projects/hipblaslt/library/src/amd_detail/rocblaslt/src/Tensile/Logic/asm_full/gfx1201/GridBased/gfx1201_Cijk_Ailk_Bjlk_BBS_BH_Bias_SHB_HA_S_SAB_SCD_SAV_UserArgs.yaml
- {MinimumRequiredVersion: 5.0.0}
- gfx1201
- gfx1201
- [Device 73f0]
    SolutionIndex: 0
    SolutionNameMin: Cijk_Ailk_Bjlk_BBS_BH_Bias_HAS_SAV_UserArgs_MT64x32x32_MI16x16x1_SN_CLR1_GSU1_LBSPPA1024_LBSPPB512_MIWT2_1_PGR1_PLR1_SS0_SU32_SUM1_SUS256_SVW8_WG32_4_1_WGM8
    SolutionIndex: 1
    SolutionNameMin: Cijk_Ailk_Bjlk_BBS_BH_Bias_HAS_SAV_UserArgs_MT64x32x32_MI16x16x1_SN_CLR1_GSU1_LBSPPA1024_LBSPPB512_MIWT2_1_PGR2_PLR1_SS0_SU32_SUM1_SUS256_SVW8_WG32_4_1_WGM8
    SolutionIndex: 2
    SolutionNameMin: Cijk_Ailk_Bjlk_BBS_BH_Bias_HAS_SAV_UserArgs_MT64x32x32_MI16x16x1_SN_CLR0_GSU1_LBSPPA1024_LBSPPB512_MIWT2_1_PGR1_PLR0_SS0_SU32_SUM1_SUS256_SVW8_WG32_4_1_WGM8
    SolutionIndex: 3
    SolutionNameMin: Cijk_Ailk_Bjlk_BBS_BH_Bias_HAS_SAV_UserArgs_MT64x32x32_MI16x16x1_SN_CLR0_GSU1_LBSPPA1024_LBSPPB512_MIWT2_1_PGR2_PLR0_SS0_SU32_SUM1_SUS256_SVW8_WG32_4_1_WGM8
    SolutionIndex: 4
    SolutionNameMin: Cijk_Ailk_Bjlk_BBS_BH_Bias_HAS_SAV_UserArgs_MT32x64x32_MI16x16x1_SN_CLR1_GSU1_LBSPPA512_LBSPPB1024_MIWT2_1_PGR1_PLR1_SS0_SU32_SUM1_SUS256_SVW8_WG16_8_1_WGM8
    SolutionIndex: 5
    SolutionNameMin: Cijk_Ailk_Bjlk_BBS_BH_Bias_HAS_SAV_UserArgs_MT32x64x32_MI16x16x1_SN_CLR1_GSU1_LBSPPA512_LBSPPB1024_MIWT2_1_PGR2_PLR1_SS0_SU32_SUM1_SUS256_SVW8_WG16_8_1_WGM8
    SolutionIndex: 6
    SolutionNameMin: Cijk_Ailk_Bjlk_BBS_BH_Bias_HAS_SAV_UserArgs_MT32x64x32_MI16x16x1_SN_CLR0_GSU1_LBSPPA512_LBSPPB1024_MIWT2_1_PGR1_PLR0_SS0_SU32_SUM1_SUS256_SVW8_WG16_8_1_WGM8
    SolutionIndex: 7
    SolutionNameMin: Cijk_Ailk_Bjlk_BBS_BH_Bias_HAS_SAV_UserArgs_MT32x64x32_MI16x16x1_SN_CLR0_GSU1_LBSPPA512_LBSPPB1024_MIWT2_1_PGR2_PLR0_SS0_SU32_SUM1_SUS256_SVW8_WG16_8_1_WGM8
    SolutionIndex: 8
    SolutionNameMin: Cijk_Ailk_Bjlk_BBS_BH_Bias_HAS_SAV_UserArgs_MT32x32x64_MI16x16x1_SN_CLR1_GSU1_LBSPPA512_LBSPPB512_MIWT1_1_PGR1_PLR1_SS0_SU32_SUM1_SUS256_SVW8_WG32_4_1_WGM8
    SolutionIndex: 9
    SolutionNameMin: Cijk_Ailk_Bjlk_BBS_BH_Bias_HAS_SAV_UserArgs_MT64x32x64_MI16x16x1_SN_CLR1_GSU1_LBSPPA1024_LBSPPB512_MIWT2_1_PGR1_PLR3_SS0_SU32_SUM1_SUS256_SVW8_WG32_4_1_WGM8
    SolutionIndex: 10
    SolutionNameMin: Cijk_Ailk_Bjlk_BBS_BH_Bias_HAS_SAV_UserArgs_MT64x16x32_MI16x16x1_SN_CLR1_GSU1_LBSPPA1024_LBSPPB256_MIWT1_1_PGR2_PLR1_SS1_SU32_SUM1_SUS256_SVW1_WG64_2_1_WGM8
    SolutionIndex: 11
    SolutionNameMin: Cijk_Ailk_Bjlk_BBS_BH_Bias_HAS_SAV_UserArgs_MT64x16x32_MI16x16x1_SN_CLR0_GSU1_LBSPPA1024_LBSPPB256_MIWT1_1_PGR2_PLR0_SS1_SU32_SUM1_SUS256_SVW1_WG64_2_1_WGM8
    SolutionIndex: 12
    SolutionNameMin: Cijk_Ailk_Bjlk_BBS_BH_Bias_HAS_SAV_UserArgs_MT32x32x32_MI16x16x1_SN_CLR0_GSU1_LBSPPA512_LBSPPB512_MIWT1_1_PGR2_PLR0_SS1_SU32_SUM1_SUS256_SVW1_WG32_4_1_WGM8
    SolutionIndex: 13
    SolutionNameMin: Cijk_Ailk_Bjlk_BBS_BH_Bias_HAS_SAV_UserArgs_MT64x32x32_MI16x16x1_SN_CLR1_GSU1_LBSPPA1024_LBSPPB512_MIWT2_1_PGR1_PLR1_SS1_SU32_SUM1_SUS256_SVW1_WG32_4_1_WGM8
    SolutionIndex: 14
    SolutionNameMin: Cijk_Ailk_Bjlk_BBS_BH_Bias_HAS_SAV_UserArgs_MT64x32x32_MI16x16x1_SN_CLR1_GSU1_LBSPPA1024_LBSPPB512_MIWT2_1_PGR2_PLR1_SS1_SU32_SUM1_SUS256_SVW1_WG32_4_1_WGM8
    SolutionIndex: 15
    SolutionNameMin: Cijk_Ailk_Bjlk_BBS_BH_Bias_HAS_SAV_UserArgs_MT32x64x32_MI16x16x1_SN_CLR1_GSU1_LBSPPA512_LBSPPB1024_MIWT2_1_PGR1_PLR1_SS1_SU32_SUM1_SUS256_SVW1_WG16_8_1_WGM8
    SolutionIndex: 16
    SolutionNameMin: Cijk_Ailk_Bjlk_BBS_BH_Bias_HAS_SAV_UserArgs_MT32x64x32_MI16x16x1_SN_CLR0_GSU1_LBSPPA512_LBSPPB1024_MIWT2_1_PGR1_PLR0_SS1_SU32_SUM1_SUS256_SVW1_WG16_8_1_WGM8
    SolutionIndex: 17
    SolutionNameMin: Cijk_Ailk_Bjlk_BBS_BH_Bias_HAS_SAV_UserArgs_MT64x32x64_MI16x16x1_SN_CLR1_GSU1_LBSPPA1024_LBSPPB512_MIWT2_1_PGR1_PLR1_SS1_SU32_SUM1_SUS256_SVW1_WG32_4_1_WGM8
    SolutionIndex: 114
    SolutionNameMin: Cijk_Ailk_Bjlk_BBS_BH_Bias_SHB_HA_S_SAB_SCD_SAV_UserArgs_MT32x16x64_MI16x16x1_SN_LDSB0_AFC1_AFEM1_AFEM1_ASEM1_CLR1_CADS0_DTLA0_DTLB0_DTVA1_DTVB1_EPS0_FDSI0_GRPM1_GRVWA8_GRVWB8_GSU1_GSUAMB_GSUC0_GSUWGMRR0_GLS0_ISA1201_IU1_K1_LBSPPA0_LBSPPB0_LBSPPM0_LPA0_LPB0_LPM0_LRVW8_LWPMn1_MIAV1_MIWT1_1_MO40_NTn1_NTA0_NTB0_NTC0_NTD0_NTM0_NEPBS0_NLCA1_NLCB1_ONLL0_PGR1_PLR0_PKA0_SIA3_SS0_SU32_SUM1_SUS256_SPO0_SRVW0_SSO0_SVW8_SK0_SKXCCM0_TLDS0_ULSGRO0_USL1_UIOFGRO0_USFGROn1_VSn1_VWA1_VWB1_WSGRA0_WSGRB0_WS32_WG32_2_1_WGM8_WGMXCC1_WGMXCCGn1
    SolutionIndex: 115
    SolutionNameMin: Cijk_Ailk_Bjlk_BBS_BH_Bias_SHB_HA_S_SAB_SCD_SAV_UserArgs_MT32x32x64_MI16x16x1_SN_LDSB1_AFC1_AFEM1_AFEM1_ASEM1_CLR1_CADS0_DTLA0_DTLB0_DTVA0_DTVB0_EPS1_FDSI0_GRPM1_GRVWA4_GRVWB4_GSU1_GSUAMB_GSUC0_GSUWGMRR0_GLS0_ISA1201_IU4_K1_LBSPPA512_LBSPPB512_LBSPPM0_LPA16_LPB16_LPM0_LRVW8_LWPMn1_MIAV1_MIWT1_1_MO40_NTn1_NTA0_NTB0_NTC0_NTD0_NTM0_NEPBS0_NLCA1_NLCB1_ONLL0_PGR1_PLR1_PKA0_SIA2_SS0_SU32_SUM1_SUS256_SPO0_SRVW0_SSO0_SVW8_SK0_SKXCCM0_TLDS0_ULSGRO0_USL1_UIOFGRO0_USFGROn1_VSn1_VWA1_VWB1_WSGRA0_WSGRB0_WS32_WG32_4_1_WGM8_WGMXCC1_WGMXCCGn1
    SolutionIndex: 116
    SolutionNameMin: Cijk_Ailk_Bjlk_BBS_BH_Bias_SHB_HA_S_SAB_SCD_SAV_UserArgs_MT16x32x32_MI16x16x1_SN_LDSB1_AFC1_AFEM1_AFEM1_ASEM1_CLR1_CADS0_DTLA0_DTLB0_DTVA0_DTVB0_EPS0_FDSI0_GRPM1_GRVWA1_GRVWB1_GSU1_GSUAMB_GSUC0_GSUWGMRR0_GLS0_ISA1201_IU2_K1_LBSPPA256_LBSPPB512_LBSPPM0_LPA16_LPB16_LPM0_LRVW8_LWPMn1_MIAV1_MIWT1_1_MO40_NTn1_NTA0_NTB0_NTC0_NTD0_NTM0_NEPBS0_NLCA1_NLCB1_ONLL0_PGR2_PLR1_PKA0_SIA2_SS0_SU32_SUM1_SUS256_SPO0_SRVW0_SSO0_SVW8_SK0_SKXCCM0_TLDS0_ULSGRO0_USL1_UIOFGRO0_USFGROn1_VSn1_VWA1_VWB1_WSGRA0_WSGRB0_WS32_WG16_4_1_WGM8_WGMXCC1_WGMXCCGn1
    SolutionIndex: 117
    SolutionNameMin: Cijk_Ailk_Bjlk_BBS_BH_Bias_SHB_HA_S_SAB_SCD_SAV_UserArgs_MT32x16x64_MI16x16x1_SN_LDSB0_AFC1_AFEM1_AFEM1_ASEM1_CLR1_CADS0_DTLA0_DTLB0_DTVA0_DTVB1_EPS1_FDSI0_GRPM1_GRVWA8_GRVWB8_GSU1_GSUAMB_GSUC0_GSUWGMRR0_GLS0_ISA1201_IU1_K1_LBSPPA512_LBSPPB0_LBSPPM0_LPA16_LPB0_LPM0_LRVW8_LWPMn1_MIAV1_MIWT1_1_MO40_NTn1_NTA0_NTB0_NTC0_NTD0_NTM0_NEPBS0_NLCA1_NLCB1_ONLL0_PGR1_PLR1_PKA0_SIA3_SS1_SU32_SUM1_SUS256_SPO0_SRVW0_SSO0_SVW1_SK0_SKXCCM0_TLDS0_ULSGRO0_USL1_UIOFGRO0_USFGROn1_VSn1_VWA1_VWB1_WSGRA0_WSGRB0_WS32_WG32_2_1_WGM8_WGMXCC1_WGMXCCGn1
    SolutionIndex: 118
    SolutionNameMin: Cijk_Ailk_Bjlk_BBS_BH_Bias_SHB_HA_S_SAB_SCD_SAV_UserArgs_MT32x32x64_MI16x16x1_SN_LDSB0_AFC1_AFEM1_AFEM1_ASEM1_CLR1_CADS0_DTLA0_DTLB0_DTVA0_DTVB0_EPS0_FDSI0_GRPM1_GRVWA8_GRVWB4_GSU1_GSUAMB_GSUC0_GSUWGMRR0_GLS0_ISA1201_IU1_K1_LBSPPA512_LBSPPB512_LBSPPM0_LPA16_LPB16_LPM0_LRVW8_LWPMn1_MIAV1_MIWT1_1_MO40_NTn1_NTA0_NTB0_NTC0_NTD0_NTM0_NEPBS0_NLCA1_NLCB1_ONLL0_PGR2_PLR1_PKA0_SIA3_SS0_SU32_SUM1_SUS256_SPO0_SRVW0_SSO0_SVW8_SK0_SKXCCM0_TLDS0_ULSGRO1_USL1_UIOFGRO0_USFGROn1_VSn1_VWA1_VWB1_WSGRA0_WSGRB0_WS32_WG32_4_1_WGM8_WGMXCC1_WGMXCCGn1
    SolutionIndex: 119
    SolutionNameMin: Cijk_Ailk_Bjlk_BBS_BH_Bias_SHB_HA_S_SAB_SCD_SAV_UserArgs_MT32x32x64_MI16x16x1_SN_LDSB0_AFC1_AFEM1_AFEM1_ASEM1_CLR1_CADS0_DTLA0_DTLB0_DTVA0_DTVB1_EPS0_FDSI0_GRPM1_GRVWA4_GRVWB8_GSU1_GSUAMB_GSUC0_GSUWGMRR0_GLS0_ISA1201_IU1_K1_LBSPPA512_LBSPPB0_LBSPPM0_LPA16_LPB0_LPM0_LRVW8_LWPMn1_MIAV1_MIWT1_1_MO40_NTn1_NTA0_NTB0_NTC0_NTD0_NTM0_NEPBS0_NLCA1_NLCB1_ONLL0_PGR2_PLR1_PKA0_SIA3_SS0_SU32_SUM1_SUS256_SPO0_SRVW0_SSO0_SVW8_SK0_SKXCCM0_TLDS0_ULSGRO0_USL1_UIOFGRO0_USFGROn1_VSn1_VWA1_VWB1_WSGRA0_WSGRB0_WS32_WG32_4_1_WGM8_WGMXCC1_WGMXCCGn1
    SolutionIndex: 120
    SolutionNameMin: Cijk_Ailk_Bjlk_BBS_BH_Bias_SHB_HA_S_SAB_SCD_SAV_UserArgs_MT32x32x64_MI16x16x1_SN_LDSB0_AFC1_AFEM1_AFEM1_ASEM1_CLR1_CADS0_DTLA0_DTLB0_DTVA1_DTVB0_EPS0_FDSI0_GRPM1_GRVWA8_GRVWB4_GSU1_GSUAMB_GSUC0_GSUWGMRR0_GLS0_ISA1201_IU1_K1_LBSPPA0_LBSPPB512_LBSPPM0_LPA0_LPB16_LPM0_LRVW8_LWPMn1_MIAV1_MIWT1_1_MO40_NTn1_NTA0_NTB0_NTC0_NTD0_NTM0_NEPBS0_NLCA1_NLCB1_ONLL0_PGR2_PLR1_PKA0_SIA3_SS0_SU32_SUM1_SUS256_SPO0_SRVW0_SSO0_SVW8_SK0_SKXCCM0_TLDS0_ULSGRO0_USL1_UIOFGRO0_USFGROn1_VSn1_VWA1_VWB1_WSGRA0_WSGRB0_WS32_WG32_4_1_WGM8_WGMXCC1_WGMXCCGn1
    SolutionIndex: 121
    SolutionNameMin: Cijk_Ailk_Bjlk_BBS_BH_Bias_SHB_HA_S_SAB_SCD_SAV_UserArgs_MT16x32x32_MI16x16x1_SN_LDSB1_AFC1_AFEM1_AFEM1_ASEM1_CLR1_CADS0_DTLA0_DTLB0_DTVA0_DTVB0_EPS1_FDSI0_GRPM1_GRVWA1_GRVWB1_GSU1_GSUAMB_GSUC0_GSUWGMRR0_GLS0_ISA1201_IU2_K1_LBSPPA256_LBSPPB512_LBSPPM0_LPA16_LPB16_LPM0_LRVW8_LWPMn1_MIAV1_MIWT1_1_MO40_NTn1_NTA0_NTB0_NTC0_NTD0_NTM0_NEPBS0_NLCA1_NLCB1_ONLL0_PGR1_PLR1_PKA0_SIA2_SS0_SU32_SUM1_SUS256_SPO0_SRVW0_SSO0_SVW8_SK0_SKXCCM0_TLDS0_ULSGRO0_USL1_UIOFGRO0_USFGROn1_VSn1_VWA1_VWB1_WSGRA0_WSGRB0_WS32_WG16_4_1_WGM8_WGMXCC1_WGMXCCGn1
    SolutionIndex: 122
    SolutionNameMin: Cijk_Ailk_Bjlk_BBS_BH_Bias_SHB_HA_S_SAB_SCD_SAV_UserArgs_MT32x32x32_MI16x16x1_SN_LDSB1_AFC1_AFEM1_AFEM1_ASEM1_CLR1_CADS0_DTLA0_DTLB0_DTVA0_DTVB0_EPS0_FDSI0_GRPM1_GRVWA1_GRVWB1_GSU1_GSUAMB_GSUC0_GSUWGMRR0_GLS0_ISA1201_IU2_K1_LBSPPA512_LBSPPB512_LBSPPM0_LPA16_LPB16_LPM0_LRVW8_LWPMn1_MIAV1_MIWT1_1_MO40_NTn1_NTA0_NTB0_NTC0_NTD0_NTM0_NEPBS0_NLCA1_NLCB1_ONLL0_PGR2_PLR1_PKA0_SIA2_SS0_SU32_SUM1_SUS256_SPO0_SRVW0_SSO0_SVW8_SK0_SKXCCM0_TLDS0_ULSGRO1_USL1_UIOFGRO0_USFGROn1_VSn1_VWA1_VWB1_WSGRA0_WSGRB0_WS32_WG32_4_1_WGM8_WGMXCC1_WGMXCCGn1
    SolutionIndex: 123
    SolutionNameMin: Cijk_Ailk_Bjlk_BBS_BH_Bias_SHB_HA_S_SAB_SCD_SAV_UserArgs_MT32x32x64_MI16x16x1_SN_LDSB0_AFC1_AFEM1_AFEM1_ASEM1_CLR1_CADS0_DTLA0_DTLB0_DTVA0_DTVB0_EPS1_FDSI0_GRPM1_GRVWA1_GRVWB1_GSU1_GSUAMB_GSUC0_GSUWGMRR0_GLS0_ISA1201_IU1_K1_LBSPPA512_LBSPPB512_LBSPPM0_LPA16_LPB16_LPM0_LRVW8_LWPMn1_MIAV1_MIWT1_1_MO40_NTn1_NTA0_NTB0_NTC0_NTD0_NTM0_NEPBS0_NLCA1_NLCB1_ONLL0_PGR1_PLR1_PKA0_SIA3_SS0_SU32_SUM1_SUS256_SPO0_SRVW0_SSO0_SVW8_SK0_SKXCCM0_TLDS0_ULSGRO0_USL1_UIOFGRO0_USFGROn1_VSn1_VWA1_VWB1_WSGRA0_WSGRB0_WS32_WG32_4_1_WGM8_WGMXCC1_WGMXCCGn1
    SolutionIndex: 124
    SolutionNameMin: Cijk_Ailk_Bjlk_BBS_BH_Bias_SHB_HA_S_SAB_SCD_SAV_UserArgs_MT32x32x64_MI16x16x1_SN_LDSB1_AFC1_AFEM1_AFEM1_ASEM1_CLR1_CADS0_DTLA0_DTLB0_DTVA0_DTVB0_EPS1_FDSI0_GRPM1_GRVWA1_GRVWB1_GSU1_GSUAMB_GSUC0_GSUWGMRR0_GLS0_ISA1201_IU4_K1_LBSPPA512_LBSPPB512_LBSPPM0_LPA16_LPB16_LPM0_LRVW8_LWPMn1_MIAV1_MIWT1_1_MO40_NTn1_NTA0_NTB0_NTC0_NTD0_NTM0_NEPBS0_NLCA1_NLCB1_ONLL0_PGR1_PLR1_PKA0_SIA2_SS0_SU32_SUM1_SUS256_SPO0_SRVW0_SSO0_SVW8_SK0_SKXCCM0_TLDS0_ULSGRO0_USL1_UIOFGRO0_USFGROn1_VSn1_VWA1_VWB1_WSGRA0_WSGRB0_WS32_WG32_4_1_WGM8_WGMXCC1_WGMXCCGn1
    SolutionIndex: 125
    SolutionNameMin: Cijk_Ailk_Bjlk_BBS_BH_Bias_SHB_HA_S_SAB_SCD_SAV_UserArgs_MT32x32x32_MI16x16x1_SN_LDSB1_AFC1_AFEM1_AFEM1_ASEM1_CLR1_CADS0_DTLA0_DTLB0_DTVA0_DTVB0_EPS0_FDSI0_GRPM1_GRVWA1_GRVWB1_GSU1_GSUAMB_GSUC0_GSUWGMRR0_GLS0_ISA1201_IU2_K1_LBSPPA512_LBSPPB512_LBSPPM0_LPA16_LPB16_LPM0_LRVW8_LWPMn1_MIAV1_MIWT1_1_MO40_NTn1_NTA0_NTB0_NTC0_NTD0_NTM0_NEPBS0_NLCA1_NLCB1_ONLL0_PGR2_PLR1_PKA0_SIA2_SS0_SU32_SUM1_SUS256_SPO0_SRVW0_SSO0_SVW8_SK0_SKXCCM0_TLDS0_ULSGRO0_USL1_UIOFGRO0_USFGROn1_VSn1_VWA1_VWB1_WSGRA0_WSGRB0_WS32_WG32_4_1_WGM8_WGMXCC1_WGMXCCGn1
    SolutionIndex: 126
    SolutionNameMin: Cijk_Ailk_Bjlk_BBS_BH_Bias_SHB_HA_S_SAB_SCD_SAV_UserArgs_MT32x32x32_MI16x16x1_SN_LDSB0_AFC1_AFEM1_AFEM1_ASEM1_CLR1_CADS0_DTLA0_DTLB0_DTVA0_DTVB0_EPS0_FDSI0_GRPM1_GRVWA4_GRVWB1_GSU1_GSUAMB_GSUC0_GSUWGMRR0_GLS0_ISA1201_IU1_K1_LBSPPA512_LBSPPB512_LBSPPM0_LPA16_LPB16_LPM0_LRVW8_LWPMn1_MIAV1_MIWT1_1_MO40_NTn1_NTA0_NTB0_NTC0_NTD0_NTM0_NEPBS0_NLCA1_NLCB1_ONLL0_PGR2_PLR1_PKA0_SIA3_SS0_SU32_SUM1_SUS256_SPO0_SRVW0_SSO0_SVW8_SK0_SKXCCM0_TLDS0_ULSGRO0_USL1_UIOFGRO0_USFGROn1_VSn1_VWA1_VWB1_WSGRA0_WSGRB0_WS32_WG32_4_1_WGM8_WGMXCC1_WGMXCCGn1
    SolutionIndex: 127
    SolutionNameMin: Cijk_Ailk_Bjlk_BBS_BH_Bias_SHB_HA_S_SAB_SCD_SAV_UserArgs_MT32x32x64_MI16x16x1_SN_LDSB1_AFC1_AFEM1_AFEM1_ASEM1_CLR1_CADS0_DTLA0_DTLB0_DTVA0_DTVB0_EPS0_FDSI0_GRPM1_GRVWA1_GRVWB1_GSU1_GSUAMB_GSUC0_GSUWGMRR0_GLS0_ISA1201_IU4_K1_LBSPPA512_LBSPPB512_LBSPPM0_LPA16_LPB16_LPM0_LRVW8_LWPMn1_MIAV1_MIWT1_1_MO40_NTn1_NTA0_NTB0_NTC0_NTD0_NTM0_NEPBS0_NLCA1_NLCB1_ONLL0_PGR2_PLR1_PKA0_SIA2_SS0_SU32_SUM1_SUS256_SPO0_SRVW0_SSO0_SVW8_SK0_SKXCCM0_TLDS0_ULSGRO1_USL1_UIOFGRO0_USFGROn1_VSn1_VWA1_VWB1_WSGRA0_WSGRB0_WS32_WG32_4_1_WGM8_WGMXCC1_WGMXCCGn1
    SolutionIndex: 128
    SolutionNameMin: Cijk_Ailk_Bjlk_BBS_BH_Bias_SHB_HA_S_SAB_SCD_SAV_UserArgs_MT32x32x32_MI16x16x1_SN_LDSB0_AFC1_AFEM1_AFEM1_ASEM1_CLR1_CADS0_DTLA0_DTLB0_DTVA0_DTVB0_EPS0_FDSI0_GRPM1_GRVWA4_GRVWB4_GSU1_GSUAMB_GSUC0_GSUWGMRR0_GLS0_ISA1201_IU1_K1_LBSPPA512_LBSPPB512_LBSPPM0_LPA16_LPB16_LPM0_LRVW8_LWPMn1_MIAV1_MIWT1_1_MO40_NTn1_NTA0_NTB0_NTC0_NTD0_NTM0_NEPBS0_NLCA1_NLCB1_ONLL0_PGR2_PLR1_PKA0_SIA3_SS0_SU32_SUM1_SUS256_SPO0_SRVW0_SSO0_SVW8_SK0_SKXCCM0_TLDS0_ULSGRO0_USL1_UIOFGRO0_USFGROn1_VSn1_VWA1_VWB1_WSGRA0_WSGRB0_WS32_WG32_4_1_WGM8_WGMXCC1_WGMXCCGn1
    SolutionIndex: 129
    SolutionNameMin: Cijk_Ailk_Bjlk_BBS_BH_Bias_SHB_HA_S_SAB_SCD_SAV_UserArgs_MT32x32x64_MI16x16x1_SN_LDSB0_AFC1_AFEM1_AFEM1_ASEM1_CLR1_CADS0_DTLA0_DTLB0_DTVA0_DTVB0_EPS0_FDSI0_GRPM1_GRVWA4_GRVWB8_GSU1_GSUAMB_GSUC0_GSUWGMRR0_GLS0_ISA1201_IU1_K1_LBSPPA512_LBSPPB512_LBSPPM0_LPA16_LPB16_LPM0_LRVW8_LWPMn1_MIAV1_MIWT1_1_MO40_NTn1_NTA0_NTB0_NTC0_NTD0_NTM0_NEPBS0_NLCA1_NLCB1_ONLL0_PGR2_PLR1_PKA0_SIA3_SS0_SU32_SUM1_SUS256_SPO0_SRVW0_SSO0_SVW8_SK0_SKXCCM0_TLDS0_ULSGRO1_USL1_UIOFGRO0_USFGROn1_VSn1_VWA1_VWB1_WSGRA0_WSGRB0_WS32_WG32_4_1_WGM8_WGMXCC1_WGMXCCGn1
    SolutionIndex: 130
    SolutionNameMin: Cijk_Ailk_Bjlk_BBS_BH_Bias_SHB_HA_S_SAB_SCD_SAV_UserArgs_MT32x32x32_MI16x16x1_SN_LDSB0_AFC1_AFEM1_AFEM1_ASEM1_CLR1_CADS0_DTLA0_DTLB0_DTVA0_DTVB0_EPS0_FDSI0_GRPM1_GRVWA1_GRVWB1_GSU1_GSUAMB_GSUC0_GSUWGMRR0_GLS0_ISA1201_IU1_K1_LBSPPA512_LBSPPB512_LBSPPM0_LPA16_LPB16_LPM0_LRVW8_LWPMn1_MIAV1_MIWT1_1_MO40_NTn1_NTA0_NTB0_NTC0_NTD0_NTM0_NEPBS0_NLCA1_NLCB1_ONLL0_PGR2_PLR1_PKA0_SIA3_SS0_SU32_SUM1_SUS256_SPO0_SRVW0_SSO0_SVW8_SK0_SKXCCM0_TLDS0_ULSGRO1_USL1_UIOFGRO0_USFGROn1_VSn1_VWA1_VWB1_WSGRA0_WSGRB0_WS32_WG32_4_1_WGM8_WGMXCC1_WGMXCCGn1
    SolutionIndex: 131
    SolutionNameMin: Cijk_Ailk_Bjlk_BBS_BH_Bias_SHB_HA_S_SAB_SCD_SAV_UserArgs_MT32x32x64_MI16x16x1_SN_LDSB0_AFC1_AFEM1_AFEM1_ASEM1_CLR1_CADS0_DTLA0_DTLB0_DTVA0_DTVB0_EPS0_FDSI0_GRPM1_GRVWA1_GRVWB1_GSU1_GSUAMB_GSUC0_GSUWGMRR0_GLS0_ISA1201_IU1_K1_LBSPPA512_LBSPPB512_LBSPPM0_LPA16_LPB16_LPM0_LRVW8_LWPMn1_MIAV1_MIWT1_1_MO40_NTn1_NTA0_NTB0_NTC0_NTD0_NTM0_NEPBS0_NLCA1_NLCB1_ONLL0_PGR2_PLR1_PKA0_SIA3_SS0_SU32_SUM1_SUS256_SPO0_SRVW0_SSO0_SVW8_SK0_SKXCCM0_TLDS0_ULSGRO0_USL1_UIOFGRO0_USFGROn1_VSn1_VWA1_VWB1_WSGRA0_WSGRB0_WS32_WG32_4_1_WGM8_WGMXCC1_WGMXCCGn1
    SolutionIndex: 132
    SolutionNameMin: Cijk_Ailk_Bjlk_BBS_BH_Bias_SHB_HA_S_SAB_SCD_SAV_UserArgs_MT64x64x32_MI16x16x1_SN_LDSB1_AFC1_AFEM1_AFEM1_ASEM1_CLR1_CADS0_DTLA0_DTLB0_DTVA0_DTVB0_EPS1_FDSI0_GRPM1_GRVWA1_GRVWB1_GSU1_GSUAMB_GSUC0_GSUWGMRR0_GLS0_ISA1201_IU2_K1_LBSPPA1024_LBSPPB1024_LBSPPM0_LPA32_LPB32_LPM0_LRVW8_LWPMn1_MIAV1_MIWT2_2_MO40_NTn1_NTA0_NTB0_NTC0_NTD0_NTM0_NEPBS0_NLCA1_NLCB1_ONLL0_PGR1_PLR1_PKA0_SIA2_SS0_SU32_SUM1_SUS256_SPO0_SRVW0_SSO0_SVW8_SK0_SKXCCM0_TLDS0_ULSGRO0_USL1_UIOFGRO0_USFGROn1_VSn1_VWA2_VWB2_WSGRA0_WSGRB0_WS32_WG32_4_1_WGM8_WGMXCC1_WGMXCCGn1
    SolutionIndex: 133
    SolutionNameMin: Cijk_Ailk_Bjlk_BBS_BH_Bias_SHB_HA_S_SAB_SCD_SAV_UserArgs_MT64x64x64_MI16x16x1_SN_LDSB1_AFC1_AFEM1_AFEM1_ASEM1_CLR1_CADS0_DTLA0_DTLB0_DTVA0_DTVB0_EPS0_FDSI0_GRPM1_GRVWA8_GRVWB8_GSU1_GSUAMB_GSUC0_GSUWGMRR0_GLS0_ISA1201_IU4_K1_LBSPPA1024_LBSPPB1024_LBSPPM0_LPA32_LPB32_LPM0_LRVW8_LWPMn1_MIAV1_MIWT2_2_MO40_NTn1_NTA0_NTB0_NTC0_NTD0_NTM0_NEPBS0_NLCA1_NLCB1_ONLL0_PGR2_PLR1_PKA0_SIA2_SS0_SU32_SUM1_SUS256_SPO0_SRVW0_SSO0_SVW8_SK0_SKXCCM0_TLDS0_ULSGRO1_USL1_UIOFGRO0_USFGROn1_VSn1_VWA2_VWB2_WSGRA0_WSGRB0_WS32_WG32_4_1_WGM8_WGMXCC1_WGMXCCGn1
    SolutionIndex: 134
    SolutionNameMin: Cijk_Ailk_Bjlk_BBS_BH_Bias_SHB_HA_S_SAB_SCD_SAV_UserArgs_MT32x32x64_MI16x16x1_SN_LDSB0_AFC1_AFEM1_AFEM1_ASEM1_CLR1_CADS0_DTLA0_DTLB0_DTVA0_DTVB0_EPS0_FDSI0_GRPM1_GRVWA1_GRVWB1_GSU1_GSUAMB_GSUC0_GSUWGMRR0_GLS0_ISA1201_IU1_K1_LBSPPA512_LBSPPB512_LBSPPM0_LPA16_LPB16_LPM0_LRVW8_LWPMn1_MIAV1_MIWT1_1_MO40_NTn1_NTA0_NTB0_NTC0_NTD0_NTM0_NEPBS0_NLCA1_NLCB1_ONLL0_PGR2_PLR1_PKA0_SIA3_SS0_SU32_SUM1_SUS256_SPO0_SRVW0_SSO0_SVW8_SK0_SKXCCM0_TLDS0_ULSGRO1_USL1_UIOFGRO0_USFGROn1_VSn1_VWA1_VWB1_WSGRA0_WSGRB0_WS32_WG32_4_1_WGM8_WGMXCC1_WGMXCCGn1
    SolutionIndex: 135
    SolutionNameMin: Cijk_Ailk_Bjlk_BBS_BH_Bias_SHB_HA_S_SAB_SCD_SAV_UserArgs_MT64x64x64_MI16x16x1_SN_LDSB0_AFC1_AFEM1_AFEM1_ASEM1_CLR1_CADS0_DTLA0_DTLB0_DTVA0_DTVB1_EPS0_FDSI0_GRPM1_GRVWA4_GRVWB8_GSU1_GSUAMB_GSUC0_GSUWGMRR0_GLS0_ISA1201_IU1_K1_LBSPPA1024_LBSPPB0_LBSPPM0_LPA32_LPB0_LPM0_LRVW8_LWPMn1_MIAV1_MIWT2_2_MO40_NTn1_NTA0_NTB0_NTC0_NTD0_NTM0_NEPBS0_NLCA1_NLCB4_ONLL0_PGR2_PLR1_PKA0_SIA3_SS0_SU32_SUM1_SUS256_SPO0_SRVW0_SSO0_SVW8_SK0_SKXCCM0_TLDS0_ULSGRO0_USL1_UIOFGRO0_USFGROn1_VSn1_VWA2_VWB1_WSGRA0_WSGRB0_WS32_WG32_4_1_WGM8_WGMXCC1_WGMXCCGn1
    SolutionIndex: 136
    SolutionNameMin: Cijk_Ailk_Bjlk_BBS_BH_Bias_SHB_HA_S_SAB_SCD_SAV_UserArgs_MT64x64x64_MI16x16x1_SN_LDSB0_AFC1_AFEM1_AFEM1_ASEM1_CLR1_CADS0_DTLA0_DTLB0_DTVA1_DTVB0_EPS0_FDSI0_GRPM1_GRVWA8_GRVWB8_GSU1_GSUAMB_GSUC0_GSUWGMRR0_GLS0_ISA1201_IU1_K1_LBSPPA0_LBSPPB1024_LBSPPM0_LPA0_LPB32_LPM0_LRVW8_LWPMn1_MIAV1_MIWT2_2_MO40_NTn1_NTA0_NTB0_NTC0_NTD0_NTM0_NEPBS0_NLCA4_NLCB1_ONLL0_PGR2_PLR1_PKA0_SIA3_SS0_SU32_SUM1_SUS256_SPO0_SRVW0_SSO0_SVW8_SK0_SKXCCM0_TLDS0_ULSGRO0_USL1_UIOFGRO0_USFGROn1_VSn1_VWA1_VWB2_WSGRA0_WSGRB0_WS32_WG32_4_1_WGM8_WGMXCC1_WGMXCCGn1
    SolutionIndex: 137
    SolutionNameMin: Cijk_Ailk_Bjlk_BBS_BH_Bias_SHB_HA_S_SAB_SCD_SAV_UserArgs_MT32x16x32_MI16x16x1_SN_LDSB1_AFC1_AFEM1_AFEM1_ASEM1_CLR1_CADS0_DTLA0_DTLB0_DTVA0_DTVB0_EPS0_FDSI0_GRPM1_GRVWA1_GRVWB1_GSU1_GSUAMB_GSUC0_GSUWGMRR0_GLS0_ISA1201_IU2_K1_LBSPPA512_LBSPPB256_LBSPPM0_LPA16_LPB16_LPM0_LRVW8_LWPMn1_MIAV1_MIWT1_1_MO40_NTn1_NTA0_NTB0_NTC0_NTD0_NTM0_NEPBS0_NLCA1_NLCB1_ONLL0_PGR2_PLR1_PKA0_SIA2_SS0_SU32_SUM1_SUS256_SPO0_SRVW0_SSO0_SVW8_SK0_SKXCCM0_TLDS0_ULSGRO1_USL1_UIOFGRO0_USFGROn1_VSn1_VWA1_VWB1_WSGRA0_WSGRB0_WS32_WG32_2_1_WGM8_WGMXCC1_WGMXCCGn1
    SolutionIndex: 138
    SolutionNameMin: Cijk_Ailk_Bjlk_BBS_BH_Bias_SHB_HA_S_SAB_SCD_SAV_UserArgs_MT32x16x32_MI16x16x1_SN_LDSB0_AFC1_AFEM1_AFEM1_ASEM1_CLR1_CADS0_DTLA0_DTLB0_DTVA0_DTVB0_EPS0_FDSI0_GRPM1_GRVWA1_GRVWB1_GSU1_GSUAMB_GSUC0_GSUWGMRR0_GLS0_ISA1201_IU1_K1_LBSPPA512_LBSPPB256_LBSPPM0_LPA16_LPB16_LPM0_LRVW8_LWPMn1_MIAV1_MIWT1_1_MO40_NTn1_NTA0_NTB0_NTC0_NTD0_NTM0_NEPBS0_NLCA1_NLCB1_ONLL0_PGR2_PLR1_PKA0_SIA3_SS0_SU32_SUM1_SUS256_SPO0_SRVW0_SSO0_SVW8_SK0_SKXCCM0_TLDS0_ULSGRO1_USL1_UIOFGRO0_USFGROn1_VSn1_VWA1_VWB1_WSGRA0_WSGRB0_WS32_WG32_2_1_WGM8_WGMXCC1_WGMXCCGn1
    SolutionIndex: 139
    SolutionNameMin: Cijk_Ailk_Bjlk_BBS_BH_Bias_SHB_HA_S_SAB_SCD_SAV_UserArgs_MT64x64x32_MI16x16x1_SN_LDSB1_AFC1_AFEM1_AFEM1_ASEM1_CLR1_CADS0_DTLA0_DTLB0_DTVA0_DTVB0_EPS0_FDSI0_GRPM1_GRVWA4_GRVWB8_GSU1_GSUAMB_GSUC0_GSUWGMRR0_GLS0_ISA1201_IU2_K1_LBSPPA1024_LBSPPB1024_LBSPPM0_LPA32_LPB32_LPM0_LRVW8_LWPMn1_MIAV1_MIWT2_2_MO40_NTn1_NTA0_NTB0_NTC0_NTD0_NTM0_NEPBS0_NLCA1_NLCB1_ONLL0_PGR2_PLR1_PKA0_SIA2_SS0_SU32_SUM1_SUS256_SPO0_SRVW0_SSO0_SVW8_SK0_SKXCCM0_TLDS0_ULSGRO1_USL1_UIOFGRO0_USFGROn1_VSn1_VWA2_VWB2_WSGRA0_WSGRB0_WS32_WG32_4_1_WGM8_WGMXCC1_WGMXCCGn1
    SolutionIndex: 140
    SolutionNameMin: Cijk_Ailk_Bjlk_BBS_BH_Bias_SHB_HA_S_SAB_SCD_SAV_UserArgs_MT64x64x32_MI16x16x1_SN_LDSB0_AFC1_AFEM1_AFEM1_ASEM1_CLR1_CADS0_DTLA0_DTLB0_DTVA0_DTVB0_EPS0_FDSI0_GRPM1_GRVWA4_GRVWB8_GSU1_GSUAMB_GSUC0_GSUWGMRR0_GLS0_ISA1201_IU1_K1_LBSPPA1024_LBSPPB1024_LBSPPM0_LPA32_LPB32_LPM0_LRVW8_LWPMn1_MIAV1_MIWT2_2_MO40_NTn1_NTA0_NTB0_NTC0_NTD0_NTM0_NEPBS0_NLCA1_NLCB1_ONLL0_PGR2_PLR1_PKA0_SIA3_SS0_SU32_SUM1_SUS256_SPO0_SRVW0_SSO0_SVW8_SK0_SKXCCM0_TLDS0_ULSGRO1_USL1_UIOFGRO0_USFGROn1_VSn1_VWA2_VWB2_WSGRA0_WSGRB0_WS32_WG32_4_1_WGM8_WGMXCC1_WGMXCCGn1
    SolutionIndex: 141
    SolutionNameMin: Cijk_Ailk_Bjlk_BBS_BH_Bias_SHB_HA_S_SAB_SCD_SAV_UserArgs_MT64x64x32_MI16x16x1_SN_LDSB1_AFC1_AFEM1_AFEM1_ASEM1_CLR1_CADS0_DTLA0_DTLB0_DTVA0_DTVB0_EPS1_FDSI0_GRPM1_GRVWA1_GRVWB4_GSU1_GSUAMB_GSUC0_GSUWGMRR0_GLS0_ISA1201_IU2_K1_LBSPPA1024_LBSPPB1024_LBSPPM0_LPA32_LPB32_LPM0_LRVW8_LWPMn1_MIAV1_MIWT2_2_MO40_NTn1_NTA0_NTB0_NTC0_NTD0_NTM0_NEPBS0_NLCA1_NLCB1_ONLL0_PGR1_PLR1_PKA0_SIA2_SS0_SU32_SUM1_SUS256_SPO0_SRVW0_SSO0_SVW8_SK0_SKXCCM0_TLDS0_ULSGRO0_USL1_UIOFGRO0_USFGROn1_VSn1_VWA2_VWB2_WSGRA0_WSGRB0_WS32_WG32_4_1_WGM8_WGMXCC1_WGMXCCGn1
    SolutionIndex: 142
    SolutionNameMin: Cijk_Ailk_Bjlk_BBS_BH_Bias_SHB_HA_S_SAB_SCD_SAV_UserArgs_MT64x64x64_MI16x16x1_SN_LDSB1_AFC1_AFEM1_AFEM1_ASEM1_CLR1_CADS0_DTLA0_DTLB0_DTVA0_DTVB0_EPS1_FDSI0_GRPM1_GRVWA4_GRVWB8_GSU1_GSUAMB_GSUC0_GSUWGMRR0_GLS0_ISA1201_IU4_K1_LBSPPA1024_LBSPPB1024_LBSPPM0_LPA32_LPB32_LPM0_LRVW8_LWPMn1_MIAV1_MIWT2_2_MO40_NTn1_NTA0_NTB0_NTC0_NTD0_NTM0_NEPBS0_NLCA1_NLCB1_ONLL0_PGR1_PLR1_PKA0_SIA2_SS0_SU32_SUM1_SUS256_SPO0_SRVW0_SSO0_SVW8_SK0_SKXCCM0_TLDS0_ULSGRO0_USL1_UIOFGRO0_USFGROn1_VSn1_VWA2_VWB2_WSGRA0_WSGRB0_WS32_WG32_4_1_WGM8_WGMXCC1_WGMXCCGn1
    SolutionIndex: 143
    SolutionNameMin: Cijk_Ailk_Bjlk_BBS_BH_Bias_SHB_HA_S_SAB_SCD_SAV_UserArgs_MT64x64x16_MI16x16x1_SN_LDSB1_AFC1_AFEM1_AFEM1_ASEM1_CLR1_CADS0_DTLA0_DTLB0_DTVA0_DTVB0_EPS0_FDSI0_GRPM1_GRVWA4_GRVWB8_GSU1_GSUAMB_GSUC0_GSUWGMRR0_GLS0_ISA1201_IU1_K1_LBSPPA1024_LBSPPB1024_LBSPPM0_LPA32_LPB32_LPM0_LRVW8_LWPMn1_MIAV1_MIWT2_2_MO40_NTn1_NTA0_NTB0_NTC0_NTD0_NTM0_NEPBS0_NLCA1_NLCB1_ONLL0_PGR2_PLR1_PKA0_SIA2_SS0_SU32_SUM1_SUS256_SPO0_SRVW0_SSO0_SVW8_SK0_SKXCCM0_TLDS0_ULSGRO0_USL1_UIOFGRO0_USFGROn1_VSn1_VWA2_VWB2_WSGRA0_WSGRB0_WS32_WG32_4_1_WGM8_WGMXCC1_WGMXCCGn1
    SolutionIndex: 144
    SolutionNameMin: Cijk_Ailk_Bjlk_BBS_BH_Bias_SHB_HA_S_SAB_SCD_SAV_UserArgs_MT32x128x32_MI16x16x1_SN_LDSB0_AFC1_AFEM1_AFEM1_ASEM1_CLR1_CADS0_DTLA0_DTLB0_DTVA0_DTVB1_EPS0_FDSI0_GRPM1_GRVWA4_GRVWB8_GSU1_GSUAMB_GSUC0_GSUWGMRR0_GLS0_ISA1201_IU1_K1_LBSPPA512_LBSPPB0_LBSPPM0_LPA16_LPB0_LPM0_LRVW8_LWPMn1_MIAV1_MIWT1_4_MO40_NTn1_NTA0_NTB0_NTC0_NTD0_NTM0_NEPBS0_NLCA1_NLCB2_ONLL0_PGR2_PLR1_PKA0_SIA3_SS0_SU32_SUM1_SUS256_SPO0_SRVW0_SSO0_SVW8_SK0_SKXCCM0_TLDS0_ULSGRO0_USL1_UIOFGRO0_USFGROn1_VSn1_VWA1_VWB1_WSGRA0_WSGRB0_WS32_WG32_4_1_WGM8_WGMXCC1_WGMXCCGn1
    SolutionIndex: 145
    SolutionNameMin: Cijk_Ailk_Bjlk_BBS_BH_Bias_SHB_HA_S_SAB_SCD_SAV_UserArgs_MT64x64x32_MI16x16x1_SN_LDSB0_AFC1_AFEM1_AFEM1_ASEM1_CLR1_CADS0_DTLA0_DTLB0_DTVA0_DTVB0_EPS1_FDSI0_GRPM1_GRVWA8_GRVWB4_GSU1_GSUAMB_GSUC0_GSUWGMRR0_GLS0_ISA1201_IU1_K1_LBSPPA1024_LBSPPB1024_LBSPPM0_LPA32_LPB32_LPM0_LRVW8_LWPMn1_MIAV1_MIWT2_2_MO40_NTn1_NTA0_NTB0_NTC0_NTD0_NTM0_NEPBS0_NLCA1_NLCB1_ONLL0_PGR1_PLR1_PKA0_SIA3_SS0_SU32_SUM1_SUS256_SPO0_SRVW0_SSO0_SVW8_SK0_SKXCCM0_TLDS0_ULSGRO0_USL1_UIOFGRO0_USFGROn1_VSn1_VWA2_VWB2_WSGRA0_WSGRB0_WS32_WG32_4_1_WGM8_WGMXCC1_WGMXCCGn1
    SolutionIndex: 146
    SolutionNameMin: Cijk_Ailk_Bjlk_BBS_BH_Bias_SHB_HA_S_SAB_SCD_SAV_UserArgs_MT64x64x32_MI16x16x1_SN_LDSB1_AFC1_AFEM1_AFEM1_ASEM1_CLR1_CADS0_DTLA0_DTLB0_DTVA0_DTVB0_EPS0_FDSI0_GRPM1_GRVWA8_GRVWB4_GSU1_GSUAMB_GSUC0_GSUWGMRR0_GLS0_ISA1201_IU2_K1_LBSPPA1024_LBSPPB1024_LBSPPM0_LPA32_LPB32_LPM0_LRVW8_LWPMn1_MIAV1_MIWT2_2_MO40_NTn1_NTA0_NTB0_NTC0_NTD0_NTM0_NEPBS0_NLCA1_NLCB1_ONLL0_PGR2_PLR1_PKA0_SIA2_SS0_SU32_SUM1_SUS256_SPO0_SRVW0_SSO0_SVW8_SK0_SKXCCM0_TLDS0_ULSGRO0_USL1_UIOFGRO0_USFGROn1_VSn1_VWA2_VWB2_WSGRA0_WSGRB0_WS32_WG32_4_1_WGM8_WGMXCC1_WGMXCCGn1
    SolutionIndex: 147
    SolutionNameMin: Cijk_Ailk_Bjlk_BBS_BH_Bias_SHB_HA_S_SAB_SCD_SAV_UserArgs_MT64x64x16_MI16x16x1_SN_LDSB0_AFC1_AFEM1_AFEM1_ASEM1_CLR0_CADS0_DTLA0_DTLB0_DTVA0_DTVB0_EPS0_FDSI0_GRPM1_GRVWA4_GRVWB8_GSU1_GSUAMB_GSUC0_GSUWGMRR0_GLS0_ISA1201_IU1_K1_LBSPPA1024_LBSPPB1024_LBSPPM0_LPA32_LPB32_LPM0_LRVW8_LWPMn1_MIAV1_MIWT2_2_MO40_NTn1_NTA0_NTB0_NTC0_NTD0_NTM0_NEPBS0_NLCA1_NLCB1_ONLL0_PGR2_PLR0_PKA0_SIA3_SS0_SU32_SUM1_SUS256_SPO0_SRVW0_SSO0_SVW8_SK0_SKXCCM0_TLDS0_ULSGRO0_USL1_UIOFGRO0_USFGROn1_VSn1_VWA2_VWB2_WSGRA0_WSGRB0_WS32_WG32_4_1_WGM8_WGMXCC1_WGMXCCGn1
    SolutionIndex: 148
    SolutionNameMin: Cijk_Ailk_Bjlk_BBS_BH_Bias_SHB_HA_S_SAB_SCD_SAV_UserArgs_MT32x16x32_MI16x16x1_SN_LDSB1_AFC1_AFEM1_AFEM1_ASEM1_CLR1_CADS0_DTLA0_DTLB0_DTVA0_DTVB0_EPS1_FDSI0_GRPM1_GRVWA4_GRVWB8_GSU1_GSUAMB_GSUC0_GSUWGMRR0_GLS0_ISA1201_IU2_K1_LBSPPA512_LBSPPB256_LBSPPM0_LPA16_LPB16_LPM0_LRVW8_LWPMn1_MIAV1_MIWT1_1_MO40_NTn1_NTA0_NTB0_NTC0_NTD0_NTM0_NEPBS0_NLCA1_NLCB1_ONLL0_PGR1_PLR1_PKA0_SIA2_SS0_SU32_SUM1_SUS256_SPO0_SRVW0_SSO0_SVW8_SK0_SKXCCM0_TLDS0_ULSGRO0_USL1_UIOFGRO0_USFGROn1_VSn1_VWA1_VWB1_WSGRA0_WSGRB0_WS32_WG32_2_1_WGM8_WGMXCC1_WGMXCCGn1
    SolutionIndex: 149
    SolutionNameMin: Cijk_Ailk_Bjlk_BBS_BH_Bias_SHB_HA_S_SAB_SCD_SAV_UserArgs_MT32x32x32_MI16x16x1_SN_LDSB0_AFC1_AFEM1_AFEM1_ASEM1_CLR1_CADS0_DTLA0_DTLB0_DTVA0_DTVB0_EPS0_FDSI0_GRPM1_GRVWA1_GRVWB1_GSU1_GSUAMB_GSUC0_GSUWGMRR0_GLS0_ISA1201_IU1_K1_LBSPPA512_LBSPPB512_LBSPPM0_LPA16_LPB16_LPM0_LRVW8_LWPMn1_MIAV1_MIWT1_1_MO40_NTn1_NTA0_NTB0_NTC0_NTD0_NTM0_NEPBS0_NLCA1_NLCB1_ONLL0_PGR2_PLR1_PKA0_SIA3_SS0_SU32_SUM1_SUS256_SPO0_SRVW0_SSO0_SVW8_SK0_SKXCCM0_TLDS0_ULSGRO0_USL1_UIOFGRO0_USFGROn1_VSn1_VWA1_VWB1_WSGRA0_WSGRB0_WS32_WG32_4_1_WGM8_WGMXCC1_WGMXCCGn1
    SolutionIndex: 150
    SolutionNameMin: Cijk_Ailk_Bjlk_BBS_BH_Bias_SHB_HA_S_SAB_SCD_SAV_UserArgs_MT16x32x32_MI16x16x1_SN_LDSB1_AFC1_AFEM1_AFEM1_ASEM1_CLR1_CADS0_DTLA0_DTLB0_DTVA0_DTVB0_EPS0_FDSI0_GRPM1_GRVWA1_GRVWB1_GSU1_GSUAMB_GSUC0_GSUWGMRR0_GLS0_ISA1201_IU2_K1_LBSPPA256_LBSPPB512_LBSPPM0_LPA16_LPB16_LPM0_LRVW8_LWPMn1_MIAV1_MIWT1_1_MO40_NTn1_NTA0_NTB0_NTC0_NTD0_NTM0_NEPBS0_NLCA1_NLCB1_ONLL0_PGR2_PLR1_PKA0_SIA2_SS0_SU32_SUM1_SUS256_SPO0_SRVW0_SSO0_SVW8_SK0_SKXCCM0_TLDS0_ULSGRO1_USL1_UIOFGRO0_USFGROn1_VSn1_VWA1_VWB1_WSGRA0_WSGRB0_WS32_WG16_4_1_WGM8_WGMXCC1_WGMXCCGn1
    SolutionIndex: 151
    SolutionNameMin: Cijk_Ailk_Bjlk_BBS_BH_Bias_SHB_HA_S_SAB_SCD_SAV_UserArgs_MT32x32x32_MI16x16x1_SN_LDSB0_AFC1_AFEM1_AFEM1_ASEM1_CLR1_CADS0_DTLA0_DTLB0_DTVA0_DTVB0_EPS0_FDSI0_GRPM1_GRVWA1_GRVWB1_GSU1_GSUAMB_GSUC0_GSUWGMRR0_GLS0_ISA1201_IU1_K1_LBSPPA512_LBSPPB512_LBSPPM0_LPA16_LPB16_LPM0_LRVW8_LWPMn1_MIAV1_MIWT1_1_MO40_NTn1_NTA0_NTB0_NTC0_NTD0_NTM0_NEPBS0_NLCA1_NLCB1_ONLL0_PGR2_PLR1_PKA0_SIA3_SS1_SU32_SUM1_SUS256_SPO0_SRVW0_SSO0_SVW1_SK0_SKXCCM0_TLDS0_ULSGRO1_USL1_UIOFGRO0_USFGROn1_VSn1_VWA1_VWB1_WSGRA0_WSGRB0_WS32_WG32_4_1_WGM8_WGMXCC1_WGMXCCGn1
    SolutionIndex: 152
    SolutionNameMin: Cijk_Ailk_Bjlk_BBS_BH_Bias_SHB_HA_S_SAB_SCD_SAV_UserArgs_MT64x64x32_MI16x16x1_SN_LDSB0_AFC1_AFEM1_AFEM1_ASEM1_CLR1_CADS0_DTLA0_DTLB0_DTVA0_DTVB0_EPS0_FDSI0_GRPM1_GRVWA1_GRVWB1_GSU1_GSUAMB_GSUC0_GSUWGMRR0_GLS0_ISA1201_IU1_K1_LBSPPA1024_LBSPPB1024_LBSPPM0_LPA32_LPB32_LPM0_LRVW8_LWPMn1_MIAV1_MIWT2_2_MO40_NTn1_NTA0_NTB0_NTC0_NTD0_NTM0_NEPBS0_NLCA1_NLCB1_ONLL0_PGR2_PLR1_PKA0_SIA3_SS0_SU32_SUM1_SUS256_SPO0_SRVW0_SSO0_SVW8_SK0_SKXCCM0_TLDS0_ULSGRO1_USL1_UIOFGRO0_USFGROn1_VSn1_VWA2_VWB2_WSGRA0_WSGRB0_WS32_WG32_4_1_WGM8_WGMXCC1_WGMXCCGn1
    SolutionIndex: 153
    SolutionNameMin: Cijk_Ailk_Bjlk_BBS_BH_Bias_SHB_HA_S_SAB_SCD_SAV_UserArgs_MT32x128x32_MI16x16x1_SN_LDSB1_AFC1_AFEM1_AFEM1_ASEM1_CLR1_CADS0_DTLA0_DTLB0_DTVA0_DTVB0_EPS1_FDSI0_GRPM1_GRVWA1_GRVWB8_GSU1_GSUAMB_GSUC0_GSUWGMRR0_GLS0_ISA1201_IU2_K1_LBSPPA512_LBSPPB2048_LBSPPM0_LPA16_LPB0_LPM0_LRVW8_LWPMn1_MIAV1_MIWT1_4_MO40_NTn1_NTA0_NTB0_NTC0_NTD0_NTM0_NEPBS0_NLCA1_NLCB1_ONLL0_PGR1_PLR1_PKA0_SIA2_SS0_SU32_SUM1_SUS256_SPO0_SRVW0_SSO0_SVW8_SK0_SKXCCM0_TLDS0_ULSGRO0_USL1_UIOFGRO0_USFGROn1_VSn1_VWA1_VWB4_WSGRA0_WSGRB0_WS32_WG32_4_1_WGM8_WGMXCC1_WGMXCCGn1
    SolutionIndex: 154
    SolutionNameMin: Cijk_Ailk_Bjlk_BBS_BH_Bias_SHB_HA_S_SAB_SCD_SAV_UserArgs_MT32x128x32_MI16x16x1_SN_LDSB0_AFC1_AFEM1_AFEM1_ASEM1_CLR1_CADS0_DTLA0_DTLB0_DTVA0_DTVB0_EPS0_FDSI0_GRPM1_GRVWA8_GRVWB4_GSU1_GSUAMB_GSUC0_GSUWGMRR0_GLS0_ISA1201_IU1_K1_LBSPPA512_LBSPPB2048_LBSPPM0_LPA16_LPB0_LPM0_LRVW8_LWPMn1_MIAV1_MIWT1_4_MO40_NTn1_NTA0_NTB0_NTC0_NTD0_NTM0_NEPBS0_NLCA1_NLCB1_ONLL0_PGR2_PLR1_PKA0_SIA3_SS0_SU32_SUM1_SUS256_SPO0_SRVW0_SSO0_SVW8_SK0_SKXCCM0_TLDS0_ULSGRO0_USL1_UIOFGRO0_USFGROn1_VSn1_VWA1_VWB4_WSGRA0_WSGRB0_WS32_WG32_4_1_WGM8_WGMXCC1_WGMXCCGn1
    SolutionIndex: 155
    SolutionNameMin: Cijk_Ailk_Bjlk_BBS_BH_Bias_SHB_HA_S_SAB_SCD_SAV_UserArgs_MT32x128x16_MI16x16x1_SN_LDSB0_AFC1_AFEM1_AFEM1_ASEM1_CLR0_CADS0_DTLA0_DTLB0_DTVA0_DTVB0_EPS0_FDSI0_GRPM1_GRVWA1_GRVWB8_GSU1_GSUAMB_GSUC0_GSUWGMRR0_GLS0_ISA1201_IU1_K1_LBSPPA512_LBSPPB2048_LBSPPM0_LPA16_LPB0_LPM0_LRVW8_LWPMn1_MIAV1_MIWT1_4_MO40_NTn1_NTA0_NTB0_NTC0_NTD0_NTM0_NEPBS0_NLCA1_NLCB1_ONLL0_PGR2_PLR0_PKA0_SIA3_SS0_SU32_SUM1_SUS256_SPO0_SRVW0_SSO0_SVW8_SK0_SKXCCM0_TLDS0_ULSGRO1_USL1_UIOFGRO0_USFGROn1_VSn1_VWA1_VWB4_WSGRA0_WSGRB0_WS32_WG32_4_1_WGM8_WGMXCC1_WGMXCCGn1
    SolutionIndex: 156
    SolutionNameMin: Cijk_Ailk_Bjlk_BBS_BH_Bias_SHB_HA_S_SAB_SCD_SAV_UserArgs_MT32x128x32_MI16x16x1_SN_LDSB1_AFC1_AFEM1_AFEM1_ASEM1_CLR1_CADS0_DTLA0_DTLB0_DTVA0_DTVB0_EPS1_FDSI0_GRPM1_GRVWA4_GRVWB8_GSU1_GSUAMB_GSUC0_GSUWGMRR0_GLS0_ISA1201_IU2_K1_LBSPPA512_LBSPPB2048_LBSPPM0_LPA16_LPB0_LPM0_LRVW8_LWPMn1_MIAV1_MIWT1_4_MO40_NTn1_NTA0_NTB0_NTC0_NTD0_NTM0_NEPBS0_NLCA1_NLCB1_ONLL0_PGR1_PLR1_PKA0_SIA2_SS0_SU32_SUM1_SUS256_SPO0_SRVW0_SSO0_SVW8_SK0_SKXCCM0_TLDS0_ULSGRO0_USL1_UIOFGRO0_USFGROn1_VSn1_VWA1_VWB4_WSGRA0_WSGRB0_WS32_WG32_4_1_WGM8_WGMXCC1_WGMXCCGn1
    SolutionIndex: 157
    SolutionNameMin: Cijk_Ailk_Bjlk_BBS_BH_Bias_SHB_HA_S_SAB_SCD_SAV_UserArgs_MT64x64x32_MI16x16x1_SN_LDSB1_AFC1_AFEM1_AFEM1_ASEM1_CLR1_CADS0_DTLA0_DTLB0_DTVA0_DTVB0_EPS1_FDSI0_GRPM1_GRVWA8_GRVWB4_GSU1_GSUAMB_GSUC0_GSUWGMRR0_GLS0_ISA1201_IU2_K1_LBSPPA1024_LBSPPB1024_LBSPPM0_LPA32_LPB32_LPM0_LRVW8_LWPMn1_MIAV1_MIWT2_2_MO40_NTn1_NTA0_NTB0_NTC0_NTD0_NTM0_NEPBS0_NLCA1_NLCB1_ONLL0_PGR1_PLR1_PKA0_SIA2_SS0_SU32_SUM1_SUS256_SPO0_SRVW0_SSO0_SVW8_SK0_SKXCCM0_TLDS0_ULSGRO0_USL1_UIOFGRO0_USFGROn1_VSn1_VWA2_VWB2_WSGRA0_WSGRB0_WS32_WG32_4_1_WGM8_WGMXCC1_WGMXCCGn1
    SolutionIndex: 158
    SolutionNameMin: Cijk_Ailk_Bjlk_BBS_BH_Bias_SHB_HA_S_SAB_SCD_SAV_UserArgs_MT32x32x32_MI16x16x1_SN_LDSB0_AFC1_AFEM1_AFEM1_ASEM1_CLR1_CADS0_DTLA0_DTLB0_DTVA0_DTVB0_EPS1_FDSI0_GRPM1_GRVWA4_GRVWB4_GSU1_GSUAMB_GSUC0_GSUWGMRR0_GLS0_ISA1201_IU1_K1_LBSPPA512_LBSPPB512_LBSPPM0_LPA16_LPB16_LPM0_LRVW8_LWPMn1_MIAV1_MIWT1_1_MO40_NTn1_NTA0_NTB0_NTC0_NTD0_NTM0_NEPBS0_NLCA1_NLCB1_ONLL0_PGR1_PLR1_PKA0_SIA3_SS0_SU32_SUM1_SUS256_SPO0_SRVW0_SSO0_SVW8_SK0_SKXCCM0_TLDS0_ULSGRO0_USL1_UIOFGRO0_USFGROn1_VSn1_VWA1_VWB1_WSGRA0_WSGRB0_WS32_WG32_4_1_WGM8_WGMXCC1_WGMXCCGn1
    SolutionIndex: 159
    SolutionNameMin: Cijk_Ailk_Bjlk_BBS_BH_Bias_SHB_HA_S_SAB_SCD_SAV_UserArgs_MT64x64x64_MI16x16x1_SN_LDSB1_AFC1_AFEM1_AFEM1_ASEM1_CLR1_CADS0_DTLA0_DTLB0_DTVA0_DTVB0_EPS0_FDSI0_GRPM1_GRVWA4_GRVWB4_GSU1_GSUAMB_GSUC0_GSUWGMRR0_GLS0_ISA1201_IU4_K1_LBSPPA1024_LBSPPB1024_LBSPPM0_LPA32_LPB32_LPM0_LRVW8_LWPMn1_MIAV1_MIWT2_2_MO40_NTn1_NTA0_NTB0_NTC0_NTD0_NTM0_NEPBS0_NLCA1_NLCB1_ONLL0_PGR2_PLR1_PKA0_SIA2_SS0_SU32_SUM1_SUS256_SPO0_SRVW0_SSO0_SVW8_SK0_SKXCCM0_TLDS0_ULSGRO1_USL1_UIOFGRO0_USFGROn1_VSn1_VWA2_VWB2_WSGRA0_WSGRB0_WS32_WG32_4_1_WGM8_WGMXCC1_WGMXCCGn1
    SolutionIndex: 160
    SolutionNameMin: Cijk_Ailk_Bjlk_BBS_BH_Bias_SHB_HA_S_SAB_SCD_SAV_UserArgs_MT64x64x64_MI16x16x1_SN_LDSB1_AFC1_AFEM1_AFEM1_ASEM1_CLR1_CADS0_DTLA0_DTLB0_DTVA0_DTVB0_EPS1_FDSI0_GRPM1_GRVWA8_GRVWB8_GSU1_GSUAMB_GSUC0_GSUWGMRR0_GLS0_ISA1201_IU4_K1_LBSPPA1024_LBSPPB1024_LBSPPM0_LPA32_LPB32_LPM0_LRVW8_LWPMn1_MIAV1_MIWT2_2_MO40_NTn1_NTA0_NTB0_NTC0_NTD0_NTM0_NEPBS0_NLCA1_NLCB1_ONLL0_PGR1_PLR1_PKA0_SIA2_SS0_SU32_SUM1_SUS256_SPO0_SRVW0_SSO0_SVW8_SK0_SKXCCM0_TLDS0_ULSGRO0_USL1_UIOFGRO0_USFGROn1_VSn1_VWA2_VWB2_WSGRA0_WSGRB0_WS32_WG32_4_1_WGM8_WGMXCC1_WGMXCCGn1
    SolutionIndex: 161
    SolutionNameMin: Cijk_Ailk_Bjlk_BBS_BH_Bias_SHB_HA_S_SAB_SCD_SAV_UserArgs_MT64x64x32_MI16x16x1_SN_LDSB0_AFC1_AFEM1_AFEM1_ASEM1_CLR1_CADS0_DTLA0_DTLB0_DTVA1_DTVB1_EPS0_FDSI0_GRPM1_GRVWA8_GRVWB8_GSU1_GSUAMB_GSUC0_GSUWGMRR0_GLS0_ISA1201_IU1_K1_LBSPPA0_LBSPPB0_LBSPPM0_LPA0_LPB0_LPM0_LRVW8_LWPMn1_MIAV1_MIWT2_2_MO40_NTn1_NTA0_NTB0_NTC0_NTD0_NTM0_NEPBS0_NLCA2_NLCB2_ONLL0_PGR1_PLR0_PKA0_SIA3_SS0_SU32_SUM1_SUS256_SPO0_SRVW0_SSO0_SVW8_SK0_SKXCCM0_TLDS0_ULSGRO0_USL1_UIOFGRO0_USFGROn1_VSn1_VWA1_VWB1_WSGRA0_WSGRB0_WS32_WG32_4_1_WGM8_WGMXCC1_WGMXCCGn1
    SolutionIndex: 162
    SolutionNameMin: Cijk_Ailk_Bjlk_BBS_BH_Bias_SHB_HA_S_SAB_SCD_SAV_UserArgs_MT64x64x32_MI16x16x1_SN_LDSB1_AFC1_AFEM1_AFEM1_ASEM1_CLR1_CADS0_DTLA0_DTLB0_DTVA0_DTVB0_EPS0_FDSI0_GRPM1_GRVWA8_GRVWB8_GSU1_GSUAMB_GSUC0_GSUWGMRR0_GLS0_ISA1201_IU2_K1_LBSPPA1024_LBSPPB1024_LBSPPM0_LPA32_LPB32_LPM0_LRVW8_LWPMn1_MIAV1_MIWT2_2_MO40_NTn1_NTA0_NTB0_NTC0_NTD0_NTM0_NEPBS0_NLCA1_NLCB1_ONLL0_PGR2_PLR1_PKA0_SIA2_SS0_SU32_SUM1_SUS256_SPO0_SRVW0_SSO0_SVW8_SK0_SKXCCM0_TLDS0_ULSGRO1_USL1_UIOFGRO0_USFGROn1_VSn1_VWA2_VWB2_WSGRA0_WSGRB0_WS32_WG32_4_1_WGM8_WGMXCC1_WGMXCCGn1
    SolutionIndex: 163
    SolutionNameMin: Cijk_Ailk_Bjlk_BBS_BH_Bias_SHB_HA_S_SAB_SCD_SAV_UserArgs_MT64x64x16_MI16x16x1_SN_LDSB1_AFC1_AFEM1_AFEM1_ASEM1_CLR1_CADS0_DTLA0_DTLB0_DTVA0_DTVB0_EPS1_FDSI0_GRPM1_GRVWA4_GRVWB4_GSU1_GSUAMB_GSUC0_GSUWGMRR0_GLS0_ISA1201_IU1_K1_LBSPPA1024_LBSPPB1024_LBSPPM0_LPA32_LPB32_LPM0_LRVW8_LWPMn1_MIAV1_MIWT2_2_MO40_NTn1_NTA0_NTB0_NTC0_NTD0_NTM0_NEPBS0_NLCA1_NLCB1_ONLL0_PGR1_PLR1_PKA0_SIA2_SS0_SU32_SUM1_SUS256_SPO0_SRVW0_SSO0_SVW8_SK0_SKXCCM0_TLDS0_ULSGRO0_USL1_UIOFGRO0_USFGROn1_VSn1_VWA2_VWB2_WSGRA0_WSGRB0_WS32_WG32_4_1_WGM8_WGMXCC1_WGMXCCGn1
    SolutionIndex: 164
    SolutionNameMin: Cijk_Ailk_Bjlk_BBS_BH_Bias_SHB_HA_S_SAB_SCD_SAV_UserArgs_MT64x64x16_MI16x16x1_SN_LDSB0_AFC1_AFEM1_AFEM1_ASEM1_CLR0_CADS0_DTLA0_DTLB0_DTVA0_DTVB0_EPS0_FDSI0_GRPM1_GRVWA4_GRVWB4_GSU1_GSUAMB_GSUC0_GSUWGMRR0_GLS0_ISA1201_IU1_K1_LBSPPA1024_LBSPPB1024_LBSPPM0_LPA32_LPB32_LPM0_LRVW8_LWPMn1_MIAV1_MIWT2_2_MO40_NTn1_NTA0_NTB0_NTC0_NTD0_NTM0_NEPBS0_NLCA1_NLCB1_ONLL0_PGR2_PLR0_PKA0_SIA3_SS0_SU32_SUM1_SUS256_SPO0_SRVW0_SSO0_SVW8_SK0_SKXCCM0_TLDS0_ULSGRO0_USL1_UIOFGRO0_USFGROn1_VSn1_VWA2_VWB2_WSGRA0_WSGRB0_WS32_WG32_4_1_WGM8_WGMXCC1_WGMXCCGn1
    SolutionIndex: 165
    SolutionNameMin: Cijk_Ailk_Bjlk_BBS_BH_Bias_SHB_HA_S_SAB_SCD_SAV_UserArgs_MT64x64x32_MI16x16x1_SN_LDSB0_AFC1_AFEM1_AFEM1_ASEM1_CLR1_CADS0_DTLA0_DTLB0_DTVA0_DTVB0_EPS1_FDSI0_GRPM1_GRVWA4_GRVWB4_GSU1_GSUAMB_GSUC0_GSUWGMRR0_GLS0_ISA1201_IU1_K1_LBSPPA1024_LBSPPB1024_LBSPPM0_LPA32_LPB32_LPM0_LRVW8_LWPMn1_MIAV1_MIWT2_2_MO40_NTn1_NTA0_NTB0_NTC0_NTD0_NTM0_NEPBS0_NLCA1_NLCB1_ONLL0_PGR1_PLR1_PKA0_SIA3_SS0_SU32_SUM1_SUS256_SPO0_SRVW0_SSO0_SVW8_SK0_SKXCCM0_TLDS0_ULSGRO0_USL1_UIOFGRO0_USFGROn1_VSn1_VWA2_VWB2_WSGRA0_WSGRB0_WS32_WG32_4_1_WGM8_WGMXCC1_WGMXCCGn1
    SolutionIndex: 166
    SolutionNameMin: Cijk_Ailk_Bjlk_BBS_BH_Bias_SHB_HA_S_SAB_SCD_SAV_UserArgs_MT64x64x32_MI16x16x1_SN_LDSB1_AFC1_AFEM1_AFEM1_ASEM1_CLR1_CADS0_DTLA0_DTLB0_DTVA0_DTVB0_EPS0_FDSI0_GRPM1_GRVWA1_GRVWB1_GSU1_GSUAMB_GSUC0_GSUWGMRR0_GLS0_ISA1201_IU2_K1_LBSPPA1024_LBSPPB1024_LBSPPM0_LPA32_LPB32_LPM0_LRVW8_LWPMn1_MIAV1_MIWT2_2_MO40_NTn1_NTA0_NTB0_NTC0_NTD0_NTM0_NEPBS0_NLCA1_NLCB1_ONLL0_PGR2_PLR1_PKA0_SIA2_SS0_SU32_SUM1_SUS256_SPO0_SRVW0_SSO0_SVW8_SK0_SKXCCM0_TLDS0_ULSGRO0_USL1_UIOFGRO0_USFGROn1_VSn1_VWA2_VWB2_WSGRA0_WSGRB0_WS32_WG32_4_1_WGM8_WGMXCC1_WGMXCCGn1
    SolutionIndex: 167
    SolutionNameMin: Cijk_Ailk_Bjlk_BBS_BH_Bias_SHB_HA_S_SAB_SCD_SAV_UserArgs_MT64x64x16_MI16x16x1_SN_LDSB0_AFC1_AFEM1_AFEM1_ASEM1_CLR1_CADS0_DTLA0_DTLB0_DTVA1_DTVB1_EPS0_FDSI0_GRPM1_GRVWA8_GRVWB8_GSU1_GSUAMB_GSUC0_GSUWGMRR0_GLS0_ISA1201_IU1_K1_LBSPPA0_LBSPPB0_LBSPPM0_LPA0_LPB0_LPM0_LRVW8_LWPMn1_MIAV1_MIWT2_2_MO40_NTn1_NTA0_NTB0_NTC0_NTD0_NTM0_NEPBS0_NLCA1_NLCB1_ONLL0_PGR1_PLR0_PKA0_SIA3_SS0_SU32_SUM1_SUS256_SPO0_SRVW0_SSO0_SVW8_SK0_SKXCCM0_TLDS0_ULSGRO0_USL1_UIOFGRO0_USFGROn1_VSn1_VWA1_VWB1_WSGRA0_WSGRB0_WS32_WG32_4_1_WGM8_WGMXCC1_WGMXCCGn1
    SolutionIndex: 168
    SolutionNameMin: Cijk_Ailk_Bjlk_BBS_BH_Bias_SHB_HA_S_SAB_SCD_SAV_UserArgs_MT64x64x64_MI16x16x1_SN_LDSB0_AFC1_AFEM1_AFEM1_ASEM1_CLR1_CADS0_DTLA0_DTLB0_DTVA1_DTVB0_EPS1_FDSI0_GRPM1_GRVWA8_GRVWB4_GSU1_GSUAMB_GSUC0_GSUWGMRR0_GLS0_ISA1201_IU1_K1_LBSPPA0_LBSPPB1024_LBSPPM0_LPA0_LPB32_LPM0_LRVW8_LWPMn1_MIAV1_MIWT2_2_MO40_NTn1_NTA0_NTB0_NTC0_NTD0_NTM0_NEPBS0_NLCA4_NLCB1_ONLL0_PGR1_PLR1_PKA0_SIA3_SS0_SU32_SUM1_SUS256_SPO0_SRVW0_SSO0_SVW8_SK0_SKXCCM0_TLDS0_ULSGRO0_USL1_UIOFGRO0_USFGROn1_VSn1_VWA1_VWB2_WSGRA0_WSGRB0_WS32_WG32_4_1_WGM8_WGMXCC1_WGMXCCGn1
    SolutionIndex: 169
    SolutionNameMin: Cijk_Ailk_Bjlk_BBS_BH_Bias_SHB_HA_S_SAB_SCD_SAV_UserArgs_MT32x16x32_MI16x16x1_SN_LDSB1_AFC1_AFEM1_AFEM1_ASEM1_CLR1_CADS0_DTLA0_DTLB0_DTVA0_DTVB0_EPS0_FDSI0_GRPM1_GRVWA1_GRVWB1_GSU1_GSUAMB_GSUC0_GSUWGMRR0_GLS0_ISA1201_IU2_K1_LBSPPA512_LBSPPB256_LBSPPM0_LPA16_LPB16_LPM0_LRVW8_LWPMn1_MIAV1_MIWT1_1_MO40_NTn1_NTA0_NTB0_NTC0_NTD0_NTM0_NEPBS0_NLCA1_NLCB1_ONLL0_PGR2_PLR1_PKA0_SIA2_SS0_SU32_SUM1_SUS256_SPO0_SRVW0_SSO0_SVW8_SK0_SKXCCM0_TLDS0_ULSGRO0_USL1_UIOFGRO0_USFGROn1_VSn1_VWA1_VWB1_WSGRA0_WSGRB0_WS32_WG32_2_1_WGM8_WGMXCC1_WGMXCCGn1
    SolutionIndex: 170
    SolutionNameMin: Cijk_Ailk_Bjlk_BBS_BH_Bias_SHB_HA_S_SAB_SCD_SAV_UserArgs_MT128x32x32_MI16x16x1_SN_LDSB1_AFC1_AFEM1_AFEM1_ASEM1_CLR1_CADS0_DTLA0_DTLB0_DTVA0_DTVB0_EPS0_FDSI0_GRPM1_GRVWA4_GRVWB1_GSU1_GSUAMB_GSUC0_GSUWGMRR0_GLS0_ISA1201_IU2_K1_LBSPPA2048_LBSPPB512_LBSPPM0_LPA0_LPB16_LPM0_LRVW8_LWPMn1_MIAV1_MIWT4_1_MO40_NTn1_NTA0_NTB0_NTC0_NTD0_NTM0_NEPBS0_NLCA1_NLCB1_ONLL0_PGR2_PLR1_PKA0_SIA2_SS1_SU32_SUM1_SUS256_SPO0_SRVW0_SSO0_SVW4_SK0_SKXCCM0_TLDS0_ULSGRO1_USL1_UIOFGRO0_USFGROn1_VSn1_VWA4_VWB1_WSGRA0_WSGRB0_WS32_WG32_4_1_WGM8_WGMXCC1_WGMXCCGn1
    SolutionIndex: 171
    SolutionNameMin: Cijk_Ailk_Bjlk_BBS_BH_Bias_SHB_HA_S_SAB_SCD_SAV_UserArgs_MT32x128x16_MI16x16x1_SN_LDSB0_AFC1_AFEM1_AFEM1_ASEM1_CLR0_CADS0_DTLA0_DTLB0_DTVA0_DTVB0_EPS0_FDSI0_GRPM1_GRVWA4_GRVWB4_GSU1_GSUAMB_GSUC0_GSUWGMRR0_GLS0_ISA1201_IU1_K1_LBSPPA512_LBSPPB2048_LBSPPM0_LPA16_LPB0_LPM0_LRVW8_LWPMn1_MIAV1_MIWT1_4_MO40_NTn1_NTA0_NTB0_NTC0_NTD0_NTM0_NEPBS0_NLCA1_NLCB1_ONLL0_PGR2_PLR0_PKA0_SIA3_SS0_SU32_SUM1_SUS256_SPO0_SRVW0_SSO0_SVW8_SK0_SKXCCM0_TLDS0_ULSGRO1_USL1_UIOFGRO0_USFGROn1_VSn1_VWA1_VWB4_WSGRA0_WSGRB0_WS32_WG32_4_1_WGM8_WGMXCC1_WGMXCCGn1
    SolutionIndex: 172
    SolutionNameMin: Cijk_Ailk_Bjlk_BBS_BH_Bias_SHB_HA_S_SAB_SCD_SAV_UserArgs_MT64x64x32_MI16x16x1_SN_LDSB0_AFC1_AFEM1_AFEM1_ASEM1_CLR1_CADS0_DTLA0_DTLB0_DTVA0_DTVB0_EPS0_FDSI0_GRPM1_GRVWA4_GRVWB4_GSU1_GSUAMB_GSUC0_GSUWGMRR0_GLS0_ISA1201_IU1_K1_LBSPPA1024_LBSPPB1024_LBSPPM0_LPA32_LPB32_LPM0_LRVW8_LWPMn1_MIAV1_MIWT2_2_MO40_NTn1_NTA0_NTB0_NTC0_NTD0_NTM0_NEPBS0_NLCA1_NLCB1_ONLL0_PGR2_PLR1_PKA0_SIA3_SS0_SU32_SUM1_SUS256_SPO0_SRVW0_SSO0_SVW8_SK0_SKXCCM0_TLDS0_ULSGRO0_USL1_UIOFGRO0_USFGROn1_VSn1_VWA2_VWB2_WSGRA0_WSGRB0_WS32_WG32_4_1_WGM8_WGMXCC1_WGMXCCGn1
    SolutionIndex: 173
    SolutionNameMin: Cijk_Ailk_Bjlk_BBS_BH_Bias_SHB_HA_S_SAB_SCD_SAV_UserArgs_MT64x64x32_MI16x16x1_SN_LDSB0_AFC1_AFEM1_AFEM1_ASEM1_CLR1_CADS0_DTLA0_DTLB0_DTVA0_DTVB1_EPS0_FDSI0_GRPM1_GRVWA8_GRVWB8_GSU1_GSUAMB_GSUC0_GSUWGMRR0_GLS0_ISA1201_IU1_K1_LBSPPA1024_LBSPPB0_LBSPPM0_LPA32_LPB0_LPM0_LRVW8_LWPMn1_MIAV1_MIWT2_2_MO40_NTn1_NTA0_NTB0_NTC0_NTD0_NTM0_NEPBS0_NLCA1_NLCB2_ONLL0_PGR2_PLR1_PKA0_SIA3_SS0_SU32_SUM1_SUS256_SPO0_SRVW0_SSO0_SVW8_SK0_SKXCCM0_TLDS0_ULSGRO0_USL1_UIOFGRO0_USFGROn1_VSn1_VWA2_VWB1_WSGRA0_WSGRB0_WS32_WG32_4_1_WGM8_WGMXCC1_WGMXCCGn1
    SolutionIndex: 174
    SolutionNameMin: Cijk_Ailk_Bjlk_BBS_BH_Bias_SHB_HA_S_SAB_SCD_SAV_UserArgs_MT64x64x32_MI16x16x1_SN_LDSB1_AFC1_AFEM1_AFEM1_ASEM1_CLR1_CADS0_DTLA0_DTLB0_DTVA0_DTVB0_EPS1_FDSI0_GRPM1_GRVWA8_GRVWB8_GSU1_GSUAMB_GSUC0_GSUWGMRR0_GLS0_ISA1201_IU2_K1_LBSPPA1024_LBSPPB1024_LBSPPM0_LPA32_LPB32_LPM0_LRVW8_LWPMn1_MIAV1_MIWT2_2_MO40_NTn1_NTA0_NTB0_NTC0_NTD0_NTM0_NEPBS0_NLCA1_NLCB1_ONLL0_PGR1_PLR1_PKA0_SIA2_SS0_SU32_SUM1_SUS256_SPO0_SRVW0_SSO0_SVW8_SK0_SKXCCM0_TLDS0_ULSGRO0_USL1_UIOFGRO0_USFGROn1_VSn1_VWA2_VWB2_WSGRA0_WSGRB0_WS32_WG32_4_1_WGM8_WGMXCC1_WGMXCCGn1
    SolutionIndex: 175
    SolutionNameMin: Cijk_Ailk_Bjlk_BBS_BH_Bias_SHB_HA_S_SAB_SCD_SAV_UserArgs_MT64x64x64_MI16x16x1_SN_LDSB0_AFC1_AFEM1_AFEM1_ASEM1_CLR1_CADS0_DTLA0_DTLB0_DTVA1_DTVB1_EPS0_FDSI0_GRPM1_GRVWA8_GRVWB8_GSU1_GSUAMB_GSUC0_GSUWGMRR0_GLS0_ISA1201_IU1_K1_LBSPPA0_LBSPPB0_LBSPPM0_LPA0_LPB0_LPM0_LRVW8_LWPMn1_MIAV1_MIWT2_2_MO40_NTn1_NTA0_NTB0_NTC0_NTD0_NTM0_NEPBS0_NLCA4_NLCB4_ONLL0_PGR1_PLR0_PKA0_SIA3_SS0_SU32_SUM1_SUS256_SPO0_SRVW0_SSO0_SVW8_SK0_SKXCCM0_TLDS0_ULSGRO0_USL1_UIOFGRO0_USFGROn1_VSn1_VWA1_VWB1_WSGRA0_WSGRB0_WS32_WG32_4_1_WGM8_WGMXCC1_WGMXCCGn1
    SolutionIndex: 176
    SolutionNameMin: Cijk_Ailk_Bjlk_BBS_BH_Bias_SHB_HA_S_SAB_SCD_SAV_UserArgs_MT64x64x32_MI16x16x1_SN_LDSB0_AFC1_AFEM1_AFEM1_ASEM1_CLR1_CADS0_DTLA0_DTLB0_DTVA1_DTVB0_EPS0_FDSI0_GRPM1_GRVWA8_GRVWB8_GSU1_GSUAMB_GSUC0_GSUWGMRR0_GLS0_ISA1201_IU1_K1_LBSPPA0_LBSPPB1024_LBSPPM0_LPA0_LPB32_LPM0_LRVW8_LWPMn1_MIAV1_MIWT2_2_MO40_NTn1_NTA0_NTB0_NTC0_NTD0_NTM0_NEPBS0_NLCA2_NLCB1_ONLL0_PGR2_PLR1_PKA0_SIA3_SS0_SU32_SUM1_SUS256_SPO0_SRVW0_SSO0_SVW8_SK0_SKXCCM0_TLDS0_ULSGRO0_USL1_UIOFGRO0_USFGROn1_VSn1_VWA1_VWB2_WSGRA0_WSGRB0_WS32_WG32_4_1_WGM8_WGMXCC1_WGMXCCGn1
    SolutionIndex: 177
    SolutionNameMin: Cijk_Ailk_Bjlk_BBS_BH_Bias_SHB_HA_S_SAB_SCD_SAV_UserArgs_MT64x64x32_MI16x16x1_SN_LDSB0_AFC1_AFEM1_AFEM1_ASEM1_CLR1_CADS0_DTLA0_DTLB0_DTVA0_DTVB0_EPS0_FDSI0_GRPM1_GRVWA4_GRVWB8_GSU1_GSUAMB_GSUC0_GSUWGMRR0_GLS0_ISA1201_IU1_K1_LBSPPA1024_LBSPPB1024_LBSPPM0_LPA32_LPB32_LPM0_LRVW8_LWPMn1_MIAV1_MIWT2_2_MO40_NTn1_NTA0_NTB0_NTC0_NTD0_NTM0_NEPBS0_NLCA1_NLCB1_ONLL0_PGR2_PLR1_PKA0_SIA3_SS0_SU32_SUM1_SUS256_SPO0_SRVW0_SSO0_SVW8_SK0_SKXCCM0_TLDS0_ULSGRO0_USL1_UIOFGRO0_USFGROn1_VSn1_VWA2_VWB2_WSGRA0_WSGRB0_WS32_WG32_4_1_WGM8_WGMXCC1_WGMXCCGn1
    SolutionIndex: 178
    SolutionNameMin: Cijk_Ailk_Bjlk_BBS_BH_Bias_SHB_HA_S_SAB_SCD_SAV_UserArgs_MT64x64x64_MI16x16x1_SN_LDSB1_AFC1_AFEM1_AFEM1_ASEM1_CLR1_CADS0_DTLA0_DTLB0_DTVA0_DTVB0_EPS0_FDSI0_GRPM1_GRVWA8_GRVWB4_GSU1_GSUAMB_GSUC0_GSUWGMRR0_GLS0_ISA1201_IU4_K1_LBSPPA1024_LBSPPB1024_LBSPPM0_LPA32_LPB32_LPM0_LRVW8_LWPMn1_MIAV1_MIWT2_2_MO40_NTn1_NTA0_NTB0_NTC0_NTD0_NTM0_NEPBS0_NLCA1_NLCB1_ONLL0_PGR2_PLR1_PKA0_SIA2_SS0_SU32_SUM1_SUS256_SPO0_SRVW0_SSO0_SVW8_SK0_SKXCCM0_TLDS0_ULSGRO1_USL1_UIOFGRO0_USFGROn1_VSn1_VWA2_VWB2_WSGRA0_WSGRB0_WS32_WG32_4_1_WGM8_WGMXCC1_WGMXCCGn1
    SolutionIndex: 179
    SolutionNameMin: Cijk_Ailk_Bjlk_BBS_BH_Bias_SHB_HA_S_SAB_SCD_SAV_UserArgs_MT64x64x64_MI16x16x1_SN_LDSB1_AFC1_AFEM1_AFEM1_ASEM1_CLR1_CADS0_DTLA0_DTLB0_DTVA0_DTVB0_EPS1_FDSI0_GRPM1_GRVWA8_GRVWB4_GSU1_GSUAMB_GSUC0_GSUWGMRR0_GLS0_ISA1201_IU4_K1_LBSPPA1024_LBSPPB1024_LBSPPM0_LPA32_LPB32_LPM0_LRVW8_LWPMn1_MIAV1_MIWT2_2_MO40_NTn1_NTA0_NTB0_NTC0_NTD0_NTM0_NEPBS0_NLCA1_NLCB1_ONLL0_PGR1_PLR1_PKA0_SIA2_SS0_SU32_SUM1_SUS256_SPO0_SRVW0_SSO0_SVW8_SK0_SKXCCM0_TLDS0_ULSGRO0_USL1_UIOFGRO0_USFGROn1_VSn1_VWA2_VWB2_WSGRA0_WSGRB0_WS32_WG32_4_1_WGM8_WGMXCC1_WGMXCCGn1
    SolutionIndex: 180
    SolutionNameMin: Cijk_Ailk_Bjlk_BBS_BH_Bias_SHB_HA_S_SAB_SCD_SAV_UserArgs_MT32x32x32_MI16x16x1_SN_LDSB0_AFC1_AFEM1_AFEM1_ASEM1_CLR1_CADS0_DTLA0_DTLB0_DTVA0_DTVB0_EPS0_FDSI0_GRPM1_GRVWA8_GRVWB4_GSU1_GSUAMB_GSUC0_GSUWGMRR0_GLS0_ISA1201_IU1_K1_LBSPPA512_LBSPPB512_LBSPPM0_LPA16_LPB16_LPM0_LRVW8_LWPMn1_MIAV1_MIWT1_1_MO40_NTn1_NTA0_NTB0_NTC0_NTD0_NTM0_NEPBS0_NLCA1_NLCB1_ONLL0_PGR2_PLR1_PKA0_SIA3_SS0_SU32_SUM1_SUS256_SPO0_SRVW0_SSO0_SVW8_SK0_SKXCCM0_TLDS0_ULSGRO1_USL1_UIOFGRO0_USFGROn1_VSn1_VWA1_VWB1_WSGRA0_WSGRB0_WS32_WG32_4_1_WGM8_WGMXCC1_WGMXCCGn1
    SolutionIndex: 181
    SolutionNameMin: Cijk_Ailk_Bjlk_BBS_BH_Bias_SHB_HA_S_SAB_SCD_SAV_UserArgs_MT32x16x32_MI16x16x1_SN_LDSB0_AFC1_AFEM1_AFEM1_ASEM1_CLR1_CADS0_DTLA0_DTLB0_DTVA0_DTVB0_EPS0_FDSI0_GRPM1_GRVWA1_GRVWB4_GSU1_GSUAMB_GSUC0_GSUWGMRR0_GLS0_ISA1201_IU1_K1_LBSPPA512_LBSPPB256_LBSPPM0_LPA16_LPB16_LPM0_LRVW8_LWPMn1_MIAV1_MIWT1_1_MO40_NTn1_NTA0_NTB0_NTC0_NTD0_NTM0_NEPBS0_NLCA1_NLCB1_ONLL0_PGR2_PLR1_PKA0_SIA3_SS0_SU32_SUM1_SUS256_SPO0_SRVW0_SSO0_SVW8_SK0_SKXCCM0_TLDS0_ULSGRO1_USL1_UIOFGRO0_USFGROn1_VSn1_VWA1_VWB1_WSGRA0_WSGRB0_WS32_WG32_2_1_WGM8_WGMXCC1_WGMXCCGn1
    SolutionIndex: 182
    SolutionNameMin: Cijk_Ailk_Bjlk_BBS_BH_Bias_SHB_HA_S_SAB_SCD_SAV_UserArgs_MT64x64x64_MI16x16x1_SN_LDSB1_AFC1_AFEM1_AFEM1_ASEM1_CLR1_CADS0_DTLA0_DTLB0_DTVA0_DTVB0_EPS0_FDSI0_GRPM1_GRVWA8_GRVWB8_GSU1_GSUAMB_GSUC0_GSUWGMRR0_GLS0_ISA1201_IU4_K1_LBSPPA1024_LBSPPB1024_LBSPPM0_LPA32_LPB32_LPM0_LRVW8_LWPMn1_MIAV1_MIWT2_2_MO40_NTn1_NTA0_NTB0_NTC0_NTD0_NTM0_NEPBS0_NLCA1_NLCB1_ONLL0_PGR2_PLR1_PKA0_SIA2_SS0_SU32_SUM1_SUS256_SPO0_SRVW0_SSO0_SVW8_SK0_SKXCCM0_TLDS0_ULSGRO0_USL1_UIOFGRO0_USFGROn1_VSn1_VWA2_VWB2_WSGRA0_WSGRB0_WS32_WG32_4_1_WGM8_WGMXCC1_WGMXCCGn1
    SolutionIndex: 183
    SolutionNameMin: Cijk_Ailk_Bjlk_BBS_BH_Bias_SHB_HA_S_SAB_SCD_SAV_UserArgs_MT64x64x16_MI16x16x1_SN_LDSB1_AFC1_AFEM1_AFEM1_ASEM1_CLR1_CADS0_DTLA0_DTLB0_DTVA0_DTVB0_EPS1_FDSI0_GRPM1_GRVWA1_GRVWB1_GSU1_GSUAMB_GSUC0_GSUWGMRR0_GLS0_ISA1201_IU1_K1_LBSPPA1024_LBSPPB1024_LBSPPM0_LPA32_LPB32_LPM0_LRVW8_LWPMn1_MIAV1_MIWT2_2_MO40_NTn1_NTA0_NTB0_NTC0_NTD0_NTM0_NEPBS0_NLCA1_NLCB1_ONLL0_PGR1_PLR1_PKA0_SIA2_SS0_SU32_SUM1_SUS256_SPO0_SRVW0_SSO0_SVW8_SK0_SKXCCM0_TLDS0_ULSGRO0_USL1_UIOFGRO0_USFGROn1_VSn1_VWA2_VWB2_WSGRA0_WSGRB0_WS32_WG32_4_1_WGM8_WGMXCC1_WGMXCCGn1
    SolutionIndex: 184
    SolutionNameMin: Cijk_Ailk_Bjlk_BBS_BH_Bias_SHB_HA_S_SAB_SCD_SAV_UserArgs_MT64x64x32_MI16x16x1_SN_LDSB0_AFC1_AFEM1_AFEM1_ASEM1_CLR1_CADS0_DTLA0_DTLB0_DTVA0_DTVB0_EPS0_FDSI0_GRPM1_GRVWA8_GRVWB8_GSU1_GSUAMB_GSUC0_GSUWGMRR0_GLS0_ISA1201_IU1_K1_LBSPPA1024_LBSPPB1024_LBSPPM0_LPA32_LPB32_LPM0_LRVW8_LWPMn1_MIAV1_MIWT2_2_MO40_NTn1_NTA0_NTB0_NTC0_NTD0_NTM0_NEPBS0_NLCA1_NLCB1_ONLL0_PGR2_PLR1_PKA0_SIA3_SS0_SU32_SUM1_SUS256_SPO0_SRVW0_SSO0_SVW8_SK0_SKXCCM0_TLDS0_ULSGRO1_USL1_UIOFGRO0_USFGROn1_VSn1_VWA2_VWB2_WSGRA0_WSGRB0_WS32_WG32_4_1_WGM8_WGMXCC1_WGMXCCGn1
    SolutionIndex: 185
    SolutionNameMin: Cijk_Ailk_Bjlk_BBS_BH_Bias_SHB_HA_S_SAB_SCD_SAV_UserArgs_MT64x64x64_MI16x16x1_SN_LDSB1_AFC1_AFEM1_AFEM1_ASEM1_CLR1_CADS0_DTLA0_DTLB0_DTVA0_DTVB0_EPS0_FDSI0_GRPM1_GRVWA8_GRVWB4_GSU1_GSUAMB_GSUC0_GSUWGMRR0_GLS0_ISA1201_IU4_K1_LBSPPA1024_LBSPPB1024_LBSPPM0_LPA32_LPB32_LPM0_LRVW8_LWPMn1_MIAV1_MIWT2_2_MO40_NTn1_NTA0_NTB0_NTC0_NTD0_NTM0_NEPBS0_NLCA1_NLCB1_ONLL0_PGR2_PLR1_PKA0_SIA2_SS0_SU32_SUM1_SUS256_SPO0_SRVW0_SSO0_SVW8_SK0_SKXCCM0_TLDS0_ULSGRO0_USL1_UIOFGRO0_USFGROn1_VSn1_VWA2_VWB2_WSGRA0_WSGRB0_WS32_WG32_4_1_WGM8_WGMXCC1_WGMXCCGn1
    SolutionIndex: 186
    SolutionNameMin: Cijk_Ailk_Bjlk_BBS_BH_Bias_SHB_HA_S_SAB_SCD_SAV_UserArgs_MT64x64x32_MI16x16x1_SN_LDSB0_AFC1_AFEM1_AFEM1_ASEM1_CLR1_CADS0_DTLA0_DTLB0_DTVA0_DTVB0_EPS0_FDSI0_GRPM1_GRVWA1_GRVWB1_GSU1_GSUAMB_GSUC0_GSUWGMRR0_GLS0_ISA1201_IU1_K1_LBSPPA1024_LBSPPB1024_LBSPPM0_LPA32_LPB32_LPM0_LRVW8_LWPMn1_MIAV1_MIWT2_2_MO40_NTn1_NTA0_NTB0_NTC0_NTD0_NTM0_NEPBS0_NLCA1_NLCB1_ONLL0_PGR2_PLR1_PKA0_SIA3_SS0_SU32_SUM1_SUS256_SPO0_SRVW0_SSO0_SVW8_SK0_SKXCCM0_TLDS0_ULSGRO0_USL1_UIOFGRO0_USFGROn1_VSn1_VWA2_VWB2_WSGRA0_WSGRB0_WS32_WG32_4_1_WGM8_WGMXCC1_WGMXCCGn1
    SolutionIndex: 187
    SolutionNameMin: Cijk_Ailk_Bjlk_BBS_BH_Bias_SHB_HA_S_SAB_SCD_SAV_UserArgs_MT128x64x16_MI16x16x1_SN_LDSB1_AFC1_AFEM1_AFEM1_ASEM1_CLR1_CADS0_DTLA0_DTLB0_DTVA0_DTVB0_EPS1_FDSI0_GRPM1_GRVWA4_GRVWB1_GSU1_GSUAMB_GSUC0_GSUWGMRR0_GLS0_ISA1201_IU1_K1_LBSPPA2048_LBSPPB1024_LBSPPM0_LPA0_LPB16_LPM0_LRVW8_LWPMn1_MIAV1_MIWT8_1_MO40_NTn1_NTA0_NTB0_NTC0_NTD0_NTM0_NEPBS0_NLCA1_NLCB1_ONLL0_PGR1_PLR1_PKA0_SIA2_SS1_SU32_SUM1_SUS256_SPO0_SRVW0_SSO0_SVW8_SK0_SKXCCM0_TLDS0_ULSGRO0_USL1_UIOFGRO0_USFGROn1_VSn1_VWA8_VWB1_WSGRA0_WSGRB0_WS32_WG16_8_1_WGM8_WGMXCC1_WGMXCCGn1
    SolutionIndex: 188
    SolutionNameMin: Cijk_Ailk_Bjlk_BBS_BH_Bias_SHB_HA_S_SAB_SCD_SAV_UserArgs_MT32x32x32_MI16x16x1_SN_LDSB1_AFC1_AFEM1_AFEM1_ASEM1_CLR1_CADS0_DTLA0_DTLB0_DTVA0_DTVB0_EPS1_FDSI0_GRPM1_GRVWA1_GRVWB8_GSU1_GSUAMB_GSUC0_GSUWGMRR0_GLS0_ISA1201_IU2_K1_LBSPPA512_LBSPPB512_LBSPPM0_LPA16_LPB16_LPM0_LRVW8_LWPMn1_MIAV1_MIWT1_1_MO40_NTn1_NTA0_NTB0_NTC0_NTD0_NTM0_NEPBS0_NLCA1_NLCB1_ONLL0_PGR1_PLR1_PKA0_SIA2_SS0_SU32_SUM1_SUS256_SPO0_SRVW0_SSO0_SVW8_SK0_SKXCCM0_TLDS0_ULSGRO0_USL1_UIOFGRO0_USFGROn1_VSn1_VWA1_VWB1_WSGRA0_WSGRB0_WS32_WG32_4_1_WGM8_WGMXCC1_WGMXCCGn1
    SolutionIndex: 189
    SolutionNameMin: Cijk_Ailk_Bjlk_BBS_BH_Bias_SHB_HA_S_SAB_SCD_SAV_UserArgs_MT32x32x32_MI16x16x1_SN_LDSB1_AFC1_AFEM1_AFEM1_ASEM1_CLR1_CADS0_DTLA0_DTLB0_DTVA0_DTVB0_EPS1_FDSI0_GRPM1_GRVWA4_GRVWB1_GSU1_GSUAMB_GSUC0_GSUWGMRR0_GLS0_ISA1201_IU2_K1_LBSPPA512_LBSPPB512_LBSPPM0_LPA16_LPB16_LPM0_LRVW8_LWPMn1_MIAV1_MIWT1_1_MO40_NTn1_NTA0_NTB0_NTC0_NTD0_NTM0_NEPBS0_NLCA1_NLCB1_ONLL0_PGR1_PLR1_PKA0_SIA2_SS1_SU32_SUM1_SUS256_SPO0_SRVW0_SSO0_SVW1_SK0_SKXCCM0_TLDS0_ULSGRO0_USL1_UIOFGRO0_USFGROn1_VSn1_VWA1_VWB1_WSGRA0_WSGRB0_WS32_WG32_4_1_WGM8_WGMXCC1_WGMXCCGn1
    SolutionIndex: 190
    SolutionNameMin: Cijk_Ailk_Bjlk_BBS_BH_Bias_SHB_HA_S_SAB_SCD_SAV_UserArgs_MT64x64x32_MI16x16x1_SN_LDSB1_AFC1_AFEM1_AFEM1_ASEM1_CLR1_CADS0_DTLA0_DTLB0_DTVA0_DTVB0_EPS1_FDSI0_GRPM1_GRVWA4_GRVWB4_GSU1_GSUAMB_GSUC0_GSUWGMRR0_GLS0_ISA1201_IU2_K1_LBSPPA1024_LBSPPB1024_LBSPPM0_LPA32_LPB32_LPM0_LRVW8_LWPMn1_MIAV1_MIWT2_2_MO40_NTn1_NTA0_NTB0_NTC0_NTD0_NTM0_NEPBS0_NLCA1_NLCB1_ONLL0_PGR1_PLR1_PKA0_SIA2_SS0_SU32_SUM1_SUS256_SPO0_SRVW0_SSO0_SVW8_SK0_SKXCCM0_TLDS0_ULSGRO0_USL1_UIOFGRO0_USFGROn1_VSn1_VWA2_VWB2_WSGRA0_WSGRB0_WS32_WG32_4_1_WGM8_WGMXCC1_WGMXCCGn1
    SolutionIndex: 191
    SolutionNameMin: Cijk_Ailk_Bjlk_BBS_BH_Bias_SHB_HA_S_SAB_SCD_SAV_UserArgs_MT64x64x64_MI16x16x1_SN_LDSB0_AFC1_AFEM1_AFEM1_ASEM1_CLR1_CADS0_DTLA0_DTLB0_DTVA0_DTVB1_EPS1_FDSI0_GRPM1_GRVWA4_GRVWB8_GSU1_GSUAMB_GSUC0_GSUWGMRR0_GLS0_ISA1201_IU1_K1_LBSPPA1024_LBSPPB0_LBSPPM0_LPA32_LPB0_LPM0_LRVW8_LWPMn1_MIAV1_MIWT2_2_MO40_NTn1_NTA0_NTB0_NTC0_NTD0_NTM0_NEPBS0_NLCA1_NLCB4_ONLL0_PGR1_PLR1_PKA0_SIA3_SS0_SU32_SUM1_SUS256_SPO0_SRVW0_SSO0_SVW8_SK0_SKXCCM0_TLDS0_ULSGRO0_USL1_UIOFGRO0_USFGROn1_VSn1_VWA2_VWB1_WSGRA0_WSGRB0_WS32_WG32_4_1_WGM8_WGMXCC1_WGMXCCGn1
    SolutionIndex: 192
    SolutionNameMin: Cijk_Ailk_Bjlk_BBS_BH_Bias_SHB_HA_S_SAB_SCD_SAV_UserArgs_MT64x64x16_MI16x16x1_SN_LDSB0_AFC1_AFEM1_AFEM1_ASEM1_CLR0_CADS0_DTLA0_DTLB0_DTVA0_DTVB0_EPS0_FDSI0_GRPM1_GRVWA1_GRVWB1_GSU1_GSUAMB_GSUC0_GSUWGMRR0_GLS0_ISA1201_IU1_K1_LBSPPA1024_LBSPPB1024_LBSPPM0_LPA32_LPB32_LPM0_LRVW8_LWPMn1_MIAV1_MIWT2_2_MO40_NTn1_NTA0_NTB0_NTC0_NTD0_NTM0_NEPBS0_NLCA1_NLCB1_ONLL0_PGR2_PLR0_PKA0_SIA3_SS0_SU32_SUM1_SUS256_SPO0_SRVW0_SSO0_SVW8_SK0_SKXCCM0_TLDS0_ULSGRO1_USL1_UIOFGRO0_USFGROn1_VSn1_VWA2_VWB2_WSGRA0_WSGRB0_WS32_WG32_4_1_WGM8_WGMXCC1_WGMXCCGn1
    SolutionIndex: 193
    SolutionNameMin: Cijk_Ailk_Bjlk_BBS_BH_Bias_SHB_HA_S_SAB_SCD_SAV_UserArgs_MT64x64x64_MI16x16x1_SN_LDSB0_AFC1_AFEM1_AFEM1_ASEM1_CLR1_CADS0_DTLA0_DTLB0_DTVA0_DTVB1_EPS0_FDSI0_GRPM1_GRVWA8_GRVWB8_GSU1_GSUAMB_GSUC0_GSUWGMRR0_GLS0_ISA1201_IU1_K1_LBSPPA1024_LBSPPB0_LBSPPM0_LPA32_LPB0_LPM0_LRVW8_LWPMn1_MIAV1_MIWT2_2_MO40_NTn1_NTA0_NTB0_NTC0_NTD0_NTM0_NEPBS0_NLCA1_NLCB4_ONLL0_PGR2_PLR1_PKA0_SIA3_SS0_SU32_SUM1_SUS256_SPO0_SRVW0_SSO0_SVW8_SK0_SKXCCM0_TLDS0_ULSGRO0_USL1_UIOFGRO0_USFGROn1_VSn1_VWA2_VWB1_WSGRA0_WSGRB0_WS32_WG32_4_1_WGM8_WGMXCC1_WGMXCCGn1
    SolutionIndex: 194
    SolutionNameMin: Cijk_Ailk_Bjlk_BBS_BH_Bias_SHB_HA_S_SAB_SCD_SAV_UserArgs_MT32x128x64_MI16x16x1_SN_LDSB0_AFC1_AFEM1_AFEM1_ASEM1_CLR1_CADS0_DTLA0_DTLB0_DTVA1_DTVB0_EPS0_FDSI0_GRPM1_GRVWA8_GRVWB8_GSU1_GSUAMB_GSUC0_GSUWGMRR0_GLS0_ISA1201_IU1_K1_LBSPPA0_LBSPPB2048_LBSPPM0_LPA0_LPB0_LPM0_LRVW8_LWPMn1_MIAV1_MIWT1_4_MO40_NTn1_NTA0_NTB0_NTC0_NTD0_NTM0_NEPBS0_NLCA1_NLCB1_ONLL0_PGR2_PLR1_PKA0_SIA3_SS0_SU32_SUM1_SUS256_SPO0_SRVW0_SSO0_SVW8_SK0_SKXCCM0_TLDS0_ULSGRO0_USL1_UIOFGRO0_USFGROn1_VSn1_VWA1_VWB4_WSGRA0_WSGRB0_WS32_WG32_4_1_WGM8_WGMXCC1_WGMXCCGn1
    SolutionIndex: 195
    SolutionNameMin: Cijk_Ailk_Bjlk_BBS_BH_Bias_SHB_HA_S_SAB_SCD_SAV_UserArgs_MT16x16x32_MI16x16x1_SN_LDSB0_AFC1_AFEM1_AFEM1_ASEM1_CLR1_CADS0_DTLA0_DTLB0_DTVA0_DTVB0_EPS0_FDSI0_GRPM1_GRVWA1_GRVWB1_GSU1_GSUAMB_GSUC0_GSUWGMRR0_GLS0_ISA1201_IU1_K1_LBSPPA256_LBSPPB256_LBSPPM0_LPA16_LPB16_LPM0_LRVW8_LWPMn1_MIAV1_MIWT1_1_MO40_NTn1_NTA0_NTB0_NTC0_NTD0_NTM0_NEPBS0_NLCA1_NLCB1_ONLL0_PGR2_PLR1_PKA0_SIA3_SS0_SU32_SUM1_SUS256_SPO0_SRVW0_SSO0_SVW8_SK0_SKXCCM0_TLDS0_ULSGRO1_USL1_UIOFGRO0_USFGROn1_VSn1_VWA1_VWB1_WSGRA0_WSGRB0_WS32_WG16_2_1_WGM8_WGMXCC1_WGMXCCGn1
    SolutionIndex: 196
    SolutionNameMin: Cijk_Ailk_Bjlk_BBS_BH_Bias_SHB_HA_S_SAB_SCD_SAV_UserArgs_MT32x32x32_MI16x16x1_SN_LDSB1_AFC1_AFEM1_AFEM1_ASEM1_CLR1_CADS0_DTLA0_DTLB0_DTVA0_DTVB0_EPS1_FDSI0_GRPM1_GRVWA1_GRVWB1_GSU1_GSUAMB_GSUC0_GSUWGMRR0_GLS0_ISA1201_IU2_K1_LBSPPA512_LBSPPB512_LBSPPM0_LPA16_LPB16_LPM0_LRVW8_LWPMn1_MIAV1_MIWT1_1_MO40_NTn1_NTA0_NTB0_NTC0_NTD0_NTM0_NEPBS0_NLCA1_NLCB1_ONLL0_PGR1_PLR1_PKA0_SIA2_SS0_SU32_SUM1_SUS256_SPO0_SRVW0_SSO0_SVW8_SK0_SKXCCM0_TLDS0_ULSGRO0_USL1_UIOFGRO0_USFGROn1_VSn1_VWA1_VWB1_WSGRA0_WSGRB0_WS32_WG32_4_1_WGM8_WGMXCC1_WGMXCCGn1
    SolutionIndex: 197
    SolutionNameMin: Cijk_Ailk_Bjlk_BBS_BH_Bias_SHB_HA_S_SAB_SCD_SAV_UserArgs_MT64x64x16_MI16x16x1_SN_LDSB0_AFC1_AFEM1_AFEM1_ASEM1_CLR0_CADS0_DTLA0_DTLB0_DTVA0_DTVB0_EPS0_FDSI0_GRPM1_GRVWA4_GRVWB1_GSU1_GSUAMB_GSUC0_GSUWGMRR0_GLS0_ISA1201_IU1_K1_LBSPPA1024_LBSPPB1024_LBSPPM0_LPA32_LPB32_LPM0_LRVW8_LWPMn1_MIAV1_MIWT2_2_MO40_NTn1_NTA0_NTB0_NTC0_NTD0_NTM0_NEPBS0_NLCA1_NLCB1_ONLL0_PGR2_PLR0_PKA0_SIA3_SS0_SU32_SUM1_SUS256_SPO0_SRVW0_SSO0_SVW8_SK0_SKXCCM0_TLDS0_ULSGRO1_USL1_UIOFGRO0_USFGROn1_VSn1_VWA2_VWB2_WSGRA0_WSGRB0_WS32_WG32_4_1_WGM8_WGMXCC1_WGMXCCGn1
    SolutionIndex: 198
    SolutionNameMin: Cijk_Ailk_Bjlk_BBS_BH_Bias_SHB_HA_S_SAB_SCD_SAV_UserArgs_MT64x64x32_MI16x16x1_SN_LDSB1_AFC1_AFEM1_AFEM1_ASEM1_CLR1_CADS0_DTLA0_DTLB0_DTVA0_DTVB0_EPS0_FDSI0_GRPM1_GRVWA1_GRVWB1_GSU1_GSUAMB_GSUC0_GSUWGMRR0_GLS0_ISA1201_IU2_K1_LBSPPA1024_LBSPPB1024_LBSPPM0_LPA32_LPB32_LPM0_LRVW8_LWPMn1_MIAV1_MIWT2_2_MO40_NTn1_NTA0_NTB0_NTC0_NTD0_NTM0_NEPBS0_NLCA1_NLCB1_ONLL0_PGR2_PLR1_PKA0_SIA2_SS0_SU32_SUM1_SUS256_SPO0_SRVW0_SSO0_SVW8_SK0_SKXCCM0_TLDS0_ULSGRO1_USL1_UIOFGRO0_USFGROn1_VSn1_VWA2_VWB2_WSGRA0_WSGRB0_WS32_WG32_4_1_WGM8_WGMXCC1_WGMXCCGn1
    SolutionIndex: 199
    SolutionNameMin: Cijk_Ailk_Bjlk_BBS_BH_Bias_SHB_HA_S_SAB_SCD_SAV_UserArgs_MT64x64x16_MI16x16x1_SN_LDSB0_AFC1_AFEM1_AFEM1_ASEM1_CLR0_CADS0_DTLA0_DTLB0_DTVA0_DTVB0_EPS0_FDSI0_GRPM1_GRVWA4_GRVWB8_GSU1_GSUAMB_GSUC0_GSUWGMRR0_GLS0_ISA1201_IU1_K1_LBSPPA1024_LBSPPB1024_LBSPPM0_LPA32_LPB32_LPM0_LRVW8_LWPMn1_MIAV1_MIWT2_2_MO40_NTn1_NTA0_NTB0_NTC0_NTD0_NTM0_NEPBS0_NLCA1_NLCB1_ONLL0_PGR2_PLR0_PKA0_SIA3_SS0_SU32_SUM1_SUS256_SPO0_SRVW0_SSO0_SVW8_SK0_SKXCCM0_TLDS0_ULSGRO1_USL1_UIOFGRO0_USFGROn1_VSn1_VWA2_VWB2_WSGRA0_WSGRB0_WS32_WG32_4_1_WGM8_WGMXCC1_WGMXCCGn1
    SolutionIndex: 200
    SolutionNameMin: Cijk_Ailk_Bjlk_BBS_BH_Bias_SHB_HA_S_SAB_SCD_SAV_UserArgs_MT32x32x32_MI16x16x1_SN_LDSB1_AFC1_AFEM1_AFEM1_ASEM1_CLR1_CADS0_DTLA0_DTLB0_DTVA0_DTVB0_EPS1_FDSI0_GRPM1_GRVWA4_GRVWB1_GSU1_GSUAMB_GSUC0_GSUWGMRR0_GLS0_ISA1201_IU2_K1_LBSPPA512_LBSPPB512_LBSPPM0_LPA16_LPB16_LPM0_LRVW8_LWPMn1_MIAV1_MIWT1_1_MO40_NTn1_NTA0_NTB0_NTC0_NTD0_NTM0_NEPBS0_NLCA1_NLCB1_ONLL0_PGR1_PLR1_PKA0_SIA2_SS0_SU32_SUM1_SUS256_SPO0_SRVW0_SSO0_SVW8_SK0_SKXCCM0_TLDS0_ULSGRO0_USL1_UIOFGRO0_USFGROn1_VSn1_VWA1_VWB1_WSGRA0_WSGRB0_WS32_WG32_4_1_WGM8_WGMXCC1_WGMXCCGn1
    SolutionIndex: 201
    SolutionNameMin: Cijk_Ailk_Bjlk_BBS_BH_Bias_SHB_HA_S_SAB_SCD_SAV_UserArgs_MT64x64x16_MI16x16x1_SN_LDSB1_AFC1_AFEM1_AFEM1_ASEM1_CLR1_CADS0_DTLA0_DTLB0_DTVA0_DTVB0_EPS1_FDSI0_GRPM1_GRVWA8_GRVWB4_GSU1_GSUAMB_GSUC0_GSUWGMRR0_GLS0_ISA1201_IU1_K1_LBSPPA1024_LBSPPB1024_LBSPPM0_LPA32_LPB32_LPM0_LRVW8_LWPMn1_MIAV1_MIWT2_2_MO40_NTn1_NTA0_NTB0_NTC0_NTD0_NTM0_NEPBS0_NLCA1_NLCB1_ONLL0_PGR1_PLR1_PKA0_SIA2_SS0_SU32_SUM1_SUS256_SPO0_SRVW0_SSO0_SVW8_SK0_SKXCCM0_TLDS0_ULSGRO0_USL1_UIOFGRO0_USFGROn1_VSn1_VWA2_VWB2_WSGRA0_WSGRB0_WS32_WG32_4_1_WGM8_WGMXCC1_WGMXCCGn1
    SolutionIndex: 202
    SolutionNameMin: Cijk_Ailk_Bjlk_BBS_BH_Bias_SHB_HA_S_SAB_SCD_SAV_UserArgs_MT64x64x32_MI16x16x1_SN_LDSB0_AFC1_AFEM1_AFEM1_ASEM1_CLR1_CADS0_DTLA0_DTLB0_DTVA0_DTVB1_EPS1_FDSI0_GRPM1_GRVWA4_GRVWB8_GSU1_GSUAMB_GSUC0_GSUWGMRR0_GLS0_ISA1201_IU1_K1_LBSPPA1024_LBSPPB0_LBSPPM0_LPA32_LPB0_LPM0_LRVW8_LWPMn1_MIAV1_MIWT2_2_MO40_NTn1_NTA0_NTB0_NTC0_NTD0_NTM0_NEPBS0_NLCA1_NLCB2_ONLL0_PGR1_PLR1_PKA0_SIA3_SS0_SU32_SUM1_SUS256_SPO0_SRVW0_SSO0_SVW8_SK0_SKXCCM0_TLDS0_ULSGRO0_USL1_UIOFGRO0_USFGROn1_VSn1_VWA2_VWB1_WSGRA0_WSGRB0_WS32_WG32_4_1_WGM8_WGMXCC1_WGMXCCGn1
    SolutionIndex: 203
    SolutionNameMin: Cijk_Ailk_Bjlk_BBS_BH_Bias_SHB_HA_S_SAB_SCD_SAV_UserArgs_MT128x32x32_MI16x16x1_SN_LDSB1_AFC1_AFEM1_AFEM1_ASEM1_CLR1_CADS0_DTLA0_DTLB0_DTVA0_DTVB0_EPS0_FDSI0_GRPM1_GRVWA8_GRVWB1_GSU1_GSUAMB_GSUC0_GSUWGMRR0_GLS0_ISA1201_IU2_K1_LBSPPA2048_LBSPPB512_LBSPPM0_LPA0_LPB16_LPM0_LRVW8_LWPMn1_MIAV1_MIWT4_1_MO40_NTn1_NTA0_NTB0_NTC0_NTD0_NTM0_NEPBS0_NLCA1_NLCB1_ONLL0_PGR2_PLR1_PKA0_SIA2_SS1_SU32_SUM1_SUS256_SPO0_SRVW0_SSO0_SVW4_SK0_SKXCCM0_TLDS0_ULSGRO1_USL1_UIOFGRO0_USFGROn1_VSn1_VWA4_VWB1_WSGRA0_WSGRB0_WS32_WG32_4_1_WGM8_WGMXCC1_WGMXCCGn1
    SolutionIndex: 204
    SolutionNameMin: Cijk_Ailk_Bjlk_BBS_BH_Bias_SHB_HA_S_SAB_SCD_SAV_UserArgs_MT32x32x32_MI16x16x1_SN_LDSB0_AFC1_AFEM1_AFEM1_ASEM1_CLR1_CADS0_DTLA0_DTLB0_DTVA0_DTVB0_EPS0_FDSI0_GRPM1_GRVWA1_GRVWB4_GSU1_GSUAMB_GSUC0_GSUWGMRR0_GLS0_ISA1201_IU1_K1_LBSPPA512_LBSPPB512_LBSPPM0_LPA16_LPB16_LPM0_LRVW8_LWPMn1_MIAV1_MIWT1_1_MO40_NTn1_NTA0_NTB0_NTC0_NTD0_NTM0_NEPBS0_NLCA1_NLCB1_ONLL0_PGR2_PLR1_PKA0_SIA3_SS0_SU32_SUM1_SUS256_SPO0_SRVW0_SSO0_SVW8_SK0_SKXCCM0_TLDS0_ULSGRO0_USL1_UIOFGRO0_USFGROn1_VSn1_VWA1_VWB1_WSGRA0_WSGRB0_WS32_WG32_4_1_WGM8_WGMXCC1_WGMXCCGn1
    SolutionIndex: 205
    SolutionNameMin: Cijk_Ailk_Bjlk_BBS_BH_Bias_SHB_HA_S_SAB_SCD_SAV_UserArgs_MT64x64x32_MI16x16x1_SN_LDSB0_AFC1_AFEM1_AFEM1_ASEM1_CLR1_CADS0_DTLA0_DTLB0_DTVA0_DTVB0_EPS0_FDSI0_GRPM1_GRVWA8_GRVWB4_GSU1_GSUAMB_GSUC0_GSUWGMRR0_GLS0_ISA1201_IU1_K1_LBSPPA1024_LBSPPB1024_LBSPPM0_LPA32_LPB32_LPM0_LRVW8_LWPMn1_MIAV1_MIWT2_2_MO40_NTn1_NTA0_NTB0_NTC0_NTD0_NTM0_NEPBS0_NLCA1_NLCB1_ONLL0_PGR2_PLR1_PKA0_SIA3_SS0_SU32_SUM1_SUS256_SPO0_SRVW0_SSO0_SVW8_SK0_SKXCCM0_TLDS0_ULSGRO1_USL1_UIOFGRO0_USFGROn1_VSn1_VWA2_VWB2_WSGRA0_WSGRB0_WS32_WG32_4_1_WGM8_WGMXCC1_WGMXCCGn1
    SolutionIndex: 206
    SolutionNameMin: Cijk_Ailk_Bjlk_BBS_BH_Bias_SHB_HA_S_SAB_SCD_SAV_UserArgs_MT64x64x16_MI16x16x1_SN_LDSB0_AFC1_AFEM1_AFEM1_ASEM1_CLR0_CADS0_DTLA0_DTLB0_DTVA0_DTVB0_EPS0_FDSI0_GRPM1_GRVWA4_GRVWB4_GSU1_GSUAMB_GSUC0_GSUWGMRR0_GLS0_ISA1201_IU1_K1_LBSPPA1024_LBSPPB1024_LBSPPM0_LPA32_LPB32_LPM0_LRVW8_LWPMn1_MIAV1_MIWT2_2_MO40_NTn1_NTA0_NTB0_NTC0_NTD0_NTM0_NEPBS0_NLCA1_NLCB1_ONLL0_PGR2_PLR0_PKA0_SIA3_SS0_SU32_SUM1_SUS256_SPO0_SRVW0_SSO0_SVW8_SK0_SKXCCM0_TLDS0_ULSGRO1_USL1_UIOFGRO0_USFGROn1_VSn1_VWA2_VWB2_WSGRA0_WSGRB0_WS32_WG32_4_1_WGM8_WGMXCC1_WGMXCCGn1
    SolutionIndex: 207
    SolutionNameMin: Cijk_Ailk_Bjlk_BBS_BH_Bias_SHB_HA_S_SAB_SCD_SAV_UserArgs_MT64x64x32_MI16x16x1_SN_LDSB0_AFC1_AFEM1_AFEM1_ASEM1_CLR1_CADS0_DTLA0_DTLB0_DTVA0_DTVB0_EPS0_FDSI0_GRPM1_GRVWA8_GRVWB8_GSU1_GSUAMB_GSUC0_GSUWGMRR0_GLS0_ISA1201_IU1_K1_LBSPPA1024_LBSPPB1024_LBSPPM0_LPA32_LPB32_LPM0_LRVW8_LWPMn1_MIAV1_MIWT2_2_MO40_NTn1_NTA0_NTB0_NTC0_NTD0_NTM0_NEPBS0_NLCA1_NLCB1_ONLL0_PGR2_PLR1_PKA0_SIA3_SS0_SU32_SUM1_SUS256_SPO0_SRVW0_SSO0_SVW8_SK0_SKXCCM0_TLDS0_ULSGRO0_USL1_UIOFGRO0_USFGROn1_VSn1_VWA2_VWB2_WSGRA0_WSGRB0_WS32_WG32_4_1_WGM8_WGMXCC1_WGMXCCGn1
    SolutionIndex: 208
    SolutionNameMin: Cijk_Ailk_Bjlk_BBS_BH_Bias_SHB_HA_S_SAB_SCD_SAV_UserArgs_MT64x64x64_MI16x16x1_SN_LDSB0_AFC1_AFEM1_AFEM1_ASEM1_CLR1_CADS0_DTLA0_DTLB0_DTVA0_DTVB1_EPS1_FDSI0_GRPM1_GRVWA8_GRVWB8_GSU1_GSUAMB_GSUC0_GSUWGMRR0_GLS0_ISA1201_IU1_K1_LBSPPA1024_LBSPPB0_LBSPPM0_LPA32_LPB0_LPM0_LRVW8_LWPMn1_MIAV1_MIWT2_2_MO40_NTn1_NTA0_NTB0_NTC0_NTD0_NTM0_NEPBS0_NLCA1_NLCB4_ONLL0_PGR1_PLR1_PKA0_SIA3_SS0_SU32_SUM1_SUS256_SPO0_SRVW0_SSO0_SVW8_SK0_SKXCCM0_TLDS0_ULSGRO0_USL1_UIOFGRO0_USFGROn1_VSn1_VWA2_VWB1_WSGRA0_WSGRB0_WS32_WG32_4_1_WGM8_WGMXCC1_WGMXCCGn1
    SolutionIndex: 209
    SolutionNameMin: Cijk_Ailk_Bjlk_BBS_BH_Bias_SHB_HA_S_SAB_SCD_SAV_UserArgs_MT64x64x32_MI16x16x1_SN_LDSB0_AFC1_AFEM1_AFEM1_ASEM1_CLR1_CADS0_DTLA0_DTLB0_DTVA0_DTVB1_EPS1_FDSI0_GRPM1_GRVWA8_GRVWB8_GSU1_GSUAMB_GSUC0_GSUWGMRR0_GLS0_ISA1201_IU1_K1_LBSPPA1024_LBSPPB0_LBSPPM0_LPA32_LPB0_LPM0_LRVW8_LWPMn1_MIAV1_MIWT2_2_MO40_NTn1_NTA0_NTB0_NTC0_NTD0_NTM0_NEPBS0_NLCA1_NLCB2_ONLL0_PGR1_PLR1_PKA0_SIA3_SS0_SU32_SUM1_SUS256_SPO0_SRVW0_SSO0_SVW8_SK0_SKXCCM0_TLDS0_ULSGRO0_USL1_UIOFGRO0_USFGROn1_VSn1_VWA2_VWB1_WSGRA0_WSGRB0_WS32_WG32_4_1_WGM8_WGMXCC1_WGMXCCGn1
    SolutionIndex: 210
    SolutionNameMin: Cijk_Ailk_Bjlk_BBS_BH_Bias_SHB_HA_S_SAB_SCD_SAV_UserArgs_MT64x128x16_MI16x16x1_SN_LDSB0_AFC1_AFEM1_AFEM1_ASEM1_CLR1_CADS0_DTLA0_DTLB0_DTVA1_DTVB1_EPS0_FDSI0_GRPM1_GRVWA8_GRVWB8_GSU1_GSUAMB_GSUC0_GSUWGMRR0_GLS0_ISA1201_IU1_K1_LBSPPA0_LBSPPB0_LBSPPM0_LPA0_LPB0_LPM0_LRVW8_LWPMn1_MIAV1_MIWT1_8_MO40_NTn1_NTA0_NTB0_NTC0_NTD0_NTM0_NEPBS0_NLCA1_NLCB1_ONLL0_PGR1_PLR0_PKA0_SIA3_SS0_SU32_SUM1_SUS256_SPO0_SRVW0_SSO0_SVW8_SK0_SKXCCM0_TLDS0_ULSGRO0_USL1_UIOFGRO0_USFGROn1_VSn1_VWA1_VWB1_WSGRA0_WSGRB0_WS32_WG64_2_1_WGM8_WGMXCC1_WGMXCCGn1
    SolutionIndex: 211
    SolutionNameMin: Cijk_Ailk_Bjlk_BBS_BH_Bias_SHB_HA_S_SAB_SCD_SAV_UserArgs_MT128x64x16_MI16x16x1_SN_LDSB0_AFC1_AFEM1_AFEM1_ASEM1_CLR1_CADS0_DTLA0_DTLB0_DTVA1_DTVB1_EPS0_FDSI0_GRPM1_GRVWA8_GRVWB8_GSU1_GSUAMB_GSUC0_GSUWGMRR0_GLS0_ISA1201_IU1_K1_LBSPPA0_LBSPPB0_LBSPPM0_LPA0_LPB0_LPM0_LRVW8_LWPMn1_MIAV1_MIWT8_1_MO40_NTn1_NTA0_NTB0_NTC0_NTD0_NTM0_NEPBS0_NLCA1_NLCB1_ONLL0_PGR1_PLR0_PKA0_SIA3_SS0_SU32_SUM1_SUS256_SPO0_SRVW0_SSO0_SVW8_SK0_SKXCCM0_TLDS0_ULSGRO0_USL1_UIOFGRO0_USFGROn1_VSn1_VWA1_VWB1_WSGRA0_WSGRB0_WS32_WG16_8_1_WGM8_WGMXCC1_WGMXCCGn1
    SolutionIndex: 212
    SolutionNameMin: Cijk_Ailk_Bjlk_BBS_BH_Bias_SHB_HA_S_SAB_SCD_SAV_UserArgs_MT32x32x32_MI16x16x1_SN_LDSB0_AFC1_AFEM1_AFEM1_ASEM1_CLR1_CADS0_DTLA0_DTLB0_DTVA1_DTVB0_EPS0_FDSI0_GRPM1_GRVWA8_GRVWB1_GSU1_GSUAMB_GSUC0_GSUWGMRR0_GLS0_ISA1201_IU1_K1_LBSPPA0_LBSPPB512_LBSPPM0_LPA0_LPB16_LPM0_LRVW8_LWPMn1_MIAV1_MIWT1_1_MO40_NTn1_NTA0_NTB0_NTC0_NTD0_NTM0_NEPBS0_NLCA1_NLCB1_ONLL0_PGR2_PLR1_PKA0_SIA3_SS0_SU32_SUM1_SUS256_SPO0_SRVW0_SSO0_SVW8_SK0_SKXCCM0_TLDS0_ULSGRO0_USL1_UIOFGRO0_USFGROn1_VSn1_VWA1_VWB1_WSGRA0_WSGRB0_WS32_WG32_4_1_WGM8_WGMXCC1_WGMXCCGn1
    SolutionIndex: 213
    SolutionNameMin: Cijk_Ailk_Bjlk_BBS_BH_Bias_SHB_HA_S_SAB_SCD_SAV_UserArgs_MT128x32x16_MI16x16x1_SN_LDSB0_AFC1_AFEM1_AFEM1_ASEM1_CLR0_CADS0_DTLA0_DTLB0_DTVA0_DTVB0_EPS0_FDSI0_GRPM1_GRVWA8_GRVWB4_GSU1_GSUAMB_GSUC0_GSUWGMRR0_GLS0_ISA1201_IU1_K1_LBSPPA2048_LBSPPB512_LBSPPM0_LPA0_LPB16_LPM0_LRVW8_LWPMn1_MIAV1_MIWT4_1_MO40_NTn1_NTA0_NTB0_NTC0_NTD0_NTM0_NEPBS0_NLCA1_NLCB1_ONLL0_PGR2_PLR0_PKA0_SIA3_SS1_SU32_SUM1_SUS256_SPO0_SRVW0_SSO0_SVW4_SK0_SKXCCM0_TLDS0_ULSGRO1_USL1_UIOFGRO0_USFGROn1_VSn1_VWA4_VWB1_WSGRA0_WSGRB0_WS32_WG32_4_1_WGM8_WGMXCC1_WGMXCCGn1
    SolutionIndex: 214
    SolutionNameMin: Cijk_Ailk_Bjlk_BBS_BH_Bias_SHB_HA_S_SAB_SCD_SAV_UserArgs_MT64x64x64_MI16x16x1_SN_LDSB1_AFC1_AFEM1_AFEM1_ASEM1_CLR1_CADS0_DTLA0_DTLB0_DTVA0_DTVB0_EPS1_FDSI0_GRPM1_GRVWA4_GRVWB4_GSU1_GSUAMB_GSUC0_GSUWGMRR0_GLS0_ISA1201_IU4_K1_LBSPPA1024_LBSPPB1024_LBSPPM0_LPA32_LPB32_LPM0_LRVW8_LWPMn1_MIAV1_MIWT2_2_MO40_NTn1_NTA0_NTB0_NTC0_NTD0_NTM0_NEPBS0_NLCA1_NLCB1_ONLL0_PGR1_PLR1_PKA0_SIA2_SS0_SU32_SUM1_SUS256_SPO0_SRVW0_SSO0_SVW8_SK0_SKXCCM0_TLDS0_ULSGRO0_USL1_UIOFGRO0_USFGROn1_VSn1_VWA2_VWB2_WSGRA0_WSGRB0_WS32_WG32_4_1_WGM8_WGMXCC1_WGMXCCGn1
    SolutionIndex: 215
    SolutionNameMin: Cijk_Ailk_Bjlk_BBS_BH_Bias_SHB_HA_S_SAB_SCD_SAV_UserArgs_MT64x64x32_MI16x16x1_SN_LDSB1_AFC1_AFEM1_AFEM1_ASEM1_CLR1_CADS0_DTLA0_DTLB0_DTVA0_DTVB0_EPS1_FDSI0_GRPM1_GRVWA4_GRVWB8_GSU1_GSUAMB_GSUC0_GSUWGMRR0_GLS0_ISA1201_IU2_K1_LBSPPA1024_LBSPPB1024_LBSPPM0_LPA32_LPB32_LPM0_LRVW8_LWPMn1_MIAV1_MIWT2_2_MO40_NTn1_NTA0_NTB0_NTC0_NTD0_NTM0_NEPBS0_NLCA1_NLCB1_ONLL0_PGR1_PLR1_PKA0_SIA2_SS0_SU32_SUM1_SUS256_SPO0_SRVW0_SSO0_SVW8_SK0_SKXCCM0_TLDS0_ULSGRO0_USL1_UIOFGRO0_USFGROn1_VSn1_VWA2_VWB2_WSGRA0_WSGRB0_WS32_WG32_4_1_WGM8_WGMXCC1_WGMXCCGn1
    SolutionIndex: 216
    SolutionNameMin: Cijk_Ailk_Bjlk_BBS_BH_Bias_SHB_HA_S_SAB_SCD_SAV_UserArgs_MT64x64x16_MI16x16x1_SN_LDSB0_AFC1_AFEM1_AFEM1_ASEM1_CLR0_CADS0_DTLA0_DTLB0_DTVA0_DTVB0_EPS0_FDSI0_GRPM1_GRVWA8_GRVWB8_GSU1_GSUAMB_GSUC0_GSUWGMRR0_GLS0_ISA1201_IU1_K1_LBSPPA1024_LBSPPB1024_LBSPPM0_LPA32_LPB32_LPM0_LRVW8_LWPMn1_MIAV1_MIWT2_2_MO40_NTn1_NTA0_NTB0_NTC0_NTD0_NTM0_NEPBS0_NLCA1_NLCB1_ONLL0_PGR2_PLR0_PKA0_SIA3_SS0_SU32_SUM1_SUS256_SPO0_SRVW0_SSO0_SVW8_SK0_SKXCCM0_TLDS0_ULSGRO1_USL1_UIOFGRO0_USFGROn1_VSn1_VWA2_VWB2_WSGRA0_WSGRB0_WS32_WG32_4_1_WGM8_WGMXCC1_WGMXCCGn1
    SolutionIndex: 217
    SolutionNameMin: Cijk_Ailk_Bjlk_BBS_BH_Bias_SHB_HA_S_SAB_SCD_SAV_UserArgs_MT64x128x16_MI16x16x1_SN_LDSB1_AFC1_AFEM1_AFEM1_ASEM1_CLR1_CADS0_DTLA0_DTLB0_DTVA0_DTVB0_EPS1_FDSI0_GRPM1_GRVWA1_GRVWB1_GSU1_GSUAMB_GSUC0_GSUWGMRR0_GLS0_ISA1201_IU1_K1_LBSPPA1024_LBSPPB2048_LBSPPM0_LPA16_LPB0_LPM0_LRVW8_LWPMn1_MIAV1_MIWT1_8_MO40_NTn1_NTA0_NTB0_NTC0_NTD0_NTM0_NEPBS0_NLCA1_NLCB1_ONLL0_PGR1_PLR1_PKA0_SIA2_SS0_SU32_SUM1_SUS256_SPO0_SRVW0_SSO0_SVW8_SK0_SKXCCM0_TLDS0_ULSGRO0_USL1_UIOFGRO0_USFGROn1_VSn1_VWA1_VWB8_WSGRA0_WSGRB0_WS32_WG64_2_1_WGM8_WGMXCC1_WGMXCCGn1
    SolutionIndex: 218
    SolutionNameMin: Cijk_Ailk_Bjlk_BBS_BH_Bias_SHB_HA_S_SAB_SCD_SAV_UserArgs_MT64x128x16_MI16x16x1_SN_LDSB1_AFC1_AFEM1_AFEM1_ASEM1_CLR1_CADS0_DTLA0_DTLB0_DTVA0_DTVB0_EPS1_FDSI0_GRPM1_GRVWA1_GRVWB4_GSU1_GSUAMB_GSUC0_GSUWGMRR0_GLS0_ISA1201_IU1_K1_LBSPPA1024_LBSPPB2048_LBSPPM0_LPA16_LPB0_LPM0_LRVW8_LWPMn1_MIAV1_MIWT1_8_MO40_NTn1_NTA0_NTB0_NTC0_NTD0_NTM0_NEPBS0_NLCA1_NLCB1_ONLL0_PGR1_PLR1_PKA0_SIA2_SS0_SU32_SUM1_SUS256_SPO0_SRVW0_SSO0_SVW8_SK0_SKXCCM0_TLDS0_ULSGRO0_USL1_UIOFGRO0_USFGROn1_VSn1_VWA1_VWB8_WSGRA0_WSGRB0_WS32_WG64_2_1_WGM8_WGMXCC1_WGMXCCGn1
    SolutionIndex: 219
    SolutionNameMin: Cijk_Ailk_Bjlk_BBS_BH_Bias_SHB_HA_S_SAB_SCD_SAV_UserArgs_MT32x32x64_MI16x16x1_SN_LDSB0_AFC1_AFEM1_AFEM1_ASEM1_CLR1_CADS0_DTLA0_DTLB0_DTVA1_DTVB0_EPS1_FDSI0_GRPM1_GRVWA8_GRVWB4_GSU1_GSUAMB_GSUC0_GSUWGMRR0_GLS0_ISA1201_IU1_K1_LBSPPA0_LBSPPB512_LBSPPM0_LPA0_LPB16_LPM0_LRVW8_LWPMn1_MIAV1_MIWT1_1_MO40_NTn1_NTA0_NTB0_NTC0_NTD0_NTM0_NEPBS0_NLCA1_NLCB1_ONLL0_PGR1_PLR1_PKA0_SIA3_SS0_SU32_SUM1_SUS256_SPO0_SRVW0_SSO0_SVW8_SK0_SKXCCM0_TLDS0_ULSGRO0_USL1_UIOFGRO0_USFGROn1_VSn1_VWA1_VWB1_WSGRA0_WSGRB0_WS32_WG32_4_1_WGM8_WGMXCC1_WGMXCCGn1
    SolutionIndex: 220
    SolutionNameMin: Cijk_Ailk_Bjlk_BBS_BH_Bias_SHB_HA_S_SAB_SCD_SAV_UserArgs_MT64x64x16_MI16x16x1_SN_LDSB1_AFC1_AFEM1_AFEM1_ASEM1_CLR1_CADS0_DTLA0_DTLB0_DTVA0_DTVB0_EPS1_FDSI0_GRPM1_GRVWA4_GRVWB8_GSU1_GSUAMB_GSUC0_GSUWGMRR0_GLS0_ISA1201_IU1_K1_LBSPPA1024_LBSPPB1024_LBSPPM0_LPA32_LPB32_LPM0_LRVW8_LWPMn1_MIAV1_MIWT2_2_MO40_NTn1_NTA0_NTB0_NTC0_NTD0_NTM0_NEPBS0_NLCA1_NLCB1_ONLL0_PGR1_PLR1_PKA0_SIA2_SS0_SU32_SUM1_SUS256_SPO0_SRVW0_SSO0_SVW8_SK0_SKXCCM0_TLDS0_ULSGRO0_USL1_UIOFGRO0_USFGROn1_VSn1_VWA2_VWB2_WSGRA0_WSGRB0_WS32_WG32_4_1_WGM8_WGMXCC1_WGMXCCGn1
    SolutionIndex: 221
    SolutionNameMin: Cijk_Ailk_Bjlk_BBS_BH_Bias_SHB_HA_S_SAB_SCD_SAV_UserArgs_MT128x64x16_MI16x16x1_SN_LDSB1_AFC1_AFEM1_AFEM1_ASEM1_CLR1_CADS0_DTLA0_DTLB0_DTVA0_DTVB0_EPS1_FDSI0_GRPM1_GRVWA1_GRVWB1_GSU1_GSUAMB_GSUC0_GSUWGMRR0_GLS0_ISA1201_IU1_K1_LBSPPA2048_LBSPPB1024_LBSPPM0_LPA0_LPB16_LPM0_LRVW8_LWPMn1_MIAV1_MIWT8_1_MO40_NTn1_NTA0_NTB0_NTC0_NTD0_NTM0_NEPBS0_NLCA1_NLCB1_ONLL0_PGR1_PLR1_PKA0_SIA2_SS1_SU32_SUM1_SUS256_SPO0_SRVW0_SSO0_SVW8_SK0_SKXCCM0_TLDS0_ULSGRO0_USL1_UIOFGRO0_USFGROn1_VSn1_VWA8_VWB1_WSGRA0_WSGRB0_WS32_WG16_8_1_WGM8_WGMXCC1_WGMXCCGn1
    SolutionIndex: 222
    SolutionNameMin: Cijk_Ailk_Bjlk_BBS_BH_Bias_SHB_HA_S_SAB_SCD_SAV_UserArgs_MT32x128x64_MI16x16x1_SN_LDSB0_AFC1_AFEM1_AFEM1_ASEM1_CLR1_CADS0_DTLA0_DTLB0_DTVA0_DTVB1_EPS0_FDSI0_GRPM1_GRVWA4_GRVWB8_GSU1_GSUAMB_GSUC0_GSUWGMRR0_GLS0_ISA1201_IU1_K1_LBSPPA512_LBSPPB0_LBSPPM0_LPA16_LPB0_LPM0_LRVW8_LWPMn1_MIAV1_MIWT1_4_MO40_NTn1_NTA0_NTB0_NTC0_NTD0_NTM0_NEPBS0_NLCA1_NLCB4_ONLL0_PGR2_PLR1_PKA0_SIA3_SS0_SU32_SUM1_SUS256_SPO0_SRVW0_SSO0_SVW8_SK0_SKXCCM0_TLDS0_ULSGRO0_USL1_UIOFGRO0_USFGROn1_VSn1_VWA1_VWB1_WSGRA0_WSGRB0_WS32_WG32_4_1_WGM8_WGMXCC1_WGMXCCGn1
    SolutionIndex: 223
    SolutionNameMin: Cijk_Ailk_Bjlk_BBS_BH_Bias_SHB_HA_S_SAB_SCD_SAV_UserArgs_MT64x64x32_MI16x16x1_SN_LDSB0_AFC1_AFEM1_AFEM1_ASEM1_CLR1_CADS0_DTLA0_DTLB0_DTVA0_DTVB0_EPS1_FDSI0_GRPM1_GRVWA1_GRVWB1_GSU1_GSUAMB_GSUC0_GSUWGMRR0_GLS0_ISA1201_IU1_K1_LBSPPA1024_LBSPPB1024_LBSPPM0_LPA32_LPB32_LPM0_LRVW8_LWPMn1_MIAV1_MIWT2_2_MO40_NTn1_NTA0_NTB0_NTC0_NTD0_NTM0_NEPBS0_NLCA1_NLCB1_ONLL0_PGR1_PLR1_PKA0_SIA3_SS0_SU32_SUM1_SUS256_SPO0_SRVW0_SSO0_SVW8_SK0_SKXCCM0_TLDS0_ULSGRO0_USL1_UIOFGRO0_USFGROn1_VSn1_VWA2_VWB2_WSGRA0_WSGRB0_WS32_WG32_4_1_WGM8_WGMXCC1_WGMXCCGn1
    SolutionIndex: 224
    SolutionNameMin: Cijk_Ailk_Bjlk_BBS_BH_Bias_SHB_HA_S_SAB_SCD_SAV_UserArgs_MT128x64x32_MI16x16x1_SN_LDSB0_AFC1_AFEM1_AFEM1_ASEM1_CLR1_CADS0_DTLA0_DTLB0_DTVA1_DTVB0_EPS0_FDSI0_GRPM1_GRVWA8_GRVWB8_GSU1_GSUAMB_GSUC0_GSUWGMRR0_GLS0_ISA1201_IU1_K1_LBSPPA0_LBSPPB1024_LBSPPM0_LPA0_LPB16_LPM0_LRVW8_LWPMn1_MIAV1_MIWT8_1_MO40_NTn1_NTA0_NTB0_NTC0_NTD0_NTM0_NEPBS0_NLCA2_NLCB1_ONLL0_PGR2_PLR1_PKA0_SIA3_SS0_SU32_SUM1_SUS256_SPO0_SRVW0_SSO0_SVW8_SK0_SKXCCM0_TLDS0_ULSGRO0_USL1_UIOFGRO0_USFGROn1_VSn1_VWA1_VWB1_WSGRA0_WSGRB0_WS32_WG16_8_1_WGM8_WGMXCC1_WGMXCCGn1
    SolutionIndex: 225
    SolutionNameMin: Cijk_Ailk_Bjlk_BBS_BH_Bias_SHB_HA_S_SAB_SCD_SAV_UserArgs_MT32x32x32_MI16x16x1_SN_LDSB0_AFC1_AFEM1_AFEM1_ASEM1_CLR1_CADS0_DTLA0_DTLB0_DTVA0_DTVB0_EPS0_FDSI0_GRPM1_GRVWA4_GRVWB4_GSU1_GSUAMB_GSUC0_GSUWGMRR0_GLS0_ISA1201_IU1_K1_LBSPPA512_LBSPPB512_LBSPPM0_LPA16_LPB16_LPM0_LRVW8_LWPMn1_MIAV1_MIWT1_1_MO40_NTn1_NTA0_NTB0_NTC0_NTD0_NTM0_NEPBS0_NLCA1_NLCB1_ONLL0_PGR2_PLR1_PKA0_SIA3_SS0_SU32_SUM1_SUS256_SPO0_SRVW0_SSO0_SVW8_SK0_SKXCCM0_TLDS0_ULSGRO1_USL1_UIOFGRO0_USFGROn1_VSn1_VWA1_VWB1_WSGRA0_WSGRB0_WS32_WG32_4_1_WGM8_WGMXCC1_WGMXCCGn1
    SolutionIndex: 227
    SolutionNameMin: Cijk_Ailk_Bjlk_BBS_BH_Bias_SHB_HA_S_SAB_SCD_SAV_UserArgs_MT64x64x32_MI16x16x1_SN_LDSB0_AFC1_AFEM1_AFEM1_ASEM1_CLR1_CADS0_DTLA0_DTLB0_DTVA0_DTVB0_EPS0_FDSI0_GRPM1_GRVWA4_GRVWB4_GSU1_GSUAMB_GSUC0_GSUWGMRR0_GLS0_ISA1201_IU1_K1_LBSPPA1024_LBSPPB1024_LBSPPM0_LPA32_LPB32_LPM0_LRVW8_LWPMn1_MIAV1_MIWT2_2_MO40_NTn1_NTA0_NTB0_NTC0_NTD0_NTM0_NEPBS0_NLCA1_NLCB1_ONLL0_PGR2_PLR1_PKA0_SIA3_SS0_SU32_SUM1_SUS256_SPO0_SRVW0_SSO0_SVW8_SK0_SKXCCM0_TLDS0_ULSGRO1_USL1_UIOFGRO0_USFGROn1_VSn1_VWA2_VWB2_WSGRA0_WSGRB0_WS32_WG32_4_1_WGM8_WGMXCC1_WGMXCCGn1
    SolutionIndex: 230
    SolutionNameMin: Cijk_Ailk_Bjlk_BBS_BH_Bias_SHB_HA_S_SAB_SCD_SAV_UserArgs_MT64x64x32_MI16x16x1_SN_LDSB0_AFC1_AFEM1_AFEM1_ASEM1_CLR1_CADS0_DTLA0_DTLB0_DTVA1_DTVB0_EPS0_FDSI0_GRPM1_GRVWA8_GRVWB4_GSU1_GSUAMB_GSUC0_GSUWGMRR0_GLS0_ISA1201_IU1_K1_LBSPPA0_LBSPPB1024_LBSPPM0_LPA0_LPB32_LPM0_LRVW8_LWPMn1_MIAV1_MIWT2_2_MO40_NTn1_NTA0_NTB0_NTC0_NTD0_NTM0_NEPBS0_NLCA2_NLCB1_ONLL0_PGR2_PLR1_PKA0_SIA3_SS0_SU32_SUM1_SUS256_SPO0_SRVW0_SSO0_SVW8_SK0_SKXCCM0_TLDS0_ULSGRO0_USL1_UIOFGRO0_USFGROn1_VSn1_VWA1_VWB2_WSGRA0_WSGRB0_WS32_WG32_4_1_WGM8_WGMXCC1_WGMXCCGn1
    SolutionIndex: 238
    SolutionNameMin: Cijk_Ailk_Bjlk_BBS_BH_Bias_SHB_HA_S_SAB_SCD_SAV_UserArgs_MT64x128x32_MI16x16x1_SN_LDSB0_AFC1_AFEM1_AFEM1_ASEM1_CLR1_CADS0_DTLA0_DTLB0_DTVA0_DTVB1_EPS1_FDSI0_GRPM1_GRVWA8_GRVWB8_GSU1_GSUAMB_GSUC0_GSUWGMRR0_GLS0_ISA1201_IU1_K1_LBSPPA1024_LBSPPB0_LBSPPM0_LPA16_LPB0_LPM0_LRVW8_LWPMn1_MIAV1_MIWT1_8_MO40_NTn1_NTA0_NTB0_NTC0_NTD0_NTM0_NEPBS0_NLCA1_NLCB2_ONLL0_PGR1_PLR1_PKA0_SIA3_SS0_SU32_SUM1_SUS256_SPO0_SRVW0_SSO0_SVW8_SK0_SKXCCM0_TLDS0_ULSGRO0_USL1_UIOFGRO0_USFGROn1_VSn1_VWA1_VWB1_WSGRA0_WSGRB0_WS32_WG64_2_1_WGM8_WGMXCC1_WGMXCCGn1
    SolutionIndex: 239
    SolutionNameMin: Cijk_Ailk_Bjlk_BBS_BH_Bias_SHB_HA_S_SAB_SCD_SAV_UserArgs_MT16x256x16_MI16x16x1_SN_LDSB0_AFC1_AFEM1_AFEM1_ASEM1_CLR1_CADS0_DTLA0_DTLB0_DTVA1_DTVB1_EPS0_FDSI0_GRPM1_GRVWA8_GRVWB8_GSU1_GSUAMB_GSUC0_GSUWGMRR0_GLS0_ISA1201_IU1_K1_LBSPPA0_LBSPPB0_LBSPPM0_LPA0_LPB0_LPM0_LRVW8_LWPMn1_MIAV1_MIWT1_8_MO40_NTn1_NTA0_NTB0_NTC0_NTD0_NTM0_NEPBS0_NLCA1_NLCB1_ONLL0_PGR1_PLR0_PKA0_SIA3_SS0_SU32_SUM1_SUS256_SPO0_SRVW0_SSO0_SVW8_SK0_SKXCCM0_TLDS0_ULSGRO0_USL1_UIOFGRO0_USFGROn1_VSn1_VWA1_VWB1_WSGRA0_WSGRB0_WS32_WG16_4_1_WGM8_WGMXCC1_WGMXCCGn1
    SolutionIndex: 241
    SolutionNameMin: Cijk_Ailk_Bjlk_BBS_BH_Bias_SHB_HA_S_SAB_SCD_SAV_UserArgs_MT32x128x16_MI16x16x1_SN_LDSB0_AFC1_AFEM1_AFEM1_ASEM1_CLR1_CADS0_DTLA0_DTLB0_DTVA1_DTVB1_EPS0_FDSI0_GRPM1_GRVWA8_GRVWB8_GSU1_GSUAMB_GSUC0_GSUWGMRR0_GLS0_ISA1201_IU1_K1_LBSPPA0_LBSPPB0_LBSPPM0_LPA0_LPB0_LPM0_LRVW8_LWPMn1_MIAV1_MIWT1_4_MO40_NTn1_NTA0_NTB0_NTC0_NTD0_NTM0_NEPBS0_NLCA1_NLCB1_ONLL0_PGR1_PLR0_PKA0_SIA3_SS0_SU32_SUM1_SUS256_SPO0_SRVW0_SSO0_SVW8_SK0_SKXCCM0_TLDS0_ULSGRO0_USL1_UIOFGRO0_USFGROn1_VSn1_VWA1_VWB1_WSGRA0_WSGRB0_WS32_WG32_4_1_WGM8_WGMXCC1_WGMXCCGn1
    SolutionIndex: 242
    SolutionNameMin: Cijk_Ailk_Bjlk_BBS_BH_Bias_SHB_HA_S_SAB_SCD_SAV_UserArgs_MT16x128x16_MI16x16x1_SN_LDSB0_AFC1_AFEM1_AFEM1_ASEM1_CLR1_CADS0_DTLA0_DTLB0_DTVA1_DTVB1_EPS0_FDSI0_GRPM1_GRVWA8_GRVWB8_GSU1_GSUAMB_GSUC0_GSUWGMRR0_GLS0_ISA1201_IU1_K1_LBSPPA0_LBSPPB0_LBSPPM0_LPA0_LPB0_LPM0_LRVW8_LWPMn1_MIAV1_MIWT1_8_MO40_NTn1_NTA0_NTB0_NTC0_NTD0_NTM0_NEPBS0_NLCA1_NLCB1_ONLL0_PGR1_PLR0_PKA0_SIA3_SS0_SU32_SUM1_SUS256_SPO0_SRVW0_SSO0_SVW8_SK0_SKXCCM0_TLDS0_ULSGRO0_USL1_UIOFGRO0_USFGROn1_VSn1_VWA1_VWB1_WSGRA0_WSGRB0_WS32_WG16_2_1_WGM8_WGMXCC1_WGMXCCGn1
    SolutionIndex: 244
    SolutionNameMin: Cijk_Ailk_Bjlk_BBS_BH_Bias_SHB_HA_S_SAB_SCD_SAV_UserArgs_MT32x16x64_MI16x16x1_SN_LDSB1_AFC1_AFEM1_AFEM1_ASEM1_CLR1_CADS0_DTLA0_DTLB0_DTVA0_DTVB0_EPS1_FDSI0_GRPM1_GRVWA4_GRVWB8_GSU1_GSUAMB_GSUC0_GSUWGMRR0_GLS0_ISA1201_IU4_K1_LBSPPA512_LBSPPB256_LBSPPM0_LPA16_LPB16_LPM0_LRVW8_LWPMn1_MIAV1_MIWT1_1_MO40_NTn1_NTA0_NTB0_NTC0_NTD0_NTM0_NEPBS0_NLCA1_NLCB1_ONLL0_PGR1_PLR1_PKA0_SIA2_SS0_SU32_SUM1_SUS256_SPO0_SRVW0_SSO0_SVW8_SK0_SKXCCM0_TLDS0_ULSGRO0_USL1_UIOFGRO0_USFGROn1_VSn1_VWA1_VWB1_WSGRA0_WSGRB0_WS32_WG32_2_1_WGM8_WGMXCC1_WGMXCCGn1
    SolutionIndex: 245
    SolutionNameMin: Cijk_Ailk_Bjlk_BBS_BH_Bias_SHB_HA_S_SAB_SCD_SAV_UserArgs_MT32x16x64_MI16x16x1_SN_LDSB0_AFC1_AFEM1_AFEM1_ASEM1_CLR1_CADS0_DTLA0_DTLB0_DTVA0_DTVB1_EPS0_FDSI0_GRPM1_GRVWA4_GRVWB8_GSU1_GSUAMB_GSUC0_GSUWGMRR0_GLS0_ISA1201_IU1_K1_LBSPPA512_LBSPPB0_LBSPPM0_LPA16_LPB0_LPM0_LRVW8_LWPMn1_MIAV1_MIWT1_1_MO40_NTn1_NTA0_NTB0_NTC0_NTD0_NTM0_NEPBS0_NLCA1_NLCB1_ONLL0_PGR2_PLR1_PKA0_SIA3_SS0_SU32_SUM1_SUS256_SPO0_SRVW0_SSO0_SVW8_SK0_SKXCCM0_TLDS0_ULSGRO0_USL1_UIOFGRO0_USFGROn1_VSn1_VWA1_VWB1_WSGRA0_WSGRB0_WS32_WG32_2_1_WGM8_WGMXCC1_WGMXCCGn1
    SolutionIndex: 246
    SolutionNameMin: Cijk_Ailk_Bjlk_BBS_BH_Bias_SHB_HA_S_SAB_SCD_SAV_UserArgs_MT32x32x128_MI16x16x1_SN_LDSB0_AFC1_AFEM1_AFEM1_ASEM1_CLR1_CADS0_DTLA0_DTLB0_DTVA0_DTVB1_EPS1_FDSI0_GRPM1_GRVWA4_GRVWB8_GSU1_GSUAMB_GSUC0_GSUWGMRR0_GLS0_ISA1201_IU1_K1_LBSPPA512_LBSPPB0_LBSPPM0_LPA16_LPB0_LPM0_LRVW8_LWPMn1_MIAV1_MIWT1_1_MO40_NTn1_NTA0_NTB0_NTC0_NTD0_NTM0_NEPBS0_NLCA1_NLCB1_ONLL0_PGR1_PLR1_PKA0_SIA3_SS0_SU32_SUM1_SUS256_SPO0_SRVW0_SSO0_SVW8_SK0_SKXCCM0_TLDS0_ULSGRO0_USL1_UIOFGRO0_USFGROn1_VSn1_VWA1_VWB1_WSGRA0_WSGRB0_WS32_WG32_4_1_WGM8_WGMXCC1_WGMXCCGn1
    SolutionIndex: 248
    SolutionNameMin: Cijk_Ailk_Bjlk_BBS_BH_Bias_SHB_HA_S_SAB_SCD_SAV_UserArgs_MT16x32x64_MI16x16x1_SN_LDSB0_AFC1_AFEM1_AFEM1_ASEM1_CLR1_CADS0_DTLA0_DTLB0_DTVA0_DTVB0_EPS0_FDSI0_GRPM1_GRVWA4_GRVWB8_GSU1_GSUAMB_GSUC0_GSUWGMRR0_GLS0_ISA1201_IU1_K1_LBSPPA256_LBSPPB512_LBSPPM0_LPA16_LPB16_LPM0_LRVW8_LWPMn1_MIAV1_MIWT1_1_MO40_NTn1_NTA0_NTB0_NTC0_NTD0_NTM0_NEPBS0_NLCA1_NLCB1_ONLL0_PGR2_PLR1_PKA0_SIA3_SS0_SU32_SUM1_SUS256_SPO0_SRVW0_SSO0_SVW8_SK0_SKXCCM0_TLDS0_ULSGRO0_USL1_UIOFGRO0_USFGROn1_VSn1_VWA1_VWB1_WSGRA0_WSGRB0_WS32_WG16_4_1_WGM8_WGMXCC1_WGMXCCGn1
    SolutionIndex: 249
    SolutionNameMin: Cijk_Ailk_Bjlk_BBS_BH_Bias_SHB_HA_S_SAB_SCD_SAV_UserArgs_MT32x32x64_MI16x16x1_SN_LDSB0_AFC1_AFEM1_AFEM1_ASEM1_CLR1_CADS0_DTLA0_DTLB0_DTVA0_DTVB0_EPS0_FDSI0_GRPM1_GRVWA4_GRVWB4_GSU1_GSUAMB_GSUC0_GSUWGMRR0_GLS0_ISA1201_IU1_K1_LBSPPA512_LBSPPB512_LBSPPM0_LPA16_LPB16_LPM0_LRVW8_LWPMn1_MIAV1_MIWT1_1_MO40_NTn1_NTA0_NTB0_NTC0_NTD0_NTM0_NEPBS0_NLCA1_NLCB1_ONLL0_PGR2_PLR1_PKA0_SIA3_SS0_SU32_SUM1_SUS256_SPO0_SRVW0_SSO0_SVW8_SK0_SKXCCM0_TLDS0_ULSGRO0_USL1_UIOFGRO0_USFGROn1_VSn1_VWA1_VWB1_WSGRA0_WSGRB0_WS32_WG32_4_1_WGM8_WGMXCC1_WGMXCCGn1
    SolutionIndex: 251
    SolutionNameMin: Cijk_Ailk_Bjlk_BBS_BH_Bias_SHB_HA_S_SAB_SCD_SAV_UserArgs_MT32x32x128_MI16x16x1_SN_LDSB0_AFC1_AFEM1_AFEM1_ASEM1_CLR1_CADS0_DTLA0_DTLB0_DTVA0_DTVB1_EPS0_FDSI0_GRPM1_GRVWA4_GRVWB8_GSU1_GSUAMB_GSUC0_GSUWGMRR0_GLS0_ISA1201_IU1_K1_LBSPPA512_LBSPPB0_LBSPPM0_LPA16_LPB0_LPM0_LRVW8_LWPMn1_MIAV1_MIWT1_1_MO40_NTn1_NTA0_NTB0_NTC0_NTD0_NTM0_NEPBS0_NLCA1_NLCB1_ONLL0_PGR2_PLR1_PKA0_SIA3_SS0_SU32_SUM1_SUS256_SPO0_SRVW0_SSO0_SVW8_SK0_SKXCCM0_TLDS0_ULSGRO0_USL1_UIOFGRO0_USFGROn1_VSn1_VWA1_VWB1_WSGRA0_WSGRB0_WS32_WG32_4_1_WGM8_WGMXCC1_WGMXCCGn1
    SolutionIndex: 252
    SolutionNameMin: Cijk_Ailk_Bjlk_BBS_BH_Bias_SHB_HA_S_SAB_SCD_SAV_UserArgs_MT32x32x64_MI16x16x1_SN_LDSB0_AFC1_AFEM1_AFEM1_ASEM1_CLR1_CADS0_DTLA0_DTLB0_DTVA0_DTVB1_EPS0_FDSI0_GRPM1_GRVWA8_GRVWB8_GSU1_GSUAMB_GSUC0_GSUWGMRR0_GLS0_ISA1201_IU1_K1_LBSPPA512_LBSPPB0_LBSPPM0_LPA16_LPB0_LPM0_LRVW8_LWPMn1_MIAV1_MIWT1_1_MO40_NTn1_NTA0_NTB0_NTC0_NTD0_NTM0_NEPBS0_NLCA1_NLCB1_ONLL0_PGR2_PLR1_PKA0_SIA3_SS0_SU32_SUM1_SUS256_SPO0_SRVW0_SSO0_SVW8_SK0_SKXCCM0_TLDS0_ULSGRO0_USL1_UIOFGRO0_USFGROn1_VSn1_VWA1_VWB1_WSGRA0_WSGRB0_WS32_WG32_4_1_WGM8_WGMXCC1_WGMXCCGn1
    SolutionIndex: 253
    SolutionNameMin: Cijk_Ailk_Bjlk_BBS_BH_Bias_SHB_HA_S_SAB_SCD_SAV_UserArgs_MT32x32x64_MI16x16x1_SN_LDSB0_AFC1_AFEM1_AFEM1_ASEM1_CLR1_CADS0_DTLA0_DTLB0_DTVA1_DTVB0_EPS0_FDSI0_GRPM1_GRVWA8_GRVWB8_GSU1_GSUAMB_GSUC0_GSUWGMRR0_GLS0_ISA1201_IU1_K1_LBSPPA0_LBSPPB512_LBSPPM0_LPA0_LPB16_LPM0_LRVW8_LWPMn1_MIAV1_MIWT1_1_MO40_NTn1_NTA0_NTB0_NTC0_NTD0_NTM0_NEPBS0_NLCA1_NLCB1_ONLL0_PGR2_PLR1_PKA0_SIA3_SS0_SU32_SUM1_SUS256_SPO0_SRVW0_SSO0_SVW8_SK0_SKXCCM0_TLDS0_ULSGRO0_USL1_UIOFGRO0_USFGROn1_VSn1_VWA1_VWB1_WSGRA0_WSGRB0_WS32_WG32_4_1_WGM8_WGMXCC1_WGMXCCGn1
    SolutionIndex: 254
    SolutionNameMin: Cijk_Ailk_Bjlk_BBS_BH_Bias_SHB_HA_S_SAB_SCD_SAV_UserArgs_MT32x32x128_MI16x16x1_SN_LDSB0_AFC1_AFEM1_AFEM1_ASEM1_CLR1_CADS0_DTLA0_DTLB0_DTVA0_DTVB1_EPS0_FDSI0_GRPM1_GRVWA8_GRVWB8_GSU1_GSUAMB_GSUC0_GSUWGMRR0_GLS0_ISA1201_IU1_K1_LBSPPA512_LBSPPB0_LBSPPM0_LPA16_LPB0_LPM0_LRVW8_LWPMn1_MIAV1_MIWT1_1_MO40_NTn1_NTA0_NTB0_NTC0_NTD0_NTM0_NEPBS0_NLCA1_NLCB1_ONLL0_PGR2_PLR1_PKA0_SIA3_SS0_SU32_SUM1_SUS256_SPO0_SRVW0_SSO0_SVW8_SK0_SKXCCM0_TLDS0_ULSGRO0_USL1_UIOFGRO0_USFGROn1_VSn1_VWA1_VWB1_WSGRA0_WSGRB0_WS32_WG32_4_1_WGM8_WGMXCC1_WGMXCCGn1
    SolutionIndex: 256
    SolutionNameMin: Cijk_Ailk_Bjlk_BBS_BH_Bias_SHB_HA_S_SAB_SCD_SAV_UserArgs_MT64x64x64_MI16x16x1_SN_LDSB0_AFC1_AFEM1_AFEM1_ASEM1_CLR1_CADS0_DTLA0_DTLB0_DTVA1_DTVB0_EPS1_FDSI0_GRPM1_GRVWA8_GRVWB8_GSU1_GSUAMB_GSUC0_GSUWGMRR0_GLS0_ISA1201_IU1_K1_LBSPPA0_LBSPPB1024_LBSPPM0_LPA0_LPB32_LPM0_LRVW8_LWPMn1_MIAV1_MIWT2_2_MO40_NTn1_NTA0_NTB0_NTC0_NTD0_NTM0_NEPBS0_NLCA4_NLCB1_ONLL0_PGR1_PLR1_PKA0_SIA3_SS0_SU32_SUM1_SUS256_SPO0_SRVW0_SSO0_SVW8_SK0_SKXCCM0_TLDS0_ULSGRO0_USL1_UIOFGRO0_USFGROn1_VSn1_VWA1_VWB2_WSGRA0_WSGRB0_WS32_WG32_4_1_WGM8_WGMXCC1_WGMXCCGn1
    SolutionIndex: 257
    SolutionNameMin: Cijk_Ailk_Bjlk_BBS_BH_Bias_SHB_HA_S_SAB_SCD_SAV_UserArgs_MT16x32x128_MI16x16x1_SN_LDSB0_AFC1_AFEM1_AFEM1_ASEM1_CLR1_CADS0_DTLA0_DTLB0_DTVA0_DTVB1_EPS0_FDSI0_GRPM1_GRVWA4_GRVWB8_GSU1_GSUAMB_GSUC0_GSUWGMRR0_GLS0_ISA1201_IU1_K1_LBSPPA256_LBSPPB0_LBSPPM0_LPA16_LPB0_LPM0_LRVW8_LWPMn1_MIAV1_MIWT1_1_MO40_NTn1_NTA0_NTB0_NTC0_NTD0_NTM0_NEPBS0_NLCA1_NLCB1_ONLL0_PGR2_PLR1_PKA0_SIA3_SS0_SU32_SUM1_SUS256_SPO0_SRVW0_SSO0_SVW8_SK0_SKXCCM0_TLDS0_ULSGRO0_USL1_UIOFGRO0_USFGROn1_VSn1_VWA1_VWB1_WSGRA0_WSGRB0_WS32_WG16_4_1_WGM8_WGMXCC1_WGMXCCGn1
    SolutionIndex: 258
    SolutionNameMin: Cijk_Ailk_Bjlk_BBS_BH_Bias_SHB_HA_S_SAB_SCD_SAV_UserArgs_MT64x64x64_MI16x16x1_SN_LDSB0_AFC1_AFEM1_AFEM1_ASEM1_CLR1_CADS0_DTLA0_DTLB0_DTVA1_DTVB0_EPS0_FDSI0_GRPM1_GRVWA8_GRVWB4_GSU1_GSUAMB_GSUC0_GSUWGMRR0_GLS0_ISA1201_IU1_K1_LBSPPA0_LBSPPB1024_LBSPPM0_LPA0_LPB32_LPM0_LRVW8_LWPMn1_MIAV1_MIWT2_2_MO40_NTn1_NTA0_NTB0_NTC0_NTD0_NTM0_NEPBS0_NLCA4_NLCB1_ONLL0_PGR2_PLR1_PKA0_SIA3_SS0_SU32_SUM1_SUS256_SPO0_SRVW0_SSO0_SVW8_SK0_SKXCCM0_TLDS0_ULSGRO0_USL1_UIOFGRO0_USFGROn1_VSn1_VWA1_VWB2_WSGRA0_WSGRB0_WS32_WG32_4_1_WGM8_WGMXCC1_WGMXCCGn1
    SolutionIndex: 261
    SolutionNameMin: Cijk_Ailk_Bjlk_BBS_BH_Bias_SHB_HA_S_SAB_SCD_SAV_UserArgs_MT64x64x64_MI16x16x1_SN_LDSB1_AFC1_AFEM1_AFEM1_ASEM1_CLR1_CADS0_DTLA0_DTLB0_DTVA0_DTVB0_EPS1_FDSI0_GRPM1_GRVWA8_GRVWB8_GSU1_GSUAMB_GSUC0_GSUWGMRR0_GLS0_ISA1201_IU1_K1_LBSPPA1024_LBSPPB1024_LBSPPM0_LPA32_LPB32_LPM0_LRVW8_LWPMn1_MIAV1_MIWT2_2_MO40_NTn1_NTA0_NTB0_NTC0_NTD0_NTM0_NEPBS0_NLCA1_NLCB1_ONLL0_PGR1_PLR1_PKA0_SIA3_SS0_SU32_SUM1_SUS256_SPO0_SRVW0_SSO0_SVW8_SK0_SKXCCM0_TLDS0_ULSGRO0_USL1_UIOFGRO0_USFGROn1_VSn1_VWA2_VWB2_WSGRA0_WSGRB0_WS32_WG32_4_1_WGM8_WGMXCC1_WGMXCCGn1
    SolutionIndex: 262
    SolutionNameMin: Cijk_Ailk_Bjlk_BBS_BH_Bias_SHB_HA_S_SAB_SCD_SAV_UserArgs_MT16x32x64_MI16x16x1_SN_LDSB0_AFC1_AFEM1_AFEM1_ASEM1_CLR1_CADS0_DTLA0_DTLB0_DTVA0_DTVB1_EPS0_FDSI0_GRPM1_GRVWA4_GRVWB8_GSU1_GSUAMB_GSUC0_GSUWGMRR0_GLS0_ISA1201_IU1_K1_LBSPPA256_LBSPPB0_LBSPPM0_LPA16_LPB0_LPM0_LRVW8_LWPMn1_MIAV1_MIWT1_1_MO40_NTn1_NTA0_NTB0_NTC0_NTD0_NTM0_NEPBS0_NLCA1_NLCB1_ONLL0_PGR2_PLR1_PKA0_SIA3_SS0_SU32_SUM1_SUS256_SPO0_SRVW0_SSO0_SVW8_SK0_SKXCCM0_TLDS0_ULSGRO0_USL1_UIOFGRO0_USFGROn1_VSn1_VWA1_VWB1_WSGRA0_WSGRB0_WS32_WG16_4_1_WGM8_WGMXCC1_WGMXCCGn1
    SolutionIndex: 263
    SolutionNameMin: Cijk_Ailk_Bjlk_BBS_BH_Bias_SHB_HA_S_SAB_SCD_SAV_UserArgs_MT32x32x128_MI16x16x1_SN_LDSB0_AFC1_AFEM1_AFEM1_ASEM1_CLR1_CADS0_DTLA0_DTLB0_DTVA0_DTVB1_EPS0_FDSI0_GRPM1_GRVWA8_GRVWB8_GSU1_GSUAMB_GSUC0_GSUWGMRR0_GLS0_ISA1201_IU1_K1_LBSPPA512_LBSPPB0_LBSPPM0_LPA16_LPB0_LPM0_LRVW8_LWPMn1_MIAV1_MIWT1_1_MO40_NTn1_NTA0_NTB0_NTC0_NTD0_NTM0_NEPBS0_NLCA1_NLCB1_ONLL0_PGR2_PLR1_PKA0_SIA3_SS1_SU32_SUM1_SUS256_SPO0_SRVW0_SSO0_SVW1_SK0_SKXCCM0_TLDS0_ULSGRO0_USL1_UIOFGRO0_USFGROn1_VSn1_VWA1_VWB1_WSGRA0_WSGRB0_WS32_WG32_4_1_WGM8_WGMXCC1_WGMXCCGn1
    SolutionIndex: 268
    SolutionNameMin: Cijk_Ailk_Bjlk_BBS_BH_Bias_SHB_HA_S_SAB_SCD_SAV_UserArgs_MT32x32x64_MI16x16x1_SN_LDSB0_AFC1_AFEM1_AFEM1_ASEM1_CLR1_CADS0_DTLA0_DTLB0_DTVA1_DTVB0_EPS0_FDSI0_GRPM1_GRVWA8_GRVWB4_GSU1_GSUAMB_GSUC0_GSUWGMRR0_GLS0_ISA1201_IU1_K1_LBSPPA0_LBSPPB512_LBSPPM0_LPA0_LPB16_LPM0_LRVW8_LWPMn1_MIAV1_MIWT1_1_MO40_NTn1_NTA0_NTB0_NTC0_NTD0_NTM0_NEPBS0_NLCA1_NLCB1_ONLL0_PGR2_PLR1_PKA0_SIA3_SS1_SU32_SUM1_SUS256_SPO0_SRVW0_SSO0_SVW1_SK0_SKXCCM0_TLDS0_ULSGRO0_USL1_UIOFGRO0_USFGROn1_VSn1_VWA1_VWB1_WSGRA0_WSGRB0_WS32_WG32_4_1_WGM8_WGMXCC1_WGMXCCGn1
    SolutionIndex: 270
    SolutionNameMin: Cijk_Ailk_Bjlk_BBS_BH_Bias_SHB_HA_S_SAB_SCD_SAV_UserArgs_MT64x64x32_MI16x16x1_SN_LDSB0_AFC1_AFEM1_AFEM1_ASEM1_CLR1_CADS0_DTLA0_DTLB0_DTVA0_DTVB1_EPS0_FDSI0_GRPM1_GRVWA4_GRVWB8_GSU1_GSUAMB_GSUC0_GSUWGMRR0_GLS0_ISA1201_IU1_K1_LBSPPA1024_LBSPPB0_LBSPPM0_LPA32_LPB0_LPM0_LRVW8_LWPMn1_MIAV1_MIWT2_2_MO40_NTn1_NTA0_NTB0_NTC0_NTD0_NTM0_NEPBS0_NLCA1_NLCB2_ONLL0_PGR2_PLR1_PKA0_SIA3_SS0_SU32_SUM1_SUS256_SPO0_SRVW0_SSO0_SVW8_SK0_SKXCCM0_TLDS0_ULSGRO0_USL1_UIOFGRO0_USFGROn1_VSn1_VWA2_VWB1_WSGRA0_WSGRB0_WS32_WG32_4_1_WGM8_WGMXCC1_WGMXCCGn1
    SolutionIndex: 271
    SolutionNameMin: Cijk_Ailk_Bjlk_BBS_BH_Bias_SHB_HA_S_SAB_SCD_SAV_UserArgs_MT64x128x32_MI16x16x1_SN_LDSB0_AFC1_AFEM1_AFEM1_ASEM1_CLR1_CADS0_DTLA0_DTLB0_DTVA0_DTVB1_EPS0_FDSI0_GRPM1_GRVWA4_GRVWB8_GSU1_GSUAMB_GSUC0_GSUWGMRR0_GLS0_ISA1201_IU1_K1_LBSPPA1024_LBSPPB0_LBSPPM0_LPA16_LPB0_LPM0_LRVW8_LWPMn1_MIAV1_MIWT1_8_MO40_NTn1_NTA0_NTB0_NTC0_NTD0_NTM0_NEPBS0_NLCA1_NLCB2_ONLL0_PGR2_PLR1_PKA0_SIA3_SS0_SU32_SUM1_SUS256_SPO0_SRVW0_SSO0_SVW8_SK0_SKXCCM0_TLDS0_ULSGRO0_USL1_UIOFGRO0_USFGROn1_VSn1_VWA1_VWB1_WSGRA0_WSGRB0_WS32_WG64_2_1_WGM8_WGMXCC1_WGMXCCGn1
    SolutionIndex: 272
    SolutionNameMin: Cijk_Ailk_Bjlk_BBS_BH_Bias_SHB_HA_S_SAB_SCD_SAV_UserArgs_MT128x64x32_MI16x16x1_SN_LDSB0_AFC1_AFEM1_AFEM1_ASEM1_CLR1_CADS0_DTLA0_DTLB0_DTVA1_DTVB0_EPS1_FDSI0_GRPM1_GRVWA8_GRVWB8_GSU1_GSUAMB_GSUC0_GSUWGMRR0_GLS0_ISA1201_IU1_K1_LBSPPA0_LBSPPB1024_LBSPPM0_LPA0_LPB16_LPM0_LRVW8_LWPMn1_MIAV1_MIWT8_1_MO40_NTn1_NTA0_NTB0_NTC0_NTD0_NTM0_NEPBS0_NLCA2_NLCB1_ONLL0_PGR1_PLR1_PKA0_SIA3_SS0_SU32_SUM1_SUS256_SPO0_SRVW0_SSO0_SVW8_SK0_SKXCCM0_TLDS0_ULSGRO0_USL1_UIOFGRO0_USFGROn1_VSn1_VWA1_VWB1_WSGRA0_WSGRB0_WS32_WG16_8_1_WGM8_WGMXCC1_WGMXCCGn1
    SolutionIndex: 273
    SolutionNameMin: Cijk_Ailk_Bjlk_BBS_BH_Bias_SHB_HA_S_SAB_SCD_SAV_UserArgs_MT32x32x128_MI16x16x1_SN_LDSB0_AFC1_AFEM1_AFEM1_ASEM1_CLR1_CADS0_DTLA0_DTLB0_DTVA1_DTVB0_EPS0_FDSI0_GRPM1_GRVWA8_GRVWB8_GSU1_GSUAMB_GSUC0_GSUWGMRR0_GLS0_ISA1201_IU1_K1_LBSPPA0_LBSPPB512_LBSPPM0_LPA0_LPB16_LPM0_LRVW8_LWPMn1_MIAV1_MIWT1_1_MO40_NTn1_NTA0_NTB0_NTC0_NTD0_NTM0_NEPBS0_NLCA1_NLCB1_ONLL0_PGR2_PLR1_PKA0_SIA3_SS0_SU32_SUM1_SUS256_SPO0_SRVW0_SSO0_SVW8_SK0_SKXCCM0_TLDS0_ULSGRO0_USL1_UIOFGRO0_USFGROn1_VSn1_VWA1_VWB1_WSGRA0_WSGRB0_WS32_WG32_4_1_WGM8_WGMXCC1_WGMXCCGn1
    SolutionIndex: 275
    SolutionNameMin: Cijk_Ailk_Bjlk_BBS_BH_Bias_SHB_HA_S_SAB_SCD_SAV_UserArgs_MT64x64x64_MI16x16x1_SN_LDSB0_AFC1_AFEM1_AFEM1_ASEM1_CLR1_CADS0_DTLA0_DTLB0_DTVA0_DTVB1_EPS1_FDSI0_GRPM1_GRVWA8_GRVWB8_GSU1_GSUAMB_GSUC0_GSUWGMRR0_GLS0_ISA1201_IU1_K1_LBSPPA1024_LBSPPB0_LBSPPM0_LPA32_LPB0_LPM0_LRVW8_LWPMn1_MIAV1_MIWT2_2_MO40_NTn1_NTA0_NTB0_NTC0_NTD0_NTM0_NEPBS0_NLCA1_NLCB4_ONLL0_PGR1_PLR1_PKA0_SIA3_SS1_SU32_SUM1_SUS256_SPO0_SRVW0_SSO0_SVW2_SK0_SKXCCM0_TLDS0_ULSGRO0_USL1_UIOFGRO0_USFGROn1_VSn1_VWA2_VWB1_WSGRA0_WSGRB0_WS32_WG32_4_1_WGM8_WGMXCC1_WGMXCCGn1
    SolutionIndex: 276
    SolutionNameMin: Cijk_Ailk_Bjlk_BBS_BH_Bias_SHB_HA_S_SAB_SCD_SAV_UserArgs_MT128x64x32_MI16x16x1_SN_LDSB0_AFC1_AFEM1_AFEM1_ASEM1_CLR1_CADS0_DTLA0_DTLB0_DTVA1_DTVB0_EPS0_FDSI0_GRPM1_GRVWA8_GRVWB4_GSU1_GSUAMB_GSUC0_GSUWGMRR0_GLS0_ISA1201_IU1_K1_LBSPPA0_LBSPPB1024_LBSPPM0_LPA0_LPB16_LPM0_LRVW8_LWPMn1_MIAV1_MIWT8_1_MO40_NTn1_NTA0_NTB0_NTC0_NTD0_NTM0_NEPBS0_NLCA2_NLCB1_ONLL0_PGR2_PLR1_PKA0_SIA3_SS0_SU32_SUM1_SUS256_SPO0_SRVW0_SSO0_SVW8_SK0_SKXCCM0_TLDS0_ULSGRO0_USL1_UIOFGRO0_USFGROn1_VSn1_VWA1_VWB1_WSGRA0_WSGRB0_WS32_WG16_8_1_WGM8_WGMXCC1_WGMXCCGn1
    SolutionIndex: 277
    SolutionNameMin: Cijk_Ailk_Bjlk_BBS_BH_Bias_SHB_HA_S_SAB_SCD_SAV_UserArgs_MT32x32x64_MI16x16x1_SN_LDSB0_AFC1_AFEM1_AFEM1_ASEM1_CLR1_CADS0_DTLA0_DTLB0_DTVA0_DTVB1_EPS0_FDSI0_GRPM1_GRVWA4_GRVWB8_GSU1_GSUAMB_GSUC0_GSUWGMRR0_GLS0_ISA1201_IU1_K1_LBSPPA512_LBSPPB0_LBSPPM0_LPA16_LPB0_LPM0_LRVW8_LWPMn1_MIAV1_MIWT1_1_MO40_NTn1_NTA0_NTB0_NTC0_NTD0_NTM0_NEPBS0_NLCA1_NLCB1_ONLL0_PGR2_PLR1_PKA0_SIA3_SS1_SU32_SUM1_SUS256_SPO0_SRVW0_SSO0_SVW1_SK0_SKXCCM0_TLDS0_ULSGRO0_USL1_UIOFGRO0_USFGROn1_VSn1_VWA1_VWB1_WSGRA0_WSGRB0_WS32_WG32_4_1_WGM8_WGMXCC1_WGMXCCGn1
    SolutionIndex: 278
    SolutionNameMin: Cijk_Ailk_Bjlk_BBS_BH_Bias_SHB_HA_S_SAB_SCD_SAV_UserArgs_MT64x64x32_MI16x16x1_SN_LDSB1_AFC1_AFEM1_AFEM1_ASEM1_CLR1_CADS0_DTLA0_DTLB0_DTVA0_DTVB0_EPS1_FDSI0_GRPM1_GRVWA8_GRVWB4_GSU1_GSUAMB_GSUC0_GSUWGMRR0_GLS0_ISA1201_IU2_K1_LBSPPA1024_LBSPPB1024_LBSPPM0_LPA32_LPB32_LPM0_LRVW8_LWPMn1_MIAV1_MIWT2_2_MO40_NTn1_NTA0_NTB0_NTC0_NTD0_NTM0_NEPBS0_NLCA1_NLCB1_ONLL0_PGR1_PLR1_PKA0_SIA2_SS1_SU32_SUM1_SUS256_SPO0_SRVW0_SSO0_SVW2_SK0_SKXCCM0_TLDS0_ULSGRO0_USL1_UIOFGRO0_USFGROn1_VSn1_VWA2_VWB2_WSGRA0_WSGRB0_WS32_WG32_4_1_WGM8_WGMXCC1_WGMXCCGn1
    SolutionIndex: 279
    SolutionNameMin: Cijk_Ailk_Bjlk_BBS_BH_Bias_SHB_HA_S_SAB_SCD_SAV_UserArgs_MT64x64x64_MI16x16x1_SN_LDSB0_AFC1_AFEM1_AFEM1_ASEM1_CLR1_CADS0_DTLA0_DTLB0_DTVA0_DTVB1_EPS0_FDSI0_GRPM1_GRVWA4_GRVWB8_GSU1_GSUAMB_GSUC0_GSUWGMRR0_GLS0_ISA1201_IU1_K1_LBSPPA1024_LBSPPB0_LBSPPM0_LPA32_LPB0_LPM0_LRVW8_LWPMn1_MIAV1_MIWT2_2_MO40_NTn1_NTA0_NTB0_NTC0_NTD0_NTM0_NEPBS0_NLCA1_NLCB4_ONLL0_PGR2_PLR1_PKA0_SIA3_SS1_SU32_SUM1_SUS256_SPO0_SRVW0_SSO0_SVW2_SK0_SKXCCM0_TLDS0_ULSGRO0_USL1_UIOFGRO0_USFGROn1_VSn1_VWA2_VWB1_WSGRA0_WSGRB0_WS32_WG32_4_1_WGM8_WGMXCC1_WGMXCCGn1
    SolutionIndex: 280
    SolutionNameMin: Cijk_Ailk_Bjlk_BBS_BH_Bias_SHB_HA_S_SAB_SCD_SAV_UserArgs_MT64x128x32_MI16x16x1_SN_LDSB0_AFC1_AFEM1_AFEM1_ASEM1_CLR1_CADS0_DTLA0_DTLB0_DTVA0_DTVB1_EPS0_FDSI0_GRPM1_GRVWA8_GRVWB8_GSU1_GSUAMB_GSUC0_GSUWGMRR0_GLS0_ISA1201_IU1_K1_LBSPPA1024_LBSPPB0_LBSPPM0_LPA16_LPB0_LPM0_LRVW8_LWPMn1_MIAV1_MIWT1_8_MO40_NTn1_NTA0_NTB0_NTC0_NTD0_NTM0_NEPBS0_NLCA1_NLCB2_ONLL0_PGR2_PLR1_PKA0_SIA3_SS0_SU32_SUM1_SUS256_SPO0_SRVW0_SSO0_SVW8_SK0_SKXCCM0_TLDS0_ULSGRO0_USL1_UIOFGRO0_USFGROn1_VSn1_VWA1_VWB1_WSGRA0_WSGRB0_WS32_WG64_2_1_WGM8_WGMXCC1_WGMXCCGn1
    SolutionIndex: 281
    SolutionNameMin: Cijk_Ailk_Bjlk_BBS_BH_Bias_SHB_HA_S_SAB_SCD_SAV_UserArgs_MT128x128x16_MI16x16x1_SN_LDSB0_AFC1_AFEM1_AFEM1_ASEM1_CLR1_CADS0_DTLA0_DTLB0_DTVA1_DTVB1_EPS0_FDSI0_GRPM1_GRVWA8_GRVWB8_GSU1_GSUAMB_GSUC0_GSUWGMRR0_GLS0_ISA1201_IU1_K1_LBSPPA0_LBSPPB0_LBSPPM0_LPA0_LPB0_LPM0_LRVW8_LWPMn1_MIAV1_MIWT8_2_MO40_NTn1_NTA0_NTB0_NTC0_NTD0_NTM0_NEPBS0_NLCA1_NLCB1_ONLL0_PGR1_PLR0_PKA0_SIA3_SS0_SU32_SUM1_SUS256_SPO0_SRVW0_SSO0_SVW8_SK0_SKXCCM0_TLDS0_ULSGRO0_USL1_UIOFGRO0_USFGROn1_VSn1_VWA1_VWB1_WSGRA0_WSGRB0_WS32_WG16_8_1_WGM8_WGMXCC1_WGMXCCGn1
    SolutionIndex: 282
    SolutionNameMin: Cijk_Ailk_Bjlk_BBS_BH_Bias_SHB_HA_S_SAB_SCD_SAV_UserArgs_MT128x128x16_MI16x16x1_SN_LDSB0_AFC1_AFEM1_AFEM1_ASEM1_CLR1_CADS0_DTLA0_DTLB0_DTVA1_DTVB1_EPS0_FDSI0_GRPM1_GRVWA8_GRVWB8_GSU1_GSUAMB_GSUC0_GSUWGMRR0_GLS0_ISA1201_IU1_K1_LBSPPA0_LBSPPB0_LBSPPM0_LPA0_LPB0_LPM0_LRVW8_LWPMn1_MIAV1_MIWT4_4_MO40_NTn1_NTA0_NTB0_NTC0_NTD0_NTM0_NEPBS0_NLCA1_NLCB1_ONLL0_PGR1_PLR0_PKA0_SIA3_SS0_SU32_SUM1_SUS256_SPO0_SRVW0_SSO0_SVW8_SK0_SKXCCM0_TLDS0_ULSGRO0_USL1_UIOFGRO0_USFGROn1_VSn1_VWA1_VWB1_WSGRA0_WSGRB0_WS32_WG32_4_1_WGM8_WGMXCC1_WGMXCCGn1
    SolutionIndex: 284
    SolutionNameMin: Cijk_Ailk_Bjlk_BBS_BH_Bias_SHB_HA_S_SAB_SCD_SAV_UserArgs_MT64x128x32_MI16x16x1_SN_LDSB0_AFC1_AFEM1_AFEM1_ASEM1_CLR1_CADS0_DTLA0_DTLB0_DTVA0_DTVB1_EPS1_FDSI0_GRPM1_GRVWA4_GRVWB8_GSU1_GSUAMB_GSUC0_GSUWGMRR0_GLS0_ISA1201_IU1_K1_LBSPPA1024_LBSPPB0_LBSPPM0_LPA16_LPB0_LPM0_LRVW8_LWPMn1_MIAV1_MIWT1_8_MO40_NTn1_NTA0_NTB0_NTC0_NTD0_NTM0_NEPBS0_NLCA1_NLCB2_ONLL0_PGR1_PLR1_PKA0_SIA3_SS0_SU32_SUM1_SUS256_SPO0_SRVW0_SSO0_SVW8_SK0_SKXCCM0_TLDS0_ULSGRO0_USL1_UIOFGRO0_USFGROn1_VSn1_VWA1_VWB1_WSGRA0_WSGRB0_WS32_WG64_2_1_WGM8_WGMXCC1_WGMXCCGn1
    SolutionIndex: 285
    SolutionNameMin: Cijk_Ailk_Bjlk_BBS_BH_Bias_SHB_HA_S_SAB_SCD_SAV_UserArgs_MT16x16x128_MI16x16x1_SN_LDSB1_AFC1_AFEM1_AFEM1_ASEM1_CLR1_CADS0_DTLA0_DTLB0_DTVA0_DTVB0_EPS0_FDSI0_GRPM1_GRVWA8_GRVWB8_GSU1_GSUAMB_GSUC0_GSUWGMRR0_GLS0_ISA1201_IU8_K1_LBSPPA256_LBSPPB256_LBSPPM0_LPA16_LPB16_LPM0_LRVW8_LWPMn1_MIAV1_MIWT1_1_MO40_NTn1_NTA0_NTB0_NTC0_NTD0_NTM0_NEPBS0_NLCA1_NLCB1_ONLL0_PGR2_PLR1_PKA0_SIA2_SS0_SU32_SUM1_SUS256_SPO0_SRVW0_SSO0_SVW8_SK0_SKXCCM0_TLDS0_ULSGRO0_USL1_UIOFGRO0_USFGROn1_VSn1_VWA1_VWB1_WSGRA0_WSGRB0_WS32_WG16_2_1_WGM8_WGMXCC1_WGMXCCGn1
    SolutionIndex: 286
    SolutionNameMin: Cijk_Ailk_Bjlk_BBS_BH_Bias_SHB_HA_S_SAB_SCD_SAV_UserArgs_MT16x32x128_MI16x16x1_SN_LDSB0_AFC1_AFEM1_AFEM1_ASEM1_CLR1_CADS0_DTLA0_DTLB0_DTVA0_DTVB1_EPS0_FDSI0_GRPM1_GRVWA8_GRVWB8_GSU1_GSUAMB_GSUC0_GSUWGMRR0_GLS0_ISA1201_IU1_K1_LBSPPA256_LBSPPB0_LBSPPM0_LPA16_LPB0_LPM0_LRVW8_LWPMn1_MIAV1_MIWT1_1_MO40_NTn1_NTA0_NTB0_NTC0_NTD0_NTM0_NEPBS0_NLCA1_NLCB1_ONLL0_PGR2_PLR1_PKA0_SIA3_SS0_SU32_SUM1_SUS256_SPO0_SRVW0_SSO0_SVW8_SK0_SKXCCM0_TLDS0_ULSGRO0_USL1_UIOFGRO0_USFGROn1_VSn1_VWA1_VWB1_WSGRA0_WSGRB0_WS32_WG16_4_1_WGM8_WGMXCC1_WGMXCCGn1
    SolutionIndex: 287
    SolutionNameMin: Cijk_Ailk_Bjlk_BBS_BH_Bias_SHB_HA_S_SAB_SCD_SAV_UserArgs_MT32x32x128_MI16x16x1_SN_LDSB0_AFC1_AFEM1_AFEM1_ASEM1_CLR1_CADS0_DTLA0_DTLB0_DTVA1_DTVB0_EPS0_FDSI0_GRPM1_GRVWA8_GRVWB8_GSU1_GSUAMB_GSUC0_GSUWGMRR0_GLS0_ISA1201_IU1_K1_LBSPPA0_LBSPPB512_LBSPPM0_LPA0_LPB16_LPM0_LRVW8_LWPMn1_MIAV1_MIWT1_1_MO40_NTn1_NTA0_NTB0_NTC0_NTD0_NTM0_NEPBS0_NLCA1_NLCB1_ONLL0_PGR2_PLR1_PKA0_SIA3_SS1_SU32_SUM1_SUS256_SPO0_SRVW0_SSO0_SVW1_SK0_SKXCCM0_TLDS0_ULSGRO0_USL1_UIOFGRO0_USFGROn1_VSn1_VWA1_VWB1_WSGRA0_WSGRB0_WS32_WG32_4_1_WGM8_WGMXCC1_WGMXCCGn1
    SolutionIndex: 288
    SolutionNameMin: Cijk_Ailk_Bjlk_BBS_BH_Bias_SHB_HA_S_SAB_SCD_SAV_UserArgs_MT32x32x64_MI16x16x1_SN_LDSB0_AFC1_AFEM1_AFEM1_ASEM1_CLR1_CADS0_DTLA0_DTLB0_DTVA0_DTVB1_EPS0_FDSI0_GRPM1_GRVWA8_GRVWB8_GSU1_GSUAMB_GSUC0_GSUWGMRR0_GLS0_ISA1201_IU1_K1_LBSPPA512_LBSPPB0_LBSPPM0_LPA16_LPB0_LPM0_LRVW8_LWPMn1_MIAV1_MIWT1_1_MO40_NTn1_NTA0_NTB0_NTC0_NTD0_NTM0_NEPBS0_NLCA1_NLCB1_ONLL0_PGR2_PLR1_PKA0_SIA3_SS1_SU32_SUM1_SUS256_SPO0_SRVW0_SSO0_SVW1_SK0_SKXCCM0_TLDS0_ULSGRO0_USL1_UIOFGRO0_USFGROn1_VSn1_VWA1_VWB1_WSGRA0_WSGRB0_WS32_WG32_4_1_WGM8_WGMXCC1_WGMXCCGn1
    SolutionIndex: 289
    SolutionNameMin: Cijk_Ailk_Bjlk_BBS_BH_Bias_SHB_HA_S_SAB_SCD_SAV_UserArgs_MT64x64x64_MI16x16x1_SN_LDSB0_AFC1_AFEM1_AFEM1_ASEM1_CLR1_CADS0_DTLA0_DTLB0_DTVA0_DTVB1_EPS1_FDSI0_GRPM1_GRVWA4_GRVWB8_GSU1_GSUAMB_GSUC0_GSUWGMRR0_GLS0_ISA1201_IU1_K1_LBSPPA1024_LBSPPB0_LBSPPM0_LPA32_LPB0_LPM0_LRVW8_LWPMn1_MIAV1_MIWT2_2_MO40_NTn1_NTA0_NTB0_NTC0_NTD0_NTM0_NEPBS0_NLCA1_NLCB4_ONLL0_PGR1_PLR1_PKA0_SIA3_SS1_SU32_SUM1_SUS256_SPO0_SRVW0_SSO0_SVW2_SK0_SKXCCM0_TLDS0_ULSGRO0_USL1_UIOFGRO0_USFGROn1_VSn1_VWA2_VWB1_WSGRA0_WSGRB0_WS32_WG32_4_1_WGM8_WGMXCC1_WGMXCCGn1
    SolutionIndex: 290
    SolutionNameMin: Cijk_Ailk_Bjlk_BBS_BH_Bias_SHB_HA_S_SAB_SCD_SAV_UserArgs_MT32x16x128_MI16x16x1_SN_LDSB0_AFC1_AFEM1_AFEM1_ASEM1_CLR1_CADS0_DTLA0_DTLB0_DTVA1_DTVB0_EPS0_FDSI0_GRPM1_GRVWA8_GRVWB8_GSU1_GSUAMB_GSUC0_GSUWGMRR0_GLS0_ISA1201_IU1_K1_LBSPPA0_LBSPPB256_LBSPPM0_LPA0_LPB16_LPM0_LRVW8_LWPMn1_MIAV1_MIWT1_1_MO40_NTn1_NTA0_NTB0_NTC0_NTD0_NTM0_NEPBS0_NLCA1_NLCB1_ONLL0_PGR2_PLR1_PKA0_SIA3_SS0_SU32_SUM1_SUS256_SPO0_SRVW0_SSO0_SVW8_SK0_SKXCCM0_TLDS0_ULSGRO0_USL1_UIOFGRO0_USFGROn1_VSn1_VWA1_VWB1_WSGRA0_WSGRB0_WS32_WG32_2_1_WGM8_WGMXCC1_WGMXCCGn1
    SolutionIndex: 291
    SolutionNameMin: Cijk_Ailk_Bjlk_BBS_BH_Bias_SHB_HA_S_SAB_SCD_SAV_UserArgs_MT64x64x64_MI16x16x1_SN_LDSB0_AFC1_AFEM1_AFEM1_ASEM1_CLR1_CADS0_DTLA0_DTLB0_DTVA0_DTVB1_EPS0_FDSI0_GRPM1_GRVWA8_GRVWB8_GSU1_GSUAMB_GSUC0_GSUWGMRR0_GLS0_ISA1201_IU1_K1_LBSPPA1024_LBSPPB0_LBSPPM0_LPA32_LPB0_LPM0_LRVW8_LWPMn1_MIAV1_MIWT2_2_MO40_NTn1_NTA0_NTB0_NTC0_NTD0_NTM0_NEPBS0_NLCA1_NLCB4_ONLL0_PGR2_PLR1_PKA0_SIA3_SS1_SU32_SUM1_SUS256_SPO0_SRVW0_SSO0_SVW2_SK0_SKXCCM0_TLDS0_ULSGRO0_USL1_UIOFGRO0_USFGROn1_VSn1_VWA2_VWB1_WSGRA0_WSGRB0_WS32_WG32_4_1_WGM8_WGMXCC1_WGMXCCGn1
    SolutionIndex: 292
    SolutionNameMin: Cijk_Ailk_Bjlk_BBS_BH_Bias_SHB_HA_S_SAB_SCD_SAV_UserArgs_MT32x32x128_MI16x16x1_SN_LDSB0_AFC1_AFEM1_AFEM1_ASEM1_CLR1_CADS0_DTLA0_DTLB0_DTVA1_DTVB0_EPS0_FDSI0_GRPM1_GRVWA8_GRVWB4_GSU1_GSUAMB_GSUC0_GSUWGMRR0_GLS0_ISA1201_IU1_K1_LBSPPA0_LBSPPB512_LBSPPM0_LPA0_LPB16_LPM0_LRVW8_LWPMn1_MIAV1_MIWT1_1_MO40_NTn1_NTA0_NTB0_NTC0_NTD0_NTM0_NEPBS0_NLCA1_NLCB1_ONLL0_PGR2_PLR1_PKA0_SIA3_SS0_SU32_SUM1_SUS256_SPO0_SRVW0_SSO0_SVW8_SK0_SKXCCM0_TLDS0_ULSGRO0_USL1_UIOFGRO0_USFGROn1_VSn1_VWA1_VWB1_WSGRA0_WSGRB0_WS32_WG32_4_1_WGM8_WGMXCC1_WGMXCCGn1
    SolutionIndex: 293
    SolutionNameMin: Cijk_Ailk_Bjlk_BBS_BH_Bias_SHB_HA_S_SAB_SCD_SAV_UserArgs_MT16x32x64_MI16x16x1_SN_LDSB0_AFC1_AFEM1_AFEM1_ASEM1_CLR1_CADS0_DTLA0_DTLB0_DTVA0_DTVB1_EPS0_FDSI0_GRPM1_GRVWA8_GRVWB8_GSU1_GSUAMB_GSUC0_GSUWGMRR0_GLS0_ISA1201_IU1_K1_LBSPPA256_LBSPPB0_LBSPPM0_LPA16_LPB0_LPM0_LRVW8_LWPMn1_MIAV1_MIWT1_1_MO40_NTn1_NTA0_NTB0_NTC0_NTD0_NTM0_NEPBS0_NLCA1_NLCB1_ONLL0_PGR2_PLR1_PKA0_SIA3_SS0_SU32_SUM1_SUS256_SPO0_SRVW0_SSO0_SVW8_SK0_SKXCCM0_TLDS0_ULSGRO0_USL1_UIOFGRO0_USFGROn1_VSn1_VWA1_VWB1_WSGRA0_WSGRB0_WS32_WG16_4_1_WGM8_WGMXCC1_WGMXCCGn1
    SolutionIndex: 295
    SolutionNameMin: Cijk_Ailk_Bjlk_BBS_BH_Bias_SHB_HA_S_SAB_SCD_SAV_UserArgs_MT64x64x32_MI16x16x1_SN_LDSB0_AFC1_AFEM1_AFEM1_ASEM1_CLR1_CADS0_DTLA0_DTLB0_DTVA0_DTVB1_EPS1_FDSI0_GRPM1_GRVWA8_GRVWB8_GSU1_GSUAMB_GSUC0_GSUWGMRR0_GLS0_ISA1201_IU1_K1_LBSPPA1024_LBSPPB0_LBSPPM0_LPA32_LPB0_LPM0_LRVW8_LWPMn1_MIAV1_MIWT2_2_MO40_NTn1_NTA0_NTB0_NTC0_NTD0_NTM0_NEPBS0_NLCA1_NLCB2_ONLL0_PGR1_PLR1_PKA0_SIA3_SS1_SU32_SUM1_SUS256_SPO0_SRVW0_SSO0_SVW2_SK0_SKXCCM0_TLDS0_ULSGRO0_USL1_UIOFGRO0_USFGROn1_VSn1_VWA2_VWB1_WSGRA0_WSGRB0_WS32_WG32_4_1_WGM8_WGMXCC1_WGMXCCGn1
    SolutionIndex: 296
    SolutionNameMin: Cijk_Ailk_Bjlk_BBS_BH_Bias_SHB_HA_S_SAB_SCD_SAV_UserArgs_MT32x128x64_MI16x16x1_SN_LDSB0_AFC1_AFEM1_AFEM1_ASEM1_CLR1_CADS0_DTLA0_DTLB0_DTVA0_DTVB1_EPS1_FDSI0_GRPM1_GRVWA4_GRVWB8_GSU1_GSUAMB_GSUC0_GSUWGMRR0_GLS0_ISA1201_IU1_K1_LBSPPA512_LBSPPB0_LBSPPM0_LPA16_LPB0_LPM0_LRVW8_LWPMn1_MIAV1_MIWT1_4_MO40_NTn1_NTA0_NTB0_NTC0_NTD0_NTM0_NEPBS0_NLCA1_NLCB4_ONLL0_PGR1_PLR1_PKA0_SIA3_SS0_SU32_SUM1_SUS256_SPO0_SRVW0_SSO0_SVW8_SK0_SKXCCM0_TLDS0_ULSGRO0_USL1_UIOFGRO0_USFGROn1_VSn1_VWA1_VWB1_WSGRA0_WSGRB0_WS32_WG32_4_1_WGM8_WGMXCC1_WGMXCCGn1
    SolutionIndex: 297
    SolutionNameMin: Cijk_Ailk_Bjlk_BBS_BH_Bias_SHB_HA_S_SAB_SCD_SAV_UserArgs_MT32x128x64_MI16x16x1_SN_LDSB0_AFC1_AFEM1_AFEM1_ASEM1_CLR1_CADS0_DTLA0_DTLB0_DTVA0_DTVB1_EPS1_FDSI0_GRPM1_GRVWA8_GRVWB8_GSU1_GSUAMB_GSUC0_GSUWGMRR0_GLS0_ISA1201_IU1_K1_LBSPPA512_LBSPPB0_LBSPPM0_LPA16_LPB0_LPM0_LRVW8_LWPMn1_MIAV1_MIWT1_4_MO40_NTn1_NTA0_NTB0_NTC0_NTD0_NTM0_NEPBS0_NLCA1_NLCB4_ONLL0_PGR1_PLR1_PKA0_SIA3_SS0_SU32_SUM1_SUS256_SPO0_SRVW0_SSO0_SVW8_SK0_SKXCCM0_TLDS0_ULSGRO0_USL1_UIOFGRO0_USFGROn1_VSn1_VWA1_VWB1_WSGRA0_WSGRB0_WS32_WG32_4_1_WGM8_WGMXCC1_WGMXCCGn1
    SolutionIndex: 298
    SolutionNameMin: Cijk_Ailk_Bjlk_BBS_BH_Bias_SHB_HA_S_SAB_SCD_SAV_UserArgs_MT32x128x32_MI16x16x1_SN_LDSB0_AFC1_AFEM1_AFEM1_ASEM1_CLR1_CADS0_DTLA0_DTLB0_DTVA0_DTVB1_EPS1_FDSI0_GRPM1_GRVWA8_GRVWB8_GSU1_GSUAMB_GSUC0_GSUWGMRR0_GLS0_ISA1201_IU1_K1_LBSPPA512_LBSPPB0_LBSPPM0_LPA16_LPB0_LPM0_LRVW8_LWPMn1_MIAV1_MIWT1_4_MO40_NTn1_NTA0_NTB0_NTC0_NTD0_NTM0_NEPBS0_NLCA1_NLCB2_ONLL0_PGR1_PLR1_PKA0_SIA3_SS0_SU32_SUM1_SUS256_SPO0_SRVW0_SSO0_SVW8_SK0_SKXCCM0_TLDS0_ULSGRO0_USL1_UIOFGRO0_USFGROn1_VSn1_VWA1_VWB1_WSGRA0_WSGRB0_WS32_WG32_4_1_WGM8_WGMXCC1_WGMXCCGn1
    SolutionIndex: 300
    SolutionNameMin: Cijk_Ailk_Bjlk_BBS_BH_Bias_SHB_HA_S_SAB_SCD_SAV_UserArgs_MT16x16x128_MI16x16x1_SN_LDSB1_AFC1_AFEM1_AFEM1_ASEM1_CLR1_CADS0_DTLA0_DTLB0_DTVA0_DTVB0_EPS1_FDSI0_GRPM1_GRVWA8_GRVWB8_GSU1_GSUAMB_GSUC0_GSUWGMRR0_GLS0_ISA1201_IU8_K1_LBSPPA256_LBSPPB256_LBSPPM0_LPA16_LPB16_LPM0_LRVW8_LWPMn1_MIAV1_MIWT1_1_MO40_NTn1_NTA0_NTB0_NTC0_NTD0_NTM0_NEPBS0_NLCA1_NLCB1_ONLL0_PGR1_PLR1_PKA0_SIA2_SS0_SU32_SUM1_SUS256_SPO0_SRVW0_SSO0_SVW8_SK0_SKXCCM0_TLDS0_ULSGRO0_USL1_UIOFGRO0_USFGROn1_VSn1_VWA1_VWB1_WSGRA0_WSGRB0_WS32_WG16_2_1_WGM8_WGMXCC1_WGMXCCGn1
    SolutionIndex: 302
    SolutionNameMin: Cijk_Ailk_Bjlk_BBS_BH_Bias_SHB_HA_S_SAB_SCD_SAV_UserArgs_MT32x32x128_MI16x16x1_SN_LDSB0_AFC1_AFEM1_AFEM1_ASEM1_CLR1_CADS0_DTLA0_DTLB0_DTVA1_DTVB0_EPS1_FDSI0_GRPM1_GRVWA8_GRVWB4_GSU1_GSUAMB_GSUC0_GSUWGMRR0_GLS0_ISA1201_IU1_K1_LBSPPA0_LBSPPB512_LBSPPM0_LPA0_LPB16_LPM0_LRVW8_LWPMn1_MIAV1_MIWT1_1_MO40_NTn1_NTA0_NTB0_NTC0_NTD0_NTM0_NEPBS0_NLCA1_NLCB1_ONLL0_PGR1_PLR1_PKA0_SIA3_SS1_SU32_SUM1_SUS256_SPO0_SRVW0_SSO0_SVW1_SK0_SKXCCM0_TLDS0_ULSGRO0_USL1_UIOFGRO0_USFGROn1_VSn1_VWA1_VWB1_WSGRA0_WSGRB0_WS32_WG32_4_1_WGM8_WGMXCC1_WGMXCCGn1
    SolutionIndex: 303
    SolutionNameMin: Cijk_Ailk_Bjlk_BBS_BH_Bias_SHB_HA_S_SAB_SCD_SAV_UserArgs_MT32x128x64_MI16x16x1_SN_LDSB0_AFC1_AFEM1_AFEM1_ASEM1_CLR1_CADS0_DTLA0_DTLB0_DTVA0_DTVB1_EPS0_FDSI0_GRPM1_GRVWA8_GRVWB8_GSU1_GSUAMB_GSUC0_GSUWGMRR0_GLS0_ISA1201_IU1_K1_LBSPPA512_LBSPPB0_LBSPPM0_LPA16_LPB0_LPM0_LRVW8_LWPMn1_MIAV1_MIWT1_4_MO40_NTn1_NTA0_NTB0_NTC0_NTD0_NTM0_NEPBS0_NLCA1_NLCB4_ONLL0_PGR2_PLR1_PKA0_SIA3_SS0_SU32_SUM1_SUS256_SPO0_SRVW0_SSO0_SVW8_SK0_SKXCCM0_TLDS0_ULSGRO0_USL1_UIOFGRO0_USFGROn1_VSn1_VWA1_VWB1_WSGRA0_WSGRB0_WS32_WG32_4_1_WGM8_WGMXCC1_WGMXCCGn1
    SolutionIndex: 305
    SolutionNameMin: Cijk_Ailk_Bjlk_BBS_BH_Bias_SHB_HA_S_SAB_SCD_SAV_UserArgs_MT32x128x32_MI16x16x1_SN_LDSB0_AFC1_AFEM1_AFEM1_ASEM1_CLR1_CADS0_DTLA0_DTLB0_DTVA0_DTVB1_EPS1_FDSI0_GRPM1_GRVWA4_GRVWB8_GSU1_GSUAMB_GSUC0_GSUWGMRR0_GLS0_ISA1201_IU1_K1_LBSPPA512_LBSPPB0_LBSPPM0_LPA16_LPB0_LPM0_LRVW8_LWPMn1_MIAV1_MIWT1_4_MO40_NTn1_NTA0_NTB0_NTC0_NTD0_NTM0_NEPBS0_NLCA1_NLCB2_ONLL0_PGR1_PLR1_PKA0_SIA3_SS0_SU32_SUM1_SUS256_SPO0_SRVW0_SSO0_SVW8_SK0_SKXCCM0_TLDS0_ULSGRO0_USL1_UIOFGRO0_USFGROn1_VSn1_VWA1_VWB1_WSGRA0_WSGRB0_WS32_WG32_4_1_WGM8_WGMXCC1_WGMXCCGn1
    SolutionIndex: 306
    SolutionNameMin: Cijk_Ailk_Bjlk_BBS_BH_Bias_SHB_HA_S_SAB_SCD_SAV_UserArgs_MT64x64x32_MI16x16x1_SN_LDSB0_AFC1_AFEM1_AFEM1_ASEM1_CLR1_CADS0_DTLA0_DTLB0_DTVA0_DTVB1_EPS0_FDSI0_GRPM1_GRVWA8_GRVWB8_GSU1_GSUAMB_GSUC0_GSUWGMRR0_GLS0_ISA1201_IU1_K1_LBSPPA1024_LBSPPB0_LBSPPM0_LPA32_LPB0_LPM0_LRVW8_LWPMn1_MIAV1_MIWT2_2_MO40_NTn1_NTA0_NTB0_NTC0_NTD0_NTM0_NEPBS0_NLCA1_NLCB2_ONLL0_PGR2_PLR1_PKA0_SIA3_SS1_SU32_SUM1_SUS256_SPO0_SRVW0_SSO0_SVW2_SK0_SKXCCM0_TLDS0_ULSGRO0_USL1_UIOFGRO0_USFGROn1_VSn1_VWA2_VWB1_WSGRA0_WSGRB0_WS32_WG32_4_1_WGM8_WGMXCC1_WGMXCCGn1
    SolutionIndex: 307
    SolutionNameMin: Cijk_Ailk_Bjlk_BBS_BH_Bias_SHB_HA_S_SAB_SCD_SAV_UserArgs_MT64x64x32_MI16x16x1_SN_LDSB0_AFC1_AFEM1_AFEM1_ASEM1_CLR1_CADS0_DTLA0_DTLB0_DTVA1_DTVB1_EPS0_FDSI0_GRPM1_GRVWA8_GRVWB8_GSU1_GSUAMB_GSUC0_GSUWGMRR0_GLS0_ISA1201_IU1_K1_LBSPPA0_LBSPPB0_LBSPPM0_LPA0_LPB0_LPM0_LRVW8_LWPMn1_MIAV1_MIWT2_2_MO40_NTn1_NTA0_NTB0_NTC0_NTD0_NTM0_NEPBS0_NLCA2_NLCB2_ONLL0_PGR1_PLR0_PKA0_SIA3_SS1_SU32_SUM1_SUS256_SPO0_SRVW0_SSO0_SVW1_SK0_SKXCCM0_TLDS0_ULSGRO0_USL1_UIOFGRO0_USFGROn1_VSn1_VWA1_VWB1_WSGRA0_WSGRB0_WS32_WG32_4_1_WGM8_WGMXCC1_WGMXCCGn1
    SolutionIndex: 308
    SolutionNameMin: Cijk_Ailk_Bjlk_BBS_BH_Bias_SHB_HA_S_SAB_SCD_SAV_UserArgs_MT32x32x128_MI16x16x1_SN_LDSB0_AFC1_AFEM1_AFEM1_ASEM1_CLR1_CADS0_DTLA0_DTLB0_DTVA1_DTVB0_EPS1_FDSI0_GRPM1_GRVWA8_GRVWB8_GSU1_GSUAMB_GSUC0_GSUWGMRR0_GLS0_ISA1201_IU1_K1_LBSPPA0_LBSPPB512_LBSPPM0_LPA0_LPB16_LPM0_LRVW8_LWPMn1_MIAV1_MIWT1_1_MO40_NTn1_NTA0_NTB0_NTC0_NTD0_NTM0_NEPBS0_NLCA1_NLCB1_ONLL0_PGR1_PLR1_PKA0_SIA3_SS0_SU32_SUM1_SUS256_SPO0_SRVW0_SSO0_SVW8_SK0_SKXCCM0_TLDS0_ULSGRO0_USL1_UIOFGRO0_USFGROn1_VSn1_VWA1_VWB1_WSGRA0_WSGRB0_WS32_WG32_4_1_WGM8_WGMXCC1_WGMXCCGn1
    SolutionIndex: 311
    SolutionNameMin: Cijk_Ailk_Bjlk_BBS_BH_Bias_SHB_HA_S_SAB_SCD_SAV_UserArgs_MT16x16x128_MI16x16x1_SN_LDSB1_AFC1_AFEM1_AFEM1_ASEM1_CLR1_CADS0_DTLA0_DTLB0_DTVA0_DTVB0_EPS1_FDSI0_GRPM1_GRVWA8_GRVWB8_GSU1_GSUAMB_GSUC0_GSUWGMRR0_GLS0_ISA1201_IU8_K1_LBSPPA256_LBSPPB256_LBSPPM0_LPA16_LPB16_LPM0_LRVW8_LWPMn1_MIAV1_MIWT1_1_MO40_NTn1_NTA0_NTB0_NTC0_NTD0_NTM0_NEPBS0_NLCA1_NLCB1_ONLL0_PGR1_PLR1_PKA0_SIA2_SS1_SU32_SUM1_SUS256_SPO0_SRVW0_SSO0_SVW1_SK0_SKXCCM0_TLDS0_ULSGRO0_USL1_UIOFGRO0_USFGROn1_VSn1_VWA1_VWB1_WSGRA0_WSGRB0_WS32_WG16_2_1_WGM8_WGMXCC1_WGMXCCGn1
    SolutionIndex: 313
    SolutionNameMin: Cijk_Ailk_Bjlk_BBS_BH_Bias_SHB_HA_S_SAB_SCD_SAV_UserArgs_MT32x32x128_MI16x16x1_SN_LDSB0_AFC1_AFEM1_AFEM1_ASEM1_CLR1_CADS0_DTLA0_DTLB0_DTVA0_DTVB1_EPS1_FDSI0_GRPM1_GRVWA8_GRVWB8_GSU1_GSUAMB_GSUC0_GSUWGMRR0_GLS0_ISA1201_IU1_K1_LBSPPA512_LBSPPB0_LBSPPM0_LPA16_LPB0_LPM0_LRVW8_LWPMn1_MIAV1_MIWT1_1_MO40_NTn1_NTA0_NTB0_NTC0_NTD0_NTM0_NEPBS0_NLCA1_NLCB1_ONLL0_PGR1_PLR1_PKA0_SIA3_SS0_SU32_SUM1_SUS256_SPO0_SRVW0_SSO0_SVW8_SK0_SKXCCM0_TLDS0_ULSGRO0_USL1_UIOFGRO0_USFGROn1_VSn1_VWA1_VWB1_WSGRA0_WSGRB0_WS32_WG32_4_1_WGM8_WGMXCC1_WGMXCCGn1
    SolutionIndex: 314
    SolutionNameMin: Cijk_Ailk_Bjlk_BBS_BH_Bias_SHB_HA_S_SAB_SCD_SAV_UserArgs_MT128x64x32_MI16x16x1_SN_LDSB0_AFC1_AFEM1_AFEM1_ASEM1_CLR1_CADS0_DTLA0_DTLB0_DTVA1_DTVB0_EPS0_FDSI0_GRPM1_GRVWA8_GRVWB8_GSU1_GSUAMB_GSUC0_GSUWGMRR0_GLS0_ISA1201_IU1_K1_LBSPPA0_LBSPPB1024_LBSPPM0_LPA0_LPB16_LPM0_LRVW8_LWPMn1_MIAV1_MIWT8_1_MO40_NTn1_NTA0_NTB0_NTC0_NTD0_NTM0_NEPBS0_NLCA2_NLCB1_ONLL0_PGR2_PLR1_PKA0_SIA3_SS1_SU32_SUM1_SUS256_SPO0_SRVW0_SSO0_SVW1_SK0_SKXCCM0_TLDS0_ULSGRO0_USL1_UIOFGRO0_USFGROn1_VSn1_VWA1_VWB1_WSGRA0_WSGRB0_WS32_WG16_8_1_WGM8_WGMXCC1_WGMXCCGn1
    SolutionIndex: 315
    SolutionNameMin: Cijk_Ailk_Bjlk_BBS_BH_Bias_SHB_HA_S_SAB_SCD_SAV_UserArgs_MT128x128x16_MI16x16x1_SN_LDSB0_AFC1_AFEM1_AFEM1_ASEM1_CLR1_CADS0_DTLA0_DTLB0_DTVA1_DTVB1_EPS0_FDSI0_GRPM1_GRVWA8_GRVWB8_GSU1_GSUAMB_GSUC0_GSUWGMRR0_GLS0_ISA1201_IU1_K1_LBSPPA0_LBSPPB0_LBSPPM0_LPA0_LPB0_LPM0_LRVW8_LWPMn1_MIAV1_MIWT4_4_MO40_NTn1_NTA0_NTB0_NTC0_NTD0_NTM0_NEPBS0_NLCA1_NLCB1_ONLL0_PGR1_PLR0_PKA0_SIA3_SS1_SU32_SUM1_SUS256_SPO0_SRVW0_SSO0_SVW1_SK0_SKXCCM0_TLDS0_ULSGRO0_USL1_UIOFGRO0_USFGROn1_VSn1_VWA1_VWB1_WSGRA0_WSGRB0_WS32_WG32_4_1_WGM8_WGMXCC1_WGMXCCGn1
    SolutionIndex: 317
    SolutionNameMin: Cijk_Ailk_Bjlk_BBS_BH_Bias_SHB_HA_S_SAB_SCD_SAV_UserArgs_MT32x32x64_MI16x16x1_SN_LDSB0_AFC1_AFEM1_AFEM1_ASEM1_CLR1_CADS0_DTLA0_DTLB0_DTVA1_DTVB1_EPS0_FDSI0_GRPM1_GRVWA8_GRVWB8_GSU1_GSUAMB_GSUC0_GSUWGMRR0_GLS0_ISA1201_IU1_K1_LBSPPA0_LBSPPB0_LBSPPM0_LPA0_LPB0_LPM0_LRVW8_LWPMn1_MIAV1_MIWT1_1_MO40_NTn1_NTA0_NTB0_NTC0_NTD0_NTM0_NEPBS0_NLCA1_NLCB1_ONLL0_PGR1_PLR0_PKA0_SIA3_SS0_SU32_SUM1_SUS256_SPO0_SRVW0_SSO0_SVW8_SK0_SKXCCM0_TLDS0_ULSGRO0_USL1_UIOFGRO0_USFGROn1_VSn1_VWA1_VWB1_WSGRA0_WSGRB0_WS32_WG32_4_1_WGM8_WGMXCC1_WGMXCCGn1
    SolutionIndex: 318
    SolutionNameMin: Cijk_Ailk_Bjlk_BBS_BH_Bias_SHB_HA_S_SAB_SCD_SAV_UserArgs_MT64x64x32_MI16x16x1_SN_LDSB0_AFC1_AFEM1_AFEM1_ASEM1_CLR1_CADS0_DTLA0_DTLB0_DTVA1_DTVB0_EPS1_FDSI0_GRPM1_GRVWA8_GRVWB8_GSU1_GSUAMB_GSUC0_GSUWGMRR0_GLS0_ISA1201_IU1_K1_LBSPPA0_LBSPPB1024_LBSPPM0_LPA0_LPB32_LPM0_LRVW8_LWPMn1_MIAV1_MIWT2_2_MO40_NTn1_NTA0_NTB0_NTC0_NTD0_NTM0_NEPBS0_NLCA2_NLCB1_ONLL0_PGR1_PLR1_PKA0_SIA3_SS0_SU32_SUM1_SUS256_SPO0_SRVW0_SSO0_SVW8_SK0_SKXCCM0_TLDS0_ULSGRO0_USL1_UIOFGRO0_USFGROn1_VSn1_VWA1_VWB2_WSGRA0_WSGRB0_WS32_WG32_4_1_WGM8_WGMXCC1_WGMXCCGn1
    SolutionIndex: 319
    SolutionNameMin: Cijk_Ailk_Bjlk_BBS_BH_Bias_SHB_HA_S_SAB_SCD_SAV_UserArgs_MT64x64x32_MI16x16x1_SN_LDSB1_AFC1_AFEM1_AFEM1_ASEM1_CLR1_CADS0_DTLA0_DTLB0_DTVA0_DTVB0_EPS0_FDSI0_GRPM1_GRVWA1_GRVWB8_GSU1_GSUAMB_GSUC0_GSUWGMRR0_GLS0_ISA1201_IU2_K1_LBSPPA1024_LBSPPB1024_LBSPPM0_LPA32_LPB32_LPM0_LRVW8_LWPMn1_MIAV1_MIWT2_2_MO40_NTn1_NTA0_NTB0_NTC0_NTD0_NTM0_NEPBS0_NLCA1_NLCB1_ONLL0_PGR2_PLR1_PKA0_SIA2_SS0_SU32_SUM1_SUS256_SPO0_SRVW0_SSO0_SVW8_SK0_SKXCCM0_TLDS0_ULSGRO1_USL1_UIOFGRO0_USFGROn1_VSn1_VWA2_VWB2_WSGRA0_WSGRB0_WS32_WG32_4_1_WGM8_WGMXCC1_WGMXCCGn1
    SolutionIndex: 320
    SolutionNameMin: Cijk_Ailk_Bjlk_BBS_BH_Bias_SHB_HA_S_SAB_SCD_SAV_UserArgs_MT32x16x64_MI16x16x1_SN_LDSB0_AFC1_AFEM1_AFEM1_ASEM1_CLR1_CADS0_DTLA0_DTLB0_DTVA1_DTVB0_EPS1_FDSI0_GRPM1_GRVWA8_GRVWB4_GSU1_GSUAMB_GSUC0_GSUWGMRR0_GLS0_ISA1201_IU1_K1_LBSPPA0_LBSPPB256_LBSPPM0_LPA0_LPB16_LPM0_LRVW8_LWPMn1_MIAV1_MIWT1_1_MO40_NTn1_NTA0_NTB0_NTC0_NTD0_NTM0_NEPBS0_NLCA1_NLCB1_ONLL0_PGR1_PLR1_PKA0_SIA3_SS0_SU32_SUM1_SUS256_SPO0_SRVW0_SSO0_SVW8_SK0_SKXCCM0_TLDS0_ULSGRO0_USL1_UIOFGRO0_USFGROn1_VSn1_VWA1_VWB1_WSGRA0_WSGRB0_WS32_WG32_2_1_WGM8_WGMXCC1_WGMXCCGn1
    SolutionIndex: 321
    SolutionNameMin: Cijk_Ailk_Bjlk_BBS_BH_Bias_SHB_HA_S_SAB_SCD_SAV_UserArgs_MT64x64x32_MI16x16x1_SN_LDSB1_AFC1_AFEM1_AFEM1_ASEM1_CLR1_CADS0_DTLA0_DTLB0_DTVA0_DTVB0_EPS0_FDSI0_GRPM1_GRVWA8_GRVWB8_GSU1_GSUAMB_GSUC0_GSUWGMRR0_GLS0_ISA1201_IU2_K1_LBSPPA1024_LBSPPB1024_LBSPPM0_LPA32_LPB32_LPM0_LRVW8_LWPMn1_MIAV1_MIWT2_2_MO40_NTn1_NTA0_NTB0_NTC0_NTD0_NTM0_NEPBS0_NLCA1_NLCB1_ONLL0_PGR2_PLR1_PKA0_SIA2_SS0_SU32_SUM1_SUS256_SPO0_SRVW0_SSO0_SVW8_SK0_SKXCCM0_TLDS0_ULSGRO0_USL1_UIOFGRO0_USFGROn1_VSn1_VWA2_VWB2_WSGRA0_WSGRB0_WS32_WG32_4_1_WGM8_WGMXCC1_WGMXCCGn1
    SolutionIndex: 322
    SolutionNameMin: Cijk_Ailk_Bjlk_BBS_BH_Bias_SHB_HA_S_SAB_SCD_SAV_UserArgs_MT64x64x16_MI16x16x1_SN_LDSB1_AFC1_AFEM1_AFEM1_ASEM1_CLR1_CADS0_DTLA0_DTLB0_DTVA0_DTVB0_EPS0_FDSI0_GRPM1_GRVWA1_GRVWB4_GSU1_GSUAMB_GSUC0_GSUWGMRR0_GLS0_ISA1201_IU1_K1_LBSPPA1024_LBSPPB1024_LBSPPM0_LPA32_LPB32_LPM0_LRVW8_LWPMn1_MIAV1_MIWT2_2_MO40_NTn1_NTA0_NTB0_NTC0_NTD0_NTM0_NEPBS0_NLCA1_NLCB1_ONLL0_PGR2_PLR1_PKA0_SIA2_SS0_SU32_SUM1_SUS256_SPO0_SRVW0_SSO0_SVW8_SK0_SKXCCM0_TLDS0_ULSGRO1_USL1_UIOFGRO0_USFGROn1_VSn1_VWA2_VWB2_WSGRA0_WSGRB0_WS32_WG32_4_1_WGM8_WGMXCC1_WGMXCCGn1
    SolutionIndex: 323
    SolutionNameMin: Cijk_Ailk_Bjlk_BBS_BH_Bias_SHB_HA_S_SAB_SCD_SAV_UserArgs_MT64x64x16_MI16x16x1_SN_LDSB1_AFC1_AFEM1_AFEM1_ASEM1_CLR1_CADS0_DTLA0_DTLB0_DTVA0_DTVB0_EPS0_FDSI0_GRPM1_GRVWA1_GRVWB1_GSU1_GSUAMB_GSUC0_GSUWGMRR0_GLS0_ISA1201_IU1_K1_LBSPPA1024_LBSPPB1024_LBSPPM0_LPA32_LPB32_LPM0_LRVW8_LWPMn1_MIAV1_MIWT2_2_MO40_NTn1_NTA0_NTB0_NTC0_NTD0_NTM0_NEPBS0_NLCA1_NLCB1_ONLL0_PGR2_PLR1_PKA0_SIA2_SS0_SU32_SUM1_SUS256_SPO0_SRVW0_SSO0_SVW8_SK0_SKXCCM0_TLDS0_ULSGRO1_USL1_UIOFGRO0_USFGROn1_VSn1_VWA2_VWB2_WSGRA0_WSGRB0_WS32_WG32_4_1_WGM8_WGMXCC1_WGMXCCGn1
    SolutionIndex: 324
    SolutionNameMin: Cijk_Ailk_Bjlk_BBS_BH_Bias_SHB_HA_S_SAB_SCD_SAV_UserArgs_MT64x64x64_MI16x16x1_SN_LDSB1_AFC1_AFEM1_AFEM1_ASEM1_CLR1_CADS0_DTLA0_DTLB0_DTVA0_DTVB0_EPS0_FDSI0_GRPM1_GRVWA4_GRVWB8_GSU1_GSUAMB_GSUC0_GSUWGMRR0_GLS0_ISA1201_IU4_K1_LBSPPA1024_LBSPPB1024_LBSPPM0_LPA32_LPB32_LPM0_LRVW8_LWPMn1_MIAV1_MIWT2_2_MO40_NTn1_NTA0_NTB0_NTC0_NTD0_NTM0_NEPBS0_NLCA1_NLCB1_ONLL0_PGR2_PLR1_PKA0_SIA2_SS0_SU32_SUM1_SUS256_SPO0_SRVW0_SSO0_SVW8_SK0_SKXCCM0_TLDS0_ULSGRO0_USL1_UIOFGRO0_USFGROn1_VSn1_VWA2_VWB2_WSGRA0_WSGRB0_WS32_WG32_4_1_WGM8_WGMXCC1_WGMXCCGn1
    SolutionIndex: 325
    SolutionNameMin: Cijk_Ailk_Bjlk_BBS_BH_Bias_SHB_HA_S_SAB_SCD_SAV_UserArgs_MT16x128x32_MI16x16x1_SN_LDSB0_AFC1_AFEM1_AFEM1_ASEM1_CLR1_CADS0_DTLA0_DTLB0_DTVA0_DTVB1_EPS0_FDSI0_GRPM1_GRVWA4_GRVWB8_GSU1_GSUAMB_GSUC0_GSUWGMRR0_GLS0_ISA1201_IU1_K1_LBSPPA256_LBSPPB0_LBSPPM0_LPA16_LPB0_LPM0_LRVW8_LWPMn1_MIAV1_MIWT1_8_MO40_NTn1_NTA0_NTB0_NTC0_NTD0_NTM0_NEPBS0_NLCA1_NLCB2_ONLL0_PGR2_PLR1_PKA0_SIA3_SS0_SU32_SUM1_SUS256_SPO0_SRVW0_SSO0_SVW8_SK0_SKXCCM0_TLDS0_ULSGRO0_USL1_UIOFGRO0_USFGROn1_VSn1_VWA1_VWB1_WSGRA0_WSGRB0_WS32_WG16_2_1_WGM8_WGMXCC1_WGMXCCGn1
    SolutionIndex: 326
    SolutionNameMin: Cijk_Ailk_Bjlk_BBS_BH_Bias_SHB_HA_S_SAB_SCD_SAV_UserArgs_MT32x32x128_MI16x16x1_SN_LDSB0_AFC1_AFEM1_AFEM1_ASEM1_CLR1_CADS0_DTLA0_DTLB0_DTVA0_DTVB1_EPS1_FDSI0_GRPM1_GRVWA8_GRVWB8_GSU1_GSUAMB_GSUC0_GSUWGMRR0_GLS0_ISA1201_IU1_K1_LBSPPA512_LBSPPB0_LBSPPM0_LPA16_LPB0_LPM0_LRVW8_LWPMn1_MIAV1_MIWT1_1_MO40_NTn1_NTA0_NTB0_NTC0_NTD0_NTM0_NEPBS0_NLCA1_NLCB1_ONLL0_PGR1_PLR1_PKA0_SIA3_SS1_SU32_SUM1_SUS256_SPO0_SRVW0_SSO0_SVW1_SK0_SKXCCM0_TLDS0_ULSGRO0_USL1_UIOFGRO0_USFGROn1_VSn1_VWA1_VWB1_WSGRA0_WSGRB0_WS32_WG32_4_1_WGM8_WGMXCC1_WGMXCCGn1
    SolutionIndex: 327
    SolutionNameMin: Cijk_Ailk_Bjlk_BBS_BH_Bias_SHB_HA_S_SAB_SCD_SAV_UserArgs_MT32x32x128_MI16x16x1_SN_LDSB0_AFC1_AFEM1_AFEM1_ASEM1_CLR1_CADS0_DTLA0_DTLB0_DTVA1_DTVB0_EPS1_FDSI0_GRPM1_GRVWA8_GRVWB8_GSU1_GSUAMB_GSUC0_GSUWGMRR0_GLS0_ISA1201_IU1_K1_LBSPPA0_LBSPPB512_LBSPPM0_LPA0_LPB16_LPM0_LRVW8_LWPMn1_MIAV1_MIWT1_1_MO40_NTn1_NTA0_NTB0_NTC0_NTD0_NTM0_NEPBS0_NLCA1_NLCB1_ONLL0_PGR1_PLR1_PKA0_SIA3_SS1_SU32_SUM1_SUS256_SPO0_SRVW0_SSO0_SVW1_SK0_SKXCCM0_TLDS0_ULSGRO0_USL1_UIOFGRO0_USFGROn1_VSn1_VWA1_VWB1_WSGRA0_WSGRB0_WS32_WG32_4_1_WGM8_WGMXCC1_WGMXCCGn1
    SolutionIndex: 328
    SolutionNameMin: Cijk_Ailk_Bjlk_BBS_BH_Bias_SHB_HA_S_SAB_SCD_SAV_UserArgs_MT128x64x32_MI16x16x1_SN_LDSB0_AFC1_AFEM1_AFEM1_ASEM1_CLR1_CADS0_DTLA0_DTLB0_DTVA1_DTVB0_EPS1_FDSI0_GRPM1_GRVWA8_GRVWB8_GSU1_GSUAMB_GSUC0_GSUWGMRR0_GLS0_ISA1201_IU1_K1_LBSPPA0_LBSPPB1024_LBSPPM0_LPA0_LPB16_LPM0_LRVW8_LWPMn1_MIAV1_MIWT8_1_MO40_NTn1_NTA0_NTB0_NTC0_NTD0_NTM0_NEPBS0_NLCA2_NLCB1_ONLL0_PGR1_PLR1_PKA0_SIA3_SS1_SU32_SUM1_SUS256_SPO0_SRVW0_SSO0_SVW1_SK0_SKXCCM0_TLDS0_ULSGRO0_USL1_UIOFGRO0_USFGROn1_VSn1_VWA1_VWB1_WSGRA0_WSGRB0_WS32_WG16_8_1_WGM8_WGMXCC1_WGMXCCGn1
    SolutionIndex: 329
    SolutionNameMin: Cijk_Ailk_Bjlk_BBS_BH_Bias_SHB_HA_S_SAB_SCD_SAV_UserArgs_MT128x64x32_MI16x16x1_SN_LDSB0_AFC1_AFEM1_AFEM1_ASEM1_CLR1_CADS0_DTLA0_DTLB0_DTVA1_DTVB0_EPS0_FDSI0_GRPM1_GRVWA8_GRVWB4_GSU1_GSUAMB_GSUC0_GSUWGMRR0_GLS0_ISA1201_IU1_K1_LBSPPA0_LBSPPB1024_LBSPPM0_LPA0_LPB16_LPM0_LRVW8_LWPMn1_MIAV1_MIWT8_1_MO40_NTn1_NTA0_NTB0_NTC0_NTD0_NTM0_NEPBS0_NLCA2_NLCB1_ONLL0_PGR2_PLR1_PKA0_SIA3_SS1_SU32_SUM1_SUS256_SPO0_SRVW0_SSO0_SVW1_SK0_SKXCCM0_TLDS0_ULSGRO0_USL1_UIOFGRO0_USFGROn1_VSn1_VWA1_VWB1_WSGRA0_WSGRB0_WS32_WG16_8_1_WGM8_WGMXCC1_WGMXCCGn1
    SolutionIndex: 330
    SolutionNameMin: Cijk_Ailk_Bjlk_BBS_BH_Bias_SHB_HA_S_SAB_SCD_SAV_UserArgs_MT128x128x16_MI16x16x1_SN_LDSB1_AFC1_AFEM1_AFEM1_ASEM1_CLR1_CADS0_DTLA0_DTLB0_DTVA0_DTVB0_EPS0_FDSI0_GRPM1_GRVWA8_GRVWB8_GSU1_GSUAMB_GSUC0_GSUWGMRR0_GLS0_ISA1201_IU1_K1_LBSPPA2048_LBSPPB2048_LBSPPM0_LPA0_LPB0_LPM0_LRVW8_LWPMn1_MIAV1_MIWT4_4_MO40_NTn1_NTA0_NTB0_NTC0_NTD0_NTM0_NEPBS0_NLCA1_NLCB1_ONLL0_PGR2_PLR1_PKA0_SIA2_SS0_SU32_SUM1_SUS256_SPO0_SRVW0_SSO0_SVW8_SK0_SKXCCM0_TLDS0_ULSGRO1_USL1_UIOFGRO0_USFGROn1_VSn1_VWA4_VWB4_WSGRA0_WSGRB0_WS32_WG32_4_1_WGM8_WGMXCC1_WGMXCCGn1
    SolutionIndex: 335
    SolutionNameMin: Cijk_Ailk_Bjlk_BBS_BH_Bias_SHB_HA_S_SAB_SCD_SAV_UserArgs_MT128x128x16_MI16x16x1_SN_LDSB0_AFC1_AFEM1_AFEM1_ASEM1_CLR1_CADS0_DTLA0_DTLB0_DTVA1_DTVB1_EPS0_FDSI0_GRPM1_GRVWA8_GRVWB8_GSU1_GSUAMB_GSUC0_GSUWGMRR0_GLS0_ISA1201_IU1_K1_LBSPPA0_LBSPPB0_LBSPPM0_LPA0_LPB0_LPM0_LRVW8_LWPMn1_MIAV1_MIWT8_2_MO40_NTn1_NTA0_NTB0_NTC0_NTD0_NTM0_NEPBS0_NLCA1_NLCB1_ONLL0_PGR1_PLR0_PKA0_SIA3_SS1_SU32_SUM1_SUS256_SPO0_SRVW0_SSO0_SVW1_SK0_SKXCCM0_TLDS0_ULSGRO0_USL1_UIOFGRO0_USFGROn1_VSn1_VWA1_VWB1_WSGRA0_WSGRB0_WS32_WG16_8_1_WGM8_WGMXCC1_WGMXCCGn1
    SolutionIndex: 339
    SolutionNameMin: Cijk_Ailk_Bjlk_BBS_BH_Bias_SHB_HA_S_SAB_SCD_SAV_UserArgs_MT128x128x16_MI16x16x1_SN_LDSB1_AFC1_AFEM1_AFEM1_ASEM1_CLR1_CADS0_DTLA0_DTLB0_DTVA0_DTVB0_EPS0_FDSI0_GRPM1_GRVWA4_GRVWB4_GSU1_GSUAMB_GSUC0_GSUWGMRR0_GLS0_ISA1201_IU1_K1_LBSPPA2048_LBSPPB2048_LBSPPM0_LPA0_LPB0_LPM0_LRVW8_LWPMn1_MIAV1_MIWT4_4_MO40_NTn1_NTA0_NTB0_NTC0_NTD0_NTM0_NEPBS0_NLCA1_NLCB1_ONLL0_PGR2_PLR1_PKA0_SIA2_SS1_SU32_SUM1_SUS256_SPO0_SRVW0_SSO0_SVW4_SK0_SKXCCM0_TLDS0_ULSGRO1_USL1_UIOFGRO0_USFGROn1_VSn1_VWA4_VWB4_WSGRA0_WSGRB0_WS32_WG32_4_1_WGM8_WGMXCC1_WGMXCCGn1
    SolutionIndex: 343
    SolutionNameMin: Cijk_Ailk_Bjlk_BBS_BH_Bias_SHB_HA_S_SAB_SCD_SAV_UserArgs_MT128x128x16_MI16x16x1_SN_LDSB1_AFC1_AFEM1_AFEM1_ASEM1_CLR1_CADS0_DTLA0_DTLB0_DTVA0_DTVB0_EPS0_FDSI0_GRPM1_GRVWA8_GRVWB8_GSU1_GSUAMB_GSUC0_GSUWGMRR0_GLS0_ISA1201_IU1_K1_LBSPPA2048_LBSPPB2048_LBSPPM0_LPA0_LPB0_LPM0_LRVW8_LWPMn1_MIAV1_MIWT4_4_MO40_NTn1_NTA0_NTB0_NTC0_NTD0_NTM0_NEPBS0_NLCA1_NLCB1_ONLL0_PGR2_PLR1_PKA0_SIA2_SS1_SU32_SUM1_SUS256_SPO0_SRVW0_SSO0_SVW4_SK0_SKXCCM0_TLDS0_ULSGRO0_USL1_UIOFGRO0_USFGROn1_VSn1_VWA4_VWB4_WSGRA0_WSGRB0_WS32_WG32_4_1_WGM8_WGMXCC1_WGMXCCGn1
    SolutionIndex: 362
    SolutionNameMin: Cijk_Ailk_Bjlk_BBS_BH_Bias_SHB_HA_S_SAB_SCD_SAV_UserArgs_MT64x64x16_MI16x16x1_SN_LDSB1_AFC1_AFEM1_AFEM1_ASEM1_CLR1_CADS0_DTLA0_DTLB0_DTVA0_DTVB0_EPS1_FDSI0_GRPM1_GRVWA1_GRVWB8_GSU1_GSUAMB_GSUC0_GSUWGMRR0_GLS0_ISA1201_IU1_K1_LBSPPA1024_LBSPPB1024_LBSPPM0_LPA32_LPB32_LPM0_LRVW8_LWPMn1_MIAV1_MIWT2_2_MO40_NTn1_NTA0_NTB0_NTC0_NTD0_NTM0_NEPBS0_NLCA1_NLCB1_ONLL0_PGR1_PLR1_PKA0_SIA2_SS0_SU32_SUM1_SUS256_SPO0_SRVW0_SSO0_SVW8_SK0_SKXCCM0_TLDS0_ULSGRO0_USL1_UIOFGRO0_USFGROn1_VSn1_VWA2_VWB2_WSGRA0_WSGRB0_WS32_WG32_4_1_WGM8_WGMXCC1_WGMXCCGn1
    SolutionIndex: 363
    SolutionNameMin: Cijk_Ailk_Bjlk_BBS_BH_Bias_SHB_HA_S_SAB_SCD_SAV_UserArgs_MT64x64x32_MI16x16x1_SN_LDSB1_AFC1_AFEM1_AFEM1_ASEM1_CLR1_CADS0_DTLA0_DTLB0_DTVA0_DTVB0_EPS0_FDSI0_GRPM1_GRVWA4_GRVWB4_GSU1_GSUAMB_GSUC0_GSUWGMRR0_GLS0_ISA1201_IU2_K1_LBSPPA1024_LBSPPB1024_LBSPPM0_LPA32_LPB32_LPM0_LRVW8_LWPMn1_MIAV1_MIWT2_2_MO40_NTn1_NTA0_NTB0_NTC0_NTD0_NTM0_NEPBS0_NLCA1_NLCB1_ONLL0_PGR2_PLR1_PKA0_SIA2_SS0_SU32_SUM1_SUS256_SPO0_SRVW0_SSO0_SVW8_SK0_SKXCCM0_TLDS0_ULSGRO1_USL1_UIOFGRO0_USFGROn1_VSn1_VWA2_VWB2_WSGRA0_WSGRB0_WS32_WG32_4_1_WGM8_WGMXCC1_WGMXCCGn1
    SolutionIndex: 364
    SolutionNameMin: Cijk_Ailk_Bjlk_BBS_BH_Bias_SHB_HA_S_SAB_SCD_SAV_UserArgs_MT64x64x16_MI16x16x1_SN_LDSB0_AFC1_AFEM1_AFEM1_ASEM1_CLR0_CADS0_DTLA0_DTLB0_DTVA0_DTVB0_EPS0_FDSI0_GRPM1_GRVWA1_GRVWB1_GSU1_GSUAMB_GSUC0_GSUWGMRR0_GLS0_ISA1201_IU1_K1_LBSPPA1024_LBSPPB1024_LBSPPM0_LPA32_LPB32_LPM0_LRVW8_LWPMn1_MIAV1_MIWT2_2_MO40_NTn1_NTA0_NTB0_NTC0_NTD0_NTM0_NEPBS0_NLCA1_NLCB1_ONLL0_PGR2_PLR0_PKA0_SIA3_SS0_SU32_SUM1_SUS256_SPO0_SRVW0_SSO0_SVW8_SK0_SKXCCM0_TLDS0_ULSGRO0_USL1_UIOFGRO0_USFGROn1_VSn1_VWA2_VWB2_WSGRA0_WSGRB0_WS32_WG32_4_1_WGM8_WGMXCC1_WGMXCCGn1
    SolutionIndex: 365
    SolutionNameMin: Cijk_Ailk_Bjlk_BBS_BH_Bias_SHB_HA_S_SAB_SCD_SAV_UserArgs_MT64x64x16_MI16x16x1_SN_LDSB0_AFC1_AFEM1_AFEM1_ASEM1_CLR0_CADS0_DTLA0_DTLB0_DTVA0_DTVB0_EPS0_FDSI0_GRPM1_GRVWA1_GRVWB8_GSU1_GSUAMB_GSUC0_GSUWGMRR0_GLS0_ISA1201_IU1_K1_LBSPPA1024_LBSPPB1024_LBSPPM0_LPA32_LPB32_LPM0_LRVW8_LWPMn1_MIAV1_MIWT2_2_MO40_NTn1_NTA0_NTB0_NTC0_NTD0_NTM0_NEPBS0_NLCA1_NLCB1_ONLL0_PGR2_PLR0_PKA0_SIA3_SS0_SU32_SUM1_SUS256_SPO0_SRVW0_SSO0_SVW8_SK0_SKXCCM0_TLDS0_ULSGRO0_USL1_UIOFGRO0_USFGROn1_VSn1_VWA2_VWB2_WSGRA0_WSGRB0_WS32_WG32_4_1_WGM8_WGMXCC1_WGMXCCGn1
    SolutionIndex: 366
    SolutionNameMin: Cijk_Ailk_Bjlk_BBS_BH_Bias_SHB_HA_S_SAB_SCD_SAV_UserArgs_MT64x128x16_MI16x16x1_SN_LDSB1_AFC1_AFEM1_AFEM1_ASEM1_CLR1_CADS0_DTLA0_DTLB0_DTVA0_DTVB0_EPS0_FDSI0_GRPM1_GRVWA4_GRVWB8_GSU1_GSUAMB_GSUC0_GSUWGMRR0_GLS0_ISA1201_IU1_K1_LBSPPA1024_LBSPPB2048_LBSPPM0_LPA16_LPB0_LPM0_LRVW8_LWPMn1_MIAV1_MIWT1_8_MO40_NTn1_NTA0_NTB0_NTC0_NTD0_NTM0_NEPBS0_NLCA1_NLCB1_ONLL0_PGR2_PLR1_PKA0_SIA2_SS0_SU32_SUM1_SUS256_SPO0_SRVW0_SSO0_SVW8_SK0_SKXCCM0_TLDS0_ULSGRO0_USL1_UIOFGRO0_USFGROn1_VSn1_VWA1_VWB8_WSGRA0_WSGRB0_WS32_WG64_2_1_WGM8_WGMXCC1_WGMXCCGn1
    SolutionIndex: 367
    SolutionNameMin: Cijk_Ailk_Bjlk_BBS_BH_Bias_SHB_HA_S_SAB_SCD_SAV_UserArgs_MT64x64x64_MI16x16x1_SN_LDSB1_AFC1_AFEM1_AFEM1_ASEM1_CLR1_CADS0_DTLA0_DTLB0_DTVA0_DTVB0_EPS1_FDSI0_GRPM1_GRVWA4_GRVWB4_GSU1_GSUAMB_GSUC0_GSUWGMRR0_GLS0_ISA1201_IU4_K1_LBSPPA1024_LBSPPB1024_LBSPPM0_LPA32_LPB32_LPM0_LRVW8_LWPMn1_MIAV1_MIWT2_2_MO40_NTn1_NTA0_NTB0_NTC0_NTD0_NTM0_NEPBS0_NLCA1_NLCB1_ONLL0_PGR1_PLR1_PKA0_SIA2_SS1_SU32_SUM1_SUS256_SPO0_SRVW0_SSO0_SVW2_SK0_SKXCCM0_TLDS0_ULSGRO0_USL1_UIOFGRO0_USFGROn1_VSn1_VWA2_VWB2_WSGRA0_WSGRB0_WS32_WG32_4_1_WGM8_WGMXCC1_WGMXCCGn1
    SolutionIndex: 368
    SolutionNameMin: Cijk_Ailk_Bjlk_BBS_BH_Bias_SHB_HA_S_SAB_SCD_SAV_UserArgs_MT64x64x32_MI16x16x1_SN_LDSB0_AFC1_AFEM1_AFEM1_ASEM1_CLR1_CADS0_DTLA0_DTLB0_DTVA1_DTVB0_EPS1_FDSI0_GRPM1_GRVWA8_GRVWB4_GSU1_GSUAMB_GSUC0_GSUWGMRR0_GLS0_ISA1201_IU1_K1_LBSPPA0_LBSPPB1024_LBSPPM0_LPA0_LPB32_LPM0_LRVW8_LWPMn1_MIAV1_MIWT2_2_MO40_NTn1_NTA0_NTB0_NTC0_NTD0_NTM0_NEPBS0_NLCA2_NLCB1_ONLL0_PGR1_PLR1_PKA0_SIA3_SS0_SU32_SUM1_SUS256_SPO0_SRVW0_SSO0_SVW8_SK0_SKXCCM0_TLDS0_ULSGRO0_USL1_UIOFGRO0_USFGROn1_VSn1_VWA1_VWB2_WSGRA0_WSGRB0_WS32_WG32_4_1_WGM8_WGMXCC1_WGMXCCGn1
    SolutionIndex: 369
    SolutionNameMin: Cijk_Ailk_Bjlk_BBS_BH_Bias_SHB_HA_S_SAB_SCD_SAV_UserArgs_MT64x64x32_MI16x16x1_SN_LDSB0_AFC1_AFEM1_AFEM1_ASEM1_CLR1_CADS0_DTLA0_DTLB0_DTVA0_DTVB1_EPS1_FDSI0_GRPM1_GRVWA4_GRVWB8_GSU1_GSUAMB_GSUC0_GSUWGMRR0_GLS0_ISA1201_IU1_K1_LBSPPA1024_LBSPPB0_LBSPPM0_LPA32_LPB0_LPM0_LRVW8_LWPMn1_MIAV1_MIWT2_2_MO40_NTn1_NTA0_NTB0_NTC0_NTD0_NTM0_NEPBS0_NLCA1_NLCB2_ONLL0_PGR1_PLR1_PKA0_SIA3_SS1_SU32_SUM1_SUS256_SPO0_SRVW0_SSO0_SVW2_SK0_SKXCCM0_TLDS0_ULSGRO0_USL1_UIOFGRO0_USFGROn1_VSn1_VWA2_VWB1_WSGRA0_WSGRB0_WS32_WG32_4_1_WGM8_WGMXCC1_WGMXCCGn1
    SolutionIndex: 370
    SolutionNameMin: Cijk_Ailk_Bjlk_BBS_BH_Bias_SHB_HA_S_SAB_SCD_SAV_UserArgs_MT64x128x32_MI16x16x1_SN_LDSB0_AFC1_AFEM1_AFEM1_ASEM1_CLR1_CADS0_DTLA0_DTLB0_DTVA0_DTVB1_EPS0_FDSI0_GRPM1_GRVWA4_GRVWB8_GSU1_GSUAMB_GSUC0_GSUWGMRR0_GLS0_ISA1201_IU1_K1_LBSPPA1024_LBSPPB0_LBSPPM0_LPA16_LPB0_LPM0_LRVW8_LWPMn1_MIAV1_MIWT1_8_MO40_NTn1_NTA0_NTB0_NTC0_NTD0_NTM0_NEPBS0_NLCA1_NLCB2_ONLL0_PGR2_PLR1_PKA0_SIA3_SS1_SU32_SUM1_SUS256_SPO0_SRVW0_SSO0_SVW1_SK0_SKXCCM0_TLDS0_ULSGRO0_USL1_UIOFGRO0_USFGROn1_VSn1_VWA1_VWB1_WSGRA0_WSGRB0_WS32_WG64_2_1_WGM8_WGMXCC1_WGMXCCGn1
    SolutionIndex: 371
    SolutionNameMin: Cijk_Ailk_Bjlk_BBS_BH_Bias_SHB_HA_S_SAB_SCD_SAV_UserArgs_MT64x128x32_MI16x16x1_SN_LDSB0_AFC1_AFEM1_AFEM1_ASEM1_CLR1_CADS0_DTLA0_DTLB0_DTVA0_DTVB1_EPS0_FDSI0_GRPM1_GRVWA8_GRVWB8_GSU1_GSUAMB_GSUC0_GSUWGMRR0_GLS0_ISA1201_IU1_K1_LBSPPA1024_LBSPPB0_LBSPPM0_LPA16_LPB0_LPM0_LRVW8_LWPMn1_MIAV1_MIWT1_8_MO40_NTn1_NTA0_NTB0_NTC0_NTD0_NTM0_NEPBS0_NLCA1_NLCB2_ONLL0_PGR2_PLR1_PKA0_SIA3_SS1_SU32_SUM1_SUS256_SPO0_SRVW0_SSO0_SVW1_SK0_SKXCCM0_TLDS0_ULSGRO0_USL1_UIOFGRO0_USFGROn1_VSn1_VWA1_VWB1_WSGRA0_WSGRB0_WS32_WG64_2_1_WGM8_WGMXCC1_WGMXCCGn1
- - - [512, 512, 1, 64]
    - [163, 1.52]
  - - [1024, 512, 1, 64]
    - [167, 2.75]
  - - [1536, 512, 1, 64]
    - [6, 2764.79]
  - - [2048, 512, 1, 64]
    - [15, 3519.82]
  - - [2560, 512, 1, 64]
    - [7, 4377.96]
  - - [3072, 512, 1, 64]
    - [5, 5057.82]
  - - [512, 1024, 1, 64]
    - [175, 2.76]
  - - [1024, 1024, 1, 64]
    - [239, 4.45]
  - - [1536, 1024, 1, 64]
    - [282, 5.77]
  - - [2048, 1024, 1, 64]
    - [282, 6.91]
  - - [2560, 1024, 1, 64]
    - [4, 7148.67]
  - - [3072, 1024, 1, 64]
    - [4, 7922.19]
  - - [512, 1536, 1, 64]
    - [4, 2895.54]
  - - [1024, 1536, 1, 64]
    - [282, 5.85]
  - - [1536, 1536, 1, 64]
    - [282, 7.03]
  - - [2048, 1536, 1, 64]
    - [282, 8.24]
  - - [2560, 1536, 1, 64]
    - [7, 9019.2]
  - - [3072, 1536, 1, 64]
    - [5, 9848.67]
  - - [512, 2048, 1, 64]
    - [4, 3739.91]
  - - [1024, 2048, 1, 64]
    - [281, 6.91]
  - - [1536, 2048, 1, 64]
    - [281, 8.0]
  - - [2048, 2048, 1, 64]
    - [282, 9.18]
  - - [2560, 2048, 1, 64]
    - [2, 10608.8]
  - - [3072, 2048, 1, 64]
    - [4, 12018.4]
  - - [512, 2560, 1, 64]
    - [5, 4229.73]
  - - [1024, 2560, 1, 64]
    - [4, 7224.09]
  - - [1536, 2560, 1, 64]
    - [5, 8998.24]
  - - [2048, 2560, 1, 64]
    - [1, 10791.5]
  - - [2560, 2560, 1, 64]
    - [5, 12205.3]
  - - [3072, 2560, 1, 64]
    - [3, 12526.4]
  - - [512, 3072, 1, 64]
    - [17, 3995.76]
  - - [1024, 3072, 1, 64]
    - [7, 7679.97]
  - - [1536, 3072, 1, 64]
    - [1, 10270.0]
  - - [2048, 3072, 1, 64]
    - [4, 11815.3]
  - - [2560, 3072, 1, 64]
    - [5, 12965.9]
  - - [3072, 3072, 1, 64]
    - [7, 13879.2]
  - - [512, 512, 1, 256]
    - [208, 5.42]
  - - [1024, 512, 1, 256]
    - [276, 9.23]
  - - [1536, 512, 1, 256]
    - [6, 8778.71]
  - - [2048, 512, 1, 256]
    - [4, 10953.9]
  - - [2560, 512, 1, 256]
    - [15, 12527.3]
  - - [3072, 512, 1, 256]
    - [0, 9610.21]
  - - [512, 1024, 1, 256]
    - [280, 9.36]
  - - [1024, 1024, 1, 256]
    - [282, 14.46]
  - - [1536, 1024, 1, 256]
    - [282, 17.57]
  - - [2048, 1024, 1, 256]
    - [281, 19.6]
  - - [2560, 1024, 1, 256]
    - [4, 18361.3]
  - - [3072, 1024, 1, 256]
    - [13, 19686.5]
  - - [512, 1536, 1, 256]
    - [4, 8780.82]
  - - [1024, 1536, 1, 256]
    - [282, 17.84]
  - - [1536, 1536, 1, 256]
    - [282, 19.59]
  - - [2048, 1536, 1, 256]
    - [281, 22.82]
  - - [2560, 1536, 1, 256]
    - [4, 21248.4]
  - - [3072, 1536, 1, 256]
    - [4, 22807.0]
  - - [512, 2048, 1, 256]
    - [14, 7492.55]
  - - [1024, 2048, 1, 256]
    - [282, 19.84]
  - - [1536, 2048, 1, 256]
    - [339, 21.35]
  - - [2048, 2048, 1, 256]
    - [282, 23.79]
  - - [2560, 2048, 1, 256]
    - [4, 23864.7]
  - - [3072, 2048, 1, 256]
    - [4, 25187.5]
  - - [512, 2560, 1, 256]
    - [4, 12600.2]
  - - [1024, 2560, 1, 256]
    - [15, 18341.3]
  - - [1536, 2560, 1, 256]
    - [4, 21642.2]
  - - [2048, 2560, 1, 256]
    - [4, 23746.5]
  - - [2560, 2560, 1, 256]
    - [4, 25374.1]
  - - [3072, 2560, 1, 256]
    - [4, 26900.8]
  - - [512, 3072, 1, 256]
    - [13, 14040.0]
  - - [1024, 3072, 1, 256]
    - [4, 20017.3]
  - - [1536, 3072, 1, 256]
    - [4, 22886.9]
  - - [2048, 3072, 1, 256]
    - [4, 25132.2]
  - - [2560, 3072, 1, 256]
    - [0, 26647.4]
  - - [3072, 3072, 1, 256]
    - [15, 27327.5]
  - - [512, 512, 1, 512]
    - [191, 9.18]
  - - [1024, 512, 1, 512]
    - [276, 14.88]
  - - [1536, 512, 1, 512]
    - [15, 14221.5]
  - - [2048, 512, 1, 512]
    - [13, 17068.4]
  - - [2560, 512, 1, 512]
    - [15, 18650.2]
  - - [3072, 512, 1, 512]
    - [4, 20663.2]
  - - [512, 1024, 1, 512]
    - [271, 15.33]
  - - [1024, 1024, 1, 512]
    - [282, 22.78]
  - - [1536, 1024, 1, 512]
    - [4, 20655.0]
  - - [2048, 1024, 1, 512]
    - [15, 22773.6]
  - - [2560, 1024, 1, 512]
    - [13, 24229.7]
  - - [3072, 1024, 1, 512]
    - [15, 25706.9]
  - - [512, 1536, 1, 512]
    - [4, 14320.4]
  - - [1024, 1536, 1, 512]
    - [4, 20400.7]
  - - [1536, 1536, 1, 512]
    - [4, 23523.4]
  - - [2048, 1536, 1, 512]
    - [13, 26308.4]
  - - [2560, 1536, 1, 512]
    - [15, 27021.9]
  - - [3072, 1536, 1, 512]
    - [4, 29369.5]
  - - [512, 2048, 1, 512]
    - [4, 16680.5]
  - - [1024, 2048, 1, 512]
    - [15, 22463.2]
  - - [1536, 2048, 1, 512]
    - [13, 25764.7]
  - - [2048, 2048, 1, 512]
    - [4, 27882.2]
  - - [2560, 2048, 1, 512]
    - [4, 29294.8]
  - - [3072, 2048, 1, 512]
    - [13, 30521.8]
  - - [512, 2560, 1, 512]
    - [15, 18251.5]
  - - [1024, 2560, 1, 512]
    - [13, 19232.6]
  - - [1536, 2560, 1, 512]
    - [13, 27498.9]
  - - [2048, 2560, 1, 512]
    - [15, 29866.3]
  - - [2560, 2560, 1, 512]
    - [15, 30820.6]
  - - [3072, 2560, 1, 512]
    - [4, 32075.9]
  - - [512, 3072, 1, 512]
    - [17, 15962.5]
  - - [1024, 3072, 1, 512]
    - [13, 25657.7]
  - - [1536, 3072, 1, 512]
    - [13, 28584.3]
  - - [2048, 3072, 1, 512]
    - [4, 30594.4]
  - - [2560, 3072, 1, 512]
    - [0, 30950.8]
  - - [3072, 3072, 1, 512]
    - [13, 32420.7]
  - - [512, 512, 1, 1024]
    - [275, 15.59]
  - - [1024, 512, 1, 1024]
    - [276, 22.74]
  - - [1536, 512, 1, 1024]
    - [4, 20059.7]
  - - [2048, 512, 1, 1024]
    - [15, 22638.7]
  - - [2560, 512, 1, 1024]
    - [16, 23365.2]
  - - [3072, 512, 1, 1024]
    - [4, 26126.8]
  - - [512, 1024, 1, 1024]
    - [271, 23.82]
  - - [1024, 1024, 1, 1024]
    - [282, 32.64]
  - - [1536, 1024, 1, 1024]
    - [281, 35.35]
  - - [2048, 1024, 1, 1024]
    - [282, 38.39]
  - - [2560, 1024, 1, 1024]
    - [4, 29343.0]
  - - [3072, 1024, 1, 1024]
    - [15, 30870.5]
  - - [512, 1536, 1, 1024]
    - [15, 19795.4]
  - - [1024, 1536, 1, 1024]
    - [282, 35.1]
  - - [1536, 1536, 1, 1024]
    - [282, 35.92]
  - - [2048, 1536, 1, 1024]
    - [238, 37.2]
  - - [2560, 1536, 1, 1024]
    - [15, 32041.5]
  - - [3072, 1536, 1, 1024]
    - [4, 32160.4]
  - - [512, 2048, 1, 1024]
    - [15, 23000.9]
  - - [1024, 2048, 1, 1024]
    - [281, 36.27]
  - - [1536, 2048, 1, 1024]
    - [224, 36.47]
  - - [2048, 2048, 1, 1024]
    - [343, 39.89]
  - - [2560, 2048, 1, 1024]
    - [0, 33207.0]
  - - [3072, 2048, 1, 1024]
    - [0, 34410.8]
  - - [512, 2560, 1, 1024]
    - [15, 19293.7]
  - - [1024, 2560, 1, 1024]
    - [16, 28586.9]
  - - [1536, 2560, 1, 1024]
    - [4, 31516.4]
  - - [2048, 2560, 1, 1024]
    - [4, 32695.5]
  - - [2560, 2560, 1, 1024]
    - [13, 33584.5]
  - - [3072, 2560, 1, 1024]
    - [4, 34444.3]
  - - [512, 3072, 1, 1024]
    - [4, 26250.5]
  - - [1024, 3072, 1, 1024]
    - [13, 30288.9]
  - - [1536, 3072, 1, 1024]
    - [15, 32653.5]
  - - [2048, 3072, 1, 1024]
    - [15, 34049.1]
  - - [2560, 3072, 1, 1024]
    - [13, 34721.0]
  - - [3072, 3072, 1, 1024]
    - [4, 34981.8]
  - - [512, 512, 1, 2048]
    - [258, 22.67]
  - - [1024, 512, 1, 2048]
    - [276, 31.34]
  - - [1536, 512, 1, 2048]
    - [15, 24494.7]
  - - [2048, 512, 1, 2048]
    - [4, 27958.6]
  - - [2560, 512, 1, 2048]
    - [13, 28495.7]
  - - [3072, 512, 1, 2048]
    - [15, 29965.7]
  - - [512, 1024, 1, 2048]
    - [271, 31.76]
  - - [1024, 1024, 1, 2048]
    - [282, 41.3]
  - - [1536, 1024, 1, 2048]
    - [15, 30559.4]
  - - [2048, 1024, 1, 2048]
    - [15, 31352.9]
  - - [2560, 1024, 1, 2048]
    - [13, 32903.2]
  - - [3072, 1024, 1, 2048]
    - [15, 34230.3]
  - - [512, 1536, 1, 2048]
    - [15, 24394.2]
  - - [1024, 1536, 1, 2048]
    - [4, 29957.4]
  - - [1536, 1536, 1, 2048]
    - [4, 32132.4]
  - - [2048, 1536, 1, 2048]
    - [4, 32967.6]
  - - [2560, 1536, 1, 2048]
    - [15, 34108.8]
  - - [3072, 1536, 1, 2048]
    - [4, 35303.1]
  - - [512, 2048, 1, 2048]
    - [15, 27543.7]
  - - [1024, 2048, 1, 2048]
    - [15, 31852.7]
  - - [1536, 2048, 1, 2048]
    - [4, 33429.5]
  - - [2048, 2048, 1, 2048]
    - [330, 44.81]
  - - [2560, 2048, 1, 2048]
    - [15, 35012.8]
  - - [3072, 2048, 1, 2048]
    - [4, 34927.5]
  - - [512, 2560, 1, 2048]
    - [15, 28473.1]
  - - [1024, 2560, 1, 2048]
    - [13, 32443.1]
  - - [1536, 2560, 1, 2048]
    - [15, 33703.4]
  - - [2048, 2560, 1, 2048]
    - [15, 34952.8]
  - - [2560, 2560, 1, 2048]
    - [15, 35427.5]
  - - [3072, 2560, 1, 2048]
    - [15, 35568.4]
  - - [512, 3072, 1, 2048]
    - [0, 30643.9]
  - - [1024, 3072, 1, 2048]
    - [4, 33135.0]
  - - [1536, 3072, 1, 2048]
    - [15, 35086.0]
  - - [2048, 3072, 1, 2048]
    - [13, 35286.5]
  - - [2560, 3072, 1, 2048]
    - [4, 35540.8]
  - - [3072, 3072, 1, 2048]
    - [15, 35994.4]
  - - [512, 512, 1, 3072]
    - [9, 17907.8]
  - - [1024, 512, 1, 3072]
    - [13, 25523.4]
  - - [1536, 512, 1, 3072]
    - [15, 26395.7]
  - - [2048, 512, 1, 3072]
    - [13, 29236.7]
  - - [2560, 512, 1, 3072]
    - [4, 30260.9]
  - - [3072, 512, 1, 3072]
    - [15, 31219.3]
  - - [512, 1024, 1, 3072]
    - [2, 24676.9]
  - - [1024, 1024, 1, 3072]
    - [15, 29555.2]
  - - [1536, 1024, 1, 3072]
    - [4, 31553.2]
  - - [2048, 1024, 1, 3072]
    - [4, 32571.0]
  - - [2560, 1024, 1, 3072]
    - [13, 33635.7]
  - - [3072, 1024, 1, 3072]
    - [0, 34003.7]
  - - [512, 1536, 1, 3072]
    - [4, 26965.3]
  - - [1024, 1536, 1, 3072]
    - [13, 31697.3]
  - - [1536, 1536, 1, 3072]
    - [15, 33471.2]
  - - [2048, 1536, 1, 3072]
    - [15, 34142.1]
  - - [2560, 1536, 1, 3072]
    - [4, 34520.7]
  - - [3072, 1536, 1, 3072]
    - [0, 35005.5]
  - - [512, 2048, 1, 3072]
    - [0, 30031.5]
  - - [1024, 2048, 1, 3072]
    - [15, 33287.7]
  - - [1536, 2048, 1, 3072]
    - [13, 34538.9]
  - - [2048, 2048, 1, 3072]
    - [4, 34890.2]
  - - [2560, 2048, 1, 3072]
    - [15, 35540.9]
  - - [3072, 2048, 1, 3072]
    - [15, 35493.7]
  - - [512, 2560, 1, 3072]
    - [15, 30412.2]
  - - [1024, 2560, 1, 3072]
    - [13, 34182.2]
  - - [1536, 2560, 1, 3072]
    - [4, 34612.4]
  - - [2048, 2560, 1, 3072]
    - [4, 34945.9]
  - - [2560, 2560, 1, 3072]
    - [15, 35803.3]
  - - [3072, 2560, 1, 3072]
    - [0, 35815.1]
  - - [512, 3072, 1, 3072]
    - [0, 32031.1]
  - - [1024, 3072, 1, 3072]
    - [15, 33794.0]
  - - [1536, 3072, 1, 3072]
    - [0, 34947.1]
  - - [2048, 3072, 1, 3072]
    - [15, 35799.6]
  - - [2560, 3072, 1, 3072]
    - [0, 35674.7]
  - - [3072, 3072, 1, 3072]
    - [281, 51.46]
  - - [1, 1, 1, 1]
    - [122, 0.0]
  - - [1, 1, 1, 64]
    - [12, 0.004]
  - - [1, 64, 1, 1]
    - [11, 0.00423883]
  - - [64, 1, 1, 1]
    - [11, 0.00425858]
  - - [64, 64, 1, 1]
    - [8, 0.269323]
  - - [64, 1, 1, 64]
    - [10, 0.267914]
  - - [1, 64, 1, 64]
    - [12, 0.266945]
  - - [64, 64, 1, 64]
    - [114, 0.02]
  - - [64, 64, 1, 256]
    - [244, 0.1]
  - - [64, 64, 1, 512]
    - [285, 0.18]
  - - [64, 64, 1, 1024]
    - [300, 0.34]
  - - [64, 64, 1, 2048]
    - [300, 0.58]
  - - [64, 64, 1, 4096]
    - [311, 0.83]
  - - [256, 256, 1, 256]
    - [120, 1.46]
  - - [4096, 4096, 1, 4096]
    - [315, 50.27]
  - - [320, 64, 1, 64]
    - [117, 0.12]
  - - [576, 64, 1, 64]
    - [121, 0.22]
  - - [832, 64, 1, 64]
    - [124, 0.32]
  - - [1088, 64, 1, 64]
    - [130, 0.42]
  - - [1344, 64, 1, 64]
    - [262, 0.52]
  - - [1600, 64, 1, 64]
    - [160, 0.62]
  - - [1856, 64, 1, 64]
    - [182, 0.71]
  - - [2112, 64, 1, 64]
    - [362, 0.77]
  - - [2368, 64, 1, 64]
    - [363, 0.85]
  - - [2624, 64, 1, 64]
    - [183, 0.97]
  - - [2880, 64, 1, 64]
    - [322, 1.04]
  - - [3136, 64, 1, 64]
    - [201, 1.13]
  - - [3392, 64, 1, 64]
    - [178, 1.23]
  - - [3648, 64, 1, 64]
    - [230, 1.35]
  - - [3904, 64, 1, 64]
    - [132, 1.43]
  - - [64, 320, 1, 64]
    - [126, 0.13]
  - - [320, 320, 1, 64]
    - [159, 0.61]
  - - [576, 320, 1, 64]
    - [163, 1.06]
  - - [832, 320, 1, 64]
    - [166, 1.46]
  - - [1088, 320, 1, 64]
    - [132, 1.91]
  - - [1344, 320, 1, 64]
    - [175, 2.24]
  - - [1600, 320, 1, 64]
    - [166, 2.65]
  - - [1856, 320, 1, 64]
    - [166, 2.93]
  - - [2112, 320, 1, 64]
    - [167, 3.17]
  - - [2368, 320, 1, 64]
    - [132, 3.45]
  - - [2624, 320, 1, 64]
    - [167, 3.63]
  - - [2880, 320, 1, 64]
    - [132, 3.84]
  - - [3136, 320, 1, 64]
    - [364, 4.15]
  - - [3392, 320, 1, 64]
    - [210, 4.3]
  - - [3648, 320, 1, 64]
    - [132, 4.64]
  - - [3904, 320, 1, 64]
    - [183, 4.73]
  - - [64, 576, 1, 64]
    - [195, 0.23]
  - - [320, 576, 1, 64]
    - [139, 1.07]
  - - [576, 576, 1, 64]
    - [199, 1.81]
  - - [832, 576, 1, 64]
    - [161, 2.45]
  - - [1088, 576, 1, 64]
    - [132, 3.1]
  - - [1344, 576, 1, 64]
    - [167, 3.62]
  - - [1600, 576, 1, 64]
    - [238, 3.94]
  - - [1856, 576, 1, 64]
    - [210, 4.32]
  - - [2112, 576, 1, 64]
    - [183, 4.64]
  - - [2368, 576, 1, 64]
    - [210, 5.09]
  - - [2624, 576, 1, 64]
    - [167, 5.1]
  - - [2880, 576, 1, 64]
    - [167, 5.44]
  - - [3136, 576, 1, 64]
    - [132, 5.69]
  - - [3392, 576, 1, 64]
    - [132, 6.0]
  - - [3648, 576, 1, 64]
    - [210, 6.24]
  - - [3904, 576, 1, 64]
    - [132, 6.19]
  - - [64, 832, 1, 64]
    - [219, 0.33]
  - - [320, 832, 1, 64]
    - [220, 1.48]
  - - [576, 832, 1, 64]
    - [222, 2.38]
  - - [832, 832, 1, 64]
    - [167, 3.27]
  - - [1088, 832, 1, 64]
    - [183, 3.94]
  - - [1344, 832, 1, 64]
    - [210, 4.53]
  - - [1600, 832, 1, 64]
    - [210, 4.98]
  - - [1856, 832, 1, 64]
    - [210, 5.32]
  - - [2112, 832, 1, 64]
    - [132, 5.53]
  - - [2368, 832, 1, 64]
    - [210, 5.96]
  - - [2624, 832, 1, 64]
    - [210, 6.53]
  - - [2880, 832, 1, 64]
    - [210, 6.56]
  - - [3136, 832, 1, 64]
    - [210, 6.94]
  - - [3392, 832, 1, 64]
    - [210, 7.0]
  - - [3648, 832, 1, 64]
    - [210, 7.16]
  - - [3904, 832, 1, 64]
    - [210, 7.33]
  - - [64, 1088, 1, 64]
    - [320, 0.42]
  - - [320, 1088, 1, 64]
    - [322, 1.9]
  - - [576, 1088, 1, 64]
    - [176, 3.02]
  - - [832, 1088, 1, 64]
    - [209, 3.89]
  - - [1088, 1088, 1, 64]
    - [210, 4.78]
  - - [1344, 1088, 1, 64]
    - [210, 5.46]
  - - [1600, 1088, 1, 64]
    - [132, 5.57]
  - - [1856, 1088, 1, 64]
    - [210, 6.08]
  - - [2112, 1088, 1, 64]
    - [242, 6.4]
  - - [2368, 1088, 1, 64]
    - [210, 6.94]
  - - [2624, 1088, 1, 64]
    - [210, 7.15]
  - - [2880, 1088, 1, 64]
    - [242, 7.39]
  - - [3136, 1088, 1, 64]
    - [210, 7.78]
  - - [3392, 1088, 1, 64]
    - [210, 8.06]
  - - [3648, 1088, 1, 64]
    - [210, 7.98]
  - - [3904, 1088, 1, 64]
    - [210, 8.14]
  - - [64, 1344, 1, 64]
    - [124, 0.52]
  - - [320, 1344, 1, 64]
    - [132, 2.26]
  - - [576, 1344, 1, 64]
    - [167, 3.63]
  - - [832, 1344, 1, 64]
    - [210, 4.56]
  - - [1088, 1344, 1, 64]
    - [210, 5.39]
  - - [1344, 1344, 1, 64]
    - [132, 5.73]
  - - [1600, 1344, 1, 64]
    - [210, 6.48]
  - - [1856, 1344, 1, 64]
    - [242, 6.91]
  - - [2112, 1344, 1, 64]
    - [210, 7.06]
  - - [2368, 1344, 1, 64]
    - [242, 7.7]
  - - [2624, 1344, 1, 64]
    - [242, 7.64]
  - - [2880, 1344, 1, 64]
    - [242, 7.94]
  - - [3136, 1344, 1, 64]
    - [242, 8.39]
  - - [3392, 1344, 1, 64]
    - [242, 8.43]
  - - [3648, 1344, 1, 64]
    - [242, 8.64]
  - - [3904, 1344, 1, 64]
    - [242, 8.83]
  - - [64, 1600, 1, 64]
    - [185, 0.62]
  - - [320, 1600, 1, 64]
    - [324, 2.64]
  - - [576, 1600, 1, 64]
    - [284, 4.0]
  - - [832, 1600, 1, 64]
    - [210, 4.94]
  - - [1088, 1600, 1, 64]
    - [210, 5.94]
  - - [1344, 1600, 1, 64]
    - [210, 6.46]
  - - [1600, 1600, 1, 64]
    - [242, 6.77]
  - - [1856, 1600, 1, 64]
    - [242, 7.45]
  - - [2112, 1600, 1, 64]
    - [210, 7.77]
  - - [2368, 1600, 1, 64]
    - [210, 8.02]
  - - [2624, 1600, 1, 64]
    - [242, 8.33]
  - - [2880, 1600, 1, 64]
    - [210, 8.48]
  - - [3136, 1600, 1, 64]
    - [242, 8.78]
  - - [3392, 1600, 1, 64]
    - [210, 8.9]
  - - [3648, 1600, 1, 64]
    - [210, 9.02]
  - - [3904, 1600, 1, 64]
    - [242, 9.26]
  - - [64, 1856, 1, 64]
    - [183, 0.71]
  - - [320, 1856, 1, 64]
    - [209, 2.88]
  - - [576, 1856, 1, 64]
    - [239, 4.27]
  - - [832, 1856, 1, 64]
    - [183, 5.29]
  - - [1088, 1856, 1, 64]
    - [210, 6.45]
  - - [1344, 1856, 1, 64]
    - [242, 6.83]
  - - [1600, 1856, 1, 64]
    - [242, 7.44]
  - - [1856, 1856, 1, 64]
    - [210, 7.72]
  - - [2112, 1856, 1, 64]
    - [242, 8.24]
  - - [2368, 1856, 1, 64]
    - [242, 8.41]
  - - [2624, 1856, 1, 64]
    - [210, 8.62]
  - - [2880, 1856, 1, 64]
    - [210, 8.72]
  - - [3136, 1856, 1, 64]
    - [210, 9.22]
  - - [3392, 1856, 1, 64]
    - [242, 9.41]
  - - [3648, 1856, 1, 64]
    - [210, 9.53]
  - - [3904, 1856, 1, 64]
    - [210, 9.67]
  - - [64, 2112, 1, 64]
    - [227, 0.78]
  - - [320, 2112, 1, 64]
    - [239, 3.22]
  - - [576, 2112, 1, 64]
    - [210, 4.86]
  - - [832, 2112, 1, 64]
    - [210, 6.06]
  - - [1088, 2112, 1, 64]
    - [242, 6.5]
  - - [1344, 2112, 1, 64]
    - [239, 7.15]
  - - [1600, 2112, 1, 64]
    - [210, 7.61]
  - - [1856, 2112, 1, 64]
    - [242, 8.18]
  - - [2112, 2112, 1, 64]
    - [242, 8.43]
  - - [2368, 2112, 1, 64]
    - [210, 8.75]
  - - [2624, 2112, 1, 64]
    - [210, 9.19]
  - - [2880, 2112, 1, 64]
    - [210, 9.45]
  - - [3136, 2112, 1, 64]
    - [210, 9.27]
  - - [3392, 2112, 1, 64]
    - [210, 9.38]
  - - [3648, 2112, 1, 64]
    - [242, 9.75]
  - - [3904, 2112, 1, 64]
    - [210, 9.77]
  - - [64, 2368, 1, 64]
    - [365, 0.87]
  - - [320, 2368, 1, 64]
    - [241, 3.49]
  - - [576, 2368, 1, 64]
    - [242, 5.13]
  - - [832, 2368, 1, 64]
    - [210, 6.19]
  - - [1088, 2368, 1, 64]
    - [239, 6.89]
  - - [1344, 2368, 1, 64]
    - [210, 7.51]
  - - [1600, 2368, 1, 64]
    - [210, 8.17]
  - - [1856, 2368, 1, 64]
    - [242, 8.42]
  - - [2112, 2368, 1, 64]
    - [210, 8.81]
  - - [2368, 2368, 1, 64]
    - [242, 9.13]
  - - [2624, 2368, 1, 64]
    - [242, 9.25]
  - - [2880, 2368, 1, 64]
    - [210, 9.62]
  - - [3136, 2368, 1, 64]
    - [210, 9.58]
  - - [3392, 2368, 1, 64]
    - [242, 9.77]
  - - [3648, 2368, 1, 64]
    - [210, 10.15]
  - - [3904, 2368, 1, 64]
    - [210, 10.01]
  - - [64, 2624, 1, 64]
    - [199, 0.96]
  - - [320, 2624, 1, 64]
    - [242, 3.72]
  - - [576, 2624, 1, 64]
    - [210, 5.53]
  - - [832, 2624, 1, 64]
    - [242, 6.63]
  - - [1088, 2624, 1, 64]
    - [210, 7.23]
  - - [1344, 2624, 1, 64]
    - [210, 7.91]
  - - [1600, 2624, 1, 64]
    - [242, 8.28]
  - - [1856, 2624, 1, 64]
    - [210, 8.77]
  - - [2112, 2624, 1, 64]
    - [242, 9.16]
  - - [2368, 2624, 1, 64]
    - [242, 9.23]
  - - [2624, 2624, 1, 64]
    - [210, 9.53]
  - - [2880, 2624, 1, 64]
    - [242, 9.68]
  - - [3136, 2624, 1, 64]
    - [210, 9.9]
  - - [3392, 2624, 1, 64]
    - [210, 10.19]
  - - [3648, 2624, 1, 64]
    - [210, 10.16]
  - - [3904, 2624, 1, 64]
    - [210, 10.21]
  - - [64, 2880, 1, 64]
    - [143, 1.01]
  - - [320, 2880, 1, 64]
    - [364, 3.82]
  - - [576, 2880, 1, 64]
    - [242, 5.74]
  - - [832, 2880, 1, 64]
    - [242, 6.75]
  - - [1088, 2880, 1, 64]
    - [242, 7.43]
  - - [1344, 2880, 1, 64]
    - [242, 8.07]
  - - [1600, 2880, 1, 64]
    - [242, 8.64]
  - - [1856, 2880, 1, 64]
    - [242, 8.99]
  - - [2112, 2880, 1, 64]
    - [242, 9.24]
  - - [2368, 2880, 1, 64]
    - [210, 9.51]
  - - [2624, 2880, 1, 64]
    - [242, 9.5]
  - - [2880, 2880, 1, 64]
    - [210, 9.91]
  - - [3136, 2880, 1, 64]
    - [242, 10.0]
  - - [3392, 2880, 1, 64]
    - [210, 10.05]
  - - [3648, 2880, 1, 64]
    - [210, 10.37]
  - - [3904, 2880, 1, 64]
    - [210, 10.55]
  - - [64, 3136, 1, 64]
    - [166, 1.16]
  - - [320, 3136, 1, 64]
    - [366, 4.26]
  - - [576, 3136, 1, 64]
    - [242, 5.8]
  - - [832, 3136, 1, 64]
    - [242, 6.9]
  - - [1088, 3136, 1, 64]
    - [239, 7.76]
  - - [1344, 3136, 1, 64]
    - [210, 8.45]
  - - [1600, 3136, 1, 64]
    - [210, 8.76]
  - - [1856, 3136, 1, 64]
    - [210, 9.22]
  - - [2112, 3136, 1, 64]
    - [210, 9.53]
  - - [2368, 3136, 1, 64]
    - [210, 9.87]
  - - [2624, 3136, 1, 64]
    - [242, 9.92]
  - - [2880, 3136, 1, 64]
    - [210, 10.0]
  - - [3136, 3136, 1, 64]
    - [210, 10.08]
  - - [3392, 3136, 1, 64]
    - [210, 10.43]
  - - [3648, 3136, 1, 64]
    - [242, 10.42]
  - - [3904, 3136, 1, 64]
    - [242, 10.66]
  - - [64, 3392, 1, 64]
    - [367, 1.19]
  - - [320, 3392, 1, 64]
    - [242, 4.41]
  - - [576, 3392, 1, 64]
    - [210, 6.32]
  - - [832, 3392, 1, 64]
    - [210, 7.35]
  - - [1088, 3392, 1, 64]
    - [242, 8.06]
  - - [1344, 3392, 1, 64]
    - [210, 8.59]
  - - [1600, 3392, 1, 64]
    - [210, 8.98]
  - - [1856, 3392, 1, 64]
    - [242, 9.33]
  - - [2112, 3392, 1, 64]
    - [242, 9.6]
  - - [2368, 3392, 1, 64]
    - [242, 9.7]
  - - [2624, 3392, 1, 64]
    - [242, 10.19]
  - - [2880, 3392, 1, 64]
    - [210, 10.41]
  - - [3136, 3392, 1, 64]
    - [210, 10.33]
  - - [3392, 3392, 1, 64]
    - [210, 10.51]
  - - [3648, 3392, 1, 64]
    - [210, 10.36]
  - - [3904, 3392, 1, 64]
    - [242, 10.58]
  - - [64, 3648, 1, 64]
    - [136, 1.32]
  - - [320, 3648, 1, 64]
    - [166, 4.57]
  - - [576, 3648, 1, 64]
    - [242, 6.37]
  - - [832, 3648, 1, 64]
    - [242, 7.64]
  - - [1088, 3648, 1, 64]
    - [210, 8.12]
  - - [1344, 3648, 1, 64]
    - [210, 8.64]
  - - [1600, 3648, 1, 64]
    - [210, 9.32]
  - - [1856, 3648, 1, 64]
    - [210, 9.59]
  - - [2112, 3648, 1, 64]
    - [210, 9.82]
  - - [2368, 3648, 1, 64]
    - [210, 9.91]
  - - [2624, 3648, 1, 64]
    - [210, 10.27]
  - - [2880, 3648, 1, 64]
    - [210, 10.29]
  - - [3136, 3648, 1, 64]
    - [210, 10.61]
  - - [3392, 3648, 1, 64]
    - [210, 10.46]
  - - [3648, 3648, 1, 64]
    - [210, 10.62]
  - - [3904, 3648, 1, 64]
    - [242, 10.78]
  - - [64, 3904, 1, 64]
    - [175, 1.44]
  - - [320, 3904, 1, 64]
    - [239, 5.07]
  - - [576, 3904, 1, 64]
    - [210, 6.69]
  - - [832, 3904, 1, 64]
    - [242, 7.65]
  - - [1088, 3904, 1, 64]
    - [242, 8.38]
  - - [1344, 3904, 1, 64]
    - [210, 9.08]
  - - [1600, 3904, 1, 64]
    - [210, 9.44]
  - - [1856, 3904, 1, 64]
    - [210, 9.44]
  - - [2112, 3904, 1, 64]
    - [210, 9.9]
  - - [2368, 3904, 1, 64]
    - [210, 10.42]
  - - [2624, 3904, 1, 64]
    - [210, 10.2]
  - - [2880, 3904, 1, 64]
    - [242, 10.42]
  - - [3136, 3904, 1, 64]
    - [210, 10.79]
  - - [3392, 3904, 1, 64]
    - [210, 10.69]
  - - [3648, 3904, 1, 64]
    - [210, 10.89]
  - - [3904, 3904, 1, 64]
    - [242, 11.0]
  - - [320, 64, 1, 256]
    - [248, 0.48]
  - - [576, 64, 1, 256]
    - [120, 0.87]
  - - [832, 64, 1, 256]
    - [253, 1.23]
  - - [1088, 64, 1, 256]
    - [114, 1.47]
  - - [1344, 64, 1, 256]
    - [208, 1.86]
  - - [1600, 64, 1, 256]
    - [191, 2.23]
  - - [1856, 64, 1, 256]
    - [191, 2.55]
  - - [2112, 64, 1, 256]
    - [208, 2.84]
  - - [2368, 64, 1, 256]
    - [208, 3.19]
  - - [2624, 64, 1, 256]
    - [256, 3.5]
  - - [2880, 64, 1, 256]
    - [258, 3.81]
  - - [3136, 64, 1, 256]
    - [160, 4.08]
  - - [3392, 64, 1, 256]
    - [182, 4.44]
  - - [3648, 64, 1, 256]
    - [135, 4.81]
  - - [3904, 64, 1, 256]
    - [193, 5.17]
  - - [64, 320, 1, 256]
    - [262, 0.49]
  - - [320, 320, 1, 256]
    - [256, 2.25]
  - - [576, 320, 1, 256]
    - [256, 3.82]
  - - [832, 320, 1, 256]
    - [193, 5.13]
  - - [1088, 320, 1, 256]
    - [193, 6.69]
  - - [1344, 320, 1, 256]
    - [271, 7.59]
  - - [1600, 320, 1, 256]
    - [289, 8.49]
  - - [1856, 320, 1, 256]
    - [161, 9.26]
  - - [2112, 320, 1, 256]
    - [167, 9.74]
  - - [2368, 320, 1, 256]
    - [318, 10.91]
  - - [2624, 320, 1, 256]
    - [284, 11.39]
  - - [2880, 320, 1, 256]
    - [167, 11.82]
  - - [3136, 320, 1, 256]
    - [209, 12.58]
  - - [3392, 320, 1, 256]
    - [210, 13.24]
  - - [3648, 320, 1, 256]
    - [209, 13.53]
  - - [3904, 320, 1, 256]
    - [210, 13.89]
  - - [64, 576, 1, 256]
    - [277, 0.84]
  - - [320, 576, 1, 256]
    - [133, 3.76]
  - - [576, 576, 1, 256]
    - [168, 6.14]
  - - [832, 576, 1, 256]
    - [176, 8.22]
  - - [1088, 576, 1, 256]
    - [167, 10.28]
  - - [1344, 576, 1, 256]
    - [167, 11.51]
  - - [1600, 576, 1, 256]
    - [167, 12.23]
  - - [1856, 576, 1, 256]
    - [161, 12.69]
  - - [2112, 576, 1, 256]
    - [176, 13.11]
  - - [2368, 576, 1, 256]
    - [173, 14.21]
  - - [2624, 576, 1, 256]
    - [167, 14.9]
  - - [2880, 576, 1, 256]
    - [173, 15.32]
  - - [3136, 576, 1, 256]
    - [167, 16.07]
  - - [3392, 576, 1, 256]
    - [167, 16.77]
  - - [3648, 576, 1, 256]
    - [210, 16.88]
  - - [3904, 576, 1, 256]
    - [167, 17.41]
  - - [64, 832, 1, 256]
    - [262, 1.22]
  - - [320, 832, 1, 256]
    - [193, 5.17]
  - - [576, 832, 1, 256]
    - [191, 8.3]
  - - [832, 832, 1, 256]
    - [238, 10.37]
  - - [1088, 832, 1, 256]
    - [209, 12.16]
  - - [1344, 832, 1, 256]
    - [161, 13.59]
  - - [1600, 832, 1, 256]
    - [210, 14.08]
  - - [1856, 832, 1, 256]
    - [173, 15.27]
  - - [2112, 832, 1, 256]
    - [167, 15.98]
  - - [2368, 832, 1, 256]
    - [167, 16.92]
  - - [2624, 832, 1, 256]
    - [210, 17.91]
  - - [2880, 832, 1, 256]
    - [238, 17.22]
  - - [3136, 832, 1, 256]
    - [176, 18.04]
  - - [3392, 832, 1, 256]
    - [210, 18.23]
  - - [3648, 832, 1, 256]
    - [173, 18.43]
  - - [3904, 832, 1, 256]
    - [167, 19.11]
  - - [64, 1088, 1, 256]
    - [120, 1.54]
  - - [320, 1088, 1, 256]
    - [193, 6.66]
  - - [576, 1088, 1, 256]
    - [167, 10.13]
  - - [832, 1088, 1, 256]
    - [167, 12.52]
  - - [1088, 1088, 1, 256]
    - [210, 14.06]
  - - [1344, 1088, 1, 256]
    - [210, 15.73]
  - - [1600, 1088, 1, 256]
    - [167, 15.86]
  - - [1856, 1088, 1, 256]
    - [167, 16.87]
  - - [2112, 1088, 1, 256]
    - [167, 17.19]
  - - [2368, 1088, 1, 256]
    - [210, 17.94]
  - - [2624, 1088, 1, 256]
    - [210, 19.12]
  - - [2880, 1088, 1, 256]
    - [210, 19.34]
  - - [3136, 1088, 1, 256]
    - [210, 20.57]
  - - [3392, 1088, 1, 256]
    - [210, 20.48]
  - - [3648, 1088, 1, 256]
    - [210, 20.82]
  - - [3904, 1088, 1, 256]
    - [210, 20.79]
  - - [64, 1344, 1, 256]
    - [252, 1.9]
  - - [320, 1344, 1, 256]
    - [256, 7.49]
  - - [576, 1344, 1, 256]
    - [167, 11.72]
  - - [832, 1344, 1, 256]
    - [284, 13.45]
  - - [1088, 1344, 1, 256]
    - [210, 15.71]
  - - [1344, 1344, 1, 256]
    - [167, 16.62]
  - - [1600, 1344, 1, 256]
    - [210, 18.08]
  - - [1856, 1344, 1, 256]
    - [280, 18.42]
  - - [2112, 1344, 1, 256]
    - [210, 18.84]
  - - [2368, 1344, 1, 256]
    - [210, 19.81]
  - - [2624, 1344, 1, 256]
    - [210, 20.55]
  - - [2880, 1344, 1, 256]
    - [210, 20.67]
  - - [3136, 1344, 1, 256]
    - [210, 21.76]
  - - [3392, 1344, 1, 256]
    - [210, 20.96]
  - - [3648, 1344, 1, 256]
    - [210, 21.44]
  - - [3904, 1344, 1, 256]
    - [271, 21.37]
  - - [64, 1600, 1, 256]
    - [136, 2.24]
  - - [320, 1600, 1, 256]
    - [168, 8.86]
  - - [576, 1600, 1, 256]
    - [271, 12.1]
  - - [832, 1600, 1, 256]
    - [202, 13.6]
  - - [1088, 1600, 1, 256]
    - [210, 16.94]
  - - [1344, 1600, 1, 256]
    - [210, 17.48]
  - - [1600, 1600, 1, 256]
    - [210, 17.68]
  - - [1856, 1600, 1, 256]
    - [210, 19.42]
  - - [2112, 1600, 1, 256]
    - [210, 20.1]
  - - [2368, 1600, 1, 256]
    - [210, 20.43]
  - - [2624, 1600, 1, 256]
    - [210, 21.28]
  - - [2880, 1600, 1, 256]
    - [167, 20.32]
  - - [3136, 1600, 1, 256]
    - [210, 21.43]
  - - [3392, 1600, 1, 256]
    - [210, 21.68]
  - - [3648, 1600, 1, 256]
    - [210, 22.55]
  - - [3904, 1600, 1, 256]
    - [210, 23.14]
  - - [64, 1856, 1, 256]
    - [261, 2.58]
  - - [320, 1856, 1, 256]
    - [167, 9.65]
  - - [576, 1856, 1, 256]
    - [167, 13.08]
  - - [832, 1856, 1, 256]
    - [176, 15.07]
  - - [1088, 1856, 1, 256]
    - [210, 17.67]
  - - [1344, 1856, 1, 256]
    - [271, 18.35]
  - - [1600, 1856, 1, 256]
    - [167, 18.65]
  - - [1856, 1856, 1, 256]
    - [210, 20.17]
  - - [2112, 1856, 1, 256]
    - [210, 20.59]
  - - [2368, 1856, 1, 256]
    - [210, 21.06]
  - - [2624, 1856, 1, 256]
    - [210, 21.6]
  - - [2880, 1856, 1, 256]
    - [210, 21.63]
  - - [3136, 1856, 1, 256]
    - [210, 22.74]
  - - [3392, 1856, 1, 256]
    - [210, 22.41]
  - - [3648, 1856, 1, 256]
    - [210, 22.78]
  - - [3904, 1856, 1, 256]
    - [211, 22.67]
  - - [64, 2112, 1, 256]
    - [270, 2.77]
  - - [320, 2112, 1, 256]
    - [239, 10.1]
  - - [576, 2112, 1, 256]
    - [271, 14.2]
  - - [832, 2112, 1, 256]
    - [210, 16.86]
  - - [1088, 2112, 1, 256]
    - [167, 17.54]
  - - [1344, 2112, 1, 256]
    - [167, 18.26]
  - - [1600, 2112, 1, 256]
    - [238, 18.88]
  - - [1856, 2112, 1, 256]
    - [210, 20.84]
  - - [2112, 2112, 1, 256]
    - [210, 20.88]
  - - [2368, 2112, 1, 256]
    - [280, 21.26]
  - - [2624, 2112, 1, 256]
    - [210, 22.47]
  - - [2880, 2112, 1, 256]
    - [210, 22.4]
  - - [3136, 2112, 1, 256]
    - [210, 22.64]
  - - [3392, 2112, 1, 256]
    - [210, 22.71]
  - - [3648, 2112, 1, 256]
    - [210, 23.25]
  - - [3904, 2112, 1, 256]
    - [210, 24.1]
  - - [64, 2368, 1, 256]
    - [289, 3.11]
  - - [320, 2368, 1, 256]
    - [167, 11.31]
  - - [576, 2368, 1, 256]
    - [230, 13.96]
  - - [832, 2368, 1, 256]
    - [167, 16.27]
  - - [1088, 2368, 1, 256]
    - [176, 17.85]
  - - [1344, 2368, 1, 256]
    - [167, 18.96]
  - - [1600, 2368, 1, 256]
    - [238, 19.79]
  - - [1856, 2368, 1, 256]
    - [173, 19.81]
  - - [2112, 2368, 1, 256]
    - [280, 20.74]
  - - [2368, 2368, 1, 256]
    - [280, 21.62]
  - - [2624, 2368, 1, 256]
    - [211, 22.2]
  - - [2880, 2368, 1, 256]
    - [280, 21.89]
  - - [3136, 2368, 1, 256]
    - [211, 22.53]
  - - [3392, 2368, 1, 256]
    - [282, 23.0]
  - - [3648, 2368, 1, 256]
    - [238, 22.86]
  - - [3904, 2368, 1, 256]
    - [211, 23.77]
  - - [64, 2624, 1, 256]
    - [256, 3.52]
  - - [320, 2624, 1, 256]
    - [161, 11.27]
  - - [576, 2624, 1, 256]
    - [210, 16.19]
  - - [832, 2624, 1, 256]
    - [210, 18.1]
  - - [1088, 2624, 1, 256]
    - [210, 19.17]
  - - [1344, 2624, 1, 256]
    - [210, 21.41]
  - - [1600, 2624, 1, 256]
    - [210, 21.91]
  - - [1856, 2624, 1, 256]
    - [210, 22.19]
  - - [2112, 2624, 1, 256]
    - [210, 23.47]
  - - [2368, 2624, 1, 256]
    - [210, 23.47]
  - - [2624, 2624, 1, 256]
    - [210, 24.58]
  - - [2880, 2624, 1, 256]
    - [210, 24.48]
  - - [3136, 2624, 1, 256]
    - [210, 24.64]
  - - [3392, 2624, 1, 256]
    - [210, 24.59]
  - - [3648, 2624, 1, 256]
    - [210, 24.84]
  - - [3904, 2624, 1, 256]
    - [210, 24.85]
  - - [64, 2880, 1, 256]
    - [258, 3.75]
  - - [320, 2880, 1, 256]
    - [167, 12.2]
  - - [576, 2880, 1, 256]
    - [270, 15.39]
  - - [832, 2880, 1, 256]
    - [238, 17.21]
  - - [1088, 2880, 1, 256]
    - [176, 18.81]
  - - [1344, 2880, 1, 256]
    - [209, 19.33]
  - - [1600, 2880, 1, 256]
    - [210, 21.36]
  - - [1856, 2880, 1, 256]
    - [238, 21.45]
  - - [2112, 2880, 1, 256]
    - [210, 22.48]
  - - [2368, 2880, 1, 256]
    - [210, 22.39]
  - - [2624, 2880, 1, 256]
    - [211, 22.99]
  - - [2880, 2880, 1, 256]
    - [280, 23.14]
  - - [3136, 2880, 1, 256]
    - [210, 22.91]
  - - [3392, 2880, 1, 256]
    - [282, 23.58]
  - - [3648, 2880, 1, 256]
    - [281, 23.9]
  - - [3904, 2880, 1, 256]
    - [211, 24.58]
  - - [64, 3136, 1, 256]
    - [256, 4.18]
  - - [320, 3136, 1, 256]
    - [280, 13.25]
  - - [576, 3136, 1, 256]
    - [167, 16.31]
  - - [832, 3136, 1, 256]
    - [176, 17.72]
  - - [1088, 3136, 1, 256]
    - [210, 19.9]
  - - [1344, 3136, 1, 256]
    - [210, 21.33]
  - - [1600, 3136, 1, 256]
    - [210, 22.01]
  - - [1856, 3136, 1, 256]
    - [210, 23.31]
  - - [2112, 3136, 1, 256]
    - [210, 23.28]
  - - [2368, 3136, 1, 256]
    - [280, 23.36]
  - - [2624, 3136, 1, 256]
    - [210, 24.37]
  - - [2880, 3136, 1, 256]
    - [210, 24.32]
  - - [3136, 3136, 1, 256]
    - [210, 24.83]
  - - [3392, 3136, 1, 256]
    - [210, 24.64]
  - - [3648, 3136, 1, 256]
    - [210, 24.87]
  - - [3904, 3136, 1, 256]
    - [282, 25.67]
  - - [64, 3392, 1, 256]
    - [256, 4.52]
  - - [320, 3392, 1, 256]
    - [167, 13.18]
  - - [576, 3392, 1, 256]
    - [210, 16.63]
  - - [832, 3392, 1, 256]
    - [210, 18.81]
  - - [1088, 3392, 1, 256]
    - [210, 20.3]
  - - [1344, 3392, 1, 256]
    - [238, 21.26]
  - - [1600, 3392, 1, 256]
    - [210, 21.7]
  - - [1856, 3392, 1, 256]
    - [210, 22.71]
  - - [2112, 3392, 1, 256]
    - [238, 22.88]
  - - [2368, 3392, 1, 256]
    - [210, 23.62]
  - - [2624, 3392, 1, 256]
    - [211, 23.38]
  - - [2880, 3392, 1, 256]
    - [238, 23.34]
  - - [3136, 3392, 1, 256]
    - [211, 24.38]
  - - [3392, 3392, 1, 256]
    - [282, 24.29]
  - - [3648, 3392, 1, 256]
    - [282, 25.24]
  - - [3904, 3392, 1, 256]
    - [282, 25.6]
  - - [64, 3648, 1, 256]
    - [168, 4.8]
  - - [320, 3648, 1, 256]
    - [167, 13.93]
  - - [576, 3648, 1, 256]
    - [167, 17.09]
  - - [832, 3648, 1, 256]
    - [280, 18.28]
  - - [1088, 3648, 1, 256]
    - [210, 20.06]
  - - [1344, 3648, 1, 256]
    - [173, 19.97]
  - - [1600, 3648, 1, 256]
    - [210, 21.91]
  - - [1856, 3648, 1, 256]
    - [238, 22.1]
  - - [2112, 3648, 1, 256]
    - [280, 22.64]
  - - [2368, 3648, 1, 256]
    - [282, 23.02]
  - - [2624, 3648, 1, 256]
    - [211, 23.63]
  - - [2880, 3648, 1, 256]
    - [281, 23.8]
  - - [3136, 3648, 1, 256]
    - [281, 24.94]
  - - [3392, 3648, 1, 256]
    - [282, 25.08]
  - - [3648, 3648, 1, 256]
    - [282, 25.67]
  - - [3904, 3648, 1, 256]
    - [282, 25.96]
  - - [64, 3904, 1, 256]
    - [230, 5.1]
  - - [320, 3904, 1, 256]
    - [284, 14.63]
  - - [576, 3904, 1, 256]
    - [210, 18.78]
  - - [832, 3904, 1, 256]
    - [210, 20.72]
  - - [1088, 3904, 1, 256]
    - [210, 21.84]
  - - [1344, 3904, 1, 256]
    - [210, 23.05]
  - - [1600, 3904, 1, 256]
    - [210, 23.02]
  - - [1856, 3904, 1, 256]
    - [210, 23.88]
  - - [2112, 3904, 1, 256]
    - [210, 25.06]
  - - [2368, 3904, 1, 256]
    - [210, 24.26]
  - - [2624, 3904, 1, 256]
    - [210, 25.53]
  - - [2880, 3904, 1, 256]
    - [210, 25.62]
  - - [3136, 3904, 1, 256]
    - [210, 25.66]
  - - [3392, 3904, 1, 256]
    - [210, 25.76]
  - - [3648, 3904, 1, 256]
    - [210, 25.4]
  - - [3904, 3904, 1, 256]
    - [210, 26.49]
  - - [320, 64, 1, 512]
    - [286, 0.91]
  - - [576, 64, 1, 512]
    - [252, 1.61]
  - - [832, 64, 1, 512]
    - [252, 2.3]
  - - [1088, 64, 1, 512]
    - [136, 2.82]
  - - [1344, 64, 1, 512]
    - [252, 3.51]
  - - [1600, 64, 1, 512]
    - [208, 4.08]
  - - [1856, 64, 1, 512]
    - [258, 4.73]
  - - [2112, 64, 1, 512]
    - [256, 5.09]
  - - [2368, 64, 1, 512]
    - [258, 5.66]
  - - [2624, 64, 1, 512]
    - [136, 6.3]
  - - [2880, 64, 1, 512]
    - [208, 6.91]
  - - [3136, 64, 1, 512]
    - [136, 7.38]
  - - [3392, 64, 1, 512]
    - [191, 8.06]
  - - [3648, 64, 1, 512]
    - [136, 8.48]
  - - [3904, 64, 1, 512]
    - [193, 9.29]
  - - [64, 320, 1, 512]
    - [120, 0.93]
  - - [320, 320, 1, 512]
    - [208, 4.1]
  - - [576, 320, 1, 512]
    - [256, 6.85]
  - - [832, 320, 1, 512]
    - [208, 8.88]
  - - [1088, 320, 1, 512]
    - [173, 11.37]
  - - [1344, 320, 1, 512]
    - [271, 12.73]
  - - [1600, 320, 1, 512]
    - [270, 14.58]
  - - [1856, 320, 1, 512]
    - [208, 15.5]
  - - [2112, 320, 1, 512]
    - [270, 15.6]
  - - [2368, 320, 1, 512]
    - [368, 17.04]
  - - [2624, 320, 1, 512]
    - [209, 17.55]
  - - [2880, 320, 1, 512]
    - [173, 18.1]
  - - [3136, 320, 1, 512]
    - [176, 19.21]
  - - [3392, 320, 1, 512]
    - [210, 20.04]
  - - [3648, 320, 1, 512]
    - [209, 20.97]
  - - [3904, 320, 1, 512]
    - [176, 20.26]
  - - [64, 576, 1, 512]
    - [293, 1.58]
  - - [320, 576, 1, 512]
    - [208, 6.88]
  - - [576, 576, 1, 512]
    - [135, 10.78]
  - - [832, 576, 1, 512]
    - [161, 13.95]
  - - [1088, 576, 1, 512]
    - [208, 16.03]
  - - [1344, 576, 1, 512]
    - [167, 18.57]
  - - [1600, 576, 1, 512]
    - [167, 19.25]
  - - [1856, 576, 1, 512]
    - [173, 19.34]
  - - [2112, 576, 1, 512]
    - [173, 20.26]
  - - [2368, 576, 1, 512]
    - [230, 21.31]
  - - [2624, 576, 1, 512]
    - [202, 22.01]
  - - [2880, 576, 1, 512]
    - [173, 23.03]
  - - [3136, 576, 1, 512]
    - [173, 24.01]
  - - [3392, 576, 1, 512]
    - [202, 24.22]
  - - [3648, 576, 1, 512]
    - [173, 24.39]
  - - [3904, 576, 1, 512]
    - [173, 24.73]
  - - [64, 832, 1, 512]
    - [119, 2.25]
  - - [320, 832, 1, 512]
    - [193, 9.04]
  - - [576, 832, 1, 512]
    - [209, 13.46]
  - - [832, 832, 1, 512]
    - [238, 16.45]
  - - [1088, 832, 1, 512]
    - [167, 19.71]
  - - [1344, 832, 1, 512]
    - [167, 20.53]
  - - [1600, 832, 1, 512]
    - [209, 20.84]
  - - [1856, 832, 1, 512]
    - [173, 22.74]
  - - [2112, 832, 1, 512]
    - [173, 23.17]
  - - [2368, 832, 1, 512]
    - [176, 23.18]
  - - [2624, 832, 1, 512]
    - [176, 24.61]
  - - [2880, 832, 1, 512]
    - [173, 25.18]
  - - [3136, 832, 1, 512]
    - [209, 26.0]
  - - [3392, 832, 1, 512]
    - [173, 25.91]
  - - [3648, 832, 1, 512]
    - [173, 26.18]
  - - [3904, 832, 1, 512]
    - [209, 26.61]
  - - [64, 1088, 1, 512]
    - [193, 2.78]
  - - [320, 1088, 1, 512]
    - [176, 11.24]
  - - [576, 1088, 1, 512]
    - [161, 16.55]
  - - [832, 1088, 1, 512]
    - [167, 19.66]
  - - [1088, 1088, 1, 512]
    - [238, 21.44]
  - - [1344, 1088, 1, 512]
    - [210, 23.17]
  - - [1600, 1088, 1, 512]
    - [173, 23.13]
  - - [1856, 1088, 1, 512]
    - [173, 23.9]
  - - [2112, 1088, 1, 512]
    - [173, 25.38]
  - - [2368, 1088, 1, 512]
    - [209, 25.66]
  - - [2624, 1088, 1, 512]
    - [173, 26.32]
  - - [2880, 1088, 1, 512]
    - [270, 26.84]
  - - [3136, 1088, 1, 512]
    - [210, 27.95]
  - - [3392, 1088, 1, 512]
    - [280, 28.34]
  - - [3648, 1088, 1, 512]
    - [209, 27.12]
  - - [3904, 1088, 1, 512]
    - [209, 27.64]
  - - [64, 1344, 1, 512]
    - [136, 3.49]
  - - [320, 1344, 1, 512]
    - [208, 12.69]
  - - [576, 1344, 1, 512]
    - [161, 17.83]
  - - [832, 1344, 1, 512]
    - [167, 20.23]
  - - [1088, 1344, 1, 512]
    - [210, 22.73]
  - - [1344, 1344, 1, 512]
    - [167, 23.45]
  - - [1600, 1344, 1, 512]
    - [284, 24.72]
  - - [1856, 1344, 1, 512]
    - [280, 26.38]
  - - [2112, 1344, 1, 512]
    - [173, 26.16]
  - - [2368, 1344, 1, 512]
    - [271, 27.17]
  - - [2624, 1344, 1, 512]
    - [173, 27.39]
  - - [2880, 1344, 1, 512]
    - [210, 27.53]
  - - [3136, 1344, 1, 512]
    - [210, 28.61]
  - - [3392, 1344, 1, 512]
    - [173, 28.07]
  - - [3648, 1344, 1, 512]
    - [280, 28.97]
  - - [3904, 1344, 1, 512]
    - [280, 29.38]
  - - [64, 1600, 1, 512]
    - [136, 4.13]
  - - [320, 1600, 1, 512]
    - [193, 14.89]
  - - [576, 1600, 1, 512]
    - [238, 18.56]
  - - [832, 1600, 1, 512]
    - [230, 20.76]
  - - [1088, 1600, 1, 512]
    - [210, 23.55]
  - - [1344, 1600, 1, 512]
    - [173, 24.84]
  - - [1600, 1600, 1, 512]
    - [173, 25.69]
  - - [1856, 1600, 1, 512]
    - [173, 26.43]
  - - [2112, 1600, 1, 512]
    - [173, 26.9]
  - - [2368, 1600, 1, 512]
    - [209, 27.25]
  - - [2624, 1600, 1, 512]
    - [280, 28.19]
  - - [2880, 1600, 1, 512]
    - [280, 28.35]
  - - [3136, 1600, 1, 512]
    - [271, 29.19]
  - - [3392, 1600, 1, 512]
    - [280, 29.68]
  - - [3648, 1600, 1, 512]
    - [282, 29.6]
  - - [3904, 1600, 1, 512]
    - [211, 30.12]
  - - [64, 1856, 1, 512]
    - [289, 4.53]
  - - [320, 1856, 1, 512]
    - [161, 15.39]
  - - [576, 1856, 1, 512]
    - [173, 19.45]
  - - [832, 1856, 1, 512]
    - [209, 22.43]
  - - [1088, 1856, 1, 512]
    - [210, 24.49]
  - - [1344, 1856, 1, 512]
    - [238, 25.11]
  - - [1600, 1856, 1, 512]
    - [209, 25.96]
  - - [1856, 1856, 1, 512]
    - [209, 26.36]
  - - [2112, 1856, 1, 512]
    - [173, 27.82]
  - - [2368, 1856, 1, 512]
    - [173, 27.83]
  - - [2624, 1856, 1, 512]
    - [280, 28.66]
  - - [2880, 1856, 1, 512]
    - [173, 28.88]
  - - [3136, 1856, 1, 512]
    - [280, 29.54]
  - - [3392, 1856, 1, 512]
    - [280, 30.42]
  - - [3648, 1856, 1, 512]
    - [280, 30.1]
  - - [3904, 1856, 1, 512]
    - [280, 30.78]
  - - [64, 2112, 1, 512]
    - [208, 5.15]
  - - [320, 2112, 1, 512]
    - [239, 15.68]
  - - [576, 2112, 1, 512]
    - [284, 20.68]
  - - [832, 2112, 1, 512]
    - [173, 23.5]
  - - [1088, 2112, 1, 512]
    - [173, 25.32]
  - - [1344, 2112, 1, 512]
    - [173, 26.41]
  - - [1600, 2112, 1, 512]
    - [173, 27.15]
  - - [1856, 2112, 1, 512]
    - [173, 27.82]
  - - [2112, 2112, 1, 512]
    - [173, 27.78]
  - - [2368, 2112, 1, 512]
    - [280, 29.19]
  - - [2624, 2112, 1, 512]
    - [280, 29.26]
  - - [2880, 2112, 1, 512]
    - [280, 30.19]
  - - [3136, 2112, 1, 512]
    - [173, 29.82]
  - - [3392, 2112, 1, 512]
    - [282, 30.41]
  - - [3648, 2112, 1, 512]
    - [280, 29.96]
  - - [3904, 2112, 1, 512]
    - [211, 31.39]
  - - [64, 2368, 1, 512]
    - [256, 5.74]
  - - [320, 2368, 1, 512]
    - [167, 17.14]
  - - [576, 2368, 1, 512]
    - [176, 20.99]
  - - [832, 2368, 1, 512]
    - [167, 23.3]
  - - [1088, 2368, 1, 512]
    - [270, 25.54]
  - - [1344, 2368, 1, 512]
    - [173, 26.47]
  - - [1600, 2368, 1, 512]
    - [270, 26.72]
  - - [1856, 2368, 1, 512]
    - [209, 27.51]
  - - [2112, 2368, 1, 512]
    - [173, 28.49]
  - - [2368, 2368, 1, 512]
    - [209, 29.23]
  - - [2624, 2368, 1, 512]
    - [211, 29.71]
  - - [2880, 2368, 1, 512]
    - [282, 30.12]
  - - [3136, 2368, 1, 512]
    - [282, 31.47]
  - - [3392, 2368, 1, 512]
    - [282, 30.88]
  - - [3648, 2368, 1, 512]
    - [282, 31.44]
  - - [3904, 2368, 1, 512]
    - [282, 32.15]
  - - [64, 2624, 1, 512]
    - [208, 6.3]
  - - [320, 2624, 1, 512]
    - [280, 17.46]
  - - [576, 2624, 1, 512]
    - [210, 24.2]
  - - [832, 2624, 1, 512]
    - [210, 26.05]
  - - [1088, 2624, 1, 512]
    - [210, 26.79]
  - - [1344, 2624, 1, 512]
    - [210, 29.4]
  - - [1600, 2624, 1, 512]
    - [210, 29.11]
  - - [1856, 2624, 1, 512]
    - [280, 29.02]
  - - [2112, 2624, 1, 512]
    - [210, 31.19]
  - - [2368, 2624, 1, 512]
    - [280, 30.58]
  - - [2624, 2624, 1, 512]
    - [280, 31.3]
  - - [2880, 2624, 1, 512]
    - [280, 31.97]
  - - [3136, 2624, 1, 512]
    - [210, 32.48]
  - - [3392, 2624, 1, 512]
    - [280, 32.37]
  - - [3648, 2624, 1, 512]
    - [238, 31.49]
  - - [3904, 2624, 1, 512]
    - [211, 32.57]
  - - [64, 2880, 1, 512]
    - [191, 6.99]
  - - [320, 2880, 1, 512]
    - [167, 17.79]
  - - [576, 2880, 1, 512]
    - [173, 23.32]
  - - [832, 2880, 1, 512]
    - [173, 24.78]
  - - [1088, 2880, 1, 512]
    - [209, 26.4]
  - - [1344, 2880, 1, 512]
    - [173, 27.23]
  - - [1600, 2880, 1, 512]
    - [270, 28.12]
  - - [1856, 2880, 1, 512]
    - [270, 29.05]
  - - [2112, 2880, 1, 512]
    - [173, 29.49]
  - - [2368, 2880, 1, 512]
    - [282, 30.38]
  - - [2624, 2880, 1, 512]
    - [211, 30.55]
  - - [2880, 2880, 1, 512]
    - [282, 31.39]
  - - [3136, 2880, 1, 512]
    - [282, 31.54]
  - - [3392, 2880, 1, 512]
    - [282, 32.53]
  - - [3648, 2880, 1, 512]
    - [282, 32.07]
  - - [3904, 2880, 1, 512]
    - [282, 33.31]
  - - [64, 3136, 1, 512]
    - [168, 7.37]
  - - [320, 3136, 1, 512]
    - [280, 20.29]
  - - [576, 3136, 1, 512]
    - [209, 23.55]
  - - [832, 3136, 1, 512]
    - [209, 25.46]
  - - [1088, 3136, 1, 512]
    - [271, 27.23]
  - - [1344, 3136, 1, 512]
    - [280, 28.22]
  - - [1600, 3136, 1, 512]
    - [280, 29.26]
  - - [1856, 3136, 1, 512]
    - [280, 30.5]
  - - [2112, 3136, 1, 512]
    - [280, 31.03]
  - - [2368, 3136, 1, 512]
    - [271, 31.46]
  - - [2624, 3136, 1, 512]
    - [280, 30.79]
  - - [2880, 3136, 1, 512]
    - [280, 31.49]
  - - [3136, 3136, 1, 512]
    - [282, 32.44]
  - - [3392, 3136, 1, 512]
    - [281, 32.91]
  - - [3648, 3136, 1, 512]
    - [282, 33.76]
  - - [3904, 3136, 1, 512]
    - [282, 33.72]
  - - [64, 3392, 1, 512]
    - [256, 8.03]
  - - [320, 3392, 1, 512]
    - [270, 19.33]
  - - [576, 3392, 1, 512]
    - [173, 24.3]
  - - [832, 3392, 1, 512]
    - [173, 25.82]
  - - [1088, 3392, 1, 512]
    - [209, 26.69]
  - - [1344, 3392, 1, 512]
    - [173, 28.75]
  - - [1600, 3392, 1, 512]
    - [173, 28.71]
  - - [1856, 3392, 1, 512]
    - [280, 29.82]
  - - [2112, 3392, 1, 512]
    - [282, 29.95]
  - - [2368, 3392, 1, 512]
    - [281, 30.98]
  - - [2624, 3392, 1, 512]
    - [224, 30.81]
  - - [2880, 3392, 1, 512]
    - [282, 31.81]
  - - [3136, 3392, 1, 512]
    - [282, 32.9]
  - - [3392, 3392, 1, 512]
    - [282, 33.64]
  - - [3648, 3392, 1, 512]
    - [282, 34.09]
  - - [3904, 3392, 1, 512]
    - [282, 34.11]
  - - [64, 3648, 1, 512]
    - [256, 8.66]
  - - [320, 3648, 1, 512]
    - [173, 20.99]
  - - [576, 3648, 1, 512]
    - [209, 23.52]
  - - [832, 3648, 1, 512]
    - [173, 26.4]
  - - [1088, 3648, 1, 512]
    - [173, 27.14]
  - - [1344, 3648, 1, 512]
    - [173, 28.49]
  - - [1600, 3648, 1, 512]
    - [209, 29.01]
  - - [1856, 3648, 1, 512]
    - [282, 30.04]
  - - [2112, 3648, 1, 512]
    - [282, 31.1]
  - - [2368, 3648, 1, 512]
    - [282, 31.2]
  - - [2624, 3648, 1, 512]
    - [211, 31.05]
  - - [2880, 3648, 1, 512]
    - [282, 33.07]
  - - [3136, 3648, 1, 512]
    - [282, 33.59]
  - - [3392, 3648, 1, 512]
    - [282, 33.73]
  - - [3648, 3648, 1, 512]
    - [282, 33.25]
  - - [3904, 3648, 1, 512]
    - [282, 34.02]
  - - [64, 3904, 1, 512]
    - [256, 9.18]
  - - [320, 3904, 1, 512]
    - [238, 22.41]
  - - [576, 3904, 1, 512]
    - [280, 25.63]
  - - [832, 3904, 1, 512]
    - [271, 27.9]
  - - [1088, 3904, 1, 512]
    - [210, 28.91]
  - - [1344, 3904, 1, 512]
    - [210, 30.05]
  - - [1600, 3904, 1, 512]
    - [280, 30.23]
  - - [1856, 3904, 1, 512]
    - [280, 31.52]
  - - [2112, 3904, 1, 512]
    - [238, 32.52]
  - - [2368, 3904, 1, 512]
    - [238, 32.01]
  - - [2624, 3904, 1, 512]
    - [280, 32.84]
  - - [2880, 3904, 1, 512]
    - [238, 33.17]
  - - [3136, 3904, 1, 512]
    - [238, 32.63]
  - - [3392, 3904, 1, 512]
    - [271, 33.07]
  - - [3648, 3904, 1, 512]
    - [238, 33.52]
  - - [3904, 3904, 1, 512]
    - [282, 33.87]
  - - [320, 64, 1, 1024]
    - [286, 1.65]
  - - [576, 64, 1, 1024]
    - [251, 2.85]
  - - [832, 64, 1, 1024]
    - [251, 4.07]
  - - [1088, 64, 1, 1024]
    - [313, 4.98]
  - - [1344, 64, 1, 1024]
    - [313, 5.97]
  - - [1600, 64, 1, 1024]
    - [136, 6.99]
  - - [1856, 64, 1, 1024]
    - [135, 8.02]
  - - [2112, 64, 1, 1024]
    - [291, 8.23]
  - - [2368, 64, 1, 1024]
    - [208, 9.39]
  - - [2624, 64, 1, 1024]
    - [208, 10.46]
  - - [2880, 64, 1, 1024]
    - [208, 11.39]
  - - [3136, 64, 1, 1024]
    - [256, 12.46]
  - - [3392, 64, 1, 1024]
    - [258, 13.33]
  - - [3648, 64, 1, 1024]
    - [193, 14.12]
  - - [3904, 64, 1, 1024]
    - [193, 15.17]
  - - [64, 320, 1, 1024]
    - [251, 1.66]
  - - [320, 320, 1, 1024]
    - [256, 6.98]
  - - [576, 320, 1, 1024]
    - [256, 11.36]
  - - [832, 320, 1, 1024]
    - [256, 13.94]
  - - [1088, 320, 1, 1024]
    - [193, 17.69]
  - - [1344, 320, 1, 1024]
    - [271, 19.57]
  - - [1600, 320, 1, 1024]
    - [168, 21.08]
  - - [1856, 320, 1, 1024]
    - [208, 22.26]
  - - [2112, 320, 1, 1024]
    - [209, 22.14]
  - - [2368, 320, 1, 1024]
    - [369, 24.16]
  - - [2624, 320, 1, 1024]
    - [210, 24.71]
  - - [2880, 320, 1, 1024]
    - [193, 24.29]
  - - [3136, 320, 1, 1024]
    - [256, 26.39]
  - - [3392, 320, 1, 1024]
    - [173, 27.04]
  - - [3648, 320, 1, 1024]
    - [193, 28.21]
  - - [3904, 320, 1, 1024]
    - [208, 27.87]
  - - [64, 576, 1, 1024]
    - [273, 2.87]
  - - [320, 576, 1, 1024]
    - [208, 11.4]
  - - [576, 576, 1, 1024]
    - [191, 17.14]
  - - [832, 576, 1, 1024]
    - [193, 20.42]
  - - [1088, 576, 1, 1024]
    - [161, 23.69]
  - - [1344, 576, 1, 1024]
    - [167, 26.16]
  - - [1600, 576, 1, 1024]
    - [167, 26.34]
  - - [1856, 576, 1, 1024]
    - [193, 26.46]
  - - [2112, 576, 1, 1024]
    - [208, 27.53]
  - - [2368, 576, 1, 1024]
    - [208, 28.28]
  - - [2624, 576, 1, 1024]
    - [306, 28.76]
  - - [2880, 576, 1, 1024]
    - [193, 30.72]
  - - [3136, 576, 1, 1024]
    - [270, 30.93]
  - - [3392, 576, 1, 1024]
    - [173, 31.42]
  - - [3648, 576, 1, 1024]
    - [209, 30.64]
  - - [3904, 576, 1, 1024]
    - [173, 31.53]
  - - [64, 832, 1, 1024]
    - [273, 3.98]
  - - [320, 832, 1, 1024]
    - [191, 14.09]
  - - [576, 832, 1, 1024]
    - [161, 20.76]
  - - [832, 832, 1, 1024]
    - [167, 23.9]
  - - [1088, 832, 1, 1024]
    - [167, 26.54]
  - - [1344, 832, 1, 1024]
    - [270, 27.03]
  - - [1600, 832, 1, 1024]
    - [208, 28.47]
  - - [1856, 832, 1, 1024]
    - [208, 30.27]
  - - [2112, 832, 1, 1024]
    - [173, 30.58]
  - - [2368, 832, 1, 1024]
    - [173, 30.72]
  - - [2624, 832, 1, 1024]
    - [208, 31.86]
  - - [2880, 832, 1, 1024]
    - [208, 32.42]
  - - [3136, 832, 1, 1024]
    - [270, 33.29]
  - - [3392, 832, 1, 1024]
    - [270, 32.25]
  - - [3648, 832, 1, 1024]
    - [173, 33.26]
  - - [3904, 832, 1, 1024]
    - [173, 33.58]
  - - [64, 1088, 1, 1024]
    - [253, 4.8]
  - - [320, 1088, 1, 1024]
    - [193, 17.85]
  - - [576, 1088, 1, 1024]
    - [161, 23.82]
  - - [832, 1088, 1, 1024]
    - [167, 27.33]
  - - [1088, 1088, 1, 1024]
    - [280, 28.39]
  - - [1344, 1088, 1, 1024]
    - [210, 29.16]
  - - [1600, 1088, 1, 1024]
    - [209, 29.71]
  - - [1856, 1088, 1, 1024]
    - [173, 31.34]
  - - [2112, 1088, 1, 1024]
    - [173, 31.63]
  - - [2368, 1088, 1, 1024]
    - [270, 33.19]
  - - [2624, 1088, 1, 1024]
    - [208, 33.41]
  - - [2880, 1088, 1, 1024]
    - [209, 33.31]
  - - [3136, 1088, 1, 1024]
    - [280, 33.47]
  - - [3392, 1088, 1, 1024]
    - [280, 34.02]
  - - [3648, 1088, 1, 1024]
    - [208, 33.31]
  - - [3904, 1088, 1, 1024]
    - [224, 34.87]
  - - [64, 1344, 1, 1024]
    - [208, 5.95]
  - - [320, 1344, 1, 1024]
    - [271, 18.92]
  - - [576, 1344, 1, 1024]
    - [167, 25.28]
  - - [832, 1344, 1, 1024]
    - [208, 27.71]
  - - [1088, 1344, 1, 1024]
    - [210, 29.4]
  - - [1344, 1344, 1, 1024]
    - [208, 30.87]
  - - [1600, 1344, 1, 1024]
    - [173, 31.29]
  - - [1856, 1344, 1, 1024]
    - [280, 32.88]
  - - [2112, 1344, 1, 1024]
    - [209, 33.16]
  - - [2368, 1344, 1, 1024]
    - [280, 34.34]
  - - [2624, 1344, 1, 1024]
    - [173, 34.68]
  - - [2880, 1344, 1, 1024]
    - [173, 34.75]
  - - [3136, 1344, 1, 1024]
    - [280, 35.39]
  - - [3392, 1344, 1, 1024]
    - [209, 34.85]
  - - [3648, 1344, 1, 1024]
    - [173, 35.22]
  - - [3904, 1344, 1, 1024]
    - [271, 36.06]
  - - [64, 1600, 1, 1024]
    - [291, 6.75]
  - - [320, 1600, 1, 1024]
    - [161, 21.91]
  - - [576, 1600, 1, 1024]
    - [284, 25.69]
  - - [832, 1600, 1, 1024]
    - [208, 27.48]
  - - [1088, 1600, 1, 1024]
    - [173, 30.15]
  - - [1344, 1600, 1, 1024]
    - [193, 31.41]
  - - [1600, 1600, 1, 1024]
    - [209, 32.66]
  - - [1856, 1600, 1, 1024]
    - [193, 33.5]
  - - [2112, 1600, 1, 1024]
    - [173, 34.7]
  - - [2368, 1600, 1, 1024]
    - [208, 33.7]
  - - [2624, 1600, 1, 1024]
    - [173, 34.06]
  - - [2880, 1600, 1, 1024]
    - [173, 34.86]
  - - [3136, 1600, 1, 1024]
    - [209, 35.39]
  - - [3392, 1600, 1, 1024]
    - [282, 35.63]
  - - [3648, 1600, 1, 1024]
    - [281, 36.11]
  - - [3904, 1600, 1, 1024]
    - [272, 36.34]
  - - [64, 1856, 1, 1024]
    - [191, 8.12]
  - - [320, 1856, 1, 1024]
    - [161, 22.18]
  - - [576, 1856, 1, 1024]
    - [173, 26.19]
  - - [832, 1856, 1, 1024]
    - [173, 30.48]
  - - [1088, 1856, 1, 1024]
    - [173, 30.94]
  - - [1344, 1856, 1, 1024]
    - [173, 32.46]
  - - [1600, 1856, 1, 1024]
    - [193, 32.93]
  - - [1856, 1856, 1, 1024]
    - [209, 33.42]
  - - [2112, 1856, 1, 1024]
    - [173, 35.08]
  - - [2368, 1856, 1, 1024]
    - [173, 35.52]
  - - [2624, 1856, 1, 1024]
    - [282, 34.46]
  - - [2880, 1856, 1, 1024]
    - [270, 35.13]
  - - [3136, 1856, 1, 1024]
    - [282, 35.34]
  - - [3392, 1856, 1, 1024]
    - [173, 35.57]
  - - [3648, 1856, 1, 1024]
    - [282, 37.22]
  - - [3904, 1856, 1, 1024]
    - [282, 37.78]
  - - [64, 2112, 1, 1024]
    - [135, 8.26]
  - - [320, 2112, 1, 1024]
    - [167, 22.97]
  - - [576, 2112, 1, 1024]
    - [208, 27.07]
  - - [832, 2112, 1, 1024]
    - [208, 30.72]
  - - [1088, 2112, 1, 1024]
    - [173, 31.77]
  - - [1344, 2112, 1, 1024]
    - [193, 32.84]
  - - [1600, 2112, 1, 1024]
    - [173, 34.37]
  - - [1856, 2112, 1, 1024]
    - [270, 35.06]
  - - [2112, 2112, 1, 1024]
    - [202, 34.51]
  - - [2368, 2112, 1, 1024]
    - [209, 34.52]
  - - [2624, 2112, 1, 1024]
    - [224, 36.21]
  - - [2880, 2112, 1, 1024]
    - [282, 36.7]
  - - [3136, 2112, 1, 1024]
    - [282, 37.43]
  - - [3392, 2112, 1, 1024]
    - [282, 37.56]
  - - [3648, 2112, 1, 1024]
    - [282, 38.53]
  - - [3904, 2112, 1, 1024]
    - [224, 38.38]
  - - [64, 2368, 1, 1024]
    - [208, 9.47]
  - - [320, 2368, 1, 1024]
    - [176, 24.29]
  - - [576, 2368, 1, 1024]
    - [191, 28.32]
  - - [832, 2368, 1, 1024]
    - [208, 30.82]
  - - [1088, 2368, 1, 1024]
    - [270, 32.93]
  - - [1344, 2368, 1, 1024]
    - [208, 33.47]
  - - [1600, 2368, 1, 1024]
    - [173, 34.64]
  - - [1856, 2368, 1, 1024]
    - [209, 34.34]
  - - [2112, 2368, 1, 1024]
    - [270, 34.58]
  - - [2368, 2368, 1, 1024]
    - [173, 35.31]
  - - [2624, 2368, 1, 1024]
    - [282, 36.1]
  - - [2880, 2368, 1, 1024]
    - [282, 37.81]
  - - [3136, 2368, 1, 1024]
    - [282, 38.7]
  - - [3392, 2368, 1, 1024]
    - [173, 36.9]
  - - [3648, 2368, 1, 1024]
    - [282, 37.62]
  - - [3904, 2368, 1, 1024]
    - [282, 39.31]
  - - [64, 2624, 1, 1024]
    - [191, 10.36]
  - - [320, 2624, 1, 1024]
    - [208, 24.74]
  - - [576, 2624, 1, 1024]
    - [210, 31.74]
  - - [832, 2624, 1, 1024]
    - [280, 32.05]
  - - [1088, 2624, 1, 1024]
    - [173, 33.39]
  - - [1344, 2624, 1, 1024]
    - [280, 36.11]
  - - [1600, 2624, 1, 1024]
    - [280, 36.36]
  - - [1856, 2624, 1, 1024]
    - [280, 35.81]
  - - [2112, 2624, 1, 1024]
    - [280, 37.08]
  - - [2368, 2624, 1, 1024]
    - [280, 37.79]
  - - [2624, 2624, 1, 1024]
    - [280, 38.18]
  - - [2880, 2624, 1, 1024]
    - [280, 38.84]
  - - [3136, 2624, 1, 1024]
    - [271, 38.13]
  - - [3392, 2624, 1, 1024]
    - [271, 39.44]
  - - [3648, 2624, 1, 1024]
    - [280, 38.77]
  - - [3904, 2624, 1, 1024]
    - [280, 39.4]
  - - [64, 2880, 1, 1024]
    - [208, 11.31]
  - - [320, 2880, 1, 1024]
    - [208, 25.12]
  - - [576, 2880, 1, 1024]
    - [306, 30.14]
  - - [832, 2880, 1, 1024]
    - [173, 32.06]
  - - [1088, 2880, 1, 1024]
    - [173, 34.5]
  - - [1344, 2880, 1, 1024]
    - [173, 34.1]
  - - [1600, 2880, 1, 1024]
    - [173, 35.0]
  - - [1856, 2880, 1, 1024]
    - [173, 35.07]
  - - [2112, 2880, 1, 1024]
    - [173, 35.55]
  - - [2368, 2880, 1, 1024]
    - [282, 37.14]
  - - [2624, 2880, 1, 1024]
    - [282, 37.41]
  - - [2880, 2880, 1, 1024]
    - [282, 38.71]
  - - [3136, 2880, 1, 1024]
    - [282, 38.68]
  - - [3392, 2880, 1, 1024]
    - [282, 39.76]
  - - [3648, 2880, 1, 1024]
    - [282, 38.71]
  - - [3904, 2880, 1, 1024]
    - [282, 40.09]
  - - [64, 3136, 1, 1024]
    - [208, 12.19]
  - - [320, 3136, 1, 1024]
    - [238, 27.23]
  - - [576, 3136, 1, 1024]
    - [173, 31.44]
  - - [832, 3136, 1, 1024]
    - [173, 33.42]
  - - [1088, 3136, 1, 1024]
    - [208, 32.87]
  - - [1344, 3136, 1, 1024]
    - [209, 34.29]
  - - [1600, 3136, 1, 1024]
    - [208, 35.47]
  - - [1856, 3136, 1, 1024]
    - [280, 36.02]
  - - [2112, 3136, 1, 1024]
    - [280, 36.09]
  - - [2368, 3136, 1, 1024]
    - [282, 37.54]
  - - [2624, 3136, 1, 1024]
    - [276, 36.56]
  - - [2880, 3136, 1, 1024]
    - [282, 38.73]
  - - [3136, 3136, 1, 1024]
    - [282, 40.15]
  - - [3392, 3136, 1, 1024]
    - [282, 40.04]
  - - [3648, 3136, 1, 1024]
    - [282, 40.94]
  - - [3904, 3136, 1, 1024]
    - [282, 40.15]
  - - [64, 3392, 1, 1024]
    - [191, 13.14]
  - - [320, 3392, 1, 1024]
    - [193, 26.69]
  - - [576, 3392, 1, 1024]
    - [208, 31.62]
  - - [832, 3392, 1, 1024]
    - [173, 32.6]
  - - [1088, 3392, 1, 1024]
    - [209, 33.42]
  - - [1344, 3392, 1, 1024]
    - [270, 35.45]
  - - [1600, 3392, 1, 1024]
    - [173, 35.04]
  - - [1856, 3392, 1, 1024]
    - [173, 35.65]
  - - [2112, 3392, 1, 1024]
    - [209, 36.06]
  - - [2368, 3392, 1, 1024]
    - [282, 37.9]
  - - [2624, 3392, 1, 1024]
    - [282, 39.48]
  - - [2880, 3392, 1, 1024]
    - [282, 39.82]
  - - [3136, 3392, 1, 1024]
    - [282, 39.69]
  - - [3392, 3392, 1, 1024]
    - [282, 41.13]
  - - [3648, 3392, 1, 1024]
    - [282, 40.56]
  - - [3904, 3392, 1, 1024]
    - [282, 40.47]
  - - [64, 3648, 1, 1024]
    - [135, 14.19]
  - - [320, 3648, 1, 1024]
    - [208, 28.96]
  - - [576, 3648, 1, 1024]
    - [208, 31.19]
  - - [832, 3648, 1, 1024]
    - [202, 32.7]
  - - [1088, 3648, 1, 1024]
    - [173, 34.26]
  - - [1344, 3648, 1, 1024]
    - [173, 34.76]
  - - [1600, 3648, 1, 1024]
    - [208, 35.72]
  - - [1856, 3648, 1, 1024]
    - [282, 36.8]
  - - [2112, 3648, 1, 1024]
    - [282, 38.04]
  - - [2368, 3648, 1, 1024]
    - [282, 38.85]
  - - [2624, 3648, 1, 1024]
    - [282, 38.89]
  - - [2880, 3648, 1, 1024]
    - [282, 40.65]
  - - [3136, 3648, 1, 1024]
    - [281, 39.86]
  - - [3392, 3648, 1, 1024]
    - [282, 40.9]
  - - [3648, 3648, 1, 1024]
    - [282, 40.49]
  - - [3904, 3648, 1, 1024]
    - [282, 41.53]
  - - [64, 3904, 1, 1024]
    - [135, 14.94]
  - - [320, 3904, 1, 1024]
    - [284, 29.38]
  - - [576, 3904, 1, 1024]
    - [280, 32.97]
  - - [832, 3904, 1, 1024]
    - [280, 34.73]
  - - [1088, 3904, 1, 1024]
    - [280, 36.43]
  - - [1344, 3904, 1, 1024]
    - [271, 36.06]
  - - [1600, 3904, 1, 1024]
    - [280, 36.94]
  - - [1856, 3904, 1, 1024]
    - [280, 38.4]
  - - [2112, 3904, 1, 1024]
    - [271, 39.04]
  - - [2368, 3904, 1, 1024]
    - [280, 39.05]
  - - [2624, 3904, 1, 1024]
    - [280, 40.07]
  - - [2880, 3904, 1, 1024]
    - [280, 39.82]
  - - [3136, 3904, 1, 1024]
    - [280, 40.3]
  - - [3392, 3904, 1, 1024]
    - [282, 40.99]
  - - [3648, 3904, 1, 1024]
    - [281, 40.55]
  - - [3904, 3904, 1, 1024]
    - [282, 41.78]
  - - [320, 64, 1, 2048]
    - [273, 2.77]
  - - [576, 64, 1, 2048]
    - [254, 4.74]
  - - [832, 64, 1, 2048]
    - [254, 6.64]
  - - [1088, 64, 1, 2048]
    - [326, 7.32]
  - - [1344, 64, 1, 2048]
    - [313, 9.41]
  - - [1600, 64, 1, 2048]
    - [193, 10.88]
  - - [1856, 64, 1, 2048]
    - [193, 12.62]
  - - [2112, 64, 1, 2048]
    - [135, 12.23]
  - - [2368, 64, 1, 2048]
    - [291, 13.76]
  - - [2624, 64, 1, 2048]
    - [168, 15.0]
  - - [2880, 64, 1, 2048]
    - [136, 16.55]
  - - [3136, 64, 1, 2048]
    - [136, 18.05]
  - - [3392, 64, 1, 2048]
    - [193, 19.57]
  - - [3648, 64, 1, 2048]
    - [193, 20.25]
  - - [3904, 64, 1, 2048]
    - [193, 22.36]
  - - [64, 320, 1, 2048]
    - [273, 2.78]
  - - [320, 320, 1, 2048]
    - [136, 11.03]
  - - [576, 320, 1, 2048]
    - [208, 16.73]
  - - [832, 320, 1, 2048]
    - [208, 19.58]
  - - [1088, 320, 1, 2048]
    - [193, 24.48]
  - - [1344, 320, 1, 2048]
    - [271, 26.79]
  - - [1600, 320, 1, 2048]
    - [193, 29.05]
  - - [1856, 320, 1, 2048]
    - [193, 29.08]
  - - [2112, 320, 1, 2048]
    - [270, 27.74]
  - - [2368, 320, 1, 2048]
    - [173, 30.94]
  - - [2624, 320, 1, 2048]
    - [136, 30.74]
  - - [2880, 320, 1, 2048]
    - [275, 31.2]
  - - [3136, 320, 1, 2048]
    - [208, 32.62]
  - - [3392, 320, 1, 2048]
    - [208, 32.39]
  - - [3648, 320, 1, 2048]
    - [193, 35.11]
  - - [3904, 320, 1, 2048]
    - [328, 34.59]
  - - [64, 576, 1, 2048]
    - [251, 4.6]
  - - [320, 576, 1, 2048]
    - [193, 16.62]
  - - [576, 576, 1, 2048]
    - [173, 23.29]
  - - [832, 576, 1, 2048]
    - [289, 27.66]
  - - [1088, 576, 1, 2048]
    - [191, 30.08]
  - - [1344, 576, 1, 2048]
    - [161, 32.36]
  - - [1600, 576, 1, 2048]
    - [167, 33.59]
  - - [1856, 576, 1, 2048]
    - [191, 32.67]
  - - [2112, 576, 1, 2048]
    - [193, 33.41]
  - - [2368, 576, 1, 2048]
    - [270, 34.41]
  - - [2624, 576, 1, 2048]
    - [193, 36.02]
  - - [2880, 576, 1, 2048]
    - [193, 35.51]
  - - [3136, 576, 1, 2048]
    - [173, 37.29]
  - - [3392, 576, 1, 2048]
    - [275, 36.47]
  - - [3648, 576, 1, 2048]
    - [193, 35.97]
  - - [3904, 576, 1, 2048]
    - [193, 36.42]
  - - [64, 832, 1, 2048]
    - [292, 6.43]
  - - [320, 832, 1, 2048]
    - [208, 19.65]
  - - [576, 832, 1, 2048]
    - [191, 27.8]
  - - [832, 832, 1, 2048]
    - [167, 30.96]
  - - [1088, 832, 1, 2048]
    - [167, 33.59]
  - - [1344, 832, 1, 2048]
    - [193, 33.99]
  - - [1600, 832, 1, 2048]
    - [208, 34.59]
  - - [1856, 832, 1, 2048]
    - [208, 35.61]
  - - [2112, 832, 1, 2048]
    - [193, 36.65]
  - - [2368, 832, 1, 2048]
    - [275, 35.5]
  - - [2624, 832, 1, 2048]
    - [173, 37.32]
  - - [2880, 832, 1, 2048]
    - [193, 37.9]
  - - [3136, 832, 1, 2048]
    - [208, 37.97]
  - - [3392, 832, 1, 2048]
    - [193, 37.86]
  - - [3648, 832, 1, 2048]
    - [208, 38.07]
  - - [3904, 832, 1, 2048]
    - [193, 38.94]
  - - [64, 1088, 1, 2048]
    - [327, 7.54]
  - - [320, 1088, 1, 2048]
    - [208, 25.13]
  - - [576, 1088, 1, 2048]
    - [161, 30.98]
  - - [832, 1088, 1, 2048]
    - [167, 34.78]
  - - [1088, 1088, 1, 2048]
    - [280, 33.8]
  - - [1344, 1088, 1, 2048]
    - [208, 35.4]
  - - [1600, 1088, 1, 2048]
    - [208, 35.55]
  - - [1856, 1088, 1, 2048]
    - [208, 35.99]
  - - [2112, 1088, 1, 2048]
    - [191, 37.81]
  - - [2368, 1088, 1, 2048]
    - [256, 37.47]
  - - [2624, 1088, 1, 2048]
    - [193, 37.86]
  - - [2880, 1088, 1, 2048]
    - [256, 38.06]
  - - [3136, 1088, 1, 2048]
    - [193, 38.52]
  - - [3392, 1088, 1, 2048]
    - [275, 38.25]
  - - [3648, 1088, 1, 2048]
    - [208, 39.12]
  - - [3904, 1088, 1, 2048]
    - [276, 40.27]
  - - [64, 1344, 1, 2048]
    - [136, 9.4]
  - - [320, 1344, 1, 2048]
    - [161, 25.79]
  - - [576, 1344, 1, 2048]
    - [208, 32.53]
  - - [832, 1344, 1, 2048]
    - [208, 34.26]
  - - [1088, 1344, 1, 2048]
    - [208, 34.45]
  - - [1344, 1344, 1, 2048]
    - [208, 36.35]
  - - [1600, 1344, 1, 2048]
    - [193, 36.69]
  - - [1856, 1344, 1, 2048]
    - [280, 37.76]
  - - [2112, 1344, 1, 2048]
    - [191, 38.98]
  - - [2368, 1344, 1, 2048]
    - [208, 39.4]
  - - [2624, 1344, 1, 2048]
    - [272, 40.34]
  - - [2880, 1344, 1, 2048]
    - [193, 39.42]
  - - [3136, 1344, 1, 2048]
    - [271, 39.41]
  - - [3392, 1344, 1, 2048]
    - [135, 39.52]
  - - [3648, 1344, 1, 2048]
    - [282, 41.25]
  - - [3904, 1344, 1, 2048]
    - [276, 41.04]
  - - [64, 1600, 1, 2048]
    - [136, 11.09]
  - - [320, 1600, 1, 2048]
    - [208, 29.17]
  - - [576, 1600, 1, 2048]
    - [167, 32.56]
  - - [832, 1600, 1, 2048]
    - [208, 34.26]
  - - [1088, 1600, 1, 2048]
    - [208, 35.6]
  - - [1344, 1600, 1, 2048]
    - [208, 37.04]
  - - [1600, 1600, 1, 2048]
    - [193, 38.21]
  - - [1856, 1600, 1, 2048]
    - [208, 37.86]
  - - [2112, 1600, 1, 2048]
    - [208, 39.1]
  - - [2368, 1600, 1, 2048]
    - [191, 39.53]
  - - [2624, 1600, 1, 2048]
    - [224, 40.29]
  - - [2880, 1600, 1, 2048]
    - [208, 39.22]
  - - [3136, 1600, 1, 2048]
    - [369, 39.67]
  - - [3392, 1600, 1, 2048]
    - [282, 42.02]
  - - [3648, 1600, 1, 2048]
    - [282, 42.45]
  - - [3904, 1600, 1, 2048]
    - [224, 42.13]
  - - [64, 1856, 1, 2048]
    - [191, 12.49]
  - - [320, 1856, 1, 2048]
    - [161, 28.82]
  - - [576, 1856, 1, 2048]
    - [208, 33.22]
  - - [832, 1856, 1, 2048]
    - [173, 35.68]
  - - [1088, 1856, 1, 2048]
    - [191, 37.26]
  - - [1344, 1856, 1, 2048]
    - [191, 36.74]
  - - [1600, 1856, 1, 2048]
    - [208, 38.68]
  - - [1856, 1856, 1, 2048]
    - [191, 38.87]
  - - [2112, 1856, 1, 2048]
    - [208, 39.95]
  - - [2368, 1856, 1, 2048]
    - [173, 40.62]
  - - [2624, 1856, 1, 2048]
    - [282, 40.67]
  - - [2880, 1856, 1, 2048]
    - [208, 40.62]
  - - [3136, 1856, 1, 2048]
    - [315, 41.04]
  - - [3392, 1856, 1, 2048]
    - [315, 41.31]
  - - [3648, 1856, 1, 2048]
    - [315, 41.74]
  - - [3904, 1856, 1, 2048]
    - [282, 43.2]
  - - [64, 2112, 1, 2048]
    - [193, 12.45]
  - - [320, 2112, 1, 2048]
    - [167, 29.12]
  - - [576, 2112, 1, 2048]
    - [208, 33.98]
  - - [832, 2112, 1, 2048]
    - [208, 36.91]
  - - [1088, 2112, 1, 2048]
    - [193, 37.1]
  - - [1344, 2112, 1, 2048]
    - [173, 37.91]
  - - [1600, 2112, 1, 2048]
    - [193, 40.1]
  - - [1856, 2112, 1, 2048]
    - [281, 38.7]
  - - [2112, 2112, 1, 2048]
    - [173, 39.48]
  - - [2368, 2112, 1, 2048]
    - [173, 40.59]
  - - [2624, 2112, 1, 2048]
    - [314, 40.66]
  - - [2880, 2112, 1, 2048]
    - [282, 40.92]
  - - [3136, 2112, 1, 2048]
    - [282, 42.37]
  - - [3392, 2112, 1, 2048]
    - [282, 42.05]
  - - [3648, 2112, 1, 2048]
    - [282, 43.55]
  - - [3904, 2112, 1, 2048]
    - [276, 43.61]
  - - [64, 2368, 1, 2048]
    - [208, 13.97]
  - - [320, 2368, 1, 2048]
    - [202, 30.95]
  - - [576, 2368, 1, 2048]
    - [191, 35.14]
  - - [832, 2368, 1, 2048]
    - [208, 36.25]
  - - [1088, 2368, 1, 2048]
    - [208, 38.94]
  - - [1344, 2368, 1, 2048]
    - [193, 37.96]
  - - [1600, 2368, 1, 2048]
    - [193, 40.5]
  - - [1856, 2368, 1, 2048]
    - [270, 40.14]
  - - [2112, 2368, 1, 2048]
    - [208, 40.1]
  - - [2368, 2368, 1, 2048]
    - [282, 40.54]
  - - [2624, 2368, 1, 2048]
    - [224, 41.83]
  - - [2880, 2368, 1, 2048]
    - [282, 42.92]
  - - [3136, 2368, 1, 2048]
    - [282, 43.28]
  - - [3392, 2368, 1, 2048]
    - [282, 43.26]
  - - [3648, 2368, 1, 2048]
    - [282, 42.6]
  - - [3904, 2368, 1, 2048]
    - [282, 44.41]
  - - [64, 2624, 1, 2048]
    - [208, 15.53]
  - - [320, 2624, 1, 2048]
    - [291, 31.02]
  - - [576, 2624, 1, 2048]
    - [210, 37.27]
  - - [832, 2624, 1, 2048]
    - [238, 38.44]
  - - [1088, 2624, 1, 2048]
    - [208, 39.45]
  - - [1344, 2624, 1, 2048]
    - [238, 40.43]
  - - [1600, 2624, 1, 2048]
    - [280, 40.86]
  - - [1856, 2624, 1, 2048]
    - [280, 41.68]
  - - [2112, 2624, 1, 2048]
    - [280, 42.02]
  - - [2368, 2624, 1, 2048]
    - [280, 43.33]
  - - [2624, 2624, 1, 2048]
    - [280, 44.24]
  - - [2880, 2624, 1, 2048]
    - [280, 43.51]
  - - [3136, 2624, 1, 2048]
    - [280, 42.73]
  - - [3392, 2624, 1, 2048]
    - [282, 44.11]
  - - [3648, 2624, 1, 2048]
    - [271, 44.06]
  - - [3904, 2624, 1, 2048]
    - [271, 44.16]
  - - [64, 2880, 1, 2048]
    - [191, 16.78]
  - - [320, 2880, 1, 2048]
    - [208, 31.4]
  - - [576, 2880, 1, 2048]
    - [193, 35.95]
  - - [832, 2880, 1, 2048]
    - [208, 37.17]
  - - [1088, 2880, 1, 2048]
    - [208, 40.14]
  - - [1344, 2880, 1, 2048]
    - [208, 40.09]
  - - [1600, 2880, 1, 2048]
    - [173, 39.67]
  - - [1856, 2880, 1, 2048]
    - [282, 41.71]
  - - [2112, 2880, 1, 2048]
    - [282, 40.39]
  - - [2368, 2880, 1, 2048]
    - [282, 42.26]
  - - [2624, 2880, 1, 2048]
    - [224, 41.79]
  - - [2880, 2880, 1, 2048]
    - [281, 42.79]
  - - [3136, 2880, 1, 2048]
    - [315, 44.05]
  - - [3392, 2880, 1, 2048]
    - [281, 43.46]
  - - [3648, 2880, 1, 2048]
    - [281, 44.89]
  - - [3904, 2880, 1, 2048]
    - [281, 44.33]
  - - [64, 3136, 1, 2048]
    - [193, 17.99]
  - - [320, 3136, 1, 2048]
    - [275, 33.9]
  - - [576, 3136, 1, 2048]
    - [173, 36.29]
  - - [832, 3136, 1, 2048]
    - [306, 38.19]
  - - [1088, 3136, 1, 2048]
    - [208, 38.38]
  - - [1344, 3136, 1, 2048]
    - [208, 39.64]
  - - [1600, 3136, 1, 2048]
    - [208, 40.18]
  - - [1856, 3136, 1, 2048]
    - [282, 41.29]
  - - [2112, 3136, 1, 2048]
    - [282, 42.67]
  - - [2368, 3136, 1, 2048]
    - [315, 43.4]
  - - [2624, 3136, 1, 2048]
    - [282, 43.56]
  - - [2880, 3136, 1, 2048]
    - [282, 45.02]
  - - [3136, 3136, 1, 2048]
    - [281, 44.08]
  - - [3392, 3136, 1, 2048]
    - [282, 44.44]
  - - [3648, 3136, 1, 2048]
    - [281, 45.12]
  - - [3904, 3136, 1, 2048]
    - [281, 45.05]
  - - [64, 3392, 1, 2048]
    - [275, 19.3]
  - - [320, 3392, 1, 2048]
    - [193, 32.09]
  - - [576, 3392, 1, 2048]
    - [208, 37.27]
  - - [832, 3392, 1, 2048]
    - [193, 38.12]
  - - [1088, 3392, 1, 2048]
    - [193, 38.66]
  - - [1344, 3392, 1, 2048]
    - [173, 39.78]
  - - [1600, 3392, 1, 2048]
    - [282, 41.65]
  - - [1856, 3392, 1, 2048]
    - [315, 41.56]
  - - [2112, 3392, 1, 2048]
    - [282, 42.93]
  - - [2368, 3392, 1, 2048]
    - [282, 41.97]
  - - [2624, 3392, 1, 2048]
    - [282, 45.02]
  - - [2880, 3392, 1, 2048]
    - [281, 44.49]
  - - [3136, 3392, 1, 2048]
    - [282, 44.24]
  - - [3392, 3392, 1, 2048]
    - [281, 46.08]
  - - [3648, 3392, 1, 2048]
    - [281, 45.85]
  - - [3904, 3392, 1, 2048]
    - [281, 45.65]
  - - [64, 3648, 1, 2048]
    - [136, 20.83]
  - - [320, 3648, 1, 2048]
    - [208, 35.22]
  - - [576, 3648, 1, 2048]
    - [193, 36.3]
  - - [832, 3648, 1, 2048]
    - [208, 38.3]
  - - [1088, 3648, 1, 2048]
    - [173, 39.1]
  - - [1344, 3648, 1, 2048]
    - [282, 40.82]
  - - [1600, 3648, 1, 2048]
    - [315, 40.35]
  - - [1856, 3648, 1, 2048]
    - [282, 42.26]
  - - [2112, 3648, 1, 2048]
    - [282, 42.39]
  - - [2368, 3648, 1, 2048]
    - [282, 42.92]
  - - [2624, 3648, 1, 2048]
    - [281, 43.14]
  - - [2880, 3648, 1, 2048]
    - [281, 45.73]
  - - [3136, 3648, 1, 2048]
    - [281, 45.15]
  - - [3392, 3648, 1, 2048]
    - [281, 45.43]
  - - [3648, 3648, 1, 2048]
    - [281, 45.98]
  - - [3904, 3648, 1, 2048]
    - [281, 45.8]
  - - [64, 3904, 1, 2048]
    - [191, 22.25]
  - - [320, 3904, 1, 2048]
    - [238, 36.13]
  - - [576, 3904, 1, 2048]
    - [284, 37.8]
  - - [832, 3904, 1, 2048]
    - [280, 39.35]
  - - [1088, 3904, 1, 2048]
    - [208, 39.39]
  - - [1344, 3904, 1, 2048]
    - [280, 41.61]
  - - [1600, 3904, 1, 2048]
    - [271, 41.72]
  - - [1856, 3904, 1, 2048]
    - [370, 41.25]
  - - [2112, 3904, 1, 2048]
    - [271, 43.95]
  - - [2368, 3904, 1, 2048]
    - [315, 43.14]
  - - [2624, 3904, 1, 2048]
    - [282, 44.14]
  - - [2880, 3904, 1, 2048]
    - [282, 44.91]
  - - [3136, 3904, 1, 2048]
    - [282, 45.73]
  - - [3392, 3904, 1, 2048]
    - [282, 46.57]
  - - [3648, 3904, 1, 2048]
    - [281, 46.26]
  - - [3904, 3904, 1, 2048]
    - [281, 46.18]
  - - [320, 64, 1, 4096]
    - [254, 4.14]
  - - [576, 64, 1, 4096]
    - [273, 6.84]
  - - [832, 64, 1, 4096]
    - [254, 9.57]
  - - [1088, 64, 1, 4096]
    - [326, 10.57]
  - - [1344, 64, 1, 4096]
    - [313, 12.66]
  - - [1600, 64, 1, 4096]
    - [193, 14.35]
  - - [1856, 64, 1, 4096]
    - [193, 16.13]
  - - [2112, 64, 1, 4096]
    - [135, 16.28]
  - - [2368, 64, 1, 4096]
    - [291, 18.23]
  - - [2624, 64, 1, 4096]
    - [136, 19.89]
  - - [2880, 64, 1, 4096]
    - [193, 22.03]
  - - [3136, 64, 1, 4096]
    - [193, 23.74]
  - - [3392, 64, 1, 4096]
    - [193, 25.74]
  - - [3648, 64, 1, 4096]
    - [291, 26.87]
  - - [3904, 64, 1, 4096]
    - [291, 28.68]
  - - [64, 320, 1, 4096]
    - [254, 4.23]
  - - [320, 320, 1, 4096]
    - [136, 15.08]
  - - [576, 320, 1, 4096]
    - [193, 22.1]
  - - [832, 320, 1, 4096]
    - [208, 23.96]
  - - [1088, 320, 1, 4096]
    - [208, 30.49]
  - - [1344, 320, 1, 4096]
    - [271, 32.97]
  - - [1600, 320, 1, 4096]
    - [135, 34.93]
  - - [1856, 320, 1, 4096]
    - [208, 33.59]
  - - [2112, 320, 1, 4096]
    - [208, 31.23]
  - - [2368, 320, 1, 4096]
    - [256, 35.88]
  - - [2624, 320, 1, 4096]
    - [193, 33.0]
  - - [2880, 320, 1, 4096]
    - [191, 35.2]
  - - [3136, 320, 1, 4096]
    - [208, 38.26]
  - - [3392, 320, 1, 4096]
    - [193, 37.46]
  - - [3648, 320, 1, 4096]
    - [193, 39.87]
  - - [3904, 320, 1, 4096]
    - [328, 40.3]
  - - [64, 576, 1, 4096]
    - [254, 6.8]
  - - [320, 576, 1, 4096]
    - [135, 21.6]
  - - [576, 576, 1, 4096]
    - [208, 29.21]
  - - [832, 576, 1, 4096]
    - [291, 33.26]
  - - [1088, 576, 1, 4096]
    - [161, 35.86]
  - - [1344, 576, 1, 4096]
    - [167, 38.29]
  - - [1600, 576, 1, 4096]
    - [167, 38.83]
  - - [1856, 576, 1, 4096]
    - [291, 36.95]
  - - [2112, 576, 1, 4096]
    - [193, 37.63]
  - - [2368, 576, 1, 4096]
    - [136, 37.92]
  - - [2624, 576, 1, 4096]
    - [135, 37.79]
  - - [2880, 576, 1, 4096]
    - [193, 40.65]
  - - [3136, 576, 1, 4096]
    - [208, 40.69]
  - - [3392, 576, 1, 4096]
    - [173, 40.34]
  - - [3648, 576, 1, 4096]
    - [208, 40.81]
  - - [3904, 576, 1, 4096]
    - [224, 40.71]
  - - [64, 832, 1, 4096]
    - [302, 8.13]
  - - [320, 832, 1, 4096]
    - [208, 24.12]
  - - [576, 832, 1, 4096]
    - [271, 32.36]
  - - [832, 832, 1, 4096]
    - [161, 35.5]
  - - [1088, 832, 1, 4096]
    - [167, 37.62]
  - - [1344, 832, 1, 4096]
    - [291, 37.78]
  - - [1600, 832, 1, 4096]
    - [256, 37.6]
  - - [1856, 832, 1, 4096]
    - [291, 40.2]
  - - [2112, 832, 1, 4096]
    - [193, 40.66]
  - - [2368, 832, 1, 4096]
    - [193, 39.94]
  - - [2624, 832, 1, 4096]
    - [193, 41.12]
  - - [2880, 832, 1, 4096]
    - [208, 41.51]
  - - [3136, 832, 1, 4096]
    - [291, 42.03]
  - - [3392, 832, 1, 4096]
    - [289, 42.23]
  - - [3648, 832, 1, 4096]
    - [275, 41.97]
  - - [3904, 832, 1, 4096]
    - [224, 41.74]
  - - [64, 1088, 1, 4096]
    - [208, 10.18]
  - - [320, 1088, 1, 4096]
    - [275, 30.58]
  - - [576, 1088, 1, 4096]
    - [161, 36.29]
  - - [832, 1088, 1, 4096]
    - [167, 39.8]
  - - [1088, 1088, 1, 4096]
    - [280, 38.27]
  - - [1344, 1088, 1, 4096]
    - [193, 38.86]
  - - [1600, 1088, 1, 4096]
    - [208, 39.82]
  - - [1856, 1088, 1, 4096]
    - [193, 41.31]
  - - [2112, 1088, 1, 4096]
    - [279, 41.15]
  - - [2368, 1088, 1, 4096]
    - [208, 41.83]
  - - [2624, 1088, 1, 4096]
    - [224, 40.5]
  - - [2880, 1088, 1, 4096]
    - [208, 42.95]
  - - [3136, 1088, 1, 4096]
    - [371, 40.57]
  - - [3392, 1088, 1, 4096]
    - [282, 42.03]
  - - [3648, 1088, 1, 4096]
    - [193, 43.12]
  - - [3904, 1088, 1, 4096]
    - [282, 44.42]
  - - [64, 1344, 1, 4096]
    - [136, 12.56]
  - - [320, 1344, 1, 4096]
    - [329, 30.69]
  - - [576, 1344, 1, 4096]
    - [291, 37.29]
  - - [832, 1344, 1, 4096]
    - [208, 38.73]
  - - [1088, 1344, 1, 4096]
    - [275, 38.4]
  - - [1344, 1344, 1, 4096]
    - [275, 40.58]
  - - [1600, 1344, 1, 4096]
    - [191, 41.61]
  - - [1856, 1344, 1, 4096]
    - [238, 40.9]
  - - [2112, 1344, 1, 4096]
    - [282, 42.27]
  - - [2368, 1344, 1, 4096]
    - [280, 42.43]
  - - [2624, 1344, 1, 4096]
    - [272, 43.26]
  - - [2880, 1344, 1, 4096]
    - [282, 44.66]
  - - [3136, 1344, 1, 4096]
    - [282, 44.07]
  - - [3392, 1344, 1, 4096]
    - [208, 45.1]
  - - [3648, 1344, 1, 4096]
    - [281, 44.08]
  - - [3904, 1344, 1, 4096]
    - [282, 44.72]
  - - [64, 1600, 1, 4096]
    - [136, 14.92]
  - - [320, 1600, 1, 4096]
    - [193, 34.95]
  - - [576, 1600, 1, 4096]
    - [167, 36.6]
  - - [832, 1600, 1, 4096]
    - [208, 37.08]
  - - [1088, 1600, 1, 4096]
    - [191, 40.01]
  - - [1344, 1600, 1, 4096]
    - [135, 40.7]
  - - [1600, 1600, 1, 4096]
    - [135, 40.71]
  - - [1856, 1600, 1, 4096]
    - [135, 42.11]
  - - [2112, 1600, 1, 4096]
    - [282, 42.75]
  - - [2368, 1600, 1, 4096]
    - [282, 43.04]
  - - [2624, 1600, 1, 4096]
    - [314, 43.16]
  - - [2880, 1600, 1, 4096]
    - [282, 43.48]
  - - [3136, 1600, 1, 4096]
    - [282, 43.83]
  - - [3392, 1600, 1, 4096]
    - [282, 46.91]
  - - [3648, 1600, 1, 4096]
    - [282, 46.07]
  - - [3904, 1600, 1, 4096]
    - [282, 46.45]
  - - [64, 1856, 1, 4096]
    - [136, 17.27]
  - - [320, 1856, 1, 4096]
    - [307, 32.93]
  - - [576, 1856, 1, 4096]
    - [275, 36.33]
  - - [832, 1856, 1, 4096]
    - [193, 40.67]
  - - [1088, 1856, 1, 4096]
    - [208, 40.28]
  - - [1344, 1856, 1, 4096]
    - [208, 41.64]
  - - [1600, 1856, 1, 4096]
    - [256, 41.29]
  - - [1856, 1856, 1, 4096]
    - [193, 42.81]
  - - [2112, 1856, 1, 4096]
    - [282, 44.06]
  - - [2368, 1856, 1, 4096]
    - [282, 45.2]
  - - [2624, 1856, 1, 4096]
    - [281, 45.54]
  - - [2880, 1856, 1, 4096]
    - [315, 45.29]
  - - [3136, 1856, 1, 4096]
    - [282, 46.61]
  - - [3392, 1856, 1, 4096]
    - [315, 45.75]
  - - [3648, 1856, 1, 4096]
    - [281, 46.45]
  - - [3904, 1856, 1, 4096]
    - [281, 45.97]
  - - [64, 2112, 1, 4096]
    - [208, 16.52]
  - - [320, 2112, 1, 4096]
    - [167, 33.52]
  - - [576, 2112, 1, 4096]
    - [208, 37.11]
  - - [832, 2112, 1, 4096]
    - [193, 40.53]
  - - [1088, 2112, 1, 4096]
    - [208, 41.66]
  - - [1344, 2112, 1, 4096]
    - [191, 41.36]
  - - [1600, 2112, 1, 4096]
    - [315, 42.83]
  - - [1856, 2112, 1, 4096]
    - [282, 44.71]
  - - [2112, 2112, 1, 4096]
    - [282, 42.86]
  - - [2368, 2112, 1, 4096]
    - [282, 44.08]
  - - [2624, 2112, 1, 4096]
    - [224, 44.9]
  - - [2880, 2112, 1, 4096]
    - [282, 44.93]
  - - [3136, 2112, 1, 4096]
    - [281, 46.22]
  - - [3392, 2112, 1, 4096]
    - [282, 47.08]
  - - [3648, 2112, 1, 4096]
    - [282, 46.83]
  - - [3904, 2112, 1, 4096]
    - [282, 48.48]
  - - [64, 2368, 1, 4096]
    - [193, 18.37]
  - - [320, 2368, 1, 4096]
    - [256, 35.25]
  - - [576, 2368, 1, 4096]
    - [135, 38.96]
  - - [832, 2368, 1, 4096]
    - [275, 39.02]
  - - [1088, 2368, 1, 4096]
    - [135, 41.59]
  - - [1344, 2368, 1, 4096]
    - [314, 41.53]
  - - [1600, 2368, 1, 4096]
    - [282, 43.85]
  - - [1856, 2368, 1, 4096]
    - [315, 44.17]
  - - [2112, 2368, 1, 4096]
    - [282, 42.64]
  - - [2368, 2368, 1, 4096]
    - [315, 43.73]
  - - [2624, 2368, 1, 4096]
    - [315, 45.84]
  - - [2880, 2368, 1, 4096]
    - [281, 46.84]
  - - [3136, 2368, 1, 4096]
    - [282, 47.46]
  - - [3392, 2368, 1, 4096]
    - [282, 46.33]
  - - [3648, 2368, 1, 4096]
    - [281, 46.32]
  - - [3904, 2368, 1, 4096]
    - [282, 47.76]
  - - [64, 2624, 1, 4096]
    - [208, 20.39]
  - - [320, 2624, 1, 4096]
    - [289, 35.46]
  - - [576, 2624, 1, 4096]
    - [210, 40.14]
  - - [832, 2624, 1, 4096]
    - [238, 41.53]
  - - [1088, 2624, 1, 4096]
    - [282, 42.65]
  - - [1344, 2624, 1, 4096]
    - [371, 43.92]
  - - [1600, 2624, 1, 4096]
    - [271, 43.86]
  - - [1856, 2624, 1, 4096]
    - [282, 44.58]
  - - [2112, 2624, 1, 4096]
    - [280, 46.48]
  - - [2368, 2624, 1, 4096]
    - [282, 46.4]
  - - [2624, 2624, 1, 4096]
    - [281, 46.41]
  - - [2880, 2624, 1, 4096]
    - [315, 46.03]
  - - [3136, 2624, 1, 4096]
    - [281, 47.83]
  - - [3392, 2624, 1, 4096]
    - [281, 48.26]
  - - [3648, 2624, 1, 4096]
    - [281, 46.8]
  - - [3904, 2624, 1, 4096]
    - [282, 48.9]
  - - [64, 2880, 1, 4096]
    - [193, 21.64]
  - - [320, 2880, 1, 4096]
    - [193, 34.85]
  - - [576, 2880, 1, 4096]
    - [208, 39.84]
  - - [832, 2880, 1, 4096]
    - [291, 40.39]
  - - [1088, 2880, 1, 4096]
    - [208, 42.4]
  - - [1344, 2880, 1, 4096]
    - [282, 42.95]
  - - [1600, 2880, 1, 4096]
    - [315, 42.8]
  - - [1856, 2880, 1, 4096]
    - [282, 44.86]
  - - [2112, 2880, 1, 4096]
    - [282, 45.05]
  - - [2368, 2880, 1, 4096]
    - [315, 46.21]
  - - [2624, 2880, 1, 4096]
    - [315, 45.66]
  - - [2880, 2880, 1, 4096]
    - [282, 47.6]
  - - [3136, 2880, 1, 4096]
    - [335, 47.95]
  - - [3392, 2880, 1, 4096]
    - [335, 47.07]
  - - [3648, 2880, 1, 4096]
    - [282, 49.73]
  - - [3904, 2880, 1, 4096]
    - [281, 48.76]
  - - [64, 3136, 1, 4096]
    - [136, 23.21]
  - - [320, 3136, 1, 4096]
    - [275, 37.56]
  - - [576, 3136, 1, 4096]
    - [256, 39.87]
  - - [832, 3136, 1, 4096]
    - [208, 42.37]
  - - [1088, 3136, 1, 4096]
    - [224, 41.89]
  - - [1344, 3136, 1, 4096]
    - [282, 42.81]
  - - [1600, 3136, 1, 4096]
    - [282, 43.97]
  - - [1856, 3136, 1, 4096]
    - [282, 45.62]
  - - [2112, 3136, 1, 4096]
    - [282, 46.44]
  - - [2368, 3136, 1, 4096]
    - [282, 47.49]
  - - [2624, 3136, 1, 4096]
    - [281, 47.03]
  - - [2880, 3136, 1, 4096]
    - [282, 48.62]
  - - [3136, 3136, 1, 4096]
    - [281, 47.73]
  - - [3392, 3136, 1, 4096]
    - [281, 48.21]
  - - [3648, 3136, 1, 4096]
    - [281, 49.24]
  - - [3904, 3136, 1, 4096]
    - [282, 49.77]
  - - [64, 3392, 1, 4096]
    - [136, 25.72]
  - - [320, 3392, 1, 4096]
    - [275, 36.7]
  - - [576, 3392, 1, 4096]
    - [279, 41.24]
  - - [832, 3392, 1, 4096]
    - [275, 42.71]
  - - [1088, 3392, 1, 4096]
    - [224, 42.38]
  - - [1344, 3392, 1, 4096]
    - [282, 42.52]
  - - [1600, 3392, 1, 4096]
    - [282, 46.94]
  - - [1856, 3392, 1, 4096]
    - [282, 46.65]
  - - [2112, 3392, 1, 4096]
    - [281, 45.63]
  - - [2368, 3392, 1, 4096]
    - [282, 46.38]
  - - [2624, 3392, 1, 4096]
    - [281, 47.86]
  - - [2880, 3392, 1, 4096]
    - [282, 47.68]
  - - [3136, 3392, 1, 4096]
    - [281, 47.38]
  - - [3392, 3392, 1, 4096]
    - [282, 49.64]
  - - [3648, 3392, 1, 4096]
    - [281, 49.05]
  - - [3904, 3392, 1, 4096]
    - [335, 48.89]
  - - [64, 3648, 1, 4096]
    - [136, 27.17]
  - - [320, 3648, 1, 4096]
    - [135, 39.62]
  - - [576, 3648, 1, 4096]
    - [135, 40.54]
  - - [832, 3648, 1, 4096]
    - [168, 40.95]
  - - [1088, 3648, 1, 4096]
    - [208, 44.14]
  - - [1344, 3648, 1, 4096]
    - [282, 46.35]
  - - [1600, 3648, 1, 4096]
    - [282, 46.11]
  - - [1856, 3648, 1, 4096]
    - [281, 46.4]
  - - [2112, 3648, 1, 4096]
    - [281, 45.7]
  - - [2368, 3648, 1, 4096]
    - [335, 46.1]
  - - [2624, 3648, 1, 4096]
    - [282, 48.08]
  - - [2880, 3648, 1, 4096]
    - [282, 49.98]
  - - [3136, 3648, 1, 4096]
    - [282, 49.92]
  - - [3392, 3648, 1, 4096]
    - [282, 50.1]
  - - [3648, 3648, 1, 4096]
    - [281, 49.0]
  - - [3904, 3648, 1, 4096]
    - [281, 49.31]
  - - [64, 3904, 1, 4096]
    - [193, 28.68]
  - - [320, 3904, 1, 4096]
    - [238, 39.76]
  - - [576, 3904, 1, 4096]
    - [271, 38.73]
  - - [832, 3904, 1, 4096]
    - [280, 43.41]
  - - [1088, 3904, 1, 4096]
    - [281, 43.38]
  - - [1344, 3904, 1, 4096]
    - [282, 44.95]
  - - [1600, 3904, 1, 4096]
    - [282, 47.5]
  - - [1856, 3904, 1, 4096]
    - [281, 47.32]
  - - [2112, 3904, 1, 4096]
    - [281, 48.32]
  - - [2368, 3904, 1, 4096]
    - [282, 48.21]
  - - [2624, 3904, 1, 4096]
    - [281, 48.06]
  - - [2880, 3904, 1, 4096]
    - [282, 48.6]
  - - [3136, 3904, 1, 4096]
    - [282, 48.96]
  - - [3392, 3904, 1, 4096]
    - [281, 49.01]
  - - [3648, 3904, 1, 4096]
    - [281, 49.31]
  - - [3904, 3904, 1, 4096]
    - [282, 48.43]
  - - [192, 64, 1, 64]
    - [116, 0.08]
  - - [448, 64, 1, 64]
    - [119, 0.17]
  - - [704, 64, 1, 64]
    - [122, 0.28]
  - - [960, 64, 1, 64]
    - [126, 0.38]
  - - [1216, 64, 1, 64]
    - [125, 0.48]
  - - [1472, 64, 1, 64]
    - [317, 0.57]
  - - [1728, 64, 1, 64]
    - [179, 0.66]
  - - [1984, 64, 1, 64]
    - [208, 0.75]
  - - [64, 192, 1, 64]
    - [137, 0.08]
  - - [192, 192, 1, 64]
    - [116, 0.23]
  - - [320, 192, 1, 64]
    - [122, 0.38]
  - - [448, 192, 1, 64]
    - [139, 0.51]
  - - [576, 192, 1, 64]
    - [141, 0.62]
  - - [704, 192, 1, 64]
    - [143, 0.79]
  - - [832, 192, 1, 64]
    - [145, 0.92]
  - - [960, 192, 1, 64]
    - [147, 1.06]
  - - [1088, 192, 1, 64]
    - [174, 1.2]
  - - [1216, 192, 1, 64]
    - [207, 1.31]
  - - [1344, 192, 1, 64]
    - [178, 1.46]
  - - [1472, 192, 1, 64]
    - [140, 1.55]
  - - [1600, 192, 1, 64]
    - [318, 1.67]
  - - [1728, 192, 1, 64]
    - [172, 1.79]
  - - [1856, 192, 1, 64]
    - [319, 1.93]
  - - [1984, 192, 1, 64]
    - [136, 2.07]
  - - [192, 320, 1, 64]
    - [158, 0.38]
  - - [448, 320, 1, 64]
    - [161, 0.83]
  - - [704, 320, 1, 64]
    - [165, 1.29]
  - - [960, 320, 1, 64]
    - [168, 1.67]
  - - [1216, 320, 1, 64]
    - [132, 2.11]
  - - [1472, 320, 1, 64]
    - [175, 2.42]
  - - [1728, 320, 1, 64]
    - [198, 2.72]
  - - [1984, 320, 1, 64]
    - [167, 3.14]
  - - [64, 448, 1, 64]
    - [180, 0.18]
  - - [192, 448, 1, 64]
    - [181, 0.51]
  - - [320, 448, 1, 64]
    - [177, 0.81]
  - - [448, 448, 1, 64]
    - [182, 1.14]
  - - [576, 448, 1, 64]
    - [139, 1.48]
  - - [704, 448, 1, 64]
    - [184, 1.69]
  - - [832, 448, 1, 64]
    - [186, 2.0]
  - - [960, 448, 1, 64]
    - [144, 2.2]
  - - [1088, 448, 1, 64]
    - [167, 2.54]
  - - [1216, 448, 1, 64]
    - [166, 2.65]
  - - [1344, 448, 1, 64]
    - [166, 2.92]
  - - [1472, 448, 1, 64]
    - [239, 3.11]
  - - [1600, 448, 1, 64]
    - [166, 3.26]
  - - [1728, 448, 1, 64]
    - [132, 3.48]
  - - [1856, 448, 1, 64]
    - [166, 3.67]
  - - [1984, 448, 1, 64]
    - [210, 3.89]
  - - [192, 576, 1, 64]
    - [171, 0.67]
  - - [448, 576, 1, 64]
    - [199, 1.48]
  - - [704, 576, 1, 64]
    - [135, 2.06]
  - - [960, 576, 1, 64]
    - [161, 2.72]
  - - [1216, 576, 1, 64]
    - [210, 3.34]
  - - [1472, 576, 1, 64]
    - [280, 3.17]
  - - [1728, 576, 1, 64]
    - [167, 4.13]
  - - [1984, 576, 1, 64]
    - [183, 4.48]
  - - [64, 704, 1, 64]
    - [204, 0.28]
  - - [192, 704, 1, 64]
    - [178, 0.78]
  - - [320, 704, 1, 64]
    - [186, 1.3]
  - - [448, 704, 1, 64]
    - [184, 1.71]
  - - [576, 704, 1, 64]
    - [208, 2.11]
  - - [704, 704, 1, 64]
    - [167, 2.53]
  - - [832, 704, 1, 64]
    - [161, 2.87]
  - - [960, 704, 1, 64]
    - [210, 3.15]
  - - [1088, 704, 1, 64]
    - [167, 3.55]
  - - [1216, 704, 1, 64]
    - [183, 3.75]
  - - [1344, 704, 1, 64]
    - [210, 4.07]
  - - [1472, 704, 1, 64]
    - [192, 4.2]
  - - [1600, 704, 1, 64]
    - [210, 4.45]
  - - [1728, 704, 1, 64]
    - [183, 4.67]
  - - [1856, 704, 1, 64]
    - [183, 4.93]
  - - [1984, 704, 1, 64]
    - [239, 5.03]
  - - [192, 832, 1, 64]
    - [162, 0.92]
  - - [448, 832, 1, 64]
    - [175, 2.05]
  - - [704, 832, 1, 64]
    - [167, 2.92]
  - - [960, 832, 1, 64]
    - [166, 3.54]
  - - [1216, 832, 1, 64]
    - [183, 4.24]
  - - [1472, 832, 1, 64]
    - [210, 4.61]
  - - [1728, 832, 1, 64]
    - [210, 5.23]
  - - [1984, 832, 1, 64]
    - [210, 5.63]
  - - [64, 960, 1, 64]
    - [123, 0.38]
  - - [192, 960, 1, 64]
    - [161, 1.05]
  - - [320, 960, 1, 64]
    - [183, 1.71]
  - - [448, 960, 1, 64]
    - [167, 2.26]
  - - [576, 960, 1, 64]
    - [167, 2.74]
  - - [704, 960, 1, 64]
    - [210, 3.2]
  - - [832, 960, 1, 64]
    - [167, 3.59]
  - - [960, 960, 1, 64]
    - [210, 4.05]
  - - [1088, 960, 1, 64]
    - [132, 4.4]
  - - [1216, 960, 1, 64]
    - [210, 4.67]
  - - [1344, 960, 1, 64]
    - [183, 4.9]
  - - [1472, 960, 1, 64]
    - [239, 5.16]
  - - [1600, 960, 1, 64]
    - [242, 5.15]
  - - [1728, 960, 1, 64]
    - [239, 5.66]
  - - [1856, 960, 1, 64]
    - [210, 5.71]
  - - [1984, 960, 1, 64]
    - [242, 6.09]
  - - [192, 1088, 1, 64]
    - [321, 1.2]
  - - [448, 1088, 1, 64]
    - [167, 2.52]
  - - [704, 1088, 1, 64]
    - [167, 3.58]
  - - [960, 1088, 1, 64]
    - [323, 4.34]
  - - [1216, 1088, 1, 64]
    - [242, 4.81]
  - - [1472, 1088, 1, 64]
    - [242, 5.4]
  - - [1728, 1088, 1, 64]
    - [210, 5.74]
  - - [1984, 1088, 1, 64]
    - [242, 6.41]
  - - [64, 1216, 1, 64]
    - [252, 0.47]
  - - [192, 1216, 1, 64]
    - [201, 1.3]
  - - [320, 1216, 1, 64]
    - [167, 2.12]
  - - [448, 1216, 1, 64]
    - [167, 2.72]
  - - [576, 1216, 1, 64]
    - [210, 3.36]
  - - [704, 1216, 1, 64]
    - [132, 3.79]
  - - [832, 1216, 1, 64]
    - [183, 4.23]
  - - [960, 1216, 1, 64]
    - [210, 4.76]
  - - [1088, 1216, 1, 64]
    - [210, 4.83]
  - - [1216, 1216, 1, 64]
    - [210, 5.28]
  - - [1344, 1216, 1, 64]
    - [210, 5.34]
  - - [1472, 1216, 1, 64]
    - [210, 5.56]
  - - [1600, 1216, 1, 64]
    - [210, 6.08]
  - - [1728, 1216, 1, 64]
    - [210, 6.18]
  - - [1856, 1216, 1, 64]
    - [242, 6.34]
  - - [1984, 1216, 1, 64]
    - [242, 6.68]
  - - [192, 1344, 1, 64]
    - [223, 1.47]
  - - [448, 1344, 1, 64]
    - [198, 2.95]
  - - [704, 1344, 1, 64]
    - [210, 4.15]
  - - [960, 1344, 1, 64]
    - [242, 4.84]
  - - [1216, 1344, 1, 64]
    - [210, 5.36]
  - - [1472, 1344, 1, 64]
    - [210, 6.01]
  - - [1728, 1344, 1, 64]
    - [242, 6.5]
  - - [1984, 1344, 1, 64]
    - [242, 7.02]
  - - [64, 1472, 1, 64]
    - [134, 0.56]
  - - [192, 1472, 1, 64]
    - [166, 1.56]
  - - [320, 1472, 1, 64]
    - [175, 2.46]
  - - [448, 1472, 1, 64]
    - [167, 3.13]
  - - [576, 1472, 1, 64]
    - [242, 3.71]
  - - [704, 1472, 1, 64]
    - [183, 4.3]
  - - [832, 1472, 1, 64]
    - [210, 4.93]
  - - [960, 1472, 1, 64]
    - [210, 5.16]
  - - [1088, 1472, 1, 64]
    - [210, 5.37]
  - - [1216, 1472, 1, 64]
    - [242, 5.65]
  - - [1344, 1472, 1, 64]
    - [239, 6.09]
  - - [1472, 1472, 1, 64]
    - [210, 6.41]
  - - [1600, 1472, 1, 64]
    - [242, 6.48]
  - - [1728, 1472, 1, 64]
    - [210, 6.69]
  - - [1856, 1472, 1, 64]
    - [210, 7.07]
  - - [1984, 1472, 1, 64]
    - [242, 7.24]
  - - [192, 1600, 1, 64]
    - [193, 1.69]
  - - [448, 1600, 1, 64]
    - [241, 3.29]
  - - [704, 1600, 1, 64]
    - [132, 4.44]
  - - [960, 1600, 1, 64]
    - [210, 5.34]
  - - [1216, 1600, 1, 64]
    - [242, 6.09]
  - - [1472, 1600, 1, 64]
    - [242, 6.48]
  - - [1728, 1600, 1, 64]
    - [242, 7.14]
  - - [1984, 1600, 1, 64]
    - [210, 7.55]
  - - [64, 1728, 1, 64]
    - [215, 0.65]
  - - [192, 1728, 1, 64]
    - [182, 1.81]
  - - [320, 1728, 1, 64]
    - [167, 2.74]
  - - [448, 1728, 1, 64]
    - [132, 3.48]
  - - [576, 1728, 1, 64]
    - [210, 4.3]
  - - [704, 1728, 1, 64]
    - [325, 4.71]
  - - [832, 1728, 1, 64]
    - [210, 5.34]
  - - [960, 1728, 1, 64]
    - [210, 5.6]
  - - [1088, 1728, 1, 64]
    - [242, 5.78]
  - - [1216, 1728, 1, 64]
    - [210, 6.17]
  - - [1344, 1728, 1, 64]
    - [210, 6.38]
  - - [1472, 1728, 1, 64]
    - [210, 6.66]
  - - [1600, 1728, 1, 64]
    - [210, 7.11]
  - - [1728, 1728, 1, 64]
    - [210, 7.26]
  - - [1856, 1728, 1, 64]
    - [210, 7.49]
  - - [1984, 1728, 1, 64]
    - [210, 7.64]
  - - [192, 1856, 1, 64]
    - [146, 1.93]
  - - [448, 1856, 1, 64]
    - [242, 3.62]
  - - [704, 1856, 1, 64]
    - [183, 5.01]
  - - [960, 1856, 1, 64]
    - [242, 5.74]
  - - [1216, 1856, 1, 64]
    - [242, 6.64]
  - - [1472, 1856, 1, 64]
    - [242, 7.09]
  - - [1728, 1856, 1, 64]
    - [242, 7.63]
  - - [1984, 1856, 1, 64]
    - [210, 7.97]
  - - [64, 1984, 1, 64]
    - [324, 0.73]
  - - [192, 1984, 1, 64]
    - [167, 2.01]
  - - [320, 1984, 1, 64]
    - [132, 2.97]
  - - [448, 1984, 1, 64]
    - [132, 3.78]
  - - [576, 1984, 1, 64]
    - [210, 4.44]
  - - [704, 1984, 1, 64]
    - [210, 5.05]
  - - [832, 1984, 1, 64]
    - [210, 5.59]
  - - [960, 1984, 1, 64]
    - [210, 5.87]
  - - [1088, 1984, 1, 64]
    - [210, 6.4]
  - - [1216, 1984, 1, 64]
    - [242, 6.65]
  - - [1344, 1984, 1, 64]
    - [242, 6.85]
  - - [1472, 1984, 1, 64]
    - [242, 7.2]
  - - [1600, 1984, 1, 64]
    - [242, 7.5]
  - - [1728, 1984, 1, 64]
    - [239, 7.65]
  - - [1856, 1984, 1, 64]
    - [242, 7.9]
  - - [1984, 1984, 1, 64]
    - [239, 8.18]
  - - [192, 64, 1, 256]
    - [246, 0.28]
  - - [448, 64, 1, 256]
    - [249, 0.66]
  - - [704, 64, 1, 256]
    - [118, 0.99]
  - - [960, 64, 1, 256]
    - [119, 1.38]
  - - [1216, 64, 1, 256]
    - [252, 1.72]
  - - [1472, 64, 1, 256]
    - [119, 2.0]
  - - [1728, 64, 1, 256]
    - [191, 2.35]
  - - [1984, 64, 1, 256]
    - [208, 2.67]
  - - [64, 192, 1, 256]
    - [257, 0.29]
  - - [192, 192, 1, 256]
    - [119, 0.84]
  - - [320, 192, 1, 256]
    - [120, 1.37]
  - - [448, 192, 1, 256]
    - [168, 1.81]
  - - [576, 192, 1, 256]
    - [142, 2.34]
  - - [704, 192, 1, 256]
    - [256, 2.77]
  - - [832, 192, 1, 256]
    - [173, 3.22]
  - - [960, 192, 1, 256]
    - [173, 3.66]
  - - [1088, 192, 1, 256]
    - [133, 4.15]
  - - [1216, 192, 1, 256]
    - [256, 4.69]
  - - [1344, 192, 1, 256]
    - [168, 5.16]
  - - [1472, 192, 1, 256]
    - [193, 5.32]
  - - [1600, 192, 1, 256]
    - [208, 5.8]
  - - [1728, 192, 1, 256]
    - [193, 6.23]
  - - [1856, 192, 1, 256]
    - [256, 6.67]
  - - [1984, 192, 1, 256]
    - [208, 6.99]
  - - [192, 320, 1, 256]
    - [119, 1.38]
  - - [448, 320, 1, 256]
    - [256, 2.93]
  - - [704, 320, 1, 256]
    - [258, 4.49]
  - - [960, 320, 1, 256]
    - [173, 5.78]
  - - [1216, 320, 1, 256]
    - [289, 6.92]
  - - [1472, 320, 1, 256]
    - [270, 7.99]
  - - [1728, 320, 1, 256]
    - [167, 8.75]
  - - [1984, 320, 1, 256]
    - [230, 9.71]
  - - [64, 448, 1, 256]
    - [119, 0.66]
  - - [192, 448, 1, 256]
    - [191, 1.83]
  - - [320, 448, 1, 256]
    - [191, 2.93]
  - - [448, 448, 1, 256]
    - [230, 3.96]
  - - [576, 448, 1, 256]
    - [256, 5.21]
  - - [704, 448, 1, 256]
    - [176, 5.88]
  - - [832, 448, 1, 256]
    - [208, 6.89]
  - - [960, 448, 1, 256]
    - [271, 7.48]
  - - [1088, 448, 1, 256]
    - [208, 8.28]
  - - [1216, 448, 1, 256]
    - [173, 8.38]
  - - [1344, 448, 1, 256]
    - [256, 9.28]
  - - [1472, 448, 1, 256]
    - [284, 9.82]
  - - [1600, 448, 1, 256]
    - [270, 10.08]
  - - [1728, 448, 1, 256]
    - [173, 10.79]
  - - [1856, 448, 1, 256]
    - [239, 11.0]
  - - [1984, 448, 1, 256]
    - [238, 11.76]
  - - [192, 576, 1, 256]
    - [133, 2.33]
  - - [448, 576, 1, 256]
    - [193, 5.07]
  - - [704, 576, 1, 256]
    - [191, 6.78]
  - - [960, 576, 1, 256]
    - [167, 8.97]
  - - [1216, 576, 1, 256]
    - [167, 10.55]
  - - [1472, 576, 1, 256]
    - [167, 11.79]
  - - [1728, 576, 1, 256]
    - [167, 12.8]
  - - [1984, 576, 1, 256]
    - [167, 13.73]
  - - [64, 704, 1, 256]
    - [245, 1.01]
  - - [192, 704, 1, 256]
    - [136, 2.73]
  - - [320, 704, 1, 256]
    - [278, 4.45]
  - - [448, 704, 1, 256]
    - [208, 5.91]
  - - [576, 704, 1, 256]
    - [208, 7.0]
  - - [704, 704, 1, 256]
    - [279, 7.93]
  - - [832, 704, 1, 256]
    - [167, 9.31]
  - - [960, 704, 1, 256]
    - [167, 10.25]
  - - [1088, 704, 1, 256]
    - [167, 11.33]
  - - [1216, 704, 1, 256]
    - [167, 11.7]
  - - [1344, 704, 1, 256]
    - [238, 12.35]
  - - [1472, 704, 1, 256]
    - [161, 12.95]
  - - [1600, 704, 1, 256]
    - [167, 13.47]
  - - [1728, 704, 1, 256]
    - [270, 13.03]
  - - [1856, 704, 1, 256]
    - [270, 14.12]
  - - [1984, 704, 1, 256]
    - [210, 14.34]
  - - [192, 832, 1, 256]
    - [191, 3.32]
  - - [448, 832, 1, 256]
    - [191, 7.05]
  - - [704, 832, 1, 256]
    - [167, 9.36]
  - - [960, 832, 1, 256]
    - [167, 11.34]
  - - [1216, 832, 1, 256]
    - [167, 12.96]
  - - [1472, 832, 1, 256]
    - [230, 13.16]
  - - [1728, 832, 1, 256]
    - [173, 15.07]
  - - [1984, 832, 1, 256]
    - [210, 15.47]
  - - [64, 960, 1, 256]
    - [119, 1.41]
  - - [192, 960, 1, 256]
    - [190, 3.79]
  - - [320, 960, 1, 256]
    - [208, 5.89]
  - - [448, 960, 1, 256]
    - [161, 7.56]
  - - [576, 960, 1, 256]
    - [167, 9.26]
  - - [704, 960, 1, 256]
    - [239, 10.17]
  - - [832, 960, 1, 256]
    - [167, 11.17]
  - - [960, 960, 1, 256]
    - [238, 12.46]
  - - [1088, 960, 1, 256]
    - [167, 13.45]
  - - [1216, 960, 1, 256]
    - [167, 14.24]
  - - [1344, 960, 1, 256]
    - [173, 13.7]
  - - [1472, 960, 1, 256]
    - [210, 15.22]
  - - [1600, 960, 1, 256]
    - [173, 15.19]
  - - [1728, 960, 1, 256]
    - [210, 15.86]
  - - [1856, 960, 1, 256]
    - [161, 16.1]
  - - [1984, 960, 1, 256]
    - [210, 16.27]
  - - [192, 1088, 1, 256]
    - [208, 4.3]
  - - [448, 1088, 1, 256]
    - [289, 8.19]
  - - [704, 1088, 1, 256]
    - [167, 11.49]
  - - [960, 1088, 1, 256]
    - [167, 13.64]
  - - [1216, 1088, 1, 256]
    - [210, 14.16]
  - - [1472, 1088, 1, 256]
    - [210, 15.61]
  - - [1728, 1088, 1, 256]
    - [210, 16.74]
  - - [1984, 1088, 1, 256]
    - [210, 17.87]
  - - [64, 1216, 1, 256]
    - [253, 1.75]
  - - [192, 1216, 1, 256]
    - [144, 4.59]
  - - [320, 1216, 1, 256]
    - [193, 7.4]
  - - [448, 1216, 1, 256]
    - [167, 9.03]
  - - [576, 1216, 1, 256]
    - [238, 10.61]
  - - [704, 1216, 1, 256]
    - [167, 12.07]
  - - [832, 1216, 1, 256]
    - [167, 13.01]
  - - [960, 1216, 1, 256]
    - [210, 14.12]
  - - [1088, 1216, 1, 256]
    - [210, 14.29]
  - - [1216, 1216, 1, 256]
    - [210, 16.02]
  - - [1344, 1216, 1, 256]
    - [210, 16.13]
  - - [1472, 1216, 1, 256]
    - [210, 16.21]
  - - [1600, 1216, 1, 256]
    - [210, 17.59]
  - - [1728, 1216, 1, 256]
    - [210, 17.6]
  - - [1856, 1216, 1, 256]
    - [210, 17.68]
  - - [1984, 1216, 1, 256]
    - [210, 18.56]
  - - [192, 1344, 1, 256]
    - [208, 5.29]
  - - [448, 1344, 1, 256]
    - [193, 9.21]
  - - [704, 1344, 1, 256]
    - [238, 12.45]
  - - [960, 1344, 1, 256]
    - [210, 13.63]
  - - [1216, 1344, 1, 256]
    - [210, 15.9]
  - - [1472, 1344, 1, 256]
    - [210, 17.51]
  - - [1728, 1344, 1, 256]
    - [167, 17.71]
  - - [1984, 1344, 1, 256]
    - [238, 18.6]
  - - [64, 1472, 1, 256]
    - [268, 2.01]
  - - [192, 1472, 1, 256]
    - [256, 5.34]
  - - [320, 1472, 1, 256]
    - [280, 7.97]
  - - [448, 1472, 1, 256]
    - [238, 9.77]
  - - [576, 1472, 1, 256]
    - [167, 11.78]
  - - [704, 1472, 1, 256]
    - [167, 13.31]
  - - [832, 1472, 1, 256]
    - [238, 14.17]
  - - [960, 1472, 1, 256]
    - [210, 14.78]
  - - [1088, 1472, 1, 256]
    - [210, 15.49]
  - - [1216, 1472, 1, 256]
    - [167, 16.12]
  - - [1344, 1472, 1, 256]
    - [210, 17.62]
  - - [1472, 1472, 1, 256]
    - [210, 17.81]
  - - [1600, 1472, 1, 256]
    - [161, 17.71]
  - - [1728, 1472, 1, 256]
    - [210, 17.92]
  - - [1856, 1472, 1, 256]
    - [238, 18.82]
  - - [1984, 1472, 1, 256]
    - [210, 19.44]
  - - [192, 1600, 1, 256]
    - [168, 5.79]
  - - [448, 1600, 1, 256]
    - [284, 10.7]
  - - [704, 1600, 1, 256]
    - [280, 12.9]
  - - [960, 1600, 1, 256]
    - [209, 14.7]
  - - [1216, 1600, 1, 256]
    - [210, 17.15]
  - - [1472, 1600, 1, 256]
    - [167, 18.46]
  - - [1728, 1600, 1, 256]
    - [210, 19.3]
  - - [1984, 1600, 1, 256]
    - [210, 19.97]
  - - [64, 1728, 1, 256]
    - [296, 2.34]
  - - [192, 1728, 1, 256]
    - [208, 6.2]
  - - [320, 1728, 1, 256]
    - [167, 8.9]
  - - [448, 1728, 1, 256]
    - [167, 11.39]
  - - [576, 1728, 1, 256]
    - [167, 12.52]
  - - [704, 1728, 1, 256]
    - [284, 13.44]
  - - [832, 1728, 1, 256]
    - [270, 14.28]
  - - [960, 1728, 1, 256]
    - [173, 15.44]
  - - [1088, 1728, 1, 256]
    - [167, 16.4]
  - - [1216, 1728, 1, 256]
    - [167, 17.02]
  - - [1344, 1728, 1, 256]
    - [167, 17.67]
  - - [1472, 1728, 1, 256]
    - [173, 17.89]
  - - [1600, 1728, 1, 256]
    - [210, 18.33]
  - - [1728, 1728, 1, 256]
    - [173, 18.94]
  - - [1856, 1728, 1, 256]
    - [210, 19.28]
  - - [1984, 1728, 1, 256]
    - [238, 19.65]
  - - [192, 1856, 1, 256]
    - [306, 6.52]
  - - [448, 1856, 1, 256]
    - [167, 11.39]
  - - [704, 1856, 1, 256]
    - [210, 13.58]
  - - [960, 1856, 1, 256]
    - [173, 15.87]
  - - [1216, 1856, 1, 256]
    - [210, 18.35]
  - - [1472, 1856, 1, 256]
    - [271, 18.58]
  - - [1728, 1856, 1, 256]
    - [280, 19.52]
  - - [1984, 1856, 1, 256]
    - [210, 20.39]
  - - [64, 1984, 1, 256]
    - [208, 2.7]
  - - [192, 1984, 1, 256]
    - [173, 6.97]
  - - [320, 1984, 1, 256]
    - [208, 9.78]
  - - [448, 1984, 1, 256]
    - [167, 11.94]
  - - [576, 1984, 1, 256]
    - [167, 13.39]
  - - [704, 1984, 1, 256]
    - [210, 14.2]
  - - [832, 1984, 1, 256]
    - [210, 15.64]
  - - [960, 1984, 1, 256]
    - [210, 16.72]
  - - [1088, 1984, 1, 256]
    - [210, 17.45]
  - - [1216, 1984, 1, 256]
    - [284, 17.95]
  - - [1344, 1984, 1, 256]
    - [271, 18.27]
  - - [1472, 1984, 1, 256]
    - [210, 19.22]
  - - [1600, 1984, 1, 256]
    - [210, 20.18]
  - - [1728, 1984, 1, 256]
    - [210, 20.29]
  - - [1856, 1984, 1, 256]
    - [210, 20.87]
  - - [1984, 1984, 1, 256]
    - [210, 21.4]
  - - [192, 64, 1, 512]
    - [273, 0.55]
  - - [448, 64, 1, 512]
    - [286, 1.23]
  - - [704, 64, 1, 512]
    - [254, 1.94]
  - - [960, 64, 1, 512]
    - [254, 2.54]
  - - [1216, 64, 1, 512]
    - [288, 3.05]
  - - [1472, 64, 1, 512]
    - [326, 3.67]
  - - [1728, 64, 1, 512]
    - [256, 4.31]
  - - [1984, 64, 1, 512]
    - [193, 4.99]
  - - [64, 192, 1, 512]
    - [290, 0.55]
  - - [192, 192, 1, 512]
    - [120, 1.57]
  - - [320, 192, 1, 512]
    - [120, 2.48]
  - - [448, 192, 1, 512]
    - [136, 3.37]
  - - [576, 192, 1, 512]
    - [208, 4.25]
  - - [704, 192, 1, 512]
    - [168, 4.95]
  - - [832, 192, 1, 512]
    - [256, 5.86]
  - - [960, 192, 1, 512]
    - [208, 6.63]
  - - [1088, 192, 1, 512]
    - [256, 7.51]
  - - [1216, 192, 1, 512]
    - [168, 8.33]
  - - [1344, 192, 1, 512]
    - [256, 9.14]
  - - [1472, 192, 1, 512]
    - [173, 9.19]
  - - [1600, 192, 1, 512]
    - [208, 9.79]
  - - [1728, 192, 1, 512]
    - [208, 10.61]
  - - [1856, 192, 1, 512]
    - [208, 11.46]
  - - [1984, 192, 1, 512]
    - [208, 11.97]
  - - [192, 320, 1, 512]
    - [119, 2.52]
  - - [448, 320, 1, 512]
    - [168, 5.21]
  - - [704, 320, 1, 512]
    - [208, 8.13]
  - - [960, 320, 1, 512]
    - [191, 9.77]
  - - [1216, 320, 1, 512]
    - [258, 11.81]
  - - [1472, 320, 1, 512]
    - [208, 13.28]
  - - [1728, 320, 1, 512]
    - [256, 13.72]
  - - [1984, 320, 1, 512]
    - [208, 16.04]
  - - [64, 448, 1, 512]
    - [254, 1.24]
  - - [192, 448, 1, 512]
    - [191, 3.38]
  - - [320, 448, 1, 512]
    - [256, 5.18]
  - - [448, 448, 1, 512]
    - [191, 7.12]
  - - [576, 448, 1, 512]
    - [191, 9.2]
  - - [704, 448, 1, 512]
    - [191, 9.97]
  - - [832, 448, 1, 512]
    - [208, 11.82]
  - - [960, 448, 1, 512]
    - [284, 12.25]
  - - [1088, 448, 1, 512]
    - [136, 13.36]
  - - [1216, 448, 1, 512]
    - [275, 13.5]
  - - [1344, 448, 1, 512]
    - [193, 15.06]
  - - [1472, 448, 1, 512]
    - [284, 15.8]
  - - [1600, 448, 1, 512]
    - [202, 15.93]
  - - [1728, 448, 1, 512]
    - [209, 17.56]
  - - [1856, 448, 1, 512]
    - [209, 17.19]
  - - [1984, 448, 1, 512]
    - [209, 17.88]
  - - [192, 576, 1, 512]
    - [208, 4.3]
  - - [448, 576, 1, 512]
    - [256, 9.34]
  - - [704, 576, 1, 512]
    - [193, 11.67]
  - - [960, 576, 1, 512]
    - [167, 14.67]
  - - [1216, 576, 1, 512]
    - [209, 16.02]
  - - [1472, 576, 1, 512]
    - [167, 18.16]
  - - [1728, 576, 1, 512]
    - [167, 19.48]
  - - [1984, 576, 1, 512]
    - [173, 20.01]
  - - [64, 704, 1, 512]
    - [292, 1.89]
  - - [192, 704, 1, 512]
    - [191, 4.92]
  - - [320, 704, 1, 512]
    - [136, 8.07]
  - - [448, 704, 1, 512]
    - [208, 10.27]
  - - [576, 704, 1, 512]
    - [193, 11.61]
  - - [704, 704, 1, 512]
    - [208, 13.89]
  - - [832, 704, 1, 512]
    - [167, 15.13]
  - - [960, 704, 1, 512]
    - [167, 16.08]
  - - [1088, 704, 1, 512]
    - [167, 18.0]
  - - [1216, 704, 1, 512]
    - [167, 18.58]
  - - [1344, 704, 1, 512]
    - [167, 19.09]
  - - [1472, 704, 1, 512]
    - [167, 19.64]
  - - [1600, 704, 1, 512]
    - [270, 20.05]
  - - [1728, 704, 1, 512]
    - [173, 19.94]
  - - [1856, 704, 1, 512]
    - [176, 21.24]
  - - [1984, 704, 1, 512]
    - [173, 21.23]
  - - [192, 832, 1, 512]
    - [208, 5.8]
  - - [448, 832, 1, 512]
    - [208, 11.6]
  - - [704, 832, 1, 512]
    - [161, 15.3]
  - - [960, 832, 1, 512]
    - [167, 17.24]
  - - [1216, 832, 1, 512]
    - [167, 19.44]
  - - [1472, 832, 1, 512]
    - [173, 19.89]
  - - [1728, 832, 1, 512]
    - [173, 22.51]
  - - [1984, 832, 1, 512]
    - [173, 22.97]
  - - [64, 960, 1, 512]
    - [120, 2.54]
  - - [192, 960, 1, 512]
    - [297, 6.59]
  - - [320, 960, 1, 512]
    - [135, 9.8]
  - - [448, 960, 1, 512]
    - [298, 12.45]
  - - [576, 960, 1, 512]
    - [161, 14.66]
  - - [704, 960, 1, 512]
    - [280, 15.7]
  - - [832, 960, 1, 512]
    - [167, 17.5]
  - - [960, 960, 1, 512]
    - [271, 18.25]
  - - [1088, 960, 1, 512]
    - [167, 20.11]
  - - [1216, 960, 1, 512]
    - [167, 19.95]
  - - [1344, 960, 1, 512]
    - [173, 21.02]
  - - [1472, 960, 1, 512]
    - [176, 21.08]
  - - [1600, 960, 1, 512]
    - [209, 22.21]
  - - [1728, 960, 1, 512]
    - [173, 22.65]
  - - [1856, 960, 1, 512]
    - [209, 23.34]
  - - [1984, 960, 1, 512]
    - [173, 23.02]
  - - [192, 1088, 1, 512]
    - [208, 7.5]
  - - [448, 1088, 1, 512]
    - [161, 13.73]
  - - [704, 1088, 1, 512]
    - [167, 18.16]
  - - [960, 1088, 1, 512]
    - [167, 19.86]
  - - [1216, 1088, 1, 512]
    - [173, 20.39]
  - - [1472, 1088, 1, 512]
    - [210, 22.72]
  - - [1728, 1088, 1, 512]
    - [284, 23.85]
  - - [1984, 1088, 1, 512]
    - [284, 24.76]
  - - [64, 1216, 1, 512]
    - [120, 3.13]
  - - [192, 1216, 1, 512]
    - [275, 8.14]
  - - [320, 1216, 1, 512]
    - [208, 12.17]
  - - [448, 1216, 1, 512]
    - [161, 14.66]
  - - [576, 1216, 1, 512]
    - [238, 16.89]
  - - [704, 1216, 1, 512]
    - [238, 18.15]
  - - [832, 1216, 1, 512]
    - [167, 19.96]
  - - [960, 1216, 1, 512]
    - [210, 21.46]
  - - [1088, 1216, 1, 512]
    - [210, 21.4]
  - - [1216, 1216, 1, 512]
    - [210, 24.17]
  - - [1344, 1216, 1, 512]
    - [280, 22.52]
  - - [1472, 1216, 1, 512]
    - [173, 23.26]
  - - [1600, 1216, 1, 512]
    - [210, 25.9]
  - - [1728, 1216, 1, 512]
    - [210, 24.83]
  - - [1856, 1216, 1, 512]
    - [280, 23.89]
  - - [1984, 1216, 1, 512]
    - [280, 25.29]
  - - [192, 1344, 1, 512]
    - [191, 9.18]
  - - [448, 1344, 1, 512]
    - [161, 15.56]
  - - [704, 1344, 1, 512]
    - [280, 18.94]
  - - [960, 1344, 1, 512]
    - [173, 21.37]
  - - [1216, 1344, 1, 512]
    - [210, 23.16]
  - - [1472, 1344, 1, 512]
    - [210, 25.05]
  - - [1728, 1344, 1, 512]
    - [176, 24.29]
  - - [1984, 1344, 1, 512]
    - [173, 24.98]
  - - [64, 1472, 1, 512]
    - [136, 3.68]
  - - [192, 1472, 1, 512]
    - [191, 9.19]
  - - [320, 1472, 1, 512]
    - [289, 12.77]
  - - [448, 1472, 1, 512]
    - [167, 15.47]
  - - [576, 1472, 1, 512]
    - [167, 17.88]
  - - [704, 1472, 1, 512]
    - [173, 19.88]
  - - [832, 1472, 1, 512]
    - [238, 21.64]
  - - [960, 1472, 1, 512]
    - [173, 22.02]
  - - [1088, 1472, 1, 512]
    - [210, 22.39]
  - - [1216, 1472, 1, 512]
    - [173, 23.4]
  - - [1344, 1472, 1, 512]
    - [210, 25.03]
  - - [1472, 1472, 1, 512]
    - [238, 24.85]
  - - [1600, 1472, 1, 512]
    - [209, 24.66]
  - - [1728, 1472, 1, 512]
    - [209, 24.56]
  - - [1856, 1472, 1, 512]
    - [280, 26.06]
  - - [1984, 1472, 1, 512]
    - [238, 25.71]
  - - [192, 1600, 1, 512]
    - [275, 9.59]
  - - [448, 1600, 1, 512]
    - [167, 17.16]
  - - [704, 1600, 1, 512]
    - [270, 20.13]
  - - [960, 1600, 1, 512]
    - [173, 22.77]
  - - [1216, 1600, 1, 512]
    - [173, 23.98]
  - - [1472, 1600, 1, 512]
    - [173, 24.87]
  - - [1728, 1600, 1, 512]
    - [173, 25.5]
  - - [1984, 1600, 1, 512]
    - [280, 26.85]
  - - [64, 1728, 1, 512]
    - [208, 4.33]
  - - [192, 1728, 1, 512]
    - [208, 10.51]
  - - [320, 1728, 1, 512]
    - [208, 14.08]
  - - [448, 1728, 1, 512]
    - [167, 18.11]
  - - [576, 1728, 1, 512]
    - [191, 19.03]
  - - [704, 1728, 1, 512]
    - [173, 20.18]
  - - [832, 1728, 1, 512]
    - [173, 21.81]
  - - [960, 1728, 1, 512]
    - [209, 22.84]
  - - [1088, 1728, 1, 512]
    - [167, 22.52]
  - - [1216, 1728, 1, 512]
    - [173, 24.14]
  - - [1344, 1728, 1, 512]
    - [176, 24.15]
  - - [1472, 1728, 1, 512]
    - [270, 25.29]
  - - [1600, 1728, 1, 512]
    - [209, 24.92]
  - - [1728, 1728, 1, 512]
    - [173, 26.84]
  - - [1856, 1728, 1, 512]
    - [173, 26.66]
  - - [1984, 1728, 1, 512]
    - [173, 26.84]
  - - [192, 1856, 1, 512]
    - [193, 11.38]
  - - [448, 1856, 1, 512]
    - [167, 17.77]
  - - [704, 1856, 1, 512]
    - [270, 21.36]
  - - [960, 1856, 1, 512]
    - [173, 23.69]
  - - [1216, 1856, 1, 512]
    - [280, 25.1]
  - - [1472, 1856, 1, 512]
    - [270, 25.83]
  - - [1728, 1856, 1, 512]
    - [209, 26.36]
  - - [1984, 1856, 1, 512]
    - [209, 26.32]
  - - [64, 1984, 1, 512]
    - [135, 4.93]
  - - [192, 1984, 1, 512]
    - [191, 11.98]
  - - [320, 1984, 1, 512]
    - [256, 15.72]
  - - [448, 1984, 1, 512]
    - [242, 17.98]
  - - [576, 1984, 1, 512]
    - [208, 19.79]
  - - [704, 1984, 1, 512]
    - [270, 21.25]
  - - [832, 1984, 1, 512]
    - [173, 22.97]
  - - [960, 1984, 1, 512]
    - [176, 23.09]
  - - [1088, 1984, 1, 512]
    - [210, 24.15]
  - - [1216, 1984, 1, 512]
    - [176, 24.32]
  - - [1344, 1984, 1, 512]
    - [173, 25.53]
  - - [1472, 1984, 1, 512]
    - [173, 26.13]
  - - [1600, 1984, 1, 512]
    - [209, 25.86]
  - - [1728, 1984, 1, 512]
    - [209, 25.77]
  - - [1856, 1984, 1, 512]
    - [271, 26.99]
  - - [1984, 1984, 1, 512]
    - [173, 27.4]
  - - [192, 64, 1, 1024]
    - [290, 0.99]
  - - [448, 64, 1, 1024]
    - [292, 2.24]
  - - [704, 64, 1, 1024]
    - [251, 3.38]
  - - [960, 64, 1, 1024]
    - [263, 4.48]
  - - [1216, 64, 1, 1024]
    - [252, 5.34]
  - - [1472, 64, 1, 1024]
    - [193, 6.28]
  - - [1728, 64, 1, 1024]
    - [193, 7.34]
  - - [1984, 64, 1, 1024]
    - [193, 8.55]
  - - [64, 192, 1, 1024]
    - [292, 0.99]
  - - [192, 192, 1, 1024]
    - [302, 2.62]
  - - [320, 192, 1, 1024]
    - [136, 4.18]
  - - [448, 192, 1, 1024]
    - [136, 5.73]
  - - [576, 192, 1, 1024]
    - [193, 7.41]
  - - [704, 192, 1, 1024]
    - [193, 8.18]
  - - [832, 192, 1, 1024]
    - [291, 9.35]
  - - [960, 192, 1, 1024]
    - [208, 10.93]
  - - [1088, 192, 1, 1024]
    - [208, 12.36]
  - - [1216, 192, 1, 1024]
    - [208, 13.86]
  - - [1344, 192, 1, 1024]
    - [256, 14.58]
  - - [1472, 192, 1, 1024]
    - [173, 13.76]
  - - [1600, 192, 1, 1024]
    - [208, 14.8]
  - - [1728, 192, 1, 1024]
    - [256, 14.99]
  - - [1856, 192, 1, 1024]
    - [191, 17.53]
  - - [1984, 192, 1, 1024]
    - [208, 18.91]
  - - [192, 320, 1, 1024]
    - [254, 4.17]
  - - [448, 320, 1, 1024]
    - [208, 8.78]
  - - [704, 320, 1, 1024]
    - [168, 13.15]
  - - [960, 320, 1, 1024]
    - [191, 15.41]
  - - [1216, 320, 1, 1024]
    - [193, 19.23]
  - - [1472, 320, 1, 1024]
    - [208, 19.9]
  - - [1728, 320, 1, 1024]
    - [208, 20.05]
  - - [1984, 320, 1, 1024]
    - [208, 23.22]
  - - [64, 448, 1, 1024]
    - [290, 2.17]
  - - [192, 448, 1, 1024]
    - [193, 5.59]
  - - [320, 448, 1, 1024]
    - [191, 7.96]
  - - [448, 448, 1, 1024]
    - [208, 8.29]
  - - [576, 448, 1, 1024]
    - [208, 14.14]
  - - [704, 448, 1, 1024]
    - [191, 11.99]
  - - [832, 448, 1, 1024]
    - [191, 17.71]
  - - [960, 448, 1, 1024]
    - [271, 18.04]
  - - [1088, 448, 1, 1024]
    - [173, 16.76]
  - - [1216, 448, 1, 1024]
    - [161, 16.63]
  - - [1344, 448, 1, 1024]
    - [173, 19.06]
  - - [1472, 448, 1, 1024]
    - [238, 21.94]
  - - [1600, 448, 1, 1024]
    - [295, 18.71]
  - - [1728, 448, 1, 1024]
    - [209, 22.93]
  - - [1856, 448, 1, 1024]
    - [202, 21.72]
  - - [1984, 448, 1, 1024]
    - [168, 21.36]
  - - [192, 576, 1, 1024]
    - [168, 5.64]
  - - [448, 576, 1, 1024]
    - [136, 13.3]
  - - [704, 576, 1, 1024]
    - [193, 15.89]
  - - [960, 576, 1, 1024]
    - [161, 0.66]
  - - [1216, 576, 1, 1024]
    - [167, 19.5]
  - - [1472, 576, 1, 1024]
    - [167, 23.52]
  - - [1728, 576, 1, 1024]
    - [208, 21.66]
  - - [1984, 576, 1, 1024]
    - [256, 22.66]
  - - [64, 704, 1, 1024]
    - [273, 2.15]
  - - [192, 704, 1, 1024]
    - [191, 7.79]
  - - [320, 704, 1, 1024]
    - [208, 9.82]
  - - [448, 704, 1, 1024]
    - [191, 13.11]
  - - [576, 704, 1, 1024]
    - [161, 15.66]
  - - [704, 704, 1, 1024]
    - [161, 17.58]
  - - [832, 704, 1, 1024]
    - [161, 18.07]
  - - [960, 704, 1, 1024]
    - [161, 21.97]
  - - [1088, 704, 1, 1024]
    - [167, 23.83]
  - - [1216, 704, 1, 1024]
    - [167, 22.54]
  - - [1344, 704, 1, 1024]
    - [208, 23.06]
  - - [1472, 704, 1, 1024]
    - [208, 25.41]
  - - [1600, 704, 1, 1024]
    - [136, 24.45]
  - - [1728, 704, 1, 1024]
    - [208, 24.55]
  - - [1856, 704, 1, 1024]
    - [173, 27.09]
  - - [1984, 704, 1, 1024]
    - [193, 26.9]
  - - [192, 832, 1, 1024]
    - [208, 7.26]
  - - [448, 832, 1, 1024]
    - [193, 17.55]
  - - [704, 832, 1, 1024]
    - [161, 20.31]
  - - [960, 832, 1, 1024]
    - [167, 20.61]
  - - [1216, 832, 1, 1024]
    - [208, 23.36]
  - - [1472, 832, 1, 1024]
    - [270, 26.25]
  - - [1728, 832, 1, 1024]
    - [173, 28.37]
  - - [1984, 832, 1, 1024]
    - [208, 28.56]
  - - [64, 960, 1, 1024]
    - [120, 0.07]
  - - [192, 960, 1, 1024]
    - [256, 8.59]
  - - [320, 960, 1, 1024]
    - [135, 0.33]
  - - [448, 960, 1, 1024]
    - [238, 17.13]
  - - [576, 960, 1, 1024]
    - [161, 17.64]
  - - [704, 960, 1, 1024]
    - [284, 0.84]
  - - [832, 960, 1, 1024]
    - [167, 23.56]
  - - [960, 960, 1, 1024]
    - [280, 22.23]
  - - [1088, 960, 1, 1024]
    - [208, 26.7]
  - - [1216, 960, 1, 1024]
    - [173, 26.39]
  - - [1344, 960, 1, 1024]
    - [270, 26.11]
  - - [1472, 960, 1, 1024]
    - [173, 27.71]
  - - [1600, 960, 1, 1024]
    - [209, 26.65]
  - - [1728, 960, 1, 1024]
    - [270, 29.06]
  - - [1856, 960, 1, 1024]
    - [208, 29.47]
  - - [1984, 960, 1, 1024]
    - [208, 27.56]
  - - [192, 1088, 1, 1024]
    - [191, 9.75]
  - - [448, 1088, 1, 1024]
    - [161, 18.04]
  - - [704, 1088, 1, 1024]
    - [161, 20.71]
  - - [960, 1088, 1, 1024]
    - [270, 1.3]
  - - [1216, 1088, 1, 1024]
    - [208, 28.82]
  - - [1472, 1088, 1, 1024]
    - [173, 30.7]
  - - [1728, 1088, 1, 1024]
    - [173, 32.1]
  - - [1984, 1088, 1, 1024]
    - [173, 33.65]
  - - [64, 1216, 1, 1024]
    - [193, 4.83]
  - - [192, 1216, 1, 1024]
    - [193, 12.77]
  - - [320, 1216, 1, 1024]
    - [191, 13.94]
  - - [448, 1216, 1, 1024]
    - [161, 20.78]
  - - [576, 1216, 1, 1024]
    - [284, 22.95]
  - - [704, 1216, 1, 1024]
    - [238, 24.42]
  - - [832, 1216, 1, 1024]
    - [167, 25.68]
  - - [960, 1216, 1, 1024]
    - [173, 24.9]
  - - [1088, 1216, 1, 1024]
    - [210, 29.08]
  - - [1216, 1216, 1, 1024]
    - [210, 32.11]
  - - [1344, 1216, 1, 1024]
    - [210, 32.23]
  - - [1472, 1216, 1, 1024]
    - [208, 32.35]
  - - [1600, 1216, 1, 1024]
    - [284, 34.18]
  - - [1728, 1216, 1, 1024]
    - [238, 33.85]
  - - [1856, 1216, 1, 1024]
    - [173, 33.85]
  - - [1984, 1216, 1, 1024]
    - [280, 35.48]
  - - [192, 1344, 1, 1024]
    - [208, 14.04]
  - - [448, 1344, 1, 1024]
    - [161, 0.7]
  - - [704, 1344, 1, 1024]
    - [238, 25.26]
  - - [960, 1344, 1, 1024]
    - [208, 27.18]
  - - [1216, 1344, 1, 1024]
    - [193, 31.49]
  - - [1472, 1344, 1, 1024]
    - [238, 33.76]
  - - [1728, 1344, 1, 1024]
    - [173, 34.26]
  - - [1984, 1344, 1, 1024]
    - [173, 34.92]
  - - [64, 1472, 1, 1024]
    - [136, 4.86]
  - - [192, 1472, 1, 1024]
    - [208, 10.64]
  - - [320, 1472, 1, 1024]
    - [161, 17.1]
  - - [448, 1472, 1, 1024]
    - [167, 18.3]
  - - [576, 1472, 1, 1024]
    - [208, 20.92]
  - - [704, 1472, 1, 1024]
    - [191, 1.17]
  - - [832, 1472, 1, 1024]
    - [280, 1.27]
  - - [960, 1472, 1, 1024]
    - [208, 27.93]
  - - [1088, 1472, 1, 1024]
    - [209, 30.96]
  - - [1216, 1472, 1, 1024]
    - [173, 32.85]
  - - [1344, 1472, 1, 1024]
    - [280, 33.33]
  - - [1472, 1472, 1, 1024]
    - [270, 33.29]
  - - [1600, 1472, 1, 1024]
    - [173, 34.6]
  - - [1728, 1472, 1, 1024]
    - [270, 34.66]
  - - [1856, 1472, 1, 1024]
    - [209, 35.34]
  - - [1984, 1472, 1, 1024]
    - [173, 35.4]
  - - [192, 1600, 1, 1024]
    - [136, 15.34]
  - - [448, 1600, 1, 1024]
    - [167, 24.18]
  - - [704, 1600, 1, 1024]
    - [275, 28.22]
  - - [960, 1600, 1, 1024]
    - [191, 30.89]
  - - [1216, 1600, 1, 1024]
    - [209, 33.35]
  - - [1472, 1600, 1, 1024]
    - [173, 34.37]
  - - [1728, 1600, 1, 1024]
    - [173, 34.43]
  - - [1984, 1600, 1, 1024]
    - [270, 35.45]
  - - [64, 1728, 1, 1024]
    - [136, 7.71]
  - - [192, 1728, 1, 1024]
    - [173, 16.83]
  - - [320, 1728, 1, 1024]
    - [202, 21.03]
  - - [448, 1728, 1, 1024]
    - [167, 25.47]
  - - [576, 1728, 1, 1024]
    - [193, 27.55]
  - - [704, 1728, 1, 1024]
    - [176, 28.11]
  - - [832, 1728, 1, 1024]
    - [208, 30.79]
  - - [960, 1728, 1, 1024]
    - [208, 31.78]
  - - [1088, 1728, 1, 1024]
    - [193, 32.22]
  - - [1216, 1728, 1, 1024]
    - [209, 32.49]
  - - [1344, 1728, 1, 1024]
    - [173, 34.19]
  - - [1472, 1728, 1, 1024]
    - [173, 34.5]
  - - [1600, 1728, 1, 1024]
    - [270, 34.82]
  - - [1728, 1728, 1, 1024]
    - [173, 36.0]
  - - [1856, 1728, 1, 1024]
    - [209, 35.84]
  - - [1984, 1728, 1, 1024]
    - [209, 35.91]
  - - [192, 1856, 1, 1024]
    - [270, 17.76]
  - - [448, 1856, 1, 1024]
    - [208, 25.08]
  - - [704, 1856, 1, 1024]
    - [193, 29.9]
  - - [960, 1856, 1, 1024]
    - [191, 32.1]
  - - [1216, 1856, 1, 1024]
    - [173, 33.36]
  - - [1472, 1856, 1, 1024]
    - [173, 35.12]
  - - [1728, 1856, 1, 1024]
    - [173, 36.37]
  - - [1984, 1856, 1, 1024]
    - [209, 36.27]
  - - [64, 1984, 1, 1024]
    - [136, 8.64]
  - - [192, 1984, 1, 1024]
    - [191, 18.78]
  - - [320, 1984, 1, 1024]
    - [256, 23.34]
  - - [448, 1984, 1, 1024]
    - [209, 26.3]
  - - [576, 1984, 1, 1024]
    - [208, 28.82]
  - - [704, 1984, 1, 1024]
    - [208, 30.5]
  - - [832, 1984, 1, 1024]
    - [173, 31.99]
  - - [960, 1984, 1, 1024]
    - [173, 32.61]
  - - [1088, 1984, 1, 1024]
    - [173, 33.51]
  - - [1216, 1984, 1, 1024]
    - [173, 34.58]
  - - [1344, 1984, 1, 1024]
    - [173, 34.7]
  - - [1472, 1984, 1, 1024]
    - [209, 34.96]
  - - [1600, 1984, 1, 1024]
    - [173, 35.86]
  - - [1728, 1984, 1, 1024]
    - [173, 35.96]
  - - [1856, 1984, 1, 1024]
    - [173, 36.31]
  - - [1984, 1984, 1, 1024]
    - [173, 36.48]
  - - [192, 64, 1, 2048]
    - [254, 1.64]
  - - [448, 64, 1, 2048]
    - [273, 3.67]
  - - [704, 64, 1, 2048]
    - [263, 5.54]
  - - [960, 64, 1, 2048]
    - [251, 7.23]
  - - [1216, 64, 1, 2048]
    - [246, 8.43]
  - - [1472, 64, 1, 2048]
    - [193, 9.94]
  - - [1728, 64, 1, 2048]
    - [193, 11.42]
  - - [1984, 64, 1, 2048]
    - [136, 12.54]
  - - [64, 192, 1, 2048]
    - [290, 1.63]
  - - [192, 192, 1, 2048]
    - [253, 4.42]
  - - [320, 192, 1, 2048]
    - [136, 6.45]
  - - [448, 192, 1, 2048]
    - [193, 9.02]
  - - [576, 192, 1, 2048]
    - [136, 11.58]
  - - [704, 192, 1, 2048]
    - [193, 12.43]
  - - [832, 192, 1, 2048]
    - [303, 14.38]
  - - [960, 192, 1, 2048]
    - [135, 16.55]
  - - [1088, 192, 1, 2048]
    - [168, 18.57]
  - - [1216, 192, 1, 2048]
    - [256, 20.58]
  - - [1344, 192, 1, 2048]
    - [191, 22.49]
  - - [1472, 192, 1, 2048]
    - [191, 20.47]
  - - [1600, 192, 1, 2048]
    - [135, 21.82]
  - - [1728, 192, 1, 2048]
    - [168, 23.65]
  - - [1856, 192, 1, 2048]
    - [208, 25.36]
  - - [1984, 192, 1, 2048]
    - [193, 26.88]
  - - [192, 320, 1, 2048]
    - [252, 6.58]
  - - [448, 320, 1, 2048]
    - [256, 13.01]
  - - [704, 320, 1, 2048]
    - [191, 19.95]
  - - [960, 320, 1, 2048]
    - [191, 21.84]
  - - [1216, 320, 1, 2048]
    - [191, 27.96]
  - - [1472, 320, 1, 2048]
    - [193, 27.31]
  - - [1728, 320, 1, 2048]
    - [161, 27.71]
  - - [1984, 320, 1, 2048]
    - [191, 31.26]
  - - [64, 448, 1, 2048]
    - [273, 3.74]
  - - [192, 448, 1, 2048]
    - [136, 8.99]
  - - [320, 448, 1, 2048]
    - [208, 13.16]
  - - [448, 448, 1, 2048]
    - [136, 17.92]
  - - [576, 448, 1, 2048]
    - [191, 22.53]
  - - [704, 448, 1, 2048]
    - [208, 22.43]
  - - [832, 448, 1, 2048]
    - [289, 26.17]
  - - [960, 448, 1, 2048]
    - [280, 25.43]
  - - [1088, 448, 1, 2048]
    - [191, 28.73]
  - - [1216, 448, 1, 2048]
    - [305, 27.57]
  - - [1344, 448, 1, 2048]
    - [193, 29.95]
  - - [1472, 448, 1, 2048]
    - [280, 29.97]
  - - [1600, 448, 1, 2048]
    - [173, 30.48]
  - - [1728, 448, 1, 2048]
    - [256, 32.8]
  - - [1856, 448, 1, 2048]
    - [256, 32.05]
  - - [1984, 448, 1, 2048]
    - [136, 33.96]
  - - [192, 576, 1, 2048]
    - [193, 11.46]
  - - [448, 576, 1, 2048]
    - [136, 22.54]
  - - [704, 576, 1, 2048]
    - [191, 23.91]
  - - [960, 576, 1, 2048]
    - [208, 28.06]
  - - [1216, 576, 1, 2048]
    - [161, 32.52]
  - - [1472, 576, 1, 2048]
    - [167, 33.35]
  - - [1728, 576, 1, 2048]
    - [193, 34.91]
  - - [1984, 576, 1, 2048]
    - [208, 36.0]
  - - [64, 704, 1, 2048]
    - [273, 5.32]
  - - [192, 704, 1, 2048]
    - [256, 12.39]
  - - [320, 704, 1, 2048]
    - [191, 20.09]
  - - [448, 704, 1, 2048]
    - [208, 22.45]
  - - [576, 704, 1, 2048]
    - [161, 24.62]
  - - [704, 704, 1, 2048]
    - [191, 29.07]
  - - [832, 704, 1, 2048]
    - [161, 29.65]
  - - [960, 704, 1, 2048]
    - [167, 30.77]
  - - [1088, 704, 1, 2048]
    - [167, 34.09]
  - - [1216, 704, 1, 2048]
    - [167, 34.47]
  - - [1344, 704, 1, 2048]
    - [208, 33.6]
  - - [1472, 704, 1, 2048]
    - [208, 36.36]
  - - [1600, 704, 1, 2048]
    - [193, 35.78]
  - - [1728, 704, 1, 2048]
    - [208, 35.55]
  - - [1856, 704, 1, 2048]
    - [208, 37.19]
  - - [1984, 704, 1, 2048]
    - [208, 37.48]
  - - [192, 832, 1, 2048]
    - [208, 14.56]
  - - [448, 832, 1, 2048]
    - [193, 25.89]
  - - [704, 832, 1, 2048]
    - [208, 29.37]
  - - [960, 832, 1, 2048]
    - [167, 32.06]
  - - [1216, 832, 1, 2048]
    - [135, 35.32]
  - - [1472, 832, 1, 2048]
    - [208, 35.69]
  - - [1728, 832, 1, 2048]
    - [193, 37.78]
  - - [1984, 832, 1, 2048]
    - [208, 38.5]
  - - [64, 960, 1, 2048]
    - [253, 7.06]
  - - [192, 960, 1, 2048]
    - [191, 16.75]
  - - [320, 960, 1, 2048]
    - [208, 21.91]
  - - [448, 960, 1, 2048]
    - [208, 25.4]
  - - [576, 960, 1, 2048]
    - [161, 30.23]
  - - [704, 960, 1, 2048]
    - [161, 30.44]
  - - [832, 960, 1, 2048]
    - [167, 31.87]
  - - [960, 960, 1, 2048]
    - [238, 32.95]
  - - [1088, 960, 1, 2048]
    - [208, 36.25]
  - - [1216, 960, 1, 2048]
    - [208, 36.85]
  - - [1344, 960, 1, 2048]
    - [193, 37.59]
  - - [1472, 960, 1, 2048]
    - [193, 37.42]
  - - [1600, 960, 1, 2048]
    - [208, 38.11]
  - - [1728, 960, 1, 2048]
    - [275, 38.83]
  - - [1856, 960, 1, 2048]
    - [208, 39.49]
  - - [1984, 960, 1, 2048]
    - [208, 39.49]
  - - [192, 1088, 1, 2048]
    - [275, 19.06]
  - - [448, 1088, 1, 2048]
    - [161, 28.92]
  - - [704, 1088, 1, 2048]
    - [161, 34.23]
  - - [960, 1088, 1, 2048]
    - [208, 35.97]
  - - [1216, 1088, 1, 2048]
    - [275, 36.31]
  - - [1472, 1088, 1, 2048]
    - [208, 37.94]
  - - [1728, 1088, 1, 2048]
    - [193, 39.08]
  - - [1984, 1088, 1, 2048]
    - [193, 39.83]
  - - [64, 1216, 1, 2048]
    - [297, 8.21]
  - - [192, 1216, 1, 2048]
    - [208, 20.52]
  - - [320, 1216, 1, 2048]
    - [191, 26.9]
  - - [448, 1216, 1, 2048]
    - [161, 29.32]
  - - [576, 1216, 1, 2048]
    - [238, 33.99]
  - - [704, 1216, 1, 2048]
    - [167, 33.87]
  - - [832, 1216, 1, 2048]
    - [208, 35.61]
  - - [960, 1216, 1, 2048]
    - [193, 36.86]
  - - [1088, 1216, 1, 2048]
    - [193, 36.09]
  - - [1216, 1216, 1, 2048]
    - [210, 39.59]
  - - [1344, 1216, 1, 2048]
    - [210, 38.73]
  - - [1472, 1216, 1, 2048]
    - [291, 38.88]
  - - [1600, 1216, 1, 2048]
    - [271, 40.86]
  - - [1728, 1216, 1, 2048]
    - [280, 40.16]
  - - [1856, 1216, 1, 2048]
    - [208, 39.96]
  - - [1984, 1216, 1, 2048]
    - [280, 41.42]
  - - [192, 1344, 1, 2048]
    - [191, 22.53]
  - - [448, 1344, 1, 2048]
    - [161, 31.6]
  - - [704, 1344, 1, 2048]
    - [238, 34.8]
  - - [960, 1344, 1, 2048]
    - [208, 37.55]
  - - [1216, 1344, 1, 2048]
    - [208, 38.18]
  - - [1472, 1344, 1, 2048]
    - [280, 40.18]
  - - [1728, 1344, 1, 2048]
    - [270, 40.38]
  - - [1984, 1344, 1, 2048]
    - [191, 40.55]
  - - [64, 1472, 1, 2048]
    - [136, 9.85]
  - - [192, 1472, 1, 2048]
    - [191, 20.33]
  - - [320, 1472, 1, 2048]
    - [161, 27.84]
  - - [448, 1472, 1, 2048]
    - [161, 30.67]
  - - [576, 1472, 1, 2048]
    - [208, 33.49]
  - - [704, 1472, 1, 2048]
    - [191, 35.83]
  - - [832, 1472, 1, 2048]
    - [280, 36.41]
  - - [960, 1472, 1, 2048]
    - [208, 37.36]
  - - [1088, 1472, 1, 2048]
    - [208, 37.99]
  - - [1216, 1472, 1, 2048]
    - [208, 39.25]
  - - [1344, 1472, 1, 2048]
    - [284, 39.17]
  - - [1472, 1472, 1, 2048]
    - [208, 40.15]
  - - [1600, 1472, 1, 2048]
    - [208, 40.65]
  - - [1728, 1472, 1, 2048]
    - [208, 40.86]
  - - [1856, 1472, 1, 2048]
    - [208, 41.52]
  - - [1984, 1472, 1, 2048]
    - [208, 41.28]
  - - [192, 1600, 1, 2048]
    - [173, 21.71]
  - - [448, 1600, 1, 2048]
    - [167, 32.01]
  - - [704, 1600, 1, 2048]
    - [193, 35.88]
  - - [960, 1600, 1, 2048]
    - [193, 38.24]
  - - [1216, 1600, 1, 2048]
    - [193, 39.8]
  - - [1472, 1600, 1, 2048]
    - [193, 40.42]
  - - [1728, 1600, 1, 2048]
    - [208, 40.94]
  - - [1984, 1600, 1, 2048]
    - [208, 41.41]
  - - [64, 1728, 1, 2048]
    - [136, 11.51]
  - - [192, 1728, 1, 2048]
    - [191, 23.63]
  - - [320, 1728, 1, 2048]
    - [161, 27.87]
  - - [448, 1728, 1, 2048]
    - [193, 32.99]
  - - [576, 1728, 1, 2048]
    - [208, 35.23]
  - - [704, 1728, 1, 2048]
    - [208, 35.63]
  - - [832, 1728, 1, 2048]
    - [306, 37.58]
  - - [960, 1728, 1, 2048]
    - [191, 38.71]
  - - [1088, 1728, 1, 2048]
    - [208, 39.1]
  - - [1216, 1728, 1, 2048]
    - [208, 39.46]
  - - [1344, 1728, 1, 2048]
    - [173, 40.77]
  - - [1472, 1728, 1, 2048]
    - [208, 40.89]
  - - [1600, 1728, 1, 2048]
    - [208, 40.95]
  - - [1728, 1728, 1, 2048]
    - [289, 41.21]
  - - [1856, 1728, 1, 2048]
    - [208, 41.59]
  - - [1984, 1728, 1, 2048]
    - [282, 41.95]
  - - [192, 1856, 1, 2048]
    - [135, 25.28]
  - - [448, 1856, 1, 2048]
    - [191, 32.3]
  - - [704, 1856, 1, 2048]
    - [208, 37.69]
  - - [960, 1856, 1, 2048]
    - [193, 39.23]
  - - [1216, 1856, 1, 2048]
    - [193, 39.73]
  - - [1472, 1856, 1, 2048]
    - [306, 40.96]
  - - [1728, 1856, 1, 2048]
    - [191, 41.57]
  - - [1984, 1856, 1, 2048]
    - [193, 41.83]
  - - [64, 1984, 1, 2048]
    - [275, 12.81]
  - - [192, 1984, 1, 2048]
    - [208, 26.94]
  - - [320, 1984, 1, 2048]
    - [193, 31.07]
  - - [448, 1984, 1, 2048]
    - [208, 34.31]
  - - [576, 1984, 1, 2048]
    - [208, 36.82]
  - - [704, 1984, 1, 2048]
    - [208, 37.58]
  - - [832, 1984, 1, 2048]
    - [208, 38.7]
  - - [960, 1984, 1, 2048]
    - [208, 39.63]
  - - [1088, 1984, 1, 2048]
    - [208, 40.3]
  - - [1216, 1984, 1, 2048]
    - [193, 40.43]
  - - [1344, 1984, 1, 2048]
    - [193, 41.02]
  - - [1472, 1984, 1, 2048]
    - [193, 41.37]
  - - [1600, 1984, 1, 2048]
    - [173, 41.59]
  - - [1728, 1984, 1, 2048]
    - [282, 41.68]
  - - [1856, 1984, 1, 2048]
    - [193, 41.77]
  - - [1984, 1984, 1, 2048]
    - [281, 42.27]
  - - [192, 64, 1, 4096]
    - [290, 2.47]
  - - [448, 64, 1, 4096]
    - [254, 5.62]
  - - [704, 64, 1, 4096]
    - [254, 8.11]
  - - [960, 64, 1, 4096]
    - [263, 10.53]
  - - [1216, 64, 1, 4096]
    - [246, 11.89]
  - - [1472, 64, 1, 4096]
    - [313, 13.71]
  - - [1728, 64, 1, 4096]
    - [193, 15.33]
  - - [1984, 64, 1, 4096]
    - [193, 17.85]
  - - [64, 192, 1, 4096]
    - [273, 2.54]
  - - [192, 192, 1, 4096]
    - [308, 6.46]
  - - [320, 192, 1, 4096]
    - [136, 9.29]
  - - [448, 192, 1, 4096]
    - [193, 12.77]
  - - [576, 192, 1, 4096]
    - [136, 16.47]
  - - [704, 192, 1, 4096]
    - [193, 16.71]
  - - [832, 192, 1, 4096]
    - [136, 19.26]
  - - [960, 192, 1, 4096]
    - [256, 22.13]
  - - [1088, 192, 1, 4096]
    - [193, 25.08]
  - - [1216, 192, 1, 4096]
    - [291, 27.79]
  - - [1344, 192, 1, 4096]
    - [136, 30.53]
  - - [1472, 192, 1, 4096]
    - [135, 26.36]
  - - [1600, 192, 1, 4096]
    - [275, 28.07]
  - - [1728, 192, 1, 4096]
    - [208, 30.4]
  - - [1856, 192, 1, 4096]
    - [208, 32.37]
  - - [1984, 192, 1, 4096]
    - [193, 34.01]
  - - [192, 320, 1, 4096]
    - [136, 9.18]
  - - [448, 320, 1, 4096]
    - [136, 17.69]
  - - [704, 320, 1, 4096]
    - [291, 26.6]
  - - [960, 320, 1, 4096]
    - [193, 28.59]
  - - [1216, 320, 1, 4096]
    - [193, 34.67]
  - - [1472, 320, 1, 4096]
    - [193, 33.75]
  - - [1728, 320, 1, 4096]
    - [193, 33.32]
  - - [1984, 320, 1, 4096]
    - [275, 37.18]
  - - [64, 448, 1, 4096]
    - [273, 5.76]
  - - [192, 448, 1, 4096]
    - [136, 12.5]
  - - [320, 448, 1, 4096]
    - [193, 17.29]
  - - [448, 448, 1, 4096]
    - [193, 23.98]
  - - [576, 448, 1, 4096]
    - [193, 30.43]
  - - [704, 448, 1, 4096]
    - [297, 28.97]
  - - [832, 448, 1, 4096]
    - [208, 33.41]
  - - [960, 448, 1, 4096]
    - [193, 30.92]
  - - [1088, 448, 1, 4096]
    - [291, 34.6]
  - - [1216, 448, 1, 4096]
    - [161, 33.28]
  - - [1344, 448, 1, 4096]
    - [193, 35.82]
  - - [1472, 448, 1, 4096]
    - [238, 35.78]
  - - [1600, 448, 1, 4096]
    - [314, 36.58]
  - - [1728, 448, 1, 4096]
    - [173, 38.0]
  - - [1856, 448, 1, 4096]
    - [191, 37.96]
  - - [1984, 448, 1, 4096]
    - [136, 39.44]
  - - [192, 576, 1, 4096]
    - [136, 16.65]
  - - [448, 576, 1, 4096]
    - [193, 30.26]
  - - [704, 576, 1, 4096]
    - [193, 29.75]
  - - [960, 576, 1, 4096]
    - [161, 33.83]
  - - [1216, 576, 1, 4096]
    - [328, 37.9]
  - - [1472, 576, 1, 4096]
    - [161, 38.59]
  - - [1728, 576, 1, 4096]
    - [193, 40.12]
  - - [1984, 576, 1, 4096]
    - [291, 41.29]
  - - [64, 704, 1, 4096]
    - [273, 7.55]
  - - [192, 704, 1, 4096]
    - [193, 16.53]
  - - [320, 704, 1, 4096]
    - [193, 26.7]
  - - [448, 704, 1, 4096]
    - [193, 29.18]
  - - [576, 704, 1, 4096]
    - [193, 30.05]
  - - [704, 704, 1, 4096]
    - [193, 35.79]
  - - [832, 704, 1, 4096]
    - [161, 35.55]
  - - [960, 704, 1, 4096]
    - [161, 36.19]
  - - [1088, 704, 1, 4096]
    - [161, 40.91]
  - - [1216, 704, 1, 4096]
    - [167, 40.19]
  - - [1344, 704, 1, 4096]
    - [167, 39.4]
  - - [1472, 704, 1, 4096]
    - [291, 40.93]
  - - [1600, 704, 1, 4096]
    - [193, 41.41]
  - - [1728, 704, 1, 4096]
    - [291, 40.51]
  - - [1856, 704, 1, 4096]
    - [191, 42.38]
  - - [1984, 704, 1, 4096]
    - [291, 42.0]
  - - [192, 832, 1, 4096]
    - [291, 19.32]
  - - [448, 832, 1, 4096]
    - [258, 33.59]
  - - [704, 832, 1, 4096]
    - [193, 35.1]
  - - [960, 832, 1, 4096]
    - [191, 36.92]
  - - [1216, 832, 1, 4096]
    - [193, 40.89]
  - - [1472, 832, 1, 4096]
    - [193, 41.04]
  - - [1728, 832, 1, 4096]
    - [256, 42.26]
  - - [1984, 832, 1, 4096]
    - [191, 42.89]
  - - [64, 960, 1, 4096]
    - [287, 9.1]
  - - [192, 960, 1, 4096]
    - [193, 22.05]
  - - [320, 960, 1, 4096]
    - [135, 28.19]
  - - [448, 960, 1, 4096]
    - [208, 31.0]
  - - [576, 960, 1, 4096]
    - [161, 35.78]
  - - [704, 960, 1, 4096]
    - [280, 35.65]
  - - [832, 960, 1, 4096]
    - [167, 37.3]
  - - [960, 960, 1, 4096]
    - [315, 38.32]
  - - [1088, 960, 1, 4096]
    - [256, 40.91]
  - - [1216, 960, 1, 4096]
    - [208, 41.74]
  - - [1344, 960, 1, 4096]
    - [289, 41.56]
  - - [1472, 960, 1, 4096]
    - [168, 41.58]
  - - [1600, 960, 1, 4096]
    - [208, 42.76]
  - - [1728, 960, 1, 4096]
    - [289, 42.81]
  - - [1856, 960, 1, 4096]
    - [208, 43.46]
  - - [1984, 960, 1, 4096]
    - [191, 42.89]
  - - [192, 1088, 1, 4096]
    - [193, 24.9]
  - - [448, 1088, 1, 4096]
    - [193, 34.98]
  - - [704, 1088, 1, 4096]
    - [161, 40.24]
  - - [960, 1088, 1, 4096]
    - [291, 41.28]
  - - [1216, 1088, 1, 4096]
    - [208, 40.73]
  - - [1472, 1088, 1, 4096]
    - [193, 42.41]
  - - [1728, 1088, 1, 4096]
    - [193, 43.19]
  - - [1984, 1088, 1, 4096]
    - [193, 44.11]
  - - [64, 1216, 1, 4096]
    - [136, 11.34]
  - - [192, 1216, 1, 4096]
    - [193, 27.76]
  - - [320, 1216, 1, 4096]
    - [193, 34.72]
  - - [448, 1216, 1, 4096]
    - [307, 34.98]
  - - [576, 1216, 1, 4096]
    - [238, 39.59]
  - - [704, 1216, 1, 4096]
    - [167, 38.88]
  - - [832, 1216, 1, 4096]
    - [193, 41.1]
  - - [960, 1216, 1, 4096]
    - [289, 41.74]
  - - [1088, 1216, 1, 4096]
    - [210, 41.08]
  - - [1216, 1216, 1, 4096]
    - [210, 44.88]
  - - [1344, 1216, 1, 4096]
    - [193, 43.06]
  - - [1472, 1216, 1, 4096]
    - [209, 42.68]
  - - [1600, 1216, 1, 4096]
    - [280, 45.1]
  - - [1728, 1216, 1, 4096]
    - [238, 44.57]
  - - [1856, 1216, 1, 4096]
    - [193, 43.92]
  - - [1984, 1216, 1, 4096]
    - [284, 45.39]
  - - [192, 1344, 1, 4096]
    - [291, 30.44]
  - - [448, 1344, 1, 4096]
    - [161, 37.83]
  - - [704, 1344, 1, 4096]
    - [271, 39.92]
  - - [960, 1344, 1, 4096]
    - [193, 42.26]
  - - [1216, 1344, 1, 4096]
    - [291, 42.86]
  - - [1472, 1344, 1, 4096]
    - [280, 43.81]
  - - [1728, 1344, 1, 4096]
    - [193, 44.27]
  - - [1984, 1344, 1, 4096]
    - [275, 44.32]
  - - [64, 1472, 1, 4096]
    - [136, 13.66]
  - - [192, 1472, 1, 4096]
    - [208, 25.7]
  - - [320, 1472, 1, 4096]
    - [208, 33.82]
  - - [448, 1472, 1, 4096]
    - [307, 36.34]
  - - [576, 1472, 1, 4096]
    - [193, 38.71]
  - - [704, 1472, 1, 4096]
    - [291, 40.65]
  - - [832, 1472, 1, 4096]
    - [280, 41.27]
  - - [960, 1472, 1, 4096]
    - [136, 41.93]
  - - [1088, 1472, 1, 4096]
    - [193, 42.22]
  - - [1216, 1472, 1, 4096]
    - [209, 42.5]
  - - [1344, 1472, 1, 4096]
    - [191, 42.71]
  - - [1472, 1472, 1, 4096]
    - [193, 43.58]
  - - [1600, 1472, 1, 4096]
    - [291, 44.03]
  - - [1728, 1472, 1, 4096]
    - [208, 43.72]
  - - [1856, 1472, 1, 4096]
    - [289, 43.92]
  - - [1984, 1472, 1, 4096]
    - [282, 44.7]
  - - [192, 1600, 1, 4096]
    - [191, 28.25]
  - - [448, 1600, 1, 4096]
    - [167, 37.71]
  - - [704, 1600, 1, 4096]
    - [193, 41.2]
  - - [960, 1600, 1, 4096]
    - [193, 42.93]
  - - [1216, 1600, 1, 4096]
    - [136, 43.44]
  - - [1472, 1600, 1, 4096]
    - [208, 44.51]
  - - [1728, 1600, 1, 4096]
    - [275, 44.25]
  - - [1984, 1600, 1, 4096]
    - [208, 43.01]
  - - [64, 1728, 1, 4096]
    - [136, 16.03]
  - - [192, 1728, 1, 4096]
    - [275, 30.15]
  - - [320, 1728, 1, 4096]
    - [161, 33.81]
  - - [448, 1728, 1, 4096]
    - [279, 38.2]
  - - [576, 1728, 1, 4096]
    - [275, 40.71]
  - - [704, 1728, 1, 4096]
    - [208, 40.92]
  - - [832, 1728, 1, 4096]
    - [193, 42.5]
  - - [960, 1728, 1, 4096]
    - [193, 43.56]
  - - [1088, 1728, 1, 4096]
    - [193, 43.14]
  - - [1216, 1728, 1, 4096]
    - [193, 43.01]
  - - [1344, 1728, 1, 4096]
    - [289, 44.04]
  - - [1472, 1728, 1, 4096]
    - [208, 44.28]
  - - [1600, 1728, 1, 4096]
    - [208, 43.83]
  - - [1728, 1728, 1, 4096]
    - [275, 43.63]
  - - [1856, 1728, 1, 4096]
    - [256, 43.93]
  - - [1984, 1728, 1, 4096]
    - [282, 45.87]
  - - [192, 1856, 1, 4096]
    - [208, 32.73]
  - - [448, 1856, 1, 4096]
    - [193, 38.22]
  - - [704, 1856, 1, 4096]
    - [291, 42.02]
  - - [960, 1856, 1, 4096]
    - [208, 43.55]
  - - [1216, 1856, 1, 4096]
    - [193, 43.87]
  - - [1472, 1856, 1, 4096]
    - [191, 44.37]
  - - [1728, 1856, 1, 4096]
    - [208, 43.43]
  - - [1984, 1856, 1, 4096]
    - [282, 44.17]
  - - [64, 1984, 1, 4096]
    - [136, 18.3]
  - - [192, 1984, 1, 4096]
    - [275, 34.13]
  - - [320, 1984, 1, 4096]
    - [208, 37.28]
  - - [448, 1984, 1, 4096]
    - [208, 40.2]
  - - [576, 1984, 1, 4096]
    - [208, 41.91]
  - - [704, 1984, 1, 4096]
    - [135, 42.09]
  - - [832, 1984, 1, 4096]
    - [291, 43.08]
  - - [960, 1984, 1, 4096]
    - [193, 43.11]
  - - [1088, 1984, 1, 4096]
    - [208, 44.06]
  - - [1216, 1984, 1, 4096]
    - [289, 43.96]
  - - [1344, 1984, 1, 4096]
    - [191, 44.26]
  - - [1472, 1984, 1, 4096]
    - [275, 44.65]
  - - [1600, 1984, 1, 4096]
    - [193, 43.45]
  - - [1728, 1984, 1, 4096]
    - [282, 45.61]
  - - [1856, 1984, 1, 4096]
    - [315, 43.98]
  - - [1984, 1984, 1, 4096]
    - [282, 46.87]
  - - [128, 64, 1, 64]
    - [115, 0.05]
  - - [256, 64, 1, 64]
    - [114, 0.11]
  - - [384, 64, 1, 64]
    - [118, 0.16]
  - - [512, 64, 1, 64]
    - [120, 0.21]
  - - [640, 64, 1, 64]
    - [114, 0.26]
  - - [768, 64, 1, 64]
    - [123, 0.31]
  - - [896, 64, 1, 64]
    - [125, 0.37]
  - - [1024, 64, 1, 64]
    - [127, 0.42]
  - - [64, 128, 1, 64]
    - [114, 0.05]
  - - [128, 128, 1, 64]
    - [128, 0.11]
  - - [192, 128, 1, 64]
    - [129, 0.16]
  - - [256, 128, 1, 64]
    - [130, 0.21]
  - - [320, 128, 1, 64]
    - [121, 0.26]
  - - [384, 128, 1, 64]
    - [130, 0.31]
  - - [448, 128, 1, 64]
    - [131, 0.37]
  - - [512, 128, 1, 64]
    - [130, 0.42]
  - - [576, 128, 1, 64]
    - [132, 0.46]
  - - [640, 128, 1, 64]
    - [133, 0.5]
  - - [704, 128, 1, 64]
    - [134, 0.55]
  - - [768, 128, 1, 64]
    - [134, 0.61]
  - - [832, 128, 1, 64]
    - [132, 0.66]
  - - [896, 128, 1, 64]
    - [135, 0.71]
  - - [960, 128, 1, 64]
    - [132, 0.76]
  - - [1024, 128, 1, 64]
    - [136, 0.8]
  - - [128, 192, 1, 64]
    - [134, 0.16]
  - - [256, 192, 1, 64]
    - [138, 0.32]
  - - [384, 192, 1, 64]
    - [134, 0.46]
  - - [512, 192, 1, 64]
    - [140, 0.59]
  - - [640, 192, 1, 64]
    - [142, 0.76]
  - - [768, 192, 1, 64]
    - [144, 0.86]
  - - [896, 192, 1, 64]
    - [146, 1.01]
  - - [1024, 192, 1, 64]
    - [132, 1.15]
  - - [64, 256, 1, 64]
    - [148, 0.11]
  - - [128, 256, 1, 64]
    - [149, 0.21]
  - - [192, 256, 1, 64]
    - [150, 0.31]
  - - [256, 256, 1, 64]
    - [151, 0.42]
  - - [320, 256, 1, 64]
    - [130, 0.51]
  - - [384, 256, 1, 64]
    - [134, 0.61]
  - - [448, 256, 1, 64]
    - [152, 0.71]
  - - [512, 256, 1, 64]
    - [140, 0.8]
  - - [576, 256, 1, 64]
    - [153, 0.86]
  - - [640, 256, 1, 64]
    - [140, 0.92]
  - - [704, 256, 1, 64]
    - [154, 1.01]
  - - [768, 256, 1, 64]
    - [155, 1.1]
  - - [832, 256, 1, 64]
    - [156, 1.2]
  - - [896, 256, 1, 64]
    - [157, 1.33]
  - - [960, 256, 1, 64]
    - [132, 1.44]
  - - [1024, 256, 1, 64]
    - [132, 1.54]
  - - [128, 320, 1, 64]
    - [121, 0.26]
  - - [256, 320, 1, 64]
    - [134, 0.5]
  - - [384, 320, 1, 64]
    - [160, 0.76]
  - - [512, 320, 1, 64]
    - [162, 0.97]
  - - [640, 320, 1, 64]
    - [164, 1.19]
  - - [768, 320, 1, 64]
    - [157, 1.41]
  - - [896, 320, 1, 64]
    - [167, 1.57]
  - - [1024, 320, 1, 64]
    - [161, 1.79]
  - - [64, 384, 1, 64]
    - [130, 0.16]
  - - [128, 384, 1, 64]
    - [169, 0.32]
  - - [192, 384, 1, 64]
    - [121, 0.45]
  - - [256, 384, 1, 64]
    - [170, 0.59]
  - - [320, 384, 1, 64]
    - [162, 0.76]
  - - [384, 384, 1, 64]
    - [171, 0.85]
  - - [448, 384, 1, 64]
    - [172, 0.97]
  - - [512, 384, 1, 64]
    - [173, 1.11]
  - - [576, 384, 1, 64]
    - [174, 1.26]
  - - [640, 384, 1, 64]
    - [175, 1.42]
  - - [704, 384, 1, 64]
    - [176, 1.5]
  - - [768, 384, 1, 64]
    - [136, 1.59]
  - - [832, 384, 1, 64]
    - [177, 1.71]
  - - [896, 384, 1, 64]
    - [178, 1.85]
  - - [960, 384, 1, 64]
    - [179, 1.99]
  - - [1024, 384, 1, 64]
    - [132, 2.12]
  - - [128, 448, 1, 64]
    - [151, 0.36]
  - - [256, 448, 1, 64]
    - [179, 0.71]
  - - [384, 448, 1, 64]
    - [157, 1.01]
  - - [512, 448, 1, 64]
    - [174, 1.34]
  - - [640, 448, 1, 64]
    - [183, 1.61]
  - - [768, 448, 1, 64]
    - [185, 1.91]
  - - [896, 448, 1, 64]
    - [175, 2.14]
  - - [1024, 448, 1, 64]
    - [187, 2.42]
  - - [64, 512, 1, 64]
    - [188, 0.21]
  - - [128, 512, 1, 64]
    - [189, 0.42]
  - - [192, 512, 1, 64]
    - [158, 0.58]
  - - [256, 512, 1, 64]
    - [190, 0.8]
  - - [320, 512, 1, 64]
    - [133, 0.96]
  - - [384, 512, 1, 64]
    - [184, 1.16]
  - - [448, 512, 1, 64]
    - [132, 1.35]
  - - [576, 512, 1, 64]
    - [191, 1.64]
  - - [640, 512, 1, 64]
    - [192, 1.82]
  - - [704, 512, 1, 64]
    - [183, 2.01]
  - - [768, 512, 1, 64]
    - [132, 2.18]
  - - [832, 512, 1, 64]
    - [183, 2.25]
  - - [896, 512, 1, 64]
    - [193, 2.41]
  - - [960, 512, 1, 64]
    - [194, 2.51]
  - - [128, 576, 1, 64]
    - [196, 0.46]
  - - [256, 576, 1, 64]
    - [197, 0.86]
  - - [384, 576, 1, 64]
    - [198, 1.3]
  - - [512, 576, 1, 64]
    - [183, 1.64]
  - - [640, 576, 1, 64]
    - [167, 2.05]
  - - [768, 576, 1, 64]
    - [132, 2.33]
  - - [896, 576, 1, 64]
    - [167, 2.73]
  - - [1024, 576, 1, 64]
    - [167, 2.91]
  - - [64, 640, 1, 64]
    - [200, 0.25]
  - - [128, 640, 1, 64]
    - [196, 0.49]
  - - [192, 640, 1, 64]
    - [179, 0.73]
  - - [256, 640, 1, 64]
    - [156, 0.92]
  - - [320, 640, 1, 64]
    - [157, 1.16]
  - - [384, 640, 1, 64]
    - [198, 1.39]
  - - [448, 640, 1, 64]
    - [139, 1.56]
  - - [512, 640, 1, 64]
    - [132, 1.76]
  - - [576, 640, 1, 64]
    - [184, 2.0]
  - - [640, 640, 1, 64]
    - [201, 2.11]
  - - [704, 640, 1, 64]
    - [183, 2.31]
  - - [768, 640, 1, 64]
    - [202, 2.51]
  - - [832, 640, 1, 64]
    - [132, 2.57]
  - - [896, 640, 1, 64]
    - [132, 2.76]
  - - [960, 640, 1, 64]
    - [198, 2.99]
  - - [1024, 640, 1, 64]
    - [203, 3.17]
  - - [128, 704, 1, 64]
    - [162, 0.56]
  - - [256, 704, 1, 64]
    - [205, 1.06]
  - - [384, 704, 1, 64]
    - [206, 1.51]
  - - [512, 704, 1, 64]
    - [207, 1.92]
  - - [640, 704, 1, 64]
    - [157, 2.32]
  - - [768, 704, 1, 64]
    - [209, 2.6]
  - - [896, 704, 1, 64]
    - [161, 3.11]
  - - [1024, 704, 1, 64]
    - [211, 3.47]
  - - [64, 768, 1, 64]
    - [212, 0.32]
  - - [128, 768, 1, 64]
    - [213, 0.59]
  - - [192, 768, 1, 64]
    - [214, 0.87]
  - - [256, 768, 1, 64]
    - [215, 1.16]
  - - [320, 768, 1, 64]
    - [157, 1.45]
  - - [384, 768, 1, 64]
    - [132, 1.66]
  - - [448, 768, 1, 64]
    - [207, 1.92]
  - - [512, 768, 1, 64]
    - [216, 2.18]
  - - [576, 768, 1, 64]
    - [217, 2.33]
  - - [640, 768, 1, 64]
    - [187, 2.58]
  - - [704, 768, 1, 64]
    - [161, 2.72]
  - - [768, 768, 1, 64]
    - [132, 2.95]
  - - [832, 768, 1, 64]
    - [132, 3.19]
  - - [896, 768, 1, 64]
    - [211, 3.28]
  - - [960, 768, 1, 64]
    - [218, 3.49]
  - - [1024, 768, 1, 64]
    - [211, 3.75]
  - - [128, 832, 1, 64]
    - [175, 0.66]
  - - [256, 832, 1, 64]
    - [190, 1.25]
  - - [384, 832, 1, 64]
    - [205, 1.78]
  - - [512, 832, 1, 64]
    - [221, 2.25]
  - - [640, 832, 1, 64]
    - [198, 2.69]
  - - [768, 832, 1, 64]
    - [223, 3.02]
  - - [896, 832, 1, 64]
    - [224, 3.42]
  - - [1024, 832, 1, 64]
    - [132, 3.74]
  - - [64, 896, 1, 64]
    - [225, 0.36]
  - - [128, 896, 1, 64]
    - [183, 0.68]
