projects/hipblaslt/library/src/amd_detail/rocblaslt/src/Tensile/Logic/asm_full/gfx1201/GridBased/gfx1201_Cijk_Ailk_Bjlk_I8BH_SHB_HA_S_SCD_SAV_UserArgs.yaml
- {MinimumRequiredVersion: 5.0.0}
- gfx1201
- gfx1201
- [Device 73f0]
    SolutionIndex: 0
    SolutionNameMin: Cijk_Ailk_Bjlk_I8BH_SHB_HA_S_SCD_SAV_UserArgs_MT128x128x16_MI16x16x1_SN_LDSB0_AFC1_AFEM1_AFEM1_ASEM1_CLR1_CADS0_DTLA0_DTLB0_DTVA1_DTVB1_EPS0_FDSI0_GRPM1_GRVWA8_GRVWB8_GSU1_GSUAMB_GSUC0_GSUWGMRR0_GLS0_ISA1201_IU1_K1_LBSPPA0_LBSPPB0_LBSPPM0_LPA0_LPB0_LPM0_LRVW8_LWPMn1_MIAV1_MIWT8_2_MO40_NTn1_NTA0_NTB0_NTC0_NTD0_NTM0_NEPBS0_NLCA1_NLCB1_ONLL0_PGR1_PLR0_PKA0_SIA3_SS0_SU32_SUM1_SUS256_SPO0_SRVW0_SSO0_SVW8_SK0_SKXCCM0_TLDS0_ULSGRO0_USL1_UIOFGRO0_USFGROn1_VSn1_VWA1_VWB1_WSGRA0_WSGRB0_WS32_WG16_8_1_WGM8_WGMXCC1_WGMXCCGn1
    SolutionIndex: 1
    SolutionNameMin: Cijk_Ailk_Bjlk_I8BH_SHB_HA_S_SCD_SAV_UserArgs_MT128x128x16_MI16x16x1_SN_LDSB0_AFC1_AFEM1_AFEM1_ASEM1_CLR1_CADS0_DTLA0_DTLB0_DTVA1_DTVB1_EPS0_FDSI0_GRPM1_GRVWA8_GRVWB8_GSU1_GSUAMB_GSUC0_GSUWGMRR0_GLS0_ISA1201_IU1_K1_LBSPPA0_LBSPPB0_LBSPPM0_LPA0_LPB0_LPM0_LRVW8_LWPMn1_MIAV1_MIWT4_4_MO40_NTn1_NTA0_NTB0_NTC0_NTD0_NTM0_NEPBS0_NLCA1_NLCB1_ONLL0_PGR1_PLR0_PKA0_SIA3_SS0_SU32_SUM1_SUS256_SPO0_SRVW0_SSO0_SVW8_SK0_SKXCCM0_TLDS0_ULSGRO0_USL1_UIOFGRO0_USFGROn1_VSn1_VWA1_VWB1_WSGRA0_WSGRB0_WS32_WG32_4_1_WGM8_WGMXCC1_WGMXCCGn1
    SolutionIndex: 2
    SolutionNameMin: Cijk_Ailk_Bjlk_I8BH_SHB_HA_S_SCD_SAV_UserArgs_MT64x64x16_MI16x16x1_SN_LDSB1_AFC1_AFEM1_AFEM1_ASEM1_CLR1_CADS0_DTLA0_DTLB0_DTVA0_DTVB0_EPS1_FDSI0_GRPM1_GRVWA8_GRVWB1_GSU1_GSUAMB_GSUC0_GSUWGMRR0_GLS0_ISA1201_IU1_K1_LBSPPA512_LBSPPB512_LBSPPM0_LPA32_LPB32_LPM0_LRVW8_LWPMn1_MIAV1_MIWT2_2_MO40_NTn1_NTA0_NTB0_NTC0_NTD0_NTM0_NEPBS0_NLCA1_NLCB1_ONLL0_PGR1_PLR1_PKA0_SIA2_SS0_SU32_SUM1_SUS256_SPO0_SRVW0_SSO0_SVW16_SK0_SKXCCM0_TLDS0_ULSGRO0_USL1_UIOFGRO0_USFGROn1_VSn1_VWA2_VWB2_WSGRA0_WSGRB0_WS32_WG32_4_1_WGM8_WGMXCC1_WGMXCCGn1
    SolutionIndex: 3
    SolutionNameMin: Cijk_Ailk_Bjlk_I8BH_SHB_HA_S_SCD_SAV_UserArgs_MT64x64x16_MI16x16x1_SN_LDSB1_AFC1_AFEM1_AFEM1_ASEM1_CLR1_CADS0_DTLA0_DTLB0_DTVA0_DTVB0_EPS1_FDSI0_GRPM1_GRVWA4_GRVWB4_GSU1_GSUAMB_GSUC0_GSUWGMRR0_GLS0_ISA1201_IU1_K1_LBSPPA512_LBSPPB512_LBSPPM0_LPA32_LPB32_LPM0_LRVW8_LWPMn1_MIAV1_MIWT2_2_MO40_NTn1_NTA0_NTB0_NTC0_NTD0_NTM0_NEPBS0_NLCA1_NLCB1_ONLL0_PGR1_PLR1_PKA0_SIA2_SS0_SU32_SUM1_SUS256_SPO0_SRVW0_SSO0_SVW16_SK0_SKXCCM0_TLDS0_ULSGRO0_USL1_UIOFGRO0_USFGROn1_VSn1_VWA2_VWB2_WSGRA0_WSGRB0_WS32_WG32_4_1_WGM8_WGMXCC1_WGMXCCGn1
    SolutionIndex: 4
    SolutionNameMin: Cijk_Ailk_Bjlk_I8BH_SHB_HA_S_SCD_SAV_UserArgs_MT64x64x16_MI16x16x1_SN_LDSB1_AFC1_AFEM1_AFEM1_ASEM1_CLR1_CADS0_DTLA0_DTLB0_DTVA0_DTVB0_EPS1_FDSI0_GRPM1_GRVWA8_GRVWB4_GSU1_GSUAMB_GSUC0_GSUWGMRR0_GLS0_ISA1201_IU1_K1_LBSPPA512_LBSPPB512_LBSPPM0_LPA32_LPB32_LPM0_LRVW8_LWPMn1_MIAV1_MIWT2_2_MO40_NTn1_NTA0_NTB0_NTC0_NTD0_NTM0_NEPBS0_NLCA1_NLCB1_ONLL0_PGR1_PLR1_PKA0_SIA2_SS0_SU32_SUM1_SUS256_SPO0_SRVW0_SSO0_SVW16_SK0_SKXCCM0_TLDS0_ULSGRO0_USL1_UIOFGRO0_USFGROn1_VSn1_VWA2_VWB2_WSGRA0_WSGRB0_WS32_WG32_4_1_WGM8_WGMXCC1_WGMXCCGn1
    SolutionIndex: 5
    SolutionNameMin: Cijk_Ailk_Bjlk_I8BH_SHB_HA_S_SCD_SAV_UserArgs_MT64x64x16_MI16x16x1_SN_LDSB1_AFC1_AFEM1_AFEM1_ASEM1_CLR1_CADS0_DTLA0_DTLB0_DTVA0_DTVB0_EPS0_FDSI0_GRPM1_GRVWA4_GRVWB4_GSU1_GSUAMB_GSUC0_GSUWGMRR0_GLS0_ISA1201_IU1_K1_LBSPPA512_LBSPPB512_LBSPPM0_LPA32_LPB32_LPM0_LRVW8_LWPMn1_MIAV1_MIWT2_2_MO40_NTn1_NTA0_NTB0_NTC0_NTD0_NTM0_NEPBS0_NLCA1_NLCB1_ONLL0_PGR2_PLR1_PKA0_SIA2_SS0_SU32_SUM1_SUS256_SPO0_SRVW0_SSO0_SVW16_SK0_SKXCCM0_TLDS0_ULSGRO0_USL1_UIOFGRO0_USFGROn1_VSn1_VWA2_VWB2_WSGRA0_WSGRB0_WS32_WG32_4_1_WGM8_WGMXCC1_WGMXCCGn1
    SolutionIndex: 6
    SolutionNameMin: Cijk_Ailk_Bjlk_I8BH_SHB_HA_S_SCD_SAV_UserArgs_MT64x64x16_MI16x16x1_SN_LDSB0_AFC1_AFEM1_AFEM1_ASEM1_CLR1_CADS0_DTLA0_DTLB0_DTVA1_DTVB1_EPS0_FDSI0_GRPM1_GRVWA8_GRVWB8_GSU1_GSUAMB_GSUC0_GSUWGMRR0_GLS0_ISA1201_IU1_K1_LBSPPA0_LBSPPB0_LBSPPM0_LPA0_LPB0_LPM0_LRVW8_LWPMn1_MIAV1_MIWT2_2_MO40_NTn1_NTA0_NTB0_NTC0_NTD0_NTM0_NEPBS0_NLCA1_NLCB1_ONLL0_PGR1_PLR0_PKA0_SIA3_SS0_SU32_SUM1_SUS256_SPO0_SRVW0_SSO0_SVW8_SK0_SKXCCM0_TLDS0_ULSGRO0_USL1_UIOFGRO0_USFGROn1_VSn1_VWA1_VWB1_WSGRA0_WSGRB0_WS32_WG32_4_1_WGM8_WGMXCC1_WGMXCCGn1
    SolutionIndex: 7
    SolutionNameMin: Cijk_Ailk_Bjlk_I8BH_SHB_HA_S_SCD_SAV_UserArgs_MT32x32x16_MI16x16x1_SN_LDSB1_AFC1_AFEM1_AFEM1_ASEM1_CLR1_CADS0_DTLA0_DTLB0_DTVA0_DTVB0_EPS1_FDSI0_GRPM1_GRVWA1_GRVWB1_GSU1_GSUAMB_GSUC0_GSUWGMRR0_GLS0_ISA1201_IU1_K1_LBSPPA256_LBSPPB256_LBSPPM0_LPA16_LPB16_LPM0_LRVW8_LWPMn1_MIAV1_MIWT1_1_MO40_NTn1_NTA0_NTB0_NTC0_NTD0_NTM0_NEPBS0_NLCA1_NLCB1_ONLL0_PGR1_PLR1_PKA0_SIA2_SS0_SU32_SUM1_SUS256_SPO0_SRVW0_SSO0_SVW8_SK0_SKXCCM0_TLDS0_ULSGRO0_USL1_UIOFGRO0_USFGROn1_VSn1_VWA1_VWB1_WSGRA0_WSGRB0_WS32_WG32_4_1_WGM8_WGMXCC1_WGMXCCGn1
    SolutionIndex: 8
    SolutionNameMin: Cijk_Ailk_Bjlk_I8BH_SHB_HA_S_SCD_SAV_UserArgs_MT32x32x16_MI16x16x1_SN_LDSB0_AFC1_AFEM1_AFEM1_ASEM1_CLR0_CADS0_DTLA0_DTLB0_DTVA0_DTVB0_EPS0_FDSI0_GRPM1_GRVWA1_GRVWB1_GSU1_GSUAMB_GSUC0_GSUWGMRR0_GLS0_ISA1201_IU1_K1_LBSPPA256_LBSPPB256_LBSPPM0_LPA16_LPB16_LPM0_LRVW8_LWPMn1_MIAV1_MIWT1_1_MO40_NTn1_NTA0_NTB0_NTC0_NTD0_NTM0_NEPBS0_NLCA1_NLCB1_ONLL0_PGR2_PLR0_PKA0_SIA3_SS0_SU32_SUM1_SUS256_SPO0_SRVW0_SSO0_SVW8_SK0_SKXCCM0_TLDS0_ULSGRO0_USL1_UIOFGRO0_USFGROn1_VSn1_VWA1_VWB1_WSGRA0_WSGRB0_WS32_WG32_4_1_WGM8_WGMXCC1_WGMXCCGn1
    SolutionIndex: 9
    SolutionNameMin: Cijk_Ailk_Bjlk_I8BH_SHB_HA_S_SCD_SAV_UserArgs_MT32x32x16_MI16x16x1_SN_LDSB0_AFC1_AFEM1_AFEM1_ASEM1_CLR1_CADS0_DTLA0_DTLB0_DTVA1_DTVB1_EPS0_FDSI0_GRPM1_GRVWA8_GRVWB8_GSU1_GSUAMB_GSUC0_GSUWGMRR0_GLS0_ISA1201_IU1_K1_LBSPPA0_LBSPPB0_LBSPPM0_LPA0_LPB0_LPM0_LRVW8_LWPMn1_MIAV1_MIWT1_1_MO40_NTn1_NTA0_NTB0_NTC0_NTD0_NTM0_NEPBS0_NLCA1_NLCB1_ONLL0_PGR1_PLR0_PKA0_SIA3_SS0_SU32_SUM1_SUS256_SPO0_SRVW0_SSO0_SVW8_SK0_SKXCCM0_TLDS0_ULSGRO0_USL1_UIOFGRO0_USFGROn1_VSn1_VWA1_VWB1_WSGRA0_WSGRB0_WS32_WG32_4_1_WGM8_WGMXCC1_WGMXCCGn1
    SolutionIndex: 10
    SolutionNameMin: Cijk_Ailk_Bjlk_I8BH_SHB_HA_S_SCD_SAV_UserArgs_MT32x16x16_MI16x16x1_SN_LDSB1_AFC1_AFEM1_AFEM1_ASEM1_CLR1_CADS0_DTLA0_DTLB0_DTVA0_DTVB0_EPS1_FDSI0_GRPM1_GRVWA1_GRVWB1_GSU1_GSUAMB_GSUC0_GSUWGMRR0_GLS0_ISA1201_IU1_K1_LBSPPA256_LBSPPB128_LBSPPM0_LPA16_LPB16_LPM0_LRVW8_LWPMn1_MIAV1_MIWT1_1_MO40_NTn1_NTA0_NTB0_NTC0_NTD0_NTM0_NEPBS0_NLCA1_NLCB1_ONLL0_PGR1_PLR1_PKA0_SIA2_SS0_SU32_SUM1_SUS256_SPO0_SRVW0_SSO0_SVW8_SK0_SKXCCM0_TLDS0_ULSGRO0_USL1_UIOFGRO0_USFGROn1_VSn1_VWA1_VWB1_WSGRA0_WSGRB0_WS32_WG32_2_1_WGM8_WGMXCC1_WGMXCCGn1
    SolutionIndex: 11
    SolutionNameMin: Cijk_Ailk_Bjlk_I8BH_SHB_HA_S_SCD_SAV_UserArgs_MT128x64x16_MI16x16x1_SN_LDSB0_AFC1_AFEM1_AFEM1_ASEM1_CLR1_CADS0_DTLA0_DTLB0_DTVA1_DTVB1_EPS0_FDSI0_GRPM1_GRVWA8_GRVWB8_GSU1_GSUAMB_GSUC0_GSUWGMRR0_GLS0_ISA1201_IU1_K1_LBSPPA0_LBSPPB0_LBSPPM0_LPA0_LPB0_LPM0_LRVW8_LWPMn1_MIAV1_MIWT8_1_MO40_NTn1_NTA0_NTB0_NTC0_NTD0_NTM0_NEPBS0_NLCA1_NLCB1_ONLL0_PGR1_PLR0_PKA0_SIA3_SS0_SU32_SUM1_SUS256_SPO0_SRVW0_SSO0_SVW8_SK0_SKXCCM0_TLDS0_ULSGRO0_USL1_UIOFGRO0_USFGROn1_VSn1_VWA1_VWB1_WSGRA0_WSGRB0_WS32_WG16_8_1_WGM8_WGMXCC1_WGMXCCGn1
    SolutionIndex: 12
    SolutionNameMin: Cijk_Ailk_Bjlk_I8BH_SHB_HA_S_SCD_SAV_UserArgs_MT128x32x16_MI16x16x1_SN_LDSB0_AFC1_AFEM1_AFEM1_ASEM1_CLR1_CADS0_DTLA0_DTLB0_DTVA1_DTVB1_EPS0_FDSI0_GRPM1_GRVWA8_GRVWB8_GSU1_GSUAMB_GSUC0_GSUWGMRR0_GLS0_ISA1201_IU1_K1_LBSPPA0_LBSPPB0_LBSPPM0_LPA0_LPB0_LPM0_LRVW8_LWPMn1_MIAV1_MIWT4_1_MO40_NTn1_NTA0_NTB0_NTC0_NTD0_NTM0_NEPBS0_NLCA1_NLCB1_ONLL0_PGR1_PLR0_PKA0_SIA3_SS0_SU32_SUM1_SUS256_SPO0_SRVW0_SSO0_SVW8_SK0_SKXCCM0_TLDS0_ULSGRO0_USL1_UIOFGRO0_USFGROn1_VSn1_VWA1_VWB1_WSGRA0_WSGRB0_WS32_WG32_4_1_WGM8_WGMXCC1_WGMXCCGn1
    SolutionIndex: 13
    SolutionNameMin: Cijk_Ailk_Bjlk_I8BH_SHB_HA_S_SCD_SAV_UserArgs_MT16x512x16_MI16x16x1_SN_LDSB0_AFC1_AFEM1_AFEM1_ASEM1_CLR1_CADS0_DTLA0_DTLB0_DTVA1_DTVB1_EPS0_FDSI0_GRPM1_GRVWA8_GRVWB8_GSU1_GSUAMB_GSUC0_GSUWGMRR0_GLS0_ISA1201_IU1_K1_LBSPPA0_LBSPPB0_LBSPPM0_LPA0_LPB0_LPM0_LRVW8_LWPMn1_MIAV1_MIWT1_8_MO40_NTn1_NTA0_NTB0_NTC0_NTD0_NTM0_NEPBS0_NLCA1_NLCB1_ONLL0_PGR1_PLR0_PKA0_SIA3_SS0_SU32_SUM1_SUS256_SPO0_SRVW0_SSO0_SVW8_SK0_SKXCCM0_TLDS0_ULSGRO0_USL1_UIOFGRO0_USFGROn1_VSn1_VWA1_VWB1_WSGRA0_WSGRB0_WS32_WG16_8_1_WGM8_WGMXCC1_WGMXCCGn1
    SolutionIndex: 14
    SolutionNameMin: Cijk_Ailk_Bjlk_I8BH_SHB_HA_S_SCD_SAV_UserArgs_MT32x128x16_MI16x16x1_SN_LDSB0_AFC1_AFEM1_AFEM1_ASEM1_CLR1_CADS0_DTLA0_DTLB0_DTVA1_DTVB1_EPS0_FDSI0_GRPM1_GRVWA8_GRVWB8_GSU1_GSUAMB_GSUC0_GSUWGMRR0_GLS0_ISA1201_IU1_K1_LBSPPA0_LBSPPB0_LBSPPM0_LPA0_LPB0_LPM0_LRVW8_LWPMn1_MIAV1_MIWT1_4_MO40_NTn1_NTA0_NTB0_NTC0_NTD0_NTM0_NEPBS0_NLCA1_NLCB1_ONLL0_PGR1_PLR0_PKA0_SIA3_SS0_SU32_SUM1_SUS256_SPO0_SRVW0_SSO0_SVW8_SK0_SKXCCM0_TLDS0_ULSGRO0_USL1_UIOFGRO0_USFGROn1_VSn1_VWA1_VWB1_WSGRA0_WSGRB0_WS32_WG32_4_1_WGM8_WGMXCC1_WGMXCCGn1
    SolutionIndex: 15
    SolutionNameMin: Cijk_Ailk_Bjlk_I8BH_SHB_HA_S_SCD_SAV_UserArgs_MT64x128x16_MI16x16x1_SN_LDSB0_AFC1_AFEM1_AFEM1_ASEM1_CLR1_CADS0_DTLA0_DTLB0_DTVA1_DTVB1_EPS0_FDSI0_GRPM1_GRVWA8_GRVWB8_GSU1_GSUAMB_GSUC0_GSUWGMRR0_GLS0_ISA1201_IU1_K1_LBSPPA0_LBSPPB0_LBSPPM0_LPA0_LPB0_LPM0_LRVW8_LWPMn1_MIAV1_MIWT1_8_MO40_NTn1_NTA0_NTB0_NTC0_NTD0_NTM0_NEPBS0_NLCA1_NLCB1_ONLL0_PGR1_PLR0_PKA0_SIA3_SS0_SU32_SUM1_SUS256_SPO0_SRVW0_SSO0_SVW8_SK0_SKXCCM0_TLDS0_ULSGRO0_USL1_UIOFGRO0_USFGROn1_VSn1_VWA1_VWB1_WSGRA0_WSGRB0_WS32_WG64_2_1_WGM8_WGMXCC1_WGMXCCGn1
    SolutionIndex: 16
    SolutionNameMin: Cijk_Ailk_Bjlk_I8BH_SHB_HA_S_SCD_SAV_UserArgs_MT128x16x16_MI16x16x1_SN_LDSB0_AFC1_AFEM1_AFEM1_ASEM1_CLR1_CADS0_DTLA0_DTLB0_DTVA1_DTVB1_EPS0_FDSI0_GRPM1_GRVWA8_GRVWB8_GSU1_GSUAMB_GSUC0_GSUWGMRR0_GLS0_ISA1201_IU1_K1_LBSPPA0_LBSPPB0_LBSPPM0_LPA0_LPB0_LPM0_LRVW8_LWPMn1_MIAV1_MIWT8_1_MO40_NTn1_NTA0_NTB0_NTC0_NTD0_NTM0_NEPBS0_NLCA1_NLCB1_ONLL0_PGR1_PLR0_PKA0_SIA3_SS0_SU32_SUM1_SUS256_SPO0_SRVW0_SSO0_SVW8_SK0_SKXCCM0_TLDS0_ULSGRO0_USL1_UIOFGRO0_USFGROn1_VSn1_VWA1_VWB1_WSGRA0_WSGRB0_WS32_WG16_2_1_WGM8_WGMXCC1_WGMXCCGn1
    SolutionIndex: 18
    SolutionNameMin: Cijk_Ailk_Bjlk_I8BH_SHB_HA_S_SCD_SAV_UserArgs_MT16x256x16_MI16x16x1_SN_LDSB0_AFC1_AFEM1_AFEM1_ASEM1_CLR1_CADS0_DTLA0_DTLB0_DTVA1_DTVB1_EPS0_FDSI0_GRPM1_GRVWA8_GRVWB8_GSU1_GSUAMB_GSUC0_GSUWGMRR0_GLS0_ISA1201_IU1_K1_LBSPPA0_LBSPPB0_LBSPPM0_LPA0_LPB0_LPM0_LRVW8_LWPMn1_MIAV1_MIWT1_8_MO40_NTn1_NTA0_NTB0_NTC0_NTD0_NTM0_NEPBS0_NLCA1_NLCB1_ONLL0_PGR1_PLR0_PKA0_SIA3_SS0_SU32_SUM1_SUS256_SPO0_SRVW0_SSO0_SVW8_SK0_SKXCCM0_TLDS0_ULSGRO0_USL1_UIOFGRO0_USFGROn1_VSn1_VWA1_VWB1_WSGRA0_WSGRB0_WS32_WG16_4_1_WGM8_WGMXCC1_WGMXCCGn1
    SolutionIndex: 19
    SolutionNameMin: Cijk_Ailk_Bjlk_I8BH_SHB_HA_S_SCD_SAV_UserArgs_MT128x128x32_MI16x16x1_SN_LDSB0_AFC1_AFEM1_AFEM1_ASEM1_CLR1_CADS0_DTLA0_DTLB0_DTVA1_DTVB0_EPS1_FDSI0_GRPM1_GRVWA8_GRVWB4_GSU1_GSUAMB_GSUC0_GSUWGMRR0_GLS0_ISA1201_IU1_K1_LBSPPA0_LBSPPB1024_LBSPPM0_LPA0_LPB32_LPM0_LRVW8_LWPMn1_MIAV1_MIWT8_2_MO40_NTn1_NTA0_NTB0_NTC0_NTD0_NTM0_NEPBS0_NLCA2_NLCB1_ONLL0_PGR1_PLR1_PKA0_SIA3_SS0_SU32_SUM1_SUS256_SPO0_SRVW0_SSO0_SVW8_SK0_SKXCCM0_TLDS0_ULSGRO0_USL1_UIOFGRO0_USFGROn1_VSn1_VWA1_VWB2_WSGRA0_WSGRB0_WS32_WG16_8_1_WGM8_WGMXCC1_WGMXCCGn1
    SolutionIndex: 21
    SolutionNameMin: Cijk_Ailk_Bjlk_I8BH_SHB_HA_S_SCD_SAV_UserArgs_MT128x128x32_MI16x16x1_SN_LDSB0_AFC1_AFEM1_AFEM1_ASEM1_CLR1_CADS0_DTLA0_DTLB0_DTVA1_DTVB0_EPS1_FDSI0_GRPM1_GRVWA8_GRVWB16_GSU1_GSUAMB_GSUC0_GSUWGMRR0_GLS0_ISA1201_IU1_K1_LBSPPA0_LBSPPB1024_LBSPPM0_LPA0_LPB32_LPM0_LRVW8_LWPMn1_MIAV1_MIWT8_2_MO40_NTn1_NTA0_NTB0_NTC0_NTD0_NTM0_NEPBS0_NLCA2_NLCB1_ONLL0_PGR1_PLR1_PKA0_SIA3_SS0_SU32_SUM1_SUS256_SPO0_SRVW0_SSO0_SVW8_SK0_SKXCCM0_TLDS0_ULSGRO0_USL1_UIOFGRO0_USFGROn1_VSn1_VWA1_VWB2_WSGRA0_WSGRB0_WS32_WG16_8_1_WGM8_WGMXCC1_WGMXCCGn1
    SolutionIndex: 22
    SolutionNameMin: Cijk_Ailk_Bjlk_I8BH_SHB_HA_S_SCD_SAV_UserArgs_MT128x128x32_MI16x16x1_SN_LDSB0_AFC1_AFEM1_AFEM1_ASEM1_CLR1_CADS0_DTLA0_DTLB0_DTVA1_DTVB0_EPS0_FDSI0_GRPM1_GRVWA8_GRVWB4_GSU1_GSUAMB_GSUC0_GSUWGMRR0_GLS0_ISA1201_IU1_K1_LBSPPA0_LBSPPB1024_LBSPPM0_LPA0_LPB32_LPM0_LRVW8_LWPMn1_MIAV1_MIWT8_2_MO40_NTn1_NTA0_NTB0_NTC0_NTD0_NTM0_NEPBS0_NLCA2_NLCB1_ONLL0_PGR2_PLR1_PKA0_SIA3_SS0_SU32_SUM1_SUS256_SPO0_SRVW0_SSO0_SVW8_SK0_SKXCCM0_TLDS0_ULSGRO0_USL1_UIOFGRO0_USFGROn1_VSn1_VWA1_VWB2_WSGRA0_WSGRB0_WS32_WG16_8_1_WGM8_WGMXCC1_WGMXCCGn1
    SolutionIndex: 23
    SolutionNameMin: Cijk_Ailk_Bjlk_I8BH_SHB_HA_S_SCD_SAV_UserArgs_MT128x128x32_MI16x16x1_SN_LDSB0_AFC1_AFEM1_AFEM1_ASEM1_CLR1_CADS0_DTLA0_DTLB0_DTVA1_DTVB0_EPS0_FDSI0_GRPM1_GRVWA8_GRVWB8_GSU1_GSUAMB_GSUC0_GSUWGMRR0_GLS0_ISA1201_IU1_K1_LBSPPA0_LBSPPB1024_LBSPPM0_LPA0_LPB32_LPM0_LRVW8_LWPMn1_MIAV1_MIWT8_2_MO40_NTn1_NTA0_NTB0_NTC0_NTD0_NTM0_NEPBS0_NLCA2_NLCB1_ONLL0_PGR2_PLR1_PKA0_SIA3_SS0_SU32_SUM1_SUS256_SPO0_SRVW0_SSO0_SVW8_SK0_SKXCCM0_TLDS0_ULSGRO0_USL1_UIOFGRO0_USFGROn1_VSn1_VWA1_VWB2_WSGRA0_WSGRB0_WS32_WG16_8_1_WGM8_WGMXCC1_WGMXCCGn1
    SolutionIndex: 24
    SolutionNameMin: Cijk_Ailk_Bjlk_I8BH_SHB_HA_S_SCD_SAV_UserArgs_MT128x128x32_MI16x16x1_SN_LDSB0_AFC1_AFEM1_AFEM1_ASEM1_CLR1_CADS0_DTLA0_DTLB0_DTVA1_DTVB0_EPS0_FDSI0_GRPM1_GRVWA8_GRVWB16_GSU1_GSUAMB_GSUC0_GSUWGMRR0_GLS0_ISA1201_IU1_K1_LBSPPA0_LBSPPB1024_LBSPPM0_LPA0_LPB32_LPM0_LRVW8_LWPMn1_MIAV1_MIWT8_2_MO40_NTn1_NTA0_NTB0_NTC0_NTD0_NTM0_NEPBS0_NLCA2_NLCB1_ONLL0_PGR2_PLR1_PKA0_SIA3_SS0_SU32_SUM1_SUS256_SPO0_SRVW0_SSO0_SVW8_SK0_SKXCCM0_TLDS0_ULSGRO0_USL1_UIOFGRO0_USFGROn1_VSn1_VWA1_VWB2_WSGRA0_WSGRB0_WS32_WG16_8_1_WGM8_WGMXCC1_WGMXCCGn1
    SolutionIndex: 25
    SolutionNameMin: Cijk_Ailk_Bjlk_I8BH_SHB_HA_S_SCD_SAV_UserArgs_MT128x128x32_MI16x16x1_SN_LDSB0_AFC1_AFEM1_AFEM1_ASEM1_CLR1_CADS0_DTLA0_DTLB0_DTVA1_DTVB1_EPS0_FDSI0_GRPM1_GRVWA8_GRVWB8_GSU1_GSUAMB_GSUC0_GSUWGMRR0_GLS0_ISA1201_IU1_K1_LBSPPA0_LBSPPB0_LBSPPM0_LPA0_LPB0_LPM0_LRVW8_LWPMn1_MIAV1_MIWT8_2_MO40_NTn1_NTA0_NTB0_NTC0_NTD0_NTM0_NEPBS0_NLCA2_NLCB2_ONLL0_PGR1_PLR0_PKA0_SIA3_SS0_SU32_SUM1_SUS256_SPO0_SRVW0_SSO0_SVW8_SK0_SKXCCM0_TLDS0_ULSGRO0_USL1_UIOFGRO0_USFGROn1_VSn1_VWA1_VWB1_WSGRA0_WSGRB0_WS32_WG16_8_1_WGM8_WGMXCC1_WGMXCCGn1
    SolutionIndex: 26
    SolutionNameMin: Cijk_Ailk_Bjlk_I8BH_SHB_HA_S_SCD_SAV_UserArgs_MT128x128x32_MI16x16x1_SN_LDSB0_AFC1_AFEM1_AFEM1_ASEM1_CLR1_CADS0_DTLA0_DTLB0_DTVA1_DTVB0_EPS0_FDSI0_GRPM1_GRVWA8_GRVWB4_GSU1_GSUAMB_GSUC0_GSUWGMRR0_GLS0_ISA1201_IU1_K1_LBSPPA0_LBSPPB1024_LBSPPM0_LPA0_LPB64_LPM0_LRVW8_LWPMn1_MIAV1_MIWT4_4_MO40_NTn1_NTA0_NTB0_NTC0_NTD0_NTM0_NEPBS0_NLCA2_NLCB1_ONLL0_PGR2_PLR1_PKA0_SIA3_SS0_SU32_SUM1_SUS256_SPO0_SRVW0_SSO0_SVW8_SK0_SKXCCM0_TLDS0_ULSGRO0_USL1_UIOFGRO0_USFGROn1_VSn1_VWA1_VWB4_WSGRA0_WSGRB0_WS32_WG32_4_1_WGM8_WGMXCC1_WGMXCCGn1
    SolutionIndex: 27
    SolutionNameMin: Cijk_Ailk_Bjlk_I8BH_SHB_HA_S_SCD_SAV_UserArgs_MT128x128x32_MI16x16x1_SN_LDSB0_AFC1_AFEM1_AFEM1_ASEM1_CLR1_CADS0_DTLA0_DTLB0_DTVA1_DTVB0_EPS0_FDSI0_GRPM1_GRVWA8_GRVWB16_GSU1_GSUAMB_GSUC0_GSUWGMRR0_GLS0_ISA1201_IU1_K1_LBSPPA0_LBSPPB1024_LBSPPM0_LPA0_LPB64_LPM0_LRVW8_LWPMn1_MIAV1_MIWT4_4_MO40_NTn1_NTA0_NTB0_NTC0_NTD0_NTM0_NEPBS0_NLCA2_NLCB1_ONLL0_PGR2_PLR1_PKA0_SIA3_SS0_SU32_SUM1_SUS256_SPO0_SRVW0_SSO0_SVW8_SK0_SKXCCM0_TLDS0_ULSGRO0_USL1_UIOFGRO0_USFGROn1_VSn1_VWA1_VWB4_WSGRA0_WSGRB0_WS32_WG32_4_1_WGM8_WGMXCC1_WGMXCCGn1
    SolutionIndex: 28
    SolutionNameMin: Cijk_Ailk_Bjlk_I8BH_SHB_HA_S_SCD_SAV_UserArgs_MT128x128x32_MI16x16x1_SN_LDSB0_AFC1_AFEM1_AFEM1_ASEM1_CLR1_CADS0_DTLA0_DTLB0_DTVA0_DTVB1_EPS1_FDSI0_GRPM1_GRVWA16_GRVWB8_GSU1_GSUAMB_GSUC0_GSUWGMRR0_GLS0_ISA1201_IU1_K1_LBSPPA1024_LBSPPB0_LBSPPM0_LPA64_LPB0_LPM0_LRVW8_LWPMn1_MIAV1_MIWT4_4_MO40_NTn1_NTA0_NTB0_NTC0_NTD0_NTM0_NEPBS0_NLCA1_NLCB2_ONLL0_PGR1_PLR1_PKA0_SIA3_SS0_SU32_SUM1_SUS256_SPO0_SRVW0_SSO0_SVW8_SK0_SKXCCM0_TLDS0_ULSGRO0_USL1_UIOFGRO0_USFGROn1_VSn1_VWA4_VWB1_WSGRA0_WSGRB0_WS32_WG32_4_1_WGM8_WGMXCC1_WGMXCCGn1
    SolutionIndex: 29
    SolutionNameMin: Cijk_Ailk_Bjlk_I8BH_SHB_HA_S_SCD_SAV_UserArgs_MT128x128x32_MI16x16x1_SN_LDSB0_AFC1_AFEM1_AFEM1_ASEM1_CLR1_CADS0_DTLA0_DTLB0_DTVA0_DTVB1_EPS0_FDSI0_GRPM1_GRVWA4_GRVWB8_GSU1_GSUAMB_GSUC0_GSUWGMRR0_GLS0_ISA1201_IU1_K1_LBSPPA1024_LBSPPB0_LBSPPM0_LPA64_LPB0_LPM0_LRVW8_LWPMn1_MIAV1_MIWT4_4_MO40_NTn1_NTA0_NTB0_NTC0_NTD0_NTM0_NEPBS0_NLCA1_NLCB2_ONLL0_PGR2_PLR1_PKA0_SIA3_SS0_SU32_SUM1_SUS256_SPO0_SRVW0_SSO0_SVW8_SK0_SKXCCM0_TLDS0_ULSGRO0_USL1_UIOFGRO0_USFGROn1_VSn1_VWA4_VWB1_WSGRA0_WSGRB0_WS32_WG32_4_1_WGM8_WGMXCC1_WGMXCCGn1
    SolutionIndex: 30
    SolutionNameMin: Cijk_Ailk_Bjlk_I8BH_SHB_HA_S_SCD_SAV_UserArgs_MT128x128x32_MI16x16x1_SN_LDSB0_AFC1_AFEM1_AFEM1_ASEM1_CLR1_CADS0_DTLA0_DTLB0_DTVA0_DTVB1_EPS0_FDSI0_GRPM1_GRVWA8_GRVWB8_GSU1_GSUAMB_GSUC0_GSUWGMRR0_GLS0_ISA1201_IU1_K1_LBSPPA1024_LBSPPB0_LBSPPM0_LPA64_LPB0_LPM0_LRVW8_LWPMn1_MIAV1_MIWT4_4_MO40_NTn1_NTA0_NTB0_NTC0_NTD0_NTM0_NEPBS0_NLCA1_NLCB2_ONLL0_PGR2_PLR1_PKA0_SIA3_SS0_SU32_SUM1_SUS256_SPO0_SRVW0_SSO0_SVW8_SK0_SKXCCM0_TLDS0_ULSGRO0_USL1_UIOFGRO0_USFGROn1_VSn1_VWA4_VWB1_WSGRA0_WSGRB0_WS32_WG32_4_1_WGM8_WGMXCC1_WGMXCCGn1
    SolutionIndex: 31
    SolutionNameMin: Cijk_Ailk_Bjlk_I8BH_SHB_HA_S_SCD_SAV_UserArgs_MT128x128x32_MI16x16x1_SN_LDSB0_AFC1_AFEM1_AFEM1_ASEM1_CLR1_CADS0_DTLA0_DTLB0_DTVA1_DTVB1_EPS0_FDSI0_GRPM1_GRVWA8_GRVWB8_GSU1_GSUAMB_GSUC0_GSUWGMRR0_GLS0_ISA1201_IU1_K1_LBSPPA0_LBSPPB0_LBSPPM0_LPA0_LPB0_LPM0_LRVW8_LWPMn1_MIAV1_MIWT4_4_MO40_NTn1_NTA0_NTB0_NTC0_NTD0_NTM0_NEPBS0_NLCA2_NLCB2_ONLL0_PGR1_PLR0_PKA0_SIA3_SS0_SU32_SUM1_SUS256_SPO0_SRVW0_SSO0_SVW8_SK0_SKXCCM0_TLDS0_ULSGRO0_USL1_UIOFGRO0_USFGROn1_VSn1_VWA1_VWB1_WSGRA0_WSGRB0_WS32_WG32_4_1_WGM8_WGMXCC1_WGMXCCGn1
    SolutionIndex: 32
    SolutionNameMin: Cijk_Ailk_Bjlk_I8BH_SHB_HA_S_SCD_SAV_UserArgs_MT64x64x32_MI16x16x1_SN_LDSB1_AFC1_AFEM1_AFEM1_ASEM1_CLR1_CADS0_DTLA0_DTLB0_DTVA0_DTVB0_EPS1_FDSI0_GRPM1_GRVWA1_GRVWB1_GSU1_GSUAMB_GSUC0_GSUWGMRR0_GLS0_ISA1201_IU2_K1_LBSPPA512_LBSPPB512_LBSPPM0_LPA32_LPB32_LPM0_LRVW8_LWPMn1_MIAV1_MIWT2_2_MO40_NTn1_NTA0_NTB0_NTC0_NTD0_NTM0_NEPBS0_NLCA1_NLCB1_ONLL0_PGR1_PLR1_PKA0_SIA2_SS0_SU32_SUM1_SUS256_SPO0_SRVW0_SSO0_SVW16_SK0_SKXCCM0_TLDS0_ULSGRO0_USL1_UIOFGRO0_USFGROn1_VSn1_VWA2_VWB2_WSGRA0_WSGRB0_WS32_WG32_4_1_WGM8_WGMXCC1_WGMXCCGn1
    SolutionIndex: 33
    SolutionNameMin: Cijk_Ailk_Bjlk_I8BH_SHB_HA_S_SCD_SAV_UserArgs_MT64x64x32_MI16x16x1_SN_LDSB1_AFC1_AFEM1_AFEM1_ASEM1_CLR1_CADS0_DTLA0_DTLB0_DTVA0_DTVB0_EPS0_FDSI0_GRPM1_GRVWA4_GRVWB4_GSU1_GSUAMB_GSUC0_GSUWGMRR0_GLS0_ISA1201_IU2_K1_LBSPPA512_LBSPPB512_LBSPPM0_LPA32_LPB32_LPM0_LRVW8_LWPMn1_MIAV1_MIWT2_2_MO40_NTn1_NTA0_NTB0_NTC0_NTD0_NTM0_NEPBS0_NLCA1_NLCB1_ONLL0_PGR2_PLR1_PKA0_SIA2_SS0_SU32_SUM1_SUS256_SPO0_SRVW0_SSO0_SVW16_SK0_SKXCCM0_TLDS0_ULSGRO0_USL1_UIOFGRO0_USFGROn1_VSn1_VWA2_VWB2_WSGRA0_WSGRB0_WS32_WG32_4_1_WGM8_WGMXCC1_WGMXCCGn1
    SolutionIndex: 34
    SolutionNameMin: Cijk_Ailk_Bjlk_I8BH_SHB_HA_S_SCD_SAV_UserArgs_MT64x64x32_MI16x16x1_SN_LDSB1_AFC1_AFEM1_AFEM1_ASEM1_CLR1_CADS0_DTLA0_DTLB0_DTVA0_DTVB0_EPS0_FDSI0_GRPM1_GRVWA4_GRVWB16_GSU1_GSUAMB_GSUC0_GSUWGMRR0_GLS0_ISA1201_IU2_K1_LBSPPA512_LBSPPB512_LBSPPM0_LPA32_LPB32_LPM0_LRVW8_LWPMn1_MIAV1_MIWT2_2_MO40_NTn1_NTA0_NTB0_NTC0_NTD0_NTM0_NEPBS0_NLCA1_NLCB1_ONLL0_PGR2_PLR1_PKA0_SIA2_SS0_SU32_SUM1_SUS256_SPO0_SRVW0_SSO0_SVW16_SK0_SKXCCM0_TLDS0_ULSGRO0_USL1_UIOFGRO0_USFGROn1_VSn1_VWA2_VWB2_WSGRA0_WSGRB0_WS32_WG32_4_1_WGM8_WGMXCC1_WGMXCCGn1
    SolutionIndex: 35
    SolutionNameMin: Cijk_Ailk_Bjlk_I8BH_SHB_HA_S_SCD_SAV_UserArgs_MT64x64x32_MI16x16x1_SN_LDSB1_AFC1_AFEM1_AFEM1_ASEM1_CLR1_CADS0_DTLA0_DTLB0_DTVA0_DTVB0_EPS0_FDSI0_GRPM1_GRVWA1_GRVWB1_GSU1_GSUAMB_GSUC0_GSUWGMRR0_GLS0_ISA1201_IU2_K1_LBSPPA512_LBSPPB512_LBSPPM0_LPA32_LPB32_LPM0_LRVW8_LWPMn1_MIAV1_MIWT2_2_MO40_NTn1_NTA0_NTB0_NTC0_NTD0_NTM0_NEPBS0_NLCA1_NLCB1_ONLL0_PGR2_PLR1_PKA0_SIA2_SS0_SU32_SUM1_SUS256_SPO0_SRVW0_SSO0_SVW16_SK0_SKXCCM0_TLDS0_ULSGRO1_USL1_UIOFGRO0_USFGROn1_VSn1_VWA2_VWB2_WSGRA0_WSGRB0_WS32_WG32_4_1_WGM8_WGMXCC1_WGMXCCGn1
    SolutionIndex: 36
    SolutionNameMin: Cijk_Ailk_Bjlk_I8BH_SHB_HA_S_SCD_SAV_UserArgs_MT64x64x32_MI16x16x1_SN_LDSB1_AFC1_AFEM1_AFEM1_ASEM1_CLR1_CADS0_DTLA0_DTLB0_DTVA0_DTVB0_EPS0_FDSI0_GRPM1_GRVWA4_GRVWB4_GSU1_GSUAMB_GSUC0_GSUWGMRR0_GLS0_ISA1201_IU2_K1_LBSPPA512_LBSPPB512_LBSPPM0_LPA32_LPB32_LPM0_LRVW8_LWPMn1_MIAV1_MIWT2_2_MO40_NTn1_NTA0_NTB0_NTC0_NTD0_NTM0_NEPBS0_NLCA1_NLCB1_ONLL0_PGR2_PLR1_PKA0_SIA2_SS0_SU32_SUM1_SUS256_SPO0_SRVW0_SSO0_SVW16_SK0_SKXCCM0_TLDS0_ULSGRO1_USL1_UIOFGRO0_USFGROn1_VSn1_VWA2_VWB2_WSGRA0_WSGRB0_WS32_WG32_4_1_WGM8_WGMXCC1_WGMXCCGn1
    SolutionIndex: 37
    SolutionNameMin: Cijk_Ailk_Bjlk_I8BH_SHB_HA_S_SCD_SAV_UserArgs_MT64x64x32_MI16x16x1_SN_LDSB0_AFC1_AFEM1_AFEM1_ASEM1_CLR1_CADS0_DTLA0_DTLB0_DTVA0_DTVB0_EPS0_FDSI0_GRPM1_GRVWA1_GRVWB1_GSU1_GSUAMB_GSUC0_GSUWGMRR0_GLS0_ISA1201_IU1_K1_LBSPPA512_LBSPPB512_LBSPPM0_LPA32_LPB32_LPM0_LRVW8_LWPMn1_MIAV1_MIWT2_2_MO40_NTn1_NTA0_NTB0_NTC0_NTD0_NTM0_NEPBS0_NLCA1_NLCB1_ONLL0_PGR2_PLR1_PKA0_SIA3_SS0_SU32_SUM1_SUS256_SPO0_SRVW0_SSO0_SVW16_SK0_SKXCCM0_TLDS0_ULSGRO1_USL1_UIOFGRO0_USFGROn1_VSn1_VWA2_VWB2_WSGRA0_WSGRB0_WS32_WG32_4_1_WGM8_WGMXCC1_WGMXCCGn1
    SolutionIndex: 38
    SolutionNameMin: Cijk_Ailk_Bjlk_I8BH_SHB_HA_S_SCD_SAV_UserArgs_MT64x64x32_MI16x16x1_SN_LDSB0_AFC1_AFEM1_AFEM1_ASEM1_CLR1_CADS0_DTLA0_DTLB0_DTVA0_DTVB0_EPS0_FDSI0_GRPM1_GRVWA16_GRVWB8_GSU1_GSUAMB_GSUC0_GSUWGMRR0_GLS0_ISA1201_IU1_K1_LBSPPA512_LBSPPB512_LBSPPM0_LPA32_LPB32_LPM0_LRVW8_LWPMn1_MIAV1_MIWT2_2_MO40_NTn1_NTA0_NTB0_NTC0_NTD0_NTM0_NEPBS0_NLCA1_NLCB1_ONLL0_PGR2_PLR1_PKA0_SIA3_SS0_SU32_SUM1_SUS256_SPO0_SRVW0_SSO0_SVW16_SK0_SKXCCM0_TLDS0_ULSGRO1_USL1_UIOFGRO0_USFGROn1_VSn1_VWA2_VWB2_WSGRA0_WSGRB0_WS32_WG32_4_1_WGM8_WGMXCC1_WGMXCCGn1
    SolutionIndex: 39
    SolutionNameMin: Cijk_Ailk_Bjlk_I8BH_SHB_HA_S_SCD_SAV_UserArgs_MT64x64x32_MI16x16x1_SN_LDSB0_AFC1_AFEM1_AFEM1_ASEM1_CLR1_CADS0_DTLA0_DTLB0_DTVA0_DTVB1_EPS1_FDSI0_GRPM1_GRVWA8_GRVWB8_GSU1_GSUAMB_GSUC0_GSUWGMRR0_GLS0_ISA1201_IU1_K1_LBSPPA512_LBSPPB0_LBSPPM0_LPA32_LPB0_LPM0_LRVW8_LWPMn1_MIAV1_MIWT2_2_MO40_NTn1_NTA0_NTB0_NTC0_NTD0_NTM0_NEPBS0_NLCA1_NLCB2_ONLL0_PGR1_PLR1_PKA0_SIA3_SS0_SU32_SUM1_SUS256_SPO0_SRVW0_SSO0_SVW16_SK0_SKXCCM0_TLDS0_ULSGRO0_USL1_UIOFGRO0_USFGROn1_VSn1_VWA2_VWB1_WSGRA0_WSGRB0_WS32_WG32_4_1_WGM8_WGMXCC1_WGMXCCGn1
    SolutionIndex: 40
    SolutionNameMin: Cijk_Ailk_Bjlk_I8BH_SHB_HA_S_SCD_SAV_UserArgs_MT64x64x32_MI16x16x1_SN_LDSB0_AFC1_AFEM1_AFEM1_ASEM1_CLR1_CADS0_DTLA0_DTLB0_DTVA0_DTVB1_EPS1_FDSI0_GRPM1_GRVWA16_GRVWB8_GSU1_GSUAMB_GSUC0_GSUWGMRR0_GLS0_ISA1201_IU1_K1_LBSPPA512_LBSPPB0_LBSPPM0_LPA32_LPB0_LPM0_LRVW8_LWPMn1_MIAV1_MIWT2_2_MO40_NTn1_NTA0_NTB0_NTC0_NTD0_NTM0_NEPBS0_NLCA1_NLCB2_ONLL0_PGR1_PLR1_PKA0_SIA3_SS0_SU32_SUM1_SUS256_SPO0_SRVW0_SSO0_SVW16_SK0_SKXCCM0_TLDS0_ULSGRO0_USL1_UIOFGRO0_USFGROn1_VSn1_VWA2_VWB1_WSGRA0_WSGRB0_WS32_WG32_4_1_WGM8_WGMXCC1_WGMXCCGn1
    SolutionIndex: 41
    SolutionNameMin: Cijk_Ailk_Bjlk_I8BH_SHB_HA_S_SCD_SAV_UserArgs_MT64x64x32_MI16x16x1_SN_LDSB0_AFC1_AFEM1_AFEM1_ASEM1_CLR1_CADS0_DTLA0_DTLB0_DTVA0_DTVB1_EPS0_FDSI0_GRPM1_GRVWA4_GRVWB8_GSU1_GSUAMB_GSUC0_GSUWGMRR0_GLS0_ISA1201_IU1_K1_LBSPPA512_LBSPPB0_LBSPPM0_LPA32_LPB0_LPM0_LRVW8_LWPMn1_MIAV1_MIWT2_2_MO40_NTn1_NTA0_NTB0_NTC0_NTD0_NTM0_NEPBS0_NLCA1_NLCB2_ONLL0_PGR2_PLR1_PKA0_SIA3_SS0_SU32_SUM1_SUS256_SPO0_SRVW0_SSO0_SVW16_SK0_SKXCCM0_TLDS0_ULSGRO0_USL1_UIOFGRO0_USFGROn1_VSn1_VWA2_VWB1_WSGRA0_WSGRB0_WS32_WG32_4_1_WGM8_WGMXCC1_WGMXCCGn1
    SolutionIndex: 42
    SolutionNameMin: Cijk_Ailk_Bjlk_I8BH_SHB_HA_S_SCD_SAV_UserArgs_MT64x64x32_MI16x16x1_SN_LDSB0_AFC1_AFEM1_AFEM1_ASEM1_CLR1_CADS0_DTLA0_DTLB0_DTVA0_DTVB1_EPS0_FDSI0_GRPM1_GRVWA16_GRVWB8_GSU1_GSUAMB_GSUC0_GSUWGMRR0_GLS0_ISA1201_IU1_K1_LBSPPA512_LBSPPB0_LBSPPM0_LPA32_LPB0_LPM0_LRVW8_LWPMn1_MIAV1_MIWT2_2_MO40_NTn1_NTA0_NTB0_NTC0_NTD0_NTM0_NEPBS0_NLCA1_NLCB2_ONLL0_PGR2_PLR1_PKA0_SIA3_SS0_SU32_SUM1_SUS256_SPO0_SRVW0_SSO0_SVW16_SK0_SKXCCM0_TLDS0_ULSGRO0_USL1_UIOFGRO0_USFGROn1_VSn1_VWA2_VWB1_WSGRA0_WSGRB0_WS32_WG32_4_1_WGM8_WGMXCC1_WGMXCCGn1
    SolutionIndex: 43
    SolutionNameMin: Cijk_Ailk_Bjlk_I8BH_SHB_HA_S_SCD_SAV_UserArgs_MT64x64x32_MI16x16x1_SN_LDSB0_AFC1_AFEM1_AFEM1_ASEM1_CLR1_CADS0_DTLA0_DTLB0_DTVA1_DTVB1_EPS0_FDSI0_GRPM1_GRVWA8_GRVWB8_GSU1_GSUAMB_GSUC0_GSUWGMRR0_GLS0_ISA1201_IU1_K1_LBSPPA0_LBSPPB0_LBSPPM0_LPA0_LPB0_LPM0_LRVW8_LWPMn1_MIAV1_MIWT2_2_MO40_NTn1_NTA0_NTB0_NTC0_NTD0_NTM0_NEPBS0_NLCA2_NLCB2_ONLL0_PGR1_PLR0_PKA0_SIA3_SS0_SU32_SUM1_SUS256_SPO0_SRVW0_SSO0_SVW8_SK0_SKXCCM0_TLDS0_ULSGRO0_USL1_UIOFGRO0_USFGROn1_VSn1_VWA1_VWB1_WSGRA0_WSGRB0_WS32_WG32_4_1_WGM8_WGMXCC1_WGMXCCGn1
    SolutionIndex: 44
    SolutionNameMin: Cijk_Ailk_Bjlk_I8BH_SHB_HA_S_SCD_SAV_UserArgs_MT32x32x32_MI16x16x1_SN_LDSB1_AFC1_AFEM1_AFEM1_ASEM1_CLR1_CADS0_DTLA0_DTLB0_DTVA0_DTVB0_EPS1_FDSI0_GRPM1_GRVWA4_GRVWB8_GSU1_GSUAMB_GSUC0_GSUWGMRR0_GLS0_ISA1201_IU2_K1_LBSPPA256_LBSPPB256_LBSPPM0_LPA16_LPB16_LPM0_LRVW8_LWPMn1_MIAV1_MIWT1_1_MO40_NTn1_NTA0_NTB0_NTC0_NTD0_NTM0_NEPBS0_NLCA1_NLCB1_ONLL0_PGR1_PLR1_PKA0_SIA2_SS0_SU32_SUM1_SUS256_SPO0_SRVW0_SSO0_SVW8_SK0_SKXCCM0_TLDS0_ULSGRO0_USL1_UIOFGRO0_USFGROn1_VSn1_VWA1_VWB1_WSGRA0_WSGRB0_WS32_WG32_4_1_WGM8_WGMXCC1_WGMXCCGn1
    SolutionIndex: 45
    SolutionNameMin: Cijk_Ailk_Bjlk_I8BH_SHB_HA_S_SCD_SAV_UserArgs_MT32x32x32_MI16x16x1_SN_LDSB1_AFC1_AFEM1_AFEM1_ASEM1_CLR1_CADS0_DTLA0_DTLB0_DTVA0_DTVB0_EPS0_FDSI0_GRPM1_GRVWA1_GRVWB1_GSU1_GSUAMB_GSUC0_GSUWGMRR0_GLS0_ISA1201_IU2_K1_LBSPPA256_LBSPPB256_LBSPPM0_LPA16_LPB16_LPM0_LRVW8_LWPMn1_MIAV1_MIWT1_1_MO40_NTn1_NTA0_NTB0_NTC0_NTD0_NTM0_NEPBS0_NLCA1_NLCB1_ONLL0_PGR2_PLR1_PKA0_SIA2_SS0_SU32_SUM1_SUS256_SPO0_SRVW0_SSO0_SVW8_SK0_SKXCCM0_TLDS0_ULSGRO0_USL1_UIOFGRO0_USFGROn1_VSn1_VWA1_VWB1_WSGRA0_WSGRB0_WS32_WG32_4_1_WGM8_WGMXCC1_WGMXCCGn1
    SolutionIndex: 46
    SolutionNameMin: Cijk_Ailk_Bjlk_I8BH_SHB_HA_S_SCD_SAV_UserArgs_MT32x32x32_MI16x16x1_SN_LDSB1_AFC1_AFEM1_AFEM1_ASEM1_CLR1_CADS0_DTLA0_DTLB0_DTVA0_DTVB0_EPS0_FDSI0_GRPM1_GRVWA1_GRVWB1_GSU1_GSUAMB_GSUC0_GSUWGMRR0_GLS0_ISA1201_IU2_K1_LBSPPA256_LBSPPB256_LBSPPM0_LPA16_LPB16_LPM0_LRVW8_LWPMn1_MIAV1_MIWT1_1_MO40_NTn1_NTA0_NTB0_NTC0_NTD0_NTM0_NEPBS0_NLCA1_NLCB1_ONLL0_PGR2_PLR1_PKA0_SIA2_SS0_SU32_SUM1_SUS256_SPO0_SRVW0_SSO0_SVW8_SK0_SKXCCM0_TLDS0_ULSGRO1_USL1_UIOFGRO0_USFGROn1_VSn1_VWA1_VWB1_WSGRA0_WSGRB0_WS32_WG32_4_1_WGM8_WGMXCC1_WGMXCCGn1
    SolutionIndex: 47
    SolutionNameMin: Cijk_Ailk_Bjlk_I8BH_SHB_HA_S_SCD_SAV_UserArgs_MT32x32x32_MI16x16x1_SN_LDSB0_AFC1_AFEM1_AFEM1_ASEM1_CLR1_CADS0_DTLA0_DTLB0_DTVA0_DTVB0_EPS0_FDSI0_GRPM1_GRVWA1_GRVWB1_GSU1_GSUAMB_GSUC0_GSUWGMRR0_GLS0_ISA1201_IU1_K1_LBSPPA256_LBSPPB256_LBSPPM0_LPA16_LPB16_LPM0_LRVW8_LWPMn1_MIAV1_MIWT1_1_MO40_NTn1_NTA0_NTB0_NTC0_NTD0_NTM0_NEPBS0_NLCA1_NLCB1_ONLL0_PGR2_PLR1_PKA0_SIA3_SS0_SU32_SUM1_SUS256_SPO0_SRVW0_SSO0_SVW8_SK0_SKXCCM0_TLDS0_ULSGRO1_USL1_UIOFGRO0_USFGROn1_VSn1_VWA1_VWB1_WSGRA0_WSGRB0_WS32_WG32_4_1_WGM8_WGMXCC1_WGMXCCGn1
    SolutionIndex: 48
    SolutionNameMin: Cijk_Ailk_Bjlk_I8BH_SHB_HA_S_SCD_SAV_UserArgs_MT32x32x32_MI16x16x1_SN_LDSB0_AFC1_AFEM1_AFEM1_ASEM1_CLR1_CADS0_DTLA0_DTLB0_DTVA1_DTVB0_EPS0_FDSI0_GRPM1_GRVWA8_GRVWB8_GSU1_GSUAMB_GSUC0_GSUWGMRR0_GLS0_ISA1201_IU1_K1_LBSPPA0_LBSPPB256_LBSPPM0_LPA0_LPB16_LPM0_LRVW8_LWPMn1_MIAV1_MIWT1_1_MO40_NTn1_NTA0_NTB0_NTC0_NTD0_NTM0_NEPBS0_NLCA1_NLCB1_ONLL0_PGR2_PLR1_PKA0_SIA3_SS0_SU32_SUM1_SUS256_SPO0_SRVW0_SSO0_SVW8_SK0_SKXCCM0_TLDS0_ULSGRO0_USL1_UIOFGRO0_USFGROn1_VSn1_VWA1_VWB1_WSGRA0_WSGRB0_WS32_WG32_4_1_WGM8_WGMXCC1_WGMXCCGn1
    SolutionIndex: 49
    SolutionNameMin: Cijk_Ailk_Bjlk_I8BH_SHB_HA_S_SCD_SAV_UserArgs_MT32x32x32_MI16x16x1_SN_LDSB0_AFC1_AFEM1_AFEM1_ASEM1_CLR1_CADS0_DTLA0_DTLB0_DTVA0_DTVB1_EPS0_FDSI0_GRPM1_GRVWA8_GRVWB8_GSU1_GSUAMB_GSUC0_GSUWGMRR0_GLS0_ISA1201_IU1_K1_LBSPPA256_LBSPPB0_LBSPPM0_LPA16_LPB0_LPM0_LRVW8_LWPMn1_MIAV1_MIWT1_1_MO40_NTn1_NTA0_NTB0_NTC0_NTD0_NTM0_NEPBS0_NLCA1_NLCB1_ONLL0_PGR2_PLR1_PKA0_SIA3_SS0_SU32_SUM1_SUS256_SPO0_SRVW0_SSO0_SVW8_SK0_SKXCCM0_TLDS0_ULSGRO0_USL1_UIOFGRO0_USFGROn1_VSn1_VWA1_VWB1_WSGRA0_WSGRB0_WS32_WG32_4_1_WGM8_WGMXCC1_WGMXCCGn1
    SolutionIndex: 50
    SolutionNameMin: Cijk_Ailk_Bjlk_I8BH_SHB_HA_S_SCD_SAV_UserArgs_MT16x32x32_MI16x16x1_SN_LDSB0_AFC1_AFEM1_AFEM1_ASEM1_CLR1_CADS0_DTLA0_DTLB0_DTVA0_DTVB0_EPS0_FDSI0_GRPM1_GRVWA1_GRVWB1_GSU1_GSUAMB_GSUC0_GSUWGMRR0_GLS0_ISA1201_IU1_K1_LBSPPA128_LBSPPB256_LBSPPM0_LPA16_LPB16_LPM0_LRVW8_LWPMn1_MIAV1_MIWT1_1_MO40_NTn1_NTA0_NTB0_NTC0_NTD0_NTM0_NEPBS0_NLCA1_NLCB1_ONLL0_PGR2_PLR1_PKA0_SIA3_SS0_SU32_SUM1_SUS256_SPO0_SRVW0_SSO0_SVW8_SK0_SKXCCM0_TLDS0_ULSGRO1_USL1_UIOFGRO0_USFGROn1_VSn1_VWA1_VWB1_WSGRA0_WSGRB0_WS32_WG16_4_1_WGM8_WGMXCC1_WGMXCCGn1
    SolutionIndex: 51
    SolutionNameMin: Cijk_Ailk_Bjlk_I8BH_SHB_HA_S_SCD_SAV_UserArgs_MT16x32x32_MI16x16x1_SN_LDSB0_AFC1_AFEM1_AFEM1_ASEM1_CLR1_CADS0_DTLA0_DTLB0_DTVA0_DTVB1_EPS0_FDSI0_GRPM1_GRVWA1_GRVWB8_GSU1_GSUAMB_GSUC0_GSUWGMRR0_GLS0_ISA1201_IU1_K1_LBSPPA128_LBSPPB0_LBSPPM0_LPA16_LPB0_LPM0_LRVW8_LWPMn1_MIAV1_MIWT1_1_MO40_NTn1_NTA0_NTB0_NTC0_NTD0_NTM0_NEPBS0_NLCA1_NLCB1_ONLL0_PGR2_PLR1_PKA0_SIA3_SS0_SU32_SUM1_SUS256_SPO0_SRVW0_SSO0_SVW8_SK0_SKXCCM0_TLDS0_ULSGRO0_USL1_UIOFGRO0_USFGROn1_VSn1_VWA1_VWB1_WSGRA0_WSGRB0_WS32_WG16_4_1_WGM8_WGMXCC1_WGMXCCGn1
    SolutionIndex: 52
    SolutionNameMin: Cijk_Ailk_Bjlk_I8BH_SHB_HA_S_SCD_SAV_UserArgs_MT16x32x32_MI16x16x1_SN_LDSB0_AFC1_AFEM1_AFEM1_ASEM1_CLR1_CADS0_DTLA0_DTLB0_DTVA1_DTVB1_EPS0_FDSI0_GRPM1_GRVWA8_GRVWB8_GSU1_GSUAMB_GSUC0_GSUWGMRR0_GLS0_ISA1201_IU1_K1_LBSPPA0_LBSPPB0_LBSPPM0_LPA0_LPB0_LPM0_LRVW8_LWPMn1_MIAV1_MIWT1_1_MO40_NTn1_NTA0_NTB0_NTC0_NTD0_NTM0_NEPBS0_NLCA1_NLCB1_ONLL0_PGR1_PLR0_PKA0_SIA3_SS0_SU32_SUM1_SUS256_SPO0_SRVW0_SSO0_SVW8_SK0_SKXCCM0_TLDS0_ULSGRO0_USL1_UIOFGRO0_USFGROn1_VSn1_VWA1_VWB1_WSGRA0_WSGRB0_WS32_WG16_4_1_WGM8_WGMXCC1_WGMXCCGn1
    SolutionIndex: 53
    SolutionNameMin: Cijk_Ailk_Bjlk_I8BH_SHB_HA_S_SCD_SAV_UserArgs_MT32x16x32_MI16x16x1_SN_LDSB1_AFC1_AFEM1_AFEM1_ASEM1_CLR1_CADS0_DTLA0_DTLB0_DTVA0_DTVB0_EPS1_FDSI0_GRPM1_GRVWA1_GRVWB1_GSU1_GSUAMB_GSUC0_GSUWGMRR0_GLS0_ISA1201_IU2_K1_LBSPPA256_LBSPPB128_LBSPPM0_LPA16_LPB16_LPM0_LRVW8_LWPMn1_MIAV1_MIWT1_1_MO40_NTn1_NTA0_NTB0_NTC0_NTD0_NTM0_NEPBS0_NLCA1_NLCB1_ONLL0_PGR1_PLR1_PKA0_SIA2_SS0_SU32_SUM1_SUS256_SPO0_SRVW0_SSO0_SVW8_SK0_SKXCCM0_TLDS0_ULSGRO0_USL1_UIOFGRO0_USFGROn1_VSn1_VWA1_VWB1_WSGRA0_WSGRB0_WS32_WG32_2_1_WGM8_WGMXCC1_WGMXCCGn1
    SolutionIndex: 54
    SolutionNameMin: Cijk_Ailk_Bjlk_I8BH_SHB_HA_S_SCD_SAV_UserArgs_MT32x16x32_MI16x16x1_SN_LDSB0_AFC1_AFEM1_AFEM1_ASEM1_CLR1_CADS0_DTLA0_DTLB0_DTVA0_DTVB0_EPS0_FDSI0_GRPM1_GRVWA4_GRVWB8_GSU1_GSUAMB_GSUC0_GSUWGMRR0_GLS0_ISA1201_IU1_K1_LBSPPA256_LBSPPB128_LBSPPM0_LPA16_LPB16_LPM0_LRVW8_LWPMn1_MIAV1_MIWT1_1_MO40_NTn1_NTA0_NTB0_NTC0_NTD0_NTM0_NEPBS0_NLCA1_NLCB1_ONLL0_PGR2_PLR1_PKA0_SIA3_SS0_SU32_SUM1_SUS256_SPO0_SRVW0_SSO0_SVW8_SK0_SKXCCM0_TLDS0_ULSGRO1_USL1_UIOFGRO0_USFGROn1_VSn1_VWA1_VWB1_WSGRA0_WSGRB0_WS32_WG32_2_1_WGM8_WGMXCC1_WGMXCCGn1
    SolutionIndex: 55
    SolutionNameMin: Cijk_Ailk_Bjlk_I8BH_SHB_HA_S_SCD_SAV_UserArgs_MT32x16x32_MI16x16x1_SN_LDSB0_AFC1_AFEM1_AFEM1_ASEM1_CLR1_CADS0_DTLA0_DTLB0_DTVA1_DTVB0_EPS0_FDSI0_GRPM1_GRVWA8_GRVWB8_GSU1_GSUAMB_GSUC0_GSUWGMRR0_GLS0_ISA1201_IU1_K1_LBSPPA0_LBSPPB128_LBSPPM0_LPA0_LPB16_LPM0_LRVW8_LWPMn1_MIAV1_MIWT1_1_MO40_NTn1_NTA0_NTB0_NTC0_NTD0_NTM0_NEPBS0_NLCA1_NLCB1_ONLL0_PGR2_PLR1_PKA0_SIA3_SS0_SU32_SUM1_SUS256_SPO0_SRVW0_SSO0_SVW8_SK0_SKXCCM0_TLDS0_ULSGRO0_USL1_UIOFGRO0_USFGROn1_VSn1_VWA1_VWB1_WSGRA0_WSGRB0_WS32_WG32_2_1_WGM8_WGMXCC1_WGMXCCGn1
    SolutionIndex: 56
    SolutionNameMin: Cijk_Ailk_Bjlk_I8BH_SHB_HA_S_SCD_SAV_UserArgs_MT128x64x32_MI16x16x1_SN_LDSB0_AFC1_AFEM1_AFEM1_ASEM1_CLR1_CADS0_DTLA0_DTLB0_DTVA1_DTVB0_EPS1_FDSI0_GRPM1_GRVWA8_GRVWB1_GSU1_GSUAMB_GSUC0_GSUWGMRR0_GLS0_ISA1201_IU1_K1_LBSPPA0_LBSPPB512_LBSPPM0_LPA0_LPB16_LPM0_LRVW8_LWPMn1_MIAV1_MIWT8_1_MO40_NTn1_NTA0_NTB0_NTC0_NTD0_NTM0_NEPBS0_NLCA2_NLCB1_ONLL0_PGR1_PLR1_PKA0_SIA3_SS0_SU32_SUM1_SUS256_SPO0_SRVW0_SSO0_SVW8_SK0_SKXCCM0_TLDS0_ULSGRO0_USL1_UIOFGRO0_USFGROn1_VSn1_VWA1_VWB1_WSGRA0_WSGRB0_WS32_WG16_8_1_WGM8_WGMXCC1_WGMXCCGn1
    SolutionIndex: 57
    SolutionNameMin: Cijk_Ailk_Bjlk_I8BH_SHB_HA_S_SCD_SAV_UserArgs_MT128x64x32_MI16x16x1_SN_LDSB0_AFC1_AFEM1_AFEM1_ASEM1_CLR1_CADS0_DTLA0_DTLB0_DTVA1_DTVB0_EPS1_FDSI0_GRPM1_GRVWA8_GRVWB4_GSU1_GSUAMB_GSUC0_GSUWGMRR0_GLS0_ISA1201_IU1_K1_LBSPPA0_LBSPPB512_LBSPPM0_LPA0_LPB16_LPM0_LRVW8_LWPMn1_MIAV1_MIWT8_1_MO40_NTn1_NTA0_NTB0_NTC0_NTD0_NTM0_NEPBS0_NLCA2_NLCB1_ONLL0_PGR1_PLR1_PKA0_SIA3_SS0_SU32_SUM1_SUS256_SPO0_SRVW0_SSO0_SVW8_SK0_SKXCCM0_TLDS0_ULSGRO0_USL1_UIOFGRO0_USFGROn1_VSn1_VWA1_VWB1_WSGRA0_WSGRB0_WS32_WG16_8_1_WGM8_WGMXCC1_WGMXCCGn1
    SolutionIndex: 58
    SolutionNameMin: Cijk_Ailk_Bjlk_I8BH_SHB_HA_S_SCD_SAV_UserArgs_MT128x64x32_MI16x16x1_SN_LDSB0_AFC1_AFEM1_AFEM1_ASEM1_CLR1_CADS0_DTLA0_DTLB0_DTVA1_DTVB0_EPS1_FDSI0_GRPM1_GRVWA8_GRVWB8_GSU1_GSUAMB_GSUC0_GSUWGMRR0_GLS0_ISA1201_IU1_K1_LBSPPA0_LBSPPB512_LBSPPM0_LPA0_LPB16_LPM0_LRVW8_LWPMn1_MIAV1_MIWT8_1_MO40_NTn1_NTA0_NTB0_NTC0_NTD0_NTM0_NEPBS0_NLCA2_NLCB1_ONLL0_PGR1_PLR1_PKA0_SIA3_SS0_SU32_SUM1_SUS256_SPO0_SRVW0_SSO0_SVW8_SK0_SKXCCM0_TLDS0_ULSGRO0_USL1_UIOFGRO0_USFGROn1_VSn1_VWA1_VWB1_WSGRA0_WSGRB0_WS32_WG16_8_1_WGM8_WGMXCC1_WGMXCCGn1
    SolutionIndex: 59
    SolutionNameMin: Cijk_Ailk_Bjlk_I8BH_SHB_HA_S_SCD_SAV_UserArgs_MT128x64x32_MI16x16x1_SN_LDSB0_AFC1_AFEM1_AFEM1_ASEM1_CLR1_CADS0_DTLA0_DTLB0_DTVA1_DTVB0_EPS1_FDSI0_GRPM1_GRVWA8_GRVWB16_GSU1_GSUAMB_GSUC0_GSUWGMRR0_GLS0_ISA1201_IU1_K1_LBSPPA0_LBSPPB512_LBSPPM0_LPA0_LPB16_LPM0_LRVW8_LWPMn1_MIAV1_MIWT8_1_MO40_NTn1_NTA0_NTB0_NTC0_NTD0_NTM0_NEPBS0_NLCA2_NLCB1_ONLL0_PGR1_PLR1_PKA0_SIA3_SS0_SU32_SUM1_SUS256_SPO0_SRVW0_SSO0_SVW8_SK0_SKXCCM0_TLDS0_ULSGRO0_USL1_UIOFGRO0_USFGROn1_VSn1_VWA1_VWB1_WSGRA0_WSGRB0_WS32_WG16_8_1_WGM8_WGMXCC1_WGMXCCGn1
    SolutionIndex: 60
    SolutionNameMin: Cijk_Ailk_Bjlk_I8BH_SHB_HA_S_SCD_SAV_UserArgs_MT128x64x32_MI16x16x1_SN_LDSB0_AFC1_AFEM1_AFEM1_ASEM1_CLR1_CADS0_DTLA0_DTLB0_DTVA1_DTVB0_EPS0_FDSI0_GRPM1_GRVWA8_GRVWB4_GSU1_GSUAMB_GSUC0_GSUWGMRR0_GLS0_ISA1201_IU1_K1_LBSPPA0_LBSPPB512_LBSPPM0_LPA0_LPB16_LPM0_LRVW8_LWPMn1_MIAV1_MIWT8_1_MO40_NTn1_NTA0_NTB0_NTC0_NTD0_NTM0_NEPBS0_NLCA2_NLCB1_ONLL0_PGR2_PLR1_PKA0_SIA3_SS0_SU32_SUM1_SUS256_SPO0_SRVW0_SSO0_SVW8_SK0_SKXCCM0_TLDS0_ULSGRO0_USL1_UIOFGRO0_USFGROn1_VSn1_VWA1_VWB1_WSGRA0_WSGRB0_WS32_WG16_8_1_WGM8_WGMXCC1_WGMXCCGn1
    SolutionIndex: 61
    SolutionNameMin: Cijk_Ailk_Bjlk_I8BH_SHB_HA_S_SCD_SAV_UserArgs_MT128x64x32_MI16x16x1_SN_LDSB0_AFC1_AFEM1_AFEM1_ASEM1_CLR1_CADS0_DTLA0_DTLB0_DTVA1_DTVB0_EPS0_FDSI0_GRPM1_GRVWA8_GRVWB8_GSU1_GSUAMB_GSUC0_GSUWGMRR0_GLS0_ISA1201_IU1_K1_LBSPPA0_LBSPPB512_LBSPPM0_LPA0_LPB16_LPM0_LRVW8_LWPMn1_MIAV1_MIWT8_1_MO40_NTn1_NTA0_NTB0_NTC0_NTD0_NTM0_NEPBS0_NLCA2_NLCB1_ONLL0_PGR2_PLR1_PKA0_SIA3_SS0_SU32_SUM1_SUS256_SPO0_SRVW0_SSO0_SVW8_SK0_SKXCCM0_TLDS0_ULSGRO0_USL1_UIOFGRO0_USFGROn1_VSn1_VWA1_VWB1_WSGRA0_WSGRB0_WS32_WG16_8_1_WGM8_WGMXCC1_WGMXCCGn1
    SolutionIndex: 62
    SolutionNameMin: Cijk_Ailk_Bjlk_I8BH_SHB_HA_S_SCD_SAV_UserArgs_MT128x64x32_MI16x16x1_SN_LDSB0_AFC1_AFEM1_AFEM1_ASEM1_CLR1_CADS0_DTLA0_DTLB0_DTVA1_DTVB0_EPS0_FDSI0_GRPM1_GRVWA8_GRVWB16_GSU1_GSUAMB_GSUC0_GSUWGMRR0_GLS0_ISA1201_IU1_K1_LBSPPA0_LBSPPB512_LBSPPM0_LPA0_LPB16_LPM0_LRVW8_LWPMn1_MIAV1_MIWT8_1_MO40_NTn1_NTA0_NTB0_NTC0_NTD0_NTM0_NEPBS0_NLCA2_NLCB1_ONLL0_PGR2_PLR1_PKA0_SIA3_SS0_SU32_SUM1_SUS256_SPO0_SRVW0_SSO0_SVW8_SK0_SKXCCM0_TLDS0_ULSGRO0_USL1_UIOFGRO0_USFGROn1_VSn1_VWA1_VWB1_WSGRA0_WSGRB0_WS32_WG16_8_1_WGM8_WGMXCC1_WGMXCCGn1
    SolutionIndex: 63
    SolutionNameMin: Cijk_Ailk_Bjlk_I8BH_SHB_HA_S_SCD_SAV_UserArgs_MT128x64x32_MI16x16x1_SN_LDSB0_AFC1_AFEM1_AFEM1_ASEM1_CLR1_CADS0_DTLA0_DTLB0_DTVA1_DTVB1_EPS0_FDSI0_GRPM1_GRVWA8_GRVWB8_GSU1_GSUAMB_GSUC0_GSUWGMRR0_GLS0_ISA1201_IU1_K1_LBSPPA0_LBSPPB0_LBSPPM0_LPA0_LPB0_LPM0_LRVW8_LWPMn1_MIAV1_MIWT8_1_MO40_NTn1_NTA0_NTB0_NTC0_NTD0_NTM0_NEPBS0_NLCA2_NLCB1_ONLL0_PGR1_PLR0_PKA0_SIA3_SS0_SU32_SUM1_SUS256_SPO0_SRVW0_SSO0_SVW8_SK0_SKXCCM0_TLDS0_ULSGRO0_USL1_UIOFGRO0_USFGROn1_VSn1_VWA1_VWB1_WSGRA0_WSGRB0_WS32_WG16_8_1_WGM8_WGMXCC1_WGMXCCGn1
    SolutionIndex: 64
    SolutionNameMin: Cijk_Ailk_Bjlk_I8BH_SHB_HA_S_SCD_SAV_UserArgs_MT128x32x32_MI16x16x1_SN_LDSB0_AFC1_AFEM1_AFEM1_ASEM1_CLR1_CADS0_DTLA0_DTLB0_DTVA1_DTVB0_EPS1_FDSI0_GRPM1_GRVWA8_GRVWB1_GSU1_GSUAMB_GSUC0_GSUWGMRR0_GLS0_ISA1201_IU1_K1_LBSPPA0_LBSPPB256_LBSPPM0_LPA0_LPB16_LPM0_LRVW8_LWPMn1_MIAV1_MIWT4_1_MO40_NTn1_NTA0_NTB0_NTC0_NTD0_NTM0_NEPBS0_NLCA2_NLCB1_ONLL0_PGR1_PLR1_PKA0_SIA3_SS0_SU32_SUM1_SUS256_SPO0_SRVW0_SSO0_SVW8_SK0_SKXCCM0_TLDS0_ULSGRO0_USL1_UIOFGRO0_USFGROn1_VSn1_VWA1_VWB1_WSGRA0_WSGRB0_WS32_WG32_4_1_WGM8_WGMXCC1_WGMXCCGn1
    SolutionIndex: 65
    SolutionNameMin: Cijk_Ailk_Bjlk_I8BH_SHB_HA_S_SCD_SAV_UserArgs_MT128x32x32_MI16x16x1_SN_LDSB0_AFC1_AFEM1_AFEM1_ASEM1_CLR1_CADS0_DTLA0_DTLB0_DTVA1_DTVB0_EPS1_FDSI0_GRPM1_GRVWA8_GRVWB4_GSU1_GSUAMB_GSUC0_GSUWGMRR0_GLS0_ISA1201_IU1_K1_LBSPPA0_LBSPPB256_LBSPPM0_LPA0_LPB16_LPM0_LRVW8_LWPMn1_MIAV1_MIWT4_1_MO40_NTn1_NTA0_NTB0_NTC0_NTD0_NTM0_NEPBS0_NLCA2_NLCB1_ONLL0_PGR1_PLR1_PKA0_SIA3_SS0_SU32_SUM1_SUS256_SPO0_SRVW0_SSO0_SVW8_SK0_SKXCCM0_TLDS0_ULSGRO0_USL1_UIOFGRO0_USFGROn1_VSn1_VWA1_VWB1_WSGRA0_WSGRB0_WS32_WG32_4_1_WGM8_WGMXCC1_WGMXCCGn1
    SolutionIndex: 66
    SolutionNameMin: Cijk_Ailk_Bjlk_I8BH_SHB_HA_S_SCD_SAV_UserArgs_MT128x32x32_MI16x16x1_SN_LDSB0_AFC1_AFEM1_AFEM1_ASEM1_CLR1_CADS0_DTLA0_DTLB0_DTVA1_DTVB0_EPS0_FDSI0_GRPM1_GRVWA8_GRVWB1_GSU1_GSUAMB_GSUC0_GSUWGMRR0_GLS0_ISA1201_IU1_K1_LBSPPA0_LBSPPB256_LBSPPM0_LPA0_LPB16_LPM0_LRVW8_LWPMn1_MIAV1_MIWT4_1_MO40_NTn1_NTA0_NTB0_NTC0_NTD0_NTM0_NEPBS0_NLCA2_NLCB1_ONLL0_PGR2_PLR1_PKA0_SIA3_SS0_SU32_SUM1_SUS256_SPO0_SRVW0_SSO0_SVW8_SK0_SKXCCM0_TLDS0_ULSGRO0_USL1_UIOFGRO0_USFGROn1_VSn1_VWA1_VWB1_WSGRA0_WSGRB0_WS32_WG32_4_1_WGM8_WGMXCC1_WGMXCCGn1
    SolutionIndex: 67
    SolutionNameMin: Cijk_Ailk_Bjlk_I8BH_SHB_HA_S_SCD_SAV_UserArgs_MT128x32x32_MI16x16x1_SN_LDSB0_AFC1_AFEM1_AFEM1_ASEM1_CLR1_CADS0_DTLA0_DTLB0_DTVA1_DTVB0_EPS0_FDSI0_GRPM1_GRVWA8_GRVWB4_GSU1_GSUAMB_GSUC0_GSUWGMRR0_GLS0_ISA1201_IU1_K1_LBSPPA0_LBSPPB256_LBSPPM0_LPA0_LPB16_LPM0_LRVW8_LWPMn1_MIAV1_MIWT4_1_MO40_NTn1_NTA0_NTB0_NTC0_NTD0_NTM0_NEPBS0_NLCA2_NLCB1_ONLL0_PGR2_PLR1_PKA0_SIA3_SS0_SU32_SUM1_SUS256_SPO0_SRVW0_SSO0_SVW8_SK0_SKXCCM0_TLDS0_ULSGRO0_USL1_UIOFGRO0_USFGROn1_VSn1_VWA1_VWB1_WSGRA0_WSGRB0_WS32_WG32_4_1_WGM8_WGMXCC1_WGMXCCGn1
    SolutionIndex: 68
    SolutionNameMin: Cijk_Ailk_Bjlk_I8BH_SHB_HA_S_SCD_SAV_UserArgs_MT128x32x32_MI16x16x1_SN_LDSB0_AFC1_AFEM1_AFEM1_ASEM1_CLR1_CADS0_DTLA0_DTLB0_DTVA1_DTVB0_EPS0_FDSI0_GRPM1_GRVWA8_GRVWB8_GSU1_GSUAMB_GSUC0_GSUWGMRR0_GLS0_ISA1201_IU1_K1_LBSPPA0_LBSPPB256_LBSPPM0_LPA0_LPB16_LPM0_LRVW8_LWPMn1_MIAV1_MIWT4_1_MO40_NTn1_NTA0_NTB0_NTC0_NTD0_NTM0_NEPBS0_NLCA2_NLCB1_ONLL0_PGR2_PLR1_PKA0_SIA3_SS0_SU32_SUM1_SUS256_SPO0_SRVW0_SSO0_SVW8_SK0_SKXCCM0_TLDS0_ULSGRO0_USL1_UIOFGRO0_USFGROn1_VSn1_VWA1_VWB1_WSGRA0_WSGRB0_WS32_WG32_4_1_WGM8_WGMXCC1_WGMXCCGn1
    SolutionIndex: 69
    SolutionNameMin: Cijk_Ailk_Bjlk_I8BH_SHB_HA_S_SCD_SAV_UserArgs_MT128x32x32_MI16x16x1_SN_LDSB0_AFC1_AFEM1_AFEM1_ASEM1_CLR1_CADS0_DTLA0_DTLB0_DTVA1_DTVB1_EPS0_FDSI0_GRPM1_GRVWA8_GRVWB8_GSU1_GSUAMB_GSUC0_GSUWGMRR0_GLS0_ISA1201_IU1_K1_LBSPPA0_LBSPPB0_LBSPPM0_LPA0_LPB0_LPM0_LRVW8_LWPMn1_MIAV1_MIWT4_1_MO40_NTn1_NTA0_NTB0_NTC0_NTD0_NTM0_NEPBS0_NLCA2_NLCB1_ONLL0_PGR1_PLR0_PKA0_SIA3_SS0_SU32_SUM1_SUS256_SPO0_SRVW0_SSO0_SVW8_SK0_SKXCCM0_TLDS0_ULSGRO0_USL1_UIOFGRO0_USFGROn1_VSn1_VWA1_VWB1_WSGRA0_WSGRB0_WS32_WG32_4_1_WGM8_WGMXCC1_WGMXCCGn1
    SolutionIndex: 70
    SolutionNameMin: Cijk_Ailk_Bjlk_I8BH_SHB_HA_S_SCD_SAV_UserArgs_MT512x16x32_MI16x16x1_SN_LDSB0_AFC1_AFEM1_AFEM1_ASEM1_CLR1_CADS0_DTLA0_DTLB0_DTVA1_DTVB0_EPS1_FDSI0_GRPM1_GRVWA8_GRVWB1_GSU1_GSUAMB_GSUC0_GSUWGMRR0_GLS0_ISA1201_IU1_K1_LBSPPA0_LBSPPB128_LBSPPM0_LPA0_LPB16_LPM0_LRVW8_LWPMn1_MIAV1_MIWT8_1_MO40_NTn1_NTA0_NTB0_NTC0_NTD0_NTM0_NEPBS0_NLCA2_NLCB1_ONLL0_PGR1_PLR1_PKA0_SIA3_SS0_SU32_SUM1_SUS256_SPO0_SRVW0_SSO0_SVW8_SK0_SKXCCM0_TLDS0_ULSGRO0_USL1_UIOFGRO0_USFGROn1_VSn1_VWA1_VWB1_WSGRA0_WSGRB0_WS32_WG64_2_1_WGM8_WGMXCC1_WGMXCCGn1
    SolutionIndex: 71
    SolutionNameMin: Cijk_Ailk_Bjlk_I8BH_SHB_HA_S_SCD_SAV_UserArgs_MT512x16x32_MI16x16x1_SN_LDSB0_AFC1_AFEM1_AFEM1_ASEM1_CLR1_CADS0_DTLA0_DTLB0_DTVA1_DTVB0_EPS1_FDSI0_GRPM1_GRVWA8_GRVWB4_GSU1_GSUAMB_GSUC0_GSUWGMRR0_GLS0_ISA1201_IU1_K1_LBSPPA0_LBSPPB128_LBSPPM0_LPA0_LPB16_LPM0_LRVW8_LWPMn1_MIAV1_MIWT8_1_MO40_NTn1_NTA0_NTB0_NTC0_NTD0_NTM0_NEPBS0_NLCA2_NLCB1_ONLL0_PGR1_PLR1_PKA0_SIA3_SS0_SU32_SUM1_SUS256_SPO0_SRVW0_SSO0_SVW8_SK0_SKXCCM0_TLDS0_ULSGRO0_USL1_UIOFGRO0_USFGROn1_VSn1_VWA1_VWB1_WSGRA0_WSGRB0_WS32_WG64_2_1_WGM8_WGMXCC1_WGMXCCGn1
    SolutionIndex: 72
    SolutionNameMin: Cijk_Ailk_Bjlk_I8BH_SHB_HA_S_SCD_SAV_UserArgs_MT16x512x32_MI16x16x1_SN_LDSB0_AFC1_AFEM1_AFEM1_ASEM1_CLR1_CADS0_DTLA0_DTLB0_DTVA0_DTVB1_EPS1_FDSI0_GRPM1_GRVWA1_GRVWB8_GSU1_GSUAMB_GSUC0_GSUWGMRR0_GLS0_ISA1201_IU1_K1_LBSPPA128_LBSPPB0_LBSPPM0_LPA16_LPB0_LPM0_LRVW8_LWPMn1_MIAV1_MIWT1_8_MO40_NTn1_NTA0_NTB0_NTC0_NTD0_NTM0_NEPBS0_NLCA1_NLCB2_ONLL0_PGR1_PLR1_PKA0_SIA3_SS0_SU32_SUM1_SUS256_SPO0_SRVW0_SSO0_SVW8_SK0_SKXCCM0_TLDS0_ULSGRO0_USL1_UIOFGRO0_USFGROn1_VSn1_VWA1_VWB1_WSGRA0_WSGRB0_WS32_WG16_8_1_WGM8_WGMXCC1_WGMXCCGn1
    SolutionIndex: 73
    SolutionNameMin: Cijk_Ailk_Bjlk_I8BH_SHB_HA_S_SCD_SAV_UserArgs_MT16x512x32_MI16x16x1_SN_LDSB0_AFC1_AFEM1_AFEM1_ASEM1_CLR1_CADS0_DTLA0_DTLB0_DTVA0_DTVB1_EPS1_FDSI0_GRPM1_GRVWA4_GRVWB8_GSU1_GSUAMB_GSUC0_GSUWGMRR0_GLS0_ISA1201_IU1_K1_LBSPPA128_LBSPPB0_LBSPPM0_LPA16_LPB0_LPM0_LRVW8_LWPMn1_MIAV1_MIWT1_8_MO40_NTn1_NTA0_NTB0_NTC0_NTD0_NTM0_NEPBS0_NLCA1_NLCB2_ONLL0_PGR1_PLR1_PKA0_SIA3_SS0_SU32_SUM1_SUS256_SPO0_SRVW0_SSO0_SVW8_SK0_SKXCCM0_TLDS0_ULSGRO0_USL1_UIOFGRO0_USFGROn1_VSn1_VWA1_VWB1_WSGRA0_WSGRB0_WS32_WG16_8_1_WGM8_WGMXCC1_WGMXCCGn1
    SolutionIndex: 74
    SolutionNameMin: Cijk_Ailk_Bjlk_I8BH_SHB_HA_S_SCD_SAV_UserArgs_MT16x512x32_MI16x16x1_SN_LDSB0_AFC1_AFEM1_AFEM1_ASEM1_CLR1_CADS0_DTLA0_DTLB0_DTVA0_DTVB1_EPS0_FDSI0_GRPM1_GRVWA1_GRVWB8_GSU1_GSUAMB_GSUC0_GSUWGMRR0_GLS0_ISA1201_IU1_K1_LBSPPA128_LBSPPB0_LBSPPM0_LPA16_LPB0_LPM0_LRVW8_LWPMn1_MIAV1_MIWT1_8_MO40_NTn1_NTA0_NTB0_NTC0_NTD0_NTM0_NEPBS0_NLCA1_NLCB2_ONLL0_PGR2_PLR1_PKA0_SIA3_SS0_SU32_SUM1_SUS256_SPO0_SRVW0_SSO0_SVW8_SK0_SKXCCM0_TLDS0_ULSGRO0_USL1_UIOFGRO0_USFGROn1_VSn1_VWA1_VWB1_WSGRA0_WSGRB0_WS32_WG16_8_1_WGM8_WGMXCC1_WGMXCCGn1
    SolutionIndex: 75
    SolutionNameMin: Cijk_Ailk_Bjlk_I8BH_SHB_HA_S_SCD_SAV_UserArgs_MT16x512x32_MI16x16x1_SN_LDSB0_AFC1_AFEM1_AFEM1_ASEM1_CLR1_CADS0_DTLA0_DTLB0_DTVA0_DTVB1_EPS0_FDSI0_GRPM1_GRVWA4_GRVWB8_GSU1_GSUAMB_GSUC0_GSUWGMRR0_GLS0_ISA1201_IU1_K1_LBSPPA128_LBSPPB0_LBSPPM0_LPA16_LPB0_LPM0_LRVW8_LWPMn1_MIAV1_MIWT1_8_MO40_NTn1_NTA0_NTB0_NTC0_NTD0_NTM0_NEPBS0_NLCA1_NLCB2_ONLL0_PGR2_PLR1_PKA0_SIA3_SS0_SU32_SUM1_SUS256_SPO0_SRVW0_SSO0_SVW8_SK0_SKXCCM0_TLDS0_ULSGRO0_USL1_UIOFGRO0_USFGROn1_VSn1_VWA1_VWB1_WSGRA0_WSGRB0_WS32_WG16_8_1_WGM8_WGMXCC1_WGMXCCGn1
    SolutionIndex: 76
    SolutionNameMin: Cijk_Ailk_Bjlk_I8BH_SHB_HA_S_SCD_SAV_UserArgs_MT16x512x32_MI16x16x1_SN_LDSB0_AFC1_AFEM1_AFEM1_ASEM1_CLR1_CADS0_DTLA0_DTLB0_DTVA1_DTVB1_EPS0_FDSI0_GRPM1_GRVWA8_GRVWB8_GSU1_GSUAMB_GSUC0_GSUWGMRR0_GLS0_ISA1201_IU1_K1_LBSPPA0_LBSPPB0_LBSPPM0_LPA0_LPB0_LPM0_LRVW8_LWPMn1_MIAV1_MIWT1_8_MO40_NTn1_NTA0_NTB0_NTC0_NTD0_NTM0_NEPBS0_NLCA1_NLCB2_ONLL0_PGR1_PLR0_PKA0_SIA3_SS0_SU32_SUM1_SUS256_SPO0_SRVW0_SSO0_SVW8_SK0_SKXCCM0_TLDS0_ULSGRO0_USL1_UIOFGRO0_USFGROn1_VSn1_VWA1_VWB1_WSGRA0_WSGRB0_WS32_WG16_8_1_WGM8_WGMXCC1_WGMXCCGn1
    SolutionIndex: 77
    SolutionNameMin: Cijk_Ailk_Bjlk_I8BH_SHB_HA_S_SCD_SAV_UserArgs_MT32x128x32_MI16x16x1_SN_LDSB0_AFC1_AFEM1_AFEM1_ASEM1_CLR1_CADS0_DTLA0_DTLB0_DTVA0_DTVB1_EPS1_FDSI0_GRPM1_GRVWA1_GRVWB8_GSU1_GSUAMB_GSUC0_GSUWGMRR0_GLS0_ISA1201_IU1_K1_LBSPPA256_LBSPPB0_LBSPPM0_LPA16_LPB0_LPM0_LRVW8_LWPMn1_MIAV1_MIWT1_4_MO40_NTn1_NTA0_NTB0_NTC0_NTD0_NTM0_NEPBS0_NLCA1_NLCB2_ONLL0_PGR1_PLR1_PKA0_SIA3_SS0_SU32_SUM1_SUS256_SPO0_SRVW0_SSO0_SVW8_SK0_SKXCCM0_TLDS0_ULSGRO0_USL1_UIOFGRO0_USFGROn1_VSn1_VWA1_VWB1_WSGRA0_WSGRB0_WS32_WG32_4_1_WGM8_WGMXCC1_WGMXCCGn1
    SolutionIndex: 78
    SolutionNameMin: Cijk_Ailk_Bjlk_I8BH_SHB_HA_S_SCD_SAV_UserArgs_MT32x128x32_MI16x16x1_SN_LDSB0_AFC1_AFEM1_AFEM1_ASEM1_CLR1_CADS0_DTLA0_DTLB0_DTVA0_DTVB1_EPS1_FDSI0_GRPM1_GRVWA4_GRVWB8_GSU1_GSUAMB_GSUC0_GSUWGMRR0_GLS0_ISA1201_IU1_K1_LBSPPA256_LBSPPB0_LBSPPM0_LPA16_LPB0_LPM0_LRVW8_LWPMn1_MIAV1_MIWT1_4_MO40_NTn1_NTA0_NTB0_NTC0_NTD0_NTM0_NEPBS0_NLCA1_NLCB2_ONLL0_PGR1_PLR1_PKA0_SIA3_SS0_SU32_SUM1_SUS256_SPO0_SRVW0_SSO0_SVW8_SK0_SKXCCM0_TLDS0_ULSGRO0_USL1_UIOFGRO0_USFGROn1_VSn1_VWA1_VWB1_WSGRA0_WSGRB0_WS32_WG32_4_1_WGM8_WGMXCC1_WGMXCCGn1
    SolutionIndex: 79
    SolutionNameMin: Cijk_Ailk_Bjlk_I8BH_SHB_HA_S_SCD_SAV_UserArgs_MT32x128x32_MI16x16x1_SN_LDSB0_AFC1_AFEM1_AFEM1_ASEM1_CLR1_CADS0_DTLA0_DTLB0_DTVA0_DTVB1_EPS0_FDSI0_GRPM1_GRVWA4_GRVWB8_GSU1_GSUAMB_GSUC0_GSUWGMRR0_GLS0_ISA1201_IU1_K1_LBSPPA256_LBSPPB0_LBSPPM0_LPA16_LPB0_LPM0_LRVW8_LWPMn1_MIAV1_MIWT1_4_MO40_NTn1_NTA0_NTB0_NTC0_NTD0_NTM0_NEPBS0_NLCA1_NLCB2_ONLL0_PGR2_PLR1_PKA0_SIA3_SS0_SU32_SUM1_SUS256_SPO0_SRVW0_SSO0_SVW8_SK0_SKXCCM0_TLDS0_ULSGRO0_USL1_UIOFGRO0_USFGROn1_VSn1_VWA1_VWB1_WSGRA0_WSGRB0_WS32_WG32_4_1_WGM8_WGMXCC1_WGMXCCGn1
    SolutionIndex: 80
    SolutionNameMin: Cijk_Ailk_Bjlk_I8BH_SHB_HA_S_SCD_SAV_UserArgs_MT32x128x32_MI16x16x1_SN_LDSB0_AFC1_AFEM1_AFEM1_ASEM1_CLR1_CADS0_DTLA0_DTLB0_DTVA0_DTVB1_EPS0_FDSI0_GRPM1_GRVWA8_GRVWB8_GSU1_GSUAMB_GSUC0_GSUWGMRR0_GLS0_ISA1201_IU1_K1_LBSPPA256_LBSPPB0_LBSPPM0_LPA16_LPB0_LPM0_LRVW8_LWPMn1_MIAV1_MIWT1_4_MO40_NTn1_NTA0_NTB0_NTC0_NTD0_NTM0_NEPBS0_NLCA1_NLCB2_ONLL0_PGR2_PLR1_PKA0_SIA3_SS0_SU32_SUM1_SUS256_SPO0_SRVW0_SSO0_SVW8_SK0_SKXCCM0_TLDS0_ULSGRO0_USL1_UIOFGRO0_USFGROn1_VSn1_VWA1_VWB1_WSGRA0_WSGRB0_WS32_WG32_4_1_WGM8_WGMXCC1_WGMXCCGn1
    SolutionIndex: 81
    SolutionNameMin: Cijk_Ailk_Bjlk_I8BH_SHB_HA_S_SCD_SAV_UserArgs_MT32x128x32_MI16x16x1_SN_LDSB0_AFC1_AFEM1_AFEM1_ASEM1_CLR1_CADS0_DTLA0_DTLB0_DTVA1_DTVB1_EPS0_FDSI0_GRPM1_GRVWA8_GRVWB8_GSU1_GSUAMB_GSUC0_GSUWGMRR0_GLS0_ISA1201_IU1_K1_LBSPPA0_LBSPPB0_LBSPPM0_LPA0_LPB0_LPM0_LRVW8_LWPMn1_MIAV1_MIWT1_4_MO40_NTn1_NTA0_NTB0_NTC0_NTD0_NTM0_NEPBS0_NLCA1_NLCB2_ONLL0_PGR1_PLR0_PKA0_SIA3_SS0_SU32_SUM1_SUS256_SPO0_SRVW0_SSO0_SVW8_SK0_SKXCCM0_TLDS0_ULSGRO0_USL1_UIOFGRO0_USFGROn1_VSn1_VWA1_VWB1_WSGRA0_WSGRB0_WS32_WG32_4_1_WGM8_WGMXCC1_WGMXCCGn1
    SolutionIndex: 82
    SolutionNameMin: Cijk_Ailk_Bjlk_I8BH_SHB_HA_S_SCD_SAV_UserArgs_MT64x128x32_MI16x16x1_SN_LDSB0_AFC1_AFEM1_AFEM1_ASEM1_CLR1_CADS0_DTLA0_DTLB0_DTVA0_DTVB1_EPS1_FDSI0_GRPM1_GRVWA1_GRVWB8_GSU1_GSUAMB_GSUC0_GSUWGMRR0_GLS0_ISA1201_IU1_K1_LBSPPA512_LBSPPB0_LBSPPM0_LPA16_LPB0_LPM0_LRVW8_LWPMn1_MIAV1_MIWT1_8_MO40_NTn1_NTA0_NTB0_NTC0_NTD0_NTM0_NEPBS0_NLCA1_NLCB2_ONLL0_PGR1_PLR1_PKA0_SIA3_SS0_SU32_SUM1_SUS256_SPO0_SRVW0_SSO0_SVW8_SK0_SKXCCM0_TLDS0_ULSGRO0_USL1_UIOFGRO0_USFGROn1_VSn1_VWA1_VWB1_WSGRA0_WSGRB0_WS32_WG64_2_1_WGM8_WGMXCC1_WGMXCCGn1
    SolutionIndex: 83
    SolutionNameMin: Cijk_Ailk_Bjlk_I8BH_SHB_HA_S_SCD_SAV_UserArgs_MT64x128x32_MI16x16x1_SN_LDSB0_AFC1_AFEM1_AFEM1_ASEM1_CLR1_CADS0_DTLA0_DTLB0_DTVA0_DTVB1_EPS1_FDSI0_GRPM1_GRVWA4_GRVWB8_GSU1_GSUAMB_GSUC0_GSUWGMRR0_GLS0_ISA1201_IU1_K1_LBSPPA512_LBSPPB0_LBSPPM0_LPA16_LPB0_LPM0_LRVW8_LWPMn1_MIAV1_MIWT1_8_MO40_NTn1_NTA0_NTB0_NTC0_NTD0_NTM0_NEPBS0_NLCA1_NLCB2_ONLL0_PGR1_PLR1_PKA0_SIA3_SS0_SU32_SUM1_SUS256_SPO0_SRVW0_SSO0_SVW8_SK0_SKXCCM0_TLDS0_ULSGRO0_USL1_UIOFGRO0_USFGROn1_VSn1_VWA1_VWB1_WSGRA0_WSGRB0_WS32_WG64_2_1_WGM8_WGMXCC1_WGMXCCGn1
    SolutionIndex: 84
    SolutionNameMin: Cijk_Ailk_Bjlk_I8BH_SHB_HA_S_SCD_SAV_UserArgs_MT64x128x32_MI16x16x1_SN_LDSB0_AFC1_AFEM1_AFEM1_ASEM1_CLR1_CADS0_DTLA0_DTLB0_DTVA0_DTVB1_EPS1_FDSI0_GRPM1_GRVWA8_GRVWB8_GSU1_GSUAMB_GSUC0_GSUWGMRR0_GLS0_ISA1201_IU1_K1_LBSPPA512_LBSPPB0_LBSPPM0_LPA16_LPB0_LPM0_LRVW8_LWPMn1_MIAV1_MIWT1_8_MO40_NTn1_NTA0_NTB0_NTC0_NTD0_NTM0_NEPBS0_NLCA1_NLCB2_ONLL0_PGR1_PLR1_PKA0_SIA3_SS0_SU32_SUM1_SUS256_SPO0_SRVW0_SSO0_SVW8_SK0_SKXCCM0_TLDS0_ULSGRO0_USL1_UIOFGRO0_USFGROn1_VSn1_VWA1_VWB1_WSGRA0_WSGRB0_WS32_WG64_2_1_WGM8_WGMXCC1_WGMXCCGn1
    SolutionIndex: 85
    SolutionNameMin: Cijk_Ailk_Bjlk_I8BH_SHB_HA_S_SCD_SAV_UserArgs_MT64x128x32_MI16x16x1_SN_LDSB0_AFC1_AFEM1_AFEM1_ASEM1_CLR1_CADS0_DTLA0_DTLB0_DTVA0_DTVB1_EPS1_FDSI0_GRPM1_GRVWA16_GRVWB8_GSU1_GSUAMB_GSUC0_GSUWGMRR0_GLS0_ISA1201_IU1_K1_LBSPPA512_LBSPPB0_LBSPPM0_LPA16_LPB0_LPM0_LRVW8_LWPMn1_MIAV1_MIWT1_8_MO40_NTn1_NTA0_NTB0_NTC0_NTD0_NTM0_NEPBS0_NLCA1_NLCB2_ONLL0_PGR1_PLR1_PKA0_SIA3_SS0_SU32_SUM1_SUS256_SPO0_SRVW0_SSO0_SVW8_SK0_SKXCCM0_TLDS0_ULSGRO0_USL1_UIOFGRO0_USFGROn1_VSn1_VWA1_VWB1_WSGRA0_WSGRB0_WS32_WG64_2_1_WGM8_WGMXCC1_WGMXCCGn1
    SolutionIndex: 86
    SolutionNameMin: Cijk_Ailk_Bjlk_I8BH_SHB_HA_S_SCD_SAV_UserArgs_MT64x128x32_MI16x16x1_SN_LDSB0_AFC1_AFEM1_AFEM1_ASEM1_CLR1_CADS0_DTLA0_DTLB0_DTVA0_DTVB1_EPS0_FDSI0_GRPM1_GRVWA4_GRVWB8_GSU1_GSUAMB_GSUC0_GSUWGMRR0_GLS0_ISA1201_IU1_K1_LBSPPA512_LBSPPB0_LBSPPM0_LPA16_LPB0_LPM0_LRVW8_LWPMn1_MIAV1_MIWT1_8_MO40_NTn1_NTA0_NTB0_NTC0_NTD0_NTM0_NEPBS0_NLCA1_NLCB2_ONLL0_PGR2_PLR1_PKA0_SIA3_SS0_SU32_SUM1_SUS256_SPO0_SRVW0_SSO0_SVW8_SK0_SKXCCM0_TLDS0_ULSGRO0_USL1_UIOFGRO0_USFGROn1_VSn1_VWA1_VWB1_WSGRA0_WSGRB0_WS32_WG64_2_1_WGM8_WGMXCC1_WGMXCCGn1
    SolutionIndex: 87
    SolutionNameMin: Cijk_Ailk_Bjlk_I8BH_SHB_HA_S_SCD_SAV_UserArgs_MT64x128x32_MI16x16x1_SN_LDSB0_AFC1_AFEM1_AFEM1_ASEM1_CLR1_CADS0_DTLA0_DTLB0_DTVA0_DTVB1_EPS0_FDSI0_GRPM1_GRVWA8_GRVWB8_GSU1_GSUAMB_GSUC0_GSUWGMRR0_GLS0_ISA1201_IU1_K1_LBSPPA512_LBSPPB0_LBSPPM0_LPA16_LPB0_LPM0_LRVW8_LWPMn1_MIAV1_MIWT1_8_MO40_NTn1_NTA0_NTB0_NTC0_NTD0_NTM0_NEPBS0_NLCA1_NLCB2_ONLL0_PGR2_PLR1_PKA0_SIA3_SS0_SU32_SUM1_SUS256_SPO0_SRVW0_SSO0_SVW8_SK0_SKXCCM0_TLDS0_ULSGRO0_USL1_UIOFGRO0_USFGROn1_VSn1_VWA1_VWB1_WSGRA0_WSGRB0_WS32_WG64_2_1_WGM8_WGMXCC1_WGMXCCGn1
    SolutionIndex: 88
    SolutionNameMin: Cijk_Ailk_Bjlk_I8BH_SHB_HA_S_SCD_SAV_UserArgs_MT64x128x32_MI16x16x1_SN_LDSB0_AFC1_AFEM1_AFEM1_ASEM1_CLR1_CADS0_DTLA0_DTLB0_DTVA0_DTVB1_EPS0_FDSI0_GRPM1_GRVWA16_GRVWB8_GSU1_GSUAMB_GSUC0_GSUWGMRR0_GLS0_ISA1201_IU1_K1_LBSPPA512_LBSPPB0_LBSPPM0_LPA16_LPB0_LPM0_LRVW8_LWPMn1_MIAV1_MIWT1_8_MO40_NTn1_NTA0_NTB0_NTC0_NTD0_NTM0_NEPBS0_NLCA1_NLCB2_ONLL0_PGR2_PLR1_PKA0_SIA3_SS0_SU32_SUM1_SUS256_SPO0_SRVW0_SSO0_SVW8_SK0_SKXCCM0_TLDS0_ULSGRO0_USL1_UIOFGRO0_USFGROn1_VSn1_VWA1_VWB1_WSGRA0_WSGRB0_WS32_WG64_2_1_WGM8_WGMXCC1_WGMXCCGn1
    SolutionIndex: 89
    SolutionNameMin: Cijk_Ailk_Bjlk_I8BH_SHB_HA_S_SCD_SAV_UserArgs_MT64x128x32_MI16x16x1_SN_LDSB0_AFC1_AFEM1_AFEM1_ASEM1_CLR1_CADS0_DTLA0_DTLB0_DTVA1_DTVB1_EPS0_FDSI0_GRPM1_GRVWA8_GRVWB8_GSU1_GSUAMB_GSUC0_GSUWGMRR0_GLS0_ISA1201_IU1_K1_LBSPPA0_LBSPPB0_LBSPPM0_LPA0_LPB0_LPM0_LRVW8_LWPMn1_MIAV1_MIWT1_8_MO40_NTn1_NTA0_NTB0_NTC0_NTD0_NTM0_NEPBS0_NLCA1_NLCB2_ONLL0_PGR1_PLR0_PKA0_SIA3_SS0_SU32_SUM1_SUS256_SPO0_SRVW0_SSO0_SVW8_SK0_SKXCCM0_TLDS0_ULSGRO0_USL1_UIOFGRO0_USFGROn1_VSn1_VWA1_VWB1_WSGRA0_WSGRB0_WS32_WG64_2_1_WGM8_WGMXCC1_WGMXCCGn1
    SolutionIndex: 90
    SolutionNameMin: Cijk_Ailk_Bjlk_I8BH_SHB_HA_S_SCD_SAV_UserArgs_MT256x16x32_MI16x16x1_SN_LDSB0_AFC1_AFEM1_AFEM1_ASEM1_CLR1_CADS0_DTLA0_DTLB0_DTVA1_DTVB0_EPS1_FDSI0_GRPM1_GRVWA8_GRVWB4_GSU1_GSUAMB_GSUC0_GSUWGMRR0_GLS0_ISA1201_IU1_K1_LBSPPA0_LBSPPB128_LBSPPM0_LPA0_LPB16_LPM0_LRVW8_LWPMn1_MIAV1_MIWT8_1_MO40_NTn1_NTA0_NTB0_NTC0_NTD0_NTM0_NEPBS0_NLCA2_NLCB1_ONLL0_PGR1_PLR1_PKA0_SIA3_SS0_SU32_SUM1_SUS256_SPO0_SRVW0_SSO0_SVW8_SK0_SKXCCM0_TLDS0_ULSGRO0_USL1_UIOFGRO0_USFGROn1_VSn1_VWA1_VWB1_WSGRA0_WSGRB0_WS32_WG32_2_1_WGM8_WGMXCC1_WGMXCCGn1
    SolutionIndex: 91
    SolutionNameMin: Cijk_Ailk_Bjlk_I8BH_SHB_HA_S_SCD_SAV_UserArgs_MT256x16x32_MI16x16x1_SN_LDSB0_AFC1_AFEM1_AFEM1_ASEM1_CLR1_CADS0_DTLA0_DTLB0_DTVA1_DTVB0_EPS1_FDSI0_GRPM1_GRVWA8_GRVWB8_GSU1_GSUAMB_GSUC0_GSUWGMRR0_GLS0_ISA1201_IU1_K1_LBSPPA0_LBSPPB128_LBSPPM0_LPA0_LPB16_LPM0_LRVW8_LWPMn1_MIAV1_MIWT8_1_MO40_NTn1_NTA0_NTB0_NTC0_NTD0_NTM0_NEPBS0_NLCA2_NLCB1_ONLL0_PGR1_PLR1_PKA0_SIA3_SS0_SU32_SUM1_SUS256_SPO0_SRVW0_SSO0_SVW8_SK0_SKXCCM0_TLDS0_ULSGRO0_USL1_UIOFGRO0_USFGROn1_VSn1_VWA1_VWB1_WSGRA0_WSGRB0_WS32_WG32_2_1_WGM8_WGMXCC1_WGMXCCGn1
    SolutionIndex: 92
    SolutionNameMin: Cijk_Ailk_Bjlk_I8BH_SHB_HA_S_SCD_SAV_UserArgs_MT256x16x32_MI16x16x1_SN_LDSB0_AFC1_AFEM1_AFEM1_ASEM1_CLR1_CADS0_DTLA0_DTLB0_DTVA1_DTVB1_EPS0_FDSI0_GRPM1_GRVWA8_GRVWB8_GSU1_GSUAMB_GSUC0_GSUWGMRR0_GLS0_ISA1201_IU1_K1_LBSPPA0_LBSPPB0_LBSPPM0_LPA0_LPB0_LPM0_LRVW8_LWPMn1_MIAV1_MIWT8_1_MO40_NTn1_NTA0_NTB0_NTC0_NTD0_NTM0_NEPBS0_NLCA2_NLCB1_ONLL0_PGR1_PLR0_PKA0_SIA3_SS0_SU32_SUM1_SUS256_SPO0_SRVW0_SSO0_SVW8_SK0_SKXCCM0_TLDS0_ULSGRO0_USL1_UIOFGRO0_USFGROn1_VSn1_VWA1_VWB1_WSGRA0_WSGRB0_WS32_WG32_2_1_WGM8_WGMXCC1_WGMXCCGn1
    SolutionIndex: 93
    SolutionNameMin: Cijk_Ailk_Bjlk_I8BH_SHB_HA_S_SCD_SAV_UserArgs_MT16x256x32_MI16x16x1_SN_LDSB0_AFC1_AFEM1_AFEM1_ASEM1_CLR1_CADS0_DTLA0_DTLB0_DTVA0_DTVB1_EPS1_FDSI0_GRPM1_GRVWA1_GRVWB8_GSU1_GSUAMB_GSUC0_GSUWGMRR0_GLS0_ISA1201_IU1_K1_LBSPPA128_LBSPPB0_LBSPPM0_LPA16_LPB0_LPM0_LRVW8_LWPMn1_MIAV1_MIWT1_8_MO40_NTn1_NTA0_NTB0_NTC0_NTD0_NTM0_NEPBS0_NLCA1_NLCB2_ONLL0_PGR1_PLR1_PKA0_SIA3_SS0_SU32_SUM1_SUS256_SPO0_SRVW0_SSO0_SVW8_SK0_SKXCCM0_TLDS0_ULSGRO0_USL1_UIOFGRO0_USFGROn1_VSn1_VWA1_VWB1_WSGRA0_WSGRB0_WS32_WG16_4_1_WGM8_WGMXCC1_WGMXCCGn1
    SolutionIndex: 94
    SolutionNameMin: Cijk_Ailk_Bjlk_I8BH_SHB_HA_S_SCD_SAV_UserArgs_MT16x256x32_MI16x16x1_SN_LDSB0_AFC1_AFEM1_AFEM1_ASEM1_CLR1_CADS0_DTLA0_DTLB0_DTVA0_DTVB1_EPS1_FDSI0_GRPM1_GRVWA8_GRVWB8_GSU1_GSUAMB_GSUC0_GSUWGMRR0_GLS0_ISA1201_IU1_K1_LBSPPA128_LBSPPB0_LBSPPM0_LPA16_LPB0_LPM0_LRVW8_LWPMn1_MIAV1_MIWT1_8_MO40_NTn1_NTA0_NTB0_NTC0_NTD0_NTM0_NEPBS0_NLCA1_NLCB2_ONLL0_PGR1_PLR1_PKA0_SIA3_SS0_SU32_SUM1_SUS256_SPO0_SRVW0_SSO0_SVW8_SK0_SKXCCM0_TLDS0_ULSGRO0_USL1_UIOFGRO0_USFGROn1_VSn1_VWA1_VWB1_WSGRA0_WSGRB0_WS32_WG16_4_1_WGM8_WGMXCC1_WGMXCCGn1
    SolutionIndex: 95
    SolutionNameMin: Cijk_Ailk_Bjlk_I8BH_SHB_HA_S_SCD_SAV_UserArgs_MT16x256x32_MI16x16x1_SN_LDSB0_AFC1_AFEM1_AFEM1_ASEM1_CLR1_CADS0_DTLA0_DTLB0_DTVA0_DTVB1_EPS0_FDSI0_GRPM1_GRVWA8_GRVWB8_GSU1_GSUAMB_GSUC0_GSUWGMRR0_GLS0_ISA1201_IU1_K1_LBSPPA128_LBSPPB0_LBSPPM0_LPA16_LPB0_LPM0_LRVW8_LWPMn1_MIAV1_MIWT1_8_MO40_NTn1_NTA0_NTB0_NTC0_NTD0_NTM0_NEPBS0_NLCA1_NLCB2_ONLL0_PGR2_PLR1_PKA0_SIA3_SS0_SU32_SUM1_SUS256_SPO0_SRVW0_SSO0_SVW8_SK0_SKXCCM0_TLDS0_ULSGRO0_USL1_UIOFGRO0_USFGROn1_VSn1_VWA1_VWB1_WSGRA0_WSGRB0_WS32_WG16_4_1_WGM8_WGMXCC1_WGMXCCGn1
    SolutionIndex: 96
    SolutionNameMin: Cijk_Ailk_Bjlk_I8BH_SHB_HA_S_SCD_SAV_UserArgs_MT16x256x32_MI16x16x1_SN_LDSB0_AFC1_AFEM1_AFEM1_ASEM1_CLR1_CADS0_DTLA0_DTLB0_DTVA1_DTVB1_EPS0_FDSI0_GRPM1_GRVWA8_GRVWB8_GSU1_GSUAMB_GSUC0_GSUWGMRR0_GLS0_ISA1201_IU1_K1_LBSPPA0_LBSPPB0_LBSPPM0_LPA0_LPB0_LPM0_LRVW8_LWPMn1_MIAV1_MIWT1_8_MO40_NTn1_NTA0_NTB0_NTC0_NTD0_NTM0_NEPBS0_NLCA1_NLCB2_ONLL0_PGR1_PLR0_PKA0_SIA3_SS0_SU32_SUM1_SUS256_SPO0_SRVW0_SSO0_SVW8_SK0_SKXCCM0_TLDS0_ULSGRO0_USL1_UIOFGRO0_USFGROn1_VSn1_VWA1_VWB1_WSGRA0_WSGRB0_WS32_WG16_4_1_WGM8_WGMXCC1_WGMXCCGn1
    SolutionIndex: 97
    SolutionNameMin: Cijk_Ailk_Bjlk_I8BH_SHB_HA_S_SCD_SAV_UserArgs_MT64x64x64_MI16x16x1_SN_LDSB1_AFC1_AFEM1_AFEM1_ASEM1_CLR1_CADS0_DTLA0_DTLB0_DTVA0_DTVB0_EPS1_FDSI0_GRPM1_GRVWA4_GRVWB4_GSU1_GSUAMB_GSUC0_GSUWGMRR0_GLS0_ISA1201_IU4_K1_LBSPPA512_LBSPPB512_LBSPPM0_LPA32_LPB32_LPM0_LRVW8_LWPMn1_MIAV1_MIWT2_2_MO40_NTn1_NTA0_NTB0_NTC0_NTD0_NTM0_NEPBS0_NLCA1_NLCB1_ONLL0_PGR1_PLR1_PKA0_SIA2_SS0_SU32_SUM1_SUS256_SPO0_SRVW0_SSO0_SVW16_SK0_SKXCCM0_TLDS0_ULSGRO0_USL1_UIOFGRO0_USFGROn1_VSn1_VWA2_VWB2_WSGRA0_WSGRB0_WS32_WG32_4_1_WGM8_WGMXCC1_WGMXCCGn1
    SolutionIndex: 98
    SolutionNameMin: Cijk_Ailk_Bjlk_I8BH_SHB_HA_S_SCD_SAV_UserArgs_MT64x64x64_MI16x16x1_SN_LDSB1_AFC1_AFEM1_AFEM1_ASEM1_CLR1_CADS0_DTLA0_DTLB0_DTVA0_DTVB0_EPS1_FDSI0_GRPM1_GRVWA8_GRVWB4_GSU1_GSUAMB_GSUC0_GSUWGMRR0_GLS0_ISA1201_IU4_K1_LBSPPA512_LBSPPB512_LBSPPM0_LPA32_LPB32_LPM0_LRVW8_LWPMn1_MIAV1_MIWT2_2_MO40_NTn1_NTA0_NTB0_NTC0_NTD0_NTM0_NEPBS0_NLCA1_NLCB1_ONLL0_PGR1_PLR1_PKA0_SIA2_SS0_SU32_SUM1_SUS256_SPO0_SRVW0_SSO0_SVW16_SK0_SKXCCM0_TLDS0_ULSGRO0_USL1_UIOFGRO0_USFGROn1_VSn1_VWA2_VWB2_WSGRA0_WSGRB0_WS32_WG32_4_1_WGM8_WGMXCC1_WGMXCCGn1
    SolutionIndex: 99
    SolutionNameMin: Cijk_Ailk_Bjlk_I8BH_SHB_HA_S_SCD_SAV_UserArgs_MT64x64x64_MI16x16x1_SN_LDSB1_AFC1_AFEM1_AFEM1_ASEM1_CLR1_CADS0_DTLA0_DTLB0_DTVA0_DTVB0_EPS1_FDSI0_GRPM1_GRVWA16_GRVWB4_GSU1_GSUAMB_GSUC0_GSUWGMRR0_GLS0_ISA1201_IU4_K1_LBSPPA512_LBSPPB512_LBSPPM0_LPA32_LPB32_LPM0_LRVW8_LWPMn1_MIAV1_MIWT2_2_MO40_NTn1_NTA0_NTB0_NTC0_NTD0_NTM0_NEPBS0_NLCA1_NLCB1_ONLL0_PGR1_PLR1_PKA0_SIA2_SS0_SU32_SUM1_SUS256_SPO0_SRVW0_SSO0_SVW16_SK0_SKXCCM0_TLDS0_ULSGRO0_USL1_UIOFGRO0_USFGROn1_VSn1_VWA2_VWB2_WSGRA0_WSGRB0_WS32_WG32_4_1_WGM8_WGMXCC1_WGMXCCGn1
    SolutionIndex: 100
    SolutionNameMin: Cijk_Ailk_Bjlk_I8BH_SHB_HA_S_SCD_SAV_UserArgs_MT64x64x64_MI16x16x1_SN_LDSB1_AFC1_AFEM1_AFEM1_ASEM1_CLR1_CADS0_DTLA0_DTLB0_DTVA0_DTVB0_EPS1_FDSI0_GRPM1_GRVWA8_GRVWB8_GSU1_GSUAMB_GSUC0_GSUWGMRR0_GLS0_ISA1201_IU4_K1_LBSPPA512_LBSPPB512_LBSPPM0_LPA32_LPB32_LPM0_LRVW8_LWPMn1_MIAV1_MIWT2_2_MO40_NTn1_NTA0_NTB0_NTC0_NTD0_NTM0_NEPBS0_NLCA1_NLCB1_ONLL0_PGR1_PLR1_PKA0_SIA2_SS0_SU32_SUM1_SUS256_SPO0_SRVW0_SSO0_SVW16_SK0_SKXCCM0_TLDS0_ULSGRO0_USL1_UIOFGRO0_USFGROn1_VSn1_VWA2_VWB2_WSGRA0_WSGRB0_WS32_WG32_4_1_WGM8_WGMXCC1_WGMXCCGn1
    SolutionIndex: 101
    SolutionNameMin: Cijk_Ailk_Bjlk_I8BH_SHB_HA_S_SCD_SAV_UserArgs_MT64x64x64_MI16x16x1_SN_LDSB1_AFC1_AFEM1_AFEM1_ASEM1_CLR1_CADS0_DTLA0_DTLB0_DTVA0_DTVB0_EPS0_FDSI0_GRPM1_GRVWA4_GRVWB4_GSU1_GSUAMB_GSUC0_GSUWGMRR0_GLS0_ISA1201_IU4_K1_LBSPPA512_LBSPPB512_LBSPPM0_LPA32_LPB32_LPM0_LRVW8_LWPMn1_MIAV1_MIWT2_2_MO40_NTn1_NTA0_NTB0_NTC0_NTD0_NTM0_NEPBS0_NLCA1_NLCB1_ONLL0_PGR2_PLR1_PKA0_SIA2_SS0_SU32_SUM1_SUS256_SPO0_SRVW0_SSO0_SVW16_SK0_SKXCCM0_TLDS0_ULSGRO0_USL1_UIOFGRO0_USFGROn1_VSn1_VWA2_VWB2_WSGRA0_WSGRB0_WS32_WG32_4_1_WGM8_WGMXCC1_WGMXCCGn1
    SolutionIndex: 102
    SolutionNameMin: Cijk_Ailk_Bjlk_I8BH_SHB_HA_S_SCD_SAV_UserArgs_MT64x64x64_MI16x16x1_SN_LDSB1_AFC1_AFEM1_AFEM1_ASEM1_CLR1_CADS0_DTLA0_DTLB0_DTVA0_DTVB0_EPS0_FDSI0_GRPM1_GRVWA8_GRVWB4_GSU1_GSUAMB_GSUC0_GSUWGMRR0_GLS0_ISA1201_IU4_K1_LBSPPA512_LBSPPB512_LBSPPM0_LPA32_LPB32_LPM0_LRVW8_LWPMn1_MIAV1_MIWT2_2_MO40_NTn1_NTA0_NTB0_NTC0_NTD0_NTM0_NEPBS0_NLCA1_NLCB1_ONLL0_PGR2_PLR1_PKA0_SIA2_SS0_SU32_SUM1_SUS256_SPO0_SRVW0_SSO0_SVW16_SK0_SKXCCM0_TLDS0_ULSGRO0_USL1_UIOFGRO0_USFGROn1_VSn1_VWA2_VWB2_WSGRA0_WSGRB0_WS32_WG32_4_1_WGM8_WGMXCC1_WGMXCCGn1
    SolutionIndex: 103
    SolutionNameMin: Cijk_Ailk_Bjlk_I8BH_SHB_HA_S_SCD_SAV_UserArgs_MT64x64x64_MI16x16x1_SN_LDSB1_AFC1_AFEM1_AFEM1_ASEM1_CLR1_CADS0_DTLA0_DTLB0_DTVA0_DTVB0_EPS0_FDSI0_GRPM1_GRVWA8_GRVWB4_GSU1_GSUAMB_GSUC0_GSUWGMRR0_GLS0_ISA1201_IU4_K1_LBSPPA512_LBSPPB512_LBSPPM0_LPA32_LPB32_LPM0_LRVW8_LWPMn1_MIAV1_MIWT2_2_MO40_NTn1_NTA0_NTB0_NTC0_NTD0_NTM0_NEPBS0_NLCA1_NLCB1_ONLL0_PGR2_PLR1_PKA0_SIA2_SS0_SU32_SUM1_SUS256_SPO0_SRVW0_SSO0_SVW16_SK0_SKXCCM0_TLDS0_ULSGRO1_USL1_UIOFGRO0_USFGROn1_VSn1_VWA2_VWB2_WSGRA0_WSGRB0_WS32_WG32_4_1_WGM8_WGMXCC1_WGMXCCGn1
    SolutionIndex: 104
    SolutionNameMin: Cijk_Ailk_Bjlk_I8BH_SHB_HA_S_SCD_SAV_UserArgs_MT64x64x64_MI16x16x1_SN_LDSB1_AFC1_AFEM1_AFEM1_ASEM1_CLR1_CADS0_DTLA0_DTLB0_DTVA0_DTVB0_EPS0_FDSI0_GRPM1_GRVWA16_GRVWB4_GSU1_GSUAMB_GSUC0_GSUWGMRR0_GLS0_ISA1201_IU4_K1_LBSPPA512_LBSPPB512_LBSPPM0_LPA32_LPB32_LPM0_LRVW8_LWPMn1_MIAV1_MIWT2_2_MO40_NTn1_NTA0_NTB0_NTC0_NTD0_NTM0_NEPBS0_NLCA1_NLCB1_ONLL0_PGR2_PLR1_PKA0_SIA2_SS0_SU32_SUM1_SUS256_SPO0_SRVW0_SSO0_SVW16_SK0_SKXCCM0_TLDS0_ULSGRO1_USL1_UIOFGRO0_USFGROn1_VSn1_VWA2_VWB2_WSGRA0_WSGRB0_WS32_WG32_4_1_WGM8_WGMXCC1_WGMXCCGn1
    SolutionIndex: 105
    SolutionNameMin: Cijk_Ailk_Bjlk_I8BH_SHB_HA_S_SCD_SAV_UserArgs_MT64x64x64_MI16x16x1_SN_LDSB1_AFC1_AFEM1_AFEM1_ASEM1_CLR1_CADS0_DTLA0_DTLB0_DTVA0_DTVB0_EPS0_FDSI0_GRPM1_GRVWA4_GRVWB8_GSU1_GSUAMB_GSUC0_GSUWGMRR0_GLS0_ISA1201_IU4_K1_LBSPPA512_LBSPPB512_LBSPPM0_LPA32_LPB32_LPM0_LRVW8_LWPMn1_MIAV1_MIWT2_2_MO40_NTn1_NTA0_NTB0_NTC0_NTD0_NTM0_NEPBS0_NLCA1_NLCB1_ONLL0_PGR2_PLR1_PKA0_SIA2_SS0_SU32_SUM1_SUS256_SPO0_SRVW0_SSO0_SVW16_SK0_SKXCCM0_TLDS0_ULSGRO1_USL1_UIOFGRO0_USFGROn1_VSn1_VWA2_VWB2_WSGRA0_WSGRB0_WS32_WG32_4_1_WGM8_WGMXCC1_WGMXCCGn1
    SolutionIndex: 106
    SolutionNameMin: Cijk_Ailk_Bjlk_I8BH_SHB_HA_S_SCD_SAV_UserArgs_MT64x64x64_MI16x16x1_SN_LDSB0_AFC1_AFEM1_AFEM1_ASEM1_CLR1_CADS0_DTLA0_DTLB0_DTVA1_DTVB0_EPS1_FDSI0_GRPM1_GRVWA8_GRVWB4_GSU1_GSUAMB_GSUC0_GSUWGMRR0_GLS0_ISA1201_IU1_K1_LBSPPA0_LBSPPB512_LBSPPM0_LPA0_LPB32_LPM0_LRVW8_LWPMn1_MIAV1_MIWT2_2_MO40_NTn1_NTA0_NTB0_NTC0_NTD0_NTM0_NEPBS0_NLCA4_NLCB1_ONLL0_PGR1_PLR1_PKA0_SIA3_SS0_SU32_SUM1_SUS256_SPO0_SRVW0_SSO0_SVW8_SK0_SKXCCM0_TLDS0_ULSGRO0_USL1_UIOFGRO0_USFGROn1_VSn1_VWA1_VWB2_WSGRA0_WSGRB0_WS32_WG32_4_1_WGM8_WGMXCC1_WGMXCCGn1
    SolutionIndex: 107
    SolutionNameMin: Cijk_Ailk_Bjlk_I8BH_SHB_HA_S_SCD_SAV_UserArgs_MT64x64x64_MI16x16x1_SN_LDSB0_AFC1_AFEM1_AFEM1_ASEM1_CLR1_CADS0_DTLA0_DTLB0_DTVA1_DTVB0_EPS1_FDSI0_GRPM1_GRVWA8_GRVWB8_GSU1_GSUAMB_GSUC0_GSUWGMRR0_GLS0_ISA1201_IU1_K1_LBSPPA0_LBSPPB512_LBSPPM0_LPA0_LPB32_LPM0_LRVW8_LWPMn1_MIAV1_MIWT2_2_MO40_NTn1_NTA0_NTB0_NTC0_NTD0_NTM0_NEPBS0_NLCA4_NLCB1_ONLL0_PGR1_PLR1_PKA0_SIA3_SS0_SU32_SUM1_SUS256_SPO0_SRVW0_SSO0_SVW8_SK0_SKXCCM0_TLDS0_ULSGRO0_USL1_UIOFGRO0_USFGROn1_VSn1_VWA1_VWB2_WSGRA0_WSGRB0_WS32_WG32_4_1_WGM8_WGMXCC1_WGMXCCGn1
    SolutionIndex: 108
    SolutionNameMin: Cijk_Ailk_Bjlk_I8BH_SHB_HA_S_SCD_SAV_UserArgs_MT64x64x64_MI16x16x1_SN_LDSB0_AFC1_AFEM1_AFEM1_ASEM1_CLR1_CADS0_DTLA0_DTLB0_DTVA1_DTVB0_EPS1_FDSI0_GRPM1_GRVWA8_GRVWB16_GSU1_GSUAMB_GSUC0_GSUWGMRR0_GLS0_ISA1201_IU1_K1_LBSPPA0_LBSPPB512_LBSPPM0_LPA0_LPB32_LPM0_LRVW8_LWPMn1_MIAV1_MIWT2_2_MO40_NTn1_NTA0_NTB0_NTC0_NTD0_NTM0_NEPBS0_NLCA4_NLCB1_ONLL0_PGR1_PLR1_PKA0_SIA3_SS0_SU32_SUM1_SUS256_SPO0_SRVW0_SSO0_SVW8_SK0_SKXCCM0_TLDS0_ULSGRO0_USL1_UIOFGRO0_USFGROn1_VSn1_VWA1_VWB2_WSGRA0_WSGRB0_WS32_WG32_4_1_WGM8_WGMXCC1_WGMXCCGn1
    SolutionIndex: 109
    SolutionNameMin: Cijk_Ailk_Bjlk_I8BH_SHB_HA_S_SCD_SAV_UserArgs_MT64x64x64_MI16x16x1_SN_LDSB0_AFC1_AFEM1_AFEM1_ASEM1_CLR1_CADS0_DTLA0_DTLB0_DTVA1_DTVB0_EPS0_FDSI0_GRPM1_GRVWA8_GRVWB8_GSU1_GSUAMB_GSUC0_GSUWGMRR0_GLS0_ISA1201_IU1_K1_LBSPPA0_LBSPPB512_LBSPPM0_LPA0_LPB32_LPM0_LRVW8_LWPMn1_MIAV1_MIWT2_2_MO40_NTn1_NTA0_NTB0_NTC0_NTD0_NTM0_NEPBS0_NLCA4_NLCB1_ONLL0_PGR2_PLR1_PKA0_SIA3_SS0_SU32_SUM1_SUS256_SPO0_SRVW0_SSO0_SVW8_SK0_SKXCCM0_TLDS0_ULSGRO0_USL1_UIOFGRO0_USFGROn1_VSn1_VWA1_VWB2_WSGRA0_WSGRB0_WS32_WG32_4_1_WGM8_WGMXCC1_WGMXCCGn1
    SolutionIndex: 110
    SolutionNameMin: Cijk_Ailk_Bjlk_I8BH_SHB_HA_S_SCD_SAV_UserArgs_MT64x64x64_MI16x16x1_SN_LDSB0_AFC1_AFEM1_AFEM1_ASEM1_CLR1_CADS0_DTLA0_DTLB0_DTVA1_DTVB0_EPS0_FDSI0_GRPM1_GRVWA8_GRVWB16_GSU1_GSUAMB_GSUC0_GSUWGMRR0_GLS0_ISA1201_IU1_K1_LBSPPA0_LBSPPB512_LBSPPM0_LPA0_LPB32_LPM0_LRVW8_LWPMn1_MIAV1_MIWT2_2_MO40_NTn1_NTA0_NTB0_NTC0_NTD0_NTM0_NEPBS0_NLCA4_NLCB1_ONLL0_PGR2_PLR1_PKA0_SIA3_SS0_SU32_SUM1_SUS256_SPO0_SRVW0_SSO0_SVW8_SK0_SKXCCM0_TLDS0_ULSGRO0_USL1_UIOFGRO0_USFGROn1_VSn1_VWA1_VWB2_WSGRA0_WSGRB0_WS32_WG32_4_1_WGM8_WGMXCC1_WGMXCCGn1
    SolutionIndex: 111
    SolutionNameMin: Cijk_Ailk_Bjlk_I8BH_SHB_HA_S_SCD_SAV_UserArgs_MT64x64x64_MI16x16x1_SN_LDSB0_AFC1_AFEM1_AFEM1_ASEM1_CLR1_CADS0_DTLA0_DTLB0_DTVA0_DTVB1_EPS1_FDSI0_GRPM1_GRVWA4_GRVWB8_GSU1_GSUAMB_GSUC0_GSUWGMRR0_GLS0_ISA1201_IU1_K1_LBSPPA512_LBSPPB0_LBSPPM0_LPA32_LPB0_LPM0_LRVW8_LWPMn1_MIAV1_MIWT2_2_MO40_NTn1_NTA0_NTB0_NTC0_NTD0_NTM0_NEPBS0_NLCA1_NLCB4_ONLL0_PGR1_PLR1_PKA0_SIA3_SS0_SU32_SUM1_SUS256_SPO0_SRVW0_SSO0_SVW16_SK0_SKXCCM0_TLDS0_ULSGRO0_USL1_UIOFGRO0_USFGROn1_VSn1_VWA2_VWB1_WSGRA0_WSGRB0_WS32_WG32_4_1_WGM8_WGMXCC1_WGMXCCGn1
    SolutionIndex: 112
    SolutionNameMin: Cijk_Ailk_Bjlk_I8BH_SHB_HA_S_SCD_SAV_UserArgs_MT64x64x64_MI16x16x1_SN_LDSB0_AFC1_AFEM1_AFEM1_ASEM1_CLR1_CADS0_DTLA0_DTLB0_DTVA0_DTVB1_EPS1_FDSI0_GRPM1_GRVWA8_GRVWB8_GSU1_GSUAMB_GSUC0_GSUWGMRR0_GLS0_ISA1201_IU1_K1_LBSPPA512_LBSPPB0_LBSPPM0_LPA32_LPB0_LPM0_LRVW8_LWPMn1_MIAV1_MIWT2_2_MO40_NTn1_NTA0_NTB0_NTC0_NTD0_NTM0_NEPBS0_NLCA1_NLCB4_ONLL0_PGR1_PLR1_PKA0_SIA3_SS0_SU32_SUM1_SUS256_SPO0_SRVW0_SSO0_SVW16_SK0_SKXCCM0_TLDS0_ULSGRO0_USL1_UIOFGRO0_USFGROn1_VSn1_VWA2_VWB1_WSGRA0_WSGRB0_WS32_WG32_4_1_WGM8_WGMXCC1_WGMXCCGn1
    SolutionIndex: 113
    SolutionNameMin: Cijk_Ailk_Bjlk_I8BH_SHB_HA_S_SCD_SAV_UserArgs_MT64x64x64_MI16x16x1_SN_LDSB0_AFC1_AFEM1_AFEM1_ASEM1_CLR1_CADS0_DTLA0_DTLB0_DTVA0_DTVB1_EPS1_FDSI0_GRPM1_GRVWA16_GRVWB8_GSU1_GSUAMB_GSUC0_GSUWGMRR0_GLS0_ISA1201_IU1_K1_LBSPPA512_LBSPPB0_LBSPPM0_LPA32_LPB0_LPM0_LRVW8_LWPMn1_MIAV1_MIWT2_2_MO40_NTn1_NTA0_NTB0_NTC0_NTD0_NTM0_NEPBS0_NLCA1_NLCB4_ONLL0_PGR1_PLR1_PKA0_SIA3_SS0_SU32_SUM1_SUS256_SPO0_SRVW0_SSO0_SVW16_SK0_SKXCCM0_TLDS0_ULSGRO0_USL1_UIOFGRO0_USFGROn1_VSn1_VWA2_VWB1_WSGRA0_WSGRB0_WS32_WG32_4_1_WGM8_WGMXCC1_WGMXCCGn1
    SolutionIndex: 114
    SolutionNameMin: Cijk_Ailk_Bjlk_I8BH_SHB_HA_S_SCD_SAV_UserArgs_MT64x64x64_MI16x16x1_SN_LDSB0_AFC1_AFEM1_AFEM1_ASEM1_CLR1_CADS0_DTLA0_DTLB0_DTVA0_DTVB1_EPS0_FDSI0_GRPM1_GRVWA4_GRVWB8_GSU1_GSUAMB_GSUC0_GSUWGMRR0_GLS0_ISA1201_IU1_K1_LBSPPA512_LBSPPB0_LBSPPM0_LPA32_LPB0_LPM0_LRVW8_LWPMn1_MIAV1_MIWT2_2_MO40_NTn1_NTA0_NTB0_NTC0_NTD0_NTM0_NEPBS0_NLCA1_NLCB4_ONLL0_PGR2_PLR1_PKA0_SIA3_SS0_SU32_SUM1_SUS256_SPO0_SRVW0_SSO0_SVW16_SK0_SKXCCM0_TLDS0_ULSGRO0_USL1_UIOFGRO0_USFGROn1_VSn1_VWA2_VWB1_WSGRA0_WSGRB0_WS32_WG32_4_1_WGM8_WGMXCC1_WGMXCCGn1
    SolutionIndex: 115
    SolutionNameMin: Cijk_Ailk_Bjlk_I8BH_SHB_HA_S_SCD_SAV_UserArgs_MT64x64x64_MI16x16x1_SN_LDSB0_AFC1_AFEM1_AFEM1_ASEM1_CLR1_CADS0_DTLA0_DTLB0_DTVA0_DTVB1_EPS0_FDSI0_GRPM1_GRVWA8_GRVWB8_GSU1_GSUAMB_GSUC0_GSUWGMRR0_GLS0_ISA1201_IU1_K1_LBSPPA512_LBSPPB0_LBSPPM0_LPA32_LPB0_LPM0_LRVW8_LWPMn1_MIAV1_MIWT2_2_MO40_NTn1_NTA0_NTB0_NTC0_NTD0_NTM0_NEPBS0_NLCA1_NLCB4_ONLL0_PGR2_PLR1_PKA0_SIA3_SS0_SU32_SUM1_SUS256_SPO0_SRVW0_SSO0_SVW16_SK0_SKXCCM0_TLDS0_ULSGRO0_USL1_UIOFGRO0_USFGROn1_VSn1_VWA2_VWB1_WSGRA0_WSGRB0_WS32_WG32_4_1_WGM8_WGMXCC1_WGMXCCGn1
    SolutionIndex: 116
    SolutionNameMin: Cijk_Ailk_Bjlk_I8BH_SHB_HA_S_SCD_SAV_UserArgs_MT64x64x64_MI16x16x1_SN_LDSB0_AFC1_AFEM1_AFEM1_ASEM1_CLR1_CADS0_DTLA0_DTLB0_DTVA0_DTVB1_EPS0_FDSI0_GRPM1_GRVWA16_GRVWB8_GSU1_GSUAMB_GSUC0_GSUWGMRR0_GLS0_ISA1201_IU1_K1_LBSPPA512_LBSPPB0_LBSPPM0_LPA32_LPB0_LPM0_LRVW8_LWPMn1_MIAV1_MIWT2_2_MO40_NTn1_NTA0_NTB0_NTC0_NTD0_NTM0_NEPBS0_NLCA1_NLCB4_ONLL0_PGR2_PLR1_PKA0_SIA3_SS0_SU32_SUM1_SUS256_SPO0_SRVW0_SSO0_SVW16_SK0_SKXCCM0_TLDS0_ULSGRO0_USL1_UIOFGRO0_USFGROn1_VSn1_VWA2_VWB1_WSGRA0_WSGRB0_WS32_WG32_4_1_WGM8_WGMXCC1_WGMXCCGn1
    SolutionIndex: 117
    SolutionNameMin: Cijk_Ailk_Bjlk_I8BH_SHB_HA_S_SCD_SAV_UserArgs_MT64x64x64_MI16x16x1_SN_LDSB0_AFC1_AFEM1_AFEM1_ASEM1_CLR1_CADS0_DTLA0_DTLB0_DTVA1_DTVB1_EPS0_FDSI0_GRPM1_GRVWA8_GRVWB8_GSU1_GSUAMB_GSUC0_GSUWGMRR0_GLS0_ISA1201_IU1_K1_LBSPPA0_LBSPPB0_LBSPPM0_LPA0_LPB0_LPM0_LRVW8_LWPMn1_MIAV1_MIWT2_2_MO40_NTn1_NTA0_NTB0_NTC0_NTD0_NTM0_NEPBS0_NLCA4_NLCB4_ONLL0_PGR1_PLR0_PKA0_SIA3_SS0_SU32_SUM1_SUS256_SPO0_SRVW0_SSO0_SVW8_SK0_SKXCCM0_TLDS0_ULSGRO0_USL1_UIOFGRO0_USFGROn1_VSn1_VWA1_VWB1_WSGRA0_WSGRB0_WS32_WG32_4_1_WGM8_WGMXCC1_WGMXCCGn1
    SolutionIndex: 118
    SolutionNameMin: Cijk_Ailk_Bjlk_I8BH_SHB_HA_S_SCD_SAV_UserArgs_MT32x32x64_MI16x16x1_SN_LDSB1_AFC1_AFEM1_AFEM1_ASEM1_CLR1_CADS0_DTLA0_DTLB0_DTVA0_DTVB0_EPS1_FDSI0_GRPM1_GRVWA1_GRVWB1_GSU1_GSUAMB_GSUC0_GSUWGMRR0_GLS0_ISA1201_IU4_K1_LBSPPA256_LBSPPB256_LBSPPM0_LPA16_LPB16_LPM0_LRVW8_LWPMn1_MIAV1_MIWT1_1_MO40_NTn1_NTA0_NTB0_NTC0_NTD0_NTM0_NEPBS0_NLCA1_NLCB1_ONLL0_PGR1_PLR1_PKA0_SIA2_SS0_SU32_SUM1_SUS256_SPO0_SRVW0_SSO0_SVW8_SK0_SKXCCM0_TLDS0_ULSGRO0_USL1_UIOFGRO0_USFGROn1_VSn1_VWA1_VWB1_WSGRA0_WSGRB0_WS32_WG32_4_1_WGM8_WGMXCC1_WGMXCCGn1
    SolutionIndex: 119
    SolutionNameMin: Cijk_Ailk_Bjlk_I8BH_SHB_HA_S_SCD_SAV_UserArgs_MT32x32x64_MI16x16x1_SN_LDSB1_AFC1_AFEM1_AFEM1_ASEM1_CLR1_CADS0_DTLA0_DTLB0_DTVA0_DTVB0_EPS0_FDSI0_GRPM1_GRVWA1_GRVWB1_GSU1_GSUAMB_GSUC0_GSUWGMRR0_GLS0_ISA1201_IU4_K1_LBSPPA256_LBSPPB256_LBSPPM0_LPA16_LPB16_LPM0_LRVW8_LWPMn1_MIAV1_MIWT1_1_MO40_NTn1_NTA0_NTB0_NTC0_NTD0_NTM0_NEPBS0_NLCA1_NLCB1_ONLL0_PGR2_PLR1_PKA0_SIA2_SS0_SU32_SUM1_SUS256_SPO0_SRVW0_SSO0_SVW8_SK0_SKXCCM0_TLDS0_ULSGRO0_USL1_UIOFGRO0_USFGROn1_VSn1_VWA1_VWB1_WSGRA0_WSGRB0_WS32_WG32_4_1_WGM8_WGMXCC1_WGMXCCGn1
    SolutionIndex: 120
    SolutionNameMin: Cijk_Ailk_Bjlk_I8BH_SHB_HA_S_SCD_SAV_UserArgs_MT32x32x64_MI16x16x1_SN_LDSB1_AFC1_AFEM1_AFEM1_ASEM1_CLR1_CADS0_DTLA0_DTLB0_DTVA0_DTVB0_EPS0_FDSI0_GRPM1_GRVWA1_GRVWB1_GSU1_GSUAMB_GSUC0_GSUWGMRR0_GLS0_ISA1201_IU4_K1_LBSPPA256_LBSPPB256_LBSPPM0_LPA16_LPB16_LPM0_LRVW8_LWPMn1_MIAV1_MIWT1_1_MO40_NTn1_NTA0_NTB0_NTC0_NTD0_NTM0_NEPBS0_NLCA1_NLCB1_ONLL0_PGR2_PLR1_PKA0_SIA2_SS0_SU32_SUM1_SUS256_SPO0_SRVW0_SSO0_SVW8_SK0_SKXCCM0_TLDS0_ULSGRO1_USL1_UIOFGRO0_USFGROn1_VSn1_VWA1_VWB1_WSGRA0_WSGRB0_WS32_WG32_4_1_WGM8_WGMXCC1_WGMXCCGn1
    SolutionIndex: 121
    SolutionNameMin: Cijk_Ailk_Bjlk_I8BH_SHB_HA_S_SCD_SAV_UserArgs_MT32x32x64_MI16x16x1_SN_LDSB0_AFC1_AFEM1_AFEM1_ASEM1_CLR1_CADS0_DTLA0_DTLB0_DTVA1_DTVB0_EPS0_FDSI0_GRPM1_GRVWA8_GRVWB4_GSU1_GSUAMB_GSUC0_GSUWGMRR0_GLS0_ISA1201_IU1_K1_LBSPPA0_LBSPPB256_LBSPPM0_LPA0_LPB16_LPM0_LRVW8_LWPMn1_MIAV1_MIWT1_1_MO40_NTn1_NTA0_NTB0_NTC0_NTD0_NTM0_NEPBS0_NLCA1_NLCB1_ONLL0_PGR2_PLR1_PKA0_SIA3_SS0_SU32_SUM1_SUS256_SPO0_SRVW0_SSO0_SVW8_SK0_SKXCCM0_TLDS0_ULSGRO0_USL1_UIOFGRO0_USFGROn1_VSn1_VWA1_VWB1_WSGRA0_WSGRB0_WS32_WG32_4_1_WGM8_WGMXCC1_WGMXCCGn1
    SolutionIndex: 122
    SolutionNameMin: Cijk_Ailk_Bjlk_I8BH_SHB_HA_S_SCD_SAV_UserArgs_MT32x32x64_MI16x16x1_SN_LDSB0_AFC1_AFEM1_AFEM1_ASEM1_CLR1_CADS0_DTLA0_DTLB0_DTVA1_DTVB0_EPS0_FDSI0_GRPM1_GRVWA8_GRVWB8_GSU1_GSUAMB_GSUC0_GSUWGMRR0_GLS0_ISA1201_IU1_K1_LBSPPA0_LBSPPB256_LBSPPM0_LPA0_LPB16_LPM0_LRVW8_LWPMn1_MIAV1_MIWT1_1_MO40_NTn1_NTA0_NTB0_NTC0_NTD0_NTM0_NEPBS0_NLCA1_NLCB1_ONLL0_PGR2_PLR1_PKA0_SIA3_SS0_SU32_SUM1_SUS256_SPO0_SRVW0_SSO0_SVW8_SK0_SKXCCM0_TLDS0_ULSGRO0_USL1_UIOFGRO0_USFGROn1_VSn1_VWA1_VWB1_WSGRA0_WSGRB0_WS32_WG32_4_1_WGM8_WGMXCC1_WGMXCCGn1
    SolutionIndex: 123
    SolutionNameMin: Cijk_Ailk_Bjlk_I8BH_SHB_HA_S_SCD_SAV_UserArgs_MT32x32x64_MI16x16x1_SN_LDSB0_AFC1_AFEM1_AFEM1_ASEM1_CLR1_CADS0_DTLA0_DTLB0_DTVA1_DTVB0_EPS0_FDSI0_GRPM1_GRVWA8_GRVWB16_GSU1_GSUAMB_GSUC0_GSUWGMRR0_GLS0_ISA1201_IU1_K1_LBSPPA0_LBSPPB256_LBSPPM0_LPA0_LPB16_LPM0_LRVW8_LWPMn1_MIAV1_MIWT1_1_MO40_NTn1_NTA0_NTB0_NTC0_NTD0_NTM0_NEPBS0_NLCA1_NLCB1_ONLL0_PGR2_PLR1_PKA0_SIA3_SS0_SU32_SUM1_SUS256_SPO0_SRVW0_SSO0_SVW8_SK0_SKXCCM0_TLDS0_ULSGRO0_USL1_UIOFGRO0_USFGROn1_VSn1_VWA1_VWB1_WSGRA0_WSGRB0_WS32_WG32_4_1_WGM8_WGMXCC1_WGMXCCGn1
    SolutionIndex: 124
    SolutionNameMin: Cijk_Ailk_Bjlk_I8BH_SHB_HA_S_SCD_SAV_UserArgs_MT32x32x64_MI16x16x1_SN_LDSB0_AFC1_AFEM1_AFEM1_ASEM1_CLR1_CADS0_DTLA0_DTLB0_DTVA0_DTVB1_EPS0_FDSI0_GRPM1_GRVWA8_GRVWB8_GSU1_GSUAMB_GSUC0_GSUWGMRR0_GLS0_ISA1201_IU1_K1_LBSPPA256_LBSPPB0_LBSPPM0_LPA16_LPB0_LPM0_LRVW8_LWPMn1_MIAV1_MIWT1_1_MO40_NTn1_NTA0_NTB0_NTC0_NTD0_NTM0_NEPBS0_NLCA1_NLCB1_ONLL0_PGR2_PLR1_PKA0_SIA3_SS0_SU32_SUM1_SUS256_SPO0_SRVW0_SSO0_SVW8_SK0_SKXCCM0_TLDS0_ULSGRO0_USL1_UIOFGRO0_USFGROn1_VSn1_VWA1_VWB1_WSGRA0_WSGRB0_WS32_WG32_4_1_WGM8_WGMXCC1_WGMXCCGn1
    SolutionIndex: 125
    SolutionNameMin: Cijk_Ailk_Bjlk_I8BH_SHB_HA_S_SCD_SAV_UserArgs_MT32x32x64_MI16x16x1_SN_LDSB0_AFC1_AFEM1_AFEM1_ASEM1_CLR1_CADS0_DTLA0_DTLB0_DTVA0_DTVB1_EPS0_FDSI0_GRPM1_GRVWA16_GRVWB8_GSU1_GSUAMB_GSUC0_GSUWGMRR0_GLS0_ISA1201_IU1_K1_LBSPPA256_LBSPPB0_LBSPPM0_LPA16_LPB0_LPM0_LRVW8_LWPMn1_MIAV1_MIWT1_1_MO40_NTn1_NTA0_NTB0_NTC0_NTD0_NTM0_NEPBS0_NLCA1_NLCB1_ONLL0_PGR2_PLR1_PKA0_SIA3_SS0_SU32_SUM1_SUS256_SPO0_SRVW0_SSO0_SVW8_SK0_SKXCCM0_TLDS0_ULSGRO0_USL1_UIOFGRO0_USFGROn1_VSn1_VWA1_VWB1_WSGRA0_WSGRB0_WS32_WG32_4_1_WGM8_WGMXCC1_WGMXCCGn1
    SolutionIndex: 126
    SolutionNameMin: Cijk_Ailk_Bjlk_I8BH_SHB_HA_S_SCD_SAV_UserArgs_MT32x32x64_MI16x16x1_SN_LDSB0_AFC1_AFEM1_AFEM1_ASEM1_CLR1_CADS0_DTLA0_DTLB0_DTVA1_DTVB1_EPS0_FDSI0_GRPM1_GRVWA8_GRVWB8_GSU1_GSUAMB_GSUC0_GSUWGMRR0_GLS0_ISA1201_IU1_K1_LBSPPA0_LBSPPB0_LBSPPM0_LPA0_LPB0_LPM0_LRVW8_LWPMn1_MIAV1_MIWT1_1_MO40_NTn1_NTA0_NTB0_NTC0_NTD0_NTM0_NEPBS0_NLCA1_NLCB1_ONLL0_PGR1_PLR0_PKA0_SIA3_SS0_SU32_SUM1_SUS256_SPO0_SRVW0_SSO0_SVW8_SK0_SKXCCM0_TLDS0_ULSGRO0_USL1_UIOFGRO0_USFGROn1_VSn1_VWA1_VWB1_WSGRA0_WSGRB0_WS32_WG32_4_1_WGM8_WGMXCC1_WGMXCCGn1
    SolutionIndex: 127
    SolutionNameMin: Cijk_Ailk_Bjlk_I8BH_SHB_HA_S_SCD_SAV_UserArgs_MT16x32x64_MI16x16x1_SN_LDSB0_AFC1_AFEM1_AFEM1_ASEM1_CLR1_CADS0_DTLA0_DTLB0_DTVA1_DTVB1_EPS0_FDSI0_GRPM1_GRVWA8_GRVWB8_GSU1_GSUAMB_GSUC0_GSUWGMRR0_GLS0_ISA1201_IU1_K1_LBSPPA0_LBSPPB0_LBSPPM0_LPA0_LPB0_LPM0_LRVW8_LWPMn1_MIAV1_MIWT1_1_MO40_NTn1_NTA0_NTB0_NTC0_NTD0_NTM0_NEPBS0_NLCA1_NLCB1_ONLL0_PGR1_PLR0_PKA0_SIA3_SS0_SU32_SUM1_SUS256_SPO0_SRVW0_SSO0_SVW8_SK0_SKXCCM0_TLDS0_ULSGRO0_USL1_UIOFGRO0_USFGROn1_VSn1_VWA1_VWB1_WSGRA0_WSGRB0_WS32_WG16_4_1_WGM8_WGMXCC1_WGMXCCGn1
    SolutionIndex: 128
    SolutionNameMin: Cijk_Ailk_Bjlk_I8BH_SHB_HA_S_SCD_SAV_UserArgs_MT32x16x64_MI16x16x1_SN_LDSB0_AFC1_AFEM1_AFEM1_ASEM1_CLR1_CADS0_DTLA0_DTLB0_DTVA1_DTVB0_EPS1_FDSI0_GRPM1_GRVWA8_GRVWB1_GSU1_GSUAMB_GSUC0_GSUWGMRR0_GLS0_ISA1201_IU1_K1_LBSPPA0_LBSPPB128_LBSPPM0_LPA0_LPB16_LPM0_LRVW8_LWPMn1_MIAV1_MIWT1_1_MO40_NTn1_NTA0_NTB0_NTC0_NTD0_NTM0_NEPBS0_NLCA1_NLCB1_ONLL0_PGR1_PLR1_PKA0_SIA3_SS0_SU32_SUM1_SUS256_SPO0_SRVW0_SSO0_SVW8_SK0_SKXCCM0_TLDS0_ULSGRO0_USL1_UIOFGRO0_USFGROn1_VSn1_VWA1_VWB1_WSGRA0_WSGRB0_WS32_WG32_2_1_WGM8_WGMXCC1_WGMXCCGn1
    SolutionIndex: 129
    SolutionNameMin: Cijk_Ailk_Bjlk_I8BH_SHB_HA_S_SCD_SAV_UserArgs_MT32x16x64_MI16x16x1_SN_LDSB0_AFC1_AFEM1_AFEM1_ASEM1_CLR1_CADS0_DTLA0_DTLB0_DTVA1_DTVB0_EPS0_FDSI0_GRPM1_GRVWA8_GRVWB8_GSU1_GSUAMB_GSUC0_GSUWGMRR0_GLS0_ISA1201_IU1_K1_LBSPPA0_LBSPPB128_LBSPPM0_LPA0_LPB16_LPM0_LRVW8_LWPMn1_MIAV1_MIWT1_1_MO40_NTn1_NTA0_NTB0_NTC0_NTD0_NTM0_NEPBS0_NLCA1_NLCB1_ONLL0_PGR2_PLR1_PKA0_SIA3_SS0_SU32_SUM1_SUS256_SPO0_SRVW0_SSO0_SVW8_SK0_SKXCCM0_TLDS0_ULSGRO0_USL1_UIOFGRO0_USFGROn1_VSn1_VWA1_VWB1_WSGRA0_WSGRB0_WS32_WG32_2_1_WGM8_WGMXCC1_WGMXCCGn1
    SolutionIndex: 130
    SolutionNameMin: Cijk_Ailk_Bjlk_I8BH_SHB_HA_S_SCD_SAV_UserArgs_MT32x16x64_MI16x16x1_SN_LDSB0_AFC1_AFEM1_AFEM1_ASEM1_CLR1_CADS0_DTLA0_DTLB0_DTVA1_DTVB1_EPS0_FDSI0_GRPM1_GRVWA8_GRVWB8_GSU1_GSUAMB_GSUC0_GSUWGMRR0_GLS0_ISA1201_IU1_K1_LBSPPA0_LBSPPB0_LBSPPM0_LPA0_LPB0_LPM0_LRVW8_LWPMn1_MIAV1_MIWT1_1_MO40_NTn1_NTA0_NTB0_NTC0_NTD0_NTM0_NEPBS0_NLCA1_NLCB1_ONLL0_PGR1_PLR0_PKA0_SIA3_SS0_SU32_SUM1_SUS256_SPO0_SRVW0_SSO0_SVW8_SK0_SKXCCM0_TLDS0_ULSGRO0_USL1_UIOFGRO0_USFGROn1_VSn1_VWA1_VWB1_WSGRA0_WSGRB0_WS32_WG32_2_1_WGM8_WGMXCC1_WGMXCCGn1
    SolutionIndex: 131
    SolutionNameMin: Cijk_Ailk_Bjlk_I8BH_SHB_HA_S_SCD_SAV_UserArgs_MT16x16x64_MI16x16x1_SN_LDSB0_AFC1_AFEM1_AFEM1_ASEM1_CLR1_CADS0_DTLA0_DTLB0_DTVA1_DTVB1_EPS0_FDSI0_GRPM1_GRVWA8_GRVWB8_GSU1_GSUAMB_GSUC0_GSUWGMRR0_GLS0_ISA1201_IU1_K1_LBSPPA0_LBSPPB0_LBSPPM0_LPA0_LPB0_LPM0_LRVW8_LWPMn1_MIAV1_MIWT1_1_MO40_NTn1_NTA0_NTB0_NTC0_NTD0_NTM0_NEPBS0_NLCA1_NLCB1_ONLL0_PGR1_PLR0_PKA0_SIA3_SS0_SU32_SUM1_SUS256_SPO0_SRVW0_SSO0_SVW8_SK0_SKXCCM0_TLDS0_ULSGRO0_USL1_UIOFGRO0_USFGROn1_VSn1_VWA1_VWB1_WSGRA0_WSGRB0_WS32_WG16_2_1_WGM8_WGMXCC1_WGMXCCGn1
    SolutionIndex: 132
    SolutionNameMin: Cijk_Ailk_Bjlk_I8BH_SHB_HA_S_SCD_SAV_UserArgs_MT128x64x64_MI16x16x1_SN_LDSB0_AFC1_AFEM1_AFEM1_ASEM1_CLR1_CADS0_DTLA0_DTLB0_DTVA1_DTVB1_EPS0_FDSI0_GRPM1_GRVWA8_GRVWB8_GSU1_GSUAMB_GSUC0_GSUWGMRR0_GLS0_ISA1201_IU1_K1_LBSPPA0_LBSPPB0_LBSPPM0_LPA0_LPB0_LPM0_LRVW8_LWPMn1_MIAV1_MIWT8_1_MO40_NTn1_NTA0_NTB0_NTC0_NTD0_NTM0_NEPBS0_NLCA4_NLCB1_ONLL0_PGR1_PLR0_PKA0_SIA3_SS0_SU32_SUM1_SUS256_SPO0_SRVW0_SSO0_SVW8_SK0_SKXCCM0_TLDS0_ULSGRO0_USL1_UIOFGRO0_USFGROn1_VSn1_VWA1_VWB1_WSGRA0_WSGRB0_WS32_WG16_8_1_WGM8_WGMXCC1_WGMXCCGn1
    SolutionIndex: 133
    SolutionNameMin: Cijk_Ailk_Bjlk_I8BH_SHB_HA_S_SCD_SAV_UserArgs_MT128x32x64_MI16x16x1_SN_LDSB0_AFC1_AFEM1_AFEM1_ASEM1_CLR1_CADS0_DTLA0_DTLB0_DTVA1_DTVB0_EPS1_FDSI0_GRPM1_GRVWA8_GRVWB1_GSU1_GSUAMB_GSUC0_GSUWGMRR0_GLS0_ISA1201_IU1_K1_LBSPPA0_LBSPPB256_LBSPPM0_LPA0_LPB16_LPM0_LRVW8_LWPMn1_MIAV1_MIWT4_1_MO40_NTn1_NTA0_NTB0_NTC0_NTD0_NTM0_NEPBS0_NLCA4_NLCB1_ONLL0_PGR1_PLR1_PKA0_SIA3_SS0_SU32_SUM1_SUS256_SPO0_SRVW0_SSO0_SVW8_SK0_SKXCCM0_TLDS0_ULSGRO0_USL1_UIOFGRO0_USFGROn1_VSn1_VWA1_VWB1_WSGRA0_WSGRB0_WS32_WG32_4_1_WGM8_WGMXCC1_WGMXCCGn1
    SolutionIndex: 134
    SolutionNameMin: Cijk_Ailk_Bjlk_I8BH_SHB_HA_S_SCD_SAV_UserArgs_MT128x32x64_MI16x16x1_SN_LDSB0_AFC1_AFEM1_AFEM1_ASEM1_CLR1_CADS0_DTLA0_DTLB0_DTVA1_DTVB0_EPS1_FDSI0_GRPM1_GRVWA8_GRVWB4_GSU1_GSUAMB_GSUC0_GSUWGMRR0_GLS0_ISA1201_IU1_K1_LBSPPA0_LBSPPB256_LBSPPM0_LPA0_LPB16_LPM0_LRVW8_LWPMn1_MIAV1_MIWT4_1_MO40_NTn1_NTA0_NTB0_NTC0_NTD0_NTM0_NEPBS0_NLCA4_NLCB1_ONLL0_PGR1_PLR1_PKA0_SIA3_SS0_SU32_SUM1_SUS256_SPO0_SRVW0_SSO0_SVW8_SK0_SKXCCM0_TLDS0_ULSGRO0_USL1_UIOFGRO0_USFGROn1_VSn1_VWA1_VWB1_WSGRA0_WSGRB0_WS32_WG32_4_1_WGM8_WGMXCC1_WGMXCCGn1
    SolutionIndex: 135
    SolutionNameMin: Cijk_Ailk_Bjlk_I8BH_SHB_HA_S_SCD_SAV_UserArgs_MT128x32x64_MI16x16x1_SN_LDSB0_AFC1_AFEM1_AFEM1_ASEM1_CLR1_CADS0_DTLA0_DTLB0_DTVA1_DTVB0_EPS1_FDSI0_GRPM1_GRVWA8_GRVWB8_GSU1_GSUAMB_GSUC0_GSUWGMRR0_GLS0_ISA1201_IU1_K1_LBSPPA0_LBSPPB256_LBSPPM0_LPA0_LPB16_LPM0_LRVW8_LWPMn1_MIAV1_MIWT4_1_MO40_NTn1_NTA0_NTB0_NTC0_NTD0_NTM0_NEPBS0_NLCA4_NLCB1_ONLL0_PGR1_PLR1_PKA0_SIA3_SS0_SU32_SUM1_SUS256_SPO0_SRVW0_SSO0_SVW8_SK0_SKXCCM0_TLDS0_ULSGRO0_USL1_UIOFGRO0_USFGROn1_VSn1_VWA1_VWB1_WSGRA0_WSGRB0_WS32_WG32_4_1_WGM8_WGMXCC1_WGMXCCGn1
    SolutionIndex: 136
    SolutionNameMin: Cijk_Ailk_Bjlk_I8BH_SHB_HA_S_SCD_SAV_UserArgs_MT128x32x64_MI16x16x1_SN_LDSB0_AFC1_AFEM1_AFEM1_ASEM1_CLR1_CADS0_DTLA0_DTLB0_DTVA1_DTVB0_EPS1_FDSI0_GRPM1_GRVWA8_GRVWB16_GSU1_GSUAMB_GSUC0_GSUWGMRR0_GLS0_ISA1201_IU1_K1_LBSPPA0_LBSPPB256_LBSPPM0_LPA0_LPB16_LPM0_LRVW8_LWPMn1_MIAV1_MIWT4_1_MO40_NTn1_NTA0_NTB0_NTC0_NTD0_NTM0_NEPBS0_NLCA4_NLCB1_ONLL0_PGR1_PLR1_PKA0_SIA3_SS0_SU32_SUM1_SUS256_SPO0_SRVW0_SSO0_SVW8_SK0_SKXCCM0_TLDS0_ULSGRO0_USL1_UIOFGRO0_USFGROn1_VSn1_VWA1_VWB1_WSGRA0_WSGRB0_WS32_WG32_4_1_WGM8_WGMXCC1_WGMXCCGn1
    SolutionIndex: 137
    SolutionNameMin: Cijk_Ailk_Bjlk_I8BH_SHB_HA_S_SCD_SAV_UserArgs_MT128x32x64_MI16x16x1_SN_LDSB0_AFC1_AFEM1_AFEM1_ASEM1_CLR1_CADS0_DTLA0_DTLB0_DTVA1_DTVB0_EPS0_FDSI0_GRPM1_GRVWA8_GRVWB1_GSU1_GSUAMB_GSUC0_GSUWGMRR0_GLS0_ISA1201_IU1_K1_LBSPPA0_LBSPPB256_LBSPPM0_LPA0_LPB16_LPM0_LRVW8_LWPMn1_MIAV1_MIWT4_1_MO40_NTn1_NTA0_NTB0_NTC0_NTD0_NTM0_NEPBS0_NLCA4_NLCB1_ONLL0_PGR2_PLR1_PKA0_SIA3_SS0_SU32_SUM1_SUS256_SPO0_SRVW0_SSO0_SVW8_SK0_SKXCCM0_TLDS0_ULSGRO0_USL1_UIOFGRO0_USFGROn1_VSn1_VWA1_VWB1_WSGRA0_WSGRB0_WS32_WG32_4_1_WGM8_WGMXCC1_WGMXCCGn1
    SolutionIndex: 138
    SolutionNameMin: Cijk_Ailk_Bjlk_I8BH_SHB_HA_S_SCD_SAV_UserArgs_MT128x32x64_MI16x16x1_SN_LDSB0_AFC1_AFEM1_AFEM1_ASEM1_CLR1_CADS0_DTLA0_DTLB0_DTVA1_DTVB0_EPS0_FDSI0_GRPM1_GRVWA8_GRVWB4_GSU1_GSUAMB_GSUC0_GSUWGMRR0_GLS0_ISA1201_IU1_K1_LBSPPA0_LBSPPB256_LBSPPM0_LPA0_LPB16_LPM0_LRVW8_LWPMn1_MIAV1_MIWT4_1_MO40_NTn1_NTA0_NTB0_NTC0_NTD0_NTM0_NEPBS0_NLCA4_NLCB1_ONLL0_PGR2_PLR1_PKA0_SIA3_SS0_SU32_SUM1_SUS256_SPO0_SRVW0_SSO0_SVW8_SK0_SKXCCM0_TLDS0_ULSGRO0_USL1_UIOFGRO0_USFGROn1_VSn1_VWA1_VWB1_WSGRA0_WSGRB0_WS32_WG32_4_1_WGM8_WGMXCC1_WGMXCCGn1
    SolutionIndex: 139
    SolutionNameMin: Cijk_Ailk_Bjlk_I8BH_SHB_HA_S_SCD_SAV_UserArgs_MT128x32x64_MI16x16x1_SN_LDSB0_AFC1_AFEM1_AFEM1_ASEM1_CLR1_CADS0_DTLA0_DTLB0_DTVA1_DTVB0_EPS0_FDSI0_GRPM1_GRVWA8_GRVWB8_GSU1_GSUAMB_GSUC0_GSUWGMRR0_GLS0_ISA1201_IU1_K1_LBSPPA0_LBSPPB256_LBSPPM0_LPA0_LPB16_LPM0_LRVW8_LWPMn1_MIAV1_MIWT4_1_MO40_NTn1_NTA0_NTB0_NTC0_NTD0_NTM0_NEPBS0_NLCA4_NLCB1_ONLL0_PGR2_PLR1_PKA0_SIA3_SS0_SU32_SUM1_SUS256_SPO0_SRVW0_SSO0_SVW8_SK0_SKXCCM0_TLDS0_ULSGRO0_USL1_UIOFGRO0_USFGROn1_VSn1_VWA1_VWB1_WSGRA0_WSGRB0_WS32_WG32_4_1_WGM8_WGMXCC1_WGMXCCGn1
    SolutionIndex: 140
    SolutionNameMin: Cijk_Ailk_Bjlk_I8BH_SHB_HA_S_SCD_SAV_UserArgs_MT128x32x64_MI16x16x1_SN_LDSB0_AFC1_AFEM1_AFEM1_ASEM1_CLR1_CADS0_DTLA0_DTLB0_DTVA1_DTVB0_EPS0_FDSI0_GRPM1_GRVWA8_GRVWB16_GSU1_GSUAMB_GSUC0_GSUWGMRR0_GLS0_ISA1201_IU1_K1_LBSPPA0_LBSPPB256_LBSPPM0_LPA0_LPB16_LPM0_LRVW8_LWPMn1_MIAV1_MIWT4_1_MO40_NTn1_NTA0_NTB0_NTC0_NTD0_NTM0_NEPBS0_NLCA4_NLCB1_ONLL0_PGR2_PLR1_PKA0_SIA3_SS0_SU32_SUM1_SUS256_SPO0_SRVW0_SSO0_SVW8_SK0_SKXCCM0_TLDS0_ULSGRO0_USL1_UIOFGRO0_USFGROn1_VSn1_VWA1_VWB1_WSGRA0_WSGRB0_WS32_WG32_4_1_WGM8_WGMXCC1_WGMXCCGn1
    SolutionIndex: 141
    SolutionNameMin: Cijk_Ailk_Bjlk_I8BH_SHB_HA_S_SCD_SAV_UserArgs_MT128x32x64_MI16x16x1_SN_LDSB0_AFC1_AFEM1_AFEM1_ASEM1_CLR1_CADS0_DTLA0_DTLB0_DTVA1_DTVB1_EPS0_FDSI0_GRPM1_GRVWA8_GRVWB8_GSU1_GSUAMB_GSUC0_GSUWGMRR0_GLS0_ISA1201_IU1_K1_LBSPPA0_LBSPPB0_LBSPPM0_LPA0_LPB0_LPM0_LRVW8_LWPMn1_MIAV1_MIWT4_1_MO40_NTn1_NTA0_NTB0_NTC0_NTD0_NTM0_NEPBS0_NLCA4_NLCB1_ONLL0_PGR1_PLR0_PKA0_SIA3_SS0_SU32_SUM1_SUS256_SPO0_SRVW0_SSO0_SVW8_SK0_SKXCCM0_TLDS0_ULSGRO0_USL1_UIOFGRO0_USFGROn1_VSn1_VWA1_VWB1_WSGRA0_WSGRB0_WS32_WG32_4_1_WGM8_WGMXCC1_WGMXCCGn1
    SolutionIndex: 142
    SolutionNameMin: Cijk_Ailk_Bjlk_I8BH_SHB_HA_S_SCD_SAV_UserArgs_MT32x128x64_MI16x16x1_SN_LDSB1_AFC1_AFEM1_AFEM1_ASEM1_CLR1_CADS0_DTLA0_DTLB0_DTVA0_DTVB0_EPS1_FDSI0_GRPM1_GRVWA8_GRVWB16_GSU1_GSUAMB_GSUC0_GSUWGMRR0_GLS0_ISA1201_IU4_K1_LBSPPA256_LBSPPB1024_LBSPPM0_LPA16_LPB64_LPM0_LRVW8_LWPMn1_MIAV1_MIWT1_4_MO40_NTn1_NTA0_NTB0_NTC0_NTD0_NTM0_NEPBS0_NLCA1_NLCB1_ONLL0_PGR1_PLR1_PKA0_SIA2_SS0_SU32_SUM1_SUS256_SPO0_SRVW0_SSO0_SVW8_SK0_SKXCCM0_TLDS0_ULSGRO0_USL1_UIOFGRO0_USFGROn1_VSn1_VWA1_VWB4_WSGRA0_WSGRB0_WS32_WG32_4_1_WGM8_WGMXCC1_WGMXCCGn1
    SolutionIndex: 143
    SolutionNameMin: Cijk_Ailk_Bjlk_I8BH_SHB_HA_S_SCD_SAV_UserArgs_MT32x128x64_MI16x16x1_SN_LDSB1_AFC1_AFEM1_AFEM1_ASEM1_CLR1_CADS0_DTLA0_DTLB0_DTVA0_DTVB0_EPS0_FDSI0_GRPM1_GRVWA4_GRVWB16_GSU1_GSUAMB_GSUC0_GSUWGMRR0_GLS0_ISA1201_IU4_K1_LBSPPA256_LBSPPB1024_LBSPPM0_LPA16_LPB64_LPM0_LRVW8_LWPMn1_MIAV1_MIWT1_4_MO40_NTn1_NTA0_NTB0_NTC0_NTD0_NTM0_NEPBS0_NLCA1_NLCB1_ONLL0_PGR2_PLR1_PKA0_SIA2_SS0_SU32_SUM1_SUS256_SPO0_SRVW0_SSO0_SVW8_SK0_SKXCCM0_TLDS0_ULSGRO0_USL1_UIOFGRO0_USFGROn1_VSn1_VWA1_VWB4_WSGRA0_WSGRB0_WS32_WG32_4_1_WGM8_WGMXCC1_WGMXCCGn1
    SolutionIndex: 144
    SolutionNameMin: Cijk_Ailk_Bjlk_I8BH_SHB_HA_S_SCD_SAV_UserArgs_MT32x128x64_MI16x16x1_SN_LDSB0_AFC1_AFEM1_AFEM1_ASEM1_CLR1_CADS0_DTLA0_DTLB0_DTVA0_DTVB0_EPS0_FDSI0_GRPM1_GRVWA8_GRVWB16_GSU1_GSUAMB_GSUC0_GSUWGMRR0_GLS0_ISA1201_IU1_K1_LBSPPA256_LBSPPB1024_LBSPPM0_LPA16_LPB64_LPM0_LRVW8_LWPMn1_MIAV1_MIWT1_4_MO40_NTn1_NTA0_NTB0_NTC0_NTD0_NTM0_NEPBS0_NLCA1_NLCB1_ONLL0_PGR2_PLR1_PKA0_SIA3_SS0_SU32_SUM1_SUS256_SPO0_SRVW0_SSO0_SVW8_SK0_SKXCCM0_TLDS0_ULSGRO0_USL1_UIOFGRO0_USFGROn1_VSn1_VWA1_VWB4_WSGRA0_WSGRB0_WS32_WG32_4_1_WGM8_WGMXCC1_WGMXCCGn1
    SolutionIndex: 145
    SolutionNameMin: Cijk_Ailk_Bjlk_I8BH_SHB_HA_S_SCD_SAV_UserArgs_MT32x128x64_MI16x16x1_SN_LDSB0_AFC1_AFEM1_AFEM1_ASEM1_CLR1_CADS0_DTLA0_DTLB0_DTVA0_DTVB0_EPS0_FDSI0_GRPM1_GRVWA8_GRVWB16_GSU1_GSUAMB_GSUC0_GSUWGMRR0_GLS0_ISA1201_IU1_K1_LBSPPA256_LBSPPB1024_LBSPPM0_LPA16_LPB64_LPM0_LRVW8_LWPMn1_MIAV1_MIWT1_4_MO40_NTn1_NTA0_NTB0_NTC0_NTD0_NTM0_NEPBS0_NLCA1_NLCB1_ONLL0_PGR2_PLR1_PKA0_SIA3_SS0_SU32_SUM1_SUS256_SPO0_SRVW0_SSO0_SVW8_SK0_SKXCCM0_TLDS0_ULSGRO1_USL1_UIOFGRO0_USFGROn1_VSn1_VWA1_VWB4_WSGRA0_WSGRB0_WS32_WG32_4_1_WGM8_WGMXCC1_WGMXCCGn1
    SolutionIndex: 146
    SolutionNameMin: Cijk_Ailk_Bjlk_I8BH_SHB_HA_S_SCD_SAV_UserArgs_MT32x128x64_MI16x16x1_SN_LDSB0_AFC1_AFEM1_AFEM1_ASEM1_CLR1_CADS0_DTLA0_DTLB0_DTVA0_DTVB1_EPS1_FDSI0_GRPM1_GRVWA1_GRVWB8_GSU1_GSUAMB_GSUC0_GSUWGMRR0_GLS0_ISA1201_IU1_K1_LBSPPA256_LBSPPB0_LBSPPM0_LPA16_LPB0_LPM0_LRVW8_LWPMn1_MIAV1_MIWT1_4_MO40_NTn1_NTA0_NTB0_NTC0_NTD0_NTM0_NEPBS0_NLCA1_NLCB4_ONLL0_PGR1_PLR1_PKA0_SIA3_SS0_SU32_SUM1_SUS256_SPO0_SRVW0_SSO0_SVW8_SK0_SKXCCM0_TLDS0_ULSGRO0_USL1_UIOFGRO0_USFGROn1_VSn1_VWA1_VWB1_WSGRA0_WSGRB0_WS32_WG32_4_1_WGM8_WGMXCC1_WGMXCCGn1
    SolutionIndex: 147
    SolutionNameMin: Cijk_Ailk_Bjlk_I8BH_SHB_HA_S_SCD_SAV_UserArgs_MT32x128x64_MI16x16x1_SN_LDSB0_AFC1_AFEM1_AFEM1_ASEM1_CLR1_CADS0_DTLA0_DTLB0_DTVA0_DTVB1_EPS1_FDSI0_GRPM1_GRVWA4_GRVWB8_GSU1_GSUAMB_GSUC0_GSUWGMRR0_GLS0_ISA1201_IU1_K1_LBSPPA256_LBSPPB0_LBSPPM0_LPA16_LPB0_LPM0_LRVW8_LWPMn1_MIAV1_MIWT1_4_MO40_NTn1_NTA0_NTB0_NTC0_NTD0_NTM0_NEPBS0_NLCA1_NLCB4_ONLL0_PGR1_PLR1_PKA0_SIA3_SS0_SU32_SUM1_SUS256_SPO0_SRVW0_SSO0_SVW8_SK0_SKXCCM0_TLDS0_ULSGRO0_USL1_UIOFGRO0_USFGROn1_VSn1_VWA1_VWB1_WSGRA0_WSGRB0_WS32_WG32_4_1_WGM8_WGMXCC1_WGMXCCGn1
    SolutionIndex: 148
    SolutionNameMin: Cijk_Ailk_Bjlk_I8BH_SHB_HA_S_SCD_SAV_UserArgs_MT32x128x64_MI16x16x1_SN_LDSB0_AFC1_AFEM1_AFEM1_ASEM1_CLR1_CADS0_DTLA0_DTLB0_DTVA0_DTVB1_EPS1_FDSI0_GRPM1_GRVWA8_GRVWB8_GSU1_GSUAMB_GSUC0_GSUWGMRR0_GLS0_ISA1201_IU1_K1_LBSPPA256_LBSPPB0_LBSPPM0_LPA16_LPB0_LPM0_LRVW8_LWPMn1_MIAV1_MIWT1_4_MO40_NTn1_NTA0_NTB0_NTC0_NTD0_NTM0_NEPBS0_NLCA1_NLCB4_ONLL0_PGR1_PLR1_PKA0_SIA3_SS0_SU32_SUM1_SUS256_SPO0_SRVW0_SSO0_SVW8_SK0_SKXCCM0_TLDS0_ULSGRO0_USL1_UIOFGRO0_USFGROn1_VSn1_VWA1_VWB1_WSGRA0_WSGRB0_WS32_WG32_4_1_WGM8_WGMXCC1_WGMXCCGn1
    SolutionIndex: 149
    SolutionNameMin: Cijk_Ailk_Bjlk_I8BH_SHB_HA_S_SCD_SAV_UserArgs_MT32x128x64_MI16x16x1_SN_LDSB0_AFC1_AFEM1_AFEM1_ASEM1_CLR1_CADS0_DTLA0_DTLB0_DTVA0_DTVB1_EPS1_FDSI0_GRPM1_GRVWA16_GRVWB8_GSU1_GSUAMB_GSUC0_GSUWGMRR0_GLS0_ISA1201_IU1_K1_LBSPPA256_LBSPPB0_LBSPPM0_LPA16_LPB0_LPM0_LRVW8_LWPMn1_MIAV1_MIWT1_4_MO40_NTn1_NTA0_NTB0_NTC0_NTD0_NTM0_NEPBS0_NLCA1_NLCB4_ONLL0_PGR1_PLR1_PKA0_SIA3_SS0_SU32_SUM1_SUS256_SPO0_SRVW0_SSO0_SVW8_SK0_SKXCCM0_TLDS0_ULSGRO0_USL1_UIOFGRO0_USFGROn1_VSn1_VWA1_VWB1_WSGRA0_WSGRB0_WS32_WG32_4_1_WGM8_WGMXCC1_WGMXCCGn1
    SolutionIndex: 150
    SolutionNameMin: Cijk_Ailk_Bjlk_I8BH_SHB_HA_S_SCD_SAV_UserArgs_MT32x128x64_MI16x16x1_SN_LDSB0_AFC1_AFEM1_AFEM1_ASEM1_CLR1_CADS0_DTLA0_DTLB0_DTVA0_DTVB1_EPS0_FDSI0_GRPM1_GRVWA1_GRVWB8_GSU1_GSUAMB_GSUC0_GSUWGMRR0_GLS0_ISA1201_IU1_K1_LBSPPA256_LBSPPB0_LBSPPM0_LPA16_LPB0_LPM0_LRVW8_LWPMn1_MIAV1_MIWT1_4_MO40_NTn1_NTA0_NTB0_NTC0_NTD0_NTM0_NEPBS0_NLCA1_NLCB4_ONLL0_PGR2_PLR1_PKA0_SIA3_SS0_SU32_SUM1_SUS256_SPO0_SRVW0_SSO0_SVW8_SK0_SKXCCM0_TLDS0_ULSGRO0_USL1_UIOFGRO0_USFGROn1_VSn1_VWA1_VWB1_WSGRA0_WSGRB0_WS32_WG32_4_1_WGM8_WGMXCC1_WGMXCCGn1
    SolutionIndex: 151
    SolutionNameMin: Cijk_Ailk_Bjlk_I8BH_SHB_HA_S_SCD_SAV_UserArgs_MT32x128x64_MI16x16x1_SN_LDSB0_AFC1_AFEM1_AFEM1_ASEM1_CLR1_CADS0_DTLA0_DTLB0_DTVA0_DTVB1_EPS0_FDSI0_GRPM1_GRVWA8_GRVWB8_GSU1_GSUAMB_GSUC0_GSUWGMRR0_GLS0_ISA1201_IU1_K1_LBSPPA256_LBSPPB0_LBSPPM0_LPA16_LPB0_LPM0_LRVW8_LWPMn1_MIAV1_MIWT1_4_MO40_NTn1_NTA0_NTB0_NTC0_NTD0_NTM0_NEPBS0_NLCA1_NLCB4_ONLL0_PGR2_PLR1_PKA0_SIA3_SS0_SU32_SUM1_SUS256_SPO0_SRVW0_SSO0_SVW8_SK0_SKXCCM0_TLDS0_ULSGRO0_USL1_UIOFGRO0_USFGROn1_VSn1_VWA1_VWB1_WSGRA0_WSGRB0_WS32_WG32_4_1_WGM8_WGMXCC1_WGMXCCGn1
    SolutionIndex: 152
    SolutionNameMin: Cijk_Ailk_Bjlk_I8BH_SHB_HA_S_SCD_SAV_UserArgs_MT32x128x64_MI16x16x1_SN_LDSB0_AFC1_AFEM1_AFEM1_ASEM1_CLR1_CADS0_DTLA0_DTLB0_DTVA0_DTVB1_EPS0_FDSI0_GRPM1_GRVWA16_GRVWB8_GSU1_GSUAMB_GSUC0_GSUWGMRR0_GLS0_ISA1201_IU1_K1_LBSPPA256_LBSPPB0_LBSPPM0_LPA16_LPB0_LPM0_LRVW8_LWPMn1_MIAV1_MIWT1_4_MO40_NTn1_NTA0_NTB0_NTC0_NTD0_NTM0_NEPBS0_NLCA1_NLCB4_ONLL0_PGR2_PLR1_PKA0_SIA3_SS0_SU32_SUM1_SUS256_SPO0_SRVW0_SSO0_SVW8_SK0_SKXCCM0_TLDS0_ULSGRO0_USL1_UIOFGRO0_USFGROn1_VSn1_VWA1_VWB1_WSGRA0_WSGRB0_WS32_WG32_4_1_WGM8_WGMXCC1_WGMXCCGn1
    SolutionIndex: 153
    SolutionNameMin: Cijk_Ailk_Bjlk_I8BH_SHB_HA_S_SCD_SAV_UserArgs_MT32x128x64_MI16x16x1_SN_LDSB0_AFC1_AFEM1_AFEM1_ASEM1_CLR1_CADS0_DTLA0_DTLB0_DTVA1_DTVB1_EPS0_FDSI0_GRPM1_GRVWA8_GRVWB8_GSU1_GSUAMB_GSUC0_GSUWGMRR0_GLS0_ISA1201_IU1_K1_LBSPPA0_LBSPPB0_LBSPPM0_LPA0_LPB0_LPM0_LRVW8_LWPMn1_MIAV1_MIWT1_4_MO40_NTn1_NTA0_NTB0_NTC0_NTD0_NTM0_NEPBS0_NLCA1_NLCB4_ONLL0_PGR1_PLR0_PKA0_SIA3_SS0_SU32_SUM1_SUS256_SPO0_SRVW0_SSO0_SVW8_SK0_SKXCCM0_TLDS0_ULSGRO0_USL1_UIOFGRO0_USFGROn1_VSn1_VWA1_VWB1_WSGRA0_WSGRB0_WS32_WG32_4_1_WGM8_WGMXCC1_WGMXCCGn1
    SolutionIndex: 154
    SolutionNameMin: Cijk_Ailk_Bjlk_I8BH_SHB_HA_S_SCD_SAV_UserArgs_MT64x128x64_MI16x16x1_SN_LDSB0_AFC1_AFEM1_AFEM1_ASEM1_CLR1_CADS0_DTLA0_DTLB0_DTVA1_DTVB1_EPS0_FDSI0_GRPM1_GRVWA8_GRVWB8_GSU1_GSUAMB_GSUC0_GSUWGMRR0_GLS0_ISA1201_IU1_K1_LBSPPA0_LBSPPB0_LBSPPM0_LPA0_LPB0_LPM0_LRVW8_LWPMn1_MIAV1_MIWT1_8_MO40_NTn1_NTA0_NTB0_NTC0_NTD0_NTM0_NEPBS0_NLCA1_NLCB4_ONLL0_PGR1_PLR0_PKA0_SIA3_SS0_SU32_SUM1_SUS256_SPO0_SRVW0_SSO0_SVW8_SK0_SKXCCM0_TLDS0_ULSGRO0_USL1_UIOFGRO0_USFGROn1_VSn1_VWA1_VWB1_WSGRA0_WSGRB0_WS32_WG64_2_1_WGM8_WGMXCC1_WGMXCCGn1
    SolutionIndex: 155
    SolutionNameMin: Cijk_Ailk_Bjlk_I8BH_SHB_HA_S_SCD_SAV_UserArgs_MT16x128x64_MI16x16x1_SN_LDSB0_AFC1_AFEM1_AFEM1_ASEM1_CLR1_CADS0_DTLA0_DTLB0_DTVA1_DTVB1_EPS0_FDSI0_GRPM1_GRVWA8_GRVWB8_GSU1_GSUAMB_GSUC0_GSUWGMRR0_GLS0_ISA1201_IU1_K1_LBSPPA0_LBSPPB0_LBSPPM0_LPA0_LPB0_LPM0_LRVW8_LWPMn1_MIAV1_MIWT1_8_MO40_NTn1_NTA0_NTB0_NTC0_NTD0_NTM0_NEPBS0_NLCA1_NLCB4_ONLL0_PGR1_PLR0_PKA0_SIA3_SS0_SU32_SUM1_SUS256_SPO0_SRVW0_SSO0_SVW8_SK0_SKXCCM0_TLDS0_ULSGRO0_USL1_UIOFGRO0_USFGROn1_VSn1_VWA1_VWB1_WSGRA0_WSGRB0_WS32_WG16_2_1_WGM8_WGMXCC1_WGMXCCGn1
    SolutionIndex: 156
    SolutionNameMin: Cijk_Ailk_Bjlk_I8BH_SHB_HA_S_SCD_SAV_UserArgs_MT16x256x64_MI16x16x1_SN_LDSB0_AFC1_AFEM1_AFEM1_ASEM1_CLR1_CADS0_DTLA0_DTLB0_DTVA1_DTVB1_EPS0_FDSI0_GRPM1_GRVWA8_GRVWB8_GSU1_GSUAMB_GSUC0_GSUWGMRR0_GLS0_ISA1201_IU1_K1_LBSPPA0_LBSPPB0_LBSPPM0_LPA0_LPB0_LPM0_LRVW8_LWPMn1_MIAV1_MIWT1_8_MO40_NTn1_NTA0_NTB0_NTC0_NTD0_NTM0_NEPBS0_NLCA1_NLCB4_ONLL0_PGR1_PLR0_PKA0_SIA3_SS0_SU32_SUM1_SUS256_SPO0_SRVW0_SSO0_SVW8_SK0_SKXCCM0_TLDS0_ULSGRO0_USL1_UIOFGRO0_USFGROn1_VSn1_VWA1_VWB1_WSGRA0_WSGRB0_WS32_WG16_4_1_WGM8_WGMXCC1_WGMXCCGn1
    SolutionIndex: 157
    SolutionNameMin: Cijk_Ailk_Bjlk_I8BH_SHB_HA_S_SCD_SAV_UserArgs_MT64x64x128_MI16x16x1_SN_LDSB0_AFC1_AFEM1_AFEM1_ASEM1_CLR1_CADS0_DTLA0_DTLB0_DTVA1_DTVB0_EPS1_FDSI0_GRPM1_GRVWA8_GRVWB4_GSU1_GSUAMB_GSUC0_GSUWGMRR0_GLS0_ISA1201_IU1_K1_LBSPPA0_LBSPPB512_LBSPPM0_LPA0_LPB32_LPM0_LRVW8_LWPMn1_MIAV1_MIWT2_2_MO40_NTn1_NTA0_NTB0_NTC0_NTD0_NTM0_NEPBS0_NLCA8_NLCB1_ONLL0_PGR1_PLR1_PKA0_SIA3_SS0_SU32_SUM1_SUS256_SPO0_SRVW0_SSO0_SVW8_SK0_SKXCCM0_TLDS0_ULSGRO0_USL1_UIOFGRO0_USFGROn1_VSn1_VWA1_VWB2_WSGRA0_WSGRB0_WS32_WG32_4_1_WGM8_WGMXCC1_WGMXCCGn1
    SolutionIndex: 158
    SolutionNameMin: Cijk_Ailk_Bjlk_I8BH_SHB_HA_S_SCD_SAV_UserArgs_MT64x64x128_MI16x16x1_SN_LDSB0_AFC1_AFEM1_AFEM1_ASEM1_CLR1_CADS0_DTLA0_DTLB0_DTVA1_DTVB0_EPS1_FDSI0_GRPM1_GRVWA8_GRVWB8_GSU1_GSUAMB_GSUC0_GSUWGMRR0_GLS0_ISA1201_IU1_K1_LBSPPA0_LBSPPB512_LBSPPM0_LPA0_LPB32_LPM0_LRVW8_LWPMn1_MIAV1_MIWT2_2_MO40_NTn1_NTA0_NTB0_NTC0_NTD0_NTM0_NEPBS0_NLCA8_NLCB1_ONLL0_PGR1_PLR1_PKA0_SIA3_SS0_SU32_SUM1_SUS256_SPO0_SRVW0_SSO0_SVW8_SK0_SKXCCM0_TLDS0_ULSGRO0_USL1_UIOFGRO0_USFGROn1_VSn1_VWA1_VWB2_WSGRA0_WSGRB0_WS32_WG32_4_1_WGM8_WGMXCC1_WGMXCCGn1
    SolutionIndex: 159
    SolutionNameMin: Cijk_Ailk_Bjlk_I8BH_SHB_HA_S_SCD_SAV_UserArgs_MT64x64x128_MI16x16x1_SN_LDSB0_AFC1_AFEM1_AFEM1_ASEM1_CLR1_CADS0_DTLA0_DTLB0_DTVA1_DTVB0_EPS1_FDSI0_GRPM1_GRVWA8_GRVWB16_GSU1_GSUAMB_GSUC0_GSUWGMRR0_GLS0_ISA1201_IU1_K1_LBSPPA0_LBSPPB512_LBSPPM0_LPA0_LPB32_LPM0_LRVW8_LWPMn1_MIAV1_MIWT2_2_MO40_NTn1_NTA0_NTB0_NTC0_NTD0_NTM0_NEPBS0_NLCA8_NLCB1_ONLL0_PGR1_PLR1_PKA0_SIA3_SS0_SU32_SUM1_SUS256_SPO0_SRVW0_SSO0_SVW8_SK0_SKXCCM0_TLDS0_ULSGRO0_USL1_UIOFGRO0_USFGROn1_VSn1_VWA1_VWB2_WSGRA0_WSGRB0_WS32_WG32_4_1_WGM8_WGMXCC1_WGMXCCGn1
    SolutionIndex: 160
    SolutionNameMin: Cijk_Ailk_Bjlk_I8BH_SHB_HA_S_SCD_SAV_UserArgs_MT64x64x128_MI16x16x1_SN_LDSB0_AFC1_AFEM1_AFEM1_ASEM1_CLR1_CADS0_DTLA0_DTLB0_DTVA1_DTVB0_EPS0_FDSI0_GRPM1_GRVWA8_GRVWB16_GSU1_GSUAMB_GSUC0_GSUWGMRR0_GLS0_ISA1201_IU1_K1_LBSPPA0_LBSPPB512_LBSPPM0_LPA0_LPB32_LPM0_LRVW8_LWPMn1_MIAV1_MIWT2_2_MO40_NTn1_NTA0_NTB0_NTC0_NTD0_NTM0_NEPBS0_NLCA8_NLCB1_ONLL0_PGR2_PLR1_PKA0_SIA3_SS0_SU32_SUM1_SUS256_SPO0_SRVW0_SSO0_SVW8_SK0_SKXCCM0_TLDS0_ULSGRO0_USL1_UIOFGRO0_USFGROn1_VSn1_VWA1_VWB2_WSGRA0_WSGRB0_WS32_WG32_4_1_WGM8_WGMXCC1_WGMXCCGn1
    SolutionIndex: 161
    SolutionNameMin: Cijk_Ailk_Bjlk_I8BH_SHB_HA_S_SCD_SAV_UserArgs_MT64x64x128_MI16x16x1_SN_LDSB0_AFC1_AFEM1_AFEM1_ASEM1_CLR1_CADS0_DTLA0_DTLB0_DTVA0_DTVB1_EPS1_FDSI0_GRPM1_GRVWA4_GRVWB8_GSU1_GSUAMB_GSUC0_GSUWGMRR0_GLS0_ISA1201_IU1_K1_LBSPPA512_LBSPPB0_LBSPPM0_LPA32_LPB0_LPM0_LRVW8_LWPMn1_MIAV1_MIWT2_2_MO40_NTn1_NTA0_NTB0_NTC0_NTD0_NTM0_NEPBS0_NLCA1_NLCB8_ONLL0_PGR1_PLR1_PKA0_SIA3_SS0_SU32_SUM1_SUS256_SPO0_SRVW0_SSO0_SVW16_SK0_SKXCCM0_TLDS0_ULSGRO0_USL1_UIOFGRO0_USFGROn1_VSn1_VWA2_VWB1_WSGRA0_WSGRB0_WS32_WG32_4_1_WGM8_WGMXCC1_WGMXCCGn1
    SolutionIndex: 162
    SolutionNameMin: Cijk_Ailk_Bjlk_I8BH_SHB_HA_S_SCD_SAV_UserArgs_MT64x64x128_MI16x16x1_SN_LDSB0_AFC1_AFEM1_AFEM1_ASEM1_CLR1_CADS0_DTLA0_DTLB0_DTVA0_DTVB1_EPS1_FDSI0_GRPM1_GRVWA8_GRVWB8_GSU1_GSUAMB_GSUC0_GSUWGMRR0_GLS0_ISA1201_IU1_K1_LBSPPA512_LBSPPB0_LBSPPM0_LPA32_LPB0_LPM0_LRVW8_LWPMn1_MIAV1_MIWT2_2_MO40_NTn1_NTA0_NTB0_NTC0_NTD0_NTM0_NEPBS0_NLCA1_NLCB8_ONLL0_PGR1_PLR1_PKA0_SIA3_SS0_SU32_SUM1_SUS256_SPO0_SRVW0_SSO0_SVW16_SK0_SKXCCM0_TLDS0_ULSGRO0_USL1_UIOFGRO0_USFGROn1_VSn1_VWA2_VWB1_WSGRA0_WSGRB0_WS32_WG32_4_1_WGM8_WGMXCC1_WGMXCCGn1
    SolutionIndex: 163
    SolutionNameMin: Cijk_Ailk_Bjlk_I8BH_SHB_HA_S_SCD_SAV_UserArgs_MT64x64x128_MI16x16x1_SN_LDSB0_AFC1_AFEM1_AFEM1_ASEM1_CLR1_CADS0_DTLA0_DTLB0_DTVA0_DTVB1_EPS1_FDSI0_GRPM1_GRVWA16_GRVWB8_GSU1_GSUAMB_GSUC0_GSUWGMRR0_GLS0_ISA1201_IU1_K1_LBSPPA512_LBSPPB0_LBSPPM0_LPA32_LPB0_LPM0_LRVW8_LWPMn1_MIAV1_MIWT2_2_MO40_NTn1_NTA0_NTB0_NTC0_NTD0_NTM0_NEPBS0_NLCA1_NLCB8_ONLL0_PGR1_PLR1_PKA0_SIA3_SS0_SU32_SUM1_SUS256_SPO0_SRVW0_SSO0_SVW16_SK0_SKXCCM0_TLDS0_ULSGRO0_USL1_UIOFGRO0_USFGROn1_VSn1_VWA2_VWB1_WSGRA0_WSGRB0_WS32_WG32_4_1_WGM8_WGMXCC1_WGMXCCGn1
    SolutionIndex: 164
    SolutionNameMin: Cijk_Ailk_Bjlk_I8BH_SHB_HA_S_SCD_SAV_UserArgs_MT32x32x128_MI16x16x1_SN_LDSB0_AFC1_AFEM1_AFEM1_ASEM1_CLR1_CADS0_DTLA0_DTLB0_DTVA1_DTVB0_EPS1_FDSI0_GRPM1_GRVWA8_GRVWB4_GSU1_GSUAMB_GSUC0_GSUWGMRR0_GLS0_ISA1201_IU1_K1_LBSPPA0_LBSPPB256_LBSPPM0_LPA0_LPB16_LPM0_LRVW8_LWPMn1_MIAV1_MIWT1_1_MO40_NTn1_NTA0_NTB0_NTC0_NTD0_NTM0_NEPBS0_NLCA1_NLCB1_ONLL0_PGR1_PLR1_PKA0_SIA3_SS0_SU32_SUM1_SUS256_SPO0_SRVW0_SSO0_SVW8_SK0_SKXCCM0_TLDS0_ULSGRO0_USL1_UIOFGRO0_USFGROn1_VSn1_VWA1_VWB1_WSGRA0_WSGRB0_WS32_WG32_4_1_WGM8_WGMXCC1_WGMXCCGn1
    SolutionIndex: 165
    SolutionNameMin: Cijk_Ailk_Bjlk_I8BH_SHB_HA_S_SCD_SAV_UserArgs_MT32x32x128_MI16x16x1_SN_LDSB0_AFC1_AFEM1_AFEM1_ASEM1_CLR1_CADS0_DTLA0_DTLB0_DTVA1_DTVB0_EPS1_FDSI0_GRPM1_GRVWA8_GRVWB8_GSU1_GSUAMB_GSUC0_GSUWGMRR0_GLS0_ISA1201_IU1_K1_LBSPPA0_LBSPPB256_LBSPPM0_LPA0_LPB16_LPM0_LRVW8_LWPMn1_MIAV1_MIWT1_1_MO40_NTn1_NTA0_NTB0_NTC0_NTD0_NTM0_NEPBS0_NLCA1_NLCB1_ONLL0_PGR1_PLR1_PKA0_SIA3_SS0_SU32_SUM1_SUS256_SPO0_SRVW0_SSO0_SVW8_SK0_SKXCCM0_TLDS0_ULSGRO0_USL1_UIOFGRO0_USFGROn1_VSn1_VWA1_VWB1_WSGRA0_WSGRB0_WS32_WG32_4_1_WGM8_WGMXCC1_WGMXCCGn1
    SolutionIndex: 166
    SolutionNameMin: Cijk_Ailk_Bjlk_I8BH_SHB_HA_S_SCD_SAV_UserArgs_MT32x32x128_MI16x16x1_SN_LDSB0_AFC1_AFEM1_AFEM1_ASEM1_CLR1_CADS0_DTLA0_DTLB0_DTVA1_DTVB0_EPS1_FDSI0_GRPM1_GRVWA8_GRVWB16_GSU1_GSUAMB_GSUC0_GSUWGMRR0_GLS0_ISA1201_IU1_K1_LBSPPA0_LBSPPB256_LBSPPM0_LPA0_LPB16_LPM0_LRVW8_LWPMn1_MIAV1_MIWT1_1_MO40_NTn1_NTA0_NTB0_NTC0_NTD0_NTM0_NEPBS0_NLCA1_NLCB1_ONLL0_PGR1_PLR1_PKA0_SIA3_SS0_SU32_SUM1_SUS256_SPO0_SRVW0_SSO0_SVW8_SK0_SKXCCM0_TLDS0_ULSGRO0_USL1_UIOFGRO0_USFGROn1_VSn1_VWA1_VWB1_WSGRA0_WSGRB0_WS32_WG32_4_1_WGM8_WGMXCC1_WGMXCCGn1
    SolutionIndex: 167
    SolutionNameMin: Cijk_Ailk_Bjlk_I8BH_SHB_HA_S_SCD_SAV_UserArgs_MT32x32x128_MI16x16x1_SN_LDSB0_AFC1_AFEM1_AFEM1_ASEM1_CLR1_CADS0_DTLA0_DTLB0_DTVA1_DTVB0_EPS0_FDSI0_GRPM1_GRVWA8_GRVWB4_GSU1_GSUAMB_GSUC0_GSUWGMRR0_GLS0_ISA1201_IU1_K1_LBSPPA0_LBSPPB256_LBSPPM0_LPA0_LPB16_LPM0_LRVW8_LWPMn1_MIAV1_MIWT1_1_MO40_NTn1_NTA0_NTB0_NTC0_NTD0_NTM0_NEPBS0_NLCA1_NLCB1_ONLL0_PGR2_PLR1_PKA0_SIA3_SS0_SU32_SUM1_SUS256_SPO0_SRVW0_SSO0_SVW8_SK0_SKXCCM0_TLDS0_ULSGRO0_USL1_UIOFGRO0_USFGROn1_VSn1_VWA1_VWB1_WSGRA0_WSGRB0_WS32_WG32_4_1_WGM8_WGMXCC1_WGMXCCGn1
    SolutionIndex: 168
    SolutionNameMin: Cijk_Ailk_Bjlk_I8BH_SHB_HA_S_SCD_SAV_UserArgs_MT32x32x128_MI16x16x1_SN_LDSB0_AFC1_AFEM1_AFEM1_ASEM1_CLR1_CADS0_DTLA0_DTLB0_DTVA1_DTVB0_EPS0_FDSI0_GRPM1_GRVWA8_GRVWB8_GSU1_GSUAMB_GSUC0_GSUWGMRR0_GLS0_ISA1201_IU1_K1_LBSPPA0_LBSPPB256_LBSPPM0_LPA0_LPB16_LPM0_LRVW8_LWPMn1_MIAV1_MIWT1_1_MO40_NTn1_NTA0_NTB0_NTC0_NTD0_NTM0_NEPBS0_NLCA1_NLCB1_ONLL0_PGR2_PLR1_PKA0_SIA3_SS0_SU32_SUM1_SUS256_SPO0_SRVW0_SSO0_SVW8_SK0_SKXCCM0_TLDS0_ULSGRO0_USL1_UIOFGRO0_USFGROn1_VSn1_VWA1_VWB1_WSGRA0_WSGRB0_WS32_WG32_4_1_WGM8_WGMXCC1_WGMXCCGn1
    SolutionIndex: 169
    SolutionNameMin: Cijk_Ailk_Bjlk_I8BH_SHB_HA_S_SCD_SAV_UserArgs_MT32x32x128_MI16x16x1_SN_LDSB0_AFC1_AFEM1_AFEM1_ASEM1_CLR1_CADS0_DTLA0_DTLB0_DTVA1_DTVB0_EPS0_FDSI0_GRPM1_GRVWA8_GRVWB16_GSU1_GSUAMB_GSUC0_GSUWGMRR0_GLS0_ISA1201_IU1_K1_LBSPPA0_LBSPPB256_LBSPPM0_LPA0_LPB16_LPM0_LRVW8_LWPMn1_MIAV1_MIWT1_1_MO40_NTn1_NTA0_NTB0_NTC0_NTD0_NTM0_NEPBS0_NLCA1_NLCB1_ONLL0_PGR2_PLR1_PKA0_SIA3_SS0_SU32_SUM1_SUS256_SPO0_SRVW0_SSO0_SVW8_SK0_SKXCCM0_TLDS0_ULSGRO0_USL1_UIOFGRO0_USFGROn1_VSn1_VWA1_VWB1_WSGRA0_WSGRB0_WS32_WG32_4_1_WGM8_WGMXCC1_WGMXCCGn1
    SolutionIndex: 170
    SolutionNameMin: Cijk_Ailk_Bjlk_I8BH_SHB_HA_S_SCD_SAV_UserArgs_MT32x32x128_MI16x16x1_SN_LDSB0_AFC1_AFEM1_AFEM1_ASEM1_CLR1_CADS0_DTLA0_DTLB0_DTVA0_DTVB1_EPS1_FDSI0_GRPM1_GRVWA4_GRVWB8_GSU1_GSUAMB_GSUC0_GSUWGMRR0_GLS0_ISA1201_IU1_K1_LBSPPA256_LBSPPB0_LBSPPM0_LPA16_LPB0_LPM0_LRVW8_LWPMn1_MIAV1_MIWT1_1_MO40_NTn1_NTA0_NTB0_NTC0_NTD0_NTM0_NEPBS0_NLCA1_NLCB1_ONLL0_PGR1_PLR1_PKA0_SIA3_SS0_SU32_SUM1_SUS256_SPO0_SRVW0_SSO0_SVW8_SK0_SKXCCM0_TLDS0_ULSGRO0_USL1_UIOFGRO0_USFGROn1_VSn1_VWA1_VWB1_WSGRA0_WSGRB0_WS32_WG32_4_1_WGM8_WGMXCC1_WGMXCCGn1
    SolutionIndex: 171
    SolutionNameMin: Cijk_Ailk_Bjlk_I8BH_SHB_HA_S_SCD_SAV_UserArgs_MT32x32x128_MI16x16x1_SN_LDSB0_AFC1_AFEM1_AFEM1_ASEM1_CLR1_CADS0_DTLA0_DTLB0_DTVA0_DTVB1_EPS1_FDSI0_GRPM1_GRVWA8_GRVWB8_GSU1_GSUAMB_GSUC0_GSUWGMRR0_GLS0_ISA1201_IU1_K1_LBSPPA256_LBSPPB0_LBSPPM0_LPA16_LPB0_LPM0_LRVW8_LWPMn1_MIAV1_MIWT1_1_MO40_NTn1_NTA0_NTB0_NTC0_NTD0_NTM0_NEPBS0_NLCA1_NLCB1_ONLL0_PGR1_PLR1_PKA0_SIA3_SS0_SU32_SUM1_SUS256_SPO0_SRVW0_SSO0_SVW8_SK0_SKXCCM0_TLDS0_ULSGRO0_USL1_UIOFGRO0_USFGROn1_VSn1_VWA1_VWB1_WSGRA0_WSGRB0_WS32_WG32_4_1_WGM8_WGMXCC1_WGMXCCGn1
    SolutionIndex: 172
    SolutionNameMin: Cijk_Ailk_Bjlk_I8BH_SHB_HA_S_SCD_SAV_UserArgs_MT32x32x128_MI16x16x1_SN_LDSB0_AFC1_AFEM1_AFEM1_ASEM1_CLR1_CADS0_DTLA0_DTLB0_DTVA0_DTVB1_EPS1_FDSI0_GRPM1_GRVWA16_GRVWB8_GSU1_GSUAMB_GSUC0_GSUWGMRR0_GLS0_ISA1201_IU1_K1_LBSPPA256_LBSPPB0_LBSPPM0_LPA16_LPB0_LPM0_LRVW8_LWPMn1_MIAV1_MIWT1_1_MO40_NTn1_NTA0_NTB0_NTC0_NTD0_NTM0_NEPBS0_NLCA1_NLCB1_ONLL0_PGR1_PLR1_PKA0_SIA3_SS0_SU32_SUM1_SUS256_SPO0_SRVW0_SSO0_SVW8_SK0_SKXCCM0_TLDS0_ULSGRO0_USL1_UIOFGRO0_USFGROn1_VSn1_VWA1_VWB1_WSGRA0_WSGRB0_WS32_WG32_4_1_WGM8_WGMXCC1_WGMXCCGn1
    SolutionIndex: 173
    SolutionNameMin: Cijk_Ailk_Bjlk_I8BH_SHB_HA_S_SCD_SAV_UserArgs_MT32x32x128_MI16x16x1_SN_LDSB0_AFC1_AFEM1_AFEM1_ASEM1_CLR1_CADS0_DTLA0_DTLB0_DTVA0_DTVB1_EPS0_FDSI0_GRPM1_GRVWA4_GRVWB8_GSU1_GSUAMB_GSUC0_GSUWGMRR0_GLS0_ISA1201_IU1_K1_LBSPPA256_LBSPPB0_LBSPPM0_LPA16_LPB0_LPM0_LRVW8_LWPMn1_MIAV1_MIWT1_1_MO40_NTn1_NTA0_NTB0_NTC0_NTD0_NTM0_NEPBS0_NLCA1_NLCB1_ONLL0_PGR2_PLR1_PKA0_SIA3_SS0_SU32_SUM1_SUS256_SPO0_SRVW0_SSO0_SVW8_SK0_SKXCCM0_TLDS0_ULSGRO0_USL1_UIOFGRO0_USFGROn1_VSn1_VWA1_VWB1_WSGRA0_WSGRB0_WS32_WG32_4_1_WGM8_WGMXCC1_WGMXCCGn1
    SolutionIndex: 174
    SolutionNameMin: Cijk_Ailk_Bjlk_I8BH_SHB_HA_S_SCD_SAV_UserArgs_MT32x32x128_MI16x16x1_SN_LDSB0_AFC1_AFEM1_AFEM1_ASEM1_CLR1_CADS0_DTLA0_DTLB0_DTVA0_DTVB1_EPS0_FDSI0_GRPM1_GRVWA8_GRVWB8_GSU1_GSUAMB_GSUC0_GSUWGMRR0_GLS0_ISA1201_IU1_K1_LBSPPA256_LBSPPB0_LBSPPM0_LPA16_LPB0_LPM0_LRVW8_LWPMn1_MIAV1_MIWT1_1_MO40_NTn1_NTA0_NTB0_NTC0_NTD0_NTM0_NEPBS0_NLCA1_NLCB1_ONLL0_PGR2_PLR1_PKA0_SIA3_SS0_SU32_SUM1_SUS256_SPO0_SRVW0_SSO0_SVW8_SK0_SKXCCM0_TLDS0_ULSGRO0_USL1_UIOFGRO0_USFGROn1_VSn1_VWA1_VWB1_WSGRA0_WSGRB0_WS32_WG32_4_1_WGM8_WGMXCC1_WGMXCCGn1
    SolutionIndex: 175
    SolutionNameMin: Cijk_Ailk_Bjlk_I8BH_SHB_HA_S_SCD_SAV_UserArgs_MT32x32x128_MI16x16x1_SN_LDSB0_AFC1_AFEM1_AFEM1_ASEM1_CLR1_CADS0_DTLA0_DTLB0_DTVA0_DTVB1_EPS0_FDSI0_GRPM1_GRVWA16_GRVWB8_GSU1_GSUAMB_GSUC0_GSUWGMRR0_GLS0_ISA1201_IU1_K1_LBSPPA256_LBSPPB0_LBSPPM0_LPA16_LPB0_LPM0_LRVW8_LWPMn1_MIAV1_MIWT1_1_MO40_NTn1_NTA0_NTB0_NTC0_NTD0_NTM0_NEPBS0_NLCA1_NLCB1_ONLL0_PGR2_PLR1_PKA0_SIA3_SS0_SU32_SUM1_SUS256_SPO0_SRVW0_SSO0_SVW8_SK0_SKXCCM0_TLDS0_ULSGRO0_USL1_UIOFGRO0_USFGROn1_VSn1_VWA1_VWB1_WSGRA0_WSGRB0_WS32_WG32_4_1_WGM8_WGMXCC1_WGMXCCGn1
    SolutionIndex: 176
    SolutionNameMin: Cijk_Ailk_Bjlk_I8BH_SHB_HA_S_SCD_SAV_UserArgs_MT32x32x128_MI16x16x1_SN_LDSB0_AFC1_AFEM1_AFEM1_ASEM1_CLR1_CADS0_DTLA0_DTLB0_DTVA1_DTVB1_EPS0_FDSI0_GRPM1_GRVWA8_GRVWB8_GSU1_GSUAMB_GSUC0_GSUWGMRR0_GLS0_ISA1201_IU1_K1_LBSPPA0_LBSPPB0_LBSPPM0_LPA0_LPB0_LPM0_LRVW8_LWPMn1_MIAV1_MIWT1_1_MO40_NTn1_NTA0_NTB0_NTC0_NTD0_NTM0_NEPBS0_NLCA1_NLCB1_ONLL0_PGR1_PLR0_PKA0_SIA3_SS0_SU32_SUM1_SUS256_SPO0_SRVW0_SSO0_SVW8_SK0_SKXCCM0_TLDS0_ULSGRO0_USL1_UIOFGRO0_USFGROn1_VSn1_VWA1_VWB1_WSGRA0_WSGRB0_WS32_WG32_4_1_WGM8_WGMXCC1_WGMXCCGn1
    SolutionIndex: 177
    SolutionNameMin: Cijk_Ailk_Bjlk_I8BH_SHB_HA_S_SCD_SAV_UserArgs_MT16x32x128_MI16x16x1_SN_LDSB0_AFC1_AFEM1_AFEM1_ASEM1_CLR1_CADS0_DTLA0_DTLB0_DTVA0_DTVB1_EPS1_FDSI0_GRPM1_GRVWA4_GRVWB8_GSU1_GSUAMB_GSUC0_GSUWGMRR0_GLS0_ISA1201_IU1_K1_LBSPPA128_LBSPPB0_LBSPPM0_LPA16_LPB0_LPM0_LRVW8_LWPMn1_MIAV1_MIWT1_1_MO40_NTn1_NTA0_NTB0_NTC0_NTD0_NTM0_NEPBS0_NLCA1_NLCB1_ONLL0_PGR1_PLR1_PKA0_SIA3_SS0_SU32_SUM1_SUS256_SPO0_SRVW0_SSO0_SVW8_SK0_SKXCCM0_TLDS0_ULSGRO0_USL1_UIOFGRO0_USFGROn1_VSn1_VWA1_VWB1_WSGRA0_WSGRB0_WS32_WG16_4_1_WGM8_WGMXCC1_WGMXCCGn1
    SolutionIndex: 178
    SolutionNameMin: Cijk_Ailk_Bjlk_I8BH_SHB_HA_S_SCD_SAV_UserArgs_MT16x32x128_MI16x16x1_SN_LDSB0_AFC1_AFEM1_AFEM1_ASEM1_CLR1_CADS0_DTLA0_DTLB0_DTVA0_DTVB1_EPS1_FDSI0_GRPM1_GRVWA8_GRVWB8_GSU1_GSUAMB_GSUC0_GSUWGMRR0_GLS0_ISA1201_IU1_K1_LBSPPA128_LBSPPB0_LBSPPM0_LPA16_LPB0_LPM0_LRVW8_LWPMn1_MIAV1_MIWT1_1_MO40_NTn1_NTA0_NTB0_NTC0_NTD0_NTM0_NEPBS0_NLCA1_NLCB1_ONLL0_PGR1_PLR1_PKA0_SIA3_SS0_SU32_SUM1_SUS256_SPO0_SRVW0_SSO0_SVW8_SK0_SKXCCM0_TLDS0_ULSGRO0_USL1_UIOFGRO0_USFGROn1_VSn1_VWA1_VWB1_WSGRA0_WSGRB0_WS32_WG16_4_1_WGM8_WGMXCC1_WGMXCCGn1
    SolutionIndex: 179
    SolutionNameMin: Cijk_Ailk_Bjlk_I8BH_SHB_HA_S_SCD_SAV_UserArgs_MT16x32x128_MI16x16x1_SN_LDSB0_AFC1_AFEM1_AFEM1_ASEM1_CLR1_CADS0_DTLA0_DTLB0_DTVA0_DTVB1_EPS1_FDSI0_GRPM1_GRVWA16_GRVWB8_GSU1_GSUAMB_GSUC0_GSUWGMRR0_GLS0_ISA1201_IU1_K1_LBSPPA128_LBSPPB0_LBSPPM0_LPA16_LPB0_LPM0_LRVW8_LWPMn1_MIAV1_MIWT1_1_MO40_NTn1_NTA0_NTB0_NTC0_NTD0_NTM0_NEPBS0_NLCA1_NLCB1_ONLL0_PGR1_PLR1_PKA0_SIA3_SS0_SU32_SUM1_SUS256_SPO0_SRVW0_SSO0_SVW8_SK0_SKXCCM0_TLDS0_ULSGRO0_USL1_UIOFGRO0_USFGROn1_VSn1_VWA1_VWB1_WSGRA0_WSGRB0_WS32_WG16_4_1_WGM8_WGMXCC1_WGMXCCGn1
    SolutionIndex: 180
    SolutionNameMin: Cijk_Ailk_Bjlk_I8BH_SHB_HA_S_SCD_SAV_UserArgs_MT16x32x128_MI16x16x1_SN_LDSB0_AFC1_AFEM1_AFEM1_ASEM1_CLR1_CADS0_DTLA0_DTLB0_DTVA1_DTVB1_EPS0_FDSI0_GRPM1_GRVWA8_GRVWB8_GSU1_GSUAMB_GSUC0_GSUWGMRR0_GLS0_ISA1201_IU1_K1_LBSPPA0_LBSPPB0_LBSPPM0_LPA0_LPB0_LPM0_LRVW8_LWPMn1_MIAV1_MIWT1_1_MO40_NTn1_NTA0_NTB0_NTC0_NTD0_NTM0_NEPBS0_NLCA1_NLCB1_ONLL0_PGR1_PLR0_PKA0_SIA3_SS0_SU32_SUM1_SUS256_SPO0_SRVW0_SSO0_SVW8_SK0_SKXCCM0_TLDS0_ULSGRO0_USL1_UIOFGRO0_USFGROn1_VSn1_VWA1_VWB1_WSGRA0_WSGRB0_WS32_WG16_4_1_WGM8_WGMXCC1_WGMXCCGn1
    SolutionIndex: 181
    SolutionNameMin: Cijk_Ailk_Bjlk_I8BH_SHB_HA_S_SCD_SAV_UserArgs_MT32x16x128_MI16x16x1_SN_LDSB0_AFC1_AFEM1_AFEM1_ASEM1_CLR1_CADS0_DTLA0_DTLB0_DTVA1_DTVB0_EPS1_FDSI0_GRPM1_GRVWA8_GRVWB4_GSU1_GSUAMB_GSUC0_GSUWGMRR0_GLS0_ISA1201_IU1_K1_LBSPPA0_LBSPPB128_LBSPPM0_LPA0_LPB16_LPM0_LRVW8_LWPMn1_MIAV1_MIWT1_1_MO40_NTn1_NTA0_NTB0_NTC0_NTD0_NTM0_NEPBS0_NLCA1_NLCB1_ONLL0_PGR1_PLR1_PKA0_SIA3_SS0_SU32_SUM1_SUS256_SPO0_SRVW0_SSO0_SVW8_SK0_SKXCCM0_TLDS0_ULSGRO0_USL1_UIOFGRO0_USFGROn1_VSn1_VWA1_VWB1_WSGRA0_WSGRB0_WS32_WG32_2_1_WGM8_WGMXCC1_WGMXCCGn1
    SolutionIndex: 182
    SolutionNameMin: Cijk_Ailk_Bjlk_I8BH_SHB_HA_S_SCD_SAV_UserArgs_MT32x16x128_MI16x16x1_SN_LDSB0_AFC1_AFEM1_AFEM1_ASEM1_CLR1_CADS0_DTLA0_DTLB0_DTVA1_DTVB0_EPS1_FDSI0_GRPM1_GRVWA8_GRVWB16_GSU1_GSUAMB_GSUC0_GSUWGMRR0_GLS0_ISA1201_IU1_K1_LBSPPA0_LBSPPB128_LBSPPM0_LPA0_LPB16_LPM0_LRVW8_LWPMn1_MIAV1_MIWT1_1_MO40_NTn1_NTA0_NTB0_NTC0_NTD0_NTM0_NEPBS0_NLCA1_NLCB1_ONLL0_PGR1_PLR1_PKA0_SIA3_SS0_SU32_SUM1_SUS256_SPO0_SRVW0_SSO0_SVW8_SK0_SKXCCM0_TLDS0_ULSGRO0_USL1_UIOFGRO0_USFGROn1_VSn1_VWA1_VWB1_WSGRA0_WSGRB0_WS32_WG32_2_1_WGM8_WGMXCC1_WGMXCCGn1
    SolutionIndex: 183
    SolutionNameMin: Cijk_Ailk_Bjlk_I8BH_SHB_HA_S_SCD_SAV_UserArgs_MT32x16x128_MI16x16x1_SN_LDSB0_AFC1_AFEM1_AFEM1_ASEM1_CLR1_CADS0_DTLA0_DTLB0_DTVA1_DTVB0_EPS0_FDSI0_GRPM1_GRVWA8_GRVWB16_GSU1_GSUAMB_GSUC0_GSUWGMRR0_GLS0_ISA1201_IU1_K1_LBSPPA0_LBSPPB128_LBSPPM0_LPA0_LPB16_LPM0_LRVW8_LWPMn1_MIAV1_MIWT1_1_MO40_NTn1_NTA0_NTB0_NTC0_NTD0_NTM0_NEPBS0_NLCA1_NLCB1_ONLL0_PGR2_PLR1_PKA0_SIA3_SS0_SU32_SUM1_SUS256_SPO0_SRVW0_SSO0_SVW8_SK0_SKXCCM0_TLDS0_ULSGRO0_USL1_UIOFGRO0_USFGROn1_VSn1_VWA1_VWB1_WSGRA0_WSGRB0_WS32_WG32_2_1_WGM8_WGMXCC1_WGMXCCGn1
    SolutionIndex: 184
    SolutionNameMin: Cijk_Ailk_Bjlk_I8BH_SHB_HA_S_SCD_SAV_UserArgs_MT32x16x128_MI16x16x1_SN_LDSB0_AFC1_AFEM1_AFEM1_ASEM1_CLR1_CADS0_DTLA0_DTLB0_DTVA0_DTVB1_EPS0_FDSI0_GRPM1_GRVWA16_GRVWB8_GSU1_GSUAMB_GSUC0_GSUWGMRR0_GLS0_ISA1201_IU1_K1_LBSPPA256_LBSPPB0_LBSPPM0_LPA16_LPB0_LPM0_LRVW8_LWPMn1_MIAV1_MIWT1_1_MO40_NTn1_NTA0_NTB0_NTC0_NTD0_NTM0_NEPBS0_NLCA1_NLCB1_ONLL0_PGR2_PLR1_PKA0_SIA3_SS0_SU32_SUM1_SUS256_SPO0_SRVW0_SSO0_SVW8_SK0_SKXCCM0_TLDS0_ULSGRO0_USL1_UIOFGRO0_USFGROn1_VSn1_VWA1_VWB1_WSGRA0_WSGRB0_WS32_WG32_2_1_WGM8_WGMXCC1_WGMXCCGn1
    SolutionIndex: 185
    SolutionNameMin: Cijk_Ailk_Bjlk_I8BH_SHB_HA_S_SCD_SAV_UserArgs_MT32x16x128_MI16x16x1_SN_LDSB0_AFC1_AFEM1_AFEM1_ASEM1_CLR1_CADS0_DTLA0_DTLB0_DTVA1_DTVB1_EPS0_FDSI0_GRPM1_GRVWA8_GRVWB8_GSU1_GSUAMB_GSUC0_GSUWGMRR0_GLS0_ISA1201_IU1_K1_LBSPPA0_LBSPPB0_LBSPPM0_LPA0_LPB0_LPM0_LRVW8_LWPMn1_MIAV1_MIWT1_1_MO40_NTn1_NTA0_NTB0_NTC0_NTD0_NTM0_NEPBS0_NLCA1_NLCB1_ONLL0_PGR1_PLR0_PKA0_SIA3_SS0_SU32_SUM1_SUS256_SPO0_SRVW0_SSO0_SVW8_SK0_SKXCCM0_TLDS0_ULSGRO0_USL1_UIOFGRO0_USFGROn1_VSn1_VWA1_VWB1_WSGRA0_WSGRB0_WS32_WG32_2_1_WGM8_WGMXCC1_WGMXCCGn1
    SolutionIndex: 186
    SolutionNameMin: Cijk_Ailk_Bjlk_I8BH_SHB_HA_S_SCD_SAV_UserArgs_MT16x16x128_MI16x16x1_SN_LDSB1_AFC1_AFEM1_AFEM1_ASEM1_CLR1_CADS0_DTLA0_DTLB0_DTVA0_DTVB0_EPS1_FDSI0_GRPM1_GRVWA16_GRVWB8_GSU1_GSUAMB_GSUC0_GSUWGMRR0_GLS0_ISA1201_IU8_K1_LBSPPA128_LBSPPB128_LBSPPM0_LPA16_LPB16_LPM0_LRVW8_LWPMn1_MIAV1_MIWT1_1_MO40_NTn1_NTA0_NTB0_NTC0_NTD0_NTM0_NEPBS0_NLCA1_NLCB1_ONLL0_PGR1_PLR1_PKA0_SIA2_SS0_SU32_SUM1_SUS256_SPO0_SRVW0_SSO0_SVW8_SK0_SKXCCM0_TLDS0_ULSGRO0_USL1_UIOFGRO0_USFGROn1_VSn1_VWA1_VWB1_WSGRA0_WSGRB0_WS32_WG16_2_1_WGM8_WGMXCC1_WGMXCCGn1
    SolutionIndex: 187
    SolutionNameMin: Cijk_Ailk_Bjlk_I8BH_SHB_HA_S_SCD_SAV_UserArgs_MT16x16x128_MI16x16x1_SN_LDSB0_AFC1_AFEM1_AFEM1_ASEM1_CLR1_CADS0_DTLA0_DTLB0_DTVA0_DTVB1_EPS1_FDSI0_GRPM1_GRVWA4_GRVWB8_GSU1_GSUAMB_GSUC0_GSUWGMRR0_GLS0_ISA1201_IU1_K1_LBSPPA128_LBSPPB0_LBSPPM0_LPA16_LPB0_LPM0_LRVW8_LWPMn1_MIAV1_MIWT1_1_MO40_NTn1_NTA0_NTB0_NTC0_NTD0_NTM0_NEPBS0_NLCA1_NLCB1_ONLL0_PGR1_PLR1_PKA0_SIA3_SS0_SU32_SUM1_SUS256_SPO0_SRVW0_SSO0_SVW8_SK0_SKXCCM0_TLDS0_ULSGRO0_USL1_UIOFGRO0_USFGROn1_VSn1_VWA1_VWB1_WSGRA0_WSGRB0_WS32_WG16_2_1_WGM8_WGMXCC1_WGMXCCGn1
    SolutionIndex: 188
    SolutionNameMin: Cijk_Ailk_Bjlk_I8BH_SHB_HA_S_SCD_SAV_UserArgs_MT16x16x128_MI16x16x1_SN_LDSB0_AFC1_AFEM1_AFEM1_ASEM1_CLR1_CADS0_DTLA0_DTLB0_DTVA0_DTVB1_EPS0_FDSI0_GRPM1_GRVWA16_GRVWB8_GSU1_GSUAMB_GSUC0_GSUWGMRR0_GLS0_ISA1201_IU1_K1_LBSPPA128_LBSPPB0_LBSPPM0_LPA16_LPB0_LPM0_LRVW8_LWPMn1_MIAV1_MIWT1_1_MO40_NTn1_NTA0_NTB0_NTC0_NTD0_NTM0_NEPBS0_NLCA1_NLCB1_ONLL0_PGR2_PLR1_PKA0_SIA3_SS0_SU32_SUM1_SUS256_SPO0_SRVW0_SSO0_SVW8_SK0_SKXCCM0_TLDS0_ULSGRO0_USL1_UIOFGRO0_USFGROn1_VSn1_VWA1_VWB1_WSGRA0_WSGRB0_WS32_WG16_2_1_WGM8_WGMXCC1_WGMXCCGn1
    SolutionIndex: 190
    SolutionNameMin: Cijk_Ailk_Bjlk_I8BH_SHB_HA_S_SCD_SAV_UserArgs_MT128x64x16_MI16x16x1_SN_LDSB1_AFC1_AFEM1_AFEM1_ASEM1_CLR1_CADS0_DTLA0_DTLB0_DTVA0_DTVB0_EPS1_FDSI0_GRPM1_GRVWA1_GRVWB1_GSU1_GSUAMB_GSUC0_GSUWGMRR0_GLS0_ISA1201_IU1_K1_LBSPPA1024_LBSPPB512_LBSPPM0_LPA0_LPB16_LPM0_LRVW8_LWPMn1_MIAV1_MIWT8_1_MO40_NTn1_NTA0_NTB0_NTC0_NTD0_NTM0_NEPBS0_NLCA1_NLCB1_ONLL0_PGR1_PLR1_PKA0_SIA2_SS1_SU32_SUM1_SUS256_SPO0_SRVW0_SSO0_SVW8_SK0_SKXCCM0_TLDS0_ULSGRO0_USL1_UIOFGRO0_USFGROn1_VSn1_VWA8_VWB1_WSGRA0_WSGRB0_WS32_WG16_8_1_WGM8_WGMXCC1_WGMXCCGn1
    SolutionIndex: 191
    SolutionNameMin: Cijk_Ailk_Bjlk_I8BH_SHB_HA_S_SCD_SAV_UserArgs_MT128x64x16_MI16x16x1_SN_LDSB1_AFC1_AFEM1_AFEM1_ASEM1_CLR1_CADS0_DTLA0_DTLB0_DTVA0_DTVB0_EPS1_FDSI0_GRPM1_GRVWA8_GRVWB1_GSU1_GSUAMB_GSUC0_GSUWGMRR0_GLS0_ISA1201_IU1_K1_LBSPPA1024_LBSPPB512_LBSPPM0_LPA0_LPB16_LPM0_LRVW8_LWPMn1_MIAV1_MIWT8_1_MO40_NTn1_NTA0_NTB0_NTC0_NTD0_NTM0_NEPBS0_NLCA1_NLCB1_ONLL0_PGR1_PLR1_PKA0_SIA2_SS1_SU32_SUM1_SUS256_SPO0_SRVW0_SSO0_SVW8_SK0_SKXCCM0_TLDS0_ULSGRO0_USL1_UIOFGRO0_USFGROn1_VSn1_VWA8_VWB1_WSGRA0_WSGRB0_WS32_WG16_8_1_WGM8_WGMXCC1_WGMXCCGn1
    SolutionIndex: 193
    SolutionNameMin: Cijk_Ailk_Bjlk_I8BH_SHB_HA_S_SCD_SAV_UserArgs_MT64x64x32_MI16x16x1_SN_LDSB1_AFC1_AFEM1_AFEM1_ASEM1_CLR1_CADS0_DTLA0_DTLB0_DTVA0_DTVB0_EPS1_FDSI0_GRPM1_GRVWA1_GRVWB4_GSU1_GSUAMB_GSUC0_GSUWGMRR0_GLS0_ISA1201_IU2_K1_LBSPPA512_LBSPPB512_LBSPPM0_LPA32_LPB32_LPM0_LRVW8_LWPMn1_MIAV1_MIWT2_2_MO40_NTn1_NTA0_NTB0_NTC0_NTD0_NTM0_NEPBS0_NLCA1_NLCB1_ONLL0_PGR1_PLR1_PKA0_SIA2_SS1_SU32_SUM1_SUS256_SPO0_SRVW0_SSO0_SVW2_SK0_SKXCCM0_TLDS0_ULSGRO0_USL1_UIOFGRO0_USFGROn1_VSn1_VWA2_VWB2_WSGRA0_WSGRB0_WS32_WG32_4_1_WGM8_WGMXCC1_WGMXCCGn1
    SolutionIndex: 194
    SolutionNameMin: Cijk_Ailk_Bjlk_I8BH_SHB_HA_S_SCD_SAV_UserArgs_MT64x64x32_MI16x16x1_SN_LDSB0_AFC1_AFEM1_AFEM1_ASEM1_CLR1_CADS0_DTLA0_DTLB0_DTVA0_DTVB1_EPS0_FDSI0_GRPM1_GRVWA16_GRVWB8_GSU1_GSUAMB_GSUC0_GSUWGMRR0_GLS0_ISA1201_IU1_K1_LBSPPA512_LBSPPB0_LBSPPM0_LPA32_LPB0_LPM0_LRVW8_LWPMn1_MIAV1_MIWT2_2_MO40_NTn1_NTA0_NTB0_NTC0_NTD0_NTM0_NEPBS0_NLCA1_NLCB2_ONLL0_PGR2_PLR1_PKA0_SIA3_SS1_SU32_SUM1_SUS256_SPO0_SRVW0_SSO0_SVW2_SK0_SKXCCM0_TLDS0_ULSGRO0_USL1_UIOFGRO0_USFGROn1_VSn1_VWA2_VWB1_WSGRA0_WSGRB0_WS32_WG32_4_1_WGM8_WGMXCC1_WGMXCCGn1
    SolutionIndex: 195
    SolutionNameMin: Cijk_Ailk_Bjlk_I8BH_SHB_HA_S_SCD_SAV_UserArgs_MT64x64x32_MI16x16x1_SN_LDSB0_AFC1_AFEM1_AFEM1_ASEM1_CLR1_CADS0_DTLA0_DTLB0_DTVA1_DTVB1_EPS0_FDSI0_GRPM1_GRVWA8_GRVWB8_GSU1_GSUAMB_GSUC0_GSUWGMRR0_GLS0_ISA1201_IU1_K1_LBSPPA0_LBSPPB0_LBSPPM0_LPA0_LPB0_LPM0_LRVW8_LWPMn1_MIAV1_MIWT2_2_MO40_NTn1_NTA0_NTB0_NTC0_NTD0_NTM0_NEPBS0_NLCA2_NLCB2_ONLL0_PGR1_PLR0_PKA0_SIA3_SS1_SU32_SUM1_SUS256_SPO0_SRVW0_SSO0_SVW1_SK0_SKXCCM0_TLDS0_ULSGRO0_USL1_UIOFGRO0_USFGROn1_VSn1_VWA1_VWB1_WSGRA0_WSGRB0_WS32_WG32_4_1_WGM8_WGMXCC1_WGMXCCGn1
    SolutionIndex: 197
    SolutionNameMin: Cijk_Ailk_Bjlk_I8BH_SHB_HA_S_SCD_SAV_UserArgs_MT128x64x32_MI16x16x1_SN_LDSB0_AFC1_AFEM1_AFEM1_ASEM1_CLR1_CADS0_DTLA0_DTLB0_DTVA1_DTVB0_EPS1_FDSI0_GRPM1_GRVWA8_GRVWB8_GSU1_GSUAMB_GSUC0_GSUWGMRR0_GLS0_ISA1201_IU1_K1_LBSPPA0_LBSPPB512_LBSPPM0_LPA0_LPB16_LPM0_LRVW8_LWPMn1_MIAV1_MIWT8_1_MO40_NTn1_NTA0_NTB0_NTC0_NTD0_NTM0_NEPBS0_NLCA2_NLCB1_ONLL0_PGR1_PLR1_PKA0_SIA3_SS1_SU32_SUM1_SUS256_SPO0_SRVW0_SSO0_SVW1_SK0_SKXCCM0_TLDS0_ULSGRO0_USL1_UIOFGRO0_USFGROn1_VSn1_VWA1_VWB1_WSGRA0_WSGRB0_WS32_WG16_8_1_WGM8_WGMXCC1_WGMXCCGn1
    SolutionIndex: 199
    SolutionNameMin: Cijk_Ailk_Bjlk_I8BH_SHB_HA_S_SCD_SAV_UserArgs_MT128x64x32_MI16x16x1_SN_LDSB0_AFC1_AFEM1_AFEM1_ASEM1_CLR1_CADS0_DTLA0_DTLB0_DTVA1_DTVB0_EPS0_FDSI0_GRPM1_GRVWA8_GRVWB8_GSU1_GSUAMB_GSUC0_GSUWGMRR0_GLS0_ISA1201_IU1_K1_LBSPPA0_LBSPPB512_LBSPPM0_LPA0_LPB16_LPM0_LRVW8_LWPMn1_MIAV1_MIWT8_1_MO40_NTn1_NTA0_NTB0_NTC0_NTD0_NTM0_NEPBS0_NLCA2_NLCB1_ONLL0_PGR2_PLR1_PKA0_SIA3_SS1_SU32_SUM1_SUS256_SPO0_SRVW0_SSO0_SVW1_SK0_SKXCCM0_TLDS0_ULSGRO0_USL1_UIOFGRO0_USFGROn1_VSn1_VWA1_VWB1_WSGRA0_WSGRB0_WS32_WG16_8_1_WGM8_WGMXCC1_WGMXCCGn1
    SolutionIndex: 200
    SolutionNameMin: Cijk_Ailk_Bjlk_I8BH_SHB_HA_S_SCD_SAV_UserArgs_MT128x64x32_MI16x16x1_SN_LDSB0_AFC1_AFEM1_AFEM1_ASEM1_CLR1_CADS0_DTLA0_DTLB0_DTVA1_DTVB0_EPS0_FDSI0_GRPM1_GRVWA8_GRVWB16_GSU1_GSUAMB_GSUC0_GSUWGMRR0_GLS0_ISA1201_IU1_K1_LBSPPA0_LBSPPB512_LBSPPM0_LPA0_LPB16_LPM0_LRVW8_LWPMn1_MIAV1_MIWT8_1_MO40_NTn1_NTA0_NTB0_NTC0_NTD0_NTM0_NEPBS0_NLCA2_NLCB1_ONLL0_PGR2_PLR1_PKA0_SIA3_SS1_SU32_SUM1_SUS256_SPO0_SRVW0_SSO0_SVW1_SK0_SKXCCM0_TLDS0_ULSGRO0_USL1_UIOFGRO0_USFGROn1_VSn1_VWA1_VWB1_WSGRA0_WSGRB0_WS32_WG16_8_1_WGM8_WGMXCC1_WGMXCCGn1
    SolutionIndex: 201
    SolutionNameMin: Cijk_Ailk_Bjlk_I8BH_SHB_HA_S_SCD_SAV_UserArgs_MT128x64x32_MI16x16x1_SN_LDSB0_AFC1_AFEM1_AFEM1_ASEM1_CLR1_CADS0_DTLA0_DTLB0_DTVA0_DTVB1_EPS1_FDSI0_GRPM1_GRVWA8_GRVWB8_GSU1_GSUAMB_GSUC0_GSUWGMRR0_GLS0_ISA1201_IU1_K1_LBSPPA1024_LBSPPB0_LBSPPM0_LPA0_LPB0_LPM0_LRVW8_LWPMn1_MIAV1_MIWT8_1_MO40_NTn1_NTA0_NTB0_NTC0_NTD0_NTM0_NEPBS0_NLCA1_NLCB1_ONLL0_PGR1_PLR1_PKA0_SIA3_SS1_SU32_SUM1_SUS256_SPO0_SRVW0_SSO0_SVW8_SK0_SKXCCM0_TLDS0_ULSGRO0_USL1_UIOFGRO0_USFGROn1_VSn1_VWA8_VWB1_WSGRA0_WSGRB0_WS32_WG16_8_1_WGM8_WGMXCC1_WGMXCCGn1
    SolutionIndex: 202
    SolutionNameMin: Cijk_Ailk_Bjlk_I8BH_SHB_HA_S_SCD_SAV_UserArgs_MT128x32x32_MI16x16x1_SN_LDSB1_AFC1_AFEM1_AFEM1_ASEM1_CLR1_CADS0_DTLA0_DTLB0_DTVA0_DTVB0_EPS1_FDSI0_GRPM1_GRVWA8_GRVWB8_GSU1_GSUAMB_GSUC0_GSUWGMRR0_GLS0_ISA1201_IU2_K1_LBSPPA1024_LBSPPB256_LBSPPM0_LPA64_LPB16_LPM0_LRVW8_LWPMn1_MIAV1_MIWT4_1_MO40_NTn1_NTA0_NTB0_NTC0_NTD0_NTM0_NEPBS0_NLCA1_NLCB1_ONLL0_PGR1_PLR1_PKA0_SIA2_SS1_SU32_SUM1_SUS256_SPO0_SRVW0_SSO0_SVW4_SK0_SKXCCM0_TLDS0_ULSGRO0_USL1_UIOFGRO0_USFGROn1_VSn1_VWA4_VWB1_WSGRA0_WSGRB0_WS32_WG32_4_1_WGM8_WGMXCC1_WGMXCCGn1
    SolutionIndex: 203
    SolutionNameMin: Cijk_Ailk_Bjlk_I8BH_SHB_HA_S_SCD_SAV_UserArgs_MT128x32x32_MI16x16x1_SN_LDSB1_AFC1_AFEM1_AFEM1_ASEM1_CLR1_CADS0_DTLA0_DTLB0_DTVA0_DTVB0_EPS0_FDSI0_GRPM1_GRVWA4_GRVWB1_GSU1_GSUAMB_GSUC0_GSUWGMRR0_GLS0_ISA1201_IU2_K1_LBSPPA1024_LBSPPB256_LBSPPM0_LPA64_LPB16_LPM0_LRVW8_LWPMn1_MIAV1_MIWT4_1_MO40_NTn1_NTA0_NTB0_NTC0_NTD0_NTM0_NEPBS0_NLCA1_NLCB1_ONLL0_PGR2_PLR1_PKA0_SIA2_SS1_SU32_SUM1_SUS256_SPO0_SRVW0_SSO0_SVW4_SK0_SKXCCM0_TLDS0_ULSGRO0_USL1_UIOFGRO0_USFGROn1_VSn1_VWA4_VWB1_WSGRA0_WSGRB0_WS32_WG32_4_1_WGM8_WGMXCC1_WGMXCCGn1
    SolutionIndex: 204
    SolutionNameMin: Cijk_Ailk_Bjlk_I8BH_SHB_HA_S_SCD_SAV_UserArgs_MT128x32x32_MI16x16x1_SN_LDSB1_AFC1_AFEM1_AFEM1_ASEM1_CLR1_CADS0_DTLA0_DTLB0_DTVA0_DTVB0_EPS0_FDSI0_GRPM1_GRVWA8_GRVWB4_GSU1_GSUAMB_GSUC0_GSUWGMRR0_GLS0_ISA1201_IU2_K1_LBSPPA1024_LBSPPB256_LBSPPM0_LPA64_LPB16_LPM0_LRVW8_LWPMn1_MIAV1_MIWT4_1_MO40_NTn1_NTA0_NTB0_NTC0_NTD0_NTM0_NEPBS0_NLCA1_NLCB1_ONLL0_PGR2_PLR1_PKA0_SIA2_SS1_SU32_SUM1_SUS256_SPO0_SRVW0_SSO0_SVW4_SK0_SKXCCM0_TLDS0_ULSGRO1_USL1_UIOFGRO0_USFGROn1_VSn1_VWA4_VWB1_WSGRA0_WSGRB0_WS32_WG32_4_1_WGM8_WGMXCC1_WGMXCCGn1
    SolutionIndex: 205
    SolutionNameMin: Cijk_Ailk_Bjlk_I8BH_SHB_HA_S_SCD_SAV_UserArgs_MT64x64x64_MI16x16x1_SN_LDSB1_AFC1_AFEM1_AFEM1_ASEM1_CLR1_CADS0_DTLA0_DTLB0_DTVA0_DTVB0_EPS1_FDSI0_GRPM1_GRVWA4_GRVWB4_GSU1_GSUAMB_GSUC0_GSUWGMRR0_GLS0_ISA1201_IU4_K1_LBSPPA512_LBSPPB512_LBSPPM0_LPA32_LPB32_LPM0_LRVW8_LWPMn1_MIAV1_MIWT2_2_MO40_NTn1_NTA0_NTB0_NTC0_NTD0_NTM0_NEPBS0_NLCA1_NLCB1_ONLL0_PGR1_PLR1_PKA0_SIA2_SS1_SU32_SUM1_SUS256_SPO0_SRVW0_SSO0_SVW2_SK0_SKXCCM0_TLDS0_ULSGRO0_USL1_UIOFGRO0_USFGROn1_VSn1_VWA2_VWB2_WSGRA0_WSGRB0_WS32_WG32_4_1_WGM8_WGMXCC1_WGMXCCGn1
    SolutionIndex: 206
    SolutionNameMin: Cijk_Ailk_Bjlk_I8BH_SHB_HA_S_SCD_SAV_UserArgs_MT64x64x64_MI16x16x1_SN_LDSB0_AFC1_AFEM1_AFEM1_ASEM1_CLR1_CADS0_DTLA0_DTLB0_DTVA0_DTVB0_EPS0_FDSI0_GRPM1_GRVWA16_GRVWB8_GSU1_GSUAMB_GSUC0_GSUWGMRR0_GLS0_ISA1201_IU1_K1_LBSPPA512_LBSPPB512_LBSPPM0_LPA32_LPB32_LPM0_LRVW8_LWPMn1_MIAV1_MIWT2_2_MO40_NTn1_NTA0_NTB0_NTC0_NTD0_NTM0_NEPBS0_NLCA1_NLCB1_ONLL0_PGR2_PLR1_PKA0_SIA3_SS1_SU32_SUM1_SUS256_SPO0_SRVW0_SSO0_SVW2_SK0_SKXCCM0_TLDS0_ULSGRO1_USL1_UIOFGRO0_USFGROn1_VSn1_VWA2_VWB2_WSGRA0_WSGRB0_WS32_WG32_4_1_WGM8_WGMXCC1_WGMXCCGn1
    SolutionIndex: 207
    SolutionNameMin: Cijk_Ailk_Bjlk_I8BH_SHB_HA_S_SCD_SAV_UserArgs_MT64x64x64_MI16x16x1_SN_LDSB0_AFC1_AFEM1_AFEM1_ASEM1_CLR1_CADS0_DTLA0_DTLB0_DTVA0_DTVB1_EPS1_FDSI0_GRPM1_GRVWA4_GRVWB8_GSU1_GSUAMB_GSUC0_GSUWGMRR0_GLS0_ISA1201_IU1_K1_LBSPPA512_LBSPPB0_LBSPPM0_LPA32_LPB0_LPM0_LRVW8_LWPMn1_MIAV1_MIWT2_2_MO40_NTn1_NTA0_NTB0_NTC0_NTD0_NTM0_NEPBS0_NLCA1_NLCB4_ONLL0_PGR1_PLR1_PKA0_SIA3_SS1_SU32_SUM1_SUS256_SPO0_SRVW0_SSO0_SVW2_SK0_SKXCCM0_TLDS0_ULSGRO0_USL1_UIOFGRO0_USFGROn1_VSn1_VWA2_VWB1_WSGRA0_WSGRB0_WS32_WG32_4_1_WGM8_WGMXCC1_WGMXCCGn1
    SolutionIndex: 208
    SolutionNameMin: Cijk_Ailk_Bjlk_I8BH_SHB_HA_S_SCD_SAV_UserArgs_MT64x64x64_MI16x16x1_SN_LDSB0_AFC1_AFEM1_AFEM1_ASEM1_CLR1_CADS0_DTLA0_DTLB0_DTVA0_DTVB1_EPS1_FDSI0_GRPM1_GRVWA8_GRVWB8_GSU1_GSUAMB_GSUC0_GSUWGMRR0_GLS0_ISA1201_IU1_K1_LBSPPA512_LBSPPB0_LBSPPM0_LPA32_LPB0_LPM0_LRVW8_LWPMn1_MIAV1_MIWT2_2_MO40_NTn1_NTA0_NTB0_NTC0_NTD0_NTM0_NEPBS0_NLCA1_NLCB4_ONLL0_PGR1_PLR1_PKA0_SIA3_SS1_SU32_SUM1_SUS256_SPO0_SRVW0_SSO0_SVW2_SK0_SKXCCM0_TLDS0_ULSGRO0_USL1_UIOFGRO0_USFGROn1_VSn1_VWA2_VWB1_WSGRA0_WSGRB0_WS32_WG32_4_1_WGM8_WGMXCC1_WGMXCCGn1
    SolutionIndex: 209
    SolutionNameMin: Cijk_Ailk_Bjlk_I8BH_SHB_HA_S_SCD_SAV_UserArgs_MT64x64x64_MI16x16x1_SN_LDSB0_AFC1_AFEM1_AFEM1_ASEM1_CLR1_CADS0_DTLA0_DTLB0_DTVA0_DTVB1_EPS1_FDSI0_GRPM1_GRVWA16_GRVWB8_GSU1_GSUAMB_GSUC0_GSUWGMRR0_GLS0_ISA1201_IU1_K1_LBSPPA512_LBSPPB0_LBSPPM0_LPA32_LPB0_LPM0_LRVW8_LWPMn1_MIAV1_MIWT2_2_MO40_NTn1_NTA0_NTB0_NTC0_NTD0_NTM0_NEPBS0_NLCA1_NLCB4_ONLL0_PGR1_PLR1_PKA0_SIA3_SS1_SU32_SUM1_SUS256_SPO0_SRVW0_SSO0_SVW2_SK0_SKXCCM0_TLDS0_ULSGRO0_USL1_UIOFGRO0_USFGROn1_VSn1_VWA2_VWB1_WSGRA0_WSGRB0_WS32_WG32_4_1_WGM8_WGMXCC1_WGMXCCGn1
    SolutionIndex: 210
    SolutionNameMin: Cijk_Ailk_Bjlk_I8BH_SHB_HA_S_SCD_SAV_UserArgs_MT64x64x64_MI16x16x1_SN_LDSB0_AFC1_AFEM1_AFEM1_ASEM1_CLR1_CADS0_DTLA0_DTLB0_DTVA0_DTVB1_EPS0_FDSI0_GRPM1_GRVWA16_GRVWB8_GSU1_GSUAMB_GSUC0_GSUWGMRR0_GLS0_ISA1201_IU1_K1_LBSPPA512_LBSPPB0_LBSPPM0_LPA32_LPB0_LPM0_LRVW8_LWPMn1_MIAV1_MIWT2_2_MO40_NTn1_NTA0_NTB0_NTC0_NTD0_NTM0_NEPBS0_NLCA1_NLCB4_ONLL0_PGR2_PLR1_PKA0_SIA3_SS1_SU32_SUM1_SUS256_SPO0_SRVW0_SSO0_SVW2_SK0_SKXCCM0_TLDS0_ULSGRO0_USL1_UIOFGRO0_USFGROn1_VSn1_VWA2_VWB1_WSGRA0_WSGRB0_WS32_WG32_4_1_WGM8_WGMXCC1_WGMXCCGn1
    SolutionIndex: 211
    SolutionNameMin: Cijk_Ailk_Bjlk_I8BH_SHB_HA_S_SCD_SAV_UserArgs_MT32x32x64_MI16x16x1_SN_LDSB0_AFC1_AFEM1_AFEM1_ASEM1_CLR1_CADS0_DTLA0_DTLB0_DTVA1_DTVB0_EPS0_FDSI0_GRPM1_GRVWA8_GRVWB16_GSU1_GSUAMB_GSUC0_GSUWGMRR0_GLS0_ISA1201_IU1_K1_LBSPPA0_LBSPPB256_LBSPPM0_LPA0_LPB16_LPM0_LRVW8_LWPMn1_MIAV1_MIWT1_1_MO40_NTn1_NTA0_NTB0_NTC0_NTD0_NTM0_NEPBS0_NLCA1_NLCB1_ONLL0_PGR2_PLR1_PKA0_SIA3_SS1_SU32_SUM1_SUS256_SPO0_SRVW0_SSO0_SVW1_SK0_SKXCCM0_TLDS0_ULSGRO0_USL1_UIOFGRO0_USFGROn1_VSn1_VWA1_VWB1_WSGRA0_WSGRB0_WS32_WG32_4_1_WGM8_WGMXCC1_WGMXCCGn1
    SolutionIndex: 212
    SolutionNameMin: Cijk_Ailk_Bjlk_I8BH_SHB_HA_S_SCD_SAV_UserArgs_MT32x32x64_MI16x16x1_SN_LDSB0_AFC1_AFEM1_AFEM1_ASEM1_CLR1_CADS0_DTLA0_DTLB0_DTVA0_DTVB1_EPS0_FDSI0_GRPM1_GRVWA16_GRVWB8_GSU1_GSUAMB_GSUC0_GSUWGMRR0_GLS0_ISA1201_IU1_K1_LBSPPA256_LBSPPB0_LBSPPM0_LPA16_LPB0_LPM0_LRVW8_LWPMn1_MIAV1_MIWT1_1_MO40_NTn1_NTA0_NTB0_NTC0_NTD0_NTM0_NEPBS0_NLCA1_NLCB1_ONLL0_PGR2_PLR1_PKA0_SIA3_SS1_SU32_SUM1_SUS256_SPO0_SRVW0_SSO0_SVW1_SK0_SKXCCM0_TLDS0_ULSGRO0_USL1_UIOFGRO0_USFGROn1_VSn1_VWA1_VWB1_WSGRA0_WSGRB0_WS32_WG32_4_1_WGM8_WGMXCC1_WGMXCCGn1
    SolutionIndex: 213
    SolutionNameMin: Cijk_Ailk_Bjlk_I8BH_SHB_HA_S_SCD_SAV_UserArgs_MT32x32x64_MI16x16x1_SN_LDSB0_AFC1_AFEM1_AFEM1_ASEM1_CLR1_CADS0_DTLA0_DTLB0_DTVA1_DTVB1_EPS0_FDSI0_GRPM1_GRVWA8_GRVWB8_GSU1_GSUAMB_GSUC0_GSUWGMRR0_GLS0_ISA1201_IU1_K1_LBSPPA0_LBSPPB0_LBSPPM0_LPA0_LPB0_LPM0_LRVW8_LWPMn1_MIAV1_MIWT1_1_MO40_NTn1_NTA0_NTB0_NTC0_NTD0_NTM0_NEPBS0_NLCA1_NLCB1_ONLL0_PGR1_PLR0_PKA0_SIA3_SS1_SU32_SUM1_SUS256_SPO0_SRVW0_SSO0_SVW1_SK0_SKXCCM0_TLDS0_ULSGRO0_USL1_UIOFGRO0_USFGROn1_VSn1_VWA1_VWB1_WSGRA0_WSGRB0_WS32_WG32_4_1_WGM8_WGMXCC1_WGMXCCGn1
    SolutionIndex: 214
    SolutionNameMin: Cijk_Ailk_Bjlk_I8BH_SHB_HA_S_SCD_SAV_UserArgs_MT16x32x64_MI16x16x1_SN_LDSB0_AFC1_AFEM1_AFEM1_ASEM1_CLR1_CADS0_DTLA0_DTLB0_DTVA1_DTVB1_EPS0_FDSI0_GRPM1_GRVWA8_GRVWB8_GSU1_GSUAMB_GSUC0_GSUWGMRR0_GLS0_ISA1201_IU1_K1_LBSPPA0_LBSPPB0_LBSPPM0_LPA0_LPB0_LPM0_LRVW8_LWPMn1_MIAV1_MIWT1_1_MO40_NTn1_NTA0_NTB0_NTC0_NTD0_NTM0_NEPBS0_NLCA1_NLCB1_ONLL0_PGR1_PLR0_PKA0_SIA3_SS1_SU32_SUM1_SUS256_SPO0_SRVW0_SSO0_SVW1_SK0_SKXCCM0_TLDS0_ULSGRO0_USL1_UIOFGRO0_USFGROn1_VSn1_VWA1_VWB1_WSGRA0_WSGRB0_WS32_WG16_4_1_WGM8_WGMXCC1_WGMXCCGn1
    SolutionIndex: 215
    SolutionNameMin: Cijk_Ailk_Bjlk_I8BH_SHB_HA_S_SCD_SAV_UserArgs_MT32x16x64_MI16x16x1_SN_LDSB0_AFC1_AFEM1_AFEM1_ASEM1_CLR1_CADS0_DTLA0_DTLB0_DTVA1_DTVB1_EPS0_FDSI0_GRPM1_GRVWA8_GRVWB8_GSU1_GSUAMB_GSUC0_GSUWGMRR0_GLS0_ISA1201_IU1_K1_LBSPPA0_LBSPPB0_LBSPPM0_LPA0_LPB0_LPM0_LRVW8_LWPMn1_MIAV1_MIWT1_1_MO40_NTn1_NTA0_NTB0_NTC0_NTD0_NTM0_NEPBS0_NLCA1_NLCB1_ONLL0_PGR1_PLR0_PKA0_SIA3_SS1_SU32_SUM1_SUS256_SPO0_SRVW0_SSO0_SVW1_SK0_SKXCCM0_TLDS0_ULSGRO0_USL1_UIOFGRO0_USFGROn1_VSn1_VWA1_VWB1_WSGRA0_WSGRB0_WS32_WG32_2_1_WGM8_WGMXCC1_WGMXCCGn1
    SolutionIndex: 216
    SolutionNameMin: Cijk_Ailk_Bjlk_I8BH_SHB_HA_S_SCD_SAV_UserArgs_MT128x64x64_MI16x16x1_SN_LDSB0_AFC1_AFEM1_AFEM1_ASEM1_CLR1_CADS0_DTLA0_DTLB0_DTVA0_DTVB1_EPS1_FDSI0_GRPM1_GRVWA8_GRVWB8_GSU1_GSUAMB_GSUC0_GSUWGMRR0_GLS0_ISA1201_IU1_K1_LBSPPA1024_LBSPPB0_LBSPPM0_LPA0_LPB0_LPM0_LRVW8_LWPMn1_MIAV1_MIWT8_1_MO40_NTn1_NTA0_NTB0_NTC0_NTD0_NTM0_NEPBS0_NLCA1_NLCB1_ONLL0_PGR1_PLR1_PKA0_SIA3_SS1_SU32_SUM1_SUS256_SPO0_SRVW0_SSO0_SVW8_SK0_SKXCCM0_TLDS0_ULSGRO0_USL1_UIOFGRO0_USFGROn1_VSn1_VWA8_VWB1_WSGRA0_WSGRB0_WS32_WG16_8_1_WGM8_WGMXCC1_WGMXCCGn1
    SolutionIndex: 217
    SolutionNameMin: Cijk_Ailk_Bjlk_I8BH_SHB_HA_S_SCD_SAV_UserArgs_MT128x64x64_MI16x16x1_SN_LDSB0_AFC1_AFEM1_AFEM1_ASEM1_CLR1_CADS0_DTLA0_DTLB0_DTVA0_DTVB1_EPS0_FDSI0_GRPM1_GRVWA8_GRVWB8_GSU1_GSUAMB_GSUC0_GSUWGMRR0_GLS0_ISA1201_IU1_K1_LBSPPA1024_LBSPPB0_LBSPPM0_LPA0_LPB0_LPM0_LRVW8_LWPMn1_MIAV1_MIWT8_1_MO40_NTn1_NTA0_NTB0_NTC0_NTD0_NTM0_NEPBS0_NLCA1_NLCB1_ONLL0_PGR2_PLR1_PKA0_SIA3_SS1_SU32_SUM1_SUS256_SPO0_SRVW0_SSO0_SVW8_SK0_SKXCCM0_TLDS0_ULSGRO0_USL1_UIOFGRO0_USFGROn1_VSn1_VWA8_VWB1_WSGRA0_WSGRB0_WS32_WG16_8_1_WGM8_WGMXCC1_WGMXCCGn1
    SolutionIndex: 218
    SolutionNameMin: Cijk_Ailk_Bjlk_I8BH_SHB_HA_S_SCD_SAV_UserArgs_MT128x32x64_MI16x16x1_SN_LDSB1_AFC1_AFEM1_AFEM1_ASEM1_CLR1_CADS0_DTLA0_DTLB0_DTVA0_DTVB0_EPS1_FDSI0_GRPM1_GRVWA8_GRVWB4_GSU1_GSUAMB_GSUC0_GSUWGMRR0_GLS0_ISA1201_IU4_K1_LBSPPA1024_LBSPPB256_LBSPPM0_LPA64_LPB16_LPM0_LRVW8_LWPMn1_MIAV1_MIWT4_1_MO40_NTn1_NTA0_NTB0_NTC0_NTD0_NTM0_NEPBS0_NLCA1_NLCB1_ONLL0_PGR1_PLR1_PKA0_SIA2_SS1_SU32_SUM1_SUS256_SPO0_SRVW0_SSO0_SVW4_SK0_SKXCCM0_TLDS0_ULSGRO0_USL1_UIOFGRO0_USFGROn1_VSn1_VWA4_VWB1_WSGRA0_WSGRB0_WS32_WG32_4_1_WGM8_WGMXCC1_WGMXCCGn1
    SolutionIndex: 219
    SolutionNameMin: Cijk_Ailk_Bjlk_I8BH_SHB_HA_S_SCD_SAV_UserArgs_MT128x32x64_MI16x16x1_SN_LDSB1_AFC1_AFEM1_AFEM1_ASEM1_CLR1_CADS0_DTLA0_DTLB0_DTVA0_DTVB0_EPS0_FDSI0_GRPM1_GRVWA8_GRVWB4_GSU1_GSUAMB_GSUC0_GSUWGMRR0_GLS0_ISA1201_IU4_K1_LBSPPA1024_LBSPPB256_LBSPPM0_LPA64_LPB16_LPM0_LRVW8_LWPMn1_MIAV1_MIWT4_1_MO40_NTn1_NTA0_NTB0_NTC0_NTD0_NTM0_NEPBS0_NLCA1_NLCB1_ONLL0_PGR2_PLR1_PKA0_SIA2_SS1_SU32_SUM1_SUS256_SPO0_SRVW0_SSO0_SVW4_SK0_SKXCCM0_TLDS0_ULSGRO0_USL1_UIOFGRO0_USFGROn1_VSn1_VWA4_VWB1_WSGRA0_WSGRB0_WS32_WG32_4_1_WGM8_WGMXCC1_WGMXCCGn1
    SolutionIndex: 220
    SolutionNameMin: Cijk_Ailk_Bjlk_I8BH_SHB_HA_S_SCD_SAV_UserArgs_MT128x32x64_MI16x16x1_SN_LDSB0_AFC1_AFEM1_AFEM1_ASEM1_CLR1_CADS0_DTLA0_DTLB0_DTVA0_DTVB0_EPS1_FDSI0_GRPM1_GRVWA16_GRVWB4_GSU1_GSUAMB_GSUC0_GSUWGMRR0_GLS0_ISA1201_IU1_K1_LBSPPA1024_LBSPPB256_LBSPPM0_LPA64_LPB16_LPM0_LRVW8_LWPMn1_MIAV1_MIWT4_1_MO40_NTn1_NTA0_NTB0_NTC0_NTD0_NTM0_NEPBS0_NLCA1_NLCB1_ONLL0_PGR1_PLR1_PKA0_SIA3_SS1_SU32_SUM1_SUS256_SPO0_SRVW0_SSO0_SVW4_SK0_SKXCCM0_TLDS0_ULSGRO0_USL1_UIOFGRO0_USFGROn1_VSn1_VWA4_VWB1_WSGRA0_WSGRB0_WS32_WG32_4_1_WGM8_WGMXCC1_WGMXCCGn1
    SolutionIndex: 221
    SolutionNameMin: Cijk_Ailk_Bjlk_I8BH_SHB_HA_S_SCD_SAV_UserArgs_MT128x32x64_MI16x16x1_SN_LDSB0_AFC1_AFEM1_AFEM1_ASEM1_CLR1_CADS0_DTLA0_DTLB0_DTVA0_DTVB0_EPS0_FDSI0_GRPM1_GRVWA16_GRVWB4_GSU1_GSUAMB_GSUC0_GSUWGMRR0_GLS0_ISA1201_IU1_K1_LBSPPA1024_LBSPPB256_LBSPPM0_LPA64_LPB16_LPM0_LRVW8_LWPMn1_MIAV1_MIWT4_1_MO40_NTn1_NTA0_NTB0_NTC0_NTD0_NTM0_NEPBS0_NLCA1_NLCB1_ONLL0_PGR2_PLR1_PKA0_SIA3_SS1_SU32_SUM1_SUS256_SPO0_SRVW0_SSO0_SVW4_SK0_SKXCCM0_TLDS0_ULSGRO1_USL1_UIOFGRO0_USFGROn1_VSn1_VWA4_VWB1_WSGRA0_WSGRB0_WS32_WG32_4_1_WGM8_WGMXCC1_WGMXCCGn1
    SolutionIndex: 222
    SolutionNameMin: Cijk_Ailk_Bjlk_I8BH_SHB_HA_S_SCD_SAV_UserArgs_MT128x32x64_MI16x16x1_SN_LDSB0_AFC1_AFEM1_AFEM1_ASEM1_CLR1_CADS0_DTLA0_DTLB0_DTVA0_DTVB0_EPS0_FDSI0_GRPM1_GRVWA8_GRVWB16_GSU1_GSUAMB_GSUC0_GSUWGMRR0_GLS0_ISA1201_IU1_K1_LBSPPA1024_LBSPPB256_LBSPPM0_LPA64_LPB16_LPM0_LRVW8_LWPMn1_MIAV1_MIWT4_1_MO40_NTn1_NTA0_NTB0_NTC0_NTD0_NTM0_NEPBS0_NLCA1_NLCB1_ONLL0_PGR2_PLR1_PKA0_SIA3_SS1_SU32_SUM1_SUS256_SPO0_SRVW0_SSO0_SVW4_SK0_SKXCCM0_TLDS0_ULSGRO1_USL1_UIOFGRO0_USFGROn1_VSn1_VWA4_VWB1_WSGRA0_WSGRB0_WS32_WG32_4_1_WGM8_WGMXCC1_WGMXCCGn1
    SolutionIndex: 223
    SolutionNameMin: Cijk_Ailk_Bjlk_I8BH_SHB_HA_S_SCD_SAV_UserArgs_MT128x32x64_MI16x16x1_SN_LDSB0_AFC1_AFEM1_AFEM1_ASEM1_CLR1_CADS0_DTLA0_DTLB0_DTVA0_DTVB0_EPS0_FDSI0_GRPM1_GRVWA16_GRVWB16_GSU1_GSUAMB_GSUC0_GSUWGMRR0_GLS0_ISA1201_IU1_K1_LBSPPA1024_LBSPPB256_LBSPPM0_LPA64_LPB16_LPM0_LRVW8_LWPMn1_MIAV1_MIWT4_1_MO40_NTn1_NTA0_NTB0_NTC0_NTD0_NTM0_NEPBS0_NLCA1_NLCB1_ONLL0_PGR2_PLR1_PKA0_SIA3_SS1_SU32_SUM1_SUS256_SPO0_SRVW0_SSO0_SVW4_SK0_SKXCCM0_TLDS0_ULSGRO1_USL1_UIOFGRO0_USFGROn1_VSn1_VWA4_VWB1_WSGRA0_WSGRB0_WS32_WG32_4_1_WGM8_WGMXCC1_WGMXCCGn1
    SolutionIndex: 224
    SolutionNameMin: Cijk_Ailk_Bjlk_I8BH_SHB_HA_S_SCD_SAV_UserArgs_MT128x32x64_MI16x16x1_SN_LDSB0_AFC1_AFEM1_AFEM1_ASEM1_CLR1_CADS0_DTLA0_DTLB0_DTVA1_DTVB0_EPS1_FDSI0_GRPM1_GRVWA8_GRVWB4_GSU1_GSUAMB_GSUC0_GSUWGMRR0_GLS0_ISA1201_IU1_K1_LBSPPA0_LBSPPB256_LBSPPM0_LPA0_LPB16_LPM0_LRVW8_LWPMn1_MIAV1_MIWT4_1_MO40_NTn1_NTA0_NTB0_NTC0_NTD0_NTM0_NEPBS0_NLCA4_NLCB1_ONLL0_PGR1_PLR1_PKA0_SIA3_SS1_SU32_SUM1_SUS256_SPO0_SRVW0_SSO0_SVW1_SK0_SKXCCM0_TLDS0_ULSGRO0_USL1_UIOFGRO0_USFGROn1_VSn1_VWA1_VWB1_WSGRA0_WSGRB0_WS32_WG32_4_1_WGM8_WGMXCC1_WGMXCCGn1
    SolutionIndex: 225
    SolutionNameMin: Cijk_Ailk_Bjlk_I8BH_SHB_HA_S_SCD_SAV_UserArgs_MT128x32x64_MI16x16x1_SN_LDSB0_AFC1_AFEM1_AFEM1_ASEM1_CLR1_CADS0_DTLA0_DTLB0_DTVA1_DTVB0_EPS1_FDSI0_GRPM1_GRVWA8_GRVWB16_GSU1_GSUAMB_GSUC0_GSUWGMRR0_GLS0_ISA1201_IU1_K1_LBSPPA0_LBSPPB256_LBSPPM0_LPA0_LPB16_LPM0_LRVW8_LWPMn1_MIAV1_MIWT4_1_MO40_NTn1_NTA0_NTB0_NTC0_NTD0_NTM0_NEPBS0_NLCA4_NLCB1_ONLL0_PGR1_PLR1_PKA0_SIA3_SS1_SU32_SUM1_SUS256_SPO0_SRVW0_SSO0_SVW1_SK0_SKXCCM0_TLDS0_ULSGRO0_USL1_UIOFGRO0_USFGROn1_VSn1_VWA1_VWB1_WSGRA0_WSGRB0_WS32_WG32_4_1_WGM8_WGMXCC1_WGMXCCGn1
    SolutionIndex: 226
    SolutionNameMin: Cijk_Ailk_Bjlk_I8BH_SHB_HA_S_SCD_SAV_UserArgs_MT128x32x64_MI16x16x1_SN_LDSB0_AFC1_AFEM1_AFEM1_ASEM1_CLR1_CADS0_DTLA0_DTLB0_DTVA0_DTVB1_EPS1_FDSI0_GRPM1_GRVWA8_GRVWB8_GSU1_GSUAMB_GSUC0_GSUWGMRR0_GLS0_ISA1201_IU1_K1_LBSPPA1024_LBSPPB0_LBSPPM0_LPA64_LPB0_LPM0_LRVW8_LWPMn1_MIAV1_MIWT4_1_MO40_NTn1_NTA0_NTB0_NTC0_NTD0_NTM0_NEPBS0_NLCA1_NLCB1_ONLL0_PGR1_PLR1_PKA0_SIA3_SS1_SU32_SUM1_SUS256_SPO0_SRVW0_SSO0_SVW4_SK0_SKXCCM0_TLDS0_ULSGRO0_USL1_UIOFGRO0_USFGROn1_VSn1_VWA4_VWB1_WSGRA0_WSGRB0_WS32_WG32_4_1_WGM8_WGMXCC1_WGMXCCGn1
    SolutionIndex: 227
    SolutionNameMin: Cijk_Ailk_Bjlk_I8BH_SHB_HA_S_SCD_SAV_UserArgs_MT128x32x64_MI16x16x1_SN_LDSB0_AFC1_AFEM1_AFEM1_ASEM1_CLR1_CADS0_DTLA0_DTLB0_DTVA0_DTVB1_EPS1_FDSI0_GRPM1_GRVWA16_GRVWB8_GSU1_GSUAMB_GSUC0_GSUWGMRR0_GLS0_ISA1201_IU1_K1_LBSPPA1024_LBSPPB0_LBSPPM0_LPA64_LPB0_LPM0_LRVW8_LWPMn1_MIAV1_MIWT4_1_MO40_NTn1_NTA0_NTB0_NTC0_NTD0_NTM0_NEPBS0_NLCA1_NLCB1_ONLL0_PGR1_PLR1_PKA0_SIA3_SS1_SU32_SUM1_SUS256_SPO0_SRVW0_SSO0_SVW4_SK0_SKXCCM0_TLDS0_ULSGRO0_USL1_UIOFGRO0_USFGROn1_VSn1_VWA4_VWB1_WSGRA0_WSGRB0_WS32_WG32_4_1_WGM8_WGMXCC1_WGMXCCGn1
    SolutionIndex: 228
    SolutionNameMin: Cijk_Ailk_Bjlk_I8BH_SHB_HA_S_SCD_SAV_UserArgs_MT64x64x128_MI16x16x1_SN_LDSB0_AFC1_AFEM1_AFEM1_ASEM1_CLR1_CADS0_DTLA0_DTLB0_DTVA0_DTVB1_EPS1_FDSI0_GRPM1_GRVWA8_GRVWB8_GSU1_GSUAMB_GSUC0_GSUWGMRR0_GLS0_ISA1201_IU1_K1_LBSPPA512_LBSPPB0_LBSPPM0_LPA32_LPB0_LPM0_LRVW8_LWPMn1_MIAV1_MIWT2_2_MO40_NTn1_NTA0_NTB0_NTC0_NTD0_NTM0_NEPBS0_NLCA1_NLCB8_ONLL0_PGR1_PLR1_PKA0_SIA3_SS1_SU32_SUM1_SUS256_SPO0_SRVW0_SSO0_SVW2_SK0_SKXCCM0_TLDS0_ULSGRO0_USL1_UIOFGRO0_USFGROn1_VSn1_VWA2_VWB1_WSGRA0_WSGRB0_WS32_WG32_4_1_WGM8_WGMXCC1_WGMXCCGn1
    SolutionIndex: 229
    SolutionNameMin: Cijk_Ailk_Bjlk_I8BH_SHB_HA_S_SCD_SAV_UserArgs_MT64x64x128_MI16x16x1_SN_LDSB0_AFC1_AFEM1_AFEM1_ASEM1_CLR1_CADS0_DTLA0_DTLB0_DTVA0_DTVB1_EPS1_FDSI0_GRPM1_GRVWA16_GRVWB8_GSU1_GSUAMB_GSUC0_GSUWGMRR0_GLS0_ISA1201_IU1_K1_LBSPPA512_LBSPPB0_LBSPPM0_LPA32_LPB0_LPM0_LRVW8_LWPMn1_MIAV1_MIWT2_2_MO40_NTn1_NTA0_NTB0_NTC0_NTD0_NTM0_NEPBS0_NLCA1_NLCB8_ONLL0_PGR1_PLR1_PKA0_SIA3_SS1_SU32_SUM1_SUS256_SPO0_SRVW0_SSO0_SVW2_SK0_SKXCCM0_TLDS0_ULSGRO0_USL1_UIOFGRO0_USFGROn1_VSn1_VWA2_VWB1_WSGRA0_WSGRB0_WS32_WG32_4_1_WGM8_WGMXCC1_WGMXCCGn1
    SolutionIndex: 230
    SolutionNameMin: Cijk_Ailk_Bjlk_I8BH_SHB_HA_S_SCD_SAV_UserArgs_MT32x32x128_MI16x16x1_SN_LDSB0_AFC1_AFEM1_AFEM1_ASEM1_CLR1_CADS0_DTLA0_DTLB0_DTVA1_DTVB0_EPS1_FDSI0_GRPM1_GRVWA8_GRVWB8_GSU1_GSUAMB_GSUC0_GSUWGMRR0_GLS0_ISA1201_IU1_K1_LBSPPA0_LBSPPB256_LBSPPM0_LPA0_LPB16_LPM0_LRVW8_LWPMn1_MIAV1_MIWT1_1_MO40_NTn1_NTA0_NTB0_NTC0_NTD0_NTM0_NEPBS0_NLCA1_NLCB1_ONLL0_PGR1_PLR1_PKA0_SIA3_SS1_SU32_SUM1_SUS256_SPO0_SRVW0_SSO0_SVW1_SK0_SKXCCM0_TLDS0_ULSGRO0_USL1_UIOFGRO0_USFGROn1_VSn1_VWA1_VWB1_WSGRA0_WSGRB0_WS32_WG32_4_1_WGM8_WGMXCC1_WGMXCCGn1
    SolutionIndex: 231
    SolutionNameMin: Cijk_Ailk_Bjlk_I8BH_SHB_HA_S_SCD_SAV_UserArgs_MT32x32x128_MI16x16x1_SN_LDSB0_AFC1_AFEM1_AFEM1_ASEM1_CLR1_CADS0_DTLA0_DTLB0_DTVA1_DTVB0_EPS1_FDSI0_GRPM1_GRVWA8_GRVWB16_GSU1_GSUAMB_GSUC0_GSUWGMRR0_GLS0_ISA1201_IU1_K1_LBSPPA0_LBSPPB256_LBSPPM0_LPA0_LPB16_LPM0_LRVW8_LWPMn1_MIAV1_MIWT1_1_MO40_NTn1_NTA0_NTB0_NTC0_NTD0_NTM0_NEPBS0_NLCA1_NLCB1_ONLL0_PGR1_PLR1_PKA0_SIA3_SS1_SU32_SUM1_SUS256_SPO0_SRVW0_SSO0_SVW1_SK0_SKXCCM0_TLDS0_ULSGRO0_USL1_UIOFGRO0_USFGROn1_VSn1_VWA1_VWB1_WSGRA0_WSGRB0_WS32_WG32_4_1_WGM8_WGMXCC1_WGMXCCGn1
    SolutionIndex: 232
    SolutionNameMin: Cijk_Ailk_Bjlk_I8BH_SHB_HA_S_SCD_SAV_UserArgs_MT32x32x128_MI16x16x1_SN_LDSB0_AFC1_AFEM1_AFEM1_ASEM1_CLR1_CADS0_DTLA0_DTLB0_DTVA1_DTVB0_EPS0_FDSI0_GRPM1_GRVWA8_GRVWB8_GSU1_GSUAMB_GSUC0_GSUWGMRR0_GLS0_ISA1201_IU1_K1_LBSPPA0_LBSPPB256_LBSPPM0_LPA0_LPB16_LPM0_LRVW8_LWPMn1_MIAV1_MIWT1_1_MO40_NTn1_NTA0_NTB0_NTC0_NTD0_NTM0_NEPBS0_NLCA1_NLCB1_ONLL0_PGR2_PLR1_PKA0_SIA3_SS1_SU32_SUM1_SUS256_SPO0_SRVW0_SSO0_SVW1_SK0_SKXCCM0_TLDS0_ULSGRO0_USL1_UIOFGRO0_USFGROn1_VSn1_VWA1_VWB1_WSGRA0_WSGRB0_WS32_WG32_4_1_WGM8_WGMXCC1_WGMXCCGn1
    SolutionIndex: 233
    SolutionNameMin: Cijk_Ailk_Bjlk_I8BH_SHB_HA_S_SCD_SAV_UserArgs_MT32x32x128_MI16x16x1_SN_LDSB0_AFC1_AFEM1_AFEM1_ASEM1_CLR1_CADS0_DTLA0_DTLB0_DTVA1_DTVB0_EPS0_FDSI0_GRPM1_GRVWA8_GRVWB16_GSU1_GSUAMB_GSUC0_GSUWGMRR0_GLS0_ISA1201_IU1_K1_LBSPPA0_LBSPPB256_LBSPPM0_LPA0_LPB16_LPM0_LRVW8_LWPMn1_MIAV1_MIWT1_1_MO40_NTn1_NTA0_NTB0_NTC0_NTD0_NTM0_NEPBS0_NLCA1_NLCB1_ONLL0_PGR2_PLR1_PKA0_SIA3_SS1_SU32_SUM1_SUS256_SPO0_SRVW0_SSO0_SVW1_SK0_SKXCCM0_TLDS0_ULSGRO0_USL1_UIOFGRO0_USFGROn1_VSn1_VWA1_VWB1_WSGRA0_WSGRB0_WS32_WG32_4_1_WGM8_WGMXCC1_WGMXCCGn1
    SolutionIndex: 234
    SolutionNameMin: Cijk_Ailk_Bjlk_I8BH_SHB_HA_S_SCD_SAV_UserArgs_MT32x32x128_MI16x16x1_SN_LDSB0_AFC1_AFEM1_AFEM1_ASEM1_CLR1_CADS0_DTLA0_DTLB0_DTVA0_DTVB1_EPS1_FDSI0_GRPM1_GRVWA4_GRVWB8_GSU1_GSUAMB_GSUC0_GSUWGMRR0_GLS0_ISA1201_IU1_K1_LBSPPA256_LBSPPB0_LBSPPM0_LPA16_LPB0_LPM0_LRVW8_LWPMn1_MIAV1_MIWT1_1_MO40_NTn1_NTA0_NTB0_NTC0_NTD0_NTM0_NEPBS0_NLCA1_NLCB1_ONLL0_PGR1_PLR1_PKA0_SIA3_SS1_SU32_SUM1_SUS256_SPO0_SRVW0_SSO0_SVW1_SK0_SKXCCM0_TLDS0_ULSGRO0_USL1_UIOFGRO0_USFGROn1_VSn1_VWA1_VWB1_WSGRA0_WSGRB0_WS32_WG32_4_1_WGM8_WGMXCC1_WGMXCCGn1
    SolutionIndex: 235
    SolutionNameMin: Cijk_Ailk_Bjlk_I8BH_SHB_HA_S_SCD_SAV_UserArgs_MT32x32x128_MI16x16x1_SN_LDSB0_AFC1_AFEM1_AFEM1_ASEM1_CLR1_CADS0_DTLA0_DTLB0_DTVA0_DTVB1_EPS1_FDSI0_GRPM1_GRVWA8_GRVWB8_GSU1_GSUAMB_GSUC0_GSUWGMRR0_GLS0_ISA1201_IU1_K1_LBSPPA256_LBSPPB0_LBSPPM0_LPA16_LPB0_LPM0_LRVW8_LWPMn1_MIAV1_MIWT1_1_MO40_NTn1_NTA0_NTB0_NTC0_NTD0_NTM0_NEPBS0_NLCA1_NLCB1_ONLL0_PGR1_PLR1_PKA0_SIA3_SS1_SU32_SUM1_SUS256_SPO0_SRVW0_SSO0_SVW1_SK0_SKXCCM0_TLDS0_ULSGRO0_USL1_UIOFGRO0_USFGROn1_VSn1_VWA1_VWB1_WSGRA0_WSGRB0_WS32_WG32_4_1_WGM8_WGMXCC1_WGMXCCGn1
    SolutionIndex: 236
    SolutionNameMin: Cijk_Ailk_Bjlk_I8BH_SHB_HA_S_SCD_SAV_UserArgs_MT32x32x128_MI16x16x1_SN_LDSB0_AFC1_AFEM1_AFEM1_ASEM1_CLR1_CADS0_DTLA0_DTLB0_DTVA0_DTVB1_EPS1_FDSI0_GRPM1_GRVWA16_GRVWB8_GSU1_GSUAMB_GSUC0_GSUWGMRR0_GLS0_ISA1201_IU1_K1_LBSPPA256_LBSPPB0_LBSPPM0_LPA16_LPB0_LPM0_LRVW8_LWPMn1_MIAV1_MIWT1_1_MO40_NTn1_NTA0_NTB0_NTC0_NTD0_NTM0_NEPBS0_NLCA1_NLCB1_ONLL0_PGR1_PLR1_PKA0_SIA3_SS1_SU32_SUM1_SUS256_SPO0_SRVW0_SSO0_SVW1_SK0_SKXCCM0_TLDS0_ULSGRO0_USL1_UIOFGRO0_USFGROn1_VSn1_VWA1_VWB1_WSGRA0_WSGRB0_WS32_WG32_4_1_WGM8_WGMXCC1_WGMXCCGn1
    SolutionIndex: 237
    SolutionNameMin: Cijk_Ailk_Bjlk_I8BH_SHB_HA_S_SCD_SAV_UserArgs_MT32x32x128_MI16x16x1_SN_LDSB0_AFC1_AFEM1_AFEM1_ASEM1_CLR1_CADS0_DTLA0_DTLB0_DTVA0_DTVB1_EPS0_FDSI0_GRPM1_GRVWA8_GRVWB8_GSU1_GSUAMB_GSUC0_GSUWGMRR0_GLS0_ISA1201_IU1_K1_LBSPPA256_LBSPPB0_LBSPPM0_LPA16_LPB0_LPM0_LRVW8_LWPMn1_MIAV1_MIWT1_1_MO40_NTn1_NTA0_NTB0_NTC0_NTD0_NTM0_NEPBS0_NLCA1_NLCB1_ONLL0_PGR2_PLR1_PKA0_SIA3_SS1_SU32_SUM1_SUS256_SPO0_SRVW0_SSO0_SVW1_SK0_SKXCCM0_TLDS0_ULSGRO0_USL1_UIOFGRO0_USFGROn1_VSn1_VWA1_VWB1_WSGRA0_WSGRB0_WS32_WG32_4_1_WGM8_WGMXCC1_WGMXCCGn1
    SolutionIndex: 238
    SolutionNameMin: Cijk_Ailk_Bjlk_I8BH_SHB_HA_S_SCD_SAV_UserArgs_MT32x32x128_MI16x16x1_SN_LDSB0_AFC1_AFEM1_AFEM1_ASEM1_CLR1_CADS0_DTLA0_DTLB0_DTVA0_DTVB1_EPS0_FDSI0_GRPM1_GRVWA16_GRVWB8_GSU1_GSUAMB_GSUC0_GSUWGMRR0_GLS0_ISA1201_IU1_K1_LBSPPA256_LBSPPB0_LBSPPM0_LPA16_LPB0_LPM0_LRVW8_LWPMn1_MIAV1_MIWT1_1_MO40_NTn1_NTA0_NTB0_NTC0_NTD0_NTM0_NEPBS0_NLCA1_NLCB1_ONLL0_PGR2_PLR1_PKA0_SIA3_SS1_SU32_SUM1_SUS256_SPO0_SRVW0_SSO0_SVW1_SK0_SKXCCM0_TLDS0_ULSGRO0_USL1_UIOFGRO0_USFGROn1_VSn1_VWA1_VWB1_WSGRA0_WSGRB0_WS32_WG32_4_1_WGM8_WGMXCC1_WGMXCCGn1
    SolutionIndex: 239
    SolutionNameMin: Cijk_Ailk_Bjlk_I8BH_SHB_HA_S_SCD_SAV_UserArgs_MT32x32x128_MI16x16x1_SN_LDSB0_AFC1_AFEM1_AFEM1_ASEM1_CLR1_CADS0_DTLA0_DTLB0_DTVA1_DTVB1_EPS0_FDSI0_GRPM1_GRVWA8_GRVWB8_GSU1_GSUAMB_GSUC0_GSUWGMRR0_GLS0_ISA1201_IU1_K1_LBSPPA0_LBSPPB0_LBSPPM0_LPA0_LPB0_LPM0_LRVW8_LWPMn1_MIAV1_MIWT1_1_MO40_NTn1_NTA0_NTB0_NTC0_NTD0_NTM0_NEPBS0_NLCA1_NLCB1_ONLL0_PGR1_PLR0_PKA0_SIA3_SS1_SU32_SUM1_SUS256_SPO0_SRVW0_SSO0_SVW1_SK0_SKXCCM0_TLDS0_ULSGRO0_USL1_UIOFGRO0_USFGROn1_VSn1_VWA1_VWB1_WSGRA0_WSGRB0_WS32_WG32_4_1_WGM8_WGMXCC1_WGMXCCGn1
    SolutionIndex: 240
    SolutionNameMin: Cijk_Ailk_Bjlk_I8BH_SHB_HA_S_SCD_SAV_UserArgs_MT128x32x128_MI16x16x1_SN_LDSB1_AFC1_AFEM1_AFEM1_ASEM1_CLR1_CADS0_DTLA0_DTLB0_DTVA0_DTVB1_EPS1_FDSI0_GRPM1_GRVWA8_GRVWB8_GSU1_GSUAMB_GSUC0_GSUWGMRR0_GLS0_ISA1201_IU1_K1_LBSPPA1024_LBSPPB0_LBSPPM0_LPA64_LPB0_LPM0_LRVW8_LWPMn1_MIAV1_MIWT4_1_MO40_NTn1_NTA0_NTB0_NTC0_NTD0_NTM0_NEPBS0_NLCA1_NLCB1_ONLL0_PGR1_PLR1_PKA0_SIA3_SS1_SU32_SUM1_SUS256_SPO0_SRVW0_SSO0_SVW4_SK0_SKXCCM0_TLDS0_ULSGRO0_USL1_UIOFGRO0_USFGROn1_VSn1_VWA4_VWB1_WSGRA0_WSGRB0_WS32_WG32_4_1_WGM8_WGMXCC1_WGMXCCGn1
    SolutionIndex: 241
    SolutionNameMin: Cijk_Ailk_Bjlk_I8BH_SHB_HA_S_SCD_SAV_UserArgs_MT32x32x32_MI16x16x1_SN_LDSB1_AFC1_AFEM1_AFEM1_ASEM1_CLR1_CADS0_DTLA0_DTLB0_DTVA0_DTVB0_EPS1_FDSI0_GRPM1_GRVWA1_GRVWB1_GSU1_GSUAMB_GSUC0_GSUWGMRR0_GLS0_ISA1201_IU2_K1_LBSPPA256_LBSPPB256_LBSPPM0_LPA16_LPB16_LPM0_LRVW8_LWPMn1_MIAV1_MIWT1_1_MO40_NTn1_NTA0_NTB0_NTC0_NTD0_NTM0_NEPBS0_NLCA1_NLCB1_ONLL0_PGR1_PLR1_PKA0_SIA2_SS0_SU32_SUM1_SUS256_SPO0_SRVW0_SSO0_SVW8_SK0_SKXCCM0_TLDS0_ULSGRO0_USL1_UIOFGRO0_USFGROn1_VSn1_VWA1_VWB1_WSGRA0_WSGRB0_WS32_WG32_4_1_WGM8_WGMXCC1_WGMXCCGn1
    SolutionIndex: 242
    SolutionNameMin: Cijk_Ailk_Bjlk_I8BH_SHB_HA_S_SCD_SAV_UserArgs_MT64x64x64_MI16x16x1_SN_LDSB1_AFC1_AFEM1_AFEM1_ASEM1_CLR1_CADS0_DTLA0_DTLB0_DTVA0_DTVB0_EPS0_FDSI0_GRPM1_GRVWA4_GRVWB16_GSU1_GSUAMB_GSUC0_GSUWGMRR0_GLS0_ISA1201_IU4_K1_LBSPPA512_LBSPPB512_LBSPPM0_LPA32_LPB32_LPM0_LRVW8_LWPMn1_MIAV1_MIWT2_2_MO40_NTn1_NTA0_NTB0_NTC0_NTD0_NTM0_NEPBS0_NLCA1_NLCB1_ONLL0_PGR2_PLR1_PKA0_SIA2_SS0_SU32_SUM1_SUS256_SPO0_SRVW0_SSO0_SVW16_SK0_SKXCCM0_TLDS0_ULSGRO0_USL1_UIOFGRO0_USFGROn1_VSn1_VWA2_VWB2_WSGRA0_WSGRB0_WS32_WG32_4_1_WGM8_WGMXCC1_WGMXCCGn1
    SolutionIndex: 243
    SolutionNameMin: Cijk_Ailk_Bjlk_I8BH_SHB_HA_S_SCD_SAV_UserArgs_MT32x32x64_MI16x16x1_SN_LDSB1_AFC1_AFEM1_AFEM1_ASEM1_CLR1_CADS0_DTLA0_DTLB0_DTVA0_DTVB0_EPS0_FDSI0_GRPM1_GRVWA4_GRVWB8_GSU1_GSUAMB_GSUC0_GSUWGMRR0_GLS0_ISA1201_IU4_K1_LBSPPA256_LBSPPB256_LBSPPM0_LPA16_LPB16_LPM0_LRVW8_LWPMn1_MIAV1_MIWT1_1_MO40_NTn1_NTA0_NTB0_NTC0_NTD0_NTM0_NEPBS0_NLCA1_NLCB1_ONLL0_PGR2_PLR1_PKA0_SIA2_SS1_SU32_SUM1_SUS256_SPO0_SRVW0_SSO0_SVW1_SK0_SKXCCM0_TLDS0_ULSGRO1_USL1_UIOFGRO0_USFGROn1_VSn1_VWA1_VWB1_WSGRA0_WSGRB0_WS32_WG32_4_1_WGM8_WGMXCC1_WGMXCCGn1
    SolutionIndex: 244
    SolutionNameMin: Cijk_Ailk_Bjlk_I8BH_SHB_HA_S_SCD_SAV_UserArgs_MT64x64x64_MI16x16x1_SN_LDSB1_AFC1_AFEM1_AFEM1_ASEM1_CLR1_CADS0_DTLA0_DTLB0_DTVA0_DTVB0_EPS0_FDSI0_GRPM1_GRVWA8_GRVWB4_GSU1_GSUAMB_GSUC0_GSUWGMRR0_GLS0_ISA1201_IU4_K1_LBSPPA512_LBSPPB512_LBSPPM0_LPA32_LPB32_LPM0_LRVW8_LWPMn1_MIAV1_MIWT2_2_MO40_NTn1_NTA0_NTB0_NTC0_NTD0_NTM0_NEPBS0_NLCA1_NLCB1_ONLL0_PGR2_PLR1_PKA0_SIA2_SS1_SU32_SUM1_SUS256_SPO0_SRVW0_SSO0_SVW2_SK0_SKXCCM0_TLDS0_ULSGRO1_USL1_UIOFGRO0_USFGROn1_VSn1_VWA2_VWB2_WSGRA0_WSGRB0_WS32_WG32_4_1_WGM8_WGMXCC1_WGMXCCGn1
    SolutionIndex: 245
    SolutionNameMin: Cijk_Ailk_Bjlk_I8BH_SHB_HA_S_SCD_SAV_UserArgs_MT64x64x32_MI16x16x1_SN_LDSB1_AFC1_AFEM1_AFEM1_ASEM1_CLR1_CADS0_DTLA0_DTLB0_DTVA0_DTVB0_EPS0_FDSI0_GRPM1_GRVWA4_GRVWB4_GSU1_GSUAMB_GSUC0_GSUWGMRR0_GLS0_ISA1201_IU2_K1_LBSPPA512_LBSPPB512_LBSPPM0_LPA32_LPB32_LPM0_LRVW8_LWPMn1_MIAV1_MIWT2_2_MO40_NTn1_NTA0_NTB0_NTC0_NTD0_NTM0_NEPBS0_NLCA1_NLCB1_ONLL0_PGR2_PLR1_PKA0_SIA2_SS1_SU32_SUM1_SUS256_SPO0_SRVW0_SSO0_SVW2_SK0_SKXCCM0_TLDS0_ULSGRO0_USL1_UIOFGRO0_USFGROn1_VSn1_VWA2_VWB2_WSGRA0_WSGRB0_WS32_WG32_4_1_WGM8_WGMXCC1_WGMXCCGn1
    SolutionIndex: 246
    SolutionNameMin: Cijk_Ailk_Bjlk_I8BH_SHB_HA_S_SCD_SAV_UserArgs_MT64x64x64_MI16x16x1_SN_LDSB1_AFC1_AFEM1_AFEM1_ASEM1_CLR1_CADS0_DTLA0_DTLB0_DTVA0_DTVB0_EPS1_FDSI0_GRPM1_GRVWA4_GRVWB8_GSU1_GSUAMB_GSUC0_GSUWGMRR0_GLS0_ISA1201_IU4_K1_LBSPPA512_LBSPPB512_LBSPPM0_LPA32_LPB32_LPM0_LRVW8_LWPMn1_MIAV1_MIWT2_2_MO40_NTn1_NTA0_NTB0_NTC0_NTD0_NTM0_NEPBS0_NLCA1_NLCB1_ONLL0_PGR1_PLR1_PKA0_SIA2_SS0_SU32_SUM1_SUS256_SPO0_SRVW0_SSO0_SVW16_SK0_SKXCCM0_TLDS0_ULSGRO0_USL1_UIOFGRO0_USFGROn1_VSn1_VWA2_VWB2_WSGRA0_WSGRB0_WS32_WG32_4_1_WGM8_WGMXCC1_WGMXCCGn1
    SolutionIndex: 247
    SolutionNameMin: Cijk_Ailk_Bjlk_I8BH_SHB_HA_S_SCD_SAV_UserArgs_MT64x64x64_MI16x16x1_SN_LDSB1_AFC1_AFEM1_AFEM1_ASEM1_CLR1_CADS0_DTLA0_DTLB0_DTVA0_DTVB0_EPS0_FDSI0_GRPM1_GRVWA16_GRVWB8_GSU1_GSUAMB_GSUC0_GSUWGMRR0_GLS0_ISA1201_IU4_K1_LBSPPA512_LBSPPB512_LBSPPM0_LPA32_LPB32_LPM0_LRVW8_LWPMn1_MIAV1_MIWT2_2_MO40_NTn1_NTA0_NTB0_NTC0_NTD0_NTM0_NEPBS0_NLCA1_NLCB1_ONLL0_PGR2_PLR1_PKA0_SIA2_SS1_SU32_SUM1_SUS256_SPO0_SRVW0_SSO0_SVW2_SK0_SKXCCM0_TLDS0_ULSGRO0_USL1_UIOFGRO0_USFGROn1_VSn1_VWA2_VWB2_WSGRA0_WSGRB0_WS32_WG32_4_1_WGM8_WGMXCC1_WGMXCCGn1
    SolutionIndex: 248
    SolutionNameMin: Cijk_Ailk_Bjlk_I8BH_SHB_HA_S_SCD_SAV_UserArgs_MT64x64x16_MI16x16x1_SN_LDSB1_AFC1_AFEM1_AFEM1_ASEM1_CLR1_CADS0_DTLA0_DTLB0_DTVA0_DTVB0_EPS1_FDSI0_GRPM1_GRVWA1_GRVWB1_GSU1_GSUAMB_GSUC0_GSUWGMRR0_GLS0_ISA1201_IU1_K1_LBSPPA512_LBSPPB512_LBSPPM0_LPA32_LPB32_LPM0_LRVW8_LWPMn1_MIAV1_MIWT2_2_MO40_NTn1_NTA0_NTB0_NTC0_NTD0_NTM0_NEPBS0_NLCA1_NLCB1_ONLL0_PGR1_PLR1_PKA0_SIA2_SS1_SU32_SUM1_SUS256_SPO0_SRVW0_SSO0_SVW2_SK0_SKXCCM0_TLDS0_ULSGRO0_USL1_UIOFGRO0_USFGROn1_VSn1_VWA2_VWB2_WSGRA0_WSGRB0_WS32_WG32_4_1_WGM8_WGMXCC1_WGMXCCGn1
    SolutionIndex: 249
    SolutionNameMin: Cijk_Ailk_Bjlk_I8BH_SHB_HA_S_SCD_SAV_UserArgs_MT64x64x32_MI16x16x1_SN_LDSB1_AFC1_AFEM1_AFEM1_ASEM1_CLR1_CADS0_DTLA0_DTLB0_DTVA0_DTVB0_EPS1_FDSI0_GRPM1_GRVWA4_GRVWB4_GSU1_GSUAMB_GSUC0_GSUWGMRR0_GLS0_ISA1201_IU2_K1_LBSPPA512_LBSPPB512_LBSPPM0_LPA32_LPB32_LPM0_LRVW8_LWPMn1_MIAV1_MIWT2_2_MO40_NTn1_NTA0_NTB0_NTC0_NTD0_NTM0_NEPBS0_NLCA1_NLCB1_ONLL0_PGR1_PLR1_PKA0_SIA2_SS0_SU32_SUM1_SUS256_SPO0_SRVW0_SSO0_SVW16_SK0_SKXCCM0_TLDS0_ULSGRO0_USL1_UIOFGRO0_USFGROn1_VSn1_VWA2_VWB2_WSGRA0_WSGRB0_WS32_WG32_4_1_WGM8_WGMXCC1_WGMXCCGn1
    SolutionIndex: 250
    SolutionNameMin: Cijk_Ailk_Bjlk_I8BH_SHB_HA_S_SCD_SAV_UserArgs_MT64x128x32_MI16x16x1_SN_LDSB0_AFC1_AFEM1_AFEM1_ASEM1_CLR1_CADS0_DTLA0_DTLB0_DTVA0_DTVB1_EPS0_FDSI0_GRPM1_GRVWA1_GRVWB8_GSU1_GSUAMB_GSUC0_GSUWGMRR0_GLS0_ISA1201_IU1_K1_LBSPPA512_LBSPPB0_LBSPPM0_LPA16_LPB0_LPM0_LRVW8_LWPMn1_MIAV1_MIWT1_8_MO40_NTn1_NTA0_NTB0_NTC0_NTD0_NTM0_NEPBS0_NLCA1_NLCB2_ONLL0_PGR2_PLR1_PKA0_SIA3_SS0_SU32_SUM1_SUS256_SPO0_SRVW0_SSO0_SVW8_SK0_SKXCCM0_TLDS0_ULSGRO0_USL1_UIOFGRO0_USFGROn1_VSn1_VWA1_VWB1_WSGRA0_WSGRB0_WS32_WG64_2_1_WGM8_WGMXCC1_WGMXCCGn1
    SolutionIndex: 251
    SolutionNameMin: Cijk_Ailk_Bjlk_I8BH_SHB_HA_S_SCD_SAV_UserArgs_MT64x64x32_MI16x16x1_SN_LDSB1_AFC1_AFEM1_AFEM1_ASEM1_CLR1_CADS0_DTLA0_DTLB0_DTVA0_DTVB0_EPS0_FDSI0_GRPM1_GRVWA1_GRVWB1_GSU1_GSUAMB_GSUC0_GSUWGMRR0_GLS0_ISA1201_IU2_K1_LBSPPA512_LBSPPB512_LBSPPM0_LPA32_LPB32_LPM0_LRVW8_LWPMn1_MIAV1_MIWT2_2_MO40_NTn1_NTA0_NTB0_NTC0_NTD0_NTM0_NEPBS0_NLCA1_NLCB1_ONLL0_PGR2_PLR1_PKA0_SIA2_SS1_SU32_SUM1_SUS256_SPO0_SRVW0_SSO0_SVW2_SK0_SKXCCM0_TLDS0_ULSGRO1_USL1_UIOFGRO0_USFGROn1_VSn1_VWA2_VWB2_WSGRA0_WSGRB0_WS32_WG32_4_1_WGM8_WGMXCC1_WGMXCCGn1
    SolutionIndex: 252
    SolutionNameMin: Cijk_Ailk_Bjlk_I8BH_SHB_HA_S_SCD_SAV_UserArgs_MT64x64x32_MI16x16x1_SN_LDSB1_AFC1_AFEM1_AFEM1_ASEM1_CLR1_CADS0_DTLA0_DTLB0_DTVA0_DTVB0_EPS0_FDSI0_GRPM1_GRVWA4_GRVWB8_GSU1_GSUAMB_GSUC0_GSUWGMRR0_GLS0_ISA1201_IU2_K1_LBSPPA512_LBSPPB512_LBSPPM0_LPA32_LPB32_LPM0_LRVW8_LWPMn1_MIAV1_MIWT2_2_MO40_NTn1_NTA0_NTB0_NTC0_NTD0_NTM0_NEPBS0_NLCA1_NLCB1_ONLL0_PGR2_PLR1_PKA0_SIA2_SS0_SU32_SUM1_SUS256_SPO0_SRVW0_SSO0_SVW16_SK0_SKXCCM0_TLDS0_ULSGRO0_USL1_UIOFGRO0_USFGROn1_VSn1_VWA2_VWB2_WSGRA0_WSGRB0_WS32_WG32_4_1_WGM8_WGMXCC1_WGMXCCGn1
    SolutionIndex: 253
    SolutionNameMin: Cijk_Ailk_Bjlk_I8BH_SHB_HA_S_SCD_SAV_UserArgs_MT64x64x64_MI16x16x1_SN_LDSB1_AFC1_AFEM1_AFEM1_ASEM1_CLR1_CADS0_DTLA0_DTLB0_DTVA0_DTVB0_EPS0_FDSI0_GRPM1_GRVWA4_GRVWB8_GSU1_GSUAMB_GSUC0_GSUWGMRR0_GLS0_ISA1201_IU4_K1_LBSPPA512_LBSPPB512_LBSPPM0_LPA32_LPB32_LPM0_LRVW8_LWPMn1_MIAV1_MIWT2_2_MO40_NTn1_NTA0_NTB0_NTC0_NTD0_NTM0_NEPBS0_NLCA1_NLCB1_ONLL0_PGR2_PLR1_PKA0_SIA2_SS1_SU32_SUM1_SUS256_SPO0_SRVW0_SSO0_SVW2_SK0_SKXCCM0_TLDS0_ULSGRO0_USL1_UIOFGRO0_USFGROn1_VSn1_VWA2_VWB2_WSGRA0_WSGRB0_WS32_WG32_4_1_WGM8_WGMXCC1_WGMXCCGn1
    SolutionIndex: 254
    SolutionNameMin: Cijk_Ailk_Bjlk_I8BH_SHB_HA_S_SCD_SAV_UserArgs_MT32x128x64_MI16x16x1_SN_LDSB0_AFC1_AFEM1_AFEM1_ASEM1_CLR1_CADS0_DTLA0_DTLB0_DTVA0_DTVB0_EPS0_FDSI0_GRPM1_GRVWA4_GRVWB16_GSU1_GSUAMB_GSUC0_GSUWGMRR0_GLS0_ISA1201_IU1_K1_LBSPPA256_LBSPPB1024_LBSPPM0_LPA16_LPB64_LPM0_LRVW8_LWPMn1_MIAV1_MIWT1_4_MO40_NTn1_NTA0_NTB0_NTC0_NTD0_NTM0_NEPBS0_NLCA1_NLCB1_ONLL0_PGR2_PLR1_PKA0_SIA3_SS0_SU32_SUM1_SUS256_SPO0_SRVW0_SSO0_SVW8_SK0_SKXCCM0_TLDS0_ULSGRO1_USL1_UIOFGRO0_USFGROn1_VSn1_VWA1_VWB4_WSGRA0_WSGRB0_WS32_WG32_4_1_WGM8_WGMXCC1_WGMXCCGn1
    SolutionIndex: 255
    SolutionNameMin: Cijk_Ailk_Bjlk_I8BH_SHB_HA_S_SCD_SAV_UserArgs_MT16x256x32_MI16x16x1_SN_LDSB0_AFC1_AFEM1_AFEM1_ASEM1_CLR1_CADS0_DTLA0_DTLB0_DTVA1_DTVB0_EPS1_FDSI0_GRPM1_GRVWA8_GRVWB16_GSU1_GSUAMB_GSUC0_GSUWGMRR0_GLS0_ISA1201_IU1_K1_LBSPPA0_LBSPPB2048_LBSPPM0_LPA0_LPB0_LPM0_LRVW8_LWPMn1_MIAV1_MIWT1_8_MO40_NTn1_NTA0_NTB0_NTC0_NTD0_NTM0_NEPBS0_NLCA1_NLCB1_ONLL0_PGR1_PLR1_PKA0_SIA3_SS0_SU32_SUM1_SUS256_SPO0_SRVW0_SSO0_SVW8_SK0_SKXCCM0_TLDS0_ULSGRO0_USL1_UIOFGRO0_USFGROn1_VSn1_VWA1_VWB8_WSGRA0_WSGRB0_WS32_WG16_4_1_WGM8_WGMXCC1_WGMXCCGn1
    SolutionIndex: 256
    SolutionNameMin: Cijk_Ailk_Bjlk_I8BH_SHB_HA_S_SCD_SAV_UserArgs_MT64x128x64_MI16x16x1_SN_LDSB0_AFC1_AFEM1_AFEM1_ASEM1_CLR1_CADS0_DTLA0_DTLB0_DTVA0_DTVB0_EPS0_FDSI0_GRPM1_GRVWA8_GRVWB8_GSU1_GSUAMB_GSUC0_GSUWGMRR0_GLS0_ISA1201_IU1_K1_LBSPPA512_LBSPPB1024_LBSPPM0_LPA16_LPB0_LPM0_LRVW8_LWPMn1_MIAV1_MIWT1_8_MO40_NTn1_NTA0_NTB0_NTC0_NTD0_NTM0_NEPBS0_NLCA1_NLCB1_ONLL0_PGR2_PLR1_PKA0_SIA3_SS0_SU32_SUM1_SUS256_SPO0_SRVW0_SSO0_SVW8_SK0_SKXCCM0_TLDS0_ULSGRO1_USL1_UIOFGRO0_USFGROn1_VSn1_VWA1_VWB8_WSGRA0_WSGRB0_WS32_WG64_2_1_WGM8_WGMXCC1_WGMXCCGn1
    SolutionIndex: 257
    SolutionNameMin: Cijk_Ailk_Bjlk_I8BH_SHB_HA_S_SCD_SAV_UserArgs_MT32x128x64_MI16x16x1_SN_LDSB0_AFC1_AFEM1_AFEM1_ASEM1_CLR1_CADS0_DTLA0_DTLB0_DTVA0_DTVB0_EPS0_FDSI0_GRPM1_GRVWA16_GRVWB16_GSU1_GSUAMB_GSUC0_GSUWGMRR0_GLS0_ISA1201_IU1_K1_LBSPPA256_LBSPPB1024_LBSPPM0_LPA16_LPB64_LPM0_LRVW8_LWPMn1_MIAV1_MIWT1_4_MO40_NTn1_NTA0_NTB0_NTC0_NTD0_NTM0_NEPBS0_NLCA1_NLCB1_ONLL0_PGR2_PLR1_PKA0_SIA3_SS0_SU32_SUM1_SUS256_SPO0_SRVW0_SSO0_SVW8_SK0_SKXCCM0_TLDS0_ULSGRO1_USL1_UIOFGRO0_USFGROn1_VSn1_VWA1_VWB4_WSGRA0_WSGRB0_WS32_WG32_4_1_WGM8_WGMXCC1_WGMXCCGn1
    SolutionIndex: 258
    SolutionNameMin: Cijk_Ailk_Bjlk_I8BH_SHB_HA_S_SCD_SAV_UserArgs_MT64x64x32_MI16x16x1_SN_LDSB0_AFC1_AFEM1_AFEM1_ASEM1_CLR1_CADS0_DTLA0_DTLB0_DTVA0_DTVB0_EPS0_FDSI0_GRPM1_GRVWA1_GRVWB1_GSU1_GSUAMB_GSUC0_GSUWGMRR0_GLS0_ISA1201_IU1_K1_LBSPPA512_LBSPPB512_LBSPPM0_LPA32_LPB32_LPM0_LRVW8_LWPMn1_MIAV1_MIWT2_2_MO40_NTn1_NTA0_NTB0_NTC0_NTD0_NTM0_NEPBS0_NLCA1_NLCB1_ONLL0_PGR2_PLR1_PKA0_SIA3_SS1_SU32_SUM1_SUS256_SPO0_SRVW0_SSO0_SVW2_SK0_SKXCCM0_TLDS0_ULSGRO1_USL1_UIOFGRO0_USFGROn1_VSn1_VWA2_VWB2_WSGRA0_WSGRB0_WS32_WG32_4_1_WGM8_WGMXCC1_WGMXCCGn1
    SolutionIndex: 259
    SolutionNameMin: Cijk_Ailk_Bjlk_I8BH_SHB_HA_S_SCD_SAV_UserArgs_MT64x128x64_MI16x16x1_SN_LDSB0_AFC1_AFEM1_AFEM1_ASEM1_CLR1_CADS0_DTLA0_DTLB0_DTVA0_DTVB0_EPS0_FDSI0_GRPM1_GRVWA8_GRVWB8_GSU1_GSUAMB_GSUC0_GSUWGMRR0_GLS0_ISA1201_IU1_K1_LBSPPA512_LBSPPB1024_LBSPPM0_LPA16_LPB0_LPM0_LRVW8_LWPMn1_MIAV1_MIWT1_8_MO40_NTn1_NTA0_NTB0_NTC0_NTD0_NTM0_NEPBS0_NLCA1_NLCB1_ONLL0_PGR2_PLR1_PKA0_SIA3_SS0_SU32_SUM1_SUS256_SPO0_SRVW0_SSO0_SVW8_SK0_SKXCCM0_TLDS0_ULSGRO0_USL1_UIOFGRO0_USFGROn1_VSn1_VWA1_VWB8_WSGRA0_WSGRB0_WS32_WG64_2_1_WGM8_WGMXCC1_WGMXCCGn1
    SolutionIndex: 260
    SolutionNameMin: Cijk_Ailk_Bjlk_I8BH_SHB_HA_S_SCD_SAV_UserArgs_MT64x128x64_MI16x16x1_SN_LDSB0_AFC1_AFEM1_AFEM1_ASEM1_CLR1_CADS0_DTLA0_DTLB0_DTVA0_DTVB0_EPS1_FDSI0_GRPM1_GRVWA8_GRVWB16_GSU1_GSUAMB_GSUC0_GSUWGMRR0_GLS0_ISA1201_IU1_K1_LBSPPA512_LBSPPB1024_LBSPPM0_LPA16_LPB0_LPM0_LRVW8_LWPMn1_MIAV1_MIWT1_8_MO40_NTn1_NTA0_NTB0_NTC0_NTD0_NTM0_NEPBS0_NLCA1_NLCB1_ONLL0_PGR1_PLR1_PKA0_SIA3_SS0_SU32_SUM1_SUS256_SPO0_SRVW0_SSO0_SVW8_SK0_SKXCCM0_TLDS0_ULSGRO0_USL1_UIOFGRO0_USFGROn1_VSn1_VWA1_VWB8_WSGRA0_WSGRB0_WS32_WG64_2_1_WGM8_WGMXCC1_WGMXCCGn1
    SolutionIndex: 261
    SolutionNameMin: Cijk_Ailk_Bjlk_I8BH_SHB_HA_S_SCD_SAV_UserArgs_MT64x128x64_MI16x16x1_SN_LDSB0_AFC1_AFEM1_AFEM1_ASEM1_CLR1_CADS0_DTLA0_DTLB0_DTVA0_DTVB0_EPS1_FDSI0_GRPM1_GRVWA16_GRVWB8_GSU1_GSUAMB_GSUC0_GSUWGMRR0_GLS0_ISA1201_IU1_K1_LBSPPA512_LBSPPB1024_LBSPPM0_LPA16_LPB0_LPM0_LRVW8_LWPMn1_MIAV1_MIWT1_8_MO40_NTn1_NTA0_NTB0_NTC0_NTD0_NTM0_NEPBS0_NLCA1_NLCB1_ONLL0_PGR1_PLR1_PKA0_SIA3_SS0_SU32_SUM1_SUS256_SPO0_SRVW0_SSO0_SVW8_SK0_SKXCCM0_TLDS0_ULSGRO0_USL1_UIOFGRO0_USFGROn1_VSn1_VWA1_VWB8_WSGRA0_WSGRB0_WS32_WG64_2_1_WGM8_WGMXCC1_WGMXCCGn1
    SolutionIndex: 262
    SolutionNameMin: Cijk_Ailk_Bjlk_I8BH_SHB_HA_S_SCD_SAV_UserArgs_MT64x128x64_MI16x16x1_SN_LDSB0_AFC1_AFEM1_AFEM1_ASEM1_CLR1_CADS0_DTLA0_DTLB0_DTVA0_DTVB0_EPS0_FDSI0_GRPM1_GRVWA8_GRVWB16_GSU1_GSUAMB_GSUC0_GSUWGMRR0_GLS0_ISA1201_IU1_K1_LBSPPA512_LBSPPB1024_LBSPPM0_LPA16_LPB0_LPM0_LRVW8_LWPMn1_MIAV1_MIWT1_8_MO40_NTn1_NTA0_NTB0_NTC0_NTD0_NTM0_NEPBS0_NLCA1_NLCB1_ONLL0_PGR2_PLR1_PKA0_SIA3_SS0_SU32_SUM1_SUS256_SPO0_SRVW0_SSO0_SVW8_SK0_SKXCCM0_TLDS0_ULSGRO1_USL1_UIOFGRO0_USFGROn1_VSn1_VWA1_VWB8_WSGRA0_WSGRB0_WS32_WG64_2_1_WGM8_WGMXCC1_WGMXCCGn1
    SolutionIndex: 263
    SolutionNameMin: Cijk_Ailk_Bjlk_I8BH_SHB_HA_S_SCD_SAV_UserArgs_MT64x128x64_MI16x16x1_SN_LDSB0_AFC1_AFEM1_AFEM1_ASEM1_CLR1_CADS0_DTLA0_DTLB0_DTVA0_DTVB0_EPS0_FDSI0_GRPM1_GRVWA8_GRVWB16_GSU1_GSUAMB_GSUC0_GSUWGMRR0_GLS0_ISA1201_IU1_K1_LBSPPA512_LBSPPB1024_LBSPPM0_LPA16_LPB0_LPM0_LRVW8_LWPMn1_MIAV1_MIWT1_8_MO40_NTn1_NTA0_NTB0_NTC0_NTD0_NTM0_NEPBS0_NLCA1_NLCB1_ONLL0_PGR2_PLR1_PKA0_SIA3_SS0_SU32_SUM1_SUS256_SPO0_SRVW0_SSO0_SVW8_SK0_SKXCCM0_TLDS0_ULSGRO0_USL1_UIOFGRO0_USFGROn1_VSn1_VWA1_VWB8_WSGRA0_WSGRB0_WS32_WG64_2_1_WGM8_WGMXCC1_WGMXCCGn1
    SolutionIndex: 264
    SolutionNameMin: Cijk_Ailk_Bjlk_I8BH_SHB_HA_S_SCD_SAV_UserArgs_MT64x128x32_MI16x16x1_SN_LDSB1_AFC1_AFEM1_AFEM1_ASEM1_CLR1_CADS0_DTLA0_DTLB0_DTVA0_DTVB0_EPS0_FDSI0_GRPM1_GRVWA4_GRVWB16_GSU1_GSUAMB_GSUC0_GSUWGMRR0_GLS0_ISA1201_IU2_K1_LBSPPA512_LBSPPB1024_LBSPPM0_LPA16_LPB0_LPM0_LRVW8_LWPMn1_MIAV1_MIWT1_8_MO40_NTn1_NTA0_NTB0_NTC0_NTD0_NTM0_NEPBS0_NLCA1_NLCB1_ONLL0_PGR2_PLR1_PKA0_SIA2_SS0_SU32_SUM1_SUS256_SPO0_SRVW0_SSO0_SVW8_SK0_SKXCCM0_TLDS0_ULSGRO1_USL1_UIOFGRO0_USFGROn1_VSn1_VWA1_VWB8_WSGRA0_WSGRB0_WS32_WG64_2_1_WGM8_WGMXCC1_WGMXCCGn1
    SolutionIndex: 265
    SolutionNameMin: Cijk_Ailk_Bjlk_I8BH_SHB_HA_S_SCD_SAV_UserArgs_MT64x128x64_MI16x16x1_SN_LDSB0_AFC1_AFEM1_AFEM1_ASEM1_CLR1_CADS0_DTLA0_DTLB0_DTVA0_DTVB0_EPS1_FDSI0_GRPM1_GRVWA16_GRVWB16_GSU1_GSUAMB_GSUC0_GSUWGMRR0_GLS0_ISA1201_IU1_K1_LBSPPA512_LBSPPB1024_LBSPPM0_LPA16_LPB0_LPM0_LRVW8_LWPMn1_MIAV1_MIWT1_8_MO40_NTn1_NTA0_NTB0_NTC0_NTD0_NTM0_NEPBS0_NLCA1_NLCB1_ONLL0_PGR1_PLR1_PKA0_SIA3_SS0_SU32_SUM1_SUS256_SPO0_SRVW0_SSO0_SVW8_SK0_SKXCCM0_TLDS0_ULSGRO0_USL1_UIOFGRO0_USFGROn1_VSn1_VWA1_VWB8_WSGRA0_WSGRB0_WS32_WG64_2_1_WGM8_WGMXCC1_WGMXCCGn1
    SolutionIndex: 266
    SolutionNameMin: Cijk_Ailk_Bjlk_I8BH_SHB_HA_S_SCD_SAV_UserArgs_MT16x128x32_MI16x16x1_SN_LDSB0_AFC1_AFEM1_AFEM1_ASEM1_CLR1_CADS0_DTLA0_DTLB0_DTVA0_DTVB1_EPS1_FDSI0_GRPM1_GRVWA16_GRVWB8_GSU1_GSUAMB_GSUC0_GSUWGMRR0_GLS0_ISA1201_IU1_K1_LBSPPA128_LBSPPB0_LBSPPM0_LPA16_LPB0_LPM0_LRVW8_LWPMn1_MIAV1_MIWT1_8_MO40_NTn1_NTA0_NTB0_NTC0_NTD0_NTM0_NEPBS0_NLCA1_NLCB2_ONLL0_PGR1_PLR1_PKA0_SIA3_SS0_SU32_SUM1_SUS256_SPO0_SRVW0_SSO0_SVW8_SK0_SKXCCM0_TLDS0_ULSGRO0_USL1_UIOFGRO0_USFGROn1_VSn1_VWA1_VWB1_WSGRA0_WSGRB0_WS32_WG16_2_1_WGM8_WGMXCC1_WGMXCCGn1
    SolutionIndex: 267
    SolutionNameMin: Cijk_Ailk_Bjlk_I8BH_SHB_HA_S_SCD_SAV_UserArgs_MT64x128x32_MI16x16x1_SN_LDSB1_AFC1_AFEM1_AFEM1_ASEM1_CLR1_CADS0_DTLA0_DTLB0_DTVA0_DTVB0_EPS0_FDSI0_GRPM1_GRVWA8_GRVWB16_GSU1_GSUAMB_GSUC0_GSUWGMRR0_GLS0_ISA1201_IU2_K1_LBSPPA512_LBSPPB1024_LBSPPM0_LPA16_LPB0_LPM0_LRVW8_LWPMn1_MIAV1_MIWT1_8_MO40_NTn1_NTA0_NTB0_NTC0_NTD0_NTM0_NEPBS0_NLCA1_NLCB1_ONLL0_PGR2_PLR1_PKA0_SIA2_SS0_SU32_SUM1_SUS256_SPO0_SRVW0_SSO0_SVW8_SK0_SKXCCM0_TLDS0_ULSGRO1_USL1_UIOFGRO0_USFGROn1_VSn1_VWA1_VWB8_WSGRA0_WSGRB0_WS32_WG64_2_1_WGM8_WGMXCC1_WGMXCCGn1
    SolutionIndex: 268
    SolutionNameMin: Cijk_Ailk_Bjlk_I8BH_SHB_HA_S_SCD_SAV_UserArgs_MT16x128x32_MI16x16x1_SN_LDSB0_AFC1_AFEM1_AFEM1_ASEM1_CLR1_CADS0_DTLA0_DTLB0_DTVA0_DTVB1_EPS1_FDSI0_GRPM1_GRVWA4_GRVWB8_GSU1_GSUAMB_GSUC0_GSUWGMRR0_GLS0_ISA1201_IU1_K1_LBSPPA128_LBSPPB0_LBSPPM0_LPA16_LPB0_LPM0_LRVW8_LWPMn1_MIAV1_MIWT1_8_MO40_NTn1_NTA0_NTB0_NTC0_NTD0_NTM0_NEPBS0_NLCA1_NLCB2_ONLL0_PGR1_PLR1_PKA0_SIA3_SS0_SU32_SUM1_SUS256_SPO0_SRVW0_SSO0_SVW8_SK0_SKXCCM0_TLDS0_ULSGRO0_USL1_UIOFGRO0_USFGROn1_VSn1_VWA1_VWB1_WSGRA0_WSGRB0_WS32_WG16_2_1_WGM8_WGMXCC1_WGMXCCGn1
    SolutionIndex: 269
    SolutionNameMin: Cijk_Ailk_Bjlk_I8BH_SHB_HA_S_SCD_SAV_UserArgs_MT64x64x32_MI16x16x1_SN_LDSB0_AFC1_AFEM1_AFEM1_ASEM1_CLR1_CADS0_DTLA0_DTLB0_DTVA0_DTVB0_EPS0_FDSI0_GRPM1_GRVWA4_GRVWB16_GSU1_GSUAMB_GSUC0_GSUWGMRR0_GLS0_ISA1201_IU1_K1_LBSPPA512_LBSPPB512_LBSPPM0_LPA32_LPB32_LPM0_LRVW8_LWPMn1_MIAV1_MIWT2_2_MO40_NTn1_NTA0_NTB0_NTC0_NTD0_NTM0_NEPBS0_NLCA1_NLCB1_ONLL0_PGR2_PLR1_PKA0_SIA3_SS0_SU32_SUM1_SUS256_SPO0_SRVW0_SSO0_SVW16_SK0_SKXCCM0_TLDS0_ULSGRO1_USL1_UIOFGRO0_USFGROn1_VSn1_VWA2_VWB2_WSGRA0_WSGRB0_WS32_WG32_4_1_WGM8_WGMXCC1_WGMXCCGn1
    SolutionIndex: 270
    SolutionNameMin: Cijk_Ailk_Bjlk_I8BH_SHB_HA_S_SCD_SAV_UserArgs_MT32x128x64_MI16x16x1_SN_LDSB0_AFC1_AFEM1_AFEM1_ASEM1_CLR1_CADS0_DTLA0_DTLB0_DTVA1_DTVB0_EPS1_FDSI0_GRPM1_GRVWA8_GRVWB16_GSU1_GSUAMB_GSUC0_GSUWGMRR0_GLS0_ISA1201_IU1_K1_LBSPPA0_LBSPPB1024_LBSPPM0_LPA0_LPB64_LPM0_LRVW8_LWPMn1_MIAV1_MIWT1_4_MO40_NTn1_NTA0_NTB0_NTC0_NTD0_NTM0_NEPBS0_NLCA1_NLCB1_ONLL0_PGR1_PLR1_PKA0_SIA3_SS0_SU32_SUM1_SUS256_SPO0_SRVW0_SSO0_SVW8_SK0_SKXCCM0_TLDS0_ULSGRO0_USL1_UIOFGRO0_USFGROn1_VSn1_VWA1_VWB4_WSGRA0_WSGRB0_WS32_WG32_4_1_WGM8_WGMXCC1_WGMXCCGn1
    SolutionIndex: 271
    SolutionNameMin: Cijk_Ailk_Bjlk_I8BH_SHB_HA_S_SCD_SAV_UserArgs_MT64x128x64_MI16x16x1_SN_LDSB0_AFC1_AFEM1_AFEM1_ASEM1_CLR1_CADS0_DTLA0_DTLB0_DTVA1_DTVB0_EPS0_FDSI0_GRPM1_GRVWA8_GRVWB8_GSU1_GSUAMB_GSUC0_GSUWGMRR0_GLS0_ISA1201_IU1_K1_LBSPPA0_LBSPPB1024_LBSPPM0_LPA0_LPB0_LPM0_LRVW8_LWPMn1_MIAV1_MIWT1_8_MO40_NTn1_NTA0_NTB0_NTC0_NTD0_NTM0_NEPBS0_NLCA1_NLCB1_ONLL0_PGR2_PLR1_PKA0_SIA3_SS0_SU32_SUM1_SUS256_SPO0_SRVW0_SSO0_SVW8_SK0_SKXCCM0_TLDS0_ULSGRO0_USL1_UIOFGRO0_USFGROn1_VSn1_VWA1_VWB8_WSGRA0_WSGRB0_WS32_WG64_2_1_WGM8_WGMXCC1_WGMXCCGn1
    SolutionIndex: 272
    SolutionNameMin: Cijk_Ailk_Bjlk_I8BH_SHB_HA_S_SCD_SAV_UserArgs_MT64x128x64_MI16x16x1_SN_LDSB0_AFC1_AFEM1_AFEM1_ASEM1_CLR1_CADS0_DTLA0_DTLB0_DTVA1_DTVB0_EPS1_FDSI0_GRPM1_GRVWA8_GRVWB8_GSU1_GSUAMB_GSUC0_GSUWGMRR0_GLS0_ISA1201_IU1_K1_LBSPPA0_LBSPPB1024_LBSPPM0_LPA0_LPB0_LPM0_LRVW8_LWPMn1_MIAV1_MIWT1_8_MO40_NTn1_NTA0_NTB0_NTC0_NTD0_NTM0_NEPBS0_NLCA1_NLCB1_ONLL0_PGR1_PLR1_PKA0_SIA3_SS0_SU32_SUM1_SUS256_SPO0_SRVW0_SSO0_SVW8_SK0_SKXCCM0_TLDS0_ULSGRO0_USL1_UIOFGRO0_USFGROn1_VSn1_VWA1_VWB8_WSGRA0_WSGRB0_WS32_WG64_2_1_WGM8_WGMXCC1_WGMXCCGn1
    SolutionIndex: 273
    SolutionNameMin: Cijk_Ailk_Bjlk_I8BH_SHB_HA_S_SCD_SAV_UserArgs_MT32x128x64_MI16x16x1_SN_LDSB0_AFC1_AFEM1_AFEM1_ASEM1_CLR1_CADS0_DTLA0_DTLB0_DTVA0_DTVB0_EPS1_FDSI0_GRPM1_GRVWA16_GRVWB16_GSU1_GSUAMB_GSUC0_GSUWGMRR0_GLS0_ISA1201_IU1_K1_LBSPPA256_LBSPPB1024_LBSPPM0_LPA16_LPB64_LPM0_LRVW8_LWPMn1_MIAV1_MIWT1_4_MO40_NTn1_NTA0_NTB0_NTC0_NTD0_NTM0_NEPBS0_NLCA1_NLCB1_ONLL0_PGR1_PLR1_PKA0_SIA3_SS0_SU32_SUM1_SUS256_SPO0_SRVW0_SSO0_SVW8_SK0_SKXCCM0_TLDS0_ULSGRO0_USL1_UIOFGRO0_USFGROn1_VSn1_VWA1_VWB4_WSGRA0_WSGRB0_WS32_WG32_4_1_WGM8_WGMXCC1_WGMXCCGn1
    SolutionIndex: 274
    SolutionNameMin: Cijk_Ailk_Bjlk_I8BH_SHB_HA_S_SCD_SAV_UserArgs_MT16x512x32_MI16x16x1_SN_LDSB0_AFC1_AFEM1_AFEM1_ASEM1_CLR1_CADS0_DTLA0_DTLB0_DTVA1_DTVB0_EPS0_FDSI0_GRPM1_GRVWA8_GRVWB16_GSU1_GSUAMB_GSUC0_GSUWGMRR0_GLS0_ISA1201_IU1_K1_LBSPPA0_LBSPPB4096_LBSPPM0_LPA0_LPB0_LPM0_LRVW8_LWPMn1_MIAV1_MIWT1_8_MO40_NTn1_NTA0_NTB0_NTC0_NTD0_NTM0_NEPBS0_NLCA1_NLCB1_ONLL0_PGR2_PLR1_PKA0_SIA3_SS0_SU32_SUM1_SUS256_SPO0_SRVW0_SSO0_SVW8_SK0_SKXCCM0_TLDS0_ULSGRO0_USL1_UIOFGRO0_USFGROn1_VSn1_VWA1_VWB8_WSGRA0_WSGRB0_WS32_WG16_8_1_WGM8_WGMXCC1_WGMXCCGn1
    SolutionIndex: 275
    SolutionNameMin: Cijk_Ailk_Bjlk_I8BH_SHB_HA_S_SCD_SAV_UserArgs_MT16x512x32_MI16x16x1_SN_LDSB0_AFC1_AFEM1_AFEM1_ASEM1_CLR1_CADS0_DTLA0_DTLB0_DTVA1_DTVB0_EPS1_FDSI0_GRPM1_GRVWA8_GRVWB16_GSU1_GSUAMB_GSUC0_GSUWGMRR0_GLS0_ISA1201_IU1_K1_LBSPPA0_LBSPPB4096_LBSPPM0_LPA0_LPB0_LPM0_LRVW8_LWPMn1_MIAV1_MIWT1_8_MO40_NTn1_NTA0_NTB0_NTC0_NTD0_NTM0_NEPBS0_NLCA1_NLCB1_ONLL0_PGR1_PLR1_PKA0_SIA3_SS0_SU32_SUM1_SUS256_SPO0_SRVW0_SSO0_SVW8_SK0_SKXCCM0_TLDS0_ULSGRO0_USL1_UIOFGRO0_USFGROn1_VSn1_VWA1_VWB8_WSGRA0_WSGRB0_WS32_WG16_8_1_WGM8_WGMXCC1_WGMXCCGn1
    SolutionIndex: 276
    SolutionNameMin: Cijk_Ailk_Bjlk_I8BH_SHB_HA_S_SCD_SAV_UserArgs_MT16x128x32_MI16x16x1_SN_LDSB0_AFC1_AFEM1_AFEM1_ASEM1_CLR1_CADS0_DTLA0_DTLB0_DTVA0_DTVB1_EPS1_FDSI0_GRPM1_GRVWA8_GRVWB8_GSU1_GSUAMB_GSUC0_GSUWGMRR0_GLS0_ISA1201_IU1_K1_LBSPPA128_LBSPPB0_LBSPPM0_LPA16_LPB0_LPM0_LRVW8_LWPMn1_MIAV1_MIWT1_8_MO40_NTn1_NTA0_NTB0_NTC0_NTD0_NTM0_NEPBS0_NLCA1_NLCB2_ONLL0_PGR1_PLR1_PKA0_SIA3_SS0_SU32_SUM1_SUS256_SPO0_SRVW0_SSO0_SVW8_SK0_SKXCCM0_TLDS0_ULSGRO0_USL1_UIOFGRO0_USFGROn1_VSn1_VWA1_VWB1_WSGRA0_WSGRB0_WS32_WG16_2_1_WGM8_WGMXCC1_WGMXCCGn1
    SolutionIndex: 277
    SolutionNameMin: Cijk_Ailk_Bjlk_I8BH_SHB_HA_S_SCD_SAV_UserArgs_MT64x128x64_MI16x16x1_SN_LDSB0_AFC1_AFEM1_AFEM1_ASEM1_CLR1_CADS0_DTLA0_DTLB0_DTVA1_DTVB0_EPS1_FDSI0_GRPM1_GRVWA8_GRVWB16_GSU1_GSUAMB_GSUC0_GSUWGMRR0_GLS0_ISA1201_IU1_K1_LBSPPA0_LBSPPB1024_LBSPPM0_LPA0_LPB0_LPM0_LRVW8_LWPMn1_MIAV1_MIWT1_8_MO40_NTn1_NTA0_NTB0_NTC0_NTD0_NTM0_NEPBS0_NLCA1_NLCB1_ONLL0_PGR1_PLR1_PKA0_SIA3_SS0_SU32_SUM1_SUS256_SPO0_SRVW0_SSO0_SVW8_SK0_SKXCCM0_TLDS0_ULSGRO0_USL1_UIOFGRO0_USFGROn1_VSn1_VWA1_VWB8_WSGRA0_WSGRB0_WS32_WG64_2_1_WGM8_WGMXCC1_WGMXCCGn1
    SolutionIndex: 278
    SolutionNameMin: Cijk_Ailk_Bjlk_I8BH_SHB_HA_S_SCD_SAV_UserArgs_MT16x256x32_MI16x16x1_SN_LDSB0_AFC1_AFEM1_AFEM1_ASEM1_CLR1_CADS0_DTLA0_DTLB0_DTVA0_DTVB1_EPS1_FDSI0_GRPM1_GRVWA4_GRVWB8_GSU1_GSUAMB_GSUC0_GSUWGMRR0_GLS0_ISA1201_IU1_K1_LBSPPA128_LBSPPB0_LBSPPM0_LPA16_LPB0_LPM0_LRVW8_LWPMn1_MIAV1_MIWT1_8_MO40_NTn1_NTA0_NTB0_NTC0_NTD0_NTM0_NEPBS0_NLCA1_NLCB2_ONLL0_PGR1_PLR1_PKA0_SIA3_SS0_SU32_SUM1_SUS256_SPO0_SRVW0_SSO0_SVW8_SK0_SKXCCM0_TLDS0_ULSGRO0_USL1_UIOFGRO0_USFGROn1_VSn1_VWA1_VWB1_WSGRA0_WSGRB0_WS32_WG16_4_1_WGM8_WGMXCC1_WGMXCCGn1
    SolutionIndex: 279
    SolutionNameMin: Cijk_Ailk_Bjlk_I8BH_SHB_HA_S_SCD_SAV_UserArgs_MT64x128x32_MI16x16x1_SN_LDSB1_AFC1_AFEM1_AFEM1_ASEM1_CLR1_CADS0_DTLA0_DTLB0_DTVA0_DTVB0_EPS0_FDSI0_GRPM1_GRVWA8_GRVWB8_GSU1_GSUAMB_GSUC0_GSUWGMRR0_GLS0_ISA1201_IU2_K1_LBSPPA512_LBSPPB1024_LBSPPM0_LPA16_LPB0_LPM0_LRVW8_LWPMn1_MIAV1_MIWT1_8_MO40_NTn1_NTA0_NTB0_NTC0_NTD0_NTM0_NEPBS0_NLCA1_NLCB1_ONLL0_PGR2_PLR1_PKA0_SIA2_SS0_SU32_SUM1_SUS256_SPO0_SRVW0_SSO0_SVW8_SK0_SKXCCM0_TLDS0_ULSGRO1_USL1_UIOFGRO0_USFGROn1_VSn1_VWA1_VWB8_WSGRA0_WSGRB0_WS32_WG64_2_1_WGM8_WGMXCC1_WGMXCCGn1
    SolutionIndex: 281
    SolutionNameMin: Cijk_Ailk_Bjlk_I8BH_SHB_HA_S_SCD_SAV_UserArgs_MT16x128x32_MI16x16x1_SN_LDSB0_AFC1_AFEM1_AFEM1_ASEM1_CLR1_CADS0_DTLA0_DTLB0_DTVA0_DTVB1_EPS0_FDSI0_GRPM1_GRVWA8_GRVWB8_GSU1_GSUAMB_GSUC0_GSUWGMRR0_GLS0_ISA1201_IU1_K1_LBSPPA128_LBSPPB0_LBSPPM0_LPA16_LPB0_LPM0_LRVW8_LWPMn1_MIAV1_MIWT1_8_MO40_NTn1_NTA0_NTB0_NTC0_NTD0_NTM0_NEPBS0_NLCA1_NLCB2_ONLL0_PGR2_PLR1_PKA0_SIA3_SS0_SU32_SUM1_SUS256_SPO0_SRVW0_SSO0_SVW8_SK0_SKXCCM0_TLDS0_ULSGRO0_USL1_UIOFGRO0_USFGROn1_VSn1_VWA1_VWB1_WSGRA0_WSGRB0_WS32_WG16_2_1_WGM8_WGMXCC1_WGMXCCGn1
    SolutionIndex: 282
    SolutionNameMin: Cijk_Ailk_Bjlk_I8BH_SHB_HA_S_SCD_SAV_UserArgs_MT64x128x32_MI16x16x1_SN_LDSB1_AFC1_AFEM1_AFEM1_ASEM1_CLR1_CADS0_DTLA0_DTLB0_DTVA0_DTVB0_EPS1_FDSI0_GRPM1_GRVWA8_GRVWB8_GSU1_GSUAMB_GSUC0_GSUWGMRR0_GLS0_ISA1201_IU2_K1_LBSPPA512_LBSPPB1024_LBSPPM0_LPA16_LPB0_LPM0_LRVW8_LWPMn1_MIAV1_MIWT1_8_MO40_NTn1_NTA0_NTB0_NTC0_NTD0_NTM0_NEPBS0_NLCA1_NLCB1_ONLL0_PGR1_PLR1_PKA0_SIA2_SS0_SU32_SUM1_SUS256_SPO0_SRVW0_SSO0_SVW8_SK0_SKXCCM0_TLDS0_ULSGRO0_USL1_UIOFGRO0_USFGROn1_VSn1_VWA1_VWB8_WSGRA0_WSGRB0_WS32_WG64_2_1_WGM8_WGMXCC1_WGMXCCGn1
    SolutionIndex: 283
    SolutionNameMin: Cijk_Ailk_Bjlk_I8BH_SHB_HA_S_SCD_SAV_UserArgs_MT64x64x32_MI16x16x1_SN_LDSB1_AFC1_AFEM1_AFEM1_ASEM1_CLR1_CADS0_DTLA0_DTLB0_DTVA0_DTVB0_EPS0_FDSI0_GRPM1_GRVWA1_GRVWB16_GSU1_GSUAMB_GSUC0_GSUWGMRR0_GLS0_ISA1201_IU2_K1_LBSPPA512_LBSPPB512_LBSPPM0_LPA32_LPB32_LPM0_LRVW8_LWPMn1_MIAV1_MIWT2_2_MO40_NTn1_NTA0_NTB0_NTC0_NTD0_NTM0_NEPBS0_NLCA1_NLCB1_ONLL0_PGR2_PLR1_PKA0_SIA2_SS0_SU32_SUM1_SUS256_SPO0_SRVW0_SSO0_SVW16_SK0_SKXCCM0_TLDS0_ULSGRO1_USL1_UIOFGRO0_USFGROn1_VSn1_VWA2_VWB2_WSGRA0_WSGRB0_WS32_WG32_4_1_WGM8_WGMXCC1_WGMXCCGn1
    SolutionIndex: 287
    SolutionNameMin: Cijk_Ailk_Bjlk_I8BH_SHB_HA_S_SCD_SAV_UserArgs_MT64x64x128_MI16x16x1_SN_LDSB0_AFC1_AFEM1_AFEM1_ASEM1_CLR1_CADS0_DTLA0_DTLB0_DTVA1_DTVB1_EPS0_FDSI0_GRPM1_GRVWA8_GRVWB8_GSU1_GSUAMB_GSUC0_GSUWGMRR0_GLS0_ISA1201_IU1_K1_LBSPPA0_LBSPPB0_LBSPPM0_LPA0_LPB0_LPM0_LRVW8_LWPMn1_MIAV1_MIWT2_2_MO40_NTn1_NTA0_NTB0_NTC0_NTD0_NTM0_NEPBS0_NLCA8_NLCB8_ONLL0_PGR1_PLR0_PKA0_SIA3_SS0_SU32_SUM1_SUS256_SPO0_SRVW0_SSO0_SVW8_SK0_SKXCCM0_TLDS0_ULSGRO0_USL1_UIOFGRO0_USFGROn1_VSn1_VWA1_VWB1_WSGRA0_WSGRB0_WS32_WG32_4_1_WGM8_WGMXCC1_WGMXCCGn1
    SolutionIndex: 288
    SolutionNameMin: Cijk_Ailk_Bjlk_I8BH_SHB_HA_S_SCD_SAV_UserArgs_MT16x256x32_MI16x16x1_SN_LDSB0_AFC1_AFEM1_AFEM1_ASEM1_CLR1_CADS0_DTLA0_DTLB0_DTVA0_DTVB1_EPS0_FDSI0_GRPM1_GRVWA1_GRVWB8_GSU1_GSUAMB_GSUC0_GSUWGMRR0_GLS0_ISA1201_IU1_K1_LBSPPA128_LBSPPB0_LBSPPM0_LPA16_LPB0_LPM0_LRVW8_LWPMn1_MIAV1_MIWT1_8_MO40_NTn1_NTA0_NTB0_NTC0_NTD0_NTM0_NEPBS0_NLCA1_NLCB2_ONLL0_PGR2_PLR1_PKA0_SIA3_SS0_SU32_SUM1_SUS256_SPO0_SRVW0_SSO0_SVW8_SK0_SKXCCM0_TLDS0_ULSGRO0_USL1_UIOFGRO0_USFGROn1_VSn1_VWA1_VWB1_WSGRA0_WSGRB0_WS32_WG16_4_1_WGM8_WGMXCC1_WGMXCCGn1
    SolutionIndex: 290
    SolutionNameMin: Cijk_Ailk_Bjlk_I8BH_SHB_HA_S_SCD_SAV_UserArgs_MT64x64x64_MI16x16x1_SN_LDSB0_AFC1_AFEM1_AFEM1_ASEM1_CLR1_CADS0_DTLA0_DTLB0_DTVA1_DTVB1_EPS0_FDSI0_GRPM1_GRVWA8_GRVWB8_GSU1_GSUAMB_GSUC0_GSUWGMRR0_GLS0_ISA1201_IU1_K1_LBSPPA0_LBSPPB0_LBSPPM0_LPA0_LPB0_LPM0_LRVW8_LWPMn1_MIAV1_MIWT2_2_MO40_NTn1_NTA0_NTB0_NTC0_NTD0_NTM0_NEPBS0_NLCA4_NLCB4_ONLL0_PGR1_PLR0_PKA0_SIA3_SS1_SU32_SUM1_SUS256_SPO0_SRVW0_SSO0_SVW1_SK0_SKXCCM0_TLDS0_ULSGRO0_USL1_UIOFGRO0_USFGROn1_VSn1_VWA1_VWB1_WSGRA0_WSGRB0_WS32_WG32_4_1_WGM8_WGMXCC1_WGMXCCGn1
    SolutionIndex: 293
    SolutionNameMin: Cijk_Ailk_Bjlk_I8BH_SHB_HA_S_SCD_SAV_UserArgs_MT128x32x64_MI16x16x1_SN_LDSB0_AFC1_AFEM1_AFEM1_ASEM1_CLR1_CADS0_DTLA0_DTLB0_DTVA1_DTVB0_EPS1_FDSI0_GRPM1_GRVWA8_GRVWB8_GSU1_GSUAMB_GSUC0_GSUWGMRR0_GLS0_ISA1201_IU1_K1_LBSPPA0_LBSPPB256_LBSPPM0_LPA0_LPB16_LPM0_LRVW8_LWPMn1_MIAV1_MIWT4_1_MO40_NTn1_NTA0_NTB0_NTC0_NTD0_NTM0_NEPBS0_NLCA4_NLCB1_ONLL0_PGR1_PLR1_PKA0_SIA3_SS1_SU32_SUM1_SUS256_SPO0_SRVW0_SSO0_SVW1_SK0_SKXCCM0_TLDS0_ULSGRO0_USL1_UIOFGRO0_USFGROn1_VSn1_VWA1_VWB1_WSGRA0_WSGRB0_WS32_WG32_4_1_WGM8_WGMXCC1_WGMXCCGn1
    SolutionIndex: 295
    SolutionNameMin: Cijk_Ailk_Bjlk_I8BH_SHB_HA_S_SCD_SAV_UserArgs_MT16x32x128_MI16x16x1_SN_LDSB0_AFC1_AFEM1_AFEM1_ASEM1_CLR1_CADS0_DTLA0_DTLB0_DTVA0_DTVB1_EPS1_FDSI0_GRPM1_GRVWA16_GRVWB8_GSU1_GSUAMB_GSUC0_GSUWGMRR0_GLS0_ISA1201_IU1_K1_LBSPPA128_LBSPPB0_LBSPPM0_LPA16_LPB0_LPM0_LRVW8_LWPMn1_MIAV1_MIWT1_1_MO40_NTn1_NTA0_NTB0_NTC0_NTD0_NTM0_NEPBS0_NLCA1_NLCB1_ONLL0_PGR1_PLR1_PKA0_SIA3_SS1_SU32_SUM1_SUS256_SPO0_SRVW0_SSO0_SVW1_SK0_SKXCCM0_TLDS0_ULSGRO0_USL1_UIOFGRO0_USFGROn1_VSn1_VWA1_VWB1_WSGRA0_WSGRB0_WS32_WG16_4_1_WGM8_WGMXCC1_WGMXCCGn1
    SolutionIndex: 315
    SolutionNameMin: Cijk_Ailk_Bjlk_I8BH_SHB_HA_S_SCD_SAV_UserArgs_MT64x128x64_MI16x16x1_SN_LDSB0_AFC1_AFEM1_AFEM1_ASEM1_CLR1_CADS0_DTLA0_DTLB0_DTVA0_DTVB0_EPS1_FDSI0_GRPM1_GRVWA4_GRVWB8_GSU1_GSUAMB_GSUC0_GSUWGMRR0_GLS0_ISA1201_IU1_K1_LBSPPA512_LBSPPB1024_LBSPPM0_LPA16_LPB0_LPM0_LRVW8_LWPMn1_MIAV1_MIWT1_8_MO40_NTn1_NTA0_NTB0_NTC0_NTD0_NTM0_NEPBS0_NLCA1_NLCB1_ONLL0_PGR1_PLR1_PKA0_SIA3_SS0_SU32_SUM1_SUS256_SPO0_SRVW0_SSO0_SVW8_SK0_SKXCCM0_TLDS0_ULSGRO0_USL1_UIOFGRO0_USFGROn1_VSn1_VWA1_VWB8_WSGRA0_WSGRB0_WS32_WG64_2_1_WGM8_WGMXCC1_WGMXCCGn1
    SolutionIndex: 319
    SolutionNameMin: Cijk_Ailk_Bjlk_I8BH_SHB_HA_S_SCD_SAV_UserArgs_MT64x128x64_MI16x16x1_SN_LDSB0_AFC1_AFEM1_AFEM1_ASEM1_CLR1_CADS0_DTLA0_DTLB0_DTVA0_DTVB0_EPS1_FDSI0_GRPM1_GRVWA4_GRVWB16_GSU1_GSUAMB_GSUC0_GSUWGMRR0_GLS0_ISA1201_IU1_K1_LBSPPA512_LBSPPB1024_LBSPPM0_LPA16_LPB0_LPM0_LRVW8_LWPMn1_MIAV1_MIWT1_8_MO40_NTn1_NTA0_NTB0_NTC0_NTD0_NTM0_NEPBS0_NLCA1_NLCB1_ONLL0_PGR1_PLR1_PKA0_SIA3_SS0_SU32_SUM1_SUS256_SPO0_SRVW0_SSO0_SVW8_SK0_SKXCCM0_TLDS0_ULSGRO0_USL1_UIOFGRO0_USFGROn1_VSn1_VWA1_VWB8_WSGRA0_WSGRB0_WS32_WG64_2_1_WGM8_WGMXCC1_WGMXCCGn1
    SolutionIndex: 326
    SolutionNameMin: Cijk_Ailk_Bjlk_I8BH_SHB_HA_S_SCD_SAV_UserArgs_MT64x128x64_MI16x16x1_SN_LDSB0_AFC1_AFEM1_AFEM1_ASEM1_CLR1_CADS0_DTLA0_DTLB0_DTVA0_DTVB0_EPS0_FDSI0_GRPM1_GRVWA4_GRVWB8_GSU1_GSUAMB_GSUC0_GSUWGMRR0_GLS0_ISA1201_IU1_K1_LBSPPA512_LBSPPB1024_LBSPPM0_LPA16_LPB0_LPM0_LRVW8_LWPMn1_MIAV1_MIWT1_8_MO40_NTn1_NTA0_NTB0_NTC0_NTD0_NTM0_NEPBS0_NLCA1_NLCB1_ONLL0_PGR2_PLR1_PKA0_SIA3_SS0_SU32_SUM1_SUS256_SPO0_SRVW0_SSO0_SVW8_SK0_SKXCCM0_TLDS0_ULSGRO0_USL1_UIOFGRO0_USFGROn1_VSn1_VWA1_VWB8_WSGRA0_WSGRB0_WS32_WG64_2_1_WGM8_WGMXCC1_WGMXCCGn1
    SolutionIndex: 334
    SolutionNameMin: Cijk_Ailk_Bjlk_I8BH_SHB_HA_S_SCD_SAV_UserArgs_MT64x128x32_MI16x16x1_SN_LDSB1_AFC1_AFEM1_AFEM1_ASEM1_CLR1_CADS0_DTLA0_DTLB0_DTVA0_DTVB0_EPS0_FDSI0_GRPM1_GRVWA16_GRVWB8_GSU1_GSUAMB_GSUC0_GSUWGMRR0_GLS0_ISA1201_IU2_K1_LBSPPA512_LBSPPB1024_LBSPPM0_LPA16_LPB0_LPM0_LRVW8_LWPMn1_MIAV1_MIWT1_8_MO40_NTn1_NTA0_NTB0_NTC0_NTD0_NTM0_NEPBS0_NLCA1_NLCB1_ONLL0_PGR2_PLR1_PKA0_SIA2_SS0_SU32_SUM1_SUS256_SPO0_SRVW0_SSO0_SVW8_SK0_SKXCCM0_TLDS0_ULSGRO1_USL1_UIOFGRO0_USFGROn1_VSn1_VWA1_VWB8_WSGRA0_WSGRB0_WS32_WG64_2_1_WGM8_WGMXCC1_WGMXCCGn1
    SolutionIndex: 347
    SolutionNameMin: Cijk_Ailk_Bjlk_I8BH_SHB_HA_S_SCD_SAV_UserArgs_MT64x128x16_MI16x16x1_SN_LDSB0_AFC1_AFEM1_AFEM1_ASEM1_CLR0_CADS0_DTLA0_DTLB0_DTVA0_DTVB0_EPS0_FDSI0_GRPM1_GRVWA1_GRVWB1_GSU1_GSUAMB_GSUC0_GSUWGMRR0_GLS0_ISA1201_IU1_K1_LBSPPA512_LBSPPB1024_LBSPPM0_LPA16_LPB0_LPM0_LRVW8_LWPMn1_MIAV1_MIWT1_8_MO40_NTn1_NTA0_NTB0_NTC0_NTD0_NTM0_NEPBS0_NLCA1_NLCB1_ONLL0_PGR2_PLR0_PKA0_SIA3_SS0_SU32_SUM1_SUS256_SPO0_SRVW0_SSO0_SVW8_SK0_SKXCCM0_TLDS0_ULSGRO1_USL1_UIOFGRO0_USFGROn1_VSn1_VWA1_VWB8_WSGRA0_WSGRB0_WS32_WG64_2_1_WGM8_WGMXCC1_WGMXCCGn1
    SolutionIndex: 351
    SolutionNameMin: Cijk_Ailk_Bjlk_I8BH_SHB_HA_S_SCD_SAV_UserArgs_MT64x128x32_MI16x16x1_SN_LDSB1_AFC1_AFEM1_AFEM1_ASEM1_CLR1_CADS0_DTLA0_DTLB0_DTVA0_DTVB0_EPS0_FDSI0_GRPM1_GRVWA4_GRVWB8_GSU1_GSUAMB_GSUC0_GSUWGMRR0_GLS0_ISA1201_IU2_K1_LBSPPA512_LBSPPB1024_LBSPPM0_LPA16_LPB0_LPM0_LRVW8_LWPMn1_MIAV1_MIWT1_8_MO40_NTn1_NTA0_NTB0_NTC0_NTD0_NTM0_NEPBS0_NLCA1_NLCB1_ONLL0_PGR2_PLR1_PKA0_SIA2_SS0_SU32_SUM1_SUS256_SPO0_SRVW0_SSO0_SVW8_SK0_SKXCCM0_TLDS0_ULSGRO0_USL1_UIOFGRO0_USFGROn1_VSn1_VWA1_VWB8_WSGRA0_WSGRB0_WS32_WG64_2_1_WGM8_WGMXCC1_WGMXCCGn1
    SolutionIndex: 353
    SolutionNameMin: Cijk_Ailk_Bjlk_I8BH_SHB_HA_S_SCD_SAV_UserArgs_MT64x128x16_MI16x16x1_SN_LDSB1_AFC1_AFEM1_AFEM1_ASEM1_CLR1_CADS0_DTLA0_DTLB0_DTVA0_DTVB0_EPS0_FDSI0_GRPM1_GRVWA1_GRVWB1_GSU1_GSUAMB_GSUC0_GSUWGMRR0_GLS0_ISA1201_IU1_K1_LBSPPA512_LBSPPB1024_LBSPPM0_LPA16_LPB0_LPM0_LRVW8_LWPMn1_MIAV1_MIWT1_8_MO40_NTn1_NTA0_NTB0_NTC0_NTD0_NTM0_NEPBS0_NLCA1_NLCB1_ONLL0_PGR2_PLR1_PKA0_SIA2_SS0_SU32_SUM1_SUS256_SPO0_SRVW0_SSO0_SVW8_SK0_SKXCCM0_TLDS0_ULSGRO1_USL1_UIOFGRO0_USFGROn1_VSn1_VWA1_VWB8_WSGRA0_WSGRB0_WS32_WG64_2_1_WGM8_WGMXCC1_WGMXCCGn1
    SolutionIndex: 367
    SolutionNameMin: Cijk_Ailk_Bjlk_I8BH_SHB_HA_S_SCD_SAV_UserArgs_MT32x32x32_MI16x16x1_SN_LDSB1_AFC1_AFEM1_AFEM1_ASEM1_CLR1_CADS0_DTLA0_DTLB0_DTVA0_DTVB0_EPS1_FDSI0_GRPM1_GRVWA4_GRVWB1_GSU1_GSUAMB_GSUC0_GSUWGMRR0_GLS0_ISA1201_IU2_K1_LBSPPA256_LBSPPB256_LBSPPM0_LPA16_LPB16_LPM0_LRVW8_LWPMn1_MIAV1_MIWT1_1_MO40_NTn1_NTA0_NTB0_NTC0_NTD0_NTM0_NEPBS0_NLCA1_NLCB1_ONLL0_PGR1_PLR1_PKA0_SIA2_SS1_SU32_SUM1_SUS256_SPO0_SRVW0_SSO0_SVW1_SK0_SKXCCM0_TLDS0_ULSGRO0_USL1_UIOFGRO0_USFGROn1_VSn1_VWA1_VWB1_WSGRA0_WSGRB0_WS32_WG32_4_1_WGM8_WGMXCC1_WGMXCCGn1
    SolutionIndex: 368
    SolutionNameMin: Cijk_Ailk_Bjlk_I8BH_SHB_HA_S_SCD_SAV_UserArgs_MT32x16x32_MI16x16x1_SN_LDSB0_AFC1_AFEM1_AFEM1_ASEM1_CLR1_CADS0_DTLA0_DTLB0_DTVA0_DTVB0_EPS0_FDSI0_GRPM1_GRVWA4_GRVWB1_GSU1_GSUAMB_GSUC0_GSUWGMRR0_GLS0_ISA1201_IU1_K1_LBSPPA256_LBSPPB128_LBSPPM0_LPA16_LPB16_LPM0_LRVW8_LWPMn1_MIAV1_MIWT1_1_MO40_NTn1_NTA0_NTB0_NTC0_NTD0_NTM0_NEPBS0_NLCA1_NLCB1_ONLL0_PGR2_PLR1_PKA0_SIA3_SS0_SU32_SUM1_SUS256_SPO0_SRVW0_SSO0_SVW8_SK0_SKXCCM0_TLDS0_ULSGRO1_USL1_UIOFGRO0_USFGROn1_VSn1_VWA1_VWB1_WSGRA0_WSGRB0_WS32_WG32_2_1_WGM8_WGMXCC1_WGMXCCGn1
    SolutionIndex: 369
    SolutionNameMin: Cijk_Ailk_Bjlk_I8BH_SHB_HA_S_SCD_SAV_UserArgs_MT64x64x64_MI16x16x1_SN_LDSB1_AFC1_AFEM1_AFEM1_ASEM1_CLR1_CADS0_DTLA0_DTLB0_DTVA0_DTVB0_EPS1_FDSI0_GRPM1_GRVWA8_GRVWB8_GSU1_GSUAMB_GSUC0_GSUWGMRR0_GLS0_ISA1201_IU4_K1_LBSPPA512_LBSPPB512_LBSPPM0_LPA32_LPB32_LPM0_LRVW8_LWPMn1_MIAV1_MIWT2_2_MO40_NTn1_NTA0_NTB0_NTC0_NTD0_NTM0_NEPBS0_NLCA1_NLCB1_ONLL0_PGR1_PLR1_PKA0_SIA2_SS1_SU32_SUM1_SUS256_SPO0_SRVW0_SSO0_SVW2_SK0_SKXCCM0_TLDS0_ULSGRO0_USL1_UIOFGRO0_USFGROn1_VSn1_VWA2_VWB2_WSGRA0_WSGRB0_WS32_WG32_4_1_WGM8_WGMXCC1_WGMXCCGn1
    SolutionIndex: 371
    SolutionNameMin: Cijk_Ailk_Bjlk_I8BH_SHB_HA_S_SCD_SAV_UserArgs_MT32x128x64_MI16x16x1_SN_LDSB0_AFC1_AFEM1_AFEM1_ASEM1_CLR1_CADS0_DTLA0_DTLB0_DTVA0_DTVB0_EPS1_FDSI0_GRPM1_GRVWA4_GRVWB16_GSU1_GSUAMB_GSUC0_GSUWGMRR0_GLS0_ISA1201_IU1_K1_LBSPPA256_LBSPPB1024_LBSPPM0_LPA16_LPB64_LPM0_LRVW8_LWPMn1_MIAV1_MIWT1_4_MO40_NTn1_NTA0_NTB0_NTC0_NTD0_NTM0_NEPBS0_NLCA1_NLCB1_ONLL0_PGR1_PLR1_PKA0_SIA3_SS0_SU32_SUM1_SUS256_SPO0_SRVW0_SSO0_SVW8_SK0_SKXCCM0_TLDS0_ULSGRO0_USL1_UIOFGRO0_USFGROn1_VSn1_VWA1_VWB4_WSGRA0_WSGRB0_WS32_WG32_4_1_WGM8_WGMXCC1_WGMXCCGn1
    SolutionIndex: 374
    SolutionNameMin: Cijk_Ailk_Bjlk_I8BH_SHB_HA_S_SCD_SAV_UserArgs_MT32x128x64_MI16x16x1_SN_LDSB0_AFC1_AFEM1_AFEM1_ASEM1_CLR1_CADS0_DTLA0_DTLB0_DTVA0_DTVB0_EPS0_FDSI0_GRPM1_GRVWA16_GRVWB8_GSU1_GSUAMB_GSUC0_GSUWGMRR0_GLS0_ISA1201_IU1_K1_LBSPPA256_LBSPPB1024_LBSPPM0_LPA16_LPB64_LPM0_LRVW8_LWPMn1_MIAV1_MIWT1_4_MO40_NTn1_NTA0_NTB0_NTC0_NTD0_NTM0_NEPBS0_NLCA1_NLCB1_ONLL0_PGR2_PLR1_PKA0_SIA3_SS0_SU32_SUM1_SUS256_SPO0_SRVW0_SSO0_SVW8_SK0_SKXCCM0_TLDS0_ULSGRO0_USL1_UIOFGRO0_USFGROn1_VSn1_VWA1_VWB4_WSGRA0_WSGRB0_WS32_WG32_4_1_WGM8_WGMXCC1_WGMXCCGn1
    SolutionIndex: 375
    SolutionNameMin: Cijk_Ailk_Bjlk_I8BH_SHB_HA_S_SCD_SAV_UserArgs_MT64x64x32_MI16x16x1_SN_LDSB0_AFC1_AFEM1_AFEM1_ASEM1_CLR1_CADS0_DTLA0_DTLB0_DTVA0_DTVB1_EPS0_FDSI0_GRPM1_GRVWA1_GRVWB8_GSU1_GSUAMB_GSUC0_GSUWGMRR0_GLS0_ISA1201_IU1_K1_LBSPPA512_LBSPPB0_LBSPPM0_LPA32_LPB0_LPM0_LRVW8_LWPMn1_MIAV1_MIWT2_2_MO40_NTn1_NTA0_NTB0_NTC0_NTD0_NTM0_NEPBS0_NLCA1_NLCB2_ONLL0_PGR2_PLR1_PKA0_SIA3_SS0_SU32_SUM1_SUS256_SPO0_SRVW0_SSO0_SVW16_SK0_SKXCCM0_TLDS0_ULSGRO0_USL1_UIOFGRO0_USFGROn1_VSn1_VWA2_VWB1_WSGRA0_WSGRB0_WS32_WG32_4_1_WGM8_WGMXCC1_WGMXCCGn1
    SolutionIndex: 380
    SolutionNameMin: Cijk_Ailk_Bjlk_I8BH_SHB_HA_S_SCD_SAV_UserArgs_MT32x128x32_MI16x16x1_SN_LDSB1_AFC1_AFEM1_AFEM1_ASEM1_CLR1_CADS0_DTLA0_DTLB0_DTVA0_DTVB0_EPS1_FDSI0_GRPM1_GRVWA1_GRVWB4_GSU1_GSUAMB_GSUC0_GSUWGMRR0_GLS0_ISA1201_IU2_K1_LBSPPA256_LBSPPB1024_LBSPPM0_LPA16_LPB64_LPM0_LRVW8_LWPMn1_MIAV1_MIWT1_4_MO40_NTn1_NTA0_NTB0_NTC0_NTD0_NTM0_NEPBS0_NLCA1_NLCB1_ONLL0_PGR1_PLR1_PKA0_SIA2_SS0_SU32_SUM1_SUS256_SPO0_SRVW0_SSO0_SVW8_SK0_SKXCCM0_TLDS0_ULSGRO0_USL1_UIOFGRO0_USFGROn1_VSn1_VWA1_VWB4_WSGRA0_WSGRB0_WS32_WG32_4_1_WGM8_WGMXCC1_WGMXCCGn1
    SolutionIndex: 381
    SolutionNameMin: Cijk_Ailk_Bjlk_I8BH_SHB_HA_S_SCD_SAV_UserArgs_MT32x128x64_MI16x16x1_SN_LDSB0_AFC1_AFEM1_AFEM1_ASEM1_CLR1_CADS0_DTLA0_DTLB0_DTVA0_DTVB0_EPS0_FDSI0_GRPM1_GRVWA16_GRVWB8_GSU1_GSUAMB_GSUC0_GSUWGMRR0_GLS0_ISA1201_IU1_K1_LBSPPA256_LBSPPB1024_LBSPPM0_LPA16_LPB64_LPM0_LRVW8_LWPMn1_MIAV1_MIWT1_4_MO40_NTn1_NTA0_NTB0_NTC0_NTD0_NTM0_NEPBS0_NLCA1_NLCB1_ONLL0_PGR2_PLR1_PKA0_SIA3_SS0_SU32_SUM1_SUS256_SPO0_SRVW0_SSO0_SVW8_SK0_SKXCCM0_TLDS0_ULSGRO1_USL1_UIOFGRO0_USFGROn1_VSn1_VWA1_VWB4_WSGRA0_WSGRB0_WS32_WG32_4_1_WGM8_WGMXCC1_WGMXCCGn1
    SolutionIndex: 390
    SolutionNameMin: Cijk_Ailk_Bjlk_I8BH_SHB_HA_S_SCD_SAV_UserArgs_MT32x32x128_MI16x16x1_SN_LDSB0_AFC1_AFEM1_AFEM1_ASEM1_CLR1_CADS0_DTLA0_DTLB0_DTVA1_DTVB0_EPS1_FDSI0_GRPM1_GRVWA8_GRVWB4_GSU1_GSUAMB_GSUC0_GSUWGMRR0_GLS0_ISA1201_IU1_K1_LBSPPA0_LBSPPB256_LBSPPM0_LPA0_LPB16_LPM0_LRVW8_LWPMn1_MIAV1_MIWT1_1_MO40_NTn1_NTA0_NTB0_NTC0_NTD0_NTM0_NEPBS0_NLCA1_NLCB1_ONLL0_PGR1_PLR1_PKA0_SIA3_SS1_SU32_SUM1_SUS256_SPO0_SRVW0_SSO0_SVW1_SK0_SKXCCM0_TLDS0_ULSGRO0_USL1_UIOFGRO0_USFGROn1_VSn1_VWA1_VWB1_WSGRA0_WSGRB0_WS32_WG32_4_1_WGM8_WGMXCC1_WGMXCCGn1
- - - [64, 64, 1, 64]
    - [367, 0.03]
  - - [128, 64, 1, 64]
    - [44, 0.05]
  - - [192, 64, 1, 64]
    - [118, 0.07]
  - - [256, 64, 1, 64]
    - [10, 0.1]
  - - [320, 64, 1, 64]
    - [47, 0.13]
  - - [384, 64, 1, 64]
    - [47, 0.16]
  - - [448, 64, 1, 64]
    - [118, 0.18]
  - - [512, 64, 1, 64]
    - [128, 0.21]
  - - [576, 64, 1, 64]
    - [368, 0.22]
  - - [640, 64, 1, 64]
    - [46, 0.25]
  - - [704, 64, 1, 64]
    - [241, 0.27]
  - - [768, 64, 1, 64]
    - [131, 0.3]
  - - [832, 64, 1, 64]
    - [126, 0.32]
  - - [896, 64, 1, 64]
    - [215, 0.34]
  - - [960, 64, 1, 64]
    - [118, 0.35]
  - - [1024, 64, 1, 64]
    - [119, 0.39]
  - - [64, 128, 1, 64]
    - [213, 0.05]
  - - [128, 128, 1, 64]
    - [119, 0.1]
  - - [192, 128, 1, 64]
    - [127, 0.16]
  - - [256, 128, 1, 64]
    - [127, 0.21]
  - - [320, 128, 1, 64]
    - [8, 0.25]
  - - [384, 128, 1, 64]
    - [127, 0.3]
  - - [448, 128, 1, 64]
    - [50, 0.35]
  - - [512, 128, 1, 64]
    - [45, 0.39]
  - - [576, 128, 1, 64]
    - [153, 0.43]
  - - [640, 128, 1, 64]
    - [43, 0.48]
  - - [704, 128, 1, 64]
    - [117, 0.54]
  - - [768, 128, 1, 64]
    - [43, 0.57]
  - - [832, 128, 1, 64]
    - [35, 0.63]
  - - [896, 128, 1, 64]
    - [141, 0.67]
  - - [960, 128, 1, 64]
    - [98, 0.73]
  - - [1024, 128, 1, 64]
    - [141, 0.78]
  - - [64, 192, 1, 64]
    - [243, 0.07]
  - - [128, 192, 1, 64]
    - [130, 0.16]
  - - [192, 192, 1, 64]
    - [118, 0.23]
  - - [256, 192, 1, 64]
    - [118, 0.3]
  - - [320, 192, 1, 64]
    - [130, 0.37]
  - - [384, 192, 1, 64]
    - [101, 0.44]
  - - [448, 192, 1, 64]
    - [98, 0.5]
  - - [512, 192, 1, 64]
    - [153, 0.58]
  - - [576, 192, 1, 64]
    - [117, 0.62]
  - - [640, 192, 1, 64]
    - [98, 0.73]
  - - [704, 192, 1, 64]
    - [244, 0.76]
  - - [768, 192, 1, 64]
    - [65, 0.84]
  - - [832, 192, 1, 64]
    - [99, 0.89]
  - - [896, 192, 1, 64]
    - [141, 0.96]
  - - [960, 192, 1, 64]
    - [6, 1.0]
  - - [1024, 192, 1, 64]
    - [101, 1.07]
  - - [64, 256, 1, 64]
    - [54, 0.1]
  - - [128, 256, 1, 64]
    - [127, 0.2]
  - - [192, 256, 1, 64]
    - [126, 0.3]
  - - [256, 256, 1, 64]
    - [118, 0.38]
  - - [320, 256, 1, 64]
    - [78, 0.48]
  - - [384, 256, 1, 64]
    - [117, 0.56]
  - - [448, 256, 1, 64]
    - [104, 0.65]
  - - [512, 256, 1, 64]
    - [103, 0.77]
  - - [576, 256, 1, 64]
    - [43, 0.81]
  - - [640, 256, 1, 64]
    - [78, 0.92]
  - - [704, 256, 1, 64]
    - [6, 0.99]
  - - [768, 256, 1, 64]
    - [117, 1.09]
  - - [832, 256, 1, 64]
    - [117, 1.17]
  - - [896, 256, 1, 64]
    - [204, 1.23]
  - - [960, 256, 1, 64]
    - [153, 1.36]
  - - [1024, 256, 1, 64]
    - [43, 1.43]
  - - [64, 320, 1, 64]
    - [127, 0.13]
  - - [128, 320, 1, 64]
    - [120, 0.25]
  - - [192, 320, 1, 64]
    - [130, 0.36]
  - - [256, 320, 1, 64]
    - [105, 0.48]
  - - [320, 320, 1, 64]
    - [153, 0.59]
  - - [384, 320, 1, 64]
    - [97, 0.73]
  - - [448, 320, 1, 64]
    - [33, 0.82]
  - - [512, 320, 1, 64]
    - [117, 0.89]
  - - [576, 320, 1, 64]
    - [117, 0.96]
  - - [640, 320, 1, 64]
    - [117, 1.11]
  - - [704, 320, 1, 64]
    - [117, 1.23]
  - - [768, 320, 1, 64]
    - [141, 1.35]
  - - [832, 320, 1, 64]
    - [115, 1.41]
  - - [896, 320, 1, 64]
    - [6, 1.49]
  - - [960, 320, 1, 64]
    - [104, 1.49]
  - - [1024, 320, 1, 64]
    - [43, 1.66]
  - - [64, 384, 1, 64]
    - [51, 0.16]
  - - [128, 384, 1, 64]
    - [52, 0.3]
  - - [192, 384, 1, 64]
    - [97, 0.44]
  - - [256, 384, 1, 64]
    - [97, 0.58]
  - - [320, 384, 1, 64]
    - [117, 0.73]
  - - [384, 384, 1, 64]
    - [81, 0.83]
  - - [448, 384, 1, 64]
    - [41, 0.94]
  - - [512, 384, 1, 64]
    - [153, 1.08]
  - - [576, 384, 1, 64]
    - [153, 1.23]
  - - [640, 384, 1, 64]
    - [64, 1.35]
  - - [704, 384, 1, 64]
    - [38, 1.44]
  - - [768, 384, 1, 64]
    - [69, 1.55]
  - - [832, 384, 1, 64]
    - [82, 1.59]
  - - [896, 384, 1, 64]
    - [35, 1.72]
  - - [960, 384, 1, 64]
    - [43, 1.86]
  - - [1024, 384, 1, 64]
    - [43, 1.96]
  - - [64, 448, 1, 64]
    - [120, 0.17]
  - - [128, 448, 1, 64]
    - [9, 0.34]
  - - [192, 448, 1, 64]
    - [246, 0.48]
  - - [256, 448, 1, 64]
    - [117, 0.68]
  - - [320, 448, 1, 64]
    - [246, 0.78]
  - - [384, 448, 1, 64]
    - [117, 0.93]
  - - [448, 448, 1, 64]
    - [249, 1.04]
  - - [512, 448, 1, 64]
    - [117, 1.27]
  - - [576, 448, 1, 64]
    - [36, 1.37]
  - - [640, 448, 1, 64]
    - [66, 1.48]
  - - [704, 448, 1, 64]
    - [35, 1.52]
  - - [768, 448, 1, 64]
    - [69, 1.71]
  - - [832, 448, 1, 64]
    - [43, 1.78]
  - - [896, 448, 1, 64]
    - [3, 1.95]
  - - [960, 448, 1, 64]
    - [75, 1.97]
  - - [1024, 448, 1, 64]
    - [11, 2.24]
  - - [64, 512, 1, 64]
    - [118, 0.2]
  - - [128, 512, 1, 64]
    - [214, 0.39]
  - - [192, 512, 1, 64]
    - [98, 0.58]
  - - [256, 512, 1, 64]
    - [102, 0.77]
  - - [320, 512, 1, 64]
    - [4, 0.9]
  - - [384, 512, 1, 64]
    - [111, 1.03]
  - - [448, 512, 1, 64]
    - [43, 1.23]
  - - [512, 512, 1, 64]
    - [112, 1.42]
  - - [576, 512, 1, 64]
    - [193, 1.48]
  - - [640, 512, 1, 64]
    - [72, 1.68]
  - - [704, 512, 1, 64]
    - [14, 1.82]
  - - [768, 512, 1, 64]
    - [43, 1.97]
  - - [832, 512, 1, 64]
    - [73, 2.07]
  - - [896, 512, 1, 64]
    - [11, 2.24]
  - - [960, 512, 1, 64]
    - [15, 2.33]
  - - [1024, 512, 1, 64]
    - [70, 2.53]
  - - [64, 576, 1, 64]
    - [118, 0.22]
  - - [128, 576, 1, 64]
    - [117, 0.44]
  - - [192, 576, 1, 64]
    - [104, 0.62]
  - - [256, 576, 1, 64]
    - [218, 0.82]
  - - [320, 576, 1, 64]
    - [104, 0.97]
  - - [384, 576, 1, 64]
    - [117, 1.24]
  - - [448, 576, 1, 64]
    - [252, 1.37]
  - - [512, 576, 1, 64]
    - [34, 1.49]
  - - [576, 576, 1, 64]
    - [153, 1.59]
  - - [640, 576, 1, 64]
    - [43, 1.88]
  - - [704, 576, 1, 64]
    - [253, 1.91]
  - - [768, 576, 1, 64]
    - [89, 2.14]
  - - [832, 576, 1, 64]
    - [89, 2.17]
  - - [896, 576, 1, 64]
    - [11, 2.5]
  - - [960, 576, 1, 64]
    - [117, 2.31]
  - - [1024, 576, 1, 64]
    - [63, 2.61]
  - - [64, 640, 1, 64]
    - [7, 0.24]
  - - [128, 640, 1, 64]
    - [100, 0.46]
  - - [192, 640, 1, 64]
    - [143, 0.72]
  - - [256, 640, 1, 64]
    - [138, 0.91]
  - - [320, 640, 1, 64]
    - [43, 1.13]
  - - [384, 640, 1, 64]
    - [69, 1.36]
  - - [448, 640, 1, 64]
    - [43, 1.49]
  - - [512, 640, 1, 64]
    - [57, 1.67]
  - - [576, 640, 1, 64]
    - [43, 1.86]
  - - [640, 640, 1, 64]
    - [0, 1.95]
  - - [704, 640, 1, 64]
    - [15, 2.08]
  - - [768, 640, 1, 64]
    - [216, 2.31]
  - - [832, 640, 1, 64]
    - [154, 2.54]
  - - [896, 640, 1, 64]
    - [15, 2.59]
  - - [960, 640, 1, 64]
    - [6, 2.6]
  - - [1024, 640, 1, 64]
    - [31, 2.88]
  - - [64, 704, 1, 64]
    - [55, 0.26]
  - - [128, 704, 1, 64]
    - [97, 0.53]
  - - [192, 704, 1, 64]
    - [117, 0.78]
  - - [256, 704, 1, 64]
    - [138, 0.95]
  - - [320, 704, 1, 64]
    - [117, 1.23]
  - - [384, 704, 1, 64]
    - [12, 1.47]
  - - [448, 704, 1, 64]
    - [35, 1.58]
  - - [512, 704, 1, 64]
    - [81, 1.79]
  - - [576, 704, 1, 64]
    - [35, 1.97]
  - - [640, 704, 1, 64]
    - [63, 2.1]
  - - [704, 704, 1, 64]
    - [83, 2.23]
  - - [768, 704, 1, 64]
    - [217, 2.42]
  - - [832, 704, 1, 64]
    - [254, 2.43]
  - - [896, 704, 1, 64]
    - [223, 2.76]
  - - [960, 704, 1, 64]
    - [95, 2.84]
  - - [1024, 704, 1, 64]
    - [222, 3.05]
  - - [64, 768, 1, 64]
    - [53, 0.29]
  - - [128, 768, 1, 64]
    - [219, 0.57]
  - - [192, 768, 1, 64]
    - [36, 0.84]
  - - [256, 768, 1, 64]
    - [202, 1.05]
  - - [320, 768, 1, 64]
    - [142, 1.33]
  - - [384, 768, 1, 64]
    - [43, 1.54]
  - - [448, 768, 1, 64]
    - [2, 1.67]
  - - [512, 768, 1, 64]
    - [32, 1.89]
  - - [576, 768, 1, 64]
    - [96, 2.14]
  - - [640, 768, 1, 64]
    - [11, 2.37]
  - - [704, 768, 1, 64]
    - [83, 2.59]
  - - [768, 768, 1, 64]
    - [89, 2.53]
  - - [832, 768, 1, 64]
    - [144, 2.67]
  - - [896, 768, 1, 64]
    - [11, 2.85]
  - - [960, 768, 1, 64]
    - [96, 3.17]
  - - [1024, 768, 1, 64]
    - [96, 3.38]
  - - [64, 832, 1, 64]
    - [47, 0.32]
  - - [128, 832, 1, 64]
    - [117, 0.64]
  - - [192, 832, 1, 64]
    - [117, 0.89]
  - - [256, 832, 1, 64]
    - [77, 1.17]
  - - [320, 832, 1, 64]
    - [117, 1.38]
  - - [384, 832, 1, 64]
    - [43, 1.61]
  - - [448, 832, 1, 64]
    - [43, 1.76]
  - - [512, 832, 1, 64]
    - [15, 2.02]
  - - [576, 832, 1, 64]
    - [154, 2.17]
  - - [640, 832, 1, 64]
    - [191, 2.4]
  - - [704, 832, 1, 64]
    - [257, 2.51]
  - - [768, 832, 1, 64]
    - [221, 2.78]
  - - [832, 832, 1, 64]
    - [89, 2.95]
  - - [896, 832, 1, 64]
    - [190, 3.12]
  - - [960, 832, 1, 64]
    - [258, 3.26]
  - - [1024, 832, 1, 64]
    - [227, 3.48]
  - - [64, 896, 1, 64]
    - [130, 0.35]
  - - [128, 896, 1, 64]
    - [203, 0.66]
  - - [192, 896, 1, 64]
    - [117, 0.95]
  - - [256, 896, 1, 64]
    - [141, 1.25]
  - - [320, 896, 1, 64]
    - [81, 1.48]
  - - [384, 896, 1, 64]
    - [117, 1.71]
  - - [448, 896, 1, 64]
    - [43, 1.96]
  - - [512, 896, 1, 64]
    - [89, 2.24]
  - - [576, 896, 1, 64]
    - [83, 2.46]
  - - [640, 896, 1, 64]
    - [63, 2.59]
  - - [704, 896, 1, 64]
    - [89, 2.69]
  - - [768, 896, 1, 64]
    - [92, 2.86]
  - - [832, 896, 1, 64]
    - [15, 3.16]
  - - [896, 896, 1, 64]
    - [201, 3.27]
  - - [960, 896, 1, 64]
    - [116, 3.41]
  - - [1024, 896, 1, 64]
    - [116, 3.68]
  - - [64, 960, 1, 64]
    - [130, 0.37]
  - - [128, 960, 1, 64]
    - [117, 0.74]
  - - [192, 960, 1, 64]
    - [117, 0.98]
  - - [256, 960, 1, 64]
    - [33, 1.34]
  - - [320, 960, 1, 64]
    - [76, 1.52]
  - - [384, 960, 1, 64]
    - [43, 1.85]
  - - [448, 960, 1, 64]
    - [76, 1.96]
  - - [512, 960, 1, 64]
    - [89, 2.36]
  - - [576, 960, 1, 64]
    - [85, 2.44]
  - - [640, 960, 1, 64]
    - [220, 2.68]
  - - [704, 960, 1, 64]
    - [87, 2.82]
  - - [768, 960, 1, 64]
    - [63, 3.14]
  - - [832, 960, 1, 64]
    - [37, 3.17]
  - - [896, 960, 1, 64]
    - [113, 3.52]
  - - [960, 960, 1, 64]
    - [115, 3.78]
  - - [1024, 960, 1, 64]
    - [31, 3.77]
  - - [64, 1024, 1, 64]
    - [51, 0.4]
  - - [128, 1024, 1, 64]
    - [99, 0.77]
  - - [192, 1024, 1, 64]
    - [6, 1.06]
  - - [256, 1024, 1, 64]
    - [65, 1.42]
  - - [320, 1024, 1, 64]
    - [43, 1.66]
  - - [384, 1024, 1, 64]
    - [5, 1.91]
  - - [448, 1024, 1, 64]
    - [72, 2.24]
  - - [512, 1024, 1, 64]
    - [96, 2.52]
  - - [576, 1024, 1, 64]
    - [15, 2.62]
  - - [640, 1024, 1, 64]
    - [145, 2.84]
  - - [704, 1024, 1, 64]
    - [76, 2.99]
  - - [768, 1024, 1, 64]
    - [95, 3.26]
  - - [832, 1024, 1, 64]
    - [115, 3.4]
  - - [896, 1024, 1, 64]
    - [226, 3.68]
  - - [960, 1024, 1, 64]
    - [11, 3.73]
  - - [1024, 1024, 1, 64]
    - [31, 4.0]
  - - [64, 64, 1, 256]
    - [177, 0.09]
  - - [128, 64, 1, 256]
    - [185, 0.19]
  - - [192, 64, 1, 256]
    - [180, 0.29]
  - - [256, 64, 1, 256]
    - [181, 0.38]
  - - [320, 64, 1, 256]
    - [182, 0.46]
  - - [384, 64, 1, 256]
    - [185, 0.57]
  - - [448, 64, 1, 256]
    - [179, 0.62]
  - - [512, 64, 1, 256]
    - [179, 0.73]
  - - [576, 64, 1, 256]
    - [130, 0.79]
  - - [640, 64, 1, 256]
    - [176, 0.92]
  - - [704, 64, 1, 256]
    - [126, 0.97]
  - - [768, 64, 1, 256]
    - [180, 1.08]
  - - [832, 64, 1, 256]
    - [215, 1.15]
  - - [896, 64, 1, 256]
    - [185, 1.25]
  - - [960, 64, 1, 256]
    - [213, 1.32]
  - - [1024, 64, 1, 256]
    - [176, 1.39]
  - - [64, 128, 1, 256]
    - [167, 0.19]
  - - [128, 128, 1, 256]
    - [165, 0.38]
  - - [192, 128, 1, 256]
    - [235, 0.56]
  - - [256, 128, 1, 256]
    - [167, 0.76]
  - - [320, 128, 1, 256]
    - [166, 0.88]
  - - [384, 128, 1, 256]
    - [178, 1.04]
  - - [448, 128, 1, 256]
    - [178, 1.21]
  - - [512, 128, 1, 256]
    - [182, 1.36]
  - - [576, 128, 1, 256]
    - [130, 1.48]
  - - [640, 128, 1, 256]
    - [149, 1.67]
  - - [704, 128, 1, 256]
    - [147, 1.86]
  - - [768, 128, 1, 256]
    - [135, 2.0]
  - - [832, 128, 1, 256]
    - [207, 2.18]
  - - [896, 128, 1, 256]
    - [148, 2.46]
  - - [960, 128, 1, 256]
    - [79, 2.5]
  - - [1024, 128, 1, 256]
    - [134, 2.77]
  - - [64, 192, 1, 256]
    - [171, 0.29]
  - - [128, 192, 1, 256]
    - [129, 0.56]
  - - [192, 192, 1, 256]
    - [165, 0.83]
  - - [256, 192, 1, 256]
    - [48, 1.03]
  - - [320, 192, 1, 256]
    - [215, 1.31]
  - - [384, 192, 1, 256]
    - [148, 1.56]
  - - [448, 192, 1, 256]
    - [147, 1.81]
  - - [512, 192, 1, 256]
    - [136, 2.07]
  - - [576, 192, 1, 256]
    - [111, 2.21]
  - - [640, 192, 1, 256]
    - [136, 2.6]
  - - [704, 192, 1, 256]
    - [112, 2.77]
  - - [768, 192, 1, 256]
    - [112, 2.79]
  - - [832, 192, 1, 256]
    - [113, 3.13]
  - - [896, 192, 1, 256]
    - [136, 3.29]
  - - [960, 192, 1, 256]
    - [287, 3.45]
  - - [1024, 192, 1, 256]
    - [135, 3.55]
  - - [64, 256, 1, 256]
    - [178, 0.39]
  - - [128, 256, 1, 256]
    - [167, 0.76]
  - - [192, 256, 1, 256]
    - [165, 1.08]
  - - [256, 256, 1, 256]
    - [211, 1.47]
  - - [320, 256, 1, 256]
    - [147, 1.74]
  - - [384, 256, 1, 256]
    - [134, 2.07]
  - - [448, 256, 1, 256]
    - [148, 2.31]
  - - [512, 256, 1, 256]
    - [147, 2.79]
  - - [576, 256, 1, 256]
    - [149, 2.81]
  - - [640, 256, 1, 256]
    - [69, 3.03]
  - - [704, 256, 1, 256]
    - [163, 3.36]
  - - [768, 256, 1, 256]
    - [117, 3.59]
  - - [832, 256, 1, 256]
    - [43, 4.05]
  - - [896, 256, 1, 256]
    - [43, 4.38]
  - - [960, 256, 1, 256]
    - [117, 4.62]
  - - [1024, 256, 1, 256]
    - [147, 5.01]
  - - [64, 320, 1, 256]
    - [181, 0.47]
  - - [128, 320, 1, 256]
    - [168, 0.91]
  - - [192, 320, 1, 256]
    - [168, 1.32]
  - - [256, 320, 1, 256]
    - [147, 1.65]
  - - [320, 320, 1, 256]
    - [43, 2.05]
  - - [384, 320, 1, 256]
    - [134, 2.58]
  - - [448, 320, 1, 256]
    - [112, 2.82]
  - - [512, 320, 1, 256]
    - [41, 3.11]
  - - [576, 320, 1, 256]
    - [113, 3.49]
  - - [640, 320, 1, 256]
    - [135, 3.9]
  - - [704, 320, 1, 256]
    - [113, 4.04]
  - - [768, 320, 1, 256]
    - [136, 4.68]
  - - [832, 320, 1, 256]
    - [6, 4.81]
  - - [896, 320, 1, 256]
    - [43, 4.92]
  - - [960, 320, 1, 256]
    - [43, 5.29]
  - - [1024, 320, 1, 256]
    - [134, 5.55]
  - - [64, 384, 1, 256]
    - [168, 0.57]
  - - [128, 384, 1, 256]
    - [130, 1.09]
  - - [192, 384, 1, 256]
    - [111, 1.58]
  - - [256, 384, 1, 256]
    - [113, 2.05]
  - - [320, 384, 1, 256]
    - [113, 2.47]
  - - [384, 384, 1, 256]
    - [240, 2.74]
  - - [448, 384, 1, 256]
    - [80, 3.24]
  - - [512, 384, 1, 256]
    - [147, 3.74]
  - - [576, 384, 1, 256]
    - [116, 4.18]
  - - [640, 384, 1, 256]
    - [136, 4.57]
  - - [704, 384, 1, 256]
    - [149, 4.76]
  - - [768, 384, 1, 256]
    - [134, 5.13]
  - - [832, 384, 1, 256]
    - [43, 5.57]
  - - [896, 384, 1, 256]
    - [6, 5.79]
  - - [960, 384, 1, 256]
    - [43, 6.34]
  - - [1024, 384, 1, 256]
    - [6, 6.46]
  - - [64, 448, 1, 256]
    - [165, 0.66]
  - - [128, 448, 1, 256]
    - [127, 1.27]
  - - [192, 448, 1, 256]
    - [111, 1.8]
  - - [256, 448, 1, 256]
    - [148, 2.42]
  - - [320, 448, 1, 256]
    - [108, 2.79]
  - - [384, 448, 1, 256]
    - [43, 3.27]
  - - [448, 448, 1, 256]
    - [111, 3.74]
  - - [512, 448, 1, 256]
    - [147, 4.35]
  - - [576, 448, 1, 256]
    - [6, 4.6]
  - - [640, 448, 1, 256]
    - [43, 5.15]
  - - [704, 448, 1, 256]
    - [43, 5.48]
  - - [768, 448, 1, 256]
    - [43, 5.9]
  - - [832, 448, 1, 256]
    - [43, 6.34]
  - - [896, 448, 1, 256]
    - [141, 6.63]
  - - [960, 448, 1, 256]
    - [18, 6.88]
  - - [1024, 448, 1, 256]
    - [18, 7.31]
  - - [64, 512, 1, 256]
    - [55, 0.74]
  - - [128, 512, 1, 256]
    - [182, 1.38]
  - - [192, 512, 1, 256]
    - [147, 2.0]
  - - [256, 512, 1, 256]
    - [136, 2.68]
  - - [320, 512, 1, 256]
    - [43, 3.14]
  - - [384, 512, 1, 256]
    - [43, 3.74]
  - - [448, 512, 1, 256]
    - [107, 4.26]
  - - [512, 512, 1, 256]
    - [111, 4.95]
  - - [576, 512, 1, 256]
    - [6, 5.15]
  - - [640, 512, 1, 256]
    - [69, 5.63]
  - - [704, 512, 1, 256]
    - [117, 6.0]
  - - [768, 512, 1, 256]
    - [117, 6.44]
  - - [832, 512, 1, 256]
    - [43, 6.64]
  - - [896, 512, 1, 256]
    - [11, 7.08]
  - - [960, 512, 1, 256]
    - [43, 7.61]
  - - [1024, 512, 1, 256]
    - [58, 8.21]
  - - [64, 576, 1, 256]
    - [177, 0.8]
  - - [128, 576, 1, 256]
    - [49, 1.53]
  - - [192, 576, 1, 256]
    - [147, 2.29]
  - - [256, 576, 1, 256]
    - [163, 2.83]
  - - [320, 576, 1, 256]
    - [43, 3.51]
  - - [384, 576, 1, 256]
    - [134, 4.24]
  - - [448, 576, 1, 256]
    - [116, 4.64]
  - - [512, 576, 1, 256]
    - [43, 5.18]
  - - [576, 576, 1, 256]
    - [6, 5.56]
  - - [640, 576, 1, 256]
    - [117, 6.41]
  - - [704, 576, 1, 256]
    - [43, 6.44]
  - - [768, 576, 1, 256]
    - [83, 7.01]
  - - [832, 576, 1, 256]
    - [15, 7.24]
  - - [896, 576, 1, 256]
    - [11, 8.11]
  - - [960, 576, 1, 256]
    - [43, 8.11]
  - - [1024, 576, 1, 256]
    - [56, 8.32]
  - - [64, 640, 1, 256]
    - [239, 0.91]
  - - [128, 640, 1, 256]
    - [215, 1.69]
  - - [192, 640, 1, 256]
    - [161, 2.52]
  - - [256, 640, 1, 256]
    - [135, 3.27]
  - - [320, 640, 1, 256]
    - [147, 3.95]
  - - [384, 640, 1, 256]
    - [134, 4.57]
  - - [448, 640, 1, 256]
    - [81, 5.21]
  - - [512, 640, 1, 256]
    - [43, 5.49]
  - - [576, 640, 1, 256]
    - [43, 6.37]
  - - [640, 640, 1, 256]
    - [43, 6.75]
  - - [704, 640, 1, 256]
    - [89, 7.16]
  - - [768, 640, 1, 256]
    - [89, 7.83]
  - - [832, 640, 1, 256]
    - [15, 8.27]
  - - [896, 640, 1, 256]
    - [25, 8.46]
  - - [960, 640, 1, 256]
    - [88, 8.45]
  - - [1024, 640, 1, 256]
    - [43, 9.07]
  - - [64, 704, 1, 256]
    - [176, 1.0]
  - - [128, 704, 1, 256]
    - [135, 1.83]
  - - [192, 704, 1, 256]
    - [111, 2.81]
  - - [256, 704, 1, 256]
    - [112, 3.29]
  - - [320, 704, 1, 256]
    - [43, 4.24]
  - - [384, 704, 1, 256]
    - [43, 5.08]
  - - [448, 704, 1, 256]
    - [43, 5.47]
  - - [512, 704, 1, 256]
    - [43, 6.09]
  - - [576, 704, 1, 256]
    - [6, 6.61]
  - - [640, 704, 1, 256]
    - [63, 7.21]
  - - [704, 704, 1, 256]
    - [85, 7.42]
  - - [768, 704, 1, 256]
    - [90, 8.18]
  - - [832, 704, 1, 256]
    - [117, 7.99]
  - - [896, 704, 1, 256]
    - [43, 8.59]
  - - [960, 704, 1, 256]
    - [6, 8.53]
  - - [1024, 704, 1, 256]
    - [96, 9.69]
  - - [64, 768, 1, 256]
    - [130, 1.1]
  - - [128, 768, 1, 256]
    - [112, 2.09]
  - - [192, 768, 1, 256]
    - [148, 2.9]
  - - [256, 768, 1, 256]
    - [209, 3.57]
  - - [320, 768, 1, 256]
    - [115, 4.53]
  - - [384, 768, 1, 256]
    - [117, 5.24]
  - - [448, 768, 1, 256]
    - [43, 5.97]
  - - [512, 768, 1, 256]
    - [43, 6.35]
  - - [576, 768, 1, 256]
    - [15, 7.05]
  - - [640, 768, 1, 256]
    - [11, 7.94]
  - - [704, 768, 1, 256]
    - [15, 8.4]
  - - [768, 768, 1, 256]
    - [89, 8.79]
  - - [832, 768, 1, 256]
    - [117, 8.62]
  - - [896, 768, 1, 256]
    - [18, 9.29]
  - - [960, 768, 1, 256]
    - [96, 9.63]
  - - [1024, 768, 1, 256]
    - [89, 10.63]
  - - [64, 832, 1, 256]
    - [180, 1.12]
  - - [128, 832, 1, 256]
    - [134, 2.18]
  - - [192, 832, 1, 256]
    - [147, 3.14]
  - - [256, 832, 1, 256]
    - [208, 3.89]
  - - [320, 832, 1, 256]
    - [43, 4.82]
  - - [384, 832, 1, 256]
    - [43, 5.39]
  - - [448, 832, 1, 256]
    - [6, 6.17]
  - - [512, 832, 1, 256]
    - [18, 6.84]
  - - [576, 832, 1, 256]
    - [15, 7.24]
  - - [640, 832, 1, 256]
    - [11, 8.31]
  - - [704, 832, 1, 256]
    - [43, 7.86]
  - - [768, 832, 1, 256]
    - [117, 8.71]
  - - [832, 832, 1, 256]
    - [15, 8.87]
  - - [896, 832, 1, 256]
    - [63, 10.16]
  - - [960, 832, 1, 256]
    - [112, 9.76]
  - - [1024, 832, 1, 256]
    - [115, 10.62]
  - - [64, 896, 1, 256]
    - [130, 1.26]
  - - [128, 896, 1, 256]
    - [135, 2.47]
  - - [192, 896, 1, 256]
    - [112, 3.36]
  - - [256, 896, 1, 256]
    - [136, 4.39]
  - - [320, 896, 1, 256]
    - [148, 5.11]
  - - [384, 896, 1, 256]
    - [43, 5.67]
  - - [448, 896, 1, 256]
    - [14, 6.45]
  - - [512, 896, 1, 256]
    - [15, 7.33]
  - - [576, 896, 1, 256]
    - [89, 8.15]
  - - [640, 896, 1, 256]
    - [25, 8.46]
  - - [704, 896, 1, 256]
    - [89, 8.57]
  - - [768, 896, 1, 256]
    - [89, 9.04]
  - - [832, 896, 1, 256]
    - [89, 10.03]
  - - [896, 896, 1, 256]
    - [61, 10.33]
  - - [960, 896, 1, 256]
    - [146, 10.97]
  - - [1024, 896, 1, 256]
    - [113, 11.33]
  - - [64, 960, 1, 256]
    - [127, 1.32]
  - - [128, 960, 1, 256]
    - [147, 2.6]
  - - [192, 960, 1, 256]
    - [147, 3.34]
  - - [256, 960, 1, 256]
    - [147, 4.69]
  - - [320, 960, 1, 256]
    - [43, 5.17]
  - - [384, 960, 1, 256]
    - [117, 6.17]
  - - [448, 960, 1, 256]
    - [43, 6.94]
  - - [512, 960, 1, 256]
    - [18, 7.9]
  - - [576, 960, 1, 256]
    - [89, 8.03]
  - - [640, 960, 1, 256]
    - [11, 8.66]
  - - [704, 960, 1, 256]
    - [6, 8.96]
  - - [768, 960, 1, 256]
    - [92, 9.63]
  - - [832, 960, 1, 256]
    - [146, 10.15]
  - - [896, 960, 1, 256]
    - [112, 11.03]
  - - [960, 960, 1, 256]
    - [112, 11.65]
  - - [1024, 960, 1, 256]
    - [111, 12.02]
  - - [64, 1024, 1, 256]
    - [176, 1.4]
  - - [128, 1024, 1, 256]
    - [147, 2.75]
  - - [192, 1024, 1, 256]
    - [112, 3.71]
  - - [256, 1024, 1, 256]
    - [113, 4.87]
  - - [320, 1024, 1, 256]
    - [43, 5.71]
  - - [384, 1024, 1, 256]
    - [43, 6.7]
  - - [448, 1024, 1, 256]
    - [154, 7.1]
  - - [512, 1024, 1, 256]
    - [94, 8.4]
  - - [576, 1024, 1, 256]
    - [13, 8.08]
  - - [640, 1024, 1, 256]
    - [43, 9.1]
  - - [704, 1024, 1, 256]
    - [18, 9.65]
  - - [768, 1024, 1, 256]
    - [132, 10.37]
  - - [832, 1024, 1, 256]
    - [146, 10.6]
  - - [896, 1024, 1, 256]
    - [112, 11.39]
  - - [960, 1024, 1, 256]
    - [150, 12.12]
  - - [1024, 1024, 1, 256]
    - [111, 12.66]
  - - [64, 64, 1, 512]
    - [165, 0.18]
  - - [128, 64, 1, 512]
    - [182, 0.34]
  - - [192, 64, 1, 512]
    - [176, 0.5]
  - - [256, 64, 1, 512]
    - [165, 0.7]
  - - [320, 64, 1, 512]
    - [182, 0.87]
  - - [384, 64, 1, 512]
    - [178, 1.05]
  - - [448, 64, 1, 512]
    - [178, 1.16]
  - - [512, 64, 1, 512]
    - [170, 1.39]
  - - [576, 64, 1, 512]
    - [178, 1.46]
  - - [640, 64, 1, 512]
    - [236, 1.61]
  - - [704, 64, 1, 512]
    - [171, 1.81]
  - - [768, 64, 1, 512]
    - [176, 1.9]
  - - [832, 64, 1, 512]
    - [171, 2.02]
  - - [896, 64, 1, 512]
    - [215, 2.23]
  - - [960, 64, 1, 512]
    - [172, 2.4]
  - - [1024, 64, 1, 512]
    - [171, 2.61]
  - - [64, 128, 1, 512]
    - [121, 0.36]
  - - [128, 128, 1, 512]
    - [178, 0.68]
  - - [192, 128, 1, 512]
    - [122, 1.03]
  - - [256, 128, 1, 512]
    - [171, 1.38]
  - - [320, 128, 1, 512]
    - [171, 1.65]
  - - [384, 128, 1, 512]
    - [170, 1.94]
  - - [448, 128, 1, 512]
    - [173, 2.19]
  - - [512, 128, 1, 512]
    - [212, 2.5]
  - - [576, 128, 1, 512]
    - [147, 2.82]
  - - [640, 128, 1, 512]
    - [134, 2.97]
  - - [704, 128, 1, 512]
    - [148, 3.28]
  - - [768, 128, 1, 512]
    - [148, 3.61]
  - - [832, 128, 1, 512]
    - [113, 3.9]
  - - [896, 128, 1, 512]
    - [134, 4.38]
  - - [960, 128, 1, 512]
    - [147, 4.67]
  - - [1024, 128, 1, 512]
    - [134, 4.8]
  - - [64, 192, 1, 512]
    - [174, 0.5]
  - - [128, 192, 1, 512]
    - [182, 1.0]
  - - [192, 192, 1, 512]
    - [166, 1.5]
  - - [256, 192, 1, 512]
    - [134, 1.94]
  - - [320, 192, 1, 512]
    - [130, 2.35]
  - - [384, 192, 1, 512]
    - [134, 2.83]
  - - [448, 192, 1, 512]
    - [147, 3.22]
  - - [512, 192, 1, 512]
    - [135, 3.74]
  - - [576, 192, 1, 512]
    - [112, 3.86]
  - - [640, 192, 1, 512]
    - [134, 4.69]
  - - [704, 192, 1, 512]
    - [163, 4.83]
  - - [768, 192, 1, 512]
    - [135, 5.06]
  - - [832, 192, 1, 512]
    - [43, 5.27]
  - - [896, 192, 1, 512]
    - [135, 5.68]
  - - [960, 192, 1, 512]
    - [148, 5.94]
  - - [1024, 192, 1, 512]
    - [134, 6.46]
  - - [64, 256, 1, 512]
    - [179, 0.71]
  - - [128, 256, 1, 512]
    - [165, 1.41]
  - - [192, 256, 1, 512]
    - [146, 1.88]
  - - [256, 256, 1, 512]
    - [123, 2.52]
  - - [320, 256, 1, 512]
    - [147, 3.14]
  - - [384, 256, 1, 512]
    - [147, 3.77]
  - - [448, 256, 1, 512]
    - [149, 4.36]
  - - [512, 256, 1, 512]
    - [136, 4.72]
  - - [576, 256, 1, 512]
    - [148, 5.39]
  - - [640, 256, 1, 512]
    - [147, 5.7]
  - - [704, 256, 1, 512]
    - [147, 5.8]
  - - [768, 256, 1, 512]
    - [113, 6.34]
  - - [832, 256, 1, 512]
    - [111, 6.71]
  - - [896, 256, 1, 512]
    - [134, 7.4]
  - - [960, 256, 1, 512]
    - [81, 7.71]
  - - [1024, 256, 1, 512]
    - [147, 8.52]
  - - [64, 320, 1, 512]
    - [164, 0.87]
  - - [128, 320, 1, 512]
    - [237, 1.66]
  - - [192, 320, 1, 512]
    - [175, 2.41]
  - - [256, 320, 1, 512]
    - [134, 2.99]
  - - [320, 320, 1, 512]
    - [148, 3.77]
  - - [384, 320, 1, 512]
    - [135, 4.69]
  - - [448, 320, 1, 512]
    - [112, 4.89]
  - - [512, 320, 1, 512]
    - [113, 5.31]
  - - [576, 320, 1, 512]
    - [43, 5.74]
  - - [640, 320, 1, 512]
    - [134, 6.54]
  - - [704, 320, 1, 512]
    - [43, 7.19]
  - - [768, 320, 1, 512]
    - [135, 7.72]
  - - [832, 320, 1, 512]
    - [113, 8.01]
  - - [896, 320, 1, 512]
    - [69, 8.41]
  - - [960, 320, 1, 512]
    - [43, 8.63]
  - - [1024, 320, 1, 512]
    - [69, 9.36]
  - - [64, 384, 1, 512]
    - [177, 1.07]
  - - [128, 384, 1, 512]
    - [168, 1.96]
  - - [192, 384, 1, 512]
    - [231, 2.74]
  - - [256, 384, 1, 512]
    - [135, 3.79]
  - - [320, 384, 1, 512]
    - [147, 4.43]
  - - [384, 384, 1, 512]
    - [134, 5.1]
  - - [448, 384, 1, 512]
    - [108, 5.71]
  - - [512, 384, 1, 512]
    - [147, 6.4]
  - - [576, 384, 1, 512]
    - [147, 6.98]
  - - [640, 384, 1, 512]
    - [134, 7.71]
  - - [704, 384, 1, 512]
    - [148, 8.78]
  - - [768, 384, 1, 512]
    - [153, 8.64]
  - - [832, 384, 1, 512]
    - [43, 9.32]
  - - [896, 384, 1, 512]
    - [153, 9.71]
  - - [960, 384, 1, 512]
    - [43, 10.28]
  - - [1024, 384, 1, 512]
    - [195, 10.74]
  - - [64, 448, 1, 512]
    - [168, 1.21]
  - - [128, 448, 1, 512]
    - [166, 2.29]
  - - [192, 448, 1, 512]
    - [148, 3.07]
  - - [256, 448, 1, 512]
    - [134, 4.14]
  - - [320, 448, 1, 512]
    - [112, 5.03]
  - - [384, 448, 1, 512]
    - [43, 5.66]
  - - [448, 448, 1, 512]
    - [81, 6.29]
  - - [512, 448, 1, 512]
    - [148, 7.32]
  - - [576, 448, 1, 512]
    - [43, 8.1]
  - - [640, 448, 1, 512]
    - [138, 8.62]
  - - [704, 448, 1, 512]
    - [43, 9.22]
  - - [768, 448, 1, 512]
    - [43, 9.83]
  - - [832, 448, 1, 512]
    - [117, 10.38]
  - - [896, 448, 1, 512]
    - [43, 11.05]
  - - [960, 448, 1, 512]
    - [18, 11.4]
  - - [1024, 448, 1, 512]
    - [85, 11.72]
  - - [64, 512, 1, 512]
    - [165, 1.39]
  - - [128, 512, 1, 512]
    - [237, 2.55]
  - - [192, 512, 1, 512]
    - [149, 3.7]
  - - [256, 512, 1, 512]
    - [135, 5.02]
  - - [320, 512, 1, 512]
    - [208, 5.5]
  - - [384, 512, 1, 512]
    - [135, 6.44]
  - - [448, 512, 1, 512]
    - [134, 7.48]
  - - [512, 512, 1, 512]
    - [111, 10.33]
  - - [576, 512, 1, 512]
    - [43, 8.77]
  - - [640, 512, 1, 512]
    - [69, 9.25]
  - - [704, 512, 1, 512]
    - [6, 10.34]
  - - [768, 512, 1, 512]
    - [6, 11.05]
  - - [832, 512, 1, 512]
    - [117, 11.53]
  - - [896, 512, 1, 512]
    - [11, 12.16]
  - - [960, 512, 1, 512]
    - [91, 12.23]
  - - [1024, 512, 1, 512]
    - [71, 13.56]
  - - [64, 576, 1, 512]
    - [165, 1.47]
  - - [128, 576, 1, 512]
    - [135, 2.71]
  - - [192, 576, 1, 512]
    - [147, 3.96]
  - - [256, 576, 1, 512]
    - [161, 5.11]
  - - [320, 576, 1, 512]
    - [43, 5.77]
  - - [384, 576, 1, 512]
    - [68, 6.97]
  - - [448, 576, 1, 512]
    - [117, 7.88]
  - - [512, 576, 1, 512]
    - [43, 8.22]
  - - [576, 576, 1, 512]
    - [43, 9.6]
  - - [640, 576, 1, 512]
    - [43, 10.83]
  - - [704, 576, 1, 512]
    - [6, 10.99]
  - - [768, 576, 1, 512]
    - [43, 11.63]
  - - [832, 576, 1, 512]
    - [43, 11.99]
  - - [896, 576, 1, 512]
    - [11, 13.9]
  - - [960, 576, 1, 512]
    - [6, 12.72]
  - - [1024, 576, 1, 512]
    - [132, 13.17]
  - - [64, 640, 1, 512]
    - [164, 1.67]
  - - [128, 640, 1, 512]
    - [135, 2.98]
  - - [192, 640, 1, 512]
    - [147, 4.66]
  - - [256, 640, 1, 512]
    - [81, 5.33]
  - - [320, 640, 1, 512]
    - [43, 6.46]
  - - [384, 640, 1, 512]
    - [147, 8.03]
  - - [448, 640, 1, 512]
    - [147, 8.62]
  - - [512, 640, 1, 512]
    - [81, 9.28]
  - - [576, 640, 1, 512]
    - [117, 10.6]
  - - [640, 640, 1, 512]
    - [43, 11.04]
  - - [704, 640, 1, 512]
    - [81, 11.67]
  - - [768, 640, 1, 512]
    - [69, 12.65]
  - - [832, 640, 1, 512]
    - [154, 13.6]
  - - [896, 640, 1, 512]
    - [89, 13.72]
  - - [960, 640, 1, 512]
    - [117, 13.77]
  - - [1024, 640, 1, 512]
    - [69, 14.93]
  - - [64, 704, 1, 512]
    - [169, 1.81]
  - - [128, 704, 1, 512]
    - [148, 3.45]
  - - [192, 704, 1, 512]
    - [147, 4.96]
  - - [256, 704, 1, 512]
    - [135, 5.77]
  - - [320, 704, 1, 512]
    - [148, 6.89]
  - - [384, 704, 1, 512]
    - [139, 8.68]
  - - [448, 704, 1, 512]
    - [43, 8.95]
  - - [512, 704, 1, 512]
    - [43, 10.19]
  - - [576, 704, 1, 512]
    - [6, 11.08]
  - - [640, 704, 1, 512]
    - [11, 11.89]
  - - [704, 704, 1, 512]
    - [117, 12.46]
  - - [768, 704, 1, 512]
    - [63, 13.21]
  - - [832, 704, 1, 512]
    - [43, 13.19]
  - - [896, 704, 1, 512]
    - [6, 14.11]
  - - [960, 704, 1, 512]
    - [6, 14.64]
  - - [1024, 704, 1, 512]
    - [89, 15.32]
  - - [64, 768, 1, 512]
    - [166, 1.97]
  - - [128, 768, 1, 512]
    - [135, 3.76]
  - - [192, 768, 1, 512]
    - [108, 5.27]
  - - [256, 768, 1, 512]
    - [146, 6.13]
  - - [320, 768, 1, 512]
    - [147, 7.91]
  - - [384, 768, 1, 512]
    - [43, 8.83]
  - - [448, 768, 1, 512]
    - [43, 9.73]
  - - [512, 768, 1, 512]
    - [43, 11.01]
  - - [576, 768, 1, 512]
    - [15, 11.81]
  - - [640, 768, 1, 512]
    - [84, 12.86]
  - - [704, 768, 1, 512]
    - [15, 13.31]
  - - [768, 768, 1, 512]
    - [117, 13.26]
  - - [832, 768, 1, 512]
    - [81, 14.2]
  - - [896, 768, 1, 512]
    - [96, 14.86]
  - - [960, 768, 1, 512]
    - [63, 15.57]
  - - [1024, 768, 1, 512]
    - [63, 16.38]
  - - [64, 832, 1, 512]
    - [166, 2.1]
  - - [128, 832, 1, 512]
    - [134, 3.81]
  - - [192, 832, 1, 512]
    - [43, 5.22]
  - - [256, 832, 1, 512]
    - [134, 6.97]
  - - [320, 832, 1, 512]
    - [43, 8.19]
  - - [384, 832, 1, 512]
    - [43, 9.29]
  - - [448, 832, 1, 512]
    - [117, 10.27]
  - - [512, 832, 1, 512]
    - [43, 11.15]
  - - [576, 832, 1, 512]
    - [15, 12.34]
  - - [640, 832, 1, 512]
    - [58, 13.71]
  - - [704, 832, 1, 512]
    - [6, 13.05]
  - - [768, 832, 1, 512]
    - [43, 14.32]
  - - [832, 832, 1, 512]
    - [89, 14.28]
  - - [896, 832, 1, 512]
    - [63, 15.37]
  - - [960, 832, 1, 512]
    - [146, 15.61]
  - - [1024, 832, 1, 512]
    - [133, 16.37]
  - - [64, 896, 1, 512]
    - [231, 2.28]
  - - [128, 896, 1, 512]
    - [147, 4.32]
  - - [192, 896, 1, 512]
    - [106, 5.51]
  - - [256, 896, 1, 512]
    - [134, 7.27]
  - - [320, 896, 1, 512]
    - [117, 8.59]
  - - [384, 896, 1, 512]
    - [117, 9.95]
  - - [448, 896, 1, 512]
    - [6, 10.93]
  - - [512, 896, 1, 512]
    - [84, 12.0]
  - - [576, 896, 1, 512]
    - [15, 13.43]
  - - [640, 896, 1, 512]
    - [1, 14.37]
  - - [704, 896, 1, 512]
    - [43, 13.96]
  - - [768, 896, 1, 512]
    - [16, 14.59]
  - - [832, 896, 1, 512]
    - [154, 15.53]
  - - [896, 896, 1, 512]
    - [15, 16.4]
  - - [960, 896, 1, 512]
    - [146, 16.83]
  - - [1024, 896, 1, 512]
    - [137, 17.9]
  - - [64, 960, 1, 512]
    - [165, 2.42]
  - - [128, 960, 1, 512]
    - [147, 4.65]
  - - [192, 960, 1, 512]
    - [147, 5.75]
  - - [256, 960, 1, 512]
    - [134, 8.04]
  - - [320, 960, 1, 512]
    - [43, 9.04]
  - - [384, 960, 1, 512]
    - [43, 10.78]
  - - [448, 960, 1, 512]
    - [43, 11.32]
  - - [512, 960, 1, 512]
    - [18, 12.69]
  - - [576, 960, 1, 512]
    - [117, 12.93]
  - - [640, 960, 1, 512]
    - [6, 13.66]
  - - [704, 960, 1, 512]
    - [117, 13.93]
  - - [768, 960, 1, 512]
    - [15, 15.18]
  - - [832, 960, 1, 512]
    - [146, 15.56]
  - - [896, 960, 1, 512]
    - [133, 16.78]
  - - [960, 960, 1, 512]
    - [150, 17.62]
  - - [1024, 960, 1, 512]
    - [133, 19.1]
  - - [64, 1024, 1, 512]
    - [178, 2.55]
  - - [128, 1024, 1, 512]
    - [136, 4.72]
  - - [192, 1024, 1, 512]
    - [80, 6.3]
  - - [256, 1024, 1, 512]
    - [135, 8.3]
  - - [320, 1024, 1, 512]
    - [43, 9.33]
  - - [384, 1024, 1, 512]
    - [43, 11.34]
  - - [448, 1024, 1, 512]
    - [15, 11.7]
  - - [512, 1024, 1, 512]
    - [15, 13.31]
  - - [576, 1024, 1, 512]
    - [85, 13.5]
  - - [640, 1024, 1, 512]
    - [81, 14.96]
  - - [704, 1024, 1, 512]
    - [89, 15.7]
  - - [768, 1024, 1, 512]
    - [96, 16.9]
  - - [832, 1024, 1, 512]
    - [146, 16.71]
  - - [896, 1024, 1, 512]
    - [146, 17.9]
  - - [960, 1024, 1, 512]
    - [112, 18.96]
  - - [1024, 1024, 1, 512]
    - [111, 20.19]
  - - [64, 64, 1, 1024]
    - [236, 0.32]
  - - [128, 64, 1, 1024]
    - [165, 0.66]
  - - [192, 64, 1, 1024]
    - [230, 0.91]
  - - [256, 64, 1, 1024]
    - [179, 1.18]
  - - [320, 64, 1, 1024]
    - [178, 1.44]
  - - [384, 64, 1, 1024]
    - [236, 1.8]
  - - [448, 64, 1, 1024]
    - [172, 2.07]
  - - [512, 64, 1, 1024]
    - [181, 2.4]
  - - [576, 64, 1, 1024]
    - [230, 2.57]
  - - [640, 64, 1, 1024]
    - [236, 2.85]
  - - [704, 64, 1, 1024]
    - [236, 3.06]
  - - [768, 64, 1, 1024]
    - [172, 3.24]
  - - [832, 64, 1, 1024]
    - [171, 3.63]
  - - [896, 64, 1, 1024]
    - [172, 3.96]
  - - [960, 64, 1, 1024]
    - [171, 4.14]
  - - [1024, 64, 1, 1024]
    - [172, 4.5]
  - - [64, 128, 1, 1024]
    - [165, 0.63]
  - - [128, 128, 1, 1024]
    - [179, 1.21]
  - - [192, 128, 1, 1024]
    - [166, 1.72]
  - - [256, 128, 1, 1024]
    - [165, 2.4]
  - - [320, 128, 1, 1024]
    - [165, 2.87]
  - - [384, 128, 1, 1024]
    - [172, 3.23]
  - - [448, 128, 1, 1024]
    - [172, 3.89]
  - - [512, 128, 1, 1024]
    - [175, 4.42]
  - - [576, 128, 1, 1024]
    - [126, 4.51]
  - - [640, 128, 1, 1024]
    - [134, 5.24]
  - - [704, 128, 1, 1024]
    - [147, 5.47]
  - - [768, 128, 1, 1024]
    - [136, 6.25]
  - - [832, 128, 1, 1024]
    - [147, 6.45]
  - - [896, 128, 1, 1024]
    - [135, 7.03]
  - - [960, 128, 1, 1024]
    - [147, 7.74]
  - - [1024, 128, 1, 1024]
    - [136, 7.95]
  - - [64, 192, 1, 1024]
    - [235, 0.87]
  - - [128, 192, 1, 1024]
    - [236, 1.78]
  - - [192, 192, 1, 1024]
    - [172, 2.6]
  - - [256, 192, 1, 1024]
    - [172, 3.27]
  - - [320, 192, 1, 1024]
    - [174, 3.84]
  - - [384, 192, 1, 1024]
    - [135, 4.59]
  - - [448, 192, 1, 1024]
    - [147, 5.16]
  - - [512, 192, 1, 1024]
    - [135, 5.96]
  - - [576, 192, 1, 1024]
    - [112, 6.41]
  - - [640, 192, 1, 1024]
    - [136, 7.55]
  - - [704, 192, 1, 1024]
    - [163, 7.96]
  - - [768, 192, 1, 1024]
    - [135, 8.54]
  - - [832, 192, 1, 1024]
    - [163, 8.49]
  - - [896, 192, 1, 1024]
    - [108, 8.76]
  - - [960, 192, 1, 1024]
    - [80, 9.08]
  - - [1024, 192, 1, 1024]
    - [148, 10.06]
  - - [64, 256, 1, 1024]
    - [159, 1.18]
  - - [128, 256, 1, 1024]
    - [172, 2.4]
  - - [192, 256, 1, 1024]
    - [123, 3.23]
  - - [256, 256, 1, 1024]
    - [125, 4.23]
  - - [320, 256, 1, 1024]
    - [149, 5.07]
  - - [384, 256, 1, 1024]
    - [136, 5.99]
  - - [448, 256, 1, 1024]
    - [148, 6.85]
  - - [512, 256, 1, 1024]
    - [147, 8.1]
  - - [576, 256, 1, 1024]
    - [148, 8.6]
  - - [640, 256, 1, 1024]
    - [224, 9.04]
  - - [704, 256, 1, 1024]
    - [147, 9.31]
  - - [768, 256, 1, 1024]
    - [147, 9.85]
  - - [832, 256, 1, 1024]
    - [148, 10.95]
  - - [896, 256, 1, 1024]
    - [135, 11.44]
  - - [960, 256, 1, 1024]
    - [148, 12.46]
  - - [1024, 256, 1, 1024]
    - [148, 13.38]
  - - [64, 320, 1, 1024]
    - [235, 1.47]
  - - [128, 320, 1, 1024]
    - [231, 2.83]
  - - [192, 320, 1, 1024]
    - [165, 4.02]
  - - [256, 320, 1, 1024]
    - [136, 5.09]
  - - [320, 320, 1, 1024]
    - [147, 6.39]
  - - [384, 320, 1, 1024]
    - [134, 7.83]
  - - [448, 320, 1, 1024]
    - [228, 7.79]
  - - [512, 320, 1, 1024]
    - [162, 8.9]
  - - [576, 320, 1, 1024]
    - [149, 9.05]
  - - [640, 320, 1, 1024]
    - [135, 10.54]
  - - [704, 320, 1, 1024]
    - [152, 10.81]
  - - [768, 320, 1, 1024]
    - [134, 12.1]
  - - [832, 320, 1, 1024]
    - [113, 12.85]
  - - [896, 320, 1, 1024]
    - [43, 13.08]
  - - [960, 320, 1, 1024]
    - [43, 14.2]
  - - [1024, 320, 1, 1024]
    - [43, 13.96]
  - - [64, 384, 1, 1024]
    - [165, 1.82]
  - - [128, 384, 1, 1024]
    - [170, 3.24]
  - - [192, 384, 1, 1024]
    - [149, 4.66]
  - - [256, 384, 1, 1024]
    - [147, 6.22]
  - - [320, 384, 1, 1024]
    - [149, 7.77]
  - - [384, 384, 1, 1024]
    - [224, 8.5]
  - - [448, 384, 1, 1024]
    - [149, 8.94]
  - - [512, 384, 1, 1024]
    - [148, 10.13]
  - - [576, 384, 1, 1024]
    - [148, 11.33]
  - - [640, 384, 1, 1024]
    - [148, 12.14]
  - - [704, 384, 1, 1024]
    - [43, 12.69]
  - - [768, 384, 1, 1024]
    - [67, 13.14]
  - - [832, 384, 1, 1024]
    - [43, 14.58]
  - - [896, 384, 1, 1024]
    - [43, 14.9]
  - - [960, 384, 1, 1024]
    - [43, 15.72]
  - - [1024, 384, 1, 1024]
    - [43, 16.77]
  - - [64, 448, 1, 1024]
    - [165, 2.0]
  - - [128, 448, 1, 1024]
    - [166, 3.83]
  - - [192, 448, 1, 1024]
    - [147, 5.41]
  - - [256, 448, 1, 1024]
    - [134, 7.26]
  - - [320, 448, 1, 1024]
    - [112, 8.13]
  - - [384, 448, 1, 1024]
    - [225, 9.06]
  - - [448, 448, 1, 1024]
    - [148, 10.12]
  - - [512, 448, 1, 1024]
    - [149, 11.71]
  - - [576, 448, 1, 1024]
    - [207, 12.12]
  - - [640, 448, 1, 1024]
    - [43, 12.92]
  - - [704, 448, 1, 1024]
    - [43, 13.67]
  - - [768, 448, 1, 1024]
    - [81, 14.81]
  - - [832, 448, 1, 1024]
    - [43, 15.92]
  - - [896, 448, 1, 1024]
    - [12, 16.51]
  - - [960, 448, 1, 1024]
    - [117, 16.93]
  - - [1024, 448, 1, 1024]
    - [43, 17.76]
  - - [64, 512, 1, 1024]
    - [165, 2.43]
  - - [128, 512, 1, 1024]
    - [166, 4.44]
  - - [192, 512, 1, 1024]
    - [112, 5.88]
  - - [256, 512, 1, 1024]
    - [136, 8.0]
  - - [320, 512, 1, 1024]
    - [158, 8.81]
  - - [384, 512, 1, 1024]
    - [135, 9.78]
  - - [448, 512, 1, 1024]
    - [68, 11.38]
  - - [512, 512, 1, 1024]
    - [111, 12.24]
  - - [576, 512, 1, 1024]
    - [195, 13.24]
  - - [640, 512, 1, 1024]
    - [43, 14.63]
  - - [704, 512, 1, 1024]
    - [6, 15.71]
  - - [768, 512, 1, 1024]
    - [43, 16.27]
  - - [832, 512, 1, 1024]
    - [43, 16.96]
  - - [896, 512, 1, 1024]
    - [69, 17.61]
  - - [960, 512, 1, 1024]
    - [11, 18.63]
  - - [1024, 512, 1, 1024]
    - [30, 26.91]
  - - [64, 576, 1, 1024]
    - [164, 2.55]
  - - [128, 576, 1, 1024]
    - [162, 5.49]
  - - [192, 576, 1, 1024]
    - [149, 6.57]
  - - [256, 576, 1, 1024]
    - [163, 9.85]
  - - [320, 576, 1, 1024]
    - [43, 9.34]
  - - [384, 576, 1, 1024]
    - [116, 14.93]
  - - [448, 576, 1, 1024]
    - [113, 12.07]
  - - [512, 576, 1, 1024]
    - [113, 18.13]
  - - [576, 576, 1, 1024]
    - [43, 14.47]
  - - [640, 576, 1, 1024]
    - [113, 21.44]
  - - [704, 576, 1, 1024]
    - [117, 16.64]
  - - [768, 576, 1, 1024]
    - [113, 23.77]
  - - [832, 576, 1, 1024]
    - [117, 18.02]
  - - [896, 576, 1, 1024]
    - [113, 27.2]
  - - [960, 576, 1, 1024]
    - [43, 19.17]
  - - [1024, 576, 1, 1024]
    - [40, 27.05]
  - - [64, 640, 1, 1024]
    - [169, 3.2]
  - - [128, 640, 1, 1024]
    - [163, 6.18]
  - - [192, 640, 1, 1024]
    - [163, 9.18]
  - - [256, 640, 1, 1024]
    - [149, 10.78]
  - - [320, 640, 1, 1024]
    - [229, 13.59]
  - - [384, 640, 1, 1024]
    - [162, 16.0]
  - - [448, 640, 1, 1024]
    - [113, 16.87]
  - - [512, 640, 1, 1024]
    - [113, 19.18]
  - - [576, 640, 1, 1024]
    - [208, 21.51]
  - - [640, 640, 1, 1024]
    - [88, 22.52]
  - - [704, 640, 1, 1024]
    - [113, 23.97]
  - - [768, 640, 1, 1024]
    - [88, 26.91]
  - - [832, 640, 1, 1024]
    - [112, 25.25]
  - - [896, 640, 1, 1024]
    - [87, 26.71]
  - - [960, 640, 1, 1024]
    - [88, 28.57]
  - - [1024, 640, 1, 1024]
    - [88, 31.24]
  - - [64, 704, 1, 1024]
    - [165, 3.12]
  - - [128, 704, 1, 1024]
    - [162, 6.43]
  - - [192, 704, 1, 1024]
    - [113, 8.03]
  - - [256, 704, 1, 1024]
    - [210, 11.93]
  - - [320, 704, 1, 1024]
    - [147, 10.94]
  - - [384, 704, 1, 1024]
    - [208, 16.06]
  - - [448, 704, 1, 1024]
    - [43, 13.79]
  - - [512, 704, 1, 1024]
    - [112, 20.96]
  - - [576, 704, 1, 1024]
    - [43, 16.93]
  - - [640, 704, 1, 1024]
    - [62, 23.67]
  - - [704, 704, 1, 1024]
    - [43, 18.23]
  - - [768, 704, 1, 1024]
    - [87, 24.92]
  - - [832, 704, 1, 1024]
    - [195, 18.81]
  - - [896, 704, 1, 1024]
    - [40, 29.26]
  - - [960, 704, 1, 1024]
    - [43, 19.96]
  - - [1024, 704, 1, 1024]
    - [85, 31.79]
  - - [64, 768, 1, 1024]
    - [168, 3.77]
  - - [128, 768, 1, 1024]
    - [162, 7.14]
  - - [192, 768, 1, 1024]
    - [148, 10.06]
  - - [256, 768, 1, 1024]
    - [162, 12.74]
  - - [320, 768, 1, 1024]
    - [159, 15.81]
  - - [384, 768, 1, 1024]
    - [208, 17.78]
  - - [448, 768, 1, 1024]
    - [112, 20.88]
  - - [512, 768, 1, 1024]
    - [208, 22.35]
  - - [576, 768, 1, 1024]
    - [113, 22.59]
  - - [640, 768, 1, 1024]
    - [60, 26.17]
  - - [704, 768, 1, 1024]
    - [40, 24.63]
  - - [768, 768, 1, 1024]
    - [113, 26.48]
  - - [832, 768, 1, 1024]
    - [40, 29.47]
  - - [896, 768, 1, 1024]
    - [57, 30.86]
  - - [960, 768, 1, 1024]
    - [40, 30.56]
  - - [1024, 768, 1, 1024]
    - [21, 33.37]
  - - [64, 832, 1, 1024]
    - [390, 3.5]
  - - [128, 832, 1, 1024]
    - [162, 7.91]
  - - [192, 832, 1, 1024]
    - [108, 8.31]
  - - [256, 832, 1, 1024]
    - [112, 14.14]
  - - [320, 832, 1, 1024]
    - [43, 12.54]
  - - [384, 832, 1, 1024]
    - [111, 19.25]
  - - [448, 832, 1, 1024]
    - [43, 15.75]
  - - [512, 832, 1, 1024]
    - [208, 21.94]
  - - [576, 832, 1, 1024]
    - [43, 18.03]
  - - [640, 832, 1, 1024]
    - [62, 24.79]
  - - [704, 832, 1, 1024]
    - [290, 18.71]
  - - [768, 832, 1, 1024]
    - [87, 30.19]
  - - [832, 832, 1, 1024]
    - [195, 20.1]
  - - [896, 832, 1, 1024]
    - [62, 34.15]
  - - [960, 832, 1, 1024]
    - [43, 21.93]
  - - [1024, 832, 1, 1024]
    - [31, 34.82]
  - - [64, 896, 1, 1024]
    - [165, 4.3]
  - - [128, 896, 1, 1024]
    - [162, 8.27]
  - - [192, 896, 1, 1024]
    - [207, 11.34]
  - - [256, 896, 1, 1024]
    - [113, 14.87]
  - - [320, 896, 1, 1024]
    - [113, 17.71]
  - - [384, 896, 1, 1024]
    - [113, 19.94]
  - - [448, 896, 1, 1024]
    - [88, 21.42]
  - - [512, 896, 1, 1024]
    - [88, 24.11]
  - - [576, 896, 1, 1024]
    - [88, 27.63]
  - - [640, 896, 1, 1024]
    - [87, 27.55]
  - - [704, 896, 1, 1024]
    - [88, 29.98]
  - - [768, 896, 1, 1024]
    - [85, 32.49]
  - - [832, 896, 1, 1024]
    - [85, 34.47]
  - - [896, 896, 1, 1024]
    - [31, 34.87]
  - - [960, 896, 1, 1024]
    - [85, 35.42]
  - - [1024, 896, 1, 1024]
    - [21, 38.37]
  - - [64, 960, 1, 1024]
    - [231, 4.06]
  - - [128, 960, 1, 1024]
    - [162, 9.06]
  - - [192, 960, 1, 1024]
    - [147, 9.08]
  - - [256, 960, 1, 1024]
    - [148, 15.65]
  - - [320, 960, 1, 1024]
    - [43, 13.95]
  - - [384, 960, 1, 1024]
    - [148, 21.15]
  - - [448, 960, 1, 1024]
    - [6, 16.73]
  - - [512, 960, 1, 1024]
    - [42, 24.79]
  - - [576, 960, 1, 1024]
    - [43, 19.55]
  - - [640, 960, 1, 1024]
    - [85, 29.2]
  - - [704, 960, 1, 1024]
    - [117, 20.73]
  - - [768, 960, 1, 1024]
    - [84, 34.46]
  - - [832, 960, 1, 1024]
    - [43, 21.88]
  - - [896, 960, 1, 1024]
    - [31, 35.78]
  - - [960, 960, 1, 1024]
    - [112, 24.45]
  - - [1024, 960, 1, 1024]
    - [21, 40.07]
  - - [64, 1024, 1, 1024]
    - [233, 5.13]
  - - [128, 1024, 1, 1024]
    - [159, 9.63]
  - - [192, 1024, 1, 1024]
    - [147, 12.72]
  - - [256, 1024, 1, 1024]
    - [116, 17.33]
  - - [320, 1024, 1, 1024]
    - [112, 19.58]
  - - [384, 1024, 1, 1024]
    - [112, 22.41]
  - - [448, 1024, 1, 1024]
    - [208, 23.9]
  - - [512, 1024, 1, 1024]
    - [27, 26.74]
  - - [576, 1024, 1, 1024]
    - [111, 27.08]
  - - [640, 1024, 1, 1024]
    - [111, 29.81]
  - - [704, 1024, 1, 1024]
    - [40, 29.73]
  - - [768, 1024, 1, 1024]
    - [24, 33.22]
  - - [832, 1024, 1, 1024]
    - [40, 31.46]
  - - [896, 1024, 1, 1024]
    - [19, 38.78]
  - - [960, 1024, 1, 1024]
    - [58, 34.27]
  - - [1024, 1024, 1, 1024]
    - [113, 27.37]
  - - [64, 64, 1, 2048]
    - [170, 0.53]
  - - [128, 64, 1, 2048]
    - [188, 1.12]
  - - [192, 64, 1, 2048]
    - [174, 1.4]
  - - [256, 64, 1, 2048]
    - [164, 2.28]
  - - [320, 64, 1, 2048]
    - [236, 2.32]
  - - [384, 64, 1, 2048]
    - [169, 3.22]
  - - [448, 64, 1, 2048]
    - [182, 3.26]
  - - [512, 64, 1, 2048]
    - [175, 4.5]
  - - [576, 64, 1, 2048]
    - [179, 4.05]
  - - [640, 64, 1, 2048]
    - [175, 5.21]
  - - [704, 64, 1, 2048]
    - [172, 4.84]
  - - [768, 64, 1, 2048]
    - [238, 6.12]
  - - [832, 64, 1, 2048]
    - [234, 5.48]
  - - [896, 64, 1, 2048]
    - [175, 7.21]
  - - [960, 64, 1, 2048]
    - [171, 6.3]
  - - [1024, 64, 1, 2048]
    - [238, 8.32]
  - - [64, 128, 1, 2048]
    - [186, 1.11]
  - - [128, 128, 1, 2048]
    - [175, 2.17]
  - - [192, 128, 1, 2048]
    - [168, 3.22]
  - - [256, 128, 1, 2048]
    - [175, 4.46]
  - - [320, 128, 1, 2048]
    - [175, 5.39]
  - - [384, 128, 1, 2048]
    - [238, 6.25]
  - - [448, 128, 1, 2048]
    - [124, 7.04]
  - - [512, 128, 1, 2048]
    - [175, 7.91]
  - - [576, 128, 1, 2048]
    - [163, 8.99]
  - - [640, 128, 1, 2048]
    - [229, 9.69]
  - - [704, 128, 1, 2048]
    - [162, 10.66]
  - - [768, 128, 1, 2048]
    - [159, 12.0]
  - - [832, 128, 1, 2048]
    - [162, 12.43]
  - - [896, 128, 1, 2048]
    - [159, 13.88]
  - - [960, 128, 1, 2048]
    - [163, 14.33]
  - - [1024, 128, 1, 2048]
    - [159, 15.87]
  - - [64, 192, 1, 2048]
    - [170, 1.39]
  - - [128, 192, 1, 2048]
    - [169, 3.26]
  - - [192, 192, 1, 2048]
    - [165, 3.96]
  - - [256, 192, 1, 2048]
    - [163, 5.77]
  - - [320, 192, 1, 2048]
    - [238, 5.84]
  - - [384, 192, 1, 2048]
    - [161, 8.87]
  - - [448, 192, 1, 2048]
    - [149, 7.86]
  - - [512, 192, 1, 2048]
    - [159, 11.43]
  - - [576, 192, 1, 2048]
    - [134, 10.02]
  - - [640, 192, 1, 2048]
    - [159, 14.14]
  - - [704, 192, 1, 2048]
    - [108, 11.42]
  - - [768, 192, 1, 2048]
    - [163, 15.48]
  - - [832, 192, 1, 2048]
    - [209, 11.78]
  - - [896, 192, 1, 2048]
    - [159, 18.26]
  - - [960, 192, 1, 2048]
    - [135, 13.01]
  - - [1024, 192, 1, 2048]
    - [162, 19.87]
  - - [64, 256, 1, 2048]
    - [234, 2.25]
  - - [128, 256, 1, 2048]
    - [167, 4.22]
  - - [192, 256, 1, 2048]
    - [123, 5.92]
  - - [256, 256, 1, 2048]
    - [162, 7.7]
  - - [320, 256, 1, 2048]
    - [159, 9.88]
  - - [384, 256, 1, 2048]
    - [163, 11.88]
  - - [448, 256, 1, 2048]
    - [163, 13.23]
  - - [512, 256, 1, 2048]
    - [159, 15.65]
  - - [576, 256, 1, 2048]
    - [159, 15.63]
  - - [640, 256, 1, 2048]
    - [136, 17.46]
  - - [704, 256, 1, 2048]
    - [158, 18.39]
  - - [768, 256, 1, 2048]
    - [116, 20.32]
  - - [832, 256, 1, 2048]
    - [158, 21.89]
  - - [896, 256, 1, 2048]
    - [116, 23.63]
  - - [960, 256, 1, 2048]
    - [116, 24.96]
  - - [1024, 256, 1, 2048]
    - [159, 26.29]
  - - [64, 320, 1, 2048]
    - [178, 2.26]
  - - [128, 320, 1, 2048]
    - [232, 5.17]
  - - [192, 320, 1, 2048]
    - [236, 6.07]
  - - [256, 320, 1, 2048]
    - [163, 9.9]
  - - [320, 320, 1, 2048]
    - [147, 9.13]
  - - [384, 320, 1, 2048]
    - [157, 14.18]
  - - [448, 320, 1, 2048]
    - [113, 11.4]
  - - [512, 320, 1, 2048]
    - [116, 16.73]
  - - [576, 320, 1, 2048]
    - [148, 12.84]
  - - [640, 320, 1, 2048]
    - [139, 20.55]
  - - [704, 320, 1, 2048]
    - [148, 15.19]
  - - [768, 320, 1, 2048]
    - [136, 24.34]
  - - [832, 320, 1, 2048]
    - [113, 17.39]
  - - [896, 320, 1, 2048]
    - [135, 25.37]
  - - [960, 320, 1, 2048]
    - [43, 18.79]
  - - [1024, 320, 1, 2048]
    - [110, 27.39]
  - - [64, 384, 1, 2048]
    - [183, 3.25]
  - - [128, 384, 1, 2048]
    - [232, 6.02]
  - - [192, 384, 1, 2048]
    - [159, 8.66]
  - - [256, 384, 1, 2048]
    - [163, 11.84]
  - - [320, 384, 1, 2048]
    - [163, 14.73]
  - - [384, 384, 1, 2048]
    - [163, 15.46]
  - - [448, 384, 1, 2048]
    - [151, 18.21]
  - - [512, 384, 1, 2048]
    - [152, 19.68]
  - - [576, 384, 1, 2048]
    - [116, 22.34]
  - - [640, 384, 1, 2048]
    - [140, 24.44]
  - - [704, 384, 1, 2048]
    - [149, 23.67]
  - - [768, 384, 1, 2048]
    - [112, 24.59]
  - - [832, 384, 1, 2048]
    - [107, 25.81]
  - - [896, 384, 1, 2048]
    - [136, 28.58]
  - - [960, 384, 1, 2048]
    - [107, 28.29]
  - - [1024, 384, 1, 2048]
    - [135, 30.82]
  - - [64, 448, 1, 2048]
    - [172, 3.15]
  - - [128, 448, 1, 2048]
    - [158, 6.8]
  - - [192, 448, 1, 2048]
    - [149, 8.08]
  - - [256, 448, 1, 2048]
    - [162, 12.97]
  - - [320, 448, 1, 2048]
    - [159, 11.81]
  - - [384, 448, 1, 2048]
    - [162, 18.1]
  - - [448, 448, 1, 2048]
    - [148, 14.09]
  - - [512, 448, 1, 2048]
    - [151, 22.67]
  - - [576, 448, 1, 2048]
    - [43, 16.9]
  - - [640, 448, 1, 2048]
    - [148, 25.39]
  - - [704, 448, 1, 2048]
    - [43, 19.26]
  - - [768, 448, 1, 2048]
    - [149, 29.1]
  - - [832, 448, 1, 2048]
    - [43, 21.52]
  - - [896, 448, 1, 2048]
    - [61, 30.77]
  - - [960, 448, 1, 2048]
    - [43, 22.44]
  - - [1024, 448, 1, 2048]
    - [87, 33.62]
  - - [64, 512, 1, 2048]
    - [233, 4.43]
  - - [128, 512, 1, 2048]
    - [232, 8.11]
  - - [192, 512, 1, 2048]
    - [162, 11.37]
  - - [256, 512, 1, 2048]
    - [229, 15.28]
  - - [320, 512, 1, 2048]
    - [158, 17.08]
  - - [384, 512, 1, 2048]
    - [158, 20.59]
  - - [448, 512, 1, 2048]
    - [158, 23.24]
  - - [512, 512, 1, 2048]
    - [112, 25.21]
  - - [576, 512, 1, 2048]
    - [108, 25.84]
  - - [640, 512, 1, 2048]
    - [134, 28.38]
  - - [704, 512, 1, 2048]
    - [108, 30.33]
  - - [768, 512, 1, 2048]
    - [108, 32.53]
  - - [832, 512, 1, 2048]
    - [107, 30.78]
  - - [896, 512, 1, 2048]
    - [60, 35.52]
  - - [960, 512, 1, 2048]
    - [107, 34.38]
  - - [1024, 512, 1, 2048]
    - [26, 37.63]
  - - [64, 576, 1, 2048]
    - [179, 4.03]
  - - [128, 576, 1, 2048]
    - [163, 8.69]
  - - [192, 576, 1, 2048]
    - [148, 10.3]
  - - [256, 576, 1, 2048]
    - [229, 15.41]
  - - [320, 576, 1, 2048]
    - [113, 12.85]
  - - [384, 576, 1, 2048]
    - [163, 22.29]
  - - [448, 576, 1, 2048]
    - [113, 16.9]
  - - [512, 576, 1, 2048]
    - [113, 25.94]
  - - [576, 576, 1, 2048]
    - [43, 20.26]
  - - [640, 576, 1, 2048]
    - [112, 32.04]
  - - [704, 576, 1, 2048]
    - [117, 22.74]
  - - [768, 576, 1, 2048]
    - [87, 33.5]
  - - [832, 576, 1, 2048]
    - [290, 24.08]
  - - [896, 576, 1, 2048]
    - [62, 38.71]
  - - [960, 576, 1, 2048]
    - [43, 24.84]
  - - [1024, 576, 1, 2048]
    - [40, 37.07]
  - - [64, 640, 1, 2048]
    - [233, 5.38]
  - - [128, 640, 1, 2048]
    - [159, 9.94]
  - - [192, 640, 1, 2048]
    - [162, 14.11]
  - - [256, 640, 1, 2048]
    - [162, 17.39]
  - - [320, 640, 1, 2048]
    - [163, 21.16]
  - - [384, 640, 1, 2048]
    - [162, 25.2]
  - - [448, 640, 1, 2048]
    - [113, 24.99]
  - - [512, 640, 1, 2048]
    - [112, 29.26]
  - - [576, 640, 1, 2048]
    - [116, 31.72]
  - - [640, 640, 1, 2048]
    - [62, 31.55]
  - - [704, 640, 1, 2048]
    - [88, 34.18]
  - - [768, 640, 1, 2048]
    - [88, 37.64]
  - - [832, 640, 1, 2048]
    - [88, 35.05]
  - - [896, 640, 1, 2048]
    - [62, 37.26]
  - - [960, 640, 1, 2048]
    - [40, 39.99]
  - - [1024, 640, 1, 2048]
    - [88, 42.03]
  - - [64, 704, 1, 2048]
    - [231, 4.86]
  - - [128, 704, 1, 2048]
    - [162, 10.42]
  - - [192, 704, 1, 2048]
    - [108, 11.67]
  - - [256, 704, 1, 2048]
    - [113, 18.49]
  - - [320, 704, 1, 2048]
    - [152, 15.65]
  - - [384, 704, 1, 2048]
    - [112, 24.31]
  - - [448, 704, 1, 2048]
    - [43, 18.84]
  - - [512, 704, 1, 2048]
    - [112, 30.45]
  - - [576, 704, 1, 2048]
    - [195, 23.28]
  - - [640, 704, 1, 2048]
    - [61, 34.14]
  - - [704, 704, 1, 2048]
    - [43, 24.75]
  - - [768, 704, 1, 2048]
    - [40, 34.96]
  - - [832, 704, 1, 2048]
    - [43, 24.49]
  - - [896, 704, 1, 2048]
    - [61, 39.64]
  - - [960, 704, 1, 2048]
    - [195, 25.78]
  - - [1024, 704, 1, 2048]
    - [88, 41.84]
  - - [64, 768, 1, 2048]
    - [233, 6.37]
  - - [128, 768, 1, 2048]
    - [163, 11.4]
  - - [192, 768, 1, 2048]
    - [163, 15.41]
  - - [256, 768, 1, 2048]
    - [135, 20.01]
  - - [320, 768, 1, 2048]
    - [116, 24.12]
  - - [384, 768, 1, 2048]
    - [112, 25.83]
  - - [448, 768, 1, 2048]
    - [113, 30.72]
  - - [512, 768, 1, 2048]
    - [112, 34.01]
  - - [576, 768, 1, 2048]
    - [42, 32.12]
  - - [640, 768, 1, 2048]
    - [26, 35.63]
  - - [704, 768, 1, 2048]
    - [40, 34.82]
  - - [768, 768, 1, 2048]
    - [40, 37.34]
  - - [832, 768, 1, 2048]
    - [40, 38.51]
  - - [896, 768, 1, 2048]
    - [59, 43.41]
  - - [960, 768, 1, 2048]
    - [200, 42.54]
  - - [1024, 768, 1, 2048]
    - [21, 45.77]
  - - [64, 832, 1, 2048]
    - [166, 5.76]
  - - [128, 832, 1, 2048]
    - [163, 12.9]
  - - [192, 832, 1, 2048]
    - [147, 12.27]
  - - [256, 832, 1, 2048]
    - [139, 21.38]
  - - [320, 832, 1, 2048]
    - [113, 17.42]
  - - [384, 832, 1, 2048]
    - [113, 28.74]
  - - [448, 832, 1, 2048]
    - [43, 22.55]
  - - [512, 832, 1, 2048]
    - [87, 31.22]
  - - [576, 832, 1, 2048]
    - [43, 24.38]
  - - [640, 832, 1, 2048]
    - [40, 35.21]
  - - [704, 832, 1, 2048]
    - [6, 24.13]
  - - [768, 832, 1, 2048]
    - [85, 39.7]
  - - [832, 832, 1, 2048]
    - [195, 26.89]
  - - [896, 832, 1, 2048]
    - [62, 46.87]
  - - [960, 832, 1, 2048]
    - [43, 27.42]
  - - [1024, 832, 1, 2048]
    - [24, 47.29]
  - - [64, 896, 1, 2048]
    - [232, 7.35]
  - - [128, 896, 1, 2048]
    - [163, 13.58]
  - - [192, 896, 1, 2048]
    - [162, 18.36]
  - - [256, 896, 1, 2048]
    - [139, 22.67]
  - - [320, 896, 1, 2048]
    - [112, 25.94]
  - - [384, 896, 1, 2048]
    - [209, 29.88]
  - - [448, 896, 1, 2048]
    - [87, 30.84]
  - - [512, 896, 1, 2048]
    - [87, 34.43]
  - - [576, 896, 1, 2048]
    - [87, 38.4]
  - - [640, 896, 1, 2048]
    - [59, 37.12]
  - - [704, 896, 1, 2048]
    - [85, 40.28]
  - - [768, 896, 1, 2048]
    - [87, 44.07]
  - - [832, 896, 1, 2048]
    - [87, 47.18]
  - - [896, 896, 1, 2048]
    - [31, 48.11]
  - - [960, 896, 1, 2048]
    - [85, 46.72]
  - - [1024, 896, 1, 2048]
    - [21, 52.58]
  - - [64, 960, 1, 2048]
    - [166, 6.3]
  - - [128, 960, 1, 2048]
    - [163, 14.17]
  - - [192, 960, 1, 2048]
    - [148, 12.98]
  - - [256, 960, 1, 2048]
    - [134, 24.5]
  - - [320, 960, 1, 2048]
    - [43, 19.21]
  - - [384, 960, 1, 2048]
    - [148, 32.02]
  - - [448, 960, 1, 2048]
    - [43, 22.66]
  - - [512, 960, 1, 2048]
    - [28, 34.69]
  - - [576, 960, 1, 2048]
    - [43, 25.5]
  - - [640, 960, 1, 2048]
    - [62, 39.35]
  - - [704, 960, 1, 2048]
    - [43, 26.82]
  - - [768, 960, 1, 2048]
    - [85, 46.31]
  - - [832, 960, 1, 2048]
    - [146, 27.69]
  - - [896, 960, 1, 2048]
    - [31, 50.93]
  - - [960, 960, 1, 2048]
    - [112, 29.75]
  - - [1024, 960, 1, 2048]
    - [23, 55.2]
  - - [64, 1024, 1, 2048]
    - [169, 8.49]
  - - [128, 1024, 1, 2048]
    - [159, 15.05]
  - - [192, 1024, 1, 2048]
    - [116, 20.3]
  - - [256, 1024, 1, 2048]
    - [163, 27.06]
  - - [320, 1024, 1, 2048]
    - [209, 29.12]
  - - [384, 1024, 1, 2048]
    - [113, 33.78]
  - - [448, 1024, 1, 2048]
    - [111, 33.59]
  - - [512, 1024, 1, 2048]
    - [27, 38.17]
  - - [576, 1024, 1, 2048]
    - [40, 37.66]
  - - [640, 1024, 1, 2048]
    - [62, 41.48]
  - - [704, 1024, 1, 2048]
    - [200, 40.73]
  - - [768, 1024, 1, 2048]
    - [24, 46.22]
  - - [832, 1024, 1, 2048]
    - [39, 41.31]
  - - [896, 1024, 1, 2048]
    - [24, 52.67]
  - - [960, 1024, 1, 2048]
    - [58, 46.83]
  - - [1024, 1024, 1, 2048]
    - [22, 60.08]
  - - [64, 64, 1, 4096]
    - [165, 0.86]
  - - [128, 64, 1, 4096]
    - [230, 1.7]
  - - [192, 64, 1, 4096]
    - [234, 2.03]
  - - [256, 64, 1, 4096]
    - [164, 3.3]
  - - [320, 64, 1, 4096]
    - [175, 4.05]
  - - [384, 64, 1, 4096]
    - [164, 4.89]
  - - [448, 64, 1, 4096]
    - [235, 4.53]
  - - [512, 64, 1, 4096]
    - [175, 6.58]
  - - [576, 64, 1, 4096]
    - [175, 7.08]
  - - [640, 64, 1, 4096]
    - [238, 7.86]
  - - [704, 64, 1, 4096]
    - [172, 6.72]
  - - [768, 64, 1, 4096]
    - [175, 9.28]
  - - [832, 64, 1, 4096]
    - [175, 10.04]
  - - [896, 64, 1, 4096]
    - [238, 11.08]
  - - [960, 64, 1, 4096]
    - [236, 8.86]
  - - [1024, 64, 1, 4096]
    - [238, 11.9]
  - - [64, 128, 1, 4096]
    - [187, 1.72]
  - - [128, 128, 1, 4096]
    - [238, 3.35]
  - - [192, 128, 1, 4096]
    - [233, 4.99]
  - - [256, 128, 1, 4096]
    - [238, 6.3]
  - - [320, 128, 1, 4096]
    - [238, 7.88]
  - - [384, 128, 1, 4096]
    - [238, 9.0]
  - - [448, 128, 1, 4096]
    - [238, 10.62]
  - - [512, 128, 1, 4096]
    - [174, 11.7]
  - - [576, 128, 1, 4096]
    - [163, 12.75]
  - - [640, 128, 1, 4096]
    - [159, 14.05]
  - - [704, 128, 1, 4096]
    - [159, 15.94]
  - - [768, 128, 1, 4096]
    - [163, 16.7]
  - - [832, 128, 1, 4096]
    - [163, 18.55]
  - - [896, 128, 1, 4096]
    - [163, 19.55]
  - - [960, 128, 1, 4096]
    - [159, 20.84]
  - - [1024, 128, 1, 4096]
    - [159, 22.61]
  - - [64, 192, 1, 4096]
    - [170, 2.05]
  - - [128, 192, 1, 4096]
    - [184, 4.9]
  - - [192, 192, 1, 4096]
    - [171, 5.51]
  - - [256, 192, 1, 4096]
    - [159, 8.73]
  - - [320, 192, 1, 4096]
    - [238, 8.1]
  - - [384, 192, 1, 4096]
    - [163, 12.83]
  - - [448, 192, 1, 4096]
    - [149, 10.49]
  - - [512, 192, 1, 4096]
    - [163, 16.98]
  - - [576, 192, 1, 4096]
    - [134, 13.27]
  - - [640, 192, 1, 4096]
    - [229, 20.96]
  - - [704, 192, 1, 4096]
    - [163, 15.2]
  - - [768, 192, 1, 4096]
    - [163, 21.9]
  - - [832, 192, 1, 4096]
    - [293, 15.51]
  - - [896, 192, 1, 4096]
    - [159, 25.17]
  - - [960, 192, 1, 4096]
    - [136, 16.52]
  - - [1024, 192, 1, 4096]
    - [159, 28.27]
  - - [64, 256, 1, 4096]
    - [183, 3.43]
  - - [128, 256, 1, 4096]
    - [169, 6.4]
  - - [192, 256, 1, 4096]
    - [125, 8.61]
  - - [256, 256, 1, 4096]
    - [159, 11.33]
  - - [320, 256, 1, 4096]
    - [159, 14.0]
  - - [384, 256, 1, 4096]
    - [159, 16.85]
  - - [448, 256, 1, 4096]
    - [159, 19.36]
  - - [512, 256, 1, 4096]
    - [159, 22.07]
  - - [576, 256, 1, 4096]
    - [159, 22.28]
  - - [640, 256, 1, 4096]
    - [159, 23.82]
  - - [704, 256, 1, 4096]
    - [151, 25.78]
  - - [768, 256, 1, 4096]
    - [116, 27.42]
  - - [832, 256, 1, 4096]
    - [159, 29.65]
  - - [896, 256, 1, 4096]
    - [160, 31.38]
  - - [960, 256, 1, 4096]
    - [151, 33.83]
  - - [1024, 256, 1, 4096]
    - [159, 36.36]
  - - [64, 320, 1, 4096]
    - [171, 4.11]
  - - [128, 320, 1, 4096]
    - [168, 7.49]
  - - [192, 320, 1, 4096]
    - [171, 8.49]
  - - [256, 320, 1, 4096]
    - [229, 14.03]
  - - [320, 320, 1, 4096]
    - [159, 17.35]
  - - [384, 320, 1, 4096]
    - [159, 20.73]
  - - [448, 320, 1, 4096]
    - [107, 15.86]
  - - [512, 320, 1, 4096]
    - [163, 24.02]
  - - [576, 320, 1, 4096]
    - [159, 26.23]
  - - [640, 320, 1, 4096]
    - [159, 28.46]
  - - [704, 320, 1, 4096]
    - [149, 19.8]
  - - [768, 320, 1, 4096]
    - [136, 32.73]
  - - [832, 320, 1, 4096]
    - [112, 31.1]
  - - [896, 320, 1, 4096]
    - [136, 34.49]
  - - [960, 320, 1, 4096]
    - [195, 22.61]
  - - [1024, 320, 1, 4096]
    - [107, 36.75]
  - - [64, 384, 1, 4096]
    - [169, 4.93]
  - - [128, 384, 1, 4096]
    - [159, 8.71]
  - - [192, 384, 1, 4096]
    - [163, 12.74]
  - - [256, 384, 1, 4096]
    - [159, 16.81]
  - - [320, 384, 1, 4096]
    - [159, 20.62]
  - - [384, 384, 1, 4096]
    - [159, 21.64]
  - - [448, 384, 1, 4096]
    - [163, 25.58]
  - - [512, 384, 1, 4096]
    - [151, 27.45]
  - - [576, 384, 1, 4096]
    - [112, 29.78]
  - - [640, 384, 1, 4096]
    - [138, 33.63]
  - - [704, 384, 1, 4096]
    - [149, 31.7]
  - - [768, 384, 1, 4096]
    - [107, 33.6]
  - - [832, 384, 1, 4096]
    - [207, 34.29]
  - - [896, 384, 1, 4096]
    - [134, 37.49]
  - - [960, 384, 1, 4096]
    - [113, 36.92]
  - - [1024, 384, 1, 4096]
    - [135, 41.34]
  - - [64, 448, 1, 4096]
    - [295, 4.53]
  - - [128, 448, 1, 4096]
    - [163, 10.13]
  - - [192, 448, 1, 4096]
    - [149, 10.62]
  - - [256, 448, 1, 4096]
    - [159, 19.8]
  - - [320, 448, 1, 4096]
    - [208, 15.28]
  - - [384, 448, 1, 4096]
    - [162, 24.84]
  - - [448, 448, 1, 4096]
    - [80, 17.68]
  - - [512, 448, 1, 4096]
    - [151, 31.25]
  - - [576, 448, 1, 4096]
    - [43, 21.3]
  - - [640, 448, 1, 4096]
    - [148, 34.41]
  - - [704, 448, 1, 4096]
    - [43, 23.02]
  - - [768, 448, 1, 4096]
    - [148, 39.3]
  - - [832, 448, 1, 4096]
    - [43, 26.73]
  - - [896, 448, 1, 4096]
    - [61, 39.23]
  - - [960, 448, 1, 4096]
    - [43, 27.93]
  - - [1024, 448, 1, 4096]
    - [29, 42.42]
  - - [64, 512, 1, 4096]
    - [169, 6.76]
  - - [128, 512, 1, 4096]
    - [159, 11.2]
  - - [192, 512, 1, 4096]
    - [163, 17.12]
  - - [256, 512, 1, 4096]
    - [162, 22.05]
  - - [320, 512, 1, 4096]
    - [159, 24.53]
  - - [384, 512, 1, 4096]
    - [158, 28.01]
  - - [448, 512, 1, 4096]
    - [159, 31.96]
  - - [512, 512, 1, 4096]
    - [112, 34.7]
  - - [576, 512, 1, 4096]
    - [108, 33.64]
  - - [640, 512, 1, 4096]
    - [107, 37.22]
  - - [704, 512, 1, 4096]
    - [108, 39.29]
  - - [768, 512, 1, 4096]
    - [107, 42.76]
  - - [832, 512, 1, 4096]
    - [200, 39.34]
  - - [896, 512, 1, 4096]
    - [62, 45.36]
  - - [960, 512, 1, 4096]
    - [62, 43.15]
  - - [1024, 512, 1, 4096]
    - [27, 48.18]
  - - [64, 576, 1, 4096]
    - [238, 7.11]
  - - [128, 576, 1, 4096]
    - [163, 12.69]
  - - [192, 576, 1, 4096]
    - [149, 13.62]
  - - [256, 576, 1, 4096]
    - [163, 21.55]
  - - [320, 576, 1, 4096]
    - [229, 26.83]
  - - [384, 576, 1, 4096]
    - [162, 30.96]
  - - [448, 576, 1, 4096]
    - [113, 21.02]
  - - [512, 576, 1, 4096]
    - [111, 34.25]
  - - [576, 576, 1, 4096]
    - [112, 38.24]
  - - [640, 576, 1, 4096]
    - [113, 42.48]
  - - [704, 576, 1, 4096]
    - [43, 27.64]
  - - [768, 576, 1, 4096]
    - [194, 41.22]
  - - [832, 576, 1, 4096]
    - [113, 42.76]
  - - [896, 576, 1, 4096]
    - [62, 48.73]
  - - [960, 576, 1, 4096]
    - [290, 29.86]
  - - [1024, 576, 1, 4096]
    - [87, 46.2]
  - - [64, 640, 1, 4096]
    - [233, 7.95]
  - - [128, 640, 1, 4096]
    - [163, 14.48]
  - - [192, 640, 1, 4096]
    - [163, 21.26]
  - - [256, 640, 1, 4096]
    - [163, 24.07]
  - - [320, 640, 1, 4096]
    - [228, 28.98]
  - - [384, 640, 1, 4096]
    - [162, 33.92]
  - - [448, 640, 1, 4096]
    - [209, 33.94]
  - - [512, 640, 1, 4096]
    - [112, 38.38]
  - - [576, 640, 1, 4096]
    - [209, 41.03]
  - - [640, 640, 1, 4096]
    - [88, 41.13]
  - - [704, 640, 1, 4096]
    - [88, 44.72]
  - - [768, 640, 1, 4096]
    - [88, 48.14]
  - - [832, 640, 1, 4096]
    - [87, 44.92]
  - - [896, 640, 1, 4096]
    - [87, 46.47]
  - - [960, 640, 1, 4096]
    - [88, 49.21]
  - - [1024, 640, 1, 4096]
    - [88, 53.08]
  - - [64, 704, 1, 4096]
    - [235, 6.69]
  - - [128, 704, 1, 4096]
    - [229, 15.28]
  - - [192, 704, 1, 4096]
    - [159, 15.13]
  - - [256, 704, 1, 4096]
    - [228, 25.66]
  - - [320, 704, 1, 4096]
    - [148, 19.63]
  - - [384, 704, 1, 4096]
    - [136, 31.76]
  - - [448, 704, 1, 4096]
    - [43, 23.62]
  - - [512, 704, 1, 4096]
    - [208, 40.52]
  - - [576, 704, 1, 4096]
    - [43, 28.38]
  - - [640, 704, 1, 4096]
    - [61, 45.1]
  - - [704, 704, 1, 4096]
    - [43, 30.48]
  - - [768, 704, 1, 4096]
    - [40, 44.17]
  - - [832, 704, 1, 4096]
    - [43, 28.31]
  - - [896, 704, 1, 4096]
    - [62, 49.51]
  - - [960, 704, 1, 4096]
    - [43, 30.14]
  - - [1024, 704, 1, 4096]
    - [86, 51.13]
  - - [64, 768, 1, 4096]
    - [169, 9.65]
  - - [128, 768, 1, 4096]
    - [163, 16.78]
  - - [192, 768, 1, 4096]
    - [159, 22.19]
  - - [256, 768, 1, 4096]
    - [116, 27.0]
  - - [320, 768, 1, 4096]
    - [116, 32.9]
  - - [384, 768, 1, 4096]
    - [208, 34.25]
  - - [448, 768, 1, 4096]
    - [113, 39.11]
  - - [512, 768, 1, 4096]
    - [113, 43.77]
  - - [576, 768, 1, 4096]
    - [199, 40.5]
  - - [640, 768, 1, 4096]
    - [62, 49.22]
  - - [704, 768, 1, 4096]
    - [40, 43.21]
  - - [768, 768, 1, 4096]
    - [40, 45.56]
  - - [832, 768, 1, 4096]
    - [40, 47.6]
  - - [896, 768, 1, 4096]
    - [61, 54.53]
  - - [960, 768, 1, 4096]
    - [199, 54.05]
  - - [1024, 768, 1, 4096]
    - [21, 56.03]
  - - [64, 832, 1, 4096]
    - [233, 9.93]
  - - [128, 832, 1, 4096]
    - [163, 18.68]
  - - [192, 832, 1, 4096]
    - [163, 15.53]
  - - [256, 832, 1, 4096]
    - [135, 29.29]
  - - [320, 832, 1, 4096]
    - [208, 31.07]
  - - [384, 832, 1, 4096]
    - [112, 37.51]
  - - [448, 832, 1, 4096]
    - [43, 27.2]
  - - [512, 832, 1, 4096]
    - [87, 40.14]
  - - [576, 832, 1, 4096]
    - [86, 43.81]
  - - [640, 832, 1, 4096]
    - [61, 43.72]
  - - [704, 832, 1, 4096]
    - [43, 29.02]
  - - [768, 832, 1, 4096]
    - [87, 50.06]
  - - [832, 832, 1, 4096]
    - [88, 52.82]
  - - [896, 832, 1, 4096]
    - [60, 56.91]
  - - [960, 832, 1, 4096]
    - [43, 32.18]
  - - [1024, 832, 1, 4096]
    - [21, 60.09]
  - - [64, 896, 1, 4096]
    - [233, 10.98]
  - - [128, 896, 1, 4096]
    - [159, 19.52]
  - - [192, 896, 1, 4096]
    - [163, 25.47]
  - - [256, 896, 1, 4096]
    - [149, 31.57]
  - - [320, 896, 1, 4096]
    - [112, 33.47]
  - - [384, 896, 1, 4096]
    - [112, 37.56]
  - - [448, 896, 1, 4096]
    - [88, 39.01]
  - - [512, 896, 1, 4096]
    - [87, 44.86]
  - - [576, 896, 1, 4096]
    - [87, 49.45]
  - - [640, 896, 1, 4096]
    - [88, 46.28]
  - - [704, 896, 1, 4096]
    - [88, 51.0]
  - - [768, 896, 1, 4096]
    - [88, 54.4]
  - - [832, 896, 1, 4096]
    - [85, 56.84]
  - - [896, 896, 1, 4096]
    - [31, 58.3]
  - - [960, 896, 1, 4096]
    - [88, 54.29]
  - - [1024, 896, 1, 4096]
    - [21, 64.64]
  - - [64, 960, 1, 4096]
    - [231, 9.17]
  - - [128, 960, 1, 4096]
    - [163, 20.67]
  - - [192, 960, 1, 4096]
    - [149, 16.41]
  - - [256, 960, 1, 4096]
    - [140, 34.27]
  - - [320, 960, 1, 4096]
    - [43, 22.72]
  - - [384, 960, 1, 4096]
    - [148, 41.46]
  - - [448, 960, 1, 4096]
    - [43, 27.49]
  - - [512, 960, 1, 4096]
    - [29, 44.92]
  - - [576, 960, 1, 4096]
    - [117, 29.68]
  - - [640, 960, 1, 4096]
    - [87, 48.73]
  - - [704, 960, 1, 4096]
    - [117, 31.17]
  - - [768, 960, 1, 4096]
    - [84, 55.49]
  - - [832, 960, 1, 4096]
    - [195, 32.44]
  - - [896, 960, 1, 4096]
    - [24, 59.62]
  - - [960, 960, 1, 4096]
    - [287, 34.39]
  - - [1024, 960, 1, 4096]
    - [21, 64.99]
  - - [64, 1024, 1, 4096]
    - [233, 12.29]
  - - [128, 1024, 1, 4096]
    - [229, 22.28]
  - - [192, 1024, 1, 4096]
    - [163, 28.6]
  - - [256, 1024, 1, 4096]
    - [163, 35.89]
  - - [320, 1024, 1, 4096]
    - [113, 37.49]
  - - [384, 1024, 1, 4096]
    - [209, 42.82]
  - - [448, 1024, 1, 4096]
    - [199, 42.35]
  - - [512, 1024, 1, 4096]
    - [27, 49.23]
  - - [576, 1024, 1, 4096]
    - [40, 46.05]
  - - [640, 1024, 1, 4096]
    - [62, 52.22]
  - - [704, 1024, 1, 4096]
    - [60, 51.56]
  - - [768, 1024, 1, 4096]
    - [21, 56.13]
  - - [832, 1024, 1, 4096]
    - [197, 50.86]
  - - [896, 1024, 1, 4096]
    - [19, 64.71]
  - - [960, 1024, 1, 4096]
    - [197, 57.17]
  - - [1024, 1024, 1, 4096]
    - [112, 37.61]
  - - [1088, 64, 1, 64]
    - [45, 0.41]
  - - [1216, 64, 1, 64]
    - [104, 0.43]
  - - [1344, 64, 1, 64]
    - [117, 0.47]
  - - [1472, 64, 1, 64]
    - [242, 0.52]
  - - [1600, 64, 1, 64]
    - [104, 0.57]
  - - [1728, 64, 1, 64]
    - [117, 0.64]
  - - [1856, 64, 1, 64]
    - [369, 0.67]
  - - [1984, 64, 1, 64]
    - [103, 0.71]
  - - [1088, 192, 1, 64]
    - [117, 1.15]
  - - [1216, 192, 1, 64]
    - [6, 1.26]
  - - [1344, 192, 1, 64]
    - [245, 1.34]
  - - [1472, 192, 1, 64]
    - [6, 1.49]
  - - [1600, 192, 1, 64]
    - [33, 1.53]
  - - [1728, 192, 1, 64]
    - [43, 1.64]
  - - [1856, 192, 1, 64]
    - [43, 1.77]
  - - [1984, 192, 1, 64]
    - [141, 1.86]
  - - [1088, 320, 1, 64]
    - [117, 1.7]
  - - [1216, 320, 1, 64]
    - [247, 1.87]
  - - [1344, 320, 1, 64]
    - [43, 1.98]
  - - [1472, 320, 1, 64]
    - [43, 2.13]
  - - [1600, 320, 1, 64]
    - [116, 2.23]
  - - [1728, 320, 1, 64]
    - [248, 2.38]
  - - [1856, 320, 1, 64]
    - [371, 2.47]
  - - [1984, 320, 1, 64]
    - [43, 2.68]
  - - [1088, 448, 1, 64]
    - [250, 2.12]
  - - [1216, 448, 1, 64]
    - [109, 2.35]
  - - [1344, 448, 1, 64]
    - [94, 2.47]
  - - [1472, 448, 1, 64]
    - [6, 2.68]
  - - [1600, 448, 1, 64]
    - [206, 2.83]
  - - [1728, 448, 1, 64]
    - [37, 3.19]
  - - [1856, 448, 1, 64]
    - [251, 3.3]
  - - [1984, 448, 1, 64]
    - [113, 3.48]
  - - [1088, 576, 1, 64]
    - [374, 2.54]
  - - [1216, 576, 1, 64]
    - [89, 2.95]
  - - [1344, 576, 1, 64]
    - [116, 3.02]
  - - [1472, 576, 1, 64]
    - [115, 3.38]
  - - [1600, 576, 1, 64]
    - [375, 3.71]
  - - [1728, 576, 1, 64]
    - [113, 3.79]
  - - [1856, 576, 1, 64]
    - [37, 3.91]
  - - [1984, 576, 1, 64]
    - [251, 3.81]
  - - [1088, 704, 1, 64]
    - [35, 3.13]
  - - [1216, 704, 1, 64]
    - [113, 3.4]
  - - [1344, 704, 1, 64]
    - [112, 3.84]
  - - [1472, 704, 1, 64]
    - [112, 3.75]
  - - [1600, 704, 1, 64]
    - [115, 4.12]
  - - [1728, 704, 1, 64]
    - [255, 4.12]
  - - [1856, 704, 1, 64]
    - [255, 4.45]
  - - [1984, 704, 1, 64]
    - [256, 4.79]
  - - [1088, 832, 1, 64]
    - [116, 3.69]
  - - [1216, 832, 1, 64]
    - [112, 3.69]
  - - [1344, 832, 1, 64]
    - [35, 3.92]
  - - [1472, 832, 1, 64]
    - [259, 4.22]
  - - [1600, 832, 1, 64]
    - [262, 4.45]
  - - [1728, 832, 1, 64]
    - [261, 4.79]
  - - [1856, 832, 1, 64]
    - [260, 5.16]
  - - [1984, 832, 1, 64]
    - [87, 5.29]
  - - [1088, 960, 1, 64]
    - [37, 3.81]
  - - [1216, 960, 1, 64]
    - [262, 3.91]
  - - [1344, 960, 1, 64]
    - [263, 4.26]
  - - [1472, 960, 1, 64]
    - [262, 4.67]
  - - [1600, 960, 1, 64]
    - [260, 4.91]
  - - [1728, 960, 1, 64]
    - [75, 5.31]
  - - [1856, 960, 1, 64]
    - [74, 5.66]
  - - [1984, 960, 1, 64]
    - [264, 5.72]
  - - [64, 1088, 1, 64]
    - [243, 0.4]
  - - [192, 1088, 1, 64]
    - [117, 1.14]
  - - [320, 1088, 1, 64]
    - [43, 1.75]
  - - [448, 1088, 1, 64]
    - [89, 2.32]
  - - [576, 1088, 1, 64]
    - [371, 2.57]
  - - [704, 1088, 1, 64]
    - [35, 3.15]
  - - [832, 1088, 1, 64]
    - [115, 3.52]
  - - [960, 1088, 1, 64]
    - [37, 3.73]
  - - [1088, 1088, 1, 64]
    - [116, 4.16]
  - - [1216, 1088, 1, 64]
    - [319, 4.47]
  - - [1344, 1088, 1, 64]
    - [260, 4.95]
  - - [1472, 1088, 1, 64]
    - [315, 5.17]
  - - [1600, 1088, 1, 64]
    - [281, 5.74]
  - - [1728, 1088, 1, 64]
    - [88, 6.02]
  - - [1856, 1088, 1, 64]
    - [267, 6.13]
  - - [1984, 1088, 1, 64]
    - [281, 5.66]
  - - [64, 1216, 1, 64]
    - [269, 0.44]
  - - [192, 1216, 1, 64]
    - [115, 1.26]
  - - [320, 1216, 1, 64]
    - [43, 1.91]
  - - [448, 1216, 1, 64]
    - [84, 2.44]
  - - [576, 1216, 1, 64]
    - [15, 2.98]
  - - [704, 1216, 1, 64]
    - [270, 3.4]
  - - [832, 1216, 1, 64]
    - [89, 3.77]
  - - [960, 1216, 1, 64]
    - [262, 4.03]
  - - [1088, 1216, 1, 64]
    - [326, 4.55]
  - - [1216, 1216, 1, 64]
    - [256, 4.96]
  - - [1344, 1216, 1, 64]
    - [86, 5.28]
  - - [1472, 1216, 1, 64]
    - [266, 5.74]
  - - [1600, 1216, 1, 64]
    - [267, 5.93]
  - - [1728, 1216, 1, 64]
    - [266, 5.92]
  - - [1856, 1216, 1, 64]
    - [277, 5.59]
  - - [1984, 1216, 1, 64]
    - [84, 5.83]
  - - [64, 1344, 1, 64]
    - [380, 0.48]
  - - [192, 1344, 1, 64]
    - [117, 1.39]
  - - [320, 1344, 1, 64]
    - [43, 2.06]
  - - [448, 1344, 1, 64]
    - [257, 2.48]
  - - [576, 1344, 1, 64]
    - [37, 3.19]
  - - [704, 1344, 1, 64]
    - [116, 3.65]
  - - [832, 1344, 1, 64]
    - [115, 4.09]
  - - [960, 1344, 1, 64]
    - [260, 4.49]
  - - [1088, 1344, 1, 64]
    - [259, 4.87]
  - - [1216, 1344, 1, 64]
    - [265, 5.39]
  - - [1344, 1344, 1, 64]
    - [85, 5.9]
  - - [1472, 1344, 1, 64]
    - [334, 5.98]
  - - [1600, 1344, 1, 64]
    - [334, 6.54]
  - - [1728, 1344, 1, 64]
    - [267, 5.74]
  - - [1856, 1344, 1, 64]
    - [271, 6.23]
  - - [1984, 1344, 1, 64]
    - [89, 6.22]
  - - [64, 1472, 1, 64]
    - [105, 0.53]
  - - [192, 1472, 1, 64]
    - [115, 1.45]
  - - [320, 1472, 1, 64]
    - [89, 2.25]
  - - [448, 1472, 1, 64]
    - [273, 2.78]
  - - [576, 1472, 1, 64]
    - [251, 3.39]
  - - [704, 1472, 1, 64]
    - [112, 3.74]
  - - [832, 1472, 1, 64]
    - [274, 4.13]
  - - [960, 1472, 1, 64]
    - [275, 4.7]
  - - [1088, 1472, 1, 64]
    - [275, 5.35]
  - - [1216, 1472, 1, 64]
    - [87, 5.82]
  - - [1344, 1472, 1, 64]
    - [267, 5.96]
  - - [1472, 1472, 1, 64]
    - [268, 5.69]
  - - [1600, 1472, 1, 64]
    - [271, 5.9]
  - - [1728, 1472, 1, 64]
    - [73, 6.15]
  - - [1856, 1472, 1, 64]
    - [89, 6.35]
  - - [1984, 1472, 1, 64]
    - [74, 6.52]
  - - [64, 1600, 1, 64]
    - [6, 0.58]
  - - [192, 1600, 1, 64]
    - [35, 1.57]
  - - [320, 1600, 1, 64]
    - [86, 2.31]
  - - [448, 1600, 1, 64]
    - [84, 3.0]
  - - [576, 1600, 1, 64]
    - [258, 3.63]
  - - [704, 1600, 1, 64]
    - [35, 4.08]
  - - [832, 1600, 1, 64]
    - [259, 4.44]
  - - [960, 1600, 1, 64]
    - [265, 5.09]
  - - [1088, 1600, 1, 64]
    - [261, 5.63]
  - - [1216, 1600, 1, 64]
    - [334, 5.95]
  - - [1344, 1600, 1, 64]
    - [334, 6.53]
  - - [1472, 1600, 1, 64]
    - [272, 5.86]
  - - [1600, 1600, 1, 64]
    - [278, 6.35]
  - - [1728, 1600, 1, 64]
    - [89, 6.5]
  - - [1856, 1600, 1, 64]
    - [277, 6.73]
  - - [1984, 1600, 1, 64]
    - [89, 6.76]
  - - [64, 1728, 1, 64]
    - [283, 0.61]
  - - [192, 1728, 1, 64]
    - [43, 1.57]
  - - [320, 1728, 1, 64]
    - [15, 2.46]
  - - [448, 1728, 1, 64]
    - [89, 3.25]
  - - [576, 1728, 1, 64]
    - [116, 3.93]
  - - [704, 1728, 1, 64]
    - [255, 4.08]
  - - [832, 1728, 1, 64]
    - [256, 4.75]
  - - [960, 1728, 1, 64]
    - [263, 5.38]
  - - [1088, 1728, 1, 64]
    - [85, 5.92]
  - - [1216, 1728, 1, 64]
    - [288, 5.97]
  - - [1344, 1728, 1, 64]
    - [267, 5.78]
  - - [1472, 1728, 1, 64]
    - [93, 6.2]
  - - [1600, 1728, 1, 64]
    - [279, 6.39]
  - - [1728, 1728, 1, 64]
    - [288, 6.74]
  - - [1856, 1728, 1, 64]
    - [278, 6.78]
  - - [1984, 1728, 1, 64]
    - [93, 7.2]
  - - [64, 1856, 1, 64]
    - [32, 0.68]
  - - [192, 1856, 1, 64]
    - [43, 1.78]
  - - [320, 1856, 1, 64]
    - [381, 2.56]
  - - [448, 1856, 1, 64]
    - [113, 3.42]
  - - [576, 1856, 1, 64]
    - [37, 3.9]
  - - [704, 1856, 1, 64]
    - [261, 4.49]
  - - [832, 1856, 1, 64]
    - [265, 5.16]
  - - [960, 1856, 1, 64]
    - [84, 5.7]
  - - [1088, 1856, 1, 64]
    - [87, 6.36]
  - - [1216, 1856, 1, 64]
    - [87, 5.81]
  - - [1344, 1856, 1, 64]
    - [277, 6.19]
  - - [1472, 1856, 1, 64]
    - [89, 6.32]
  - - [1600, 1856, 1, 64]
    - [351, 6.87]
  - - [1728, 1856, 1, 64]
    - [347, 6.8]
  - - [1856, 1856, 1, 64]
    - [347, 7.34]
  - - [1984, 1856, 1, 64]
    - [282, 7.23]
  - - [64, 1984, 1, 64]
    - [205, 0.71]
  - - [192, 1984, 1, 64]
    - [35, 1.85]
  - - [320, 1984, 1, 64]
    - [76, 2.64]
  - - [448, 1984, 1, 64]
    - [116, 3.51]
  - - [576, 1984, 1, 64]
    - [263, 3.98]
  - - [704, 1984, 1, 64]
    - [275, 4.74]
  - - [832, 1984, 1, 64]
    - [274, 5.33]
  - - [960, 1984, 1, 64]
    - [267, 5.81]
  - - [1088, 1984, 1, 64]
    - [84, 6.09]
  - - [1216, 1984, 1, 64]
    - [84, 5.99]
  - - [1344, 1984, 1, 64]
    - [72, 6.47]
  - - [1472, 1984, 1, 64]
    - [87, 6.55]
  - - [1600, 1984, 1, 64]
    - [89, 6.88]
  - - [1728, 1984, 1, 64]
    - [72, 7.14]
  - - [1856, 1984, 1, 64]
    - [351, 7.18]
  - - [1984, 1984, 1, 64]
    - [353, 7.4]
  - - [1088, 64, 1, 256]
    - [126, 1.51]
  - - [1216, 64, 1, 256]
    - [111, 1.54]
  - - [1344, 64, 1, 256]
    - [113, 1.69]
  - - [1472, 64, 1, 256]
    - [111, 1.85]
  - - [1600, 64, 1, 256]
    - [112, 2.05]
  - - [1728, 64, 1, 256]
    - [112, 2.17]
  - - [1856, 64, 1, 256]
    - [111, 2.33]
  - - [1984, 64, 1, 256]
    - [208, 2.54]
  - - [1088, 192, 1, 256]
    - [209, 3.72]
  - - [1216, 192, 1, 256]
    - [43, 4.33]
  - - [1344, 192, 1, 256]
    - [111, 4.77]
  - - [1472, 192, 1, 256]
    - [111, 5.08]
  - - [1600, 192, 1, 256]
    - [6, 5.21]
  - - [1728, 192, 1, 256]
    - [117, 5.63]
  - - [1856, 192, 1, 256]
    - [117, 5.78]
  - - [1984, 192, 1, 256]
    - [43, 6.46]
  - - [1088, 320, 1, 256]
    - [43, 5.62]
  - - [1216, 320, 1, 256]
    - [43, 6.48]
  - - [1344, 320, 1, 256]
    - [43, 6.66]
  - - [1472, 320, 1, 256]
    - [43, 7.24]
  - - [1600, 320, 1, 256]
    - [43, 7.56]
  - - [1728, 320, 1, 256]
    - [117, 8.05]
  - - [1856, 320, 1, 256]
    - [6, 8.15]
  - - [1984, 320, 1, 256]
    - [117, 8.41]
  - - [1088, 448, 1, 256]
    - [117, 7.46]
  - - [1216, 448, 1, 256]
    - [43, 7.8]
  - - [1344, 448, 1, 256]
    - [43, 8.38]
  - - [1472, 448, 1, 256]
    - [117, 8.96]
  - - [1600, 448, 1, 256]
    - [287, 9.19]
  - - [1728, 448, 1, 256]
    - [146, 9.51]
  - - [1856, 448, 1, 256]
    - [146, 10.18]
  - - [1984, 448, 1, 256]
    - [115, 10.87]
  - - [1088, 576, 1, 256]
    - [43, 8.42]
  - - [1216, 576, 1, 256]
    - [43, 9.19]
  - - [1344, 576, 1, 256]
    - [111, 9.52]
  - - [1472, 576, 1, 256]
    - [112, 10.73]
  - - [1600, 576, 1, 256]
    - [112, 11.37]
  - - [1728, 576, 1, 256]
    - [111, 12.12]
  - - [1856, 576, 1, 256]
    - [111, 13.15]
  - - [1984, 576, 1, 256]
    - [112, 11.51]
  - - [1088, 704, 1, 256]
    - [116, 9.39]
  - - [1216, 704, 1, 256]
    - [111, 10.58]
  - - [1344, 704, 1, 256]
    - [113, 12.04]
  - - [1472, 704, 1, 256]
    - [112, 12.68]
  - - [1600, 704, 1, 256]
    - [116, 12.03]
  - - [1728, 704, 1, 256]
    - [111, 12.01]
  - - [1856, 704, 1, 256]
    - [278, 12.27]
  - - [1984, 704, 1, 256]
    - [154, 13.25]
  - - [1088, 832, 1, 256]
    - [112, 11.39]
  - - [1216, 832, 1, 256]
    - [111, 12.44]
  - - [1344, 832, 1, 256]
    - [113, 13.66]
  - - [1472, 832, 1, 256]
    - [112, 12.12]
  - - [1600, 832, 1, 256]
    - [154, 12.6]
  - - [1728, 832, 1, 256]
    - [276, 13.46]
  - - [1856, 832, 1, 256]
    - [154, 14.37]
  - - [1984, 832, 1, 256]
    - [87, 15.18]
  - - [1088, 960, 1, 256]
    - [112, 12.76]
  - - [1216, 960, 1, 256]
    - [111, 11.78]
  - - [1344, 960, 1, 256]
    - [154, 12.12]
  - - [1472, 960, 1, 256]
    - [154, 13.31]
  - - [1600, 960, 1, 256]
    - [156, 14.41]
  - - [1728, 960, 1, 256]
    - [156, 15.53]
  - - [1856, 960, 1, 256]
    - [84, 16.78]
  - - [1984, 960, 1, 256]
    - [288, 17.72]
  - - [64, 1088, 1, 256]
    - [126, 1.5]
  - - [192, 1088, 1, 256]
    - [147, 3.96]
  - - [320, 1088, 1, 256]
    - [43, 5.74]
  - - [448, 1088, 1, 256]
    - [89, 7.32]
  - - [576, 1088, 1, 256]
    - [43, 8.45]
  - - [704, 1088, 1, 256]
    - [6, 9.6]
  - - [832, 1088, 1, 256]
    - [111, 11.25]
  - - [960, 1088, 1, 256]
    - [116, 13.05]
  - - [1088, 1088, 1, 256]
    - [112, 12.75]
  - - [1216, 1088, 1, 256]
    - [93, 12.6]
  - - [1344, 1088, 1, 256]
    - [85, 13.69]
  - - [1472, 1088, 1, 256]
    - [85, 15.13]
  - - [1600, 1088, 1, 256]
    - [154, 16.38]
  - - [1728, 1088, 1, 256]
    - [154, 17.68]
  - - [1856, 1088, 1, 256]
    - [87, 18.74]
  - - [1984, 1088, 1, 256]
    - [43, 16.28]
  - - [64, 1216, 1, 256]
    - [148, 1.61]
  - - [192, 1216, 1, 256]
    - [43, 4.37]
  - - [320, 1216, 1, 256]
    - [117, 6.63]
  - - [448, 1216, 1, 256]
    - [117, 8.11]
  - - [576, 1216, 1, 256]
    - [89, 9.07]
  - - [704, 1216, 1, 256]
    - [116, 10.82]
  - - [832, 1216, 1, 256]
    - [113, 12.49]
  - - [960, 1216, 1, 256]
    - [111, 11.89]
  - - [1088, 1216, 1, 256]
    - [155, 12.63]
  - - [1216, 1216, 1, 256]
    - [87, 13.79]
  - - [1344, 1216, 1, 256]
    - [154, 15.27]
  - - [1472, 1216, 1, 256]
    - [84, 16.82]
  - - [1600, 1216, 1, 256]
    - [154, 18.03]
  - - [1728, 1216, 1, 256]
    - [85, 17.17]
  - - [1856, 1216, 1, 256]
    - [84, 16.58]
  - - [1984, 1216, 1, 256]
    - [87, 17.6]
  - - [64, 1344, 1, 256]
    - [112, 1.8]
  - - [192, 1344, 1, 256]
    - [147, 4.61]
  - - [320, 1344, 1, 256]
    - [43, 6.7]
  - - [448, 1344, 1, 256]
    - [117, 8.07]
  - - [576, 1344, 1, 256]
    - [15, 9.92]
  - - [704, 1344, 1, 256]
    - [112, 11.62]
  - - [832, 1344, 1, 256]
    - [116, 13.68]
  - - [960, 1344, 1, 256]
    - [15, 12.29]
  - - [1088, 1344, 1, 256]
    - [155, 14.06]
  - - [1216, 1344, 1, 256]
    - [87, 15.42]
  - - [1344, 1344, 1, 256]
    - [83, 17.11]
  - - [1472, 1344, 1, 256]
    - [88, 18.45]
  - - [1600, 1344, 1, 256]
    - [85, 19.88]
  - - [1728, 1344, 1, 256]
    - [87, 17.16]
  - - [1856, 1344, 1, 256]
    - [86, 18.21]
  - - [1984, 1344, 1, 256]
    - [85, 17.96]
  - - [64, 1472, 1, 256]
    - [147, 1.89]
  - - [192, 1472, 1, 256]
    - [43, 5.12]
  - - [320, 1472, 1, 256]
    - [89, 7.47]
  - - [448, 1472, 1, 256]
    - [43, 8.76]
  - - [576, 1472, 1, 256]
    - [146, 10.46]
  - - [704, 1472, 1, 256]
    - [113, 13.08]
  - - [832, 1472, 1, 256]
    - [113, 12.25]
  - - [960, 1472, 1, 256]
    - [154, 13.4]
  - - [1088, 1472, 1, 256]
    - [155, 15.12]
  - - [1216, 1472, 1, 256]
    - [85, 16.69]
  - - [1344, 1472, 1, 256]
    - [84, 18.5]
  - - [1472, 1472, 1, 256]
    - [155, 16.33]
  - - [1600, 1472, 1, 256]
    - [87, 16.74]
  - - [1728, 1472, 1, 256]
    - [87, 17.1]
  - - [1856, 1472, 1, 256]
    - [87, 18.23]
  - - [1984, 1472, 1, 256]
    - [87, 19.56]
  - - [64, 1600, 1, 256]
    - [113, 2.1]
  - - [192, 1600, 1, 256]
    - [43, 5.35]
  - - [320, 1600, 1, 256]
    - [154, 7.8]
  - - [448, 1600, 1, 256]
    - [89, 9.29]
  - - [576, 1600, 1, 256]
    - [112, 11.56]
  - - [704, 1600, 1, 256]
    - [111, 12.62]
  - - [832, 1600, 1, 256]
    - [154, 12.51]
  - - [960, 1600, 1, 256]
    - [155, 14.49]
  - - [1088, 1600, 1, 256]
    - [83, 16.58]
  - - [1216, 1600, 1, 256]
    - [84, 18.03]
  - - [1344, 1600, 1, 256]
    - [85, 20.37]
  - - [1472, 1600, 1, 256]
    - [87, 17.21]
  - - [1600, 1600, 1, 256]
    - [83, 17.34]
  - - [1728, 1600, 1, 256]
    - [84, 18.72]
  - - [1856, 1600, 1, 256]
    - [84, 19.81]
  - - [1984, 1600, 1, 256]
    - [85, 19.67]
  - - [64, 1728, 1, 256]
    - [148, 2.28]
  - - [192, 1728, 1, 256]
    - [43, 5.73]
  - - [320, 1728, 1, 256]
    - [6, 8.1]
  - - [448, 1728, 1, 256]
    - [154, 10.16]
  - - [576, 1728, 1, 256]
    - [113, 12.26]
  - - [704, 1728, 1, 256]
    - [113, 11.95]
  - - [832, 1728, 1, 256]
    - [154, 13.54]
  - - [960, 1728, 1, 256]
    - [88, 15.46]
  - - [1088, 1728, 1, 256]
    - [83, 17.35]
  - - [1216, 1728, 1, 256]
    - [154, 17.38]
  - - [1344, 1728, 1, 256]
    - [87, 17.04]
  - - [1472, 1728, 1, 256]
    - [83, 17.09]
  - - [1600, 1728, 1, 256]
    - [83, 18.58]
  - - [1728, 1728, 1, 256]
    - [88, 19.89]
  - - [1856, 1728, 1, 256]
    - [87, 19.71]
  - - [1984, 1728, 1, 256]
    - [1, 19.8]
  - - [64, 1856, 1, 256]
    - [148, 2.46]
  - - [192, 1856, 1, 256]
    - [153, 5.92]
  - - [320, 1856, 1, 256]
    - [15, 8.17]
  - - [448, 1856, 1, 256]
    - [163, 10.25]
  - - [576, 1856, 1, 256]
    - [112, 13.05]
  - - [704, 1856, 1, 256]
    - [86, 12.35]
  - - [832, 1856, 1, 256]
    - [94, 14.48]
  - - [960, 1856, 1, 256]
    - [83, 16.38]
  - - [1088, 1856, 1, 256]
    - [86, 18.7]
  - - [1216, 1856, 1, 256]
    - [154, 16.92]
  - - [1344, 1856, 1, 256]
    - [87, 18.24]
  - - [1472, 1856, 1, 256]
    - [83, 18.41]
  - - [1600, 1856, 1, 256]
    - [84, 20.01]
  - - [1728, 1856, 1, 256]
    - [1, 19.97]
  - - [1856, 1856, 1, 256]
    - [85, 21.25]
  - - [1984, 1856, 1, 256]
    - [83, 21.05]
  - - [64, 1984, 1, 256]
    - [147, 2.55]
  - - [192, 1984, 1, 256]
    - [117, 6.36]
  - - [320, 1984, 1, 256]
    - [117, 8.72]
  - - [448, 1984, 1, 256]
    - [111, 11.04]
  - - [576, 1984, 1, 256]
    - [116, 11.33]
  - - [704, 1984, 1, 256]
    - [156, 13.27]
  - - [832, 1984, 1, 256]
    - [276, 15.38]
  - - [960, 1984, 1, 256]
    - [85, 17.73]
  - - [1088, 1984, 1, 256]
    - [88, 17.34]
  - - [1216, 1984, 1, 256]
    - [87, 16.28]
  - - [1344, 1984, 1, 256]
    - [84, 18.01]
  - - [1472, 1984, 1, 256]
    - [1, 18.64]
  - - [1600, 1984, 1, 256]
    - [87, 19.53]
  - - [1728, 1984, 1, 256]
    - [1, 21.31]
  - - [1856, 1984, 1, 256]
    - [85, 20.95]
  - - [1984, 1984, 1, 256]
    - [85, 20.63]
  - - [1088, 64, 1, 512]
    - [171, 2.72]
  - - [1216, 64, 1, 512]
    - [126, 2.88]
  - - [1344, 64, 1, 512]
    - [185, 3.01]
  - - [1472, 64, 1, 512]
    - [112, 3.44]
  - - [1600, 64, 1, 512]
    - [159, 3.58]
  - - [1728, 64, 1, 512]
    - [111, 3.88]
  - - [1856, 64, 1, 512]
    - [112, 4.15]
  - - [1984, 64, 1, 512]
    - [134, 4.48]
  - - [1088, 192, 1, 512]
    - [43, 6.65]
  - - [1216, 192, 1, 512]
    - [43, 7.39]
  - - [1344, 192, 1, 512]
    - [43, 8.1]
  - - [1472, 192, 1, 512]
    - [43, 8.21]
  - - [1600, 192, 1, 512]
    - [43, 8.93]
  - - [1728, 192, 1, 512]
    - [117, 9.44]
  - - [1856, 192, 1, 512]
    - [43, 9.89]
  - - [1984, 192, 1, 512]
    - [43, 10.94]
  - - [1088, 320, 1, 512]
    - [43, 9.62]
  - - [1216, 320, 1, 512]
    - [43, 10.87]
  - - [1344, 320, 1, 512]
    - [117, 11.17]
  - - [1472, 320, 1, 512]
    - [43, 11.82]
  - - [1600, 320, 1, 512]
    - [6, 12.65]
  - - [1728, 320, 1, 512]
    - [6, 12.61]
  - - [1856, 320, 1, 512]
    - [43, 12.96]
  - - [1984, 320, 1, 512]
    - [43, 13.98]
  - - [1088, 448, 1, 512]
    - [43, 12.32]
  - - [1216, 448, 1, 512]
    - [6, 12.8]
  - - [1344, 448, 1, 512]
    - [43, 13.68]
  - - [1472, 448, 1, 512]
    - [6, 14.07]
  - - [1600, 448, 1, 512]
    - [43, 14.08]
  - - [1728, 448, 1, 512]
    - [150, 15.24]
  - - [1856, 448, 1, 512]
    - [150, 15.86]
  - - [1984, 448, 1, 512]
    - [116, 16.54]
  - - [1088, 576, 1, 512]
    - [117, 13.7]
  - - [1216, 576, 1, 512]
    - [89, 14.73]
  - - [1344, 576, 1, 512]
    - [43, 15.14]
  - - [1472, 576, 1, 512]
    - [115, 15.89]
  - - [1600, 576, 1, 512]
    - [112, 17.81]
  - - [1728, 576, 1, 512]
    - [111, 18.78]
  - - [1856, 576, 1, 512]
    - [228, 20.06]
  - - [1984, 576, 1, 512]
    - [287, 17.88]
  - - [1088, 704, 1, 512]
    - [43, 15.0]
  - - [1216, 704, 1, 512]
    - [111, 16.12]
  - - [1344, 704, 1, 512]
    - [111, 17.77]
  - - [1472, 704, 1, 512]
    - [111, 19.47]
  - - [1600, 704, 1, 512]
    - [111, 18.77]
  - - [1728, 704, 1, 512]
    - [112, 18.45]
  - - [1856, 704, 1, 512]
    - [114, 19.5]
  - - [1984, 704, 1, 512]
    - [154, 19.95]
  - - [1088, 832, 1, 512]
    - [116, 16.94]
  - - [1216, 832, 1, 512]
    - [111, 18.96]
  - - [1344, 832, 1, 512]
    - [111, 20.77]
  - - [1472, 832, 1, 512]
    - [112, 19.01]
  - - [1600, 832, 1, 512]
    - [116, 19.94]
  - - [1728, 832, 1, 512]
    - [156, 20.56]
  - - [1856, 832, 1, 512]
    - [154, 21.96]
  - - [1984, 832, 1, 512]
    - [154, 23.18]
  - - [1088, 960, 1, 512]
    - [112, 19.7]
  - - [1216, 960, 1, 512]
    - [287, 18.21]
  - - [1344, 960, 1, 512]
    - [112, 19.61]
  - - [1472, 960, 1, 512]
    - [155, 20.19]
  - - [1600, 960, 1, 512]
    - [154, 21.83]
  - - [1728, 960, 1, 512]
    - [154, 23.53]
  - - [1856, 960, 1, 512]
    - [154, 24.58]
  - - [1984, 960, 1, 512]
    - [154, 26.68]
  - - [64, 1088, 1, 512]
    - [165, 2.61]
  - - [192, 1088, 1, 512]
    - [147, 6.51]
  - - [320, 1088, 1, 512]
    - [43, 9.83]
  - - [448, 1088, 1, 512]
    - [43, 12.19]
  - - [576, 1088, 1, 512]
    - [43, 13.82]
  - - [704, 1088, 1, 512]
    - [43, 15.31]
  - - [832, 1088, 1, 512]
    - [150, 17.2]
  - - [960, 1088, 1, 512]
    - [113, 19.83]
  - - [1088, 1088, 1, 512]
    - [112, 19.61]
  - - [1216, 1088, 1, 512]
    - [116, 19.92]
  - - [1344, 1088, 1, 512]
    - [155, 21.05]
  - - [1472, 1088, 1, 512]
    - [154, 22.73]
  - - [1600, 1088, 1, 512]
    - [154, 24.63]
  - - [1728, 1088, 1, 512]
    - [154, 26.42]
  - - [1856, 1088, 1, 512]
    - [154, 28.35]
  - - [1984, 1088, 1, 512]
    - [117, 24.1]
  - - [64, 1216, 1, 512]
    - [214, 2.87]
  - - [192, 1216, 1, 512]
    - [149, 7.46]
  - - [320, 1216, 1, 512]
    - [6, 10.96]
  - - [448, 1216, 1, 512]
    - [117, 13.09]
  - - [576, 1216, 1, 512]
    - [89, 14.45]
  - - [704, 1216, 1, 512]
    - [146, 16.58]
  - - [832, 1216, 1, 512]
    - [111, 19.08]
  - - [960, 1216, 1, 512]
    - [287, 17.83]
  - - [1088, 1216, 1, 512]
    - [113, 20.27]
  - - [1216, 1216, 1, 512]
    - [154, 21.19]
  - - [1344, 1216, 1, 512]
    - [154, 23.69]
  - - [1472, 1216, 1, 512]
    - [154, 24.89]
  - - [1600, 1216, 1, 512]
    - [154, 27.4]
  - - [1728, 1216, 1, 512]
    - [154, 25.33]
  - - [1856, 1216, 1, 512]
    - [112, 24.29]
  - - [1984, 1216, 1, 512]
    - [85, 25.71]
  - - [64, 1344, 1, 512]
    - [149, 3.08]
  - - [192, 1344, 1, 512]
    - [43, 8.01]
  - - [320, 1344, 1, 512]
    - [43, 11.16]
  - - [448, 1344, 1, 512]
    - [43, 13.23]
  - - [576, 1344, 1, 512]
    - [150, 15.37]
  - - [704, 1344, 1, 512]
    - [113, 17.89]
