projects/hipblaslt/library/src/amd_detail/rocblaslt/src/Tensile/Logic/asm_full/gfx1201/GridBased/gfx1201_Cijk_Ailk_Bjlk_BSS_BH_Bias_SHB_HA_S_SAB_SCD_SAV_UserArgs.yaml
- {MinimumRequiredVersion: 5.0.0}
- gfx1201
- gfx1201
- [Device 73f0]
    SolutionIndex: 0
    SolutionNameMin: Cijk_Ailk_Bjlk_BSS_BH_Bias_HAS_SAV_UserArgs_MT64x32x32_MI16x16x1_SN_CLR1_GSU1_LBSPPA1024_LBSPPB512_MIWT2_1_PGR1_PLR1_SS0_SU32_SUM1_SUS256_SVW8_WG32_4_1_WGM8
    SolutionIndex: 1
    SolutionNameMin: Cijk_Ailk_Bjlk_BSS_BH_Bias_HAS_SAV_UserArgs_MT64x32x32_MI16x16x1_SN_CLR1_GSU1_LBSPPA1024_LBSPPB512_MIWT2_1_PGR2_PLR1_SS0_SU32_SUM1_SUS256_SVW8_WG32_4_1_WGM8
    SolutionIndex: 2
    SolutionNameMin: Cijk_Ailk_Bjlk_BSS_BH_Bias_HAS_SAV_UserArgs_MT64x32x32_MI16x16x1_SN_CLR0_GSU1_LBSPPA1024_LBSPPB512_MIWT2_1_PGR1_PLR0_SS0_SU32_SUM1_SUS256_SVW8_WG32_4_1_WGM8
    SolutionIndex: 3
    SolutionNameMin: Cijk_Ailk_Bjlk_BSS_BH_Bias_HAS_SAV_UserArgs_MT64x32x32_MI16x16x1_SN_CLR0_GSU1_LBSPPA1024_LBSPPB512_MIWT2_1_PGR2_PLR0_SS0_SU32_SUM1_SUS256_SVW8_WG32_4_1_WGM8
    SolutionIndex: 4
    SolutionNameMin: Cijk_Ailk_Bjlk_BSS_BH_Bias_HAS_SAV_UserArgs_MT32x64x32_MI16x16x1_SN_CLR1_GSU1_LBSPPA512_LBSPPB1024_MIWT2_1_PGR1_PLR1_SS0_SU32_SUM1_SUS256_SVW8_WG16_8_1_WGM8
    SolutionIndex: 5
    SolutionNameMin: Cijk_Ailk_Bjlk_BSS_BH_Bias_HAS_SAV_UserArgs_MT32x64x32_MI16x16x1_SN_CLR1_GSU1_LBSPPA512_LBSPPB1024_MIWT2_1_PGR2_PLR1_SS0_SU32_SUM1_SUS256_SVW8_WG16_8_1_WGM8
    SolutionIndex: 6
    SolutionNameMin: Cijk_Ailk_Bjlk_BSS_BH_Bias_HAS_SAV_UserArgs_MT32x64x32_MI16x16x1_SN_CLR0_GSU1_LBSPPA512_LBSPPB1024_MIWT2_1_PGR1_PLR0_SS0_SU32_SUM1_SUS256_SVW8_WG16_8_1_WGM8
    SolutionIndex: 7
    SolutionNameMin: Cijk_Ailk_Bjlk_BSS_BH_Bias_HAS_SAV_UserArgs_MT32x64x32_MI16x16x1_SN_CLR0_GSU1_LBSPPA512_LBSPPB1024_MIWT2_1_PGR2_PLR0_SS0_SU32_SUM1_SUS256_SVW8_WG16_8_1_WGM8
    SolutionIndex: 8
    SolutionNameMin: Cijk_Ailk_Bjlk_BSS_BH_Bias_HAS_SAV_UserArgs_MT32x32x64_MI16x16x1_SN_CLR1_GSU1_LBSPPA512_LBSPPB512_MIWT1_1_PGR1_PLR1_SS0_SU32_SUM1_SUS256_SVW8_WG32_4_1_WGM8
    SolutionIndex: 9
    SolutionNameMin: Cijk_Ailk_Bjlk_BSS_BH_Bias_HAS_SAV_UserArgs_MT64x32x64_MI16x16x1_SN_CLR1_GSU1_LBSPPA1024_LBSPPB512_MIWT2_1_PGR1_PLR3_SS0_SU32_SUM1_SUS256_SVW8_WG32_4_1_WGM8
    SolutionIndex: 10
    SolutionNameMin: Cijk_Ailk_Bjlk_BSS_BH_Bias_HAS_SAV_UserArgs_MT64x16x32_MI16x16x1_SN_CLR1_GSU1_LBSPPA1024_LBSPPB256_MIWT1_1_PGR2_PLR1_SS1_SU32_SUM1_SUS256_SVW1_WG64_2_1_WGM8
    SolutionIndex: 11
    SolutionNameMin: Cijk_Ailk_Bjlk_BSS_BH_Bias_HAS_SAV_UserArgs_MT64x16x32_MI16x16x1_SN_CLR0_GSU1_LBSPPA1024_LBSPPB256_MIWT1_1_PGR2_PLR0_SS1_SU32_SUM1_SUS256_SVW1_WG64_2_1_WGM8
    SolutionIndex: 12
    SolutionNameMin: Cijk_Ailk_Bjlk_BSS_BH_Bias_HAS_SAV_UserArgs_MT32x32x32_MI16x16x1_SN_CLR0_GSU1_LBSPPA512_LBSPPB512_MIWT1_1_PGR2_PLR0_SS1_SU32_SUM1_SUS256_SVW1_WG32_4_1_WGM8
    SolutionIndex: 13
    SolutionNameMin: Cijk_Ailk_Bjlk_BSS_BH_Bias_HAS_SAV_UserArgs_MT64x32x32_MI16x16x1_SN_CLR1_GSU1_LBSPPA1024_LBSPPB512_MIWT2_1_PGR1_PLR1_SS1_SU32_SUM1_SUS256_SVW1_WG32_4_1_WGM8
    SolutionIndex: 14
    SolutionNameMin: Cijk_Ailk_Bjlk_BSS_BH_Bias_HAS_SAV_UserArgs_MT64x32x32_MI16x16x1_SN_CLR1_GSU1_LBSPPA1024_LBSPPB512_MIWT2_1_PGR2_PLR1_SS1_SU32_SUM1_SUS256_SVW1_WG32_4_1_WGM8
    SolutionIndex: 15
    SolutionNameMin: Cijk_Ailk_Bjlk_BSS_BH_Bias_HAS_SAV_UserArgs_MT32x64x32_MI16x16x1_SN_CLR1_GSU1_LBSPPA512_LBSPPB1024_MIWT2_1_PGR1_PLR1_SS1_SU32_SUM1_SUS256_SVW1_WG16_8_1_WGM8
    SolutionIndex: 16
    SolutionNameMin: Cijk_Ailk_Bjlk_BSS_BH_Bias_HAS_SAV_UserArgs_MT32x64x32_MI16x16x1_SN_CLR0_GSU1_LBSPPA512_LBSPPB1024_MIWT2_1_PGR1_PLR0_SS1_SU32_SUM1_SUS256_SVW1_WG16_8_1_WGM8
    SolutionIndex: 17
    SolutionNameMin: Cijk_Ailk_Bjlk_BSS_BH_Bias_HAS_SAV_UserArgs_MT64x32x64_MI16x16x1_SN_CLR1_GSU1_LBSPPA1024_LBSPPB512_MIWT2_1_PGR1_PLR1_SS1_SU32_SUM1_SUS256_SVW1_WG32_4_1_WGM8
    SolutionIndex: 114
    SolutionNameMin: Cijk_Ailk_Bjlk_BSS_BH_Bias_SHB_HA_S_SAB_SCD_SAV_UserArgs_MT32x16x64_MI16x16x1_SN_LDSB0_AFC1_AFEM1_AFEM1_ASEM1_CLR1_CADS0_DTLA0_DTLB0_DTVA1_DTVB1_EPS0_FDSI0_GRPM1_GRVWA8_GRVWB8_GSU1_GSUAMB_GSUC0_GSUWGMRR0_GLS0_ISA1201_IU1_K1_LBSPPA0_LBSPPB0_LBSPPM0_LPA0_LPB0_LPM0_LRVW8_LWPMn1_MIAV1_MIWT1_1_MO40_NTn1_NTA0_NTB0_NTC0_NTD0_NTM0_NEPBS0_NLCA1_NLCB1_ONLL0_PGR1_PLR0_PKA0_SIA3_SS0_SU32_SUM1_SUS256_SPO0_SRVW0_SSO0_SVW8_SK0_SKXCCM0_TLDS0_ULSGRO0_USL1_UIOFGRO0_USFGROn1_VSn1_VWA1_VWB1_WSGRA0_WSGRB0_WS32_WG32_2_1_WGM8_WGMXCC1_WGMXCCGn1
    SolutionIndex: 115
    SolutionNameMin: Cijk_Ailk_Bjlk_BSS_BH_Bias_SHB_HA_S_SAB_SCD_SAV_UserArgs_MT32x32x64_MI16x16x1_SN_LDSB0_AFC1_AFEM1_AFEM1_ASEM1_CLR1_CADS0_DTLA0_DTLB0_DTVA0_DTVB0_EPS0_FDSI0_GRPM1_GRVWA8_GRVWB8_GSU1_GSUAMB_GSUC0_GSUWGMRR0_GLS0_ISA1201_IU1_K1_LBSPPA512_LBSPPB512_LBSPPM0_LPA16_LPB16_LPM0_LRVW8_LWPMn1_MIAV1_MIWT1_1_MO40_NTn1_NTA0_NTB0_NTC0_NTD0_NTM0_NEPBS0_NLCA1_NLCB1_ONLL0_PGR2_PLR1_PKA0_SIA3_SS1_SU32_SUM1_SUS256_SPO0_SRVW0_SSO0_SVW1_SK0_SKXCCM0_TLDS0_ULSGRO0_USL1_UIOFGRO0_USFGROn1_VSn1_VWA1_VWB1_WSGRA0_WSGRB0_WS32_WG32_4_1_WGM8_WGMXCC1_WGMXCCGn1
    SolutionIndex: 116
    SolutionNameMin: Cijk_Ailk_Bjlk_BSS_BH_Bias_SHB_HA_S_SAB_SCD_SAV_UserArgs_MT16x32x32_MI16x16x1_SN_LDSB1_AFC1_AFEM1_AFEM1_ASEM1_CLR1_CADS0_DTLA0_DTLB0_DTVA0_DTVB0_EPS0_FDSI0_GRPM1_GRVWA4_GRVWB4_GSU1_GSUAMB_GSUC0_GSUWGMRR0_GLS0_ISA1201_IU2_K1_LBSPPA256_LBSPPB512_LBSPPM0_LPA16_LPB16_LPM0_LRVW8_LWPMn1_MIAV1_MIWT1_1_MO40_NTn1_NTA0_NTB0_NTC0_NTD0_NTM0_NEPBS0_NLCA1_NLCB1_ONLL0_PGR2_PLR1_PKA0_SIA2_SS0_SU32_SUM1_SUS256_SPO0_SRVW0_SSO0_SVW8_SK0_SKXCCM0_TLDS0_ULSGRO0_USL1_UIOFGRO0_USFGROn1_VSn1_VWA1_VWB1_WSGRA0_WSGRB0_WS32_WG16_4_1_WGM8_WGMXCC1_WGMXCCGn1
    SolutionIndex: 117
    SolutionNameMin: Cijk_Ailk_Bjlk_BSS_BH_Bias_SHB_HA_S_SAB_SCD_SAV_UserArgs_MT32x32x64_MI16x16x1_SN_LDSB1_AFC1_AFEM1_AFEM1_ASEM1_CLR1_CADS0_DTLA0_DTLB0_DTVA0_DTVB0_EPS1_FDSI0_GRPM1_GRVWA1_GRVWB1_GSU1_GSUAMB_GSUC0_GSUWGMRR0_GLS0_ISA1201_IU4_K1_LBSPPA512_LBSPPB512_LBSPPM0_LPA16_LPB16_LPM0_LRVW8_LWPMn1_MIAV1_MIWT1_1_MO40_NTn1_NTA0_NTB0_NTC0_NTD0_NTM0_NEPBS0_NLCA1_NLCB1_ONLL0_PGR1_PLR1_PKA0_SIA2_SS0_SU32_SUM1_SUS256_SPO0_SRVW0_SSO0_SVW8_SK0_SKXCCM0_TLDS0_ULSGRO0_USL1_UIOFGRO0_USFGROn1_VSn1_VWA1_VWB1_WSGRA0_WSGRB0_WS32_WG32_4_1_WGM8_WGMXCC1_WGMXCCGn1
    SolutionIndex: 118
    SolutionNameMin: Cijk_Ailk_Bjlk_BSS_BH_Bias_SHB_HA_S_SAB_SCD_SAV_UserArgs_MT32x32x64_MI16x16x1_SN_LDSB1_AFC1_AFEM1_AFEM1_ASEM1_CLR1_CADS0_DTLA0_DTLB0_DTVA0_DTVB0_EPS0_FDSI0_GRPM1_GRVWA4_GRVWB4_GSU1_GSUAMB_GSUC0_GSUWGMRR0_GLS0_ISA1201_IU4_K1_LBSPPA512_LBSPPB512_LBSPPM0_LPA16_LPB16_LPM0_LRVW8_LWPMn1_MIAV1_MIWT1_1_MO40_NTn1_NTA0_NTB0_NTC0_NTD0_NTM0_NEPBS0_NLCA1_NLCB1_ONLL0_PGR2_PLR1_PKA0_SIA2_SS1_SU32_SUM1_SUS256_SPO0_SRVW0_SSO0_SVW1_SK0_SKXCCM0_TLDS0_ULSGRO0_USL1_UIOFGRO0_USFGROn1_VSn1_VWA1_VWB1_WSGRA0_WSGRB0_WS32_WG32_4_1_WGM8_WGMXCC1_WGMXCCGn1
    SolutionIndex: 119
    SolutionNameMin: Cijk_Ailk_Bjlk_BSS_BH_Bias_SHB_HA_S_SAB_SCD_SAV_UserArgs_MT32x32x32_MI16x16x1_SN_LDSB0_AFC1_AFEM1_AFEM1_ASEM1_CLR1_CADS0_DTLA0_DTLB0_DTVA0_DTVB0_EPS0_FDSI0_GRPM1_GRVWA1_GRVWB1_GSU1_GSUAMB_GSUC0_GSUWGMRR0_GLS0_ISA1201_IU1_K1_LBSPPA512_LBSPPB512_LBSPPM0_LPA16_LPB16_LPM0_LRVW8_LWPMn1_MIAV1_MIWT1_1_MO40_NTn1_NTA0_NTB0_NTC0_NTD0_NTM0_NEPBS0_NLCA1_NLCB1_ONLL0_PGR2_PLR1_PKA0_SIA3_SS0_SU32_SUM1_SUS256_SPO0_SRVW0_SSO0_SVW8_SK0_SKXCCM0_TLDS0_ULSGRO1_USL1_UIOFGRO0_USFGROn1_VSn1_VWA1_VWB1_WSGRA0_WSGRB0_WS32_WG32_4_1_WGM8_WGMXCC1_WGMXCCGn1
    SolutionIndex: 120
    SolutionNameMin: Cijk_Ailk_Bjlk_BSS_BH_Bias_SHB_HA_S_SAB_SCD_SAV_UserArgs_MT32x32x64_MI16x16x1_SN_LDSB0_AFC1_AFEM1_AFEM1_ASEM1_CLR1_CADS0_DTLA0_DTLB0_DTVA0_DTVB0_EPS0_FDSI0_GRPM1_GRVWA1_GRVWB1_GSU1_GSUAMB_GSUC0_GSUWGMRR0_GLS0_ISA1201_IU1_K1_LBSPPA512_LBSPPB512_LBSPPM0_LPA16_LPB16_LPM0_LRVW8_LWPMn1_MIAV1_MIWT1_1_MO40_NTn1_NTA0_NTB0_NTC0_NTD0_NTM0_NEPBS0_NLCA1_NLCB1_ONLL0_PGR2_PLR1_PKA0_SIA3_SS0_SU32_SUM1_SUS256_SPO0_SRVW0_SSO0_SVW8_SK0_SKXCCM0_TLDS0_ULSGRO1_USL1_UIOFGRO0_USFGROn1_VSn1_VWA1_VWB1_WSGRA0_WSGRB0_WS32_WG32_4_1_WGM8_WGMXCC1_WGMXCCGn1
    SolutionIndex: 121
    SolutionNameMin: Cijk_Ailk_Bjlk_BSS_BH_Bias_SHB_HA_S_SAB_SCD_SAV_UserArgs_MT32x32x32_MI16x16x1_SN_LDSB1_AFC1_AFEM1_AFEM1_ASEM1_CLR1_CADS0_DTLA0_DTLB0_DTVA0_DTVB0_EPS1_FDSI0_GRPM1_GRVWA1_GRVWB1_GSU1_GSUAMB_GSUC0_GSUWGMRR0_GLS0_ISA1201_IU2_K1_LBSPPA512_LBSPPB512_LBSPPM0_LPA16_LPB16_LPM0_LRVW8_LWPMn1_MIAV1_MIWT1_1_MO40_NTn1_NTA0_NTB0_NTC0_NTD0_NTM0_NEPBS0_NLCA1_NLCB1_ONLL0_PGR1_PLR1_PKA0_SIA2_SS0_SU32_SUM1_SUS256_SPO0_SRVW0_SSO0_SVW8_SK0_SKXCCM0_TLDS0_ULSGRO0_USL1_UIOFGRO0_USFGROn1_VSn1_VWA1_VWB1_WSGRA0_WSGRB0_WS32_WG32_4_1_WGM8_WGMXCC1_WGMXCCGn1
    SolutionIndex: 122
    SolutionNameMin: Cijk_Ailk_Bjlk_BSS_BH_Bias_SHB_HA_S_SAB_SCD_SAV_UserArgs_MT16x16x32_MI16x16x1_SN_LDSB1_AFC1_AFEM1_AFEM1_ASEM1_CLR1_CADS0_DTLA0_DTLB0_DTVA0_DTVB0_EPS0_FDSI0_GRPM1_GRVWA1_GRVWB1_GSU1_GSUAMB_GSUC0_GSUWGMRR0_GLS0_ISA1201_IU2_K1_LBSPPA256_LBSPPB256_LBSPPM0_LPA16_LPB16_LPM0_LRVW8_LWPMn1_MIAV1_MIWT1_1_MO40_NTn1_NTA0_NTB0_NTC0_NTD0_NTM0_NEPBS0_NLCA1_NLCB1_ONLL0_PGR2_PLR1_PKA0_SIA2_SS0_SU32_SUM1_SUS256_SPO0_SRVW0_SSO0_SVW8_SK0_SKXCCM0_TLDS0_ULSGRO0_USL1_UIOFGRO0_USFGROn1_VSn1_VWA1_VWB1_WSGRA0_WSGRB0_WS32_WG16_2_1_WGM8_WGMXCC1_WGMXCCGn1
    SolutionIndex: 123
    SolutionNameMin: Cijk_Ailk_Bjlk_BSS_BH_Bias_SHB_HA_S_SAB_SCD_SAV_UserArgs_MT32x16x64_MI16x16x1_SN_LDSB0_AFC1_AFEM1_AFEM1_ASEM1_CLR1_CADS0_DTLA0_DTLB0_DTVA1_DTVB0_EPS1_FDSI0_GRPM1_GRVWA8_GRVWB8_GSU1_GSUAMB_GSUC0_GSUWGMRR0_GLS0_ISA1201_IU1_K1_LBSPPA0_LBSPPB256_LBSPPM0_LPA0_LPB16_LPM0_LRVW8_LWPMn1_MIAV1_MIWT1_1_MO40_NTn1_NTA0_NTB0_NTC0_NTD0_NTM0_NEPBS0_NLCA1_NLCB1_ONLL0_PGR1_PLR1_PKA0_SIA3_SS1_SU32_SUM1_SUS256_SPO0_SRVW0_SSO0_SVW1_SK0_SKXCCM0_TLDS0_ULSGRO0_USL1_UIOFGRO0_USFGROn1_VSn1_VWA1_VWB1_WSGRA0_WSGRB0_WS32_WG32_2_1_WGM8_WGMXCC1_WGMXCCGn1
    SolutionIndex: 124
    SolutionNameMin: Cijk_Ailk_Bjlk_BSS_BH_Bias_SHB_HA_S_SAB_SCD_SAV_UserArgs_MT16x32x64_MI16x16x1_SN_LDSB0_AFC1_AFEM1_AFEM1_ASEM1_CLR1_CADS0_DTLA0_DTLB0_DTVA0_DTVB1_EPS1_FDSI0_GRPM1_GRVWA4_GRVWB8_GSU1_GSUAMB_GSUC0_GSUWGMRR0_GLS0_ISA1201_IU1_K1_LBSPPA256_LBSPPB0_LBSPPM0_LPA16_LPB0_LPM0_LRVW8_LWPMn1_MIAV1_MIWT1_1_MO40_NTn1_NTA0_NTB0_NTC0_NTD0_NTM0_NEPBS0_NLCA1_NLCB1_ONLL0_PGR1_PLR1_PKA0_SIA3_SS0_SU32_SUM1_SUS256_SPO0_SRVW0_SSO0_SVW8_SK0_SKXCCM0_TLDS0_ULSGRO0_USL1_UIOFGRO0_USFGROn1_VSn1_VWA1_VWB1_WSGRA0_WSGRB0_WS32_WG16_4_1_WGM8_WGMXCC1_WGMXCCGn1
    SolutionIndex: 125
    SolutionNameMin: Cijk_Ailk_Bjlk_BSS_BH_Bias_SHB_HA_S_SAB_SCD_SAV_UserArgs_MT32x32x32_MI16x16x1_SN_LDSB1_AFC1_AFEM1_AFEM1_ASEM1_CLR1_CADS0_DTLA0_DTLB0_DTVA0_DTVB0_EPS0_FDSI0_GRPM1_GRVWA1_GRVWB1_GSU1_GSUAMB_GSUC0_GSUWGMRR0_GLS0_ISA1201_IU2_K1_LBSPPA512_LBSPPB512_LBSPPM0_LPA16_LPB16_LPM0_LRVW8_LWPMn1_MIAV1_MIWT1_1_MO40_NTn1_NTA0_NTB0_NTC0_NTD0_NTM0_NEPBS0_NLCA1_NLCB1_ONLL0_PGR2_PLR1_PKA0_SIA2_SS0_SU32_SUM1_SUS256_SPO0_SRVW0_SSO0_SVW8_SK0_SKXCCM0_TLDS0_ULSGRO1_USL1_UIOFGRO0_USFGROn1_VSn1_VWA1_VWB1_WSGRA0_WSGRB0_WS32_WG32_4_1_WGM8_WGMXCC1_WGMXCCGn1
    SolutionIndex: 126
    SolutionNameMin: Cijk_Ailk_Bjlk_BSS_BH_Bias_SHB_HA_S_SAB_SCD_SAV_UserArgs_MT16x32x32_MI16x16x1_SN_LDSB0_AFC1_AFEM1_AFEM1_ASEM1_CLR1_CADS0_DTLA0_DTLB0_DTVA0_DTVB0_EPS0_FDSI0_GRPM1_GRVWA1_GRVWB1_GSU1_GSUAMB_GSUC0_GSUWGMRR0_GLS0_ISA1201_IU1_K1_LBSPPA256_LBSPPB512_LBSPPM0_LPA16_LPB16_LPM0_LRVW8_LWPMn1_MIAV1_MIWT1_1_MO40_NTn1_NTA0_NTB0_NTC0_NTD0_NTM0_NEPBS0_NLCA1_NLCB1_ONLL0_PGR2_PLR1_PKA0_SIA3_SS0_SU32_SUM1_SUS256_SPO0_SRVW0_SSO0_SVW8_SK0_SKXCCM0_TLDS0_ULSGRO1_USL1_UIOFGRO0_USFGROn1_VSn1_VWA1_VWB1_WSGRA0_WSGRB0_WS32_WG16_4_1_WGM8_WGMXCC1_WGMXCCGn1
    SolutionIndex: 127
    SolutionNameMin: Cijk_Ailk_Bjlk_BSS_BH_Bias_SHB_HA_S_SAB_SCD_SAV_UserArgs_MT32x32x32_MI16x16x1_SN_LDSB0_AFC1_AFEM1_AFEM1_ASEM1_CLR1_CADS0_DTLA0_DTLB0_DTVA0_DTVB0_EPS0_FDSI0_GRPM1_GRVWA4_GRVWB4_GSU1_GSUAMB_GSUC0_GSUWGMRR0_GLS0_ISA1201_IU1_K1_LBSPPA512_LBSPPB512_LBSPPM0_LPA16_LPB16_LPM0_LRVW8_LWPMn1_MIAV1_MIWT1_1_MO40_NTn1_NTA0_NTB0_NTC0_NTD0_NTM0_NEPBS0_NLCA1_NLCB1_ONLL0_PGR2_PLR1_PKA0_SIA3_SS0_SU32_SUM1_SUS256_SPO0_SRVW0_SSO0_SVW8_SK0_SKXCCM0_TLDS0_ULSGRO1_USL1_UIOFGRO0_USFGROn1_VSn1_VWA1_VWB1_WSGRA0_WSGRB0_WS32_WG32_4_1_WGM8_WGMXCC1_WGMXCCGn1
    SolutionIndex: 128
    SolutionNameMin: Cijk_Ailk_Bjlk_BSS_BH_Bias_SHB_HA_S_SAB_SCD_SAV_UserArgs_MT32x32x16_MI16x16x1_SN_LDSB0_AFC1_AFEM1_AFEM1_ASEM1_CLR0_CADS0_DTLA0_DTLB0_DTVA0_DTVB0_EPS0_FDSI0_GRPM1_GRVWA4_GRVWB1_GSU1_GSUAMB_GSUC0_GSUWGMRR0_GLS0_ISA1201_IU1_K1_LBSPPA512_LBSPPB512_LBSPPM0_LPA16_LPB16_LPM0_LRVW8_LWPMn1_MIAV1_MIWT1_1_MO40_NTn1_NTA0_NTB0_NTC0_NTD0_NTM0_NEPBS0_NLCA1_NLCB1_ONLL0_PGR2_PLR0_PKA0_SIA3_SS0_SU32_SUM1_SUS256_SPO0_SRVW0_SSO0_SVW8_SK0_SKXCCM0_TLDS0_ULSGRO1_USL1_UIOFGRO0_USFGROn1_VSn1_VWA1_VWB1_WSGRA0_WSGRB0_WS32_WG32_4_1_WGM8_WGMXCC1_WGMXCCGn1
    SolutionIndex: 129
    SolutionNameMin: Cijk_Ailk_Bjlk_BSS_BH_Bias_SHB_HA_S_SAB_SCD_SAV_UserArgs_MT32x32x32_MI16x16x1_SN_LDSB0_AFC1_AFEM1_AFEM1_ASEM1_CLR1_CADS0_DTLA0_DTLB0_DTVA0_DTVB0_EPS0_FDSI0_GRPM1_GRVWA1_GRVWB1_GSU1_GSUAMB_GSUC0_GSUWGMRR0_GLS0_ISA1201_IU1_K1_LBSPPA512_LBSPPB512_LBSPPM0_LPA16_LPB16_LPM0_LRVW8_LWPMn1_MIAV1_MIWT1_1_MO40_NTn1_NTA0_NTB0_NTC0_NTD0_NTM0_NEPBS0_NLCA1_NLCB1_ONLL0_PGR2_PLR1_PKA0_SIA3_SS1_SU32_SUM1_SUS256_SPO0_SRVW0_SSO0_SVW1_SK0_SKXCCM0_TLDS0_ULSGRO1_USL1_UIOFGRO0_USFGROn1_VSn1_VWA1_VWB1_WSGRA0_WSGRB0_WS32_WG32_4_1_WGM8_WGMXCC1_WGMXCCGn1
    SolutionIndex: 130
    SolutionNameMin: Cijk_Ailk_Bjlk_BSS_BH_Bias_SHB_HA_S_SAB_SCD_SAV_UserArgs_MT32x16x32_MI16x16x1_SN_LDSB0_AFC1_AFEM1_AFEM1_ASEM1_CLR1_CADS0_DTLA0_DTLB0_DTVA1_DTVB0_EPS0_FDSI0_GRPM1_GRVWA8_GRVWB8_GSU1_GSUAMB_GSUC0_GSUWGMRR0_GLS0_ISA1201_IU1_K1_LBSPPA0_LBSPPB256_LBSPPM0_LPA0_LPB16_LPM0_LRVW8_LWPMn1_MIAV1_MIWT1_1_MO40_NTn1_NTA0_NTB0_NTC0_NTD0_NTM0_NEPBS0_NLCA1_NLCB1_ONLL0_PGR2_PLR1_PKA0_SIA3_SS0_SU32_SUM1_SUS256_SPO0_SRVW0_SSO0_SVW8_SK0_SKXCCM0_TLDS0_ULSGRO0_USL1_UIOFGRO0_USFGROn1_VSn1_VWA1_VWB1_WSGRA0_WSGRB0_WS32_WG32_2_1_WGM8_WGMXCC1_WGMXCCGn1
    SolutionIndex: 131
    SolutionNameMin: Cijk_Ailk_Bjlk_BSS_BH_Bias_SHB_HA_S_SAB_SCD_SAV_UserArgs_MT32x16x32_MI16x16x1_SN_LDSB1_AFC1_AFEM1_AFEM1_ASEM1_CLR1_CADS0_DTLA0_DTLB0_DTVA0_DTVB0_EPS1_FDSI0_GRPM1_GRVWA8_GRVWB4_GSU1_GSUAMB_GSUC0_GSUWGMRR0_GLS0_ISA1201_IU2_K1_LBSPPA512_LBSPPB256_LBSPPM0_LPA16_LPB16_LPM0_LRVW8_LWPMn1_MIAV1_MIWT1_1_MO40_NTn1_NTA0_NTB0_NTC0_NTD0_NTM0_NEPBS0_NLCA1_NLCB1_ONLL0_PGR1_PLR1_PKA0_SIA2_SS1_SU32_SUM1_SUS256_SPO0_SRVW0_SSO0_SVW1_SK0_SKXCCM0_TLDS0_ULSGRO0_USL1_UIOFGRO0_USFGROn1_VSn1_VWA1_VWB1_WSGRA0_WSGRB0_WS32_WG32_2_1_WGM8_WGMXCC1_WGMXCCGn1
    SolutionIndex: 132
    SolutionNameMin: Cijk_Ailk_Bjlk_BSS_BH_Bias_SHB_HA_S_SAB_SCD_SAV_UserArgs_MT32x16x32_MI16x16x1_SN_LDSB0_AFC1_AFEM1_AFEM1_ASEM1_CLR1_CADS0_DTLA0_DTLB0_DTVA0_DTVB0_EPS1_FDSI0_GRPM1_GRVWA1_GRVWB1_GSU1_GSUAMB_GSUC0_GSUWGMRR0_GLS0_ISA1201_IU1_K1_LBSPPA512_LBSPPB256_LBSPPM0_LPA16_LPB16_LPM0_LRVW8_LWPMn1_MIAV1_MIWT1_1_MO40_NTn1_NTA0_NTB0_NTC0_NTD0_NTM0_NEPBS0_NLCA1_NLCB1_ONLL0_PGR1_PLR1_PKA0_SIA3_SS0_SU32_SUM1_SUS256_SPO0_SRVW0_SSO0_SVW8_SK0_SKXCCM0_TLDS0_ULSGRO0_USL1_UIOFGRO0_USFGROn1_VSn1_VWA1_VWB1_WSGRA0_WSGRB0_WS32_WG32_2_1_WGM8_WGMXCC1_WGMXCCGn1
    SolutionIndex: 133
    SolutionNameMin: Cijk_Ailk_Bjlk_BSS_BH_Bias_SHB_HA_S_SAB_SCD_SAV_UserArgs_MT32x32x64_MI16x16x1_SN_LDSB1_AFC1_AFEM1_AFEM1_ASEM1_CLR1_CADS0_DTLA0_DTLB0_DTVA0_DTVB0_EPS0_FDSI0_GRPM1_GRVWA8_GRVWB8_GSU1_GSUAMB_GSUC0_GSUWGMRR0_GLS0_ISA1201_IU4_K1_LBSPPA512_LBSPPB512_LBSPPM0_LPA16_LPB16_LPM0_LRVW8_LWPMn1_MIAV1_MIWT1_1_MO40_NTn1_NTA0_NTB0_NTC0_NTD0_NTM0_NEPBS0_NLCA1_NLCB1_ONLL0_PGR2_PLR1_PKA0_SIA2_SS0_SU32_SUM1_SUS256_SPO0_SRVW0_SSO0_SVW8_SK0_SKXCCM0_TLDS0_ULSGRO0_USL1_UIOFGRO0_USFGROn1_VSn1_VWA1_VWB1_WSGRA0_WSGRB0_WS32_WG32_4_1_WGM8_WGMXCC1_WGMXCCGn1
    SolutionIndex: 134
    SolutionNameMin: Cijk_Ailk_Bjlk_BSS_BH_Bias_SHB_HA_S_SAB_SCD_SAV_UserArgs_MT32x16x32_MI16x16x1_SN_LDSB1_AFC1_AFEM1_AFEM1_ASEM1_CLR1_CADS0_DTLA0_DTLB0_DTVA0_DTVB0_EPS0_FDSI0_GRPM1_GRVWA1_GRVWB1_GSU1_GSUAMB_GSUC0_GSUWGMRR0_GLS0_ISA1201_IU2_K1_LBSPPA512_LBSPPB256_LBSPPM0_LPA16_LPB16_LPM0_LRVW8_LWPMn1_MIAV1_MIWT1_1_MO40_NTn1_NTA0_NTB0_NTC0_NTD0_NTM0_NEPBS0_NLCA1_NLCB1_ONLL0_PGR2_PLR1_PKA0_SIA2_SS0_SU32_SUM1_SUS256_SPO0_SRVW0_SSO0_SVW8_SK0_SKXCCM0_TLDS0_ULSGRO1_USL1_UIOFGRO0_USFGROn1_VSn1_VWA1_VWB1_WSGRA0_WSGRB0_WS32_WG32_2_1_WGM8_WGMXCC1_WGMXCCGn1
    SolutionIndex: 135
    SolutionNameMin: Cijk_Ailk_Bjlk_BSS_BH_Bias_SHB_HA_S_SAB_SCD_SAV_UserArgs_MT32x16x32_MI16x16x1_SN_LDSB1_AFC1_AFEM1_AFEM1_ASEM1_CLR1_CADS0_DTLA0_DTLB0_DTVA0_DTVB0_EPS0_FDSI0_GRPM1_GRVWA1_GRVWB1_GSU1_GSUAMB_GSUC0_GSUWGMRR0_GLS0_ISA1201_IU2_K1_LBSPPA512_LBSPPB256_LBSPPM0_LPA16_LPB16_LPM0_LRVW8_LWPMn1_MIAV1_MIWT1_1_MO40_NTn1_NTA0_NTB0_NTC0_NTD0_NTM0_NEPBS0_NLCA1_NLCB1_ONLL0_PGR2_PLR1_PKA0_SIA2_SS0_SU32_SUM1_SUS256_SPO0_SRVW0_SSO0_SVW8_SK0_SKXCCM0_TLDS0_ULSGRO0_USL1_UIOFGRO0_USFGROn1_VSn1_VWA1_VWB1_WSGRA0_WSGRB0_WS32_WG32_2_1_WGM8_WGMXCC1_WGMXCCGn1
    SolutionIndex: 136
    SolutionNameMin: Cijk_Ailk_Bjlk_BSS_BH_Bias_SHB_HA_S_SAB_SCD_SAV_UserArgs_MT32x16x32_MI16x16x1_SN_LDSB1_AFC1_AFEM1_AFEM1_ASEM1_CLR1_CADS0_DTLA0_DTLB0_DTVA0_DTVB0_EPS0_FDSI0_GRPM1_GRVWA8_GRVWB8_GSU1_GSUAMB_GSUC0_GSUWGMRR0_GLS0_ISA1201_IU2_K1_LBSPPA512_LBSPPB256_LBSPPM0_LPA16_LPB16_LPM0_LRVW8_LWPMn1_MIAV1_MIWT1_1_MO40_NTn1_NTA0_NTB0_NTC0_NTD0_NTM0_NEPBS0_NLCA1_NLCB1_ONLL0_PGR2_PLR1_PKA0_SIA2_SS0_SU32_SUM1_SUS256_SPO0_SRVW0_SSO0_SVW8_SK0_SKXCCM0_TLDS0_ULSGRO1_USL1_UIOFGRO0_USFGROn1_VSn1_VWA1_VWB1_WSGRA0_WSGRB0_WS32_WG32_2_1_WGM8_WGMXCC1_WGMXCCGn1
    SolutionIndex: 137
    SolutionNameMin: Cijk_Ailk_Bjlk_BSS_BH_Bias_SHB_HA_S_SAB_SCD_SAV_UserArgs_MT32x16x16_MI16x16x1_SN_LDSB1_AFC1_AFEM1_AFEM1_ASEM1_CLR1_CADS0_DTLA0_DTLB0_DTVA0_DTVB0_EPS0_FDSI0_GRPM1_GRVWA1_GRVWB1_GSU1_GSUAMB_GSUC0_GSUWGMRR0_GLS0_ISA1201_IU1_K1_LBSPPA512_LBSPPB256_LBSPPM0_LPA16_LPB16_LPM0_LRVW8_LWPMn1_MIAV1_MIWT1_1_MO40_NTn1_NTA0_NTB0_NTC0_NTD0_NTM0_NEPBS0_NLCA1_NLCB1_ONLL0_PGR2_PLR1_PKA0_SIA2_SS0_SU32_SUM1_SUS256_SPO0_SRVW0_SSO0_SVW8_SK0_SKXCCM0_TLDS0_ULSGRO0_USL1_UIOFGRO0_USFGROn1_VSn1_VWA1_VWB1_WSGRA0_WSGRB0_WS32_WG32_2_1_WGM8_WGMXCC1_WGMXCCGn1
    SolutionIndex: 138
    SolutionNameMin: Cijk_Ailk_Bjlk_BSS_BH_Bias_SHB_HA_S_SAB_SCD_SAV_UserArgs_MT16x32x32_MI16x16x1_SN_LDSB0_AFC1_AFEM1_AFEM1_ASEM1_CLR1_CADS0_DTLA0_DTLB0_DTVA1_DTVB1_EPS0_FDSI0_GRPM1_GRVWA8_GRVWB8_GSU1_GSUAMB_GSUC0_GSUWGMRR0_GLS0_ISA1201_IU1_K1_LBSPPA0_LBSPPB0_LBSPPM0_LPA0_LPB0_LPM0_LRVW8_LWPMn1_MIAV1_MIWT1_1_MO40_NTn1_NTA0_NTB0_NTC0_NTD0_NTM0_NEPBS0_NLCA1_NLCB1_ONLL0_PGR1_PLR0_PKA0_SIA3_SS0_SU32_SUM1_SUS256_SPO0_SRVW0_SSO0_SVW8_SK0_SKXCCM0_TLDS0_ULSGRO0_USL1_UIOFGRO0_USFGROn1_VSn1_VWA1_VWB1_WSGRA0_WSGRB0_WS32_WG16_4_1_WGM8_WGMXCC1_WGMXCCGn1
    SolutionIndex: 139
    SolutionNameMin: Cijk_Ailk_Bjlk_BSS_BH_Bias_SHB_HA_S_SAB_SCD_SAV_UserArgs_MT32x32x32_MI16x16x1_SN_LDSB0_AFC1_AFEM1_AFEM1_ASEM1_CLR1_CADS0_DTLA0_DTLB0_DTVA0_DTVB0_EPS0_FDSI0_GRPM1_GRVWA8_GRVWB4_GSU1_GSUAMB_GSUC0_GSUWGMRR0_GLS0_ISA1201_IU1_K1_LBSPPA512_LBSPPB512_LBSPPM0_LPA16_LPB16_LPM0_LRVW8_LWPMn1_MIAV1_MIWT1_1_MO40_NTn1_NTA0_NTB0_NTC0_NTD0_NTM0_NEPBS0_NLCA1_NLCB1_ONLL0_PGR2_PLR1_PKA0_SIA3_SS0_SU32_SUM1_SUS256_SPO0_SRVW0_SSO0_SVW8_SK0_SKXCCM0_TLDS0_ULSGRO1_USL1_UIOFGRO0_USFGROn1_VSn1_VWA1_VWB1_WSGRA0_WSGRB0_WS32_WG32_4_1_WGM8_WGMXCC1_WGMXCCGn1
    SolutionIndex: 142
    SolutionNameMin: Cijk_Ailk_Bjlk_BSS_BH_Bias_SHB_HA_S_SAB_SCD_SAV_UserArgs_MT64x64x32_MI16x16x1_SN_LDSB0_AFC1_AFEM1_AFEM1_ASEM1_CLR1_CADS0_DTLA0_DTLB0_DTVA1_DTVB1_EPS0_FDSI0_GRPM1_GRVWA8_GRVWB8_GSU1_GSUAMB_GSUC0_GSUWGMRR0_GLS0_ISA1201_IU1_K1_LBSPPA0_LBSPPB0_LBSPPM0_LPA0_LPB0_LPM0_LRVW8_LWPMn1_MIAV1_MIWT2_2_MO40_NTn1_NTA0_NTB0_NTC0_NTD0_NTM0_NEPBS0_NLCA2_NLCB2_ONLL0_PGR1_PLR0_PKA0_SIA3_SS0_SU32_SUM1_SUS256_SPO0_SRVW0_SSO0_SVW8_SK0_SKXCCM0_TLDS0_ULSGRO0_USL1_UIOFGRO0_USFGROn1_VSn1_VWA1_VWB1_WSGRA0_WSGRB0_WS32_WG32_4_1_WGM8_WGMXCC1_WGMXCCGn1
    SolutionIndex: 148
    SolutionNameMin: Cijk_Ailk_Bjlk_BSS_BH_Bias_SHB_HA_S_SAB_SCD_SAV_UserArgs_MT16x32x16_MI16x16x1_SN_LDSB1_AFC1_AFEM1_AFEM1_ASEM1_CLR1_CADS0_DTLA0_DTLB0_DTVA0_DTVB0_EPS0_FDSI0_GRPM1_GRVWA1_GRVWB4_GSU1_GSUAMB_GSUC0_GSUWGMRR0_GLS0_ISA1201_IU1_K1_LBSPPA256_LBSPPB512_LBSPPM0_LPA16_LPB16_LPM0_LRVW8_LWPMn1_MIAV1_MIWT1_1_MO40_NTn1_NTA0_NTB0_NTC0_NTD0_NTM0_NEPBS0_NLCA1_NLCB1_ONLL0_PGR2_PLR1_PKA0_SIA2_SS0_SU32_SUM1_SUS256_SPO0_SRVW0_SSO0_SVW8_SK0_SKXCCM0_TLDS0_ULSGRO0_USL1_UIOFGRO0_USFGROn1_VSn1_VWA1_VWB1_WSGRA0_WSGRB0_WS32_WG16_4_1_WGM8_WGMXCC1_WGMXCCGn1
    SolutionIndex: 150
    SolutionNameMin: Cijk_Ailk_Bjlk_BSS_BH_Bias_SHB_HA_S_SAB_SCD_SAV_UserArgs_MT64x64x64_MI16x16x1_SN_LDSB0_AFC1_AFEM1_AFEM1_ASEM1_CLR1_CADS0_DTLA0_DTLB0_DTVA1_DTVB1_EPS0_FDSI0_GRPM1_GRVWA8_GRVWB8_GSU1_GSUAMB_GSUC0_GSUWGMRR0_GLS0_ISA1201_IU1_K1_LBSPPA0_LBSPPB0_LBSPPM0_LPA0_LPB0_LPM0_LRVW8_LWPMn1_MIAV1_MIWT2_2_MO40_NTn1_NTA0_NTB0_NTC0_NTD0_NTM0_NEPBS0_NLCA4_NLCB4_ONLL0_PGR1_PLR0_PKA0_SIA3_SS0_SU32_SUM1_SUS256_SPO0_SRVW0_SSO0_SVW8_SK0_SKXCCM0_TLDS0_ULSGRO0_USL1_UIOFGRO0_USFGROn1_VSn1_VWA1_VWB1_WSGRA0_WSGRB0_WS32_WG32_4_1_WGM8_WGMXCC1_WGMXCCGn1
    SolutionIndex: 152
    SolutionNameMin: Cijk_Ailk_Bjlk_BSS_BH_Bias_SHB_HA_S_SAB_SCD_SAV_UserArgs_MT64x64x32_MI16x16x1_SN_LDSB1_AFC1_AFEM1_AFEM1_ASEM1_CLR1_CADS0_DTLA0_DTLB0_DTVA0_DTVB0_EPS1_FDSI0_GRPM1_GRVWA8_GRVWB8_GSU1_GSUAMB_GSUC0_GSUWGMRR0_GLS0_ISA1201_IU2_K1_LBSPPA1024_LBSPPB1024_LBSPPM0_LPA32_LPB32_LPM0_LRVW8_LWPMn1_MIAV1_MIWT2_2_MO40_NTn1_NTA0_NTB0_NTC0_NTD0_NTM0_NEPBS0_NLCA1_NLCB1_ONLL0_PGR1_PLR1_PKA0_SIA2_SS1_SU32_SUM1_SUS256_SPO0_SRVW0_SSO0_SVW2_SK0_SKXCCM0_TLDS0_ULSGRO0_USL1_UIOFGRO0_USFGROn1_VSn1_VWA2_VWB2_WSGRA0_WSGRB0_WS32_WG32_4_1_WGM8_WGMXCC1_WGMXCCGn1
    SolutionIndex: 154
    SolutionNameMin: Cijk_Ailk_Bjlk_BSS_BH_Bias_SHB_HA_S_SAB_SCD_SAV_UserArgs_MT64x64x16_MI16x16x1_SN_LDSB0_AFC1_AFEM1_AFEM1_ASEM1_CLR0_CADS0_DTLA0_DTLB0_DTVA0_DTVB0_EPS0_FDSI0_GRPM1_GRVWA8_GRVWB4_GSU1_GSUAMB_GSUC0_GSUWGMRR0_GLS0_ISA1201_IU1_K1_LBSPPA1024_LBSPPB1024_LBSPPM0_LPA32_LPB32_LPM0_LRVW8_LWPMn1_MIAV1_MIWT2_2_MO40_NTn1_NTA0_NTB0_NTC0_NTD0_NTM0_NEPBS0_NLCA1_NLCB1_ONLL0_PGR2_PLR0_PKA0_SIA3_SS1_SU32_SUM1_SUS256_SPO0_SRVW0_SSO0_SVW2_SK0_SKXCCM0_TLDS0_ULSGRO1_USL1_UIOFGRO0_USFGROn1_VSn1_VWA2_VWB2_WSGRA0_WSGRB0_WS32_WG32_4_1_WGM8_WGMXCC1_WGMXCCGn1
    SolutionIndex: 156
    SolutionNameMin: Cijk_Ailk_Bjlk_BSS_BH_Bias_SHB_HA_S_SAB_SCD_SAV_UserArgs_MT64x64x32_MI16x16x1_SN_LDSB1_AFC1_AFEM1_AFEM1_ASEM1_CLR1_CADS0_DTLA0_DTLB0_DTVA0_DTVB0_EPS0_FDSI0_GRPM1_GRVWA4_GRVWB4_GSU1_GSUAMB_GSUC0_GSUWGMRR0_GLS0_ISA1201_IU2_K1_LBSPPA1024_LBSPPB1024_LBSPPM0_LPA32_LPB32_LPM0_LRVW8_LWPMn1_MIAV1_MIWT2_2_MO40_NTn1_NTA0_NTB0_NTC0_NTD0_NTM0_NEPBS0_NLCA1_NLCB1_ONLL0_PGR2_PLR1_PKA0_SIA2_SS1_SU32_SUM1_SUS256_SPO0_SRVW0_SSO0_SVW2_SK0_SKXCCM0_TLDS0_ULSGRO0_USL1_UIOFGRO0_USFGROn1_VSn1_VWA2_VWB2_WSGRA0_WSGRB0_WS32_WG32_4_1_WGM8_WGMXCC1_WGMXCCGn1
    SolutionIndex: 159
    SolutionNameMin: Cijk_Ailk_Bjlk_BSS_BH_Bias_SHB_HA_S_SAB_SCD_SAV_UserArgs_MT64x64x64_MI16x16x1_SN_LDSB0_AFC1_AFEM1_AFEM1_ASEM1_CLR1_CADS0_DTLA0_DTLB0_DTVA1_DTVB0_EPS0_FDSI0_GRPM1_GRVWA8_GRVWB8_GSU1_GSUAMB_GSUC0_GSUWGMRR0_GLS0_ISA1201_IU1_K1_LBSPPA0_LBSPPB1024_LBSPPM0_LPA0_LPB32_LPM0_LRVW8_LWPMn1_MIAV1_MIWT2_2_MO40_NTn1_NTA0_NTB0_NTC0_NTD0_NTM0_NEPBS0_NLCA4_NLCB1_ONLL0_PGR2_PLR1_PKA0_SIA3_SS0_SU32_SUM1_SUS256_SPO0_SRVW0_SSO0_SVW8_SK0_SKXCCM0_TLDS0_ULSGRO0_USL1_UIOFGRO0_USFGROn1_VSn1_VWA1_VWB2_WSGRA0_WSGRB0_WS32_WG32_4_1_WGM8_WGMXCC1_WGMXCCGn1
    SolutionIndex: 161
    SolutionNameMin: Cijk_Ailk_Bjlk_BSS_BH_Bias_SHB_HA_S_SAB_SCD_SAV_UserArgs_MT64x64x16_MI16x16x1_SN_LDSB1_AFC1_AFEM1_AFEM1_ASEM1_CLR1_CADS0_DTLA0_DTLB0_DTVA0_DTVB0_EPS1_FDSI0_GRPM1_GRVWA1_GRVWB1_GSU1_GSUAMB_GSUC0_GSUWGMRR0_GLS0_ISA1201_IU1_K1_LBSPPA1024_LBSPPB1024_LBSPPM0_LPA32_LPB32_LPM0_LRVW8_LWPMn1_MIAV1_MIWT2_2_MO40_NTn1_NTA0_NTB0_NTC0_NTD0_NTM0_NEPBS0_NLCA1_NLCB1_ONLL0_PGR1_PLR1_PKA0_SIA2_SS1_SU32_SUM1_SUS256_SPO0_SRVW0_SSO0_SVW2_SK0_SKXCCM0_TLDS0_ULSGRO0_USL1_UIOFGRO0_USFGROn1_VSn1_VWA2_VWB2_WSGRA0_WSGRB0_WS32_WG32_4_1_WGM8_WGMXCC1_WGMXCCGn1
    SolutionIndex: 163
    SolutionNameMin: Cijk_Ailk_Bjlk_BSS_BH_Bias_SHB_HA_S_SAB_SCD_SAV_UserArgs_MT64x64x16_MI16x16x1_SN_LDSB1_AFC1_AFEM1_AFEM1_ASEM1_CLR1_CADS0_DTLA0_DTLB0_DTVA0_DTVB0_EPS0_FDSI0_GRPM1_GRVWA4_GRVWB4_GSU1_GSUAMB_GSUC0_GSUWGMRR0_GLS0_ISA1201_IU1_K1_LBSPPA1024_LBSPPB1024_LBSPPM0_LPA32_LPB32_LPM0_LRVW8_LWPMn1_MIAV1_MIWT2_2_MO40_NTn1_NTA0_NTB0_NTC0_NTD0_NTM0_NEPBS0_NLCA1_NLCB1_ONLL0_PGR2_PLR1_PKA0_SIA2_SS1_SU32_SUM1_SUS256_SPO0_SRVW0_SSO0_SVW2_SK0_SKXCCM0_TLDS0_ULSGRO1_USL1_UIOFGRO0_USFGROn1_VSn1_VWA2_VWB2_WSGRA0_WSGRB0_WS32_WG32_4_1_WGM8_WGMXCC1_WGMXCCGn1
    SolutionIndex: 164
    SolutionNameMin: Cijk_Ailk_Bjlk_BSS_BH_Bias_SHB_HA_S_SAB_SCD_SAV_UserArgs_MT64x64x32_MI16x16x1_SN_LDSB1_AFC1_AFEM1_AFEM1_ASEM1_CLR1_CADS0_DTLA0_DTLB0_DTVA0_DTVB0_EPS1_FDSI0_GRPM1_GRVWA4_GRVWB4_GSU1_GSUAMB_GSUC0_GSUWGMRR0_GLS0_ISA1201_IU2_K1_LBSPPA1024_LBSPPB1024_LBSPPM0_LPA32_LPB32_LPM0_LRVW8_LWPMn1_MIAV1_MIWT2_2_MO40_NTn1_NTA0_NTB0_NTC0_NTD0_NTM0_NEPBS0_NLCA1_NLCB1_ONLL0_PGR1_PLR1_PKA0_SIA2_SS1_SU32_SUM1_SUS256_SPO0_SRVW0_SSO0_SVW2_SK0_SKXCCM0_TLDS0_ULSGRO0_USL1_UIOFGRO0_USFGROn1_VSn1_VWA2_VWB2_WSGRA0_WSGRB0_WS32_WG32_4_1_WGM8_WGMXCC1_WGMXCCGn1
    SolutionIndex: 165
    SolutionNameMin: Cijk_Ailk_Bjlk_BSS_BH_Bias_SHB_HA_S_SAB_SCD_SAV_UserArgs_MT64x64x32_MI16x16x1_SN_LDSB0_AFC1_AFEM1_AFEM1_ASEM1_CLR1_CADS0_DTLA0_DTLB0_DTVA0_DTVB1_EPS0_FDSI0_GRPM1_GRVWA4_GRVWB8_GSU1_GSUAMB_GSUC0_GSUWGMRR0_GLS0_ISA1201_IU1_K1_LBSPPA1024_LBSPPB0_LBSPPM0_LPA32_LPB0_LPM0_LRVW8_LWPMn1_MIAV1_MIWT2_2_MO40_NTn1_NTA0_NTB0_NTC0_NTD0_NTM0_NEPBS0_NLCA1_NLCB2_ONLL0_PGR2_PLR1_PKA0_SIA3_SS1_SU32_SUM1_SUS256_SPO0_SRVW0_SSO0_SVW2_SK0_SKXCCM0_TLDS0_ULSGRO0_USL1_UIOFGRO0_USFGROn1_VSn1_VWA2_VWB1_WSGRA0_WSGRB0_WS32_WG32_4_1_WGM8_WGMXCC1_WGMXCCGn1
    SolutionIndex: 166
    SolutionNameMin: Cijk_Ailk_Bjlk_BSS_BH_Bias_SHB_HA_S_SAB_SCD_SAV_UserArgs_MT64x64x32_MI16x16x1_SN_LDSB1_AFC1_AFEM1_AFEM1_ASEM1_CLR1_CADS0_DTLA0_DTLB0_DTVA0_DTVB0_EPS0_FDSI0_GRPM1_GRVWA4_GRVWB8_GSU1_GSUAMB_GSUC0_GSUWGMRR0_GLS0_ISA1201_IU2_K1_LBSPPA1024_LBSPPB1024_LBSPPM0_LPA32_LPB32_LPM0_LRVW8_LWPMn1_MIAV1_MIWT2_2_MO40_NTn1_NTA0_NTB0_NTC0_NTD0_NTM0_NEPBS0_NLCA1_NLCB1_ONLL0_PGR2_PLR1_PKA0_SIA2_SS1_SU32_SUM1_SUS256_SPO0_SRVW0_SSO0_SVW2_SK0_SKXCCM0_TLDS0_ULSGRO1_USL1_UIOFGRO0_USFGROn1_VSn1_VWA2_VWB2_WSGRA0_WSGRB0_WS32_WG32_4_1_WGM8_WGMXCC1_WGMXCCGn1
    SolutionIndex: 168
    SolutionNameMin: Cijk_Ailk_Bjlk_BSS_BH_Bias_SHB_HA_S_SAB_SCD_SAV_UserArgs_MT32x32x64_MI16x16x1_SN_LDSB1_AFC1_AFEM1_AFEM1_ASEM1_CLR1_CADS0_DTLA0_DTLB0_DTVA0_DTVB0_EPS0_FDSI0_GRPM1_GRVWA1_GRVWB1_GSU1_GSUAMB_GSUC0_GSUWGMRR0_GLS0_ISA1201_IU4_K1_LBSPPA512_LBSPPB512_LBSPPM0_LPA16_LPB16_LPM0_LRVW8_LWPMn1_MIAV1_MIWT1_1_MO40_NTn1_NTA0_NTB0_NTC0_NTD0_NTM0_NEPBS0_NLCA1_NLCB1_ONLL0_PGR2_PLR1_PKA0_SIA2_SS1_SU32_SUM1_SUS256_SPO0_SRVW0_SSO0_SVW1_SK0_SKXCCM0_TLDS0_ULSGRO0_USL1_UIOFGRO0_USFGROn1_VSn1_VWA1_VWB1_WSGRA0_WSGRB0_WS32_WG32_4_1_WGM8_WGMXCC1_WGMXCCGn1
    SolutionIndex: 170
    SolutionNameMin: Cijk_Ailk_Bjlk_BSS_BH_Bias_SHB_HA_S_SAB_SCD_SAV_UserArgs_MT32x32x32_MI16x16x1_SN_LDSB1_AFC1_AFEM1_AFEM1_ASEM1_CLR1_CADS0_DTLA0_DTLB0_DTVA0_DTVB0_EPS1_FDSI0_GRPM1_GRVWA1_GRVWB8_GSU1_GSUAMB_GSUC0_GSUWGMRR0_GLS0_ISA1201_IU2_K1_LBSPPA512_LBSPPB512_LBSPPM0_LPA16_LPB16_LPM0_LRVW8_LWPMn1_MIAV1_MIWT1_1_MO40_NTn1_NTA0_NTB0_NTC0_NTD0_NTM0_NEPBS0_NLCA1_NLCB1_ONLL0_PGR1_PLR1_PKA0_SIA2_SS0_SU32_SUM1_SUS256_SPO0_SRVW0_SSO0_SVW8_SK0_SKXCCM0_TLDS0_ULSGRO0_USL1_UIOFGRO0_USFGROn1_VSn1_VWA1_VWB1_WSGRA0_WSGRB0_WS32_WG32_4_1_WGM8_WGMXCC1_WGMXCCGn1
    SolutionIndex: 172
    SolutionNameMin: Cijk_Ailk_Bjlk_BSS_BH_Bias_SHB_HA_S_SAB_SCD_SAV_UserArgs_MT64x64x32_MI16x16x1_SN_LDSB1_AFC1_AFEM1_AFEM1_ASEM1_CLR1_CADS0_DTLA0_DTLB0_DTVA0_DTVB0_EPS1_FDSI0_GRPM1_GRVWA8_GRVWB4_GSU1_GSUAMB_GSUC0_GSUWGMRR0_GLS0_ISA1201_IU2_K1_LBSPPA1024_LBSPPB1024_LBSPPM0_LPA32_LPB32_LPM0_LRVW8_LWPMn1_MIAV1_MIWT2_2_MO40_NTn1_NTA0_NTB0_NTC0_NTD0_NTM0_NEPBS0_NLCA1_NLCB1_ONLL0_PGR1_PLR1_PKA0_SIA2_SS1_SU32_SUM1_SUS256_SPO0_SRVW0_SSO0_SVW2_SK0_SKXCCM0_TLDS0_ULSGRO0_USL1_UIOFGRO0_USFGROn1_VSn1_VWA2_VWB2_WSGRA0_WSGRB0_WS32_WG32_4_1_WGM8_WGMXCC1_WGMXCCGn1
    SolutionIndex: 173
    SolutionNameMin: Cijk_Ailk_Bjlk_BSS_BH_Bias_SHB_HA_S_SAB_SCD_SAV_UserArgs_MT32x128x32_MI16x16x1_SN_LDSB0_AFC1_AFEM1_AFEM1_ASEM1_CLR1_CADS0_DTLA0_DTLB0_DTVA0_DTVB0_EPS0_FDSI0_GRPM1_GRVWA4_GRVWB4_GSU1_GSUAMB_GSUC0_GSUWGMRR0_GLS0_ISA1201_IU1_K1_LBSPPA512_LBSPPB2048_LBSPPM0_LPA16_LPB0_LPM0_LRVW8_LWPMn1_MIAV1_MIWT1_4_MO40_NTn1_NTA0_NTB0_NTC0_NTD0_NTM0_NEPBS0_NLCA1_NLCB1_ONLL0_PGR2_PLR1_PKA0_SIA3_SS0_SU32_SUM1_SUS256_SPO0_SRVW0_SSO0_SVW8_SK0_SKXCCM0_TLDS0_ULSGRO1_USL1_UIOFGRO0_USFGROn1_VSn1_VWA1_VWB4_WSGRA0_WSGRB0_WS32_WG32_4_1_WGM8_WGMXCC1_WGMXCCGn1
    SolutionIndex: 175
    SolutionNameMin: Cijk_Ailk_Bjlk_BSS_BH_Bias_SHB_HA_S_SAB_SCD_SAV_UserArgs_MT64x64x32_MI16x16x1_SN_LDSB1_AFC1_AFEM1_AFEM1_ASEM1_CLR1_CADS0_DTLA0_DTLB0_DTVA0_DTVB0_EPS1_FDSI0_GRPM1_GRVWA1_GRVWB1_GSU1_GSUAMB_GSUC0_GSUWGMRR0_GLS0_ISA1201_IU2_K1_LBSPPA1024_LBSPPB1024_LBSPPM0_LPA32_LPB32_LPM0_LRVW8_LWPMn1_MIAV1_MIWT2_2_MO40_NTn1_NTA0_NTB0_NTC0_NTD0_NTM0_NEPBS0_NLCA1_NLCB1_ONLL0_PGR1_PLR1_PKA0_SIA2_SS1_SU32_SUM1_SUS256_SPO0_SRVW0_SSO0_SVW2_SK0_SKXCCM0_TLDS0_ULSGRO0_USL1_UIOFGRO0_USFGROn1_VSn1_VWA2_VWB2_WSGRA0_WSGRB0_WS32_WG32_4_1_WGM8_WGMXCC1_WGMXCCGn1
    SolutionIndex: 176
    SolutionNameMin: Cijk_Ailk_Bjlk_BSS_BH_Bias_SHB_HA_S_SAB_SCD_SAV_UserArgs_MT64x64x16_MI16x16x1_SN_LDSB1_AFC1_AFEM1_AFEM1_ASEM1_CLR1_CADS0_DTLA0_DTLB0_DTVA0_DTVB0_EPS0_FDSI0_GRPM1_GRVWA8_GRVWB4_GSU1_GSUAMB_GSUC0_GSUWGMRR0_GLS0_ISA1201_IU1_K1_LBSPPA1024_LBSPPB1024_LBSPPM0_LPA32_LPB32_LPM0_LRVW8_LWPMn1_MIAV1_MIWT2_2_MO40_NTn1_NTA0_NTB0_NTC0_NTD0_NTM0_NEPBS0_NLCA1_NLCB1_ONLL0_PGR2_PLR1_PKA0_SIA2_SS1_SU32_SUM1_SUS256_SPO0_SRVW0_SSO0_SVW2_SK0_SKXCCM0_TLDS0_ULSGRO0_USL1_UIOFGRO0_USFGROn1_VSn1_VWA2_VWB2_WSGRA0_WSGRB0_WS32_WG32_4_1_WGM8_WGMXCC1_WGMXCCGn1
    SolutionIndex: 179
    SolutionNameMin: Cijk_Ailk_Bjlk_BSS_BH_Bias_SHB_HA_S_SAB_SCD_SAV_UserArgs_MT128x32x16_MI16x16x1_SN_LDSB1_AFC1_AFEM1_AFEM1_ASEM1_CLR1_CADS0_DTLA0_DTLB0_DTVA0_DTVB0_EPS1_FDSI0_GRPM1_GRVWA8_GRVWB1_GSU1_GSUAMB_GSUC0_GSUWGMRR0_GLS0_ISA1201_IU1_K1_LBSPPA2048_LBSPPB512_LBSPPM0_LPA0_LPB16_LPM0_LRVW8_LWPMn1_MIAV1_MIWT4_1_MO40_NTn1_NTA0_NTB0_NTC0_NTD0_NTM0_NEPBS0_NLCA1_NLCB1_ONLL0_PGR1_PLR1_PKA0_SIA2_SS1_SU32_SUM1_SUS256_SPO0_SRVW0_SSO0_SVW4_SK0_SKXCCM0_TLDS0_ULSGRO0_USL1_UIOFGRO0_USFGROn1_VSn1_VWA4_VWB1_WSGRA0_WSGRB0_WS32_WG32_4_1_WGM8_WGMXCC1_WGMXCCGn1
    SolutionIndex: 180
    SolutionNameMin: Cijk_Ailk_Bjlk_BSS_BH_Bias_SHB_HA_S_SAB_SCD_SAV_UserArgs_MT64x64x16_MI16x16x1_SN_LDSB1_AFC1_AFEM1_AFEM1_ASEM1_CLR1_CADS0_DTLA0_DTLB0_DTVA0_DTVB0_EPS1_FDSI0_GRPM1_GRVWA8_GRVWB4_GSU1_GSUAMB_GSUC0_GSUWGMRR0_GLS0_ISA1201_IU1_K1_LBSPPA1024_LBSPPB1024_LBSPPM0_LPA32_LPB32_LPM0_LRVW8_LWPMn1_MIAV1_MIWT2_2_MO40_NTn1_NTA0_NTB0_NTC0_NTD0_NTM0_NEPBS0_NLCA1_NLCB1_ONLL0_PGR1_PLR1_PKA0_SIA2_SS1_SU32_SUM1_SUS256_SPO0_SRVW0_SSO0_SVW2_SK0_SKXCCM0_TLDS0_ULSGRO0_USL1_UIOFGRO0_USFGROn1_VSn1_VWA2_VWB2_WSGRA0_WSGRB0_WS32_WG32_4_1_WGM8_WGMXCC1_WGMXCCGn1
    SolutionIndex: 182
    SolutionNameMin: Cijk_Ailk_Bjlk_BSS_BH_Bias_SHB_HA_S_SAB_SCD_SAV_UserArgs_MT64x64x16_MI16x16x1_SN_LDSB1_AFC1_AFEM1_AFEM1_ASEM1_CLR1_CADS0_DTLA0_DTLB0_DTVA0_DTVB0_EPS1_FDSI0_GRPM1_GRVWA1_GRVWB4_GSU1_GSUAMB_GSUC0_GSUWGMRR0_GLS0_ISA1201_IU1_K1_LBSPPA1024_LBSPPB1024_LBSPPM0_LPA32_LPB32_LPM0_LRVW8_LWPMn1_MIAV1_MIWT2_2_MO40_NTn1_NTA0_NTB0_NTC0_NTD0_NTM0_NEPBS0_NLCA1_NLCB1_ONLL0_PGR1_PLR1_PKA0_SIA2_SS1_SU32_SUM1_SUS256_SPO0_SRVW0_SSO0_SVW2_SK0_SKXCCM0_TLDS0_ULSGRO0_USL1_UIOFGRO0_USFGROn1_VSn1_VWA2_VWB2_WSGRA0_WSGRB0_WS32_WG32_4_1_WGM8_WGMXCC1_WGMXCCGn1
    SolutionIndex: 183
    SolutionNameMin: Cijk_Ailk_Bjlk_BSS_BH_Bias_SHB_HA_S_SAB_SCD_SAV_UserArgs_MT128x32x16_MI16x16x1_SN_LDSB0_AFC1_AFEM1_AFEM1_ASEM1_CLR0_CADS0_DTLA0_DTLB0_DTVA0_DTVB0_EPS0_FDSI0_GRPM1_GRVWA8_GRVWB1_GSU1_GSUAMB_GSUC0_GSUWGMRR0_GLS0_ISA1201_IU1_K1_LBSPPA2048_LBSPPB512_LBSPPM0_LPA0_LPB16_LPM0_LRVW8_LWPMn1_MIAV1_MIWT4_1_MO40_NTn1_NTA0_NTB0_NTC0_NTD0_NTM0_NEPBS0_NLCA1_NLCB1_ONLL0_PGR2_PLR0_PKA0_SIA3_SS1_SU32_SUM1_SUS256_SPO0_SRVW0_SSO0_SVW4_SK0_SKXCCM0_TLDS0_ULSGRO1_USL1_UIOFGRO0_USFGROn1_VSn1_VWA4_VWB1_WSGRA0_WSGRB0_WS32_WG32_4_1_WGM8_WGMXCC1_WGMXCCGn1
    SolutionIndex: 184
    SolutionNameMin: Cijk_Ailk_Bjlk_BSS_BH_Bias_SHB_HA_S_SAB_SCD_SAV_UserArgs_MT64x64x32_MI16x16x1_SN_LDSB1_AFC1_AFEM1_AFEM1_ASEM1_CLR1_CADS0_DTLA0_DTLB0_DTVA0_DTVB0_EPS0_FDSI0_GRPM1_GRVWA1_GRVWB1_GSU1_GSUAMB_GSUC0_GSUWGMRR0_GLS0_ISA1201_IU2_K1_LBSPPA1024_LBSPPB1024_LBSPPM0_LPA32_LPB32_LPM0_LRVW8_LWPMn1_MIAV1_MIWT2_2_MO40_NTn1_NTA0_NTB0_NTC0_NTD0_NTM0_NEPBS0_NLCA1_NLCB1_ONLL0_PGR2_PLR1_PKA0_SIA2_SS1_SU32_SUM1_SUS256_SPO0_SRVW0_SSO0_SVW2_SK0_SKXCCM0_TLDS0_ULSGRO0_USL1_UIOFGRO0_USFGROn1_VSn1_VWA2_VWB2_WSGRA0_WSGRB0_WS32_WG32_4_1_WGM8_WGMXCC1_WGMXCCGn1
    SolutionIndex: 186
    SolutionNameMin: Cijk_Ailk_Bjlk_BSS_BH_Bias_SHB_HA_S_SAB_SCD_SAV_UserArgs_MT16x32x32_MI16x16x1_SN_LDSB0_AFC1_AFEM1_AFEM1_ASEM1_CLR1_CADS0_DTLA0_DTLB0_DTVA0_DTVB1_EPS0_FDSI0_GRPM1_GRVWA1_GRVWB8_GSU1_GSUAMB_GSUC0_GSUWGMRR0_GLS0_ISA1201_IU1_K1_LBSPPA256_LBSPPB0_LBSPPM0_LPA16_LPB0_LPM0_LRVW8_LWPMn1_MIAV1_MIWT1_1_MO40_NTn1_NTA0_NTB0_NTC0_NTD0_NTM0_NEPBS0_NLCA1_NLCB1_ONLL0_PGR2_PLR1_PKA0_SIA3_SS0_SU32_SUM1_SUS256_SPO0_SRVW0_SSO0_SVW8_SK0_SKXCCM0_TLDS0_ULSGRO0_USL1_UIOFGRO0_USFGROn1_VSn1_VWA1_VWB1_WSGRA0_WSGRB0_WS32_WG16_4_1_WGM8_WGMXCC1_WGMXCCGn1
    SolutionIndex: 188
    SolutionNameMin: Cijk_Ailk_Bjlk_BSS_BH_Bias_SHB_HA_S_SAB_SCD_SAV_UserArgs_MT32x32x64_MI16x16x1_SN_LDSB0_AFC1_AFEM1_AFEM1_ASEM1_CLR1_CADS0_DTLA0_DTLB0_DTVA0_DTVB0_EPS0_FDSI0_GRPM1_GRVWA1_GRVWB8_GSU1_GSUAMB_GSUC0_GSUWGMRR0_GLS0_ISA1201_IU1_K1_LBSPPA512_LBSPPB512_LBSPPM0_LPA16_LPB16_LPM0_LRVW8_LWPMn1_MIAV1_MIWT1_1_MO40_NTn1_NTA0_NTB0_NTC0_NTD0_NTM0_NEPBS0_NLCA1_NLCB1_ONLL0_PGR2_PLR1_PKA0_SIA3_SS0_SU32_SUM1_SUS256_SPO0_SRVW0_SSO0_SVW8_SK0_SKXCCM0_TLDS0_ULSGRO1_USL1_UIOFGRO0_USFGROn1_VSn1_VWA1_VWB1_WSGRA0_WSGRB0_WS32_WG32_4_1_WGM8_WGMXCC1_WGMXCCGn1
    SolutionIndex: 189
    SolutionNameMin: Cijk_Ailk_Bjlk_BSS_BH_Bias_SHB_HA_S_SAB_SCD_SAV_UserArgs_MT32x128x32_MI16x16x1_SN_LDSB1_AFC1_AFEM1_AFEM1_ASEM1_CLR1_CADS0_DTLA0_DTLB0_DTVA0_DTVB0_EPS1_FDSI0_GRPM1_GRVWA4_GRVWB8_GSU1_GSUAMB_GSUC0_GSUWGMRR0_GLS0_ISA1201_IU2_K1_LBSPPA512_LBSPPB2048_LBSPPM0_LPA16_LPB0_LPM0_LRVW8_LWPMn1_MIAV1_MIWT1_4_MO40_NTn1_NTA0_NTB0_NTC0_NTD0_NTM0_NEPBS0_NLCA1_NLCB1_ONLL0_PGR1_PLR1_PKA0_SIA2_SS0_SU32_SUM1_SUS256_SPO0_SRVW0_SSO0_SVW8_SK0_SKXCCM0_TLDS0_ULSGRO0_USL1_UIOFGRO0_USFGROn1_VSn1_VWA1_VWB4_WSGRA0_WSGRB0_WS32_WG32_4_1_WGM8_WGMXCC1_WGMXCCGn1
    SolutionIndex: 191
    SolutionNameMin: Cijk_Ailk_Bjlk_BSS_BH_Bias_SHB_HA_S_SAB_SCD_SAV_UserArgs_MT64x64x32_MI16x16x1_SN_LDSB0_AFC1_AFEM1_AFEM1_ASEM1_CLR1_CADS0_DTLA0_DTLB0_DTVA0_DTVB0_EPS0_FDSI0_GRPM1_GRVWA8_GRVWB4_GSU1_GSUAMB_GSUC0_GSUWGMRR0_GLS0_ISA1201_IU1_K1_LBSPPA1024_LBSPPB1024_LBSPPM0_LPA32_LPB32_LPM0_LRVW8_LWPMn1_MIAV1_MIWT2_2_MO40_NTn1_NTA0_NTB0_NTC0_NTD0_NTM0_NEPBS0_NLCA1_NLCB1_ONLL0_PGR2_PLR1_PKA0_SIA3_SS1_SU32_SUM1_SUS256_SPO0_SRVW0_SSO0_SVW2_SK0_SKXCCM0_TLDS0_ULSGRO1_USL1_UIOFGRO0_USFGROn1_VSn1_VWA2_VWB2_WSGRA0_WSGRB0_WS32_WG32_4_1_WGM8_WGMXCC1_WGMXCCGn1
    SolutionIndex: 192
    SolutionNameMin: Cijk_Ailk_Bjlk_BSS_BH_Bias_SHB_HA_S_SAB_SCD_SAV_UserArgs_MT64x64x16_MI16x16x1_SN_LDSB1_AFC1_AFEM1_AFEM1_ASEM1_CLR1_CADS0_DTLA0_DTLB0_DTVA0_DTVB0_EPS1_FDSI0_GRPM1_GRVWA4_GRVWB8_GSU1_GSUAMB_GSUC0_GSUWGMRR0_GLS0_ISA1201_IU1_K1_LBSPPA1024_LBSPPB1024_LBSPPM0_LPA32_LPB32_LPM0_LRVW8_LWPMn1_MIAV1_MIWT2_2_MO40_NTn1_NTA0_NTB0_NTC0_NTD0_NTM0_NEPBS0_NLCA1_NLCB1_ONLL0_PGR1_PLR1_PKA0_SIA2_SS1_SU32_SUM1_SUS256_SPO0_SRVW0_SSO0_SVW2_SK0_SKXCCM0_TLDS0_ULSGRO0_USL1_UIOFGRO0_USFGROn1_VSn1_VWA2_VWB2_WSGRA0_WSGRB0_WS32_WG32_4_1_WGM8_WGMXCC1_WGMXCCGn1
    SolutionIndex: 193
    SolutionNameMin: Cijk_Ailk_Bjlk_BSS_BH_Bias_SHB_HA_S_SAB_SCD_SAV_UserArgs_MT64x64x16_MI16x16x1_SN_LDSB0_AFC1_AFEM1_AFEM1_ASEM1_CLR0_CADS0_DTLA0_DTLB0_DTVA0_DTVB0_EPS0_FDSI0_GRPM1_GRVWA4_GRVWB4_GSU1_GSUAMB_GSUC0_GSUWGMRR0_GLS0_ISA1201_IU1_K1_LBSPPA1024_LBSPPB1024_LBSPPM0_LPA32_LPB32_LPM0_LRVW8_LWPMn1_MIAV1_MIWT2_2_MO40_NTn1_NTA0_NTB0_NTC0_NTD0_NTM0_NEPBS0_NLCA1_NLCB1_ONLL0_PGR2_PLR0_PKA0_SIA3_SS1_SU32_SUM1_SUS256_SPO0_SRVW0_SSO0_SVW2_SK0_SKXCCM0_TLDS0_ULSGRO1_USL1_UIOFGRO0_USFGROn1_VSn1_VWA2_VWB2_WSGRA0_WSGRB0_WS32_WG32_4_1_WGM8_WGMXCC1_WGMXCCGn1
    SolutionIndex: 196
    SolutionNameMin: Cijk_Ailk_Bjlk_BSS_BH_Bias_SHB_HA_S_SAB_SCD_SAV_UserArgs_MT64x64x16_MI16x16x1_SN_LDSB1_AFC1_AFEM1_AFEM1_ASEM1_CLR1_CADS0_DTLA0_DTLB0_DTVA0_DTVB0_EPS0_FDSI0_GRPM1_GRVWA8_GRVWB8_GSU1_GSUAMB_GSUC0_GSUWGMRR0_GLS0_ISA1201_IU1_K1_LBSPPA1024_LBSPPB1024_LBSPPM0_LPA32_LPB32_LPM0_LRVW8_LWPMn1_MIAV1_MIWT2_2_MO40_NTn1_NTA0_NTB0_NTC0_NTD0_NTM0_NEPBS0_NLCA1_NLCB1_ONLL0_PGR2_PLR1_PKA0_SIA2_SS1_SU32_SUM1_SUS256_SPO0_SRVW0_SSO0_SVW2_SK0_SKXCCM0_TLDS0_ULSGRO0_USL1_UIOFGRO0_USFGROn1_VSn1_VWA2_VWB2_WSGRA0_WSGRB0_WS32_WG32_4_1_WGM8_WGMXCC1_WGMXCCGn1
    SolutionIndex: 203
    SolutionNameMin: Cijk_Ailk_Bjlk_BSS_BH_Bias_SHB_HA_S_SAB_SCD_SAV_UserArgs_MT128x32x32_MI16x16x1_SN_LDSB0_AFC1_AFEM1_AFEM1_ASEM1_CLR1_CADS0_DTLA0_DTLB0_DTVA0_DTVB0_EPS0_FDSI0_GRPM1_GRVWA8_GRVWB8_GSU1_GSUAMB_GSUC0_GSUWGMRR0_GLS0_ISA1201_IU1_K1_LBSPPA2048_LBSPPB512_LBSPPM0_LPA0_LPB16_LPM0_LRVW8_LWPMn1_MIAV1_MIWT4_1_MO40_NTn1_NTA0_NTB0_NTC0_NTD0_NTM0_NEPBS0_NLCA1_NLCB1_ONLL0_PGR2_PLR1_PKA0_SIA3_SS1_SU32_SUM1_SUS256_SPO0_SRVW0_SSO0_SVW4_SK0_SKXCCM0_TLDS0_ULSGRO1_USL1_UIOFGRO0_USFGROn1_VSn1_VWA4_VWB1_WSGRA0_WSGRB0_WS32_WG32_4_1_WGM8_WGMXCC1_WGMXCCGn1
    SolutionIndex: 204
    SolutionNameMin: Cijk_Ailk_Bjlk_BSS_BH_Bias_SHB_HA_S_SAB_SCD_SAV_UserArgs_MT64x64x32_MI16x16x1_SN_LDSB1_AFC1_AFEM1_AFEM1_ASEM1_CLR1_CADS0_DTLA0_DTLB0_DTVA0_DTVB0_EPS0_FDSI0_GRPM1_GRVWA8_GRVWB4_GSU1_GSUAMB_GSUC0_GSUWGMRR0_GLS0_ISA1201_IU2_K1_LBSPPA1024_LBSPPB1024_LBSPPM0_LPA32_LPB32_LPM0_LRVW8_LWPMn1_MIAV1_MIWT2_2_MO40_NTn1_NTA0_NTB0_NTC0_NTD0_NTM0_NEPBS0_NLCA1_NLCB1_ONLL0_PGR2_PLR1_PKA0_SIA2_SS1_SU32_SUM1_SUS256_SPO0_SRVW0_SSO0_SVW2_SK0_SKXCCM0_TLDS0_ULSGRO1_USL1_UIOFGRO0_USFGROn1_VSn1_VWA2_VWB2_WSGRA0_WSGRB0_WS32_WG32_4_1_WGM8_WGMXCC1_WGMXCCGn1
    SolutionIndex: 205
    SolutionNameMin: Cijk_Ailk_Bjlk_BSS_BH_Bias_SHB_HA_S_SAB_SCD_SAV_UserArgs_MT64x64x32_MI16x16x1_SN_LDSB0_AFC1_AFEM1_AFEM1_ASEM1_CLR1_CADS0_DTLA0_DTLB0_DTVA0_DTVB0_EPS0_FDSI0_GRPM1_GRVWA1_GRVWB1_GSU1_GSUAMB_GSUC0_GSUWGMRR0_GLS0_ISA1201_IU1_K1_LBSPPA1024_LBSPPB1024_LBSPPM0_LPA32_LPB32_LPM0_LRVW8_LWPMn1_MIAV1_MIWT2_2_MO40_NTn1_NTA0_NTB0_NTC0_NTD0_NTM0_NEPBS0_NLCA1_NLCB1_ONLL0_PGR2_PLR1_PKA0_SIA3_SS1_SU32_SUM1_SUS256_SPO0_SRVW0_SSO0_SVW2_SK0_SKXCCM0_TLDS0_ULSGRO1_USL1_UIOFGRO0_USFGROn1_VSn1_VWA2_VWB2_WSGRA0_WSGRB0_WS32_WG32_4_1_WGM8_WGMXCC1_WGMXCCGn1
    SolutionIndex: 207
    SolutionNameMin: Cijk_Ailk_Bjlk_BSS_BH_Bias_SHB_HA_S_SAB_SCD_SAV_UserArgs_MT64x64x64_MI16x16x1_SN_LDSB0_AFC1_AFEM1_AFEM1_ASEM1_CLR1_CADS0_DTLA0_DTLB0_DTVA0_DTVB1_EPS1_FDSI0_GRPM1_GRVWA8_GRVWB8_GSU1_GSUAMB_GSUC0_GSUWGMRR0_GLS0_ISA1201_IU1_K1_LBSPPA1024_LBSPPB0_LBSPPM0_LPA32_LPB0_LPM0_LRVW8_LWPMn1_MIAV1_MIWT2_2_MO40_NTn1_NTA0_NTB0_NTC0_NTD0_NTM0_NEPBS0_NLCA1_NLCB4_ONLL0_PGR1_PLR1_PKA0_SIA3_SS1_SU32_SUM1_SUS256_SPO0_SRVW0_SSO0_SVW2_SK0_SKXCCM0_TLDS0_ULSGRO0_USL1_UIOFGRO0_USFGROn1_VSn1_VWA2_VWB1_WSGRA0_WSGRB0_WS32_WG32_4_1_WGM8_WGMXCC1_WGMXCCGn1
    SolutionIndex: 208
    SolutionNameMin: Cijk_Ailk_Bjlk_BSS_BH_Bias_SHB_HA_S_SAB_SCD_SAV_UserArgs_MT32x32x64_MI16x16x1_SN_LDSB0_AFC1_AFEM1_AFEM1_ASEM1_CLR1_CADS0_DTLA0_DTLB0_DTVA0_DTVB0_EPS1_FDSI0_GRPM1_GRVWA1_GRVWB1_GSU1_GSUAMB_GSUC0_GSUWGMRR0_GLS0_ISA1201_IU1_K1_LBSPPA512_LBSPPB512_LBSPPM0_LPA16_LPB16_LPM0_LRVW8_LWPMn1_MIAV1_MIWT1_1_MO40_NTn1_NTA0_NTB0_NTC0_NTD0_NTM0_NEPBS0_NLCA1_NLCB1_ONLL0_PGR1_PLR1_PKA0_SIA3_SS0_SU32_SUM1_SUS256_SPO0_SRVW0_SSO0_SVW8_SK0_SKXCCM0_TLDS0_ULSGRO0_USL1_UIOFGRO0_USFGROn1_VSn1_VWA1_VWB1_WSGRA0_WSGRB0_WS32_WG32_4_1_WGM8_WGMXCC1_WGMXCCGn1
    SolutionIndex: 209
    SolutionNameMin: Cijk_Ailk_Bjlk_BSS_BH_Bias_SHB_HA_S_SAB_SCD_SAV_UserArgs_MT32x128x16_MI16x16x1_SN_LDSB1_AFC1_AFEM1_AFEM1_ASEM1_CLR1_CADS0_DTLA0_DTLB0_DTVA0_DTVB0_EPS1_FDSI0_GRPM1_GRVWA1_GRVWB1_GSU1_GSUAMB_GSUC0_GSUWGMRR0_GLS0_ISA1201_IU1_K1_LBSPPA512_LBSPPB2048_LBSPPM0_LPA16_LPB0_LPM0_LRVW8_LWPMn1_MIAV1_MIWT1_4_MO40_NTn1_NTA0_NTB0_NTC0_NTD0_NTM0_NEPBS0_NLCA1_NLCB1_ONLL0_PGR1_PLR1_PKA0_SIA2_SS0_SU32_SUM1_SUS256_SPO0_SRVW0_SSO0_SVW8_SK0_SKXCCM0_TLDS0_ULSGRO0_USL1_UIOFGRO0_USFGROn1_VSn1_VWA1_VWB4_WSGRA0_WSGRB0_WS32_WG32_4_1_WGM8_WGMXCC1_WGMXCCGn1
    SolutionIndex: 213
    SolutionNameMin: Cijk_Ailk_Bjlk_BSS_BH_Bias_SHB_HA_S_SAB_SCD_SAV_UserArgs_MT64x64x32_MI16x16x1_SN_LDSB0_AFC1_AFEM1_AFEM1_ASEM1_CLR1_CADS0_DTLA0_DTLB0_DTVA0_DTVB1_EPS1_FDSI0_GRPM1_GRVWA4_GRVWB8_GSU1_GSUAMB_GSUC0_GSUWGMRR0_GLS0_ISA1201_IU1_K1_LBSPPA1024_LBSPPB0_LBSPPM0_LPA32_LPB0_LPM0_LRVW8_LWPMn1_MIAV1_MIWT2_2_MO40_NTn1_NTA0_NTB0_NTC0_NTD0_NTM0_NEPBS0_NLCA1_NLCB2_ONLL0_PGR1_PLR1_PKA0_SIA3_SS1_SU32_SUM1_SUS256_SPO0_SRVW0_SSO0_SVW2_SK0_SKXCCM0_TLDS0_ULSGRO0_USL1_UIOFGRO0_USFGROn1_VSn1_VWA2_VWB1_WSGRA0_WSGRB0_WS32_WG32_4_1_WGM8_WGMXCC1_WGMXCCGn1
    SolutionIndex: 219
    SolutionNameMin: Cijk_Ailk_Bjlk_BSS_BH_Bias_SHB_HA_S_SAB_SCD_SAV_UserArgs_MT64x64x64_MI16x16x1_SN_LDSB1_AFC1_AFEM1_AFEM1_ASEM1_CLR1_CADS0_DTLA0_DTLB0_DTVA0_DTVB0_EPS0_FDSI0_GRPM1_GRVWA4_GRVWB4_GSU1_GSUAMB_GSUC0_GSUWGMRR0_GLS0_ISA1201_IU4_K1_LBSPPA1024_LBSPPB1024_LBSPPM0_LPA32_LPB32_LPM0_LRVW8_LWPMn1_MIAV1_MIWT2_2_MO40_NTn1_NTA0_NTB0_NTC0_NTD0_NTM0_NEPBS0_NLCA1_NLCB1_ONLL0_PGR2_PLR1_PKA0_SIA2_SS1_SU32_SUM1_SUS256_SPO0_SRVW0_SSO0_SVW2_SK0_SKXCCM0_TLDS0_ULSGRO1_USL1_UIOFGRO0_USFGROn1_VSn1_VWA2_VWB2_WSGRA0_WSGRB0_WS32_WG32_4_1_WGM8_WGMXCC1_WGMXCCGn1
    SolutionIndex: 222
    SolutionNameMin: Cijk_Ailk_Bjlk_BSS_BH_Bias_SHB_HA_S_SAB_SCD_SAV_UserArgs_MT32x32x64_MI16x16x1_SN_LDSB0_AFC1_AFEM1_AFEM1_ASEM1_CLR1_CADS0_DTLA0_DTLB0_DTVA1_DTVB1_EPS0_FDSI0_GRPM1_GRVWA8_GRVWB8_GSU1_GSUAMB_GSUC0_GSUWGMRR0_GLS0_ISA1201_IU1_K1_LBSPPA0_LBSPPB0_LBSPPM0_LPA0_LPB0_LPM0_LRVW8_LWPMn1_MIAV1_MIWT1_1_MO40_NTn1_NTA0_NTB0_NTC0_NTD0_NTM0_NEPBS0_NLCA1_NLCB1_ONLL0_PGR1_PLR0_PKA0_SIA3_SS0_SU32_SUM1_SUS256_SPO0_SRVW0_SSO0_SVW8_SK0_SKXCCM0_TLDS0_ULSGRO0_USL1_UIOFGRO0_USFGROn1_VSn1_VWA1_VWB1_WSGRA0_WSGRB0_WS32_WG32_4_1_WGM8_WGMXCC1_WGMXCCGn1
    SolutionIndex: 223
    SolutionNameMin: Cijk_Ailk_Bjlk_BSS_BH_Bias_SHB_HA_S_SAB_SCD_SAV_UserArgs_MT64x64x16_MI16x16x1_SN_LDSB1_AFC1_AFEM1_AFEM1_ASEM1_CLR1_CADS0_DTLA0_DTLB0_DTVA0_DTVB0_EPS1_FDSI0_GRPM1_GRVWA4_GRVWB4_GSU1_GSUAMB_GSUC0_GSUWGMRR0_GLS0_ISA1201_IU1_K1_LBSPPA1024_LBSPPB1024_LBSPPM0_LPA32_LPB32_LPM0_LRVW8_LWPMn1_MIAV1_MIWT2_2_MO40_NTn1_NTA0_NTB0_NTC0_NTD0_NTM0_NEPBS0_NLCA1_NLCB1_ONLL0_PGR1_PLR1_PKA0_SIA2_SS1_SU32_SUM1_SUS256_SPO0_SRVW0_SSO0_SVW2_SK0_SKXCCM0_TLDS0_ULSGRO0_USL1_UIOFGRO0_USFGROn1_VSn1_VWA2_VWB2_WSGRA0_WSGRB0_WS32_WG32_4_1_WGM8_WGMXCC1_WGMXCCGn1
    SolutionIndex: 225
    SolutionNameMin: Cijk_Ailk_Bjlk_BSS_BH_Bias_SHB_HA_S_SAB_SCD_SAV_UserArgs_MT64x64x16_MI16x16x1_SN_LDSB1_AFC1_AFEM1_AFEM1_ASEM1_CLR1_CADS0_DTLA0_DTLB0_DTVA0_DTVB0_EPS1_FDSI0_GRPM1_GRVWA4_GRVWB1_GSU1_GSUAMB_GSUC0_GSUWGMRR0_GLS0_ISA1201_IU1_K1_LBSPPA1024_LBSPPB1024_LBSPPM0_LPA32_LPB32_LPM0_LRVW8_LWPMn1_MIAV1_MIWT2_2_MO40_NTn1_NTA0_NTB0_NTC0_NTD0_NTM0_NEPBS0_NLCA1_NLCB1_ONLL0_PGR1_PLR1_PKA0_SIA2_SS1_SU32_SUM1_SUS256_SPO0_SRVW0_SSO0_SVW2_SK0_SKXCCM0_TLDS0_ULSGRO0_USL1_UIOFGRO0_USFGROn1_VSn1_VWA2_VWB2_WSGRA0_WSGRB0_WS32_WG32_4_1_WGM8_WGMXCC1_WGMXCCGn1
    SolutionIndex: 227
    SolutionNameMin: Cijk_Ailk_Bjlk_BSS_BH_Bias_SHB_HA_S_SAB_SCD_SAV_UserArgs_MT64x64x32_MI16x16x1_SN_LDSB1_AFC1_AFEM1_AFEM1_ASEM1_CLR1_CADS0_DTLA0_DTLB0_DTVA0_DTVB0_EPS0_FDSI0_GRPM1_GRVWA8_GRVWB8_GSU1_GSUAMB_GSUC0_GSUWGMRR0_GLS0_ISA1201_IU2_K1_LBSPPA1024_LBSPPB1024_LBSPPM0_LPA32_LPB32_LPM0_LRVW8_LWPMn1_MIAV1_MIWT2_2_MO40_NTn1_NTA0_NTB0_NTC0_NTD0_NTM0_NEPBS0_NLCA1_NLCB1_ONLL0_PGR2_PLR1_PKA0_SIA2_SS1_SU32_SUM1_SUS256_SPO0_SRVW0_SSO0_SVW2_SK0_SKXCCM0_TLDS0_ULSGRO0_USL1_UIOFGRO0_USFGROn1_VSn1_VWA2_VWB2_WSGRA0_WSGRB0_WS32_WG32_4_1_WGM8_WGMXCC1_WGMXCCGn1
    SolutionIndex: 232
    SolutionNameMin: Cijk_Ailk_Bjlk_BSS_BH_Bias_SHB_HA_S_SAB_SCD_SAV_UserArgs_MT128x128x16_MI16x16x1_SN_LDSB1_AFC1_AFEM1_AFEM1_ASEM1_CLR1_CADS0_DTLA0_DTLB0_DTVA0_DTVB0_EPS0_FDSI0_GRPM1_GRVWA4_GRVWB4_GSU1_GSUAMB_GSUC0_GSUWGMRR0_GLS0_ISA1201_IU1_K1_LBSPPA2048_LBSPPB2048_LBSPPM0_LPA0_LPB0_LPM0_LRVW8_LWPMn1_MIAV1_MIWT4_4_MO40_NTn1_NTA0_NTB0_NTC0_NTD0_NTM0_NEPBS0_NLCA1_NLCB1_ONLL0_PGR2_PLR1_PKA0_SIA2_SS1_SU32_SUM1_SUS256_SPO0_SRVW0_SSO0_SVW4_SK0_SKXCCM0_TLDS0_ULSGRO0_USL1_UIOFGRO0_USFGROn1_VSn1_VWA4_VWB4_WSGRA0_WSGRB0_WS32_WG32_4_1_WGM8_WGMXCC1_WGMXCCGn1
    SolutionIndex: 233
    SolutionNameMin: Cijk_Ailk_Bjlk_BSS_BH_Bias_SHB_HA_S_SAB_SCD_SAV_UserArgs_MT64x64x16_MI16x16x1_SN_LDSB0_AFC1_AFEM1_AFEM1_ASEM1_CLR1_CADS0_DTLA0_DTLB0_DTVA1_DTVB1_EPS0_FDSI0_GRPM1_GRVWA8_GRVWB8_GSU1_GSUAMB_GSUC0_GSUWGMRR0_GLS0_ISA1201_IU1_K1_LBSPPA0_LBSPPB0_LBSPPM0_LPA0_LPB0_LPM0_LRVW8_LWPMn1_MIAV1_MIWT2_2_MO40_NTn1_NTA0_NTB0_NTC0_NTD0_NTM0_NEPBS0_NLCA1_NLCB1_ONLL0_PGR1_PLR0_PKA0_SIA3_SS0_SU32_SUM1_SUS256_SPO0_SRVW0_SSO0_SVW8_SK0_SKXCCM0_TLDS0_ULSGRO0_USL1_UIOFGRO0_USFGROn1_VSn1_VWA1_VWB1_WSGRA0_WSGRB0_WS32_WG32_4_1_WGM8_WGMXCC1_WGMXCCGn1
    SolutionIndex: 236
    SolutionNameMin: Cijk_Ailk_Bjlk_BSS_BH_Bias_SHB_HA_S_SAB_SCD_SAV_UserArgs_MT64x64x32_MI16x16x1_SN_LDSB0_AFC1_AFEM1_AFEM1_ASEM1_CLR1_CADS0_DTLA0_DTLB0_DTVA0_DTVB1_EPS1_FDSI0_GRPM1_GRVWA8_GRVWB8_GSU1_GSUAMB_GSUC0_GSUWGMRR0_GLS0_ISA1201_IU1_K1_LBSPPA1024_LBSPPB0_LBSPPM0_LPA32_LPB0_LPM0_LRVW8_LWPMn1_MIAV1_MIWT2_2_MO40_NTn1_NTA0_NTB0_NTC0_NTD0_NTM0_NEPBS0_NLCA1_NLCB2_ONLL0_PGR1_PLR1_PKA0_SIA3_SS1_SU32_SUM1_SUS256_SPO0_SRVW0_SSO0_SVW2_SK0_SKXCCM0_TLDS0_ULSGRO0_USL1_UIOFGRO0_USFGROn1_VSn1_VWA2_VWB1_WSGRA0_WSGRB0_WS32_WG32_4_1_WGM8_WGMXCC1_WGMXCCGn1
    SolutionIndex: 237
    SolutionNameMin: Cijk_Ailk_Bjlk_BSS_BH_Bias_SHB_HA_S_SAB_SCD_SAV_UserArgs_MT64x64x32_MI16x16x1_SN_LDSB0_AFC1_AFEM1_AFEM1_ASEM1_CLR1_CADS0_DTLA0_DTLB0_DTVA0_DTVB1_EPS0_FDSI0_GRPM1_GRVWA8_GRVWB8_GSU1_GSUAMB_GSUC0_GSUWGMRR0_GLS0_ISA1201_IU1_K1_LBSPPA1024_LBSPPB0_LBSPPM0_LPA32_LPB0_LPM0_LRVW8_LWPMn1_MIAV1_MIWT2_2_MO40_NTn1_NTA0_NTB0_NTC0_NTD0_NTM0_NEPBS0_NLCA1_NLCB2_ONLL0_PGR2_PLR1_PKA0_SIA3_SS1_SU32_SUM1_SUS256_SPO0_SRVW0_SSO0_SVW2_SK0_SKXCCM0_TLDS0_ULSGRO0_USL1_UIOFGRO0_USFGROn1_VSn1_VWA2_VWB1_WSGRA0_WSGRB0_WS32_WG32_4_1_WGM8_WGMXCC1_WGMXCCGn1
    SolutionIndex: 238
    SolutionNameMin: Cijk_Ailk_Bjlk_BSS_BH_Bias_SHB_HA_S_SAB_SCD_SAV_UserArgs_MT128x128x16_MI16x16x1_SN_LDSB1_AFC1_AFEM1_AFEM1_ASEM1_CLR1_CADS0_DTLA0_DTLB0_DTVA0_DTVB0_EPS0_FDSI0_GRPM1_GRVWA8_GRVWB4_GSU1_GSUAMB_GSUC0_GSUWGMRR0_GLS0_ISA1201_IU1_K1_LBSPPA2048_LBSPPB2048_LBSPPM0_LPA0_LPB0_LPM0_LRVW8_LWPMn1_MIAV1_MIWT4_4_MO40_NTn1_NTA0_NTB0_NTC0_NTD0_NTM0_NEPBS0_NLCA1_NLCB1_ONLL0_PGR2_PLR1_PKA0_SIA2_SS1_SU32_SUM1_SUS256_SPO0_SRVW0_SSO0_SVW4_SK0_SKXCCM0_TLDS0_ULSGRO0_USL1_UIOFGRO0_USFGROn1_VSn1_VWA4_VWB4_WSGRA0_WSGRB0_WS32_WG32_4_1_WGM8_WGMXCC1_WGMXCCGn1
    SolutionIndex: 242
    SolutionNameMin: Cijk_Ailk_Bjlk_BSS_BH_Bias_SHB_HA_S_SAB_SCD_SAV_UserArgs_MT128x128x16_MI16x16x1_SN_LDSB1_AFC1_AFEM1_AFEM1_ASEM1_CLR1_CADS0_DTLA0_DTLB0_DTVA0_DTVB0_EPS0_FDSI0_GRPM1_GRVWA8_GRVWB8_GSU1_GSUAMB_GSUC0_GSUWGMRR0_GLS0_ISA1201_IU1_K1_LBSPPA2048_LBSPPB2048_LBSPPM0_LPA0_LPB0_LPM0_LRVW8_LWPMn1_MIAV1_MIWT4_4_MO40_NTn1_NTA0_NTB0_NTC0_NTD0_NTM0_NEPBS0_NLCA1_NLCB1_ONLL0_PGR2_PLR1_PKA0_SIA2_SS1_SU32_SUM1_SUS256_SPO0_SRVW0_SSO0_SVW4_SK0_SKXCCM0_TLDS0_ULSGRO0_USL1_UIOFGRO0_USFGROn1_VSn1_VWA4_VWB4_WSGRA0_WSGRB0_WS32_WG32_4_1_WGM8_WGMXCC1_WGMXCCGn1
    SolutionIndex: 243
    SolutionNameMin: Cijk_Ailk_Bjlk_BSS_BH_Bias_SHB_HA_S_SAB_SCD_SAV_UserArgs_MT64x128x16_MI16x16x1_SN_LDSB0_AFC1_AFEM1_AFEM1_ASEM1_CLR1_CADS0_DTLA0_DTLB0_DTVA1_DTVB1_EPS0_FDSI0_GRPM1_GRVWA8_GRVWB8_GSU1_GSUAMB_GSUC0_GSUWGMRR0_GLS0_ISA1201_IU1_K1_LBSPPA0_LBSPPB0_LBSPPM0_LPA0_LPB0_LPM0_LRVW8_LWPMn1_MIAV1_MIWT1_8_MO40_NTn1_NTA0_NTB0_NTC0_NTD0_NTM0_NEPBS0_NLCA1_NLCB1_ONLL0_PGR1_PLR0_PKA0_SIA3_SS0_SU32_SUM1_SUS256_SPO0_SRVW0_SSO0_SVW8_SK0_SKXCCM0_TLDS0_ULSGRO0_USL1_UIOFGRO0_USFGROn1_VSn1_VWA1_VWB1_WSGRA0_WSGRB0_WS32_WG64_2_1_WGM8_WGMXCC1_WGMXCCGn1
    SolutionIndex: 244
    SolutionNameMin: Cijk_Ailk_Bjlk_BSS_BH_Bias_SHB_HA_S_SAB_SCD_SAV_UserArgs_MT128x128x16_MI16x16x1_SN_LDSB1_AFC1_AFEM1_AFEM1_ASEM1_CLR1_CADS0_DTLA0_DTLB0_DTVA0_DTVB0_EPS0_FDSI0_GRPM1_GRVWA4_GRVWB8_GSU1_GSUAMB_GSUC0_GSUWGMRR0_GLS0_ISA1201_IU1_K1_LBSPPA2048_LBSPPB2048_LBSPPM0_LPA0_LPB0_LPM0_LRVW8_LWPMn1_MIAV1_MIWT4_4_MO40_NTn1_NTA0_NTB0_NTC0_NTD0_NTM0_NEPBS0_NLCA1_NLCB1_ONLL0_PGR2_PLR1_PKA0_SIA2_SS1_SU32_SUM1_SUS256_SPO0_SRVW0_SSO0_SVW4_SK0_SKXCCM0_TLDS0_ULSGRO1_USL1_UIOFGRO0_USFGROn1_VSn1_VWA4_VWB4_WSGRA0_WSGRB0_WS32_WG32_4_1_WGM8_WGMXCC1_WGMXCCGn1
    SolutionIndex: 245
    SolutionNameMin: Cijk_Ailk_Bjlk_BSS_BH_Bias_SHB_HA_S_SAB_SCD_SAV_UserArgs_MT64x64x16_MI16x16x1_SN_LDSB1_AFC1_AFEM1_AFEM1_ASEM1_CLR1_CADS0_DTLA0_DTLB0_DTVA0_DTVB0_EPS0_FDSI0_GRPM1_GRVWA1_GRVWB1_GSU1_GSUAMB_GSUC0_GSUWGMRR0_GLS0_ISA1201_IU1_K1_LBSPPA1024_LBSPPB1024_LBSPPM0_LPA32_LPB32_LPM0_LRVW8_LWPMn1_MIAV1_MIWT2_2_MO40_NTn1_NTA0_NTB0_NTC0_NTD0_NTM0_NEPBS0_NLCA1_NLCB1_ONLL0_PGR2_PLR1_PKA0_SIA2_SS1_SU32_SUM1_SUS256_SPO0_SRVW0_SSO0_SVW2_SK0_SKXCCM0_TLDS0_ULSGRO0_USL1_UIOFGRO0_USFGROn1_VSn1_VWA2_VWB2_WSGRA0_WSGRB0_WS32_WG32_4_1_WGM8_WGMXCC1_WGMXCCGn1
    SolutionIndex: 246
    SolutionNameMin: Cijk_Ailk_Bjlk_BSS_BH_Bias_SHB_HA_S_SAB_SCD_SAV_UserArgs_MT128x128x16_MI16x16x1_SN_LDSB1_AFC1_AFEM1_AFEM1_ASEM1_CLR1_CADS0_DTLA0_DTLB0_DTVA0_DTVB0_EPS1_FDSI0_GRPM1_GRVWA8_GRVWB4_GSU1_GSUAMB_GSUC0_GSUWGMRR0_GLS0_ISA1201_IU1_K1_LBSPPA2048_LBSPPB2048_LBSPPM0_LPA0_LPB0_LPM0_LRVW8_LWPMn1_MIAV1_MIWT4_4_MO40_NTn1_NTA0_NTB0_NTC0_NTD0_NTM0_NEPBS0_NLCA1_NLCB1_ONLL0_PGR1_PLR1_PKA0_SIA2_SS1_SU32_SUM1_SUS256_SPO0_SRVW0_SSO0_SVW4_SK0_SKXCCM0_TLDS0_ULSGRO0_USL1_UIOFGRO0_USFGROn1_VSn1_VWA4_VWB4_WSGRA0_WSGRB0_WS32_WG32_4_1_WGM8_WGMXCC1_WGMXCCGn1
    SolutionIndex: 247
    SolutionNameMin: Cijk_Ailk_Bjlk_BSS_BH_Bias_SHB_HA_S_SAB_SCD_SAV_UserArgs_MT16x32x32_MI16x16x1_SN_LDSB0_AFC1_AFEM1_AFEM1_ASEM1_CLR1_CADS0_DTLA0_DTLB0_DTVA1_DTVB0_EPS0_FDSI0_GRPM1_GRVWA8_GRVWB1_GSU1_GSUAMB_GSUC0_GSUWGMRR0_GLS0_ISA1201_IU1_K1_LBSPPA0_LBSPPB512_LBSPPM0_LPA0_LPB16_LPM0_LRVW8_LWPMn1_MIAV1_MIWT1_1_MO40_NTn1_NTA0_NTB0_NTC0_NTD0_NTM0_NEPBS0_NLCA1_NLCB1_ONLL0_PGR2_PLR1_PKA0_SIA3_SS0_SU32_SUM1_SUS256_SPO0_SRVW0_SSO0_SVW8_SK0_SKXCCM0_TLDS0_ULSGRO0_USL1_UIOFGRO0_USFGROn1_VSn1_VWA1_VWB1_WSGRA0_WSGRB0_WS32_WG16_4_1_WGM8_WGMXCC1_WGMXCCGn1
    SolutionIndex: 248
    SolutionNameMin: Cijk_Ailk_Bjlk_BSS_BH_Bias_SHB_HA_S_SAB_SCD_SAV_UserArgs_MT64x64x16_MI16x16x1_SN_LDSB1_AFC1_AFEM1_AFEM1_ASEM1_CLR1_CADS0_DTLA0_DTLB0_DTVA0_DTVB0_EPS0_FDSI0_GRPM1_GRVWA4_GRVWB1_GSU1_GSUAMB_GSUC0_GSUWGMRR0_GLS0_ISA1201_IU1_K1_LBSPPA1024_LBSPPB1024_LBSPPM0_LPA32_LPB32_LPM0_LRVW8_LWPMn1_MIAV1_MIWT2_2_MO40_NTn1_NTA0_NTB0_NTC0_NTD0_NTM0_NEPBS0_NLCA1_NLCB1_ONLL0_PGR2_PLR1_PKA0_SIA2_SS1_SU32_SUM1_SUS256_SPO0_SRVW0_SSO0_SVW2_SK0_SKXCCM0_TLDS0_ULSGRO0_USL1_UIOFGRO0_USFGROn1_VSn1_VWA2_VWB2_WSGRA0_WSGRB0_WS32_WG32_4_1_WGM8_WGMXCC1_WGMXCCGn1
    SolutionIndex: 250
    SolutionNameMin: Cijk_Ailk_Bjlk_BSS_BH_Bias_SHB_HA_S_SAB_SCD_SAV_UserArgs_MT16x128x32_MI16x16x1_SN_LDSB0_AFC1_AFEM1_AFEM1_ASEM1_CLR1_CADS0_DTLA0_DTLB0_DTVA0_DTVB1_EPS0_FDSI0_GRPM1_GRVWA4_GRVWB8_GSU1_GSUAMB_GSUC0_GSUWGMRR0_GLS0_ISA1201_IU1_K1_LBSPPA256_LBSPPB0_LBSPPM0_LPA16_LPB0_LPM0_LRVW8_LWPMn1_MIAV1_MIWT1_8_MO40_NTn1_NTA0_NTB0_NTC0_NTD0_NTM0_NEPBS0_NLCA1_NLCB2_ONLL0_PGR2_PLR1_PKA0_SIA3_SS0_SU32_SUM1_SUS256_SPO0_SRVW0_SSO0_SVW8_SK0_SKXCCM0_TLDS0_ULSGRO0_USL1_UIOFGRO0_USFGROn1_VSn1_VWA1_VWB1_WSGRA0_WSGRB0_WS32_WG16_2_1_WGM8_WGMXCC1_WGMXCCGn1
    SolutionIndex: 252
    SolutionNameMin: Cijk_Ailk_Bjlk_BSS_BH_Bias_SHB_HA_S_SAB_SCD_SAV_UserArgs_MT64x64x64_MI16x16x1_SN_LDSB1_AFC1_AFEM1_AFEM1_ASEM1_CLR1_CADS0_DTLA0_DTLB0_DTVA0_DTVB0_EPS0_FDSI0_GRPM1_GRVWA8_GRVWB4_GSU1_GSUAMB_GSUC0_GSUWGMRR0_GLS0_ISA1201_IU4_K1_LBSPPA1024_LBSPPB1024_LBSPPM0_LPA32_LPB32_LPM0_LRVW8_LWPMn1_MIAV1_MIWT2_2_MO40_NTn1_NTA0_NTB0_NTC0_NTD0_NTM0_NEPBS0_NLCA1_NLCB1_ONLL0_PGR2_PLR1_PKA0_SIA2_SS1_SU32_SUM1_SUS256_SPO0_SRVW0_SSO0_SVW2_SK0_SKXCCM0_TLDS0_ULSGRO1_USL1_UIOFGRO0_USFGROn1_VSn1_VWA2_VWB2_WSGRA0_WSGRB0_WS32_WG32_4_1_WGM8_WGMXCC1_WGMXCCGn1
    SolutionIndex: 253
    SolutionNameMin: Cijk_Ailk_Bjlk_BSS_BH_Bias_SHB_HA_S_SAB_SCD_SAV_UserArgs_MT64x64x32_MI16x16x1_SN_LDSB1_AFC1_AFEM1_AFEM1_ASEM1_CLR1_CADS0_DTLA0_DTLB0_DTVA0_DTVB0_EPS1_FDSI0_GRPM1_GRVWA4_GRVWB8_GSU1_GSUAMB_GSUC0_GSUWGMRR0_GLS0_ISA1201_IU2_K1_LBSPPA1024_LBSPPB1024_LBSPPM0_LPA32_LPB32_LPM0_LRVW8_LWPMn1_MIAV1_MIWT2_2_MO40_NTn1_NTA0_NTB0_NTC0_NTD0_NTM0_NEPBS0_NLCA1_NLCB1_ONLL0_PGR1_PLR1_PKA0_SIA2_SS1_SU32_SUM1_SUS256_SPO0_SRVW0_SSO0_SVW2_SK0_SKXCCM0_TLDS0_ULSGRO0_USL1_UIOFGRO0_USFGROn1_VSn1_VWA2_VWB2_WSGRA0_WSGRB0_WS32_WG32_4_1_WGM8_WGMXCC1_WGMXCCGn1
    SolutionIndex: 254
    SolutionNameMin: Cijk_Ailk_Bjlk_BSS_BH_Bias_SHB_HA_S_SAB_SCD_SAV_UserArgs_MT128x128x16_MI16x16x1_SN_LDSB1_AFC1_AFEM1_AFEM1_ASEM1_CLR1_CADS0_DTLA0_DTLB0_DTVA0_DTVB0_EPS0_FDSI0_GRPM1_GRVWA8_GRVWB4_GSU1_GSUAMB_GSUC0_GSUWGMRR0_GLS0_ISA1201_IU1_K1_LBSPPA2048_LBSPPB2048_LBSPPM0_LPA0_LPB0_LPM0_LRVW8_LWPMn1_MIAV1_MIWT4_4_MO40_NTn1_NTA0_NTB0_NTC0_NTD0_NTM0_NEPBS0_NLCA1_NLCB1_ONLL0_PGR2_PLR1_PKA0_SIA2_SS1_SU32_SUM1_SUS256_SPO0_SRVW0_SSO0_SVW4_SK0_SKXCCM0_TLDS0_ULSGRO1_USL1_UIOFGRO0_USFGROn1_VSn1_VWA4_VWB4_WSGRA0_WSGRB0_WS32_WG32_4_1_WGM8_WGMXCC1_WGMXCCGn1
    SolutionIndex: 255
    SolutionNameMin: Cijk_Ailk_Bjlk_BSS_BH_Bias_SHB_HA_S_SAB_SCD_SAV_UserArgs_MT128x128x16_MI16x16x1_SN_LDSB1_AFC1_AFEM1_AFEM1_ASEM1_CLR1_CADS0_DTLA0_DTLB0_DTVA0_DTVB0_EPS0_FDSI0_GRPM1_GRVWA8_GRVWB8_GSU1_GSUAMB_GSUC0_GSUWGMRR0_GLS0_ISA1201_IU1_K1_LBSPPA2048_LBSPPB2048_LBSPPM0_LPA0_LPB0_LPM0_LRVW8_LWPMn1_MIAV1_MIWT4_4_MO40_NTn1_NTA0_NTB0_NTC0_NTD0_NTM0_NEPBS0_NLCA1_NLCB1_ONLL0_PGR2_PLR1_PKA0_SIA2_SS1_SU32_SUM1_SUS256_SPO0_SRVW0_SSO0_SVW4_SK0_SKXCCM0_TLDS0_ULSGRO1_USL1_UIOFGRO0_USFGROn1_VSn1_VWA4_VWB4_WSGRA0_WSGRB0_WS32_WG32_4_1_WGM8_WGMXCC1_WGMXCCGn1
    SolutionIndex: 256
    SolutionNameMin: Cijk_Ailk_Bjlk_BSS_BH_Bias_SHB_HA_S_SAB_SCD_SAV_UserArgs_MT128x128x16_MI16x16x1_SN_LDSB1_AFC1_AFEM1_AFEM1_ASEM1_CLR1_CADS0_DTLA0_DTLB0_DTVA0_DTVB0_EPS1_FDSI0_GRPM1_GRVWA1_GRVWB1_GSU1_GSUAMB_GSUC0_GSUWGMRR0_GLS0_ISA1201_IU1_K1_LBSPPA2048_LBSPPB2048_LBSPPM0_LPA0_LPB0_LPM0_LRVW8_LWPMn1_MIAV1_MIWT4_4_MO40_NTn1_NTA0_NTB0_NTC0_NTD0_NTM0_NEPBS0_NLCA1_NLCB1_ONLL0_PGR1_PLR1_PKA0_SIA2_SS1_SU32_SUM1_SUS256_SPO0_SRVW0_SSO0_SVW4_SK0_SKXCCM0_TLDS0_ULSGRO0_USL1_UIOFGRO0_USFGROn1_VSn1_VWA4_VWB4_WSGRA0_WSGRB0_WS32_WG32_4_1_WGM8_WGMXCC1_WGMXCCGn1
    SolutionIndex: 257
    SolutionNameMin: Cijk_Ailk_Bjlk_BSS_BH_Bias_SHB_HA_S_SAB_SCD_SAV_UserArgs_MT128x128x16_MI16x16x1_SN_LDSB1_AFC1_AFEM1_AFEM1_ASEM1_CLR1_CADS0_DTLA0_DTLB0_DTVA0_DTVB0_EPS1_FDSI0_GRPM1_GRVWA8_GRVWB8_GSU1_GSUAMB_GSUC0_GSUWGMRR0_GLS0_ISA1201_IU1_K1_LBSPPA2048_LBSPPB2048_LBSPPM0_LPA0_LPB0_LPM0_LRVW8_LWPMn1_MIAV1_MIWT4_4_MO40_NTn1_NTA0_NTB0_NTC0_NTD0_NTM0_NEPBS0_NLCA1_NLCB1_ONLL0_PGR1_PLR1_PKA0_SIA2_SS1_SU32_SUM1_SUS256_SPO0_SRVW0_SSO0_SVW4_SK0_SKXCCM0_TLDS0_ULSGRO0_USL1_UIOFGRO0_USFGROn1_VSn1_VWA4_VWB4_WSGRA0_WSGRB0_WS32_WG32_4_1_WGM8_WGMXCC1_WGMXCCGn1
    SolutionIndex: 258
    SolutionNameMin: Cijk_Ailk_Bjlk_BSS_BH_Bias_SHB_HA_S_SAB_SCD_SAV_UserArgs_MT16x32x128_MI16x16x1_SN_LDSB0_AFC1_AFEM1_AFEM1_ASEM1_CLR1_CADS0_DTLA0_DTLB0_DTVA0_DTVB1_EPS1_FDSI0_GRPM1_GRVWA8_GRVWB8_GSU1_GSUAMB_GSUC0_GSUWGMRR0_GLS0_ISA1201_IU1_K1_LBSPPA256_LBSPPB0_LBSPPM0_LPA16_LPB0_LPM0_LRVW8_LWPMn1_MIAV1_MIWT1_1_MO40_NTn1_NTA0_NTB0_NTC0_NTD0_NTM0_NEPBS0_NLCA1_NLCB1_ONLL0_PGR1_PLR1_PKA0_SIA3_SS1_SU32_SUM1_SUS256_SPO0_SRVW0_SSO0_SVW1_SK0_SKXCCM0_TLDS0_ULSGRO0_USL1_UIOFGRO0_USFGROn1_VSn1_VWA1_VWB1_WSGRA0_WSGRB0_WS32_WG16_4_1_WGM8_WGMXCC1_WGMXCCGn1
    SolutionIndex: 260
    SolutionNameMin: Cijk_Ailk_Bjlk_BSS_BH_Bias_SHB_HA_S_SAB_SCD_SAV_UserArgs_MT16x32x64_MI16x16x1_SN_LDSB1_AFC1_AFEM1_AFEM1_ASEM1_CLR1_CADS0_DTLA0_DTLB0_DTVA0_DTVB0_EPS0_FDSI0_GRPM1_GRVWA8_GRVWB8_GSU1_GSUAMB_GSUC0_GSUWGMRR0_GLS0_ISA1201_IU4_K1_LBSPPA256_LBSPPB512_LBSPPM0_LPA16_LPB16_LPM0_LRVW8_LWPMn1_MIAV1_MIWT1_1_MO40_NTn1_NTA0_NTB0_NTC0_NTD0_NTM0_NEPBS0_NLCA1_NLCB1_ONLL0_PGR2_PLR1_PKA0_SIA2_SS0_SU32_SUM1_SUS256_SPO0_SRVW0_SSO0_SVW8_SK0_SKXCCM0_TLDS0_ULSGRO0_USL1_UIOFGRO0_USFGROn1_VSn1_VWA1_VWB1_WSGRA0_WSGRB0_WS32_WG16_4_1_WGM8_WGMXCC1_WGMXCCGn1
    SolutionIndex: 261
    SolutionNameMin: Cijk_Ailk_Bjlk_BSS_BH_Bias_SHB_HA_S_SAB_SCD_SAV_UserArgs_MT32x32x128_MI16x16x1_SN_LDSB0_AFC1_AFEM1_AFEM1_ASEM1_CLR1_CADS0_DTLA0_DTLB0_DTVA0_DTVB1_EPS0_FDSI0_GRPM1_GRVWA4_GRVWB8_GSU1_GSUAMB_GSUC0_GSUWGMRR0_GLS0_ISA1201_IU1_K1_LBSPPA512_LBSPPB0_LBSPPM0_LPA16_LPB0_LPM0_LRVW8_LWPMn1_MIAV1_MIWT1_1_MO40_NTn1_NTA0_NTB0_NTC0_NTD0_NTM0_NEPBS0_NLCA1_NLCB1_ONLL0_PGR2_PLR1_PKA0_SIA3_SS0_SU32_SUM1_SUS256_SPO0_SRVW0_SSO0_SVW8_SK0_SKXCCM0_TLDS0_ULSGRO0_USL1_UIOFGRO0_USFGROn1_VSn1_VWA1_VWB1_WSGRA0_WSGRB0_WS32_WG32_4_1_WGM8_WGMXCC1_WGMXCCGn1
    SolutionIndex: 262
    SolutionNameMin: Cijk_Ailk_Bjlk_BSS_BH_Bias_SHB_HA_S_SAB_SCD_SAV_UserArgs_MT32x16x128_MI16x16x1_SN_LDSB0_AFC1_AFEM1_AFEM1_ASEM1_CLR1_CADS0_DTLA0_DTLB0_DTVA1_DTVB0_EPS0_FDSI0_GRPM1_GRVWA8_GRVWB8_GSU1_GSUAMB_GSUC0_GSUWGMRR0_GLS0_ISA1201_IU1_K1_LBSPPA0_LBSPPB256_LBSPPM0_LPA0_LPB16_LPM0_LRVW8_LWPMn1_MIAV1_MIWT1_1_MO40_NTn1_NTA0_NTB0_NTC0_NTD0_NTM0_NEPBS0_NLCA1_NLCB1_ONLL0_PGR2_PLR1_PKA0_SIA3_SS0_SU32_SUM1_SUS256_SPO0_SRVW0_SSO0_SVW8_SK0_SKXCCM0_TLDS0_ULSGRO0_USL1_UIOFGRO0_USFGROn1_VSn1_VWA1_VWB1_WSGRA0_WSGRB0_WS32_WG32_2_1_WGM8_WGMXCC1_WGMXCCGn1
    SolutionIndex: 263
    SolutionNameMin: Cijk_Ailk_Bjlk_BSS_BH_Bias_SHB_HA_S_SAB_SCD_SAV_UserArgs_MT32x32x64_MI16x16x1_SN_LDSB0_AFC1_AFEM1_AFEM1_ASEM1_CLR1_CADS0_DTLA0_DTLB0_DTVA1_DTVB0_EPS0_FDSI0_GRPM1_GRVWA8_GRVWB4_GSU1_GSUAMB_GSUC0_GSUWGMRR0_GLS0_ISA1201_IU1_K1_LBSPPA0_LBSPPB512_LBSPPM0_LPA0_LPB16_LPM0_LRVW8_LWPMn1_MIAV1_MIWT1_1_MO40_NTn1_NTA0_NTB0_NTC0_NTD0_NTM0_NEPBS0_NLCA1_NLCB1_ONLL0_PGR2_PLR1_PKA0_SIA3_SS0_SU32_SUM1_SUS256_SPO0_SRVW0_SSO0_SVW8_SK0_SKXCCM0_TLDS0_ULSGRO0_USL1_UIOFGRO0_USFGROn1_VSn1_VWA1_VWB1_WSGRA0_WSGRB0_WS32_WG32_4_1_WGM8_WGMXCC1_WGMXCCGn1
    SolutionIndex: 264
    SolutionNameMin: Cijk_Ailk_Bjlk_BSS_BH_Bias_SHB_HA_S_SAB_SCD_SAV_UserArgs_MT32x16x64_MI16x16x1_SN_LDSB0_AFC1_AFEM1_AFEM1_ASEM1_CLR1_CADS0_DTLA0_DTLB0_DTVA0_DTVB1_EPS0_FDSI0_GRPM1_GRVWA4_GRVWB8_GSU1_GSUAMB_GSUC0_GSUWGMRR0_GLS0_ISA1201_IU1_K1_LBSPPA512_LBSPPB0_LBSPPM0_LPA16_LPB0_LPM0_LRVW8_LWPMn1_MIAV1_MIWT1_1_MO40_NTn1_NTA0_NTB0_NTC0_NTD0_NTM0_NEPBS0_NLCA1_NLCB1_ONLL0_PGR2_PLR1_PKA0_SIA3_SS1_SU32_SUM1_SUS256_SPO0_SRVW0_SSO0_SVW1_SK0_SKXCCM0_TLDS0_ULSGRO0_USL1_UIOFGRO0_USFGROn1_VSn1_VWA1_VWB1_WSGRA0_WSGRB0_WS32_WG32_2_1_WGM8_WGMXCC1_WGMXCCGn1
    SolutionIndex: 265
    SolutionNameMin: Cijk_Ailk_Bjlk_BSS_BH_Bias_SHB_HA_S_SAB_SCD_SAV_UserArgs_MT32x32x128_MI16x16x1_SN_LDSB0_AFC1_AFEM1_AFEM1_ASEM1_CLR1_CADS0_DTLA0_DTLB0_DTVA1_DTVB0_EPS0_FDSI0_GRPM1_GRVWA8_GRVWB8_GSU1_GSUAMB_GSUC0_GSUWGMRR0_GLS0_ISA1201_IU1_K1_LBSPPA0_LBSPPB512_LBSPPM0_LPA0_LPB16_LPM0_LRVW8_LWPMn1_MIAV1_MIWT1_1_MO40_NTn1_NTA0_NTB0_NTC0_NTD0_NTM0_NEPBS0_NLCA1_NLCB1_ONLL0_PGR2_PLR1_PKA0_SIA3_SS0_SU32_SUM1_SUS256_SPO0_SRVW0_SSO0_SVW8_SK0_SKXCCM0_TLDS0_ULSGRO0_USL1_UIOFGRO0_USFGROn1_VSn1_VWA1_VWB1_WSGRA0_WSGRB0_WS32_WG32_4_1_WGM8_WGMXCC1_WGMXCCGn1
    SolutionIndex: 266
    SolutionNameMin: Cijk_Ailk_Bjlk_BSS_BH_Bias_SHB_HA_S_SAB_SCD_SAV_UserArgs_MT32x32x64_MI16x16x1_SN_LDSB0_AFC1_AFEM1_AFEM1_ASEM1_CLR1_CADS0_DTLA0_DTLB0_DTVA1_DTVB0_EPS0_FDSI0_GRPM1_GRVWA8_GRVWB8_GSU1_GSUAMB_GSUC0_GSUWGMRR0_GLS0_ISA1201_IU1_K1_LBSPPA0_LBSPPB512_LBSPPM0_LPA0_LPB16_LPM0_LRVW8_LWPMn1_MIAV1_MIWT1_1_MO40_NTn1_NTA0_NTB0_NTC0_NTD0_NTM0_NEPBS0_NLCA1_NLCB1_ONLL0_PGR2_PLR1_PKA0_SIA3_SS0_SU32_SUM1_SUS256_SPO0_SRVW0_SSO0_SVW8_SK0_SKXCCM0_TLDS0_ULSGRO0_USL1_UIOFGRO0_USFGROn1_VSn1_VWA1_VWB1_WSGRA0_WSGRB0_WS32_WG32_4_1_WGM8_WGMXCC1_WGMXCCGn1
    SolutionIndex: 267
    SolutionNameMin: Cijk_Ailk_Bjlk_BSS_BH_Bias_SHB_HA_S_SAB_SCD_SAV_UserArgs_MT32x32x128_MI16x16x1_SN_LDSB0_AFC1_AFEM1_AFEM1_ASEM1_CLR1_CADS0_DTLA0_DTLB0_DTVA0_DTVB1_EPS0_FDSI0_GRPM1_GRVWA8_GRVWB8_GSU1_GSUAMB_GSUC0_GSUWGMRR0_GLS0_ISA1201_IU1_K1_LBSPPA512_LBSPPB0_LBSPPM0_LPA16_LPB0_LPM0_LRVW8_LWPMn1_MIAV1_MIWT1_1_MO40_NTn1_NTA0_NTB0_NTC0_NTD0_NTM0_NEPBS0_NLCA1_NLCB1_ONLL0_PGR2_PLR1_PKA0_SIA3_SS0_SU32_SUM1_SUS256_SPO0_SRVW0_SSO0_SVW8_SK0_SKXCCM0_TLDS0_ULSGRO0_USL1_UIOFGRO0_USFGROn1_VSn1_VWA1_VWB1_WSGRA0_WSGRB0_WS32_WG32_4_1_WGM8_WGMXCC1_WGMXCCGn1
    SolutionIndex: 268
    SolutionNameMin: Cijk_Ailk_Bjlk_BSS_BH_Bias_SHB_HA_S_SAB_SCD_SAV_UserArgs_MT32x32x128_MI16x16x1_SN_LDSB0_AFC1_AFEM1_AFEM1_ASEM1_CLR1_CADS0_DTLA0_DTLB0_DTVA0_DTVB1_EPS0_FDSI0_GRPM1_GRVWA4_GRVWB8_GSU1_GSUAMB_GSUC0_GSUWGMRR0_GLS0_ISA1201_IU1_K1_LBSPPA512_LBSPPB0_LBSPPM0_LPA16_LPB0_LPM0_LRVW8_LWPMn1_MIAV1_MIWT1_1_MO40_NTn1_NTA0_NTB0_NTC0_NTD0_NTM0_NEPBS0_NLCA1_NLCB1_ONLL0_PGR2_PLR1_PKA0_SIA3_SS1_SU32_SUM1_SUS256_SPO0_SRVW0_SSO0_SVW1_SK0_SKXCCM0_TLDS0_ULSGRO0_USL1_UIOFGRO0_USFGROn1_VSn1_VWA1_VWB1_WSGRA0_WSGRB0_WS32_WG32_4_1_WGM8_WGMXCC1_WGMXCCGn1
    SolutionIndex: 269
    SolutionNameMin: Cijk_Ailk_Bjlk_BSS_BH_Bias_SHB_HA_S_SAB_SCD_SAV_UserArgs_MT32x32x64_MI16x16x1_SN_LDSB0_AFC1_AFEM1_AFEM1_ASEM1_CLR1_CADS0_DTLA0_DTLB0_DTVA0_DTVB1_EPS0_FDSI0_GRPM1_GRVWA4_GRVWB8_GSU1_GSUAMB_GSUC0_GSUWGMRR0_GLS0_ISA1201_IU1_K1_LBSPPA512_LBSPPB0_LBSPPM0_LPA16_LPB0_LPM0_LRVW8_LWPMn1_MIAV1_MIWT1_1_MO40_NTn1_NTA0_NTB0_NTC0_NTD0_NTM0_NEPBS0_NLCA1_NLCB1_ONLL0_PGR2_PLR1_PKA0_SIA3_SS1_SU32_SUM1_SUS256_SPO0_SRVW0_SSO0_SVW1_SK0_SKXCCM0_TLDS0_ULSGRO0_USL1_UIOFGRO0_USFGROn1_VSn1_VWA1_VWB1_WSGRA0_WSGRB0_WS32_WG32_4_1_WGM8_WGMXCC1_WGMXCCGn1
    SolutionIndex: 270
    SolutionNameMin: Cijk_Ailk_Bjlk_BSS_BH_Bias_SHB_HA_S_SAB_SCD_SAV_UserArgs_MT32x32x64_MI16x16x1_SN_LDSB0_AFC1_AFEM1_AFEM1_ASEM1_CLR1_CADS0_DTLA0_DTLB0_DTVA0_DTVB1_EPS0_FDSI0_GRPM1_GRVWA8_GRVWB8_GSU1_GSUAMB_GSUC0_GSUWGMRR0_GLS0_ISA1201_IU1_K1_LBSPPA512_LBSPPB0_LBSPPM0_LPA16_LPB0_LPM0_LRVW8_LWPMn1_MIAV1_MIWT1_1_MO40_NTn1_NTA0_NTB0_NTC0_NTD0_NTM0_NEPBS0_NLCA1_NLCB1_ONLL0_PGR2_PLR1_PKA0_SIA3_SS1_SU32_SUM1_SUS256_SPO0_SRVW0_SSO0_SVW1_SK0_SKXCCM0_TLDS0_ULSGRO0_USL1_UIOFGRO0_USFGROn1_VSn1_VWA1_VWB1_WSGRA0_WSGRB0_WS32_WG32_4_1_WGM8_WGMXCC1_WGMXCCGn1
    SolutionIndex: 272
    SolutionNameMin: Cijk_Ailk_Bjlk_BSS_BH_Bias_SHB_HA_S_SAB_SCD_SAV_UserArgs_MT32x32x128_MI16x16x1_SN_LDSB0_AFC1_AFEM1_AFEM1_ASEM1_CLR1_CADS0_DTLA0_DTLB0_DTVA1_DTVB0_EPS0_FDSI0_GRPM1_GRVWA8_GRVWB4_GSU1_GSUAMB_GSUC0_GSUWGMRR0_GLS0_ISA1201_IU1_K1_LBSPPA0_LBSPPB512_LBSPPM0_LPA0_LPB16_LPM0_LRVW8_LWPMn1_MIAV1_MIWT1_1_MO40_NTn1_NTA0_NTB0_NTC0_NTD0_NTM0_NEPBS0_NLCA1_NLCB1_ONLL0_PGR2_PLR1_PKA0_SIA3_SS0_SU32_SUM1_SUS256_SPO0_SRVW0_SSO0_SVW8_SK0_SKXCCM0_TLDS0_ULSGRO0_USL1_UIOFGRO0_USFGROn1_VSn1_VWA1_VWB1_WSGRA0_WSGRB0_WS32_WG32_4_1_WGM8_WGMXCC1_WGMXCCGn1
    SolutionIndex: 273
    SolutionNameMin: Cijk_Ailk_Bjlk_BSS_BH_Bias_SHB_HA_S_SAB_SCD_SAV_UserArgs_MT32x32x64_MI16x16x1_SN_LDSB0_AFC1_AFEM1_AFEM1_ASEM1_CLR1_CADS0_DTLA0_DTLB0_DTVA0_DTVB1_EPS0_FDSI0_GRPM1_GRVWA8_GRVWB8_GSU1_GSUAMB_GSUC0_GSUWGMRR0_GLS0_ISA1201_IU1_K1_LBSPPA512_LBSPPB0_LBSPPM0_LPA16_LPB0_LPM0_LRVW8_LWPMn1_MIAV1_MIWT1_1_MO40_NTn1_NTA0_NTB0_NTC0_NTD0_NTM0_NEPBS0_NLCA1_NLCB1_ONLL0_PGR2_PLR1_PKA0_SIA3_SS0_SU32_SUM1_SUS256_SPO0_SRVW0_SSO0_SVW8_SK0_SKXCCM0_TLDS0_ULSGRO0_USL1_UIOFGRO0_USFGROn1_VSn1_VWA1_VWB1_WSGRA0_WSGRB0_WS32_WG32_4_1_WGM8_WGMXCC1_WGMXCCGn1
    SolutionIndex: 274
    SolutionNameMin: Cijk_Ailk_Bjlk_BSS_BH_Bias_SHB_HA_S_SAB_SCD_SAV_UserArgs_MT32x32x64_MI16x16x1_SN_LDSB0_AFC1_AFEM1_AFEM1_ASEM1_CLR1_CADS0_DTLA0_DTLB0_DTVA0_DTVB1_EPS0_FDSI0_GRPM1_GRVWA4_GRVWB8_GSU1_GSUAMB_GSUC0_GSUWGMRR0_GLS0_ISA1201_IU1_K1_LBSPPA512_LBSPPB0_LBSPPM0_LPA16_LPB0_LPM0_LRVW8_LWPMn1_MIAV1_MIWT1_1_MO40_NTn1_NTA0_NTB0_NTC0_NTD0_NTM0_NEPBS0_NLCA1_NLCB1_ONLL0_PGR2_PLR1_PKA0_SIA3_SS0_SU32_SUM1_SUS256_SPO0_SRVW0_SSO0_SVW8_SK0_SKXCCM0_TLDS0_ULSGRO0_USL1_UIOFGRO0_USFGROn1_VSn1_VWA1_VWB1_WSGRA0_WSGRB0_WS32_WG32_4_1_WGM8_WGMXCC1_WGMXCCGn1
    SolutionIndex: 275
    SolutionNameMin: Cijk_Ailk_Bjlk_BSS_BH_Bias_SHB_HA_S_SAB_SCD_SAV_UserArgs_MT64x64x64_MI16x16x1_SN_LDSB0_AFC1_AFEM1_AFEM1_ASEM1_CLR1_CADS0_DTLA0_DTLB0_DTVA1_DTVB0_EPS1_FDSI0_GRPM1_GRVWA8_GRVWB8_GSU1_GSUAMB_GSUC0_GSUWGMRR0_GLS0_ISA1201_IU1_K1_LBSPPA0_LBSPPB1024_LBSPPM0_LPA0_LPB32_LPM0_LRVW8_LWPMn1_MIAV1_MIWT2_2_MO40_NTn1_NTA0_NTB0_NTC0_NTD0_NTM0_NEPBS0_NLCA4_NLCB1_ONLL0_PGR1_PLR1_PKA0_SIA3_SS0_SU32_SUM1_SUS256_SPO0_SRVW0_SSO0_SVW8_SK0_SKXCCM0_TLDS0_ULSGRO0_USL1_UIOFGRO0_USFGROn1_VSn1_VWA1_VWB2_WSGRA0_WSGRB0_WS32_WG32_4_1_WGM8_WGMXCC1_WGMXCCGn1
    SolutionIndex: 278
    SolutionNameMin: Cijk_Ailk_Bjlk_BSS_BH_Bias_SHB_HA_S_SAB_SCD_SAV_UserArgs_MT64x64x64_MI16x16x1_SN_LDSB0_AFC1_AFEM1_AFEM1_ASEM1_CLR1_CADS0_DTLA0_DTLB0_DTVA1_DTVB0_EPS1_FDSI0_GRPM1_GRVWA8_GRVWB4_GSU1_GSUAMB_GSUC0_GSUWGMRR0_GLS0_ISA1201_IU1_K1_LBSPPA0_LBSPPB1024_LBSPPM0_LPA0_LPB32_LPM0_LRVW8_LWPMn1_MIAV1_MIWT2_2_MO40_NTn1_NTA0_NTB0_NTC0_NTD0_NTM0_NEPBS0_NLCA4_NLCB1_ONLL0_PGR1_PLR1_PKA0_SIA3_SS0_SU32_SUM1_SUS256_SPO0_SRVW0_SSO0_SVW8_SK0_SKXCCM0_TLDS0_ULSGRO0_USL1_UIOFGRO0_USFGROn1_VSn1_VWA1_VWB2_WSGRA0_WSGRB0_WS32_WG32_4_1_WGM8_WGMXCC1_WGMXCCGn1
    SolutionIndex: 279
    SolutionNameMin: Cijk_Ailk_Bjlk_BSS_BH_Bias_SHB_HA_S_SAB_SCD_SAV_UserArgs_MT32x128x64_MI16x16x1_SN_LDSB0_AFC1_AFEM1_AFEM1_ASEM1_CLR1_CADS0_DTLA0_DTLB0_DTVA0_DTVB1_EPS1_FDSI0_GRPM1_GRVWA8_GRVWB8_GSU1_GSUAMB_GSUC0_GSUWGMRR0_GLS0_ISA1201_IU1_K1_LBSPPA512_LBSPPB0_LBSPPM0_LPA16_LPB0_LPM0_LRVW8_LWPMn1_MIAV1_MIWT1_4_MO40_NTn1_NTA0_NTB0_NTC0_NTD0_NTM0_NEPBS0_NLCA1_NLCB4_ONLL0_PGR1_PLR1_PKA0_SIA3_SS0_SU32_SUM1_SUS256_SPO0_SRVW0_SSO0_SVW8_SK0_SKXCCM0_TLDS0_ULSGRO0_USL1_UIOFGRO0_USFGROn1_VSn1_VWA1_VWB1_WSGRA0_WSGRB0_WS32_WG32_4_1_WGM8_WGMXCC1_WGMXCCGn1
    SolutionIndex: 280
    SolutionNameMin: Cijk_Ailk_Bjlk_BSS_BH_Bias_SHB_HA_S_SAB_SCD_SAV_UserArgs_MT64x64x32_MI16x16x1_SN_LDSB0_AFC1_AFEM1_AFEM1_ASEM1_CLR1_CADS0_DTLA0_DTLB0_DTVA1_DTVB0_EPS0_FDSI0_GRPM1_GRVWA8_GRVWB4_GSU1_GSUAMB_GSUC0_GSUWGMRR0_GLS0_ISA1201_IU1_K1_LBSPPA0_LBSPPB1024_LBSPPM0_LPA0_LPB32_LPM0_LRVW8_LWPMn1_MIAV1_MIWT2_2_MO40_NTn1_NTA0_NTB0_NTC0_NTD0_NTM0_NEPBS0_NLCA2_NLCB1_ONLL0_PGR2_PLR1_PKA0_SIA3_SS0_SU32_SUM1_SUS256_SPO0_SRVW0_SSO0_SVW8_SK0_SKXCCM0_TLDS0_ULSGRO0_USL1_UIOFGRO0_USFGROn1_VSn1_VWA1_VWB2_WSGRA0_WSGRB0_WS32_WG32_4_1_WGM8_WGMXCC1_WGMXCCGn1
    SolutionIndex: 281
    SolutionNameMin: Cijk_Ailk_Bjlk_BSS_BH_Bias_SHB_HA_S_SAB_SCD_SAV_UserArgs_MT64x64x64_MI16x16x1_SN_LDSB0_AFC1_AFEM1_AFEM1_ASEM1_CLR1_CADS0_DTLA0_DTLB0_DTVA0_DTVB1_EPS0_FDSI0_GRPM1_GRVWA8_GRVWB8_GSU1_GSUAMB_GSUC0_GSUWGMRR0_GLS0_ISA1201_IU1_K1_LBSPPA1024_LBSPPB0_LBSPPM0_LPA32_LPB0_LPM0_LRVW8_LWPMn1_MIAV1_MIWT2_2_MO40_NTn1_NTA0_NTB0_NTC0_NTD0_NTM0_NEPBS0_NLCA1_NLCB4_ONLL0_PGR2_PLR1_PKA0_SIA3_SS1_SU32_SUM1_SUS256_SPO0_SRVW0_SSO0_SVW2_SK0_SKXCCM0_TLDS0_ULSGRO0_USL1_UIOFGRO0_USFGROn1_VSn1_VWA2_VWB1_WSGRA0_WSGRB0_WS32_WG32_4_1_WGM8_WGMXCC1_WGMXCCGn1
    SolutionIndex: 283
    SolutionNameMin: Cijk_Ailk_Bjlk_BSS_BH_Bias_SHB_HA_S_SAB_SCD_SAV_UserArgs_MT32x32x64_MI16x16x1_SN_LDSB0_AFC1_AFEM1_AFEM1_ASEM1_CLR1_CADS0_DTLA0_DTLB0_DTVA1_DTVB0_EPS0_FDSI0_GRPM1_GRVWA8_GRVWB1_GSU1_GSUAMB_GSUC0_GSUWGMRR0_GLS0_ISA1201_IU1_K1_LBSPPA0_LBSPPB512_LBSPPM0_LPA0_LPB16_LPM0_LRVW8_LWPMn1_MIAV1_MIWT1_1_MO40_NTn1_NTA0_NTB0_NTC0_NTD0_NTM0_NEPBS0_NLCA1_NLCB1_ONLL0_PGR2_PLR1_PKA0_SIA3_SS0_SU32_SUM1_SUS256_SPO0_SRVW0_SSO0_SVW8_SK0_SKXCCM0_TLDS0_ULSGRO0_USL1_UIOFGRO0_USFGROn1_VSn1_VWA1_VWB1_WSGRA0_WSGRB0_WS32_WG32_4_1_WGM8_WGMXCC1_WGMXCCGn1
    SolutionIndex: 286
    SolutionNameMin: Cijk_Ailk_Bjlk_BSS_BH_Bias_SHB_HA_S_SAB_SCD_SAV_UserArgs_MT64x64x32_MI16x16x1_SN_LDSB0_AFC1_AFEM1_AFEM1_ASEM1_CLR1_CADS0_DTLA0_DTLB0_DTVA1_DTVB0_EPS0_FDSI0_GRPM1_GRVWA8_GRVWB8_GSU1_GSUAMB_GSUC0_GSUWGMRR0_GLS0_ISA1201_IU1_K1_LBSPPA0_LBSPPB1024_LBSPPM0_LPA0_LPB32_LPM0_LRVW8_LWPMn1_MIAV1_MIWT2_2_MO40_NTn1_NTA0_NTB0_NTC0_NTD0_NTM0_NEPBS0_NLCA2_NLCB1_ONLL0_PGR2_PLR1_PKA0_SIA3_SS0_SU32_SUM1_SUS256_SPO0_SRVW0_SSO0_SVW8_SK0_SKXCCM0_TLDS0_ULSGRO0_USL1_UIOFGRO0_USFGROn1_VSn1_VWA1_VWB2_WSGRA0_WSGRB0_WS32_WG32_4_1_WGM8_WGMXCC1_WGMXCCGn1
    SolutionIndex: 287
    SolutionNameMin: Cijk_Ailk_Bjlk_BSS_BH_Bias_SHB_HA_S_SAB_SCD_SAV_UserArgs_MT64x64x64_MI16x16x1_SN_LDSB0_AFC1_AFEM1_AFEM1_ASEM1_CLR1_CADS0_DTLA0_DTLB0_DTVA0_DTVB1_EPS1_FDSI0_GRPM1_GRVWA4_GRVWB8_GSU1_GSUAMB_GSUC0_GSUWGMRR0_GLS0_ISA1201_IU1_K1_LBSPPA1024_LBSPPB0_LBSPPM0_LPA32_LPB0_LPM0_LRVW8_LWPMn1_MIAV1_MIWT2_2_MO40_NTn1_NTA0_NTB0_NTC0_NTD0_NTM0_NEPBS0_NLCA1_NLCB4_ONLL0_PGR1_PLR1_PKA0_SIA3_SS1_SU32_SUM1_SUS256_SPO0_SRVW0_SSO0_SVW2_SK0_SKXCCM0_TLDS0_ULSGRO0_USL1_UIOFGRO0_USFGROn1_VSn1_VWA2_VWB1_WSGRA0_WSGRB0_WS32_WG32_4_1_WGM8_WGMXCC1_WGMXCCGn1
    SolutionIndex: 288
    SolutionNameMin: Cijk_Ailk_Bjlk_BSS_BH_Bias_SHB_HA_S_SAB_SCD_SAV_UserArgs_MT64x64x64_MI16x16x1_SN_LDSB1_AFC1_AFEM1_AFEM1_ASEM1_CLR1_CADS0_DTLA0_DTLB0_DTVA0_DTVB0_EPS1_FDSI0_GRPM1_GRVWA8_GRVWB8_GSU1_GSUAMB_GSUC0_GSUWGMRR0_GLS0_ISA1201_IU4_K1_LBSPPA1024_LBSPPB1024_LBSPPM0_LPA32_LPB32_LPM0_LRVW8_LWPMn1_MIAV1_MIWT2_2_MO40_NTn1_NTA0_NTB0_NTC0_NTD0_NTM0_NEPBS0_NLCA1_NLCB1_ONLL0_PGR1_PLR1_PKA0_SIA2_SS1_SU32_SUM1_SUS256_SPO0_SRVW0_SSO0_SVW2_SK0_SKXCCM0_TLDS0_ULSGRO0_USL1_UIOFGRO0_USFGROn1_VSn1_VWA2_VWB2_WSGRA0_WSGRB0_WS32_WG32_4_1_WGM8_WGMXCC1_WGMXCCGn1
    SolutionIndex: 292
    SolutionNameMin: Cijk_Ailk_Bjlk_BSS_BH_Bias_SHB_HA_S_SAB_SCD_SAV_UserArgs_MT64x64x64_MI16x16x1_SN_LDSB0_AFC1_AFEM1_AFEM1_ASEM1_CLR1_CADS0_DTLA0_DTLB0_DTVA1_DTVB0_EPS0_FDSI0_GRPM1_GRVWA8_GRVWB4_GSU1_GSUAMB_GSUC0_GSUWGMRR0_GLS0_ISA1201_IU1_K1_LBSPPA0_LBSPPB1024_LBSPPM0_LPA0_LPB32_LPM0_LRVW8_LWPMn1_MIAV1_MIWT2_2_MO40_NTn1_NTA0_NTB0_NTC0_NTD0_NTM0_NEPBS0_NLCA4_NLCB1_ONLL0_PGR2_PLR1_PKA0_SIA3_SS0_SU32_SUM1_SUS256_SPO0_SRVW0_SSO0_SVW8_SK0_SKXCCM0_TLDS0_ULSGRO0_USL1_UIOFGRO0_USFGROn1_VSn1_VWA1_VWB2_WSGRA0_WSGRB0_WS32_WG32_4_1_WGM8_WGMXCC1_WGMXCCGn1
    SolutionIndex: 293
    SolutionNameMin: Cijk_Ailk_Bjlk_BSS_BH_Bias_SHB_HA_S_SAB_SCD_SAV_UserArgs_MT64x64x64_MI16x16x1_SN_LDSB1_AFC1_AFEM1_AFEM1_ASEM1_CLR1_CADS0_DTLA0_DTLB0_DTVA0_DTVB0_EPS1_FDSI0_GRPM1_GRVWA4_GRVWB8_GSU1_GSUAMB_GSUC0_GSUWGMRR0_GLS0_ISA1201_IU4_K1_LBSPPA1024_LBSPPB1024_LBSPPM0_LPA32_LPB32_LPM0_LRVW8_LWPMn1_MIAV1_MIWT2_2_MO40_NTn1_NTA0_NTB0_NTC0_NTD0_NTM0_NEPBS0_NLCA1_NLCB1_ONLL0_PGR1_PLR1_PKA0_SIA2_SS1_SU32_SUM1_SUS256_SPO0_SRVW0_SSO0_SVW2_SK0_SKXCCM0_TLDS0_ULSGRO0_USL1_UIOFGRO0_USFGROn1_VSn1_VWA2_VWB2_WSGRA0_WSGRB0_WS32_WG32_4_1_WGM8_WGMXCC1_WGMXCCGn1
    SolutionIndex: 294
    SolutionNameMin: Cijk_Ailk_Bjlk_BSS_BH_Bias_SHB_HA_S_SAB_SCD_SAV_UserArgs_MT64x64x64_MI16x16x1_SN_LDSB1_AFC1_AFEM1_AFEM1_ASEM1_CLR1_CADS0_DTLA0_DTLB0_DTVA0_DTVB0_EPS1_FDSI0_GRPM1_GRVWA8_GRVWB4_GSU1_GSUAMB_GSUC0_GSUWGMRR0_GLS0_ISA1201_IU4_K1_LBSPPA1024_LBSPPB1024_LBSPPM0_LPA32_LPB32_LPM0_LRVW8_LWPMn1_MIAV1_MIWT2_2_MO40_NTn1_NTA0_NTB0_NTC0_NTD0_NTM0_NEPBS0_NLCA1_NLCB1_ONLL0_PGR1_PLR1_PKA0_SIA2_SS1_SU32_SUM1_SUS256_SPO0_SRVW0_SSO0_SVW2_SK0_SKXCCM0_TLDS0_ULSGRO0_USL1_UIOFGRO0_USFGROn1_VSn1_VWA2_VWB2_WSGRA0_WSGRB0_WS32_WG32_4_1_WGM8_WGMXCC1_WGMXCCGn1
    SolutionIndex: 295
    SolutionNameMin: Cijk_Ailk_Bjlk_BSS_BH_Bias_SHB_HA_S_SAB_SCD_SAV_UserArgs_MT32x32x64_MI16x16x1_SN_LDSB0_AFC1_AFEM1_AFEM1_ASEM1_CLR1_CADS0_DTLA0_DTLB0_DTVA1_DTVB0_EPS0_FDSI0_GRPM1_GRVWA8_GRVWB4_GSU1_GSUAMB_GSUC0_GSUWGMRR0_GLS0_ISA1201_IU1_K1_LBSPPA0_LBSPPB512_LBSPPM0_LPA0_LPB16_LPM0_LRVW8_LWPMn1_MIAV1_MIWT1_1_MO40_NTn1_NTA0_NTB0_NTC0_NTD0_NTM0_NEPBS0_NLCA1_NLCB1_ONLL0_PGR2_PLR1_PKA0_SIA3_SS1_SU32_SUM1_SUS256_SPO0_SRVW0_SSO0_SVW1_SK0_SKXCCM0_TLDS0_ULSGRO0_USL1_UIOFGRO0_USFGROn1_VSn1_VWA1_VWB1_WSGRA0_WSGRB0_WS32_WG32_4_1_WGM8_WGMXCC1_WGMXCCGn1
    SolutionIndex: 299
    SolutionNameMin: Cijk_Ailk_Bjlk_BSS_BH_Bias_SHB_HA_S_SAB_SCD_SAV_UserArgs_MT64x64x64_MI16x16x1_SN_LDSB0_AFC1_AFEM1_AFEM1_ASEM1_CLR1_CADS0_DTLA0_DTLB0_DTVA0_DTVB1_EPS0_FDSI0_GRPM1_GRVWA4_GRVWB8_GSU1_GSUAMB_GSUC0_GSUWGMRR0_GLS0_ISA1201_IU1_K1_LBSPPA1024_LBSPPB0_LBSPPM0_LPA32_LPB0_LPM0_LRVW8_LWPMn1_MIAV1_MIWT2_2_MO40_NTn1_NTA0_NTB0_NTC0_NTD0_NTM0_NEPBS0_NLCA1_NLCB4_ONLL0_PGR2_PLR1_PKA0_SIA3_SS1_SU32_SUM1_SUS256_SPO0_SRVW0_SSO0_SVW2_SK0_SKXCCM0_TLDS0_ULSGRO0_USL1_UIOFGRO0_USFGROn1_VSn1_VWA2_VWB1_WSGRA0_WSGRB0_WS32_WG32_4_1_WGM8_WGMXCC1_WGMXCCGn1
    SolutionIndex: 300
    SolutionNameMin: Cijk_Ailk_Bjlk_BSS_BH_Bias_SHB_HA_S_SAB_SCD_SAV_UserArgs_MT32x16x64_MI16x16x1_SN_LDSB0_AFC1_AFEM1_AFEM1_ASEM1_CLR1_CADS0_DTLA0_DTLB0_DTVA1_DTVB0_EPS0_FDSI0_GRPM1_GRVWA8_GRVWB8_GSU1_GSUAMB_GSUC0_GSUWGMRR0_GLS0_ISA1201_IU1_K1_LBSPPA0_LBSPPB256_LBSPPM0_LPA0_LPB16_LPM0_LRVW8_LWPMn1_MIAV1_MIWT1_1_MO40_NTn1_NTA0_NTB0_NTC0_NTD0_NTM0_NEPBS0_NLCA1_NLCB1_ONLL0_PGR2_PLR1_PKA0_SIA3_SS0_SU32_SUM1_SUS256_SPO0_SRVW0_SSO0_SVW8_SK0_SKXCCM0_TLDS0_ULSGRO0_USL1_UIOFGRO0_USFGROn1_VSn1_VWA1_VWB1_WSGRA0_WSGRB0_WS32_WG32_2_1_WGM8_WGMXCC1_WGMXCCGn1
    SolutionIndex: 301
    SolutionNameMin: Cijk_Ailk_Bjlk_BSS_BH_Bias_SHB_HA_S_SAB_SCD_SAV_UserArgs_MT64x64x16_MI16x16x1_SN_LDSB0_AFC1_AFEM1_AFEM1_ASEM1_CLR1_CADS0_DTLA0_DTLB0_DTVA1_DTVB1_EPS0_FDSI0_GRPM1_GRVWA8_GRVWB8_GSU1_GSUAMB_GSUC0_GSUWGMRR0_GLS0_ISA1201_IU1_K1_LBSPPA0_LBSPPB0_LBSPPM0_LPA0_LPB0_LPM0_LRVW8_LWPMn1_MIAV1_MIWT2_2_MO40_NTn1_NTA0_NTB0_NTC0_NTD0_NTM0_NEPBS0_NLCA1_NLCB1_ONLL0_PGR1_PLR0_PKA0_SIA3_SS1_SU32_SUM1_SUS256_SPO0_SRVW0_SSO0_SVW1_SK0_SKXCCM0_TLDS0_ULSGRO0_USL1_UIOFGRO0_USFGROn1_VSn1_VWA1_VWB1_WSGRA0_WSGRB0_WS32_WG32_4_1_WGM8_WGMXCC1_WGMXCCGn1
    SolutionIndex: 302
    SolutionNameMin: Cijk_Ailk_Bjlk_BSS_BH_Bias_SHB_HA_S_SAB_SCD_SAV_UserArgs_MT16x32x64_MI16x16x1_SN_LDSB0_AFC1_AFEM1_AFEM1_ASEM1_CLR1_CADS0_DTLA0_DTLB0_DTVA1_DTVB0_EPS0_FDSI0_GRPM1_GRVWA8_GRVWB8_GSU1_GSUAMB_GSUC0_GSUWGMRR0_GLS0_ISA1201_IU1_K1_LBSPPA0_LBSPPB512_LBSPPM0_LPA0_LPB16_LPM0_LRVW8_LWPMn1_MIAV1_MIWT1_1_MO40_NTn1_NTA0_NTB0_NTC0_NTD0_NTM0_NEPBS0_NLCA1_NLCB1_ONLL0_PGR2_PLR1_PKA0_SIA3_SS0_SU32_SUM1_SUS256_SPO0_SRVW0_SSO0_SVW8_SK0_SKXCCM0_TLDS0_ULSGRO0_USL1_UIOFGRO0_USFGROn1_VSn1_VWA1_VWB1_WSGRA0_WSGRB0_WS32_WG16_4_1_WGM8_WGMXCC1_WGMXCCGn1
    SolutionIndex: 304
    SolutionNameMin: Cijk_Ailk_Bjlk_BSS_BH_Bias_SHB_HA_S_SAB_SCD_SAV_UserArgs_MT128x128x16_MI16x16x1_SN_LDSB1_AFC1_AFEM1_AFEM1_ASEM1_CLR1_CADS0_DTLA0_DTLB0_DTVA0_DTVB0_EPS1_FDSI0_GRPM1_GRVWA4_GRVWB8_GSU1_GSUAMB_GSUC0_GSUWGMRR0_GLS0_ISA1201_IU1_K1_LBSPPA2048_LBSPPB2048_LBSPPM0_LPA0_LPB0_LPM0_LRVW8_LWPMn1_MIAV1_MIWT4_4_MO40_NTn1_NTA0_NTB0_NTC0_NTD0_NTM0_NEPBS0_NLCA1_NLCB1_ONLL0_PGR1_PLR1_PKA0_SIA2_SS1_SU32_SUM1_SUS256_SPO0_SRVW0_SSO0_SVW4_SK0_SKXCCM0_TLDS0_ULSGRO0_USL1_UIOFGRO0_USFGROn1_VSn1_VWA4_VWB4_WSGRA0_WSGRB0_WS32_WG32_4_1_WGM8_WGMXCC1_WGMXCCGn1
    SolutionIndex: 305
    SolutionNameMin: Cijk_Ailk_Bjlk_BSS_BH_Bias_SHB_HA_S_SAB_SCD_SAV_UserArgs_MT128x128x16_MI16x16x1_SN_LDSB1_AFC1_AFEM1_AFEM1_ASEM1_CLR1_CADS0_DTLA0_DTLB0_DTVA0_DTVB0_EPS1_FDSI0_GRPM1_GRVWA4_GRVWB4_GSU1_GSUAMB_GSUC0_GSUWGMRR0_GLS0_ISA1201_IU1_K1_LBSPPA2048_LBSPPB2048_LBSPPM0_LPA0_LPB0_LPM0_LRVW8_LWPMn1_MIAV1_MIWT4_4_MO40_NTn1_NTA0_NTB0_NTC0_NTD0_NTM0_NEPBS0_NLCA1_NLCB1_ONLL0_PGR1_PLR1_PKA0_SIA2_SS1_SU32_SUM1_SUS256_SPO0_SRVW0_SSO0_SVW4_SK0_SKXCCM0_TLDS0_ULSGRO0_USL1_UIOFGRO0_USFGROn1_VSn1_VWA4_VWB4_WSGRA0_WSGRB0_WS32_WG32_4_1_WGM8_WGMXCC1_WGMXCCGn1
    SolutionIndex: 306
    SolutionNameMin: Cijk_Ailk_Bjlk_BSS_BH_Bias_SHB_HA_S_SAB_SCD_SAV_UserArgs_MT32x128x64_MI16x16x1_SN_LDSB0_AFC1_AFEM1_AFEM1_ASEM1_CLR1_CADS0_DTLA0_DTLB0_DTVA0_DTVB1_EPS1_FDSI0_GRPM1_GRVWA4_GRVWB8_GSU1_GSUAMB_GSUC0_GSUWGMRR0_GLS0_ISA1201_IU1_K1_LBSPPA512_LBSPPB0_LBSPPM0_LPA16_LPB0_LPM0_LRVW8_LWPMn1_MIAV1_MIWT1_4_MO40_NTn1_NTA0_NTB0_NTC0_NTD0_NTM0_NEPBS0_NLCA1_NLCB4_ONLL0_PGR1_PLR1_PKA0_SIA3_SS0_SU32_SUM1_SUS256_SPO0_SRVW0_SSO0_SVW8_SK0_SKXCCM0_TLDS0_ULSGRO0_USL1_UIOFGRO0_USFGROn1_VSn1_VWA1_VWB1_WSGRA0_WSGRB0_WS32_WG32_4_1_WGM8_WGMXCC1_WGMXCCGn1
    SolutionIndex: 307
    SolutionNameMin: Cijk_Ailk_Bjlk_BSS_BH_Bias_SHB_HA_S_SAB_SCD_SAV_UserArgs_MT64x128x32_MI16x16x1_SN_LDSB0_AFC1_AFEM1_AFEM1_ASEM1_CLR1_CADS0_DTLA0_DTLB0_DTVA0_DTVB1_EPS1_FDSI0_GRPM1_GRVWA4_GRVWB8_GSU1_GSUAMB_GSUC0_GSUWGMRR0_GLS0_ISA1201_IU1_K1_LBSPPA1024_LBSPPB0_LBSPPM0_LPA16_LPB0_LPM0_LRVW8_LWPMn1_MIAV1_MIWT1_8_MO40_NTn1_NTA0_NTB0_NTC0_NTD0_NTM0_NEPBS0_NLCA1_NLCB2_ONLL0_PGR1_PLR1_PKA0_SIA3_SS0_SU32_SUM1_SUS256_SPO0_SRVW0_SSO0_SVW8_SK0_SKXCCM0_TLDS0_ULSGRO0_USL1_UIOFGRO0_USFGROn1_VSn1_VWA1_VWB1_WSGRA0_WSGRB0_WS32_WG64_2_1_WGM8_WGMXCC1_WGMXCCGn1
    SolutionIndex: 309
    SolutionNameMin: Cijk_Ailk_Bjlk_BSS_BH_Bias_SHB_HA_S_SAB_SCD_SAV_UserArgs_MT64x128x32_MI16x16x1_SN_LDSB0_AFC1_AFEM1_AFEM1_ASEM1_CLR1_CADS0_DTLA0_DTLB0_DTVA0_DTVB1_EPS0_FDSI0_GRPM1_GRVWA4_GRVWB8_GSU1_GSUAMB_GSUC0_GSUWGMRR0_GLS0_ISA1201_IU1_K1_LBSPPA1024_LBSPPB0_LBSPPM0_LPA16_LPB0_LPM0_LRVW8_LWPMn1_MIAV1_MIWT1_8_MO40_NTn1_NTA0_NTB0_NTC0_NTD0_NTM0_NEPBS0_NLCA1_NLCB2_ONLL0_PGR2_PLR1_PKA0_SIA3_SS0_SU32_SUM1_SUS256_SPO0_SRVW0_SSO0_SVW8_SK0_SKXCCM0_TLDS0_ULSGRO0_USL1_UIOFGRO0_USFGROn1_VSn1_VWA1_VWB1_WSGRA0_WSGRB0_WS32_WG64_2_1_WGM8_WGMXCC1_WGMXCCGn1
    SolutionIndex: 310
    SolutionNameMin: Cijk_Ailk_Bjlk_BSS_BH_Bias_SHB_HA_S_SAB_SCD_SAV_UserArgs_MT64x128x32_MI16x16x1_SN_LDSB0_AFC1_AFEM1_AFEM1_ASEM1_CLR1_CADS0_DTLA0_DTLB0_DTVA0_DTVB1_EPS1_FDSI0_GRPM1_GRVWA8_GRVWB8_GSU1_GSUAMB_GSUC0_GSUWGMRR0_GLS0_ISA1201_IU1_K1_LBSPPA1024_LBSPPB0_LBSPPM0_LPA16_LPB0_LPM0_LRVW8_LWPMn1_MIAV1_MIWT1_8_MO40_NTn1_NTA0_NTB0_NTC0_NTD0_NTM0_NEPBS0_NLCA1_NLCB2_ONLL0_PGR1_PLR1_PKA0_SIA3_SS0_SU32_SUM1_SUS256_SPO0_SRVW0_SSO0_SVW8_SK0_SKXCCM0_TLDS0_ULSGRO0_USL1_UIOFGRO0_USFGROn1_VSn1_VWA1_VWB1_WSGRA0_WSGRB0_WS32_WG64_2_1_WGM8_WGMXCC1_WGMXCCGn1
    SolutionIndex: 311
    SolutionNameMin: Cijk_Ailk_Bjlk_BSS_BH_Bias_SHB_HA_S_SAB_SCD_SAV_UserArgs_MT16x16x64_MI16x16x1_SN_LDSB1_AFC1_AFEM1_AFEM1_ASEM1_CLR1_CADS0_DTLA0_DTLB0_DTVA0_DTVB0_EPS1_FDSI0_GRPM1_GRVWA4_GRVWB4_GSU1_GSUAMB_GSUC0_GSUWGMRR0_GLS0_ISA1201_IU4_K1_LBSPPA256_LBSPPB256_LBSPPM0_LPA16_LPB16_LPM0_LRVW8_LWPMn1_MIAV1_MIWT1_1_MO40_NTn1_NTA0_NTB0_NTC0_NTD0_NTM0_NEPBS0_NLCA1_NLCB1_ONLL0_PGR1_PLR1_PKA0_SIA2_SS1_SU32_SUM1_SUS256_SPO0_SRVW0_SSO0_SVW1_SK0_SKXCCM0_TLDS0_ULSGRO0_USL1_UIOFGRO0_USFGROn1_VSn1_VWA1_VWB1_WSGRA0_WSGRB0_WS32_WG16_2_1_WGM8_WGMXCC1_WGMXCCGn1
    SolutionIndex: 312
    SolutionNameMin: Cijk_Ailk_Bjlk_BSS_BH_Bias_SHB_HA_S_SAB_SCD_SAV_UserArgs_MT16x32x64_MI16x16x1_SN_LDSB1_AFC1_AFEM1_AFEM1_ASEM1_CLR1_CADS0_DTLA0_DTLB0_DTVA0_DTVB0_EPS1_FDSI0_GRPM1_GRVWA8_GRVWB8_GSU1_GSUAMB_GSUC0_GSUWGMRR0_GLS0_ISA1201_IU4_K1_LBSPPA256_LBSPPB512_LBSPPM0_LPA16_LPB16_LPM0_LRVW8_LWPMn1_MIAV1_MIWT1_1_MO40_NTn1_NTA0_NTB0_NTC0_NTD0_NTM0_NEPBS0_NLCA1_NLCB1_ONLL0_PGR1_PLR1_PKA0_SIA2_SS1_SU32_SUM1_SUS256_SPO0_SRVW0_SSO0_SVW1_SK0_SKXCCM0_TLDS0_ULSGRO0_USL1_UIOFGRO0_USFGROn1_VSn1_VWA1_VWB1_WSGRA0_WSGRB0_WS32_WG16_4_1_WGM8_WGMXCC1_WGMXCCGn1
    SolutionIndex: 314
    SolutionNameMin: Cijk_Ailk_Bjlk_BSS_BH_Bias_SHB_HA_S_SAB_SCD_SAV_UserArgs_MT32x32x64_MI16x16x1_SN_LDSB0_AFC1_AFEM1_AFEM1_ASEM1_CLR1_CADS0_DTLA0_DTLB0_DTVA0_DTVB0_EPS0_FDSI0_GRPM1_GRVWA8_GRVWB8_GSU1_GSUAMB_GSUC0_GSUWGMRR0_GLS0_ISA1201_IU1_K1_LBSPPA512_LBSPPB512_LBSPPM0_LPA16_LPB16_LPM0_LRVW8_LWPMn1_MIAV1_MIWT1_1_MO40_NTn1_NTA0_NTB0_NTC0_NTD0_NTM0_NEPBS0_NLCA1_NLCB1_ONLL0_PGR2_PLR1_PKA0_SIA3_SS0_SU32_SUM1_SUS256_SPO0_SRVW0_SSO0_SVW8_SK0_SKXCCM0_TLDS0_ULSGRO0_USL1_UIOFGRO0_USFGROn1_VSn1_VWA1_VWB1_WSGRA0_WSGRB0_WS32_WG32_4_1_WGM8_WGMXCC1_WGMXCCGn1
    SolutionIndex: 315
    SolutionNameMin: Cijk_Ailk_Bjlk_BSS_BH_Bias_SHB_HA_S_SAB_SCD_SAV_UserArgs_MT32x32x128_MI16x16x1_SN_LDSB0_AFC1_AFEM1_AFEM1_ASEM1_CLR1_CADS0_DTLA0_DTLB0_DTVA0_DTVB1_EPS0_FDSI0_GRPM1_GRVWA8_GRVWB8_GSU1_GSUAMB_GSUC0_GSUWGMRR0_GLS0_ISA1201_IU1_K1_LBSPPA512_LBSPPB0_LBSPPM0_LPA16_LPB0_LPM0_LRVW8_LWPMn1_MIAV1_MIWT1_1_MO40_NTn1_NTA0_NTB0_NTC0_NTD0_NTM0_NEPBS0_NLCA1_NLCB1_ONLL0_PGR2_PLR1_PKA0_SIA3_SS1_SU32_SUM1_SUS256_SPO0_SRVW0_SSO0_SVW1_SK0_SKXCCM0_TLDS0_ULSGRO0_USL1_UIOFGRO0_USFGROn1_VSn1_VWA1_VWB1_WSGRA0_WSGRB0_WS32_WG32_4_1_WGM8_WGMXCC1_WGMXCCGn1
    SolutionIndex: 317
    SolutionNameMin: Cijk_Ailk_Bjlk_BSS_BH_Bias_SHB_HA_S_SAB_SCD_SAV_UserArgs_MT32x16x128_MI16x16x1_SN_LDSB0_AFC1_AFEM1_AFEM1_ASEM1_CLR1_CADS0_DTLA0_DTLB0_DTVA1_DTVB0_EPS1_FDSI0_GRPM1_GRVWA8_GRVWB8_GSU1_GSUAMB_GSUC0_GSUWGMRR0_GLS0_ISA1201_IU1_K1_LBSPPA0_LBSPPB256_LBSPPM0_LPA0_LPB16_LPM0_LRVW8_LWPMn1_MIAV1_MIWT1_1_MO40_NTn1_NTA0_NTB0_NTC0_NTD0_NTM0_NEPBS0_NLCA1_NLCB1_ONLL0_PGR1_PLR1_PKA0_SIA3_SS1_SU32_SUM1_SUS256_SPO0_SRVW0_SSO0_SVW1_SK0_SKXCCM0_TLDS0_ULSGRO0_USL1_UIOFGRO0_USFGROn1_VSn1_VWA1_VWB1_WSGRA0_WSGRB0_WS32_WG32_2_1_WGM8_WGMXCC1_WGMXCCGn1
    SolutionIndex: 319
    SolutionNameMin: Cijk_Ailk_Bjlk_BSS_BH_Bias_SHB_HA_S_SAB_SCD_SAV_UserArgs_MT16x32x128_MI16x16x1_SN_LDSB0_AFC1_AFEM1_AFEM1_ASEM1_CLR1_CADS0_DTLA0_DTLB0_DTVA0_DTVB1_EPS0_FDSI0_GRPM1_GRVWA8_GRVWB8_GSU1_GSUAMB_GSUC0_GSUWGMRR0_GLS0_ISA1201_IU1_K1_LBSPPA256_LBSPPB0_LBSPPM0_LPA16_LPB0_LPM0_LRVW8_LWPMn1_MIAV1_MIWT1_1_MO40_NTn1_NTA0_NTB0_NTC0_NTD0_NTM0_NEPBS0_NLCA1_NLCB1_ONLL0_PGR2_PLR1_PKA0_SIA3_SS0_SU32_SUM1_SUS256_SPO0_SRVW0_SSO0_SVW8_SK0_SKXCCM0_TLDS0_ULSGRO0_USL1_UIOFGRO0_USFGROn1_VSn1_VWA1_VWB1_WSGRA0_WSGRB0_WS32_WG16_4_1_WGM8_WGMXCC1_WGMXCCGn1
    SolutionIndex: 321
    SolutionNameMin: Cijk_Ailk_Bjlk_BSS_BH_Bias_SHB_HA_S_SAB_SCD_SAV_UserArgs_MT64x64x32_MI16x16x1_SN_LDSB0_AFC1_AFEM1_AFEM1_ASEM1_CLR1_CADS0_DTLA0_DTLB0_DTVA1_DTVB1_EPS0_FDSI0_GRPM1_GRVWA8_GRVWB8_GSU1_GSUAMB_GSUC0_GSUWGMRR0_GLS0_ISA1201_IU1_K1_LBSPPA0_LBSPPB0_LBSPPM0_LPA0_LPB0_LPM0_LRVW8_LWPMn1_MIAV1_MIWT2_2_MO40_NTn1_NTA0_NTB0_NTC0_NTD0_NTM0_NEPBS0_NLCA2_NLCB2_ONLL0_PGR1_PLR0_PKA0_SIA3_SS1_SU32_SUM1_SUS256_SPO0_SRVW0_SSO0_SVW1_SK0_SKXCCM0_TLDS0_ULSGRO0_USL1_UIOFGRO0_USFGROn1_VSn1_VWA1_VWB1_WSGRA0_WSGRB0_WS32_WG32_4_1_WGM8_WGMXCC1_WGMXCCGn1
    SolutionIndex: 322
    SolutionNameMin: Cijk_Ailk_Bjlk_BSS_BH_Bias_SHB_HA_S_SAB_SCD_SAV_UserArgs_MT128x64x32_MI16x16x1_SN_LDSB0_AFC1_AFEM1_AFEM1_ASEM1_CLR1_CADS0_DTLA0_DTLB0_DTVA1_DTVB0_EPS1_FDSI0_GRPM1_GRVWA8_GRVWB4_GSU1_GSUAMB_GSUC0_GSUWGMRR0_GLS0_ISA1201_IU1_K1_LBSPPA0_LBSPPB1024_LBSPPM0_LPA0_LPB16_LPM0_LRVW8_LWPMn1_MIAV1_MIWT8_1_MO40_NTn1_NTA0_NTB0_NTC0_NTD0_NTM0_NEPBS0_NLCA2_NLCB1_ONLL0_PGR1_PLR1_PKA0_SIA3_SS0_SU32_SUM1_SUS256_SPO0_SRVW0_SSO0_SVW8_SK0_SKXCCM0_TLDS0_ULSGRO0_USL1_UIOFGRO0_USFGROn1_VSn1_VWA1_VWB1_WSGRA0_WSGRB0_WS32_WG16_8_1_WGM8_WGMXCC1_WGMXCCGn1
    SolutionIndex: 323
    SolutionNameMin: Cijk_Ailk_Bjlk_BSS_BH_Bias_SHB_HA_S_SAB_SCD_SAV_UserArgs_MT32x32x128_MI16x16x1_SN_LDSB0_AFC1_AFEM1_AFEM1_ASEM1_CLR1_CADS0_DTLA0_DTLB0_DTVA1_DTVB0_EPS0_FDSI0_GRPM1_GRVWA8_GRVWB4_GSU1_GSUAMB_GSUC0_GSUWGMRR0_GLS0_ISA1201_IU1_K1_LBSPPA0_LBSPPB512_LBSPPM0_LPA0_LPB16_LPM0_LRVW8_LWPMn1_MIAV1_MIWT1_1_MO40_NTn1_NTA0_NTB0_NTC0_NTD0_NTM0_NEPBS0_NLCA1_NLCB1_ONLL0_PGR2_PLR1_PKA0_SIA3_SS1_SU32_SUM1_SUS256_SPO0_SRVW0_SSO0_SVW1_SK0_SKXCCM0_TLDS0_ULSGRO0_USL1_UIOFGRO0_USFGROn1_VSn1_VWA1_VWB1_WSGRA0_WSGRB0_WS32_WG32_4_1_WGM8_WGMXCC1_WGMXCCGn1
    SolutionIndex: 324
    SolutionNameMin: Cijk_Ailk_Bjlk_BSS_BH_Bias_SHB_HA_S_SAB_SCD_SAV_UserArgs_MT128x64x32_MI16x16x1_SN_LDSB0_AFC1_AFEM1_AFEM1_ASEM1_CLR1_CADS0_DTLA0_DTLB0_DTVA1_DTVB0_EPS0_FDSI0_GRPM1_GRVWA8_GRVWB8_GSU1_GSUAMB_GSUC0_GSUWGMRR0_GLS0_ISA1201_IU1_K1_LBSPPA0_LBSPPB1024_LBSPPM0_LPA0_LPB16_LPM0_LRVW8_LWPMn1_MIAV1_MIWT8_1_MO40_NTn1_NTA0_NTB0_NTC0_NTD0_NTM0_NEPBS0_NLCA2_NLCB1_ONLL0_PGR2_PLR1_PKA0_SIA3_SS1_SU32_SUM1_SUS256_SPO0_SRVW0_SSO0_SVW1_SK0_SKXCCM0_TLDS0_ULSGRO0_USL1_UIOFGRO0_USFGROn1_VSn1_VWA1_VWB1_WSGRA0_WSGRB0_WS32_WG16_8_1_WGM8_WGMXCC1_WGMXCCGn1
    SolutionIndex: 325
    SolutionNameMin: Cijk_Ailk_Bjlk_BSS_BH_Bias_SHB_HA_S_SAB_SCD_SAV_UserArgs_MT32x128x32_MI16x16x1_SN_LDSB0_AFC1_AFEM1_AFEM1_ASEM1_CLR1_CADS0_DTLA0_DTLB0_DTVA0_DTVB1_EPS1_FDSI0_GRPM1_GRVWA8_GRVWB8_GSU1_GSUAMB_GSUC0_GSUWGMRR0_GLS0_ISA1201_IU1_K1_LBSPPA512_LBSPPB0_LBSPPM0_LPA16_LPB0_LPM0_LRVW8_LWPMn1_MIAV1_MIWT1_4_MO40_NTn1_NTA0_NTB0_NTC0_NTD0_NTM0_NEPBS0_NLCA1_NLCB2_ONLL0_PGR1_PLR1_PKA0_SIA3_SS0_SU32_SUM1_SUS256_SPO0_SRVW0_SSO0_SVW8_SK0_SKXCCM0_TLDS0_ULSGRO0_USL1_UIOFGRO0_USFGROn1_VSn1_VWA1_VWB1_WSGRA0_WSGRB0_WS32_WG32_4_1_WGM8_WGMXCC1_WGMXCCGn1
    SolutionIndex: 326
    SolutionNameMin: Cijk_Ailk_Bjlk_BSS_BH_Bias_SHB_HA_S_SAB_SCD_SAV_UserArgs_MT64x128x32_MI16x16x1_SN_LDSB0_AFC1_AFEM1_AFEM1_ASEM1_CLR1_CADS0_DTLA0_DTLB0_DTVA0_DTVB1_EPS0_FDSI0_GRPM1_GRVWA8_GRVWB8_GSU1_GSUAMB_GSUC0_GSUWGMRR0_GLS0_ISA1201_IU1_K1_LBSPPA1024_LBSPPB0_LBSPPM0_LPA16_LPB0_LPM0_LRVW8_LWPMn1_MIAV1_MIWT1_8_MO40_NTn1_NTA0_NTB0_NTC0_NTD0_NTM0_NEPBS0_NLCA1_NLCB2_ONLL0_PGR2_PLR1_PKA0_SIA3_SS0_SU32_SUM1_SUS256_SPO0_SRVW0_SSO0_SVW8_SK0_SKXCCM0_TLDS0_ULSGRO0_USL1_UIOFGRO0_USFGROn1_VSn1_VWA1_VWB1_WSGRA0_WSGRB0_WS32_WG64_2_1_WGM8_WGMXCC1_WGMXCCGn1
    SolutionIndex: 327
    SolutionNameMin: Cijk_Ailk_Bjlk_BSS_BH_Bias_SHB_HA_S_SAB_SCD_SAV_UserArgs_MT128x128x16_MI16x16x1_SN_LDSB0_AFC1_AFEM1_AFEM1_ASEM1_CLR1_CADS0_DTLA0_DTLB0_DTVA1_DTVB1_EPS0_FDSI0_GRPM1_GRVWA8_GRVWB8_GSU1_GSUAMB_GSUC0_GSUWGMRR0_GLS0_ISA1201_IU1_K1_LBSPPA0_LBSPPB0_LBSPPM0_LPA0_LPB0_LPM0_LRVW8_LWPMn1_MIAV1_MIWT4_4_MO40_NTn1_NTA0_NTB0_NTC0_NTD0_NTM0_NEPBS0_NLCA1_NLCB1_ONLL0_PGR1_PLR0_PKA0_SIA3_SS0_SU32_SUM1_SUS256_SPO0_SRVW0_SSO0_SVW8_SK0_SKXCCM0_TLDS0_ULSGRO0_USL1_UIOFGRO0_USFGROn1_VSn1_VWA1_VWB1_WSGRA0_WSGRB0_WS32_WG32_4_1_WGM8_WGMXCC1_WGMXCCGn1
    SolutionIndex: 328
    SolutionNameMin: Cijk_Ailk_Bjlk_BSS_BH_Bias_SHB_HA_S_SAB_SCD_SAV_UserArgs_MT64x128x32_MI16x16x1_SN_LDSB0_AFC1_AFEM1_AFEM1_ASEM1_CLR1_CADS0_DTLA0_DTLB0_DTVA0_DTVB1_EPS1_FDSI0_GRPM1_GRVWA8_GRVWB8_GSU1_GSUAMB_GSUC0_GSUWGMRR0_GLS0_ISA1201_IU1_K1_LBSPPA1024_LBSPPB0_LBSPPM0_LPA16_LPB0_LPM0_LRVW8_LWPMn1_MIAV1_MIWT1_8_MO40_NTn1_NTA0_NTB0_NTC0_NTD0_NTM0_NEPBS0_NLCA1_NLCB2_ONLL0_PGR1_PLR1_PKA0_SIA3_SS1_SU32_SUM1_SUS256_SPO0_SRVW0_SSO0_SVW1_SK0_SKXCCM0_TLDS0_ULSGRO0_USL1_UIOFGRO0_USFGROn1_VSn1_VWA1_VWB1_WSGRA0_WSGRB0_WS32_WG64_2_1_WGM8_WGMXCC1_WGMXCCGn1
    SolutionIndex: 329
    SolutionNameMin: Cijk_Ailk_Bjlk_BSS_BH_Bias_SHB_HA_S_SAB_SCD_SAV_UserArgs_MT16x16x128_MI16x16x1_SN_LDSB1_AFC1_AFEM1_AFEM1_ASEM1_CLR1_CADS0_DTLA0_DTLB0_DTVA0_DTVB0_EPS1_FDSI0_GRPM1_GRVWA8_GRVWB8_GSU1_GSUAMB_GSUC0_GSUWGMRR0_GLS0_ISA1201_IU8_K1_LBSPPA256_LBSPPB256_LBSPPM0_LPA16_LPB16_LPM0_LRVW8_LWPMn1_MIAV1_MIWT1_1_MO40_NTn1_NTA0_NTB0_NTC0_NTD0_NTM0_NEPBS0_NLCA1_NLCB1_ONLL0_PGR1_PLR1_PKA0_SIA2_SS0_SU32_SUM1_SUS256_SPO0_SRVW0_SSO0_SVW8_SK0_SKXCCM0_TLDS0_ULSGRO0_USL1_UIOFGRO0_USFGROn1_VSn1_VWA1_VWB1_WSGRA0_WSGRB0_WS32_WG16_2_1_WGM8_WGMXCC1_WGMXCCGn1
    SolutionIndex: 330
    SolutionNameMin: Cijk_Ailk_Bjlk_BSS_BH_Bias_SHB_HA_S_SAB_SCD_SAV_UserArgs_MT32x32x128_MI16x16x1_SN_LDSB0_AFC1_AFEM1_AFEM1_ASEM1_CLR1_CADS0_DTLA0_DTLB0_DTVA1_DTVB0_EPS0_FDSI0_GRPM1_GRVWA8_GRVWB8_GSU1_GSUAMB_GSUC0_GSUWGMRR0_GLS0_ISA1201_IU1_K1_LBSPPA0_LBSPPB512_LBSPPM0_LPA0_LPB16_LPM0_LRVW8_LWPMn1_MIAV1_MIWT1_1_MO40_NTn1_NTA0_NTB0_NTC0_NTD0_NTM0_NEPBS0_NLCA1_NLCB1_ONLL0_PGR2_PLR1_PKA0_SIA3_SS1_SU32_SUM1_SUS256_SPO0_SRVW0_SSO0_SVW1_SK0_SKXCCM0_TLDS0_ULSGRO0_USL1_UIOFGRO0_USFGROn1_VSn1_VWA1_VWB1_WSGRA0_WSGRB0_WS32_WG32_4_1_WGM8_WGMXCC1_WGMXCCGn1
    SolutionIndex: 331
    SolutionNameMin: Cijk_Ailk_Bjlk_BSS_BH_Bias_SHB_HA_S_SAB_SCD_SAV_UserArgs_MT32x32x128_MI16x16x1_SN_LDSB0_AFC1_AFEM1_AFEM1_ASEM1_CLR1_CADS0_DTLA0_DTLB0_DTVA0_DTVB1_EPS1_FDSI0_GRPM1_GRVWA4_GRVWB8_GSU1_GSUAMB_GSUC0_GSUWGMRR0_GLS0_ISA1201_IU1_K1_LBSPPA512_LBSPPB0_LBSPPM0_LPA16_LPB0_LPM0_LRVW8_LWPMn1_MIAV1_MIWT1_1_MO40_NTn1_NTA0_NTB0_NTC0_NTD0_NTM0_NEPBS0_NLCA1_NLCB1_ONLL0_PGR1_PLR1_PKA0_SIA3_SS0_SU32_SUM1_SUS256_SPO0_SRVW0_SSO0_SVW8_SK0_SKXCCM0_TLDS0_ULSGRO0_USL1_UIOFGRO0_USFGROn1_VSn1_VWA1_VWB1_WSGRA0_WSGRB0_WS32_WG32_4_1_WGM8_WGMXCC1_WGMXCCGn1
    SolutionIndex: 332
    SolutionNameMin: Cijk_Ailk_Bjlk_BSS_BH_Bias_SHB_HA_S_SAB_SCD_SAV_UserArgs_MT32x128x64_MI16x16x1_SN_LDSB0_AFC1_AFEM1_AFEM1_ASEM1_CLR1_CADS0_DTLA0_DTLB0_DTVA0_DTVB1_EPS0_FDSI0_GRPM1_GRVWA8_GRVWB8_GSU1_GSUAMB_GSUC0_GSUWGMRR0_GLS0_ISA1201_IU1_K1_LBSPPA512_LBSPPB0_LBSPPM0_LPA16_LPB0_LPM0_LRVW8_LWPMn1_MIAV1_MIWT1_4_MO40_NTn1_NTA0_NTB0_NTC0_NTD0_NTM0_NEPBS0_NLCA1_NLCB4_ONLL0_PGR2_PLR1_PKA0_SIA3_SS0_SU32_SUM1_SUS256_SPO0_SRVW0_SSO0_SVW8_SK0_SKXCCM0_TLDS0_ULSGRO0_USL1_UIOFGRO0_USFGROn1_VSn1_VWA1_VWB1_WSGRA0_WSGRB0_WS32_WG32_4_1_WGM8_WGMXCC1_WGMXCCGn1
    SolutionIndex: 333
    SolutionNameMin: Cijk_Ailk_Bjlk_BSS_BH_Bias_SHB_HA_S_SAB_SCD_SAV_UserArgs_MT64x64x64_MI16x16x1_SN_LDSB0_AFC1_AFEM1_AFEM1_ASEM1_CLR1_CADS0_DTLA0_DTLB0_DTVA0_DTVB1_EPS1_FDSI0_GRPM1_GRVWA4_GRVWB8_GSU1_GSUAMB_GSUC0_GSUWGMRR0_GLS0_ISA1201_IU1_K1_LBSPPA1024_LBSPPB0_LBSPPM0_LPA32_LPB0_LPM0_LRVW8_LWPMn1_MIAV1_MIWT2_2_MO40_NTn1_NTA0_NTB0_NTC0_NTD0_NTM0_NEPBS0_NLCA1_NLCB4_ONLL0_PGR1_PLR1_PKA0_SIA3_SS0_SU32_SUM1_SUS256_SPO0_SRVW0_SSO0_SVW8_SK0_SKXCCM0_TLDS0_ULSGRO0_USL1_UIOFGRO0_USFGROn1_VSn1_VWA2_VWB1_WSGRA0_WSGRB0_WS32_WG32_4_1_WGM8_WGMXCC1_WGMXCCGn1
    SolutionIndex: 335
    SolutionNameMin: Cijk_Ailk_Bjlk_BSS_BH_Bias_SHB_HA_S_SAB_SCD_SAV_UserArgs_MT64x64x64_MI16x16x1_SN_LDSB0_AFC1_AFEM1_AFEM1_ASEM1_CLR1_CADS0_DTLA0_DTLB0_DTVA0_DTVB1_EPS0_FDSI0_GRPM1_GRVWA8_GRVWB8_GSU1_GSUAMB_GSUC0_GSUWGMRR0_GLS0_ISA1201_IU1_K1_LBSPPA1024_LBSPPB0_LBSPPM0_LPA32_LPB0_LPM0_LRVW8_LWPMn1_MIAV1_MIWT2_2_MO40_NTn1_NTA0_NTB0_NTC0_NTD0_NTM0_NEPBS0_NLCA1_NLCB4_ONLL0_PGR2_PLR1_PKA0_SIA3_SS0_SU32_SUM1_SUS256_SPO0_SRVW0_SSO0_SVW8_SK0_SKXCCM0_TLDS0_ULSGRO0_USL1_UIOFGRO0_USFGROn1_VSn1_VWA2_VWB1_WSGRA0_WSGRB0_WS32_WG32_4_1_WGM8_WGMXCC1_WGMXCCGn1
    SolutionIndex: 337
    SolutionNameMin: Cijk_Ailk_Bjlk_BSS_BH_Bias_SHB_HA_S_SAB_SCD_SAV_UserArgs_MT64x64x64_MI16x16x1_SN_LDSB0_AFC1_AFEM1_AFEM1_ASEM1_CLR1_CADS0_DTLA0_DTLB0_DTVA0_DTVB1_EPS1_FDSI0_GRPM1_GRVWA8_GRVWB8_GSU1_GSUAMB_GSUC0_GSUWGMRR0_GLS0_ISA1201_IU1_K1_LBSPPA1024_LBSPPB0_LBSPPM0_LPA32_LPB0_LPM0_LRVW8_LWPMn1_MIAV1_MIWT2_2_MO40_NTn1_NTA0_NTB0_NTC0_NTD0_NTM0_NEPBS0_NLCA1_NLCB4_ONLL0_PGR1_PLR1_PKA0_SIA3_SS0_SU32_SUM1_SUS256_SPO0_SRVW0_SSO0_SVW8_SK0_SKXCCM0_TLDS0_ULSGRO0_USL1_UIOFGRO0_USFGROn1_VSn1_VWA2_VWB1_WSGRA0_WSGRB0_WS32_WG32_4_1_WGM8_WGMXCC1_WGMXCCGn1
    SolutionIndex: 338
    SolutionNameMin: Cijk_Ailk_Bjlk_BSS_BH_Bias_SHB_HA_S_SAB_SCD_SAV_UserArgs_MT64x64x64_MI16x16x1_SN_LDSB0_AFC1_AFEM1_AFEM1_ASEM1_CLR1_CADS0_DTLA0_DTLB0_DTVA0_DTVB1_EPS0_FDSI0_GRPM1_GRVWA4_GRVWB8_GSU1_GSUAMB_GSUC0_GSUWGMRR0_GLS0_ISA1201_IU1_K1_LBSPPA1024_LBSPPB0_LBSPPM0_LPA32_LPB0_LPM0_LRVW8_LWPMn1_MIAV1_MIWT2_2_MO40_NTn1_NTA0_NTB0_NTC0_NTD0_NTM0_NEPBS0_NLCA1_NLCB4_ONLL0_PGR2_PLR1_PKA0_SIA3_SS0_SU32_SUM1_SUS256_SPO0_SRVW0_SSO0_SVW8_SK0_SKXCCM0_TLDS0_ULSGRO0_USL1_UIOFGRO0_USFGROn1_VSn1_VWA2_VWB1_WSGRA0_WSGRB0_WS32_WG32_4_1_WGM8_WGMXCC1_WGMXCCGn1
    SolutionIndex: 339
    SolutionNameMin: Cijk_Ailk_Bjlk_BSS_BH_Bias_SHB_HA_S_SAB_SCD_SAV_UserArgs_MT128x128x16_MI16x16x1_SN_LDSB0_AFC1_AFEM1_AFEM1_ASEM1_CLR1_CADS0_DTLA0_DTLB0_DTVA1_DTVB1_EPS0_FDSI0_GRPM1_GRVWA8_GRVWB8_GSU1_GSUAMB_GSUC0_GSUWGMRR0_GLS0_ISA1201_IU1_K1_LBSPPA0_LBSPPB0_LBSPPM0_LPA0_LPB0_LPM0_LRVW8_LWPMn1_MIAV1_MIWT8_2_MO40_NTn1_NTA0_NTB0_NTC0_NTD0_NTM0_NEPBS0_NLCA1_NLCB1_ONLL0_PGR1_PLR0_PKA0_SIA3_SS0_SU32_SUM1_SUS256_SPO0_SRVW0_SSO0_SVW8_SK0_SKXCCM0_TLDS0_ULSGRO0_USL1_UIOFGRO0_USFGROn1_VSn1_VWA1_VWB1_WSGRA0_WSGRB0_WS32_WG16_8_1_WGM8_WGMXCC1_WGMXCCGn1
    SolutionIndex: 340
    SolutionNameMin: Cijk_Ailk_Bjlk_BSS_BH_Bias_SHB_HA_S_SAB_SCD_SAV_UserArgs_MT16x16x128_MI16x16x1_SN_LDSB1_AFC1_AFEM1_AFEM1_ASEM1_CLR1_CADS0_DTLA0_DTLB0_DTVA0_DTVB0_EPS1_FDSI0_GRPM1_GRVWA8_GRVWB8_GSU1_GSUAMB_GSUC0_GSUWGMRR0_GLS0_ISA1201_IU8_K1_LBSPPA256_LBSPPB256_LBSPPM0_LPA16_LPB16_LPM0_LRVW8_LWPMn1_MIAV1_MIWT1_1_MO40_NTn1_NTA0_NTB0_NTC0_NTD0_NTM0_NEPBS0_NLCA1_NLCB1_ONLL0_PGR1_PLR1_PKA0_SIA2_SS1_SU32_SUM1_SUS256_SPO0_SRVW0_SSO0_SVW1_SK0_SKXCCM0_TLDS0_ULSGRO0_USL1_UIOFGRO0_USFGROn1_VSn1_VWA1_VWB1_WSGRA0_WSGRB0_WS32_WG16_2_1_WGM8_WGMXCC1_WGMXCCGn1
    SolutionIndex: 341
    SolutionNameMin: Cijk_Ailk_Bjlk_BSS_BH_Bias_SHB_HA_S_SAB_SCD_SAV_UserArgs_MT128x64x32_MI16x16x1_SN_LDSB0_AFC1_AFEM1_AFEM1_ASEM1_CLR1_CADS0_DTLA0_DTLB0_DTVA1_DTVB0_EPS0_FDSI0_GRPM1_GRVWA8_GRVWB4_GSU1_GSUAMB_GSUC0_GSUWGMRR0_GLS0_ISA1201_IU1_K1_LBSPPA0_LBSPPB1024_LBSPPM0_LPA0_LPB16_LPM0_LRVW8_LWPMn1_MIAV1_MIWT8_1_MO40_NTn1_NTA0_NTB0_NTC0_NTD0_NTM0_NEPBS0_NLCA2_NLCB1_ONLL0_PGR2_PLR1_PKA0_SIA3_SS1_SU32_SUM1_SUS256_SPO0_SRVW0_SSO0_SVW1_SK0_SKXCCM0_TLDS0_ULSGRO0_USL1_UIOFGRO0_USFGROn1_VSn1_VWA1_VWB1_WSGRA0_WSGRB0_WS32_WG16_8_1_WGM8_WGMXCC1_WGMXCCGn1
    SolutionIndex: 342
    SolutionNameMin: Cijk_Ailk_Bjlk_BSS_BH_Bias_SHB_HA_S_SAB_SCD_SAV_UserArgs_MT128x64x32_MI16x16x1_SN_LDSB0_AFC1_AFEM1_AFEM1_ASEM1_CLR1_CADS0_DTLA0_DTLB0_DTVA1_DTVB0_EPS1_FDSI0_GRPM1_GRVWA8_GRVWB8_GSU1_GSUAMB_GSUC0_GSUWGMRR0_GLS0_ISA1201_IU1_K1_LBSPPA0_LBSPPB1024_LBSPPM0_LPA0_LPB16_LPM0_LRVW8_LWPMn1_MIAV1_MIWT8_1_MO40_NTn1_NTA0_NTB0_NTC0_NTD0_NTM0_NEPBS0_NLCA2_NLCB1_ONLL0_PGR1_PLR1_PKA0_SIA3_SS1_SU32_SUM1_SUS256_SPO0_SRVW0_SSO0_SVW1_SK0_SKXCCM0_TLDS0_ULSGRO0_USL1_UIOFGRO0_USFGROn1_VSn1_VWA1_VWB1_WSGRA0_WSGRB0_WS32_WG16_8_1_WGM8_WGMXCC1_WGMXCCGn1
    SolutionIndex: 343
    SolutionNameMin: Cijk_Ailk_Bjlk_BSS_BH_Bias_SHB_HA_S_SAB_SCD_SAV_UserArgs_MT32x32x128_MI16x16x1_SN_LDSB0_AFC1_AFEM1_AFEM1_ASEM1_CLR1_CADS0_DTLA0_DTLB0_DTVA0_DTVB1_EPS1_FDSI0_GRPM1_GRVWA8_GRVWB8_GSU1_GSUAMB_GSUC0_GSUWGMRR0_GLS0_ISA1201_IU1_K1_LBSPPA512_LBSPPB0_LBSPPM0_LPA16_LPB0_LPM0_LRVW8_LWPMn1_MIAV1_MIWT1_1_MO40_NTn1_NTA0_NTB0_NTC0_NTD0_NTM0_NEPBS0_NLCA1_NLCB1_ONLL0_PGR1_PLR1_PKA0_SIA3_SS1_SU32_SUM1_SUS256_SPO0_SRVW0_SSO0_SVW1_SK0_SKXCCM0_TLDS0_ULSGRO0_USL1_UIOFGRO0_USFGROn1_VSn1_VWA1_VWB1_WSGRA0_WSGRB0_WS32_WG32_4_1_WGM8_WGMXCC1_WGMXCCGn1
    SolutionIndex: 345
    SolutionNameMin: Cijk_Ailk_Bjlk_BSS_BH_Bias_SHB_HA_S_SAB_SCD_SAV_UserArgs_MT32x32x128_MI16x16x1_SN_LDSB0_AFC1_AFEM1_AFEM1_ASEM1_CLR1_CADS0_DTLA0_DTLB0_DTVA1_DTVB0_EPS1_FDSI0_GRPM1_GRVWA8_GRVWB8_GSU1_GSUAMB_GSUC0_GSUWGMRR0_GLS0_ISA1201_IU1_K1_LBSPPA0_LBSPPB512_LBSPPM0_LPA0_LPB16_LPM0_LRVW8_LWPMn1_MIAV1_MIWT1_1_MO40_NTn1_NTA0_NTB0_NTC0_NTD0_NTM0_NEPBS0_NLCA1_NLCB1_ONLL0_PGR1_PLR1_PKA0_SIA3_SS0_SU32_SUM1_SUS256_SPO0_SRVW0_SSO0_SVW8_SK0_SKXCCM0_TLDS0_ULSGRO0_USL1_UIOFGRO0_USFGROn1_VSn1_VWA1_VWB1_WSGRA0_WSGRB0_WS32_WG32_4_1_WGM8_WGMXCC1_WGMXCCGn1
    SolutionIndex: 346
    SolutionNameMin: Cijk_Ailk_Bjlk_BSS_BH_Bias_SHB_HA_S_SAB_SCD_SAV_UserArgs_MT128x128x16_MI16x16x1_SN_LDSB0_AFC1_AFEM1_AFEM1_ASEM1_CLR1_CADS0_DTLA0_DTLB0_DTVA1_DTVB1_EPS0_FDSI0_GRPM1_GRVWA8_GRVWB8_GSU1_GSUAMB_GSUC0_GSUWGMRR0_GLS0_ISA1201_IU1_K1_LBSPPA0_LBSPPB0_LBSPPM0_LPA0_LPB0_LPM0_LRVW8_LWPMn1_MIAV1_MIWT4_4_MO40_NTn1_NTA0_NTB0_NTC0_NTD0_NTM0_NEPBS0_NLCA1_NLCB1_ONLL0_PGR1_PLR0_PKA0_SIA3_SS1_SU32_SUM1_SUS256_SPO0_SRVW0_SSO0_SVW1_SK0_SKXCCM0_TLDS0_ULSGRO0_USL1_UIOFGRO0_USFGROn1_VSn1_VWA1_VWB1_WSGRA0_WSGRB0_WS32_WG32_4_1_WGM8_WGMXCC1_WGMXCCGn1
    SolutionIndex: 349
    SolutionNameMin: Cijk_Ailk_Bjlk_BSS_BH_Bias_SHB_HA_S_SAB_SCD_SAV_UserArgs_MT16x32x32_MI16x16x1_SN_LDSB1_AFC1_AFEM1_AFEM1_ASEM1_CLR1_CADS0_DTLA0_DTLB0_DTVA0_DTVB0_EPS1_FDSI0_GRPM1_GRVWA8_GRVWB4_GSU1_GSUAMB_GSUC0_GSUWGMRR0_GLS0_ISA1201_IU2_K1_LBSPPA256_LBSPPB512_LBSPPM0_LPA16_LPB16_LPM0_LRVW8_LWPMn1_MIAV1_MIWT1_1_MO40_NTn1_NTA0_NTB0_NTC0_NTD0_NTM0_NEPBS0_NLCA1_NLCB1_ONLL0_PGR1_PLR1_PKA0_SIA2_SS0_SU32_SUM1_SUS256_SPO0_SRVW0_SSO0_SVW8_SK0_SKXCCM0_TLDS0_ULSGRO0_USL1_UIOFGRO0_USFGROn1_VSn1_VWA1_VWB1_WSGRA0_WSGRB0_WS32_WG16_4_1_WGM8_WGMXCC1_WGMXCCGn1
    SolutionIndex: 350
    SolutionNameMin: Cijk_Ailk_Bjlk_BSS_BH_Bias_SHB_HA_S_SAB_SCD_SAV_UserArgs_MT64x64x32_MI16x16x1_SN_LDSB1_AFC1_AFEM1_AFEM1_ASEM1_CLR1_CADS0_DTLA0_DTLB0_DTVA0_DTVB0_EPS0_FDSI0_GRPM1_GRVWA4_GRVWB4_GSU1_GSUAMB_GSUC0_GSUWGMRR0_GLS0_ISA1201_IU2_K1_LBSPPA1024_LBSPPB1024_LBSPPM0_LPA32_LPB32_LPM0_LRVW8_LWPMn1_MIAV1_MIWT2_2_MO40_NTn1_NTA0_NTB0_NTC0_NTD0_NTM0_NEPBS0_NLCA1_NLCB1_ONLL0_PGR2_PLR1_PKA0_SIA2_SS1_SU32_SUM1_SUS256_SPO0_SRVW0_SSO0_SVW2_SK0_SKXCCM0_TLDS0_ULSGRO1_USL1_UIOFGRO0_USFGROn1_VSn1_VWA2_VWB2_WSGRA0_WSGRB0_WS32_WG32_4_1_WGM8_WGMXCC1_WGMXCCGn1
    SolutionIndex: 351
    SolutionNameMin: Cijk_Ailk_Bjlk_BSS_BH_Bias_SHB_HA_S_SAB_SCD_SAV_UserArgs_MT64x64x32_MI16x16x1_SN_LDSB0_AFC1_AFEM1_AFEM1_ASEM1_CLR1_CADS0_DTLA0_DTLB0_DTVA1_DTVB0_EPS1_FDSI0_GRPM1_GRVWA8_GRVWB4_GSU1_GSUAMB_GSUC0_GSUWGMRR0_GLS0_ISA1201_IU1_K1_LBSPPA0_LBSPPB1024_LBSPPM0_LPA0_LPB32_LPM0_LRVW8_LWPMn1_MIAV1_MIWT2_2_MO40_NTn1_NTA0_NTB0_NTC0_NTD0_NTM0_NEPBS0_NLCA2_NLCB1_ONLL0_PGR1_PLR1_PKA0_SIA3_SS0_SU32_SUM1_SUS256_SPO0_SRVW0_SSO0_SVW8_SK0_SKXCCM0_TLDS0_ULSGRO0_USL1_UIOFGRO0_USFGROn1_VSn1_VWA1_VWB2_WSGRA0_WSGRB0_WS32_WG32_4_1_WGM8_WGMXCC1_WGMXCCGn1
    SolutionIndex: 352
    SolutionNameMin: Cijk_Ailk_Bjlk_BSS_BH_Bias_SHB_HA_S_SAB_SCD_SAV_UserArgs_MT64x64x16_MI16x16x1_SN_LDSB0_AFC1_AFEM1_AFEM1_ASEM1_CLR0_CADS0_DTLA0_DTLB0_DTVA0_DTVB0_EPS0_FDSI0_GRPM1_GRVWA8_GRVWB1_GSU1_GSUAMB_GSUC0_GSUWGMRR0_GLS0_ISA1201_IU1_K1_LBSPPA1024_LBSPPB1024_LBSPPM0_LPA32_LPB32_LPM0_LRVW8_LWPMn1_MIAV1_MIWT2_2_MO40_NTn1_NTA0_NTB0_NTC0_NTD0_NTM0_NEPBS0_NLCA1_NLCB1_ONLL0_PGR2_PLR0_PKA0_SIA3_SS1_SU32_SUM1_SUS256_SPO0_SRVW0_SSO0_SVW2_SK0_SKXCCM0_TLDS0_ULSGRO1_USL1_UIOFGRO0_USFGROn1_VSn1_VWA2_VWB2_WSGRA0_WSGRB0_WS32_WG32_4_1_WGM8_WGMXCC1_WGMXCCGn1
    SolutionIndex: 353
    SolutionNameMin: Cijk_Ailk_Bjlk_BSS_BH_Bias_SHB_HA_S_SAB_SCD_SAV_UserArgs_MT64x64x16_MI16x16x1_SN_LDSB1_AFC1_AFEM1_AFEM1_ASEM1_CLR1_CADS0_DTLA0_DTLB0_DTVA0_DTVB0_EPS0_FDSI0_GRPM1_GRVWA1_GRVWB1_GSU1_GSUAMB_GSUC0_GSUWGMRR0_GLS0_ISA1201_IU1_K1_LBSPPA1024_LBSPPB1024_LBSPPM0_LPA32_LPB32_LPM0_LRVW8_LWPMn1_MIAV1_MIWT2_2_MO40_NTn1_NTA0_NTB0_NTC0_NTD0_NTM0_NEPBS0_NLCA1_NLCB1_ONLL0_PGR2_PLR1_PKA0_SIA2_SS1_SU32_SUM1_SUS256_SPO0_SRVW0_SSO0_SVW2_SK0_SKXCCM0_TLDS0_ULSGRO1_USL1_UIOFGRO0_USFGROn1_VSn1_VWA2_VWB2_WSGRA0_WSGRB0_WS32_WG32_4_1_WGM8_WGMXCC1_WGMXCCGn1
    SolutionIndex: 354
    SolutionNameMin: Cijk_Ailk_Bjlk_BSS_BH_Bias_SHB_HA_S_SAB_SCD_SAV_UserArgs_MT64x64x16_MI16x16x1_SN_LDSB0_AFC1_AFEM1_AFEM1_ASEM1_CLR0_CADS0_DTLA0_DTLB0_DTVA0_DTVB0_EPS0_FDSI0_GRPM1_GRVWA1_GRVWB1_GSU1_GSUAMB_GSUC0_GSUWGMRR0_GLS0_ISA1201_IU1_K1_LBSPPA1024_LBSPPB1024_LBSPPM0_LPA32_LPB32_LPM0_LRVW8_LWPMn1_MIAV1_MIWT2_2_MO40_NTn1_NTA0_NTB0_NTC0_NTD0_NTM0_NEPBS0_NLCA1_NLCB1_ONLL0_PGR2_PLR0_PKA0_SIA3_SS1_SU32_SUM1_SUS256_SPO0_SRVW0_SSO0_SVW2_SK0_SKXCCM0_TLDS0_ULSGRO1_USL1_UIOFGRO0_USFGROn1_VSn1_VWA2_VWB2_WSGRA0_WSGRB0_WS32_WG32_4_1_WGM8_WGMXCC1_WGMXCCGn1
    SolutionIndex: 355
    SolutionNameMin: Cijk_Ailk_Bjlk_BSS_BH_Bias_SHB_HA_S_SAB_SCD_SAV_UserArgs_MT64x64x64_MI16x16x1_SN_LDSB1_AFC1_AFEM1_AFEM1_ASEM1_CLR1_CADS0_DTLA0_DTLB0_DTVA0_DTVB0_EPS1_FDSI0_GRPM1_GRVWA8_GRVWB8_GSU1_GSUAMB_GSUC0_GSUWGMRR0_GLS0_ISA1201_IU1_K1_LBSPPA1024_LBSPPB1024_LBSPPM0_LPA32_LPB32_LPM0_LRVW8_LWPMn1_MIAV1_MIWT2_2_MO40_NTn1_NTA0_NTB0_NTC0_NTD0_NTM0_NEPBS0_NLCA1_NLCB1_ONLL0_PGR1_PLR1_PKA0_SIA3_SS1_SU32_SUM1_SUS256_SPO0_SRVW0_SSO0_SVW2_SK0_SKXCCM0_TLDS0_ULSGRO0_USL1_UIOFGRO0_USFGROn1_VSn1_VWA2_VWB2_WSGRA0_WSGRB0_WS32_WG32_4_1_WGM8_WGMXCC1_WGMXCCGn1
    SolutionIndex: 356
    SolutionNameMin: Cijk_Ailk_Bjlk_BSS_BH_Bias_SHB_HA_S_SAB_SCD_SAV_UserArgs_MT32x16x64_MI16x16x1_SN_LDSB0_AFC1_AFEM1_AFEM1_ASEM1_CLR1_CADS0_DTLA0_DTLB0_DTVA1_DTVB1_EPS0_FDSI0_GRPM1_GRVWA8_GRVWB8_GSU1_GSUAMB_GSUC0_GSUWGMRR0_GLS0_ISA1201_IU1_K1_LBSPPA0_LBSPPB0_LBSPPM0_LPA0_LPB0_LPM0_LRVW8_LWPMn1_MIAV1_MIWT1_1_MO40_NTn1_NTA0_NTB0_NTC0_NTD0_NTM0_NEPBS0_NLCA1_NLCB1_ONLL0_PGR1_PLR0_PKA0_SIA3_SS1_SU32_SUM1_SUS256_SPO0_SRVW0_SSO0_SVW1_SK0_SKXCCM0_TLDS0_ULSGRO0_USL1_UIOFGRO0_USFGROn1_VSn1_VWA1_VWB1_WSGRA0_WSGRB0_WS32_WG32_2_1_WGM8_WGMXCC1_WGMXCCGn1
    SolutionIndex: 357
    SolutionNameMin: Cijk_Ailk_Bjlk_BSS_BH_Bias_SHB_HA_S_SAB_SCD_SAV_UserArgs_MT16x128x16_MI16x16x1_SN_LDSB0_AFC1_AFEM1_AFEM1_ASEM1_CLR1_CADS0_DTLA0_DTLB0_DTVA1_DTVB1_EPS0_FDSI0_GRPM1_GRVWA8_GRVWB8_GSU1_GSUAMB_GSUC0_GSUWGMRR0_GLS0_ISA1201_IU1_K1_LBSPPA0_LBSPPB0_LBSPPM0_LPA0_LPB0_LPM0_LRVW8_LWPMn1_MIAV1_MIWT1_8_MO40_NTn1_NTA0_NTB0_NTC0_NTD0_NTM0_NEPBS0_NLCA1_NLCB1_ONLL0_PGR1_PLR0_PKA0_SIA3_SS0_SU32_SUM1_SUS256_SPO0_SRVW0_SSO0_SVW8_SK0_SKXCCM0_TLDS0_ULSGRO0_USL1_UIOFGRO0_USFGROn1_VSn1_VWA1_VWB1_WSGRA0_WSGRB0_WS32_WG16_2_1_WGM8_WGMXCC1_WGMXCCGn1
    SolutionIndex: 358
    SolutionNameMin: Cijk_Ailk_Bjlk_BSS_BH_Bias_SHB_HA_S_SAB_SCD_SAV_UserArgs_MT32x16x64_MI16x16x1_SN_LDSB0_AFC1_AFEM1_AFEM1_ASEM1_CLR1_CADS0_DTLA0_DTLB0_DTVA1_DTVB0_EPS1_FDSI0_GRPM1_GRVWA8_GRVWB4_GSU1_GSUAMB_GSUC0_GSUWGMRR0_GLS0_ISA1201_IU1_K1_LBSPPA0_LBSPPB256_LBSPPM0_LPA0_LPB16_LPM0_LRVW8_LWPMn1_MIAV1_MIWT1_1_MO40_NTn1_NTA0_NTB0_NTC0_NTD0_NTM0_NEPBS0_NLCA1_NLCB1_ONLL0_PGR1_PLR1_PKA0_SIA3_SS0_SU32_SUM1_SUS256_SPO0_SRVW0_SSO0_SVW8_SK0_SKXCCM0_TLDS0_ULSGRO0_USL1_UIOFGRO0_USFGROn1_VSn1_VWA1_VWB1_WSGRA0_WSGRB0_WS32_WG32_2_1_WGM8_WGMXCC1_WGMXCCGn1
    SolutionIndex: 359
    SolutionNameMin: Cijk_Ailk_Bjlk_BSS_BH_Bias_SHB_HA_S_SAB_SCD_SAV_UserArgs_MT64x64x16_MI16x16x1_SN_LDSB0_AFC1_AFEM1_AFEM1_ASEM1_CLR0_CADS0_DTLA0_DTLB0_DTVA0_DTVB0_EPS0_FDSI0_GRPM1_GRVWA1_GRVWB1_GSU1_GSUAMB_GSUC0_GSUWGMRR0_GLS0_ISA1201_IU1_K1_LBSPPA1024_LBSPPB1024_LBSPPM0_LPA32_LPB32_LPM0_LRVW8_LWPMn1_MIAV1_MIWT2_2_MO40_NTn1_NTA0_NTB0_NTC0_NTD0_NTM0_NEPBS0_NLCA1_NLCB1_ONLL0_PGR2_PLR0_PKA0_SIA3_SS1_SU32_SUM1_SUS256_SPO0_SRVW0_SSO0_SVW2_SK0_SKXCCM0_TLDS0_ULSGRO0_USL1_UIOFGRO0_USFGROn1_VSn1_VWA2_VWB2_WSGRA0_WSGRB0_WS32_WG32_4_1_WGM8_WGMXCC1_WGMXCCGn1
    SolutionIndex: 360
    SolutionNameMin: Cijk_Ailk_Bjlk_BSS_BH_Bias_SHB_HA_S_SAB_SCD_SAV_UserArgs_MT16x32x64_MI16x16x1_SN_LDSB0_AFC1_AFEM1_AFEM1_ASEM1_CLR1_CADS0_DTLA0_DTLB0_DTVA1_DTVB1_EPS0_FDSI0_GRPM1_GRVWA8_GRVWB8_GSU1_GSUAMB_GSUC0_GSUWGMRR0_GLS0_ISA1201_IU1_K1_LBSPPA0_LBSPPB0_LBSPPM0_LPA0_LPB0_LPM0_LRVW8_LWPMn1_MIAV1_MIWT1_1_MO40_NTn1_NTA0_NTB0_NTC0_NTD0_NTM0_NEPBS0_NLCA1_NLCB1_ONLL0_PGR1_PLR0_PKA0_SIA3_SS1_SU32_SUM1_SUS256_SPO0_SRVW0_SSO0_SVW1_SK0_SKXCCM0_TLDS0_ULSGRO0_USL1_UIOFGRO0_USFGROn1_VSn1_VWA1_VWB1_WSGRA0_WSGRB0_WS32_WG16_4_1_WGM8_WGMXCC1_WGMXCCGn1
    SolutionIndex: 361
    SolutionNameMin: Cijk_Ailk_Bjlk_BSS_BH_Bias_SHB_HA_S_SAB_SCD_SAV_UserArgs_MT32x32x32_MI16x16x1_SN_LDSB1_AFC1_AFEM1_AFEM1_ASEM1_CLR1_CADS0_DTLA0_DTLB0_DTVA0_DTVB0_EPS0_FDSI0_GRPM1_GRVWA1_GRVWB1_GSU1_GSUAMB_GSUC0_GSUWGMRR0_GLS0_ISA1201_IU2_K1_LBSPPA512_LBSPPB512_LBSPPM0_LPA16_LPB16_LPM0_LRVW8_LWPMn1_MIAV1_MIWT1_1_MO40_NTn1_NTA0_NTB0_NTC0_NTD0_NTM0_NEPBS0_NLCA1_NLCB1_ONLL0_PGR2_PLR1_PKA0_SIA2_SS1_SU32_SUM1_SUS256_SPO0_SRVW0_SSO0_SVW1_SK0_SKXCCM0_TLDS0_ULSGRO0_USL1_UIOFGRO0_USFGROn1_VSn1_VWA1_VWB1_WSGRA0_WSGRB0_WS32_WG32_4_1_WGM8_WGMXCC1_WGMXCCGn1
    SolutionIndex: 362
    SolutionNameMin: Cijk_Ailk_Bjlk_BSS_BH_Bias_SHB_HA_S_SAB_SCD_SAV_UserArgs_MT64x64x16_MI16x16x1_SN_LDSB1_AFC1_AFEM1_AFEM1_ASEM1_CLR1_CADS0_DTLA0_DTLB0_DTVA0_DTVB0_EPS0_FDSI0_GRPM1_GRVWA4_GRVWB4_GSU1_GSUAMB_GSUC0_GSUWGMRR0_GLS0_ISA1201_IU1_K1_LBSPPA1024_LBSPPB1024_LBSPPM0_LPA32_LPB32_LPM0_LRVW8_LWPMn1_MIAV1_MIWT2_2_MO40_NTn1_NTA0_NTB0_NTC0_NTD0_NTM0_NEPBS0_NLCA1_NLCB1_ONLL0_PGR2_PLR1_PKA0_SIA2_SS1_SU32_SUM1_SUS256_SPO0_SRVW0_SSO0_SVW2_SK0_SKXCCM0_TLDS0_ULSGRO0_USL1_UIOFGRO0_USFGROn1_VSn1_VWA2_VWB2_WSGRA0_WSGRB0_WS32_WG32_4_1_WGM8_WGMXCC1_WGMXCCGn1
    SolutionIndex: 363
    SolutionNameMin: Cijk_Ailk_Bjlk_BSS_BH_Bias_SHB_HA_S_SAB_SCD_SAV_UserArgs_MT16x128x32_MI16x16x1_SN_LDSB0_AFC1_AFEM1_AFEM1_ASEM1_CLR1_CADS0_DTLA0_DTLB0_DTVA0_DTVB1_EPS1_FDSI0_GRPM1_GRVWA8_GRVWB8_GSU1_GSUAMB_GSUC0_GSUWGMRR0_GLS0_ISA1201_IU1_K1_LBSPPA256_LBSPPB0_LBSPPM0_LPA16_LPB0_LPM0_LRVW8_LWPMn1_MIAV1_MIWT1_8_MO40_NTn1_NTA0_NTB0_NTC0_NTD0_NTM0_NEPBS0_NLCA1_NLCB2_ONLL0_PGR1_PLR1_PKA0_SIA3_SS0_SU32_SUM1_SUS256_SPO0_SRVW0_SSO0_SVW8_SK0_SKXCCM0_TLDS0_ULSGRO0_USL1_UIOFGRO0_USFGROn1_VSn1_VWA1_VWB1_WSGRA0_WSGRB0_WS32_WG16_2_1_WGM8_WGMXCC1_WGMXCCGn1
    SolutionIndex: 364
    SolutionNameMin: Cijk_Ailk_Bjlk_BSS_BH_Bias_SHB_HA_S_SAB_SCD_SAV_UserArgs_MT64x64x16_MI16x16x1_SN_LDSB1_AFC1_AFEM1_AFEM1_ASEM1_CLR1_CADS0_DTLA0_DTLB0_DTVA0_DTVB0_EPS0_FDSI0_GRPM1_GRVWA4_GRVWB1_GSU1_GSUAMB_GSUC0_GSUWGMRR0_GLS0_ISA1201_IU1_K1_LBSPPA1024_LBSPPB1024_LBSPPM0_LPA32_LPB32_LPM0_LRVW8_LWPMn1_MIAV1_MIWT2_2_MO40_NTn1_NTA0_NTB0_NTC0_NTD0_NTM0_NEPBS0_NLCA1_NLCB1_ONLL0_PGR2_PLR1_PKA0_SIA2_SS1_SU32_SUM1_SUS256_SPO0_SRVW0_SSO0_SVW2_SK0_SKXCCM0_TLDS0_ULSGRO1_USL1_UIOFGRO0_USFGROn1_VSn1_VWA2_VWB2_WSGRA0_WSGRB0_WS32_WG32_4_1_WGM8_WGMXCC1_WGMXCCGn1
    SolutionIndex: 365
    SolutionNameMin: Cijk_Ailk_Bjlk_BSS_BH_Bias_SHB_HA_S_SAB_SCD_SAV_UserArgs_MT64x64x32_MI16x16x1_SN_LDSB0_AFC1_AFEM1_AFEM1_ASEM1_CLR1_CADS0_DTLA0_DTLB0_DTVA0_DTVB0_EPS1_FDSI0_GRPM1_GRVWA4_GRVWB8_GSU1_GSUAMB_GSUC0_GSUWGMRR0_GLS0_ISA1201_IU1_K1_LBSPPA1024_LBSPPB1024_LBSPPM0_LPA32_LPB32_LPM0_LRVW8_LWPMn1_MIAV1_MIWT2_2_MO40_NTn1_NTA0_NTB0_NTC0_NTD0_NTM0_NEPBS0_NLCA1_NLCB1_ONLL0_PGR1_PLR1_PKA0_SIA3_SS1_SU32_SUM1_SUS256_SPO0_SRVW0_SSO0_SVW2_SK0_SKXCCM0_TLDS0_ULSGRO0_USL1_UIOFGRO0_USFGROn1_VSn1_VWA2_VWB2_WSGRA0_WSGRB0_WS32_WG32_4_1_WGM8_WGMXCC1_WGMXCCGn1
    SolutionIndex: 366
    SolutionNameMin: Cijk_Ailk_Bjlk_BSS_BH_Bias_SHB_HA_S_SAB_SCD_SAV_UserArgs_MT32x32x128_MI16x16x1_SN_LDSB0_AFC1_AFEM1_AFEM1_ASEM1_CLR1_CADS0_DTLA0_DTLB0_DTVA0_DTVB1_EPS1_FDSI0_GRPM1_GRVWA8_GRVWB8_GSU1_GSUAMB_GSUC0_GSUWGMRR0_GLS0_ISA1201_IU1_K1_LBSPPA512_LBSPPB0_LBSPPM0_LPA16_LPB0_LPM0_LRVW8_LWPMn1_MIAV1_MIWT1_1_MO40_NTn1_NTA0_NTB0_NTC0_NTD0_NTM0_NEPBS0_NLCA1_NLCB1_ONLL0_PGR1_PLR1_PKA0_SIA3_SS0_SU32_SUM1_SUS256_SPO0_SRVW0_SSO0_SVW8_SK0_SKXCCM0_TLDS0_ULSGRO0_USL1_UIOFGRO0_USFGROn1_VSn1_VWA1_VWB1_WSGRA0_WSGRB0_WS32_WG32_4_1_WGM8_WGMXCC1_WGMXCCGn1
    SolutionIndex: 367
    SolutionNameMin: Cijk_Ailk_Bjlk_BSS_BH_Bias_SHB_HA_S_SAB_SCD_SAV_UserArgs_MT16x32x64_MI16x16x1_SN_LDSB0_AFC1_AFEM1_AFEM1_ASEM1_CLR1_CADS0_DTLA0_DTLB0_DTVA1_DTVB1_EPS0_FDSI0_GRPM1_GRVWA8_GRVWB8_GSU1_GSUAMB_GSUC0_GSUWGMRR0_GLS0_ISA1201_IU1_K1_LBSPPA0_LBSPPB0_LBSPPM0_LPA0_LPB0_LPM0_LRVW8_LWPMn1_MIAV1_MIWT1_1_MO40_NTn1_NTA0_NTB0_NTC0_NTD0_NTM0_NEPBS0_NLCA1_NLCB1_ONLL0_PGR1_PLR0_PKA0_SIA3_SS0_SU32_SUM1_SUS256_SPO0_SRVW0_SSO0_SVW8_SK0_SKXCCM0_TLDS0_ULSGRO0_USL1_UIOFGRO0_USFGROn1_VSn1_VWA1_VWB1_WSGRA0_WSGRB0_WS32_WG16_4_1_WGM8_WGMXCC1_WGMXCCGn1
    SolutionIndex: 368
    SolutionNameMin: Cijk_Ailk_Bjlk_BSS_BH_Bias_SHB_HA_S_SAB_SCD_SAV_UserArgs_MT32x32x32_MI16x16x1_SN_LDSB0_AFC1_AFEM1_AFEM1_ASEM1_CLR1_CADS0_DTLA0_DTLB0_DTVA0_DTVB1_EPS0_FDSI0_GRPM1_GRVWA8_GRVWB8_GSU1_GSUAMB_GSUC0_GSUWGMRR0_GLS0_ISA1201_IU1_K1_LBSPPA512_LBSPPB0_LBSPPM0_LPA16_LPB0_LPM0_LRVW8_LWPMn1_MIAV1_MIWT1_1_MO40_NTn1_NTA0_NTB0_NTC0_NTD0_NTM0_NEPBS0_NLCA1_NLCB1_ONLL0_PGR2_PLR1_PKA0_SIA3_SS0_SU32_SUM1_SUS256_SPO0_SRVW0_SSO0_SVW8_SK0_SKXCCM0_TLDS0_ULSGRO0_USL1_UIOFGRO0_USFGROn1_VSn1_VWA1_VWB1_WSGRA0_WSGRB0_WS32_WG32_4_1_WGM8_WGMXCC1_WGMXCCGn1
    SolutionIndex: 369
    SolutionNameMin: Cijk_Ailk_Bjlk_BSS_BH_Bias_SHB_HA_S_SAB_SCD_SAV_UserArgs_MT32x16x32_MI16x16x1_SN_LDSB0_AFC1_AFEM1_AFEM1_ASEM1_CLR1_CADS0_DTLA0_DTLB0_DTVA0_DTVB1_EPS0_FDSI0_GRPM1_GRVWA4_GRVWB8_GSU1_GSUAMB_GSUC0_GSUWGMRR0_GLS0_ISA1201_IU1_K1_LBSPPA512_LBSPPB0_LBSPPM0_LPA16_LPB0_LPM0_LRVW8_LWPMn1_MIAV1_MIWT1_1_MO40_NTn1_NTA0_NTB0_NTC0_NTD0_NTM0_NEPBS0_NLCA1_NLCB1_ONLL0_PGR2_PLR1_PKA0_SIA3_SS1_SU32_SUM1_SUS256_SPO0_SRVW0_SSO0_SVW1_SK0_SKXCCM0_TLDS0_ULSGRO0_USL1_UIOFGRO0_USFGROn1_VSn1_VWA1_VWB1_WSGRA0_WSGRB0_WS32_WG32_2_1_WGM8_WGMXCC1_WGMXCCGn1
    SolutionIndex: 370
    SolutionNameMin: Cijk_Ailk_Bjlk_BSS_BH_Bias_SHB_HA_S_SAB_SCD_SAV_UserArgs_MT64x128x16_MI16x16x1_SN_LDSB0_AFC1_AFEM1_AFEM1_ASEM1_CLR1_CADS0_DTLA0_DTLB0_DTVA1_DTVB1_EPS0_FDSI0_GRPM1_GRVWA8_GRVWB8_GSU1_GSUAMB_GSUC0_GSUWGMRR0_GLS0_ISA1201_IU1_K1_LBSPPA0_LBSPPB0_LBSPPM0_LPA0_LPB0_LPM0_LRVW8_LWPMn1_MIAV1_MIWT1_8_MO40_NTn1_NTA0_NTB0_NTC0_NTD0_NTM0_NEPBS0_NLCA1_NLCB1_ONLL0_PGR1_PLR0_PKA0_SIA3_SS1_SU32_SUM1_SUS256_SPO0_SRVW0_SSO0_SVW1_SK0_SKXCCM0_TLDS0_ULSGRO0_USL1_UIOFGRO0_USFGROn1_VSn1_VWA1_VWB1_WSGRA0_WSGRB0_WS32_WG64_2_1_WGM8_WGMXCC1_WGMXCCGn1
    SolutionIndex: 371
    SolutionNameMin: Cijk_Ailk_Bjlk_BSS_BH_Bias_SHB_HA_S_SAB_SCD_SAV_UserArgs_MT128x64x16_MI16x16x1_SN_LDSB0_AFC1_AFEM1_AFEM1_ASEM1_CLR1_CADS0_DTLA0_DTLB0_DTVA1_DTVB1_EPS0_FDSI0_GRPM1_GRVWA8_GRVWB8_GSU1_GSUAMB_GSUC0_GSUWGMRR0_GLS0_ISA1201_IU1_K1_LBSPPA0_LBSPPB0_LBSPPM0_LPA0_LPB0_LPM0_LRVW8_LWPMn1_MIAV1_MIWT8_1_MO40_NTn1_NTA0_NTB0_NTC0_NTD0_NTM0_NEPBS0_NLCA1_NLCB1_ONLL0_PGR1_PLR0_PKA0_SIA3_SS1_SU32_SUM1_SUS256_SPO0_SRVW0_SSO0_SVW1_SK0_SKXCCM0_TLDS0_ULSGRO0_USL1_UIOFGRO0_USFGROn1_VSn1_VWA1_VWB1_WSGRA0_WSGRB0_WS32_WG16_8_1_WGM8_WGMXCC1_WGMXCCGn1
    SolutionIndex: 372
    SolutionNameMin: Cijk_Ailk_Bjlk_BSS_BH_Bias_SHB_HA_S_SAB_SCD_SAV_UserArgs_MT64x128x32_MI16x16x1_SN_LDSB0_AFC1_AFEM1_AFEM1_ASEM1_CLR1_CADS0_DTLA0_DTLB0_DTVA0_DTVB1_EPS0_FDSI0_GRPM1_GRVWA4_GRVWB8_GSU1_GSUAMB_GSUC0_GSUWGMRR0_GLS0_ISA1201_IU1_K1_LBSPPA1024_LBSPPB0_LBSPPM0_LPA16_LPB0_LPM0_LRVW8_LWPMn1_MIAV1_MIWT1_8_MO40_NTn1_NTA0_NTB0_NTC0_NTD0_NTM0_NEPBS0_NLCA1_NLCB2_ONLL0_PGR2_PLR1_PKA0_SIA3_SS1_SU32_SUM1_SUS256_SPO0_SRVW0_SSO0_SVW1_SK0_SKXCCM0_TLDS0_ULSGRO0_USL1_UIOFGRO0_USFGROn1_VSn1_VWA1_VWB1_WSGRA0_WSGRB0_WS32_WG64_2_1_WGM8_WGMXCC1_WGMXCCGn1
    SolutionIndex: 373
    SolutionNameMin: Cijk_Ailk_Bjlk_BSS_BH_Bias_SHB_HA_S_SAB_SCD_SAV_UserArgs_MT64x64x64_MI16x16x1_SN_LDSB0_AFC1_AFEM1_AFEM1_ASEM1_CLR1_CADS0_DTLA0_DTLB0_DTVA1_DTVB0_EPS1_FDSI0_GRPM1_GRVWA8_GRVWB8_GSU1_GSUAMB_GSUC0_GSUWGMRR0_GLS0_ISA1201_IU1_K1_LBSPPA0_LBSPPB1024_LBSPPM0_LPA0_LPB32_LPM0_LRVW8_LWPMn1_MIAV1_MIWT2_2_MO40_NTn1_NTA0_NTB0_NTC0_NTD0_NTM0_NEPBS0_NLCA4_NLCB1_ONLL0_PGR1_PLR1_PKA0_SIA3_SS1_SU32_SUM1_SUS256_SPO0_SRVW0_SSO0_SVW1_SK0_SKXCCM0_TLDS0_ULSGRO0_USL1_UIOFGRO0_USFGROn1_VSn1_VWA1_VWB2_WSGRA0_WSGRB0_WS32_WG32_4_1_WGM8_WGMXCC1_WGMXCCGn1
    SolutionIndex: 374
    SolutionNameMin: Cijk_Ailk_Bjlk_BSS_BH_Bias_SHB_HA_S_SAB_SCD_SAV_UserArgs_MT64x64x64_MI16x16x1_SN_LDSB0_AFC1_AFEM1_AFEM1_ASEM1_CLR1_CADS0_DTLA0_DTLB0_DTVA1_DTVB0_EPS0_FDSI0_GRPM1_GRVWA8_GRVWB8_GSU1_GSUAMB_GSUC0_GSUWGMRR0_GLS0_ISA1201_IU1_K1_LBSPPA0_LBSPPB1024_LBSPPM0_LPA0_LPB32_LPM0_LRVW8_LWPMn1_MIAV1_MIWT2_2_MO40_NTn1_NTA0_NTB0_NTC0_NTD0_NTM0_NEPBS0_NLCA4_NLCB1_ONLL0_PGR2_PLR1_PKA0_SIA3_SS1_SU32_SUM1_SUS256_SPO0_SRVW0_SSO0_SVW1_SK0_SKXCCM0_TLDS0_ULSGRO0_USL1_UIOFGRO0_USFGROn1_VSn1_VWA1_VWB2_WSGRA0_WSGRB0_WS32_WG32_4_1_WGM8_WGMXCC1_WGMXCCGn1
    SolutionIndex: 375
    SolutionNameMin: Cijk_Ailk_Bjlk_BSS_BH_Bias_SHB_HA_S_SAB_SCD_SAV_UserArgs_MT64x64x32_MI16x16x1_SN_LDSB0_AFC1_AFEM1_AFEM1_ASEM1_CLR1_CADS0_DTLA0_DTLB0_DTVA1_DTVB0_EPS0_FDSI0_GRPM1_GRVWA8_GRVWB8_GSU1_GSUAMB_GSUC0_GSUWGMRR0_GLS0_ISA1201_IU1_K1_LBSPPA0_LBSPPB1024_LBSPPM0_LPA0_LPB32_LPM0_LRVW8_LWPMn1_MIAV1_MIWT2_2_MO40_NTn1_NTA0_NTB0_NTC0_NTD0_NTM0_NEPBS0_NLCA2_NLCB1_ONLL0_PGR2_PLR1_PKA0_SIA3_SS1_SU32_SUM1_SUS256_SPO0_SRVW0_SSO0_SVW1_SK0_SKXCCM0_TLDS0_ULSGRO0_USL1_UIOFGRO0_USFGROn1_VSn1_VWA1_VWB2_WSGRA0_WSGRB0_WS32_WG32_4_1_WGM8_WGMXCC1_WGMXCCGn1
    SolutionIndex: 376
    SolutionNameMin: Cijk_Ailk_Bjlk_BSS_BH_Bias_SHB_HA_S_SAB_SCD_SAV_UserArgs_MT64x64x64_MI16x16x1_SN_LDSB0_AFC1_AFEM1_AFEM1_ASEM1_CLR1_CADS0_DTLA0_DTLB0_DTVA1_DTVB0_EPS1_FDSI0_GRPM1_GRVWA8_GRVWB4_GSU1_GSUAMB_GSUC0_GSUWGMRR0_GLS0_ISA1201_IU1_K1_LBSPPA0_LBSPPB1024_LBSPPM0_LPA0_LPB32_LPM0_LRVW8_LWPMn1_MIAV1_MIWT2_2_MO40_NTn1_NTA0_NTB0_NTC0_NTD0_NTM0_NEPBS0_NLCA4_NLCB1_ONLL0_PGR1_PLR1_PKA0_SIA3_SS1_SU32_SUM1_SUS256_SPO0_SRVW0_SSO0_SVW1_SK0_SKXCCM0_TLDS0_ULSGRO0_USL1_UIOFGRO0_USFGROn1_VSn1_VWA1_VWB2_WSGRA0_WSGRB0_WS32_WG32_4_1_WGM8_WGMXCC1_WGMXCCGn1
    SolutionIndex: 377
    SolutionNameMin: Cijk_Ailk_Bjlk_BSS_BH_Bias_SHB_HA_S_SAB_SCD_SAV_UserArgs_MT128x64x16_MI16x16x1_SN_LDSB0_AFC1_AFEM1_AFEM1_ASEM1_CLR1_CADS0_DTLA0_DTLB0_DTVA1_DTVB1_EPS0_FDSI0_GRPM1_GRVWA8_GRVWB8_GSU1_GSUAMB_GSUC0_GSUWGMRR0_GLS0_ISA1201_IU1_K1_LBSPPA0_LBSPPB0_LBSPPM0_LPA0_LPB0_LPM0_LRVW8_LWPMn1_MIAV1_MIWT8_1_MO40_NTn1_NTA0_NTB0_NTC0_NTD0_NTM0_NEPBS0_NLCA1_NLCB1_ONLL0_PGR1_PLR0_PKA0_SIA3_SS0_SU32_SUM1_SUS256_SPO0_SRVW0_SSO0_SVW8_SK0_SKXCCM0_TLDS0_ULSGRO0_USL1_UIOFGRO0_USFGROn1_VSn1_VWA1_VWB1_WSGRA0_WSGRB0_WS32_WG16_8_1_WGM8_WGMXCC1_WGMXCCGn1
    SolutionIndex: 378
    SolutionNameMin: Cijk_Ailk_Bjlk_BSS_BH_Bias_SHB_HA_S_SAB_SCD_SAV_UserArgs_MT64x128x32_MI16x16x1_SN_LDSB0_AFC1_AFEM1_AFEM1_ASEM1_CLR1_CADS0_DTLA0_DTLB0_DTVA0_DTVB1_EPS0_FDSI0_GRPM1_GRVWA8_GRVWB8_GSU1_GSUAMB_GSUC0_GSUWGMRR0_GLS0_ISA1201_IU1_K1_LBSPPA1024_LBSPPB0_LBSPPM0_LPA16_LPB0_LPM0_LRVW8_LWPMn1_MIAV1_MIWT1_8_MO40_NTn1_NTA0_NTB0_NTC0_NTD0_NTM0_NEPBS0_NLCA1_NLCB2_ONLL0_PGR2_PLR1_PKA0_SIA3_SS1_SU32_SUM1_SUS256_SPO0_SRVW0_SSO0_SVW1_SK0_SKXCCM0_TLDS0_ULSGRO0_USL1_UIOFGRO0_USFGROn1_VSn1_VWA1_VWB1_WSGRA0_WSGRB0_WS32_WG64_2_1_WGM8_WGMXCC1_WGMXCCGn1
    SolutionIndex: 379
    SolutionNameMin: Cijk_Ailk_Bjlk_BSS_BH_Bias_SHB_HA_S_SAB_SCD_SAV_UserArgs_MT32x32x16_MI16x16x1_SN_LDSB1_AFC1_AFEM1_AFEM1_ASEM1_CLR1_CADS0_DTLA0_DTLB0_DTVA0_DTVB0_EPS1_FDSI0_GRPM1_GRVWA1_GRVWB1_GSU1_GSUAMB_GSUC0_GSUWGMRR0_GLS0_ISA1201_IU1_K1_LBSPPA512_LBSPPB512_LBSPPM0_LPA16_LPB16_LPM0_LRVW8_LWPMn1_MIAV1_MIWT1_1_MO40_NTn1_NTA0_NTB0_NTC0_NTD0_NTM0_NEPBS0_NLCA1_NLCB1_ONLL0_PGR1_PLR1_PKA0_SIA2_SS0_SU32_SUM1_SUS256_SPO0_SRVW0_SSO0_SVW8_SK0_SKXCCM0_TLDS0_ULSGRO0_USL1_UIOFGRO0_USFGROn1_VSn1_VWA1_VWB1_WSGRA0_WSGRB0_WS32_WG32_4_1_WGM8_WGMXCC1_WGMXCCGn1
    SolutionIndex: 380
    SolutionNameMin: Cijk_Ailk_Bjlk_BSS_BH_Bias_SHB_HA_S_SAB_SCD_SAV_UserArgs_MT128x128x16_MI16x16x1_SN_LDSB1_AFC1_AFEM1_AFEM1_ASEM1_CLR1_CADS0_DTLA0_DTLB0_DTVA0_DTVB0_EPS0_FDSI0_GRPM1_GRVWA1_GRVWB4_GSU1_GSUAMB_GSUC0_GSUWGMRR0_GLS0_ISA1201_IU1_K1_LBSPPA2048_LBSPPB2048_LBSPPM0_LPA0_LPB0_LPM0_LRVW8_LWPMn1_MIAV1_MIWT4_4_MO40_NTn1_NTA0_NTB0_NTC0_NTD0_NTM0_NEPBS0_NLCA1_NLCB1_ONLL0_PGR2_PLR1_PKA0_SIA2_SS1_SU32_SUM1_SUS256_SPO0_SRVW0_SSO0_SVW4_SK0_SKXCCM0_TLDS0_ULSGRO0_USL1_UIOFGRO0_USFGROn1_VSn1_VWA4_VWB4_WSGRA0_WSGRB0_WS32_WG32_4_1_WGM8_WGMXCC1_WGMXCCGn1
    SolutionIndex: 381
    SolutionNameMin: Cijk_Ailk_Bjlk_BSS_BH_Bias_SHB_HA_S_SAB_SCD_SAV_UserArgs_MT128x128x16_MI16x16x1_SN_LDSB1_AFC1_AFEM1_AFEM1_ASEM1_CLR1_CADS0_DTLA0_DTLB0_DTVA0_DTVB0_EPS0_FDSI0_GRPM1_GRVWA4_GRVWB4_GSU1_GSUAMB_GSUC0_GSUWGMRR0_GLS0_ISA1201_IU1_K1_LBSPPA2048_LBSPPB2048_LBSPPM0_LPA0_LPB0_LPM0_LRVW8_LWPMn1_MIAV1_MIWT4_4_MO40_NTn1_NTA0_NTB0_NTC0_NTD0_NTM0_NEPBS0_NLCA1_NLCB1_ONLL0_PGR2_PLR1_PKA0_SIA2_SS1_SU32_SUM1_SUS256_SPO0_SRVW0_SSO0_SVW4_SK0_SKXCCM0_TLDS0_ULSGRO1_USL1_UIOFGRO0_USFGROn1_VSn1_VWA4_VWB4_WSGRA0_WSGRB0_WS32_WG32_4_1_WGM8_WGMXCC1_WGMXCCGn1
    SolutionIndex: 386
    SolutionNameMin: Cijk_Ailk_Bjlk_BSS_BH_Bias_SHB_HA_S_SAB_SCD_SAV_UserArgs_MT128x128x16_MI16x16x1_SN_LDSB0_AFC1_AFEM1_AFEM1_ASEM1_CLR0_CADS0_DTLA0_DTLB0_DTVA0_DTVB0_EPS1_FDSI0_GRPM1_GRVWA4_GRVWB8_GSU1_GSUAMB_GSUC0_GSUWGMRR0_GLS0_ISA1201_IU1_K1_LBSPPA2048_LBSPPB2048_LBSPPM0_LPA0_LPB0_LPM0_LRVW8_LWPMn1_MIAV1_MIWT4_4_MO40_NTn1_NTA0_NTB0_NTC0_NTD0_NTM0_NEPBS0_NLCA1_NLCB1_ONLL0_PGR1_PLR0_PKA0_SIA3_SS1_SU32_SUM1_SUS256_SPO0_SRVW0_SSO0_SVW4_SK0_SKXCCM0_TLDS0_ULSGRO0_USL1_UIOFGRO0_USFGROn1_VSn1_VWA4_VWB4_WSGRA0_WSGRB0_WS32_WG32_4_1_WGM8_WGMXCC1_WGMXCCGn1
    SolutionIndex: 387
    SolutionNameMin: Cijk_Ailk_Bjlk_BSS_BH_Bias_SHB_HA_S_SAB_SCD_SAV_UserArgs_MT128x128x16_MI16x16x1_SN_LDSB1_AFC1_AFEM1_AFEM1_ASEM1_CLR1_CADS0_DTLA0_DTLB0_DTVA0_DTVB0_EPS0_FDSI0_GRPM1_GRVWA1_GRVWB1_GSU1_GSUAMB_GSUC0_GSUWGMRR0_GLS0_ISA1201_IU1_K1_LBSPPA2048_LBSPPB2048_LBSPPM0_LPA0_LPB0_LPM0_LRVW8_LWPMn1_MIAV1_MIWT4_4_MO40_NTn1_NTA0_NTB0_NTC0_NTD0_NTM0_NEPBS0_NLCA1_NLCB1_ONLL0_PGR2_PLR1_PKA0_SIA2_SS1_SU32_SUM1_SUS256_SPO0_SRVW0_SSO0_SVW4_SK0_SKXCCM0_TLDS0_ULSGRO0_USL1_UIOFGRO0_USFGROn1_VSn1_VWA4_VWB4_WSGRA0_WSGRB0_WS32_WG32_4_1_WGM8_WGMXCC1_WGMXCCGn1
    SolutionIndex: 388
    SolutionNameMin: Cijk_Ailk_Bjlk_BSS_BH_Bias_SHB_HA_S_SAB_SCD_SAV_UserArgs_MT128x128x16_MI16x16x1_SN_LDSB0_AFC1_AFEM1_AFEM1_ASEM1_CLR0_CADS0_DTLA0_DTLB0_DTVA0_DTVB0_EPS1_FDSI0_GRPM1_GRVWA8_GRVWB8_GSU1_GSUAMB_GSUC0_GSUWGMRR0_GLS0_ISA1201_IU1_K1_LBSPPA2048_LBSPPB2048_LBSPPM0_LPA0_LPB0_LPM0_LRVW8_LWPMn1_MIAV1_MIWT4_4_MO40_NTn1_NTA0_NTB0_NTC0_NTD0_NTM0_NEPBS0_NLCA1_NLCB1_ONLL0_PGR1_PLR0_PKA0_SIA3_SS1_SU32_SUM1_SUS256_SPO0_SRVW0_SSO0_SVW4_SK0_SKXCCM0_TLDS0_ULSGRO0_USL1_UIOFGRO0_USFGROn1_VSn1_VWA4_VWB4_WSGRA0_WSGRB0_WS32_WG32_4_1_WGM8_WGMXCC1_WGMXCCGn1
    SolutionIndex: 389
    SolutionNameMin: Cijk_Ailk_Bjlk_BSS_BH_Bias_SHB_HA_S_SAB_SCD_SAV_UserArgs_MT128x128x16_MI16x16x1_SN_LDSB1_AFC1_AFEM1_AFEM1_ASEM1_CLR1_CADS0_DTLA0_DTLB0_DTVA0_DTVB0_EPS0_FDSI0_GRPM1_GRVWA4_GRVWB8_GSU1_GSUAMB_GSUC0_GSUWGMRR0_GLS0_ISA1201_IU1_K1_LBSPPA2048_LBSPPB2048_LBSPPM0_LPA0_LPB0_LPM0_LRVW8_LWPMn1_MIAV1_MIWT4_4_MO40_NTn1_NTA0_NTB0_NTC0_NTD0_NTM0_NEPBS0_NLCA1_NLCB1_ONLL0_PGR2_PLR1_PKA0_SIA2_SS1_SU32_SUM1_SUS256_SPO0_SRVW0_SSO0_SVW4_SK0_SKXCCM0_TLDS0_ULSGRO0_USL1_UIOFGRO0_USFGROn1_VSn1_VWA4_VWB4_WSGRA0_WSGRB0_WS32_WG32_4_1_WGM8_WGMXCC1_WGMXCCGn1
    SolutionIndex: 390
    SolutionNameMin: Cijk_Ailk_Bjlk_BSS_BH_Bias_SHB_HA_S_SAB_SCD_SAV_UserArgs_MT128x128x16_MI16x16x1_SN_LDSB0_AFC1_AFEM1_AFEM1_ASEM1_CLR0_CADS0_DTLA0_DTLB0_DTVA0_DTVB0_EPS0_FDSI0_GRPM1_GRVWA8_GRVWB8_GSU1_GSUAMB_GSUC0_GSUWGMRR0_GLS0_ISA1201_IU1_K1_LBSPPA2048_LBSPPB2048_LBSPPM0_LPA0_LPB0_LPM0_LRVW8_LWPMn1_MIAV1_MIWT4_4_MO40_NTn1_NTA0_NTB0_NTC0_NTD0_NTM0_NEPBS0_NLCA1_NLCB1_ONLL0_PGR2_PLR0_PKA0_SIA3_SS1_SU32_SUM1_SUS256_SPO0_SRVW0_SSO0_SVW4_SK0_SKXCCM0_TLDS0_ULSGRO0_USL1_UIOFGRO0_USFGROn1_VSn1_VWA4_VWB4_WSGRA0_WSGRB0_WS32_WG32_4_1_WGM8_WGMXCC1_WGMXCCGn1
    SolutionIndex: 392
    SolutionNameMin: Cijk_Ailk_Bjlk_BSS_BH_Bias_SHB_HA_S_SAB_SCD_SAV_UserArgs_MT128x128x16_MI16x16x1_SN_LDSB0_AFC1_AFEM1_AFEM1_ASEM1_CLR1_CADS0_DTLA0_DTLB0_DTVA1_DTVB1_EPS0_FDSI0_GRPM1_GRVWA8_GRVWB8_GSU1_GSUAMB_GSUC0_GSUWGMRR0_GLS0_ISA1201_IU1_K1_LBSPPA0_LBSPPB0_LBSPPM0_LPA0_LPB0_LPM0_LRVW8_LWPMn1_MIAV1_MIWT8_2_MO40_NTn1_NTA0_NTB0_NTC0_NTD0_NTM0_NEPBS0_NLCA1_NLCB1_ONLL0_PGR1_PLR0_PKA0_SIA3_SS1_SU32_SUM1_SUS256_SPO0_SRVW0_SSO0_SVW1_SK0_SKXCCM0_TLDS0_ULSGRO0_USL1_UIOFGRO0_USFGROn1_VSn1_VWA1_VWB1_WSGRA0_WSGRB0_WS32_WG16_8_1_WGM8_WGMXCC1_WGMXCCGn1
    SolutionIndex: 393
    SolutionNameMin: Cijk_Ailk_Bjlk_BSS_BH_Bias_SHB_HA_S_SAB_SCD_SAV_UserArgs_MT128x64x32_MI16x16x1_SN_LDSB0_AFC1_AFEM1_AFEM1_ASEM1_CLR1_CADS0_DTLA0_DTLB0_DTVA1_DTVB0_EPS1_FDSI0_GRPM1_GRVWA8_GRVWB4_GSU1_GSUAMB_GSUC0_GSUWGMRR0_GLS0_ISA1201_IU1_K1_LBSPPA0_LBSPPB1024_LBSPPM0_LPA0_LPB16_LPM0_LRVW8_LWPMn1_MIAV1_MIWT8_1_MO40_NTn1_NTA0_NTB0_NTC0_NTD0_NTM0_NEPBS0_NLCA2_NLCB1_ONLL0_PGR1_PLR1_PKA0_SIA3_SS1_SU32_SUM1_SUS256_SPO0_SRVW0_SSO0_SVW1_SK0_SKXCCM0_TLDS0_ULSGRO0_USL1_UIOFGRO0_USFGROn1_VSn1_VWA1_VWB1_WSGRA0_WSGRB0_WS32_WG16_8_1_WGM8_WGMXCC1_WGMXCCGn1
    SolutionIndex: 398
    SolutionNameMin: Cijk_Ailk_Bjlk_BSS_BH_Bias_SHB_HA_S_SAB_SCD_SAV_UserArgs_MT128x128x16_MI16x16x1_SN_LDSB0_AFC1_AFEM1_AFEM1_ASEM1_CLR0_CADS0_DTLA0_DTLB0_DTVA0_DTVB0_EPS0_FDSI0_GRPM1_GRVWA8_GRVWB8_GSU1_GSUAMB_GSUC0_GSUWGMRR0_GLS0_ISA1201_IU1_K1_LBSPPA2048_LBSPPB2048_LBSPPM0_LPA0_LPB0_LPM0_LRVW8_LWPMn1_MIAV1_MIWT4_4_MO40_NTn1_NTA0_NTB0_NTC0_NTD0_NTM0_NEPBS0_NLCA1_NLCB1_ONLL0_PGR2_PLR0_PKA0_SIA3_SS1_SU32_SUM1_SUS256_SPO0_SRVW0_SSO0_SVW4_SK0_SKXCCM0_TLDS0_ULSGRO1_USL1_UIOFGRO0_USFGROn1_VSn1_VWA4_VWB4_WSGRA0_WSGRB0_WS32_WG32_4_1_WGM8_WGMXCC1_WGMXCCGn1
    SolutionIndex: 400
    SolutionNameMin: Cijk_Ailk_Bjlk_BSS_BH_Bias_SHB_HA_S_SAB_SCD_SAV_UserArgs_MT128x128x16_MI16x16x1_SN_LDSB0_AFC1_AFEM1_AFEM1_ASEM1_CLR0_CADS0_DTLA0_DTLB0_DTVA0_DTVB0_EPS0_FDSI0_GRPM1_GRVWA8_GRVWB4_GSU1_GSUAMB_GSUC0_GSUWGMRR0_GLS0_ISA1201_IU1_K1_LBSPPA2048_LBSPPB2048_LBSPPM0_LPA0_LPB0_LPM0_LRVW8_LWPMn1_MIAV1_MIWT4_4_MO40_NTn1_NTA0_NTB0_NTC0_NTD0_NTM0_NEPBS0_NLCA1_NLCB1_ONLL0_PGR2_PLR0_PKA0_SIA3_SS1_SU32_SUM1_SUS256_SPO0_SRVW0_SSO0_SVW4_SK0_SKXCCM0_TLDS0_ULSGRO0_USL1_UIOFGRO0_USFGROn1_VSn1_VWA4_VWB4_WSGRA0_WSGRB0_WS32_WG32_4_1_WGM8_WGMXCC1_WGMXCCGn1
    SolutionIndex: 406
    SolutionNameMin: Cijk_Ailk_Bjlk_BSS_BH_Bias_SHB_HA_S_SAB_SCD_SAV_UserArgs_MT64x128x16_MI16x16x1_SN_LDSB0_AFC1_AFEM1_AFEM1_ASEM1_CLR0_CADS0_DTLA0_DTLB0_DTVA0_DTVB0_EPS0_FDSI0_GRPM1_GRVWA4_GRVWB8_GSU1_GSUAMB_GSUC0_GSUWGMRR0_GLS0_ISA1201_IU1_K1_LBSPPA1024_LBSPPB2048_LBSPPM0_LPA16_LPB0_LPM0_LRVW8_LWPMn1_MIAV1_MIWT1_8_MO40_NTn1_NTA0_NTB0_NTC0_NTD0_NTM0_NEPBS0_NLCA1_NLCB1_ONLL0_PGR2_PLR0_PKA0_SIA3_SS0_SU32_SUM1_SUS256_SPO0_SRVW0_SSO0_SVW8_SK0_SKXCCM0_TLDS0_ULSGRO0_USL1_UIOFGRO0_USFGROn1_VSn1_VWA1_VWB8_WSGRA0_WSGRB0_WS32_WG64_2_1_WGM8_WGMXCC1_WGMXCCGn1
    SolutionIndex: 409
    SolutionNameMin: Cijk_Ailk_Bjlk_BSS_BH_Bias_SHB_HA_S_SAB_SCD_SAV_UserArgs_MT128x128x16_MI16x16x1_SN_LDSB1_AFC1_AFEM1_AFEM1_ASEM1_CLR1_CADS0_DTLA0_DTLB0_DTVA0_DTVB0_EPS0_FDSI0_GRPM1_GRVWA8_GRVWB1_GSU1_GSUAMB_GSUC0_GSUWGMRR0_GLS0_ISA1201_IU1_K1_LBSPPA2048_LBSPPB2048_LBSPPM0_LPA0_LPB0_LPM0_LRVW8_LWPMn1_MIAV1_MIWT4_4_MO40_NTn1_NTA0_NTB0_NTC0_NTD0_NTM0_NEPBS0_NLCA1_NLCB1_ONLL0_PGR2_PLR1_PKA0_SIA2_SS1_SU32_SUM1_SUS256_SPO0_SRVW0_SSO0_SVW4_SK0_SKXCCM0_TLDS0_ULSGRO0_USL1_UIOFGRO0_USFGROn1_VSn1_VWA4_VWB4_WSGRA0_WSGRB0_WS32_WG32_4_1_WGM8_WGMXCC1_WGMXCCGn1
    SolutionIndex: 410
    SolutionNameMin: Cijk_Ailk_Bjlk_BSS_BH_Bias_SHB_HA_S_SAB_SCD_SAV_UserArgs_MT128x64x32_MI16x16x1_SN_LDSB0_AFC1_AFEM1_AFEM1_ASEM1_CLR1_CADS0_DTLA0_DTLB0_DTVA1_DTVB0_EPS0_FDSI0_GRPM1_GRVWA8_GRVWB8_GSU1_GSUAMB_GSUC0_GSUWGMRR0_GLS0_ISA1201_IU1_K1_LBSPPA0_LBSPPB1024_LBSPPM0_LPA0_LPB16_LPM0_LRVW8_LWPMn1_MIAV1_MIWT8_1_MO40_NTn1_NTA0_NTB0_NTC0_NTD0_NTM0_NEPBS0_NLCA2_NLCB1_ONLL0_PGR2_PLR1_PKA0_SIA3_SS0_SU32_SUM1_SUS256_SPO0_SRVW0_SSO0_SVW8_SK0_SKXCCM0_TLDS0_ULSGRO0_USL1_UIOFGRO0_USFGROn1_VSn1_VWA1_VWB1_WSGRA0_WSGRB0_WS32_WG16_8_1_WGM8_WGMXCC1_WGMXCCGn1
    SolutionIndex: 413
    SolutionNameMin: Cijk_Ailk_Bjlk_BSS_BH_Bias_SHB_HA_S_SAB_SCD_SAV_UserArgs_MT64x64x32_MI16x16x1_SN_LDSB0_AFC1_AFEM1_AFEM1_ASEM1_CLR1_CADS0_DTLA0_DTLB0_DTVA1_DTVB0_EPS1_FDSI0_GRPM1_GRVWA8_GRVWB8_GSU1_GSUAMB_GSUC0_GSUWGMRR0_GLS0_ISA1201_IU1_K1_LBSPPA0_LBSPPB1024_LBSPPM0_LPA0_LPB32_LPM0_LRVW8_LWPMn1_MIAV1_MIWT2_2_MO40_NTn1_NTA0_NTB0_NTC0_NTD0_NTM0_NEPBS0_NLCA2_NLCB1_ONLL0_PGR1_PLR1_PKA0_SIA3_SS0_SU32_SUM1_SUS256_SPO0_SRVW0_SSO0_SVW8_SK0_SKXCCM0_TLDS0_ULSGRO0_USL1_UIOFGRO0_USFGROn1_VSn1_VWA1_VWB2_WSGRA0_WSGRB0_WS32_WG32_4_1_WGM8_WGMXCC1_WGMXCCGn1
    SolutionIndex: 415
    SolutionNameMin: Cijk_Ailk_Bjlk_BSS_BH_Bias_SHB_HA_S_SAB_SCD_SAV_UserArgs_MT64x64x64_MI16x16x1_SN_LDSB1_AFC1_AFEM1_AFEM1_ASEM1_CLR1_CADS0_DTLA0_DTLB0_DTVA0_DTVB0_EPS0_FDSI0_GRPM1_GRVWA8_GRVWB4_GSU1_GSUAMB_GSUC0_GSUWGMRR0_GLS0_ISA1201_IU4_K1_LBSPPA1024_LBSPPB1024_LBSPPM0_LPA32_LPB32_LPM0_LRVW8_LWPMn1_MIAV1_MIWT2_2_MO40_NTn1_NTA0_NTB0_NTC0_NTD0_NTM0_NEPBS0_NLCA1_NLCB1_ONLL0_PGR2_PLR1_PKA0_SIA2_SS1_SU32_SUM1_SUS256_SPO0_SRVW0_SSO0_SVW2_SK0_SKXCCM0_TLDS0_ULSGRO0_USL1_UIOFGRO0_USFGROn1_VSn1_VWA2_VWB2_WSGRA0_WSGRB0_WS32_WG32_4_1_WGM8_WGMXCC1_WGMXCCGn1
    SolutionIndex: 416
    SolutionNameMin: Cijk_Ailk_Bjlk_BSS_BH_Bias_SHB_HA_S_SAB_SCD_SAV_UserArgs_MT32x128x16_MI16x16x1_SN_LDSB0_AFC1_AFEM1_AFEM1_ASEM1_CLR1_CADS0_DTLA0_DTLB0_DTVA1_DTVB1_EPS0_FDSI0_GRPM1_GRVWA8_GRVWB8_GSU1_GSUAMB_GSUC0_GSUWGMRR0_GLS0_ISA1201_IU1_K1_LBSPPA0_LBSPPB0_LBSPPM0_LPA0_LPB0_LPM0_LRVW8_LWPMn1_MIAV1_MIWT1_4_MO40_NTn1_NTA0_NTB0_NTC0_NTD0_NTM0_NEPBS0_NLCA1_NLCB1_ONLL0_PGR1_PLR0_PKA0_SIA3_SS0_SU32_SUM1_SUS256_SPO0_SRVW0_SSO0_SVW8_SK0_SKXCCM0_TLDS0_ULSGRO0_USL1_UIOFGRO0_USFGROn1_VSn1_VWA1_VWB1_WSGRA0_WSGRB0_WS32_WG32_4_1_WGM8_WGMXCC1_WGMXCCGn1
    SolutionIndex: 417
    SolutionNameMin: Cijk_Ailk_Bjlk_BSS_BH_Bias_SHB_HA_S_SAB_SCD_SAV_UserArgs_MT64x64x16_MI16x16x1_SN_LDSB1_AFC1_AFEM1_AFEM1_ASEM1_CLR1_CADS0_DTLA0_DTLB0_DTVA0_DTVB0_EPS0_FDSI0_GRPM1_GRVWA1_GRVWB4_GSU1_GSUAMB_GSUC0_GSUWGMRR0_GLS0_ISA1201_IU1_K1_LBSPPA1024_LBSPPB1024_LBSPPM0_LPA32_LPB32_LPM0_LRVW8_LWPMn1_MIAV1_MIWT2_2_MO40_NTn1_NTA0_NTB0_NTC0_NTD0_NTM0_NEPBS0_NLCA1_NLCB1_ONLL0_PGR2_PLR1_PKA0_SIA2_SS1_SU32_SUM1_SUS256_SPO0_SRVW0_SSO0_SVW2_SK0_SKXCCM0_TLDS0_ULSGRO0_USL1_UIOFGRO0_USFGROn1_VSn1_VWA2_VWB2_WSGRA0_WSGRB0_WS32_WG32_4_1_WGM8_WGMXCC1_WGMXCCGn1
    SolutionIndex: 418
    SolutionNameMin: Cijk_Ailk_Bjlk_BSS_BH_Bias_SHB_HA_S_SAB_SCD_SAV_UserArgs_MT64x128x16_MI16x16x1_SN_LDSB0_AFC1_AFEM1_AFEM1_ASEM1_CLR0_CADS0_DTLA0_DTLB0_DTVA0_DTVB0_EPS0_FDSI0_GRPM1_GRVWA4_GRVWB4_GSU1_GSUAMB_GSUC0_GSUWGMRR0_GLS0_ISA1201_IU1_K1_LBSPPA1024_LBSPPB2048_LBSPPM0_LPA16_LPB0_LPM0_LRVW8_LWPMn1_MIAV1_MIWT1_8_MO40_NTn1_NTA0_NTB0_NTC0_NTD0_NTM0_NEPBS0_NLCA1_NLCB1_ONLL0_PGR2_PLR0_PKA0_SIA3_SS0_SU32_SUM1_SUS256_SPO0_SRVW0_SSO0_SVW8_SK0_SKXCCM0_TLDS0_ULSGRO1_USL1_UIOFGRO0_USFGROn1_VSn1_VWA1_VWB8_WSGRA0_WSGRB0_WS32_WG64_2_1_WGM8_WGMXCC1_WGMXCCGn1
    SolutionIndex: 419
    SolutionNameMin: Cijk_Ailk_Bjlk_BSS_BH_Bias_SHB_HA_S_SAB_SCD_SAV_UserArgs_MT64x64x32_MI16x16x1_SN_LDSB1_AFC1_AFEM1_AFEM1_ASEM1_CLR1_CADS0_DTLA0_DTLB0_DTVA0_DTVB0_EPS0_FDSI0_GRPM1_GRVWA8_GRVWB1_GSU1_GSUAMB_GSUC0_GSUWGMRR0_GLS0_ISA1201_IU2_K1_LBSPPA1024_LBSPPB1024_LBSPPM0_LPA32_LPB32_LPM0_LRVW8_LWPMn1_MIAV1_MIWT2_2_MO40_NTn1_NTA0_NTB0_NTC0_NTD0_NTM0_NEPBS0_NLCA1_NLCB1_ONLL0_PGR2_PLR1_PKA0_SIA2_SS1_SU32_SUM1_SUS256_SPO0_SRVW0_SSO0_SVW2_SK0_SKXCCM0_TLDS0_ULSGRO0_USL1_UIOFGRO0_USFGROn1_VSn1_VWA2_VWB2_WSGRA0_WSGRB0_WS32_WG32_4_1_WGM8_WGMXCC1_WGMXCCGn1
    SolutionIndex: 420
    SolutionNameMin: Cijk_Ailk_Bjlk_BSS_BH_Bias_SHB_HA_S_SAB_SCD_SAV_UserArgs_MT64x128x16_MI16x16x1_SN_LDSB0_AFC1_AFEM1_AFEM1_ASEM1_CLR0_CADS0_DTLA0_DTLB0_DTVA0_DTVB0_EPS0_FDSI0_GRPM1_GRVWA4_GRVWB4_GSU1_GSUAMB_GSUC0_GSUWGMRR0_GLS0_ISA1201_IU1_K1_LBSPPA1024_LBSPPB2048_LBSPPM0_LPA16_LPB0_LPM0_LRVW8_LWPMn1_MIAV1_MIWT1_8_MO40_NTn1_NTA0_NTB0_NTC0_NTD0_NTM0_NEPBS0_NLCA1_NLCB1_ONLL0_PGR2_PLR0_PKA0_SIA3_SS0_SU32_SUM1_SUS256_SPO0_SRVW0_SSO0_SVW8_SK0_SKXCCM0_TLDS0_ULSGRO0_USL1_UIOFGRO0_USFGROn1_VSn1_VWA1_VWB8_WSGRA0_WSGRB0_WS32_WG64_2_1_WGM8_WGMXCC1_WGMXCCGn1
    SolutionIndex: 421
    SolutionNameMin: Cijk_Ailk_Bjlk_BSS_BH_Bias_SHB_HA_S_SAB_SCD_SAV_UserArgs_MT64x64x32_MI16x16x1_SN_LDSB1_AFC1_AFEM1_AFEM1_ASEM1_CLR1_CADS0_DTLA0_DTLB0_DTVA0_DTVB0_EPS0_FDSI0_GRPM1_GRVWA1_GRVWB4_GSU1_GSUAMB_GSUC0_GSUWGMRR0_GLS0_ISA1201_IU2_K1_LBSPPA1024_LBSPPB1024_LBSPPM0_LPA32_LPB32_LPM0_LRVW8_LWPMn1_MIAV1_MIWT2_2_MO40_NTn1_NTA0_NTB0_NTC0_NTD0_NTM0_NEPBS0_NLCA1_NLCB1_ONLL0_PGR2_PLR1_PKA0_SIA2_SS1_SU32_SUM1_SUS256_SPO0_SRVW0_SSO0_SVW2_SK0_SKXCCM0_TLDS0_ULSGRO0_USL1_UIOFGRO0_USFGROn1_VSn1_VWA2_VWB2_WSGRA0_WSGRB0_WS32_WG32_4_1_WGM8_WGMXCC1_WGMXCCGn1
- - - [512, 512, 1, 64]
    - [203, 1.55]
  - - [1024, 512, 1, 64]
    - [179, 2.91]
  - - [1536, 512, 1, 64]
    - [6, 2764.79]
  - - [2048, 512, 1, 64]
    - [15, 3519.82]
  - - [2560, 512, 1, 64]
    - [7, 4377.96]
  - - [3072, 512, 1, 64]
    - [5, 5057.82]
  - - [512, 1024, 1, 64]
    - [183, 2.87]
  - - [1024, 1024, 1, 64]
    - [257, 4.93]
  - - [1536, 1024, 1, 64]
    - [256, 6.69]
  - - [2048, 1024, 1, 64]
    - [246, 7.87]
  - - [2560, 1024, 1, 64]
    - [4, 7148.67]
  - - [3072, 1024, 1, 64]
    - [4, 7922.19]
  - - [512, 1536, 1, 64]
    - [4, 2895.54]
  - - [1024, 1536, 1, 64]
    - [232, 7.0]
  - - [1536, 1536, 1, 64]
    - [244, 8.17]
  - - [2048, 1536, 1, 64]
    - [238, 9.52]
  - - [2560, 1536, 1, 64]
    - [7, 9019.2]
  - - [3072, 1536, 1, 64]
    - [5, 9848.67]
  - - [512, 2048, 1, 64]
    - [4, 3739.91]
  - - [1024, 2048, 1, 64]
    - [244, 7.94]
  - - [1536, 2048, 1, 64]
    - [254, 9.17]
  - - [2048, 2048, 1, 64]
    - [386, 11.18]
  - - [2560, 2048, 1, 64]
    - [2, 10608.8]
  - - [3072, 2048, 1, 64]
    - [4, 12018.4]
  - - [512, 2560, 1, 64]
    - [5, 4229.73]
  - - [1024, 2560, 1, 64]
    - [4, 7224.09]
  - - [1536, 2560, 1, 64]
    - [5, 8998.24]
  - - [2048, 2560, 1, 64]
    - [1, 10791.5]
  - - [2560, 2560, 1, 64]
    - [5, 12205.3]
  - - [3072, 2560, 1, 64]
    - [3, 12526.4]
  - - [512, 3072, 1, 64]
    - [17, 3995.76]
  - - [1024, 3072, 1, 64]
    - [7, 7679.97]
  - - [1536, 3072, 1, 64]
    - [1, 10270.0]
  - - [2048, 3072, 1, 64]
    - [4, 11815.3]
  - - [2560, 3072, 1, 64]
    - [5, 12965.9]
  - - [3072, 3072, 1, 64]
    - [7, 13879.2]
  - - [512, 512, 1, 256]
    - [207, 5.5]
  - - [1024, 512, 1, 256]
    - [165, 9.48]
  - - [1536, 512, 1, 256]
    - [6, 8778.71]
  - - [2048, 512, 1, 256]
    - [4, 10953.9]
  - - [2560, 512, 1, 256]
    - [15, 12527.3]
  - - [3072, 512, 1, 256]
    - [0, 9610.21]
  - - [512, 1024, 1, 256]
    - [281, 9.65]
  - - [1024, 1024, 1, 256]
    - [242, 15.43]
  - - [1536, 1024, 1, 256]
    - [409, 18.84]
  - - [2048, 1024, 1, 256]
    - [257, 21.47]
  - - [2560, 1024, 1, 256]
    - [4, 18361.3]
  - - [3072, 1024, 1, 256]
    - [13, 19686.5]
  - - [512, 1536, 1, 256]
    - [4, 8780.82]
  - - [1024, 1536, 1, 256]
    - [232, 19.13]
  - - [1536, 1536, 1, 256]
    - [232, 20.99]
  - - [2048, 1536, 1, 256]
    - [388, 24.28]
  - - [2560, 1536, 1, 256]
    - [4, 21248.4]
  - - [3072, 1536, 1, 256]
    - [4, 22807.0]
  - - [512, 2048, 1, 256]
    - [14, 7492.55]
  - - [1024, 2048, 1, 256]
    - [305, 21.52]
  - - [1536, 2048, 1, 256]
    - [390, 24.09]
  - - [2048, 2048, 1, 256]
    - [381, 27.0]
  - - [2560, 2048, 1, 256]
    - [4, 23864.7]
  - - [3072, 2048, 1, 256]
    - [4, 25187.5]
  - - [512, 2560, 1, 256]
    - [4, 12600.2]
  - - [1024, 2560, 1, 256]
    - [15, 18341.3]
  - - [1536, 2560, 1, 256]
    - [4, 21642.2]
  - - [2048, 2560, 1, 256]
    - [4, 23746.5]
  - - [2560, 2560, 1, 256]
    - [4, 25374.1]
  - - [3072, 2560, 1, 256]
    - [4, 26900.8]
  - - [512, 3072, 1, 256]
    - [13, 14040.0]
  - - [1024, 3072, 1, 256]
    - [4, 20017.3]
  - - [1536, 3072, 1, 256]
    - [4, 22886.9]
  - - [2048, 3072, 1, 256]
    - [4, 25132.2]
  - - [2560, 3072, 1, 256]
    - [0, 26647.4]
  - - [3072, 3072, 1, 256]
    - [15, 27327.5]
  - - [512, 512, 1, 512]
    - [281, 9.18]
  - - [1024, 512, 1, 512]
    - [207, 15.52]
  - - [1536, 512, 1, 512]
    - [15, 14221.5]
  - - [2048, 512, 1, 512]
    - [13, 17068.4]
  - - [2560, 512, 1, 512]
    - [15, 18650.2]
  - - [3072, 512, 1, 512]
    - [4, 20663.2]
  - - [512, 1024, 1, 512]
    - [237, 15.7]
  - - [1024, 1024, 1, 512]
    - [246, 24.43]
  - - [1536, 1024, 1, 512]
    - [4, 20655.0]
  - - [2048, 1024, 1, 512]
    - [15, 22773.6]
  - - [2560, 1024, 1, 512]
    - [13, 24229.7]
  - - [3072, 1024, 1, 512]
    - [15, 25706.9]
  - - [512, 1536, 1, 512]
    - [4, 14320.4]
  - - [1024, 1536, 1, 512]
    - [4, 20400.7]
  - - [1536, 1536, 1, 512]
    - [4, 23523.4]
  - - [2048, 1536, 1, 512]
    - [13, 26308.4]
  - - [2560, 1536, 1, 512]
    - [15, 27021.9]
  - - [3072, 1536, 1, 512]
    - [4, 29369.5]
  - - [512, 2048, 1, 512]
    - [4, 16680.5]
  - - [1024, 2048, 1, 512]
    - [15, 22463.2]
  - - [1536, 2048, 1, 512]
    - [13, 25764.7]
  - - [2048, 2048, 1, 512]
    - [4, 27882.2]
  - - [2560, 2048, 1, 512]
    - [4, 29294.8]
  - - [3072, 2048, 1, 512]
    - [13, 30521.8]
  - - [512, 2560, 1, 512]
    - [15, 18251.5]
  - - [1024, 2560, 1, 512]
    - [13, 19232.6]
  - - [1536, 2560, 1, 512]
    - [13, 27498.9]
  - - [2048, 2560, 1, 512]
    - [15, 29866.3]
  - - [2560, 2560, 1, 512]
    - [15, 30820.6]
  - - [3072, 2560, 1, 512]
    - [4, 32075.9]
  - - [512, 3072, 1, 512]
    - [17, 15962.5]
  - - [1024, 3072, 1, 512]
    - [13, 25657.7]
  - - [1536, 3072, 1, 512]
    - [13, 28584.3]
  - - [2048, 3072, 1, 512]
    - [4, 30594.4]
  - - [2560, 3072, 1, 512]
    - [0, 30950.8]
  - - [3072, 3072, 1, 512]
    - [13, 32420.7]
  - - [512, 512, 1, 1024]
    - [207, 15.4]
  - - [1024, 512, 1, 1024]
    - [207, 23.2]
  - - [1536, 512, 1, 1024]
    - [4, 20059.7]
  - - [2048, 512, 1, 1024]
    - [15, 22638.7]
  - - [2560, 512, 1, 1024]
    - [16, 23365.2]
  - - [3072, 512, 1, 1024]
    - [4, 26126.8]
  - - [512, 1024, 1, 1024]
    - [326, 23.13]
  - - [1024, 1024, 1, 1024]
    - [242, 32.7]
  - - [1536, 1024, 1, 1024]
    - [232, 36.64]
  - - [2048, 1024, 1, 1024]
    - [380, 37.74]
  - - [2560, 1024, 1, 1024]
    - [4, 29343.0]
  - - [3072, 1024, 1, 1024]
    - [15, 30870.5]
  - - [512, 1536, 1, 1024]
    - [15, 19795.4]
  - - [1024, 1536, 1, 1024]
    - [232, 37.12]
  - - [1536, 1536, 1, 1024]
    - [242, 36.54]
  - - [2048, 1536, 1, 1024]
    - [390, 38.71]
  - - [2560, 1536, 1, 1024]
    - [15, 32041.5]
  - - [3072, 1536, 1, 1024]
    - [4, 32160.4]
  - - [512, 2048, 1, 1024]
    - [15, 23000.9]
  - - [1024, 2048, 1, 1024]
    - [387, 37.92]
  - - [1536, 2048, 1, 1024]
    - [388, 38.64]
  - - [2048, 2048, 1, 1024]
    - [232, 41.55]
  - - [2560, 2048, 1, 1024]
    - [0, 33207.0]
  - - [3072, 2048, 1, 1024]
    - [0, 34410.8]
  - - [512, 2560, 1, 1024]
    - [15, 19293.7]
  - - [1024, 2560, 1, 1024]
    - [16, 28586.9]
  - - [1536, 2560, 1, 1024]
    - [4, 31516.4]
  - - [2048, 2560, 1, 1024]
    - [4, 32695.5]
  - - [2560, 2560, 1, 1024]
    - [13, 33584.5]
  - - [3072, 2560, 1, 1024]
    - [4, 34444.3]
  - - [512, 3072, 1, 1024]
    - [4, 26250.5]
  - - [1024, 3072, 1, 1024]
    - [13, 30288.9]
  - - [1536, 3072, 1, 1024]
    - [15, 32653.5]
  - - [2048, 3072, 1, 1024]
    - [15, 34049.1]
  - - [2560, 3072, 1, 1024]
    - [13, 34721.0]
  - - [3072, 3072, 1, 1024]
    - [4, 34981.8]
  - - [512, 512, 1, 2048]
    - [281, 23.01]
  - - [1024, 512, 1, 2048]
    - [341, 32.53]
  - - [1536, 512, 1, 2048]
    - [15, 24494.7]
  - - [2048, 512, 1, 2048]
    - [4, 27958.6]
  - - [2560, 512, 1, 2048]
    - [13, 28495.7]
  - - [3072, 512, 1, 2048]
    - [15, 29965.7]
  - - [512, 1024, 1, 2048]
    - [326, 31.49]
  - - [1024, 1024, 1, 2048]
    - [327, 41.69]
  - - [1536, 1024, 1, 2048]
    - [15, 30559.4]
  - - [2048, 1024, 1, 2048]
    - [15, 31352.9]
  - - [2560, 1024, 1, 2048]
    - [13, 32903.2]
  - - [3072, 1024, 1, 2048]
    - [15, 34230.3]
  - - [512, 1536, 1, 2048]
    - [15, 24394.2]
  - - [1024, 1536, 1, 2048]
    - [4, 29957.4]
  - - [1536, 1536, 1, 2048]
    - [4, 32132.4]
  - - [2048, 1536, 1, 2048]
    - [4, 32967.6]
  - - [2560, 1536, 1, 2048]
    - [15, 34108.8]
  - - [3072, 1536, 1, 2048]
    - [4, 35303.1]
  - - [512, 2048, 1, 2048]
    - [15, 27543.7]
  - - [1024, 2048, 1, 2048]
    - [15, 31852.7]
  - - [1536, 2048, 1, 2048]
    - [4, 33429.5]
  - - [2048, 2048, 1, 2048]
    - [255, 46.02]
  - - [2560, 2048, 1, 2048]
    - [15, 35012.8]
  - - [3072, 2048, 1, 2048]
    - [4, 34927.5]
  - - [512, 2560, 1, 2048]
    - [15, 28473.1]
  - - [1024, 2560, 1, 2048]
    - [13, 32443.1]
  - - [1536, 2560, 1, 2048]
    - [15, 33703.4]
  - - [2048, 2560, 1, 2048]
    - [15, 34952.8]
  - - [2560, 2560, 1, 2048]
    - [15, 35427.5]
  - - [3072, 2560, 1, 2048]
    - [15, 35568.4]
  - - [512, 3072, 1, 2048]
    - [0, 30643.9]
  - - [1024, 3072, 1, 2048]
    - [4, 33135.0]
  - - [1536, 3072, 1, 2048]
    - [15, 35086.0]
  - - [2048, 3072, 1, 2048]
    - [13, 35286.5]
  - - [2560, 3072, 1, 2048]
    - [4, 35540.8]
  - - [3072, 3072, 1, 2048]
    - [15, 35994.4]
  - - [512, 512, 1, 3072]
    - [9, 17907.8]
  - - [1024, 512, 1, 3072]
    - [13, 25523.4]
  - - [1536, 512, 1, 3072]
    - [15, 26395.7]
  - - [2048, 512, 1, 3072]
    - [13, 29236.7]
  - - [2560, 512, 1, 3072]
    - [4, 30260.9]
  - - [3072, 512, 1, 3072]
    - [15, 31219.3]
  - - [512, 1024, 1, 3072]
    - [2, 24676.9]
  - - [1024, 1024, 1, 3072]
    - [15, 29555.2]
  - - [1536, 1024, 1, 3072]
    - [4, 31553.2]
  - - [2048, 1024, 1, 3072]
    - [4, 32571.0]
  - - [2560, 1024, 1, 3072]
    - [13, 33635.7]
  - - [3072, 1024, 1, 3072]
    - [0, 34003.7]
  - - [512, 1536, 1, 3072]
    - [4, 26965.3]
  - - [1024, 1536, 1, 3072]
    - [13, 31697.3]
  - - [1536, 1536, 1, 3072]
    - [15, 33471.2]
  - - [2048, 1536, 1, 3072]
    - [15, 34142.1]
  - - [2560, 1536, 1, 3072]
    - [4, 34520.7]
  - - [3072, 1536, 1, 3072]
    - [0, 35005.5]
  - - [512, 2048, 1, 3072]
    - [0, 30031.5]
  - - [1024, 2048, 1, 3072]
    - [15, 33287.7]
  - - [1536, 2048, 1, 3072]
    - [13, 34538.9]
  - - [2048, 2048, 1, 3072]
    - [4, 34890.2]
  - - [2560, 2048, 1, 3072]
    - [15, 35540.9]
  - - [3072, 2048, 1, 3072]
    - [15, 35493.7]
  - - [512, 2560, 1, 3072]
    - [15, 30412.2]
  - - [1024, 2560, 1, 3072]
    - [13, 34182.2]
  - - [1536, 2560, 1, 3072]
    - [4, 34612.4]
  - - [2048, 2560, 1, 3072]
    - [4, 34945.9]
  - - [2560, 2560, 1, 3072]
    - [15, 35803.3]
  - - [3072, 2560, 1, 3072]
    - [0, 35815.1]
  - - [512, 3072, 1, 3072]
    - [0, 32031.1]
  - - [1024, 3072, 1, 3072]
    - [15, 33794.0]
  - - [1536, 3072, 1, 3072]
    - [0, 34947.1]
  - - [2048, 3072, 1, 3072]
    - [15, 35799.6]
  - - [2560, 3072, 1, 3072]
    - [0, 35674.7]
  - - [3072, 3072, 1, 3072]
    - [339, 50.74]
  - - [1, 1, 1, 1]
    - [379, 0.0]
  - - [1, 1, 1, 64]
    - [12, 0.004]
  - - [1, 64, 1, 1]
    - [11, 0.00423883]
  - - [64, 1, 1, 1]
    - [11, 0.00425858]
  - - [64, 64, 1, 1]
    - [8, 0.269323]
  - - [64, 1, 1, 64]
    - [10, 0.267914]
  - - [1, 64, 1, 64]
    - [12, 0.266945]
  - - [64, 64, 1, 64]
    - [114, 0.03]
  - - [64, 64, 1, 256]
    - [258, 0.1]
  - - [64, 64, 1, 512]
    - [311, 0.19]
  - - [64, 64, 1, 1024]
    - [329, 0.35]
  - - [64, 64, 1, 2048]
    - [340, 0.58]
  - - [64, 64, 1, 4096]
    - [329, 0.85]
  - - [256, 256, 1, 256]
    - [273, 1.52]
  - - [4096, 4096, 1, 4096]
    - [346, 49.27]
  - - [320, 64, 1, 64]
    - [118, 0.13]
  - - [576, 64, 1, 64]
    - [122, 0.24]
  - - [832, 64, 1, 64]
    - [126, 0.34]
  - - [1088, 64, 1, 64]
    - [120, 0.44]
  - - [1344, 64, 1, 64]
    - [119, 0.55]
  - - [1600, 64, 1, 64]
    - [166, 0.63]
  - - [1856, 64, 1, 64]
    - [204, 0.73]
  - - [2112, 64, 1, 64]
    - [175, 0.82]
  - - [2368, 64, 1, 64]
    - [184, 0.92]
  - - [2624, 64, 1, 64]
    - [161, 1.02]
  - - [2880, 64, 1, 64]
    - [152, 1.11]
  - - [3136, 64, 1, 64]
    - [164, 1.14]
  - - [3392, 64, 1, 64]
    - [175, 1.31]
  - - [3648, 64, 1, 64]
    - [415, 1.39]
  - - [3904, 64, 1, 64]
    - [182, 1.46]
  - - [64, 320, 1, 64]
    - [168, 0.13]
  - - [320, 320, 1, 64]
    - [172, 0.63]
  - - [576, 320, 1, 64]
    - [142, 1.05]
  - - [832, 320, 1, 64]
    - [176, 1.46]
  - - [1088, 320, 1, 64]
    - [192, 1.92]
  - - [1344, 320, 1, 64]
    - [172, 2.37]
  - - [1600, 320, 1, 64]
    - [350, 2.8]
  - - [1856, 320, 1, 64]
    - [351, 2.95]
  - - [2112, 320, 1, 64]
    - [301, 3.2]
  - - [2368, 320, 1, 64]
    - [175, 3.75]
  - - [2624, 320, 1, 64]
    - [161, 3.97]
  - - [2880, 320, 1, 64]
    - [175, 4.25]
  - - [3136, 320, 1, 64]
    - [175, 4.52]
  - - [3392, 320, 1, 64]
    - [184, 4.75]
  - - [3648, 320, 1, 64]
    - [161, 5.02]
  - - [3904, 320, 1, 64]
    - [353, 5.23]
  - - [64, 576, 1, 64]
    - [208, 0.24]
  - - [320, 576, 1, 64]
    - [175, 1.11]
  - - [576, 576, 1, 64]
    - [172, 1.89]
  - - [832, 576, 1, 64]
    - [172, 2.61]
  - - [1088, 576, 1, 64]
    - [175, 3.28]
  - - [1344, 576, 1, 64]
    - [175, 3.79]
  - - [1600, 576, 1, 64]
    - [161, 4.29]
  - - [1856, 576, 1, 64]
    - [245, 4.45]
  - - [2112, 576, 1, 64]
    - [161, 4.79]
  - - [2368, 576, 1, 64]
    - [161, 5.37]
  - - [2624, 576, 1, 64]
    - [161, 5.71]
  - - [2880, 576, 1, 64]
    - [161, 6.23]
  - - [3136, 576, 1, 64]
    - [245, 6.32]
  - - [3392, 576, 1, 64]
    - [245, 6.65]
  - - [3648, 576, 1, 64]
    - [161, 6.8]
  - - [3904, 576, 1, 64]
    - [161, 7.15]
  - - [64, 832, 1, 64]
    - [168, 0.34]
  - - [320, 832, 1, 64]
    - [176, 1.54]
  - - [576, 832, 1, 64]
    - [163, 2.6]
  - - [832, 832, 1, 64]
    - [237, 3.37]
  - - [1088, 832, 1, 64]
    - [175, 4.23]
  - - [1344, 832, 1, 64]
    - [161, 4.86]
  - - [1600, 832, 1, 64]
    - [161, 5.29]
  - - [1856, 832, 1, 64]
    - [161, 5.99]
  - - [2112, 832, 1, 64]
    - [175, 6.2]
  - - [2368, 832, 1, 64]
    - [245, 6.86]
  - - [2624, 832, 1, 64]
    - [161, 7.28]
  - - [2880, 832, 1, 64]
    - [161, 7.47]
  - - [3136, 832, 1, 64]
    - [353, 7.68]
  - - [3392, 832, 1, 64]
    - [161, 7.89]
  - - [3648, 832, 1, 64]
    - [245, 8.3]
  - - [3904, 832, 1, 64]
    - [245, 8.46]
  - - [64, 1088, 1, 64]
    - [356, 0.44]
  - - [320, 1088, 1, 64]
    - [164, 1.97]
  - - [576, 1088, 1, 64]
    - [354, 3.2]
  - - [832, 1088, 1, 64]
    - [354, 4.03]
  - - [1088, 1088, 1, 64]
    - [161, 4.99]
  - - [1344, 1088, 1, 64]
    - [161, 5.45]
  - - [1600, 1088, 1, 64]
    - [245, 6.02]
  - - [1856, 1088, 1, 64]
    - [161, 6.7]
  - - [2112, 1088, 1, 64]
    - [161, 7.26]
  - - [2368, 1088, 1, 64]
    - [161, 7.8]
  - - [2624, 1088, 1, 64]
    - [245, 7.99]
  - - [2880, 1088, 1, 64]
    - [161, 8.14]
  - - [3136, 1088, 1, 64]
    - [245, 8.76]
  - - [3392, 1088, 1, 64]
    - [161, 9.3]
  - - [3648, 1088, 1, 64]
    - [245, 9.17]
  - - [3904, 1088, 1, 64]
    - [245, 9.61]
  - - [64, 1344, 1, 64]
    - [360, 0.54]
  - - [320, 1344, 1, 64]
    - [175, 2.36]
  - - [576, 1344, 1, 64]
    - [175, 3.81]
  - - [832, 1344, 1, 64]
    - [161, 4.86]
  - - [1088, 1344, 1, 64]
    - [161, 5.5]
  - - [1344, 1344, 1, 64]
    - [245, 6.5]
  - - [1600, 1344, 1, 64]
    - [245, 6.82]
  - - [1856, 1344, 1, 64]
    - [161, 7.4]
  - - [2112, 1344, 1, 64]
    - [161, 7.85]
  - - [2368, 1344, 1, 64]
    - [245, 8.41]
  - - [2624, 1344, 1, 64]
    - [161, 8.8]
  - - [2880, 1344, 1, 64]
    - [161, 9.09]
  - - [3136, 1344, 1, 64]
    - [161, 9.42]
  - - [3392, 1344, 1, 64]
    - [245, 9.91]
  - - [3648, 1344, 1, 64]
    - [245, 10.09]
  - - [3904, 1344, 1, 64]
    - [161, 10.46]
  - - [64, 1600, 1, 64]
    - [164, 0.63]
  - - [320, 1600, 1, 64]
    - [156, 2.75]
  - - [576, 1600, 1, 64]
    - [363, 4.02]
  - - [832, 1600, 1, 64]
    - [161, 5.37]
  - - [1088, 1600, 1, 64]
    - [184, 6.12]
  - - [1344, 1600, 1, 64]
    - [245, 7.07]
  - - [1600, 1600, 1, 64]
    - [245, 7.54]
  - - [1856, 1600, 1, 64]
    - [161, 8.09]
  - - [2112, 1600, 1, 64]
    - [161, 8.94]
  - - [2368, 1600, 1, 64]
    - [161, 8.95]
  - - [2624, 1600, 1, 64]
    - [161, 9.72]
  - - [2880, 1600, 1, 64]
    - [161, 9.79]
  - - [3136, 1600, 1, 64]
    - [245, 10.01]
  - - [3392, 1600, 1, 64]
    - [245, 10.41]
  - - [3648, 1600, 1, 64]
    - [161, 10.5]
  - - [3904, 1600, 1, 64]
    - [245, 10.91]
  - - [64, 1856, 1, 64]
    - [362, 0.72]
  - - [320, 1856, 1, 64]
    - [161, 3.09]
  - - [576, 1856, 1, 64]
    - [161, 4.53]
  - - [832, 1856, 1, 64]
    - [245, 5.87]
  - - [1088, 1856, 1, 64]
    - [245, 6.82]
  - - [1344, 1856, 1, 64]
    - [161, 7.59]
  - - [1600, 1856, 1, 64]
    - [161, 8.43]
  - - [1856, 1856, 1, 64]
    - [161, 9.01]
  - - [2112, 1856, 1, 64]
    - [161, 9.38]
  - - [2368, 1856, 1, 64]
    - [161, 9.43]
  - - [2624, 1856, 1, 64]
    - [245, 9.95]
  - - [2880, 1856, 1, 64]
    - [161, 10.43]
  - - [3136, 1856, 1, 64]
    - [161, 10.6]
  - - [3392, 1856, 1, 64]
    - [245, 11.19]
  - - [3648, 1856, 1, 64]
    - [406, 11.04]
  - - [3904, 1856, 1, 64]
    - [245, 11.4]
  - - [64, 2112, 1, 64]
    - [416, 0.79]
  - - [320, 2112, 1, 64]
    - [184, 3.33]
  - - [576, 2112, 1, 64]
    - [161, 5.06]
  - - [832, 2112, 1, 64]
    - [245, 6.12]
  - - [1088, 2112, 1, 64]
    - [161, 7.15]
  - - [1344, 2112, 1, 64]
    - [161, 8.14]
  - - [1600, 2112, 1, 64]
    - [245, 8.83]
  - - [1856, 2112, 1, 64]
    - [245, 9.46]
  - - [2112, 2112, 1, 64]
    - [245, 9.75]
  - - [2368, 2112, 1, 64]
    - [161, 10.07]
  - - [2624, 2112, 1, 64]
    - [161, 10.42]
  - - [2880, 2112, 1, 64]
    - [161, 10.77]
  - - [3136, 2112, 1, 64]
    - [245, 11.01]
  - - [3392, 2112, 1, 64]
    - [161, 11.63]
  - - [3648, 2112, 1, 64]
    - [400, 11.69]
  - - [3904, 2112, 1, 64]
    - [256, 12.02]
  - - [64, 2368, 1, 64]
    - [164, 0.88]
  - - [320, 2368, 1, 64]
    - [417, 3.55]
  - - [576, 2368, 1, 64]
    - [161, 5.35]
  - - [832, 2368, 1, 64]
    - [245, 6.52]
  - - [1088, 2368, 1, 64]
    - [245, 7.66]
  - - [1344, 2368, 1, 64]
    - [161, 8.38]
  - - [1600, 2368, 1, 64]
    - [245, 9.07]
  - - [1856, 2368, 1, 64]
    - [245, 9.65]
  - - [2112, 2368, 1, 64]
    - [245, 10.18]
  - - [2368, 2368, 1, 64]
    - [245, 10.48]
  - - [2624, 2368, 1, 64]
    - [161, 10.88]
  - - [2880, 2368, 1, 64]
    - [245, 11.05]
  - - [3136, 2368, 1, 64]
    - [406, 11.41]
  - - [3392, 2368, 1, 64]
    - [304, 11.86]
  - - [3648, 2368, 1, 64]
    - [390, 12.16]
  - - [3904, 2368, 1, 64]
    - [400, 12.47]
  - - [64, 2624, 1, 64]
    - [180, 1.02]
  - - [320, 2624, 1, 64]
    - [161, 3.81]
  - - [576, 2624, 1, 64]
    - [161, 5.73]
  - - [832, 2624, 1, 64]
    - [245, 7.11]
  - - [1088, 2624, 1, 64]
    - [245, 7.97]
  - - [1344, 2624, 1, 64]
    - [161, 8.69]
  - - [1600, 2624, 1, 64]
    - [245, 9.56]
  - - [1856, 2624, 1, 64]
    - [245, 10.09]
  - - [2112, 2624, 1, 64]
    - [161, 10.47]
  - - [2368, 2624, 1, 64]
    - [161, 10.88]
  - - [2624, 2624, 1, 64]
    - [418, 11.05]
  - - [2880, 2624, 1, 64]
    - [161, 11.42]
  - - [3136, 2624, 1, 64]
    - [256, 11.86]
  - - [3392, 2624, 1, 64]
    - [238, 12.25]
  - - [3648, 2624, 1, 64]
    - [256, 12.57]
  - - [3904, 2624, 1, 64]
    - [256, 12.86]
  - - [64, 2880, 1, 64]
    - [419, 1.06]
  - - [320, 2880, 1, 64]
    - [184, 4.03]
  - - [576, 2880, 1, 64]
    - [175, 5.91]
  - - [832, 2880, 1, 64]
    - [161, 7.29]
  - - [1088, 2880, 1, 64]
    - [245, 8.39]
  - - [1344, 2880, 1, 64]
    - [245, 9.1]
  - - [1600, 2880, 1, 64]
    - [161, 9.88]
  - - [1856, 2880, 1, 64]
    - [161, 10.42]
  - - [2112, 2880, 1, 64]
    - [161, 10.66]
  - - [2368, 2880, 1, 64]
    - [245, 11.21]
  - - [2624, 2880, 1, 64]
    - [390, 11.42]
  - - [2880, 2880, 1, 64]
    - [245, 11.89]
  - - [3136, 2880, 1, 64]
    - [388, 12.29]
  - - [3392, 2880, 1, 64]
    - [386, 12.61]
  - - [3648, 2880, 1, 64]
    - [386, 13.19]
  - - [3904, 2880, 1, 64]
    - [390, 13.4]
  - - [64, 3136, 1, 64]
    - [184, 1.18]
  - - [320, 3136, 1, 64]
    - [184, 4.32]
  - - [576, 3136, 1, 64]
    - [245, 6.23]
  - - [832, 3136, 1, 64]
    - [420, 7.35]
  - - [1088, 3136, 1, 64]
    - [161, 8.66]
  - - [1344, 3136, 1, 64]
    - [161, 9.36]
  - - [1600, 3136, 1, 64]
    - [161, 10.1]
  - - [1856, 3136, 1, 64]
    - [245, 10.62]
  - - [2112, 3136, 1, 64]
    - [245, 11.45]
  - - [2368, 3136, 1, 64]
    - [245, 11.76]
  - - [2624, 3136, 1, 64]
    - [390, 12.04]
  - - [2880, 3136, 1, 64]
    - [257, 12.7]
  - - [3136, 3136, 1, 64]
    - [246, 12.75]
  - - [3392, 3136, 1, 64]
    - [256, 13.19]
  - - [3648, 3136, 1, 64]
    - [256, 13.6]
  - - [3904, 3136, 1, 64]
    - [256, 14.04]
  - - [64, 3392, 1, 64]
    - [175, 1.26]
  - - [320, 3392, 1, 64]
    - [175, 4.71]
  - - [576, 3392, 1, 64]
    - [161, 6.85]
  - - [832, 3392, 1, 64]
    - [161, 8.13]
  - - [1088, 3392, 1, 64]
    - [161, 9.09]
  - - [1344, 3392, 1, 64]
    - [245, 9.5]
  - - [1600, 3392, 1, 64]
    - [245, 10.34]
  - - [1856, 3392, 1, 64]
    - [161, 10.9]
  - - [2112, 3392, 1, 64]
    - [245, 11.25]
  - - [2368, 3392, 1, 64]
    - [390, 11.88]
  - - [2624, 3392, 1, 64]
    - [256, 12.27]
  - - [2880, 3392, 1, 64]
    - [256, 12.91]
  - - [3136, 3392, 1, 64]
    - [256, 13.12]
  - - [3392, 3392, 1, 64]
    - [256, 13.53]
  - - [3648, 3392, 1, 64]
    - [390, 13.82]
  - - [3904, 3392, 1, 64]
    - [246, 14.2]
  - - [64, 3648, 1, 64]
    - [421, 1.33]
  - - [320, 3648, 1, 64]
    - [175, 4.89]
  - - [576, 3648, 1, 64]
    - [161, 7.06]
  - - [832, 3648, 1, 64]
    - [161, 8.15]
  - - [1088, 3648, 1, 64]
    - [161, 9.34]
  - - [1344, 3648, 1, 64]
    - [161, 10.1]
  - - [1600, 3648, 1, 64]
    - [245, 10.71]
  - - [1856, 3648, 1, 64]
    - [245, 11.21]
  - - [2112, 3648, 1, 64]
    - [161, 11.69]
  - - [2368, 3648, 1, 64]
    - [386, 12.07]
  - - [2624, 3648, 1, 64]
    - [246, 12.58]
  - - [2880, 3648, 1, 64]
    - [256, 13.14]
  - - [3136, 3648, 1, 64]
    - [386, 13.55]
  - - [3392, 3648, 1, 64]
    - [256, 14.0]
  - - [3648, 3648, 1, 64]
    - [386, 14.16]
  - - [3904, 3648, 1, 64]
    - [390, 14.42]
  - - [64, 3904, 1, 64]
    - [184, 1.42]
  - - [320, 3904, 1, 64]
    - [353, 4.99]
  - - [576, 3904, 1, 64]
    - [245, 6.96]
  - - [832, 3904, 1, 64]
    - [161, 8.54]
  - - [1088, 3904, 1, 64]
    - [161, 9.43]
  - - [1344, 3904, 1, 64]
    - [245, 10.31]
  - - [1600, 3904, 1, 64]
    - [245, 10.81]
  - - [1856, 3904, 1, 64]
    - [245, 11.27]
  - - [2112, 3904, 1, 64]
    - [256, 11.77]
  - - [2368, 3904, 1, 64]
    - [390, 12.35]
  - - [2624, 3904, 1, 64]
    - [386, 12.77]
  - - [2880, 3904, 1, 64]
    - [398, 13.19]
  - - [3136, 3904, 1, 64]
    - [256, 13.66]
  - - [3392, 3904, 1, 64]
    - [398, 14.06]
  - - [3648, 3904, 1, 64]
    - [390, 14.42]
  - - [3904, 3904, 1, 64]
    - [398, 14.63]
  - - [320, 64, 1, 256]
    - [262, 0.5]
  - - [576, 64, 1, 256]
    - [265, 0.89]
  - - [832, 64, 1, 256]
    - [268, 1.26]
  - - [1088, 64, 1, 256]
    - [366, 1.57]
  - - [1344, 64, 1, 256]
    - [368, 1.89]
  - - [1600, 64, 1, 256]
    - [278, 2.32]
  - - [1856, 64, 1, 256]
    - [278, 2.65]
  - - [2112, 64, 1, 256]
    - [275, 2.99]
  - - [2368, 64, 1, 256]
    - [286, 3.24]
  - - [2624, 64, 1, 256]
    - [275, 3.46]
  - - [2880, 64, 1, 256]
    - [275, 3.73]
  - - [3136, 64, 1, 256]
    - [275, 4.13]
  - - [3392, 64, 1, 256]
    - [275, 4.45]
  - - [3648, 64, 1, 256]
    - [294, 4.79]
  - - [3904, 64, 1, 256]
    - [278, 4.99]
  - - [64, 320, 1, 256]
    - [274, 0.49]
  - - [320, 320, 1, 256]
    - [278, 2.29]
  - - [576, 320, 1, 256]
    - [275, 4.0]
  - - [832, 320, 1, 256]
    - [275, 5.42]
  - - [1088, 320, 1, 256]
    - [280, 6.8]
  - - [1344, 320, 1, 256]
    - [286, 7.84]
  - - [1600, 320, 1, 256]
    - [165, 9.15]
  - - [1856, 320, 1, 256]
    - [165, 9.9]
  - - [2112, 320, 1, 256]
    - [213, 10.33]
  - - [2368, 320, 1, 256]
    - [236, 11.7]
  - - [2624, 320, 1, 256]
    - [213, 12.07]
  - - [2880, 320, 1, 256]
    - [236, 12.66]
  - - [3136, 320, 1, 256]
    - [236, 13.48]
  - - [3392, 320, 1, 256]
    - [165, 13.91]
  - - [3648, 320, 1, 256]
    - [236, 14.25]
  - - [3904, 320, 1, 256]
    - [165, 14.33]
  - - [64, 576, 1, 256]
    - [300, 0.85]
  - - [320, 576, 1, 256]
    - [278, 3.93]
  - - [576, 576, 1, 256]
    - [287, 6.53]
  - - [832, 576, 1, 256]
    - [299, 8.76]
  - - [1088, 576, 1, 256]
    - [159, 10.38]
  - - [1344, 576, 1, 256]
    - [321, 11.52]
  - - [1600, 576, 1, 256]
    - [237, 12.18]
  - - [1856, 576, 1, 256]
    - [165, 13.21]
  - - [2112, 576, 1, 256]
    - [301, 14.34]
  - - [2368, 576, 1, 256]
    - [237, 15.11]
  - - [2624, 576, 1, 256]
    - [237, 16.02]
  - - [2880, 576, 1, 256]
    - [237, 16.85]
  - - [3136, 576, 1, 256]
    - [236, 17.68]
  - - [3392, 576, 1, 256]
    - [237, 18.26]
  - - [3648, 576, 1, 256]
    - [237, 18.17]
  - - [3904, 576, 1, 256]
    - [371, 19.14]
  - - [64, 832, 1, 256]
    - [295, 1.28]
  - - [320, 832, 1, 256]
    - [278, 5.46]
  - - [576, 832, 1, 256]
    - [281, 8.72]
  - - [832, 832, 1, 256]
    - [301, 10.92]
  - - [1088, 832, 1, 256]
    - [142, 12.78]
  - - [1344, 832, 1, 256]
    - [301, 13.89]
  - - [1600, 832, 1, 256]
    - [301, 14.82]
  - - [1856, 832, 1, 256]
    - [237, 16.25]
  - - [2112, 832, 1, 256]
    - [236, 17.36]
  - - [2368, 832, 1, 256]
    - [237, 17.76]
  - - [2624, 832, 1, 256]
    - [237, 18.94]
  - - [2880, 832, 1, 256]
    - [237, 19.24]
  - - [3136, 832, 1, 256]
    - [237, 19.97]
  - - [3392, 832, 1, 256]
    - [237, 20.56]
  - - [3648, 832, 1, 256]
    - [236, 20.65]
  - - [3904, 832, 1, 256]
    - [301, 21.52]
  - - [64, 1088, 1, 256]
    - [263, 1.6]
  - - [320, 1088, 1, 256]
    - [280, 6.79]
  - - [576, 1088, 1, 256]
    - [237, 10.01]
  - - [832, 1088, 1, 256]
    - [301, 13.05]
  - - [1088, 1088, 1, 256]
    - [326, 14.67]
  - - [1344, 1088, 1, 256]
    - [301, 15.59]
  - - [1600, 1088, 1, 256]
    - [236, 17.1]
  - - [1856, 1088, 1, 256]
    - [165, 18.03]
  - - [2112, 1088, 1, 256]
    - [213, 18.95]
  - - [2368, 1088, 1, 256]
    - [237, 19.89]
  - - [2624, 1088, 1, 256]
    - [236, 20.76]
  - - [2880, 1088, 1, 256]
    - [237, 21.17]
  - - [3136, 1088, 1, 256]
    - [301, 22.01]
  - - [3392, 1088, 1, 256]
    - [236, 22.31]
  - - [3648, 1088, 1, 256]
    - [236, 23.09]
  - - [3904, 1088, 1, 256]
    - [237, 23.29]
  - - [64, 1344, 1, 256]
    - [274, 1.87]
  - - [320, 1344, 1, 256]
    - [309, 7.59]
  - - [576, 1344, 1, 256]
    - [301, 11.48]
  - - [832, 1344, 1, 256]
    - [237, 13.85]
  - - [1088, 1344, 1, 256]
    - [243, 15.59]
  - - [1344, 1344, 1, 256]
    - [213, 17.38]
  - - [1600, 1344, 1, 256]
    - [237, 18.51]
  - - [1856, 1344, 1, 256]
    - [237, 19.37]
  - - [2112, 1344, 1, 256]
    - [236, 20.64]
  - - [2368, 1344, 1, 256]
    - [237, 21.18]
  - - [2624, 1344, 1, 256]
    - [371, 22.32]
  - - [2880, 1344, 1, 256]
    - [236, 22.68]
  - - [3136, 1344, 1, 256]
    - [301, 22.95]
  - - [3392, 1344, 1, 256]
    - [237, 23.68]
  - - [3648, 1344, 1, 256]
    - [237, 23.95]
  - - [3904, 1344, 1, 256]
    - [326, 24.53]
  - - [64, 1600, 1, 256]
    - [306, 2.22]
  - - [320, 1600, 1, 256]
    - [287, 8.8]
  - - [576, 1600, 1, 256]
    - [301, 12.65]
  - - [832, 1600, 1, 256]
    - [301, 15.26]
  - - [1088, 1600, 1, 256]
    - [237, 16.92]
  - - [1344, 1600, 1, 256]
    - [309, 18.34]
  - - [1600, 1600, 1, 256]
    - [237, 19.95]
  - - [1856, 1600, 1, 256]
    - [213, 20.68]
  - - [2112, 1600, 1, 256]
    - [301, 21.72]
  - - [2368, 1600, 1, 256]
    - [286, 22.55]
  - - [2624, 1600, 1, 256]
    - [371, 22.86]
  - - [2880, 1600, 1, 256]
    - [237, 23.56]
  - - [3136, 1600, 1, 256]
    - [309, 24.38]
  - - [3392, 1600, 1, 256]
    - [237, 24.46]
  - - [3648, 1600, 1, 256]
    - [237, 25.02]
  - - [3904, 1600, 1, 256]
    - [371, 25.62]
  - - [64, 1856, 1, 256]
    - [306, 2.51]
  - - [320, 1856, 1, 256]
    - [236, 9.56]
  - - [576, 1856, 1, 256]
    - [301, 13.31]
  - - [832, 1856, 1, 256]
    - [301, 16.27]
  - - [1088, 1856, 1, 256]
    - [237, 18.01]
  - - [1344, 1856, 1, 256]
    - [301, 19.23]
  - - [1600, 1856, 1, 256]
    - [236, 20.81]
  - - [1856, 1856, 1, 256]
    - [165, 21.68]
  - - [2112, 1856, 1, 256]
    - [236, 22.64]
  - - [2368, 1856, 1, 256]
    - [286, 23.54]
  - - [2624, 1856, 1, 256]
    - [237, 23.73]
  - - [2880, 1856, 1, 256]
    - [236, 24.3]
  - - [3136, 1856, 1, 256]
    - [236, 24.72]
  - - [3392, 1856, 1, 256]
    - [326, 25.24]
  - - [3648, 1856, 1, 256]
    - [237, 25.77]
  - - [3904, 1856, 1, 256]
    - [371, 26.41]
  - - [64, 2112, 1, 256]
    - [207, 2.74]
  - - [320, 2112, 1, 256]
    - [213, 10.09]
  - - [576, 2112, 1, 256]
    - [280, 14.65]
  - - [832, 2112, 1, 256]
    - [237, 17.33]
  - - [1088, 2112, 1, 256]
    - [237, 19.39]
  - - [1344, 2112, 1, 256]
    - [301, 20.69]
  - - [1600, 2112, 1, 256]
    - [301, 21.69]
  - - [1856, 2112, 1, 256]
    - [236, 22.82]
  - - [2112, 2112, 1, 256]
    - [413, 23.08]
  - - [2368, 2112, 1, 256]
    - [165, 24.19]
  - - [2624, 2112, 1, 256]
    - [371, 25.22]
  - - [2880, 2112, 1, 256]
    - [254, 25.2]
  - - [3136, 2112, 1, 256]
    - [371, 26.23]
  - - [3392, 2112, 1, 256]
    - [304, 26.47]
  - - [3648, 2112, 1, 256]
    - [242, 27.27]
  - - [3904, 2112, 1, 256]
    - [232, 28.09]
  - - [64, 2368, 1, 256]
    - [207, 3.26]
  - - [320, 2368, 1, 256]
    - [237, 11.73]
  - - [576, 2368, 1, 256]
    - [301, 15.58]
  - - [832, 2368, 1, 256]
    - [286, 18.23]
  - - [1088, 2368, 1, 256]
    - [165, 20.25]
  - - [1344, 2368, 1, 256]
    - [165, 21.51]
  - - [1600, 2368, 1, 256]
    - [213, 22.64]
  - - [1856, 2368, 1, 256]
    - [237, 23.26]
  - - [2112, 2368, 1, 256]
    - [236, 23.66]
  - - [2368, 2368, 1, 256]
    - [389, 24.59]
  - - [2624, 2368, 1, 256]
    - [371, 25.61]
  - - [2880, 2368, 1, 256]
    - [242, 26.47]
  - - [3136, 2368, 1, 256]
    - [390, 26.94]
  - - [3392, 2368, 1, 256]
    - [238, 27.49]
  - - [3648, 2368, 1, 256]
    - [238, 27.76]
  - - [3904, 2368, 1, 256]
    - [238, 28.46]
  - - [64, 2624, 1, 256]
    - [207, 3.61]
  - - [320, 2624, 1, 256]
    - [236, 12.14]
  - - [576, 2624, 1, 256]
    - [237, 16.56]
  - - [832, 2624, 1, 256]
    - [237, 18.99]
  - - [1088, 2624, 1, 256]
    - [237, 21.03]
  - - [1344, 2624, 1, 256]
    - [370, 22.66]
  - - [1600, 2624, 1, 256]
    - [370, 23.07]
  - - [1856, 2624, 1, 256]
    - [326, 23.76]
  - - [2112, 2624, 1, 256]
    - [309, 24.68]
  - - [2368, 2624, 1, 256]
    - [370, 25.51]
  - - [2624, 2624, 1, 256]
    - [370, 26.32]
  - - [2880, 2624, 1, 256]
    - [370, 26.97]
  - - [3136, 2624, 1, 256]
    - [238, 27.61]
  - - [3392, 2624, 1, 256]
    - [255, 27.98]
  - - [3648, 2624, 1, 256]
    - [238, 28.6]
  - - [3904, 2624, 1, 256]
    - [242, 29.16]
  - - [64, 2880, 1, 256]
    - [279, 3.84]
  - - [320, 2880, 1, 256]
    - [237, 12.22]
  - - [576, 2880, 1, 256]
    - [165, 16.77]
  - - [832, 2880, 1, 256]
    - [237, 19.14]
  - - [1088, 2880, 1, 256]
    - [237, 21.7]
  - - [1344, 2880, 1, 256]
    - [237, 22.45]
  - - [1600, 2880, 1, 256]
    - [237, 23.68]
  - - [1856, 2880, 1, 256]
    - [237, 24.41]
  - - [2112, 2880, 1, 256]
    - [236, 24.99]
  - - [2368, 2880, 1, 256]
    - [389, 26.01]
  - - [2624, 2880, 1, 256]
    - [242, 26.66]
  - - [2880, 2880, 1, 256]
    - [255, 27.09]
  - - [3136, 2880, 1, 256]
    - [242, 27.78]
  - - [3392, 2880, 1, 256]
    - [255, 28.24]
  - - [3648, 2880, 1, 256]
    - [257, 28.82]
  - - [3904, 2880, 1, 256]
    - [242, 29.44]
  - - [64, 3136, 1, 256]
    - [253, 4.27]
  - - [320, 3136, 1, 256]
    - [237, 13.5]
  - - [576, 3136, 1, 256]
    - [286, 17.43]
  - - [832, 3136, 1, 256]
    - [237, 20.22]
  - - [1088, 3136, 1, 256]
    - [326, 21.34]
  - - [1344, 3136, 1, 256]
    - [237, 23.04]
  - - [1600, 3136, 1, 256]
    - [236, 23.85]
  - - [1856, 3136, 1, 256]
    - [242, 24.97]
  - - [2112, 3136, 1, 256]
    - [242, 26.02]
  - - [2368, 3136, 1, 256]
    - [242, 26.41]
  - - [2624, 3136, 1, 256]
    - [390, 27.7]
  - - [2880, 3136, 1, 256]
    - [242, 28.21]
  - - [3136, 3136, 1, 256]
    - [388, 29.07]
  - - [3392, 3136, 1, 256]
    - [242, 29.47]
  - - [3648, 3136, 1, 256]
    - [390, 30.27]
  - - [3904, 3136, 1, 256]
    - [254, 30.66]
  - - [64, 3392, 1, 256]
    - [165, 4.54]
  - - [320, 3392, 1, 256]
    - [280, 13.7]
  - - [576, 3392, 1, 256]
    - [165, 17.87]
  - - [832, 3392, 1, 256]
    - [236, 20.46]
  - - [1088, 3392, 1, 256]
    - [237, 22.63]
  - - [1344, 3392, 1, 256]
    - [237, 23.67]
  - - [1600, 3392, 1, 256]
    - [237, 24.28]
  - - [1856, 3392, 1, 256]
    - [257, 25.28]
  - - [2112, 3392, 1, 256]
    - [238, 26.58]
  - - [2368, 3392, 1, 256]
    - [238, 27.29]
  - - [2624, 3392, 1, 256]
    - [238, 27.97]
  - - [2880, 3392, 1, 256]
    - [232, 28.48]
  - - [3136, 3392, 1, 256]
    - [305, 29.14]
  - - [3392, 3392, 1, 256]
    - [304, 29.9]
  - - [3648, 3392, 1, 256]
    - [238, 30.64]
  - - [3904, 3392, 1, 256]
    - [242, 30.96]
  - - [64, 3648, 1, 256]
    - [281, 4.73]
  - - [320, 3648, 1, 256]
    - [236, 14.23]
  - - [576, 3648, 1, 256]
    - [237, 18.13]
  - - [832, 3648, 1, 256]
    - [286, 20.64]
  - - [1088, 3648, 1, 256]
    - [237, 22.66]
  - - [1344, 3648, 1, 256]
    - [237, 23.93]
  - - [1600, 3648, 1, 256]
    - [236, 24.66]
  - - [1856, 3648, 1, 256]
    - [236, 25.71]
  - - [2112, 3648, 1, 256]
    - [246, 26.8]
  - - [2368, 3648, 1, 256]
    - [255, 28.12]
  - - [2624, 3648, 1, 256]
    - [238, 28.16]
  - - [2880, 3648, 1, 256]
    - [242, 29.15]
  - - [3136, 3648, 1, 256]
    - [242, 30.11]
  - - [3392, 3648, 1, 256]
    - [304, 30.25]
  - - [3648, 3648, 1, 256]
    - [389, 30.76]
  - - [3904, 3648, 1, 256]
    - [242, 31.15]
  - - [64, 3904, 1, 256]
    - [287, 5.04]
  - - [320, 3904, 1, 256]
    - [307, 14.89]
  - - [576, 3904, 1, 256]
    - [237, 19.24]
  - - [832, 3904, 1, 256]
    - [237, 21.76]
  - - [1088, 3904, 1, 256]
    - [307, 23.76]
  - - [1344, 3904, 1, 256]
    - [307, 24.42]
  - - [1600, 3904, 1, 256]
    - [309, 25.72]
  - - [1856, 3904, 1, 256]
    - [232, 26.27]
  - - [2112, 3904, 1, 256]
    - [370, 27.66]
  - - [2368, 3904, 1, 256]
    - [255, 28.45]
  - - [2624, 3904, 1, 256]
    - [238, 28.69]
  - - [2880, 3904, 1, 256]
    - [242, 29.18]
  - - [3136, 3904, 1, 256]
    - [238, 30.09]
  - - [3392, 3904, 1, 256]
    - [388, 30.55]
  - - [3648, 3904, 1, 256]
    - [257, 30.81]
  - - [3904, 3904, 1, 256]
    - [257, 31.23]
  - - [320, 64, 1, 512]
    - [262, 0.91]
  - - [576, 64, 1, 512]
    - [268, 1.62]
  - - [832, 64, 1, 512]
    - [261, 2.35]
  - - [1088, 64, 1, 512]
    - [266, 2.92]
  - - [1344, 64, 1, 512]
    - [273, 3.59]
  - - [1600, 64, 1, 512]
    - [275, 4.21]
  - - [1856, 64, 1, 512]
    - [275, 4.78]
  - - [2112, 64, 1, 512]
    - [337, 5.1]
  - - [2368, 64, 1, 512]
    - [292, 5.64]
  - - [2624, 64, 1, 512]
    - [278, 6.25]
  - - [2880, 64, 1, 512]
    - [278, 6.67]
  - - [3136, 64, 1, 512]
    - [278, 7.74]
  - - [3392, 64, 1, 512]
    - [275, 8.26]
  - - [3648, 64, 1, 512]
    - [275, 8.8]
  - - [3904, 64, 1, 512]
    - [281, 9.46]
  - - [64, 320, 1, 512]
    - [272, 0.95]
  - - [320, 320, 1, 512]
    - [286, 4.04]
  - - [576, 320, 1, 512]
    - [275, 6.69]
  - - [832, 320, 1, 512]
    - [286, 8.89]
  - - [1088, 320, 1, 512]
    - [287, 11.65]
  - - [1344, 320, 1, 512]
    - [275, 13.26]
  - - [1600, 320, 1, 512]
    - [281, 15.22]
  - - [1856, 320, 1, 512]
    - [275, 15.86]
  - - [2112, 320, 1, 512]
    - [280, 16.0]
  - - [2368, 320, 1, 512]
    - [213, 18.28]
  - - [2624, 320, 1, 512]
    - [243, 18.46]
  - - [2880, 320, 1, 512]
    - [237, 18.63]
  - - [3136, 320, 1, 512]
    - [237, 20.16]
  - - [3392, 320, 1, 512]
    - [165, 20.52]
  - - [3648, 320, 1, 512]
    - [165, 22.15]
  - - [3904, 320, 1, 512]
    - [286, 22.07]
  - - [64, 576, 1, 512]
    - [263, 1.58]
  - - [320, 576, 1, 512]
    - [275, 6.8]
  - - [576, 576, 1, 512]
    - [299, 11.16]
  - - [832, 576, 1, 512]
    - [159, 14.45]
  - - [1088, 576, 1, 512]
    - [233, 16.81]
  - - [1344, 576, 1, 512]
    - [321, 18.5]
  - - [1600, 576, 1, 512]
    - [307, 18.91]
  - - [1856, 576, 1, 512]
    - [237, 20.62]
  - - [2112, 576, 1, 512]
    - [286, 21.75]
  - - [2368, 576, 1, 512]
    - [286, 22.67]
  - - [2624, 576, 1, 512]
    - [165, 23.89]
  - - [2880, 576, 1, 512]
    - [237, 24.84]
  - - [3136, 576, 1, 512]
    - [237, 25.87]
  - - [3392, 576, 1, 512]
    - [165, 26.73]
  - - [3648, 576, 1, 512]
    - [280, 26.48]
  - - [3904, 576, 1, 512]
    - [237, 27.45]
  - - [64, 832, 1, 512]
    - [295, 2.31]
  - - [320, 832, 1, 512]
    - [278, 9.27]
  - - [576, 832, 1, 512]
    - [159, 13.88]
  - - [832, 832, 1, 512]
    - [142, 16.77]
  - - [1088, 832, 1, 512]
    - [301, 20.06]
  - - [1344, 832, 1, 512]
    - [301, 21.13]
  - - [1600, 832, 1, 512]
    - [286, 22.57]
  - - [1856, 832, 1, 512]
    - [237, 24.3]
  - - [2112, 832, 1, 512]
    - [286, 25.51]
  - - [2368, 832, 1, 512]
    - [237, 26.44]
  - - [2624, 832, 1, 512]
    - [237, 27.58]
  - - [2880, 832, 1, 512]
    - [236, 27.54]
  - - [3136, 832, 1, 512]
    - [237, 28.71]
  - - [3392, 832, 1, 512]
    - [280, 29.08]
  - - [3648, 832, 1, 512]
    - [237, 29.57]
  - - [3904, 832, 1, 512]
    - [286, 30.19]
  - - [64, 1088, 1, 512]
    - [266, 2.9]
  - - [320, 1088, 1, 512]
    - [278, 11.69]
  - - [576, 1088, 1, 512]
    - [142, 16.72]
  - - [832, 1088, 1, 512]
    - [301, 19.87]
  - - [1088, 1088, 1, 512]
    - [307, 22.64]
  - - [1344, 1088, 1, 512]
    - [286, 23.19]
  - - [1600, 1088, 1, 512]
    - [236, 25.49]
  - - [1856, 1088, 1, 512]
    - [237, 27.12]
  - - [2112, 1088, 1, 512]
    - [237, 28.07]
  - - [2368, 1088, 1, 512]
    - [286, 28.76]
  - - [2624, 1088, 1, 512]
    - [286, 29.22]
  - - [2880, 1088, 1, 512]
    - [237, 30.32]
  - - [3136, 1088, 1, 512]
    - [286, 30.26]
  - - [3392, 1088, 1, 512]
    - [165, 30.47]
  - - [3648, 1088, 1, 512]
    - [280, 31.43]
  - - [3904, 1088, 1, 512]
    - [237, 31.91]
  - - [64, 1344, 1, 512]
    - [306, 3.39]
  - - [320, 1344, 1, 512]
    - [275, 12.65]
  - - [576, 1344, 1, 512]
    - [236, 18.18]
  - - [832, 1344, 1, 512]
    - [165, 21.08]
  - - [1088, 1344, 1, 512]
    - [243, 23.45]
  - - [1344, 1344, 1, 512]
    - [165, 25.97]
  - - [1600, 1344, 1, 512]
    - [236, 26.85]
  - - [1856, 1344, 1, 512]
    - [307, 27.82]
  - - [2112, 1344, 1, 512]
    - [236, 29.28]
  - - [2368, 1344, 1, 512]
    - [309, 29.81]
  - - [2624, 1344, 1, 512]
    - [236, 30.63]
  - - [2880, 1344, 1, 512]
    - [237, 31.6]
  - - [3136, 1344, 1, 512]
    - [237, 31.41]
  - - [3392, 1344, 1, 512]
    - [236, 32.15]
  - - [3648, 1344, 1, 512]
    - [346, 32.66]
  - - [3904, 1344, 1, 512]
    - [286, 33.02]
  - - [64, 1600, 1, 512]
    - [207, 4.13]
  - - [320, 1600, 1, 512]
    - [287, 15.19]
  - - [576, 1600, 1, 512]
    - [301, 19.83]
  - - [832, 1600, 1, 512]
    - [286, 22.69]
  - - [1088, 1600, 1, 512]
    - [237, 25.53]
  - - [1344, 1600, 1, 512]
    - [286, 27.34]
  - - [1600, 1600, 1, 512]
    - [165, 28.65]
  - - [1856, 1600, 1, 512]
    - [237, 30.01]
  - - [2112, 1600, 1, 512]
    - [237, 30.44]
  - - [2368, 1600, 1, 512]
    - [237, 31.46]
  - - [2624, 1600, 1, 512]
    - [237, 31.78]
  - - [2880, 1600, 1, 512]
    - [237, 32.37]
  - - [3136, 1600, 1, 512]
    - [237, 32.9]
  - - [3392, 1600, 1, 512]
    - [346, 33.55]
  - - [3648, 1600, 1, 512]
    - [346, 34.17]
  - - [3904, 1600, 1, 512]
    - [327, 34.16]
  - - [64, 1856, 1, 512]
    - [279, 4.58]
  - - [320, 1856, 1, 512]
    - [275, 16.05]
  - - [576, 1856, 1, 512]
    - [237, 20.36]
  - - [832, 1856, 1, 512]
    - [237, 24.73]
  - - [1088, 1856, 1, 512]
    - [280, 26.42]
  - - [1344, 1856, 1, 512]
    - [236, 28.37]
  - - [1600, 1856, 1, 512]
    - [237, 29.85]
  - - [1856, 1856, 1, 512]
    - [280, 30.55]
  - - [2112, 1856, 1, 512]
    - [236, 31.4]
  - - [2368, 1856, 1, 512]
    - [346, 32.01]
  - - [2624, 1856, 1, 512]
    - [237, 32.64]
  - - [2880, 1856, 1, 512]
    - [286, 33.33]
  - - [3136, 1856, 1, 512]
    - [236, 33.75]
  - - [3392, 1856, 1, 512]
    - [346, 34.67]
  - - [3648, 1856, 1, 512]
    - [327, 34.91]
  - - [3904, 1856, 1, 512]
    - [346, 35.47]
  - - [64, 2112, 1, 512]
    - [207, 5.2]
  - - [320, 2112, 1, 512]
    - [301, 16.74]
  - - [576, 2112, 1, 512]
    - [286, 22.35]
  - - [832, 2112, 1, 512]
    - [237, 24.99]
  - - [1088, 2112, 1, 512]
    - [237, 27.84]
  - - [1344, 2112, 1, 512]
    - [165, 29.36]
  - - [1600, 2112, 1, 512]
    - [165, 30.95]
  - - [1856, 2112, 1, 512]
    - [237, 31.55]
  - - [2112, 2112, 1, 512]
    - [237, 31.78]
  - - [2368, 2112, 1, 512]
    - [237, 32.76]
  - - [2624, 2112, 1, 512]
    - [280, 33.12]
  - - [2880, 2112, 1, 512]
    - [236, 33.84]
  - - [3136, 2112, 1, 512]
    - [327, 34.38]
  - - [3392, 2112, 1, 512]
    - [327, 35.88]
  - - [3648, 2112, 1, 512]
    - [327, 36.38]
  - - [3904, 2112, 1, 512]
    - [327, 37.22]
  - - [64, 2368, 1, 512]
    - [207, 5.83]
  - - [320, 2368, 1, 512]
    - [213, 18.27]
  - - [576, 2368, 1, 512]
    - [237, 22.69]
  - - [832, 2368, 1, 512]
    - [237, 26.43]
  - - [1088, 2368, 1, 512]
    - [165, 28.85]
  - - [1344, 2368, 1, 512]
    - [237, 29.82]
  - - [1600, 2368, 1, 512]
    - [237, 31.65]
  - - [1856, 2368, 1, 512]
    - [237, 32.1]
  - - [2112, 2368, 1, 512]
    - [237, 32.9]
  - - [2368, 2368, 1, 512]
    - [286, 33.26]
  - - [2624, 2368, 1, 512]
    - [346, 34.22]
  - - [2880, 2368, 1, 512]
    - [327, 35.5]
  - - [3136, 2368, 1, 512]
    - [346, 36.3]
  - - [3392, 2368, 1, 512]
    - [327, 35.97]
  - - [3648, 2368, 1, 512]
    - [327, 36.69]
  - - [3904, 2368, 1, 512]
    - [327, 37.68]
  - - [64, 2624, 1, 512]
    - [207, 6.42]
  - - [320, 2624, 1, 512]
    - [309, 18.88]
  - - [576, 2624, 1, 512]
    - [243, 24.34]
  - - [832, 2624, 1, 512]
    - [307, 27.78]
  - - [1088, 2624, 1, 512]
    - [237, 29.55]
  - - [1344, 2624, 1, 512]
    - [326, 31.32]
  - - [1600, 2624, 1, 512]
    - [326, 32.2]
  - - [1856, 2624, 1, 512]
    - [346, 32.92]
  - - [2112, 2624, 1, 512]
    - [326, 33.38]
  - - [2368, 2624, 1, 512]
    - [327, 34.52]
  - - [2624, 2624, 1, 512]
    - [346, 35.55]
  - - [2880, 2624, 1, 512]
    - [327, 35.93]
  - - [3136, 2624, 1, 512]
    - [327, 36.8]
  - - [3392, 2624, 1, 512]
    - [327, 37.55]
  - - [3648, 2624, 1, 512]
    - [327, 37.19]
  - - [3904, 2624, 1, 512]
    - [327, 38.12]
  - - [64, 2880, 1, 512]
    - [207, 7.02]
  - - [320, 2880, 1, 512]
    - [286, 19.27]
  - - [576, 2880, 1, 512]
    - [236, 24.64]
  - - [832, 2880, 1, 512]
    - [237, 27.8]
  - - [1088, 2880, 1, 512]
    - [286, 30.17]
  - - [1344, 2880, 1, 512]
    - [286, 31.64]
  - - [1600, 2880, 1, 512]
    - [286, 32.04]
  - - [1856, 2880, 1, 512]
    - [346, 33.27]
  - - [2112, 2880, 1, 512]
    - [286, 33.66]
  - - [2368, 2880, 1, 512]
    - [346, 35.29]
  - - [2624, 2880, 1, 512]
    - [327, 35.69]
  - - [2880, 2880, 1, 512]
    - [346, 36.44]
  - - [3136, 2880, 1, 512]
    - [346, 36.63]
  - - [3392, 2880, 1, 512]
    - [327, 37.59]
  - - [3648, 2880, 1, 512]
    - [327, 37.81]
  - - [3904, 2880, 1, 512]
    - [327, 39.16]
  - - [64, 3136, 1, 512]
    - [281, 7.21]
  - - [320, 3136, 1, 512]
    - [309, 20.1]
  - - [576, 3136, 1, 512]
    - [286, 25.63]
  - - [832, 3136, 1, 512]
    - [237, 28.79]
  - - [1088, 3136, 1, 512]
    - [213, 29.95]
  - - [1344, 3136, 1, 512]
    - [237, 31.75]
  - - [1600, 3136, 1, 512]
    - [237, 32.34]
  - - [1856, 3136, 1, 512]
    - [327, 33.61]
  - - [2112, 3136, 1, 512]
    - [327, 34.4]
  - - [2368, 3136, 1, 512]
    - [327, 35.54]
  - - [2624, 3136, 1, 512]
    - [327, 36.83]
  - - [2880, 3136, 1, 512]
    - [346, 37.44]
  - - [3136, 3136, 1, 512]
    - [327, 38.01]
  - - [3392, 3136, 1, 512]
    - [327, 38.23]
  - - [3648, 3136, 1, 512]
    - [327, 39.55]
  - - [3904, 3136, 1, 512]
    - [327, 40.32]
  - - [64, 3392, 1, 512]
    - [287, 8.12]
  - - [320, 3392, 1, 512]
    - [286, 21.05]
  - - [576, 3392, 1, 512]
    - [236, 26.61]
  - - [832, 3392, 1, 512]
    - [165, 29.02]
  - - [1088, 3392, 1, 512]
    - [165, 31.02]
  - - [1344, 3392, 1, 512]
    - [236, 32.21]
  - - [1600, 3392, 1, 512]
    - [346, 33.56]
  - - [1856, 3392, 1, 512]
    - [346, 34.37]
  - - [2112, 3392, 1, 512]
    - [346, 35.2]
  - - [2368, 3392, 1, 512]
    - [327, 36.32]
  - - [2624, 3392, 1, 512]
    - [346, 37.15]
  - - [2880, 3392, 1, 512]
    - [327, 37.5]
  - - [3136, 3392, 1, 512]
    - [327, 37.78]
  - - [3392, 3392, 1, 512]
    - [346, 38.89]
  - - [3648, 3392, 1, 512]
    - [327, 39.22]
  - - [3904, 3392, 1, 512]
    - [327, 40.04]
  - - [64, 3648, 1, 512]
    - [278, 8.59]
  - - [320, 3648, 1, 512]
    - [165, 21.95]
  - - [576, 3648, 1, 512]
    - [237, 26.72]
  - - [832, 3648, 1, 512]
    - [286, 29.63]
  - - [1088, 3648, 1, 512]
    - [237, 31.58]
  - - [1344, 3648, 1, 512]
    - [346, 32.95]
  - - [1600, 3648, 1, 512]
    - [236, 33.31]
  - - [1856, 3648, 1, 512]
    - [346, 35.13]
  - - [2112, 3648, 1, 512]
    - [346, 35.77]
  - - [2368, 3648, 1, 512]
    - [327, 36.47]
  - - [2624, 3648, 1, 512]
    - [327, 37.63]
  - - [2880, 3648, 1, 512]
    - [327, 38.38]
  - - [3136, 3648, 1, 512]
    - [327, 38.91]
  - - [3392, 3648, 1, 512]
    - [327, 39.58]
  - - [3648, 3648, 1, 512]
    - [327, 39.48]
  - - [3904, 3648, 1, 512]
    - [327, 40.07]
  - - [64, 3904, 1, 512]
    - [281, 9.4]
  - - [320, 3904, 1, 512]
    - [307, 22.91]
  - - [576, 3904, 1, 512]
    - [307, 27.45]
  - - [832, 3904, 1, 512]
    - [286, 30.18]
  - - [1088, 3904, 1, 512]
    - [326, 31.99]
  - - [1344, 3904, 1, 512]
    - [326, 33.55]
  - - [1600, 3904, 1, 512]
    - [326, 34.65]
  - - [1856, 3904, 1, 512]
    - [346, 35.47]
  - - [2112, 3904, 1, 512]
    - [326, 36.21]
  - - [2368, 3904, 1, 512]
    - [327, 37.09]
  - - [2624, 3904, 1, 512]
    - [327, 38.06]
  - - [2880, 3904, 1, 512]
    - [327, 38.44]
  - - [3136, 3904, 1, 512]
    - [327, 39.02]
  - - [3392, 3904, 1, 512]
    - [327, 39.77]
  - - [3648, 3904, 1, 512]
    - [327, 39.84]
  - - [3904, 3904, 1, 512]
    - [327, 39.3]
  - - [320, 64, 1, 1024]
    - [319, 1.7]
  - - [576, 64, 1, 1024]
    - [267, 2.77]
  - - [832, 64, 1, 1024]
    - [267, 4.0]
  - - [1088, 64, 1, 1024]
    - [273, 5.0]
  - - [1344, 64, 1, 1024]
    - [331, 6.09]
  - - [1600, 64, 1, 1024]
    - [159, 7.16]
  - - [1856, 64, 1, 1024]
    - [159, 8.25]
  - - [2112, 64, 1, 1024]
    - [275, 8.62]
  - - [2368, 64, 1, 1024]
    - [278, 9.63]
  - - [2624, 64, 1, 1024]
    - [278, 10.51]
  - - [2880, 64, 1, 1024]
    - [275, 11.58]
  - - [3136, 64, 1, 1024]
    - [292, 12.46]
  - - [3392, 64, 1, 1024]
    - [159, 12.96]
  - - [3648, 64, 1, 1024]
    - [278, 13.81]
  - - [3904, 64, 1, 1024]
    - [299, 14.71]
  - - [64, 320, 1, 1024]
    - [262, 1.71]
  - - [320, 320, 1, 1024]
    - [159, 7.18]
  - - [576, 320, 1, 1024]
    - [275, 11.11]
  - - [832, 320, 1, 1024]
    - [159, 13.83]
  - - [1088, 320, 1, 1024]
    - [207, 18.12]
  - - [1344, 320, 1, 1024]
    - [309, 20.23]
  - - [1600, 320, 1, 1024]
    - [275, 22.06]
  - - [1856, 320, 1, 1024]
    - [207, 23.17]
  - - [2112, 320, 1, 1024]
    - [237, 23.34]
  - - [2368, 320, 1, 1024]
    - [237, 25.34]
  - - [2624, 320, 1, 1024]
    - [310, 25.53]
  - - [2880, 320, 1, 1024]
    - [237, 26.58]
  - - [3136, 320, 1, 1024]
    - [237, 27.95]
  - - [3392, 320, 1, 1024]
    - [286, 28.36]
  - - [3648, 320, 1, 1024]
    - [237, 29.5]
  - - [3904, 320, 1, 1024]
    - [324, 29.65]
  - - [64, 576, 1, 1024]
    - [267, 2.76]
  - - [320, 576, 1, 1024]
    - [275, 11.22]
  - - [576, 576, 1, 1024]
    - [207, 17.03]
  - - [832, 576, 1, 1024]
    - [287, 20.88]
  - - [1088, 576, 1, 1024]
    - [321, 24.35]
  - - [1344, 576, 1, 1024]
    - [233, 26.66]
  - - [1600, 576, 1, 1024]
    - [233, 27.17]
  - - [1856, 576, 1, 1024]
    - [281, 28.43]
  - - [2112, 576, 1, 1024]
    - [237, 29.81]
  - - [2368, 576, 1, 1024]
    - [237, 30.84]
  - - [2624, 576, 1, 1024]
    - [236, 32.06]
  - - [2880, 576, 1, 1024]
    - [281, 32.78]
  - - [3136, 576, 1, 1024]
    - [281, 33.88]
  - - [3392, 576, 1, 1024]
    - [165, 34.56]
  - - [3648, 576, 1, 1024]
    - [237, 34.4]
  - - [3904, 576, 1, 1024]
    - [281, 34.45]
  - - [64, 832, 1, 1024]
    - [272, 3.91]
  - - [320, 832, 1, 1024]
    - [338, 13.99]
  - - [576, 832, 1, 1024]
    - [281, 20.82]
  - - [832, 832, 1, 1024]
    - [233, 24.48]
  - - [1088, 832, 1, 1024]
    - [207, 27.8]
  - - [1344, 832, 1, 1024]
    - [165, 28.89]
  - - [1600, 832, 1, 1024]
    - [165, 30.35]
  - - [1856, 832, 1, 1024]
    - [237, 32.63]
  - - [2112, 832, 1, 1024]
    - [237, 33.05]
  - - [2368, 832, 1, 1024]
    - [165, 33.59]
  - - [2624, 832, 1, 1024]
    - [207, 34.67]
  - - [2880, 832, 1, 1024]
    - [165, 35.22]
  - - [3136, 832, 1, 1024]
    - [236, 35.67]
  - - [3392, 832, 1, 1024]
    - [237, 36.26]
  - - [3648, 832, 1, 1024]
    - [237, 36.31]
  - - [3904, 832, 1, 1024]
    - [286, 37.33]
  - - [64, 1088, 1, 1024]
    - [266, 4.75]
  - - [320, 1088, 1, 1024]
    - [275, 17.68]
  - - [576, 1088, 1, 1024]
    - [142, 24.22]
  - - [832, 1088, 1, 1024]
    - [301, 28.4]
  - - [1088, 1088, 1, 1024]
    - [310, 29.85]
  - - [1344, 1088, 1, 1024]
    - [165, 30.94]
  - - [1600, 1088, 1, 1024]
    - [237, 32.91]
  - - [1856, 1088, 1, 1024]
    - [236, 33.85]
  - - [2112, 1088, 1, 1024]
    - [237, 35.13]
  - - [2368, 1088, 1, 1024]
    - [286, 36.05]
  - - [2624, 1088, 1, 1024]
    - [286, 36.8]
  - - [2880, 1088, 1, 1024]
    - [165, 37.44]
  - - [3136, 1088, 1, 1024]
    - [275, 37.39]
  - - [3392, 1088, 1, 1024]
    - [236, 37.9]
  - - [3648, 1088, 1, 1024]
    - [207, 38.31]
  - - [3904, 1088, 1, 1024]
    - [327, 39.22]
  - - [64, 1344, 1, 1024]
    - [345, 5.85]
  - - [320, 1344, 1, 1024]
    - [309, 19.15]
  - - [576, 1344, 1, 1024]
    - [142, 25.9]
  - - [832, 1344, 1, 1024]
    - [237, 29.18]
  - - [1088, 1344, 1, 1024]
    - [237, 31.35]
  - - [1344, 1344, 1, 1024]
    - [237, 33.78]
  - - [1600, 1344, 1, 1024]
    - [165, 34.47]
  - - [1856, 1344, 1, 1024]
    - [237, 35.26]
  - - [2112, 1344, 1, 1024]
    - [237, 36.76]
  - - [2368, 1344, 1, 1024]
    - [309, 36.66]
  - - [2624, 1344, 1, 1024]
    - [236, 37.68]
  - - [2880, 1344, 1, 1024]
    - [237, 38.65]
  - - [3136, 1344, 1, 1024]
    - [207, 38.47]
  - - [3392, 1344, 1, 1024]
    - [237, 38.93]
  - - [3648, 1344, 1, 1024]
    - [327, 40.44]
  - - [3904, 1344, 1, 1024]
    - [327, 40.01]
  - - [64, 1600, 1, 1024]
    - [279, 7.11]
  - - [320, 1600, 1, 1024]
    - [207, 22.9]
  - - [576, 1600, 1, 1024]
    - [310, 26.81]
  - - [832, 1600, 1, 1024]
    - [237, 30.88]
  - - [1088, 1600, 1, 1024]
    - [207, 32.91]
  - - [1344, 1600, 1, 1024]
    - [165, 34.63]
  - - [1600, 1600, 1, 1024]
    - [207, 35.8]
  - - [1856, 1600, 1, 1024]
    - [237, 36.93]
  - - [2112, 1600, 1, 1024]
    - [346, 37.67]
  - - [2368, 1600, 1, 1024]
    - [286, 38.1]
  - - [2624, 1600, 1, 1024]
    - [237, 38.67]
  - - [2880, 1600, 1, 1024]
    - [237, 39.39]
  - - [3136, 1600, 1, 1024]
    - [237, 39.8]
  - - [3392, 1600, 1, 1024]
    - [327, 41.34]
  - - [3648, 1600, 1, 1024]
    - [327, 41.54]
  - - [3904, 1600, 1, 1024]
    - [327, 40.96]
  - - [64, 1856, 1, 1024]
    - [207, 7.88]
  - - [320, 1856, 1, 1024]
    - [207, 22.72]
  - - [576, 1856, 1, 1024]
    - [207, 28.0]
  - - [832, 1856, 1, 1024]
    - [237, 32.45]
  - - [1088, 1856, 1, 1024]
    - [207, 34.01]
  - - [1344, 1856, 1, 1024]
    - [286, 34.99]
  - - [1600, 1856, 1, 1024]
    - [237, 37.09]
  - - [1856, 1856, 1, 1024]
    - [236, 37.63]
  - - [2112, 1856, 1, 1024]
    - [392, 38.56]
  - - [2368, 1856, 1, 1024]
    - [346, 39.7]
  - - [2624, 1856, 1, 1024]
    - [327, 40.23]
  - - [2880, 1856, 1, 1024]
    - [286, 39.38]
  - - [3136, 1856, 1, 1024]
    - [327, 40.87]
  - - [3392, 1856, 1, 1024]
    - [392, 40.9]
  - - [3648, 1856, 1, 1024]
    - [327, 42.73]
  - - [3904, 1856, 1, 1024]
    - [327, 42.77]
  - - [64, 2112, 1, 1024]
    - [335, 8.42]
  - - [320, 2112, 1, 1024]
    - [233, 23.1]
  - - [576, 2112, 1, 1024]
    - [207, 29.36]
  - - [832, 2112, 1, 1024]
    - [165, 32.71]
  - - [1088, 2112, 1, 1024]
    - [281, 35.29]
  - - [1344, 2112, 1, 1024]
    - [237, 36.6]
  - - [1600, 2112, 1, 1024]
    - [237, 37.71]
  - - [1856, 2112, 1, 1024]
    - [346, 38.51]
  - - [2112, 2112, 1, 1024]
    - [286, 38.62]
  - - [2368, 2112, 1, 1024]
    - [213, 39.2]
  - - [2624, 2112, 1, 1024]
    - [327, 40.5]
  - - [2880, 2112, 1, 1024]
    - [327, 41.19]
  - - [3136, 2112, 1, 1024]
    - [327, 42.16]
  - - [3392, 2112, 1, 1024]
    - [327, 42.03]
  - - [3648, 2112, 1, 1024]
    - [327, 42.96]
  - - [3904, 2112, 1, 1024]
    - [327, 43.6]
  - - [64, 2368, 1, 1024]
    - [207, 9.53]
  - - [320, 2368, 1, 1024]
    - [280, 25.67]
  - - [576, 2368, 1, 1024]
    - [237, 30.95]
  - - [832, 2368, 1, 1024]
    - [237, 33.2]
  - - [1088, 2368, 1, 1024]
    - [237, 35.73]
  - - [1344, 2368, 1, 1024]
    - [237, 37.18]
  - - [1600, 2368, 1, 1024]
    - [237, 38.59]
  - - [1856, 2368, 1, 1024]
    - [236, 38.96]
  - - [2112, 2368, 1, 1024]
    - [236, 39.62]
  - - [2368, 2368, 1, 1024]
    - [327, 39.85]
  - - [2624, 2368, 1, 1024]
    - [327, 40.9]
  - - [2880, 2368, 1, 1024]
    - [346, 41.81]
  - - [3136, 2368, 1, 1024]
    - [327, 43.45]
  - - [3392, 2368, 1, 1024]
    - [327, 42.37]
  - - [3648, 2368, 1, 1024]
    - [327, 42.11]
  - - [3904, 2368, 1, 1024]
    - [327, 43.62]
  - - [64, 2624, 1, 1024]
    - [287, 9.96]
  - - [320, 2624, 1, 1024]
    - [326, 26.29]
  - - [576, 2624, 1, 1024]
    - [237, 32.0]
  - - [832, 2624, 1, 1024]
    - [307, 35.48]
  - - [1088, 2624, 1, 1024]
    - [213, 36.45]
  - - [1344, 2624, 1, 1024]
    - [307, 38.67]
  - - [1600, 2624, 1, 1024]
    - [326, 39.19]
  - - [1856, 2624, 1, 1024]
    - [346, 40.03]
  - - [2112, 2624, 1, 1024]
    - [236, 40.07]
  - - [2368, 2624, 1, 1024]
    - [327, 41.09]
  - - [2624, 2624, 1, 1024]
    - [346, 42.98]
  - - [2880, 2624, 1, 1024]
    - [327, 42.39]
  - - [3136, 2624, 1, 1024]
    - [346, 42.85]
  - - [3392, 2624, 1, 1024]
    - [327, 44.13]
  - - [3648, 2624, 1, 1024]
    - [327, 43.67]
  - - [3904, 2624, 1, 1024]
    - [327, 44.43]
  - - [64, 2880, 1, 1024]
    - [207, 11.14]
  - - [320, 2880, 1, 1024]
    - [237, 26.34]
  - - [576, 2880, 1, 1024]
    - [236, 32.99]
  - - [832, 2880, 1, 1024]
    - [237, 35.34]
  - - [1088, 2880, 1, 1024]
    - [213, 37.1]
  - - [1344, 2880, 1, 1024]
    - [236, 38.13]
  - - [1600, 2880, 1, 1024]
    - [165, 38.83]
  - - [1856, 2880, 1, 1024]
    - [327, 40.26]
  - - [2112, 2880, 1, 1024]
    - [346, 40.35]
  - - [2368, 2880, 1, 1024]
    - [346, 42.79]
  - - [2624, 2880, 1, 1024]
    - [327, 41.95]
  - - [2880, 2880, 1, 1024]
    - [327, 43.38]
  - - [3136, 2880, 1, 1024]
    - [327, 43.12]
  - - [3392, 2880, 1, 1024]
    - [327, 43.99]
  - - [3648, 2880, 1, 1024]
    - [339, 42.88]
  - - [3904, 2880, 1, 1024]
    - [327, 44.65]
  - - [64, 3136, 1, 1024]
    - [275, 12.34]
  - - [320, 3136, 1, 1024]
    - [310, 28.21]
  - - [576, 3136, 1, 1024]
    - [237, 33.67]
  - - [832, 3136, 1, 1024]
    - [237, 36.25]
  - - [1088, 3136, 1, 1024]
    - [237, 37.79]
  - - [1344, 3136, 1, 1024]
    - [207, 38.34]
  - - [1600, 3136, 1, 1024]
    - [237, 39.8]
  - - [1856, 3136, 1, 1024]
    - [346, 40.86]
  - - [2112, 3136, 1, 1024]
    - [327, 41.67]
  - - [2368, 3136, 1, 1024]
    - [327, 42.47]
  - - [2624, 3136, 1, 1024]
    - [327, 43.6]
  - - [2880, 3136, 1, 1024]
    - [346, 43.58]
  - - [3136, 3136, 1, 1024]
    - [327, 45.55]
  - - [3392, 3136, 1, 1024]
    - [327, 43.57]
  - - [3648, 3136, 1, 1024]
    - [339, 44.94]
  - - [3904, 3136, 1, 1024]
    - [339, 44.69]
  - - [64, 3392, 1, 1024]
    - [207, 13.1]
  - - [320, 3392, 1, 1024]
    - [275, 28.94]
  - - [576, 3392, 1, 1024]
    - [165, 35.0]
  - - [832, 3392, 1, 1024]
    - [237, 36.57]
  - - [1088, 3392, 1, 1024]
    - [237, 37.64]
  - - [1344, 3392, 1, 1024]
    - [236, 38.93]
  - - [1600, 3392, 1, 1024]
    - [327, 41.46]
  - - [1856, 3392, 1, 1024]
    - [346, 41.17]
  - - [2112, 3392, 1, 1024]
    - [327, 41.94]
  - - [2368, 3392, 1, 1024]
    - [327, 41.85]
  - - [2624, 3392, 1, 1024]
    - [327, 44.34]
  - - [2880, 3392, 1, 1024]
    - [327, 43.96]
  - - [3136, 3392, 1, 1024]
    - [339, 44.62]
  - - [3392, 3392, 1, 1024]
    - [346, 44.45]
  - - [3648, 3392, 1, 1024]
    - [339, 44.81]
  - - [3904, 3392, 1, 1024]
    - [327, 44.52]
  - - [64, 3648, 1, 1024]
    - [281, 14.4]
  - - [320, 3648, 1, 1024]
    - [286, 30.36]
  - - [576, 3648, 1, 1024]
    - [286, 34.03]
  - - [832, 3648, 1, 1024]
    - [207, 37.26]
  - - [1088, 3648, 1, 1024]
    - [237, 38.09]
  - - [1344, 3648, 1, 1024]
    - [346, 40.64]
  - - [1600, 3648, 1, 1024]
    - [327, 40.04]
  - - [1856, 3648, 1, 1024]
    - [346, 41.54]
  - - [2112, 3648, 1, 1024]
    - [327, 42.22]
  - - [2368, 3648, 1, 1024]
    - [327, 42.2]
  - - [2624, 3648, 1, 1024]
    - [327, 43.75]
  - - [2880, 3648, 1, 1024]
    - [327, 44.78]
  - - [3136, 3648, 1, 1024]
    - [339, 44.54]
  - - [3392, 3648, 1, 1024]
    - [327, 44.45]
  - - [3648, 3648, 1, 1024]
    - [339, 44.83]
  - - [3904, 3648, 1, 1024]
    - [339, 44.55]
  - - [64, 3904, 1, 1024]
    - [207, 15.23]
  - - [320, 3904, 1, 1024]
    - [310, 31.65]
  - - [576, 3904, 1, 1024]
    - [309, 34.94]
  - - [832, 3904, 1, 1024]
    - [326, 37.77]
  - - [1088, 3904, 1, 1024]
    - [309, 39.24]
  - - [1344, 3904, 1, 1024]
    - [309, 39.96]
  - - [1600, 3904, 1, 1024]
    - [346, 41.74]
  - - [1856, 3904, 1, 1024]
    - [327, 42.42]
  - - [2112, 3904, 1, 1024]
    - [327, 43.26]
  - - [2368, 3904, 1, 1024]
    - [327, 44.12]
  - - [2624, 3904, 1, 1024]
    - [327, 44.12]
  - - [2880, 3904, 1, 1024]
    - [327, 44.38]
  - - [3136, 3904, 1, 1024]
    - [327, 44.39]
  - - [3392, 3904, 1, 1024]
    - [327, 44.41]
  - - [3648, 3904, 1, 1024]
    - [339, 45.17]
  - - [3904, 3904, 1, 1024]
    - [339, 45.65]
  - - [320, 64, 1, 2048]
    - [267, 2.79]
  - - [576, 64, 1, 2048]
    - [267, 4.76]
  - - [832, 64, 1, 2048]
    - [267, 6.66]
  - - [1088, 64, 1, 2048]
    - [366, 7.83]
  - - [1344, 64, 1, 2048]
    - [366, 9.52]
  - - [1600, 64, 1, 2048]
    - [159, 10.76]
  - - [1856, 64, 1, 2048]
    - [281, 11.84]
  - - [2112, 64, 1, 2048]
    - [159, 12.49]
  - - [2368, 64, 1, 2048]
    - [335, 13.82]
  - - [2624, 64, 1, 2048]
    - [281, 15.64]
  - - [2880, 64, 1, 2048]
    - [278, 16.91]
  - - [3136, 64, 1, 2048]
    - [159, 17.86]
  - - [3392, 64, 1, 2048]
    - [281, 19.38]
  - - [3648, 64, 1, 2048]
    - [281, 20.67]
  - - [3904, 64, 1, 2048]
    - [278, 21.31]
  - - [64, 320, 1, 2048]
    - [315, 2.74]
  - - [320, 320, 1, 2048]
    - [159, 10.69]
  - - [576, 320, 1, 2048]
    - [159, 16.63]
  - - [832, 320, 1, 2048]
    - [335, 19.59]
  - - [1088, 320, 1, 2048]
    - [207, 24.89]
  - - [1344, 320, 1, 2048]
    - [309, 27.46]
  - - [1600, 320, 1, 2048]
    - [281, 30.24]
  - - [1856, 320, 1, 2048]
    - [281, 30.16]
  - - [2112, 320, 1, 2048]
    - [275, 29.11]
  - - [2368, 320, 1, 2048]
    - [165, 32.52]
  - - [2624, 320, 1, 2048]
    - [159, 33.1]
  - - [2880, 320, 1, 2048]
    - [207, 33.15]
  - - [3136, 320, 1, 2048]
    - [207, 35.31]
  - - [3392, 320, 1, 2048]
    - [281, 35.28]
  - - [3648, 320, 1, 2048]
    - [165, 37.02]
  - - [3904, 320, 1, 2048]
    - [342, 37.36]
  - - [64, 576, 1, 2048]
    - [272, 4.51]
  - - [320, 576, 1, 2048]
    - [281, 17.04]
  - - [576, 576, 1, 2048]
    - [281, 23.6]
  - - [832, 576, 1, 2048]
    - [142, 28.44]
  - - [1088, 576, 1, 2048]
    - [207, 31.58]
  - - [1344, 576, 1, 2048]
    - [142, 34.72]
  - - [1600, 576, 1, 2048]
    - [233, 35.49]
  - - [1856, 576, 1, 2048]
    - [207, 34.71]
  - - [2112, 576, 1, 2048]
    - [292, 35.92]
  - - [2368, 576, 1, 2048]
    - [237, 36.87]
  - - [2624, 576, 1, 2048]
    - [207, 38.12]
  - - [2880, 576, 1, 2048]
    - [207, 39.1]
  - - [3136, 576, 1, 2048]
    - [237, 39.44]
  - - [3392, 576, 1, 2048]
    - [159, 39.41]
  - - [3648, 576, 1, 2048]
    - [207, 39.83]
  - - [3904, 576, 1, 2048]
    - [281, 40.84]
  - - [64, 832, 1, 2048]
    - [323, 6.36]
  - - [320, 832, 1, 2048]
    - [335, 19.76]
  - - [576, 832, 1, 2048]
    - [207, 28.99]
  - - [832, 832, 1, 2048]
    - [142, 32.2]
  - - [1088, 832, 1, 2048]
    - [281, 35.48]
  - - [1344, 832, 1, 2048]
    - [281, 36.4]
  - - [1600, 832, 1, 2048]
    - [165, 36.13]
  - - [1856, 832, 1, 2048]
    - [237, 38.74]
  - - [2112, 832, 1, 2048]
    - [207, 39.56]
  - - [2368, 832, 1, 2048]
    - [207, 39.39]
  - - [2624, 832, 1, 2048]
    - [207, 40.04]
  - - [2880, 832, 1, 2048]
    - [207, 40.77]
  - - [3136, 832, 1, 2048]
    - [207, 41.42]
  - - [3392, 832, 1, 2048]
    - [207, 41.04]
  - - [3648, 832, 1, 2048]
    - [159, 41.39]
  - - [3904, 832, 1, 2048]
    - [207, 42.11]
  - - [64, 1088, 1, 2048]
    - [345, 7.56]
  - - [320, 1088, 1, 2048]
    - [337, 25.03]
  - - [576, 1088, 1, 2048]
    - [142, 32.3]
  - - [832, 1088, 1, 2048]
    - [301, 36.4]
  - - [1088, 1088, 1, 2048]
    - [326, 35.88]
  - - [1344, 1088, 1, 2048]
    - [292, 37.1]
  - - [1600, 1088, 1, 2048]
    - [287, 38.76]
  - - [1856, 1088, 1, 2048]
    - [159, 39.45]
  - - [2112, 1088, 1, 2048]
    - [207, 40.82]
  - - [2368, 1088, 1, 2048]
    - [375, 40.32]
  - - [2624, 1088, 1, 2048]
    - [275, 41.44]
  - - [2880, 1088, 1, 2048]
    - [287, 41.82]
  - - [3136, 1088, 1, 2048]
    - [207, 42.01]
  - - [3392, 1088, 1, 2048]
    - [327, 42.9]
  - - [3648, 1088, 1, 2048]
    - [373, 41.42]
  - - [3904, 1088, 1, 2048]
    - [327, 43.98]
  - - [64, 1344, 1, 2048]
    - [345, 9.11]
  - - [320, 1344, 1, 2048]
    - [321, 26.29]
  - - [576, 1344, 1, 2048]
    - [301, 34.09]
  - - [832, 1344, 1, 2048]
    - [281, 36.26]
  - - [1088, 1344, 1, 2048]
    - [207, 36.96]
  - - [1344, 1344, 1, 2048]
    - [299, 39.96]
  - - [1600, 1344, 1, 2048]
    - [207, 40.42]
  - - [1856, 1344, 1, 2048]
    - [310, 41.47]
  - - [2112, 1344, 1, 2048]
    - [327, 41.45]
  - - [2368, 1344, 1, 2048]
    - [207, 41.94]
  - - [2624, 1344, 1, 2048]
    - [322, 42.38]
  - - [2880, 1344, 1, 2048]
    - [327, 43.78]
  - - [3136, 1344, 1, 2048]
    - [327, 43.02]
  - - [3392, 1344, 1, 2048]
    - [327, 42.54]
  - - [3648, 1344, 1, 2048]
    - [327, 45.26]
  - - [3904, 1344, 1, 2048]
    - [327, 44.2]
  - - [64, 1600, 1, 2048]
    - [159, 11.1]
  - - [320, 1600, 1, 2048]
    - [207, 30.19]
  - - [576, 1600, 1, 2048]
    - [233, 34.11]
  - - [832, 1600, 1, 2048]
    - [237, 36.95]
  - - [1088, 1600, 1, 2048]
    - [299, 39.07]
  - - [1344, 1600, 1, 2048]
    - [159, 40.39]
  - - [1600, 1600, 1, 2048]
    - [281, 40.57]
  - - [1856, 1600, 1, 2048]
    - [207, 41.16]
  - - [2112, 1600, 1, 2048]
    - [327, 43.61]
  - - [2368, 1600, 1, 2048]
    - [327, 43.02]
  - - [2624, 1600, 1, 2048]
    - [327, 43.41]
  - - [2880, 1600, 1, 2048]
    - [346, 42.41]
  - - [3136, 1600, 1, 2048]
    - [327, 42.02]
  - - [3392, 1600, 1, 2048]
    - [327, 45.95]
  - - [3648, 1600, 1, 2048]
    - [339, 45.67]
  - - [3904, 1600, 1, 2048]
    - [346, 45.0]
  - - [64, 1856, 1, 2048]
    - [159, 12.31]
  - - [320, 1856, 1, 2048]
    - [275, 30.0]
  - - [576, 1856, 1, 2048]
    - [207, 35.2]
  - - [832, 1856, 1, 2048]
    - [287, 39.21]
  - - [1088, 1856, 1, 2048]
    - [281, 40.01]
  - - [1344, 1856, 1, 2048]
    - [341, 40.56]
  - - [1600, 1856, 1, 2048]
    - [281, 41.52]
  - - [1856, 1856, 1, 2048]
    - [237, 42.04]
  - - [2112, 1856, 1, 2048]
    - [346, 43.83]
  - - [2368, 1856, 1, 2048]
    - [327, 44.54]
  - - [2624, 1856, 1, 2048]
    - [327, 45.31]
  - - [2880, 1856, 1, 2048]
    - [346, 44.31]
  - - [3136, 1856, 1, 2048]
    - [346, 45.42]
  - - [3392, 1856, 1, 2048]
    - [339, 45.7]
  - - [3648, 1856, 1, 2048]
    - [327, 46.3]
  - - [3904, 1856, 1, 2048]
    - [327, 46.04]
  - - [64, 2112, 1, 2048]
    - [207, 12.42]
  - - [320, 2112, 1, 2048]
    - [301, 29.85]
  - - [576, 2112, 1, 2048]
    - [281, 36.0]
  - - [832, 2112, 1, 2048]
    - [281, 39.65]
  - - [1088, 2112, 1, 2048]
    - [207, 40.69]
  - - [1344, 2112, 1, 2048]
    - [287, 41.18]
  - - [1600, 2112, 1, 2048]
    - [327, 42.49]
  - - [1856, 2112, 1, 2048]
    - [346, 43.81]
  - - [2112, 2112, 1, 2048]
    - [327, 42.08]
  - - [2368, 2112, 1, 2048]
    - [327, 43.16]
  - - [2624, 2112, 1, 2048]
    - [410, 43.81]
  - - [2880, 2112, 1, 2048]
    - [346, 44.49]
  - - [3136, 2112, 1, 2048]
    - [327, 45.9]
  - - [3392, 2112, 1, 2048]
    - [327, 46.35]
  - - [3648, 2112, 1, 2048]
    - [339, 45.72]
  - - [3904, 2112, 1, 2048]
    - [339, 47.71]
  - - [64, 2368, 1, 2048]
    - [287, 14.17]
  - - [320, 2368, 1, 2048]
    - [159, 33.0]
  - - [576, 2368, 1, 2048]
    - [281, 37.4]
  - - [832, 2368, 1, 2048]
    - [207, 39.97]
  - - [1088, 2368, 1, 2048]
    - [159, 41.13]
  - - [1344, 2368, 1, 2048]
    - [159, 42.09]
  - - [1600, 2368, 1, 2048]
    - [327, 43.45]
  - - [1856, 2368, 1, 2048]
    - [346, 44.32]
  - - [2112, 2368, 1, 2048]
    - [339, 42.05]
  - - [2368, 2368, 1, 2048]
    - [327, 43.97]
  - - [2624, 2368, 1, 2048]
    - [327, 45.27]
  - - [2880, 2368, 1, 2048]
    - [346, 45.82]
  - - [3136, 2368, 1, 2048]
    - [327, 47.89]
  - - [3392, 2368, 1, 2048]
    - [327, 46.3]
  - - [3648, 2368, 1, 2048]
    - [327, 45.48]
  - - [3904, 2368, 1, 2048]
    - [327, 46.7]
  - - [64, 2624, 1, 2048]
    - [287, 15.14]
  - - [320, 2624, 1, 2048]
    - [281, 33.05]
  - - [576, 2624, 1, 2048]
    - [370, 38.62]
  - - [832, 2624, 1, 2048]
    - [307, 41.4]
  - - [1088, 2624, 1, 2048]
    - [207, 41.58]
  - - [1344, 2624, 1, 2048]
    - [378, 43.14]
  - - [1600, 2624, 1, 2048]
    - [326, 44.07]
  - - [1856, 2624, 1, 2048]
    - [346, 44.94]
  - - [2112, 2624, 1, 2048]
    - [378, 45.07]
  - - [2368, 2624, 1, 2048]
    - [327, 44.87]
  - - [2624, 2624, 1, 2048]
    - [392, 46.61]
  - - [2880, 2624, 1, 2048]
    - [372, 45.97]
  - - [3136, 2624, 1, 2048]
    - [339, 46.95]
  - - [3392, 2624, 1, 2048]
    - [339, 48.42]
  - - [3648, 2624, 1, 2048]
    - [327, 47.89]
  - - [3904, 2624, 1, 2048]
    - [339, 47.81]
  - - [64, 2880, 1, 2048]
    - [207, 17.1]
  - - [320, 2880, 1, 2048]
    - [281, 33.54]
  - - [576, 2880, 1, 2048]
    - [165, 39.17]
  - - [832, 2880, 1, 2048]
    - [281, 41.41]
  - - [1088, 2880, 1, 2048]
    - [207, 42.41]
  - - [1344, 2880, 1, 2048]
    - [346, 42.96]
  - - [1600, 2880, 1, 2048]
    - [346, 42.77]
  - - [1856, 2880, 1, 2048]
    - [346, 45.09]
  - - [2112, 2880, 1, 2048]
    - [346, 44.51]
  - - [2368, 2880, 1, 2048]
    - [327, 46.38]
  - - [2624, 2880, 1, 2048]
    - [327, 45.64]
  - - [2880, 2880, 1, 2048]
    - [346, 46.62]
  - - [3136, 2880, 1, 2048]
    - [346, 47.39]
  - - [3392, 2880, 1, 2048]
    - [392, 47.49]
  - - [3648, 2880, 1, 2048]
    - [339, 49.17]
  - - [3904, 2880, 1, 2048]
    - [392, 48.54]
  - - [64, 3136, 1, 2048]
    - [281, 17.99]
  - - [320, 3136, 1, 2048]
    - [207, 35.85]
  - - [576, 3136, 1, 2048]
    - [237, 39.57]
  - - [832, 3136, 1, 2048]
    - [375, 40.84]
  - - [1088, 3136, 1, 2048]
    - [286, 41.34]
  - - [1344, 3136, 1, 2048]
    - [327, 42.85]
  - - [1600, 3136, 1, 2048]
    - [339, 43.13]
  - - [1856, 3136, 1, 2048]
    - [327, 45.76]
  - - [2112, 3136, 1, 2048]
    - [339, 45.27]
  - - [2368, 3136, 1, 2048]
    - [346, 47.06]
  - - [2624, 3136, 1, 2048]
    - [327, 46.65]
  - - [2880, 3136, 1, 2048]
    - [339, 48.58]
  - - [3136, 3136, 1, 2048]
    - [339, 49.13]
  - - [3392, 3136, 1, 2048]
    - [339, 48.58]
  - - [3648, 3136, 1, 2048]
    - [392, 48.31]
  - - [3904, 3136, 1, 2048]
    - [327, 48.74]
  - - [64, 3392, 1, 2048]
    - [287, 19.3]
  - - [320, 3392, 1, 2048]
    - [207, 35.29]
  - - [576, 3392, 1, 2048]
    - [281, 40.34]
  - - [832, 3392, 1, 2048]
    - [207, 41.43]
  - - [1088, 3392, 1, 2048]
    - [327, 42.3]
  - - [1344, 3392, 1, 2048]
    - [327, 42.47]
  - - [1600, 3392, 1, 2048]
    - [327, 46.14]
  - - [1856, 3392, 1, 2048]
    - [346, 45.98]
  - - [2112, 3392, 1, 2048]
    - [346, 45.48]
  - - [2368, 3392, 1, 2048]
    - [339, 45.79]
  - - [2624, 3392, 1, 2048]
    - [392, 47.76]
  - - [2880, 3392, 1, 2048]
    - [339, 48.15]
  - - [3136, 3392, 1, 2048]
    - [339, 47.83]
  - - [3392, 3392, 1, 2048]
    - [339, 49.14]
  - - [3648, 3392, 1, 2048]
    - [327, 48.2]
  - - [3904, 3392, 1, 2048]
    - [339, 49.27]
  - - [64, 3648, 1, 2048]
    - [207, 21.3]
  - - [320, 3648, 1, 2048]
    - [237, 37.25]
  - - [576, 3648, 1, 2048]
    - [275, 39.84]
  - - [832, 3648, 1, 2048]
    - [207, 41.61]
  - - [1088, 3648, 1, 2048]
    - [287, 42.45]
  - - [1344, 3648, 1, 2048]
    - [327, 45.19]
  - - [1600, 3648, 1, 2048]
    - [392, 44.46]
  - - [1856, 3648, 1, 2048]
    - [327, 45.41]
  - - [2112, 3648, 1, 2048]
    - [339, 45.97]
  - - [2368, 3648, 1, 2048]
    - [339, 46.23]
  - - [2624, 3648, 1, 2048]
    - [339, 47.74]
  - - [2880, 3648, 1, 2048]
    - [339, 48.46]
  - - [3136, 3648, 1, 2048]
    - [392, 48.13]
  - - [3392, 3648, 1, 2048]
    - [392, 48.77]
  - - [3648, 3648, 1, 2048]
    - [346, 47.16]
  - - [3904, 3648, 1, 2048]
    - [339, 47.83]
  - - [64, 3904, 1, 2048]
    - [287, 22.08]
  - - [320, 3904, 1, 2048]
    - [326, 37.48]
  - - [576, 3904, 1, 2048]
    - [281, 40.46]
  - - [832, 3904, 1, 2048]
    - [165, 42.47]
  - - [1088, 3904, 1, 2048]
    - [327, 43.32]
  - - [1344, 3904, 1, 2048]
    - [346, 44.44]
  - - [1600, 3904, 1, 2048]
    - [346, 45.41]
  - - [1856, 3904, 1, 2048]
    - [346, 46.13]
  - - [2112, 3904, 1, 2048]
    - [327, 47.15]
  - - [2368, 3904, 1, 2048]
    - [327, 47.49]
  - - [2624, 3904, 1, 2048]
    - [339, 48.21]
  - - [2880, 3904, 1, 2048]
    - [339, 48.62]
  - - [3136, 3904, 1, 2048]
    - [392, 48.88]
  - - [3392, 3904, 1, 2048]
    - [327, 48.13]
  - - [3648, 3904, 1, 2048]
    - [327, 48.42]
  - - [3904, 3904, 1, 2048]
    - [327, 48.65]
  - - [320, 64, 1, 4096]
    - [315, 4.13]
  - - [576, 64, 1, 4096]
    - [267, 6.98]
  - - [832, 64, 1, 4096]
    - [267, 9.73]
  - - [1088, 64, 1, 4096]
    - [270, 10.79]
  - - [1344, 64, 1, 4096]
    - [343, 12.8]
  - - [1600, 64, 1, 4096]
    - [159, 14.0]
  - - [1856, 64, 1, 4096]
    - [281, 16.28]
  - - [2112, 64, 1, 4096]
    - [281, 16.59]
  - - [2368, 64, 1, 4096]
    - [159, 18.32]
  - - [2624, 64, 1, 4096]
    - [278, 20.43]
  - - [2880, 64, 1, 4096]
    - [278, 22.18]
  - - [3136, 64, 1, 4096]
    - [281, 24.17]
  - - [3392, 64, 1, 4096]
    - [275, 25.63]
  - - [3648, 64, 1, 4096]
    - [281, 27.93]
  - - [3904, 64, 1, 4096]
    - [278, 28.97]
  - - [64, 320, 1, 4096]
    - [267, 4.05]
  - - [320, 320, 1, 4096]
    - [159, 15.28]
  - - [576, 320, 1, 4096]
    - [281, 22.46]
  - - [832, 320, 1, 4096]
    - [207, 25.3]
  - - [1088, 320, 1, 4096]
    - [299, 31.84]
  - - [1344, 320, 1, 4096]
    - [309, 34.24]
  - - [1600, 320, 1, 4096]
    - [299, 36.77]
  - - [1856, 320, 1, 4096]
    - [281, 35.92]
  - - [2112, 320, 1, 4096]
    - [237, 34.2]
  - - [2368, 320, 1, 4096]
    - [237, 37.8]
  - - [2624, 320, 1, 4096]
    - [287, 38.72]
  - - [2880, 320, 1, 4096]
    - [335, 38.09]
  - - [3136, 320, 1, 4096]
    - [374, 40.28]
  - - [3392, 320, 1, 4096]
    - [281, 40.16]
  - - [3648, 320, 1, 4096]
    - [373, 41.44]
  - - [3904, 320, 1, 4096]
    - [342, 42.55]
  - - [64, 576, 1, 4096]
    - [267, 6.64]
  - - [320, 576, 1, 4096]
    - [159, 22.24]
  - - [576, 576, 1, 4096]
    - [207, 30.65]
  - - [832, 576, 1, 4096]
    - [335, 34.61]
  - - [1088, 576, 1, 4096]
    - [142, 37.99]
  - - [1344, 576, 1, 4096]
    - [142, 40.19]
  - - [1600, 576, 1, 4096]
    - [233, 40.69]
  - - [1856, 576, 1, 4096]
    - [335, 39.73]
  - - [2112, 576, 1, 4096]
    - [281, 41.14]
  - - [2368, 576, 1, 4096]
    - [376, 41.19]
  - - [2624, 576, 1, 4096]
    - [281, 42.25]
  - - [2880, 576, 1, 4096]
    - [373, 42.35]
  - - [3136, 576, 1, 4096]
    - [207, 43.57]
  - - [3392, 576, 1, 4096]
    - [237, 43.68]
  - - [3648, 576, 1, 4096]
    - [207, 42.8]
  - - [3904, 576, 1, 4096]
    - [324, 43.58]
  - - [64, 832, 1, 4096]
    - [263, 8.13]
  - - [320, 832, 1, 4096]
    - [207, 25.01]
  - - [576, 832, 1, 4096]
    - [281, 34.79]
  - - [832, 832, 1, 4096]
    - [321, 37.29]
  - - [1088, 832, 1, 4096]
    - [281, 41.45]
  - - [1344, 832, 1, 4096]
    - [207, 40.91]
  - - [1600, 832, 1, 4096]
    - [281, 40.9]
  - - [1856, 832, 1, 4096]
    - [287, 42.13]
  - - [2112, 832, 1, 4096]
    - [207, 43.24]
  - - [2368, 832, 1, 4096]
    - [287, 42.95]
  - - [2624, 832, 1, 4096]
    - [322, 43.64]
  - - [2880, 832, 1, 4096]
    - [278, 43.32]
  - - [3136, 832, 1, 4096]
    - [278, 43.56]
  - - [3392, 832, 1, 4096]
    - [327, 43.99]
  - - [3648, 832, 1, 4096]
    - [287, 43.26]
  - - [3904, 832, 1, 4096]
    - [324, 45.02]
  - - [64, 1088, 1, 4096]
    - [159, 10.24]
  - - [320, 1088, 1, 4096]
    - [281, 32.15]
  - - [576, 1088, 1, 4096]
    - [142, 38.5]
  - - [832, 1088, 1, 4096]
    - [301, 41.99]
  - - [1088, 1088, 1, 4096]
    - [307, 41.14]
  - - [1344, 1088, 1, 4096]
    - [278, 41.33]
  - - [1600, 1088, 1, 4096]
    - [373, 41.94]
  - - [1856, 1088, 1, 4096]
    - [281, 43.58]
  - - [2112, 1088, 1, 4096]
    - [165, 43.1]
  - - [2368, 1088, 1, 4096]
    - [207, 42.86]
  - - [2624, 1088, 1, 4096]
    - [327, 45.34]
  - - [2880, 1088, 1, 4096]
    - [287, 43.81]
  - - [3136, 1088, 1, 4096]
    - [378, 44.11]
  - - [3392, 1088, 1, 4096]
    - [327, 45.78]
  - - [3648, 1088, 1, 4096]
    - [165, 44.31]
  - - [3904, 1088, 1, 4096]
    - [339, 46.61]
  - - [64, 1344, 1, 4096]
    - [159, 12.54]
  - - [320, 1344, 1, 4096]
    - [326, 31.78]
  - - [576, 1344, 1, 4096]
    - [281, 39.16]
  - - [832, 1344, 1, 4096]
    - [281, 40.58]
  - - [1088, 1344, 1, 4096]
    - [287, 41.53]
  - - [1344, 1344, 1, 4096]
    - [165, 43.28]
  - - [1600, 1344, 1, 4096]
    - [237, 43.19]
  - - [1856, 1344, 1, 4096]
    - [310, 44.42]
  - - [2112, 1344, 1, 4096]
    - [327, 44.52]
  - - [2368, 1344, 1, 4096]
    - [378, 44.43]
  - - [2624, 1344, 1, 4096]
    - [393, 45.65]
  - - [2880, 1344, 1, 4096]
    - [339, 46.74]
  - - [3136, 1344, 1, 4096]
    - [346, 46.01]
  - - [3392, 1344, 1, 4096]
    - [327, 45.5]
  - - [3648, 1344, 1, 4096]
    - [327, 48.1]
  - - [3904, 1344, 1, 4096]
    - [327, 47.89]
  - - [64, 1600, 1, 4096]
    - [337, 14.5]
  - - [320, 1600, 1, 4096]
    - [281, 37.16]
  - - [576, 1600, 1, 4096]
    - [301, 39.1]
  - - [832, 1600, 1, 4096]
    - [337, 40.45]
  - - [1088, 1600, 1, 4096]
    - [159, 42.64]
  - - [1344, 1600, 1, 4096]
    - [299, 42.94]
  - - [1600, 1600, 1, 4096]
    - [281, 42.69]
  - - [1856, 1600, 1, 4096]
    - [278, 42.94]
  - - [2112, 1600, 1, 4096]
    - [327, 46.01]
  - - [2368, 1600, 1, 4096]
    - [346, 45.58]
  - - [2624, 1600, 1, 4096]
    - [324, 46.03]
  - - [2880, 1600, 1, 4096]
    - [327, 46.43]
  - - [3136, 1600, 1, 4096]
    - [327, 46.11]
  - - [3392, 1600, 1, 4096]
    - [339, 48.61]
  - - [3648, 1600, 1, 4096]
    - [327, 48.51]
  - - [3904, 1600, 1, 4096]
    - [392, 48.63]
  - - [64, 1856, 1, 4096]
    - [159, 17.4]
  - - [320, 1856, 1, 4096]
    - [281, 36.29]
  - - [576, 1856, 1, 4096]
    - [281, 40.19]
  - - [832, 1856, 1, 4096]
    - [286, 41.98]
  - - [1088, 1856, 1, 4096]
    - [281, 43.5]
  - - [1344, 1856, 1, 4096]
    - [324, 43.76]
  - - [1600, 1856, 1, 4096]
    - [165, 43.93]
  - - [1856, 1856, 1, 4096]
    - [207, 43.51]
  - - [2112, 1856, 1, 4096]
    - [346, 47.12]
  - - [2368, 1856, 1, 4096]
    - [339, 47.24]
  - - [2624, 1856, 1, 4096]
    - [339, 48.22]
  - - [2880, 1856, 1, 4096]
    - [392, 47.99]
  - - [3136, 1856, 1, 4096]
    - [392, 48.52]
  - - [3392, 1856, 1, 4096]
    - [339, 48.74]
  - - [3648, 1856, 1, 4096]
    - [392, 48.74]
  - - [3904, 1856, 1, 4096]
    - [392, 49.22]
  - - [64, 2112, 1, 4096]
    - [333, 16.65]
  - - [320, 2112, 1, 4096]
    - [301, 35.88]
  - - [576, 2112, 1, 4096]
    - [207, 40.67]
  - - [832, 2112, 1, 4096]
    - [207, 43.02]
  - - [1088, 2112, 1, 4096]
    - [299, 43.4]
  - - [1344, 2112, 1, 4096]
    - [327, 44.94]
  - - [1600, 2112, 1, 4096]
    - [339, 45.68]
  - - [1856, 2112, 1, 4096]
    - [327, 47.47]
  - - [2112, 2112, 1, 4096]
    - [346, 45.24]
  - - [2368, 2112, 1, 4096]
    - [327, 46.09]
  - - [2624, 2112, 1, 4096]
    - [327, 47.44]
  - - [2880, 2112, 1, 4096]
    - [339, 47.23]
  - - [3136, 2112, 1, 4096]
    - [327, 48.47]
  - - [3392, 2112, 1, 4096]
    - [346, 48.65]
  - - [3648, 2112, 1, 4096]
    - [327, 48.87]
  - - [3904, 2112, 1, 4096]
    - [392, 49.88]
  - - [64, 2368, 1, 4096]
    - [337, 18.61]
  - - [320, 2368, 1, 4096]
    - [159, 38.08]
  - - [576, 2368, 1, 4096]
    - [281, 42.13]
  - - [832, 2368, 1, 4096]
    - [207, 42.92]
  - - [1088, 2368, 1, 4096]
    - [281, 43.04]
  - - [1344, 2368, 1, 4096]
    - [341, 43.95]
  - - [1600, 2368, 1, 4096]
    - [327, 46.6]
  - - [1856, 2368, 1, 4096]
    - [346, 47.29]
  - - [2112, 2368, 1, 4096]
    - [339, 45.61]
  - - [2368, 2368, 1, 4096]
    - [327, 47.3]
  - - [2624, 2368, 1, 4096]
    - [392, 48.25]
  - - [2880, 2368, 1, 4096]
    - [339, 49.22]
  - - [3136, 2368, 1, 4096]
    - [327, 49.44]
  - - [3392, 2368, 1, 4096]
    - [339, 48.93]
  - - [3648, 2368, 1, 4096]
    - [339, 49.5]
  - - [3904, 2368, 1, 4096]
    - [327, 49.28]
  - - [64, 2624, 1, 4096]
    - [207, 20.65]
  - - [320, 2624, 1, 4096]
    - [281, 38.48]
  - - [576, 2624, 1, 4096]
    - [243, 43.09]
  - - [832, 2624, 1, 4096]
    - [378, 44.69]
  - - [1088, 2624, 1, 4096]
    - [327, 45.18]
  - - [1344, 2624, 1, 4096]
    - [310, 46.83]
  - - [1600, 2624, 1, 4096]
    - [378, 45.7]
  - - [1856, 2624, 1, 4096]
    - [346, 47.85]
  - - [2112, 2624, 1, 4096]
    - [346, 46.65]
  - - [2368, 2624, 1, 4096]
    - [339, 48.28]
  - - [2624, 2624, 1, 4096]
    - [327, 49.19]
  - - [2880, 2624, 1, 4096]
    - [339, 48.27]
  - - [3136, 2624, 1, 4096]
    - [339, 50.07]
  - - [3392, 2624, 1, 4096]
    - [327, 50.69]
  - - [3648, 2624, 1, 4096]
    - [339, 48.64]
  - - [3904, 2624, 1, 4096]
    - [346, 49.45]
  - - [64, 2880, 1, 4096]
    - [337, 22.11]
  - - [320, 2880, 1, 4096]
    - [207, 38.71]
  - - [576, 2880, 1, 4096]
    - [287, 42.65]
  - - [832, 2880, 1, 4096]
    - [287, 42.18]
  - - [1088, 2880, 1, 4096]
    - [341, 43.39]
  - - [1344, 2880, 1, 4096]
    - [327, 47.09]
  - - [1600, 2880, 1, 4096]
    - [339, 46.01]
  - - [1856, 2880, 1, 4096]
    - [346, 47.98]
  - - [2112, 2880, 1, 4096]
    - [346, 47.76]
  - - [2368, 2880, 1, 4096]
    - [327, 49.1]
  - - [2624, 2880, 1, 4096]
    - [339, 48.59]
  - - [2880, 2880, 1, 4096]
    - [327, 48.85]
  - - [3136, 2880, 1, 4096]
    - [346, 49.33]
  - - [3392, 2880, 1, 4096]
    - [339, 49.18]
  - - [3648, 2880, 1, 4096]
    - [327, 50.23]
  - - [3904, 2880, 1, 4096]
    - [327, 49.33]
  - - [64, 3136, 1, 4096]
    - [207, 24.72]
  - - [320, 3136, 1, 4096]
    - [281, 40.8]
  - - [576, 3136, 1, 4096]
    - [278, 43.12]
  - - [832, 3136, 1, 4096]
    - [281, 43.22]
  - - [1088, 3136, 1, 4096]
    - [410, 43.68]
  - - [1344, 3136, 1, 4096]
    - [327, 46.05]
  - - [1600, 3136, 1, 4096]
    - [346, 46.13]
  - - [1856, 3136, 1, 4096]
    - [339, 48.71]
  - - [2112, 3136, 1, 4096]
    - [339, 48.42]
  - - [2368, 3136, 1, 4096]
    - [327, 49.6]
  - - [2624, 3136, 1, 4096]
    - [327, 49.14]
  - - [2880, 3136, 1, 4096]
    - [339, 49.79]
  - - [3136, 3136, 1, 4096]
    - [346, 49.16]
  - - [3392, 3136, 1, 4096]
    - [392, 49.11]
  - - [3648, 3136, 1, 4096]
    - [327, 49.79]
  - - [3904, 3136, 1, 4096]
    - [327, 49.89]
  - - [64, 3392, 1, 4096]
    - [281, 25.88]
  - - [320, 3392, 1, 4096]
    - [335, 39.99]
  - - [576, 3392, 1, 4096]
    - [278, 43.59]
  - - [832, 3392, 1, 4096]
    - [346, 44.24]
  - - [1088, 3392, 1, 4096]
    - [327, 45.83]
  - - [1344, 3392, 1, 4096]
    - [327, 45.92]
  - - [1600, 3392, 1, 4096]
    - [339, 49.1]
  - - [1856, 3392, 1, 4096]
    - [327, 49.1]
  - - [2112, 3392, 1, 4096]
    - [392, 48.65]
  - - [2368, 3392, 1, 4096]
    - [339, 48.53]
  - - [2624, 3392, 1, 4096]
    - [339, 49.28]
  - - [2880, 3392, 1, 4096]
    - [327, 48.72]
  - - [3136, 3392, 1, 4096]
    - [339, 48.63]
  - - [3392, 3392, 1, 4096]
    - [327, 49.88]
  - - [3648, 3392, 1, 4096]
    - [327, 49.57]
  - - [3904, 3392, 1, 4096]
    - [392, 49.09]
  - - [64, 3648, 1, 4096]
    - [287, 27.91]
  - - [320, 3648, 1, 4096]
    - [281, 42.87]
  - - [576, 3648, 1, 4096]
    - [299, 42.89]
  - - [832, 3648, 1, 4096]
    - [236, 42.8]
  - - [1088, 3648, 1, 4096]
    - [327, 43.83]
  - - [1344, 3648, 1, 4096]
    - [327, 48.97]
  - - [1600, 3648, 1, 4096]
    - [392, 48.05]
  - - [1856, 3648, 1, 4096]
    - [339, 48.73]
  - - [2112, 3648, 1, 4096]
    - [339, 49.42]
  - - [2368, 3648, 1, 4096]
    - [327, 48.12]
  - - [2624, 3648, 1, 4096]
    - [327, 48.4]
  - - [2880, 3648, 1, 4096]
    - [327, 49.75]
  - - [3136, 3648, 1, 4096]
    - [327, 49.46]
  - - [3392, 3648, 1, 4096]
    - [327, 49.55]
  - - [3648, 3648, 1, 4096]
    - [327, 49.77]
  - - [3904, 3648, 1, 4096]
    - [346, 49.72]
  - - [64, 3904, 1, 4096]
    - [207, 29.29]
  - - [320, 3904, 1, 4096]
    - [281, 42.22]
  - - [576, 3904, 1, 4096]
    - [292, 43.13]
  - - [832, 3904, 1, 4096]
    - [309, 45.43]
  - - [1088, 3904, 1, 4096]
    - [327, 46.5]
  - - [1344, 3904, 1, 4096]
    - [346, 47.86]
  - - [1600, 3904, 1, 4096]
    - [327, 48.18]
  - - [1856, 3904, 1, 4096]
    - [392, 48.62]
  - - [2112, 3904, 1, 4096]
    - [327, 49.0]
  - - [2368, 3904, 1, 4096]
    - [392, 48.62]
  - - [2624, 3904, 1, 4096]
    - [392, 48.86]
  - - [2880, 3904, 1, 4096]
    - [327, 48.97]
  - - [3136, 3904, 1, 4096]
    - [392, 49.38]
  - - [3392, 3904, 1, 4096]
    - [346, 49.49]
  - - [3648, 3904, 1, 4096]
    - [327, 49.69]
  - - [3904, 3904, 1, 4096]
    - [327, 50.07]
  - - [192, 64, 1, 64]
    - [116, 0.08]
  - - [448, 64, 1, 64]
    - [120, 0.19]
  - - [704, 64, 1, 64]
    - [124, 0.29]
  - - [960, 64, 1, 64]
    - [128, 0.37]
  - - [1216, 64, 1, 64]
    - [349, 0.47]
  - - [1472, 64, 1, 64]
    - [125, 0.56]
  - - [1728, 64, 1, 64]
    - [223, 0.65]
  - - [1984, 64, 1, 64]
    - [350, 0.78]
  - - [64, 192, 1, 64]
    - [120, 0.08]
  - - [192, 192, 1, 64]
    - [121, 0.24]
  - - [320, 192, 1, 64]
    - [148, 0.39]
  - - [448, 192, 1, 64]
    - [119, 0.54]
  - - [576, 192, 1, 64]
    - [150, 0.68]
  - - [704, 192, 1, 64]
    - [152, 0.82]
  - - [832, 192, 1, 64]
    - [154, 0.97]
  - - [960, 192, 1, 64]
    - [156, 1.11]
  - - [1088, 192, 1, 64]
    - [175, 1.27]
  - - [1216, 192, 1, 64]
    - [161, 1.41]
  - - [1344, 192, 1, 64]
    - [175, 1.56]
  - - [1472, 192, 1, 64]
    - [172, 1.63]
  - - [1600, 192, 1, 64]
    - [166, 1.78]
  - - [1728, 192, 1, 64]
    - [288, 1.86]
  - - [1856, 192, 1, 64]
    - [184, 1.93]
  - - [1984, 192, 1, 64]
    - [164, 2.08]
  - - [192, 320, 1, 64]
    - [170, 0.38]
  - - [448, 320, 1, 64]
    - [173, 0.83]
  - - [704, 320, 1, 64]
    - [175, 1.29]
  - - [960, 320, 1, 64]
    - [142, 1.68]
  - - [1216, 320, 1, 64]
    - [182, 2.1]
  - - [1472, 320, 1, 64]
    - [165, 2.47]
  - - [1728, 320, 1, 64]
    - [175, 2.76]
  - - [1984, 320, 1, 64]
    - [184, 3.14]
  - - [64, 448, 1, 64]
    - [186, 0.18]
  - - [192, 448, 1, 64]
    - [188, 0.51]
  - - [320, 448, 1, 64]
    - [189, 0.83]
  - - [448, 448, 1, 64]
    - [191, 1.15]
  - - [576, 448, 1, 64]
    - [192, 1.46]
  - - [704, 448, 1, 64]
    - [193, 1.75]
  - - [832, 448, 1, 64]
    - [192, 2.03]
  - - [960, 448, 1, 64]
    - [196, 2.25]
  - - [1088, 448, 1, 64]
    - [225, 2.54]
  - - [1216, 448, 1, 64]
    - [352, 2.72]
  - - [1344, 448, 1, 64]
    - [175, 3.02]
  - - [1472, 448, 1, 64]
    - [175, 3.19]
  - - [1600, 448, 1, 64]
    - [184, 3.37]
  - - [1728, 448, 1, 64]
    - [353, 3.65]
  - - [1856, 448, 1, 64]
    - [161, 3.77]
  - - [1984, 448, 1, 64]
    - [175, 4.03]
  - - [192, 576, 1, 64]
    - [209, 0.65]
  - - [448, 576, 1, 64]
    - [150, 1.47]
  - - [704, 576, 1, 64]
    - [213, 2.14]
  - - [960, 576, 1, 64]
    - [150, 2.76]
  - - [1216, 576, 1, 64]
    - [175, 3.28]
  - - [1472, 576, 1, 64]
    - [175, 3.88]
  - - [1728, 576, 1, 64]
    - [161, 4.54]
  - - [1984, 576, 1, 64]
    - [354, 4.76]
  - - [64, 704, 1, 64]
    - [222, 0.28]
  - - [192, 704, 1, 64]
    - [193, 0.78]
  - - [320, 704, 1, 64]
    - [161, 1.29]
  - - [448, 704, 1, 64]
    - [223, 1.81]
  - - [576, 704, 1, 64]
    - [225, 2.16]
  - - [704, 704, 1, 64]
    - [227, 2.61]
  - - [832, 704, 1, 64]
    - [175, 2.98]
  - - [960, 704, 1, 64]
    - [175, 3.23]
  - - [1088, 704, 1, 64]
    - [193, 3.61]
  - - [1216, 704, 1, 64]
    - [355, 3.86]
  - - [1344, 704, 1, 64]
    - [353, 4.35]
  - - [1472, 704, 1, 64]
    - [161, 4.73]
  - - [1600, 704, 1, 64]
    - [175, 4.92]
  - - [1728, 704, 1, 64]
    - [161, 5.07]
  - - [1856, 704, 1, 64]
    - [353, 5.17]
  - - [1984, 704, 1, 64]
    - [161, 5.36]
  - - [192, 832, 1, 64]
    - [175, 0.97]
  - - [448, 832, 1, 64]
    - [164, 2.15]
  - - [704, 832, 1, 64]
    - [236, 2.91]
  - - [960, 832, 1, 64]
    - [161, 3.82]
  - - [1216, 832, 1, 64]
    - [354, 4.57]
  - - [1472, 832, 1, 64]
    - [161, 4.9]
  - - [1728, 832, 1, 64]
    - [161, 5.5]
  - - [1984, 832, 1, 64]
    - [161, 6.0]
  - - [64, 960, 1, 64]
    - [247, 0.38]
  - - [192, 960, 1, 64]
    - [175, 1.06]
  - - [320, 960, 1, 64]
    - [164, 1.68]
  - - [448, 960, 1, 64]
    - [248, 2.29]
  - - [576, 960, 1, 64]
    - [175, 2.78]
  - - [704, 960, 1, 64]
    - [161, 3.2]
  - - [832, 960, 1, 64]
    - [250, 3.69]
  - - [960, 960, 1, 64]
    - [243, 4.06]
  - - [1088, 960, 1, 64]
    - [354, 4.49]
  - - [1216, 960, 1, 64]
    - [161, 5.03]
  - - [1344, 960, 1, 64]
    - [245, 5.36]
  - - [1472, 960, 1, 64]
    - [245, 5.42]
  - - [1600, 960, 1, 64]
    - [161, 5.66]
  - - [1728, 960, 1, 64]
    - [245, 6.21]
  - - [1856, 960, 1, 64]
    - [245, 6.48]
  - - [1984, 960, 1, 64]
    - [161, 6.74]
  - - [192, 1088, 1, 64]
    - [175, 1.27]
  - - [448, 1088, 1, 64]
    - [192, 2.54]
  - - [704, 1088, 1, 64]
    - [175, 3.72]
  - - [960, 1088, 1, 64]
    - [357, 4.54]
  - - [1216, 1088, 1, 64]
    - [161, 5.11]
  - - [1472, 1088, 1, 64]
    - [245, 5.76]
  - - [1728, 1088, 1, 64]
    - [245, 6.75]
  - - [1984, 1088, 1, 64]
    - [161, 6.82]
  - - [64, 1216, 1, 64]
    - [358, 0.48]
  - - [192, 1216, 1, 64]
    - [219, 1.38]
  - - [320, 1216, 1, 64]
    - [193, 2.21]
  - - [448, 1216, 1, 64]
    - [357, 2.79]
  - - [576, 1216, 1, 64]
    - [175, 3.33]
  - - [704, 1216, 1, 64]
    - [175, 4.01]
  - - [832, 1216, 1, 64]
    - [359, 4.35]
  - - [960, 1216, 1, 64]
    - [161, 4.85]
  - - [1088, 1216, 1, 64]
    - [161, 5.17]
  - - [1216, 1216, 1, 64]
    - [161, 5.56]
  - - [1344, 1216, 1, 64]
    - [245, 5.94]
  - - [1472, 1216, 1, 64]
    - [161, 6.28]
  - - [1600, 1216, 1, 64]
    - [245, 6.6]
  - - [1728, 1216, 1, 64]
    - [245, 6.84]
  - - [1856, 1216, 1, 64]
    - [161, 7.14]
  - - [1984, 1216, 1, 64]
    - [353, 7.36]
  - - [192, 1344, 1, 64]
    - [164, 1.47]
  - - [448, 1344, 1, 64]
    - [175, 3.16]
  - - [704, 1344, 1, 64]
    - [184, 4.16]
  - - [960, 1344, 1, 64]
    - [353, 5.14]
  - - [1216, 1344, 1, 64]
    - [161, 6.2]
  - - [1472, 1344, 1, 64]
    - [161, 6.89]
  - - [1728, 1344, 1, 64]
    - [245, 7.18]
  - - [1984, 1344, 1, 64]
    - [161, 7.66]
  - - [64, 1472, 1, 64]
    - [361, 0.59]
  - - [192, 1472, 1, 64]
    - [205, 1.63]
  - - [320, 1472, 1, 64]
    - [362, 2.58]
  - - [448, 1472, 1, 64]
    - [184, 3.29]
  - - [576, 1472, 1, 64]
    - [245, 4.06]
  - - [704, 1472, 1, 64]
    - [175, 4.52]
  - - [832, 1472, 1, 64]
    - [161, 5.12]
  - - [960, 1472, 1, 64]
    - [245, 5.69]
  - - [1088, 1472, 1, 64]
    - [161, 6.07]
  - - [1216, 1472, 1, 64]
    - [245, 6.29]
  - - [1344, 1472, 1, 64]
    - [161, 6.56]
  - - [1472, 1472, 1, 64]
    - [245, 6.89]
  - - [1600, 1472, 1, 64]
    - [175, 7.13]
  - - [1728, 1472, 1, 64]
    - [161, 7.64]
  - - [1856, 1472, 1, 64]
    - [245, 7.95]
  - - [1984, 1472, 1, 64]
    - [161, 8.44]
  - - [192, 1600, 1, 64]
    - [253, 1.64]
  - - [448, 1600, 1, 64]
    - [175, 3.56]
  - - [704, 1600, 1, 64]
    - [175, 4.78]
  - - [960, 1600, 1, 64]
    - [245, 5.68]
  - - [1216, 1600, 1, 64]
    - [161, 6.61]
  - - [1472, 1600, 1, 64]
    - [184, 7.05]
  - - [1728, 1600, 1, 64]
    - [245, 7.75]
  - - [1984, 1600, 1, 64]
    - [161, 8.48]
  - - [64, 1728, 1, 64]
    - [150, 0.66]
  - - [192, 1728, 1, 64]
    - [364, 1.84]
  - - [320, 1728, 1, 64]
    - [365, 2.77]
  - - [448, 1728, 1, 64]
    - [175, 3.84]
  - - [576, 1728, 1, 64]
    - [161, 4.52]
  - - [704, 1728, 1, 64]
    - [161, 4.88]
  - - [832, 1728, 1, 64]
    - [161, 5.55]
  - - [960, 1728, 1, 64]
    - [245, 5.97]
  - - [1088, 1728, 1, 64]
    - [161, 6.43]
  - - [1216, 1728, 1, 64]
    - [245, 6.8]
  - - [1344, 1728, 1, 64]
    - [245, 7.17]
  - - [1472, 1728, 1, 64]
    - [161, 7.57]
  - - [1600, 1728, 1, 64]
    - [161, 8.16]
  - - [1728, 1728, 1, 64]
    - [161, 8.22]
  - - [1856, 1728, 1, 64]
    - [245, 8.38]
  - - [1984, 1728, 1, 64]
    - [161, 8.72]
  - - [192, 1856, 1, 64]
    - [252, 1.94]
  - - [448, 1856, 1, 64]
    - [245, 3.79]
  - - [704, 1856, 1, 64]
    - [353, 5.19]
  - - [960, 1856, 1, 64]
    - [245, 6.12]
  - - [1216, 1856, 1, 64]
    - [161, 6.98]
  - - [1472, 1856, 1, 64]
    - [161, 7.97]
  - - [1728, 1856, 1, 64]
    - [161, 8.51]
  - - [1984, 1856, 1, 64]
    - [161, 8.86]
  - - [64, 1984, 1, 64]
    - [225, 0.75]
  - - [192, 1984, 1, 64]
    - [288, 2.08]
  - - [320, 1984, 1, 64]
    - [236, 3.19]
  - - [448, 1984, 1, 64]
    - [245, 4.18]
  - - [576, 1984, 1, 64]
    - [354, 4.98]
  - - [704, 1984, 1, 64]
    - [161, 5.64]
  - - [832, 1984, 1, 64]
    - [245, 5.97]
  - - [960, 1984, 1, 64]
    - [245, 6.38]
  - - [1088, 1984, 1, 64]
    - [161, 6.9]
  - - [1216, 1984, 1, 64]
    - [161, 7.34]
  - - [1344, 1984, 1, 64]
    - [161, 7.82]
  - - [1472, 1984, 1, 64]
    - [245, 8.05]
  - - [1600, 1984, 1, 64]
    - [161, 8.38]
  - - [1728, 1984, 1, 64]
    - [161, 8.64]
  - - [1856, 1984, 1, 64]
    - [161, 8.88]
  - - [1984, 1984, 1, 64]
    - [245, 9.29]
  - - [192, 64, 1, 256]
    - [260, 0.3]
  - - [448, 64, 1, 256]
    - [264, 0.69]
  - - [704, 64, 1, 256]
    - [261, 1.08]
  - - [960, 64, 1, 256]
    - [267, 1.39]
  - - [1216, 64, 1, 256]
    - [367, 1.7]
  - - [1472, 64, 1, 256]
    - [278, 2.15]
  - - [1728, 64, 1, 256]
    - [281, 2.43]
  - - [1984, 64, 1, 256]
    - [278, 2.84]
  - - [64, 192, 1, 256]
    - [262, 0.31]
  - - [192, 192, 1, 256]
    - [263, 0.89]
  - - [320, 192, 1, 256]
    - [283, 1.44]
  - - [448, 192, 1, 256]
    - [275, 1.96]
  - - [576, 192, 1, 256]
    - [207, 2.43]
  - - [704, 192, 1, 256]
    - [278, 2.96]
  - - [832, 192, 1, 256]
    - [278, 3.49]
  - - [960, 192, 1, 256]
    - [278, 3.98]
  - - [1088, 192, 1, 256]
    - [278, 4.38]
  - - [1216, 192, 1, 256]
    - [293, 4.72]
  - - [1344, 192, 1, 256]
    - [207, 5.43]
  - - [1472, 192, 1, 256]
    - [292, 5.74]
  - - [1600, 192, 1, 256]
    - [280, 6.15]
  - - [1728, 192, 1, 256]
    - [237, 6.61]
  - - [1856, 192, 1, 256]
    - [165, 6.95]
  - - [1984, 192, 1, 256]
    - [275, 7.32]
  - - [192, 320, 1, 256]
    - [263, 1.46]
  - - [448, 320, 1, 256]
    - [278, 3.17]
  - - [704, 320, 1, 256]
    - [207, 4.73]
  - - [960, 320, 1, 256]
    - [286, 6.17]
  - - [1216, 320, 1, 256]
    - [165, 7.57]
  - - [1472, 320, 1, 256]
    - [280, 8.57]
  - - [1728, 320, 1, 256]
    - [159, 9.42]
  - - [1984, 320, 1, 256]
    - [287, 10.51]
  - - [64, 448, 1, 256]
    - [127, 0.68]
  - - [192, 448, 1, 256]
    - [279, 1.86]
  - - [320, 448, 1, 256]
    - [278, 2.98]
  - - [448, 448, 1, 256]
    - [280, 4.11]
  - - [576, 448, 1, 256]
    - [278, 5.18]
  - - [704, 448, 1, 256]
    - [286, 6.07]
  - - [832, 448, 1, 256]
    - [292, 6.83]
  - - [960, 448, 1, 256]
    - [159, 7.9]
  - - [1088, 448, 1, 256]
    - [286, 8.8]
  - - [1216, 448, 1, 256]
    - [275, 9.23]
  - - [1344, 448, 1, 256]
    - [275, 10.18]
  - - [1472, 448, 1, 256]
    - [237, 10.01]
  - - [1600, 448, 1, 256]
    - [213, 10.72]
  - - [1728, 448, 1, 256]
    - [237, 11.48]
  - - [1856, 448, 1, 256]
    - [237, 11.58]
  - - [1984, 448, 1, 256]
    - [213, 12.07]
  - - [192, 576, 1, 256]
    - [280, 2.4]
  - - [448, 576, 1, 256]
    - [294, 5.2]
  - - [704, 576, 1, 256]
    - [280, 7.23]
  - - [960, 576, 1, 256]
    - [142, 9.09]
  - - [1216, 576, 1, 256]
    - [142, 10.92]
  - - [1472, 576, 1, 256]
    - [233, 11.89]
  - - [1728, 576, 1, 256]
    - [301, 13.02]
  - - [1984, 576, 1, 256]
    - [237, 14.15]
  - - [64, 704, 1, 256]
    - [302, 1.04]
  - - [192, 704, 1, 256]
    - [280, 2.94]
  - - [320, 704, 1, 256]
    - [293, 4.78]
  - - [448, 704, 1, 256]
    - [286, 6.25]
  - - [576, 704, 1, 256]
    - [281, 7.25]
  - - [704, 704, 1, 256]
    - [281, 8.67]
  - - [832, 704, 1, 256]
    - [159, 9.52]
  - - [960, 704, 1, 256]
    - [233, 10.49]
  - - [1088, 704, 1, 256]
    - [237, 11.54]
  - - [1216, 704, 1, 256]
    - [301, 12.11]
  - - [1344, 704, 1, 256]
    - [236, 12.82]
  - - [1472, 704, 1, 256]
    - [165, 14.0]
  - - [1600, 704, 1, 256]
    - [237, 14.54]
  - - [1728, 704, 1, 256]
    - [301, 14.76]
  - - [1856, 704, 1, 256]
    - [301, 15.68]
  - - [1984, 704, 1, 256]
    - [301, 16.23]
  - - [192, 832, 1, 256]
    - [278, 3.34]
  - - [448, 832, 1, 256]
    - [159, 6.96]
  - - [704, 832, 1, 256]
    - [159, 9.77]
  - - [960, 832, 1, 256]
    - [233, 11.83]
  - - [1216, 832, 1, 256]
    - [237, 13.7]
  - - [1472, 832, 1, 256]
    - [237, 14.69]
  - - [1728, 832, 1, 256]
    - [301, 16.36]
  - - [1984, 832, 1, 256]
    - [237, 17.09]
  - - [64, 960, 1, 256]
    - [265, 1.45]
  - - [192, 960, 1, 256]
    - [275, 3.99]
  - - [320, 960, 1, 256]
    - [278, 6.13]
  - - [448, 960, 1, 256]
    - [159, 7.93]
  - - [576, 960, 1, 256]
    - [281, 9.49]
  - - [704, 960, 1, 256]
    - [237, 10.63]
  - - [832, 960, 1, 256]
    - [301, 11.42]
  - - [960, 960, 1, 256]
    - [301, 12.86]
  - - [1088, 960, 1, 256]
    - [301, 14.05]
  - - [1216, 960, 1, 256]
    - [310, 14.45]
  - - [1344, 960, 1, 256]
    - [165, 15.23]
  - - [1472, 960, 1, 256]
    - [280, 15.83]
  - - [1600, 960, 1, 256]
    - [236, 16.5]
  - - [1728, 960, 1, 256]
    - [237, 17.38]
  - - [1856, 960, 1, 256]
    - [301, 17.79]
  - - [1984, 960, 1, 256]
    - [237, 17.84]
  - - [192, 1088, 1, 256]
    - [293, 4.27]
  - - [448, 1088, 1, 256]
    - [287, 8.52]
  - - [704, 1088, 1, 256]
    - [301, 11.33]
  - - [960, 1088, 1, 256]
    - [165, 13.6]
  - - [1216, 1088, 1, 256]
    - [301, 15.01]
  - - [1472, 1088, 1, 256]
    - [301, 16.28]
  - - [1728, 1088, 1, 256]
    - [165, 17.71]
  - - [1984, 1088, 1, 256]
    - [237, 18.64]
  - - [64, 1216, 1, 256]
    - [369, 1.71]
  - - [192, 1216, 1, 256]
    - [207, 4.67]
  - - [320, 1216, 1, 256]
    - [281, 7.6]
  - - [448, 1216, 1, 256]
    - [159, 9.3]
  - - [576, 1216, 1, 256]
    - [321, 11.05]
  - - [704, 1216, 1, 256]
    - [301, 12.46]
  - - [832, 1216, 1, 256]
    - [301, 13.07]
  - - [960, 1216, 1, 256]
    - [165, 14.48]
  - - [1088, 1216, 1, 256]
    - [301, 14.88]
  - - [1216, 1216, 1, 256]
    - [370, 15.94]
  - - [1344, 1216, 1, 256]
    - [236, 16.41]
  - - [1472, 1216, 1, 256]
    - [236, 17.43]
  - - [1600, 1216, 1, 256]
    - [237, 18.21]
  - - [1728, 1216, 1, 256]
    - [237, 18.3]
  - - [1856, 1216, 1, 256]
    - [371, 18.98]
  - - [1984, 1216, 1, 256]
    - [237, 19.29]
  - - [192, 1344, 1, 256]
    - [159, 5.36]
  - - [448, 1344, 1, 256]
    - [237, 10.14]
  - - [704, 1344, 1, 256]
    - [301, 13.01]
  - - [960, 1344, 1, 256]
    - [280, 15.03]
  - - [1216, 1344, 1, 256]
    - [236, 16.58]
  - - [1472, 1344, 1, 256]
    - [326, 17.87]
  - - [1728, 1344, 1, 256]
    - [237, 19.2]
  - - [1984, 1344, 1, 256]
    - [236, 20.38]
  - - [64, 1472, 1, 256]
    - [263, 2.06]
  - - [192, 1472, 1, 256]
    - [275, 5.47]
  - - [320, 1472, 1, 256]
    - [292, 8.27]
  - - [448, 1472, 1, 256]
    - [301, 10.28]
  - - [576, 1472, 1, 256]
    - [309, 11.96]
  - - [704, 1472, 1, 256]
    - [301, 13.53]
  - - [832, 1472, 1, 256]
    - [307, 14.8]
  - - [960, 1472, 1, 256]
    - [280, 15.68]
  - - [1088, 1472, 1, 256]
    - [301, 16.35]
  - - [1216, 1472, 1, 256]
    - [286, 17.15]
  - - [1344, 1472, 1, 256]
    - [213, 17.86]
  - - [1472, 1472, 1, 256]
    - [237, 18.81]
  - - [1600, 1472, 1, 256]
    - [213, 19.12]
  - - [1728, 1472, 1, 256]
    - [213, 19.49]
  - - [1856, 1472, 1, 256]
    - [237, 20.67]
  - - [1984, 1472, 1, 256]
    - [165, 20.76]
  - - [192, 1600, 1, 256]
    - [278, 6.09]
  - - [448, 1600, 1, 256]
    - [213, 10.74]
  - - [704, 1600, 1, 256]
    - [237, 13.92]
  - - [960, 1600, 1, 256]
    - [237, 16.41]
  - - [1216, 1600, 1, 256]
    - [237, 18.19]
  - - [1472, 1600, 1, 256]
    - [237, 19.41]
  - - [1728, 1600, 1, 256]
    - [236, 20.48]
  - - [1984, 1600, 1, 256]
    - [301, 21.54]
  - - [64, 1728, 1, 256]
    - [306, 2.35]
  - - [192, 1728, 1, 256]
    - [278, 6.26]
  - - [320, 1728, 1, 256]
    - [159, 9.23]
  - - [448, 1728, 1, 256]
    - [213, 11.42]
  - - [576, 1728, 1, 256]
    - [301, 13.09]
  - - [704, 1728, 1, 256]
    - [301, 14.42]
  - - [832, 1728, 1, 256]
    - [280, 15.93]
  - - [960, 1728, 1, 256]
    - [237, 16.89]
  - - [1088, 1728, 1, 256]
    - [237, 17.93]
  - - [1216, 1728, 1, 256]
    - [236, 18.25]
  - - [1344, 1728, 1, 256]
    - [236, 19.18]
  - - [1472, 1728, 1, 256]
    - [237, 19.55]
  - - [1600, 1728, 1, 256]
    - [236, 20.37]
  - - [1728, 1728, 1, 256]
    - [165, 20.98]
  - - [1856, 1728, 1, 256]
    - [236, 21.35]
  - - [1984, 1728, 1, 256]
    - [236, 21.72]
  - - [192, 1856, 1, 256]
    - [237, 6.68]
  - - [448, 1856, 1, 256]
    - [301, 12.16]
  - - [704, 1856, 1, 256]
    - [301, 15.1]
  - - [960, 1856, 1, 256]
    - [237, 17.62]
  - - [1216, 1856, 1, 256]
    - [236, 18.71]
  - - [1472, 1856, 1, 256]
    - [236, 20.17]
  - - [1728, 1856, 1, 256]
    - [237, 21.57]
  - - [1984, 1856, 1, 256]
    - [236, 22.13]
  - - [64, 1984, 1, 256]
    - [164, 2.69]
  - - [192, 1984, 1, 256]
    - [165, 7.12]
  - - [320, 1984, 1, 256]
    - [236, 10.2]
  - - [448, 1984, 1, 256]
    - [301, 12.75]
  - - [576, 1984, 1, 256]
    - [237, 14.13]
  - - [704, 1984, 1, 256]
    - [237, 15.59]
  - - [832, 1984, 1, 256]
    - [236, 16.67]
  - - [960, 1984, 1, 256]
    - [237, 17.58]
  - - [1088, 1984, 1, 256]
    - [286, 18.68]
  - - [1216, 1984, 1, 256]
    - [236, 19.28]
  - - [1344, 1984, 1, 256]
    - [237, 19.87]
  - - [1472, 1984, 1, 256]
    - [236, 20.64]
  - - [1600, 1984, 1, 256]
    - [237, 21.25]
  - - [1728, 1984, 1, 256]
    - [301, 21.76]
  - - [1856, 1984, 1, 256]
    - [213, 21.98]
  - - [1984, 1984, 1, 256]
    - [237, 22.51]
  - - [192, 64, 1, 512]
    - [312, 0.54]
  - - [448, 64, 1, 512]
    - [314, 1.25]
  - - [704, 64, 1, 512]
    - [267, 1.9]
  - - [960, 64, 1, 512]
    - [273, 2.7]
  - - [1216, 64, 1, 512]
    - [267, 3.24]
  - - [1472, 64, 1, 512]
    - [278, 3.73]
  - - [1728, 64, 1, 512]
    - [292, 4.29]
  - - [1984, 64, 1, 512]
    - [278, 5.04]
  - - [64, 192, 1, 512]
    - [317, 0.55]
  - - [192, 192, 1, 512]
    - [263, 1.55]
  - - [320, 192, 1, 512]
    - [263, 2.6]
  - - [448, 192, 1, 512]
    - [278, 3.54]
  - - [576, 192, 1, 512]
    - [159, 4.58]
  - - [704, 192, 1, 512]
    - [292, 5.31]
  - - [832, 192, 1, 512]
    - [278, 5.87]
  - - [960, 192, 1, 512]
    - [292, 6.78]
  - - [1088, 192, 1, 512]
    - [275, 7.6]
  - - [1216, 192, 1, 512]
    - [287, 8.39]
  - - [1344, 192, 1, 512]
    - [287, 9.24]
  - - [1472, 192, 1, 512]
    - [275, 9.45]
  - - [1600, 192, 1, 512]
    - [286, 10.17]
  - - [1728, 192, 1, 512]
    - [207, 10.74]
  - - [1856, 192, 1, 512]
    - [165, 11.28]
  - - [1984, 192, 1, 512]
    - [237, 11.99]
  - - [192, 320, 1, 512]
    - [269, 2.51]
  - - [448, 320, 1, 512]
    - [275, 5.63]
  - - [704, 320, 1, 512]
    - [287, 8.5]
  - - [960, 320, 1, 512]
    - [275, 10.65]
  - - [1216, 320, 1, 512]
    - [237, 12.99]
  - - [1472, 320, 1, 512]
    - [207, 14.22]
  - - [1728, 320, 1, 512]
    - [275, 15.09]
  - - [1984, 320, 1, 512]
    - [281, 16.41]
  - - [64, 448, 1, 512]
    - [261, 1.31]
  - - [192, 448, 1, 512]
    - [306, 3.59]
  - - [320, 448, 1, 512]
    - [275, 5.6]
  - - [448, 448, 1, 512]
    - [280, 7.49]
  - - [576, 448, 1, 512]
    - [159, 9.22]
  - - [704, 448, 1, 512]
    - [207, 10.32]
  - - [832, 448, 1, 512]
    - [292, 12.1]
  - - [960, 448, 1, 512]
    - [292, 12.59]
  - - [1088, 448, 1, 512]
    - [237, 14.19]
  - - [1216, 448, 1, 512]
    - [213, 14.35]
  - - [1344, 448, 1, 512]
    - [281, 15.72]
  - - [1472, 448, 1, 512]
    - [310, 15.96]
  - - [1600, 448, 1, 512]
    - [280, 17.12]
  - - [1728, 448, 1, 512]
    - [165, 18.08]
  - - [1856, 448, 1, 512]
    - [237, 18.63]
  - - [1984, 448, 1, 512]
    - [236, 19.69]
  - - [192, 576, 1, 512]
    - [306, 4.54]
  - - [448, 576, 1, 512]
    - [207, 9.76]
  - - [704, 576, 1, 512]
    - [237, 12.42]
  - - [960, 576, 1, 512]
    - [275, 15.14]
  - - [1216, 576, 1, 512]
    - [233, 18.1]
  - - [1472, 576, 1, 512]
    - [233, 18.96]
  - - [1728, 576, 1, 512]
    - [280, 20.32]
  - - [1984, 576, 1, 512]
    - [280, 21.45]
  - - [64, 704, 1, 512]
    - [261, 1.9]
  - - [192, 704, 1, 512]
    - [278, 5.03]
  - - [320, 704, 1, 512]
    - [287, 8.41]
  - - [448, 704, 1, 512]
    - [275, 10.34]
  - - [576, 704, 1, 512]
    - [275, 12.04]
  - - [704, 704, 1, 512]
    - [275, 14.57]
  - - [832, 704, 1, 512]
    - [159, 15.44]
  - - [960, 704, 1, 512]
    - [142, 16.59]
  - - [1088, 704, 1, 512]
    - [301, 18.53]
  - - [1216, 704, 1, 512]
    - [142, 18.82]
  - - [1344, 704, 1, 512]
    - [286, 19.41]
  - - [1472, 704, 1, 512]
    - [237, 21.09]
  - - [1600, 704, 1, 512]
    - [286, 21.45]
  - - [1728, 704, 1, 512]
    - [165, 21.68]
  - - [1856, 704, 1, 512]
    - [165, 22.75]
  - - [1984, 704, 1, 512]
    - [237, 23.11]
  - - [192, 832, 1, 512]
    - [275, 6.2]
  - - [448, 832, 1, 512]
    - [237, 12.59]
  - - [704, 832, 1, 512]
    - [207, 15.87]
  - - [960, 832, 1, 512]
    - [142, 18.58]
  - - [1216, 832, 1, 512]
    - [301, 20.56]
  - - [1472, 832, 1, 512]
    - [237, 21.84]
  - - [1728, 832, 1, 512]
    - [286, 23.88]
  - - [1984, 832, 1, 512]
    - [213, 24.86]
  - - [64, 960, 1, 512]
    - [265, 2.7]
  - - [192, 960, 1, 512]
    - [275, 7.07]
  - - [320, 960, 1, 512]
    - [278, 10.62]
  - - [448, 960, 1, 512]
    - [325, 12.67]
  - - [576, 960, 1, 512]
    - [321, 15.52]
  - - [704, 960, 1, 512]
    - [326, 16.8]
  - - [832, 960, 1, 512]
    - [233, 18.59]
  - - [960, 960, 1, 512]
    - [326, 19.43]
  - - [1088, 960, 1, 512]
    - [237, 21.76]
  - - [1216, 960, 1, 512]
    - [237, 22.31]
  - - [1344, 960, 1, 512]
    - [286, 23.42]
  - - [1472, 960, 1, 512]
    - [237, 23.77]
  - - [1600, 960, 1, 512]
    - [213, 24.04]
  - - [1728, 960, 1, 512]
    - [237, 25.04]
  - - [1856, 960, 1, 512]
    - [236, 26.07]
  - - [1984, 960, 1, 512]
    - [286, 26.07]
  - - [192, 1088, 1, 512]
    - [278, 7.63]
  - - [448, 1088, 1, 512]
    - [299, 14.26]
  - - [704, 1088, 1, 512]
    - [301, 18.37]
  - - [960, 1088, 1, 512]
    - [165, 21.24]
  - - [1216, 1088, 1, 512]
    - [243, 22.25]
  - - [1472, 1088, 1, 512]
    - [236, 24.21]
  - - [1728, 1088, 1, 512]
    - [237, 26.14]
  - - [1984, 1088, 1, 512]
    - [237, 27.04]
  - - [64, 1216, 1, 512]
    - [263, 3.27]
  - - [192, 1216, 1, 512]
    - [275, 8.76]
  - - [320, 1216, 1, 512]
    - [165, 12.54]
  - - [448, 1216, 1, 512]
    - [142, 15.17]
  - - [576, 1216, 1, 512]
    - [326, 17.48]
  - - [704, 1216, 1, 512]
    - [310, 19.47]
  - - [832, 1216, 1, 512]
    - [233, 20.63]
  - - [960, 1216, 1, 512]
    - [280, 22.02]
  - - [1088, 1216, 1, 512]
    - [237, 22.33]
  - - [1216, 1216, 1, 512]
    - [243, 23.81]
  - - [1344, 1216, 1, 512]
    - [309, 24.69]
  - - [1472, 1216, 1, 512]
    - [237, 25.9]
  - - [1600, 1216, 1, 512]
    - [309, 26.82]
  - - [1728, 1216, 1, 512]
    - [326, 26.96]
  - - [1856, 1216, 1, 512]
    - [237, 27.44]
  - - [1984, 1216, 1, 512]
    - [326, 27.87]
  - - [192, 1344, 1, 512]
    - [281, 9.67]
  - - [448, 1344, 1, 512]
    - [321, 16.71]
  - - [704, 1344, 1, 512]
    - [309, 20.31]
  - - [960, 1344, 1, 512]
    - [237, 22.6]
  - - [1216, 1344, 1, 512]
    - [236, 24.54]
  - - [1472, 1344, 1, 512]
    - [286, 25.95]
  - - [1728, 1344, 1, 512]
    - [237, 27.73]
  - - [1984, 1344, 1, 512]
    - [236, 28.68]
  - - [64, 1472, 1, 512]
    - [287, 3.73]
  - - [192, 1472, 1, 512]
    - [159, 9.47]
  - - [320, 1472, 1, 512]
    - [292, 13.82]
  - - [448, 1472, 1, 512]
    - [301, 16.33]
  - - [576, 1472, 1, 512]
    - [286, 18.58]
  - - [704, 1472, 1, 512]
    - [237, 20.83]
  - - [832, 1472, 1, 512]
    - [307, 22.24]
  - - [960, 1472, 1, 512]
    - [243, 23.67]
  - - [1088, 1472, 1, 512]
    - [237, 24.17]
  - - [1216, 1472, 1, 512]
    - [280, 25.82]
  - - [1344, 1472, 1, 512]
    - [286, 26.16]
  - - [1472, 1472, 1, 512]
    - [213, 27.41]
  - - [1600, 1472, 1, 512]
    - [237, 28.42]
  - - [1728, 1472, 1, 512]
    - [236, 28.39]
  - - [1856, 1472, 1, 512]
    - [280, 29.13]
  - - [1984, 1472, 1, 512]
    - [213, 29.16]
  - - [192, 1600, 1, 512]
    - [159, 10.52]
  - - [448, 1600, 1, 512]
    - [310, 17.21]
  - - [704, 1600, 1, 512]
    - [237, 21.22]
  - - [960, 1600, 1, 512]
    - [165, 24.88]
  - - [1216, 1600, 1, 512]
    - [286, 26.87]
  - - [1472, 1600, 1, 512]
    - [237, 28.16]
  - - [1728, 1600, 1, 512]
    - [237, 28.68]
  - - [1984, 1600, 1, 512]
    - [165, 29.84]
  - - [64, 1728, 1, 512]
    - [279, 4.32]
  - - [192, 1728, 1, 512]
    - [278, 10.82]
  - - [320, 1728, 1, 512]
    - [159, 14.72]
  - - [448, 1728, 1, 512]
    - [237, 18.52]
  - - [576, 1728, 1, 512]
    - [301, 20.13]
  - - [704, 1728, 1, 512]
    - [165, 21.5]
  - - [832, 1728, 1, 512]
    - [237, 24.03]
  - - [960, 1728, 1, 512]
    - [237, 25.53]
  - - [1088, 1728, 1, 512]
    - [286, 25.79]
  - - [1216, 1728, 1, 512]
    - [237, 25.87]
  - - [1344, 1728, 1, 512]
    - [237, 27.77]
  - - [1472, 1728, 1, 512]
    - [237, 28.2]
  - - [1600, 1728, 1, 512]
    - [237, 28.35]
  - - [1728, 1728, 1, 512]
    - [213, 29.65]
  - - [1856, 1728, 1, 512]
    - [165, 30.0]
  - - [1984, 1728, 1, 512]
    - [237, 30.35]
  - - [192, 1856, 1, 512]
    - [278, 11.54]
  - - [448, 1856, 1, 512]
    - [301, 18.61]
  - - [704, 1856, 1, 512]
    - [280, 23.04]
  - - [960, 1856, 1, 512]
    - [237, 25.21]
  - - [1216, 1856, 1, 512]
    - [237, 27.18]
  - - [1472, 1856, 1, 512]
    - [237, 29.48]
  - - [1728, 1856, 1, 512]
    - [237, 29.85]
  - - [1984, 1856, 1, 512]
    - [286, 30.51]
  - - [64, 1984, 1, 512]
    - [281, 5.19]
  - - [192, 1984, 1, 512]
    - [281, 12.69]
  - - [320, 1984, 1, 512]
    - [237, 17.04]
  - - [448, 1984, 1, 512]
    - [237, 19.25]
  - - [576, 1984, 1, 512]
    - [286, 21.65]
  - - [704, 1984, 1, 512]
    - [165, 23.63]
  - - [832, 1984, 1, 512]
    - [280, 25.07]
  - - [960, 1984, 1, 512]
    - [286, 26.08]
  - - [1088, 1984, 1, 512]
    - [236, 26.86]
  - - [1216, 1984, 1, 512]
    - [286, 28.19]
  - - [1344, 1984, 1, 512]
    - [237, 28.97]
  - - [1472, 1984, 1, 512]
    - [165, 29.37]
  - - [1600, 1984, 1, 512]
    - [237, 29.73]
  - - [1728, 1984, 1, 512]
    - [346, 30.25]
  - - [1856, 1984, 1, 512]
    - [280, 30.59]
  - - [1984, 1984, 1, 512]
    - [237, 31.16]
  - - [192, 64, 1, 1024]
    - [330, 0.99]
  - - [448, 64, 1, 1024]
    - [267, 2.25]
  - - [704, 64, 1, 1024]
    - [267, 3.39]
  - - [960, 64, 1, 1024]
    - [331, 4.53]
  - - [1216, 64, 1, 1024]
    - [273, 5.36]
  - - [1472, 64, 1, 1024]
    - [343, 6.35]
  - - [1728, 64, 1, 1024]
    - [281, 7.58]
  - - [1984, 64, 1, 1024]
    - [281, 8.79]
  - - [64, 192, 1, 1024]
    - [265, 1.03]
  - - [192, 192, 1, 1024]
    - [261, 2.85]
  - - [320, 192, 1, 1024]
    - [159, 4.39]
  - - [448, 192, 1, 1024]
    - [159, 6.14]
  - - [576, 192, 1, 1024]
    - [281, 7.74]
  - - [704, 192, 1, 1024]
    - [292, 8.7]
  - - [832, 192, 1, 1024]
    - [278, 9.81]
  - - [960, 192, 1, 1024]
    - [207, 11.49]
  - - [1088, 192, 1, 1024]
    - [278, 12.68]
  - - [1216, 192, 1, 1024]
    - [207, 14.52]
  - - [1344, 192, 1, 1024]
    - [275, 16.0]
  - - [1472, 192, 1, 1024]
    - [287, 15.01]
  - - [1600, 192, 1, 1024]
    - [333, 16.34]
  - - [1728, 192, 1, 1024]
    - [292, 17.25]
  - - [1856, 192, 1, 1024]
    - [287, 18.11]
  - - [1984, 192, 1, 1024]
    - [287, 19.37]
  - - [192, 320, 1, 1024]
    - [274, 4.25]
  - - [448, 320, 1, 1024]
    - [278, 9.21]
  - - [704, 320, 1, 1024]
    - [281, 13.57]
  - - [960, 320, 1, 1024]
    - [159, 16.3]
  - - [1216, 320, 1, 1024]
    - [207, 20.16]
  - - [1472, 320, 1, 1024]
    - [275, 20.58]
  - - [1728, 320, 1, 1024]
    - [142, 21.93]
  - - [1984, 320, 1, 1024]
    - [207, 24.99]
  - - [64, 448, 1, 1024]
    - [272, 2.36]
  - - [192, 448, 1, 1024]
    - [159, 6.03]
  - - [320, 448, 1, 1024]
    - [278, 8.88]
  - - [448, 448, 1, 1024]
    - [207, 12.47]
  - - [576, 448, 1, 1024]
    - [207, 15.84]
  - - [704, 448, 1, 1024]
    - [275, 16.89]
  - - [832, 448, 1, 1024]
    - [159, 18.99]
  - - [960, 448, 1, 1024]
    - [207, 19.14]
  - - [1088, 448, 1, 1024]
    - [207, 21.73]
  - - [1216, 448, 1, 1024]
    - [142, 21.64]
  - - [1344, 448, 1, 1024]
    - [275, 22.91]
  - - [1472, 448, 1, 1024]
    - [307, 23.51]
  - - [1600, 448, 1, 1024]
    - [237, 23.97]
  - - [1728, 448, 1, 1024]
    - [236, 26.75]
  - - [1856, 448, 1, 1024]
    - [213, 25.7]
  - - [1984, 448, 1, 1024]
    - [237, 27.08]
  - - [192, 576, 1, 1024]
    - [159, 7.44]
  - - [448, 576, 1, 1024]
    - [275, 15.76]
  - - [704, 576, 1, 1024]
    - [142, 18.24]
  - - [960, 576, 1, 1024]
    - [142, 21.73]
  - - [1216, 576, 1, 1024]
    - [233, 25.48]
  - - [1472, 576, 1, 1024]
    - [233, 26.91]
  - - [1728, 576, 1, 1024]
    - [165, 28.14]
  - - [1984, 576, 1, 1024]
    - [237, 29.79]
  - - [64, 704, 1, 1024]
    - [272, 3.38]
  - - [192, 704, 1, 1024]
    - [287, 8.6]
  - - [320, 704, 1, 1024]
    - [278, 13.52]
  - - [448, 704, 1, 1024]
    - [159, 16.33]
  - - [576, 704, 1, 1024]
    - [287, 18.06]
  - - [704, 704, 1, 1024]
    - [207, 21.85]
  - - [832, 704, 1, 1024]
    - [321, 23.19]
  - - [960, 704, 1, 1024]
    - [142, 24.27]
  - - [1088, 704, 1, 1024]
    - [142, 26.68]
  - - [1216, 704, 1, 1024]
    - [301, 27.14]
  - - [1344, 704, 1, 1024]
    - [301, 27.63]
  - - [1472, 704, 1, 1024]
    - [207, 29.41]
  - - [1600, 704, 1, 1024]
    - [159, 29.27]
  - - [1728, 704, 1, 1024]
    - [281, 29.84]
  - - [1856, 704, 1, 1024]
    - [237, 31.28]
  - - [1984, 704, 1, 1024]
    - [237, 31.76]
  - - [192, 832, 1, 1024]
    - [278, 10.13]
  - - [448, 832, 1, 1024]
    - [281, 18.97]
  - - [704, 832, 1, 1024]
    - [207, 22.86]
  - - [960, 832, 1, 1024]
    - [233, 25.72]
  - - [1216, 832, 1, 1024]
    - [207, 29.11]
  - - [1472, 832, 1, 1024]
    - [207, 29.66]
  - - [1728, 832, 1, 1024]
    - [165, 32.47]
  - - [1984, 832, 1, 1024]
    - [165, 32.96]
  - - [64, 960, 1, 1024]
    - [263, 4.47]
  - - [192, 960, 1, 1024]
    - [306, 11.22]
  - - [320, 960, 1, 1024]
    - [292, 16.16]
  - - [448, 960, 1, 1024]
    - [310, 19.2]
  - - [576, 960, 1, 1024]
    - [321, 22.73]
  - - [704, 960, 1, 1024]
    - [310, 23.64]
  - - [832, 960, 1, 1024]
    - [301, 25.9]
  - - [960, 960, 1, 1024]
    - [307, 27.26]
  - - [1088, 960, 1, 1024]
    - [207, 29.49]
  - - [1216, 960, 1, 1024]
    - [237, 30.91]
  - - [1344, 960, 1, 1024]
    - [207, 30.96]
  - - [1472, 960, 1, 1024]
    - [237, 31.86]
  - - [1600, 960, 1, 1024]
    - [237, 32.39]
  - - [1728, 960, 1, 1024]
    - [237, 32.88]
  - - [1856, 960, 1, 1024]
    - [236, 33.23]
  - - [1984, 960, 1, 1024]
    - [237, 33.87]
  - - [192, 1088, 1, 1024]
    - [159, 12.45]
  - - [448, 1088, 1, 1024]
    - [142, 21.45]
  - - [704, 1088, 1, 1024]
    - [301, 26.16]
  - - [960, 1088, 1, 1024]
    - [207, 29.51]
  - - [1216, 1088, 1, 1024]
    - [237, 29.93]
  - - [1472, 1088, 1, 1024]
    - [213, 31.94]
  - - [1728, 1088, 1, 1024]
    - [237, 33.77]
  - - [1984, 1088, 1, 1024]
    - [237, 34.87]
  - - [64, 1216, 1, 1024]
    - [279, 5.52]
  - - [192, 1216, 1, 1024]
    - [281, 14.22]
  - - [320, 1216, 1, 1024]
    - [278, 20.45]
  - - [448, 1216, 1, 1024]
    - [142, 22.48]
  - - [576, 1216, 1, 1024]
    - [310, 26.46]
  - - [704, 1216, 1, 1024]
    - [307, 26.76]
  - - [832, 1216, 1, 1024]
    - [237, 29.23]
  - - [960, 1216, 1, 1024]
    - [307, 30.85]
  - - [1088, 1216, 1, 1024]
    - [207, 29.99]
  - - [1216, 1216, 1, 1024]
    - [243, 32.34]
  - - [1344, 1216, 1, 1024]
    - [309, 33.07]
  - - [1472, 1216, 1, 1024]
    - [207, 33.62]
  - - [1600, 1216, 1, 1024]
    - [310, 34.72]
  - - [1728, 1216, 1, 1024]
    - [326, 34.64]
  - - [1856, 1216, 1, 1024]
    - [281, 34.64]
  - - [1984, 1216, 1, 1024]
    - [326, 35.84]
  - - [192, 1344, 1, 1024]
    - [281, 15.63]
  - - [448, 1344, 1, 1024]
    - [321, 24.24]
  - - [704, 1344, 1, 1024]
    - [309, 27.55]
  - - [960, 1344, 1, 1024]
    - [237, 31.09]
  - - [1216, 1344, 1, 1024]
    - [207, 32.73]
  - - [1472, 1344, 1, 1024]
    - [207, 33.49]
  - - [1728, 1344, 1, 1024]
    - [237, 35.42]
  - - [1984, 1344, 1, 1024]
    - [237, 36.22]
  - - [64, 1472, 1, 1024]
    - [279, 6.36]
  - - [192, 1472, 1, 1024]
    - [292, 14.8]
  - - [320, 1472, 1, 1024]
    - [326, 20.73]
  - - [448, 1472, 1, 1024]
    - [233, 23.87]
  - - [576, 1472, 1, 1024]
    - [287, 26.22]
  - - [704, 1472, 1, 1024]
    - [287, 29.24]
  - - [832, 1472, 1, 1024]
    - [307, 30.35]
  - - [960, 1472, 1, 1024]
    - [237, 31.81]
  - - [1088, 1472, 1, 1024]
    - [237, 32.44]
  - - [1216, 1472, 1, 1024]
    - [236, 33.49]
  - - [1344, 1472, 1, 1024]
    - [165, 33.69]
  - - [1472, 1472, 1, 1024]
    - [237, 34.84]
  - - [1600, 1472, 1, 1024]
    - [207, 35.81]
  - - [1728, 1472, 1, 1024]
    - [237, 36.03]
  - - [1856, 1472, 1, 1024]
    - [165, 36.61]
  - - [1984, 1472, 1, 1024]
    - [237, 36.46]
  - - [192, 1600, 1, 1024]
    - [275, 16.13]
  - - [448, 1600, 1, 1024]
    - [310, 24.56]
  - - [704, 1600, 1, 1024]
    - [207, 29.4]
  - - [960, 1600, 1, 1024]
    - [237, 32.69]
  - - [1216, 1600, 1, 1024]
    - [207, 34.6]
  - - [1472, 1600, 1, 1024]
    - [237, 35.94]
  - - [1728, 1600, 1, 1024]
    - [237, 35.69]
  - - [1984, 1600, 1, 1024]
    - [207, 36.81]
  - - [64, 1728, 1, 1024]
    - [279, 7.4]
  - - [192, 1728, 1, 1024]
    - [286, 17.15]
  - - [320, 1728, 1, 1024]
    - [142, 21.59]
  - - [448, 1728, 1, 1024]
    - [165, 25.78]
  - - [576, 1728, 1, 1024]
    - [207, 28.31]
  - - [704, 1728, 1, 1024]
    - [237, 29.49]
  - - [832, 1728, 1, 1024]
    - [237, 32.36]
  - - [960, 1728, 1, 1024]
    - [281, 32.99]
  - - [1088, 1728, 1, 1024]
    - [281, 33.79]
  - - [1216, 1728, 1, 1024]
    - [207, 34.1]
  - - [1344, 1728, 1, 1024]
    - [237, 35.61]
  - - [1472, 1728, 1, 1024]
    - [207, 35.67]
  - - [1600, 1728, 1, 1024]
    - [237, 36.04]
  - - [1728, 1728, 1, 1024]
    - [237, 37.36]
  - - [1856, 1728, 1, 1024]
    - [237, 37.09]
  - - [1984, 1728, 1, 1024]
    - [346, 37.89]
  - - [192, 1856, 1, 1024]
    - [286, 18.13]
  - - [448, 1856, 1, 1024]
    - [275, 25.88]
  - - [704, 1856, 1, 1024]
    - [237, 31.29]
  - - [960, 1856, 1, 1024]
    - [237, 33.49]
  - - [1216, 1856, 1, 1024]
    - [286, 34.49]
  - - [1472, 1856, 1, 1024]
    - [165, 36.6]
  - - [1728, 1856, 1, 1024]
    - [213, 36.94]
  - - [1984, 1856, 1, 1024]
    - [207, 37.58]
  - - [64, 1984, 1, 1024]
    - [159, 8.44]
  - - [192, 1984, 1, 1024]
    - [207, 19.34]
  - - [320, 1984, 1, 1024]
    - [207, 24.51]
  - - [448, 1984, 1, 1024]
    - [281, 27.57]
  - - [576, 1984, 1, 1024]
    - [207, 29.72]
  - - [704, 1984, 1, 1024]
    - [207, 31.61]
  - - [832, 1984, 1, 1024]
    - [237, 32.67]
  - - [960, 1984, 1, 1024]
    - [237, 33.75]
  - - [1088, 1984, 1, 1024]
    - [237, 34.91]
  - - [1216, 1984, 1, 1024]
    - [237, 35.6]
  - - [1344, 1984, 1, 1024]
    - [236, 35.95]
  - - [1472, 1984, 1, 1024]
    - [346, 36.54]
  - - [1600, 1984, 1, 1024]
    - [237, 36.79]
  - - [1728, 1984, 1, 1024]
    - [346, 38.18]
  - - [1856, 1984, 1, 1024]
    - [281, 37.5]
  - - [1984, 1984, 1, 1024]
    - [346, 39.28]
  - - [192, 64, 1, 2048]
    - [319, 1.65]
  - - [448, 64, 1, 2048]
    - [267, 3.9]
  - - [704, 64, 1, 2048]
    - [267, 5.56]
  - - [960, 64, 1, 2048]
    - [268, 7.28]
  - - [1216, 64, 1, 2048]
    - [366, 8.63]
  - - [1472, 64, 1, 2048]
    - [366, 10.2]
  - - [1728, 64, 1, 2048]
    - [159, 11.56]
  - - [1984, 64, 1, 2048]
    - [281, 12.47]
  - - [64, 192, 1, 2048]
    - [319, 1.64]
  - - [192, 192, 1, 2048]
    - [273, 4.4]
  - - [320, 192, 1, 2048]
    - [159, 6.47]
  - - [448, 192, 1, 2048]
    - [159, 9.38]
  - - [576, 192, 1, 2048]
    - [159, 11.95]
  - - [704, 192, 1, 2048]
    - [337, 12.89]
  - - [832, 192, 1, 2048]
    - [279, 15.01]
  - - [960, 192, 1, 2048]
    - [279, 16.82]
  - - [1088, 192, 1, 2048]
    - [275, 18.83]
  - - [1216, 192, 1, 2048]
    - [281, 20.83]
  - - [1344, 192, 1, 2048]
    - [207, 22.65]
  - - [1472, 192, 1, 2048]
    - [335, 20.67]
  - - [1600, 192, 1, 2048]
    - [207, 22.31]
  - - [1728, 192, 1, 2048]
    - [281, 23.99]
  - - [1856, 192, 1, 2048]
    - [281, 25.5]
  - - [1984, 192, 1, 2048]
    - [275, 26.97]
  - - [192, 320, 1, 2048]
    - [273, 6.62]
  - - [448, 320, 1, 2048]
    - [159, 13.21]
  - - [704, 320, 1, 2048]
    - [281, 20.65]
  - - [960, 320, 1, 2048]
    - [207, 23.05]
  - - [1216, 320, 1, 2048]
    - [281, 27.69]
  - - [1472, 320, 1, 2048]
    - [165, 27.86]
  - - [1728, 320, 1, 2048]
    - [142, 28.57]
  - - [1984, 320, 1, 2048]
    - [207, 32.1]
  - - [64, 448, 1, 2048]
    - [265, 3.77]
  - - [192, 448, 1, 2048]
    - [159, 9.23]
  - - [320, 448, 1, 2048]
    - [278, 13.35]
  - - [448, 448, 1, 2048]
    - [159, 18.16]
  - - [576, 448, 1, 2048]
    - [292, 23.01]
  - - [704, 448, 1, 2048]
    - [281, 23.34]
  - - [832, 448, 1, 2048]
    - [281, 26.79]
  - - [960, 448, 1, 2048]
    - [325, 25.86]
  - - [1088, 448, 1, 2048]
    - [275, 29.06]
  - - [1216, 448, 1, 2048]
    - [207, 28.25]
  - - [1344, 448, 1, 2048]
    - [275, 30.65]
  - - [1472, 448, 1, 2048]
    - [310, 30.46]
  - - [1600, 448, 1, 2048]
    - [275, 31.14]
  - - [1728, 448, 1, 2048]
    - [159, 33.68]
  - - [1856, 448, 1, 2048]
    - [275, 32.58]
  - - [1984, 448, 1, 2048]
    - [237, 34.13]
  - - [192, 576, 1, 2048]
    - [159, 11.57]
  - - [448, 576, 1, 2048]
    - [281, 23.22]
  - - [704, 576, 1, 2048]
    - [207, 24.6]
  - - [960, 576, 1, 2048]
    - [142, 29.05]
  - - [1216, 576, 1, 2048]
    - [321, 32.69]
  - - [1472, 576, 1, 2048]
    - [233, 34.31]
  - - [1728, 576, 1, 2048]
    - [207, 35.49]
  - - [1984, 576, 1, 2048]
    - [299, 36.38]
  - - [64, 704, 1, 2048]
    - [265, 5.41]
  - - [192, 704, 1, 2048]
    - [287, 12.66]
  - - [320, 704, 1, 2048]
    - [287, 20.57]
  - - [448, 704, 1, 2048]
    - [207, 23.07]
  - - [576, 704, 1, 2048]
    - [321, 24.59]
  - - [704, 704, 1, 2048]
    - [207, 29.73]
  - - [832, 704, 1, 2048]
    - [321, 29.82]
  - - [960, 704, 1, 2048]
    - [142, 31.49]
  - - [1088, 704, 1, 2048]
    - [321, 34.99]
  - - [1216, 704, 1, 2048]
    - [301, 34.74]
  - - [1344, 704, 1, 2048]
    - [301, 35.08]
  - - [1472, 704, 1, 2048]
    - [207, 36.64]
  - - [1600, 704, 1, 2048]
    - [281, 36.47]
  - - [1728, 704, 1, 2048]
    - [281, 36.29]
  - - [1856, 704, 1, 2048]
    - [281, 38.04]
  - - [1984, 704, 1, 2048]
    - [281, 38.23]
  - - [192, 832, 1, 2048]
    - [281, 14.56]
  - - [448, 832, 1, 2048]
    - [281, 26.74]
  - - [704, 832, 1, 2048]
    - [321, 29.96]
  - - [960, 832, 1, 2048]
    - [233, 32.72]
  - - [1216, 832, 1, 2048]
    - [281, 36.18]
  - - [1472, 832, 1, 2048]
    - [281, 36.59]
  - - [1728, 832, 1, 2048]
    - [281, 38.83]
  - - [1984, 832, 1, 2048]
    - [281, 38.97]
  - - [64, 960, 1, 2048]
    - [330, 7.29]
  - - [192, 960, 1, 2048]
    - [159, 17.27]
  - - [320, 960, 1, 2048]
    - [207, 22.5]
  - - [448, 960, 1, 2048]
    - [325, 26.04]
  - - [576, 960, 1, 2048]
    - [142, 30.7]
  - - [704, 960, 1, 2048]
    - [310, 30.97]
  - - [832, 960, 1, 2048]
    - [301, 32.9]
  - - [960, 960, 1, 2048]
    - [326, 34.12]
  - - [1088, 960, 1, 2048]
    - [207, 36.83]
  - - [1216, 960, 1, 2048]
    - [281, 37.41]
  - - [1344, 960, 1, 2048]
    - [287, 37.73]
  - - [1472, 960, 1, 2048]
    - [207, 37.61]
  - - [1600, 960, 1, 2048]
    - [281, 38.86]
  - - [1728, 960, 1, 2048]
    - [207, 39.44]
  - - [1856, 960, 1, 2048]
    - [281, 39.54]
  - - [1984, 960, 1, 2048]
    - [299, 39.33]
  - - [192, 1088, 1, 2048]
    - [207, 19.31]
  - - [448, 1088, 1, 2048]
    - [142, 29.15]
  - - [704, 1088, 1, 2048]
    - [142, 34.71]
  - - [960, 1088, 1, 2048]
    - [207, 36.68]
  - - [1216, 1088, 1, 2048]
    - [281, 36.3]
  - - [1472, 1088, 1, 2048]
    - [287, 37.9]
  - - [1728, 1088, 1, 2048]
    - [281, 39.26]
  - - [1984, 1088, 1, 2048]
    - [207, 39.49]
  - - [64, 1216, 1, 2048]
    - [159, 8.46]
  - - [192, 1216, 1, 2048]
    - [207, 20.83]
  - - [320, 1216, 1, 2048]
    - [159, 28.55]
  - - [448, 1216, 1, 2048]
    - [321, 30.59]
  - - [576, 1216, 1, 2048]
    - [307, 33.72]
  - - [704, 1216, 1, 2048]
    - [233, 34.48]
  - - [832, 1216, 1, 2048]
    - [281, 36.05]
  - - [960, 1216, 1, 2048]
    - [281, 37.85]
  - - [1088, 1216, 1, 2048]
    - [243, 36.48]
  - - [1216, 1216, 1, 2048]
    - [243, 40.26]
  - - [1344, 1216, 1, 2048]
    - [281, 38.95]
  - - [1472, 1216, 1, 2048]
    - [237, 39.63]
  - - [1600, 1216, 1, 2048]
    - [307, 41.59]
  - - [1728, 1216, 1, 2048]
    - [307, 41.1]
  - - [1856, 1216, 1, 2048]
    - [207, 40.29]
  - - [1984, 1216, 1, 2048]
    - [328, 41.13]
  - - [192, 1344, 1, 2048]
    - [287, 22.65]
  - - [448, 1344, 1, 2048]
    - [321, 31.54]
  - - [704, 1344, 1, 2048]
    - [326, 35.1]
  - - [960, 1344, 1, 2048]
    - [281, 37.84]
  - - [1216, 1344, 1, 2048]
    - [281, 39.03]
  - - [1472, 1344, 1, 2048]
    - [372, 38.98]
  - - [1728, 1344, 1, 2048]
    - [299, 40.88]
  - - [1984, 1344, 1, 2048]
    - [159, 40.14]
  - - [64, 1472, 1, 2048]
    - [159, 10.28]
  - - [192, 1472, 1, 2048]
    - [287, 21.02]
  - - [320, 1472, 1, 2048]
    - [281, 28.4]
  - - [448, 1472, 1, 2048]
    - [321, 30.83]
  - - [576, 1472, 1, 2048]
    - [281, 33.7]
  - - [704, 1472, 1, 2048]
    - [207, 36.88]
  - - [832, 1472, 1, 2048]
    - [310, 37.21]
  - - [960, 1472, 1, 2048]
    - [275, 37.54]
  - - [1088, 1472, 1, 2048]
    - [281, 38.25]
  - - [1216, 1472, 1, 2048]
    - [299, 39.38]
  - - [1344, 1472, 1, 2048]
    - [299, 39.32]
  - - [1472, 1472, 1, 2048]
    - [287, 40.27]
  - - [1600, 1472, 1, 2048]
    - [327, 40.66]
  - - [1728, 1472, 1, 2048]
    - [299, 40.78]
  - - [1856, 1472, 1, 2048]
    - [275, 40.4]
  - - [1984, 1472, 1, 2048]
    - [327, 42.1]
  - - [192, 1600, 1, 2048]
    - [335, 22.45]
  - - [448, 1600, 1, 2048]
    - [301, 32.33]
  - - [704, 1600, 1, 2048]
    - [281, 35.81]
  - - [960, 1600, 1, 2048]
    - [207, 38.8]
  - - [1216, 1600, 1, 2048]
    - [281, 40.74]
  - - [1472, 1600, 1, 2048]
    - [236, 40.39]
  - - [1728, 1600, 1, 2048]
    - [207, 40.7]
  - - [1984, 1600, 1, 2048]
    - [237, 41.86]
  - - [64, 1728, 1, 2048]
    - [337, 11.51]
  - - [192, 1728, 1, 2048]
    - [287, 24.63]
  - - [320, 1728, 1, 2048]
    - [142, 29.21]
  - - [448, 1728, 1, 2048]
    - [299, 33.33]
  - - [576, 1728, 1, 2048]
    - [207, 35.75]
  - - [704, 1728, 1, 2048]
    - [207, 36.46]
  - - [832, 1728, 1, 2048]
    - [281, 38.95]
  - - [960, 1728, 1, 2048]
    - [207, 39.57]
  - - [1088, 1728, 1, 2048]
    - [237, 39.43]
  - - [1216, 1728, 1, 2048]
    - [281, 39.64]
  - - [1344, 1728, 1, 2048]
    - [207, 41.36]
  - - [1472, 1728, 1, 2048]
    - [165, 40.9]
  - - [1600, 1728, 1, 2048]
    - [287, 40.59]
  - - [1728, 1728, 1, 2048]
    - [236, 42.06]
  - - [1856, 1728, 1, 2048]
    - [275, 41.28]
  - - [1984, 1728, 1, 2048]
    - [327, 42.98]
  - - [192, 1856, 1, 2048]
    - [281, 25.99]
  - - [448, 1856, 1, 2048]
    - [281, 33.3]
  - - [704, 1856, 1, 2048]
    - [207, 38.2]
  - - [960, 1856, 1, 2048]
    - [165, 39.19]
  - - [1216, 1856, 1, 2048]
    - [299, 39.92]
  - - [1472, 1856, 1, 2048]
    - [236, 41.41]
  - - [1728, 1856, 1, 2048]
    - [237, 42.18]
  - - [1984, 1856, 1, 2048]
    - [275, 41.61]
  - - [64, 1984, 1, 2048]
    - [207, 13.02]
  - - [192, 1984, 1, 2048]
    - [207, 27.36]
  - - [320, 1984, 1, 2048]
    - [207, 32.4]
  - - [448, 1984, 1, 2048]
    - [299, 34.88]
  - - [576, 1984, 1, 2048]
    - [281, 37.24]
  - - [704, 1984, 1, 2048]
    - [281, 37.98]
  - - [832, 1984, 1, 2048]
    - [281, 38.54]
  - - [960, 1984, 1, 2048]
    - [299, 39.6]
  - - [1088, 1984, 1, 2048]
    - [299, 40.12]
  - - [1216, 1984, 1, 2048]
    - [327, 41.02]
  - - [1344, 1984, 1, 2048]
    - [159, 40.55]
  - - [1472, 1984, 1, 2048]
    - [346, 41.76]
  - - [1600, 1984, 1, 2048]
    - [292, 40.72]
  - - [1728, 1984, 1, 2048]
    - [327, 42.76]
  - - [1856, 1984, 1, 2048]
    - [287, 42.27]
  - - [1984, 1984, 1, 2048]
    - [346, 43.87]
  - - [192, 64, 1, 4096]
    - [262, 2.5]
  - - [448, 64, 1, 4096]
    - [265, 5.63]
  - - [704, 64, 1, 4096]
    - [267, 8.17]
  - - [960, 64, 1, 4096]
    - [267, 10.67]
  - - [1216, 64, 1, 4096]
    - [343, 11.59]
  - - [1472, 64, 1, 4096]
    - [343, 13.8]
  - - [1728, 64, 1, 4096]
    - [281, 15.12]
  - - [1984, 64, 1, 4096]
    - [281, 17.65]
  - - [64, 192, 1, 4096]
    - [319, 2.5]
  - - [192, 192, 1, 4096]
    - [273, 6.41]
  - - [320, 192, 1, 4096]
    - [159, 9.16]
  - - [448, 192, 1, 4096]
    - [281, 12.7]
  - - [576, 192, 1, 4096]
    - [159, 16.1]
  - - [704, 192, 1, 4096]
    - [278, 16.66]
  - - [832, 192, 1, 4096]
    - [278, 19.68]
  - - [960, 192, 1, 4096]
    - [281, 22.41]
  - - [1088, 192, 1, 4096]
    - [281, 25.26]
  - - [1216, 192, 1, 4096]
    - [281, 27.89]
  - - [1344, 192, 1, 4096]
    - [281, 30.41]
  - - [1472, 192, 1, 4096]
    - [281, 26.19]
  - - [1600, 192, 1, 4096]
    - [337, 28.39]
  - - [1728, 192, 1, 4096]
    - [281, 30.7]
  - - [1856, 192, 1, 4096]
    - [337, 32.89]
  - - [1984, 192, 1, 4096]
    - [299, 34.55]
  - - [192, 320, 1, 4096]
    - [159, 9.36]
  - - [448, 320, 1, 4096]
    - [335, 17.63]
  - - [704, 320, 1, 4096]
    - [281, 27.23]
  - - [960, 320, 1, 4096]
    - [299, 28.51]
  - - [1216, 320, 1, 4096]
    - [337, 34.97]
  - - [1472, 320, 1, 4096]
    - [281, 34.66]
  - - [1728, 320, 1, 4096]
    - [335, 33.71]
  - - [1984, 320, 1, 4096]
    - [207, 37.8]
  - - [64, 448, 1, 4096]
    - [315, 5.76]
  - - [192, 448, 1, 4096]
    - [159, 12.69]
  - - [320, 448, 1, 4096]
    - [337, 17.65]
  - - [448, 448, 1, 4096]
    - [275, 24.05]
  - - [576, 448, 1, 4096]
    - [281, 30.41]
  - - [704, 448, 1, 4096]
    - [275, 29.04]
  - - [832, 448, 1, 4096]
    - [281, 33.79]
  - - [960, 448, 1, 4096]
    - [281, 31.48]
  - - [1088, 448, 1, 4096]
    - [287, 35.09]
  - - [1216, 448, 1, 4096]
    - [321, 33.58]
  - - [1344, 448, 1, 4096]
    - [207, 36.19]
  - - [1472, 448, 1, 4096]
    - [310, 36.12]
  - - [1600, 448, 1, 4096]
    - [342, 36.58]
  - - [1728, 448, 1, 4096]
    - [292, 38.55]
  - - [1856, 448, 1, 4096]
    - [373, 37.67]
  - - [1984, 448, 1, 4096]
    - [275, 39.71]
  - - [192, 576, 1, 4096]
    - [159, 16.17]
  - - [448, 576, 1, 4096]
    - [281, 30.42]
  - - [704, 576, 1, 4096]
    - [287, 30.04]
  - - [960, 576, 1, 4096]
    - [321, 34.38]
  - - [1216, 576, 1, 4096]
    - [142, 38.46]
  - - [1472, 576, 1, 4096]
    - [233, 39.5]
  - - [1728, 576, 1, 4096]
    - [281, 40.56]
  - - [1984, 576, 1, 4096]
    - [281, 42.0]
  - - [64, 704, 1, 4096]
    - [330, 7.53]
  - - [192, 704, 1, 4096]
    - [337, 16.72]
  - - [320, 704, 1, 4096]
    - [159, 27.17]
  - - [448, 704, 1, 4096]
    - [281, 29.28]
  - - [576, 704, 1, 4096]
    - [281, 29.84]
  - - [704, 704, 1, 4096]
    - [207, 36.11]
  - - [832, 704, 1, 4096]
    - [321, 35.78]
  - - [960, 704, 1, 4096]
    - [142, 36.79]
  - - [1088, 704, 1, 4096]
    - [142, 40.85]
  - - [1216, 704, 1, 4096]
    - [301, 40.83]
  - - [1344, 704, 1, 4096]
    - [233, 39.63]
  - - [1472, 704, 1, 4096]
    - [374, 40.55]
  - - [1600, 704, 1, 4096]
    - [299, 41.12]
  - - [1728, 704, 1, 4096]
    - [337, 39.83]
  - - [1856, 704, 1, 4096]
    - [374, 41.72]
  - - [1984, 704, 1, 4096]
    - [232, 40.55]
  - - [192, 832, 1, 4096]
    - [159, 19.4]
  - - [448, 832, 1, 4096]
    - [281, 33.91]
  - - [704, 832, 1, 4096]
    - [142, 35.89]
  - - [960, 832, 1, 4096]
    - [233, 37.8]
  - - [1216, 832, 1, 4096]
    - [159, 40.39]
  - - [1472, 832, 1, 4096]
    - [342, 40.79]
  - - [1728, 832, 1, 4096]
    - [375, 40.63]
  - - [1984, 832, 1, 4096]
    - [299, 43.14]
  - - [64, 960, 1, 4096]
    - [323, 9.38]
  - - [192, 960, 1, 4096]
    - [159, 22.31]
  - - [320, 960, 1, 4096]
    - [332, 28.55]
  - - [448, 960, 1, 4096]
    - [207, 31.61]
  - - [576, 960, 1, 4096]
    - [142, 36.34]
  - - [704, 960, 1, 4096]
    - [326, 36.27]
  - - [832, 960, 1, 4096]
    - [301, 37.54]
  - - [960, 960, 1, 4096]
    - [346, 40.81]
  - - [1088, 960, 1, 4096]
    - [373, 41.06]
  - - [1216, 960, 1, 4096]
    - [299, 42.13]
  - - [1344, 960, 1, 4096]
    - [375, 40.14]
  - - [1472, 960, 1, 4096]
    - [242, 41.36]
  - - [1600, 960, 1, 4096]
    - [376, 41.88]
  - - [1728, 960, 1, 4096]
    - [376, 42.04]
  - - [1856, 960, 1, 4096]
    - [299, 43.36]
  - - [1984, 960, 1, 4096]
    - [327, 42.93]
  - - [192, 1088, 1, 4096]
    - [281, 24.98]
  - - [448, 1088, 1, 4096]
    - [281, 35.34]
  - - [704, 1088, 1, 4096]
    - [321, 40.31]
  - - [960, 1088, 1, 4096]
    - [287, 41.37]
  - - [1216, 1088, 1, 4096]
    - [281, 40.54]
  - - [1472, 1088, 1, 4096]
    - [287, 42.05]
  - - [1728, 1088, 1, 4096]
    - [281, 43.18]
  - - [1984, 1088, 1, 4096]
    - [287, 43.85]
  - - [64, 1216, 1, 4096]
    - [287, 11.34]
  - - [192, 1216, 1, 4096]
    - [159, 28.2]
  - - [320, 1216, 1, 4096]
    - [292, 34.76]
  - - [448, 1216, 1, 4096]
    - [142, 36.36]
  - - [576, 1216, 1, 4096]
    - [310, 39.94]
  - - [704, 1216, 1, 4096]
    - [281, 39.62]
  - - [832, 1216, 1, 4096]
    - [299, 40.98]
  - - [960, 1216, 1, 4096]
    - [281, 42.45]
  - - [1088, 1216, 1, 4096]
    - [243, 40.93]
  - - [1216, 1216, 1, 4096]
    - [370, 44.66]
  - - [1344, 1216, 1, 4096]
    - [207, 43.08]
  - - [1472, 1216, 1, 4096]
    - [237, 43.25]
  - - [1600, 1216, 1, 4096]
    - [326, 45.77]
  - - [1728, 1216, 1, 4096]
    - [307, 44.2]
  - - [1856, 1216, 1, 4096]
    - [307, 43.06]
  - - [1984, 1216, 1, 4096]
    - [307, 45.82]
  - - [192, 1344, 1, 4096]
    - [159, 30.38]
  - - [448, 1344, 1, 4096]
    - [142, 38.08]
  - - [704, 1344, 1, 4096]
    - [326, 39.54]
  - - [960, 1344, 1, 4096]
    - [237, 42.1]
  - - [1216, 1344, 1, 4096]
    - [377, 41.73]
  - - [1472, 1344, 1, 4096]
    - [378, 43.31]
  - - [1728, 1344, 1, 4096]
    - [327, 43.79]
  - - [1984, 1344, 1, 4096]
    - [287, 42.74]
  - - [64, 1472, 1, 4096]
    - [159, 14.0]
  - - [192, 1472, 1, 4096]
    - [281, 26.25]
  - - [320, 1472, 1, 4096]
    - [281, 34.25]
  - - [448, 1472, 1, 4096]
    - [142, 36.81]
  - - [576, 1472, 1, 4096]
    - [233, 38.32]
  - - [704, 1472, 1, 4096]
    - [374, 40.76]
  - - [832, 1472, 1, 4096]
    - [310, 41.35]
  - - [960, 1472, 1, 4096]
    - [327, 41.63]
  - - [1088, 1472, 1, 4096]
    - [207, 42.01]
  - - [1216, 1472, 1, 4096]
    - [281, 43.83]
  - - [1344, 1472, 1, 4096]
    - [335, 42.25]
  - - [1472, 1472, 1, 4096]
    - [287, 43.93]
  - - [1600, 1472, 1, 4096]
    - [327, 44.6]
  - - [1728, 1472, 1, 4096]
    - [207, 42.57]
  - - [1856, 1472, 1, 4096]
    - [281, 43.58]
  - - [1984, 1472, 1, 4096]
    - [327, 45.39]
  - - [192, 1600, 1, 4096]
    - [335, 28.49]
  - - [448, 1600, 1, 4096]
    - [233, 37.71]
  - - [704, 1600, 1, 4096]
    - [299, 41.07]
  - - [960, 1600, 1, 4096]
    - [373, 41.9]
  - - [1216, 1600, 1, 4096]
    - [237, 43.64]
  - - [1472, 1600, 1, 4096]
    - [346, 44.12]
  - - [1728, 1600, 1, 4096]
    - [327, 43.29]
  - - [1984, 1600, 1, 4096]
    - [327, 43.12]
  - - [64, 1728, 1, 4096]
    - [337, 16.08]
  - - [192, 1728, 1, 4096]
    - [207, 30.63]
  - - [320, 1728, 1, 4096]
    - [142, 34.29]
  - - [448, 1728, 1, 4096]
    - [281, 39.65]
  - - [576, 1728, 1, 4096]
    - [281, 40.65]
  - - [704, 1728, 1, 4096]
    - [207, 40.78]
  - - [832, 1728, 1, 4096]
    - [286, 41.57]
  - - [960, 1728, 1, 4096]
    - [237, 42.89]
  - - [1088, 1728, 1, 4096]
    - [281, 43.12]
  - - [1216, 1728, 1, 4096]
    - [287, 43.2]
  - - [1344, 1728, 1, 4096]
    - [346, 43.09]
  - - [1472, 1728, 1, 4096]
    - [376, 42.12]
  - - [1600, 1728, 1, 4096]
    - [207, 43.54]
  - - [1728, 1728, 1, 4096]
    - [287, 44.3]
  - - [1856, 1728, 1, 4096]
    - [327, 44.01]
  - - [1984, 1728, 1, 4096]
    - [346, 46.71]
  - - [192, 1856, 1, 4096]
    - [281, 32.7]
  - - [448, 1856, 1, 4096]
    - [281, 37.91]
  - - [704, 1856, 1, 4096]
    - [286, 41.1]
  - - [960, 1856, 1, 4096]
    - [237, 42.95]
  - - [1216, 1856, 1, 4096]
    - [327, 42.82]
  - - [1472, 1856, 1, 4096]
    - [287, 43.11]
  - - [1728, 1856, 1, 4096]
    - [327, 43.78]
  - - [1984, 1856, 1, 4096]
    - [327, 45.16]
  - - [64, 1984, 1, 4096]
    - [287, 18.29]
  - - [192, 1984, 1, 4096]
    - [207, 34.68]
  - - [320, 1984, 1, 4096]
    - [278, 37.71]
  - - [448, 1984, 1, 4096]
    - [159, 39.57]
  - - [576, 1984, 1, 4096]
    - [159, 40.91]
  - - [704, 1984, 1, 4096]
    - [242, 41.19]
  - - [832, 1984, 1, 4096]
    - [281, 43.41]
  - - [960, 1984, 1, 4096]
    - [346, 42.99]
  - - [1088, 1984, 1, 4096]
    - [278, 43.12]
  - - [1216, 1984, 1, 4096]
    - [346, 44.9]
  - - [1344, 1984, 1, 4096]
    - [281, 42.67]
  - - [1472, 1984, 1, 4096]
    - [327, 45.9]
  - - [1600, 1984, 1, 4096]
    - [346, 44.07]
  - - [1728, 1984, 1, 4096]
    - [327, 46.68]
  - - [1856, 1984, 1, 4096]
    - [346, 45.43]
  - - [1984, 1984, 1, 4096]
    - [327, 47.36]
  - - [128, 64, 1, 64]
    - [115, 0.05]
  - - [256, 64, 1, 64]
    - [117, 0.11]
  - - [384, 64, 1, 64]
    - [119, 0.16]
  - - [512, 64, 1, 64]
    - [121, 0.21]
  - - [640, 64, 1, 64]
    - [123, 0.25]
  - - [768, 64, 1, 64]
    - [125, 0.31]
  - - [896, 64, 1, 64]
    - [127, 0.35]
  - - [1024, 64, 1, 64]
    - [129, 0.41]
  - - [64, 128, 1, 64]
    - [130, 0.05]
  - - [128, 128, 1, 64]
    - [131, 0.1]
  - - [192, 128, 1, 64]
    - [132, 0.16]
  - - [256, 128, 1, 64]
    - [133, 0.21]
  - - [320, 128, 1, 64]
    - [134, 0.25]
  - - [384, 128, 1, 64]
    - [135, 0.3]
  - - [448, 128, 1, 64]
    - [136, 0.35]
  - - [512, 128, 1, 64]
    - [137, 0.4]
  - - [576, 128, 1, 64]
    - [138, 0.45]
  - - [640, 128, 1, 64]
    - [139, 0.49]
