projects/hipblaslt/library/src/amd_detail/rocblaslt/src/Tensile/Logic/asm_full/gfx950/gfx950/Equality/gfx950_Cijk_Ailk_Bljk_S_B_BiasS_HAS_SAV_UserArgs.yaml
- {MinimumRequiredVersion: 5.0.0}
- gfx950
- {Architecture: gfx950, CUCount: 256}
- [Device 75a0]
    SolutionIndex: 0
    SolutionNameMin: Cijk_Ailk_Bljk_S_B_Bias_HA_S_SAV_UserArgs_MT16x16x256_MI16x16x1_SN_LDSB1_AFC0_AG0_AFEM1_AFEM1_ASEM1_CLR1_CADS0_DTLA0_DTLB0_DTVA0_DTVB0_DTVMXSA0_DTVMXSB0_DTVSM0_DPLBn1_EPS0_ELFLR0_EMLLn1_FDSI0_GRPM1_GRVWA1_GRVWB4_GSU0_GSUAMB_GSUC0_GSUWGMRR0_GLS0_ISA950_IU1_K1_LDSTI0_LBSPPA256_LBSPPB1024_LBSPPM0_LPA16_LPB8_LPM0_LRVW4_LWPMn1_MIAV0_MIWT1_1_MO40_MGRIPMn1_NTn1_NTA6_NTB6_NTC2_NTD5_NTM0_NEPBS10_NLCA1_NLCB1_ONLL1_PGR2_PLR1_PKA1_SGROBn1_SIA3_SS0_SU0_SUM0_SUS0_SPO0_SRVW0_SSO0_SVW1_SK3_SKFTR0_SKXCCM8_SGRO0_TDMI0_TIN0_TLDS1_TLDSM1_ULSGRO0_USL1_UIOFGRO0_UPLRP0_USFGRO0_VSn1_VWA1_VWB1_WSGRA0_WSGRB0_WS64_WG16_4_4_WGM1_WGMXCC1_WGMXCCGn1
    SolutionIndex: 1
    SolutionNameMin: Cijk_Ailk_Bljk_S_B_Bias_HA_S_SAV_UserArgs_MT48x64x16_MI16x16x1_SN_LDSB1_AFC0_AG0_AFEM1_AFEM1_ASEM1_CLR1_CADS0_DTLA0_DTLB0_DTVA0_DTVB0_DTVMXSA0_DTVMXSB0_DTVSM0_DPLBn1_EPS0_ELFLR0_EMLLn1_FDSI0_GRPM1_GRVWA1_GRVWB2_GSU0_GSUAMB_GSUC0_GSUWGMRR0_GLS0_ISA950_IU1_K1_LDSTI0_LBSPPA192_LBSPPB256_LBSPPM0_LPA0_LPB16_LPM0_LRVW1_LWPMn1_MIAV1_MIWT3_1_MO40_MGRIPMn1_NTn1_NTA0_NTB1_NTC0_NTD6_NTM0_NEPBS14_NLCA3_NLCB1_ONLL1_PGR2_PLR1_PKA1_SGROBn1_SIA3_SS1_SU8_SUM1_SUS256_SPO0_SRVW0_SSO0_SVW1_SK3_SKFTR0_SKXCCM0_SGRO0_TDMI0_TIN0_TLDS0_TLDSM1_ULSGRO0_USL1_UIOFGRO0_UPLRP0_USFGRO0_VSn1_VWA1_VWB1_WSGRA0_WSGRB0_WS64_WG16_16_1_WGM1_WGMXCC1_WGMXCCGn1
    SolutionIndex: 2
    SolutionNameMin: Cijk_Ailk_Bljk_S_B_Bias_HA_S_SAV_UserArgs_MT128x128x16_MI32x32x1_SN_LDSB1_AFC0_AG0_AFEM1_AFEM1_ASEM1_CLR1_CADS0_DTLA0_DTLB0_DTVA0_DTVB0_DTVMXSA0_DTVMXSB0_DTVSM0_DPLBn1_EPS1_ELFLR0_EMLLn1_FDSI0_GRPM1_GRVWA4_GRVWB4_GSU0_GSUAMB_GSUC0_GSUWGMRR0_GLS0_ISA950_IU1_K1_LDSTI0_LBSPPA128_LBSPPB256_LBSPPM0_LPA4_LPB4_LPM0_LRVW4_LWPMn1_MIAV0_MIWT1_4_MO40_MGRIPMn1_NTn1_NTA1_NTB2_NTC1_NTD0_NTM0_NEPBS0_NLCA1_NLCB1_ONLL1_PGR1_PLR1_PKA1_SGROBn1_SIA3_SS1_SU0_SUM0_SUS0_SPO0_SRVW0_SSO4_SVW1_SK3_SKFTR0_SKXCCM0_SGRO0_TDMI0_TIN0_TLDS2_TLDSM1_ULSGRO0_USL1_UIOFGRO0_UPLRP0_USFGROn1_VSn1_VWA1_VWB4_WSGRA0_WSGRB0_WS64_WG128_2_1_WGM1_WGMXCC4_WGMXCCGn1
    SolutionIndex: 3
    SolutionNameMin: Cijk_Ailk_Bljk_S_B_Bias_HA_S_SAV_UserArgs_MT256x128x16_MI16x16x1_SN_LDSB0_AFC0_AG0_AFEM1_AFEM1_ASEM1_CLR1_CADS0_DTLA0_DTLB0_DTVA0_DTVB0_DTVMXSA0_DTVMXSB0_DTVSM0_DPLBn1_EPS1_ELFLR0_EMLLn1_FDSI0_GRPM1_GRVWA4_GRVWB4_GSU0_GSUAMB_GSUC0_GSUWGMRR0_GLS0_ISA950_IU1_K1_LDSTI0_LBSPPA1024_LBSPPB512_LBSPPM0_LPA0_LPB0_LPM0_LRVW1_LWPMn1_MIAV0_MIWT8_4_MO40_MGRIPMn1_NTn1_NTA3_NTB2_NTC6_NTD6_NTM0_NEPBS4_NLCA1_NLCB1_ONLL1_PGR1_PLR1_PKA1_SGROBn1_SIA3_SS1_SU8_SUM1_SUS128_SPO0_SRVW0_SSO1_SVW4_SK3_SKFTR0_SKXCCM0_SGRO0_TDMI0_TIN0_TLDS0_TLDSM1_ULSGRO0_USL1_UIOFGRO0_UPLRP0_USFGRO0_VSn1_VWA4_VWB4_WSGRA0_WSGRB0_WS64_WG32_8_1_WGM1_WGMXCC8_WGMXCCGn1
    SolutionIndex: 4
    SolutionNameMin: Cijk_Ailk_Bljk_S_B_Bias_HA_S_SAV_UserArgs_MT128x128x16_MI16x16x1_SN_LDSB1_AFC0_AG0_AFEM1_AFEM1_ASEM1_CLR1_CADS0_DTLA0_DTLB0_DTVA0_DTVB0_DTVMXSA0_DTVMXSB0_DTVSM0_DPLBn1_EPS0_ELFLR0_EMLLn1_FDSI0_GRPM1_GRVWA4_GRVWB4_GSU0_GSUAMB_GSUC0_GSUWGMRR0_GLS0_ISA950_IU1_K1_LDSTI0_LBSPPA512_LBSPPB512_LBSPPM0_LPA0_LPB0_LPM0_LRVW1_LWPMn1_MIAV1_MIWT8_2_MO40_MGRIPMn1_NTn1_NTA2_NTB0_NTC4_NTD7_NTM0_NEPBS4_NLCA1_NLCB1_ONLL1_PGR2_PLR1_PKA1_SGROBn1_SIA3_SS1_SU8_SUM1_SUS256_SPO1_SRVW0_SSO0_SVW4_SK3_SKFTR0_SKXCCM4_SGRO0_TDMI0_TIN0_TLDS0_TLDSM1_ULSGRO0_USL1_UIOFGRO0_UPLRP0_USFGRO0_VSn1_VWA4_VWB2_WSGRA0_WSGRB0_WS64_WG16_16_1_WGM1_WGMXCC4_WGMXCCGn1
    SolutionIndex: 5
    SolutionNameMin: Cijk_Ailk_Bljk_S_B_Bias_HA_S_SAV_UserArgs_MT128x192x16_MI16x16x1_SN_LDSB1_AFC0_AG0_AFEM1_AFEM1_ASEM1_CLR1_CADS0_DTLA0_DTLB0_DTVA0_DTVB0_DTVMXSA0_DTVMXSB0_DTVSM0_DPLBn1_EPS1_ELFLR0_EMLLn1_FDSI0_GRPM1_GRVWA4_GRVWB4_GSU0_GSUAMB_GSUC0_GSUWGMRR0_GLS0_ISA950_IU1_K1_LDSTI0_LBSPPA1024_LBSPPB128_LBSPPM0_LPA0_LPB4_LPM0_LRVW2_LWPMn1_MIAV0_MIWT8_3_MO40_MGRIPMn1_NTn1_NTA1_NTB0_NTC5_NTD6_NTM0_NEPBS4_NLCA1_NLCB1_ONLL1_PGR1_PLR1_PKA1_SGROBn1_SIA3_SS1_SU8_SUM1_SUS128_SPO1_SRVW0_SSO0_SVW4_SK3_SKFTR0_SKXCCM8_SGRO0_TDMI0_TIN0_TLDS1_TLDSM1_ULSGRO0_USL1_UIOFGRO0_UPLRP0_USFGRO1_VSn1_VWA4_VWB1_WSGRA0_WSGRB0_WS64_WG16_16_1_WGM1_WGMXCC1_WGMXCCGn1
    SolutionIndex: 6
    SolutionNameMin: Cijk_Ailk_Bljk_S_B_Bias_HA_S_SAV_UserArgs_MT128x192x16_MI16x16x1_SN_LDSB1_AFC0_AG0_AFEM1_AFEM1_ASEM1_CLR0_CADS0_DTLA0_DTLB0_DTVA0_DTVB0_DTVMXSA0_DTVMXSB0_DTVSM0_DPLBn1_EPS0_ELFLR0_EMLLn1_FDSI0_GRPM1_GRVWA4_GRVWB4_GSU0_GSUAMB_GSUC0_GSUWGMRR0_GLS0_ISA950_IU1_K1_LDSTI1_LBSPPA512_LBSPPB768_LBSPPM0_LPA0_LPB16_LPM0_LRVW1_LWPMn1_MIAV0_MIWT8_3_MO40_MGRIPMn1_NTn1_NTA3_NTB1_NTC7_NTD6_NTM0_NEPBS14_NLCA1_NLCB1_ONLL1_PGR2_PLR1_PKA1_SGROBn1_SIA3_SS1_SU0_SUM0_SUS0_SPO1_SRVW0_SSO1_SVW4_SK3_SKFTR0_SKXCCM8_SGRO0_TDMI0_TIN0_TLDS0_TLDSM1_ULSGRO0_USL1_UIOFGRO0_UPLRP0_USFGRO0_VSn1_VWA4_VWB1_WSGRA0_WSGRB0_WS64_WG16_16_1_WGM1_WGMXCC1_WGMXCCGn1
    SolutionIndex: 7
    SolutionNameMin: Cijk_Ailk_Bljk_S_B_Bias_HA_S_SAV_UserArgs_MT256x96x16_MI16x16x1_SN_LDSB1_AFC0_AG0_AFEM1_AFEM1_ASEM1_CLR0_CADS0_DTLA0_DTLB0_DTVA0_DTVB0_DTVMXSA0_DTVMXSB0_DTVSM0_DPLBn1_EPS0_ELFLR0_EMLLn1_FDSI0_GRPM1_GRVWA4_GRVWB2_GSU0_GSUAMB_GSUC0_GSUWGMRR0_GLS0_ISA950_IU1_K1_LDSTI1_LBSPPA1024_LBSPPB384_LBSPPM0_LPA0_LPB16_LPM0_LRVW1_LWPMn1_MIAV0_MIWT8_3_MO40_MGRIPMn1_NTn1_NTA2_NTB0_NTC5_NTD6_NTM0_NEPBS4_NLCA1_NLCB1_ONLL1_PGR2_PLR1_PKA1_SGROBn1_SIA3_SS1_SU8_SUM1_SUS512_SPO0_SRVW0_SSO1_SVW4_SK3_SKFTR0_SKXCCM0_SGRO0_TDMI0_TIN0_TLDS0_TLDSM1_ULSGRO0_USL1_UIOFGRO0_UPLRP0_USFGROn1_VSn1_VWA4_VWB1_WSGRA0_WSGRB0_WS64_WG32_8_1_WGM1_WGMXCC8_WGMXCCGn1
    SolutionIndex: 8
    SolutionNameMin: Cijk_Ailk_Bljk_S_B_Bias_HA_S_SAV_UserArgs_MT16x384x16_MI16x16x1_SN_LDSB1_AFC0_AG0_AFEM1_AFEM1_ASEM1_CLR0_CADS0_DTLA0_DTLB0_DTVA0_DTVB0_DTVMXSA0_DTVMXSB0_DTVSM0_DPLBn1_EPS0_ELFLR0_EMLLn1_FDSI0_GRPM1_GRVWA1_GRVWB4_GSU0_GSUAMB_GSUC0_GSUWGMRR0_GLS0_ISA950_IU1_K1_LDSTI1_LBSPPA64_LBSPPB1536_LBSPPM0_LPA0_LPB0_LPM0_LRVW1_LWPMn1_MIAV1_MIWT1_6_MO40_MGRIPMn1_NTn1_NTA0_NTB4_NTC1_NTD5_NTM0_NEPBS16_NLCA1_NLCB1_ONLL1_PGR2_PLR1_PKA1_SGROBn1_SIA3_SS0_SU0_SUM0_SUS0_SPO0_SRVW0_SSO0_SVW4_SK3_SKFTR0_SKXCCM0_SGRO0_TDMI0_TIN0_TLDS0_TLDSM1_ULSGRO0_USL1_UIOFGRO0_UPLRP0_USFGRO1_VSn1_VWA1_VWB2_WSGRA0_WSGRB0_WS64_WG16_16_1_WGM1_WGMXCC8_WGMXCCGn1
    SolutionIndex: 9
    SolutionNameMin: Cijk_Ailk_Bljk_S_B_Bias_HA_S_SAV_UserArgs_MT48x192x32_MI16x16x1_SN_LDSB1_AFC0_AG0_AFEM1_AFEM1_ASEM1_CLR1_CADS0_DTLA0_DTLB0_DTVA0_DTVB0_DTVMXSA0_DTVMXSB0_DTVSM0_DPLBn1_EPS1_ELFLR0_EMLLn1_FDSI0_GRPM1_GRVWA2_GRVWB4_GSU0_GSUAMB_GSUC0_GSUWGMRR0_GLS0_ISA950_IU1_K1_LDSTI0_LBSPPA768_LBSPPB128_LBSPPM0_LPA16_LPB8_LPM0_LRVW4_LWPMn1_MIAV0_MIWT3_3_MO40_MGRIPMn1_NTn1_NTA0_NTB5_NTC1_NTD6_NTM0_NEPBS0_NLCA3_NLCB1_ONLL1_PGR1_PLR1_PKA1_SGROBn1_SIA3_SS1_SU0_SUM0_SUS0_SPO1_SRVW0_SSO0_SVW1_SK3_SKFTR0_SKXCCM0_SGRO0_TDMI0_TIN0_TLDS1_TLDSM1_ULSGRO0_USL1_UIOFGRO0_UPLRP0_USFGRO0_VSn1_VWA1_VWB1_WSGRA0_WSGRB0_WS64_WG16_16_1_WGM1_WGMXCC8_WGMXCCGn1
    SolutionIndex: 10
    SolutionNameMin: Cijk_Ailk_Bljk_S_B_Bias_HA_S_SAV_UserArgs_MT32x64x64_MI16x16x1_SN_LDSB1_AFC0_AG0_AFEM1_AFEM1_ASEM1_CLR1_CADS0_DTLA0_DTLB0_DTVA0_DTVB0_DTVMXSA0_DTVMXSB0_DTVSM0_DPLBn1_EPS0_ELFLR0_EMLLn1_FDSI0_GRPM1_GRVWA1_GRVWB4_GSU0_GSUAMB_GSUC0_GSUWGMRR0_GLS0_ISA950_IU1_K1_LDSTI0_LBSPPA512_LBSPPB256_LBSPPM0_LPA0_LPB8_LPM0_LRVW4_LWPMn1_MIAV0_MIWT2_1_MO40_MGRIPMn1_NTn1_NTA0_NTB0_NTC2_NTD6_NTM0_NEPBS0_NLCA1_NLCB1_ONLL1_PGR2_PLR1_PKA1_SGROBn1_SIA3_SS1_SU0_SUM0_SUS0_SPO0_SRVW0_SSO0_SVW2_SK3_SKFTR0_SKXCCM0_SGRO0_TDMI0_TIN0_TLDS1_TLDSM1_ULSGRO0_USL1_UIOFGRO0_UPLRP0_USFGRO0_VSn1_VWA2_VWB1_WSGRA0_WSGRB0_WS64_WG16_16_1_WGM1_WGMXCC4_WGMXCCGn1
    SolutionIndex: 11
    SolutionNameMin: Cijk_Ailk_Bljk_S_B_Bias_HA_S_SAV_UserArgs_MT32x64x64_MI16x16x1_SN_LDSB1_AFC0_AG0_AFEM1_AFEM1_ASEM1_CLR1_CADS0_DTLA0_DTLB0_DTVA0_DTVB0_DTVMXSA0_DTVMXSB0_DTVSM0_DPLBn1_EPS0_ELFLR0_EMLLn1_FDSI0_GRPM1_GRVWA1_GRVWB4_GSU0_GSUAMB_GSUC0_GSUWGMRR0_GLS0_ISA950_IU1_K1_LDSTI0_LBSPPA512_LBSPPB256_LBSPPM0_LPA0_LPB8_LPM0_LRVW4_LWPMn1_MIAV0_MIWT2_1_MO40_MGRIPMn1_NTn1_NTA2_NTB2_NTC5_NTD6_NTM0_NEPBS12_NLCA1_NLCB1_ONLL1_PGR2_PLR1_PKA1_SGROBn1_SIA3_SS1_SU0_SUM0_SUS0_SPO0_SRVW0_SSO0_SVW2_SK3_SKFTR0_SKXCCM0_SGRO0_TDMI0_TIN0_TLDS1_TLDSM1_ULSGRO0_USL1_UIOFGRO0_UPLRP0_USFGRO0_VSn1_VWA2_VWB1_WSGRA0_WSGRB0_WS64_WG16_16_1_WGM1_WGMXCC4_WGMXCCGn1
    SolutionIndex: 12
    SolutionNameMin: Cijk_Ailk_Bljk_S_B_Bias_HA_S_SAV_UserArgs_MT64x48x64_MI16x16x1_SN_LDSB1_AFC0_AG0_AFEM1_AFEM1_ASEM1_CLR1_CADS0_DTLA0_DTLB0_DTVA0_DTVB0_DTVMXSA0_DTVMXSB0_DTVSM0_DPLBn1_EPS0_ELFLR0_EMLLn1_FDSI0_GRPM1_GRVWA4_GRVWB4_GSU0_GSUAMB_GSUC0_GSUWGMRR0_GLS0_ISA950_IU1_K1_LDSTI0_LBSPPA1024_LBSPPB256_LBSPPM0_LPA16_LPB8_LPM0_LRVW4_LWPMn1_MIAV0_MIWT1_3_MO40_MGRIPMn1_NTn1_NTA1_NTB2_NTC0_NTD5_NTM0_NEPBS0_NLCA1_NLCB1_ONLL1_PGR2_PLR1_PKA1_SGROBn1_SIA3_SS1_SU0_SUM0_SUS0_SPO0_SRVW0_SSO0_SVW1_SK3_SKFTR0_SKXCCM4_SGRO0_TDMI0_TIN0_TLDS1_TLDSM1_ULSGRO0_USL1_UIOFGRO0_UPLRP0_USFGRO0_VSn1_VWA1_VWB1_WSGRA0_WSGRB0_WS64_WG64_4_1_WGM1_WGMXCC1_WGMXCCGn1
    SolutionIndex: 13
    SolutionNameMin: Cijk_Ailk_Bljk_S_B_Bias_HA_S_SAV_UserArgs_MT64x64x64_MI32x32x1_SN_LDSB1_AFC0_AG0_AFEM1_AFEM1_ASEM1_CLR1_CADS0_DTLA0_DTLB0_DTVA0_DTVB0_DTVMXSA0_DTVMXSB0_DTVSM0_DPLBn1_EPS1_ELFLR0_EMLLn1_FDSI0_GRPM1_GRVWA4_GRVWB4_GSU0_GSUAMB_GSUC0_GSUWGMRR0_GLS0_ISA950_IU1_K1_LDSTI0_LBSPPA0_LBSPPB256_LBSPPM0_LPA0_LPB4_LPM0_LRVW4_LWPMn1_MIAV1_MIWT1_1_MO40_MGRIPMn1_NTn1_NTA1_NTB2_NTC0_NTD4_NTM0_NEPBS16_NLCA1_NLCB1_ONLL1_PGR1_PLR1_PKA1_SGROBn1_SIA3_SS1_SU0_SUM0_SUS0_SPO0_SRVW0_SSO0_SVW1_SK3_SKFTR0_SKXCCM4_SGRO0_TDMI0_TIN0_TLDS1_TLDSM1_ULSGRO0_USL1_UIOFGRO0_UPLRP0_USFGROn1_VSn1_VWA1_VWB1_WSGRA0_WSGRB0_WS64_WG64_4_1_WGM1_WGMXCC1_WGMXCCGn1
    SolutionIndex: 14
    SolutionNameMin: Cijk_Ailk_Bljk_S_B_Bias_HA_S_SAV_UserArgs_MT64x64x32_MI32x32x1_SN_LDSB1_AFC0_AG0_AFEM1_AFEM1_ASEM1_CLR1_CADS0_DTLA0_DTLB0_DTVA0_DTVB0_DTVMXSA0_DTVMXSB0_DTVSM0_DPLBn1_EPS0_ELFLR0_EMLLn1_FDSI0_GRPM1_GRVWA1_GRVWB4_GSU0_GSUAMB_GSUC0_GSUWGMRR0_GLS0_ISA950_IU1_K1_LDSTI0_LBSPPA0_LBSPPB128_LBSPPM0_LPA0_LPB4_LPM0_LRVW4_LWPMn1_MIAV0_MIWT1_1_MO40_MGRIPMn1_NTn1_NTA3_NTB1_NTC7_NTD5_NTM0_NEPBS0_NLCA1_NLCB1_ONLL1_PGR2_PLR1_PKA1_SGROBn1_SIA3_SS1_SU0_SUM0_SUS0_SPO1_SRVW0_SSO0_SVW1_SK3_SKFTR0_SKXCCM0_SGRO0_TDMI0_TIN0_TLDS1_TLDSM1_ULSGRO0_USL1_UIOFGRO0_UPLRP0_USFGRO1_VSn1_VWA1_VWB1_WSGRA0_WSGRB0_WS64_WG64_4_1_WGM1_WGMXCC2_WGMXCCGn1
    SolutionIndex: 15
    SolutionNameMin: Cijk_Ailk_Bljk_S_B_Bias_HA_S_SAV_UserArgs_MT64x64x64_MI16x16x1_SN_LDSB1_AFC0_AG0_AFEM1_AFEM1_ASEM1_CLR1_CADS0_DTLA0_DTLB0_DTVA0_DTVB0_DTVMXSA0_DTVMXSB0_DTVSM0_DPLBn1_EPS0_ELFLR0_EMLLn1_FDSI0_GRPM1_GRVWA1_GRVWB4_GSU0_GSUAMB_GSUC0_GSUWGMRR0_GLS0_ISA950_IU1_K1_LDSTI0_LBSPPA1024_LBSPPB512_LBSPPM0_LPA0_LPB8_LPM0_LRVW4_LWPMn1_MIAV1_MIWT2_2_MO40_MGRIPMn1_NTn1_NTA3_NTB1_NTC4_NTD5_NTM0_NEPBS10_NLCA1_NLCB1_ONLL1_PGR2_PLR1_PKA1_SGROBn1_SIA3_SS1_SU0_SUM0_SUS0_SPO0_SRVW0_SSO0_SVW2_SK3_SKFTR0_SKXCCM4_SGRO0_TDMI0_TIN0_TLDS1_TLDSM1_ULSGRO0_USL1_UIOFGRO0_UPLRP0_USFGRO0_VSn1_VWA2_VWB2_WSGRA0_WSGRB0_WS64_WG32_8_1_WGM1_WGMXCC1_WGMXCCGn1
    SolutionIndex: 16
    SolutionNameMin: Cijk_Ailk_Bljk_S_B_Bias_HA_S_SAV_UserArgs_MT64x48x64_MI16x16x1_SN_LDSB1_AFC0_AG0_AFEM1_AFEM1_ASEM1_CLR1_CADS0_DTLA0_DTLB0_DTVA0_DTVB0_DTVMXSA0_DTVMXSB0_DTVSM0_DPLBn1_EPS0_ELFLR0_EMLLn1_FDSI0_GRPM1_GRVWA4_GRVWB4_GSU0_GSUAMB_GSUC0_GSUWGMRR0_GLS0_ISA950_IU1_K1_LDSTI0_LBSPPA1024_LBSPPB256_LBSPPM0_LPA16_LPB8_LPM0_LRVW4_LWPMn1_MIAV1_MIWT1_3_MO40_MGRIPMn1_NTn1_NTA1_NTB2_NTC1_NTD6_NTM0_NEPBS0_NLCA1_NLCB1_ONLL1_PGR2_PLR1_PKA1_SGROBn1_SIA3_SS1_SU0_SUM0_SUS0_SPO1_SRVW0_SSO0_SVW1_SK3_SKFTR0_SKXCCM0_SGRO0_TDMI0_TIN0_TLDS1_TLDSM1_ULSGRO0_USL1_UIOFGRO0_UPLRP0_USFGRO0_VSn1_VWA1_VWB1_WSGRA0_WSGRB0_WS64_WG64_4_1_WGM1_WGMXCC4_WGMXCCGn1
    SolutionIndex: 17
    SolutionNameMin: Cijk_Ailk_Bljk_S_B_Bias_HA_S_SAV_UserArgs_MT128x80x16_MI16x16x1_SN_LDSB1_AFC0_AG0_AFEM1_AFEM1_ASEM1_CLR1_CADS0_DTLA0_DTLB0_DTVA0_DTVB0_DTVMXSA0_DTVMXSB0_DTVSM0_DPLBn1_EPS0_ELFLR0_EMLLn1_FDSI0_GRPM1_GRVWA4_GRVWB1_GSU0_GSUAMB_GSUC0_GSUWGMRR0_GLS0_ISA950_IU1_K1_LDSTI0_LBSPPA1024_LBSPPB128_LBSPPM0_LPA0_LPB2_LPM0_LRVW2_LWPMn1_MIAV1_MIWT2_5_MO40_MGRIPMn1_NTn1_NTA1_NTB0_NTC1_NTD5_NTM0_NEPBS16_NLCA1_NLCB1_ONLL1_PGR2_PLR1_PKA1_SGROBn1_SIA3_SS1_SU0_SUM0_SUS0_SPO0_SRVW0_SSO0_SVW2_SK3_SKFTR0_SKXCCM0_SGRO0_TDMI0_TIN0_TLDS1_TLDSM1_ULSGRO0_USL1_UIOFGRO0_UPLRP0_USFGRO1_VSn1_VWA2_VWB1_WSGRA0_WSGRB0_WS64_WG64_4_1_WGM6_WGMXCC8_WGMXCCGn1
    SolutionIndex: 18
    SolutionNameMin: Cijk_Ailk_Bljk_S_B_Bias_HA_S_SAV_UserArgs_MT64x64x16_MI16x16x1_SN_LDSB0_AFC0_AG0_AFEM1_AFEM1_ASEM1_CLR1_CADS0_DTLA0_DTLB0_DTVA0_DTVB0_DTVMXSA0_DTVMXSB0_DTVSM0_DPLBn1_EPS0_ELFLR0_EMLLn1_FDSI0_GRPM1_GRVWA1_GRVWB4_GSU0_GSUAMB_GSUC0_GSUWGMRR0_GLS0_ISA950_IU1_K1_LDSTI0_LBSPPA256_LBSPPB256_LBSPPM0_LPA0_LPB16_LPM0_LRVW1_LWPMn1_MIAV1_MIWT4_1_MO40_MGRIPMn1_NTn1_NTA1_NTB3_NTC5_NTD4_NTM0_NEPBS0_NLCA1_NLCB1_ONLL1_PGR2_PLR1_PKA1_SGROBn1_SIA3_SS1_SU0_SUM0_SUS0_SPO0_SRVW0_SSO0_SVW4_SK3_SKFTR0_SKXCCM0_SGRO0_TDMI0_TIN0_TLDS0_TLDSM1_ULSGRO0_USL1_UIOFGRO0_UPLRP0_USFGRO1_VSn1_VWA4_VWB1_WSGRA0_WSGRB0_WS64_WG16_16_1_WGM1_WGMXCC16_WGMXCCGn1
    SolutionIndex: 19
    SolutionNameMin: Cijk_Ailk_Bljk_S_B_Bias_HA_S_SAV_UserArgs_MT512x32x16_MI32x32x1_SN_LDSB0_AFC0_AG0_AFEM1_AFEM1_ASEM1_CLR1_CADS0_DTLA1_DTLB0_DTVA0_DTVB0_DTVMXSA0_DTVMXSB0_DTVSM0_DPLBn1_EPS0_ELFLR0_EMLLn1_FDSI0_GRPM1_GRVWA4_GRVWB2_GSU0_GSUAMB_GSUC0_GSUWGMRR0_GLS0_ISA950_IU1_K1_LDSTI0_LBSPPA0_LBSPPB0_LBSPPM0_LPA0_LPB0_LPM0_LRVW1_LWPMn1_MIAV0_MIWT4_1_MO40_MGRIPMn1_NTn1_NTA1_NTB1_NTC6_NTD5_NTM0_NEPBS16_NLCA1_NLCB1_ONLL1_PGR2_PLR1_PKA1_SGROBn1_SIA3_SS1_SU0_SUM0_SUS0_SPO1_SRVW0_SSO1_SVW4_SK3_SKFTR0_SKXCCM0_SGRO0_TDMI0_TIN0_TLDS0_TLDSM1_ULSGRO0_USL1_UIOFGRO0_UPLRP0_USFGROn1_VSn1_VWA4_VWB1_WSGRA0_WSGRB0_WS64_WG128_2_1_WGM1_WGMXCC16_WGMXCCGn1
    SolutionIndex: 20
    SolutionNameMin: Cijk_Ailk_Bljk_S_B_Bias_HA_S_SAV_UserArgs_MT128x96x16_MI32x32x1_SN_LDSB1_AFC0_AG0_AFEM1_AFEM1_ASEM1_CLR1_CADS0_DTLA0_DTLB0_DTVA0_DTVB0_DTVMXSA0_DTVMXSB0_DTVSM0_DPLBn1_EPS0_ELFLR0_EMLLn1_FDSI0_GRPM1_GRVWA1_GRVWB2_GSU0_GSUAMB_GSUC0_GSUWGMRR0_GLS0_ISA950_IU1_K1_LDSTI0_LBSPPA0_LBSPPB128_LBSPPM0_LPA0_LPB4_LPM0_LRVW4_LWPMn1_MIAV0_MIWT1_3_MO40_MGRIPMn1_NTn1_NTA2_NTB2_NTC4_NTD7_NTM0_NEPBS0_NLCA1_NLCB1_ONLL1_PGR2_PLR1_PKA1_SGROBn1_SIA3_SS1_SU0_SUM0_SUS0_SPO0_SRVW0_SSO1_SVW1_SK3_SKFTR0_SKXCCM0_SGRO0_TDMI0_TIN0_TLDS1_TLDSM1_ULSGRO0_USL1_UIOFGRO0_UPLRP0_USFGROn1_VSn1_VWA1_VWB1_WSGRA0_WSGRB0_WS64_WG128_2_1_WGM1_WGMXCC1_WGMXCCGn1
    SolutionIndex: 21
    SolutionNameMin: Cijk_Ailk_Bljk_S_B_Bias_HA_S_SAV_UserArgs_MT16x16x128_MI16x16x1_SN_LDSB1_AFC0_AG0_AFEM1_AFEM1_ASEM1_CLR1_CADS0_DTLA0_DTLB0_DTVA0_DTVB0_DTVMXSA0_DTVMXSB0_DTVSM0_DPLBn1_EPS0_ELFLR0_EMLLn1_FDSI0_GRPM1_GRVWA1_GRVWB4_GSU0_GSUAMB_GSUC0_GSUWGMRR0_GLS0_ISA950_IU1_K1_LDSTI0_LBSPPA256_LBSPPB512_LBSPPM0_LPA16_LPB8_LPM0_LRVW4_LWPMn1_MIAV0_MIWT1_1_MO40_MGRIPMn1_NTn1_NTA7_NTB0_NTC1_NTD4_NTM0_NEPBS2_NLCA1_NLCB1_ONLL1_PGR2_PLR1_PKA1_SGROBn1_SIA3_SS0_SU0_SUM0_SUS0_SPO1_SRVW0_SSO0_SVW1_SK3_SKFTR0_SKXCCM0_SGRO0_TDMI0_TIN0_TLDS1_TLDSM1_ULSGRO0_USL1_UIOFGRO0_UPLRP0_USFGRO0_VSn1_VWA1_VWB1_WSGRA0_WSGRB0_WS64_WG16_4_4_WGM1_WGMXCC8_WGMXCCGn1
    SolutionIndex: 22
    SolutionNameMin: Cijk_Ailk_Bljk_S_B_Bias_HA_S_SAV_UserArgs_MT32x16x128_MI16x16x1_SN_LDSB0_AFC0_AG0_AFEM1_AFEM1_ASEM1_CLR1_CADS0_DTLA0_DTLB0_DTVA0_DTVB0_DTVMXSA0_DTVMXSB0_DTVSM0_DPLBn1_EPS0_ELFLR0_EMLLn1_FDSI0_GRPM1_GRVWA4_GRVWB4_GSU0_GSUAMB_GSUC0_GSUWGMRR0_GLS0_ISA950_IU1_K1_LDSTI0_LBSPPA512_LBSPPB512_LBSPPM0_LPA16_LPB8_LPM0_LRVW4_LWPMn1_MIAV1_MIWT1_1_MO40_MGRIPMn1_NTn1_NTA6_NTB3_NTC3_NTD3_NTM0_NEPBS0_NLCA1_NLCB1_ONLL1_PGR2_PLR1_PKA1_SGROBn1_SIA3_SS0_SU8_SUM1_SUS512_SPO1_SRVW0_SSO0_SVW4_SK3_SKFTR0_SKXCCM2_SGRO0_TDMI0_TIN0_TLDS1_TLDSM1_ULSGRO0_USL1_UIOFGRO0_UPLRP0_USFGROn1_VSn1_VWA1_VWB1_WSGRA0_WSGRB0_WS64_WG32_4_1_WGM1_WGMXCC8_WGMXCCGn1
    SolutionIndex: 23
    SolutionNameMin: Cijk_Ailk_Bljk_S_B_Bias_HA_S_SAV_UserArgs_MT32x16x128_MI16x16x1_SN_LDSB0_AFC0_AG0_AFEM1_AFEM1_ASEM1_CLR1_CADS0_DTLA0_DTLB0_DTVA0_DTVB0_DTVMXSA0_DTVMXSB0_DTVSM0_DPLBn1_EPS0_ELFLR0_EMLLn1_FDSI0_GRPM1_GRVWA4_GRVWB4_GSU0_GSUAMB_GSUC0_GSUWGMRR0_GLS0_ISA950_IU1_K1_LDSTI0_LBSPPA512_LBSPPB512_LBSPPM0_LPA0_LPB8_LPM0_LRVW4_LWPMn1_MIAV0_MIWT2_1_MO40_MGRIPMn1_NTn1_NTA7_NTB0_NTC1_NTD2_NTM0_NEPBS2_NLCA1_NLCB1_ONLL1_PGR2_PLR1_PKA1_SGROBn1_SIA3_SS1_SU8_SUM1_SUS512_SPO1_SRVW0_SSO0_SVW2_SK3_SKFTR0_SKXCCM4_SGRO0_TDMI0_TIN0_TLDS1_TLDSM1_ULSGRO0_USL1_UIOFGRO0_UPLRP0_USFGRO1_VSn1_VWA2_VWB1_WSGRA0_WSGRB0_WS64_WG16_4_2_WGM1_WGMXCC8_WGMXCCGn1
    SolutionIndex: 24
    SolutionNameMin: Cijk_Ailk_Bljk_S_B_Bias_HA_S_SAV_UserArgs_MT32x32x128_MI16x16x1_SN_LDSB0_AFC0_AG0_AFEM1_AFEM1_ASEM1_CLR1_CADS0_DTLA0_DTLB0_DTVA0_DTVB0_DTVMXSA0_DTVMXSB0_DTVSM0_DPLBn1_EPS0_ELFLR0_EMLLn1_FDSI0_GRPM1_GRVWA1_GRVWB4_GSU0_GSUAMB_GSUC0_GSUWGMRR0_GLS0_ISA950_IU1_K1_LDSTI0_LBSPPA512_LBSPPB512_LBSPPM0_LPA16_LPB8_LPM0_LRVW4_LWPMn1_MIAV1_MIWT1_1_MO40_MGRIPMn1_NTn1_NTA6_NTB1_NTC3_NTD3_NTM0_NEPBS8_NLCA1_NLCB1_ONLL1_PGR2_PLR1_PKA1_SGROBn1_SIA3_SS1_SU8_SUM1_SUS512_SPO1_SRVW0_SSO0_SVW1_SK3_SKFTR0_SKXCCM0_SGRO0_TDMI0_TIN0_TLDS1_TLDSM1_ULSGRO0_USL1_UIOFGRO0_UPLRP0_USFGRO0_VSn1_VWA1_VWB1_WSGRA0_WSGRB0_WS64_WG32_8_1_WGM1_WGMXCC8_WGMXCCGn1
    SolutionIndex: 25
    SolutionNameMin: Cijk_Ailk_Bljk_S_B_Bias_HA_S_SAV_UserArgs_MT32x16x128_MI16x16x1_SN_LDSB1_AFC0_AG0_AFEM1_AFEM1_ASEM1_CLR1_CADS0_DTLA0_DTLB0_DTVA0_DTVB0_DTVMXSA0_DTVMXSB0_DTVSM0_DPLBn1_EPS0_ELFLR0_EMLLn1_FDSI0_GRPM1_GRVWA1_GRVWB4_GSU0_GSUAMB_GSUC0_GSUWGMRR0_GLS0_ISA950_IU1_K1_LDSTI0_LBSPPA512_LBSPPB512_LBSPPM0_LPA16_LPB8_LPM0_LRVW4_LWPMn1_MIAV0_MIWT1_1_MO40_MGRIPMn1_NTn1_NTA6_NTB2_NTC3_NTD2_NTM0_NEPBS14_NLCA1_NLCB1_ONLL1_PGR2_PLR1_PKA1_SGROBn1_SIA3_SS1_SU0_SUM0_SUS0_SPO0_SRVW0_SSO0_SVW1_SK3_SKFTR0_SKXCCM0_SGRO0_TDMI0_TIN0_TLDS1_TLDSM1_ULSGRO0_USL1_UIOFGRO0_UPLRP0_USFGRO0_VSn1_VWA1_VWB1_WSGRA0_WSGRB0_WS64_WG32_4_2_WGM1_WGMXCC1_WGMXCCGn1
    SolutionIndex: 26
    SolutionNameMin: Cijk_Ailk_Bljk_S_B_Bias_HA_S_SAV_UserArgs_MT96x16x64_MI16x16x1_SN_LDSB0_AFC0_AG0_AFEM1_AFEM1_ASEM1_CLR1_CADS0_DTLA0_DTLB0_DTVA0_DTVB0_DTVMXSA0_DTVMXSB0_DTVSM0_DPLBn1_EPS0_ELFLR0_EMLLn1_FDSI0_GRPM1_GRVWA4_GRVWB4_GSU0_GSUAMB_GSUC0_GSUWGMRR0_GLS0_ISA950_IU1_K1_LDSTI0_LBSPPA1536_LBSPPB256_LBSPPM0_LPA16_LPB8_LPM0_LRVW4_LWPMn1_MIAV1_MIWT3_1_MO40_MGRIPMn1_NTn1_NTA4_NTB3_NTC3_NTD3_NTM0_NEPBS14_NLCA3_NLCB1_ONLL1_PGR2_PLR1_PKA1_SGROBn1_SIA3_SS1_SU0_SUM0_SUS0_SPO0_SRVW0_SSO0_SVW1_SK3_SKFTR0_SKXCCM0_SGRO0_TDMI0_TIN0_TLDS1_TLDSM1_ULSGRO0_USL1_UIOFGRO0_UPLRP0_USFGRO0_VSn1_VWA1_VWB1_WSGRA0_WSGRB0_WS64_WG32_4_1_WGM1_WGMXCC2_WGMXCCGn1
    SolutionIndex: 27
    SolutionNameMin: Cijk_Ailk_Bljk_S_B_Bias_HA_S_SAV_UserArgs_MT32x32x128_MI16x16x1_SN_LDSB1_AFC0_AG0_AFEM1_AFEM1_ASEM1_CLR1_CADS0_DTLA0_DTLB0_DTVA0_DTVB0_DTVMXSA0_DTVMXSB0_DTVSM0_DPLBn1_EPS0_ELFLR0_EMLLn1_FDSI0_GRPM1_GRVWA1_GRVWB4_GSU0_GSUAMB_GSUC0_GSUWGMRR0_GLS0_ISA950_IU1_K1_LDSTI0_LBSPPA512_LBSPPB512_LBSPPM0_LPA16_LPB8_LPM0_LRVW4_LWPMn1_MIAV0_MIWT1_1_MO40_MGRIPMn1_NTn1_NTA7_NTB1_NTC0_NTD6_NTM0_NEPBS0_NLCA1_NLCB1_ONLL1_PGR2_PLR1_PKA1_SGROBn1_SIA3_SS1_SU0_SUM0_SUS0_SPO0_SRVW0_SSO0_SVW1_SK3_SKFTR0_SKXCCM0_SGRO0_TDMI0_TIN0_TLDS1_TLDSM1_ULSGRO0_USL1_UIOFGRO0_UPLRP0_USFGRO0_VSn1_VWA1_VWB1_WSGRA0_WSGRB0_WS64_WG32_8_1_WGM1_WGMXCC1_WGMXCCGn1
    SolutionIndex: 28
    SolutionNameMin: Cijk_Ailk_Bljk_S_B_Bias_HA_S_SAV_UserArgs_MT96x32x64_MI16x16x1_SN_LDSB0_AFC0_AG0_AFEM1_AFEM1_ASEM1_CLR1_CADS0_DTLA0_DTLB0_DTVA0_DTVB0_DTVMXSA0_DTVMXSB0_DTVSM0_DPLBn1_EPS0_ELFLR0_EMLLn1_FDSI0_GRPM1_GRVWA1_GRVWB4_GSU0_GSUAMB_GSUC0_GSUWGMRR0_GLS0_ISA950_IU1_K1_LDSTI0_LBSPPA1536_LBSPPB256_LBSPPM0_LPA16_LPB8_LPM0_LRVW4_LWPMn1_MIAV1_MIWT3_1_MO40_MGRIPMn1_NTn1_NTA6_NTB0_NTC2_NTD2_NTM0_NEPBS0_NLCA3_NLCB1_ONLL1_PGR2_PLR1_PKA1_SGROBn1_SIA3_SS1_SU8_SUM1_SUS256_SPO0_SRVW0_SSO0_SVW1_SK3_SKFTR0_SKXCCM0_SGRO0_TDMI0_TIN0_TLDS1_TLDSM1_ULSGRO0_USL1_UIOFGRO0_UPLRP0_USFGRO0_VSn1_VWA1_VWB1_WSGRA0_WSGRB0_WS64_WG32_8_1_WGM1_WGMXCC8_WGMXCCGn1
    SolutionIndex: 29
    SolutionNameMin: Cijk_Ailk_Bljk_S_B_Bias_HA_S_SAV_UserArgs_MT256x64x32_MI16x16x1_SN_LDSB1_AFC0_AG0_AFEM1_AFEM1_ASEM1_CLR1_CADS0_DTLA0_DTLB0_DTVA0_DTVB0_DTVMXSA0_DTVMXSB0_DTVSM0_DPLBn1_EPS0_ELFLR0_EMLLn1_FDSI0_GRPM1_GRVWA4_GRVWB4_GSU0_GSUAMB_GSUC0_GSUWGMRR0_GLS0_ISA950_IU1_K1_LDSTI0_LBSPPA4096_LBSPPB512_LBSPPM0_LPA0_LPB8_LPM0_LRVW4_LWPMn1_MIAV1_MIWT4_4_MO40_MGRIPMn1_NTn1_NTA2_NTB1_NTC7_NTD6_NTM0_NEPBS8_NLCA1_NLCB1_ONLL1_PGR2_PLR1_PKA1_SGROBn1_SIA3_SS1_SU0_SUM0_SUS0_SPO0_SRVW0_SSO1_SVW4_SK3_SKFTR0_SKXCCM4_SGRO0_TDMI0_TIN0_TLDS1_TLDSM1_ULSGRO0_USL1_UIOFGRO0_UPLRP0_USFGRO0_VSn1_VWA4_VWB4_WSGRA0_WSGRB0_WS64_WG64_4_1_WGM32_WGMXCC4_WGMXCCGn1
    SolutionIndex: 30
    SolutionNameMin: Cijk_Ailk_Bljk_S_B_Bias_HA_S_SAV_UserArgs_MT96x32x64_MI16x16x1_SN_LDSB0_AFC0_AG0_AFEM1_AFEM1_ASEM1_CLR1_CADS0_DTLA0_DTLB0_DTVA0_DTVB0_DTVMXSA0_DTVMXSB0_DTVSM0_DPLBn1_EPS0_ELFLR0_EMLLn1_FDSI0_GRPM1_GRVWA1_GRVWB4_GSU0_GSUAMB_GSUC0_GSUWGMRR0_GLS0_ISA950_IU1_K1_LDSTI0_LBSPPA1536_LBSPPB256_LBSPPM0_LPA16_LPB8_LPM0_LRVW4_LWPMn1_MIAV1_MIWT3_1_MO40_MGRIPMn1_NTn1_NTA5_NTB0_NTC2_NTD2_NTM0_NEPBS0_NLCA3_NLCB1_ONLL1_PGR2_PLR1_PKA1_SGROBn1_SIA3_SS0_SU0_SUM0_SUS0_SPO0_SRVW0_SSO0_SVW4_SK3_SKFTR0_SKXCCM0_SGRO0_TDMI0_TIN0_TLDS1_TLDSM1_ULSGRO0_USL1_UIOFGRO0_UPLRP0_USFGRO0_VSn1_VWA1_VWB1_WSGRA0_WSGRB0_WS64_WG32_8_1_WGM1_WGMXCC4_WGMXCCGn1
    SolutionIndex: 31
    SolutionNameMin: Cijk_Ailk_Bljk_S_B_Bias_HA_S_SAV_UserArgs_MT64x48x64_MI16x16x1_SN_LDSB1_AFC0_AG0_AFEM1_AFEM1_ASEM1_CLR1_CADS0_DTLA0_DTLB0_DTVA0_DTVB0_DTVMXSA0_DTVMXSB0_DTVSM0_DPLBn1_EPS0_ELFLR0_EMLLn1_FDSI0_GRPM1_GRVWA4_GRVWB4_GSU0_GSUAMB_GSUC0_GSUWGMRR0_GLS0_ISA950_IU1_K1_LDSTI0_LBSPPA1024_LBSPPB256_LBSPPM0_LPA16_LPB8_LPM0_LRVW4_LWPMn1_MIAV1_MIWT1_3_MO40_MGRIPMn1_NTn1_NTA6_NTB2_NTC2_NTD3_NTM0_NEPBS0_NLCA1_NLCB1_ONLL1_PGR2_PLR1_PKA1_SGROBn1_SIA3_SS0_SU0_SUM0_SUS0_SPO0_SRVW0_SSO0_SVW4_SK3_SKFTR0_SKXCCM4_SGRO0_TDMI0_TIN0_TLDS1_TLDSM1_ULSGRO0_USL1_UIOFGRO0_UPLRP0_USFGRO0_VSn1_VWA1_VWB1_WSGRA0_WSGRB0_WS64_WG64_4_1_WGM1_WGMXCC1_WGMXCCGn1
    SolutionIndex: 32
    SolutionNameMin: Cijk_Ailk_Bljk_S_B_Bias_HA_S_SAV_UserArgs_MT96x128x32_MI16x16x1_SN_LDSB1_AFC0_AG0_AFEM1_AFEM1_ASEM1_CLR1_CADS0_DTLA0_DTLB0_DTVA0_DTVB0_DTVMXSA0_DTVMXSB0_DTVSM0_DPLBn1_EPS0_ELFLR0_EMLLn1_FDSI0_GRPM1_GRVWA4_GRVWB4_GSU0_GSUAMB_GSUC0_GSUWGMRR0_GLS0_ISA950_IU1_K1_LDSTI0_LBSPPA1536_LBSPPB256_LBSPPM0_LPA0_LPB8_LPM0_LRVW4_LWPMn1_MIAV1_MIWT6_2_MO40_MGRIPMn1_NTn1_NTA1_NTB3_NTC0_NTD2_NTM0_NEPBS12_NLCA3_NLCB1_ONLL1_PGR2_PLR1_PKA1_SGROBn1_SIA3_SS1_SU0_SUM0_SUS0_SPO0_SRVW0_SSO0_SVW2_SK3_SKFTR0_SKXCCM0_SGRO0_TDMI0_TIN0_TLDS1_TLDSM1_ULSGRO0_USL1_UIOFGRO0_UPLRP0_USFGRO0_VSn1_VWA2_VWB2_WSGRA0_WSGRB0_WS64_WG16_16_1_WGM2_WGMXCC8_WGMXCCGn1
    SolutionIndex: 33
    SolutionNameMin: Cijk_Ailk_Bljk_S_B_Bias_HA_S_SAV_UserArgs_MT128x16x64_MI16x16x1_SN_LDSB0_AFC0_AG0_AFEM1_AFEM1_ASEM1_CLR1_CADS0_DTLA0_DTLB0_DTVA0_DTVB0_DTVMXSA0_DTVMXSB0_DTVSM0_DPLBn1_EPS0_ELFLR0_EMLLn1_FDSI0_GRPM1_GRVWA2_GRVWB4_GSU0_GSUAMB_GSUC0_GSUWGMRR0_GLS0_ISA950_IU1_K1_LDSTI0_LBSPPA2048_LBSPPB256_LBSPPM0_LPA0_LPB8_LPM0_LRVW4_LWPMn1_MIAV0_MIWT2_1_MO40_MGRIPMn1_NTn1_NTA7_NTB4_NTC7_NTD0_NTM0_NEPBS12_NLCA1_NLCB1_ONLL1_PGR2_PLR1_PKA1_SGROBn1_SIA3_SS1_SU8_SUM1_SUS256_SPO1_SRVW0_SSO0_SVW2_SK3_SKFTR0_SKXCCM0_SGRO0_TDMI0_TIN0_TLDS1_TLDSM1_ULSGRO0_USL1_UIOFGRO0_UPLRP0_USFGRO0_VSn1_VWA2_VWB1_WSGRA0_WSGRB0_WS64_WG64_4_1_WGM2_WGMXCC1_WGMXCCGn1
    SolutionIndex: 34
    SolutionNameMin: Cijk_Ailk_Bljk_S_B_Bias_HA_S_SAV_UserArgs_MT384x64x32_MI16x16x1_SN_LDSB1_AFC0_AG0_AFEM1_AFEM1_ASEM1_CLR1_CADS0_DTLA0_DTLB0_DTVA0_DTVB0_DTVMXSA0_DTVMXSB0_DTVSM0_DPLBn1_EPS0_ELFLR0_EMLLn1_FDSI0_GRPM1_GRVWA4_GRVWB4_GSU0_GSUAMB_GSUC0_GSUWGMRR0_GLS0_ISA950_IU1_K1_LDSTI0_LBSPPA6144_LBSPPB512_LBSPPM0_LPA0_LPB8_LPM0_LRVW4_LWPMn1_MIAV0_MIWT6_4_MO40_MGRIPMn1_NTn1_NTA7_NTB2_NTC3_NTD7_NTM0_NEPBS12_NLCA3_NLCB1_ONLL1_PGR2_PLR1_PKA1_SGROBn1_SIA3_SS1_SU0_SUM0_SUS0_SPO0_SRVW0_SSO1_SVW2_SK3_SKFTR0_SKXCCM4_SGRO0_TDMI0_TIN0_TLDS1_TLDSM1_ULSGRO0_USL1_UIOFGRO0_UPLRP0_USFGROn1_VSn1_VWA2_VWB4_WSGRA0_WSGRB0_WS64_WG64_4_1_WGM4_WGMXCC8_WGMXCCGn1
    SolutionIndex: 35
    SolutionNameMin: Cijk_Ailk_Bljk_S_B_Bias_HA_S_SAV_UserArgs_MT128x128x32_MI16x16x1_SN_LDSB1_AFC0_AG0_AFEM1_AFEM1_ASEM1_CLR1_CADS0_DTLA0_DTLB0_DTVA0_DTVB0_DTVMXSA0_DTVMXSB0_DTVSM0_DPLBn1_EPS0_ELFLR0_EMLLn1_FDSI0_GRPM1_GRVWA4_GRVWB4_GSU0_GSUAMB_GSUC0_GSUWGMRR0_GLS0_ISA950_IU1_K1_LDSTI0_LBSPPA2048_LBSPPB512_LBSPPM0_LPA0_LPB8_LPM0_LRVW4_LWPMn1_MIAV1_MIWT4_4_MO40_MGRIPMn1_NTn1_NTA6_NTB2_NTC7_NTD7_NTM0_NEPBS10_NLCA1_NLCB1_ONLL1_PGR2_PLR1_PKA1_SGROBn1_SIA3_SS1_SU0_SUM0_SUS0_SPO0_SRVW0_SSO0_SVW4_SK3_SKFTR0_SKXCCM0_SGRO0_TDMI0_TIN0_TLDS1_TLDSM1_ULSGRO0_USL1_UIOFGRO0_UPLRP0_USFGROn1_VSn1_VWA4_VWB4_WSGRA0_WSGRB0_WS64_WG32_8_1_WGM32_WGMXCC16_WGMXCCGn1
    SolutionIndex: 36
    SolutionNameMin: Cijk_Ailk_Bljk_S_B_Bias_HA_S_SAV_UserArgs_MT64x64x64_MI16x16x1_SN_LDSB1_AFC0_AG0_AFEM1_AFEM1_ASEM1_CLR1_CADS0_DTLA0_DTLB0_DTVA0_DTVB0_DTVMXSA0_DTVMXSB0_DTVSM0_DPLBn1_EPS0_ELFLR0_EMLLn1_FDSI0_GRPM1_GRVWA4_GRVWB4_GSU0_GSUAMB_GSUC0_GSUWGMRR0_GLS0_ISA950_IU1_K1_LDSTI0_LBSPPA1024_LBSPPB512_LBSPPM0_LPA0_LPB8_LPM0_LRVW4_LWPMn1_MIAV1_MIWT2_2_MO40_MGRIPMn1_NTn1_NTA4_NTB0_NTC3_NTD2_NTM0_NEPBS14_NLCA1_NLCB1_ONLL1_PGR2_PLR1_PKA1_SGROBn1_SIA3_SS1_SU0_SUM0_SUS0_SPO0_SRVW0_SSO0_SVW2_SK3_SKFTR0_SKXCCM0_SGRO0_TDMI0_TIN0_TLDS1_TLDSM1_ULSGRO0_USL1_UIOFGRO0_UPLRP0_USFGROn1_VSn1_VWA2_VWB2_WSGRA0_WSGRB0_WS64_WG32_8_1_WGM1_WGMXCC32_WGMXCCGn1
    SolutionIndex: 37
    SolutionNameMin: Cijk_Ailk_Bljk_S_B_Bias_HA_S_SAV_UserArgs_MT96x16x64_MI16x16x1_SN_LDSB0_AFC0_AG0_AFEM1_AFEM1_ASEM1_CLR1_CADS0_DTLA0_DTLB0_DTVA0_DTVB0_DTVMXSA0_DTVMXSB0_DTVSM0_DPLBn1_EPS0_ELFLR0_EMLLn1_FDSI0_GRPM1_GRVWA4_GRVWB4_GSU0_GSUAMB_GSUC0_GSUWGMRR0_GLS0_ISA950_IU1_K1_LDSTI0_LBSPPA1536_LBSPPB256_LBSPPM0_LPA16_LPB8_LPM0_LRVW4_LWPMn1_MIAV0_MIWT3_1_MO40_MGRIPMn1_NTn1_NTA4_NTB2_NTC0_NTD3_NTM0_NEPBS12_NLCA3_NLCB1_ONLL1_PGR2_PLR1_PKA1_SGROBn1_SIA3_SS0_SU0_SUM0_SUS0_SPO0_SRVW0_SSO0_SVW4_SK3_SKFTR0_SKXCCM2_SGRO0_TDMI0_TIN0_TLDS1_TLDSM1_ULSGRO0_USL1_UIOFGRO0_UPLRP0_USFGRO1_VSn1_VWA1_VWB1_WSGRA0_WSGRB0_WS64_WG32_4_1_WGM1_WGMXCC8_WGMXCCGn1
    SolutionIndex: 38
    SolutionNameMin: Cijk_Ailk_Bljk_S_B_Bias_HA_S_SAV_UserArgs_MT128x128x16_MI16x16x1_SN_LDSB1_AFC0_AG0_AFEM1_AFEM1_ASEM1_CLR0_CADS0_DTLA0_DTLB0_DTVA0_DTVB0_DTVMXSA0_DTVMXSB0_DTVSM0_DPLBn1_EPS0_ELFLR0_EMLLn1_FDSI0_GRPM1_GRVWA4_GRVWB4_GSU0_GSUAMB_GSUC0_GSUWGMRR0_GLS0_ISA950_IU1_K1_LDSTI1_LBSPPA512_LBSPPB512_LBSPPM0_LPA0_LPB0_LPM0_LRVW1_LWPMn1_MIAV1_MIWT4_4_MO40_MGRIPMn1_NTn1_NTA2_NTB0_NTC6_NTD7_NTM0_NEPBS4_NLCA1_NLCB1_ONLL1_PGR2_PLR1_PKA1_SGROBn1_SIA3_SS1_SU0_SUM0_SUS0_SPO1_SRVW0_SSO1_SVW4_SK3_SKFTR0_SKXCCM0_SGRO0_TDMI0_TIN0_TLDS0_TLDSM1_ULSGRO0_USL1_UIOFGRO0_UPLRP0_USFGRO0_VSn1_VWA4_VWB4_WSGRA0_WSGRB0_WS64_WG32_8_1_WGM1_WGMXCC2_WGMXCCGn1
    SolutionIndex: 39
    SolutionNameMin: Cijk_Ailk_Bljk_S_B_Bias_HA_S_SAV_UserArgs_MT64x64x64_MI16x16x1_SN_LDSB1_AFC0_AG0_AFEM1_AFEM1_ASEM1_CLR1_CADS0_DTLA0_DTLB0_DTVA0_DTVB0_DTVMXSA0_DTVMXSB0_DTVSM0_DPLBn1_EPS0_ELFLR0_EMLLn1_FDSI0_GRPM1_GRVWA4_GRVWB4_GSU0_GSUAMB_GSUC0_GSUWGMRR0_GLS0_ISA950_IU1_K1_LDSTI0_LBSPPA1024_LBSPPB1024_LBSPPM0_LPA16_LPB8_LPM0_LRVW4_LWPMn1_MIAV1_MIWT1_4_MO40_MGRIPMn1_NTn1_NTA2_NTB4_NTC0_NTD3_NTM0_NEPBS0_NLCA1_NLCB1_ONLL1_PGR2_PLR1_PKA1_SGROBn1_SIA3_SS1_SU0_SUM0_SUS0_SPO0_SRVW0_SSO0_SVW1_SK3_SKFTR0_SKXCCM0_SGRO0_TDMI0_TIN0_TLDS1_TLDSM1_ULSGRO0_USL1_UIOFGRO0_UPLRP0_USFGRO1_VSn1_VWA1_VWB4_WSGRA0_WSGRB0_WS64_WG64_4_1_WGM16_WGMXCC1_WGMXCCGn1
    SolutionIndex: 40
    SolutionNameMin: Cijk_Ailk_Bljk_S_B_Bias_HA_S_SAV_UserArgs_MT256x64x16_MI16x16x1_SN_LDSB1_AFC0_AG0_AFEM1_AFEM1_ASEM1_CLR1_CADS0_DTLA0_DTLB0_DTVA0_DTVB0_DTVMXSA0_DTVMXSB0_DTVSM0_DPLBn1_EPS0_ELFLR0_EMLLn1_FDSI0_GRPM1_GRVWA4_GRVWB2_GSU0_GSUAMB_GSUC0_GSUWGMRR0_GLS0_ISA950_IU1_K1_LDSTI0_LBSPPA2048_LBSPPB128_LBSPPM0_LPA0_LPB2_LPM0_LRVW2_LWPMn1_MIAV1_MIWT16_1_MO40_MGRIPMn1_NTn1_NTA0_NTB1_NTC4_NTD7_NTM0_NEPBS4_NLCA1_NLCB1_ONLL1_PGR2_PLR1_PKA1_SGROBn1_SIA3_SS1_SU0_SUM0_SUS0_SPO1_SRVW0_SSO0_SVW4_SK3_SKFTR0_SKXCCM0_SGRO0_TDMI0_TIN0_TLDS1_TLDSM1_ULSGRO0_USL1_UIOFGRO0_UPLRP0_USFGRO0_VSn1_VWA4_VWB1_WSGRA0_WSGRB0_WS64_WG16_16_1_WGM4_WGMXCC16_WGMXCCGn1
    SolutionIndex: 41
    SolutionNameMin: Cijk_Ailk_Bljk_S_B_Bias_HA_S_SAV_UserArgs_MT32x16x128_MI16x16x1_SN_LDSB0_AFC0_AG0_AFEM1_AFEM1_ASEM1_CLR1_CADS0_DTLA0_DTLB0_DTVA0_DTVB0_DTVMXSA0_DTVMXSB0_DTVSM0_DPLBn1_EPS0_ELFLR0_EMLLn1_FDSI0_GRPM1_GRVWA4_GRVWB4_GSU0_GSUAMB_GSUC0_GSUWGMRR0_GLS0_ISA950_IU1_K1_LDSTI0_LBSPPA512_LBSPPB512_LBSPPM0_LPA16_LPB8_LPM0_LRVW4_LWPMn1_MIAV0_MIWT1_1_MO40_MGRIPMn1_NTn1_NTA6_NTB3_NTC3_NTD3_NTM0_NEPBS14_NLCA1_NLCB1_ONLL1_PGR2_PLR1_PKA1_SGROBn1_SIA3_SS0_SU8_SUM1_SUS512_SPO0_SRVW0_SSO0_SVW4_SK3_SKFTR0_SKXCCM4_SGRO0_TDMI0_TIN0_TLDS1_TLDSM1_ULSGRO0_USL1_UIOFGRO0_UPLRP0_USFGRO0_VSn1_VWA1_VWB1_WSGRA0_WSGRB0_WS64_WG32_4_1_WGM1_WGMXCC8_WGMXCCGn1
    SolutionIndex: 42
    SolutionNameMin: Cijk_Ailk_Bljk_S_B_Bias_HA_S_SAV_UserArgs_MT64x64x64_MI16x16x1_SN_LDSB1_AFC0_AG0_AFEM1_AFEM1_ASEM1_CLR1_CADS0_DTLA0_DTLB0_DTVA0_DTVB0_DTVMXSA0_DTVMXSB0_DTVSM0_DPLBn1_EPS0_ELFLR0_EMLLn1_FDSI0_GRPM1_GRVWA4_GRVWB4_GSU0_GSUAMB_GSUC0_GSUWGMRR0_GLS0_ISA950_IU1_K1_LDSTI0_LBSPPA1024_LBSPPB256_LBSPPM0_LPA0_LPB8_LPM0_LRVW4_LWPMn1_MIAV1_MIWT4_1_MO40_MGRIPMn1_NTn1_NTA4_NTB0_NTC0_NTD2_NTM0_NEPBS12_NLCA1_NLCB1_ONLL1_PGR2_PLR1_PKA1_SGROBn1_SIA3_SS1_SU0_SUM0_SUS0_SPO0_SRVW0_SSO0_SVW4_SK3_SKFTR0_SKXCCM4_SGRO0_TDMI0_TIN0_TLDS1_TLDSM1_ULSGRO0_USL1_UIOFGRO0_UPLRP0_USFGRO0_VSn1_VWA4_VWB1_WSGRA0_WSGRB0_WS64_WG16_16_1_WGM4_WGMXCC4_WGMXCCGn1
    SolutionIndex: 43
    SolutionNameMin: Cijk_Ailk_Bljk_S_B_Bias_HA_S_SAV_UserArgs_MT64x32x128_MI16x16x1_SN_LDSB1_AFC0_AG0_AFEM1_AFEM1_ASEM1_CLR1_CADS0_DTLA0_DTLB0_DTVA0_DTVB0_DTVMXSA0_DTVMXSB0_DTVSM0_DPLBn1_EPS0_ELFLR0_EMLLn1_FDSI0_GRPM1_GRVWA4_GRVWB4_GSU0_GSUAMB_GSUC0_GSUWGMRR0_GLS0_ISA950_IU1_K1_LDSTI0_LBSPPA1024_LBSPPB512_LBSPPM0_LPA0_LPB8_LPM0_LRVW4_LWPMn1_MIAV1_MIWT2_1_MO40_MGRIPMn1_NTn1_NTA0_NTB4_NTC2_NTD3_NTM0_NEPBS12_NLCA1_NLCB1_ONLL1_PGR2_PLR1_PKA1_SGROBn1_SIA3_SS1_SU0_SUM0_SUS0_SPO0_SRVW0_SSO1_SVW2_SK3_SKFTR0_SKXCCM0_SGRO0_TDMI0_TIN0_TLDS1_TLDSM1_ULSGRO0_USL1_UIOFGRO0_UPLRP0_USFGRO0_VSn1_VWA2_VWB1_WSGRA0_WSGRB0_WS64_WG32_8_1_WGM1_WGMXCC32_WGMXCCGn1
    SolutionIndex: 44
    SolutionNameMin: Cijk_Ailk_Bljk_S_B_Bias_HA_S_SAV_UserArgs_MT32x32x128_MI16x16x1_SN_LDSB0_AFC0_AG0_AFEM1_AFEM1_ASEM1_CLR1_CADS0_DTLA0_DTLB0_DTVA0_DTVB0_DTVMXSA0_DTVMXSB0_DTVSM0_DPLBn1_EPS0_ELFLR0_EMLLn1_FDSI0_GRPM1_GRVWA4_GRVWB4_GSU0_GSUAMB_GSUC0_GSUWGMRR0_GLS0_ISA950_IU1_K1_LDSTI0_LBSPPA512_LBSPPB512_LBSPPM0_LPA16_LPB8_LPM0_LRVW4_LWPMn1_MIAV0_MIWT1_1_MO40_MGRIPMn1_NTn1_NTA3_NTB2_NTC2_NTD2_NTM0_NEPBS4_NLCA1_NLCB1_ONLL1_PGR2_PLR1_PKA1_SGROBn1_SIA3_SS1_SU8_SUM1_SUS512_SPO1_SRVW0_SSO0_SVW1_SK3_SKFTR0_SKXCCM0_SGRO0_TDMI0_TIN0_TLDS1_TLDSM1_ULSGRO0_USL1_UIOFGRO0_UPLRP0_USFGRO0_VSn1_VWA1_VWB1_WSGRA0_WSGRB0_WS64_WG32_8_1_WGM1_WGMXCC1_WGMXCCGn1
    SolutionIndex: 45
    SolutionNameMin: Cijk_Ailk_Bljk_S_B_Bias_HA_S_SAV_UserArgs_MT64x32x128_MI16x16x1_SN_LDSB0_AFC0_AG0_AFEM1_AFEM1_ASEM1_CLR1_CADS0_DTLA0_DTLB0_DTVA0_DTVB0_DTVMXSA0_DTVMXSB0_DTVSM0_DPLBn1_EPS0_ELFLR0_EMLLn1_FDSI0_GRPM1_GRVWA4_GRVWB4_GSU0_GSUAMB_GSUC0_GSUWGMRR0_GLS0_ISA950_IU1_K1_LDSTI0_LBSPPA1024_LBSPPB1024_LBSPPM0_LPA16_LPB8_LPM0_LRVW4_LWPMn1_MIAV1_MIWT1_2_MO40_MGRIPMn1_NTn1_NTA7_NTB2_NTC0_NTD2_NTM0_NEPBS14_NLCA1_NLCB1_ONLL1_PGR2_PLR1_PKA1_SGROBn1_SIA3_SS0_SU0_SUM0_SUS0_SPO0_SRVW0_SSO0_SVW4_SK3_SKFTR0_SKXCCM0_SGRO0_TDMI0_TIN0_TLDS1_TLDSM1_ULSGRO0_USL1_UIOFGRO0_UPLRP0_USFGRO0_VSn1_VWA1_VWB2_WSGRA0_WSGRB0_WS64_WG64_4_1_WGM16_WGMXCC4_WGMXCCGn1
    SolutionIndex: 46
    SolutionNameMin: Cijk_Ailk_Bljk_S_B_Bias_HA_S_SAV_UserArgs_MT64x32x128_MI16x16x1_SN_LDSB0_AFC0_AG0_AFEM1_AFEM1_ASEM1_CLR1_CADS0_DTLA0_DTLB0_DTVA0_DTVB0_DTVMXSA0_DTVMXSB0_DTVSM0_DPLBn1_EPS0_ELFLR0_EMLLn1_FDSI0_GRPM1_GRVWA4_GRVWB4_GSU0_GSUAMB_GSUC0_GSUWGMRR0_GLS0_ISA950_IU1_K1_LDSTI0_LBSPPA1024_LBSPPB512_LBSPPM0_LPA0_LPB8_LPM0_LRVW4_LWPMn1_MIAV0_MIWT2_1_MO40_MGRIPMn1_NTn1_NTA6_NTB3_NTC1_NTD2_NTM0_NEPBS10_NLCA1_NLCB1_ONLL1_PGR2_PLR1_PKA1_SGROBn1_SIA3_SS1_SU0_SUM0_SUS0_SPO0_SRVW0_SSO1_SVW2_SK3_SKFTR0_SKXCCM2_SGRO0_TDMI0_TIN0_TLDS1_TLDSM1_ULSGRO0_USL1_UIOFGRO0_UPLRP0_USFGRO0_VSn1_VWA2_VWB1_WSGRA0_WSGRB0_WS64_WG32_8_1_WGM3_WGMXCC8_WGMXCCGn1
    SolutionIndex: 47
    SolutionNameMin: Cijk_Ailk_Bljk_S_B_Bias_HA_S_SAV_UserArgs_MT64x48x64_MI16x16x1_SN_LDSB1_AFC0_AG0_AFEM1_AFEM1_ASEM1_CLR1_CADS0_DTLA0_DTLB0_DTVA0_DTVB0_DTVMXSA0_DTVMXSB0_DTVSM0_DPLBn1_EPS0_ELFLR0_EMLLn1_FDSI0_GRPM1_GRVWA4_GRVWB4_GSU0_GSUAMB_GSUC0_GSUWGMRR0_GLS0_ISA950_IU1_K1_LDSTI0_LBSPPA1024_LBSPPB256_LBSPPM0_LPA16_LPB8_LPM0_LRVW4_LWPMn1_MIAV1_MIWT1_3_MO40_MGRIPMn1_NTn1_NTA5_NTB3_NTC1_NTD3_NTM0_NEPBS14_NLCA1_NLCB1_ONLL1_PGR2_PLR1_PKA1_SGROBn1_SIA3_SS1_SU8_SUM1_SUS256_SPO0_SRVW0_SSO0_SVW1_SK3_SKFTR0_SKXCCM0_SGRO0_TDMI0_TIN0_TLDS1_TLDSM1_ULSGRO0_USL1_UIOFGRO0_UPLRP0_USFGRO1_VSn1_VWA1_VWB1_WSGRA0_WSGRB0_WS64_WG64_4_1_WGM1_WGMXCC16_WGMXCCGn1
    SolutionIndex: 48
    SolutionNameMin: Cijk_Ailk_Bljk_S_B_Bias_HA_S_SAV_UserArgs_MT64x64x16_MI16x16x1_SN_LDSB0_AFC0_AG0_AFEM1_AFEM1_ASEM1_CLR1_CADS0_DTLA0_DTLB0_DTVA0_DTVB0_DTVMXSA0_DTVMXSB0_DTVSM0_DPLBn1_EPS0_ELFLR0_EMLLn1_FDSI0_GRPM1_GRVWA2_GRVWB4_GSU0_GSUAMB_GSUC0_GSUWGMRR0_GLS0_ISA950_IU1_K1_LDSTI0_LBSPPA512_LBSPPB128_LBSPPM0_LPA0_LPB4_LPM0_LRVW2_LWPMn1_MIAV0_MIWT4_1_MO40_MGRIPMn1_NTn1_NTA3_NTB0_NTC6_NTD7_NTM0_NEPBS14_NLCA1_NLCB1_ONLL1_PGR2_PLR1_PKA1_SGROBn1_SIA3_SS1_SU0_SUM0_SUS0_SPO0_SRVW0_SSO1_SVW4_SK3_SKFTR0_SKXCCM0_SGRO0_TDMI0_TIN0_TLDS1_TLDSM1_ULSGRO0_USL1_UIOFGRO0_UPLRP0_USFGROn1_VSn1_VWA4_VWB1_WSGRA0_WSGRB0_WS64_WG16_16_1_WGM1_WGMXCC1_WGMXCCGn1
    SolutionIndex: 49
    SolutionNameMin: Cijk_Ailk_Bljk_S_B_Bias_HA_S_SAV_UserArgs_MT64x32x128_MI16x16x1_SN_LDSB1_AFC0_AG0_AFEM1_AFEM1_ASEM1_CLR1_CADS0_DTLA0_DTLB0_DTVA0_DTVB0_DTVMXSA0_DTVMXSB0_DTVSM0_DPLBn1_EPS0_ELFLR0_EMLLn1_FDSI0_GRPM1_GRVWA4_GRVWB4_GSU0_GSUAMB_GSUC0_GSUWGMRR0_GLS0_ISA950_IU1_K1_LDSTI0_LBSPPA1024_LBSPPB512_LBSPPM0_LPA0_LPB8_LPM0_LRVW4_LWPMn1_MIAV1_MIWT2_1_MO40_MGRIPMn1_NTn1_NTA0_NTB7_NTC7_NTD3_NTM0_NEPBS12_NLCA1_NLCB1_ONLL1_PGR2_PLR1_PKA1_SGROBn1_SIA3_SS1_SU0_SUM0_SUS0_SPO0_SRVW0_SSO0_SVW2_SK3_SKFTR0_SKXCCM8_SGRO0_TDMI0_TIN0_TLDS1_TLDSM1_ULSGRO0_USL1_UIOFGRO0_UPLRP0_USFGRO1_VSn1_VWA2_VWB1_WSGRA0_WSGRB0_WS64_WG32_8_1_WGM1_WGMXCC2_WGMXCCGn1
    SolutionIndex: 50
    SolutionNameMin: Cijk_Ailk_Bljk_S_B_Bias_HA_S_SAV_UserArgs_MT64x32x128_MI16x16x1_SN_LDSB0_AFC0_AG0_AFEM1_AFEM1_ASEM1_CLR1_CADS0_DTLA0_DTLB0_DTVA0_DTVB0_DTVMXSA0_DTVMXSB0_DTVSM0_DPLBn1_EPS0_ELFLR0_EMLLn1_FDSI0_GRPM1_GRVWA4_GRVWB4_GSU0_GSUAMB_GSUC0_GSUWGMRR0_GLS0_ISA950_IU1_K1_LDSTI0_LBSPPA1024_LBSPPB512_LBSPPM0_LPA0_LPB8_LPM0_LRVW4_LWPMn1_MIAV0_MIWT2_1_MO40_MGRIPMn1_NTn1_NTA4_NTB3_NTC0_NTD6_NTM0_NEPBS14_NLCA1_NLCB1_ONLL1_PGR2_PLR1_PKA1_SGROBn1_SIA3_SS1_SU0_SUM0_SUS0_SPO1_SRVW0_SSO1_SVW2_SK3_SKFTR0_SKXCCM8_SGRO0_TDMI0_TIN0_TLDS1_TLDSM1_ULSGRO0_USL1_UIOFGRO0_UPLRP0_USFGRO0_VSn1_VWA2_VWB1_WSGRA0_WSGRB0_WS64_WG32_8_1_WGM1_WGMXCC8_WGMXCCGn1
    SolutionIndex: 51
    SolutionNameMin: Cijk_Ailk_Bljk_S_B_Bias_HA_S_SAV_UserArgs_MT16x256x16_MI16x16x1_SN_LDSB1_AFC0_AG0_AFEM1_AFEM1_ASEM1_CLR1_CADS0_DTLA0_DTLB0_DTVA0_DTVB0_DTVMXSA0_DTVMXSB0_DTVSM0_DPLBn1_EPS0_ELFLR0_EMLLn1_FDSI0_GRPM1_GRVWA1_GRVWB4_GSU0_GSUAMB_GSUC0_GSUWGMRR0_GLS0_ISA950_IU1_K1_LDSTI0_LBSPPA64_LBSPPB1024_LBSPPM0_LPA0_LPB0_LPM0_LRVW1_LWPMn1_MIAV1_MIWT1_4_MO40_MGRIPMn1_NTn1_NTA0_NTB4_NTC0_NTD0_NTM0_NEPBS0_NLCA1_NLCB1_ONLL1_PGR2_PLR1_PKA1_SGROBn1_SIA3_SS0_SU0_SUM0_SUS0_SPO0_SRVW0_SSO0_SVW4_SK3_SKFTR0_SKXCCM0_SGRO0_TDMI0_TIN0_TLDS0_TLDSM1_ULSGRO0_USL1_UIOFGRO0_UPLRP0_USFGRO1_VSn1_VWA1_VWB4_WSGRA0_WSGRB0_WS64_WG16_16_1_WGM0_WGMXCC8_WGMXCCGn1
    SolutionIndex: 52
    SolutionNameMin: Cijk_Ailk_Bljk_S_B_Bias_HA_S_SAV_UserArgs_MT128x96x16_MI16x16x1_SN_LDSB1_AFC0_AG0_AFEM1_AFEM1_ASEM1_CLR1_CADS0_DTLA0_DTLB0_DTVA0_DTVB0_DTVMXSA0_DTVMXSB0_DTVSM0_DPLBn1_EPS1_ELFLR0_EMLLn1_FDSI0_GRPM1_GRVWA1_GRVWB2_GSU0_GSUAMB_GSUC0_GSUWGMRR0_GLS0_ISA950_IU1_K1_LDSTI0_LBSPPA512_LBSPPB384_LBSPPM0_LPA0_LPB16_LPM0_LRVW1_LWPMn1_MIAV0_MIWT4_3_MO40_MGRIPMn1_NTn1_NTA0_NTB0_NTC4_NTD4_NTM0_NEPBS14_NLCA1_NLCB1_ONLL1_PGR1_PLR1_PKA1_SGROBn1_SIA3_SS1_SU16_SUM1_SUS64_SPO0_SRVW0_SSO0_SVW4_SK3_SKFTR0_SKXCCM0_SGRO0_TDMI0_TIN0_TLDS0_TLDSM1_ULSGRO0_USL1_UIOFGRO0_UPLRP0_USFGRO1_VSn1_VWA4_VWB1_WSGRA0_WSGRB0_WS64_WG32_8_1_WGM48_WGMXCC8_WGMXCCGn1
    SolutionIndex: 53
    SolutionNameMin: Cijk_Ailk_Bljk_S_B_Bias_HA_S_SAV_UserArgs_MT16x320x16_MI16x16x1_SN_LDSB1_AFC0_AG0_AFEM1_AFEM1_ASEM1_CLR1_CADS0_DTLA0_DTLB0_DTVA0_DTVB0_DTVMXSA0_DTVMXSB0_DTVSM0_DPLBn1_EPS0_ELFLR0_EMLLn1_FDSI0_GRPM1_GRVWA1_GRVWB4_GSU0_GSUAMB_GSUC0_GSUWGMRR0_GLS0_ISA950_IU1_K1_LDSTI0_LBSPPA128_LBSPPB128_LBSPPM0_LPA2_LPB4_LPM0_LRVW2_LWPMn1_MIAV1_MIWT1_5_MO40_MGRIPMn1_NTn1_NTA0_NTB0_NTC0_NTD4_NTM0_NEPBS4_NLCA1_NLCB1_ONLL1_PGR2_PLR1_PKA1_SGROBn1_SIA3_SS1_SU0_SUM0_SUS0_SPO0_SRVW0_SSO0_SVW1_SK3_SKFTR0_SKXCCM0_SGRO0_TDMI0_TIN0_TLDS2_TLDSM1_ULSGRO0_USL1_UIOFGRO0_UPLRP0_USFGRO1_VSn1_VWA1_VWB1_WSGRA0_WSGRB0_WS64_WG16_16_1_WGM2_WGMXCC16_WGMXCCGn1
    SolutionIndex: 54
    SolutionNameMin: Cijk_Ailk_Bljk_S_B_Bias_HA_S_SAV_UserArgs_MT16x512x16_MI16x16x1_SN_LDSB1_AFC0_AG0_AFEM1_AFEM1_ASEM1_CLR1_CADS0_DTLA0_DTLB0_DTVA0_DTVB0_DTVMXSA0_DTVMXSB0_DTVSM0_DPLBn1_EPS0_ELFLR0_EMLLn1_FDSI0_GRPM1_GRVWA1_GRVWB4_GSU0_GSUAMB_GSUC0_GSUWGMRR0_GLS0_ISA950_IU1_K1_LDSTI0_LBSPPA128_LBSPPB256_LBSPPM0_LPA16_LPB4_LPM0_LRVW2_LWPMn1_MIAV1_MIWT1_8_MO40_MGRIPMn1_NTn1_NTA0_NTB0_NTC4_NTD4_NTM0_NEPBS8_NLCA1_NLCB1_ONLL1_PGR2_PLR1_PKA1_SGROBn1_SIA3_SS1_SU0_SUM0_SUS0_SPO0_SRVW0_SSO0_SVW1_SK3_SKFTR0_SKXCCM0_SGRO0_TDMI0_TIN0_TLDS1_TLDSM1_ULSGRO0_USL1_UIOFGRO0_UPLRP0_USFGROn1_VSn1_VWA1_VWB4_WSGRA0_WSGRB0_WS64_WG16_16_1_WGM0_WGMXCCn1_WGMXCCGn1
    SolutionIndex: 55
    SolutionNameMin: Cijk_Ailk_Bljk_S_B_Bias_HA_S_SAV_UserArgs_MT16x320x8_MI16x16x1_SN_LDSB1_AFC0_AG1_AFEM1_AFEM1_ASEM1_CLR1_CADS0_DTLA0_DTLB0_DTVA0_DTVB0_DTVMXSA0_DTVMXSB0_DTVSM0_DPLBn1_EPS0_ELFLR0_EMLLn1_FDSI0_GRPM1_GRVWA1_GRVWB4_GSU0_GSUAMB_GSUC0_GSUWGMRR0_GLS0_ISA950_IU1_K1_LDSTI0_LBSPPA64_LBSPPB1280_LBSPPM0_LPA0_LPB0_LPM0_LRVW1_LWPMn1_MIAV1_MIWT1_10_MO40_MGRIPMn1_NTn1_NTA0_NTB0_NTC0_NTD4_NTM0_NEPBS16_NLCA1_NLCB1_ONLL1_PGR2_PLR1_PKA1_SGROBn1_SIA3_SS0_SU0_SUM0_SUS0_SPO0_SRVW0_SSO0_SVW4_SK3_SKFTR0_SKXCCM0_SGRO0_TDMI0_TIN0_TLDS0_TLDSM1_ULSGRO0_USL1_UIOFGRO0_UPLRP0_USFGRO1_VSn1_VWA1_VWB2_WSGRA0_WSGRB0_WS64_WG16_8_1_WGM48_WGMXCC8_WGMXCCGn1
    SolutionIndex: 56
    SolutionNameMin: Cijk_Ailk_Bljk_S_B_Bias_HA_S_SAV_UserArgs_MT16x288x8_MI16x16x1_SN_LDSB1_AFC0_AG1_AFEM1_AFEM1_ASEM1_CLR1_CADS0_DTLA0_DTLB0_DTVA0_DTVB0_DTVMXSA0_DTVMXSB0_DTVSM0_DPLBn1_EPS0_ELFLR0_EMLLn1_FDSI0_GRPM1_GRVWA1_GRVWB1_GSU0_GSUAMB_GSUC0_GSUWGMRR0_GLS0_ISA950_IU1_K1_LDSTI0_LBSPPA128_LBSPPB128_LBSPPM0_LPA16_LPB2_LPM0_LRVW2_LWPMn1_MIAV1_MIWT1_9_MO40_MGRIPMn1_NTn1_NTA0_NTB0_NTC4_NTD4_NTM0_NEPBS10_NLCA1_NLCB1_ONLL1_PGR2_PLR1_PKA1_SGROBn1_SIA3_SS0_SU0_SUM0_SUS0_SPO0_SRVW0_SSO0_SVW4_SK3_SKFTR0_SKXCCM0_SGRO0_TDMI0_TIN0_TLDS1_TLDSM1_ULSGRO0_USL1_UIOFGRO0_UPLRP0_USFGRO0_VSn1_VWA1_VWB1_WSGRA0_WSGRB0_WS64_WG16_8_1_WGM24_WGMXCC16_WGMXCCGn1
    SolutionIndex: 57
    SolutionNameMin: Cijk_Ailk_Bljk_S_B_Bias_HA_S_SAV_UserArgs_MT160x128x8_MI16x16x1_SN_LDSB1_AFC0_AG1_AFEM1_AFEM1_ASEM1_CLR1_CADS0_DTLA0_DTLB0_DTVA0_DTVB0_DTVMXSA0_DTVMXSB0_DTVSM0_DPLBn1_EPS1_ELFLR0_EMLLn1_FDSI0_GRPM1_GRVWA1_GRVWB2_GSU0_GSUAMB_GSUC0_GSUWGMRR0_GLS0_ISA950_IU1_K1_LDSTI0_LBSPPA1280_LBSPPB128_LBSPPM0_LPA0_LPB2_LPM0_LRVW2_LWPMn1_MIAV0_MIWT10_2_MO40_MGRIPMn1_NTn1_NTA0_NTB0_NTC4_NTD4_NTM0_NEPBS10_NLCA5_NLCB1_ONLL1_PGR1_PLR1_PKA1_SGROBn1_SIA3_SS1_SU0_SUM0_SUS0_SPO1_SRVW0_SSO4_SVW2_SK3_SKFTR0_SKXCCM8_SGRO0_TDMI0_TIN0_TLDS1_TLDSM1_ULSGRO0_USL1_UIOFGRO0_UPLRP0_USFGRO0_VSn1_VWA2_VWB2_WSGRA0_WSGRB0_WS64_WG16_16_1_WGM24_WGMXCC1_WGMXCCGn1
    SolutionIndex: 58
    SolutionNameMin: Cijk_Ailk_Bljk_S_B_Bias_HA_S_SAV_UserArgs_MT16x16x512_MI16x16x1_SN_LDSB1_AFC0_AG0_AFEM1_AFEM1_ASEM1_CLR1_CADS0_DTLA0_DTLB0_DTVA0_DTVB0_DTVMXSA0_DTVMXSB0_DTVSM0_DPLBn1_EPS0_ELFLR0_EMLLn1_FDSI0_GRPM1_GRVWA4_GRVWB4_GSU0_GSUAMB_GSUC0_GSUWGMRR0_GLS0_ISA950_IU1_K1_LDSTI0_LBSPPA256_LBSPPB2048_LBSPPM0_LPA16_LPB8_LPM0_LRVW4_LWPMn1_MIAV0_MIWT1_1_MO40_MGRIPMn1_NTn1_NTA4_NTB0_NTC0_NTD0_NTM0_NEPBS0_NLCA1_NLCB1_ONLL1_PGR2_PLR1_PKA1_SGROBn1_SIA3_SS1_SU0_SUM0_SUS0_SPO0_SRVW0_SSO0_SVW1_SK3_SKFTR0_SKXCCM8_SGRO0_TDMI0_TIN0_TLDS1_TLDSM1_ULSGRO0_USL1_UIOFGRO0_UPLRP0_USFGRO0_VSn1_VWA1_VWB1_WSGRA0_WSGRB0_WS64_WG16_4_4_WGM6_WGMXCC1_WGMXCCGn1
    SolutionIndex: 59
    SolutionNameMin: Cijk_Ailk_Bljk_S_B_Bias_HA_S_SAV_UserArgs_MT128x224x32_MI16x16x1_SN_LDSB1_AFC0_AG0_AFEM1_AFEM1_ASEM1_CLR1_CADS0_DTLA0_DTLB0_DTVA0_DTVB0_DTVMXSA0_DTVMXSB0_DTVSM0_DPLBn1_EPS0_ELFLR0_EMLLn1_FDSI0_GRPM1_GRVWA4_GRVWB4_GSU0_GSUAMB_GSUC0_GSUWGMRR0_GLS0_ISA950_IU1_K1_LDSTI0_LBSPPA2048_LBSPPB128_LBSPPM0_LPA0_LPB8_LPM0_LRVW4_LWPMn1_MIAV0_MIWT4_7_MO40_MGRIPMn1_NTn1_NTA0_NTB4_NTC0_NTD0_NTM0_NEPBS0_NLCA1_NLCB1_ONLL1_PGR2_PLR1_PKA1_SGROBn1_SIA3_SS1_SU0_SUM0_SUS0_SPO0_SRVW0_SSO0_SVW4_SK3_SKFTR0_SKXCCM8_SGRO0_TDMI0_TIN0_TLDS1_TLDSM1_ULSGRO0_USL1_UIOFGRO0_UPLRP0_USFGRO0_VSn1_VWA4_VWB1_WSGRA0_WSGRB0_WS64_WG32_8_1_WGM6_WGMXCC1_WGMXCCGn1
    SolutionIndex: 60
    SolutionNameMin: Cijk_Ailk_Bljk_S_B_Bias_HA_S_SAV_UserArgs_MT256x160x16_MI16x16x1_SN_LDSB0_AFC0_AG0_AFEM1_AFEM1_ASEM1_CLR1_CADS0_DTLA0_DTLB0_DTVA0_DTVB0_DTVMXSA0_DTVMXSB0_DTVSM0_DPLBn1_EPS0_ELFLR0_EMLLn1_FDSI0_GRPM1_GRVWA4_GRVWB2_GSU0_GSUAMB_GSUC0_GSUWGMRR0_GLS0_ISA950_IU1_K1_LDSTI0_LBSPPA2048_LBSPPB128_LBSPPM0_LPA0_LPB2_LPM0_LRVW2_LWPMn1_MIAV0_MIWT8_5_MO40_MGRIPMn1_NTn1_NTA0_NTB0_NTC0_NTD0_NTM0_NEPBS0_NLCA1_NLCB1_ONLL1_PGR2_PLR1_PKA1_SGROBn1_SIA3_SS1_SU0_SUM0_SUS0_SPO0_SRVW0_SSO0_SVW4_SK3_SKFTR0_SKXCCM0_SGRO0_TDMI0_TIN0_TLDS1_TLDSM1_ULSGRO0_USL1_UIOFGRO0_UPLRP0_USFGRO0_VSn1_VWA4_VWB1_WSGRA0_WSGRB0_WS64_WG32_8_1_WGM0_WGMXCCn1_WGMXCCGn1
    SolutionIndex: 61
    SolutionNameMin: Cijk_Ailk_Bljk_S_B_Bias_HA_S_SAV_UserArgs_MT64x160x64_MI16x16x1_SN_LDSB1_AFC0_AG0_AFEM1_AFEM1_ASEM1_CLR1_CADS0_DTLA0_DTLB0_DTVA0_DTVB0_DTVMXSA0_DTVMXSB0_DTVSM0_DPLBn1_EPS0_ELFLR0_EMLLn1_FDSI0_GRPM1_GRVWA4_GRVWB4_GSU0_GSUAMB_GSUC0_GSUWGMRR0_GLS0_ISA950_IU1_K1_LDSTI0_LBSPPA1024_LBSPPB256_LBSPPM0_LPA0_LPB8_LPM0_LRVW4_LWPMn1_MIAV0_MIWT2_5_MO40_MGRIPMn1_NTn1_NTA0_NTB0_NTC0_NTD0_NTM0_NEPBS0_NLCA1_NLCB1_ONLL1_PGR2_PLR1_PKA1_SGROBn1_SIA3_SS1_SU0_SUM0_SUS0_SPO0_SRVW0_SSO0_SVW2_SK3_SKFTR0_SKXCCM0_SGRO0_TDMI0_TIN0_TLDS1_TLDSM1_ULSGRO0_USL1_UIOFGRO0_UPLRP0_USFGRO0_VSn1_VWA2_VWB1_WSGRA0_WSGRB0_WS64_WG32_8_1_WGM0_WGMXCCn1_WGMXCCGn1
    SolutionIndex: 62
    SolutionNameMin: Cijk_Ailk_Bljk_S_B_Bias_HA_S_SAV_UserArgs_MT32x16x128_MI16x16x1_SN_LDSB1_AFC1_AG0_AFEM1_AFEM1_ASEM1_CLR1_CADS0_DTLA0_DTLB0_DTVA0_DTVB0_DTVMXSA0_DTVMXSB0_DTVSM0_DPLBn1_EPS0_ELFLR0_EMLLn1_FDSI0_GRPM1_GRVWA4_GRVWB4_GSU0_GSUAMB_GSUC0_GSUWGMRR0_GLS0_ISA950_IU1_K1_LDSTI0_LBSPPA512_LBSPPB512_LBSPPM0_LPA0_LPB8_LPM0_LRVW4_LWPMn1_MIAV0_MIWT2_1_MO40_MGRIPMn1_NTn1_NTA6_NTB0_NTC1_NTD0_NTM0_NEPBS14_NLCA1_NLCB1_ONLL1_PGR2_PLR1_PKA1_SGROBn1_SIA3_SS1_SU0_SUM0_SUS0_SPO0_SRVW0_SSO0_SVW2_SK3_SKFTR0_SKXCCM0_SGRO0_TDMI0_TIN0_TLDS1_TLDSM1_ULSGRO0_USL1_UIOFGRO0_UPLRP0_USFGRO0_VSn1_VWA2_VWB1_WSGRA0_WSGRB0_WS64_WG16_4_4_WGM1_WGMXCC8_WGMXCCGn1
    SolutionIndex: 63
    SolutionNameMin: Cijk_Ailk_Bljk_S_B_Bias_HA_S_SAV_UserArgs_MT64x48x64_MI16x16x1_SN_LDSB1_AFC1_AG0_AFEM1_AFEM1_ASEM1_CLR1_CADS0_DTLA0_DTLB0_DTVA0_DTVB0_DTVMXSA0_DTVMXSB0_DTVSM0_DPLBn1_EPS0_ELFLR0_EMLLn1_FDSI0_GRPM1_GRVWA4_GRVWB4_GSU0_GSUAMB_GSUC0_GSUWGMRR0_GLS0_ISA950_IU1_K1_LDSTI0_LBSPPA1024_LBSPPB256_LBSPPM0_LPA16_LPB8_LPM0_LRVW4_LWPMn1_MIAV1_MIWT1_3_MO40_MGRIPMn1_NTn1_NTA0_NTB2_NTC0_NTD7_NTM0_NEPBS14_NLCA1_NLCB1_ONLL1_PGR2_PLR1_PKA1_SGROBn1_SIA3_SS1_SU0_SUM0_SUS0_SPO0_SRVW0_SSO0_SVW1_SK3_SKFTR0_SKXCCM8_SGRO0_TDMI0_TIN0_TLDS1_TLDSM1_ULSGRO0_USL1_UIOFGRO0_UPLRP0_USFGRO1_VSn1_VWA1_VWB1_WSGRA0_WSGRB0_WS64_WG64_4_1_WGM1_WGMXCC2_WGMXCCGn1
    SolutionIndex: 64
    SolutionNameMin: Cijk_Ailk_Bljk_S_B_Bias_HA_S_SAV_UserArgs_MT16x32x16_MI16x16x1_SN_LDSB1_AFC1_AG0_AFEM1_AFEM1_ASEM1_CLR1_CADS0_DTLA0_DTLB0_DTVA0_DTVB0_DTVMXSA0_DTVMXSB0_DTVSM0_DPLBn1_EPS0_ELFLR0_EMLLn1_FDSI0_GRPM1_GRVWA1_GRVWB4_GSU0_GSUAMB_GSUC0_GSUWGMRR0_GLS0_ISA950_IU1_K1_LDSTI0_LBSPPA64_LBSPPB128_LBSPPM0_LPA0_LPB0_LPM0_LRVW1_LWPMn1_MIAV1_MIWT1_2_MO40_MGRIPMn1_NTn1_NTA2_NTB1_NTC2_NTD1_NTM0_NEPBS12_NLCA1_NLCB1_ONLL1_PGR2_PLR1_PKA1_SGROBn1_SIA3_SS1_SU0_SUM0_SUS0_SPO0_SRVW0_SSO0_SVW1_SK3_SKFTR0_SKXCCM4_SGRO0_TDMI0_TIN0_TLDS0_TLDSM1_ULSGRO0_USL1_UIOFGRO0_UPLRP0_USFGRO1_VSn1_VWA1_VWB2_WSGRA0_WSGRB0_WS64_WG16_4_2_WGM1_WGMXCC2_WGMXCCGn1
    SolutionIndex: 65
    SolutionNameMin: Cijk_Ailk_Bljk_S_B_Bias_HA_S_SAV_UserArgs_MT16x16x32_MI16x16x1_SN_LDSB1_AFC0_AG0_AFEM1_AFEM1_ASEM1_CLR1_CADS0_DTLA0_DTLB0_DTVA0_DTVB0_DTVMXSA0_DTVMXSB0_DTVSM0_DPLB0_EPS1_ELFLR0_EMLLn1_FDSI0_GRPM1_GRVWA1_GRVWB4_GSU0_GSUAMB_GSUC0_GSUWGMRR0_GLS0_ISA950_IU1_K1_LDSTI0_LBSPPA0_LBSPPB0_LBSPPM0_LPA0_LPB0_LPM0_LRVW1_LWPMn1_MIAV0_MIWT1_1_MO40_MGRIPM1_NTn1_NTA0_NTB0_NTC0_NTD4_NTM0_NEPBS10_NLCA1_NLCB1_ONLL1_PGR1_PLR1_PKA1_SGROB0_SIA3_SS0_SU0_SUM0_SUS0_SPO1_SRVW0_SSO0_SVW4_SK3_SKFTR0_SKXCCM0_SGRO0_TDMI0_TIN1_TLDS0_TLDSMn1_ULSGRO0_USL1_UIOFGRO0_UPLRP0_USFGRO1_VSn1_VWA1_VWB1_WSGRA2_WSGRB0_WS64_WG16_4_1_WGM6_WGMXCC8_WGMXCCGn1
    SolutionIndex: 66
    SolutionNameMin: Cijk_Ailk_Bljk_S_B_Bias_HA_S_SAV_UserArgs_MT32x16x32_MI16x16x1_SN_LDSB1_AFC0_AG1_AFEM1_AFEM1_ASEM1_CLR1_CADS0_DTLA0_DTLB0_DTVA0_DTVB0_DTVMXSA0_DTVMXSB0_DTVSM0_DPLB0_EPS1_ELFLR0_EMLL0_FDSI0_GRPM1_GRVWA1_GRVWB4_GSU0_GSUAMB_GSUC0_GSUWGMRR0_GLS0_ISA950_IU1_K1_LDSTI0_LBSPPA128_LBSPPB0_LBSPPM0_LPA16_LPB0_LPM0_LRVW1_LWPMn1_MIAV1_MIWT1_1_MO40_MGRIPM1_NTn1_NTA0_NTB0_NTC4_NTD4_NTM0_NEPBS8_NLCA1_NLCB1_ONLL1_PGR1_PLR1_PKA1_SGROB0_SIA3_SS0_SU0_SUM0_SUS0_SPO1_SRVW0_SSO0_SVW4_SK3_SKFTR0_SKXCCM0_SGRO0_TDMI0_TIN1_TLDS0_TLDSMn1_ULSGRO0_USL1_UIOFGRO0_UPLRP0_USFGRO1_VSn1_VWA1_VWB1_WSGRA0_WSGRB0_WS64_WG32_4_1_WGM24_WGMXCC4_WGMXCCGn1
    SolutionIndex: 67
    SolutionNameMin: Cijk_Ailk_Bljk_S_B_Bias_HA_S_SAV_UserArgs_MT64x128x32_MI16x16x1_SN_LDSB1_AFC0_AG0_AFEM1_AFEM1_ASEM1_CLR1_CADS0_DTLA0_DTLB0_DTVA0_DTVB0_DTVMXSA0_DTVMXSB0_DTVSM0_DPLB0_EPS1_ELFLR0_EMLL0_FDSI0_GRPM1_GRVWA1_GRVWB4_GSU0_GSUAMB_GSUC0_GSUWGMRR0_GLS0_ISA950_IU1_K1_LDSTI0_LBSPPA0_LBSPPB256_LBSPPM0_LPA0_LPB8_LPM0_LRVW4_LWPMn1_MIAV0_MIWT4_2_MO40_MGRIPM1_NTn1_NTA0_NTB0_NTC4_NTD4_NTM0_NEPBS10_NLCA1_NLCB1_ONLL1_PGR1_PLR1_PKA1_SGROB0_SIA3_SS1_SU0_SUM0_SUS0_SPO0_SRVW0_SSO1_SVW4_SK3_SKFTR0_SKXCCM0_SGRO0_TDMI0_TIN1_TLDS1_TLDSMn1_ULSGRO0_USL1_UIOFGRO0_UPLRP0_USFGRO1_VSn1_VWA4_VWB2_WSGRA2_WSGRB2_WS64_WG16_16_1_WGM8_WGMXCC1_WGMXCCGn1
    SolutionIndex: 68
    SolutionNameMin: Cijk_Ailk_Bljk_S_B_Bias_HA_S_SAV_UserArgs_MT64x48x32_MI16x16x1_SN_LDSB1_AFC0_AG1_AFEM1_AFEM1_ASEM1_CLR1_CADS0_DTLA0_DTLB0_DTVA0_DTVB0_DTVMXSA0_DTVMXSB0_DTVSM0_DPLB0_EPS0_ELFLR0_EMLLn1_FDSI0_GRPM1_GRVWA1_GRVWB1_GSU0_GSUAMB_GSUC0_GSUWGMRR0_GLS0_ISA950_IU1_K1_LDSTI0_LBSPPA1024_LBSPPB128_LBSPPM0_LPA16_LPB8_LPM0_LRVW4_LWPMn1_MIAV0_MIWT1_3_MO40_MGRIPM1_NTn1_NTA0_NTB0_NTC0_NTD4_NTM0_NEPBS16_NLCA1_NLCB1_ONLL1_PGR2_PLR1_PKA1_SGROB0_SIA3_SS1_SU0_SUM0_SUS0_SPO0_SRVW0_SSO0_SVW1_SK3_SKFTR0_SKXCCM4_SGRO0_TDMI0_TIN1_TLDS1_TLDSMn1_ULSGRO0_USL1_UIOFGRO0_UPLRP0_USFGRO0_VSn1_VWA1_VWB1_WSGRA2_WSGRB0_WS64_WG64_4_1_WGM24_WGMXCC1_WGMXCCGn1
    SolutionIndex: 69
    SolutionNameMin: Cijk_Ailk_Bljk_S_B_Bias_HA_S_SAV_UserArgs_MT256x256x32_MI16x16x1_SN_LDSB1_AFC0_AG1_AFEM1_AFEM1_ASEM1_CLR1_CADS0_DTLA0_DTLB0_DTVA0_DTVB0_DTVMXSA0_DTVMXSB0_DTVSM0_DPLB0_EPS0_ELFLR0_EMLLn1_FDSI0_GRPM1_GRVWA2_GRVWB4_GSU0_GSUAMB_GSUC0_GSUWGMRR0_GLS0_ISA950_IU1_K1_LDSTI0_LBSPPA0_LBSPPB512_LBSPPM0_LPA0_LPB8_LPM0_LRVW4_LWPMn1_MIAV0_MIWT8_8_MO40_MGRIPM1_NTn1_NTA0_NTB0_NTC0_NTD0_NTM0_NEPBS0_NLCA2_NLCB1_ONLL1_PGR2_PLR1_PKA1_SGROB0_SIA3_SS1_SU8_SUM0_SUS128_SPO1_SRVW0_SSO0_SVW4_SK3_SKFTR0_SKXCCM0_SGRO0_TDMI0_TIN0_TLDS1_TLDSMn1_ULSGRO0_USL1_UIOFGRO0_UPLRP0_USFGRO0_VSn1_VWA4_VWB4_WSGRA2_WSGRB2_WS64_WG32_8_1_WGM8_WGMXCC1_WGMXCCGn1
    SolutionIndex: 70
    SolutionNameMin: Cijk_Ailk_Bljk_S_B_Bias_HA_S_SAV_UserArgs_MT16x64x32_MI16x16x1_SN_LDSB0_AFC0_AG0_AFEM1_AFEM1_ASEM1_CLR1_CADS0_DTLA0_DTLB0_DTVA0_DTVB0_DTVMXSA0_DTVMXSB0_DTVSM0_DPLB0_EPS1_ELFLR0_EMLL0_FDSI0_GRPM1_GRVWA1_GRVWB4_GSU0_GSUAMB_GSUC0_GSUWGMRR0_GLS0_ISA950_IU1_K1_LDSTI0_LBSPPA128_LBSPPB128_LBSPPM0_LPA8_LPB8_LPM0_LRVW4_LWPMn1_MIAV0_MIWT1_1_MO40_MGRIPM1_NTn1_NTA0_NTB0_NTC4_NTD4_NTM0_NEPBS14_NLCA1_NLCB1_ONLL1_PGR1_PLR1_PKA1_SGROB0_SIA3_SS0_SU0_SUM0_SUS0_SPO0_SRVW0_SSO0_SVW4_SK3_SKFTR0_SKXCCM8_SGRO0_TDMI0_TIN1_TLDS2_TLDSMn1_ULSGRO0_USL1_UIOFGRO0_UPLRP0_USFGRO1_VSn1_VWA1_VWB1_WSGRA0_WSGRB2_WS64_WG16_16_1_WGM16_WGMXCC1_WGMXCCGn1
    SolutionIndex: 71
    SolutionNameMin: Cijk_Ailk_Bljk_S_B_Bias_HA_S_SAV_UserArgs_MT96x64x32_MI16x16x1_SN_LDSB1_AFC0_AG1_AFEM1_AFEM1_ASEM1_CLR1_CADS0_DTLA0_DTLB0_DTVA0_DTVB0_DTVMXSA0_DTVMXSB0_DTVSM0_DPLB0_EPS0_ELFLR0_EMLLn1_FDSI0_GRPM1_GRVWA1_GRVWB4_GSU0_GSUAMB_GSUC0_GSUWGMRR0_GLS0_ISA950_IU1_K1_LDSTI0_LBSPPA0_LBSPPB256_LBSPPM0_LPA0_LPB16_LPM0_LRVW1_LWPMn1_MIAV0_MIWT6_1_MO40_MGRIPM1_NTn1_NTA0_NTB0_NTC4_NTD0_NTM0_NEPBS12_NLCA3_NLCB1_ONLL1_PGR2_PLR1_PKA1_SGROB0_SIA3_SS1_SU0_SUM0_SUS0_SPO0_SRVW0_SSO0_SVW2_SK3_SKFTR0_SKXCCM8_SGRO0_TDMI0_TIN1_TLDS0_TLDSMn1_ULSGRO1_USL1_UIOFGRO0_UPLRP0_USFGRO1_VSn1_VWA2_VWB1_WSGRA2_WSGRB0_WS64_WG16_16_1_WGM2_WGMXCC1_WGMXCCGn1
    SolutionIndex: 72
    SolutionNameMin: Cijk_Ailk_Bljk_S_B_Bias_HA_S_SAV_UserArgs_MT16x128x32_MI16x16x1_SN_LDSB0_AFC0_AG1_AFEM1_AFEM1_ASEM1_CLR1_CADS0_DTLA0_DTLB0_DTVA0_DTVB0_DTVMXSA0_DTVMXSB0_DTVSM0_DPLB0_EPS0_ELFLR0_EMLLn1_FDSI0_GRPM1_GRVWA1_GRVWB4_GSU0_GSUAMB_GSUC0_GSUWGMRR0_GLS0_ISA950_IU1_K1_LDSTI0_LBSPPA256_LBSPPB256_LBSPPM0_LPA16_LPB8_LPM0_LRVW4_LWPMn1_MIAV1_MIWT1_2_MO40_MGRIPM1_NTn1_NTA0_NTB0_NTC0_NTD0_NTM0_NEPBS10_NLCA1_NLCB1_ONLL1_PGR2_PLR1_PKA1_SGROB0_SIA3_SS0_SU0_SUM0_SUS0_SPO1_SRVW0_SSO1_SVW4_SK3_SKFTR0_SKXCCM4_SGRO0_TDMI0_TIN1_TLDS1_TLDSMn1_ULSGRO0_USL1_UIOFGRO0_UPLRP0_USFGRO1_VSn1_VWA1_VWB2_WSGRA0_WSGRB2_WS64_WG16_16_1_WGM2_WGMXCC1_WGMXCCGn1
    SolutionIndex: 73
    SolutionNameMin: Cijk_Ailk_Bljk_S_B_Bias_HA_S_SAV_UserArgs_MT16x64x32_MI16x16x1_SN_LDSB1_AFC0_AG0_AFEM1_AFEM1_ASEM1_CLR1_CADS0_DTLA0_DTLB0_DTVA0_DTVB0_DTVMXSA0_DTVMXSB0_DTVSM0_DPLB0_EPS0_ELFLR0_EMLL0_FDSI0_GRPM1_GRVWA1_GRVWB4_GSU0_GSUAMB_GSUC0_GSUWGMRR0_GLS0_ISA950_IU1_K1_LDSTI0_LBSPPA256_LBSPPB128_LBSPPM0_LPA16_LPB8_LPM0_LRVW4_LWPMn1_MIAV1_MIWT1_1_MO40_MGRIPM1_NTn1_NTA0_NTB4_NTC0_NTD0_NTM0_NEPBS16_NLCA1_NLCB1_ONLL1_PGR2_PLR1_PKA1_SGROB0_SIA3_SS0_SU0_SUM0_SUS0_SPO0_SRVW0_SSO0_SVW4_SK3_SKFTR0_SKXCCM0_SGRO0_TDMI0_TIN1_TLDS1_TLDSMn1_ULSGRO0_USL1_UIOFGRO0_UPLRP0_USFGRO1_VSn1_VWA1_VWB1_WSGRA0_WSGRB0_WS64_WG16_16_1_WGM4_WGMXCC8_WGMXCCGn1
    SolutionIndex: 74
    SolutionNameMin: Cijk_Ailk_Bljk_S_B_Bias_HA_S_SAV_UserArgs_MT16x96x32_MI16x16x1_SN_LDSB0_AFC0_AG0_AFEM1_AFEM1_ASEM1_CLR1_CADS0_DTLA0_DTLB0_DTVA0_DTVB0_DTVMXSA0_DTVMXSB0_DTVSM0_DPLB0_EPS0_ELFLR0_EMLL0_FDSI0_GRPM1_GRVWA1_GRVWB4_GSU0_GSUAMB_GSUC0_GSUWGMRR0_GLS0_ISA950_IU1_K1_LDSTI0_LBSPPA256_LBSPPB128_LBSPPM0_LPA16_LPB8_LPM0_LRVW4_LWPMn1_MIAV1_MIWT1_3_MO40_MGRIPM1_NTn1_NTA0_NTB4_NTC0_NTD0_NTM0_NEPBS14_NLCA1_NLCB1_ONLL1_PGR2_PLR1_PKA1_SGROB0_SIA3_SS0_SU16_SUM0_SUS256_SPO0_SRVW0_SSO0_SVW1_SK3_SKFTR0_SKXCCM4_SGRO0_TDMI0_TIN0_TLDS1_TLDSMn1_ULSGRO0_USL1_UIOFGRO0_UPLRP0_USFGRO1_VSn1_VWA1_VWB1_WSGRA2_WSGRB0_WS64_WG16_8_2_WGM24_WGMXCC2_WGMXCCGn1
    SolutionIndex: 75
    SolutionNameMin: Cijk_Ailk_Bljk_S_B_Bias_HA_S_SAV_UserArgs_MT64x80x32_MI16x16x1_SN_LDSB1_AFC0_AG0_AFEM1_AFEM1_ASEM1_CLR1_CADS0_DTLA0_DTLB0_DTVA0_DTVB0_DTVMXSA0_DTVMXSB0_DTVSM0_DPLB0_EPS0_ELFLR0_EMLLn1_FDSI0_GRPM1_GRVWA1_GRVWB1_GSU0_GSUAMB_GSUC0_GSUWGMRR0_GLS0_ISA950_IU1_K1_LDSTI0_LBSPPA1024_LBSPPB128_LBSPPM0_LPA16_LPB8_LPM0_LRVW4_LWPMn1_MIAV1_MIWT1_5_MO40_MGRIPM1_NTn1_NTA0_NTB4_NTC4_NTD0_NTM0_NEPBS14_NLCA1_NLCB1_ONLL1_PGR2_PLR1_PKA1_SGROB0_SIA3_SS0_SU0_SUM0_SUS0_SPO0_SRVW0_SSO0_SVW4_SK3_SKFTR0_SKXCCM0_SGRO0_TDMI0_TIN1_TLDS1_TLDSMn1_ULSGRO0_USL1_UIOFGRO0_UPLRP0_USFGRO0_VSn1_VWA1_VWB1_WSGRA0_WSGRB0_WS64_WG64_4_1_WGMn32_WGMXCC4_WGMXCCGn1
    SolutionIndex: 76
    SolutionNameMin: Cijk_Ailk_Bljk_S_B_Bias_HA_S_SAV_UserArgs_MT16x32x64_MI16x16x1_SN_LDSB1_AFC0_AG0_AFEM1_AFEM1_ASEM1_CLR1_CADS0_DTLA0_DTLB0_DTVA0_DTVB0_DTVMXSA0_DTVMXSB0_DTVSM0_DPLB0_EPS0_ELFLR0_EMLLn1_FDSI0_GRPM1_GRVWA1_GRVWB4_GSU0_GSUAMB_GSUC0_GSUWGMRR0_GLS0_ISA950_IU1_K1_LDSTI0_LBSPPA256_LBSPPB256_LBSPPM0_LPA16_LPB8_LPM0_LRVW4_LWPMn1_MIAV1_MIWT1_1_MO40_MGRIPM1_NTn1_NTA0_NTB4_NTC0_NTD0_NTM0_NEPBS14_NLCA1_NLCB1_ONLL1_PGR2_PLR1_PKA1_SGROB0_SIA3_SS0_SU0_SUM0_SUS0_SPO0_SRVW0_SSO0_SVW4_SK3_SKFTR0_SKXCCM4_SGRO0_TDMI0_TIN1_TLDS1_TLDSMn1_ULSGRO0_USL1_UIOFGRO0_UPLRP0_USFGRO1_VSn1_VWA1_VWB1_WSGRA0_WSGRB0_WS64_WG16_8_1_WGM24_WGMXCC2_WGMXCCGn1
    SolutionIndex: 77
    SolutionNameMin: Cijk_Ailk_Bljk_S_B_Bias_HA_S_SAV_UserArgs_MT128x80x32_MI16x16x1_SN_LDSB0_AFC0_AG1_AFEM1_AFEM1_ASEM1_CLR1_CADS0_DTLA0_DTLB0_DTVA0_DTVB0_DTVMXSA0_DTVMXSB0_DTVSM0_DPLB0_EPS0_ELFLR0_EMLLn1_FDSI0_GRPM1_GRVWA4_GRVWB2_GSU0_GSUAMB_GSUC0_GSUWGMRR0_GLS0_ISA950_IU1_K1_LDSTI0_LBSPPA0_LBSPPB128_LBSPPM0_LPA0_LPB8_LPM0_LRVW4_LWPMn1_MIAV1_MIWT2_5_MO40_MGRIPM1_NTn1_NTA0_NTB0_NTC4_NTD4_NTM0_NEPBS0_NLCA1_NLCB1_ONLL1_PGR2_PLR1_PKA1_SGROB0_SIA3_SS1_SU0_SUM0_SUS0_SPO0_SRVW0_SSO0_SVW2_SK3_SKFTR0_SKXCCM0_SGRO0_TDMI0_TIN0_TLDS1_TLDSMn1_ULSGRO1_USL1_UIOFGRO0_UPLRP0_USFGRO0_VSn1_VWA2_VWB1_WSGRA0_WSGRB2_WS64_WG64_4_1_WGM32_WGMXCC16_WGMXCCGn1
    SolutionIndex: 78
    SolutionNameMin: Cijk_Ailk_Bljk_S_B_Bias_HA_S_SAV_UserArgs_MT16x16x32_MI16x16x1_SN_LDSB1_AFC0_AG0_AFEM1_AFEM1_ASEM1_CLR1_CADS0_DTLA0_DTLB0_DTVA0_DTVB0_DTVMXSA0_DTVMXSB0_DTVSM0_DPLB0_EPS0_ELFLR0_EMLLn1_FDSI0_GRPM1_GRVWA1_GRVWB4_GSU0_GSUAMB_GSUC0_GSUWGMRR0_GLS0_ISA950_IU1_K1_LDSTI0_LBSPPA128_LBSPPB128_LBSPPM0_LPA8_LPB8_LPM0_LRVW4_LWPMn1_MIAV0_MIWT1_1_MO40_MGRIPM1_NTn1_NTA0_NTB4_NTC0_NTD0_NTM0_NEPBS14_NLCA1_NLCB1_ONLL1_PGR2_PLR1_PKA1_SGROB0_SIA3_SS0_SU0_SUM0_SUS0_SPO0_SRVW0_SSO0_SVW4_SK3_SKFTR0_SKXCCM0_SGRO0_TDMI0_TIN1_TLDS2_TLDSMn1_ULSGRO0_USL1_UIOFGRO0_UPLRP0_USFGRO1_VSn1_VWA1_VWB1_WSGRA0_WSGRB0_WS64_WG16_4_1_WGM48_WGMXCC32_WGMXCCGn1
    SolutionIndex: 79
    SolutionNameMin: Cijk_Ailk_Bljk_S_B_Bias_HA_S_SAV_UserArgs_MT32x128x32_MI16x16x1_SN_LDSB0_AFC0_AG0_AFEM1_AFEM1_ASEM1_CLR1_CADS0_DTLA0_DTLB0_DTVA0_DTVB0_DTVMXSA0_DTVMXSB0_DTVSM0_DPLB0_EPS0_ELFLR0_EMLL0_FDSI0_GRPM1_GRVWA1_GRVWB4_GSU0_GSUAMB_GSUC0_GSUWGMRR0_GLS0_ISA950_IU1_K1_LDSTI0_LBSPPA0_LBSPPB256_LBSPPM0_LPA0_LPB8_LPM0_LRVW4_LWPMn1_MIAV0_MIWT2_2_MO40_MGRIPM1_NTn1_NTA0_NTB0_NTC4_NTD4_NTM0_NEPBS0_NLCA1_NLCB1_ONLL1_PGR2_PLR1_PKA1_SGROB0_SIA3_SS1_SU0_SUM0_SUS0_SPO0_SRVW0_SSO0_SVW2_SK3_SKFTR0_SKXCCM0_SGRO0_TDMI0_TIN1_TLDS1_TLDSMn1_ULSGRO0_USL1_UIOFGRO0_UPLRP0_USFGRO1_VSn1_VWA2_VWB2_WSGRA0_WSGRB2_WS64_WG16_16_1_WGM8_WGMXCC8_WGMXCCGn1
    SolutionIndex: 80
    SolutionNameMin: Cijk_Ailk_Bljk_S_B_Bias_HA_S_SAV_UserArgs_MT16x16x32_MI16x16x1_SN_LDSB1_AFC0_AG1_AFEM1_AFEM1_ASEM1_CLR1_CADS0_DTLA0_DTLB0_DTVA0_DTVB0_DTVMXSA0_DTVMXSB0_DTVSM0_DPLB0_EPS0_ELFLR0_EMLL0_FDSI0_GRPM1_GRVWA1_GRVWB4_GSU0_GSUAMB_GSUC0_GSUWGMRR0_GLS0_ISA950_IU1_K1_LDSTI0_LBSPPA128_LBSPPB128_LBSPPM0_LPA8_LPB8_LPM0_LRVW4_LWPMn1_MIAV0_MIWT1_1_MO40_MGRIPM1_NTn1_NTA0_NTB0_NTC0_NTD0_NTM0_NEPBS14_NLCA1_NLCB1_ONLL1_PGR2_PLR1_PKA1_SGROB0_SIA3_SS1_SU8_SUM0_SUS128_SPO1_SRVW0_SSO0_SVW1_SK3_SKFTR0_SKXCCM0_SGRO0_TDMI0_TIN0_TLDS2_TLDSMn1_ULSGRO0_USL1_UIOFGRO0_UPLRP0_USFGRO1_VSn1_VWA1_VWB1_WSGRA0_WSGRB0_WS64_WG16_4_2_WGM32_WGMXCC4_WGMXCCGn1
    SolutionIndex: 81
    SolutionNameMin: Cijk_Ailk_Bljk_S_B_Bias_HA_S_SAV_UserArgs_MT32x64x32_MI16x16x1_SN_LDSB1_AFC0_AG0_AFEM1_AFEM1_ASEM1_CLR1_CADS0_DTLA0_DTLB0_DTVA0_DTVB0_DTVMXSA0_DTVMXSB0_DTVSM0_DPLB0_EPS0_ELFLR0_EMLLn1_FDSI0_GRPM1_GRVWA1_GRVWB4_GSU0_GSUAMB_GSUC0_GSUWGMRR0_GLS0_ISA950_IU1_K1_LDSTI0_LBSPPA0_LBSPPB128_LBSPPM0_LPA0_LPB8_LPM0_LRVW4_LWPMn1_MIAV0_MIWT2_1_MO40_MGRIPM1_NTn1_NTA0_NTB0_NTC4_NTD4_NTM0_NEPBS16_NLCA1_NLCB1_ONLL1_PGR2_PLR1_PKA1_SGROB0_SIA3_SS1_SU0_SUM0_SUS0_SPO1_SRVW0_SSO0_SVW2_SK3_SKFTR0_SKXCCM0_SGRO0_TDMI0_TIN1_TLDS1_TLDSMn1_ULSGRO0_USL1_UIOFGRO0_UPLRP0_USFGRO1_VSn1_VWA2_VWB1_WSGRA0_WSGRB0_WS64_WG16_16_1_WGM8_WGMXCC1_WGMXCCGn1
    SolutionIndex: 82
    SolutionNameMin: Cijk_Ailk_Bljk_S_B_Bias_HA_S_SAV_UserArgs_MT16x320x32_MI16x16x1_SN_LDSB1_AFC0_AG1_AFEM1_AFEM1_ASEM1_CLR1_CADS0_DTLA0_DTLB0_DTVA0_DTVB0_DTVMXSA0_DTVMXSB0_DTVSM0_DPLB0_EPS0_ELFLR0_EMLL0_FDSI0_GRPM1_GRVWA2_GRVWB2_GSU0_GSUAMB_GSUC0_GSUWGMRR0_GLS0_ISA950_IU1_K1_LDSTI0_LBSPPA128_LBSPPB128_LBSPPM0_LPA8_LPB8_LPM0_LRVW4_LWPMn1_MIAV1_MIWT1_5_MO40_MGRIPM1_NTn1_NTA0_NTB4_NTC0_NTD4_NTM0_NEPBS0_NLCA1_NLCB1_ONLL1_PGR2_PLR1_PKA1_SGROB0_SIA3_SS0_SU8_SUM0_SUS512_SPO1_SRVW0_SSO1_SVW4_SK3_SKFTR0_SKXCCM0_SGRO0_TDMI0_TIN0_TLDS2_TLDSMn1_ULSGRO1_USL1_UIOFGRO0_UPLRP0_USFGRO1_VSn1_VWA1_VWB1_WSGRA2_WSGRB0_WS64_WG16_16_1_WGM32_WGMXCC32_WGMXCCGn1
    SolutionIndex: 83
    SolutionNameMin: Cijk_Ailk_Bljk_S_B_Bias_HA_S_SAV_UserArgs_MT224x288x32_MI16x16x1_SN_LDSB1_AFC0_AG0_AFEM1_AFEM1_ASEM1_CLR1_CADS0_DTLA0_DTLB0_DTVA0_DTVB0_DTVMXSA0_DTVMXSB0_DTVSM0_DPLB0_EPS0_ELFLR0_EMLL0_FDSI0_GRPM1_GRVWA4_GRVWB4_GSU0_GSUAMB_GSUC0_GSUWGMRR0_GLS0_ISA950_IU1_K1_LDSTI0_LBSPPA3584_LBSPPB128_LBSPPM0_LPA16_LPB8_LPM0_LRVWn1_LWPMn1_MIAV0_MIWT7_9_MO40_MGRIPM1_NTn1_NTA0_NTB0_NTC4_NTD0_NTM0_NEPBS8_NLCA7_NLCB1_ONLL1_PGR2_PLR1_PKA1_SGROB0_SIA3_SS1_SU0_SUM0_SUS0_SPO0_SRVW0_SSO1_SVW1_SK3_SKFTR0_SKXCCM0_SGRO0_TDMI0_TIN1_TLDS1_TLDSMn1_ULSGRO0_USL1_UIOFGRO0_UPLRP0_USFGRO1_VSn1_VWA1_VWB1_WSGRA2_WSGRB0_WS64_WG32_8_1_WGM0_WGMXCC8_WGMXCCGn1
    SolutionIndex: 84
    SolutionNameMin: Cijk_Ailk_Bljk_S_B_Bias_HA_S_SAV_UserArgs_MT288x224x32_MI16x16x1_SN_LDSB1_AFC0_AG1_AFEM1_AFEM1_ASEM1_CLR1_CADS0_DTLA0_DTLB0_DTVA0_DTVB0_DTVMXSA0_DTVMXSB0_DTVSM0_DPLB0_EPS0_ELFLR0_EMLL0_FDSI0_GRPM1_GRVWA4_GRVWB4_GSU0_GSUAMB_GSUC0_GSUWGMRR0_GLS0_ISA950_IU1_K1_LDSTI0_LBSPPA4608_LBSPPB128_LBSPPM0_LPA16_LPB8_LPM0_LRVWn1_LWPMn1_MIAV0_MIWT9_7_MO40_MGRIPM1_NTn1_NTA0_NTB0_NTC0_NTD4_NTM0_NEPBS8_NLCA9_NLCB1_ONLL1_PGR2_PLR1_PKA1_SGROB0_SIA3_SS1_SU8_SUM0_SUS512_SPO1_SRVW0_SSO1_SVW1_SK3_SKFTR0_SKXCCM4_SGRO0_TDMI0_TIN0_TLDS1_TLDSMn1_ULSGRO1_USL1_UIOFGRO0_UPLRP0_USFGRO0_VSn1_VWA1_VWB1_WSGRA0_WSGRB2_WS64_WG32_8_1_WGM2_WGMXCC4_WGMXCCGn1
    SolutionIndex: 85
    SolutionNameMin: Cijk_Ailk_Bljk_S_B_Bias_HA_S_SAV_UserArgs_MT256x192x32_MI16x16x1_SN_LDSB1_AFC0_AG0_AFEM1_AFEM1_ASEM1_CLR1_CADS0_DTLA0_DTLB0_DTVA0_DTVB0_DTVMXSA0_DTVMXSB0_DTVSM0_DPLB0_EPS0_ELFLR0_EMLLn1_FDSI0_GRPM1_GRVWA4_GRVWB4_GSU0_GSUAMB_GSUC0_GSUWGMRR0_GLS0_ISA950_IU1_K1_LDSTI0_LBSPPA0_LBSPPB512_LBSPPM0_LPA0_LPB8_LPM0_LRVWn1_LWPMn1_MIAV0_MIWT4_12_MO40_MGRIPM1_NTn1_NTA0_NTB0_NTC4_NTD4_NTM0_NEPBS0_NLCA1_NLCB1_ONLL1_PGR2_PLR1_PKA1_SGROB0_SIA3_SS1_SU0_SUM0_SUS0_SPO0_SRVW0_SSO4_SVW4_SK3_SKFTR0_SKXCCM8_SGRO0_TDMI0_TIN0_TLDS1_TLDSMn1_ULSGRO1_USL1_UIOFGRO0_UPLRP0_USFGRO1_VSn1_VWA4_VWB4_WSGRA0_WSGRB0_WS64_WG64_4_1_WGM2_WGMXCC32_WGMXCCGn1
    SolutionIndex: 86
    SolutionNameMin: Cijk_Ailk_Bljk_S_B_Bias_HA_S_SAV_UserArgs_MT256x192x32_MI32x32x1_SN_LDSB1_AFC0_AG1_AFEM1_AFEM1_ASEM1_CLR1_CADS0_DTLA0_DTLB0_DTVA0_DTVB0_DTVMXSA0_DTVMXSB0_DTVSM0_DPLB0_EPS1_ELFLR0_EMLLn1_FDSI0_GRPM1_GRVWA4_GRVWB4_GSU0_GSUAMB_GSUC0_GSUWGMRR0_GLS0_ISA950_IU1_K1_LDSTI0_LBSPPA0_LBSPPB128_LBSPPM0_LPA0_LPB4_LPM0_LRVWn1_LWPMn1_MIAV0_MIWT4_3_MO40_MGRIPM1_NTn1_NTA0_NTB0_NTC4_NTD4_NTM0_NEPBS12_NLCA1_NLCB1_ONLL1_PGR1_PLR1_PKA1_SGROB0_SIA3_SS1_SU0_SUM0_SUS0_SPO1_SRVW0_SSO1_SVW4_SK3_SKFTR0_SKXCCM4_SGRO0_TDMI0_TIN1_TLDS1_TLDSMn1_ULSGRO0_USL1_UIOFGRO0_UPLRP0_USFGRO1_VSn1_VWA4_VWB1_WSGRA2_WSGRB0_WS64_WG64_4_1_WGM4_WGMXCC1_WGMXCCGn1
    SolutionIndex: 87
    SolutionNameMin: Cijk_Ailk_Bljk_S_B_Bias_HA_S_SAV_UserArgs_MT256x192x32_MI16x16x1_SN_LDSB1_AFC0_AG0_AFEM1_AFEM1_ASEM1_CLR1_CADS0_DTLA0_DTLB0_DTVA0_DTVB0_DTVMXSA0_DTVMXSB0_DTVSM0_DPLB0_EPS0_ELFLR0_EMLL0_FDSI0_GRPM1_GRVWA4_GRVWB4_GSU0_GSUAMB_GSUC0_GSUWGMRR0_GLS0_ISA950_IU1_K1_LDSTI0_LBSPPA0_LBSPPB256_LBSPPM0_LPA0_LPB8_LPM0_LRVWn1_LWPMn1_MIAV0_MIWT8_6_MO40_MGRIPM1_NTn1_NTA0_NTB0_NTC4_NTD4_NTM0_NEPBS12_NLCA1_NLCB1_ONLL1_PGR2_PLR1_PKA1_SGROB0_SIA3_SS1_SU0_SUM0_SUS0_SPO0_SRVW0_SSO1_SVW4_SK3_SKFTR0_SKXCCM8_SGRO0_TDMI0_TIN1_TLDS1_TLDSMn1_ULSGRO0_USL1_UIOFGRO0_UPLRP0_USFGRO0_VSn1_VWA4_VWB2_WSGRA0_WSGRB2_WS64_WG32_8_1_WGM2_WGMXCC16_WGMXCCGn1
    SolutionIndex: 88
    SolutionNameMin: Cijk_Ailk_Bljk_S_B_Bias_HA_S_SAV_UserArgs_MT448x128x32_MI16x16x1_SN_LDSB1_AFC0_AG1_AFEM1_AFEM1_ASEM1_CLR1_CADS0_DTLA0_DTLB0_DTVA0_DTVB0_DTVMXSA0_DTVMXSB0_DTVSM0_DPLB0_EPS0_ELFLR0_EMLLn1_FDSI0_GRPM1_GRVWA4_GRVWB4_GSU0_GSUAMB_GSUC0_GSUWGMRR0_GLS0_ISA950_IU1_K1_LDSTI0_LBSPPA0_LBSPPB512_LBSPPM0_LPA0_LPB8_LPM0_LRVWn1_LWPMn1_MIAV0_MIWT14_4_MO40_MGRIPM1_NTn1_NTA0_NTB0_NTC0_NTD0_NTM0_NEPBS0_NLCA7_NLCB1_ONLL1_PGR2_PLR1_PKA1_SGROB0_SIA3_SS1_SU8_SUM0_SUS512_SPO0_SRVW0_SSO0_SVW2_SK3_SKFTR0_SKXCCM8_SGRO0_TDMI0_TIN0_TLDS1_TLDSMn1_ULSGRO0_USL1_UIOFGRO0_UPLRP0_USFGRO1_VSn1_VWA2_VWB4_WSGRA0_WSGRB2_WS64_WG32_8_1_WGM48_WGMXCC16_WGMXCCGn1
    SolutionIndex: 89
    SolutionNameMin: Cijk_Ailk_Bljk_S_B_Bias_HA_S_SAV_UserArgs_MT128x448x32_MI16x16x1_SN_LDSB1_AFC0_AG1_AFEM1_AFEM1_ASEM1_CLR1_CADS0_DTLA0_DTLB0_DTVA0_DTVB0_DTVMXSA0_DTVMXSB0_DTVSM0_DPLB0_EPS0_ELFLR0_EMLLn1_FDSI0_GRPM1_GRVWA2_GRVWB4_GSU0_GSUAMB_GSUC0_GSUWGMRR0_GLS0_ISA950_IU1_K1_LDSTI0_LBSPPA0_LBSPPB256_LBSPPM0_LPA0_LPB8_LPM0_LRVWn1_LWPMn1_MIAV0_MIWT4_14_MO40_MGRIPM1_NTn1_NTA0_NTB0_NTC0_NTD0_NTM0_NEPBS0_NLCA1_NLCB1_ONLL1_PGR2_PLR1_PKA1_SGROB0_SIA3_SS1_SU0_SUM0_SUS0_SPO1_SRVW0_SSO1_SVW4_SK3_SKFTR0_SKXCCM0_SGRO0_TDMI0_TIN1_TLDS1_TLDSMn1_ULSGRO0_USL1_UIOFGRO0_UPLRP0_USFGRO0_VSn1_VWA4_VWB2_WSGRA0_WSGRB0_WS64_WG32_8_1_WGM2_WGMXCC4_WGMXCCGn1
    SolutionIndex: 90
    SolutionNameMin: Cijk_Ailk_Bljk_S_B_Bias_HA_S_SAV_UserArgs_MT256x240x32_MI16x16x1_SN_LDSB0_AFC0_AG1_AFEM1_AFEM1_ASEM1_CLR1_CADS0_DTLA0_DTLB0_DTVA0_DTVB0_DTVMXSA0_DTVMXSB0_DTVSM0_DPLB0_EPS0_ELFLR0_EMLLn1_FDSI0_GRPM1_GRVWA4_GRVWB2_GSU0_GSUAMB_GSUC0_GSUWGMRR0_GLS0_ISA950_IU1_K1_LDSTI0_LBSPPA0_LBSPPB128_LBSPPM0_LPA0_LPB8_LPM0_LRVWn1_LWPMn1_MIAV0_MIWT4_15_MO40_MGRIPM1_NTn1_NTA0_NTB0_NTC0_NTD0_NTM0_NEPBS12_NLCA1_NLCB1_ONLL1_PGR2_PLR1_PKA1_SGROB0_SIA3_SS1_SU0_SUM0_SUS0_SPO1_SRVW0_SSO1_SVW4_SK3_SKFTR0_SKXCCM8_SGRO0_TDMI0_TIN1_TLDS1_TLDSMn1_ULSGRO0_USL1_UIOFGRO0_UPLRP0_USFGRO1_VSn1_VWA4_VWB1_WSGRA2_WSGRB2_WS64_WG64_4_1_WGMn1_WGMXCC1_WGMXCCGn1
    SolutionIndex: 91
    SolutionNameMin: Cijk_Ailk_Bljk_S_B_Bias_HA_S_SAV_UserArgs_MT384x128x32_MI16x16x1_SN_LDSB1_AFC0_AG1_AFEM1_AFEM1_ASEM1_CLR1_CADS0_DTLA0_DTLB0_DTVA0_DTVB0_DTVMXSA0_DTVMXSB0_DTVSM0_DPLB0_EPS0_ELFLR0_EMLL0_FDSI0_GRPM1_GRVWA4_GRVWB4_GSU0_GSUAMB_GSUC0_GSUWGMRR0_GLS0_ISA950_IU1_K1_LDSTI0_LBSPPA0_LBSPPB512_LBSPPM0_LPA0_LPB8_LPM0_LRVWn1_LWPMn1_MIAV0_MIWT12_4_MO40_MGRIPM1_NTn1_NTA0_NTB0_NTC4_NTD4_NTM0_NEPBS12_NLCA3_NLCB1_ONLL1_PGR2_PLR1_PKA1_SGROB0_SIA3_SS1_SU0_SUM0_SUS0_SPO0_SRVW0_SSO1_SVW4_SK3_SKFTR0_SKXCCM0_SGRO0_TDMI0_TIN1_TLDS1_TLDSMn1_ULSGRO0_USL1_UIOFGRO0_UPLRP0_USFGRO0_VSn1_VWA4_VWB4_WSGRA0_WSGRB2_WS64_WG32_8_1_WGMn32_WGMXCC8_WGMXCCGn1
    SolutionIndex: 92
    SolutionNameMin: Cijk_Ailk_Bljk_S_B_Bias_HA_S_SAV_UserArgs_MT224x192x32_MI16x16x1_SN_LDSB1_AFC0_AG1_AFEM1_AFEM1_ASEM1_CLR1_CADS0_DTLA0_DTLB0_DTVA0_DTVB0_DTVMXSA0_DTVMXSB0_DTVSM0_DPLB0_EPS0_ELFLR0_EMLLn1_FDSI0_GRPM1_GRVWA4_GRVWB4_GSU0_GSUAMB_GSUC0_GSUWGMRR0_GLS0_ISA950_IU1_K1_LDSTI0_LBSPPA0_LBSPPB128_LBSPPM0_LPA0_LPB8_LPM0_LRVWn1_LWPMn1_MIAV0_MIWT14_3_MO40_MGRIPM1_NTn1_NTA0_NTB0_NTC4_NTD4_NTM0_NEPBS0_NLCA7_NLCB1_ONLL1_PGR2_PLR1_PKA1_SGROB0_SIA3_SS1_SU0_SUM0_SUS0_SPO1_SRVW0_SSO0_SVW2_SK3_SKFTR0_SKXCCM8_SGRO0_TDMI0_TIN0_TLDS1_TLDSMn1_ULSGRO1_USL1_UIOFGRO0_UPLRP0_USFGRO0_VSn1_VWA2_VWB1_WSGRA0_WSGRB0_WS64_WG16_16_1_WGMn1_WGMXCC2_WGMXCCGn1
    SolutionIndex: 93
    SolutionNameMin: Cijk_Ailk_Bljk_S_B_Bias_HA_S_SAV_UserArgs_MT256x256x32_MI16x16x1_SN_LDSB0_AFC0_AG1_AFEM1_AFEM1_ASEM1_CLR1_CADS0_DTLA0_DTLB0_DTVA0_DTVB0_DTVMXSA0_DTVMXSB0_DTVSM0_DPLB0_EPS0_ELFLR0_EMLLn1_FDSI0_GRPM1_GRVWA4_GRVWB4_GSU0_GSUAMB_GSUC0_GSUWGMRR0_GLS0_ISA950_IU1_K1_LDSTI0_LBSPPA0_LBSPPB512_LBSPPM0_LPA0_LPB8_LPM0_LRVWn1_LWPMn1_MIAV0_MIWT8_8_MO40_MGRIPM1_NTn1_NTA0_NTB0_NTC4_NTD4_NTM0_NEPBS0_NLCA1_NLCB1_ONLL1_PGR2_PLR1_PKA1_SGROB0_SIA3_SS1_SU0_SUM0_SUS0_SPO1_SRVW0_SSO1_SVW4_SK3_SKFTR0_SKXCCM4_SGRO0_TDMI0_TIN1_TLDS1_TLDSMn1_ULSGRO0_USL1_UIOFGRO0_UPLRP0_USFGRO1_VSn1_VWA4_VWB4_WSGRA2_WSGRB2_WS64_WG32_8_1_WGM32_WGMXCC1_WGMXCCGn1
    SolutionIndex: 94
    SolutionNameMin: Cijk_Ailk_Bljk_S_B_Bias_HA_S_SAV_UserArgs_MT256x192x32_MI16x16x1_SN_LDSB1_AFC0_AG0_AFEM1_AFEM1_ASEM1_CLR1_CADS0_DTLA0_DTLB0_DTVA0_DTVB0_DTVMXSA0_DTVMXSB0_DTVSM0_DPLB0_EPS0_ELFLR0_EMLLn1_FDSI0_GRPM1_GRVWA4_GRVWB4_GSU0_GSUAMB_GSUC0_GSUWGMRR0_GLS0_ISA950_IU1_K1_LDSTI0_LBSPPA0_LBSPPB512_LBSPPM0_LPA0_LPB8_LPM0_LRVWn1_LWPMn1_MIAV0_MIWT4_12_MO40_MGRIPM1_NTn1_NTA0_NTB0_NTC4_NTD4_NTM0_NEPBS0_NLCA1_NLCB1_ONLL1_PGR2_PLR1_PKA1_SGROB0_SIA3_SS1_SU0_SUM0_SUS0_SPO0_SRVW0_SSO1_SVW4_SK3_SKFTR0_SKXCCM0_SGRO0_TDMI0_TIN1_TLDS1_TLDSMn1_ULSGRO0_USL1_UIOFGRO0_UPLRP0_USFGRO0_VSn1_VWA4_VWB4_WSGRA2_WSGRB0_WS64_WG64_4_1_WGM16_WGMXCC2_WGMXCCGn1
    SolutionIndex: 95
    SolutionNameMin: Cijk_Ailk_Bljk_S_B_Bias_HA_S_SAV_UserArgs_MT192x208x32_MI16x16x1_SN_LDSB0_AFC0_AG1_AFEM1_AFEM1_ASEM1_CLR1_CADS0_DTLA0_DTLB0_DTVA0_DTVB0_DTVMXSA0_DTVMXSB0_DTVSM0_DPLB0_EPS0_ELFLR0_EMLL0_FDSI0_GRPM1_GRVWA1_GRVWB2_GSU0_GSUAMB_GSUC0_GSUWGMRR0_GLS0_ISA950_IU1_K1_LDSTI0_LBSPPA3072_LBSPPB128_LBSPPM0_LPA16_LPB8_LPM0_LRVWn1_LWPMn1_MIAV0_MIWT3_13_MO40_MGRIPM1_NTn1_NTA0_NTB0_NTC0_NTD0_NTM0_NEPBS0_NLCA3_NLCB1_ONLL1_PGR2_PLR1_PKA1_SGROB0_SIA3_SS1_SU0_SUM0_SUS0_SPO1_SRVW0_SSO0_SVW1_SK3_SKFTR0_SKXCCM0_SGRO0_TDMI0_TIN1_TLDS1_TLDSMn1_ULSGRO0_USL1_UIOFGRO0_UPLRP0_USFGRO0_VSn1_VWA1_VWB1_WSGRA0_WSGRB2_WS64_WG64_4_1_WGM8_WGMXCC8_WGMXCCGn1
    SolutionIndex: 96
    SolutionNameMin: Cijk_Ailk_Bljk_S_B_Bias_HA_S_SAV_UserArgs_MT352x128x32_MI16x16x1_SN_LDSB1_AFC0_AG0_AFEM1_AFEM1_ASEM1_CLR1_CADS0_DTLA0_DTLB0_DTVA0_DTVB0_DTVMXSA0_DTVMXSB0_DTVSM0_DPLB0_EPS0_ELFLR0_EMLLn1_FDSI0_GRPM1_GRVWA4_GRVWB4_GSU0_GSUAMB_GSUC0_GSUWGMRR0_GLS0_ISA950_IU1_K1_LDSTI0_LBSPPA5632_LBSPPB512_LBSPPM0_LPA16_LPB8_LPM0_LRVWn1_LWPMn1_MIAV0_MIWT11_4_MO40_MGRIPM1_NTn1_NTA0_NTB0_NTC0_NTD0_NTM0_NEPBS0_NLCA11_NLCB1_ONLL1_PGR2_PLR1_PKA1_SGROB0_SIA3_SS1_SU8_SUM0_SUS512_SPO1_SRVW0_SSO0_SVW1_SK3_SKFTR0_SKXCCM0_SGRO0_TDMI0_TIN0_TLDS1_TLDSMn1_ULSGRO0_USL1_UIOFGRO0_UPLRP0_USFGRO0_VSn1_VWA1_VWB4_WSGRA0_WSGRB0_WS64_WG32_8_1_WGMn16_WGMXCC16_WGMXCCGn1
    SolutionIndex: 97
    SolutionNameMin: Cijk_Ailk_Bljk_S_B_Bias_HA_S_SAV_UserArgs_MT256x192x32_MI32x32x1_SN_LDSB1_AFC0_AG1_AFEM1_AFEM1_ASEM1_CLR1_CADS0_DTLA0_DTLB0_DTVA0_DTVB0_DTVMXSA0_DTVMXSB0_DTVSM0_DPLB0_EPS0_ELFLR0_EMLLn1_FDSI0_GRPM1_GRVWA4_GRVWB4_GSU0_GSUAMB_GSUC0_GSUWGMRR0_GLS0_ISA950_IU1_K1_LDSTI0_LBSPPA0_LBSPPB128_LBSPPM0_LPA0_LPB4_LPM0_LRVWn1_LWPMn1_MIAV0_MIWT4_3_MO40_MGRIPM1_NTn1_NTA0_NTB0_NTC4_NTD4_NTM0_NEPBS12_NLCA1_NLCB1_ONLL1_PGR2_PLR1_PKA1_SGROB0_SIA3_SS1_SU0_SUM0_SUS0_SPO0_SRVW0_SSO1_SVW4_SK3_SKFTR0_SKXCCM8_SGRO0_TDMI0_TIN1_TLDS1_TLDSMn1_ULSGRO1_USL1_UIOFGRO0_UPLRP0_USFGRO0_VSn1_VWA4_VWB1_WSGRA0_WSGRB0_WS64_WG64_4_1_WGM2_WGMXCC32_WGMXCCGn1
    SolutionIndex: 98
    SolutionNameMin: Cijk_Ailk_Bljk_S_B_Bias_HA_S_SAV_UserArgs_MT384x128x32_MI16x16x1_SN_LDSB1_AFC0_AG1_AFEM1_AFEM1_ASEM1_CLR1_CADS0_DTLA0_DTLB0_DTVA0_DTVB0_DTVMXSA0_DTVMXSB0_DTVSM0_DPLB0_EPS0_ELFLR0_EMLLn1_FDSI0_GRPM1_GRVWA4_GRVWB4_GSU0_GSUAMB_GSUC0_GSUWGMRR0_GLS0_ISA950_IU1_K1_LDSTI0_LBSPPA0_LBSPPB512_LBSPPM0_LPA0_LPB8_LPM0_LRVWn1_LWPMn1_MIAV0_MIWT12_4_MO40_MGRIPM1_NTn1_NTA0_NTB0_NTC4_NTD4_NTM0_NEPBS12_NLCA3_NLCB1_ONLL1_PGR2_PLR1_PKA1_SGROB0_SIA3_SS1_SU0_SUM0_SUS0_SPO0_SRVW0_SSO1_SVW4_SK3_SKFTR0_SKXCCM0_SGRO0_TDMI0_TIN1_TLDS1_TLDSMn1_ULSGRO1_USL1_UIOFGRO0_UPLRP0_USFGRO0_VSn1_VWA4_VWB4_WSGRA2_WSGRB0_WS64_WG32_8_1_WGMn1_WGMXCC8_WGMXCCGn1
    SolutionIndex: 99
    SolutionNameMin: Cijk_Ailk_Bljk_S_B_Bias_HA_S_SAV_UserArgs_MT128x416x32_MI16x16x1_SN_LDSB1_AFC0_AG1_AFEM1_AFEM1_ASEM1_CLR1_CADS0_DTLA0_DTLB0_DTVA0_DTVB0_DTVMXSA0_DTVMXSB0_DTVSM0_DPLB0_EPS0_ELFLR0_EMLL0_FDSI0_GRPM1_GRVWA4_GRVWB4_GSU0_GSUAMB_GSUC0_GSUWGMRR0_GLS0_ISA950_IU1_K1_LDSTI0_LBSPPA0_LBSPPB128_LBSPPM0_LPA0_LPB8_LPM0_LRVWn1_LWPMn1_MIAV0_MIWT4_13_MO40_MGRIPM1_NTn1_NTA0_NTB0_NTC4_NTD0_NTM0_NEPBS0_NLCA1_NLCB1_ONLL1_PGR2_PLR1_PKA1_SGROB0_SIA3_SS1_SU16_SUM0_SUS128_SPO0_SRVW0_SSO1_SVW4_SK3_SKFTR0_SKXCCM0_SGRO0_TDMI0_TIN0_TLDS1_TLDSMn1_ULSGRO1_USL1_UIOFGRO0_UPLRP0_USFGRO0_VSn1_VWA4_VWB1_WSGRA0_WSGRB0_WS64_WG32_8_1_WGM4_WGMXCC2_WGMXCCGn1
    SolutionIndex: 100
    SolutionNameMin: Cijk_Ailk_Bljk_S_B_Bias_HA_S_SAV_UserArgs_MT384x128x32_MI16x16x1_SN_LDSB1_AFC0_AG0_AFEM1_AFEM1_ASEM1_CLR1_CADS0_DTLA0_DTLB0_DTVA0_DTVB0_DTVMXSA0_DTVMXSB0_DTVSM0_DPLB0_EPS0_ELFLR0_EMLLn1_FDSI0_GRPM1_GRVWA4_GRVWB4_GSU0_GSUAMB_GSUC0_GSUWGMRR0_GLS0_ISA950_IU1_K1_LDSTI0_LBSPPA0_LBSPPB512_LBSPPM0_LPA0_LPB8_LPM0_LRVWn1_LWPMn1_MIAV0_MIWT12_4_MO40_MGRIPM1_NTn1_NTA0_NTB0_NTC0_NTD0_NTM0_NEPBS12_NLCA3_NLCB1_ONLL1_PGR2_PLR1_PKA1_SGROB0_SIA3_SS1_SU0_SUM0_SUS0_SPO0_SRVW0_SSO1_SVW4_SK3_SKFTR0_SKXCCM4_SGRO0_TDMI0_TIN1_TLDS1_TLDSMn1_ULSGRO0_USL1_UIOFGRO0_UPLRP0_USFGRO1_VSn1_VWA4_VWB4_WSGRA0_WSGRB0_WS64_WG32_8_1_WGM48_WGMXCC2_WGMXCCGn1
    SolutionIndex: 101
    SolutionNameMin: Cijk_Ailk_Bljk_S_B_Bias_HA_S_SAV_UserArgs_MT128x288x32_MI16x16x1_SN_LDSB1_AFC0_AG1_AFEM1_AFEM1_ASEM1_CLR0_CADS0_DTLA0_DTLB0_DTVA0_DTVB0_DTVMXSA0_DTVMXSB0_DTVSM0_DPLB0_EPS0_ELFLR0_EMLL0_FDSI0_GRPM1_GRVWA4_GRVWB4_GSU0_GSUAMB_GSUC0_GSUWGMRR0_GLS0_ISA950_IU1_K1_LDSTI1_LBSPPA0_LBSPPB1152_LBSPPM0_LPA0_LPB16_LPM0_LRVWn1_LWPMn1_MIAV0_MIWT4_9_MO40_MGRIPM1_NTn1_NTA0_NTB0_NTC0_NTD0_NTM0_NEPBS16_NLCA1_NLCB1_ONLL1_PGR2_PLR1_PKA1_SGROB0_SIA3_SS1_SU0_SUM0_SUS0_SPO0_SRVW0_SSO1_SVW4_SK3_SKFTR0_SKXCCM0_SGRO0_TDMI0_TIN1_TLDS0_TLDSMn1_ULSGRO1_USL1_UIOFGRO0_UPLRP0_USFGRO1_VSn1_VWA4_VWB1_WSGRA0_WSGRB0_WS64_WG32_8_1_WGM2_WGMXCC8_WGMXCCGn1
    SolutionIndex: 102
    SolutionNameMin: Cijk_Ailk_Bljk_S_B_Bias_HA_S_SAV_UserArgs_MT256x160x32_MI16x16x1_SN_LDSB1_AFC0_AG1_AFEM1_AFEM1_ASEM1_CLR0_CADS0_DTLA0_DTLB0_DTVA0_DTVB0_DTVMXSA0_DTVMXSB0_DTVSM0_DPLB0_EPS0_ELFLR0_EMLL0_FDSI0_GRPM1_GRVWA4_GRVWB4_GSU0_GSUAMB_GSUC0_GSUWGMRR0_GLS0_ISA950_IU1_K1_LDSTI1_LBSPPA0_LBSPPB640_LBSPPM0_LPA0_LPB16_LPM0_LRVWn1_LWPMn1_MIAV0_MIWT8_5_MO40_MGRIPM1_NTn1_NTA0_NTB0_NTC4_NTD4_NTM0_NEPBS0_NLCA1_NLCB1_ONLL1_PGR2_PLR1_PKA1_SGROB0_SIA3_SS1_SU0_SUM0_SUS0_SPO0_SRVW0_SSO1_SVW4_SK3_SKFTR0_SKXCCM0_SGRO0_TDMI0_TIN0_TLDS0_TLDSMn1_ULSGRO0_USL1_UIOFGRO0_UPLRP0_USFGRO0_VSn1_VWA4_VWB1_WSGRA0_WSGRB0_WS64_WG32_8_1_WGMn1_WGMXCC16_WGMXCCGn1
    SolutionIndex: 103
    SolutionNameMin: Cijk_Ailk_Bljk_S_B_Bias_HA_S_SAV_UserArgs_MT448x128x32_MI16x16x1_SN_LDSB1_AFC0_AG1_AFEM1_AFEM1_ASEM1_CLR1_CADS0_DTLA0_DTLB0_DTVA0_DTVB0_DTVMXSA0_DTVMXSB0_DTVSM0_DPLB0_EPS0_ELFLR0_EMLLn1_FDSI0_GRPM1_GRVWA4_GRVWB4_GSU0_GSUAMB_GSUC0_GSUWGMRR0_GLS0_ISA950_IU1_K1_LDSTI0_LBSPPA0_LBSPPB512_LBSPPM0_LPA0_LPB8_LPM0_LRVWn1_LWPMn1_MIAV0_MIWT14_4_MO40_MGRIPM1_NTn1_NTA0_NTB0_NTC4_NTD4_NTM0_NEPBS16_NLCA7_NLCB1_ONLL1_PGR2_PLR1_PKA1_SGROB0_SIA3_SS1_SU0_SUM0_SUS0_SPO1_SRVW0_SSO1_SVW2_SK3_SKFTR0_SKXCCM0_SGRO0_TDMI0_TIN1_TLDS1_TLDSMn1_ULSGRO0_USL1_UIOFGRO0_UPLRP0_USFGRO0_VSn1_VWA2_VWB4_WSGRA0_WSGRB0_WS64_WG32_8_1_WGMn16_WGMXCC32_WGMXCCGn1
    SolutionIndex: 104
    SolutionNameMin: Cijk_Ailk_Bljk_S_B_Bias_HA_S_SAV_UserArgs_MT256x128x32_MI16x16x1_SN_LDSB1_AFC0_AG1_AFEM1_AFEM1_ASEM1_CLR0_CADS0_DTLA0_DTLB0_DTVA0_DTVB0_DTVMXSA0_DTVMXSB0_DTVSM0_DPLB0_EPS0_ELFLR0_EMLL0_FDSI0_GRPM1_GRVWA2_GRVWB4_GSU0_GSUAMB_GSUC0_GSUWGMRR0_GLS0_ISA950_IU1_K1_LDSTI1_LBSPPA0_LBSPPB0_LBSPPM0_LPA0_LPB0_LPM0_LRVWn1_LWPMn1_MIAV0_MIWT4_8_MO40_MGRIPM1_NTn1_NTA0_NTB0_NTC0_NTD0_NTM0_NEPBS0_NLCA1_NLCB1_ONLL1_PGR2_PLR1_PKA1_SGROB0_SIA3_SS1_SU0_SUM0_SUS0_SPO0_SRVW0_SSO1_SVW4_SK3_SKFTR0_SKXCCM0_SGRO0_TDMI0_TIN1_TLDS0_TLDSMn1_ULSGRO0_USL1_UIOFGRO0_UPLRP0_USFGRO0_VSn1_VWA4_VWB4_WSGRA0_WSGRB0_WS64_WG64_4_1_WGM2_WGMXCC8_WGMXCCGn1
    SolutionIndex: 105
    SolutionNameMin: Cijk_Ailk_Bljk_S_B_Bias_HA_S_SAV_UserArgs_MT256x256x32_MI16x16x1_SN_LDSB1_AFC0_AG0_AFEM1_AFEM1_ASEM1_CLR1_CADS0_DTLA0_DTLB0_DTVA0_DTVB0_DTVMXSA0_DTVMXSB0_DTVSM0_DPLB0_EPS0_ELFLR0_EMLLn1_FDSI0_GRPM1_GRVWA4_GRVWB4_GSU0_GSUAMB_GSUC0_GSUWGMRR0_GLS0_ISA950_IU1_K1_LDSTI0_LBSPPA0_LBSPPB512_LBSPPM0_LPA0_LPB8_LPM0_LRVWn1_LWPMn1_MIAV0_MIWT8_8_MO40_MGRIPM1_NTn1_NTA0_NTB0_NTC4_NTD4_NTM0_NEPBS14_NLCA1_NLCB1_ONLL1_PGR2_PLR1_PKA1_SGROB0_SIA3_SS1_SU8_SUM0_SUS128_SPO1_SRVW0_SSO1_SVW4_SK3_SKFTR0_SKXCCM0_SGRO0_TDMI0_TIN0_TLDS1_TLDSMn1_ULSGRO1_USL1_UIOFGRO0_UPLRP0_USFGRO0_VSn1_VWA4_VWB4_WSGRA0_WSGRB0_WS64_WG32_8_1_WGM8_WGMXCC8_WGMXCCGn1
    SolutionIndex: 106
    SolutionNameMin: Cijk_Ailk_Bljk_S_B_Bias_HA_S_SAV_UserArgs_MT192x192x32_MI16x16x1_SN_LDSB1_AFC0_AG1_AFEM1_AFEM1_ASEM1_CLR0_CADS0_DTLA0_DTLB0_DTVA0_DTVB0_DTVMXSA0_DTVMXSB0_DTVSM0_DPLB0_EPS0_ELFLR0_EMLLn1_FDSI0_GRPM1_GRVWA4_GRVWB4_GSU0_GSUAMB_GSUC0_GSUWGMRR0_GLS0_ISA950_IU1_K1_LDSTI1_LBSPPA0_LBSPPB768_LBSPPM0_LPA0_LPB16_LPM0_LRVWn1_LWPMn1_MIAV0_MIWT12_3_MO40_MGRIPM1_NTn1_NTA0_NTB0_NTC0_NTD0_NTM0_NEPBS8_NLCA3_NLCB1_ONLL1_PGR2_PLR1_PKA1_SGROB0_SIA3_SS1_SU0_SUM0_SUS0_SPO0_SRVW0_SSO0_SVW4_SK3_SKFTR0_SKXCCM0_SGRO0_TDMI0_TIN1_TLDS0_TLDSMn1_ULSGRO0_USL1_UIOFGRO0_UPLRP0_USFGRO1_VSn1_VWA4_VWB1_WSGRA2_WSGRB0_WS64_WG16_16_1_WGM32_WGMXCC1_WGMXCCGn1
    SolutionIndex: 107
    SolutionNameMin: Cijk_Ailk_Bljk_S_B_Bias_HA_S_SAV_UserArgs_MT416x128x32_MI16x16x1_SN_LDSB1_AFC0_AG1_AFEM1_AFEM1_ASEM1_CLR1_CADS0_DTLA0_DTLB0_DTVA0_DTVB0_DTVMXSA0_DTVMXSB0_DTVSM0_DPLB0_EPS0_ELFLR0_EMLL0_FDSI0_GRPM1_GRVWA4_GRVWB4_GSU0_GSUAMB_GSUC0_GSUWGMRR0_GLS0_ISA950_IU1_K1_LDSTI0_LBSPPA6656_LBSPPB512_LBSPPM0_LPA16_LPB8_LPM0_LRVWn1_LWPMn1_MIAV0_MIWT13_4_MO40_MGRIPM1_NTn1_NTA0_NTB0_NTC0_NTD0_NTM0_NEPBS10_NLCA13_NLCB1_ONLL1_PGR2_PLR1_PKA1_SGROB0_SIA3_SS0_SU16_SUM0_SUS128_SPO1_SRVW0_SSO4_SVW4_SK3_SKFTR0_SKXCCM4_SGRO0_TDMI0_TIN0_TLDS1_TLDSMn1_ULSGRO0_USL1_UIOFGRO0_UPLRP0_USFGRO1_VSn1_VWA1_VWB4_WSGRA2_WSGRB0_WS64_WG32_8_1_WGM32_WGMXCC4_WGMXCCGn1
    SolutionIndex: 108
    SolutionNameMin: Cijk_Ailk_Bljk_S_B_Bias_HA_S_SAV_UserArgs_MT160x192x32_MI16x16x1_SN_LDSB1_AFC0_AG0_AFEM1_AFEM1_ASEM1_CLR0_CADS0_DTLA0_DTLB0_DTVA0_DTVB0_DTVMXSA0_DTVMXSB0_DTVSM0_DPLB0_EPS0_ELFLR0_EMLL0_FDSI0_GRPM1_GRVWA4_GRVWB4_GSU0_GSUAMB_GSUC0_GSUWGMRR0_GLS0_ISA950_IU1_K1_LDSTI1_LBSPPA0_LBSPPB768_LBSPPM0_LPA0_LPB16_LPM0_LRVWn1_LWPMn1_MIAV0_MIWT10_3_MO40_MGRIPM1_NTn1_NTA0_NTB0_NTC4_NTD4_NTM0_NEPBS0_NLCA5_NLCB1_ONLL1_PGR2_PLR1_PKA1_SGROB0_SIA3_SS1_SU0_SUM0_SUS0_SPO0_SRVW0_SSO0_SVW2_SK3_SKFTR0_SKXCCM0_SGRO0_TDMI0_TIN1_TLDS0_TLDSMn1_ULSGRO0_USL1_UIOFGRO0_UPLRP0_USFGRO1_VSn1_VWA2_VWB1_WSGRA2_WSGRB2_WS64_WG16_16_1_WGM8_WGMXCC2_WGMXCCGn1
    SolutionIndex: 109
    SolutionNameMin: Cijk_Ailk_Bljk_S_B_Bias_HA_S_SAV_UserArgs_MT192x192x32_MI16x16x1_SN_LDSB1_AFC0_AG1_AFEM1_AFEM1_ASEM1_CLR0_CADS0_DTLA0_DTLB0_DTVA0_DTVB0_DTVMXSA0_DTVMXSB0_DTVSM0_DPLB0_EPS0_ELFLR0_EMLLn1_FDSI0_GRPM1_GRVWA4_GRVWB4_GSU0_GSUAMB_GSUC0_GSUWGMRR0_GLS0_ISA950_IU1_K1_LDSTI1_LBSPPA0_LBSPPB768_LBSPPM0_LPA0_LPB16_LPM0_LRVWn1_LWPMn1_MIAV0_MIWT12_3_MO40_MGRIPM1_NTn1_NTA0_NTB0_NTC4_NTD4_NTM0_NEPBS8_NLCA3_NLCB1_ONLL1_PGR2_PLR1_PKA1_SGROB0_SIA3_SS1_SU0_SUM0_SUS0_SPO0_SRVW0_SSO1_SVW4_SK3_SKFTR0_SKXCCM0_SGRO0_TDMI0_TIN1_TLDS0_TLDSMn1_ULSGRO0_USL1_UIOFGRO0_UPLRP0_USFGRO0_VSn1_VWA4_VWB1_WSGRA2_WSGRB2_WS64_WG16_16_1_WGMn2_WGMXCC1_WGMXCCGn1
    SolutionIndex: 110
    SolutionNameMin: Cijk_Ailk_Bljk_S_B_Bias_HA_S_SAV_UserArgs_MT160x224x32_MI16x16x1_SN_LDSB0_AFC0_AG0_AFEM1_AFEM1_ASEM1_CLR1_CADS0_DTLA0_DTLB0_DTVA0_DTVB0_DTVMXSA0_DTVMXSB0_DTVSM0_DPLB0_EPS0_ELFLR0_EMLL0_FDSI0_GRPM1_GRVWA1_GRVWB4_GSU0_GSUAMB_GSUC0_GSUWGMRR0_GLS0_ISA950_IU1_K1_LDSTI0_LBSPPA2560_LBSPPB128_LBSPPM0_LPA16_LPB8_LPM0_LRVWn1_LWPMn1_MIAV0_MIWT5_7_MO40_MGRIPM1_NTn1_NTA0_NTB0_NTC0_NTD0_NTM0_NEPBS0_NLCA5_NLCB1_ONLL1_PGR2_PLR1_PKA1_SGROB0_SIA3_SS1_SU8_SUM0_SUS128_SPO1_SRVW0_SSO0_SVW1_SK3_SKFTR0_SKXCCM0_SGRO0_TDMI0_TIN0_TLDS1_TLDSMn1_ULSGRO0_USL1_UIOFGRO0_UPLRP0_USFGRO0_VSn1_VWA1_VWB1_WSGRA2_WSGRB2_WS64_WG32_8_1_WGM32_WGMXCC1_WGMXCCGn1
    SolutionIndex: 111
    SolutionNameMin: Cijk_Ailk_Bljk_S_B_Bias_HA_S_SAV_UserArgs_MT384x160x32_MI16x16x1_SN_LDSB1_AFC0_AG1_AFEM1_AFEM1_ASEM1_CLR1_CADS0_DTLA0_DTLB0_DTVA0_DTVB0_DTVMXSA0_DTVMXSB0_DTVSM0_DPLB0_EPS0_ELFLR0_EMLL0_FDSI0_GRPM1_GRVWA2_GRVWB4_GSU0_GSUAMB_GSUC0_GSUWGMRR0_GLS0_ISA950_IU1_K1_LDSTI0_LBSPPA0_LBSPPB128_LBSPPM0_LPA0_LPB8_LPM0_LRVWn1_LWPMn1_MIAV0_MIWT12_5_MO40_MGRIPM1_NTn1_NTA0_NTB0_NTC4_NTD4_NTM0_NEPBS0_NLCA3_NLCB1_ONLL1_PGR2_PLR1_PKA1_SGROB0_SIA3_SS1_SU0_SUM0_SUS0_SPO1_SRVW0_SSO1_SVW4_SK3_SKFTR0_SKXCCM0_SGRO0_TDMI0_TIN1_TLDS1_TLDSMn1_ULSGRO0_USL1_UIOFGRO0_UPLRP0_USFGRO1_VSn1_VWA4_VWB1_WSGRA0_WSGRB2_WS64_WG32_8_1_WGMn1_WGMXCC32_WGMXCCGn1
    SolutionIndex: 112
    SolutionNameMin: Cijk_Ailk_Bljk_S_B_Bias_HA_S_SAV_UserArgs_MT256x224x32_MI16x16x1_SN_LDSB1_AFC0_AG1_AFEM1_AFEM1_ASEM1_CLR1_CADS0_DTLA0_DTLB0_DTVA0_DTVB0_DTVMXSA0_DTVMXSB0_DTVSM0_DPLB0_EPS0_ELFLR0_EMLL0_FDSI0_GRPM1_GRVWA4_GRVWB4_GSU0_GSUAMB_GSUC0_GSUWGMRR0_GLS0_ISA950_IU1_K1_LDSTI0_LBSPPA0_LBSPPB256_LBSPPM0_LPA0_LPB8_LPM0_LRVWn1_LWPMn1_MIAV0_MIWT4_14_MO40_MGRIPM1_NTn1_NTA0_NTB0_NTC0_NTD0_NTM0_NEPBS12_NLCA1_NLCB1_ONLL1_PGR2_PLR1_PKA1_SGROB0_SIA3_SS1_SU0_SUM0_SUS0_SPO1_SRVW0_SSO1_SVW4_SK3_SKFTR0_SKXCCM0_SGRO0_TDMI0_TIN1_TLDS1_TLDSMn1_ULSGRO1_USL1_UIOFGRO0_UPLRP0_USFGRO0_VSn1_VWA4_VWB2_WSGRA0_WSGRB0_WS64_WG64_4_1_WGM2_WGMXCC4_WGMXCCGn1
    SolutionIndex: 113
    SolutionNameMin: Cijk_Ailk_Bljk_S_B_Bias_HA_S_SAV_UserArgs_MT128x256x32_MI16x16x1_SN_LDSB1_AFC0_AG1_AFEM1_AFEM1_ASEM1_CLR0_CADS0_DTLA0_DTLB0_DTVA0_DTVB0_DTVMXSA0_DTVMXSB0_DTVSM0_DPLB0_EPS0_ELFLR0_EMLL0_FDSI0_GRPM1_GRVWA4_GRVWB4_GSU0_GSUAMB_GSUC0_GSUWGMRR0_GLS0_ISA950_IU1_K1_LDSTI1_LBSPPA0_LBSPPB0_LBSPPM0_LPA0_LPB0_LPM0_LRVWn1_LWPMn1_MIAV0_MIWT8_4_MO40_MGRIPM1_NTn1_NTA0_NTB0_NTC0_NTD0_NTM0_NEPBS8_NLCA1_NLCB1_ONLL1_PGR2_PLR1_PKA1_SGROB0_SIA3_SS1_SU0_SUM0_SUS0_SPO0_SRVW0_SSO1_SVW4_SK3_SKFTR0_SKXCCM4_SGRO0_TDMI0_TIN1_TLDS0_TLDSMn1_ULSGRO0_USL1_UIOFGRO0_UPLRP0_USFGRO1_VSn1_VWA4_VWB4_WSGRA2_WSGRB0_WS64_WG16_16_1_WGM4_WGMXCC1_WGMXCCGn1
    SolutionIndex: 114
    SolutionNameMin: Cijk_Ailk_Bljk_S_B_Bias_HA_S_SAV_UserArgs_MT384x96x32_MI16x16x1_SN_LDSB1_AFC0_AG1_AFEM1_AFEM1_ASEM1_CLR1_CADS0_DTLA0_DTLB0_DTVA0_DTVB0_DTVMXSA0_DTVMXSB0_DTVSM0_DPLB0_EPS0_ELFLR0_EMLL0_FDSI0_GRPM1_GRVWA4_GRVWB4_GSU0_GSUAMB_GSUC0_GSUWGMRR0_GLS0_ISA950_IU1_K1_LDSTI0_LBSPPA0_LBSPPB128_LBSPPM0_LPA0_LPB8_LPM0_LRVWn1_LWPMn1_MIAV0_MIWT12_3_MO40_MGRIPM1_NTn1_NTA0_NTB0_NTC0_NTD0_NTM0_NEPBS12_NLCA3_NLCB1_ONLL1_PGR2_PLR1_PKA1_SGROB0_SIA3_SS1_SU0_SUM0_SUS0_SPO0_SRVW0_SSO0_SVW4_SK3_SKFTR0_SKXCCM8_SGRO0_TDMI0_TIN1_TLDS1_TLDSMn1_ULSGRO1_USL1_UIOFGRO0_UPLRP0_USFGRO0_VSn1_VWA4_VWB1_WSGRA2_WSGRB2_WS64_WG32_8_1_WGM2_WGMXCC1_WGMXCCGn1
    SolutionIndex: 115
    SolutionNameMin: Cijk_Ailk_Bljk_S_B_Bias_HA_S_SAV_UserArgs_MT384x128x32_MI16x16x1_SN_LDSB1_AFC0_AG1_AFEM1_AFEM1_ASEM1_CLR1_CADS0_DTLA0_DTLB0_DTVA0_DTVB0_DTVMXSA0_DTVMXSB0_DTVSM0_DPLB0_EPS0_ELFLR0_EMLLn1_FDSI0_GRPM1_GRVWA4_GRVWB4_GSU0_GSUAMB_GSUC0_GSUWGMRR0_GLS0_ISA950_IU1_K1_LDSTI0_LBSPPA0_LBSPPB512_LBSPPM0_LPA0_LPB8_LPM0_LRVWn1_LWPMn1_MIAV0_MIWT12_4_MO40_MGRIPM1_NTn1_NTA4_NTB0_NTC4_NTD4_NTM0_NEPBS12_NLCA3_NLCB1_ONLL1_PGR2_PLR1_PKA1_SGROB0_SIA3_SS1_SU8_SUM0_SUS512_SPO1_SRVW0_SSO4_SVW4_SK3_SKFTR0_SKXCCM0_SGRO0_TDMI0_TIN0_TLDS1_TLDSMn1_ULSGRO0_USL1_UIOFGRO0_UPLRP0_USFGRO0_VSn1_VWA4_VWB4_WSGRA0_WSGRB2_WS64_WG32_8_1_WGM0_WGMXCC1_WGMXCCGn1
    SolutionIndex: 116
    SolutionNameMin: Cijk_Ailk_Bljk_S_B_Bias_HA_S_SAV_UserArgs_MT128x416x32_MI16x16x1_SN_LDSB1_AFC0_AG1_AFEM1_AFEM1_ASEM1_CLR1_CADS0_DTLA0_DTLB0_DTVA0_DTVB0_DTVMXSA0_DTVMXSB0_DTVSM0_DPLB0_EPS1_ELFLR0_EMLLn1_FDSI0_GRPM1_GRVWA1_GRVWB4_GSU0_GSUAMB_GSUC0_GSUWGMRR0_GLS0_ISA950_IU1_K1_LDSTI0_LBSPPA0_LBSPPB128_LBSPPM0_LPA0_LPB8_LPM0_LRVWn1_LWPMn1_MIAV0_MIWT4_13_MO40_MGRIPM1_NTn1_NTA0_NTB0_NTC4_NTD4_NTM0_NEPBS0_NLCA1_NLCB1_ONLL1_PGR1_PLR1_PKA1_SGROB0_SIA3_SS1_SU0_SUM0_SUS0_SPO1_SRVW0_SSO1_SVW4_SK3_SKFTR0_SKXCCM4_SGRO0_TDMI0_TIN1_TLDS1_TLDSMn1_ULSGRO0_USL1_UIOFGRO0_UPLRP0_USFGRO0_VSn1_VWA4_VWB1_WSGRA0_WSGRB2_WS64_WG32_8_1_WGM2_WGMXCC1_WGMXCCGn1
    SolutionIndex: 117
    SolutionNameMin: Cijk_Ailk_Bljk_S_B_Bias_HA_S_SAV_UserArgs_MT160x192x32_MI16x16x1_SN_LDSB1_AFC0_AG1_AFEM1_AFEM1_ASEM1_CLR0_CADS0_DTLA0_DTLB0_DTVA0_DTVB0_DTVMXSA0_DTVMXSB0_DTVSM0_DPLB0_EPS0_ELFLR0_EMLL0_FDSI0_GRPM1_GRVWA4_GRVWB4_GSU0_GSUAMB_GSUC0_GSUWGMRR0_GLS0_ISA950_IU1_K1_LDSTI1_LBSPPA0_LBSPPB768_LBSPPM0_LPA0_LPB16_LPM0_LRVWn1_LWPMn1_MIAV0_MIWT10_3_MO40_MGRIPM1_NTn1_NTA0_NTB0_NTC4_NTD4_NTM0_NEPBS0_NLCA5_NLCB1_ONLL1_PGR2_PLR1_PKA1_SGROB0_SIA3_SS1_SU0_SUM0_SUS0_SPO0_SRVW0_SSO1_SVW2_SK3_SKFTR0_SKXCCM0_SGRO0_TDMI0_TIN1_TLDS0_TLDSMn1_ULSGRO1_USL1_UIOFGRO0_UPLRP0_USFGRO0_VSn1_VWA2_VWB1_WSGRA2_WSGRB0_WS64_WG16_16_1_WGM2_WGMXCC8_WGMXCCGn1
    SolutionIndex: 118
    SolutionNameMin: Cijk_Ailk_Bljk_S_B_Bias_HA_S_SAV_UserArgs_MT128x256x32_MI16x16x1_SN_LDSB1_AFC0_AG1_AFEM1_AFEM1_ASEM1_CLR0_CADS0_DTLA0_DTLB0_DTVA0_DTVB0_DTVMXSA0_DTVMXSB0_DTVSM0_DPLB0_EPS0_ELFLR0_EMLLn1_FDSI0_GRPM1_GRVWA4_GRVWB4_GSU0_GSUAMB_GSUC0_GSUWGMRR0_GLS0_ISA950_IU1_K1_LDSTI1_LBSPPA0_LBSPPB0_LBSPPM0_LPA0_LPB0_LPM0_LRVWn1_LWPMn1_MIAV0_MIWT4_8_MO40_MGRIPM1_NTn1_NTA0_NTB0_NTC0_NTD0_NTM0_NEPBS0_NLCA1_NLCB1_ONLL1_PGR2_PLR1_PKA1_SGROB0_SIA3_SS1_SU0_SUM0_SUS0_SPO0_SRVW0_SSO1_SVW4_SK3_SKFTR0_SKXCCM0_SGRO0_TDMI0_TIN1_TLDS0_TLDSMn1_ULSGRO0_USL1_UIOFGRO0_UPLRP0_USFGRO0_VSn1_VWA4_VWB4_WSGRA0_WSGRB0_WS64_WG32_8_1_WGM6_WGMXCC4_WGMXCCGn1
    SolutionIndex: 119
    SolutionNameMin: Cijk_Ailk_Bljk_S_B_Bias_HA_S_SAV_UserArgs_MT320x128x32_MI32x32x1_SN_LDSB1_AFC0_AG0_AFEM1_AFEM1_ASEM1_CLR0_CADS0_DTLA0_DTLB0_DTVA0_DTVB0_DTVMXSA0_DTVMXSB0_DTVSM0_DPLB0_EPS0_ELFLR0_EMLL0_FDSI0_GRPM1_GRVWA4_GRVWB4_GSU0_GSUAMB_GSUC0_GSUWGMRR0_GLS0_ISA950_IU1_K1_LDSTI1_LBSPPA0_LBSPPB0_LBSPPM0_LPA0_LPB0_LPM0_LRVWn1_LWPMn1_MIAV0_MIWT5_2_MO40_MGRIPM1_NTn1_NTA0_NTB0_NTC0_NTD0_NTM0_NEPBS0_NLCA5_NLCB1_ONLL1_PGR2_PLR1_PKA1_SGROB0_SIA3_SS1_SU0_SUM0_SUS0_SPO0_SRVW0_SSO1_SVW1_SK3_SKFTR0_SKXCCM0_SGRO0_TDMI0_TIN1_TLDS0_TLDSMn1_ULSGRO1_USL1_UIOFGRO0_UPLRP0_USFGRO0_VSn1_VWA1_VWB2_WSGRA0_WSGRB0_WS64_WG64_4_1_WGM16_WGMXCC8_WGMXCCGn1
    SolutionIndex: 120
    SolutionNameMin: Cijk_Ailk_Bljk_S_B_Bias_HA_S_SAV_UserArgs_MT128x256x32_MI16x16x1_SN_LDSB1_AFC0_AG1_AFEM1_AFEM1_ASEM1_CLR0_CADS0_DTLA0_DTLB0_DTVA0_DTVB0_DTVMXSA0_DTVMXSB0_DTVSM0_DPLB0_EPS0_ELFLR0_EMLLn1_FDSI0_GRPM1_GRVWA2_GRVWB4_GSU0_GSUAMB_GSUC0_GSUWGMRR0_GLS0_ISA950_IU1_K1_LDSTI1_LBSPPA0_LBSPPB0_LBSPPM0_LPA0_LPB0_LPM0_LRVWn1_LWPMn1_MIAV0_MIWT4_8_MO40_MGRIPM1_NTn1_NTA0_NTB0_NTC4_NTD4_NTM0_NEPBS14_NLCA1_NLCB1_ONLL1_PGR2_PLR1_PKA1_SGROB0_SIA3_SS1_SU16_SUM0_SUS128_SPO0_SRVW0_SSO1_SVW4_SK3_SKFTR0_SKXCCM0_SGRO0_TDMI0_TIN0_TLDS0_TLDSMn1_ULSGRO0_USL1_UIOFGRO0_UPLRP0_USFGRO0_VSn1_VWA4_VWB4_WSGRA2_WSGRB0_WS64_WG32_8_1_WGM2_WGMXCC8_WGMXCCGn1
    SolutionIndex: 121
    SolutionNameMin: Cijk_Ailk_Bljk_S_B_Bias_HA_S_SAV_UserArgs_MT128x416x32_MI16x16x1_SN_LDSB1_AFC0_AG0_AFEM1_AFEM1_ASEM1_CLR1_CADS0_DTLA0_DTLB0_DTVA0_DTVB0_DTVMXSA0_DTVMXSB0_DTVSM0_DPLB0_EPS0_ELFLR0_EMLLn1_FDSI0_GRPM1_GRVWA1_GRVWB4_GSU0_GSUAMB_GSUC0_GSUWGMRR0_GLS0_ISA950_IU1_K1_LDSTI0_LBSPPA0_LBSPPB128_LBSPPM0_LPA0_LPB8_LPM0_LRVWn1_LWPMn1_MIAV0_MIWT4_13_MO40_MGRIPM1_NTn1_NTA0_NTB0_NTC4_NTD4_NTM0_NEPBS0_NLCA2_NLCB1_ONLL1_PGR2_PLR1_PKA1_SGROB0_SIA3_SS1_SU0_SUM0_SUS0_SPO0_SRVW0_SSO1_SVW4_SK3_SKFTR0_SKXCCM0_SGRO0_TDMI0_TIN1_TLDS1_TLDSMn1_ULSGRO0_USL1_UIOFGRO0_UPLRP0_USFGRO0_VSn1_VWA4_VWB1_WSGRA2_WSGRB0_WS64_WG32_8_1_WGM8_WGMXCC1_WGMXCCGn1
    SolutionIndex: 122
    SolutionNameMin: Cijk_Ailk_Bljk_S_B_Bias_HA_S_SAV_UserArgs_MT256x128x32_MI16x16x1_SN_LDSB1_AFC0_AG1_AFEM1_AFEM1_ASEM1_CLR0_CADS0_DTLA0_DTLB0_DTVA0_DTVB0_DTVMXSA0_DTVMXSB0_DTVSM0_DPLB0_EPS0_ELFLR0_EMLLn1_FDSI0_GRPM1_GRVWA4_GRVWB4_GSU0_GSUAMB_GSUC0_GSUWGMRR0_GLS0_ISA950_IU1_K1_LDSTI1_LBSPPA0_LBSPPB0_LBSPPM0_LPA0_LPB0_LPM0_LRVWn1_LWPMn1_MIAV0_MIWT4_8_MO40_MGRIPM1_NTn1_NTA0_NTB0_NTC0_NTD0_NTM0_NEPBS12_NLCA1_NLCB1_ONLL1_PGR2_PLR1_PKA1_SGROB0_SIA3_SS1_SU0_SUM0_SUS0_SPO0_SRVW0_SSO1_SVW4_SK3_SKFTR0_SKXCCM0_SGRO0_TDMI0_TIN1_TLDS0_TLDSMn1_ULSGRO1_USL1_UIOFGRO0_UPLRP0_USFGRO0_VSn1_VWA4_VWB4_WSGRA2_WSGRB2_WS64_WG64_4_1_WGM4_WGMXCC16_WGMXCCGn1
    SolutionIndex: 123
    SolutionNameMin: Cijk_Ailk_Bljk_S_B_Bias_HA_S_SAV_UserArgs_MT256x256x32_MI32x32x1_SN_LDSB1_AFC0_AG1_AFEM1_AFEM1_ASEM1_CLR1_CADS0_DTLA0_DTLB0_DTVA0_DTVB0_DTVMXSA0_DTVMXSB0_DTVSM0_DPLB0_EPS0_ELFLR0_EMLL0_FDSI0_GRPM1_GRVWA4_GRVWB4_GSU0_GSUAMB_GSUC0_GSUWGMRR0_GLS0_ISA950_IU1_K1_LDSTI0_LBSPPA0_LBSPPB512_LBSPPM0_LPA0_LPB4_LPM0_LRVWn1_LWPMn1_MIAV0_MIWT4_4_MO40_MGRIPM1_NTn1_NTA0_NTB0_NTC4_NTD4_NTM0_NEPBS0_NLCA1_NLCB1_ONLL1_PGR2_PLR1_PKA1_SGROB0_SIA3_SS1_SU0_SUM0_SUS0_SPO0_SRVW0_SSO1_SVW4_SK3_SKFTR0_SKXCCM4_SGRO0_TDMI0_TIN1_TLDS1_TLDSMn1_ULSGRO0_USL1_UIOFGRO0_UPLRP0_USFGRO0_VSn1_VWA4_VWB4_WSGRA0_WSGRB0_WS64_WG64_4_1_WGMn16_WGMXCC16_WGMXCCGn1
    SolutionIndex: 124
    SolutionNameMin: Cijk_Ailk_Bljk_S_B_Bias_HA_S_SAV_UserArgs_MT160x192x32_MI16x16x1_SN_LDSB1_AFC0_AG1_AFEM1_AFEM1_ASEM1_CLR0_CADS0_DTLA0_DTLB0_DTVA0_DTVB0_DTVMXSA0_DTVMXSB0_DTVSM0_DPLB0_EPS0_ELFLR0_EMLL0_FDSI0_GRPM1_GRVWA4_GRVWB4_GSU0_GSUAMB_GSUC0_GSUWGMRR0_GLS0_ISA950_IU1_K1_LDSTI1_LBSPPA0_LBSPPB768_LBSPPM0_LPA0_LPB16_LPM0_LRVWn1_LWPMn1_MIAV0_MIWT10_3_MO40_MGRIPM1_NTn1_NTA0_NTB0_NTC4_NTD4_NTM0_NEPBS0_NLCA5_NLCB1_ONLL1_PGR2_PLR1_PKA1_SGROB0_SIA3_SS1_SU0_SUM0_SUS0_SPO0_SRVW0_SSO1_SVW2_SK3_SKFTR0_SKXCCM0_SGRO0_TDMI0_TIN1_TLDS0_TLDSMn1_ULSGRO0_USL1_UIOFGRO0_UPLRP0_USFGRO0_VSn1_VWA2_VWB1_WSGRA0_WSGRB0_WS64_WG16_16_1_WGM2_WGMXCC32_WGMXCCGn1
    SolutionIndex: 125
    SolutionNameMin: Cijk_Ailk_Bljk_S_B_Bias_HA_S_SAV_UserArgs_MT128x320x32_MI32x32x1_SN_LDSB1_AFC0_AG1_AFEM1_AFEM1_ASEM1_CLR1_CADS0_DTLA0_DTLB0_DTVA0_DTVB0_DTVMXSA0_DTVMXSB0_DTVSM0_DPLB0_EPS0_ELFLR0_EMLLn1_FDSI0_GRPM1_GRVWA1_GRVWB4_GSU0_GSUAMB_GSUC0_GSUWGMRR0_GLS0_ISA950_IU1_K1_LDSTI0_LBSPPA0_LBSPPB128_LBSPPM0_LPA0_LPB4_LPM0_LRVWn1_LWPMn1_MIAV0_MIWT2_5_MO40_MGRIPM1_NTn1_NTA0_NTB0_NTC0_NTD0_NTM0_NEPBS0_NLCA2_NLCB1_ONLL1_PGR2_PLR1_PKA1_SGROB0_SIA3_SS1_SU0_SUM0_SUS0_SPO0_SRVW0_SSO0_SVW2_SK3_SKFTR0_SKXCCM0_SGRO0_TDMI0_TIN1_TLDS1_TLDSMn1_ULSGRO0_USL1_UIOFGRO0_UPLRP0_USFGRO0_VSn1_VWA2_VWB1_WSGRA2_WSGRB0_WS64_WG64_4_1_WGMn1_WGMXCC8_WGMXCCGn1
    SolutionIndex: 126
    SolutionNameMin: Cijk_Ailk_Bljk_S_B_Bias_HA_S_SAV_UserArgs_MT128x176x32_MI16x16x1_SN_LDSB1_AFC0_AG1_AFEM1_AFEM1_ASEM1_CLR1_CADS0_DTLA0_DTLB0_DTVA0_DTVB0_DTVMXSA0_DTVMXSB0_DTVSM0_DPLB0_EPS0_ELFLR0_EMLLn1_FDSI0_GRPM1_GRVWA2_GRVWB2_GSU0_GSUAMB_GSUC0_GSUWGMRR0_GLS0_ISA950_IU1_K1_LDSTI0_LBSPPA0_LBSPPB128_LBSPPM0_LPA0_LPB8_LPM0_LRVWn1_LWPMn1_MIAV0_MIWT2_11_MO40_MGRIPM1_NTn1_NTA0_NTB0_NTC0_NTD4_NTM0_NEPBS16_NLCA1_NLCB1_ONLL1_PGR2_PLR1_PKA1_SGROB0_SIA3_SS1_SU0_SUM0_SUS0_SPO0_SRVW0_SSO4_SVW2_SK3_SKFTR0_SKXCCM0_SGRO0_TDMI0_TIN1_TLDS1_TLDSMn1_ULSGRO0_USL1_UIOFGRO0_UPLRP0_USFGRO0_VSn1_VWA2_VWB1_WSGRA2_WSGRB2_WS64_WG64_4_1_WGM0_WGMXCC8_WGMXCCGn1
    SolutionIndex: 127
    SolutionNameMin: Cijk_Ailk_Bljk_S_B_Bias_HA_S_SAV_UserArgs_MT256x176x32_MI16x16x1_SN_LDSB1_AFC0_AG1_AFEM1_AFEM1_ASEM1_CLR1_CADS0_DTLA0_DTLB0_DTVA0_DTVB0_DTVMXSA0_DTVMXSB0_DTVSM0_DPLB0_EPS1_ELFLR0_EMLLn1_FDSI0_GRPM1_GRVWA1_GRVWB2_GSU0_GSUAMB_GSUC0_GSUWGMRR0_GLS0_ISA950_IU1_K1_LDSTI0_LBSPPA0_LBSPPB128_LBSPPM0_LPA0_LPB8_LPM0_LRVWn1_LWPMn1_MIAV0_MIWT4_11_MO40_MGRIPM1_NTn1_NTA0_NTB0_NTC4_NTD4_NTM0_NEPBS0_NLCA4_NLCB1_ONLL1_PGR1_PLR1_PKA1_SGROB0_SIA3_SS1_SU0_SUM0_SUS0_SPO1_SRVW0_SSO1_SVW4_SK3_SKFTR0_SKXCCM0_SGRO0_TDMI0_TIN1_TLDS1_TLDSMn1_ULSGRO0_USL1_UIOFGRO0_UPLRP0_USFGRO0_VSn1_VWA4_VWB1_WSGRA2_WSGRB0_WS64_WG64_4_1_WGM2_WGMXCC1_WGMXCCGn1
    SolutionIndex: 128
    SolutionNameMin: Cijk_Ailk_Bljk_S_B_Bias_HA_S_SAV_UserArgs_MT128x416x32_MI16x16x1_SN_LDSB1_AFC0_AG1_AFEM1_AFEM1_ASEM1_CLR1_CADS0_DTLA0_DTLB0_DTVA0_DTVB0_DTVMXSA0_DTVMXSB0_DTVSM0_DPLB0_EPS0_ELFLR0_EMLL0_FDSI0_GRPM1_GRVWA2_GRVWB4_GSU0_GSUAMB_GSUC0_GSUWGMRR0_GLS0_ISA950_IU1_K1_LDSTI0_LBSPPA0_LBSPPB128_LBSPPM0_LPA0_LPB8_LPM0_LRVWn1_LWPMn1_MIAV0_MIWT4_13_MO40_MGRIPM1_NTn1_NTA0_NTB0_NTC0_NTD0_NTM0_NEPBS0_NLCA1_NLCB1_ONLL1_PGR2_PLR1_PKA1_SGROB0_SIA3_SS1_SU0_SUM0_SUS0_SPO0_SRVW0_SSO1_SVW4_SK3_SKFTR0_SKXCCM0_SGRO0_TDMI0_TIN1_TLDS1_TLDSMn1_ULSGRO0_USL1_UIOFGRO0_UPLRP0_USFGRO1_VSn1_VWA4_VWB1_WSGRA2_WSGRB0_WS64_WG32_8_1_WGMn1_WGMXCC8_WGMXCCGn1
    SolutionIndex: 129
    SolutionNameMin: Cijk_Ailk_Bljk_S_B_Bias_HA_S_SAV_UserArgs_MT256x192x32_MI16x16x1_SN_LDSB1_AFC0_AG0_AFEM1_AFEM1_ASEM1_CLR1_CADS0_DTLA0_DTLB0_DTVA0_DTVB0_DTVMXSA0_DTVMXSB0_DTVSM0_DPLB0_EPS0_ELFLR0_EMLL0_FDSI0_GRPM1_GRVWA4_GRVWB4_GSU0_GSUAMB_GSUC0_GSUWGMRR0_GLS0_ISA950_IU1_K1_LDSTI0_LBSPPA0_LBSPPB256_LBSPPM0_LPA0_LPB8_LPM0_LRVWn1_LWPMn1_MIAV0_MIWT8_6_MO40_MGRIPM1_NTn1_NTA0_NTB0_NTC4_NTD4_NTM0_NEPBS12_NLCA1_NLCB1_ONLL1_PGR2_PLR1_PKA1_SGROB0_SIA3_SS1_SU0_SUM0_SUS0_SPO1_SRVW0_SSO1_SVW4_SK3_SKFTR0_SKXCCM0_SGRO0_TDMI0_TIN1_TLDS1_TLDSMn1_ULSGRO0_USL1_UIOFGRO0_UPLRP0_USFGRO0_VSn1_VWA4_VWB2_WSGRA0_WSGRB0_WS64_WG32_8_1_WGM8_WGMXCC1_WGMXCCGn1
    SolutionIndex: 130
    SolutionNameMin: Cijk_Ailk_Bljk_S_B_Bias_HA_S_SAV_UserArgs_MT128x160x32_MI16x16x1_SN_LDSB1_AFC0_AG0_AFEM1_AFEM1_ASEM1_CLR1_CADS0_DTLA0_DTLB0_DTVA0_DTVB0_DTVMXSA0_DTVMXSB0_DTVSM0_DPLB0_EPS0_ELFLR0_EMLLn1_FDSI0_GRPM1_GRVWA2_GRVWB4_GSU0_GSUAMB_GSUC0_GSUWGMRR0_GLS0_ISA950_IU1_K1_LDSTI0_LBSPPA0_LBSPPB640_LBSPPM0_LPA0_LPB16_LPM0_LRVWn1_LWPMn1_MIAV0_MIWT4_5_MO40_MGRIPM1_NTn1_NTA0_NTB0_NTC0_NTD0_NTM0_NEPBS0_NLCA1_NLCB1_ONLL1_PGR2_PLR1_PKA1_SGROB0_SIA3_SS1_SU0_SUM0_SUS0_SPO0_SRVW0_SSO1_SVW4_SK3_SKFTR0_SKXCCM4_SGRO0_TDMI0_TIN1_TLDS0_TLDSMn1_ULSGRO0_USL1_UIOFGRO0_UPLRP0_USFGRO1_VSn1_VWA4_VWB1_WSGRA0_WSGRB2_WS64_WG32_8_1_WGM2_WGMXCC1_WGMXCCGn1
    SolutionIndex: 131
    SolutionNameMin: Cijk_Ailk_Bljk_S_B_Bias_HA_S_SAV_UserArgs_MT416x64x32_MI16x16x1_SN_LDSB1_AFC0_AG1_AFEM1_AFEM1_ASEM1_CLR0_CADS0_DTLA0_DTLB0_DTVA0_DTVB0_DTVMXSA0_DTVMXSB0_DTVSM0_DPLB0_EPS0_ELFLR0_EMLL0_FDSI0_GRPM1_GRVWA4_GRVWB4_GSU0_GSUAMB_GSUC0_GSUWGMRR0_GLS0_ISA950_IU1_K1_LDSTI1_LBSPPA0_LBSPPB256_LBSPPM0_LPA0_LPB16_LPM0_LRVWn1_LWPMn1_MIAV0_MIWT26_1_MO40_MGRIPM1_NTn1_NTA0_NTB0_NTC0_NTD0_NTM0_NEPBS12_NLCA13_NLCB1_ONLL1_PGR2_PLR1_PKA1_SGROB0_SIA3_SS1_SU0_SUM0_SUS0_SPO1_SRVW0_SSO1_SVW2_SK3_SKFTR0_SKXCCM4_SGRO0_TDMI0_TIN1_TLDS0_TLDSMn1_ULSGRO0_USL1_UIOFGRO0_UPLRP0_USFGRO1_VSn1_VWA2_VWB1_WSGRA2_WSGRB0_WS64_WG16_16_1_WGM8_WGMXCC4_WGMXCCGn1
    SolutionIndex: 132
    SolutionNameMin: Cijk_Ailk_Bljk_S_B_Bias_HA_S_SAV_UserArgs_MT272x128x32_MI16x16x1_SN_LDSB1_AFC0_AG1_AFEM1_AFEM1_ASEM1_CLR1_CADS0_DTLA0_DTLB0_DTVA0_DTVB0_DTVMXSA0_DTVMXSB0_DTVSM0_DPLB0_EPS0_ELFLR0_EMLLn1_FDSI0_GRPM1_GRVWA2_GRVWB4_GSU0_GSUAMB_GSUC0_GSUWGMRR0_GLS0_ISA950_IU1_K1_LDSTI0_LBSPPA4352_LBSPPB256_LBSPPM0_LPA16_LPB8_LPM0_LRVWn1_LWPMn1_MIAV0_MIWT17_2_MO40_MGRIPM1_NTn1_NTA0_NTB0_NTC0_NTD0_NTM0_NEPBS0_NLCA17_NLCB1_ONLL1_PGR2_PLR1_PKA1_SGROB0_SIA3_SS1_SU16_SUM0_SUS512_SPO0_SRVW0_SSO0_SVW1_SK3_SKFTR0_SKXCCM0_SGRO0_TDMI0_TIN0_TLDS1_TLDSMn1_ULSGRO0_USL1_UIOFGRO0_UPLRP0_USFGRO1_VSn1_VWA1_VWB2_WSGRA0_WSGRB0_WS64_WG16_16_1_WGMn6_WGMXCC16_WGMXCCGn1
    SolutionIndex: 133
    SolutionNameMin: Cijk_Ailk_Bljk_S_B_Bias_HA_S_SAV_UserArgs_MT256x224x32_MI16x16x1_SN_LDSB1_AFC0_AG0_AFEM1_AFEM1_ASEM1_CLR1_CADS0_DTLA0_DTLB0_DTVA0_DTVB0_DTVMXSA0_DTVMXSB0_DTVSM0_DPLB0_EPS0_ELFLR0_EMLLn1_FDSI0_GRPM1_GRVWA4_GRVWB4_GSU0_GSUAMB_GSUC0_GSUWGMRR0_GLS0_ISA950_IU1_K1_LDSTI0_LBSPPA0_LBSPPB128_LBSPPM0_LPA0_LPB8_LPM0_LRVWn1_LWPMn1_MIAV0_MIWT8_7_MO40_MGRIPM1_NTn1_NTA0_NTB0_NTC4_NTD4_NTM0_NEPBS0_NLCA1_NLCB1_ONLL1_PGR2_PLR1_PKA1_SGROB0_SIA3_SS1_SU0_SUM0_SUS0_SPO0_SRVW0_SSO1_SVW4_SK3_SKFTR0_SKXCCM0_SGRO0_TDMI0_TIN1_TLDS1_TLDSMn1_ULSGRO0_USL1_UIOFGRO0_UPLRP0_USFGRO0_VSn1_VWA4_VWB1_WSGRA2_WSGRB2_WS64_WG32_8_1_WGMn2_WGMXCC1_WGMXCCGn1
    SolutionIndex: 134
    SolutionNameMin: Cijk_Ailk_Bljk_S_B_Bias_HA_S_SAV_UserArgs_MT128x384x32_MI16x16x1_SN_LDSB1_AFC0_AG0_AFEM1_AFEM1_ASEM1_CLR1_CADS0_DTLA0_DTLB0_DTVA0_DTVB0_DTVMXSA0_DTVMXSB0_DTVSM0_DPLB0_EPS0_ELFLR0_EMLLn1_FDSI0_GRPM1_GRVWA4_GRVWB4_GSU0_GSUAMB_GSUC0_GSUWGMRR0_GLS0_ISA950_IU1_K1_LDSTI0_LBSPPA0_LBSPPB512_LBSPPM0_LPA0_LPB8_LPM0_LRVWn1_LWPMn1_MIAV0_MIWT4_12_MO40_MGRIPM1_NTn1_NTA0_NTB0_NTC4_NTD4_NTM0_NEPBS14_NLCA1_NLCB1_ONLL1_PGR2_PLR1_PKA1_SGROB0_SIA3_SS1_SU0_SUM0_SUS0_SPO0_SRVW0_SSO1_SVW4_SK3_SKFTR0_SKXCCM8_SGRO0_TDMI0_TIN1_TLDS1_TLDSMn1_ULSGRO0_USL1_UIOFGRO0_UPLRP0_USFGRO1_VSn1_VWA4_VWB4_WSGRA0_WSGRB0_WS64_WG32_8_1_WGMn1_WGMXCC4_WGMXCCGn1
    SolutionIndex: 135
    SolutionNameMin: Cijk_Ailk_Bljk_S_B_Bias_HA_S_SAV_UserArgs_MT112x192x32_MI16x16x1_SN_LDSB1_AFC0_AG1_AFEM1_AFEM1_ASEM1_CLR1_CADS0_DTLA0_DTLB0_DTVA0_DTVB0_DTVMXSA0_DTVMXSB0_DTVSM0_DPLB0_EPS0_ELFLR0_EMLL0_FDSI0_GRPM1_GRVWA2_GRVWB2_GSU0_GSUAMB_GSUC0_GSUWGMRR0_GLS0_ISA950_IU1_K1_LDSTI0_LBSPPA1792_LBSPPB128_LBSPPM0_LPA16_LPB8_LPM0_LRVWn1_LWPMn1_MIAV0_MIWT7_3_MO40_MGRIPM1_NTn1_NTA0_NTB4_NTC0_NTD0_NTM0_NEPBS14_NLCA7_NLCB1_ONLL1_PGR2_PLR1_PKA1_SGROB0_SIA3_SS0_SU0_SUM0_SUS0_SPO0_SRVW0_SSO1_SVW4_SK3_SKFTR0_SKXCCM0_SGRO0_TDMI0_TIN0_TLDS1_TLDSMn1_ULSGRO1_USL1_UIOFGRO0_UPLRP0_USFGRO1_VSn1_VWA1_VWB1_WSGRA0_WSGRB2_WS64_WG16_16_1_WGM4_WGMXCC32_WGMXCCGn1
    SolutionIndex: 136
    SolutionNameMin: Cijk_Ailk_Bljk_S_B_Bias_HA_S_SAV_UserArgs_MT256x128x32_MI32x32x1_SN_LDSB1_AFC0_AG1_AFEM1_AFEM1_ASEM1_CLR0_CADS0_DTLA0_DTLB0_DTVA0_DTVB0_DTVMXSA0_DTVMXSB0_DTVSM0_DPLB0_EPS0_ELFLR0_EMLLn1_FDSI0_GRPM1_GRVWA4_GRVWB4_GSU0_GSUAMB_GSUC0_GSUWGMRR0_GLS0_ISA950_IU1_K1_LDSTI1_LBSPPA0_LBSPPB0_LBSPPM0_LPA0_LPB0_LPM0_LRVWn1_LWPMn1_MIAV0_MIWT4_2_MO40_MGRIPM1_NTn1_NTA0_NTB0_NTC0_NTD0_NTM0_NEPBS0_NLCA1_NLCB1_ONLL1_PGR2_PLR1_PKA1_SGROB0_SIA3_SS1_SU16_SUM0_SUS512_SPO1_SRVW0_SSO1_SVW4_SK3_SKFTR0_SKXCCM8_SGRO0_TDMI0_TIN0_TLDS0_TLDSMn1_ULSGRO0_USL1_UIOFGRO0_UPLRP0_USFGRO0_VSn1_VWA4_VWB2_WSGRA0_WSGRB0_WS64_WG64_4_1_WGMn32_WGMXCC1_WGMXCCGn1
    SolutionIndex: 137
    SolutionNameMin: Cijk_Ailk_Bljk_S_B_Bias_HA_S_SAV_UserArgs_MT160x224x32_MI16x16x1_SN_LDSB1_AFC0_AG1_AFEM1_AFEM1_ASEM1_CLR0_CADS0_DTLA0_DTLB0_DTVA0_DTVB0_DTVMXSA0_DTVMXSB0_DTVSM0_DPLB0_EPS0_ELFLR0_EMLL0_FDSI0_GRPM1_GRVWA4_GRVWB4_GSU0_GSUAMB_GSUC0_GSUWGMRR0_GLS0_ISA950_IU1_K1_LDSTI1_LBSPPA640_LBSPPB896_LBSPPM0_LPA16_LPB16_LPM0_LRVWn1_LWPMn1_MIAV0_MIWT5_7_MO40_MGRIPM1_NTn1_NTA0_NTB0_NTC0_NTD0_NTM0_NEPBS0_NLCA5_NLCB1_ONLL1_PGR2_PLR1_PKA1_SGROB0_SIA3_SS0_SU8_SUM0_SUS256_SPO1_SRVW0_SSO1_SVW4_SK3_SKFTR0_SKXCCM4_SGRO0_TDMI0_TIN0_TLDS0_TLDSMn1_ULSGRO0_USL1_UIOFGRO0_UPLRP0_USFGRO0_VSn1_VWA1_VWB1_WSGRA0_WSGRB2_WS64_WG32_8_1_WGMn8_WGMXCC1_WGMXCCGn1
    SolutionIndex: 138
    SolutionNameMin: Cijk_Ailk_Bljk_S_B_Bias_HA_S_SAV_UserArgs_MT128x160x32_MI16x16x1_SN_LDSB1_AFC0_AG0_AFEM1_AFEM1_ASEM1_CLR1_CADS0_DTLA0_DTLB0_DTVA0_DTVB0_DTVMXSA0_DTVMXSB0_DTVSM0_DPLB0_EPS1_ELFLR0_EMLLn1_FDSI0_GRPM1_GRVWA1_GRVWB4_GSU0_GSUAMB_GSUC0_GSUWGMRR0_GLS0_ISA950_IU1_K1_LDSTI0_LBSPPA512_LBSPPB128_LBSPPM0_LPA8_LPB8_LPM0_LRVWn1_LWPMn1_MIAV0_MIWT4_5_MO40_MGRIPM1_NTn1_NTA0_NTB0_NTC4_NTD4_NTM0_NEPBS8_NLCA1_NLCB1_ONLL1_PGR1_PLR1_PKA1_SGROB0_SIA3_SS1_SU0_SUM0_SUS0_SPO0_SRVW0_SSO1_SVW4_SK3_SKFTR0_SKXCCM0_SGRO0_TDMI0_TIN1_TLDS2_TLDSMn1_ULSGRO0_USL1_UIOFGRO0_UPLRP0_USFGRO1_VSn1_VWA4_VWB1_WSGRA0_WSGRB0_WS64_WG32_8_1_WGMn2_WGMXCC1_WGMXCCGn1
    SolutionIndex: 139
    SolutionNameMin: Cijk_Ailk_Bljk_S_B_Bias_HA_S_SAV_UserArgs_MT320x160x32_MI16x16x1_SN_LDSB1_AFC0_AG0_AFEM1_AFEM1_ASEM1_CLR1_CADS0_DTLA0_DTLB0_DTVA0_DTVB0_DTVMXSA0_DTVMXSB0_DTVSM0_DPLB0_EPS0_ELFLR0_EMLLn1_FDSI0_GRPM1_GRVWA4_GRVWB4_GSU0_GSUAMB_GSUC0_GSUWGMRR0_GLS0_ISA950_IU1_K1_LDSTI0_LBSPPA0_LBSPPB128_LBSPPM0_LPA0_LPB8_LPM0_LRVWn1_LWPMn1_MIAV0_MIWT10_5_MO40_MGRIPM1_NTn1_NTA0_NTB0_NTC4_NTD4_NTM0_NEPBS0_NLCA5_NLCB1_ONLL1_PGR2_PLR1_PKA1_SGROB0_SIA3_SS1_SU0_SUM0_SUS0_SPO0_SRVW0_SSO1_SVW2_SK3_SKFTR0_SKXCCM4_SGRO0_TDMI0_TIN1_TLDS1_TLDSMn1_ULSGRO0_USL1_UIOFGRO0_UPLRP0_USFGRO1_VSn1_VWA2_VWB1_WSGRA0_WSGRB2_WS64_WG32_8_1_WGMn1_WGMXCC16_WGMXCCGn1
    SolutionIndex: 140
    SolutionNameMin: Cijk_Ailk_Bljk_S_B_Bias_HA_S_SAV_UserArgs_MT224x192x32_MI16x16x1_SN_LDSB1_AFC0_AG0_AFEM1_AFEM1_ASEM1_CLR1_CADS0_DTLA0_DTLB0_DTVA0_DTVB0_DTVMXSA0_DTVMXSB0_DTVSM0_DPLB0_EPS0_ELFLR0_EMLL0_FDSI0_GRPM1_GRVWA4_GRVWB4_GSU0_GSUAMB_GSUC0_GSUWGMRR0_GLS0_ISA950_IU1_K1_LDSTI0_LBSPPA0_LBSPPB128_LBSPPM0_LPA0_LPB8_LPM0_LRVWn1_LWPMn1_MIAV0_MIWT14_3_MO40_MGRIPM1_NTn1_NTA0_NTB0_NTC4_NTD4_NTM0_NEPBS0_NLCA7_NLCB1_ONLL1_PGR2_PLR1_PKA1_SGROB0_SIA3_SS1_SU0_SUM0_SUS0_SPO0_SRVW0_SSO0_SVW2_SK3_SKFTR0_SKXCCM0_SGRO0_TDMI0_TIN1_TLDS1_TLDSMn1_ULSGRO0_USL1_UIOFGRO0_UPLRP0_USFGRO1_VSn1_VWA2_VWB1_WSGRA2_WSGRB2_WS64_WG16_16_1_WGMn1_WGMXCC32_WGMXCCGn1
    SolutionIndex: 141
    SolutionNameMin: Cijk_Ailk_Bljk_S_B_Bias_HA_S_SAV_UserArgs_MT256x96x32_MI16x16x1_SN_LDSB1_AFC0_AG0_AFEM1_AFEM1_ASEM1_CLR1_CADS0_DTLA0_DTLB0_DTVA0_DTVB0_DTVMXSA0_DTVMXSB0_DTVSM0_DPLB0_EPS1_ELFLR0_EMLLn1_FDSI0_GRPM1_GRVWA4_GRVWB4_GSU0_GSUAMB_GSUC0_GSUWGMRR0_GLS0_ISA950_IU1_K1_LDSTI0_LBSPPA0_LBSPPB0_LBSPPM0_LPA0_LPB0_LPM0_LRVWn1_LWPMn1_MIAV0_MIWT4_6_MO40_MGRIPM1_NTn1_NTA0_NTB0_NTC4_NTD4_NTM0_NEPBS10_NLCA1_NLCB1_ONLL1_PGR1_PLR1_PKA1_SGROB0_SIA3_SS1_SU0_SUM0_SUS0_SPO0_SRVW0_SSO1_SVW4_SK3_SKFTR0_SKXCCM0_SGRO0_TDMI0_TIN1_TLDS0_TLDSMn1_ULSGRO0_USL1_UIOFGRO0_UPLRP0_USFGRO1_VSn1_VWA4_VWB2_WSGRA0_WSGRB0_WS64_WG64_4_1_WGM2_WGMXCC1_WGMXCCGn1
    SolutionIndex: 142
    SolutionNameMin: Cijk_Ailk_Bljk_S_B_Bias_HA_S_SAV_UserArgs_MT160x320x32_MI16x16x1_SN_LDSB1_AFC0_AG1_AFEM1_AFEM1_ASEM1_CLR1_CADS0_DTLA0_DTLB0_DTVA0_DTVB0_DTVMXSA0_DTVMXSB0_DTVSM0_DPLB0_EPS1_ELFLR0_EMLLn1_FDSI0_GRPM1_GRVWA1_GRVWB4_GSU0_GSUAMB_GSUC0_GSUWGMRR0_GLS0_ISA950_IU1_K1_LDSTI0_LBSPPA0_LBSPPB128_LBSPPM0_LPA0_LPB8_LPM0_LRVWn1_LWPMn1_MIAV0_MIWT10_5_MO40_MGRIPM1_NTn1_NTA0_NTB0_NTC0_NTD0_NTM0_NEPBS0_NLCA5_NLCB1_ONLL1_PGR1_PLR1_PKA1_SGROB0_SIA3_SS1_SU0_SUM0_SUS0_SPO0_SRVW0_SSO1_SVW2_SK3_SKFTR0_SKXCCM0_SGRO0_TDMI0_TIN1_TLDS1_TLDSMn1_ULSGRO0_USL1_UIOFGRO0_UPLRP0_USFGRO0_VSn1_VWA2_VWB1_WSGRA0_WSGRB2_WS64_WG16_16_1_WGM4_WGMXCC4_WGMXCCGn1
    SolutionIndex: 143
    SolutionNameMin: Cijk_Ailk_Bljk_S_B_Bias_HA_S_SAV_UserArgs_MT384x160x32_MI16x16x1_SN_LDSB1_AFC0_AG1_AFEM1_AFEM1_ASEM1_CLR1_CADS0_DTLA0_DTLB0_DTVA0_DTVB0_DTVMXSA0_DTVMXSB0_DTVSM0_DPLB0_EPS0_ELFLR0_EMLL0_FDSI0_GRPM1_GRVWA4_GRVWB4_GSU0_GSUAMB_GSUC0_GSUWGMRR0_GLS0_ISA950_IU1_K1_LDSTI0_LBSPPA0_LBSPPB128_LBSPPM0_LPA0_LPB8_LPM0_LRVWn1_LWPMn1_MIAV0_MIWT12_5_MO40_MGRIPM1_NTn1_NTA0_NTB0_NTC4_NTD4_NTM0_NEPBS12_NLCA3_NLCB1_ONLL1_PGR2_PLR1_PKA1_SGROB0_SIA3_SS1_SU0_SUM0_SUS0_SPO1_SRVW0_SSO1_SVW4_SK3_SKFTR0_SKXCCM0_SGRO0_TDMI0_TIN1_TLDS1_TLDSMn1_ULSGRO0_USL1_UIOFGRO0_UPLRP0_USFGRO1_VSn1_VWA4_VWB1_WSGRA0_WSGRB0_WS64_WG32_8_1_WGMn1_WGMXCC1_WGMXCCGn1
    SolutionIndex: 144
    SolutionNameMin: Cijk_Ailk_Bljk_S_B_Bias_HA_S_SAV_UserArgs_MT448x64x32_MI16x16x1_SN_LDSB1_AFC0_AG1_AFEM1_AFEM1_ASEM1_CLR0_CADS0_DTLA0_DTLB0_DTVA0_DTVB0_DTVMXSA0_DTVMXSB0_DTVSM0_DPLB0_EPS0_ELFLR0_EMLLn1_FDSI0_GRPM1_GRVWA4_GRVWB4_GSU0_GSUAMB_GSUC0_GSUWGMRR0_GLS0_ISA950_IU1_K1_LDSTI1_LBSPPA0_LBSPPB0_LBSPPM0_LPA0_LPB0_LPM0_LRVWn1_LWPMn1_MIAV0_MIWT14_2_MO40_MGRIPM1_NTn1_NTA0_NTB0_NTC0_NTD0_NTM0_NEPBS14_NLCA7_NLCB1_ONLL1_PGR2_PLR1_PKA1_SGROB0_SIA3_SS1_SU0_SUM0_SUS0_SPO1_SRVW0_SSO1_SVW2_SK3_SKFTR0_SKXCCM8_SGRO0_TDMI0_TIN1_TLDS0_TLDSMn1_ULSGRO1_USL1_UIOFGRO0_UPLRP0_USFGRO0_VSn1_VWA2_VWB2_WSGRA0_WSGRB2_WS64_WG32_8_1_WGM48_WGMXCC1_WGMXCCGn1
    SolutionIndex: 145
    SolutionNameMin: Cijk_Ailk_Bljk_S_B_Bias_HA_S_SAV_UserArgs_MT128x160x32_MI16x16x1_SN_LDSB1_AFC0_AG1_AFEM1_AFEM1_ASEM1_CLR1_CADS0_DTLA0_DTLB0_DTVA0_DTVB0_DTVMXSA0_DTVMXSB0_DTVSM0_DPLB0_EPS1_ELFLR0_EMLLn1_FDSI0_GRPM1_GRVWA1_GRVWB4_GSU0_GSUAMB_GSUC0_GSUWGMRR0_GLS0_ISA950_IU1_K1_LDSTI0_LBSPPA512_LBSPPB128_LBSPPM0_LPA8_LPB8_LPM0_LRVWn1_LWPMn1_MIAV0_MIWT4_5_MO40_MGRIPM1_NTn1_NTA0_NTB0_NTC0_NTD0_NTM0_NEPBS8_NLCA2_NLCB1_ONLL1_PGR1_PLR1_PKA1_SGROB0_SIA3_SS1_SU0_SUM0_SUS0_SPO0_SRVW0_SSO1_SVW4_SK3_SKFTR0_SKXCCM0_SGRO0_TDMI0_TIN1_TLDS2_TLDSMn1_ULSGRO0_USL1_UIOFGRO0_UPLRP0_USFGRO0_VSn1_VWA4_VWB1_WSGRA2_WSGRB2_WS64_WG32_8_1_WGMn1_WGMXCC8_WGMXCCGn1
    SolutionIndex: 146
    SolutionNameMin: Cijk_Ailk_Bljk_S_B_Bias_HA_S_SAV_UserArgs_MT352x128x32_MI16x16x1_SN_LDSB1_AFC0_AG0_AFEM1_AFEM1_ASEM1_CLR1_CADS0_DTLA0_DTLB0_DTVA0_DTVB0_DTVMXSA0_DTVMXSB0_DTVSM0_DPLB0_EPS0_ELFLR0_EMLL0_FDSI0_GRPM1_GRVWA4_GRVWB4_GSU0_GSUAMB_GSUC0_GSUWGMRR0_GLS0_ISA950_IU1_K1_LDSTI0_LBSPPA5632_LBSPPB512_LBSPPM0_LPA16_LPB8_LPM0_LRVWn1_LWPMn1_MIAV0_MIWT11_4_MO40_MGRIPM1_NTn1_NTA0_NTB0_NTC0_NTD0_NTM0_NEPBS10_NLCA11_NLCB1_ONLL1_PGR2_PLR1_PKA1_SGROB0_SIA3_SS0_SU0_SUM0_SUS0_SPO1_SRVW0_SSO4_SVW4_SK3_SKFTR0_SKXCCM8_SGRO0_TDMI0_TIN1_TLDS1_TLDSMn1_ULSGRO1_USL1_UIOFGRO0_UPLRP0_USFGRO1_VSn1_VWA1_VWB4_WSGRA2_WSGRB0_WS64_WG32_8_1_WGM4_WGMXCC2_WGMXCCGn1
    SolutionIndex: 147
    SolutionNameMin: Cijk_Ailk_Bljk_S_B_Bias_HA_S_SAV_UserArgs_MT256x160x32_MI32x32x1_SN_LDSB1_AFC0_AG1_AFEM1_AFEM1_ASEM1_CLR0_CADS0_DTLA0_DTLB0_DTVA0_DTVB0_DTVMXSA0_DTVMXSB0_DTVSM0_DPLB0_EPS0_ELFLR0_EMLLn1_FDSI0_GRPM1_GRVWA4_GRVWB4_GSU0_GSUAMB_GSUC0_GSUWGMRR0_GLS0_ISA950_IU1_K1_LDSTI1_LBSPPA0_LBSPPB0_LBSPPM0_LPA0_LPB0_LPM0_LRVWn1_LWPMn1_MIAV0_MIWT2_5_MO40_MGRIPM1_NTn1_NTA0_NTB0_NTC0_NTD0_NTM0_NEPBS12_NLCA1_NLCB1_ONLL1_PGR2_PLR1_PKA1_SGROB0_SIA3_SS1_SU0_SUM0_SUS0_SPO0_SRVW0_SSO1_SVW2_SK3_SKFTR0_SKXCCM0_SGRO0_TDMI0_TIN1_TLDS0_TLDSMn1_ULSGRO1_USL1_UIOFGRO0_UPLRP0_USFGRO1_VSn1_VWA2_VWB1_WSGRA0_WSGRB0_WS64_WG128_2_1_WGMn1_WGMXCC8_WGMXCCGn1
    SolutionIndex: 148
    SolutionNameMin: Cijk_Ailk_Bljk_S_B_Bias_HA_S_SAV_UserArgs_MT256x224x32_MI16x16x1_SN_LDSB1_AFC0_AG1_AFEM1_AFEM1_ASEM1_CLR1_CADS0_DTLA0_DTLB0_DTVA0_DTVB0_DTVMXSA0_DTVMXSB0_DTVSM0_DPLB0_EPS1_ELFLR0_EMLLn1_FDSI0_GRPM1_GRVWA4_GRVWB4_GSU0_GSUAMB_GSUC0_GSUWGMRR0_GLS0_ISA950_IU1_K1_LDSTI0_LBSPPA0_LBSPPB256_LBSPPM0_LPA0_LPB8_LPM0_LRVWn1_LWPMn1_MIAV0_MIWT4_14_MO40_MGRIPM1_NTn1_NTA0_NTB0_NTC4_NTD4_NTM0_NEPBS14_NLCA1_NLCB1_ONLL1_PGR1_PLR1_PKA1_SGROB0_SIA3_SS1_SU0_SUM0_SUS0_SPO1_SRVW0_SSO1_SVW4_SK3_SKFTR0_SKXCCM0_SGRO0_TDMI0_TIN1_TLDS1_TLDSMn1_ULSGRO0_USL1_UIOFGRO0_UPLRP0_USFGRO0_VSn1_VWA4_VWB2_WSGRA0_WSGRB2_WS64_WG64_4_1_WGM2_WGMXCC1_WGMXCCGn1
    SolutionIndex: 149
    SolutionNameMin: Cijk_Ailk_Bljk_S_B_Bias_HA_S_SAV_UserArgs_MT320x128x32_MI16x16x1_SN_LDSB1_AFC0_AG1_AFEM1_AFEM1_ASEM1_CLR1_CADS0_DTLA0_DTLB0_DTVA0_DTVB0_DTVMXSA0_DTVMXSB0_DTVSM0_DPLB0_EPS1_ELFLR0_EMLL0_FDSI0_GRPM1_GRVWA4_GRVWB4_GSU0_GSUAMB_GSUC0_GSUWGMRR0_GLS0_ISA950_IU1_K1_LDSTI0_LBSPPA0_LBSPPB256_LBSPPM0_LPA0_LPB8_LPM0_LRVWn1_LWPMn1_MIAV0_MIWT20_2_MO40_MGRIPM1_NTn1_NTA0_NTB0_NTC4_NTD4_NTM0_NEPBS0_NLCA5_NLCB1_ONLL1_PGR1_PLR1_PKA1_SGROB0_SIA3_SS1_SU0_SUM0_SUS0_SPO0_SRVW0_SSO1_SVW4_SK3_SKFTR0_SKXCCM0_SGRO0_TDMI0_TIN1_TLDS1_TLDSMn1_ULSGRO0_USL1_UIOFGRO0_UPLRP0_USFGRO0_VSn1_VWA4_VWB2_WSGRA0_WSGRB0_WS64_WG16_16_1_WGM6_WGMXCC1_WGMXCCGn1
    SolutionIndex: 150
    SolutionNameMin: Cijk_Ailk_Bljk_S_B_Bias_HA_S_SAV_UserArgs_MT64x288x32_MI16x16x1_SN_LDSB1_AFC0_AG1_AFEM1_AFEM1_ASEM1_CLR1_CADS0_DTLA0_DTLB0_DTVA0_DTVB0_DTVMXSA0_DTVMXSB0_DTVSM0_DPLB0_EPS1_ELFLR0_EMLLn1_FDSI0_GRPM1_GRVWA1_GRVWB4_GSU0_GSUAMB_GSUC0_GSUWGMRR0_GLS0_ISA950_IU1_K1_LDSTI0_LBSPPA0_LBSPPB128_LBSPPM0_LPA0_LPB8_LPM0_LRVWn1_LWPMn1_MIAV0_MIWT2_9_MO40_MGRIPM1_NTn1_NTA0_NTB0_NTC4_NTD0_NTM0_NEPBS0_NLCA1_NLCB1_ONLL1_PGR1_PLR1_PKA1_SGROB0_SIA3_SS1_SU0_SUM0_SUS0_SPO1_SRVW0_SSO0_SVW2_SK3_SKFTR0_SKXCCM0_SGRO0_TDMI0_TIN1_TLDS1_TLDSMn1_ULSGRO0_USL1_UIOFGRO0_UPLRP0_USFGRO1_VSn1_VWA2_VWB1_WSGRA0_WSGRB0_WS64_WG32_8_1_WGM32_WGMXCC1_WGMXCCGn1
    SolutionIndex: 151
    SolutionNameMin: Cijk_Ailk_Bljk_S_B_Bias_HA_S_SAV_UserArgs_MT512x128x32_MI32x32x1_SN_LDSB1_AFC0_AG1_AFEM1_AFEM1_ASEM1_CLR1_CADS0_DTLA0_DTLB0_DTVA0_DTVB0_DTVMXSA0_DTVMXSB0_DTVSM0_DPLB0_EPS0_ELFLR0_EMLL0_FDSI0_GRPM1_GRVWA4_GRVWB4_GSU0_GSUAMB_GSUC0_GSUWGMRR0_GLS0_ISA950_IU1_K1_LDSTI0_LBSPPA0_LBSPPB512_LBSPPM0_LPA0_LPB4_LPM0_LRVWn1_LWPMn1_MIAV0_MIWT4_4_MO40_MGRIPM1_NTn1_NTA0_NTB0_NTC4_NTD4_NTM0_NEPBS8_NLCA1_NLCB1_ONLL1_PGR2_PLR1_PKA1_SGROB0_SIA3_SS1_SU0_SUM0_SUS0_SPO1_SRVW0_SSO1_SVW4_SK3_SKFTR0_SKXCCM0_SGRO0_TDMI0_TIN1_TLDS1_TLDSMn1_ULSGRO1_USL1_UIOFGRO0_UPLRP0_USFGRO1_VSn1_VWA4_VWB4_WSGRA0_WSGRB0_WS64_WG128_2_1_WGMn48_WGMXCC1_WGMXCCGn1
    SolutionIndex: 152
    SolutionNameMin: Cijk_Ailk_Bljk_S_B_Bias_HA_S_SAV_UserArgs_MT256x160x32_MI16x16x1_SN_LDSB1_AFC0_AG0_AFEM1_AFEM1_ASEM1_CLR1_CADS0_DTLA0_DTLB0_DTVA0_DTVB0_DTVMXSA0_DTVMXSB0_DTVSM0_DPLB0_EPS0_ELFLR0_EMLL0_FDSI0_GRPM1_GRVWA4_GRVWB4_GSU0_GSUAMB_GSUC0_GSUWGMRR0_GLS0_ISA950_IU1_K1_LDSTI0_LBSPPA0_LBSPPB128_LBSPPM0_LPA0_LPB8_LPM0_LRVWn1_LWPMn1_MIAV0_MIWT8_5_MO40_MGRIPM1_NTn1_NTA0_NTB0_NTC4_NTD4_NTM0_NEPBS14_NLCA1_NLCB1_ONLL1_PGR2_PLR1_PKA1_SGROB0_SIA3_SS1_SU0_SUM0_SUS0_SPO0_SRVW0_SSO1_SVW4_SK3_SKFTR0_SKXCCM0_SGRO0_TDMI0_TIN1_TLDS1_TLDSMn1_ULSGRO0_USL1_UIOFGRO0_UPLRP0_USFGRO0_VSn1_VWA4_VWB1_WSGRA0_WSGRB0_WS64_WG32_8_1_WGM2_WGMXCC1_WGMXCCGn1
    SolutionIndex: 153
    SolutionNameMin: Cijk_Ailk_Bljk_S_B_Bias_HA_S_SAV_UserArgs_MT112x192x32_MI16x16x1_SN_LDSB1_AFC0_AG0_AFEM1_AFEM1_ASEM1_CLR1_CADS0_DTLA0_DTLB0_DTVA0_DTVB0_DTVMXSA0_DTVMXSB0_DTVSM0_DPLB0_EPS0_ELFLR0_EMLL0_FDSI0_GRPM1_GRVWA2_GRVWB4_GSU0_GSUAMB_GSUC0_GSUWGMRR0_GLS0_ISA950_IU1_K1_LDSTI0_LBSPPA0_LBSPPB768_LBSPPM0_LPA0_LPB16_LPM0_LRVWn1_LWPMn1_MIAV1_MIWT7_3_MO40_MGRIPM1_NTn1_NTA0_NTB4_NTC0_NTD0_NTM0_NEPBS0_NLCA7_NLCB1_ONLL1_PGR2_PLR1_PKA1_SGROB0_SIA3_SS1_SU0_SUM0_SUS0_SPO0_SRVW0_SSO4_SVW1_SK3_SKFTR0_SKXCCM0_SGRO0_TDMI0_TIN1_TLDS0_TLDSMn1_ULSGRO0_USL1_UIOFGRO0_UPLRP0_USFGRO0_VSn1_VWA1_VWB1_WSGRA0_WSGRB0_WS64_WG16_16_1_WGM32_WGMXCC16_WGMXCCGn1
    SolutionIndex: 154
    SolutionNameMin: Cijk_Ailk_Bljk_S_B_Bias_HA_S_SAV_UserArgs_MT256x160x32_MI16x16x1_SN_LDSB1_AFC0_AG1_AFEM1_AFEM1_ASEM1_CLR1_CADS0_DTLA0_DTLB0_DTVA0_DTVB0_DTVMXSA0_DTVMXSB0_DTVSM0_DPLB0_EPS0_ELFLR0_EMLLn1_FDSI0_GRPM1_GRVWA4_GRVWB4_GSU0_GSUAMB_GSUC0_GSUWGMRR0_GLS0_ISA950_IU1_K1_LDSTI0_LBSPPA0_LBSPPB128_LBSPPM0_LPA0_LPB8_LPM0_LRVWn1_LWPMn1_MIAV0_MIWT8_5_MO40_MGRIPM1_NTn1_NTA0_NTB0_NTC4_NTD4_NTM0_NEPBS14_NLCA1_NLCB1_ONLL1_PGR2_PLR1_PKA1_SGROB0_SIA3_SS1_SU0_SUM0_SUS0_SPO0_SRVW0_SSO1_SVW4_SK3_SKFTR0_SKXCCM0_SGRO0_TDMI0_TIN1_TLDS1_TLDSMn1_ULSGRO1_USL1_UIOFGRO0_UPLRP0_USFGRO1_VSn1_VWA4_VWB1_WSGRA0_WSGRB0_WS64_WG32_8_1_WGM2_WGMXCC1_WGMXCCGn1
    SolutionIndex: 155
    SolutionNameMin: Cijk_Ailk_Bljk_S_B_Bias_HA_S_SAV_UserArgs_MT320x128x32_MI16x16x1_SN_LDSB1_AFC0_AG1_AFEM1_AFEM1_ASEM1_CLR1_CADS0_DTLA0_DTLB0_DTVA0_DTVB0_DTVMXSA0_DTVMXSB0_DTVSM0_DPLB0_EPS0_ELFLR0_EMLLn1_FDSI0_GRPM1_GRVWA4_GRVWB4_GSU0_GSUAMB_GSUC0_GSUWGMRR0_GLS0_ISA950_IU1_K1_LDSTI0_LBSPPA0_LBSPPB256_LBSPPM0_LPA0_LPB8_LPM0_LRVWn1_LWPMn1_MIAV0_MIWT20_2_MO40_MGRIPM1_NTn1_NTA0_NTB0_NTC4_NTD4_NTM0_NEPBS16_NLCA5_NLCB1_ONLL1_PGR2_PLR1_PKA1_SGROB0_SIA3_SS1_SU0_SUM0_SUS0_SPO0_SRVW0_SSO1_SVW4_SK3_SKFTR0_SKXCCM0_SGRO0_TDMI0_TIN1_TLDS1_TLDSMn1_ULSGRO0_USL1_UIOFGRO0_UPLRP0_USFGRO1_VSn1_VWA4_VWB2_WSGRA2_WSGRB0_WS64_WG16_16_1_WGM2_WGMXCC4_WGMXCCGn1
    SolutionIndex: 156
    SolutionNameMin: Cijk_Ailk_Bljk_S_B_Bias_HA_S_SAV_UserArgs_MT128x192x32_MI16x16x1_SN_LDSB1_AFC0_AG1_AFEM1_AFEM1_ASEM1_CLR1_CADS0_DTLA0_DTLB0_DTVA0_DTVB0_DTVMXSA0_DTVMXSB0_DTVSM0_DPLB0_EPS1_ELFLR0_EMLLn1_FDSI0_GRPM1_GRVWA4_GRVWB4_GSU0_GSUAMB_GSUC0_GSUWGMRR0_GLS0_ISA950_IU1_K1_LDSTI0_LBSPPA0_LBSPPB256_LBSPPM0_LPA0_LPB8_LPM0_LRVWn1_LWPMn1_MIAV0_MIWT4_6_MO40_MGRIPM1_NTn1_NTA0_NTB0_NTC0_NTD0_NTM0_NEPBS0_NLCA1_NLCB1_ONLL1_PGR1_PLR1_PKA1_SGROB0_SIA3_SS1_SU16_SUM0_SUS256_SPO1_SRVW0_SSO4_SVW4_SK3_SKFTR0_SKXCCM0_SGRO0_TDMI0_TIN0_TLDS1_TLDSMn1_ULSGRO0_USL1_UIOFGRO0_UPLRP0_USFGRO0_VSn1_VWA4_VWB2_WSGRA0_WSGRB2_WS64_WG32_8_1_WGM2_WGMXCC8_WGMXCCGn1
    SolutionIndex: 157
    SolutionNameMin: Cijk_Ailk_Bljk_S_B_Bias_HA_S_SAV_UserArgs_MT384x128x32_MI16x16x1_SN_LDSB1_AFC0_AG1_AFEM1_AFEM1_ASEM1_CLR1_CADS0_DTLA0_DTLB0_DTVA0_DTVB0_DTVMXSA0_DTVMXSB0_DTVSM0_DPLB0_EPS0_ELFLR0_EMLL0_FDSI0_GRPM1_GRVWA4_GRVWB4_GSU0_GSUAMB_GSUC0_GSUWGMRR0_GLS0_ISA950_IU1_K1_LDSTI0_LBSPPA0_LBSPPB512_LBSPPM0_LPA0_LPB8_LPM0_LRVWn1_LWPMn1_MIAV0_MIWT12_4_MO40_MGRIPM1_NTn1_NTA0_NTB0_NTC4_NTD4_NTM0_NEPBS12_NLCA3_NLCB1_ONLL1_PGR2_PLR1_PKA1_SGROB0_SIA3_SS1_SU0_SUM0_SUS0_SPO0_SRVW0_SSO1_SVW4_SK3_SKFTR0_SKXCCM0_SGRO0_TDMI0_TIN1_TLDS1_TLDSMn1_ULSGRO1_USL1_UIOFGRO0_UPLRP0_USFGRO1_VSn1_VWA4_VWB4_WSGRA2_WSGRB2_WS64_WG32_8_1_WGM48_WGMXCC1_WGMXCCGn1
    SolutionIndex: 158
    SolutionNameMin: Cijk_Ailk_Bljk_S_B_Bias_HA_S_SAV_UserArgs_MT128x112x32_MI16x16x1_SN_LDSB1_AFC0_AG1_AFEM1_AFEM1_ASEM1_CLR1_CADS0_DTLA0_DTLB0_DTVA0_DTVB0_DTVMXSA0_DTVMXSB0_DTVSM0_DPLB0_EPS0_ELFLR0_EMLLn1_FDSI0_GRPM1_GRVWA2_GRVWB2_GSU0_GSUAMB_GSUC0_GSUWGMRR0_GLS0_ISA950_IU1_K1_LDSTI0_LBSPPA0_LBSPPB128_LBSPPM0_LPA0_LPB8_LPM0_LRVWn1_LWPMn1_MIAV0_MIWT2_7_MO40_MGRIPM1_NTn1_NTA0_NTB0_NTC0_NTD4_NTM0_NEPBS0_NLCA1_NLCB1_ONLL1_PGR2_PLR1_PKA1_SGROB0_SIA3_SS1_SU0_SUM0_SUS0_SPO0_SRVW0_SSO1_SVW2_SK3_SKFTR0_SKXCCM4_SGRO0_TDMI0_TIN1_TLDS1_TLDSMn1_ULSGRO1_USL1_UIOFGRO0_UPLRP0_USFGRO1_VSn1_VWA2_VWB1_WSGRA0_WSGRB2_WS64_WG64_4_1_WGM4_WGMXCC1_WGMXCCGn1
    SolutionIndex: 159
    SolutionNameMin: Cijk_Ailk_Bljk_S_B_Bias_HA_S_SAV_UserArgs_MT256x128x32_MI16x16x1_SN_LDSB1_AFC0_AG1_AFEM1_AFEM1_ASEM1_CLR0_CADS0_DTLA0_DTLB0_DTVA0_DTVB0_DTVMXSA0_DTVMXSB0_DTVSM0_DPLB0_EPS0_ELFLR0_EMLLn1_FDSI0_GRPM1_GRVWA4_GRVWB4_GSU0_GSUAMB_GSUC0_GSUWGMRR0_GLS0_ISA950_IU1_K1_LDSTI1_LBSPPA0_LBSPPB0_LBSPPM0_LPA0_LPB0_LPM0_LRVWn1_LWPMn1_MIAV0_MIWT4_8_MO40_MGRIPM1_NTn1_NTA0_NTB0_NTC4_NTD4_NTM0_NEPBS0_NLCA1_NLCB1_ONLL1_PGR2_PLR1_PKA1_SGROB0_SIA3_SS1_SU0_SUM0_SUS0_SPO1_SRVW0_SSO1_SVW4_SK3_SKFTR0_SKXCCM0_SGRO0_TDMI0_TIN1_TLDS0_TLDSMn1_ULSGRO0_USL1_UIOFGRO0_UPLRP0_USFGRO1_VSn1_VWA4_VWB4_WSGRA2_WSGRB0_WS64_WG64_4_1_WGM2_WGMXCC4_WGMXCCGn1
    SolutionIndex: 160
    SolutionNameMin: Cijk_Ailk_Bljk_S_B_Bias_HA_S_SAV_UserArgs_MT128x112x32_MI16x16x1_SN_LDSB1_AFC0_AG0_AFEM1_AFEM1_ASEM1_CLR1_CADS0_DTLA0_DTLB0_DTVA0_DTVB0_DTVMXSA0_DTVMXSB0_DTVSM0_DPLB0_EPS1_ELFLR0_EMLLn1_FDSI0_GRPM1_GRVWA1_GRVWB2_GSU0_GSUAMB_GSUC0_GSUWGMRR0_GLS0_ISA950_IU1_K1_LDSTI0_LBSPPA0_LBSPPB128_LBSPPM0_LPA0_LPB8_LPM0_LRVWn1_LWPMn1_MIAV0_MIWT2_7_MO40_MGRIPM1_NTn1_NTA0_NTB0_NTC4_NTD4_NTM0_NEPBS10_NLCA1_NLCB1_ONLL1_PGR1_PLR1_PKA1_SGROB0_SIA3_SS1_SU0_SUM0_SUS0_SPO0_SRVW0_SSO0_SVW2_SK3_SKFTR0_SKXCCM0_SGRO0_TDMI0_TIN1_TLDS1_TLDSMn1_ULSGRO0_USL1_UIOFGRO0_UPLRP0_USFGRO1_VSn1_VWA2_VWB1_WSGRA0_WSGRB0_WS64_WG64_4_1_WGM4_WGMXCC1_WGMXCCGn1
    SolutionIndex: 161
    SolutionNameMin: Cijk_Ailk_Bljk_S_B_Bias_HA_S_SAV_UserArgs_MT256x128x32_MI32x32x1_SN_LDSB1_AFC0_AG1_AFEM1_AFEM1_ASEM1_CLR1_CADS0_DTLA0_DTLB0_DTVA0_DTVB0_DTVMXSA0_DTVMXSB0_DTVSM0_DPLB0_EPS0_ELFLR0_EMLLn1_FDSI0_GRPM1_GRVWA4_GRVWB4_GSU0_GSUAMB_GSUC0_GSUWGMRR0_GLS0_ISA950_IU1_K1_LDSTI0_LBSPPA0_LBSPPB128_LBSPPM0_LPA0_LPB4_LPM0_LRVWn1_LWPMn1_MIAV0_MIWT8_1_MO40_MGRIPM1_NTn1_NTA0_NTB0_NTC4_NTD4_NTM0_NEPBS12_NLCA1_NLCB1_ONLL1_PGR2_PLR1_PKA1_SGROB0_SIA3_SS1_SU8_SUM0_SUS128_SPO0_SRVW0_SSO1_SVW4_SK3_SKFTR0_SKXCCM0_SGRO0_TDMI0_TIN0_TLDS1_TLDSMn1_ULSGRO0_USL1_UIOFGRO0_UPLRP0_USFGRO1_VSn1_VWA4_VWB1_WSGRA2_WSGRB0_WS64_WG32_8_1_WGMn1_WGMXCC1_WGMXCCGn1
    SolutionIndex: 162
    SolutionNameMin: Cijk_Ailk_Bljk_S_B_Bias_HA_S_SAV_UserArgs_MT256x192x32_MI16x16x1_SN_LDSB1_AFC0_AG1_AFEM1_AFEM1_ASEM1_CLR1_CADS0_DTLA0_DTLB0_DTVA0_DTVB0_DTVMXSA0_DTVMXSB0_DTVSM0_DPLB0_EPS0_ELFLR0_EMLL0_FDSI0_GRPM1_GRVWA4_GRVWB4_GSU0_GSUAMB_GSUC0_GSUWGMRR0_GLS0_ISA950_IU1_K1_LDSTI0_LBSPPA0_LBSPPB512_LBSPPM0_LPA0_LPB8_LPM0_LRVWn1_LWPMn1_MIAV0_MIWT4_12_MO40_MGRIPM1_NTn1_NTA0_NTB0_NTC4_NTD4_NTM0_NEPBS12_NLCA1_NLCB1_ONLL1_PGR2_PLR1_PKA1_SGROB0_SIA3_SS1_SU0_SUM0_SUS0_SPO1_SRVW0_SSO1_SVW4_SK3_SKFTR0_SKXCCM0_SGRO0_TDMI0_TIN1_TLDS1_TLDSMn1_ULSGRO1_USL1_UIOFGRO0_UPLRP0_USFGRO0_VSn1_VWA4_VWB4_WSGRA2_WSGRB2_WS64_WG64_4_1_WGMn1_WGMXCC1_WGMXCCGn1
    SolutionIndex: 163
    SolutionNameMin: Cijk_Ailk_Bljk_S_B_Bias_HA_S_SAV_UserArgs_MT192x192x32_MI16x16x1_SN_LDSB1_AFC0_AG1_AFEM1_AFEM1_ASEM1_CLR1_CADS0_DTLA0_DTLB0_DTVA0_DTVB0_DTVMXSA0_DTVMXSB0_DTVSM0_DPLB0_EPS0_ELFLR0_EMLL0_FDSI0_GRPM1_GRVWA4_GRVWB4_GSU0_GSUAMB_GSUC0_GSUWGMRR0_GLS0_ISA950_IU1_K1_LDSTI0_LBSPPA0_LBSPPB128_LBSPPM0_LPA0_LPB8_LPM0_LRVWn1_LWPMn1_MIAV0_MIWT12_3_MO40_MGRIPM1_NTn1_NTA0_NTB0_NTC4_NTD4_NTM0_NEPBS12_NLCA3_NLCB1_ONLL1_PGR2_PLR1_PKA1_SGROB0_SIA3_SS1_SU0_SUM0_SUS0_SPO1_SRVW0_SSO1_SVW4_SK3_SKFTR0_SKXCCM8_SGRO0_TDMI0_TIN1_TLDS1_TLDSMn1_ULSGRO0_USL1_UIOFGRO0_UPLRP0_USFGRO1_VSn1_VWA4_VWB1_WSGRA2_WSGRB0_WS64_WG16_16_1_WGMn2_WGMXCC8_WGMXCCGn1
    SolutionIndex: 164
    SolutionNameMin: Cijk_Ailk_Bljk_S_B_Bias_HA_S_SAV_UserArgs_MT224x288x32_MI16x16x1_SN_LDSB1_AFC0_AG1_AFEM1_AFEM1_ASEM1_CLR1_CADS0_DTLA0_DTLB0_DTVA0_DTVB0_DTVMXSA0_DTVMXSB0_DTVSM0_DPLB0_EPS0_ELFLR0_EMLLn1_FDSI0_GRPM1_GRVWA4_GRVWB4_GSU0_GSUAMB_GSUC0_GSUWGMRR0_GLS0_ISA950_IU1_K1_LDSTI0_LBSPPA3584_LBSPPB128_LBSPPM0_LPA16_LPB8_LPM0_LRVWn1_LWPMn1_MIAV0_MIWT7_9_MO40_MGRIPM1_NTn1_NTA0_NTB0_NTC0_NTD0_NTM0_NEPBS0_NLCA7_NLCB1_ONLL1_PGR2_PLR1_PKA1_SGROB0_SIA3_SS0_SU0_SUM0_SUS0_SPO0_SRVW0_SSO1_SVW4_SK3_SKFTR0_SKXCCM0_SGRO0_TDMI0_TIN0_TLDS1_TLDSMn1_ULSGRO0_USL1_UIOFGRO0_UPLRP0_USFGRO1_VSn1_VWA1_VWB1_WSGRA2_WSGRB0_WS64_WG32_8_1_WGM8_WGMXCC1_WGMXCCGn1
    SolutionIndex: 165
    SolutionNameMin: Cijk_Ailk_Bljk_S_B_Bias_HA_S_SAV_UserArgs_MT64x320x32_MI16x16x1_SN_LDSB1_AFC0_AG1_AFEM1_AFEM1_ASEM1_CLR1_CADS0_DTLA0_DTLB0_DTVA0_DTVB0_DTVMXSA0_DTVMXSB0_DTVSM0_DPLB0_EPS1_ELFLR0_EMLLn1_FDSI0_GRPM1_GRVWA1_GRVWB4_GSU0_GSUAMB_GSUC0_GSUWGMRR0_GLS0_ISA950_IU1_K1_LDSTI0_LBSPPA512_LBSPPB128_LBSPPM0_LPA8_LPB8_LPM0_LRVWn1_LWPMn1_MIAV0_MIWT4_5_MO40_MGRIPM1_NTn1_NTA0_NTB0_NTC0_NTD0_NTM0_NEPBS16_NLCA1_NLCB1_ONLL1_PGR1_PLR1_PKA1_SGROB0_SIA3_SS1_SU8_SUM0_SUS128_SPO0_SRVW0_SSO1_SVW4_SK3_SKFTR0_SKXCCM0_SGRO0_TDMI0_TIN0_TLDS2_TLDSMn1_ULSGRO0_USL1_UIOFGRO0_UPLRP0_USFGRO1_VSn1_VWA4_VWB1_WSGRA2_WSGRB2_WS64_WG16_16_1_WGM8_WGMXCC1_WGMXCCGn1
    SolutionIndex: 166
    SolutionNameMin: Cijk_Ailk_Bljk_S_B_Bias_HA_S_SAV_UserArgs_MT128x160x32_MI16x16x1_SN_LDSB1_AFC0_AG0_AFEM1_AFEM1_ASEM1_CLR1_CADS0_DTLA0_DTLB0_DTVA0_DTVB0_DTVMXSA0_DTVMXSB0_DTVSM0_DPLB0_EPS0_ELFLR0_EMLL0_FDSI0_GRPM1_GRVWA2_GRVWB4_GSU0_GSUAMB_GSUC0_GSUWGMRR0_GLS0_ISA950_IU1_K1_LDSTI0_LBSPPA0_LBSPPB128_LBSPPM0_LPA0_LPB8_LPM0_LRVWn1_LWPMn1_MIAV0_MIWT4_5_MO40_MGRIPM1_NTn1_NTA0_NTB0_NTC4_NTD4_NTM0_NEPBS16_NLCA1_NLCB1_ONLL1_PGR2_PLR1_PKA1_SGROB0_SIA3_SS1_SU0_SUM0_SUS0_SPO0_SRVW0_SSO1_SVW4_SK3_SKFTR0_SKXCCM0_SGRO0_TDMI0_TIN1_TLDS1_TLDSMn1_ULSGRO0_USL1_UIOFGRO0_UPLRP0_USFGRO1_VSn1_VWA4_VWB1_WSGRA0_WSGRB2_WS64_WG32_8_1_WGM8_WGMXCC4_WGMXCCGn1
    SolutionIndex: 167
    SolutionNameMin: Cijk_Ailk_Bljk_S_B_Bias_HA_S_SAV_UserArgs_MT256x80x32_MI16x16x1_SN_LDSB1_AFC0_AG1_AFEM1_AFEM1_ASEM1_CLR0_CADS0_DTLA0_DTLB0_DTVA0_DTVB0_DTVMXSA0_DTVMXSB0_DTVSM0_DPLB0_EPS0_ELFLR0_EMLL0_FDSI0_GRPM1_GRVWA2_GRVWB2_GSU0_GSUAMB_GSUC0_GSUWGMRR0_GLS0_ISA950_IU1_K1_LDSTI1_LBSPPA0_LBSPPB0_LBSPPM0_LPA0_LPB0_LPM0_LRVWn1_LWPMn1_MIAV1_MIWT4_5_MO40_MGRIPM1_NTn1_NTA0_NTB0_NTC0_NTD0_NTM0_NEPBS10_NLCA2_NLCB1_ONLL1_PGR2_PLR1_PKA1_SGROB0_SIA3_SS1_SU0_SUM0_SUS0_SPO0_SRVW0_SSO1_SVW4_SK3_SKFTR0_SKXCCM0_SGRO0_TDMI0_TIN1_TLDS0_TLDSMn1_ULSGRO0_USL1_UIOFGRO0_UPLRP0_USFGRO0_VSn1_VWA4_VWB1_WSGRA2_WSGRB0_WS64_WG64_4_1_WGM8_WGMXCC4_WGMXCCGn1
    SolutionIndex: 168
    SolutionNameMin: Cijk_Ailk_Bljk_S_B_Bias_HA_S_SAV_UserArgs_MT256x112x32_MI16x16x1_SN_LDSB1_AFC0_AG1_AFEM1_AFEM1_ASEM1_CLR0_CADS0_DTLA0_DTLB0_DTVA0_DTVB0_DTVMXSA0_DTVMXSB0_DTVSM0_DPLB0_EPS0_ELFLR0_EMLLn1_FDSI0_GRPM1_GRVWA4_GRVWB1_GSU0_GSUAMB_GSUC0_GSUWGMRR0_GLS0_ISA950_IU1_K1_LDSTI1_LBSPPA0_LBSPPB0_LBSPPM0_LPA0_LPB0_LPM0_LRVWn1_LWPMn1_MIAV0_MIWT4_7_MO40_MGRIPM1_NTn1_NTA0_NTB0_NTC0_NTD0_NTM0_NEPBS16_NLCA1_NLCB1_ONLL1_PGR2_PLR1_PKA1_SGROB0_SIA3_SS1_SU0_SUM0_SUS0_SPO0_SRVW0_SSO1_SVW4_SK3_SKFTR0_SKXCCM0_SGRO0_TDMI0_TIN1_TLDS0_TLDSMn1_ULSGRO0_USL1_UIOFGRO0_UPLRP0_USFGRO1_VSn1_VWA4_VWB1_WSGRA2_WSGRB0_WS64_WG64_4_1_WGMn1_WGMXCC8_WGMXCCGn1
    SolutionIndex: 169
    SolutionNameMin: Cijk_Ailk_Bljk_S_B_Bias_HA_S_SAV_UserArgs_MT384x64x32_MI16x16x1_SN_LDSB1_AFC0_AG1_AFEM1_AFEM1_ASEM1_CLR1_CADS0_DTLA0_DTLB0_DTVA0_DTVB0_DTVMXSA0_DTVMXSB0_DTVSM0_DPLB0_EPS0_ELFLR0_EMLL0_FDSI0_GRPM1_GRVWA4_GRVWB4_GSU0_GSUAMB_GSUC0_GSUWGMRR0_GLS0_ISA950_IU1_K1_LDSTI0_LBSPPA0_LBSPPB512_LBSPPM0_LPA0_LPB8_LPM0_LRVWn1_LWPMn1_MIAV0_MIWT6_4_MO40_MGRIPM1_NTn1_NTA0_NTB0_NTC4_NTD4_NTM0_NEPBS16_NLCA3_NLCB1_ONLL1_PGR2_PLR1_PKA1_SGROB0_SIA3_SS1_SU0_SUM0_SUS0_SPO0_SRVW0_SSO0_SVW2_SK3_SKFTR0_SKXCCM0_SGRO0_TDMI0_TIN1_TLDS1_TLDSMn1_ULSGRO0_USL1_UIOFGRO0_UPLRP0_USFGRO0_VSn1_VWA2_VWB4_WSGRA2_WSGRB0_WS64_WG64_4_1_WGM16_WGMXCC16_WGMXCCGn1
    SolutionIndex: 170
    SolutionNameMin: Cijk_Ailk_Bljk_S_B_Bias_HA_S_SAV_UserArgs_MT96x192x32_MI16x16x1_SN_LDSB1_AFC0_AG1_AFEM1_AFEM1_ASEM1_CLR0_CADS0_DTLA0_DTLB0_DTVA0_DTVB0_DTVMXSA0_DTVMXSB0_DTVSM0_DPLB0_EPS0_ELFLR0_EMLLn1_FDSI0_GRPM1_GRVWA4_GRVWB4_GSU0_GSUAMB_GSUC0_GSUWGMRR0_GLS0_ISA950_IU1_K1_LDSTI1_LBSPPA0_LBSPPB768_LBSPPM0_LPA0_LPB16_LPM0_LRVWn1_LWPMn1_MIAV1_MIWT6_3_MO40_MGRIPM1_NTn1_NTA0_NTB0_NTC4_NTD4_NTM0_NEPBS10_NLCA3_NLCB1_ONLL1_PGR2_PLR1_PKA1_SGROB0_SIA3_SS1_SU0_SUM0_SUS0_SPO1_SRVW0_SSO0_SVW2_SK3_SKFTR0_SKXCCM0_SGRO0_TDMI0_TIN1_TLDS0_TLDSMn1_ULSGRO1_USL1_UIOFGRO0_UPLRP0_USFGRO0_VSn1_VWA2_VWB1_WSGRA2_WSGRB2_WS64_WG16_16_1_WGM4_WGMXCC4_WGMXCCGn1
    SolutionIndex: 171
    SolutionNameMin: Cijk_Ailk_Bljk_S_B_Bias_HA_S_SAV_UserArgs_MT256x80x32_MI16x16x1_SN_LDSB1_AFC0_AG1_AFEM1_AFEM1_ASEM1_CLR1_CADS0_DTLA0_DTLB0_DTVA0_DTVB0_DTVMXSA0_DTVMXSB0_DTVSM0_DPLB0_EPS0_ELFLR0_EMLLn1_FDSI0_GRPM1_GRVWA4_GRVWB2_GSU0_GSUAMB_GSUC0_GSUWGMRR0_GLS0_ISA950_IU1_K1_LDSTI0_LBSPPA0_LBSPPB128_LBSPPM0_LPA0_LPB8_LPM0_LRVWn1_LWPMn1_MIAV0_MIWT4_5_MO40_MGRIPM1_NTn1_NTA0_NTB0_NTC4_NTD0_NTM0_NEPBS8_NLCA1_NLCB1_ONLL1_PGR2_PLR1_PKA1_SGROB0_SIA3_SS1_SU0_SUM0_SUS0_SPO0_SRVW0_SSO1_SVW4_SK3_SKFTR0_SKXCCM0_SGRO0_TDMI0_TIN1_TLDS1_TLDSMn1_ULSGRO0_USL1_UIOFGRO0_UPLRP0_USFGRO1_VSn1_VWA4_VWB1_WSGRA2_WSGRB2_WS64_WG64_4_1_WGM48_WGMXCC1_WGMXCCGn1
    SolutionIndex: 172
    SolutionNameMin: Cijk_Ailk_Bljk_S_B_Bias_HA_S_SAV_UserArgs_MT128x192x32_MI32x32x1_SN_LDSB1_AFC0_AG1_AFEM1_AFEM1_ASEM1_CLR1_CADS0_DTLA0_DTLB0_DTVA0_DTVB0_DTVMXSA0_DTVMXSB0_DTVSM0_DPLB0_EPS0_ELFLR0_EMLLn1_FDSI0_GRPM1_GRVWA1_GRVWB4_GSU0_GSUAMB_GSUC0_GSUWGMRR0_GLS0_ISA950_IU1_K1_LDSTI0_LBSPPA0_LBSPPB128_LBSPPM0_LPA0_LPB4_LPM0_LRVWn1_LWPMn1_MIAV0_MIWT2_3_MO40_MGRIPM1_NTn1_NTA0_NTB0_NTC0_NTD0_NTM0_NEPBS12_NLCA2_NLCB1_ONLL1_PGR2_PLR1_PKA1_SGROB0_SIA3_SS1_SU0_SUM0_SUS0_SPO0_SRVW0_SSO0_SVW2_SK3_SKFTR0_SKXCCM0_SGRO0_TDMI0_TIN1_TLDS1_TLDSMn1_ULSGRO0_USL1_UIOFGRO0_UPLRP0_USFGRO1_VSn1_VWA2_VWB1_WSGRA2_WSGRB0_WS64_WG64_4_1_WGMn32_WGMXCC8_WGMXCCGn1
    SolutionIndex: 173
    SolutionNameMin: Cijk_Ailk_Bljk_S_B_Bias_HA_S_SAV_UserArgs_MT64x384x32_MI16x16x1_SN_LDSB1_AFC0_AG1_AFEM1_AFEM1_ASEM1_CLR1_CADS0_DTLA0_DTLB0_DTVA0_DTVB0_DTVMXSA0_DTVMXSB0_DTVSM0_DPLB0_EPS1_ELFLR0_EMLLn1_FDSI0_GRPM1_GRVWA4_GRVWB4_GSU0_GSUAMB_GSUC0_GSUWGMRR0_GLS0_ISA950_IU1_K1_LDSTI0_LBSPPA512_LBSPPB256_LBSPPM0_LPA8_LPB8_LPM0_LRVWn1_LWPMn1_MIAV0_MIWT4_6_MO40_MGRIPM1_NTn1_NTA0_NTB0_NTC4_NTD4_NTM0_NEPBS8_NLCA1_NLCB1_ONLL1_PGR1_PLR1_PKA1_SGROB0_SIA3_SS1_SU0_SUM0_SUS0_SPO0_SRVW0_SSO1_SVW4_SK3_SKFTR0_SKXCCM0_SGRO0_TDMI0_TIN0_TLDS2_TLDSMn1_ULSGRO0_USL1_UIOFGRO0_UPLRP0_USFGRO1_VSn1_VWA4_VWB2_WSGRA0_WSGRB2_WS64_WG16_16_1_WGM4_WGMXCC2_WGMXCCGn1
    SolutionIndex: 174
    SolutionNameMin: Cijk_Ailk_Bljk_S_B_Bias_HA_S_SAV_UserArgs_MT128x128x32_MI32x32x1_SN_LDSB1_AFC0_AG1_AFEM1_AFEM1_ASEM1_CLR1_CADS0_DTLA0_DTLB0_DTVA0_DTVB0_DTVMXSA0_DTVMXSB0_DTVSM0_DPLB0_EPS0_ELFLR0_EMLL0_FDSI0_GRPM1_GRVWA2_GRVWB2_GSU0_GSUAMB_GSUC0_GSUWGMRR0_GLS0_ISA950_IU1_K1_LDSTI0_LBSPPA0_LBSPPB128_LBSPPM0_LPA0_LPB4_LPM0_LRVWn1_LWPMn1_MIAV0_MIWT4_1_MO40_MGRIPM1_NTn1_NTA0_NTB0_NTC4_NTD0_NTM0_NEPBS10_NLCA1_NLCB1_ONLL1_PGR2_PLR1_PKA1_SGROB0_SIA3_SS1_SU0_SUM0_SUS0_SPO1_SRVW0_SSO0_SVW4_SK3_SKFTR0_SKXCCM0_SGRO0_TDMI0_TIN1_TLDS1_TLDSMn1_ULSGRO1_USL1_UIOFGRO0_UPLRP0_USFGRO1_VSn1_VWA4_VWB1_WSGRA2_WSGRB0_WS64_WG32_8_1_WGMn32_WGMXCC4_WGMXCCGn1
    SolutionIndex: 175
    SolutionNameMin: Cijk_Ailk_Bljk_S_B_Bias_HA_S_SAV_UserArgs_MT144x192x32_MI16x16x1_SN_LDSB1_AFC0_AG0_AFEM1_AFEM1_ASEM1_CLR1_CADS0_DTLA0_DTLB0_DTVA0_DTVB0_DTVMXSA0_DTVMXSB0_DTVSM0_DPLB0_EPS0_ELFLR0_EMLL0_FDSI0_GRPM1_GRVWA2_GRVWB4_GSU0_GSUAMB_GSUC0_GSUWGMRR0_GLS0_ISA950_IU1_K1_LDSTI0_LBSPPA128_LBSPPB128_LBSPPM0_LPA8_LPB8_LPM0_LRVWn1_LWPMn1_MIAV0_MIWT9_3_MO40_MGRIPM1_NTn1_NTA0_NTB0_NTC0_NTD4_NTM0_NEPBS16_NLCA9_NLCB1_ONLL1_PGR2_PLR1_PKA1_SGROB0_SIA3_SS0_SU0_SUM0_SUS0_SPO0_SRVW0_SSO0_SVW4_SK3_SKFTR0_SKXCCM8_SGRO0_TDMI0_TIN1_TLDS2_TLDSMn1_ULSGRO0_USL1_UIOFGRO0_UPLRP0_USFGRO0_VSn1_VWA1_VWB1_WSGRA2_WSGRB2_WS64_WG16_16_1_WGMn4_WGMXCC8_WGMXCCGn1
    SolutionIndex: 176
    SolutionNameMin: Cijk_Ailk_Bljk_S_B_Bias_HA_S_SAV_UserArgs_MT224x64x32_MI16x16x1_SN_LDSB1_AFC0_AG1_AFEM1_AFEM1_ASEM1_CLR1_CADS0_DTLA0_DTLB0_DTVA0_DTVB0_DTVMXSA0_DTVMXSB0_DTVSM0_DPLB0_EPS0_ELFLR0_EMLLn1_FDSI0_GRPM1_GRVWA4_GRVWB4_GSU0_GSUAMB_GSUC0_GSUWGMRR0_GLS0_ISA950_IU1_K1_LDSTI0_LBSPPA256_LBSPPB128_LBSPPM0_LPA8_LPB8_LPM0_LRVWn1_LWPMn1_MIAV0_MIWT14_1_MO40_MGRIPM1_NTn1_NTA0_NTB0_NTC0_NTD0_NTM0_NEPBS14_NLCA7_NLCB1_ONLL1_PGR2_PLR1_PKA1_SGROB0_SIA3_SS1_SU0_SUM0_SUS0_SPO0_SRVW0_SSO1_SVW2_SK3_SKFTR0_SKXCCM0_SGRO0_TDMI0_TIN1_TLDS2_TLDSMn1_ULSGRO1_USL1_UIOFGRO0_UPLRP0_USFGRO0_VSn1_VWA2_VWB1_WSGRA0_WSGRB0_WS64_WG16_16_1_WGM8_WGMXCC2_WGMXCCGn1
    SolutionIndex: 177
    SolutionNameMin: Cijk_Ailk_Bljk_S_B_Bias_HA_S_SAV_UserArgs_MT256x96x32_MI16x16x1_SN_LDSB1_AFC0_AG0_AFEM1_AFEM1_ASEM1_CLR1_CADS0_DTLA0_DTLB0_DTVA0_DTVB0_DTVMXSA0_DTVMXSB0_DTVSM0_DPLB0_EPS1_ELFLR0_EMLLn1_FDSI0_GRPM1_GRVWA4_GRVWB4_GSU0_GSUAMB_GSUC0_GSUWGMRR0_GLS0_ISA950_IU1_K1_LDSTI0_LBSPPA0_LBSPPB0_LBSPPM0_LPA0_LPB0_LPM0_LRVWn1_LWPMn1_MIAV0_MIWT4_6_MO40_MGRIPM1_NTn1_NTA0_NTB0_NTC4_NTD4_NTM0_NEPBS8_NLCA1_NLCB1_ONLL1_PGR1_PLR1_PKA1_SGROB0_SIA3_SS1_SU0_SUM0_SUS0_SPO0_SRVW0_SSO0_SVW4_SK3_SKFTR0_SKXCCM0_SGRO0_TDMI0_TIN1_TLDS0_TLDSMn1_ULSGRO0_USL1_UIOFGRO0_UPLRP0_USFGRO0_VSn1_VWA4_VWB2_WSGRA0_WSGRB0_WS64_WG64_4_1_WGMn2_WGMXCC8_WGMXCCGn1
    SolutionIndex: 178
    SolutionNameMin: Cijk_Ailk_Bljk_S_B_Bias_HA_S_SAV_UserArgs_MT160x128x32_MI16x16x1_SN_LDSB1_AFC0_AG1_AFEM1_AFEM1_ASEM1_CLR1_CADS0_DTLA0_DTLB0_DTVA0_DTVB0_DTVMXSA0_DTVMXSB0_DTVSM0_DPLB0_EPS1_ELFLR0_EMLL0_FDSI0_GRPM1_GRVWA1_GRVWB4_GSU0_GSUAMB_GSUC0_GSUWGMRR0_GLS0_ISA950_IU1_K1_LDSTI0_LBSPPA256_LBSPPB256_LBSPPM0_LPA8_LPB8_LPM0_LRVWn1_LWPMn1_MIAV0_MIWT10_2_MO40_MGRIPM1_NTn1_NTA0_NTB0_NTC4_NTD4_NTM0_NEPBS14_NLCA5_NLCB1_ONLL1_PGR1_PLR1_PKA1_SGROB0_SIA3_SS1_SU0_SUM0_SUS0_SPO0_SRVW0_SSO0_SVW2_SK3_SKFTR0_SKXCCM0_SGRO0_TDMI0_TIN1_TLDS2_TLDSMn1_ULSGRO0_USL1_UIOFGRO0_UPLRP0_USFGRO1_VSn1_VWA2_VWB2_WSGRA2_WSGRB0_WS64_WG16_16_1_WGM4_WGMXCC8_WGMXCCGn1
    SolutionIndex: 179
    SolutionNameMin: Cijk_Ailk_Bljk_S_B_Bias_HA_S_SAV_UserArgs_MT128x192x32_MI16x16x1_SN_LDSB1_AFC0_AG0_AFEM1_AFEM1_ASEM1_CLR1_CADS0_DTLA0_DTLB0_DTVA0_DTVB0_DTVMXSA0_DTVMXSB0_DTVSM0_DPLB0_EPS1_ELFLR0_EMLL0_FDSI0_GRPM1_GRVWA1_GRVWB4_GSU0_GSUAMB_GSUC0_GSUWGMRR0_GLS0_ISA950_IU1_K1_LDSTI0_LBSPPA512_LBSPPB128_LBSPPM0_LPA8_LPB8_LPM0_LRVWn1_LWPMn1_MIAV0_MIWT8_3_MO40_MGRIPM1_NTn1_NTA0_NTB0_NTC0_NTD0_NTM0_NEPBS0_NLCA2_NLCB1_ONLL1_PGR1_PLR1_PKA1_SGROB0_SIA3_SS1_SU0_SUM0_SUS0_SPO1_SRVW0_SSO0_SVW4_SK3_SKFTR0_SKXCCM0_SGRO0_TDMI0_TIN1_TLDS2_TLDSMn1_ULSGRO0_USL1_UIOFGRO0_UPLRP0_USFGRO1_VSn1_VWA4_VWB1_WSGRA2_WSGRB0_WS64_WG16_16_1_WGM2_WGMXCC4_WGMXCCGn1
    SolutionIndex: 180
    SolutionNameMin: Cijk_Ailk_Bljk_S_B_Bias_HA_S_SAV_UserArgs_MT128x192x32_MI16x16x1_SN_LDSB1_AFC0_AG0_AFEM1_AFEM1_ASEM1_CLR1_CADS0_DTLA0_DTLB0_DTVA0_DTVB0_DTVMXSA0_DTVMXSB0_DTVSM0_DPLB0_EPS1_ELFLR0_EMLLn1_FDSI0_GRPM1_GRVWA2_GRVWB4_GSU0_GSUAMB_GSUC0_GSUWGMRR0_GLS0_ISA950_IU1_K1_LDSTI0_LBSPPA0_LBSPPB128_LBSPPM0_LPA0_LPB8_LPM0_LRVWn1_LWPMn1_MIAV0_MIWT8_3_MO40_MGRIPM1_NTn1_NTA0_NTB0_NTC4_NTD4_NTM0_NEPBS12_NLCA1_NLCB1_ONLL1_PGR1_PLR1_PKA1_SGROB0_SIA3_SS1_SU8_SUM0_SUS256_SPO1_SRVW0_SSO1_SVW4_SK3_SKFTR0_SKXCCM0_SGRO0_TDMI0_TIN0_TLDS1_TLDSMn1_ULSGRO0_USL1_UIOFGRO0_UPLRP0_USFGRO0_VSn1_VWA4_VWB1_WSGRA2_WSGRB2_WS64_WG16_16_1_WGMn4_WGMXCC8_WGMXCCGn1
    SolutionIndex: 181
    SolutionNameMin: Cijk_Ailk_Bljk_S_B_Bias_HA_S_SAV_UserArgs_MT160x128x32_MI16x16x1_SN_LDSB1_AFC0_AG1_AFEM1_AFEM1_ASEM1_CLR1_CADS0_DTLA0_DTLB0_DTVA0_DTVB0_DTVMXSA0_DTVMXSB0_DTVSM0_DPLB0_EPS1_ELFLR0_EMLLn1_FDSI0_GRPM1_GRVWA1_GRVWB4_GSU0_GSUAMB_GSUC0_GSUWGMRR0_GLS0_ISA950_IU1_K1_LDSTI0_LBSPPA256_LBSPPB256_LBSPPM0_LPA8_LPB8_LPM0_LRVWn1_LWPMn1_MIAV1_MIWT10_2_MO40_MGRIPM1_NTn1_NTA0_NTB0_NTC0_NTD0_NTM0_NEPBS16_NLCA5_NLCB1_ONLL1_PGR1_PLR1_PKA1_SGROB0_SIA3_SS1_SU0_SUM0_SUS0_SPO0_SRVW0_SSO1_SVW2_SK3_SKFTR0_SKXCCM0_SGRO0_TDMI0_TIN1_TLDS2_TLDSMn1_ULSGRO0_USL1_UIOFGRO0_UPLRP0_USFGRO1_VSn1_VWA2_VWB2_WSGRA0_WSGRB2_WS64_WG16_16_1_WGM8_WGMXCC1_WGMXCCGn1
    SolutionIndex: 182
    SolutionNameMin: Cijk_Ailk_Bljk_S_B_Bias_HA_S_SAV_UserArgs_MT256x80x32_MI16x16x1_SN_LDSB1_AFC0_AG1_AFEM1_AFEM1_ASEM1_CLR1_CADS0_DTLA0_DTLB0_DTVA0_DTVB0_DTVMXSA0_DTVMXSB0_DTVSM0_DPLB0_EPS0_ELFLR0_EMLLn1_FDSI0_GRPM1_GRVWA4_GRVWB2_GSU0_GSUAMB_GSUC0_GSUWGMRR0_GLS0_ISA950_IU1_K1_LDSTI0_LBSPPA0_LBSPPB128_LBSPPM0_LPA0_LPB8_LPM0_LRVWn1_LWPMn1_MIAV0_MIWT4_5_MO40_MGRIPM1_NTn1_NTA0_NTB0_NTC4_NTD4_NTM0_NEPBS12_NLCA1_NLCB1_ONLL1_PGR2_PLR1_PKA1_SGROB0_SIA3_SS1_SU8_SUM0_SUS256_SPO1_SRVW0_SSO1_SVW4_SK3_SKFTR0_SKXCCM0_SGRO0_TDMI0_TIN0_TLDS1_TLDSMn1_ULSGRO1_USL1_UIOFGRO0_UPLRP0_USFGRO1_VSn1_VWA4_VWB1_WSGRA2_WSGRB2_WS64_WG64_4_1_WGMn2_WGMXCC32_WGMXCCGn1
    SolutionIndex: 183
    SolutionNameMin: Cijk_Ailk_Bljk_S_B_Bias_HA_S_SAV_UserArgs_MT64x128x32_MI16x16x1_SN_LDSB1_AFC0_AG1_AFEM1_AFEM1_ASEM1_CLR1_CADS0_DTLA0_DTLB0_DTVA0_DTVB0_DTVMXSA0_DTVMXSB0_DTVSM0_DPLB0_EPS1_ELFLR0_EMLL0_FDSI0_GRPM1_GRVWA1_GRVWB4_GSU0_GSUAMB_GSUC0_GSUWGMRR0_GLS0_ISA950_IU1_K1_LDSTI0_LBSPPA0_LBSPPB256_LBSPPM0_LPA0_LPB8_LPM0_LRVWn1_LWPMn1_MIAV1_MIWT4_2_MO40_MGRIPM1_NTn1_NTA0_NTB0_NTC4_NTD4_NTM0_NEPBS10_NLCA1_NLCB1_ONLL1_PGR1_PLR1_PKA1_SGROB0_SIA3_SS1_SU0_SUM0_SUS0_SPO0_SRVW0_SSO0_SVW4_SK3_SKFTR0_SKXCCM4_SGRO0_TDMI0_TIN1_TLDS1_TLDSMn1_ULSGRO0_USL1_UIOFGRO0_UPLRP0_USFGRO1_VSn1_VWA4_VWB2_WSGRA2_WSGRB0_WS64_WG16_16_1_WGM6_WGMXCC2_WGMXCCGn1
    SolutionIndex: 184
    SolutionNameMin: Cijk_Ailk_Bljk_S_B_Bias_HA_S_SAV_UserArgs_MT288x224x32_MI16x16x1_SN_LDSB1_AFC0_AG1_AFEM1_AFEM1_ASEM1_CLR1_CADS0_DTLA0_DTLB0_DTVA0_DTVB0_DTVMXSA0_DTVMXSB0_DTVSM0_DPLB0_EPS0_ELFLR0_EMLLn1_FDSI0_GRPM1_GRVWA4_GRVWB4_GSU0_GSUAMB_GSUC0_GSUWGMRR0_GLS0_ISA950_IU1_K1_LDSTI0_LBSPPA4608_LBSPPB128_LBSPPM0_LPA16_LPB8_LPM0_LRVWn1_LWPMn1_MIAV0_MIWT9_7_MO40_MGRIPM1_NTn1_NTA0_NTB0_NTC0_NTD4_NTM0_NEPBS10_NLCA9_NLCB1_ONLL1_PGR2_PLR1_PKA1_SGROB0_SIA3_SS1_SU8_SUM0_SUS512_SPO0_SRVW0_SSO0_SVW1_SK3_SKFTR0_SKXCCM0_SGRO0_TDMI0_TIN0_TLDS1_TLDSMn1_ULSGRO1_USL1_UIOFGRO0_UPLRP0_USFGRO1_VSn1_VWA1_VWB1_WSGRA2_WSGRB2_WS64_WG32_8_1_WGM16_WGMXCC4_WGMXCCGn1
    SolutionIndex: 185
    SolutionNameMin: Cijk_Ailk_Bljk_S_B_Bias_HA_S_SAV_UserArgs_MT64x320x32_MI16x16x1_SN_LDSB1_AFC0_AG1_AFEM1_AFEM1_ASEM1_CLR1_CADS0_DTLA0_DTLB0_DTVA0_DTVB0_DTVMXSA0_DTVMXSB0_DTVSM0_DPLB0_EPS1_ELFLR0_EMLL0_FDSI0_GRPM1_GRVWA1_GRVWB4_GSU0_GSUAMB_GSUC0_GSUWGMRR0_GLS0_ISA950_IU1_K1_LDSTI0_LBSPPA0_LBSPPB128_LBSPPM0_LPA0_LPB8_LPM0_LRVWn1_LWPMn1_MIAV0_MIWT4_5_MO40_MGRIPM1_NTn1_NTA0_NTB0_NTC4_NTD4_NTM0_NEPBS0_NLCA1_NLCB1_ONLL1_PGR1_PLR1_PKA1_SGROB0_SIA3_SS1_SU0_SUM0_SUS0_SPO0_SRVW0_SSO1_SVW4_SK3_SKFTR0_SKXCCM0_SGRO0_TDMI0_TIN1_TLDS1_TLDSMn1_ULSGRO0_USL1_UIOFGRO0_UPLRP0_USFGRO0_VSn1_VWA4_VWB1_WSGRA0_WSGRB2_WS64_WG16_16_1_WGMn2_WGMXCC4_WGMXCCGn1
    SolutionIndex: 186
    SolutionNameMin: Cijk_Ailk_Bljk_S_B_Bias_HA_S_SAV_UserArgs_MT256x96x32_MI16x16x1_SN_LDSB1_AFC0_AG1_AFEM1_AFEM1_ASEM1_CLR1_CADS0_DTLA0_DTLB0_DTVA0_DTVB0_DTVMXSA0_DTVMXSB0_DTVSM0_DPLB0_EPS0_ELFLR0_EMLLn1_FDSI0_GRPM1_GRVWA2_GRVWB4_GSU0_GSUAMB_GSUC0_GSUWGMRR0_GLS0_ISA950_IU1_K1_LDSTI0_LBSPPA0_LBSPPB256_LBSPPM0_LPA0_LPB8_LPM0_LRVWn1_LWPMn1_MIAV0_MIWT4_6_MO40_MGRIPM1_NTn1_NTA0_NTB0_NTC0_NTD0_NTM0_NEPBS16_NLCA2_NLCB1_ONLL1_PGR2_PLR1_PKA1_SGROB0_SIA3_SS1_SU0_SUM0_SUS0_SPO0_SRVW0_SSO1_SVW4_SK3_SKFTR0_SKXCCM0_SGRO0_TDMI0_TIN1_TLDS1_TLDSMn1_ULSGRO0_USL1_UIOFGRO0_UPLRP0_USFGRO1_VSn1_VWA4_VWB2_WSGRA2_WSGRB2_WS64_WG64_4_1_WGM2_WGMXCC8_WGMXCCGn1
    SolutionIndex: 187
    SolutionNameMin: Cijk_Ailk_Bljk_S_B_Bias_HA_S_SAV_UserArgs_MT256x64x32_MI32x32x1_SN_LDSB1_AFC0_AG1_AFEM1_AFEM1_ASEM1_CLR1_CADS0_DTLA0_DTLB0_DTVA0_DTVB0_DTVMXSA0_DTVMXSB0_DTVSM0_DPLB0_EPS1_ELFLR0_EMLLn1_FDSI0_GRPM1_GRVWA1_GRVWB2_GSU0_GSUAMB_GSUC0_GSUWGMRR0_GLS0_ISA950_IU1_K1_LDSTI0_LBSPPA0_LBSPPB128_LBSPPM0_LPA0_LPB4_LPM0_LRVWn1_LWPMn1_MIAV0_MIWT4_1_MO40_MGRIPM1_NTn1_NTA0_NTB0_NTC4_NTD4_NTM0_NEPBS0_NLCA4_NLCB1_ONLL1_PGR1_PLR1_PKA1_SGROB0_SIA3_SS1_SU0_SUM0_SUS0_SPO1_SRVW0_SSO0_SVW4_SK3_SKFTR0_SKXCCM0_SGRO0_TDMI0_TIN1_TLDS1_TLDSMn1_ULSGRO0_USL1_UIOFGRO0_UPLRP0_USFGRO0_VSn1_VWA4_VWB1_WSGRA2_WSGRB0_WS64_WG64_4_1_WGM4_WGMXCC4_WGMXCCGn1
    SolutionIndex: 188
    SolutionNameMin: Cijk_Ailk_Bljk_S_B_Bias_HA_S_SAV_UserArgs_MT128x192x32_MI16x16x1_SN_LDSB1_AFC0_AG1_AFEM1_AFEM1_ASEM1_CLR1_CADS0_DTLA0_DTLB0_DTVA0_DTVB0_DTVMXSA0_DTVMXSB0_DTVSM0_DPLB0_EPS0_ELFLR0_EMLLn1_FDSI0_GRPM1_GRVWA4_GRVWB4_GSU0_GSUAMB_GSUC0_GSUWGMRR0_GLS0_ISA950_IU1_K1_LDSTI0_LBSPPA0_LBSPPB128_LBSPPM0_LPA0_LPB8_LPM0_LRVWn1_LWPMn1_MIAV0_MIWT8_3_MO40_MGRIPM1_NTn1_NTA0_NTB0_NTC4_NTD4_NTM0_NEPBS8_NLCA1_NLCB1_ONLL1_PGR2_PLR1_PKA1_SGROB0_SIA3_SS1_SU8_SUM0_SUS128_SPO0_SRVW0_SSO1_SVW4_SK3_SKFTR0_SKXCCM0_SGRO0_TDMI0_TIN0_TLDS1_TLDSMn1_ULSGRO0_USL1_UIOFGRO0_UPLRP0_USFGRO0_VSn1_VWA4_VWB1_WSGRA2_WSGRB2_WS64_WG16_16_1_WGMn2_WGMXCC2_WGMXCCGn1
    SolutionIndex: 189
    SolutionNameMin: Cijk_Ailk_Bljk_S_B_Bias_HA_S_SAV_UserArgs_MT192x64x32_MI16x16x1_SN_LDSB1_AFC0_AG1_AFEM1_AFEM1_ASEM1_CLR1_CADS0_DTLA0_DTLB0_DTVA0_DTVB0_DTVMXSA0_DTVMXSB0_DTVSM0_DPLB0_EPS0_ELFLR0_EMLL0_FDSI0_GRPM1_GRVWA4_GRVWB4_GSU0_GSUAMB_GSUC0_GSUWGMRR0_GLS0_ISA950_IU1_K1_LDSTI0_LBSPPA0_LBSPPB256_LBSPPM0_LPA0_LPB16_LPM0_LRVWn1_LWPMn1_MIAV0_MIWT12_1_MO40_MGRIPM1_NTn1_NTA0_NTB4_NTC0_NTD4_NTM0_NEPBS8_NLCA3_NLCB1_ONLL1_PGR2_PLR1_PKA1_SGROB0_SIA3_SS1_SU0_SUM0_SUS0_SPO0_SRVW0_SSO1_SVW4_SK3_SKFTR0_SKXCCM0_SGRO0_TDMI0_TIN1_TLDS0_TLDSMn1_ULSGRO0_USL1_UIOFGRO0_UPLRP0_USFGRO0_VSn1_VWA4_VWB1_WSGRA2_WSGRB0_WS64_WG16_16_1_WGMn24_WGMXCC2_WGMXCCGn1
    SolutionIndex: 190
    SolutionNameMin: Cijk_Ailk_Bljk_S_B_Bias_HA_S_SAV_UserArgs_MT256x64x32_MI16x16x1_SN_LDSB1_AFC0_AG1_AFEM1_AFEM1_ASEM1_CLR1_CADS0_DTLA0_DTLB0_DTVA0_DTVB0_DTVMXSA0_DTVMXSB0_DTVSM0_DPLB0_EPS0_ELFLR0_EMLLn1_FDSI0_GRPM1_GRVWA4_GRVWB4_GSU0_GSUAMB_GSUC0_GSUWGMRR0_GLS0_ISA950_IU1_K1_LDSTI0_LBSPPA0_LBSPPB256_LBSPPM0_LPA0_LPB8_LPM0_LRVWn1_LWPMn1_MIAV0_MIWT8_2_MO40_MGRIPM1_NTn1_NTA0_NTB0_NTC4_NTD4_NTM0_NEPBS0_NLCA1_NLCB1_ONLL1_PGR2_PLR1_PKA1_SGROB0_SIA3_SS1_SU16_SUM0_SUS128_SPO0_SRVW0_SSO1_SVW4_SK3_SKFTR0_SKXCCM0_SGRO0_TDMI0_TIN0_TLDS1_TLDSMn1_ULSGRO0_USL1_UIOFGRO0_UPLRP0_USFGRO0_VSn1_VWA4_VWB2_WSGRA0_WSGRB2_WS64_WG32_8_1_WGMn2_WGMXCC4_WGMXCCGn1
    SolutionIndex: 191
    SolutionNameMin: Cijk_Ailk_Bljk_S_B_Bias_HA_S_SAV_UserArgs_MT192x64x32_MI32x32x1_SN_LDSB1_AFC0_AG1_AFEM1_AFEM1_ASEM1_CLR1_CADS0_DTLA0_DTLB0_DTVA0_DTVB0_DTVMXSA0_DTVMXSB0_DTVSM0_DPLB0_EPS1_ELFLR0_EMLL0_FDSI0_GRPM1_GRVWA1_GRVWB4_GSU0_GSUAMB_GSUC0_GSUWGMRR0_GLS0_ISA950_IU1_K1_LDSTI0_LBSPPA0_LBSPPB128_LBSPPM0_LPA0_LPB4_LPM0_LRVWn1_LWPMn1_MIAV0_MIWT3_1_MO40_MGRIPM1_NTn1_NTA0_NTB4_NTC0_NTD4_NTM0_NEPBS0_NLCA3_NLCB1_ONLL1_PGR1_PLR1_PKA1_SGROB0_SIA3_SS1_SU0_SUM0_SUS0_SPO0_SRVW0_SSO1_SVW1_SK3_SKFTR0_SKXCCM0_SGRO0_TDMI0_TIN1_TLDS1_TLDSMn1_ULSGRO0_USL1_UIOFGRO0_UPLRP0_USFGRO0_VSn1_VWA1_VWB1_WSGRA0_WSGRB0_WS64_WG64_4_1_WGM8_WGMXCC1_WGMXCCGn1
    SolutionIndex: 192
    SolutionNameMin: Cijk_Ailk_Bljk_S_B_Bias_HA_S_SAV_UserArgs_MT128x128x32_MI16x16x1_SN_LDSB1_AFC0_AG1_AFEM1_AFEM1_ASEM1_CLR1_CADS0_DTLA0_DTLB0_DTVA0_DTVB0_DTVMXSA0_DTVMXSB0_DTVSM0_DPLB0_EPS0_ELFLR0_EMLLn1_FDSI0_GRPM1_GRVWA4_GRVWB4_GSU0_GSUAMB_GSUC0_GSUWGMRR0_GLS0_ISA950_IU1_K1_LDSTI0_LBSPPA0_LBSPPB512_LBSPPM0_LPA0_LPB8_LPM0_LRVWn1_LWPMn1_MIAV0_MIWT4_4_MO40_MGRIPM1_NTn1_NTA0_NTB0_NTC4_NTD0_NTM0_NEPBS4_NLCA1_NLCB1_ONLL1_PGR2_PLR1_PKA1_SGROB0_SIA3_SS1_SU0_SUM0_SUS0_SPO0_SRVW0_SSO1_SVW4_SK3_SKFTR0_SKXCCM4_SGRO0_TDMI0_TIN1_TLDS1_TLDSMn1_ULSGRO0_USL1_UIOFGRO0_UPLRP0_USFGRO1_VSn1_VWA4_VWB4_WSGRA0_WSGRB2_WS64_WG32_8_1_WGM6_WGMXCC2_WGMXCCGn1
    SolutionIndex: 193
    SolutionNameMin: Cijk_Ailk_Bljk_S_B_Bias_HA_S_SAV_UserArgs_MT64x128x32_MI16x16x1_SN_LDSB1_AFC0_AG1_AFEM1_AFEM1_ASEM1_CLR1_CADS0_DTLA0_DTLB0_DTVA0_DTVB0_DTVMXSA0_DTVMXSB0_DTVSM0_DPLB0_EPS1_ELFLR0_EMLLn1_FDSI0_GRPM1_GRVWA1_GRVWB4_GSU0_GSUAMB_GSUC0_GSUWGMRR0_GLS0_ISA950_IU1_K1_LDSTI0_LBSPPA0_LBSPPB256_LBSPPM0_LPA0_LPB8_LPM0_LRVWn1_LWPMn1_MIAV1_MIWT4_2_MO40_MGRIPM1_NTn1_NTA0_NTB0_NTC4_NTD4_NTM0_NEPBS10_NLCA1_NLCB1_ONLL1_PGR1_PLR1_PKA1_SGROB0_SIA3_SS1_SU0_SUM0_SUS0_SPO0_SRVW0_SSO0_SVW4_SK3_SKFTR0_SKXCCM0_SGRO0_TDMI0_TIN1_TLDS1_TLDSMn1_ULSGRO0_USL1_UIOFGRO0_UPLRP0_USFGRO0_VSn1_VWA4_VWB2_WSGRA0_WSGRB0_WS64_WG16_16_1_WGM4_WGMXCC1_WGMXCCGn1
    SolutionIndex: 194
    SolutionNameMin: Cijk_Ailk_Bljk_S_B_Bias_HA_S_SAV_UserArgs_MT144x64x32_MI16x16x1_SN_LDSB0_AFC0_AG1_AFEM1_AFEM1_ASEM1_CLR1_CADS0_DTLA0_DTLB0_DTVA0_DTVB0_DTVMXSA0_DTVMXSB0_DTVSM0_DPLB0_EPS1_ELFLR0_EMLLn1_FDSI0_GRPM1_GRVWA1_GRVWB4_GSU0_GSUAMB_GSUC0_GSUWGMRR0_GLS0_ISA950_IU1_K1_LDSTI0_LBSPPA2304_LBSPPB128_LBSPPM0_LPA16_LPB8_LPM0_LRVWn1_LWPMn1_MIAV0_MIWT9_1_MO40_MGRIPM1_NTn1_NTA0_NTB0_NTC0_NTD0_NTM0_NEPBS0_NLCA9_NLCB1_ONLL1_PGR1_PLR1_PKA1_SGROB0_SIA3_SS1_SU0_SUM0_SUS0_SPO1_SRVW0_SSO4_SVW1_SK3_SKFTR0_SKXCCM8_SGRO0_TDMI0_TIN1_TLDS1_TLDSMn1_ULSGRO0_USL1_UIOFGRO0_UPLRP0_USFGRO0_VSn1_VWA1_VWB1_WSGRA2_WSGRB0_WS64_WG16_16_1_WGMn1_WGMXCC1_WGMXCCGn1
    SolutionIndex: 195
    SolutionNameMin: Cijk_Ailk_Bljk_S_B_Bias_HA_S_SAV_UserArgs_MT256x256x32_MI16x16x1_SN_LDSB1_AFC0_AG1_AFEM1_AFEM1_ASEM1_CLR1_CADS0_DTLA0_DTLB0_DTVA0_DTVB0_DTVMXSA0_DTVMXSB0_DTVSM0_DPLB0_EPS0_ELFLR0_EMLLn1_FDSI0_GRPM1_GRVWA4_GRVWB4_GSU0_GSUAMB_GSUC0_GSUWGMRR0_GLS0_ISA950_IU1_K1_LDSTI0_LBSPPA0_LBSPPB512_LBSPPM0_LPA0_LPB8_LPM0_LRVWn1_LWPMn1_MIAV0_MIWT8_8_MO40_MGRIPM1_NTn1_NTA0_NTB0_NTC4_NTD4_NTM0_NEPBS16_NLCA1_NLCB1_ONLL1_PGR2_PLR1_PKA1_SGROB0_SIA3_SS1_SU0_SUM0_SUS0_SPO1_SRVW0_SSO1_SVW4_SK3_SKFTR0_SKXCCM4_SGRO0_TDMI0_TIN1_TLDS1_TLDSMn1_ULSGRO0_USL1_UIOFGRO0_UPLRP0_USFGRO1_VSn1_VWA4_VWB4_WSGRA0_WSGRB2_WS64_WG32_8_1_WGM8_WGMXCC16_WGMXCCGn1
    SolutionIndex: 196
    SolutionNameMin: Cijk_Ailk_Bljk_S_B_Bias_HA_S_SAV_UserArgs_MT128x64x32_MI32x32x1_SN_LDSB0_AFC0_AG1_AFEM1_AFEM1_ASEM1_CLR1_CADS0_DTLA0_DTLB0_DTVA0_DTVB0_DTVMXSA0_DTVMXSB0_DTVSM0_DPLB0_EPS1_ELFLR0_EMLL0_FDSI0_GRPM1_GRVWA1_GRVWB4_GSU0_GSUAMB_GSUC0_GSUWGMRR0_GLS0_ISA950_IU1_K1_LDSTI0_LBSPPA0_LBSPPB128_LBSPPM0_LPA0_LPB4_LPM0_LRVWn1_LWPMn1_MIAV1_MIWT2_1_MO40_MGRIPM1_NTn1_NTA0_NTB0_NTC4_NTD4_NTM0_NEPBS0_NLCA2_NLCB1_ONLL1_PGR1_PLR1_PKA1_SGROB0_SIA3_SS1_SU0_SUM0_SUS0_SPO1_SRVW0_SSO0_SVW2_SK3_SKFTR0_SKXCCM0_SGRO0_TDMI0_TIN1_TLDS1_TLDSMn1_ULSGRO0_USL1_UIOFGRO0_UPLRP0_USFGRO1_VSn1_VWA2_VWB1_WSGRA2_WSGRB2_WS64_WG64_4_1_WGM16_WGMXCC1_WGMXCCGn1
    SolutionIndex: 197
    SolutionNameMin: Cijk_Ailk_Bljk_S_B_Bias_HA_S_SAV_UserArgs_MT128x48x32_MI16x16x1_SN_LDSB1_AFC0_AG0_AFEM1_AFEM1_ASEM1_CLR1_CADS0_DTLA0_DTLB0_DTVA0_DTVB0_DTVMXSA0_DTVMXSB0_DTVSM0_DPLB0_EPS1_ELFLR0_EMLL0_FDSI0_GRPM1_GRVWA1_GRVWB2_GSU0_GSUAMB_GSUC0_GSUWGMRR0_GLS0_ISA950_IU1_K1_LDSTI0_LBSPPA0_LBSPPB128_LBSPPM0_LPA0_LPB8_LPM0_LRVWn1_LWPMn1_MIAV0_MIWT2_3_MO40_MGRIPM1_NTn1_NTA0_NTB0_NTC4_NTD4_NTM0_NEPBS12_NLCA2_NLCB1_ONLL1_PGR1_PLR1_PKA1_SGROB0_SIA3_SS1_SU0_SUM0_SUS0_SPO0_SRVW0_SSO0_SVW2_SK3_SKFTR0_SKXCCM4_SGRO0_TDMI0_TIN1_TLDS1_TLDSMn1_ULSGRO0_USL1_UIOFGRO0_UPLRP0_USFGRO1_VSn1_VWA2_VWB1_WSGRA2_WSGRB2_WS64_WG64_4_1_WGM24_WGMXCC2_WGMXCCGn1
    SolutionIndex: 198
    SolutionNameMin: Cijk_Ailk_Bljk_S_B_Bias_HA_S_SAV_UserArgs_MT128x128x32_MI32x32x1_SN_LDSB1_AFC0_AG1_AFEM1_AFEM1_ASEM1_CLR1_CADS0_DTLA0_DTLB0_DTVA0_DTVB0_DTVMXSA0_DTVMXSB0_DTVSM0_DPLB0_EPS1_ELFLR0_EMLLn1_FDSI0_GRPM1_GRVWA1_GRVWB4_GSU0_GSUAMB_GSUC0_GSUWGMRR0_GLS0_ISA950_IU1_K1_LDSTI0_LBSPPA0_LBSPPB128_LBSPPM0_LPA0_LPB4_LPM0_LRVWn1_LWPMn1_MIAV0_MIWT4_1_MO40_MGRIPM1_NTn1_NTA0_NTB0_NTC4_NTD4_NTM0_NEPBS16_NLCA2_NLCB1_ONLL1_PGR1_PLR1_PKA1_SGROB0_SIA3_SS1_SU0_SUM0_SUS0_SPO0_SRVW0_SSO1_SVW4_SK3_SKFTR0_SKXCCM0_SGRO0_TDMI0_TIN1_TLDS1_TLDSMn1_ULSGRO0_USL1_UIOFGRO0_UPLRP0_USFGRO0_VSn1_VWA4_VWB1_WSGRA2_WSGRB2_WS64_WG32_8_1_WGMn1_WGMXCC8_WGMXCCGn1
    SolutionIndex: 199
    SolutionNameMin: Cijk_Ailk_Bljk_S_B_Bias_HA_S_SAV_UserArgs_MT64x128x32_MI16x16x1_SN_LDSB1_AFC0_AG1_AFEM1_AFEM1_ASEM1_CLR1_CADS0_DTLA0_DTLB0_DTVA0_DTVB0_DTVMXSA0_DTVMXSB0_DTVSM0_DPLB0_EPS1_ELFLR0_EMLL0_FDSI0_GRPM1_GRVWA1_GRVWB4_GSU0_GSUAMB_GSUC0_GSUWGMRR0_GLS0_ISA950_IU1_K1_LDSTI0_LBSPPA0_LBSPPB256_LBSPPM0_LPA0_LPB8_LPM0_LRVWn1_LWPMn1_MIAV0_MIWT4_2_MO40_MGRIPM1_NTn1_NTA0_NTB0_NTC0_NTD0_NTM0_NEPBS14_NLCA1_NLCB1_ONLL1_PGR1_PLR1_PKA1_SGROB0_SIA3_SS1_SU0_SUM0_SUS0_SPO1_SRVW0_SSO1_SVW4_SK3_SKFTR0_SKXCCM0_SGRO0_TDMI0_TIN1_TLDS1_TLDSMn1_ULSGRO0_USL1_UIOFGRO0_UPLRP0_USFGRO1_VSn1_VWA4_VWB2_WSGRA0_WSGRB0_WS64_WG16_16_1_WGM8_WGMXCC1_WGMXCCGn1
    SolutionIndex: 200
    SolutionNameMin: Cijk_Ailk_Bljk_S_B_Bias_HA_S_SAV_UserArgs_MT128x160x32_MI16x16x1_SN_LDSB1_AFC0_AG1_AFEM1_AFEM1_ASEM1_CLR1_CADS0_DTLA0_DTLB0_DTVA0_DTVB0_DTVMXSA0_DTVMXSB0_DTVSM0_DPLB0_EPS0_ELFLR0_EMLL0_FDSI0_GRPM1_GRVWA4_GRVWB4_GSU0_GSUAMB_GSUC0_GSUWGMRR0_GLS0_ISA950_IU1_K1_LDSTI0_LBSPPA0_LBSPPB128_LBSPPM0_LPA0_LPB8_LPM0_LRVWn1_LWPMn1_MIAV0_MIWT4_5_MO40_MGRIPM1_NTn1_NTA0_NTB0_NTC4_NTD0_NTM0_NEPBS8_NLCA1_NLCB1_ONLL1_PGR2_PLR1_PKA1_SGROB0_SIA3_SS1_SU16_SUM0_SUS512_SPO1_SRVW0_SSO1_SVW4_SK3_SKFTR0_SKXCCM0_SGRO0_TDMI0_TIN0_TLDS1_TLDSMn1_ULSGRO0_USL1_UIOFGRO0_UPLRP0_USFGRO0_VSn1_VWA4_VWB1_WSGRA0_WSGRB2_WS64_WG32_8_1_WGM8_WGMXCC1_WGMXCCGn1
    SolutionIndex: 201
    SolutionNameMin: Cijk_Ailk_Bljk_S_B_Bias_HA_S_SAV_UserArgs_MT128x64x32_MI16x16x1_SN_LDSB0_AFC0_AG1_AFEM1_AFEM1_ASEM1_CLR1_CADS0_DTLA0_DTLB0_DTVA0_DTVB0_DTVMXSA0_DTVMXSB0_DTVSM0_DPLB0_EPS1_ELFLR0_EMLL0_FDSI0_GRPM1_GRVWA1_GRVWB4_GSU0_GSUAMB_GSUC0_GSUWGMRR0_GLS0_ISA950_IU1_K1_LDSTI0_LBSPPA0_LBSPPB128_LBSPPM0_LPA0_LPB8_LPM0_LRVWn1_LWPMn1_MIAV0_MIWT8_1_MO40_MGRIPM1_NTn1_NTA0_NTB0_NTC4_NTD4_NTM0_NEPBS0_NLCA1_NLCB1_ONLL1_PGR1_PLR1_PKA1_SGROB0_SIA3_SS1_SU0_SUM0_SUS0_SPO1_SRVW0_SSO0_SVW4_SK3_SKFTR0_SKXCCM0_SGRO0_TDMI0_TIN1_TLDS1_TLDSMn1_ULSGRO0_USL1_UIOFGRO0_UPLRP0_USFGRO1_VSn1_VWA4_VWB1_WSGRA0_WSGRB2_WS64_WG16_16_1_WGM6_WGMXCC1_WGMXCCGn1
    SolutionIndex: 202
    SolutionNameMin: Cijk_Ailk_Bljk_S_B_Bias_HA_S_SAV_UserArgs_MT64x128x32_MI16x16x1_SN_LDSB0_AFC0_AG0_AFEM1_AFEM1_ASEM1_CLR1_CADS0_DTLA0_DTLB0_DTVA0_DTVB0_DTVMXSA0_DTVMXSB0_DTVSM0_DPLB0_EPS1_ELFLR0_EMLL0_FDSI0_GRPM1_GRVWA1_GRVWB2_GSU0_GSUAMB_GSUC0_GSUWGMRR0_GLS0_ISA950_IU1_K1_LDSTI0_LBSPPA0_LBSPPB256_LBSPPM0_LPA0_LPB8_LPM0_LRVWn1_LWPMn1_MIAV0_MIWT4_2_MO40_MGRIPM1_NTn1_NTA0_NTB0_NTC4_NTD4_NTM0_NEPBS10_NLCA1_NLCB1_ONLL1_PGR1_PLR1_PKA1_SGROB0_SIA3_SS1_SU0_SUM0_SUS0_SPO1_SRVW0_SSO0_SVW4_SK3_SKFTR0_SKXCCM0_SGRO0_TDMI0_TIN1_TLDS1_TLDSMn1_ULSGRO0_USL1_UIOFGRO0_UPLRP0_USFGRO1_VSn1_VWA4_VWB2_WSGRA0_WSGRB0_WS64_WG16_16_1_WGMn4_WGMXCC1_WGMXCCGn1
    SolutionIndex: 203
    SolutionNameMin: Cijk_Ailk_Bljk_S_B_Bias_HA_S_SAV_UserArgs_MT128x112x32_MI16x16x1_SN_LDSB0_AFC0_AG0_AFEM1_AFEM1_ASEM1_CLR1_CADS0_DTLA0_DTLB0_DTVA0_DTVB0_DTVMXSA0_DTVMXSB0_DTVSM0_DPLB0_EPS1_ELFLR0_EMLL0_FDSI0_GRPM1_GRVWA1_GRVWB2_GSU0_GSUAMB_GSUC0_GSUWGMRR0_GLS0_ISA950_IU1_K1_LDSTI0_LBSPPA0_LBSPPB128_LBSPPM0_LPA0_LPB8_LPM0_LRVWn1_LWPMn1_MIAV0_MIWT2_7_MO40_MGRIPM1_NTn1_NTA0_NTB0_NTC4_NTD4_NTM0_NEPBS0_NLCA1_NLCB1_ONLL1_PGR1_PLR1_PKA1_SGROB0_SIA3_SS1_SU0_SUM0_SUS0_SPO0_SRVW0_SSO0_SVW2_SK3_SKFTR0_SKXCCM0_SGRO0_TDMI0_TIN1_TLDS1_TLDSMn1_ULSGRO0_USL1_UIOFGRO0_UPLRP0_USFGRO1_VSn1_VWA2_VWB1_WSGRA0_WSGRB0_WS64_WG64_4_1_WGMn2_WGMXCC1_WGMXCCGn1
    SolutionIndex: 204
    SolutionNameMin: Cijk_Ailk_Bljk_S_B_Bias_HA_S_SAV_UserArgs_MT128x32x32_MI16x16x1_SN_LDSB1_AFC0_AG1_AFEM1_AFEM1_ASEM1_CLR1_CADS0_DTLA0_DTLB0_DTVA0_DTVB0_DTVMXSA0_DTVMXSB0_DTVSM0_DPLB0_EPS1_ELFLR0_EMLL0_FDSI0_GRPM1_GRVWA1_GRVWB4_GSU0_GSUAMB_GSUC0_GSUWGMRR0_GLS0_ISA950_IU1_K1_LDSTI0_LBSPPA0_LBSPPB128_LBSPPM0_LPA0_LPB8_LPM0_LRVWn1_LWPMn1_MIAV0_MIWT4_1_MO40_MGRIPM1_NTn1_NTA0_NTB0_NTC4_NTD4_NTM0_NEPBS4_NLCA2_NLCB1_ONLL1_PGR1_PLR1_PKA1_SGROB0_SIA3_SS1_SU0_SUM0_SUS0_SPO0_SRVW0_SSO0_SVW4_SK3_SKFTR0_SKXCCM8_SGRO0_TDMI0_TIN1_TLDS1_TLDSMn1_ULSGRO0_USL1_UIOFGRO0_UPLRP0_USFGRO0_VSn1_VWA4_VWB1_WSGRA2_WSGRB0_WS64_WG32_8_1_WGM48_WGMXCC1_WGMXCCGn1
    SolutionIndex: 205
    SolutionNameMin: Cijk_Ailk_Bljk_S_B_Bias_HA_S_SAV_UserArgs_MT64x64x64_MI16x16x1_SN_LDSB1_AFC0_AG0_AFEM1_AFEM1_ASEM1_CLR1_CADS0_DTLA0_DTLB0_DTVA0_DTVB0_DTVMXSA0_DTVMXSB0_DTVSM0_DPLB0_EPS0_ELFLR0_EMLL0_FDSI0_GRPM1_GRVWA4_GRVWB4_GSU0_GSUAMB_GSUC0_GSUWGMRR0_GLS0_ISA950_IU1_K1_LDSTI0_LBSPPA0_LBSPPB256_LBSPPM0_LPA0_LPB8_LPM0_LRVWn1_LWPMn1_MIAV1_MIWT4_1_MO40_MGRIPM1_NTn1_NTA4_NTB0_NTC0_NTD4_NTM0_NEPBS8_NLCA1_NLCB1_ONLL1_PGR2_PLR1_PKA1_SGROB0_SIA3_SS1_SU0_SUM0_SUS0_SPO0_SRVW0_SSO0_SVW4_SK3_SKFTR0_SKXCCM0_SGRO0_TDMI0_TIN1_TLDS1_TLDSMn1_ULSGRO1_USL1_UIOFGRO0_UPLRP0_USFGRO0_VSn1_VWA4_VWB1_WSGRA0_WSGRB0_WS64_WG16_16_1_WGMn32_WGMXCC1_WGMXCCGn1
    SolutionIndex: 206
    SolutionNameMin: Cijk_Ailk_Bljk_S_B_Bias_HA_S_SAV_UserArgs_MT192x112x32_MI16x16x1_SN_LDSB1_AFC0_AG0_AFEM1_AFEM1_ASEM1_CLR1_CADS0_DTLA0_DTLB0_DTVA0_DTVB0_DTVMXSA0_DTVMXSB0_DTVSM0_DPLB0_EPS0_ELFLR0_EMLL0_FDSI0_GRPM1_GRVWA4_GRVWB1_GSU0_GSUAMB_GSUC0_GSUWGMRR0_GLS0_ISA950_IU1_K1_LDSTI0_LBSPPA3072_LBSPPB128_LBSPPM0_LPA16_LPB8_LPM0_LRVWn1_LWPMn1_MIAV1_MIWT3_7_MO40_MGRIPM1_NTn1_NTA4_NTB4_NTC4_NTD4_NTM0_NEPBS10_NLCA3_NLCB1_ONLL1_PGR2_PLR1_PKA1_SGROB0_SIA3_SS0_SU16_SUM0_SUS128_SPO1_SRVW0_SSO0_SVW4_SK3_SKFTR0_SKXCCM4_SGRO0_TDMI0_TIN0_TLDS1_TLDSMn1_ULSGRO0_USL1_UIOFGRO0_UPLRP0_USFGRO0_VSn1_VWA1_VWB1_WSGRA2_WSGRB0_WS64_WG64_4_1_WGMn4_WGMXCC2_WGMXCCGn1
    SolutionIndex: 207
    SolutionNameMin: Cijk_Ailk_Bljk_S_B_Bias_HA_S_SAV_UserArgs_MT64x160x32_MI16x16x1_SN_LDSB1_AFC0_AG0_AFEM1_AFEM1_ASEM1_CLR1_CADS0_DTLA0_DTLB0_DTVA0_DTVB0_DTVMXSA0_DTVMXSB0_DTVSM0_DPLB0_EPS1_ELFLR0_EMLLn1_FDSI0_GRPM1_GRVWA1_GRVWB4_GSU0_GSUAMB_GSUC0_GSUWGMRR0_GLS0_ISA950_IU1_K1_LDSTI0_LBSPPA0_LBSPPB128_LBSPPM0_LPA0_LPB8_LPM0_LRVWn1_LWPMn1_MIAV0_MIWT2_5_MO40_MGRIPM1_NTn1_NTA0_NTB0_NTC4_NTD4_NTM0_NEPBS0_NLCA1_NLCB1_ONLL1_PGR1_PLR1_PKA1_SGROB0_SIA3_SS1_SU0_SUM0_SUS0_SPO0_SRVW0_SSO1_SVW2_SK3_SKFTR0_SKXCCM0_SGRO0_TDMI0_TIN1_TLDS1_TLDSMn1_ULSGRO0_USL1_UIOFGRO0_UPLRP0_USFGRO1_VSn1_VWA2_VWB1_WSGRA2_WSGRB0_WS64_WG32_8_1_WGM8_WGMXCC1_WGMXCCGn1
    SolutionIndex: 208
    SolutionNameMin: Cijk_Ailk_Bljk_S_B_Bias_HA_S_SAV_UserArgs_MT128x128x32_MI32x32x1_SN_LDSB1_AFC0_AG1_AFEM1_AFEM1_ASEM1_CLR1_CADS0_DTLA0_DTLB0_DTVA0_DTVB0_DTVMXSA0_DTVMXSB0_DTVSM0_DPLB0_EPS0_ELFLR0_EMLLn1_FDSI0_GRPM1_GRVWA1_GRVWB4_GSU0_GSUAMB_GSUC0_GSUWGMRR0_GLS0_ISA950_IU1_K1_LDSTI0_LBSPPA0_LBSPPB128_LBSPPM0_LPA0_LPB4_LPM0_LRVWn1_LWPMn1_MIAV0_MIWT4_1_MO40_MGRIPM1_NTn1_NTA0_NTB0_NTC0_NTD4_NTM0_NEPBS0_NLCA2_NLCB1_ONLL1_PGR2_PLR1_PKA1_SGROB0_SIA3_SS1_SU0_SUM0_SUS0_SPO1_SRVW0_SSO0_SVW4_SK3_SKFTR0_SKXCCM0_SGRO0_TDMI0_TIN1_TLDS1_TLDSMn1_ULSGRO1_USL1_UIOFGRO0_UPLRP0_USFGRO1_VSn1_VWA4_VWB1_WSGRA2_WSGRB0_WS64_WG32_8_1_WGM4_WGMXCC2_WGMXCCGn1
    SolutionIndex: 209
    SolutionNameMin: Cijk_Ailk_Bljk_S_B_Bias_HA_S_SAV_UserArgs_MT128x32x32_MI16x16x1_SN_LDSB0_AFC0_AG0_AFEM1_AFEM1_ASEM1_CLR1_CADS0_DTLA0_DTLB0_DTVA0_DTVB0_DTVMXSA0_DTVMXSB0_DTVSM0_DPLB0_EPS0_ELFLR0_EMLL0_FDSI0_GRPM1_GRVWA4_GRVWB4_GSU0_GSUAMB_GSUC0_GSUWGMRR0_GLS0_ISA950_IU1_K1_LDSTI0_LBSPPA0_LBSPPB256_LBSPPM0_LPA0_LPB8_LPM0_LRVWn1_LWPMn1_MIAV0_MIWT2_2_MO40_MGRIPM1_NTn1_NTA0_NTB0_NTC4_NTD4_NTM0_NEPBS10_NLCA1_NLCB1_ONLL1_PGR2_PLR1_PKA1_SGROB0_SIA3_SS1_SU0_SUM0_SUS0_SPO0_SRVW0_SSO0_SVW2_SK3_SKFTR0_SKXCCM0_SGRO0_TDMI0_TIN1_TLDS1_TLDSMn1_ULSGRO0_USL1_UIOFGRO0_UPLRP0_USFGRO1_VSn1_VWA2_VWB2_WSGRA0_WSGRB2_WS64_WG64_4_1_WGMn1_WGMXCC1_WGMXCCGn1
    SolutionIndex: 210
    SolutionNameMin: Cijk_Ailk_Bljk_S_B_Bias_HA_S_SAV_UserArgs_MT64x128x32_MI16x16x1_SN_LDSB1_AFC0_AG1_AFEM1_AFEM1_ASEM1_CLR1_CADS0_DTLA0_DTLB0_DTVA0_DTVB0_DTVMXSA0_DTVMXSB0_DTVSM0_DPLB0_EPS1_ELFLR0_EMLLn1_FDSI0_GRPM1_GRVWA1_GRVWB4_GSU0_GSUAMB_GSUC0_GSUWGMRR0_GLS0_ISA950_IU1_K1_LDSTI0_LBSPPA0_LBSPPB256_LBSPPM0_LPA0_LPB8_LPM0_LRVWn1_LWPMn1_MIAV0_MIWT4_2_MO40_MGRIPM1_NTn1_NTA0_NTB4_NTC4_NTD0_NTM0_NEPBS16_NLCA1_NLCB1_ONLL1_PGR1_PLR1_PKA1_SGROB0_SIA3_SS1_SU0_SUM0_SUS0_SPO0_SRVW0_SSO1_SVW4_SK3_SKFTR0_SKXCCM0_SGRO0_TDMI0_TIN1_TLDS1_TLDSMn1_ULSGRO0_USL1_UIOFGRO0_UPLRP0_USFGRO0_VSn1_VWA4_VWB2_WSGRA2_WSGRB0_WS64_WG16_16_1_WGM2_WGMXCC8_WGMXCCGn1
    SolutionIndex: 211
    SolutionNameMin: Cijk_Ailk_Bljk_S_B_Bias_HA_S_SAV_UserArgs_MT256x64x32_MI16x16x1_SN_LDSB1_AFC0_AG1_AFEM1_AFEM1_ASEM1_CLR1_CADS0_DTLA0_DTLB0_DTVA0_DTVB0_DTVMXSA0_DTVMXSB0_DTVSM0_DPLB0_EPS1_ELFLR0_EMLLn1_FDSI0_GRPM1_GRVWA4_GRVWB4_GSU0_GSUAMB_GSUC0_GSUWGMRR0_GLS0_ISA950_IU1_K1_LDSTI0_LBSPPA0_LBSPPB256_LBSPPM0_LPA0_LPB8_LPM0_LRVWn1_LWPMn1_MIAV0_MIWT8_2_MO40_MGRIPM1_NTn1_NTA0_NTB0_NTC4_NTD4_NTM0_NEPBS10_NLCA1_NLCB1_ONLL1_PGR1_PLR1_PKA1_SGROB0_SIA3_SS1_SU0_SUM0_SUS0_SPO1_SRVW0_SSO1_SVW4_SK3_SKFTR0_SKXCCM0_SGRO0_TDMI0_TIN1_TLDS1_TLDSMn1_ULSGRO0_USL1_UIOFGRO0_UPLRP0_USFGRO0_VSn1_VWA4_VWB2_WSGRA2_WSGRB0_WS64_WG32_8_1_WGM0_WGMXCC16_WGMXCCGn1
    SolutionIndex: 212
    SolutionNameMin: Cijk_Ailk_Bljk_S_B_Bias_HA_S_SAV_UserArgs_MT320x32x32_MI16x16x1_SN_LDSB1_AFC0_AG1_AFEM1_AFEM1_ASEM1_CLR1_CADS0_DTLA0_DTLB0_DTVA0_DTVB0_DTVMXSA0_DTVMXSB0_DTVSM0_DPLB0_EPS0_ELFLR0_EMLL0_FDSI0_GRPM1_GRVWA2_GRVWB2_GSU0_GSUAMB_GSUC0_GSUWGMRR0_GLS0_ISA950_IU1_K1_LDSTI0_LBSPPA0_LBSPPB128_LBSPPM0_LPA0_LPB8_LPM0_LRVWn1_LWPMn1_MIAV0_MIWT10_1_MO40_MGRIPM1_NTn1_NTA0_NTB0_NTC0_NTD4_NTM0_NEPBS0_NLCA5_NLCB1_ONLL1_PGR2_PLR1_PKA1_SGROB0_SIA3_SS1_SU0_SUM0_SUS0_SPO0_SRVW0_SSO4_SVW2_SK3_SKFTR0_SKXCCM0_SGRO0_TDMI0_TIN1_TLDS1_TLDSMn1_ULSGRO0_USL1_UIOFGRO0_UPLRP0_USFGRO0_VSn1_VWA2_VWB1_WSGRA0_WSGRB2_WS64_WG32_8_1_WGM4_WGMXCC8_WGMXCCGn1
    SolutionIndex: 213
    SolutionNameMin: Cijk_Ailk_Bljk_S_B_Bias_HA_S_SAV_UserArgs_MT64x64x32_MI16x16x1_SN_LDSB0_AFC0_AG1_AFEM1_AFEM1_ASEM1_CLR1_CADS0_DTLA0_DTLB0_DTVA0_DTVB0_DTVMXSA0_DTVMXSB0_DTVSM0_DPLB0_EPS1_ELFLR0_EMLL0_FDSI0_GRPM1_GRVWA1_GRVWB4_GSU0_GSUAMB_GSUC0_GSUWGMRR0_GLS0_ISA950_IU1_K1_LDSTI0_LBSPPA0_LBSPPB128_LBSPPM0_LPA0_LPB8_LPM0_LRVWn1_LWPMn1_MIAV0_MIWT4_1_MO40_MGRIPM1_NTn1_NTA0_NTB0_NTC4_NTD4_NTM0_NEPBS10_NLCA1_NLCB1_ONLL1_PGR1_PLR1_PKA1_SGROB0_SIA3_SS1_SU0_SUM0_SUS0_SPO1_SRVW0_SSO0_SVW4_SK3_SKFTR0_SKXCCM8_SGRO0_TDMI0_TIN1_TLDS1_TLDSMn1_ULSGRO0_USL1_UIOFGRO0_UPLRP0_USFGRO1_VSn1_VWA4_VWB1_WSGRA2_WSGRB0_WS64_WG16_16_1_WGM16_WGMXCC1_WGMXCCGn1
    SolutionIndex: 214
    SolutionNameMin: Cijk_Ailk_Bljk_S_B_Bias_HA_S_SAV_UserArgs_MT128x64x32_MI16x16x1_SN_LDSB0_AFC0_AG0_AFEM1_AFEM1_ASEM1_CLR1_CADS0_DTLA0_DTLB0_DTVA0_DTVB0_DTVMXSA0_DTVMXSB0_DTVSM0_DPLB0_EPS1_ELFLR0_EMLLn1_FDSI0_GRPM1_GRVWA1_GRVWB1_GSU0_GSUAMB_GSUC0_GSUWGMRR0_GLS0_ISA950_IU1_K1_LDSTI0_LBSPPA0_LBSPPB256_LBSPPM0_LPA0_LPB8_LPM0_LRVWn1_LWPMn1_MIAV0_MIWT4_2_MO40_MGRIPM1_NTn1_NTA0_NTB0_NTC4_NTD4_NTM0_NEPBS10_NLCA2_NLCB1_ONLL1_PGR1_PLR1_PKA1_SGROB0_SIA3_SS1_SU0_SUM0_SUS0_SPO0_SRVW0_SSO0_SVW4_SK3_SKFTR0_SKXCCM0_SGRO0_TDMI0_TIN1_TLDS1_TLDSMn1_ULSGRO0_USL1_UIOFGRO0_UPLRP0_USFGRO1_VSn1_VWA4_VWB2_WSGRA2_WSGRB0_WS64_WG32_8_1_WGM16_WGMXCC1_WGMXCCGn1
    SolutionIndex: 215
    SolutionNameMin: Cijk_Ailk_Bljk_S_B_Bias_HA_S_SAV_UserArgs_MT80x64x32_MI16x16x1_SN_LDSB0_AFC0_AG0_AFEM1_AFEM1_ASEM1_CLR1_CADS0_DTLA0_DTLB0_DTVA0_DTVB0_DTVMXSA0_DTVMXSB0_DTVSM0_DPLB0_EPS1_ELFLR0_EMLL0_FDSI0_GRPM1_GRVWA1_GRVWB4_GSU0_GSUAMB_GSUC0_GSUWGMRR0_GLS0_ISA950_IU1_K1_LDSTI0_LBSPPA128_LBSPPB128_LBSPPM0_LPA8_LPB8_LPM0_LRVWn1_LWPMn1_MIAV1_MIWT5_1_MO40_MGRIPM1_NTn1_NTA0_NTB0_NTC0_NTD0_NTM0_NEPBS0_NLCA5_NLCB1_ONLL1_PGR1_PLR1_PKA1_SGROB0_SIA3_SS1_SU0_SUM0_SUS0_SPO0_SRVW0_SSO0_SVW1_SK3_SKFTR0_SKXCCM8_SGRO0_TDMI0_TIN1_TLDS2_TLDSMn1_ULSGRO0_USL1_UIOFGRO0_UPLRP0_USFGRO1_VSn1_VWA1_VWB1_WSGRA0_WSGRB0_WS64_WG16_16_1_WGM2_WGMXCC1_WGMXCCGn1
    SolutionIndex: 216
    SolutionNameMin: Cijk_Ailk_Bljk_S_B_Bias_HA_S_SAV_UserArgs_MT64x96x32_MI16x16x1_SN_LDSB0_AFC0_AG0_AFEM1_AFEM1_ASEM1_CLR1_CADS0_DTLA0_DTLB0_DTVA0_DTVB0_DTVMXSA0_DTVMXSB0_DTVSM0_DPLB0_EPS1_ELFLR0_EMLL0_FDSI0_GRPM1_GRVWA1_GRVWB4_GSU0_GSUAMB_GSUC0_GSUWGMRR0_GLS0_ISA950_IU1_K1_LDSTI0_LBSPPA0_LBSPPB128_LBSPPM0_LPA0_LPB8_LPM0_LRVWn1_LWPMn1_MIAV0_MIWT2_3_MO40_MGRIPM1_NTn1_NTA0_NTB0_NTC4_NTD4_NTM0_NEPBS0_NLCA1_NLCB1_ONLL1_PGR1_PLR1_PKA1_SGROB0_SIA3_SS1_SU0_SUM0_SUS0_SPO0_SRVW0_SSO1_SVW2_SK3_SKFTR0_SKXCCM0_SGRO0_TDMI0_TIN1_TLDS1_TLDSMn1_ULSGRO0_USL1_UIOFGRO0_UPLRP0_USFGRO1_VSn1_VWA2_VWB1_WSGRA0_WSGRB0_WS64_WG32_8_1_WGM8_WGMXCC1_WGMXCCGn1
    SolutionIndex: 217
    SolutionNameMin: Cijk_Ailk_Bljk_S_B_Bias_HA_S_SAV_UserArgs_MT64x64x32_MI16x16x1_SN_LDSB0_AFC0_AG1_AFEM1_AFEM1_ASEM1_CLR1_CADS0_DTLA0_DTLB0_DTVA0_DTVB0_DTVMXSA0_DTVMXSB0_DTVSM0_DPLB0_EPS1_ELFLR0_EMLLn1_FDSI0_GRPM1_GRVWA1_GRVWB4_GSU0_GSUAMB_GSUC0_GSUWGMRR0_GLS0_ISA950_IU1_K1_LDSTI0_LBSPPA0_LBSPPB256_LBSPPM0_LPA0_LPB8_LPM0_LRVWn1_LWPMn1_MIAV0_MIWT2_2_MO40_MGRIPM1_NTn1_NTA0_NTB0_NTC4_NTD4_NTM0_NEPBS16_NLCA1_NLCB1_ONLL1_PGR1_PLR1_PKA1_SGROB0_SIA3_SS1_SU0_SUM0_SUS0_SPO0_SRVW0_SSO1_SVW2_SK3_SKFTR0_SKXCCM4_SGRO0_TDMI0_TIN1_TLDS1_TLDSMn1_ULSGRO0_USL1_UIOFGRO0_UPLRP0_USFGRO1_VSn1_VWA2_VWB2_WSGRA2_WSGRB0_WS64_WG32_8_1_WGMn2_WGMXCC1_WGMXCCGn1
    SolutionIndex: 218
    SolutionNameMin: Cijk_Ailk_Bljk_S_B_Bias_HA_S_SAV_UserArgs_MT128x64x32_MI16x16x1_SN_LDSB1_AFC0_AG0_AFEM1_AFEM1_ASEM1_CLR1_CADS0_DTLA0_DTLB0_DTVA0_DTVB0_DTVMXSA0_DTVMXSB0_DTVSM0_DPLB0_EPS0_ELFLR0_EMLLn1_FDSI0_GRPM1_GRVWA4_GRVWB4_GSU0_GSUAMB_GSUC0_GSUWGMRR0_GLS0_ISA950_IU1_K1_LDSTI0_LBSPPA0_LBSPPB256_LBSPPM0_LPA0_LPB8_LPM0_LRVWn1_LWPMn1_MIAV1_MIWT4_2_MO40_MGRIPM1_NTn1_NTA0_NTB0_NTC4_NTD4_NTM0_NEPBS0_NLCA1_NLCB1_ONLL1_PGR2_PLR1_PKA1_SGROB0_SIA3_SS1_SU0_SUM0_SUS0_SPO0_SRVW0_SSO0_SVW4_SK3_SKFTR0_SKXCCM0_SGRO0_TDMI0_TIN1_TLDS1_TLDSMn1_ULSGRO0_USL1_UIOFGRO0_UPLRP0_USFGRO0_VSn1_VWA4_VWB2_WSGRA2_WSGRB0_WS64_WG32_8_1_WGM4_WGMXCC8_WGMXCCGn1
    SolutionIndex: 219
    SolutionNameMin: Cijk_Ailk_Bljk_S_B_Bias_HA_S_SAV_UserArgs_MT64x64x32_MI16x16x1_SN_LDSB0_AFC0_AG0_AFEM1_AFEM1_ASEM1_CLR1_CADS0_DTLA0_DTLB0_DTVA0_DTVB0_DTVMXSA0_DTVMXSB0_DTVSM0_DPLB0_EPS1_ELFLR0_EMLLn1_FDSI0_GRPM1_GRVWA1_GRVWB4_GSU0_GSUAMB_GSUC0_GSUWGMRR0_GLS0_ISA950_IU1_K1_LDSTI0_LBSPPA0_LBSPPB256_LBSPPM0_LPA0_LPB8_LPM0_LRVWn1_LWPMn1_MIAV0_MIWT2_2_MO40_MGRIPM1_NTn1_NTA0_NTB0_NTC4_NTD4_NTM0_NEPBS10_NLCA1_NLCB1_ONLL1_PGR1_PLR1_PKA1_SGROB0_SIA3_SS1_SU0_SUM0_SUS0_SPO1_SRVW0_SSO0_SVW2_SK3_SKFTR0_SKXCCM0_SGRO0_TDMI0_TIN1_TLDS1_TLDSMn1_ULSGRO0_USL1_UIOFGRO0_UPLRP0_USFGRO1_VSn1_VWA2_VWB2_WSGRA0_WSGRB0_WS64_WG32_8_1_WGM6_WGMXCC2_WGMXCCGn1
    SolutionIndex: 220
    SolutionNameMin: Cijk_Ailk_Bljk_S_B_Bias_HA_S_SAV_UserArgs_MT80x64x32_MI16x16x1_SN_LDSB0_AFC0_AG1_AFEM1_AFEM1_ASEM1_CLR1_CADS0_DTLA0_DTLB0_DTVA0_DTVB0_DTVMXSA0_DTVMXSB0_DTVSM0_DPLB0_EPS1_ELFLR0_EMLLn1_FDSI0_GRPM1_GRVWA1_GRVWB4_GSU0_GSUAMB_GSUC0_GSUWGMRR0_GLS0_ISA950_IU1_K1_LDSTI0_LBSPPA1280_LBSPPB128_LBSPPM0_LPA16_LPB8_LPM0_LRVWn1_LWPMn1_MIAV1_MIWT5_1_MO40_MGRIPM1_NTn1_NTA0_NTB0_NTC0_NTD0_NTM0_NEPBS0_NLCA5_NLCB1_ONLL1_PGR1_PLR1_PKA1_SGROB0_SIA3_SS1_SU0_SUM0_SUS0_SPO0_SRVW0_SSO0_SVW1_SK3_SKFTR0_SKXCCM4_SGRO0_TDMI0_TIN1_TLDS1_TLDSMn1_ULSGRO0_USL1_UIOFGRO0_UPLRP0_USFGRO1_VSn1_VWA1_VWB1_WSGRA0_WSGRB2_WS64_WG16_16_1_WGM4_WGMXCC1_WGMXCCGn1
    SolutionIndex: 221
    SolutionNameMin: Cijk_Ailk_Bljk_S_B_Bias_HA_S_SAV_UserArgs_MT160x64x32_MI16x16x1_SN_LDSB0_AFC0_AG1_AFEM1_AFEM1_ASEM1_CLR1_CADS0_DTLA0_DTLB0_DTVA0_DTVB0_DTVMXSA0_DTVMXSB0_DTVSM0_DPLB0_EPS0_ELFLR0_EMLLn1_FDSI0_GRPM1_GRVWA4_GRVWB4_GSU0_GSUAMB_GSUC0_GSUWGMRR0_GLS0_ISA950_IU1_K1_LDSTI0_LBSPPA2560_LBSPPB256_LBSPPM0_LPA16_LPB8_LPM0_LRVWn1_LWPMn1_MIAV0_MIWT5_2_MO40_MGRIPM1_NTn1_NTA0_NTB0_NTC0_NTD4_NTM0_NEPBS0_NLCA5_NLCB1_ONLL1_PGR2_PLR1_PKA1_SGROB0_SIA3_SS1_SU0_SUM0_SUS0_SPO0_SRVW0_SSO1_SVW1_SK3_SKFTR0_SKXCCM0_SGRO0_TDMI0_TIN1_TLDS1_TLDSMn1_ULSGRO0_USL1_UIOFGRO0_UPLRP0_USFGRO0_VSn1_VWA1_VWB2_WSGRA0_WSGRB0_WS64_WG32_8_1_WGM8_WGMXCC4_WGMXCCGn1
    SolutionIndex: 222
    SolutionNameMin: Cijk_Ailk_Bljk_S_B_Bias_HA_S_SAV_UserArgs_MT96x64x32_MI16x16x1_SN_LDSB1_AFC0_AG0_AFEM1_AFEM1_ASEM1_CLR1_CADS0_DTLA0_DTLB0_DTVA0_DTVB0_DTVMXSA0_DTVMXSB0_DTVSM0_DPLB0_EPS0_ELFLR0_EMLL0_FDSI0_GRPM1_GRVWA1_GRVWB4_GSU0_GSUAMB_GSUC0_GSUWGMRR0_GLS0_ISA950_IU1_K1_LDSTI0_LBSPPA0_LBSPPB128_LBSPPM0_LPA0_LPB8_LPM0_LRVWn1_LWPMn1_MIAV0_MIWT6_1_MO40_MGRIPM1_NTn1_NTA0_NTB4_NTC0_NTD4_NTM0_NEPBS12_NLCA3_NLCB1_ONLL1_PGR2_PLR1_PKA1_SGROB0_SIA3_SS1_SU0_SUM0_SUS0_SPO0_SRVW0_SSO0_SVW2_SK3_SKFTR0_SKXCCM0_SGRO0_TDMI0_TIN1_TLDS1_TLDSMn1_ULSGRO1_USL1_UIOFGRO0_UPLRP0_USFGRO1_VSn1_VWA2_VWB1_WSGRA0_WSGRB2_WS64_WG16_16_1_WGM32_WGMXCC32_WGMXCCGn1
    SolutionIndex: 223
    SolutionNameMin: Cijk_Ailk_Bljk_S_B_Bias_HA_S_SAV_UserArgs_MT32x64x64_MI16x16x1_SN_LDSB1_AFC0_AG0_AFEM1_AFEM1_ASEM1_CLR1_CADS0_DTLA0_DTLB0_DTVA0_DTVB0_DTVMXSA0_DTVMXSB0_DTVSM0_DPLB0_EPS0_ELFLR0_EMLL0_FDSI0_GRPM1_GRVWA4_GRVWB4_GSU0_GSUAMB_GSUC0_GSUWGMRR0_GLS0_ISA950_IU1_K1_LDSTI0_LBSPPA0_LBSPPB256_LBSPPM0_LPA0_LPB8_LPM0_LRVWn1_LWPMn1_MIAV0_MIWT2_1_MO40_MGRIPM1_NTn1_NTA4_NTB0_NTC4_NTD4_NTM0_NEPBS14_NLCA1_NLCB1_ONLL1_PGR2_PLR1_PKA1_SGROB0_SIA3_SS1_SU0_SUM0_SUS0_SPO1_SRVW0_SSO1_SVW2_SK3_SKFTR0_SKXCCM8_SGRO0_TDMI0_TIN1_TLDS1_TLDSMn1_ULSGRO1_USL1_UIOFGRO0_UPLRP0_USFGRO0_VSn1_VWA2_VWB1_WSGRA0_WSGRB0_WS64_WG16_16_1_WGM8_WGMXCC1_WGMXCCGn1
    SolutionIndex: 224
    SolutionNameMin: Cijk_Ailk_Bljk_S_B_Bias_HA_S_SAV_UserArgs_MT32x64x64_MI16x16x1_SN_LDSB1_AFC0_AG1_AFEM1_AFEM1_ASEM1_CLR1_CADS0_DTLA0_DTLB0_DTVA0_DTVB0_DTVMXSA0_DTVMXSB0_DTVSM0_DPLB0_EPS0_ELFLR0_EMLL0_FDSI0_GRPM1_GRVWA4_GRVWB4_GSU0_GSUAMB_GSUC0_GSUWGMRR0_GLS0_ISA950_IU1_K1_LDSTI0_LBSPPA0_LBSPPB256_LBSPPM0_LPA0_LPB8_LPM0_LRVWn1_LWPMn1_MIAV0_MIWT2_1_MO40_MGRIPM1_NTn1_NTA4_NTB0_NTC0_NTD4_NTM0_NEPBS12_NLCA1_NLCB1_ONLL1_PGR2_PLR1_PKA1_SGROB0_SIA3_SS1_SU0_SUM0_SUS0_SPO0_SRVW0_SSO1_SVW2_SK3_SKFTR0_SKXCCM8_SGRO0_TDMI0_TIN1_TLDS1_TLDSMn1_ULSGRO1_USL1_UIOFGRO0_UPLRP0_USFGRO0_VSn1_VWA2_VWB1_WSGRA0_WSGRB0_WS64_WG16_16_1_WGM16_WGMXCC1_WGMXCCGn1
    SolutionIndex: 225
    SolutionNameMin: Cijk_Ailk_Bljk_S_B_Bias_HA_S_SAV_UserArgs_MT128x64x32_MI16x16x1_SN_LDSB0_AFC0_AG0_AFEM1_AFEM1_ASEM1_CLR1_CADS0_DTLA0_DTLB0_DTVA0_DTVB0_DTVMXSA0_DTVMXSB0_DTVSM0_DPLB0_EPS0_ELFLR0_EMLLn1_FDSI0_GRPM1_GRVWA1_GRVWB4_GSU0_GSUAMB_GSUC0_GSUWGMRR0_GLS0_ISA950_IU1_K1_LDSTI0_LBSPPA0_LBSPPB256_LBSPPM0_LPA0_LPB8_LPM0_LRVWn1_LWPMn1_MIAV1_MIWT4_2_MO40_MGRIPM1_NTn1_NTA0_NTB4_NTC4_NTD0_NTM0_NEPBS0_NLCA1_NLCB1_ONLL1_PGR2_PLR1_PKA1_SGROB0_SIA3_SS1_SU0_SUM0_SUS0_SPO0_SRVW0_SSO0_SVW4_SK3_SKFTR0_SKXCCM0_SGRO0_TDMI0_TIN1_TLDS1_TLDSMn1_ULSGRO1_USL1_UIOFGRO0_UPLRP0_USFGRO1_VSn1_VWA4_VWB2_WSGRA0_WSGRB0_WS64_WG32_8_1_WGM2_WGMXCC4_WGMXCCGn1
    SolutionIndex: 226
    SolutionNameMin: Cijk_Ailk_Bljk_S_B_Bias_HA_S_SAV_UserArgs_MT64x64x32_MI32x32x1_SN_LDSB0_AFC0_AG0_AFEM1_AFEM1_ASEM1_CLR1_CADS0_DTLA0_DTLB0_DTVA0_DTVB0_DTVMXSA0_DTVMXSB0_DTVSM0_DPLB0_EPS1_ELFLR0_EMLL0_FDSI0_GRPM1_GRVWA1_GRVWB4_GSU0_GSUAMB_GSUC0_GSUWGMRR0_GLS0_ISA950_IU1_K1_LDSTI0_LBSPPA0_LBSPPB128_LBSPPM0_LPA0_LPB4_LPM0_LRVWn1_LWPMn1_MIAV0_MIWT1_1_MO40_MGRIPM1_NTn1_NTA0_NTB0_NTC4_NTD4_NTM0_NEPBS0_NLCA1_NLCB1_ONLL1_PGR1_PLR1_PKA1_SGROB0_SIA3_SS1_SU0_SUM0_SUS0_SPO1_SRVW0_SSO0_SVW1_SK3_SKFTR0_SKXCCM4_SGRO0_TDMI0_TIN1_TLDS1_TLDSMn1_ULSGRO0_USL1_UIOFGRO0_UPLRP0_USFGRO1_VSn1_VWA1_VWB1_WSGRA2_WSGRB0_WS64_WG64_4_1_WGM2_WGMXCC1_WGMXCCGn1
    SolutionIndex: 227
    SolutionNameMin: Cijk_Ailk_Bljk_S_B_Bias_HA_S_SAV_UserArgs_MT64x112x32_MI16x16x1_SN_LDSB0_AFC0_AG1_AFEM1_AFEM1_ASEM1_CLR1_CADS0_DTLA0_DTLB0_DTVA0_DTVB0_DTVMXSA0_DTVMXSB0_DTVSM0_DPLB0_EPS1_ELFLR0_EMLL0_FDSI0_GRPM1_GRVWA1_GRVWB2_GSU0_GSUAMB_GSUC0_GSUWGMRR0_GLS0_ISA950_IU1_K1_LDSTI0_LBSPPA1024_LBSPPB128_LBSPPM0_LPA16_LPB8_LPM0_LRVWn1_LWPMn1_MIAV0_MIWT1_7_MO40_MGRIPM1_NTn1_NTA0_NTB0_NTC0_NTD4_NTM0_NEPBS0_NLCA1_NLCB1_ONLL1_PGR1_PLR1_PKA1_SGROB0_SIA3_SS1_SU0_SUM0_SUS0_SPO0_SRVW0_SSO1_SVW1_SK3_SKFTR0_SKXCCM0_SGRO0_TDMI0_TIN1_TLDS1_TLDSMn1_ULSGRO0_USL1_UIOFGRO0_UPLRP0_USFGRO1_VSn1_VWA1_VWB1_WSGRA0_WSGRB0_WS64_WG64_4_1_WGM8_WGMXCC1_WGMXCCGn1
    SolutionIndex: 228
    SolutionNameMin: Cijk_Ailk_Bljk_S_B_Bias_HA_S_SAV_UserArgs_MT96x64x32_MI16x16x1_SN_LDSB1_AFC0_AG0_AFEM1_AFEM1_ASEM1_CLR1_CADS0_DTLA0_DTLB0_DTVA0_DTVB0_DTVMXSA0_DTVMXSB0_DTVSM0_DPLB0_EPS0_ELFLR0_EMLL0_FDSI0_GRPM1_GRVWA1_GRVWB4_GSU0_GSUAMB_GSUC0_GSUWGMRR0_GLS0_ISA950_IU1_K1_LDSTI0_LBSPPA0_LBSPPB128_LBSPPM0_LPA0_LPB8_LPM0_LRVWn1_LWPMn1_MIAV0_MIWT6_1_MO40_MGRIPM1_NTn1_NTA0_NTB0_NTC4_NTD4_NTM0_NEPBS12_NLCA3_NLCB1_ONLL1_PGR2_PLR1_PKA1_SGROB0_SIA3_SS1_SU0_SUM0_SUS0_SPO0_SRVW0_SSO0_SVW2_SK3_SKFTR0_SKXCCM8_SGRO0_TDMI0_TIN1_TLDS1_TLDSMn1_ULSGRO1_USL1_UIOFGRO0_UPLRP0_USFGRO0_VSn1_VWA2_VWB1_WSGRA0_WSGRB0_WS64_WG16_16_1_WGM4_WGMXCC1_WGMXCCGn1
    SolutionIndex: 229
    SolutionNameMin: Cijk_Ailk_Bljk_S_B_Bias_HA_S_SAV_UserArgs_MT32x128x32_MI32x32x1_SN_LDSB0_AFC0_AG1_AFEM1_AFEM1_ASEM1_CLR1_CADS0_DTLA0_DTLB0_DTVA0_DTVB0_DTVMXSA0_DTVMXSB0_DTVSM0_DPLB0_EPS1_ELFLR0_EMLLn1_FDSI0_GRPM1_GRVWA1_GRVWB4_GSU0_GSUAMB_GSUC0_GSUWGMRR0_GLS0_ISA950_IU1_K1_LDSTI0_LBSPPA0_LBSPPB128_LBSPPM0_LPA0_LPB4_LPM0_LRVWn1_LWPMn1_MIAV0_MIWT1_1_MO40_MGRIPM1_NTn1_NTA0_NTB4_NTC0_NTD4_NTM0_NEPBS0_NLCA1_NLCB1_ONLL1_PGR1_PLR1_PKA1_SGROB0_SIA3_SS1_SU0_SUM0_SUS0_SPO1_SRVW0_SSO0_SVW1_SK3_SKFTR0_SKXCCM0_SGRO0_TDMI0_TIN1_TLDS1_TLDSMn1_ULSGRO0_USL1_UIOFGRO0_UPLRP0_USFGRO1_VSn1_VWA1_VWB1_WSGRA0_WSGRB0_WS64_WG32_8_1_WGMn4_WGMXCC32_WGMXCCGn1
    SolutionIndex: 230
    SolutionNameMin: Cijk_Ailk_Bljk_S_B_Bias_HA_S_SAV_UserArgs_MT64x80x32_MI16x16x1_SN_LDSB1_AFC0_AG0_AFEM1_AFEM1_ASEM1_CLR1_CADS0_DTLA0_DTLB0_DTVA0_DTVB0_DTVMXSA0_DTVMXSB0_DTVSM0_DPLB0_EPS0_ELFLR0_EMLLn1_FDSI0_GRPM1_GRVWA1_GRVWB1_GSU0_GSUAMB_GSUC0_GSUWGMRR0_GLS0_ISA950_IU1_K1_LDSTI0_LBSPPA1024_LBSPPB128_LBSPPM0_LPA16_LPB8_LPM0_LRVWn1_LWPMn1_MIAV1_MIWT1_5_MO40_MGRIPM1_NTn1_NTA0_NTB0_NTC0_NTD4_NTM0_NEPBS12_NLCA1_NLCB1_ONLL1_PGR2_PLR1_PKA1_SGROB0_SIA3_SS0_SU0_SUM0_SUS0_SPO0_SRVW0_SSO0_SVW4_SK3_SKFTR0_SKXCCM0_SGRO0_TDMI0_TIN1_TLDS1_TLDSMn1_ULSGRO1_USL1_UIOFGRO0_UPLRP0_USFGRO0_VSn1_VWA1_VWB1_WSGRA0_WSGRB0_WS64_WG64_4_1_WGM4_WGMXCC16_WGMXCCGn1
    SolutionIndex: 231
    SolutionNameMin: Cijk_Ailk_Bljk_S_B_Bias_HA_S_SAV_UserArgs_MT48x64x32_MI16x16x1_SN_LDSB0_AFC0_AG1_AFEM1_AFEM1_ASEM1_CLR1_CADS0_DTLA0_DTLB0_DTVA0_DTVB0_DTVMXSA0_DTVMXSB0_DTVSM0_DPLB0_EPS0_ELFLR0_EMLLn1_FDSI0_GRPM1_GRVWA1_GRVWB4_GSU0_GSUAMB_GSUC0_GSUWGMRR0_GLS0_ISA950_IU1_K1_LDSTI0_LBSPPA768_LBSPPB128_LBSPPM0_LPA16_LPB8_LPM0_LRVWn1_LWPMn1_MIAV0_MIWT3_1_MO40_MGRIPM1_NTn1_NTA0_NTB0_NTC4_NTD4_NTM0_NEPBS16_NLCA3_NLCB1_ONLL1_PGR2_PLR1_PKA1_SGROB0_SIA3_SS1_SU0_SUM0_SUS0_SPO0_SRVW0_SSO0_SVW1_SK3_SKFTR0_SKXCCM4_SGRO0_TDMI0_TIN1_TLDS1_TLDSMn1_ULSGRO0_USL1_UIOFGRO0_UPLRP0_USFGRO1_VSn1_VWA1_VWB1_WSGRA0_WSGRB0_WS64_WG16_16_1_WGM2_WGMXCC1_WGMXCCGn1
    SolutionIndex: 232
    SolutionNameMin: Cijk_Ailk_Bljk_S_B_Bias_HA_S_SAV_UserArgs_MT64x192x32_MI16x16x1_SN_LDSB0_AFC0_AG1_AFEM1_AFEM1_ASEM1_CLR1_CADS0_DTLA0_DTLB0_DTVA0_DTVB0_DTVMXSA0_DTVMXSB0_DTVSM0_DPLB0_EPS0_ELFLR0_EMLLn1_FDSI0_GRPM1_GRVWA1_GRVWB4_GSU0_GSUAMB_GSUC0_GSUWGMRR0_GLS0_ISA950_IU1_K1_LDSTI0_LBSPPA0_LBSPPB128_LBSPPM0_LPA0_LPB8_LPM0_LRVWn1_LWPMn1_MIAV0_MIWT4_3_MO40_MGRIPM1_NTn1_NTA0_NTB0_NTC4_NTD4_NTM0_NEPBS16_NLCA1_NLCB1_ONLL1_PGR2_PLR1_PKA1_SGROB0_SIA3_SS1_SU0_SUM0_SUS0_SPO0_SRVW0_SSO0_SVW4_SK3_SKFTR0_SKXCCM4_SGRO0_TDMI0_TIN1_TLDS1_TLDSMn1_ULSGRO0_USL1_UIOFGRO0_UPLRP0_USFGRO1_VSn1_VWA4_VWB1_WSGRA2_WSGRB0_WS64_WG16_16_1_WGM2_WGMXCC1_WGMXCCGn1
    SolutionIndex: 233
    SolutionNameMin: Cijk_Ailk_Bljk_S_B_Bias_HA_S_SAV_UserArgs_MT32x64x32_MI16x16x1_SN_LDSB0_AFC0_AG1_AFEM1_AFEM1_ASEM1_CLR1_CADS0_DTLA0_DTLB0_DTVA0_DTVB0_DTVMXSA0_DTVMXSB0_DTVSM0_DPLB0_EPS0_ELFLR0_EMLL0_FDSI0_GRPM1_GRVWA1_GRVWB4_GSU0_GSUAMB_GSUC0_GSUWGMRR0_GLS0_ISA950_IU1_K1_LDSTI0_LBSPPA0_LBSPPB128_LBSPPM0_LPA0_LPB8_LPM0_LRVWn1_LWPMn1_MIAV0_MIWT2_1_MO40_MGRIPM1_NTn1_NTA0_NTB0_NTC4_NTD4_NTM0_NEPBS10_NLCA1_NLCB1_ONLL1_PGR2_PLR1_PKA1_SGROB0_SIA3_SS1_SU0_SUM0_SUS0_SPO0_SRVW0_SSO1_SVW2_SK3_SKFTR0_SKXCCM0_SGRO0_TDMI0_TIN1_TLDS1_TLDSMn1_ULSGRO0_USL1_UIOFGRO0_UPLRP0_USFGRO1_VSn1_VWA2_VWB1_WSGRA0_WSGRB2_WS64_WG16_16_1_WGM4_WGMXCC1_WGMXCCGn1
    SolutionIndex: 234
    SolutionNameMin: Cijk_Ailk_Bljk_S_B_Bias_HA_S_SAV_UserArgs_MT80x64x32_MI16x16x1_SN_LDSB0_AFC0_AG1_AFEM1_AFEM1_ASEM1_CLR1_CADS0_DTLA0_DTLB0_DTVA0_DTVB0_DTVMXSA0_DTVMXSB0_DTVSM0_DPLB0_EPS0_ELFLR0_EMLLn1_FDSI0_GRPM1_GRVWA1_GRVWB1_GSU0_GSUAMB_GSUC0_GSUWGMRR0_GLS0_ISA950_IU1_K1_LDSTI0_LBSPPA1280_LBSPPB128_LBSPPM0_LPA16_LPB8_LPM0_LRVWn1_LWPMn1_MIAV1_MIWT5_1_MO40_MGRIPM1_NTn1_NTA0_NTB4_NTC0_NTD4_NTM0_NEPBS0_NLCA5_NLCB1_ONLL1_PGR2_PLR1_PKA1_SGROB0_SIA3_SS1_SU0_SUM0_SUS0_SPO0_SRVW0_SSO0_SVW1_SK3_SKFTR0_SKXCCM0_SGRO0_TDMI0_TIN0_TLDS1_TLDSMn1_ULSGRO1_USL1_UIOFGRO0_UPLRP0_USFGRO0_VSn1_VWA1_VWB1_WSGRA0_WSGRB2_WS64_WG16_16_1_WGMn16_WGMXCC1_WGMXCCGn1
    SolutionIndex: 235
    SolutionNameMin: Cijk_Ailk_Bljk_S_B_Bias_HA_S_SAV_UserArgs_MT32x32x128_MI16x16x1_SN_LDSB0_AFC0_AG1_AFEM1_AFEM1_ASEM1_CLR1_CADS0_DTLA0_DTLB0_DTVA0_DTVB0_DTVMXSA0_DTVMXSB0_DTVSM0_DPLB0_EPS0_ELFLR0_EMLL0_FDSI0_GRPM1_GRVWA1_GRVWB4_GSU0_GSUAMB_GSUC0_GSUWGMRR0_GLS0_ISA950_IU1_K1_LDSTI0_LBSPPA512_LBSPPB512_LBSPPM0_LPA16_LPB8_LPM0_LRVWn1_LWPMn1_MIAV1_MIWT1_1_MO40_MGRIPM1_NTn1_NTA0_NTB4_NTC4_NTD4_NTM0_NEPBS4_NLCA1_NLCB1_ONLL1_PGR2_PLR1_PKA1_SGROB0_SIA3_SS1_SU0_SUM0_SUS0_SPO0_SRVW0_SSO0_SVW1_SK3_SKFTR0_SKXCCM0_SGRO0_TDMI0_TIN1_TLDS1_TLDSMn1_ULSGRO0_USL1_UIOFGRO0_UPLRP0_USFGRO0_VSn1_VWA1_VWB1_WSGRA0_WSGRB0_WS64_WG32_8_1_WGMn8_WGMXCC1_WGMXCCGn1
    SolutionIndex: 236
    SolutionNameMin: Cijk_Ailk_Bljk_S_B_Bias_HA_S_SAV_UserArgs_MT64x64x32_MI16x16x1_SN_LDSB1_AFC0_AG1_AFEM1_AFEM1_ASEM1_CLR1_CADS0_DTLA0_DTLB0_DTVA0_DTVB0_DTVMXSA0_DTVMXSB0_DTVSM0_DPLB0_EPS0_ELFLR0_EMLLn1_FDSI0_GRPM1_GRVWA1_GRVWB4_GSU0_GSUAMB_GSUC0_GSUWGMRR0_GLS0_ISA950_IU1_K1_LDSTI0_LBSPPA0_LBSPPB128_LBSPPM0_LPA0_LPB8_LPM0_LRVWn1_LWPMn1_MIAV0_MIWT4_1_MO40_MGRIPM1_NTn1_NTA0_NTB0_NTC4_NTD4_NTM0_NEPBS10_NLCA1_NLCB1_ONLL1_PGR2_PLR1_PKA1_SGROB0_SIA3_SS1_SU0_SUM0_SUS0_SPO1_SRVW0_SSO0_SVW4_SK3_SKFTR0_SKXCCM0_SGRO0_TDMI0_TIN1_TLDS1_TLDSMn1_ULSGRO1_USL1_UIOFGRO0_UPLRP0_USFGRO1_VSn1_VWA4_VWB1_WSGRA0_WSGRB0_WS64_WG16_16_1_WGM8_WGMXCC1_WGMXCCGn1
    SolutionIndex: 237
    SolutionNameMin: Cijk_Ailk_Bljk_S_B_Bias_HA_S_SAV_UserArgs_MT64x64x32_MI16x16x1_SN_LDSB1_AFC0_AG1_AFEM1_AFEM1_ASEM1_CLR1_CADS0_DTLA0_DTLB0_DTVA0_DTVB0_DTVMXSA0_DTVMXSB0_DTVSM0_DPLB0_EPS0_ELFLR0_EMLL0_FDSI0_GRPM1_GRVWA1_GRVWB4_GSU0_GSUAMB_GSUC0_GSUWGMRR0_GLS0_ISA950_IU1_K1_LDSTI0_LBSPPA0_LBSPPB128_LBSPPM0_LPA0_LPB8_LPM0_LRVWn1_LWPMn1_MIAV0_MIWT4_1_MO40_MGRIPM1_NTn1_NTA0_NTB0_NTC4_NTD4_NTM0_NEPBS8_NLCA1_NLCB1_ONLL1_PGR2_PLR1_PKA1_SGROB0_SIA3_SS1_SU0_SUM0_SUS0_SPO0_SRVW0_SSO1_SVW4_SK3_SKFTR0_SKXCCM0_SGRO0_TDMI0_TIN1_TLDS1_TLDSMn1_ULSGRO0_USL1_UIOFGRO0_UPLRP0_USFGRO1_VSn1_VWA4_VWB1_WSGRA2_WSGRB0_WS64_WG16_16_1_WGM24_WGMXCC1_WGMXCCGn1
    SolutionIndex: 238
    SolutionNameMin: Cijk_Ailk_Bljk_S_B_Bias_HA_S_SAV_UserArgs_MT96x64x32_MI16x16x1_SN_LDSB0_AFC0_AG0_AFEM1_AFEM1_ASEM1_CLR1_CADS0_DTLA0_DTLB0_DTVA0_DTVB0_DTVMXSA0_DTVMXSB0_DTVSM0_DPLB0_EPS0_ELFLR0_EMLLn1_FDSI0_GRPM1_GRVWA1_GRVWB4_GSU0_GSUAMB_GSUC0_GSUWGMRR0_GLS0_ISA950_IU1_K1_LDSTI0_LBSPPA0_LBSPPB128_LBSPPM0_LPA0_LPB8_LPM0_LRVWn1_LWPMn1_MIAV0_MIWT6_1_MO40_MGRIPM1_NTn1_NTA0_NTB0_NTC4_NTD4_NTM0_NEPBS0_NLCA3_NLCB1_ONLL1_PGR2_PLR1_PKA1_SGROB0_SIA3_SS1_SU0_SUM0_SUS0_SPO0_SRVW0_SSO0_SVW2_SK3_SKFTR0_SKXCCM8_SGRO0_TDMI0_TIN1_TLDS1_TLDSMn1_ULSGRO0_USL1_UIOFGRO0_UPLRP0_USFGRO0_VSn1_VWA2_VWB1_WSGRA0_WSGRB0_WS64_WG16_16_1_WGM2_WGMXCC1_WGMXCCGn1
    SolutionIndex: 239
    SolutionNameMin: Cijk_Ailk_Bljk_S_B_Bias_HA_S_SAV_UserArgs_MT64x64x32_MI16x16x1_SN_LDSB1_AFC0_AG0_AFEM1_AFEM1_ASEM1_CLR1_CADS0_DTLA0_DTLB0_DTVA0_DTVB0_DTVMXSA0_DTVMXSB0_DTVSM0_DPLB0_EPS0_ELFLR0_EMLL0_FDSI0_GRPM1_GRVWA1_GRVWB4_GSU0_GSUAMB_GSUC0_GSUWGMRR0_GLS0_ISA950_IU1_K1_LDSTI0_LBSPPA0_LBSPPB128_LBSPPM0_LPA0_LPB8_LPM0_LRVWn1_LWPMn1_MIAV1_MIWT4_1_MO40_MGRIPM1_NTn1_NTA0_NTB0_NTC4_NTD4_NTM0_NEPBS12_NLCA1_NLCB1_ONLL1_PGR2_PLR1_PKA1_SGROB0_SIA3_SS1_SU0_SUM0_SUS0_SPO0_SRVW0_SSO0_SVW4_SK3_SKFTR0_SKXCCM4_SGRO0_TDMI0_TIN1_TLDS1_TLDSMn1_ULSGRO1_USL1_UIOFGRO0_UPLRP0_USFGRO0_VSn1_VWA4_VWB1_WSGRA2_WSGRB2_WS64_WG16_16_1_WGM48_WGMXCC1_WGMXCCGn1
    SolutionIndex: 240
    SolutionNameMin: Cijk_Ailk_Bljk_S_B_Bias_HA_S_SAV_UserArgs_MT64x64x32_MI16x16x1_SN_LDSB0_AFC0_AG1_AFEM1_AFEM1_ASEM1_CLR1_CADS0_DTLA0_DTLB0_DTVA0_DTVB0_DTVMXSA0_DTVMXSB0_DTVSM0_DPLB0_EPS0_ELFLR0_EMLL0_FDSI0_GRPM1_GRVWA1_GRVWB4_GSU0_GSUAMB_GSUC0_GSUWGMRR0_GLS0_ISA950_IU1_K1_LDSTI0_LBSPPA0_LBSPPB128_LBSPPM0_LPA0_LPB8_LPM0_LRVWn1_LWPMn1_MIAV0_MIWT4_1_MO40_MGRIPM1_NTn1_NTA0_NTB0_NTC4_NTD4_NTM0_NEPBS8_NLCA1_NLCB1_ONLL1_PGR2_PLR1_PKA1_SGROB0_SIA3_SS1_SU0_SUM0_SUS0_SPO0_SRVW0_SSO0_SVW4_SK3_SKFTR0_SKXCCM8_SGRO0_TDMI0_TIN1_TLDS1_TLDSMn1_ULSGRO1_USL1_UIOFGRO0_UPLRP0_USFGRO1_VSn1_VWA4_VWB1_WSGRA0_WSGRB0_WS64_WG16_16_1_WGM16_WGMXCC1_WGMXCCGn1
    SolutionIndex: 241
    SolutionNameMin: Cijk_Ailk_Bljk_S_B_Bias_HA_S_SAV_UserArgs_MT96x64x32_MI16x16x1_SN_LDSB0_AFC0_AG1_AFEM1_AFEM1_ASEM1_CLR1_CADS0_DTLA0_DTLB0_DTVA0_DTVB0_DTVMXSA0_DTVMXSB0_DTVSM0_DPLB0_EPS1_ELFLR0_EMLLn1_FDSI0_GRPM1_GRVWA1_GRVWB4_GSU0_GSUAMB_GSUC0_GSUWGMRR0_GLS0_ISA950_IU1_K1_LDSTI0_LBSPPA0_LBSPPB128_LBSPPM0_LPA0_LPB8_LPM0_LRVWn1_LWPMn1_MIAV1_MIWT6_1_MO40_MGRIPM1_NTn1_NTA0_NTB0_NTC4_NTD4_NTM0_NEPBS12_NLCA3_NLCB1_ONLL1_PGR1_PLR1_PKA1_SGROB0_SIA3_SS1_SU0_SUM0_SUS0_SPO0_SRVW0_SSO0_SVW2_SK3_SKFTR0_SKXCCM8_SGRO0_TDMI0_TIN1_TLDS1_TLDSMn1_ULSGRO0_USL1_UIOFGRO0_UPLRP0_USFGRO1_VSn1_VWA2_VWB1_WSGRA0_WSGRB2_WS64_WG16_16_1_WGM4_WGMXCC1_WGMXCCGn1
    SolutionIndex: 242
    SolutionNameMin: Cijk_Ailk_Bljk_S_B_Bias_HA_S_SAV_UserArgs_MT64x48x64_MI16x16x1_SN_LDSB1_AFC0_AG1_AFEM1_AFEM1_ASEM1_CLR1_CADS0_DTLA0_DTLB0_DTVA0_DTVB0_DTVMXSA0_DTVMXSB0_DTVSM0_DPLB0_EPS0_ELFLR0_EMLLn1_FDSI0_GRPM1_GRVWA4_GRVWB4_GSU0_GSUAMB_GSUC0_GSUWGMRR0_GLS0_ISA950_IU1_K1_LDSTI0_LBSPPA1024_LBSPPB256_LBSPPM0_LPA16_LPB8_LPM0_LRVWn1_LWPMn1_MIAV0_MIWT1_3_MO40_MGRIPM1_NTn1_NTA0_NTB0_NTC0_NTD0_NTM0_NEPBS0_NLCA1_NLCB1_ONLL1_PGR2_PLR1_PKA1_SGROB0_SIA3_SS0_SU0_SUM0_SUS0_SPO0_SRVW0_SSO0_SVW4_SK3_SKFTR0_SKXCCM4_SGRO0_TDMI0_TIN1_TLDS1_TLDSMn1_ULSGRO1_USL1_UIOFGRO0_UPLRP0_USFGRO0_VSn1_VWA1_VWB1_WSGRA2_WSGRB0_WS64_WG64_4_1_WGM6_WGMXCC1_WGMXCCGn1
    SolutionIndex: 243
    SolutionNameMin: Cijk_Ailk_Bljk_S_B_Bias_HA_S_SAV_UserArgs_MT64x64x32_MI32x32x1_SN_LDSB0_AFC0_AG0_AFEM1_AFEM1_ASEM1_CLR1_CADS0_DTLA0_DTLB0_DTVA0_DTVB0_DTVMXSA0_DTVMXSB0_DTVSM0_DPLB0_EPS0_ELFLR0_EMLLn1_FDSI0_GRPM1_GRVWA1_GRVWB4_GSU0_GSUAMB_GSUC0_GSUWGMRR0_GLS0_ISA950_IU1_K1_LDSTI0_LBSPPA0_LBSPPB128_LBSPPM0_LPA0_LPB4_LPM0_LRVWn1_LWPMn1_MIAV0_MIWT1_1_MO40_MGRIPM1_NTn1_NTA0_NTB0_NTC4_NTD4_NTM0_NEPBS0_NLCA1_NLCB1_ONLL1_PGR2_PLR1_PKA1_SGROB0_SIA3_SS1_SU0_SUM0_SUS0_SPO0_SRVW0_SSO0_SVW1_SK3_SKFTR0_SKXCCM8_SGRO0_TDMI0_TIN1_TLDS1_TLDSMn1_ULSGRO0_USL1_UIOFGRO0_UPLRP0_USFGRO0_VSn1_VWA1_VWB1_WSGRA0_WSGRB0_WS64_WG64_4_1_WGM8_WGMXCC1_WGMXCCGn1
    SolutionIndex: 244
    SolutionNameMin: Cijk_Ailk_Bljk_S_B_Bias_HA_S_SAV_UserArgs_MT32x96x64_MI16x16x1_SN_LDSB1_AFC0_AG0_AFEM1_AFEM1_ASEM1_CLR1_CADS0_DTLA0_DTLB0_DTVA0_DTVB0_DTVMXSA0_DTVMXSB0_DTVSM0_DPLB0_EPS0_ELFLR0_EMLL0_FDSI0_GRPM1_GRVWA1_GRVWB4_GSU0_GSUAMB_GSUC0_GSUWGMRR0_GLS0_ISA950_IU1_K1_LDSTI0_LBSPPA512_LBSPPB256_LBSPPM0_LPA16_LPB8_LPM0_LRVWn1_LWPMn1_MIAV0_MIWT1_3_MO40_MGRIPM1_NTn1_NTA4_NTB0_NTC0_NTD4_NTM0_NEPBS14_NLCA1_NLCB1_ONLL1_PGR2_PLR1_PKA1_SGROB0_SIA3_SS0_SU0_SUM0_SUS0_SPO0_SRVW0_SSO0_SVW4_SK3_SKFTR0_SKXCCM0_SGRO0_TDMI0_TIN1_TLDS1_TLDSMn1_ULSGRO0_USL1_UIOFGRO0_UPLRP0_USFGRO1_VSn1_VWA1_VWB1_WSGRA2_WSGRB0_WS64_WG32_8_1_WGM2_WGMXCC4_WGMXCCGn1
    SolutionIndex: 245
    SolutionNameMin: Cijk_Ailk_Bljk_S_B_Bias_HA_S_SAV_UserArgs_MT64x48x64_MI16x16x1_SN_LDSB1_AFC0_AG0_AFEM1_AFEM1_ASEM1_CLR1_CADS0_DTLA0_DTLB0_DTVA0_DTVB0_DTVMXSA0_DTVMXSB0_DTVSM0_DPLB0_EPS0_ELFLR0_EMLLn1_FDSI0_GRPM1_GRVWA4_GRVWB4_GSU0_GSUAMB_GSUC0_GSUWGMRR0_GLS0_ISA950_IU1_K1_LDSTI0_LBSPPA1024_LBSPPB256_LBSPPM0_LPA16_LPB8_LPM0_LRVWn1_LWPMn1_MIAV0_MIWT1_3_MO40_MGRIPM1_NTn1_NTA0_NTB0_NTC4_NTD4_NTM0_NEPBS14_NLCA1_NLCB1_ONLL1_PGR2_PLR1_PKA1_SGROB0_SIA3_SS1_SU0_SUM0_SUS0_SPO0_SRVW0_SSO0_SVW1_SK3_SKFTR0_SKXCCM0_SGRO0_TDMI0_TIN1_TLDS1_TLDSMn1_ULSGRO0_USL1_UIOFGRO0_UPLRP0_USFGRO0_VSn1_VWA1_VWB1_WSGRA0_WSGRB0_WS64_WG64_4_1_WGMn8_WGMXCC2_WGMXCCGn1
    SolutionIndex: 246
    SolutionNameMin: Cijk_Ailk_Bljk_S_B_Bias_HA_S_SAV_UserArgs_MT64x64x32_MI32x32x1_SN_LDSB0_AFC0_AG1_AFEM1_AFEM1_ASEM1_CLR1_CADS0_DTLA0_DTLB0_DTVA0_DTVB0_DTVMXSA0_DTVMXSB0_DTVSM0_DPLB0_EPS0_ELFLR0_EMLLn1_FDSI0_GRPM1_GRVWA1_GRVWB4_GSU0_GSUAMB_GSUC0_GSUWGMRR0_GLS0_ISA950_IU1_K1_LDSTI0_LBSPPA0_LBSPPB128_LBSPPM0_LPA0_LPB4_LPM0_LRVWn1_LWPMn1_MIAV0_MIWT1_1_MO40_MGRIPM1_NTn1_NTA0_NTB0_NTC4_NTD4_NTM0_NEPBS0_NLCA1_NLCB1_ONLL1_PGR2_PLR1_PKA1_SGROB0_SIA3_SS1_SU0_SUM0_SUS0_SPO1_SRVW0_SSO1_SVW1_SK3_SKFTR0_SKXCCM8_SGRO0_TDMI0_TIN1_TLDS1_TLDSMn1_ULSGRO0_USL1_UIOFGRO0_UPLRP0_USFGRO0_VSn1_VWA1_VWB1_WSGRA0_WSGRB0_WS64_WG64_4_1_WGM2_WGMXCC1_WGMXCCGn1
    SolutionIndex: 247
    SolutionNameMin: Cijk_Ailk_Bljk_S_B_Bias_HA_S_SAV_UserArgs_MT64x48x64_MI16x16x1_SN_LDSB1_AFC0_AG1_AFEM1_AFEM1_ASEM1_CLR1_CADS0_DTLA0_DTLB0_DTVA0_DTVB0_DTVMXSA0_DTVMXSB0_DTVSM0_DPLB0_EPS0_ELFLR0_EMLLn1_FDSI0_GRPM1_GRVWA1_GRVWB4_GSU0_GSUAMB_GSUC0_GSUWGMRR0_GLS0_ISA950_IU1_K1_LDSTI0_LBSPPA1024_LBSPPB256_LBSPPM0_LPA16_LPB8_LPM0_LRVWn1_LWPMn1_MIAV0_MIWT1_3_MO40_MGRIPM1_NTn1_NTA0_NTB4_NTC4_NTD4_NTM0_NEPBS10_NLCA1_NLCB1_ONLL1_PGR2_PLR1_PKA1_SGROB0_SIA3_SS0_SU0_SUM0_SUS0_SPO0_SRVW0_SSO0_SVW4_SK3_SKFTR0_SKXCCM4_SGRO0_TDMI0_TIN1_TLDS1_TLDSMn1_ULSGRO0_USL1_UIOFGRO0_UPLRP0_USFGRO0_VSn1_VWA1_VWB1_WSGRA0_WSGRB0_WS64_WG64_4_1_WGM8_WGMXCC1_WGMXCCGn1
    SolutionIndex: 248
    SolutionNameMin: Cijk_Ailk_Bljk_S_B_Bias_HA_S_SAV_UserArgs_MT64x32x64_MI16x16x1_SN_LDSB1_AFC0_AG1_AFEM1_AFEM1_ASEM1_CLR1_CADS0_DTLA0_DTLB0_DTVA0_DTVB0_DTVMXSA0_DTVMXSB0_DTVSM0_DPLB0_EPS0_ELFLR0_EMLL0_FDSI0_GRPM1_GRVWA4_GRVWB4_GSU0_GSUAMB_GSUC0_GSUWGMRR0_GLS0_ISA950_IU1_K1_LDSTI0_LBSPPA0_LBSPPB256_LBSPPM0_LPA0_LPB8_LPM0_LRVWn1_LWPMn1_MIAV0_MIWT2_1_MO40_MGRIPM1_NTn1_NTA0_NTB0_NTC4_NTD4_NTM0_NEPBS10_NLCA1_NLCB1_ONLL1_PGR2_PLR1_PKA1_SGROB0_SIA3_SS1_SU0_SUM0_SUS0_SPO1_SRVW0_SSO0_SVW2_SK3_SKFTR0_SKXCCM0_SGRO0_TDMI0_TIN1_TLDS1_TLDSMn1_ULSGRO0_USL1_UIOFGRO0_UPLRP0_USFGRO0_VSn1_VWA2_VWB1_WSGRA0_WSGRB0_WS64_WG32_8_1_WGM32_WGMXCC1_WGMXCCGn1
    SolutionIndex: 249
    SolutionNameMin: Cijk_Ailk_Bljk_S_B_Bias_HA_S_SAV_UserArgs_MT64x64x32_MI16x16x1_SN_LDSB1_AFC0_AG0_AFEM1_AFEM1_ASEM1_CLR1_CADS0_DTLA0_DTLB0_DTVA0_DTVB0_DTVMXSA0_DTVMXSB0_DTVSM0_DPLB0_EPS0_ELFLR0_EMLL0_FDSI0_GRPM1_GRVWA1_GRVWB4_GSU0_GSUAMB_GSUC0_GSUWGMRR0_GLS0_ISA950_IU1_K1_LDSTI0_LBSPPA0_LBSPPB128_LBSPPM0_LPA0_LPB8_LPM0_LRVWn1_LWPMn1_MIAV1_MIWT4_1_MO40_MGRIPM1_NTn1_NTA0_NTB0_NTC4_NTD4_NTM0_NEPBS0_NLCA1_NLCB1_ONLL1_PGR2_PLR1_PKA1_SGROB0_SIA3_SS1_SU0_SUM0_SUS0_SPO0_SRVW0_SSO0_SVW4_SK3_SKFTR0_SKXCCM4_SGRO0_TDMI0_TIN1_TLDS1_TLDSMn1_ULSGRO1_USL1_UIOFGRO0_UPLRP0_USFGRO0_VSn1_VWA4_VWB1_WSGRA2_WSGRB0_WS64_WG16_16_1_WGM6_WGMXCC1_WGMXCCGn1
    SolutionIndex: 250
    SolutionNameMin: Cijk_Ailk_Bljk_S_B_Bias_HA_S_SAV_UserArgs_MT32x64x64_MI16x16x1_SN_LDSB1_AFC0_AG1_AFEM1_AFEM1_ASEM1_CLR1_CADS0_DTLA0_DTLB0_DTVA0_DTVB0_DTVMXSA0_DTVMXSB0_DTVSM0_DPLB0_EPS0_ELFLR0_EMLLn1_FDSI0_GRPM1_GRVWA1_GRVWB4_GSU0_GSUAMB_GSUC0_GSUWGMRR0_GLS0_ISA950_IU1_K1_LDSTI0_LBSPPA0_LBSPPB256_LBSPPM0_LPA0_LPB8_LPM0_LRVWn1_LWPMn1_MIAV0_MIWT2_1_MO40_MGRIPM1_NTn1_NTA0_NTB0_NTC0_NTD0_NTM0_NEPBS0_NLCA1_NLCB1_ONLL1_PGR2_PLR1_PKA1_SGROB0_SIA3_SS1_SU0_SUM0_SUS0_SPO0_SRVW0_SSO0_SVW2_SK3_SKFTR0_SKXCCM4_SGRO0_TDMI0_TIN1_TLDS1_TLDSMn1_ULSGRO0_USL1_UIOFGRO0_UPLRP0_USFGRO0_VSn1_VWA2_VWB1_WSGRA0_WSGRB2_WS64_WG16_16_1_WGM24_WGMXCC1_WGMXCCGn1
    SolutionIndex: 251
    SolutionNameMin: Cijk_Ailk_Bljk_S_B_Bias_HA_S_SAV_UserArgs_MT32x96x32_MI16x16x1_SN_LDSB0_AFC0_AG1_AFEM1_AFEM1_ASEM1_CLR1_CADS0_DTLA0_DTLB0_DTVA0_DTVB0_DTVMXSA0_DTVMXSB0_DTVSM0_DPLB0_EPS0_ELFLR0_EMLL0_FDSI0_GRPM1_GRVWA1_GRVWB4_GSU0_GSUAMB_GSUC0_GSUWGMRR0_GLS0_ISA950_IU1_K1_LDSTI0_LBSPPA512_LBSPPB128_LBSPPM0_LPA16_LPB8_LPM0_LRVWn1_LWPMn1_MIAV1_MIWT1_3_MO40_MGRIPM1_NTn1_NTA0_NTB0_NTC4_NTD4_NTM0_NEPBS16_NLCA1_NLCB1_ONLL1_PGR2_PLR1_PKA1_SGROB0_SIA3_SS1_SU0_SUM0_SUS0_SPO0_SRVW0_SSO0_SVW1_SK3_SKFTR0_SKXCCM8_SGRO0_TDMI0_TIN1_TLDS1_TLDSMn1_ULSGRO0_USL1_UIOFGRO0_UPLRP0_USFGRO1_VSn1_VWA1_VWB1_WSGRA0_WSGRB2_WS64_WG32_8_1_WGM0_WGMXCC1_WGMXCCGn1
    SolutionIndex: 252
    SolutionNameMin: Cijk_Ailk_Bljk_S_B_Bias_HA_S_SAV_UserArgs_MT64x32x64_MI16x16x1_SN_LDSB0_AFC0_AG1_AFEM1_AFEM1_ASEM1_CLR1_CADS0_DTLA0_DTLB0_DTVA0_DTVB0_DTVMXSA0_DTVMXSB0_DTVSM0_DPLB0_EPS0_ELFLR0_EMLL0_FDSI0_GRPM1_GRVWA1_GRVWB4_GSU0_GSUAMB_GSUC0_GSUWGMRR0_GLS0_ISA950_IU1_K1_LDSTI0_LBSPPA0_LBSPPB256_LBSPPM0_LPA0_LPB8_LPM0_LRVWn1_LWPMn1_MIAV0_MIWT2_1_MO40_MGRIPM1_NTn1_NTA0_NTB0_NTC4_NTD4_NTM0_NEPBS0_NLCA1_NLCB1_ONLL1_PGR2_PLR1_PKA1_SGROB0_SIA3_SS1_SU0_SUM0_SUS0_SPO0_SRVW0_SSO0_SVW2_SK3_SKFTR0_SKXCCM0_SGRO0_TDMI0_TIN1_TLDS1_TLDSMn1_ULSGRO0_USL1_UIOFGRO0_UPLRP0_USFGRO1_VSn1_VWA2_VWB1_WSGRA0_WSGRB0_WS64_WG32_8_1_WGM24_WGMXCC1_WGMXCCGn1
    SolutionIndex: 253
    SolutionNameMin: Cijk_Ailk_Bljk_S_B_Bias_HA_S_SAV_UserArgs_MT64x64x32_MI16x16x1_SN_LDSB1_AFC0_AG1_AFEM1_AFEM1_ASEM1_CLR1_CADS0_DTLA0_DTLB0_DTVA0_DTVB0_DTVMXSA0_DTVMXSB0_DTVSM0_DPLB0_EPS0_ELFLR0_EMLL0_FDSI0_GRPM1_GRVWA1_GRVWB4_GSU0_GSUAMB_GSUC0_GSUWGMRR0_GLS0_ISA950_IU1_K1_LDSTI0_LBSPPA0_LBSPPB128_LBSPPM0_LPA0_LPB8_LPM0_LRVWn1_LWPMn1_MIAV0_MIWT4_1_MO40_MGRIPM1_NTn1_NTA0_NTB0_NTC4_NTD4_NTM0_NEPBS10_NLCA1_NLCB1_ONLL1_PGR2_PLR1_PKA1_SGROB0_SIA3_SS1_SU0_SUM0_SUS0_SPO1_SRVW0_SSO0_SVW4_SK3_SKFTR0_SKXCCM0_SGRO0_TDMI0_TIN1_TLDS1_TLDSMn1_ULSGRO1_USL1_UIOFGRO0_UPLRP0_USFGRO1_VSn1_VWA4_VWB1_WSGRA0_WSGRB0_WS64_WG16_16_1_WGM2_WGMXCC32_WGMXCCGn1
    SolutionIndex: 254
    SolutionNameMin: Cijk_Ailk_Bljk_S_B_Bias_HA_S_SAV_UserArgs_MT64x64x32_MI16x16x1_SN_LDSB0_AFC0_AG1_AFEM1_AFEM1_ASEM1_CLR1_CADS0_DTLA0_DTLB0_DTVA0_DTVB0_DTVMXSA0_DTVMXSB0_DTVSM0_DPLB0_EPS0_ELFLR0_EMLLn1_FDSI0_GRPM1_GRVWA1_GRVWB4_GSU0_GSUAMB_GSUC0_GSUWGMRR0_GLS0_ISA950_IU1_K1_LDSTI0_LBSPPA0_LBSPPB128_LBSPPM0_LPA0_LPB8_LPM0_LRVWn1_LWPMn1_MIAV0_MIWT4_1_MO40_MGRIPM1_NTn1_NTA0_NTB0_NTC4_NTD4_NTM0_NEPBS14_NLCA1_NLCB1_ONLL1_PGR2_PLR1_PKA1_SGROB0_SIA3_SS1_SU0_SUM0_SUS0_SPO1_SRVW0_SSO0_SVW4_SK3_SKFTR0_SKXCCM0_SGRO0_TDMI0_TIN1_TLDS1_TLDSMn1_ULSGRO0_USL1_UIOFGRO0_UPLRP0_USFGRO1_VSn1_VWA4_VWB1_WSGRA0_WSGRB0_WS64_WG16_16_1_WGM8_WGMXCC1_WGMXCCGn1
    SolutionIndex: 255
    SolutionNameMin: Cijk_Ailk_Bljk_S_B_Bias_HA_S_SAV_UserArgs_MT48x64x32_MI16x16x1_SN_LDSB1_AFC0_AG1_AFEM1_AFEM1_ASEM1_CLR1_CADS0_DTLA0_DTLB0_DTVA0_DTVB0_DTVMXSA0_DTVMXSB0_DTVSM0_DPLB0_EPS0_ELFLR0_EMLLn1_FDSI0_GRPM1_GRVWA1_GRVWB4_GSU0_GSUAMB_GSUC0_GSUWGMRR0_GLS0_ISA950_IU1_K1_LDSTI0_LBSPPA768_LBSPPB128_LBSPPM0_LPA16_LPB8_LPM0_LRVWn1_LWPMn1_MIAV0_MIWT3_1_MO40_MGRIPM1_NTn1_NTA0_NTB0_NTC4_NTD4_NTM0_NEPBS0_NLCA3_NLCB1_ONLL1_PGR2_PLR1_PKA1_SGROB0_SIA3_SS1_SU0_SUM0_SUS0_SPO0_SRVW0_SSO0_SVW1_SK3_SKFTR0_SKXCCM0_SGRO0_TDMI0_TIN1_TLDS1_TLDSMn1_ULSGRO1_USL1_UIOFGRO0_UPLRP0_USFGRO0_VSn1_VWA1_VWB1_WSGRA2_WSGRB0_WS64_WG16_16_1_WGMn48_WGMXCC1_WGMXCCGn1
    SolutionIndex: 256
    SolutionNameMin: Cijk_Ailk_Bljk_S_B_Bias_HA_S_SAV_UserArgs_MT512x112x32_MI16x16x1_SN_LDSB1_AFC0_AG1_AFEM1_AFEM1_ASEM1_CLR1_CADS0_DTLA0_DTLB0_DTVA0_DTVB0_DTVMXSA0_DTVMXSB0_DTVSM0_DPLB0_EPS0_ELFLR0_EMLL0_FDSI0_GRPM1_GRVWA4_GRVWB1_GSU0_GSUAMB_GSUC0_GSUWGMRR0_GLS0_ISA950_IU1_K1_LDSTI0_LBSPPA0_LBSPPB128_LBSPPM0_LPA0_LPB8_LPM0_LRVWn1_LWPMn1_MIAV0_MIWT8_7_MO40_MGRIPM1_NTn1_NTA4_NTB0_NTC0_NTD0_NTM0_NEPBS16_NLCA1_NLCB1_ONLL1_PGR2_PLR1_PKA1_SGROB0_SIA3_SS1_SU16_SUM0_SUS256_SPO1_SRVW0_SSO0_SVW4_SK3_SKFTR0_SKXCCM8_SGRO0_TDMI0_TIN0_TLDS1_TLDSMn1_ULSGRO0_USL1_UIOFGRO0_UPLRP0_USFGRO1_VSn1_VWA4_VWB1_WSGRA0_WSGRB0_WS64_WG64_4_1_WGMn16_WGMXCC2_WGMXCCGn1
    SolutionIndex: 257
    SolutionNameMin: Cijk_Ailk_Bljk_S_B_Bias_HA_S_SAV_UserArgs_MT48x64x32_MI16x16x1_SN_LDSB1_AFC0_AG0_AFEM1_AFEM1_ASEM1_CLR1_CADS0_DTLA0_DTLB0_DTVA0_DTVB0_DTVMXSA0_DTVMXSB0_DTVSM0_DPLB0_EPS0_ELFLR0_EMLL0_FDSI0_GRPM1_GRVWA1_GRVWB4_GSU0_GSUAMB_GSUC0_GSUWGMRR0_GLS0_ISA950_IU1_K1_LDSTI0_LBSPPA768_LBSPPB128_LBSPPM0_LPA16_LPB8_LPM0_LRVWn1_LWPMn1_MIAV0_MIWT3_1_MO40_MGRIPM1_NTn1_NTA0_NTB0_NTC4_NTD4_NTM0_NEPBS0_NLCA3_NLCB1_ONLL1_PGR2_PLR1_PKA1_SGROB0_SIA3_SS1_SU0_SUM0_SUS0_SPO1_SRVW0_SSO0_SVW1_SK3_SKFTR0_SKXCCM0_SGRO0_TDMI0_TIN1_TLDS1_TLDSMn1_ULSGRO1_USL1_UIOFGRO0_UPLRP0_USFGRO1_VSn1_VWA1_VWB1_WSGRA0_WSGRB0_WS64_WG16_16_1_WGM4_WGMXCC2_WGMXCCGn1
    SolutionIndex: 258
    SolutionNameMin: Cijk_Ailk_Bljk_S_B_Bias_HA_S_SAV_UserArgs_MT64x96x32_MI16x16x1_SN_LDSB0_AFC0_AG1_AFEM1_AFEM1_ASEM1_CLR1_CADS0_DTLA0_DTLB0_DTVA0_DTVB0_DTVMXSA0_DTVMXSB0_DTVSM0_DPLB0_EPS0_ELFLR0_EMLL0_FDSI0_GRPM1_GRVWA1_GRVWB4_GSU0_GSUAMB_GSUC0_GSUWGMRR0_GLS0_ISA950_IU1_K1_LDSTI0_LBSPPA0_LBSPPB128_LBSPPM0_LPA0_LPB8_LPM0_LRVWn1_LWPMn1_MIAV0_MIWT2_3_MO40_MGRIPM1_NTn1_NTA0_NTB0_NTC4_NTD4_NTM0_NEPBS16_NLCA1_NLCB1_ONLL1_PGR2_PLR1_PKA1_SGROB0_SIA3_SS1_SU0_SUM0_SUS0_SPO1_SRVW0_SSO0_SVW2_SK3_SKFTR0_SKXCCM8_SGRO0_TDMI0_TIN1_TLDS1_TLDSMn1_ULSGRO0_USL1_UIOFGRO0_UPLRP0_USFGRO1_VSn1_VWA2_VWB1_WSGRA0_WSGRB0_WS64_WG32_8_1_WGM2_WGMXCC1_WGMXCCGn1
    SolutionIndex: 259
    SolutionNameMin: Cijk_Ailk_Bljk_S_B_Bias_HA_S_SAV_UserArgs_MT256x16x32_MI16x16x1_SN_LDSB1_AFC0_AG0_AFEM1_AFEM1_ASEM1_CLR1_CADS0_DTLA0_DTLB0_DTVA0_DTVB0_DTVMXSA0_DTVMXSB0_DTVSM0_DPLB0_EPS0_ELFLR0_EMLL0_FDSI0_GRPM1_GRVWA4_GRVWB2_GSU0_GSUAMB_GSUC0_GSUWGMRR0_GLS0_ISA950_IU1_K1_LDSTI0_LBSPPA0_LBSPPB128_LBSPPM0_LPA0_LPB8_LPM0_LRVWn1_LWPMn1_MIAV0_MIWT4_1_MO40_MGRIPM1_NTn1_NTA0_NTB0_NTC4_NTD4_NTM0_NEPBS16_NLCA1_NLCB1_ONLL1_PGR2_PLR1_PKA1_SGROB0_SIA3_SS1_SU0_SUM0_SUS0_SPO0_SRVW0_SSO0_SVW4_SK3_SKFTR0_SKXCCM0_SGRO0_TDMI0_TIN1_TLDS1_TLDSMn1_ULSGRO0_USL1_UIOFGRO0_UPLRP0_USFGRO1_VSn1_VWA4_VWB1_WSGRA0_WSGRB0_WS64_WG64_4_1_WGM6_WGMXCC16_WGMXCCGn1
    SolutionIndex: 260
    SolutionNameMin: Cijk_Ailk_Bljk_S_B_Bias_HA_S_SAV_UserArgs_MT32x64x64_MI16x16x1_SN_LDSB1_AFC0_AG0_AFEM1_AFEM1_ASEM1_CLR1_CADS0_DTLA0_DTLB0_DTVA0_DTVB0_DTVMXSA0_DTVMXSB0_DTVSM0_DPLB0_EPS0_ELFLR0_EMLLn1_FDSI0_GRPM1_GRVWA1_GRVWB4_GSU0_GSUAMB_GSUC0_GSUWGMRR0_GLS0_ISA950_IU1_K1_LDSTI0_LBSPPA0_LBSPPB256_LBSPPM0_LPA0_LPB8_LPM0_LRVWn1_LWPMn1_MIAV1_MIWT2_1_MO40_MGRIPM1_NTn1_NTA0_NTB0_NTC4_NTD4_NTM0_NEPBS4_NLCA1_NLCB1_ONLL1_PGR2_PLR1_PKA1_SGROB0_SIA3_SS1_SU0_SUM0_SUS0_SPO0_SRVW0_SSO0_SVW2_SK3_SKFTR0_SKXCCM0_SGRO0_TDMI0_TIN1_TLDS1_TLDSMn1_ULSGRO0_USL1_UIOFGRO0_UPLRP0_USFGRO0_VSn1_VWA2_VWB1_WSGRA0_WSGRB0_WS64_WG16_16_1_WGMn4_WGMXCC1_WGMXCCGn1
    SolutionIndex: 261
    SolutionNameMin: Cijk_Ailk_Bljk_S_B_Bias_HA_S_SAV_UserArgs_MT64x32x64_MI16x16x1_SN_LDSB1_AFC0_AG0_AFEM1_AFEM1_ASEM1_CLR1_CADS0_DTLA0_DTLB0_DTVA0_DTVB0_DTVMXSA0_DTVMXSB0_DTVSM0_DPLB0_EPS0_ELFLR0_EMLLn1_FDSI0_GRPM1_GRVWA4_GRVWB4_GSU0_GSUAMB_GSUC0_GSUWGMRR0_GLS0_ISA950_IU1_K1_LDSTI0_LBSPPA0_LBSPPB256_LBSPPM0_LPA0_LPB8_LPM0_LRVWn1_LWPMn1_MIAV0_MIWT2_1_MO40_MGRIPM1_NTn1_NTA0_NTB0_NTC4_NTD4_NTM0_NEPBS14_NLCA1_NLCB1_ONLL1_PGR2_PLR1_PKA1_SGROB0_SIA3_SS1_SU0_SUM0_SUS0_SPO0_SRVW0_SSO0_SVW2_SK3_SKFTR0_SKXCCM0_SGRO0_TDMI0_TIN1_TLDS1_TLDSMn1_ULSGRO0_USL1_UIOFGRO0_UPLRP0_USFGRO0_VSn1_VWA2_VWB1_WSGRA0_WSGRB0_WS64_WG32_8_1_WGM32_WGMXCC8_WGMXCCGn1
    SolutionIndex: 262
    SolutionNameMin: Cijk_Ailk_Bljk_S_B_Bias_HA_S_SAV_UserArgs_MT80x64x32_MI16x16x1_SN_LDSB0_AFC0_AG1_AFEM1_AFEM1_ASEM1_CLR1_CADS0_DTLA0_DTLB0_DTVA0_DTVB0_DTVMXSA0_DTVMXSB0_DTVSM0_DPLB0_EPS0_ELFLR0_EMLLn1_FDSI0_GRPM1_GRVWA1_GRVWB4_GSU0_GSUAMB_GSUC0_GSUWGMRR0_GLS0_ISA950_IU1_K1_LDSTI0_LBSPPA1280_LBSPPB128_LBSPPM0_LPA16_LPB8_LPM0_LRVWn1_LWPMn1_MIAV0_MIWT5_1_MO40_MGRIPM1_NTn1_NTA0_NTB0_NTC0_NTD0_NTM0_NEPBS0_NLCA5_NLCB1_ONLL1_PGR2_PLR1_PKA1_SGROB0_SIA3_SS0_SU0_SUM0_SUS0_SPO0_SRVW0_SSO0_SVW4_SK3_SKFTR0_SKXCCM8_SGRO0_TDMI0_TIN1_TLDS1_TLDSMn1_ULSGRO0_USL1_UIOFGRO0_UPLRP0_USFGRO1_VSn1_VWA1_VWB1_WSGRA0_WSGRB0_WS64_WG16_16_1_WGM2_WGMXCC1_WGMXCCGn1
    SolutionIndex: 263
    SolutionNameMin: Cijk_Ailk_Bljk_S_B_Bias_HA_S_SAV_UserArgs_MT64x48x64_MI16x16x1_SN_LDSB1_AFC0_AG1_AFEM1_AFEM1_ASEM1_CLR1_CADS0_DTLA0_DTLB0_DTVA0_DTVB0_DTVMXSA0_DTVMXSB0_DTVSM0_DPLB0_EPS1_ELFLR0_EMLL0_FDSI0_GRPM1_GRVWA4_GRVWB4_GSU0_GSUAMB_GSUC0_GSUWGMRR0_GLS0_ISA950_IU1_K1_LDSTI0_LBSPPA1024_LBSPPB256_LBSPPM0_LPA16_LPB8_LPM0_LRVWn1_LWPMn1_MIAV1_MIWT1_3_MO40_MGRIPM1_NTn1_NTA0_NTB4_NTC4_NTD4_NTM0_NEPBS16_NLCA1_NLCB1_ONLL1_PGR1_PLR1_PKA1_SGROB0_SIA3_SS0_SU0_SUM0_SUS0_SPO0_SRVW0_SSO0_SVW4_SK3_SKFTR0_SKXCCM0_SGRO0_TDMI0_TIN1_TLDS1_TLDSMn1_ULSGRO0_USL1_UIOFGRO0_UPLRP0_USFGRO1_VSn1_VWA1_VWB1_WSGRA2_WSGRB0_WS64_WG64_4_1_WGM8_WGMXCC1_WGMXCCGn1
    SolutionIndex: 264
    SolutionNameMin: Cijk_Ailk_Bljk_S_B_Bias_HA_S_SAV_UserArgs_MT64x48x32_MI16x16x1_SN_LDSB1_AFC0_AG0_AFEM1_AFEM1_ASEM1_CLR1_CADS0_DTLA0_DTLB0_DTVA0_DTVB0_DTVMXSA0_DTVMXSB0_DTVSM0_DPLB0_EPS0_ELFLR0_EMLL0_FDSI0_GRPM1_GRVWA1_GRVWB2_GSU0_GSUAMB_GSUC0_GSUWGMRR0_GLS0_ISA950_IU1_K1_LDSTI0_LBSPPA1024_LBSPPB128_LBSPPM0_LPA16_LPB8_LPM0_LRVWn1_LWPMn1_MIAV0_MIWT1_3_MO40_MGRIPM1_NTn1_NTA0_NTB0_NTC4_NTD4_NTM0_NEPBS0_NLCA1_NLCB1_ONLL1_PGR2_PLR1_PKA1_SGROB0_SIA3_SS1_SU0_SUM0_SUS0_SPO0_SRVW0_SSO0_SVW1_SK3_SKFTR0_SKXCCM0_SGRO0_TDMI0_TIN1_TLDS1_TLDSMn1_ULSGRO0_USL1_UIOFGRO0_UPLRP0_USFGRO0_VSn1_VWA1_VWB1_WSGRA0_WSGRB0_WS64_WG64_4_1_WGMn2_WGMXCC1_WGMXCCGn1
    SolutionIndex: 265
    SolutionNameMin: Cijk_Ailk_Bljk_S_B_Bias_HA_S_SAV_UserArgs_MT64x64x32_MI16x16x1_SN_LDSB1_AFC0_AG0_AFEM1_AFEM1_ASEM1_CLR1_CADS0_DTLA0_DTLB0_DTVA0_DTVB0_DTVMXSA0_DTVMXSB0_DTVSM0_DPLB0_EPS0_ELFLR0_EMLLn1_FDSI0_GRPM1_GRVWA1_GRVWB4_GSU0_GSUAMB_GSUC0_GSUWGMRR0_GLS0_ISA950_IU1_K1_LDSTI0_LBSPPA0_LBSPPB128_LBSPPM0_LPA0_LPB8_LPM0_LRVWn1_LWPMn1_MIAV0_MIWT4_1_MO40_MGRIPM1_NTn1_NTA0_NTB0_NTC4_NTD4_NTM0_NEPBS12_NLCA1_NLCB1_ONLL1_PGR2_PLR1_PKA1_SGROB0_SIA3_SS1_SU0_SUM0_SUS0_SPO1_SRVW0_SSO1_SVW4_SK3_SKFTR0_SKXCCM0_SGRO0_TDMI0_TIN1_TLDS1_TLDSMn1_ULSGRO0_USL1_UIOFGRO0_UPLRP0_USFGRO1_VSn1_VWA4_VWB1_WSGRA0_WSGRB0_WS64_WG16_16_1_WGM8_WGMXCC1_WGMXCCGn1
    SolutionIndex: 266
    SolutionNameMin: Cijk_Ailk_Bljk_S_B_Bias_HA_S_SAV_UserArgs_MT64x32x32_MI16x16x1_SN_LDSB1_AFC0_AG1_AFEM1_AFEM1_ASEM1_CLR1_CADS0_DTLA0_DTLB0_DTVA0_DTVB0_DTVMXSA0_DTVMXSB0_DTVSM0_DPLB0_EPS0_ELFLR0_EMLLn1_FDSI0_GRPM1_GRVWA1_GRVWB4_GSU0_GSUAMB_GSUC0_GSUWGMRR0_GLS0_ISA950_IU1_K1_LDSTI0_LBSPPA0_LBSPPB128_LBSPPM0_LPA0_LPB8_LPM0_LRVWn1_LWPMn1_MIAV0_MIWT2_1_MO40_MGRIPM1_NTn1_NTA0_NTB0_NTC4_NTD4_NTM0_NEPBS12_NLCA1_NLCB1_ONLL1_PGR2_PLR1_PKA1_SGROB0_SIA3_SS1_SU0_SUM0_SUS0_SPO1_SRVW0_SSO0_SVW2_SK3_SKFTR0_SKXCCM0_SGRO0_TDMI0_TIN1_TLDS1_TLDSMn1_ULSGRO0_USL1_UIOFGRO0_UPLRP0_USFGRO1_VSn1_VWA2_VWB1_WSGRA0_WSGRB0_WS64_WG32_8_1_WGM8_WGMXCC1_WGMXCCGn1
    SolutionIndex: 267
    SolutionNameMin: Cijk_Ailk_Bljk_S_B_Bias_HA_S_SAV_UserArgs_MT160x352x32_MI16x16x1_SN_LDSB1_AFC0_AG1_AFEM1_AFEM1_ASEM1_CLR1_CADS0_DTLA0_DTLB0_DTVA0_DTVB0_DTVMXSA0_DTVMXSB0_DTVSM0_DPLB0_EPS0_ELFLR0_EMLL0_FDSI0_GRPM1_GRVWA4_GRVWB4_GSU0_GSUAMB_GSUC0_GSUWGMRR0_GLS0_ISA950_IU1_K1_LDSTI0_LBSPPA2560_LBSPPB128_LBSPPM0_LPA16_LPB8_LPM0_LRVWn1_LWPMn1_MIAV0_MIWT5_11_MO40_MGRIPM1_NTn1_NTA4_NTB0_NTC0_NTD0_NTM0_NEPBS12_NLCA5_NLCB1_ONLL1_PGR2_PLR1_PKA1_SGROB0_SIA3_SS0_SU16_SUM0_SUS128_SPO0_SRVW0_SSO0_SVW4_SK3_SKFTR0_SKXCCM0_SGRO0_TDMI0_TIN0_TLDS1_TLDSMn1_ULSGRO1_USL1_UIOFGRO0_UPLRP0_USFGRO0_VSn1_VWA1_VWB1_WSGRA0_WSGRB0_WS64_WG32_8_1_WGMn6_WGMXCC4_WGMXCCGn1
    SolutionIndex: 268
    SolutionNameMin: Cijk_Ailk_Bljk_S_B_Bias_HA_S_SAV_UserArgs_MT64x48x32_MI16x16x1_SN_LDSB1_AFC0_AG0_AFEM1_AFEM1_ASEM1_CLR1_CADS0_DTLA0_DTLB0_DTVA0_DTVB0_DTVMXSA0_DTVMXSB0_DTVSM0_DPLB0_EPS0_ELFLR0_EMLL0_FDSI0_GRPM1_GRVWA1_GRVWB1_GSU0_GSUAMB_GSUC0_GSUWGMRR0_GLS0_ISA950_IU1_K1_LDSTI0_LBSPPA1024_LBSPPB128_LBSPPM0_LPA16_LPB8_LPM0_LRVWn1_LWPMn1_MIAV0_MIWT1_3_MO40_MGRIPM1_NTn1_NTA0_NTB0_NTC4_NTD4_NTM0_NEPBS16_NLCA1_NLCB1_ONLL1_PGR2_PLR1_PKA1_SGROB0_SIA3_SS1_SU0_SUM0_SUS0_SPO1_SRVW0_SSO0_SVW1_SK3_SKFTR0_SKXCCM4_SGRO0_TDMI0_TIN1_TLDS1_TLDSMn1_ULSGRO1_USL1_UIOFGRO0_UPLRP0_USFGRO0_VSn1_VWA1_VWB1_WSGRA2_WSGRB0_WS64_WG64_4_1_WGM4_WGMXCC1_WGMXCCGn1
    SolutionIndex: 269
    SolutionNameMin: Cijk_Ailk_Bljk_S_B_Bias_HA_S_SAV_UserArgs_MT64x48x64_MI16x16x1_SN_LDSB1_AFC0_AG0_AFEM1_AFEM1_ASEM1_CLR1_CADS0_DTLA0_DTLB0_DTVA0_DTVB0_DTVMXSA0_DTVMXSB0_DTVSM0_DPLB0_EPS1_ELFLR0_EMLL0_FDSI0_GRPM1_GRVWA1_GRVWB4_GSU0_GSUAMB_GSUC0_GSUWGMRR0_GLS0_ISA950_IU1_K1_LDSTI0_LBSPPA1024_LBSPPB256_LBSPPM0_LPA16_LPB8_LPM0_LRVWn1_LWPMn1_MIAV0_MIWT1_3_MO40_MGRIPM1_NTn1_NTA0_NTB0_NTC4_NTD4_NTM0_NEPBS0_NLCA1_NLCB1_ONLL1_PGR1_PLR1_PKA1_SGROB0_SIA3_SS1_SU0_SUM0_SUS0_SPO0_SRVW0_SSO0_SVW1_SK3_SKFTR0_SKXCCM0_SGRO0_TDMI0_TIN1_TLDS1_TLDSMn1_ULSGRO0_USL1_UIOFGRO0_UPLRP0_USFGRO1_VSn1_VWA1_VWB1_WSGRA0_WSGRB0_WS64_WG64_4_1_WGM32_WGMXCC8_WGMXCCGn1
    SolutionIndex: 270
    SolutionNameMin: Cijk_Ailk_Bljk_S_B_Bias_HA_S_SAV_UserArgs_MT64x48x32_MI16x16x1_SN_LDSB1_AFC0_AG1_AFEM1_AFEM1_ASEM1_CLR1_CADS0_DTLA0_DTLB0_DTVA0_DTVB0_DTVMXSA0_DTVMXSB0_DTVSM0_DPLB0_EPS0_ELFLR0_EMLL0_FDSI0_GRPM1_GRVWA1_GRVWB1_GSU0_GSUAMB_GSUC0_GSUWGMRR0_GLS0_ISA950_IU1_K1_LDSTI0_LBSPPA1024_LBSPPB128_LBSPPM0_LPA16_LPB8_LPM0_LRVWn1_LWPMn1_MIAV0_MIWT1_3_MO40_MGRIPM1_NTn1_NTA0_NTB0_NTC4_NTD4_NTM0_NEPBS16_NLCA1_NLCB1_ONLL1_PGR2_PLR1_PKA1_SGROB0_SIA3_SS1_SU0_SUM0_SUS0_SPO0_SRVW0_SSO0_SVW1_SK3_SKFTR0_SKXCCM0_SGRO0_TDMI0_TIN1_TLDS1_TLDSMn1_ULSGRO0_USL1_UIOFGRO0_UPLRP0_USFGRO0_VSn1_VWA1_VWB1_WSGRA0_WSGRB0_WS64_WG64_4_1_WGM2_WGMXCC1_WGMXCCGn1
    SolutionIndex: 271
    SolutionNameMin: Cijk_Ailk_Bljk_S_B_Bias_HA_S_SAV_UserArgs_MT64x64x32_MI16x16x1_SN_LDSB0_AFC0_AG0_AFEM1_AFEM1_ASEM1_CLR1_CADS0_DTLA0_DTLB0_DTVA0_DTVB0_DTVMXSA0_DTVMXSB0_DTVSM0_DPLB0_EPS0_ELFLR0_EMLLn1_FDSI0_GRPM1_GRVWA1_GRVWB4_GSU0_GSUAMB_GSUC0_GSUWGMRR0_GLS0_ISA950_IU1_K1_LDSTI0_LBSPPA0_LBSPPB256_LBSPPM0_LPA0_LPB8_LPM0_LRVWn1_LWPMn1_MIAV1_MIWT2_2_MO40_MGRIPM1_NTn1_NTA0_NTB0_NTC4_NTD4_NTM0_NEPBS0_NLCA1_NLCB1_ONLL1_PGR2_PLR1_PKA1_SGROB0_SIA3_SS1_SU0_SUM0_SUS0_SPO0_SRVW0_SSO0_SVW2_SK3_SKFTR0_SKXCCM8_SGRO0_TDMI0_TIN1_TLDS1_TLDSMn1_ULSGRO1_USL1_UIOFGRO0_UPLRP0_USFGRO1_VSn1_VWA2_VWB2_WSGRA0_WSGRB2_WS64_WG32_8_1_WGM48_WGMXCC1_WGMXCCGn1
    SolutionIndex: 272
    SolutionNameMin: Cijk_Ailk_Bljk_S_B_Bias_HA_S_SAV_UserArgs_MT32x32x64_MI16x16x1_SN_LDSB0_AFC0_AG1_AFEM1_AFEM1_ASEM1_CLR1_CADS0_DTLA0_DTLB0_DTVA0_DTVB0_DTVMXSA0_DTVMXSB0_DTVSM0_DPLB0_EPS0_ELFLR0_EMLL0_FDSI0_GRPM1_GRVWA1_GRVWB4_GSU0_GSUAMB_GSUC0_GSUWGMRR0_GLS0_ISA950_IU1_K1_LDSTI0_LBSPPA512_LBSPPB256_LBSPPM0_LPA16_LPB8_LPM0_LRVWn1_LWPMn1_MIAV0_MIWT1_1_MO40_MGRIPM1_NTn1_NTA0_NTB0_NTC4_NTD4_NTM0_NEPBS0_NLCA1_NLCB1_ONLL1_PGR2_PLR1_PKA1_SGROB0_SIA3_SS1_SU0_SUM0_SUS0_SPO1_SRVW0_SSO1_SVW1_SK3_SKFTR0_SKXCCM4_SGRO0_TDMI0_TIN0_TLDS1_TLDSMn1_ULSGRO1_USL1_UIOFGRO0_UPLRP0_USFGRO1_VSn1_VWA1_VWB1_WSGRA0_WSGRB0_WS64_WG32_8_1_WGM16_WGMXCC1_WGMXCCGn1
    SolutionIndex: 273
    SolutionNameMin: Cijk_Ailk_Bljk_S_B_Bias_HA_S_SAV_UserArgs_MT64x32x32_MI16x16x1_SN_LDSB1_AFC0_AG1_AFEM1_AFEM1_ASEM1_CLR1_CADS0_DTLA0_DTLB0_DTVA0_DTVB0_DTVMXSA0_DTVMXSB0_DTVSM0_DPLB0_EPS0_ELFLR0_EMLLn1_FDSI0_GRPM1_GRVWA1_GRVWB4_GSU0_GSUAMB_GSUC0_GSUWGMRR0_GLS0_ISA950_IU1_K1_LDSTI0_LBSPPA1024_LBSPPB256_LBSPPM0_LPA16_LPB8_LPM0_LRVWn1_LWPMn1_MIAV0_MIWT1_2_MO40_MGRIPM1_NTn1_NTA0_NTB0_NTC4_NTD4_NTM0_NEPBS0_NLCA1_NLCB1_ONLL1_PGR2_PLR1_PKA1_SGROB0_SIA3_SS1_SU0_SUM0_SUS0_SPO1_SRVW0_SSO1_SVW1_SK3_SKFTR0_SKXCCM8_SGRO0_TDMI0_TIN1_TLDS1_TLDSMn1_ULSGRO1_USL1_UIOFGRO0_UPLRP0_USFGRO1_VSn1_VWA1_VWB2_WSGRA0_WSGRB0_WS64_WG64_4_1_WGMn1_WGMXCC1_WGMXCCGn1
    SolutionIndex: 274
    SolutionNameMin: Cijk_Ailk_Bljk_S_B_Bias_HA_S_SAV_UserArgs_MT32x32x128_MI16x16x1_SN_LDSB1_AFC0_AG1_AFEM1_AFEM1_ASEM1_CLR1_CADS0_DTLA0_DTLB0_DTVA0_DTVB0_DTVMXSA0_DTVMXSB0_DTVSM0_DPLB0_EPS1_ELFLR0_EMLL0_FDSI0_GRPM1_GRVWA4_GRVWB4_GSU0_GSUAMB_GSUC0_GSUWGMRR0_GLS0_ISA950_IU1_K1_LDSTI0_LBSPPA512_LBSPPB512_LBSPPM0_LPA16_LPB8_LPM0_LRVWn1_LWPMn1_MIAV0_MIWT1_1_MO40_MGRIPM1_NTn1_NTA4_NTB0_NTC0_NTD4_NTM0_NEPBS0_NLCA1_NLCB1_ONLL1_PGR1_PLR1_PKA1_SGROB0_SIA3_SS1_SU0_SUM0_SUS0_SPO1_SRVW0_SSO0_SVW1_SK3_SKFTR0_SKXCCM8_SGRO0_TDMI0_TIN1_TLDS1_TLDSMn1_ULSGRO0_USL1_UIOFGRO0_UPLRP0_USFGRO1_VSn1_VWA1_VWB1_WSGRA0_WSGRB0_WS64_WG32_8_1_WGMn6_WGMXCC1_WGMXCCGn1
    SolutionIndex: 275
    SolutionNameMin: Cijk_Ailk_Bljk_S_B_Bias_HA_S_SAV_UserArgs_MT64x32x32_MI16x16x1_SN_LDSB0_AFC0_AG0_AFEM1_AFEM1_ASEM1_CLR1_CADS0_DTLA0_DTLB0_DTVA0_DTVB0_DTVMXSA0_DTVMXSB0_DTVSM0_DPLB0_EPS0_ELFLR0_EMLL0_FDSI0_GRPM1_GRVWA1_GRVWB4_GSU0_GSUAMB_GSUC0_GSUWGMRR0_GLS0_ISA950_IU1_K1_LDSTI0_LBSPPA1024_LBSPPB256_LBSPPM0_LPA16_LPB8_LPM0_LRVWn1_LWPMn1_MIAV0_MIWT1_2_MO40_MGRIPM1_NTn1_NTA0_NTB0_NTC4_NTD4_NTM0_NEPBS0_NLCA1_NLCB1_ONLL1_PGR2_PLR1_PKA1_SGROB0_SIA3_SS1_SU0_SUM0_SUS0_SPO1_SRVW0_SSO0_SVW1_SK3_SKFTR0_SKXCCM8_SGRO0_TDMI0_TIN1_TLDS1_TLDSMn1_ULSGRO0_USL1_UIOFGRO0_UPLRP0_USFGRO1_VSn1_VWA1_VWB2_WSGRA0_WSGRB0_WS64_WG64_4_1_WGMn1_WGMXCC1_WGMXCCGn1
    SolutionIndex: 276
    SolutionNameMin: Cijk_Ailk_Bljk_S_B_Bias_HA_S_SAV_UserArgs_MT64x32x32_MI16x16x1_SN_LDSB1_AFC0_AG1_AFEM1_AFEM1_ASEM1_CLR1_CADS0_DTLA0_DTLB0_DTVA0_DTVB0_DTVMXSA0_DTVMXSB0_DTVSM0_DPLB0_EPS0_ELFLR0_EMLLn1_FDSI0_GRPM1_GRVWA4_GRVWB4_GSU0_GSUAMB_GSUC0_GSUWGMRR0_GLS0_ISA950_IU1_K1_LDSTI0_LBSPPA0_LBSPPB128_LBSPPM0_LPA0_LPB8_LPM0_LRVWn1_LWPMn1_MIAV0_MIWT2_1_MO40_MGRIPM1_NTn1_NTA0_NTB4_NTC0_NTD4_NTM0_NEPBS12_NLCA1_NLCB1_ONLL1_PGR2_PLR1_PKA1_SGROB0_SIA3_SS1_SU0_SUM0_SUS0_SPO1_SRVW0_SSO0_SVW2_SK3_SKFTR0_SKXCCM0_SGRO0_TDMI0_TIN1_TLDS1_TLDSMn1_ULSGRO0_USL1_UIOFGRO0_UPLRP0_USFGRO0_VSn1_VWA2_VWB1_WSGRA0_WSGRB2_WS64_WG32_8_1_WGM16_WGMXCC1_WGMXCCGn1
    SolutionIndex: 277
    SolutionNameMin: Cijk_Ailk_Bljk_S_B_Bias_HA_S_SAV_UserArgs_MT32x64x32_MI16x16x1_SN_LDSB1_AFC0_AG0_AFEM1_AFEM1_ASEM1_CLR1_CADS0_DTLA0_DTLB0_DTVA0_DTVB0_DTVMXSA0_DTVMXSB0_DTVSM0_DPLB0_EPS0_ELFLR0_EMLL0_FDSI0_GRPM1_GRVWA1_GRVWB4_GSU0_GSUAMB_GSUC0_GSUWGMRR0_GLS0_ISA950_IU1_K1_LDSTI0_LBSPPA0_LBSPPB128_LBSPPM0_LPA0_LPB8_LPM0_LRVWn1_LWPMn1_MIAV0_MIWT2_1_MO40_MGRIPM1_NTn1_NTA0_NTB0_NTC4_NTD4_NTM0_NEPBS10_NLCA1_NLCB1_ONLL1_PGR2_PLR1_PKA1_SGROB0_SIA3_SS1_SU0_SUM0_SUS0_SPO1_SRVW0_SSO1_SVW2_SK3_SKFTR0_SKXCCM0_SGRO0_TDMI0_TIN1_TLDS1_TLDSMn1_ULSGRO0_USL1_UIOFGRO0_UPLRP0_USFGRO1_VSn1_VWA2_VWB1_WSGRA0_WSGRB0_WS64_WG16_16_1_WGMn1_WGMXCC1_WGMXCCGn1
    SolutionIndex: 278
    SolutionNameMin: Cijk_Ailk_Bljk_S_B_Bias_HA_S_SAV_UserArgs_MT256x224x32_MI16x16x1_SN_LDSB1_AFC0_AG1_AFEM1_AFEM1_ASEM1_CLR1_CADS0_DTLA0_DTLB0_DTVA0_DTVB0_DTVMXSA0_DTVMXSB0_DTVSM0_DPLB0_EPS0_ELFLR0_EMLLn1_FDSI0_GRPM1_GRVWA4_GRVWB4_GSU0_GSUAMB_GSUC0_GSUWGMRR0_GLS0_ISA950_IU1_K1_LDSTI0_LBSPPA0_LBSPPB128_LBSPPM0_LPA0_LPB8_LPM0_LRVWn1_LWPMn1_MIAV0_MIWT8_7_MO40_MGRIPM1_NTn1_NTA0_NTB0_NTC0_NTD0_NTM0_NEPBS16_NLCA1_NLCB1_ONLL1_PGR2_PLR1_PKA1_SGROB0_SIA3_SS1_SU8_SUM0_SUS256_SPO0_SRVW0_SSO1_SVW4_SK3_SKFTR0_SKXCCM4_SGRO0_TDMI0_TIN0_TLDS1_TLDSMn1_ULSGRO0_USL1_UIOFGRO0_UPLRP0_USFGRO0_VSn1_VWA4_VWB1_WSGRA0_WSGRB0_WS64_WG32_8_1_WGM16_WGMXCC1_WGMXCCGn1
    SolutionIndex: 279
    SolutionNameMin: Cijk_Ailk_Bljk_S_B_Bias_HA_S_SAV_UserArgs_MT32x64x64_MI16x16x1_SN_LDSB1_AFC0_AG1_AFEM1_AFEM1_ASEM1_CLR1_CADS0_DTLA0_DTLB0_DTVA0_DTVB0_DTVMXSA0_DTVMXSB0_DTVSM0_DPLB0_EPS1_ELFLR0_EMLL0_FDSI0_GRPM1_GRVWA1_GRVWB4_GSU0_GSUAMB_GSUC0_GSUWGMRR0_GLS0_ISA950_IU1_K1_LDSTI0_LBSPPA0_LBSPPB256_LBSPPM0_LPA0_LPB8_LPM0_LRVWn1_LWPMn1_MIAV0_MIWT2_1_MO40_MGRIPM1_NTn1_NTA0_NTB0_NTC4_NTD4_NTM0_NEPBS14_NLCA1_NLCB1_ONLL1_PGR1_PLR1_PKA1_SGROB0_SIA3_SS1_SU0_SUM0_SUS0_SPO1_SRVW0_SSO0_SVW2_SK3_SKFTR0_SKXCCM4_SGRO0_TDMI0_TIN1_TLDS1_TLDSMn1_ULSGRO0_USL1_UIOFGRO0_UPLRP0_USFGRO1_VSn1_VWA2_VWB1_WSGRA0_WSGRB0_WS64_WG16_16_1_WGM16_WGMXCC1_WGMXCCGn1
    SolutionIndex: 280
    SolutionNameMin: Cijk_Ailk_Bljk_S_B_Bias_HA_S_SAV_UserArgs_MT32x32x128_MI16x16x1_SN_LDSB1_AFC0_AG0_AFEM1_AFEM1_ASEM1_CLR1_CADS0_DTLA0_DTLB0_DTVA0_DTVB0_DTVMXSA0_DTVMXSB0_DTVSM0_DPLB0_EPS0_ELFLR0_EMLLn1_FDSI0_GRPM1_GRVWA4_GRVWB4_GSU0_GSUAMB_GSUC0_GSUWGMRR0_GLS0_ISA950_IU1_K1_LDSTI0_LBSPPA512_LBSPPB512_LBSPPM0_LPA16_LPB8_LPM0_LRVWn1_LWPMn1_MIAV1_MIWT1_1_MO40_MGRIPM1_NTn1_NTA4_NTB0_NTC0_NTD4_NTM0_NEPBS8_NLCA1_NLCB1_ONLL1_PGR2_PLR1_PKA1_SGROB0_SIA3_SS1_SU0_SUM0_SUS0_SPO1_SRVW0_SSO0_SVW1_SK3_SKFTR0_SKXCCM8_SGRO0_TDMI0_TIN1_TLDS1_TLDSMn1_ULSGRO0_USL1_UIOFGRO0_UPLRP0_USFGRO0_VSn1_VWA1_VWB1_WSGRA0_WSGRB0_WS64_WG32_8_1_WGM32_WGMXCC1_WGMXCCGn1
    SolutionIndex: 281
    SolutionNameMin: Cijk_Ailk_Bljk_S_B_Bias_HA_S_SAV_UserArgs_MT32x64x32_MI16x16x1_SN_LDSB1_AFC0_AG0_AFEM1_AFEM1_ASEM1_CLR1_CADS0_DTLA0_DTLB0_DTVA0_DTVB0_DTVMXSA0_DTVMXSB0_DTVSM0_DPLB0_EPS0_ELFLR0_EMLLn1_FDSI0_GRPM1_GRVWA1_GRVWB4_GSU0_GSUAMB_GSUC0_GSUWGMRR0_GLS0_ISA950_IU1_K1_LDSTI0_LBSPPA0_LBSPPB128_LBSPPM0_LPA0_LPB8_LPM0_LRVWn1_LWPMn1_MIAV0_MIWT2_1_MO40_MGRIPM1_NTn1_NTA0_NTB0_NTC4_NTD4_NTM0_NEPBS4_NLCA1_NLCB1_ONLL1_PGR2_PLR1_PKA1_SGROB0_SIA3_SS1_SU0_SUM0_SUS0_SPO1_SRVW0_SSO4_SVW2_SK3_SKFTR0_SKXCCM0_SGRO0_TDMI0_TIN1_TLDS1_TLDSMn1_ULSGRO0_USL1_UIOFGRO0_UPLRP0_USFGRO1_VSn1_VWA2_VWB1_WSGRA0_WSGRB0_WS64_WG16_16_1_WGMn16_WGMXCC1_WGMXCCGn1
    SolutionIndex: 282
    SolutionNameMin: Cijk_Ailk_Bljk_S_B_Bias_HA_S_SAV_UserArgs_MT32x32x64_MI16x16x1_SN_LDSB1_AFC0_AG1_AFEM1_AFEM1_ASEM1_CLR1_CADS0_DTLA0_DTLB0_DTVA0_DTVB0_DTVMXSA0_DTVMXSB0_DTVSM0_DPLB0_EPS0_ELFLR0_EMLLn1_FDSI0_GRPM1_GRVWA1_GRVWB4_GSU0_GSUAMB_GSUC0_GSUWGMRR0_GLS0_ISA950_IU1_K1_LDSTI0_LBSPPA512_LBSPPB256_LBSPPM0_LPA16_LPB8_LPM0_LRVWn1_LWPMn1_MIAV0_MIWT1_1_MO40_MGRIPM1_NTn1_NTA0_NTB0_NTC0_NTD0_NTM0_NEPBS4_NLCA1_NLCB1_ONLL1_PGR2_PLR1_PKA1_SGROB0_SIA3_SS1_SU0_SUM0_SUS0_SPO0_SRVW0_SSO0_SVW1_SK3_SKFTR0_SKXCCM4_SGRO0_TDMI0_TIN1_TLDS1_TLDSMn1_ULSGRO1_USL1_UIOFGRO0_UPLRP0_USFGRO1_VSn1_VWA1_VWB1_WSGRA0_WSGRB2_WS64_WG32_8_1_WGM24_WGMXCC1_WGMXCCGn1
    SolutionIndex: 283
    SolutionNameMin: Cijk_Ailk_Bljk_S_B_Bias_HA_S_SAV_UserArgs_MT96x32x32_MI16x16x1_SN_LDSB0_AFC0_AG1_AFEM1_AFEM1_ASEM1_CLR1_CADS0_DTLA0_DTLB0_DTVA0_DTVB0_DTVMXSA0_DTVMXSB0_DTVSM0_DPLB0_EPS1_ELFLR0_EMLLn1_FDSI0_GRPM1_GRVWA1_GRVWB4_GSU0_GSUAMB_GSUC0_GSUWGMRR0_GLS0_ISA950_IU1_K1_LDSTI0_LBSPPA1536_LBSPPB128_LBSPPM0_LPA16_LPB8_LPM0_LRVWn1_LWPMn1_MIAV0_MIWT3_1_MO40_MGRIPM1_NTn1_NTA0_NTB0_NTC4_NTD4_NTM0_NEPBS8_NLCA3_NLCB1_ONLL1_PGR1_PLR1_PKA1_SGROB0_SIA3_SS0_SU0_SUM0_SUS0_SPO1_SRVW0_SSO0_SVW4_SK3_SKFTR0_SKXCCM8_SGRO0_TDMI0_TIN1_TLDS1_TLDSMn1_ULSGRO0_USL1_UIOFGRO0_UPLRP0_USFGRO1_VSn1_VWA1_VWB1_WSGRA2_WSGRB0_WS64_WG32_8_1_WGM2_WGMXCC1_WGMXCCGn1
    SolutionIndex: 284
    SolutionNameMin: Cijk_Ailk_Bljk_S_B_Bias_HA_S_SAV_UserArgs_MT64x32x32_MI16x16x1_SN_LDSB1_AFC0_AG1_AFEM1_AFEM1_ASEM1_CLR1_CADS0_DTLA0_DTLB0_DTVA0_DTVB0_DTVMXSA0_DTVMXSB0_DTVSM0_DPLB0_EPS0_ELFLR0_EMLL0_FDSI0_GRPM1_GRVWA1_GRVWB4_GSU0_GSUAMB_GSUC0_GSUWGMRR0_GLS0_ISA950_IU1_K1_LDSTI0_LBSPPA0_LBSPPB128_LBSPPM0_LPA0_LPB8_LPM0_LRVWn1_LWPMn1_MIAV0_MIWT2_1_MO40_MGRIPM1_NTn1_NTA4_NTB0_NTC0_NTD4_NTM0_NEPBS8_NLCA1_NLCB1_ONLL1_PGR2_PLR1_PKA1_SGROB0_SIA3_SS1_SU0_SUM0_SUS0_SPO0_SRVW0_SSO0_SVW2_SK3_SKFTR0_SKXCCM0_SGRO0_TDMI0_TIN1_TLDS1_TLDSMn1_ULSGRO0_USL1_UIOFGRO0_UPLRP0_USFGRO1_VSn1_VWA2_VWB1_WSGRA0_WSGRB0_WS64_WG32_8_1_WGM24_WGMXCC1_WGMXCCGn1
    SolutionIndex: 285
    SolutionNameMin: Cijk_Ailk_Bljk_S_B_Bias_HA_S_SAV_UserArgs_MT64x32x64_MI16x16x1_SN_LDSB1_AFC0_AG1_AFEM1_AFEM1_ASEM1_CLR1_CADS0_DTLA0_DTLB0_DTVA0_DTVB0_DTVMXSA0_DTVMXSB0_DTVSM0_DPLB0_EPS0_ELFLR0_EMLLn1_FDSI0_GRPM1_GRVWA1_GRVWB4_GSU0_GSUAMB_GSUC0_GSUWGMRR0_GLS0_ISA950_IU1_K1_LDSTI0_LBSPPA0_LBSPPB256_LBSPPM0_LPA0_LPB8_LPM0_LRVWn1_LWPMn1_MIAV0_MIWT2_1_MO40_MGRIPM1_NTn1_NTA0_NTB0_NTC4_NTD4_NTM0_NEPBS10_NLCA1_NLCB1_ONLL1_PGR2_PLR1_PKA1_SGROB0_SIA3_SS1_SU0_SUM0_SUS0_SPO0_SRVW0_SSO1_SVW2_SK3_SKFTR0_SKXCCM8_SGRO0_TDMI0_TIN1_TLDS1_TLDSMn1_ULSGRO0_USL1_UIOFGRO0_UPLRP0_USFGRO0_VSn1_VWA2_VWB1_WSGRA2_WSGRB0_WS64_WG32_8_1_WGM32_WGMXCC1_WGMXCCGn1
    SolutionIndex: 286
    SolutionNameMin: Cijk_Ailk_Bljk_S_B_Bias_HA_S_SAV_UserArgs_MT32x32x128_MI16x16x1_SN_LDSB1_AFC0_AG0_AFEM1_AFEM1_ASEM1_CLR1_CADS0_DTLA0_DTLB0_DTVA0_DTVB0_DTVMXSA0_DTVMXSB0_DTVSM0_DPLB0_EPS0_ELFLR0_EMLL0_FDSI0_GRPM1_GRVWA4_GRVWB4_GSU0_GSUAMB_GSUC0_GSUWGMRR0_GLS0_ISA950_IU1_K1_LDSTI0_LBSPPA512_LBSPPB512_LBSPPM0_LPA16_LPB8_LPM0_LRVWn1_LWPMn1_MIAV0_MIWT1_1_MO40_MGRIPM1_NTn1_NTA0_NTB4_NTC4_NTD4_NTM0_NEPBS10_NLCA1_NLCB1_ONLL1_PGR2_PLR1_PKA1_SGROB0_SIA3_SS1_SU0_SUM0_SUS0_SPO1_SRVW0_SSO0_SVW1_SK3_SKFTR0_SKXCCM0_SGRO0_TDMI0_TIN1_TLDS1_TLDSMn1_ULSGRO0_USL1_UIOFGRO0_UPLRP0_USFGRO0_VSn1_VWA1_VWB1_WSGRA0_WSGRB0_WS64_WG32_8_1_WGMn8_WGMXCC1_WGMXCCGn1
    SolutionIndex: 287
    SolutionNameMin: Cijk_Ailk_Bljk_S_B_Bias_HA_S_SAV_UserArgs_MT256x256x32_MI16x16x1_SN_LDSB1_AFC0_AG1_AFEM1_AFEM1_ASEM1_CLR1_CADS0_DTLA0_DTLB0_DTVA0_DTVB0_DTVMXSA0_DTVMXSB0_DTVSM0_DPLB0_EPS0_ELFLR0_EMLL0_FDSI0_GRPM1_GRVWA4_GRVWB4_GSU0_GSUAMB_GSUC0_GSUWGMRR0_GLS0_ISA950_IU1_K1_LDSTI0_LBSPPA0_LBSPPB512_LBSPPM0_LPA0_LPB8_LPM0_LRVWn1_LWPMn1_MIAV0_MIWT8_8_MO40_MGRIPM1_NTn1_NTA0_NTB0_NTC4_NTD4_NTM0_NEPBS0_NLCA1_NLCB1_ONLL1_PGR2_PLR1_PKA1_SGROB0_SIA3_SS1_SU0_SUM0_SUS0_SPO0_SRVW0_SSO1_SVW4_SK3_SKFTR0_SKXCCM8_SGRO0_TDMI0_TIN1_TLDS1_TLDSMn1_ULSGRO0_USL1_UIOFGRO0_UPLRP0_USFGRO1_VSn1_VWA4_VWB4_WSGRA2_WSGRB0_WS64_WG32_8_1_WGMn2_WGMXCC8_WGMXCCGn1
    SolutionIndex: 288
    SolutionNameMin: Cijk_Ailk_Bljk_S_B_Bias_HA_S_SAV_UserArgs_MT64x32x32_MI16x16x1_SN_LDSB1_AFC0_AG1_AFEM1_AFEM1_ASEM1_CLR1_CADS0_DTLA0_DTLB0_DTVA0_DTVB0_DTVMXSA0_DTVMXSB0_DTVSM0_DPLB0_EPS0_ELFLR0_EMLL0_FDSI0_GRPM1_GRVWA1_GRVWB4_GSU0_GSUAMB_GSUC0_GSUWGMRR0_GLS0_ISA950_IU1_K1_LDSTI0_LBSPPA0_LBSPPB128_LBSPPM0_LPA0_LPB8_LPM0_LRVWn1_LWPMn1_MIAV0_MIWT2_1_MO40_MGRIPM1_NTn1_NTA0_NTB0_NTC4_NTD4_NTM0_NEPBS16_NLCA1_NLCB1_ONLL1_PGR2_PLR1_PKA1_SGROB0_SIA3_SS1_SU0_SUM0_SUS0_SPO0_SRVW0_SSO0_SVW2_SK3_SKFTR0_SKXCCM0_SGRO0_TDMI0_TIN1_TLDS1_TLDSMn1_ULSGRO0_USL1_UIOFGRO0_UPLRP0_USFGRO1_VSn1_VWA2_VWB1_WSGRA0_WSGRB0_WS64_WG32_8_1_WGM2_WGMXCC1_WGMXCCGn1
    SolutionIndex: 289
    SolutionNameMin: Cijk_Ailk_Bljk_S_B_Bias_HA_S_SAV_UserArgs_MT32x32x32_MI16x16x1_SN_LDSB1_AFC0_AG1_AFEM1_AFEM1_ASEM1_CLR1_CADS0_DTLA0_DTLB0_DTVA0_DTVB0_DTVMXSA0_DTVMXSB0_DTVSM0_DPLB0_EPS0_ELFLR0_EMLLn1_FDSI0_GRPM1_GRVWA1_GRVWB4_GSU0_GSUAMB_GSUC0_GSUWGMRR0_GLS0_ISA950_IU1_K1_LDSTI0_LBSPPA512_LBSPPB128_LBSPPM0_LPA16_LPB8_LPM0_LRVWn1_LWPMn1_MIAV0_MIWT1_1_MO40_MGRIPM1_NTn1_NTA0_NTB0_NTC4_NTD4_NTM0_NEPBS10_NLCA1_NLCB1_ONLL1_PGR2_PLR1_PKA1_SGROB0_SIA3_SS1_SU0_SUM0_SUS0_SPO0_SRVW0_SSO0_SVW1_SK3_SKFTR0_SKXCCM8_SGRO0_TDMI0_TIN1_TLDS1_TLDSMn1_ULSGRO0_USL1_UIOFGRO0_UPLRP0_USFGRO1_VSn1_VWA1_VWB1_WSGRA0_WSGRB0_WS64_WG32_8_1_WGM0_WGMXCC1_WGMXCCGn1
    SolutionIndex: 290
    SolutionNameMin: Cijk_Ailk_Bljk_S_B_Bias_HA_S_SAV_UserArgs_MT128x32x32_MI16x16x1_SN_LDSB0_AFC0_AG0_AFEM1_AFEM1_ASEM1_CLR1_CADS0_DTLA0_DTLB0_DTVA0_DTVB0_DTVMXSA0_DTVMXSB0_DTVSM0_DPLB0_EPS1_ELFLR0_EMLLn1_FDSI0_GRPM1_GRVWA1_GRVWB4_GSU0_GSUAMB_GSUC0_GSUWGMRR0_GLS0_ISA950_IU1_K1_LDSTI0_LBSPPA0_LBSPPB128_LBSPPM0_LPA0_LPB8_LPM0_LRVWn1_LWPMn1_MIAV0_MIWT4_1_MO40_MGRIPM1_NTn1_NTA0_NTB0_NTC4_NTD4_NTM0_NEPBS0_NLCA1_NLCB1_ONLL1_PGR1_PLR1_PKA1_SGROB0_SIA3_SS1_SU0_SUM0_SUS0_SPO1_SRVW0_SSO0_SVW4_SK3_SKFTR0_SKXCCM0_SGRO0_TDMI0_TIN1_TLDS1_TLDSMn1_ULSGRO0_USL1_UIOFGRO0_UPLRP0_USFGRO1_VSn1_VWA4_VWB1_WSGRA0_WSGRB0_WS64_WG32_8_1_WGM32_WGMXCC32_WGMXCCGn1
    SolutionIndex: 291
    SolutionNameMin: Cijk_Ailk_Bljk_S_B_Bias_HA_S_SAV_UserArgs_MT32x32x128_MI16x16x1_SN_LDSB1_AFC0_AG1_AFEM1_AFEM1_ASEM1_CLR1_CADS0_DTLA0_DTLB0_DTVA0_DTVB0_DTVMXSA0_DTVMXSB0_DTVSM0_DPLB0_EPS0_ELFLR0_EMLLn1_FDSI0_GRPM1_GRVWA4_GRVWB4_GSU0_GSUAMB_GSUC0_GSUWGMRR0_GLS0_ISA950_IU1_K1_LDSTI0_LBSPPA512_LBSPPB512_LBSPPM0_LPA16_LPB8_LPM0_LRVWn1_LWPMn1_MIAV0_MIWT1_1_MO40_MGRIPM1_NTn1_NTA0_NTB0_NTC4_NTD4_NTM0_NEPBS2_NLCA1_NLCB1_ONLL1_PGR2_PLR1_PKA1_SGROB0_SIA3_SS0_SU0_SUM0_SUS0_SPO1_SRVW0_SSO0_SVW4_SK3_SKFTR0_SKXCCM4_SGRO0_TDMI0_TIN1_TLDS1_TLDSMn1_ULSGRO1_USL1_UIOFGRO0_UPLRP0_USFGRO1_VSn1_VWA1_VWB1_WSGRA0_WSGRB2_WS64_WG32_8_1_WGM32_WGMXCC1_WGMXCCGn1
    SolutionIndex: 292
    SolutionNameMin: Cijk_Ailk_Bljk_S_B_Bias_HA_S_SAV_UserArgs_MT64x32x32_MI16x16x1_SN_LDSB1_AFC0_AG0_AFEM1_AFEM1_ASEM1_CLR1_CADS0_DTLA0_DTLB0_DTVA0_DTVB0_DTVMXSA0_DTVMXSB0_DTVSM0_DPLB0_EPS0_ELFLR0_EMLLn1_FDSI0_GRPM1_GRVWA1_GRVWB4_GSU0_GSUAMB_GSUC0_GSUWGMRR0_GLS0_ISA950_IU1_K1_LDSTI0_LBSPPA0_LBSPPB128_LBSPPM0_LPA0_LPB8_LPM0_LRVWn1_LWPMn1_MIAV1_MIWT2_1_MO40_MGRIPM1_NTn1_NTA4_NTB0_NTC0_NTD4_NTM0_NEPBS0_NLCA1_NLCB1_ONLL1_PGR2_PLR1_PKA1_SGROB0_SIA3_SS1_SU0_SUM0_SUS0_SPO0_SRVW0_SSO0_SVW2_SK3_SKFTR0_SKXCCM0_SGRO0_TDMI0_TIN1_TLDS1_TLDSMn1_ULSGRO0_USL1_UIOFGRO0_UPLRP0_USFGRO1_VSn1_VWA2_VWB1_WSGRA0_WSGRB0_WS64_WG32_8_1_WGM32_WGMXCC1_WGMXCCGn1
    SolutionIndex: 293
    SolutionNameMin: Cijk_Ailk_Bljk_S_B_Bias_HA_S_SAV_UserArgs_MT16x64x32_MI16x16x1_SN_LDSB1_AFC0_AG1_AFEM1_AFEM1_ASEM1_CLR1_CADS0_DTLA0_DTLB0_DTVA0_DTVB0_DTVMXSA0_DTVMXSB0_DTVSM0_DPLB0_EPS0_ELFLR0_EMLLn1_FDSI0_GRPM1_GRVWA1_GRVWB4_GSU0_GSUAMB_GSUC0_GSUWGMRR0_GLS0_ISA950_IU1_K1_LDSTI0_LBSPPA128_LBSPPB128_LBSPPM0_LPA8_LPB8_LPM0_LRVWn1_LWPMn1_MIAV0_MIWT1_1_MO40_MGRIPM1_NTn1_NTA0_NTB0_NTC0_NTD4_NTM0_NEPBS16_NLCA1_NLCB1_ONLL1_PGR2_PLR1_PKA1_SGROB0_SIA3_SS0_SU0_SUM0_SUS0_SPO0_SRVW0_SSO0_SVW4_SK3_SKFTR0_SKXCCM8_SGRO0_TDMI0_TIN1_TLDS2_TLDSMn1_ULSGRO0_USL1_UIOFGRO0_UPLRP0_USFGRO1_VSn1_VWA1_VWB1_WSGRA0_WSGRB0_WS64_WG16_16_1_WGM32_WGMXCC1_WGMXCCGn1
    SolutionIndex: 294
    SolutionNameMin: Cijk_Ailk_Bljk_S_B_Bias_HA_S_SAV_UserArgs_MT16x16x64_MI16x16x1_SN_LDSB1_AFC0_AG1_AFEM1_AFEM1_ASEM1_CLR1_CADS0_DTLA0_DTLB0_DTVA0_DTVB0_DTVMXSA0_DTVMXSB0_DTVSM0_DPLB0_EPS0_ELFLR0_EMLLn1_FDSI0_GRPM1_GRVWA1_GRVWB4_GSU0_GSUAMB_GSUC0_GSUWGMRR0_GLS0_ISA950_IU1_K1_LDSTI0_LBSPPA256_LBSPPB256_LBSPPM0_LPA8_LPB8_LPM0_LRVWn1_LWPMn1_MIAV0_MIWT1_1_MO40_MGRIPM1_NTn1_NTA4_NTB0_NTC0_NTD0_NTM0_NEPBS0_NLCA1_NLCB1_ONLL1_PGR2_PLR1_PKA1_SGROB0_SIA3_SS0_SU8_SUM0_SUS256_SPO1_SRVW0_SSO0_SVW1_SK3_SKFTR0_SKXCCM0_SGRO0_TDMI0_TIN0_TLDS2_TLDSMn1_ULSGRO0_USL1_UIOFGRO0_UPLRP0_USFGRO1_VSn1_VWA1_VWB1_WSGRA0_WSGRB2_WS64_WG16_4_2_WGM6_WGMXCC32_WGMXCCGn1
    SolutionIndex: 295
    SolutionNameMin: Cijk_Ailk_Bljk_S_B_Bias_HA_S_SAV_UserArgs_MT32x32x32_MI16x16x1_SN_LDSB1_AFC0_AG1_AFEM1_AFEM1_ASEM1_CLR1_CADS0_DTLA0_DTLB0_DTVA0_DTVB0_DTVMXSA0_DTVMXSB0_DTVSM0_DPLB0_EPS0_ELFLR0_EMLL0_FDSI0_GRPM1_GRVWA1_GRVWB4_GSU0_GSUAMB_GSUC0_GSUWGMRR0_GLS0_ISA950_IU1_K1_LDSTI0_LBSPPA512_LBSPPB128_LBSPPM0_LPA16_LPB8_LPM0_LRVWn1_LWPMn1_MIAV1_MIWT1_1_MO40_MGRIPM1_NTn1_NTA0_NTB0_NTC4_NTD0_NTM0_NEPBS10_NLCA1_NLCB1_ONLL1_PGR2_PLR1_PKA1_SGROB0_SIA3_SS1_SU0_SUM0_SUS0_SPO0_SRVW0_SSO0_SVW1_SK3_SKFTR0_SKXCCM0_SGRO0_TDMI0_TIN1_TLDS1_TLDSMn1_ULSGRO1_USL1_UIOFGRO0_UPLRP0_USFGRO1_VSn1_VWA1_VWB1_WSGRA0_WSGRB0_WS64_WG32_8_1_WGM8_WGMXCC1_WGMXCCGn1
    SolutionIndex: 296
    SolutionNameMin: Cijk_Ailk_Bljk_S_B_Bias_HA_S_SAV_UserArgs_MT32x32x64_MI16x16x1_SN_LDSB1_AFC0_AG0_AFEM1_AFEM1_ASEM1_CLR1_CADS0_DTLA0_DTLB0_DTVA0_DTVB0_DTVMXSA0_DTVMXSB0_DTVSM0_DPLB0_EPS0_ELFLR0_EMLLn1_FDSI0_GRPM1_GRVWA1_GRVWB4_GSU0_GSUAMB_GSUC0_GSUWGMRR0_GLS0_ISA950_IU1_K1_LDSTI0_LBSPPA512_LBSPPB256_LBSPPM0_LPA16_LPB8_LPM0_LRVWn1_LWPMn1_MIAV0_MIWT1_1_MO40_MGRIPM1_NTn1_NTA0_NTB0_NTC0_NTD4_NTM0_NEPBS12_NLCA1_NLCB1_ONLL1_PGR2_PLR1_PKA1_SGROB0_SIA3_SS1_SU0_SUM0_SUS0_SPO0_SRVW0_SSO0_SVW1_SK3_SKFTR0_SKXCCM0_SGRO0_TDMI0_TIN1_TLDS1_TLDSMn1_ULSGRO0_USL1_UIOFGRO0_UPLRP0_USFGRO1_VSn1_VWA1_VWB1_WSGRA0_WSGRB0_WS64_WG32_8_1_WGM8_WGMXCC1_WGMXCCGn1
    SolutionIndex: 297
    SolutionNameMin: Cijk_Ailk_Bljk_S_B_Bias_HA_S_SAV_UserArgs_MT32x64x32_MI16x16x1_SN_LDSB0_AFC0_AG0_AFEM1_AFEM1_ASEM1_CLR1_CADS0_DTLA0_DTLB0_DTVA0_DTVB0_DTVMXSA0_DTVMXSB0_DTVSM0_DPLB0_EPS0_ELFLR0_EMLL0_FDSI0_GRPM1_GRVWA1_GRVWB4_GSU0_GSUAMB_GSUC0_GSUWGMRR0_GLS0_ISA950_IU1_K1_LDSTI0_LBSPPA0_LBSPPB128_LBSPPM0_LPA0_LPB8_LPM0_LRVWn1_LWPMn1_MIAV0_MIWT2_1_MO40_MGRIPM1_NTn1_NTA0_NTB4_NTC4_NTD0_NTM0_NEPBS10_NLCA1_NLCB1_ONLL1_PGR2_PLR1_PKA1_SGROB0_SIA3_SS1_SU0_SUM0_SUS0_SPO1_SRVW0_SSO0_SVW2_SK3_SKFTR0_SKXCCM4_SGRO0_TDMI0_TIN1_TLDS1_TLDSMn1_ULSGRO0_USL1_UIOFGRO0_UPLRP0_USFGRO1_VSn1_VWA2_VWB1_WSGRA0_WSGRB0_WS64_WG16_16_1_WGM48_WGMXCC1_WGMXCCGn1
    SolutionIndex: 298
    SolutionNameMin: Cijk_Ailk_Bljk_S_B_Bias_HA_S_SAV_UserArgs_MT256x208x32_MI16x16x1_SN_LDSB1_AFC0_AG1_AFEM1_AFEM1_ASEM1_CLR1_CADS0_DTLA0_DTLB0_DTVA0_DTVB0_DTVMXSA0_DTVMXSB0_DTVSM0_DPLB0_EPS0_ELFLR0_EMLL0_FDSI0_GRPM1_GRVWA4_GRVWB2_GSU0_GSUAMB_GSUC0_GSUWGMRR0_GLS0_ISA950_IU1_K1_LDSTI0_LBSPPA0_LBSPPB128_LBSPPM0_LPA0_LPB8_LPM0_LRVWn1_LWPMn1_MIAV0_MIWT4_13_MO40_MGRIPM1_NTn1_NTA0_NTB0_NTC4_NTD4_NTM0_NEPBS14_NLCA1_NLCB1_ONLL1_PGR2_PLR1_PKA1_SGROB0_SIA3_SS1_SU0_SUM0_SUS0_SPO1_SRVW0_SSO1_SVW4_SK3_SKFTR0_SKXCCM0_SGRO0_TDMI0_TIN1_TLDS1_TLDSMn1_ULSGRO0_USL1_UIOFGRO0_UPLRP0_USFGRO1_VSn1_VWA4_VWB1_WSGRA2_WSGRB0_WS64_WG64_4_1_WGM24_WGMXCC2_WGMXCCGn1
    SolutionIndex: 299
    SolutionNameMin: Cijk_Ailk_Bljk_S_B_Bias_HA_S_SAV_UserArgs_MT32x32x128_MI16x16x1_SN_LDSB1_AFC0_AG0_AFEM1_AFEM1_ASEM1_CLR1_CADS0_DTLA0_DTLB0_DTVA0_DTVB0_DTVMXSA0_DTVMXSB0_DTVSM0_DPLB0_EPS0_ELFLR0_EMLL0_FDSI0_GRPM1_GRVWA1_GRVWB4_GSU0_GSUAMB_GSUC0_GSUWGMRR0_GLS0_ISA950_IU1_K1_LDSTI0_LBSPPA512_LBSPPB512_LBSPPM0_LPA16_LPB8_LPM0_LRVWn1_LWPMn1_MIAV0_MIWT1_1_MO40_MGRIPM1_NTn1_NTA4_NTB0_NTC4_NTD0_NTM0_NEPBS8_NLCA1_NLCB1_ONLL1_PGR2_PLR1_PKA1_SGROB0_SIA3_SS1_SU0_SUM0_SUS0_SPO0_SRVW0_SSO0_SVW1_SK3_SKFTR0_SKXCCM0_SGRO0_TDMI0_TIN1_TLDS1_TLDSMn1_ULSGRO0_USL1_UIOFGRO0_UPLRP0_USFGRO1_VSn1_VWA1_VWB1_WSGRA0_WSGRB0_WS64_WG32_8_1_WGM32_WGMXCC8_WGMXCCGn1
    SolutionIndex: 300
    SolutionNameMin: Cijk_Ailk_Bljk_S_B_Bias_HA_S_SAV_UserArgs_MT32x16x32_MI16x16x1_SN_LDSB1_AFC0_AG0_AFEM1_AFEM1_ASEM1_CLR1_CADS0_DTLA0_DTLB0_DTVA0_DTVB0_DTVMXSA0_DTVMXSB0_DTVSM0_DPLB0_EPS0_ELFLR0_EMLLn1_FDSI0_GRPM1_GRVWA1_GRVWB2_GSU0_GSUAMB_GSUC0_GSUWGMRR0_GLS0_ISA950_IU1_K1_LDSTI0_LBSPPA512_LBSPPB128_LBSPPM0_LPA16_LPB8_LPM0_LRVWn1_LWPMn1_MIAV0_MIWT1_1_MO40_MGRIPM1_NTn1_NTA4_NTB0_NTC0_NTD0_NTM0_NEPBS4_NLCA1_NLCB1_ONLL1_PGR2_PLR1_PKA1_SGROB0_SIA3_SS0_SU0_SUM0_SUS0_SPO0_SRVW0_SSO0_SVW1_SK3_SKFTR0_SKXCCM8_SGRO0_TDMI0_TIN0_TLDS1_TLDSMn1_ULSGRO0_USL1_UIOFGRO0_UPLRP0_USFGRO1_VSn1_VWA1_VWB1_WSGRA0_WSGRB0_WS64_WG32_4_2_WGM32_WGMXCC1_WGMXCCGn1
    SolutionIndex: 301
    SolutionNameMin: Cijk_Ailk_Bljk_S_B_Bias_HA_S_SAV_UserArgs_MT16x16x32_MI16x16x1_SN_LDSB1_AFC0_AG1_AFEM1_AFEM1_ASEM1_CLR1_CADS0_DTLA0_DTLB0_DTVA0_DTVB0_DTVMXSA0_DTVMXSB0_DTVSM0_DPLB0_EPS0_ELFLR0_EMLLn1_FDSI0_GRPM1_GRVWA1_GRVWB4_GSU0_GSUAMB_GSUC0_GSUWGMRR0_GLS0_ISA950_IU1_K1_LDSTI0_LBSPPA128_LBSPPB128_LBSPPM0_LPA8_LPB8_LPM0_LRVWn1_LWPMn1_MIAV1_MIWT1_1_MO40_MGRIPM1_NTn1_NTA0_NTB0_NTC0_NTD0_NTM0_NEPBS14_NLCA1_NLCB1_ONLL1_PGR2_PLR1_PKA1_SGROB0_SIA3_SS1_SU0_SUM0_SUS0_SPO1_SRVW0_SSO0_SVW1_SK3_SKFTR0_SKXCCM0_SGRO0_TDMI0_TIN0_TLDS2_TLDSMn1_ULSGRO0_USL1_UIOFGRO0_UPLRP0_USFGRO1_VSn1_VWA1_VWB1_WSGRA0_WSGRB0_WS64_WG16_4_2_WGMn32_WGMXCC1_WGMXCCGn1
    SolutionIndex: 302
    SolutionNameMin: Cijk_Ailk_Bljk_S_B_Bias_HA_S_SAV_UserArgs_MT16x128x32_MI16x16x1_SN_LDSB1_AFC0_AG1_AFEM1_AFEM1_ASEM1_CLR1_CADS0_DTLA0_DTLB0_DTVA0_DTVB0_DTVMXSA0_DTVMXSB0_DTVSM0_DPLB0_EPS0_ELFLR0_EMLL0_FDSI0_GRPM1_GRVWA1_GRVWB4_GSU0_GSUAMB_GSUC0_GSUWGMRR0_GLS0_ISA950_IU1_K1_LDSTI0_LBSPPA256_LBSPPB256_LBSPPM0_LPA16_LPB8_LPM0_LRVWn1_LWPMn1_MIAV0_MIWT1_2_MO40_MGRIPM1_NTn1_NTA0_NTB0_NTC4_NTD4_NTM0_NEPBS8_NLCA1_NLCB1_ONLL1_PGR2_PLR1_PKA1_SGROB0_SIA3_SS1_SU0_SUM0_SUS0_SPO1_SRVW0_SSO0_SVW1_SK3_SKFTR0_SKXCCM8_SGRO0_TDMI0_TIN1_TLDS1_TLDSMn1_ULSGRO0_USL1_UIOFGRO0_UPLRP0_USFGRO1_VSn1_VWA1_VWB2_WSGRA0_WSGRB0_WS64_WG16_16_1_WGMn1_WGMXCC1_WGMXCCGn1
    SolutionIndex: 303
    SolutionNameMin: Cijk_Ailk_Bljk_S_B_Bias_HA_S_SAV_UserArgs_MT32x32x64_MI16x16x1_SN_LDSB1_AFC0_AG0_AFEM1_AFEM1_ASEM1_CLR1_CADS0_DTLA0_DTLB0_DTVA0_DTVB0_DTVMXSA0_DTVMXSB0_DTVSM0_DPLB0_EPS0_ELFLR0_EMLLn1_FDSI0_GRPM1_GRVWA1_GRVWB4_GSU0_GSUAMB_GSUC0_GSUWGMRR0_GLS0_ISA950_IU1_K1_LDSTI0_LBSPPA512_LBSPPB256_LBSPPM0_LPA16_LPB8_LPM0_LRVWn1_LWPMn1_MIAV0_MIWT1_1_MO40_MGRIPM1_NTn1_NTA0_NTB0_NTC4_NTD4_NTM0_NEPBS14_NLCA1_NLCB1_ONLL1_PGR2_PLR1_PKA1_SGROB0_SIA3_SS1_SU0_SUM0_SUS0_SPO0_SRVW0_SSO0_SVW1_SK3_SKFTR0_SKXCCM8_SGRO0_TDMI0_TIN1_TLDS1_TLDSMn1_ULSGRO0_USL1_UIOFGRO0_UPLRP0_USFGRO1_VSn1_VWA1_VWB1_WSGRA0_WSGRB0_WS64_WG32_8_1_WGM4_WGMXCC1_WGMXCCGn1
    SolutionIndex: 304
    SolutionNameMin: Cijk_Ailk_Bljk_S_B_Bias_HA_S_SAV_UserArgs_MT32x32x64_MI16x16x1_SN_LDSB1_AFC0_AG0_AFEM1_AFEM1_ASEM1_CLR1_CADS0_DTLA0_DTLB0_DTVA0_DTVB0_DTVMXSA0_DTVMXSB0_DTVSM0_DPLB0_EPS0_ELFLR0_EMLL0_FDSI0_GRPM1_GRVWA1_GRVWB4_GSU0_GSUAMB_GSUC0_GSUWGMRR0_GLS0_ISA950_IU1_K1_LDSTI0_LBSPPA512_LBSPPB256_LBSPPM0_LPA16_LPB8_LPM0_LRVWn1_LWPMn1_MIAV0_MIWT1_1_MO40_MGRIPM1_NTn1_NTA0_NTB0_NTC4_NTD4_NTM0_NEPBS8_NLCA1_NLCB1_ONLL1_PGR2_PLR1_PKA1_SGROB0_SIA3_SS1_SU0_SUM0_SUS0_SPO0_SRVW0_SSO0_SVW1_SK3_SKFTR0_SKXCCM4_SGRO0_TDMI0_TIN1_TLDS1_TLDSMn1_ULSGRO0_USL1_UIOFGRO0_UPLRP0_USFGRO0_VSn1_VWA1_VWB1_WSGRA0_WSGRB0_WS64_WG32_8_1_WGM48_WGMXCC1_WGMXCCGn1
    SolutionIndex: 305
    SolutionNameMin: Cijk_Ailk_Bljk_S_B_Bias_HA_S_SAV_UserArgs_MT64x32x32_MI16x16x1_SN_LDSB1_AFC0_AG0_AFEM1_AFEM1_ASEM1_CLR1_CADS0_DTLA0_DTLB0_DTVA0_DTVB0_DTVMXSA0_DTVMXSB0_DTVSM0_DPLB0_EPS1_ELFLR0_EMLLn1_FDSI0_GRPM1_GRVWA1_GRVWB4_GSU0_GSUAMB_GSUC0_GSUWGMRR0_GLS0_ISA950_IU1_K1_LDSTI0_LBSPPA0_LBSPPB128_LBSPPM0_LPA0_LPB8_LPM0_LRVWn1_LWPMn1_MIAV0_MIWT2_1_MO40_MGRIPM1_NTn1_NTA0_NTB0_NTC4_NTD4_NTM0_NEPBS8_NLCA1_NLCB1_ONLL1_PGR1_PLR1_PKA1_SGROB0_SIA3_SS1_SU0_SUM0_SUS0_SPO1_SRVW0_SSO0_SVW2_SK3_SKFTR0_SKXCCM8_SGRO0_TDMI0_TIN1_TLDS1_TLDSMn1_ULSGRO0_USL1_UIOFGRO0_UPLRP0_USFGRO1_VSn1_VWA2_VWB1_WSGRA0_WSGRB0_WS64_WG32_8_1_WGM8_WGMXCC1_WGMXCCGn1
    SolutionIndex: 306
    SolutionNameMin: Cijk_Ailk_Bljk_S_B_Bias_HA_S_SAV_UserArgs_MT32x32x32_MI16x16x1_SN_LDSB1_AFC0_AG1_AFEM1_AFEM1_ASEM1_CLR1_CADS0_DTLA0_DTLB0_DTVA0_DTVB0_DTVMXSA0_DTVMXSB0_DTVSM0_DPLB0_EPS0_ELFLR0_EMLL0_FDSI0_GRPM1_GRVWA1_GRVWB4_GSU0_GSUAMB_GSUC0_GSUWGMRR0_GLS0_ISA950_IU1_K1_LDSTI0_LBSPPA512_LBSPPB128_LBSPPM0_LPA16_LPB8_LPM0_LRVWn1_LWPMn1_MIAV0_MIWT1_1_MO40_MGRIPM1_NTn1_NTA0_NTB0_NTC0_NTD4_NTM0_NEPBS16_NLCA1_NLCB1_ONLL1_PGR2_PLR1_PKA1_SGROB0_SIA3_SS1_SU0_SUM0_SUS0_SPO1_SRVW0_SSO0_SVW1_SK3_SKFTR0_SKXCCM4_SGRO0_TDMI0_TIN1_TLDS1_TLDSMn1_ULSGRO0_USL1_UIOFGRO0_UPLRP0_USFGRO1_VSn1_VWA1_VWB1_WSGRA0_WSGRB0_WS64_WG32_8_1_WGM8_WGMXCC1_WGMXCCGn1
    SolutionIndex: 307
    SolutionNameMin: Cijk_Ailk_Bljk_S_B_Bias_HA_S_SAV_UserArgs_MT64x64x32_MI16x16x1_SN_LDSB0_AFC0_AG1_AFEM1_AFEM1_ASEM1_CLR1_CADS0_DTLA0_DTLB0_DTVA0_DTVB0_DTVMXSA0_DTVMXSB0_DTVSM0_DPLB0_EPS0_ELFLR0_EMLL0_FDSI0_GRPM1_GRVWA1_GRVWB4_GSU0_GSUAMB_GSUC0_GSUWGMRR0_GLS0_ISA950_IU1_K1_LDSTI0_LBSPPA0_LBSPPB256_LBSPPM0_LPA0_LPB8_LPM0_LRVWn1_LWPMn1_MIAV0_MIWT2_2_MO40_MGRIPM1_NTn1_NTA0_NTB0_NTC4_NTD4_NTM0_NEPBS16_NLCA1_NLCB1_ONLL1_PGR2_PLR1_PKA1_SGROB0_SIA3_SS1_SU0_SUM0_SUS0_SPO0_SRVW0_SSO0_SVW2_SK3_SKFTR0_SKXCCM4_SGRO0_TDMI0_TIN1_TLDS1_TLDSMn1_ULSGRO0_USL1_UIOFGRO0_UPLRP0_USFGRO1_VSn1_VWA2_VWB2_WSGRA0_WSGRB0_WS64_WG32_8_1_WGM32_WGMXCC1_WGMXCCGn1
    SolutionIndex: 308
    SolutionNameMin: Cijk_Ailk_Bljk_S_B_Bias_HA_S_SAV_UserArgs_MT256x256x32_MI16x16x1_SN_LDSB1_AFC0_AG1_AFEM1_AFEM1_ASEM1_CLR1_CADS0_DTLA0_DTLB0_DTVA0_DTVB0_DTVMXSA0_DTVMXSB0_DTVSM0_DPLB0_EPS0_ELFLR0_EMLLn1_FDSI0_GRPM1_GRVWA4_GRVWB4_GSU0_GSUAMB_GSUC0_GSUWGMRR0_GLS0_ISA950_IU1_K1_LDSTI0_LBSPPA0_LBSPPB512_LBSPPM0_LPA0_LPB8_LPM0_LRVWn1_LWPMn1_MIAV0_MIWT8_8_MO40_MGRIPM1_NTn1_NTA0_NTB0_NTC4_NTD4_NTM0_NEPBS16_NLCA1_NLCB1_ONLL1_PGR2_PLR1_PKA1_SGROB0_SIA3_SS1_SU8_SUM0_SUS128_SPO0_SRVW0_SSO1_SVW4_SK3_SKFTR0_SKXCCM8_SGRO0_TDMI0_TIN0_TLDS1_TLDSMn1_ULSGRO0_USL1_UIOFGRO0_UPLRP0_USFGRO1_VSn1_VWA4_VWB4_WSGRA0_WSGRB2_WS64_WG32_8_1_WGM8_WGMXCC1_WGMXCCGn1
    SolutionIndex: 309
    SolutionNameMin: Cijk_Ailk_Bljk_S_B_Bias_HA_S_SAV_UserArgs_MT32x64x32_MI16x16x1_SN_LDSB1_AFC0_AG0_AFEM1_AFEM1_ASEM1_CLR1_CADS0_DTLA0_DTLB0_DTVA0_DTVB0_DTVMXSA0_DTVMXSB0_DTVSM0_DPLB0_EPS0_ELFLR0_EMLL0_FDSI0_GRPM1_GRVWA1_GRVWB4_GSU0_GSUAMB_GSUC0_GSUWGMRR0_GLS0_ISA950_IU1_K1_LDSTI0_LBSPPA512_LBSPPB256_LBSPPM0_LPA16_LPB8_LPM0_LRVWn1_LWPMn1_MIAV0_MIWT1_2_MO40_MGRIPM1_NTn1_NTA0_NTB0_NTC4_NTD4_NTM0_NEPBS0_NLCA1_NLCB1_ONLL1_PGR2_PLR1_PKA1_SGROB0_SIA3_SS1_SU0_SUM0_SUS0_SPO0_SRVW0_SSO0_SVW1_SK3_SKFTR0_SKXCCM8_SGRO0_TDMI0_TIN1_TLDS1_TLDSMn1_ULSGRO1_USL1_UIOFGRO0_UPLRP0_USFGRO1_VSn1_VWA1_VWB2_WSGRA0_WSGRB0_WS64_WG32_8_1_WGM8_WGMXCC1_WGMXCCGn1
    SolutionIndex: 310
    SolutionNameMin: Cijk_Ailk_Bljk_S_B_Bias_HA_S_SAV_UserArgs_MT32x32x128_MI16x16x1_SN_LDSB1_AFC0_AG1_AFEM1_AFEM1_ASEM1_CLR1_CADS0_DTLA0_DTLB0_DTVA0_DTVB0_DTVMXSA0_DTVMXSB0_DTVSM0_DPLB0_EPS0_ELFLR0_EMLLn1_FDSI0_GRPM1_GRVWA1_GRVWB4_GSU0_GSUAMB_GSUC0_GSUWGMRR0_GLS0_ISA950_IU1_K1_LDSTI0_LBSPPA512_LBSPPB512_LBSPPM0_LPA16_LPB8_LPM0_LRVWn1_LWPMn1_MIAV0_MIWT1_1_MO40_MGRIPM1_NTn1_NTA0_NTB4_NTC0_NTD4_NTM0_NEPBS8_NLCA1_NLCB1_ONLL1_PGR2_PLR1_PKA1_SGROB0_SIA3_SS0_SU0_SUM0_SUS0_SPO1_SRVW0_SSO0_SVW4_SK3_SKFTR0_SKXCCM0_SGRO0_TDMI0_TIN1_TLDS1_TLDSMn1_ULSGRO1_USL1_UIOFGRO0_UPLRP0_USFGRO1_VSn1_VWA1_VWB1_WSGRA0_WSGRB0_WS64_WG32_8_1_WGM8_WGMXCC1_WGMXCCGn1
    SolutionIndex: 311
    SolutionNameMin: Cijk_Ailk_Bljk_S_B_Bias_HA_S_SAV_UserArgs_MT64x32x32_MI16x16x1_SN_LDSB1_AFC0_AG0_AFEM1_AFEM1_ASEM1_CLR1_CADS0_DTLA0_DTLB0_DTVA0_DTVB0_DTVMXSA0_DTVMXSB0_DTVSM0_DPLB0_EPS0_ELFLR0_EMLLn1_FDSI0_GRPM1_GRVWA1_GRVWB4_GSU0_GSUAMB_GSUC0_GSUWGMRR0_GLS0_ISA950_IU1_K1_LDSTI0_LBSPPA0_LBSPPB128_LBSPPM0_LPA0_LPB8_LPM0_LRVWn1_LWPMn1_MIAV0_MIWT2_1_MO40_MGRIPM1_NTn1_NTA0_NTB0_NTC4_NTD4_NTM0_NEPBS0_NLCA1_NLCB1_ONLL1_PGR2_PLR1_PKA1_SGROB0_SIA3_SS1_SU0_SUM0_SUS0_SPO0_SRVW0_SSO1_SVW2_SK3_SKFTR0_SKXCCM0_SGRO0_TDMI0_TIN1_TLDS1_TLDSMn1_ULSGRO0_USL1_UIOFGRO0_UPLRP0_USFGRO1_VSn1_VWA2_VWB1_WSGRA0_WSGRB0_WS64_WG32_8_1_WGMn1_WGMXCC1_WGMXCCGn1
    SolutionIndex: 312
    SolutionNameMin: Cijk_Ailk_Bljk_S_B_Bias_HA_S_SAV_UserArgs_MT32x64x32_MI16x16x1_SN_LDSB1_AFC0_AG1_AFEM1_AFEM1_ASEM1_CLR1_CADS0_DTLA0_DTLB0_DTVA0_DTVB0_DTVMXSA0_DTVMXSB0_DTVSM0_DPLB0_EPS0_ELFLR0_EMLL0_FDSI0_GRPM1_GRVWA1_GRVWB4_GSU0_GSUAMB_GSUC0_GSUWGMRR0_GLS0_ISA950_IU1_K1_LDSTI0_LBSPPA512_LBSPPB256_LBSPPM0_LPA16_LPB8_LPM0_LRVWn1_LWPMn1_MIAV1_MIWT1_2_MO40_MGRIPM1_NTn1_NTA0_NTB4_NTC4_NTD0_NTM0_NEPBS10_NLCA1_NLCB1_ONLL1_PGR2_PLR1_PKA1_SGROB0_SIA3_SS0_SU0_SUM0_SUS0_SPO0_SRVW0_SSO0_SVW4_SK3_SKFTR0_SKXCCM8_SGRO0_TDMI0_TIN1_TLDS1_TLDSMn1_ULSGRO1_USL1_UIOFGRO0_UPLRP0_USFGRO1_VSn1_VWA1_VWB2_WSGRA2_WSGRB0_WS64_WG32_8_1_WGMn2_WGMXCC1_WGMXCCGn1
    SolutionIndex: 313
    SolutionNameMin: Cijk_Ailk_Bljk_S_B_Bias_HA_S_SAV_UserArgs_MT64x32x32_MI16x16x1_SN_LDSB1_AFC0_AG1_AFEM1_AFEM1_ASEM1_CLR1_CADS0_DTLA0_DTLB0_DTVA0_DTVB0_DTVMXSA0_DTVMXSB0_DTVSM0_DPLB0_EPS0_ELFLR0_EMLLn1_FDSI0_GRPM1_GRVWA1_GRVWB4_GSU0_GSUAMB_GSUC0_GSUWGMRR0_GLS0_ISA950_IU1_K1_LDSTI0_LBSPPA1024_LBSPPB256_LBSPPM0_LPA16_LPB8_LPM0_LRVWn1_LWPMn1_MIAV0_MIWT1_2_MO40_MGRIPM1_NTn1_NTA0_NTB0_NTC4_NTD4_NTM0_NEPBS16_NLCA1_NLCB1_ONLL1_PGR2_PLR1_PKA1_SGROB0_SIA3_SS0_SU0_SUM0_SUS0_SPO1_SRVW0_SSO0_SVW4_SK3_SKFTR0_SKXCCM8_SGRO0_TDMI0_TIN1_TLDS1_TLDSMn1_ULSGRO1_USL1_UIOFGRO0_UPLRP0_USFGRO1_VSn1_VWA1_VWB2_WSGRA0_WSGRB2_WS64_WG64_4_1_WGM4_WGMXCC1_WGMXCCGn1
    SolutionIndex: 314
    SolutionNameMin: Cijk_Ailk_Bljk_S_B_Bias_HA_S_SAV_UserArgs_MT64x32x32_MI16x16x1_SN_LDSB1_AFC0_AG1_AFEM1_AFEM1_ASEM1_CLR1_CADS0_DTLA0_DTLB0_DTVA0_DTVB0_DTVMXSA0_DTVMXSB0_DTVSM0_DPLB0_EPS0_ELFLR0_EMLL0_FDSI0_GRPM1_GRVWA1_GRVWB4_GSU0_GSUAMB_GSUC0_GSUWGMRR0_GLS0_ISA950_IU1_K1_LDSTI0_LBSPPA0_LBSPPB128_LBSPPM0_LPA0_LPB8_LPM0_LRVWn1_LWPMn1_MIAV0_MIWT2_1_MO40_MGRIPM1_NTn1_NTA0_NTB0_NTC4_NTD4_NTM0_NEPBS8_NLCA1_NLCB1_ONLL1_PGR2_PLR1_PKA1_SGROB0_SIA3_SS1_SU0_SUM0_SUS0_SPO0_SRVW0_SSO0_SVW2_SK3_SKFTR0_SKXCCM0_SGRO0_TDMI0_TIN1_TLDS1_TLDSMn1_ULSGRO0_USL1_UIOFGRO0_UPLRP0_USFGRO1_VSn1_VWA2_VWB1_WSGRA0_WSGRB0_WS64_WG32_8_1_WGMn2_WGMXCC1_WGMXCCGn1
    SolutionIndex: 315
    SolutionNameMin: Cijk_Ailk_Bljk_S_B_Bias_HA_S_SAV_UserArgs_MT16x32x128_MI16x16x1_SN_LDSB1_AFC0_AG1_AFEM1_AFEM1_ASEM1_CLR1_CADS0_DTLA0_DTLB0_DTVA0_DTVB0_DTVMXSA0_DTVMXSB0_DTVSM0_DPLB0_EPS0_ELFLR0_EMLLn1_FDSI0_GRPM1_GRVWA1_GRVWB4_GSU0_GSUAMB_GSUC0_GSUWGMRR0_GLS0_ISA950_IU1_K1_LDSTI0_LBSPPA256_LBSPPB512_LBSPPM0_LPA16_LPB8_LPM0_LRVWn1_LWPMn1_MIAV0_MIWT1_1_MO40_MGRIPM1_NTn1_NTA0_NTB4_NTC0_NTD0_NTM0_NEPBS14_NLCA1_NLCB1_ONLL1_PGR2_PLR1_PKA1_SGROB0_SIA3_SS0_SU0_SUM0_SUS0_SPO1_SRVW0_SSO0_SVW4_SK3_SKFTR0_SKXCCM0_SGRO0_TDMI0_TIN1_TLDS1_TLDSMn1_ULSGRO1_USL1_UIOFGRO0_UPLRP0_USFGRO1_VSn1_VWA1_VWB1_WSGRA2_WSGRB0_WS64_WG16_8_1_WGM48_WGMXCC1_WGMXCCGn1
    SolutionIndex: 316
    SolutionNameMin: Cijk_Ailk_Bljk_S_B_Bias_HA_S_SAV_UserArgs_MT256x256x32_MI16x16x1_SN_LDSB1_AFC0_AG0_AFEM1_AFEM1_ASEM1_CLR1_CADS0_DTLA0_DTLB0_DTVA0_DTVB0_DTVMXSA0_DTVMXSB0_DTVSM0_DPLB0_EPS0_ELFLR0_EMLLn1_FDSI0_GRPM1_GRVWA4_GRVWB4_GSU0_GSUAMB_GSUC0_GSUWGMRR0_GLS0_ISA950_IU1_K1_LDSTI0_LBSPPA0_LBSPPB512_LBSPPM0_LPA0_LPB8_LPM0_LRVWn1_LWPMn1_MIAV0_MIWT8_8_MO40_MGRIPM1_NTn1_NTA0_NTB0_NTC4_NTD4_NTM0_NEPBS14_NLCA1_NLCB1_ONLL1_PGR2_PLR1_PKA1_SGROB0_SIA3_SS1_SU8_SUM0_SUS512_SPO0_SRVW0_SSO1_SVW4_SK3_SKFTR0_SKXCCM4_SGRO0_TDMI0_TIN0_TLDS1_TLDSMn1_ULSGRO0_USL1_UIOFGRO0_UPLRP0_USFGRO0_VSn1_VWA4_VWB4_WSGRA2_WSGRB2_WS64_WG32_8_1_WGM2_WGMXCC1_WGMXCCGn1
    SolutionIndex: 317
    SolutionNameMin: Cijk_Ailk_Bljk_S_B_Bias_HA_S_SAV_UserArgs_MT256x256x32_MI32x32x1_SN_LDSB1_AFC0_AG1_AFEM1_AFEM1_ASEM1_CLR1_CADS0_DTLA0_DTLB0_DTVA0_DTVB0_DTVMXSA0_DTVMXSB0_DTVSM0_DPLB0_EPS1_ELFLR0_EMLL0_FDSI0_GRPM1_GRVWA4_GRVWB4_GSU0_GSUAMB_GSUC0_GSUWGMRR0_GLS0_ISA950_IU1_K1_LDSTI0_LBSPPA0_LBSPPB512_LBSPPM0_LPA0_LPB4_LPM0_LRVWn1_LWPMn1_MIAV0_MIWT4_4_MO40_MGRIPM1_NTn1_NTA0_NTB0_NTC4_NTD0_NTM0_NEPBS16_NLCA1_NLCB1_ONLL1_PGR1_PLR1_PKA1_SGROB0_SIA3_SS1_SU16_SUM0_SUS128_SPO0_SRVW0_SSO1_SVW4_SK3_SKFTR0_SKXCCM8_SGRO0_TDMI0_TIN0_TLDS1_TLDSMn1_ULSGRO0_USL1_UIOFGRO0_UPLRP0_USFGRO1_VSn1_VWA4_VWB4_WSGRA0_WSGRB2_WS64_WG64_4_1_WGMn1_WGMXCC1_WGMXCCGn1
    SolutionIndex: 318
    SolutionNameMin: Cijk_Ailk_Bljk_S_B_Bias_HA_S_SAV_UserArgs_MT256x256x32_MI16x16x1_SN_LDSB1_AFC0_AG0_AFEM1_AFEM1_ASEM1_CLR1_CADS0_DTLA0_DTLB0_DTVA0_DTVB0_DTVMXSA0_DTVMXSB0_DTVSM0_DPLB0_EPS0_ELFLR0_EMLL0_FDSI0_GRPM1_GRVWA4_GRVWB4_GSU0_GSUAMB_GSUC0_GSUWGMRR0_GLS0_ISA950_IU1_K1_LDSTI0_LBSPPA0_LBSPPB512_LBSPPM0_LPA0_LPB8_LPM0_LRVWn1_LWPMn1_MIAV0_MIWT8_8_MO40_MGRIPM1_NTn1_NTA0_NTB0_NTC4_NTD4_NTM0_NEPBS14_NLCA1_NLCB1_ONLL1_PGR2_PLR1_PKA1_SGROB0_SIA3_SS1_SU0_SUM0_SUS0_SPO1_SRVW0_SSO1_SVW4_SK3_SKFTR0_SKXCCM4_SGRO0_TDMI0_TIN1_TLDS1_TLDSMn1_ULSGRO1_USL1_UIOFGRO0_UPLRP0_USFGRO1_VSn1_VWA4_VWB4_WSGRA0_WSGRB2_WS64_WG32_8_1_WGMn1_WGMXCC16_WGMXCCGn1
    SolutionIndex: 319
    SolutionNameMin: Cijk_Ailk_Bljk_S_B_Bias_HA_S_SAV_UserArgs_MT256x256x32_MI16x16x1_SN_LDSB1_AFC0_AG1_AFEM1_AFEM1_ASEM1_CLR1_CADS0_DTLA0_DTLB0_DTVA0_DTVB0_DTVMXSA0_DTVMXSB0_DTVSM0_DPLB0_EPS0_ELFLR0_EMLLn1_FDSI0_GRPM1_GRVWA4_GRVWB4_GSU0_GSUAMB_GSUC0_GSUWGMRR0_GLS0_ISA950_IU1_K1_LDSTI0_LBSPPA0_LBSPPB512_LBSPPM0_LPA0_LPB8_LPM0_LRVWn1_LWPMn1_MIAV0_MIWT8_8_MO40_MGRIPM1_NTn1_NTA0_NTB0_NTC4_NTD4_NTM0_NEPBS14_NLCA1_NLCB1_ONLL1_PGR2_PLR1_PKA1_SGROB0_SIA3_SS1_SU0_SUM0_SUS0_SPO0_SRVW0_SSO1_SVW4_SK3_SKFTR0_SKXCCM4_SGRO0_TDMI0_TIN1_TLDS1_TLDSMn1_ULSGRO0_USL1_UIOFGRO0_UPLRP0_USFGRO1_VSn1_VWA4_VWB4_WSGRA0_WSGRB0_WS64_WG32_8_1_WGM8_WGMXCC2_WGMXCCGn1
    SolutionIndex: 320
    SolutionNameMin: Cijk_Ailk_Bljk_S_B_Bias_HA_S_SAV_UserArgs_MT384x160x32_MI16x16x1_SN_LDSB1_AFC0_AG1_AFEM1_AFEM1_ASEM1_CLR1_CADS0_DTLA0_DTLB0_DTVA0_DTVB0_DTVMXSA0_DTVMXSB0_DTVSM0_DPLB0_EPS1_ELFLR0_EMLL0_FDSI0_GRPM1_GRVWA2_GRVWB4_GSU0_GSUAMB_GSUC0_GSUWGMRR0_GLS0_ISA950_IU1_K1_LDSTI0_LBSPPA0_LBSPPB128_LBSPPM0_LPA0_LPB8_LPM0_LRVWn1_LWPMn1_MIAV0_MIWT12_5_MO40_MGRIPM1_NTn1_NTA0_NTB0_NTC4_NTD4_NTM0_NEPBS0_NLCA3_NLCB1_ONLL1_PGR1_PLR1_PKA1_SGROB0_SIA3_SS1_SU0_SUM0_SUS0_SPO0_SRVW0_SSO1_SVW4_SK3_SKFTR0_SKXCCM0_SGRO0_TDMI0_TIN1_TLDS1_TLDSMn1_ULSGRO0_USL1_UIOFGRO0_UPLRP0_USFGRO1_VSn1_VWA4_VWB1_WSGRA2_WSGRB2_WS64_WG32_8_1_WGMn1_WGMXCC8_WGMXCCGn1
    SolutionIndex: 321
    SolutionNameMin: Cijk_Ailk_Bljk_S_B_Bias_HA_S_SAV_UserArgs_MT256x256x32_MI16x16x1_SN_LDSB0_AFC0_AG1_AFEM1_AFEM1_ASEM1_CLR1_CADS0_DTLA0_DTLB0_DTVA0_DTVB0_DTVMXSA0_DTVMXSB0_DTVSM0_DPLB0_EPS0_ELFLR0_EMLLn1_FDSI0_GRPM1_GRVWA4_GRVWB4_GSU0_GSUAMB_GSUC0_GSUWGMRR0_GLS0_ISA950_IU1_K1_LDSTI0_LBSPPA0_LBSPPB512_LBSPPM0_LPA0_LPB8_LPM0_LRVWn1_LWPMn1_MIAV0_MIWT8_8_MO40_MGRIPM1_NTn1_NTA0_NTB0_NTC4_NTD4_NTM0_NEPBS16_NLCA1_NLCB1_ONLL1_PGR2_PLR1_PKA1_SGROB0_SIA3_SS1_SU0_SUM0_SUS0_SPO1_SRVW0_SSO1_SVW4_SK3_SKFTR0_SKXCCM8_SGRO0_TDMI0_TIN1_TLDS1_TLDSMn1_ULSGRO0_USL1_UIOFGRO0_UPLRP0_USFGRO1_VSn1_VWA4_VWB4_WSGRA0_WSGRB0_WS64_WG32_8_1_WGMn1_WGMXCC1_WGMXCCGn1
    SolutionIndex: 322
    SolutionNameMin: Cijk_Ailk_Bljk_S_B_Bias_HA_S_SAV_UserArgs_MT416x128x32_MI16x16x1_SN_LDSB1_AFC0_AG0_AFEM1_AFEM1_ASEM1_CLR1_CADS0_DTLA0_DTLB0_DTVA0_DTVB0_DTVMXSA0_DTVMXSB0_DTVSM0_DPLB0_EPS0_ELFLR0_EMLLn1_FDSI0_GRPM1_GRVWA4_GRVWB4_GSU0_GSUAMB_GSUC0_GSUWGMRR0_GLS0_ISA950_IU1_K1_LDSTI0_LBSPPA6656_LBSPPB512_LBSPPM0_LPA16_LPB8_LPM0_LRVWn1_LWPMn1_MIAV0_MIWT13_4_MO40_MGRIPM1_NTn1_NTA0_NTB0_NTC0_NTD0_NTM0_NEPBS10_NLCA13_NLCB1_ONLL1_PGR2_PLR1_PKA1_SGROB0_SIA3_SS1_SU0_SUM0_SUS0_SPO1_SRVW0_SSO4_SVW1_SK3_SKFTR0_SKXCCM0_SGRO0_TDMI0_TIN1_TLDS1_TLDSMn1_ULSGRO0_USL1_UIOFGRO0_UPLRP0_USFGRO0_VSn1_VWA1_VWB4_WSGRA0_WSGRB2_WS64_WG32_8_1_WGM2_WGMXCC1_WGMXCCGn1
    SolutionIndex: 323
    SolutionNameMin: Cijk_Ailk_Bljk_S_B_Bias_HA_S_SAV_UserArgs_MT256x256x32_MI16x16x1_SN_LDSB0_AFC0_AG1_AFEM1_AFEM1_ASEM1_CLR1_CADS0_DTLA0_DTLB0_DTVA0_DTVB0_DTVMXSA0_DTVMXSB0_DTVSM0_DPLB0_EPS0_ELFLR0_EMLL0_FDSI0_GRPM1_GRVWA4_GRVWB4_GSU0_GSUAMB_GSUC0_GSUWGMRR0_GLS0_ISA950_IU1_K1_LDSTI0_LBSPPA0_LBSPPB512_LBSPPM0_LPA0_LPB8_LPM0_LRVWn1_LWPMn1_MIAV0_MIWT8_8_MO40_MGRIPM1_NTn1_NTA0_NTB0_NTC4_NTD4_NTM0_NEPBS14_NLCA1_NLCB1_ONLL1_PGR2_PLR1_PKA1_SGROB0_SIA3_SS1_SU0_SUM0_SUS0_SPO1_SRVW0_SSO1_SVW4_SK3_SKFTR0_SKXCCM0_SGRO0_TDMI0_TIN1_TLDS1_TLDSMn1_ULSGRO0_USL1_UIOFGRO0_UPLRP0_USFGRO1_VSn1_VWA4_VWB4_WSGRA0_WSGRB0_WS64_WG32_8_1_WGMn2_WGMXCC1_WGMXCCGn1
    SolutionIndex: 324
    SolutionNameMin: Cijk_Ailk_Bljk_S_B_Bias_HA_S_SAV_UserArgs_MT192x320x32_MI16x16x1_SN_LDSB1_AFC0_AG0_AFEM1_AFEM1_ASEM1_CLR1_CADS0_DTLA0_DTLB0_DTVA0_DTVB0_DTVMXSA0_DTVMXSB0_DTVSM0_DPLB0_EPS0_ELFLR0_EMLLn1_FDSI0_GRPM1_GRVWA4_GRVWB4_GSU0_GSUAMB_GSUC0_GSUWGMRR0_GLS0_ISA950_IU1_K1_LDSTI0_LBSPPA0_LBSPPB128_LBSPPM0_LPA0_LPB8_LPM0_LRVWn1_LWPMn1_MIAV0_MIWT12_5_MO40_MGRIPM1_NTn1_NTA0_NTB0_NTC0_NTD0_NTM0_NEPBS0_NLCA3_NLCB1_ONLL1_PGR2_PLR1_PKA1_SGROB0_SIA3_SS1_SU0_SUM0_SUS0_SPO1_SRVW0_SSO1_SVW4_SK3_SKFTR0_SKXCCM8_SGRO0_TDMI0_TIN1_TLDS1_TLDSMn1_ULSGRO0_USL1_UIOFGRO0_UPLRP0_USFGRO0_VSn1_VWA4_VWB1_WSGRA2_WSGRB2_WS64_WG16_16_1_WGM32_WGMXCC16_WGMXCCGn1
    SolutionIndex: 325
    SolutionNameMin: Cijk_Ailk_Bljk_S_B_Bias_HA_S_SAV_UserArgs_MT256x256x32_MI16x16x1_SN_LDSB0_AFC0_AG0_AFEM1_AFEM1_ASEM1_CLR1_CADS0_DTLA0_DTLB0_DTVA0_DTVB0_DTVMXSA0_DTVMXSB0_DTVSM0_DPLB0_EPS0_ELFLR0_EMLL0_FDSI0_GRPM1_GRVWA4_GRVWB4_GSU0_GSUAMB_GSUC0_GSUWGMRR0_GLS0_ISA950_IU1_K1_LDSTI0_LBSPPA0_LBSPPB512_LBSPPM0_LPA0_LPB8_LPM0_LRVWn1_LWPMn1_MIAV0_MIWT4_16_MO40_MGRIPM1_NTn1_NTA0_NTB0_NTC4_NTD4_NTM0_NEPBS16_NLCA1_NLCB1_ONLL1_PGR2_PLR1_PKA1_SGROB0_SIA3_SS1_SU0_SUM0_SUS0_SPO1_SRVW0_SSO1_SVW4_SK3_SKFTR0_SKXCCM4_SGRO0_TDMI0_TIN1_TLDS1_TLDSMn1_ULSGRO1_USL1_UIOFGRO0_UPLRP0_USFGRO1_VSn1_VWA4_VWB4_WSGRA2_WSGRB0_WS64_WG64_4_1_WGM8_WGMXCC2_WGMXCCGn1
    SolutionIndex: 326
    SolutionNameMin: Cijk_Ailk_Bljk_S_B_Bias_HA_S_SAV_UserArgs_MT352x128x32_MI16x16x1_SN_LDSB1_AFC0_AG1_AFEM1_AFEM1_ASEM1_CLR1_CADS0_DTLA0_DTLB0_DTVA0_DTVB0_DTVMXSA0_DTVMXSB0_DTVSM0_DPLB0_EPS0_ELFLR0_EMLL0_FDSI0_GRPM1_GRVWA4_GRVWB4_GSU0_GSUAMB_GSUC0_GSUWGMRR0_GLS0_ISA950_IU1_K1_LDSTI0_LBSPPA5632_LBSPPB512_LBSPPM0_LPA16_LPB8_LPM0_LRVWn1_LWPMn1_MIAV0_MIWT11_4_MO40_MGRIPM1_NTn1_NTA4_NTB0_NTC0_NTD4_NTM0_NEPBS0_NLCA11_NLCB1_ONLL1_PGR2_PLR1_PKA1_SGROB0_SIA3_SS1_SU0_SUM0_SUS0_SPO1_SRVW0_SSO4_SVW1_SK3_SKFTR0_SKXCCM0_SGRO0_TDMI0_TIN1_TLDS1_TLDSMn1_ULSGRO1_USL1_UIOFGRO0_UPLRP0_USFGRO0_VSn1_VWA1_VWB4_WSGRA2_WSGRB0_WS64_WG32_8_1_WGMn48_WGMXCC2_WGMXCCGn1
    SolutionIndex: 327
    SolutionNameMin: Cijk_Ailk_Bljk_S_B_Bias_HA_S_SAV_UserArgs_MT128x416x32_MI16x16x1_SN_LDSB1_AFC0_AG1_AFEM1_AFEM1_ASEM1_CLR1_CADS0_DTLA0_DTLB0_DTVA0_DTVB0_DTVMXSA0_DTVMXSB0_DTVSM0_DPLB0_EPS0_ELFLR0_EMLLn1_FDSI0_GRPM1_GRVWA4_GRVWB4_GSU0_GSUAMB_GSUC0_GSUWGMRR0_GLS0_ISA950_IU1_K1_LDSTI0_LBSPPA0_LBSPPB128_LBSPPM0_LPA0_LPB8_LPM0_LRVWn1_LWPMn1_MIAV0_MIWT4_13_MO40_MGRIPM1_NTn1_NTA0_NTB0_NTC4_NTD4_NTM0_NEPBS0_NLCA1_NLCB1_ONLL1_PGR2_PLR1_PKA1_SGROB0_SIA3_SS1_SU16_SUM0_SUS128_SPO0_SRVW0_SSO1_SVW4_SK3_SKFTR0_SKXCCM4_SGRO0_TDMI0_TIN0_TLDS1_TLDSMn1_ULSGRO0_USL1_UIOFGRO0_UPLRP0_USFGRO0_VSn1_VWA4_VWB1_WSGRA0_WSGRB2_WS64_WG32_8_1_WGM8_WGMXCC1_WGMXCCGn1
    SolutionIndex: 328
    SolutionNameMin: Cijk_Ailk_Bljk_S_B_Bias_HA_S_SAV_UserArgs_MT256x192x32_MI16x16x1_SN_LDSB1_AFC0_AG1_AFEM1_AFEM1_ASEM1_CLR1_CADS0_DTLA0_DTLB0_DTVA0_DTVB0_DTVMXSA0_DTVMXSB0_DTVSM0_DPLB0_EPS0_ELFLR0_EMLLn1_FDSI0_GRPM1_GRVWA4_GRVWB4_GSU0_GSUAMB_GSUC0_GSUWGMRR0_GLS0_ISA950_IU1_K1_LDSTI0_LBSPPA0_LBSPPB256_LBSPPM0_LPA0_LPB8_LPM0_LRVWn1_LWPMn1_MIAV0_MIWT8_6_MO40_MGRIPM1_NTn1_NTA0_NTB0_NTC4_NTD4_NTM0_NEPBS12_NLCA1_NLCB1_ONLL1_PGR2_PLR1_PKA1_SGROB0_SIA3_SS1_SU0_SUM0_SUS0_SPO0_SRVW0_SSO1_SVW4_SK3_SKFTR0_SKXCCM8_SGRO0_TDMI0_TIN1_TLDS1_TLDSMn1_ULSGRO0_USL1_UIOFGRO0_UPLRP0_USFGRO0_VSn1_VWA4_VWB2_WSGRA0_WSGRB0_WS64_WG32_8_1_WGMn48_WGMXCC1_WGMXCCGn1
    SolutionIndex: 329
    SolutionNameMin: Cijk_Ailk_Bljk_S_B_Bias_HA_S_SAV_UserArgs_MT256x256x32_MI32x32x1_SN_LDSB0_AFC0_AG0_AFEM1_AFEM1_ASEM1_CLR1_CADS0_DTLA0_DTLB0_DTVA0_DTVB0_DTVMXSA0_DTVMXSB0_DTVSM0_DPLB0_EPS0_ELFLR0_EMLLn1_FDSI0_GRPM1_GRVWA4_GRVWB4_GSU0_GSUAMB_GSUC0_GSUWGMRR0_GLS0_ISA950_IU1_K1_LDSTI0_LBSPPA0_LBSPPB512_LBSPPM0_LPA0_LPB4_LPM0_LRVWn1_LWPMn1_MIAV0_MIWT4_4_MO40_MGRIPM1_NTn1_NTA0_NTB0_NTC0_NTD0_NTM0_NEPBS0_NLCA1_NLCB1_ONLL1_PGR2_PLR1_PKA1_SGROB0_SIA3_SS1_SU0_SUM0_SUS0_SPO1_SRVW0_SSO1_SVW4_SK3_SKFTR0_SKXCCM4_SGRO0_TDMI0_TIN1_TLDS1_TLDSMn1_ULSGRO1_USL1_UIOFGRO0_UPLRP0_USFGRO0_VSn1_VWA4_VWB4_WSGRA2_WSGRB0_WS64_WG64_4_1_WGM6_WGMXCC1_WGMXCCGn1
    SolutionIndex: 330
    SolutionNameMin: Cijk_Ailk_Bljk_S_B_Bias_HA_S_SAV_UserArgs_MT384x112x32_MI16x16x1_SN_LDSB1_AFC0_AG0_AFEM1_AFEM1_ASEM1_CLR1_CADS0_DTLA0_DTLB0_DTVA0_DTVB0_DTVMXSA0_DTVMXSB0_DTVSM0_DPLB0_EPS0_ELFLR0_EMLLn1_FDSI0_GRPM1_GRVWA4_GRVWB2_GSU0_GSUAMB_GSUC0_GSUWGMRR0_GLS0_ISA950_IU1_K1_LDSTI0_LBSPPA0_LBSPPB128_LBSPPM0_LPA0_LPB8_LPM0_LRVWn1_LWPMn1_MIAV0_MIWT6_7_MO40_MGRIPM1_NTn1_NTA4_NTB0_NTC0_NTD4_NTM0_NEPBS12_NLCA3_NLCB1_ONLL1_PGR2_PLR1_PKA1_SGROB0_SIA3_SS1_SU0_SUM0_SUS0_SPO0_SRVW0_SSO0_SVW2_SK3_SKFTR0_SKXCCM0_SGRO0_TDMI0_TIN1_TLDS1_TLDSMn1_ULSGRO0_USL1_UIOFGRO0_UPLRP0_USFGRO0_VSn1_VWA2_VWB1_WSGRA2_WSGRB0_WS64_WG64_4_1_WGMn8_WGMXCC16_WGMXCCGn1
    SolutionIndex: 331
    SolutionNameMin: Cijk_Ailk_Bljk_S_B_Bias_HA_S_SAV_UserArgs_MT512x128x32_MI32x32x1_SN_LDSB1_AFC0_AG1_AFEM1_AFEM1_ASEM1_CLR1_CADS0_DTLA0_DTLB0_DTVA0_DTVB0_DTVMXSA0_DTVMXSB0_DTVSM0_DPLB0_EPS0_ELFLR0_EMLLn1_FDSI0_GRPM1_GRVWA4_GRVWB4_GSU0_GSUAMB_GSUC0_GSUWGMRR0_GLS0_ISA950_IU1_K1_LDSTI0_LBSPPA0_LBSPPB512_LBSPPM0_LPA0_LPB4_LPM0_LRVWn1_LWPMn1_MIAV0_MIWT4_4_MO40_MGRIPM1_NTn1_NTA0_NTB0_NTC0_NTD0_NTM0_NEPBS0_NLCA1_NLCB1_ONLL1_PGR2_PLR1_PKA1_SGROB0_SIA3_SS1_SU8_SUM0_SUS128_SPO1_SRVW0_SSO1_SVW4_SK3_SKFTR0_SKXCCM0_SGRO0_TDMI0_TIN0_TLDS1_TLDSMn1_ULSGRO0_USL1_UIOFGRO0_UPLRP0_USFGRO0_VSn1_VWA4_VWB4_WSGRA0_WSGRB0_WS64_WG128_2_1_WGM6_WGMXCC4_WGMXCCGn1
    SolutionIndex: 332
    SolutionNameMin: Cijk_Ailk_Bljk_S_B_Bias_HA_S_SAV_UserArgs_MT256x256x32_MI16x16x1_SN_LDSB1_AFC0_AG0_AFEM1_AFEM1_ASEM1_CLR1_CADS0_DTLA0_DTLB0_DTVA0_DTVB0_DTVMXSA0_DTVMXSB0_DTVSM0_DPLB0_EPS0_ELFLR0_EMLL0_FDSI0_GRPM1_GRVWA2_GRVWB4_GSU0_GSUAMB_GSUC0_GSUWGMRR0_GLS0_ISA950_IU1_K1_LDSTI0_LBSPPA0_LBSPPB512_LBSPPM0_LPA0_LPB8_LPM0_LRVWn1_LWPMn1_MIAV0_MIWT8_8_MO40_MGRIPM1_NTn1_NTA0_NTB0_NTC4_NTD4_NTM0_NEPBS16_NLCA1_NLCB1_ONLL1_PGR2_PLR1_PKA1_SGROB0_SIA3_SS1_SU0_SUM0_SUS0_SPO0_SRVW0_SSO1_SVW4_SK3_SKFTR0_SKXCCM0_SGRO0_TDMI0_TIN1_TLDS1_TLDSMn1_ULSGRO0_USL1_UIOFGRO0_UPLRP0_USFGRO1_VSn1_VWA4_VWB4_WSGRA0_WSGRB0_WS64_WG32_8_1_WGM4_WGMXCC8_WGMXCCGn1
    SolutionIndex: 333
    SolutionNameMin: Cijk_Ailk_Bljk_S_B_Bias_HA_S_SAV_UserArgs_MT512x128x32_MI32x32x1_SN_LDSB1_AFC0_AG0_AFEM1_AFEM1_ASEM1_CLR1_CADS0_DTLA0_DTLB0_DTVA0_DTVB0_DTVMXSA0_DTVMXSB0_DTVSM0_DPLB0_EPS0_ELFLR0_EMLL0_FDSI0_GRPM1_GRVWA4_GRVWB4_GSU0_GSUAMB_GSUC0_GSUWGMRR0_GLS0_ISA950_IU1_K1_LDSTI0_LBSPPA0_LBSPPB512_LBSPPM0_LPA0_LPB4_LPM0_LRVWn1_LWPMn1_MIAV0_MIWT4_4_MO40_MGRIPM1_NTn1_NTA0_NTB0_NTC0_NTD0_NTM0_NEPBS0_NLCA2_NLCB1_ONLL1_PGR2_PLR1_PKA1_SGROB0_SIA3_SS1_SU0_SUM0_SUS0_SPO1_SRVW0_SSO1_SVW4_SK3_SKFTR0_SKXCCM4_SGRO0_TDMI0_TIN1_TLDS1_TLDSMn1_ULSGRO0_USL1_UIOFGRO0_UPLRP0_USFGRO0_VSn1_VWA4_VWB4_WSGRA2_WSGRB2_WS64_WG128_2_1_WGM2_WGMXCC1_WGMXCCGn1
    SolutionIndex: 334
    SolutionNameMin: Cijk_Ailk_Bljk_S_B_Bias_HA_S_SAV_UserArgs_MT128x416x32_MI16x16x1_SN_LDSB1_AFC0_AG0_AFEM1_AFEM1_ASEM1_CLR1_CADS0_DTLA0_DTLB0_DTVA0_DTVB0_DTVMXSA0_DTVMXSB0_DTVSM0_DPLB0_EPS0_ELFLR0_EMLLn1_FDSI0_GRPM1_GRVWA4_GRVWB4_GSU0_GSUAMB_GSUC0_GSUWGMRR0_GLS0_ISA950_IU1_K1_LDSTI0_LBSPPA0_LBSPPB128_LBSPPM0_LPA0_LPB8_LPM0_LRVWn1_LWPMn1_MIAV0_MIWT4_13_MO40_MGRIPM1_NTn1_NTA0_NTB0_NTC4_NTD4_NTM0_NEPBS0_NLCA1_NLCB1_ONLL1_PGR2_PLR1_PKA1_SGROB0_SIA3_SS1_SU0_SUM0_SUS0_SPO0_SRVW0_SSO1_SVW4_SK3_SKFTR0_SKXCCM0_SGRO0_TDMI0_TIN1_TLDS1_TLDSMn1_ULSGRO0_USL1_UIOFGRO0_UPLRP0_USFGRO1_VSn1_VWA4_VWB1_WSGRA0_WSGRB2_WS64_WG32_8_1_WGM6_WGMXCC2_WGMXCCGn1
    SolutionIndex: 335
    SolutionNameMin: Cijk_Ailk_Bljk_S_B_Bias_HA_S_SAV_UserArgs_MT256x240x32_MI16x16x1_SN_LDSB1_AFC0_AG1_AFEM1_AFEM1_ASEM1_CLR1_CADS0_DTLA0_DTLB0_DTVA0_DTVB0_DTVMXSA0_DTVMXSB0_DTVSM0_DPLB0_EPS0_ELFLR0_EMLLn1_FDSI0_GRPM1_GRVWA4_GRVWB2_GSU0_GSUAMB_GSUC0_GSUWGMRR0_GLS0_ISA950_IU1_K1_LDSTI0_LBSPPA0_LBSPPB128_LBSPPM0_LPA0_LPB8_LPM0_LRVWn1_LWPMn1_MIAV0_MIWT4_15_MO40_MGRIPM1_NTn1_NTA0_NTB0_NTC0_NTD0_NTM0_NEPBS12_NLCA1_NLCB1_ONLL1_PGR2_PLR1_PKA1_SGROB0_SIA3_SS1_SU0_SUM0_SUS0_SPO1_SRVW0_SSO1_SVW4_SK3_SKFTR0_SKXCCM0_SGRO0_TDMI0_TIN1_TLDS1_TLDSMn1_ULSGRO0_USL1_UIOFGRO0_UPLRP0_USFGRO1_VSn1_VWA4_VWB1_WSGRA2_WSGRB2_WS64_WG64_4_1_WGM8_WGMXCC1_WGMXCCGn1
    SolutionIndex: 336
    SolutionNameMin: Cijk_Ailk_Bljk_S_B_Bias_HA_S_SAV_UserArgs_MT256x224x32_MI16x16x1_SN_LDSB1_AFC0_AG0_AFEM1_AFEM1_ASEM1_CLR1_CADS0_DTLA0_DTLB0_DTVA0_DTVB0_DTVMXSA0_DTVMXSB0_DTVSM0_DPLB0_EPS0_ELFLR0_EMLLn1_FDSI0_GRPM1_GRVWA4_GRVWB4_GSU0_GSUAMB_GSUC0_GSUWGMRR0_GLS0_ISA950_IU1_K1_LDSTI0_LBSPPA0_LBSPPB256_LBSPPM0_LPA0_LPB8_LPM0_LRVWn1_LWPMn1_MIAV0_MIWT4_14_MO40_MGRIPM1_NTn1_NTA0_NTB0_NTC0_NTD0_NTM0_NEPBS0_NLCA1_NLCB1_ONLL1_PGR2_PLR1_PKA1_SGROB0_SIA3_SS1_SU0_SUM0_SUS0_SPO0_SRVW0_SSO1_SVW4_SK3_SKFTR0_SKXCCM0_SGRO0_TDMI0_TIN1_TLDS1_TLDSMn1_ULSGRO1_USL1_UIOFGRO0_UPLRP0_USFGRO1_VSn1_VWA4_VWB2_WSGRA2_WSGRB2_WS64_WG64_4_1_WGM4_WGMXCC2_WGMXCCGn1
    SolutionIndex: 337
    SolutionNameMin: Cijk_Ailk_Bljk_S_B_Bias_HA_S_SAV_UserArgs_MT144x448x32_MI16x16x1_SN_LDSB1_AFC0_AG1_AFEM1_AFEM1_ASEM1_CLR1_CADS0_DTLA0_DTLB0_DTVA0_DTVB0_DTVMXSA0_DTVMXSB0_DTVSM0_DPLB0_EPS0_ELFLR0_EMLLn1_FDSI0_GRPM1_GRVWA1_GRVWB4_GSU0_GSUAMB_GSUC0_GSUWGMRR0_GLS0_ISA950_IU1_K1_LDSTI0_LBSPPA2304_LBSPPB128_LBSPPM0_LPA16_LPB8_LPM0_LRVWn1_LWPMn1_MIAV0_MIWT9_7_MO40_MGRIPM1_NTn1_NTA0_NTB0_NTC0_NTD0_NTM0_NEPBS0_NLCA9_NLCB1_ONLL1_PGR2_PLR1_PKA1_SGROB0_SIA3_SS1_SU0_SUM0_SUS0_SPO1_SRVW0_SSO1_SVW1_SK3_SKFTR0_SKXCCM8_SGRO0_TDMI0_TIN1_TLDS1_TLDSMn1_ULSGRO0_USL1_UIOFGRO0_UPLRP0_USFGRO0_VSn1_VWA1_VWB1_WSGRA0_WSGRB2_WS64_WG16_16_1_WGMn1_WGMXCC1_WGMXCCGn1
    SolutionIndex: 338
    SolutionNameMin: Cijk_Ailk_Bljk_S_B_Bias_HA_S_SAV_UserArgs_MT128x416x32_MI16x16x1_SN_LDSB1_AFC0_AG1_AFEM1_AFEM1_ASEM1_CLR1_CADS0_DTLA0_DTLB0_DTVA0_DTVB0_DTVMXSA0_DTVMXSB0_DTVSM0_DPLB0_EPS0_ELFLR0_EMLLn1_FDSI0_GRPM1_GRVWA4_GRVWB4_GSU0_GSUAMB_GSUC0_GSUWGMRR0_GLS0_ISA950_IU1_K1_LDSTI0_LBSPPA0_LBSPPB128_LBSPPM0_LPA0_LPB8_LPM0_LRVWn1_LWPMn1_MIAV0_MIWT4_13_MO40_MGRIPM1_NTn1_NTA0_NTB0_NTC0_NTD0_NTM0_NEPBS14_NLCA1_NLCB1_ONLL1_PGR2_PLR1_PKA1_SGROB0_SIA3_SS1_SU0_SUM0_SUS0_SPO1_SRVW0_SSO1_SVW4_SK3_SKFTR0_SKXCCM8_SGRO0_TDMI0_TIN1_TLDS1_TLDSMn1_ULSGRO0_USL1_UIOFGRO0_UPLRP0_USFGRO1_VSn1_VWA4_VWB1_WSGRA0_WSGRB0_WS64_WG32_8_1_WGMn1_WGMXCC1_WGMXCCGn1
    SolutionIndex: 339
    SolutionNameMin: Cijk_Ailk_Bljk_S_B_Bias_HA_S_SAV_UserArgs_MT256x256x32_MI16x16x1_SN_LDSB1_AFC0_AG0_AFEM1_AFEM1_ASEM1_CLR1_CADS0_DTLA0_DTLB0_DTVA0_DTVB0_DTVMXSA0_DTVMXSB0_DTVSM0_DPLB0_EPS1_ELFLR0_EMLL0_FDSI0_GRPM1_GRVWA4_GRVWB4_GSU0_GSUAMB_GSUC0_GSUWGMRR0_GLS0_ISA950_IU1_K1_LDSTI0_LBSPPA0_LBSPPB512_LBSPPM0_LPA0_LPB8_LPM0_LRVWn1_LWPMn1_MIAV0_MIWT4_16_MO40_MGRIPM1_NTn1_NTA0_NTB0_NTC4_NTD4_NTM0_NEPBS16_NLCA1_NLCB1_ONLL1_PGR1_PLR1_PKA1_SGROB0_SIA3_SS1_SU0_SUM0_SUS0_SPO0_SRVW0_SSO1_SVW4_SK3_SKFTR0_SKXCCM0_SGRO0_TDMI0_TIN1_TLDS1_TLDSMn1_ULSGRO0_USL1_UIOFGRO0_UPLRP0_USFGRO1_VSn1_VWA4_VWB4_WSGRA2_WSGRB2_WS64_WG64_4_1_WGMn48_WGMXCC32_WGMXCCGn1
    SolutionIndex: 340
    SolutionNameMin: Cijk_Ailk_Bljk_S_B_Bias_HA_S_SAV_UserArgs_MT512x128x32_MI16x16x1_SN_LDSB1_AFC0_AG0_AFEM1_AFEM1_ASEM1_CLR1_CADS0_DTLA0_DTLB0_DTVA0_DTVB0_DTVMXSA0_DTVMXSB0_DTVSM0_DPLB0_EPS0_ELFLR0_EMLLn1_FDSI0_GRPM1_GRVWA4_GRVWB4_GSU0_GSUAMB_GSUC0_GSUWGMRR0_GLS0_ISA950_IU1_K1_LDSTI0_LBSPPA0_LBSPPB512_LBSPPM0_LPA0_LPB8_LPM0_LRVWn1_LWPMn1_MIAV0_MIWT8_8_MO40_MGRIPM1_NTn1_NTA0_NTB0_NTC0_NTD0_NTM0_NEPBS0_NLCA2_NLCB1_ONLL1_PGR2_PLR1_PKA1_SGROB0_SIA3_SS1_SU0_SUM0_SUS0_SPO1_SRVW0_SSO1_SVW4_SK3_SKFTR0_SKXCCM4_SGRO0_TDMI0_TIN1_TLDS1_TLDSMn1_ULSGRO0_USL1_UIOFGRO0_UPLRP0_USFGRO0_VSn1_VWA4_VWB4_WSGRA2_WSGRB0_WS64_WG64_4_1_WGM4_WGMXCC1_WGMXCCGn1
    SolutionIndex: 341
    SolutionNameMin: Cijk_Ailk_Bljk_S_B_Bias_HA_S_SAV_UserArgs_MT144x448x32_MI16x16x1_SN_LDSB1_AFC0_AG0_AFEM1_AFEM1_ASEM1_CLR1_CADS0_DTLA0_DTLB0_DTVA0_DTVB0_DTVMXSA0_DTVMXSB0_DTVSM0_DPLB0_EPS0_ELFLR0_EMLLn1_FDSI0_GRPM1_GRVWA2_GRVWB4_GSU0_GSUAMB_GSUC0_GSUWGMRR0_GLS0_ISA950_IU1_K1_LDSTI0_LBSPPA2304_LBSPPB128_LBSPPM0_LPA16_LPB8_LPM0_LRVWn1_LWPMn1_MIAV0_MIWT9_7_MO40_MGRIPM1_NTn1_NTA0_NTB0_NTC0_NTD0_NTM0_NEPBS0_NLCA9_NLCB1_ONLL1_PGR2_PLR1_PKA1_SGROB0_SIA3_SS1_SU0_SUM0_SUS0_SPO1_SRVW0_SSO1_SVW1_SK3_SKFTR0_SKXCCM4_SGRO0_TDMI0_TIN1_TLDS1_TLDSMn1_ULSGRO0_USL1_UIOFGRO0_UPLRP0_USFGRO1_VSn1_VWA1_VWB1_WSGRA0_WSGRB0_WS64_WG16_16_1_WGM2_WGMXCC1_WGMXCCGn1
    SolutionIndex: 342
    SolutionNameMin: Cijk_Ailk_Bljk_S_B_Bias_HA_S_SAV_UserArgs_MT256x224x32_MI16x16x1_SN_LDSB1_AFC0_AG1_AFEM1_AFEM1_ASEM1_CLR1_CADS0_DTLA0_DTLB0_DTVA0_DTVB0_DTVMXSA0_DTVMXSB0_DTVSM0_DPLB0_EPS0_ELFLR0_EMLL0_FDSI0_GRPM1_GRVWA4_GRVWB4_GSU0_GSUAMB_GSUC0_GSUWGMRR0_GLS0_ISA950_IU1_K1_LDSTI0_LBSPPA0_LBSPPB256_LBSPPM0_LPA0_LPB8_LPM0_LRVWn1_LWPMn1_MIAV0_MIWT4_14_MO40_MGRIPM1_NTn1_NTA0_NTB0_NTC0_NTD0_NTM0_NEPBS0_NLCA1_NLCB1_ONLL1_PGR2_PLR1_PKA1_SGROB0_SIA3_SS1_SU0_SUM0_SUS0_SPO0_SRVW0_SSO1_SVW4_SK3_SKFTR0_SKXCCM4_SGRO0_TDMI0_TIN1_TLDS1_TLDSMn1_ULSGRO0_USL1_UIOFGRO0_UPLRP0_USFGRO1_VSn1_VWA4_VWB2_WSGRA2_WSGRB2_WS64_WG64_4_1_WGM2_WGMXCC1_WGMXCCGn1
    SolutionIndex: 343
    SolutionNameMin: Cijk_Ailk_Bljk_S_B_Bias_HA_S_SAV_UserArgs_MT256x224x32_MI16x16x1_SN_LDSB1_AFC0_AG0_AFEM1_AFEM1_ASEM1_CLR1_CADS0_DTLA0_DTLB0_DTVA0_DTVB0_DTVMXSA0_DTVMXSB0_DTVSM0_DPLB0_EPS0_ELFLR0_EMLLn1_FDSI0_GRPM1_GRVWA4_GRVWB4_GSU0_GSUAMB_GSUC0_GSUWGMRR0_GLS0_ISA950_IU1_K1_LDSTI0_LBSPPA0_LBSPPB128_LBSPPM0_LPA0_LPB8_LPM0_LRVWn1_LWPMn1_MIAV0_MIWT8_7_MO40_MGRIPM1_NTn1_NTA0_NTB0_NTC4_NTD4_NTM0_NEPBS0_NLCA1_NLCB1_ONLL1_PGR2_PLR1_PKA1_SGROB0_SIA3_SS1_SU0_SUM0_SUS0_SPO1_SRVW0_SSO1_SVW4_SK3_SKFTR0_SKXCCM8_SGRO0_TDMI0_TIN1_TLDS1_TLDSMn1_ULSGRO0_USL1_UIOFGRO0_UPLRP0_USFGRO1_VSn1_VWA4_VWB1_WSGRA0_WSGRB0_WS64_WG32_8_1_WGM32_WGMXCC32_WGMXCCGn1
    SolutionIndex: 344
    SolutionNameMin: Cijk_Ailk_Bljk_S_B_Bias_HA_S_SAV_UserArgs_MT512x128x32_MI32x32x1_SN_LDSB0_AFC0_AG1_AFEM1_AFEM1_ASEM1_CLR0_CADS0_DTLA0_DTLB0_DTVA0_DTVB0_DTVMXSA0_DTVMXSB0_DTVSM0_DPLB0_EPS0_ELFLR0_EMLLn1_FDSI0_GRPM1_GRVWA4_GRVWB4_GSU0_GSUAMB_GSUC0_GSUWGMRR0_GLS0_ISA950_IU1_K1_LDSTI1_LBSPPA0_LBSPPB0_LBSPPM0_LPA0_LPB0_LPM0_LRVWn1_LWPMn1_MIAV0_MIWT16_1_MO40_MGRIPM1_NTn1_NTA0_NTB0_NTC4_NTD4_NTM0_NEPBS0_NLCA2_NLCB1_ONLL1_PGR2_PLR1_PKA1_SGROB0_SIA3_SS1_SU0_SUM0_SUS0_SPO0_SRVW0_SSO1_SVW4_SK3_SKFTR0_SKXCCM8_SGRO0_TDMI0_TIN0_TLDS0_TLDSMn1_ULSGRO0_USL1_UIOFGRO0_UPLRP0_USFGRO0_VSn1_VWA4_VWB1_WSGRA2_WSGRB0_WS64_WG32_8_1_WGMn1_WGMXCC16_WGMXCCGn1
    SolutionIndex: 345
    SolutionNameMin: Cijk_Ailk_Bljk_S_B_Bias_HA_S_SAV_UserArgs_MT256x224x32_MI16x16x1_SN_LDSB1_AFC0_AG0_AFEM1_AFEM1_ASEM1_CLR1_CADS0_DTLA0_DTLB0_DTVA0_DTVB0_DTVMXSA0_DTVMXSB0_DTVSM0_DPLB0_EPS0_ELFLR0_EMLLn1_FDSI0_GRPM1_GRVWA4_GRVWB4_GSU0_GSUAMB_GSUC0_GSUWGMRR0_GLS0_ISA950_IU1_K1_LDSTI0_LBSPPA0_LBSPPB128_LBSPPM0_LPA0_LPB8_LPM0_LRVWn1_LWPMn1_MIAV0_MIWT8_7_MO40_MGRIPM1_NTn1_NTA0_NTB0_NTC4_NTD4_NTM0_NEPBS0_NLCA1_NLCB1_ONLL1_PGR2_PLR1_PKA1_SGROB0_SIA3_SS1_SU0_SUM0_SUS0_SPO0_SRVW0_SSO1_SVW4_SK3_SKFTR0_SKXCCM8_SGRO0_TDMI0_TIN1_TLDS1_TLDSMn1_ULSGRO0_USL1_UIOFGRO0_UPLRP0_USFGRO0_VSn1_VWA4_VWB1_WSGRA0_WSGRB0_WS64_WG32_8_1_WGM8_WGMXCC8_WGMXCCGn1
    SolutionIndex: 346
    SolutionNameMin: Cijk_Ailk_Bljk_S_B_Bias_HA_S_SAV_UserArgs_MT512x128x32_MI32x32x1_SN_LDSB1_AFC0_AG1_AFEM1_AFEM1_ASEM1_CLR1_CADS0_DTLA0_DTLB0_DTVA0_DTVB0_DTVMXSA0_DTVMXSB0_DTVSM0_DPLB0_EPS0_ELFLR0_EMLL0_FDSI0_GRPM1_GRVWA4_GRVWB4_GSU0_GSUAMB_GSUC0_GSUWGMRR0_GLS0_ISA950_IU1_K1_LDSTI0_LBSPPA0_LBSPPB512_LBSPPM0_LPA0_LPB4_LPM0_LRVWn1_LWPMn1_MIAV0_MIWT4_4_MO40_MGRIPM1_NTn1_NTA0_NTB0_NTC0_NTD0_NTM0_NEPBS0_NLCA2_NLCB1_ONLL1_PGR2_PLR1_PKA1_SGROB0_SIA3_SS1_SU0_SUM0_SUS0_SPO1_SRVW0_SSO1_SVW4_SK3_SKFTR0_SKXCCM0_SGRO0_TDMI0_TIN1_TLDS1_TLDSMn1_ULSGRO0_USL1_UIOFGRO0_UPLRP0_USFGRO1_VSn1_VWA4_VWB4_WSGRA2_WSGRB0_WS64_WG128_2_1_WGMn1_WGMXCC8_WGMXCCGn1
    SolutionIndex: 347
    SolutionNameMin: Cijk_Ailk_Bljk_S_B_Bias_HA_S_SAV_UserArgs_MT256x256x32_MI16x16x1_SN_LDSB1_AFC0_AG1_AFEM1_AFEM1_ASEM1_CLR1_CADS0_DTLA0_DTLB0_DTVA0_DTVB0_DTVMXSA0_DTVMXSB0_DTVSM0_DPLB0_EPS0_ELFLR0_EMLL0_FDSI0_GRPM1_GRVWA4_GRVWB4_GSU0_GSUAMB_GSUC0_GSUWGMRR0_GLS0_ISA950_IU1_K1_LDSTI0_LBSPPA0_LBSPPB512_LBSPPM0_LPA0_LPB8_LPM0_LRVWn1_LWPMn1_MIAV0_MIWT8_8_MO40_MGRIPM1_NTn1_NTA0_NTB0_NTC4_NTD4_NTM0_NEPBS14_NLCA1_NLCB1_ONLL1_PGR2_PLR1_PKA1_SGROB0_SIA3_SS1_SU0_SUM0_SUS0_SPO1_SRVW0_SSO1_SVW4_SK3_SKFTR0_SKXCCM4_SGRO0_TDMI0_TIN1_TLDS1_TLDSMn1_ULSGRO0_USL1_UIOFGRO0_UPLRP0_USFGRO1_VSn1_VWA4_VWB4_WSGRA0_WSGRB0_WS64_WG32_8_1_WGMn2_WGMXCC1_WGMXCCGn1
    SolutionIndex: 348
    SolutionNameMin: Cijk_Ailk_Bljk_S_B_Bias_HA_S_SAV_UserArgs_MT288x192x32_MI16x16x1_SN_LDSB1_AFC0_AG1_AFEM1_AFEM1_ASEM1_CLR1_CADS0_DTLA0_DTLB0_DTVA0_DTVB0_DTVMXSA0_DTVMXSB0_DTVSM0_DPLB0_EPS0_ELFLR0_EMLL0_FDSI0_GRPM1_GRVWA4_GRVWB4_GSU0_GSUAMB_GSUC0_GSUWGMRR0_GLS0_ISA950_IU1_K1_LDSTI0_LBSPPA0_LBSPPB128_LBSPPM0_LPA0_LPB8_LPM0_LRVWn1_LWPMn1_MIAV0_MIWT18_3_MO40_MGRIPM1_NTn1_NTA0_NTB0_NTC4_NTD4_NTM0_NEPBS0_NLCA9_NLCB1_ONLL1_PGR2_PLR1_PKA1_SGROB0_SIA3_SS1_SU0_SUM0_SUS0_SPO0_SRVW0_SSO1_SVW2_SK3_SKFTR0_SKXCCM4_SGRO0_TDMI0_TIN1_TLDS1_TLDSMn1_ULSGRO0_USL1_UIOFGRO0_UPLRP0_USFGRO1_VSn1_VWA2_VWB1_WSGRA0_WSGRB2_WS64_WG16_16_1_WGM4_WGMXCC32_WGMXCCGn1
    SolutionIndex: 349
    SolutionNameMin: Cijk_Ailk_Bljk_S_B_Bias_HA_S_SAV_UserArgs_MT256x256x32_MI32x32x1_SN_LDSB1_AFC0_AG1_AFEM1_AFEM1_ASEM1_CLR1_CADS0_DTLA0_DTLB0_DTVA0_DTVB0_DTVMXSA0_DTVMXSB0_DTVSM0_DPLB0_EPS1_ELFLR0_EMLL0_FDSI0_GRPM1_GRVWA4_GRVWB4_GSU0_GSUAMB_GSUC0_GSUWGMRR0_GLS0_ISA950_IU1_K1_LDSTI0_LBSPPA0_LBSPPB256_LBSPPM0_LPA0_LPB4_LPM0_LRVWn1_LWPMn1_MIAV0_MIWT8_2_MO40_MGRIPM1_NTn1_NTA0_NTB0_NTC0_NTD0_NTM0_NEPBS0_NLCA1_NLCB1_ONLL1_PGR1_PLR1_PKA1_SGROB0_SIA3_SS1_SU0_SUM0_SUS0_SPO1_SRVW0_SSO1_SVW4_SK3_SKFTR0_SKXCCM0_SGRO0_TDMI0_TIN1_TLDS1_TLDSMn1_ULSGRO0_USL1_UIOFGRO0_UPLRP0_USFGRO1_VSn1_VWA4_VWB2_WSGRA0_WSGRB0_WS64_WG32_8_1_WGM4_WGMXCC2_WGMXCCGn1
    SolutionIndex: 350
    SolutionNameMin: Cijk_Ailk_Bljk_S_B_Bias_HA_S_SAV_UserArgs_MT512x128x32_MI32x32x1_SN_LDSB1_AFC0_AG1_AFEM1_AFEM1_ASEM1_CLR1_CADS0_DTLA0_DTLB0_DTVA0_DTVB0_DTVMXSA0_DTVMXSB0_DTVSM0_DPLB0_EPS0_ELFLR0_EMLLn1_FDSI0_GRPM1_GRVWA4_GRVWB4_GSU0_GSUAMB_GSUC0_GSUWGMRR0_GLS0_ISA950_IU1_K1_LDSTI0_LBSPPA0_LBSPPB512_LBSPPM0_LPA0_LPB4_LPM0_LRVWn1_LWPMn1_MIAV0_MIWT4_4_MO40_MGRIPM1_NTn1_NTA0_NTB0_NTC0_NTD0_NTM0_NEPBS0_NLCA2_NLCB1_ONLL1_PGR2_PLR1_PKA1_SGROB0_SIA3_SS1_SU0_SUM0_SUS0_SPO1_SRVW0_SSO1_SVW4_SK3_SKFTR0_SKXCCM4_SGRO0_TDMI0_TIN1_TLDS1_TLDSMn1_ULSGRO0_USL1_UIOFGRO0_UPLRP0_USFGRO0_VSn1_VWA4_VWB4_WSGRA2_WSGRB0_WS64_WG128_2_1_WGM32_WGMXCC1_WGMXCCGn1
    SolutionIndex: 351
    SolutionNameMin: Cijk_Ailk_Bljk_S_B_Bias_HA_S_SAV_UserArgs_MT416x128x32_MI16x16x1_SN_LDSB1_AFC0_AG1_AFEM1_AFEM1_ASEM1_CLR1_CADS0_DTLA0_DTLB0_DTVA0_DTVB0_DTVMXSA0_DTVMXSB0_DTVSM0_DPLB0_EPS0_ELFLR0_EMLLn1_FDSI0_GRPM1_GRVWA4_GRVWB4_GSU0_GSUAMB_GSUC0_GSUWGMRR0_GLS0_ISA950_IU1_K1_LDSTI0_LBSPPA6656_LBSPPB512_LBSPPM0_LPA16_LPB8_LPM0_LRVWn1_LWPMn1_MIAV0_MIWT13_4_MO40_MGRIPM1_NTn1_NTA0_NTB0_NTC4_NTD0_NTM0_NEPBS4_NLCA13_NLCB1_ONLL1_PGR2_PLR1_PKA1_SGROB0_SIA3_SS0_SU0_SUM0_SUS0_SPO0_SRVW0_SSO4_SVW4_SK3_SKFTR0_SKXCCM4_SGRO0_TDMI0_TIN1_TLDS1_TLDSMn1_ULSGRO1_USL1_UIOFGRO0_UPLRP0_USFGRO1_VSn1_VWA1_VWB4_WSGRA0_WSGRB0_WS64_WG32_8_1_WGMn6_WGMXCC4_WGMXCCGn1
    SolutionIndex: 352
    SolutionNameMin: Cijk_Ailk_Bljk_S_B_Bias_HA_S_SAV_UserArgs_MT512x128x32_MI32x32x1_SN_LDSB1_AFC0_AG1_AFEM1_AFEM1_ASEM1_CLR1_CADS0_DTLA0_DTLB0_DTVA0_DTVB0_DTVMXSA0_DTVMXSB0_DTVSM0_DPLB0_EPS0_ELFLR0_EMLLn1_FDSI0_GRPM1_GRVWA4_GRVWB4_GSU0_GSUAMB_GSUC0_GSUWGMRR0_GLS0_ISA950_IU1_K1_LDSTI0_LBSPPA0_LBSPPB512_LBSPPM0_LPA0_LPB4_LPM0_LRVWn1_LWPMn1_MIAV0_MIWT4_4_MO40_MGRIPM1_NTn1_NTA0_NTB0_NTC0_NTD0_NTM0_NEPBS0_NLCA1_NLCB1_ONLL1_PGR2_PLR1_PKA1_SGROB0_SIA3_SS1_SU0_SUM0_SUS0_SPO1_SRVW0_SSO1_SVW4_SK3_SKFTR0_SKXCCM0_SGRO0_TDMI0_TIN1_TLDS1_TLDSMn1_ULSGRO1_USL1_UIOFGRO0_UPLRP0_USFGRO0_VSn1_VWA4_VWB4_WSGRA0_WSGRB0_WS64_WG128_2_1_WGMn1_WGMXCC8_WGMXCCGn1
    SolutionIndex: 353
    SolutionNameMin: Cijk_Ailk_Bljk_S_B_Bias_HA_S_SAV_UserArgs_MT256x256x32_MI16x16x1_SN_LDSB1_AFC0_AG1_AFEM1_AFEM1_ASEM1_CLR1_CADS0_DTLA0_DTLB0_DTVA0_DTVB0_DTVMXSA0_DTVMXSB0_DTVSM0_DPLB0_EPS0_ELFLR0_EMLL0_FDSI0_GRPM1_GRVWA1_GRVWB4_GSU0_GSUAMB_GSUC0_GSUWGMRR0_GLS0_ISA950_IU1_K1_LDSTI0_LBSPPA0_LBSPPB512_LBSPPM0_LPA0_LPB8_LPM0_LRVWn1_LWPMn1_MIAV0_MIWT8_8_MO40_MGRIPM1_NTn1_NTA0_NTB0_NTC4_NTD4_NTM0_NEPBS0_NLCA4_NLCB1_ONLL1_PGR2_PLR1_PKA1_SGROB0_SIA3_SS1_SU0_SUM0_SUS0_SPO1_SRVW0_SSO1_SVW4_SK3_SKFTR0_SKXCCM8_SGRO0_TDMI0_TIN1_TLDS1_TLDSMn1_ULSGRO0_USL1_UIOFGRO0_UPLRP0_USFGRO0_VSn1_VWA4_VWB4_WSGRA2_WSGRB0_WS64_WG32_8_1_WGM8_WGMXCC2_WGMXCCGn1
    SolutionIndex: 354
    SolutionNameMin: Cijk_Ailk_Bljk_S_B_Bias_HA_S_SAV_UserArgs_MT512x128x32_MI32x32x1_SN_LDSB0_AFC0_AG1_AFEM1_AFEM1_ASEM1_CLR0_CADS0_DTLA1_DTLB0_DTVA0_DTVB0_DTVMXSA0_DTVMXSB0_DTVSM0_DPLB0_EPS0_ELFLR0_EMLLn1_FDSI0_GRPM1_GRVWA4_GRVWB4_GSU0_GSUAMB_GSUC0_GSUWGMRR0_GLS0_ISA950_IU1_K1_LDSTI1_LBSPPA0_LBSPPB0_LBSPPM0_LPA0_LPB0_LPM0_LRVWn1_LWPMn1_MIAV0_MIWT4_4_MO40_MGRIPM1_NTn1_NTA0_NTB0_NTC0_NTD4_NTM0_NEPBS0_NLCA1_NLCB1_ONLL1_PGR2_PLR1_PKA1_SGROB0_SIA3_SS1_SU0_SUM0_SUS0_SPO0_SRVW0_SSO1_SVW4_SK3_SKFTR0_SKXCCM0_SGRO0_TDMI0_TIN1_TLDS0_TLDSMn1_ULSGRO0_USL1_UIOFGRO0_UPLRP0_USFGRO0_VSn1_VWA4_VWB4_WSGRA0_WSGRB0_WS64_WG128_2_1_WGM32_WGMXCC2_WGMXCCGn1
    SolutionIndex: 355
    SolutionNameMin: Cijk_Ailk_Bljk_S_B_Bias_HA_S_SAV_UserArgs_MT256x224x32_MI16x16x1_SN_LDSB1_AFC0_AG1_AFEM1_AFEM1_ASEM1_CLR1_CADS0_DTLA0_DTLB0_DTVA0_DTVB0_DTVMXSA0_DTVMXSB0_DTVSM0_DPLB0_EPS0_ELFLR0_EMLL0_FDSI0_GRPM1_GRVWA1_GRVWB4_GSU0_GSUAMB_GSUC0_GSUWGMRR0_GLS0_ISA950_IU1_K1_LDSTI0_LBSPPA0_LBSPPB128_LBSPPM0_LPA0_LPB8_LPM0_LRVWn1_LWPMn1_MIAV0_MIWT8_7_MO40_MGRIPM1_NTn1_NTA0_NTB0_NTC0_NTD0_NTM0_NEPBS12_NLCA4_NLCB1_ONLL1_PGR2_PLR1_PKA1_SGROB0_SIA3_SS1_SU0_SUM0_SUS0_SPO1_SRVW0_SSO1_SVW4_SK3_SKFTR0_SKXCCM4_SGRO0_TDMI0_TIN1_TLDS1_TLDSMn1_ULSGRO0_USL1_UIOFGRO0_UPLRP0_USFGRO0_VSn1_VWA4_VWB1_WSGRA2_WSGRB0_WS64_WG32_8_1_WGM2_WGMXCC1_WGMXCCGn1
    SolutionIndex: 356
    SolutionNameMin: Cijk_Ailk_Bljk_S_B_Bias_HA_S_SAV_UserArgs_MT384x160x32_MI16x16x1_SN_LDSB1_AFC0_AG1_AFEM1_AFEM1_ASEM1_CLR1_CADS0_DTLA0_DTLB0_DTVA0_DTVB0_DTVMXSA0_DTVMXSB0_DTVSM0_DPLB0_EPS0_ELFLR0_EMLL0_FDSI0_GRPM1_GRVWA4_GRVWB4_GSU0_GSUAMB_GSUC0_GSUWGMRR0_GLS0_ISA950_IU1_K1_LDSTI0_LBSPPA0_LBSPPB128_LBSPPM0_LPA0_LPB8_LPM0_LRVWn1_LWPMn1_MIAV0_MIWT12_5_MO40_MGRIPM1_NTn1_NTA0_NTB0_NTC4_NTD4_NTM0_NEPBS12_NLCA3_NLCB1_ONLL1_PGR2_PLR1_PKA1_SGROB0_SIA3_SS1_SU8_SUM0_SUS512_SPO0_SRVW0_SSO1_SVW4_SK3_SKFTR0_SKXCCM0_SGRO0_TDMI0_TIN0_TLDS1_TLDSMn1_ULSGRO1_USL1_UIOFGRO0_UPLRP0_USFGRO0_VSn1_VWA4_VWB1_WSGRA0_WSGRB0_WS64_WG32_8_1_WGM2_WGMXCC1_WGMXCCGn1
    SolutionIndex: 357
    SolutionNameMin: Cijk_Ailk_Bljk_S_B_Bias_HA_S_SAV_UserArgs_MT512x128x32_MI16x16x1_SN_LDSB1_AFC0_AG0_AFEM1_AFEM1_ASEM1_CLR1_CADS0_DTLA0_DTLB0_DTVA0_DTVB0_DTVMXSA0_DTVMXSB0_DTVSM0_DPLB0_EPS0_ELFLR0_EMLLn1_FDSI0_GRPM1_GRVWA4_GRVWB4_GSU0_GSUAMB_GSUC0_GSUWGMRR0_GLS0_ISA950_IU1_K1_LDSTI0_LBSPPA0_LBSPPB512_LBSPPM0_LPA0_LPB8_LPM0_LRVWn1_LWPMn1_MIAV0_MIWT8_8_MO40_MGRIPM1_NTn1_NTA0_NTB0_NTC4_NTD4_NTM0_NEPBS14_NLCA1_NLCB1_ONLL1_PGR2_PLR1_PKA1_SGROB0_SIA3_SS1_SU0_SUM0_SUS0_SPO1_SRVW0_SSO1_SVW4_SK3_SKFTR0_SKXCCM4_SGRO0_TDMI0_TIN1_TLDS1_TLDSMn1_ULSGRO0_USL1_UIOFGRO0_UPLRP0_USFGRO0_VSn1_VWA4_VWB4_WSGRA0_WSGRB0_WS64_WG64_4_1_WGM24_WGMXCC8_WGMXCCGn1
    SolutionIndex: 358
    SolutionNameMin: Cijk_Ailk_Bljk_S_B_Bias_HA_S_SAV_UserArgs_MT128x352x32_MI16x16x1_SN_LDSB1_AFC0_AG1_AFEM1_AFEM1_ASEM1_CLR1_CADS0_DTLA0_DTLB0_DTVA0_DTVB0_DTVMXSA0_DTVMXSB0_DTVSM0_DPLB0_EPS0_ELFLR0_EMLLn1_FDSI0_GRPM1_GRVWA4_GRVWB4_GSU0_GSUAMB_GSUC0_GSUWGMRR0_GLS0_ISA950_IU1_K1_LDSTI0_LBSPPA0_LBSPPB128_LBSPPM0_LPA0_LPB8_LPM0_LRVWn1_LWPMn1_MIAV0_MIWT4_11_MO40_MGRIPM1_NTn1_NTA0_NTB0_NTC4_NTD0_NTM0_NEPBS12_NLCA1_NLCB1_ONLL1_PGR2_PLR1_PKA1_SGROB0_SIA3_SS1_SU16_SUM0_SUS512_SPO0_SRVW0_SSO1_SVW4_SK3_SKFTR0_SKXCCM0_SGRO0_TDMI0_TIN0_TLDS1_TLDSMn1_ULSGRO0_USL1_UIOFGRO0_UPLRP0_USFGRO1_VSn1_VWA4_VWB1_WSGRA0_WSGRB2_WS64_WG32_8_1_WGM8_WGMXCC1_WGMXCCGn1
- - - [9, 6577472, 1, 2]
    - [54, 0.0]
  - - [10, 1, 1, 925632]
    - [0, 0.0]
  - - [9, 1, 1, 786144]
    - [0, 0.0]
  - - [48, 98304, 1, 48]
    - [9, 0.0]
  - - [12, 13744384, 1, 2]
    - [56, 0.0]
  - - [8, 21907200, 1, 2]
    - [55, 0.0]
  - - [10, 20920192, 1, 2]
    - [56, 0.0]
  - - [160, 1792, 128, 128]
    - [57, 0.0]
  - - [120, 3072, 128, 48]
    - [2, 0.0]
  - - [128, 358400, 1, 128]
    - [38, 0.0]
  - - [256, 256000, 1, 256]
    - [3, 0.0]
  - - [256, 640000, 1, 256]
    - [60, 0.0]
  - - [512, 114560, 1, 256]
    - [4, 0.0]
  - - [512, 189360, 1, 256]
    - [3, 0.0]
  - - [640, 600640, 1, 256]
    - [5, 0.0]
  - - [1024, 66960, 1, 256]
    - [6, 0.0]
  - - [1024, 194160, 1, 256]
    - [7, 0.0]
  - - [1024, 248960, 1, 256]
    - [7, 0.0]
  - - [48, 614400, 1, 48]
    - [1, 0.0]
  - - [1, 592704, 1, 12]
    - [51, 0.0]
  - - [1, 925632, 1, 10]
    - [8, 0.0]
  - - [12, 592704, 1, 1]
    - [53, 0.0]
  - - [1, 786144, 1, 9]
    - [55, 0.0]
  - - [1, 875568, 1, 8]
    - [8, 0.0]
  - - [9, 786144, 1, 1]
    - [53, 0.0]
  - - [48, 98304, 1, 128]
    - [9, 0.0]
  - - [128, 57344, 1, 128]
    - [4, 0.0]
  - - [128, 57344, 1, 256]
    - [59, 0.0]
  - - [128, 98304, 1, 48]
    - [52, 0.0]
  - - [256, 57344, 1, 128]
    - [3, 0.0]
  - - [384, 1280, 1, 256]
    - [10, 0.0]
  - - [384, 1280, 1, 384]
    - [11, 0.0]
  - - [512, 1280, 1, 512]
    - [16, 0.0]
  - - [640, 1280, 1, 640]
    - [13, 0.0]
  - - [640, 26480, 1, 256]
    - [6, 0.0]
  - - [768, 1280, 1, 256]
    - [14, 0.0]
  - - [768, 1280, 1, 768]
    - [15, 0.0]
  - - [1664, 1280, 1, 256]
    - [12, 0.0]
  - - [1664, 1280, 1, 1664]
    - [61, 0.0]
  - - [1920, 1280, 1, 1920]
    - [17, 0.0]
  - - [1920, 136080, 1, 256]
    - [6, 0.0]
  - - [2560, 360, 1, 2]
    - [18, 0.0]
  - - [2560, 1560, 1, 2]
    - [19, 0.0]
  - - [2560, 3600, 1, 2]
    - [20, 0.0]
  - - [3072, 2, 1, 1024]
    - [21, 0.0]
  - - [3072, 2, 1, 3072]
    - [22, 0.0]
  - - [3072, 16, 1, 3072]
    - [23, 0.0]
  - - [3072, 32, 1, 3072]
    - [24, 0.0]
  - - [5120, 16, 1, 256]
    - [25, 0.0]
  - - [5120, 16, 1, 5120]
    - [26, 0.0]
  - - [5120, 32, 1, 256]
    - [27, 0.0]
  - - [5120, 32, 1, 5120]
    - [28, 0.0]
  - - [5120, 1560, 1, 5120]
    - [29, 0.0]
  - - [6144, 24, 1, 3072]
    - [30, 0.0]
  - - [6144, 40, 1, 3072]
    - [31, 0.0]
  - - [6144, 1024, 1, 3072]
    - [32, 0.0]
  - - [30720, 16, 1, 5120]
    - [33, 0.0]
  - - [8, 875568, 1, 1]
    - [56, 0.0]
  - - [10, 925632, 1, 1]
    - [53, 0.0]
  - - [6144, 1024, 1, 6144]
    - [34, 0.0]
  - - [4096, 1024, 1, 4096]
    - [35, 0.0]
  - - [4096, 256, 1, 4096]
    - [36, 0.0]
  - - [6144, 1, 1, 6144]
    - [37, 0.0]
  - - [6144, 2048, 1, 272]
    - [38, 0.0]
  - - [256, 2048, 1, 6144]
    - [39, 0.0]
  - - [4096, 2048, 1, 272]
    - [40, 0.0]
  - - [4096, 1, 1, 4096]
    - [41, 0.0]
  - - [2048, 256, 1, 4096]
    - [42, 0.0]
  - - [256, 2048, 1, 4096]
    - [43, 0.0]
  - - [1280, 154, 1, 1280]
    - [44, 0.0]
  - - [1280, 77, 1, 5120]
    - [45, 0.0]
  - - [5120, 77, 1, 1280]
    - [46, 0.0]
  - - [3840, 77, 1, 1280]
    - [47, 0.0]
  - - [4096, 1024, 1, 272]
    - [48, 0.0]
  - - [256, 1024, 1, 4096]
    - [49, 0.0]
  - - [2048, 256, 1, 2048]
    - [50, 0.0]
  - - [8, 1, 1, 875568]
    - [58, 0.0]
  - - [12, 1, 1, 592704]
    - [58, 0.0]
  - - [128, 1, 40, 488]
    - [62, 0.0]
  - - [128, 580, 28, 580]
    - [63, 0.0]
  - - [580, 64, 3, 1]
    - [64, 0.0]
  - - [256, 64, 1, 1]
    - [65, 0.0]
  - - [512, 64, 1, 1]
    - [66, 0.0]
  - - [576, 9168, 1, 128]
    - [67, 0.0]
  - - [256, 9168, 1, 128]
    - [68, 0.0]
  - - [234, 1760256, 1, 32]
    - [69, 0.0]
  - - [1, 48559, 1, 96]
    - [70, 0.0]
  - - [96, 48559, 1, 1]
    - [71, 0.0]
  - - [100, 9168, 1, 100]
    - [72, 0.0]
  - - [1, 8384, 1, 96]
    - [73, 0.0]
  - - [1, 17648, 1, 96]
    - [74, 0.0]
  - - [128, 9168, 1, 128]
    - [75, 0.0]
  - - [1, 5333, 1, 96]
    - [76, 0.0]
  - - [96, 17648, 1, 1]
    - [77, 0.0]
  - - [1, 53, 1, 96]
    - [78, 0.0]
  - - [96, 8384, 1, 1]
    - [79, 0.0]
  - - [384, 53, 1, 96]
    - [80, 0.0]
  - - [96, 5333, 1, 1]
    - [81, 0.0]
  - - [8, 300, 9168, 192]
    - [82, 0.0]
  - - [19660, 6553, 1, 131072]
    - [83, 0.0]
  - - [5734, 19660, 1, 131072]
    - [84, 0.0]
  - - [9216, 6144, 1, 16384]
    - [85, 0.0]
  - - [157286, 358, 1, 32]
    - [86, 0.0]
  - - [32768, 2304, 1, 32]
    - [87, 0.0]
  - - [344064, 128, 1, 128]
    - [88, 0.0]
  - - [1638, 26214, 1, 128]
    - [89, 0.0]
  - - [1228, 58982, 1, 32]
    - [90, 0.0]
  - - [294912, 256, 1, 32]
    - [91, 0.0]
  - - [114688, 384, 1, 128]
    - [92, 0.0]
  - - [256, 314572, 1, 32]
    - [93, 0.0]
  - - [256, 294912, 1, 32]
    - [94, 0.0]
  - - [371, 104857, 1, 128]
    - [95, 0.0]
  - - [176947, 128, 1, 16384]
    - [96, 0.0]
  - - [6144, 12288, 1, 32]
    - [97, 0.0]
  - - [2304, 32768, 1, 32]
    - [98, 0.0]
  - - [384, 106496, 1, 128]
    - [99, 0.0]
  - - [209715, 256, 1, 32]
    - [100, 0.0]
  - - [793, 39321, 1, 128]
    - [101, 0.0]
  - - [8192, 5120, 1, 128]
    - [102, 0.0]
  - - [458752, 128, 1, 32]
    - [103, 0.0]
  - - [6553, 4915, 1, 128]
    - [104, 0.0]
  - - [512, 131072, 1, 32]
    - [105, 0.0]
  - - [1440, 24576, 1, 128]
    - [106, 0.0]
  - - [209715, 115, 1, 8192]
    - [107, 0.0]
  - - [5120, 6144, 1, 128]
    - [108, 0.0]
  - - [16896, 2048, 1, 128]
    - [109, 0.0]
  - - [307, 85196, 1, 128]
    - [110, 0.0]
  - - [98304, 640, 1, 32]
    - [111, 0.0]
  - - [1228, 32768, 1, 32]
    - [112, 0.0]
  - - [928, 32768, 1, 128]
    - [113, 0.0]
  - - [55705, 460, 1, 128]
    - [114, 0.0]
  - - [270336, 128, 1, 128]
    - [115, 0.0]
  - - [16384, 3328, 1, 32]
    - [116, 0.0]
  - - [13312, 2304, 1, 128]
    - [117, 0.0]
  - - [120, 131072, 1, 256]
    - [118, 0.0]
  - - [307, 131072, 1, 32]
    - [119, 0.0]
  - - [3712, 8192, 1, 128]
    - [120, 0.0]
  - - [1024, 53248, 1, 32]
    - [121, 0.0]
  - - [1824, 16384, 1, 128]
    - [122, 0.0]
  - - [480, 131072, 1, 32]
    - [123, 0.0]
  - - [26624, 1152, 1, 128]
    - [124, 0.0]
  - - [345, 104857, 1, 32]
    - [125, 0.0]
  - - [1638, 3174, 1, 1024]
    - [126, 0.0]
  - - [6144, 9216, 1, 32]
    - [127, 0.0]
  - - [742, 52428, 1, 32]
    - [128, 0.0]
  - - [2048, 23808, 1, 32]
    - [129, 0.0]
  - - [3891, 4915, 1, 128]
    - [130, 0.0]
  - - [212992, 128, 1, 128]
    - [131, 0.0]
  - - [272, 98304, 1, 128]
    - [132, 0.0]
  - - [57344, 672, 1, 32]
    - [133, 0.0]
  - - [256, 196608, 1, 32]
    - [134, 0.0]
  - - [102, 91750, 1, 16384]
    - [135, 0.0]
  - - [235929, 128, 1, 32]
    - [136, 0.0]
  - - [320, 110592, 1, 32]
    - [137, 0.0]
  - - [24576, 800, 1, 128]
    - [138, 0.0]
  - - [81920, 480, 1, 32]
    - [139, 0.0]
  - - [114688, 384, 1, 32]
    - [140, 0.0]
  - - [2304, 10240, 1, 128]
    - [141, 0.0]
  - - [614, 58982, 1, 32]
    - [142, 0.0]
  - - [33792, 1280, 1, 32]
    - [143, 0.0]
  - - [216268, 128, 1, 32]
    - [144, 0.0]
  - - [716, 26214, 1, 128]
    - [145, 0.0]
  - - [176947, 128, 1, 8192]
    - [146, 0.0]
  - - [11468, 3276, 1, 32]
    - [147, 0.0]
  - - [4608, 9216, 1, 32]
    - [148, 0.0]
  - - [307200, 128, 1, 32]
    - [149, 0.0]
  - - [128, 135168, 1, 128]
    - [150, 0.0]
  - - [245760, 128, 1, 32]
    - [151, 0.0]
  - - [15360, 2560, 1, 32]
    - [152, 0.0]
  - - [102, 93388, 1, 256]
    - [153, 0.0]
  - - [6400, 6144, 1, 32]
    - [154, 0.0]
  - - [3712, 8192, 1, 32]
    - [155, 0.0]
  - - [2457, 9420, 1, 32]
    - [156, 0.0]
  - - [270336, 128, 1, 32]
    - [157, 0.0]
  - - [2150, 1638, 1, 1024]
    - [158, 0.0]
  - - [262144, 128, 1, 32]
    - [159, 0.0]
  - - [1920, 5632, 1, 256]
    - [160, 0.0]
  - - [12288, 2688, 1, 32]
    - [161, 0.0]
  - - [22528, 1536, 1, 32]
    - [162, 0.0]
  - - [24576, 1408, 1, 32]
    - [163, 0.0]
  - - [819, 9216, 1, 16384]
    - [164, 0.0]
  - - [217, 78643, 1, 32]
    - [165, 0.0]
  - - [768, 25600, 1, 32]
    - [166, 0.0]
  - - [8908, 1638, 1, 128]
    - [167, 0.0]
  - - [3276, 4300, 1, 128]
    - [168, 0.0]
  - - [139264, 128, 1, 32]
    - [169, 0.0]
  - - [2560, 4915, 1, 128]
    - [170, 0.0]
  - - [3276, 4454, 1, 32]
    - [171, 0.0]
  - - [230, 72089, 1, 32]
    - [172, 0.0]
  - - [576, 39321, 1, 32]
    - [173, 0.0]
  - - [504, 24576, 1, 32]
    - [174, 0.0]
  - - [9216, 704, 1, 16384]
    - [175, 0.0]
  - - [1638, 3993, 1, 256]
    - [176, 0.0]
  - - [29696, 384, 1, 128]
    - [177, 0.0]
  - - [13312, 768, 1, 128]
    - [178, 0.0]
  - - [1433, 7372, 1, 32]
    - [179, 0.0]
  - - [2048, 7372, 1, 32]
    - [180, 0.0]
  - - [1248, 8192, 1, 128]
    - [181, 0.0]
  - - [8192, 1638, 1, 32]
    - [182, 0.0]
  - - [5888, 1024, 1, 256]
    - [183, 0.0]
  - - [8601, 13107, 1, 131072]
    - [184, 0.0]
  - - [1408, 10240, 1, 32]
    - [185, 0.0]
  - - [432, 24576, 1, 32]
    - [186, 0.0]
  - - [7782, 819, 1, 128]
    - [187, 0.0]
  - - [2304, 6553, 1, 32]
    - [188, 0.0]
  - - [192, 29696, 1, 256]
    - [189, 0.0]
  - - [1536, 6912, 1, 32]
    - [190, 0.0]
  - - [563, 9830, 1, 128]
    - [191, 0.0]
  - - [120, 65536, 1, 32]
    - [192, 0.0]
  - - [1664, 3072, 1, 256]
    - [193, 0.0]
  - - [13107, 307, 1, 256]
    - [194, 0.0]
  - - [4096, 57344, 1, 256]
    - [195, 0.0]
  - - [1638, 2252, 1, 256]
    - [196, 0.0]
  - - [8192, 576, 1, 32]
    - [197, 0.0]
  - - [1408, 8192, 1, 32]
    - [198, 0.0]
  - - [614, 9011, 1, 128]
    - [199, 0.0]
  - - [332, 26214, 1, 32]
    - [200, 0.0]
  - - [1280, 2816, 1, 256]
    - [201, 0.0]
  - - [2560, 1280, 1, 256]
    - [202, 0.0]
  - - [1024, 3276, 1, 256]
    - [203, 0.0]
  - - [13516, 204, 1, 128]
    - [204, 0.0]
  - - [8192, 102, 1, 1024]
    - [205, 0.0]
  - - [44236, 102, 1, 8192]
    - [206, 0.0]
  - - [1024, 4864, 1, 128]
    - [207, 0.0]
  - - [6553, 998, 1, 32]
    - [208, 0.0]
  - - [8192, 360, 1, 256]
    - [209, 0.0]
  - - [192, 27648, 1, 32]
    - [210, 0.0]
  - - [10752, 640, 1, 32]
    - [211, 0.0]
  - - [6553, 716, 1, 32]
    - [212, 0.0]
  - - [2048, 800, 1, 256]
    - [213, 0.0]
  - - [1024, 3840, 1, 128]
    - [214, 0.0]
  - - [6553, 345, 1, 256]
    - [215, 0.0]
  - - [1689, 1638, 1, 128]
    - [216, 0.0]
  - - [992, 2048, 1, 256]
    - [217, 0.0]
  - - [1920, 3072, 1, 32]
    - [218, 0.0]
  - - [3072, 640, 1, 256]
    - [219, 0.0]
  - - [4915, 460, 1, 128]
    - [220, 0.0]
  - - [1216, 4096, 1, 32]
    - [221, 0.0]
  - - [96, 45056, 1, 32]
    - [222, 0.0]
  - - [1536, 256, 1, 1024]
    - [223, 0.0]
  - - [1536, 192, 1, 1024]
    - [224, 0.0]
  - - [2432, 1536, 1, 32]
    - [225, 0.0]
  - - [4915, 358, 1, 128]
    - [226, 0.0]
  - - [499, 6553, 1, 32]
    - [227, 0.0]
  - - [2304, 640, 1, 256]
    - [228, 0.0]
  - - [25, 65536, 1, 32]
    - [229, 0.0]
  - - [2048, 544, 1, 256]
    - [230, 0.0]
  - - [819, 614, 1, 128]
    - [231, 0.0]
  - - [240, 12288, 1, 32]
    - [232, 0.0]
  - - [2944, 512, 1, 128]
    - [233, 0.0]
  - - [72, 32768, 1, 32]
    - [234, 0.0]
  - - [256, 896, 1, 1024]
    - [235, 0.0]
  - - [928, 2048, 1, 32]
    - [236, 0.0]
  - - [576, 1536, 1, 256]
    - [237, 0.0]
  - - [409, 3072, 1, 128]
    - [238, 0.0]
  - - [512, 1638, 1, 256]
    - [239, 0.0]
  - - [9830, 166, 1, 32]
    - [240, 0.0]
  - - [2304, 512, 1, 128]
    - [241, 0.0]
  - - [3276, 179, 1, 256]
    - [242, 0.0]
  - - [819, 1075, 1, 128]
    - [243, 0.0]
  - - [8192, 72, 1, 256]
    - [244, 0.0]
  - - [512, 1344, 1, 256]
    - [245, 0.0]
  - - [2867, 307, 1, 128]
    - [246, 0.0]
  - - [192, 2816, 1, 256]
    - [247, 0.0]
  - - [1638, 256, 1, 256]
    - [248, 0.0]
  - - [2048, 360, 1, 128]
    - [249, 0.0]
  - - [2867, 102, 1, 256]
    - [250, 0.0]
  - - [2457, 256, 1, 128]
    - [251, 0.0]
  - - [1638, 230, 1, 256]
    - [252, 0.0]
  - - [204, 5734, 1, 32]
    - [253, 0.0]
  - - [1024, 1248, 1, 32]
    - [254, 0.0]
  - - [360, 2048, 1, 128]
    - [255, 0.0]
  - - [42598, 102, 1, 8192]
    - [256, 0.0]
  - - [819, 768, 1, 128]
    - [257, 0.0]
  - - [448, 3072, 1, 32]
    - [258, 0.0]
  - - [12288, 72, 1, 32]
    - [259, 0.0]
  - - [1024, 480, 1, 256]
    - [260, 0.0]
  - - [1152, 384, 1, 256]
    - [261, 0.0]
  - - [264, 4096, 1, 32]
    - [262, 0.0]
  - - [128, 5376, 1, 128]
    - [263, 0.0]
  - - [1280, 576, 1, 128]
    - [264, 0.0]
  - - [192, 6656, 1, 32]
    - [265, 0.0]
  - - [192, 6144, 1, 32]
    - [266, 0.0]
  - - [9216, 704, 1, 8192]
    - [267, 0.0]
  - - [320, 2304, 1, 128]
    - [268, 0.0]
  - - [768, 896, 1, 128]
    - [269, 0.0]
  - - [512, 1344, 1, 128]
    - [270, 0.0]
  - - [6553, 115, 1, 32]
    - [271, 0.0]
  - - [819, 563, 1, 128]
    - [272, 0.0]
  - - [819, 512, 1, 128]
    - [273, 0.0]
  - - [2304, 64, 1, 256]
    - [274, 0.0]
  - - [409, 716, 1, 128]
    - [275, 0.0]
  - - [176, 3072, 1, 32]
    - [276, 0.0]
  - - [4096, 216, 1, 32]
    - [277, 0.0]
  - - [3276, 45875, 1, 256]
    - [278, 0.0]
  - - [2048, 216, 1, 128]
    - [279, 0.0]
  - - [1920, 128, 1, 256]
    - [280, 0.0]
  - - [256, 3276, 1, 32]
    - [281, 0.0]
  - - [1638, 128, 1, 256]
    - [282, 0.0]
  - - [80, 8192, 1, 32]
    - [283, 0.0]
  - - [16384, 24, 1, 32]
    - [284, 0.0]
  - - [2048, 224, 1, 128]
    - [285, 0.0]
  - - [256, 960, 1, 256]
    - [286, 0.0]
  - - [12288, 16384, 1, 128]
    - [287, 0.0]
  - - [64, 5632, 1, 32]
    - [288, 0.0]
  - - [160, 1536, 1, 32]
    - [289, 0.0]
  - - [4608, 160, 1, 32]
    - [290, 0.0]
  - - [512, 448, 1, 256]
    - [291, 0.0]
  - - [10240, 24, 1, 32]
    - [292, 0.0]
  - - [1024, 144, 1, 32]
    - [293, 0.0]
  - - [2048, 8, 1, 128]
    - [294, 0.0]
  - - [409, 512, 1, 32]
    - [295, 0.0]
  - - [160, 512, 1, 128]
    - [296, 0.0]
  - - [25, 9830, 1, 32]
    - [297, 0.0]
  - - [512, 235929, 1, 256]
    - [298, 0.0]
  - - [1638, 102, 1, 128]
    - [299, 0.0]
  - - [6553, 12, 1, 32]
    - [300, 0.0]
  - - [512, 64, 1, 32]
    - [301, 0.0]
  - - [409, 921, 1, 32]
    - [302, 0.0]
  - - [819, 153, 1, 128]
    - [303, 0.0]
  - - [256, 384, 1, 256]
    - [304, 0.0]
  - - [3072, 160, 1, 32]
    - [305, 0.0]
  - - [1152, 128, 1, 32]
    - [306, 0.0]
  - - [384, 1664, 1, 32]
    - [307, 0.0]
  - - [1024, 196608, 1, 128]
    - [308, 0.0]
  - - [51, 8192, 1, 32]
    - [309, 0.0]
  - - [64, 2048, 1, 128]
    - [310, 0.0]
  - - [3072, 128, 1, 32]
    - [311, 0.0]
  - - [40, 8192, 1, 32]
    - [312, 0.0]
  - - [8192, 40, 1, 32]
    - [313, 0.0]
  - - [512, 704, 1, 32]
    - [314, 0.0]
  - - [8, 8192, 1, 128]
    - [315, 0.0]
  - - [512, 393216, 1, 128]
    - [316, 0.0]
  - - [1228, 104857, 1, 128]
    - [317, 0.0]
  - - [131072, 1728, 1, 32]
    - [318, 0.0]
  - - [512, 524288, 1, 32]
    - [319, 0.0]
  - - [327680, 640, 1, 32]
    - [320, 0.0]
  - - [768, 327680, 1, 32]
    - [321, 0.0]
  - - [4915, 8192, 1, 131072]
    - [322, 0.0]
  - - [12800, 16384, 1, 32]
    - [323, 0.0]
  - - [1433, 78643, 1, 128]
    - [324, 0.0]
  - - [512, 458752, 1, 32]
    - [325, 0.0]
  - - [180224, 128, 1, 1024]
    - [326, 0.0]
  - - [512, 235929, 1, 128]
    - [327, 0.0]
  - - [1536, 49152, 1, 256]
    - [328, 0.0]
  - - [2969, 52428, 1, 32]
    - [329, 0.0]
  - - [132710, 102, 1, 131072]
    - [330, 0.0]
  - - [18022, 8192, 1, 32]
    - [331, 0.0]
  - - [1024, 196608, 1, 32]
    - [332, 0.0]
  - - [88473, 1638, 1, 32]
    - [333, 0.0]
  - - [2048, 52428, 1, 128]
    - [334, 0.0]
  - - [1740, 78643, 1, 32]
    - [335, 0.0]
  - - [4915, 24576, 1, 32]
    - [336, 0.0]
  - - [409, 367001, 1, 32]
    - [337, 0.0]
  - - [1638, 72089, 1, 32]
    - [338, 0.0]
  - - [512, 360448, 1, 32]
    - [339, 0.0]
  - - [4505, 32768, 1, 32]
    - [340, 0.0]
  - - [409, 340787, 1, 32]
    - [341, 0.0]
  - - [3174, 26214, 1, 128]
    - [342, 0.0]
  - - [1024, 172032, 1, 32]
    - [343, 0.0]
  - - [327680, 512, 1, 32]
    - [344, 0.0]
  - - [8192, 7168, 1, 256]
    - [345, 0.0]
  - - [11468, 9830, 1, 32]
    - [346, 0.0]
  - - [1024, 163840, 1, 32]
    - [347, 0.0]
  - - [9216, 6144, 1, 256]
    - [348, 0.0]
  - - [1638, 65536, 1, 32]
    - [349, 0.0]
  - - [104857, 1024, 1, 32]
    - [350, 0.0]
  - - [104857, 115, 1, 131072]
    - [351, 0.0]
  - - [26214, 3686, 1, 32]
    - [352, 0.0]
  - - [512, 163840, 1, 128]
    - [353, 0.0]
  - - [3276, 32768, 1, 32]
    - [354, 0.0]
  - - [1638, 55705, 1, 32]
    - [355, 0.0]
  - - [19456, 2304, 1, 256]
    - [356, 0.0]
  - - [131072, 819, 1, 32]
    - [357, 0.0]
  - - [384, 116736, 1, 256]
    - [358, 0.0]
