projects/hipblaslt/library/src/amd_detail/rocblaslt/src/Tensile/Logic/asm_full/gfx950/gfx950/Equality/gfx950_Cijk_Alik_Bjlk_S_B_BiasS_HAS_SAV_UserArgs.yaml
- {MinimumRequiredVersion: 5.0.0}
- gfx950
- gfx950
- [Device 75a0]
    SolutionIndex: 0
    SolutionNameMin: Cijk_Alik_Bjlk_S_B_Bias_HA_S_SAV_UserArgs_MT32x64x128_MI16x16x1_SN_LDSB1_AFC0_AG0_AFEM1_AFEM1_ASEM1_CLR1_CADS0_DTLA0_DTLB0_DTVA0_DTVB0_DTVMXSA0_DTVMXSB0_DTVSM0_DPLBn1_EPS0_ELFLR0_EMLLn1_FDSI0_GRPM1_GRVWA4_GRVWB4_GSU0_GSUAMB_GSUC0_GSUWGMRR0_GLS0_ISA950_IU1_K1_LDSTI0_LBSPPA512_LBSPPB1024_LBSPPM0_LPA8_LPB0_LPM0_LRVW4_LWPMn1_MIAV1_MIWT1_2_MO40_MGRIPMn1_NTn1_NTA3_NTB2_NTC1_NTD4_NTM0_NEPBS12_NLCA1_NLCB1_ONLL1_PGR2_PLR1_PKA1_SGROBn1_SIA3_SS1_SU8_SUM1_SUS512_SPO0_SRVW0_SSO0_SVW1_SK3_SKFTR0_SKXCCM0_SGRO0_TDMI0_TIN0_TLDS1_TLDSM1_ULSGRO0_USL1_UIOFGRO0_UPLRP0_USFGROn1_VSn1_VWA1_VWB2_WSGRA0_WSGRB0_WS64_WG32_8_1_WGM1_WGMXCC4_WGMXCCGn1
    SolutionIndex: 1
    SolutionNameMin: Cijk_Alik_Bjlk_S_B_Bias_HA_S_SAV_UserArgs_MT48x64x64_MI16x16x1_SN_LDSB1_AFC0_AG0_AFEM1_AFEM1_ASEM1_CLR1_CADS0_DTLA0_DTLB0_DTVA0_DTVB0_DTVMXSA0_DTVMXSB0_DTVSM0_DPLBn1_EPS0_ELFLR0_EMLLn1_FDSI0_GRPM1_GRVWA4_GRVWB4_GSU0_GSUAMB_GSUC0_GSUWGMRR0_GLS0_ISA950_IU1_K1_LDSTI0_LBSPPA256_LBSPPB1024_LBSPPM0_LPA8_LPB16_LPM0_LRVW4_LWPMn1_MIAV1_MIWT3_1_MO40_MGRIPMn1_NTn1_NTA1_NTB1_NTC1_NTD1_NTM0_NEPBS16_NLCA1_NLCB1_ONLL1_PGR2_PLR1_PKA1_SGROBn1_SIA3_SS1_SU0_SUM0_SUS0_SPO0_SRVW0_SSO0_SVW1_SK3_SKFTR0_SKXCCM4_SGRO0_TDMI0_TIN0_TLDS1_TLDSM1_ULSGRO0_USL1_UIOFGRO0_UPLRP0_USFGRO0_VSn1_VWA1_VWB1_WSGRA0_WSGRB0_WS64_WG16_16_1_WGM1_WGMXCC8_WGMXCCGn1
    SolutionIndex: 2
    SolutionNameMin: Cijk_Alik_Bjlk_S_B_Bias_HA_S_SAV_UserArgs_MT48x64x64_MI16x16x1_SN_LDSB1_AFC0_AG0_AFEM1_AFEM1_ASEM1_CLR1_CADS0_DTLA0_DTLB0_DTVA0_DTVB0_DTVMXSA0_DTVMXSB0_DTVSM0_DPLBn1_EPS0_ELFLR0_EMLLn1_FDSI0_GRPM1_GRVWA4_GRVWB4_GSU0_GSUAMB_GSUC0_GSUWGMRR0_GLS0_ISA950_IU1_K1_LDSTI0_LBSPPA256_LBSPPB1024_LBSPPM0_LPA8_LPB16_LPM0_LRVW4_LWPMn1_MIAV0_MIWT3_1_MO40_MGRIPMn1_NTn1_NTA3_NTB1_NTC1_NTD1_NTM0_NEPBS16_NLCA1_NLCB1_ONLL1_PGR2_PLR1_PKA1_SGROBn1_SIA3_SS1_SU0_SUM0_SUS0_SPO0_SRVW0_SSO0_SVW1_SK3_SKFTR0_SKXCCM0_SGRO0_TDMI0_TIN0_TLDS1_TLDSM1_ULSGRO0_USL1_UIOFGRO0_UPLRP0_USFGROn1_VSn1_VWA1_VWB1_WSGRA0_WSGRB0_WS64_WG16_16_1_WGM6_WGMXCC8_WGMXCCGn1
    SolutionIndex: 3
    SolutionNameMin: Cijk_Alik_Bjlk_S_B_Bias_HA_S_SAV_UserArgs_MT32x32x128_MI16x16x1_SN_LDSB0_AFC0_AG0_AFEM1_AFEM1_ASEM1_CLR1_CADS0_DTLA0_DTLB0_DTVA0_DTVB0_DTVMXSA0_DTVMXSB0_DTVSM0_DPLBn1_EPS0_ELFLR0_EMLLn1_FDSI0_GRPM1_GRVWA1_GRVWB4_GSU0_GSUAMB_GSUC0_GSUWGMRR0_GLS0_ISA950_IU1_K1_LDSTI0_LBSPPA512_LBSPPB512_LBSPPM0_LPA8_LPB16_LPM0_LRVW4_LWPMn1_MIAV0_MIWT1_1_MO40_MGRIPMn1_NTn1_NTA2_NTB7_NTC0_NTD2_NTM0_NEPBS16_NLCA1_NLCB1_ONLL1_PGR2_PLR1_PKA1_SGROBn1_SIA3_SS1_SU0_SUM0_SUS0_SPO1_SRVW0_SSO0_SVW1_SK3_SKFTR0_SKXCCM0_SGRO0_TDMI0_TIN0_TLDS1_TLDSM1_ULSGRO0_USL1_UIOFGRO0_UPLRP0_USFGRO0_VSn1_VWA1_VWB1_WSGRA0_WSGRB0_WS64_WG32_8_1_WGM16_WGMXCC1_WGMXCCGn1
    SolutionIndex: 4
    SolutionNameMin: Cijk_Alik_Bjlk_S_B_Bias_HA_S_SAV_UserArgs_MT96x160x32_MI16x16x1_SN_LDSB1_AFC0_AG0_AFEM1_AFEM1_ASEM1_CLR1_CADS0_DTLA0_DTLB0_DTVA0_DTVB0_DTVMXSA0_DTVMXSB0_DTVSM0_DPLBn1_EPS0_ELFLR0_EMLLn1_FDSI0_GRPM1_GRVWA4_GRVWB4_GSU0_GSUAMB_GSUC0_GSUWGMRR0_GLS0_ISA950_IU1_K1_LDSTI0_LBSPPA128_LBSPPB2560_LBSPPM0_LPA8_LPB16_LPM0_LRVW4_LWPMn1_MIAV1_MIWT3_5_MO40_MGRIPMn1_NTn1_NTA2_NTB6_NTC0_NTD1_NTM0_NEPBS0_NLCA1_NLCB5_ONLL1_PGR2_PLR1_PKA1_SGROBn1_SIA3_SS1_SU0_SUM0_SUS0_SPO0_SRVW0_SSO0_SVW1_SK3_SKFTR0_SKXCCM4_SGRO0_TDMI0_TIN0_TLDS1_TLDSM1_ULSGRO0_USL1_UIOFGRO0_UPLRP0_USFGRO0_VSn1_VWA1_VWB1_WSGRA0_WSGRB0_WS64_WG32_8_1_WGM48_WGMXCC32_WGMXCCGn1
    SolutionIndex: 5
    SolutionNameMin: Cijk_Alik_Bjlk_S_B_Bias_HA_S_SAV_UserArgs_MT64x32x128_MI16x16x1_SN_LDSB1_AFC0_AG0_AFEM1_AFEM1_ASEM1_CLR1_CADS0_DTLA0_DTLB0_DTVA0_DTVB0_DTVMXSA0_DTVMXSB0_DTVSM0_DPLBn1_EPS0_ELFLR0_EMLLn1_FDSI0_GRPM1_GRVWA4_GRVWB4_GSU0_GSUAMB_GSUC0_GSUWGMRR0_GLS0_ISA950_IU1_K1_LDSTI0_LBSPPA512_LBSPPB512_LBSPPM0_LPA8_LPB0_LPM0_LRVW4_LWPMn1_MIAV0_MIWT1_2_MO40_MGRIPMn1_NTn1_NTA1_NTB1_NTC3_NTD5_NTM0_NEPBS0_NLCA1_NLCB1_ONLL1_PGR2_PLR1_PKA1_SGROBn1_SIA3_SS1_SU0_SUM0_SUS0_SPO1_SRVW0_SSO0_SVW1_SK3_SKFTR0_SKXCCM0_SGRO0_TDMI0_TIN0_TLDS1_TLDSM1_ULSGRO0_USL1_UIOFGRO0_UPLRP0_USFGRO0_VSn1_VWA1_VWB2_WSGRA0_WSGRB0_WS64_WG64_4_1_WGM1_WGMXCC32_WGMXCCGn1
    SolutionIndex: 6
    SolutionNameMin: Cijk_Alik_Bjlk_S_B_Bias_HA_S_SAV_UserArgs_MT64x256x32_MI16x16x1_SN_LDSB1_AFC0_AG0_AFEM1_AFEM1_ASEM1_CLR1_CADS0_DTLA0_DTLB0_DTVA0_DTVB0_DTVMXSA0_DTVMXSB0_DTVSM0_DPLBn1_EPS0_ELFLR0_EMLLn1_FDSI0_GRPM1_GRVWA4_GRVWB4_GSU0_GSUAMB_GSUC0_GSUWGMRR0_GLS0_ISA950_IU1_K1_LDSTI0_LBSPPA128_LBSPPB4096_LBSPPM0_LPA8_LPB0_LPM0_LRVW4_LWPMn1_MIAV0_MIWT1_16_MO40_MGRIPMn1_NTn1_NTA3_NTB0_NTC0_NTD4_NTM0_NEPBS16_NLCA1_NLCB1_ONLL1_PGR2_PLR1_PKA1_SGROBn1_SIA3_SS1_SU0_SUM0_SUS0_SPO0_SRVW0_SSO4_SVW1_SK3_SKFTR0_SKXCCM0_SGRO0_TDMI0_TIN0_TLDS1_TLDSM1_ULSGRO0_USL1_UIOFGRO0_UPLRP0_USFGRO0_VSn1_VWA1_VWB4_WSGRA0_WSGRB0_WS64_WG64_4_1_WGM6_WGMXCC4_WGMXCCGn1
    SolutionIndex: 7
    SolutionNameMin: Cijk_Alik_Bjlk_S_B_Bias_HA_S_SAV_UserArgs_MT64x80x64_MI16x16x1_SN_LDSB1_AFC0_AG0_AFEM1_AFEM1_ASEM1_CLR1_CADS0_DTLA0_DTLB0_DTVA0_DTVB0_DTVMXSA0_DTVMXSB0_DTVSM0_DPLBn1_EPS0_ELFLR0_EMLLn1_FDSI0_GRPM1_GRVWA4_GRVWB4_GSU0_GSUAMB_GSUC0_GSUWGMRR0_GLS0_ISA950_IU1_K1_LDSTI0_LBSPPA256_LBSPPB1280_LBSPPM0_LPA8_LPB16_LPM0_LRVW4_LWPMn1_MIAV1_MIWT1_5_MO40_MGRIPMn1_NTn1_NTA3_NTB0_NTC1_NTD1_NTM0_NEPBS10_NLCA1_NLCB5_ONLL1_PGR2_PLR1_PKA1_SGROBn1_SIA3_SS0_SU0_SUM0_SUS0_SPO0_SRVW0_SSO4_SVW4_SK3_SKFTR0_SKXCCM0_SGRO0_TDMI0_TIN0_TLDS1_TLDSM1_ULSGRO0_USL1_UIOFGRO0_UPLRP0_USFGRO1_VSn1_VWA1_VWB1_WSGRA0_WSGRB0_WS64_WG64_4_1_WGM4_WGMXCC8_WGMXCCGn1
    SolutionIndex: 8
    SolutionNameMin: Cijk_Alik_Bjlk_S_B_Bias_HA_S_SAV_UserArgs_MT64x64x64_MI32x32x1_SN_LDSB1_AFC0_AG0_AFEM1_AFEM1_ASEM1_CLR1_CADS0_DTLA0_DTLB0_DTVA0_DTVB0_DTVMXSA0_DTVMXSB0_DTVSM0_DPLBn1_EPS1_ELFLR0_EMLLn1_FDSI0_GRPM1_GRVWA4_GRVWB4_GSU0_GSUAMB_GSUC0_GSUWGMRR0_GLS0_ISA950_IU1_K1_LDSTI0_LBSPPA256_LBSPPB0_LBSPPM0_LPA4_LPB0_LPM0_LRVW4_LWPMn1_MIAV0_MIWT1_1_MO40_MGRIPMn1_NTn1_NTA2_NTB0_NTC1_NTD0_NTM0_NEPBS16_NLCA1_NLCB1_ONLL1_PGR1_PLR1_PKA1_SGROBn1_SIA3_SS1_SU0_SUM0_SUS0_SPO1_SRVW0_SSO0_SVW1_SK3_SKFTR0_SKXCCM8_SGRO0_TDMI0_TIN0_TLDS1_TLDSM1_ULSGRO0_USL1_UIOFGRO0_UPLRP0_USFGROn1_VSn1_VWA1_VWB1_WSGRA0_WSGRB0_WS64_WG64_4_1_WGM1_WGMXCC4_WGMXCCGn1
    SolutionIndex: 9
    SolutionNameMin: Cijk_Alik_Bjlk_S_B_Bias_HA_S_SAV_UserArgs_MT64x64x64_MI16x16x1_SN_LDSB1_AFC0_AG0_AFEM1_AFEM1_ASEM1_CLR1_CADS0_DTLA0_DTLB0_DTVA0_DTVB0_DTVMXSA0_DTVMXSB0_DTVSM0_DPLBn1_EPS0_ELFLR0_EMLLn1_FDSI0_GRPM1_GRVWA4_GRVWB4_GSU0_GSUAMB_GSUC0_GSUWGMRR0_GLS0_ISA950_IU1_K1_LDSTI0_LBSPPA256_LBSPPB1024_LBSPPM0_LPA8_LPB0_LPM0_LRVW4_LWPMn1_MIAV1_MIWT1_4_MO40_MGRIPMn1_NTn1_NTA0_NTB1_NTC1_NTD0_NTM0_NEPBS0_NLCA1_NLCB1_ONLL1_PGR2_PLR1_PKA1_SGROBn1_SIA3_SS1_SU0_SUM0_SUS0_SPO0_SRVW0_SSO0_SVW1_SK3_SKFTR0_SKXCCM0_SGRO0_TDMI0_TIN0_TLDS1_TLDSM1_ULSGRO0_USL1_UIOFGRO0_UPLRP0_USFGRO1_VSn1_VWA1_VWB4_WSGRA0_WSGRB0_WS64_WG64_4_1_WGM32_WGMXCC4_WGMXCCGn1
    SolutionIndex: 10
    SolutionNameMin: Cijk_Alik_Bjlk_S_B_Bias_HA_S_SAV_UserArgs_MT80x64x64_MI16x16x1_SN_LDSB1_AFC0_AG0_AFEM1_AFEM1_ASEM1_CLR1_CADS0_DTLA0_DTLB0_DTVA0_DTVB0_DTVMXSA0_DTVMXSB0_DTVSM0_DPLBn1_EPS0_ELFLR0_EMLLn1_FDSI0_GRPM1_GRVWA4_GRVWB4_GSU0_GSUAMB_GSUC0_GSUWGMRR0_GLS0_ISA950_IU1_K1_LDSTI0_LBSPPA256_LBSPPB1024_LBSPPM0_LPA8_LPB16_LPM0_LRVW4_LWPMn1_MIAV1_MIWT5_1_MO40_MGRIPMn1_NTn1_NTA3_NTB3_NTC1_NTD0_NTM0_NEPBS0_NLCA1_NLCB1_ONLL1_PGR2_PLR1_PKA1_SGROBn1_SIA3_SS1_SU0_SUM0_SUS0_SPO0_SRVW0_SSO0_SVW1_SK3_SKFTR0_SKXCCM4_SGRO0_TDMI0_TIN0_TLDS1_TLDSM1_ULSGRO0_USL1_UIOFGRO0_UPLRP0_USFGROn1_VSn1_VWA1_VWB1_WSGRA0_WSGRB0_WS64_WG16_16_1_WGM1_WGMXCC8_WGMXCCGn1
    SolutionIndex: 11
    SolutionNameMin: Cijk_Alik_Bjlk_S_B_Bias_HA_S_SAV_UserArgs_MT112x64x64_MI16x16x1_SN_LDSB1_AFC0_AG0_AFEM1_AFEM1_ASEM1_CLR1_CADS0_DTLA0_DTLB0_DTVA0_DTVB0_DTVMXSA0_DTVMXSB0_DTVSM0_DPLBn1_EPS0_ELFLR0_EMLLn1_FDSI0_GRPM1_GRVWA4_GRVWB4_GSU0_GSUAMB_GSUC0_GSUWGMRR0_GLS0_ISA950_IU1_K1_LDSTI0_LBSPPA256_LBSPPB1024_LBSPPM0_LPA8_LPB16_LPM0_LRVW4_LWPMn1_MIAV0_MIWT7_1_MO40_MGRIPMn1_NTn1_NTA3_NTB1_NTC0_NTD0_NTM0_NEPBS0_NLCA1_NLCB1_ONLL1_PGR2_PLR1_PKA1_SGROBn1_SIA3_SS1_SU0_SUM0_SUS0_SPO0_SRVW0_SSO0_SVW1_SK3_SKFTR0_SKXCCM4_SGRO0_TDMI0_TIN0_TLDS1_TLDSM1_ULSGRO0_USL1_UIOFGRO0_UPLRP0_USFGRO1_VSn1_VWA1_VWB1_WSGRA0_WSGRB0_WS64_WG16_16_1_WGM1_WGMXCC16_WGMXCCGn1
    SolutionIndex: 12
    SolutionNameMin: Cijk_Alik_Bjlk_S_B_Bias_HA_S_SAV_UserArgs_MT176x64x32_MI16x16x1_SN_LDSB1_AFC0_AG0_AFEM1_AFEM1_ASEM1_CLR1_CADS0_DTLA0_DTLB0_DTVA0_DTVB0_DTVMXSA0_DTVMXSB0_DTVSM0_DPLBn1_EPS1_ELFLR0_EMLLn1_FDSI0_GRPM1_GRVWA1_GRVWB1_GSU0_GSUAMB_GSUC0_GSUWGMRR0_GLS0_ISA950_IU1_K1_LDSTI0_LBSPPA128_LBSPPB1024_LBSPPM0_LPA8_LPB16_LPM0_LRVW4_LWPMn1_MIAV1_MIWT11_1_MO40_MGRIPMn1_NTn1_NTA2_NTB0_NTC0_NTD4_NTM0_NEPBS0_NLCA1_NLCB1_ONLL1_PGR1_PLR1_PKA1_SGROBn1_SIA3_SS1_SU0_SUM0_SUS0_SPO0_SRVW0_SSO0_SVW1_SK3_SKFTR0_SKXCCM4_SGRO0_TDMI0_TIN0_TLDS1_TLDSM1_ULSGRO0_USL1_UIOFGRO0_UPLRP0_USFGRO0_VSn1_VWA1_VWB1_WSGRA0_WSGRB0_WS64_WG16_16_1_WGM8_WGMXCC2_WGMXCCGn1
    SolutionIndex: 13
    SolutionNameMin: Cijk_Alik_Bjlk_S_B_Bias_HA_S_SAV_UserArgs_MT96x128x32_MI16x16x1_SN_LDSB1_AFC0_AG0_AFEM1_AFEM1_ASEM1_CLR1_CADS0_DTLA0_DTLB0_DTVA0_DTVB0_DTVMXSA0_DTVMXSB0_DTVSM0_DPLBn1_EPS0_ELFLR0_EMLLn1_FDSI0_GRPM1_GRVWA4_GRVWB4_GSU0_GSUAMB_GSUC0_GSUWGMRR0_GLS0_ISA950_IU1_K1_LDSTI0_LBSPPA128_LBSPPB2048_LBSPPM0_LPA8_LPB0_LPM0_LRVW4_LWPMn1_MIAV0_MIWT3_4_MO40_MGRIPMn1_NTn1_NTA3_NTB3_NTC0_NTD1_NTM0_NEPBS0_NLCA1_NLCB1_ONLL1_PGR2_PLR1_PKA1_SGROBn1_SIA3_SS1_SU16_SUM1_SUS128_SPO0_SRVW0_SSO0_SVW1_SK3_SKFTR0_SKXCCM8_SGRO0_TDMI0_TIN0_TLDS1_TLDSM1_ULSGRO0_USL1_UIOFGRO0_UPLRP0_USFGRO1_VSn1_VWA1_VWB4_WSGRA0_WSGRB0_WS64_WG32_8_1_WGM4_WGMXCC1_WGMXCCGn1
    SolutionIndex: 14
    SolutionNameMin: Cijk_Alik_Bjlk_S_B_Bias_HA_S_SAV_UserArgs_MT96x96x32_MI16x16x1_SN_LDSB1_AFC0_AG0_AFEM1_AFEM1_ASEM1_CLR1_CADS0_DTLA0_DTLB0_DTVA0_DTVB0_DTVMXSA0_DTVMXSB0_DTVSM0_DPLBn1_EPS0_ELFLR0_EMLLn1_FDSI0_GRPM1_GRVWA4_GRVWB4_GSU0_GSUAMB_GSUC0_GSUWGMRR0_GLS0_ISA950_IU1_K1_LDSTI0_LBSPPA128_LBSPPB1536_LBSPPM0_LPA8_LPB16_LPM0_LRVW4_LWPMn1_MIAV0_MIWT3_3_MO40_MGRIPMn1_NTn1_NTA0_NTB1_NTC0_NTD7_NTM0_NEPBS0_NLCA1_NLCB3_ONLL1_PGR2_PLR1_PKA1_SGROBn1_SIA3_SS1_SU0_SUM0_SUS0_SPO0_SRVW0_SSO1_SVW1_SK3_SKFTR0_SKXCCM0_SGRO0_TDMI0_TIN0_TLDS1_TLDSM1_ULSGRO0_USL1_UIOFGRO0_UPLRP0_USFGROn1_VSn1_VWA1_VWB1_WSGRA0_WSGRB0_WS64_WG32_8_1_WGM32_WGMXCC4_WGMXCCGn1
    SolutionIndex: 15
    SolutionNameMin: Cijk_Alik_Bjlk_S_B_Bias_HA_S_SAV_UserArgs_MT64x160x32_MI16x16x1_SN_LDSB1_AFC0_AG0_AFEM1_AFEM1_ASEM1_CLR1_CADS0_DTLA0_DTLB0_DTVA0_DTVB0_DTVMXSA0_DTVMXSB0_DTVSM0_DPLBn1_EPS0_ELFLR0_EMLLn1_FDSI0_GRPM1_GRVWA4_GRVWB4_GSU0_GSUAMB_GSUC0_GSUWGMRR0_GLS0_ISA950_IU1_K1_LDSTI0_LBSPPA256_LBSPPB2560_LBSPPM0_LPA8_LPB16_LPM0_LRVW4_LWPMn1_MIAV0_MIWT2_5_MO40_MGRIPMn1_NTn1_NTA1_NTB1_NTC2_NTD6_NTM0_NEPBS0_NLCA1_NLCB5_ONLL1_PGR2_PLR1_PKA1_SGROBn1_SIA3_SS1_SU0_SUM0_SUS0_SPO0_SRVW0_SSO1_SVW2_SK3_SKFTR0_SKXCCM0_SGRO0_TDMI0_TIN0_TLDS1_TLDSM1_ULSGRO0_USL1_UIOFGRO0_UPLRP0_USFGRO0_VSn1_VWA2_VWB1_WSGRA0_WSGRB0_WS64_WG32_8_1_WGM4_WGMXCC8_WGMXCCGn1
    SolutionIndex: 16
    SolutionNameMin: Cijk_Alik_Bjlk_S_B_Bias_HA_S_SAV_UserArgs_MT32x16x64_MI16x16x1_SN_LDSB0_AFC0_AG0_AFEM1_AFEM1_ASEM1_CLR1_CADS0_DTLA0_DTLB0_DTVA0_DTVB0_DTVMXSA0_DTVMXSB0_DTVSM0_DPLBn1_EPS0_ELFLR0_EMLLn1_FDSI0_GRPM1_GRVWA4_GRVWB1_GSU0_GSUAMB_GSUC0_GSUWGMRR0_GLS0_ISA950_IU1_K1_LDSTI0_LBSPPA256_LBSPPB256_LBSPPM0_LPA8_LPB16_LPM0_LRVW4_LWPMn1_MIAV0_MIWT1_1_MO40_MGRIPMn1_NTn1_NTA3_NTB0_NTC6_NTD0_NTM0_NEPBS12_NLCA1_NLCB1_ONLL1_PGR2_PLR1_PKA1_SGROBn1_SIA3_SS1_SU0_SUM0_SUS0_SPO0_SRVW0_SSO0_SVW1_SK3_SKFTR0_SKXCCM4_SGRO0_TDMI0_TIN0_TLDS1_TLDSM1_ULSGRO0_USL1_UIOFGRO0_UPLRP0_USFGRO1_VSn1_VWA1_VWB1_WSGRA0_WSGRB0_WS64_WG32_4_2_WGM1_WGMXCC4_WGMXCCGn1
    SolutionIndex: 17
    SolutionNameMin: Cijk_Alik_Bjlk_S_B_Bias_HA_S_SAV_UserArgs_MT16x16x16_MI16x16x1_SN_LDSB1_AFC0_AG0_AFEM1_AFEM1_ASEM1_CLR1_CADS0_DTLA0_DTLB0_DTVA0_DTVB0_DTVMXSA0_DTVMXSB0_DTVSM0_DPLBn1_EPS1_ELFLR0_EMLLn1_FDSI0_GRPM1_GRVWA4_GRVWB1_GSU0_GSUAMB_GSUC0_GSUWGMRR0_GLS0_ISA950_IU1_K1_LDSTI0_LBSPPA64_LBSPPB64_LBSPPM0_LPA0_LPB0_LPM0_LRVW1_LWPMn1_MIAV0_MIWT1_1_MO40_MGRIPMn1_NTn1_NTA4_NTB6_NTC6_NTD7_NTM0_NEPBS12_NLCA1_NLCB1_ONLL1_PGR1_PLR1_PKA1_SGROBn1_SIA3_SS0_SU0_SUM0_SUS0_SPO1_SRVW0_SSO0_SVW4_SK3_SKFTR0_SKXCCM4_SGRO0_TDMI0_TIN0_TLDS0_TLDSM1_ULSGRO0_USL1_UIOFGRO0_UPLRP0_USFGROn1_VSn1_VWA1_VWB1_WSGRA0_WSGRB0_WS64_WG16_4_1_WGM1_WGMXCC1_WGMXCCGn1
    SolutionIndex: 18
    SolutionNameMin: Cijk_Alik_Bjlk_S_B_Bias_HA_S_SAV_UserArgs_MT352x128x32_MI16x16x1_SN_LDSB1_AFC0_AG0_AFEM1_AFEM1_ASEM1_CLR1_CADS0_DTLA0_DTLB0_DTVA0_DTVB0_DTVMXSA0_DTVMXSB0_DTVSM0_DPLB0_EPS0_ELFLR0_EMLL0_FDSI0_GRPM1_GRVWA4_GRVWB4_GSU0_GSUAMB_GSUC0_GSUWGMRR0_GLS0_ISA950_IU1_K1_LDSTI0_LBSPPA128_LBSPPB0_LBSPPM0_LPA8_LPB0_LPM0_LRVWn1_LWPMn1_MIAV0_MIWT11_4_MO40_MGRIPM1_NTn1_NTA4_NTB0_NTC4_NTD0_NTM0_NEPBS0_NLCA1_NLCB1_ONLL1_PGR2_PLR1_PKA1_SGROB0_SIA3_SS0_SU8_SUM0_SUS256_SPO1_SRVW0_SSO4_SVW4_SK3_SKFTR0_SKXCCM0_SGRO0_TDMI0_TIN0_TLDS1_TLDSMn1_ULSGRO1_USL1_UIOFGRO0_UPLRP0_USFGRO1_VSn1_VWA1_VWB4_WSGRA0_WSGRB0_WS64_WG32_8_1_WGMn32_WGMXCC4_WGMXCCGn1
    SolutionIndex: 19
    SolutionNameMin: Cijk_Alik_Bjlk_S_B_Bias_HA_S_SAV_UserArgs_MT416x128x32_MI16x16x1_SN_LDSB1_AFC0_AG1_AFEM1_AFEM1_ASEM1_CLR1_CADS0_DTLA0_DTLB0_DTVA0_DTVB0_DTVMXSA0_DTVMXSB0_DTVSM0_DPLB0_EPS0_ELFLR0_EMLL0_FDSI0_GRPM1_GRVWA4_GRVWB4_GSU0_GSUAMB_GSUC0_GSUWGMRR0_GLS0_ISA950_IU1_K1_LDSTI0_LBSPPA128_LBSPPB0_LBSPPM0_LPA8_LPB0_LPM0_LRVWn1_LWPMn1_MIAV0_MIWT13_4_MO40_MGRIPM1_NTn1_NTA4_NTB0_NTC0_NTD0_NTM0_NEPBS16_NLCA1_NLCB1_ONLL1_PGR2_PLR1_PKA1_SGROB0_SIA3_SS0_SU8_SUM0_SUS128_SPO0_SRVW0_SSO1_SVW4_SK3_SKFTR0_SKXCCM4_SGRO0_TDMI0_TIN0_TLDS1_TLDSMn1_ULSGRO0_USL1_UIOFGRO0_UPLRP0_USFGRO0_VSn1_VWA1_VWB4_WSGRA0_WSGRB2_WS64_WG32_8_1_WGM8_WGMXCC4_WGMXCCGn1
    SolutionIndex: 20
    SolutionNameMin: Cijk_Alik_Bjlk_S_B_Bias_HA_S_SAV_UserArgs_MT512x128x32_MI16x16x1_SN_LDSB1_AFC0_AG1_AFEM1_AFEM1_ASEM1_CLR1_CADS0_DTLA0_DTLB0_DTVA0_DTVB0_DTVMXSA0_DTVMXSB0_DTVSM0_DPLB0_EPS0_ELFLR0_EMLLn1_FDSI0_GRPM1_GRVWA4_GRVWB4_GSU0_GSUAMB_GSUC0_GSUWGMRR0_GLS0_ISA950_IU1_K1_LDSTI0_LBSPPA512_LBSPPB0_LBSPPM0_LPA8_LPB0_LPM0_LRVWn1_LWPMn1_MIAV0_MIWT8_8_MO40_MGRIPM1_NTn1_NTA0_NTB0_NTC0_NTD0_NTM0_NEPBS0_NLCA1_NLCB1_ONLL1_PGR2_PLR1_PKA1_SGROB0_SIA3_SS1_SU0_SUM0_SUS0_SPO0_SRVW0_SSO1_SVW4_SK3_SKFTR0_SKXCCM4_SGRO0_TDMI0_TIN1_TLDS1_TLDSMn1_ULSGRO1_USL1_UIOFGRO0_UPLRP0_USFGRO1_VSn1_VWA4_VWB4_WSGRA0_WSGRB0_WS64_WG64_4_1_WGM4_WGMXCC1_WGMXCCGn1
    SolutionIndex: 21
    SolutionNameMin: Cijk_Alik_Bjlk_S_B_Bias_HA_S_SAV_UserArgs_MT384x64x32_MI32x32x1_SN_LDSB1_AFC0_AG1_AFEM1_AFEM1_ASEM1_CLR1_CADS0_DTLA0_DTLB0_DTVA0_DTVB0_DTVMXSA0_DTVMXSB0_DTVSM0_DPLB0_EPS0_ELFLR0_EMLL0_FDSI0_GRPM1_GRVWA4_GRVWB4_GSU0_GSUAMB_GSUC0_GSUWGMRR0_GLS0_ISA950_IU1_K1_LDSTI0_LBSPPA128_LBSPPB0_LBSPPM0_LPA4_LPB0_LPM0_LRVWn1_LWPMn1_MIAV0_MIWT3_2_MO40_MGRIPM1_NTn1_NTA0_NTB0_NTC0_NTD0_NTM0_NEPBS0_NLCA1_NLCB1_ONLL1_PGR2_PLR1_PKA1_SGROB0_SIA3_SS1_SU0_SUM0_SUS0_SPO0_SRVW0_SSO1_SVW1_SK3_SKFTR0_SKXCCM0_SGRO0_TDMI0_TIN1_TLDS1_TLDSMn1_ULSGRO0_USL1_UIOFGRO0_UPLRP0_USFGRO1_VSn1_VWA1_VWB2_WSGRA0_WSGRB0_WS64_WG128_2_1_WGM6_WGMXCC8_WGMXCCGn1
    SolutionIndex: 22
    SolutionNameMin: Cijk_Alik_Bjlk_S_B_Bias_HA_S_SAV_UserArgs_MT96x320x32_MI16x16x1_SN_LDSB1_AFC0_AG1_AFEM1_AFEM1_ASEM1_CLR0_CADS0_DTLA0_DTLB0_DTVA0_DTVB0_DTVMXSA0_DTVMXSB0_DTVSM0_DPLB0_EPS0_ELFLR0_EMLLn1_FDSI0_GRPM1_GRVWA4_GRVWB4_GSU0_GSUAMB_GSUC0_GSUWGMRR0_GLS0_ISA950_IU1_K1_LDSTI1_LBSPPA0_LBSPPB1280_LBSPPM0_LPA0_LPB16_LPM0_LRVWn1_LWPMn1_MIAV0_MIWT6_5_MO40_MGRIPM1_NTn1_NTA0_NTB0_NTC4_NTD4_NTM0_NEPBS0_NLCA1_NLCB5_ONLL1_PGR2_PLR1_PKA1_SGROB0_SIA3_SS1_SU0_SUM0_SUS0_SPO0_SRVW0_SSO1_SVW2_SK3_SKFTR0_SKXCCM4_SGRO0_TDMI0_TIN1_TLDS0_TLDSMn1_ULSGRO0_USL1_UIOFGRO0_UPLRP0_USFGRO1_VSn1_VWA2_VWB1_WSGRA0_WSGRB0_WS64_WG16_16_1_WGMn1_WGMXCC1_WGMXCCGn1
    SolutionIndex: 23
    SolutionNameMin: Cijk_Alik_Bjlk_S_B_Bias_HA_S_SAV_UserArgs_MT128x352x32_MI16x16x1_SN_LDSB0_AFC0_AG1_AFEM1_AFEM1_ASEM1_CLR1_CADS0_DTLA0_DTLB0_DTVA0_DTVB0_DTVMXSA0_DTVMXSB0_DTVSM0_DPLB0_EPS1_ELFLR0_EMLL0_FDSI0_GRPM1_GRVWA4_GRVWB4_GSU0_GSUAMB_GSUC0_GSUWGMRR0_GLS0_ISA950_IU1_K1_LDSTI0_LBSPPA512_LBSPPB5632_LBSPPM0_LPA8_LPB16_LPM0_LRVWn1_LWPMn1_MIAV0_MIWT4_11_MO40_MGRIPM1_NTn1_NTA0_NTB0_NTC4_NTD4_NTM0_NEPBS16_NLCA1_NLCB11_ONLL1_PGR1_PLR1_PKA1_SGROB0_SIA3_SS1_SU0_SUM0_SUS0_SPO0_SRVW0_SSO1_SVW4_SK3_SKFTR0_SKXCCM0_SGRO0_TDMI0_TIN1_TLDS1_TLDSMn1_ULSGRO0_USL1_UIOFGRO0_UPLRP0_USFGRO1_VSn1_VWA4_VWB1_WSGRA0_WSGRB0_WS64_WG32_8_1_WGM4_WGMXCC2_WGMXCCGn1
    SolutionIndex: 24
    SolutionNameMin: Cijk_Alik_Bjlk_S_B_Bias_HA_S_SAV_UserArgs_MT256x128x32_MI16x16x1_SN_LDSB1_AFC0_AG1_AFEM1_AFEM1_ASEM1_CLR0_CADS0_DTLA0_DTLB0_DTVA0_DTVB0_DTVMXSA0_DTVMXSB0_DTVSM0_DPLB0_EPS0_ELFLR0_EMLL0_FDSI0_GRPM1_GRVWA4_GRVWB4_GSU0_GSUAMB_GSUC0_GSUWGMRR0_GLS0_ISA950_IU1_K1_LDSTI1_LBSPPA0_LBSPPB0_LBSPPM0_LPA0_LPB0_LPM0_LRVWn1_LWPMn1_MIAV0_MIWT4_8_MO40_MGRIPM1_NTn1_NTA0_NTB0_NTC4_NTD4_NTM0_NEPBS8_NLCA1_NLCB1_ONLL1_PGR2_PLR1_PKA1_SGROB0_SIA3_SS1_SU8_SUM0_SUS256_SPO1_SRVW0_SSO1_SVW4_SK3_SKFTR0_SKXCCM0_SGRO0_TDMI0_TIN0_TLDS0_TLDSMn1_ULSGRO0_USL1_UIOFGRO0_UPLRP0_USFGRO1_VSn1_VWA4_VWB4_WSGRA0_WSGRB2_WS64_WG64_4_1_WGMn4_WGMXCC8_WGMXCCGn1
    SolutionIndex: 25
    SolutionNameMin: Cijk_Alik_Bjlk_S_B_Bias_HA_S_SAV_UserArgs_MT256x256x32_MI32x32x1_SN_LDSB1_AFC0_AG0_AFEM1_AFEM1_ASEM1_CLR1_CADS0_DTLA0_DTLB0_DTVA0_DTVB0_DTVMXSA0_DTVMXSB0_DTVSM0_DPLB0_EPS1_ELFLR0_EMLL0_FDSI0_GRPM1_GRVWA4_GRVWB4_GSU0_GSUAMB_GSUC0_GSUWGMRR0_GLS0_ISA950_IU1_K1_LDSTI0_LBSPPA512_LBSPPB0_LBSPPM0_LPA4_LPB0_LPM0_LRVWn1_LWPMn1_MIAV0_MIWT4_4_MO40_MGRIPM1_NTn1_NTA0_NTB0_NTC4_NTD4_NTM0_NEPBS8_NLCA1_NLCB1_ONLL1_PGR1_PLR1_PKA1_SGROB0_SIA3_SS1_SU0_SUM0_SUS0_SPO0_SRVW0_SSO1_SVW4_SK3_SKFTR0_SKXCCM0_SGRO0_TDMI0_TIN1_TLDS1_TLDSMn1_ULSGRO0_USL1_UIOFGRO0_UPLRP0_USFGRO0_VSn1_VWA4_VWB4_WSGRA2_WSGRB0_WS64_WG64_4_1_WGM16_WGMXCC32_WGMXCCGn1
    SolutionIndex: 26
    SolutionNameMin: Cijk_Alik_Bjlk_S_B_Bias_HA_S_SAV_UserArgs_MT256x240x32_MI16x16x1_SN_LDSB1_AFC0_AG1_AFEM1_AFEM1_ASEM1_CLR1_CADS0_DTLA0_DTLB0_DTVA0_DTVB0_DTVMXSA0_DTVMXSB0_DTVSM0_DPLB0_EPS0_ELFLR0_EMLL0_FDSI0_GRPM1_GRVWA4_GRVWB2_GSU0_GSUAMB_GSUC0_GSUWGMRR0_GLS0_ISA950_IU1_K1_LDSTI0_LBSPPA512_LBSPPB3840_LBSPPM0_LPA8_LPB16_LPM0_LRVWn1_LWPMn1_MIAV0_MIWT4_15_MO40_MGRIPM1_NTn1_NTA0_NTB0_NTC0_NTD0_NTM0_NEPBS10_NLCA1_NLCB15_ONLL1_PGR2_PLR1_PKA1_SGROB0_SIA3_SS1_SU0_SUM0_SUS0_SPO0_SRVW0_SSO1_SVW4_SK3_SKFTR0_SKXCCM8_SGRO0_TDMI0_TIN1_TLDS1_TLDSMn1_ULSGRO0_USL1_UIOFGRO0_UPLRP0_USFGRO0_VSn1_VWA4_VWB1_WSGRA0_WSGRB0_WS64_WG64_4_1_WGM2_WGMXCC1_WGMXCCGn1
    SolutionIndex: 27
    SolutionNameMin: Cijk_Alik_Bjlk_S_B_Bias_HA_S_SAV_UserArgs_MT256x128x32_MI32x32x1_SN_LDSB1_AFC0_AG1_AFEM1_AFEM1_ASEM1_CLR1_CADS0_DTLA0_DTLB0_DTVA0_DTVB0_DTVMXSA0_DTVMXSB0_DTVSM0_DPLB0_EPS1_ELFLR0_EMLL0_FDSI0_GRPM1_GRVWA4_GRVWB1_GSU0_GSUAMB_GSUC0_GSUWGMRR0_GLS0_ISA950_IU1_K1_LDSTI0_LBSPPA512_LBSPPB0_LBSPPM0_LPA4_LPB0_LPM0_LRVWn1_LWPMn1_MIAV0_MIWT8_1_MO40_MGRIPM1_NTn1_NTA0_NTB0_NTC4_NTD4_NTM0_NEPBS12_NLCA1_NLCB2_ONLL1_PGR1_PLR1_PKA1_SGROB0_SIA3_SS1_SU0_SUM0_SUS0_SPO1_SRVW0_SSO1_SVW4_SK3_SKFTR0_SKXCCM0_SGRO0_TDMI0_TIN1_TLDS1_TLDSMn1_ULSGRO0_USL1_UIOFGRO0_UPLRP0_USFGRO1_VSn1_VWA4_VWB1_WSGRA2_WSGRB2_WS64_WG32_8_1_WGM4_WGMXCC8_WGMXCCGn1
    SolutionIndex: 28
    SolutionNameMin: Cijk_Alik_Bjlk_S_B_Bias_HA_S_SAV_UserArgs_MT128x160x32_MI16x16x1_SN_LDSB1_AFC0_AG0_AFEM1_AFEM1_ASEM1_CLR1_CADS0_DTLA0_DTLB0_DTVA0_DTVB0_DTVMXSA0_DTVMXSB0_DTVSM0_DPLB0_EPS0_ELFLR0_EMLL0_FDSI0_GRPM1_GRVWA4_GRVWB4_GSU0_GSUAMB_GSUC0_GSUWGMRR0_GLS0_ISA950_IU1_K1_LDSTI0_LBSPPA512_LBSPPB128_LBSPPM0_LPA8_LPB8_LPM0_LRVWn1_LWPMn1_MIAV1_MIWT4_5_MO40_MGRIPM1_NTn1_NTA0_NTB0_NTC4_NTD4_NTM0_NEPBS8_NLCA1_NLCB5_ONLL1_PGR2_PLR1_PKA1_SGROB0_SIA3_SS1_SU0_SUM0_SUS0_SPO0_SRVW0_SSO1_SVW4_SK3_SKFTR0_SKXCCM0_SGRO0_TDMI0_TIN1_TLDS2_TLDSMn1_ULSGRO0_USL1_UIOFGRO0_UPLRP0_USFGRO0_VSn1_VWA4_VWB1_WSGRA2_WSGRB0_WS64_WG32_8_1_WGM8_WGMXCC1_WGMXCCGn1
    SolutionIndex: 29
    SolutionNameMin: Cijk_Alik_Bjlk_S_B_Bias_HA_S_SAV_UserArgs_MT128x160x32_MI16x16x1_SN_LDSB1_AFC0_AG1_AFEM1_AFEM1_ASEM1_CLR1_CADS0_DTLA0_DTLB0_DTVA0_DTVB0_DTVMXSA0_DTVMXSB0_DTVSM0_DPLB0_EPS0_ELFLR0_EMLLn1_FDSI0_GRPM1_GRVWA4_GRVWB2_GSU0_GSUAMB_GSUC0_GSUWGMRR0_GLS0_ISA950_IU1_K1_LDSTI0_LBSPPA512_LBSPPB2560_LBSPPM0_LPA8_LPB16_LPM0_LRVWn1_LWPMn1_MIAV0_MIWT4_5_MO40_MGRIPM1_NTn1_NTA0_NTB0_NTC4_NTD4_NTM0_NEPBS16_NLCA1_NLCB5_ONLL1_PGR2_PLR1_PKA1_SGROB0_SIA3_SS1_SU0_SUM0_SUS0_SPO0_SRVW0_SSO1_SVW4_SK3_SKFTR0_SKXCCM0_SGRO0_TDMI0_TIN1_TLDS1_TLDSMn1_ULSGRO0_USL1_UIOFGRO0_UPLRP0_USFGRO0_VSn1_VWA4_VWB1_WSGRA2_WSGRB0_WS64_WG32_8_1_WGM2_WGMXCC16_WGMXCCGn1
    SolutionIndex: 30
    SolutionNameMin: Cijk_Alik_Bjlk_S_B_Bias_HA_S_SAV_UserArgs_MT160x128x32_MI16x16x1_SN_LDSB1_AFC0_AG1_AFEM1_AFEM1_ASEM1_CLR1_CADS0_DTLA0_DTLB0_DTVA0_DTVB0_DTVMXSA0_DTVMXSB0_DTVSM0_DPLB0_EPS1_ELFLR0_EMLLn1_FDSI0_GRPM1_GRVWA4_GRVWB1_GSU0_GSUAMB_GSUC0_GSUWGMRR0_GLS0_ISA950_IU1_K1_LDSTI0_LBSPPA256_LBSPPB0_LBSPPM0_LPA8_LPB0_LPM0_LRVWn1_LWPMn1_MIAV0_MIWT10_2_MO40_MGRIPM1_NTn1_NTA0_NTB0_NTC4_NTD4_NTM0_NEPBS0_NLCA1_NLCB2_ONLL1_PGR1_PLR1_PKA1_SGROB0_SIA3_SS1_SU0_SUM0_SUS0_SPO0_SRVW0_SSO1_SVW2_SK3_SKFTR0_SKXCCM0_SGRO0_TDMI0_TIN1_TLDS1_TLDSMn1_ULSGRO0_USL1_UIOFGRO0_UPLRP0_USFGRO1_VSn1_VWA2_VWB2_WSGRA0_WSGRB2_WS64_WG16_16_1_WGMn1_WGMXCC4_WGMXCCGn1
    SolutionIndex: 31
    SolutionNameMin: Cijk_Alik_Bjlk_S_B_Bias_HA_S_SAV_UserArgs_MT384x64x32_MI16x16x1_SN_LDSB1_AFC0_AG1_AFEM1_AFEM1_ASEM1_CLR1_CADS0_DTLA0_DTLB0_DTVA0_DTVB0_DTVMXSA0_DTVMXSB0_DTVSM0_DPLB0_EPS1_ELFLR0_EMLL0_FDSI0_GRPM1_GRVWA4_GRVWB1_GSU0_GSUAMB_GSUC0_GSUWGMRR0_GLS0_ISA950_IU1_K1_LDSTI0_LBSPPA256_LBSPPB0_LBSPPM0_LPA8_LPB0_LPM0_LRVWn1_LWPMn1_MIAV0_MIWT6_4_MO40_MGRIPM1_NTn1_NTA0_NTB0_NTC4_NTD4_NTM0_NEPBS16_NLCA1_NLCB1_ONLL1_PGR1_PLR1_PKA1_SGROB0_SIA3_SS1_SU0_SUM0_SUS0_SPO0_SRVW0_SSO0_SVW2_SK3_SKFTR0_SKXCCM0_SGRO0_TDMI0_TIN1_TLDS1_TLDSMn1_ULSGRO0_USL1_UIOFGRO0_UPLRP0_USFGRO1_VSn1_VWA2_VWB4_WSGRA2_WSGRB0_WS64_WG64_4_1_WGM48_WGMXCC16_WGMXCCGn1
    SolutionIndex: 32
    SolutionNameMin: Cijk_Alik_Bjlk_S_B_Bias_HA_S_SAV_UserArgs_MT256x80x32_MI16x16x1_SN_LDSB1_AFC0_AG1_AFEM1_AFEM1_ASEM1_CLR1_CADS0_DTLA0_DTLB0_DTVA0_DTVB0_DTVMXSA0_DTVMXSB0_DTVSM0_DPLB0_EPS0_ELFLR0_EMLLn1_FDSI0_GRPM1_GRVWA4_GRVWB1_GSU0_GSUAMB_GSUC0_GSUWGMRR0_GLS0_ISA950_IU1_K1_LDSTI0_LBSPPA512_LBSPPB1280_LBSPPM0_LPA8_LPB16_LPM0_LRVWn1_LWPMn1_MIAV0_MIWT4_5_MO40_MGRIPM1_NTn1_NTA0_NTB0_NTC0_NTD0_NTM0_NEPBS8_NLCA1_NLCB5_ONLL1_PGR2_PLR1_PKA1_SGROB0_SIA3_SS1_SU0_SUM0_SUS0_SPO0_SRVW0_SSO1_SVW4_SK3_SKFTR0_SKXCCM0_SGRO0_TDMI0_TIN1_TLDS1_TLDSMn1_ULSGRO0_USL1_UIOFGRO0_UPLRP0_USFGRO1_VSn1_VWA4_VWB1_WSGRA2_WSGRB2_WS64_WG64_4_1_WGM4_WGMXCC4_WGMXCCGn1
    SolutionIndex: 33
    SolutionNameMin: Cijk_Alik_Bjlk_S_B_Bias_HA_S_SAV_UserArgs_MT128x80x32_MI16x16x1_SN_LDSB1_AFC0_AG0_AFEM1_AFEM1_ASEM1_CLR1_CADS0_DTLA0_DTLB0_DTVA0_DTVB0_DTVMXSA0_DTVMXSB0_DTVSM0_DPLB0_EPS1_ELFLR0_EMLLn1_FDSI0_GRPM1_GRVWA4_GRVWB1_GSU0_GSUAMB_GSUC0_GSUWGMRR0_GLS0_ISA950_IU1_K1_LDSTI0_LBSPPA256_LBSPPB128_LBSPPM0_LPA8_LPB8_LPM0_LRVWn1_LWPMn1_MIAV0_MIWT2_5_MO40_MGRIPM1_NTn1_NTA0_NTB0_NTC4_NTD4_NTM0_NEPBS10_NLCA1_NLCB5_ONLL1_PGR1_PLR1_PKA1_SGROB0_SIA3_SS1_SU0_SUM0_SUS0_SPO1_SRVW0_SSO0_SVW2_SK3_SKFTR0_SKXCCM0_SGRO0_TDMI0_TIN1_TLDS2_TLDSMn1_ULSGRO0_USL1_UIOFGRO0_UPLRP0_USFGRO0_VSn1_VWA2_VWB1_WSGRA0_WSGRB0_WS64_WG64_4_1_WGMn2_WGMXCC1_WGMXCCGn1
    SolutionIndex: 34
    SolutionNameMin: Cijk_Alik_Bjlk_S_B_Bias_HA_S_SAV_UserArgs_MT192x96x32_MI16x16x1_SN_LDSB1_AFC0_AG1_AFEM1_AFEM1_ASEM1_CLR0_CADS0_DTLA0_DTLB0_DTVA0_DTVB0_DTVMXSA0_DTVMXSB0_DTVSM0_DPLB0_EPS0_ELFLR0_EMLL0_FDSI0_GRPM1_GRVWA4_GRVWB4_GSU0_GSUAMB_GSUC0_GSUWGMRR0_GLS0_ISA950_IU1_K1_LDSTI1_LBSPPA0_LBSPPB384_LBSPPM0_LPA0_LPB16_LPM0_LRVWn1_LWPMn1_MIAV1_MIWT6_3_MO40_MGRIPM1_NTn1_NTA0_NTB0_NTC4_NTD4_NTM0_NEPBS10_NLCA1_NLCB3_ONLL1_PGR2_PLR1_PKA1_SGROB0_SIA3_SS1_SU0_SUM0_SUS0_SPO1_SRVW0_SSO0_SVW2_SK3_SKFTR0_SKXCCM0_SGRO0_TDMI0_TIN1_TLDS0_TLDSMn1_ULSGRO0_USL1_UIOFGRO0_UPLRP0_USFGRO0_VSn1_VWA2_VWB1_WSGRA0_WSGRB0_WS64_WG32_8_1_WGM2_WGMXCC1_WGMXCCGn1
    SolutionIndex: 35
    SolutionNameMin: Cijk_Alik_Bjlk_S_B_Bias_HA_S_SAV_UserArgs_MT256x96x32_MI16x16x1_SN_LDSB1_AFC0_AG1_AFEM1_AFEM1_ASEM1_CLR1_CADS0_DTLA0_DTLB0_DTVA0_DTVB0_DTVMXSA0_DTVMXSB0_DTVSM0_DPLB0_EPS1_ELFLR0_EMLL0_FDSI0_GRPM1_GRVWA4_GRVWB1_GSU0_GSUAMB_GSUC0_GSUWGMRR0_GLS0_ISA950_IU1_K1_LDSTI0_LBSPPA512_LBSPPB0_LBSPPM0_LPA8_LPB0_LPM0_LRVWn1_LWPMn1_MIAV0_MIWT4_6_MO40_MGRIPM1_NTn1_NTA0_NTB0_NTC4_NTD4_NTM0_NEPBS14_NLCA1_NLCB3_ONLL1_PGR1_PLR1_PKA1_SGROB0_SIA3_SS1_SU16_SUM0_SUS128_SPO0_SRVW0_SSO1_SVW4_SK3_SKFTR0_SKXCCM0_SGRO0_TDMI0_TIN0_TLDS1_TLDSMn1_ULSGRO0_USL1_UIOFGRO0_UPLRP0_USFGRO0_VSn1_VWA4_VWB2_WSGRA0_WSGRB0_WS64_WG64_4_1_WGMn2_WGMXCC2_WGMXCCGn1
    SolutionIndex: 36
    SolutionNameMin: Cijk_Alik_Bjlk_S_B_Bias_HA_S_SAV_UserArgs_MT128x160x32_MI16x16x1_SN_LDSB1_AFC0_AG1_AFEM1_AFEM1_ASEM1_CLR1_CADS0_DTLA0_DTLB0_DTVA0_DTVB0_DTVMXSA0_DTVMXSB0_DTVSM0_DPLB0_EPS0_ELFLR0_EMLL0_FDSI0_GRPM1_GRVWA2_GRVWB4_GSU0_GSUAMB_GSUC0_GSUWGMRR0_GLS0_ISA950_IU1_K1_LDSTI0_LBSPPA512_LBSPPB2560_LBSPPM0_LPA8_LPB16_LPM0_LRVWn1_LWPMn1_MIAV0_MIWT4_5_MO40_MGRIPM1_NTn1_NTA0_NTB0_NTC0_NTD0_NTM0_NEPBS8_NLCA1_NLCB5_ONLL1_PGR2_PLR1_PKA1_SGROB0_SIA3_SS1_SU8_SUM0_SUS256_SPO0_SRVW0_SSO1_SVW4_SK3_SKFTR0_SKXCCM4_SGRO0_TDMI0_TIN0_TLDS1_TLDSMn1_ULSGRO0_USL1_UIOFGRO0_UPLRP0_USFGRO1_VSn1_VWA4_VWB1_WSGRA0_WSGRB0_WS64_WG32_8_1_WGM2_WGMXCC1_WGMXCCGn1
    SolutionIndex: 37
    SolutionNameMin: Cijk_Alik_Bjlk_S_B_Bias_HA_S_SAV_UserArgs_MT96x160x32_MI16x16x1_SN_LDSB1_AFC0_AG0_AFEM1_AFEM1_ASEM1_CLR1_CADS0_DTLA0_DTLB0_DTVA0_DTVB0_DTVMXSA0_DTVMXSB0_DTVSM0_DPLB0_EPS0_ELFLR0_EMLLn1_FDSI0_GRPM1_GRVWA4_GRVWB4_GSU0_GSUAMB_GSUC0_GSUWGMRR0_GLS0_ISA950_IU1_K1_LDSTI0_LBSPPA128_LBSPPB2560_LBSPPM0_LPA8_LPB16_LPM0_LRVWn1_LWPMn1_MIAV1_MIWT3_5_MO40_MGRIPM1_NTn1_NTA0_NTB0_NTC0_NTD0_NTM0_NEPBS0_NLCA1_NLCB5_ONLL1_PGR2_PLR1_PKA1_SGROB0_SIA3_SS1_SU0_SUM0_SUS0_SPO1_SRVW0_SSO1_SVW1_SK3_SKFTR0_SKXCCM0_SGRO0_TDMI0_TIN1_TLDS1_TLDSMn1_ULSGRO0_USL1_UIOFGRO0_UPLRP0_USFGRO1_VSn1_VWA1_VWB1_WSGRA2_WSGRB0_WS64_WG32_8_1_WGM16_WGMXCC1_WGMXCCGn1
    SolutionIndex: 38
    SolutionNameMin: Cijk_Alik_Bjlk_S_B_Bias_HA_S_SAV_UserArgs_MT64x144x32_MI16x16x1_SN_LDSB1_AFC0_AG1_AFEM1_AFEM1_ASEM1_CLR1_CADS0_DTLA0_DTLB0_DTVA0_DTVB0_DTVMXSA0_DTVMXSB0_DTVSM0_DPLB0_EPS0_ELFLR0_EMLLn1_FDSI0_GRPM1_GRVWA4_GRVWB2_GSU0_GSUAMB_GSUC0_GSUWGMRR0_GLS0_ISA950_IU1_K1_LDSTI0_LBSPPA128_LBSPPB2304_LBSPPM0_LPA8_LPB16_LPM0_LRVWn1_LWPMn1_MIAV1_MIWT1_9_MO40_MGRIPM1_NTn1_NTA0_NTB0_NTC0_NTD0_NTM0_NEPBS0_NLCA1_NLCB9_ONLL1_PGR2_PLR1_PKA1_SGROB0_SIA3_SS1_SU0_SUM0_SUS0_SPO1_SRVW0_SSO0_SVW1_SK3_SKFTR0_SKXCCM8_SGRO0_TDMI0_TIN1_TLDS1_TLDSMn1_ULSGRO0_USL1_UIOFGRO0_UPLRP0_USFGRO1_VSn1_VWA1_VWB1_WSGRA2_WSGRB0_WS64_WG64_4_1_WGMn1_WGMXCC1_WGMXCCGn1
    SolutionIndex: 39
    SolutionNameMin: Cijk_Alik_Bjlk_S_B_Bias_HA_S_SAV_UserArgs_MT256x96x32_MI16x16x1_SN_LDSB1_AFC0_AG1_AFEM1_AFEM1_ASEM1_CLR1_CADS0_DTLA0_DTLB0_DTVA0_DTVB0_DTVMXSA0_DTVMXSB0_DTVSM0_DPLB0_EPS1_ELFLR0_EMLLn1_FDSI0_GRPM1_GRVWA4_GRVWB1_GSU0_GSUAMB_GSUC0_GSUWGMRR0_GLS0_ISA950_IU1_K1_LDSTI0_LBSPPA512_LBSPPB256_LBSPPM0_LPA8_LPB8_LPM0_LRVWn1_LWPMn1_MIAV0_MIWT4_6_MO40_MGRIPM1_NTn1_NTA0_NTB0_NTC4_NTD4_NTM0_NEPBS8_NLCA1_NLCB3_ONLL1_PGR1_PLR1_PKA1_SGROB0_SIA3_SS1_SU0_SUM0_SUS0_SPO0_SRVW0_SSO1_SVW4_SK3_SKFTR0_SKXCCM4_SGRO0_TDMI0_TIN1_TLDS2_TLDSMn1_ULSGRO0_USL1_UIOFGRO0_UPLRP0_USFGRO1_VSn1_VWA4_VWB2_WSGRA0_WSGRB2_WS64_WG64_4_1_WGMn48_WGMXCC1_WGMXCCGn1
    SolutionIndex: 40
    SolutionNameMin: Cijk_Alik_Bjlk_S_B_Bias_HA_S_SAV_UserArgs_MT128x160x32_MI16x16x1_SN_LDSB1_AFC0_AG0_AFEM1_AFEM1_ASEM1_CLR1_CADS0_DTLA0_DTLB0_DTVA0_DTVB0_DTVMXSA0_DTVMXSB0_DTVSM0_DPLB0_EPS1_ELFLR0_EMLL0_FDSI0_GRPM1_GRVWA4_GRVWB2_GSU0_GSUAMB_GSUC0_GSUWGMRR0_GLS0_ISA950_IU1_K1_LDSTI0_LBSPPA512_LBSPPB2560_LBSPPM0_LPA8_LPB16_LPM0_LRVWn1_LWPMn1_MIAV0_MIWT4_5_MO40_MGRIPM1_NTn1_NTA0_NTB0_NTC4_NTD4_NTM0_NEPBS0_NLCA1_NLCB5_ONLL1_PGR1_PLR1_PKA1_SGROB0_SIA3_SS1_SU0_SUM0_SUS0_SPO0_SRVW0_SSO1_SVW4_SK3_SKFTR0_SKXCCM0_SGRO0_TDMI0_TIN1_TLDS1_TLDSMn1_ULSGRO0_USL1_UIOFGRO0_UPLRP0_USFGRO0_VSn1_VWA4_VWB1_WSGRA0_WSGRB0_WS64_WG32_8_1_WGM4_WGMXCC8_WGMXCCGn1
    SolutionIndex: 41
    SolutionNameMin: Cijk_Alik_Bjlk_S_B_Bias_HA_S_SAV_UserArgs_MT208x256x32_MI16x16x1_SN_LDSB1_AFC0_AG1_AFEM1_AFEM1_ASEM1_CLR1_CADS0_DTLA0_DTLB0_DTVA0_DTVB0_DTVMXSA0_DTVMXSB0_DTVSM0_DPLB0_EPS0_ELFLR0_EMLLn1_FDSI0_GRPM1_GRVWA2_GRVWB4_GSU0_GSUAMB_GSUC0_GSUWGMRR0_GLS0_ISA950_IU1_K1_LDSTI0_LBSPPA128_LBSPPB0_LBSPPM0_LPA8_LPB0_LPM0_LRVWn1_LWPMn1_MIAV0_MIWT13_4_MO40_MGRIPM1_NTn1_NTA0_NTB0_NTC0_NTD0_NTM0_NEPBS0_NLCA1_NLCB1_ONLL1_PGR2_PLR1_PKA1_SGROB0_SIA3_SS1_SU0_SUM0_SUS0_SPO1_SRVW0_SSO1_SVW1_SK3_SKFTR0_SKXCCM0_SGRO0_TDMI0_TIN1_TLDS1_TLDSMn1_ULSGRO0_USL1_UIOFGRO0_UPLRP0_USFGRO1_VSn1_VWA1_VWB4_WSGRA0_WSGRB0_WS64_WG16_16_1_WGM8_WGMXCC4_WGMXCCGn1
    SolutionIndex: 42
    SolutionNameMin: Cijk_Alik_Bjlk_S_B_Bias_HA_S_SAV_UserArgs_MT256x96x32_MI16x16x1_SN_LDSB1_AFC0_AG0_AFEM1_AFEM1_ASEM1_CLR1_CADS0_DTLA0_DTLB0_DTVA0_DTVB0_DTVMXSA0_DTVMXSB0_DTVSM0_DPLB0_EPS0_ELFLR0_EMLLn1_FDSI0_GRPM1_GRVWA4_GRVWB1_GSU0_GSUAMB_GSUC0_GSUWGMRR0_GLS0_ISA950_IU1_K1_LDSTI0_LBSPPA512_LBSPPB0_LBSPPM0_LPA8_LPB0_LPM0_LRVWn1_LWPMn1_MIAV0_MIWT4_6_MO40_MGRIPM1_NTn1_NTA0_NTB4_NTC4_NTD4_NTM0_NEPBS16_NLCA1_NLCB3_ONLL1_PGR2_PLR1_PKA1_SGROB0_SIA3_SS1_SU0_SUM0_SUS0_SPO0_SRVW0_SSO1_SVW4_SK3_SKFTR0_SKXCCM0_SGRO0_TDMI0_TIN1_TLDS1_TLDSMn1_ULSGRO0_USL1_UIOFGRO0_UPLRP0_USFGRO1_VSn1_VWA4_VWB2_WSGRA0_WSGRB2_WS64_WG64_4_1_WGM4_WGMXCC4_WGMXCCGn1
    SolutionIndex: 43
    SolutionNameMin: Cijk_Alik_Bjlk_S_B_Bias_HA_S_SAV_UserArgs_MT128x192x32_MI16x16x1_SN_LDSB1_AFC0_AG0_AFEM1_AFEM1_ASEM1_CLR1_CADS0_DTLA0_DTLB0_DTVA0_DTVB0_DTVMXSA0_DTVMXSB0_DTVSM0_DPLB0_EPS0_ELFLR0_EMLLn1_FDSI0_GRPM1_GRVWA4_GRVWB2_GSU0_GSUAMB_GSUC0_GSUWGMRR0_GLS0_ISA950_IU1_K1_LDSTI0_LBSPPA512_LBSPPB3072_LBSPPM0_LPA8_LPB16_LPM0_LRVWn1_LWPMn1_MIAV0_MIWT8_3_MO40_MGRIPM1_NTn1_NTA0_NTB0_NTC4_NTD4_NTM0_NEPBS12_NLCA1_NLCB3_ONLL1_PGR2_PLR1_PKA1_SGROB0_SIA3_SS1_SU0_SUM0_SUS0_SPO0_SRVW0_SSO1_SVW4_SK3_SKFTR0_SKXCCM0_SGRO0_TDMI0_TIN0_TLDS1_TLDSMn1_ULSGRO0_USL1_UIOFGRO0_UPLRP0_USFGRO1_VSn1_VWA4_VWB1_WSGRA2_WSGRB2_WS64_WG16_16_1_WGMn4_WGMXCC2_WGMXCCGn1
    SolutionIndex: 44
    SolutionNameMin: Cijk_Alik_Bjlk_S_B_Bias_HA_S_SAV_UserArgs_MT160x128x32_MI16x16x1_SN_LDSB1_AFC0_AG1_AFEM1_AFEM1_ASEM1_CLR1_CADS0_DTLA0_DTLB0_DTVA0_DTVB0_DTVMXSA0_DTVMXSB0_DTVSM0_DPLB0_EPS0_ELFLR0_EMLLn1_FDSI0_GRPM1_GRVWA4_GRVWB4_GSU0_GSUAMB_GSUC0_GSUWGMRR0_GLS0_ISA950_IU1_K1_LDSTI0_LBSPPA0_LBSPPB0_LBSPPM0_LPA0_LPB0_LPM0_LRVWn1_LWPMn1_MIAV1_MIWT10_2_MO40_MGRIPM1_NTn1_NTA0_NTB0_NTC0_NTD0_NTM0_NEPBS14_NLCA1_NLCB1_ONLL1_PGR2_PLR1_PKA1_SGROB0_SIA3_SS1_SU0_SUM0_SUS0_SPO0_SRVW0_SSO1_SVW2_SK3_SKFTR0_SKXCCM0_SGRO0_TDMI0_TIN1_TLDS0_TLDSMn1_ULSGRO1_USL1_UIOFGRO0_UPLRP0_USFGRO1_VSn1_VWA2_VWB2_WSGRA0_WSGRB0_WS64_WG16_16_1_WGM2_WGMXCC4_WGMXCCGn1
    SolutionIndex: 45
    SolutionNameMin: Cijk_Alik_Bjlk_S_B_Bias_HA_S_SAV_UserArgs_MT64x192x32_MI16x16x1_SN_LDSB1_AFC0_AG1_AFEM1_AFEM1_ASEM1_CLR1_CADS0_DTLA0_DTLB0_DTVA0_DTVB0_DTVMXSA0_DTVMXSB0_DTVSM0_DPLB0_EPS0_ELFLR0_EMLLn1_FDSI0_GRPM1_GRVWA2_GRVWB2_GSU0_GSUAMB_GSUC0_GSUWGMRR0_GLS0_ISA950_IU1_K1_LDSTI0_LBSPPA0_LBSPPB768_LBSPPM0_LPA0_LPB16_LPM0_LRVWn1_LWPMn1_MIAV1_MIWT4_3_MO40_MGRIPM1_NTn1_NTA0_NTB0_NTC0_NTD0_NTM0_NEPBS16_NLCA1_NLCB3_ONLL1_PGR2_PLR1_PKA1_SGROB0_SIA3_SS1_SU0_SUM0_SUS0_SPO1_SRVW0_SSO0_SVW4_SK3_SKFTR0_SKXCCM0_SGRO0_TDMI0_TIN1_TLDS0_TLDSMn1_ULSGRO0_USL1_UIOFGRO0_UPLRP0_USFGRO1_VSn1_VWA4_VWB1_WSGRA2_WSGRB2_WS64_WG16_16_1_WGM4_WGMXCC2_WGMXCCGn1
    SolutionIndex: 46
    SolutionNameMin: Cijk_Alik_Bjlk_S_B_Bias_HA_S_SAV_UserArgs_MT128x176x32_MI16x16x1_SN_LDSB1_AFC0_AG1_AFEM1_AFEM1_ASEM1_CLR1_CADS0_DTLA0_DTLB0_DTVA0_DTVB0_DTVMXSA0_DTVMXSB0_DTVSM0_DPLB0_EPS0_ELFLR0_EMLLn1_FDSI0_GRPM1_GRVWA4_GRVWB2_GSU0_GSUAMB_GSUC0_GSUWGMRR0_GLS0_ISA950_IU1_K1_LDSTI0_LBSPPA0_LBSPPB0_LBSPPM0_LPA0_LPB0_LPM0_LRVWn1_LWPMn1_MIAV0_MIWT2_11_MO40_MGRIPM1_NTn1_NTA0_NTB4_NTC0_NTD0_NTM0_NEPBS0_NLCA1_NLCB11_ONLL1_PGR2_PLR1_PKA1_SGROB0_SIA3_SS1_SU0_SUM0_SUS0_SPO0_SRVW0_SSO1_SVW2_SK3_SKFTR0_SKXCCM0_SGRO0_TDMI0_TIN1_TLDS0_TLDSMn1_ULSGRO0_USL1_UIOFGRO0_UPLRP0_USFGRO1_VSn1_VWA2_VWB1_WSGRA0_WSGRB0_WS64_WG64_4_1_WGM2_WGMXCC4_WGMXCCGn1
    SolutionIndex: 47
    SolutionNameMin: Cijk_Alik_Bjlk_S_B_Bias_HA_S_SAV_UserArgs_MT128x208x32_MI16x16x1_SN_LDSB1_AFC0_AG1_AFEM1_AFEM1_ASEM1_CLR1_CADS0_DTLA0_DTLB0_DTVA0_DTVB0_DTVMXSA0_DTVMXSB0_DTVSM0_DPLB0_EPS0_ELFLR0_EMLLn1_FDSI0_GRPM1_GRVWA4_GRVWB1_GSU0_GSUAMB_GSUC0_GSUWGMRR0_GLS0_ISA950_IU1_K1_LDSTI0_LBSPPA256_LBSPPB3328_LBSPPM0_LPA8_LPB16_LPM0_LRVWn1_LWPMn1_MIAV0_MIWT2_13_MO40_MGRIPM1_NTn1_NTA0_NTB0_NTC4_NTD4_NTM0_NEPBS0_NLCA1_NLCB13_ONLL1_PGR2_PLR1_PKA1_SGROB0_SIA3_SS1_SU0_SUM0_SUS0_SPO0_SRVW0_SSO1_SVW2_SK3_SKFTR0_SKXCCM0_SGRO0_TDMI0_TIN1_TLDS1_TLDSMn1_ULSGRO1_USL1_UIOFGRO0_UPLRP0_USFGRO0_VSn1_VWA2_VWB1_WSGRA2_WSGRB0_WS64_WG64_4_1_WGM6_WGMXCC4_WGMXCCGn1
    SolutionIndex: 48
    SolutionNameMin: Cijk_Alik_Bjlk_S_B_Bias_HA_S_SAV_UserArgs_MT256x96x32_MI16x16x1_SN_LDSB1_AFC0_AG1_AFEM1_AFEM1_ASEM1_CLR1_CADS0_DTLA0_DTLB0_DTVA0_DTVB0_DTVMXSA0_DTVMXSB0_DTVSM0_DPLB0_EPS0_ELFLR0_EMLL0_FDSI0_GRPM1_GRVWA2_GRVWB1_GSU0_GSUAMB_GSUC0_GSUWGMRR0_GLS0_ISA950_IU1_K1_LDSTI0_LBSPPA512_LBSPPB0_LBSPPM0_LPA8_LPB0_LPM0_LRVWn1_LWPMn1_MIAV0_MIWT4_6_MO40_MGRIPM1_NTn1_NTA0_NTB4_NTC4_NTD4_NTM0_NEPBS0_NLCA1_NLCB3_ONLL1_PGR2_PLR1_PKA1_SGROB0_SIA3_SS1_SU0_SUM0_SUS0_SPO1_SRVW0_SSO1_SVW4_SK3_SKFTR0_SKXCCM0_SGRO0_TDMI0_TIN1_TLDS1_TLDSMn1_ULSGRO0_USL1_UIOFGRO0_UPLRP0_USFGRO0_VSn1_VWA4_VWB2_WSGRA0_WSGRB2_WS64_WG64_4_1_WGM4_WGMXCC1_WGMXCCGn1
    SolutionIndex: 49
    SolutionNameMin: Cijk_Alik_Bjlk_S_B_Bias_HA_S_SAV_UserArgs_MT128x128x32_MI16x16x1_SN_LDSB1_AFC0_AG1_AFEM1_AFEM1_ASEM1_CLR1_CADS0_DTLA0_DTLB0_DTVA0_DTVB0_DTVMXSA0_DTVMXSB0_DTVSM0_DPLB0_EPS1_ELFLR0_EMLL0_FDSI0_GRPM1_GRVWA4_GRVWB4_GSU0_GSUAMB_GSUC0_GSUWGMRR0_GLS0_ISA950_IU1_K1_LDSTI0_LBSPPA512_LBSPPB0_LBSPPM0_LPA8_LPB0_LPM0_LRVWn1_LWPMn1_MIAV1_MIWT4_4_MO40_MGRIPM1_NTn1_NTA4_NTB0_NTC0_NTD4_NTM0_NEPBS14_NLCA1_NLCB1_ONLL1_PGR1_PLR1_PKA1_SGROB0_SIA3_SS1_SU0_SUM0_SUS0_SPO0_SRVW0_SSO0_SVW4_SK3_SKFTR0_SKXCCM4_SGRO0_TDMI0_TIN1_TLDS1_TLDSMn1_ULSGRO0_USL1_UIOFGRO0_UPLRP0_USFGRO0_VSn1_VWA4_VWB4_WSGRA2_WSGRB2_WS64_WG32_8_1_WGMn32_WGMXCC1_WGMXCCGn1
    SolutionIndex: 50
    SolutionNameMin: Cijk_Alik_Bjlk_S_B_Bias_HA_S_SAV_UserArgs_MT128x64x32_MI32x32x1_SN_LDSB1_AFC0_AG1_AFEM1_AFEM1_ASEM1_CLR1_CADS0_DTLA0_DTLB0_DTVA0_DTVB0_DTVMXSA0_DTVMXSB0_DTVSM0_DPLB0_EPS0_ELFLR0_EMLLn1_FDSI0_GRPM1_GRVWA1_GRVWB4_GSU0_GSUAMB_GSUC0_GSUWGMRR0_GLS0_ISA950_IU1_K1_LDSTI0_LBSPPA256_LBSPPB128_LBSPPM0_LPA4_LPB4_LPM0_LRVWn1_LWPMn1_MIAV0_MIWT2_1_MO40_MGRIPM1_NTn1_NTA0_NTB0_NTC4_NTD4_NTM0_NEPBS10_NLCA1_NLCB1_ONLL1_PGR2_PLR1_PKA1_SGROB0_SIA3_SS1_SU0_SUM0_SUS0_SPO0_SRVW0_SSO1_SVW2_SK3_SKFTR0_SKXCCM0_SGRO0_TDMI0_TIN1_TLDS2_TLDSMn1_ULSGRO0_USL1_UIOFGRO0_UPLRP0_USFGRO1_VSn1_VWA2_VWB1_WSGRA0_WSGRB2_WS64_WG64_4_1_WGM4_WGMXCC2_WGMXCCGn1
    SolutionIndex: 51
    SolutionNameMin: Cijk_Alik_Bjlk_S_B_Bias_HA_S_SAV_UserArgs_MT128x80x32_MI16x16x1_SN_LDSB1_AFC0_AG0_AFEM1_AFEM1_ASEM1_CLR1_CADS0_DTLA0_DTLB0_DTVA0_DTVB0_DTVMXSA0_DTVMXSB0_DTVSM0_DPLB0_EPS1_ELFLR0_EMLL0_FDSI0_GRPM1_GRVWA4_GRVWB1_GSU0_GSUAMB_GSUC0_GSUWGMRR0_GLS0_ISA950_IU1_K1_LDSTI0_LBSPPA256_LBSPPB1280_LBSPPM0_LPA8_LPB16_LPM0_LRVWn1_LWPMn1_MIAV1_MIWT2_5_MO40_MGRIPM1_NTn1_NTA0_NTB0_NTC4_NTD4_NTM0_NEPBS10_NLCA1_NLCB5_ONLL1_PGR1_PLR1_PKA1_SGROB0_SIA3_SS1_SU0_SUM0_SUS0_SPO0_SRVW0_SSO0_SVW2_SK3_SKFTR0_SKXCCM0_SGRO0_TDMI0_TIN1_TLDS1_TLDSMn1_ULSGRO0_USL1_UIOFGRO0_UPLRP0_USFGRO1_VSn1_VWA2_VWB1_WSGRA2_WSGRB2_WS64_WG64_4_1_WGM4_WGMXCC1_WGMXCCGn1
    SolutionIndex: 52
    SolutionNameMin: Cijk_Alik_Bjlk_S_B_Bias_HA_S_SAV_UserArgs_MT256x224x32_MI16x16x1_SN_LDSB1_AFC0_AG1_AFEM1_AFEM1_ASEM1_CLR1_CADS0_DTLA0_DTLB0_DTVA0_DTVB0_DTVMXSA0_DTVMXSB0_DTVSM0_DPLB0_EPS1_ELFLR0_EMLL0_FDSI0_GRPM1_GRVWA4_GRVWB1_GSU0_GSUAMB_GSUC0_GSUWGMRR0_GLS0_ISA950_IU1_K1_LDSTI0_LBSPPA512_LBSPPB3584_LBSPPM0_LPA8_LPB16_LPM0_LRVWn1_LWPMn1_MIAV0_MIWT8_7_MO40_MGRIPM1_NTn1_NTA0_NTB0_NTC0_NTD0_NTM0_NEPBS0_NLCA1_NLCB7_ONLL1_PGR1_PLR1_PKA1_SGROB0_SIA3_SS1_SU0_SUM0_SUS0_SPO0_SRVW0_SSO1_SVW4_SK3_SKFTR0_SKXCCM4_SGRO0_TDMI0_TIN1_TLDS1_TLDSMn1_ULSGRO0_USL1_UIOFGRO0_UPLRP0_USFGRO0_VSn1_VWA4_VWB1_WSGRA0_WSGRB0_WS64_WG32_8_1_WGM2_WGMXCC1_WGMXCCGn1
    SolutionIndex: 53
    SolutionNameMin: Cijk_Alik_Bjlk_S_B_Bias_HA_S_SAV_UserArgs_MT128x112x32_MI16x16x1_SN_LDSB1_AFC0_AG0_AFEM1_AFEM1_ASEM1_CLR1_CADS0_DTLA0_DTLB0_DTVA0_DTVB0_DTVMXSA0_DTVMXSB0_DTVSM0_DPLB0_EPS0_ELFLR0_EMLLn1_FDSI0_GRPM1_GRVWA4_GRVWB2_GSU0_GSUAMB_GSUC0_GSUWGMRR0_GLS0_ISA950_IU1_K1_LDSTI0_LBSPPA0_LBSPPB0_LBSPPM0_LPA0_LPB0_LPM0_LRVWn1_LWPMn1_MIAV0_MIWT2_7_MO40_MGRIPM1_NTn1_NTA0_NTB0_NTC0_NTD0_NTM0_NEPBS0_NLCA1_NLCB7_ONLL1_PGR2_PLR1_PKA1_SGROB0_SIA3_SS1_SU0_SUM0_SUS0_SPO0_SRVW0_SSO4_SVW2_SK3_SKFTR0_SKXCCM4_SGRO0_TDMI0_TIN1_TLDS0_TLDSMn1_ULSGRO0_USL1_UIOFGRO0_UPLRP0_USFGRO0_VSn1_VWA2_VWB1_WSGRA0_WSGRB0_WS64_WG64_4_1_WGM2_WGMXCC1_WGMXCCGn1
    SolutionIndex: 54
    SolutionNameMin: Cijk_Alik_Bjlk_S_B_Bias_HA_S_SAV_UserArgs_MT256x80x32_MI16x16x1_SN_LDSB0_AFC0_AG1_AFEM1_AFEM1_ASEM1_CLR1_CADS0_DTLA0_DTLB0_DTVA0_DTVB0_DTVMXSA0_DTVMXSB0_DTVSM0_DPLB0_EPS0_ELFLR0_EMLLn1_FDSI0_GRPM1_GRVWA4_GRVWB1_GSU0_GSUAMB_GSUC0_GSUWGMRR0_GLS0_ISA950_IU1_K1_LDSTI0_LBSPPA512_LBSPPB1280_LBSPPM0_LPA8_LPB16_LPM0_LRVWn1_LWPMn1_MIAV0_MIWT4_5_MO40_MGRIPM1_NTn1_NTA0_NTB0_NTC4_NTD4_NTM0_NEPBS12_NLCA1_NLCB5_ONLL1_PGR2_PLR1_PKA1_SGROB0_SIA3_SS1_SU0_SUM0_SUS0_SPO1_SRVW0_SSO1_SVW4_SK3_SKFTR0_SKXCCM8_SGRO0_TDMI0_TIN1_TLDS1_TLDSMn1_ULSGRO0_USL1_UIOFGRO0_UPLRP0_USFGRO1_VSn1_VWA4_VWB1_WSGRA0_WSGRB0_WS64_WG64_4_1_WGMn1_WGMXCC1_WGMXCCGn1
    SolutionIndex: 55
    SolutionNameMin: Cijk_Alik_Bjlk_S_B_Bias_HA_S_SAV_UserArgs_MT160x64x32_MI16x16x1_SN_LDSB1_AFC0_AG0_AFEM1_AFEM1_ASEM1_CLR1_CADS0_DTLA0_DTLB0_DTVA0_DTVB0_DTVMXSA0_DTVMXSB0_DTVSM0_DPLB0_EPS1_ELFLR0_EMLLn1_FDSI0_GRPM1_GRVWA4_GRVWB4_GSU0_GSUAMB_GSUC0_GSUWGMRR0_GLS0_ISA950_IU1_K1_LDSTI0_LBSPPA256_LBSPPB1024_LBSPPM0_LPA8_LPB16_LPM0_LRVWn1_LWPMn1_MIAV0_MIWT10_1_MO40_MGRIPM1_NTn1_NTA0_NTB0_NTC4_NTD4_NTM0_NEPBS10_NLCA1_NLCB1_ONLL1_PGR1_PLR1_PKA1_SGROB0_SIA3_SS1_SU0_SUM0_SUS0_SPO0_SRVW0_SSO0_SVW2_SK3_SKFTR0_SKXCCM0_SGRO0_TDMI0_TIN0_TLDS1_TLDSMn1_ULSGRO0_USL1_UIOFGRO0_UPLRP0_USFGRO1_VSn1_VWA2_VWB1_WSGRA0_WSGRB2_WS64_WG16_16_1_WGMn1_WGMXCC1_WGMXCCGn1
    SolutionIndex: 56
    SolutionNameMin: Cijk_Alik_Bjlk_S_B_Bias_HA_S_SAV_UserArgs_MT256x64x32_MI16x16x1_SN_LDSB1_AFC0_AG1_AFEM1_AFEM1_ASEM1_CLR1_CADS0_DTLA0_DTLB0_DTVA0_DTVB0_DTVMXSA0_DTVMXSB0_DTVSM0_DPLB0_EPS1_ELFLR0_EMLL0_FDSI0_GRPM1_GRVWA4_GRVWB4_GSU0_GSUAMB_GSUC0_GSUWGMRR0_GLS0_ISA950_IU1_K1_LDSTI0_LBSPPA512_LBSPPB256_LBSPPM0_LPA8_LPB8_LPM0_LRVWn1_LWPMn1_MIAV0_MIWT8_2_MO40_MGRIPM1_NTn1_NTA0_NTB0_NTC4_NTD4_NTM0_NEPBS0_NLCA1_NLCB1_ONLL1_PGR1_PLR1_PKA1_SGROB0_SIA3_SS1_SU0_SUM0_SUS0_SPO0_SRVW0_SSO4_SVW4_SK3_SKFTR0_SKXCCM0_SGRO0_TDMI0_TIN1_TLDS2_TLDSMn1_ULSGRO0_USL1_UIOFGRO0_UPLRP0_USFGRO1_VSn1_VWA4_VWB2_WSGRA2_WSGRB2_WS64_WG32_8_1_WGM6_WGMXCC8_WGMXCCGn1
    SolutionIndex: 57
    SolutionNameMin: Cijk_Alik_Bjlk_S_B_Bias_HA_S_SAV_UserArgs_MT64x160x32_MI16x16x1_SN_LDSB1_AFC0_AG1_AFEM1_AFEM1_ASEM1_CLR1_CADS0_DTLA0_DTLB0_DTVA0_DTVB0_DTVMXSA0_DTVMXSB0_DTVSM0_DPLB0_EPS1_ELFLR0_EMLLn1_FDSI0_GRPM1_GRVWA1_GRVWB4_GSU0_GSUAMB_GSUC0_GSUWGMRR0_GLS0_ISA950_IU1_K1_LDSTI0_LBSPPA256_LBSPPB2560_LBSPPM0_LPA8_LPB16_LPM0_LRVWn1_LWPMn1_MIAV0_MIWT2_5_MO40_MGRIPM1_NTn1_NTA0_NTB0_NTC4_NTD4_NTM0_NEPBS10_NLCA1_NLCB5_ONLL1_PGR1_PLR1_PKA1_SGROB0_SIA3_SS1_SU0_SUM0_SUS0_SPO0_SRVW0_SSO1_SVW2_SK3_SKFTR0_SKXCCM0_SGRO0_TDMI0_TIN1_TLDS1_TLDSMn1_ULSGRO0_USL1_UIOFGRO0_UPLRP0_USFGRO1_VSn1_VWA2_VWB1_WSGRA2_WSGRB0_WS64_WG32_8_1_WGM8_WGMXCC1_WGMXCCGn1
    SolutionIndex: 58
    SolutionNameMin: Cijk_Alik_Bjlk_S_B_Bias_HA_S_SAV_UserArgs_MT224x64x32_MI16x16x1_SN_LDSB1_AFC0_AG1_AFEM1_AFEM1_ASEM1_CLR1_CADS0_DTLA0_DTLB0_DTVA0_DTVB0_DTVMXSA0_DTVMXSB0_DTVSM0_DPLB0_EPS1_ELFLR0_EMLL0_FDSI0_GRPM1_GRVWA4_GRVWB1_GSU0_GSUAMB_GSUC0_GSUWGMRR0_GLS0_ISA950_IU1_K1_LDSTI0_LBSPPA256_LBSPPB1024_LBSPPM0_LPA8_LPB16_LPM0_LRVWn1_LWPMn1_MIAV0_MIWT14_1_MO40_MGRIPM1_NTn1_NTA0_NTB0_NTC4_NTD4_NTM0_NEPBS0_NLCA1_NLCB1_ONLL1_PGR1_PLR1_PKA1_SGROB0_SIA3_SS1_SU0_SUM0_SUS0_SPO1_SRVW0_SSO1_SVW2_SK3_SKFTR0_SKXCCM4_SGRO0_TDMI0_TIN1_TLDS1_TLDSMn1_ULSGRO0_USL1_UIOFGRO0_UPLRP0_USFGRO1_VSn1_VWA2_VWB1_WSGRA2_WSGRB2_WS64_WG16_16_1_WGM32_WGMXCC2_WGMXCCGn1
    SolutionIndex: 59
    SolutionNameMin: Cijk_Alik_Bjlk_S_B_Bias_HA_S_SAV_UserArgs_MT128x64x32_MI32x32x1_SN_LDSB0_AFC0_AG1_AFEM1_AFEM1_ASEM1_CLR1_CADS0_DTLA0_DTLB0_DTVA0_DTVB0_DTVMXSA0_DTVMXSB0_DTVSM0_DPLB0_EPS1_ELFLR0_EMLLn1_FDSI0_GRPM1_GRVWA1_GRVWB4_GSU0_GSUAMB_GSUC0_GSUWGMRR0_GLS0_ISA950_IU1_K1_LDSTI0_LBSPPA256_LBSPPB0_LBSPPM0_LPA4_LPB0_LPM0_LRVWn1_LWPMn1_MIAV0_MIWT2_1_MO40_MGRIPM1_NTn1_NTA0_NTB0_NTC4_NTD4_NTM0_NEPBS0_NLCA1_NLCB1_ONLL1_PGR1_PLR1_PKA1_SGROB0_SIA3_SS1_SU0_SUM0_SUS0_SPO0_SRVW0_SSO1_SVW2_SK3_SKFTR0_SKXCCM0_SGRO0_TDMI0_TIN1_TLDS1_TLDSMn1_ULSGRO0_USL1_UIOFGRO0_UPLRP0_USFGRO1_VSn1_VWA2_VWB1_WSGRA0_WSGRB0_WS64_WG64_4_1_WGM8_WGMXCC1_WGMXCCGn1
    SolutionIndex: 60
    SolutionNameMin: Cijk_Alik_Bjlk_S_B_Bias_HA_S_SAV_UserArgs_MT128x192x32_MI16x16x1_SN_LDSB1_AFC0_AG0_AFEM1_AFEM1_ASEM1_CLR1_CADS0_DTLA0_DTLB0_DTVA0_DTVB0_DTVMXSA0_DTVMXSB0_DTVSM0_DPLB0_EPS0_ELFLR0_EMLLn1_FDSI0_GRPM1_GRVWA2_GRVWB2_GSU0_GSUAMB_GSUC0_GSUWGMRR0_GLS0_ISA950_IU1_K1_LDSTI0_LBSPPA512_LBSPPB3072_LBSPPM0_LPA8_LPB16_LPM0_LRVWn1_LWPMn1_MIAV0_MIWT8_3_MO40_MGRIPM1_NTn1_NTA0_NTB4_NTC4_NTD4_NTM0_NEPBS8_NLCA1_NLCB3_ONLL1_PGR2_PLR1_PKA1_SGROB0_SIA3_SS1_SU16_SUM0_SUS512_SPO0_SRVW0_SSO1_SVW4_SK3_SKFTR0_SKXCCM0_SGRO0_TDMI0_TIN0_TLDS1_TLDSMn1_ULSGRO0_USL1_UIOFGRO0_UPLRP0_USFGRO1_VSn1_VWA4_VWB1_WSGRA0_WSGRB0_WS64_WG16_16_1_WGM8_WGMXCC1_WGMXCCGn1
    SolutionIndex: 61
    SolutionNameMin: Cijk_Alik_Bjlk_S_B_Bias_HA_S_SAV_UserArgs_MT64x208x32_MI16x16x1_SN_LDSB0_AFC0_AG0_AFEM1_AFEM1_ASEM1_CLR1_CADS0_DTLA0_DTLB0_DTVA0_DTVB0_DTVMXSA0_DTVMXSB0_DTVSM0_DPLB0_EPS0_ELFLR0_EMLLn1_FDSI0_GRPM1_GRVWA2_GRVWB2_GSU0_GSUAMB_GSUC0_GSUWGMRR0_GLS0_ISA950_IU1_K1_LDSTI0_LBSPPA128_LBSPPB3328_LBSPPM0_LPA8_LPB16_LPM0_LRVWn1_LWPMn1_MIAV0_MIWT1_13_MO40_MGRIPM1_NTn1_NTA0_NTB0_NTC0_NTD4_NTM0_NEPBS0_NLCA1_NLCB13_ONLL1_PGR2_PLR1_PKA1_SGROB0_SIA3_SS1_SU0_SUM0_SUS0_SPO0_SRVW0_SSO1_SVW1_SK3_SKFTR0_SKXCCM4_SGRO0_TDMI0_TIN1_TLDS1_TLDSMn1_ULSGRO1_USL1_UIOFGRO0_UPLRP0_USFGRO1_VSn1_VWA1_VWB1_WSGRA0_WSGRB0_WS64_WG64_4_1_WGM8_WGMXCC1_WGMXCCGn1
    SolutionIndex: 62
    SolutionNameMin: Cijk_Alik_Bjlk_S_B_Bias_HA_S_SAV_UserArgs_MT64x128x32_MI16x16x1_SN_LDSB0_AFC0_AG1_AFEM1_AFEM1_ASEM1_CLR1_CADS0_DTLA0_DTLB0_DTVA0_DTVB0_DTVMXSA0_DTVMXSB0_DTVSM0_DPLB0_EPS1_ELFLR0_EMLL0_FDSI0_GRPM1_GRVWA4_GRVWB1_GSU0_GSUAMB_GSUC0_GSUWGMRR0_GLS0_ISA950_IU1_K1_LDSTI0_LBSPPA512_LBSPPB0_LBSPPM0_LPA8_LPB0_LPM0_LRVWn1_LWPMn1_MIAV0_MIWT4_2_MO40_MGRIPM1_NTn1_NTA0_NTB0_NTC4_NTD4_NTM0_NEPBS0_NLCA1_NLCB1_ONLL1_PGR1_PLR1_PKA1_SGROB0_SIA3_SS1_SU0_SUM0_SUS0_SPO1_SRVW0_SSO0_SVW4_SK3_SKFTR0_SKXCCM0_SGRO0_TDMI0_TIN1_TLDS1_TLDSMn1_ULSGRO0_USL1_UIOFGRO0_UPLRP0_USFGRO1_VSn1_VWA4_VWB2_WSGRA0_WSGRB0_WS64_WG16_16_1_WGM6_WGMXCC1_WGMXCCGn1
    SolutionIndex: 63
    SolutionNameMin: Cijk_Alik_Bjlk_S_B_Bias_HA_S_SAV_UserArgs_MT256x224x32_MI16x16x1_SN_LDSB1_AFC0_AG1_AFEM1_AFEM1_ASEM1_CLR1_CADS0_DTLA0_DTLB0_DTVA0_DTVB0_DTVMXSA0_DTVMXSB0_DTVSM0_DPLB0_EPS0_ELFLR0_EMLLn1_FDSI0_GRPM1_GRVWA4_GRVWB4_GSU0_GSUAMB_GSUC0_GSUWGMRR0_GLS0_ISA950_IU1_K1_LDSTI0_LBSPPA512_LBSPPB0_LBSPPM0_LPA8_LPB0_LPM0_LRVWn1_LWPMn1_MIAV0_MIWT4_14_MO40_MGRIPM1_NTn1_NTA0_NTB0_NTC4_NTD4_NTM0_NEPBS14_NLCA1_NLCB7_ONLL1_PGR2_PLR1_PKA1_SGROB0_SIA3_SS1_SU0_SUM0_SUS0_SPO0_SRVW0_SSO1_SVW4_SK3_SKFTR0_SKXCCM0_SGRO0_TDMI0_TIN1_TLDS1_TLDSMn1_ULSGRO1_USL1_UIOFGRO0_UPLRP0_USFGRO1_VSn1_VWA4_VWB2_WSGRA2_WSGRB2_WS64_WG64_4_1_WGM8_WGMXCC1_WGMXCCGn1
    SolutionIndex: 64
    SolutionNameMin: Cijk_Alik_Bjlk_S_B_Bias_HA_S_SAV_UserArgs_MT224x64x32_MI16x16x1_SN_LDSB0_AFC0_AG1_AFEM1_AFEM1_ASEM1_CLR1_CADS0_DTLA0_DTLB0_DTVA0_DTVB0_DTVMXSA0_DTVMXSB0_DTVSM0_DPLB0_EPS0_ELFLR0_EMLLn1_FDSI0_GRPM1_GRVWA4_GRVWB1_GSU0_GSUAMB_GSUC0_GSUWGMRR0_GLS0_ISA950_IU1_K1_LDSTI0_LBSPPA256_LBSPPB1024_LBSPPM0_LPA8_LPB16_LPM0_LRVWn1_LWPMn1_MIAV0_MIWT14_1_MO40_MGRIPM1_NTn1_NTA0_NTB0_NTC4_NTD4_NTM0_NEPBS0_NLCA1_NLCB1_ONLL1_PGR2_PLR1_PKA1_SGROB0_SIA3_SS1_SU0_SUM0_SUS0_SPO1_SRVW0_SSO1_SVW2_SK3_SKFTR0_SKXCCM4_SGRO0_TDMI0_TIN1_TLDS1_TLDSMn1_ULSGRO1_USL1_UIOFGRO0_UPLRP0_USFGRO0_VSn1_VWA2_VWB1_WSGRA0_WSGRB2_WS64_WG16_16_1_WGM32_WGMXCC1_WGMXCCGn1
    SolutionIndex: 65
    SolutionNameMin: Cijk_Alik_Bjlk_S_B_Bias_HA_S_SAV_UserArgs_MT128x112x32_MI16x16x1_SN_LDSB0_AFC0_AG0_AFEM1_AFEM1_ASEM1_CLR1_CADS0_DTLA0_DTLB0_DTVA0_DTVB0_DTVMXSA0_DTVMXSB0_DTVSM0_DPLB0_EPS1_ELFLR0_EMLL0_FDSI0_GRPM1_GRVWA1_GRVWB1_GSU0_GSUAMB_GSUC0_GSUWGMRR0_GLS0_ISA950_IU1_K1_LDSTI0_LBSPPA256_LBSPPB1792_LBSPPM0_LPA8_LPB16_LPM0_LRVWn1_LWPMn1_MIAV0_MIWT2_7_MO40_MGRIPM1_NTn1_NTA0_NTB0_NTC4_NTD4_NTM0_NEPBS0_NLCA1_NLCB7_ONLL1_PGR1_PLR1_PKA1_SGROB0_SIA3_SS1_SU0_SUM0_SUS0_SPO0_SRVW0_SSO1_SVW2_SK3_SKFTR0_SKXCCM0_SGRO0_TDMI0_TIN1_TLDS1_TLDSMn1_ULSGRO0_USL1_UIOFGRO0_UPLRP0_USFGRO0_VSn1_VWA2_VWB1_WSGRA2_WSGRB0_WS64_WG64_4_1_WGM2_WGMXCC1_WGMXCCGn1
    SolutionIndex: 66
    SolutionNameMin: Cijk_Alik_Bjlk_S_B_Bias_HA_S_SAV_UserArgs_MT128x112x32_MI16x16x1_SN_LDSB0_AFC0_AG1_AFEM1_AFEM1_ASEM1_CLR1_CADS0_DTLA0_DTLB0_DTVA0_DTVB0_DTVMXSA0_DTVMXSB0_DTVSM0_DPLB0_EPS1_ELFLR0_EMLL0_FDSI0_GRPM1_GRVWA1_GRVWB1_GSU0_GSUAMB_GSUC0_GSUWGMRR0_GLS0_ISA950_IU1_K1_LDSTI0_LBSPPA256_LBSPPB1792_LBSPPM0_LPA8_LPB16_LPM0_LRVWn1_LWPMn1_MIAV0_MIWT2_7_MO40_MGRIPM1_NTn1_NTA0_NTB0_NTC4_NTD4_NTM0_NEPBS0_NLCA1_NLCB7_ONLL1_PGR1_PLR1_PKA1_SGROB0_SIA3_SS1_SU0_SUM0_SUS0_SPO0_SRVW0_SSO0_SVW2_SK3_SKFTR0_SKXCCM0_SGRO0_TDMI0_TIN1_TLDS1_TLDSMn1_ULSGRO0_USL1_UIOFGRO0_UPLRP0_USFGRO0_VSn1_VWA2_VWB1_WSGRA2_WSGRB2_WS64_WG64_4_1_WGM2_WGMXCC8_WGMXCCGn1
    SolutionIndex: 67
    SolutionNameMin: Cijk_Alik_Bjlk_S_B_Bias_HA_S_SAV_UserArgs_MT64x64x32_MI16x16x1_SN_LDSB0_AFC0_AG1_AFEM1_AFEM1_ASEM1_CLR1_CADS0_DTLA0_DTLB0_DTVA0_DTVB0_DTVMXSA0_DTVMXSB0_DTVSM0_DPLB0_EPS0_ELFLR0_EMLL0_FDSI0_GRPM1_GRVWA4_GRVWB4_GSU0_GSUAMB_GSUC0_GSUWGMRR0_GLS0_ISA950_IU1_K1_LDSTI0_LBSPPA512_LBSPPB1024_LBSPPM0_LPA8_LPB16_LPM0_LRVWn1_LWPMn1_MIAV1_MIWT4_1_MO40_MGRIPM1_NTn1_NTA0_NTB0_NTC4_NTD4_NTM0_NEPBS16_NLCA1_NLCB1_ONLL1_PGR2_PLR1_PKA1_SGROB0_SIA3_SS1_SU0_SUM0_SUS0_SPO0_SRVW0_SSO0_SVW4_SK3_SKFTR0_SKXCCM0_SGRO0_TDMI0_TIN1_TLDS1_TLDSMn1_ULSGRO1_USL1_UIOFGRO0_UPLRP0_USFGRO1_VSn1_VWA4_VWB1_WSGRA2_WSGRB0_WS64_WG16_16_1_WGM2_WGMXCC8_WGMXCCGn1
    SolutionIndex: 68
    SolutionNameMin: Cijk_Alik_Bjlk_S_B_Bias_HA_S_SAV_UserArgs_MT256x64x32_MI32x32x1_SN_LDSB1_AFC0_AG1_AFEM1_AFEM1_ASEM1_CLR1_CADS0_DTLA0_DTLB0_DTVA0_DTVB0_DTVMXSA0_DTVMXSB0_DTVSM0_DPLB0_EPS0_ELFLR0_EMLL0_FDSI0_GRPM1_GRVWA4_GRVWB1_GSU0_GSUAMB_GSUC0_GSUWGMRR0_GLS0_ISA950_IU1_K1_LDSTI0_LBSPPA512_LBSPPB0_LBSPPM0_LPA4_LPB0_LPM0_LRVWn1_LWPMn1_MIAV0_MIWT4_1_MO40_MGRIPM1_NTn1_NTA0_NTB0_NTC4_NTD4_NTM0_NEPBS8_NLCA1_NLCB1_ONLL1_PGR2_PLR1_PKA1_SGROB0_SIA3_SS1_SU0_SUM0_SUS0_SPO1_SRVW0_SSO1_SVW4_SK3_SKFTR0_SKXCCM0_SGRO0_TDMI0_TIN1_TLDS1_TLDSMn1_ULSGRO0_USL1_UIOFGRO0_UPLRP0_USFGRO1_VSn1_VWA4_VWB1_WSGRA0_WSGRB0_WS64_WG64_4_1_WGM8_WGMXCC1_WGMXCCGn1
    SolutionIndex: 69
    SolutionNameMin: Cijk_Alik_Bjlk_S_B_Bias_HA_S_SAV_UserArgs_MT256x64x32_MI16x16x1_SN_LDSB1_AFC0_AG1_AFEM1_AFEM1_ASEM1_CLR1_CADS0_DTLA0_DTLB0_DTVA0_DTVB0_DTVMXSA0_DTVMXSB0_DTVSM0_DPLB0_EPS0_ELFLR0_EMLLn1_FDSI0_GRPM1_GRVWA4_GRVWB1_GSU0_GSUAMB_GSUC0_GSUWGMRR0_GLS0_ISA950_IU1_K1_LDSTI0_LBSPPA512_LBSPPB0_LBSPPM0_LPA8_LPB0_LPM0_LRVWn1_LWPMn1_MIAV0_MIWT4_4_MO40_MGRIPM1_NTn1_NTA0_NTB0_NTC4_NTD4_NTM0_NEPBS16_NLCA1_NLCB1_ONLL1_PGR2_PLR1_PKA1_SGROB0_SIA3_SS1_SU0_SUM0_SUS0_SPO1_SRVW0_SSO1_SVW4_SK3_SKFTR0_SKXCCM0_SGRO0_TDMI0_TIN1_TLDS1_TLDSMn1_ULSGRO0_USL1_UIOFGRO0_UPLRP0_USFGRO1_VSn1_VWA4_VWB4_WSGRA2_WSGRB0_WS64_WG64_4_1_WGMn2_WGMXCC16_WGMXCCGn1
    SolutionIndex: 70
    SolutionNameMin: Cijk_Alik_Bjlk_S_B_Bias_HA_S_SAV_UserArgs_MT64x144x32_MI16x16x1_SN_LDSB0_AFC0_AG1_AFEM1_AFEM1_ASEM1_CLR1_CADS0_DTLA0_DTLB0_DTVA0_DTVB0_DTVMXSA0_DTVMXSB0_DTVSM0_DPLB0_EPS0_ELFLR0_EMLLn1_FDSI0_GRPM1_GRVWA2_GRVWB2_GSU0_GSUAMB_GSUC0_GSUWGMRR0_GLS0_ISA950_IU1_K1_LDSTI0_LBSPPA128_LBSPPB128_LBSPPM0_LPA8_LPB8_LPM0_LRVWn1_LWPMn1_MIAV0_MIWT1_9_MO40_MGRIPM1_NTn1_NTA0_NTB0_NTC0_NTD4_NTM0_NEPBS0_NLCA1_NLCB9_ONLL1_PGR2_PLR1_PKA1_SGROB0_SIA3_SS1_SU0_SUM0_SUS0_SPO1_SRVW0_SSO1_SVW1_SK3_SKFTR0_SKXCCM8_SGRO0_TDMI0_TIN1_TLDS2_TLDSMn1_ULSGRO0_USL1_UIOFGRO0_UPLRP0_USFGRO1_VSn1_VWA1_VWB1_WSGRA0_WSGRB0_WS64_WG64_4_1_WGM8_WGMXCC1_WGMXCCGn1
    SolutionIndex: 71
    SolutionNameMin: Cijk_Alik_Bjlk_S_B_Bias_HA_S_SAV_UserArgs_MT256x48x32_MI16x16x1_SN_LDSB1_AFC0_AG0_AFEM1_AFEM1_ASEM1_CLR1_CADS0_DTLA0_DTLB0_DTVA0_DTVB0_DTVMXSA0_DTVMXSB0_DTVSM0_DPLB0_EPS0_ELFLR0_EMLLn1_FDSI0_GRPM1_GRVWA4_GRVWB1_GSU0_GSUAMB_GSUC0_GSUWGMRR0_GLS0_ISA950_IU1_K1_LDSTI0_LBSPPA512_LBSPPB768_LBSPPM0_LPA8_LPB16_LPM0_LRVWn1_LWPMn1_MIAV0_MIWT4_3_MO40_MGRIPM1_NTn1_NTA0_NTB0_NTC0_NTD4_NTM0_NEPBS0_NLCA1_NLCB3_ONLL1_PGR2_PLR1_PKA1_SGROB0_SIA3_SS1_SU0_SUM0_SUS0_SPO0_SRVW0_SSO1_SVW4_SK3_SKFTR0_SKXCCM8_SGRO0_TDMI0_TIN1_TLDS1_TLDSMn1_ULSGRO1_USL1_UIOFGRO0_UPLRP0_USFGRO1_VSn1_VWA4_VWB1_WSGRA2_WSGRB2_WS64_WG64_4_1_WGM32_WGMXCC1_WGMXCCGn1
    SolutionIndex: 72
    SolutionNameMin: Cijk_Alik_Bjlk_S_B_Bias_HA_S_SAV_UserArgs_MT128x32x32_MI16x16x1_SN_LDSB0_AFC0_AG1_AFEM1_AFEM1_ASEM1_CLR1_CADS0_DTLA0_DTLB0_DTVA0_DTVB0_DTVMXSA0_DTVMXSB0_DTVSM0_DPLB0_EPS1_ELFLR0_EMLLn1_FDSI0_GRPM1_GRVWA4_GRVWB4_GSU0_GSUAMB_GSUC0_GSUWGMRR0_GLS0_ISA950_IU1_K1_LDSTI0_LBSPPA512_LBSPPB512_LBSPPM0_LPA8_LPB16_LPM0_LRVWn1_LWPMn1_MIAV1_MIWT4_1_MO40_MGRIPM1_NTn1_NTA0_NTB0_NTC4_NTD4_NTM0_NEPBS0_NLCA1_NLCB1_ONLL1_PGR1_PLR1_PKA1_SGROB0_SIA3_SS1_SU0_SUM0_SUS0_SPO0_SRVW0_SSO0_SVW4_SK3_SKFTR0_SKXCCM0_SGRO0_TDMI0_TIN1_TLDS1_TLDSMn1_ULSGRO0_USL1_UIOFGRO0_UPLRP0_USFGRO1_VSn1_VWA4_VWB1_WSGRA0_WSGRB0_WS64_WG32_8_1_WGMn8_WGMXCC1_WGMXCCGn1
    SolutionIndex: 73
    SolutionNameMin: Cijk_Alik_Bjlk_S_B_Bias_HA_S_SAV_UserArgs_MT256x224x32_MI16x16x1_SN_LDSB1_AFC0_AG1_AFEM1_AFEM1_ASEM1_CLR1_CADS0_DTLA0_DTLB0_DTVA0_DTVB0_DTVMXSA0_DTVMXSB0_DTVSM0_DPLB0_EPS0_ELFLR0_EMLLn1_FDSI0_GRPM1_GRVWA4_GRVWB4_GSU0_GSUAMB_GSUC0_GSUWGMRR0_GLS0_ISA950_IU1_K1_LDSTI0_LBSPPA512_LBSPPB0_LBSPPM0_LPA8_LPB0_LPM0_LRVWn1_LWPMn1_MIAV0_MIWT4_14_MO40_MGRIPM1_NTn1_NTA0_NTB0_NTC0_NTD0_NTM0_NEPBS0_NLCA1_NLCB7_ONLL1_PGR2_PLR1_PKA1_SGROB0_SIA3_SS1_SU0_SUM0_SUS0_SPO0_SRVW0_SSO1_SVW4_SK3_SKFTR0_SKXCCM0_SGRO0_TDMI0_TIN1_TLDS1_TLDSMn1_ULSGRO0_USL1_UIOFGRO0_UPLRP0_USFGRO1_VSn1_VWA4_VWB2_WSGRA0_WSGRB2_WS64_WG64_4_1_WGM4_WGMXCC2_WGMXCCGn1
    SolutionIndex: 74
    SolutionNameMin: Cijk_Alik_Bjlk_S_B_Bias_HA_S_SAV_UserArgs_MT128x64x32_MI16x16x1_SN_LDSB1_AFC0_AG0_AFEM1_AFEM1_ASEM1_CLR1_CADS0_DTLA0_DTLB0_DTVA0_DTVB0_DTVMXSA0_DTVMXSB0_DTVSM0_DPLB0_EPS0_ELFLR0_EMLL0_FDSI0_GRPM1_GRVWA4_GRVWB4_GSU0_GSUAMB_GSUC0_GSUWGMRR0_GLS0_ISA950_IU1_K1_LDSTI0_LBSPPA512_LBSPPB0_LBSPPM0_LPA8_LPB0_LPM0_LRVWn1_LWPMn1_MIAV1_MIWT4_2_MO40_MGRIPM1_NTn1_NTA0_NTB0_NTC4_NTD4_NTM0_NEPBS0_NLCA1_NLCB1_ONLL1_PGR2_PLR1_PKA1_SGROB0_SIA3_SS1_SU0_SUM0_SUS0_SPO0_SRVW0_SSO0_SVW4_SK3_SKFTR0_SKXCCM0_SGRO0_TDMI0_TIN1_TLDS1_TLDSMn1_ULSGRO1_USL1_UIOFGRO0_UPLRP0_USFGRO0_VSn1_VWA4_VWB2_WSGRA0_WSGRB2_WS64_WG32_8_1_WGM2_WGMXCC32_WGMXCCGn1
    SolutionIndex: 75
    SolutionNameMin: Cijk_Alik_Bjlk_S_B_Bias_HA_S_SAV_UserArgs_MT128x64x32_MI16x16x1_SN_LDSB1_AFC0_AG1_AFEM1_AFEM1_ASEM1_CLR1_CADS0_DTLA0_DTLB0_DTVA0_DTVB0_DTVMXSA0_DTVMXSB0_DTVSM0_DPLB0_EPS0_ELFLR0_EMLLn1_FDSI0_GRPM1_GRVWA4_GRVWB4_GSU0_GSUAMB_GSUC0_GSUWGMRR0_GLS0_ISA950_IU1_K1_LDSTI0_LBSPPA512_LBSPPB0_LBSPPM0_LPA8_LPB0_LPM0_LRVWn1_LWPMn1_MIAV1_MIWT4_2_MO40_MGRIPM1_NTn1_NTA0_NTB0_NTC4_NTD4_NTM0_NEPBS12_NLCA1_NLCB1_ONLL1_PGR2_PLR1_PKA1_SGROB0_SIA3_SS1_SU0_SUM0_SUS0_SPO0_SRVW0_SSO0_SVW4_SK3_SKFTR0_SKXCCM0_SGRO0_TDMI0_TIN1_TLDS1_TLDSMn1_ULSGRO1_USL1_UIOFGRO0_UPLRP0_USFGRO1_VSn1_VWA4_VWB2_WSGRA0_WSGRB0_WS64_WG32_8_1_WGM2_WGMXCC8_WGMXCCGn1
    SolutionIndex: 76
    SolutionNameMin: Cijk_Alik_Bjlk_S_B_Bias_HA_S_SAV_UserArgs_MT128x32x32_MI16x16x1_SN_LDSB0_AFC0_AG0_AFEM1_AFEM1_ASEM1_CLR1_CADS0_DTLA0_DTLB0_DTVA0_DTVB0_DTVMXSA0_DTVMXSB0_DTVSM0_DPLB0_EPS1_ELFLR0_EMLLn1_FDSI0_GRPM1_GRVWA4_GRVWB1_GSU0_GSUAMB_GSUC0_GSUWGMRR0_GLS0_ISA950_IU1_K1_LDSTI0_LBSPPA512_LBSPPB512_LBSPPM0_LPA8_LPB16_LPM0_LRVWn1_LWPMn1_MIAV0_MIWT4_1_MO40_MGRIPM1_NTn1_NTA0_NTB0_NTC4_NTD4_NTM0_NEPBS8_NLCA1_NLCB1_ONLL1_PGR1_PLR1_PKA1_SGROB0_SIA3_SS1_SU0_SUM0_SUS0_SPO1_SRVW0_SSO0_SVW4_SK3_SKFTR0_SKXCCM0_SGRO0_TDMI0_TIN1_TLDS1_TLDSMn1_ULSGRO0_USL1_UIOFGRO0_UPLRP0_USFGRO1_VSn1_VWA4_VWB1_WSGRA0_WSGRB0_WS64_WG32_8_1_WGMn1_WGMXCC1_WGMXCCGn1
    SolutionIndex: 77
    SolutionNameMin: Cijk_Alik_Bjlk_S_B_Bias_HA_S_SAV_UserArgs_MT64x64x32_MI16x16x1_SN_LDSB0_AFC0_AG1_AFEM1_AFEM1_ASEM1_CLR1_CADS0_DTLA0_DTLB0_DTVA0_DTVB0_DTVMXSA0_DTVMXSB0_DTVSM0_DPLB0_EPS1_ELFLR0_EMLL0_FDSI0_GRPM1_GRVWA4_GRVWB1_GSU0_GSUAMB_GSUC0_GSUWGMRR0_GLS0_ISA950_IU1_K1_LDSTI0_LBSPPA512_LBSPPB1024_LBSPPM0_LPA8_LPB16_LPM0_LRVWn1_LWPMn1_MIAV0_MIWT4_1_MO40_MGRIPM1_NTn1_NTA0_NTB0_NTC4_NTD4_NTM0_NEPBS10_NLCA1_NLCB1_ONLL1_PGR1_PLR1_PKA1_SGROB0_SIA3_SS1_SU0_SUM0_SUS0_SPO1_SRVW0_SSO0_SVW4_SK3_SKFTR0_SKXCCM8_SGRO0_TDMI0_TIN1_TLDS1_TLDSMn1_ULSGRO0_USL1_UIOFGRO0_UPLRP0_USFGRO1_VSn1_VWA4_VWB1_WSGRA0_WSGRB0_WS64_WG16_16_1_WGM4_WGMXCC1_WGMXCCGn1
    SolutionIndex: 78
    SolutionNameMin: Cijk_Alik_Bjlk_S_B_Bias_HA_S_SAV_UserArgs_MT64x64x32_MI16x16x1_SN_LDSB0_AFC0_AG0_AFEM1_AFEM1_ASEM1_CLR1_CADS0_DTLA0_DTLB0_DTVA0_DTVB0_DTVMXSA0_DTVMXSB0_DTVSM0_DPLB0_EPS1_ELFLR0_EMLLn1_FDSI0_GRPM1_GRVWA4_GRVWB1_GSU0_GSUAMB_GSUC0_GSUWGMRR0_GLS0_ISA950_IU1_K1_LDSTI0_LBSPPA256_LBSPPB0_LBSPPM0_LPA8_LPB0_LPM0_LRVWn1_LWPMn1_MIAV0_MIWT2_2_MO40_MGRIPM1_NTn1_NTA0_NTB0_NTC4_NTD4_NTM0_NEPBS14_NLCA1_NLCB1_ONLL1_PGR1_PLR1_PKA1_SGROB0_SIA3_SS1_SU0_SUM0_SUS0_SPO1_SRVW0_SSO0_SVW2_SK3_SKFTR0_SKXCCM8_SGRO0_TDMI0_TIN1_TLDS1_TLDSMn1_ULSGRO0_USL1_UIOFGRO0_UPLRP0_USFGRO1_VSn1_VWA2_VWB2_WSGRA0_WSGRB2_WS64_WG32_8_1_WGM24_WGMXCC1_WGMXCCGn1
    SolutionIndex: 79
    SolutionNameMin: Cijk_Alik_Bjlk_S_B_Bias_HA_S_SAV_UserArgs_MT128x80x32_MI16x16x1_SN_LDSB0_AFC0_AG1_AFEM1_AFEM1_ASEM1_CLR1_CADS0_DTLA0_DTLB0_DTVA0_DTVB0_DTVMXSA0_DTVMXSB0_DTVSM0_DPLB0_EPS0_ELFLR0_EMLL0_FDSI0_GRPM1_GRVWA4_GRVWB2_GSU0_GSUAMB_GSUC0_GSUWGMRR0_GLS0_ISA950_IU1_K1_LDSTI0_LBSPPA256_LBSPPB1280_LBSPPM0_LPA8_LPB16_LPM0_LRVWn1_LWPMn1_MIAV1_MIWT2_5_MO40_MGRIPM1_NTn1_NTA0_NTB0_NTC4_NTD4_NTM0_NEPBS0_NLCA1_NLCB5_ONLL1_PGR2_PLR1_PKA1_SGROB0_SIA3_SS1_SU0_SUM0_SUS0_SPO1_SRVW0_SSO0_SVW2_SK3_SKFTR0_SKXCCM8_SGRO0_TDMI0_TIN1_TLDS1_TLDSMn1_ULSGRO1_USL1_UIOFGRO0_UPLRP0_USFGRO1_VSn1_VWA2_VWB1_WSGRA2_WSGRB2_WS64_WG64_4_1_WGM48_WGMXCC1_WGMXCCGn1
    SolutionIndex: 80
    SolutionNameMin: Cijk_Alik_Bjlk_S_B_Bias_HA_S_SAV_UserArgs_MT128x32x32_MI16x16x1_SN_LDSB0_AFC0_AG0_AFEM1_AFEM1_ASEM1_CLR1_CADS0_DTLA0_DTLB0_DTVA0_DTVB0_DTVMXSA0_DTVMXSB0_DTVSM0_DPLB0_EPS1_ELFLR0_EMLL0_FDSI0_GRPM1_GRVWA4_GRVWB1_GSU0_GSUAMB_GSUC0_GSUWGMRR0_GLS0_ISA950_IU1_K1_LDSTI0_LBSPPA512_LBSPPB512_LBSPPM0_LPA8_LPB16_LPM0_LRVWn1_LWPMn1_MIAV0_MIWT4_1_MO40_MGRIPM1_NTn1_NTA0_NTB0_NTC4_NTD4_NTM0_NEPBS14_NLCA1_NLCB1_ONLL1_PGR1_PLR1_PKA1_SGROB0_SIA3_SS1_SU0_SUM0_SUS0_SPO1_SRVW0_SSO0_SVW4_SK3_SKFTR0_SKXCCM8_SGRO0_TDMI0_TIN1_TLDS1_TLDSMn1_ULSGRO0_USL1_UIOFGRO0_UPLRP0_USFGRO1_VSn1_VWA4_VWB1_WSGRA0_WSGRB0_WS64_WG32_8_1_WGM48_WGMXCC1_WGMXCCGn1
    SolutionIndex: 81
    SolutionNameMin: Cijk_Alik_Bjlk_S_B_Bias_HA_S_SAV_UserArgs_MT128x64x32_MI16x16x1_SN_LDSB0_AFC0_AG0_AFEM1_AFEM1_ASEM1_CLR1_CADS0_DTLA0_DTLB0_DTVA0_DTVB0_DTVMXSA0_DTVMXSB0_DTVSM0_DPLB0_EPS1_ELFLR0_EMLLn1_FDSI0_GRPM1_GRVWA4_GRVWB1_GSU0_GSUAMB_GSUC0_GSUWGMRR0_GLS0_ISA950_IU1_K1_LDSTI0_LBSPPA512_LBSPPB0_LBSPPM0_LPA8_LPB0_LPM0_LRVWn1_LWPMn1_MIAV0_MIWT4_2_MO40_MGRIPM1_NTn1_NTA0_NTB0_NTC4_NTD0_NTM0_NEPBS10_NLCA1_NLCB1_ONLL1_PGR1_PLR1_PKA1_SGROB0_SIA3_SS1_SU0_SUM0_SUS0_SPO0_SRVW0_SSO1_SVW4_SK3_SKFTR0_SKXCCM0_SGRO0_TDMI0_TIN1_TLDS1_TLDSMn1_ULSGRO0_USL1_UIOFGRO0_UPLRP0_USFGRO1_VSn1_VWA4_VWB2_WSGRA0_WSGRB0_WS64_WG32_8_1_WGMn1_WGMXCC8_WGMXCCGn1
    SolutionIndex: 82
    SolutionNameMin: Cijk_Alik_Bjlk_S_B_Bias_HA_S_SAV_UserArgs_MT64x160x32_MI16x16x1_SN_LDSB0_AFC0_AG0_AFEM1_AFEM1_ASEM1_CLR1_CADS0_DTLA0_DTLB0_DTVA0_DTVB0_DTVMXSA0_DTVMXSB0_DTVSM0_DPLB0_EPS1_ELFLR0_EMLL0_FDSI0_GRPM1_GRVWA4_GRVWB1_GSU0_GSUAMB_GSUC0_GSUWGMRR0_GLS0_ISA950_IU1_K1_LDSTI0_LBSPPA256_LBSPPB2560_LBSPPM0_LPA8_LPB16_LPM0_LRVWn1_LWPMn1_MIAV1_MIWT2_5_MO40_MGRIPM1_NTn1_NTA0_NTB0_NTC4_NTD4_NTM0_NEPBS0_NLCA1_NLCB5_ONLL1_PGR1_PLR1_PKA1_SGROB0_SIA3_SS1_SU0_SUM0_SUS0_SPO0_SRVW0_SSO0_SVW2_SK3_SKFTR0_SKXCCM8_SGRO0_TDMI0_TIN1_TLDS1_TLDSMn1_ULSGRO0_USL1_UIOFGRO0_UPLRP0_USFGRO1_VSn1_VWA2_VWB1_WSGRA0_WSGRB0_WS64_WG32_8_1_WGMn16_WGMXCC1_WGMXCCGn1
    SolutionIndex: 83
    SolutionNameMin: Cijk_Alik_Bjlk_S_B_Bias_HA_S_SAV_UserArgs_MT64x64x32_MI32x32x1_SN_LDSB0_AFC0_AG1_AFEM1_AFEM1_ASEM1_CLR1_CADS0_DTLA0_DTLB0_DTVA0_DTVB0_DTVMXSA0_DTVMXSB0_DTVSM0_DPLB0_EPS1_ELFLR0_EMLL0_FDSI0_GRPM1_GRVWA4_GRVWB1_GSU0_GSUAMB_GSUC0_GSUWGMRR0_GLS0_ISA950_IU1_K1_LDSTI0_LBSPPA128_LBSPPB0_LBSPPM0_LPA4_LPB0_LPM0_LRVWn1_LWPMn1_MIAV0_MIWT1_1_MO40_MGRIPM1_NTn1_NTA0_NTB0_NTC4_NTD4_NTM0_NEPBS0_NLCA1_NLCB1_ONLL1_PGR1_PLR1_PKA1_SGROB0_SIA3_SS1_SU0_SUM0_SUS0_SPO1_SRVW0_SSO0_SVW1_SK3_SKFTR0_SKXCCM8_SGRO0_TDMI0_TIN1_TLDS1_TLDSMn1_ULSGRO0_USL1_UIOFGRO0_UPLRP0_USFGRO1_VSn1_VWA1_VWB1_WSGRA2_WSGRB2_WS64_WG64_4_1_WGM4_WGMXCC1_WGMXCCGn1
    SolutionIndex: 84
    SolutionNameMin: Cijk_Alik_Bjlk_S_B_Bias_HA_S_SAV_UserArgs_MT192x320x32_MI16x16x1_SN_LDSB1_AFC0_AG1_AFEM1_AFEM1_ASEM1_CLR1_CADS0_DTLA0_DTLB0_DTVA0_DTVB0_DTVMXSA0_DTVMXSB0_DTVSM0_DPLB0_EPS0_ELFLR0_EMLLn1_FDSI0_GRPM1_GRVWA4_GRVWB4_GSU0_GSUAMB_GSUC0_GSUWGMRR0_GLS0_ISA950_IU1_K1_LDSTI0_LBSPPA512_LBSPPB5120_LBSPPM0_LPA8_LPB16_LPM0_LRVWn1_LWPMn1_MIAV0_MIWT12_5_MO40_MGRIPM1_NTn1_NTA0_NTB0_NTC0_NTD0_NTM0_NEPBS12_NLCA1_NLCB5_ONLL1_PGR2_PLR1_PKA1_SGROB0_SIA3_SS1_SU0_SUM0_SUS0_SPO1_SRVW0_SSO1_SVW4_SK3_SKFTR0_SKXCCM0_SGRO0_TDMI0_TIN1_TLDS1_TLDSMn1_ULSGRO1_USL1_UIOFGRO0_UPLRP0_USFGRO0_VSn1_VWA4_VWB1_WSGRA0_WSGRB0_WS64_WG16_16_1_WGM4_WGMXCC2_WGMXCCGn1
    SolutionIndex: 85
    SolutionNameMin: Cijk_Alik_Bjlk_S_B_Bias_HA_S_SAV_UserArgs_MT64x32x32_MI16x16x1_SN_LDSB0_AFC0_AG1_AFEM1_AFEM1_ASEM1_CLR1_CADS0_DTLA0_DTLB0_DTVA0_DTVB0_DTVMXSA0_DTVMXSB0_DTVSM0_DPLB0_EPS0_ELFLR0_EMLL0_FDSI0_GRPM1_GRVWA4_GRVWB1_GSU0_GSUAMB_GSUC0_GSUWGMRR0_GLS0_ISA950_IU1_K1_LDSTI0_LBSPPA256_LBSPPB512_LBSPPM0_LPA8_LPB16_LPM0_LRVWn1_LWPMn1_MIAV0_MIWT2_1_MO40_MGRIPM1_NTn1_NTA0_NTB0_NTC4_NTD4_NTM0_NEPBS10_NLCA1_NLCB1_ONLL1_PGR2_PLR1_PKA1_SGROB0_SIA3_SS1_SU0_SUM0_SUS0_SPO1_SRVW0_SSO1_SVW2_SK3_SKFTR0_SKXCCM0_SGRO0_TDMI0_TIN1_TLDS1_TLDSMn1_ULSGRO0_USL1_UIOFGRO0_UPLRP0_USFGRO0_VSn1_VWA2_VWB1_WSGRA0_WSGRB0_WS64_WG32_8_1_WGMn1_WGMXCC1_WGMXCCGn1
    SolutionIndex: 86
    SolutionNameMin: Cijk_Alik_Bjlk_S_B_Bias_HA_S_SAV_UserArgs_MT32x64x32_MI16x16x1_SN_LDSB0_AFC0_AG1_AFEM1_AFEM1_ASEM1_CLR1_CADS0_DTLA0_DTLB0_DTVA0_DTVB0_DTVMXSA0_DTVMXSB0_DTVSM0_DPLB0_EPS0_ELFLR0_EMLLn1_FDSI0_GRPM1_GRVWA4_GRVWB1_GSU0_GSUAMB_GSUC0_GSUWGMRR0_GLS0_ISA950_IU1_K1_LDSTI0_LBSPPA256_LBSPPB1024_LBSPPM0_LPA8_LPB16_LPM0_LRVWn1_LWPMn1_MIAV0_MIWT2_1_MO40_MGRIPM1_NTn1_NTA0_NTB0_NTC4_NTD4_NTM0_NEPBS10_NLCA1_NLCB1_ONLL1_PGR2_PLR1_PKA1_SGROB0_SIA3_SS1_SU0_SUM0_SUS0_SPO1_SRVW0_SSO0_SVW2_SK3_SKFTR0_SKXCCM8_SGRO0_TDMI0_TIN1_TLDS1_TLDSMn1_ULSGRO0_USL1_UIOFGRO0_UPLRP0_USFGRO1_VSn1_VWA2_VWB1_WSGRA0_WSGRB0_WS64_WG16_16_1_WGM8_WGMXCC1_WGMXCCGn1
    SolutionIndex: 87
    SolutionNameMin: Cijk_Alik_Bjlk_S_B_Bias_HA_S_SAV_UserArgs_MT64x32x32_MI16x16x1_SN_LDSB0_AFC0_AG1_AFEM1_AFEM1_ASEM1_CLR1_CADS0_DTLA0_DTLB0_DTVA0_DTVB0_DTVMXSA0_DTVMXSB0_DTVSM0_DPLB0_EPS0_ELFLR0_EMLLn1_FDSI0_GRPM1_GRVWA4_GRVWB1_GSU0_GSUAMB_GSUC0_GSUWGMRR0_GLS0_ISA950_IU1_K1_LDSTI0_LBSPPA256_LBSPPB512_LBSPPM0_LPA8_LPB16_LPM0_LRVWn1_LWPMn1_MIAV0_MIWT2_1_MO40_MGRIPM1_NTn1_NTA0_NTB0_NTC4_NTD4_NTM0_NEPBS10_NLCA1_NLCB1_ONLL1_PGR2_PLR1_PKA1_SGROB0_SIA3_SS1_SU0_SUM0_SUS0_SPO1_SRVW0_SSO0_SVW2_SK3_SKFTR0_SKXCCM8_SGRO0_TDMI0_TIN1_TLDS1_TLDSMn1_ULSGRO0_USL1_UIOFGRO0_UPLRP0_USFGRO1_VSn1_VWA2_VWB1_WSGRA0_WSGRB0_WS64_WG32_8_1_WGM6_WGMXCC1_WGMXCCGn1
    SolutionIndex: 88
    SolutionNameMin: Cijk_Alik_Bjlk_S_B_Bias_HA_S_SAV_UserArgs_MT96x64x32_MI16x16x1_SN_LDSB0_AFC0_AG1_AFEM1_AFEM1_ASEM1_CLR1_CADS0_DTLA0_DTLB0_DTVA0_DTVB0_DTVMXSA0_DTVMXSB0_DTVSM0_DPLB0_EPS0_ELFLR0_EMLLn1_FDSI0_GRPM1_GRVWA4_GRVWB4_GSU0_GSUAMB_GSUC0_GSUWGMRR0_GLS0_ISA950_IU1_K1_LDSTI0_LBSPPA256_LBSPPB1024_LBSPPM0_LPA8_LPB16_LPM0_LRVWn1_LWPMn1_MIAV0_MIWT6_1_MO40_MGRIPM1_NTn1_NTA0_NTB0_NTC4_NTD4_NTM0_NEPBS0_NLCA1_NLCB1_ONLL1_PGR2_PLR1_PKA1_SGROB0_SIA3_SS1_SU0_SUM0_SUS0_SPO0_SRVW0_SSO0_SVW2_SK3_SKFTR0_SKXCCM8_SGRO0_TDMI0_TIN0_TLDS1_TLDSMn1_ULSGRO1_USL1_UIOFGRO0_UPLRP0_USFGRO0_VSn1_VWA2_VWB1_WSGRA2_WSGRB2_WS64_WG16_16_1_WGM2_WGMXCC1_WGMXCCGn1
    SolutionIndex: 89
    SolutionNameMin: Cijk_Alik_Bjlk_S_B_Bias_HA_S_SAV_UserArgs_MT64x48x32_MI16x16x1_SN_LDSB0_AFC0_AG1_AFEM1_AFEM1_ASEM1_CLR1_CADS0_DTLA0_DTLB0_DTVA0_DTVB0_DTVMXSA0_DTVMXSB0_DTVSM0_DPLB0_EPS0_ELFLR0_EMLLn1_FDSI0_GRPM1_GRVWA4_GRVWB1_GSU0_GSUAMB_GSUC0_GSUWGMRR0_GLS0_ISA950_IU1_K1_LDSTI0_LBSPPA128_LBSPPB768_LBSPPM0_LPA8_LPB16_LPM0_LRVWn1_LWPMn1_MIAV0_MIWT1_3_MO40_MGRIPM1_NTn1_NTA0_NTB0_NTC4_NTD4_NTM0_NEPBS0_NLCA1_NLCB3_ONLL1_PGR2_PLR1_PKA1_SGROB0_SIA3_SS1_SU8_SUM0_SUS512_SPO0_SRVW0_SSO1_SVW1_SK3_SKFTR0_SKXCCM4_SGRO0_TDMI0_TIN0_TLDS1_TLDSMn1_ULSGRO0_USL1_UIOFGRO0_UPLRP0_USFGRO0_VSn1_VWA1_VWB1_WSGRA0_WSGRB2_WS64_WG64_4_1_WGM16_WGMXCC1_WGMXCCGn1
    SolutionIndex: 90
    SolutionNameMin: Cijk_Alik_Bjlk_S_B_Bias_HA_S_SAV_UserArgs_MT32x96x32_MI16x16x1_SN_LDSB1_AFC0_AG1_AFEM1_AFEM1_ASEM1_CLR1_CADS0_DTLA0_DTLB0_DTVA0_DTVB0_DTVMXSA0_DTVMXSB0_DTVSM0_DPLB0_EPS0_ELFLR0_EMLL0_FDSI0_GRPM1_GRVWA4_GRVWB1_GSU0_GSUAMB_GSUC0_GSUWGMRR0_GLS0_ISA950_IU1_K1_LDSTI0_LBSPPA128_LBSPPB1536_LBSPPM0_LPA8_LPB16_LPM0_LRVWn1_LWPMn1_MIAV0_MIWT1_3_MO40_MGRIPM1_NTn1_NTA0_NTB0_NTC0_NTD4_NTM0_NEPBS12_NLCA1_NLCB3_ONLL1_PGR2_PLR1_PKA1_SGROB0_SIA3_SS1_SU0_SUM0_SUS0_SPO0_SRVW0_SSO0_SVW1_SK3_SKFTR0_SKXCCM0_SGRO0_TDMI0_TIN1_TLDS1_TLDSMn1_ULSGRO0_USL1_UIOFGRO0_UPLRP0_USFGRO1_VSn1_VWA1_VWB1_WSGRA2_WSGRB0_WS64_WG32_8_1_WGM8_WGMXCC1_WGMXCCGn1
    SolutionIndex: 91
    SolutionNameMin: Cijk_Alik_Bjlk_S_B_Bias_HA_S_SAV_UserArgs_MT64x32x32_MI16x16x1_SN_LDSB0_AFC0_AG0_AFEM1_AFEM1_ASEM1_CLR1_CADS0_DTLA0_DTLB0_DTVA0_DTVB0_DTVMXSA0_DTVMXSB0_DTVSM0_DPLB0_EPS0_ELFLR0_EMLL0_FDSI0_GRPM1_GRVWA4_GRVWB1_GSU0_GSUAMB_GSUC0_GSUWGMRR0_GLS0_ISA950_IU1_K1_LDSTI0_LBSPPA256_LBSPPB512_LBSPPM0_LPA8_LPB16_LPM0_LRVWn1_LWPMn1_MIAV0_MIWT2_1_MO40_MGRIPM1_NTn1_NTA0_NTB0_NTC4_NTD4_NTM0_NEPBS16_NLCA1_NLCB1_ONLL1_PGR2_PLR1_PKA1_SGROB0_SIA3_SS1_SU0_SUM0_SUS0_SPO1_SRVW0_SSO4_SVW2_SK3_SKFTR0_SKXCCM0_SGRO0_TDMI0_TIN1_TLDS1_TLDSMn1_ULSGRO0_USL1_UIOFGRO0_UPLRP0_USFGRO0_VSn1_VWA2_VWB1_WSGRA0_WSGRB2_WS64_WG32_8_1_WGM4_WGMXCC1_WGMXCCGn1
    SolutionIndex: 92
    SolutionNameMin: Cijk_Alik_Bjlk_S_B_Bias_HA_S_SAV_UserArgs_MT64x64x32_MI16x16x1_SN_LDSB0_AFC0_AG1_AFEM1_AFEM1_ASEM1_CLR1_CADS0_DTLA0_DTLB0_DTVA0_DTVB0_DTVMXSA0_DTVMXSB0_DTVSM0_DPLB0_EPS0_ELFLR0_EMLLn1_FDSI0_GRPM1_GRVWA4_GRVWB4_GSU0_GSUAMB_GSUC0_GSUWGMRR0_GLS0_ISA950_IU1_K1_LDSTI0_LBSPPA256_LBSPPB0_LBSPPM0_LPA8_LPB0_LPM0_LRVWn1_LWPMn1_MIAV0_MIWT2_2_MO40_MGRIPM1_NTn1_NTA0_NTB0_NTC0_NTD4_NTM0_NEPBS16_NLCA1_NLCB1_ONLL1_PGR2_PLR1_PKA1_SGROB0_SIA3_SS1_SU0_SUM0_SUS0_SPO1_SRVW0_SSO0_SVW2_SK3_SKFTR0_SKXCCM0_SGRO0_TDMI0_TIN1_TLDS1_TLDSMn1_ULSGRO0_USL1_UIOFGRO0_UPLRP0_USFGRO0_VSn1_VWA2_VWB2_WSGRA0_WSGRB0_WS64_WG32_8_1_WGM6_WGMXCC4_WGMXCCGn1
    SolutionIndex: 93
    SolutionNameMin: Cijk_Alik_Bjlk_S_B_Bias_HA_S_SAV_UserArgs_MT64x192x32_MI16x16x1_SN_LDSB0_AFC0_AG1_AFEM1_AFEM1_ASEM1_CLR1_CADS0_DTLA0_DTLB0_DTVA0_DTVB0_DTVMXSA0_DTVMXSB0_DTVSM0_DPLB0_EPS0_ELFLR0_EMLLn1_FDSI0_GRPM1_GRVWA4_GRVWB4_GSU0_GSUAMB_GSUC0_GSUWGMRR0_GLS0_ISA950_IU1_K1_LDSTI0_LBSPPA512_LBSPPB3072_LBSPPM0_LPA8_LPB16_LPM0_LRVWn1_LWPMn1_MIAV0_MIWT4_3_MO40_MGRIPM1_NTn1_NTA0_NTB0_NTC4_NTD4_NTM0_NEPBS16_NLCA1_NLCB3_ONLL1_PGR2_PLR1_PKA1_SGROB0_SIA3_SS1_SU0_SUM0_SUS0_SPO1_SRVW0_SSO0_SVW4_SK3_SKFTR0_SKXCCM0_SGRO0_TDMI0_TIN1_TLDS1_TLDSMn1_ULSGRO0_USL1_UIOFGRO0_UPLRP0_USFGRO0_VSn1_VWA4_VWB1_WSGRA0_WSGRB2_WS64_WG16_16_1_WGM4_WGMXCC4_WGMXCCGn1
    SolutionIndex: 94
    SolutionNameMin: Cijk_Alik_Bjlk_S_B_Bias_HA_S_SAV_UserArgs_MT64x64x32_MI16x16x1_SN_LDSB0_AFC0_AG1_AFEM1_AFEM1_ASEM1_CLR1_CADS0_DTLA0_DTLB0_DTVA0_DTVB0_DTVMXSA0_DTVMXSB0_DTVSM0_DPLB0_EPS0_ELFLR0_EMLLn1_FDSI0_GRPM1_GRVWA4_GRVWB1_GSU0_GSUAMB_GSUC0_GSUWGMRR0_GLS0_ISA950_IU1_K1_LDSTI0_LBSPPA512_LBSPPB1024_LBSPPM0_LPA8_LPB16_LPM0_LRVWn1_LWPMn1_MIAV1_MIWT4_1_MO40_MGRIPM1_NTn1_NTA0_NTB0_NTC4_NTD4_NTM0_NEPBS8_NLCA1_NLCB1_ONLL1_PGR2_PLR1_PKA1_SGROB0_SIA3_SS1_SU0_SUM0_SUS0_SPO0_SRVW0_SSO0_SVW4_SK3_SKFTR0_SKXCCM0_SGRO0_TDMI0_TIN1_TLDS1_TLDSMn1_ULSGRO0_USL1_UIOFGRO0_UPLRP0_USFGRO1_VSn1_VWA4_VWB1_WSGRA2_WSGRB0_WS64_WG16_16_1_WGM8_WGMXCC1_WGMXCCGn1
    SolutionIndex: 95
    SolutionNameMin: Cijk_Alik_Bjlk_S_B_Bias_HA_S_SAV_UserArgs_MT128x480x32_MI16x16x1_SN_LDSB1_AFC0_AG0_AFEM1_AFEM1_ASEM1_CLR1_CADS0_DTLA0_DTLB0_DTVA0_DTVB0_DTVMXSA0_DTVMXSB0_DTVSM0_DPLB0_EPS0_ELFLR0_EMLL0_FDSI0_GRPM1_GRVWA2_GRVWB4_GSU0_GSUAMB_GSUC0_GSUWGMRR0_GLS0_ISA950_IU1_K1_LDSTI0_LBSPPA512_LBSPPB7680_LBSPPM0_LPA8_LPB16_LPM0_LRVWn1_LWPMn1_MIAV0_MIWT4_15_MO40_MGRIPM1_NTn1_NTA0_NTB0_NTC0_NTD0_NTM0_NEPBS0_NLCA1_NLCB15_ONLL1_PGR2_PLR1_PKA1_SGROB0_SIA3_SS1_SU8_SUM0_SUS128_SPO0_SRVW0_SSO1_SVW4_SK3_SKFTR0_SKXCCM4_SGRO0_TDMI0_TIN0_TLDS1_TLDSMn1_ULSGRO0_USL1_UIOFGRO0_UPLRP0_USFGRO0_VSn1_VWA4_VWB1_WSGRA0_WSGRB0_WS64_WG32_8_1_WGM2_WGMXCC1_WGMXCCGn1
    SolutionIndex: 96
    SolutionNameMin: Cijk_Alik_Bjlk_S_B_Bias_HA_S_SAV_UserArgs_MT64x64x32_MI16x16x1_SN_LDSB1_AFC0_AG0_AFEM1_AFEM1_ASEM1_CLR1_CADS0_DTLA0_DTLB0_DTVA0_DTVB0_DTVMXSA0_DTVMXSB0_DTVSM0_DPLB0_EPS0_ELFLR0_EMLL0_FDSI0_GRPM1_GRVWA1_GRVWB1_GSU0_GSUAMB_GSUC0_GSUWGMRR0_GLS0_ISA950_IU1_K1_LDSTI0_LBSPPA512_LBSPPB1024_LBSPPM0_LPA8_LPB16_LPM0_LRVWn1_LWPMn1_MIAV0_MIWT4_1_MO40_MGRIPM1_NTn1_NTA0_NTB0_NTC4_NTD4_NTM0_NEPBS12_NLCA1_NLCB1_ONLL1_PGR2_PLR1_PKA1_SGROB0_SIA3_SS1_SU0_SUM0_SUS0_SPO1_SRVW0_SSO0_SVW4_SK3_SKFTR0_SKXCCM4_SGRO0_TDMI0_TIN1_TLDS1_TLDSMn1_ULSGRO1_USL1_UIOFGRO0_UPLRP0_USFGRO0_VSn1_VWA4_VWB1_WSGRA0_WSGRB0_WS64_WG16_16_1_WGM6_WGMXCC1_WGMXCCGn1
    SolutionIndex: 97
    SolutionNameMin: Cijk_Alik_Bjlk_S_B_Bias_HA_S_SAV_UserArgs_MT64x64x32_MI16x16x1_SN_LDSB1_AFC0_AG1_AFEM1_AFEM1_ASEM1_CLR1_CADS0_DTLA0_DTLB0_DTVA0_DTVB0_DTVMXSA0_DTVMXSB0_DTVSM0_DPLB0_EPS0_ELFLR0_EMLL0_FDSI0_GRPM1_GRVWA4_GRVWB1_GSU0_GSUAMB_GSUC0_GSUWGMRR0_GLS0_ISA950_IU1_K1_LDSTI0_LBSPPA512_LBSPPB1024_LBSPPM0_LPA8_LPB16_LPM0_LRVWn1_LWPMn1_MIAV0_MIWT4_1_MO40_MGRIPM1_NTn1_NTA0_NTB0_NTC4_NTD4_NTM0_NEPBS12_NLCA1_NLCB1_ONLL1_PGR2_PLR1_PKA1_SGROB0_SIA3_SS1_SU0_SUM0_SUS0_SPO0_SRVW0_SSO0_SVW4_SK3_SKFTR0_SKXCCM0_SGRO0_TDMI0_TIN1_TLDS1_TLDSMn1_ULSGRO1_USL1_UIOFGRO0_UPLRP0_USFGRO0_VSn1_VWA4_VWB1_WSGRA2_WSGRB2_WS64_WG16_16_1_WGMn4_WGMXCC1_WGMXCCGn1
    SolutionIndex: 98
    SolutionNameMin: Cijk_Alik_Bjlk_S_B_Bias_HA_S_SAV_UserArgs_MT128x48x32_MI16x16x1_SN_LDSB0_AFC0_AG0_AFEM1_AFEM1_ASEM1_CLR1_CADS0_DTLA0_DTLB0_DTVA0_DTVB0_DTVMXSA0_DTVMXSB0_DTVSM0_DPLB0_EPS0_ELFLR0_EMLLn1_FDSI0_GRPM1_GRVWA4_GRVWB2_GSU0_GSUAMB_GSUC0_GSUWGMRR0_GLS0_ISA950_IU1_K1_LDSTI0_LBSPPA256_LBSPPB128_LBSPPM0_LPA8_LPB8_LPM0_LRVWn1_LWPMn1_MIAV0_MIWT2_3_MO40_MGRIPM1_NTn1_NTA0_NTB0_NTC4_NTD4_NTM0_NEPBS0_NLCA1_NLCB3_ONLL1_PGR2_PLR1_PKA1_SGROB0_SIA3_SS1_SU0_SUM0_SUS0_SPO0_SRVW0_SSO1_SVW2_SK3_SKFTR0_SKXCCM8_SGRO0_TDMI0_TIN1_TLDS2_TLDSMn1_ULSGRO0_USL1_UIOFGRO0_UPLRP0_USFGRO1_VSn1_VWA2_VWB1_WSGRA0_WSGRB0_WS64_WG64_4_1_WGM8_WGMXCC1_WGMXCCGn1
    SolutionIndex: 99
    SolutionNameMin: Cijk_Alik_Bjlk_S_B_Bias_HA_S_SAV_UserArgs_MT128x32x32_MI16x16x1_SN_LDSB0_AFC0_AG0_AFEM1_AFEM1_ASEM1_CLR1_CADS0_DTLA0_DTLB0_DTVA0_DTVB0_DTVMXSA0_DTVMXSB0_DTVSM0_DPLB0_EPS0_ELFLR0_EMLLn1_FDSI0_GRPM1_GRVWA4_GRVWB1_GSU0_GSUAMB_GSUC0_GSUWGMRR0_GLS0_ISA950_IU1_K1_LDSTI0_LBSPPA512_LBSPPB512_LBSPPM0_LPA8_LPB16_LPM0_LRVWn1_LWPMn1_MIAV1_MIWT4_1_MO40_MGRIPM1_NTn1_NTA0_NTB0_NTC4_NTD4_NTM0_NEPBS16_NLCA1_NLCB1_ONLL1_PGR2_PLR1_PKA1_SGROB0_SIA3_SS1_SU0_SUM0_SUS0_SPO0_SRVW0_SSO0_SVW4_SK3_SKFTR0_SKXCCM0_SGRO0_TDMI0_TIN1_TLDS1_TLDSMn1_ULSGRO1_USL1_UIOFGRO0_UPLRP0_USFGRO1_VSn1_VWA4_VWB1_WSGRA0_WSGRB2_WS64_WG32_8_1_WGM16_WGMXCC1_WGMXCCGn1
    SolutionIndex: 100
    SolutionNameMin: Cijk_Alik_Bjlk_S_B_Bias_HA_S_SAV_UserArgs_MT64x80x32_MI16x16x1_SN_LDSB0_AFC0_AG1_AFEM1_AFEM1_ASEM1_CLR1_CADS0_DTLA0_DTLB0_DTVA0_DTVB0_DTVMXSA0_DTVMXSB0_DTVSM0_DPLB0_EPS1_ELFLR0_EMLL0_FDSI0_GRPM1_GRVWA4_GRVWB1_GSU0_GSUAMB_GSUC0_GSUWGMRR0_GLS0_ISA950_IU1_K1_LDSTI0_LBSPPA128_LBSPPB1280_LBSPPM0_LPA8_LPB16_LPM0_LRVWn1_LWPMn1_MIAV0_MIWT1_5_MO40_MGRIPM1_NTn1_NTA0_NTB0_NTC4_NTD4_NTM0_NEPBS0_NLCA1_NLCB5_ONLL1_PGR1_PLR1_PKA1_SGROB0_SIA3_SS1_SU0_SUM0_SUS0_SPO1_SRVW0_SSO1_SVW1_SK3_SKFTR0_SKXCCM4_SGRO0_TDMI0_TIN1_TLDS1_TLDSMn1_ULSGRO0_USL1_UIOFGRO0_UPLRP0_USFGRO1_VSn1_VWA1_VWB1_WSGRA0_WSGRB0_WS64_WG64_4_1_WGM32_WGMXCC1_WGMXCCGn1
    SolutionIndex: 101
    SolutionNameMin: Cijk_Alik_Bjlk_S_B_Bias_HA_S_SAV_UserArgs_MT96x64x32_MI16x16x1_SN_LDSB1_AFC0_AG0_AFEM1_AFEM1_ASEM1_CLR1_CADS0_DTLA0_DTLB0_DTVA0_DTVB0_DTVMXSA0_DTVMXSB0_DTVSM0_DPLB0_EPS0_ELFLR0_EMLL0_FDSI0_GRPM1_GRVWA4_GRVWB1_GSU0_GSUAMB_GSUC0_GSUWGMRR0_GLS0_ISA950_IU1_K1_LDSTI0_LBSPPA256_LBSPPB1024_LBSPPM0_LPA8_LPB16_LPM0_LRVWn1_LWPMn1_MIAV1_MIWT6_1_MO40_MGRIPM1_NTn1_NTA0_NTB0_NTC4_NTD4_NTM0_NEPBS12_NLCA1_NLCB1_ONLL1_PGR2_PLR1_PKA1_SGROB0_SIA3_SS1_SU0_SUM0_SUS0_SPO0_SRVW0_SSO0_SVW2_SK3_SKFTR0_SKXCCM0_SGRO0_TDMI0_TIN1_TLDS1_TLDSMn1_ULSGRO1_USL1_UIOFGRO0_UPLRP0_USFGRO0_VSn1_VWA2_VWB1_WSGRA0_WSGRB0_WS64_WG16_16_1_WGMn1_WGMXCC2_WGMXCCGn1
    SolutionIndex: 102
    SolutionNameMin: Cijk_Alik_Bjlk_S_B_Bias_HA_S_SAV_UserArgs_MT64x96x32_MI16x16x1_SN_LDSB0_AFC0_AG1_AFEM1_AFEM1_ASEM1_CLR1_CADS0_DTLA0_DTLB0_DTVA0_DTVB0_DTVMXSA0_DTVMXSB0_DTVSM0_DPLB0_EPS1_ELFLR0_EMLL0_FDSI0_GRPM1_GRVWA4_GRVWB1_GSU0_GSUAMB_GSUC0_GSUWGMRR0_GLS0_ISA950_IU1_K1_LDSTI0_LBSPPA256_LBSPPB1536_LBSPPM0_LPA8_LPB16_LPM0_LRVWn1_LWPMn1_MIAV0_MIWT2_3_MO40_MGRIPM1_NTn1_NTA0_NTB0_NTC4_NTD4_NTM0_NEPBS14_NLCA1_NLCB3_ONLL1_PGR1_PLR1_PKA1_SGROB0_SIA3_SS1_SU0_SUM0_SUS0_SPO0_SRVW0_SSO0_SVW2_SK3_SKFTR0_SKXCCM8_SGRO0_TDMI0_TIN1_TLDS1_TLDSMn1_ULSGRO0_USL1_UIOFGRO0_UPLRP0_USFGRO1_VSn1_VWA2_VWB1_WSGRA0_WSGRB0_WS64_WG32_8_1_WGM32_WGMXCC1_WGMXCCGn1
    SolutionIndex: 103
    SolutionNameMin: Cijk_Alik_Bjlk_S_B_Bias_HA_S_SAV_UserArgs_MT128x32x32_MI32x32x1_SN_LDSB1_AFC0_AG0_AFEM1_AFEM1_ASEM1_CLR1_CADS0_DTLA0_DTLB0_DTVA0_DTVB0_DTVMXSA0_DTVMXSB0_DTVSM0_DPLB0_EPS0_ELFLR0_EMLLn1_FDSI0_GRPM1_GRVWA4_GRVWB1_GSU0_GSUAMB_GSUC0_GSUWGMRR0_GLS0_ISA950_IU1_K1_LDSTI0_LBSPPA128_LBSPPB0_LBSPPM0_LPA4_LPB0_LPM0_LRVWn1_LWPMn1_MIAV0_MIWT1_1_MO40_MGRIPM1_NTn1_NTA0_NTB0_NTC4_NTD4_NTM0_NEPBS16_NLCA1_NLCB1_ONLL1_PGR2_PLR1_PKA1_SGROB0_SIA3_SS1_SU0_SUM0_SUS0_SPO0_SRVW0_SSO0_SVW1_SK3_SKFTR0_SKXCCM4_SGRO0_TDMI0_TIN1_TLDS1_TLDSMn1_ULSGRO1_USL1_UIOFGRO0_UPLRP0_USFGRO1_VSn1_VWA1_VWB1_WSGRA0_WSGRB0_WS64_WG128_2_1_WGM2_WGMXCC1_WGMXCCGn1
    SolutionIndex: 104
    SolutionNameMin: Cijk_Alik_Bjlk_S_B_Bias_HA_S_SAV_UserArgs_MT64x64x32_MI16x16x1_SN_LDSB1_AFC0_AG1_AFEM1_AFEM1_ASEM1_CLR1_CADS0_DTLA0_DTLB0_DTVA0_DTVB0_DTVMXSA0_DTVMXSB0_DTVSM0_DPLB0_EPS0_ELFLR0_EMLL0_FDSI0_GRPM1_GRVWA4_GRVWB1_GSU0_GSUAMB_GSUC0_GSUWGMRR0_GLS0_ISA950_IU1_K1_LDSTI0_LBSPPA512_LBSPPB1024_LBSPPM0_LPA8_LPB16_LPM0_LRVWn1_LWPMn1_MIAV0_MIWT4_1_MO40_MGRIPM1_NTn1_NTA0_NTB4_NTC4_NTD0_NTM0_NEPBS10_NLCA1_NLCB1_ONLL1_PGR2_PLR1_PKA1_SGROB0_SIA3_SS1_SU0_SUM0_SUS0_SPO1_SRVW0_SSO0_SVW4_SK3_SKFTR0_SKXCCM0_SGRO0_TDMI0_TIN1_TLDS1_TLDSMn1_ULSGRO0_USL1_UIOFGRO0_UPLRP0_USFGRO1_VSn1_VWA4_VWB1_WSGRA0_WSGRB2_WS64_WG16_16_1_WGM8_WGMXCC1_WGMXCCGn1
    SolutionIndex: 105
    SolutionNameMin: Cijk_Alik_Bjlk_S_B_Bias_HA_S_SAV_UserArgs_MT512x128x32_MI32x32x1_SN_LDSB1_AFC0_AG0_AFEM1_AFEM1_ASEM1_CLR1_CADS0_DTLA0_DTLB0_DTVA0_DTVB0_DTVMXSA0_DTVMXSB0_DTVSM0_DPLB0_EPS1_ELFLR0_EMLLn1_FDSI0_GRPM1_GRVWA4_GRVWB4_GSU0_GSUAMB_GSUC0_GSUWGMRR0_GLS0_ISA950_IU1_K1_LDSTI0_LBSPPA512_LBSPPB0_LBSPPM0_LPA4_LPB0_LPM0_LRVWn1_LWPMn1_MIAV0_MIWT4_4_MO40_MGRIPM1_NTn1_NTA0_NTB0_NTC4_NTD4_NTM0_NEPBS14_NLCA1_NLCB1_ONLL1_PGR1_PLR1_PKA1_SGROB0_SIA3_SS1_SU0_SUM0_SUS0_SPO0_SRVW0_SSO1_SVW4_SK3_SKFTR0_SKXCCM8_SGRO0_TDMI0_TIN1_TLDS1_TLDSMn1_ULSGRO0_USL1_UIOFGRO0_UPLRP0_USFGRO1_VSn1_VWA4_VWB4_WSGRA2_WSGRB0_WS64_WG128_2_1_WGMn32_WGMXCC16_WGMXCCGn1
    SolutionIndex: 106
    SolutionNameMin: Cijk_Alik_Bjlk_S_B_Bias_HA_S_SAV_UserArgs_MT128x32x32_MI16x16x1_SN_LDSB0_AFC0_AG1_AFEM1_AFEM1_ASEM1_CLR1_CADS0_DTLA0_DTLB0_DTVA0_DTVB0_DTVMXSA0_DTVMXSB0_DTVSM0_DPLB0_EPS0_ELFLR0_EMLL0_FDSI0_GRPM1_GRVWA4_GRVWB1_GSU0_GSUAMB_GSUC0_GSUWGMRR0_GLS0_ISA950_IU1_K1_LDSTI0_LBSPPA512_LBSPPB512_LBSPPM0_LPA8_LPB16_LPM0_LRVWn1_LWPMn1_MIAV0_MIWT4_1_MO40_MGRIPM1_NTn1_NTA0_NTB0_NTC4_NTD4_NTM0_NEPBS10_NLCA1_NLCB1_ONLL1_PGR2_PLR1_PKA1_SGROB0_SIA3_SS1_SU0_SUM0_SUS0_SPO1_SRVW0_SSO0_SVW4_SK3_SKFTR0_SKXCCM8_SGRO0_TDMI0_TIN1_TLDS1_TLDSMn1_ULSGRO0_USL1_UIOFGRO0_UPLRP0_USFGRO1_VSn1_VWA4_VWB1_WSGRA0_WSGRB0_WS64_WG32_8_1_WGMn4_WGMXCC1_WGMXCCGn1
    SolutionIndex: 107
    SolutionNameMin: Cijk_Alik_Bjlk_S_B_Bias_HA_S_SAV_UserArgs_MT64x64x32_MI16x16x1_SN_LDSB0_AFC0_AG0_AFEM1_AFEM1_ASEM1_CLR1_CADS0_DTLA0_DTLB0_DTVA0_DTVB0_DTVMXSA0_DTVMXSB0_DTVSM0_DPLB0_EPS0_ELFLR0_EMLL0_FDSI0_GRPM1_GRVWA1_GRVWB4_GSU0_GSUAMB_GSUC0_GSUWGMRR0_GLS0_ISA950_IU1_K1_LDSTI0_LBSPPA128_LBSPPB0_LBSPPM0_LPA8_LPB0_LPM0_LRVWn1_LWPMn1_MIAV0_MIWT1_4_MO40_MGRIPM1_NTn1_NTA0_NTB0_NTC4_NTD4_NTM0_NEPBS16_NLCA1_NLCB1_ONLL1_PGR2_PLR1_PKA1_SGROB0_SIA3_SS1_SU0_SUM0_SUS0_SPO1_SRVW0_SSO0_SVW1_SK3_SKFTR0_SKXCCM8_SGRO0_TDMI0_TIN1_TLDS1_TLDSMn1_ULSGRO0_USL1_UIOFGRO0_UPLRP0_USFGRO1_VSn1_VWA1_VWB4_WSGRA0_WSGRB0_WS64_WG64_4_1_WGM4_WGMXCC1_WGMXCCGn1
    SolutionIndex: 108
    SolutionNameMin: Cijk_Alik_Bjlk_S_B_Bias_HA_S_SAV_UserArgs_MT64x64x32_MI16x16x1_SN_LDSB1_AFC0_AG0_AFEM1_AFEM1_ASEM1_CLR1_CADS0_DTLA0_DTLB0_DTVA0_DTVB0_DTVMXSA0_DTVMXSB0_DTVSM0_DPLB0_EPS0_ELFLR0_EMLLn1_FDSI0_GRPM1_GRVWA4_GRVWB1_GSU0_GSUAMB_GSUC0_GSUWGMRR0_GLS0_ISA950_IU1_K1_LDSTI0_LBSPPA512_LBSPPB1024_LBSPPM0_LPA8_LPB16_LPM0_LRVWn1_LWPMn1_MIAV0_MIWT4_1_MO40_MGRIPM1_NTn1_NTA0_NTB0_NTC4_NTD4_NTM0_NEPBS16_NLCA1_NLCB1_ONLL1_PGR2_PLR1_PKA1_SGROB0_SIA3_SS1_SU0_SUM0_SUS0_SPO0_SRVW0_SSO0_SVW4_SK3_SKFTR0_SKXCCM8_SGRO0_TDMI0_TIN1_TLDS1_TLDSMn1_ULSGRO1_USL1_UIOFGRO0_UPLRP0_USFGRO0_VSn1_VWA4_VWB1_WSGRA0_WSGRB2_WS64_WG16_16_1_WGMn8_WGMXCC1_WGMXCCGn1
    SolutionIndex: 109
    SolutionNameMin: Cijk_Alik_Bjlk_S_B_Bias_HA_S_SAV_UserArgs_MT128x16x32_MI16x16x1_SN_LDSB1_AFC0_AG0_AFEM1_AFEM1_ASEM1_CLR1_CADS0_DTLA0_DTLB0_DTVA0_DTVB0_DTVMXSA0_DTVMXSB0_DTVSM0_DPLB0_EPS0_ELFLR0_EMLLn1_FDSI0_GRPM1_GRVWA2_GRVWB1_GSU0_GSUAMB_GSUC0_GSUWGMRR0_GLS0_ISA950_IU1_K1_LDSTI0_LBSPPA256_LBSPPB256_LBSPPM0_LPA8_LPB16_LPM0_LRVWn1_LWPMn1_MIAV0_MIWT2_1_MO40_MGRIPM1_NTn1_NTA0_NTB0_NTC4_NTD4_NTM0_NEPBS10_NLCA1_NLCB1_ONLL1_PGR2_PLR1_PKA1_SGROB0_SIA3_SS1_SU0_SUM0_SUS0_SPO1_SRVW0_SSO0_SVW2_SK3_SKFTR0_SKXCCM0_SGRO0_TDMI0_TIN1_TLDS1_TLDSMn1_ULSGRO0_USL1_UIOFGRO0_UPLRP0_USFGRO1_VSn1_VWA2_VWB1_WSGRA0_WSGRB0_WS64_WG64_4_1_WGM8_WGMXCC1_WGMXCCGn1
    SolutionIndex: 110
    SolutionNameMin: Cijk_Alik_Bjlk_S_B_Bias_HA_S_SAV_UserArgs_MT32x64x64_MI16x16x1_SN_LDSB1_AFC0_AG1_AFEM1_AFEM1_ASEM1_CLR1_CADS0_DTLA0_DTLB0_DTVA0_DTVB0_DTVMXSA0_DTVMXSB0_DTVSM0_DPLB0_EPS0_ELFLR0_EMLL0_FDSI0_GRPM1_GRVWA4_GRVWB4_GSU0_GSUAMB_GSUC0_GSUWGMRR0_GLS0_ISA950_IU1_K1_LDSTI0_LBSPPA512_LBSPPB1024_LBSPPM0_LPA8_LPB16_LPM0_LRVWn1_LWPMn1_MIAV1_MIWT2_1_MO40_MGRIPM1_NTn1_NTA0_NTB0_NTC4_NTD4_NTM0_NEPBS14_NLCA1_NLCB1_ONLL1_PGR2_PLR1_PKA1_SGROB0_SIA3_SS1_SU0_SUM0_SUS0_SPO1_SRVW0_SSO0_SVW2_SK3_SKFTR0_SKXCCM4_SGRO0_TDMI0_TIN1_TLDS1_TLDSMn1_ULSGRO0_USL1_UIOFGRO0_UPLRP0_USFGRO1_VSn1_VWA2_VWB1_WSGRA0_WSGRB0_WS64_WG16_16_1_WGM6_WGMXCC1_WGMXCCGn1
    SolutionIndex: 111
    SolutionNameMin: Cijk_Alik_Bjlk_S_B_Bias_HA_S_SAV_UserArgs_MT64x64x64_MI16x16x1_SN_LDSB1_AFC0_AG0_AFEM1_AFEM1_ASEM1_CLR1_CADS0_DTLA0_DTLB0_DTVA0_DTVB0_DTVMXSA0_DTVMXSB0_DTVSM0_DPLB0_EPS1_ELFLR0_EMLLn1_FDSI0_GRPM1_GRVWA4_GRVWB1_GSU0_GSUAMB_GSUC0_GSUWGMRR0_GLS0_ISA950_IU1_K1_LDSTI0_LBSPPA1024_LBSPPB1024_LBSPPM0_LPA8_LPB16_LPM0_LRVWn1_LWPMn1_MIAV1_MIWT4_1_MO40_MGRIPM1_NTn1_NTA0_NTB0_NTC4_NTD4_NTM0_NEPBS0_NLCA1_NLCB1_ONLL1_PGR1_PLR1_PKA1_SGROB0_SIA3_SS1_SU0_SUM0_SUS0_SPO0_SRVW0_SSO0_SVW4_SK3_SKFTR0_SKXCCM4_SGRO0_TDMI0_TIN1_TLDS1_TLDSMn1_ULSGRO0_USL1_UIOFGRO0_UPLRP0_USFGRO1_VSn1_VWA4_VWB1_WSGRA0_WSGRB0_WS64_WG16_16_1_WGM8_WGMXCC1_WGMXCCGn1
    SolutionIndex: 112
    SolutionNameMin: Cijk_Alik_Bjlk_S_B_Bias_HA_S_SAV_UserArgs_MT64x64x32_MI16x16x1_SN_LDSB1_AFC0_AG1_AFEM1_AFEM1_ASEM1_CLR1_CADS0_DTLA0_DTLB0_DTVA0_DTVB0_DTVMXSA0_DTVMXSB0_DTVSM0_DPLB0_EPS0_ELFLR0_EMLLn1_FDSI0_GRPM1_GRVWA2_GRVWB1_GSU0_GSUAMB_GSUC0_GSUWGMRR0_GLS0_ISA950_IU1_K1_LDSTI0_LBSPPA512_LBSPPB1024_LBSPPM0_LPA8_LPB16_LPM0_LRVWn1_LWPMn1_MIAV0_MIWT4_1_MO40_MGRIPM1_NTn1_NTA0_NTB0_NTC4_NTD4_NTM0_NEPBS10_NLCA1_NLCB1_ONLL1_PGR2_PLR1_PKA1_SGROB0_SIA3_SS1_SU0_SUM0_SUS0_SPO1_SRVW0_SSO0_SVW4_SK3_SKFTR0_SKXCCM4_SGRO0_TDMI0_TIN1_TLDS1_TLDSMn1_ULSGRO1_USL1_UIOFGRO0_UPLRP0_USFGRO0_VSn1_VWA4_VWB1_WSGRA0_WSGRB2_WS64_WG16_16_1_WGMn32_WGMXCC1_WGMXCCGn1
    SolutionIndex: 113
    SolutionNameMin: Cijk_Alik_Bjlk_S_B_Bias_HA_S_SAV_UserArgs_MT64x64x32_MI16x16x1_SN_LDSB1_AFC0_AG1_AFEM1_AFEM1_ASEM1_CLR1_CADS0_DTLA0_DTLB0_DTVA0_DTVB0_DTVMXSA0_DTVMXSB0_DTVSM0_DPLB0_EPS0_ELFLR0_EMLLn1_FDSI0_GRPM1_GRVWA4_GRVWB1_GSU0_GSUAMB_GSUC0_GSUWGMRR0_GLS0_ISA950_IU1_K1_LDSTI0_LBSPPA512_LBSPPB1024_LBSPPM0_LPA8_LPB16_LPM0_LRVWn1_LWPMn1_MIAV1_MIWT4_1_MO40_MGRIPM1_NTn1_NTA0_NTB0_NTC4_NTD4_NTM0_NEPBS12_NLCA1_NLCB1_ONLL1_PGR2_PLR1_PKA1_SGROB0_SIA3_SS1_SU0_SUM0_SUS0_SPO0_SRVW0_SSO0_SVW4_SK3_SKFTR0_SKXCCM8_SGRO0_TDMI0_TIN1_TLDS1_TLDSMn1_ULSGRO1_USL1_UIOFGRO0_UPLRP0_USFGRO1_VSn1_VWA4_VWB1_WSGRA2_WSGRB2_WS64_WG16_16_1_WGMn2_WGMXCC1_WGMXCCGn1
    SolutionIndex: 114
    SolutionNameMin: Cijk_Alik_Bjlk_S_B_Bias_HA_S_SAV_UserArgs_MT64x48x32_MI16x16x1_SN_LDSB0_AFC0_AG0_AFEM1_AFEM1_ASEM1_CLR1_CADS0_DTLA0_DTLB0_DTVA0_DTVB0_DTVMXSA0_DTVMXSB0_DTVSM0_DPLB0_EPS0_ELFLR0_EMLLn1_FDSI0_GRPM1_GRVWA4_GRVWB1_GSU0_GSUAMB_GSUC0_GSUWGMRR0_GLS0_ISA950_IU1_K1_LDSTI0_LBSPPA128_LBSPPB128_LBSPPM0_LPA8_LPB8_LPM0_LRVWn1_LWPMn1_MIAV1_MIWT1_3_MO40_MGRIPM1_NTn1_NTA0_NTB0_NTC4_NTD4_NTM0_NEPBS14_NLCA1_NLCB3_ONLL1_PGR2_PLR1_PKA1_SGROB0_SIA3_SS1_SU0_SUM0_SUS0_SPO0_SRVW0_SSO0_SVW1_SK3_SKFTR0_SKXCCM0_SGRO0_TDMI0_TIN1_TLDS2_TLDSMn1_ULSGRO0_USL1_UIOFGRO0_UPLRP0_USFGRO1_VSn1_VWA1_VWB1_WSGRA0_WSGRB0_WS64_WG64_4_1_WGM4_WGMXCC2_WGMXCCGn1
    SolutionIndex: 115
    SolutionNameMin: Cijk_Alik_Bjlk_S_B_Bias_HA_S_SAV_UserArgs_MT256x256x32_MI32x32x1_SN_LDSB1_AFC0_AG1_AFEM1_AFEM1_ASEM1_CLR1_CADS0_DTLA0_DTLB0_DTVA0_DTVB0_DTVMXSA0_DTVMXSB0_DTVSM0_DPLB0_EPS0_ELFLR0_EMLL0_FDSI0_GRPM1_GRVWA4_GRVWB4_GSU0_GSUAMB_GSUC0_GSUWGMRR0_GLS0_ISA950_IU1_K1_LDSTI0_LBSPPA512_LBSPPB0_LBSPPM0_LPA4_LPB0_LPM0_LRVWn1_LWPMn1_MIAV0_MIWT8_2_MO40_MGRIPM1_NTn1_NTA0_NTB0_NTC0_NTD0_NTM0_NEPBS0_NLCA1_NLCB1_ONLL1_PGR2_PLR1_PKA1_SGROB0_SIA3_SS1_SU0_SUM0_SUS0_SPO1_SRVW0_SSO1_SVW4_SK3_SKFTR0_SKXCCM4_SGRO0_TDMI0_TIN1_TLDS1_TLDSMn1_ULSGRO0_USL1_UIOFGRO0_UPLRP0_USFGRO1_VSn1_VWA4_VWB2_WSGRA0_WSGRB0_WS64_WG32_8_1_WGM16_WGMXCC32_WGMXCCGn1
    SolutionIndex: 116
    SolutionNameMin: Cijk_Alik_Bjlk_S_B_Bias_HA_S_SAV_UserArgs_MT32x64x64_MI16x16x1_SN_LDSB1_AFC0_AG1_AFEM1_AFEM1_ASEM1_CLR1_CADS0_DTLA0_DTLB0_DTVA0_DTVB0_DTVMXSA0_DTVMXSB0_DTVSM0_DPLB0_EPS0_ELFLR0_EMLLn1_FDSI0_GRPM1_GRVWA4_GRVWB4_GSU0_GSUAMB_GSUC0_GSUWGMRR0_GLS0_ISA950_IU1_K1_LDSTI0_LBSPPA512_LBSPPB1024_LBSPPM0_LPA8_LPB16_LPM0_LRVWn1_LWPMn1_MIAV0_MIWT2_1_MO40_MGRIPM1_NTn1_NTA0_NTB0_NTC4_NTD4_NTM0_NEPBS8_NLCA1_NLCB1_ONLL1_PGR2_PLR1_PKA1_SGROB0_SIA3_SS1_SU0_SUM0_SUS0_SPO1_SRVW0_SSO0_SVW2_SK3_SKFTR0_SKXCCM4_SGRO0_TDMI0_TIN1_TLDS1_TLDSMn1_ULSGRO0_USL1_UIOFGRO0_UPLRP0_USFGRO0_VSn1_VWA2_VWB1_WSGRA0_WSGRB0_WS64_WG16_16_1_WGM24_WGMXCC1_WGMXCCGn1
    SolutionIndex: 117
    SolutionNameMin: Cijk_Alik_Bjlk_S_B_Bias_HA_S_SAV_UserArgs_MT64x48x32_MI16x16x1_SN_LDSB0_AFC0_AG1_AFEM1_AFEM1_ASEM1_CLR1_CADS0_DTLA0_DTLB0_DTVA0_DTVB0_DTVMXSA0_DTVMXSB0_DTVSM0_DPLB0_EPS1_ELFLR0_EMLLn1_FDSI0_GRPM1_GRVWA4_GRVWB1_GSU0_GSUAMB_GSUC0_GSUWGMRR0_GLS0_ISA950_IU1_K1_LDSTI0_LBSPPA128_LBSPPB768_LBSPPM0_LPA8_LPB16_LPM0_LRVWn1_LWPMn1_MIAV0_MIWT1_3_MO40_MGRIPM1_NTn1_NTA0_NTB0_NTC0_NTD4_NTM0_NEPBS0_NLCA1_NLCB3_ONLL1_PGR1_PLR1_PKA1_SGROB0_SIA3_SS1_SU0_SUM0_SUS0_SPO1_SRVW0_SSO1_SVW1_SK3_SKFTR0_SKXCCM0_SGRO0_TDMI0_TIN1_TLDS1_TLDSMn1_ULSGRO0_USL1_UIOFGRO0_UPLRP0_USFGRO1_VSn1_VWA1_VWB1_WSGRA0_WSGRB0_WS64_WG64_4_1_WGM2_WGMXCC4_WGMXCCGn1
    SolutionIndex: 118
    SolutionNameMin: Cijk_Alik_Bjlk_S_B_Bias_HA_S_SAV_UserArgs_MT64x64x32_MI16x16x1_SN_LDSB1_AFC0_AG1_AFEM1_AFEM1_ASEM1_CLR1_CADS0_DTLA0_DTLB0_DTVA0_DTVB0_DTVMXSA0_DTVMXSB0_DTVSM0_DPLB0_EPS0_ELFLR0_EMLLn1_FDSI0_GRPM1_GRVWA4_GRVWB1_GSU0_GSUAMB_GSUC0_GSUWGMRR0_GLS0_ISA950_IU1_K1_LDSTI0_LBSPPA512_LBSPPB1024_LBSPPM0_LPA8_LPB16_LPM0_LRVWn1_LWPMn1_MIAV0_MIWT4_1_MO40_MGRIPM1_NTn1_NTA0_NTB0_NTC4_NTD4_NTM0_NEPBS0_NLCA1_NLCB1_ONLL1_PGR2_PLR1_PKA1_SGROB0_SIA3_SS1_SU0_SUM0_SUS0_SPO0_SRVW0_SSO0_SVW4_SK3_SKFTR0_SKXCCM0_SGRO0_TDMI0_TIN1_TLDS1_TLDSMn1_ULSGRO1_USL1_UIOFGRO0_UPLRP0_USFGRO0_VSn1_VWA4_VWB1_WSGRA0_WSGRB0_WS64_WG16_16_1_WGM8_WGMXCC1_WGMXCCGn1
    SolutionIndex: 119
    SolutionNameMin: Cijk_Alik_Bjlk_S_B_Bias_HA_S_SAV_UserArgs_MT64x16x64_MI16x16x1_SN_LDSB0_AFC0_AG0_AFEM1_AFEM1_ASEM1_CLR1_CADS0_DTLA0_DTLB0_DTVA0_DTVB0_DTVMXSA0_DTVMXSB0_DTVSM0_DPLB0_EPS0_ELFLR0_EMLL0_FDSI0_GRPM1_GRVWA4_GRVWB1_GSU0_GSUAMB_GSUC0_GSUWGMRR0_GLS0_ISA950_IU1_K1_LDSTI0_LBSPPA256_LBSPPB256_LBSPPM0_LPA8_LPB8_LPM0_LRVWn1_LWPMn1_MIAV0_MIWT1_1_MO40_MGRIPM1_NTn1_NTA0_NTB0_NTC4_NTD4_NTM0_NEPBS12_NLCA1_NLCB1_ONLL1_PGR2_PLR1_PKA1_SGROB0_SIA3_SS1_SU0_SUM0_SUS0_SPO1_SRVW0_SSO4_SVW1_SK3_SKFTR0_SKXCCM8_SGRO0_TDMI0_TIN1_TLDS2_TLDSMn1_ULSGRO1_USL1_UIOFGRO0_UPLRP0_USFGRO1_VSn1_VWA1_VWB1_WSGRA2_WSGRB0_WS64_WG64_4_1_WGMn1_WGMXCC1_WGMXCCGn1
    SolutionIndex: 120
    SolutionNameMin: Cijk_Alik_Bjlk_S_B_Bias_HA_S_SAV_UserArgs_MT96x32x32_MI16x16x1_SN_LDSB1_AFC0_AG1_AFEM1_AFEM1_ASEM1_CLR1_CADS0_DTLA0_DTLB0_DTVA0_DTVB0_DTVMXSA0_DTVMXSB0_DTVSM0_DPLB0_EPS0_ELFLR0_EMLL0_FDSI0_GRPM1_GRVWA4_GRVWB1_GSU0_GSUAMB_GSUC0_GSUWGMRR0_GLS0_ISA950_IU1_K1_LDSTI0_LBSPPA128_LBSPPB512_LBSPPM0_LPA8_LPB16_LPM0_LRVWn1_LWPMn1_MIAV0_MIWT3_1_MO40_MGRIPM1_NTn1_NTA0_NTB0_NTC4_NTD4_NTM0_NEPBS14_NLCA1_NLCB1_ONLL1_PGR2_PLR1_PKA1_SGROB0_SIA3_SS1_SU0_SUM0_SUS0_SPO0_SRVW0_SSO0_SVW1_SK3_SKFTR0_SKXCCM4_SGRO0_TDMI0_TIN1_TLDS1_TLDSMn1_ULSGRO1_USL1_UIOFGRO0_UPLRP0_USFGRO1_VSn1_VWA1_VWB1_WSGRA2_WSGRB0_WS64_WG32_8_1_WGM4_WGMXCC1_WGMXCCGn1
    SolutionIndex: 121
    SolutionNameMin: Cijk_Alik_Bjlk_S_B_Bias_HA_S_SAV_UserArgs_MT128x32x32_MI16x16x1_SN_LDSB0_AFC0_AG1_AFEM1_AFEM1_ASEM1_CLR1_CADS0_DTLA0_DTLB0_DTVA0_DTVB0_DTVMXSA0_DTVMXSB0_DTVSM0_DPLB0_EPS0_ELFLR0_EMLLn1_FDSI0_GRPM1_GRVWA4_GRVWB1_GSU0_GSUAMB_GSUC0_GSUWGMRR0_GLS0_ISA950_IU1_K1_LDSTI0_LBSPPA512_LBSPPB512_LBSPPM0_LPA8_LPB16_LPM0_LRVWn1_LWPMn1_MIAV0_MIWT4_1_MO40_MGRIPM1_NTn1_NTA0_NTB0_NTC4_NTD4_NTM0_NEPBS10_NLCA1_NLCB1_ONLL1_PGR2_PLR1_PKA1_SGROB0_SIA3_SS1_SU0_SUM0_SUS0_SPO0_SRVW0_SSO0_SVW4_SK3_SKFTR0_SKXCCM0_SGRO0_TDMI0_TIN1_TLDS1_TLDSMn1_ULSGRO0_USL1_UIOFGRO0_UPLRP0_USFGRO1_VSn1_VWA4_VWB1_WSGRA0_WSGRB0_WS64_WG32_8_1_WGM6_WGMXCC1_WGMXCCGn1
    SolutionIndex: 122
    SolutionNameMin: Cijk_Alik_Bjlk_S_B_Bias_HA_S_SAV_UserArgs_MT32x64x64_MI16x16x1_SN_LDSB1_AFC0_AG1_AFEM1_AFEM1_ASEM1_CLR1_CADS0_DTLA0_DTLB0_DTVA0_DTVB0_DTVMXSA0_DTVMXSB0_DTVSM0_DPLB0_EPS0_ELFLR0_EMLLn1_FDSI0_GRPM1_GRVWA4_GRVWB4_GSU0_GSUAMB_GSUC0_GSUWGMRR0_GLS0_ISA950_IU1_K1_LDSTI0_LBSPPA512_LBSPPB1024_LBSPPM0_LPA8_LPB16_LPM0_LRVWn1_LWPMn1_MIAV0_MIWT2_1_MO40_MGRIPM1_NTn1_NTA0_NTB0_NTC4_NTD4_NTM0_NEPBS4_NLCA1_NLCB1_ONLL1_PGR2_PLR1_PKA1_SGROB0_SIA3_SS1_SU0_SUM0_SUS0_SPO1_SRVW0_SSO0_SVW2_SK3_SKFTR0_SKXCCM4_SGRO0_TDMI0_TIN1_TLDS1_TLDSMn1_ULSGRO0_USL1_UIOFGRO0_UPLRP0_USFGRO0_VSn1_VWA2_VWB1_WSGRA0_WSGRB2_WS64_WG16_16_1_WGM32_WGMXCC1_WGMXCCGn1
    SolutionIndex: 123
    SolutionNameMin: Cijk_Alik_Bjlk_S_B_Bias_HA_S_SAV_UserArgs_MT32x64x64_MI16x16x1_SN_LDSB1_AFC0_AG0_AFEM1_AFEM1_ASEM1_CLR1_CADS0_DTLA0_DTLB0_DTVA0_DTVB0_DTVMXSA0_DTVMXSB0_DTVSM0_DPLB0_EPS0_ELFLR0_EMLLn1_FDSI0_GRPM1_GRVWA4_GRVWB4_GSU0_GSUAMB_GSUC0_GSUWGMRR0_GLS0_ISA950_IU1_K1_LDSTI0_LBSPPA256_LBSPPB0_LBSPPM0_LPA8_LPB0_LPM0_LRVWn1_LWPMn1_MIAV0_MIWT1_2_MO40_MGRIPM1_NTn1_NTA4_NTB0_NTC0_NTD4_NTM0_NEPBS14_NLCA1_NLCB1_ONLL1_PGR2_PLR1_PKA1_SGROB0_SIA3_SS0_SU0_SUM0_SUS0_SPO0_SRVW0_SSO0_SVW4_SK3_SKFTR0_SKXCCM8_SGRO0_TDMI0_TIN1_TLDS1_TLDSMn1_ULSGRO1_USL1_UIOFGRO0_UPLRP0_USFGRO0_VSn1_VWA1_VWB2_WSGRA0_WSGRB0_WS64_WG32_8_1_WGM32_WGMXCC1_WGMXCCGn1
    SolutionIndex: 124
    SolutionNameMin: Cijk_Alik_Bjlk_S_B_Bias_HA_S_SAV_UserArgs_MT64x32x64_MI16x16x1_SN_LDSB1_AFC0_AG1_AFEM1_AFEM1_ASEM1_CLR1_CADS0_DTLA0_DTLB0_DTVA0_DTVB0_DTVMXSA0_DTVMXSB0_DTVSM0_DPLB0_EPS0_ELFLR0_EMLL0_FDSI0_GRPM1_GRVWA4_GRVWB1_GSU0_GSUAMB_GSUC0_GSUWGMRR0_GLS0_ISA950_IU1_K1_LDSTI0_LBSPPA256_LBSPPB0_LBSPPM0_LPA8_LPB0_LPM0_LRVWn1_LWPMn1_MIAV1_MIWT1_2_MO40_MGRIPM1_NTn1_NTA0_NTB0_NTC4_NTD4_NTM0_NEPBS16_NLCA1_NLCB1_ONLL1_PGR2_PLR1_PKA1_SGROB0_SIA3_SS1_SU0_SUM0_SUS0_SPO0_SRVW0_SSO0_SVW1_SK3_SKFTR0_SKXCCM0_SGRO0_TDMI0_TIN1_TLDS1_TLDSMn1_ULSGRO0_USL1_UIOFGRO0_UPLRP0_USFGRO1_VSn1_VWA1_VWB2_WSGRA2_WSGRB2_WS64_WG64_4_1_WGM32_WGMXCC8_WGMXCCGn1
    SolutionIndex: 125
    SolutionNameMin: Cijk_Alik_Bjlk_S_B_Bias_HA_S_SAV_UserArgs_MT32x32x128_MI16x16x1_SN_LDSB1_AFC0_AG0_AFEM1_AFEM1_ASEM1_CLR1_CADS0_DTLA0_DTLB0_DTVA0_DTVB0_DTVMXSA0_DTVMXSB0_DTVSM0_DPLB0_EPS1_ELFLR0_EMLLn1_FDSI0_GRPM1_GRVWA4_GRVWB1_GSU0_GSUAMB_GSUC0_GSUWGMRR0_GLS0_ISA950_IU1_K1_LDSTI0_LBSPPA512_LBSPPB512_LBSPPM0_LPA8_LPB16_LPM0_LRVWn1_LWPMn1_MIAV0_MIWT1_1_MO40_MGRIPM1_NTn1_NTA4_NTB0_NTC0_NTD4_NTM0_NEPBS12_NLCA1_NLCB1_ONLL1_PGR1_PLR1_PKA1_SGROB0_SIA3_SS1_SU0_SUM0_SUS0_SPO1_SRVW0_SSO0_SVW1_SK3_SKFTR0_SKXCCM8_SGRO0_TDMI0_TIN1_TLDS1_TLDSMn1_ULSGRO0_USL1_UIOFGRO0_UPLRP0_USFGRO1_VSn1_VWA1_VWB1_WSGRA0_WSGRB0_WS64_WG32_8_1_WGM8_WGMXCC1_WGMXCCGn1
    SolutionIndex: 126
    SolutionNameMin: Cijk_Alik_Bjlk_S_B_Bias_HA_S_SAV_UserArgs_MT128x320x32_MI16x16x1_SN_LDSB1_AFC0_AG0_AFEM1_AFEM1_ASEM1_CLR1_CADS0_DTLA0_DTLB0_DTVA0_DTVB0_DTVMXSA0_DTVMXSB0_DTVSM0_DPLB0_EPS0_ELFLR0_EMLLn1_FDSI0_GRPM1_GRVWA4_GRVWB4_GSU0_GSUAMB_GSUC0_GSUWGMRR0_GLS0_ISA950_IU1_K1_LDSTI0_LBSPPA512_LBSPPB0_LBSPPM0_LPA8_LPB0_LPM0_LRVWn1_LWPMn1_MIAV0_MIWT4_10_MO40_MGRIPM1_NTn1_NTA0_NTB0_NTC4_NTD0_NTM0_NEPBS0_NLCA1_NLCB5_ONLL1_PGR2_PLR1_PKA1_SGROB0_SIA3_SS1_SU0_SUM0_SUS0_SPO0_SRVW0_SSO1_SVW4_SK3_SKFTR0_SKXCCM8_SGRO0_TDMI0_TIN1_TLDS1_TLDSMn1_ULSGRO0_USL1_UIOFGRO0_UPLRP0_USFGRO1_VSn1_VWA4_VWB2_WSGRA0_WSGRB2_WS64_WG32_8_1_WGMn4_WGMXCC32_WGMXCCGn1
    SolutionIndex: 127
    SolutionNameMin: Cijk_Alik_Bjlk_S_B_Bias_HA_S_SAV_UserArgs_MT32x64x64_MI16x16x1_SN_LDSB1_AFC0_AG0_AFEM1_AFEM1_ASEM1_CLR1_CADS0_DTLA0_DTLB0_DTVA0_DTVB0_DTVMXSA0_DTVMXSB0_DTVSM0_DPLB0_EPS0_ELFLR0_EMLL0_FDSI0_GRPM1_GRVWA4_GRVWB4_GSU0_GSUAMB_GSUC0_GSUWGMRR0_GLS0_ISA950_IU1_K1_LDSTI0_LBSPPA256_LBSPPB0_LBSPPM0_LPA8_LPB0_LPM0_LRVWn1_LWPMn1_MIAV0_MIWT1_2_MO40_MGRIPM1_NTn1_NTA0_NTB0_NTC4_NTD4_NTM0_NEPBS16_NLCA1_NLCB1_ONLL1_PGR2_PLR1_PKA1_SGROB0_SIA3_SS0_SU0_SUM0_SUS0_SPO1_SRVW0_SSO0_SVW4_SK3_SKFTR0_SKXCCM0_SGRO0_TDMI0_TIN1_TLDS1_TLDSMn1_ULSGRO0_USL1_UIOFGRO0_UPLRP0_USFGRO1_VSn1_VWA1_VWB2_WSGRA0_WSGRB2_WS64_WG32_8_1_WGM32_WGMXCC8_WGMXCCGn1
    SolutionIndex: 128
    SolutionNameMin: Cijk_Alik_Bjlk_S_B_Bias_HA_S_SAV_UserArgs_MT160x32x32_MI16x16x1_SN_LDSB1_AFC0_AG1_AFEM1_AFEM1_ASEM1_CLR1_CADS0_DTLA0_DTLB0_DTVA0_DTVB0_DTVMXSA0_DTVMXSB0_DTVSM0_DPLB0_EPS0_ELFLR0_EMLLn1_FDSI0_GRPM1_GRVWA4_GRVWB1_GSU0_GSUAMB_GSUC0_GSUWGMRR0_GLS0_ISA950_IU1_K1_LDSTI0_LBSPPA128_LBSPPB512_LBSPPM0_LPA8_LPB16_LPM0_LRVWn1_LWPMn1_MIAV0_MIWT5_1_MO40_MGRIPM1_NTn1_NTA0_NTB4_NTC0_NTD4_NTM0_NEPBS14_NLCA1_NLCB1_ONLL1_PGR2_PLR1_PKA1_SGROB0_SIA3_SS0_SU0_SUM0_SUS0_SPO0_SRVW0_SSO0_SVW4_SK3_SKFTR0_SKXCCM0_SGRO0_TDMI0_TIN1_TLDS1_TLDSMn1_ULSGRO0_USL1_UIOFGRO0_UPLRP0_USFGRO1_VSn1_VWA1_VWB1_WSGRA0_WSGRB2_WS64_WG32_8_1_WGM16_WGMXCC1_WGMXCCGn1
    SolutionIndex: 129
    SolutionNameMin: Cijk_Alik_Bjlk_S_B_Bias_HA_S_SAV_UserArgs_MT96x32x32_MI16x16x1_SN_LDSB1_AFC0_AG0_AFEM1_AFEM1_ASEM1_CLR1_CADS0_DTLA0_DTLB0_DTVA0_DTVB0_DTVMXSA0_DTVMXSB0_DTVSM0_DPLB0_EPS0_ELFLR0_EMLLn1_FDSI0_GRPM1_GRVWA4_GRVWB1_GSU0_GSUAMB_GSUC0_GSUWGMRR0_GLS0_ISA950_IU1_K1_LDSTI0_LBSPPA128_LBSPPB512_LBSPPM0_LPA8_LPB16_LPM0_LRVWn1_LWPMn1_MIAV0_MIWT3_1_MO40_MGRIPM1_NTn1_NTA0_NTB4_NTC4_NTD0_NTM0_NEPBS0_NLCA1_NLCB1_ONLL1_PGR2_PLR1_PKA1_SGROB0_SIA3_SS1_SU0_SUM0_SUS0_SPO0_SRVW0_SSO4_SVW1_SK3_SKFTR0_SKXCCM0_SGRO0_TDMI0_TIN1_TLDS1_TLDSMn1_ULSGRO0_USL1_UIOFGRO0_UPLRP0_USFGRO1_VSn1_VWA1_VWB1_WSGRA0_WSGRB2_WS64_WG32_8_1_WGM2_WGMXCC32_WGMXCCGn1
    SolutionIndex: 130
    SolutionNameMin: Cijk_Alik_Bjlk_S_B_Bias_HA_S_SAV_UserArgs_MT64x32x32_MI16x16x1_SN_LDSB1_AFC0_AG1_AFEM1_AFEM1_ASEM1_CLR1_CADS0_DTLA0_DTLB0_DTVA0_DTVB0_DTVMXSA0_DTVMXSB0_DTVSM0_DPLB0_EPS1_ELFLR0_EMLLn1_FDSI0_GRPM1_GRVWA4_GRVWB1_GSU0_GSUAMB_GSUC0_GSUWGMRR0_GLS0_ISA950_IU1_K1_LDSTI0_LBSPPA256_LBSPPB512_LBSPPM0_LPA8_LPB16_LPM0_LRVWn1_LWPMn1_MIAV0_MIWT2_1_MO40_MGRIPM1_NTn1_NTA0_NTB0_NTC4_NTD4_NTM0_NEPBS10_NLCA1_NLCB1_ONLL1_PGR1_PLR1_PKA1_SGROB0_SIA3_SS1_SU0_SUM0_SUS0_SPO1_SRVW0_SSO0_SVW2_SK3_SKFTR0_SKXCCM0_SGRO0_TDMI0_TIN1_TLDS1_TLDSMn1_ULSGRO0_USL1_UIOFGRO0_UPLRP0_USFGRO1_VSn1_VWA2_VWB1_WSGRA0_WSGRB0_WS64_WG32_8_1_WGM8_WGMXCC1_WGMXCCGn1
    SolutionIndex: 131
    SolutionNameMin: Cijk_Alik_Bjlk_S_B_Bias_HA_S_SAV_UserArgs_MT64x64x32_MI16x16x1_SN_LDSB1_AFC0_AG0_AFEM1_AFEM1_ASEM1_CLR1_CADS0_DTLA0_DTLB0_DTVA0_DTVB0_DTVMXSA0_DTVMXSB0_DTVSM0_DPLB0_EPS0_ELFLR0_EMLLn1_FDSI0_GRPM1_GRVWA4_GRVWB1_GSU0_GSUAMB_GSUC0_GSUWGMRR0_GLS0_ISA950_IU1_K1_LDSTI0_LBSPPA512_LBSPPB1024_LBSPPM0_LPA8_LPB16_LPM0_LRVWn1_LWPMn1_MIAV0_MIWT4_1_MO40_MGRIPM1_NTn1_NTA0_NTB0_NTC4_NTD4_NTM0_NEPBS14_NLCA1_NLCB1_ONLL1_PGR2_PLR1_PKA1_SGROB0_SIA3_SS1_SU0_SUM0_SUS0_SPO1_SRVW0_SSO0_SVW4_SK3_SKFTR0_SKXCCM0_SGRO0_TDMI0_TIN1_TLDS1_TLDSMn1_ULSGRO0_USL1_UIOFGRO0_UPLRP0_USFGRO1_VSn1_VWA4_VWB1_WSGRA0_WSGRB0_WS64_WG16_16_1_WGM24_WGMXCC1_WGMXCCGn1
    SolutionIndex: 132
    SolutionNameMin: Cijk_Alik_Bjlk_S_B_Bias_HA_S_SAV_UserArgs_MT64x48x32_MI16x16x1_SN_LDSB1_AFC0_AG0_AFEM1_AFEM1_ASEM1_CLR1_CADS0_DTLA0_DTLB0_DTVA0_DTVB0_DTVMXSA0_DTVMXSB0_DTVSM0_DPLB0_EPS0_ELFLR0_EMLLn1_FDSI0_GRPM1_GRVWA4_GRVWB1_GSU0_GSUAMB_GSUC0_GSUWGMRR0_GLS0_ISA950_IU1_K1_LDSTI0_LBSPPA128_LBSPPB768_LBSPPM0_LPA8_LPB16_LPM0_LRVWn1_LWPMn1_MIAV1_MIWT1_3_MO40_MGRIPM1_NTn1_NTA0_NTB0_NTC4_NTD4_NTM0_NEPBS12_NLCA1_NLCB3_ONLL1_PGR2_PLR1_PKA1_SGROB0_SIA3_SS1_SU0_SUM0_SUS0_SPO0_SRVW0_SSO0_SVW1_SK3_SKFTR0_SKXCCM8_SGRO0_TDMI0_TIN1_TLDS1_TLDSMn1_ULSGRO1_USL1_UIOFGRO0_UPLRP0_USFGRO0_VSn1_VWA1_VWB1_WSGRA0_WSGRB0_WS64_WG64_4_1_WGM0_WGMXCC1_WGMXCCGn1
    SolutionIndex: 133
    SolutionNameMin: Cijk_Alik_Bjlk_S_B_Bias_HA_S_SAV_UserArgs_MT96x32x32_MI16x16x1_SN_LDSB1_AFC0_AG0_AFEM1_AFEM1_ASEM1_CLR1_CADS0_DTLA0_DTLB0_DTVA0_DTVB0_DTVMXSA0_DTVMXSB0_DTVSM0_DPLB0_EPS0_ELFLR0_EMLL0_FDSI0_GRPM1_GRVWA4_GRVWB1_GSU0_GSUAMB_GSUC0_GSUWGMRR0_GLS0_ISA950_IU1_K1_LDSTI0_LBSPPA128_LBSPPB512_LBSPPM0_LPA8_LPB16_LPM0_LRVWn1_LWPMn1_MIAV0_MIWT3_1_MO40_MGRIPM1_NTn1_NTA0_NTB0_NTC4_NTD4_NTM0_NEPBS16_NLCA1_NLCB1_ONLL1_PGR2_PLR1_PKA1_SGROB0_SIA3_SS1_SU0_SUM0_SUS0_SPO0_SRVW0_SSO0_SVW1_SK3_SKFTR0_SKXCCM0_SGRO0_TDMI0_TIN1_TLDS1_TLDSMn1_ULSGRO1_USL1_UIOFGRO0_UPLRP0_USFGRO1_VSn1_VWA1_VWB1_WSGRA0_WSGRB2_WS64_WG32_8_1_WGM4_WGMXCC1_WGMXCCGn1
    SolutionIndex: 134
    SolutionNameMin: Cijk_Alik_Bjlk_S_B_Bias_HA_S_SAV_UserArgs_MT64x48x32_MI16x16x1_SN_LDSB1_AFC0_AG0_AFEM1_AFEM1_ASEM1_CLR1_CADS0_DTLA0_DTLB0_DTVA0_DTVB0_DTVMXSA0_DTVMXSB0_DTVSM0_DPLB0_EPS0_ELFLR0_EMLL0_FDSI0_GRPM1_GRVWA4_GRVWB1_GSU0_GSUAMB_GSUC0_GSUWGMRR0_GLS0_ISA950_IU1_K1_LDSTI0_LBSPPA128_LBSPPB768_LBSPPM0_LPA8_LPB16_LPM0_LRVWn1_LWPMn1_MIAV0_MIWT1_3_MO40_MGRIPM1_NTn1_NTA0_NTB0_NTC4_NTD4_NTM0_NEPBS0_NLCA1_NLCB3_ONLL1_PGR2_PLR1_PKA1_SGROB0_SIA3_SS1_SU0_SUM0_SUS0_SPO0_SRVW0_SSO1_SVW1_SK3_SKFTR0_SKXCCM4_SGRO0_TDMI0_TIN1_TLDS1_TLDSMn1_ULSGRO0_USL1_UIOFGRO0_UPLRP0_USFGRO0_VSn1_VWA1_VWB1_WSGRA0_WSGRB0_WS64_WG64_4_1_WGM32_WGMXCC1_WGMXCCGn1
    SolutionIndex: 135
    SolutionNameMin: Cijk_Alik_Bjlk_S_B_Bias_HA_S_SAV_UserArgs_MT64x48x32_MI16x16x1_SN_LDSB1_AFC0_AG1_AFEM1_AFEM1_ASEM1_CLR1_CADS0_DTLA0_DTLB0_DTVA0_DTVB0_DTVMXSA0_DTVMXSB0_DTVSM0_DPLB0_EPS0_ELFLR0_EMLL0_FDSI0_GRPM1_GRVWA4_GRVWB1_GSU0_GSUAMB_GSUC0_GSUWGMRR0_GLS0_ISA950_IU1_K1_LDSTI0_LBSPPA128_LBSPPB768_LBSPPM0_LPA8_LPB16_LPM0_LRVWn1_LWPMn1_MIAV0_MIWT1_3_MO40_MGRIPM1_NTn1_NTA0_NTB4_NTC4_NTD4_NTM0_NEPBS0_NLCA1_NLCB3_ONLL1_PGR2_PLR1_PKA1_SGROB0_SIA3_SS1_SU0_SUM0_SUS0_SPO0_SRVW0_SSO0_SVW1_SK3_SKFTR0_SKXCCM8_SGRO0_TDMI0_TIN1_TLDS1_TLDSMn1_ULSGRO1_USL1_UIOFGRO0_UPLRP0_USFGRO0_VSn1_VWA1_VWB1_WSGRA0_WSGRB2_WS64_WG64_4_1_WGM2_WGMXCC1_WGMXCCGn1
    SolutionIndex: 136
    SolutionNameMin: Cijk_Alik_Bjlk_S_B_Bias_HA_S_SAV_UserArgs_MT64x48x32_MI16x16x1_SN_LDSB1_AFC0_AG1_AFEM1_AFEM1_ASEM1_CLR1_CADS0_DTLA0_DTLB0_DTVA0_DTVB0_DTVMXSA0_DTVMXSB0_DTVSM0_DPLB0_EPS0_ELFLR0_EMLLn1_FDSI0_GRPM1_GRVWA4_GRVWB1_GSU0_GSUAMB_GSUC0_GSUWGMRR0_GLS0_ISA950_IU1_K1_LDSTI0_LBSPPA128_LBSPPB768_LBSPPM0_LPA8_LPB16_LPM0_LRVWn1_LWPMn1_MIAV0_MIWT1_3_MO40_MGRIPM1_NTn1_NTA0_NTB0_NTC4_NTD4_NTM0_NEPBS0_NLCA1_NLCB3_ONLL1_PGR2_PLR1_PKA1_SGROB0_SIA3_SS0_SU0_SUM0_SUS0_SPO0_SRVW0_SSO0_SVW4_SK3_SKFTR0_SKXCCM0_SGRO0_TDMI0_TIN1_TLDS1_TLDSMn1_ULSGRO1_USL1_UIOFGRO0_UPLRP0_USFGRO0_VSn1_VWA1_VWB1_WSGRA2_WSGRB0_WS64_WG64_4_1_WGMn32_WGMXCC2_WGMXCCGn1
    SolutionIndex: 137
    SolutionNameMin: Cijk_Alik_Bjlk_S_B_Bias_HA_S_SAV_UserArgs_MT32x64x32_MI16x16x1_SN_LDSB0_AFC0_AG1_AFEM1_AFEM1_ASEM1_CLR1_CADS0_DTLA0_DTLB0_DTVA0_DTVB0_DTVMXSA0_DTVMXSB0_DTVSM0_DPLB0_EPS1_ELFLR0_EMLL0_FDSI0_GRPM1_GRVWA4_GRVWB1_GSU0_GSUAMB_GSUC0_GSUWGMRR0_GLS0_ISA950_IU1_K1_LDSTI0_LBSPPA256_LBSPPB1024_LBSPPM0_LPA8_LPB16_LPM0_LRVWn1_LWPMn1_MIAV0_MIWT2_1_MO40_MGRIPM1_NTn1_NTA0_NTB0_NTC0_NTD0_NTM0_NEPBS14_NLCA1_NLCB1_ONLL1_PGR1_PLR1_PKA1_SGROB0_SIA3_SS1_SU0_SUM0_SUS0_SPO1_SRVW0_SSO4_SVW2_SK3_SKFTR0_SKXCCM0_SGRO0_TDMI0_TIN1_TLDS1_TLDSMn1_ULSGRO0_USL1_UIOFGRO0_UPLRP0_USFGRO1_VSn1_VWA2_VWB1_WSGRA0_WSGRB0_WS64_WG16_16_1_WGM2_WGMXCC8_WGMXCCGn1
    SolutionIndex: 138
    SolutionNameMin: Cijk_Alik_Bjlk_S_B_Bias_HA_S_SAV_UserArgs_MT64x48x32_MI16x16x1_SN_LDSB1_AFC0_AG0_AFEM1_AFEM1_ASEM1_CLR1_CADS0_DTLA0_DTLB0_DTVA0_DTVB0_DTVMXSA0_DTVMXSB0_DTVSM0_DPLB0_EPS0_ELFLR0_EMLL0_FDSI0_GRPM1_GRVWA4_GRVWB1_GSU0_GSUAMB_GSUC0_GSUWGMRR0_GLS0_ISA950_IU1_K1_LDSTI0_LBSPPA128_LBSPPB768_LBSPPM0_LPA8_LPB16_LPM0_LRVWn1_LWPMn1_MIAV0_MIWT1_3_MO40_MGRIPM1_NTn1_NTA0_NTB0_NTC4_NTD4_NTM0_NEPBS0_NLCA1_NLCB3_ONLL1_PGR2_PLR1_PKA1_SGROB0_SIA3_SS1_SU0_SUM0_SUS0_SPO0_SRVW0_SSO0_SVW1_SK3_SKFTR0_SKXCCM4_SGRO0_TDMI0_TIN1_TLDS1_TLDSMn1_ULSGRO1_USL1_UIOFGRO0_UPLRP0_USFGRO0_VSn1_VWA1_VWB1_WSGRA2_WSGRB2_WS64_WG64_4_1_WGM4_WGMXCC1_WGMXCCGn1
    SolutionIndex: 139
    SolutionNameMin: Cijk_Alik_Bjlk_S_B_Bias_HA_S_SAV_UserArgs_MT32x32x128_MI16x16x1_SN_LDSB1_AFC0_AG1_AFEM1_AFEM1_ASEM1_CLR1_CADS0_DTLA0_DTLB0_DTVA0_DTVB0_DTVMXSA0_DTVMXSB0_DTVSM0_DPLB0_EPS0_ELFLR0_EMLLn1_FDSI0_GRPM1_GRVWA4_GRVWB4_GSU0_GSUAMB_GSUC0_GSUWGMRR0_GLS0_ISA950_IU1_K1_LDSTI0_LBSPPA512_LBSPPB512_LBSPPM0_LPA8_LPB16_LPM0_LRVWn1_LWPMn1_MIAV0_MIWT1_1_MO40_MGRIPM1_NTn1_NTA4_NTB0_NTC0_NTD4_NTM0_NEPBS16_NLCA1_NLCB1_ONLL1_PGR2_PLR1_PKA1_SGROB0_SIA3_SS0_SU0_SUM0_SUS0_SPO1_SRVW0_SSO0_SVW4_SK3_SKFTR0_SKXCCM0_SGRO0_TDMI0_TIN1_TLDS1_TLDSMn1_ULSGRO0_USL1_UIOFGRO0_UPLRP0_USFGRO0_VSn1_VWA1_VWB1_WSGRA0_WSGRB0_WS64_WG32_8_1_WGM24_WGMXCC8_WGMXCCGn1
    SolutionIndex: 140
    SolutionNameMin: Cijk_Alik_Bjlk_S_B_Bias_HA_S_SAV_UserArgs_MT32x32x64_MI16x16x1_SN_LDSB0_AFC0_AG0_AFEM1_AFEM1_ASEM1_CLR1_CADS0_DTLA0_DTLB0_DTVA0_DTVB0_DTVMXSA0_DTVMXSB0_DTVSM0_DPLB0_EPS1_ELFLR0_EMLL0_FDSI0_GRPM1_GRVWA4_GRVWB1_GSU0_GSUAMB_GSUC0_GSUWGMRR0_GLS0_ISA950_IU1_K1_LDSTI0_LBSPPA256_LBSPPB512_LBSPPM0_LPA8_LPB16_LPM0_LRVWn1_LWPMn1_MIAV0_MIWT1_1_MO40_MGRIPM1_NTn1_NTA0_NTB0_NTC4_NTD4_NTM0_NEPBS16_NLCA1_NLCB1_ONLL1_PGR1_PLR1_PKA1_SGROB0_SIA3_SS1_SU0_SUM0_SUS0_SPO1_SRVW0_SSO1_SVW1_SK3_SKFTR0_SKXCCM8_SGRO0_TDMI0_TIN1_TLDS1_TLDSMn1_ULSGRO0_USL1_UIOFGRO0_UPLRP0_USFGRO1_VSn1_VWA1_VWB1_WSGRA0_WSGRB2_WS64_WG32_8_1_WGMn1_WGMXCC1_WGMXCCGn1
    SolutionIndex: 141
    SolutionNameMin: Cijk_Alik_Bjlk_S_B_Bias_HA_S_SAV_UserArgs_MT32x64x32_MI16x16x1_SN_LDSB1_AFC0_AG1_AFEM1_AFEM1_ASEM1_CLR1_CADS0_DTLA0_DTLB0_DTVA0_DTVB0_DTVMXSA0_DTVMXSB0_DTVSM0_DPLB0_EPS0_ELFLR0_EMLLn1_FDSI0_GRPM1_GRVWA4_GRVWB1_GSU0_GSUAMB_GSUC0_GSUWGMRR0_GLS0_ISA950_IU1_K1_LDSTI0_LBSPPA128_LBSPPB0_LBSPPM0_LPA8_LPB0_LPM0_LRVWn1_LWPMn1_MIAV0_MIWT1_2_MO40_MGRIPM1_NTn1_NTA0_NTB0_NTC4_NTD4_NTM0_NEPBS10_NLCA1_NLCB1_ONLL1_PGR2_PLR1_PKA1_SGROB0_SIA3_SS1_SU0_SUM0_SUS0_SPO0_SRVW0_SSO0_SVW1_SK3_SKFTR0_SKXCCM0_SGRO0_TDMI0_TIN1_TLDS1_TLDSMn1_ULSGRO1_USL1_UIOFGRO0_UPLRP0_USFGRO1_VSn1_VWA1_VWB2_WSGRA0_WSGRB0_WS64_WG32_8_1_WGM32_WGMXCC1_WGMXCCGn1
    SolutionIndex: 142
    SolutionNameMin: Cijk_Alik_Bjlk_S_B_Bias_HA_S_SAV_UserArgs_MT64x64x32_MI16x16x1_SN_LDSB0_AFC0_AG0_AFEM1_AFEM1_ASEM1_CLR1_CADS0_DTLA0_DTLB0_DTVA0_DTVB0_DTVMXSA0_DTVMXSB0_DTVSM0_DPLB0_EPS1_ELFLR0_EMLLn1_FDSI0_GRPM1_GRVWA4_GRVWB1_GSU0_GSUAMB_GSUC0_GSUWGMRR0_GLS0_ISA950_IU1_K1_LDSTI0_LBSPPA512_LBSPPB1024_LBSPPM0_LPA8_LPB16_LPM0_LRVWn1_LWPMn1_MIAV0_MIWT4_1_MO40_MGRIPM1_NTn1_NTA0_NTB0_NTC4_NTD4_NTM0_NEPBS16_NLCA1_NLCB1_ONLL1_PGR1_PLR1_PKA1_SGROB0_SIA3_SS1_SU0_SUM0_SUS0_SPO0_SRVW0_SSO0_SVW4_SK3_SKFTR0_SKXCCM0_SGRO0_TDMI0_TIN1_TLDS1_TLDSMn1_ULSGRO0_USL1_UIOFGRO0_UPLRP0_USFGRO1_VSn1_VWA4_VWB1_WSGRA2_WSGRB0_WS64_WG16_16_1_WGM4_WGMXCC16_WGMXCCGn1
    SolutionIndex: 143
    SolutionNameMin: Cijk_Alik_Bjlk_S_B_Bias_HA_S_SAV_UserArgs_MT32x32x64_MI16x16x1_SN_LDSB1_AFC0_AG1_AFEM1_AFEM1_ASEM1_CLR1_CADS0_DTLA0_DTLB0_DTVA0_DTVB0_DTVMXSA0_DTVMXSB0_DTVSM0_DPLB0_EPS0_ELFLR0_EMLLn1_FDSI0_GRPM1_GRVWA4_GRVWB1_GSU0_GSUAMB_GSUC0_GSUWGMRR0_GLS0_ISA950_IU1_K1_LDSTI0_LBSPPA256_LBSPPB512_LBSPPM0_LPA8_LPB16_LPM0_LRVWn1_LWPMn1_MIAV1_MIWT1_1_MO40_MGRIPM1_NTn1_NTA0_NTB0_NTC0_NTD0_NTM0_NEPBS8_NLCA1_NLCB1_ONLL1_PGR2_PLR1_PKA1_SGROB0_SIA3_SS1_SU0_SUM0_SUS0_SPO0_SRVW0_SSO0_SVW1_SK3_SKFTR0_SKXCCM4_SGRO0_TDMI0_TIN1_TLDS1_TLDSMn1_ULSGRO0_USL1_UIOFGRO0_UPLRP0_USFGRO1_VSn1_VWA1_VWB1_WSGRA0_WSGRB0_WS64_WG32_8_1_WGM4_WGMXCC1_WGMXCCGn1
    SolutionIndex: 144
    SolutionNameMin: Cijk_Alik_Bjlk_S_B_Bias_HA_S_SAV_UserArgs_MT64x32x32_MI16x16x1_SN_LDSB0_AFC0_AG1_AFEM1_AFEM1_ASEM1_CLR1_CADS0_DTLA0_DTLB0_DTVA0_DTVB0_DTVMXSA0_DTVMXSB0_DTVSM0_DPLB0_EPS0_ELFLR0_EMLLn1_FDSI0_GRPM1_GRVWA4_GRVWB1_GSU0_GSUAMB_GSUC0_GSUWGMRR0_GLS0_ISA950_IU1_K1_LDSTI0_LBSPPA256_LBSPPB512_LBSPPM0_LPA8_LPB16_LPM0_LRVWn1_LWPMn1_MIAV0_MIWT2_1_MO40_MGRIPM1_NTn1_NTA0_NTB0_NTC4_NTD4_NTM0_NEPBS10_NLCA1_NLCB1_ONLL1_PGR2_PLR1_PKA1_SGROB0_SIA3_SS1_SU0_SUM0_SUS0_SPO1_SRVW0_SSO4_SVW2_SK3_SKFTR0_SKXCCM0_SGRO0_TDMI0_TIN1_TLDS1_TLDSMn1_ULSGRO0_USL1_UIOFGRO0_UPLRP0_USFGRO1_VSn1_VWA2_VWB1_WSGRA0_WSGRB0_WS64_WG32_8_1_WGMn2_WGMXCC1_WGMXCCGn1
    SolutionIndex: 145
    SolutionNameMin: Cijk_Alik_Bjlk_S_B_Bias_HA_S_SAV_UserArgs_MT64x64x32_MI16x16x1_SN_LDSB0_AFC0_AG1_AFEM1_AFEM1_ASEM1_CLR1_CADS0_DTLA0_DTLB0_DTVA0_DTVB0_DTVMXSA0_DTVMXSB0_DTVSM0_DPLB0_EPS0_ELFLR0_EMLL0_FDSI0_GRPM1_GRVWA4_GRVWB1_GSU0_GSUAMB_GSUC0_GSUWGMRR0_GLS0_ISA950_IU1_K1_LDSTI0_LBSPPA512_LBSPPB1024_LBSPPM0_LPA8_LPB16_LPM0_LRVWn1_LWPMn1_MIAV0_MIWT4_1_MO40_MGRIPM1_NTn1_NTA0_NTB0_NTC4_NTD4_NTM0_NEPBS4_NLCA1_NLCB1_ONLL1_PGR2_PLR1_PKA1_SGROB0_SIA3_SS1_SU0_SUM0_SUS0_SPO1_SRVW0_SSO0_SVW4_SK3_SKFTR0_SKXCCM8_SGRO0_TDMI0_TIN1_TLDS1_TLDSMn1_ULSGRO0_USL1_UIOFGRO0_UPLRP0_USFGRO1_VSn1_VWA4_VWB1_WSGRA0_WSGRB0_WS64_WG16_16_1_WGM4_WGMXCC1_WGMXCCGn1
    SolutionIndex: 146
    SolutionNameMin: Cijk_Alik_Bjlk_S_B_Bias_HA_S_SAV_UserArgs_MT64x32x64_MI16x16x1_SN_LDSB1_AFC0_AG0_AFEM1_AFEM1_ASEM1_CLR1_CADS0_DTLA0_DTLB0_DTVA0_DTVB0_DTVMXSA0_DTVMXSB0_DTVSM0_DPLB0_EPS0_ELFLR0_EMLLn1_FDSI0_GRPM1_GRVWA4_GRVWB1_GSU0_GSUAMB_GSUC0_GSUWGMRR0_GLS0_ISA950_IU1_K1_LDSTI0_LBSPPA256_LBSPPB0_LBSPPM0_LPA8_LPB0_LPM0_LRVWn1_LWPMn1_MIAV0_MIWT1_2_MO40_MGRIPM1_NTn1_NTA0_NTB0_NTC4_NTD4_NTM0_NEPBS4_NLCA1_NLCB1_ONLL1_PGR2_PLR1_PKA1_SGROB0_SIA3_SS0_SU0_SUM0_SUS0_SPO0_SRVW0_SSO0_SVW4_SK3_SKFTR0_SKXCCM8_SGRO0_TDMI0_TIN1_TLDS1_TLDSMn1_ULSGRO1_USL1_UIOFGRO0_UPLRP0_USFGRO0_VSn1_VWA1_VWB2_WSGRA0_WSGRB2_WS64_WG64_4_1_WGM8_WGMXCC1_WGMXCCGn1
    SolutionIndex: 147
    SolutionNameMin: Cijk_Alik_Bjlk_S_B_Bias_HA_S_SAV_UserArgs_MT160x352x32_MI16x16x1_SN_LDSB0_AFC0_AG0_AFEM1_AFEM1_ASEM1_CLR1_CADS0_DTLA0_DTLB0_DTVA0_DTVB0_DTVMXSA0_DTVMXSB0_DTVSM0_DPLB0_EPS0_ELFLR0_EMLLn1_FDSI0_GRPM1_GRVWA4_GRVWB4_GSU0_GSUAMB_GSUC0_GSUWGMRR0_GLS0_ISA950_IU1_K1_LDSTI0_LBSPPA128_LBSPPB5632_LBSPPM0_LPA8_LPB16_LPM0_LRVWn1_LWPMn1_MIAV0_MIWT5_11_MO40_MGRIPM1_NTn1_NTA0_NTB0_NTC0_NTD0_NTM0_NEPBS0_NLCA1_NLCB11_ONLL1_PGR2_PLR1_PKA1_SGROB0_SIA3_SS1_SU0_SUM0_SUS0_SPO0_SRVW0_SSO1_SVW1_SK3_SKFTR0_SKXCCM0_SGRO0_TDMI0_TIN1_TLDS1_TLDSMn1_ULSGRO1_USL1_UIOFGRO0_UPLRP0_USFGRO0_VSn1_VWA1_VWB1_WSGRA0_WSGRB0_WS64_WG32_8_1_WGM4_WGMXCC2_WGMXCCGn1
    SolutionIndex: 148
    SolutionNameMin: Cijk_Alik_Bjlk_S_B_Bias_HA_S_SAV_UserArgs_MT64x32x32_MI16x16x1_SN_LDSB0_AFC0_AG0_AFEM1_AFEM1_ASEM1_CLR1_CADS0_DTLA0_DTLB0_DTVA0_DTVB0_DTVMXSA0_DTVMXSB0_DTVSM0_DPLB0_EPS1_ELFLR0_EMLL0_FDSI0_GRPM1_GRVWA4_GRVWB1_GSU0_GSUAMB_GSUC0_GSUWGMRR0_GLS0_ISA950_IU1_K1_LDSTI0_LBSPPA128_LBSPPB0_LBSPPM0_LPA8_LPB0_LPM0_LRVWn1_LWPMn1_MIAV0_MIWT1_2_MO40_MGRIPM1_NTn1_NTA0_NTB0_NTC0_NTD0_NTM0_NEPBS16_NLCA1_NLCB1_ONLL1_PGR1_PLR1_PKA1_SGROB0_SIA3_SS1_SU0_SUM0_SUS0_SPO1_SRVW0_SSO0_SVW1_SK3_SKFTR0_SKXCCM0_SGRO0_TDMI0_TIN1_TLDS1_TLDSMn1_ULSGRO0_USL1_UIOFGRO0_UPLRP0_USFGRO1_VSn1_VWA1_VWB2_WSGRA0_WSGRB0_WS64_WG64_4_1_WGM2_WGMXCC4_WGMXCCGn1
    SolutionIndex: 149
    SolutionNameMin: Cijk_Alik_Bjlk_S_B_Bias_HA_S_SAV_UserArgs_MT64x32x64_MI16x16x1_SN_LDSB1_AFC0_AG0_AFEM1_AFEM1_ASEM1_CLR1_CADS0_DTLA0_DTLB0_DTVA0_DTVB0_DTVMXSA0_DTVMXSB0_DTVSM0_DPLB0_EPS1_ELFLR0_EMLL0_FDSI0_GRPM1_GRVWA4_GRVWB1_GSU0_GSUAMB_GSUC0_GSUWGMRR0_GLS0_ISA950_IU1_K1_LDSTI0_LBSPPA512_LBSPPB512_LBSPPM0_LPA8_LPB16_LPM0_LRVWn1_LWPMn1_MIAV0_MIWT2_1_MO40_MGRIPM1_NTn1_NTA0_NTB0_NTC4_NTD4_NTM0_NEPBS0_NLCA1_NLCB1_ONLL1_PGR1_PLR1_PKA1_SGROB0_SIA3_SS1_SU0_SUM0_SUS0_SPO0_SRVW0_SSO0_SVW2_SK3_SKFTR0_SKXCCM8_SGRO0_TDMI0_TIN1_TLDS1_TLDSMn1_ULSGRO0_USL1_UIOFGRO0_UPLRP0_USFGRO1_VSn1_VWA2_VWB1_WSGRA0_WSGRB0_WS64_WG32_8_1_WGM8_WGMXCC1_WGMXCCGn1
    SolutionIndex: 150
    SolutionNameMin: Cijk_Alik_Bjlk_S_B_Bias_HA_S_SAV_UserArgs_MT64x32x64_MI16x16x1_SN_LDSB1_AFC0_AG0_AFEM1_AFEM1_ASEM1_CLR1_CADS0_DTLA0_DTLB0_DTVA0_DTVB0_DTVMXSA0_DTVMXSB0_DTVSM0_DPLB0_EPS0_ELFLR0_EMLL0_FDSI0_GRPM1_GRVWA4_GRVWB1_GSU0_GSUAMB_GSUC0_GSUWGMRR0_GLS0_ISA950_IU1_K1_LDSTI0_LBSPPA512_LBSPPB512_LBSPPM0_LPA8_LPB16_LPM0_LRVWn1_LWPMn1_MIAV0_MIWT2_1_MO40_MGRIPM1_NTn1_NTA0_NTB0_NTC4_NTD4_NTM0_NEPBS16_NLCA1_NLCB1_ONLL1_PGR2_PLR1_PKA1_SGROB0_SIA3_SS1_SU0_SUM0_SUS0_SPO1_SRVW0_SSO1_SVW2_SK3_SKFTR0_SKXCCM8_SGRO0_TDMI0_TIN1_TLDS1_TLDSMn1_ULSGRO0_USL1_UIOFGRO0_UPLRP0_USFGRO1_VSn1_VWA2_VWB1_WSGRA0_WSGRB0_WS64_WG32_8_1_WGM32_WGMXCC1_WGMXCCGn1
    SolutionIndex: 151
    SolutionNameMin: Cijk_Alik_Bjlk_S_B_Bias_HA_S_SAV_UserArgs_MT32x32x32_MI16x16x1_SN_LDSB1_AFC0_AG0_AFEM1_AFEM1_ASEM1_CLR1_CADS0_DTLA0_DTLB0_DTVA0_DTVB0_DTVMXSA0_DTVMXSB0_DTVSM0_DPLB0_EPS0_ELFLR0_EMLLn1_FDSI0_GRPM1_GRVWA4_GRVWB1_GSU0_GSUAMB_GSUC0_GSUWGMRR0_GLS0_ISA950_IU1_K1_LDSTI0_LBSPPA128_LBSPPB512_LBSPPM0_LPA8_LPB16_LPM0_LRVWn1_LWPMn1_MIAV0_MIWT1_1_MO40_MGRIPM1_NTn1_NTA0_NTB0_NTC4_NTD4_NTM0_NEPBS0_NLCA1_NLCB1_ONLL1_PGR2_PLR1_PKA1_SGROB0_SIA3_SS0_SU0_SUM0_SUS0_SPO0_SRVW0_SSO0_SVW4_SK3_SKFTR0_SKXCCM8_SGRO0_TDMI0_TIN1_TLDS1_TLDSMn1_ULSGRO0_USL1_UIOFGRO0_UPLRP0_USFGRO1_VSn1_VWA1_VWB1_WSGRA0_WSGRB0_WS64_WG32_8_1_WGM8_WGMXCC1_WGMXCCGn1
    SolutionIndex: 152
    SolutionNameMin: Cijk_Alik_Bjlk_S_B_Bias_HA_S_SAV_UserArgs_MT32x64x64_MI16x16x1_SN_LDSB1_AFC0_AG0_AFEM1_AFEM1_ASEM1_CLR1_CADS0_DTLA0_DTLB0_DTVA0_DTVB0_DTVMXSA0_DTVMXSB0_DTVSM0_DPLB0_EPS1_ELFLR0_EMLLn1_FDSI0_GRPM1_GRVWA4_GRVWB1_GSU0_GSUAMB_GSUC0_GSUWGMRR0_GLS0_ISA950_IU1_K1_LDSTI0_LBSPPA512_LBSPPB1024_LBSPPM0_LPA8_LPB16_LPM0_LRVWn1_LWPMn1_MIAV0_MIWT2_1_MO40_MGRIPM1_NTn1_NTA0_NTB0_NTC4_NTD4_NTM0_NEPBS16_NLCA1_NLCB1_ONLL1_PGR1_PLR1_PKA1_SGROB0_SIA3_SS1_SU0_SUM0_SUS0_SPO0_SRVW0_SSO0_SVW2_SK3_SKFTR0_SKXCCM0_SGRO0_TDMI0_TIN1_TLDS1_TLDSMn1_ULSGRO0_USL1_UIOFGRO0_UPLRP0_USFGRO1_VSn1_VWA2_VWB1_WSGRA0_WSGRB2_WS64_WG16_16_1_WGM8_WGMXCC1_WGMXCCGn1
    SolutionIndex: 153
    SolutionNameMin: Cijk_Alik_Bjlk_S_B_Bias_HA_S_SAV_UserArgs_MT16x32x128_MI16x16x1_SN_LDSB1_AFC0_AG0_AFEM1_AFEM1_ASEM1_CLR1_CADS0_DTLA0_DTLB0_DTVA0_DTVB0_DTVMXSA0_DTVMXSB0_DTVSM0_DPLB0_EPS0_ELFLR0_EMLLn1_FDSI0_GRPM1_GRVWA4_GRVWB1_GSU0_GSUAMB_GSUC0_GSUWGMRR0_GLS0_ISA950_IU1_K1_LDSTI0_LBSPPA512_LBSPPB512_LBSPPM0_LPA8_LPB16_LPM0_LRVWn1_LWPMn1_MIAV1_MIWT1_1_MO40_MGRIPM1_NTn1_NTA4_NTB0_NTC0_NTD4_NTM0_NEPBS10_NLCA1_NLCB1_ONLL1_PGR2_PLR1_PKA1_SGROB0_SIA3_SS1_SU0_SUM0_SUS0_SPO1_SRVW0_SSO0_SVW1_SK3_SKFTR0_SKXCCM8_SGRO0_TDMI0_TIN0_TLDS1_TLDSMn1_ULSGRO0_USL1_UIOFGRO0_UPLRP0_USFGRO1_VSn1_VWA1_VWB1_WSGRA0_WSGRB0_WS64_WG16_8_2_WGM16_WGMXCC1_WGMXCCGn1
    SolutionIndex: 154
    SolutionNameMin: Cijk_Alik_Bjlk_S_B_Bias_HA_S_SAV_UserArgs_MT64x32x64_MI16x16x1_SN_LDSB1_AFC0_AG1_AFEM1_AFEM1_ASEM1_CLR1_CADS0_DTLA0_DTLB0_DTVA0_DTVB0_DTVMXSA0_DTVMXSB0_DTVSM0_DPLB0_EPS0_ELFLR0_EMLLn1_FDSI0_GRPM1_GRVWA4_GRVWB1_GSU0_GSUAMB_GSUC0_GSUWGMRR0_GLS0_ISA950_IU1_K1_LDSTI0_LBSPPA512_LBSPPB512_LBSPPM0_LPA8_LPB16_LPM0_LRVWn1_LWPMn1_MIAV1_MIWT2_1_MO40_MGRIPM1_NTn1_NTA0_NTB0_NTC4_NTD4_NTM0_NEPBS16_NLCA1_NLCB1_ONLL1_PGR2_PLR1_PKA1_SGROB0_SIA3_SS1_SU0_SUM0_SUS0_SPO0_SRVW0_SSO0_SVW2_SK3_SKFTR0_SKXCCM8_SGRO0_TDMI0_TIN1_TLDS1_TLDSMn1_ULSGRO0_USL1_UIOFGRO0_UPLRP0_USFGRO1_VSn1_VWA2_VWB1_WSGRA0_WSGRB0_WS64_WG32_8_1_WGM2_WGMXCC1_WGMXCCGn1
    SolutionIndex: 155
    SolutionNameMin: Cijk_Alik_Bjlk_S_B_Bias_HA_S_SAV_UserArgs_MT32x32x128_MI16x16x1_SN_LDSB1_AFC0_AG1_AFEM1_AFEM1_ASEM1_CLR1_CADS0_DTLA0_DTLB0_DTVA0_DTVB0_DTVMXSA0_DTVMXSB0_DTVSM0_DPLB0_EPS0_ELFLR0_EMLLn1_FDSI0_GRPM1_GRVWA4_GRVWB1_GSU0_GSUAMB_GSUC0_GSUWGMRR0_GLS0_ISA950_IU1_K1_LDSTI0_LBSPPA512_LBSPPB512_LBSPPM0_LPA8_LPB16_LPM0_LRVWn1_LWPMn1_MIAV1_MIWT1_1_MO40_MGRIPM1_NTn1_NTA0_NTB4_NTC0_NTD4_NTM0_NEPBS8_NLCA1_NLCB1_ONLL1_PGR2_PLR1_PKA1_SGROB0_SIA3_SS0_SU0_SUM0_SUS0_SPO0_SRVW0_SSO0_SVW4_SK3_SKFTR0_SKXCCM8_SGRO0_TDMI0_TIN1_TLDS1_TLDSMn1_ULSGRO0_USL1_UIOFGRO0_UPLRP0_USFGRO1_VSn1_VWA1_VWB1_WSGRA0_WSGRB2_WS64_WG32_8_1_WGM8_WGMXCC1_WGMXCCGn1
    SolutionIndex: 156
    SolutionNameMin: Cijk_Alik_Bjlk_S_B_Bias_HA_S_SAV_UserArgs_MT32x32x32_MI16x16x1_SN_LDSB1_AFC0_AG1_AFEM1_AFEM1_ASEM1_CLR1_CADS0_DTLA0_DTLB0_DTVA0_DTVB0_DTVMXSA0_DTVMXSB0_DTVSM0_DPLB0_EPS0_ELFLR0_EMLL0_FDSI0_GRPM1_GRVWA4_GRVWB1_GSU0_GSUAMB_GSUC0_GSUWGMRR0_GLS0_ISA950_IU1_K1_LDSTI0_LBSPPA128_LBSPPB512_LBSPPM0_LPA8_LPB16_LPM0_LRVWn1_LWPMn1_MIAV0_MIWT1_1_MO40_MGRIPM1_NTn1_NTA0_NTB0_NTC4_NTD4_NTM0_NEPBS16_NLCA1_NLCB1_ONLL1_PGR2_PLR1_PKA1_SGROB0_SIA3_SS1_SU0_SUM0_SUS0_SPO0_SRVW0_SSO0_SVW1_SK3_SKFTR0_SKXCCM8_SGRO0_TDMI0_TIN1_TLDS1_TLDSMn1_ULSGRO0_USL1_UIOFGRO0_UPLRP0_USFGRO1_VSn1_VWA1_VWB1_WSGRA0_WSGRB0_WS64_WG32_8_1_WGM2_WGMXCC1_WGMXCCGn1
    SolutionIndex: 157
    SolutionNameMin: Cijk_Alik_Bjlk_S_B_Bias_HA_S_SAV_UserArgs_MT256x224x32_MI16x16x1_SN_LDSB1_AFC0_AG1_AFEM1_AFEM1_ASEM1_CLR1_CADS0_DTLA0_DTLB0_DTVA0_DTVB0_DTVMXSA0_DTVMXSB0_DTVSM0_DPLB0_EPS0_ELFLR0_EMLL0_FDSI0_GRPM1_GRVWA4_GRVWB4_GSU0_GSUAMB_GSUC0_GSUWGMRR0_GLS0_ISA950_IU1_K1_LDSTI0_LBSPPA512_LBSPPB0_LBSPPM0_LPA8_LPB0_LPM0_LRVWn1_LWPMn1_MIAV0_MIWT4_14_MO40_MGRIPM1_NTn1_NTA0_NTB0_NTC0_NTD0_NTM0_NEPBS0_NLCA1_NLCB7_ONLL1_PGR2_PLR1_PKA1_SGROB0_SIA3_SS1_SU0_SUM0_SUS0_SPO1_SRVW0_SSO1_SVW4_SK3_SKFTR0_SKXCCM0_SGRO0_TDMI0_TIN1_TLDS1_TLDSMn1_ULSGRO0_USL1_UIOFGRO0_UPLRP0_USFGRO1_VSn1_VWA4_VWB2_WSGRA0_WSGRB0_WS64_WG64_4_1_WGMn1_WGMXCC8_WGMXCCGn1
    SolutionIndex: 158
    SolutionNameMin: Cijk_Alik_Bjlk_S_B_Bias_HA_S_SAV_UserArgs_MT64x32x64_MI16x16x1_SN_LDSB1_AFC0_AG1_AFEM1_AFEM1_ASEM1_CLR1_CADS0_DTLA0_DTLB0_DTVA0_DTVB0_DTVMXSA0_DTVMXSB0_DTVSM0_DPLB0_EPS0_ELFLR0_EMLL0_FDSI0_GRPM1_GRVWA4_GRVWB1_GSU0_GSUAMB_GSUC0_GSUWGMRR0_GLS0_ISA950_IU1_K1_LDSTI0_LBSPPA512_LBSPPB512_LBSPPM0_LPA8_LPB16_LPM0_LRVWn1_LWPMn1_MIAV0_MIWT2_1_MO40_MGRIPM1_NTn1_NTA0_NTB4_NTC4_NTD4_NTM0_NEPBS16_NLCA1_NLCB1_ONLL1_PGR2_PLR1_PKA1_SGROB0_SIA3_SS1_SU0_SUM0_SUS0_SPO1_SRVW0_SSO0_SVW2_SK3_SKFTR0_SKXCCM4_SGRO0_TDMI0_TIN1_TLDS1_TLDSMn1_ULSGRO0_USL1_UIOFGRO0_UPLRP0_USFGRO0_VSn1_VWA2_VWB1_WSGRA0_WSGRB2_WS64_WG32_8_1_WGM24_WGMXCC1_WGMXCCGn1
    SolutionIndex: 159
    SolutionNameMin: Cijk_Alik_Bjlk_S_B_Bias_HA_S_SAV_UserArgs_MT128x16x32_MI16x16x1_SN_LDSB1_AFC0_AG0_AFEM1_AFEM1_ASEM1_CLR1_CADS0_DTLA0_DTLB0_DTVA0_DTVB0_DTVMXSA0_DTVMXSB0_DTVSM0_DPLB0_EPS0_ELFLR0_EMLLn1_FDSI0_GRPM1_GRVWA4_GRVWB1_GSU0_GSUAMB_GSUC0_GSUWGMRR0_GLS0_ISA950_IU1_K1_LDSTI0_LBSPPA256_LBSPPB128_LBSPPM0_LPA8_LPB8_LPM0_LRVWn1_LWPMn1_MIAV1_MIWT2_1_MO40_MGRIPM1_NTn1_NTA0_NTB0_NTC4_NTD4_NTM0_NEPBS14_NLCA1_NLCB1_ONLL1_PGR2_PLR1_PKA1_SGROB0_SIA3_SS1_SU0_SUM0_SUS0_SPO0_SRVW0_SSO0_SVW2_SK3_SKFTR0_SKXCCM0_SGRO0_TDMI0_TIN1_TLDS2_TLDSMn1_ULSGRO0_USL1_UIOFGRO0_UPLRP0_USFGRO1_VSn1_VWA2_VWB1_WSGRA0_WSGRB0_WS64_WG64_4_1_WGM8_WGMXCC1_WGMXCCGn1
    SolutionIndex: 160
    SolutionNameMin: Cijk_Alik_Bjlk_S_B_Bias_HA_S_SAV_UserArgs_MT64x32x32_MI16x16x1_SN_LDSB1_AFC0_AG1_AFEM1_AFEM1_ASEM1_CLR1_CADS0_DTLA0_DTLB0_DTVA0_DTVB0_DTVMXSA0_DTVMXSB0_DTVSM0_DPLB0_EPS1_ELFLR0_EMLLn1_FDSI0_GRPM1_GRVWA4_GRVWB1_GSU0_GSUAMB_GSUC0_GSUWGMRR0_GLS0_ISA950_IU1_K1_LDSTI0_LBSPPA256_LBSPPB512_LBSPPM0_LPA8_LPB16_LPM0_LRVWn1_LWPMn1_MIAV0_MIWT2_1_MO40_MGRIPM1_NTn1_NTA0_NTB0_NTC4_NTD4_NTM0_NEPBS0_NLCA1_NLCB1_ONLL1_PGR1_PLR1_PKA1_SGROB0_SIA3_SS1_SU0_SUM0_SUS0_SPO1_SRVW0_SSO0_SVW2_SK3_SKFTR0_SKXCCM0_SGRO0_TDMI0_TIN1_TLDS1_TLDSMn1_ULSGRO0_USL1_UIOFGRO0_UPLRP0_USFGRO1_VSn1_VWA2_VWB1_WSGRA0_WSGRB0_WS64_WG32_8_1_WGM32_WGMXCC1_WGMXCCGn1
    SolutionIndex: 161
    SolutionNameMin: Cijk_Alik_Bjlk_S_B_Bias_HA_S_SAV_UserArgs_MT32x32x64_MI16x16x1_SN_LDSB1_AFC0_AG1_AFEM1_AFEM1_ASEM1_CLR1_CADS0_DTLA0_DTLB0_DTVA0_DTVB0_DTVMXSA0_DTVMXSB0_DTVSM0_DPLB0_EPS0_ELFLR0_EMLLn1_FDSI0_GRPM1_GRVWA4_GRVWB1_GSU0_GSUAMB_GSUC0_GSUWGMRR0_GLS0_ISA950_IU1_K1_LDSTI0_LBSPPA256_LBSPPB512_LBSPPM0_LPA8_LPB16_LPM0_LRVWn1_LWPMn1_MIAV0_MIWT1_1_MO40_MGRIPM1_NTn1_NTA0_NTB0_NTC4_NTD4_NTM0_NEPBS12_NLCA1_NLCB1_ONLL1_PGR2_PLR1_PKA1_SGROB0_SIA3_SS1_SU0_SUM0_SUS0_SPO0_SRVW0_SSO0_SVW1_SK3_SKFTR0_SKXCCM4_SGRO0_TDMI0_TIN1_TLDS1_TLDSMn1_ULSGRO0_USL1_UIOFGRO0_UPLRP0_USFGRO1_VSn1_VWA1_VWB1_WSGRA0_WSGRB0_WS64_WG32_8_1_WGM4_WGMXCC1_WGMXCCGn1
    SolutionIndex: 162
    SolutionNameMin: Cijk_Alik_Bjlk_S_B_Bias_HA_S_SAV_UserArgs_MT16x80x32_MI16x16x1_SN_LDSB0_AFC0_AG1_AFEM1_AFEM1_ASEM1_CLR1_CADS0_DTLA0_DTLB0_DTVA0_DTVB0_DTVMXSA0_DTVMXSB0_DTVSM0_DPLB0_EPS0_ELFLR0_EMLLn1_FDSI0_GRPM1_GRVWA2_GRVWB1_GSU0_GSUAMB_GSUC0_GSUWGMRR0_GLS0_ISA950_IU1_K1_LDSTI0_LBSPPA0_LBSPPB0_LBSPPM0_LPA0_LPB0_LPM0_LRVWn1_LWPMn1_MIAV0_MIWT1_5_MO40_MGRIPM1_NTn1_NTA0_NTB4_NTC0_NTD4_NTM0_NEPBS16_NLCA1_NLCB5_ONLL1_PGR2_PLR1_PKA1_SGROB0_SIA3_SS1_SU0_SUM0_SUS0_SPO1_SRVW0_SSO0_SVW1_SK3_SKFTR0_SKXCCM8_SGRO0_TDMI0_TIN0_TLDS0_TLDSMn1_ULSGRO1_USL1_UIOFGRO0_UPLRP0_USFGRO1_VSn1_VWA1_VWB1_WSGRA0_WSGRB0_WS64_WG16_4_4_WGMn24_WGMXCC1_WGMXCCGn1
    SolutionIndex: 163
    SolutionNameMin: Cijk_Alik_Bjlk_S_B_Bias_HA_S_SAV_UserArgs_MT64x16x64_MI16x16x1_SN_LDSB1_AFC0_AG1_AFEM1_AFEM1_ASEM1_CLR1_CADS0_DTLA0_DTLB0_DTVA0_DTVB0_DTVMXSA0_DTVMXSB0_DTVSM0_DPLB0_EPS0_ELFLR0_EMLLn1_FDSI0_GRPM1_GRVWA4_GRVWB1_GSU0_GSUAMB_GSUC0_GSUWGMRR0_GLS0_ISA950_IU1_K1_LDSTI0_LBSPPA256_LBSPPB256_LBSPPM0_LPA8_LPB16_LPM0_LRVWn1_LWPMn1_MIAV0_MIWT1_1_MO40_MGRIPM1_NTn1_NTA0_NTB4_NTC0_NTD4_NTM0_NEPBS10_NLCA1_NLCB1_ONLL1_PGR2_PLR1_PKA1_SGROB0_SIA3_SS0_SU0_SUM0_SUS0_SPO1_SRVW0_SSO0_SVW4_SK3_SKFTR0_SKXCCM8_SGRO0_TDMI0_TIN1_TLDS1_TLDSMn1_ULSGRO0_USL1_UIOFGRO0_UPLRP0_USFGRO1_VSn1_VWA1_VWB1_WSGRA0_WSGRB2_WS64_WG64_4_1_WGM8_WGMXCC1_WGMXCCGn1
    SolutionIndex: 164
    SolutionNameMin: Cijk_Alik_Bjlk_S_B_Bias_HA_S_SAV_UserArgs_MT32x32x64_MI16x16x1_SN_LDSB1_AFC0_AG0_AFEM1_AFEM1_ASEM1_CLR1_CADS0_DTLA0_DTLB0_DTVA0_DTVB0_DTVMXSA0_DTVMXSB0_DTVSM0_DPLB0_EPS0_ELFLR0_EMLLn1_FDSI0_GRPM1_GRVWA4_GRVWB1_GSU0_GSUAMB_GSUC0_GSUWGMRR0_GLS0_ISA950_IU1_K1_LDSTI0_LBSPPA256_LBSPPB512_LBSPPM0_LPA8_LPB16_LPM0_LRVWn1_LWPMn1_MIAV0_MIWT1_1_MO40_MGRIPM1_NTn1_NTA0_NTB0_NTC4_NTD4_NTM0_NEPBS16_NLCA1_NLCB1_ONLL1_PGR2_PLR1_PKA1_SGROB0_SIA3_SS1_SU0_SUM0_SUS0_SPO0_SRVW0_SSO0_SVW1_SK3_SKFTR0_SKXCCM4_SGRO0_TDMI0_TIN1_TLDS1_TLDSMn1_ULSGRO0_USL1_UIOFGRO0_UPLRP0_USFGRO1_VSn1_VWA1_VWB1_WSGRA0_WSGRB0_WS64_WG32_8_1_WGM32_WGMXCC1_WGMXCCGn1
    SolutionIndex: 165
    SolutionNameMin: Cijk_Alik_Bjlk_S_B_Bias_HA_S_SAV_UserArgs_MT16x16x32_MI16x16x1_SN_LDSB1_AFC0_AG0_AFEM1_AFEM1_ASEM1_CLR1_CADS0_DTLA0_DTLB0_DTVA0_DTVB0_DTVMXSA0_DTVMXSB0_DTVSM0_DPLB0_EPS0_ELFLR0_EMLLn1_FDSI0_GRPM1_GRVWA4_GRVWB1_GSU0_GSUAMB_GSUC0_GSUWGMRR0_GLS0_ISA950_IU1_K1_LDSTI0_LBSPPA128_LBSPPB128_LBSPPM0_LPA8_LPB8_LPM0_LRVWn1_LWPMn1_MIAV1_MIWT1_1_MO40_MGRIPM1_NTn1_NTA0_NTB0_NTC0_NTD4_NTM0_NEPBS2_NLCA1_NLCB1_ONLL1_PGR2_PLR1_PKA1_SGROB0_SIA3_SS1_SU0_SUM0_SUS0_SPO1_SRVW0_SSO0_SVW1_SK3_SKFTR0_SKXCCM0_SGRO0_TDMI0_TIN0_TLDS2_TLDSMn1_ULSGRO0_USL1_UIOFGRO0_UPLRP0_USFGRO1_VSn1_VWA1_VWB1_WSGRA0_WSGRB0_WS64_WG16_4_2_WGM48_WGMXCC1_WGMXCCGn1
    SolutionIndex: 166
    SolutionNameMin: Cijk_Alik_Bjlk_S_B_Bias_HA_S_SAV_UserArgs_MT32x32x128_MI16x16x1_SN_LDSB1_AFC0_AG0_AFEM1_AFEM1_ASEM1_CLR1_CADS0_DTLA0_DTLB0_DTVA0_DTVB0_DTVMXSA0_DTVMXSB0_DTVSM0_DPLB0_EPS0_ELFLR0_EMLLn1_FDSI0_GRPM1_GRVWA4_GRVWB1_GSU0_GSUAMB_GSUC0_GSUWGMRR0_GLS0_ISA950_IU1_K1_LDSTI0_LBSPPA512_LBSPPB512_LBSPPM0_LPA8_LPB16_LPM0_LRVWn1_LWPMn1_MIAV1_MIWT1_1_MO40_MGRIPM1_NTn1_NTA4_NTB0_NTC4_NTD0_NTM0_NEPBS14_NLCA1_NLCB1_ONLL1_PGR2_PLR1_PKA1_SGROB0_SIA3_SS1_SU0_SUM0_SUS0_SPO1_SRVW0_SSO0_SVW1_SK3_SKFTR0_SKXCCM0_SGRO0_TDMI0_TIN1_TLDS1_TLDSMn1_ULSGRO0_USL1_UIOFGRO0_UPLRP0_USFGRO1_VSn1_VWA1_VWB1_WSGRA0_WSGRB0_WS64_WG32_8_1_WGM8_WGMXCC8_WGMXCCGn1
    SolutionIndex: 167
    SolutionNameMin: Cijk_Alik_Bjlk_S_B_Bias_HA_S_SAV_UserArgs_MT32x32x32_MI16x16x1_SN_LDSB1_AFC0_AG0_AFEM1_AFEM1_ASEM1_CLR1_CADS0_DTLA0_DTLB0_DTVA0_DTVB0_DTVMXSA0_DTVMXSB0_DTVSM0_DPLB0_EPS0_ELFLR0_EMLLn1_FDSI0_GRPM1_GRVWA4_GRVWB1_GSU0_GSUAMB_GSUC0_GSUWGMRR0_GLS0_ISA950_IU1_K1_LDSTI0_LBSPPA128_LBSPPB512_LBSPPM0_LPA8_LPB16_LPM0_LRVWn1_LWPMn1_MIAV0_MIWT1_1_MO40_MGRIPM1_NTn1_NTA0_NTB0_NTC0_NTD4_NTM0_NEPBS14_NLCA1_NLCB1_ONLL1_PGR2_PLR1_PKA1_SGROB0_SIA3_SS1_SU0_SUM0_SUS0_SPO0_SRVW0_SSO0_SVW1_SK3_SKFTR0_SKXCCM0_SGRO0_TDMI0_TIN1_TLDS1_TLDSMn1_ULSGRO0_USL1_UIOFGRO0_UPLRP0_USFGRO1_VSn1_VWA1_VWB1_WSGRA0_WSGRB0_WS64_WG32_8_1_WGM2_WGMXCC1_WGMXCCGn1
    SolutionIndex: 168
    SolutionNameMin: Cijk_Alik_Bjlk_S_B_Bias_HA_S_SAV_UserArgs_MT32x32x64_MI16x16x1_SN_LDSB1_AFC0_AG0_AFEM1_AFEM1_ASEM1_CLR1_CADS0_DTLA0_DTLB0_DTVA0_DTVB0_DTVMXSA0_DTVMXSB0_DTVSM0_DPLB0_EPS0_ELFLR0_EMLLn1_FDSI0_GRPM1_GRVWA4_GRVWB1_GSU0_GSUAMB_GSUC0_GSUWGMRR0_GLS0_ISA950_IU1_K1_LDSTI0_LBSPPA256_LBSPPB512_LBSPPM0_LPA8_LPB16_LPM0_LRVWn1_LWPMn1_MIAV0_MIWT1_1_MO40_MGRIPM1_NTn1_NTA0_NTB0_NTC0_NTD4_NTM0_NEPBS4_NLCA1_NLCB1_ONLL1_PGR2_PLR1_PKA1_SGROB0_SIA3_SS1_SU0_SUM0_SUS0_SPO0_SRVW0_SSO0_SVW1_SK3_SKFTR0_SKXCCM8_SGRO0_TDMI0_TIN1_TLDS1_TLDSMn1_ULSGRO0_USL1_UIOFGRO0_UPLRP0_USFGRO1_VSn1_VWA1_VWB1_WSGRA0_WSGRB0_WS64_WG32_8_1_WGM2_WGMXCC1_WGMXCCGn1
    SolutionIndex: 169
    SolutionNameMin: Cijk_Alik_Bjlk_S_B_Bias_HA_S_SAV_UserArgs_MT32x64x32_MI16x16x1_SN_LDSB1_AFC0_AG1_AFEM1_AFEM1_ASEM1_CLR1_CADS0_DTLA0_DTLB0_DTVA0_DTVB0_DTVMXSA0_DTVMXSB0_DTVSM0_DPLB0_EPS0_ELFLR0_EMLL0_FDSI0_GRPM1_GRVWA4_GRVWB1_GSU0_GSUAMB_GSUC0_GSUWGMRR0_GLS0_ISA950_IU1_K1_LDSTI0_LBSPPA256_LBSPPB1024_LBSPPM0_LPA8_LPB16_LPM0_LRVWn1_LWPMn1_MIAV0_MIWT2_1_MO40_MGRIPM1_NTn1_NTA0_NTB0_NTC4_NTD4_NTM0_NEPBS8_NLCA1_NLCB1_ONLL1_PGR2_PLR1_PKA1_SGROB0_SIA3_SS1_SU0_SUM0_SUS0_SPO1_SRVW0_SSO0_SVW2_SK3_SKFTR0_SKXCCM4_SGRO0_TDMI0_TIN1_TLDS1_TLDSMn1_ULSGRO0_USL1_UIOFGRO0_UPLRP0_USFGRO1_VSn1_VWA2_VWB1_WSGRA0_WSGRB0_WS64_WG16_16_1_WGM2_WGMXCC1_WGMXCCGn1
    SolutionIndex: 170
    SolutionNameMin: Cijk_Alik_Bjlk_S_B_Bias_HA_S_SAV_UserArgs_MT64x16x32_MI16x16x1_SN_LDSB1_AFC0_AG0_AFEM1_AFEM1_ASEM1_CLR1_CADS0_DTLA0_DTLB0_DTVA0_DTVB0_DTVMXSA0_DTVMXSB0_DTVSM0_DPLB0_EPS1_ELFLR0_EMLLn1_FDSI0_GRPM1_GRVWA4_GRVWB1_GSU0_GSUAMB_GSUC0_GSUWGMRR0_GLS0_ISA950_IU1_K1_LDSTI0_LBSPPA128_LBSPPB256_LBSPPM0_LPA8_LPB16_LPM0_LRVWn1_LWPMn1_MIAV0_MIWT1_1_MO40_MGRIPM1_NTn1_NTA0_NTB0_NTC0_NTD4_NTM0_NEPBS14_NLCA1_NLCB1_ONLL1_PGR1_PLR1_PKA1_SGROB0_SIA3_SS1_SU0_SUM0_SUS0_SPO0_SRVW0_SSO0_SVW1_SK3_SKFTR0_SKXCCM4_SGRO0_TDMI0_TIN1_TLDS1_TLDSMn1_ULSGRO0_USL1_UIOFGRO0_UPLRP0_USFGRO1_VSn1_VWA1_VWB1_WSGRA0_WSGRB0_WS64_WG64_4_1_WGM32_WGMXCC1_WGMXCCGn1
    SolutionIndex: 171
    SolutionNameMin: Cijk_Alik_Bjlk_S_B_Bias_HA_S_SAV_UserArgs_MT64x64x32_MI16x16x1_SN_LDSB0_AFC0_AG0_AFEM1_AFEM1_ASEM1_CLR1_CADS0_DTLA0_DTLB0_DTVA0_DTVB0_DTVMXSA0_DTVMXSB0_DTVSM0_DPLB0_EPS0_ELFLR0_EMLLn1_FDSI0_GRPM1_GRVWA4_GRVWB1_GSU0_GSUAMB_GSUC0_GSUWGMRR0_GLS0_ISA950_IU1_K1_LDSTI0_LBSPPA512_LBSPPB1024_LBSPPM0_LPA8_LPB16_LPM0_LRVWn1_LWPMn1_MIAV0_MIWT4_1_MO40_MGRIPM1_NTn1_NTA0_NTB0_NTC4_NTD4_NTM0_NEPBS8_NLCA1_NLCB1_ONLL1_PGR2_PLR1_PKA1_SGROB0_SIA3_SS1_SU0_SUM0_SUS0_SPO1_SRVW0_SSO0_SVW4_SK3_SKFTR0_SKXCCM8_SGRO0_TDMI0_TIN1_TLDS1_TLDSMn1_ULSGRO0_USL1_UIOFGRO0_UPLRP0_USFGRO1_VSn1_VWA4_VWB1_WSGRA0_WSGRB0_WS64_WG16_16_1_WGM2_WGMXCC1_WGMXCCGn1
    SolutionIndex: 172
    SolutionNameMin: Cijk_Alik_Bjlk_S_B_Bias_HA_S_SAV_UserArgs_MT32x32x32_MI16x16x1_SN_LDSB0_AFC0_AG1_AFEM1_AFEM1_ASEM1_CLR1_CADS0_DTLA0_DTLB0_DTVA0_DTVB0_DTVMXSA0_DTVMXSB0_DTVSM0_DPLB0_EPS0_ELFLR0_EMLL0_FDSI0_GRPM1_GRVWA4_GRVWB1_GSU0_GSUAMB_GSUC0_GSUWGMRR0_GLS0_ISA950_IU1_K1_LDSTI0_LBSPPA128_LBSPPB512_LBSPPM0_LPA8_LPB16_LPM0_LRVWn1_LWPMn1_MIAV0_MIWT1_1_MO40_MGRIPM1_NTn1_NTA0_NTB0_NTC4_NTD4_NTM0_NEPBS12_NLCA1_NLCB1_ONLL1_PGR2_PLR1_PKA1_SGROB0_SIA3_SS0_SU0_SUM0_SUS0_SPO1_SRVW0_SSO0_SVW4_SK3_SKFTR0_SKXCCM8_SGRO0_TDMI0_TIN1_TLDS1_TLDSMn1_ULSGRO0_USL1_UIOFGRO0_UPLRP0_USFGRO1_VSn1_VWA1_VWB1_WSGRA0_WSGRB0_WS64_WG32_8_1_WGM4_WGMXCC1_WGMXCCGn1
    SolutionIndex: 173
    SolutionNameMin: Cijk_Alik_Bjlk_S_B_Bias_HA_S_SAV_UserArgs_MT32x32x32_MI16x16x1_SN_LDSB0_AFC0_AG1_AFEM1_AFEM1_ASEM1_CLR1_CADS0_DTLA0_DTLB0_DTVA0_DTVB0_DTVMXSA0_DTVMXSB0_DTVSM0_DPLB0_EPS0_ELFLR0_EMLL0_FDSI0_GRPM1_GRVWA4_GRVWB1_GSU0_GSUAMB_GSUC0_GSUWGMRR0_GLS0_ISA950_IU1_K1_LDSTI0_LBSPPA128_LBSPPB512_LBSPPM0_LPA8_LPB16_LPM0_LRVWn1_LWPMn1_MIAV1_MIWT1_1_MO40_MGRIPM1_NTn1_NTA0_NTB0_NTC4_NTD4_NTM0_NEPBS10_NLCA1_NLCB1_ONLL1_PGR2_PLR1_PKA1_SGROB0_SIA3_SS1_SU0_SUM0_SUS0_SPO0_SRVW0_SSO0_SVW1_SK3_SKFTR0_SKXCCM8_SGRO0_TDMI0_TIN1_TLDS1_TLDSMn1_ULSGRO0_USL1_UIOFGRO0_UPLRP0_USFGRO1_VSn1_VWA1_VWB1_WSGRA0_WSGRB0_WS64_WG32_8_1_WGM2_WGMXCC1_WGMXCCGn1
    SolutionIndex: 174
    SolutionNameMin: Cijk_Alik_Bjlk_S_B_Bias_HA_S_SAV_UserArgs_MT128x32x32_MI16x16x1_SN_LDSB0_AFC0_AG1_AFEM1_AFEM1_ASEM1_CLR1_CADS0_DTLA0_DTLB0_DTVA0_DTVB0_DTVMXSA0_DTVMXSB0_DTVSM0_DPLB0_EPS0_ELFLR0_EMLLn1_FDSI0_GRPM1_GRVWA4_GRVWB1_GSU0_GSUAMB_GSUC0_GSUWGMRR0_GLS0_ISA950_IU1_K1_LDSTI0_LBSPPA512_LBSPPB512_LBSPPM0_LPA8_LPB16_LPM0_LRVWn1_LWPMn1_MIAV0_MIWT4_1_MO40_MGRIPM1_NTn1_NTA0_NTB0_NTC4_NTD4_NTM0_NEPBS16_NLCA1_NLCB1_ONLL1_PGR2_PLR1_PKA1_SGROB0_SIA3_SS1_SU0_SUM0_SUS0_SPO0_SRVW0_SSO1_SVW4_SK3_SKFTR0_SKXCCM4_SGRO0_TDMI0_TIN1_TLDS1_TLDSMn1_ULSGRO0_USL1_UIOFGRO0_UPLRP0_USFGRO1_VSn1_VWA4_VWB1_WSGRA0_WSGRB0_WS64_WG32_8_1_WGMn16_WGMXCC1_WGMXCCGn1
    SolutionIndex: 175
    SolutionNameMin: Cijk_Alik_Bjlk_S_B_Bias_HA_S_SAV_UserArgs_MT64x32x32_MI16x16x1_SN_LDSB1_AFC0_AG1_AFEM1_AFEM1_ASEM1_CLR1_CADS0_DTLA0_DTLB0_DTVA0_DTVB0_DTVMXSA0_DTVMXSB0_DTVSM0_DPLB0_EPS0_ELFLR0_EMLLn1_FDSI0_GRPM1_GRVWA4_GRVWB1_GSU0_GSUAMB_GSUC0_GSUWGMRR0_GLS0_ISA950_IU1_K1_LDSTI0_LBSPPA256_LBSPPB512_LBSPPM0_LPA8_LPB16_LPM0_LRVWn1_LWPMn1_MIAV0_MIWT2_1_MO40_MGRIPM1_NTn1_NTA0_NTB0_NTC4_NTD4_NTM0_NEPBS16_NLCA1_NLCB1_ONLL1_PGR2_PLR1_PKA1_SGROB0_SIA3_SS1_SU0_SUM0_SUS0_SPO1_SRVW0_SSO0_SVW2_SK3_SKFTR0_SKXCCM8_SGRO0_TDMI0_TIN1_TLDS1_TLDSMn1_ULSGRO1_USL1_UIOFGRO0_UPLRP0_USFGRO1_VSn1_VWA2_VWB1_WSGRA0_WSGRB0_WS64_WG32_8_1_WGM8_WGMXCC1_WGMXCCGn1
    SolutionIndex: 176
    SolutionNameMin: Cijk_Alik_Bjlk_S_B_Bias_HA_S_SAV_UserArgs_MT256x240x32_MI16x16x1_SN_LDSB1_AFC0_AG0_AFEM1_AFEM1_ASEM1_CLR1_CADS0_DTLA0_DTLB0_DTVA0_DTVB0_DTVMXSA0_DTVMXSB0_DTVSM0_DPLB0_EPS0_ELFLR0_EMLL0_FDSI0_GRPM1_GRVWA4_GRVWB2_GSU0_GSUAMB_GSUC0_GSUWGMRR0_GLS0_ISA950_IU1_K1_LDSTI0_LBSPPA512_LBSPPB3840_LBSPPM0_LPA8_LPB16_LPM0_LRVWn1_LWPMn1_MIAV0_MIWT4_15_MO40_MGRIPM1_NTn1_NTA0_NTB0_NTC4_NTD4_NTM0_NEPBS12_NLCA1_NLCB15_ONLL1_PGR2_PLR1_PKA1_SGROB0_SIA3_SS1_SU0_SUM0_SUS0_SPO1_SRVW0_SSO1_SVW4_SK3_SKFTR0_SKXCCM8_SGRO0_TDMI0_TIN1_TLDS1_TLDSMn1_ULSGRO0_USL1_UIOFGRO0_UPLRP0_USFGRO1_VSn1_VWA4_VWB1_WSGRA0_WSGRB2_WS64_WG64_4_1_WGM4_WGMXCC16_WGMXCCGn1
    SolutionIndex: 177
    SolutionNameMin: Cijk_Alik_Bjlk_S_B_Bias_HA_S_SAV_UserArgs_MT64x64x32_MI16x16x1_SN_LDSB1_AFC0_AG1_AFEM1_AFEM1_ASEM1_CLR1_CADS0_DTLA0_DTLB0_DTVA0_DTVB0_DTVMXSA0_DTVMXSB0_DTVSM0_DPLB0_EPS0_ELFLR0_EMLL0_FDSI0_GRPM1_GRVWA4_GRVWB1_GSU0_GSUAMB_GSUC0_GSUWGMRR0_GLS0_ISA950_IU1_K1_LDSTI0_LBSPPA512_LBSPPB1024_LBSPPM0_LPA8_LPB16_LPM0_LRVWn1_LWPMn1_MIAV0_MIWT4_1_MO40_MGRIPM1_NTn1_NTA0_NTB0_NTC4_NTD4_NTM0_NEPBS14_NLCA1_NLCB1_ONLL1_PGR2_PLR1_PKA1_SGROB0_SIA3_SS1_SU0_SUM0_SUS0_SPO0_SRVW0_SSO0_SVW4_SK3_SKFTR0_SKXCCM4_SGRO0_TDMI0_TIN1_TLDS1_TLDSMn1_ULSGRO0_USL1_UIOFGRO0_UPLRP0_USFGRO1_VSn1_VWA4_VWB1_WSGRA0_WSGRB0_WS64_WG16_16_1_WGM6_WGMXCC1_WGMXCCGn1
    SolutionIndex: 178
    SolutionNameMin: Cijk_Alik_Bjlk_S_B_Bias_HA_S_SAV_UserArgs_MT32x32x64_MI16x16x1_SN_LDSB1_AFC0_AG0_AFEM1_AFEM1_ASEM1_CLR1_CADS0_DTLA0_DTLB0_DTVA0_DTVB0_DTVMXSA0_DTVMXSB0_DTVSM0_DPLB0_EPS0_ELFLR0_EMLLn1_FDSI0_GRPM1_GRVWA4_GRVWB1_GSU0_GSUAMB_GSUC0_GSUWGMRR0_GLS0_ISA950_IU1_K1_LDSTI0_LBSPPA256_LBSPPB512_LBSPPM0_LPA8_LPB16_LPM0_LRVWn1_LWPMn1_MIAV0_MIWT1_1_MO40_MGRIPM1_NTn1_NTA0_NTB0_NTC4_NTD4_NTM0_NEPBS0_NLCA1_NLCB1_ONLL1_PGR2_PLR1_PKA1_SGROB0_SIA3_SS1_SU0_SUM0_SUS0_SPO0_SRVW0_SSO0_SVW1_SK3_SKFTR0_SKXCCM8_SGRO0_TDMI0_TIN1_TLDS1_TLDSMn1_ULSGRO0_USL1_UIOFGRO0_UPLRP0_USFGRO1_VSn1_VWA1_VWB1_WSGRA0_WSGRB0_WS64_WG32_8_1_WGM2_WGMXCC1_WGMXCCGn1
    SolutionIndex: 179
    SolutionNameMin: Cijk_Alik_Bjlk_S_B_Bias_HA_S_SAV_UserArgs_MT512x128x32_MI16x16x1_SN_LDSB1_AFC0_AG0_AFEM1_AFEM1_ASEM1_CLR1_CADS0_DTLA0_DTLB0_DTVA0_DTVB0_DTVMXSA0_DTVMXSB0_DTVSM0_DPLB0_EPS0_ELFLR0_EMLL0_FDSI0_GRPM1_GRVWA4_GRVWB4_GSU0_GSUAMB_GSUC0_GSUWGMRR0_GLS0_ISA950_IU1_K1_LDSTI0_LBSPPA512_LBSPPB0_LBSPPM0_LPA8_LPB0_LPM0_LRVWn1_LWPMn1_MIAV0_MIWT8_8_MO40_MGRIPM1_NTn1_NTA0_NTB0_NTC4_NTD4_NTM0_NEPBS0_NLCA1_NLCB1_ONLL1_PGR2_PLR1_PKA1_SGROB0_SIA3_SS1_SU0_SUM0_SUS0_SPO1_SRVW0_SSO1_SVW4_SK3_SKFTR0_SKXCCM4_SGRO0_TDMI0_TIN1_TLDS1_TLDSMn1_ULSGRO0_USL1_UIOFGRO0_UPLRP0_USFGRO1_VSn1_VWA4_VWB4_WSGRA0_WSGRB0_WS64_WG64_4_1_WGM8_WGMXCC8_WGMXCCGn1
    SolutionIndex: 180
    SolutionNameMin: Cijk_Alik_Bjlk_S_B_Bias_HA_S_SAV_UserArgs_MT256x224x32_MI32x32x1_SN_LDSB1_AFC0_AG1_AFEM1_AFEM1_ASEM1_CLR1_CADS0_DTLA0_DTLB0_DTVA0_DTVB0_DTVMXSA0_DTVMXSB0_DTVSM0_DPLB0_EPS1_ELFLR0_EMLLn1_FDSI0_GRPM1_GRVWA4_GRVWB4_GSU0_GSUAMB_GSUC0_GSUWGMRR0_GLS0_ISA950_IU1_K1_LDSTI0_LBSPPA256_LBSPPB0_LBSPPM0_LPA4_LPB0_LPM0_LRVWn1_LWPMn1_MIAV0_MIWT2_7_MO40_MGRIPM1_NTn1_NTA0_NTB0_NTC0_NTD0_NTM0_NEPBS0_NLCA1_NLCB7_ONLL1_PGR1_PLR1_PKA1_SGROB0_SIA3_SS1_SU0_SUM0_SUS0_SPO0_SRVW0_SSO1_SVW2_SK3_SKFTR0_SKXCCM4_SGRO0_TDMI0_TIN1_TLDS1_TLDSMn1_ULSGRO0_USL1_UIOFGRO0_UPLRP0_USFGRO1_VSn1_VWA2_VWB1_WSGRA0_WSGRB0_WS64_WG128_2_1_WGM2_WGMXCC1_WGMXCCGn1
    SolutionIndex: 181
    SolutionNameMin: Cijk_Alik_Bjlk_S_B_Bias_HA_S_SAV_UserArgs_MT512x128x32_MI16x16x1_SN_LDSB1_AFC0_AG1_AFEM1_AFEM1_ASEM1_CLR1_CADS0_DTLA0_DTLB0_DTVA0_DTVB0_DTVMXSA0_DTVMXSB0_DTVSM0_DPLB0_EPS0_ELFLR0_EMLLn1_FDSI0_GRPM1_GRVWA4_GRVWB4_GSU0_GSUAMB_GSUC0_GSUWGMRR0_GLS0_ISA950_IU1_K1_LDSTI0_LBSPPA512_LBSPPB0_LBSPPM0_LPA8_LPB0_LPM0_LRVWn1_LWPMn1_MIAV0_MIWT8_8_MO40_MGRIPM1_NTn1_NTA0_NTB0_NTC4_NTD4_NTM0_NEPBS14_NLCA1_NLCB1_ONLL1_PGR2_PLR1_PKA1_SGROB0_SIA3_SS1_SU0_SUM0_SUS0_SPO1_SRVW0_SSO1_SVW4_SK3_SKFTR0_SKXCCM0_SGRO0_TDMI0_TIN1_TLDS1_TLDSMn1_ULSGRO0_USL1_UIOFGRO0_UPLRP0_USFGRO0_VSn1_VWA4_VWB4_WSGRA0_WSGRB2_WS64_WG64_4_1_WGMn8_WGMXCC8_WGMXCCGn1
    SolutionIndex: 182
    SolutionNameMin: Cijk_Alik_Bjlk_S_B_Bias_HA_S_SAV_UserArgs_MT192x320x32_MI16x16x1_SN_LDSB1_AFC0_AG1_AFEM1_AFEM1_ASEM1_CLR1_CADS0_DTLA0_DTLB0_DTVA0_DTVB0_DTVMXSA0_DTVMXSB0_DTVSM0_DPLB0_EPS0_ELFLR0_EMLLn1_FDSI0_GRPM1_GRVWA4_GRVWB4_GSU0_GSUAMB_GSUC0_GSUWGMRR0_GLS0_ISA950_IU1_K1_LDSTI0_LBSPPA512_LBSPPB5120_LBSPPM0_LPA8_LPB16_LPM0_LRVWn1_LWPMn1_MIAV0_MIWT12_5_MO40_MGRIPM1_NTn1_NTA0_NTB0_NTC0_NTD0_NTM0_NEPBS12_NLCA1_NLCB5_ONLL1_PGR2_PLR1_PKA1_SGROB0_SIA3_SS1_SU0_SUM0_SUS0_SPO0_SRVW0_SSO1_SVW4_SK3_SKFTR0_SKXCCM4_SGRO0_TDMI0_TIN1_TLDS1_TLDSMn1_ULSGRO0_USL1_UIOFGRO0_UPLRP0_USFGRO0_VSn1_VWA4_VWB1_WSGRA2_WSGRB0_WS64_WG16_16_1_WGM2_WGMXCC1_WGMXCCGn1
    SolutionIndex: 183
    SolutionNameMin: Cijk_Alik_Bjlk_S_B_Bias_HA_S_SAV_UserArgs_MT128x352x32_MI16x16x1_SN_LDSB1_AFC0_AG1_AFEM1_AFEM1_ASEM1_CLR1_CADS0_DTLA0_DTLB0_DTVA0_DTVB0_DTVMXSA0_DTVMXSB0_DTVSM0_DPLB0_EPS0_ELFLR0_EMLLn1_FDSI0_GRPM1_GRVWA4_GRVWB4_GSU0_GSUAMB_GSUC0_GSUWGMRR0_GLS0_ISA950_IU1_K1_LDSTI0_LBSPPA512_LBSPPB5632_LBSPPM0_LPA8_LPB16_LPM0_LRVWn1_LWPMn1_MIAV0_MIWT4_11_MO40_MGRIPM1_NTn1_NTA0_NTB0_NTC0_NTD0_NTM0_NEPBS8_NLCA1_NLCB11_ONLL1_PGR2_PLR1_PKA1_SGROB0_SIA3_SS0_SU0_SUM0_SUS0_SPO0_SRVW0_SSO0_SVW4_SK3_SKFTR0_SKXCCM8_SGRO0_TDMI0_TIN1_TLDS1_TLDSMn1_ULSGRO0_USL1_UIOFGRO0_UPLRP0_USFGRO1_VSn1_VWA4_VWB1_WSGRA2_WSGRB0_WS64_WG32_8_1_WGM4_WGMXCC1_WGMXCCGn1
    SolutionIndex: 184
    SolutionNameMin: Cijk_Alik_Bjlk_S_B_Bias_HA_S_SAV_UserArgs_MT320x128x32_MI16x16x1_SN_LDSB0_AFC0_AG0_AFEM1_AFEM1_ASEM1_CLR1_CADS0_DTLA0_DTLB0_DTVA0_DTVB0_DTVMXSA0_DTVMXSB0_DTVSM0_DPLB0_EPS0_ELFLR0_EMLLn1_FDSI0_GRPM1_GRVWA4_GRVWB4_GSU0_GSUAMB_GSUC0_GSUWGMRR0_GLS0_ISA950_IU1_K1_LDSTI0_LBSPPA256_LBSPPB0_LBSPPM0_LPA8_LPB0_LPM0_LRVWn1_LWPMn1_MIAV0_MIWT10_4_MO40_MGRIPM1_NTn1_NTA0_NTB0_NTC0_NTD0_NTM0_NEPBS0_NLCA1_NLCB1_ONLL1_PGR2_PLR1_PKA1_SGROB0_SIA3_SS1_SU0_SUM0_SUS0_SPO0_SRVW0_SSO1_SVW2_SK3_SKFTR0_SKXCCM0_SGRO0_TDMI0_TIN1_TLDS1_TLDSMn1_ULSGRO1_USL1_UIOFGRO0_UPLRP0_USFGRO1_VSn1_VWA2_VWB4_WSGRA0_WSGRB0_WS64_WG32_8_1_WGM2_WGMXCC8_WGMXCCGn1
    SolutionIndex: 185
    SolutionNameMin: Cijk_Alik_Bjlk_S_B_Bias_HA_S_SAV_UserArgs_MT256x256x32_MI32x32x1_SN_LDSB1_AFC0_AG1_AFEM1_AFEM1_ASEM1_CLR1_CADS0_DTLA0_DTLB0_DTVA0_DTVB0_DTVMXSA0_DTVMXSB0_DTVSM0_DPLB0_EPS0_ELFLR0_EMLL0_FDSI0_GRPM1_GRVWA4_GRVWB4_GSU0_GSUAMB_GSUC0_GSUWGMRR0_GLS0_ISA950_IU1_K1_LDSTI0_LBSPPA512_LBSPPB0_LBSPPM0_LPA4_LPB0_LPM0_LRVWn1_LWPMn1_MIAV0_MIWT4_4_MO40_MGRIPM1_NTn1_NTA0_NTB0_NTC0_NTD0_NTM0_NEPBS12_NLCA1_NLCB1_ONLL1_PGR2_PLR1_PKA1_SGROB0_SIA3_SS1_SU0_SUM0_SUS0_SPO0_SRVW0_SSO1_SVW4_SK3_SKFTR0_SKXCCM8_SGRO0_TDMI0_TIN1_TLDS1_TLDSMn1_ULSGRO0_USL1_UIOFGRO0_UPLRP0_USFGRO0_VSn1_VWA4_VWB4_WSGRA0_WSGRB0_WS64_WG64_4_1_WGMn2_WGMXCC1_WGMXCCGn1
    SolutionIndex: 186
    SolutionNameMin: Cijk_Alik_Bjlk_S_B_Bias_HA_S_SAV_UserArgs_MT256x192x32_MI32x32x1_SN_LDSB1_AFC0_AG1_AFEM1_AFEM1_ASEM1_CLR1_CADS0_DTLA0_DTLB0_DTVA0_DTVB0_DTVMXSA0_DTVMXSB0_DTVSM0_DPLB0_EPS1_ELFLR0_EMLL0_FDSI0_GRPM1_GRVWA4_GRVWB4_GSU0_GSUAMB_GSUC0_GSUWGMRR0_GLS0_ISA950_IU1_K1_LDSTI0_LBSPPA512_LBSPPB0_LBSPPM0_LPA4_LPB0_LPM0_LRVWn1_LWPMn1_MIAV0_MIWT4_3_MO40_MGRIPM1_NTn1_NTA0_NTB0_NTC4_NTD4_NTM0_NEPBS12_NLCA1_NLCB3_ONLL1_PGR1_PLR1_PKA1_SGROB0_SIA3_SS1_SU0_SUM0_SUS0_SPO1_SRVW0_SSO1_SVW4_SK3_SKFTR0_SKXCCM4_SGRO0_TDMI0_TIN1_TLDS1_TLDSMn1_ULSGRO0_USL1_UIOFGRO0_UPLRP0_USFGRO1_VSn1_VWA4_VWB1_WSGRA2_WSGRB0_WS64_WG64_4_1_WGM8_WGMXCC32_WGMXCCGn1
    SolutionIndex: 187
    SolutionNameMin: Cijk_Alik_Bjlk_S_B_Bias_HA_S_SAV_UserArgs_MT256x160x32_MI16x16x1_SN_LDSB1_AFC0_AG1_AFEM1_AFEM1_ASEM1_CLR1_CADS0_DTLA0_DTLB0_DTVA0_DTVB0_DTVMXSA0_DTVMXSB0_DTVSM0_DPLB0_EPS0_ELFLR0_EMLL0_FDSI0_GRPM1_GRVWA4_GRVWB4_GSU0_GSUAMB_GSUC0_GSUWGMRR0_GLS0_ISA950_IU1_K1_LDSTI0_LBSPPA512_LBSPPB0_LBSPPM0_LPA8_LPB0_LPM0_LRVWn1_LWPMn1_MIAV0_MIWT4_10_MO40_MGRIPM1_NTn1_NTA0_NTB0_NTC0_NTD0_NTM0_NEPBS0_NLCA1_NLCB5_ONLL1_PGR2_PLR1_PKA1_SGROB0_SIA3_SS1_SU0_SUM0_SUS0_SPO0_SRVW0_SSO1_SVW4_SK3_SKFTR0_SKXCCM0_SGRO0_TDMI0_TIN1_TLDS1_TLDSMn1_ULSGRO1_USL1_UIOFGRO0_UPLRP0_USFGRO1_VSn1_VWA4_VWB2_WSGRA2_WSGRB0_WS64_WG64_4_1_WGM8_WGMXCC2_WGMXCCGn1
    SolutionIndex: 188
    SolutionNameMin: Cijk_Alik_Bjlk_S_B_Bias_HA_S_SAV_UserArgs_MT256x208x32_MI16x16x1_SN_LDSB1_AFC0_AG1_AFEM1_AFEM1_ASEM1_CLR1_CADS0_DTLA0_DTLB0_DTVA0_DTVB0_DTVMXSA0_DTVMXSB0_DTVSM0_DPLB0_EPS0_ELFLR0_EMLL0_FDSI0_GRPM1_GRVWA4_GRVWB1_GSU0_GSUAMB_GSUC0_GSUWGMRR0_GLS0_ISA950_IU1_K1_LDSTI0_LBSPPA512_LBSPPB3328_LBSPPM0_LPA8_LPB16_LPM0_LRVWn1_LWPMn1_MIAV0_MIWT4_13_MO40_MGRIPM1_NTn1_NTA0_NTB0_NTC0_NTD0_NTM0_NEPBS0_NLCA1_NLCB13_ONLL1_PGR2_PLR1_PKA1_SGROB0_SIA3_SS1_SU0_SUM0_SUS0_SPO0_SRVW0_SSO1_SVW4_SK3_SKFTR0_SKXCCM0_SGRO0_TDMI0_TIN1_TLDS1_TLDSMn1_ULSGRO0_USL1_UIOFGRO0_UPLRP0_USFGRO0_VSn1_VWA4_VWB1_WSGRA0_WSGRB2_WS64_WG64_4_1_WGMn1_WGMXCC8_WGMXCCGn1
    SolutionIndex: 189
    SolutionNameMin: Cijk_Alik_Bjlk_S_B_Bias_HA_S_SAV_UserArgs_MT128x416x32_MI16x16x1_SN_LDSB1_AFC0_AG0_AFEM1_AFEM1_ASEM1_CLR1_CADS0_DTLA0_DTLB0_DTVA0_DTVB0_DTVMXSA0_DTVMXSB0_DTVSM0_DPLB0_EPS0_ELFLR0_EMLLn1_FDSI0_GRPM1_GRVWA4_GRVWB4_GSU0_GSUAMB_GSUC0_GSUWGMRR0_GLS0_ISA950_IU1_K1_LDSTI0_LBSPPA512_LBSPPB6656_LBSPPM0_LPA8_LPB16_LPM0_LRVWn1_LWPMn1_MIAV0_MIWT4_13_MO40_MGRIPM1_NTn1_NTA0_NTB0_NTC4_NTD4_NTM0_NEPBS14_NLCA1_NLCB13_ONLL1_PGR2_PLR1_PKA1_SGROB0_SIA3_SS1_SU0_SUM0_SUS0_SPO1_SRVW0_SSO1_SVW4_SK3_SKFTR0_SKXCCM8_SGRO0_TDMI0_TIN1_TLDS1_TLDSMn1_ULSGRO0_USL1_UIOFGRO0_UPLRP0_USFGRO1_VSn1_VWA4_VWB1_WSGRA2_WSGRB2_WS64_WG32_8_1_WGMn24_WGMXCC32_WGMXCCGn1
    SolutionIndex: 190
    SolutionNameMin: Cijk_Alik_Bjlk_S_B_Bias_HA_S_SAV_UserArgs_MT256x128x32_MI16x16x1_SN_LDSB1_AFC0_AG0_AFEM1_AFEM1_ASEM1_CLR0_CADS0_DTLA0_DTLB0_DTVA0_DTVB0_DTVMXSA0_DTVMXSB0_DTVSM0_DPLB0_EPS0_ELFLR0_EMLL0_FDSI0_GRPM1_GRVWA4_GRVWB4_GSU0_GSUAMB_GSUC0_GSUWGMRR0_GLS0_ISA950_IU1_K1_LDSTI1_LBSPPA0_LBSPPB0_LBSPPM0_LPA0_LPB0_LPM0_LRVWn1_LWPMn1_MIAV0_MIWT8_4_MO40_MGRIPM1_NTn1_NTA0_NTB0_NTC4_NTD4_NTM0_NEPBS0_NLCA1_NLCB1_ONLL1_PGR2_PLR1_PKA1_SGROB0_SIA3_SS1_SU0_SUM0_SUS0_SPO1_SRVW0_SSO1_SVW4_SK3_SKFTR0_SKXCCM0_SGRO0_TDMI0_TIN1_TLDS0_TLDSMn1_ULSGRO0_USL1_UIOFGRO0_UPLRP0_USFGRO0_VSn1_VWA4_VWB4_WSGRA0_WSGRB2_WS64_WG32_8_1_WGM6_WGMXCC4_WGMXCCGn1
    SolutionIndex: 191
    SolutionNameMin: Cijk_Alik_Bjlk_S_B_Bias_HA_S_SAV_UserArgs_MT208x256x32_MI16x16x1_SN_LDSB1_AFC0_AG0_AFEM1_AFEM1_ASEM1_CLR1_CADS0_DTLA0_DTLB0_DTVA0_DTVB0_DTVMXSA0_DTVMXSB0_DTVSM0_DPLB0_EPS0_ELFLR0_EMLLn1_FDSI0_GRPM1_GRVWA2_GRVWB2_GSU0_GSUAMB_GSUC0_GSUWGMRR0_GLS0_ISA950_IU1_K1_LDSTI0_LBSPPA128_LBSPPB0_LBSPPM0_LPA8_LPB0_LPM0_LRVWn1_LWPMn1_MIAV0_MIWT13_4_MO40_MGRIPM1_NTn1_NTA0_NTB0_NTC0_NTD0_NTM0_NEPBS0_NLCA1_NLCB1_ONLL1_PGR2_PLR1_PKA1_SGROB0_SIA3_SS1_SU0_SUM0_SUS0_SPO0_SRVW0_SSO0_SVW1_SK3_SKFTR0_SKXCCM0_SGRO0_TDMI0_TIN1_TLDS1_TLDSMn1_ULSGRO1_USL1_UIOFGRO0_UPLRP0_USFGRO0_VSn1_VWA1_VWB4_WSGRA0_WSGRB0_WS64_WG16_16_1_WGM24_WGMXCC1_WGMXCCGn1
    SolutionIndex: 192
    SolutionNameMin: Cijk_Alik_Bjlk_S_B_Bias_HA_S_SAV_UserArgs_MT256x192x32_MI32x32x1_SN_LDSB1_AFC0_AG1_AFEM1_AFEM1_ASEM1_CLR1_CADS0_DTLA0_DTLB0_DTVA0_DTVB0_DTVMXSA0_DTVMXSB0_DTVSM0_DPLB0_EPS0_ELFLR0_EMLLn1_FDSI0_GRPM1_GRVWA4_GRVWB2_GSU0_GSUAMB_GSUC0_GSUWGMRR0_GLS0_ISA950_IU1_K1_LDSTI0_LBSPPA512_LBSPPB0_LBSPPM0_LPA4_LPB0_LPM0_LRVWn1_LWPMn1_MIAV0_MIWT4_3_MO40_MGRIPM1_NTn1_NTA0_NTB0_NTC4_NTD0_NTM0_NEPBS12_NLCA1_NLCB3_ONLL1_PGR2_PLR1_PKA1_SGROB0_SIA3_SS1_SU0_SUM0_SUS0_SPO1_SRVW0_SSO1_SVW4_SK3_SKFTR0_SKXCCM4_SGRO0_TDMI0_TIN1_TLDS1_TLDSMn1_ULSGRO0_USL1_UIOFGRO0_UPLRP0_USFGRO1_VSn1_VWA4_VWB1_WSGRA2_WSGRB0_WS64_WG64_4_1_WGM6_WGMXCC1_WGMXCCGn1
    SolutionIndex: 193
    SolutionNameMin: Cijk_Alik_Bjlk_S_B_Bias_HA_S_SAV_UserArgs_MT352x128x32_MI16x16x1_SN_LDSB1_AFC0_AG0_AFEM1_AFEM1_ASEM1_CLR1_CADS0_DTLA0_DTLB0_DTVA0_DTVB0_DTVMXSA0_DTVMXSB0_DTVSM0_DPLB0_EPS0_ELFLR0_EMLLn1_FDSI0_GRPM1_GRVWA4_GRVWB4_GSU0_GSUAMB_GSUC0_GSUWGMRR0_GLS0_ISA950_IU1_K1_LDSTI0_LBSPPA128_LBSPPB0_LBSPPM0_LPA8_LPB0_LPM0_LRVWn1_LWPMn1_MIAV0_MIWT11_4_MO40_MGRIPM1_NTn1_NTA4_NTB0_NTC0_NTD0_NTM0_NEPBS0_NLCA1_NLCB1_ONLL1_PGR2_PLR1_PKA1_SGROB0_SIA3_SS1_SU0_SUM0_SUS0_SPO0_SRVW0_SSO1_SVW1_SK3_SKFTR0_SKXCCM0_SGRO0_TDMI0_TIN0_TLDS1_TLDSMn1_ULSGRO1_USL1_UIOFGRO0_UPLRP0_USFGRO0_VSn1_VWA1_VWB4_WSGRA0_WSGRB2_WS64_WG32_8_1_WGMn4_WGMXCC16_WGMXCCGn1
    SolutionIndex: 194
    SolutionNameMin: Cijk_Alik_Bjlk_S_B_Bias_HA_S_SAV_UserArgs_MT256x256x32_MI16x16x1_SN_LDSB1_AFC0_AG0_AFEM1_AFEM1_ASEM1_CLR1_CADS0_DTLA0_DTLB0_DTVA0_DTVB0_DTVMXSA0_DTVMXSB0_DTVSM0_DPLB0_EPS0_ELFLR0_EMLLn1_FDSI0_GRPM1_GRVWA4_GRVWB4_GSU0_GSUAMB_GSUC0_GSUWGMRR0_GLS0_ISA950_IU1_K1_LDSTI0_LBSPPA512_LBSPPB0_LBSPPM0_LPA8_LPB0_LPM0_LRVWn1_LWPMn1_MIAV0_MIWT4_16_MO40_MGRIPM1_NTn1_NTA0_NTB0_NTC4_NTD4_NTM0_NEPBS14_NLCA1_NLCB1_ONLL1_PGR2_PLR1_PKA1_SGROB0_SIA3_SS1_SU0_SUM0_SUS0_SPO0_SRVW0_SSO1_SVW4_SK3_SKFTR0_SKXCCM8_SGRO0_TDMI0_TIN1_TLDS1_TLDSMn1_ULSGRO0_USL1_UIOFGRO0_UPLRP0_USFGRO1_VSn1_VWA4_VWB4_WSGRA2_WSGRB0_WS64_WG64_4_1_WGMn2_WGMXCC1_WGMXCCGn1
    SolutionIndex: 195
    SolutionNameMin: Cijk_Alik_Bjlk_S_B_Bias_HA_S_SAV_UserArgs_MT256x256x32_MI16x16x1_SN_LDSB0_AFC0_AG0_AFEM1_AFEM1_ASEM1_CLR1_CADS0_DTLA0_DTLB0_DTVA0_DTVB0_DTVMXSA0_DTVMXSB0_DTVSM0_DPLB0_EPS0_ELFLR0_EMLLn1_FDSI0_GRPM1_GRVWA4_GRVWB4_GSU0_GSUAMB_GSUC0_GSUWGMRR0_GLS0_ISA950_IU1_K1_LDSTI0_LBSPPA512_LBSPPB0_LBSPPM0_LPA8_LPB0_LPM0_LRVWn1_LWPMn1_MIAV0_MIWT4_16_MO40_MGRIPM1_NTn1_NTA0_NTB0_NTC4_NTD4_NTM0_NEPBS16_NLCA1_NLCB1_ONLL1_PGR2_PLR1_PKA1_SGROB0_SIA3_SS1_SU0_SUM0_SUS0_SPO0_SRVW0_SSO1_SVW4_SK3_SKFTR0_SKXCCM8_SGRO0_TDMI0_TIN1_TLDS1_TLDSMn1_ULSGRO0_USL1_UIOFGRO0_UPLRP0_USFGRO1_VSn1_VWA4_VWB4_WSGRA0_WSGRB2_WS64_WG64_4_1_WGM32_WGMXCC1_WGMXCCGn1
    SolutionIndex: 196
    SolutionNameMin: Cijk_Alik_Bjlk_S_B_Bias_HA_S_SAV_UserArgs_MT256x192x32_MI16x16x1_SN_LDSB1_AFC0_AG0_AFEM1_AFEM1_ASEM1_CLR1_CADS0_DTLA0_DTLB0_DTVA0_DTVB0_DTVMXSA0_DTVMXSB0_DTVSM0_DPLB0_EPS0_ELFLR0_EMLLn1_FDSI0_GRPM1_GRVWA4_GRVWB4_GSU0_GSUAMB_GSUC0_GSUWGMRR0_GLS0_ISA950_IU1_K1_LDSTI0_LBSPPA512_LBSPPB0_LBSPPM0_LPA8_LPB0_LPM0_LRVWn1_LWPMn1_MIAV0_MIWT4_12_MO40_MGRIPM1_NTn1_NTA0_NTB0_NTC4_NTD4_NTM0_NEPBS0_NLCA1_NLCB3_ONLL1_PGR2_PLR1_PKA1_SGROB0_SIA3_SS1_SU0_SUM0_SUS0_SPO0_SRVW0_SSO1_SVW4_SK3_SKFTR0_SKXCCM8_SGRO0_TDMI0_TIN1_TLDS1_TLDSMn1_ULSGRO0_USL1_UIOFGRO0_UPLRP0_USFGRO1_VSn1_VWA4_VWB4_WSGRA2_WSGRB2_WS64_WG64_4_1_WGM32_WGMXCC16_WGMXCCGn1
    SolutionIndex: 197
    SolutionNameMin: Cijk_Alik_Bjlk_S_B_Bias_HA_S_SAV_UserArgs_MT256x192x32_MI32x32x1_SN_LDSB1_AFC0_AG0_AFEM1_AFEM1_ASEM1_CLR1_CADS0_DTLA0_DTLB0_DTVA0_DTVB0_DTVMXSA0_DTVMXSB0_DTVSM0_DPLB0_EPS0_ELFLR0_EMLLn1_FDSI0_GRPM1_GRVWA4_GRVWB4_GSU0_GSUAMB_GSUC0_GSUWGMRR0_GLS0_ISA950_IU1_K1_LDSTI0_LBSPPA512_LBSPPB0_LBSPPM0_LPA4_LPB0_LPM0_LRVWn1_LWPMn1_MIAV0_MIWT4_3_MO40_MGRIPM1_NTn1_NTA0_NTB0_NTC4_NTD4_NTM0_NEPBS12_NLCA1_NLCB3_ONLL1_PGR2_PLR1_PKA1_SGROB0_SIA3_SS1_SU0_SUM0_SUS0_SPO0_SRVW0_SSO1_SVW4_SK3_SKFTR0_SKXCCM0_SGRO0_TDMI0_TIN1_TLDS1_TLDSMn1_ULSGRO0_USL1_UIOFGRO0_UPLRP0_USFGRO1_VSn1_VWA4_VWB1_WSGRA0_WSGRB0_WS64_WG64_4_1_WGMn1_WGMXCC4_WGMXCCGn1
    SolutionIndex: 198
    SolutionNameMin: Cijk_Alik_Bjlk_S_B_Bias_HA_S_SAV_UserArgs_MT128x448x32_MI16x16x1_SN_LDSB1_AFC0_AG1_AFEM1_AFEM1_ASEM1_CLR1_CADS0_DTLA0_DTLB0_DTVA0_DTVB0_DTVMXSA0_DTVMXSB0_DTVSM0_DPLB0_EPS0_ELFLR0_EMLL0_FDSI0_GRPM1_GRVWA4_GRVWB4_GSU0_GSUAMB_GSUC0_GSUWGMRR0_GLS0_ISA950_IU1_K1_LDSTI0_LBSPPA512_LBSPPB7168_LBSPPM0_LPA8_LPB16_LPM0_LRVWn1_LWPMn1_MIAV0_MIWT8_7_MO40_MGRIPM1_NTn1_NTA0_NTB0_NTC0_NTD0_NTM0_NEPBS0_NLCA1_NLCB7_ONLL1_PGR2_PLR1_PKA1_SGROB0_SIA3_SS1_SU0_SUM0_SUS0_SPO0_SRVW0_SSO1_SVW4_SK3_SKFTR0_SKXCCM0_SGRO0_TDMI0_TIN1_TLDS1_TLDSMn1_ULSGRO0_USL1_UIOFGRO0_UPLRP0_USFGRO1_VSn1_VWA4_VWB1_WSGRA0_WSGRB0_WS64_WG16_16_1_WGM2_WGMXCC4_WGMXCCGn1
    SolutionIndex: 199
    SolutionNameMin: Cijk_Alik_Bjlk_S_B_Bias_HA_S_SAV_UserArgs_MT224x192x32_MI16x16x1_SN_LDSB1_AFC0_AG1_AFEM1_AFEM1_ASEM1_CLR1_CADS0_DTLA0_DTLB0_DTVA0_DTVB0_DTVMXSA0_DTVMXSB0_DTVSM0_DPLB0_EPS0_ELFLR0_EMLLn1_FDSI0_GRPM1_GRVWA4_GRVWB4_GSU0_GSUAMB_GSUC0_GSUWGMRR0_GLS0_ISA950_IU1_K1_LDSTI0_LBSPPA256_LBSPPB3072_LBSPPM0_LPA8_LPB16_LPM0_LRVWn1_LWPMn1_MIAV0_MIWT14_3_MO40_MGRIPM1_NTn1_NTA0_NTB0_NTC4_NTD4_NTM0_NEPBS0_NLCA1_NLCB3_ONLL1_PGR2_PLR1_PKA1_SGROB0_SIA3_SS1_SU0_SUM0_SUS0_SPO1_SRVW0_SSO0_SVW2_SK3_SKFTR0_SKXCCM8_SGRO0_TDMI0_TIN1_TLDS1_TLDSMn1_ULSGRO0_USL1_UIOFGRO0_UPLRP0_USFGRO1_VSn1_VWA2_VWB1_WSGRA0_WSGRB2_WS64_WG16_16_1_WGM8_WGMXCC4_WGMXCCGn1
    SolutionIndex: 200
    SolutionNameMin: Cijk_Alik_Bjlk_S_B_Bias_HA_S_SAV_UserArgs_MT192x208x32_MI16x16x1_SN_LDSB1_AFC0_AG1_AFEM1_AFEM1_ASEM1_CLR1_CADS0_DTLA0_DTLB0_DTVA0_DTVB0_DTVMXSA0_DTVMXSB0_DTVSM0_DPLB0_EPS0_ELFLR0_EMLL0_FDSI0_GRPM1_GRVWA4_GRVWB2_GSU0_GSUAMB_GSUC0_GSUWGMRR0_GLS0_ISA950_IU1_K1_LDSTI0_LBSPPA128_LBSPPB3328_LBSPPM0_LPA8_LPB16_LPM0_LRVWn1_LWPMn1_MIAV0_MIWT3_13_MO40_MGRIPM1_NTn1_NTA0_NTB0_NTC0_NTD0_NTM0_NEPBS0_NLCA1_NLCB13_ONLL1_PGR2_PLR1_PKA1_SGROB0_SIA3_SS1_SU0_SUM0_SUS0_SPO1_SRVW0_SSO1_SVW1_SK3_SKFTR0_SKXCCM8_SGRO0_TDMI0_TIN1_TLDS1_TLDSMn1_ULSGRO0_USL1_UIOFGRO0_UPLRP0_USFGRO1_VSn1_VWA1_VWB1_WSGRA2_WSGRB2_WS64_WG64_4_1_WGM4_WGMXCC1_WGMXCCGn1
    SolutionIndex: 201
    SolutionNameMin: Cijk_Alik_Bjlk_S_B_Bias_HA_S_SAV_UserArgs_MT128x416x32_MI16x16x1_SN_LDSB1_AFC0_AG1_AFEM1_AFEM1_ASEM1_CLR1_CADS0_DTLA0_DTLB0_DTVA0_DTVB0_DTVMXSA0_DTVMXSB0_DTVSM0_DPLB0_EPS0_ELFLR0_EMLL0_FDSI0_GRPM1_GRVWA4_GRVWB4_GSU0_GSUAMB_GSUC0_GSUWGMRR0_GLS0_ISA950_IU1_K1_LDSTI0_LBSPPA512_LBSPPB6656_LBSPPM0_LPA8_LPB16_LPM0_LRVWn1_LWPMn1_MIAV0_MIWT4_13_MO40_MGRIPM1_NTn1_NTA0_NTB0_NTC4_NTD0_NTM0_NEPBS14_NLCA1_NLCB13_ONLL1_PGR2_PLR1_PKA1_SGROB0_SIA3_SS1_SU0_SUM0_SUS0_SPO1_SRVW0_SSO1_SVW4_SK3_SKFTR0_SKXCCM0_SGRO0_TDMI0_TIN1_TLDS1_TLDSMn1_ULSGRO0_USL1_UIOFGRO0_UPLRP0_USFGRO1_VSn1_VWA4_VWB1_WSGRA0_WSGRB2_WS64_WG32_8_1_WGM32_WGMXCC1_WGMXCCGn1
    SolutionIndex: 202
    SolutionNameMin: Cijk_Alik_Bjlk_S_B_Bias_HA_S_SAV_UserArgs_MT64x512x32_MI16x16x1_SN_LDSB1_AFC0_AG0_AFEM1_AFEM1_ASEM1_CLR0_CADS0_DTLA0_DTLB0_DTVA0_DTVB0_DTVMXSA0_DTVMXSB0_DTVSM0_DPLB0_EPS0_ELFLR0_EMLL0_FDSI0_GRPM1_GRVWA4_GRVWB4_GSU0_GSUAMB_GSUC0_GSUWGMRR0_GLS0_ISA950_IU1_K1_LDSTI1_LBSPPA0_LBSPPB0_LBSPPM0_LPA0_LPB0_LPM0_LRVWn1_LWPMn1_MIAV0_MIWT4_8_MO40_MGRIPM1_NTn1_NTA0_NTB0_NTC0_NTD0_NTM0_NEPBS0_NLCA1_NLCB2_ONLL1_PGR2_PLR1_PKA1_SGROB0_SIA3_SS1_SU0_SUM0_SUS0_SPO0_SRVW0_SSO1_SVW4_SK3_SKFTR0_SKXCCM4_SGRO0_TDMI0_TIN0_TLDS0_TLDSMn1_ULSGRO1_USL1_UIOFGRO0_UPLRP0_USFGRO0_VSn1_VWA4_VWB4_WSGRA0_WSGRB2_WS64_WG16_16_1_WGMn1_WGMXCC2_WGMXCCGn1
    SolutionIndex: 203
    SolutionNameMin: Cijk_Alik_Bjlk_S_B_Bias_HA_S_SAV_UserArgs_MT112x384x32_MI16x16x1_SN_LDSB1_AFC0_AG1_AFEM1_AFEM1_ASEM1_CLR1_CADS0_DTLA0_DTLB0_DTVA0_DTVB0_DTVMXSA0_DTVMXSB0_DTVSM0_DPLB0_EPS0_ELFLR0_EMLLn1_FDSI0_GRPM1_GRVWA2_GRVWB4_GSU0_GSUAMB_GSUC0_GSUWGMRR0_GLS0_ISA950_IU1_K1_LDSTI0_LBSPPA128_LBSPPB0_LBSPPM0_LPA8_LPB0_LPM0_LRVWn1_LWPMn1_MIAV0_MIWT7_6_MO40_MGRIPM1_NTn1_NTA0_NTB4_NTC0_NTD0_NTM0_NEPBS0_NLCA1_NLCB3_ONLL1_PGR2_PLR1_PKA1_SGROB0_SIA3_SS0_SU16_SUM0_SUS256_SPO0_SRVW0_SSO4_SVW4_SK3_SKFTR0_SKXCCM4_SGRO0_TDMI0_TIN0_TLDS1_TLDSMn1_ULSGRO0_USL1_UIOFGRO0_UPLRP0_USFGRO1_VSn1_VWA1_VWB2_WSGRA0_WSGRB2_WS64_WG16_16_1_WGMn4_WGMXCC1_WGMXCCGn1
    SolutionIndex: 204
    SolutionNameMin: Cijk_Alik_Bjlk_S_B_Bias_HA_S_SAV_UserArgs_MT256x160x32_MI16x16x1_SN_LDSB1_AFC0_AG0_AFEM1_AFEM1_ASEM1_CLR0_CADS0_DTLA0_DTLB0_DTVA0_DTVB0_DTVMXSA0_DTVMXSB0_DTVSM0_DPLB0_EPS0_ELFLR0_EMLLn1_FDSI0_GRPM1_GRVWA4_GRVWB4_GSU0_GSUAMB_GSUC0_GSUWGMRR0_GLS0_ISA950_IU1_K1_LDSTI1_LBSPPA0_LBSPPB640_LBSPPM0_LPA0_LPB16_LPM0_LRVWn1_LWPMn1_MIAV0_MIWT8_5_MO40_MGRIPM1_NTn1_NTA0_NTB0_NTC4_NTD4_NTM0_NEPBS16_NLCA1_NLCB5_ONLL1_PGR2_PLR1_PKA1_SGROB0_SIA3_SS1_SU16_SUM0_SUS128_SPO0_SRVW0_SSO1_SVW4_SK3_SKFTR0_SKXCCM4_SGRO0_TDMI0_TIN0_TLDS0_TLDSMn1_ULSGRO0_USL1_UIOFGRO0_UPLRP0_USFGRO1_VSn1_VWA4_VWB1_WSGRA0_WSGRB0_WS64_WG32_8_1_WGM4_WGMXCC2_WGMXCCGn1
    SolutionIndex: 205
    SolutionNameMin: Cijk_Alik_Bjlk_S_B_Bias_HA_S_SAV_UserArgs_MT384x128x32_MI16x16x1_SN_LDSB1_AFC0_AG1_AFEM1_AFEM1_ASEM1_CLR1_CADS0_DTLA0_DTLB0_DTVA0_DTVB0_DTVMXSA0_DTVMXSB0_DTVSM0_DPLB0_EPS0_ELFLR0_EMLL0_FDSI0_GRPM1_GRVWA4_GRVWB4_GSU0_GSUAMB_GSUC0_GSUWGMRR0_GLS0_ISA950_IU1_K1_LDSTI0_LBSPPA512_LBSPPB0_LBSPPM0_LPA8_LPB0_LPM0_LRVWn1_LWPMn1_MIAV0_MIWT12_4_MO40_MGRIPM1_NTn1_NTA0_NTB0_NTC0_NTD0_NTM0_NEPBS12_NLCA1_NLCB1_ONLL1_PGR2_PLR1_PKA1_SGROB0_SIA3_SS1_SU0_SUM0_SUS0_SPO1_SRVW0_SSO1_SVW4_SK3_SKFTR0_SKXCCM4_SGRO0_TDMI0_TIN1_TLDS1_TLDSMn1_ULSGRO1_USL1_UIOFGRO0_UPLRP0_USFGRO0_VSn1_VWA4_VWB4_WSGRA0_WSGRB0_WS64_WG32_8_1_WGM6_WGMXCC2_WGMXCCGn1
    SolutionIndex: 206
    SolutionNameMin: Cijk_Alik_Bjlk_S_B_Bias_HA_S_SAV_UserArgs_MT128x512x32_MI16x16x1_SN_LDSB1_AFC0_AG0_AFEM1_AFEM1_ASEM1_CLR1_CADS0_DTLA0_DTLB0_DTVA0_DTVB0_DTVMXSA0_DTVMXSB0_DTVSM0_DPLB0_EPS0_ELFLR0_EMLL0_FDSI0_GRPM1_GRVWA4_GRVWB4_GSU0_GSUAMB_GSUC0_GSUWGMRR0_GLS0_ISA950_IU1_K1_LDSTI0_LBSPPA512_LBSPPB0_LBSPPM0_LPA8_LPB0_LPM0_LRVWn1_LWPMn1_MIAV0_MIWT8_8_MO40_MGRIPM1_NTn1_NTA0_NTB0_NTC4_NTD4_NTM0_NEPBS16_NLCA1_NLCB1_ONLL1_PGR2_PLR1_PKA1_SGROB0_SIA3_SS1_SU0_SUM0_SUS0_SPO0_SRVW0_SSO1_SVW4_SK3_SKFTR0_SKXCCM4_SGRO0_TDMI0_TIN1_TLDS1_TLDSMn1_ULSGRO1_USL1_UIOFGRO0_UPLRP0_USFGRO0_VSn1_VWA4_VWB4_WSGRA0_WSGRB0_WS64_WG16_16_1_WGMn8_WGMXCC4_WGMXCCGn1
    SolutionIndex: 207
    SolutionNameMin: Cijk_Alik_Bjlk_S_B_Bias_HA_S_SAV_UserArgs_MT256x128x32_MI16x16x1_SN_LDSB1_AFC0_AG0_AFEM1_AFEM1_ASEM1_CLR0_CADS0_DTLA0_DTLB0_DTVA0_DTVB0_DTVMXSA0_DTVMXSB0_DTVSM0_DPLB0_EPS0_ELFLR0_EMLL0_FDSI0_GRPM1_GRVWA4_GRVWB4_GSU0_GSUAMB_GSUC0_GSUWGMRR0_GLS0_ISA950_IU1_K1_LDSTI1_LBSPPA0_LBSPPB0_LBSPPM0_LPA0_LPB0_LPM0_LRVWn1_LWPMn1_MIAV0_MIWT4_8_MO40_MGRIPM1_NTn1_NTA0_NTB0_NTC0_NTD0_NTM0_NEPBS0_NLCA1_NLCB1_ONLL1_PGR2_PLR1_PKA1_SGROB0_SIA3_SS1_SU16_SUM0_SUS512_SPO0_SRVW0_SSO4_SVW4_SK3_SKFTR0_SKXCCM8_SGRO0_TDMI0_TIN0_TLDS0_TLDSMn1_ULSGRO0_USL1_UIOFGRO0_UPLRP0_USFGRO1_VSn1_VWA4_VWB4_WSGRA0_WSGRB0_WS64_WG64_4_1_WGM8_WGMXCC1_WGMXCCGn1
    SolutionIndex: 208
    SolutionNameMin: Cijk_Alik_Bjlk_S_B_Bias_HA_S_SAV_UserArgs_MT448x128x32_MI16x16x1_SN_LDSB0_AFC0_AG1_AFEM1_AFEM1_ASEM1_CLR1_CADS0_DTLA0_DTLB0_DTVA0_DTVB0_DTVMXSA0_DTVMXSB0_DTVSM0_DPLB0_EPS0_ELFLR0_EMLL0_FDSI0_GRPM1_GRVWA4_GRVWB4_GSU0_GSUAMB_GSUC0_GSUWGMRR0_GLS0_ISA950_IU1_K1_LDSTI0_LBSPPA256_LBSPPB0_LBSPPM0_LPA8_LPB0_LPM0_LRVWn1_LWPMn1_MIAV0_MIWT14_4_MO40_MGRIPM1_NTn1_NTA0_NTB0_NTC4_NTD4_NTM0_NEPBS0_NLCA1_NLCB1_ONLL1_PGR2_PLR1_PKA1_SGROB0_SIA3_SS1_SU0_SUM0_SUS0_SPO0_SRVW0_SSO1_SVW2_SK3_SKFTR0_SKXCCM0_SGRO0_TDMI0_TIN1_TLDS1_TLDSMn1_ULSGRO0_USL1_UIOFGRO0_UPLRP0_USFGRO0_VSn1_VWA2_VWB4_WSGRA0_WSGRB2_WS64_WG32_8_1_WGM4_WGMXCC4_WGMXCCGn1
    SolutionIndex: 209
    SolutionNameMin: Cijk_Alik_Bjlk_S_B_Bias_HA_S_SAV_UserArgs_MT320x96x32_MI16x16x1_SN_LDSB1_AFC0_AG1_AFEM1_AFEM1_ASEM1_CLR0_CADS0_DTLA0_DTLB0_DTVA0_DTVB0_DTVMXSA0_DTVMXSB0_DTVSM0_DPLB0_EPS0_ELFLR0_EMLLn1_FDSI0_GRPM1_GRVWA4_GRVWB4_GSU0_GSUAMB_GSUC0_GSUWGMRR0_GLS0_ISA950_IU1_K1_LDSTI1_LBSPPA0_LBSPPB384_LBSPPM0_LPA0_LPB16_LPM0_LRVWn1_LWPMn1_MIAV0_MIWT10_3_MO40_MGRIPM1_NTn1_NTA0_NTB0_NTC4_NTD4_NTM0_NEPBS12_NLCA1_NLCB3_ONLL1_PGR2_PLR1_PKA1_SGROB0_SIA3_SS1_SU0_SUM0_SUS0_SPO1_SRVW0_SSO1_SVW2_SK3_SKFTR0_SKXCCM0_SGRO0_TDMI0_TIN1_TLDS0_TLDSMn1_ULSGRO0_USL1_UIOFGRO0_UPLRP0_USFGRO0_VSn1_VWA2_VWB1_WSGRA0_WSGRB0_WS64_WG32_8_1_WGM4_WGMXCC1_WGMXCCGn1
    SolutionIndex: 210
    SolutionNameMin: Cijk_Alik_Bjlk_S_B_Bias_HA_S_SAV_UserArgs_MT160x224x32_MI16x16x1_SN_LDSB0_AFC0_AG0_AFEM1_AFEM1_ASEM1_CLR1_CADS0_DTLA0_DTLB0_DTVA0_DTVB0_DTVMXSA0_DTVMXSB0_DTVSM0_DPLB0_EPS0_ELFLR0_EMLL0_FDSI0_GRPM1_GRVWA4_GRVWB4_GSU0_GSUAMB_GSUC0_GSUWGMRR0_GLS0_ISA950_IU1_K1_LDSTI0_LBSPPA128_LBSPPB3584_LBSPPM0_LPA8_LPB16_LPM0_LRVWn1_LWPMn1_MIAV0_MIWT5_7_MO40_MGRIPM1_NTn1_NTA0_NTB0_NTC0_NTD0_NTM0_NEPBS0_NLCA1_NLCB7_ONLL1_PGR2_PLR1_PKA1_SGROB0_SIA3_SS1_SU8_SUM0_SUS256_SPO0_SRVW0_SSO0_SVW1_SK3_SKFTR0_SKXCCM0_SGRO0_TDMI0_TIN0_TLDS1_TLDSMn1_ULSGRO0_USL1_UIOFGRO0_UPLRP0_USFGRO1_VSn1_VWA1_VWB1_WSGRA2_WSGRB2_WS64_WG32_8_1_WGM2_WGMXCC16_WGMXCCGn1
    SolutionIndex: 211
    SolutionNameMin: Cijk_Alik_Bjlk_S_B_Bias_HA_S_SAV_UserArgs_MT320x128x32_MI16x16x1_SN_LDSB1_AFC0_AG1_AFEM1_AFEM1_ASEM1_CLR1_CADS0_DTLA0_DTLB0_DTVA0_DTVB0_DTVMXSA0_DTVMXSB0_DTVSM0_DPLB0_EPS0_ELFLR0_EMLL0_FDSI0_GRPM1_GRVWA4_GRVWB4_GSU0_GSUAMB_GSUC0_GSUWGMRR0_GLS0_ISA950_IU1_K1_LDSTI0_LBSPPA512_LBSPPB0_LBSPPM0_LPA8_LPB0_LPM0_LRVWn1_LWPMn1_MIAV0_MIWT20_2_MO40_MGRIPM1_NTn1_NTA0_NTB0_NTC4_NTD4_NTM0_NEPBS14_NLCA1_NLCB1_ONLL1_PGR2_PLR1_PKA1_SGROB0_SIA3_SS1_SU0_SUM0_SUS0_SPO0_SRVW0_SSO1_SVW4_SK3_SKFTR0_SKXCCM0_SGRO0_TDMI0_TIN1_TLDS1_TLDSMn1_ULSGRO1_USL1_UIOFGRO0_UPLRP0_USFGRO0_VSn1_VWA4_VWB2_WSGRA0_WSGRB0_WS64_WG16_16_1_WGMn2_WGMXCC1_WGMXCCGn1
    SolutionIndex: 212
    SolutionNameMin: Cijk_Alik_Bjlk_S_B_Bias_HA_S_SAV_UserArgs_MT352x128x32_MI16x16x1_SN_LDSB1_AFC0_AG1_AFEM1_AFEM1_ASEM1_CLR1_CADS0_DTLA0_DTLB0_DTVA0_DTVB0_DTVMXSA0_DTVMXSB0_DTVSM0_DPLB0_EPS0_ELFLR0_EMLLn1_FDSI0_GRPM1_GRVWA4_GRVWB4_GSU0_GSUAMB_GSUC0_GSUWGMRR0_GLS0_ISA950_IU1_K1_LDSTI0_LBSPPA128_LBSPPB0_LBSPPM0_LPA8_LPB0_LPM0_LRVWn1_LWPMn1_MIAV0_MIWT11_4_MO40_MGRIPM1_NTn1_NTA4_NTB0_NTC0_NTD0_NTM0_NEPBS16_NLCA1_NLCB1_ONLL1_PGR2_PLR1_PKA1_SGROB0_SIA3_SS1_SU0_SUM0_SUS0_SPO0_SRVW0_SSO1_SVW1_SK3_SKFTR0_SKXCCM0_SGRO0_TDMI0_TIN1_TLDS1_TLDSMn1_ULSGRO1_USL1_UIOFGRO0_UPLRP0_USFGRO1_VSn1_VWA1_VWB4_WSGRA2_WSGRB0_WS64_WG32_8_1_WGM32_WGMXCC2_WGMXCCGn1
    SolutionIndex: 213
    SolutionNameMin: Cijk_Alik_Bjlk_S_B_Bias_HA_S_SAV_UserArgs_MT288x224x32_MI16x16x1_SN_LDSB1_AFC0_AG0_AFEM1_AFEM1_ASEM1_CLR1_CADS0_DTLA0_DTLB0_DTVA0_DTVB0_DTVMXSA0_DTVMXSB0_DTVSM0_DPLB0_EPS0_ELFLR0_EMLL0_FDSI0_GRPM1_GRVWA4_GRVWB4_GSU0_GSUAMB_GSUC0_GSUWGMRR0_GLS0_ISA950_IU1_K1_LDSTI0_LBSPPA128_LBSPPB3584_LBSPPM0_LPA8_LPB16_LPM0_LRVWn1_LWPMn1_MIAV0_MIWT9_7_MO40_MGRIPM1_NTn1_NTA0_NTB0_NTC0_NTD0_NTM0_NEPBS8_NLCA1_NLCB7_ONLL1_PGR2_PLR1_PKA1_SGROB0_SIA3_SS0_SU0_SUM0_SUS0_SPO1_SRVW0_SSO1_SVW4_SK3_SKFTR0_SKXCCM4_SGRO0_TDMI0_TIN1_TLDS1_TLDSMn1_ULSGRO0_USL1_UIOFGRO0_UPLRP0_USFGRO0_VSn1_VWA1_VWB1_WSGRA0_WSGRB2_WS64_WG32_8_1_WGMn24_WGMXCC16_WGMXCCGn1
    SolutionIndex: 214
    SolutionNameMin: Cijk_Alik_Bjlk_S_B_Bias_HA_S_SAV_UserArgs_MT160x192x32_MI16x16x1_SN_LDSB1_AFC0_AG1_AFEM1_AFEM1_ASEM1_CLR0_CADS0_DTLA0_DTLB0_DTVA0_DTVB0_DTVMXSA0_DTVMXSB0_DTVSM0_DPLB0_EPS0_ELFLR0_EMLLn1_FDSI0_GRPM1_GRVWA4_GRVWB4_GSU0_GSUAMB_GSUC0_GSUWGMRR0_GLS0_ISA950_IU1_K1_LDSTI1_LBSPPA0_LBSPPB768_LBSPPM0_LPA0_LPB16_LPM0_LRVWn1_LWPMn1_MIAV0_MIWT10_3_MO40_MGRIPM1_NTn1_NTA0_NTB0_NTC4_NTD4_NTM0_NEPBS0_NLCA1_NLCB3_ONLL1_PGR2_PLR1_PKA1_SGROB0_SIA3_SS1_SU0_SUM0_SUS0_SPO0_SRVW0_SSO1_SVW2_SK3_SKFTR0_SKXCCM0_SGRO0_TDMI0_TIN1_TLDS0_TLDSMn1_ULSGRO0_USL1_UIOFGRO0_UPLRP0_USFGRO0_VSn1_VWA2_VWB1_WSGRA0_WSGRB0_WS64_WG16_16_1_WGMn2_WGMXCC1_WGMXCCGn1
    SolutionIndex: 215
    SolutionNameMin: Cijk_Alik_Bjlk_S_B_Bias_HA_S_SAV_UserArgs_MT96x320x32_MI16x16x1_SN_LDSB1_AFC0_AG1_AFEM1_AFEM1_ASEM1_CLR0_CADS0_DTLA0_DTLB0_DTVA0_DTVB0_DTVMXSA0_DTVMXSB0_DTVSM0_DPLB0_EPS0_ELFLR0_EMLLn1_FDSI0_GRPM1_GRVWA4_GRVWB4_GSU0_GSUAMB_GSUC0_GSUWGMRR0_GLS0_ISA950_IU1_K1_LDSTI1_LBSPPA0_LBSPPB1280_LBSPPM0_LPA0_LPB16_LPM0_LRVWn1_LWPMn1_MIAV0_MIWT6_5_MO40_MGRIPM1_NTn1_NTA0_NTB0_NTC4_NTD4_NTM0_NEPBS0_NLCA1_NLCB5_ONLL1_PGR2_PLR1_PKA1_SGROB0_SIA3_SS1_SU0_SUM0_SUS0_SPO0_SRVW0_SSO1_SVW2_SK3_SKFTR0_SKXCCM4_SGRO0_TDMI0_TIN1_TLDS0_TLDSMn1_ULSGRO1_USL1_UIOFGRO0_UPLRP0_USFGRO0_VSn1_VWA2_VWB1_WSGRA2_WSGRB0_WS64_WG16_16_1_WGMn1_WGMXCC1_WGMXCCGn1
    SolutionIndex: 216
    SolutionNameMin: Cijk_Alik_Bjlk_S_B_Bias_HA_S_SAV_UserArgs_MT128x416x32_MI16x16x1_SN_LDSB1_AFC0_AG1_AFEM1_AFEM1_ASEM1_CLR1_CADS0_DTLA0_DTLB0_DTVA0_DTVB0_DTVMXSA0_DTVMXSB0_DTVSM0_DPLB0_EPS1_ELFLR0_EMLLn1_FDSI0_GRPM1_GRVWA1_GRVWB4_GSU0_GSUAMB_GSUC0_GSUWGMRR0_GLS0_ISA950_IU1_K1_LDSTI0_LBSPPA512_LBSPPB6656_LBSPPM0_LPA8_LPB16_LPM0_LRVWn1_LWPMn1_MIAV0_MIWT4_13_MO40_MGRIPM1_NTn1_NTA0_NTB0_NTC4_NTD4_NTM0_NEPBS16_NLCA1_NLCB13_ONLL1_PGR1_PLR1_PKA1_SGROB0_SIA3_SS1_SU0_SUM0_SUS0_SPO1_SRVW0_SSO1_SVW4_SK3_SKFTR0_SKXCCM4_SGRO0_TDMI0_TIN1_TLDS1_TLDSMn1_ULSGRO0_USL1_UIOFGRO0_UPLRP0_USFGRO0_VSn1_VWA4_VWB1_WSGRA0_WSGRB0_WS64_WG32_8_1_WGM2_WGMXCC1_WGMXCCGn1
    SolutionIndex: 217
    SolutionNameMin: Cijk_Alik_Bjlk_S_B_Bias_HA_S_SAV_UserArgs_MT320x128x32_MI16x16x1_SN_LDSB1_AFC0_AG0_AFEM1_AFEM1_ASEM1_CLR1_CADS0_DTLA0_DTLB0_DTVA0_DTVB0_DTVMXSA0_DTVMXSB0_DTVSM0_DPLB0_EPS0_ELFLR0_EMLL0_FDSI0_GRPM1_GRVWA4_GRVWB4_GSU0_GSUAMB_GSUC0_GSUWGMRR0_GLS0_ISA950_IU1_K1_LDSTI0_LBSPPA512_LBSPPB0_LBSPPM0_LPA8_LPB0_LPM0_LRVWn1_LWPMn1_MIAV0_MIWT20_2_MO40_MGRIPM1_NTn1_NTA0_NTB0_NTC4_NTD4_NTM0_NEPBS14_NLCA1_NLCB1_ONLL1_PGR2_PLR1_PKA1_SGROB0_SIA3_SS1_SU0_SUM0_SUS0_SPO0_SRVW0_SSO1_SVW4_SK3_SKFTR0_SKXCCM0_SGRO0_TDMI0_TIN1_TLDS1_TLDSMn1_ULSGRO0_USL1_UIOFGRO0_UPLRP0_USFGRO0_VSn1_VWA4_VWB2_WSGRA0_WSGRB0_WS64_WG16_16_1_WGMn2_WGMXCC4_WGMXCCGn1
    SolutionIndex: 218
    SolutionNameMin: Cijk_Alik_Bjlk_S_B_Bias_HA_S_SAV_UserArgs_MT256x160x32_MI16x16x1_SN_LDSB1_AFC0_AG1_AFEM1_AFEM1_ASEM1_CLR1_CADS0_DTLA0_DTLB0_DTVA0_DTVB0_DTVMXSA0_DTVMXSB0_DTVSM0_DPLB0_EPS0_ELFLR0_EMLLn1_FDSI0_GRPM1_GRVWA4_GRVWB4_GSU0_GSUAMB_GSUC0_GSUWGMRR0_GLS0_ISA950_IU1_K1_LDSTI0_LBSPPA512_LBSPPB0_LBSPPM0_LPA8_LPB0_LPM0_LRVWn1_LWPMn1_MIAV0_MIWT4_10_MO40_MGRIPM1_NTn1_NTA0_NTB0_NTC0_NTD0_NTM0_NEPBS0_NLCA1_NLCB5_ONLL1_PGR2_PLR1_PKA1_SGROB0_SIA3_SS1_SU0_SUM0_SUS0_SPO0_SRVW0_SSO1_SVW4_SK3_SKFTR0_SKXCCM0_SGRO0_TDMI0_TIN1_TLDS1_TLDSMn1_ULSGRO0_USL1_UIOFGRO0_UPLRP0_USFGRO1_VSn1_VWA4_VWB2_WSGRA0_WSGRB0_WS64_WG64_4_1_WGM8_WGMXCC1_WGMXCCGn1
    SolutionIndex: 219
    SolutionNameMin: Cijk_Alik_Bjlk_S_B_Bias_HA_S_SAV_UserArgs_MT384x160x32_MI16x16x1_SN_LDSB1_AFC0_AG1_AFEM1_AFEM1_ASEM1_CLR1_CADS0_DTLA0_DTLB0_DTVA0_DTVB0_DTVMXSA0_DTVMXSB0_DTVSM0_DPLB0_EPS0_ELFLR0_EMLL0_FDSI0_GRPM1_GRVWA2_GRVWB4_GSU0_GSUAMB_GSUC0_GSUWGMRR0_GLS0_ISA950_IU1_K1_LDSTI0_LBSPPA512_LBSPPB2560_LBSPPM0_LPA8_LPB16_LPM0_LRVWn1_LWPMn1_MIAV0_MIWT12_5_MO40_MGRIPM1_NTn1_NTA0_NTB0_NTC4_NTD4_NTM0_NEPBS0_NLCA1_NLCB5_ONLL1_PGR2_PLR1_PKA1_SGROB0_SIA3_SS1_SU0_SUM0_SUS0_SPO0_SRVW0_SSO1_SVW4_SK3_SKFTR0_SKXCCM0_SGRO0_TDMI0_TIN1_TLDS1_TLDSMn1_ULSGRO0_USL1_UIOFGRO0_UPLRP0_USFGRO1_VSn1_VWA4_VWB1_WSGRA0_WSGRB2_WS64_WG32_8_1_WGMn1_WGMXCC32_WGMXCCGn1
    SolutionIndex: 220
    SolutionNameMin: Cijk_Alik_Bjlk_S_B_Bias_HA_S_SAV_UserArgs_MT160x256x32_MI32x32x1_SN_LDSB1_AFC0_AG0_AFEM1_AFEM1_ASEM1_CLR0_CADS0_DTLA0_DTLB0_DTVA0_DTVB0_DTVMXSA0_DTVMXSB0_DTVSM0_DPLB0_EPS0_ELFLR0_EMLL0_FDSI0_GRPM1_GRVWA4_GRVWB4_GSU0_GSUAMB_GSUC0_GSUWGMRR0_GLS0_ISA950_IU1_K1_LDSTI1_LBSPPA0_LBSPPB0_LBSPPM0_LPA0_LPB0_LPM0_LRVWn1_LWPMn1_MIAV0_MIWT5_2_MO40_MGRIPM1_NTn1_NTA0_NTB0_NTC0_NTD0_NTM0_NEPBS10_NLCA1_NLCB1_ONLL1_PGR2_PLR1_PKA1_SGROB0_SIA3_SS1_SU8_SUM0_SUS256_SPO1_SRVW0_SSO0_SVW1_SK3_SKFTR0_SKXCCM4_SGRO0_TDMI0_TIN0_TLDS0_TLDSMn1_ULSGRO1_USL1_UIOFGRO0_UPLRP0_USFGRO1_VSn1_VWA1_VWB2_WSGRA0_WSGRB0_WS64_WG32_8_1_WGMn1_WGMXCC2_WGMXCCGn1
    SolutionIndex: 221
    SolutionNameMin: Cijk_Alik_Bjlk_S_B_Bias_HA_S_SAV_UserArgs_MT128x416x32_MI16x16x1_SN_LDSB1_AFC0_AG0_AFEM1_AFEM1_ASEM1_CLR1_CADS0_DTLA0_DTLB0_DTVA0_DTVB0_DTVMXSA0_DTVMXSB0_DTVSM0_DPLB0_EPS0_ELFLR0_EMLLn1_FDSI0_GRPM1_GRVWA4_GRVWB4_GSU0_GSUAMB_GSUC0_GSUWGMRR0_GLS0_ISA950_IU1_K1_LDSTI0_LBSPPA512_LBSPPB6656_LBSPPM0_LPA8_LPB16_LPM0_LRVWn1_LWPMn1_MIAV0_MIWT4_13_MO40_MGRIPM1_NTn1_NTA0_NTB0_NTC4_NTD4_NTM0_NEPBS0_NLCA1_NLCB13_ONLL1_PGR2_PLR1_PKA1_SGROB0_SIA3_SS1_SU0_SUM0_SUS0_SPO0_SRVW0_SSO1_SVW4_SK3_SKFTR0_SKXCCM0_SGRO0_TDMI0_TIN1_TLDS1_TLDSMn1_ULSGRO0_USL1_UIOFGRO0_UPLRP0_USFGRO1_VSn1_VWA4_VWB1_WSGRA0_WSGRB0_WS64_WG32_8_1_WGM2_WGMXCC16_WGMXCCGn1
    SolutionIndex: 222
    SolutionNameMin: Cijk_Alik_Bjlk_S_B_Bias_HA_S_SAV_UserArgs_MT512x112x32_MI16x16x1_SN_LDSB1_AFC0_AG1_AFEM1_AFEM1_ASEM1_CLR1_CADS0_DTLA0_DTLB0_DTVA0_DTVB0_DTVMXSA0_DTVMXSB0_DTVSM0_DPLB0_EPS0_ELFLR0_EMLL0_FDSI0_GRPM1_GRVWA2_GRVWB2_GSU0_GSUAMB_GSUC0_GSUWGMRR0_GLS0_ISA950_IU1_K1_LDSTI0_LBSPPA512_LBSPPB1792_LBSPPM0_LPA8_LPB16_LPM0_LRVWn1_LWPMn1_MIAV0_MIWT8_7_MO40_MGRIPM1_NTn1_NTA4_NTB0_NTC0_NTD0_NTM0_NEPBS16_NLCA1_NLCB7_ONLL1_PGR2_PLR1_PKA1_SGROB0_SIA3_SS1_SU0_SUM0_SUS0_SPO0_SRVW0_SSO0_SVW4_SK3_SKFTR0_SKXCCM8_SGRO0_TDMI0_TIN1_TLDS1_TLDSMn1_ULSGRO1_USL1_UIOFGRO0_UPLRP0_USFGRO0_VSn1_VWA4_VWB1_WSGRA0_WSGRB0_WS64_WG64_4_1_WGMn2_WGMXCC2_WGMXCCGn1
    SolutionIndex: 223
    SolutionNameMin: Cijk_Alik_Bjlk_S_B_Bias_HA_S_SAV_UserArgs_MT224x128x32_MI16x16x1_SN_LDSB1_AFC0_AG1_AFEM1_AFEM1_ASEM1_CLR0_CADS0_DTLA0_DTLB0_DTVA0_DTVB0_DTVMXSA0_DTVMXSB0_DTVSM0_DPLB0_EPS0_ELFLR0_EMLLn1_FDSI0_GRPM1_GRVWA4_GRVWB4_GSU0_GSUAMB_GSUC0_GSUWGMRR0_GLS0_ISA950_IU1_K1_LDSTI1_LBSPPA0_LBSPPB0_LBSPPM0_LPA0_LPB0_LPM0_LRVWn1_LWPMn1_MIAV0_MIWT14_2_MO40_MGRIPM1_NTn1_NTA4_NTB0_NTC4_NTD4_NTM0_NEPBS14_NLCA1_NLCB1_ONLL1_PGR2_PLR1_PKA1_SGROB0_SIA3_SS1_SU0_SUM0_SUS0_SPO0_SRVW0_SSO0_SVW2_SK3_SKFTR0_SKXCCM0_SGRO0_TDMI0_TIN0_TLDS0_TLDSMn1_ULSGRO1_USL1_UIOFGRO0_UPLRP0_USFGRO0_VSn1_VWA2_VWB2_WSGRA0_WSGRB0_WS64_WG16_16_1_WGM0_WGMXCC4_WGMXCCGn1
    SolutionIndex: 224
    SolutionNameMin: Cijk_Alik_Bjlk_S_B_Bias_HA_S_SAV_UserArgs_MT256x224x32_MI16x16x1_SN_LDSB1_AFC0_AG1_AFEM1_AFEM1_ASEM1_CLR1_CADS0_DTLA0_DTLB0_DTVA0_DTVB0_DTVMXSA0_DTVMXSB0_DTVSM0_DPLB0_EPS1_ELFLR0_EMLL0_FDSI0_GRPM1_GRVWA4_GRVWB4_GSU0_GSUAMB_GSUC0_GSUWGMRR0_GLS0_ISA950_IU1_K1_LDSTI0_LBSPPA512_LBSPPB0_LBSPPM0_LPA8_LPB0_LPM0_LRVWn1_LWPMn1_MIAV0_MIWT4_14_MO40_MGRIPM1_NTn1_NTA0_NTB0_NTC4_NTD4_NTM0_NEPBS14_NLCA1_NLCB7_ONLL1_PGR1_PLR1_PKA1_SGROB0_SIA3_SS1_SU0_SUM0_SUS0_SPO1_SRVW0_SSO1_SVW4_SK3_SKFTR0_SKXCCM0_SGRO0_TDMI0_TIN1_TLDS1_TLDSMn1_ULSGRO0_USL1_UIOFGRO0_UPLRP0_USFGRO1_VSn1_VWA4_VWB2_WSGRA0_WSGRB2_WS64_WG64_4_1_WGMn4_WGMXCC1_WGMXCCGn1
    SolutionIndex: 225
    SolutionNameMin: Cijk_Alik_Bjlk_S_B_Bias_HA_S_SAV_UserArgs_MT128x160x32_MI16x16x1_SN_LDSB1_AFC0_AG0_AFEM1_AFEM1_ASEM1_CLR1_CADS0_DTLA0_DTLB0_DTVA0_DTVB0_DTVMXSA0_DTVMXSB0_DTVSM0_DPLB0_EPS0_ELFLR0_EMLL0_FDSI0_GRPM1_GRVWA2_GRVWB4_GSU0_GSUAMB_GSUC0_GSUWGMRR0_GLS0_ISA950_IU1_K1_LDSTI0_LBSPPA512_LBSPPB128_LBSPPM0_LPA8_LPB8_LPM0_LRVWn1_LWPMn1_MIAV1_MIWT4_5_MO40_MGRIPM1_NTn1_NTA0_NTB0_NTC0_NTD0_NTM0_NEPBS0_NLCA1_NLCB5_ONLL1_PGR2_PLR1_PKA1_SGROB0_SIA3_SS1_SU0_SUM0_SUS0_SPO0_SRVW0_SSO1_SVW4_SK3_SKFTR0_SKXCCM0_SGRO0_TDMI0_TIN1_TLDS2_TLDSMn1_ULSGRO0_USL1_UIOFGRO0_UPLRP0_USFGRO0_VSn1_VWA4_VWB1_WSGRA0_WSGRB0_WS64_WG32_8_1_WGM0_WGMXCC4_WGMXCCGn1
    SolutionIndex: 226
    SolutionNameMin: Cijk_Alik_Bjlk_S_B_Bias_HA_S_SAV_UserArgs_MT128x160x32_MI16x16x1_SN_LDSB1_AFC0_AG1_AFEM1_AFEM1_ASEM1_CLR1_CADS0_DTLA0_DTLB0_DTVA0_DTVB0_DTVMXSA0_DTVMXSB0_DTVSM0_DPLB0_EPS0_ELFLR0_EMLLn1_FDSI0_GRPM1_GRVWA2_GRVWB4_GSU0_GSUAMB_GSUC0_GSUWGMRR0_GLS0_ISA950_IU1_K1_LDSTI0_LBSPPA512_LBSPPB128_LBSPPM0_LPA8_LPB8_LPM0_LRVWn1_LWPMn1_MIAV1_MIWT4_5_MO40_MGRIPM1_NTn1_NTA0_NTB0_NTC0_NTD0_NTM0_NEPBS14_NLCA1_NLCB5_ONLL1_PGR2_PLR1_PKA1_SGROB0_SIA3_SS1_SU0_SUM0_SUS0_SPO0_SRVW0_SSO1_SVW4_SK3_SKFTR0_SKXCCM0_SGRO0_TDMI0_TIN1_TLDS2_TLDSMn1_ULSGRO0_USL1_UIOFGRO0_UPLRP0_USFGRO0_VSn1_VWA4_VWB1_WSGRA0_WSGRB0_WS64_WG32_8_1_WGM4_WGMXCC8_WGMXCCGn1
    SolutionIndex: 227
    SolutionNameMin: Cijk_Alik_Bjlk_S_B_Bias_HA_S_SAV_UserArgs_MT256x192x32_MI16x16x1_SN_LDSB1_AFC0_AG0_AFEM1_AFEM1_ASEM1_CLR1_CADS0_DTLA0_DTLB0_DTVA0_DTVB0_DTVMXSA0_DTVMXSB0_DTVSM0_DPLB0_EPS0_ELFLR0_EMLLn1_FDSI0_GRPM1_GRVWA4_GRVWB4_GSU0_GSUAMB_GSUC0_GSUWGMRR0_GLS0_ISA950_IU1_K1_LDSTI0_LBSPPA512_LBSPPB0_LBSPPM0_LPA8_LPB0_LPM0_LRVWn1_LWPMn1_MIAV0_MIWT4_12_MO40_MGRIPM1_NTn1_NTA0_NTB0_NTC4_NTD4_NTM0_NEPBS12_NLCA1_NLCB3_ONLL1_PGR2_PLR1_PKA1_SGROB0_SIA3_SS1_SU16_SUM0_SUS256_SPO0_SRVW0_SSO1_SVW4_SK3_SKFTR0_SKXCCM0_SGRO0_TDMI0_TIN0_TLDS1_TLDSMn1_ULSGRO0_USL1_UIOFGRO0_UPLRP0_USFGRO1_VSn1_VWA4_VWB4_WSGRA2_WSGRB2_WS64_WG64_4_1_WGMn24_WGMXCC2_WGMXCCGn1
    SolutionIndex: 228
    SolutionNameMin: Cijk_Alik_Bjlk_S_B_Bias_HA_S_SAV_UserArgs_MT320x128x32_MI32x32x1_SN_LDSB1_AFC0_AG1_AFEM1_AFEM1_ASEM1_CLR1_CADS0_DTLA0_DTLB0_DTVA0_DTVB0_DTVMXSA0_DTVMXSB0_DTVSM0_DPLB0_EPS0_ELFLR0_EMLL0_FDSI0_GRPM1_GRVWA4_GRVWB4_GSU0_GSUAMB_GSUC0_GSUWGMRR0_GLS0_ISA950_IU1_K1_LDSTI0_LBSPPA256_LBSPPB0_LBSPPM0_LPA4_LPB0_LPM0_LRVWn1_LWPMn1_MIAV0_MIWT10_1_MO40_MGRIPM1_NTn1_NTA0_NTB0_NTC0_NTD0_NTM0_NEPBS0_NLCA1_NLCB1_ONLL1_PGR2_PLR1_PKA1_SGROB0_SIA3_SS1_SU0_SUM0_SUS0_SPO1_SRVW0_SSO1_SVW2_SK3_SKFTR0_SKXCCM8_SGRO0_TDMI0_TIN1_TLDS1_TLDSMn1_ULSGRO1_USL1_UIOFGRO0_UPLRP0_USFGRO0_VSn1_VWA2_VWB1_WSGRA0_WSGRB0_WS64_WG32_8_1_WGMn48_WGMXCC1_WGMXCCGn1
    SolutionIndex: 229
    SolutionNameMin: Cijk_Alik_Bjlk_S_B_Bias_HA_S_SAV_UserArgs_MT224x192x32_MI16x16x1_SN_LDSB0_AFC0_AG1_AFEM1_AFEM1_ASEM1_CLR1_CADS0_DTLA0_DTLB0_DTVA0_DTVB0_DTVMXSA0_DTVMXSB0_DTVSM0_DPLB0_EPS0_ELFLR0_EMLLn1_FDSI0_GRPM1_GRVWA4_GRVWB4_GSU0_GSUAMB_GSUC0_GSUWGMRR0_GLS0_ISA950_IU1_K1_LDSTI0_LBSPPA256_LBSPPB3072_LBSPPM0_LPA8_LPB16_LPM0_LRVWn1_LWPMn1_MIAV0_MIWT14_3_MO40_MGRIPM1_NTn1_NTA0_NTB0_NTC4_NTD4_NTM0_NEPBS0_NLCA1_NLCB3_ONLL1_PGR2_PLR1_PKA1_SGROB0_SIA3_SS1_SU0_SUM0_SUS0_SPO1_SRVW0_SSO0_SVW2_SK3_SKFTR0_SKXCCM8_SGRO0_TDMI0_TIN1_TLDS1_TLDSMn1_ULSGRO0_USL1_UIOFGRO0_UPLRP0_USFGRO0_VSn1_VWA2_VWB1_WSGRA0_WSGRB2_WS64_WG16_16_1_WGMn1_WGMXCC1_WGMXCCGn1
    SolutionIndex: 230
    SolutionNameMin: Cijk_Alik_Bjlk_S_B_Bias_HA_S_SAV_UserArgs_MT320x160x32_MI16x16x1_SN_LDSB0_AFC0_AG0_AFEM1_AFEM1_ASEM1_CLR1_CADS0_DTLA0_DTLB0_DTVA0_DTVB0_DTVMXSA0_DTVMXSB0_DTVSM0_DPLB0_EPS0_ELFLR0_EMLL0_FDSI0_GRPM1_GRVWA4_GRVWB1_GSU0_GSUAMB_GSUC0_GSUWGMRR0_GLS0_ISA950_IU1_K1_LDSTI0_LBSPPA256_LBSPPB2560_LBSPPM0_LPA8_LPB16_LPM0_LRVWn1_LWPMn1_MIAV0_MIWT10_5_MO40_MGRIPM1_NTn1_NTA0_NTB0_NTC4_NTD4_NTM0_NEPBS0_NLCA1_NLCB5_ONLL1_PGR2_PLR1_PKA1_SGROB0_SIA3_SS1_SU0_SUM0_SUS0_SPO1_SRVW0_SSO1_SVW2_SK3_SKFTR0_SKXCCM0_SGRO0_TDMI0_TIN1_TLDS1_TLDSMn1_ULSGRO0_USL1_UIOFGRO0_UPLRP0_USFGRO0_VSn1_VWA2_VWB1_WSGRA0_WSGRB0_WS64_WG32_8_1_WGM48_WGMXCC4_WGMXCCGn1
    SolutionIndex: 231
    SolutionNameMin: Cijk_Alik_Bjlk_S_B_Bias_HA_S_SAV_UserArgs_MT256x224x32_MI16x16x1_SN_LDSB1_AFC0_AG1_AFEM1_AFEM1_ASEM1_CLR1_CADS0_DTLA0_DTLB0_DTVA0_DTVB0_DTVMXSA0_DTVMXSB0_DTVSM0_DPLB0_EPS1_ELFLR0_EMLLn1_FDSI0_GRPM1_GRVWA4_GRVWB4_GSU0_GSUAMB_GSUC0_GSUWGMRR0_GLS0_ISA950_IU1_K1_LDSTI0_LBSPPA512_LBSPPB0_LBSPPM0_LPA8_LPB0_LPM0_LRVWn1_LWPMn1_MIAV0_MIWT4_14_MO40_MGRIPM1_NTn1_NTA0_NTB0_NTC4_NTD4_NTM0_NEPBS14_NLCA1_NLCB7_ONLL1_PGR1_PLR1_PKA1_SGROB0_SIA3_SS1_SU0_SUM0_SUS0_SPO1_SRVW0_SSO1_SVW4_SK3_SKFTR0_SKXCCM0_SGRO0_TDMI0_TIN1_TLDS1_TLDSMn1_ULSGRO0_USL1_UIOFGRO0_UPLRP0_USFGRO1_VSn1_VWA4_VWB2_WSGRA2_WSGRB0_WS64_WG64_4_1_WGMn1_WGMXCC1_WGMXCCGn1
    SolutionIndex: 232
    SolutionNameMin: Cijk_Alik_Bjlk_S_B_Bias_HA_S_SAV_UserArgs_MT128x448x32_MI16x16x1_SN_LDSB1_AFC0_AG0_AFEM1_AFEM1_ASEM1_CLR1_CADS0_DTLA0_DTLB0_DTVA0_DTVB0_DTVMXSA0_DTVMXSB0_DTVSM0_DPLB0_EPS1_ELFLR0_EMLLn1_FDSI0_GRPM1_GRVWA4_GRVWB4_GSU0_GSUAMB_GSUC0_GSUWGMRR0_GLS0_ISA950_IU1_K1_LDSTI0_LBSPPA512_LBSPPB7168_LBSPPM0_LPA8_LPB16_LPM0_LRVWn1_LWPMn1_MIAV0_MIWT8_7_MO40_MGRIPM1_NTn1_NTA0_NTB0_NTC4_NTD4_NTM0_NEPBS16_NLCA1_NLCB7_ONLL1_PGR1_PLR1_PKA1_SGROB0_SIA3_SS1_SU0_SUM0_SUS0_SPO0_SRVW0_SSO1_SVW4_SK3_SKFTR0_SKXCCM8_SGRO0_TDMI0_TIN1_TLDS1_TLDSMn1_ULSGRO0_USL1_UIOFGRO0_UPLRP0_USFGRO1_VSn1_VWA4_VWB1_WSGRA0_WSGRB0_WS64_WG16_16_1_WGM24_WGMXCC1_WGMXCCGn1
    SolutionIndex: 233
    SolutionNameMin: Cijk_Alik_Bjlk_S_B_Bias_HA_S_SAV_UserArgs_MT192x112x32_MI16x16x1_SN_LDSB1_AFC0_AG1_AFEM1_AFEM1_ASEM1_CLR1_CADS0_DTLA0_DTLB0_DTVA0_DTVB0_DTVMXSA0_DTVMXSB0_DTVSM0_DPLB0_EPS0_ELFLR0_EMLLn1_FDSI0_GRPM1_GRVWA4_GRVWB2_GSU0_GSUAMB_GSUC0_GSUWGMRR0_GLS0_ISA950_IU1_K1_LDSTI0_LBSPPA128_LBSPPB1792_LBSPPM0_LPA8_LPB16_LPM0_LRVWn1_LWPMn1_MIAV0_MIWT3_7_MO40_MGRIPM1_NTn1_NTA4_NTB0_NTC0_NTD4_NTM0_NEPBS14_NLCA1_NLCB7_ONLL1_PGR2_PLR1_PKA1_SGROB0_SIA3_SS1_SU0_SUM0_SUS0_SPO0_SRVW0_SSO4_SVW1_SK3_SKFTR0_SKXCCM4_SGRO0_TDMI0_TIN1_TLDS1_TLDSMn1_ULSGRO0_USL1_UIOFGRO0_UPLRP0_USFGRO0_VSn1_VWA1_VWB1_WSGRA2_WSGRB0_WS64_WG64_4_1_WGMn2_WGMXCC2_WGMXCCGn1
    SolutionIndex: 234
    SolutionNameMin: Cijk_Alik_Bjlk_S_B_Bias_HA_S_SAV_UserArgs_MT256x96x32_MI16x16x1_SN_LDSB1_AFC0_AG1_AFEM1_AFEM1_ASEM1_CLR1_CADS0_DTLA0_DTLB0_DTVA0_DTVB0_DTVMXSA0_DTVMXSB0_DTVSM0_DPLB0_EPS1_ELFLR0_EMLLn1_FDSI0_GRPM1_GRVWA4_GRVWB1_GSU0_GSUAMB_GSUC0_GSUWGMRR0_GLS0_ISA950_IU1_K1_LDSTI0_LBSPPA512_LBSPPB256_LBSPPM0_LPA8_LPB8_LPM0_LRVWn1_LWPMn1_MIAV0_MIWT4_6_MO40_MGRIPM1_NTn1_NTA0_NTB0_NTC4_NTD4_NTM0_NEPBS14_NLCA1_NLCB3_ONLL1_PGR1_PLR1_PKA1_SGROB0_SIA3_SS1_SU0_SUM0_SUS0_SPO0_SRVW0_SSO1_SVW4_SK3_SKFTR0_SKXCCM0_SGRO0_TDMI0_TIN1_TLDS2_TLDSMn1_ULSGRO0_USL1_UIOFGRO0_UPLRP0_USFGRO1_VSn1_VWA4_VWB2_WSGRA0_WSGRB0_WS64_WG64_4_1_WGM2_WGMXCC1_WGMXCCGn1
    SolutionIndex: 235
    SolutionNameMin: Cijk_Alik_Bjlk_S_B_Bias_HA_S_SAV_UserArgs_MT256x160x32_MI16x16x1_SN_LDSB1_AFC0_AG1_AFEM1_AFEM1_ASEM1_CLR1_CADS0_DTLA0_DTLB0_DTVA0_DTVB0_DTVMXSA0_DTVMXSB0_DTVSM0_DPLB0_EPS0_ELFLR0_EMLLn1_FDSI0_GRPM1_GRVWA4_GRVWB4_GSU0_GSUAMB_GSUC0_GSUWGMRR0_GLS0_ISA950_IU1_K1_LDSTI0_LBSPPA512_LBSPPB0_LBSPPM0_LPA8_LPB0_LPM0_LRVWn1_LWPMn1_MIAV0_MIWT4_10_MO40_MGRIPM1_NTn1_NTA0_NTB0_NTC4_NTD4_NTM0_NEPBS0_NLCA1_NLCB5_ONLL1_PGR2_PLR1_PKA1_SGROB0_SIA3_SS1_SU0_SUM0_SUS0_SPO0_SRVW0_SSO1_SVW4_SK3_SKFTR0_SKXCCM0_SGRO0_TDMI0_TIN1_TLDS1_TLDSMn1_ULSGRO0_USL1_UIOFGRO0_UPLRP0_USFGRO1_VSn1_VWA4_VWB2_WSGRA2_WSGRB0_WS64_WG64_4_1_WGM2_WGMXCC1_WGMXCCGn1
    SolutionIndex: 236
    SolutionNameMin: Cijk_Alik_Bjlk_S_B_Bias_HA_S_SAV_UserArgs_MT256x160x32_MI32x32x1_SN_LDSB1_AFC0_AG1_AFEM1_AFEM1_ASEM1_CLR0_CADS0_DTLA0_DTLB0_DTVA0_DTVB0_DTVMXSA0_DTVMXSB0_DTVSM0_DPLB0_EPS0_ELFLR0_EMLLn1_FDSI0_GRPM1_GRVWA4_GRVWB4_GSU0_GSUAMB_GSUC0_GSUWGMRR0_GLS0_ISA950_IU1_K1_LDSTI1_LBSPPA0_LBSPPB0_LBSPPM0_LPA0_LPB0_LPM0_LRVWn1_LWPMn1_MIAV0_MIWT2_5_MO40_MGRIPM1_NTn1_NTA0_NTB0_NTC0_NTD0_NTM0_NEPBS12_NLCA1_NLCB5_ONLL1_PGR2_PLR1_PKA1_SGROB0_SIA3_SS1_SU0_SUM0_SUS0_SPO0_SRVW0_SSO1_SVW2_SK3_SKFTR0_SKXCCM0_SGRO0_TDMI0_TIN1_TLDS0_TLDSMn1_ULSGRO0_USL1_UIOFGRO0_UPLRP0_USFGRO0_VSn1_VWA2_VWB1_WSGRA0_WSGRB2_WS64_WG128_2_1_WGM4_WGMXCC8_WGMXCCGn1
    SolutionIndex: 237
    SolutionNameMin: Cijk_Alik_Bjlk_S_B_Bias_HA_S_SAV_UserArgs_MT128x416x32_MI16x16x1_SN_LDSB1_AFC0_AG1_AFEM1_AFEM1_ASEM1_CLR1_CADS0_DTLA0_DTLB0_DTVA0_DTVB0_DTVMXSA0_DTVMXSB0_DTVSM0_DPLB0_EPS0_ELFLR0_EMLLn1_FDSI0_GRPM1_GRVWA4_GRVWB4_GSU0_GSUAMB_GSUC0_GSUWGMRR0_GLS0_ISA950_IU1_K1_LDSTI0_LBSPPA512_LBSPPB6656_LBSPPM0_LPA8_LPB16_LPM0_LRVWn1_LWPMn1_MIAV0_MIWT4_13_MO40_MGRIPM1_NTn1_NTA0_NTB0_NTC0_NTD0_NTM0_NEPBS0_NLCA1_NLCB13_ONLL1_PGR2_PLR1_PKA1_SGROB0_SIA3_SS1_SU0_SUM0_SUS0_SPO0_SRVW0_SSO1_SVW4_SK3_SKFTR0_SKXCCM0_SGRO0_TDMI0_TIN1_TLDS1_TLDSMn1_ULSGRO0_USL1_UIOFGRO0_UPLRP0_USFGRO0_VSn1_VWA4_VWB1_WSGRA0_WSGRB2_WS64_WG32_8_1_WGM8_WGMXCC1_WGMXCCGn1
    SolutionIndex: 238
    SolutionNameMin: Cijk_Alik_Bjlk_S_B_Bias_HA_S_SAV_UserArgs_MT192x128x32_MI16x16x1_SN_LDSB1_AFC0_AG1_AFEM1_AFEM1_ASEM1_CLR1_CADS0_DTLA0_DTLB0_DTVA0_DTVB0_DTVMXSA0_DTVMXSB0_DTVSM0_DPLB0_EPS0_ELFLR0_EMLL0_FDSI0_GRPM1_GRVWA4_GRVWB1_GSU0_GSUAMB_GSUC0_GSUWGMRR0_GLS0_ISA950_IU1_K1_LDSTI0_LBSPPA512_LBSPPB0_LBSPPM0_LPA8_LPB0_LPM0_LRVWn1_LWPMn1_MIAV0_MIWT12_2_MO40_MGRIPM1_NTn1_NTA0_NTB0_NTC4_NTD0_NTM0_NEPBS12_NLCA1_NLCB1_ONLL1_PGR2_PLR1_PKA1_SGROB0_SIA3_SS1_SU0_SUM0_SUS0_SPO0_SRVW0_SSO1_SVW4_SK3_SKFTR0_SKXCCM0_SGRO0_TDMI0_TIN1_TLDS1_TLDSMn1_ULSGRO1_USL1_UIOFGRO0_UPLRP0_USFGRO0_VSn1_VWA4_VWB2_WSGRA0_WSGRB0_WS64_WG16_16_1_WGMn16_WGMXCC1_WGMXCCGn1
    SolutionIndex: 239
    SolutionNameMin: Cijk_Alik_Bjlk_S_B_Bias_HA_S_SAV_UserArgs_MT256x224x32_MI16x16x1_SN_LDSB0_AFC0_AG1_AFEM1_AFEM1_ASEM1_CLR1_CADS0_DTLA0_DTLB0_DTVA0_DTVB0_DTVMXSA0_DTVMXSB0_DTVSM0_DPLB0_EPS0_ELFLR0_EMLLn1_FDSI0_GRPM1_GRVWA4_GRVWB4_GSU0_GSUAMB_GSUC0_GSUWGMRR0_GLS0_ISA950_IU1_K1_LDSTI0_LBSPPA512_LBSPPB0_LBSPPM0_LPA8_LPB0_LPM0_LRVWn1_LWPMn1_MIAV0_MIWT4_14_MO40_MGRIPM1_NTn1_NTA0_NTB0_NTC0_NTD0_NTM0_NEPBS8_NLCA1_NLCB7_ONLL1_PGR2_PLR1_PKA1_SGROB0_SIA3_SS1_SU0_SUM0_SUS0_SPO0_SRVW0_SSO1_SVW4_SK3_SKFTR0_SKXCCM0_SGRO0_TDMI0_TIN1_TLDS1_TLDSMn1_ULSGRO0_USL1_UIOFGRO0_UPLRP0_USFGRO1_VSn1_VWA4_VWB2_WSGRA0_WSGRB0_WS64_WG64_4_1_WGMn4_WGMXCC1_WGMXCCGn1
    SolutionIndex: 240
    SolutionNameMin: Cijk_Alik_Bjlk_S_B_Bias_HA_S_SAV_UserArgs_MT256x192x32_MI32x32x1_SN_LDSB1_AFC0_AG1_AFEM1_AFEM1_ASEM1_CLR1_CADS0_DTLA0_DTLB0_DTVA0_DTVB0_DTVMXSA0_DTVMXSB0_DTVSM0_DPLB0_EPS1_ELFLR0_EMLL0_FDSI0_GRPM1_GRVWA4_GRVWB4_GSU0_GSUAMB_GSUC0_GSUWGMRR0_GLS0_ISA950_IU1_K1_LDSTI0_LBSPPA512_LBSPPB0_LBSPPM0_LPA4_LPB0_LPM0_LRVWn1_LWPMn1_MIAV0_MIWT4_3_MO40_MGRIPM1_NTn1_NTA0_NTB0_NTC4_NTD4_NTM0_NEPBS12_NLCA1_NLCB3_ONLL1_PGR1_PLR1_PKA1_SGROB0_SIA3_SS1_SU0_SUM0_SUS0_SPO0_SRVW0_SSO1_SVW4_SK3_SKFTR0_SKXCCM0_SGRO0_TDMI0_TIN1_TLDS1_TLDSMn1_ULSGRO0_USL1_UIOFGRO0_UPLRP0_USFGRO1_VSn1_VWA4_VWB1_WSGRA0_WSGRB2_WS64_WG64_4_1_WGMn2_WGMXCC1_WGMXCCGn1
    SolutionIndex: 241
    SolutionNameMin: Cijk_Alik_Bjlk_S_B_Bias_HA_S_SAV_UserArgs_MT128x352x32_MI16x16x1_SN_LDSB0_AFC0_AG1_AFEM1_AFEM1_ASEM1_CLR1_CADS0_DTLA0_DTLB0_DTVA0_DTVB0_DTVMXSA0_DTVMXSB0_DTVSM0_DPLB0_EPS1_ELFLR0_EMLLn1_FDSI0_GRPM1_GRVWA4_GRVWB4_GSU0_GSUAMB_GSUC0_GSUWGMRR0_GLS0_ISA950_IU1_K1_LDSTI0_LBSPPA512_LBSPPB5632_LBSPPM0_LPA8_LPB16_LPM0_LRVWn1_LWPMn1_MIAV0_MIWT4_11_MO40_MGRIPM1_NTn1_NTA0_NTB0_NTC4_NTD4_NTM0_NEPBS16_NLCA1_NLCB11_ONLL1_PGR1_PLR1_PKA1_SGROB0_SIA3_SS1_SU0_SUM0_SUS0_SPO0_SRVW0_SSO1_SVW4_SK3_SKFTR0_SKXCCM4_SGRO0_TDMI0_TIN1_TLDS1_TLDSMn1_ULSGRO0_USL1_UIOFGRO0_UPLRP0_USFGRO1_VSn1_VWA4_VWB1_WSGRA0_WSGRB0_WS64_WG32_8_1_WGMn1_WGMXCC1_WGMXCCGn1
    SolutionIndex: 242
    SolutionNameMin: Cijk_Alik_Bjlk_S_B_Bias_HA_S_SAV_UserArgs_MT320x128x32_MI16x16x1_SN_LDSB1_AFC0_AG1_AFEM1_AFEM1_ASEM1_CLR1_CADS0_DTLA0_DTLB0_DTVA0_DTVB0_DTVMXSA0_DTVMXSB0_DTVSM0_DPLB0_EPS0_ELFLR0_EMLL0_FDSI0_GRPM1_GRVWA4_GRVWB4_GSU0_GSUAMB_GSUC0_GSUWGMRR0_GLS0_ISA950_IU1_K1_LDSTI0_LBSPPA512_LBSPPB0_LBSPPM0_LPA8_LPB0_LPM0_LRVWn1_LWPMn1_MIAV0_MIWT20_2_MO40_MGRIPM1_NTn1_NTA0_NTB0_NTC4_NTD4_NTM0_NEPBS14_NLCA1_NLCB1_ONLL1_PGR2_PLR1_PKA1_SGROB0_SIA3_SS1_SU0_SUM0_SUS0_SPO1_SRVW0_SSO1_SVW4_SK3_SKFTR0_SKXCCM8_SGRO0_TDMI0_TIN1_TLDS1_TLDSMn1_ULSGRO1_USL1_UIOFGRO0_UPLRP0_USFGRO1_VSn1_VWA4_VWB2_WSGRA0_WSGRB2_WS64_WG16_16_1_WGM6_WGMXCC16_WGMXCCGn1
    SolutionIndex: 243
    SolutionNameMin: Cijk_Alik_Bjlk_S_B_Bias_HA_S_SAV_UserArgs_MT512x128x32_MI32x32x1_SN_LDSB1_AFC0_AG0_AFEM1_AFEM1_ASEM1_CLR1_CADS0_DTLA0_DTLB0_DTVA0_DTVB0_DTVMXSA0_DTVMXSB0_DTVSM0_DPLB0_EPS0_ELFLR0_EMLL0_FDSI0_GRPM1_GRVWA4_GRVWB4_GSU0_GSUAMB_GSUC0_GSUWGMRR0_GLS0_ISA950_IU1_K1_LDSTI0_LBSPPA512_LBSPPB0_LBSPPM0_LPA4_LPB0_LPM0_LRVWn1_LWPMn1_MIAV0_MIWT4_4_MO40_MGRIPM1_NTn1_NTA0_NTB0_NTC4_NTD4_NTM0_NEPBS8_NLCA1_NLCB1_ONLL1_PGR2_PLR1_PKA1_SGROB0_SIA3_SS1_SU0_SUM0_SUS0_SPO0_SRVW0_SSO1_SVW4_SK3_SKFTR0_SKXCCM0_SGRO0_TDMI0_TIN1_TLDS1_TLDSMn1_ULSGRO0_USL1_UIOFGRO0_UPLRP0_USFGRO1_VSn1_VWA4_VWB4_WSGRA2_WSGRB2_WS64_WG128_2_1_WGM8_WGMXCC1_WGMXCCGn1
    SolutionIndex: 244
    SolutionNameMin: Cijk_Alik_Bjlk_S_B_Bias_HA_S_SAV_UserArgs_MT256x256x32_MI16x16x1_SN_LDSB1_AFC0_AG1_AFEM1_AFEM1_ASEM1_CLR1_CADS0_DTLA0_DTLB0_DTVA0_DTVB0_DTVMXSA0_DTVMXSB0_DTVSM0_DPLB0_EPS0_ELFLR0_EMLLn1_FDSI0_GRPM1_GRVWA4_GRVWB4_GSU0_GSUAMB_GSUC0_GSUWGMRR0_GLS0_ISA950_IU1_K1_LDSTI0_LBSPPA512_LBSPPB0_LBSPPM0_LPA8_LPB0_LPM0_LRVWn1_LWPMn1_MIAV0_MIWT16_4_MO40_MGRIPM1_NTn1_NTA0_NTB0_NTC4_NTD4_NTM0_NEPBS16_NLCA1_NLCB1_ONLL1_PGR2_PLR1_PKA1_SGROB0_SIA3_SS1_SU0_SUM0_SUS0_SPO0_SRVW0_SSO1_SVW4_SK3_SKFTR0_SKXCCM0_SGRO0_TDMI0_TIN1_TLDS1_TLDSMn1_ULSGRO0_USL1_UIOFGRO0_UPLRP0_USFGRO1_VSn1_VWA4_VWB4_WSGRA0_WSGRB0_WS64_WG16_16_1_WGM4_WGMXCC2_WGMXCCGn1
    SolutionIndex: 245
    SolutionNameMin: Cijk_Alik_Bjlk_S_B_Bias_HA_S_SAV_UserArgs_MT256x192x32_MI16x16x1_SN_LDSB1_AFC0_AG1_AFEM1_AFEM1_ASEM1_CLR1_CADS0_DTLA0_DTLB0_DTVA0_DTVB0_DTVMXSA0_DTVMXSB0_DTVSM0_DPLB0_EPS0_ELFLR0_EMLL0_FDSI0_GRPM1_GRVWA4_GRVWB4_GSU0_GSUAMB_GSUC0_GSUWGMRR0_GLS0_ISA950_IU1_K1_LDSTI0_LBSPPA512_LBSPPB0_LBSPPM0_LPA8_LPB0_LPM0_LRVWn1_LWPMn1_MIAV0_MIWT8_6_MO40_MGRIPM1_NTn1_NTA0_NTB0_NTC4_NTD4_NTM0_NEPBS12_NLCA1_NLCB3_ONLL1_PGR2_PLR1_PKA1_SGROB0_SIA3_SS1_SU0_SUM0_SUS0_SPO1_SRVW0_SSO1_SVW4_SK3_SKFTR0_SKXCCM0_SGRO0_TDMI0_TIN1_TLDS1_TLDSMn1_ULSGRO1_USL1_UIOFGRO0_UPLRP0_USFGRO1_VSn1_VWA4_VWB2_WSGRA0_WSGRB2_WS64_WG32_8_1_WGM8_WGMXCC1_WGMXCCGn1
    SolutionIndex: 246
    SolutionNameMin: Cijk_Alik_Bjlk_S_B_Bias_HA_S_SAV_UserArgs_MT256x176x32_MI16x16x1_SN_LDSB0_AFC0_AG1_AFEM1_AFEM1_ASEM1_CLR1_CADS0_DTLA0_DTLB0_DTVA0_DTVB0_DTVMXSA0_DTVMXSB0_DTVSM0_DPLB0_EPS0_ELFLR0_EMLLn1_FDSI0_GRPM1_GRVWA2_GRVWB2_GSU0_GSUAMB_GSUC0_GSUWGMRR0_GLS0_ISA950_IU1_K1_LDSTI0_LBSPPA512_LBSPPB2816_LBSPPM0_LPA8_LPB16_LPM0_LRVWn1_LWPMn1_MIAV0_MIWT4_11_MO40_MGRIPM1_NTn1_NTA0_NTB0_NTC4_NTD4_NTM0_NEPBS0_NLCA1_NLCB11_ONLL1_PGR2_PLR1_PKA1_SGROB0_SIA3_SS1_SU0_SUM0_SUS0_SPO0_SRVW0_SSO1_SVW4_SK3_SKFTR0_SKXCCM0_SGRO0_TDMI0_TIN1_TLDS1_TLDSMn1_ULSGRO1_USL1_UIOFGRO0_UPLRP0_USFGRO1_VSn1_VWA4_VWB1_WSGRA2_WSGRB0_WS64_WG64_4_1_WGMn2_WGMXCC1_WGMXCCGn1
    SolutionIndex: 247
    SolutionNameMin: Cijk_Alik_Bjlk_S_B_Bias_HA_S_SAV_UserArgs_MT256x224x32_MI16x16x1_SN_LDSB1_AFC0_AG1_AFEM1_AFEM1_ASEM1_CLR1_CADS0_DTLA0_DTLB0_DTVA0_DTVB0_DTVMXSA0_DTVMXSB0_DTVSM0_DPLB0_EPS0_ELFLR0_EMLLn1_FDSI0_GRPM1_GRVWA4_GRVWB4_GSU0_GSUAMB_GSUC0_GSUWGMRR0_GLS0_ISA950_IU1_K1_LDSTI0_LBSPPA512_LBSPPB0_LBSPPM0_LPA8_LPB0_LPM0_LRVWn1_LWPMn1_MIAV0_MIWT4_14_MO40_MGRIPM1_NTn1_NTA0_NTB0_NTC4_NTD4_NTM0_NEPBS14_NLCA1_NLCB7_ONLL1_PGR2_PLR1_PKA1_SGROB0_SIA3_SS1_SU0_SUM0_SUS0_SPO1_SRVW0_SSO1_SVW4_SK3_SKFTR0_SKXCCM0_SGRO0_TDMI0_TIN1_TLDS1_TLDSMn1_ULSGRO0_USL1_UIOFGRO0_UPLRP0_USFGRO0_VSn1_VWA4_VWB2_WSGRA2_WSGRB0_WS64_WG64_4_1_WGM2_WGMXCC1_WGMXCCGn1
    SolutionIndex: 248
    SolutionNameMin: Cijk_Alik_Bjlk_S_B_Bias_HA_S_SAV_UserArgs_MT256x128x32_MI16x16x1_SN_LDSB1_AFC0_AG0_AFEM1_AFEM1_ASEM1_CLR1_CADS0_DTLA0_DTLB0_DTVA0_DTVB0_DTVMXSA0_DTVMXSB0_DTVSM0_DPLB0_EPS0_ELFLR0_EMLL0_FDSI0_GRPM1_GRVWA4_GRVWB1_GSU0_GSUAMB_GSUC0_GSUWGMRR0_GLS0_ISA950_IU1_K1_LDSTI0_LBSPPA512_LBSPPB0_LBSPPM0_LPA8_LPB0_LPM0_LRVWn1_LWPMn1_MIAV0_MIWT4_8_MO40_MGRIPM1_NTn1_NTA0_NTB0_NTC4_NTD4_NTM0_NEPBS12_NLCA1_NLCB1_ONLL1_PGR2_PLR1_PKA1_SGROB0_SIA3_SS1_SU0_SUM0_SUS0_SPO0_SRVW0_SSO1_SVW4_SK3_SKFTR0_SKXCCM0_SGRO0_TDMI0_TIN1_TLDS1_TLDSMn1_ULSGRO0_USL1_UIOFGRO0_UPLRP0_USFGRO1_VSn1_VWA4_VWB4_WSGRA2_WSGRB0_WS64_WG64_4_1_WGMn1_WGMXCC1_WGMXCCGn1
    SolutionIndex: 249
    SolutionNameMin: Cijk_Alik_Bjlk_S_B_Bias_HA_S_SAV_UserArgs_MT256x160x32_MI16x16x1_SN_LDSB1_AFC0_AG0_AFEM1_AFEM1_ASEM1_CLR1_CADS0_DTLA0_DTLB0_DTVA0_DTVB0_DTVMXSA0_DTVMXSB0_DTVSM0_DPLB0_EPS0_ELFLR0_EMLL0_FDSI0_GRPM1_GRVWA4_GRVWB4_GSU0_GSUAMB_GSUC0_GSUWGMRR0_GLS0_ISA950_IU1_K1_LDSTI0_LBSPPA512_LBSPPB2560_LBSPPM0_LPA8_LPB16_LPM0_LRVWn1_LWPMn1_MIAV0_MIWT8_5_MO40_MGRIPM1_NTn1_NTA0_NTB0_NTC4_NTD4_NTM0_NEPBS14_NLCA1_NLCB5_ONLL1_PGR2_PLR1_PKA1_SGROB0_SIA3_SS1_SU0_SUM0_SUS0_SPO0_SRVW0_SSO1_SVW4_SK3_SKFTR0_SKXCCM0_SGRO0_TDMI0_TIN1_TLDS1_TLDSMn1_ULSGRO0_USL1_UIOFGRO0_UPLRP0_USFGRO1_VSn1_VWA4_VWB1_WSGRA0_WSGRB0_WS64_WG32_8_1_WGMn1_WGMXCC2_WGMXCCGn1
    SolutionIndex: 250
    SolutionNameMin: Cijk_Alik_Bjlk_S_B_Bias_HA_S_SAV_UserArgs_MT384x128x32_MI16x16x1_SN_LDSB1_AFC0_AG1_AFEM1_AFEM1_ASEM1_CLR1_CADS0_DTLA0_DTLB0_DTVA0_DTVB0_DTVMXSA0_DTVMXSB0_DTVSM0_DPLB0_EPS0_ELFLR0_EMLL0_FDSI0_GRPM1_GRVWA4_GRVWB4_GSU0_GSUAMB_GSUC0_GSUWGMRR0_GLS0_ISA950_IU1_K1_LDSTI0_LBSPPA512_LBSPPB0_LBSPPM0_LPA8_LPB0_LPM0_LRVWn1_LWPMn1_MIAV0_MIWT12_4_MO40_MGRIPM1_NTn1_NTA0_NTB0_NTC4_NTD4_NTM0_NEPBS12_NLCA1_NLCB1_ONLL1_PGR2_PLR1_PKA1_SGROB0_SIA3_SS1_SU0_SUM0_SUS0_SPO0_SRVW0_SSO1_SVW4_SK3_SKFTR0_SKXCCM0_SGRO0_TDMI0_TIN1_TLDS1_TLDSMn1_ULSGRO0_USL1_UIOFGRO0_UPLRP0_USFGRO1_VSn1_VWA4_VWB4_WSGRA2_WSGRB0_WS64_WG32_8_1_WGM0_WGMXCC1_WGMXCCGn1
    SolutionIndex: 251
    SolutionNameMin: Cijk_Alik_Bjlk_S_B_Bias_HA_S_SAV_UserArgs_MT256x128x32_MI32x32x1_SN_LDSB1_AFC0_AG1_AFEM1_AFEM1_ASEM1_CLR0_CADS0_DTLA0_DTLB0_DTVA0_DTVB0_DTVMXSA0_DTVMXSB0_DTVSM0_DPLB0_EPS0_ELFLR0_EMLL0_FDSI0_GRPM1_GRVWA4_GRVWB4_GSU0_GSUAMB_GSUC0_GSUWGMRR0_GLS0_ISA950_IU1_K1_LDSTI1_LBSPPA0_LBSPPB0_LBSPPM0_LPA0_LPB0_LPM0_LRVWn1_LWPMn1_MIAV0_MIWT2_4_MO40_MGRIPM1_NTn1_NTA0_NTB0_NTC4_NTD4_NTM0_NEPBS0_NLCA1_NLCB1_ONLL1_PGR2_PLR1_PKA1_SGROB0_SIA3_SS1_SU0_SUM0_SUS0_SPO0_SRVW0_SSO4_SVW2_SK3_SKFTR0_SKXCCM8_SGRO0_TDMI0_TIN1_TLDS0_TLDSMn1_ULSGRO0_USL1_UIOFGRO0_UPLRP0_USFGRO0_VSn1_VWA2_VWB4_WSGRA0_WSGRB2_WS64_WG128_2_1_WGMn2_WGMXCC32_WGMXCCGn1
    SolutionIndex: 252
    SolutionNameMin: Cijk_Alik_Bjlk_S_B_Bias_HA_S_SAV_UserArgs_MT128x192x32_MI16x16x1_SN_LDSB1_AFC0_AG1_AFEM1_AFEM1_ASEM1_CLR1_CADS0_DTLA0_DTLB0_DTVA0_DTVB0_DTVMXSA0_DTVMXSB0_DTVSM0_DPLB0_EPS0_ELFLR0_EMLL0_FDSI0_GRPM1_GRVWA4_GRVWB4_GSU0_GSUAMB_GSUC0_GSUWGMRR0_GLS0_ISA950_IU1_K1_LDSTI0_LBSPPA512_LBSPPB256_LBSPPM0_LPA8_LPB8_LPM0_LRVWn1_LWPMn1_MIAV0_MIWT4_6_MO40_MGRIPM1_NTn1_NTA0_NTB0_NTC0_NTD0_NTM0_NEPBS12_NLCA1_NLCB3_ONLL1_PGR2_PLR1_PKA1_SGROB0_SIA3_SS1_SU0_SUM0_SUS0_SPO0_SRVW0_SSO1_SVW4_SK3_SKFTR0_SKXCCM0_SGRO0_TDMI0_TIN1_TLDS2_TLDSMn1_ULSGRO0_USL1_UIOFGRO0_UPLRP0_USFGRO0_VSn1_VWA4_VWB2_WSGRA2_WSGRB2_WS64_WG32_8_1_WGM2_WGMXCC4_WGMXCCGn1
    SolutionIndex: 253
    SolutionNameMin: Cijk_Alik_Bjlk_S_B_Bias_HA_S_SAV_UserArgs_MT96x352x32_MI16x16x1_SN_LDSB1_AFC0_AG1_AFEM1_AFEM1_ASEM1_CLR0_CADS0_DTLA0_DTLB0_DTVA0_DTVB0_DTVMXSA0_DTVMXSB0_DTVSM0_DPLB0_EPS0_ELFLR0_EMLLn1_FDSI0_GRPM1_GRVWA4_GRVWB4_GSU0_GSUAMB_GSUC0_GSUWGMRR0_GLS0_ISA950_IU1_K1_LDSTI1_LBSPPA384_LBSPPB1408_LBSPPM0_LPA16_LPB16_LPM0_LRVWn1_LWPMn1_MIAV0_MIWT3_11_MO40_MGRIPM1_NTn1_NTA0_NTB0_NTC0_NTD0_NTM0_NEPBS0_NLCA1_NLCB11_ONLL1_PGR2_PLR1_PKA1_SGROB0_SIA3_SS1_SU0_SUM0_SUS0_SPO0_SRVW0_SSO1_SVW1_SK3_SKFTR0_SKXCCM0_SGRO0_TDMI0_TIN1_TLDS0_TLDSMn1_ULSGRO0_USL1_UIOFGRO0_UPLRP0_USFGRO1_VSn1_VWA1_VWB1_WSGRA0_WSGRB2_WS64_WG32_8_1_WGMn1_WGMXCC8_WGMXCCGn1
- - - [384, 1280, 1, 1562]
    - [0, 0.0]
  - - [512, 1280, 1, 1562]
    - [1, 0.0]
  - - [1562, 384, 1, 1280]
    - [2, 0.0]
  - - [64, 3072, 1, 1024]
    - [3, 0.0]
  - - [360, 5120, 1, 5120]
    - [4, 0.0]
  - - [1024, 384, 1, 1024]
    - [5, 0.0]
  - - [1560, 5120, 1, 5120]
    - [6, 0.0]
  - - [1024, 1280, 1, 1562]
    - [7, 0.0]
  - - [1562, 512, 1, 1280]
    - [8, 0.0]
  - - [1562, 640, 1, 1280]
    - [9, 0.0]
  - - [1562, 768, 1, 1280]
    - [10, 0.0]
  - - [1562, 1024, 1, 1280]
    - [11, 0.0]
  - - [1562, 1664, 1, 1280]
    - [12, 0.0]
  - - [1562, 1920, 1, 1280]
    - [13, 0.0]
  - - [1664, 1280, 1, 1562]
    - [14, 0.0]
  - - [1920, 1280, 1, 1562]
    - [15, 0.0]
  - - [77, 64, 20, 77]
    - [16, 0.0]
  - - [3, 1, 14000000, 3]
    - [17, 0.0]
  - - [176947, 128, 1, 131072]
    - [18, 0.0]
  - - [104857, 115, 1, 131072]
    - [19, 0.0]
  - - [4505, 32768, 1, 32]
    - [20, 0.0]
  - - [39321, 422, 1, 32]
    - [21, 0.0]
  - - [3712, 8192, 1, 32]
    - [22, 0.0]
  - - [1536, 22528, 1, 32]
    - [23, 0.0]
  - - [16384, 1024, 1, 128]
    - [24, 0.0]
  - - [4096, 4032, 1, 128]
    - [25, 0.0]
  - - [8908, 1638, 1, 128]
    - [26, 0.0]
  - - [2048, 8192, 1, 128]
    - [27, 0.0]
  - - [3840, 2560, 1, 256]
    - [28, 0.0]
  - - [768, 25600, 1, 32]
    - [29, 0.0]
  - - [39936, 512, 1, 32]
    - [30, 0.0]
  - - [139264, 128, 1, 32]
    - [31, 0.0]
  - - [3276, 4454, 1, 32]
    - [32, 0.0]
  - - [4608, 1664, 1, 256]
    - [33, 0.0]
  - - [2560, 4915, 1, 128]
    - [34, 0.0]
  - - [5632, 3072, 1, 32]
    - [35, 0.0]
  - - [1228, 15974, 1, 32]
    - [36, 0.0]
  - - [89, 78643, 1, 128]
    - [37, 0.0]
  - - [1638, 3993, 1, 256]
    - [38, 0.0]
  - - [29696, 384, 1, 128]
    - [39, 0.0]
  - - [8192, 1638, 1, 32]
    - [40, 0.0]
  - - [409, 314572, 1, 32]
    - [41, 0.0]
  - - [2304, 6553, 1, 32]
    - [42, 0.0]
  - - [2048, 7372, 1, 32]
    - [43, 0.0]
  - - [1248, 8192, 1, 128]
    - [44, 0.0]
  - - [1638, 5222, 1, 128]
    - [45, 0.0]
  - - [1433, 7372, 1, 32]
    - [46, 0.0]
  - - [7782, 819, 1, 128]
    - [47, 0.0]
  - - [1536, 6912, 1, 32]
    - [48, 0.0]
  - - [29696, 256, 1, 128]
    - [49, 0.0]
  - - [614, 9011, 1, 128]
    - [50, 0.0]
  - - [1664, 3072, 1, 256]
    - [51, 0.0]
  - - [6553, 18841, 1, 32]
    - [52, 0.0]
  - - [1331, 4915, 1, 128]
    - [53, 0.0]
  - - [2764, 1638, 1, 32]
    - [54, 0.0]
  - - [5120, 1536, 1, 128]
    - [55, 0.0]
  - - [1024, 7936, 1, 128]
    - [56, 0.0]
  - - [1024, 7680, 1, 128]
    - [57, 0.0]
  - - [13312, 512, 1, 128]
    - [58, 0.0]
  - - [1638, 2252, 1, 256]
    - [59, 0.0]
  - - [1408, 8192, 1, 32]
    - [60, 0.0]
  - - [499, 6553, 1, 256]
    - [61, 0.0]
  - - [1280, 2816, 1, 256]
    - [62, 0.0]
  - - [2816, 20480, 1, 256]
    - [63, 0.0]
  - - [2560, 1280, 1, 256]
    - [64, 0.0]
  - - [1024, 3276, 1, 256]
    - [65, 0.0]
  - - [256, 13312, 1, 256]
    - [66, 0.0]
  - - [3686, 819, 1, 256]
    - [67, 0.0]
  - - [3276, 1996, 1, 32]
    - [68, 0.0]
  - - [59392, 128, 1, 32]
    - [69, 0.0]
  - - [691, 3276, 1, 256]
    - [70, 0.0]
  - - [39321, 140, 1, 32]
    - [71, 0.0]
  - - [992, 2048, 1, 256]
    - [72, 0.0]
  - - [4915, 24576, 1, 32]
    - [73, 0.0]
  - - [1920, 3072, 1, 32]
    - [74, 0.0]
  - - [640, 9216, 1, 32]
    - [75, 0.0]
  - - [4096, 496, 1, 256]
    - [76, 0.0]
  - - [1228, 1331, 1, 256]
    - [77, 0.0]
  - - [3072, 640, 1, 256]
    - [78, 0.0]
  - - [4915, 460, 1, 128]
    - [79, 0.0]
  - - [2048, 800, 1, 256]
    - [80, 0.0]
  - - [2432, 1536, 1, 32]
    - [81, 0.0]
  - - [4096, 640, 1, 128]
    - [82, 0.0]
  - - [4915, 358, 1, 128]
    - [83, 0.0]
  - - [1638, 72089, 1, 32]
    - [84, 0.0]
  - - [2304, 640, 1, 256]
    - [85, 0.0]
  - - [512, 3072, 1, 256]
    - [86, 0.0]
  - - [1344, 1024, 1, 256]
    - [87, 0.0]
  - - [409, 3072, 1, 256]
    - [88, 0.0]
  - - [896, 1536, 1, 256]
    - [89, 0.0]
  - - [345, 6553, 1, 32]
    - [90, 0.0]
  - - [2944, 512, 1, 128]
    - [91, 0.0]
  - - [3686, 204, 1, 256]
    - [92, 0.0]
  - - [240, 12288, 1, 32]
    - [93, 0.0]
  - - [928, 2048, 1, 32]
    - [94, 0.0]
  - - [4915, 21299, 1, 32]
    - [95, 0.0]
  - - [576, 1536, 1, 256]
    - [96, 0.0]
  - - [512, 1638, 1, 256]
    - [97, 0.0]
  - - [409, 3072, 1, 128]
    - [98, 0.0]
  - - [921, 2048, 1, 32]
    - [99, 0.0]
  - - [1408, 768, 1, 128]
    - [100, 0.0]
  - - [768, 1664, 1, 128]
    - [101, 0.0]
  - - [2304, 512, 1, 128]
    - [102, 0.0]
  - - [819, 1075, 1, 128]
    - [103, 0.0]
  - - [128, 14848, 1, 32]
    - [104, 0.0]
  - - [4096, 20480, 1, 128]
    - [105, 0.0]
  - - [128, 13312, 1, 32]
    - [106, 0.0]
  - - [2867, 307, 1, 128]
    - [107, 0.0]
  - - [4096, 216, 1, 128]
    - [108, 0.0]
  - - [819, 1536, 1, 32]
    - [109, 0.0]
  - - [1638, 256, 1, 256]
    - [110, 0.0]
  - - [2048, 360, 1, 128]
    - [111, 0.0]
  - - [216, 4096, 1, 128]
    - [112, 0.0]
  - - [208, 4096, 1, 128]
    - [113, 0.0]
  - - [819, 768, 1, 128]
    - [114, 0.0]
  - - [1638, 65536, 1, 32]
    - [115, 0.0]
  - - [1638, 230, 1, 256]
    - [116, 0.0]
  - - [204, 5734, 1, 32]
    - [117, 0.0]
  - - [360, 2048, 1, 128]
    - [118, 0.0]
  - - [819, 614, 1, 128]
    - [119, 0.0]
  - - [2457, 256, 1, 128]
    - [120, 0.0]
  - - [1024, 1248, 1, 32]
    - [121, 0.0]
  - - [512, 864, 1, 256]
    - [122, 0.0]
  - - [4096, 72, 1, 256]
    - [123, 0.0]
  - - [1024, 480, 1, 256]
    - [124, 0.0]
  - - [2304, 64, 1, 256]
    - [125, 0.0]
  - - [2560, 20480, 1, 256]
    - [126, 0.0]
  - - [1152, 384, 1, 256]
    - [127, 0.0]
  - - [264, 4096, 1, 32]
    - [128, 0.0]
  - - [192, 6656, 1, 32]
    - [129, 0.0]
  - - [448, 3072, 1, 32]
    - [130, 0.0]
  - - [192, 6144, 1, 32]
    - [131, 0.0]
  - - [1280, 576, 1, 128]
    - [132, 0.0]
  - - [768, 896, 1, 128]
    - [133, 0.0]
  - - [512, 1344, 1, 128]
    - [134, 0.0]
  - - [128, 5376, 1, 128]
    - [135, 0.0]
  - - [204, 3072, 1, 128]
    - [136, 0.0]
  - - [89, 9830, 1, 32]
    - [137, 0.0]
  - - [320, 2304, 1, 128]
    - [138, 0.0]
  - - [1920, 128, 1, 256]
    - [139, 0.0]
  - - [819, 563, 1, 128]
    - [140, 0.0]
  - - [819, 512, 1, 128]
    - [141, 0.0]
  - - [4096, 216, 1, 32]
    - [142, 0.0]
  - - [1638, 128, 1, 256]
    - [143, 0.0]
  - - [256, 3276, 1, 32]
    - [144, 0.0]
  - - [216, 4096, 1, 32]
    - [145, 0.0]
  - - [2048, 224, 1, 128]
    - [146, 0.0]
  - - [409, 203161, 1, 32]
    - [147, 0.0]
  - - [4915, 102, 1, 32]
    - [148, 0.0]
  - - [409, 716, 1, 128]
    - [149, 0.0]
  - - [2048, 216, 1, 128]
    - [150, 0.0]
  - - [1024, 204, 1, 32]
    - [151, 0.0]
  - - [96, 4096, 1, 128]
    - [152, 0.0]
  - - [3584, 32, 1, 128]
    - [153, 0.0]
  - - [208, 2048, 1, 128]
    - [154, 0.0]
  - - [64, 2048, 1, 128]
    - [155, 0.0]
  - - [160, 1536, 1, 32]
    - [156, 0.0]
  - - [26214, 3686, 1, 32]
    - [157, 0.0]
  - - [128, 3072, 1, 128]
    - [158, 0.0]
  - - [409, 921, 1, 32]
    - [159, 0.0]
  - - [64, 5632, 1, 32]
    - [160, 0.0]
  - - [320, 512, 1, 128]
    - [161, 0.0]
  - - [16, 9216, 1, 32]
    - [162, 0.0]
  - - [40, 4096, 1, 128]
    - [163, 0.0]
  - - [832, 256, 1, 128]
    - [164, 0.0]
  - - [512, 64, 1, 32]
    - [165, 0.0]
  - - [1638, 102, 1, 128]
    - [166, 0.0]
  - - [1152, 128, 1, 32]
    - [167, 0.0]
  - - [160, 512, 1, 128]
    - [168, 0.0]
  - - [3072, 128, 1, 32]
    - [169, 0.0]
  - - [1024, 144, 1, 32]
    - [170, 0.0]
  - - [4608, 160, 1, 32]
    - [171, 0.0]
  - - [512, 409, 1, 32]
    - [172, 0.0]
  - - [409, 512, 1, 32]
    - [173, 0.0]
  - - [176, 3072, 1, 32]
    - [174, 0.0]
  - - [3072, 160, 1, 32]
    - [175, 0.0]
  - - [12288, 3712, 1, 256]
    - [176, 0.0]
  - - [384, 1664, 1, 32]
    - [177, 0.0]
  - - [819, 153, 1, 128]
    - [178, 0.0]
  - - [131072, 819, 1, 32]
    - [179, 0.0]
  - - [1638, 55705, 1, 32]
    - [180, 0.0]
  - - [7936, 8192, 1, 128]
    - [181, 0.0]
  - - [1228, 45875, 1, 128]
    - [182, 0.0]
  - - [128, 176947, 1, 16384]
    - [183, 0.0]
  - - [31129, 1638, 1, 128]
    - [184, 0.0]
  - - [460, 209715, 1, 32]
    - [185, 0.0]
  - - [8192, 7680, 1, 128]
    - [186, 0.0]
  - - [7782, 6553, 1, 128]
    - [187, 0.0]
  - - [460, 104857, 1, 128]
    - [188, 0.0]
  - - [2048, 26624, 1, 128]
    - [189, 0.0]
  - - [1024, 32256, 1, 256]
    - [190, 0.0]
  - - [409, 131072, 1, 32]
    - [191, 0.0]
  - - [157286, 358, 1, 32]
    - [192, 0.0]
  - - [176947, 128, 1, 16384]
    - [193, 0.0]
  - - [8192, 10240, 1, 32]
    - [194, 0.0]
  - - [256, 314572, 1, 32]
    - [195, 0.0]
  - - [256, 294912, 1, 32]
    - [196, 0.0]
  - - [6144, 12288, 1, 32]
    - [197, 0.0]
  - - [1638, 26214, 1, 128]
    - [198, 0.0]
  - - [114688, 384, 1, 128]
    - [199, 0.0]
  - - [371, 104857, 1, 128]
    - [200, 0.0]
  - - [384, 106496, 1, 128]
    - [201, 0.0]
  - - [793, 39321, 1, 128]
    - [202, 0.0]
  - - [102, 132710, 1, 16384]
    - [203, 0.0]
  - - [8192, 5120, 1, 128]
    - [204, 0.0]
  - - [209715, 256, 1, 32]
    - [205, 0.0]
  - - [128, 524288, 1, 32]
    - [206, 0.0]
  - - [6553, 4915, 1, 128]
    - [207, 0.0]
  - - [458752, 128, 1, 32]
    - [208, 0.0]
  - - [5120, 6144, 1, 128]
    - [209, 0.0]
  - - [307, 85196, 1, 128]
    - [210, 0.0]
  - - [13312, 2304, 1, 128]
    - [211, 0.0]
  - - [176947, 128, 1, 8192]
    - [212, 0.0]
  - - [288, 172032, 1, 32]
    - [213, 0.0]
  - - [26624, 1152, 1, 128]
    - [214, 0.0]
  - - [3712, 8192, 1, 128]
    - [215, 0.0]
  - - [16384, 3328, 1, 32]
    - [216, 0.0]
  - - [3200, 16384, 1, 32]
    - [217, 0.0]
  - - [742, 52428, 1, 32]
    - [218, 0.0]
  - - [98304, 640, 1, 32]
    - [219, 0.0]
  - - [307, 131072, 1, 32]
    - [220, 0.0]
  - - [1024, 53248, 1, 32]
    - [221, 0.0]
  - - [42598, 102, 1, 8192]
    - [222, 0.0]
  - - [212992, 128, 1, 128]
    - [223, 0.0]
  - - [6144, 9216, 1, 32]
    - [224, 0.0]
  - - [3891, 4915, 1, 128]
    - [225, 0.0]
  - - [998, 19660, 1, 128]
    - [226, 0.0]
  - - [256, 196608, 1, 32]
    - [227, 0.0]
  - - [235929, 128, 1, 32]
    - [228, 0.0]
  - - [114688, 384, 1, 32]
    - [229, 0.0]
  - - [320, 110592, 1, 32]
    - [230, 0.0]
  - - [57344, 672, 1, 32]
    - [231, 0.0]
  - - [128, 344064, 1, 32]
    - [232, 0.0]
  - - [44236, 102, 1, 8192]
    - [233, 0.0]
  - - [2304, 10240, 1, 128]
    - [234, 0.0]
  - - [6400, 6144, 1, 32]
    - [235, 0.0]
  - - [91750, 307, 1, 32]
    - [236, 0.0]
  - - [614, 58982, 1, 32]
    - [237, 0.0]
  - - [141312, 128, 1, 128]
    - [238, 0.0]
  - - [204, 157286, 1, 32]
    - [239, 0.0]
  - - [33792, 1280, 1, 32]
    - [240, 0.0]
  - - [3712, 12288, 1, 32]
    - [241, 0.0]
  - - [307200, 128, 1, 32]
    - [242, 0.0]
  - - [245760, 128, 1, 32]
    - [243, 0.0]
  - - [768, 327680, 1, 32]
    - [244, 0.0]
  - - [2048, 23808, 1, 32]
    - [245, 0.0]
  - - [49152, 672, 1, 32]
    - [246, 0.0]
  - - [4608, 9216, 1, 32]
    - [247, 0.0]
  - - [12288, 2688, 1, 32]
    - [248, 0.0]
  - - [15360, 2560, 1, 32]
    - [249, 0.0]
  - - [270336, 128, 1, 32]
    - [250, 0.0]
  - - [262144, 128, 1, 32]
    - [251, 0.0]
  - - [844, 13107, 1, 256]
    - [252, 0.0]
  - - [819, 38092, 1, 32]
    - [253, 0.0]
- null
- null
- DeviceEfficiency
- Equality
