projects/hipblaslt/library/src/amd_detail/rocblaslt/src/Tensile/Logic/asm_full/aquavanjaram/gfx942_228cu/StreamK/aquavanjaram942_Cijk_Alik_Bjlk_B8F8NSS_BH_Bias_HAS_SAV_UserArgs.yaml
- {MinimumRequiredVersion: 4.33.0}
- aquavanjaram942
- {Architecture: gfx942, CUCount: 228}
- [Device 0049, Device 0050]
    SolutionIndex: 0
    SolutionNameMin: Cijk_Alik_Bjlk_B8F8NSS_BH_Bias_HAS_SAV_UserArgs_MT256x256x64_MI16x16x1_SN_LDSB1_CLR1_GRVWA8_GRVWB16_GSU0_GSUC0_GSUWGMRR0_K1_LBSPPA512_LBSPPB2048_LPA8_LPB0_LRVW8_MIWT8_8_PLR1_SU0_SUM0_SUS64_VWA8_VWB8_WGM1_WGMXCC1_WGMXCCGn1
    SolutionIndex: 1
    SolutionNameMin: Cijk_Alik_Bjlk_B8F8NSS_BH_Bias_HAS_SAV_UserArgs_MT256x256x64_MI16x16x1_SN_LDSB1_CLR1_GRVWA16_GRVWB16_GSU0_GSUC0_GSUWGMRR0_K1_LBSPPA512_LBSPPB2048_LPA16_LPB0_LRVW8_MIWT8_8_PLR1_SU0_SUM0_SUS64_VWA8_VWB8_WGM1_WGMXCC1_WGMXCCGn1
    SolutionIndex: 2
    SolutionNameMin: Cijk_Alik_Bjlk_B8F8NSS_BH_Bias_HAS_SAV_UserArgs_MT256x256x64_MI16x16x1_SN_LDSB1_CLR1_GRVWA8_GRVWB16_GSU0_GSUC0_GSUWGMRR0_K1_LBSPPA512_LBSPPB2048_LPA8_LPB0_LRVW8_MIWT8_8_PLR1_SU0_SUM0_SUS64_VWA8_VWB8_WGM4_WGMXCC1_WGMXCCGn1
    SolutionIndex: 3
    SolutionNameMin: Cijk_Alik_Bjlk_B8F8NSS_BH_Bias_HAS_SAV_UserArgs_MT128x256x64_MI16x16x1_SN_LDSB1_CLR1_GRVWA16_GRVWB8_GSU0_GSUC0_GSUWGMRR0_K1_LBSPPA256_LBSPPB2048_LPA16_LPB0_LRVW8_MIWT4_8_PLR1_SU0_SUM0_SUS64_VWA4_VWB8_WGM1_WGMXCC1_WGMXCCGn1
    SolutionIndex: 4
    SolutionNameMin: Cijk_Alik_Bjlk_B8F8NSS_BH_Bias_HAS_SAV_UserArgs_MT128x256x64_MI16x16x1_SN_LDSB1_CLR1_GRVWA8_GRVWB16_GSU0_GSUC0_GSUWGMRR0_K1_LBSPPA256_LBSPPB2048_LPA8_LPB0_LRVW8_MIWT4_8_PLR1_SU0_SUM0_SUS64_VWA4_VWB8_WGM1_WGMXCC1_WGMXCCGn1
    SolutionIndex: 5
    SolutionNameMin: Cijk_Alik_Bjlk_B8F8NSS_BH_Bias_HAS_SAV_UserArgs_MT128x256x64_MI16x16x1_SN_LDSB1_CLR1_GRVWA16_GRVWB16_GSU0_GSUC0_GSUWGMRR0_K1_LBSPPA256_LBSPPB2048_LPA16_LPB0_LRVW8_MIWT4_8_PLR1_SU0_SUM0_SUS64_VWA4_VWB8_WGM1_WGMXCC1_WGMXCCGn1
    SolutionIndex: 6
    SolutionNameMin: Cijk_Alik_Bjlk_B8F8NSS_BH_Bias_HAS_SAV_UserArgs_MT128x256x64_MI16x16x1_SN_LDSB1_CLR1_GRVWA8_GRVWB8_GSU0_GSUC0_GSUWGMRR0_K1_LBSPPA256_LBSPPB2048_LPA8_LPB0_LRVW8_MIWT4_8_PLR1_SU0_SUM0_SUS64_VWA4_VWB8_WGM4_WGMXCC1_WGMXCCGn1
    SolutionIndex: 7
    SolutionNameMin: Cijk_Alik_Bjlk_B8F8NSS_BH_Bias_HAS_SAV_UserArgs_MT128x256x64_MI16x16x1_SN_LDSB1_CLR1_GRVWA16_GRVWB16_GSU0_GSUC0_GSUWGMRR0_K1_LBSPPA256_LBSPPB2048_LPA16_LPB0_LRVW8_MIWT4_8_PLR1_SU0_SUM0_SUS64_VWA4_VWB8_WGM4_WGMXCC1_WGMXCCGn1
    SolutionIndex: 8
    SolutionNameMin: Cijk_Alik_Bjlk_B8F8NSS_BH_Bias_HAS_SAV_UserArgs_MT128x256x64_MI16x16x1_SN_LDSB1_CLR1_GRVWA16_GRVWB8_GSU0_GSUC0_GSUWGMRR0_K1_LBSPPA256_LBSPPB2048_LPA16_LPB0_LRVW8_MIWT4_8_PLR1_SU0_SUM0_SUS64_VWA4_VWB8_WGM6_WGMXCC1_WGMXCCGn1
    SolutionIndex: 9
    SolutionNameMin: Cijk_Alik_Bjlk_B8F8NSS_BH_Bias_HAS_SAV_UserArgs_MT128x256x64_MI16x16x1_SN_LDSB1_CLR1_GRVWA8_GRVWB16_GSU0_GSUC0_GSUWGMRR0_K1_LBSPPA256_LBSPPB2048_LPA8_LPB0_LRVW8_MIWT4_8_PLR1_SU0_SUM0_SUS64_VWA4_VWB8_WGM6_WGMXCC1_WGMXCCGn1
    SolutionIndex: 10
    SolutionNameMin: Cijk_Alik_Bjlk_B8F8NSS_BH_Bias_HAS_SAV_UserArgs_MT128x256x64_MI16x16x1_SN_LDSB1_CLR1_GRVWA16_GRVWB16_GSU0_GSUC0_GSUWGMRR0_K1_LBSPPA256_LBSPPB2048_LPA16_LPB0_LRVW8_MIWT4_8_PLR1_SU0_SUM0_SUS64_VWA4_VWB8_WGM6_WGMXCC1_WGMXCCGn1
    SolutionIndex: 11
    SolutionNameMin: Cijk_Alik_Bjlk_B8F8NSS_BH_Bias_HAS_SAV_UserArgs_MT256x128x64_MI16x16x1_SN_LDSB1_CLR1_GRVWA16_GRVWB8_GSU0_GSUC0_GSUWGMRR0_K1_LBSPPA512_LBSPPB1024_LPA16_LPB64_LRVW8_MIWT8_4_PLR1_SU0_SUM0_SUS64_VWA8_VWB4_WGM1_WGMXCC1_WGMXCCGn1
    SolutionIndex: 12
    SolutionNameMin: Cijk_Alik_Bjlk_B8F8NSS_BH_Bias_HAS_SAV_UserArgs_MT256x128x64_MI16x16x1_SN_LDSB1_CLR1_GRVWA16_GRVWB16_GSU0_GSUC0_GSUWGMRR0_K1_LBSPPA512_LBSPPB1024_LPA16_LPB64_LRVW8_MIWT8_4_PLR1_SU0_SUM0_SUS64_VWA8_VWB4_WGM1_WGMXCC1_WGMXCCGn1
    SolutionIndex: 13
    SolutionNameMin: Cijk_Alik_Bjlk_B8F8NSS_BH_Bias_HAS_SAV_UserArgs_MT256x128x64_MI16x16x1_SN_LDSB1_CLR1_GRVWA8_GRVWB16_GSU0_GSUC0_GSUWGMRR0_K1_LBSPPA512_LBSPPB1024_LPA8_LPB64_LRVW8_MIWT8_4_PLR1_SU0_SUM0_SUS64_VWA8_VWB4_WGM8_WGMXCC1_WGMXCCGn1
    SolutionIndex: 14
    SolutionNameMin: Cijk_Alik_Bjlk_B8F8NSS_BH_Bias_HAS_SAV_UserArgs_MT64x128x64_MI16x16x1_SN_LDSB0_CLR1_GRVWA8_GRVWB8_GSU0_GSUC0_GSUWGMRR0_K1_LBSPPA128_LBSPPB1024_LPA8_LPB0_LRVW8_MIWT1_8_PLR1_SU0_SUM0_SUS64_VWA1_VWB8_WGM8_WGMXCC1_WGMXCCGn1
    SolutionIndex: 15
    SolutionNameMin: Cijk_Alik_Bjlk_B8F8NSS_BH_Bias_HAS_SAV_UserArgs_MT128x128x64_MI16x16x1_SN_LDSB1_CLR1_GRVWA8_GRVWB8_GSU0_GSUC0_GSUWGMRR0_K1_LBSPPA256_LBSPPB1024_LPA8_LPB64_LRVW8_MIWT4_4_PLR1_SU0_SUM0_SUS64_VWA4_VWB4_WGM1_WGMXCC1_WGMXCCGn1
    SolutionIndex: 16
    SolutionNameMin: Cijk_Alik_Bjlk_B8F8NSS_BH_Bias_HAS_SAV_UserArgs_MT128x128x64_MI16x16x1_SN_LDSB1_CLR1_GRVWA16_GRVWB8_GSU0_GSUC0_GSUWGMRR0_K1_LBSPPA256_LBSPPB1024_LPA16_LPB64_LRVW8_MIWT4_4_PLR1_SU0_SUM0_SUS64_VWA4_VWB4_WGM1_WGMXCC1_WGMXCCGn1
    SolutionIndex: 17
    SolutionNameMin: Cijk_Alik_Bjlk_B8F8NSS_BH_Bias_HAS_SAV_UserArgs_MT128x128x64_MI16x16x1_SN_LDSB1_CLR1_GRVWA8_GRVWB16_GSU0_GSUC0_GSUWGMRR0_K1_LBSPPA256_LBSPPB1024_LPA8_LPB64_LRVW8_MIWT4_4_PLR1_SU0_SUM0_SUS64_VWA4_VWB4_WGM1_WGMXCC1_WGMXCCGn1
    SolutionIndex: 18
    SolutionNameMin: Cijk_Alik_Bjlk_B8F8NSS_BH_Bias_HAS_SAV_UserArgs_MT128x128x64_MI16x16x1_SN_LDSB1_CLR1_GRVWA16_GRVWB16_GSU0_GSUC0_GSUWGMRR0_K1_LBSPPA256_LBSPPB1024_LPA16_LPB64_LRVW8_MIWT4_4_PLR1_SU0_SUM0_SUS64_VWA4_VWB4_WGM1_WGMXCC1_WGMXCCGn1
    SolutionIndex: 19
    SolutionNameMin: Cijk_Alik_Bjlk_B8F8NSS_BH_Bias_HAS_SAV_UserArgs_MT128x128x64_MI16x16x1_SN_LDSB1_CLR1_GRVWA16_GRVWB16_GSU0_GSUC0_GSUWGMRR0_K1_LBSPPA256_LBSPPB1024_LPA16_LPB64_LRVW8_MIWT4_4_PLR1_SU0_SUM0_SUS64_VWA4_VWB4_WGM4_WGMXCC1_WGMXCCGn1
    SolutionIndex: 20
    SolutionNameMin: Cijk_Alik_Bjlk_B8F8NSS_BH_Bias_HAS_SAV_UserArgs_MT128x128x64_MI16x16x1_SN_LDSB1_CLR1_GRVWA16_GRVWB16_GSU0_GSUC0_GSUWGMRR0_K1_LBSPPA256_LBSPPB1024_LPA16_LPB64_LRVW8_MIWT4_4_PLR1_SU0_SUM0_SUS64_VWA4_VWB4_WGM6_WGMXCC1_WGMXCCGn1
    SolutionIndex: 21
    SolutionNameMin: Cijk_Alik_Bjlk_B8F8NSS_BH_Bias_HAS_SAV_UserArgs_MT128x128x64_MI16x16x1_SN_LDSB1_CLR1_GRVWA16_GRVWB16_GSU0_GSUC0_GSUWGMRR0_K1_LBSPPA256_LBSPPB1024_LPA16_LPB64_LRVW8_MIWT4_4_PLR1_SU0_SUM0_SUS64_VWA4_VWB4_WGM8_WGMXCC1_WGMXCCGn1
    SolutionIndex: 22
    SolutionNameMin: Cijk_Alik_Bjlk_B8F8NSS_BH_Bias_HAS_SAV_UserArgs_MT128x64x64_MI16x16x1_SN_LDSB0_CLR1_GRVWA8_GRVWB8_GSU0_GSUC0_GSUWGMRR0_K1_LBSPPA256_LBSPPB512_LPA8_LPB32_LRVW8_MIWT4_2_PLR1_SU0_SUM0_SUS64_VWA4_VWB2_WGM1_WGMXCC1_WGMXCCGn1
    SolutionIndex: 23
    SolutionNameMin: Cijk_Alik_Bjlk_B8F8NSS_BH_Bias_HAS_SAV_UserArgs_MT128x64x64_MI16x16x1_SN_LDSB0_CLR1_GRVWA16_GRVWB8_GSU0_GSUC0_GSUWGMRR0_K1_LBSPPA256_LBSPPB512_LPA16_LPB32_LRVW8_MIWT4_2_PLR1_SU0_SUM0_SUS64_VWA4_VWB2_WGM1_WGMXCC1_WGMXCCGn1
    SolutionIndex: 24
    SolutionNameMin: Cijk_Alik_Bjlk_B8F8NSS_BH_Bias_HAS_SAV_UserArgs_MT128x64x64_MI16x16x1_SN_LDSB0_CLR1_GRVWA8_GRVWB16_GSU0_GSUC0_GSUWGMRR0_K1_LBSPPA256_LBSPPB512_LPA8_LPB32_LRVW8_MIWT4_2_PLR1_SU0_SUM0_SUS64_VWA4_VWB2_WGM1_WGMXCC1_WGMXCCGn1
    SolutionIndex: 25
    SolutionNameMin: Cijk_Alik_Bjlk_B8F8NSS_BH_Bias_HAS_SAV_UserArgs_MT128x64x64_MI16x16x1_SN_LDSB0_CLR1_GRVWA16_GRVWB16_GSU0_GSUC0_GSUWGMRR0_K1_LBSPPA256_LBSPPB512_LPA16_LPB32_LRVW8_MIWT4_2_PLR1_SU0_SUM0_SUS64_VWA4_VWB2_WGM1_WGMXCC1_WGMXCCGn1
    SolutionIndex: 26
    SolutionNameMin: Cijk_Alik_Bjlk_B8F8NSS_BH_Bias_HAS_SAV_UserArgs_MT128x64x64_MI16x16x1_SN_LDSB0_CLR1_GRVWA8_GRVWB8_GSU0_GSUC0_GSUWGMRR0_K1_LBSPPA256_LBSPPB512_LPA8_LPB32_LRVW8_MIWT4_2_PLR1_SU0_SUM0_SUS64_VWA4_VWB2_WGM4_WGMXCC1_WGMXCCGn1
    SolutionIndex: 27
    SolutionNameMin: Cijk_Alik_Bjlk_B8F8NSS_BH_Bias_HAS_SAV_UserArgs_MT128x64x64_MI16x16x1_SN_LDSB0_CLR1_GRVWA8_GRVWB16_GSU0_GSUC0_GSUWGMRR0_K1_LBSPPA256_LBSPPB512_LPA8_LPB32_LRVW8_MIWT4_2_PLR1_SU0_SUM0_SUS64_VWA4_VWB2_WGM4_WGMXCC1_WGMXCCGn1
    SolutionIndex: 28
    SolutionNameMin: Cijk_Alik_Bjlk_B8F8NSS_BH_Bias_HAS_SAV_UserArgs_MT128x64x64_MI16x16x1_SN_LDSB0_CLR1_GRVWA8_GRVWB16_GSU0_GSUC0_GSUWGMRR0_K1_LBSPPA256_LBSPPB512_LPA8_LPB32_LRVW8_MIWT4_2_PLR1_SU0_SUM0_SUS64_VWA4_VWB2_WGM6_WGMXCC1_WGMXCCGn1
    SolutionIndex: 29
    SolutionNameMin: Cijk_Alik_Bjlk_B8F8NSS_BH_Bias_HAS_SAV_UserArgs_MT128x64x64_MI16x16x1_SN_LDSB0_CLR1_GRVWA8_GRVWB8_GSU0_GSUC0_GSUWGMRR0_K1_LBSPPA256_LBSPPB512_LPA8_LPB32_LRVW8_MIWT4_2_PLR1_SU0_SUM0_SUS64_VWA4_VWB2_WGM8_WGMXCC1_WGMXCCGn1
    SolutionIndex: 30
    SolutionNameMin: Cijk_Alik_Bjlk_B8F8NSS_BH_Bias_HAS_SAV_UserArgs_MT128x64x64_MI16x16x1_SN_LDSB0_CLR1_GRVWA16_GRVWB8_GSU0_GSUC0_GSUWGMRR0_K1_LBSPPA256_LBSPPB512_LPA16_LPB32_LRVW8_MIWT4_2_PLR1_SU0_SUM0_SUS64_VWA4_VWB2_WGM8_WGMXCC1_WGMXCCGn1
    SolutionIndex: 31
    SolutionNameMin: Cijk_Alik_Bjlk_B8F8NSS_BH_Bias_HAS_SAV_UserArgs_MT128x64x64_MI16x16x1_SN_LDSB0_CLR1_GRVWA8_GRVWB16_GSU0_GSUC0_GSUWGMRR0_K1_LBSPPA256_LBSPPB512_LPA8_LPB32_LRVW8_MIWT4_2_PLR1_SU0_SUM0_SUS64_VWA4_VWB2_WGM8_WGMXCC1_WGMXCCGn1
    SolutionIndex: 32
    SolutionNameMin: Cijk_Alik_Bjlk_B8F8NSS_BH_Bias_HAS_SAV_UserArgs_MT128x32x64_MI16x16x1_SN_LDSB0_CLR1_GRVWA16_GRVWB8_GSU0_GSUC0_GSUWGMRR0_K1_LBSPPA256_LBSPPB256_LPA16_LPB16_LRVW8_MIWT4_1_PLR1_SU0_SUM0_SUS64_VWA4_VWB1_WGM1_WGMXCC1_WGMXCCGn1
    SolutionIndex: 33
    SolutionNameMin: Cijk_Alik_Bjlk_B8F8NSS_BH_Bias_HAS_SAV_UserArgs_MT64x64x64_MI16x16x1_SN_LDSB0_CLR1_GRVWA8_GRVWB8_GSU0_GSUC0_GSUWGMRR0_K1_LBSPPA128_LBSPPB512_LPA8_LPB32_LRVW8_MIWT2_2_PLR1_SU0_SUM0_SUS64_VWA2_VWB2_WGM1_WGMXCC1_WGMXCCGn1
    SolutionIndex: 34
    SolutionNameMin: Cijk_Alik_Bjlk_B8F8NSS_BH_Bias_HAS_SAV_UserArgs_MT64x64x64_MI16x16x1_SN_LDSB0_CLR1_GRVWA16_GRVWB8_GSU0_GSUC0_GSUWGMRR0_K1_LBSPPA128_LBSPPB512_LPA16_LPB32_LRVW8_MIWT2_2_PLR1_SU0_SUM0_SUS64_VWA2_VWB2_WGM1_WGMXCC1_WGMXCCGn1
    SolutionIndex: 35
    SolutionNameMin: Cijk_Alik_Bjlk_B8F8NSS_BH_Bias_HAS_SAV_UserArgs_MT64x64x64_MI16x16x1_SN_LDSB0_CLR1_GRVWA8_GRVWB8_GSU0_GSUC0_GSUWGMRR0_K1_LBSPPA128_LBSPPB512_LPA8_LPB32_LRVW8_MIWT2_2_PLR1_SU0_SUM0_SUS64_VWA2_VWB2_WGM4_WGMXCC1_WGMXCCGn1
    SolutionIndex: 36
    SolutionNameMin: Cijk_Alik_Bjlk_B8F8NSS_BH_Bias_HAS_SAV_UserArgs_MT64x64x64_MI16x16x1_SN_LDSB0_CLR1_GRVWA16_GRVWB8_GSU0_GSUC0_GSUWGMRR0_K1_LBSPPA128_LBSPPB512_LPA16_LPB32_LRVW8_MIWT2_2_PLR1_SU0_SUM0_SUS64_VWA2_VWB2_WGM6_WGMXCC1_WGMXCCGn1
    SolutionIndex: 37
    SolutionNameMin: Cijk_Alik_Bjlk_B8F8NSS_BH_Bias_HAS_SAV_UserArgs_MT64x64x64_MI16x16x1_SN_LDSB0_CLR1_GRVWA8_GRVWB8_GSU0_GSUC0_GSUWGMRR0_K1_LBSPPA128_LBSPPB512_LPA8_LPB32_LRVW8_MIWT2_2_PLR1_SU0_SUM0_SUS64_VWA2_VWB2_WGM8_WGMXCC1_WGMXCCGn1
    SolutionIndex: 38
    SolutionNameMin: Cijk_Alik_Bjlk_B8F8NSS_BH_Bias_HAS_SAV_UserArgs_MT32x64x64_MI16x16x1_SN_LDSB0_CLR1_GRVWA8_GRVWB8_GSU0_GSUC0_GSUWGMRR0_K1_LBSPPA128_LBSPPB512_LPA8_LPB32_LRVW8_MIWT1_2_PLR1_SU0_SUM0_SUS64_VWA1_VWB2_WGM1_WGMXCC1_WGMXCCGn1
    SolutionIndex: 39
    SolutionNameMin: Cijk_Alik_Bjlk_B8F8NSS_BH_Bias_HAS_SAV_UserArgs_MT64x32x64_MI16x16x1_SN_LDSB0_CLR1_GRVWA8_GRVWB8_GSU0_GSUC0_GSUWGMRR0_K1_LBSPPA128_LBSPPB256_LPA8_LPB16_LRVW8_MIWT2_1_PLR1_SU0_SUM0_SUS64_VWA2_VWB1_WGM1_WGMXCC1_WGMXCCGn1
    SolutionIndex: 40
    SolutionNameMin: Cijk_Alik_Bjlk_B8F8NSS_BH_Bias_HAS_SAV_UserArgs_MT32x32x64_MI16x16x1_SN_LDSB0_CLR1_GRVWA8_GRVWB8_GSU0_GSUC0_GSUWGMRR0_K1_LBSPPA128_LBSPPB256_LPA8_LPB16_LRVW8_MIWT1_1_PLR1_SU0_SUM0_SUS64_VWA1_VWB1_WGM1_WGMXCC1_WGMXCCGn1
    SolutionIndex: 41
    SolutionNameMin: Cijk_Alik_Bjlk_B8F8NSS_BH_Bias_HAS_SAV_UserArgs_MT32x32x64_MI16x16x1_SN_LDSB0_CLR1_GRVWA8_GRVWB8_GSU0_GSUC0_GSUWGMRR0_K1_LBSPPA128_LBSPPB256_LPA8_LPB16_LRVW8_MIWT1_1_PLR1_SU0_SUM0_SUS64_VWA1_VWB1_WGM8_WGMXCC1_WGMXCCGn1
    SolutionIndex: 42
    SolutionNameMin: Cijk_Alik_Bjlk_B8F8NSS_BH_Bias_HAS_SAV_UserArgs_MT128x256x128_MI16x16x1_SN_LDSB1_CLR1_GRVWA8_GRVWB16_GSU0_GSUC0_GSUWGMRR0_K1_LBSPPA512_LBSPPB2048_LPA8_LPB0_LRVW8_MIWT4_8_PLR1_SU0_SUM0_SUS128_VWA4_VWB8_WGM1_WGMXCC1_WGMXCCGn1
    SolutionIndex: 43
    SolutionNameMin: Cijk_Alik_Bjlk_B8F8NSS_BH_Bias_HAS_SAV_UserArgs_MT128x256x128_MI16x16x1_SN_LDSB1_CLR1_GRVWA8_GRVWB16_GSU0_GSUC0_GSUWGMRR0_K1_LBSPPA512_LBSPPB2048_LPA8_LPB0_LRVW8_MIWT4_8_PLR1_SU0_SUM0_SUS128_VWA4_VWB8_WGM4_WGMXCC1_WGMXCCGn1
    SolutionIndex: 44
    SolutionNameMin: Cijk_Alik_Bjlk_B8F8NSS_BH_Bias_HAS_SAV_UserArgs_MT128x256x128_MI16x16x1_SN_LDSB1_CLR1_GRVWA8_GRVWB16_GSU0_GSUC0_GSUWGMRR0_K1_LBSPPA512_LBSPPB2048_LPA8_LPB0_LRVW8_MIWT4_8_PLR1_SU0_SUM0_SUS128_VWA4_VWB8_WGM6_WGMXCC1_WGMXCCGn1
    SolutionIndex: 45
    SolutionNameMin: Cijk_Alik_Bjlk_B8F8NSS_BH_Bias_HAS_SAV_UserArgs_MT128x256x128_MI16x16x1_SN_LDSB1_CLR1_GRVWA8_GRVWB16_GSU0_GSUC0_GSUWGMRR0_K1_LBSPPA512_LBSPPB2048_LPA8_LPB0_LRVW8_MIWT4_8_PLR1_SU0_SUM0_SUS128_VWA4_VWB8_WGM8_WGMXCC1_WGMXCCGn1
    SolutionIndex: 46
    SolutionNameMin: Cijk_Alik_Bjlk_B8F8NSS_BH_Bias_HAS_SAV_UserArgs_MT256x128x128_MI16x16x1_SN_LDSB1_CLR1_GRVWA16_GRVWB16_GSU0_GSUC0_GSUWGMRR0_K1_LBSPPA1024_LBSPPB1024_LPA16_LPB64_LRVW8_MIWT8_4_PLR1_SU0_SUM0_SUS128_VWA8_VWB4_WGM1_WGMXCC1_WGMXCCGn1
    SolutionIndex: 47
    SolutionNameMin: Cijk_Alik_Bjlk_B8F8NSS_BH_Bias_HAS_SAV_UserArgs_MT144x256x128_MI16x16x1_SN_LDSB1_CLR1_GRVWA8_GRVWB8_GSU0_GSUC0_GSUWGMRR0_K1_LBSPPA128_LBSPPB2048_LPA8_LPB64_LRVW8_MIWT9_4_PLR1_SU0_SUM0_SUS128_VWA1_VWB4_WGM1_WGMXCC1_WGMXCCGn1
    SolutionIndex: 48
    SolutionNameMin: Cijk_Alik_Bjlk_B8F8NSS_BH_Bias_HAS_SAV_UserArgs_MT144x256x128_MI16x16x1_SN_LDSB1_CLR1_GRVWA8_GRVWB16_GSU0_GSUC0_GSUWGMRR0_K1_LBSPPA128_LBSPPB2048_LPA8_LPB64_LRVW8_MIWT9_4_PLR1_SU0_SUM0_SUS128_VWA1_VWB4_WGM1_WGMXCC1_WGMXCCGn1
    SolutionIndex: 49
    SolutionNameMin: Cijk_Alik_Bjlk_B8F8NSS_BH_Bias_HAS_SAV_UserArgs_MT144x256x128_MI16x16x1_SN_LDSB1_CLR1_GRVWA8_GRVWB16_GSU0_GSUC0_GSUWGMRR0_K1_LBSPPA128_LBSPPB2048_LPA8_LPB64_LRVW8_MIWT9_4_PLR1_SU0_SUM0_SUS128_VWA1_VWB4_WGM4_WGMXCC1_WGMXCCGn1
    SolutionIndex: 50
    SolutionNameMin: Cijk_Alik_Bjlk_B8F8NSS_BH_Bias_HAS_SAV_UserArgs_MT144x256x128_MI16x16x1_SN_LDSB1_CLR1_GRVWA8_GRVWB8_GSU0_GSUC0_GSUWGMRR0_K1_LBSPPA128_LBSPPB2048_LPA8_LPB64_LRVW8_MIWT9_4_PLR1_SU0_SUM0_SUS128_VWA1_VWB4_WGM6_WGMXCC1_WGMXCCGn1
    SolutionIndex: 51
    SolutionNameMin: Cijk_Alik_Bjlk_B8F8NSS_BH_Bias_HAS_SAV_UserArgs_MT144x256x128_MI16x16x1_SN_LDSB1_CLR1_GRVWA8_GRVWB16_GSU0_GSUC0_GSUWGMRR0_K1_LBSPPA128_LBSPPB2048_LPA8_LPB64_LRVW8_MIWT9_4_PLR1_SU0_SUM0_SUS128_VWA1_VWB4_WGM6_WGMXCC1_WGMXCCGn1
    SolutionIndex: 52
    SolutionNameMin: Cijk_Alik_Bjlk_B8F8NSS_BH_Bias_HAS_SAV_UserArgs_MT144x256x128_MI16x16x1_SN_LDSB1_CLR1_GRVWA8_GRVWB16_GSU0_GSUC0_GSUWGMRR0_K1_LBSPPA128_LBSPPB2048_LPA8_LPB64_LRVW8_MIWT9_4_PLR1_SU0_SUM0_SUS128_VWA1_VWB4_WGM8_WGMXCC1_WGMXCCGn1
    SolutionIndex: 53
    SolutionNameMin: Cijk_Alik_Bjlk_B8F8NSS_BH_Bias_HAS_SAV_UserArgs_MT144x64x128_MI16x16x1_SN_LDSB1_CLR1_GRVWA8_GRVWB16_GSU0_GSUC0_GSUWGMRR0_K1_LBSPPA128_LBSPPB512_LPA8_LPB16_LRVW8_MIWT9_1_PLR1_SU0_SUM0_SUS128_VWA1_VWB1_WGM6_WGMXCC1_WGMXCCGn1
    SolutionIndex: 54
    SolutionNameMin: Cijk_Alik_Bjlk_B8F8NSS_BH_Bias_HAS_SAV_UserArgs_MT144x64x128_MI16x16x1_SN_LDSB1_CLR1_GRVWA8_GRVWB8_GSU0_GSUC0_GSUWGMRR0_K1_LBSPPA128_LBSPPB512_LPA8_LPB16_LRVW8_MIWT9_1_PLR1_SU0_SUM0_SUS128_VWA1_VWB1_WGM8_WGMXCC1_WGMXCCGn1
    SolutionIndex: 55
    SolutionNameMin: Cijk_Alik_Bjlk_B8F8NSS_BH_Bias_HAS_SAV_UserArgs_MT144x64x128_MI16x16x1_SN_LDSB1_CLR1_GRVWA8_GRVWB16_GSU0_GSUC0_GSUWGMRR0_K1_LBSPPA128_LBSPPB512_LPA8_LPB16_LRVW8_MIWT9_1_PLR1_SU0_SUM0_SUS128_VWA1_VWB1_WGM8_WGMXCC1_WGMXCCGn1
    SolutionIndex: 56
    SolutionNameMin: Cijk_Alik_Bjlk_B8F8NSS_BH_Bias_HAS_SAV_UserArgs_MT144x128x128_MI16x16x1_SN_LDSB1_CLR1_GRVWA8_GRVWB16_GSU0_GSUC0_GSUWGMRR0_K1_LBSPPA128_LBSPPB1024_LPA8_LPB32_LRVW8_MIWT9_2_PLR1_SU0_SUM0_SUS128_VWA1_VWB2_WGM4_WGMXCC1_WGMXCCGn1
    SolutionIndex: 57
    SolutionNameMin: Cijk_Alik_Bjlk_B8F8NSS_BH_Bias_HAS_SAV_UserArgs_MT144x128x128_MI16x16x1_SN_LDSB1_CLR1_GRVWA8_GRVWB8_GSU0_GSUC0_GSUWGMRR0_K1_LBSPPA128_LBSPPB1024_LPA8_LPB32_LRVW8_MIWT9_2_PLR1_SU0_SUM0_SUS128_VWA1_VWB2_WGM6_WGMXCC1_WGMXCCGn1
    SolutionIndex: 58
    SolutionNameMin: Cijk_Alik_Bjlk_B8F8NSS_BH_Bias_HAS_SAV_UserArgs_MT144x128x128_MI16x16x1_SN_LDSB1_CLR1_GRVWA8_GRVWB16_GSU0_GSUC0_GSUWGMRR0_K1_LBSPPA128_LBSPPB1024_LPA8_LPB32_LRVW8_MIWT9_2_PLR1_SU0_SUM0_SUS128_VWA1_VWB2_WGM6_WGMXCC1_WGMXCCGn1
    SolutionIndex: 59
    SolutionNameMin: Cijk_Alik_Bjlk_B8F8NSS_BH_Bias_HAS_SAV_UserArgs_MT144x128x128_MI16x16x1_SN_LDSB1_CLR1_GRVWA8_GRVWB16_GSU0_GSUC0_GSUWGMRR0_K1_LBSPPA128_LBSPPB1024_LPA8_LPB32_LRVW8_MIWT9_2_PLR1_SU0_SUM0_SUS128_VWA1_VWB2_WGM8_WGMXCC1_WGMXCCGn1
    SolutionIndex: 60
    SolutionNameMin: Cijk_Alik_Bjlk_B8F8NSS_BH_Bias_HAS_SAV_UserArgs_MT128x128x128_MI16x16x1_SN_LDSB1_CLR1_GRVWA16_GRVWB16_GSU0_GSUC0_GSUWGMRR0_K1_LBSPPA512_LBSPPB1024_LPA16_LPB64_LRVW8_MIWT4_4_PLR1_SU0_SUM0_SUS128_VWA4_VWB4_WGM1_WGMXCC1_WGMXCCGn1
    SolutionIndex: 61
    SolutionNameMin: Cijk_Alik_Bjlk_B8F8NSS_BH_Bias_HAS_SAV_UserArgs_MT128x128x128_MI16x16x1_SN_LDSB1_CLR1_GRVWA16_GRVWB16_GSU0_GSUC0_GSUWGMRR0_K1_LBSPPA512_LBSPPB1024_LPA16_LPB64_LRVW8_MIWT4_4_PLR1_SU0_SUM0_SUS128_VWA4_VWB4_WGM4_WGMXCC1_WGMXCCGn1
    SolutionIndex: 62
    SolutionNameMin: Cijk_Alik_Bjlk_B8F8NSS_BH_Bias_HAS_SAV_UserArgs_MT128x128x128_MI16x16x1_SN_LDSB1_CLR1_GRVWA16_GRVWB16_GSU0_GSUC0_GSUWGMRR0_K1_LBSPPA512_LBSPPB1024_LPA16_LPB64_LRVW8_MIWT4_4_PLR1_SU0_SUM0_SUS128_VWA4_VWB4_WGM6_WGMXCC1_WGMXCCGn1
    SolutionIndex: 63
    SolutionNameMin: Cijk_Alik_Bjlk_B8F8NSS_BH_Bias_HAS_SAV_UserArgs_MT128x128x128_MI16x16x1_SN_LDSB1_CLR1_GRVWA16_GRVWB16_GSU0_GSUC0_GSUWGMRR0_K1_LBSPPA512_LBSPPB1024_LPA16_LPB64_LRVW8_MIWT4_4_PLR1_SU0_SUM0_SUS128_VWA4_VWB4_WGM8_WGMXCC1_WGMXCCGn1
    SolutionIndex: 64
    SolutionNameMin: Cijk_Alik_Bjlk_B8F8NSS_BH_Bias_HAS_SAV_UserArgs_MT64x128x128_MI16x16x1_SN_LDSB1_CLR1_GRVWA8_GRVWB16_GSU0_GSUC0_GSUWGMRR0_K1_LBSPPA256_LBSPPB1024_LPA8_LPB64_LRVW8_MIWT2_4_PLR1_SU0_SUM0_SUS128_VWA2_VWB4_WGM1_WGMXCC1_WGMXCCGn1
    SolutionIndex: 65
    SolutionNameMin: Cijk_Alik_Bjlk_B8F8NSS_BH_Bias_HAS_SAV_UserArgs_MT128x64x128_MI16x16x1_SN_LDSB1_CLR1_GRVWA16_GRVWB16_GSU0_GSUC0_GSUWGMRR0_K1_LBSPPA512_LBSPPB512_LPA16_LPB32_LRVW8_MIWT4_2_PLR1_SU0_SUM0_SUS128_VWA4_VWB2_WGM6_WGMXCC1_WGMXCCGn1
    SolutionIndex: 66
    SolutionNameMin: Cijk_Alik_Bjlk_B8F8NSS_BH_Bias_HAS_SAV_UserArgs_MT64x64x128_MI16x16x1_SN_LDSB1_CLR1_GRVWA8_GRVWB16_GSU0_GSUC0_GSUWGMRR0_K1_LBSPPA256_LBSPPB512_LPA8_LPB32_LRVW8_MIWT2_2_PLR1_SU0_SUM0_SUS128_VWA2_VWB2_WGM1_WGMXCC1_WGMXCCGn1
    SolutionIndex: 67
    SolutionNameMin: Cijk_Alik_Bjlk_B8F8NSS_BH_Bias_HAS_SAV_UserArgs_MT64x64x128_MI16x16x1_SN_LDSB1_CLR1_GRVWA16_GRVWB16_GSU0_GSUC0_GSUWGMRR0_K1_LBSPPA256_LBSPPB512_LPA16_LPB32_LRVW8_MIWT2_2_PLR1_SU0_SUM0_SUS128_VWA2_VWB2_WGM1_WGMXCC1_WGMXCCGn1
    SolutionIndex: 68
    SolutionNameMin: Cijk_Alik_Bjlk_B8F8NSS_BH_Bias_HAS_SAV_UserArgs_MT64x64x128_MI16x16x1_SN_LDSB1_CLR1_GRVWA8_GRVWB16_GSU0_GSUC0_GSUWGMRR0_K1_LBSPPA256_LBSPPB512_LPA8_LPB32_LRVW8_MIWT2_2_PLR1_SU0_SUM0_SUS128_VWA2_VWB2_WGM4_WGMXCC1_WGMXCCGn1
    SolutionIndex: 69
    SolutionNameMin: Cijk_Alik_Bjlk_B8F8NSS_BH_Bias_HAS_SAV_UserArgs_MT64x64x128_MI16x16x1_SN_LDSB1_CLR1_GRVWA8_GRVWB16_GSU0_GSUC0_GSUWGMRR0_K1_LBSPPA256_LBSPPB512_LPA8_LPB32_LRVW8_MIWT2_2_PLR1_SU0_SUM0_SUS128_VWA2_VWB2_WGM8_WGMXCC1_WGMXCCGn1
    SolutionIndex: 70
    SolutionNameMin: Cijk_Alik_Bjlk_B8F8NSS_BH_Bias_HAS_SAV_UserArgs_MT32x64x128_MI16x16x1_SN_LDSB0_CLR1_GRVWA16_GRVWB8_GSU0_GSUC0_GSUWGMRR0_K1_LBSPPA128_LBSPPB512_LPA16_LPB32_LRVW8_MIWT1_2_PLR1_SU0_SUM0_SUS128_VWA1_VWB2_WGM1_WGMXCC1_WGMXCCGn1
    SolutionIndex: 71
    SolutionNameMin: Cijk_Alik_Bjlk_B8F8NSS_BH_Bias_HAS_SAV_UserArgs_MT32x64x128_MI16x16x1_SN_LDSB0_CLR1_GRVWA8_GRVWB16_GSU0_GSUC0_GSUWGMRR0_K1_LBSPPA128_LBSPPB512_LPA8_LPB32_LRVW8_MIWT1_2_PLR1_SU0_SUM0_SUS128_VWA1_VWB2_WGM1_WGMXCC1_WGMXCCGn1
    SolutionIndex: 72
    SolutionNameMin: Cijk_Alik_Bjlk_B8F8NSS_BH_Bias_HAS_SAV_UserArgs_MT32x64x128_MI16x16x1_SN_LDSB0_CLR1_GRVWA16_GRVWB16_GSU0_GSUC0_GSUWGMRR0_K1_LBSPPA128_LBSPPB512_LPA16_LPB32_LRVW8_MIWT1_2_PLR1_SU0_SUM0_SUS128_VWA1_VWB2_WGM1_WGMXCC1_WGMXCCGn1
    SolutionIndex: 73
    SolutionNameMin: Cijk_Alik_Bjlk_B8F8NSS_BH_Bias_HAS_SAV_UserArgs_MT32x64x128_MI16x16x1_SN_LDSB0_CLR1_GRVWA8_GRVWB16_GSU0_GSUC0_GSUWGMRR0_K1_LBSPPA128_LBSPPB512_LPA8_LPB32_LRVW8_MIWT1_2_PLR1_SU0_SUM0_SUS128_VWA1_VWB2_WGM4_WGMXCC1_WGMXCCGn1
    SolutionIndex: 74
    SolutionNameMin: Cijk_Alik_Bjlk_B8F8NSS_BH_Bias_HAS_SAV_UserArgs_MT64x32x128_MI16x16x1_SN_LDSB0_CLR1_GRVWA8_GRVWB8_GSU0_GSUC0_GSUWGMRR0_K1_LBSPPA256_LBSPPB256_LPA8_LPB16_LRVW8_MIWT2_1_PLR1_SU0_SUM0_SUS128_VWA2_VWB1_WGM1_WGMXCC1_WGMXCCGn1
    SolutionIndex: 75
    SolutionNameMin: Cijk_Alik_Bjlk_B8F8NSS_BH_Bias_HAS_SAV_UserArgs_MT64x32x128_MI16x16x1_SN_LDSB0_CLR1_GRVWA16_GRVWB8_GSU0_GSUC0_GSUWGMRR0_K1_LBSPPA256_LBSPPB256_LPA16_LPB16_LRVW8_MIWT2_1_PLR1_SU0_SUM0_SUS128_VWA2_VWB1_WGM1_WGMXCC1_WGMXCCGn1
    SolutionIndex: 76
    SolutionNameMin: Cijk_Alik_Bjlk_B8F8NSS_BH_Bias_HAS_SAV_UserArgs_MT64x32x128_MI16x16x1_SN_LDSB0_CLR1_GRVWA8_GRVWB16_GSU0_GSUC0_GSUWGMRR0_K1_LBSPPA256_LBSPPB256_LPA8_LPB16_LRVW8_MIWT2_1_PLR1_SU0_SUM0_SUS128_VWA2_VWB1_WGM1_WGMXCC1_WGMXCCGn1
    SolutionIndex: 77
    SolutionNameMin: Cijk_Alik_Bjlk_B8F8NSS_BH_Bias_HAS_SAV_UserArgs_MT64x32x128_MI16x16x1_SN_LDSB0_CLR1_GRVWA16_GRVWB16_GSU0_GSUC0_GSUWGMRR0_K1_LBSPPA256_LBSPPB256_LPA16_LPB16_LRVW8_MIWT2_1_PLR1_SU0_SUM0_SUS128_VWA2_VWB1_WGM1_WGMXCC1_WGMXCCGn1
    SolutionIndex: 78
    SolutionNameMin: Cijk_Alik_Bjlk_B8F8NSS_BH_Bias_HAS_SAV_UserArgs_MT64x32x128_MI16x16x1_SN_LDSB0_CLR1_GRVWA16_GRVWB8_GSU0_GSUC0_GSUWGMRR0_K1_LBSPPA256_LBSPPB256_LPA16_LPB16_LRVW8_MIWT2_1_PLR1_SU0_SUM0_SUS128_VWA2_VWB1_WGM4_WGMXCC1_WGMXCCGn1
    SolutionIndex: 79
    SolutionNameMin: Cijk_Alik_Bjlk_B8F8NSS_BH_Bias_HAS_SAV_UserArgs_MT64x32x128_MI16x16x1_SN_LDSB0_CLR1_GRVWA8_GRVWB16_GSU0_GSUC0_GSUWGMRR0_K1_LBSPPA256_LBSPPB256_LPA8_LPB16_LRVW8_MIWT2_1_PLR1_SU0_SUM0_SUS128_VWA2_VWB1_WGM4_WGMXCC1_WGMXCCGn1
    SolutionIndex: 80
    SolutionNameMin: Cijk_Alik_Bjlk_B8F8NSS_BH_Bias_HAS_SAV_UserArgs_MT64x32x128_MI16x16x1_SN_LDSB0_CLR1_GRVWA8_GRVWB16_GSU0_GSUC0_GSUWGMRR0_K1_LBSPPA256_LBSPPB256_LPA8_LPB16_LRVW8_MIWT2_1_PLR1_SU0_SUM0_SUS128_VWA2_VWB1_WGM8_WGMXCC1_WGMXCCGn1
    SolutionIndex: 81
    SolutionNameMin: Cijk_Alik_Bjlk_B8F8NSS_BH_Bias_HAS_SAV_UserArgs_MT32x32x128_MI16x16x1_SN_LDSB0_CLR1_GRVWA8_GRVWB8_GSU0_GSUC0_GSUWGMRR0_K1_LBSPPA128_LBSPPB256_LPA8_LPB16_LRVW8_MIWT1_1_PLR1_SU0_SUM0_SUS128_VWA1_VWB1_WGM1_WGMXCC1_WGMXCCGn1
    SolutionIndex: 82
    SolutionNameMin: Cijk_Alik_Bjlk_B8F8NSS_BH_Bias_HAS_SAV_UserArgs_MT32x32x128_MI16x16x1_SN_LDSB0_CLR1_GRVWA16_GRVWB8_GSU0_GSUC0_GSUWGMRR0_K1_LBSPPA128_LBSPPB256_LPA16_LPB16_LRVW8_MIWT1_1_PLR1_SU0_SUM0_SUS128_VWA1_VWB1_WGM1_WGMXCC1_WGMXCCGn1
    SolutionIndex: 83
    SolutionNameMin: Cijk_Alik_Bjlk_B8F8NSS_BH_Bias_HAS_SAV_UserArgs_MT32x32x128_MI16x16x1_SN_LDSB0_CLR1_GRVWA8_GRVWB16_GSU0_GSUC0_GSUWGMRR0_K1_LBSPPA128_LBSPPB256_LPA8_LPB16_LRVW8_MIWT1_1_PLR1_SU0_SUM0_SUS128_VWA1_VWB1_WGM1_WGMXCC1_WGMXCCGn1
    SolutionIndex: 84
    SolutionNameMin: Cijk_Alik_Bjlk_B8F8NSS_BH_Bias_HAS_SAV_UserArgs_MT32x32x128_MI16x16x1_SN_LDSB0_CLR1_GRVWA8_GRVWB16_GSU0_GSUC0_GSUWGMRR0_K1_LBSPPA128_LBSPPB256_LPA8_LPB16_LRVW8_MIWT1_1_PLR1_SU0_SUM0_SUS128_VWA1_VWB1_WGM4_WGMXCC1_WGMXCCGn1
    SolutionIndex: 85
    SolutionNameMin: Cijk_Alik_Bjlk_B8F8NSS_BH_Bias_HAS_SAV_UserArgs_MT32x32x128_MI16x16x1_SN_LDSB0_CLR1_GRVWA8_GRVWB8_GSU0_GSUC0_GSUWGMRR0_K1_LBSPPA128_LBSPPB256_LPA8_LPB16_LRVW8_MIWT1_1_PLR1_SU0_SUM0_SUS128_VWA1_VWB1_WGM6_WGMXCC1_WGMXCCGn1
    SolutionIndex: 86
    SolutionNameMin: Cijk_Alik_Bjlk_B8F8NSS_BH_Bias_HAS_SAV_UserArgs_MT32x32x128_MI16x16x1_SN_LDSB0_CLR1_GRVWA8_GRVWB16_GSU0_GSUC0_GSUWGMRR0_K1_LBSPPA128_LBSPPB256_LPA8_LPB16_LRVW8_MIWT1_1_PLR1_SU0_SUM0_SUS128_VWA1_VWB1_WGM6_WGMXCC1_WGMXCCGn1
    SolutionIndex: 87
    SolutionNameMin: Cijk_Alik_Bjlk_B8F8NSS_BH_Bias_HAS_SAV_UserArgs_MT32x32x128_MI16x16x1_SN_LDSB0_CLR1_GRVWA8_GRVWB16_GSU0_GSUC0_GSUWGMRR0_K1_LBSPPA128_LBSPPB256_LPA8_LPB16_LRVW8_MIWT1_1_PLR1_SU0_SUM0_SUS128_VWA1_VWB1_WGM8_WGMXCC1_WGMXCCGn1
    SolutionIndex: 88
    SolutionNameMin: Cijk_Alik_Bjlk_B8F8NSS_BH_Bias_HAS_SAV_UserArgs_MT128x64x256_MI16x16x1_SN_LDSB1_CLR1_GRVWA16_GRVWB16_GSU0_GSUC0_GSUWGMRR0_K1_LBSPPA1024_LBSPPB512_LPA16_LPB32_LRVW8_MIWT4_2_PLR1_SU0_SUM0_SUS256_VWA4_VWB2_WGM1_WGMXCC1_WGMXCCGn1
    SolutionIndex: 89
    SolutionNameMin: Cijk_Alik_Bjlk_B8F8NSS_BH_Bias_HAS_SAV_UserArgs_MT128x64x256_MI16x16x1_SN_LDSB1_CLR1_GRVWA16_GRVWB16_GSU0_GSUC0_GSUWGMRR0_K1_LBSPPA1024_LBSPPB512_LPA16_LPB32_LRVW8_MIWT4_2_PLR1_SU0_SUM0_SUS256_VWA4_VWB2_WGM4_WGMXCC1_WGMXCCGn1
    SolutionIndex: 90
    SolutionNameMin: Cijk_Alik_Bjlk_B8F8NSS_BH_Bias_HAS_SAV_UserArgs_MT128x64x256_MI16x16x1_SN_LDSB1_CLR1_GRVWA16_GRVWB16_GSU0_GSUC0_GSUWGMRR0_K1_LBSPPA1024_LBSPPB512_LPA16_LPB32_LRVW8_MIWT4_2_PLR1_SU0_SUM0_SUS256_VWA4_VWB2_WGM6_WGMXCC1_WGMXCCGn1
    SolutionIndex: 91
    SolutionNameMin: Cijk_Alik_Bjlk_B8F8NSS_BH_Bias_HAS_SAV_UserArgs_MT128x64x256_MI16x16x1_SN_LDSB1_CLR1_GRVWA16_GRVWB16_GSU0_GSUC0_GSUWGMRR0_K1_LBSPPA1024_LBSPPB512_LPA16_LPB32_LRVW8_MIWT4_2_PLR1_SU0_SUM0_SUS256_VWA4_VWB2_WGM8_WGMXCC1_WGMXCCGn1
    SolutionIndex: 92
    SolutionNameMin: Cijk_Alik_Bjlk_B8F8NSS_BH_Bias_HAS_SAV_UserArgs_MT64x64x256_MI16x16x1_SN_LDSB1_CLR1_GRVWA16_GRVWB8_GSU0_GSUC0_GSUWGMRR0_K1_LBSPPA512_LBSPPB512_LPA16_LPB32_LRVW8_MIWT2_2_PLR1_SU0_SUM0_SUS256_VWA2_VWB2_WGM1_WGMXCC1_WGMXCCGn1
    SolutionIndex: 93
    SolutionNameMin: Cijk_Alik_Bjlk_B8F8NSS_BH_Bias_HAS_SAV_UserArgs_MT64x64x256_MI16x16x1_SN_LDSB1_CLR1_GRVWA16_GRVWB16_GSU0_GSUC0_GSUWGMRR0_K1_LBSPPA512_LBSPPB512_LPA16_LPB32_LRVW8_MIWT2_2_PLR1_SU0_SUM0_SUS256_VWA2_VWB2_WGM1_WGMXCC1_WGMXCCGn1
    SolutionIndex: 94
    SolutionNameMin: Cijk_Alik_Bjlk_B8F8NSS_BH_Bias_HAS_SAV_UserArgs_MT64x64x256_MI16x16x1_SN_LDSB1_CLR1_GRVWA16_GRVWB16_GSU0_GSUC0_GSUWGMRR0_K1_LBSPPA512_LBSPPB512_LPA16_LPB32_LRVW8_MIWT2_2_PLR1_SU0_SUM0_SUS256_VWA2_VWB2_WGM4_WGMXCC1_WGMXCCGn1
    SolutionIndex: 95
    SolutionNameMin: Cijk_Alik_Bjlk_B8F8NSS_BH_Bias_HAS_SAV_UserArgs_MT64x64x256_MI16x16x1_SN_LDSB1_CLR1_GRVWA16_GRVWB16_GSU0_GSUC0_GSUWGMRR0_K1_LBSPPA512_LBSPPB512_LPA16_LPB32_LRVW8_MIWT2_2_PLR1_SU0_SUM0_SUS256_VWA2_VWB2_WGM6_WGMXCC1_WGMXCCGn1
    SolutionIndex: 96
    SolutionNameMin: Cijk_Alik_Bjlk_B8F8NSS_BH_Bias_HAS_SAV_UserArgs_MT64x64x256_MI16x16x1_SN_LDSB1_CLR1_GRVWA16_GRVWB16_GSU0_GSUC0_GSUWGMRR0_K1_LBSPPA512_LBSPPB512_LPA16_LPB32_LRVW8_MIWT2_2_PLR1_SU0_SUM0_SUS256_VWA2_VWB2_WGM8_WGMXCC1_WGMXCCGn1
    SolutionIndex: 97
    SolutionNameMin: Cijk_Alik_Bjlk_B8F8NSS_BH_Bias_HAS_SAV_UserArgs_MT32x64x256_MI16x16x1_SN_LDSB1_CLR1_GRVWA8_GRVWB16_GSU0_GSUC0_GSUWGMRR0_K1_LBSPPA256_LBSPPB512_LPA8_LPB32_LRVW8_MIWT1_2_PLR1_SU0_SUM0_SUS256_VWA1_VWB2_WGM1_WGMXCC1_WGMXCCGn1
    SolutionIndex: 98
    SolutionNameMin: Cijk_Alik_Bjlk_B8F8NSS_BH_Bias_HAS_SAV_UserArgs_MT32x64x256_MI16x16x1_SN_LDSB1_CLR1_GRVWA16_GRVWB16_GSU0_GSUC0_GSUWGMRR0_K1_LBSPPA256_LBSPPB512_LPA16_LPB32_LRVW8_MIWT1_2_PLR1_SU0_SUM0_SUS256_VWA1_VWB2_WGM1_WGMXCC1_WGMXCCGn1
    SolutionIndex: 99
    SolutionNameMin: Cijk_Alik_Bjlk_B8F8NSS_BH_Bias_HAS_SAV_UserArgs_MT32x64x256_MI16x16x1_SN_LDSB1_CLR1_GRVWA16_GRVWB16_GSU0_GSUC0_GSUWGMRR0_K1_LBSPPA256_LBSPPB512_LPA16_LPB32_LRVW8_MIWT1_2_PLR1_SU0_SUM0_SUS256_VWA1_VWB2_WGM6_WGMXCC1_WGMXCCGn1
    SolutionIndex: 100
    SolutionNameMin: Cijk_Alik_Bjlk_B8F8NSS_BH_Bias_HAS_SAV_UserArgs_MT32x64x256_MI16x16x1_SN_LDSB1_CLR1_GRVWA8_GRVWB16_GSU0_GSUC0_GSUWGMRR0_K1_LBSPPA256_LBSPPB512_LPA8_LPB32_LRVW8_MIWT1_2_PLR1_SU0_SUM0_SUS256_VWA1_VWB2_WGM8_WGMXCC1_WGMXCCGn1
    SolutionIndex: 101
    SolutionNameMin: Cijk_Alik_Bjlk_B8F8NSS_BH_Bias_HAS_SAV_UserArgs_MT64x32x256_MI16x16x1_SN_LDSB1_CLR1_GRVWA16_GRVWB16_GSU0_GSUC0_GSUWGMRR0_K1_LBSPPA512_LBSPPB256_LPA16_LPB16_LRVW8_MIWT2_1_PLR1_SU0_SUM0_SUS256_VWA2_VWB1_WGM1_WGMXCC1_WGMXCCGn1
    SolutionIndex: 102
    SolutionNameMin: Cijk_Alik_Bjlk_B8F8NSS_BH_Bias_HAS_SAV_UserArgs_MT32x32x256_MI16x16x1_SN_LDSB1_CLR1_GRVWA8_GRVWB16_GSU0_GSUC0_GSUWGMRR0_K1_LBSPPA256_LBSPPB256_LPA8_LPB16_LRVW8_MIWT1_1_PLR1_SU0_SUM0_SUS256_VWA1_VWB1_WGM1_WGMXCC1_WGMXCCGn1
    SolutionIndex: 103
    SolutionNameMin: Cijk_Alik_Bjlk_B8F8NSS_BH_Bias_HAS_SAV_UserArgs_MT32x32x256_MI16x16x1_SN_LDSB1_CLR1_GRVWA16_GRVWB16_GSU0_GSUC0_GSUWGMRR0_K1_LBSPPA256_LBSPPB256_LPA16_LPB16_LRVW8_MIWT1_1_PLR1_SU0_SUM0_SUS256_VWA1_VWB1_WGM1_WGMXCC1_WGMXCCGn1
    SolutionIndex: 104
    SolutionNameMin: Cijk_Alik_Bjlk_B8F8NSS_BH_Bias_HAS_SAV_UserArgs_MT32x32x256_MI16x16x1_SN_LDSB1_CLR1_GRVWA16_GRVWB16_GSU0_GSUC0_GSUWGMRR0_K1_LBSPPA256_LBSPPB256_LPA16_LPB16_LRVW8_MIWT1_1_PLR1_SU0_SUM0_SUS256_VWA1_VWB1_WGM6_WGMXCC1_WGMXCCGn1
    SolutionIndex: 105
    SolutionNameMin: Cijk_Alik_Bjlk_B8F8NSS_BH_Bias_HAS_SAV_UserArgs_MT32x32x256_MI16x16x1_SN_LDSB1_CLR1_GRVWA16_GRVWB16_GSU0_GSUC0_GSUWGMRR0_K1_LBSPPA256_LBSPPB256_LPA16_LPB16_LRVW8_MIWT1_1_PLR1_SU0_SUM0_SUS256_VWA1_VWB1_WGM8_WGMXCC1_WGMXCCGn1
- - - [128, 128, 1, 128, 128, 128, 128, 128]
    - [85, 0.54]
  - - [128, 128, 1, 256, 128, 128, 256, 128]
    - [81, 1.01]
  - - [128, 128, 1, 512, 128, 128, 512, 128]
    - [81, 1.75]
  - - [128, 128, 1, 1024, 128, 128, 1024, 128]
    - [81, 2.75]
  - - [128, 128, 1, 2048, 128, 128, 2048, 128]
    - [83, 3.84]
  - - [128, 128, 1, 4096, 128, 128, 4096, 128]
    - [84, 4.78]
  - - [128, 128, 1, 8192, 128, 128, 8192, 128]
    - [86, 5.5]
  - - [128, 256, 1, 128, 128, 128, 128, 256]
    - [41, 1.08]
  - - [128, 256, 1, 256, 128, 128, 256, 256]
    - [82, 2.05]
  - - [128, 256, 1, 512, 128, 128, 512, 256]
    - [81, 3.58]
  - - [128, 256, 1, 1024, 128, 128, 1024, 256]
    - [81, 5.59]
  - - [128, 256, 1, 2048, 128, 128, 2048, 256]
    - [83, 7.75]
  - - [128, 256, 1, 4096, 128, 128, 4096, 256]
    - [83, 9.73]
  - - [128, 256, 1, 8192, 128, 128, 8192, 256]
    - [83, 11.14]
  - - [128, 512, 1, 128, 128, 128, 128, 512]
    - [40, 2.23]
  - - [128, 512, 1, 256, 128, 128, 256, 512]
    - [81, 4.0]
  - - [128, 512, 1, 512, 128, 128, 512, 512]
    - [81, 6.93]
  - - [128, 512, 1, 1024, 128, 128, 1024, 512]
    - [81, 10.85]
  - - [128, 512, 1, 2048, 128, 128, 2048, 512]
    - [83, 15.3]
  - - [128, 512, 1, 4096, 128, 128, 4096, 512]
    - [83, 19.25]
  - - [128, 512, 1, 8192, 128, 128, 8192, 512]
    - [102, 17.15]
  - - [128, 1024, 1, 128, 128, 128, 128, 1024]
    - [81, 4.31]
  - - [128, 1024, 1, 256, 128, 128, 256, 1024]
    - [40, 7.73]
  - - [128, 1024, 1, 512, 128, 128, 512, 1024]
    - [81, 13.4]
  - - [128, 1024, 1, 1024, 128, 128, 1024, 1024]
    - [81, 21.38]
  - - [128, 1024, 1, 2048, 128, 128, 2048, 1024]
    - [81, 29.98]
  - - [128, 1024, 1, 4096, 128, 128, 4096, 1024]
    - [103, 31.98]
  - - [128, 1024, 1, 8192, 128, 128, 8192, 1024]
    - [104, 32.6]
  - - [128, 2048, 1, 128, 128, 128, 128, 2048]
    - [39, 7.72]
  - - [128, 2048, 1, 256, 128, 128, 256, 2048]
    - [74, 13.85]
  - - [128, 2048, 1, 512, 128, 128, 512, 2048]
    - [75, 23.32]
  - - [128, 2048, 1, 1024, 128, 128, 1024, 2048]
    - [76, 36.69]
  - - [128, 2048, 1, 2048, 128, 128, 2048, 2048]
    - [98, 43.07]
  - - [128, 2048, 1, 4096, 128, 128, 4096, 2048]
    - [98, 52.25]
  - - [128, 2048, 1, 8192, 128, 128, 8192, 2048]
    - [99, 59.06]
  - - [128, 4096, 1, 128, 128, 128, 128, 4096]
    - [32, 13.43]
  - - [128, 4096, 1, 256, 128, 128, 256, 4096]
    - [33, 23.9]
  - - [128, 4096, 1, 512, 128, 128, 512, 4096]
    - [66, 39.58]
  - - [128, 4096, 1, 1024, 128, 128, 1024, 4096]
    - [68, 60.35]
  - - [128, 4096, 1, 2048, 128, 128, 2048, 4096]
    - [93, 75.44]
  - - [128, 4096, 1, 4096, 128, 128, 4096, 4096]
    - [93, 94.26]
  - - [128, 4096, 1, 8192, 128, 128, 8192, 4096]
    - [94, 105.89]
  - - [128, 8192, 1, 128, 128, 128, 128, 8192]
    - [24, 21.36]
  - - [128, 8192, 1, 256, 128, 128, 256, 8192]
    - [23, 37.99]
  - - [128, 8192, 1, 512, 128, 128, 512, 8192]
    - [24, 64.11]
  - - [128, 8192, 1, 1024, 128, 128, 1024, 8192]
    - [24, 96.91]
  - - [128, 8192, 1, 2048, 128, 128, 2048, 8192]
    - [88, 115.66]
  - - [128, 8192, 1, 4096, 128, 128, 4096, 8192]
    - [64, 139.39]
  - - [128, 8192, 1, 8192, 128, 128, 8192, 8192]
    - [91, 148.25]
  - - [256, 128, 1, 128, 256, 256, 128, 128]
    - [83, 1.07]
  - - [256, 128, 1, 256, 256, 256, 256, 128]
    - [83, 1.99]
  - - [256, 128, 1, 512, 256, 256, 512, 128]
    - [81, 3.46]
  - - [256, 128, 1, 1024, 256, 256, 1024, 128]
    - [83, 5.43]
  - - [256, 128, 1, 2048, 256, 256, 2048, 128]
    - [83, 7.71]
  - - [256, 128, 1, 4096, 256, 256, 4096, 128]
    - [83, 9.76]
  - - [256, 128, 1, 8192, 256, 256, 8192, 128]
    - [83, 11.11]
  - - [256, 256, 1, 128, 256, 256, 128, 256]
    - [81, 2.23]
  - - [256, 256, 1, 256, 256, 256, 256, 256]
    - [81, 4.06]
  - - [256, 256, 1, 512, 256, 256, 512, 256]
    - [81, 7.0]
  - - [256, 256, 1, 1024, 256, 256, 1024, 256]
    - [81, 10.93]
  - - [256, 256, 1, 2048, 256, 256, 2048, 256]
    - [83, 15.21]
  - - [256, 256, 1, 4096, 256, 256, 4096, 256]
    - [83, 19.26]
  - - [256, 256, 1, 8192, 256, 256, 8192, 256]
    - [87, 21.89]
  - - [256, 512, 1, 128, 256, 256, 128, 512]
    - [81, 4.29]
  - - [256, 512, 1, 256, 256, 256, 256, 512]
    - [40, 7.71]
  - - [256, 512, 1, 512, 256, 256, 512, 512]
    - [81, 13.37]
  - - [256, 512, 1, 1024, 256, 256, 1024, 512]
    - [81, 21.11]
  - - [256, 512, 1, 2048, 256, 256, 2048, 512]
    - [81, 29.35]
  - - [256, 512, 1, 4096, 256, 256, 4096, 512]
    - [87, 37.15]
  - - [256, 512, 1, 8192, 256, 256, 8192, 512]
    - [105, 37.58]
  - - [256, 1024, 1, 128, 256, 256, 128, 1024]
    - [16, 5.04]
  - - [256, 1024, 1, 256, 256, 256, 256, 1024]
    - [29, 10.06]
  - - [256, 1024, 1, 512, 256, 256, 512, 1024]
    - [35, 19.97]
  - - [256, 1024, 1, 1024, 256, 256, 1024, 1024]
    - [72, 35.19]
  - - [256, 1024, 1, 2048, 256, 256, 2048, 1024]
    - [76, 50.23]
  - - [256, 1024, 1, 4096, 256, 256, 4096, 1024]
    - [101, 54.67]
  - - [256, 1024, 1, 8192, 256, 256, 8192, 1024]
    - [99, 59.56]
  - - [256, 2048, 1, 128, 256, 256, 128, 2048]
    - [14, 9.75]
  - - [256, 2048, 1, 256, 256, 256, 256, 2048]
    - [92, 22.8]
  - - [256, 2048, 1, 512, 256, 256, 512, 2048]
    - [66, 39.74]
  - - [256, 2048, 1, 1024, 256, 256, 1024, 2048]
    - [66, 60.77]
  - - [256, 2048, 1, 2048, 256, 256, 2048, 2048]
    - [93, 77.68]
  - - [256, 2048, 1, 4096, 256, 256, 4096, 2048]
    - [93, 95.06]
  - - [256, 2048, 1, 8192, 256, 256, 8192, 2048]
    - [93, 107.31]
  - - [256, 4096, 1, 128, 256, 256, 128, 4096]
    - [30, 20.96]
  - - [256, 4096, 1, 256, 256, 256, 256, 4096]
    - [30, 37.56]
  - - [256, 4096, 1, 512, 256, 256, 512, 4096]
    - [24, 62.61]
  - - [256, 4096, 1, 1024, 256, 256, 1024, 4096]
    - [27, 94.79]
  - - [256, 4096, 1, 2048, 256, 256, 2048, 4096]
    - [88, 118.5]
  - - [256, 4096, 1, 4096, 256, 256, 4096, 4096]
    - [88, 144.04]
  - - [256, 4096, 1, 8192, 256, 256, 8192, 4096]
    - [88, 159.93]
  - - [256, 8192, 1, 128, 256, 256, 128, 8192]
    - [18, 31.42]
  - - [256, 8192, 1, 256, 256, 256, 256, 8192]
    - [17, 55.21]
  - - [256, 8192, 1, 512, 256, 256, 512, 8192]
    - [17, 89.07]
  - - [256, 8192, 1, 1024, 256, 256, 1024, 8192]
    - [60, 131.17]
  - - [256, 8192, 1, 2048, 256, 256, 2048, 8192]
    - [60, 163.8]
  - - [256, 8192, 1, 4096, 256, 256, 4096, 8192]
    - [60, 201.31]
  - - [256, 8192, 1, 8192, 256, 256, 8192, 8192]
    - [60, 194.16]
  - - [512, 128, 1, 128, 512, 512, 128, 128]
    - [40, 2.19]
  - - [512, 128, 1, 256, 512, 512, 256, 128]
    - [40, 3.94]
  - - [512, 128, 1, 512, 512, 512, 512, 128]
    - [83, 6.77]
  - - [512, 128, 1, 1024, 512, 512, 1024, 128]
    - [81, 10.79]
  - - [512, 128, 1, 2048, 512, 512, 2048, 128]
    - [81, 15.09]
  - - [512, 128, 1, 4096, 512, 512, 4096, 128]
    - [83, 19.11]
  - - [512, 128, 1, 8192, 512, 512, 8192, 128]
    - [84, 21.79]
  - - [512, 256, 1, 128, 512, 512, 128, 256]
    - [40, 4.17]
  - - [512, 256, 1, 256, 512, 512, 256, 256]
    - [40, 7.73]
  - - [512, 256, 1, 512, 512, 512, 512, 256]
    - [81, 13.23]
  - - [512, 256, 1, 1024, 512, 512, 1024, 256]
    - [81, 21.1]
  - - [512, 256, 1, 2048, 512, 512, 2048, 256]
    - [81, 29.9]
  - - [512, 256, 1, 4096, 512, 512, 4096, 256]
    - [83, 37.68]
  - - [512, 256, 1, 8192, 512, 512, 8192, 256]
    - [84, 43.0]
  - - [512, 512, 1, 128, 512, 512, 128, 512]
    - [70, 7.59]
  - - [512, 512, 1, 256, 512, 512, 256, 512]
    - [75, 13.77]
  - - [512, 512, 1, 512, 512, 512, 512, 512]
    - [75, 23.21]
  - - [512, 512, 1, 1024, 512, 512, 1024, 512]
    - [76, 36.0]
  - - [512, 512, 1, 2048, 512, 512, 2048, 512]
    - [79, 50.01]
  - - [512, 512, 1, 4096, 512, 512, 4096, 512]
    - [80, 62.25]
  - - [512, 512, 1, 8192, 512, 512, 8192, 512]
    - [73, 63.17]
  - - [512, 1024, 1, 128, 512, 512, 128, 1024]
    - [33, 13.1]
  - - [512, 1024, 1, 256, 512, 512, 256, 1024]
    - [34, 23.42]
  - - [512, 1024, 1, 512, 512, 512, 512, 1024]
    - [66, 39.42]
  - - [512, 1024, 1, 1024, 512, 512, 1024, 1024]
    - [67, 60.15]
  - - [512, 1024, 1, 2048, 512, 512, 2048, 1024]
    - [93, 82.61]
  - - [512, 1024, 1, 4096, 512, 512, 4096, 1024]
    - [95, 94.83]
  - - [512, 1024, 1, 8192, 512, 512, 8192, 1024]
    - [95, 105.01]
  - - [512, 2048, 1, 128, 512, 512, 128, 2048]
    - [23, 21.2]
  - - [512, 2048, 1, 256, 512, 512, 256, 2048]
    - [23, 37.91]
  - - [512, 2048, 1, 512, 512, 512, 512, 2048]
    - [24, 63.2]
  - - [512, 2048, 1, 1024, 512, 512, 1024, 2048]
    - [24, 95.14]
  - - [512, 2048, 1, 2048, 512, 512, 2048, 2048]
    - [88, 120.62]
  - - [512, 2048, 1, 4096, 512, 512, 4096, 2048]
    - [88, 147.81]
  - - [512, 2048, 1, 8192, 512, 512, 8192, 2048]
    - [88, 156.04]
  - - [512, 4096, 1, 128, 512, 512, 128, 4096]
    - [18, 31.2]
  - - [512, 4096, 1, 256, 512, 512, 256, 4096]
    - [21, 55.57]
  - - [512, 4096, 1, 512, 512, 512, 512, 4096]
    - [60, 87.44]
  - - [512, 4096, 1, 1024, 512, 512, 1024, 4096]
    - [60, 132.71]
  - - [512, 4096, 1, 2048, 512, 512, 2048, 4096]
    - [60, 175.33]
  - - [512, 4096, 1, 4096, 512, 512, 4096, 4096]
    - [60, 203.28]
  - - [512, 4096, 1, 8192, 512, 512, 8192, 4096]
    - [60, 200.79]
  - - [512, 8192, 1, 128, 512, 512, 128, 8192]
    - [6, 39.42]
  - - [512, 8192, 1, 256, 512, 512, 256, 8192]
    - [7, 69.83]
  - - [512, 8192, 1, 512, 512, 512, 512, 8192]
    - [7, 114.36]
  - - [512, 8192, 1, 1024, 512, 512, 1024, 8192]
    - [5, 163.79]
  - - [512, 8192, 1, 2048, 512, 512, 2048, 8192]
    - [4, 214.71]
  - - [512, 8192, 1, 4096, 512, 512, 4096, 8192]
    - [42, 238.99]
  - - [512, 8192, 1, 8192, 512, 512, 8192, 8192]
    - [42, 228.9]
  - - [1024, 128, 1, 128, 1024, 1024, 128, 128]
    - [82, 4.15]
  - - [1024, 128, 1, 256, 1024, 1024, 256, 128]
    - [81, 7.59]
  - - [1024, 128, 1, 512, 1024, 1024, 512, 128]
    - [81, 13.24]
  - - [1024, 128, 1, 1024, 1024, 1024, 1024, 128]
    - [81, 20.94]
  - - [1024, 128, 1, 2048, 1024, 1024, 2048, 128]
    - [83, 29.7]
  - - [1024, 128, 1, 4096, 1024, 1024, 4096, 128]
    - [83, 37.49]
  - - [1024, 128, 1, 8192, 1024, 1024, 8192, 128]
    - [84, 43.05]
  - - [1024, 256, 1, 128, 1024, 1024, 128, 256]
    - [74, 7.59]
  - - [1024, 256, 1, 256, 1024, 1024, 256, 256]
    - [78, 13.36]
  - - [1024, 256, 1, 512, 1024, 1024, 512, 256]
    - [77, 23.0]
  - - [1024, 256, 1, 1024, 1024, 1024, 1024, 256]
    - [76, 35.91]
  - - [1024, 256, 1, 2048, 1024, 1024, 2048, 256]
    - [76, 50.36]
  - - [1024, 256, 1, 4096, 1024, 1024, 4096, 256]
    - [79, 62.33]
  - - [1024, 256, 1, 8192, 1024, 1024, 8192, 256]
    - [100, 70.59]
  - - [1024, 512, 1, 128, 1024, 1024, 128, 512]
    - [36, 13.06]
  - - [1024, 512, 1, 256, 1024, 1024, 256, 512]
    - [37, 23.35]
  - - [1024, 512, 1, 512, 1024, 1024, 512, 512]
    - [69, 39.42]
  - - [1024, 512, 1, 1024, 1024, 1024, 1024, 512]
    - [68, 60.6]
  - - [1024, 512, 1, 2048, 1024, 1024, 2048, 512]
    - [94, 83.24]
  - - [1024, 512, 1, 4096, 1024, 1024, 4096, 512]
    - [94, 100.5]
  - - [1024, 512, 1, 8192, 1024, 1024, 8192, 512]
    - [96, 106.49]
  - - [1024, 1024, 1, 128, 1024, 1024, 128, 1024]
    - [30, 21.31]
  - - [1024, 1024, 1, 256, 1024, 1024, 256, 1024]
    - [30, 37.9]
  - - [1024, 1024, 1, 512, 1024, 1024, 512, 1024]
    - [27, 62.98]
  - - [1024, 1024, 1, 1024, 1024, 1024, 1024, 1024]
    - [28, 95.33]
  - - [1024, 1024, 1, 2048, 1024, 1024, 2048, 1024]
    - [90, 121.25]
  - - [1024, 1024, 1, 4096, 1024, 1024, 4096, 1024]
    - [90, 142.78]
  - - [1024, 1024, 1, 8192, 1024, 1024, 8192, 1024]
    - [91, 156.06]
  - - [1024, 2048, 1, 128, 1024, 1024, 128, 2048]
    - [18, 31.45]
  - - [1024, 2048, 1, 256, 1024, 1024, 256, 2048]
    - [17, 55.56]
  - - [1024, 2048, 1, 512, 1024, 1024, 512, 2048]
    - [18, 89.21]
  - - [1024, 2048, 1, 1024, 1024, 1024, 1024, 2048]
    - [60, 133.12]
  - - [1024, 2048, 1, 2048, 1024, 1024, 2048, 2048]
    - [60, 173.88]
  - - [1024, 2048, 1, 4096, 1024, 1024, 4096, 2048]
    - [62, 202.75]
  - - [1024, 2048, 1, 8192, 1024, 1024, 8192, 2048]
    - [62, 195.12]
  - - [1024, 4096, 1, 128, 1024, 1024, 128, 4096]
    - [3, 38.85]
  - - [1024, 4096, 1, 256, 1024, 1024, 256, 4096]
    - [5, 68.5]
  - - [1024, 4096, 1, 512, 1024, 1024, 512, 4096]
    - [5, 111.94]
  - - [1024, 4096, 1, 1024, 1024, 1024, 1024, 4096]
    - [4, 165.1]
  - - [1024, 4096, 1, 2048, 1024, 1024, 2048, 4096]
    - [43, 213.73]
  - - [1024, 4096, 1, 4096, 1024, 1024, 4096, 4096]
    - [48, 232.36]
  - - [1024, 4096, 1, 8192, 1024, 1024, 8192, 4096]
    - [42, 232.15]
  - - [1024, 8192, 1, 128, 1024, 1024, 128, 8192]
    - [3, 40.57]
  - - [1024, 8192, 1, 256, 1024, 1024, 256, 8192]
    - [3, 72.88]
  - - [1024, 8192, 1, 512, 1024, 1024, 512, 8192]
    - [10, 119.14]
  - - [1024, 8192, 1, 1024, 1024, 1024, 1024, 8192]
    - [9, 171.25]
  - - [1024, 8192, 1, 2048, 1024, 1024, 2048, 8192]
    - [1, 217.02]
  - - [1024, 8192, 1, 4096, 1024, 1024, 4096, 8192]
    - [44, 240.55]
  - - [1024, 8192, 1, 8192, 1024, 1024, 8192, 8192]
    - [0, 268.67]
  - - [2048, 128, 1, 128, 2048, 2048, 128, 128]
    - [70, 7.83]
  - - [2048, 128, 1, 256, 2048, 2048, 256, 128]
    - [38, 13.99]
  - - [2048, 128, 1, 512, 2048, 2048, 512, 128]
    - [71, 24.08]
  - - [2048, 128, 1, 1024, 2048, 2048, 1024, 128]
    - [76, 36.72]
  - - [2048, 128, 1, 2048, 2048, 2048, 2048, 128]
    - [76, 51.08]
  - - [2048, 128, 1, 4096, 2048, 2048, 4096, 128]
    - [80, 62.8]
  - - [2048, 128, 1, 8192, 2048, 2048, 8192, 128]
    - [97, 70.86]
  - - [2048, 256, 1, 128, 2048, 2048, 128, 256]
    - [34, 13.8]
  - - [2048, 256, 1, 256, 2048, 2048, 256, 256]
    - [34, 24.22]
  - - [2048, 256, 1, 512, 2048, 2048, 512, 256]
    - [66, 40.46]
  - - [2048, 256, 1, 1024, 2048, 2048, 1024, 256]
    - [66, 61.7]
  - - [2048, 256, 1, 2048, 2048, 2048, 2048, 256]
    - [66, 83.8]
  - - [2048, 256, 1, 4096, 2048, 2048, 4096, 256]
    - [95, 103.05]
  - - [2048, 256, 1, 8192, 2048, 2048, 8192, 256]
    - [96, 115.77]
  - - [2048, 512, 1, 128, 2048, 2048, 128, 512]
    - [22, 21.83]
  - - [2048, 512, 1, 256, 2048, 2048, 256, 512]
    - [24, 39.09]
  - - [2048, 512, 1, 512, 2048, 2048, 512, 512]
    - [24, 65.22]
  - - [2048, 512, 1, 1024, 2048, 2048, 1024, 512]
    - [31, 96.23]
  - - [2048, 512, 1, 2048, 2048, 2048, 2048, 512]
    - [31, 127.77]
  - - [2048, 512, 1, 4096, 2048, 2048, 4096, 512]
    - [91, 140.64]
  - - [2048, 512, 1, 8192, 2048, 2048, 8192, 512]
    - [89, 157.71]
  - - [2048, 1024, 1, 128, 2048, 2048, 128, 1024]
    - [18, 30.77]
  - - [2048, 1024, 1, 256, 2048, 2048, 256, 1024]
    - [21, 55.2]
  - - [2048, 1024, 1, 512, 2048, 2048, 512, 1024]
    - [21, 87.57]
  - - [2048, 1024, 1, 1024, 2048, 2048, 1024, 1024]
    - [61, 129.33]
  - - [2048, 1024, 1, 2048, 2048, 2048, 2048, 1024]
    - [61, 168.53]
  - - [2048, 1024, 1, 4096, 2048, 2048, 4096, 1024]
    - [61, 198.12]
  - - [2048, 1024, 1, 8192, 2048, 2048, 8192, 1024]
    - [61, 197.94]
  - - [2048, 2048, 1, 128, 2048, 2048, 128, 2048]
    - [4, 36.75]
  - - [2048, 2048, 1, 256, 2048, 2048, 256, 2048]
    - [3, 65.84]
  - - [2048, 2048, 1, 512, 2048, 2048, 512, 2048]
    - [4, 107.62]
  - - [2048, 2048, 1, 1024, 2048, 2048, 1024, 2048]
    - [4, 160.5]
  - - [2048, 2048, 1, 2048, 2048, 2048, 2048, 2048]
    - [43, 212.43]
  - - [2048, 2048, 1, 4096, 2048, 2048, 4096, 2048]
    - [52, 234.3]
  - - [2048, 2048, 1, 8192, 2048, 2048, 8192, 2048]
    - [49, 236.47]
  - - [2048, 4096, 1, 128, 2048, 2048, 128, 4096]
    - [18, 37.78]
  - - [2048, 4096, 1, 256, 2048, 2048, 256, 4096]
    - [13, 67.86]
  - - [2048, 4096, 1, 512, 2048, 2048, 512, 4096]
    - [4, 115.0]
  - - [2048, 4096, 1, 1024, 2048, 2048, 1024, 4096]
    - [45, 168.29]
  - - [2048, 4096, 1, 2048, 2048, 2048, 2048, 4096]
    - [1, 213.17]
  - - [2048, 4096, 1, 4096, 2048, 2048, 4096, 4096]
    - [9, 246.59]
  - - [2048, 4096, 1, 8192, 2048, 2048, 8192, 4096]
    - [2, 269.84]
  - - [2048, 8192, 1, 128, 2048, 2048, 128, 8192]
    - [47, 45.09]
  - - [2048, 8192, 1, 256, 2048, 2048, 256, 8192]
    - [49, 78.04]
  - - [2048, 8192, 1, 512, 2048, 2048, 512, 8192]
    - [48, 130.14]
  - - [2048, 8192, 1, 1024, 2048, 2048, 1024, 8192]
    - [49, 178.31]
  - - [2048, 8192, 1, 2048, 2048, 2048, 2048, 8192]
    - [4, 219.48]
  - - [2048, 8192, 1, 4096, 2048, 2048, 4096, 8192]
    - [42, 274.37]
  - - [2048, 8192, 1, 8192, 2048, 2048, 8192, 8192]
    - [46, 299.91]
  - - [4096, 128, 1, 128, 4096, 4096, 128, 128]
    - [32, 13.62]
  - - [4096, 128, 1, 256, 4096, 4096, 256, 128]
    - [33, 23.97]
  - - [4096, 128, 1, 512, 4096, 4096, 512, 128]
    - [33, 40.25]
  - - [4096, 128, 1, 1024, 4096, 4096, 1024, 128]
    - [67, 60.95]
  - - [4096, 128, 1, 2048, 4096, 4096, 2048, 128]
    - [66, 83.09]
  - - [4096, 128, 1, 4096, 4096, 4096, 4096, 128]
    - [93, 100.36]
  - - [4096, 128, 1, 8192, 4096, 4096, 8192, 128]
    - [93, 115.42]
  - - [4096, 256, 1, 128, 4096, 4096, 128, 256]
    - [24, 21.36]
  - - [4096, 256, 1, 256, 4096, 4096, 256, 256]
    - [25, 38.4]
  - - [4096, 256, 1, 512, 4096, 4096, 512, 256]
    - [24, 63.92]
  - - [4096, 256, 1, 1024, 4096, 4096, 1024, 256]
    - [31, 96.06]
  - - [4096, 256, 1, 2048, 4096, 4096, 2048, 256]
    - [27, 127.68]
  - - [4096, 256, 1, 4096, 4096, 4096, 4096, 256]
    - [65, 141.22]
  - - [4096, 256, 1, 8192, 4096, 4096, 8192, 256]
    - [89, 153.68]
  - - [4096, 512, 1, 128, 4096, 4096, 128, 512]
    - [20, 29.81]
  - - [4096, 512, 1, 256, 4096, 4096, 256, 512]
    - [19, 53.24]
  - - [4096, 512, 1, 512, 4096, 4096, 512, 512]
    - [20, 86.12]
  - - [4096, 512, 1, 1024, 4096, 4096, 1024, 512]
    - [62, 129.57]
  - - [4096, 512, 1, 2048, 4096, 4096, 2048, 512]
    - [61, 172.6]
  - - [4096, 512, 1, 4096, 4096, 4096, 4096, 512]
    - [63, 190.06]
  - - [4096, 512, 1, 8192, 4096, 4096, 8192, 512]
    - [61, 202.88]
  - - [4096, 1024, 1, 128, 4096, 4096, 128, 1024]
    - [45, 34.81]
  - - [4096, 1024, 1, 256, 4096, 4096, 256, 1024]
    - [8, 62.63]
  - - [4096, 1024, 1, 512, 4096, 4096, 512, 1024]
    - [45, 105.89]
  - - [4096, 1024, 1, 1024, 4096, 4096, 1024, 1024]
    - [43, 161.45]
  - - [4096, 1024, 1, 2048, 4096, 4096, 2048, 1024]
    - [43, 211.49]
  - - [4096, 1024, 1, 4096, 4096, 4096, 4096, 1024]
    - [44, 239.19]
  - - [4096, 1024, 1, 8192, 4096, 4096, 8192, 1024]
    - [44, 235.52]
  - - [4096, 2048, 1, 128, 4096, 4096, 128, 2048]
    - [15, 36.46]
  - - [4096, 2048, 1, 256, 4096, 4096, 256, 2048]
    - [11, 65.59]
  - - [4096, 2048, 1, 512, 4096, 4096, 512, 2048]
    - [4, 109.96]
  - - [4096, 2048, 1, 1024, 4096, 4096, 1024, 2048]
    - [42, 165.51]
  - - [4096, 2048, 1, 2048, 4096, 4096, 2048, 2048]
    - [51, 208.28]
  - - [4096, 2048, 1, 4096, 4096, 4096, 4096, 2048]
    - [52, 253.59]
  - - [4096, 2048, 1, 8192, 4096, 4096, 8192, 2048]
    - [48, 276.23]
  - - [4096, 4096, 1, 128, 4096, 4096, 128, 4096]
    - [12, 40.07]
  - - [4096, 4096, 1, 256, 4096, 4096, 256, 4096]
    - [22, 71.53]
  - - [4096, 4096, 1, 512, 4096, 4096, 512, 4096]
    - [18, 121.6]
  - - [4096, 4096, 1, 1024, 4096, 4096, 1024, 4096]
    - [60, 166.4]
  - - [4096, 4096, 1, 2048, 4096, 4096, 2048, 4096]
    - [48, 218.14]
  - - [4096, 4096, 1, 4096, 4096, 4096, 4096, 4096]
    - [49, 274.78]
  - - [4096, 4096, 1, 8192, 4096, 4096, 8192, 4096]
    - [48, 309.15]
  - - [4096, 8192, 1, 128, 4096, 4096, 128, 8192]
    - [30, 40.4]
  - - [4096, 8192, 1, 256, 4096, 4096, 256, 8192]
    - [18, 77.2]
  - - [4096, 8192, 1, 512, 4096, 4096, 512, 8192]
    - [60, 119.26]
  - - [4096, 8192, 1, 1024, 4096, 4096, 1024, 8192]
    - [42, 166.88]
  - - [4096, 8192, 1, 2048, 4096, 4096, 2048, 8192]
    - [44, 229.07]
  - - [4096, 8192, 1, 4096, 4096, 4096, 4096, 8192]
    - [0, 285.9]
  - - [4096, 8192, 1, 8192, 4096, 4096, 8192, 8192]
    - [0, 327.25]
  - - [8192, 128, 1, 128, 8192, 8192, 128, 128]
    - [26, 20.72]
  - - [8192, 128, 1, 256, 8192, 8192, 256, 128]
    - [23, 37.28]
  - - [8192, 128, 1, 512, 8192, 8192, 512, 128]
    - [24, 62.73]
  - - [8192, 128, 1, 1024, 8192, 8192, 1024, 128]
    - [27, 95.44]
  - - [8192, 128, 1, 2048, 8192, 8192, 2048, 128]
    - [89, 120.05]
  - - [8192, 128, 1, 4096, 8192, 8192, 4096, 128]
    - [65, 139.03]
  - - [8192, 128, 1, 8192, 8192, 8192, 8192, 128]
    - [89, 154.73]
  - - [8192, 256, 1, 128, 8192, 8192, 128, 256]
    - [53, 31.58]
  - - [8192, 256, 1, 256, 8192, 8192, 256, 256]
    - [54, 55.69]
  - - [8192, 256, 1, 512, 8192, 8192, 512, 256]
    - [55, 94.84]
  - - [8192, 256, 1, 1024, 8192, 8192, 1024, 256]
    - [53, 135.57]
  - - [8192, 256, 1, 2048, 8192, 8192, 2048, 256]
    - [55, 163.56]
  - - [8192, 256, 1, 4096, 8192, 8192, 4096, 256]
    - [62, 191.75]
  - - [8192, 256, 1, 8192, 8192, 8192, 8192, 256]
    - [63, 198.39]
  - - [8192, 512, 1, 128, 8192, 8192, 128, 512]
    - [57, 40.58]
  - - [8192, 512, 1, 256, 8192, 8192, 256, 512]
    - [58, 73.78]
  - - [8192, 512, 1, 512, 8192, 8192, 512, 512]
    - [58, 124.12]
  - - [8192, 512, 1, 1024, 8192, 8192, 1024, 512]
    - [59, 176.83]
  - - [8192, 512, 1, 2048, 8192, 8192, 2048, 512]
    - [59, 219.39]
  - - [8192, 512, 1, 4096, 8192, 8192, 4096, 512]
    - [59, 252.46]
  - - [8192, 512, 1, 8192, 8192, 8192, 8192, 512]
    - [56, 259.22]
  - - [8192, 1024, 1, 128, 8192, 8192, 128, 1024]
    - [48, 42.07]
  - - [8192, 1024, 1, 256, 8192, 8192, 256, 1024]
    - [49, 76.94]
  - - [8192, 1024, 1, 512, 8192, 8192, 512, 1024]
    - [52, 133.19]
  - - [8192, 1024, 1, 1024, 8192, 8192, 1024, 1024]
    - [48, 192.36]
  - - [8192, 1024, 1, 2048, 8192, 8192, 2048, 1024]
    - [51, 274.57]
  - - [8192, 1024, 1, 4096, 8192, 8192, 4096, 1024]
    - [52, 315.76]
  - - [8192, 1024, 1, 8192, 8192, 8192, 8192, 1024]
    - [49, 349.28]
  - - [8192, 2048, 1, 128, 8192, 8192, 128, 2048]
    - [49, 47.28]
  - - [8192, 2048, 1, 256, 8192, 8192, 256, 2048]
    - [49, 83.81]
  - - [8192, 2048, 1, 512, 8192, 8192, 512, 2048]
    - [48, 139.63]
  - - [8192, 2048, 1, 1024, 8192, 8192, 1024, 2048]
    - [51, 208.43]
  - - [8192, 2048, 1, 2048, 8192, 8192, 2048, 2048]
    - [52, 256.03]
  - - [8192, 2048, 1, 4096, 8192, 8192, 4096, 2048]
    - [49, 311.68]
  - - [8192, 2048, 1, 8192, 8192, 8192, 8192, 2048]
    - [49, 368.69]
  - - [8192, 4096, 1, 128, 8192, 8192, 128, 4096]
    - [50, 45.74]
  - - [8192, 4096, 1, 256, 8192, 8192, 256, 4096]
    - [50, 80.71]
  - - [8192, 4096, 1, 512, 8192, 8192, 512, 4096]
    - [51, 129.3]
  - - [8192, 4096, 1, 1024, 8192, 8192, 1024, 4096]
    - [52, 195.69]
  - - [8192, 4096, 1, 2048, 8192, 8192, 2048, 4096]
    - [51, 247.71]
  - - [8192, 4096, 1, 4096, 8192, 8192, 4096, 4096]
    - [51, 318.53]
  - - [8192, 4096, 1, 8192, 8192, 8192, 8192, 4096]
    - [51, 376.39]
  - - [8192, 8192, 1, 128, 8192, 8192, 128, 8192]
    - [20, 39.74]
  - - [8192, 8192, 1, 256, 8192, 8192, 256, 8192]
    - [8, 73.19]
  - - [8192, 8192, 1, 512, 8192, 8192, 512, 8192]
    - [49, 120.03]
  - - [8192, 8192, 1, 1024, 8192, 8192, 1024, 8192]
    - [48, 181.77]
  - - [8192, 8192, 1, 2048, 8192, 8192, 2048, 8192]
    - [49, 255.14]
  - - [8192, 8192, 1, 4096, 8192, 8192, 4096, 8192]
    - [51, 327.67]
  - - [8192, 8192, 1, 8192, 8192, 8192, 8192, 8192]
    - [51, 377.2]
- null
- null
- ExperimentalStreamK
- GridBased
