projects/hipblaslt/library/src/amd_detail/rocblaslt/src/Tensile/Logic/asm_full/aquavanjaram/gfx942_228cu/StreamK/aquavanjaram942_Cijk_Ailk_Bljk_F8B8NSS_BH_Bias_HAS_SAV_UserArgs.yaml
- {MinimumRequiredVersion: 4.33.0}
- aquavanjaram942
- {Architecture: gfx942, CUCount: 228}
- [Device 0049, Device 0050]
    SolutionIndex: 0
    SolutionNameMin: Cijk_Ailk_Bljk_F8B8NSS_BH_Bias_HAS_SAV_UserArgs_MT256x256x64_MI16x16x1_SN_LDSB1_CLR1_GRVWA16_GRVWB16_GSU0_GSUC0_GSUWGMRR0_K1_LBSPPA2048_LBSPPB512_LPA0_LPB16_LRVW8_MIWT8_8_PLR1_SU0_SUM0_SUS64_VWA8_VWB8_WGM1_WGMXCC1_WGMXCCGn1
    SolutionIndex: 1
    SolutionNameMin: Cijk_Ailk_Bljk_F8B8NSS_BH_Bias_HAS_SAV_UserArgs_MT256x256x64_MI16x16x1_SN_LDSB1_CLR1_GRVWA16_GRVWB8_GSU0_GSUC0_GSUWGMRR0_K1_LBSPPA2048_LBSPPB512_LPA0_LPB8_LRVW8_MIWT8_8_PLR1_SU0_SUM0_SUS64_VWA8_VWB8_WGM8_WGMXCC1_WGMXCCGn1
    SolutionIndex: 2
    SolutionNameMin: Cijk_Ailk_Bljk_F8B8NSS_BH_Bias_HAS_SAV_UserArgs_MT256x256x64_MI16x16x1_SN_LDSB1_CLR1_GRVWA8_GRVWB16_GSU0_GSUC0_GSUWGMRR0_K1_LBSPPA2048_LBSPPB512_LPA0_LPB16_LRVW8_MIWT8_8_PLR1_SU0_SUM0_SUS64_VWA8_VWB8_WGM8_WGMXCC1_WGMXCCGn1
    SolutionIndex: 3
    SolutionNameMin: Cijk_Ailk_Bljk_F8B8NSS_BH_Bias_HAS_SAV_UserArgs_MT128x256x64_MI16x16x1_SN_LDSB1_CLR1_GRVWA8_GRVWB8_GSU0_GSUC0_GSUWGMRR0_K1_LBSPPA1024_LBSPPB512_LPA64_LPB8_LRVW8_MIWT4_8_PLR1_SU0_SUM0_SUS64_VWA4_VWB8_WGM1_WGMXCC1_WGMXCCGn1
    SolutionIndex: 4
    SolutionNameMin: Cijk_Ailk_Bljk_F8B8NSS_BH_Bias_HAS_SAV_UserArgs_MT128x256x64_MI16x16x1_SN_LDSB1_CLR1_GRVWA8_GRVWB16_GSU0_GSUC0_GSUWGMRR0_K1_LBSPPA1024_LBSPPB512_LPA64_LPB16_LRVW8_MIWT4_8_PLR1_SU0_SUM0_SUS64_VWA4_VWB8_WGM1_WGMXCC1_WGMXCCGn1
    SolutionIndex: 5
    SolutionNameMin: Cijk_Ailk_Bljk_F8B8NSS_BH_Bias_HAS_SAV_UserArgs_MT128x256x64_MI16x16x1_SN_LDSB1_CLR1_GRVWA16_GRVWB16_GSU0_GSUC0_GSUWGMRR0_K1_LBSPPA1024_LBSPPB512_LPA64_LPB16_LRVW8_MIWT4_8_PLR1_SU0_SUM0_SUS64_VWA4_VWB8_WGM1_WGMXCC1_WGMXCCGn1
    SolutionIndex: 6
    SolutionNameMin: Cijk_Ailk_Bljk_F8B8NSS_BH_Bias_HAS_SAV_UserArgs_MT128x256x64_MI16x16x1_SN_LDSB1_CLR1_GRVWA8_GRVWB16_GSU0_GSUC0_GSUWGMRR0_K1_LBSPPA1024_LBSPPB512_LPA64_LPB16_LRVW8_MIWT4_8_PLR1_SU0_SUM0_SUS64_VWA4_VWB8_WGM4_WGMXCC1_WGMXCCGn1
    SolutionIndex: 7
    SolutionNameMin: Cijk_Ailk_Bljk_F8B8NSS_BH_Bias_HAS_SAV_UserArgs_MT128x256x64_MI16x16x1_SN_LDSB1_CLR1_GRVWA16_GRVWB16_GSU0_GSUC0_GSUWGMRR0_K1_LBSPPA1024_LBSPPB512_LPA64_LPB16_LRVW8_MIWT4_8_PLR1_SU0_SUM0_SUS64_VWA4_VWB8_WGM4_WGMXCC1_WGMXCCGn1
    SolutionIndex: 8
    SolutionNameMin: Cijk_Ailk_Bljk_F8B8NSS_BH_Bias_HAS_SAV_UserArgs_MT128x256x64_MI16x16x1_SN_LDSB1_CLR1_GRVWA8_GRVWB8_GSU0_GSUC0_GSUWGMRR0_K1_LBSPPA1024_LBSPPB512_LPA64_LPB8_LRVW8_MIWT4_8_PLR1_SU0_SUM0_SUS64_VWA4_VWB8_WGM8_WGMXCC1_WGMXCCGn1
    SolutionIndex: 9
    SolutionNameMin: Cijk_Ailk_Bljk_F8B8NSS_BH_Bias_HAS_SAV_UserArgs_MT128x128x64_MI16x16x1_SN_LDSB1_CLR1_GRVWA16_GRVWB8_GSU0_GSUC0_GSUWGMRR0_K1_LBSPPA1024_LBSPPB512_LPA32_LPB8_LRVW8_MIWT2_8_PLR1_SU0_SUM0_SUS64_VWA2_VWB8_WGM6_WGMXCC1_WGMXCCGn1
    SolutionIndex: 10
    SolutionNameMin: Cijk_Ailk_Bljk_F8B8NSS_BH_Bias_HAS_SAV_UserArgs_MT64x128x64_MI16x16x1_SN_LDSB0_CLR1_GRVWA8_GRVWB8_GSU0_GSUC0_GSUWGMRR0_K1_LBSPPA512_LBSPPB512_LPA16_LPB8_LRVW8_MIWT1_8_PLR1_SU0_SUM0_SUS64_VWA1_VWB8_WGM1_WGMXCC1_WGMXCCGn1
    SolutionIndex: 11
    SolutionNameMin: Cijk_Ailk_Bljk_F8B8NSS_BH_Bias_HAS_SAV_UserArgs_MT128x128x64_MI16x16x1_SN_LDSB1_CLR1_GRVWA16_GRVWB8_GSU0_GSUC0_GSUWGMRR0_K1_LBSPPA1024_LBSPPB256_LPA64_LPB8_LRVW8_MIWT4_4_PLR1_SU0_SUM0_SUS64_VWA4_VWB4_WGM1_WGMXCC1_WGMXCCGn1
    SolutionIndex: 12
    SolutionNameMin: Cijk_Ailk_Bljk_F8B8NSS_BH_Bias_HAS_SAV_UserArgs_MT128x128x64_MI16x16x1_SN_LDSB1_CLR1_GRVWA8_GRVWB16_GSU0_GSUC0_GSUWGMRR0_K1_LBSPPA1024_LBSPPB256_LPA64_LPB16_LRVW8_MIWT4_4_PLR1_SU0_SUM0_SUS64_VWA4_VWB4_WGM1_WGMXCC1_WGMXCCGn1
    SolutionIndex: 13
    SolutionNameMin: Cijk_Ailk_Bljk_F8B8NSS_BH_Bias_HAS_SAV_UserArgs_MT128x128x64_MI16x16x1_SN_LDSB1_CLR1_GRVWA16_GRVWB16_GSU0_GSUC0_GSUWGMRR0_K1_LBSPPA1024_LBSPPB256_LPA64_LPB16_LRVW8_MIWT4_4_PLR1_SU0_SUM0_SUS64_VWA4_VWB4_WGM1_WGMXCC1_WGMXCCGn1
    SolutionIndex: 14
    SolutionNameMin: Cijk_Ailk_Bljk_F8B8NSS_BH_Bias_HAS_SAV_UserArgs_MT128x128x64_MI16x16x1_SN_LDSB1_CLR1_GRVWA16_GRVWB16_GSU0_GSUC0_GSUWGMRR0_K1_LBSPPA1024_LBSPPB256_LPA64_LPB16_LRVW8_MIWT4_4_PLR1_SU0_SUM0_SUS64_VWA4_VWB4_WGM4_WGMXCC1_WGMXCCGn1
    SolutionIndex: 15
    SolutionNameMin: Cijk_Ailk_Bljk_F8B8NSS_BH_Bias_HAS_SAV_UserArgs_MT128x128x64_MI16x16x1_SN_LDSB1_CLR1_GRVWA16_GRVWB16_GSU0_GSUC0_GSUWGMRR0_K1_LBSPPA1024_LBSPPB256_LPA64_LPB16_LRVW8_MIWT4_4_PLR1_SU0_SUM0_SUS64_VWA4_VWB4_WGM6_WGMXCC1_WGMXCCGn1
    SolutionIndex: 16
    SolutionNameMin: Cijk_Ailk_Bljk_F8B8NSS_BH_Bias_HAS_SAV_UserArgs_MT128x128x64_MI16x16x1_SN_LDSB1_CLR1_GRVWA16_GRVWB8_GSU0_GSUC0_GSUWGMRR0_K1_LBSPPA1024_LBSPPB256_LPA64_LPB8_LRVW8_MIWT4_4_PLR1_SU0_SUM0_SUS64_VWA4_VWB4_WGM8_WGMXCC1_WGMXCCGn1
    SolutionIndex: 17
    SolutionNameMin: Cijk_Ailk_Bljk_F8B8NSS_BH_Bias_HAS_SAV_UserArgs_MT128x128x64_MI16x16x1_SN_LDSB1_CLR1_GRVWA16_GRVWB16_GSU0_GSUC0_GSUWGMRR0_K1_LBSPPA1024_LBSPPB256_LPA64_LPB16_LRVW8_MIWT4_4_PLR1_SU0_SUM0_SUS64_VWA4_VWB4_WGM8_WGMXCC1_WGMXCCGn1
    SolutionIndex: 18
    SolutionNameMin: Cijk_Ailk_Bljk_F8B8NSS_BH_Bias_HAS_SAV_UserArgs_MT64x128x64_MI16x16x1_SN_LDSB0_CLR1_GRVWA16_GRVWB8_GSU0_GSUC0_GSUWGMRR0_K1_LBSPPA512_LBSPPB256_LPA32_LPB8_LRVW8_MIWT2_4_PLR1_SU0_SUM0_SUS64_VWA2_VWB4_WGM1_WGMXCC1_WGMXCCGn1
    SolutionIndex: 19
    SolutionNameMin: Cijk_Ailk_Bljk_F8B8NSS_BH_Bias_HAS_SAV_UserArgs_MT64x128x64_MI16x16x1_SN_LDSB0_CLR1_GRVWA8_GRVWB16_GSU0_GSUC0_GSUWGMRR0_K1_LBSPPA512_LBSPPB256_LPA32_LPB16_LRVW8_MIWT2_4_PLR1_SU0_SUM0_SUS64_VWA2_VWB4_WGM1_WGMXCC1_WGMXCCGn1
    SolutionIndex: 20
    SolutionNameMin: Cijk_Ailk_Bljk_F8B8NSS_BH_Bias_HAS_SAV_UserArgs_MT64x128x64_MI16x16x1_SN_LDSB0_CLR1_GRVWA16_GRVWB16_GSU0_GSUC0_GSUWGMRR0_K1_LBSPPA512_LBSPPB256_LPA32_LPB16_LRVW8_MIWT2_4_PLR1_SU0_SUM0_SUS64_VWA2_VWB4_WGM1_WGMXCC1_WGMXCCGn1
    SolutionIndex: 21
    SolutionNameMin: Cijk_Ailk_Bljk_F8B8NSS_BH_Bias_HAS_SAV_UserArgs_MT64x128x64_MI16x16x1_SN_LDSB0_CLR1_GRVWA16_GRVWB16_GSU0_GSUC0_GSUWGMRR0_K1_LBSPPA512_LBSPPB256_LPA32_LPB16_LRVW8_MIWT2_4_PLR1_SU0_SUM0_SUS64_VWA2_VWB4_WGM6_WGMXCC1_WGMXCCGn1
    SolutionIndex: 22
    SolutionNameMin: Cijk_Ailk_Bljk_F8B8NSS_BH_Bias_HAS_SAV_UserArgs_MT64x128x64_MI16x16x1_SN_LDSB0_CLR1_GRVWA8_GRVWB16_GSU0_GSUC0_GSUWGMRR0_K1_LBSPPA512_LBSPPB256_LPA32_LPB16_LRVW8_MIWT2_4_PLR1_SU0_SUM0_SUS64_VWA2_VWB4_WGM8_WGMXCC1_WGMXCCGn1
    SolutionIndex: 23
    SolutionNameMin: Cijk_Ailk_Bljk_F8B8NSS_BH_Bias_HAS_SAV_UserArgs_MT128x64x64_MI16x16x1_SN_LDSB0_CLR1_GRVWA16_GRVWB8_GSU0_GSUC0_GSUWGMRR0_K1_LBSPPA1024_LBSPPB128_LPA64_LPB8_LRVW8_MIWT4_2_PLR1_SU0_SUM0_SUS64_VWA4_VWB2_WGM1_WGMXCC1_WGMXCCGn1
    SolutionIndex: 24
    SolutionNameMin: Cijk_Ailk_Bljk_F8B8NSS_BH_Bias_HAS_SAV_UserArgs_MT128x64x64_MI16x16x1_SN_LDSB0_CLR1_GRVWA8_GRVWB16_GSU0_GSUC0_GSUWGMRR0_K1_LBSPPA1024_LBSPPB128_LPA64_LPB16_LRVW8_MIWT4_2_PLR1_SU0_SUM0_SUS64_VWA4_VWB2_WGM1_WGMXCC1_WGMXCCGn1
    SolutionIndex: 25
    SolutionNameMin: Cijk_Ailk_Bljk_F8B8NSS_BH_Bias_HAS_SAV_UserArgs_MT128x64x64_MI16x16x1_SN_LDSB0_CLR1_GRVWA16_GRVWB16_GSU0_GSUC0_GSUWGMRR0_K1_LBSPPA1024_LBSPPB128_LPA64_LPB16_LRVW8_MIWT4_2_PLR1_SU0_SUM0_SUS64_VWA4_VWB2_WGM1_WGMXCC1_WGMXCCGn1
    SolutionIndex: 26
    SolutionNameMin: Cijk_Ailk_Bljk_F8B8NSS_BH_Bias_HAS_SAV_UserArgs_MT128x64x64_MI16x16x1_SN_LDSB0_CLR1_GRVWA8_GRVWB8_GSU0_GSUC0_GSUWGMRR0_K1_LBSPPA1024_LBSPPB128_LPA64_LPB8_LRVW8_MIWT4_2_PLR1_SU0_SUM0_SUS64_VWA4_VWB2_WGM4_WGMXCC1_WGMXCCGn1
    SolutionIndex: 27
    SolutionNameMin: Cijk_Ailk_Bljk_F8B8NSS_BH_Bias_HAS_SAV_UserArgs_MT128x64x64_MI16x16x1_SN_LDSB0_CLR1_GRVWA8_GRVWB16_GSU0_GSUC0_GSUWGMRR0_K1_LBSPPA1024_LBSPPB128_LPA64_LPB16_LRVW8_MIWT4_2_PLR1_SU0_SUM0_SUS64_VWA4_VWB2_WGM6_WGMXCC1_WGMXCCGn1
    SolutionIndex: 28
    SolutionNameMin: Cijk_Ailk_Bljk_F8B8NSS_BH_Bias_HAS_SAV_UserArgs_MT32x128x64_MI16x16x1_SN_LDSB0_CLR1_GRVWA8_GRVWB8_GSU0_GSUC0_GSUWGMRR0_K1_LBSPPA256_LBSPPB256_LPA16_LPB8_LRVW8_MIWT1_4_PLR1_SU0_SUM0_SUS64_VWA1_VWB4_WGM1_WGMXCC1_WGMXCCGn1
    SolutionIndex: 29
    SolutionNameMin: Cijk_Ailk_Bljk_F8B8NSS_BH_Bias_HAS_SAV_UserArgs_MT32x128x64_MI16x16x1_SN_LDSB0_CLR1_GRVWA8_GRVWB16_GSU0_GSUC0_GSUWGMRR0_K1_LBSPPA256_LBSPPB256_LPA16_LPB16_LRVW8_MIWT1_4_PLR1_SU0_SUM0_SUS64_VWA1_VWB4_WGM1_WGMXCC1_WGMXCCGn1
    SolutionIndex: 30
    SolutionNameMin: Cijk_Ailk_Bljk_F8B8NSS_BH_Bias_HAS_SAV_UserArgs_MT128x32x64_MI16x16x1_SN_LDSB0_CLR1_GRVWA8_GRVWB8_GSU0_GSUC0_GSUWGMRR0_K1_LBSPPA1024_LBSPPB128_LPA64_LPB8_LRVW8_MIWT4_1_PLR1_SU0_SUM0_SUS64_VWA4_VWB1_WGM1_WGMXCC1_WGMXCCGn1
    SolutionIndex: 31
    SolutionNameMin: Cijk_Ailk_Bljk_F8B8NSS_BH_Bias_HAS_SAV_UserArgs_MT64x64x64_MI16x16x1_SN_LDSB0_CLR1_GRVWA8_GRVWB8_GSU0_GSUC0_GSUWGMRR0_K1_LBSPPA512_LBSPPB128_LPA32_LPB8_LRVW8_MIWT2_2_PLR1_SU0_SUM0_SUS64_VWA2_VWB2_WGM1_WGMXCC1_WGMXCCGn1
    SolutionIndex: 32
    SolutionNameMin: Cijk_Ailk_Bljk_F8B8NSS_BH_Bias_HAS_SAV_UserArgs_MT64x64x64_MI16x16x1_SN_LDSB0_CLR1_GRVWA8_GRVWB16_GSU0_GSUC0_GSUWGMRR0_K1_LBSPPA512_LBSPPB128_LPA32_LPB16_LRVW8_MIWT2_2_PLR1_SU0_SUM0_SUS64_VWA2_VWB2_WGM1_WGMXCC1_WGMXCCGn1
    SolutionIndex: 33
    SolutionNameMin: Cijk_Ailk_Bljk_F8B8NSS_BH_Bias_HAS_SAV_UserArgs_MT64x64x64_MI16x16x1_SN_LDSB0_CLR1_GRVWA8_GRVWB16_GSU0_GSUC0_GSUWGMRR0_K1_LBSPPA512_LBSPPB128_LPA32_LPB16_LRVW8_MIWT2_2_PLR1_SU0_SUM0_SUS64_VWA2_VWB2_WGM4_WGMXCC1_WGMXCCGn1
    SolutionIndex: 34
    SolutionNameMin: Cijk_Ailk_Bljk_F8B8NSS_BH_Bias_HAS_SAV_UserArgs_MT32x64x64_MI16x16x1_SN_LDSB0_CLR1_GRVWA8_GRVWB8_GSU0_GSUC0_GSUWGMRR0_K1_LBSPPA256_LBSPPB128_LPA16_LPB8_LRVW8_MIWT1_2_PLR1_SU0_SUM0_SUS64_VWA1_VWB2_WGM1_WGMXCC1_WGMXCCGn1
    SolutionIndex: 35
    SolutionNameMin: Cijk_Ailk_Bljk_F8B8NSS_BH_Bias_HAS_SAV_UserArgs_MT32x64x64_MI16x16x1_SN_LDSB0_CLR1_GRVWA8_GRVWB16_GSU0_GSUC0_GSUWGMRR0_K1_LBSPPA256_LBSPPB128_LPA16_LPB16_LRVW8_MIWT1_2_PLR1_SU0_SUM0_SUS64_VWA1_VWB2_WGM1_WGMXCC1_WGMXCCGn1
    SolutionIndex: 36
    SolutionNameMin: Cijk_Ailk_Bljk_F8B8NSS_BH_Bias_HAS_SAV_UserArgs_MT64x32x64_MI16x16x1_SN_LDSB0_CLR1_GRVWA16_GRVWB8_GSU0_GSUC0_GSUWGMRR0_K1_LBSPPA512_LBSPPB128_LPA32_LPB8_LRVW8_MIWT2_1_PLR1_SU0_SUM0_SUS64_VWA2_VWB1_WGM1_WGMXCC1_WGMXCCGn1
    SolutionIndex: 37
    SolutionNameMin: Cijk_Ailk_Bljk_F8B8NSS_BH_Bias_HAS_SAV_UserArgs_MT32x32x64_MI16x16x1_SN_LDSB0_CLR1_GRVWA8_GRVWB8_GSU0_GSUC0_GSUWGMRR0_K1_LBSPPA256_LBSPPB128_LPA16_LPB8_LRVW8_MIWT1_1_PLR1_SU0_SUM0_SUS64_VWA1_VWB1_WGM1_WGMXCC1_WGMXCCGn1
    SolutionIndex: 38
    SolutionNameMin: Cijk_Ailk_Bljk_F8B8NSS_BH_Bias_HAS_SAV_UserArgs_MT128x256x128_MI16x16x1_SN_LDSB1_CLR1_GRVWA8_GRVWB16_GSU0_GSUC0_GSUWGMRR0_K1_LBSPPA1024_LBSPPB1024_LPA64_LPB16_LRVW8_MIWT4_8_PLR1_SU0_SUM0_SUS128_VWA4_VWB8_WGM1_WGMXCC1_WGMXCCGn1
    SolutionIndex: 39
    SolutionNameMin: Cijk_Ailk_Bljk_F8B8NSS_BH_Bias_HAS_SAV_UserArgs_MT128x256x128_MI16x16x1_SN_LDSB1_CLR1_GRVWA16_GRVWB16_GSU0_GSUC0_GSUWGMRR0_K1_LBSPPA1024_LBSPPB1024_LPA64_LPB16_LRVW8_MIWT4_8_PLR1_SU0_SUM0_SUS128_VWA4_VWB8_WGM1_WGMXCC1_WGMXCCGn1
    SolutionIndex: 40
    SolutionNameMin: Cijk_Ailk_Bljk_F8B8NSS_BH_Bias_HAS_SAV_UserArgs_MT128x256x128_MI16x16x1_SN_LDSB1_CLR1_GRVWA8_GRVWB16_GSU0_GSUC0_GSUWGMRR0_K1_LBSPPA1024_LBSPPB1024_LPA64_LPB16_LRVW8_MIWT4_8_PLR1_SU0_SUM0_SUS128_VWA4_VWB8_WGM4_WGMXCC1_WGMXCCGn1
    SolutionIndex: 41
    SolutionNameMin: Cijk_Ailk_Bljk_F8B8NSS_BH_Bias_HAS_SAV_UserArgs_MT128x256x128_MI16x16x1_SN_LDSB1_CLR1_GRVWA16_GRVWB16_GSU0_GSUC0_GSUWGMRR0_K1_LBSPPA1024_LBSPPB1024_LPA64_LPB16_LRVW8_MIWT4_8_PLR1_SU0_SUM0_SUS128_VWA4_VWB8_WGM4_WGMXCC1_WGMXCCGn1
    SolutionIndex: 42
    SolutionNameMin: Cijk_Ailk_Bljk_F8B8NSS_BH_Bias_HAS_SAV_UserArgs_MT128x256x128_MI16x16x1_SN_LDSB1_CLR1_GRVWA8_GRVWB16_GSU0_GSUC0_GSUWGMRR0_K1_LBSPPA1024_LBSPPB1024_LPA64_LPB16_LRVW8_MIWT4_8_PLR1_SU0_SUM0_SUS128_VWA4_VWB8_WGM6_WGMXCC1_WGMXCCGn1
    SolutionIndex: 43
    SolutionNameMin: Cijk_Ailk_Bljk_F8B8NSS_BH_Bias_HAS_SAV_UserArgs_MT128x256x128_MI16x16x1_SN_LDSB1_CLR1_GRVWA16_GRVWB16_GSU0_GSUC0_GSUWGMRR0_K1_LBSPPA1024_LBSPPB1024_LPA64_LPB16_LRVW8_MIWT4_8_PLR1_SU0_SUM0_SUS128_VWA4_VWB8_WGM6_WGMXCC1_WGMXCCGn1
    SolutionIndex: 44
    SolutionNameMin: Cijk_Ailk_Bljk_F8B8NSS_BH_Bias_HAS_SAV_UserArgs_MT128x256x128_MI16x16x1_SN_LDSB1_CLR1_GRVWA16_GRVWB16_GSU0_GSUC0_GSUWGMRR0_K1_LBSPPA1024_LBSPPB1024_LPA64_LPB16_LRVW8_MIWT4_8_PLR1_SU0_SUM0_SUS128_VWA4_VWB8_WGM8_WGMXCC1_WGMXCCGn1
    SolutionIndex: 45
    SolutionNameMin: Cijk_Ailk_Bljk_F8B8NSS_BH_Bias_HAS_SAV_UserArgs_MT256x144x128_MI16x16x1_SN_LDSB1_CLR1_GRVWA8_GRVWB8_GSU0_GSUC0_GSUWGMRR0_K1_LBSPPA2048_LBSPPB128_LPA64_LPB8_LRVW8_MIWT4_9_PLR1_SU0_SUM0_SUS128_VWA4_VWB1_WGM1_WGMXCC1_WGMXCCGn1
    SolutionIndex: 46
    SolutionNameMin: Cijk_Ailk_Bljk_F8B8NSS_BH_Bias_HAS_SAV_UserArgs_MT256x144x128_MI16x16x1_SN_LDSB1_CLR1_GRVWA16_GRVWB8_GSU0_GSUC0_GSUWGMRR0_K1_LBSPPA2048_LBSPPB128_LPA64_LPB8_LRVW8_MIWT4_9_PLR1_SU0_SUM0_SUS128_VWA4_VWB1_WGM1_WGMXCC1_WGMXCCGn1
    SolutionIndex: 47
    SolutionNameMin: Cijk_Ailk_Bljk_F8B8NSS_BH_Bias_HAS_SAV_UserArgs_MT256x144x128_MI16x16x1_SN_LDSB1_CLR1_GRVWA16_GRVWB8_GSU0_GSUC0_GSUWGMRR0_K1_LBSPPA2048_LBSPPB128_LPA64_LPB8_LRVW8_MIWT4_9_PLR1_SU0_SUM0_SUS128_VWA4_VWB1_WGM4_WGMXCC1_WGMXCCGn1
    SolutionIndex: 48
    SolutionNameMin: Cijk_Ailk_Bljk_F8B8NSS_BH_Bias_HAS_SAV_UserArgs_MT256x144x128_MI16x16x1_SN_LDSB1_CLR1_GRVWA8_GRVWB8_GSU0_GSUC0_GSUWGMRR0_K1_LBSPPA2048_LBSPPB128_LPA64_LPB8_LRVW8_MIWT4_9_PLR1_SU0_SUM0_SUS128_VWA4_VWB1_WGM6_WGMXCC1_WGMXCCGn1
    SolutionIndex: 49
    SolutionNameMin: Cijk_Ailk_Bljk_F8B8NSS_BH_Bias_HAS_SAV_UserArgs_MT256x144x128_MI16x16x1_SN_LDSB1_CLR1_GRVWA16_GRVWB8_GSU0_GSUC0_GSUWGMRR0_K1_LBSPPA2048_LBSPPB128_LPA64_LPB8_LRVW8_MIWT4_9_PLR1_SU0_SUM0_SUS128_VWA4_VWB1_WGM6_WGMXCC1_WGMXCCGn1
    SolutionIndex: 50
    SolutionNameMin: Cijk_Ailk_Bljk_F8B8NSS_BH_Bias_HAS_SAV_UserArgs_MT256x144x128_MI16x16x1_SN_LDSB1_CLR1_GRVWA8_GRVWB8_GSU0_GSUC0_GSUWGMRR0_K1_LBSPPA2048_LBSPPB128_LPA64_LPB8_LRVW8_MIWT4_9_PLR1_SU0_SUM0_SUS128_VWA4_VWB1_WGM8_WGMXCC1_WGMXCCGn1
    SolutionIndex: 51
    SolutionNameMin: Cijk_Ailk_Bljk_F8B8NSS_BH_Bias_HAS_SAV_UserArgs_MT256x144x128_MI16x16x1_SN_LDSB1_CLR1_GRVWA16_GRVWB8_GSU0_GSUC0_GSUWGMRR0_K1_LBSPPA2048_LBSPPB128_LPA64_LPB8_LRVW8_MIWT4_9_PLR1_SU0_SUM0_SUS128_VWA4_VWB1_WGM8_WGMXCC1_WGMXCCGn1
    SolutionIndex: 52
    SolutionNameMin: Cijk_Ailk_Bljk_F8B8NSS_BH_Bias_HAS_SAV_UserArgs_MT64x144x128_MI16x16x1_SN_LDSB1_CLR1_GRVWA8_GRVWB8_GSU0_GSUC0_GSUWGMRR0_K1_LBSPPA512_LBSPPB128_LPA16_LPB8_LRVW8_MIWT1_9_PLR1_SU0_SUM0_SUS128_VWA1_VWB1_WGM1_WGMXCC1_WGMXCCGn1
    SolutionIndex: 53
    SolutionNameMin: Cijk_Ailk_Bljk_F8B8NSS_BH_Bias_HAS_SAV_UserArgs_MT64x144x128_MI16x16x1_SN_LDSB1_CLR1_GRVWA16_GRVWB8_GSU0_GSUC0_GSUWGMRR0_K1_LBSPPA512_LBSPPB128_LPA16_LPB8_LRVW8_MIWT1_9_PLR1_SU0_SUM0_SUS128_VWA1_VWB1_WGM1_WGMXCC1_WGMXCCGn1
    SolutionIndex: 54
    SolutionNameMin: Cijk_Ailk_Bljk_F8B8NSS_BH_Bias_HAS_SAV_UserArgs_MT128x144x128_MI16x16x1_SN_LDSB1_CLR1_GRVWA16_GRVWB8_GSU0_GSUC0_GSUWGMRR0_K1_LBSPPA1024_LBSPPB128_LPA32_LPB8_LRVW8_MIWT2_9_PLR1_SU0_SUM0_SUS128_VWA2_VWB1_WGM1_WGMXCC1_WGMXCCGn1
    SolutionIndex: 55
    SolutionNameMin: Cijk_Ailk_Bljk_F8B8NSS_BH_Bias_HAS_SAV_UserArgs_MT128x144x128_MI16x16x1_SN_LDSB1_CLR1_GRVWA16_GRVWB8_GSU0_GSUC0_GSUWGMRR0_K1_LBSPPA1024_LBSPPB128_LPA32_LPB8_LRVW8_MIWT2_9_PLR1_SU0_SUM0_SUS128_VWA2_VWB1_WGM6_WGMXCC1_WGMXCCGn1
    SolutionIndex: 56
    SolutionNameMin: Cijk_Ailk_Bljk_F8B8NSS_BH_Bias_HAS_SAV_UserArgs_MT128x144x128_MI16x16x1_SN_LDSB1_CLR1_GRVWA16_GRVWB8_GSU0_GSUC0_GSUWGMRR0_K1_LBSPPA1024_LBSPPB128_LPA32_LPB8_LRVW8_MIWT2_9_PLR1_SU0_SUM0_SUS128_VWA2_VWB1_WGM8_WGMXCC1_WGMXCCGn1
    SolutionIndex: 57
    SolutionNameMin: Cijk_Ailk_Bljk_F8B8NSS_BH_Bias_HAS_SAV_UserArgs_MT128x128x128_MI16x16x1_SN_LDSB1_CLR1_GRVWA16_GRVWB16_GSU0_GSUC0_GSUWGMRR0_K1_LBSPPA1024_LBSPPB512_LPA64_LPB16_LRVW8_MIWT4_4_PLR1_SU0_SUM0_SUS128_VWA4_VWB4_WGM1_WGMXCC1_WGMXCCGn1
    SolutionIndex: 58
    SolutionNameMin: Cijk_Ailk_Bljk_F8B8NSS_BH_Bias_HAS_SAV_UserArgs_MT128x128x128_MI16x16x1_SN_LDSB1_CLR1_GRVWA16_GRVWB16_GSU0_GSUC0_GSUWGMRR0_K1_LBSPPA1024_LBSPPB512_LPA64_LPB16_LRVW8_MIWT4_4_PLR1_SU0_SUM0_SUS128_VWA4_VWB4_WGM4_WGMXCC1_WGMXCCGn1
    SolutionIndex: 59
    SolutionNameMin: Cijk_Ailk_Bljk_F8B8NSS_BH_Bias_HAS_SAV_UserArgs_MT128x128x128_MI16x16x1_SN_LDSB1_CLR1_GRVWA16_GRVWB16_GSU0_GSUC0_GSUWGMRR0_K1_LBSPPA1024_LBSPPB512_LPA64_LPB16_LRVW8_MIWT4_4_PLR1_SU0_SUM0_SUS128_VWA4_VWB4_WGM6_WGMXCC1_WGMXCCGn1
    SolutionIndex: 60
    SolutionNameMin: Cijk_Ailk_Bljk_F8B8NSS_BH_Bias_HAS_SAV_UserArgs_MT128x128x128_MI16x16x1_SN_LDSB1_CLR1_GRVWA16_GRVWB16_GSU0_GSUC0_GSUWGMRR0_K1_LBSPPA1024_LBSPPB512_LPA64_LPB16_LRVW8_MIWT4_4_PLR1_SU0_SUM0_SUS128_VWA4_VWB4_WGM8_WGMXCC1_WGMXCCGn1
    SolutionIndex: 61
    SolutionNameMin: Cijk_Ailk_Bljk_F8B8NSS_BH_Bias_HAS_SAV_UserArgs_MT64x128x128_MI16x16x1_SN_LDSB1_CLR1_GRVWA16_GRVWB16_GSU0_GSUC0_GSUWGMRR0_K1_LBSPPA512_LBSPPB512_LPA32_LPB16_LRVW8_MIWT2_4_PLR1_SU0_SUM0_SUS128_VWA2_VWB4_WGM1_WGMXCC1_WGMXCCGn1
    SolutionIndex: 62
    SolutionNameMin: Cijk_Ailk_Bljk_F8B8NSS_BH_Bias_HAS_SAV_UserArgs_MT128x64x128_MI16x16x1_SN_LDSB1_CLR1_GRVWA16_GRVWB16_GSU0_GSUC0_GSUWGMRR0_K1_LBSPPA1024_LBSPPB256_LPA64_LPB16_LRVW8_MIWT4_2_PLR1_SU0_SUM0_SUS128_VWA4_VWB2_WGM4_WGMXCC1_WGMXCCGn1
    SolutionIndex: 63
    SolutionNameMin: Cijk_Ailk_Bljk_F8B8NSS_BH_Bias_HAS_SAV_UserArgs_MT128x64x128_MI16x16x1_SN_LDSB1_CLR1_GRVWA16_GRVWB16_GSU0_GSUC0_GSUWGMRR0_K1_LBSPPA1024_LBSPPB256_LPA64_LPB16_LRVW8_MIWT4_2_PLR1_SU0_SUM0_SUS128_VWA4_VWB2_WGM6_WGMXCC1_WGMXCCGn1
    SolutionIndex: 64
    SolutionNameMin: Cijk_Ailk_Bljk_F8B8NSS_BH_Bias_HAS_SAV_UserArgs_MT128x64x128_MI16x16x1_SN_LDSB1_CLR1_GRVWA16_GRVWB16_GSU0_GSUC0_GSUWGMRR0_K1_LBSPPA1024_LBSPPB256_LPA64_LPB16_LRVW8_MIWT4_2_PLR1_SU0_SUM0_SUS128_VWA4_VWB2_WGM8_WGMXCC1_WGMXCCGn1
    SolutionIndex: 65
    SolutionNameMin: Cijk_Ailk_Bljk_F8B8NSS_BH_Bias_HAS_SAV_UserArgs_MT64x64x128_MI16x16x1_SN_LDSB1_CLR1_GRVWA16_GRVWB8_GSU0_GSUC0_GSUWGMRR0_K1_LBSPPA512_LBSPPB256_LPA32_LPB8_LRVW8_MIWT2_2_PLR1_SU0_SUM0_SUS128_VWA2_VWB2_WGM1_WGMXCC1_WGMXCCGn1
    SolutionIndex: 66
    SolutionNameMin: Cijk_Ailk_Bljk_F8B8NSS_BH_Bias_HAS_SAV_UserArgs_MT64x64x128_MI16x16x1_SN_LDSB1_CLR1_GRVWA8_GRVWB16_GSU0_GSUC0_GSUWGMRR0_K1_LBSPPA512_LBSPPB256_LPA32_LPB16_LRVW8_MIWT2_2_PLR1_SU0_SUM0_SUS128_VWA2_VWB2_WGM1_WGMXCC1_WGMXCCGn1
    SolutionIndex: 67
    SolutionNameMin: Cijk_Ailk_Bljk_F8B8NSS_BH_Bias_HAS_SAV_UserArgs_MT64x64x128_MI16x16x1_SN_LDSB1_CLR1_GRVWA16_GRVWB16_GSU0_GSUC0_GSUWGMRR0_K1_LBSPPA512_LBSPPB256_LPA32_LPB16_LRVW8_MIWT2_2_PLR1_SU0_SUM0_SUS128_VWA2_VWB2_WGM1_WGMXCC1_WGMXCCGn1
    SolutionIndex: 68
    SolutionNameMin: Cijk_Ailk_Bljk_F8B8NSS_BH_Bias_HAS_SAV_UserArgs_MT64x64x128_MI16x16x1_SN_LDSB1_CLR1_GRVWA16_GRVWB8_GSU0_GSUC0_GSUWGMRR0_K1_LBSPPA512_LBSPPB256_LPA32_LPB8_LRVW8_MIWT2_2_PLR1_SU0_SUM0_SUS128_VWA2_VWB2_WGM4_WGMXCC1_WGMXCCGn1
    SolutionIndex: 69
    SolutionNameMin: Cijk_Ailk_Bljk_F8B8NSS_BH_Bias_HAS_SAV_UserArgs_MT64x64x128_MI16x16x1_SN_LDSB1_CLR1_GRVWA16_GRVWB16_GSU0_GSUC0_GSUWGMRR0_K1_LBSPPA512_LBSPPB256_LPA32_LPB16_LRVW8_MIWT2_2_PLR1_SU0_SUM0_SUS128_VWA2_VWB2_WGM4_WGMXCC1_WGMXCCGn1
    SolutionIndex: 70
    SolutionNameMin: Cijk_Ailk_Bljk_F8B8NSS_BH_Bias_HAS_SAV_UserArgs_MT64x64x128_MI16x16x1_SN_LDSB1_CLR1_GRVWA16_GRVWB8_GSU0_GSUC0_GSUWGMRR0_K1_LBSPPA512_LBSPPB256_LPA32_LPB8_LRVW8_MIWT2_2_PLR1_SU0_SUM0_SUS128_VWA2_VWB2_WGM6_WGMXCC1_WGMXCCGn1
    SolutionIndex: 71
    SolutionNameMin: Cijk_Ailk_Bljk_F8B8NSS_BH_Bias_HAS_SAV_UserArgs_MT64x64x128_MI16x16x1_SN_LDSB1_CLR1_GRVWA8_GRVWB16_GSU0_GSUC0_GSUWGMRR0_K1_LBSPPA512_LBSPPB256_LPA32_LPB16_LRVW8_MIWT2_2_PLR1_SU0_SUM0_SUS128_VWA2_VWB2_WGM6_WGMXCC1_WGMXCCGn1
    SolutionIndex: 72
    SolutionNameMin: Cijk_Ailk_Bljk_F8B8NSS_BH_Bias_HAS_SAV_UserArgs_MT64x64x128_MI16x16x1_SN_LDSB1_CLR1_GRVWA16_GRVWB16_GSU0_GSUC0_GSUWGMRR0_K1_LBSPPA512_LBSPPB256_LPA32_LPB16_LRVW8_MIWT2_2_PLR1_SU0_SUM0_SUS128_VWA2_VWB2_WGM6_WGMXCC1_WGMXCCGn1
    SolutionIndex: 73
    SolutionNameMin: Cijk_Ailk_Bljk_F8B8NSS_BH_Bias_HAS_SAV_UserArgs_MT64x64x128_MI16x16x1_SN_LDSB1_CLR1_GRVWA8_GRVWB16_GSU0_GSUC0_GSUWGMRR0_K1_LBSPPA512_LBSPPB256_LPA32_LPB16_LRVW8_MIWT2_2_PLR1_SU0_SUM0_SUS128_VWA2_VWB2_WGM8_WGMXCC1_WGMXCCGn1
    SolutionIndex: 74
    SolutionNameMin: Cijk_Ailk_Bljk_F8B8NSS_BH_Bias_HAS_SAV_UserArgs_MT64x64x128_MI16x16x1_SN_LDSB1_CLR1_GRVWA16_GRVWB16_GSU0_GSUC0_GSUWGMRR0_K1_LBSPPA512_LBSPPB256_LPA32_LPB16_LRVW8_MIWT2_2_PLR1_SU0_SUM0_SUS128_VWA2_VWB2_WGM8_WGMXCC1_WGMXCCGn1
    SolutionIndex: 75
    SolutionNameMin: Cijk_Ailk_Bljk_F8B8NSS_BH_Bias_HAS_SAV_UserArgs_MT32x64x128_MI16x16x1_SN_LDSB0_CLR1_GRVWA8_GRVWB8_GSU0_GSUC0_GSUWGMRR0_K1_LBSPPA256_LBSPPB256_LPA16_LPB8_LRVW8_MIWT1_2_PLR1_SU0_SUM0_SUS128_VWA1_VWB2_WGM1_WGMXCC1_WGMXCCGn1
    SolutionIndex: 76
    SolutionNameMin: Cijk_Ailk_Bljk_F8B8NSS_BH_Bias_HAS_SAV_UserArgs_MT32x64x128_MI16x16x1_SN_LDSB0_CLR1_GRVWA8_GRVWB16_GSU0_GSUC0_GSUWGMRR0_K1_LBSPPA256_LBSPPB256_LPA16_LPB16_LRVW8_MIWT1_2_PLR1_SU0_SUM0_SUS128_VWA1_VWB2_WGM1_WGMXCC1_WGMXCCGn1
    SolutionIndex: 77
    SolutionNameMin: Cijk_Ailk_Bljk_F8B8NSS_BH_Bias_HAS_SAV_UserArgs_MT32x64x128_MI16x16x1_SN_LDSB0_CLR1_GRVWA16_GRVWB16_GSU0_GSUC0_GSUWGMRR0_K1_LBSPPA256_LBSPPB256_LPA16_LPB16_LRVW8_MIWT1_2_PLR1_SU0_SUM0_SUS128_VWA1_VWB2_WGM1_WGMXCC1_WGMXCCGn1
    SolutionIndex: 78
    SolutionNameMin: Cijk_Ailk_Bljk_F8B8NSS_BH_Bias_HAS_SAV_UserArgs_MT32x64x128_MI16x16x1_SN_LDSB0_CLR1_GRVWA8_GRVWB16_GSU0_GSUC0_GSUWGMRR0_K1_LBSPPA256_LBSPPB256_LPA16_LPB16_LRVW8_MIWT1_2_PLR1_SU0_SUM0_SUS128_VWA1_VWB2_WGM4_WGMXCC1_WGMXCCGn1
    SolutionIndex: 79
    SolutionNameMin: Cijk_Ailk_Bljk_F8B8NSS_BH_Bias_HAS_SAV_UserArgs_MT32x64x128_MI16x16x1_SN_LDSB0_CLR1_GRVWA8_GRVWB16_GSU0_GSUC0_GSUWGMRR0_K1_LBSPPA256_LBSPPB256_LPA16_LPB16_LRVW8_MIWT1_2_PLR1_SU0_SUM0_SUS128_VWA1_VWB2_WGM6_WGMXCC1_WGMXCCGn1
    SolutionIndex: 80
    SolutionNameMin: Cijk_Ailk_Bljk_F8B8NSS_BH_Bias_HAS_SAV_UserArgs_MT32x64x128_MI16x16x1_SN_LDSB0_CLR1_GRVWA16_GRVWB16_GSU0_GSUC0_GSUWGMRR0_K1_LBSPPA256_LBSPPB256_LPA16_LPB16_LRVW8_MIWT1_2_PLR1_SU0_SUM0_SUS128_VWA1_VWB2_WGM8_WGMXCC1_WGMXCCGn1
    SolutionIndex: 81
    SolutionNameMin: Cijk_Ailk_Bljk_F8B8NSS_BH_Bias_HAS_SAV_UserArgs_MT64x32x128_MI16x16x1_SN_LDSB0_CLR1_GRVWA8_GRVWB8_GSU0_GSUC0_GSUWGMRR0_K1_LBSPPA512_LBSPPB128_LPA32_LPB8_LRVW8_MIWT2_1_PLR1_SU0_SUM0_SUS128_VWA2_VWB1_WGM1_WGMXCC1_WGMXCCGn1
    SolutionIndex: 82
    SolutionNameMin: Cijk_Ailk_Bljk_F8B8NSS_BH_Bias_HAS_SAV_UserArgs_MT64x32x128_MI16x16x1_SN_LDSB0_CLR1_GRVWA8_GRVWB16_GSU0_GSUC0_GSUWGMRR0_K1_LBSPPA512_LBSPPB128_LPA32_LPB16_LRVW8_MIWT2_1_PLR1_SU0_SUM0_SUS128_VWA2_VWB1_WGM1_WGMXCC1_WGMXCCGn1
    SolutionIndex: 83
    SolutionNameMin: Cijk_Ailk_Bljk_F8B8NSS_BH_Bias_HAS_SAV_UserArgs_MT64x32x128_MI16x16x1_SN_LDSB0_CLR1_GRVWA16_GRVWB16_GSU0_GSUC0_GSUWGMRR0_K1_LBSPPA512_LBSPPB128_LPA32_LPB16_LRVW8_MIWT2_1_PLR1_SU0_SUM0_SUS128_VWA2_VWB1_WGM1_WGMXCC1_WGMXCCGn1
    SolutionIndex: 84
    SolutionNameMin: Cijk_Ailk_Bljk_F8B8NSS_BH_Bias_HAS_SAV_UserArgs_MT64x32x128_MI16x16x1_SN_LDSB0_CLR1_GRVWA8_GRVWB16_GSU0_GSUC0_GSUWGMRR0_K1_LBSPPA512_LBSPPB128_LPA32_LPB16_LRVW8_MIWT2_1_PLR1_SU0_SUM0_SUS128_VWA2_VWB1_WGM8_WGMXCC1_WGMXCCGn1
    SolutionIndex: 85
    SolutionNameMin: Cijk_Ailk_Bljk_F8B8NSS_BH_Bias_HAS_SAV_UserArgs_MT32x32x128_MI16x16x1_SN_LDSB0_CLR1_GRVWA8_GRVWB8_GSU0_GSUC0_GSUWGMRR0_K1_LBSPPA256_LBSPPB128_LPA16_LPB8_LRVW8_MIWT1_1_PLR1_SU0_SUM0_SUS128_VWA1_VWB1_WGM1_WGMXCC1_WGMXCCGn1
    SolutionIndex: 86
    SolutionNameMin: Cijk_Ailk_Bljk_F8B8NSS_BH_Bias_HAS_SAV_UserArgs_MT32x32x128_MI16x16x1_SN_LDSB0_CLR1_GRVWA8_GRVWB16_GSU0_GSUC0_GSUWGMRR0_K1_LBSPPA256_LBSPPB128_LPA16_LPB16_LRVW8_MIWT1_1_PLR1_SU0_SUM0_SUS128_VWA1_VWB1_WGM1_WGMXCC1_WGMXCCGn1
    SolutionIndex: 87
    SolutionNameMin: Cijk_Ailk_Bljk_F8B8NSS_BH_Bias_HAS_SAV_UserArgs_MT32x32x128_MI16x16x1_SN_LDSB0_CLR1_GRVWA16_GRVWB16_GSU0_GSUC0_GSUWGMRR0_K1_LBSPPA256_LBSPPB128_LPA16_LPB16_LRVW8_MIWT1_1_PLR1_SU0_SUM0_SUS128_VWA1_VWB1_WGM1_WGMXCC1_WGMXCCGn1
    SolutionIndex: 88
    SolutionNameMin: Cijk_Ailk_Bljk_F8B8NSS_BH_Bias_HAS_SAV_UserArgs_MT32x32x128_MI16x16x1_SN_LDSB0_CLR1_GRVWA8_GRVWB8_GSU0_GSUC0_GSUWGMRR0_K1_LBSPPA256_LBSPPB128_LPA16_LPB8_LRVW8_MIWT1_1_PLR1_SU0_SUM0_SUS128_VWA1_VWB1_WGM4_WGMXCC1_WGMXCCGn1
    SolutionIndex: 89
    SolutionNameMin: Cijk_Ailk_Bljk_F8B8NSS_BH_Bias_HAS_SAV_UserArgs_MT32x32x128_MI16x16x1_SN_LDSB0_CLR1_GRVWA8_GRVWB8_GSU0_GSUC0_GSUWGMRR0_K1_LBSPPA256_LBSPPB128_LPA16_LPB8_LRVW8_MIWT1_1_PLR1_SU0_SUM0_SUS128_VWA1_VWB1_WGM8_WGMXCC1_WGMXCCGn1
    SolutionIndex: 90
    SolutionNameMin: Cijk_Ailk_Bljk_F8B8NSS_BH_Bias_HAS_SAV_UserArgs_MT64x128x256_MI16x16x1_SN_LDSB1_CLR1_GRVWA16_GRVWB16_GSU0_GSUC0_GSUWGMRR0_K1_LBSPPA512_LBSPPB1024_LPA32_LPB16_LRVW8_MIWT2_4_PLR1_SU0_SUM0_SUS256_VWA2_VWB4_WGM1_WGMXCC1_WGMXCCGn1
    SolutionIndex: 91
    SolutionNameMin: Cijk_Ailk_Bljk_F8B8NSS_BH_Bias_HAS_SAV_UserArgs_MT64x64x256_MI16x16x1_SN_LDSB1_CLR1_GRVWA16_GRVWB16_GSU0_GSUC0_GSUWGMRR0_K1_LBSPPA512_LBSPPB512_LPA32_LPB16_LRVW8_MIWT2_2_PLR1_SU0_SUM0_SUS256_VWA2_VWB2_WGM1_WGMXCC1_WGMXCCGn1
    SolutionIndex: 92
    SolutionNameMin: Cijk_Ailk_Bljk_F8B8NSS_BH_Bias_HAS_SAV_UserArgs_MT64x32x256_MI16x16x1_SN_LDSB1_CLR1_GRVWA16_GRVWB16_GSU0_GSUC0_GSUWGMRR0_K1_LBSPPA512_LBSPPB256_LPA32_LPB16_LRVW8_MIWT2_1_PLR1_SU0_SUM0_SUS256_VWA2_VWB1_WGM1_WGMXCC1_WGMXCCGn1
    SolutionIndex: 93
    SolutionNameMin: Cijk_Ailk_Bljk_F8B8NSS_BH_Bias_HAS_SAV_UserArgs_MT64x32x256_MI16x16x1_SN_LDSB1_CLR1_GRVWA16_GRVWB16_GSU0_GSUC0_GSUWGMRR0_K1_LBSPPA512_LBSPPB256_LPA32_LPB16_LRVW8_MIWT2_1_PLR1_SU0_SUM0_SUS256_VWA2_VWB1_WGM6_WGMXCC1_WGMXCCGn1
    SolutionIndex: 94
    SolutionNameMin: Cijk_Ailk_Bljk_F8B8NSS_BH_Bias_HAS_SAV_UserArgs_MT64x32x256_MI16x16x1_SN_LDSB1_CLR1_GRVWA16_GRVWB16_GSU0_GSUC0_GSUWGMRR0_K1_LBSPPA512_LBSPPB256_LPA32_LPB16_LRVW8_MIWT2_1_PLR1_SU0_SUM0_SUS256_VWA2_VWB1_WGM8_WGMXCC1_WGMXCCGn1
    SolutionIndex: 95
    SolutionNameMin: Cijk_Ailk_Bljk_F8B8NSS_BH_Bias_HAS_SAV_UserArgs_MT32x32x256_MI16x16x1_SN_LDSB1_CLR1_GRVWA16_GRVWB16_GSU0_GSUC0_GSUWGMRR0_K1_LBSPPA256_LBSPPB256_LPA16_LPB16_LRVW8_MIWT1_1_PLR1_SU0_SUM0_SUS256_VWA1_VWB1_WGM1_WGMXCC1_WGMXCCGn1
    SolutionIndex: 96
    SolutionNameMin: Cijk_Ailk_Bljk_F8B8NSS_BH_Bias_HAS_SAV_UserArgs_MT32x32x256_MI16x16x1_SN_LDSB1_CLR1_GRVWA16_GRVWB16_GSU0_GSUC0_GSUWGMRR0_K1_LBSPPA256_LBSPPB256_LPA16_LPB16_LRVW8_MIWT1_1_PLR1_SU0_SUM0_SUS256_VWA1_VWB1_WGM4_WGMXCC1_WGMXCCGn1
    SolutionIndex: 97
    SolutionNameMin: Cijk_Ailk_Bljk_F8B8NSS_BH_Bias_HAS_SAV_UserArgs_MT32x32x256_MI16x16x1_SN_LDSB1_CLR1_GRVWA8_GRVWB16_GSU0_GSUC0_GSUWGMRR0_K1_LBSPPA256_LBSPPB256_LPA16_LPB16_LRVW8_MIWT1_1_PLR1_SU0_SUM0_SUS256_VWA1_VWB1_WGM6_WGMXCC1_WGMXCCGn1
    SolutionIndex: 98
    SolutionNameMin: Cijk_Ailk_Bljk_F8B8NSS_BH_Bias_HAS_SAV_UserArgs_MT32x32x256_MI16x16x1_SN_LDSB1_CLR1_GRVWA16_GRVWB16_GSU0_GSUC0_GSUWGMRR0_K1_LBSPPA256_LBSPPB256_LPA16_LPB16_LRVW8_MIWT1_1_PLR1_SU0_SUM0_SUS256_VWA1_VWB1_WGM6_WGMXCC1_WGMXCCGn1
    SolutionIndex: 99
    SolutionNameMin: Cijk_Ailk_Bljk_F8B8NSS_BH_Bias_HAS_SAV_UserArgs_MT32x32x256_MI16x16x1_SN_LDSB1_CLR1_GRVWA16_GRVWB16_GSU0_GSUC0_GSUWGMRR0_K1_LBSPPA256_LBSPPB256_LPA16_LPB16_LRVW8_MIWT1_1_PLR1_SU0_SUM0_SUS256_VWA1_VWB1_WGM8_WGMXCC1_WGMXCCGn1
- - - [128, 128, 1, 128, 128, 128, 128, 128]
    - [37, 0.55]
  - - [128, 128, 1, 256, 128, 128, 128, 256]
    - [87, 0.95]
  - - [128, 128, 1, 512, 128, 128, 128, 512]
    - [85, 1.71]
  - - [128, 128, 1, 1024, 128, 128, 128, 1024]
    - [86, 2.73]
  - - [128, 128, 1, 2048, 128, 128, 128, 2048]
    - [86, 3.83]
  - - [128, 128, 1, 4096, 128, 128, 128, 4096]
    - [85, 4.76]
  - - [128, 128, 1, 8192, 128, 128, 128, 8192]
    - [87, 5.45]
  - - [128, 256, 1, 128, 128, 128, 128, 128]
    - [86, 1.12]
  - - [128, 256, 1, 256, 128, 128, 128, 256]
    - [86, 2.02]
  - - [128, 256, 1, 512, 128, 128, 128, 512]
    - [86, 3.53]
  - - [128, 256, 1, 1024, 128, 128, 128, 1024]
    - [85, 5.52]
  - - [128, 256, 1, 2048, 128, 128, 128, 2048]
    - [86, 7.66]
  - - [128, 256, 1, 4096, 128, 128, 128, 4096]
    - [87, 9.57]
  - - [128, 256, 1, 8192, 128, 128, 128, 8192]
    - [85, 10.95]
  - - [128, 512, 1, 128, 128, 128, 128, 128]
    - [85, 2.18]
  - - [128, 512, 1, 256, 128, 128, 128, 256]
    - [37, 4.04]
  - - [128, 512, 1, 512, 128, 128, 128, 512]
    - [89, 5.93]
  - - [128, 512, 1, 1024, 128, 128, 128, 1024]
    - [86, 10.74]
  - - [128, 512, 1, 2048, 128, 128, 128, 2048]
    - [85, 15.15]
  - - [128, 512, 1, 4096, 128, 128, 128, 4096]
    - [87, 18.99]
  - - [128, 512, 1, 8192, 128, 128, 128, 8192]
    - [85, 21.69]
  - - [128, 1024, 1, 128, 128, 128, 128, 128]
    - [35, 4.02]
  - - [128, 1024, 1, 256, 128, 128, 128, 256]
    - [36, 6.56]
  - - [128, 1024, 1, 512, 128, 128, 128, 512]
    - [34, 11.72]
  - - [128, 1024, 1, 1024, 128, 128, 128, 1024]
    - [95, 20.66]
  - - [128, 1024, 1, 2048, 128, 128, 128, 2048]
    - [85, 29.98]
  - - [128, 1024, 1, 4096, 128, 128, 128, 4096]
    - [85, 37.48]
  - - [128, 1024, 1, 8192, 128, 128, 128, 8192]
    - [85, 42.9]
  - - [128, 2048, 1, 128, 128, 128, 128, 128]
    - [75, 7.79]
  - - [128, 2048, 1, 256, 128, 128, 128, 256]
    - [35, 13.83]
  - - [128, 2048, 1, 512, 128, 128, 128, 512]
    - [77, 23.61]
  - - [128, 2048, 1, 1024, 128, 128, 128, 1024]
    - [76, 36.51]
  - - [128, 2048, 1, 2048, 128, 128, 128, 2048]
    - [92, 50.73]
  - - [128, 2048, 1, 4096, 128, 128, 128, 4096]
    - [92, 62.93]
  - - [128, 2048, 1, 8192, 128, 128, 128, 8192]
    - [92, 71.28]
  - - [128, 4096, 1, 128, 128, 128, 128, 128]
    - [30, 13.49]
  - - [128, 4096, 1, 256, 128, 128, 128, 256]
    - [31, 23.84]
  - - [128, 4096, 1, 512, 128, 128, 128, 512]
    - [65, 39.08]
  - - [128, 4096, 1, 1024, 128, 128, 128, 1024]
    - [65, 59.76]
  - - [128, 4096, 1, 2048, 128, 128, 128, 2048]
    - [65, 81.36]
  - - [128, 4096, 1, 4096, 128, 128, 128, 4096]
    - [91, 99.43]
  - - [128, 4096, 1, 8192, 128, 128, 128, 8192]
    - [91, 111.12]
  - - [128, 8192, 1, 128, 128, 128, 128, 128]
    - [24, 21.38]
  - - [128, 8192, 1, 256, 128, 128, 128, 256]
    - [24, 37.9]
  - - [128, 8192, 1, 512, 128, 128, 128, 512]
    - [19, 62.69]
  - - [128, 8192, 1, 1024, 128, 128, 128, 1024]
    - [19, 93.41]
  - - [128, 8192, 1, 2048, 128, 128, 128, 2048]
    - [90, 118.18]
  - - [128, 8192, 1, 4096, 128, 128, 128, 4096]
    - [61, 137.24]
  - - [128, 8192, 1, 8192, 128, 128, 128, 8192]
    - [61, 147.93]
  - - [256, 128, 1, 128, 256, 256, 256, 128]
    - [86, 1.1]
  - - [256, 128, 1, 256, 256, 256, 256, 256]
    - [86, 2.04]
  - - [256, 128, 1, 512, 256, 256, 256, 512]
    - [86, 3.49]
  - - [256, 128, 1, 1024, 256, 256, 256, 1024]
    - [86, 5.53]
  - - [256, 128, 1, 2048, 256, 256, 256, 2048]
    - [85, 7.72]
  - - [256, 128, 1, 4096, 256, 256, 256, 4096]
    - [85, 9.56]
  - - [256, 128, 1, 8192, 256, 256, 256, 8192]
    - [87, 10.91]
  - - [256, 256, 1, 128, 256, 256, 256, 128]
    - [37, 2.22]
  - - [256, 256, 1, 256, 256, 256, 256, 256]
    - [86, 3.96]
  - - [256, 256, 1, 512, 256, 256, 256, 512]
    - [85, 6.89]
  - - [256, 256, 1, 1024, 256, 256, 256, 1024]
    - [85, 10.82]
  - - [256, 256, 1, 2048, 256, 256, 256, 2048]
    - [85, 15.12]
  - - [256, 256, 1, 4096, 256, 256, 256, 4096]
    - [85, 19.08]
  - - [256, 256, 1, 8192, 256, 256, 256, 8192]
    - [85, 21.78]
  - - [256, 512, 1, 128, 256, 256, 256, 128]
    - [37, 4.33]
  - - [256, 512, 1, 256, 256, 256, 256, 256]
    - [37, 7.73]
  - - [256, 512, 1, 512, 256, 256, 256, 512]
    - [85, 13.37]
  - - [256, 512, 1, 1024, 256, 256, 256, 1024]
    - [85, 21.23]
  - - [256, 512, 1, 2048, 256, 256, 256, 2048]
    - [85, 30.0]
  - - [256, 512, 1, 4096, 256, 256, 256, 4096]
    - [85, 37.61]
  - - [256, 512, 1, 8192, 256, 256, 256, 8192]
    - [85, 42.77]
  - - [256, 1024, 1, 128, 256, 256, 256, 128]
    - [76, 7.81]
  - - [256, 1024, 1, 256, 256, 256, 256, 256]
    - [76, 14.14]
  - - [256, 1024, 1, 512, 256, 256, 256, 512]
    - [82, 23.94]
  - - [256, 1024, 1, 1024, 256, 256, 256, 1024]
    - [76, 37.06]
  - - [256, 1024, 1, 2048, 256, 256, 256, 2048]
    - [92, 50.87]
  - - [256, 1024, 1, 4096, 256, 256, 256, 4096]
    - [92, 63.1]
  - - [256, 1024, 1, 8192, 256, 256, 256, 8192]
    - [92, 71.86]
  - - [256, 2048, 1, 128, 256, 256, 256, 128]
    - [32, 12.98]
  - - [256, 2048, 1, 256, 256, 256, 256, 256]
    - [31, 23.58]
  - - [256, 2048, 1, 512, 256, 256, 256, 512]
    - [31, 38.95]
  - - [256, 2048, 1, 1024, 256, 256, 256, 1024]
    - [65, 59.12]
  - - [256, 2048, 1, 2048, 256, 256, 256, 2048]
    - [91, 80.86]
  - - [256, 2048, 1, 4096, 256, 256, 256, 4096]
    - [91, 100.1]
  - - [256, 2048, 1, 8192, 256, 256, 256, 8192]
    - [70, 107.95]
  - - [256, 4096, 1, 128, 256, 256, 256, 128]
    - [19, 21.34]
  - - [256, 4096, 1, 256, 256, 256, 256, 256]
    - [20, 38.11]
  - - [256, 4096, 1, 512, 256, 256, 256, 512]
    - [20, 62.99]
  - - [256, 4096, 1, 1024, 256, 256, 256, 1024]
    - [19, 93.87]
  - - [256, 4096, 1, 2048, 256, 256, 256, 2048]
    - [18, 125.4]
  - - [256, 4096, 1, 4096, 256, 256, 256, 4096]
    - [61, 136.97]
  - - [256, 4096, 1, 8192, 256, 256, 256, 8192]
    - [61, 149.32]
  - - [256, 8192, 1, 128, 256, 256, 256, 128]
    - [52, 31.55]
  - - [256, 8192, 1, 256, 256, 256, 256, 256]
    - [53, 56.52]
  - - [256, 8192, 1, 512, 256, 256, 256, 512]
    - [53, 94.07]
  - - [256, 8192, 1, 1024, 256, 256, 256, 1024]
    - [53, 134.03]
  - - [256, 8192, 1, 2048, 256, 256, 256, 2048]
    - [57, 171.76]
  - - [256, 8192, 1, 4096, 256, 256, 256, 4096]
    - [59, 204.54]
  - - [256, 8192, 1, 8192, 256, 256, 256, 8192]
    - [58, 204.85]
  - - [512, 128, 1, 128, 512, 512, 512, 128]
    - [86, 2.16]
  - - [512, 128, 1, 256, 512, 512, 512, 256]
    - [86, 4.01]
  - - [512, 128, 1, 512, 512, 512, 512, 512]
    - [85, 6.91]
  - - [512, 128, 1, 1024, 512, 512, 512, 1024]
    - [86, 10.98]
  - - [512, 128, 1, 2048, 512, 512, 512, 2048]
    - [85, 15.35]
  - - [512, 128, 1, 4096, 512, 512, 512, 4096]
    - [85, 18.98]
  - - [512, 128, 1, 8192, 512, 512, 512, 8192]
    - [99, 17.67]
  - - [512, 256, 1, 128, 512, 512, 512, 128]
    - [37, 4.22]
  - - [512, 256, 1, 256, 512, 512, 512, 256]
    - [85, 7.73]
  - - [512, 256, 1, 512, 512, 512, 512, 512]
    - [86, 13.29]
  - - [512, 256, 1, 1024, 512, 512, 512, 1024]
    - [86, 21.24]
  - - [512, 256, 1, 2048, 512, 512, 512, 2048]
    - [86, 29.41]
  - - [512, 256, 1, 4096, 512, 512, 512, 4096]
    - [85, 37.11]
  - - [512, 256, 1, 8192, 512, 512, 512, 8192]
    - [96, 35.34]
  - - [512, 512, 1, 128, 512, 512, 512, 128]
    - [34, 7.64]
  - - [512, 512, 1, 256, 512, 512, 512, 256]
    - [81, 13.82]
  - - [512, 512, 1, 512, 512, 512, 512, 512]
    - [76, 23.61]
  - - [512, 512, 1, 1024, 512, 512, 512, 1024]
    - [82, 36.48]
  - - [512, 512, 1, 2048, 512, 512, 512, 2048]
    - [92, 50.25]
  - - [512, 512, 1, 4096, 512, 512, 512, 4096]
    - [92, 62.4]
  - - [512, 512, 1, 8192, 512, 512, 512, 8192]
    - [83, 61.52]
  - - [512, 1024, 1, 128, 512, 512, 512, 128]
    - [28, 13.22]
  - - [512, 1024, 1, 256, 512, 512, 512, 256]
    - [32, 23.54]
  - - [512, 1024, 1, 512, 512, 512, 512, 512]
    - [65, 39.32]
  - - [512, 1024, 1, 1024, 512, 512, 512, 1024]
    - [65, 59.82]
  - - [512, 1024, 1, 2048, 512, 512, 512, 2048]
    - [65, 80.95]
  - - [512, 1024, 1, 4096, 512, 512, 512, 4096]
    - [65, 97.68]
  - - [512, 1024, 1, 8192, 512, 512, 512, 8192]
    - [67, 100.9]
  - - [512, 2048, 1, 128, 512, 512, 512, 128]
    - [10, 21.36]
  - - [512, 2048, 1, 256, 512, 512, 512, 256]
    - [19, 38.7]
  - - [512, 2048, 1, 512, 512, 512, 512, 512]
    - [19, 63.47]
  - - [512, 2048, 1, 1024, 512, 512, 512, 1024]
    - [18, 94.22]
  - - [512, 2048, 1, 2048, 512, 512, 512, 2048]
    - [18, 125.08]
  - - [512, 2048, 1, 4096, 512, 512, 512, 4096]
    - [62, 132.06]
  - - [512, 2048, 1, 8192, 512, 512, 512, 8192]
    - [64, 142.7]
  - - [512, 4096, 1, 128, 512, 512, 512, 128]
    - [17, 31.38]
  - - [512, 4096, 1, 256, 512, 512, 512, 256]
    - [17, 56.01]
  - - [512, 4096, 1, 512, 512, 512, 512, 512]
    - [57, 91.01]
  - - [512, 4096, 1, 1024, 512, 512, 512, 1024]
    - [57, 133.79]
  - - [512, 4096, 1, 2048, 512, 512, 512, 2048]
    - [57, 168.96]
  - - [512, 4096, 1, 4096, 512, 512, 512, 4096]
    - [60, 192.73]
  - - [512, 4096, 1, 8192, 512, 512, 512, 8192]
    - [57, 193.16]
  - - [512, 8192, 1, 128, 512, 512, 512, 128]
    - [56, 39.94]
  - - [512, 8192, 1, 256, 512, 512, 512, 256]
    - [56, 71.52]
  - - [512, 8192, 1, 512, 512, 512, 512, 512]
    - [56, 118.17]
  - - [512, 8192, 1, 1024, 512, 512, 512, 1024]
    - [55, 168.57]
  - - [512, 8192, 1, 2048, 512, 512, 512, 2048]
    - [54, 215.96]
  - - [512, 8192, 1, 4096, 512, 512, 512, 4096]
    - [56, 242.2]
  - - [512, 8192, 1, 8192, 512, 512, 512, 8192]
    - [54, 240.71]
  - - [1024, 128, 1, 128, 1024, 1024, 1024, 128]
    - [86, 4.27]
  - - [1024, 128, 1, 256, 1024, 1024, 1024, 256]
    - [86, 7.7]
  - - [1024, 128, 1, 512, 1024, 1024, 1024, 512]
    - [86, 13.14]
  - - [1024, 128, 1, 1024, 1024, 1024, 1024, 1024]
    - [85, 20.9]
  - - [1024, 128, 1, 2048, 1024, 1024, 1024, 2048]
    - [88, 29.28]
  - - [1024, 128, 1, 4096, 1024, 1024, 1024, 4096]
    - [98, 30.07]
  - - [1024, 128, 1, 8192, 1024, 1024, 1024, 8192]
    - [97, 30.22]
  - - [1024, 256, 1, 128, 1024, 1024, 1024, 128]
    - [81, 7.6]
  - - [1024, 256, 1, 256, 1024, 1024, 1024, 256]
    - [81, 13.52]
  - - [1024, 256, 1, 512, 1024, 1024, 1024, 512]
    - [79, 23.46]
  - - [1024, 256, 1, 1024, 1024, 1024, 1024, 1024]
    - [82, 36.04]
  - - [1024, 256, 1, 2048, 1024, 1024, 1024, 2048]
    - [92, 49.64]
  - - [1024, 256, 1, 4096, 1024, 1024, 1024, 4096]
    - [78, 53.94]
  - - [1024, 256, 1, 8192, 1024, 1024, 1024, 8192]
    - [84, 58.53]
  - - [1024, 512, 1, 128, 1024, 1024, 1024, 128]
    - [29, 13.11]
  - - [1024, 512, 1, 256, 1024, 1024, 1024, 256]
    - [33, 23.36]
  - - [1024, 512, 1, 512, 1024, 1024, 1024, 512]
    - [71, 38.89]
  - - [1024, 512, 1, 1024, 1024, 1024, 1024, 1024]
    - [68, 59.16]
  - - [1024, 512, 1, 2048, 1024, 1024, 1024, 2048]
    - [65, 80.0]
  - - [1024, 512, 1, 4096, 1024, 1024, 1024, 4096]
    - [69, 91.99]
  - - [1024, 512, 1, 8192, 1024, 1024, 1024, 8192]
    - [73, 98.74]
  - - [1024, 1024, 1, 128, 1024, 1024, 1024, 128]
    - [26, 21.17]
  - - [1024, 1024, 1, 256, 1024, 1024, 1024, 256]
    - [27, 37.78]
  - - [1024, 1024, 1, 512, 1024, 1024, 1024, 512]
    - [19, 63.49]
  - - [1024, 1024, 1, 1024, 1024, 1024, 1024, 1024]
    - [18, 93.87]
  - - [1024, 1024, 1, 2048, 1024, 1024, 1024, 2048]
    - [19, 120.45]
  - - [1024, 1024, 1, 4096, 1024, 1024, 1024, 4096]
    - [62, 134.29]
  - - [1024, 1024, 1, 8192, 1024, 1024, 1024, 8192]
    - [63, 142.52]
  - - [1024, 2048, 1, 128, 1024, 1024, 1024, 128]
    - [13, 31.62]
  - - [1024, 2048, 1, 256, 1024, 1024, 1024, 256]
    - [11, 55.7]
  - - [1024, 2048, 1, 512, 1024, 1024, 1024, 512]
    - [57, 91.48]
  - - [1024, 2048, 1, 1024, 1024, 1024, 1024, 1024]
    - [57, 132.9]
  - - [1024, 2048, 1, 2048, 1024, 1024, 1024, 2048]
    - [57, 164.72]
  - - [1024, 2048, 1, 4096, 1024, 1024, 1024, 4096]
    - [57, 192.55]
  - - [1024, 2048, 1, 8192, 1024, 1024, 1024, 8192]
    - [59, 192.49]
  - - [1024, 4096, 1, 128, 1024, 1024, 1024, 128]
    - [6, 38.79]
  - - [1024, 4096, 1, 256, 1024, 1024, 1024, 256]
    - [6, 69.48]
  - - [1024, 4096, 1, 512, 1024, 1024, 1024, 512]
    - [4, 109.57]
  - - [1024, 4096, 1, 1024, 1024, 1024, 1024, 1024]
    - [4, 157.33]
  - - [1024, 4096, 1, 2048, 1024, 1024, 1024, 2048]
    - [39, 206.16]
  - - [1024, 4096, 1, 4096, 1024, 1024, 1024, 4096]
    - [46, 233.17]
  - - [1024, 4096, 1, 8192, 1024, 1024, 1024, 8192]
    - [46, 235.65]
  - - [1024, 8192, 1, 128, 1024, 1024, 1024, 128]
    - [45, 43.49]
  - - [1024, 8192, 1, 256, 1024, 1024, 1024, 256]
    - [46, 80.4]
  - - [1024, 8192, 1, 512, 1024, 1024, 1024, 512]
    - [46, 140.74]
  - - [1024, 8192, 1, 1024, 1024, 1024, 1024, 1024]
    - [51, 208.89]
  - - [1024, 8192, 1, 2048, 1024, 1024, 1024, 2048]
    - [49, 277.06]
  - - [1024, 8192, 1, 4096, 1024, 1024, 1024, 4096]
    - [46, 318.22]
  - - [1024, 8192, 1, 8192, 1024, 1024, 1024, 8192]
    - [47, 345.72]
  - - [2048, 128, 1, 128, 2048, 2048, 2048, 128]
    - [75, 7.84]
  - - [2048, 128, 1, 256, 2048, 2048, 2048, 256]
    - [76, 14.1]
  - - [2048, 128, 1, 512, 2048, 2048, 2048, 512]
    - [76, 23.85]
  - - [2048, 128, 1, 1024, 2048, 2048, 2048, 1024]
    - [76, 36.58]
  - - [2048, 128, 1, 2048, 2048, 2048, 2048, 2048]
    - [80, 42.97]
  - - [2048, 128, 1, 4096, 2048, 2048, 2048, 4096]
    - [93, 51.75]
  - - [2048, 128, 1, 8192, 2048, 2048, 2048, 8192]
    - [94, 58.74]
  - - [2048, 256, 1, 128, 2048, 2048, 2048, 128]
    - [32, 13.48]
  - - [2048, 256, 1, 256, 2048, 2048, 2048, 256]
    - [32, 23.81]
  - - [2048, 256, 1, 512, 2048, 2048, 2048, 512]
    - [66, 39.82]
  - - [2048, 256, 1, 1024, 2048, 2048, 2048, 1024]
    - [66, 59.46]
  - - [2048, 256, 1, 2048, 2048, 2048, 2048, 2048]
    - [72, 75.28]
  - - [2048, 256, 1, 4096, 2048, 2048, 2048, 4096]
    - [69, 91.01]
  - - [2048, 256, 1, 8192, 2048, 2048, 2048, 8192]
    - [69, 102.41]
  - - [2048, 512, 1, 128, 2048, 2048, 2048, 128]
    - [25, 21.95]
  - - [2048, 512, 1, 256, 2048, 2048, 2048, 256]
    - [24, 38.22]
  - - [2048, 512, 1, 512, 2048, 2048, 2048, 512]
    - [24, 62.16]
  - - [2048, 512, 1, 1024, 2048, 2048, 2048, 1024]
    - [19, 92.12]
  - - [2048, 512, 1, 2048, 2048, 2048, 2048, 2048]
    - [64, 114.29]
  - - [2048, 512, 1, 4096, 2048, 2048, 2048, 4096]
    - [64, 135.88]
  - - [2048, 512, 1, 8192, 2048, 2048, 2048, 8192]
    - [64, 141.52]
  - - [2048, 1024, 1, 128, 2048, 2048, 2048, 128]
    - [17, 31.46]
  - - [2048, 1024, 1, 256, 2048, 2048, 2048, 256]
    - [13, 55.53]
  - - [2048, 1024, 1, 512, 2048, 2048, 2048, 512]
    - [17, 89.37]
  - - [2048, 1024, 1, 1024, 2048, 2048, 2048, 1024]
    - [58, 125.75]
  - - [2048, 1024, 1, 2048, 2048, 2048, 2048, 2048]
    - [59, 162.9]
  - - [2048, 1024, 1, 4096, 2048, 2048, 2048, 4096]
    - [59, 193.41]
  - - [2048, 1024, 1, 8192, 2048, 2048, 2048, 8192]
    - [59, 195.61]
  - - [2048, 2048, 1, 128, 2048, 2048, 2048, 128]
    - [5, 38.11]
  - - [2048, 2048, 1, 256, 2048, 2048, 2048, 256]
    - [4, 67.3]
  - - [2048, 2048, 1, 512, 2048, 2048, 2048, 512]
    - [4, 105.57]
  - - [2048, 2048, 1, 1024, 2048, 2048, 2048, 1024]
    - [51, 155.31]
  - - [2048, 2048, 1, 2048, 2048, 2048, 2048, 2048]
    - [49, 208.55]
  - - [2048, 2048, 1, 4096, 2048, 2048, 2048, 4096]
    - [41, 232.91]
  - - [2048, 2048, 1, 8192, 2048, 2048, 2048, 8192]
    - [40, 230.55]
  - - [2048, 4096, 1, 128, 2048, 2048, 2048, 128]
    - [13, 37.92]
  - - [2048, 4096, 1, 256, 2048, 2048, 2048, 256]
    - [5, 68.8]
  - - [2048, 4096, 1, 512, 2048, 2048, 2048, 512]
    - [4, 113.04]
  - - [2048, 4096, 1, 1024, 2048, 2048, 2048, 1024]
    - [0, 167.15]
  - - [2048, 4096, 1, 2048, 2048, 2048, 2048, 2048]
    - [1, 210.26]
  - - [2048, 4096, 1, 4096, 2048, 2048, 2048, 4096]
    - [47, 259.33]
  - - [2048, 4096, 1, 8192, 2048, 2048, 2048, 8192]
    - [47, 300.11]
  - - [2048, 8192, 1, 128, 2048, 2048, 2048, 128]
    - [45, 48.29]
  - - [2048, 8192, 1, 256, 2048, 2048, 2048, 256]
    - [45, 86.92]
  - - [2048, 8192, 1, 512, 2048, 2048, 2048, 512]
    - [46, 148.01]
  - - [2048, 8192, 1, 1024, 2048, 2048, 2048, 1024]
    - [51, 217.58]
  - - [2048, 8192, 1, 2048, 2048, 2048, 2048, 2048]
    - [46, 260.13]
  - - [2048, 8192, 1, 4096, 2048, 2048, 2048, 4096]
    - [51, 304.49]
  - - [2048, 8192, 1, 8192, 2048, 2048, 2048, 8192]
    - [46, 358.48]
  - - [4096, 128, 1, 128, 4096, 4096, 4096, 128]
    - [30, 13.35]
  - - [4096, 128, 1, 256, 4096, 4096, 4096, 256]
    - [32, 23.62]
  - - [4096, 128, 1, 512, 4096, 4096, 4096, 512]
    - [31, 39.11]
  - - [4096, 128, 1, 1024, 4096, 4096, 4096, 1024]
    - [65, 58.6]
  - - [4096, 128, 1, 2048, 4096, 4096, 4096, 2048]
    - [74, 74.02]
  - - [4096, 128, 1, 4096, 4096, 4096, 4096, 4096]
    - [69, 91.0]
  - - [4096, 128, 1, 8192, 4096, 4096, 4096, 8192]
    - [69, 101.54]
  - - [4096, 256, 1, 128, 4096, 4096, 4096, 128]
    - [25, 21.62]
  - - [4096, 256, 1, 256, 4096, 4096, 4096, 256]
    - [24, 38.25]
  - - [4096, 256, 1, 512, 4096, 4096, 4096, 512]
    - [22, 61.4]
  - - [4096, 256, 1, 1024, 4096, 4096, 4096, 1024]
    - [22, 87.89]
  - - [4096, 256, 1, 2048, 4096, 4096, 4096, 2048]
    - [62, 113.69]
  - - [4096, 256, 1, 4096, 4096, 4096, 4096, 4096]
    - [63, 133.67]
  - - [4096, 256, 1, 8192, 4096, 4096, 4096, 8192]
    - [21, 142.2]
  - - [4096, 512, 1, 128, 4096, 4096, 4096, 128]
    - [15, 29.85]
  - - [4096, 512, 1, 256, 4096, 4096, 4096, 256]
    - [15, 52.92]
  - - [4096, 512, 1, 512, 4096, 4096, 4096, 512]
    - [14, 85.15]
  - - [4096, 512, 1, 1024, 4096, 4096, 4096, 1024]
    - [60, 124.77]
  - - [4096, 512, 1, 2048, 4096, 4096, 4096, 2048]
    - [59, 162.52]
  - - [4096, 512, 1, 4096, 4096, 4096, 4096, 4096]
    - [58, 192.31]
  - - [4096, 512, 1, 8192, 4096, 4096, 4096, 8192]
    - [9, 185.41]
  - - [4096, 1024, 1, 128, 4096, 4096, 4096, 128]
    - [42, 35.71]
  - - [4096, 1024, 1, 256, 4096, 4096, 4096, 256]
    - [8, 64.11]
  - - [4096, 1024, 1, 512, 4096, 4096, 4096, 512]
    - [51, 104.59]
  - - [4096, 1024, 1, 1024, 4096, 4096, 4096, 1024]
    - [51, 156.74]
  - - [4096, 1024, 1, 2048, 4096, 4096, 4096, 2048]
    - [51, 211.5]
  - - [4096, 1024, 1, 4096, 4096, 4096, 4096, 4096]
    - [43, 231.13]
  - - [4096, 1024, 1, 8192, 4096, 4096, 4096, 8192]
    - [41, 233.73]
  - - [4096, 2048, 1, 128, 4096, 4096, 4096, 128]
    - [6, 37.29]
  - - [4096, 2048, 1, 256, 4096, 4096, 4096, 256]
    - [6, 67.88]
  - - [4096, 2048, 1, 512, 4096, 4096, 4096, 512]
    - [49, 110.66]
  - - [4096, 2048, 1, 1024, 4096, 4096, 4096, 1024]
    - [49, 164.66]
  - - [4096, 2048, 1, 2048, 4096, 4096, 4096, 2048]
    - [1, 211.63]
  - - [4096, 2048, 1, 4096, 4096, 4096, 4096, 4096]
    - [39, 250.91]
  - - [4096, 2048, 1, 8192, 4096, 4096, 4096, 8192]
    - [39, 273.21]
  - - [4096, 4096, 1, 128, 4096, 4096, 4096, 128]
    - [46, 40.83]
  - - [4096, 4096, 1, 256, 4096, 4096, 4096, 256]
    - [23, 74.25]
  - - [4096, 4096, 1, 512, 4096, 4096, 4096, 512]
    - [11, 120.56]
  - - [4096, 4096, 1, 1024, 4096, 4096, 4096, 1024]
    - [59, 165.45]
  - - [4096, 4096, 1, 2048, 4096, 4096, 4096, 2048]
    - [46, 216.5]
  - - [4096, 4096, 1, 4096, 4096, 4096, 4096, 4096]
    - [46, 276.71]
  - - [4096, 4096, 1, 8192, 4096, 4096, 4096, 8192]
    - [43, 303.23]
  - - [4096, 8192, 1, 128, 4096, 4096, 4096, 128]
    - [45, 49.02]
  - - [4096, 8192, 1, 256, 4096, 4096, 4096, 256]
    - [50, 84.03]
  - - [4096, 8192, 1, 512, 4096, 4096, 4096, 512]
    - [46, 136.79]
  - - [4096, 8192, 1, 1024, 4096, 4096, 4096, 1024]
    - [45, 192.32]
  - - [4096, 8192, 1, 2048, 4096, 4096, 4096, 2048]
    - [48, 245.26]
  - - [4096, 8192, 1, 4096, 4096, 4096, 4096, 4096]
    - [49, 311.14]
  - - [4096, 8192, 1, 8192, 4096, 4096, 4096, 8192]
    - [49, 377.28]
  - - [8192, 128, 1, 128, 8192, 8192, 8192, 128]
    - [25, 20.87]
  - - [8192, 128, 1, 256, 8192, 8192, 8192, 256]
    - [20, 37.07]
  - - [8192, 128, 1, 512, 8192, 8192, 8192, 512]
    - [19, 61.79]
  - - [8192, 128, 1, 1024, 8192, 8192, 8192, 1024]
    - [18, 92.1]
  - - [8192, 128, 1, 2048, 8192, 8192, 8192, 2048]
    - [63, 111.04]
  - - [8192, 128, 1, 4096, 8192, 8192, 8192, 4096]
    - [63, 134.18]
  - - [8192, 128, 1, 8192, 8192, 8192, 8192, 8192]
    - [62, 139.94]
  - - [8192, 256, 1, 128, 8192, 8192, 8192, 128]
    - [12, 29.61]
  - - [8192, 256, 1, 256, 8192, 8192, 8192, 256]
    - [15, 52.62]
  - - [8192, 256, 1, 512, 8192, 8192, 8192, 512]
    - [16, 84.5]
  - - [8192, 256, 1, 1024, 8192, 8192, 8192, 1024]
    - [59, 125.23]
  - - [8192, 256, 1, 2048, 8192, 8192, 8192, 2048]
    - [60, 160.8]
  - - [8192, 256, 1, 4096, 8192, 8192, 8192, 4096]
    - [58, 188.4]
  - - [8192, 256, 1, 8192, 8192, 8192, 8192, 8192]
    - [59, 187.14]
  - - [8192, 512, 1, 128, 8192, 8192, 8192, 128]
    - [5, 37.03]
  - - [8192, 512, 1, 256, 8192, 8192, 8192, 256]
    - [6, 66.61]
  - - [8192, 512, 1, 512, 8192, 8192, 8192, 512]
    - [7, 106.5]
  - - [8192, 512, 1, 1024, 8192, 8192, 8192, 1024]
    - [43, 156.22]
  - - [8192, 512, 1, 2048, 8192, 8192, 8192, 2048]
    - [51, 207.48]
  - - [8192, 512, 1, 4096, 8192, 8192, 8192, 4096]
    - [41, 233.97]
  - - [8192, 512, 1, 8192, 8192, 8192, 8192, 8192]
    - [43, 232.93]
  - - [8192, 1024, 1, 128, 8192, 8192, 8192, 128]
    - [3, 40.08]
  - - [8192, 1024, 1, 256, 8192, 8192, 8192, 256]
    - [4, 72.71]
  - - [8192, 1024, 1, 512, 8192, 8192, 8192, 512]
    - [4, 113.5]
  - - [8192, 1024, 1, 1024, 8192, 8192, 8192, 1024]
    - [51, 166.9]
  - - [8192, 1024, 1, 2048, 8192, 8192, 8192, 2048]
    - [4, 212.33]
  - - [8192, 1024, 1, 4096, 8192, 8192, 8192, 4096]
    - [39, 256.53]
  - - [8192, 1024, 1, 8192, 8192, 8192, 8192, 8192]
    - [39, 294.78]
  - - [8192, 2048, 1, 128, 8192, 8192, 8192, 128]
    - [46, 44.43]
  - - [8192, 2048, 1, 256, 8192, 8192, 8192, 256]
    - [45, 76.99]
  - - [8192, 2048, 1, 512, 8192, 8192, 8192, 512]
    - [47, 129.12]
  - - [8192, 2048, 1, 1024, 8192, 8192, 8192, 1024]
    - [51, 184.72]
  - - [8192, 2048, 1, 2048, 8192, 8192, 8192, 2048]
    - [49, 216.08]
  - - [8192, 2048, 1, 4096, 8192, 8192, 8192, 4096]
    - [49, 260.83]
  - - [8192, 2048, 1, 8192, 8192, 8192, 8192, 8192]
    - [0, 322.88]
  - - [8192, 4096, 1, 128, 8192, 8192, 8192, 128]
    - [26, 40.88]
  - - [8192, 4096, 1, 256, 8192, 8192, 8192, 256]
    - [14, 74.74]
  - - [8192, 4096, 1, 512, 8192, 8192, 8192, 512]
    - [4, 127.33]
  - - [8192, 4096, 1, 1024, 8192, 8192, 8192, 1024]
    - [38, 176.0]
  - - [8192, 4096, 1, 2048, 8192, 8192, 8192, 2048]
    - [44, 230.94]
  - - [8192, 4096, 1, 4096, 8192, 8192, 8192, 4096]
    - [46, 288.46]
  - - [8192, 4096, 1, 8192, 8192, 8192, 8192, 8192]
    - [2, 328.05]
  - - [8192, 8192, 1, 128, 8192, 8192, 8192, 128]
    - [45, 42.21]
  - - [8192, 8192, 1, 256, 8192, 8192, 8192, 256]
    - [4, 73.08]
  - - [8192, 8192, 1, 512, 8192, 8192, 8192, 512]
    - [46, 122.12]
  - - [8192, 8192, 1, 1024, 8192, 8192, 8192, 1024]
    - [45, 183.2]
  - - [8192, 8192, 1, 2048, 8192, 8192, 8192, 2048]
    - [45, 252.99]
  - - [8192, 8192, 1, 4096, 8192, 8192, 8192, 4096]
    - [49, 315.91]
  - - [8192, 8192, 1, 8192, 8192, 8192, 8192, 8192]
    - [49, 373.44]
- null
- null
- ExperimentalStreamK
- GridBased
