projects/hipblaslt/library/src/amd_detail/rocblaslt/src/Tensile/Logic/asm_full/aquavanjaram/gfx942_228cu/StreamK/aquavanjaram942_Cijk_Ailk_Bljk_F8B8NBS_BH_Bias_HAS_SAV_UserArgs.yaml
- {MinimumRequiredVersion: 4.33.0}
- aquavanjaram942
- {Architecture: gfx942, CUCount: 228}
- [Device 0049, Device 0050]
    SolutionIndex: 0
    SolutionNameMin: Cijk_Ailk_Bljk_F8B8NBS_BH_Bias_HAS_SAV_UserArgs_MT256x256x64_MI16x16x1_SN_LDSB1_CLR1_GRVWA8_GRVWB8_GSU0_GSUC0_GSUWGMRR0_K1_LBSPPA2048_LBSPPB512_LPA0_LPB8_LRVW8_MIWT8_8_PLR1_SU0_SUM0_SUS64_VWA8_VWB8_WGM1_WGMXCC1_WGMXCCGn1
    SolutionIndex: 1
    SolutionNameMin: Cijk_Ailk_Bljk_F8B8NBS_BH_Bias_HAS_SAV_UserArgs_MT256x256x64_MI16x16x1_SN_LDSB1_CLR1_GRVWA16_GRVWB8_GSU0_GSUC0_GSUWGMRR0_K1_LBSPPA2048_LBSPPB512_LPA0_LPB8_LRVW8_MIWT8_8_PLR1_SU0_SUM0_SUS64_VWA8_VWB8_WGM1_WGMXCC1_WGMXCCGn1
    SolutionIndex: 2
    SolutionNameMin: Cijk_Ailk_Bljk_F8B8NBS_BH_Bias_HAS_SAV_UserArgs_MT256x256x64_MI16x16x1_SN_LDSB1_CLR1_GRVWA8_GRVWB16_GSU0_GSUC0_GSUWGMRR0_K1_LBSPPA2048_LBSPPB512_LPA0_LPB16_LRVW8_MIWT8_8_PLR1_SU0_SUM0_SUS64_VWA8_VWB8_WGM1_WGMXCC1_WGMXCCGn1
    SolutionIndex: 3
    SolutionNameMin: Cijk_Ailk_Bljk_F8B8NBS_BH_Bias_HAS_SAV_UserArgs_MT256x256x64_MI16x16x1_SN_LDSB1_CLR1_GRVWA16_GRVWB16_GSU0_GSUC0_GSUWGMRR0_K1_LBSPPA2048_LBSPPB512_LPA0_LPB16_LRVW8_MIWT8_8_PLR1_SU0_SUM0_SUS64_VWA8_VWB8_WGM1_WGMXCC1_WGMXCCGn1
    SolutionIndex: 4
    SolutionNameMin: Cijk_Ailk_Bljk_F8B8NBS_BH_Bias_HAS_SAV_UserArgs_MT256x256x64_MI16x16x1_SN_LDSB1_CLR1_GRVWA8_GRVWB8_GSU0_GSUC0_GSUWGMRR0_K1_LBSPPA2048_LBSPPB512_LPA0_LPB8_LRVW8_MIWT8_8_PLR1_SU0_SUM0_SUS64_VWA8_VWB8_WGM4_WGMXCC1_WGMXCCGn1
    SolutionIndex: 5
    SolutionNameMin: Cijk_Ailk_Bljk_F8B8NBS_BH_Bias_HAS_SAV_UserArgs_MT256x256x64_MI16x16x1_SN_LDSB1_CLR1_GRVWA16_GRVWB8_GSU0_GSUC0_GSUWGMRR0_K1_LBSPPA2048_LBSPPB512_LPA0_LPB8_LRVW8_MIWT8_8_PLR1_SU0_SUM0_SUS64_VWA8_VWB8_WGM4_WGMXCC1_WGMXCCGn1
    SolutionIndex: 6
    SolutionNameMin: Cijk_Ailk_Bljk_F8B8NBS_BH_Bias_HAS_SAV_UserArgs_MT256x256x64_MI16x16x1_SN_LDSB1_CLR1_GRVWA16_GRVWB16_GSU0_GSUC0_GSUWGMRR0_K1_LBSPPA2048_LBSPPB512_LPA0_LPB16_LRVW8_MIWT8_8_PLR1_SU0_SUM0_SUS64_VWA8_VWB8_WGM4_WGMXCC1_WGMXCCGn1
    SolutionIndex: 7
    SolutionNameMin: Cijk_Ailk_Bljk_F8B8NBS_BH_Bias_HAS_SAV_UserArgs_MT256x256x64_MI16x16x1_SN_LDSB1_CLR1_GRVWA16_GRVWB8_GSU0_GSUC0_GSUWGMRR0_K1_LBSPPA2048_LBSPPB512_LPA0_LPB8_LRVW8_MIWT8_8_PLR1_SU0_SUM0_SUS64_VWA8_VWB8_WGM6_WGMXCC1_WGMXCCGn1
    SolutionIndex: 8
    SolutionNameMin: Cijk_Ailk_Bljk_F8B8NBS_BH_Bias_HAS_SAV_UserArgs_MT256x256x64_MI16x16x1_SN_LDSB1_CLR1_GRVWA8_GRVWB16_GSU0_GSUC0_GSUWGMRR0_K1_LBSPPA2048_LBSPPB512_LPA0_LPB16_LRVW8_MIWT8_8_PLR1_SU0_SUM0_SUS64_VWA8_VWB8_WGM6_WGMXCC1_WGMXCCGn1
    SolutionIndex: 9
    SolutionNameMin: Cijk_Ailk_Bljk_F8B8NBS_BH_Bias_HAS_SAV_UserArgs_MT256x256x64_MI16x16x1_SN_LDSB1_CLR1_GRVWA16_GRVWB16_GSU0_GSUC0_GSUWGMRR0_K1_LBSPPA2048_LBSPPB512_LPA0_LPB16_LRVW8_MIWT8_8_PLR1_SU0_SUM0_SUS64_VWA8_VWB8_WGM6_WGMXCC1_WGMXCCGn1
    SolutionIndex: 10
    SolutionNameMin: Cijk_Ailk_Bljk_F8B8NBS_BH_Bias_HAS_SAV_UserArgs_MT128x256x64_MI16x16x1_SN_LDSB1_CLR1_GRVWA8_GRVWB16_GSU0_GSUC0_GSUWGMRR0_K1_LBSPPA1024_LBSPPB512_LPA64_LPB16_LRVW8_MIWT4_8_PLR1_SU0_SUM0_SUS64_VWA4_VWB8_WGM4_WGMXCC1_WGMXCCGn1
    SolutionIndex: 11
    SolutionNameMin: Cijk_Ailk_Bljk_F8B8NBS_BH_Bias_HAS_SAV_UserArgs_MT256x128x64_MI16x16x1_SN_LDSB1_CLR1_GRVWA16_GRVWB16_GSU0_GSUC0_GSUWGMRR0_K1_LBSPPA2048_LBSPPB256_LPA0_LPB16_LRVW8_MIWT8_4_PLR1_SU0_SUM0_SUS64_VWA8_VWB4_WGM1_WGMXCC1_WGMXCCGn1
    SolutionIndex: 12
    SolutionNameMin: Cijk_Ailk_Bljk_F8B8NBS_BH_Bias_HAS_SAV_UserArgs_MT256x128x64_MI16x16x1_SN_LDSB1_CLR1_GRVWA8_GRVWB8_GSU0_GSUC0_GSUWGMRR0_K1_LBSPPA2048_LBSPPB256_LPA0_LPB8_LRVW8_MIWT8_4_PLR1_SU0_SUM0_SUS64_VWA8_VWB4_WGM4_WGMXCC1_WGMXCCGn1
    SolutionIndex: 13
    SolutionNameMin: Cijk_Ailk_Bljk_F8B8NBS_BH_Bias_HAS_SAV_UserArgs_MT256x128x64_MI16x16x1_SN_LDSB1_CLR1_GRVWA8_GRVWB16_GSU0_GSUC0_GSUWGMRR0_K1_LBSPPA2048_LBSPPB256_LPA0_LPB16_LRVW8_MIWT8_4_PLR1_SU0_SUM0_SUS64_VWA8_VWB4_WGM4_WGMXCC1_WGMXCCGn1
    SolutionIndex: 14
    SolutionNameMin: Cijk_Ailk_Bljk_F8B8NBS_BH_Bias_HAS_SAV_UserArgs_MT256x128x64_MI16x16x1_SN_LDSB1_CLR1_GRVWA16_GRVWB16_GSU0_GSUC0_GSUWGMRR0_K1_LBSPPA2048_LBSPPB256_LPA0_LPB16_LRVW8_MIWT8_4_PLR1_SU0_SUM0_SUS64_VWA8_VWB4_WGM4_WGMXCC1_WGMXCCGn1
    SolutionIndex: 15
    SolutionNameMin: Cijk_Ailk_Bljk_F8B8NBS_BH_Bias_HAS_SAV_UserArgs_MT256x128x64_MI16x16x1_SN_LDSB1_CLR1_GRVWA8_GRVWB8_GSU0_GSUC0_GSUWGMRR0_K1_LBSPPA2048_LBSPPB256_LPA0_LPB8_LRVW8_MIWT8_4_PLR1_SU0_SUM0_SUS64_VWA8_VWB4_WGM6_WGMXCC1_WGMXCCGn1
    SolutionIndex: 16
    SolutionNameMin: Cijk_Ailk_Bljk_F8B8NBS_BH_Bias_HAS_SAV_UserArgs_MT256x128x64_MI16x16x1_SN_LDSB1_CLR1_GRVWA16_GRVWB16_GSU0_GSUC0_GSUWGMRR0_K1_LBSPPA2048_LBSPPB256_LPA0_LPB16_LRVW8_MIWT8_4_PLR1_SU0_SUM0_SUS64_VWA8_VWB4_WGM6_WGMXCC1_WGMXCCGn1
    SolutionIndex: 17
    SolutionNameMin: Cijk_Ailk_Bljk_F8B8NBS_BH_Bias_HAS_SAV_UserArgs_MT256x128x64_MI16x16x1_SN_LDSB1_CLR1_GRVWA8_GRVWB8_GSU0_GSUC0_GSUWGMRR0_K1_LBSPPA2048_LBSPPB256_LPA0_LPB8_LRVW8_MIWT8_4_PLR1_SU0_SUM0_SUS64_VWA8_VWB4_WGM8_WGMXCC1_WGMXCCGn1
    SolutionIndex: 18
    SolutionNameMin: Cijk_Ailk_Bljk_F8B8NBS_BH_Bias_HAS_SAV_UserArgs_MT256x128x64_MI16x16x1_SN_LDSB1_CLR1_GRVWA16_GRVWB8_GSU0_GSUC0_GSUWGMRR0_K1_LBSPPA2048_LBSPPB256_LPA0_LPB8_LRVW8_MIWT8_4_PLR1_SU0_SUM0_SUS64_VWA8_VWB4_WGM8_WGMXCC1_WGMXCCGn1
    SolutionIndex: 19
    SolutionNameMin: Cijk_Ailk_Bljk_F8B8NBS_BH_Bias_HAS_SAV_UserArgs_MT256x128x64_MI16x16x1_SN_LDSB1_CLR1_GRVWA8_GRVWB16_GSU0_GSUC0_GSUWGMRR0_K1_LBSPPA2048_LBSPPB256_LPA0_LPB16_LRVW8_MIWT8_4_PLR1_SU0_SUM0_SUS64_VWA8_VWB4_WGM8_WGMXCC1_WGMXCCGn1
    SolutionIndex: 20
    SolutionNameMin: Cijk_Ailk_Bljk_F8B8NBS_BH_Bias_HAS_SAV_UserArgs_MT256x128x64_MI16x16x1_SN_LDSB1_CLR1_GRVWA16_GRVWB16_GSU0_GSUC0_GSUWGMRR0_K1_LBSPPA2048_LBSPPB256_LPA0_LPB16_LRVW8_MIWT8_4_PLR1_SU0_SUM0_SUS64_VWA8_VWB4_WGM8_WGMXCC1_WGMXCCGn1
    SolutionIndex: 21
    SolutionNameMin: Cijk_Ailk_Bljk_F8B8NBS_BH_Bias_HAS_SAV_UserArgs_MT128x128x64_MI16x16x1_SN_LDSB1_CLR1_GRVWA8_GRVWB16_GSU0_GSUC0_GSUWGMRR0_K1_LBSPPA1024_LBSPPB128_LPA0_LPB16_LRVW8_MIWT8_2_PLR1_SU0_SUM0_SUS64_VWA8_VWB2_WGM1_WGMXCC1_WGMXCCGn1
    SolutionIndex: 22
    SolutionNameMin: Cijk_Ailk_Bljk_F8B8NBS_BH_Bias_HAS_SAV_UserArgs_MT128x128x64_MI16x16x1_SN_LDSB1_CLR1_GRVWA16_GRVWB16_GSU0_GSUC0_GSUWGMRR0_K1_LBSPPA1024_LBSPPB128_LPA0_LPB16_LRVW8_MIWT8_2_PLR1_SU0_SUM0_SUS64_VWA8_VWB2_WGM1_WGMXCC1_WGMXCCGn1
    SolutionIndex: 23
    SolutionNameMin: Cijk_Ailk_Bljk_F8B8NBS_BH_Bias_HAS_SAV_UserArgs_MT64x128x64_MI16x16x1_SN_LDSB0_CLR1_GRVWA8_GRVWB16_GSU0_GSUC0_GSUWGMRR0_K1_LBSPPA512_LBSPPB512_LPA16_LPB16_LRVW8_MIWT1_8_PLR1_SU0_SUM0_SUS64_VWA1_VWB8_WGM4_WGMXCC1_WGMXCCGn1
    SolutionIndex: 24
    SolutionNameMin: Cijk_Ailk_Bljk_F8B8NBS_BH_Bias_HAS_SAV_UserArgs_MT128x64x64_MI16x16x1_SN_LDSB0_CLR1_GRVWA8_GRVWB16_GSU0_GSUC0_GSUWGMRR0_K1_LBSPPA1024_LBSPPB128_LPA0_LPB16_LRVW8_MIWT8_1_PLR1_SU0_SUM0_SUS64_VWA8_VWB1_WGM1_WGMXCC1_WGMXCCGn1
    SolutionIndex: 25
    SolutionNameMin: Cijk_Ailk_Bljk_F8B8NBS_BH_Bias_HAS_SAV_UserArgs_MT128x64x64_MI16x16x1_SN_LDSB0_CLR1_GRVWA16_GRVWB16_GSU0_GSUC0_GSUWGMRR0_K1_LBSPPA1024_LBSPPB128_LPA0_LPB16_LRVW8_MIWT8_1_PLR1_SU0_SUM0_SUS64_VWA8_VWB1_WGM1_WGMXCC1_WGMXCCGn1
    SolutionIndex: 26
    SolutionNameMin: Cijk_Ailk_Bljk_F8B8NBS_BH_Bias_HAS_SAV_UserArgs_MT128x64x64_MI16x16x1_SN_LDSB0_CLR1_GRVWA16_GRVWB16_GSU0_GSUC0_GSUWGMRR0_K1_LBSPPA1024_LBSPPB128_LPA0_LPB16_LRVW8_MIWT8_1_PLR1_SU0_SUM0_SUS64_VWA8_VWB1_WGM8_WGMXCC1_WGMXCCGn1
    SolutionIndex: 27
    SolutionNameMin: Cijk_Ailk_Bljk_F8B8NBS_BH_Bias_HAS_SAV_UserArgs_MT64x128x64_MI16x16x1_SN_LDSB0_CLR1_GRVWA8_GRVWB8_GSU0_GSUC0_GSUWGMRR0_K1_LBSPPA512_LBSPPB256_LPA32_LPB8_LRVW8_MIWT2_4_PLR1_SU0_SUM0_SUS64_VWA2_VWB4_WGM1_WGMXCC1_WGMXCCGn1
    SolutionIndex: 28
    SolutionNameMin: Cijk_Ailk_Bljk_F8B8NBS_BH_Bias_HAS_SAV_UserArgs_MT64x128x64_MI16x16x1_SN_LDSB0_CLR1_GRVWA16_GRVWB8_GSU0_GSUC0_GSUWGMRR0_K1_LBSPPA512_LBSPPB256_LPA32_LPB8_LRVW8_MIWT2_4_PLR1_SU0_SUM0_SUS64_VWA2_VWB4_WGM1_WGMXCC1_WGMXCCGn1
    SolutionIndex: 29
    SolutionNameMin: Cijk_Ailk_Bljk_F8B8NBS_BH_Bias_HAS_SAV_UserArgs_MT64x128x64_MI16x16x1_SN_LDSB0_CLR1_GRVWA8_GRVWB16_GSU0_GSUC0_GSUWGMRR0_K1_LBSPPA512_LBSPPB256_LPA32_LPB16_LRVW8_MIWT2_4_PLR1_SU0_SUM0_SUS64_VWA2_VWB4_WGM1_WGMXCC1_WGMXCCGn1
    SolutionIndex: 30
    SolutionNameMin: Cijk_Ailk_Bljk_F8B8NBS_BH_Bias_HAS_SAV_UserArgs_MT64x128x64_MI16x16x1_SN_LDSB0_CLR1_GRVWA16_GRVWB16_GSU0_GSUC0_GSUWGMRR0_K1_LBSPPA512_LBSPPB256_LPA32_LPB16_LRVW8_MIWT2_4_PLR1_SU0_SUM0_SUS64_VWA2_VWB4_WGM1_WGMXCC1_WGMXCCGn1
    SolutionIndex: 31
    SolutionNameMin: Cijk_Ailk_Bljk_F8B8NBS_BH_Bias_HAS_SAV_UserArgs_MT64x128x64_MI16x16x1_SN_LDSB0_CLR1_GRVWA16_GRVWB8_GSU0_GSUC0_GSUWGMRR0_K1_LBSPPA512_LBSPPB256_LPA32_LPB8_LRVW8_MIWT2_4_PLR1_SU0_SUM0_SUS64_VWA2_VWB4_WGM4_WGMXCC1_WGMXCCGn1
    SolutionIndex: 32
    SolutionNameMin: Cijk_Ailk_Bljk_F8B8NBS_BH_Bias_HAS_SAV_UserArgs_MT64x128x64_MI16x16x1_SN_LDSB0_CLR1_GRVWA16_GRVWB16_GSU0_GSUC0_GSUWGMRR0_K1_LBSPPA512_LBSPPB256_LPA32_LPB16_LRVW8_MIWT2_4_PLR1_SU0_SUM0_SUS64_VWA2_VWB4_WGM6_WGMXCC1_WGMXCCGn1
    SolutionIndex: 33
    SolutionNameMin: Cijk_Ailk_Bljk_F8B8NBS_BH_Bias_HAS_SAV_UserArgs_MT64x128x64_MI16x16x1_SN_LDSB0_CLR1_GRVWA16_GRVWB8_GSU0_GSUC0_GSUWGMRR0_K1_LBSPPA512_LBSPPB256_LPA32_LPB8_LRVW8_MIWT2_4_PLR1_SU0_SUM0_SUS64_VWA2_VWB4_WGM8_WGMXCC1_WGMXCCGn1
    SolutionIndex: 34
    SolutionNameMin: Cijk_Ailk_Bljk_F8B8NBS_BH_Bias_HAS_SAV_UserArgs_MT128x64x64_MI16x16x1_SN_LDSB0_CLR1_GRVWA8_GRVWB16_GSU0_GSUC0_GSUWGMRR0_K1_LBSPPA1024_LBSPPB128_LPA64_LPB16_LRVW8_MIWT4_2_PLR1_SU0_SUM0_SUS64_VWA4_VWB2_WGM1_WGMXCC1_WGMXCCGn1
    SolutionIndex: 35
    SolutionNameMin: Cijk_Ailk_Bljk_F8B8NBS_BH_Bias_HAS_SAV_UserArgs_MT128x64x64_MI16x16x1_SN_LDSB0_CLR1_GRVWA16_GRVWB16_GSU0_GSUC0_GSUWGMRR0_K1_LBSPPA1024_LBSPPB128_LPA64_LPB16_LRVW8_MIWT4_2_PLR1_SU0_SUM0_SUS64_VWA4_VWB2_WGM1_WGMXCC1_WGMXCCGn1
    SolutionIndex: 36
    SolutionNameMin: Cijk_Ailk_Bljk_F8B8NBS_BH_Bias_HAS_SAV_UserArgs_MT128x64x64_MI16x16x1_SN_LDSB0_CLR1_GRVWA16_GRVWB16_GSU0_GSUC0_GSUWGMRR0_K1_LBSPPA1024_LBSPPB128_LPA64_LPB16_LRVW8_MIWT4_2_PLR1_SU0_SUM0_SUS64_VWA4_VWB2_WGM4_WGMXCC1_WGMXCCGn1
    SolutionIndex: 37
    SolutionNameMin: Cijk_Ailk_Bljk_F8B8NBS_BH_Bias_HAS_SAV_UserArgs_MT128x32x64_MI16x16x1_SN_LDSB0_CLR1_GRVWA16_GRVWB8_GSU0_GSUC0_GSUWGMRR0_K1_LBSPPA1024_LBSPPB128_LPA64_LPB8_LRVW8_MIWT4_1_PLR1_SU0_SUM0_SUS64_VWA4_VWB1_WGM1_WGMXCC1_WGMXCCGn1
    SolutionIndex: 38
    SolutionNameMin: Cijk_Ailk_Bljk_F8B8NBS_BH_Bias_HAS_SAV_UserArgs_MT128x32x64_MI16x16x1_SN_LDSB0_CLR1_GRVWA8_GRVWB8_GSU0_GSUC0_GSUWGMRR0_K1_LBSPPA1024_LBSPPB128_LPA64_LPB8_LRVW8_MIWT4_1_PLR1_SU0_SUM0_SUS64_VWA4_VWB1_WGM4_WGMXCC1_WGMXCCGn1
    SolutionIndex: 39
    SolutionNameMin: Cijk_Ailk_Bljk_F8B8NBS_BH_Bias_HAS_SAV_UserArgs_MT64x64x64_MI16x16x1_SN_LDSB0_CLR1_GRVWA8_GRVWB8_GSU0_GSUC0_GSUWGMRR0_K1_LBSPPA512_LBSPPB128_LPA32_LPB8_LRVW8_MIWT2_2_PLR1_SU0_SUM0_SUS64_VWA2_VWB2_WGM1_WGMXCC1_WGMXCCGn1
    SolutionIndex: 40
    SolutionNameMin: Cijk_Ailk_Bljk_F8B8NBS_BH_Bias_HAS_SAV_UserArgs_MT64x64x64_MI16x16x1_SN_LDSB0_CLR1_GRVWA16_GRVWB8_GSU0_GSUC0_GSUWGMRR0_K1_LBSPPA512_LBSPPB128_LPA32_LPB8_LRVW8_MIWT2_2_PLR1_SU0_SUM0_SUS64_VWA2_VWB2_WGM1_WGMXCC1_WGMXCCGn1
    SolutionIndex: 41
    SolutionNameMin: Cijk_Ailk_Bljk_F8B8NBS_BH_Bias_HAS_SAV_UserArgs_MT64x64x64_MI16x16x1_SN_LDSB0_CLR1_GRVWA8_GRVWB16_GSU0_GSUC0_GSUWGMRR0_K1_LBSPPA512_LBSPPB128_LPA32_LPB16_LRVW8_MIWT2_2_PLR1_SU0_SUM0_SUS64_VWA2_VWB2_WGM1_WGMXCC1_WGMXCCGn1
    SolutionIndex: 42
    SolutionNameMin: Cijk_Ailk_Bljk_F8B8NBS_BH_Bias_HAS_SAV_UserArgs_MT64x64x64_MI16x16x1_SN_LDSB0_CLR1_GRVWA16_GRVWB16_GSU0_GSUC0_GSUWGMRR0_K1_LBSPPA512_LBSPPB128_LPA32_LPB16_LRVW8_MIWT2_2_PLR1_SU0_SUM0_SUS64_VWA2_VWB2_WGM1_WGMXCC1_WGMXCCGn1
    SolutionIndex: 43
    SolutionNameMin: Cijk_Ailk_Bljk_F8B8NBS_BH_Bias_HAS_SAV_UserArgs_MT64x64x64_MI16x16x1_SN_LDSB0_CLR1_GRVWA8_GRVWB16_GSU0_GSUC0_GSUWGMRR0_K1_LBSPPA512_LBSPPB128_LPA32_LPB16_LRVW8_MIWT2_2_PLR1_SU0_SUM0_SUS64_VWA2_VWB2_WGM4_WGMXCC1_WGMXCCGn1
    SolutionIndex: 44
    SolutionNameMin: Cijk_Ailk_Bljk_F8B8NBS_BH_Bias_HAS_SAV_UserArgs_MT64x32x64_MI16x16x1_SN_LDSB0_CLR1_GRVWA8_GRVWB8_GSU0_GSUC0_GSUWGMRR0_K1_LBSPPA512_LBSPPB128_LPA32_LPB8_LRVW8_MIWT2_1_PLR1_SU0_SUM0_SUS64_VWA2_VWB1_WGM1_WGMXCC1_WGMXCCGn1
    SolutionIndex: 45
    SolutionNameMin: Cijk_Ailk_Bljk_F8B8NBS_BH_Bias_HAS_SAV_UserArgs_MT64x32x64_MI16x16x1_SN_LDSB0_CLR1_GRVWA8_GRVWB8_GSU0_GSUC0_GSUWGMRR0_K1_LBSPPA512_LBSPPB128_LPA32_LPB8_LRVW8_MIWT2_1_PLR1_SU0_SUM0_SUS64_VWA2_VWB1_WGM6_WGMXCC1_WGMXCCGn1
    SolutionIndex: 46
    SolutionNameMin: Cijk_Ailk_Bljk_F8B8NBS_BH_Bias_HAS_SAV_UserArgs_MT32x32x64_MI16x16x1_SN_LDSB0_CLR1_GRVWA8_GRVWB8_GSU0_GSUC0_GSUWGMRR0_K1_LBSPPA256_LBSPPB128_LPA16_LPB8_LRVW8_MIWT1_1_PLR1_SU0_SUM0_SUS64_VWA1_VWB1_WGM1_WGMXCC1_WGMXCCGn1
    SolutionIndex: 47
    SolutionNameMin: Cijk_Ailk_Bljk_F8B8NBS_BH_Bias_HAS_SAV_UserArgs_MT32x32x64_MI16x16x1_SN_LDSB0_CLR1_GRVWA8_GRVWB8_GSU0_GSUC0_GSUWGMRR0_K1_LBSPPA256_LBSPPB128_LPA16_LPB8_LRVW8_MIWT1_1_PLR1_SU0_SUM0_SUS64_VWA1_VWB1_WGM4_WGMXCC1_WGMXCCGn1
    SolutionIndex: 48
    SolutionNameMin: Cijk_Ailk_Bljk_F8B8NBS_BH_Bias_HAS_SAV_UserArgs_MT32x32x64_MI16x16x1_SN_LDSB0_CLR1_GRVWA8_GRVWB8_GSU0_GSUC0_GSUWGMRR0_K1_LBSPPA256_LBSPPB128_LPA16_LPB8_LRVW8_MIWT1_1_PLR1_SU0_SUM0_SUS64_VWA1_VWB1_WGM8_WGMXCC1_WGMXCCGn1
    SolutionIndex: 49
    SolutionNameMin: Cijk_Ailk_Bljk_F8B8NBS_BH_Bias_HAS_SAV_UserArgs_MT128x256x128_MI16x16x1_SN_LDSB1_CLR1_GRVWA8_GRVWB16_GSU0_GSUC0_GSUWGMRR0_K1_LBSPPA1024_LBSPPB1024_LPA64_LPB16_LRVW8_MIWT4_8_PLR1_SU0_SUM0_SUS128_VWA4_VWB8_WGM1_WGMXCC1_WGMXCCGn1
    SolutionIndex: 50
    SolutionNameMin: Cijk_Ailk_Bljk_F8B8NBS_BH_Bias_HAS_SAV_UserArgs_MT128x256x128_MI16x16x1_SN_LDSB1_CLR1_GRVWA16_GRVWB16_GSU0_GSUC0_GSUWGMRR0_K1_LBSPPA1024_LBSPPB1024_LPA64_LPB16_LRVW8_MIWT4_8_PLR1_SU0_SUM0_SUS128_VWA4_VWB8_WGM1_WGMXCC1_WGMXCCGn1
    SolutionIndex: 51
    SolutionNameMin: Cijk_Ailk_Bljk_F8B8NBS_BH_Bias_HAS_SAV_UserArgs_MT128x256x128_MI16x16x1_SN_LDSB1_CLR1_GRVWA16_GRVWB16_GSU0_GSUC0_GSUWGMRR0_K1_LBSPPA1024_LBSPPB1024_LPA64_LPB16_LRVW8_MIWT4_8_PLR1_SU0_SUM0_SUS128_VWA4_VWB8_WGM4_WGMXCC1_WGMXCCGn1
    SolutionIndex: 52
    SolutionNameMin: Cijk_Ailk_Bljk_F8B8NBS_BH_Bias_HAS_SAV_UserArgs_MT128x256x128_MI16x16x1_SN_LDSB1_CLR1_GRVWA16_GRVWB16_GSU0_GSUC0_GSUWGMRR0_K1_LBSPPA1024_LBSPPB1024_LPA64_LPB16_LRVW8_MIWT4_8_PLR1_SU0_SUM0_SUS128_VWA4_VWB8_WGM6_WGMXCC1_WGMXCCGn1
    SolutionIndex: 53
    SolutionNameMin: Cijk_Ailk_Bljk_F8B8NBS_BH_Bias_HAS_SAV_UserArgs_MT128x256x128_MI16x16x1_SN_LDSB1_CLR1_GRVWA16_GRVWB16_GSU0_GSUC0_GSUWGMRR0_K1_LBSPPA1024_LBSPPB1024_LPA64_LPB16_LRVW8_MIWT4_8_PLR1_SU0_SUM0_SUS128_VWA4_VWB8_WGM8_WGMXCC1_WGMXCCGn1
    SolutionIndex: 54
    SolutionNameMin: Cijk_Ailk_Bljk_F8B8NBS_BH_Bias_HAS_SAV_UserArgs_MT256x144x128_MI16x16x1_SN_LDSB1_CLR1_GRVWA8_GRVWB8_GSU0_GSUC0_GSUWGMRR0_K1_LBSPPA2048_LBSPPB128_LPA64_LPB8_LRVW8_MIWT4_9_PLR1_SU0_SUM0_SUS128_VWA4_VWB1_WGM1_WGMXCC1_WGMXCCGn1
    SolutionIndex: 55
    SolutionNameMin: Cijk_Ailk_Bljk_F8B8NBS_BH_Bias_HAS_SAV_UserArgs_MT256x144x128_MI16x16x1_SN_LDSB1_CLR1_GRVWA16_GRVWB8_GSU0_GSUC0_GSUWGMRR0_K1_LBSPPA2048_LBSPPB128_LPA64_LPB8_LRVW8_MIWT4_9_PLR1_SU0_SUM0_SUS128_VWA4_VWB1_WGM1_WGMXCC1_WGMXCCGn1
    SolutionIndex: 56
    SolutionNameMin: Cijk_Ailk_Bljk_F8B8NBS_BH_Bias_HAS_SAV_UserArgs_MT256x144x128_MI16x16x1_SN_LDSB1_CLR1_GRVWA8_GRVWB8_GSU0_GSUC0_GSUWGMRR0_K1_LBSPPA2048_LBSPPB128_LPA64_LPB8_LRVW8_MIWT4_9_PLR1_SU0_SUM0_SUS128_VWA4_VWB1_WGM4_WGMXCC1_WGMXCCGn1
    SolutionIndex: 57
    SolutionNameMin: Cijk_Ailk_Bljk_F8B8NBS_BH_Bias_HAS_SAV_UserArgs_MT256x144x128_MI16x16x1_SN_LDSB1_CLR1_GRVWA16_GRVWB8_GSU0_GSUC0_GSUWGMRR0_K1_LBSPPA2048_LBSPPB128_LPA64_LPB8_LRVW8_MIWT4_9_PLR1_SU0_SUM0_SUS128_VWA4_VWB1_WGM4_WGMXCC1_WGMXCCGn1
    SolutionIndex: 58
    SolutionNameMin: Cijk_Ailk_Bljk_F8B8NBS_BH_Bias_HAS_SAV_UserArgs_MT256x144x128_MI16x16x1_SN_LDSB1_CLR1_GRVWA16_GRVWB8_GSU0_GSUC0_GSUWGMRR0_K1_LBSPPA2048_LBSPPB128_LPA64_LPB8_LRVW8_MIWT4_9_PLR1_SU0_SUM0_SUS128_VWA4_VWB1_WGM6_WGMXCC1_WGMXCCGn1
    SolutionIndex: 59
    SolutionNameMin: Cijk_Ailk_Bljk_F8B8NBS_BH_Bias_HAS_SAV_UserArgs_MT256x144x128_MI16x16x1_SN_LDSB1_CLR1_GRVWA16_GRVWB8_GSU0_GSUC0_GSUWGMRR0_K1_LBSPPA2048_LBSPPB128_LPA64_LPB8_LRVW8_MIWT4_9_PLR1_SU0_SUM0_SUS128_VWA4_VWB1_WGM8_WGMXCC1_WGMXCCGn1
    SolutionIndex: 60
    SolutionNameMin: Cijk_Ailk_Bljk_F8B8NBS_BH_Bias_HAS_SAV_UserArgs_MT256x128x128_MI16x16x1_SN_LDSB1_CLR1_GRVWA16_GRVWB8_GSU0_GSUC0_GSUWGMRR0_K1_LBSPPA2048_LBSPPB512_LPA0_LPB8_LRVW8_MIWT8_4_PLR1_SU0_SUM0_SUS128_VWA8_VWB4_WGM1_WGMXCC1_WGMXCCGn1
    SolutionIndex: 61
    SolutionNameMin: Cijk_Ailk_Bljk_F8B8NBS_BH_Bias_HAS_SAV_UserArgs_MT256x128x128_MI16x16x1_SN_LDSB1_CLR1_GRVWA16_GRVWB8_GSU0_GSUC0_GSUWGMRR0_K1_LBSPPA2048_LBSPPB512_LPA0_LPB8_LRVW8_MIWT8_4_PLR1_SU0_SUM0_SUS128_VWA8_VWB4_WGM4_WGMXCC1_WGMXCCGn1
    SolutionIndex: 62
    SolutionNameMin: Cijk_Ailk_Bljk_F8B8NBS_BH_Bias_HAS_SAV_UserArgs_MT256x128x128_MI16x16x1_SN_LDSB1_CLR1_GRVWA16_GRVWB8_GSU0_GSUC0_GSUWGMRR0_K1_LBSPPA2048_LBSPPB512_LPA0_LPB8_LRVW8_MIWT8_4_PLR1_SU0_SUM0_SUS128_VWA8_VWB4_WGM8_WGMXCC1_WGMXCCGn1
    SolutionIndex: 63
    SolutionNameMin: Cijk_Ailk_Bljk_F8B8NBS_BH_Bias_HAS_SAV_UserArgs_MT256x64x128_MI16x16x1_SN_LDSB1_CLR1_GRVWA16_GRVWB16_GSU0_GSUC0_GSUWGMRR0_K1_LBSPPA2048_LBSPPB256_LPA0_LPB16_LRVW8_MIWT8_2_PLR1_SU0_SUM0_SUS128_VWA8_VWB2_WGM1_WGMXCC1_WGMXCCGn1
    SolutionIndex: 64
    SolutionNameMin: Cijk_Ailk_Bljk_F8B8NBS_BH_Bias_HAS_SAV_UserArgs_MT128x128x128_MI16x16x1_SN_LDSB1_CLR1_GRVWA16_GRVWB16_GSU0_GSUC0_GSUWGMRR0_K1_LBSPPA1024_LBSPPB256_LPA0_LPB16_LRVW8_MIWT8_2_PLR1_SU0_SUM0_SUS128_VWA8_VWB2_WGM1_WGMXCC1_WGMXCCGn1
    SolutionIndex: 65
    SolutionNameMin: Cijk_Ailk_Bljk_F8B8NBS_BH_Bias_HAS_SAV_UserArgs_MT128x128x128_MI16x16x1_SN_LDSB1_CLR1_GRVWA16_GRVWB16_GSU0_GSUC0_GSUWGMRR0_K1_LBSPPA1024_LBSPPB256_LPA0_LPB16_LRVW8_MIWT8_2_PLR1_SU0_SUM0_SUS128_VWA8_VWB2_WGM4_WGMXCC1_WGMXCCGn1
    SolutionIndex: 66
    SolutionNameMin: Cijk_Ailk_Bljk_F8B8NBS_BH_Bias_HAS_SAV_UserArgs_MT128x128x128_MI16x16x1_SN_LDSB1_CLR1_GRVWA16_GRVWB16_GSU0_GSUC0_GSUWGMRR0_K1_LBSPPA1024_LBSPPB256_LPA0_LPB16_LRVW8_MIWT8_2_PLR1_SU0_SUM0_SUS128_VWA8_VWB2_WGM8_WGMXCC1_WGMXCCGn1
    SolutionIndex: 67
    SolutionNameMin: Cijk_Ailk_Bljk_F8B8NBS_BH_Bias_HAS_SAV_UserArgs_MT32x256x128_MI16x16x1_SN_LDSB1_CLR1_GRVWA8_GRVWB16_GSU0_GSUC0_GSUWGMRR0_K1_LBSPPA256_LBSPPB1024_LPA16_LPB16_LRVW8_MIWT1_8_PLR1_SU0_SUM0_SUS128_VWA1_VWB8_WGM8_WGMXCC1_WGMXCCGn1
    SolutionIndex: 68
    SolutionNameMin: Cijk_Ailk_Bljk_F8B8NBS_BH_Bias_HAS_SAV_UserArgs_MT128x144x128_MI16x16x1_SN_LDSB1_CLR1_GRVWA8_GRVWB8_GSU0_GSUC0_GSUWGMRR0_K1_LBSPPA1024_LBSPPB128_LPA32_LPB8_LRVW8_MIWT2_9_PLR1_SU0_SUM0_SUS128_VWA2_VWB1_WGM1_WGMXCC1_WGMXCCGn1
    SolutionIndex: 69
    SolutionNameMin: Cijk_Ailk_Bljk_F8B8NBS_BH_Bias_HAS_SAV_UserArgs_MT128x144x128_MI16x16x1_SN_LDSB1_CLR1_GRVWA16_GRVWB8_GSU0_GSUC0_GSUWGMRR0_K1_LBSPPA1024_LBSPPB128_LPA32_LPB8_LRVW8_MIWT2_9_PLR1_SU0_SUM0_SUS128_VWA2_VWB1_WGM1_WGMXCC1_WGMXCCGn1
    SolutionIndex: 70
    SolutionNameMin: Cijk_Ailk_Bljk_F8B8NBS_BH_Bias_HAS_SAV_UserArgs_MT128x144x128_MI16x16x1_SN_LDSB1_CLR1_GRVWA16_GRVWB8_GSU0_GSUC0_GSUWGMRR0_K1_LBSPPA1024_LBSPPB128_LPA32_LPB8_LRVW8_MIWT2_9_PLR1_SU0_SUM0_SUS128_VWA2_VWB1_WGM4_WGMXCC1_WGMXCCGn1
    SolutionIndex: 71
    SolutionNameMin: Cijk_Ailk_Bljk_F8B8NBS_BH_Bias_HAS_SAV_UserArgs_MT128x128x128_MI16x16x1_SN_LDSB1_CLR1_GRVWA16_GRVWB16_GSU0_GSUC0_GSUWGMRR0_K1_LBSPPA1024_LBSPPB512_LPA64_LPB16_LRVW8_MIWT4_4_PLR1_SU0_SUM0_SUS128_VWA4_VWB4_WGM1_WGMXCC1_WGMXCCGn1
    SolutionIndex: 72
    SolutionNameMin: Cijk_Ailk_Bljk_F8B8NBS_BH_Bias_HAS_SAV_UserArgs_MT128x128x128_MI16x16x1_SN_LDSB1_CLR1_GRVWA16_GRVWB16_GSU0_GSUC0_GSUWGMRR0_K1_LBSPPA1024_LBSPPB512_LPA64_LPB16_LRVW8_MIWT4_4_PLR1_SU0_SUM0_SUS128_VWA4_VWB4_WGM4_WGMXCC1_WGMXCCGn1
    SolutionIndex: 73
    SolutionNameMin: Cijk_Ailk_Bljk_F8B8NBS_BH_Bias_HAS_SAV_UserArgs_MT128x128x128_MI16x16x1_SN_LDSB1_CLR1_GRVWA16_GRVWB16_GSU0_GSUC0_GSUWGMRR0_K1_LBSPPA1024_LBSPPB512_LPA64_LPB16_LRVW8_MIWT4_4_PLR1_SU0_SUM0_SUS128_VWA4_VWB4_WGM6_WGMXCC1_WGMXCCGn1
    SolutionIndex: 74
    SolutionNameMin: Cijk_Ailk_Bljk_F8B8NBS_BH_Bias_HAS_SAV_UserArgs_MT128x128x128_MI16x16x1_SN_LDSB1_CLR1_GRVWA16_GRVWB16_GSU0_GSUC0_GSUWGMRR0_K1_LBSPPA1024_LBSPPB512_LPA64_LPB16_LRVW8_MIWT4_4_PLR1_SU0_SUM0_SUS128_VWA4_VWB4_WGM8_WGMXCC1_WGMXCCGn1
    SolutionIndex: 75
    SolutionNameMin: Cijk_Ailk_Bljk_F8B8NBS_BH_Bias_HAS_SAV_UserArgs_MT64x128x128_MI16x16x1_SN_LDSB1_CLR1_GRVWA16_GRVWB16_GSU0_GSUC0_GSUWGMRR0_K1_LBSPPA512_LBSPPB512_LPA32_LPB16_LRVW8_MIWT2_4_PLR1_SU0_SUM0_SUS128_VWA2_VWB4_WGM1_WGMXCC1_WGMXCCGn1
    SolutionIndex: 76
    SolutionNameMin: Cijk_Ailk_Bljk_F8B8NBS_BH_Bias_HAS_SAV_UserArgs_MT64x128x128_MI16x16x1_SN_LDSB1_CLR1_GRVWA8_GRVWB16_GSU0_GSUC0_GSUWGMRR0_K1_LBSPPA512_LBSPPB512_LPA32_LPB16_LRVW8_MIWT2_4_PLR1_SU0_SUM0_SUS128_VWA2_VWB4_WGM4_WGMXCC1_WGMXCCGn1
    SolutionIndex: 77
    SolutionNameMin: Cijk_Ailk_Bljk_F8B8NBS_BH_Bias_HAS_SAV_UserArgs_MT128x64x128_MI16x16x1_SN_LDSB1_CLR1_GRVWA16_GRVWB8_GSU0_GSUC0_GSUWGMRR0_K1_LBSPPA1024_LBSPPB256_LPA64_LPB8_LRVW8_MIWT4_2_PLR1_SU0_SUM0_SUS128_VWA4_VWB2_WGM1_WGMXCC1_WGMXCCGn1
    SolutionIndex: 78
    SolutionNameMin: Cijk_Ailk_Bljk_F8B8NBS_BH_Bias_HAS_SAV_UserArgs_MT128x64x128_MI16x16x1_SN_LDSB1_CLR1_GRVWA16_GRVWB16_GSU0_GSUC0_GSUWGMRR0_K1_LBSPPA1024_LBSPPB256_LPA64_LPB16_LRVW8_MIWT4_2_PLR1_SU0_SUM0_SUS128_VWA4_VWB2_WGM1_WGMXCC1_WGMXCCGn1
    SolutionIndex: 79
    SolutionNameMin: Cijk_Ailk_Bljk_F8B8NBS_BH_Bias_HAS_SAV_UserArgs_MT128x64x128_MI16x16x1_SN_LDSB1_CLR1_GRVWA16_GRVWB16_GSU0_GSUC0_GSUWGMRR0_K1_LBSPPA1024_LBSPPB256_LPA64_LPB16_LRVW8_MIWT4_2_PLR1_SU0_SUM0_SUS128_VWA4_VWB2_WGM4_WGMXCC1_WGMXCCGn1
    SolutionIndex: 80
    SolutionNameMin: Cijk_Ailk_Bljk_F8B8NBS_BH_Bias_HAS_SAV_UserArgs_MT128x64x128_MI16x16x1_SN_LDSB1_CLR1_GRVWA16_GRVWB16_GSU0_GSUC0_GSUWGMRR0_K1_LBSPPA1024_LBSPPB256_LPA64_LPB16_LRVW8_MIWT4_2_PLR1_SU0_SUM0_SUS128_VWA4_VWB2_WGM6_WGMXCC1_WGMXCCGn1
    SolutionIndex: 81
    SolutionNameMin: Cijk_Ailk_Bljk_F8B8NBS_BH_Bias_HAS_SAV_UserArgs_MT128x64x128_MI16x16x1_SN_LDSB1_CLR1_GRVWA16_GRVWB16_GSU0_GSUC0_GSUWGMRR0_K1_LBSPPA1024_LBSPPB256_LPA64_LPB16_LRVW8_MIWT4_2_PLR1_SU0_SUM0_SUS128_VWA4_VWB2_WGM8_WGMXCC1_WGMXCCGn1
    SolutionIndex: 82
    SolutionNameMin: Cijk_Ailk_Bljk_F8B8NBS_BH_Bias_HAS_SAV_UserArgs_MT64x64x128_MI16x16x1_SN_LDSB1_CLR1_GRVWA16_GRVWB8_GSU0_GSUC0_GSUWGMRR0_K1_LBSPPA512_LBSPPB256_LPA32_LPB8_LRVW8_MIWT2_2_PLR1_SU0_SUM0_SUS128_VWA2_VWB2_WGM1_WGMXCC1_WGMXCCGn1
    SolutionIndex: 83
    SolutionNameMin: Cijk_Ailk_Bljk_F8B8NBS_BH_Bias_HAS_SAV_UserArgs_MT64x64x128_MI16x16x1_SN_LDSB1_CLR1_GRVWA8_GRVWB16_GSU0_GSUC0_GSUWGMRR0_K1_LBSPPA512_LBSPPB256_LPA32_LPB16_LRVW8_MIWT2_2_PLR1_SU0_SUM0_SUS128_VWA2_VWB2_WGM1_WGMXCC1_WGMXCCGn1
    SolutionIndex: 84
    SolutionNameMin: Cijk_Ailk_Bljk_F8B8NBS_BH_Bias_HAS_SAV_UserArgs_MT64x64x128_MI16x16x1_SN_LDSB1_CLR1_GRVWA16_GRVWB16_GSU0_GSUC0_GSUWGMRR0_K1_LBSPPA512_LBSPPB256_LPA32_LPB16_LRVW8_MIWT2_2_PLR1_SU0_SUM0_SUS128_VWA2_VWB2_WGM1_WGMXCC1_WGMXCCGn1
    SolutionIndex: 85
    SolutionNameMin: Cijk_Ailk_Bljk_F8B8NBS_BH_Bias_HAS_SAV_UserArgs_MT64x64x128_MI16x16x1_SN_LDSB1_CLR1_GRVWA16_GRVWB8_GSU0_GSUC0_GSUWGMRR0_K1_LBSPPA512_LBSPPB256_LPA32_LPB8_LRVW8_MIWT2_2_PLR1_SU0_SUM0_SUS128_VWA2_VWB2_WGM4_WGMXCC1_WGMXCCGn1
    SolutionIndex: 86
    SolutionNameMin: Cijk_Ailk_Bljk_F8B8NBS_BH_Bias_HAS_SAV_UserArgs_MT64x64x128_MI16x16x1_SN_LDSB1_CLR1_GRVWA16_GRVWB16_GSU0_GSUC0_GSUWGMRR0_K1_LBSPPA512_LBSPPB256_LPA32_LPB16_LRVW8_MIWT2_2_PLR1_SU0_SUM0_SUS128_VWA2_VWB2_WGM4_WGMXCC1_WGMXCCGn1
    SolutionIndex: 87
    SolutionNameMin: Cijk_Ailk_Bljk_F8B8NBS_BH_Bias_HAS_SAV_UserArgs_MT64x64x128_MI16x16x1_SN_LDSB1_CLR1_GRVWA16_GRVWB8_GSU0_GSUC0_GSUWGMRR0_K1_LBSPPA512_LBSPPB256_LPA32_LPB8_LRVW8_MIWT2_2_PLR1_SU0_SUM0_SUS128_VWA2_VWB2_WGM6_WGMXCC1_WGMXCCGn1
    SolutionIndex: 88
    SolutionNameMin: Cijk_Ailk_Bljk_F8B8NBS_BH_Bias_HAS_SAV_UserArgs_MT64x64x128_MI16x16x1_SN_LDSB1_CLR1_GRVWA16_GRVWB16_GSU0_GSUC0_GSUWGMRR0_K1_LBSPPA512_LBSPPB256_LPA32_LPB16_LRVW8_MIWT2_2_PLR1_SU0_SUM0_SUS128_VWA2_VWB2_WGM6_WGMXCC1_WGMXCCGn1
    SolutionIndex: 89
    SolutionNameMin: Cijk_Ailk_Bljk_F8B8NBS_BH_Bias_HAS_SAV_UserArgs_MT32x64x128_MI16x16x1_SN_LDSB0_CLR1_GRVWA8_GRVWB16_GSU0_GSUC0_GSUWGMRR0_K1_LBSPPA256_LBSPPB256_LPA16_LPB16_LRVW8_MIWT1_2_PLR1_SU0_SUM0_SUS128_VWA1_VWB2_WGM1_WGMXCC1_WGMXCCGn1
    SolutionIndex: 90
    SolutionNameMin: Cijk_Ailk_Bljk_F8B8NBS_BH_Bias_HAS_SAV_UserArgs_MT32x64x128_MI16x16x1_SN_LDSB0_CLR1_GRVWA16_GRVWB16_GSU0_GSUC0_GSUWGMRR0_K1_LBSPPA256_LBSPPB256_LPA16_LPB16_LRVW8_MIWT1_2_PLR1_SU0_SUM0_SUS128_VWA1_VWB2_WGM6_WGMXCC1_WGMXCCGn1
    SolutionIndex: 91
    SolutionNameMin: Cijk_Ailk_Bljk_F8B8NBS_BH_Bias_HAS_SAV_UserArgs_MT32x64x128_MI16x16x1_SN_LDSB0_CLR1_GRVWA16_GRVWB16_GSU0_GSUC0_GSUWGMRR0_K1_LBSPPA256_LBSPPB256_LPA16_LPB16_LRVW8_MIWT1_2_PLR1_SU0_SUM0_SUS128_VWA1_VWB2_WGM8_WGMXCC1_WGMXCCGn1
    SolutionIndex: 92
    SolutionNameMin: Cijk_Ailk_Bljk_F8B8NBS_BH_Bias_HAS_SAV_UserArgs_MT64x32x128_MI16x16x1_SN_LDSB0_CLR1_GRVWA8_GRVWB16_GSU0_GSUC0_GSUWGMRR0_K1_LBSPPA512_LBSPPB128_LPA32_LPB16_LRVW8_MIWT2_1_PLR1_SU0_SUM0_SUS128_VWA2_VWB1_WGM1_WGMXCC1_WGMXCCGn1
    SolutionIndex: 93
    SolutionNameMin: Cijk_Ailk_Bljk_F8B8NBS_BH_Bias_HAS_SAV_UserArgs_MT64x32x128_MI16x16x1_SN_LDSB0_CLR1_GRVWA16_GRVWB16_GSU0_GSUC0_GSUWGMRR0_K1_LBSPPA512_LBSPPB128_LPA32_LPB16_LRVW8_MIWT2_1_PLR1_SU0_SUM0_SUS128_VWA2_VWB1_WGM1_WGMXCC1_WGMXCCGn1
    SolutionIndex: 94
    SolutionNameMin: Cijk_Ailk_Bljk_F8B8NBS_BH_Bias_HAS_SAV_UserArgs_MT64x32x128_MI16x16x1_SN_LDSB0_CLR1_GRVWA8_GRVWB16_GSU0_GSUC0_GSUWGMRR0_K1_LBSPPA512_LBSPPB128_LPA32_LPB16_LRVW8_MIWT2_1_PLR1_SU0_SUM0_SUS128_VWA2_VWB1_WGM8_WGMXCC1_WGMXCCGn1
    SolutionIndex: 95
    SolutionNameMin: Cijk_Ailk_Bljk_F8B8NBS_BH_Bias_HAS_SAV_UserArgs_MT32x32x128_MI16x16x1_SN_LDSB0_CLR1_GRVWA8_GRVWB8_GSU0_GSUC0_GSUWGMRR0_K1_LBSPPA256_LBSPPB128_LPA16_LPB8_LRVW8_MIWT1_1_PLR1_SU0_SUM0_SUS128_VWA1_VWB1_WGM1_WGMXCC1_WGMXCCGn1
    SolutionIndex: 96
    SolutionNameMin: Cijk_Ailk_Bljk_F8B8NBS_BH_Bias_HAS_SAV_UserArgs_MT32x32x128_MI16x16x1_SN_LDSB0_CLR1_GRVWA8_GRVWB16_GSU0_GSUC0_GSUWGMRR0_K1_LBSPPA256_LBSPPB128_LPA16_LPB16_LRVW8_MIWT1_1_PLR1_SU0_SUM0_SUS128_VWA1_VWB1_WGM1_WGMXCC1_WGMXCCGn1
    SolutionIndex: 97
    SolutionNameMin: Cijk_Ailk_Bljk_F8B8NBS_BH_Bias_HAS_SAV_UserArgs_MT32x32x128_MI16x16x1_SN_LDSB0_CLR1_GRVWA16_GRVWB16_GSU0_GSUC0_GSUWGMRR0_K1_LBSPPA256_LBSPPB128_LPA16_LPB16_LRVW8_MIWT1_1_PLR1_SU0_SUM0_SUS128_VWA1_VWB1_WGM1_WGMXCC1_WGMXCCGn1
    SolutionIndex: 98
    SolutionNameMin: Cijk_Ailk_Bljk_F8B8NBS_BH_Bias_HAS_SAV_UserArgs_MT32x32x128_MI16x16x1_SN_LDSB0_CLR1_GRVWA16_GRVWB16_GSU0_GSUC0_GSUWGMRR0_K1_LBSPPA256_LBSPPB128_LPA16_LPB16_LRVW8_MIWT1_1_PLR1_SU0_SUM0_SUS128_VWA1_VWB1_WGM6_WGMXCC1_WGMXCCGn1
    SolutionIndex: 99
    SolutionNameMin: Cijk_Ailk_Bljk_F8B8NBS_BH_Bias_HAS_SAV_UserArgs_MT64x128x256_MI16x16x1_SN_LDSB1_CLR1_GRVWA8_GRVWB16_GSU0_GSUC0_GSUWGMRR0_K1_LBSPPA512_LBSPPB1024_LPA32_LPB16_LRVW8_MIWT2_4_PLR1_SU0_SUM0_SUS256_VWA2_VWB4_WGM1_WGMXCC1_WGMXCCGn1
    SolutionIndex: 100
    SolutionNameMin: Cijk_Ailk_Bljk_F8B8NBS_BH_Bias_HAS_SAV_UserArgs_MT128x64x256_MI16x16x1_SN_LDSB1_CLR1_GRVWA16_GRVWB16_GSU0_GSUC0_GSUWGMRR0_K1_LBSPPA1024_LBSPPB512_LPA64_LPB16_LRVW8_MIWT4_2_PLR1_SU0_SUM0_SUS256_VWA4_VWB2_WGM1_WGMXCC1_WGMXCCGn1
    SolutionIndex: 101
    SolutionNameMin: Cijk_Ailk_Bljk_F8B8NBS_BH_Bias_HAS_SAV_UserArgs_MT64x64x256_MI16x16x1_SN_LDSB1_CLR1_GRVWA16_GRVWB16_GSU0_GSUC0_GSUWGMRR0_K1_LBSPPA512_LBSPPB512_LPA32_LPB16_LRVW8_MIWT2_2_PLR1_SU0_SUM0_SUS256_VWA2_VWB2_WGM1_WGMXCC1_WGMXCCGn1
    SolutionIndex: 102
    SolutionNameMin: Cijk_Ailk_Bljk_F8B8NBS_BH_Bias_HAS_SAV_UserArgs_MT64x32x256_MI16x16x1_SN_LDSB1_CLR1_GRVWA16_GRVWB16_GSU0_GSUC0_GSUWGMRR0_K1_LBSPPA512_LBSPPB256_LPA32_LPB16_LRVW8_MIWT2_1_PLR1_SU0_SUM0_SUS256_VWA2_VWB1_WGM1_WGMXCC1_WGMXCCGn1
    SolutionIndex: 103
    SolutionNameMin: Cijk_Ailk_Bljk_F8B8NBS_BH_Bias_HAS_SAV_UserArgs_MT64x32x256_MI16x16x1_SN_LDSB1_CLR1_GRVWA16_GRVWB16_GSU0_GSUC0_GSUWGMRR0_K1_LBSPPA512_LBSPPB256_LPA32_LPB16_LRVW8_MIWT2_1_PLR1_SU0_SUM0_SUS256_VWA2_VWB1_WGM6_WGMXCC1_WGMXCCGn1
    SolutionIndex: 104
    SolutionNameMin: Cijk_Ailk_Bljk_F8B8NBS_BH_Bias_HAS_SAV_UserArgs_MT32x32x256_MI16x16x1_SN_LDSB1_CLR1_GRVWA16_GRVWB8_GSU0_GSUC0_GSUWGMRR0_K1_LBSPPA256_LBSPPB256_LPA16_LPB8_LRVW8_MIWT1_1_PLR1_SU0_SUM0_SUS256_VWA1_VWB1_WGM1_WGMXCC1_WGMXCCGn1
    SolutionIndex: 105
    SolutionNameMin: Cijk_Ailk_Bljk_F8B8NBS_BH_Bias_HAS_SAV_UserArgs_MT32x32x256_MI16x16x1_SN_LDSB1_CLR1_GRVWA16_GRVWB16_GSU0_GSUC0_GSUWGMRR0_K1_LBSPPA256_LBSPPB256_LPA16_LPB16_LRVW8_MIWT1_1_PLR1_SU0_SUM0_SUS256_VWA1_VWB1_WGM4_WGMXCC1_WGMXCCGn1
    SolutionIndex: 106
    SolutionNameMin: Cijk_Ailk_Bljk_F8B8NBS_BH_Bias_HAS_SAV_UserArgs_MT32x32x256_MI16x16x1_SN_LDSB1_CLR1_GRVWA16_GRVWB16_GSU0_GSUC0_GSUWGMRR0_K1_LBSPPA256_LBSPPB256_LPA16_LPB16_LRVW8_MIWT1_1_PLR1_SU0_SUM0_SUS256_VWA1_VWB1_WGM8_WGMXCC1_WGMXCCGn1
- - - [128, 128, 1, 128, 128, 128, 128, 128]
    - [96, 0.55]
  - - [128, 128, 1, 256, 128, 128, 128, 256]
    - [96, 1.01]
  - - [128, 128, 1, 512, 128, 128, 128, 512]
    - [96, 1.74]
  - - [128, 128, 1, 1024, 128, 128, 128, 1024]
    - [96, 2.73]
  - - [128, 128, 1, 2048, 128, 128, 128, 2048]
    - [95, 3.83]
  - - [128, 128, 1, 4096, 128, 128, 128, 4096]
    - [97, 4.69]
  - - [128, 128, 1, 8192, 128, 128, 128, 8192]
    - [97, 5.4]
  - - [128, 256, 1, 128, 128, 128, 128, 128]
    - [46, 1.04]
  - - [128, 256, 1, 256, 128, 128, 128, 256]
    - [46, 1.2]
  - - [128, 256, 1, 512, 128, 128, 128, 512]
    - [37, 2.36]
  - - [128, 256, 1, 1024, 128, 128, 128, 1024]
    - [45, 4.16]
  - - [128, 256, 1, 2048, 128, 128, 128, 2048]
    - [98, 7.36]
  - - [128, 256, 1, 4096, 128, 128, 128, 4096]
    - [95, 9.42]
  - - [128, 256, 1, 8192, 128, 128, 128, 8192]
    - [104, 10.81]
  - - [128, 512, 1, 128, 128, 128, 128, 128]
    - [23, 1.3]
  - - [128, 512, 1, 256, 128, 128, 128, 256]
    - [36, 2.6]
  - - [128, 512, 1, 512, 128, 128, 128, 512]
    - [48, 5.1]
  - - [128, 512, 1, 1024, 128, 128, 128, 1024]
    - [48, 9.42]
  - - [128, 512, 1, 2048, 128, 128, 128, 2048]
    - [96, 14.64]
  - - [128, 512, 1, 4096, 128, 128, 128, 4096]
    - [95, 18.68]
  - - [128, 512, 1, 8192, 128, 128, 128, 8192]
    - [104, 21.71]
  - - [128, 1024, 1, 128, 128, 128, 128, 128]
    - [42, 2.57]
  - - [128, 1024, 1, 256, 128, 128, 128, 256]
    - [26, 5.3]
  - - [128, 1024, 1, 512, 128, 128, 128, 512]
    - [44, 10.55]
  - - [128, 1024, 1, 1024, 128, 128, 128, 1024]
    - [93, 18.94]
  - - [128, 1024, 1, 2048, 128, 128, 128, 2048]
    - [95, 30.19]
  - - [128, 1024, 1, 4096, 128, 128, 128, 4096]
    - [95, 37.17]
  - - [128, 1024, 1, 8192, 128, 128, 128, 8192]
    - [95, 42.93]
  - - [128, 2048, 1, 128, 128, 128, 128, 128]
    - [76, 5.84]
  - - [128, 2048, 1, 256, 128, 128, 128, 256]
    - [33, 10.94]
  - - [128, 2048, 1, 512, 128, 128, 128, 512]
    - [40, 20.92]
  - - [128, 2048, 1, 1024, 128, 128, 128, 1024]
    - [92, 36.76]
  - - [128, 2048, 1, 2048, 128, 128, 128, 2048]
    - [102, 51.1]
  - - [128, 2048, 1, 4096, 128, 128, 128, 4096]
    - [102, 63.52]
  - - [128, 2048, 1, 8192, 128, 128, 128, 8192]
    - [102, 71.72]
  - - [128, 4096, 1, 128, 128, 128, 128, 128]
    - [25, 10.01]
  - - [128, 4096, 1, 256, 128, 128, 128, 256]
    - [99, 21.08]
  - - [128, 4096, 1, 512, 128, 128, 128, 512]
    - [43, 40.08]
  - - [128, 4096, 1, 1024, 128, 128, 128, 1024]
    - [82, 62.21]
  - - [128, 4096, 1, 2048, 128, 128, 128, 2048]
    - [82, 83.65]
  - - [128, 4096, 1, 4096, 128, 128, 128, 4096]
    - [101, 101.49]
  - - [128, 4096, 1, 8192, 128, 128, 128, 8192]
    - [101, 111.89]
  - - [128, 8192, 1, 128, 128, 128, 128, 128]
    - [67, 19.92]
  - - [128, 8192, 1, 256, 128, 128, 128, 256]
    - [29, 42.4]
  - - [128, 8192, 1, 512, 128, 128, 128, 512]
    - [30, 68.73]
  - - [128, 8192, 1, 1024, 128, 128, 128, 1024]
    - [28, 100.55]
  - - [128, 8192, 1, 2048, 128, 128, 128, 2048]
    - [28, 131.6]
  - - [128, 8192, 1, 4096, 128, 128, 128, 4096]
    - [77, 140.83]
  - - [128, 8192, 1, 8192, 128, 128, 128, 8192]
    - [101, 153.47]
  - - [256, 128, 1, 128, 256, 256, 256, 128]
    - [96, 1.11]
  - - [256, 128, 1, 256, 256, 256, 256, 256]
    - [96, 1.93]
  - - [256, 128, 1, 512, 256, 256, 256, 512]
    - [96, 3.39]
  - - [256, 128, 1, 1024, 256, 256, 256, 1024]
    - [95, 5.38]
  - - [256, 128, 1, 2048, 256, 256, 256, 2048]
    - [95, 7.56]
  - - [256, 128, 1, 4096, 256, 256, 256, 4096]
    - [95, 9.47]
  - - [256, 128, 1, 8192, 256, 256, 256, 8192]
    - [97, 10.85]
  - - [256, 256, 1, 128, 256, 256, 256, 128]
    - [95, 2.1]
  - - [256, 256, 1, 256, 256, 256, 256, 256]
    - [96, 3.81]
  - - [256, 256, 1, 512, 256, 256, 256, 512]
    - [96, 6.73]
  - - [256, 256, 1, 1024, 256, 256, 256, 1024]
    - [96, 10.51]
  - - [256, 256, 1, 2048, 256, 256, 256, 2048]
    - [95, 14.71]
  - - [256, 256, 1, 4096, 256, 256, 256, 4096]
    - [95, 18.83]
  - - [256, 256, 1, 8192, 256, 256, 256, 8192]
    - [97, 21.56]
  - - [256, 512, 1, 128, 256, 256, 256, 128]
    - [96, 4.16]
  - - [256, 512, 1, 256, 256, 256, 256, 256]
    - [96, 7.96]
  - - [256, 512, 1, 512, 256, 256, 256, 512]
    - [96, 13.86]
  - - [256, 512, 1, 1024, 256, 256, 256, 1024]
    - [95, 21.65]
  - - [256, 512, 1, 2048, 256, 256, 256, 2048]
    - [95, 30.13]
  - - [256, 512, 1, 4096, 256, 256, 256, 4096]
    - [95, 36.97]
  - - [256, 512, 1, 8192, 256, 256, 256, 8192]
    - [95, 42.54]
  - - [256, 1024, 1, 128, 256, 256, 256, 128]
    - [93, 7.77]
  - - [256, 1024, 1, 256, 256, 256, 256, 256]
    - [92, 14.54]
  - - [256, 1024, 1, 512, 256, 256, 256, 512]
    - [89, 24.51]
  - - [256, 1024, 1, 1024, 256, 256, 256, 1024]
    - [92, 37.49]
  - - [256, 1024, 1, 2048, 256, 256, 256, 2048]
    - [102, 51.62]
  - - [256, 1024, 1, 4096, 256, 256, 256, 4096]
    - [102, 62.9]
  - - [256, 1024, 1, 8192, 256, 256, 256, 8192]
    - [102, 71.89]
  - - [256, 2048, 1, 128, 256, 256, 256, 128]
    - [41, 13.93]
  - - [256, 2048, 1, 256, 256, 256, 256, 256]
    - [39, 25.18]
  - - [256, 2048, 1, 512, 256, 256, 256, 512]
    - [82, 41.72]
  - - [256, 2048, 1, 1024, 256, 256, 256, 1024]
    - [82, 62.99]
  - - [256, 2048, 1, 2048, 256, 256, 256, 2048]
    - [101, 83.77]
  - - [256, 2048, 1, 4096, 256, 256, 256, 4096]
    - [101, 101.31]
  - - [256, 2048, 1, 8192, 256, 256, 256, 8192]
    - [85, 109.93]
  - - [256, 4096, 1, 128, 256, 256, 256, 128]
    - [34, 24.31]
  - - [256, 4096, 1, 256, 256, 256, 256, 256]
    - [34, 42.23]
  - - [256, 4096, 1, 512, 256, 256, 256, 512]
    - [30, 68.37]
  - - [256, 4096, 1, 1024, 256, 256, 256, 1024]
    - [28, 100.08]
  - - [256, 4096, 1, 2048, 256, 256, 256, 2048]
    - [28, 130.42]
  - - [256, 4096, 1, 4096, 256, 256, 256, 4096]
    - [75, 145.25]
  - - [256, 4096, 1, 8192, 256, 256, 256, 8192]
    - [75, 154.05]
  - - [256, 8192, 1, 128, 256, 256, 256, 128]
    - [21, 36.54]
  - - [256, 8192, 1, 256, 256, 256, 256, 256]
    - [21, 62.96]
  - - [256, 8192, 1, 512, 256, 256, 256, 512]
    - [71, 101.98]
  - - [256, 8192, 1, 1024, 256, 256, 256, 1024]
    - [71, 149.9]
  - - [256, 8192, 1, 2048, 256, 256, 256, 2048]
    - [71, 190.85]
  - - [256, 8192, 1, 4096, 256, 256, 256, 4096]
    - [71, 218.62]
  - - [256, 8192, 1, 8192, 256, 256, 256, 8192]
    - [71, 209.35]
  - - [512, 128, 1, 128, 512, 512, 512, 128]
    - [47, 2.09]
  - - [512, 128, 1, 256, 512, 512, 512, 256]
    - [46, 3.88]
  - - [512, 128, 1, 512, 512, 512, 512, 512]
    - [95, 6.86]
  - - [512, 128, 1, 1024, 512, 512, 512, 1024]
    - [96, 10.84]
  - - [512, 128, 1, 2048, 512, 512, 512, 2048]
    - [95, 15.09]
  - - [512, 128, 1, 4096, 512, 512, 512, 4096]
    - [95, 18.96]
  - - [512, 128, 1, 8192, 512, 512, 512, 8192]
    - [105, 18.05]
  - - [512, 256, 1, 128, 512, 512, 512, 128]
    - [46, 4.11]
  - - [512, 256, 1, 256, 512, 512, 512, 256]
    - [96, 7.82]
  - - [512, 256, 1, 512, 512, 512, 512, 512]
    - [95, 13.47]
  - - [512, 256, 1, 1024, 512, 512, 512, 1024]
    - [95, 21.44]
  - - [512, 256, 1, 2048, 512, 512, 512, 2048]
    - [96, 29.79]
  - - [512, 256, 1, 4096, 512, 512, 512, 4096]
    - [95, 37.43]
  - - [512, 256, 1, 8192, 512, 512, 512, 8192]
    - [105, 36.28]
  - - [512, 512, 1, 128, 512, 512, 512, 128]
    - [44, 8.01]
  - - [512, 512, 1, 256, 512, 512, 512, 256]
    - [93, 14.31]
  - - [512, 512, 1, 512, 512, 512, 512, 512]
    - [92, 24.26]
  - - [512, 512, 1, 1024, 512, 512, 512, 1024]
    - [92, 37.12]
  - - [512, 512, 1, 2048, 512, 512, 512, 2048]
    - [102, 51.25]
  - - [512, 512, 1, 4096, 512, 512, 512, 4096]
    - [102, 63.41]
  - - [512, 512, 1, 8192, 512, 512, 512, 8192]
    - [93, 62.24]
  - - [512, 1024, 1, 128, 512, 512, 512, 128]
    - [39, 14.46]
  - - [512, 1024, 1, 256, 512, 512, 512, 256]
    - [39, 25.41]
  - - [512, 1024, 1, 512, 512, 512, 512, 512]
    - [83, 41.45]
  - - [512, 1024, 1, 1024, 512, 512, 512, 1024]
    - [82, 61.87]
  - - [512, 1024, 1, 2048, 512, 512, 512, 2048]
    - [82, 82.67]
  - - [512, 1024, 1, 4096, 512, 512, 512, 4096]
    - [82, 99.3]
  - - [512, 1024, 1, 8192, 512, 512, 512, 8192]
    - [84, 103.88]
  - - [512, 2048, 1, 128, 512, 512, 512, 128]
    - [30, 23.74]
  - - [512, 2048, 1, 256, 512, 512, 512, 256]
    - [29, 42.2]
  - - [512, 2048, 1, 512, 512, 512, 512, 512]
    - [29, 68.69]
  - - [512, 2048, 1, 1024, 512, 512, 512, 1024]
    - [28, 100.64]
  - - [512, 2048, 1, 2048, 512, 512, 512, 2048]
    - [28, 130.82]
  - - [512, 2048, 1, 4096, 512, 512, 512, 4096]
    - [100, 140.57]
  - - [512, 2048, 1, 8192, 512, 512, 512, 8192]
    - [80, 146.99]
  - - [512, 4096, 1, 128, 512, 512, 512, 128]
    - [21, 36.67]
  - - [512, 4096, 1, 256, 512, 512, 512, 256]
    - [64, 63.05]
  - - [512, 4096, 1, 512, 512, 512, 512, 512]
    - [64, 101.97]
  - - [512, 4096, 1, 1024, 512, 512, 512, 1024]
    - [71, 149.05]
  - - [512, 4096, 1, 2048, 512, 512, 512, 2048]
    - [71, 194.3]
  - - [512, 4096, 1, 4096, 512, 512, 512, 4096]
    - [71, 205.68]
  - - [512, 4096, 1, 8192, 512, 512, 512, 8192]
    - [71, 199.64]
  - - [512, 8192, 1, 128, 512, 512, 512, 128]
    - [68, 55.59]
  - - [512, 8192, 1, 256, 512, 512, 512, 256]
    - [69, 97.65]
  - - [512, 8192, 1, 512, 512, 512, 512, 512]
    - [69, 159.02]
  - - [512, 8192, 1, 1024, 512, 512, 512, 1024]
    - [69, 210.73]
  - - [512, 8192, 1, 2048, 512, 512, 512, 2048]
    - [60, 234.16]
  - - [512, 8192, 1, 4096, 512, 512, 512, 4096]
    - [69, 262.97]
  - - [512, 8192, 1, 8192, 512, 512, 512, 8192]
    - [70, 250.9]
  - - [1024, 128, 1, 128, 1024, 1024, 1024, 128]
    - [46, 4.23]
  - - [1024, 128, 1, 256, 1024, 1024, 1024, 256]
    - [46, 7.67]
  - - [1024, 128, 1, 512, 1024, 1024, 1024, 512]
    - [95, 13.47]
  - - [1024, 128, 1, 1024, 1024, 1024, 1024, 1024]
    - [96, 21.1]
  - - [1024, 128, 1, 2048, 1024, 1024, 1024, 2048]
    - [95, 29.73]
  - - [1024, 128, 1, 4096, 1024, 1024, 1024, 4096]
    - [106, 31.7]
  - - [1024, 128, 1, 8192, 1024, 1024, 1024, 8192]
    - [105, 30.47]
  - - [1024, 256, 1, 128, 1024, 1024, 1024, 128]
    - [89, 7.76]
  - - [1024, 256, 1, 256, 1024, 1024, 1024, 256]
    - [44, 14.04]
  - - [1024, 256, 1, 512, 1024, 1024, 1024, 512]
    - [92, 24.17]
  - - [1024, 256, 1, 1024, 1024, 1024, 1024, 1024]
    - [89, 36.71]
  - - [1024, 256, 1, 2048, 1024, 1024, 1024, 2048]
    - [102, 50.37]
  - - [1024, 256, 1, 4096, 1024, 1024, 1024, 4096]
    - [90, 55.04]
  - - [1024, 256, 1, 8192, 1024, 1024, 1024, 8192]
    - [94, 58.77]
  - - [1024, 512, 1, 128, 1024, 1024, 1024, 128]
    - [41, 14.1]
  - - [1024, 512, 1, 256, 1024, 1024, 1024, 256]
    - [39, 25.37]
  - - [1024, 512, 1, 512, 1024, 1024, 1024, 512]
    - [83, 41.62]
  - - [1024, 512, 1, 1024, 1024, 1024, 1024, 1024]
    - [82, 61.59]
  - - [1024, 512, 1, 2048, 1024, 1024, 1024, 2048]
    - [82, 82.72]
  - - [1024, 512, 1, 4096, 1024, 1024, 1024, 4096]
    - [86, 93.69]
  - - [1024, 512, 1, 8192, 1024, 1024, 1024, 8192]
    - [84, 101.86]
  - - [1024, 1024, 1, 128, 1024, 1024, 1024, 128]
    - [29, 24.03]
  - - [1024, 1024, 1, 256, 1024, 1024, 1024, 256]
    - [29, 42.5]
  - - [1024, 1024, 1, 512, 1024, 1024, 1024, 512]
    - [28, 69.17]
  - - [1024, 1024, 1, 1024, 1024, 1024, 1024, 1024]
    - [28, 100.67]
  - - [1024, 1024, 1, 2048, 1024, 1024, 1024, 2048]
    - [28, 131.06]
  - - [1024, 1024, 1, 4096, 1024, 1024, 1024, 4096]
    - [80, 138.83]
  - - [1024, 1024, 1, 8192, 1024, 1024, 1024, 8192]
    - [79, 146.02]
  - - [1024, 2048, 1, 128, 1024, 1024, 1024, 128]
    - [21, 36.92]
  - - [1024, 2048, 1, 256, 1024, 1024, 1024, 256]
    - [21, 63.4]
  - - [1024, 2048, 1, 512, 1024, 1024, 1024, 512]
    - [71, 103.1]
  - - [1024, 2048, 1, 1024, 1024, 1024, 1024, 1024]
    - [71, 149.74]
  - - [1024, 2048, 1, 2048, 1024, 1024, 1024, 2048]
    - [71, 188.15]
  - - [1024, 2048, 1, 4096, 1024, 1024, 1024, 4096]
    - [73, 204.07]
  - - [1024, 2048, 1, 8192, 1024, 1024, 1024, 8192]
    - [74, 195.74]
  - - [1024, 4096, 1, 128, 1024, 1024, 1024, 128]
    - [19, 52.94]
  - - [1024, 4096, 1, 256, 1024, 1024, 1024, 256]
    - [20, 90.82]
  - - [1024, 4096, 1, 512, 1024, 1024, 1024, 512]
    - [17, 139.1]
  - - [1024, 4096, 1, 1024, 1024, 1024, 1024, 1024]
    - [12, 193.11]
  - - [1024, 4096, 1, 2048, 1024, 1024, 1024, 2048]
    - [60, 236.08]
  - - [1024, 4096, 1, 4096, 1024, 1024, 1024, 4096]
    - [55, 255.34]
  - - [1024, 4096, 1, 8192, 1024, 1024, 1024, 8192]
    - [49, 241.78]
  - - [1024, 8192, 1, 128, 1024, 1024, 1024, 128]
    - [59, 71.01]
  - - [1024, 8192, 1, 256, 1024, 1024, 1024, 256]
    - [55, 124.34]
  - - [1024, 8192, 1, 512, 1024, 1024, 1024, 512]
    - [55, 196.32]
  - - [1024, 8192, 1, 1024, 1024, 1024, 1024, 1024]
    - [56, 237.52]
  - - [1024, 8192, 1, 2048, 1024, 1024, 1024, 2048]
    - [57, 298.73]
  - - [1024, 8192, 1, 4096, 1024, 1024, 1024, 4096]
    - [59, 343.78]
  - - [1024, 8192, 1, 8192, 1024, 1024, 1024, 8192]
    - [57, 361.4]
  - - [2048, 128, 1, 128, 2048, 2048, 2048, 128]
    - [44, 8.04]
  - - [2048, 128, 1, 256, 2048, 2048, 2048, 256]
    - [44, 14.25]
  - - [2048, 128, 1, 512, 2048, 2048, 2048, 512]
    - [92, 24.32]
  - - [2048, 128, 1, 1024, 2048, 2048, 2048, 1024]
    - [93, 36.95]
  - - [2048, 128, 1, 2048, 2048, 2048, 2048, 2048]
    - [91, 43.08]
  - - [2048, 128, 1, 4096, 2048, 2048, 2048, 4096]
    - [103, 52.28]
  - - [2048, 128, 1, 8192, 2048, 2048, 2048, 8192]
    - [103, 58.99]
  - - [2048, 256, 1, 128, 2048, 2048, 2048, 128]
    - [38, 13.98]
  - - [2048, 256, 1, 256, 2048, 2048, 2048, 256]
    - [41, 24.99]
  - - [2048, 256, 1, 512, 2048, 2048, 2048, 512]
    - [83, 40.81]
  - - [2048, 256, 1, 1024, 2048, 2048, 2048, 1024]
    - [87, 60.56]
  - - [2048, 256, 1, 2048, 2048, 2048, 2048, 2048]
    - [86, 77.05]
  - - [2048, 256, 1, 4096, 2048, 2048, 2048, 4096]
    - [86, 92.61]
  - - [2048, 256, 1, 8192, 2048, 2048, 2048, 8192]
    - [88, 103.44]
  - - [2048, 512, 1, 128, 2048, 2048, 2048, 128]
    - [29, 24.11]
  - - [2048, 512, 1, 256, 2048, 2048, 2048, 256]
    - [27, 42.86]
  - - [2048, 512, 1, 512, 2048, 2048, 2048, 512]
    - [29, 68.6]
  - - [2048, 512, 1, 1024, 2048, 2048, 2048, 1024]
    - [28, 100.06]
  - - [2048, 512, 1, 2048, 2048, 2048, 2048, 2048]
    - [81, 118.55]
  - - [2048, 512, 1, 4096, 2048, 2048, 2048, 4096]
    - [80, 138.68]
  - - [2048, 512, 1, 8192, 2048, 2048, 2048, 8192]
    - [80, 145.6]
  - - [2048, 1024, 1, 128, 2048, 2048, 2048, 128]
    - [21, 36.9]
  - - [2048, 1024, 1, 256, 2048, 2048, 2048, 256]
    - [64, 63.48]
  - - [2048, 1024, 1, 512, 2048, 2048, 2048, 512]
    - [71, 102.21]
  - - [2048, 1024, 1, 1024, 2048, 2048, 2048, 1024]
    - [71, 149.94]
  - - [2048, 1024, 1, 2048, 2048, 2048, 2048, 2048]
    - [74, 175.36]
  - - [2048, 1024, 1, 4096, 2048, 2048, 2048, 4096]
    - [65, 199.45]
  - - [2048, 1024, 1, 8192, 2048, 2048, 2048, 8192]
    - [73, 198.97]
  - - [2048, 2048, 1, 128, 2048, 2048, 2048, 128]
    - [11, 51.09]
  - - [2048, 2048, 1, 256, 2048, 2048, 2048, 256]
    - [11, 88.34]
  - - [2048, 2048, 1, 512, 2048, 2048, 2048, 512]
    - [11, 139.28]
  - - [2048, 2048, 1, 1024, 2048, 2048, 2048, 1024]
    - [11, 192.21]
  - - [2048, 2048, 1, 2048, 2048, 2048, 2048, 2048]
    - [18, 237.41]
  - - [2048, 2048, 1, 4096, 2048, 2048, 2048, 4096]
    - [61, 253.32]
  - - [2048, 2048, 1, 8192, 2048, 2048, 2048, 8192]
    - [58, 239.13]
  - - [2048, 4096, 1, 128, 2048, 2048, 2048, 128]
    - [1, 58.71]
  - - [2048, 4096, 1, 256, 2048, 2048, 2048, 256]
    - [2, 101.84]
  - - [2048, 4096, 1, 512, 2048, 2048, 2048, 512]
    - [3, 161.4]
  - - [2048, 4096, 1, 1024, 2048, 2048, 2048, 1024]
    - [9, 221.54]
  - - [2048, 4096, 1, 2048, 2048, 2048, 2048, 2048]
    - [0, 261.17]
  - - [2048, 4096, 1, 4096, 2048, 2048, 2048, 4096]
    - [57, 280.7]
  - - [2048, 4096, 1, 8192, 2048, 2048, 2048, 8192]
    - [58, 308.96]
  - - [2048, 8192, 1, 128, 2048, 2048, 2048, 128]
    - [58, 71.99]
  - - [2048, 8192, 1, 256, 2048, 2048, 2048, 256]
    - [58, 125.27]
  - - [2048, 8192, 1, 512, 2048, 2048, 2048, 512]
    - [56, 189.33]
  - - [2048, 8192, 1, 1024, 2048, 2048, 2048, 1024]
    - [55, 261.59]
  - - [2048, 8192, 1, 2048, 2048, 2048, 2048, 2048]
    - [55, 321.84]
  - - [2048, 8192, 1, 4096, 2048, 2048, 2048, 4096]
    - [57, 335.81]
  - - [2048, 8192, 1, 8192, 2048, 2048, 2048, 8192]
    - [59, 379.09]
  - - [4096, 128, 1, 128, 4096, 4096, 4096, 128]
    - [41, 14.34]
  - - [4096, 128, 1, 256, 4096, 4096, 4096, 256]
    - [39, 25.33]
  - - [4096, 128, 1, 512, 4096, 4096, 4096, 512]
    - [83, 41.51]
  - - [4096, 128, 1, 1024, 4096, 4096, 4096, 1024]
    - [83, 61.6]
  - - [4096, 128, 1, 2048, 4096, 4096, 4096, 2048]
    - [86, 76.03]
  - - [4096, 128, 1, 4096, 4096, 4096, 4096, 4096]
    - [86, 92.73]
  - - [4096, 128, 1, 8192, 4096, 4096, 4096, 8192]
    - [86, 104.03]
  - - [4096, 256, 1, 128, 4096, 4096, 4096, 128]
    - [24, 24.21]
  - - [4096, 256, 1, 256, 4096, 4096, 4096, 256]
    - [29, 41.92]
  - - [4096, 256, 1, 512, 4096, 4096, 4096, 512]
    - [28, 68.55]
  - - [4096, 256, 1, 1024, 4096, 4096, 4096, 1024]
    - [31, 97.79]
  - - [4096, 256, 1, 2048, 4096, 4096, 4096, 2048]
    - [81, 117.9]
  - - [4096, 256, 1, 4096, 4096, 4096, 4096, 4096]
    - [80, 139.11]
  - - [4096, 256, 1, 8192, 4096, 4096, 4096, 8192]
    - [32, 145.19]
  - - [4096, 512, 1, 128, 4096, 4096, 4096, 128]
    - [21, 37.09]
  - - [4096, 512, 1, 256, 4096, 4096, 4096, 256]
    - [22, 63.35]
  - - [4096, 512, 1, 512, 4096, 4096, 4096, 512]
    - [74, 100.6]
  - - [4096, 512, 1, 1024, 4096, 4096, 4096, 1024]
    - [74, 143.47]
  - - [4096, 512, 1, 2048, 4096, 4096, 4096, 2048]
    - [73, 174.27]
  - - [4096, 512, 1, 4096, 4096, 4096, 4096, 4096]
    - [65, 201.66]
  - - [4096, 512, 1, 8192, 4096, 4096, 4096, 8192]
    - [73, 200.49]
  - - [4096, 1024, 1, 128, 4096, 4096, 4096, 128]
    - [19, 52.66]
  - - [4096, 1024, 1, 256, 4096, 4096, 4096, 256]
    - [20, 90.53]
  - - [4096, 1024, 1, 512, 4096, 4096, 4096, 512]
    - [19, 140.63]
  - - [4096, 1024, 1, 1024, 4096, 4096, 4096, 1024]
    - [20, 195.07]
  - - [4096, 1024, 1, 2048, 4096, 4096, 4096, 2048]
    - [62, 237.45]
  - - [4096, 1024, 1, 4096, 4096, 4096, 4096, 4096]
    - [61, 251.88]
  - - [4096, 1024, 1, 8192, 4096, 4096, 4096, 8192]
    - [51, 239.19]
  - - [4096, 2048, 1, 128, 4096, 4096, 4096, 128]
    - [1, 58.03]
  - - [4096, 2048, 1, 256, 4096, 4096, 4096, 256]
    - [9, 99.84]
  - - [4096, 2048, 1, 512, 4096, 4096, 4096, 512]
    - [9, 156.0]
  - - [4096, 2048, 1, 1024, 4096, 4096, 4096, 1024]
    - [9, 221.04]
  - - [4096, 2048, 1, 2048, 4096, 4096, 4096, 2048]
    - [6, 261.84]
  - - [4096, 2048, 1, 4096, 4096, 4096, 4096, 4096]
    - [49, 258.84]
  - - [4096, 2048, 1, 8192, 4096, 4096, 4096, 8192]
    - [49, 285.02]
  - - [4096, 4096, 1, 128, 4096, 4096, 4096, 128]
    - [3, 65.09]
  - - [4096, 4096, 1, 256, 4096, 4096, 4096, 256]
    - [1, 110.98]
  - - [4096, 4096, 1, 512, 4096, 4096, 4096, 512]
    - [9, 169.43]
  - - [4096, 4096, 1, 1024, 4096, 4096, 4096, 1024]
    - [8, 216.52]
  - - [4096, 4096, 1, 2048, 4096, 4096, 4096, 2048]
    - [58, 249.91]
  - - [4096, 4096, 1, 4096, 4096, 4096, 4096, 4096]
    - [58, 282.62]
  - - [4096, 4096, 1, 8192, 4096, 4096, 4096, 8192]
    - [3, 322.24]
  - - [4096, 8192, 1, 128, 4096, 4096, 4096, 128]
    - [54, 77.96]
  - - [4096, 8192, 1, 256, 4096, 4096, 4096, 256]
    - [55, 132.11]
  - - [4096, 8192, 1, 512, 4096, 4096, 4096, 512]
    - [58, 200.07]
  - - [4096, 8192, 1, 1024, 4096, 4096, 4096, 1024]
    - [59, 250.08]
  - - [4096, 8192, 1, 2048, 4096, 4096, 4096, 2048]
    - [58, 300.15]
  - - [4096, 8192, 1, 4096, 4096, 4096, 4096, 4096]
    - [59, 352.67]
  - - [4096, 8192, 1, 8192, 4096, 4096, 4096, 8192]
    - [59, 398.37]
  - - [8192, 128, 1, 128, 8192, 8192, 8192, 128]
    - [24, 23.82]
  - - [8192, 128, 1, 256, 8192, 8192, 8192, 256]
    - [34, 41.84]
  - - [8192, 128, 1, 512, 8192, 8192, 8192, 512]
    - [35, 65.82]
  - - [8192, 128, 1, 1024, 8192, 8192, 8192, 1024]
    - [28, 96.52]
  - - [8192, 128, 1, 2048, 8192, 8192, 8192, 2048]
    - [78, 115.46]
  - - [8192, 128, 1, 4096, 8192, 8192, 8192, 4096]
    - [79, 137.33]
  - - [8192, 128, 1, 8192, 8192, 8192, 8192, 8192]
    - [79, 141.15]
  - - [8192, 256, 1, 128, 8192, 8192, 8192, 128]
    - [63, 35.59]
  - - [8192, 256, 1, 256, 8192, 8192, 8192, 256]
    - [66, 62.32]
  - - [8192, 256, 1, 512, 8192, 8192, 8192, 512]
    - [73, 100.92]
  - - [8192, 256, 1, 1024, 8192, 8192, 8192, 1024]
    - [72, 143.93]
  - - [8192, 256, 1, 2048, 8192, 8192, 8192, 2048]
    - [73, 174.84]
  - - [8192, 256, 1, 4096, 8192, 8192, 8192, 4096]
    - [73, 203.22]
  - - [8192, 256, 1, 8192, 8192, 8192, 8192, 8192]
    - [72, 195.93]
  - - [8192, 512, 1, 128, 8192, 8192, 8192, 128]
    - [13, 50.86]
  - - [8192, 512, 1, 256, 8192, 8192, 8192, 256]
    - [14, 87.35]
  - - [8192, 512, 1, 512, 8192, 8192, 8192, 512]
    - [16, 137.32]
  - - [8192, 512, 1, 1024, 8192, 8192, 8192, 1024]
    - [15, 190.46]
  - - [8192, 512, 1, 2048, 8192, 8192, 8192, 2048]
    - [16, 235.36]
  - - [8192, 512, 1, 4096, 8192, 8192, 8192, 4096]
    - [53, 254.24]
  - - [8192, 512, 1, 8192, 8192, 8192, 8192, 8192]
    - [53, 240.35]
  - - [8192, 1024, 1, 128, 8192, 8192, 8192, 128]
    - [3, 55.79]
  - - [8192, 1024, 1, 256, 8192, 8192, 8192, 256]
    - [3, 96.47]
  - - [8192, 1024, 1, 512, 8192, 8192, 8192, 512]
    - [3, 152.59]
  - - [8192, 1024, 1, 1024, 8192, 8192, 8192, 1024]
    - [5, 214.91]
  - - [8192, 1024, 1, 2048, 8192, 8192, 8192, 2048]
    - [7, 255.53]
  - - [8192, 1024, 1, 4096, 8192, 8192, 8192, 4096]
    - [50, 267.99]
  - - [8192, 1024, 1, 8192, 8192, 8192, 8192, 8192]
    - [50, 297.29]
  - - [8192, 2048, 1, 128, 8192, 8192, 8192, 128]
    - [14, 61.97]
  - - [8192, 2048, 1, 256, 8192, 8192, 8192, 256]
    - [3, 109.94]
  - - [8192, 2048, 1, 512, 8192, 8192, 8192, 512]
    - [3, 166.2]
  - - [8192, 2048, 1, 1024, 8192, 8192, 8192, 1024]
    - [4, 211.3]
  - - [8192, 2048, 1, 2048, 8192, 8192, 8192, 2048]
    - [20, 232.7]
  - - [8192, 2048, 1, 4096, 8192, 8192, 8192, 4096]
    - [7, 279.63]
  - - [8192, 2048, 1, 8192, 8192, 8192, 8192, 8192]
    - [3, 338.1]
  - - [8192, 4096, 1, 128, 8192, 8192, 8192, 128]
    - [3, 68.24]
  - - [8192, 4096, 1, 256, 8192, 8192, 8192, 256]
    - [3, 113.76]
  - - [8192, 4096, 1, 512, 8192, 8192, 8192, 512]
    - [10, 169.63]
  - - [8192, 4096, 1, 1024, 8192, 8192, 8192, 1024]
    - [52, 217.67]
  - - [8192, 4096, 1, 2048, 8192, 8192, 8192, 2048]
    - [58, 269.77]
  - - [8192, 4096, 1, 4096, 8192, 8192, 8192, 4096]
    - [58, 316.49]
  - - [8192, 4096, 1, 8192, 8192, 8192, 8192, 8192]
    - [3, 346.51]
  - - [8192, 8192, 1, 128, 8192, 8192, 8192, 128]
    - [55, 68.64]
  - - [8192, 8192, 1, 256, 8192, 8192, 8192, 256]
    - [58, 113.07]
  - - [8192, 8192, 1, 512, 8192, 8192, 8192, 512]
    - [58, 170.78]
  - - [8192, 8192, 1, 1024, 8192, 8192, 8192, 1024]
    - [58, 243.4]
  - - [8192, 8192, 1, 2048, 8192, 8192, 8192, 2048]
    - [58, 319.97]
  - - [8192, 8192, 1, 4096, 8192, 8192, 8192, 4096]
    - [59, 363.9]
  - - [8192, 8192, 1, 8192, 8192, 8192, 8192, 8192]
    - [58, 399.58]
- null
- null
- ExperimentalStreamK
- GridBased
