projects/hipblaslt/library/src/amd_detail/rocblaslt/src/Tensile/Logic/asm_full/aquavanjaram/gfx942_228cu/StreamK/aquavanjaram942_Cijk_Ailk_Bjlk_B8NBS_BH_Bias_HAS_SAV_UserArgs.yaml
- {MinimumRequiredVersion: 4.33.0}
- aquavanjaram942
- {Architecture: gfx942, CUCount: 228}
- [Device 0049, Device 0050]
    SolutionIndex: 0
    SolutionNameMin: Cijk_Ailk_Bjlk_B8NBS_BH_Bias_HAS_SAV_UserArgs_MT256x256x64_MI16x16x1_SN_LDSB0_CLR1_GRVWA4_GRVWB4_GSU0_GSUC0_GSUWGMRR0_K1_LBSPPA2048_LBSPPB2048_LPA0_LPB0_MIWT8_8_PLR1_SU0_SUM0_SUS64_VWA8_VWB8_WGM1_WGMXCC1_WGMXCCGn1
    SolutionIndex: 1
    SolutionNameMin: Cijk_Ailk_Bjlk_B8NBS_BH_Bias_HAS_SAV_UserArgs_MT256x256x64_MI16x16x1_SN_LDSB0_CLR1_GRVWA4_GRVWB8_GSU0_GSUC0_GSUWGMRR0_K1_LBSPPA2048_LBSPPB2048_LPA0_LPB0_MIWT8_8_PLR1_SU0_SUM0_SUS64_VWA8_VWB8_WGM1_WGMXCC1_WGMXCCGn1
    SolutionIndex: 2
    SolutionNameMin: Cijk_Ailk_Bjlk_B8NBS_BH_Bias_HAS_SAV_UserArgs_MT256x256x64_MI16x16x1_SN_LDSB0_CLR1_GRVWA16_GRVWB8_GSU0_GSUC0_GSUWGMRR0_K1_LBSPPA2048_LBSPPB2048_LPA0_LPB0_MIWT8_8_PLR1_SU0_SUM0_SUS64_VWA8_VWB8_WGM1_WGMXCC1_WGMXCCGn1
    SolutionIndex: 3
    SolutionNameMin: Cijk_Ailk_Bjlk_B8NBS_BH_Bias_HAS_SAV_UserArgs_MT256x256x64_MI16x16x1_SN_LDSB0_CLR1_GRVWA4_GRVWB16_GSU0_GSUC0_GSUWGMRR0_K1_LBSPPA2048_LBSPPB2048_LPA0_LPB0_MIWT8_8_PLR1_SU0_SUM0_SUS64_VWA8_VWB8_WGM1_WGMXCC1_WGMXCCGn1
    SolutionIndex: 4
    SolutionNameMin: Cijk_Ailk_Bjlk_B8NBS_BH_Bias_HAS_SAV_UserArgs_MT256x256x64_MI16x16x1_SN_LDSB0_CLR1_GRVWA8_GRVWB16_GSU0_GSUC0_GSUWGMRR0_K1_LBSPPA2048_LBSPPB2048_LPA0_LPB0_MIWT8_8_PLR1_SU0_SUM0_SUS64_VWA8_VWB8_WGM1_WGMXCC1_WGMXCCGn1
    SolutionIndex: 5
    SolutionNameMin: Cijk_Ailk_Bjlk_B8NBS_BH_Bias_HAS_SAV_UserArgs_MT256x256x64_MI16x16x1_SN_LDSB0_CLR1_GRVWA16_GRVWB16_GSU0_GSUC0_GSUWGMRR0_K1_LBSPPA2048_LBSPPB2048_LPA0_LPB0_MIWT8_8_PLR1_SU0_SUM0_SUS64_VWA8_VWB8_WGM1_WGMXCC1_WGMXCCGn1
    SolutionIndex: 6
    SolutionNameMin: Cijk_Ailk_Bjlk_B8NBS_BH_Bias_HAS_SAV_UserArgs_MT256x256x64_MI16x16x1_SN_LDSB0_CLR1_GRVWA4_GRVWB4_GSU0_GSUC0_GSUWGMRR0_K1_LBSPPA2048_LBSPPB2048_LPA0_LPB0_MIWT8_8_PLR1_SU0_SUM0_SUS64_VWA8_VWB8_WGM4_WGMXCC1_WGMXCCGn1
    SolutionIndex: 7
    SolutionNameMin: Cijk_Ailk_Bjlk_B8NBS_BH_Bias_HAS_SAV_UserArgs_MT256x256x64_MI16x16x1_SN_LDSB0_CLR1_GRVWA16_GRVWB16_GSU0_GSUC0_GSUWGMRR0_K1_LBSPPA2048_LBSPPB2048_LPA0_LPB0_MIWT8_8_PLR1_SU0_SUM0_SUS64_VWA8_VWB8_WGM4_WGMXCC1_WGMXCCGn1
    SolutionIndex: 8
    SolutionNameMin: Cijk_Ailk_Bjlk_B8NBS_BH_Bias_HAS_SAV_UserArgs_MT256x256x64_MI16x16x1_SN_LDSB0_CLR1_GRVWA4_GRVWB8_GSU0_GSUC0_GSUWGMRR0_K1_LBSPPA2048_LBSPPB2048_LPA0_LPB0_MIWT8_8_PLR1_SU0_SUM0_SUS64_VWA8_VWB8_WGM6_WGMXCC1_WGMXCCGn1
    SolutionIndex: 9
    SolutionNameMin: Cijk_Ailk_Bjlk_B8NBS_BH_Bias_HAS_SAV_UserArgs_MT256x256x64_MI16x16x1_SN_LDSB0_CLR1_GRVWA8_GRVWB8_GSU0_GSUC0_GSUWGMRR0_K1_LBSPPA2048_LBSPPB2048_LPA0_LPB0_MIWT8_8_PLR1_SU0_SUM0_SUS64_VWA8_VWB8_WGM6_WGMXCC1_WGMXCCGn1
    SolutionIndex: 10
    SolutionNameMin: Cijk_Ailk_Bjlk_B8NBS_BH_Bias_HAS_SAV_UserArgs_MT256x256x64_MI16x16x1_SN_LDSB0_CLR1_GRVWA16_GRVWB8_GSU0_GSUC0_GSUWGMRR0_K1_LBSPPA2048_LBSPPB2048_LPA0_LPB0_MIWT8_8_PLR1_SU0_SUM0_SUS64_VWA8_VWB8_WGM6_WGMXCC1_WGMXCCGn1
    SolutionIndex: 11
    SolutionNameMin: Cijk_Ailk_Bjlk_B8NBS_BH_Bias_HAS_SAV_UserArgs_MT256x256x64_MI16x16x1_SN_LDSB0_CLR1_GRVWA16_GRVWB16_GSU0_GSUC0_GSUWGMRR0_K1_LBSPPA2048_LBSPPB2048_LPA0_LPB0_MIWT8_8_PLR1_SU0_SUM0_SUS64_VWA8_VWB8_WGM6_WGMXCC1_WGMXCCGn1
    SolutionIndex: 12
    SolutionNameMin: Cijk_Ailk_Bjlk_B8NBS_BH_Bias_HAS_SAV_UserArgs_MT256x256x64_MI16x16x1_SN_LDSB0_CLR1_GRVWA4_GRVWB4_GSU0_GSUC0_GSUWGMRR0_K1_LBSPPA2048_LBSPPB2048_LPA0_LPB0_MIWT8_8_PLR1_SU0_SUM0_SUS64_VWA8_VWB8_WGM8_WGMXCC1_WGMXCCGn1
    SolutionIndex: 13
    SolutionNameMin: Cijk_Ailk_Bjlk_B8NBS_BH_Bias_HAS_SAV_UserArgs_MT256x256x64_MI16x16x1_SN_LDSB0_CLR1_GRVWA16_GRVWB16_GSU0_GSUC0_GSUWGMRR0_K1_LBSPPA2048_LBSPPB2048_LPA0_LPB0_MIWT8_8_PLR1_SU0_SUM0_SUS64_VWA8_VWB8_WGM8_WGMXCC1_WGMXCCGn1
    SolutionIndex: 14
    SolutionNameMin: Cijk_Ailk_Bjlk_B8NBS_BH_Bias_HAS_SAV_UserArgs_MT128x256x64_MI16x16x1_SN_LDSB1_CLR1_GRVWA4_GRVWB16_GSU0_GSUC0_GSUWGMRR0_K1_LBSPPA1024_LBSPPB2048_LPA64_LPB0_MIWT4_8_PLR1_SU0_SUM0_SUS64_VWA4_VWB8_WGM1_WGMXCC1_WGMXCCGn1
    SolutionIndex: 15
    SolutionNameMin: Cijk_Ailk_Bjlk_B8NBS_BH_Bias_HAS_SAV_UserArgs_MT128x256x64_MI16x16x1_SN_LDSB1_CLR1_GRVWA8_GRVWB16_GSU0_GSUC0_GSUWGMRR0_K1_LBSPPA1024_LBSPPB2048_LPA64_LPB0_MIWT4_8_PLR1_SU0_SUM0_SUS64_VWA4_VWB8_WGM1_WGMXCC1_WGMXCCGn1
    SolutionIndex: 16
    SolutionNameMin: Cijk_Ailk_Bjlk_B8NBS_BH_Bias_HAS_SAV_UserArgs_MT128x256x64_MI16x16x1_SN_LDSB1_CLR1_GRVWA16_GRVWB16_GSU0_GSUC0_GSUWGMRR0_K1_LBSPPA1024_LBSPPB2048_LPA64_LPB0_MIWT4_8_PLR1_SU0_SUM0_SUS64_VWA4_VWB8_WGM1_WGMXCC1_WGMXCCGn1
    SolutionIndex: 17
    SolutionNameMin: Cijk_Ailk_Bjlk_B8NBS_BH_Bias_HAS_SAV_UserArgs_MT128x256x64_MI16x16x1_SN_LDSB1_CLR1_GRVWA8_GRVWB16_GSU0_GSUC0_GSUWGMRR0_K1_LBSPPA1024_LBSPPB2048_LPA64_LPB0_MIWT4_8_PLR1_SU0_SUM0_SUS64_VWA4_VWB8_WGM6_WGMXCC1_WGMXCCGn1
    SolutionIndex: 18
    SolutionNameMin: Cijk_Ailk_Bjlk_B8NBS_BH_Bias_HAS_SAV_UserArgs_MT128x256x64_MI16x16x1_SN_LDSB1_CLR1_GRVWA8_GRVWB8_GSU0_GSUC0_GSUWGMRR0_K1_LBSPPA1024_LBSPPB2048_LPA64_LPB0_MIWT4_8_PLR1_SU0_SUM0_SUS64_VWA4_VWB8_WGM8_WGMXCC1_WGMXCCGn1
    SolutionIndex: 19
    SolutionNameMin: Cijk_Ailk_Bjlk_B8NBS_BH_Bias_HAS_SAV_UserArgs_MT128x256x64_MI16x16x1_SN_LDSB1_CLR1_GRVWA16_GRVWB16_GSU0_GSUC0_GSUWGMRR0_K1_LBSPPA1024_LBSPPB2048_LPA64_LPB0_MIWT4_8_PLR1_SU0_SUM0_SUS64_VWA4_VWB8_WGM8_WGMXCC1_WGMXCCGn1
    SolutionIndex: 20
    SolutionNameMin: Cijk_Ailk_Bjlk_B8NBS_BH_Bias_HAS_SAV_UserArgs_MT256x144x64_MI16x16x1_SN_LDSB0_CLR1_GRVWA8_GRVWB4_GSU0_GSUC0_GSUWGMRR0_K1_LBSPPA2048_LBSPPB1152_LPA64_LPB16_MIWT4_9_PLR1_SU0_SUM0_SUS64_VWA4_VWB1_WGM1_WGMXCC1_WGMXCCGn1
    SolutionIndex: 21
    SolutionNameMin: Cijk_Ailk_Bjlk_B8NBS_BH_Bias_HAS_SAV_UserArgs_MT256x144x64_MI16x16x1_SN_LDSB0_CLR1_GRVWA16_GRVWB4_GSU0_GSUC0_GSUWGMRR0_K1_LBSPPA2048_LBSPPB1152_LPA64_LPB16_MIWT4_9_PLR1_SU0_SUM0_SUS64_VWA4_VWB1_WGM1_WGMXCC1_WGMXCCGn1
    SolutionIndex: 22
    SolutionNameMin: Cijk_Ailk_Bjlk_B8NBS_BH_Bias_HAS_SAV_UserArgs_MT256x144x64_MI16x16x1_SN_LDSB0_CLR1_GRVWA16_GRVWB4_GSU0_GSUC0_GSUWGMRR0_K1_LBSPPA2048_LBSPPB1152_LPA64_LPB16_MIWT4_9_PLR1_SU0_SUM0_SUS64_VWA4_VWB1_WGM4_WGMXCC1_WGMXCCGn1
    SolutionIndex: 23
    SolutionNameMin: Cijk_Ailk_Bjlk_B8NBS_BH_Bias_HAS_SAV_UserArgs_MT256x144x64_MI16x16x1_SN_LDSB0_CLR1_GRVWA16_GRVWB4_GSU0_GSUC0_GSUWGMRR0_K1_LBSPPA2048_LBSPPB1152_LPA64_LPB16_MIWT4_9_PLR1_SU0_SUM0_SUS64_VWA4_VWB1_WGM6_WGMXCC1_WGMXCCGn1
    SolutionIndex: 24
    SolutionNameMin: Cijk_Ailk_Bjlk_B8NBS_BH_Bias_HAS_SAV_UserArgs_MT256x128x64_MI16x16x1_SN_LDSB1_CLR1_GRVWA4_GRVWB4_GSU0_GSUC0_GSUWGMRR0_K1_LBSPPA2048_LBSPPB1024_LPA0_LPB64_MIWT8_4_PLR1_SU0_SUM0_SUS64_VWA8_VWB4_WGM1_WGMXCC1_WGMXCCGn1
    SolutionIndex: 25
    SolutionNameMin: Cijk_Ailk_Bjlk_B8NBS_BH_Bias_HAS_SAV_UserArgs_MT256x128x64_MI16x16x1_SN_LDSB1_CLR1_GRVWA4_GRVWB8_GSU0_GSUC0_GSUWGMRR0_K1_LBSPPA2048_LBSPPB1024_LPA0_LPB64_MIWT8_4_PLR1_SU0_SUM0_SUS64_VWA8_VWB4_WGM1_WGMXCC1_WGMXCCGn1
    SolutionIndex: 26
    SolutionNameMin: Cijk_Ailk_Bjlk_B8NBS_BH_Bias_HAS_SAV_UserArgs_MT256x128x64_MI16x16x1_SN_LDSB1_CLR1_GRVWA8_GRVWB8_GSU0_GSUC0_GSUWGMRR0_K1_LBSPPA2048_LBSPPB1024_LPA0_LPB64_MIWT8_4_PLR1_SU0_SUM0_SUS64_VWA8_VWB4_WGM1_WGMXCC1_WGMXCCGn1
    SolutionIndex: 27
    SolutionNameMin: Cijk_Ailk_Bjlk_B8NBS_BH_Bias_HAS_SAV_UserArgs_MT256x128x64_MI16x16x1_SN_LDSB1_CLR1_GRVWA16_GRVWB16_GSU0_GSUC0_GSUWGMRR0_K1_LBSPPA2048_LBSPPB1024_LPA0_LPB64_MIWT8_4_PLR1_SU0_SUM0_SUS64_VWA8_VWB4_WGM1_WGMXCC1_WGMXCCGn1
    SolutionIndex: 28
    SolutionNameMin: Cijk_Ailk_Bjlk_B8NBS_BH_Bias_HAS_SAV_UserArgs_MT256x128x64_MI16x16x1_SN_LDSB1_CLR1_GRVWA16_GRVWB16_GSU0_GSUC0_GSUWGMRR0_K1_LBSPPA2048_LBSPPB1024_LPA0_LPB64_MIWT8_4_PLR1_SU0_SUM0_SUS64_VWA8_VWB4_WGM4_WGMXCC1_WGMXCCGn1
    SolutionIndex: 29
    SolutionNameMin: Cijk_Ailk_Bjlk_B8NBS_BH_Bias_HAS_SAV_UserArgs_MT256x128x64_MI16x16x1_SN_LDSB1_CLR1_GRVWA4_GRVWB8_GSU0_GSUC0_GSUWGMRR0_K1_LBSPPA2048_LBSPPB1024_LPA0_LPB64_MIWT8_4_PLR1_SU0_SUM0_SUS64_VWA8_VWB4_WGM6_WGMXCC1_WGMXCCGn1
    SolutionIndex: 30
    SolutionNameMin: Cijk_Ailk_Bjlk_B8NBS_BH_Bias_HAS_SAV_UserArgs_MT256x128x64_MI16x16x1_SN_LDSB1_CLR1_GRVWA4_GRVWB8_GSU0_GSUC0_GSUWGMRR0_K1_LBSPPA2048_LBSPPB1024_LPA0_LPB64_MIWT8_4_PLR1_SU0_SUM0_SUS64_VWA8_VWB4_WGM8_WGMXCC1_WGMXCCGn1
    SolutionIndex: 31
    SolutionNameMin: Cijk_Ailk_Bjlk_B8NBS_BH_Bias_HAS_SAV_UserArgs_MT256x128x64_MI16x16x1_SN_LDSB1_CLR1_GRVWA8_GRVWB16_GSU0_GSUC0_GSUWGMRR0_K1_LBSPPA2048_LBSPPB1024_LPA0_LPB64_MIWT8_4_PLR1_SU0_SUM0_SUS64_VWA8_VWB4_WGM8_WGMXCC1_WGMXCCGn1
    SolutionIndex: 32
    SolutionNameMin: Cijk_Ailk_Bjlk_B8NBS_BH_Bias_HAS_SAV_UserArgs_MT256x128x64_MI16x16x1_SN_LDSB1_CLR1_GRVWA16_GRVWB16_GSU0_GSUC0_GSUWGMRR0_K1_LBSPPA2048_LBSPPB1024_LPA0_LPB64_MIWT8_4_PLR1_SU0_SUM0_SUS64_VWA8_VWB4_WGM8_WGMXCC1_WGMXCCGn1
    SolutionIndex: 33
    SolutionNameMin: Cijk_Ailk_Bjlk_B8NBS_BH_Bias_HAS_SAV_UserArgs_MT128x128x64_MI16x16x1_SN_LDSB1_CLR1_GRVWA4_GRVWB4_GSU0_GSUC0_GSUWGMRR0_K1_LBSPPA1024_LBSPPB1024_LPA0_LPB32_MIWT8_2_PLR1_SU0_SUM0_SUS64_VWA8_VWB2_WGM1_WGMXCC1_WGMXCCGn1
    SolutionIndex: 34
    SolutionNameMin: Cijk_Ailk_Bjlk_B8NBS_BH_Bias_HAS_SAV_UserArgs_MT128x128x64_MI16x16x1_SN_LDSB1_CLR1_GRVWA16_GRVWB8_GSU0_GSUC0_GSUWGMRR0_K1_LBSPPA1024_LBSPPB1024_LPA0_LPB32_MIWT8_2_PLR1_SU0_SUM0_SUS64_VWA8_VWB2_WGM1_WGMXCC1_WGMXCCGn1
    SolutionIndex: 35
    SolutionNameMin: Cijk_Ailk_Bjlk_B8NBS_BH_Bias_HAS_SAV_UserArgs_MT128x128x64_MI16x16x1_SN_LDSB1_CLR1_GRVWA8_GRVWB16_GSU0_GSUC0_GSUWGMRR0_K1_LBSPPA1024_LBSPPB1024_LPA0_LPB32_MIWT8_2_PLR1_SU0_SUM0_SUS64_VWA8_VWB2_WGM1_WGMXCC1_WGMXCCGn1
    SolutionIndex: 36
    SolutionNameMin: Cijk_Ailk_Bjlk_B8NBS_BH_Bias_HAS_SAV_UserArgs_MT128x128x64_MI16x16x1_SN_LDSB1_CLR1_GRVWA4_GRVWB4_GSU0_GSUC0_GSUWGMRR0_K1_LBSPPA1024_LBSPPB1024_LPA0_LPB32_MIWT8_2_PLR1_SU0_SUM0_SUS64_VWA8_VWB2_WGM6_WGMXCC1_WGMXCCGn1
    SolutionIndex: 37
    SolutionNameMin: Cijk_Ailk_Bjlk_B8NBS_BH_Bias_HAS_SAV_UserArgs_MT128x128x64_MI16x16x1_SN_LDSB1_CLR1_GRVWA4_GRVWB4_GSU0_GSUC0_GSUWGMRR0_K1_LBSPPA1024_LBSPPB1024_LPA0_LPB32_MIWT8_2_PLR1_SU0_SUM0_SUS64_VWA8_VWB2_WGM8_WGMXCC1_WGMXCCGn1
    SolutionIndex: 38
    SolutionNameMin: Cijk_Ailk_Bjlk_B8NBS_BH_Bias_HAS_SAV_UserArgs_MT128x128x64_MI16x16x1_SN_LDSB1_CLR1_GRVWA4_GRVWB16_GSU0_GSUC0_GSUWGMRR0_K1_LBSPPA1024_LBSPPB1024_LPA64_LPB64_MIWT4_4_PLR1_SU0_SUM0_SUS64_VWA4_VWB4_WGM1_WGMXCC1_WGMXCCGn1
    SolutionIndex: 39
    SolutionNameMin: Cijk_Ailk_Bjlk_B8NBS_BH_Bias_HAS_SAV_UserArgs_MT128x128x64_MI16x16x1_SN_LDSB1_CLR1_GRVWA8_GRVWB16_GSU0_GSUC0_GSUWGMRR0_K1_LBSPPA1024_LBSPPB1024_LPA64_LPB64_MIWT4_4_PLR1_SU0_SUM0_SUS64_VWA4_VWB4_WGM1_WGMXCC1_WGMXCCGn1
    SolutionIndex: 40
    SolutionNameMin: Cijk_Ailk_Bjlk_B8NBS_BH_Bias_HAS_SAV_UserArgs_MT128x128x64_MI16x16x1_SN_LDSB1_CLR1_GRVWA16_GRVWB16_GSU0_GSUC0_GSUWGMRR0_K1_LBSPPA1024_LBSPPB1024_LPA64_LPB64_MIWT4_4_PLR1_SU0_SUM0_SUS64_VWA4_VWB4_WGM1_WGMXCC1_WGMXCCGn1
    SolutionIndex: 41
    SolutionNameMin: Cijk_Ailk_Bjlk_B8NBS_BH_Bias_HAS_SAV_UserArgs_MT128x128x64_MI16x16x1_SN_LDSB1_CLR1_GRVWA16_GRVWB8_GSU0_GSUC0_GSUWGMRR0_K1_LBSPPA1024_LBSPPB1024_LPA64_LPB64_MIWT4_4_PLR1_SU0_SUM0_SUS64_VWA4_VWB4_WGM4_WGMXCC1_WGMXCCGn1
    SolutionIndex: 42
    SolutionNameMin: Cijk_Ailk_Bjlk_B8NBS_BH_Bias_HAS_SAV_UserArgs_MT128x128x64_MI16x16x1_SN_LDSB1_CLR1_GRVWA8_GRVWB16_GSU0_GSUC0_GSUWGMRR0_K1_LBSPPA1024_LBSPPB1024_LPA64_LPB64_MIWT4_4_PLR1_SU0_SUM0_SUS64_VWA4_VWB4_WGM4_WGMXCC1_WGMXCCGn1
    SolutionIndex: 43
    SolutionNameMin: Cijk_Ailk_Bjlk_B8NBS_BH_Bias_HAS_SAV_UserArgs_MT128x128x64_MI16x16x1_SN_LDSB1_CLR1_GRVWA16_GRVWB16_GSU0_GSUC0_GSUWGMRR0_K1_LBSPPA1024_LBSPPB1024_LPA64_LPB64_MIWT4_4_PLR1_SU0_SUM0_SUS64_VWA4_VWB4_WGM4_WGMXCC1_WGMXCCGn1
    SolutionIndex: 44
    SolutionNameMin: Cijk_Ailk_Bjlk_B8NBS_BH_Bias_HAS_SAV_UserArgs_MT128x128x64_MI16x16x1_SN_LDSB1_CLR1_GRVWA8_GRVWB16_GSU0_GSUC0_GSUWGMRR0_K1_LBSPPA1024_LBSPPB1024_LPA64_LPB64_MIWT4_4_PLR1_SU0_SUM0_SUS64_VWA4_VWB4_WGM6_WGMXCC1_WGMXCCGn1
    SolutionIndex: 45
    SolutionNameMin: Cijk_Ailk_Bjlk_B8NBS_BH_Bias_HAS_SAV_UserArgs_MT128x128x64_MI16x16x1_SN_LDSB1_CLR1_GRVWA16_GRVWB16_GSU0_GSUC0_GSUWGMRR0_K1_LBSPPA1024_LBSPPB1024_LPA64_LPB64_MIWT4_4_PLR1_SU0_SUM0_SUS64_VWA4_VWB4_WGM6_WGMXCC1_WGMXCCGn1
    SolutionIndex: 46
    SolutionNameMin: Cijk_Ailk_Bjlk_B8NBS_BH_Bias_HAS_SAV_UserArgs_MT128x128x64_MI16x16x1_SN_LDSB1_CLR1_GRVWA16_GRVWB16_GSU0_GSUC0_GSUWGMRR0_K1_LBSPPA1024_LBSPPB1024_LPA64_LPB64_MIWT4_4_PLR1_SU0_SUM0_SUS64_VWA4_VWB4_WGM8_WGMXCC1_WGMXCCGn1
    SolutionIndex: 47
    SolutionNameMin: Cijk_Ailk_Bjlk_B8NBS_BH_Bias_HAS_SAV_UserArgs_MT64x128x64_MI16x16x1_SN_LDSB0_CLR1_GRVWA4_GRVWB4_GSU0_GSUC0_GSUWGMRR0_K1_LBSPPA512_LBSPPB1024_LPA32_LPB64_MIWT2_4_PLR1_SU0_SUM0_SUS64_VWA2_VWB4_WGM1_WGMXCC1_WGMXCCGn1
    SolutionIndex: 48
    SolutionNameMin: Cijk_Ailk_Bjlk_B8NBS_BH_Bias_HAS_SAV_UserArgs_MT64x128x64_MI16x16x1_SN_LDSB0_CLR1_GRVWA8_GRVWB4_GSU0_GSUC0_GSUWGMRR0_K1_LBSPPA512_LBSPPB1024_LPA32_LPB64_MIWT2_4_PLR1_SU0_SUM0_SUS64_VWA2_VWB4_WGM1_WGMXCC1_WGMXCCGn1
    SolutionIndex: 49
    SolutionNameMin: Cijk_Ailk_Bjlk_B8NBS_BH_Bias_HAS_SAV_UserArgs_MT64x128x64_MI16x16x1_SN_LDSB0_CLR1_GRVWA4_GRVWB8_GSU0_GSUC0_GSUWGMRR0_K1_LBSPPA512_LBSPPB1024_LPA32_LPB64_MIWT2_4_PLR1_SU0_SUM0_SUS64_VWA2_VWB4_WGM1_WGMXCC1_WGMXCCGn1
    SolutionIndex: 50
    SolutionNameMin: Cijk_Ailk_Bjlk_B8NBS_BH_Bias_HAS_SAV_UserArgs_MT64x128x64_MI16x16x1_SN_LDSB0_CLR1_GRVWA4_GRVWB16_GSU0_GSUC0_GSUWGMRR0_K1_LBSPPA512_LBSPPB1024_LPA32_LPB64_MIWT2_4_PLR1_SU0_SUM0_SUS64_VWA2_VWB4_WGM1_WGMXCC1_WGMXCCGn1
    SolutionIndex: 51
    SolutionNameMin: Cijk_Ailk_Bjlk_B8NBS_BH_Bias_HAS_SAV_UserArgs_MT64x128x64_MI16x16x1_SN_LDSB0_CLR1_GRVWA8_GRVWB16_GSU0_GSUC0_GSUWGMRR0_K1_LBSPPA512_LBSPPB1024_LPA32_LPB64_MIWT2_4_PLR1_SU0_SUM0_SUS64_VWA2_VWB4_WGM1_WGMXCC1_WGMXCCGn1
    SolutionIndex: 52
    SolutionNameMin: Cijk_Ailk_Bjlk_B8NBS_BH_Bias_HAS_SAV_UserArgs_MT64x128x64_MI16x16x1_SN_LDSB0_CLR1_GRVWA16_GRVWB16_GSU0_GSUC0_GSUWGMRR0_K1_LBSPPA512_LBSPPB1024_LPA32_LPB64_MIWT2_4_PLR1_SU0_SUM0_SUS64_VWA2_VWB4_WGM1_WGMXCC1_WGMXCCGn1
    SolutionIndex: 53
    SolutionNameMin: Cijk_Ailk_Bjlk_B8NBS_BH_Bias_HAS_SAV_UserArgs_MT128x64x64_MI16x16x1_SN_LDSB0_CLR1_GRVWA4_GRVWB8_GSU0_GSUC0_GSUWGMRR0_K1_LBSPPA1024_LBSPPB512_LPA64_LPB32_MIWT4_2_PLR1_SU0_SUM0_SUS64_VWA4_VWB2_WGM1_WGMXCC1_WGMXCCGn1
    SolutionIndex: 54
    SolutionNameMin: Cijk_Ailk_Bjlk_B8NBS_BH_Bias_HAS_SAV_UserArgs_MT128x64x64_MI16x16x1_SN_LDSB0_CLR1_GRVWA16_GRVWB8_GSU0_GSUC0_GSUWGMRR0_K1_LBSPPA1024_LBSPPB512_LPA64_LPB32_MIWT4_2_PLR1_SU0_SUM0_SUS64_VWA4_VWB2_WGM1_WGMXCC1_WGMXCCGn1
    SolutionIndex: 55
    SolutionNameMin: Cijk_Ailk_Bjlk_B8NBS_BH_Bias_HAS_SAV_UserArgs_MT128x32x64_MI16x16x1_SN_LDSB0_CLR1_GRVWA4_GRVWB4_GSU0_GSUC0_GSUWGMRR0_K1_LBSPPA1024_LBSPPB256_LPA64_LPB16_MIWT4_1_PLR1_SU0_SUM0_SUS64_VWA4_VWB1_WGM1_WGMXCC1_WGMXCCGn1
    SolutionIndex: 56
    SolutionNameMin: Cijk_Ailk_Bjlk_B8NBS_BH_Bias_HAS_SAV_UserArgs_MT64x64x64_MI16x16x1_SN_LDSB0_CLR1_GRVWA4_GRVWB4_GSU0_GSUC0_GSUWGMRR0_K1_LBSPPA512_LBSPPB512_LPA32_LPB32_MIWT2_2_PLR1_SU0_SUM0_SUS64_VWA2_VWB2_WGM1_WGMXCC1_WGMXCCGn1
    SolutionIndex: 57
    SolutionNameMin: Cijk_Ailk_Bjlk_B8NBS_BH_Bias_HAS_SAV_UserArgs_MT64x64x64_MI16x16x1_SN_LDSB0_CLR1_GRVWA4_GRVWB8_GSU0_GSUC0_GSUWGMRR0_K1_LBSPPA512_LBSPPB512_LPA32_LPB32_MIWT2_2_PLR1_SU0_SUM0_SUS64_VWA2_VWB2_WGM1_WGMXCC1_WGMXCCGn1
    SolutionIndex: 58
    SolutionNameMin: Cijk_Ailk_Bjlk_B8NBS_BH_Bias_HAS_SAV_UserArgs_MT64x64x64_MI16x16x1_SN_LDSB0_CLR1_GRVWA8_GRVWB8_GSU0_GSUC0_GSUWGMRR0_K1_LBSPPA512_LBSPPB512_LPA32_LPB32_MIWT2_2_PLR1_SU0_SUM0_SUS64_VWA2_VWB2_WGM1_WGMXCC1_WGMXCCGn1
    SolutionIndex: 59
    SolutionNameMin: Cijk_Ailk_Bjlk_B8NBS_BH_Bias_HAS_SAV_UserArgs_MT64x64x64_MI16x16x1_SN_LDSB0_CLR1_GRVWA8_GRVWB16_GSU0_GSUC0_GSUWGMRR0_K1_LBSPPA512_LBSPPB512_LPA32_LPB32_MIWT2_2_PLR1_SU0_SUM0_SUS64_VWA2_VWB2_WGM1_WGMXCC1_WGMXCCGn1
    SolutionIndex: 60
    SolutionNameMin: Cijk_Ailk_Bjlk_B8NBS_BH_Bias_HAS_SAV_UserArgs_MT64x64x64_MI16x16x1_SN_LDSB0_CLR1_GRVWA8_GRVWB8_GSU0_GSUC0_GSUWGMRR0_K1_LBSPPA512_LBSPPB512_LPA32_LPB32_MIWT2_2_PLR1_SU0_SUM0_SUS64_VWA2_VWB2_WGM4_WGMXCC1_WGMXCCGn1
    SolutionIndex: 61
    SolutionNameMin: Cijk_Ailk_Bjlk_B8NBS_BH_Bias_HAS_SAV_UserArgs_MT32x64x64_MI16x16x1_SN_LDSB0_CLR1_GRVWA8_GRVWB4_GSU0_GSUC0_GSUWGMRR0_K1_LBSPPA256_LBSPPB512_LPA16_LPB32_MIWT1_2_PLR1_SU0_SUM0_SUS64_VWA1_VWB2_WGM1_WGMXCC1_WGMXCCGn1
    SolutionIndex: 62
    SolutionNameMin: Cijk_Ailk_Bjlk_B8NBS_BH_Bias_HAS_SAV_UserArgs_MT32x64x64_MI16x16x1_SN_LDSB0_CLR1_GRVWA8_GRVWB8_GSU0_GSUC0_GSUWGMRR0_K1_LBSPPA256_LBSPPB512_LPA16_LPB32_MIWT1_2_PLR1_SU0_SUM0_SUS64_VWA1_VWB2_WGM1_WGMXCC1_WGMXCCGn1
    SolutionIndex: 63
    SolutionNameMin: Cijk_Ailk_Bjlk_B8NBS_BH_Bias_HAS_SAV_UserArgs_MT64x32x64_MI16x16x1_SN_LDSB0_CLR1_GRVWA4_GRVWB4_GSU0_GSUC0_GSUWGMRR0_K1_LBSPPA512_LBSPPB256_LPA32_LPB16_MIWT2_1_PLR1_SU0_SUM0_SUS64_VWA2_VWB1_WGM1_WGMXCC1_WGMXCCGn1
    SolutionIndex: 64
    SolutionNameMin: Cijk_Ailk_Bjlk_B8NBS_BH_Bias_HAS_SAV_UserArgs_MT64x32x64_MI16x16x1_SN_LDSB0_CLR1_GRVWA8_GRVWB4_GSU0_GSUC0_GSUWGMRR0_K1_LBSPPA512_LBSPPB256_LPA32_LPB16_MIWT2_1_PLR1_SU0_SUM0_SUS64_VWA2_VWB1_WGM1_WGMXCC1_WGMXCCGn1
    SolutionIndex: 65
    SolutionNameMin: Cijk_Ailk_Bjlk_B8NBS_BH_Bias_HAS_SAV_UserArgs_MT64x32x64_MI16x16x1_SN_LDSB0_CLR1_GRVWA4_GRVWB8_GSU0_GSUC0_GSUWGMRR0_K1_LBSPPA512_LBSPPB256_LPA32_LPB16_MIWT2_1_PLR1_SU0_SUM0_SUS64_VWA2_VWB1_WGM1_WGMXCC1_WGMXCCGn1
    SolutionIndex: 66
    SolutionNameMin: Cijk_Ailk_Bjlk_B8NBS_BH_Bias_HAS_SAV_UserArgs_MT32x32x64_MI16x16x1_SN_LDSB0_CLR1_GRVWA4_GRVWB4_GSU0_GSUC0_GSUWGMRR0_K1_LBSPPA256_LBSPPB256_LPA16_LPB16_MIWT1_1_PLR1_SU0_SUM0_SUS64_VWA1_VWB1_WGM1_WGMXCC1_WGMXCCGn1
    SolutionIndex: 67
    SolutionNameMin: Cijk_Ailk_Bjlk_B8NBS_BH_Bias_HAS_SAV_UserArgs_MT32x32x64_MI16x16x1_SN_LDSB0_CLR1_GRVWA8_GRVWB4_GSU0_GSUC0_GSUWGMRR0_K1_LBSPPA256_LBSPPB256_LPA16_LPB16_MIWT1_1_PLR1_SU0_SUM0_SUS64_VWA1_VWB1_WGM1_WGMXCC1_WGMXCCGn1
    SolutionIndex: 68
    SolutionNameMin: Cijk_Ailk_Bjlk_B8NBS_BH_Bias_HAS_SAV_UserArgs_MT32x32x64_MI16x16x1_SN_LDSB0_CLR1_GRVWA4_GRVWB8_GSU0_GSUC0_GSUWGMRR0_K1_LBSPPA256_LBSPPB256_LPA16_LPB16_MIWT1_1_PLR1_SU0_SUM0_SUS64_VWA1_VWB1_WGM1_WGMXCC1_WGMXCCGn1
    SolutionIndex: 69
    SolutionNameMin: Cijk_Ailk_Bjlk_B8NBS_BH_Bias_HAS_SAV_UserArgs_MT32x32x64_MI16x16x1_SN_LDSB0_CLR1_GRVWA8_GRVWB8_GSU0_GSUC0_GSUWGMRR0_K1_LBSPPA256_LBSPPB256_LPA16_LPB16_MIWT1_1_PLR1_SU0_SUM0_SUS64_VWA1_VWB1_WGM1_WGMXCC1_WGMXCCGn1
    SolutionIndex: 70
    SolutionNameMin: Cijk_Ailk_Bjlk_B8NBS_BH_Bias_HAS_SAV_UserArgs_MT256x256x128_MI16x16x1_SN_LDSB1_CLR1_GRVWA16_GRVWB8_GSU0_GSUC0_GSUWGMRR0_K1_LBSPPA2048_LBSPPB2048_LPA0_LPB0_MIWT8_8_PLR1_SU0_SUM0_SUS128_VWA8_VWB8_WGM1_WGMXCC1_WGMXCCGn1
    SolutionIndex: 71
    SolutionNameMin: Cijk_Ailk_Bjlk_B8NBS_BH_Bias_HAS_SAV_UserArgs_MT256x256x128_MI16x16x1_SN_LDSB1_CLR1_GRVWA8_GRVWB16_GSU0_GSUC0_GSUWGMRR0_K1_LBSPPA2048_LBSPPB2048_LPA0_LPB0_MIWT8_8_PLR1_SU0_SUM0_SUS128_VWA8_VWB8_WGM1_WGMXCC1_WGMXCCGn1
    SolutionIndex: 72
    SolutionNameMin: Cijk_Ailk_Bjlk_B8NBS_BH_Bias_HAS_SAV_UserArgs_MT256x256x128_MI16x16x1_SN_LDSB1_CLR1_GRVWA16_GRVWB16_GSU0_GSUC0_GSUWGMRR0_K1_LBSPPA2048_LBSPPB2048_LPA0_LPB0_MIWT8_8_PLR1_SU0_SUM0_SUS128_VWA8_VWB8_WGM1_WGMXCC1_WGMXCCGn1
    SolutionIndex: 73
    SolutionNameMin: Cijk_Ailk_Bjlk_B8NBS_BH_Bias_HAS_SAV_UserArgs_MT256x256x128_MI16x16x1_SN_LDSB1_CLR1_GRVWA16_GRVWB8_GSU0_GSUC0_GSUWGMRR0_K1_LBSPPA2048_LBSPPB2048_LPA0_LPB0_MIWT8_8_PLR1_SU0_SUM0_SUS128_VWA8_VWB8_WGM4_WGMXCC1_WGMXCCGn1
    SolutionIndex: 74
    SolutionNameMin: Cijk_Ailk_Bjlk_B8NBS_BH_Bias_HAS_SAV_UserArgs_MT256x256x128_MI16x16x1_SN_LDSB1_CLR1_GRVWA16_GRVWB16_GSU0_GSUC0_GSUWGMRR0_K1_LBSPPA2048_LBSPPB2048_LPA0_LPB0_MIWT8_8_PLR1_SU0_SUM0_SUS128_VWA8_VWB8_WGM4_WGMXCC1_WGMXCCGn1
    SolutionIndex: 75
    SolutionNameMin: Cijk_Ailk_Bjlk_B8NBS_BH_Bias_HAS_SAV_UserArgs_MT256x256x128_MI16x16x1_SN_LDSB1_CLR1_GRVWA16_GRVWB8_GSU0_GSUC0_GSUWGMRR0_K1_LBSPPA2048_LBSPPB2048_LPA0_LPB0_MIWT8_8_PLR1_SU0_SUM0_SUS128_VWA8_VWB8_WGM6_WGMXCC1_WGMXCCGn1
    SolutionIndex: 76
    SolutionNameMin: Cijk_Ailk_Bjlk_B8NBS_BH_Bias_HAS_SAV_UserArgs_MT256x256x128_MI16x16x1_SN_LDSB1_CLR1_GRVWA8_GRVWB16_GSU0_GSUC0_GSUWGMRR0_K1_LBSPPA2048_LBSPPB2048_LPA0_LPB0_MIWT8_8_PLR1_SU0_SUM0_SUS128_VWA8_VWB8_WGM8_WGMXCC1_WGMXCCGn1
    SolutionIndex: 77
    SolutionNameMin: Cijk_Ailk_Bjlk_B8NBS_BH_Bias_HAS_SAV_UserArgs_MT256x256x128_MI16x16x1_SN_LDSB1_CLR1_GRVWA16_GRVWB16_GSU0_GSUC0_GSUWGMRR0_K1_LBSPPA2048_LBSPPB2048_LPA0_LPB0_MIWT8_8_PLR1_SU0_SUM0_SUS128_VWA8_VWB8_WGM8_WGMXCC1_WGMXCCGn1
    SolutionIndex: 78
    SolutionNameMin: Cijk_Ailk_Bjlk_B8NBS_BH_Bias_HAS_SAV_UserArgs_MT128x256x128_MI16x16x1_SN_LDSB1_CLR1_GRVWA8_GRVWB16_GSU0_GSUC0_GSUWGMRR0_K1_LBSPPA1024_LBSPPB2048_LPA64_LPB0_MIWT4_8_PLR1_SU0_SUM0_SUS128_VWA4_VWB8_WGM1_WGMXCC1_WGMXCCGn1
    SolutionIndex: 79
    SolutionNameMin: Cijk_Ailk_Bjlk_B8NBS_BH_Bias_HAS_SAV_UserArgs_MT128x256x128_MI16x16x1_SN_LDSB1_CLR1_GRVWA16_GRVWB16_GSU0_GSUC0_GSUWGMRR0_K1_LBSPPA1024_LBSPPB2048_LPA64_LPB0_MIWT4_8_PLR1_SU0_SUM0_SUS128_VWA4_VWB8_WGM4_WGMXCC1_WGMXCCGn1
    SolutionIndex: 80
    SolutionNameMin: Cijk_Ailk_Bjlk_B8NBS_BH_Bias_HAS_SAV_UserArgs_MT256x128x128_MI16x16x1_SN_LDSB1_CLR1_GRVWA16_GRVWB8_GSU0_GSUC0_GSUWGMRR0_K1_LBSPPA2048_LBSPPB1024_LPA0_LPB64_MIWT8_4_PLR1_SU0_SUM0_SUS128_VWA8_VWB4_WGM6_WGMXCC1_WGMXCCGn1
    SolutionIndex: 81
    SolutionNameMin: Cijk_Ailk_Bjlk_B8NBS_BH_Bias_HAS_SAV_UserArgs_MT256x128x128_MI16x16x1_SN_LDSB1_CLR1_GRVWA16_GRVWB4_GSU0_GSUC0_GSUWGMRR0_K1_LBSPPA2048_LBSPPB1024_LPA0_LPB64_MIWT8_4_PLR1_SU0_SUM0_SUS128_VWA8_VWB4_WGM8_WGMXCC1_WGMXCCGn1
    SolutionIndex: 82
    SolutionNameMin: Cijk_Ailk_Bjlk_B8NBS_BH_Bias_HAS_SAV_UserArgs_MT256x128x128_MI16x16x1_SN_LDSB1_CLR1_GRVWA8_GRVWB16_GSU0_GSUC0_GSUWGMRR0_K1_LBSPPA2048_LBSPPB1024_LPA0_LPB64_MIWT8_4_PLR1_SU0_SUM0_SUS128_VWA8_VWB4_WGM8_WGMXCC1_WGMXCCGn1
    SolutionIndex: 83
    SolutionNameMin: Cijk_Ailk_Bjlk_B8NBS_BH_Bias_HAS_SAV_UserArgs_MT128x128x128_MI16x16x1_SN_LDSB1_CLR1_GRVWA4_GRVWB4_GSU0_GSUC0_GSUWGMRR0_K1_LBSPPA1024_LBSPPB1024_LPA0_LPB32_MIWT8_2_PLR1_SU0_SUM0_SUS128_VWA8_VWB2_WGM1_WGMXCC1_WGMXCCGn1
    SolutionIndex: 84
    SolutionNameMin: Cijk_Ailk_Bjlk_B8NBS_BH_Bias_HAS_SAV_UserArgs_MT128x128x128_MI16x16x1_SN_LDSB1_CLR1_GRVWA4_GRVWB16_GSU0_GSUC0_GSUWGMRR0_K1_LBSPPA1024_LBSPPB1024_LPA64_LPB64_MIWT4_4_PLR1_SU0_SUM0_SUS128_VWA4_VWB4_WGM1_WGMXCC1_WGMXCCGn1
    SolutionIndex: 85
    SolutionNameMin: Cijk_Ailk_Bjlk_B8NBS_BH_Bias_HAS_SAV_UserArgs_MT128x128x128_MI16x16x1_SN_LDSB1_CLR1_GRVWA16_GRVWB16_GSU0_GSUC0_GSUWGMRR0_K1_LBSPPA1024_LBSPPB1024_LPA64_LPB64_MIWT4_4_PLR1_SU0_SUM0_SUS128_VWA4_VWB4_WGM1_WGMXCC1_WGMXCCGn1
    SolutionIndex: 86
    SolutionNameMin: Cijk_Ailk_Bjlk_B8NBS_BH_Bias_HAS_SAV_UserArgs_MT64x128x128_MI16x16x1_SN_LDSB1_CLR1_GRVWA4_GRVWB4_GSU0_GSUC0_GSUWGMRR0_K1_LBSPPA512_LBSPPB1024_LPA32_LPB64_MIWT2_4_PLR1_SU0_SUM0_SUS128_VWA2_VWB4_WGM1_WGMXCC1_WGMXCCGn1
    SolutionIndex: 87
    SolutionNameMin: Cijk_Ailk_Bjlk_B8NBS_BH_Bias_HAS_SAV_UserArgs_MT128x64x128_MI16x16x1_SN_LDSB1_CLR1_GRVWA16_GRVWB16_GSU0_GSUC0_GSUWGMRR0_K1_LBSPPA1024_LBSPPB512_LPA64_LPB32_MIWT4_2_PLR1_SU0_SUM0_SUS128_VWA4_VWB2_WGM1_WGMXCC1_WGMXCCGn1
    SolutionIndex: 88
    SolutionNameMin: Cijk_Ailk_Bjlk_B8NBS_BH_Bias_HAS_SAV_UserArgs_MT128x64x128_MI16x16x1_SN_LDSB1_CLR1_GRVWA16_GRVWB16_GSU0_GSUC0_GSUWGMRR0_K1_LBSPPA1024_LBSPPB512_LPA64_LPB32_MIWT4_2_PLR1_SU0_SUM0_SUS128_VWA4_VWB2_WGM4_WGMXCC1_WGMXCCGn1
    SolutionIndex: 89
    SolutionNameMin: Cijk_Ailk_Bjlk_B8NBS_BH_Bias_HAS_SAV_UserArgs_MT128x64x128_MI16x16x1_SN_LDSB1_CLR1_GRVWA16_GRVWB16_GSU0_GSUC0_GSUWGMRR0_K1_LBSPPA1024_LBSPPB512_LPA64_LPB32_MIWT4_2_PLR1_SU0_SUM0_SUS128_VWA4_VWB2_WGM6_WGMXCC1_WGMXCCGn1
    SolutionIndex: 90
    SolutionNameMin: Cijk_Ailk_Bjlk_B8NBS_BH_Bias_HAS_SAV_UserArgs_MT128x64x128_MI16x16x1_SN_LDSB1_CLR1_GRVWA16_GRVWB16_GSU0_GSUC0_GSUWGMRR0_K1_LBSPPA1024_LBSPPB512_LPA64_LPB32_MIWT4_2_PLR1_SU0_SUM0_SUS128_VWA4_VWB2_WGM8_WGMXCC1_WGMXCCGn1
    SolutionIndex: 91
    SolutionNameMin: Cijk_Ailk_Bjlk_B8NBS_BH_Bias_HAS_SAV_UserArgs_MT64x64x128_MI16x16x1_SN_LDSB1_CLR1_GRVWA4_GRVWB8_GSU0_GSUC0_GSUWGMRR0_K1_LBSPPA512_LBSPPB512_LPA32_LPB32_MIWT2_2_PLR1_SU0_SUM0_SUS128_VWA2_VWB2_WGM1_WGMXCC1_WGMXCCGn1
    SolutionIndex: 92
    SolutionNameMin: Cijk_Ailk_Bjlk_B8NBS_BH_Bias_HAS_SAV_UserArgs_MT64x64x128_MI16x16x1_SN_LDSB1_CLR1_GRVWA16_GRVWB8_GSU0_GSUC0_GSUWGMRR0_K1_LBSPPA512_LBSPPB512_LPA32_LPB32_MIWT2_2_PLR1_SU0_SUM0_SUS128_VWA2_VWB2_WGM1_WGMXCC1_WGMXCCGn1
    SolutionIndex: 93
    SolutionNameMin: Cijk_Ailk_Bjlk_B8NBS_BH_Bias_HAS_SAV_UserArgs_MT64x64x128_MI16x16x1_SN_LDSB1_CLR1_GRVWA8_GRVWB16_GSU0_GSUC0_GSUWGMRR0_K1_LBSPPA512_LBSPPB512_LPA32_LPB32_MIWT2_2_PLR1_SU0_SUM0_SUS128_VWA2_VWB2_WGM1_WGMXCC1_WGMXCCGn1
    SolutionIndex: 94
    SolutionNameMin: Cijk_Ailk_Bjlk_B8NBS_BH_Bias_HAS_SAV_UserArgs_MT64x64x128_MI16x16x1_SN_LDSB1_CLR1_GRVWA16_GRVWB16_GSU0_GSUC0_GSUWGMRR0_K1_LBSPPA512_LBSPPB512_LPA32_LPB32_MIWT2_2_PLR1_SU0_SUM0_SUS128_VWA2_VWB2_WGM1_WGMXCC1_WGMXCCGn1
    SolutionIndex: 95
    SolutionNameMin: Cijk_Ailk_Bjlk_B8NBS_BH_Bias_HAS_SAV_UserArgs_MT64x64x128_MI16x16x1_SN_LDSB1_CLR1_GRVWA16_GRVWB16_GSU0_GSUC0_GSUWGMRR0_K1_LBSPPA512_LBSPPB512_LPA32_LPB32_MIWT2_2_PLR1_SU0_SUM0_SUS128_VWA2_VWB2_WGM4_WGMXCC1_WGMXCCGn1
    SolutionIndex: 96
    SolutionNameMin: Cijk_Ailk_Bjlk_B8NBS_BH_Bias_HAS_SAV_UserArgs_MT64x64x128_MI16x16x1_SN_LDSB1_CLR1_GRVWA4_GRVWB16_GSU0_GSUC0_GSUWGMRR0_K1_LBSPPA512_LBSPPB512_LPA32_LPB32_MIWT2_2_PLR1_SU0_SUM0_SUS128_VWA2_VWB2_WGM6_WGMXCC1_WGMXCCGn1
    SolutionIndex: 97
    SolutionNameMin: Cijk_Ailk_Bjlk_B8NBS_BH_Bias_HAS_SAV_UserArgs_MT64x64x128_MI16x16x1_SN_LDSB1_CLR1_GRVWA8_GRVWB16_GSU0_GSUC0_GSUWGMRR0_K1_LBSPPA512_LBSPPB512_LPA32_LPB32_MIWT2_2_PLR1_SU0_SUM0_SUS128_VWA2_VWB2_WGM6_WGMXCC1_WGMXCCGn1
    SolutionIndex: 98
    SolutionNameMin: Cijk_Ailk_Bjlk_B8NBS_BH_Bias_HAS_SAV_UserArgs_MT64x64x128_MI16x16x1_SN_LDSB1_CLR1_GRVWA16_GRVWB16_GSU0_GSUC0_GSUWGMRR0_K1_LBSPPA512_LBSPPB512_LPA32_LPB32_MIWT2_2_PLR1_SU0_SUM0_SUS128_VWA2_VWB2_WGM6_WGMXCC1_WGMXCCGn1
    SolutionIndex: 99
    SolutionNameMin: Cijk_Ailk_Bjlk_B8NBS_BH_Bias_HAS_SAV_UserArgs_MT64x64x128_MI16x16x1_SN_LDSB1_CLR1_GRVWA4_GRVWB16_GSU0_GSUC0_GSUWGMRR0_K1_LBSPPA512_LBSPPB512_LPA32_LPB32_MIWT2_2_PLR1_SU0_SUM0_SUS128_VWA2_VWB2_WGM8_WGMXCC1_WGMXCCGn1
    SolutionIndex: 100
    SolutionNameMin: Cijk_Ailk_Bjlk_B8NBS_BH_Bias_HAS_SAV_UserArgs_MT64x64x128_MI16x16x1_SN_LDSB1_CLR1_GRVWA16_GRVWB16_GSU0_GSUC0_GSUWGMRR0_K1_LBSPPA512_LBSPPB512_LPA32_LPB32_MIWT2_2_PLR1_SU0_SUM0_SUS128_VWA2_VWB2_WGM8_WGMXCC1_WGMXCCGn1
    SolutionIndex: 101
    SolutionNameMin: Cijk_Ailk_Bjlk_B8NBS_BH_Bias_HAS_SAV_UserArgs_MT32x64x128_MI16x16x1_SN_LDSB0_CLR1_GRVWA16_GRVWB16_GSU0_GSUC0_GSUWGMRR0_K1_LBSPPA256_LBSPPB512_LPA16_LPB32_MIWT1_2_PLR1_SU0_SUM0_SUS128_VWA1_VWB2_WGM4_WGMXCC1_WGMXCCGn1
    SolutionIndex: 102
    SolutionNameMin: Cijk_Ailk_Bjlk_B8NBS_BH_Bias_HAS_SAV_UserArgs_MT32x64x128_MI16x16x1_SN_LDSB0_CLR1_GRVWA16_GRVWB16_GSU0_GSUC0_GSUWGMRR0_K1_LBSPPA256_LBSPPB512_LPA16_LPB32_MIWT1_2_PLR1_SU0_SUM0_SUS128_VWA1_VWB2_WGM6_WGMXCC1_WGMXCCGn1
    SolutionIndex: 103
    SolutionNameMin: Cijk_Ailk_Bjlk_B8NBS_BH_Bias_HAS_SAV_UserArgs_MT32x64x128_MI16x16x1_SN_LDSB0_CLR1_GRVWA16_GRVWB16_GSU0_GSUC0_GSUWGMRR0_K1_LBSPPA256_LBSPPB512_LPA16_LPB32_MIWT1_2_PLR1_SU0_SUM0_SUS128_VWA1_VWB2_WGM8_WGMXCC1_WGMXCCGn1
    SolutionIndex: 104
    SolutionNameMin: Cijk_Ailk_Bjlk_B8NBS_BH_Bias_HAS_SAV_UserArgs_MT64x32x128_MI16x16x1_SN_LDSB0_CLR1_GRVWA4_GRVWB4_GSU0_GSUC0_GSUWGMRR0_K1_LBSPPA512_LBSPPB256_LPA32_LPB16_MIWT2_1_PLR1_SU0_SUM0_SUS128_VWA2_VWB1_WGM1_WGMXCC1_WGMXCCGn1
    SolutionIndex: 105
    SolutionNameMin: Cijk_Ailk_Bjlk_B8NBS_BH_Bias_HAS_SAV_UserArgs_MT64x32x128_MI16x16x1_SN_LDSB0_CLR1_GRVWA4_GRVWB8_GSU0_GSUC0_GSUWGMRR0_K1_LBSPPA512_LBSPPB256_LPA32_LPB16_MIWT2_1_PLR1_SU0_SUM0_SUS128_VWA2_VWB1_WGM1_WGMXCC1_WGMXCCGn1
    SolutionIndex: 106
    SolutionNameMin: Cijk_Ailk_Bjlk_B8NBS_BH_Bias_HAS_SAV_UserArgs_MT64x32x128_MI16x16x1_SN_LDSB0_CLR1_GRVWA16_GRVWB8_GSU0_GSUC0_GSUWGMRR0_K1_LBSPPA512_LBSPPB256_LPA32_LPB16_MIWT2_1_PLR1_SU0_SUM0_SUS128_VWA2_VWB1_WGM1_WGMXCC1_WGMXCCGn1
    SolutionIndex: 107
    SolutionNameMin: Cijk_Ailk_Bjlk_B8NBS_BH_Bias_HAS_SAV_UserArgs_MT64x32x128_MI16x16x1_SN_LDSB0_CLR1_GRVWA8_GRVWB16_GSU0_GSUC0_GSUWGMRR0_K1_LBSPPA512_LBSPPB256_LPA32_LPB16_MIWT2_1_PLR1_SU0_SUM0_SUS128_VWA2_VWB1_WGM1_WGMXCC1_WGMXCCGn1
    SolutionIndex: 108
    SolutionNameMin: Cijk_Ailk_Bjlk_B8NBS_BH_Bias_HAS_SAV_UserArgs_MT64x32x128_MI16x16x1_SN_LDSB0_CLR1_GRVWA16_GRVWB16_GSU0_GSUC0_GSUWGMRR0_K1_LBSPPA512_LBSPPB256_LPA32_LPB16_MIWT2_1_PLR1_SU0_SUM0_SUS128_VWA2_VWB1_WGM1_WGMXCC1_WGMXCCGn1
    SolutionIndex: 109
    SolutionNameMin: Cijk_Ailk_Bjlk_B8NBS_BH_Bias_HAS_SAV_UserArgs_MT32x32x128_MI16x16x1_SN_LDSB0_CLR1_GRVWA4_GRVWB4_GSU0_GSUC0_GSUWGMRR0_K1_LBSPPA256_LBSPPB256_LPA16_LPB16_MIWT1_1_PLR1_SU0_SUM0_SUS128_VWA1_VWB1_WGM1_WGMXCC1_WGMXCCGn1
    SolutionIndex: 110
    SolutionNameMin: Cijk_Ailk_Bjlk_B8NBS_BH_Bias_HAS_SAV_UserArgs_MT32x32x128_MI16x16x1_SN_LDSB0_CLR1_GRVWA8_GRVWB4_GSU0_GSUC0_GSUWGMRR0_K1_LBSPPA256_LBSPPB256_LPA16_LPB16_MIWT1_1_PLR1_SU0_SUM0_SUS128_VWA1_VWB1_WGM1_WGMXCC1_WGMXCCGn1
    SolutionIndex: 111
    SolutionNameMin: Cijk_Ailk_Bjlk_B8NBS_BH_Bias_HAS_SAV_UserArgs_MT32x32x128_MI16x16x1_SN_LDSB0_CLR1_GRVWA4_GRVWB8_GSU0_GSUC0_GSUWGMRR0_K1_LBSPPA256_LBSPPB256_LPA16_LPB16_MIWT1_1_PLR1_SU0_SUM0_SUS128_VWA1_VWB1_WGM1_WGMXCC1_WGMXCCGn1
    SolutionIndex: 112
    SolutionNameMin: Cijk_Ailk_Bjlk_B8NBS_BH_Bias_HAS_SAV_UserArgs_MT32x32x128_MI16x16x1_SN_LDSB0_CLR1_GRVWA8_GRVWB8_GSU0_GSUC0_GSUWGMRR0_K1_LBSPPA256_LBSPPB256_LPA16_LPB16_MIWT1_1_PLR1_SU0_SUM0_SUS128_VWA1_VWB1_WGM1_WGMXCC1_WGMXCCGn1
    SolutionIndex: 113
    SolutionNameMin: Cijk_Ailk_Bjlk_B8NBS_BH_Bias_HAS_SAV_UserArgs_MT32x32x128_MI16x16x1_SN_LDSB0_CLR1_GRVWA4_GRVWB16_GSU0_GSUC0_GSUWGMRR0_K1_LBSPPA256_LBSPPB256_LPA16_LPB16_MIWT1_1_PLR1_SU0_SUM0_SUS128_VWA1_VWB1_WGM1_WGMXCC1_WGMXCCGn1
    SolutionIndex: 114
    SolutionNameMin: Cijk_Ailk_Bjlk_B8NBS_BH_Bias_HAS_SAV_UserArgs_MT32x32x128_MI16x16x1_SN_LDSB0_CLR1_GRVWA8_GRVWB16_GSU0_GSUC0_GSUWGMRR0_K1_LBSPPA256_LBSPPB256_LPA16_LPB16_MIWT1_1_PLR1_SU0_SUM0_SUS128_VWA1_VWB1_WGM1_WGMXCC1_WGMXCCGn1
    SolutionIndex: 115
    SolutionNameMin: Cijk_Ailk_Bjlk_B8NBS_BH_Bias_HAS_SAV_UserArgs_MT32x32x128_MI16x16x1_SN_LDSB0_CLR1_GRVWA16_GRVWB16_GSU0_GSUC0_GSUWGMRR0_K1_LBSPPA256_LBSPPB256_LPA16_LPB16_MIWT1_1_PLR1_SU0_SUM0_SUS128_VWA1_VWB1_WGM1_WGMXCC1_WGMXCCGn1
    SolutionIndex: 116
    SolutionNameMin: Cijk_Ailk_Bjlk_B8NBS_BH_Bias_HAS_SAV_UserArgs_MT32x32x128_MI16x16x1_SN_LDSB0_CLR1_GRVWA4_GRVWB16_GSU0_GSUC0_GSUWGMRR0_K1_LBSPPA256_LBSPPB256_LPA16_LPB16_MIWT1_1_PLR1_SU0_SUM0_SUS128_VWA1_VWB1_WGM6_WGMXCC1_WGMXCCGn1
    SolutionIndex: 117
    SolutionNameMin: Cijk_Ailk_Bjlk_B8NBS_BH_Bias_HAS_SAV_UserArgs_MT128x64x256_MI16x16x1_SN_LDSB1_CLR1_GRVWA16_GRVWB16_GSU0_GSUC0_GSUWGMRR0_K1_LBSPPA1024_LBSPPB512_LPA64_LPB32_MIWT4_2_PLR1_SU0_SUM0_SUS256_VWA4_VWB2_WGM1_WGMXCC1_WGMXCCGn1
    SolutionIndex: 118
    SolutionNameMin: Cijk_Ailk_Bjlk_B8NBS_BH_Bias_HAS_SAV_UserArgs_MT128x64x256_MI16x16x1_SN_LDSB1_CLR1_GRVWA16_GRVWB16_GSU0_GSUC0_GSUWGMRR0_K1_LBSPPA1024_LBSPPB512_LPA64_LPB32_MIWT4_2_PLR1_SU0_SUM0_SUS256_VWA4_VWB2_WGM4_WGMXCC1_WGMXCCGn1
    SolutionIndex: 119
    SolutionNameMin: Cijk_Ailk_Bjlk_B8NBS_BH_Bias_HAS_SAV_UserArgs_MT64x64x256_MI16x16x1_SN_LDSB1_CLR1_GRVWA4_GRVWB16_GSU0_GSUC0_GSUWGMRR0_K1_LBSPPA512_LBSPPB512_LPA32_LPB32_MIWT2_2_PLR1_SU0_SUM0_SUS256_VWA2_VWB2_WGM1_WGMXCC1_WGMXCCGn1
    SolutionIndex: 120
    SolutionNameMin: Cijk_Ailk_Bjlk_B8NBS_BH_Bias_HAS_SAV_UserArgs_MT64x64x256_MI16x16x1_SN_LDSB1_CLR1_GRVWA16_GRVWB16_GSU0_GSUC0_GSUWGMRR0_K1_LBSPPA512_LBSPPB512_LPA32_LPB32_MIWT2_2_PLR1_SU0_SUM0_SUS256_VWA2_VWB2_WGM1_WGMXCC1_WGMXCCGn1
    SolutionIndex: 121
    SolutionNameMin: Cijk_Ailk_Bjlk_B8NBS_BH_Bias_HAS_SAV_UserArgs_MT64x32x256_MI16x16x1_SN_LDSB1_CLR1_GRVWA16_GRVWB16_GSU0_GSUC0_GSUWGMRR0_K1_LBSPPA512_LBSPPB256_LPA32_LPB16_MIWT2_1_PLR1_SU0_SUM0_SUS256_VWA2_VWB1_WGM1_WGMXCC1_WGMXCCGn1
    SolutionIndex: 122
    SolutionNameMin: Cijk_Ailk_Bjlk_B8NBS_BH_Bias_HAS_SAV_UserArgs_MT64x32x256_MI16x16x1_SN_LDSB1_CLR1_GRVWA16_GRVWB16_GSU0_GSUC0_GSUWGMRR0_K1_LBSPPA512_LBSPPB256_LPA32_LPB16_MIWT2_1_PLR1_SU0_SUM0_SUS256_VWA2_VWB1_WGM6_WGMXCC1_WGMXCCGn1
    SolutionIndex: 123
    SolutionNameMin: Cijk_Ailk_Bjlk_B8NBS_BH_Bias_HAS_SAV_UserArgs_MT64x32x256_MI16x16x1_SN_LDSB1_CLR1_GRVWA16_GRVWB16_GSU0_GSUC0_GSUWGMRR0_K1_LBSPPA512_LBSPPB256_LPA32_LPB16_MIWT2_1_PLR1_SU0_SUM0_SUS256_VWA2_VWB1_WGM8_WGMXCC1_WGMXCCGn1
    SolutionIndex: 124
    SolutionNameMin: Cijk_Ailk_Bjlk_B8NBS_BH_Bias_HAS_SAV_UserArgs_MT32x32x256_MI16x16x1_SN_LDSB1_CLR1_GRVWA16_GRVWB16_GSU0_GSUC0_GSUWGMRR0_K1_LBSPPA256_LBSPPB256_LPA16_LPB16_MIWT1_1_PLR1_SU0_SUM0_SUS256_VWA1_VWB1_WGM1_WGMXCC1_WGMXCCGn1
    SolutionIndex: 125
    SolutionNameMin: Cijk_Ailk_Bjlk_B8NBS_BH_Bias_HAS_SAV_UserArgs_MT32x32x256_MI16x16x1_SN_LDSB1_CLR1_GRVWA16_GRVWB16_GSU0_GSUC0_GSUWGMRR0_K1_LBSPPA256_LBSPPB256_LPA16_LPB16_MIWT1_1_PLR1_SU0_SUM0_SUS256_VWA1_VWB1_WGM4_WGMXCC1_WGMXCCGn1
    SolutionIndex: 126
    SolutionNameMin: Cijk_Ailk_Bjlk_B8NBS_BH_Bias_HAS_SAV_UserArgs_MT32x32x256_MI16x16x1_SN_LDSB1_CLR1_GRVWA16_GRVWB16_GSU0_GSUC0_GSUWGMRR0_K1_LBSPPA256_LBSPPB256_LPA16_LPB16_MIWT1_1_PLR1_SU0_SUM0_SUS256_VWA1_VWB1_WGM6_WGMXCC1_WGMXCCGn1
- - - [128, 128, 1, 128, 128, 128, 128, 128]
    - [112, 0.5]
  - - [128, 128, 1, 256, 128, 128, 128, 128]
    - [109, 0.89]
  - - [128, 128, 1, 512, 128, 128, 128, 128]
    - [109, 1.48]
  - - [128, 128, 1, 1024, 128, 128, 128, 128]
    - [113, 2.2]
  - - [128, 128, 1, 2048, 128, 128, 128, 128]
    - [114, 2.93]
  - - [128, 128, 1, 4096, 128, 128, 128, 128]
    - [114, 3.5]
  - - [128, 128, 1, 8192, 128, 128, 128, 128]
    - [124, 3.91]
  - - [128, 256, 1, 128, 128, 128, 128, 256]
    - [50, 0.68]
  - - [128, 256, 1, 256, 128, 128, 128, 256]
    - [62, 1.43]
  - - [128, 256, 1, 512, 128, 128, 128, 256]
    - [66, 2.72]
  - - [128, 256, 1, 1024, 128, 128, 128, 256]
    - [114, 4.44]
  - - [128, 256, 1, 2048, 128, 128, 128, 256]
    - [114, 5.86]
  - - [128, 256, 1, 4096, 128, 128, 128, 256]
    - [114, 7.02]
  - - [128, 256, 1, 8192, 128, 128, 128, 256]
    - [124, 7.9]
  - - [128, 512, 1, 128, 128, 128, 128, 512]
    - [66, 2.06]
  - - [128, 512, 1, 256, 128, 128, 128, 512]
    - [66, 3.65]
  - - [128, 512, 1, 512, 128, 128, 128, 512]
    - [109, 5.92]
  - - [128, 512, 1, 1024, 128, 128, 128, 512]
    - [112, 8.75]
  - - [128, 512, 1, 2048, 128, 128, 128, 512]
    - [115, 11.62]
  - - [128, 512, 1, 4096, 128, 128, 128, 512]
    - [114, 14.0]
  - - [128, 512, 1, 8192, 128, 128, 128, 512]
    - [124, 14.87]
  - - [128, 1024, 1, 128, 128, 128, 128, 1024]
    - [66, 4.05]
  - - [128, 1024, 1, 256, 128, 128, 128, 1024]
    - [66, 6.78]
  - - [128, 1024, 1, 512, 128, 128, 128, 1024]
    - [110, 11.24]
  - - [128, 1024, 1, 1024, 128, 128, 128, 1024]
    - [112, 16.59]
  - - [128, 1024, 1, 2048, 128, 128, 128, 1024]
    - [114, 22.57]
  - - [128, 1024, 1, 4096, 128, 128, 128, 1024]
    - [124, 25.53]
  - - [128, 1024, 1, 8192, 128, 128, 128, 1024]
    - [116, 27.71]
  - - [128, 2048, 1, 128, 128, 128, 128, 2048]
    - [61, 7.2]
  - - [128, 2048, 1, 256, 128, 128, 128, 2048]
    - [64, 12.67]
  - - [128, 2048, 1, 512, 128, 128, 128, 2048]
    - [105, 20.3]
  - - [128, 2048, 1, 1024, 128, 128, 128, 2048]
    - [107, 31.02]
  - - [128, 2048, 1, 2048, 128, 128, 128, 2048]
    - [121, 38.81]
  - - [128, 2048, 1, 4096, 128, 128, 128, 2048]
    - [122, 47.29]
  - - [128, 2048, 1, 8192, 128, 128, 128, 2048]
    - [122, 52.99]
  - - [128, 4096, 1, 128, 128, 128, 128, 4096]
    - [56, 13.59]
  - - [128, 4096, 1, 256, 128, 128, 128, 4096]
    - [91, 23.16]
  - - [128, 4096, 1, 512, 128, 128, 128, 4096]
    - [91, 37.41]
  - - [128, 4096, 1, 1024, 128, 128, 128, 4096]
    - [93, 53.88]
  - - [128, 4096, 1, 2048, 128, 128, 128, 4096]
    - [120, 66.69]
  - - [128, 4096, 1, 4096, 128, 128, 128, 4096]
    - [120, 81.45]
  - - [128, 4096, 1, 8192, 128, 128, 128, 4096]
    - [120, 91.22]
  - - [128, 8192, 1, 128, 128, 128, 128, 8192]
    - [48, 22.35]
  - - [128, 8192, 1, 256, 128, 128, 128, 8192]
    - [53, 38.5]
  - - [128, 8192, 1, 512, 128, 128, 128, 8192]
    - [49, 59.88]
  - - [128, 8192, 1, 1024, 128, 128, 128, 8192]
    - [51, 84.7]
  - - [128, 8192, 1, 2048, 128, 128, 128, 8192]
    - [87, 105.14]
  - - [128, 8192, 1, 4096, 128, 128, 128, 8192]
    - [117, 123.91]
  - - [128, 8192, 1, 8192, 128, 128, 128, 8192]
    - [89, 127.45]
  - - [256, 128, 1, 128, 256, 256, 256, 128]
    - [68, 1.05]
  - - [256, 128, 1, 256, 256, 256, 256, 128]
    - [68, 1.83]
  - - [256, 128, 1, 512, 256, 256, 256, 128]
    - [114, 2.92]
  - - [256, 128, 1, 1024, 256, 256, 256, 128]
    - [114, 4.38]
  - - [256, 128, 1, 2048, 256, 256, 256, 128]
    - [114, 5.82]
  - - [256, 128, 1, 4096, 256, 256, 256, 128]
    - [114, 7.01]
  - - [256, 128, 1, 8192, 256, 256, 256, 128]
    - [124, 7.9]
  - - [256, 256, 1, 128, 256, 256, 256, 256]
    - [66, 2.07]
  - - [256, 256, 1, 256, 256, 256, 256, 256]
    - [110, 3.66]
  - - [256, 256, 1, 512, 256, 256, 256, 256]
    - [112, 6.02]
  - - [256, 256, 1, 1024, 256, 256, 256, 256]
    - [114, 8.9]
  - - [256, 256, 1, 2048, 256, 256, 256, 256]
    - [114, 11.73]
  - - [256, 256, 1, 4096, 256, 256, 256, 256]
    - [114, 14.14]
  - - [256, 256, 1, 8192, 256, 256, 256, 256]
    - [124, 15.6]
  - - [256, 512, 1, 128, 256, 256, 256, 512]
    - [66, 4.12]
  - - [256, 512, 1, 256, 256, 256, 256, 512]
    - [66, 7.12]
  - - [256, 512, 1, 512, 256, 256, 256, 512]
    - [109, 11.65]
  - - [256, 512, 1, 1024, 256, 256, 256, 512]
    - [112, 17.23]
  - - [256, 512, 1, 2048, 256, 256, 256, 512]
    - [114, 23.02]
  - - [256, 512, 1, 4096, 256, 256, 256, 512]
    - [114, 27.52]
  - - [256, 512, 1, 8192, 256, 256, 256, 512]
    - [124, 30.4]
  - - [256, 1024, 1, 128, 256, 256, 256, 1024]
    - [63, 7.62]
  - - [256, 1024, 1, 256, 256, 256, 256, 1024]
    - [64, 13.15]
  - - [256, 1024, 1, 512, 256, 256, 256, 1024]
    - [106, 21.04]
  - - [256, 1024, 1, 1024, 256, 256, 256, 1024]
    - [105, 30.56]
  - - [256, 1024, 1, 2048, 256, 256, 256, 1024]
    - [121, 40.64]
  - - [256, 1024, 1, 4096, 256, 256, 256, 1024]
    - [121, 48.49]
  - - [256, 1024, 1, 8192, 256, 256, 256, 1024]
    - [122, 53.99]
  - - [256, 2048, 1, 128, 256, 256, 256, 2048]
    - [55, 13.54]
  - - [256, 2048, 1, 256, 256, 256, 256, 2048]
    - [58, 22.75]
  - - [256, 2048, 1, 512, 256, 256, 256, 2048]
    - [92, 36.28]
  - - [256, 2048, 1, 1024, 256, 256, 256, 2048]
    - [93, 53.07]
  - - [256, 2048, 1, 2048, 256, 256, 256, 2048]
    - [94, 66.87]
  - - [256, 2048, 1, 4096, 256, 256, 256, 2048]
    - [93, 78.94]
  - - [256, 2048, 1, 8192, 256, 256, 256, 2048]
    - [119, 86.82]
  - - [256, 4096, 1, 128, 256, 256, 256, 4096]
    - [53, 23.08]
  - - [256, 4096, 1, 256, 256, 256, 256, 4096]
    - [53, 39.83]
  - - [256, 4096, 1, 512, 256, 256, 256, 4096]
    - [53, 61.27]
  - - [256, 4096, 1, 1024, 256, 256, 256, 4096]
    - [52, 86.21]
  - - [256, 4096, 1, 2048, 256, 256, 256, 4096]
    - [87, 107.41]
  - - [256, 4096, 1, 4096, 256, 256, 256, 4096]
    - [89, 123.79]
  - - [256, 4096, 1, 8192, 256, 256, 256, 4096]
    - [118, 129.61]
  - - [256, 8192, 1, 128, 256, 256, 256, 8192]
    - [33, 34.98]
  - - [256, 8192, 1, 256, 256, 256, 256, 8192]
    - [33, 58.24]
  - - [256, 8192, 1, 512, 256, 256, 256, 8192]
    - [39, 90.24]
  - - [256, 8192, 1, 1024, 256, 256, 256, 8192]
    - [85, 127.17]
  - - [256, 8192, 1, 2048, 256, 256, 256, 8192]
    - [85, 154.27]
  - - [256, 8192, 1, 4096, 256, 256, 256, 8192]
    - [85, 172.88]
  - - [256, 8192, 1, 8192, 256, 256, 256, 8192]
    - [85, 162.95]
  - - [512, 128, 1, 128, 512, 512, 512, 128]
    - [109, 2.09]
  - - [512, 128, 1, 256, 512, 512, 512, 128]
    - [69, 3.63]
  - - [512, 128, 1, 512, 512, 512, 512, 128]
    - [111, 5.92]
  - - [512, 128, 1, 1024, 512, 512, 512, 128]
    - [113, 8.87]
  - - [512, 128, 1, 2048, 512, 512, 512, 128]
    - [114, 11.85]
  - - [512, 128, 1, 4096, 512, 512, 512, 128]
    - [114, 14.1]
  - - [512, 128, 1, 8192, 512, 512, 512, 128]
    - [126, 14.81]
  - - [512, 256, 1, 128, 512, 512, 512, 256]
    - [66, 4.11]
  - - [512, 256, 1, 256, 512, 512, 512, 256]
    - [66, 7.18]
  - - [512, 256, 1, 512, 512, 512, 512, 256]
    - [111, 11.68]
  - - [512, 256, 1, 1024, 512, 512, 512, 256]
    - [112, 17.37]
  - - [512, 256, 1, 2048, 512, 512, 512, 256]
    - [112, 22.96]
  - - [512, 256, 1, 4096, 512, 512, 512, 256]
    - [114, 27.81]
  - - [512, 256, 1, 8192, 512, 512, 512, 256]
    - [125, 28.0]
  - - [512, 512, 1, 128, 512, 512, 512, 512]
    - [65, 7.59]
  - - [512, 512, 1, 256, 512, 512, 512, 512]
    - [104, 13.07]
  - - [512, 512, 1, 512, 512, 512, 512, 512]
    - [105, 21.24]
  - - [512, 512, 1, 1024, 512, 512, 512, 512]
    - [107, 30.84]
  - - [512, 512, 1, 2048, 512, 512, 512, 512]
    - [121, 39.85]
  - - [512, 512, 1, 4096, 512, 512, 512, 512]
    - [121, 46.74]
  - - [512, 512, 1, 8192, 512, 512, 512, 512]
    - [108, 50.22]
  - - [512, 1024, 1, 128, 512, 512, 512, 1024]
    - [57, 13.53]
  - - [512, 1024, 1, 256, 512, 512, 512, 1024]
    - [56, 23.3]
  - - [512, 1024, 1, 512, 512, 512, 512, 1024]
    - [93, 36.6]
  - - [512, 1024, 1, 1024, 512, 512, 512, 1024]
    - [93, 52.41]
  - - [512, 1024, 1, 2048, 512, 512, 512, 1024]
    - [94, 68.4]
  - - [512, 1024, 1, 4096, 512, 512, 512, 1024]
    - [94, 75.08]
  - - [512, 1024, 1, 8192, 512, 512, 512, 1024]
    - [98, 80.72]
  - - [512, 2048, 1, 128, 512, 512, 512, 2048]
    - [53, 22.62]
  - - [512, 2048, 1, 256, 512, 512, 512, 2048]
    - [49, 39.0]
  - - [512, 2048, 1, 512, 512, 512, 512, 2048]
    - [52, 60.99]
  - - [512, 2048, 1, 1024, 512, 512, 512, 2048]
    - [52, 85.83]
  - - [512, 2048, 1, 2048, 512, 512, 512, 2048]
    - [52, 106.45]
  - - [512, 2048, 1, 4096, 512, 512, 512, 2048]
    - [87, 124.07]
  - - [512, 2048, 1, 8192, 512, 512, 512, 2048]
    - [87, 128.21]
  - - [512, 4096, 1, 128, 512, 512, 512, 4096]
    - [35, 33.99]
  - - [512, 4096, 1, 256, 512, 512, 512, 4096]
    - [33, 59.12]
  - - [512, 4096, 1, 512, 512, 512, 512, 4096]
    - [40, 89.14]
  - - [512, 4096, 1, 1024, 512, 512, 512, 4096]
    - [84, 124.95]
  - - [512, 4096, 1, 2048, 512, 512, 512, 4096]
    - [40, 153.47]
  - - [512, 4096, 1, 4096, 512, 512, 512, 4096]
    - [40, 171.49]
  - - [512, 4096, 1, 8192, 512, 512, 512, 4096]
    - [40, 163.6]
  - - [512, 8192, 1, 128, 512, 512, 512, 8192]
    - [25, 49.5]
  - - [512, 8192, 1, 256, 512, 512, 512, 8192]
    - [25, 84.73]
  - - [512, 8192, 1, 512, 512, 512, 512, 8192]
    - [27, 131.32]
  - - [512, 8192, 1, 1024, 512, 512, 512, 8192]
    - [27, 178.88]
  - - [512, 8192, 1, 2048, 512, 512, 512, 8192]
    - [26, 211.26]
  - - [512, 8192, 1, 4096, 512, 512, 512, 8192]
    - [27, 223.48]
  - - [512, 8192, 1, 8192, 512, 512, 512, 8192]
    - [80, 210.35]
  - - [1024, 128, 1, 128, 1024, 1024, 1024, 128]
    - [67, 4.05]
  - - [1024, 128, 1, 256, 1024, 1024, 1024, 128]
    - [68, 7.1]
  - - [1024, 128, 1, 512, 1024, 1024, 1024, 128]
    - [109, 11.41]
  - - [1024, 128, 1, 1024, 1024, 1024, 1024, 128]
    - [114, 17.1]
  - - [1024, 128, 1, 2048, 1024, 1024, 1024, 128]
    - [114, 22.67]
  - - [1024, 128, 1, 4096, 1024, 1024, 1024, 128]
    - [125, 25.15]
  - - [1024, 128, 1, 8192, 1024, 1024, 1024, 128]
    - [126, 26.64]
  - - [1024, 256, 1, 128, 1024, 1024, 1024, 256]
    - [63, 7.39]
  - - [1024, 256, 1, 256, 1024, 1024, 1024, 256]
    - [104, 12.79]
  - - [1024, 256, 1, 512, 1024, 1024, 1024, 256]
    - [105, 20.86]
  - - [1024, 256, 1, 1024, 1024, 1024, 1024, 256]
    - [105, 30.45]
  - - [1024, 256, 1, 2048, 1024, 1024, 1024, 256]
    - [121, 40.61]
  - - [1024, 256, 1, 4096, 1024, 1024, 1024, 256]
    - [102, 46.37]
  - - [1024, 256, 1, 8192, 1024, 1024, 1024, 256]
    - [123, 49.05]
  - - [1024, 512, 1, 128, 1024, 1024, 1024, 512]
    - [57, 13.27]
  - - [1024, 512, 1, 256, 1024, 1024, 1024, 512]
    - [57, 23.03]
  - - [1024, 512, 1, 512, 1024, 1024, 1024, 512]
    - [56, 36.56]
  - - [1024, 512, 1, 1024, 1024, 1024, 1024, 512]
    - [93, 52.81]
  - - [1024, 512, 1, 2048, 1024, 1024, 1024, 512]
    - [93, 68.35]
  - - [1024, 512, 1, 4096, 1024, 1024, 1024, 512]
    - [99, 75.84]
  - - [1024, 512, 1, 8192, 1024, 1024, 1024, 512]
    - [98, 81.5]
  - - [1024, 1024, 1, 128, 1024, 1024, 1024, 1024]
    - [48, 22.76]
  - - [1024, 1024, 1, 256, 1024, 1024, 1024, 1024]
    - [49, 39.2]
  - - [1024, 1024, 1, 512, 1024, 1024, 1024, 1024]
    - [49, 61.46]
  - - [1024, 1024, 1, 1024, 1024, 1024, 1024, 1024]
    - [52, 86.35]
  - - [1024, 1024, 1, 2048, 1024, 1024, 1024, 1024]
    - [87, 107.17]
  - - [1024, 1024, 1, 4096, 1024, 1024, 1024, 1024]
    - [88, 123.7]
  - - [1024, 1024, 1, 8192, 1024, 1024, 1024, 1024]
    - [87, 128.64]
  - - [1024, 2048, 1, 128, 1024, 1024, 1024, 2048]
    - [83, 34.41]
  - - [1024, 2048, 1, 256, 1024, 1024, 1024, 2048]
    - [33, 59.13]
  - - [1024, 2048, 1, 512, 1024, 1024, 1024, 2048]
    - [40, 90.62]
  - - [1024, 2048, 1, 1024, 1024, 1024, 1024, 2048]
    - [40, 124.22]
  - - [1024, 2048, 1, 2048, 1024, 1024, 1024, 2048]
    - [40, 154.65]
  - - [1024, 2048, 1, 4096, 1024, 1024, 1024, 2048]
    - [40, 172.3]
  - - [1024, 2048, 1, 8192, 1024, 1024, 1024, 2048]
    - [46, 162.55]
  - - [1024, 4096, 1, 128, 1024, 1024, 1024, 4096]
    - [30, 51.65]
  - - [1024, 4096, 1, 256, 1024, 1024, 1024, 4096]
    - [30, 87.5]
  - - [1024, 4096, 1, 512, 1024, 1024, 1024, 4096]
    - [28, 132.03]
  - - [1024, 4096, 1, 1024, 1024, 1024, 1024, 4096]
    - [27, 179.53]
  - - [1024, 4096, 1, 2048, 1024, 1024, 1024, 4096]
    - [27, 216.28]
  - - [1024, 4096, 1, 4096, 1024, 1024, 1024, 4096]
    - [27, 221.91]
  - - [1024, 4096, 1, 8192, 1024, 1024, 1024, 4096]
    - [79, 209.77]
  - - [1024, 8192, 1, 128, 1024, 1024, 1024, 8192]
    - [23, 65.5]
  - - [1024, 8192, 1, 256, 1024, 1024, 1024, 8192]
    - [22, 106.24]
  - - [1024, 8192, 1, 512, 1024, 1024, 1024, 8192]
    - [7, 160.09]
  - - [1024, 8192, 1, 1024, 1024, 1024, 1024, 8192]
    - [12, 210.0]
  - - [1024, 8192, 1, 2048, 1024, 1024, 1024, 8192]
    - [7, 244.06]
  - - [1024, 8192, 1, 4096, 1024, 1024, 1024, 8192]
    - [5, 242.41]
  - - [1024, 8192, 1, 8192, 1024, 1024, 1024, 8192]
    - [7, 258.94]
  - - [2048, 128, 1, 128, 2048, 2048, 2048, 128]
    - [63, 7.49]
  - - [2048, 128, 1, 256, 2048, 2048, 2048, 128]
    - [63, 12.86]
  - - [2048, 128, 1, 512, 2048, 2048, 2048, 128]
    - [104, 20.84]
  - - [2048, 128, 1, 1024, 2048, 2048, 2048, 128]
    - [107, 30.68]
  - - [2048, 128, 1, 2048, 2048, 2048, 2048, 128]
    - [103, 37.68]
  - - [2048, 128, 1, 4096, 2048, 2048, 2048, 128]
    - [101, 45.3]
  - - [2048, 128, 1, 8192, 2048, 2048, 2048, 128]
    - [102, 50.49]
  - - [2048, 256, 1, 128, 2048, 2048, 2048, 256]
    - [55, 13.31]
  - - [2048, 256, 1, 256, 2048, 2048, 2048, 256]
    - [56, 22.77]
  - - [2048, 256, 1, 512, 2048, 2048, 2048, 256]
    - [60, 36.12]
  - - [2048, 256, 1, 1024, 2048, 2048, 2048, 256]
    - [93, 52.8]
  - - [2048, 256, 1, 2048, 2048, 2048, 2048, 256]
    - [97, 67.02]
  - - [2048, 256, 1, 4096, 2048, 2048, 2048, 256]
    - [99, 78.03]
  - - [2048, 256, 1, 8192, 2048, 2048, 2048, 256]
    - [95, 85.17]
  - - [2048, 512, 1, 128, 2048, 2048, 2048, 512]
    - [86, 22.4]
  - - [2048, 512, 1, 256, 2048, 2048, 2048, 512]
    - [49, 39.15]
  - - [2048, 512, 1, 512, 2048, 2048, 2048, 512]
    - [49, 61.1]
  - - [2048, 512, 1, 1024, 2048, 2048, 2048, 512]
    - [52, 86.24]
  - - [2048, 512, 1, 2048, 2048, 2048, 2048, 512]
    - [88, 106.57]
  - - [2048, 512, 1, 4096, 2048, 2048, 2048, 512]
    - [90, 122.86]
  - - [2048, 512, 1, 8192, 2048, 2048, 2048, 512]
    - [90, 128.38]
  - - [2048, 1024, 1, 128, 2048, 2048, 2048, 1024]
    - [34, 34.68]
  - - [2048, 1024, 1, 256, 2048, 2048, 2048, 1024]
    - [33, 58.6]
  - - [2048, 1024, 1, 512, 2048, 2048, 2048, 1024]
    - [39, 90.3]
  - - [2048, 1024, 1, 1024, 2048, 2048, 2048, 1024]
    - [46, 123.16]
  - - [2048, 1024, 1, 2048, 2048, 2048, 2048, 1024]
    - [46, 153.96]
  - - [2048, 1024, 1, 4096, 2048, 2048, 2048, 1024]
    - [41, 171.27]
  - - [2048, 1024, 1, 8192, 2048, 2048, 2048, 1024]
    - [46, 160.35]
  - - [2048, 2048, 1, 128, 2048, 2048, 2048, 2048]
    - [24, 48.73]
  - - [2048, 2048, 1, 256, 2048, 2048, 2048, 2048]
    - [24, 83.99]
  - - [2048, 2048, 1, 512, 2048, 2048, 2048, 2048]
    - [27, 129.71]
  - - [2048, 2048, 1, 1024, 2048, 2048, 2048, 2048]
    - [27, 176.45]
  - - [2048, 2048, 1, 2048, 2048, 2048, 2048, 2048]
    - [32, 209.89]
  - - [2048, 2048, 1, 4096, 2048, 2048, 2048, 2048]
    - [82, 217.93]
  - - [2048, 2048, 1, 8192, 2048, 2048, 2048, 2048]
    - [79, 210.27]
  - - [2048, 4096, 1, 128, 2048, 2048, 2048, 4096]
    - [3, 59.3]
  - - [2048, 4096, 1, 256, 2048, 2048, 2048, 4096]
    - [3, 101.06]
  - - [2048, 4096, 1, 512, 2048, 2048, 2048, 4096]
    - [5, 155.65]
  - - [2048, 4096, 1, 1024, 2048, 2048, 2048, 4096]
    - [3, 207.71]
  - - [2048, 4096, 1, 2048, 2048, 2048, 2048, 4096]
    - [5, 239.8]
  - - [2048, 4096, 1, 4096, 2048, 2048, 2048, 4096]
    - [77, 239.45]
  - - [2048, 4096, 1, 8192, 2048, 2048, 2048, 4096]
    - [5, 255.99]
  - - [2048, 8192, 1, 128, 2048, 2048, 2048, 8192]
    - [3, 66.27]
  - - [2048, 8192, 1, 256, 2048, 2048, 2048, 8192]
    - [3, 111.81]
  - - [2048, 8192, 1, 512, 2048, 2048, 2048, 8192]
    - [1, 165.53]
  - - [2048, 8192, 1, 1024, 2048, 2048, 2048, 8192]
    - [5, 204.43]
  - - [2048, 8192, 1, 2048, 2048, 2048, 2048, 8192]
    - [76, 217.03]
  - - [2048, 8192, 1, 4096, 2048, 2048, 2048, 8192]
    - [75, 267.11]
  - - [2048, 8192, 1, 8192, 2048, 2048, 2048, 8192]
    - [11, 318.2]
  - - [4096, 128, 1, 128, 4096, 4096, 4096, 128]
    - [56, 13.77]
  - - [4096, 128, 1, 256, 4096, 4096, 4096, 128]
    - [56, 23.86]
  - - [4096, 128, 1, 512, 4096, 4096, 4096, 128]
    - [59, 37.25]
  - - [4096, 128, 1, 1024, 4096, 4096, 4096, 128]
    - [93, 54.15]
  - - [4096, 128, 1, 2048, 4096, 4096, 4096, 128]
    - [100, 66.24]
  - - [4096, 128, 1, 4096, 4096, 4096, 4096, 128]
    - [98, 77.86]
  - - [4096, 128, 1, 8192, 4096, 4096, 4096, 128]
    - [96, 84.58]
  - - [4096, 256, 1, 128, 4096, 4096, 4096, 256]
    - [53, 23.02]
  - - [4096, 256, 1, 256, 4096, 4096, 4096, 256]
    - [53, 39.41]
  - - [4096, 256, 1, 512, 4096, 4096, 4096, 256]
    - [53, 60.79]
  - - [4096, 256, 1, 1024, 4096, 4096, 4096, 256]
    - [52, 85.72]
  - - [4096, 256, 1, 2048, 4096, 4096, 4096, 256]
    - [90, 106.49]
  - - [4096, 256, 1, 4096, 4096, 4096, 4096, 256]
    - [90, 124.4]
  - - [4096, 256, 1, 8192, 4096, 4096, 4096, 256]
    - [88, 128.93]
  - - [4096, 512, 1, 128, 4096, 4096, 4096, 512]
    - [33, 34.2]
  - - [4096, 512, 1, 256, 4096, 4096, 4096, 512]
    - [33, 59.01]
  - - [4096, 512, 1, 512, 4096, 4096, 4096, 512]
    - [38, 90.23]
  - - [4096, 512, 1, 1024, 4096, 4096, 4096, 512]
    - [45, 123.26]
  - - [4096, 512, 1, 2048, 4096, 4096, 4096, 512]
    - [46, 153.13]
  - - [4096, 512, 1, 4096, 4096, 4096, 4096, 512]
    - [43, 173.6]
  - - [4096, 512, 1, 8192, 4096, 4096, 4096, 512]
    - [43, 163.44]
  - - [4096, 1024, 1, 128, 4096, 4096, 4096, 1024]
    - [25, 49.22]
  - - [4096, 1024, 1, 256, 4096, 4096, 4096, 1024]
    - [30, 83.42]
  - - [4096, 1024, 1, 512, 4096, 4096, 4096, 1024]
    - [32, 129.36]
  - - [4096, 1024, 1, 1024, 4096, 4096, 4096, 1024]
    - [32, 174.93]
  - - [4096, 1024, 1, 2048, 4096, 4096, 4096, 1024]
    - [32, 211.4]
  - - [4096, 1024, 1, 4096, 4096, 4096, 4096, 1024]
    - [81, 218.52]
  - - [4096, 1024, 1, 8192, 4096, 4096, 4096, 1024]
    - [79, 210.37]
  - - [4096, 2048, 1, 128, 4096, 4096, 4096, 2048]
    - [3, 57.82]
  - - [4096, 2048, 1, 256, 4096, 4096, 4096, 2048]
    - [3, 98.75]
  - - [4096, 2048, 1, 512, 4096, 4096, 4096, 2048]
    - [5, 150.78]
  - - [4096, 2048, 1, 1024, 4096, 4096, 4096, 2048]
    - [6, 206.87]
  - - [4096, 2048, 1, 2048, 4096, 4096, 4096, 2048]
    - [11, 237.4]
  - - [4096, 2048, 1, 4096, 4096, 4096, 4096, 2048]
    - [74, 237.87]
  - - [4096, 2048, 1, 8192, 4096, 4096, 4096, 2048]
    - [16, 262.71]
  - - [4096, 4096, 1, 128, 4096, 4096, 4096, 4096]
    - [3, 64.0]
  - - [4096, 4096, 1, 256, 4096, 4096, 4096, 4096]
    - [8, 108.82]
  - - [4096, 4096, 1, 512, 4096, 4096, 4096, 4096]
    - [10, 162.5]
  - - [4096, 4096, 1, 1024, 4096, 4096, 4096, 4096]
    - [9, 199.54]
  - - [4096, 4096, 1, 2048, 4096, 4096, 4096, 4096]
    - [73, 216.42]
  - - [4096, 4096, 1, 4096, 4096, 4096, 4096, 4096]
    - [7, 269.03]
  - - [4096, 4096, 1, 8192, 4096, 4096, 4096, 4096]
    - [72, 319.7]
  - - [4096, 8192, 1, 128, 4096, 4096, 4096, 8192]
    - [20, 71.34]
  - - [4096, 8192, 1, 256, 4096, 4096, 4096, 8192]
    - [21, 111.17]
  - - [4096, 8192, 1, 512, 4096, 4096, 4096, 8192]
    - [15, 160.38]
  - - [4096, 8192, 1, 1024, 4096, 4096, 4096, 8192]
    - [28, 203.02]
  - - [4096, 8192, 1, 2048, 4096, 4096, 4096, 8192]
    - [2, 260.23]
  - - [4096, 8192, 1, 4096, 4096, 4096, 4096, 8192]
    - [5, 300.31]
  - - [4096, 8192, 1, 8192, 4096, 4096, 4096, 8192]
    - [71, 338.56]
  - - [8192, 128, 1, 128, 8192, 8192, 8192, 128]
    - [54, 21.69]
  - - [8192, 128, 1, 256, 8192, 8192, 8192, 128]
    - [47, 38.06]
  - - [8192, 128, 1, 512, 8192, 8192, 8192, 128]
    - [52, 60.18]
  - - [8192, 128, 1, 1024, 8192, 8192, 8192, 128]
    - [52, 84.55]
  - - [8192, 128, 1, 2048, 8192, 8192, 8192, 128]
    - [90, 105.72]
  - - [8192, 128, 1, 4096, 8192, 8192, 8192, 128]
    - [88, 123.57]
  - - [8192, 128, 1, 8192, 8192, 8192, 8192, 128]
    - [90, 124.97]
  - - [8192, 256, 1, 128, 8192, 8192, 8192, 256]
    - [37, 33.64]
  - - [8192, 256, 1, 256, 8192, 8192, 8192, 256]
    - [36, 57.21]
  - - [8192, 256, 1, 512, 8192, 8192, 8192, 256]
    - [44, 88.26]
  - - [8192, 256, 1, 1024, 8192, 8192, 8192, 256]
    - [42, 122.36]
  - - [8192, 256, 1, 2048, 8192, 8192, 8192, 256]
    - [43, 151.98]
  - - [8192, 256, 1, 4096, 8192, 8192, 8192, 256]
    - [44, 171.74]
  - - [8192, 256, 1, 8192, 8192, 8192, 8192, 256]
    - [45, 160.51]
  - - [8192, 512, 1, 128, 8192, 8192, 8192, 512]
    - [24, 48.25]
  - - [8192, 512, 1, 256, 8192, 8192, 8192, 512]
    - [25, 81.05]
  - - [8192, 512, 1, 512, 8192, 8192, 8192, 512]
    - [28, 126.75]
  - - [8192, 512, 1, 1024, 8192, 8192, 8192, 512]
    - [28, 174.07]
  - - [8192, 512, 1, 2048, 8192, 8192, 8192, 512]
    - [17, 210.92]
  - - [8192, 512, 1, 4096, 8192, 8192, 8192, 512]
    - [18, 227.0]
  - - [8192, 512, 1, 8192, 8192, 8192, 8192, 512]
    - [19, 213.08]
  - - [8192, 1024, 1, 128, 8192, 8192, 8192, 1024]
    - [3, 55.1]
  - - [8192, 1024, 1, 256, 8192, 8192, 8192, 1024]
    - [3, 93.82]
  - - [8192, 1024, 1, 512, 8192, 8192, 8192, 1024]
    - [3, 147.24]
  - - [8192, 1024, 1, 1024, 8192, 8192, 8192, 1024]
    - [5, 201.61]
  - - [8192, 1024, 1, 2048, 8192, 8192, 8192, 1024]
    - [5, 236.1]
  - - [8192, 1024, 1, 4096, 8192, 8192, 8192, 1024]
    - [11, 236.8]
  - - [8192, 1024, 1, 8192, 8192, 8192, 8192, 1024]
    - [78, 270.09]
  - - [8192, 2048, 1, 128, 8192, 8192, 8192, 2048]
    - [1, 62.44]
  - - [8192, 2048, 1, 256, 8192, 8192, 8192, 2048]
    - [3, 107.33]
  - - [8192, 2048, 1, 512, 8192, 8192, 8192, 2048]
    - [4, 160.59]
  - - [8192, 2048, 1, 1024, 8192, 8192, 8192, 2048]
    - [13, 193.21]
  - - [8192, 2048, 1, 2048, 8192, 8192, 8192, 2048]
    - [16, 216.32]
  - - [8192, 2048, 1, 4096, 8192, 8192, 8192, 2048]
    - [70, 270.89]
  - - [8192, 2048, 1, 8192, 8192, 8192, 8192, 2048]
    - [5, 322.19]
  - - [8192, 4096, 1, 128, 8192, 8192, 8192, 4096]
    - [5, 68.01]
  - - [8192, 4096, 1, 256, 8192, 8192, 8192, 4096]
    - [0, 107.88]
  - - [8192, 4096, 1, 512, 8192, 8192, 8192, 4096]
    - [14, 161.19]
  - - [8192, 4096, 1, 1024, 8192, 8192, 8192, 4096]
    - [31, 202.98]
  - - [8192, 4096, 1, 2048, 8192, 8192, 8192, 4096]
    - [5, 259.32]
  - - [8192, 4096, 1, 4096, 8192, 8192, 8192, 4096]
    - [5, 286.8]
  - - [8192, 4096, 1, 8192, 8192, 8192, 8192, 4096]
    - [77, 325.37]
  - - [8192, 8192, 1, 128, 8192, 8192, 8192, 8192]
    - [21, 62.74]
  - - [8192, 8192, 1, 256, 8192, 8192, 8192, 8192]
    - [29, 106.11]
  - - [8192, 8192, 1, 512, 8192, 8192, 8192, 8192]
    - [3, 169.41]
  - - [8192, 8192, 1, 1024, 8192, 8192, 8192, 8192]
    - [11, 230.35]
  - - [8192, 8192, 1, 2048, 8192, 8192, 8192, 8192]
    - [77, 284.98]
  - - [8192, 8192, 1, 4096, 8192, 8192, 8192, 8192]
    - [77, 333.4]
  - - [8192, 8192, 1, 8192, 8192, 8192, 8192, 8192]
    - [5, 335.11]
- null
- null
- ExperimentalStreamK
- GridBased
