projects/hipblaslt/library/src/amd_detail/rocblaslt/src/Tensile/Logic/asm_full/aquavanjaram/gfx942_228cu/StreamK/aquavanjaram942_Cijk_Alik_Bljk_HSS_BH_Bias_HAS_SAV_UserArgs.yaml
- {MinimumRequiredVersion: 4.33.0}
- aquavanjaram942
- {Architecture: gfx942, CUCount: 228}
- [Device 0049, Device 0050]
    SolutionIndex: 0
    SolutionNameMin: Cijk_Alik_Bljk_HSS_BH_Bias_HAS_SAV_UserArgs_MT256x256x32_MI16x16x1_SN_LDSB1_CLR1_GSU0_GSUC0_GSUWGMRR0_K1_LBSPPA512_LBSPPB512_MIWT8_8_PLR1_SU0_SUM0_SUS64_VWA8_VWB8_WGM4_WGMXCC1_WGMXCCGn1
    SolutionIndex: 1
    SolutionNameMin: Cijk_Alik_Bljk_HSS_BH_Bias_HAS_SAV_UserArgs_MT128x256x32_MI16x16x1_SN_LDSB1_CLR1_GSU0_GSUC0_GSUWGMRR0_K1_LBSPPA256_LBSPPB512_MIWT4_8_PLR1_SU0_SUM0_SUS64_VWA4_VWB8_WGM1_WGMXCC1_WGMXCCGn1
    SolutionIndex: 2
    SolutionNameMin: Cijk_Alik_Bljk_HSS_BH_Bias_HAS_SAV_UserArgs_MT128x256x32_MI16x16x1_SN_LDSB1_CLR1_GSU0_GSUC0_GSUWGMRR0_K1_LBSPPA256_LBSPPB512_MIWT4_8_PLR1_SU0_SUM0_SUS64_VWA4_VWB8_WGM1_WGMXCC1_WGMXCCGn1
    SolutionIndex: 3
    SolutionNameMin: Cijk_Alik_Bljk_HSS_BH_Bias_HAS_SAV_UserArgs_MT128x256x32_MI16x16x1_SN_LDSB1_CLR1_GSU0_GSUC0_GSUWGMRR0_K1_LBSPPA256_LBSPPB512_MIWT4_8_PLR1_SU0_SUM0_SUS64_VWA4_VWB8_WGM1_WGMXCC1_WGMXCCGn1
    SolutionIndex: 4
    SolutionNameMin: Cijk_Alik_Bljk_HSS_BH_Bias_HAS_SAV_UserArgs_MT128x256x32_MI16x16x1_SN_LDSB1_CLR1_GSU0_GSUC0_GSUWGMRR0_K1_LBSPPA256_LBSPPB512_MIWT4_8_PLR1_SU0_SUM0_SUS64_VWA4_VWB8_WGM4_WGMXCC1_WGMXCCGn1
    SolutionIndex: 5
    SolutionNameMin: Cijk_Alik_Bljk_HSS_BH_Bias_HAS_SAV_UserArgs_MT128x256x32_MI16x16x1_SN_LDSB1_CLR1_GSU0_GSUC0_GSUWGMRR0_K1_LBSPPA256_LBSPPB512_MIWT4_8_PLR1_SU0_SUM0_SUS64_VWA4_VWB8_WGM4_WGMXCC1_WGMXCCGn1
    SolutionIndex: 6
    SolutionNameMin: Cijk_Alik_Bljk_HSS_BH_Bias_HAS_SAV_UserArgs_MT128x256x32_MI16x16x1_SN_LDSB1_CLR1_GSU0_GSUC0_GSUWGMRR0_K1_LBSPPA256_LBSPPB512_MIWT4_8_PLR1_SU0_SUM0_SUS64_VWA4_VWB8_WGM4_WGMXCC1_WGMXCCGn1
    SolutionIndex: 7
    SolutionNameMin: Cijk_Alik_Bljk_HSS_BH_Bias_HAS_SAV_UserArgs_MT128x256x32_MI16x16x1_SN_LDSB1_CLR1_GSU0_GSUC0_GSUWGMRR0_K1_LBSPPA256_LBSPPB512_MIWT4_8_PLR1_SU0_SUM0_SUS64_VWA4_VWB8_WGM6_WGMXCC1_WGMXCCGn1
    SolutionIndex: 8
    SolutionNameMin: Cijk_Alik_Bljk_HSS_BH_Bias_HAS_SAV_UserArgs_MT128x128x32_MI16x16x1_SN_LDSB1_CLR1_GSU0_GSUC0_GSUWGMRR0_K1_LBSPPA256_LBSPPB256_MIWT4_4_PLR1_SU0_SUM0_SUS64_VWA4_VWB4_WGM1_WGMXCC1_WGMXCCGn1
    SolutionIndex: 9
    SolutionNameMin: Cijk_Alik_Bljk_HSS_BH_Bias_HAS_SAV_UserArgs_MT128x128x32_MI16x16x1_SN_LDSB1_CLR1_GSU0_GSUC0_GSUWGMRR0_K1_LBSPPA256_LBSPPB256_MIWT4_4_PLR1_SU0_SUM0_SUS64_VWA4_VWB4_WGM1_WGMXCC1_WGMXCCGn1
    SolutionIndex: 10
    SolutionNameMin: Cijk_Alik_Bljk_HSS_BH_Bias_HAS_SAV_UserArgs_MT128x128x32_MI16x16x1_SN_LDSB1_CLR1_GSU0_GSUC0_GSUWGMRR0_K1_LBSPPA256_LBSPPB256_MIWT4_4_PLR1_SU0_SUM0_SUS64_VWA4_VWB4_WGM4_WGMXCC1_WGMXCCGn1
    SolutionIndex: 11
    SolutionNameMin: Cijk_Alik_Bljk_HSS_BH_Bias_HAS_SAV_UserArgs_MT128x128x32_MI16x16x1_SN_LDSB1_CLR1_GSU0_GSUC0_GSUWGMRR0_K1_LBSPPA256_LBSPPB256_MIWT4_4_PLR1_SU0_SUM0_SUS64_VWA4_VWB4_WGM6_WGMXCC1_WGMXCCGn1
    SolutionIndex: 12
    SolutionNameMin: Cijk_Alik_Bljk_HSS_BH_Bias_HAS_SAV_UserArgs_MT128x128x32_MI16x16x1_SN_LDSB1_CLR1_GSU0_GSUC0_GSUWGMRR0_K1_LBSPPA256_LBSPPB256_MIWT4_4_PLR1_SU0_SUM0_SUS64_VWA4_VWB4_WGM6_WGMXCC1_WGMXCCGn1
    SolutionIndex: 13
    SolutionNameMin: Cijk_Alik_Bljk_HSS_BH_Bias_HAS_SAV_UserArgs_MT128x128x32_MI16x16x1_SN_LDSB1_CLR1_GSU0_GSUC0_GSUWGMRR0_K1_LBSPPA256_LBSPPB256_MIWT4_4_PLR1_SU0_SUM0_SUS64_VWA4_VWB4_WGM8_WGMXCC1_WGMXCCGn1
    SolutionIndex: 14
    SolutionNameMin: Cijk_Alik_Bljk_HSS_BH_Bias_HAS_SAV_UserArgs_MT128x128x32_MI16x16x1_SN_LDSB1_CLR1_GSU0_GSUC0_GSUWGMRR0_K1_LBSPPA256_LBSPPB256_MIWT4_4_PLR1_SU0_SUM0_SUS64_VWA4_VWB4_WGM8_WGMXCC1_WGMXCCGn1
    SolutionIndex: 15
    SolutionNameMin: Cijk_Alik_Bljk_HSS_BH_Bias_HAS_SAV_UserArgs_MT128x64x32_MI16x16x1_SN_LDSB0_CLR1_GSU0_GSUC0_GSUWGMRR0_K1_LBSPPA256_LBSPPB128_MIWT4_2_PLR1_SU0_SUM0_SUS64_VWA4_VWB2_WGM1_WGMXCC1_WGMXCCGn1
    SolutionIndex: 16
    SolutionNameMin: Cijk_Alik_Bljk_HSS_BH_Bias_HAS_SAV_UserArgs_MT32x128x32_MI16x16x1_SN_LDSB0_CLR1_GSU0_GSUC0_GSUWGMRR0_K1_LBSPPA128_LBSPPB256_MIWT1_4_PLR1_SU0_SUM0_SUS64_VWA1_VWB4_WGM1_WGMXCC1_WGMXCCGn1
    SolutionIndex: 17
    SolutionNameMin: Cijk_Alik_Bljk_HSS_BH_Bias_HAS_SAV_UserArgs_MT128x256x64_MI16x16x1_SN_LDSB1_CLR1_GSU0_GSUC0_GSUWGMRR0_K1_LBSPPA512_LBSPPB1024_MIWT4_8_PLR1_SU0_SUM0_SUS128_VWA4_VWB8_WGM1_WGMXCC1_WGMXCCGn1
    SolutionIndex: 18
    SolutionNameMin: Cijk_Alik_Bljk_HSS_BH_Bias_HAS_SAV_UserArgs_MT128x256x64_MI16x16x1_SN_LDSB1_CLR1_GSU0_GSUC0_GSUWGMRR0_K1_LBSPPA512_LBSPPB1024_MIWT4_8_PLR1_SU0_SUM0_SUS128_VWA4_VWB8_WGM1_WGMXCC1_WGMXCCGn1
    SolutionIndex: 19
    SolutionNameMin: Cijk_Alik_Bljk_HSS_BH_Bias_HAS_SAV_UserArgs_MT128x256x64_MI16x16x1_SN_LDSB1_CLR1_GSU0_GSUC0_GSUWGMRR0_K1_LBSPPA512_LBSPPB1024_MIWT4_8_PLR1_SU0_SUM0_SUS128_VWA4_VWB8_WGM1_WGMXCC1_WGMXCCGn1
    SolutionIndex: 20
    SolutionNameMin: Cijk_Alik_Bljk_HSS_BH_Bias_HAS_SAV_UserArgs_MT128x256x64_MI16x16x1_SN_LDSB1_CLR1_GSU0_GSUC0_GSUWGMRR0_K1_LBSPPA512_LBSPPB1024_MIWT4_8_PLR1_SU0_SUM0_SUS128_VWA4_VWB8_WGM1_WGMXCC1_WGMXCCGn1
    SolutionIndex: 21
    SolutionNameMin: Cijk_Alik_Bljk_HSS_BH_Bias_HAS_SAV_UserArgs_MT128x256x64_MI16x16x1_SN_LDSB1_CLR1_GSU0_GSUC0_GSUWGMRR0_K1_LBSPPA512_LBSPPB1024_MIWT4_8_PLR1_SU0_SUM0_SUS128_VWA4_VWB8_WGM4_WGMXCC1_WGMXCCGn1
    SolutionIndex: 22
    SolutionNameMin: Cijk_Alik_Bljk_HSS_BH_Bias_HAS_SAV_UserArgs_MT128x256x64_MI16x16x1_SN_LDSB1_CLR1_GSU0_GSUC0_GSUWGMRR0_K1_LBSPPA512_LBSPPB1024_MIWT4_8_PLR1_SU0_SUM0_SUS128_VWA4_VWB8_WGM6_WGMXCC1_WGMXCCGn1
    SolutionIndex: 23
    SolutionNameMin: Cijk_Alik_Bljk_HSS_BH_Bias_HAS_SAV_UserArgs_MT128x256x64_MI16x16x1_SN_LDSB1_CLR1_GSU0_GSUC0_GSUWGMRR0_K1_LBSPPA512_LBSPPB1024_MIWT4_8_PLR1_SU0_SUM0_SUS128_VWA4_VWB8_WGM6_WGMXCC1_WGMXCCGn1
    SolutionIndex: 24
    SolutionNameMin: Cijk_Alik_Bljk_HSS_BH_Bias_HAS_SAV_UserArgs_MT128x256x64_MI16x16x1_SN_LDSB1_CLR1_GSU0_GSUC0_GSUWGMRR0_K1_LBSPPA512_LBSPPB1024_MIWT4_8_PLR1_SU0_SUM0_SUS128_VWA4_VWB8_WGM6_WGMXCC1_WGMXCCGn1
    SolutionIndex: 25
    SolutionNameMin: Cijk_Alik_Bljk_HSS_BH_Bias_HAS_SAV_UserArgs_MT128x256x64_MI16x16x1_SN_LDSB1_CLR1_GSU0_GSUC0_GSUWGMRR0_K1_LBSPPA512_LBSPPB1024_MIWT4_8_PLR1_SU0_SUM0_SUS128_VWA4_VWB8_WGM6_WGMXCC1_WGMXCCGn1
    SolutionIndex: 26
    SolutionNameMin: Cijk_Alik_Bljk_HSS_BH_Bias_HAS_SAV_UserArgs_MT128x256x64_MI16x16x1_SN_LDSB1_CLR1_GSU0_GSUC0_GSUWGMRR0_K1_LBSPPA512_LBSPPB1024_MIWT4_8_PLR1_SU0_SUM0_SUS128_VWA4_VWB8_WGM8_WGMXCC1_WGMXCCGn1
    SolutionIndex: 27
    SolutionNameMin: Cijk_Alik_Bljk_HSS_BH_Bias_HAS_SAV_UserArgs_MT256x128x64_MI16x16x1_SN_LDSB1_CLR1_GSU0_GSUC0_GSUWGMRR0_K1_LBSPPA1024_LBSPPB512_MIWT8_4_PLR1_SU0_SUM0_SUS128_VWA8_VWB4_WGM8_WGMXCC1_WGMXCCGn1
    SolutionIndex: 28
    SolutionNameMin: Cijk_Alik_Bljk_HSS_BH_Bias_HAS_SAV_UserArgs_MT128x128x64_MI16x16x1_SN_LDSB1_CLR1_GSU0_GSUC0_GSUWGMRR0_K1_LBSPPA512_LBSPPB512_MIWT4_4_PLR1_SU0_SUM0_SUS128_VWA4_VWB4_WGM1_WGMXCC1_WGMXCCGn1
    SolutionIndex: 29
    SolutionNameMin: Cijk_Alik_Bljk_HSS_BH_Bias_HAS_SAV_UserArgs_MT128x128x64_MI16x16x1_SN_LDSB1_CLR1_GSU0_GSUC0_GSUWGMRR0_K1_LBSPPA512_LBSPPB512_MIWT4_4_PLR1_SU0_SUM0_SUS128_VWA4_VWB4_WGM1_WGMXCC1_WGMXCCGn1
    SolutionIndex: 30
    SolutionNameMin: Cijk_Alik_Bljk_HSS_BH_Bias_HAS_SAV_UserArgs_MT128x128x64_MI16x16x1_SN_LDSB1_CLR1_GSU0_GSUC0_GSUWGMRR0_K1_LBSPPA512_LBSPPB512_MIWT4_4_PLR1_SU0_SUM0_SUS128_VWA4_VWB4_WGM4_WGMXCC1_WGMXCCGn1
    SolutionIndex: 31
    SolutionNameMin: Cijk_Alik_Bljk_HSS_BH_Bias_HAS_SAV_UserArgs_MT128x128x64_MI16x16x1_SN_LDSB1_CLR1_GSU0_GSUC0_GSUWGMRR0_K1_LBSPPA512_LBSPPB512_MIWT4_4_PLR1_SU0_SUM0_SUS128_VWA4_VWB4_WGM4_WGMXCC1_WGMXCCGn1
    SolutionIndex: 32
    SolutionNameMin: Cijk_Alik_Bljk_HSS_BH_Bias_HAS_SAV_UserArgs_MT128x128x64_MI16x16x1_SN_LDSB1_CLR1_GSU0_GSUC0_GSUWGMRR0_K1_LBSPPA512_LBSPPB512_MIWT4_4_PLR1_SU0_SUM0_SUS128_VWA4_VWB4_WGM6_WGMXCC1_WGMXCCGn1
    SolutionIndex: 33
    SolutionNameMin: Cijk_Alik_Bljk_HSS_BH_Bias_HAS_SAV_UserArgs_MT128x128x64_MI16x16x1_SN_LDSB1_CLR1_GSU0_GSUC0_GSUWGMRR0_K1_LBSPPA512_LBSPPB512_MIWT4_4_PLR1_SU0_SUM0_SUS128_VWA4_VWB4_WGM6_WGMXCC1_WGMXCCGn1
    SolutionIndex: 34
    SolutionNameMin: Cijk_Alik_Bljk_HSS_BH_Bias_HAS_SAV_UserArgs_MT128x128x64_MI16x16x1_SN_LDSB1_CLR1_GSU0_GSUC0_GSUWGMRR0_K1_LBSPPA512_LBSPPB512_MIWT4_4_PLR1_SU0_SUM0_SUS128_VWA4_VWB4_WGM6_WGMXCC1_WGMXCCGn1
    SolutionIndex: 35
    SolutionNameMin: Cijk_Alik_Bljk_HSS_BH_Bias_HAS_SAV_UserArgs_MT128x128x64_MI16x16x1_SN_LDSB1_CLR1_GSU0_GSUC0_GSUWGMRR0_K1_LBSPPA512_LBSPPB512_MIWT4_4_PLR1_SU0_SUM0_SUS128_VWA4_VWB4_WGM8_WGMXCC1_WGMXCCGn1
    SolutionIndex: 36
    SolutionNameMin: Cijk_Alik_Bljk_HSS_BH_Bias_HAS_SAV_UserArgs_MT128x128x64_MI16x16x1_SN_LDSB1_CLR1_GSU0_GSUC0_GSUWGMRR0_K1_LBSPPA512_LBSPPB512_MIWT4_4_PLR1_SU0_SUM0_SUS128_VWA4_VWB4_WGM8_WGMXCC1_WGMXCCGn1
    SolutionIndex: 37
    SolutionNameMin: Cijk_Alik_Bljk_HSS_BH_Bias_HAS_SAV_UserArgs_MT128x128x64_MI16x16x1_SN_LDSB1_CLR1_GSU0_GSUC0_GSUWGMRR0_K1_LBSPPA512_LBSPPB512_MIWT4_4_PLR1_SU0_SUM0_SUS128_VWA4_VWB4_WGM8_WGMXCC1_WGMXCCGn1
    SolutionIndex: 38
    SolutionNameMin: Cijk_Alik_Bljk_HSS_BH_Bias_HAS_SAV_UserArgs_MT64x128x64_MI16x16x1_SN_LDSB1_CLR1_GSU0_GSUC0_GSUWGMRR0_K1_LBSPPA256_LBSPPB512_MIWT2_4_PLR1_SU0_SUM0_SUS128_VWA2_VWB4_WGM1_WGMXCC1_WGMXCCGn1
    SolutionIndex: 39
    SolutionNameMin: Cijk_Alik_Bljk_HSS_BH_Bias_HAS_SAV_UserArgs_MT64x128x64_MI16x16x1_SN_LDSB1_CLR1_GSU0_GSUC0_GSUWGMRR0_K1_LBSPPA256_LBSPPB512_MIWT2_4_PLR1_SU0_SUM0_SUS128_VWA2_VWB4_WGM4_WGMXCC1_WGMXCCGn1
    SolutionIndex: 40
    SolutionNameMin: Cijk_Alik_Bljk_HSS_BH_Bias_HAS_SAV_UserArgs_MT64x128x64_MI16x16x1_SN_LDSB1_CLR1_GSU0_GSUC0_GSUWGMRR0_K1_LBSPPA256_LBSPPB512_MIWT2_4_PLR1_SU0_SUM0_SUS128_VWA2_VWB4_WGM8_WGMXCC1_WGMXCCGn1
    SolutionIndex: 41
    SolutionNameMin: Cijk_Alik_Bljk_HSS_BH_Bias_HAS_SAV_UserArgs_MT128x64x64_MI16x16x1_SN_LDSB1_CLR1_GSU0_GSUC0_GSUWGMRR0_K1_LBSPPA512_LBSPPB256_MIWT4_2_PLR1_SU0_SUM0_SUS128_VWA4_VWB2_WGM1_WGMXCC1_WGMXCCGn1
    SolutionIndex: 42
    SolutionNameMin: Cijk_Alik_Bljk_HSS_BH_Bias_HAS_SAV_UserArgs_MT128x64x64_MI16x16x1_SN_LDSB1_CLR1_GSU0_GSUC0_GSUWGMRR0_K1_LBSPPA512_LBSPPB256_MIWT4_2_PLR1_SU0_SUM0_SUS128_VWA4_VWB2_WGM1_WGMXCC1_WGMXCCGn1
    SolutionIndex: 43
    SolutionNameMin: Cijk_Alik_Bljk_HSS_BH_Bias_HAS_SAV_UserArgs_MT128x64x64_MI16x16x1_SN_LDSB1_CLR1_GSU0_GSUC0_GSUWGMRR0_K1_LBSPPA512_LBSPPB256_MIWT4_2_PLR1_SU0_SUM0_SUS128_VWA4_VWB2_WGM1_WGMXCC1_WGMXCCGn1
    SolutionIndex: 44
    SolutionNameMin: Cijk_Alik_Bljk_HSS_BH_Bias_HAS_SAV_UserArgs_MT128x64x64_MI16x16x1_SN_LDSB1_CLR1_GSU0_GSUC0_GSUWGMRR0_K1_LBSPPA512_LBSPPB256_MIWT4_2_PLR1_SU0_SUM0_SUS128_VWA4_VWB2_WGM4_WGMXCC1_WGMXCCGn1
    SolutionIndex: 45
    SolutionNameMin: Cijk_Alik_Bljk_HSS_BH_Bias_HAS_SAV_UserArgs_MT128x64x64_MI16x16x1_SN_LDSB1_CLR1_GSU0_GSUC0_GSUWGMRR0_K1_LBSPPA512_LBSPPB256_MIWT4_2_PLR1_SU0_SUM0_SUS128_VWA4_VWB2_WGM6_WGMXCC1_WGMXCCGn1
    SolutionIndex: 46
    SolutionNameMin: Cijk_Alik_Bljk_HSS_BH_Bias_HAS_SAV_UserArgs_MT128x64x64_MI16x16x1_SN_LDSB1_CLR1_GSU0_GSUC0_GSUWGMRR0_K1_LBSPPA512_LBSPPB256_MIWT4_2_PLR1_SU0_SUM0_SUS128_VWA4_VWB2_WGM6_WGMXCC1_WGMXCCGn1
    SolutionIndex: 47
    SolutionNameMin: Cijk_Alik_Bljk_HSS_BH_Bias_HAS_SAV_UserArgs_MT128x64x64_MI16x16x1_SN_LDSB1_CLR1_GSU0_GSUC0_GSUWGMRR0_K1_LBSPPA512_LBSPPB256_MIWT4_2_PLR1_SU0_SUM0_SUS128_VWA4_VWB2_WGM8_WGMXCC1_WGMXCCGn1
    SolutionIndex: 48
    SolutionNameMin: Cijk_Alik_Bljk_HSS_BH_Bias_HAS_SAV_UserArgs_MT32x128x64_MI16x16x1_SN_LDSB1_CLR1_GSU0_GSUC0_GSUWGMRR0_K1_LBSPPA128_LBSPPB512_MIWT1_4_PLR1_SU0_SUM0_SUS128_VWA1_VWB4_WGM1_WGMXCC1_WGMXCCGn1
    SolutionIndex: 49
    SolutionNameMin: Cijk_Alik_Bljk_HSS_BH_Bias_HAS_SAV_UserArgs_MT32x64x64_MI16x16x1_SN_LDSB0_CLR1_GSU0_GSUC0_GSUWGMRR0_K1_LBSPPA128_LBSPPB256_MIWT1_2_PLR1_SU0_SUM0_SUS128_VWA1_VWB2_WGM1_WGMXCC1_WGMXCCGn1
    SolutionIndex: 50
    SolutionNameMin: Cijk_Alik_Bljk_HSS_BH_Bias_HAS_SAV_UserArgs_MT32x64x64_MI16x16x1_SN_LDSB0_CLR1_GSU0_GSUC0_GSUWGMRR0_K1_LBSPPA128_LBSPPB256_MIWT1_2_PLR1_SU0_SUM0_SUS128_VWA1_VWB2_WGM8_WGMXCC1_WGMXCCGn1
    SolutionIndex: 51
    SolutionNameMin: Cijk_Alik_Bljk_HSS_BH_Bias_HAS_SAV_UserArgs_MT64x128x128_MI16x16x1_SN_LDSB1_CLR1_GSU0_GSUC0_GSUWGMRR0_K1_LBSPPA512_LBSPPB1024_MIWT2_4_PLR1_SU0_SUM0_SUS256_VWA2_VWB4_WGM1_WGMXCC1_WGMXCCGn1
    SolutionIndex: 52
    SolutionNameMin: Cijk_Alik_Bljk_HSS_BH_Bias_HAS_SAV_UserArgs_MT64x128x128_MI16x16x1_SN_LDSB1_CLR1_GSU0_GSUC0_GSUWGMRR0_K1_LBSPPA512_LBSPPB1024_MIWT2_4_PLR1_SU0_SUM0_SUS256_VWA2_VWB4_WGM1_WGMXCC1_WGMXCCGn1
    SolutionIndex: 53
    SolutionNameMin: Cijk_Alik_Bljk_HSS_BH_Bias_HAS_SAV_UserArgs_MT64x128x128_MI16x16x1_SN_LDSB1_CLR1_GSU0_GSUC0_GSUWGMRR0_K1_LBSPPA512_LBSPPB1024_MIWT2_4_PLR1_SU0_SUM0_SUS256_VWA2_VWB4_WGM4_WGMXCC1_WGMXCCGn1
    SolutionIndex: 54
    SolutionNameMin: Cijk_Alik_Bljk_HSS_BH_Bias_HAS_SAV_UserArgs_MT64x128x128_MI16x16x1_SN_LDSB1_CLR1_GSU0_GSUC0_GSUWGMRR0_K1_LBSPPA512_LBSPPB1024_MIWT2_4_PLR1_SU0_SUM0_SUS256_VWA2_VWB4_WGM4_WGMXCC1_WGMXCCGn1
    SolutionIndex: 55
    SolutionNameMin: Cijk_Alik_Bljk_HSS_BH_Bias_HAS_SAV_UserArgs_MT64x128x128_MI16x16x1_SN_LDSB1_CLR1_GSU0_GSUC0_GSUWGMRR0_K1_LBSPPA512_LBSPPB1024_MIWT2_4_PLR1_SU0_SUM0_SUS256_VWA2_VWB4_WGM6_WGMXCC1_WGMXCCGn1
    SolutionIndex: 56
    SolutionNameMin: Cijk_Alik_Bljk_HSS_BH_Bias_HAS_SAV_UserArgs_MT64x128x128_MI16x16x1_SN_LDSB1_CLR1_GSU0_GSUC0_GSUWGMRR0_K1_LBSPPA512_LBSPPB1024_MIWT2_4_PLR1_SU0_SUM0_SUS256_VWA2_VWB4_WGM6_WGMXCC1_WGMXCCGn1
    SolutionIndex: 57
    SolutionNameMin: Cijk_Alik_Bljk_HSS_BH_Bias_HAS_SAV_UserArgs_MT64x128x128_MI16x16x1_SN_LDSB1_CLR1_GSU0_GSUC0_GSUWGMRR0_K1_LBSPPA512_LBSPPB1024_MIWT2_4_PLR1_SU0_SUM0_SUS256_VWA2_VWB4_WGM8_WGMXCC1_WGMXCCGn1
    SolutionIndex: 58
    SolutionNameMin: Cijk_Alik_Bljk_HSS_BH_Bias_HAS_SAV_UserArgs_MT128x64x128_MI16x16x1_SN_LDSB1_CLR1_GSU0_GSUC0_GSUWGMRR0_K1_LBSPPA1024_LBSPPB512_MIWT4_2_PLR1_SU0_SUM0_SUS256_VWA4_VWB2_WGM1_WGMXCC1_WGMXCCGn1
    SolutionIndex: 59
    SolutionNameMin: Cijk_Alik_Bljk_HSS_BH_Bias_HAS_SAV_UserArgs_MT128x64x128_MI16x16x1_SN_LDSB1_CLR1_GSU0_GSUC0_GSUWGMRR0_K1_LBSPPA1024_LBSPPB512_MIWT4_2_PLR1_SU0_SUM0_SUS256_VWA4_VWB2_WGM1_WGMXCC1_WGMXCCGn1
    SolutionIndex: 60
    SolutionNameMin: Cijk_Alik_Bljk_HSS_BH_Bias_HAS_SAV_UserArgs_MT128x64x128_MI16x16x1_SN_LDSB1_CLR1_GSU0_GSUC0_GSUWGMRR0_K1_LBSPPA1024_LBSPPB512_MIWT4_2_PLR1_SU0_SUM0_SUS256_VWA4_VWB2_WGM4_WGMXCC1_WGMXCCGn1
    SolutionIndex: 61
    SolutionNameMin: Cijk_Alik_Bljk_HSS_BH_Bias_HAS_SAV_UserArgs_MT128x64x128_MI16x16x1_SN_LDSB1_CLR1_GSU0_GSUC0_GSUWGMRR0_K1_LBSPPA1024_LBSPPB512_MIWT4_2_PLR1_SU0_SUM0_SUS256_VWA4_VWB2_WGM6_WGMXCC1_WGMXCCGn1
    SolutionIndex: 62
    SolutionNameMin: Cijk_Alik_Bljk_HSS_BH_Bias_HAS_SAV_UserArgs_MT128x64x128_MI16x16x1_SN_LDSB1_CLR1_GSU0_GSUC0_GSUWGMRR0_K1_LBSPPA1024_LBSPPB512_MIWT4_2_PLR1_SU0_SUM0_SUS256_VWA4_VWB2_WGM8_WGMXCC1_WGMXCCGn1
    SolutionIndex: 63
    SolutionNameMin: Cijk_Alik_Bljk_HSS_BH_Bias_HAS_SAV_UserArgs_MT64x64x128_MI16x16x1_SN_LDSB1_CLR1_GSU0_GSUC0_GSUWGMRR0_K1_LBSPPA512_LBSPPB512_MIWT2_2_PLR1_SU0_SUM0_SUS256_VWA2_VWB2_WGM1_WGMXCC1_WGMXCCGn1
    SolutionIndex: 64
    SolutionNameMin: Cijk_Alik_Bljk_HSS_BH_Bias_HAS_SAV_UserArgs_MT64x64x128_MI16x16x1_SN_LDSB1_CLR1_GSU0_GSUC0_GSUWGMRR0_K1_LBSPPA512_LBSPPB512_MIWT2_2_PLR1_SU0_SUM0_SUS256_VWA2_VWB2_WGM1_WGMXCC1_WGMXCCGn1
    SolutionIndex: 65
    SolutionNameMin: Cijk_Alik_Bljk_HSS_BH_Bias_HAS_SAV_UserArgs_MT64x64x128_MI16x16x1_SN_LDSB1_CLR1_GSU0_GSUC0_GSUWGMRR0_K1_LBSPPA512_LBSPPB512_MIWT2_2_PLR1_SU0_SUM0_SUS256_VWA2_VWB2_WGM4_WGMXCC1_WGMXCCGn1
    SolutionIndex: 66
    SolutionNameMin: Cijk_Alik_Bljk_HSS_BH_Bias_HAS_SAV_UserArgs_MT64x64x128_MI16x16x1_SN_LDSB1_CLR1_GSU0_GSUC0_GSUWGMRR0_K1_LBSPPA512_LBSPPB512_MIWT2_2_PLR1_SU0_SUM0_SUS256_VWA2_VWB2_WGM4_WGMXCC1_WGMXCCGn1
    SolutionIndex: 67
    SolutionNameMin: Cijk_Alik_Bljk_HSS_BH_Bias_HAS_SAV_UserArgs_MT64x64x128_MI16x16x1_SN_LDSB1_CLR1_GSU0_GSUC0_GSUWGMRR0_K1_LBSPPA512_LBSPPB512_MIWT2_2_PLR1_SU0_SUM0_SUS256_VWA2_VWB2_WGM6_WGMXCC1_WGMXCCGn1
    SolutionIndex: 68
    SolutionNameMin: Cijk_Alik_Bljk_HSS_BH_Bias_HAS_SAV_UserArgs_MT64x64x128_MI16x16x1_SN_LDSB1_CLR1_GSU0_GSUC0_GSUWGMRR0_K1_LBSPPA512_LBSPPB512_MIWT2_2_PLR1_SU0_SUM0_SUS256_VWA2_VWB2_WGM6_WGMXCC1_WGMXCCGn1
    SolutionIndex: 69
    SolutionNameMin: Cijk_Alik_Bljk_HSS_BH_Bias_HAS_SAV_UserArgs_MT64x64x128_MI16x16x1_SN_LDSB1_CLR1_GSU0_GSUC0_GSUWGMRR0_K1_LBSPPA512_LBSPPB512_MIWT2_2_PLR1_SU0_SUM0_SUS256_VWA2_VWB2_WGM6_WGMXCC1_WGMXCCGn1
    SolutionIndex: 70
    SolutionNameMin: Cijk_Alik_Bljk_HSS_BH_Bias_HAS_SAV_UserArgs_MT64x64x128_MI16x16x1_SN_LDSB1_CLR1_GSU0_GSUC0_GSUWGMRR0_K1_LBSPPA512_LBSPPB512_MIWT2_2_PLR1_SU0_SUM0_SUS256_VWA2_VWB2_WGM8_WGMXCC1_WGMXCCGn1
    SolutionIndex: 71
    SolutionNameMin: Cijk_Alik_Bljk_HSS_BH_Bias_HAS_SAV_UserArgs_MT64x64x128_MI16x16x1_SN_LDSB1_CLR1_GSU0_GSUC0_GSUWGMRR0_K1_LBSPPA512_LBSPPB512_MIWT2_2_PLR1_SU0_SUM0_SUS256_VWA2_VWB2_WGM8_WGMXCC1_WGMXCCGn1
    SolutionIndex: 72
    SolutionNameMin: Cijk_Alik_Bljk_HSS_BH_Bias_HAS_SAV_UserArgs_MT32x64x128_MI16x16x1_SN_LDSB1_CLR1_GSU0_GSUC0_GSUWGMRR0_K1_LBSPPA256_LBSPPB512_MIWT1_2_PLR1_SU0_SUM0_SUS256_VWA1_VWB2_WGM1_WGMXCC1_WGMXCCGn1
    SolutionIndex: 73
    SolutionNameMin: Cijk_Alik_Bljk_HSS_BH_Bias_HAS_SAV_UserArgs_MT32x64x128_MI16x16x1_SN_LDSB1_CLR1_GSU0_GSUC0_GSUWGMRR0_K1_LBSPPA256_LBSPPB512_MIWT1_2_PLR1_SU0_SUM0_SUS256_VWA1_VWB2_WGM1_WGMXCC1_WGMXCCGn1
    SolutionIndex: 74
    SolutionNameMin: Cijk_Alik_Bljk_HSS_BH_Bias_HAS_SAV_UserArgs_MT32x64x128_MI16x16x1_SN_LDSB1_CLR1_GSU0_GSUC0_GSUWGMRR0_K1_LBSPPA256_LBSPPB512_MIWT1_2_PLR1_SU0_SUM0_SUS256_VWA1_VWB2_WGM1_WGMXCC1_WGMXCCGn1
    SolutionIndex: 75
    SolutionNameMin: Cijk_Alik_Bljk_HSS_BH_Bias_HAS_SAV_UserArgs_MT32x64x128_MI16x16x1_SN_LDSB1_CLR1_GSU0_GSUC0_GSUWGMRR0_K1_LBSPPA256_LBSPPB512_MIWT1_2_PLR1_SU0_SUM0_SUS256_VWA1_VWB2_WGM4_WGMXCC1_WGMXCCGn1
    SolutionIndex: 76
    SolutionNameMin: Cijk_Alik_Bljk_HSS_BH_Bias_HAS_SAV_UserArgs_MT32x64x128_MI16x16x1_SN_LDSB1_CLR1_GSU0_GSUC0_GSUWGMRR0_K1_LBSPPA256_LBSPPB512_MIWT1_2_PLR1_SU0_SUM0_SUS256_VWA1_VWB2_WGM4_WGMXCC1_WGMXCCGn1
    SolutionIndex: 77
    SolutionNameMin: Cijk_Alik_Bljk_HSS_BH_Bias_HAS_SAV_UserArgs_MT32x64x128_MI16x16x1_SN_LDSB1_CLR1_GSU0_GSUC0_GSUWGMRR0_K1_LBSPPA256_LBSPPB512_MIWT1_2_PLR1_SU0_SUM0_SUS256_VWA1_VWB2_WGM4_WGMXCC1_WGMXCCGn1
    SolutionIndex: 78
    SolutionNameMin: Cijk_Alik_Bljk_HSS_BH_Bias_HAS_SAV_UserArgs_MT32x64x128_MI16x16x1_SN_LDSB1_CLR1_GSU0_GSUC0_GSUWGMRR0_K1_LBSPPA256_LBSPPB512_MIWT1_2_PLR1_SU0_SUM0_SUS256_VWA1_VWB2_WGM4_WGMXCC1_WGMXCCGn1
    SolutionIndex: 79
    SolutionNameMin: Cijk_Alik_Bljk_HSS_BH_Bias_HAS_SAV_UserArgs_MT32x64x128_MI16x16x1_SN_LDSB1_CLR1_GSU0_GSUC0_GSUWGMRR0_K1_LBSPPA256_LBSPPB512_MIWT1_2_PLR1_SU0_SUM0_SUS256_VWA1_VWB2_WGM6_WGMXCC1_WGMXCCGn1
    SolutionIndex: 80
    SolutionNameMin: Cijk_Alik_Bljk_HSS_BH_Bias_HAS_SAV_UserArgs_MT32x64x128_MI16x16x1_SN_LDSB1_CLR1_GSU0_GSUC0_GSUWGMRR0_K1_LBSPPA256_LBSPPB512_MIWT1_2_PLR1_SU0_SUM0_SUS256_VWA1_VWB2_WGM6_WGMXCC1_WGMXCCGn1
    SolutionIndex: 81
    SolutionNameMin: Cijk_Alik_Bljk_HSS_BH_Bias_HAS_SAV_UserArgs_MT32x64x128_MI16x16x1_SN_LDSB1_CLR1_GSU0_GSUC0_GSUWGMRR0_K1_LBSPPA256_LBSPPB512_MIWT1_2_PLR1_SU0_SUM0_SUS256_VWA1_VWB2_WGM6_WGMXCC1_WGMXCCGn1
    SolutionIndex: 82
    SolutionNameMin: Cijk_Alik_Bljk_HSS_BH_Bias_HAS_SAV_UserArgs_MT32x64x128_MI16x16x1_SN_LDSB1_CLR1_GSU0_GSUC0_GSUWGMRR0_K1_LBSPPA256_LBSPPB512_MIWT1_2_PLR1_SU0_SUM0_SUS256_VWA1_VWB2_WGM8_WGMXCC1_WGMXCCGn1
    SolutionIndex: 83
    SolutionNameMin: Cijk_Alik_Bljk_HSS_BH_Bias_HAS_SAV_UserArgs_MT32x64x128_MI16x16x1_SN_LDSB1_CLR1_GSU0_GSUC0_GSUWGMRR0_K1_LBSPPA256_LBSPPB512_MIWT1_2_PLR1_SU0_SUM0_SUS256_VWA1_VWB2_WGM8_WGMXCC1_WGMXCCGn1
    SolutionIndex: 84
    SolutionNameMin: Cijk_Alik_Bljk_HSS_BH_Bias_HAS_SAV_UserArgs_MT64x32x128_MI16x16x1_SN_LDSB1_CLR1_GSU0_GSUC0_GSUWGMRR0_K1_LBSPPA512_LBSPPB256_MIWT2_1_PLR1_SU0_SUM0_SUS256_VWA2_VWB1_WGM1_WGMXCC1_WGMXCCGn1
    SolutionIndex: 85
    SolutionNameMin: Cijk_Alik_Bljk_HSS_BH_Bias_HAS_SAV_UserArgs_MT64x32x128_MI16x16x1_SN_LDSB1_CLR1_GSU0_GSUC0_GSUWGMRR0_K1_LBSPPA512_LBSPPB256_MIWT2_1_PLR1_SU0_SUM0_SUS256_VWA2_VWB1_WGM1_WGMXCC1_WGMXCCGn1
    SolutionIndex: 86
    SolutionNameMin: Cijk_Alik_Bljk_HSS_BH_Bias_HAS_SAV_UserArgs_MT64x32x128_MI16x16x1_SN_LDSB1_CLR1_GSU0_GSUC0_GSUWGMRR0_K1_LBSPPA512_LBSPPB256_MIWT2_1_PLR1_SU0_SUM0_SUS256_VWA2_VWB1_WGM4_WGMXCC1_WGMXCCGn1
    SolutionIndex: 87
    SolutionNameMin: Cijk_Alik_Bljk_HSS_BH_Bias_HAS_SAV_UserArgs_MT64x32x128_MI16x16x1_SN_LDSB1_CLR1_GSU0_GSUC0_GSUWGMRR0_K1_LBSPPA512_LBSPPB256_MIWT2_1_PLR1_SU0_SUM0_SUS256_VWA2_VWB1_WGM8_WGMXCC1_WGMXCCGn1
    SolutionIndex: 88
    SolutionNameMin: Cijk_Alik_Bljk_HSS_BH_Bias_HAS_SAV_UserArgs_MT32x32x128_MI16x16x1_SN_LDSB1_CLR1_GSU0_GSUC0_GSUWGMRR0_K1_LBSPPA256_LBSPPB256_MIWT1_1_PLR1_SU0_SUM0_SUS256_VWA1_VWB1_WGM1_WGMXCC1_WGMXCCGn1
    SolutionIndex: 89
    SolutionNameMin: Cijk_Alik_Bljk_HSS_BH_Bias_HAS_SAV_UserArgs_MT32x32x128_MI16x16x1_SN_LDSB1_CLR1_GSU0_GSUC0_GSUWGMRR0_K1_LBSPPA256_LBSPPB256_MIWT1_1_PLR1_SU0_SUM0_SUS256_VWA1_VWB1_WGM1_WGMXCC1_WGMXCCGn1
    SolutionIndex: 90
    SolutionNameMin: Cijk_Alik_Bljk_HSS_BH_Bias_HAS_SAV_UserArgs_MT32x32x128_MI16x16x1_SN_LDSB1_CLR1_GSU0_GSUC0_GSUWGMRR0_K1_LBSPPA256_LBSPPB256_MIWT1_1_PLR1_SU0_SUM0_SUS256_VWA1_VWB1_WGM1_WGMXCC1_WGMXCCGn1
    SolutionIndex: 91
    SolutionNameMin: Cijk_Alik_Bljk_HSS_BH_Bias_HAS_SAV_UserArgs_MT32x32x128_MI16x16x1_SN_LDSB1_CLR1_GSU0_GSUC0_GSUWGMRR0_K1_LBSPPA256_LBSPPB256_MIWT1_1_PLR1_SU0_SUM0_SUS256_VWA1_VWB1_WGM1_WGMXCC1_WGMXCCGn1
    SolutionIndex: 92
    SolutionNameMin: Cijk_Alik_Bljk_HSS_BH_Bias_HAS_SAV_UserArgs_MT32x32x128_MI16x16x1_SN_LDSB1_CLR1_GSU0_GSUC0_GSUWGMRR0_K1_LBSPPA256_LBSPPB256_MIWT1_1_PLR1_SU0_SUM0_SUS256_VWA1_VWB1_WGM1_WGMXCC1_WGMXCCGn1
    SolutionIndex: 93
    SolutionNameMin: Cijk_Alik_Bljk_HSS_BH_Bias_HAS_SAV_UserArgs_MT32x32x128_MI16x16x1_SN_LDSB1_CLR1_GSU0_GSUC0_GSUWGMRR0_K1_LBSPPA256_LBSPPB256_MIWT1_1_PLR1_SU0_SUM0_SUS256_VWA1_VWB1_WGM1_WGMXCC1_WGMXCCGn1
    SolutionIndex: 94
    SolutionNameMin: Cijk_Alik_Bljk_HSS_BH_Bias_HAS_SAV_UserArgs_MT32x32x128_MI16x16x1_SN_LDSB1_CLR1_GSU0_GSUC0_GSUWGMRR0_K1_LBSPPA256_LBSPPB256_MIWT1_1_PLR1_SU0_SUM0_SUS256_VWA1_VWB1_WGM1_WGMXCC1_WGMXCCGn1
    SolutionIndex: 95
    SolutionNameMin: Cijk_Alik_Bljk_HSS_BH_Bias_HAS_SAV_UserArgs_MT32x32x128_MI16x16x1_SN_LDSB1_CLR1_GSU0_GSUC0_GSUWGMRR0_K1_LBSPPA256_LBSPPB256_MIWT1_1_PLR1_SU0_SUM0_SUS256_VWA1_VWB1_WGM4_WGMXCC1_WGMXCCGn1
    SolutionIndex: 96
    SolutionNameMin: Cijk_Alik_Bljk_HSS_BH_Bias_HAS_SAV_UserArgs_MT32x32x128_MI16x16x1_SN_LDSB1_CLR1_GSU0_GSUC0_GSUWGMRR0_K1_LBSPPA256_LBSPPB256_MIWT1_1_PLR1_SU0_SUM0_SUS256_VWA1_VWB1_WGM4_WGMXCC1_WGMXCCGn1
    SolutionIndex: 97
    SolutionNameMin: Cijk_Alik_Bljk_HSS_BH_Bias_HAS_SAV_UserArgs_MT32x32x128_MI16x16x1_SN_LDSB1_CLR1_GSU0_GSUC0_GSUWGMRR0_K1_LBSPPA256_LBSPPB256_MIWT1_1_PLR1_SU0_SUM0_SUS256_VWA1_VWB1_WGM4_WGMXCC1_WGMXCCGn1
    SolutionIndex: 98
    SolutionNameMin: Cijk_Alik_Bljk_HSS_BH_Bias_HAS_SAV_UserArgs_MT32x32x128_MI16x16x1_SN_LDSB1_CLR1_GSU0_GSUC0_GSUWGMRR0_K1_LBSPPA256_LBSPPB256_MIWT1_1_PLR1_SU0_SUM0_SUS256_VWA1_VWB1_WGM6_WGMXCC1_WGMXCCGn1
    SolutionIndex: 99
    SolutionNameMin: Cijk_Alik_Bljk_HSS_BH_Bias_HAS_SAV_UserArgs_MT32x32x128_MI16x16x1_SN_LDSB1_CLR1_GSU0_GSUC0_GSUWGMRR0_K1_LBSPPA256_LBSPPB256_MIWT1_1_PLR1_SU0_SUM0_SUS256_VWA1_VWB1_WGM6_WGMXCC1_WGMXCCGn1
    SolutionIndex: 100
    SolutionNameMin: Cijk_Alik_Bljk_HSS_BH_Bias_HAS_SAV_UserArgs_MT32x32x128_MI16x16x1_SN_LDSB1_CLR1_GSU0_GSUC0_GSUWGMRR0_K1_LBSPPA256_LBSPPB256_MIWT1_1_PLR1_SU0_SUM0_SUS256_VWA1_VWB1_WGM6_WGMXCC1_WGMXCCGn1
    SolutionIndex: 101
    SolutionNameMin: Cijk_Alik_Bljk_HSS_BH_Bias_HAS_SAV_UserArgs_MT32x32x128_MI16x16x1_SN_LDSB1_CLR1_GSU0_GSUC0_GSUWGMRR0_K1_LBSPPA256_LBSPPB256_MIWT1_1_PLR1_SU0_SUM0_SUS256_VWA1_VWB1_WGM8_WGMXCC1_WGMXCCGn1
    SolutionIndex: 102
    SolutionNameMin: Cijk_Alik_Bljk_HSS_BH_Bias_HAS_SAV_UserArgs_MT32x32x128_MI16x16x1_SN_LDSB1_CLR1_GSU0_GSUC0_GSUWGMRR0_K1_LBSPPA256_LBSPPB256_MIWT1_1_PLR1_SU0_SUM0_SUS256_VWA1_VWB1_WGM8_WGMXCC1_WGMXCCGn1
    SolutionIndex: 103
    SolutionNameMin: Cijk_Alik_Bljk_HSS_BH_Bias_HAS_SAV_UserArgs_MT32x32x128_MI16x16x1_SN_LDSB1_CLR1_GSU0_GSUC0_GSUWGMRR0_K1_LBSPPA256_LBSPPB256_MIWT1_1_PLR1_SU0_SUM0_SUS256_VWA1_VWB1_WGM8_WGMXCC1_WGMXCCGn1
    SolutionIndex: 104
    SolutionNameMin: Cijk_Alik_Bljk_HSS_BH_Bias_HAS_SAV_UserArgs_MT32x32x32_MI16x16x1_SN_LDSB0_CLR1_GSU0_GSUC0_GSUWGMRR0_K1_LBSPPA128_LBSPPB128_MIWT1_1_PLR1_SU0_SUM0_SUS64_VWA1_VWB1_WGM1_WGMXCC1_WGMXCCGn1
- - - [128, 128, 1, 128, 128, 128, 128, 128]
    - [94, 0.5]
  - - [128, 128, 1, 256, 128, 128, 256, 256]
    - [94, 0.86]
  - - [128, 128, 1, 512, 128, 128, 512, 512]
    - [94, 1.47]
  - - [128, 128, 1, 1024, 128, 128, 1024, 1024]
    - [94, 2.27]
  - - [128, 128, 1, 2048, 128, 128, 2048, 2048]
    - [88, 3.11]
  - - [128, 128, 1, 4096, 128, 128, 4096, 4096]
    - [88, 3.9]
  - - [128, 128, 1, 8192, 128, 128, 8192, 8192]
    - [88, 4.57]
  - - [128, 256, 1, 128, 128, 128, 128, 128]
    - [94, 0.97]
  - - [128, 256, 1, 256, 128, 128, 256, 256]
    - [94, 1.68]
  - - [128, 256, 1, 512, 128, 128, 512, 512]
    - [94, 2.91]
  - - [128, 256, 1, 1024, 128, 128, 1024, 1024]
    - [94, 4.52]
  - - [128, 256, 1, 2048, 128, 128, 2048, 2048]
    - [88, 6.12]
  - - [128, 256, 1, 4096, 128, 128, 4096, 4096]
    - [88, 7.68]
  - - [128, 256, 1, 8192, 128, 128, 8192, 8192]
    - [99, 8.92]
  - - [128, 512, 1, 128, 128, 128, 128, 128]
    - [94, 1.89]
  - - [128, 512, 1, 256, 128, 128, 256, 256]
    - [94, 3.4]
  - - [128, 512, 1, 512, 128, 128, 512, 512]
    - [94, 5.77]
  - - [128, 512, 1, 1024, 128, 128, 1024, 1024]
    - [94, 8.86]
  - - [128, 512, 1, 2048, 128, 128, 2048, 2048]
    - [88, 11.95]
  - - [128, 512, 1, 4096, 128, 128, 4096, 4096]
    - [88, 15.08]
  - - [128, 512, 1, 8192, 128, 128, 8192, 8192]
    - [101, 17.55]
  - - [128, 1024, 1, 128, 128, 128, 128, 128]
    - [93, 3.69]
  - - [128, 1024, 1, 256, 128, 128, 256, 256]
    - [94, 6.56]
  - - [128, 1024, 1, 512, 128, 128, 512, 512]
    - [94, 11.06]
  - - [128, 1024, 1, 1024, 128, 128, 1024, 1024]
    - [94, 17.05]
  - - [128, 1024, 1, 2048, 128, 128, 2048, 2048]
    - [88, 23.08]
  - - [128, 1024, 1, 4096, 128, 128, 4096, 4096]
    - [88, 28.97]
  - - [128, 1024, 1, 8192, 128, 128, 8192, 8192]
    - [94, 34.88]
  - - [128, 2048, 1, 128, 128, 128, 128, 128]
    - [85, 6.62]
  - - [128, 2048, 1, 256, 128, 128, 256, 256]
    - [85, 11.19]
  - - [128, 2048, 1, 512, 128, 128, 512, 512]
    - [85, 18.96]
  - - [128, 2048, 1, 1024, 128, 128, 1024, 1024]
    - [74, 28.3]
  - - [128, 2048, 1, 2048, 128, 128, 2048, 2048]
    - [72, 37.58]
  - - [128, 2048, 1, 4096, 128, 128, 4096, 4096]
    - [72, 47.37]
  - - [128, 2048, 1, 8192, 128, 128, 8192, 8192]
    - [85, 53.55]
  - - [128, 4096, 1, 128, 128, 128, 128, 128]
    - [64, 10.91]
  - - [128, 4096, 1, 256, 128, 128, 256, 256]
    - [64, 18.34]
  - - [128, 4096, 1, 512, 128, 128, 512, 512]
    - [64, 30.73]
  - - [128, 4096, 1, 1024, 128, 128, 1024, 1024]
    - [64, 45.17]
  - - [128, 4096, 1, 2048, 128, 128, 2048, 2048]
    - [63, 60.6]
  - - [128, 4096, 1, 4096, 128, 128, 4096, 4096]
    - [64, 68.72]
  - - [128, 4096, 1, 8192, 128, 128, 8192, 8192]
    - [64, 79.66]
  - - [128, 8192, 1, 128, 128, 128, 128, 128]
    - [43, 16.53]
  - - [128, 8192, 1, 256, 128, 128, 256, 256]
    - [59, 26.96]
  - - [128, 8192, 1, 512, 128, 128, 512, 512]
    - [61, 43.44]
  - - [128, 8192, 1, 1024, 128, 128, 1024, 1024]
    - [52, 59.31]
  - - [128, 8192, 1, 2048, 128, 128, 2048, 2048]
    - [52, 71.72]
  - - [128, 8192, 1, 4096, 128, 128, 4096, 4096]
    - [52, 85.88]
  - - [128, 8192, 1, 8192, 128, 128, 8192, 8192]
    - [57, 87.9]
  - - [256, 128, 1, 128, 256, 256, 128, 128]
    - [94, 0.96]
  - - [256, 128, 1, 256, 256, 256, 256, 256]
    - [94, 1.74]
  - - [256, 128, 1, 512, 256, 256, 512, 512]
    - [91, 2.88]
  - - [256, 128, 1, 1024, 256, 256, 1024, 1024]
    - [94, 4.53]
  - - [256, 128, 1, 2048, 256, 256, 2048, 2048]
    - [94, 6.07]
  - - [256, 128, 1, 4096, 256, 256, 4096, 4096]
    - [88, 7.76]
  - - [256, 128, 1, 8192, 256, 256, 8192, 8192]
    - [88, 8.88]
  - - [256, 256, 1, 128, 256, 256, 128, 128]
    - [94, 1.89]
  - - [256, 256, 1, 256, 256, 256, 256, 256]
    - [94, 3.31]
  - - [256, 256, 1, 512, 256, 256, 512, 512]
    - [94, 5.69]
  - - [256, 256, 1, 1024, 256, 256, 1024, 1024]
    - [89, 8.6]
  - - [256, 256, 1, 2048, 256, 256, 2048, 2048]
    - [94, 11.93]
  - - [256, 256, 1, 4096, 256, 256, 4096, 4096]
    - [95, 15.08]
  - - [256, 256, 1, 8192, 256, 256, 8192, 8192]
    - [100, 17.73]
  - - [256, 512, 1, 128, 256, 256, 128, 128]
    - [90, 3.61]
  - - [256, 512, 1, 256, 256, 256, 256, 256]
    - [94, 6.56]
  - - [256, 512, 1, 512, 256, 256, 512, 512]
    - [100, 10.83]
  - - [256, 512, 1, 1024, 256, 256, 1024, 1024]
    - [94, 16.91]
  - - [256, 512, 1, 2048, 256, 256, 2048, 2048]
    - [99, 23.02]
  - - [256, 512, 1, 4096, 256, 256, 4096, 4096]
    - [99, 29.45]
  - - [256, 512, 1, 8192, 256, 256, 8192, 8192]
    - [100, 34.98]
  - - [256, 1024, 1, 128, 256, 256, 128, 128]
    - [85, 6.57]
  - - [256, 1024, 1, 256, 256, 256, 256, 256]
    - [85, 11.14]
  - - [256, 1024, 1, 512, 256, 256, 512, 512]
    - [73, 18.73]
  - - [256, 1024, 1, 1024, 256, 256, 1024, 1024]
    - [74, 28.49]
  - - [256, 1024, 1, 2048, 256, 256, 2048, 2048]
    - [74, 38.08]
  - - [256, 1024, 1, 4096, 256, 256, 4096, 4096]
    - [94, 48.23]
  - - [256, 1024, 1, 8192, 256, 256, 8192, 8192]
    - [82, 55.87]
  - - [256, 2048, 1, 128, 256, 256, 128, 128]
    - [64, 10.89]
  - - [256, 2048, 1, 256, 256, 256, 256, 256]
    - [64, 18.51]
  - - [256, 2048, 1, 512, 256, 256, 512, 512]
    - [64, 31.29]
  - - [256, 2048, 1, 1024, 256, 256, 1024, 1024]
    - [64, 47.37]
  - - [256, 2048, 1, 2048, 256, 256, 2048, 2048]
    - [64, 62.81]
  - - [256, 2048, 1, 4096, 256, 256, 4096, 4096]
    - [64, 76.59]
  - - [256, 2048, 1, 8192, 256, 256, 8192, 8192]
    - [64, 83.52]
  - - [256, 4096, 1, 128, 256, 256, 128, 128]
    - [58, 16.43]
  - - [256, 4096, 1, 256, 256, 256, 256, 256]
    - [59, 27.66]
  - - [256, 4096, 1, 512, 256, 256, 512, 512]
    - [59, 45.49]
  - - [256, 4096, 1, 1024, 256, 256, 1024, 1024]
    - [59, 64.41]
  - - [256, 4096, 1, 2048, 256, 256, 2048, 2048]
    - [59, 80.71]
  - - [256, 4096, 1, 4096, 256, 256, 4096, 4096]
    - [60, 92.85]
  - - [256, 4096, 1, 8192, 256, 256, 8192, 8192]
    - [59, 97.25]
  - - [256, 8192, 1, 128, 256, 256, 128, 128]
    - [9, 23.57]
  - - [256, 8192, 1, 256, 256, 256, 256, 256]
    - [29, 36.63]
  - - [256, 8192, 1, 512, 256, 256, 512, 512]
    - [29, 54.42]
  - - [256, 8192, 1, 1024, 256, 256, 1024, 1024]
    - [61, 73.8]
  - - [256, 8192, 1, 2048, 256, 256, 2048, 2048]
    - [41, 95.91]
  - - [256, 8192, 1, 4096, 256, 256, 4096, 4096]
    - [59, 113.05]
  - - [256, 8192, 1, 8192, 256, 256, 8192, 8192]
    - [59, 108.24]
  - - [512, 128, 1, 128, 512, 512, 128, 128]
    - [92, 1.87]
  - - [512, 128, 1, 256, 512, 512, 256, 256]
    - [94, 3.43]
  - - [512, 128, 1, 512, 512, 512, 512, 512]
    - [103, 5.51]
  - - [512, 128, 1, 1024, 512, 512, 1024, 1024]
    - [94, 8.76]
  - - [512, 128, 1, 2048, 512, 512, 2048, 2048]
    - [99, 11.84]
  - - [512, 128, 1, 4096, 512, 512, 4096, 4096]
    - [88, 15.01]
  - - [512, 128, 1, 8192, 512, 512, 8192, 8192]
    - [100, 17.49]
  - - [512, 256, 1, 128, 512, 512, 128, 128]
    - [94, 3.76]
  - - [512, 256, 1, 256, 512, 512, 256, 256]
    - [94, 6.48]
  - - [512, 256, 1, 512, 512, 512, 512, 512]
    - [97, 11.11]
  - - [512, 256, 1, 1024, 512, 512, 1024, 1024]
    - [97, 17.17]
  - - [512, 256, 1, 2048, 512, 512, 2048, 2048]
    - [96, 23.25]
  - - [512, 256, 1, 4096, 512, 512, 4096, 4096]
    - [95, 29.6]
  - - [512, 256, 1, 8192, 512, 512, 8192, 8192]
    - [100, 35.28]
  - - [512, 512, 1, 128, 512, 512, 128, 128]
    - [84, 6.32]
  - - [512, 512, 1, 256, 512, 512, 256, 256]
    - [74, 11.02]
  - - [512, 512, 1, 512, 512, 512, 512, 512]
    - [74, 18.9]
  - - [512, 512, 1, 1024, 512, 512, 1024, 1024]
    - [77, 28.55]
  - - [512, 512, 1, 2048, 512, 512, 2048, 2048]
    - [78, 38.1]
  - - [512, 512, 1, 4096, 512, 512, 4096, 4096]
    - [103, 48.16]
  - - [512, 512, 1, 8192, 512, 512, 8192, 8192]
    - [78, 56.77]
  - - [512, 1024, 1, 128, 512, 512, 128, 128]
    - [64, 10.58]
  - - [512, 1024, 1, 256, 512, 512, 256, 256]
    - [64, 18.53]
  - - [512, 1024, 1, 512, 512, 512, 512, 512]
    - [64, 31.29]
  - - [512, 1024, 1, 1024, 512, 512, 1024, 1024]
    - [69, 47.34]
  - - [512, 1024, 1, 2048, 512, 512, 2048, 2048]
    - [69, 63.13]
  - - [512, 1024, 1, 4096, 512, 512, 4096, 4096]
    - [64, 77.21]
  - - [512, 1024, 1, 8192, 512, 512, 8192, 8192]
    - [69, 87.77]
  - - [512, 2048, 1, 128, 512, 512, 128, 128]
    - [59, 16.58]
  - - [512, 2048, 1, 256, 512, 512, 256, 256]
    - [52, 27.58]
  - - [512, 2048, 1, 512, 512, 512, 512, 512]
    - [59, 45.34]
  - - [512, 2048, 1, 1024, 512, 512, 1024, 1024]
    - [59, 65.4]
  - - [512, 2048, 1, 2048, 512, 512, 2048, 2048]
    - [52, 84.34]
  - - [512, 2048, 1, 4096, 512, 512, 4096, 4096]
    - [52, 97.24]
  - - [512, 2048, 1, 8192, 512, 512, 8192, 8192]
    - [59, 98.41]
  - - [512, 4096, 1, 128, 512, 512, 128, 128]
    - [9, 23.63]
  - - [512, 4096, 1, 256, 512, 512, 256, 256]
    - [29, 37.67]
  - - [512, 4096, 1, 512, 512, 512, 512, 512]
    - [29, 56.46]
  - - [512, 4096, 1, 1024, 512, 512, 1024, 1024]
    - [59, 78.11]
  - - [512, 4096, 1, 2048, 512, 512, 2048, 2048]
    - [42, 95.94]
  - - [512, 4096, 1, 4096, 512, 512, 4096, 4096]
    - [60, 99.31]
  - - [512, 4096, 1, 8192, 512, 512, 8192, 8192]
    - [29, 104.55]
  - - [512, 8192, 1, 128, 512, 512, 128, 128]
    - [7, 29.01]
  - - [512, 8192, 1, 256, 512, 512, 256, 256]
    - [21, 44.82]
  - - [512, 8192, 1, 512, 512, 512, 512, 512]
    - [25, 66.25]
  - - [512, 8192, 1, 1024, 512, 512, 1024, 1024]
    - [8, 87.63]
  - - [512, 8192, 1, 2048, 512, 512, 2048, 2048]
    - [28, 116.54]
  - - [512, 8192, 1, 4096, 512, 512, 4096, 4096]
    - [34, 119.04]
  - - [512, 8192, 1, 8192, 512, 512, 8192, 8192]
    - [5, 127.12]
  - - [1024, 128, 1, 128, 1024, 1024, 128, 128]
    - [48, 2.42]
  - - [1024, 128, 1, 256, 1024, 1024, 256, 256]
    - [50, 4.68]
  - - [1024, 128, 1, 512, 1024, 1024, 512, 512]
    - [75, 9.01]
  - - [1024, 128, 1, 1024, 1024, 1024, 1024, 1024]
    - [98, 16.28]
  - - [1024, 128, 1, 2048, 1024, 1024, 2048, 2048]
    - [102, 23.05]
  - - [1024, 128, 1, 4096, 1024, 1024, 4096, 4096]
    - [95, 28.89]
  - - [1024, 128, 1, 8192, 1024, 1024, 8192, 8192]
    - [97, 34.86]
  - - [1024, 256, 1, 128, 1024, 1024, 128, 128]
    - [86, 6.25]
  - - [1024, 256, 1, 256, 1024, 1024, 256, 256]
    - [76, 11.03]
  - - [1024, 256, 1, 512, 1024, 1024, 512, 512]
    - [87, 18.49]
  - - [1024, 256, 1, 1024, 1024, 1024, 1024, 1024]
    - [83, 28.52]
  - - [1024, 256, 1, 2048, 1024, 1024, 2048, 2048]
    - [80, 38.59]
  - - [1024, 256, 1, 4096, 1024, 1024, 4096, 4096]
    - [103, 47.9]
  - - [1024, 256, 1, 8192, 1024, 1024, 8192, 8192]
    - [81, 56.6]
  - - [1024, 512, 1, 128, 1024, 1024, 128, 128]
    - [71, 10.61]
  - - [1024, 512, 1, 256, 1024, 1024, 256, 256]
    - [69, 18.48]
  - - [1024, 512, 1, 512, 1024, 1024, 512, 512]
    - [66, 31.45]
  - - [1024, 512, 1, 1024, 1024, 1024, 1024, 1024]
    - [66, 48.13]
  - - [1024, 512, 1, 2048, 1024, 1024, 2048, 2048]
    - [66, 63.21]
  - - [1024, 512, 1, 4096, 1024, 1024, 4096, 4096]
    - [66, 78.44]
  - - [1024, 512, 1, 8192, 1024, 1024, 8192, 8192]
    - [66, 88.54]
  - - [1024, 1024, 1, 128, 1024, 1024, 128, 128]
    - [62, 16.68]
  - - [1024, 1024, 1, 256, 1024, 1024, 256, 256]
    - [62, 27.92]
  - - [1024, 1024, 1, 512, 1024, 1024, 512, 512]
    - [62, 46.04]
  - - [1024, 1024, 1, 1024, 1024, 1024, 1024, 1024]
    - [61, 65.59]
  - - [1024, 1024, 1, 2048, 1024, 1024, 2048, 2048]
    - [54, 84.11]
  - - [1024, 1024, 1, 4096, 1024, 1024, 4096, 4096]
    - [53, 101.16]
  - - [1024, 1024, 1, 8192, 1024, 1024, 8192, 8192]
    - [60, 102.91]
  - - [1024, 2048, 1, 128, 1024, 1024, 128, 128]
    - [9, 23.72]
  - - [1024, 2048, 1, 256, 1024, 1024, 256, 256]
    - [29, 38.6]
  - - [1024, 2048, 1, 512, 1024, 1024, 512, 512]
    - [29, 57.77]
  - - [1024, 2048, 1, 1024, 1024, 1024, 1024, 1024]
    - [59, 79.73]
  - - [1024, 2048, 1, 2048, 1024, 1024, 2048, 2048]
    - [38, 95.94]
  - - [1024, 2048, 1, 4096, 1024, 1024, 4096, 4096]
    - [52, 101.02]
  - - [1024, 2048, 1, 8192, 1024, 1024, 8192, 8192]
    - [35, 107.79]
  - - [1024, 4096, 1, 128, 1024, 1024, 128, 128]
    - [2, 29.12]
  - - [1024, 4096, 1, 256, 1024, 1024, 256, 256]
    - [20, 45.32]
  - - [1024, 4096, 1, 512, 1024, 1024, 512, 512]
    - [20, 67.17]
  - - [1024, 4096, 1, 1024, 1024, 1024, 1024, 1024]
    - [14, 88.28]
  - - [1024, 4096, 1, 2048, 1024, 1024, 2048, 2048]
    - [30, 114.2]
  - - [1024, 4096, 1, 4096, 1024, 1024, 4096, 4096]
    - [34, 119.02]
  - - [1024, 4096, 1, 8192, 1024, 1024, 8192, 8192]
    - [26, 127.95]
  - - [1024, 8192, 1, 128, 1024, 1024, 128, 128]
    - [3, 32.95]
  - - [1024, 8192, 1, 256, 1024, 1024, 256, 256]
    - [20, 50.4]
  - - [1024, 8192, 1, 512, 1024, 1024, 512, 512]
    - [43, 77.0]
  - - [1024, 8192, 1, 1024, 1024, 1024, 1024, 1024]
    - [59, 103.12]
  - - [1024, 8192, 1, 2048, 1024, 1024, 2048, 2048]
    - [25, 124.37]
  - - [1024, 8192, 1, 4096, 1024, 1024, 4096, 4096]
    - [23, 139.21]
  - - [1024, 8192, 1, 8192, 1024, 1024, 8192, 8192]
    - [0, 150.17]
  - - [2048, 128, 1, 128, 2048, 2048, 128, 128]
    - [49, 6.43]
  - - [2048, 128, 1, 256, 2048, 2048, 256, 256]
    - [74, 11.28]
  - - [2048, 128, 1, 512, 2048, 2048, 512, 512]
    - [72, 18.73]
  - - [2048, 128, 1, 1024, 2048, 2048, 1024, 1024]
    - [74, 28.48]
  - - [2048, 128, 1, 2048, 2048, 2048, 2048, 2048]
    - [79, 38.01]
  - - [2048, 128, 1, 4096, 2048, 2048, 4096, 4096]
    - [80, 47.03]
  - - [2048, 128, 1, 8192, 2048, 2048, 8192, 8192]
    - [76, 52.88]
  - - [2048, 256, 1, 128, 2048, 2048, 128, 128]
    - [69, 10.93]
  - - [2048, 256, 1, 256, 2048, 2048, 256, 256]
    - [69, 18.69]
  - - [2048, 256, 1, 512, 2048, 2048, 512, 512]
    - [66, 31.71]
  - - [2048, 256, 1, 1024, 2048, 2048, 1024, 1024]
    - [71, 47.11]
  - - [2048, 256, 1, 2048, 2048, 2048, 2048, 2048]
    - [71, 63.18]
  - - [2048, 256, 1, 4096, 2048, 2048, 4096, 4096]
    - [69, 77.76]
  - - [2048, 256, 1, 8192, 2048, 2048, 8192, 8192]
    - [70, 84.6]
  - - [2048, 512, 1, 128, 2048, 2048, 128, 128]
    - [43, 16.51]
  - - [2048, 512, 1, 256, 2048, 2048, 256, 256]
    - [60, 27.48]
  - - [2048, 512, 1, 512, 2048, 2048, 512, 512]
    - [61, 45.47]
  - - [2048, 512, 1, 1024, 2048, 2048, 1024, 1024]
    - [60, 66.47]
  - - [2048, 512, 1, 2048, 2048, 2048, 2048, 2048]
    - [60, 85.09]
  - - [2048, 512, 1, 4096, 2048, 2048, 4096, 4096]
    - [60, 96.47]
  - - [2048, 512, 1, 8192, 2048, 2048, 8192, 8192]
    - [61, 101.03]
  - - [2048, 1024, 1, 128, 2048, 2048, 128, 128]
    - [8, 23.13]
  - - [2048, 1024, 1, 256, 2048, 2048, 256, 256]
    - [31, 38.1]
  - - [2048, 1024, 1, 512, 2048, 2048, 512, 512]
    - [31, 57.99]
  - - [2048, 1024, 1, 1024, 2048, 2048, 1024, 1024]
    - [60, 81.39]
  - - [2048, 1024, 1, 2048, 2048, 2048, 2048, 2048]
    - [39, 98.74]
  - - [2048, 1024, 1, 4096, 2048, 2048, 4096, 4096]
    - [52, 113.94]
  - - [2048, 1024, 1, 8192, 2048, 2048, 8192, 8192]
    - [52, 112.03]
  - - [2048, 2048, 1, 128, 2048, 2048, 128, 128]
    - [1, 27.71]
  - - [2048, 2048, 1, 256, 2048, 2048, 256, 256]
    - [20, 44.35]
  - - [2048, 2048, 1, 512, 2048, 2048, 512, 512]
    - [26, 65.59]
  - - [2048, 2048, 1, 1024, 2048, 2048, 1024, 1024]
    - [9, 87.94]
  - - [2048, 2048, 1, 2048, 2048, 2048, 2048, 2048]
    - [29, 115.89]
  - - [2048, 2048, 1, 4096, 2048, 2048, 4096, 4096]
    - [29, 127.26]
  - - [2048, 2048, 1, 8192, 2048, 2048, 8192, 8192]
    - [27, 129.15]
  - - [2048, 4096, 1, 128, 2048, 2048, 128, 128]
    - [3, 32.18]
  - - [2048, 4096, 1, 256, 2048, 2048, 256, 256]
    - [26, 50.03]
  - - [2048, 4096, 1, 512, 2048, 2048, 512, 512]
    - [46, 76.97]
  - - [2048, 4096, 1, 1024, 2048, 2048, 1024, 1024]
    - [3, 102.07]
  - - [2048, 4096, 1, 2048, 2048, 2048, 2048, 2048]
    - [20, 129.12]
  - - [2048, 4096, 1, 4096, 2048, 2048, 4096, 4096]
    - [20, 144.8]
  - - [2048, 4096, 1, 8192, 2048, 2048, 8192, 8192]
    - [20, 151.63]
  - - [2048, 8192, 1, 128, 2048, 2048, 128, 128]
    - [3, 35.32]
  - - [2048, 8192, 1, 256, 2048, 2048, 256, 256]
    - [43, 56.93]
  - - [2048, 8192, 1, 512, 2048, 2048, 512, 512]
    - [29, 83.88]
  - - [2048, 8192, 1, 1024, 2048, 2048, 1024, 1024]
    - [31, 97.43]
  - - [2048, 8192, 1, 2048, 2048, 2048, 2048, 2048]
    - [20, 127.47]
  - - [2048, 8192, 1, 4096, 2048, 2048, 4096, 4096]
    - [18, 163.54]
  - - [2048, 8192, 1, 8192, 2048, 2048, 8192, 8192]
    - [18, 180.94]
  - - [4096, 128, 1, 128, 4096, 4096, 128, 128]
    - [16, 9.49]
  - - [4096, 128, 1, 256, 4096, 4096, 256, 256]
    - [67, 16.62]
  - - [4096, 128, 1, 512, 4096, 4096, 512, 512]
    - [71, 29.42]
  - - [4096, 128, 1, 1024, 4096, 4096, 1024, 1024]
    - [71, 44.76]
  - - [4096, 128, 1, 2048, 4096, 4096, 2048, 2048]
    - [65, 60.39]
  - - [4096, 128, 1, 4096, 4096, 4096, 4096, 4096]
    - [68, 68.83]
  - - [4096, 128, 1, 8192, 4096, 4096, 8192, 8192]
    - [70, 78.57]
  - - [4096, 256, 1, 128, 4096, 4096, 128, 128]
    - [45, 16.08]
  - - [4096, 256, 1, 256, 4096, 4096, 256, 256]
    - [61, 26.92]
  - - [4096, 256, 1, 512, 4096, 4096, 512, 512]
    - [60, 44.2]
  - - [4096, 256, 1, 1024, 4096, 4096, 1024, 1024]
    - [60, 65.35]
  - - [4096, 256, 1, 2048, 4096, 4096, 2048, 2048]
    - [60, 79.8]
  - - [4096, 256, 1, 4096, 4096, 4096, 4096, 4096]
    - [56, 93.13]
  - - [4096, 256, 1, 8192, 4096, 4096, 8192, 8192]
    - [54, 96.4]
  - - [4096, 512, 1, 128, 4096, 4096, 128, 128]
    - [12, 21.98]
  - - [4096, 512, 1, 256, 4096, 4096, 256, 256]
    - [37, 36.94]
  - - [4096, 512, 1, 512, 4096, 4096, 512, 512]
    - [37, 56.0]
  - - [4096, 512, 1, 1024, 4096, 4096, 1024, 1024]
    - [60, 78.62]
  - - [4096, 512, 1, 2048, 4096, 4096, 2048, 2048]
    - [39, 94.16]
  - - [4096, 512, 1, 4096, 4096, 4096, 4096, 4096]
    - [51, 113.81]
  - - [4096, 512, 1, 8192, 4096, 4096, 8192, 8192]
    - [52, 112.26]
  - - [4096, 1024, 1, 128, 4096, 4096, 128, 128]
    - [3, 26.62]
  - - [4096, 1024, 1, 256, 4096, 4096, 256, 256]
    - [20, 43.68]
  - - [4096, 1024, 1, 512, 4096, 4096, 512, 512]
    - [25, 65.18]
  - - [4096, 1024, 1, 1024, 4096, 4096, 1024, 1024]
    - [10, 86.05]
  - - [4096, 1024, 1, 2048, 4096, 4096, 2048, 2048]
    - [32, 117.69]
  - - [4096, 1024, 1, 4096, 4096, 4096, 4096, 4096]
    - [29, 130.39]
  - - [4096, 1024, 1, 8192, 4096, 4096, 8192, 8192]
    - [29, 135.93]
  - - [4096, 2048, 1, 128, 4096, 4096, 128, 128]
    - [2, 31.59]
  - - [4096, 2048, 1, 256, 4096, 4096, 256, 256]
    - [21, 49.75]
  - - [4096, 2048, 1, 512, 4096, 4096, 512, 512]
    - [47, 74.87]
  - - [4096, 2048, 1, 1024, 4096, 4096, 1024, 1024]
    - [4, 101.49]
  - - [4096, 2048, 1, 2048, 4096, 4096, 2048, 2048]
    - [18, 132.82]
  - - [4096, 2048, 1, 4096, 4096, 4096, 4096, 4096]
    - [20, 151.41]
  - - [4096, 2048, 1, 8192, 4096, 4096, 8192, 8192]
    - [20, 159.93]
  - - [4096, 4096, 1, 128, 4096, 4096, 128, 128]
    - [15, 34.04]
  - - [4096, 4096, 1, 256, 4096, 4096, 256, 256]
    - [44, 55.54]
  - - [4096, 4096, 1, 512, 4096, 4096, 512, 512]
    - [35, 84.9]
  - - [4096, 4096, 1, 1024, 4096, 4096, 1024, 1024]
    - [37, 98.97]
  - - [4096, 4096, 1, 2048, 4096, 4096, 2048, 2048]
    - [25, 129.9]
  - - [4096, 4096, 1, 4096, 4096, 4096, 4096, 4096]
    - [20, 160.94]
  - - [4096, 4096, 1, 8192, 4096, 4096, 8192, 8192]
    - [19, 169.41]
  - - [4096, 8192, 1, 128, 4096, 4096, 128, 128]
    - [13, 37.37]
  - - [4096, 8192, 1, 256, 4096, 4096, 256, 256]
    - [33, 57.39]
  - - [4096, 8192, 1, 512, 4096, 4096, 512, 512]
    - [33, 85.63]
  - - [4096, 8192, 1, 1024, 4096, 4096, 1024, 1024]
    - [22, 112.89]
  - - [4096, 8192, 1, 2048, 4096, 4096, 2048, 2048]
    - [27, 145.29]
  - - [4096, 8192, 1, 4096, 4096, 4096, 4096, 4096]
    - [20, 163.0]
  - - [4096, 8192, 1, 8192, 4096, 4096, 8192, 8192]
    - [34, 175.93]
  - - [8192, 128, 1, 128, 8192, 8192, 128, 128]
    - [46, 16.29]
  - - [8192, 128, 1, 256, 8192, 8192, 256, 256]
    - [61, 26.41]
  - - [8192, 128, 1, 512, 8192, 8192, 512, 512]
    - [62, 43.53]
  - - [8192, 128, 1, 1024, 8192, 8192, 1024, 1024]
    - [62, 62.49]
  - - [8192, 128, 1, 2048, 8192, 8192, 2048, 2048]
    - [60, 73.2]
  - - [8192, 128, 1, 4096, 8192, 8192, 4096, 4096]
    - [55, 86.6]
  - - [8192, 128, 1, 8192, 8192, 8192, 8192, 8192]
    - [51, 85.17]
  - - [8192, 256, 1, 128, 8192, 8192, 128, 128]
    - [12, 22.31]
  - - [8192, 256, 1, 256, 8192, 8192, 256, 256]
    - [37, 35.76]
  - - [8192, 256, 1, 512, 8192, 8192, 512, 512]
    - [29, 55.51]
  - - [8192, 256, 1, 1024, 8192, 8192, 1024, 1024]
    - [52, 70.28]
  - - [8192, 256, 1, 2048, 8192, 8192, 2048, 2048]
    - [40, 94.76]
  - - [8192, 256, 1, 4096, 8192, 8192, 4096, 4096]
    - [54, 111.64]
  - - [8192, 256, 1, 8192, 8192, 8192, 8192, 8192]
    - [52, 109.05]
  - - [8192, 512, 1, 128, 8192, 8192, 128, 128]
    - [6, 27.38]
  - - [8192, 512, 1, 256, 8192, 8192, 256, 256]
    - [26, 43.15]
  - - [8192, 512, 1, 512, 8192, 8192, 512, 512]
    - [21, 65.04]
  - - [8192, 512, 1, 1024, 8192, 8192, 1024, 1024]
    - [25, 85.24]
  - - [8192, 512, 1, 2048, 8192, 8192, 2048, 2048]
    - [31, 118.36]
  - - [8192, 512, 1, 4096, 8192, 8192, 4096, 4096]
    - [29, 131.36]
  - - [8192, 512, 1, 8192, 8192, 8192, 8192, 8192]
    - [29, 134.73]
  - - [8192, 1024, 1, 128, 8192, 8192, 128, 128]
    - [2, 31.97]
  - - [8192, 1024, 1, 256, 8192, 8192, 256, 256]
    - [20, 48.77]
  - - [8192, 1024, 1, 512, 8192, 8192, 512, 512]
    - [47, 73.88]
  - - [8192, 1024, 1, 1024, 8192, 8192, 1024, 1024]
    - [7, 103.79]
  - - [8192, 1024, 1, 2048, 8192, 8192, 2048, 2048]
    - [20, 130.62]
  - - [8192, 1024, 1, 4096, 8192, 8192, 4096, 4096]
    - [20, 151.95]
  - - [8192, 1024, 1, 8192, 8192, 8192, 8192, 8192]
    - [20, 155.67]
  - - [8192, 2048, 1, 128, 8192, 8192, 128, 128]
    - [3, 35.21]
  - - [8192, 2048, 1, 256, 8192, 8192, 256, 256]
    - [44, 55.24]
  - - [8192, 2048, 1, 512, 8192, 8192, 512, 512]
    - [34, 83.05]
  - - [8192, 2048, 1, 1024, 8192, 8192, 1024, 1024]
    - [34, 101.92]
  - - [8192, 2048, 1, 2048, 8192, 8192, 2048, 2048]
    - [18, 124.16]
  - - [8192, 2048, 1, 4096, 8192, 8192, 4096, 4096]
    - [25, 160.74]
  - - [8192, 2048, 1, 8192, 8192, 8192, 8192, 8192]
    - [17, 167.99]
  - - [8192, 4096, 1, 128, 8192, 8192, 128, 128]
    - [11, 38.35]
  - - [8192, 4096, 1, 256, 8192, 8192, 256, 256]
    - [36, 57.82]
  - - [8192, 4096, 1, 512, 8192, 8192, 512, 512]
    - [20, 84.71]
  - - [8192, 4096, 1, 1024, 8192, 8192, 1024, 1024]
    - [23, 114.21]
  - - [8192, 4096, 1, 2048, 8192, 8192, 2048, 2048]
    - [23, 145.79]
  - - [8192, 4096, 1, 4096, 8192, 8192, 4096, 4096]
    - [20, 169.37]
  - - [8192, 4096, 1, 8192, 8192, 8192, 8192, 8192]
    - [20, 180.98]
  - - [8192, 8192, 1, 128, 8192, 8192, 128, 128]
    - [6, 38.74]
  - - [8192, 8192, 1, 256, 8192, 8192, 256, 256]
    - [25, 59.95]
  - - [8192, 8192, 1, 512, 8192, 8192, 512, 512]
    - [20, 90.0]
  - - [8192, 8192, 1, 1024, 8192, 8192, 1024, 1024]
    - [25, 127.82]
  - - [8192, 8192, 1, 2048, 8192, 8192, 2048, 2048]
    - [24, 161.53]
  - - [8192, 8192, 1, 4096, 8192, 8192, 4096, 4096]
    - [23, 179.52]
  - - [8192, 8192, 1, 8192, 8192, 8192, 8192, 8192]
    - [20, 200.8]
  - - [1, 1, 1, 32, 1, 1, 32, 32]
    - [104, 0.0]
- null
- null
- ExperimentalStreamK
- GridBased
