projects/hipblaslt/library/src/amd_detail/rocblaslt/src/Tensile/Logic/asm_full/aquavanjaram/gfx942_228cu/StreamK/aquavanjaram942_Cijk_Alik_Bljk_F8NHS_BH_Bias_HAS_SAV_UserArgs.yaml
- {MinimumRequiredVersion: 4.33.0}
- aquavanjaram942
- {Architecture: gfx942, CUCount: 228}
- [Device 0049, Device 0050]
    SolutionIndex: 0
    SolutionNameMin: Cijk_Alik_Bljk_F8NHS_BH_Bias_HAS_SAV_UserArgs_MT256x256x64_MI16x16x1_SN_LDSB1_CLR1_GRVWA16_GRVWB8_GSU0_GSUC0_GSUWGMRR0_K1_LBSPPA512_LBSPPB512_LPA16_LPB8_LRVW8_MIWT8_8_PLR1_SU0_SUM0_SUS64_VWA8_VWB8_WGM1_WGMXCC1_WGMXCCGn1
    SolutionIndex: 1
    SolutionNameMin: Cijk_Alik_Bljk_F8NHS_BH_Bias_HAS_SAV_UserArgs_MT256x256x64_MI16x16x1_SN_LDSB1_CLR1_GRVWA8_GRVWB16_GSU0_GSUC0_GSUWGMRR0_K1_LBSPPA512_LBSPPB512_LPA8_LPB16_LRVW8_MIWT8_8_PLR1_SU0_SUM0_SUS64_VWA8_VWB8_WGM1_WGMXCC1_WGMXCCGn1
    SolutionIndex: 2
    SolutionNameMin: Cijk_Alik_Bljk_F8NHS_BH_Bias_HAS_SAV_UserArgs_MT256x256x64_MI16x16x1_SN_LDSB1_CLR1_GRVWA8_GRVWB16_GSU0_GSUC0_GSUWGMRR0_K1_LBSPPA512_LBSPPB512_LPA8_LPB16_LRVW8_MIWT8_8_PLR1_SU0_SUM0_SUS64_VWA8_VWB8_WGM6_WGMXCC1_WGMXCCGn1
    SolutionIndex: 3
    SolutionNameMin: Cijk_Alik_Bljk_F8NHS_BH_Bias_HAS_SAV_UserArgs_MT256x256x64_MI16x16x1_SN_LDSB1_CLR1_GRVWA16_GRVWB16_GSU0_GSUC0_GSUWGMRR0_K1_LBSPPA512_LBSPPB512_LPA16_LPB16_LRVW8_MIWT8_8_PLR1_SU0_SUM0_SUS64_VWA8_VWB8_WGM6_WGMXCC1_WGMXCCGn1
    SolutionIndex: 4
    SolutionNameMin: Cijk_Alik_Bljk_F8NHS_BH_Bias_HAS_SAV_UserArgs_MT256x256x64_MI16x16x1_SN_LDSB1_CLR1_GRVWA16_GRVWB8_GSU0_GSUC0_GSUWGMRR0_K1_LBSPPA512_LBSPPB512_LPA16_LPB8_LRVW8_MIWT8_8_PLR1_SU0_SUM0_SUS64_VWA8_VWB8_WGM8_WGMXCC1_WGMXCCGn1
    SolutionIndex: 5
    SolutionNameMin: Cijk_Alik_Bljk_F8NHS_BH_Bias_HAS_SAV_UserArgs_MT256x256x64_MI16x16x1_SN_LDSB1_CLR1_GRVWA16_GRVWB16_GSU0_GSUC0_GSUWGMRR0_K1_LBSPPA512_LBSPPB512_LPA16_LPB16_LRVW8_MIWT8_8_PLR1_SU0_SUM0_SUS64_VWA8_VWB8_WGM8_WGMXCC1_WGMXCCGn1
    SolutionIndex: 6
    SolutionNameMin: Cijk_Alik_Bljk_F8NHS_BH_Bias_HAS_SAV_UserArgs_MT128x256x64_MI16x16x1_SN_LDSB1_CLR1_GRVWA8_GRVWB16_GSU0_GSUC0_GSUWGMRR0_K1_LBSPPA256_LBSPPB512_LPA8_LPB16_LRVW8_MIWT4_8_PLR1_SU0_SUM0_SUS64_VWA4_VWB8_WGM1_WGMXCC1_WGMXCCGn1
    SolutionIndex: 7
    SolutionNameMin: Cijk_Alik_Bljk_F8NHS_BH_Bias_HAS_SAV_UserArgs_MT128x256x64_MI16x16x1_SN_LDSB1_CLR1_GRVWA8_GRVWB16_GSU0_GSUC0_GSUWGMRR0_K1_LBSPPA256_LBSPPB512_LPA8_LPB16_LRVW8_MIWT4_8_PLR1_SU0_SUM0_SUS64_VWA4_VWB8_WGM8_WGMXCC1_WGMXCCGn1
    SolutionIndex: 8
    SolutionNameMin: Cijk_Alik_Bljk_F8NHS_BH_Bias_HAS_SAV_UserArgs_MT256x128x64_MI16x16x1_SN_LDSB1_CLR1_GRVWA8_GRVWB16_GSU0_GSUC0_GSUWGMRR0_K1_LBSPPA512_LBSPPB256_LPA8_LPB16_LRVW8_MIWT8_4_PLR1_SU0_SUM0_SUS64_VWA8_VWB4_WGM1_WGMXCC1_WGMXCCGn1
    SolutionIndex: 9
    SolutionNameMin: Cijk_Alik_Bljk_F8NHS_BH_Bias_HAS_SAV_UserArgs_MT256x128x64_MI16x16x1_SN_LDSB1_CLR1_GRVWA16_GRVWB16_GSU0_GSUC0_GSUWGMRR0_K1_LBSPPA512_LBSPPB256_LPA16_LPB16_LRVW8_MIWT8_4_PLR1_SU0_SUM0_SUS64_VWA8_VWB4_WGM1_WGMXCC1_WGMXCCGn1
    SolutionIndex: 10
    SolutionNameMin: Cijk_Alik_Bljk_F8NHS_BH_Bias_HAS_SAV_UserArgs_MT256x128x64_MI16x16x1_SN_LDSB1_CLR1_GRVWA8_GRVWB16_GSU0_GSUC0_GSUWGMRR0_K1_LBSPPA512_LBSPPB256_LPA8_LPB16_LRVW8_MIWT8_4_PLR1_SU0_SUM0_SUS64_VWA8_VWB4_WGM6_WGMXCC1_WGMXCCGn1
    SolutionIndex: 11
    SolutionNameMin: Cijk_Alik_Bljk_F8NHS_BH_Bias_HAS_SAV_UserArgs_MT256x128x64_MI16x16x1_SN_LDSB1_CLR1_GRVWA8_GRVWB16_GSU0_GSUC0_GSUWGMRR0_K1_LBSPPA512_LBSPPB256_LPA8_LPB16_LRVW8_MIWT8_4_PLR1_SU0_SUM0_SUS64_VWA8_VWB4_WGM8_WGMXCC1_WGMXCCGn1
    SolutionIndex: 12
    SolutionNameMin: Cijk_Alik_Bljk_F8NHS_BH_Bias_HAS_SAV_UserArgs_MT256x128x64_MI16x16x1_SN_LDSB1_CLR1_GRVWA16_GRVWB16_GSU0_GSUC0_GSUWGMRR0_K1_LBSPPA512_LBSPPB256_LPA16_LPB16_LRVW8_MIWT8_4_PLR1_SU0_SUM0_SUS64_VWA8_VWB4_WGM8_WGMXCC1_WGMXCCGn1
    SolutionIndex: 13
    SolutionNameMin: Cijk_Alik_Bljk_F8NHS_BH_Bias_HAS_SAV_UserArgs_MT256x64x64_MI16x16x1_SN_LDSB1_CLR1_GRVWA16_GRVWB8_GSU0_GSUC0_GSUWGMRR0_K1_LBSPPA512_LBSPPB128_LPA16_LPB8_LRVW8_MIWT8_2_PLR1_SU0_SUM0_SUS64_VWA8_VWB2_WGM1_WGMXCC1_WGMXCCGn1
    SolutionIndex: 14
    SolutionNameMin: Cijk_Alik_Bljk_F8NHS_BH_Bias_HAS_SAV_UserArgs_MT128x128x64_MI16x16x1_SN_LDSB1_CLR1_GRVWA8_GRVWB16_GSU0_GSUC0_GSUWGMRR0_K1_LBSPPA512_LBSPPB128_LPA8_LPB16_LRVW8_MIWT8_2_PLR1_SU0_SUM0_SUS64_VWA8_VWB2_WGM1_WGMXCC1_WGMXCCGn1
    SolutionIndex: 15
    SolutionNameMin: Cijk_Alik_Bljk_F8NHS_BH_Bias_HAS_SAV_UserArgs_MT128x128x64_MI16x16x1_SN_LDSB1_CLR1_GRVWA16_GRVWB16_GSU0_GSUC0_GSUWGMRR0_K1_LBSPPA512_LBSPPB128_LPA16_LPB16_LRVW8_MIWT8_2_PLR1_SU0_SUM0_SUS64_VWA8_VWB2_WGM1_WGMXCC1_WGMXCCGn1
    SolutionIndex: 16
    SolutionNameMin: Cijk_Alik_Bljk_F8NHS_BH_Bias_HAS_SAV_UserArgs_MT128x128x64_MI16x16x1_SN_LDSB1_CLR1_GRVWA8_GRVWB16_GSU0_GSUC0_GSUWGMRR0_K1_LBSPPA512_LBSPPB128_LPA8_LPB16_LRVW8_MIWT8_2_PLR1_SU0_SUM0_SUS64_VWA8_VWB2_WGM6_WGMXCC1_WGMXCCGn1
    SolutionIndex: 17
    SolutionNameMin: Cijk_Alik_Bljk_F8NHS_BH_Bias_HAS_SAV_UserArgs_MT128x128x64_MI16x16x1_SN_LDSB1_CLR1_GRVWA8_GRVWB16_GSU0_GSUC0_GSUWGMRR0_K1_LBSPPA512_LBSPPB128_LPA8_LPB16_LRVW8_MIWT8_2_PLR1_SU0_SUM0_SUS64_VWA8_VWB2_WGM8_WGMXCC1_WGMXCCGn1
    SolutionIndex: 18
    SolutionNameMin: Cijk_Alik_Bljk_F8NHS_BH_Bias_HAS_SAV_UserArgs_MT128x64x64_MI16x16x1_SN_LDSB0_CLR1_GRVWA8_GRVWB16_GSU0_GSUC0_GSUWGMRR0_K1_LBSPPA512_LBSPPB128_LPA8_LPB16_LRVW8_MIWT8_1_PLR1_SU0_SUM0_SUS64_VWA8_VWB1_WGM1_WGMXCC1_WGMXCCGn1
    SolutionIndex: 19
    SolutionNameMin: Cijk_Alik_Bljk_F8NHS_BH_Bias_HAS_SAV_UserArgs_MT64x128x64_MI16x16x1_SN_LDSB0_CLR1_GRVWA8_GRVWB8_GSU0_GSUC0_GSUWGMRR0_K1_LBSPPA128_LBSPPB256_LPA8_LPB8_LRVW8_MIWT2_4_PLR1_SU0_SUM0_SUS64_VWA2_VWB4_WGM1_WGMXCC1_WGMXCCGn1
    SolutionIndex: 20
    SolutionNameMin: Cijk_Alik_Bljk_F8NHS_BH_Bias_HAS_SAV_UserArgs_MT64x128x64_MI16x16x1_SN_LDSB0_CLR1_GRVWA8_GRVWB16_GSU0_GSUC0_GSUWGMRR0_K1_LBSPPA128_LBSPPB256_LPA8_LPB16_LRVW8_MIWT2_4_PLR1_SU0_SUM0_SUS64_VWA2_VWB4_WGM1_WGMXCC1_WGMXCCGn1
    SolutionIndex: 21
    SolutionNameMin: Cijk_Alik_Bljk_F8NHS_BH_Bias_HAS_SAV_UserArgs_MT64x128x64_MI16x16x1_SN_LDSB0_CLR1_GRVWA16_GRVWB16_GSU0_GSUC0_GSUWGMRR0_K1_LBSPPA128_LBSPPB256_LPA16_LPB16_LRVW8_MIWT2_4_PLR1_SU0_SUM0_SUS64_VWA2_VWB4_WGM1_WGMXCC1_WGMXCCGn1
    SolutionIndex: 22
    SolutionNameMin: Cijk_Alik_Bljk_F8NHS_BH_Bias_HAS_SAV_UserArgs_MT128x64x64_MI16x16x1_SN_LDSB0_CLR1_GRVWA8_GRVWB16_GSU0_GSUC0_GSUWGMRR0_K1_LBSPPA256_LBSPPB128_LPA8_LPB16_LRVW8_MIWT4_2_PLR1_SU0_SUM0_SUS64_VWA4_VWB2_WGM1_WGMXCC1_WGMXCCGn1
    SolutionIndex: 23
    SolutionNameMin: Cijk_Alik_Bljk_F8NHS_BH_Bias_HAS_SAV_UserArgs_MT128x64x64_MI16x16x1_SN_LDSB0_CLR1_GRVWA16_GRVWB16_GSU0_GSUC0_GSUWGMRR0_K1_LBSPPA256_LBSPPB128_LPA16_LPB16_LRVW8_MIWT4_2_PLR1_SU0_SUM0_SUS64_VWA4_VWB2_WGM1_WGMXCC1_WGMXCCGn1
    SolutionIndex: 24
    SolutionNameMin: Cijk_Alik_Bljk_F8NHS_BH_Bias_HAS_SAV_UserArgs_MT128x64x64_MI16x16x1_SN_LDSB0_CLR1_GRVWA8_GRVWB16_GSU0_GSUC0_GSUWGMRR0_K1_LBSPPA256_LBSPPB128_LPA8_LPB16_LRVW8_MIWT4_2_PLR1_SU0_SUM0_SUS64_VWA4_VWB2_WGM6_WGMXCC1_WGMXCCGn1
    SolutionIndex: 25
    SolutionNameMin: Cijk_Alik_Bljk_F8NHS_BH_Bias_HAS_SAV_UserArgs_MT128x64x64_MI16x16x1_SN_LDSB0_CLR1_GRVWA8_GRVWB16_GSU0_GSUC0_GSUWGMRR0_K1_LBSPPA256_LBSPPB128_LPA8_LPB16_LRVW8_MIWT4_2_PLR1_SU0_SUM0_SUS64_VWA4_VWB2_WGM8_WGMXCC1_WGMXCCGn1
    SolutionIndex: 26
    SolutionNameMin: Cijk_Alik_Bljk_F8NHS_BH_Bias_HAS_SAV_UserArgs_MT64x64x64_MI16x16x1_SN_LDSB0_CLR1_GRVWA8_GRVWB8_GSU0_GSUC0_GSUWGMRR0_K1_LBSPPA128_LBSPPB128_LPA8_LPB8_LRVW8_MIWT2_2_PLR1_SU0_SUM0_SUS64_VWA2_VWB2_WGM1_WGMXCC1_WGMXCCGn1
    SolutionIndex: 27
    SolutionNameMin: Cijk_Alik_Bljk_F8NHS_BH_Bias_HAS_SAV_UserArgs_MT64x64x64_MI16x16x1_SN_LDSB0_CLR1_GRVWA16_GRVWB8_GSU0_GSUC0_GSUWGMRR0_K1_LBSPPA128_LBSPPB128_LPA16_LPB8_LRVW8_MIWT2_2_PLR1_SU0_SUM0_SUS64_VWA2_VWB2_WGM1_WGMXCC1_WGMXCCGn1
    SolutionIndex: 28
    SolutionNameMin: Cijk_Alik_Bljk_F8NHS_BH_Bias_HAS_SAV_UserArgs_MT64x64x64_MI16x16x1_SN_LDSB0_CLR1_GRVWA8_GRVWB16_GSU0_GSUC0_GSUWGMRR0_K1_LBSPPA128_LBSPPB128_LPA8_LPB16_LRVW8_MIWT2_2_PLR1_SU0_SUM0_SUS64_VWA2_VWB2_WGM1_WGMXCC1_WGMXCCGn1
    SolutionIndex: 29
    SolutionNameMin: Cijk_Alik_Bljk_F8NHS_BH_Bias_HAS_SAV_UserArgs_MT64x64x64_MI16x16x1_SN_LDSB0_CLR1_GRVWA16_GRVWB16_GSU0_GSUC0_GSUWGMRR0_K1_LBSPPA128_LBSPPB128_LPA16_LPB16_LRVW8_MIWT2_2_PLR1_SU0_SUM0_SUS64_VWA2_VWB2_WGM8_WGMXCC1_WGMXCCGn1
    SolutionIndex: 30
    SolutionNameMin: Cijk_Alik_Bljk_F8NHS_BH_Bias_HAS_SAV_UserArgs_MT32x64x64_MI16x16x1_SN_LDSB0_CLR1_GRVWA8_GRVWB8_GSU0_GSUC0_GSUWGMRR0_K1_LBSPPA128_LBSPPB128_LPA8_LPB8_LRVW8_MIWT1_2_PLR1_SU0_SUM0_SUS64_VWA1_VWB2_WGM1_WGMXCC1_WGMXCCGn1
    SolutionIndex: 31
    SolutionNameMin: Cijk_Alik_Bljk_F8NHS_BH_Bias_HAS_SAV_UserArgs_MT32x64x64_MI16x16x1_SN_LDSB0_CLR1_GRVWA8_GRVWB16_GSU0_GSUC0_GSUWGMRR0_K1_LBSPPA128_LBSPPB128_LPA8_LPB16_LRVW8_MIWT1_2_PLR1_SU0_SUM0_SUS64_VWA1_VWB2_WGM1_WGMXCC1_WGMXCCGn1
    SolutionIndex: 32
    SolutionNameMin: Cijk_Alik_Bljk_F8NHS_BH_Bias_HAS_SAV_UserArgs_MT64x32x64_MI16x16x1_SN_LDSB0_CLR1_GRVWA8_GRVWB8_GSU0_GSUC0_GSUWGMRR0_K1_LBSPPA128_LBSPPB128_LPA8_LPB8_LRVW8_MIWT2_1_PLR1_SU0_SUM0_SUS64_VWA2_VWB1_WGM1_WGMXCC1_WGMXCCGn1
    SolutionIndex: 33
    SolutionNameMin: Cijk_Alik_Bljk_F8NHS_BH_Bias_HAS_SAV_UserArgs_MT64x32x64_MI16x16x1_SN_LDSB0_CLR1_GRVWA16_GRVWB8_GSU0_GSUC0_GSUWGMRR0_K1_LBSPPA128_LBSPPB128_LPA16_LPB8_LRVW8_MIWT2_1_PLR1_SU0_SUM0_SUS64_VWA2_VWB1_WGM6_WGMXCC1_WGMXCCGn1
    SolutionIndex: 34
    SolutionNameMin: Cijk_Alik_Bljk_F8NHS_BH_Bias_HAS_SAV_UserArgs_MT32x32x64_MI16x16x1_SN_LDSB0_CLR1_GRVWA8_GRVWB8_GSU0_GSUC0_GSUWGMRR0_K1_LBSPPA128_LBSPPB128_LPA8_LPB8_LRVW8_MIWT1_1_PLR1_SU0_SUM0_SUS64_VWA1_VWB1_WGM1_WGMXCC1_WGMXCCGn1
    SolutionIndex: 35
    SolutionNameMin: Cijk_Alik_Bljk_F8NHS_BH_Bias_HAS_SAV_UserArgs_MT128x256x128_MI16x16x1_SN_LDSB1_CLR1_GRVWA8_GRVWB16_GSU0_GSUC0_GSUWGMRR0_K1_LBSPPA512_LBSPPB1024_LPA8_LPB16_LRVW8_MIWT4_8_PLR1_SU0_SUM0_SUS128_VWA4_VWB8_WGM1_WGMXCC1_WGMXCCGn1
    SolutionIndex: 36
    SolutionNameMin: Cijk_Alik_Bljk_F8NHS_BH_Bias_HAS_SAV_UserArgs_MT128x256x128_MI16x16x1_SN_LDSB1_CLR1_GRVWA8_GRVWB16_GSU0_GSUC0_GSUWGMRR0_K1_LBSPPA512_LBSPPB1024_LPA8_LPB16_LRVW8_MIWT4_8_PLR1_SU0_SUM0_SUS128_VWA4_VWB8_WGM6_WGMXCC1_WGMXCCGn1
    SolutionIndex: 37
    SolutionNameMin: Cijk_Alik_Bljk_F8NHS_BH_Bias_HAS_SAV_UserArgs_MT256x144x128_MI16x16x1_SN_LDSB1_CLR1_GRVWA8_GRVWB8_GSU0_GSUC0_GSUWGMRR0_K1_LBSPPA512_LBSPPB128_LPA8_LPB8_LRVW8_MIWT4_9_PLR1_SU0_SUM0_SUS128_VWA4_VWB1_WGM1_WGMXCC1_WGMXCCGn1
    SolutionIndex: 38
    SolutionNameMin: Cijk_Alik_Bljk_F8NHS_BH_Bias_HAS_SAV_UserArgs_MT256x144x128_MI16x16x1_SN_LDSB1_CLR1_GRVWA16_GRVWB8_GSU0_GSUC0_GSUWGMRR0_K1_LBSPPA512_LBSPPB128_LPA16_LPB8_LRVW8_MIWT4_9_PLR1_SU0_SUM0_SUS128_VWA4_VWB1_WGM1_WGMXCC1_WGMXCCGn1
    SolutionIndex: 39
    SolutionNameMin: Cijk_Alik_Bljk_F8NHS_BH_Bias_HAS_SAV_UserArgs_MT256x144x128_MI16x16x1_SN_LDSB1_CLR1_GRVWA8_GRVWB8_GSU0_GSUC0_GSUWGMRR0_K1_LBSPPA512_LBSPPB128_LPA8_LPB8_LRVW8_MIWT4_9_PLR1_SU0_SUM0_SUS128_VWA4_VWB1_WGM6_WGMXCC1_WGMXCCGn1
    SolutionIndex: 40
    SolutionNameMin: Cijk_Alik_Bljk_F8NHS_BH_Bias_HAS_SAV_UserArgs_MT256x144x128_MI16x16x1_SN_LDSB1_CLR1_GRVWA16_GRVWB8_GSU0_GSUC0_GSUWGMRR0_K1_LBSPPA512_LBSPPB128_LPA16_LPB8_LRVW8_MIWT4_9_PLR1_SU0_SUM0_SUS128_VWA4_VWB1_WGM6_WGMXCC1_WGMXCCGn1
    SolutionIndex: 41
    SolutionNameMin: Cijk_Alik_Bljk_F8NHS_BH_Bias_HAS_SAV_UserArgs_MT256x144x128_MI16x16x1_SN_LDSB1_CLR1_GRVWA8_GRVWB8_GSU0_GSUC0_GSUWGMRR0_K1_LBSPPA512_LBSPPB128_LPA8_LPB8_LRVW8_MIWT4_9_PLR1_SU0_SUM0_SUS128_VWA4_VWB1_WGM8_WGMXCC1_WGMXCCGn1
    SolutionIndex: 42
    SolutionNameMin: Cijk_Alik_Bljk_F8NHS_BH_Bias_HAS_SAV_UserArgs_MT256x144x128_MI16x16x1_SN_LDSB1_CLR1_GRVWA16_GRVWB8_GSU0_GSUC0_GSUWGMRR0_K1_LBSPPA512_LBSPPB128_LPA16_LPB8_LRVW8_MIWT4_9_PLR1_SU0_SUM0_SUS128_VWA4_VWB1_WGM8_WGMXCC1_WGMXCCGn1
    SolutionIndex: 43
    SolutionNameMin: Cijk_Alik_Bljk_F8NHS_BH_Bias_HAS_SAV_UserArgs_MT256x128x128_MI16x16x1_SN_LDSB1_CLR1_GRVWA8_GRVWB16_GSU0_GSUC0_GSUWGMRR0_K1_LBSPPA1024_LBSPPB512_LPA8_LPB16_LRVW8_MIWT8_4_PLR1_SU0_SUM0_SUS128_VWA8_VWB4_WGM1_WGMXCC1_WGMXCCGn1
    SolutionIndex: 44
    SolutionNameMin: Cijk_Alik_Bljk_F8NHS_BH_Bias_HAS_SAV_UserArgs_MT256x128x128_MI16x16x1_SN_LDSB1_CLR1_GRVWA8_GRVWB16_GSU0_GSUC0_GSUWGMRR0_K1_LBSPPA1024_LBSPPB512_LPA8_LPB16_LRVW8_MIWT8_4_PLR1_SU0_SUM0_SUS128_VWA8_VWB4_WGM6_WGMXCC1_WGMXCCGn1
    SolutionIndex: 45
    SolutionNameMin: Cijk_Alik_Bljk_F8NHS_BH_Bias_HAS_SAV_UserArgs_MT256x128x128_MI16x16x1_SN_LDSB1_CLR1_GRVWA8_GRVWB16_GSU0_GSUC0_GSUWGMRR0_K1_LBSPPA1024_LBSPPB512_LPA8_LPB16_LRVW8_MIWT8_4_PLR1_SU0_SUM0_SUS128_VWA8_VWB4_WGM8_WGMXCC1_WGMXCCGn1
    SolutionIndex: 46
    SolutionNameMin: Cijk_Alik_Bljk_F8NHS_BH_Bias_HAS_SAV_UserArgs_MT144x256x128_MI16x16x1_SN_LDSB1_CLR1_GRVWA8_GRVWB16_GSU0_GSUC0_GSUWGMRR0_K1_LBSPPA128_LBSPPB512_LPA8_LPB16_LRVW8_MIWT9_4_PLR1_SU0_SUM0_SUS128_VWA1_VWB4_WGM1_WGMXCC1_WGMXCCGn1
    SolutionIndex: 47
    SolutionNameMin: Cijk_Alik_Bljk_F8NHS_BH_Bias_HAS_SAV_UserArgs_MT144x256x128_MI16x16x1_SN_LDSB1_CLR1_GRVWA8_GRVWB16_GSU0_GSUC0_GSUWGMRR0_K1_LBSPPA128_LBSPPB512_LPA8_LPB16_LRVW8_MIWT9_4_PLR1_SU0_SUM0_SUS128_VWA1_VWB4_WGM6_WGMXCC1_WGMXCCGn1
    SolutionIndex: 48
    SolutionNameMin: Cijk_Alik_Bljk_F8NHS_BH_Bias_HAS_SAV_UserArgs_MT144x256x128_MI16x16x1_SN_LDSB1_CLR1_GRVWA8_GRVWB16_GSU0_GSUC0_GSUWGMRR0_K1_LBSPPA128_LBSPPB512_LPA8_LPB16_LRVW8_MIWT9_4_PLR1_SU0_SUM0_SUS128_VWA1_VWB4_WGM8_WGMXCC1_WGMXCCGn1
    SolutionIndex: 49
    SolutionNameMin: Cijk_Alik_Bljk_F8NHS_BH_Bias_HAS_SAV_UserArgs_MT128x128x128_MI16x16x1_SN_LDSB1_CLR1_GRVWA8_GRVWB16_GSU0_GSUC0_GSUWGMRR0_K1_LBSPPA1024_LBSPPB256_LPA8_LPB16_LRVW8_MIWT8_2_PLR1_SU0_SUM0_SUS128_VWA8_VWB2_WGM1_WGMXCC1_WGMXCCGn1
    SolutionIndex: 50
    SolutionNameMin: Cijk_Alik_Bljk_F8NHS_BH_Bias_HAS_SAV_UserArgs_MT128x128x128_MI16x16x1_SN_LDSB1_CLR1_GRVWA8_GRVWB16_GSU0_GSUC0_GSUWGMRR0_K1_LBSPPA1024_LBSPPB256_LPA8_LPB16_LRVW8_MIWT8_2_PLR1_SU0_SUM0_SUS128_VWA8_VWB2_WGM6_WGMXCC1_WGMXCCGn1
    SolutionIndex: 51
    SolutionNameMin: Cijk_Alik_Bljk_F8NHS_BH_Bias_HAS_SAV_UserArgs_MT128x128x128_MI16x16x1_SN_LDSB1_CLR1_GRVWA8_GRVWB16_GSU0_GSUC0_GSUWGMRR0_K1_LBSPPA1024_LBSPPB256_LPA8_LPB16_LRVW8_MIWT8_2_PLR1_SU0_SUM0_SUS128_VWA8_VWB2_WGM8_WGMXCC1_WGMXCCGn1
    SolutionIndex: 52
    SolutionNameMin: Cijk_Alik_Bljk_F8NHS_BH_Bias_HAS_SAV_UserArgs_MT128x144x128_MI16x16x1_SN_LDSB1_CLR1_GRVWA8_GRVWB8_GSU0_GSUC0_GSUWGMRR0_K1_LBSPPA256_LBSPPB128_LPA8_LPB8_LRVW8_MIWT2_9_PLR1_SU0_SUM0_SUS128_VWA2_VWB1_WGM1_WGMXCC1_WGMXCCGn1
    SolutionIndex: 53
    SolutionNameMin: Cijk_Alik_Bljk_F8NHS_BH_Bias_HAS_SAV_UserArgs_MT128x144x128_MI16x16x1_SN_LDSB1_CLR1_GRVWA16_GRVWB8_GSU0_GSUC0_GSUWGMRR0_K1_LBSPPA256_LBSPPB128_LPA16_LPB8_LRVW8_MIWT2_9_PLR1_SU0_SUM0_SUS128_VWA2_VWB1_WGM1_WGMXCC1_WGMXCCGn1
    SolutionIndex: 54
    SolutionNameMin: Cijk_Alik_Bljk_F8NHS_BH_Bias_HAS_SAV_UserArgs_MT128x144x128_MI16x16x1_SN_LDSB1_CLR1_GRVWA8_GRVWB8_GSU0_GSUC0_GSUWGMRR0_K1_LBSPPA256_LBSPPB128_LPA8_LPB8_LRVW8_MIWT2_9_PLR1_SU0_SUM0_SUS128_VWA2_VWB1_WGM6_WGMXCC1_WGMXCCGn1
    SolutionIndex: 55
    SolutionNameMin: Cijk_Alik_Bljk_F8NHS_BH_Bias_HAS_SAV_UserArgs_MT128x144x128_MI16x16x1_SN_LDSB1_CLR1_GRVWA8_GRVWB8_GSU0_GSUC0_GSUWGMRR0_K1_LBSPPA256_LBSPPB128_LPA8_LPB8_LRVW8_MIWT2_9_PLR1_SU0_SUM0_SUS128_VWA2_VWB1_WGM8_WGMXCC1_WGMXCCGn1
    SolutionIndex: 56
    SolutionNameMin: Cijk_Alik_Bljk_F8NHS_BH_Bias_HAS_SAV_UserArgs_MT144x128x128_MI16x16x1_SN_LDSB1_CLR1_GRVWA8_GRVWB16_GSU0_GSUC0_GSUWGMRR0_K1_LBSPPA128_LBSPPB256_LPA8_LPB16_LRVW8_MIWT9_2_PLR1_SU0_SUM0_SUS128_VWA1_VWB2_WGM6_WGMXCC1_WGMXCCGn1
    SolutionIndex: 57
    SolutionNameMin: Cijk_Alik_Bljk_F8NHS_BH_Bias_HAS_SAV_UserArgs_MT144x128x128_MI16x16x1_SN_LDSB1_CLR1_GRVWA8_GRVWB16_GSU0_GSUC0_GSUWGMRR0_K1_LBSPPA128_LBSPPB256_LPA8_LPB16_LRVW8_MIWT9_2_PLR1_SU0_SUM0_SUS128_VWA1_VWB2_WGM8_WGMXCC1_WGMXCCGn1
    SolutionIndex: 58
    SolutionNameMin: Cijk_Alik_Bljk_F8NHS_BH_Bias_HAS_SAV_UserArgs_MT128x128x128_MI16x16x1_SN_LDSB1_CLR1_GRVWA8_GRVWB16_GSU0_GSUC0_GSUWGMRR0_K1_LBSPPA512_LBSPPB512_LPA8_LPB16_LRVW8_MIWT4_4_PLR1_SU0_SUM0_SUS128_VWA4_VWB4_WGM1_WGMXCC1_WGMXCCGn1
    SolutionIndex: 59
    SolutionNameMin: Cijk_Alik_Bljk_F8NHS_BH_Bias_HAS_SAV_UserArgs_MT128x128x128_MI16x16x1_SN_LDSB1_CLR1_GRVWA16_GRVWB16_GSU0_GSUC0_GSUWGMRR0_K1_LBSPPA512_LBSPPB512_LPA16_LPB16_LRVW8_MIWT4_4_PLR1_SU0_SUM0_SUS128_VWA4_VWB4_WGM1_WGMXCC1_WGMXCCGn1
    SolutionIndex: 60
    SolutionNameMin: Cijk_Alik_Bljk_F8NHS_BH_Bias_HAS_SAV_UserArgs_MT128x128x128_MI16x16x1_SN_LDSB1_CLR1_GRVWA16_GRVWB16_GSU0_GSUC0_GSUWGMRR0_K1_LBSPPA512_LBSPPB512_LPA16_LPB16_LRVW8_MIWT4_4_PLR1_SU0_SUM0_SUS128_VWA4_VWB4_WGM6_WGMXCC1_WGMXCCGn1
    SolutionIndex: 61
    SolutionNameMin: Cijk_Alik_Bljk_F8NHS_BH_Bias_HAS_SAV_UserArgs_MT128x128x128_MI16x16x1_SN_LDSB1_CLR1_GRVWA8_GRVWB16_GSU0_GSUC0_GSUWGMRR0_K1_LBSPPA512_LBSPPB512_LPA8_LPB16_LRVW8_MIWT4_4_PLR1_SU0_SUM0_SUS128_VWA4_VWB4_WGM8_WGMXCC1_WGMXCCGn1
    SolutionIndex: 62
    SolutionNameMin: Cijk_Alik_Bljk_F8NHS_BH_Bias_HAS_SAV_UserArgs_MT64x128x128_MI16x16x1_SN_LDSB1_CLR1_GRVWA8_GRVWB16_GSU0_GSUC0_GSUWGMRR0_K1_LBSPPA256_LBSPPB512_LPA8_LPB16_LRVW8_MIWT2_4_PLR1_SU0_SUM0_SUS128_VWA2_VWB4_WGM1_WGMXCC1_WGMXCCGn1
    SolutionIndex: 63
    SolutionNameMin: Cijk_Alik_Bljk_F8NHS_BH_Bias_HAS_SAV_UserArgs_MT64x64x128_MI16x16x1_SN_LDSB1_CLR1_GRVWA16_GRVWB8_GSU0_GSUC0_GSUWGMRR0_K1_LBSPPA256_LBSPPB256_LPA16_LPB8_LRVW8_MIWT2_2_PLR1_SU0_SUM0_SUS128_VWA2_VWB2_WGM1_WGMXCC1_WGMXCCGn1
    SolutionIndex: 64
    SolutionNameMin: Cijk_Alik_Bljk_F8NHS_BH_Bias_HAS_SAV_UserArgs_MT64x64x128_MI16x16x1_SN_LDSB1_CLR1_GRVWA8_GRVWB16_GSU0_GSUC0_GSUWGMRR0_K1_LBSPPA256_LBSPPB256_LPA8_LPB16_LRVW8_MIWT2_2_PLR1_SU0_SUM0_SUS128_VWA2_VWB2_WGM1_WGMXCC1_WGMXCCGn1
    SolutionIndex: 65
    SolutionNameMin: Cijk_Alik_Bljk_F8NHS_BH_Bias_HAS_SAV_UserArgs_MT64x64x128_MI16x16x1_SN_LDSB1_CLR1_GRVWA16_GRVWB16_GSU0_GSUC0_GSUWGMRR0_K1_LBSPPA256_LBSPPB256_LPA16_LPB16_LRVW8_MIWT2_2_PLR1_SU0_SUM0_SUS128_VWA2_VWB2_WGM1_WGMXCC1_WGMXCCGn1
    SolutionIndex: 66
    SolutionNameMin: Cijk_Alik_Bljk_F8NHS_BH_Bias_HAS_SAV_UserArgs_MT64x64x128_MI16x16x1_SN_LDSB1_CLR1_GRVWA8_GRVWB16_GSU0_GSUC0_GSUWGMRR0_K1_LBSPPA256_LBSPPB256_LPA8_LPB16_LRVW8_MIWT2_2_PLR1_SU0_SUM0_SUS128_VWA2_VWB2_WGM6_WGMXCC1_WGMXCCGn1
    SolutionIndex: 67
    SolutionNameMin: Cijk_Alik_Bljk_F8NHS_BH_Bias_HAS_SAV_UserArgs_MT64x64x128_MI16x16x1_SN_LDSB1_CLR1_GRVWA8_GRVWB16_GSU0_GSUC0_GSUWGMRR0_K1_LBSPPA256_LBSPPB256_LPA8_LPB16_LRVW8_MIWT2_2_PLR1_SU0_SUM0_SUS128_VWA2_VWB2_WGM8_WGMXCC1_WGMXCCGn1
    SolutionIndex: 68
    SolutionNameMin: Cijk_Alik_Bljk_F8NHS_BH_Bias_HAS_SAV_UserArgs_MT32x64x128_MI16x16x1_SN_LDSB0_CLR1_GRVWA8_GRVWB8_GSU0_GSUC0_GSUWGMRR0_K1_LBSPPA128_LBSPPB256_LPA8_LPB8_LRVW8_MIWT1_2_PLR1_SU0_SUM0_SUS128_VWA1_VWB2_WGM1_WGMXCC1_WGMXCCGn1
    SolutionIndex: 69
    SolutionNameMin: Cijk_Alik_Bljk_F8NHS_BH_Bias_HAS_SAV_UserArgs_MT32x64x128_MI16x16x1_SN_LDSB0_CLR1_GRVWA16_GRVWB16_GSU0_GSUC0_GSUWGMRR0_K1_LBSPPA128_LBSPPB256_LPA16_LPB16_LRVW8_MIWT1_2_PLR1_SU0_SUM0_SUS128_VWA1_VWB2_WGM1_WGMXCC1_WGMXCCGn1
    SolutionIndex: 70
    SolutionNameMin: Cijk_Alik_Bljk_F8NHS_BH_Bias_HAS_SAV_UserArgs_MT32x64x128_MI16x16x1_SN_LDSB0_CLR1_GRVWA8_GRVWB8_GSU0_GSUC0_GSUWGMRR0_K1_LBSPPA128_LBSPPB256_LPA8_LPB8_LRVW8_MIWT1_2_PLR1_SU0_SUM0_SUS128_VWA1_VWB2_WGM6_WGMXCC1_WGMXCCGn1
    SolutionIndex: 71
    SolutionNameMin: Cijk_Alik_Bljk_F8NHS_BH_Bias_HAS_SAV_UserArgs_MT32x64x128_MI16x16x1_SN_LDSB0_CLR1_GRVWA16_GRVWB8_GSU0_GSUC0_GSUWGMRR0_K1_LBSPPA128_LBSPPB256_LPA16_LPB8_LRVW8_MIWT1_2_PLR1_SU0_SUM0_SUS128_VWA1_VWB2_WGM6_WGMXCC1_WGMXCCGn1
    SolutionIndex: 72
    SolutionNameMin: Cijk_Alik_Bljk_F8NHS_BH_Bias_HAS_SAV_UserArgs_MT32x64x128_MI16x16x1_SN_LDSB0_CLR1_GRVWA8_GRVWB8_GSU0_GSUC0_GSUWGMRR0_K1_LBSPPA128_LBSPPB256_LPA8_LPB8_LRVW8_MIWT1_2_PLR1_SU0_SUM0_SUS128_VWA1_VWB2_WGM8_WGMXCC1_WGMXCCGn1
    SolutionIndex: 73
    SolutionNameMin: Cijk_Alik_Bljk_F8NHS_BH_Bias_HAS_SAV_UserArgs_MT64x32x128_MI16x16x1_SN_LDSB0_CLR1_GRVWA8_GRVWB8_GSU0_GSUC0_GSUWGMRR0_K1_LBSPPA256_LBSPPB128_LPA8_LPB8_LRVW8_MIWT2_1_PLR1_SU0_SUM0_SUS128_VWA2_VWB1_WGM1_WGMXCC1_WGMXCCGn1
    SolutionIndex: 74
    SolutionNameMin: Cijk_Alik_Bljk_F8NHS_BH_Bias_HAS_SAV_UserArgs_MT64x32x128_MI16x16x1_SN_LDSB0_CLR1_GRVWA16_GRVWB8_GSU0_GSUC0_GSUWGMRR0_K1_LBSPPA256_LBSPPB128_LPA16_LPB8_LRVW8_MIWT2_1_PLR1_SU0_SUM0_SUS128_VWA2_VWB1_WGM1_WGMXCC1_WGMXCCGn1
    SolutionIndex: 75
    SolutionNameMin: Cijk_Alik_Bljk_F8NHS_BH_Bias_HAS_SAV_UserArgs_MT64x32x128_MI16x16x1_SN_LDSB0_CLR1_GRVWA8_GRVWB16_GSU0_GSUC0_GSUWGMRR0_K1_LBSPPA256_LBSPPB128_LPA8_LPB16_LRVW8_MIWT2_1_PLR1_SU0_SUM0_SUS128_VWA2_VWB1_WGM1_WGMXCC1_WGMXCCGn1
    SolutionIndex: 76
    SolutionNameMin: Cijk_Alik_Bljk_F8NHS_BH_Bias_HAS_SAV_UserArgs_MT64x32x128_MI16x16x1_SN_LDSB0_CLR1_GRVWA16_GRVWB16_GSU0_GSUC0_GSUWGMRR0_K1_LBSPPA256_LBSPPB128_LPA16_LPB16_LRVW8_MIWT2_1_PLR1_SU0_SUM0_SUS128_VWA2_VWB1_WGM1_WGMXCC1_WGMXCCGn1
    SolutionIndex: 77
    SolutionNameMin: Cijk_Alik_Bljk_F8NHS_BH_Bias_HAS_SAV_UserArgs_MT64x32x128_MI16x16x1_SN_LDSB0_CLR1_GRVWA8_GRVWB8_GSU0_GSUC0_GSUWGMRR0_K1_LBSPPA256_LBSPPB128_LPA8_LPB8_LRVW8_MIWT2_1_PLR1_SU0_SUM0_SUS128_VWA2_VWB1_WGM8_WGMXCC1_WGMXCCGn1
    SolutionIndex: 78
    SolutionNameMin: Cijk_Alik_Bljk_F8NHS_BH_Bias_HAS_SAV_UserArgs_MT32x32x128_MI16x16x1_SN_LDSB0_CLR1_GRVWA8_GRVWB8_GSU0_GSUC0_GSUWGMRR0_K1_LBSPPA128_LBSPPB128_LPA8_LPB8_LRVW8_MIWT1_1_PLR1_SU0_SUM0_SUS128_VWA1_VWB1_WGM1_WGMXCC1_WGMXCCGn1
    SolutionIndex: 79
    SolutionNameMin: Cijk_Alik_Bljk_F8NHS_BH_Bias_HAS_SAV_UserArgs_MT32x32x128_MI16x16x1_SN_LDSB0_CLR1_GRVWA16_GRVWB8_GSU0_GSUC0_GSUWGMRR0_K1_LBSPPA128_LBSPPB128_LPA16_LPB8_LRVW8_MIWT1_1_PLR1_SU0_SUM0_SUS128_VWA1_VWB1_WGM1_WGMXCC1_WGMXCCGn1
    SolutionIndex: 80
    SolutionNameMin: Cijk_Alik_Bljk_F8NHS_BH_Bias_HAS_SAV_UserArgs_MT32x32x128_MI16x16x1_SN_LDSB0_CLR1_GRVWA8_GRVWB16_GSU0_GSUC0_GSUWGMRR0_K1_LBSPPA128_LBSPPB128_LPA8_LPB16_LRVW8_MIWT1_1_PLR1_SU0_SUM0_SUS128_VWA1_VWB1_WGM1_WGMXCC1_WGMXCCGn1
    SolutionIndex: 81
    SolutionNameMin: Cijk_Alik_Bljk_F8NHS_BH_Bias_HAS_SAV_UserArgs_MT32x32x128_MI16x16x1_SN_LDSB0_CLR1_GRVWA16_GRVWB16_GSU0_GSUC0_GSUWGMRR0_K1_LBSPPA128_LBSPPB128_LPA16_LPB16_LRVW8_MIWT1_1_PLR1_SU0_SUM0_SUS128_VWA1_VWB1_WGM1_WGMXCC1_WGMXCCGn1
    SolutionIndex: 82
    SolutionNameMin: Cijk_Alik_Bljk_F8NHS_BH_Bias_HAS_SAV_UserArgs_MT32x32x128_MI16x16x1_SN_LDSB0_CLR1_GRVWA8_GRVWB8_GSU0_GSUC0_GSUWGMRR0_K1_LBSPPA128_LBSPPB128_LPA8_LPB8_LRVW8_MIWT1_1_PLR1_SU0_SUM0_SUS128_VWA1_VWB1_WGM6_WGMXCC1_WGMXCCGn1
    SolutionIndex: 83
    SolutionNameMin: Cijk_Alik_Bljk_F8NHS_BH_Bias_HAS_SAV_UserArgs_MT32x32x128_MI16x16x1_SN_LDSB0_CLR1_GRVWA16_GRVWB8_GSU0_GSUC0_GSUWGMRR0_K1_LBSPPA128_LBSPPB128_LPA16_LPB8_LRVW8_MIWT1_1_PLR1_SU0_SUM0_SUS128_VWA1_VWB1_WGM6_WGMXCC1_WGMXCCGn1
    SolutionIndex: 84
    SolutionNameMin: Cijk_Alik_Bljk_F8NHS_BH_Bias_HAS_SAV_UserArgs_MT32x32x128_MI16x16x1_SN_LDSB0_CLR1_GRVWA16_GRVWB16_GSU0_GSUC0_GSUWGMRR0_K1_LBSPPA128_LBSPPB128_LPA16_LPB16_LRVW8_MIWT1_1_PLR1_SU0_SUM0_SUS128_VWA1_VWB1_WGM6_WGMXCC1_WGMXCCGn1
    SolutionIndex: 85
    SolutionNameMin: Cijk_Alik_Bljk_F8NHS_BH_Bias_HAS_SAV_UserArgs_MT32x32x128_MI16x16x1_SN_LDSB0_CLR1_GRVWA8_GRVWB8_GSU0_GSUC0_GSUWGMRR0_K1_LBSPPA128_LBSPPB128_LPA8_LPB8_LRVW8_MIWT1_1_PLR1_SU0_SUM0_SUS128_VWA1_VWB1_WGM8_WGMXCC1_WGMXCCGn1
    SolutionIndex: 86
    SolutionNameMin: Cijk_Alik_Bljk_F8NHS_BH_Bias_HAS_SAV_UserArgs_MT128x64x256_MI16x16x1_SN_LDSB1_CLR1_GRVWA8_GRVWB16_GSU0_GSUC0_GSUWGMRR0_K1_LBSPPA1024_LBSPPB512_LPA8_LPB16_LRVW8_MIWT4_2_PLR1_SU0_SUM0_SUS256_VWA4_VWB2_WGM1_WGMXCC1_WGMXCCGn1
    SolutionIndex: 87
    SolutionNameMin: Cijk_Alik_Bljk_F8NHS_BH_Bias_HAS_SAV_UserArgs_MT128x64x256_MI16x16x1_SN_LDSB1_CLR1_GRVWA8_GRVWB8_GSU0_GSUC0_GSUWGMRR0_K1_LBSPPA1024_LBSPPB512_LPA8_LPB8_LRVW8_MIWT4_2_PLR1_SU0_SUM0_SUS256_VWA4_VWB2_WGM6_WGMXCC1_WGMXCCGn1
    SolutionIndex: 88
    SolutionNameMin: Cijk_Alik_Bljk_F8NHS_BH_Bias_HAS_SAV_UserArgs_MT128x64x256_MI16x16x1_SN_LDSB1_CLR1_GRVWA8_GRVWB16_GSU0_GSUC0_GSUWGMRR0_K1_LBSPPA1024_LBSPPB512_LPA8_LPB16_LRVW8_MIWT4_2_PLR1_SU0_SUM0_SUS256_VWA4_VWB2_WGM6_WGMXCC1_WGMXCCGn1
    SolutionIndex: 89
    SolutionNameMin: Cijk_Alik_Bljk_F8NHS_BH_Bias_HAS_SAV_UserArgs_MT128x64x256_MI16x16x1_SN_LDSB1_CLR1_GRVWA8_GRVWB16_GSU0_GSUC0_GSUWGMRR0_K1_LBSPPA1024_LBSPPB512_LPA8_LPB16_LRVW8_MIWT4_2_PLR1_SU0_SUM0_SUS256_VWA4_VWB2_WGM8_WGMXCC1_WGMXCCGn1
    SolutionIndex: 90
    SolutionNameMin: Cijk_Alik_Bljk_F8NHS_BH_Bias_HAS_SAV_UserArgs_MT64x64x256_MI16x16x1_SN_LDSB1_CLR1_GRVWA8_GRVWB16_GSU0_GSUC0_GSUWGMRR0_K1_LBSPPA512_LBSPPB512_LPA8_LPB16_LRVW8_MIWT2_2_PLR1_SU0_SUM0_SUS256_VWA2_VWB2_WGM1_WGMXCC1_WGMXCCGn1
    SolutionIndex: 91
    SolutionNameMin: Cijk_Alik_Bljk_F8NHS_BH_Bias_HAS_SAV_UserArgs_MT64x64x256_MI16x16x1_SN_LDSB1_CLR1_GRVWA16_GRVWB16_GSU0_GSUC0_GSUWGMRR0_K1_LBSPPA512_LBSPPB512_LPA16_LPB16_LRVW8_MIWT2_2_PLR1_SU0_SUM0_SUS256_VWA2_VWB2_WGM1_WGMXCC1_WGMXCCGn1
    SolutionIndex: 92
    SolutionNameMin: Cijk_Alik_Bljk_F8NHS_BH_Bias_HAS_SAV_UserArgs_MT64x64x256_MI16x16x1_SN_LDSB1_CLR1_GRVWA8_GRVWB16_GSU0_GSUC0_GSUWGMRR0_K1_LBSPPA512_LBSPPB512_LPA8_LPB16_LRVW8_MIWT2_2_PLR1_SU0_SUM0_SUS256_VWA2_VWB2_WGM6_WGMXCC1_WGMXCCGn1
    SolutionIndex: 93
    SolutionNameMin: Cijk_Alik_Bljk_F8NHS_BH_Bias_HAS_SAV_UserArgs_MT32x32x256_MI16x16x1_SN_LDSB1_CLR1_GRVWA8_GRVWB16_GSU0_GSUC0_GSUWGMRR0_K1_LBSPPA256_LBSPPB256_LPA8_LPB16_LRVW8_MIWT1_1_PLR1_SU0_SUM0_SUS256_VWA1_VWB1_WGM1_WGMXCC1_WGMXCCGn1
    SolutionIndex: 94
    SolutionNameMin: Cijk_Alik_Bljk_F8NHS_BH_Bias_HAS_SAV_UserArgs_MT32x32x256_MI16x16x1_SN_LDSB1_CLR1_GRVWA16_GRVWB8_GSU0_GSUC0_GSUWGMRR0_K1_LBSPPA256_LBSPPB256_LPA16_LPB8_LRVW8_MIWT1_1_PLR1_SU0_SUM0_SUS256_VWA1_VWB1_WGM6_WGMXCC1_WGMXCCGn1
    SolutionIndex: 95
    SolutionNameMin: Cijk_Alik_Bljk_F8NHS_BH_Bias_HAS_SAV_UserArgs_MT32x32x256_MI16x16x1_SN_LDSB1_CLR1_GRVWA8_GRVWB16_GSU0_GSUC0_GSUWGMRR0_K1_LBSPPA256_LBSPPB256_LPA8_LPB16_LRVW8_MIWT1_1_PLR1_SU0_SUM0_SUS256_VWA1_VWB1_WGM8_WGMXCC1_WGMXCCGn1
    SolutionIndex: 96
    SolutionNameMin: Cijk_Alik_Bljk_F8NHS_BH_Bias_HAS_SAV_UserArgs_MT32x64x32_MI16x16x1_SN_LDSB0_CLR0_GRVWA4_GRVWB4_GSU0_GSUC0_GSUWGMRR0_K1_LBSPPA128_LBSPPB128_LPA8_LPB8_LRVW8_MIWT1_2_PLR0_SU32_SUM0_SUS256_VWA1_VWB2_WGM6_WGMXCC1_WGMXCCGn1
- - - [128, 128, 1, 128, 128, 128, 128, 128]
    - [34, 0.6]
  - - [128, 128, 1, 256, 128, 128, 256, 256]
    - [79, 1.06]
  - - [128, 128, 1, 512, 128, 128, 512, 512]
    - [78, 1.93]
  - - [128, 128, 1, 1024, 128, 128, 1024, 1024]
    - [80, 3.29]
  - - [128, 128, 1, 2048, 128, 128, 2048, 2048]
    - [78, 5.12]
  - - [128, 128, 1, 4096, 128, 128, 4096, 4096]
    - [78, 6.97]
  - - [128, 128, 1, 8192, 128, 128, 8192, 8192]
    - [78, 8.58]
  - - [128, 256, 1, 128, 128, 128, 128, 128]
    - [31, 1.06]
  - - [128, 256, 1, 256, 128, 128, 256, 256]
    - [83, 2.02]
  - - [128, 256, 1, 512, 128, 128, 512, 512]
    - [81, 3.74]
  - - [128, 256, 1, 1024, 128, 128, 1024, 1024]
    - [78, 6.69]
  - - [128, 256, 1, 2048, 128, 128, 2048, 2048]
    - [78, 10.3]
  - - [128, 256, 1, 4096, 128, 128, 4096, 4096]
    - [78, 14.02]
  - - [128, 256, 1, 8192, 128, 128, 8192, 8192]
    - [78, 17.07]
  - - [128, 512, 1, 128, 128, 128, 128, 128]
    - [84, 2.19]
  - - [128, 512, 1, 256, 128, 128, 256, 256]
    - [34, 4.29]
  - - [128, 512, 1, 512, 128, 128, 512, 512]
    - [80, 7.85]
  - - [128, 512, 1, 1024, 128, 128, 1024, 1024]
    - [78, 13.74]
  - - [128, 512, 1, 2048, 128, 128, 2048, 2048]
    - [78, 20.84]
  - - [128, 512, 1, 4096, 128, 128, 4096, 4096]
    - [78, 28.09]
  - - [128, 512, 1, 8192, 128, 128, 8192, 8192]
    - [78, 34.18]
  - - [128, 1024, 1, 128, 128, 128, 128, 128]
    - [32, 4.59]
  - - [128, 1024, 1, 256, 128, 128, 256, 256]
    - [34, 8.06]
  - - [128, 1024, 1, 512, 128, 128, 512, 512]
    - [79, 15.01]
  - - [128, 1024, 1, 1024, 128, 128, 1024, 1024]
    - [81, 25.53]
  - - [128, 1024, 1, 2048, 128, 128, 2048, 2048]
    - [78, 39.72]
  - - [128, 1024, 1, 4096, 128, 128, 4096, 4096]
    - [78, 53.92]
  - - [128, 1024, 1, 8192, 128, 128, 8192, 8192]
    - [78, 66.4]
  - - [128, 2048, 1, 128, 128, 128, 128, 128]
    - [33, 8.04]
  - - [128, 2048, 1, 256, 128, 128, 256, 256]
    - [76, 15.51]
  - - [128, 2048, 1, 512, 128, 128, 512, 512]
    - [73, 28.81]
  - - [128, 2048, 1, 1024, 128, 128, 1024, 1024]
    - [75, 46.54]
  - - [128, 2048, 1, 2048, 128, 128, 2048, 2048]
    - [68, 67.64]
  - - [128, 2048, 1, 4096, 128, 128, 4096, 4096]
    - [68, 88.49]
  - - [128, 2048, 1, 8192, 128, 128, 8192, 8192]
    - [93, 98.66]
  - - [128, 4096, 1, 128, 128, 128, 128, 128]
    - [28, 16.05]
  - - [128, 4096, 1, 256, 128, 128, 256, 256]
    - [28, 29.28]
  - - [128, 4096, 1, 512, 128, 128, 512, 512]
    - [64, 48.97]
  - - [128, 4096, 1, 1024, 128, 128, 1024, 1024]
    - [64, 76.87]
  - - [128, 4096, 1, 2048, 128, 128, 2048, 2048]
    - [64, 105.56]
  - - [128, 4096, 1, 4096, 128, 128, 4096, 4096]
    - [64, 130.04]
  - - [128, 4096, 1, 8192, 128, 128, 8192, 8192]
    - [90, 141.51]
  - - [128, 8192, 1, 128, 128, 128, 128, 128]
    - [21, 26.6]
  - - [128, 8192, 1, 256, 128, 128, 256, 256]
    - [22, 48.14]
  - - [128, 8192, 1, 512, 128, 128, 512, 512]
    - [22, 81.28]
  - - [128, 8192, 1, 1024, 128, 128, 1024, 1024]
    - [22, 122.49]
  - - [128, 8192, 1, 2048, 128, 128, 2048, 2048]
    - [22, 161.2]
  - - [128, 8192, 1, 4096, 128, 128, 4096, 4096]
    - [86, 163.63]
  - - [128, 8192, 1, 8192, 128, 128, 8192, 8192]
    - [91, 185.75]
  - - [256, 128, 1, 128, 256, 256, 128, 128]
    - [32, 1.08]
  - - [256, 128, 1, 256, 256, 256, 256, 256]
    - [78, 2.21]
  - - [256, 128, 1, 512, 256, 256, 512, 512]
    - [80, 4.01]
  - - [256, 128, 1, 1024, 256, 256, 1024, 1024]
    - [78, 7.01]
  - - [256, 128, 1, 2048, 256, 256, 2048, 2048]
    - [78, 10.36]
  - - [256, 128, 1, 4096, 256, 256, 4096, 4096]
    - [78, 14.11]
  - - [256, 128, 1, 8192, 256, 256, 8192, 8192]
    - [78, 17.15]
  - - [256, 256, 1, 128, 256, 256, 128, 128]
    - [77, 2.11]
  - - [256, 256, 1, 256, 256, 256, 256, 256]
    - [94, 4.24]
  - - [256, 256, 1, 512, 256, 256, 512, 512]
    - [81, 7.94]
  - - [256, 256, 1, 1024, 256, 256, 1024, 1024]
    - [78, 13.76]
  - - [256, 256, 1, 2048, 256, 256, 2048, 2048]
    - [78, 21.21]
  - - [256, 256, 1, 4096, 256, 256, 4096, 4096]
    - [78, 28.52]
  - - [256, 256, 1, 8192, 256, 256, 8192, 8192]
    - [78, 34.46]
  - - [256, 512, 1, 128, 256, 256, 128, 128]
    - [80, 4.83]
  - - [256, 512, 1, 256, 256, 256, 256, 256]
    - [80, 9.09]
  - - [256, 512, 1, 512, 256, 256, 512, 512]
    - [78, 16.5]
  - - [256, 512, 1, 1024, 256, 256, 1024, 1024]
    - [78, 27.01]
  - - [256, 512, 1, 2048, 256, 256, 2048, 2048]
    - [78, 40.81]
  - - [256, 512, 1, 4096, 256, 256, 4096, 4096]
    - [78, 55.79]
  - - [256, 512, 1, 8192, 256, 256, 8192, 8192]
    - [78, 67.49]
  - - [256, 1024, 1, 128, 256, 256, 128, 128]
    - [76, 9.19]
  - - [256, 1024, 1, 256, 256, 256, 256, 256]
    - [76, 16.59]
  - - [256, 1024, 1, 512, 256, 256, 512, 512]
    - [76, 28.87]
  - - [256, 1024, 1, 1024, 256, 256, 1024, 1024]
    - [75, 46.99]
  - - [256, 1024, 1, 2048, 256, 256, 2048, 2048]
    - [73, 68.34]
  - - [256, 1024, 1, 4096, 256, 256, 4096, 4096]
    - [68, 88.4]
  - - [256, 1024, 1, 8192, 256, 256, 8192, 8192]
    - [73, 101.83]
  - - [256, 2048, 1, 128, 256, 256, 128, 128]
    - [27, 16.05]
  - - [256, 2048, 1, 256, 256, 256, 256, 256]
    - [28, 29.45]
  - - [256, 2048, 1, 512, 256, 256, 512, 512]
    - [28, 48.82]
  - - [256, 2048, 1, 1024, 256, 256, 1024, 1024]
    - [63, 75.21]
  - - [256, 2048, 1, 2048, 256, 256, 2048, 2048]
    - [64, 104.61]
  - - [256, 2048, 1, 4096, 256, 256, 4096, 4096]
    - [64, 129.62]
  - - [256, 2048, 1, 8192, 256, 256, 8192, 8192]
    - [90, 141.86]
  - - [256, 4096, 1, 128, 256, 256, 128, 128]
    - [19, 26.26]
  - - [256, 4096, 1, 256, 256, 256, 256, 256]
    - [21, 47.79]
  - - [256, 4096, 1, 512, 256, 256, 512, 512]
    - [22, 80.03]
  - - [256, 4096, 1, 1024, 256, 256, 1024, 1024]
    - [25, 119.5]
  - - [256, 4096, 1, 2048, 256, 256, 2048, 2048]
    - [22, 159.49]
  - - [256, 4096, 1, 4096, 256, 256, 4096, 4096]
    - [86, 175.46]
  - - [256, 4096, 1, 8192, 256, 256, 8192, 8192]
    - [62, 188.71]
  - - [256, 8192, 1, 128, 256, 256, 128, 128]
    - [14, 40.86]
  - - [256, 8192, 1, 256, 256, 256, 256, 256]
    - [14, 73.34]
  - - [256, 8192, 1, 512, 256, 256, 512, 512]
    - [14, 117.39]
  - - [256, 8192, 1, 1024, 256, 256, 1024, 1024]
    - [14, 177.73]
  - - [256, 8192, 1, 2048, 256, 256, 2048, 2048]
    - [49, 219.97]
  - - [256, 8192, 1, 4096, 256, 256, 4096, 4096]
    - [59, 218.5]
  - - [256, 8192, 1, 8192, 256, 256, 8192, 8192]
    - [58, 253.98]
  - - [512, 128, 1, 128, 512, 512, 128, 128]
    - [81, 2.14]
  - - [512, 128, 1, 256, 512, 512, 256, 256]
    - [79, 4.46]
  - - [512, 128, 1, 512, 512, 512, 512, 512]
    - [78, 8.15]
  - - [512, 128, 1, 1024, 512, 512, 1024, 1024]
    - [80, 13.47]
  - - [512, 128, 1, 2048, 512, 512, 2048, 2048]
    - [78, 20.56]
  - - [512, 128, 1, 4096, 512, 512, 4096, 4096]
    - [78, 27.98]
  - - [512, 128, 1, 8192, 512, 512, 8192, 8192]
    - [85, 33.82]
  - - [512, 256, 1, 128, 512, 512, 128, 128]
    - [80, 4.56]
  - - [512, 256, 1, 256, 512, 512, 256, 256]
    - [83, 8.38]
  - - [512, 256, 1, 512, 512, 512, 512, 512]
    - [78, 15.71]
  - - [512, 256, 1, 1024, 512, 512, 1024, 1024]
    - [80, 26.27]
  - - [512, 256, 1, 2048, 512, 512, 2048, 2048]
    - [80, 40.03]
  - - [512, 256, 1, 4096, 512, 512, 4096, 4096]
    - [78, 55.15]
  - - [512, 256, 1, 8192, 512, 512, 8192, 8192]
    - [85, 66.56]
  - - [512, 512, 1, 128, 512, 512, 128, 128]
    - [74, 8.7]
  - - [512, 512, 1, 256, 512, 512, 256, 256]
    - [69, 15.9]
  - - [512, 512, 1, 512, 512, 512, 512, 512]
    - [74, 28.55]
  - - [512, 512, 1, 1024, 512, 512, 1024, 1024]
    - [73, 46.25]
  - - [512, 512, 1, 2048, 512, 512, 2048, 2048]
    - [75, 67.57]
  - - [512, 512, 1, 4096, 512, 512, 4096, 4096]
    - [68, 87.98]
  - - [512, 512, 1, 8192, 512, 512, 8192, 8192]
    - [95, 97.64]
  - - [512, 1024, 1, 128, 512, 512, 128, 128]
    - [65, 15.7]
  - - [512, 1024, 1, 256, 512, 512, 256, 256]
    - [27, 28.55]
  - - [512, 1024, 1, 512, 512, 512, 512, 512]
    - [26, 48.85]
  - - [512, 1024, 1, 1024, 512, 512, 1024, 1024]
    - [64, 75.41]
  - - [512, 1024, 1, 2048, 512, 512, 2048, 2048]
    - [64, 104.5]
  - - [512, 1024, 1, 4096, 512, 512, 4096, 4096]
    - [64, 129.34]
  - - [512, 1024, 1, 8192, 512, 512, 8192, 8192]
    - [92, 141.16]
  - - [512, 2048, 1, 128, 512, 512, 128, 128]
    - [21, 26.33]
  - - [512, 2048, 1, 256, 512, 512, 256, 256]
    - [22, 47.64]
  - - [512, 2048, 1, 512, 512, 512, 512, 512]
    - [22, 80.59]
  - - [512, 2048, 1, 1024, 512, 512, 1024, 1024]
    - [25, 118.79]
  - - [512, 2048, 1, 2048, 512, 512, 2048, 2048]
    - [22, 158.91]
  - - [512, 2048, 1, 4096, 512, 512, 4096, 4096]
    - [86, 178.04]
  - - [512, 2048, 1, 8192, 512, 512, 8192, 8192]
    - [86, 191.69]
  - - [512, 4096, 1, 128, 512, 512, 128, 128]
    - [49, 41.33]
  - - [512, 4096, 1, 256, 512, 512, 256, 256]
    - [14, 73.92]
  - - [512, 4096, 1, 512, 512, 512, 512, 512]
    - [14, 120.67]
  - - [512, 4096, 1, 1024, 512, 512, 1024, 1024]
    - [14, 177.75]
  - - [512, 4096, 1, 2048, 512, 512, 2048, 2048]
    - [49, 230.12]
  - - [512, 4096, 1, 4096, 512, 512, 4096, 4096]
    - [59, 230.43]
  - - [512, 4096, 1, 8192, 512, 512, 8192, 8192]
    - [58, 253.36]
  - - [512, 8192, 1, 128, 512, 512, 128, 128]
    - [52, 60.84]
  - - [512, 8192, 1, 256, 512, 512, 256, 256]
    - [53, 109.36]
  - - [512, 8192, 1, 512, 512, 512, 512, 512]
    - [53, 177.41]
  - - [512, 8192, 1, 1024, 512, 512, 1024, 1024]
    - [53, 227.7]
  - - [512, 8192, 1, 2048, 512, 512, 2048, 2048]
    - [55, 241.74]
  - - [512, 8192, 1, 4096, 512, 512, 4096, 4096]
    - [53, 275.33]
  - - [512, 8192, 1, 8192, 512, 512, 8192, 8192]
    - [54, 294.75]
  - - [1024, 128, 1, 128, 1024, 1024, 128, 128]
    - [78, 4.81]
  - - [1024, 128, 1, 256, 1024, 1024, 256, 256]
    - [81, 9.02]
  - - [1024, 128, 1, 512, 1024, 1024, 512, 512]
    - [79, 16.12]
  - - [1024, 128, 1, 1024, 1024, 1024, 1024, 1024]
    - [78, 26.91]
  - - [1024, 128, 1, 2048, 1024, 1024, 2048, 2048]
    - [78, 40.71]
  - - [1024, 128, 1, 4096, 1024, 1024, 4096, 4096]
    - [78, 54.99]
  - - [1024, 128, 1, 8192, 1024, 1024, 8192, 8192]
    - [82, 66.93]
  - - [1024, 256, 1, 128, 1024, 1024, 128, 128]
    - [76, 9.06]
  - - [1024, 256, 1, 256, 1024, 1024, 256, 256]
    - [75, 16.32]
  - - [1024, 256, 1, 512, 1024, 1024, 512, 512]
    - [75, 28.8]
  - - [1024, 256, 1, 1024, 1024, 1024, 1024, 1024]
    - [75, 46.08]
  - - [1024, 256, 1, 2048, 1024, 1024, 2048, 2048]
    - [73, 67.58]
  - - [1024, 256, 1, 4096, 1024, 1024, 4096, 4096]
    - [68, 88.29]
  - - [1024, 256, 1, 8192, 1024, 1024, 8192, 8192]
    - [72, 101.14]
  - - [1024, 512, 1, 128, 1024, 1024, 128, 128]
    - [65, 16.02]
  - - [1024, 512, 1, 256, 1024, 1024, 256, 256]
    - [28, 29.55]
  - - [1024, 512, 1, 512, 1024, 1024, 512, 512]
    - [63, 49.23]
  - - [1024, 512, 1, 1024, 1024, 1024, 1024, 1024]
    - [63, 76.02]
  - - [1024, 512, 1, 2048, 1024, 1024, 2048, 2048]
    - [64, 104.82]
  - - [1024, 512, 1, 4096, 1024, 1024, 4096, 4096]
    - [67, 125.68]
  - - [1024, 512, 1, 8192, 1024, 1024, 8192, 8192]
    - [92, 141.36]
  - - [1024, 1024, 1, 128, 1024, 1024, 128, 128]
    - [21, 27.26]
  - - [1024, 1024, 1, 256, 1024, 1024, 256, 256]
    - [23, 48.04]
  - - [1024, 1024, 1, 512, 1024, 1024, 512, 512]
    - [22, 79.89]
  - - [1024, 1024, 1, 1024, 1024, 1024, 1024, 1024]
    - [22, 122.22]
  - - [1024, 1024, 1, 2048, 1024, 1024, 2048, 2048]
    - [22, 160.85]
  - - [1024, 1024, 1, 4096, 1024, 1024, 4096, 4096]
    - [89, 174.49]
  - - [1024, 1024, 1, 8192, 1024, 1024, 8192, 8192]
    - [89, 191.56]
  - - [1024, 2048, 1, 128, 1024, 1024, 128, 128]
    - [14, 42.02]
  - - [1024, 2048, 1, 256, 1024, 1024, 256, 256]
    - [14, 75.04]
  - - [1024, 2048, 1, 512, 1024, 1024, 512, 512]
    - [14, 122.18]
  - - [1024, 2048, 1, 1024, 1024, 1024, 1024, 1024]
    - [14, 179.54]
  - - [1024, 2048, 1, 2048, 1024, 1024, 2048, 2048]
    - [49, 226.52]
  - - [1024, 2048, 1, 4096, 1024, 1024, 4096, 4096]
    - [58, 229.92]
  - - [1024, 2048, 1, 8192, 1024, 1024, 8192, 8192]
    - [50, 247.49]
  - - [1024, 4096, 1, 128, 1024, 1024, 128, 128]
    - [12, 61.43]
  - - [1024, 4096, 1, 256, 1024, 1024, 256, 256]
    - [11, 105.74]
  - - [1024, 4096, 1, 512, 1024, 1024, 512, 512]
    - [8, 163.11]
  - - [1024, 4096, 1, 1024, 1024, 1024, 1024, 1024]
    - [8, 213.71]
  - - [1024, 4096, 1, 2048, 1024, 1024, 2048, 2048]
    - [43, 241.17]
  - - [1024, 4096, 1, 4096, 1024, 1024, 4096, 4096]
    - [43, 270.58]
  - - [1024, 4096, 1, 8192, 1024, 1024, 8192, 8192]
    - [43, 259.54]
  - - [1024, 8192, 1, 128, 1024, 1024, 128, 128]
    - [42, 74.38]
  - - [1024, 8192, 1, 256, 1024, 1024, 256, 256]
    - [42, 129.13]
  - - [1024, 8192, 1, 512, 1024, 1024, 512, 512]
    - [38, 197.11]
  - - [1024, 8192, 1, 1024, 1024, 1024, 1024, 1024]
    - [38, 249.77]
  - - [1024, 8192, 1, 2048, 1024, 1024, 2048, 2048]
    - [39, 304.5]
  - - [1024, 8192, 1, 4096, 1024, 1024, 4096, 4096]
    - [37, 340.08]
  - - [1024, 8192, 1, 8192, 1024, 1024, 8192, 8192]
    - [37, 358.69]
  - - [2048, 128, 1, 128, 2048, 2048, 128, 128]
    - [71, 8.06]
  - - [2048, 128, 1, 256, 2048, 2048, 256, 256]
    - [30, 15.56]
  - - [2048, 128, 1, 512, 2048, 2048, 512, 512]
    - [75, 28.35]
  - - [2048, 128, 1, 1024, 2048, 2048, 1024, 1024]
    - [75, 46.29]
  - - [2048, 128, 1, 2048, 2048, 2048, 2048, 2048]
    - [68, 67.68]
  - - [2048, 128, 1, 4096, 2048, 2048, 4096, 4096]
    - [70, 87.71]
  - - [2048, 128, 1, 8192, 2048, 2048, 8192, 8192]
    - [72, 99.64]
  - - [2048, 256, 1, 128, 2048, 2048, 128, 128]
    - [29, 15.93]
  - - [2048, 256, 1, 256, 2048, 2048, 256, 256]
    - [28, 28.74]
  - - [2048, 256, 1, 512, 2048, 2048, 512, 512]
    - [26, 47.99]
  - - [2048, 256, 1, 1024, 2048, 2048, 1024, 1024]
    - [66, 75.18]
  - - [2048, 256, 1, 2048, 2048, 2048, 2048, 2048]
    - [66, 103.86]
  - - [2048, 256, 1, 4096, 2048, 2048, 4096, 4096]
    - [67, 129.08]
  - - [2048, 256, 1, 8192, 2048, 2048, 8192, 8192]
    - [92, 141.23]
  - - [2048, 512, 1, 128, 2048, 2048, 128, 128]
    - [20, 27.03]
  - - [2048, 512, 1, 256, 2048, 2048, 256, 256]
    - [24, 48.58]
  - - [2048, 512, 1, 512, 2048, 2048, 512, 512]
    - [24, 79.92]
  - - [2048, 512, 1, 1024, 2048, 2048, 1024, 1024]
    - [25, 120.15]
  - - [2048, 512, 1, 2048, 2048, 2048, 2048, 2048]
    - [24, 159.04]
  - - [2048, 512, 1, 4096, 2048, 2048, 4096, 4096]
    - [89, 175.1]
  - - [2048, 512, 1, 8192, 2048, 2048, 8192, 8192]
    - [88, 190.51]
  - - [2048, 1024, 1, 128, 2048, 2048, 128, 128]
    - [14, 42.12]
  - - [2048, 1024, 1, 256, 2048, 2048, 256, 256]
    - [14, 75.1]
  - - [2048, 1024, 1, 512, 2048, 2048, 512, 512]
    - [14, 121.9]
  - - [2048, 1024, 1, 1024, 2048, 2048, 1024, 1024]
    - [14, 179.14]
  - - [2048, 1024, 1, 2048, 2048, 2048, 2048, 2048]
    - [61, 212.01]
  - - [2048, 1024, 1, 4096, 2048, 2048, 4096, 4096]
    - [60, 225.99]
  - - [2048, 1024, 1, 8192, 2048, 2048, 8192, 8192]
    - [61, 253.58]
  - - [2048, 2048, 1, 128, 2048, 2048, 128, 128]
    - [9, 59.62]
  - - [2048, 2048, 1, 256, 2048, 2048, 256, 256]
    - [8, 103.58]
  - - [2048, 2048, 1, 512, 2048, 2048, 512, 512]
    - [8, 161.12]
  - - [2048, 2048, 1, 1024, 2048, 2048, 1024, 1024]
    - [43, 205.94]
  - - [2048, 2048, 1, 2048, 2048, 2048, 2048, 2048]
    - [45, 243.19]
  - - [2048, 2048, 1, 4096, 2048, 2048, 4096, 4096]
    - [45, 266.85]
  - - [2048, 2048, 1, 8192, 2048, 2048, 8192, 8192]
    - [44, 264.16]
  - - [2048, 4096, 1, 128, 2048, 2048, 128, 128]
    - [0, 66.4]
  - - [2048, 4096, 1, 256, 2048, 2048, 256, 256]
    - [1, 116.49]
  - - [2048, 4096, 1, 512, 2048, 2048, 512, 512]
    - [1, 172.14]
  - - [2048, 4096, 1, 1024, 2048, 2048, 1024, 1024]
    - [3, 224.46]
  - - [2048, 4096, 1, 2048, 2048, 2048, 2048, 2048]
    - [2, 263.81]
  - - [2048, 4096, 1, 4096, 2048, 2048, 4096, 4096]
    - [40, 271.77]
  - - [2048, 4096, 1, 8192, 2048, 2048, 8192, 8192]
    - [41, 320.68]
  - - [2048, 8192, 1, 128, 2048, 2048, 128, 128]
    - [40, 77.15]
  - - [2048, 8192, 1, 256, 2048, 2048, 256, 256]
    - [38, 132.99]
  - - [2048, 8192, 1, 512, 2048, 2048, 512, 512]
    - [39, 192.67]
  - - [2048, 8192, 1, 1024, 2048, 2048, 1024, 1024]
    - [42, 263.23]
  - - [2048, 8192, 1, 2048, 2048, 2048, 2048, 2048]
    - [40, 307.85]
  - - [2048, 8192, 1, 4096, 2048, 2048, 4096, 4096]
    - [37, 328.31]
  - - [2048, 8192, 1, 8192, 2048, 2048, 8192, 8192]
    - [37, 364.99]
  - - [4096, 128, 1, 128, 4096, 4096, 128, 128]
    - [26, 16.06]
  - - [4096, 128, 1, 256, 4096, 4096, 256, 256]
    - [26, 29.3]
  - - [4096, 128, 1, 512, 4096, 4096, 512, 512]
    - [28, 48.62]
  - - [4096, 128, 1, 1024, 4096, 4096, 1024, 1024]
    - [64, 76.93]
  - - [4096, 128, 1, 2048, 4096, 4096, 2048, 2048]
    - [64, 105.0]
  - - [4096, 128, 1, 4096, 4096, 4096, 4096, 4096]
    - [66, 127.01]
  - - [4096, 128, 1, 8192, 4096, 4096, 8192, 8192]
    - [92, 141.41]
  - - [4096, 256, 1, 128, 4096, 4096, 128, 128]
    - [18, 27.01]
  - - [4096, 256, 1, 256, 4096, 4096, 256, 256]
    - [22, 49.16]
  - - [4096, 256, 1, 512, 4096, 4096, 512, 512]
    - [22, 81.17]
  - - [4096, 256, 1, 1024, 4096, 4096, 1024, 1024]
    - [22, 120.97]
  - - [4096, 256, 1, 2048, 4096, 4096, 2048, 2048]
    - [24, 157.18]
  - - [4096, 256, 1, 4096, 4096, 4096, 4096, 4096]
    - [89, 173.63]
  - - [4096, 256, 1, 8192, 4096, 4096, 8192, 8192]
    - [88, 192.31]
  - - [4096, 512, 1, 128, 4096, 4096, 128, 128]
    - [15, 40.98]
  - - [4096, 512, 1, 256, 4096, 4096, 256, 256]
    - [14, 74.09]
  - - [4096, 512, 1, 512, 4096, 4096, 512, 512]
    - [16, 117.95]
  - - [4096, 512, 1, 1024, 4096, 4096, 1024, 1024]
    - [17, 175.73]
  - - [4096, 512, 1, 2048, 4096, 4096, 2048, 2048]
    - [51, 222.4]
  - - [4096, 512, 1, 4096, 4096, 4096, 4096, 4096]
    - [60, 229.07]
  - - [4096, 512, 1, 8192, 4096, 4096, 8192, 8192]
    - [51, 248.26]
  - - [4096, 1024, 1, 128, 4096, 4096, 128, 128]
    - [8, 57.41]
  - - [4096, 1024, 1, 256, 4096, 4096, 256, 256]
    - [7, 98.42]
  - - [4096, 1024, 1, 512, 4096, 4096, 512, 512]
    - [6, 145.66]
  - - [4096, 1024, 1, 1024, 4096, 4096, 1024, 1024]
    - [45, 197.26]
  - - [4096, 1024, 1, 2048, 4096, 4096, 2048, 2048]
    - [45, 243.21]
  - - [4096, 1024, 1, 4096, 4096, 4096, 4096, 4096]
    - [45, 269.44]
  - - [4096, 1024, 1, 8192, 4096, 4096, 8192, 8192]
    - [58, 265.0]
  - - [4096, 2048, 1, 128, 4096, 4096, 128, 128]
    - [8, 65.6]
  - - [4096, 2048, 1, 256, 4096, 4096, 256, 256]
    - [8, 113.39]
  - - [4096, 2048, 1, 512, 4096, 4096, 512, 512]
    - [3, 167.63]
  - - [4096, 2048, 1, 1024, 4096, 4096, 1024, 1024]
    - [3, 223.52]
  - - [4096, 2048, 1, 2048, 4096, 4096, 2048, 2048]
    - [3, 267.63]
  - - [4096, 2048, 1, 4096, 4096, 4096, 4096, 4096]
    - [48, 281.44]
  - - [4096, 2048, 1, 8192, 4096, 4096, 8192, 8192]
    - [46, 317.82]
  - - [4096, 4096, 1, 128, 4096, 4096, 128, 128]
    - [8, 71.3]
  - - [4096, 4096, 1, 256, 4096, 4096, 256, 256]
    - [8, 122.37]
  - - [4096, 4096, 1, 512, 4096, 4096, 512, 512]
    - [3, 179.3]
  - - [4096, 4096, 1, 1024, 4096, 4096, 1024, 1024]
    - [5, 228.9]
  - - [4096, 4096, 1, 2048, 4096, 4096, 2048, 2048]
    - [39, 264.5]
  - - [4096, 4096, 1, 4096, 4096, 4096, 4096, 4096]
    - [35, 299.9]
  - - [4096, 4096, 1, 8192, 4096, 4096, 8192, 8192]
    - [36, 332.88]
  - - [4096, 8192, 1, 128, 4096, 4096, 128, 128]
    - [38, 81.5]
  - - [4096, 8192, 1, 256, 4096, 4096, 256, 256]
    - [40, 141.1]
  - - [4096, 8192, 1, 512, 4096, 4096, 512, 512]
    - [38, 209.53]
  - - [4096, 8192, 1, 1024, 4096, 4096, 1024, 1024]
    - [41, 251.3]
  - - [4096, 8192, 1, 2048, 4096, 4096, 2048, 2048]
    - [41, 300.88]
  - - [4096, 8192, 1, 4096, 4096, 4096, 4096, 4096]
    - [41, 332.89]
  - - [4096, 8192, 1, 8192, 4096, 4096, 8192, 8192]
    - [39, 382.27]
  - - [8192, 128, 1, 128, 8192, 8192, 128, 128]
    - [21, 26.83]
  - - [8192, 128, 1, 256, 8192, 8192, 256, 256]
    - [22, 47.83]
  - - [8192, 128, 1, 512, 8192, 8192, 512, 512]
    - [24, 79.46]
  - - [8192, 128, 1, 1024, 8192, 8192, 1024, 1024]
    - [25, 118.93]
  - - [8192, 128, 1, 2048, 8192, 8192, 2048, 2048]
    - [62, 154.29]
  - - [8192, 128, 1, 4096, 8192, 8192, 4096, 4096]
    - [88, 167.81]
  - - [8192, 128, 1, 8192, 8192, 8192, 8192, 8192]
    - [87, 183.22]
  - - [8192, 256, 1, 128, 8192, 8192, 128, 128]
    - [13, 40.21]
  - - [8192, 256, 1, 256, 8192, 8192, 256, 256]
    - [14, 72.01]
  - - [8192, 256, 1, 512, 8192, 8192, 512, 512]
    - [16, 118.96]
  - - [8192, 256, 1, 1024, 8192, 8192, 1024, 1024]
    - [17, 174.78]
  - - [8192, 256, 1, 2048, 8192, 8192, 2048, 2048]
    - [50, 215.35]
  - - [8192, 256, 1, 4096, 8192, 8192, 4096, 4096]
    - [60, 224.83]
  - - [8192, 256, 1, 8192, 8192, 8192, 8192, 8192]
    - [50, 244.87]
  - - [8192, 512, 1, 128, 8192, 8192, 128, 128]
    - [10, 57.46]
  - - [8192, 512, 1, 256, 8192, 8192, 256, 256]
    - [10, 99.75]
  - - [8192, 512, 1, 512, 8192, 8192, 512, 512]
    - [57, 153.94]
  - - [8192, 512, 1, 1024, 8192, 8192, 1024, 1024]
    - [57, 220.69]
  - - [8192, 512, 1, 2048, 8192, 8192, 2048, 2048]
    - [45, 241.2]
  - - [8192, 512, 1, 4096, 8192, 8192, 4096, 4096]
    - [56, 301.18]
  - - [8192, 512, 1, 8192, 8192, 8192, 8192, 8192]
    - [56, 311.7]
  - - [8192, 1024, 1, 128, 8192, 8192, 128, 128]
    - [4, 63.91]
  - - [8192, 1024, 1, 256, 8192, 8192, 256, 256]
    - [47, 110.72]
  - - [8192, 1024, 1, 512, 8192, 8192, 512, 512]
    - [47, 177.87]
  - - [8192, 1024, 1, 1024, 8192, 8192, 1024, 1024]
    - [47, 227.58]
  - - [8192, 1024, 1, 2048, 8192, 8192, 2048, 2048]
    - [47, 303.38]
  - - [8192, 1024, 1, 4096, 8192, 8192, 4096, 4096]
    - [47, 352.5]
  - - [8192, 1024, 1, 8192, 8192, 8192, 8192, 8192]
    - [47, 383.5]
  - - [8192, 2048, 1, 128, 8192, 8192, 128, 128]
    - [48, 70.07]
  - - [8192, 2048, 1, 256, 8192, 8192, 256, 256]
    - [8, 122.21]
  - - [8192, 2048, 1, 512, 8192, 8192, 512, 512]
    - [2, 172.77]
  - - [8192, 2048, 1, 1024, 8192, 8192, 1024, 1024]
    - [47, 245.06]
  - - [8192, 2048, 1, 2048, 8192, 8192, 2048, 2048]
    - [48, 308.25]
  - - [8192, 2048, 1, 4096, 8192, 8192, 4096, 4096]
    - [47, 334.45]
  - - [8192, 2048, 1, 8192, 8192, 8192, 8192, 8192]
    - [47, 391.49]
  - - [8192, 4096, 1, 128, 8192, 8192, 128, 128]
    - [8, 76.9]
  - - [8192, 4096, 1, 256, 8192, 8192, 256, 256]
    - [8, 126.5]
  - - [8192, 4096, 1, 512, 8192, 8192, 512, 512]
    - [48, 187.69]
  - - [8192, 4096, 1, 1024, 8192, 8192, 1024, 1024]
    - [47, 236.04]
  - - [8192, 4096, 1, 2048, 8192, 8192, 2048, 2048]
    - [47, 297.78]
  - - [8192, 4096, 1, 4096, 8192, 8192, 4096, 4096]
    - [47, 347.07]
  - - [8192, 4096, 1, 8192, 8192, 8192, 8192, 8192]
    - [47, 418.14]
  - - [8192, 8192, 1, 128, 8192, 8192, 128, 128]
    - [38, 80.15]
  - - [8192, 8192, 1, 256, 8192, 8192, 256, 256]
    - [37, 128.71]
  - - [8192, 8192, 1, 512, 8192, 8192, 512, 512]
    - [39, 186.55]
  - - [8192, 8192, 1, 1024, 8192, 8192, 1024, 1024]
    - [39, 244.17]
  - - [8192, 8192, 1, 2048, 8192, 8192, 2048, 2048]
    - [37, 303.44]
  - - [8192, 8192, 1, 4096, 8192, 8192, 4096, 4096]
    - [47, 351.25]
  - - [8192, 8192, 1, 8192, 8192, 8192, 8192, 8192]
    - [47, 413.35]
  - - [1, 1, 1, 32, 1, 1, 32, 32]
    - [96, 0.0]
- null
- null
- ExperimentalStreamK
- GridBased
