projects/hipblaslt/library/src/amd_detail/rocblaslt/src/Tensile/Logic/asm_full/aquavanjaram/gfx942_228cu/StreamK/aquavanjaram942_Cijk_Ailk_Bljk_B8NB8NS_BH_Bias_HAS_SAV_UserArgs.yaml
- {MinimumRequiredVersion: 4.33.0}
- aquavanjaram942
- {Architecture: gfx942, CUCount: 228}
- [Device 0049, Device 0050]
    SolutionIndex: 0
    SolutionNameMin: Cijk_Ailk_Bljk_B8NB8NS_BH_Bias_HAS_SAV_UserArgs_MT256x256x64_MI16x16x1_SN_LDSB1_CLR1_GRVWA8_GRVWB16_GSU0_GSUC0_GSUWGMRR0_K1_LBSPPA2048_LBSPPB512_LPA0_LPB16_LRVW8_MIWT8_8_PLR1_SU0_SUM0_SUS64_VWA8_VWB8_WGM1_WGMXCC1_WGMXCCGn1
    SolutionIndex: 1
    SolutionNameMin: Cijk_Ailk_Bljk_B8NB8NS_BH_Bias_HAS_SAV_UserArgs_MT256x256x64_MI16x16x1_SN_LDSB1_CLR1_GRVWA16_GRVWB16_GSU0_GSUC0_GSUWGMRR0_K1_LBSPPA2048_LBSPPB512_LPA0_LPB16_LRVW8_MIWT8_8_PLR1_SU0_SUM0_SUS64_VWA8_VWB8_WGM1_WGMXCC1_WGMXCCGn1
    SolutionIndex: 2
    SolutionNameMin: Cijk_Ailk_Bljk_B8NB8NS_BH_Bias_HAS_SAV_UserArgs_MT256x256x64_MI16x16x1_SN_LDSB1_CLR1_GRVWA8_GRVWB16_GSU0_GSUC0_GSUWGMRR0_K1_LBSPPA2048_LBSPPB512_LPA0_LPB16_LRVW8_MIWT8_8_PLR1_SU0_SUM0_SUS64_VWA8_VWB8_WGM4_WGMXCC1_WGMXCCGn1
    SolutionIndex: 3
    SolutionNameMin: Cijk_Ailk_Bljk_B8NB8NS_BH_Bias_HAS_SAV_UserArgs_MT256x256x64_MI16x16x1_SN_LDSB1_CLR1_GRVWA16_GRVWB8_GSU0_GSUC0_GSUWGMRR0_K1_LBSPPA2048_LBSPPB512_LPA0_LPB8_LRVW8_MIWT8_8_PLR1_SU0_SUM0_SUS64_VWA8_VWB8_WGM6_WGMXCC1_WGMXCCGn1
    SolutionIndex: 4
    SolutionNameMin: Cijk_Ailk_Bljk_B8NB8NS_BH_Bias_HAS_SAV_UserArgs_MT256x256x64_MI16x16x1_SN_LDSB1_CLR1_GRVWA8_GRVWB16_GSU0_GSUC0_GSUWGMRR0_K1_LBSPPA2048_LBSPPB512_LPA0_LPB16_LRVW8_MIWT8_8_PLR1_SU0_SUM0_SUS64_VWA8_VWB8_WGM6_WGMXCC1_WGMXCCGn1
    SolutionIndex: 5
    SolutionNameMin: Cijk_Ailk_Bljk_B8NB8NS_BH_Bias_HAS_SAV_UserArgs_MT256x256x64_MI16x16x1_SN_LDSB1_CLR1_GRVWA8_GRVWB8_GSU0_GSUC0_GSUWGMRR0_K1_LBSPPA2048_LBSPPB512_LPA0_LPB8_LRVW8_MIWT8_8_PLR1_SU0_SUM0_SUS64_VWA8_VWB8_WGM8_WGMXCC1_WGMXCCGn1
    SolutionIndex: 6
    SolutionNameMin: Cijk_Ailk_Bljk_B8NB8NS_BH_Bias_HAS_SAV_UserArgs_MT256x256x64_MI16x16x1_SN_LDSB1_CLR1_GRVWA16_GRVWB8_GSU0_GSUC0_GSUWGMRR0_K1_LBSPPA2048_LBSPPB512_LPA0_LPB8_LRVW8_MIWT8_8_PLR1_SU0_SUM0_SUS64_VWA8_VWB8_WGM8_WGMXCC1_WGMXCCGn1
    SolutionIndex: 7
    SolutionNameMin: Cijk_Ailk_Bljk_B8NB8NS_BH_Bias_HAS_SAV_UserArgs_MT256x256x64_MI16x16x1_SN_LDSB1_CLR1_GRVWA8_GRVWB16_GSU0_GSUC0_GSUWGMRR0_K1_LBSPPA2048_LBSPPB512_LPA0_LPB16_LRVW8_MIWT8_8_PLR1_SU0_SUM0_SUS64_VWA8_VWB8_WGM8_WGMXCC1_WGMXCCGn1
    SolutionIndex: 8
    SolutionNameMin: Cijk_Ailk_Bljk_B8NB8NS_BH_Bias_HAS_SAV_UserArgs_MT128x256x64_MI16x16x1_SN_LDSB1_CLR1_GRVWA16_GRVWB8_GSU0_GSUC0_GSUWGMRR0_K1_LBSPPA1024_LBSPPB512_LPA64_LPB8_LRVW8_MIWT4_8_PLR1_SU0_SUM0_SUS64_VWA4_VWB8_WGM1_WGMXCC1_WGMXCCGn1
    SolutionIndex: 9
    SolutionNameMin: Cijk_Ailk_Bljk_B8NB8NS_BH_Bias_HAS_SAV_UserArgs_MT128x256x64_MI16x16x1_SN_LDSB1_CLR1_GRVWA8_GRVWB16_GSU0_GSUC0_GSUWGMRR0_K1_LBSPPA1024_LBSPPB512_LPA64_LPB16_LRVW8_MIWT4_8_PLR1_SU0_SUM0_SUS64_VWA4_VWB8_WGM1_WGMXCC1_WGMXCCGn1
    SolutionIndex: 10
    SolutionNameMin: Cijk_Ailk_Bljk_B8NB8NS_BH_Bias_HAS_SAV_UserArgs_MT128x256x64_MI16x16x1_SN_LDSB1_CLR1_GRVWA8_GRVWB16_GSU0_GSUC0_GSUWGMRR0_K1_LBSPPA1024_LBSPPB512_LPA64_LPB16_LRVW8_MIWT4_8_PLR1_SU0_SUM0_SUS64_VWA4_VWB8_WGM4_WGMXCC1_WGMXCCGn1
    SolutionIndex: 11
    SolutionNameMin: Cijk_Ailk_Bljk_B8NB8NS_BH_Bias_HAS_SAV_UserArgs_MT128x256x64_MI16x16x1_SN_LDSB1_CLR1_GRVWA16_GRVWB8_GSU0_GSUC0_GSUWGMRR0_K1_LBSPPA1024_LBSPPB512_LPA64_LPB8_LRVW8_MIWT4_8_PLR1_SU0_SUM0_SUS64_VWA4_VWB8_WGM6_WGMXCC1_WGMXCCGn1
    SolutionIndex: 12
    SolutionNameMin: Cijk_Ailk_Bljk_B8NB8NS_BH_Bias_HAS_SAV_UserArgs_MT256x128x64_MI16x16x1_SN_LDSB1_CLR1_GRVWA16_GRVWB8_GSU0_GSUC0_GSUWGMRR0_K1_LBSPPA2048_LBSPPB256_LPA0_LPB8_LRVW8_MIWT8_4_PLR1_SU0_SUM0_SUS64_VWA8_VWB4_WGM1_WGMXCC1_WGMXCCGn1
    SolutionIndex: 13
    SolutionNameMin: Cijk_Ailk_Bljk_B8NB8NS_BH_Bias_HAS_SAV_UserArgs_MT256x128x64_MI16x16x1_SN_LDSB1_CLR1_GRVWA16_GRVWB16_GSU0_GSUC0_GSUWGMRR0_K1_LBSPPA2048_LBSPPB256_LPA0_LPB16_LRVW8_MIWT8_4_PLR1_SU0_SUM0_SUS64_VWA8_VWB4_WGM1_WGMXCC1_WGMXCCGn1
    SolutionIndex: 14
    SolutionNameMin: Cijk_Ailk_Bljk_B8NB8NS_BH_Bias_HAS_SAV_UserArgs_MT256x128x64_MI16x16x1_SN_LDSB1_CLR1_GRVWA16_GRVWB16_GSU0_GSUC0_GSUWGMRR0_K1_LBSPPA2048_LBSPPB256_LPA0_LPB16_LRVW8_MIWT8_4_PLR1_SU0_SUM0_SUS64_VWA8_VWB4_WGM4_WGMXCC1_WGMXCCGn1
    SolutionIndex: 15
    SolutionNameMin: Cijk_Ailk_Bljk_B8NB8NS_BH_Bias_HAS_SAV_UserArgs_MT256x128x64_MI16x16x1_SN_LDSB1_CLR1_GRVWA16_GRVWB16_GSU0_GSUC0_GSUWGMRR0_K1_LBSPPA2048_LBSPPB256_LPA0_LPB16_LRVW8_MIWT8_4_PLR1_SU0_SUM0_SUS64_VWA8_VWB4_WGM8_WGMXCC1_WGMXCCGn1
    SolutionIndex: 16
    SolutionNameMin: Cijk_Ailk_Bljk_B8NB8NS_BH_Bias_HAS_SAV_UserArgs_MT128x128x64_MI16x16x1_SN_LDSB1_CLR1_GRVWA8_GRVWB16_GSU0_GSUC0_GSUWGMRR0_K1_LBSPPA1024_LBSPPB256_LPA64_LPB16_LRVW8_MIWT4_4_PLR1_SU0_SUM0_SUS64_VWA4_VWB4_WGM1_WGMXCC1_WGMXCCGn1
    SolutionIndex: 17
    SolutionNameMin: Cijk_Ailk_Bljk_B8NB8NS_BH_Bias_HAS_SAV_UserArgs_MT128x128x64_MI16x16x1_SN_LDSB1_CLR1_GRVWA16_GRVWB16_GSU0_GSUC0_GSUWGMRR0_K1_LBSPPA1024_LBSPPB256_LPA64_LPB16_LRVW8_MIWT4_4_PLR1_SU0_SUM0_SUS64_VWA4_VWB4_WGM1_WGMXCC1_WGMXCCGn1
    SolutionIndex: 18
    SolutionNameMin: Cijk_Ailk_Bljk_B8NB8NS_BH_Bias_HAS_SAV_UserArgs_MT64x128x64_MI16x16x1_SN_LDSB0_CLR1_GRVWA16_GRVWB8_GSU0_GSUC0_GSUWGMRR0_K1_LBSPPA512_LBSPPB256_LPA32_LPB8_LRVW8_MIWT2_4_PLR1_SU0_SUM0_SUS64_VWA2_VWB4_WGM1_WGMXCC1_WGMXCCGn1
    SolutionIndex: 19
    SolutionNameMin: Cijk_Ailk_Bljk_B8NB8NS_BH_Bias_HAS_SAV_UserArgs_MT64x128x64_MI16x16x1_SN_LDSB0_CLR1_GRVWA8_GRVWB16_GSU0_GSUC0_GSUWGMRR0_K1_LBSPPA512_LBSPPB256_LPA32_LPB16_LRVW8_MIWT2_4_PLR1_SU0_SUM0_SUS64_VWA2_VWB4_WGM1_WGMXCC1_WGMXCCGn1
    SolutionIndex: 20
    SolutionNameMin: Cijk_Ailk_Bljk_B8NB8NS_BH_Bias_HAS_SAV_UserArgs_MT128x64x64_MI16x16x1_SN_LDSB0_CLR1_GRVWA8_GRVWB8_GSU0_GSUC0_GSUWGMRR0_K1_LBSPPA1024_LBSPPB128_LPA64_LPB8_LRVW8_MIWT4_2_PLR1_SU0_SUM0_SUS64_VWA4_VWB2_WGM1_WGMXCC1_WGMXCCGn1
    SolutionIndex: 21
    SolutionNameMin: Cijk_Ailk_Bljk_B8NB8NS_BH_Bias_HAS_SAV_UserArgs_MT128x64x64_MI16x16x1_SN_LDSB0_CLR1_GRVWA8_GRVWB16_GSU0_GSUC0_GSUWGMRR0_K1_LBSPPA1024_LBSPPB128_LPA64_LPB16_LRVW8_MIWT4_2_PLR1_SU0_SUM0_SUS64_VWA4_VWB2_WGM1_WGMXCC1_WGMXCCGn1
    SolutionIndex: 22
    SolutionNameMin: Cijk_Ailk_Bljk_B8NB8NS_BH_Bias_HAS_SAV_UserArgs_MT128x64x64_MI16x16x1_SN_LDSB0_CLR1_GRVWA16_GRVWB16_GSU0_GSUC0_GSUWGMRR0_K1_LBSPPA1024_LBSPPB128_LPA64_LPB16_LRVW8_MIWT4_2_PLR1_SU0_SUM0_SUS64_VWA4_VWB2_WGM1_WGMXCC1_WGMXCCGn1
    SolutionIndex: 23
    SolutionNameMin: Cijk_Ailk_Bljk_B8NB8NS_BH_Bias_HAS_SAV_UserArgs_MT128x64x64_MI16x16x1_SN_LDSB0_CLR1_GRVWA8_GRVWB16_GSU0_GSUC0_GSUWGMRR0_K1_LBSPPA1024_LBSPPB128_LPA64_LPB16_LRVW8_MIWT4_2_PLR1_SU0_SUM0_SUS64_VWA4_VWB2_WGM8_WGMXCC1_WGMXCCGn1
    SolutionIndex: 24
    SolutionNameMin: Cijk_Ailk_Bljk_B8NB8NS_BH_Bias_HAS_SAV_UserArgs_MT128x32x64_MI16x16x1_SN_LDSB0_CLR1_GRVWA16_GRVWB8_GSU0_GSUC0_GSUWGMRR0_K1_LBSPPA1024_LBSPPB128_LPA64_LPB8_LRVW8_MIWT4_1_PLR1_SU0_SUM0_SUS64_VWA4_VWB1_WGM1_WGMXCC1_WGMXCCGn1
    SolutionIndex: 25
    SolutionNameMin: Cijk_Ailk_Bljk_B8NB8NS_BH_Bias_HAS_SAV_UserArgs_MT64x64x64_MI16x16x1_SN_LDSB0_CLR1_GRVWA8_GRVWB8_GSU0_GSUC0_GSUWGMRR0_K1_LBSPPA512_LBSPPB128_LPA32_LPB8_LRVW8_MIWT2_2_PLR1_SU0_SUM0_SUS64_VWA2_VWB2_WGM1_WGMXCC1_WGMXCCGn1
    SolutionIndex: 26
    SolutionNameMin: Cijk_Ailk_Bljk_B8NB8NS_BH_Bias_HAS_SAV_UserArgs_MT64x64x64_MI16x16x1_SN_LDSB0_CLR1_GRVWA8_GRVWB16_GSU0_GSUC0_GSUWGMRR0_K1_LBSPPA512_LBSPPB128_LPA32_LPB16_LRVW8_MIWT2_2_PLR1_SU0_SUM0_SUS64_VWA2_VWB2_WGM1_WGMXCC1_WGMXCCGn1
    SolutionIndex: 27
    SolutionNameMin: Cijk_Ailk_Bljk_B8NB8NS_BH_Bias_HAS_SAV_UserArgs_MT64x64x64_MI16x16x1_SN_LDSB0_CLR1_GRVWA16_GRVWB16_GSU0_GSUC0_GSUWGMRR0_K1_LBSPPA512_LBSPPB128_LPA32_LPB16_LRVW8_MIWT2_2_PLR1_SU0_SUM0_SUS64_VWA2_VWB2_WGM1_WGMXCC1_WGMXCCGn1
    SolutionIndex: 28
    SolutionNameMin: Cijk_Ailk_Bljk_B8NB8NS_BH_Bias_HAS_SAV_UserArgs_MT32x64x64_MI16x16x1_SN_LDSB0_CLR1_GRVWA8_GRVWB8_GSU0_GSUC0_GSUWGMRR0_K1_LBSPPA256_LBSPPB128_LPA16_LPB8_LRVW8_MIWT1_2_PLR1_SU0_SUM0_SUS64_VWA1_VWB2_WGM1_WGMXCC1_WGMXCCGn1
    SolutionIndex: 29
    SolutionNameMin: Cijk_Ailk_Bljk_B8NB8NS_BH_Bias_HAS_SAV_UserArgs_MT64x32x64_MI16x16x1_SN_LDSB0_CLR1_GRVWA8_GRVWB8_GSU0_GSUC0_GSUWGMRR0_K1_LBSPPA512_LBSPPB128_LPA32_LPB8_LRVW8_MIWT2_1_PLR1_SU0_SUM0_SUS64_VWA2_VWB1_WGM1_WGMXCC1_WGMXCCGn1
    SolutionIndex: 30
    SolutionNameMin: Cijk_Ailk_Bljk_B8NB8NS_BH_Bias_HAS_SAV_UserArgs_MT32x32x64_MI16x16x1_SN_LDSB0_CLR1_GRVWA8_GRVWB8_GSU0_GSUC0_GSUWGMRR0_K1_LBSPPA256_LBSPPB128_LPA16_LPB8_LRVW8_MIWT1_1_PLR1_SU0_SUM0_SUS64_VWA1_VWB1_WGM1_WGMXCC1_WGMXCCGn1
    SolutionIndex: 31
    SolutionNameMin: Cijk_Ailk_Bljk_B8NB8NS_BH_Bias_HAS_SAV_UserArgs_MT128x256x128_MI16x16x1_SN_LDSB1_CLR1_GRVWA16_GRVWB8_GSU0_GSUC0_GSUWGMRR0_K1_LBSPPA1024_LBSPPB1024_LPA64_LPB8_LRVW8_MIWT4_8_PLR1_SU0_SUM0_SUS128_VWA4_VWB8_WGM1_WGMXCC1_WGMXCCGn1
    SolutionIndex: 32
    SolutionNameMin: Cijk_Ailk_Bljk_B8NB8NS_BH_Bias_HAS_SAV_UserArgs_MT128x256x128_MI16x16x1_SN_LDSB1_CLR1_GRVWA16_GRVWB16_GSU0_GSUC0_GSUWGMRR0_K1_LBSPPA1024_LBSPPB1024_LPA64_LPB16_LRVW8_MIWT4_8_PLR1_SU0_SUM0_SUS128_VWA4_VWB8_WGM1_WGMXCC1_WGMXCCGn1
    SolutionIndex: 33
    SolutionNameMin: Cijk_Ailk_Bljk_B8NB8NS_BH_Bias_HAS_SAV_UserArgs_MT128x256x128_MI16x16x1_SN_LDSB1_CLR1_GRVWA16_GRVWB16_GSU0_GSUC0_GSUWGMRR0_K1_LBSPPA1024_LBSPPB1024_LPA64_LPB16_LRVW8_MIWT4_8_PLR1_SU0_SUM0_SUS128_VWA4_VWB8_WGM4_WGMXCC1_WGMXCCGn1
    SolutionIndex: 34
    SolutionNameMin: Cijk_Ailk_Bljk_B8NB8NS_BH_Bias_HAS_SAV_UserArgs_MT128x256x128_MI16x16x1_SN_LDSB1_CLR1_GRVWA16_GRVWB16_GSU0_GSUC0_GSUWGMRR0_K1_LBSPPA1024_LBSPPB1024_LPA64_LPB16_LRVW8_MIWT4_8_PLR1_SU0_SUM0_SUS128_VWA4_VWB8_WGM6_WGMXCC1_WGMXCCGn1
    SolutionIndex: 35
    SolutionNameMin: Cijk_Ailk_Bljk_B8NB8NS_BH_Bias_HAS_SAV_UserArgs_MT128x256x128_MI16x16x1_SN_LDSB1_CLR1_GRVWA16_GRVWB16_GSU0_GSUC0_GSUWGMRR0_K1_LBSPPA1024_LBSPPB1024_LPA64_LPB16_LRVW8_MIWT4_8_PLR1_SU0_SUM0_SUS128_VWA4_VWB8_WGM8_WGMXCC1_WGMXCCGn1
    SolutionIndex: 36
    SolutionNameMin: Cijk_Ailk_Bljk_B8NB8NS_BH_Bias_HAS_SAV_UserArgs_MT256x144x128_MI16x16x1_SN_LDSB1_CLR1_GRVWA16_GRVWB8_GSU0_GSUC0_GSUWGMRR0_K1_LBSPPA2048_LBSPPB128_LPA64_LPB8_LRVW8_MIWT4_9_PLR1_SU0_SUM0_SUS128_VWA4_VWB1_WGM1_WGMXCC1_WGMXCCGn1
    SolutionIndex: 37
    SolutionNameMin: Cijk_Ailk_Bljk_B8NB8NS_BH_Bias_HAS_SAV_UserArgs_MT256x144x128_MI16x16x1_SN_LDSB1_CLR1_GRVWA8_GRVWB8_GSU0_GSUC0_GSUWGMRR0_K1_LBSPPA2048_LBSPPB128_LPA64_LPB8_LRVW8_MIWT4_9_PLR1_SU0_SUM0_SUS128_VWA4_VWB1_WGM4_WGMXCC1_WGMXCCGn1
    SolutionIndex: 38
    SolutionNameMin: Cijk_Ailk_Bljk_B8NB8NS_BH_Bias_HAS_SAV_UserArgs_MT256x144x128_MI16x16x1_SN_LDSB1_CLR1_GRVWA16_GRVWB8_GSU0_GSUC0_GSUWGMRR0_K1_LBSPPA2048_LBSPPB128_LPA64_LPB8_LRVW8_MIWT4_9_PLR1_SU0_SUM0_SUS128_VWA4_VWB1_WGM4_WGMXCC1_WGMXCCGn1
    SolutionIndex: 39
    SolutionNameMin: Cijk_Ailk_Bljk_B8NB8NS_BH_Bias_HAS_SAV_UserArgs_MT256x144x128_MI16x16x1_SN_LDSB1_CLR1_GRVWA16_GRVWB8_GSU0_GSUC0_GSUWGMRR0_K1_LBSPPA2048_LBSPPB128_LPA64_LPB8_LRVW8_MIWT4_9_PLR1_SU0_SUM0_SUS128_VWA4_VWB1_WGM6_WGMXCC1_WGMXCCGn1
    SolutionIndex: 40
    SolutionNameMin: Cijk_Ailk_Bljk_B8NB8NS_BH_Bias_HAS_SAV_UserArgs_MT256x144x128_MI16x16x1_SN_LDSB1_CLR1_GRVWA16_GRVWB8_GSU0_GSUC0_GSUWGMRR0_K1_LBSPPA2048_LBSPPB128_LPA64_LPB8_LRVW8_MIWT4_9_PLR1_SU0_SUM0_SUS128_VWA4_VWB1_WGM8_WGMXCC1_WGMXCCGn1
    SolutionIndex: 41
    SolutionNameMin: Cijk_Ailk_Bljk_B8NB8NS_BH_Bias_HAS_SAV_UserArgs_MT256x128x128_MI16x16x1_SN_LDSB1_CLR1_GRVWA16_GRVWB16_GSU0_GSUC0_GSUWGMRR0_K1_LBSPPA2048_LBSPPB512_LPA0_LPB16_LRVW8_MIWT8_4_PLR1_SU0_SUM0_SUS128_VWA8_VWB4_WGM1_WGMXCC1_WGMXCCGn1
    SolutionIndex: 42
    SolutionNameMin: Cijk_Ailk_Bljk_B8NB8NS_BH_Bias_HAS_SAV_UserArgs_MT256x128x128_MI16x16x1_SN_LDSB1_CLR1_GRVWA16_GRVWB8_GSU0_GSUC0_GSUWGMRR0_K1_LBSPPA2048_LBSPPB512_LPA0_LPB8_LRVW8_MIWT8_4_PLR1_SU0_SUM0_SUS128_VWA8_VWB4_WGM4_WGMXCC1_WGMXCCGn1
    SolutionIndex: 43
    SolutionNameMin: Cijk_Ailk_Bljk_B8NB8NS_BH_Bias_HAS_SAV_UserArgs_MT256x128x128_MI16x16x1_SN_LDSB1_CLR1_GRVWA16_GRVWB8_GSU0_GSUC0_GSUWGMRR0_K1_LBSPPA2048_LBSPPB512_LPA0_LPB8_LRVW8_MIWT8_4_PLR1_SU0_SUM0_SUS128_VWA8_VWB4_WGM8_WGMXCC1_WGMXCCGn1
    SolutionIndex: 44
    SolutionNameMin: Cijk_Ailk_Bljk_B8NB8NS_BH_Bias_HAS_SAV_UserArgs_MT128x144x128_MI16x16x1_SN_LDSB1_CLR1_GRVWA8_GRVWB8_GSU0_GSUC0_GSUWGMRR0_K1_LBSPPA1024_LBSPPB128_LPA32_LPB8_LRVW8_MIWT2_9_PLR1_SU0_SUM0_SUS128_VWA2_VWB1_WGM1_WGMXCC1_WGMXCCGn1
    SolutionIndex: 45
    SolutionNameMin: Cijk_Ailk_Bljk_B8NB8NS_BH_Bias_HAS_SAV_UserArgs_MT128x144x128_MI16x16x1_SN_LDSB1_CLR1_GRVWA16_GRVWB8_GSU0_GSUC0_GSUWGMRR0_K1_LBSPPA1024_LBSPPB128_LPA32_LPB8_LRVW8_MIWT2_9_PLR1_SU0_SUM0_SUS128_VWA2_VWB1_WGM1_WGMXCC1_WGMXCCGn1
    SolutionIndex: 46
    SolutionNameMin: Cijk_Ailk_Bljk_B8NB8NS_BH_Bias_HAS_SAV_UserArgs_MT128x144x128_MI16x16x1_SN_LDSB1_CLR1_GRVWA16_GRVWB8_GSU0_GSUC0_GSUWGMRR0_K1_LBSPPA1024_LBSPPB128_LPA32_LPB8_LRVW8_MIWT2_9_PLR1_SU0_SUM0_SUS128_VWA2_VWB1_WGM6_WGMXCC1_WGMXCCGn1
    SolutionIndex: 47
    SolutionNameMin: Cijk_Ailk_Bljk_B8NB8NS_BH_Bias_HAS_SAV_UserArgs_MT128x144x128_MI16x16x1_SN_LDSB1_CLR1_GRVWA16_GRVWB8_GSU0_GSUC0_GSUWGMRR0_K1_LBSPPA1024_LBSPPB128_LPA32_LPB8_LRVW8_MIWT2_9_PLR1_SU0_SUM0_SUS128_VWA2_VWB1_WGM8_WGMXCC1_WGMXCCGn1
    SolutionIndex: 48
    SolutionNameMin: Cijk_Ailk_Bljk_B8NB8NS_BH_Bias_HAS_SAV_UserArgs_MT128x128x128_MI16x16x1_SN_LDSB1_CLR1_GRVWA8_GRVWB16_GSU0_GSUC0_GSUWGMRR0_K1_LBSPPA1024_LBSPPB512_LPA64_LPB16_LRVW8_MIWT4_4_PLR1_SU0_SUM0_SUS128_VWA4_VWB4_WGM1_WGMXCC1_WGMXCCGn1
    SolutionIndex: 49
    SolutionNameMin: Cijk_Ailk_Bljk_B8NB8NS_BH_Bias_HAS_SAV_UserArgs_MT128x128x128_MI16x16x1_SN_LDSB1_CLR1_GRVWA16_GRVWB16_GSU0_GSUC0_GSUWGMRR0_K1_LBSPPA1024_LBSPPB512_LPA64_LPB16_LRVW8_MIWT4_4_PLR1_SU0_SUM0_SUS128_VWA4_VWB4_WGM1_WGMXCC1_WGMXCCGn1
    SolutionIndex: 50
    SolutionNameMin: Cijk_Ailk_Bljk_B8NB8NS_BH_Bias_HAS_SAV_UserArgs_MT128x128x128_MI16x16x1_SN_LDSB1_CLR1_GRVWA16_GRVWB16_GSU0_GSUC0_GSUWGMRR0_K1_LBSPPA1024_LBSPPB512_LPA64_LPB16_LRVW8_MIWT4_4_PLR1_SU0_SUM0_SUS128_VWA4_VWB4_WGM4_WGMXCC1_WGMXCCGn1
    SolutionIndex: 51
    SolutionNameMin: Cijk_Ailk_Bljk_B8NB8NS_BH_Bias_HAS_SAV_UserArgs_MT128x128x128_MI16x16x1_SN_LDSB1_CLR1_GRVWA16_GRVWB16_GSU0_GSUC0_GSUWGMRR0_K1_LBSPPA1024_LBSPPB512_LPA64_LPB16_LRVW8_MIWT4_4_PLR1_SU0_SUM0_SUS128_VWA4_VWB4_WGM6_WGMXCC1_WGMXCCGn1
    SolutionIndex: 52
    SolutionNameMin: Cijk_Ailk_Bljk_B8NB8NS_BH_Bias_HAS_SAV_UserArgs_MT128x128x128_MI16x16x1_SN_LDSB1_CLR1_GRVWA16_GRVWB16_GSU0_GSUC0_GSUWGMRR0_K1_LBSPPA1024_LBSPPB512_LPA64_LPB16_LRVW8_MIWT4_4_PLR1_SU0_SUM0_SUS128_VWA4_VWB4_WGM8_WGMXCC1_WGMXCCGn1
    SolutionIndex: 53
    SolutionNameMin: Cijk_Ailk_Bljk_B8NB8NS_BH_Bias_HAS_SAV_UserArgs_MT64x128x128_MI16x16x1_SN_LDSB1_CLR1_GRVWA8_GRVWB16_GSU0_GSUC0_GSUWGMRR0_K1_LBSPPA512_LBSPPB512_LPA32_LPB16_LRVW8_MIWT2_4_PLR1_SU0_SUM0_SUS128_VWA2_VWB4_WGM1_WGMXCC1_WGMXCCGn1
    SolutionIndex: 54
    SolutionNameMin: Cijk_Ailk_Bljk_B8NB8NS_BH_Bias_HAS_SAV_UserArgs_MT64x128x128_MI16x16x1_SN_LDSB1_CLR1_GRVWA16_GRVWB16_GSU0_GSUC0_GSUWGMRR0_K1_LBSPPA512_LBSPPB512_LPA32_LPB16_LRVW8_MIWT2_4_PLR1_SU0_SUM0_SUS128_VWA2_VWB4_WGM1_WGMXCC1_WGMXCCGn1
    SolutionIndex: 55
    SolutionNameMin: Cijk_Ailk_Bljk_B8NB8NS_BH_Bias_HAS_SAV_UserArgs_MT128x64x128_MI16x16x1_SN_LDSB1_CLR1_GRVWA16_GRVWB16_GSU0_GSUC0_GSUWGMRR0_K1_LBSPPA1024_LBSPPB256_LPA64_LPB16_LRVW8_MIWT4_2_PLR1_SU0_SUM0_SUS128_VWA4_VWB2_WGM1_WGMXCC1_WGMXCCGn1
    SolutionIndex: 56
    SolutionNameMin: Cijk_Ailk_Bljk_B8NB8NS_BH_Bias_HAS_SAV_UserArgs_MT128x64x128_MI16x16x1_SN_LDSB1_CLR1_GRVWA16_GRVWB16_GSU0_GSUC0_GSUWGMRR0_K1_LBSPPA1024_LBSPPB256_LPA64_LPB16_LRVW8_MIWT4_2_PLR1_SU0_SUM0_SUS128_VWA4_VWB2_WGM4_WGMXCC1_WGMXCCGn1
    SolutionIndex: 57
    SolutionNameMin: Cijk_Ailk_Bljk_B8NB8NS_BH_Bias_HAS_SAV_UserArgs_MT128x64x128_MI16x16x1_SN_LDSB1_CLR1_GRVWA16_GRVWB16_GSU0_GSUC0_GSUWGMRR0_K1_LBSPPA1024_LBSPPB256_LPA64_LPB16_LRVW8_MIWT4_2_PLR1_SU0_SUM0_SUS128_VWA4_VWB2_WGM6_WGMXCC1_WGMXCCGn1
    SolutionIndex: 58
    SolutionNameMin: Cijk_Ailk_Bljk_B8NB8NS_BH_Bias_HAS_SAV_UserArgs_MT128x64x128_MI16x16x1_SN_LDSB1_CLR1_GRVWA16_GRVWB16_GSU0_GSUC0_GSUWGMRR0_K1_LBSPPA1024_LBSPPB256_LPA64_LPB16_LRVW8_MIWT4_2_PLR1_SU0_SUM0_SUS128_VWA4_VWB2_WGM8_WGMXCC1_WGMXCCGn1
    SolutionIndex: 59
    SolutionNameMin: Cijk_Ailk_Bljk_B8NB8NS_BH_Bias_HAS_SAV_UserArgs_MT128x32x128_MI16x16x1_SN_LDSB1_CLR1_GRVWA16_GRVWB8_GSU0_GSUC0_GSUWGMRR0_K1_LBSPPA1024_LBSPPB128_LPA64_LPB8_LRVW8_MIWT4_1_PLR1_SU0_SUM0_SUS128_VWA4_VWB1_WGM1_WGMXCC1_WGMXCCGn1
    SolutionIndex: 60
    SolutionNameMin: Cijk_Ailk_Bljk_B8NB8NS_BH_Bias_HAS_SAV_UserArgs_MT64x64x128_MI16x16x1_SN_LDSB1_CLR1_GRVWA16_GRVWB8_GSU0_GSUC0_GSUWGMRR0_K1_LBSPPA512_LBSPPB256_LPA32_LPB8_LRVW8_MIWT2_2_PLR1_SU0_SUM0_SUS128_VWA2_VWB2_WGM1_WGMXCC1_WGMXCCGn1
    SolutionIndex: 61
    SolutionNameMin: Cijk_Ailk_Bljk_B8NB8NS_BH_Bias_HAS_SAV_UserArgs_MT64x64x128_MI16x16x1_SN_LDSB1_CLR1_GRVWA8_GRVWB16_GSU0_GSUC0_GSUWGMRR0_K1_LBSPPA512_LBSPPB256_LPA32_LPB16_LRVW8_MIWT2_2_PLR1_SU0_SUM0_SUS128_VWA2_VWB2_WGM1_WGMXCC1_WGMXCCGn1
    SolutionIndex: 62
    SolutionNameMin: Cijk_Ailk_Bljk_B8NB8NS_BH_Bias_HAS_SAV_UserArgs_MT64x64x128_MI16x16x1_SN_LDSB1_CLR1_GRVWA16_GRVWB16_GSU0_GSUC0_GSUWGMRR0_K1_LBSPPA512_LBSPPB256_LPA32_LPB16_LRVW8_MIWT2_2_PLR1_SU0_SUM0_SUS128_VWA2_VWB2_WGM1_WGMXCC1_WGMXCCGn1
    SolutionIndex: 63
    SolutionNameMin: Cijk_Ailk_Bljk_B8NB8NS_BH_Bias_HAS_SAV_UserArgs_MT64x64x128_MI16x16x1_SN_LDSB1_CLR1_GRVWA16_GRVWB16_GSU0_GSUC0_GSUWGMRR0_K1_LBSPPA512_LBSPPB256_LPA32_LPB16_LRVW8_MIWT2_2_PLR1_SU0_SUM0_SUS128_VWA2_VWB2_WGM4_WGMXCC1_WGMXCCGn1
    SolutionIndex: 64
    SolutionNameMin: Cijk_Ailk_Bljk_B8NB8NS_BH_Bias_HAS_SAV_UserArgs_MT64x64x128_MI16x16x1_SN_LDSB1_CLR1_GRVWA16_GRVWB8_GSU0_GSUC0_GSUWGMRR0_K1_LBSPPA512_LBSPPB256_LPA32_LPB8_LRVW8_MIWT2_2_PLR1_SU0_SUM0_SUS128_VWA2_VWB2_WGM6_WGMXCC1_WGMXCCGn1
    SolutionIndex: 65
    SolutionNameMin: Cijk_Ailk_Bljk_B8NB8NS_BH_Bias_HAS_SAV_UserArgs_MT64x64x128_MI16x16x1_SN_LDSB1_CLR1_GRVWA16_GRVWB16_GSU0_GSUC0_GSUWGMRR0_K1_LBSPPA512_LBSPPB256_LPA32_LPB16_LRVW8_MIWT2_2_PLR1_SU0_SUM0_SUS128_VWA2_VWB2_WGM6_WGMXCC1_WGMXCCGn1
    SolutionIndex: 66
    SolutionNameMin: Cijk_Ailk_Bljk_B8NB8NS_BH_Bias_HAS_SAV_UserArgs_MT64x64x128_MI16x16x1_SN_LDSB1_CLR1_GRVWA16_GRVWB16_GSU0_GSUC0_GSUWGMRR0_K1_LBSPPA512_LBSPPB256_LPA32_LPB16_LRVW8_MIWT2_2_PLR1_SU0_SUM0_SUS128_VWA2_VWB2_WGM8_WGMXCC1_WGMXCCGn1
    SolutionIndex: 67
    SolutionNameMin: Cijk_Ailk_Bljk_B8NB8NS_BH_Bias_HAS_SAV_UserArgs_MT32x64x128_MI16x16x1_SN_LDSB0_CLR1_GRVWA16_GRVWB16_GSU0_GSUC0_GSUWGMRR0_K1_LBSPPA256_LBSPPB256_LPA16_LPB16_LRVW8_MIWT1_2_PLR1_SU0_SUM0_SUS128_VWA1_VWB2_WGM1_WGMXCC1_WGMXCCGn1
    SolutionIndex: 68
    SolutionNameMin: Cijk_Ailk_Bljk_B8NB8NS_BH_Bias_HAS_SAV_UserArgs_MT32x64x128_MI16x16x1_SN_LDSB0_CLR1_GRVWA16_GRVWB16_GSU0_GSUC0_GSUWGMRR0_K1_LBSPPA256_LBSPPB256_LPA16_LPB16_LRVW8_MIWT1_2_PLR1_SU0_SUM0_SUS128_VWA1_VWB2_WGM6_WGMXCC1_WGMXCCGn1
    SolutionIndex: 69
    SolutionNameMin: Cijk_Ailk_Bljk_B8NB8NS_BH_Bias_HAS_SAV_UserArgs_MT64x32x128_MI16x16x1_SN_LDSB0_CLR1_GRVWA8_GRVWB8_GSU0_GSUC0_GSUWGMRR0_K1_LBSPPA512_LBSPPB128_LPA32_LPB8_LRVW8_MIWT2_1_PLR1_SU0_SUM0_SUS128_VWA2_VWB1_WGM1_WGMXCC1_WGMXCCGn1
    SolutionIndex: 70
    SolutionNameMin: Cijk_Ailk_Bljk_B8NB8NS_BH_Bias_HAS_SAV_UserArgs_MT64x32x128_MI16x16x1_SN_LDSB0_CLR1_GRVWA16_GRVWB8_GSU0_GSUC0_GSUWGMRR0_K1_LBSPPA512_LBSPPB128_LPA32_LPB8_LRVW8_MIWT2_1_PLR1_SU0_SUM0_SUS128_VWA2_VWB1_WGM1_WGMXCC1_WGMXCCGn1
    SolutionIndex: 71
    SolutionNameMin: Cijk_Ailk_Bljk_B8NB8NS_BH_Bias_HAS_SAV_UserArgs_MT64x32x128_MI16x16x1_SN_LDSB0_CLR1_GRVWA8_GRVWB16_GSU0_GSUC0_GSUWGMRR0_K1_LBSPPA512_LBSPPB128_LPA32_LPB16_LRVW8_MIWT2_1_PLR1_SU0_SUM0_SUS128_VWA2_VWB1_WGM1_WGMXCC1_WGMXCCGn1
    SolutionIndex: 72
    SolutionNameMin: Cijk_Ailk_Bljk_B8NB8NS_BH_Bias_HAS_SAV_UserArgs_MT64x32x128_MI16x16x1_SN_LDSB0_CLR1_GRVWA16_GRVWB16_GSU0_GSUC0_GSUWGMRR0_K1_LBSPPA512_LBSPPB128_LPA32_LPB16_LRVW8_MIWT2_1_PLR1_SU0_SUM0_SUS128_VWA2_VWB1_WGM1_WGMXCC1_WGMXCCGn1
    SolutionIndex: 73
    SolutionNameMin: Cijk_Ailk_Bljk_B8NB8NS_BH_Bias_HAS_SAV_UserArgs_MT32x32x128_MI16x16x1_SN_LDSB0_CLR1_GRVWA8_GRVWB8_GSU0_GSUC0_GSUWGMRR0_K1_LBSPPA256_LBSPPB128_LPA16_LPB8_LRVW8_MIWT1_1_PLR1_SU0_SUM0_SUS128_VWA1_VWB1_WGM1_WGMXCC1_WGMXCCGn1
    SolutionIndex: 74
    SolutionNameMin: Cijk_Ailk_Bljk_B8NB8NS_BH_Bias_HAS_SAV_UserArgs_MT32x32x128_MI16x16x1_SN_LDSB0_CLR1_GRVWA8_GRVWB16_GSU0_GSUC0_GSUWGMRR0_K1_LBSPPA256_LBSPPB128_LPA16_LPB16_LRVW8_MIWT1_1_PLR1_SU0_SUM0_SUS128_VWA1_VWB1_WGM1_WGMXCC1_WGMXCCGn1
    SolutionIndex: 75
    SolutionNameMin: Cijk_Ailk_Bljk_B8NB8NS_BH_Bias_HAS_SAV_UserArgs_MT32x32x128_MI16x16x1_SN_LDSB0_CLR1_GRVWA16_GRVWB16_GSU0_GSUC0_GSUWGMRR0_K1_LBSPPA256_LBSPPB128_LPA16_LPB16_LRVW8_MIWT1_1_PLR1_SU0_SUM0_SUS128_VWA1_VWB1_WGM1_WGMXCC1_WGMXCCGn1
    SolutionIndex: 76
    SolutionNameMin: Cijk_Ailk_Bljk_B8NB8NS_BH_Bias_HAS_SAV_UserArgs_MT128x64x256_MI16x16x1_SN_LDSB1_CLR1_GRVWA16_GRVWB16_GSU0_GSUC0_GSUWGMRR0_K1_LBSPPA1024_LBSPPB512_LPA64_LPB16_LRVW8_MIWT4_2_PLR1_SU0_SUM0_SUS256_VWA4_VWB2_WGM1_WGMXCC1_WGMXCCGn1
    SolutionIndex: 77
    SolutionNameMin: Cijk_Ailk_Bljk_B8NB8NS_BH_Bias_HAS_SAV_UserArgs_MT64x64x256_MI16x16x1_SN_LDSB1_CLR1_GRVWA16_GRVWB16_GSU0_GSUC0_GSUWGMRR0_K1_LBSPPA512_LBSPPB512_LPA32_LPB16_LRVW8_MIWT2_2_PLR1_SU0_SUM0_SUS256_VWA2_VWB2_WGM1_WGMXCC1_WGMXCCGn1
    SolutionIndex: 78
    SolutionNameMin: Cijk_Ailk_Bljk_B8NB8NS_BH_Bias_HAS_SAV_UserArgs_MT64x32x256_MI16x16x1_SN_LDSB1_CLR1_GRVWA16_GRVWB16_GSU0_GSUC0_GSUWGMRR0_K1_LBSPPA512_LBSPPB256_LPA32_LPB16_LRVW8_MIWT2_1_PLR1_SU0_SUM0_SUS256_VWA2_VWB1_WGM1_WGMXCC1_WGMXCCGn1
    SolutionIndex: 79
    SolutionNameMin: Cijk_Ailk_Bljk_B8NB8NS_BH_Bias_HAS_SAV_UserArgs_MT64x32x256_MI16x16x1_SN_LDSB1_CLR1_GRVWA16_GRVWB16_GSU0_GSUC0_GSUWGMRR0_K1_LBSPPA512_LBSPPB256_LPA32_LPB16_LRVW8_MIWT2_1_PLR1_SU0_SUM0_SUS256_VWA2_VWB1_WGM4_WGMXCC1_WGMXCCGn1
    SolutionIndex: 80
    SolutionNameMin: Cijk_Ailk_Bljk_B8NB8NS_BH_Bias_HAS_SAV_UserArgs_MT64x32x256_MI16x16x1_SN_LDSB1_CLR1_GRVWA16_GRVWB16_GSU0_GSUC0_GSUWGMRR0_K1_LBSPPA512_LBSPPB256_LPA32_LPB16_LRVW8_MIWT2_1_PLR1_SU0_SUM0_SUS256_VWA2_VWB1_WGM6_WGMXCC1_WGMXCCGn1
    SolutionIndex: 81
    SolutionNameMin: Cijk_Ailk_Bljk_B8NB8NS_BH_Bias_HAS_SAV_UserArgs_MT64x32x256_MI16x16x1_SN_LDSB1_CLR1_GRVWA16_GRVWB16_GSU0_GSUC0_GSUWGMRR0_K1_LBSPPA512_LBSPPB256_LPA32_LPB16_LRVW8_MIWT2_1_PLR1_SU0_SUM0_SUS256_VWA2_VWB1_WGM8_WGMXCC1_WGMXCCGn1
    SolutionIndex: 82
    SolutionNameMin: Cijk_Ailk_Bljk_B8NB8NS_BH_Bias_HAS_SAV_UserArgs_MT32x32x256_MI16x16x1_SN_LDSB1_CLR1_GRVWA8_GRVWB16_GSU0_GSUC0_GSUWGMRR0_K1_LBSPPA256_LBSPPB256_LPA16_LPB16_LRVW8_MIWT1_1_PLR1_SU0_SUM0_SUS256_VWA1_VWB1_WGM1_WGMXCC1_WGMXCCGn1
    SolutionIndex: 83
    SolutionNameMin: Cijk_Ailk_Bljk_B8NB8NS_BH_Bias_HAS_SAV_UserArgs_MT32x32x256_MI16x16x1_SN_LDSB1_CLR1_GRVWA8_GRVWB16_GSU0_GSUC0_GSUWGMRR0_K1_LBSPPA256_LBSPPB256_LPA16_LPB16_LRVW8_MIWT1_1_PLR1_SU0_SUM0_SUS256_VWA1_VWB1_WGM6_WGMXCC1_WGMXCCGn1
    SolutionIndex: 84
    SolutionNameMin: Cijk_Ailk_Bljk_B8NB8NS_BH_Bias_HAS_SAV_UserArgs_MT32x32x256_MI16x16x1_SN_LDSB1_CLR1_GRVWA16_GRVWB16_GSU0_GSUC0_GSUWGMRR0_K1_LBSPPA256_LBSPPB256_LPA16_LPB16_LRVW8_MIWT1_1_PLR1_SU0_SUM0_SUS256_VWA1_VWB1_WGM6_WGMXCC1_WGMXCCGn1
    SolutionIndex: 85
    SolutionNameMin: Cijk_Ailk_Bljk_B8NB8NS_BH_Bias_HAS_SAV_UserArgs_MT32x32x256_MI16x16x1_SN_LDSB1_CLR1_GRVWA16_GRVWB16_GSU0_GSUC0_GSUWGMRR0_K1_LBSPPA256_LBSPPB256_LPA16_LPB16_LRVW8_MIWT1_1_PLR1_SU0_SUM0_SUS256_VWA1_VWB1_WGM8_WGMXCC1_WGMXCCGn1
- - - [128, 128, 1, 128, 128, 128, 128, 128]
    - [73, 0.55]
  - - [128, 128, 1, 256, 128, 128, 128, 256]
    - [73, 1.01]
  - - [128, 128, 1, 512, 128, 128, 128, 512]
    - [74, 1.76]
  - - [128, 128, 1, 1024, 128, 128, 128, 1024]
    - [74, 2.77]
  - - [128, 128, 1, 2048, 128, 128, 128, 2048]
    - [73, 3.83]
  - - [128, 128, 1, 4096, 128, 128, 128, 4096]
    - [75, 4.81]
  - - [128, 128, 1, 8192, 128, 128, 128, 8192]
    - [73, 5.48]
  - - [128, 256, 1, 128, 128, 128, 128, 128]
    - [74, 1.13]
  - - [128, 256, 1, 256, 128, 128, 128, 256]
    - [74, 2.06]
  - - [128, 256, 1, 512, 128, 128, 128, 512]
    - [74, 3.55]
  - - [128, 256, 1, 1024, 128, 128, 128, 1024]
    - [74, 5.58]
  - - [128, 256, 1, 2048, 128, 128, 128, 2048]
    - [73, 7.69]
  - - [128, 256, 1, 4096, 128, 128, 128, 4096]
    - [73, 9.58]
  - - [128, 256, 1, 8192, 128, 128, 128, 8192]
    - [73, 10.97]
  - - [128, 512, 1, 128, 128, 128, 128, 128]
    - [30, 2.23]
  - - [128, 512, 1, 256, 128, 128, 128, 256]
    - [74, 4.04]
  - - [128, 512, 1, 512, 128, 128, 128, 512]
    - [74, 7.03]
  - - [128, 512, 1, 1024, 128, 128, 128, 1024]
    - [73, 10.97]
  - - [128, 512, 1, 2048, 128, 128, 128, 2048]
    - [74, 15.42]
  - - [128, 512, 1, 4096, 128, 128, 128, 4096]
    - [73, 19.15]
  - - [128, 512, 1, 8192, 128, 128, 128, 8192]
    - [73, 21.85]
  - - [128, 1024, 1, 128, 128, 128, 128, 128]
    - [30, 4.46]
  - - [128, 1024, 1, 256, 128, 128, 128, 256]
    - [74, 8.11]
  - - [128, 1024, 1, 512, 128, 128, 128, 512]
    - [74, 13.82]
  - - [128, 1024, 1, 1024, 128, 128, 128, 1024]
    - [74, 21.66]
  - - [128, 1024, 1, 2048, 128, 128, 128, 2048]
    - [73, 30.36]
  - - [128, 1024, 1, 4096, 128, 128, 128, 4096]
    - [73, 37.27]
  - - [128, 1024, 1, 8192, 128, 128, 128, 8192]
    - [73, 43.1]
  - - [128, 2048, 1, 128, 128, 128, 128, 128]
    - [69, 8.46]
  - - [128, 2048, 1, 256, 128, 128, 128, 256]
    - [69, 15.03]
  - - [128, 2048, 1, 512, 128, 128, 128, 512]
    - [71, 25.23]
  - - [128, 2048, 1, 1024, 128, 128, 128, 1024]
    - [71, 38.01]
  - - [128, 2048, 1, 2048, 128, 128, 128, 2048]
    - [78, 52.03]
  - - [128, 2048, 1, 4096, 128, 128, 128, 4096]
    - [78, 64.28]
  - - [128, 2048, 1, 8192, 128, 128, 128, 8192]
    - [78, 72.44]
  - - [128, 4096, 1, 128, 128, 128, 128, 128]
    - [26, 15.3]
  - - [128, 4096, 1, 256, 128, 128, 128, 256]
    - [25, 26.8]
  - - [128, 4096, 1, 512, 128, 128, 128, 512]
    - [60, 43.87]
  - - [128, 4096, 1, 1024, 128, 128, 128, 1024]
    - [60, 65.05]
  - - [128, 4096, 1, 2048, 128, 128, 128, 2048]
    - [60, 85.88]
  - - [128, 4096, 1, 4096, 128, 128, 128, 4096]
    - [77, 102.87]
  - - [128, 4096, 1, 8192, 128, 128, 128, 8192]
    - [77, 112.93]
  - - [128, 8192, 1, 128, 128, 128, 128, 128]
    - [20, 25.43]
  - - [128, 8192, 1, 256, 128, 128, 128, 256]
    - [21, 44.24]
  - - [128, 8192, 1, 512, 128, 128, 128, 512]
    - [19, 70.33]
  - - [128, 8192, 1, 1024, 128, 128, 128, 1024]
    - [18, 101.8]
  - - [128, 8192, 1, 2048, 128, 128, 128, 2048]
    - [18, 133.08]
  - - [128, 8192, 1, 4096, 128, 128, 128, 4096]
    - [53, 143.15]
  - - [128, 8192, 1, 8192, 128, 128, 128, 8192]
    - [54, 153.47]
  - - [256, 128, 1, 128, 256, 256, 256, 128]
    - [30, 1.03]
  - - [256, 128, 1, 256, 256, 256, 256, 256]
    - [30, 1.94]
  - - [256, 128, 1, 512, 256, 256, 256, 512]
    - [74, 3.38]
  - - [256, 128, 1, 1024, 256, 256, 256, 1024]
    - [74, 5.36]
  - - [256, 128, 1, 2048, 256, 256, 256, 2048]
    - [73, 7.52]
  - - [256, 128, 1, 4096, 256, 256, 256, 4096]
    - [75, 9.45]
  - - [256, 128, 1, 8192, 256, 256, 256, 8192]
    - [73, 10.86]
  - - [256, 256, 1, 128, 256, 256, 256, 128]
    - [28, 1.95]
  - - [256, 256, 1, 256, 256, 256, 256, 256]
    - [82, 3.8]
  - - [256, 256, 1, 512, 256, 256, 256, 512]
    - [74, 7.01]
  - - [256, 256, 1, 1024, 256, 256, 256, 1024]
    - [74, 10.97]
  - - [256, 256, 1, 2048, 256, 256, 256, 2048]
    - [74, 15.35]
  - - [256, 256, 1, 4096, 256, 256, 256, 4096]
    - [73, 19.1]
  - - [256, 256, 1, 8192, 256, 256, 256, 8192]
    - [73, 21.79]
  - - [256, 512, 1, 128, 256, 256, 256, 128]
    - [30, 4.45]
  - - [256, 512, 1, 256, 256, 256, 256, 256]
    - [74, 8.02]
  - - [256, 512, 1, 512, 256, 256, 256, 512]
    - [74, 13.83]
  - - [256, 512, 1, 1024, 256, 256, 256, 1024]
    - [74, 21.67]
  - - [256, 512, 1, 2048, 256, 256, 256, 2048]
    - [73, 30.21]
  - - [256, 512, 1, 4096, 256, 256, 256, 4096]
    - [73, 37.73]
  - - [256, 512, 1, 8192, 256, 256, 256, 8192]
    - [73, 42.96]
  - - [256, 1024, 1, 128, 256, 256, 256, 128]
    - [71, 8.33]
  - - [256, 1024, 1, 256, 256, 256, 256, 256]
    - [29, 14.24]
  - - [256, 1024, 1, 512, 256, 256, 256, 512]
    - [71, 23.72]
  - - [256, 1024, 1, 1024, 256, 256, 256, 1024]
    - [71, 36.83]
  - - [256, 1024, 1, 2048, 256, 256, 256, 2048]
    - [79, 51.5]
  - - [256, 1024, 1, 4096, 256, 256, 256, 4096]
    - [78, 63.4]
  - - [256, 1024, 1, 8192, 256, 256, 256, 8192]
    - [78, 71.9]
  - - [256, 2048, 1, 128, 256, 256, 256, 128]
    - [27, 14.35]
  - - [256, 2048, 1, 256, 256, 256, 256, 256]
    - [26, 25.26]
  - - [256, 2048, 1, 512, 256, 256, 256, 512]
    - [62, 41.8]
  - - [256, 2048, 1, 1024, 256, 256, 256, 1024]
    - [60, 62.6]
  - - [256, 2048, 1, 2048, 256, 256, 256, 2048]
    - [60, 83.49]
  - - [256, 2048, 1, 4096, 256, 256, 256, 4096]
    - [77, 101.29]
  - - [256, 2048, 1, 8192, 256, 256, 256, 8192]
    - [64, 109.91]
  - - [256, 4096, 1, 128, 256, 256, 256, 128]
    - [21, 25.33]
  - - [256, 4096, 1, 256, 256, 256, 256, 256]
    - [22, 45.71]
  - - [256, 4096, 1, 512, 256, 256, 256, 512]
    - [19, 73.2]
  - - [256, 4096, 1, 1024, 256, 256, 256, 1024]
    - [18, 104.81]
  - - [256, 4096, 1, 2048, 256, 256, 256, 2048]
    - [18, 134.75]
  - - [256, 4096, 1, 4096, 256, 256, 256, 4096]
    - [54, 147.43]
  - - [256, 4096, 1, 8192, 256, 256, 256, 8192]
    - [54, 157.68]
  - - [256, 8192, 1, 128, 256, 256, 256, 128]
    - [49, 42.11]
  - - [256, 8192, 1, 256, 256, 256, 256, 256]
    - [17, 71.8]
  - - [256, 8192, 1, 512, 256, 256, 256, 512]
    - [49, 114.06]
  - - [256, 8192, 1, 1024, 256, 256, 256, 1024]
    - [49, 162.24]
  - - [256, 8192, 1, 2048, 256, 256, 256, 2048]
    - [49, 202.22]
  - - [256, 8192, 1, 4096, 256, 256, 256, 4096]
    - [49, 217.47]
  - - [256, 8192, 1, 8192, 256, 256, 256, 8192]
    - [51, 217.96]
  - - [512, 128, 1, 128, 512, 512, 512, 128]
    - [74, 2.23]
  - - [512, 128, 1, 256, 512, 512, 512, 256]
    - [74, 4.11]
  - - [512, 128, 1, 512, 512, 512, 512, 512]
    - [74, 7.1]
  - - [512, 128, 1, 1024, 512, 512, 512, 1024]
    - [74, 11.05]
  - - [512, 128, 1, 2048, 512, 512, 512, 2048]
    - [73, 15.4]
  - - [512, 128, 1, 4096, 512, 512, 512, 4096]
    - [73, 19.15]
  - - [512, 128, 1, 8192, 512, 512, 512, 8192]
    - [84, 18.63]
  - - [512, 256, 1, 128, 512, 512, 512, 128]
    - [73, 3.97]
  - - [512, 256, 1, 256, 512, 512, 512, 256]
    - [74, 7.59]
  - - [512, 256, 1, 512, 512, 512, 512, 512]
    - [74, 13.1]
  - - [512, 256, 1, 1024, 512, 512, 512, 1024]
    - [74, 20.82]
  - - [512, 256, 1, 2048, 512, 512, 512, 2048]
    - [73, 29.4]
  - - [512, 256, 1, 4096, 512, 512, 512, 4096]
    - [73, 37.01]
  - - [512, 256, 1, 8192, 512, 512, 512, 8192]
    - [85, 37.09]
  - - [512, 512, 1, 128, 512, 512, 512, 128]
    - [70, 7.75]
  - - [512, 512, 1, 256, 512, 512, 512, 256]
    - [69, 14.96]
  - - [512, 512, 1, 512, 512, 512, 512, 512]
    - [71, 25.16]
  - - [512, 512, 1, 1024, 512, 512, 512, 1024]
    - [71, 37.98]
  - - [512, 512, 1, 2048, 512, 512, 512, 2048]
    - [78, 51.89]
  - - [512, 512, 1, 4096, 512, 512, 512, 4096]
    - [78, 64.02]
  - - [512, 512, 1, 8192, 512, 512, 512, 8192]
    - [72, 62.59]
  - - [512, 1024, 1, 128, 512, 512, 512, 128]
    - [26, 15.23]
  - - [512, 1024, 1, 256, 512, 512, 512, 256]
    - [26, 25.38]
  - - [512, 1024, 1, 512, 512, 512, 512, 512]
    - [61, 42.89]
  - - [512, 1024, 1, 1024, 512, 512, 512, 1024]
    - [60, 63.76]
  - - [512, 1024, 1, 2048, 512, 512, 512, 2048]
    - [60, 84.44]
  - - [512, 1024, 1, 4096, 512, 512, 512, 4096]
    - [60, 100.81]
  - - [512, 1024, 1, 8192, 512, 512, 512, 8192]
    - [62, 104.65]
  - - [512, 2048, 1, 128, 512, 512, 512, 128]
    - [22, 26.41]
  - - [512, 2048, 1, 256, 512, 512, 512, 256]
    - [19, 45.8]
  - - [512, 2048, 1, 512, 512, 512, 512, 512]
    - [19, 72.95]
  - - [512, 2048, 1, 1024, 512, 512, 512, 1024]
    - [18, 104.44]
  - - [512, 2048, 1, 2048, 512, 512, 512, 2048]
    - [18, 132.76]
  - - [512, 2048, 1, 4096, 512, 512, 512, 4096]
    - [76, 145.57]
  - - [512, 2048, 1, 8192, 512, 512, 512, 8192]
    - [55, 147.04]
  - - [512, 4096, 1, 128, 512, 512, 512, 128]
    - [16, 40.6]
  - - [512, 4096, 1, 256, 512, 512, 512, 256]
    - [16, 69.26]
  - - [512, 4096, 1, 512, 512, 512, 512, 512]
    - [49, 111.23]
  - - [512, 4096, 1, 1024, 512, 512, 512, 1024]
    - [49, 158.22]
  - - [512, 4096, 1, 2048, 512, 512, 512, 2048]
    - [49, 202.21]
  - - [512, 4096, 1, 4096, 512, 512, 512, 4096]
    - [50, 204.68]
  - - [512, 4096, 1, 8192, 512, 512, 512, 8192]
    - [51, 200.15]
  - - [512, 8192, 1, 128, 512, 512, 512, 128]
    - [44, 61.59]
  - - [512, 8192, 1, 256, 512, 512, 512, 256]
    - [45, 106.38]
  - - [512, 8192, 1, 512, 512, 512, 512, 512]
    - [45, 167.8]
  - - [512, 8192, 1, 1024, 512, 512, 512, 1024]
    - [46, 228.29]
  - - [512, 8192, 1, 2048, 512, 512, 512, 2048]
    - [41, 241.7]
  - - [512, 8192, 1, 4096, 512, 512, 512, 4096]
    - [38, 256.42]
  - - [512, 8192, 1, 8192, 512, 512, 512, 8192]
    - [47, 245.91]
  - - [1024, 128, 1, 128, 1024, 1024, 1024, 128]
    - [30, 4.19]
  - - [1024, 128, 1, 256, 1024, 1024, 1024, 256]
    - [30, 7.41]
  - - [1024, 128, 1, 512, 1024, 1024, 1024, 512]
    - [74, 13.21]
  - - [1024, 128, 1, 1024, 1024, 1024, 1024, 1024]
    - [74, 20.59]
  - - [1024, 128, 1, 2048, 1024, 1024, 1024, 2048]
    - [73, 29.24]
  - - [1024, 128, 1, 4096, 1024, 1024, 1024, 4096]
    - [85, 29.65]
  - - [1024, 128, 1, 8192, 1024, 1024, 1024, 8192]
    - [83, 30.23]
  - - [1024, 256, 1, 128, 1024, 1024, 1024, 128]
    - [72, 7.6]
  - - [1024, 256, 1, 256, 1024, 1024, 1024, 256]
    - [71, 14.12]
  - - [1024, 256, 1, 512, 1024, 1024, 1024, 512]
    - [71, 25.13]
  - - [1024, 256, 1, 1024, 1024, 1024, 1024, 1024]
    - [71, 37.71]
  - - [1024, 256, 1, 2048, 1024, 1024, 1024, 2048]
    - [78, 51.49]
  - - [1024, 256, 1, 4096, 1024, 1024, 1024, 4096]
    - [68, 53.75]
  - - [1024, 256, 1, 8192, 1024, 1024, 1024, 8192]
    - [80, 59.01]
  - - [1024, 512, 1, 128, 1024, 1024, 1024, 128]
    - [26, 15.3]
  - - [1024, 512, 1, 256, 1024, 1024, 1024, 256]
    - [26, 26.66]
  - - [1024, 512, 1, 512, 1024, 1024, 1024, 512]
    - [61, 43.07]
  - - [1024, 512, 1, 1024, 1024, 1024, 1024, 1024]
    - [60, 63.66]
  - - [1024, 512, 1, 2048, 1024, 1024, 1024, 2048]
    - [60, 84.38]
  - - [1024, 512, 1, 4096, 1024, 1024, 1024, 4096]
    - [63, 94.19]
  - - [1024, 512, 1, 8192, 1024, 1024, 1024, 8192]
    - [66, 103.1]
  - - [1024, 1024, 1, 128, 1024, 1024, 1024, 128]
    - [55, 25.73]
  - - [1024, 1024, 1, 256, 1024, 1024, 1024, 256]
    - [19, 45.26]
  - - [1024, 1024, 1, 512, 1024, 1024, 1024, 512]
    - [18, 72.15]
  - - [1024, 1024, 1, 1024, 1024, 1024, 1024, 1024]
    - [19, 103.54]
  - - [1024, 1024, 1, 2048, 1024, 1024, 1024, 2048]
    - [18, 133.8]
  - - [1024, 1024, 1, 4096, 1024, 1024, 1024, 4096]
    - [58, 141.02]
  - - [1024, 1024, 1, 8192, 1024, 1024, 1024, 8192]
    - [58, 147.11]
  - - [1024, 2048, 1, 128, 1024, 1024, 1024, 128]
    - [16, 42.13]
  - - [1024, 2048, 1, 256, 1024, 1024, 1024, 256]
    - [49, 71.91]
  - - [1024, 2048, 1, 512, 1024, 1024, 1024, 512]
    - [49, 114.95]
  - - [1024, 2048, 1, 1024, 1024, 1024, 1024, 1024]
    - [49, 161.85]
  - - [1024, 2048, 1, 2048, 1024, 1024, 1024, 2048]
    - [49, 203.73]
  - - [1024, 2048, 1, 4096, 1024, 1024, 1024, 4096]
    - [49, 204.24]
  - - [1024, 2048, 1, 8192, 1024, 1024, 1024, 8192]
    - [50, 199.01]
  - - [1024, 4096, 1, 128, 1024, 1024, 1024, 128]
    - [13, 58.69]
  - - [1024, 4096, 1, 256, 1024, 1024, 1024, 256]
    - [13, 99.55]
  - - [1024, 4096, 1, 512, 1024, 1024, 1024, 512]
    - [8, 153.87]
  - - [1024, 4096, 1, 1024, 1024, 1024, 1024, 1024]
    - [8, 212.93]
  - - [1024, 4096, 1, 2048, 1024, 1024, 1024, 2048]
    - [41, 243.67]
  - - [1024, 4096, 1, 4096, 1024, 1024, 1024, 4096]
    - [32, 255.76]
  - - [1024, 4096, 1, 8192, 1024, 1024, 1024, 8192]
    - [32, 242.77]
  - - [1024, 8192, 1, 128, 1024, 1024, 1024, 128]
    - [36, 90.64]
  - - [1024, 8192, 1, 256, 1024, 1024, 1024, 256]
    - [36, 153.45]
  - - [1024, 8192, 1, 512, 1024, 1024, 1024, 512]
    - [36, 232.59]
  - - [1024, 8192, 1, 1024, 1024, 1024, 1024, 1024]
    - [2, 241.4]
  - - [1024, 8192, 1, 2048, 1024, 1024, 1024, 2048]
    - [38, 296.04]
  - - [1024, 8192, 1, 4096, 1024, 1024, 1024, 4096]
    - [40, 345.86]
  - - [1024, 8192, 1, 8192, 1024, 1024, 1024, 8192]
    - [39, 371.11]
  - - [2048, 128, 1, 128, 2048, 2048, 2048, 128]
    - [71, 8.45]
  - - [2048, 128, 1, 256, 2048, 2048, 2048, 256]
    - [71, 15.06]
  - - [2048, 128, 1, 512, 2048, 2048, 2048, 512]
    - [71, 25.18]
  - - [2048, 128, 1, 1024, 2048, 2048, 2048, 1024]
    - [71, 37.9]
  - - [2048, 128, 1, 2048, 2048, 2048, 2048, 2048]
    - [67, 44.74]
  - - [2048, 128, 1, 4096, 2048, 2048, 2048, 4096]
    - [79, 52.5]
  - - [2048, 128, 1, 8192, 2048, 2048, 2048, 8192]
    - [81, 59.33]
  - - [2048, 256, 1, 128, 2048, 2048, 2048, 128]
    - [59, 14.83]
  - - [2048, 256, 1, 256, 2048, 2048, 2048, 256]
    - [26, 26.37]
  - - [2048, 256, 1, 512, 2048, 2048, 2048, 512]
    - [26, 41.52]
  - - [2048, 256, 1, 1024, 2048, 2048, 2048, 1024]
    - [62, 62.63]
  - - [2048, 256, 1, 2048, 2048, 2048, 2048, 2048]
    - [65, 78.19]
  - - [2048, 256, 1, 4096, 2048, 2048, 2048, 4096]
    - [66, 93.25]
  - - [2048, 256, 1, 8192, 2048, 2048, 2048, 8192]
    - [63, 104.47]
  - - [2048, 512, 1, 128, 2048, 2048, 2048, 128]
    - [21, 25.96]
  - - [2048, 512, 1, 256, 2048, 2048, 2048, 256]
    - [19, 45.54]
  - - [2048, 512, 1, 512, 2048, 2048, 2048, 512]
    - [19, 71.91]
  - - [2048, 512, 1, 1024, 2048, 2048, 2048, 1024]
    - [18, 104.05]
  - - [2048, 512, 1, 2048, 2048, 2048, 2048, 2048]
    - [58, 120.77]
  - - [2048, 512, 1, 4096, 2048, 2048, 2048, 4096]
    - [58, 141.02]
  - - [2048, 512, 1, 8192, 2048, 2048, 2048, 8192]
    - [57, 147.21]
  - - [2048, 1024, 1, 128, 2048, 2048, 2048, 128]
    - [16, 42.62]
  - - [2048, 1024, 1, 256, 2048, 2048, 2048, 256]
    - [17, 72.19]
  - - [2048, 1024, 1, 512, 2048, 2048, 2048, 512]
    - [49, 114.07]
  - - [2048, 1024, 1, 1024, 2048, 2048, 2048, 1024]
    - [49, 161.25]
  - - [2048, 1024, 1, 2048, 2048, 2048, 2048, 2048]
    - [52, 183.3]
  - - [2048, 1024, 1, 4096, 2048, 2048, 2048, 4096]
    - [50, 205.94]
  - - [2048, 1024, 1, 8192, 2048, 2048, 2048, 8192]
    - [50, 197.69]
  - - [2048, 2048, 1, 128, 2048, 2048, 2048, 128]
    - [13, 59.49]
  - - [2048, 2048, 1, 256, 2048, 2048, 2048, 256]
    - [15, 101.03]
  - - [2048, 2048, 1, 512, 2048, 2048, 2048, 512]
    - [8, 154.77]
  - - [2048, 2048, 1, 1024, 2048, 2048, 2048, 1024]
    - [9, 208.93]
  - - [2048, 2048, 1, 2048, 2048, 2048, 2048, 2048]
    - [15, 239.59]
  - - [2048, 2048, 1, 4096, 2048, 2048, 2048, 4096]
    - [43, 256.29]
  - - [2048, 2048, 1, 8192, 2048, 2048, 2048, 8192]
    - [33, 242.47]
  - - [2048, 4096, 1, 128, 2048, 2048, 2048, 128]
    - [2, 73.81]
  - - [2048, 4096, 1, 256, 2048, 2048, 2048, 256]
    - [0, 124.01]
  - - [2048, 4096, 1, 512, 2048, 2048, 2048, 512]
    - [0, 183.58]
  - - [2048, 4096, 1, 1024, 2048, 2048, 2048, 1024]
    - [6, 240.58]
  - - [2048, 4096, 1, 2048, 2048, 2048, 2048, 2048]
    - [6, 274.2]
  - - [2048, 4096, 1, 4096, 2048, 2048, 2048, 4096]
    - [38, 276.71]
  - - [2048, 4096, 1, 8192, 2048, 2048, 2048, 8192]
    - [40, 308.99]
  - - [2048, 8192, 1, 128, 2048, 2048, 2048, 128]
    - [40, 95.83]
  - - [2048, 8192, 1, 256, 2048, 2048, 2048, 256]
    - [40, 156.91]
  - - [2048, 8192, 1, 512, 2048, 2048, 2048, 512]
    - [37, 211.53]
  - - [2048, 8192, 1, 1024, 2048, 2048, 2048, 1024]
    - [40, 261.07]
  - - [2048, 8192, 1, 2048, 2048, 2048, 2048, 2048]
    - [40, 320.7]
  - - [2048, 8192, 1, 4096, 2048, 2048, 2048, 4096]
    - [40, 347.21]
  - - [2048, 8192, 1, 8192, 2048, 2048, 2048, 8192]
    - [40, 386.99]
  - - [4096, 128, 1, 128, 4096, 4096, 4096, 128]
    - [24, 14.22]
  - - [4096, 128, 1, 256, 4096, 4096, 4096, 256]
    - [26, 24.96]
  - - [4096, 128, 1, 512, 4096, 4096, 4096, 512]
    - [61, 42.19]
  - - [4096, 128, 1, 1024, 4096, 4096, 4096, 1024]
    - [61, 62.48]
  - - [4096, 128, 1, 2048, 4096, 4096, 4096, 2048]
    - [66, 77.13]
  - - [4096, 128, 1, 4096, 4096, 4096, 4096, 4096]
    - [63, 93.38]
  - - [4096, 128, 1, 8192, 4096, 4096, 4096, 8192]
    - [66, 104.15]
  - - [4096, 256, 1, 128, 4096, 4096, 4096, 128]
    - [23, 25.72]
  - - [4096, 256, 1, 256, 4096, 4096, 4096, 256]
    - [19, 43.13]
  - - [4096, 256, 1, 512, 4096, 4096, 4096, 512]
    - [19, 72.04]
  - - [4096, 256, 1, 1024, 4096, 4096, 4096, 1024]
    - [18, 103.75]
  - - [4096, 256, 1, 2048, 4096, 4096, 4096, 2048]
    - [58, 120.34]
  - - [4096, 256, 1, 4096, 4096, 4096, 4096, 4096]
    - [57, 140.45]
  - - [4096, 256, 1, 8192, 4096, 4096, 4096, 8192]
    - [56, 148.41]
  - - [4096, 512, 1, 128, 4096, 4096, 4096, 128]
    - [48, 42.02]
  - - [4096, 512, 1, 256, 4096, 4096, 4096, 256]
    - [49, 71.45]
  - - [4096, 512, 1, 512, 4096, 4096, 4096, 512]
    - [49, 111.23]
  - - [4096, 512, 1, 1024, 4096, 4096, 4096, 1024]
    - [51, 150.86]
  - - [4096, 512, 1, 2048, 4096, 4096, 4096, 2048]
    - [52, 180.68]
  - - [4096, 512, 1, 4096, 4096, 4096, 4096, 4096]
    - [52, 206.14]
  - - [4096, 512, 1, 8192, 4096, 4096, 4096, 8192]
    - [51, 201.01]
  - - [4096, 1024, 1, 128, 4096, 4096, 4096, 128]
    - [13, 59.01]
  - - [4096, 1024, 1, 256, 4096, 4096, 4096, 256]
    - [12, 98.28]
  - - [4096, 1024, 1, 512, 4096, 4096, 4096, 512]
    - [13, 153.7]
  - - [4096, 1024, 1, 1024, 4096, 4096, 4096, 1024]
    - [14, 202.61]
  - - [4096, 1024, 1, 2048, 4096, 4096, 4096, 2048]
    - [15, 239.8]
  - - [4096, 1024, 1, 4096, 4096, 4096, 4096, 4096]
    - [34, 258.15]
  - - [4096, 1024, 1, 8192, 4096, 4096, 4096, 8192]
    - [34, 243.32]
  - - [4096, 2048, 1, 128, 4096, 4096, 4096, 128]
    - [4, 72.79]
  - - [4096, 2048, 1, 256, 4096, 4096, 4096, 256]
    - [0, 121.54]
  - - [4096, 2048, 1, 512, 4096, 4096, 4096, 512]
    - [4, 182.05]
  - - [4096, 2048, 1, 1024, 4096, 4096, 4096, 1024]
    - [2, 236.98]
  - - [4096, 2048, 1, 2048, 4096, 4096, 4096, 2048]
    - [6, 271.27]
  - - [4096, 2048, 1, 4096, 4096, 4096, 4096, 4096]
    - [36, 263.67]
  - - [4096, 2048, 1, 8192, 4096, 4096, 4096, 8192]
    - [32, 296.88]
  - - [4096, 4096, 1, 128, 4096, 4096, 4096, 128]
    - [4, 78.27]
  - - [4096, 4096, 1, 256, 4096, 4096, 4096, 256]
    - [4, 129.51]
  - - [4096, 4096, 1, 512, 4096, 4096, 4096, 512]
    - [3, 190.52]
  - - [4096, 4096, 1, 1024, 4096, 4096, 4096, 1024]
    - [5, 232.68]
  - - [4096, 4096, 1, 2048, 4096, 4096, 4096, 2048]
    - [39, 264.25]
  - - [4096, 4096, 1, 4096, 4096, 4096, 4096, 4096]
    - [39, 296.28]
  - - [4096, 4096, 1, 8192, 4096, 4096, 4096, 8192]
    - [3, 323.37]
  - - [4096, 8192, 1, 128, 4096, 4096, 4096, 128]
    - [36, 104.26]
  - - [4096, 8192, 1, 256, 4096, 4096, 4096, 256]
    - [36, 164.67]
  - - [4096, 8192, 1, 512, 4096, 4096, 4096, 512]
    - [39, 228.61]
  - - [4096, 8192, 1, 1024, 4096, 4096, 4096, 1024]
    - [40, 272.14]
  - - [4096, 8192, 1, 2048, 4096, 4096, 4096, 2048]
    - [39, 315.53]
  - - [4096, 8192, 1, 4096, 4096, 4096, 4096, 4096]
    - [39, 363.1]
  - - [4096, 8192, 1, 8192, 4096, 4096, 4096, 8192]
    - [40, 402.18]
  - - [8192, 128, 1, 128, 8192, 8192, 8192, 128]
    - [22, 26.72]
  - - [8192, 128, 1, 256, 8192, 8192, 8192, 256]
    - [22, 43.99]
  - - [8192, 128, 1, 512, 8192, 8192, 8192, 512]
    - [19, 70.33]
  - - [8192, 128, 1, 1024, 8192, 8192, 8192, 1024]
    - [18, 102.28]
  - - [8192, 128, 1, 2048, 8192, 8192, 8192, 2048]
    - [57, 118.7]
  - - [8192, 128, 1, 4096, 8192, 8192, 8192, 4096]
    - [56, 138.92]
  - - [8192, 128, 1, 8192, 8192, 8192, 8192, 8192]
    - [57, 142.33]
  - - [8192, 256, 1, 128, 8192, 8192, 8192, 128]
    - [16, 40.77]
  - - [8192, 256, 1, 256, 8192, 8192, 8192, 256]
    - [16, 71.76]
  - - [8192, 256, 1, 512, 8192, 8192, 8192, 512]
    - [49, 113.46]
  - - [8192, 256, 1, 1024, 8192, 8192, 8192, 1024]
    - [50, 158.63]
  - - [8192, 256, 1, 2048, 8192, 8192, 8192, 2048]
    - [51, 181.94]
  - - [8192, 256, 1, 4096, 8192, 8192, 8192, 4096]
    - [50, 203.83]
  - - [8192, 256, 1, 8192, 8192, 8192, 8192, 8192]
    - [51, 193.65]
  - - [8192, 512, 1, 128, 8192, 8192, 8192, 128]
    - [13, 58.4]
  - - [8192, 512, 1, 256, 8192, 8192, 8192, 256]
    - [13, 100.04]
  - - [8192, 512, 1, 512, 8192, 8192, 8192, 512]
    - [11, 152.37]
  - - [8192, 512, 1, 1024, 8192, 8192, 8192, 1024]
    - [11, 205.72]
  - - [8192, 512, 1, 2048, 8192, 8192, 8192, 2048]
    - [42, 236.81]
  - - [8192, 512, 1, 4096, 8192, 8192, 8192, 4096]
    - [33, 257.77]
  - - [8192, 512, 1, 8192, 8192, 8192, 8192, 8192]
    - [33, 243.95]
  - - [8192, 1024, 1, 128, 8192, 8192, 8192, 128]
    - [4, 71.83]
  - - [8192, 1024, 1, 256, 8192, 8192, 8192, 256]
    - [7, 120.45]
  - - [8192, 1024, 1, 512, 8192, 8192, 8192, 512]
    - [4, 181.17]
  - - [8192, 1024, 1, 1024, 8192, 8192, 8192, 1024]
    - [3, 237.17]
  - - [8192, 1024, 1, 2048, 8192, 8192, 8192, 2048]
    - [4, 271.6]
  - - [8192, 1024, 1, 4096, 8192, 8192, 8192, 4096]
    - [31, 263.52]
  - - [8192, 1024, 1, 8192, 8192, 8192, 8192, 8192]
    - [32, 300.9]
  - - [8192, 2048, 1, 128, 8192, 8192, 8192, 128]
    - [36, 78.02]
  - - [8192, 2048, 1, 256, 8192, 8192, 8192, 256]
    - [4, 127.29]
  - - [8192, 2048, 1, 512, 8192, 8192, 8192, 512]
    - [39, 187.72]
  - - [8192, 2048, 1, 1024, 8192, 8192, 8192, 1024]
    - [38, 231.67]
  - - [8192, 2048, 1, 2048, 8192, 8192, 8192, 2048]
    - [40, 250.97]
  - - [8192, 2048, 1, 4096, 8192, 8192, 8192, 4096]
    - [3, 286.75]
  - - [8192, 2048, 1, 8192, 8192, 8192, 8192, 8192]
    - [1, 340.39]
  - - [8192, 4096, 1, 128, 8192, 8192, 8192, 128]
    - [4, 82.0]
  - - [8192, 4096, 1, 256, 8192, 8192, 8192, 256]
    - [17, 133.15]
  - - [8192, 4096, 1, 512, 8192, 8192, 8192, 512]
    - [10, 188.76]
  - - [8192, 4096, 1, 1024, 8192, 8192, 8192, 1024]
    - [35, 239.24]
  - - [8192, 4096, 1, 2048, 8192, 8192, 8192, 2048]
    - [39, 296.0]
  - - [8192, 4096, 1, 4096, 8192, 8192, 8192, 4096]
    - [39, 327.03]
  - - [8192, 4096, 1, 8192, 8192, 8192, 8192, 8192]
    - [1, 362.91]
  - - [8192, 8192, 1, 128, 8192, 8192, 8192, 128]
    - [36, 102.87]
  - - [8192, 8192, 1, 256, 8192, 8192, 8192, 256]
    - [40, 154.41]
  - - [8192, 8192, 1, 512, 8192, 8192, 8192, 512]
    - [38, 215.24]
  - - [8192, 8192, 1, 1024, 8192, 8192, 8192, 1024]
    - [40, 282.25]
  - - [8192, 8192, 1, 2048, 8192, 8192, 8192, 2048]
    - [39, 342.7]
  - - [8192, 8192, 1, 4096, 8192, 8192, 8192, 4096]
    - [39, 384.46]
  - - [8192, 8192, 1, 8192, 8192, 8192, 8192, 8192]
    - [39, 410.8]
- null
- null
- ExperimentalStreamK
- GridBased
