projects/hipblaslt/library/src/amd_detail/rocblaslt/src/Tensile/Logic/asm_full/aquavanjaram/gfx942_228cu/StreamK/aquavanjaram942_Cijk_Alik_Bjlk_B8F8NHS_BH_Bias_HAS_SAV_UserArgs.yaml
- {MinimumRequiredVersion: 4.33.0}
- aquavanjaram942
- {Architecture: gfx942, CUCount: 228}
- [Device 0049, Device 0050]
    SolutionIndex: 0
    SolutionNameMin: Cijk_Alik_Bjlk_B8F8NHS_BH_Bias_HAS_SAV_UserArgs_MT256x256x64_MI16x16x1_SN_LDSB1_CLR1_GRVWA8_GRVWB8_GSU0_GSUC0_GSUWGMRR0_K1_LBSPPA512_LBSPPB2048_LPA8_LPB0_LRVW8_MIWT8_8_PLR1_SU0_SUM0_SUS64_VWA8_VWB8_WGM1_WGMXCC1_WGMXCCGn1
    SolutionIndex: 1
    SolutionNameMin: Cijk_Alik_Bjlk_B8F8NHS_BH_Bias_HAS_SAV_UserArgs_MT256x256x64_MI16x16x1_SN_LDSB1_CLR1_GRVWA8_GRVWB16_GSU0_GSUC0_GSUWGMRR0_K1_LBSPPA512_LBSPPB2048_LPA8_LPB0_LRVW8_MIWT8_8_PLR1_SU0_SUM0_SUS64_VWA8_VWB8_WGM1_WGMXCC1_WGMXCCGn1
    SolutionIndex: 2
    SolutionNameMin: Cijk_Alik_Bjlk_B8F8NHS_BH_Bias_HAS_SAV_UserArgs_MT256x256x64_MI16x16x1_SN_LDSB1_CLR1_GRVWA16_GRVWB16_GSU0_GSUC0_GSUWGMRR0_K1_LBSPPA512_LBSPPB2048_LPA16_LPB0_LRVW8_MIWT8_8_PLR1_SU0_SUM0_SUS64_VWA8_VWB8_WGM1_WGMXCC1_WGMXCCGn1
    SolutionIndex: 3
    SolutionNameMin: Cijk_Alik_Bjlk_B8F8NHS_BH_Bias_HAS_SAV_UserArgs_MT256x256x64_MI16x16x1_SN_LDSB1_CLR1_GRVWA16_GRVWB8_GSU0_GSUC0_GSUWGMRR0_K1_LBSPPA512_LBSPPB2048_LPA16_LPB0_LRVW8_MIWT8_8_PLR1_SU0_SUM0_SUS64_VWA8_VWB8_WGM4_WGMXCC1_WGMXCCGn1
    SolutionIndex: 4
    SolutionNameMin: Cijk_Alik_Bjlk_B8F8NHS_BH_Bias_HAS_SAV_UserArgs_MT256x256x64_MI16x16x1_SN_LDSB1_CLR1_GRVWA8_GRVWB16_GSU0_GSUC0_GSUWGMRR0_K1_LBSPPA512_LBSPPB2048_LPA8_LPB0_LRVW8_MIWT8_8_PLR1_SU0_SUM0_SUS64_VWA8_VWB8_WGM4_WGMXCC1_WGMXCCGn1
    SolutionIndex: 5
    SolutionNameMin: Cijk_Alik_Bjlk_B8F8NHS_BH_Bias_HAS_SAV_UserArgs_MT256x256x64_MI16x16x1_SN_LDSB1_CLR1_GRVWA16_GRVWB16_GSU0_GSUC0_GSUWGMRR0_K1_LBSPPA512_LBSPPB2048_LPA16_LPB0_LRVW8_MIWT8_8_PLR1_SU0_SUM0_SUS64_VWA8_VWB8_WGM4_WGMXCC1_WGMXCCGn1
    SolutionIndex: 6
    SolutionNameMin: Cijk_Alik_Bjlk_B8F8NHS_BH_Bias_HAS_SAV_UserArgs_MT256x256x64_MI16x16x1_SN_LDSB1_CLR1_GRVWA8_GRVWB16_GSU0_GSUC0_GSUWGMRR0_K1_LBSPPA512_LBSPPB2048_LPA8_LPB0_LRVW8_MIWT8_8_PLR1_SU0_SUM0_SUS64_VWA8_VWB8_WGM6_WGMXCC1_WGMXCCGn1
    SolutionIndex: 7
    SolutionNameMin: Cijk_Alik_Bjlk_B8F8NHS_BH_Bias_HAS_SAV_UserArgs_MT256x256x64_MI16x16x1_SN_LDSB1_CLR1_GRVWA16_GRVWB16_GSU0_GSUC0_GSUWGMRR0_K1_LBSPPA512_LBSPPB2048_LPA16_LPB0_LRVW8_MIWT8_8_PLR1_SU0_SUM0_SUS64_VWA8_VWB8_WGM6_WGMXCC1_WGMXCCGn1
    SolutionIndex: 8
    SolutionNameMin: Cijk_Alik_Bjlk_B8F8NHS_BH_Bias_HAS_SAV_UserArgs_MT256x256x64_MI16x16x1_SN_LDSB1_CLR1_GRVWA8_GRVWB16_GSU0_GSUC0_GSUWGMRR0_K1_LBSPPA512_LBSPPB2048_LPA8_LPB0_LRVW8_MIWT8_8_PLR1_SU0_SUM0_SUS64_VWA8_VWB8_WGM8_WGMXCC1_WGMXCCGn1
    SolutionIndex: 9
    SolutionNameMin: Cijk_Alik_Bjlk_B8F8NHS_BH_Bias_HAS_SAV_UserArgs_MT256x256x64_MI16x16x1_SN_LDSB1_CLR1_GRVWA16_GRVWB16_GSU0_GSUC0_GSUWGMRR0_K1_LBSPPA512_LBSPPB2048_LPA16_LPB0_LRVW8_MIWT8_8_PLR1_SU0_SUM0_SUS64_VWA8_VWB8_WGM8_WGMXCC1_WGMXCCGn1
    SolutionIndex: 10
    SolutionNameMin: Cijk_Alik_Bjlk_B8F8NHS_BH_Bias_HAS_SAV_UserArgs_MT128x256x64_MI16x16x1_SN_LDSB1_CLR1_GRVWA8_GRVWB16_GSU0_GSUC0_GSUWGMRR0_K1_LBSPPA256_LBSPPB2048_LPA8_LPB0_LRVW8_MIWT4_8_PLR1_SU0_SUM0_SUS64_VWA4_VWB8_WGM1_WGMXCC1_WGMXCCGn1
    SolutionIndex: 11
    SolutionNameMin: Cijk_Alik_Bjlk_B8F8NHS_BH_Bias_HAS_SAV_UserArgs_MT128x256x64_MI16x16x1_SN_LDSB1_CLR1_GRVWA8_GRVWB16_GSU0_GSUC0_GSUWGMRR0_K1_LBSPPA256_LBSPPB2048_LPA8_LPB0_LRVW8_MIWT4_8_PLR1_SU0_SUM0_SUS64_VWA4_VWB8_WGM4_WGMXCC1_WGMXCCGn1
    SolutionIndex: 12
    SolutionNameMin: Cijk_Alik_Bjlk_B8F8NHS_BH_Bias_HAS_SAV_UserArgs_MT128x256x64_MI16x16x1_SN_LDSB1_CLR1_GRVWA16_GRVWB16_GSU0_GSUC0_GSUWGMRR0_K1_LBSPPA256_LBSPPB2048_LPA16_LPB0_LRVW8_MIWT4_8_PLR1_SU0_SUM0_SUS64_VWA4_VWB8_WGM6_WGMXCC1_WGMXCCGn1
    SolutionIndex: 13
    SolutionNameMin: Cijk_Alik_Bjlk_B8F8NHS_BH_Bias_HAS_SAV_UserArgs_MT128x256x64_MI16x16x1_SN_LDSB1_CLR1_GRVWA8_GRVWB16_GSU0_GSUC0_GSUWGMRR0_K1_LBSPPA256_LBSPPB2048_LPA8_LPB0_LRVW8_MIWT4_8_PLR1_SU0_SUM0_SUS64_VWA4_VWB8_WGM8_WGMXCC1_WGMXCCGn1
    SolutionIndex: 14
    SolutionNameMin: Cijk_Alik_Bjlk_B8F8NHS_BH_Bias_HAS_SAV_UserArgs_MT256x128x64_MI16x16x1_SN_LDSB1_CLR1_GRVWA8_GRVWB8_GSU0_GSUC0_GSUWGMRR0_K1_LBSPPA512_LBSPPB1024_LPA8_LPB64_LRVW8_MIWT8_4_PLR1_SU0_SUM0_SUS64_VWA8_VWB4_WGM1_WGMXCC1_WGMXCCGn1
    SolutionIndex: 15
    SolutionNameMin: Cijk_Alik_Bjlk_B8F8NHS_BH_Bias_HAS_SAV_UserArgs_MT256x128x64_MI16x16x1_SN_LDSB1_CLR1_GRVWA16_GRVWB8_GSU0_GSUC0_GSUWGMRR0_K1_LBSPPA512_LBSPPB1024_LPA16_LPB64_LRVW8_MIWT8_4_PLR1_SU0_SUM0_SUS64_VWA8_VWB4_WGM1_WGMXCC1_WGMXCCGn1
    SolutionIndex: 16
    SolutionNameMin: Cijk_Alik_Bjlk_B8F8NHS_BH_Bias_HAS_SAV_UserArgs_MT256x128x64_MI16x16x1_SN_LDSB1_CLR1_GRVWA8_GRVWB16_GSU0_GSUC0_GSUWGMRR0_K1_LBSPPA512_LBSPPB1024_LPA8_LPB64_LRVW8_MIWT8_4_PLR1_SU0_SUM0_SUS64_VWA8_VWB4_WGM1_WGMXCC1_WGMXCCGn1
    SolutionIndex: 17
    SolutionNameMin: Cijk_Alik_Bjlk_B8F8NHS_BH_Bias_HAS_SAV_UserArgs_MT256x128x64_MI16x16x1_SN_LDSB1_CLR1_GRVWA16_GRVWB16_GSU0_GSUC0_GSUWGMRR0_K1_LBSPPA512_LBSPPB1024_LPA16_LPB64_LRVW8_MIWT8_4_PLR1_SU0_SUM0_SUS64_VWA8_VWB4_WGM1_WGMXCC1_WGMXCCGn1
    SolutionIndex: 18
    SolutionNameMin: Cijk_Alik_Bjlk_B8F8NHS_BH_Bias_HAS_SAV_UserArgs_MT256x128x64_MI16x16x1_SN_LDSB1_CLR1_GRVWA16_GRVWB16_GSU0_GSUC0_GSUWGMRR0_K1_LBSPPA512_LBSPPB1024_LPA16_LPB64_LRVW8_MIWT8_4_PLR1_SU0_SUM0_SUS64_VWA8_VWB4_WGM6_WGMXCC1_WGMXCCGn1
    SolutionIndex: 19
    SolutionNameMin: Cijk_Alik_Bjlk_B8F8NHS_BH_Bias_HAS_SAV_UserArgs_MT256x128x64_MI16x16x1_SN_LDSB1_CLR1_GRVWA8_GRVWB8_GSU0_GSUC0_GSUWGMRR0_K1_LBSPPA512_LBSPPB1024_LPA8_LPB64_LRVW8_MIWT8_4_PLR1_SU0_SUM0_SUS64_VWA8_VWB4_WGM8_WGMXCC1_WGMXCCGn1
    SolutionIndex: 20
    SolutionNameMin: Cijk_Alik_Bjlk_B8F8NHS_BH_Bias_HAS_SAV_UserArgs_MT256x128x64_MI16x16x1_SN_LDSB1_CLR1_GRVWA8_GRVWB16_GSU0_GSUC0_GSUWGMRR0_K1_LBSPPA512_LBSPPB1024_LPA8_LPB64_LRVW8_MIWT8_4_PLR1_SU0_SUM0_SUS64_VWA8_VWB4_WGM8_WGMXCC1_WGMXCCGn1
    SolutionIndex: 21
    SolutionNameMin: Cijk_Alik_Bjlk_B8F8NHS_BH_Bias_HAS_SAV_UserArgs_MT128x128x64_MI16x16x1_SN_LDSB1_CLR1_GRVWA16_GRVWB16_GSU0_GSUC0_GSUWGMRR0_K1_LBSPPA128_LBSPPB1024_LPA16_LPB0_LRVW8_MIWT2_8_PLR1_SU0_SUM0_SUS64_VWA2_VWB8_WGM1_WGMXCC1_WGMXCCGn1
    SolutionIndex: 22
    SolutionNameMin: Cijk_Alik_Bjlk_B8F8NHS_BH_Bias_HAS_SAV_UserArgs_MT128x128x64_MI16x16x1_SN_LDSB1_CLR1_GRVWA8_GRVWB8_GSU0_GSUC0_GSUWGMRR0_K1_LBSPPA512_LBSPPB1024_LPA8_LPB32_LRVW8_MIWT8_2_PLR1_SU0_SUM0_SUS64_VWA8_VWB2_WGM1_WGMXCC1_WGMXCCGn1
    SolutionIndex: 23
    SolutionNameMin: Cijk_Alik_Bjlk_B8F8NHS_BH_Bias_HAS_SAV_UserArgs_MT128x128x64_MI16x16x1_SN_LDSB1_CLR1_GRVWA16_GRVWB8_GSU0_GSUC0_GSUWGMRR0_K1_LBSPPA512_LBSPPB1024_LPA16_LPB32_LRVW8_MIWT8_2_PLR1_SU0_SUM0_SUS64_VWA8_VWB2_WGM1_WGMXCC1_WGMXCCGn1
    SolutionIndex: 24
    SolutionNameMin: Cijk_Alik_Bjlk_B8F8NHS_BH_Bias_HAS_SAV_UserArgs_MT128x128x64_MI16x16x1_SN_LDSB1_CLR1_GRVWA8_GRVWB16_GSU0_GSUC0_GSUWGMRR0_K1_LBSPPA512_LBSPPB1024_LPA8_LPB32_LRVW8_MIWT8_2_PLR1_SU0_SUM0_SUS64_VWA8_VWB2_WGM1_WGMXCC1_WGMXCCGn1
    SolutionIndex: 25
    SolutionNameMin: Cijk_Alik_Bjlk_B8F8NHS_BH_Bias_HAS_SAV_UserArgs_MT128x128x64_MI16x16x1_SN_LDSB1_CLR1_GRVWA8_GRVWB8_GSU0_GSUC0_GSUWGMRR0_K1_LBSPPA512_LBSPPB1024_LPA8_LPB32_LRVW8_MIWT8_2_PLR1_SU0_SUM0_SUS64_VWA8_VWB2_WGM6_WGMXCC1_WGMXCCGn1
    SolutionIndex: 26
    SolutionNameMin: Cijk_Alik_Bjlk_B8F8NHS_BH_Bias_HAS_SAV_UserArgs_MT128x128x64_MI16x16x1_SN_LDSB1_CLR1_GRVWA8_GRVWB8_GSU0_GSUC0_GSUWGMRR0_K1_LBSPPA512_LBSPPB1024_LPA8_LPB32_LRVW8_MIWT8_2_PLR1_SU0_SUM0_SUS64_VWA8_VWB2_WGM8_WGMXCC1_WGMXCCGn1
    SolutionIndex: 27
    SolutionNameMin: Cijk_Alik_Bjlk_B8F8NHS_BH_Bias_HAS_SAV_UserArgs_MT128x128x64_MI16x16x1_SN_LDSB1_CLR1_GRVWA8_GRVWB16_GSU0_GSUC0_GSUWGMRR0_K1_LBSPPA512_LBSPPB1024_LPA8_LPB32_LRVW8_MIWT8_2_PLR1_SU0_SUM0_SUS64_VWA8_VWB2_WGM8_WGMXCC1_WGMXCCGn1
    SolutionIndex: 28
    SolutionNameMin: Cijk_Alik_Bjlk_B8F8NHS_BH_Bias_HAS_SAV_UserArgs_MT32x256x64_MI16x16x1_SN_LDSB1_CLR1_GRVWA8_GRVWB16_GSU0_GSUC0_GSUWGMRR0_K1_LBSPPA128_LBSPPB2048_LPA8_LPB0_LRVW8_MIWT1_8_PLR1_SU0_SUM0_SUS64_VWA1_VWB8_WGM1_WGMXCC1_WGMXCCGn1
    SolutionIndex: 29
    SolutionNameMin: Cijk_Alik_Bjlk_B8F8NHS_BH_Bias_HAS_SAV_UserArgs_MT64x128x64_MI16x16x1_SN_LDSB0_CLR1_GRVWA8_GRVWB16_GSU0_GSUC0_GSUWGMRR0_K1_LBSPPA128_LBSPPB1024_LPA8_LPB0_LRVW8_MIWT1_8_PLR1_SU0_SUM0_SUS64_VWA1_VWB8_WGM1_WGMXCC1_WGMXCCGn1
    SolutionIndex: 30
    SolutionNameMin: Cijk_Alik_Bjlk_B8F8NHS_BH_Bias_HAS_SAV_UserArgs_MT64x128x64_MI16x16x1_SN_LDSB0_CLR1_GRVWA8_GRVWB8_GSU0_GSUC0_GSUWGMRR0_K1_LBSPPA128_LBSPPB1024_LPA8_LPB0_LRVW8_MIWT1_8_PLR1_SU0_SUM0_SUS64_VWA1_VWB8_WGM6_WGMXCC1_WGMXCCGn1
    SolutionIndex: 31
    SolutionNameMin: Cijk_Alik_Bjlk_B8F8NHS_BH_Bias_HAS_SAV_UserArgs_MT256x32x64_MI16x16x1_SN_LDSB1_CLR1_GRVWA16_GRVWB8_GSU0_GSUC0_GSUWGMRR0_K1_LBSPPA512_LBSPPB256_LPA16_LPB16_LRVW8_MIWT8_1_PLR1_SU0_SUM0_SUS64_VWA8_VWB1_WGM4_WGMXCC1_WGMXCCGn1
    SolutionIndex: 32
    SolutionNameMin: Cijk_Alik_Bjlk_B8F8NHS_BH_Bias_HAS_SAV_UserArgs_MT128x64x64_MI16x16x1_SN_LDSB0_CLR1_GRVWA8_GRVWB8_GSU0_GSUC0_GSUWGMRR0_K1_LBSPPA512_LBSPPB512_LPA8_LPB16_LRVW8_MIWT8_1_PLR1_SU0_SUM0_SUS64_VWA8_VWB1_WGM1_WGMXCC1_WGMXCCGn1
    SolutionIndex: 33
    SolutionNameMin: Cijk_Alik_Bjlk_B8F8NHS_BH_Bias_HAS_SAV_UserArgs_MT128x64x64_MI16x16x1_SN_LDSB0_CLR1_GRVWA16_GRVWB8_GSU0_GSUC0_GSUWGMRR0_K1_LBSPPA512_LBSPPB512_LPA16_LPB16_LRVW8_MIWT8_1_PLR1_SU0_SUM0_SUS64_VWA8_VWB1_WGM1_WGMXCC1_WGMXCCGn1
    SolutionIndex: 34
    SolutionNameMin: Cijk_Alik_Bjlk_B8F8NHS_BH_Bias_HAS_SAV_UserArgs_MT128x64x64_MI16x16x1_SN_LDSB0_CLR1_GRVWA8_GRVWB8_GSU0_GSUC0_GSUWGMRR0_K1_LBSPPA512_LBSPPB512_LPA8_LPB16_LRVW8_MIWT8_1_PLR1_SU0_SUM0_SUS64_VWA8_VWB1_WGM4_WGMXCC1_WGMXCCGn1
    SolutionIndex: 35
    SolutionNameMin: Cijk_Alik_Bjlk_B8F8NHS_BH_Bias_HAS_SAV_UserArgs_MT128x64x64_MI16x16x1_SN_LDSB0_CLR1_GRVWA16_GRVWB8_GSU0_GSUC0_GSUWGMRR0_K1_LBSPPA512_LBSPPB512_LPA16_LPB16_LRVW8_MIWT8_1_PLR1_SU0_SUM0_SUS64_VWA8_VWB1_WGM4_WGMXCC1_WGMXCCGn1
    SolutionIndex: 36
    SolutionNameMin: Cijk_Alik_Bjlk_B8F8NHS_BH_Bias_HAS_SAV_UserArgs_MT128x64x64_MI16x16x1_SN_LDSB0_CLR1_GRVWA16_GRVWB16_GSU0_GSUC0_GSUWGMRR0_K1_LBSPPA512_LBSPPB512_LPA16_LPB16_LRVW8_MIWT8_1_PLR1_SU0_SUM0_SUS64_VWA8_VWB1_WGM6_WGMXCC1_WGMXCCGn1
    SolutionIndex: 37
    SolutionNameMin: Cijk_Alik_Bjlk_B8F8NHS_BH_Bias_HAS_SAV_UserArgs_MT128x64x64_MI16x16x1_SN_LDSB0_CLR1_GRVWA8_GRVWB8_GSU0_GSUC0_GSUWGMRR0_K1_LBSPPA512_LBSPPB512_LPA8_LPB16_LRVW8_MIWT8_1_PLR1_SU0_SUM0_SUS64_VWA8_VWB1_WGM8_WGMXCC1_WGMXCCGn1
    SolutionIndex: 38
    SolutionNameMin: Cijk_Alik_Bjlk_B8F8NHS_BH_Bias_HAS_SAV_UserArgs_MT128x128x64_MI16x16x1_SN_LDSB1_CLR1_GRVWA8_GRVWB8_GSU0_GSUC0_GSUWGMRR0_K1_LBSPPA256_LBSPPB1024_LPA8_LPB64_LRVW8_MIWT4_4_PLR1_SU0_SUM0_SUS64_VWA4_VWB4_WGM1_WGMXCC1_WGMXCCGn1
    SolutionIndex: 39
    SolutionNameMin: Cijk_Alik_Bjlk_B8F8NHS_BH_Bias_HAS_SAV_UserArgs_MT128x128x64_MI16x16x1_SN_LDSB1_CLR1_GRVWA16_GRVWB8_GSU0_GSUC0_GSUWGMRR0_K1_LBSPPA256_LBSPPB1024_LPA16_LPB64_LRVW8_MIWT4_4_PLR1_SU0_SUM0_SUS64_VWA4_VWB4_WGM1_WGMXCC1_WGMXCCGn1
    SolutionIndex: 40
    SolutionNameMin: Cijk_Alik_Bjlk_B8F8NHS_BH_Bias_HAS_SAV_UserArgs_MT64x128x64_MI16x16x1_SN_LDSB0_CLR1_GRVWA16_GRVWB8_GSU0_GSUC0_GSUWGMRR0_K1_LBSPPA128_LBSPPB1024_LPA16_LPB64_LRVW8_MIWT2_4_PLR1_SU0_SUM0_SUS64_VWA2_VWB4_WGM1_WGMXCC1_WGMXCCGn1
    SolutionIndex: 41
    SolutionNameMin: Cijk_Alik_Bjlk_B8F8NHS_BH_Bias_HAS_SAV_UserArgs_MT64x128x64_MI16x16x1_SN_LDSB0_CLR1_GRVWA16_GRVWB16_GSU0_GSUC0_GSUWGMRR0_K1_LBSPPA128_LBSPPB1024_LPA16_LPB64_LRVW8_MIWT2_4_PLR1_SU0_SUM0_SUS64_VWA2_VWB4_WGM1_WGMXCC1_WGMXCCGn1
    SolutionIndex: 42
    SolutionNameMin: Cijk_Alik_Bjlk_B8F8NHS_BH_Bias_HAS_SAV_UserArgs_MT64x128x64_MI16x16x1_SN_LDSB0_CLR1_GRVWA16_GRVWB8_GSU0_GSUC0_GSUWGMRR0_K1_LBSPPA128_LBSPPB1024_LPA16_LPB64_LRVW8_MIWT2_4_PLR1_SU0_SUM0_SUS64_VWA2_VWB4_WGM4_WGMXCC1_WGMXCCGn1
    SolutionIndex: 43
    SolutionNameMin: Cijk_Alik_Bjlk_B8F8NHS_BH_Bias_HAS_SAV_UserArgs_MT64x128x64_MI16x16x1_SN_LDSB0_CLR1_GRVWA16_GRVWB8_GSU0_GSUC0_GSUWGMRR0_K1_LBSPPA128_LBSPPB1024_LPA16_LPB64_LRVW8_MIWT2_4_PLR1_SU0_SUM0_SUS64_VWA2_VWB4_WGM8_WGMXCC1_WGMXCCGn1
    SolutionIndex: 44
    SolutionNameMin: Cijk_Alik_Bjlk_B8F8NHS_BH_Bias_HAS_SAV_UserArgs_MT128x64x64_MI16x16x1_SN_LDSB0_CLR1_GRVWA8_GRVWB8_GSU0_GSUC0_GSUWGMRR0_K1_LBSPPA256_LBSPPB512_LPA8_LPB32_LRVW8_MIWT4_2_PLR1_SU0_SUM0_SUS64_VWA4_VWB2_WGM1_WGMXCC1_WGMXCCGn1
    SolutionIndex: 45
    SolutionNameMin: Cijk_Alik_Bjlk_B8F8NHS_BH_Bias_HAS_SAV_UserArgs_MT128x64x64_MI16x16x1_SN_LDSB0_CLR1_GRVWA16_GRVWB8_GSU0_GSUC0_GSUWGMRR0_K1_LBSPPA256_LBSPPB512_LPA16_LPB32_LRVW8_MIWT4_2_PLR1_SU0_SUM0_SUS64_VWA4_VWB2_WGM1_WGMXCC1_WGMXCCGn1
    SolutionIndex: 46
    SolutionNameMin: Cijk_Alik_Bjlk_B8F8NHS_BH_Bias_HAS_SAV_UserArgs_MT128x64x64_MI16x16x1_SN_LDSB0_CLR1_GRVWA8_GRVWB16_GSU0_GSUC0_GSUWGMRR0_K1_LBSPPA256_LBSPPB512_LPA8_LPB32_LRVW8_MIWT4_2_PLR1_SU0_SUM0_SUS64_VWA4_VWB2_WGM1_WGMXCC1_WGMXCCGn1
    SolutionIndex: 47
    SolutionNameMin: Cijk_Alik_Bjlk_B8F8NHS_BH_Bias_HAS_SAV_UserArgs_MT128x64x64_MI16x16x1_SN_LDSB0_CLR1_GRVWA16_GRVWB16_GSU0_GSUC0_GSUWGMRR0_K1_LBSPPA256_LBSPPB512_LPA16_LPB32_LRVW8_MIWT4_2_PLR1_SU0_SUM0_SUS64_VWA4_VWB2_WGM1_WGMXCC1_WGMXCCGn1
    SolutionIndex: 48
    SolutionNameMin: Cijk_Alik_Bjlk_B8F8NHS_BH_Bias_HAS_SAV_UserArgs_MT128x64x64_MI16x16x1_SN_LDSB0_CLR1_GRVWA8_GRVWB16_GSU0_GSUC0_GSUWGMRR0_K1_LBSPPA256_LBSPPB512_LPA8_LPB32_LRVW8_MIWT4_2_PLR1_SU0_SUM0_SUS64_VWA4_VWB2_WGM6_WGMXCC1_WGMXCCGn1
    SolutionIndex: 49
    SolutionNameMin: Cijk_Alik_Bjlk_B8F8NHS_BH_Bias_HAS_SAV_UserArgs_MT128x64x64_MI16x16x1_SN_LDSB0_CLR1_GRVWA16_GRVWB16_GSU0_GSUC0_GSUWGMRR0_K1_LBSPPA256_LBSPPB512_LPA16_LPB32_LRVW8_MIWT4_2_PLR1_SU0_SUM0_SUS64_VWA4_VWB2_WGM6_WGMXCC1_WGMXCCGn1
    SolutionIndex: 50
    SolutionNameMin: Cijk_Alik_Bjlk_B8F8NHS_BH_Bias_HAS_SAV_UserArgs_MT128x64x64_MI16x16x1_SN_LDSB0_CLR1_GRVWA8_GRVWB8_GSU0_GSUC0_GSUWGMRR0_K1_LBSPPA256_LBSPPB512_LPA8_LPB32_LRVW8_MIWT4_2_PLR1_SU0_SUM0_SUS64_VWA4_VWB2_WGM8_WGMXCC1_WGMXCCGn1
    SolutionIndex: 51
    SolutionNameMin: Cijk_Alik_Bjlk_B8F8NHS_BH_Bias_HAS_SAV_UserArgs_MT128x64x64_MI16x16x1_SN_LDSB0_CLR1_GRVWA8_GRVWB16_GSU0_GSUC0_GSUWGMRR0_K1_LBSPPA256_LBSPPB512_LPA8_LPB32_LRVW8_MIWT4_2_PLR1_SU0_SUM0_SUS64_VWA4_VWB2_WGM8_WGMXCC1_WGMXCCGn1
    SolutionIndex: 52
    SolutionNameMin: Cijk_Alik_Bjlk_B8F8NHS_BH_Bias_HAS_SAV_UserArgs_MT32x128x64_MI16x16x1_SN_LDSB0_CLR1_GRVWA8_GRVWB8_GSU0_GSUC0_GSUWGMRR0_K1_LBSPPA128_LBSPPB1024_LPA8_LPB64_LRVW8_MIWT1_4_PLR1_SU0_SUM0_SUS64_VWA1_VWB4_WGM1_WGMXCC1_WGMXCCGn1
    SolutionIndex: 53
    SolutionNameMin: Cijk_Alik_Bjlk_B8F8NHS_BH_Bias_HAS_SAV_UserArgs_MT32x128x64_MI16x16x1_SN_LDSB0_CLR1_GRVWA8_GRVWB16_GSU0_GSUC0_GSUWGMRR0_K1_LBSPPA128_LBSPPB1024_LPA8_LPB64_LRVW8_MIWT1_4_PLR1_SU0_SUM0_SUS64_VWA1_VWB4_WGM1_WGMXCC1_WGMXCCGn1
    SolutionIndex: 54
    SolutionNameMin: Cijk_Alik_Bjlk_B8F8NHS_BH_Bias_HAS_SAV_UserArgs_MT128x32x64_MI16x16x1_SN_LDSB0_CLR1_GRVWA16_GRVWB8_GSU0_GSUC0_GSUWGMRR0_K1_LBSPPA256_LBSPPB256_LPA16_LPB16_LRVW8_MIWT4_1_PLR1_SU0_SUM0_SUS64_VWA4_VWB1_WGM4_WGMXCC1_WGMXCCGn1
    SolutionIndex: 55
    SolutionNameMin: Cijk_Alik_Bjlk_B8F8NHS_BH_Bias_HAS_SAV_UserArgs_MT64x64x64_MI16x16x1_SN_LDSB0_CLR1_GRVWA8_GRVWB8_GSU0_GSUC0_GSUWGMRR0_K1_LBSPPA128_LBSPPB512_LPA8_LPB32_LRVW8_MIWT2_2_PLR1_SU0_SUM0_SUS64_VWA2_VWB2_WGM1_WGMXCC1_WGMXCCGn1
    SolutionIndex: 56
    SolutionNameMin: Cijk_Alik_Bjlk_B8F8NHS_BH_Bias_HAS_SAV_UserArgs_MT64x64x64_MI16x16x1_SN_LDSB0_CLR1_GRVWA16_GRVWB8_GSU0_GSUC0_GSUWGMRR0_K1_LBSPPA128_LBSPPB512_LPA16_LPB32_LRVW8_MIWT2_2_PLR1_SU0_SUM0_SUS64_VWA2_VWB2_WGM1_WGMXCC1_WGMXCCGn1
    SolutionIndex: 57
    SolutionNameMin: Cijk_Alik_Bjlk_B8F8NHS_BH_Bias_HAS_SAV_UserArgs_MT64x64x64_MI16x16x1_SN_LDSB0_CLR1_GRVWA8_GRVWB8_GSU0_GSUC0_GSUWGMRR0_K1_LBSPPA128_LBSPPB512_LPA8_LPB32_LRVW8_MIWT2_2_PLR1_SU0_SUM0_SUS64_VWA2_VWB2_WGM4_WGMXCC1_WGMXCCGn1
    SolutionIndex: 58
    SolutionNameMin: Cijk_Alik_Bjlk_B8F8NHS_BH_Bias_HAS_SAV_UserArgs_MT64x64x64_MI16x16x1_SN_LDSB0_CLR1_GRVWA8_GRVWB8_GSU0_GSUC0_GSUWGMRR0_K1_LBSPPA128_LBSPPB512_LPA8_LPB32_LRVW8_MIWT2_2_PLR1_SU0_SUM0_SUS64_VWA2_VWB2_WGM6_WGMXCC1_WGMXCCGn1
    SolutionIndex: 59
    SolutionNameMin: Cijk_Alik_Bjlk_B8F8NHS_BH_Bias_HAS_SAV_UserArgs_MT64x64x64_MI16x16x1_SN_LDSB0_CLR1_GRVWA8_GRVWB16_GSU0_GSUC0_GSUWGMRR0_K1_LBSPPA128_LBSPPB512_LPA8_LPB32_LRVW8_MIWT2_2_PLR1_SU0_SUM0_SUS64_VWA2_VWB2_WGM6_WGMXCC1_WGMXCCGn1
    SolutionIndex: 60
    SolutionNameMin: Cijk_Alik_Bjlk_B8F8NHS_BH_Bias_HAS_SAV_UserArgs_MT64x64x64_MI16x16x1_SN_LDSB0_CLR1_GRVWA8_GRVWB16_GSU0_GSUC0_GSUWGMRR0_K1_LBSPPA128_LBSPPB512_LPA8_LPB32_LRVW8_MIWT2_2_PLR1_SU0_SUM0_SUS64_VWA2_VWB2_WGM8_WGMXCC1_WGMXCCGn1
    SolutionIndex: 61
    SolutionNameMin: Cijk_Alik_Bjlk_B8F8NHS_BH_Bias_HAS_SAV_UserArgs_MT64x32x64_MI16x16x1_SN_LDSB0_CLR1_GRVWA8_GRVWB8_GSU0_GSUC0_GSUWGMRR0_K1_LBSPPA128_LBSPPB256_LPA8_LPB16_LRVW8_MIWT2_1_PLR1_SU0_SUM0_SUS64_VWA2_VWB1_WGM1_WGMXCC1_WGMXCCGn1
    SolutionIndex: 62
    SolutionNameMin: Cijk_Alik_Bjlk_B8F8NHS_BH_Bias_HAS_SAV_UserArgs_MT64x32x64_MI16x16x1_SN_LDSB0_CLR1_GRVWA16_GRVWB8_GSU0_GSUC0_GSUWGMRR0_K1_LBSPPA128_LBSPPB256_LPA16_LPB16_LRVW8_MIWT2_1_PLR1_SU0_SUM0_SUS64_VWA2_VWB1_WGM1_WGMXCC1_WGMXCCGn1
    SolutionIndex: 63
    SolutionNameMin: Cijk_Alik_Bjlk_B8F8NHS_BH_Bias_HAS_SAV_UserArgs_MT64x32x64_MI16x16x1_SN_LDSB0_CLR1_GRVWA16_GRVWB8_GSU0_GSUC0_GSUWGMRR0_K1_LBSPPA128_LBSPPB256_LPA16_LPB16_LRVW8_MIWT2_1_PLR1_SU0_SUM0_SUS64_VWA2_VWB1_WGM6_WGMXCC1_WGMXCCGn1
    SolutionIndex: 64
    SolutionNameMin: Cijk_Alik_Bjlk_B8F8NHS_BH_Bias_HAS_SAV_UserArgs_MT64x32x64_MI16x16x1_SN_LDSB0_CLR1_GRVWA8_GRVWB8_GSU0_GSUC0_GSUWGMRR0_K1_LBSPPA128_LBSPPB256_LPA8_LPB16_LRVW8_MIWT2_1_PLR1_SU0_SUM0_SUS64_VWA2_VWB1_WGM8_WGMXCC1_WGMXCCGn1
    SolutionIndex: 65
    SolutionNameMin: Cijk_Alik_Bjlk_B8F8NHS_BH_Bias_HAS_SAV_UserArgs_MT32x32x64_MI16x16x1_SN_LDSB0_CLR1_GRVWA8_GRVWB8_GSU0_GSUC0_GSUWGMRR0_K1_LBSPPA128_LBSPPB256_LPA8_LPB16_LRVW8_MIWT1_1_PLR1_SU0_SUM0_SUS64_VWA1_VWB1_WGM1_WGMXCC1_WGMXCCGn1
    SolutionIndex: 66
    SolutionNameMin: Cijk_Alik_Bjlk_B8F8NHS_BH_Bias_HAS_SAV_UserArgs_MT32x32x64_MI16x16x1_SN_LDSB0_CLR1_GRVWA8_GRVWB8_GSU0_GSUC0_GSUWGMRR0_K1_LBSPPA128_LBSPPB256_LPA8_LPB16_LRVW8_MIWT1_1_PLR1_SU0_SUM0_SUS64_VWA1_VWB1_WGM4_WGMXCC1_WGMXCCGn1
    SolutionIndex: 67
    SolutionNameMin: Cijk_Alik_Bjlk_B8F8NHS_BH_Bias_HAS_SAV_UserArgs_MT32x32x64_MI16x16x1_SN_LDSB0_CLR1_GRVWA8_GRVWB8_GSU0_GSUC0_GSUWGMRR0_K1_LBSPPA128_LBSPPB256_LPA8_LPB16_LRVW8_MIWT1_1_PLR1_SU0_SUM0_SUS64_VWA1_VWB1_WGM6_WGMXCC1_WGMXCCGn1
    SolutionIndex: 68
    SolutionNameMin: Cijk_Alik_Bjlk_B8F8NHS_BH_Bias_HAS_SAV_UserArgs_MT128x256x128_MI16x16x1_SN_LDSB1_CLR1_GRVWA8_GRVWB16_GSU0_GSUC0_GSUWGMRR0_K1_LBSPPA512_LBSPPB2048_LPA8_LPB0_LRVW8_MIWT4_8_PLR1_SU0_SUM0_SUS128_VWA4_VWB8_WGM1_WGMXCC1_WGMXCCGn1
    SolutionIndex: 69
    SolutionNameMin: Cijk_Alik_Bjlk_B8F8NHS_BH_Bias_HAS_SAV_UserArgs_MT128x256x128_MI16x16x1_SN_LDSB1_CLR1_GRVWA16_GRVWB16_GSU0_GSUC0_GSUWGMRR0_K1_LBSPPA512_LBSPPB2048_LPA16_LPB0_LRVW8_MIWT4_8_PLR1_SU0_SUM0_SUS128_VWA4_VWB8_WGM1_WGMXCC1_WGMXCCGn1
    SolutionIndex: 70
    SolutionNameMin: Cijk_Alik_Bjlk_B8F8NHS_BH_Bias_HAS_SAV_UserArgs_MT128x256x128_MI16x16x1_SN_LDSB1_CLR1_GRVWA8_GRVWB16_GSU0_GSUC0_GSUWGMRR0_K1_LBSPPA512_LBSPPB2048_LPA8_LPB0_LRVW8_MIWT4_8_PLR1_SU0_SUM0_SUS128_VWA4_VWB8_WGM6_WGMXCC1_WGMXCCGn1
    SolutionIndex: 71
    SolutionNameMin: Cijk_Alik_Bjlk_B8F8NHS_BH_Bias_HAS_SAV_UserArgs_MT128x256x128_MI16x16x1_SN_LDSB1_CLR1_GRVWA8_GRVWB16_GSU0_GSUC0_GSUWGMRR0_K1_LBSPPA512_LBSPPB2048_LPA8_LPB0_LRVW8_MIWT4_8_PLR1_SU0_SUM0_SUS128_VWA4_VWB8_WGM8_WGMXCC1_WGMXCCGn1
    SolutionIndex: 72
    SolutionNameMin: Cijk_Alik_Bjlk_B8F8NHS_BH_Bias_HAS_SAV_UserArgs_MT128x256x128_MI16x16x1_SN_LDSB1_CLR1_GRVWA16_GRVWB16_GSU0_GSUC0_GSUWGMRR0_K1_LBSPPA512_LBSPPB2048_LPA16_LPB0_LRVW8_MIWT4_8_PLR1_SU0_SUM0_SUS128_VWA4_VWB8_WGM8_WGMXCC1_WGMXCCGn1
    SolutionIndex: 73
    SolutionNameMin: Cijk_Alik_Bjlk_B8F8NHS_BH_Bias_HAS_SAV_UserArgs_MT256x128x128_MI16x16x1_SN_LDSB1_CLR1_GRVWA8_GRVWB16_GSU0_GSUC0_GSUWGMRR0_K1_LBSPPA1024_LBSPPB1024_LPA8_LPB64_LRVW8_MIWT8_4_PLR1_SU0_SUM0_SUS128_VWA8_VWB4_WGM1_WGMXCC1_WGMXCCGn1
    SolutionIndex: 74
    SolutionNameMin: Cijk_Alik_Bjlk_B8F8NHS_BH_Bias_HAS_SAV_UserArgs_MT256x128x128_MI16x16x1_SN_LDSB1_CLR1_GRVWA8_GRVWB16_GSU0_GSUC0_GSUWGMRR0_K1_LBSPPA1024_LBSPPB1024_LPA8_LPB64_LRVW8_MIWT8_4_PLR1_SU0_SUM0_SUS128_VWA8_VWB4_WGM4_WGMXCC1_WGMXCCGn1
    SolutionIndex: 75
    SolutionNameMin: Cijk_Alik_Bjlk_B8F8NHS_BH_Bias_HAS_SAV_UserArgs_MT256x128x128_MI16x16x1_SN_LDSB1_CLR1_GRVWA8_GRVWB16_GSU0_GSUC0_GSUWGMRR0_K1_LBSPPA1024_LBSPPB1024_LPA8_LPB64_LRVW8_MIWT8_4_PLR1_SU0_SUM0_SUS128_VWA8_VWB4_WGM6_WGMXCC1_WGMXCCGn1
    SolutionIndex: 76
    SolutionNameMin: Cijk_Alik_Bjlk_B8F8NHS_BH_Bias_HAS_SAV_UserArgs_MT256x128x128_MI16x16x1_SN_LDSB1_CLR1_GRVWA16_GRVWB16_GSU0_GSUC0_GSUWGMRR0_K1_LBSPPA1024_LBSPPB1024_LPA16_LPB64_LRVW8_MIWT8_4_PLR1_SU0_SUM0_SUS128_VWA8_VWB4_WGM6_WGMXCC1_WGMXCCGn1
    SolutionIndex: 77
    SolutionNameMin: Cijk_Alik_Bjlk_B8F8NHS_BH_Bias_HAS_SAV_UserArgs_MT144x256x128_MI16x16x1_SN_LDSB1_CLR1_GRVWA8_GRVWB16_GSU0_GSUC0_GSUWGMRR0_K1_LBSPPA128_LBSPPB2048_LPA8_LPB64_LRVW8_MIWT9_4_PLR1_SU0_SUM0_SUS128_VWA1_VWB4_WGM1_WGMXCC1_WGMXCCGn1
    SolutionIndex: 78
    SolutionNameMin: Cijk_Alik_Bjlk_B8F8NHS_BH_Bias_HAS_SAV_UserArgs_MT144x256x128_MI16x16x1_SN_LDSB1_CLR1_GRVWA8_GRVWB16_GSU0_GSUC0_GSUWGMRR0_K1_LBSPPA128_LBSPPB2048_LPA8_LPB64_LRVW8_MIWT9_4_PLR1_SU0_SUM0_SUS128_VWA1_VWB4_WGM4_WGMXCC1_WGMXCCGn1
    SolutionIndex: 79
    SolutionNameMin: Cijk_Alik_Bjlk_B8F8NHS_BH_Bias_HAS_SAV_UserArgs_MT144x256x128_MI16x16x1_SN_LDSB1_CLR1_GRVWA8_GRVWB8_GSU0_GSUC0_GSUWGMRR0_K1_LBSPPA128_LBSPPB2048_LPA8_LPB64_LRVW8_MIWT9_4_PLR1_SU0_SUM0_SUS128_VWA1_VWB4_WGM6_WGMXCC1_WGMXCCGn1
    SolutionIndex: 80
    SolutionNameMin: Cijk_Alik_Bjlk_B8F8NHS_BH_Bias_HAS_SAV_UserArgs_MT144x256x128_MI16x16x1_SN_LDSB1_CLR1_GRVWA8_GRVWB16_GSU0_GSUC0_GSUWGMRR0_K1_LBSPPA128_LBSPPB2048_LPA8_LPB64_LRVW8_MIWT9_4_PLR1_SU0_SUM0_SUS128_VWA1_VWB4_WGM6_WGMXCC1_WGMXCCGn1
    SolutionIndex: 81
    SolutionNameMin: Cijk_Alik_Bjlk_B8F8NHS_BH_Bias_HAS_SAV_UserArgs_MT144x256x128_MI16x16x1_SN_LDSB1_CLR1_GRVWA8_GRVWB8_GSU0_GSUC0_GSUWGMRR0_K1_LBSPPA128_LBSPPB2048_LPA8_LPB64_LRVW8_MIWT9_4_PLR1_SU0_SUM0_SUS128_VWA1_VWB4_WGM8_WGMXCC1_WGMXCCGn1
    SolutionIndex: 82
    SolutionNameMin: Cijk_Alik_Bjlk_B8F8NHS_BH_Bias_HAS_SAV_UserArgs_MT144x256x128_MI16x16x1_SN_LDSB1_CLR1_GRVWA8_GRVWB16_GSU0_GSUC0_GSUWGMRR0_K1_LBSPPA128_LBSPPB2048_LPA8_LPB64_LRVW8_MIWT9_4_PLR1_SU0_SUM0_SUS128_VWA1_VWB4_WGM8_WGMXCC1_WGMXCCGn1
    SolutionIndex: 83
    SolutionNameMin: Cijk_Alik_Bjlk_B8F8NHS_BH_Bias_HAS_SAV_UserArgs_MT128x128x128_MI16x16x1_SN_LDSB1_CLR1_GRVWA8_GRVWB8_GSU0_GSUC0_GSUWGMRR0_K1_LBSPPA1024_LBSPPB1024_LPA8_LPB32_LRVW8_MIWT8_2_PLR1_SU0_SUM0_SUS128_VWA8_VWB2_WGM1_WGMXCC1_WGMXCCGn1
    SolutionIndex: 84
    SolutionNameMin: Cijk_Alik_Bjlk_B8F8NHS_BH_Bias_HAS_SAV_UserArgs_MT128x128x128_MI16x16x1_SN_LDSB1_CLR1_GRVWA8_GRVWB16_GSU0_GSUC0_GSUWGMRR0_K1_LBSPPA1024_LBSPPB1024_LPA8_LPB32_LRVW8_MIWT8_2_PLR1_SU0_SUM0_SUS128_VWA8_VWB2_WGM1_WGMXCC1_WGMXCCGn1
    SolutionIndex: 85
    SolutionNameMin: Cijk_Alik_Bjlk_B8F8NHS_BH_Bias_HAS_SAV_UserArgs_MT64x128x128_MI16x16x1_SN_LDSB1_CLR1_GRVWA16_GRVWB16_GSU0_GSUC0_GSUWGMRR0_K1_LBSPPA128_LBSPPB1024_LPA16_LPB0_LRVW8_MIWT1_8_PLR1_SU0_SUM0_SUS128_VWA1_VWB8_WGM1_WGMXCC1_WGMXCCGn1
    SolutionIndex: 86
    SolutionNameMin: Cijk_Alik_Bjlk_B8F8NHS_BH_Bias_HAS_SAV_UserArgs_MT256x32x128_MI16x16x1_SN_LDSB1_CLR1_GRVWA16_GRVWB8_GSU0_GSUC0_GSUWGMRR0_K1_LBSPPA1024_LBSPPB256_LPA16_LPB16_LRVW8_MIWT8_1_PLR1_SU0_SUM0_SUS128_VWA8_VWB1_WGM4_WGMXCC1_WGMXCCGn1
    SolutionIndex: 87
    SolutionNameMin: Cijk_Alik_Bjlk_B8F8NHS_BH_Bias_HAS_SAV_UserArgs_MT128x64x128_MI16x16x1_SN_LDSB1_CLR1_GRVWA8_GRVWB8_GSU0_GSUC0_GSUWGMRR0_K1_LBSPPA1024_LBSPPB512_LPA8_LPB16_LRVW8_MIWT8_1_PLR1_SU0_SUM0_SUS128_VWA8_VWB1_WGM1_WGMXCC1_WGMXCCGn1
    SolutionIndex: 88
    SolutionNameMin: Cijk_Alik_Bjlk_B8F8NHS_BH_Bias_HAS_SAV_UserArgs_MT128x64x128_MI16x16x1_SN_LDSB1_CLR1_GRVWA16_GRVWB8_GSU0_GSUC0_GSUWGMRR0_K1_LBSPPA1024_LBSPPB512_LPA16_LPB16_LRVW8_MIWT8_1_PLR1_SU0_SUM0_SUS128_VWA8_VWB1_WGM1_WGMXCC1_WGMXCCGn1
    SolutionIndex: 89
    SolutionNameMin: Cijk_Alik_Bjlk_B8F8NHS_BH_Bias_HAS_SAV_UserArgs_MT128x64x128_MI16x16x1_SN_LDSB1_CLR1_GRVWA8_GRVWB8_GSU0_GSUC0_GSUWGMRR0_K1_LBSPPA1024_LBSPPB512_LPA8_LPB16_LRVW8_MIWT8_1_PLR1_SU0_SUM0_SUS128_VWA8_VWB1_WGM6_WGMXCC1_WGMXCCGn1
    SolutionIndex: 90
    SolutionNameMin: Cijk_Alik_Bjlk_B8F8NHS_BH_Bias_HAS_SAV_UserArgs_MT128x64x128_MI16x16x1_SN_LDSB1_CLR1_GRVWA16_GRVWB8_GSU0_GSUC0_GSUWGMRR0_K1_LBSPPA1024_LBSPPB512_LPA16_LPB16_LRVW8_MIWT8_1_PLR1_SU0_SUM0_SUS128_VWA8_VWB1_WGM8_WGMXCC1_WGMXCCGn1
    SolutionIndex: 91
    SolutionNameMin: Cijk_Alik_Bjlk_B8F8NHS_BH_Bias_HAS_SAV_UserArgs_MT144x128x128_MI16x16x1_SN_LDSB1_CLR1_GRVWA8_GRVWB16_GSU0_GSUC0_GSUWGMRR0_K1_LBSPPA128_LBSPPB1024_LPA8_LPB32_LRVW8_MIWT9_2_PLR1_SU0_SUM0_SUS128_VWA1_VWB2_WGM4_WGMXCC1_WGMXCCGn1
    SolutionIndex: 92
    SolutionNameMin: Cijk_Alik_Bjlk_B8F8NHS_BH_Bias_HAS_SAV_UserArgs_MT144x128x128_MI16x16x1_SN_LDSB1_CLR1_GRVWA8_GRVWB16_GSU0_GSUC0_GSUWGMRR0_K1_LBSPPA128_LBSPPB1024_LPA8_LPB32_LRVW8_MIWT9_2_PLR1_SU0_SUM0_SUS128_VWA1_VWB2_WGM6_WGMXCC1_WGMXCCGn1
    SolutionIndex: 93
    SolutionNameMin: Cijk_Alik_Bjlk_B8F8NHS_BH_Bias_HAS_SAV_UserArgs_MT128x128x128_MI16x16x1_SN_LDSB1_CLR1_GRVWA16_GRVWB16_GSU0_GSUC0_GSUWGMRR0_K1_LBSPPA512_LBSPPB1024_LPA16_LPB64_LRVW8_MIWT4_4_PLR1_SU0_SUM0_SUS128_VWA4_VWB4_WGM1_WGMXCC1_WGMXCCGn1
    SolutionIndex: 94
    SolutionNameMin: Cijk_Alik_Bjlk_B8F8NHS_BH_Bias_HAS_SAV_UserArgs_MT128x128x128_MI16x16x1_SN_LDSB1_CLR1_GRVWA16_GRVWB16_GSU0_GSUC0_GSUWGMRR0_K1_LBSPPA512_LBSPPB1024_LPA16_LPB64_LRVW8_MIWT4_4_PLR1_SU0_SUM0_SUS128_VWA4_VWB4_WGM4_WGMXCC1_WGMXCCGn1
    SolutionIndex: 95
    SolutionNameMin: Cijk_Alik_Bjlk_B8F8NHS_BH_Bias_HAS_SAV_UserArgs_MT128x128x128_MI16x16x1_SN_LDSB1_CLR1_GRVWA16_GRVWB16_GSU0_GSUC0_GSUWGMRR0_K1_LBSPPA512_LBSPPB1024_LPA16_LPB64_LRVW8_MIWT4_4_PLR1_SU0_SUM0_SUS128_VWA4_VWB4_WGM6_WGMXCC1_WGMXCCGn1
    SolutionIndex: 96
    SolutionNameMin: Cijk_Alik_Bjlk_B8F8NHS_BH_Bias_HAS_SAV_UserArgs_MT128x128x128_MI16x16x1_SN_LDSB1_CLR1_GRVWA16_GRVWB16_GSU0_GSUC0_GSUWGMRR0_K1_LBSPPA512_LBSPPB1024_LPA16_LPB64_LRVW8_MIWT4_4_PLR1_SU0_SUM0_SUS128_VWA4_VWB4_WGM8_WGMXCC1_WGMXCCGn1
    SolutionIndex: 97
    SolutionNameMin: Cijk_Alik_Bjlk_B8F8NHS_BH_Bias_HAS_SAV_UserArgs_MT64x128x128_MI16x16x1_SN_LDSB1_CLR1_GRVWA8_GRVWB16_GSU0_GSUC0_GSUWGMRR0_K1_LBSPPA256_LBSPPB1024_LPA8_LPB64_LRVW8_MIWT2_4_PLR1_SU0_SUM0_SUS128_VWA2_VWB4_WGM1_WGMXCC1_WGMXCCGn1
    SolutionIndex: 98
    SolutionNameMin: Cijk_Alik_Bjlk_B8F8NHS_BH_Bias_HAS_SAV_UserArgs_MT64x128x128_MI16x16x1_SN_LDSB1_CLR1_GRVWA8_GRVWB16_GSU0_GSUC0_GSUWGMRR0_K1_LBSPPA256_LBSPPB1024_LPA8_LPB64_LRVW8_MIWT2_4_PLR1_SU0_SUM0_SUS128_VWA2_VWB4_WGM4_WGMXCC1_WGMXCCGn1
    SolutionIndex: 99
    SolutionNameMin: Cijk_Alik_Bjlk_B8F8NHS_BH_Bias_HAS_SAV_UserArgs_MT128x64x128_MI16x16x1_SN_LDSB1_CLR1_GRVWA8_GRVWB8_GSU0_GSUC0_GSUWGMRR0_K1_LBSPPA512_LBSPPB512_LPA8_LPB32_LRVW8_MIWT4_2_PLR1_SU0_SUM0_SUS128_VWA4_VWB2_WGM1_WGMXCC1_WGMXCCGn1
    SolutionIndex: 100
    SolutionNameMin: Cijk_Alik_Bjlk_B8F8NHS_BH_Bias_HAS_SAV_UserArgs_MT128x64x128_MI16x16x1_SN_LDSB1_CLR1_GRVWA16_GRVWB16_GSU0_GSUC0_GSUWGMRR0_K1_LBSPPA512_LBSPPB512_LPA16_LPB32_LRVW8_MIWT4_2_PLR1_SU0_SUM0_SUS128_VWA4_VWB2_WGM6_WGMXCC1_WGMXCCGn1
    SolutionIndex: 101
    SolutionNameMin: Cijk_Alik_Bjlk_B8F8NHS_BH_Bias_HAS_SAV_UserArgs_MT64x64x128_MI16x16x1_SN_LDSB1_CLR1_GRVWA16_GRVWB8_GSU0_GSUC0_GSUWGMRR0_K1_LBSPPA256_LBSPPB512_LPA16_LPB32_LRVW8_MIWT2_2_PLR1_SU0_SUM0_SUS128_VWA2_VWB2_WGM1_WGMXCC1_WGMXCCGn1
    SolutionIndex: 102
    SolutionNameMin: Cijk_Alik_Bjlk_B8F8NHS_BH_Bias_HAS_SAV_UserArgs_MT64x64x128_MI16x16x1_SN_LDSB1_CLR1_GRVWA8_GRVWB16_GSU0_GSUC0_GSUWGMRR0_K1_LBSPPA256_LBSPPB512_LPA8_LPB32_LRVW8_MIWT2_2_PLR1_SU0_SUM0_SUS128_VWA2_VWB2_WGM1_WGMXCC1_WGMXCCGn1
    SolutionIndex: 103
    SolutionNameMin: Cijk_Alik_Bjlk_B8F8NHS_BH_Bias_HAS_SAV_UserArgs_MT64x64x128_MI16x16x1_SN_LDSB1_CLR1_GRVWA16_GRVWB8_GSU0_GSUC0_GSUWGMRR0_K1_LBSPPA256_LBSPPB512_LPA16_LPB32_LRVW8_MIWT2_2_PLR1_SU0_SUM0_SUS128_VWA2_VWB2_WGM6_WGMXCC1_WGMXCCGn1
    SolutionIndex: 104
    SolutionNameMin: Cijk_Alik_Bjlk_B8F8NHS_BH_Bias_HAS_SAV_UserArgs_MT64x64x128_MI16x16x1_SN_LDSB1_CLR1_GRVWA8_GRVWB16_GSU0_GSUC0_GSUWGMRR0_K1_LBSPPA256_LBSPPB512_LPA8_LPB32_LRVW8_MIWT2_2_PLR1_SU0_SUM0_SUS128_VWA2_VWB2_WGM8_WGMXCC1_WGMXCCGn1
    SolutionIndex: 105
    SolutionNameMin: Cijk_Alik_Bjlk_B8F8NHS_BH_Bias_HAS_SAV_UserArgs_MT64x64x128_MI16x16x1_SN_LDSB1_CLR1_GRVWA16_GRVWB16_GSU0_GSUC0_GSUWGMRR0_K1_LBSPPA256_LBSPPB512_LPA16_LPB32_LRVW8_MIWT2_2_PLR1_SU0_SUM0_SUS128_VWA2_VWB2_WGM8_WGMXCC1_WGMXCCGn1
    SolutionIndex: 106
    SolutionNameMin: Cijk_Alik_Bjlk_B8F8NHS_BH_Bias_HAS_SAV_UserArgs_MT32x64x128_MI16x16x1_SN_LDSB0_CLR1_GRVWA8_GRVWB16_GSU0_GSUC0_GSUWGMRR0_K1_LBSPPA128_LBSPPB512_LPA8_LPB32_LRVW8_MIWT1_2_PLR1_SU0_SUM0_SUS128_VWA1_VWB2_WGM1_WGMXCC1_WGMXCCGn1
    SolutionIndex: 107
    SolutionNameMin: Cijk_Alik_Bjlk_B8F8NHS_BH_Bias_HAS_SAV_UserArgs_MT32x64x128_MI16x16x1_SN_LDSB0_CLR1_GRVWA8_GRVWB16_GSU0_GSUC0_GSUWGMRR0_K1_LBSPPA128_LBSPPB512_LPA8_LPB32_LRVW8_MIWT1_2_PLR1_SU0_SUM0_SUS128_VWA1_VWB2_WGM4_WGMXCC1_WGMXCCGn1
    SolutionIndex: 108
    SolutionNameMin: Cijk_Alik_Bjlk_B8F8NHS_BH_Bias_HAS_SAV_UserArgs_MT64x32x128_MI16x16x1_SN_LDSB0_CLR1_GRVWA8_GRVWB8_GSU0_GSUC0_GSUWGMRR0_K1_LBSPPA256_LBSPPB256_LPA8_LPB16_LRVW8_MIWT2_1_PLR1_SU0_SUM0_SUS128_VWA2_VWB1_WGM1_WGMXCC1_WGMXCCGn1
    SolutionIndex: 109
    SolutionNameMin: Cijk_Alik_Bjlk_B8F8NHS_BH_Bias_HAS_SAV_UserArgs_MT64x32x128_MI16x16x1_SN_LDSB0_CLR1_GRVWA16_GRVWB8_GSU0_GSUC0_GSUWGMRR0_K1_LBSPPA256_LBSPPB256_LPA16_LPB16_LRVW8_MIWT2_1_PLR1_SU0_SUM0_SUS128_VWA2_VWB1_WGM1_WGMXCC1_WGMXCCGn1
    SolutionIndex: 110
    SolutionNameMin: Cijk_Alik_Bjlk_B8F8NHS_BH_Bias_HAS_SAV_UserArgs_MT64x32x128_MI16x16x1_SN_LDSB0_CLR1_GRVWA8_GRVWB16_GSU0_GSUC0_GSUWGMRR0_K1_LBSPPA256_LBSPPB256_LPA8_LPB16_LRVW8_MIWT2_1_PLR1_SU0_SUM0_SUS128_VWA2_VWB1_WGM1_WGMXCC1_WGMXCCGn1
    SolutionIndex: 111
    SolutionNameMin: Cijk_Alik_Bjlk_B8F8NHS_BH_Bias_HAS_SAV_UserArgs_MT64x32x128_MI16x16x1_SN_LDSB0_CLR1_GRVWA8_GRVWB16_GSU0_GSUC0_GSUWGMRR0_K1_LBSPPA256_LBSPPB256_LPA8_LPB16_LRVW8_MIWT2_1_PLR1_SU0_SUM0_SUS128_VWA2_VWB1_WGM4_WGMXCC1_WGMXCCGn1
    SolutionIndex: 112
    SolutionNameMin: Cijk_Alik_Bjlk_B8F8NHS_BH_Bias_HAS_SAV_UserArgs_MT64x32x128_MI16x16x1_SN_LDSB0_CLR1_GRVWA8_GRVWB8_GSU0_GSUC0_GSUWGMRR0_K1_LBSPPA256_LBSPPB256_LPA8_LPB16_LRVW8_MIWT2_1_PLR1_SU0_SUM0_SUS128_VWA2_VWB1_WGM8_WGMXCC1_WGMXCCGn1
    SolutionIndex: 113
    SolutionNameMin: Cijk_Alik_Bjlk_B8F8NHS_BH_Bias_HAS_SAV_UserArgs_MT64x32x128_MI16x16x1_SN_LDSB0_CLR1_GRVWA8_GRVWB16_GSU0_GSUC0_GSUWGMRR0_K1_LBSPPA256_LBSPPB256_LPA8_LPB16_LRVW8_MIWT2_1_PLR1_SU0_SUM0_SUS128_VWA2_VWB1_WGM8_WGMXCC1_WGMXCCGn1
    SolutionIndex: 114
    SolutionNameMin: Cijk_Alik_Bjlk_B8F8NHS_BH_Bias_HAS_SAV_UserArgs_MT32x32x128_MI16x16x1_SN_LDSB0_CLR1_GRVWA8_GRVWB8_GSU0_GSUC0_GSUWGMRR0_K1_LBSPPA128_LBSPPB256_LPA8_LPB16_LRVW8_MIWT1_1_PLR1_SU0_SUM0_SUS128_VWA1_VWB1_WGM1_WGMXCC1_WGMXCCGn1
    SolutionIndex: 115
    SolutionNameMin: Cijk_Alik_Bjlk_B8F8NHS_BH_Bias_HAS_SAV_UserArgs_MT32x32x128_MI16x16x1_SN_LDSB0_CLR1_GRVWA16_GRVWB8_GSU0_GSUC0_GSUWGMRR0_K1_LBSPPA128_LBSPPB256_LPA16_LPB16_LRVW8_MIWT1_1_PLR1_SU0_SUM0_SUS128_VWA1_VWB1_WGM1_WGMXCC1_WGMXCCGn1
    SolutionIndex: 116
    SolutionNameMin: Cijk_Alik_Bjlk_B8F8NHS_BH_Bias_HAS_SAV_UserArgs_MT32x32x128_MI16x16x1_SN_LDSB0_CLR1_GRVWA8_GRVWB16_GSU0_GSUC0_GSUWGMRR0_K1_LBSPPA128_LBSPPB256_LPA8_LPB16_LRVW8_MIWT1_1_PLR1_SU0_SUM0_SUS128_VWA1_VWB1_WGM1_WGMXCC1_WGMXCCGn1
    SolutionIndex: 117
    SolutionNameMin: Cijk_Alik_Bjlk_B8F8NHS_BH_Bias_HAS_SAV_UserArgs_MT32x32x128_MI16x16x1_SN_LDSB0_CLR1_GRVWA8_GRVWB8_GSU0_GSUC0_GSUWGMRR0_K1_LBSPPA128_LBSPPB256_LPA8_LPB16_LRVW8_MIWT1_1_PLR1_SU0_SUM0_SUS128_VWA1_VWB1_WGM4_WGMXCC1_WGMXCCGn1
    SolutionIndex: 118
    SolutionNameMin: Cijk_Alik_Bjlk_B8F8NHS_BH_Bias_HAS_SAV_UserArgs_MT32x32x128_MI16x16x1_SN_LDSB0_CLR1_GRVWA8_GRVWB16_GSU0_GSUC0_GSUWGMRR0_K1_LBSPPA128_LBSPPB256_LPA8_LPB16_LRVW8_MIWT1_1_PLR1_SU0_SUM0_SUS128_VWA1_VWB1_WGM4_WGMXCC1_WGMXCCGn1
    SolutionIndex: 119
    SolutionNameMin: Cijk_Alik_Bjlk_B8F8NHS_BH_Bias_HAS_SAV_UserArgs_MT32x32x128_MI16x16x1_SN_LDSB0_CLR1_GRVWA8_GRVWB8_GSU0_GSUC0_GSUWGMRR0_K1_LBSPPA128_LBSPPB256_LPA8_LPB16_LRVW8_MIWT1_1_PLR1_SU0_SUM0_SUS128_VWA1_VWB1_WGM6_WGMXCC1_WGMXCCGn1
    SolutionIndex: 120
    SolutionNameMin: Cijk_Alik_Bjlk_B8F8NHS_BH_Bias_HAS_SAV_UserArgs_MT32x32x128_MI16x16x1_SN_LDSB0_CLR1_GRVWA8_GRVWB16_GSU0_GSUC0_GSUWGMRR0_K1_LBSPPA128_LBSPPB256_LPA8_LPB16_LRVW8_MIWT1_1_PLR1_SU0_SUM0_SUS128_VWA1_VWB1_WGM8_WGMXCC1_WGMXCCGn1
    SolutionIndex: 121
    SolutionNameMin: Cijk_Alik_Bjlk_B8F8NHS_BH_Bias_HAS_SAV_UserArgs_MT128x64x256_MI16x16x1_SN_LDSB1_CLR1_GRVWA16_GRVWB16_GSU0_GSUC0_GSUWGMRR0_K1_LBSPPA1024_LBSPPB512_LPA16_LPB32_LRVW8_MIWT4_2_PLR1_SU0_SUM0_SUS256_VWA4_VWB2_WGM1_WGMXCC1_WGMXCCGn1
    SolutionIndex: 122
    SolutionNameMin: Cijk_Alik_Bjlk_B8F8NHS_BH_Bias_HAS_SAV_UserArgs_MT128x64x256_MI16x16x1_SN_LDSB1_CLR1_GRVWA16_GRVWB16_GSU0_GSUC0_GSUWGMRR0_K1_LBSPPA1024_LBSPPB512_LPA16_LPB32_LRVW8_MIWT4_2_PLR1_SU0_SUM0_SUS256_VWA4_VWB2_WGM4_WGMXCC1_WGMXCCGn1
    SolutionIndex: 123
    SolutionNameMin: Cijk_Alik_Bjlk_B8F8NHS_BH_Bias_HAS_SAV_UserArgs_MT128x64x256_MI16x16x1_SN_LDSB1_CLR1_GRVWA16_GRVWB16_GSU0_GSUC0_GSUWGMRR0_K1_LBSPPA1024_LBSPPB512_LPA16_LPB32_LRVW8_MIWT4_2_PLR1_SU0_SUM0_SUS256_VWA4_VWB2_WGM6_WGMXCC1_WGMXCCGn1
    SolutionIndex: 124
    SolutionNameMin: Cijk_Alik_Bjlk_B8F8NHS_BH_Bias_HAS_SAV_UserArgs_MT128x64x256_MI16x16x1_SN_LDSB1_CLR1_GRVWA16_GRVWB16_GSU0_GSUC0_GSUWGMRR0_K1_LBSPPA1024_LBSPPB512_LPA16_LPB32_LRVW8_MIWT4_2_PLR1_SU0_SUM0_SUS256_VWA4_VWB2_WGM8_WGMXCC1_WGMXCCGn1
    SolutionIndex: 125
    SolutionNameMin: Cijk_Alik_Bjlk_B8F8NHS_BH_Bias_HAS_SAV_UserArgs_MT64x64x256_MI16x16x1_SN_LDSB1_CLR1_GRVWA16_GRVWB16_GSU0_GSUC0_GSUWGMRR0_K1_LBSPPA512_LBSPPB512_LPA16_LPB32_LRVW8_MIWT2_2_PLR1_SU0_SUM0_SUS256_VWA2_VWB2_WGM1_WGMXCC1_WGMXCCGn1
    SolutionIndex: 126
    SolutionNameMin: Cijk_Alik_Bjlk_B8F8NHS_BH_Bias_HAS_SAV_UserArgs_MT64x64x256_MI16x16x1_SN_LDSB1_CLR1_GRVWA16_GRVWB16_GSU0_GSUC0_GSUWGMRR0_K1_LBSPPA512_LBSPPB512_LPA16_LPB32_LRVW8_MIWT2_2_PLR1_SU0_SUM0_SUS256_VWA2_VWB2_WGM4_WGMXCC1_WGMXCCGn1
    SolutionIndex: 127
    SolutionNameMin: Cijk_Alik_Bjlk_B8F8NHS_BH_Bias_HAS_SAV_UserArgs_MT64x64x256_MI16x16x1_SN_LDSB1_CLR1_GRVWA8_GRVWB16_GSU0_GSUC0_GSUWGMRR0_K1_LBSPPA512_LBSPPB512_LPA8_LPB32_LRVW8_MIWT2_2_PLR1_SU0_SUM0_SUS256_VWA2_VWB2_WGM6_WGMXCC1_WGMXCCGn1
    SolutionIndex: 128
    SolutionNameMin: Cijk_Alik_Bjlk_B8F8NHS_BH_Bias_HAS_SAV_UserArgs_MT64x64x256_MI16x16x1_SN_LDSB1_CLR1_GRVWA16_GRVWB16_GSU0_GSUC0_GSUWGMRR0_K1_LBSPPA512_LBSPPB512_LPA16_LPB32_LRVW8_MIWT2_2_PLR1_SU0_SUM0_SUS256_VWA2_VWB2_WGM6_WGMXCC1_WGMXCCGn1
    SolutionIndex: 129
    SolutionNameMin: Cijk_Alik_Bjlk_B8F8NHS_BH_Bias_HAS_SAV_UserArgs_MT64x64x256_MI16x16x1_SN_LDSB1_CLR1_GRVWA16_GRVWB16_GSU0_GSUC0_GSUWGMRR0_K1_LBSPPA512_LBSPPB512_LPA16_LPB32_LRVW8_MIWT2_2_PLR1_SU0_SUM0_SUS256_VWA2_VWB2_WGM8_WGMXCC1_WGMXCCGn1
    SolutionIndex: 130
    SolutionNameMin: Cijk_Alik_Bjlk_B8F8NHS_BH_Bias_HAS_SAV_UserArgs_MT32x64x256_MI16x16x1_SN_LDSB1_CLR1_GRVWA16_GRVWB16_GSU0_GSUC0_GSUWGMRR0_K1_LBSPPA256_LBSPPB512_LPA16_LPB32_LRVW8_MIWT1_2_PLR1_SU0_SUM0_SUS256_VWA1_VWB2_WGM1_WGMXCC1_WGMXCCGn1
    SolutionIndex: 131
    SolutionNameMin: Cijk_Alik_Bjlk_B8F8NHS_BH_Bias_HAS_SAV_UserArgs_MT32x64x256_MI16x16x1_SN_LDSB1_CLR1_GRVWA8_GRVWB16_GSU0_GSUC0_GSUWGMRR0_K1_LBSPPA256_LBSPPB512_LPA8_LPB32_LRVW8_MIWT1_2_PLR1_SU0_SUM0_SUS256_VWA1_VWB2_WGM6_WGMXCC1_WGMXCCGn1
    SolutionIndex: 132
    SolutionNameMin: Cijk_Alik_Bjlk_B8F8NHS_BH_Bias_HAS_SAV_UserArgs_MT32x64x256_MI16x16x1_SN_LDSB1_CLR1_GRVWA16_GRVWB16_GSU0_GSUC0_GSUWGMRR0_K1_LBSPPA256_LBSPPB512_LPA16_LPB32_LRVW8_MIWT1_2_PLR1_SU0_SUM0_SUS256_VWA1_VWB2_WGM6_WGMXCC1_WGMXCCGn1
    SolutionIndex: 133
    SolutionNameMin: Cijk_Alik_Bjlk_B8F8NHS_BH_Bias_HAS_SAV_UserArgs_MT64x32x256_MI16x16x1_SN_LDSB1_CLR1_GRVWA16_GRVWB16_GSU0_GSUC0_GSUWGMRR0_K1_LBSPPA512_LBSPPB256_LPA16_LPB16_LRVW8_MIWT2_1_PLR1_SU0_SUM0_SUS256_VWA2_VWB1_WGM8_WGMXCC1_WGMXCCGn1
    SolutionIndex: 134
    SolutionNameMin: Cijk_Alik_Bjlk_B8F8NHS_BH_Bias_HAS_SAV_UserArgs_MT32x32x256_MI16x16x1_SN_LDSB1_CLR1_GRVWA16_GRVWB16_GSU0_GSUC0_GSUWGMRR0_K1_LBSPPA256_LBSPPB256_LPA16_LPB16_LRVW8_MIWT1_1_PLR1_SU0_SUM0_SUS256_VWA1_VWB1_WGM1_WGMXCC1_WGMXCCGn1
    SolutionIndex: 135
    SolutionNameMin: Cijk_Alik_Bjlk_B8F8NHS_BH_Bias_HAS_SAV_UserArgs_MT32x32x256_MI16x16x1_SN_LDSB1_CLR1_GRVWA8_GRVWB16_GSU0_GSUC0_GSUWGMRR0_K1_LBSPPA256_LBSPPB256_LPA8_LPB16_LRVW8_MIWT1_1_PLR1_SU0_SUM0_SUS256_VWA1_VWB1_WGM6_WGMXCC1_WGMXCCGn1
    SolutionIndex: 136
    SolutionNameMin: Cijk_Alik_Bjlk_B8F8NHS_BH_Bias_HAS_SAV_UserArgs_MT32x32x256_MI16x16x1_SN_LDSB1_CLR1_GRVWA16_GRVWB16_GSU0_GSUC0_GSUWGMRR0_K1_LBSPPA256_LBSPPB256_LPA16_LPB16_LRVW8_MIWT1_1_PLR1_SU0_SUM0_SUS256_VWA1_VWB1_WGM8_WGMXCC1_WGMXCCGn1
- - - [128, 128, 1, 128, 128, 128, 128, 128]
    - [43, 0.37]
  - - [128, 128, 1, 256, 128, 128, 256, 128]
    - [57, 0.83]
  - - [128, 128, 1, 512, 128, 128, 512, 128]
    - [66, 1.51]
  - - [128, 128, 1, 1024, 128, 128, 1024, 128]
    - [65, 2.46]
  - - [128, 128, 1, 2048, 128, 128, 2048, 128]
    - [114, 3.74]
  - - [128, 128, 1, 4096, 128, 128, 4096, 128]
    - [116, 4.75]
  - - [128, 128, 1, 8192, 128, 128, 8192, 128]
    - [116, 5.46]
  - - [128, 256, 1, 128, 128, 128, 128, 256]
    - [67, 0.67]
  - - [128, 256, 1, 256, 128, 128, 256, 256]
    - [41, 1.4]
  - - [128, 256, 1, 512, 128, 128, 512, 256]
    - [64, 2.67]
  - - [128, 256, 1, 1024, 128, 128, 1024, 256]
    - [65, 4.98]
  - - [128, 256, 1, 2048, 128, 128, 2048, 256]
    - [114, 7.59]
  - - [128, 256, 1, 4096, 128, 128, 4096, 256]
    - [116, 9.61]
  - - [128, 256, 1, 8192, 128, 128, 8192, 256]
    - [116, 11.03]
  - - [128, 512, 1, 128, 128, 128, 128, 512]
    - [85, 1.38]
  - - [128, 512, 1, 256, 128, 128, 256, 512]
    - [45, 2.8]
  - - [128, 512, 1, 512, 128, 128, 512, 512]
    - [61, 6.14]
  - - [128, 512, 1, 1024, 128, 128, 1024, 512]
    - [116, 9.53]
  - - [128, 512, 1, 2048, 128, 128, 2048, 512]
    - [117, 14.89]
  - - [128, 512, 1, 4096, 128, 128, 4096, 512]
    - [116, 19.06]
  - - [128, 512, 1, 8192, 128, 128, 8192, 512]
    - [134, 18.39]
  - - [128, 1024, 1, 128, 128, 128, 128, 1024]
    - [30, 2.97]
  - - [128, 1024, 1, 256, 128, 128, 256, 1024]
    - [88, 5.55]
  - - [128, 1024, 1, 512, 128, 128, 512, 1024]
    - [54, 10.12]
  - - [128, 1024, 1, 1024, 128, 128, 1024, 1024]
    - [106, 18.59]
  - - [128, 1024, 1, 2048, 128, 128, 2048, 1024]
    - [114, 29.75]
  - - [128, 1024, 1, 4096, 128, 128, 4096, 1024]
    - [136, 31.01]
  - - [128, 1024, 1, 8192, 128, 128, 8192, 1024]
    - [135, 32.09]
  - - [128, 2048, 1, 128, 128, 128, 128, 2048]
    - [34, 6.77]
  - - [128, 2048, 1, 256, 128, 128, 256, 2048]
    - [42, 11.19]
  - - [128, 2048, 1, 512, 128, 128, 512, 2048]
    - [63, 21.47]
  - - [128, 2048, 1, 1024, 128, 128, 1024, 2048]
    - [109, 35.97]
  - - [128, 2048, 1, 2048, 128, 128, 2048, 2048]
    - [130, 43.55]
  - - [128, 2048, 1, 4096, 128, 128, 4096, 2048]
    - [130, 52.04]
  - - [128, 2048, 1, 8192, 128, 128, 8192, 2048]
    - [132, 59.25]
  - - [128, 4096, 1, 128, 128, 128, 128, 4096]
    - [99, 11.16]
  - - [128, 4096, 1, 256, 128, 128, 256, 4096]
    - [87, 22.26]
  - - [128, 4096, 1, 512, 128, 128, 512, 4096]
    - [60, 40.7]
  - - [128, 4096, 1, 1024, 128, 128, 1024, 4096]
    - [102, 63.99]
  - - [128, 4096, 1, 2048, 128, 128, 2048, 4096]
    - [125, 77.81]
  - - [128, 4096, 1, 4096, 128, 128, 4096, 4096]
    - [125, 95.31]
  - - [128, 4096, 1, 8192, 128, 128, 8192, 4096]
    - [125, 107.83]
  - - [128, 8192, 1, 128, 128, 128, 128, 8192]
    - [23, 19.96]
  - - [128, 8192, 1, 256, 128, 128, 256, 8192]
    - [36, 39.38]
  - - [128, 8192, 1, 512, 128, 128, 512, 8192]
    - [46, 70.68]
  - - [128, 8192, 1, 1024, 128, 128, 1024, 8192]
    - [46, 103.57]
  - - [128, 8192, 1, 2048, 128, 128, 2048, 8192]
    - [97, 121.37]
  - - [128, 8192, 1, 4096, 128, 128, 4096, 8192]
    - [98, 143.65]
  - - [128, 8192, 1, 8192, 128, 128, 8192, 8192]
    - [121, 154.36]
  - - [256, 128, 1, 128, 256, 256, 128, 128]
    - [31, 0.64]
  - - [256, 128, 1, 256, 256, 256, 256, 128]
    - [63, 1.24]
  - - [256, 128, 1, 512, 256, 256, 512, 128]
    - [114, 3.47]
  - - [256, 128, 1, 1024, 256, 256, 1024, 128]
    - [114, 5.49]
  - - [256, 128, 1, 2048, 256, 256, 2048, 128]
    - [116, 7.69]
  - - [256, 128, 1, 4096, 256, 256, 4096, 128]
    - [116, 9.68]
  - - [256, 128, 1, 8192, 256, 256, 8192, 128]
    - [116, 11.08]
  - - [256, 256, 1, 128, 256, 256, 128, 256]
    - [65, 2.16]
  - - [256, 256, 1, 256, 256, 256, 256, 256]
    - [115, 3.95]
  - - [256, 256, 1, 512, 256, 256, 512, 256]
    - [114, 6.93]
  - - [256, 256, 1, 1024, 256, 256, 1024, 256]
    - [114, 10.87]
  - - [256, 256, 1, 2048, 256, 256, 2048, 256]
    - [116, 15.25]
  - - [256, 256, 1, 4096, 256, 256, 4096, 256]
    - [116, 19.13]
  - - [256, 256, 1, 8192, 256, 256, 8192, 256]
    - [118, 21.83]
  - - [256, 512, 1, 128, 256, 256, 128, 512]
    - [61, 4.12]
  - - [256, 512, 1, 256, 256, 256, 256, 512]
    - [115, 7.67]
  - - [256, 512, 1, 512, 256, 256, 512, 512]
    - [114, 13.55]
  - - [256, 512, 1, 1024, 256, 256, 1024, 512]
    - [116, 20.87]
  - - [256, 512, 1, 2048, 256, 256, 2048, 512]
    - [116, 29.73]
  - - [256, 512, 1, 4096, 256, 256, 4096, 512]
    - [116, 37.53]
  - - [256, 512, 1, 8192, 256, 256, 8192, 512]
    - [134, 38.49]
  - - [256, 1024, 1, 128, 256, 256, 128, 1024]
    - [61, 7.94]
  - - [256, 1024, 1, 256, 256, 256, 256, 1024]
    - [108, 14.38]
  - - [256, 1024, 1, 512, 256, 256, 512, 1024]
    - [109, 24.28]
  - - [256, 1024, 1, 1024, 256, 256, 1024, 1024]
    - [108, 37.3]
  - - [256, 1024, 1, 2048, 256, 256, 2048, 1024]
    - [110, 51.31]
  - - [256, 1024, 1, 4096, 256, 256, 4096, 1024]
    - [133, 57.58]
  - - [256, 1024, 1, 8192, 256, 256, 8192, 1024]
    - [132, 59.66]
  - - [256, 2048, 1, 128, 256, 256, 128, 2048]
    - [56, 14.6]
  - - [256, 2048, 1, 256, 256, 256, 256, 2048]
    - [55, 25.75]
  - - [256, 2048, 1, 512, 256, 256, 512, 2048]
    - [101, 41.99]
  - - [256, 2048, 1, 1024, 256, 256, 1024, 2048]
    - [102, 63.66]
  - - [256, 2048, 1, 2048, 256, 256, 2048, 2048]
    - [125, 79.31]
  - - [256, 2048, 1, 4096, 256, 256, 4096, 2048]
    - [125, 95.73]
  - - [256, 2048, 1, 8192, 256, 256, 8192, 2048]
    - [125, 108.24]
  - - [256, 4096, 1, 128, 256, 256, 128, 4096]
    - [32, 24.42]
  - - [256, 4096, 1, 256, 256, 256, 256, 4096]
    - [45, 42.97]
  - - [256, 4096, 1, 512, 256, 256, 512, 4096]
    - [46, 70.73]
  - - [256, 4096, 1, 1024, 256, 256, 1024, 4096]
    - [46, 102.7]
  - - [256, 4096, 1, 2048, 256, 256, 2048, 4096]
    - [121, 124.43]
  - - [256, 4096, 1, 4096, 256, 256, 4096, 4096]
    - [121, 150.1]
  - - [256, 4096, 1, 8192, 256, 256, 8192, 4096]
    - [122, 163.5]
  - - [256, 8192, 1, 128, 256, 256, 128, 8192]
    - [22, 38.24]
  - - [256, 8192, 1, 256, 256, 256, 256, 8192]
    - [22, 65.06]
  - - [256, 8192, 1, 512, 256, 256, 512, 8192]
    - [93, 106.57]
  - - [256, 8192, 1, 1024, 256, 256, 1024, 8192]
    - [93, 154.2]
  - - [256, 8192, 1, 2048, 256, 256, 2048, 8192]
    - [93, 183.75]
  - - [256, 8192, 1, 4096, 256, 256, 4096, 8192]
    - [93, 212.27]
  - - [256, 8192, 1, 8192, 256, 256, 8192, 8192]
    - [94, 200.26]
  - - [512, 128, 1, 128, 512, 512, 128, 128]
    - [65, 2.11]
  - - [512, 128, 1, 256, 512, 512, 256, 128]
    - [115, 3.91]
  - - [512, 128, 1, 512, 512, 512, 512, 128]
    - [114, 6.83]
  - - [512, 128, 1, 1024, 512, 512, 1024, 128]
    - [114, 10.87]
  - - [512, 128, 1, 2048, 512, 512, 2048, 128]
    - [114, 15.07]
  - - [512, 128, 1, 4096, 512, 512, 4096, 128]
    - [116, 19.1]
  - - [512, 128, 1, 8192, 512, 512, 8192, 128]
    - [116, 21.97]
  - - [512, 256, 1, 128, 512, 512, 128, 256]
    - [65, 4.21]
  - - [512, 256, 1, 256, 512, 512, 256, 256]
    - [65, 7.75]
  - - [512, 256, 1, 512, 512, 512, 512, 256]
    - [114, 13.64]
  - - [512, 256, 1, 1024, 512, 512, 1024, 256]
    - [114, 21.21]
  - - [512, 256, 1, 2048, 512, 512, 2048, 256]
    - [114, 29.85]
  - - [512, 256, 1, 4096, 512, 512, 4096, 256]
    - [116, 37.63]
  - - [512, 256, 1, 8192, 512, 512, 8192, 256]
    - [120, 42.94]
  - - [512, 512, 1, 128, 512, 512, 128, 512]
    - [61, 8.14]
  - - [512, 512, 1, 256, 512, 512, 256, 512]
    - [109, 14.36]
  - - [512, 512, 1, 512, 512, 512, 512, 512]
    - [109, 24.35]
  - - [512, 512, 1, 1024, 512, 512, 1024, 512]
    - [110, 37.2]
  - - [512, 512, 1, 2048, 512, 512, 2048, 512]
    - [110, 51.75]
  - - [512, 512, 1, 4096, 512, 512, 4096, 512]
    - [111, 62.67]
  - - [512, 512, 1, 8192, 512, 512, 8192, 512]
    - [107, 63.98]
  - - [512, 1024, 1, 128, 512, 512, 128, 1024]
    - [55, 14.7]
  - - [512, 1024, 1, 256, 512, 512, 256, 1024]
    - [56, 26.03]
  - - [512, 1024, 1, 512, 512, 512, 512, 1024]
    - [55, 42.34]
  - - [512, 1024, 1, 1024, 512, 512, 1024, 1024]
    - [105, 62.15]
  - - [512, 1024, 1, 2048, 512, 512, 2048, 1024]
    - [125, 85.56]
  - - [512, 1024, 1, 4096, 512, 512, 4096, 1024]
    - [125, 96.67]
  - - [512, 1024, 1, 8192, 512, 512, 8192, 1024]
    - [128, 106.34]
  - - [512, 2048, 1, 128, 512, 512, 128, 2048]
    - [29, 19.99]
  - - [512, 2048, 1, 256, 512, 512, 256, 2048]
    - [36, 38.74]
  - - [512, 2048, 1, 512, 512, 512, 512, 2048]
    - [44, 69.18]
  - - [512, 2048, 1, 1024, 512, 512, 1024, 2048]
    - [48, 102.62]
  - - [512, 2048, 1, 2048, 512, 512, 2048, 2048]
    - [121, 125.72]
  - - [512, 2048, 1, 4096, 512, 512, 4096, 2048]
    - [121, 150.62]
  - - [512, 2048, 1, 8192, 512, 512, 8192, 2048]
    - [123, 160.22]
  - - [512, 4096, 1, 128, 512, 512, 128, 4096]
    - [38, 37.19]
  - - [512, 4096, 1, 256, 512, 512, 256, 4096]
    - [24, 65.86]
  - - [512, 4096, 1, 512, 512, 512, 512, 4096]
    - [93, 105.9]
  - - [512, 4096, 1, 1024, 512, 512, 1024, 4096]
    - [93, 153.28]
  - - [512, 4096, 1, 2048, 512, 512, 2048, 4096]
    - [93, 188.61]
  - - [512, 4096, 1, 4096, 512, 512, 4096, 4096]
    - [93, 216.84]
  - - [512, 4096, 1, 8192, 512, 512, 8192, 4096]
    - [93, 198.13]
  - - [512, 8192, 1, 128, 512, 512, 128, 8192]
    - [17, 54.82]
  - - [512, 8192, 1, 256, 512, 512, 256, 8192]
    - [16, 95.1]
  - - [512, 8192, 1, 512, 512, 512, 512, 8192]
    - [16, 149.58]
  - - [512, 8192, 1, 1024, 512, 512, 1024, 8192]
    - [16, 201.8]
  - - [512, 8192, 1, 2048, 512, 512, 2048, 8192]
    - [10, 240.13]
  - - [512, 8192, 1, 4096, 512, 512, 4096, 8192]
    - [70, 254.3]
  - - [512, 8192, 1, 8192, 512, 512, 8192, 8192]
    - [73, 234.83]
  - - [1024, 128, 1, 128, 1024, 1024, 128, 128]
    - [28, 2.58]
  - - [1024, 128, 1, 256, 1024, 1024, 256, 128]
    - [41, 5.44]
  - - [1024, 128, 1, 512, 1024, 1024, 512, 128]
    - [53, 9.91]
  - - [1024, 128, 1, 1024, 1024, 1024, 1024, 128]
    - [119, 19.19]
  - - [1024, 128, 1, 2048, 1024, 1024, 2048, 128]
    - [116, 29.01]
  - - [1024, 128, 1, 4096, 1024, 1024, 4096, 128]
    - [116, 37.5]
  - - [1024, 128, 1, 8192, 1024, 1024, 8192, 128]
    - [120, 42.9]
  - - [1024, 256, 1, 128, 1024, 1024, 128, 256]
    - [49, 6.54]
  - - [1024, 256, 1, 256, 1024, 1024, 256, 256]
    - [59, 11.36]
  - - [1024, 256, 1, 512, 1024, 1024, 512, 256]
    - [58, 21.09]
  - - [1024, 256, 1, 1024, 1024, 1024, 1024, 256]
    - [112, 35.74]
  - - [1024, 256, 1, 2048, 1024, 1024, 2048, 256]
    - [110, 51.03]
  - - [1024, 256, 1, 4096, 1024, 1024, 4096, 256]
    - [111, 62.49]
  - - [1024, 256, 1, 8192, 1024, 1024, 8192, 256]
    - [131, 70.36]
  - - [1024, 512, 1, 128, 1024, 1024, 128, 512]
    - [26, 10.85]
  - - [1024, 512, 1, 256, 1024, 1024, 256, 512]
    - [41, 21.12]
  - - [1024, 512, 1, 512, 1024, 1024, 512, 512]
    - [101, 41.4]
  - - [1024, 512, 1, 1024, 1024, 1024, 1024, 512]
    - [102, 63.29]
  - - [1024, 512, 1, 2048, 1024, 1024, 2048, 512]
    - [125, 85.8]
  - - [1024, 512, 1, 4096, 1024, 1024, 4096, 512]
    - [126, 102.23]
  - - [1024, 512, 1, 8192, 1024, 1024, 8192, 512]
    - [129, 107.31]
  - - [1024, 1024, 1, 128, 1024, 1024, 128, 1024]
    - [21, 19.3]
  - - [1024, 1024, 1, 256, 1024, 1024, 256, 1024]
    - [33, 38.15]
  - - [1024, 1024, 1, 512, 1024, 1024, 512, 1024]
    - [46, 69.8]
  - - [1024, 1024, 1, 1024, 1024, 1024, 1024, 1024]
    - [46, 102.77]
  - - [1024, 1024, 1, 2048, 1024, 1024, 2048, 1024]
    - [122, 127.47]
  - - [1024, 1024, 1, 4096, 1024, 1024, 4096, 1024]
    - [122, 146.69]
  - - [1024, 1024, 1, 8192, 1024, 1024, 8192, 1024]
    - [124, 159.13]
  - - [1024, 2048, 1, 128, 1024, 1024, 128, 2048]
    - [39, 37.5]
  - - [1024, 2048, 1, 256, 1024, 1024, 256, 2048]
    - [24, 66.38]
  - - [1024, 2048, 1, 512, 1024, 1024, 512, 2048]
    - [24, 105.63]
  - - [1024, 2048, 1, 1024, 1024, 1024, 1024, 2048]
    - [93, 152.04]
  - - [1024, 2048, 1, 2048, 1024, 1024, 2048, 2048]
    - [93, 190.55]
  - - [1024, 2048, 1, 4096, 1024, 1024, 4096, 2048]
    - [94, 216.28]
  - - [1024, 2048, 1, 8192, 1024, 1024, 8192, 2048]
    - [93, 202.82]
  - - [1024, 4096, 1, 128, 1024, 1024, 128, 4096]
    - [20, 57.43]
  - - [1024, 4096, 1, 256, 1024, 1024, 256, 4096]
    - [19, 98.42]
  - - [1024, 4096, 1, 512, 1024, 1024, 512, 4096]
    - [14, 148.29]
  - - [1024, 4096, 1, 1024, 1024, 1024, 1024, 4096]
    - [16, 195.28]
  - - [1024, 4096, 1, 2048, 1024, 1024, 2048, 4096]
    - [74, 244.62]
  - - [1024, 4096, 1, 4096, 1024, 1024, 4096, 4096]
    - [68, 259.58]
  - - [1024, 4096, 1, 8192, 1024, 1024, 8192, 4096]
    - [74, 238.3]
  - - [1024, 8192, 1, 128, 1024, 1024, 128, 8192]
    - [5, 66.47]
  - - [1024, 8192, 1, 256, 1024, 1024, 256, 8192]
    - [5, 112.05]
  - - [1024, 8192, 1, 512, 1024, 1024, 512, 8192]
    - [5, 173.49]
  - - [1024, 8192, 1, 1024, 1024, 1024, 1024, 8192]
    - [7, 236.94]
  - - [1024, 8192, 1, 2048, 1024, 1024, 2048, 8192]
    - [8, 273.73]
  - - [1024, 8192, 1, 4096, 1024, 1024, 4096, 8192]
    - [5, 260.25]
  - - [1024, 8192, 1, 8192, 1024, 1024, 8192, 8192]
    - [1, 282.47]
  - - [2048, 128, 1, 128, 2048, 2048, 128, 128]
    - [86, 6.08]
  - - [2048, 128, 1, 256, 2048, 2048, 256, 128]
    - [52, 12.05]
  - - [2048, 128, 1, 512, 2048, 2048, 512, 128]
    - [62, 22.0]
  - - [2048, 128, 1, 1024, 2048, 2048, 1024, 128]
    - [110, 36.81]
  - - [2048, 128, 1, 2048, 2048, 2048, 2048, 128]
    - [110, 51.02]
  - - [2048, 128, 1, 4096, 2048, 2048, 4096, 128]
    - [113, 62.55]
  - - [2048, 128, 1, 8192, 2048, 2048, 8192, 128]
    - [131, 70.47]
  - - [2048, 256, 1, 128, 2048, 2048, 128, 256]
    - [89, 11.97]
  - - [2048, 256, 1, 256, 2048, 2048, 256, 256]
    - [127, 23.02]
  - - [2048, 256, 1, 512, 2048, 2048, 512, 256]
    - [55, 41.37]
  - - [2048, 256, 1, 1024, 2048, 2048, 1024, 256]
    - [104, 62.9]
  - - [2048, 256, 1, 2048, 2048, 2048, 2048, 256]
    - [129, 85.35]
  - - [2048, 256, 1, 4096, 2048, 2048, 4096, 256]
    - [126, 104.36]
  - - [2048, 256, 1, 8192, 2048, 2048, 8192, 256]
    - [128, 116.67]
  - - [2048, 512, 1, 128, 2048, 2048, 128, 512]
    - [40, 22.49]
  - - [2048, 512, 1, 256, 2048, 2048, 256, 512]
    - [37, 42.54]
  - - [2048, 512, 1, 512, 2048, 2048, 512, 512]
    - [47, 67.2]
  - - [2048, 512, 1, 1024, 2048, 2048, 1024, 512]
    - [51, 102.34]
  - - [2048, 512, 1, 2048, 2048, 2048, 2048, 512]
    - [51, 133.84]
  - - [2048, 512, 1, 4096, 2048, 2048, 4096, 512]
    - [124, 147.66]
  - - [2048, 512, 1, 8192, 2048, 2048, 8192, 512]
    - [122, 156.95]
  - - [2048, 1024, 1, 128, 2048, 2048, 128, 1024]
    - [83, 38.08]
  - - [2048, 1024, 1, 256, 2048, 2048, 256, 1024]
    - [24, 66.5]
  - - [2048, 1024, 1, 512, 2048, 2048, 512, 1024]
    - [93, 106.22]
  - - [2048, 1024, 1, 1024, 2048, 2048, 1024, 1024]
    - [94, 152.76]
  - - [2048, 1024, 1, 2048, 2048, 2048, 2048, 1024]
    - [94, 189.32]
  - - [2048, 1024, 1, 4096, 2048, 2048, 4096, 1024]
    - [94, 205.71]
  - - [2048, 1024, 1, 8192, 2048, 2048, 8192, 1024]
    - [94, 204.36]
  - - [2048, 2048, 1, 128, 2048, 2048, 128, 2048]
    - [15, 56.75]
  - - [2048, 2048, 1, 256, 2048, 2048, 256, 2048]
    - [16, 97.8]
  - - [2048, 2048, 1, 512, 2048, 2048, 512, 2048]
    - [16, 148.85]
  - - [2048, 2048, 1, 1024, 2048, 2048, 1024, 2048]
    - [16, 193.05]
  - - [2048, 2048, 1, 2048, 2048, 2048, 2048, 2048]
    - [75, 241.14]
  - - [2048, 2048, 1, 4096, 2048, 2048, 4096, 2048]
    - [72, 255.16]
  - - [2048, 2048, 1, 8192, 2048, 2048, 8192, 2048]
    - [76, 238.85]
  - - [2048, 4096, 1, 128, 2048, 2048, 128, 4096]
    - [2, 64.79]
  - - [2048, 4096, 1, 256, 2048, 2048, 256, 4096]
    - [2, 111.29]
  - - [2048, 4096, 1, 512, 2048, 2048, 512, 4096]
    - [1, 172.05]
  - - [2048, 4096, 1, 1024, 2048, 2048, 1024, 4096]
    - [5, 232.96]
  - - [2048, 4096, 1, 2048, 2048, 2048, 2048, 4096]
    - [6, 271.97]
  - - [2048, 4096, 1, 4096, 2048, 2048, 4096, 4096]
    - [9, 263.84]
  - - [2048, 4096, 1, 8192, 2048, 2048, 8192, 4096]
    - [4, 281.43]
  - - [2048, 8192, 1, 128, 2048, 2048, 128, 8192]
    - [2, 71.67]
  - - [2048, 8192, 1, 256, 2048, 2048, 256, 8192]
    - [1, 120.38]
  - - [2048, 8192, 1, 512, 2048, 2048, 512, 8192]
    - [5, 186.33]
  - - [2048, 8192, 1, 1024, 2048, 2048, 1024, 8192]
    - [9, 230.24]
  - - [2048, 8192, 1, 2048, 2048, 2048, 2048, 8192]
    - [11, 240.18]
  - - [2048, 8192, 1, 4096, 2048, 2048, 4096, 8192]
    - [6, 276.68]
  - - [2048, 8192, 1, 8192, 2048, 2048, 8192, 8192]
    - [73, 315.6]
  - - [4096, 128, 1, 128, 4096, 4096, 128, 128]
    - [29, 11.33]
  - - [4096, 128, 1, 256, 4096, 4096, 256, 128]
    - [50, 22.17]
  - - [4096, 128, 1, 512, 4096, 4096, 512, 128]
    - [103, 40.32]
  - - [4096, 128, 1, 1024, 4096, 4096, 1024, 128]
    - [125, 62.73]
  - - [4096, 128, 1, 2048, 4096, 4096, 2048, 128]
    - [102, 86.37]
  - - [4096, 128, 1, 4096, 4096, 4096, 4096, 128]
    - [126, 104.48]
  - - [4096, 128, 1, 8192, 4096, 4096, 8192, 128]
    - [125, 116.97]
  - - [4096, 256, 1, 128, 4096, 4096, 128, 256]
    - [90, 22.84]
  - - [4096, 256, 1, 256, 4096, 4096, 256, 256]
    - [32, 43.04]
  - - [4096, 256, 1, 512, 4096, 4096, 512, 256]
    - [46, 70.82]
  - - [4096, 256, 1, 1024, 4096, 4096, 1024, 256]
    - [48, 102.53]
  - - [4096, 256, 1, 2048, 4096, 4096, 2048, 256]
    - [51, 133.64]
  - - [4096, 256, 1, 4096, 4096, 4096, 4096, 256]
    - [122, 146.58]
  - - [4096, 256, 1, 8192, 4096, 4096, 8192, 256]
    - [123, 160.03]
  - - [4096, 512, 1, 128, 4096, 4096, 128, 512]
    - [24, 37.74]
  - - [4096, 512, 1, 256, 4096, 4096, 256, 512]
    - [84, 65.35]
  - - [4096, 512, 1, 512, 4096, 4096, 512, 512]
    - [95, 104.28]
  - - [4096, 512, 1, 1024, 4096, 4096, 1024, 512]
    - [96, 153.34]
  - - [4096, 512, 1, 2048, 4096, 4096, 2048, 512]
    - [95, 192.59]
  - - [4096, 512, 1, 4096, 4096, 4096, 4096, 512]
    - [95, 203.71]
  - - [4096, 512, 1, 8192, 4096, 4096, 8192, 512]
    - [96, 203.84]
  - - [4096, 1024, 1, 128, 4096, 4096, 128, 1024]
    - [19, 55.16]
  - - [4096, 1024, 1, 256, 4096, 4096, 256, 1024]
    - [19, 94.94]
  - - [4096, 1024, 1, 512, 4096, 4096, 512, 1024]
    - [12, 143.97]
  - - [4096, 1024, 1, 1024, 4096, 4096, 1024, 1024]
    - [13, 195.5]
  - - [4096, 1024, 1, 2048, 4096, 4096, 2048, 1024]
    - [70, 240.83]
  - - [4096, 1024, 1, 4096, 4096, 4096, 4096, 1024]
    - [72, 259.01]
  - - [4096, 1024, 1, 8192, 4096, 4096, 8192, 1024]
    - [72, 241.47]
  - - [4096, 2048, 1, 128, 4096, 4096, 128, 2048]
    - [3, 62.46]
  - - [4096, 2048, 1, 256, 4096, 4096, 256, 2048]
    - [5, 108.07]
  - - [4096, 2048, 1, 512, 4096, 4096, 512, 2048]
    - [5, 170.82]
  - - [4096, 2048, 1, 1024, 4096, 4096, 1024, 2048]
    - [9, 233.11]
  - - [4096, 2048, 1, 2048, 4096, 4096, 2048, 2048]
    - [5, 272.53]
  - - [4096, 2048, 1, 4096, 4096, 4096, 4096, 2048]
    - [77, 267.82]
  - - [4096, 2048, 1, 8192, 4096, 4096, 8192, 2048]
    - [78, 289.38]
  - - [4096, 4096, 1, 128, 4096, 4096, 128, 4096]
    - [14, 67.4]
  - - [4096, 4096, 1, 256, 4096, 4096, 256, 4096]
    - [0, 116.51]
  - - [4096, 4096, 1, 512, 4096, 4096, 512, 4096]
    - [4, 181.61]
  - - [4096, 4096, 1, 1024, 4096, 4096, 1024, 4096]
    - [9, 225.93]
  - - [4096, 4096, 1, 2048, 4096, 4096, 2048, 4096]
    - [13, 234.64]
  - - [4096, 4096, 1, 4096, 4096, 4096, 4096, 4096]
    - [77, 291.07]
  - - [4096, 4096, 1, 8192, 4096, 4096, 8192, 4096]
    - [77, 315.91]
  - - [4096, 8192, 1, 128, 4096, 4096, 128, 8192]
    - [17, 74.85]
  - - [4096, 8192, 1, 256, 4096, 4096, 256, 8192]
    - [2, 122.32]
  - - [4096, 8192, 1, 512, 4096, 4096, 512, 8192]
    - [10, 182.11]
  - - [4096, 8192, 1, 1024, 4096, 4096, 1024, 8192]
    - [69, 218.33]
  - - [4096, 8192, 1, 2048, 4096, 4096, 2048, 8192]
    - [71, 271.72]
  - - [4096, 8192, 1, 4096, 4096, 4096, 4096, 8192]
    - [1, 324.29]
  - - [4096, 8192, 1, 8192, 4096, 4096, 8192, 8192]
    - [2, 358.14]
  - - [8192, 128, 1, 128, 8192, 8192, 128, 128]
    - [35, 22.21]
  - - [8192, 128, 1, 256, 8192, 8192, 256, 128]
    - [44, 42.89]
  - - [8192, 128, 1, 512, 8192, 8192, 512, 128]
    - [46, 71.25]
  - - [8192, 128, 1, 1024, 8192, 8192, 1024, 128]
    - [48, 99.58]
  - - [8192, 128, 1, 2048, 8192, 8192, 2048, 128]
    - [122, 125.22]
  - - [8192, 128, 1, 4096, 8192, 8192, 4096, 128]
    - [100, 142.86]
  - - [8192, 128, 1, 8192, 8192, 8192, 8192, 128]
    - [128, 158.77]
  - - [8192, 256, 1, 128, 8192, 8192, 128, 256]
    - [25, 36.47]
  - - [8192, 256, 1, 256, 8192, 8192, 256, 256]
    - [27, 63.21]
  - - [8192, 256, 1, 512, 8192, 8192, 512, 256]
    - [27, 102.27]
  - - [8192, 256, 1, 1024, 8192, 8192, 1024, 256]
    - [96, 152.34]
  - - [8192, 256, 1, 2048, 8192, 8192, 2048, 256]
    - [96, 188.59]
  - - [8192, 256, 1, 4096, 8192, 8192, 4096, 256]
    - [96, 204.33]
  - - [8192, 256, 1, 8192, 8192, 8192, 8192, 256]
    - [95, 200.9]
  - - [8192, 512, 1, 128, 8192, 8192, 128, 512]
    - [18, 55.2]
  - - [8192, 512, 1, 256, 8192, 8192, 256, 512]
    - [18, 94.31]
  - - [8192, 512, 1, 512, 8192, 8192, 512, 512]
    - [92, 142.36]
  - - [8192, 512, 1, 1024, 8192, 8192, 1024, 512]
    - [91, 208.98]
  - - [8192, 512, 1, 2048, 8192, 8192, 2048, 512]
    - [91, 240.47]
  - - [8192, 512, 1, 4096, 8192, 8192, 4096, 512]
    - [92, 268.99]
  - - [8192, 512, 1, 8192, 8192, 8192, 8192, 512]
    - [91, 265.89]
  - - [8192, 1024, 1, 128, 8192, 8192, 128, 1024]
    - [9, 61.39]
  - - [8192, 1024, 1, 256, 8192, 8192, 256, 1024]
    - [82, 107.55]
  - - [8192, 1024, 1, 512, 8192, 8192, 512, 1024]
    - [82, 181.96]
  - - [8192, 1024, 1, 1024, 8192, 8192, 1024, 1024]
    - [7, 227.07]
  - - [8192, 1024, 1, 2048, 8192, 8192, 2048, 1024]
    - [80, 304.75]
  - - [8192, 1024, 1, 4096, 8192, 8192, 4096, 1024]
    - [78, 343.43]
  - - [8192, 1024, 1, 8192, 8192, 8192, 8192, 1024]
    - [78, 358.75]
  - - [8192, 2048, 1, 128, 8192, 8192, 128, 2048]
    - [79, 66.72]
  - - [8192, 2048, 1, 256, 8192, 8192, 256, 2048]
    - [82, 117.69]
  - - [8192, 2048, 1, 512, 8192, 8192, 512, 2048]
    - [7, 179.43]
  - - [8192, 2048, 1, 1024, 8192, 8192, 1024, 2048]
    - [82, 246.46]
  - - [8192, 2048, 1, 2048, 8192, 8192, 2048, 2048]
    - [82, 289.71]
  - - [8192, 2048, 1, 4096, 8192, 8192, 4096, 2048]
    - [82, 330.51]
  - - [8192, 2048, 1, 8192, 8192, 8192, 8192, 2048]
    - [78, 385.67]
  - - [8192, 4096, 1, 128, 8192, 8192, 128, 4096]
    - [82, 71.45]
  - - [8192, 4096, 1, 256, 8192, 8192, 256, 4096]
    - [81, 118.76]
  - - [8192, 4096, 1, 512, 8192, 8192, 512, 4096]
    - [82, 180.75]
  - - [8192, 4096, 1, 1024, 8192, 8192, 1024, 4096]
    - [80, 235.6]
  - - [8192, 4096, 1, 2048, 8192, 8192, 2048, 4096]
    - [82, 292.97]
  - - [8192, 4096, 1, 4096, 8192, 8192, 4096, 4096]
    - [80, 351.64]
  - - [8192, 4096, 1, 8192, 8192, 8192, 8192, 4096]
    - [78, 400.96]
  - - [8192, 8192, 1, 128, 8192, 8192, 128, 8192]
    - [22, 64.94]
  - - [8192, 8192, 1, 256, 8192, 8192, 256, 8192]
    - [14, 118.35]
  - - [8192, 8192, 1, 512, 8192, 8192, 512, 8192]
    - [8, 166.83]
  - - [8192, 8192, 1, 1024, 8192, 8192, 1024, 8192]
    - [9, 237.95]
  - - [8192, 8192, 1, 2048, 8192, 8192, 2048, 8192]
    - [80, 307.0]
  - - [8192, 8192, 1, 4096, 8192, 8192, 4096, 8192]
    - [80, 365.86]
  - - [8192, 8192, 1, 8192, 8192, 8192, 8192, 8192]
    - [78, 400.56]
- null
- null
- ExperimentalStreamK
- GridBased
