projects/hipblaslt/library/src/amd_detail/rocblaslt/src/Tensile/Logic/asm_full/aquavanjaram/gfx942_228cu/StreamK/aquavanjaram942_Cijk_Ailk_Bjlk_F8B8NSS_BH_Bias_HAS_SAV_UserArgs.yaml
- {MinimumRequiredVersion: 4.33.0}
- aquavanjaram942
- {Architecture: gfx942, CUCount: 228}
- [Device 0049, Device 0050]
    SolutionIndex: 0
    SolutionNameMin: Cijk_Ailk_Bjlk_F8B8NSS_BH_Bias_HAS_SAV_UserArgs_MT256x256x64_MI16x16x1_SN_LDSB0_CLR1_GRVWA4_GRVWB4_GSU0_GSUC0_GSUWGMRR0_K1_LBSPPA2048_LBSPPB2048_LPA0_LPB0_MIWT8_8_PLR1_SU0_SUM0_SUS64_VWA8_VWB8_WGM1_WGMXCC1_WGMXCCGn1
    SolutionIndex: 1
    SolutionNameMin: Cijk_Ailk_Bjlk_F8B8NSS_BH_Bias_HAS_SAV_UserArgs_MT256x256x64_MI16x16x1_SN_LDSB0_CLR1_GRVWA4_GRVWB8_GSU0_GSUC0_GSUWGMRR0_K1_LBSPPA2048_LBSPPB2048_LPA0_LPB0_MIWT8_8_PLR1_SU0_SUM0_SUS64_VWA8_VWB8_WGM1_WGMXCC1_WGMXCCGn1
    SolutionIndex: 2
    SolutionNameMin: Cijk_Ailk_Bjlk_F8B8NSS_BH_Bias_HAS_SAV_UserArgs_MT256x256x64_MI16x16x1_SN_LDSB0_CLR1_GRVWA4_GRVWB16_GSU0_GSUC0_GSUWGMRR0_K1_LBSPPA2048_LBSPPB2048_LPA0_LPB0_MIWT8_8_PLR1_SU0_SUM0_SUS64_VWA8_VWB8_WGM1_WGMXCC1_WGMXCCGn1
    SolutionIndex: 3
    SolutionNameMin: Cijk_Ailk_Bjlk_F8B8NSS_BH_Bias_HAS_SAV_UserArgs_MT256x256x64_MI16x16x1_SN_LDSB0_CLR1_GRVWA16_GRVWB16_GSU0_GSUC0_GSUWGMRR0_K1_LBSPPA2048_LBSPPB2048_LPA0_LPB0_MIWT8_8_PLR1_SU0_SUM0_SUS64_VWA8_VWB8_WGM1_WGMXCC1_WGMXCCGn1
    SolutionIndex: 4
    SolutionNameMin: Cijk_Ailk_Bjlk_F8B8NSS_BH_Bias_HAS_SAV_UserArgs_MT256x256x64_MI16x16x1_SN_LDSB0_CLR1_GRVWA16_GRVWB4_GSU0_GSUC0_GSUWGMRR0_K1_LBSPPA2048_LBSPPB2048_LPA0_LPB0_MIWT8_8_PLR1_SU0_SUM0_SUS64_VWA8_VWB8_WGM4_WGMXCC1_WGMXCCGn1
    SolutionIndex: 5
    SolutionNameMin: Cijk_Ailk_Bjlk_F8B8NSS_BH_Bias_HAS_SAV_UserArgs_MT256x256x64_MI16x16x1_SN_LDSB0_CLR1_GRVWA4_GRVWB4_GSU0_GSUC0_GSUWGMRR0_K1_LBSPPA2048_LBSPPB2048_LPA0_LPB0_MIWT8_8_PLR1_SU0_SUM0_SUS64_VWA8_VWB8_WGM6_WGMXCC1_WGMXCCGn1
    SolutionIndex: 6
    SolutionNameMin: Cijk_Ailk_Bjlk_F8B8NSS_BH_Bias_HAS_SAV_UserArgs_MT256x256x64_MI16x16x1_SN_LDSB0_CLR1_GRVWA8_GRVWB16_GSU0_GSUC0_GSUWGMRR0_K1_LBSPPA2048_LBSPPB2048_LPA0_LPB0_MIWT8_8_PLR1_SU0_SUM0_SUS64_VWA8_VWB8_WGM6_WGMXCC1_WGMXCCGn1
    SolutionIndex: 7
    SolutionNameMin: Cijk_Ailk_Bjlk_F8B8NSS_BH_Bias_HAS_SAV_UserArgs_MT256x256x64_MI16x16x1_SN_LDSB0_CLR1_GRVWA16_GRVWB16_GSU0_GSUC0_GSUWGMRR0_K1_LBSPPA2048_LBSPPB2048_LPA0_LPB0_MIWT8_8_PLR1_SU0_SUM0_SUS64_VWA8_VWB8_WGM6_WGMXCC1_WGMXCCGn1
    SolutionIndex: 8
    SolutionNameMin: Cijk_Ailk_Bjlk_F8B8NSS_BH_Bias_HAS_SAV_UserArgs_MT128x256x64_MI16x16x1_SN_LDSB1_CLR1_GRVWA8_GRVWB4_GSU0_GSUC0_GSUWGMRR0_K1_LBSPPA1024_LBSPPB2048_LPA64_LPB0_MIWT4_8_PLR1_SU0_SUM0_SUS64_VWA4_VWB8_WGM1_WGMXCC1_WGMXCCGn1
    SolutionIndex: 9
    SolutionNameMin: Cijk_Ailk_Bjlk_F8B8NSS_BH_Bias_HAS_SAV_UserArgs_MT128x256x64_MI16x16x1_SN_LDSB1_CLR1_GRVWA16_GRVWB8_GSU0_GSUC0_GSUWGMRR0_K1_LBSPPA1024_LBSPPB2048_LPA64_LPB0_MIWT4_8_PLR1_SU0_SUM0_SUS64_VWA4_VWB8_WGM1_WGMXCC1_WGMXCCGn1
    SolutionIndex: 10
    SolutionNameMin: Cijk_Ailk_Bjlk_F8B8NSS_BH_Bias_HAS_SAV_UserArgs_MT128x256x64_MI16x16x1_SN_LDSB1_CLR1_GRVWA4_GRVWB16_GSU0_GSUC0_GSUWGMRR0_K1_LBSPPA1024_LBSPPB2048_LPA64_LPB0_MIWT4_8_PLR1_SU0_SUM0_SUS64_VWA4_VWB8_WGM1_WGMXCC1_WGMXCCGn1
    SolutionIndex: 11
    SolutionNameMin: Cijk_Ailk_Bjlk_F8B8NSS_BH_Bias_HAS_SAV_UserArgs_MT128x256x64_MI16x16x1_SN_LDSB1_CLR1_GRVWA8_GRVWB16_GSU0_GSUC0_GSUWGMRR0_K1_LBSPPA1024_LBSPPB2048_LPA64_LPB0_MIWT4_8_PLR1_SU0_SUM0_SUS64_VWA4_VWB8_WGM1_WGMXCC1_WGMXCCGn1
    SolutionIndex: 12
    SolutionNameMin: Cijk_Ailk_Bjlk_F8B8NSS_BH_Bias_HAS_SAV_UserArgs_MT128x256x64_MI16x16x1_SN_LDSB1_CLR1_GRVWA16_GRVWB16_GSU0_GSUC0_GSUWGMRR0_K1_LBSPPA1024_LBSPPB2048_LPA64_LPB0_MIWT4_8_PLR1_SU0_SUM0_SUS64_VWA4_VWB8_WGM1_WGMXCC1_WGMXCCGn1
    SolutionIndex: 13
    SolutionNameMin: Cijk_Ailk_Bjlk_F8B8NSS_BH_Bias_HAS_SAV_UserArgs_MT128x256x64_MI16x16x1_SN_LDSB1_CLR1_GRVWA4_GRVWB16_GSU0_GSUC0_GSUWGMRR0_K1_LBSPPA1024_LBSPPB2048_LPA64_LPB0_MIWT4_8_PLR1_SU0_SUM0_SUS64_VWA4_VWB8_WGM4_WGMXCC1_WGMXCCGn1
    SolutionIndex: 14
    SolutionNameMin: Cijk_Ailk_Bjlk_F8B8NSS_BH_Bias_HAS_SAV_UserArgs_MT128x256x64_MI16x16x1_SN_LDSB1_CLR1_GRVWA16_GRVWB16_GSU0_GSUC0_GSUWGMRR0_K1_LBSPPA1024_LBSPPB2048_LPA64_LPB0_MIWT4_8_PLR1_SU0_SUM0_SUS64_VWA4_VWB8_WGM4_WGMXCC1_WGMXCCGn1
    SolutionIndex: 15
    SolutionNameMin: Cijk_Ailk_Bjlk_F8B8NSS_BH_Bias_HAS_SAV_UserArgs_MT128x256x64_MI16x16x1_SN_LDSB1_CLR1_GRVWA4_GRVWB8_GSU0_GSUC0_GSUWGMRR0_K1_LBSPPA1024_LBSPPB2048_LPA64_LPB0_MIWT4_8_PLR1_SU0_SUM0_SUS64_VWA4_VWB8_WGM6_WGMXCC1_WGMXCCGn1
    SolutionIndex: 16
    SolutionNameMin: Cijk_Ailk_Bjlk_F8B8NSS_BH_Bias_HAS_SAV_UserArgs_MT128x256x64_MI16x16x1_SN_LDSB1_CLR1_GRVWA4_GRVWB16_GSU0_GSUC0_GSUWGMRR0_K1_LBSPPA1024_LBSPPB2048_LPA64_LPB0_MIWT4_8_PLR1_SU0_SUM0_SUS64_VWA4_VWB8_WGM6_WGMXCC1_WGMXCCGn1
    SolutionIndex: 17
    SolutionNameMin: Cijk_Ailk_Bjlk_F8B8NSS_BH_Bias_HAS_SAV_UserArgs_MT128x256x64_MI16x16x1_SN_LDSB1_CLR1_GRVWA16_GRVWB16_GSU0_GSUC0_GSUWGMRR0_K1_LBSPPA1024_LBSPPB2048_LPA64_LPB0_MIWT4_8_PLR1_SU0_SUM0_SUS64_VWA4_VWB8_WGM6_WGMXCC1_WGMXCCGn1
    SolutionIndex: 18
    SolutionNameMin: Cijk_Ailk_Bjlk_F8B8NSS_BH_Bias_HAS_SAV_UserArgs_MT128x256x64_MI16x16x1_SN_LDSB1_CLR1_GRVWA4_GRVWB16_GSU0_GSUC0_GSUWGMRR0_K1_LBSPPA1024_LBSPPB2048_LPA64_LPB0_MIWT4_8_PLR1_SU0_SUM0_SUS64_VWA4_VWB8_WGM8_WGMXCC1_WGMXCCGn1
    SolutionIndex: 19
    SolutionNameMin: Cijk_Ailk_Bjlk_F8B8NSS_BH_Bias_HAS_SAV_UserArgs_MT128x256x64_MI16x16x1_SN_LDSB1_CLR1_GRVWA16_GRVWB16_GSU0_GSUC0_GSUWGMRR0_K1_LBSPPA1024_LBSPPB2048_LPA64_LPB0_MIWT4_8_PLR1_SU0_SUM0_SUS64_VWA4_VWB8_WGM8_WGMXCC1_WGMXCCGn1
    SolutionIndex: 20
    SolutionNameMin: Cijk_Ailk_Bjlk_F8B8NSS_BH_Bias_HAS_SAV_UserArgs_MT256x144x64_MI16x16x1_SN_LDSB0_CLR1_GRVWA4_GRVWB4_GSU0_GSUC0_GSUWGMRR0_K1_LBSPPA2048_LBSPPB1152_LPA64_LPB16_MIWT4_9_PLR1_SU0_SUM0_SUS64_VWA4_VWB1_WGM1_WGMXCC1_WGMXCCGn1
    SolutionIndex: 21
    SolutionNameMin: Cijk_Ailk_Bjlk_F8B8NSS_BH_Bias_HAS_SAV_UserArgs_MT256x144x64_MI16x16x1_SN_LDSB0_CLR1_GRVWA8_GRVWB4_GSU0_GSUC0_GSUWGMRR0_K1_LBSPPA2048_LBSPPB1152_LPA64_LPB16_MIWT4_9_PLR1_SU0_SUM0_SUS64_VWA4_VWB1_WGM1_WGMXCC1_WGMXCCGn1
    SolutionIndex: 22
    SolutionNameMin: Cijk_Ailk_Bjlk_F8B8NSS_BH_Bias_HAS_SAV_UserArgs_MT256x144x64_MI16x16x1_SN_LDSB0_CLR1_GRVWA16_GRVWB4_GSU0_GSUC0_GSUWGMRR0_K1_LBSPPA2048_LBSPPB1152_LPA64_LPB16_MIWT4_9_PLR1_SU0_SUM0_SUS64_VWA4_VWB1_WGM1_WGMXCC1_WGMXCCGn1
    SolutionIndex: 23
    SolutionNameMin: Cijk_Ailk_Bjlk_F8B8NSS_BH_Bias_HAS_SAV_UserArgs_MT256x144x64_MI16x16x1_SN_LDSB0_CLR1_GRVWA4_GRVWB4_GSU0_GSUC0_GSUWGMRR0_K1_LBSPPA2048_LBSPPB1152_LPA64_LPB16_MIWT4_9_PLR1_SU0_SUM0_SUS64_VWA4_VWB1_WGM4_WGMXCC1_WGMXCCGn1
    SolutionIndex: 24
    SolutionNameMin: Cijk_Ailk_Bjlk_F8B8NSS_BH_Bias_HAS_SAV_UserArgs_MT256x144x64_MI16x16x1_SN_LDSB0_CLR1_GRVWA16_GRVWB4_GSU0_GSUC0_GSUWGMRR0_K1_LBSPPA2048_LBSPPB1152_LPA64_LPB16_MIWT4_9_PLR1_SU0_SUM0_SUS64_VWA4_VWB1_WGM4_WGMXCC1_WGMXCCGn1
    SolutionIndex: 25
    SolutionNameMin: Cijk_Ailk_Bjlk_F8B8NSS_BH_Bias_HAS_SAV_UserArgs_MT256x144x64_MI16x16x1_SN_LDSB0_CLR1_GRVWA4_GRVWB4_GSU0_GSUC0_GSUWGMRR0_K1_LBSPPA2048_LBSPPB1152_LPA64_LPB16_MIWT4_9_PLR1_SU0_SUM0_SUS64_VWA4_VWB1_WGM8_WGMXCC1_WGMXCCGn1
    SolutionIndex: 26
    SolutionNameMin: Cijk_Ailk_Bjlk_F8B8NSS_BH_Bias_HAS_SAV_UserArgs_MT256x128x64_MI16x16x1_SN_LDSB1_CLR1_GRVWA4_GRVWB4_GSU0_GSUC0_GSUWGMRR0_K1_LBSPPA2048_LBSPPB1024_LPA0_LPB64_MIWT8_4_PLR1_SU0_SUM0_SUS64_VWA8_VWB4_WGM1_WGMXCC1_WGMXCCGn1
    SolutionIndex: 27
    SolutionNameMin: Cijk_Ailk_Bjlk_F8B8NSS_BH_Bias_HAS_SAV_UserArgs_MT256x128x64_MI16x16x1_SN_LDSB1_CLR1_GRVWA16_GRVWB4_GSU0_GSUC0_GSUWGMRR0_K1_LBSPPA2048_LBSPPB1024_LPA0_LPB64_MIWT8_4_PLR1_SU0_SUM0_SUS64_VWA8_VWB4_WGM1_WGMXCC1_WGMXCCGn1
    SolutionIndex: 28
    SolutionNameMin: Cijk_Ailk_Bjlk_F8B8NSS_BH_Bias_HAS_SAV_UserArgs_MT144x256x64_MI16x16x1_SN_LDSB0_CLR1_GRVWA4_GRVWB16_GSU0_GSUC0_GSUWGMRR0_K1_LBSPPA1152_LBSPPB2048_LPA16_LPB64_MIWT9_4_PLR1_SU0_SUM0_SUS64_VWA1_VWB4_WGM1_WGMXCC1_WGMXCCGn1
    SolutionIndex: 29
    SolutionNameMin: Cijk_Ailk_Bjlk_F8B8NSS_BH_Bias_HAS_SAV_UserArgs_MT144x256x64_MI16x16x1_SN_LDSB0_CLR1_GRVWA4_GRVWB16_GSU0_GSUC0_GSUWGMRR0_K1_LBSPPA1152_LBSPPB2048_LPA16_LPB64_MIWT9_4_PLR1_SU0_SUM0_SUS64_VWA1_VWB4_WGM4_WGMXCC1_WGMXCCGn1
    SolutionIndex: 30
    SolutionNameMin: Cijk_Ailk_Bjlk_F8B8NSS_BH_Bias_HAS_SAV_UserArgs_MT144x256x64_MI16x16x1_SN_LDSB0_CLR1_GRVWA4_GRVWB16_GSU0_GSUC0_GSUWGMRR0_K1_LBSPPA1152_LBSPPB2048_LPA16_LPB64_MIWT9_4_PLR1_SU0_SUM0_SUS64_VWA1_VWB4_WGM6_WGMXCC1_WGMXCCGn1
    SolutionIndex: 31
    SolutionNameMin: Cijk_Ailk_Bjlk_F8B8NSS_BH_Bias_HAS_SAV_UserArgs_MT144x256x64_MI16x16x1_SN_LDSB0_CLR1_GRVWA4_GRVWB16_GSU0_GSUC0_GSUWGMRR0_K1_LBSPPA1152_LBSPPB2048_LPA16_LPB64_MIWT9_4_PLR1_SU0_SUM0_SUS64_VWA1_VWB4_WGM8_WGMXCC1_WGMXCCGn1
    SolutionIndex: 32
    SolutionNameMin: Cijk_Ailk_Bjlk_F8B8NSS_BH_Bias_HAS_SAV_UserArgs_MT128x128x64_MI16x16x1_SN_LDSB1_CLR1_GRVWA4_GRVWB4_GSU0_GSUC0_GSUWGMRR0_K1_LBSPPA1024_LBSPPB1024_LPA64_LPB64_MIWT4_4_PLR1_SU0_SUM0_SUS64_VWA4_VWB4_WGM1_WGMXCC1_WGMXCCGn1
    SolutionIndex: 33
    SolutionNameMin: Cijk_Ailk_Bjlk_F8B8NSS_BH_Bias_HAS_SAV_UserArgs_MT128x128x64_MI16x16x1_SN_LDSB1_CLR1_GRVWA4_GRVWB8_GSU0_GSUC0_GSUWGMRR0_K1_LBSPPA1024_LBSPPB1024_LPA64_LPB64_MIWT4_4_PLR1_SU0_SUM0_SUS64_VWA4_VWB4_WGM1_WGMXCC1_WGMXCCGn1
    SolutionIndex: 34
    SolutionNameMin: Cijk_Ailk_Bjlk_F8B8NSS_BH_Bias_HAS_SAV_UserArgs_MT128x128x64_MI16x16x1_SN_LDSB1_CLR1_GRVWA16_GRVWB8_GSU0_GSUC0_GSUWGMRR0_K1_LBSPPA1024_LBSPPB1024_LPA64_LPB64_MIWT4_4_PLR1_SU0_SUM0_SUS64_VWA4_VWB4_WGM1_WGMXCC1_WGMXCCGn1
    SolutionIndex: 35
    SolutionNameMin: Cijk_Ailk_Bjlk_F8B8NSS_BH_Bias_HAS_SAV_UserArgs_MT128x128x64_MI16x16x1_SN_LDSB1_CLR1_GRVWA4_GRVWB16_GSU0_GSUC0_GSUWGMRR0_K1_LBSPPA1024_LBSPPB1024_LPA64_LPB64_MIWT4_4_PLR1_SU0_SUM0_SUS64_VWA4_VWB4_WGM1_WGMXCC1_WGMXCCGn1
    SolutionIndex: 36
    SolutionNameMin: Cijk_Ailk_Bjlk_F8B8NSS_BH_Bias_HAS_SAV_UserArgs_MT128x128x64_MI16x16x1_SN_LDSB1_CLR1_GRVWA16_GRVWB16_GSU0_GSUC0_GSUWGMRR0_K1_LBSPPA1024_LBSPPB1024_LPA64_LPB64_MIWT4_4_PLR1_SU0_SUM0_SUS64_VWA4_VWB4_WGM1_WGMXCC1_WGMXCCGn1
    SolutionIndex: 37
    SolutionNameMin: Cijk_Ailk_Bjlk_F8B8NSS_BH_Bias_HAS_SAV_UserArgs_MT128x128x64_MI16x16x1_SN_LDSB1_CLR1_GRVWA4_GRVWB8_GSU0_GSUC0_GSUWGMRR0_K1_LBSPPA1024_LBSPPB1024_LPA64_LPB64_MIWT4_4_PLR1_SU0_SUM0_SUS64_VWA4_VWB4_WGM4_WGMXCC1_WGMXCCGn1
    SolutionIndex: 38
    SolutionNameMin: Cijk_Ailk_Bjlk_F8B8NSS_BH_Bias_HAS_SAV_UserArgs_MT128x128x64_MI16x16x1_SN_LDSB1_CLR1_GRVWA16_GRVWB8_GSU0_GSUC0_GSUWGMRR0_K1_LBSPPA1024_LBSPPB1024_LPA64_LPB64_MIWT4_4_PLR1_SU0_SUM0_SUS64_VWA4_VWB4_WGM4_WGMXCC1_WGMXCCGn1
    SolutionIndex: 39
    SolutionNameMin: Cijk_Ailk_Bjlk_F8B8NSS_BH_Bias_HAS_SAV_UserArgs_MT128x128x64_MI16x16x1_SN_LDSB1_CLR1_GRVWA16_GRVWB16_GSU0_GSUC0_GSUWGMRR0_K1_LBSPPA1024_LBSPPB1024_LPA64_LPB64_MIWT4_4_PLR1_SU0_SUM0_SUS64_VWA4_VWB4_WGM4_WGMXCC1_WGMXCCGn1
    SolutionIndex: 40
    SolutionNameMin: Cijk_Ailk_Bjlk_F8B8NSS_BH_Bias_HAS_SAV_UserArgs_MT128x128x64_MI16x16x1_SN_LDSB1_CLR1_GRVWA16_GRVWB16_GSU0_GSUC0_GSUWGMRR0_K1_LBSPPA1024_LBSPPB1024_LPA64_LPB64_MIWT4_4_PLR1_SU0_SUM0_SUS64_VWA4_VWB4_WGM6_WGMXCC1_WGMXCCGn1
    SolutionIndex: 41
    SolutionNameMin: Cijk_Ailk_Bjlk_F8B8NSS_BH_Bias_HAS_SAV_UserArgs_MT128x128x64_MI16x16x1_SN_LDSB1_CLR1_GRVWA4_GRVWB8_GSU0_GSUC0_GSUWGMRR0_K1_LBSPPA1024_LBSPPB1024_LPA64_LPB64_MIWT4_4_PLR1_SU0_SUM0_SUS64_VWA4_VWB4_WGM8_WGMXCC1_WGMXCCGn1
    SolutionIndex: 42
    SolutionNameMin: Cijk_Ailk_Bjlk_F8B8NSS_BH_Bias_HAS_SAV_UserArgs_MT128x128x64_MI16x16x1_SN_LDSB1_CLR1_GRVWA16_GRVWB8_GSU0_GSUC0_GSUWGMRR0_K1_LBSPPA1024_LBSPPB1024_LPA64_LPB64_MIWT4_4_PLR1_SU0_SUM0_SUS64_VWA4_VWB4_WGM8_WGMXCC1_WGMXCCGn1
    SolutionIndex: 43
    SolutionNameMin: Cijk_Ailk_Bjlk_F8B8NSS_BH_Bias_HAS_SAV_UserArgs_MT128x128x64_MI16x16x1_SN_LDSB1_CLR1_GRVWA8_GRVWB16_GSU0_GSUC0_GSUWGMRR0_K1_LBSPPA1024_LBSPPB1024_LPA64_LPB64_MIWT4_4_PLR1_SU0_SUM0_SUS64_VWA4_VWB4_WGM8_WGMXCC1_WGMXCCGn1
    SolutionIndex: 44
    SolutionNameMin: Cijk_Ailk_Bjlk_F8B8NSS_BH_Bias_HAS_SAV_UserArgs_MT128x128x64_MI16x16x1_SN_LDSB1_CLR1_GRVWA16_GRVWB16_GSU0_GSUC0_GSUWGMRR0_K1_LBSPPA1024_LBSPPB1024_LPA64_LPB64_MIWT4_4_PLR1_SU0_SUM0_SUS64_VWA4_VWB4_WGM8_WGMXCC1_WGMXCCGn1
    SolutionIndex: 45
    SolutionNameMin: Cijk_Ailk_Bjlk_F8B8NSS_BH_Bias_HAS_SAV_UserArgs_MT64x128x64_MI16x16x1_SN_LDSB0_CLR1_GRVWA4_GRVWB8_GSU0_GSUC0_GSUWGMRR0_K1_LBSPPA512_LBSPPB1024_LPA32_LPB64_MIWT2_4_PLR1_SU0_SUM0_SUS64_VWA2_VWB4_WGM1_WGMXCC1_WGMXCCGn1
    SolutionIndex: 46
    SolutionNameMin: Cijk_Ailk_Bjlk_F8B8NSS_BH_Bias_HAS_SAV_UserArgs_MT64x128x64_MI16x16x1_SN_LDSB0_CLR1_GRVWA8_GRVWB16_GSU0_GSUC0_GSUWGMRR0_K1_LBSPPA512_LBSPPB1024_LPA32_LPB64_MIWT2_4_PLR1_SU0_SUM0_SUS64_VWA2_VWB4_WGM1_WGMXCC1_WGMXCCGn1
    SolutionIndex: 47
    SolutionNameMin: Cijk_Ailk_Bjlk_F8B8NSS_BH_Bias_HAS_SAV_UserArgs_MT64x128x64_MI16x16x1_SN_LDSB0_CLR1_GRVWA16_GRVWB16_GSU0_GSUC0_GSUWGMRR0_K1_LBSPPA512_LBSPPB1024_LPA32_LPB64_MIWT2_4_PLR1_SU0_SUM0_SUS64_VWA2_VWB4_WGM1_WGMXCC1_WGMXCCGn1
    SolutionIndex: 48
    SolutionNameMin: Cijk_Ailk_Bjlk_F8B8NSS_BH_Bias_HAS_SAV_UserArgs_MT128x64x64_MI16x16x1_SN_LDSB0_CLR1_GRVWA4_GRVWB4_GSU0_GSUC0_GSUWGMRR0_K1_LBSPPA1024_LBSPPB512_LPA64_LPB32_MIWT4_2_PLR1_SU0_SUM0_SUS64_VWA4_VWB2_WGM1_WGMXCC1_WGMXCCGn1
    SolutionIndex: 49
    SolutionNameMin: Cijk_Ailk_Bjlk_F8B8NSS_BH_Bias_HAS_SAV_UserArgs_MT128x64x64_MI16x16x1_SN_LDSB0_CLR1_GRVWA16_GRVWB4_GSU0_GSUC0_GSUWGMRR0_K1_LBSPPA1024_LBSPPB512_LPA64_LPB32_MIWT4_2_PLR1_SU0_SUM0_SUS64_VWA4_VWB2_WGM1_WGMXCC1_WGMXCCGn1
    SolutionIndex: 50
    SolutionNameMin: Cijk_Ailk_Bjlk_F8B8NSS_BH_Bias_HAS_SAV_UserArgs_MT128x64x64_MI16x16x1_SN_LDSB0_CLR1_GRVWA4_GRVWB8_GSU0_GSUC0_GSUWGMRR0_K1_LBSPPA1024_LBSPPB512_LPA64_LPB32_MIWT4_2_PLR1_SU0_SUM0_SUS64_VWA4_VWB2_WGM1_WGMXCC1_WGMXCCGn1
    SolutionIndex: 51
    SolutionNameMin: Cijk_Ailk_Bjlk_F8B8NSS_BH_Bias_HAS_SAV_UserArgs_MT128x64x64_MI16x16x1_SN_LDSB0_CLR1_GRVWA16_GRVWB8_GSU0_GSUC0_GSUWGMRR0_K1_LBSPPA1024_LBSPPB512_LPA64_LPB32_MIWT4_2_PLR1_SU0_SUM0_SUS64_VWA4_VWB2_WGM1_WGMXCC1_WGMXCCGn1
    SolutionIndex: 52
    SolutionNameMin: Cijk_Ailk_Bjlk_F8B8NSS_BH_Bias_HAS_SAV_UserArgs_MT128x64x64_MI16x16x1_SN_LDSB0_CLR1_GRVWA4_GRVWB4_GSU0_GSUC0_GSUWGMRR0_K1_LBSPPA1024_LBSPPB512_LPA64_LPB32_MIWT4_2_PLR1_SU0_SUM0_SUS64_VWA4_VWB2_WGM4_WGMXCC1_WGMXCCGn1
    SolutionIndex: 53
    SolutionNameMin: Cijk_Ailk_Bjlk_F8B8NSS_BH_Bias_HAS_SAV_UserArgs_MT128x64x64_MI16x16x1_SN_LDSB0_CLR1_GRVWA4_GRVWB8_GSU0_GSUC0_GSUWGMRR0_K1_LBSPPA1024_LBSPPB512_LPA64_LPB32_MIWT4_2_PLR1_SU0_SUM0_SUS64_VWA4_VWB2_WGM6_WGMXCC1_WGMXCCGn1
    SolutionIndex: 54
    SolutionNameMin: Cijk_Ailk_Bjlk_F8B8NSS_BH_Bias_HAS_SAV_UserArgs_MT32x128x64_MI16x16x1_SN_LDSB0_CLR1_GRVWA4_GRVWB8_GSU0_GSUC0_GSUWGMRR0_K1_LBSPPA256_LBSPPB1024_LPA16_LPB64_MIWT1_4_PLR1_SU0_SUM0_SUS64_VWA1_VWB4_WGM1_WGMXCC1_WGMXCCGn1
    SolutionIndex: 55
    SolutionNameMin: Cijk_Ailk_Bjlk_F8B8NSS_BH_Bias_HAS_SAV_UserArgs_MT128x32x64_MI16x16x1_SN_LDSB0_CLR1_GRVWA4_GRVWB4_GSU0_GSUC0_GSUWGMRR0_K1_LBSPPA1024_LBSPPB256_LPA64_LPB16_MIWT4_1_PLR1_SU0_SUM0_SUS64_VWA4_VWB1_WGM1_WGMXCC1_WGMXCCGn1
    SolutionIndex: 56
    SolutionNameMin: Cijk_Ailk_Bjlk_F8B8NSS_BH_Bias_HAS_SAV_UserArgs_MT128x32x64_MI16x16x1_SN_LDSB0_CLR1_GRVWA8_GRVWB4_GSU0_GSUC0_GSUWGMRR0_K1_LBSPPA1024_LBSPPB256_LPA64_LPB16_MIWT4_1_PLR1_SU0_SUM0_SUS64_VWA4_VWB1_WGM1_WGMXCC1_WGMXCCGn1
    SolutionIndex: 57
    SolutionNameMin: Cijk_Ailk_Bjlk_F8B8NSS_BH_Bias_HAS_SAV_UserArgs_MT128x32x64_MI16x16x1_SN_LDSB0_CLR1_GRVWA16_GRVWB4_GSU0_GSUC0_GSUWGMRR0_K1_LBSPPA1024_LBSPPB256_LPA64_LPB16_MIWT4_1_PLR1_SU0_SUM0_SUS64_VWA4_VWB1_WGM1_WGMXCC1_WGMXCCGn1
    SolutionIndex: 58
    SolutionNameMin: Cijk_Ailk_Bjlk_F8B8NSS_BH_Bias_HAS_SAV_UserArgs_MT128x32x64_MI16x16x1_SN_LDSB0_CLR1_GRVWA4_GRVWB8_GSU0_GSUC0_GSUWGMRR0_K1_LBSPPA1024_LBSPPB256_LPA64_LPB16_MIWT4_1_PLR1_SU0_SUM0_SUS64_VWA4_VWB1_WGM1_WGMXCC1_WGMXCCGn1
    SolutionIndex: 59
    SolutionNameMin: Cijk_Ailk_Bjlk_F8B8NSS_BH_Bias_HAS_SAV_UserArgs_MT128x32x64_MI16x16x1_SN_LDSB0_CLR1_GRVWA16_GRVWB8_GSU0_GSUC0_GSUWGMRR0_K1_LBSPPA1024_LBSPPB256_LPA64_LPB16_MIWT4_1_PLR1_SU0_SUM0_SUS64_VWA4_VWB1_WGM8_WGMXCC1_WGMXCCGn1
    SolutionIndex: 60
    SolutionNameMin: Cijk_Ailk_Bjlk_F8B8NSS_BH_Bias_HAS_SAV_UserArgs_MT64x64x64_MI16x16x1_SN_LDSB0_CLR1_GRVWA4_GRVWB4_GSU0_GSUC0_GSUWGMRR0_K1_LBSPPA512_LBSPPB512_LPA32_LPB32_MIWT2_2_PLR1_SU0_SUM0_SUS64_VWA2_VWB2_WGM1_WGMXCC1_WGMXCCGn1
    SolutionIndex: 61
    SolutionNameMin: Cijk_Ailk_Bjlk_F8B8NSS_BH_Bias_HAS_SAV_UserArgs_MT64x64x64_MI16x16x1_SN_LDSB0_CLR1_GRVWA4_GRVWB8_GSU0_GSUC0_GSUWGMRR0_K1_LBSPPA512_LBSPPB512_LPA32_LPB32_MIWT2_2_PLR1_SU0_SUM0_SUS64_VWA2_VWB2_WGM1_WGMXCC1_WGMXCCGn1
    SolutionIndex: 62
    SolutionNameMin: Cijk_Ailk_Bjlk_F8B8NSS_BH_Bias_HAS_SAV_UserArgs_MT64x64x64_MI16x16x1_SN_LDSB0_CLR1_GRVWA8_GRVWB8_GSU0_GSUC0_GSUWGMRR0_K1_LBSPPA512_LBSPPB512_LPA32_LPB32_MIWT2_2_PLR1_SU0_SUM0_SUS64_VWA2_VWB2_WGM6_WGMXCC1_WGMXCCGn1
    SolutionIndex: 63
    SolutionNameMin: Cijk_Ailk_Bjlk_F8B8NSS_BH_Bias_HAS_SAV_UserArgs_MT64x64x64_MI16x16x1_SN_LDSB0_CLR1_GRVWA4_GRVWB8_GSU0_GSUC0_GSUWGMRR0_K1_LBSPPA512_LBSPPB512_LPA32_LPB32_MIWT2_2_PLR1_SU0_SUM0_SUS64_VWA2_VWB2_WGM8_WGMXCC1_WGMXCCGn1
    SolutionIndex: 64
    SolutionNameMin: Cijk_Ailk_Bjlk_F8B8NSS_BH_Bias_HAS_SAV_UserArgs_MT64x64x64_MI16x16x1_SN_LDSB0_CLR1_GRVWA16_GRVWB16_GSU0_GSUC0_GSUWGMRR0_K1_LBSPPA512_LBSPPB512_LPA32_LPB32_MIWT2_2_PLR1_SU0_SUM0_SUS64_VWA2_VWB2_WGM8_WGMXCC1_WGMXCCGn1
    SolutionIndex: 65
    SolutionNameMin: Cijk_Ailk_Bjlk_F8B8NSS_BH_Bias_HAS_SAV_UserArgs_MT32x64x64_MI16x16x1_SN_LDSB0_CLR1_GRVWA4_GRVWB4_GSU0_GSUC0_GSUWGMRR0_K1_LBSPPA256_LBSPPB512_LPA16_LPB32_MIWT1_2_PLR1_SU0_SUM0_SUS64_VWA1_VWB2_WGM1_WGMXCC1_WGMXCCGn1
    SolutionIndex: 66
    SolutionNameMin: Cijk_Ailk_Bjlk_F8B8NSS_BH_Bias_HAS_SAV_UserArgs_MT32x64x64_MI16x16x1_SN_LDSB0_CLR1_GRVWA4_GRVWB8_GSU0_GSUC0_GSUWGMRR0_K1_LBSPPA256_LBSPPB512_LPA16_LPB32_MIWT1_2_PLR1_SU0_SUM0_SUS64_VWA1_VWB2_WGM1_WGMXCC1_WGMXCCGn1
    SolutionIndex: 67
    SolutionNameMin: Cijk_Ailk_Bjlk_F8B8NSS_BH_Bias_HAS_SAV_UserArgs_MT32x64x64_MI16x16x1_SN_LDSB0_CLR1_GRVWA8_GRVWB16_GSU0_GSUC0_GSUWGMRR0_K1_LBSPPA256_LBSPPB512_LPA16_LPB32_MIWT1_2_PLR1_SU0_SUM0_SUS64_VWA1_VWB2_WGM1_WGMXCC1_WGMXCCGn1
    SolutionIndex: 68
    SolutionNameMin: Cijk_Ailk_Bjlk_F8B8NSS_BH_Bias_HAS_SAV_UserArgs_MT32x64x64_MI16x16x1_SN_LDSB0_CLR1_GRVWA4_GRVWB8_GSU0_GSUC0_GSUWGMRR0_K1_LBSPPA256_LBSPPB512_LPA16_LPB32_MIWT1_2_PLR1_SU0_SUM0_SUS64_VWA1_VWB2_WGM8_WGMXCC1_WGMXCCGn1
    SolutionIndex: 69
    SolutionNameMin: Cijk_Ailk_Bjlk_F8B8NSS_BH_Bias_HAS_SAV_UserArgs_MT64x32x64_MI16x16x1_SN_LDSB0_CLR1_GRVWA4_GRVWB4_GSU0_GSUC0_GSUWGMRR0_K1_LBSPPA512_LBSPPB256_LPA32_LPB16_MIWT2_1_PLR1_SU0_SUM0_SUS64_VWA2_VWB1_WGM1_WGMXCC1_WGMXCCGn1
    SolutionIndex: 70
    SolutionNameMin: Cijk_Ailk_Bjlk_F8B8NSS_BH_Bias_HAS_SAV_UserArgs_MT64x32x64_MI16x16x1_SN_LDSB0_CLR1_GRVWA8_GRVWB4_GSU0_GSUC0_GSUWGMRR0_K1_LBSPPA512_LBSPPB256_LPA32_LPB16_MIWT2_1_PLR1_SU0_SUM0_SUS64_VWA2_VWB1_WGM1_WGMXCC1_WGMXCCGn1
    SolutionIndex: 71
    SolutionNameMin: Cijk_Ailk_Bjlk_F8B8NSS_BH_Bias_HAS_SAV_UserArgs_MT64x32x64_MI16x16x1_SN_LDSB0_CLR1_GRVWA4_GRVWB8_GSU0_GSUC0_GSUWGMRR0_K1_LBSPPA512_LBSPPB256_LPA32_LPB16_MIWT2_1_PLR1_SU0_SUM0_SUS64_VWA2_VWB1_WGM1_WGMXCC1_WGMXCCGn1
    SolutionIndex: 72
    SolutionNameMin: Cijk_Ailk_Bjlk_F8B8NSS_BH_Bias_HAS_SAV_UserArgs_MT64x32x64_MI16x16x1_SN_LDSB0_CLR1_GRVWA16_GRVWB8_GSU0_GSUC0_GSUWGMRR0_K1_LBSPPA512_LBSPPB256_LPA32_LPB16_MIWT2_1_PLR1_SU0_SUM0_SUS64_VWA2_VWB1_WGM8_WGMXCC1_WGMXCCGn1
    SolutionIndex: 73
    SolutionNameMin: Cijk_Ailk_Bjlk_F8B8NSS_BH_Bias_HAS_SAV_UserArgs_MT32x32x64_MI16x16x1_SN_LDSB0_CLR1_GRVWA4_GRVWB4_GSU0_GSUC0_GSUWGMRR0_K1_LBSPPA256_LBSPPB256_LPA16_LPB16_MIWT1_1_PLR1_SU0_SUM0_SUS64_VWA1_VWB1_WGM1_WGMXCC1_WGMXCCGn1
    SolutionIndex: 74
    SolutionNameMin: Cijk_Ailk_Bjlk_F8B8NSS_BH_Bias_HAS_SAV_UserArgs_MT32x32x64_MI16x16x1_SN_LDSB0_CLR1_GRVWA8_GRVWB4_GSU0_GSUC0_GSUWGMRR0_K1_LBSPPA256_LBSPPB256_LPA16_LPB16_MIWT1_1_PLR1_SU0_SUM0_SUS64_VWA1_VWB1_WGM1_WGMXCC1_WGMXCCGn1
    SolutionIndex: 75
    SolutionNameMin: Cijk_Ailk_Bjlk_F8B8NSS_BH_Bias_HAS_SAV_UserArgs_MT32x32x64_MI16x16x1_SN_LDSB0_CLR1_GRVWA4_GRVWB8_GSU0_GSUC0_GSUWGMRR0_K1_LBSPPA256_LBSPPB256_LPA16_LPB16_MIWT1_1_PLR1_SU0_SUM0_SUS64_VWA1_VWB1_WGM1_WGMXCC1_WGMXCCGn1
    SolutionIndex: 76
    SolutionNameMin: Cijk_Ailk_Bjlk_F8B8NSS_BH_Bias_HAS_SAV_UserArgs_MT32x32x64_MI16x16x1_SN_LDSB0_CLR1_GRVWA8_GRVWB8_GSU0_GSUC0_GSUWGMRR0_K1_LBSPPA256_LBSPPB256_LPA16_LPB16_MIWT1_1_PLR1_SU0_SUM0_SUS64_VWA1_VWB1_WGM1_WGMXCC1_WGMXCCGn1
    SolutionIndex: 77
    SolutionNameMin: Cijk_Ailk_Bjlk_F8B8NSS_BH_Bias_HAS_SAV_UserArgs_MT32x32x64_MI16x16x1_SN_LDSB0_CLR1_GRVWA4_GRVWB4_GSU0_GSUC0_GSUWGMRR0_K1_LBSPPA256_LBSPPB256_LPA16_LPB16_MIWT1_1_PLR1_SU0_SUM0_SUS64_VWA1_VWB1_WGM6_WGMXCC1_WGMXCCGn1
    SolutionIndex: 78
    SolutionNameMin: Cijk_Ailk_Bjlk_F8B8NSS_BH_Bias_HAS_SAV_UserArgs_MT32x32x64_MI16x16x1_SN_LDSB0_CLR1_GRVWA8_GRVWB8_GSU0_GSUC0_GSUWGMRR0_K1_LBSPPA256_LBSPPB256_LPA16_LPB16_MIWT1_1_PLR1_SU0_SUM0_SUS64_VWA1_VWB1_WGM6_WGMXCC1_WGMXCCGn1
    SolutionIndex: 79
    SolutionNameMin: Cijk_Ailk_Bjlk_F8B8NSS_BH_Bias_HAS_SAV_UserArgs_MT32x32x64_MI16x16x1_SN_LDSB0_CLR1_GRVWA4_GRVWB4_GSU0_GSUC0_GSUWGMRR0_K1_LBSPPA256_LBSPPB256_LPA16_LPB16_MIWT1_1_PLR1_SU0_SUM0_SUS64_VWA1_VWB1_WGM8_WGMXCC1_WGMXCCGn1
    SolutionIndex: 80
    SolutionNameMin: Cijk_Ailk_Bjlk_F8B8NSS_BH_Bias_HAS_SAV_UserArgs_MT256x256x128_MI16x16x1_SN_LDSB1_CLR1_GRVWA16_GRVWB8_GSU0_GSUC0_GSUWGMRR0_K1_LBSPPA2048_LBSPPB2048_LPA0_LPB0_MIWT8_8_PLR1_SU0_SUM0_SUS128_VWA8_VWB8_WGM1_WGMXCC1_WGMXCCGn1
    SolutionIndex: 81
    SolutionNameMin: Cijk_Ailk_Bjlk_F8B8NSS_BH_Bias_HAS_SAV_UserArgs_MT256x256x128_MI16x16x1_SN_LDSB1_CLR1_GRVWA16_GRVWB16_GSU0_GSUC0_GSUWGMRR0_K1_LBSPPA2048_LBSPPB2048_LPA0_LPB0_MIWT8_8_PLR1_SU0_SUM0_SUS128_VWA8_VWB8_WGM1_WGMXCC1_WGMXCCGn1
    SolutionIndex: 82
    SolutionNameMin: Cijk_Ailk_Bjlk_F8B8NSS_BH_Bias_HAS_SAV_UserArgs_MT256x256x128_MI16x16x1_SN_LDSB1_CLR1_GRVWA16_GRVWB16_GSU0_GSUC0_GSUWGMRR0_K1_LBSPPA2048_LBSPPB2048_LPA0_LPB0_MIWT8_8_PLR1_SU0_SUM0_SUS128_VWA8_VWB8_WGM4_WGMXCC1_WGMXCCGn1
    SolutionIndex: 83
    SolutionNameMin: Cijk_Ailk_Bjlk_F8B8NSS_BH_Bias_HAS_SAV_UserArgs_MT256x256x128_MI16x16x1_SN_LDSB1_CLR1_GRVWA16_GRVWB8_GSU0_GSUC0_GSUWGMRR0_K1_LBSPPA2048_LBSPPB2048_LPA0_LPB0_MIWT8_8_PLR1_SU0_SUM0_SUS128_VWA8_VWB8_WGM6_WGMXCC1_WGMXCCGn1
    SolutionIndex: 84
    SolutionNameMin: Cijk_Ailk_Bjlk_F8B8NSS_BH_Bias_HAS_SAV_UserArgs_MT256x256x128_MI16x16x1_SN_LDSB1_CLR1_GRVWA8_GRVWB16_GSU0_GSUC0_GSUWGMRR0_K1_LBSPPA2048_LBSPPB2048_LPA0_LPB0_MIWT8_8_PLR1_SU0_SUM0_SUS128_VWA8_VWB8_WGM6_WGMXCC1_WGMXCCGn1
    SolutionIndex: 85
    SolutionNameMin: Cijk_Ailk_Bjlk_F8B8NSS_BH_Bias_HAS_SAV_UserArgs_MT256x256x128_MI16x16x1_SN_LDSB1_CLR1_GRVWA16_GRVWB16_GSU0_GSUC0_GSUWGMRR0_K1_LBSPPA2048_LBSPPB2048_LPA0_LPB0_MIWT8_8_PLR1_SU0_SUM0_SUS128_VWA8_VWB8_WGM6_WGMXCC1_WGMXCCGn1
    SolutionIndex: 86
    SolutionNameMin: Cijk_Ailk_Bjlk_F8B8NSS_BH_Bias_HAS_SAV_UserArgs_MT128x256x128_MI16x16x1_SN_LDSB1_CLR1_GRVWA4_GRVWB16_GSU0_GSUC0_GSUWGMRR0_K1_LBSPPA1024_LBSPPB2048_LPA64_LPB0_MIWT4_8_PLR1_SU0_SUM0_SUS128_VWA4_VWB8_WGM1_WGMXCC1_WGMXCCGn1
    SolutionIndex: 87
    SolutionNameMin: Cijk_Ailk_Bjlk_F8B8NSS_BH_Bias_HAS_SAV_UserArgs_MT128x256x128_MI16x16x1_SN_LDSB1_CLR1_GRVWA8_GRVWB16_GSU0_GSUC0_GSUWGMRR0_K1_LBSPPA1024_LBSPPB2048_LPA64_LPB0_MIWT4_8_PLR1_SU0_SUM0_SUS128_VWA4_VWB8_WGM1_WGMXCC1_WGMXCCGn1
    SolutionIndex: 88
    SolutionNameMin: Cijk_Ailk_Bjlk_F8B8NSS_BH_Bias_HAS_SAV_UserArgs_MT128x256x128_MI16x16x1_SN_LDSB1_CLR1_GRVWA16_GRVWB16_GSU0_GSUC0_GSUWGMRR0_K1_LBSPPA1024_LBSPPB2048_LPA64_LPB0_MIWT4_8_PLR1_SU0_SUM0_SUS128_VWA4_VWB8_WGM1_WGMXCC1_WGMXCCGn1
    SolutionIndex: 89
    SolutionNameMin: Cijk_Ailk_Bjlk_F8B8NSS_BH_Bias_HAS_SAV_UserArgs_MT128x256x128_MI16x16x1_SN_LDSB1_CLR1_GRVWA8_GRVWB16_GSU0_GSUC0_GSUWGMRR0_K1_LBSPPA1024_LBSPPB2048_LPA64_LPB0_MIWT4_8_PLR1_SU0_SUM0_SUS128_VWA4_VWB8_WGM4_WGMXCC1_WGMXCCGn1
    SolutionIndex: 90
    SolutionNameMin: Cijk_Ailk_Bjlk_F8B8NSS_BH_Bias_HAS_SAV_UserArgs_MT128x256x128_MI16x16x1_SN_LDSB1_CLR1_GRVWA16_GRVWB16_GSU0_GSUC0_GSUWGMRR0_K1_LBSPPA1024_LBSPPB2048_LPA64_LPB0_MIWT4_8_PLR1_SU0_SUM0_SUS128_VWA4_VWB8_WGM4_WGMXCC1_WGMXCCGn1
    SolutionIndex: 91
    SolutionNameMin: Cijk_Ailk_Bjlk_F8B8NSS_BH_Bias_HAS_SAV_UserArgs_MT128x256x128_MI16x16x1_SN_LDSB1_CLR1_GRVWA4_GRVWB16_GSU0_GSUC0_GSUWGMRR0_K1_LBSPPA1024_LBSPPB2048_LPA64_LPB0_MIWT4_8_PLR1_SU0_SUM0_SUS128_VWA4_VWB8_WGM6_WGMXCC1_WGMXCCGn1
    SolutionIndex: 92
    SolutionNameMin: Cijk_Ailk_Bjlk_F8B8NSS_BH_Bias_HAS_SAV_UserArgs_MT128x256x128_MI16x16x1_SN_LDSB1_CLR1_GRVWA16_GRVWB16_GSU0_GSUC0_GSUWGMRR0_K1_LBSPPA1024_LBSPPB2048_LPA64_LPB0_MIWT4_8_PLR1_SU0_SUM0_SUS128_VWA4_VWB8_WGM6_WGMXCC1_WGMXCCGn1
    SolutionIndex: 93
    SolutionNameMin: Cijk_Ailk_Bjlk_F8B8NSS_BH_Bias_HAS_SAV_UserArgs_MT128x256x128_MI16x16x1_SN_LDSB1_CLR1_GRVWA8_GRVWB16_GSU0_GSUC0_GSUWGMRR0_K1_LBSPPA1024_LBSPPB2048_LPA64_LPB0_MIWT4_8_PLR1_SU0_SUM0_SUS128_VWA4_VWB8_WGM8_WGMXCC1_WGMXCCGn1
    SolutionIndex: 94
    SolutionNameMin: Cijk_Ailk_Bjlk_F8B8NSS_BH_Bias_HAS_SAV_UserArgs_MT128x128x128_MI16x16x1_SN_LDSB1_CLR1_GRVWA16_GRVWB16_GSU0_GSUC0_GSUWGMRR0_K1_LBSPPA1024_LBSPPB1024_LPA64_LPB64_MIWT4_4_PLR1_SU0_SUM0_SUS128_VWA4_VWB4_WGM1_WGMXCC1_WGMXCCGn1
    SolutionIndex: 95
    SolutionNameMin: Cijk_Ailk_Bjlk_F8B8NSS_BH_Bias_HAS_SAV_UserArgs_MT128x64x128_MI16x16x1_SN_LDSB1_CLR1_GRVWA16_GRVWB16_GSU0_GSUC0_GSUWGMRR0_K1_LBSPPA1024_LBSPPB512_LPA64_LPB32_MIWT4_2_PLR1_SU0_SUM0_SUS128_VWA4_VWB2_WGM1_WGMXCC1_WGMXCCGn1
    SolutionIndex: 96
    SolutionNameMin: Cijk_Ailk_Bjlk_F8B8NSS_BH_Bias_HAS_SAV_UserArgs_MT128x64x128_MI16x16x1_SN_LDSB1_CLR1_GRVWA16_GRVWB16_GSU0_GSUC0_GSUWGMRR0_K1_LBSPPA1024_LBSPPB512_LPA64_LPB32_MIWT4_2_PLR1_SU0_SUM0_SUS128_VWA4_VWB2_WGM4_WGMXCC1_WGMXCCGn1
    SolutionIndex: 97
    SolutionNameMin: Cijk_Ailk_Bjlk_F8B8NSS_BH_Bias_HAS_SAV_UserArgs_MT128x64x128_MI16x16x1_SN_LDSB1_CLR1_GRVWA16_GRVWB16_GSU0_GSUC0_GSUWGMRR0_K1_LBSPPA1024_LBSPPB512_LPA64_LPB32_MIWT4_2_PLR1_SU0_SUM0_SUS128_VWA4_VWB2_WGM6_WGMXCC1_WGMXCCGn1
    SolutionIndex: 98
    SolutionNameMin: Cijk_Ailk_Bjlk_F8B8NSS_BH_Bias_HAS_SAV_UserArgs_MT128x64x128_MI16x16x1_SN_LDSB1_CLR1_GRVWA16_GRVWB16_GSU0_GSUC0_GSUWGMRR0_K1_LBSPPA1024_LBSPPB512_LPA64_LPB32_MIWT4_2_PLR1_SU0_SUM0_SUS128_VWA4_VWB2_WGM8_WGMXCC1_WGMXCCGn1
    SolutionIndex: 99
    SolutionNameMin: Cijk_Ailk_Bjlk_F8B8NSS_BH_Bias_HAS_SAV_UserArgs_MT64x64x128_MI16x16x1_SN_LDSB1_CLR1_GRVWA4_GRVWB8_GSU0_GSUC0_GSUWGMRR0_K1_LBSPPA512_LBSPPB512_LPA32_LPB32_MIWT2_2_PLR1_SU0_SUM0_SUS128_VWA2_VWB2_WGM1_WGMXCC1_WGMXCCGn1
    SolutionIndex: 100
    SolutionNameMin: Cijk_Ailk_Bjlk_F8B8NSS_BH_Bias_HAS_SAV_UserArgs_MT64x64x128_MI16x16x1_SN_LDSB1_CLR1_GRVWA8_GRVWB16_GSU0_GSUC0_GSUWGMRR0_K1_LBSPPA512_LBSPPB512_LPA32_LPB32_MIWT2_2_PLR1_SU0_SUM0_SUS128_VWA2_VWB2_WGM1_WGMXCC1_WGMXCCGn1
    SolutionIndex: 101
    SolutionNameMin: Cijk_Ailk_Bjlk_F8B8NSS_BH_Bias_HAS_SAV_UserArgs_MT64x64x128_MI16x16x1_SN_LDSB1_CLR1_GRVWA16_GRVWB16_GSU0_GSUC0_GSUWGMRR0_K1_LBSPPA512_LBSPPB512_LPA32_LPB32_MIWT2_2_PLR1_SU0_SUM0_SUS128_VWA2_VWB2_WGM1_WGMXCC1_WGMXCCGn1
    SolutionIndex: 102
    SolutionNameMin: Cijk_Ailk_Bjlk_F8B8NSS_BH_Bias_HAS_SAV_UserArgs_MT64x64x128_MI16x16x1_SN_LDSB1_CLR1_GRVWA16_GRVWB16_GSU0_GSUC0_GSUWGMRR0_K1_LBSPPA512_LBSPPB512_LPA32_LPB32_MIWT2_2_PLR1_SU0_SUM0_SUS128_VWA2_VWB2_WGM4_WGMXCC1_WGMXCCGn1
    SolutionIndex: 103
    SolutionNameMin: Cijk_Ailk_Bjlk_F8B8NSS_BH_Bias_HAS_SAV_UserArgs_MT64x64x128_MI16x16x1_SN_LDSB1_CLR1_GRVWA4_GRVWB8_GSU0_GSUC0_GSUWGMRR0_K1_LBSPPA512_LBSPPB512_LPA32_LPB32_MIWT2_2_PLR1_SU0_SUM0_SUS128_VWA2_VWB2_WGM6_WGMXCC1_WGMXCCGn1
    SolutionIndex: 104
    SolutionNameMin: Cijk_Ailk_Bjlk_F8B8NSS_BH_Bias_HAS_SAV_UserArgs_MT64x64x128_MI16x16x1_SN_LDSB1_CLR1_GRVWA4_GRVWB16_GSU0_GSUC0_GSUWGMRR0_K1_LBSPPA512_LBSPPB512_LPA32_LPB32_MIWT2_2_PLR1_SU0_SUM0_SUS128_VWA2_VWB2_WGM6_WGMXCC1_WGMXCCGn1
    SolutionIndex: 105
    SolutionNameMin: Cijk_Ailk_Bjlk_F8B8NSS_BH_Bias_HAS_SAV_UserArgs_MT64x64x128_MI16x16x1_SN_LDSB1_CLR1_GRVWA8_GRVWB16_GSU0_GSUC0_GSUWGMRR0_K1_LBSPPA512_LBSPPB512_LPA32_LPB32_MIWT2_2_PLR1_SU0_SUM0_SUS128_VWA2_VWB2_WGM6_WGMXCC1_WGMXCCGn1
    SolutionIndex: 106
    SolutionNameMin: Cijk_Ailk_Bjlk_F8B8NSS_BH_Bias_HAS_SAV_UserArgs_MT64x64x128_MI16x16x1_SN_LDSB1_CLR1_GRVWA16_GRVWB16_GSU0_GSUC0_GSUWGMRR0_K1_LBSPPA512_LBSPPB512_LPA32_LPB32_MIWT2_2_PLR1_SU0_SUM0_SUS128_VWA2_VWB2_WGM6_WGMXCC1_WGMXCCGn1
    SolutionIndex: 107
    SolutionNameMin: Cijk_Ailk_Bjlk_F8B8NSS_BH_Bias_HAS_SAV_UserArgs_MT64x64x128_MI16x16x1_SN_LDSB1_CLR1_GRVWA4_GRVWB16_GSU0_GSUC0_GSUWGMRR0_K1_LBSPPA512_LBSPPB512_LPA32_LPB32_MIWT2_2_PLR1_SU0_SUM0_SUS128_VWA2_VWB2_WGM8_WGMXCC1_WGMXCCGn1
    SolutionIndex: 108
    SolutionNameMin: Cijk_Ailk_Bjlk_F8B8NSS_BH_Bias_HAS_SAV_UserArgs_MT64x64x128_MI16x16x1_SN_LDSB1_CLR1_GRVWA8_GRVWB16_GSU0_GSUC0_GSUWGMRR0_K1_LBSPPA512_LBSPPB512_LPA32_LPB32_MIWT2_2_PLR1_SU0_SUM0_SUS128_VWA2_VWB2_WGM8_WGMXCC1_WGMXCCGn1
    SolutionIndex: 109
    SolutionNameMin: Cijk_Ailk_Bjlk_F8B8NSS_BH_Bias_HAS_SAV_UserArgs_MT64x64x128_MI16x16x1_SN_LDSB1_CLR1_GRVWA16_GRVWB16_GSU0_GSUC0_GSUWGMRR0_K1_LBSPPA512_LBSPPB512_LPA32_LPB32_MIWT2_2_PLR1_SU0_SUM0_SUS128_VWA2_VWB2_WGM8_WGMXCC1_WGMXCCGn1
    SolutionIndex: 110
    SolutionNameMin: Cijk_Ailk_Bjlk_F8B8NSS_BH_Bias_HAS_SAV_UserArgs_MT32x64x128_MI16x16x1_SN_LDSB0_CLR1_GRVWA8_GRVWB8_GSU0_GSUC0_GSUWGMRR0_K1_LBSPPA256_LBSPPB512_LPA16_LPB32_MIWT1_2_PLR1_SU0_SUM0_SUS128_VWA1_VWB2_WGM1_WGMXCC1_WGMXCCGn1
    SolutionIndex: 111
    SolutionNameMin: Cijk_Ailk_Bjlk_F8B8NSS_BH_Bias_HAS_SAV_UserArgs_MT32x64x128_MI16x16x1_SN_LDSB0_CLR1_GRVWA8_GRVWB16_GSU0_GSUC0_GSUWGMRR0_K1_LBSPPA256_LBSPPB512_LPA16_LPB32_MIWT1_2_PLR1_SU0_SUM0_SUS128_VWA1_VWB2_WGM1_WGMXCC1_WGMXCCGn1
    SolutionIndex: 112
    SolutionNameMin: Cijk_Ailk_Bjlk_F8B8NSS_BH_Bias_HAS_SAV_UserArgs_MT32x64x128_MI16x16x1_SN_LDSB0_CLR1_GRVWA16_GRVWB16_GSU0_GSUC0_GSUWGMRR0_K1_LBSPPA256_LBSPPB512_LPA16_LPB32_MIWT1_2_PLR1_SU0_SUM0_SUS128_VWA1_VWB2_WGM1_WGMXCC1_WGMXCCGn1
    SolutionIndex: 113
    SolutionNameMin: Cijk_Ailk_Bjlk_F8B8NSS_BH_Bias_HAS_SAV_UserArgs_MT32x64x128_MI16x16x1_SN_LDSB0_CLR1_GRVWA16_GRVWB16_GSU0_GSUC0_GSUWGMRR0_K1_LBSPPA256_LBSPPB512_LPA16_LPB32_MIWT1_2_PLR1_SU0_SUM0_SUS128_VWA1_VWB2_WGM4_WGMXCC1_WGMXCCGn1
    SolutionIndex: 114
    SolutionNameMin: Cijk_Ailk_Bjlk_F8B8NSS_BH_Bias_HAS_SAV_UserArgs_MT32x64x128_MI16x16x1_SN_LDSB0_CLR1_GRVWA4_GRVWB16_GSU0_GSUC0_GSUWGMRR0_K1_LBSPPA256_LBSPPB512_LPA16_LPB32_MIWT1_2_PLR1_SU0_SUM0_SUS128_VWA1_VWB2_WGM6_WGMXCC1_WGMXCCGn1
    SolutionIndex: 115
    SolutionNameMin: Cijk_Ailk_Bjlk_F8B8NSS_BH_Bias_HAS_SAV_UserArgs_MT32x64x128_MI16x16x1_SN_LDSB0_CLR1_GRVWA16_GRVWB16_GSU0_GSUC0_GSUWGMRR0_K1_LBSPPA256_LBSPPB512_LPA16_LPB32_MIWT1_2_PLR1_SU0_SUM0_SUS128_VWA1_VWB2_WGM8_WGMXCC1_WGMXCCGn1
    SolutionIndex: 116
    SolutionNameMin: Cijk_Ailk_Bjlk_F8B8NSS_BH_Bias_HAS_SAV_UserArgs_MT64x32x128_MI16x16x1_SN_LDSB0_CLR1_GRVWA4_GRVWB8_GSU0_GSUC0_GSUWGMRR0_K1_LBSPPA512_LBSPPB256_LPA32_LPB16_MIWT2_1_PLR1_SU0_SUM0_SUS128_VWA2_VWB1_WGM1_WGMXCC1_WGMXCCGn1
    SolutionIndex: 117
    SolutionNameMin: Cijk_Ailk_Bjlk_F8B8NSS_BH_Bias_HAS_SAV_UserArgs_MT64x32x128_MI16x16x1_SN_LDSB0_CLR1_GRVWA8_GRVWB8_GSU0_GSUC0_GSUWGMRR0_K1_LBSPPA512_LBSPPB256_LPA32_LPB16_MIWT2_1_PLR1_SU0_SUM0_SUS128_VWA2_VWB1_WGM1_WGMXCC1_WGMXCCGn1
    SolutionIndex: 118
    SolutionNameMin: Cijk_Ailk_Bjlk_F8B8NSS_BH_Bias_HAS_SAV_UserArgs_MT64x32x128_MI16x16x1_SN_LDSB0_CLR1_GRVWA8_GRVWB16_GSU0_GSUC0_GSUWGMRR0_K1_LBSPPA512_LBSPPB256_LPA32_LPB16_MIWT2_1_PLR1_SU0_SUM0_SUS128_VWA2_VWB1_WGM1_WGMXCC1_WGMXCCGn1
    SolutionIndex: 119
    SolutionNameMin: Cijk_Ailk_Bjlk_F8B8NSS_BH_Bias_HAS_SAV_UserArgs_MT64x32x128_MI16x16x1_SN_LDSB0_CLR1_GRVWA16_GRVWB16_GSU0_GSUC0_GSUWGMRR0_K1_LBSPPA512_LBSPPB256_LPA32_LPB16_MIWT2_1_PLR1_SU0_SUM0_SUS128_VWA2_VWB1_WGM1_WGMXCC1_WGMXCCGn1
    SolutionIndex: 120
    SolutionNameMin: Cijk_Ailk_Bjlk_F8B8NSS_BH_Bias_HAS_SAV_UserArgs_MT32x32x128_MI16x16x1_SN_LDSB0_CLR1_GRVWA4_GRVWB4_GSU0_GSUC0_GSUWGMRR0_K1_LBSPPA256_LBSPPB256_LPA16_LPB16_MIWT1_1_PLR1_SU0_SUM0_SUS128_VWA1_VWB1_WGM1_WGMXCC1_WGMXCCGn1
    SolutionIndex: 121
    SolutionNameMin: Cijk_Ailk_Bjlk_F8B8NSS_BH_Bias_HAS_SAV_UserArgs_MT32x32x128_MI16x16x1_SN_LDSB0_CLR1_GRVWA8_GRVWB4_GSU0_GSUC0_GSUWGMRR0_K1_LBSPPA256_LBSPPB256_LPA16_LPB16_MIWT1_1_PLR1_SU0_SUM0_SUS128_VWA1_VWB1_WGM1_WGMXCC1_WGMXCCGn1
    SolutionIndex: 122
    SolutionNameMin: Cijk_Ailk_Bjlk_F8B8NSS_BH_Bias_HAS_SAV_UserArgs_MT32x32x128_MI16x16x1_SN_LDSB0_CLR1_GRVWA4_GRVWB8_GSU0_GSUC0_GSUWGMRR0_K1_LBSPPA256_LBSPPB256_LPA16_LPB16_MIWT1_1_PLR1_SU0_SUM0_SUS128_VWA1_VWB1_WGM1_WGMXCC1_WGMXCCGn1
    SolutionIndex: 123
    SolutionNameMin: Cijk_Ailk_Bjlk_F8B8NSS_BH_Bias_HAS_SAV_UserArgs_MT32x32x128_MI16x16x1_SN_LDSB0_CLR1_GRVWA8_GRVWB8_GSU0_GSUC0_GSUWGMRR0_K1_LBSPPA256_LBSPPB256_LPA16_LPB16_MIWT1_1_PLR1_SU0_SUM0_SUS128_VWA1_VWB1_WGM1_WGMXCC1_WGMXCCGn1
    SolutionIndex: 124
    SolutionNameMin: Cijk_Ailk_Bjlk_F8B8NSS_BH_Bias_HAS_SAV_UserArgs_MT32x32x128_MI16x16x1_SN_LDSB0_CLR1_GRVWA16_GRVWB8_GSU0_GSUC0_GSUWGMRR0_K1_LBSPPA256_LBSPPB256_LPA16_LPB16_MIWT1_1_PLR1_SU0_SUM0_SUS128_VWA1_VWB1_WGM1_WGMXCC1_WGMXCCGn1
    SolutionIndex: 125
    SolutionNameMin: Cijk_Ailk_Bjlk_F8B8NSS_BH_Bias_HAS_SAV_UserArgs_MT32x32x128_MI16x16x1_SN_LDSB0_CLR1_GRVWA4_GRVWB16_GSU0_GSUC0_GSUWGMRR0_K1_LBSPPA256_LBSPPB256_LPA16_LPB16_MIWT1_1_PLR1_SU0_SUM0_SUS128_VWA1_VWB1_WGM1_WGMXCC1_WGMXCCGn1
    SolutionIndex: 126
    SolutionNameMin: Cijk_Ailk_Bjlk_F8B8NSS_BH_Bias_HAS_SAV_UserArgs_MT32x32x128_MI16x16x1_SN_LDSB0_CLR1_GRVWA8_GRVWB16_GSU0_GSUC0_GSUWGMRR0_K1_LBSPPA256_LBSPPB256_LPA16_LPB16_MIWT1_1_PLR1_SU0_SUM0_SUS128_VWA1_VWB1_WGM1_WGMXCC1_WGMXCCGn1
    SolutionIndex: 127
    SolutionNameMin: Cijk_Ailk_Bjlk_F8B8NSS_BH_Bias_HAS_SAV_UserArgs_MT128x64x256_MI16x16x1_SN_LDSB1_CLR1_GRVWA16_GRVWB16_GSU0_GSUC0_GSUWGMRR0_K1_LBSPPA1024_LBSPPB512_LPA64_LPB32_MIWT4_2_PLR1_SU0_SUM0_SUS256_VWA4_VWB2_WGM1_WGMXCC1_WGMXCCGn1
    SolutionIndex: 128
    SolutionNameMin: Cijk_Ailk_Bjlk_F8B8NSS_BH_Bias_HAS_SAV_UserArgs_MT128x64x256_MI16x16x1_SN_LDSB1_CLR1_GRVWA16_GRVWB16_GSU0_GSUC0_GSUWGMRR0_K1_LBSPPA1024_LBSPPB512_LPA64_LPB32_MIWT4_2_PLR1_SU0_SUM0_SUS256_VWA4_VWB2_WGM4_WGMXCC1_WGMXCCGn1
    SolutionIndex: 129
    SolutionNameMin: Cijk_Ailk_Bjlk_F8B8NSS_BH_Bias_HAS_SAV_UserArgs_MT64x64x256_MI16x16x1_SN_LDSB1_CLR1_GRVWA16_GRVWB16_GSU0_GSUC0_GSUWGMRR0_K1_LBSPPA512_LBSPPB512_LPA32_LPB32_MIWT2_2_PLR1_SU0_SUM0_SUS256_VWA2_VWB2_WGM1_WGMXCC1_WGMXCCGn1
    SolutionIndex: 130
    SolutionNameMin: Cijk_Ailk_Bjlk_F8B8NSS_BH_Bias_HAS_SAV_UserArgs_MT64x64x256_MI16x16x1_SN_LDSB1_CLR1_GRVWA16_GRVWB16_GSU0_GSUC0_GSUWGMRR0_K1_LBSPPA512_LBSPPB512_LPA32_LPB32_MIWT2_2_PLR1_SU0_SUM0_SUS256_VWA2_VWB2_WGM6_WGMXCC1_WGMXCCGn1
    SolutionIndex: 131
    SolutionNameMin: Cijk_Ailk_Bjlk_F8B8NSS_BH_Bias_HAS_SAV_UserArgs_MT32x64x256_MI16x16x1_SN_LDSB1_CLR1_GRVWA16_GRVWB16_GSU0_GSUC0_GSUWGMRR0_K1_LBSPPA256_LBSPPB512_LPA16_LPB32_MIWT1_2_PLR1_SU0_SUM0_SUS256_VWA1_VWB2_WGM1_WGMXCC1_WGMXCCGn1
    SolutionIndex: 132
    SolutionNameMin: Cijk_Ailk_Bjlk_F8B8NSS_BH_Bias_HAS_SAV_UserArgs_MT64x32x256_MI16x16x1_SN_LDSB1_CLR1_GRVWA16_GRVWB16_GSU0_GSUC0_GSUWGMRR0_K1_LBSPPA512_LBSPPB256_LPA32_LPB16_MIWT2_1_PLR1_SU0_SUM0_SUS256_VWA2_VWB1_WGM1_WGMXCC1_WGMXCCGn1
    SolutionIndex: 133
    SolutionNameMin: Cijk_Ailk_Bjlk_F8B8NSS_BH_Bias_HAS_SAV_UserArgs_MT64x32x256_MI16x16x1_SN_LDSB1_CLR1_GRVWA16_GRVWB16_GSU0_GSUC0_GSUWGMRR0_K1_LBSPPA512_LBSPPB256_LPA32_LPB16_MIWT2_1_PLR1_SU0_SUM0_SUS256_VWA2_VWB1_WGM4_WGMXCC1_WGMXCCGn1
    SolutionIndex: 134
    SolutionNameMin: Cijk_Ailk_Bjlk_F8B8NSS_BH_Bias_HAS_SAV_UserArgs_MT64x32x256_MI16x16x1_SN_LDSB1_CLR1_GRVWA16_GRVWB16_GSU0_GSUC0_GSUWGMRR0_K1_LBSPPA512_LBSPPB256_LPA32_LPB16_MIWT2_1_PLR1_SU0_SUM0_SUS256_VWA2_VWB1_WGM6_WGMXCC1_WGMXCCGn1
    SolutionIndex: 135
    SolutionNameMin: Cijk_Ailk_Bjlk_F8B8NSS_BH_Bias_HAS_SAV_UserArgs_MT32x32x256_MI16x16x1_SN_LDSB1_CLR1_GRVWA8_GRVWB16_GSU0_GSUC0_GSUWGMRR0_K1_LBSPPA256_LBSPPB256_LPA16_LPB16_MIWT1_1_PLR1_SU0_SUM0_SUS256_VWA1_VWB1_WGM1_WGMXCC1_WGMXCCGn1
    SolutionIndex: 136
    SolutionNameMin: Cijk_Ailk_Bjlk_F8B8NSS_BH_Bias_HAS_SAV_UserArgs_MT32x32x256_MI16x16x1_SN_LDSB1_CLR1_GRVWA16_GRVWB16_GSU0_GSUC0_GSUWGMRR0_K1_LBSPPA256_LBSPPB256_LPA16_LPB16_MIWT1_1_PLR1_SU0_SUM0_SUS256_VWA1_VWB1_WGM1_WGMXCC1_WGMXCCGn1
    SolutionIndex: 137
    SolutionNameMin: Cijk_Ailk_Bjlk_F8B8NSS_BH_Bias_HAS_SAV_UserArgs_MT32x32x256_MI16x16x1_SN_LDSB1_CLR1_GRVWA16_GRVWB16_GSU0_GSUC0_GSUWGMRR0_K1_LBSPPA256_LBSPPB256_LPA16_LPB16_MIWT1_1_PLR1_SU0_SUM0_SUS256_VWA1_VWB1_WGM4_WGMXCC1_WGMXCCGn1
    SolutionIndex: 138
    SolutionNameMin: Cijk_Ailk_Bjlk_F8B8NSS_BH_Bias_HAS_SAV_UserArgs_MT32x32x256_MI16x16x1_SN_LDSB1_CLR1_GRVWA16_GRVWB16_GSU0_GSUC0_GSUWGMRR0_K1_LBSPPA256_LBSPPB256_LPA16_LPB16_MIWT1_1_PLR1_SU0_SUM0_SUS256_VWA1_VWB1_WGM6_WGMXCC1_WGMXCCGn1
    SolutionIndex: 139
    SolutionNameMin: Cijk_Ailk_Bjlk_F8B8NSS_BH_Bias_HAS_SAV_UserArgs_MT32x32x256_MI16x16x1_SN_LDSB1_CLR1_GRVWA16_GRVWB16_GSU0_GSUC0_GSUWGMRR0_K1_LBSPPA256_LBSPPB256_LPA16_LPB16_MIWT1_1_PLR1_SU0_SUM0_SUS256_VWA1_VWB1_WGM8_WGMXCC1_WGMXCCGn1
- - - [128, 128, 1, 128, 128, 128, 128, 128]
    - [123, 0.48]
  - - [128, 128, 1, 256, 128, 128, 128, 128]
    - [74, 0.87]
  - - [128, 128, 1, 512, 128, 128, 128, 128]
    - [122, 1.45]
  - - [128, 128, 1, 1024, 128, 128, 128, 128]
    - [125, 2.16]
  - - [128, 128, 1, 2048, 128, 128, 128, 128]
    - [126, 2.87]
  - - [128, 128, 1, 4096, 128, 128, 128, 128]
    - [126, 3.48]
  - - [128, 128, 1, 8192, 128, 128, 128, 128]
    - [136, 3.91]
  - - [128, 256, 1, 128, 128, 128, 128, 256]
    - [72, 0.71]
  - - [128, 256, 1, 256, 128, 128, 128, 256]
    - [77, 1.37]
  - - [128, 256, 1, 512, 128, 128, 128, 256]
    - [78, 2.65]
  - - [128, 256, 1, 1024, 128, 128, 128, 256]
    - [126, 4.44]
  - - [128, 256, 1, 2048, 128, 128, 128, 256]
    - [126, 5.89]
  - - [128, 256, 1, 4096, 128, 128, 128, 256]
    - [136, 7.07]
  - - [128, 256, 1, 8192, 128, 128, 128, 256]
    - [136, 7.9]
  - - [128, 512, 1, 128, 128, 128, 128, 512]
    - [75, 2.03]
  - - [128, 512, 1, 256, 128, 128, 128, 512]
    - [120, 3.61]
  - - [128, 512, 1, 512, 128, 128, 128, 512]
    - [122, 5.88]
  - - [128, 512, 1, 1024, 128, 128, 128, 512]
    - [123, 8.73]
  - - [128, 512, 1, 2048, 128, 128, 128, 512]
    - [126, 11.55]
  - - [128, 512, 1, 4096, 128, 128, 128, 512]
    - [126, 13.96]
  - - [128, 512, 1, 8192, 128, 128, 128, 512]
    - [137, 15.09]
  - - [128, 1024, 1, 128, 128, 128, 128, 1024]
    - [73, 4.02]
  - - [128, 1024, 1, 256, 128, 128, 128, 1024]
    - [73, 6.95]
  - - [128, 1024, 1, 512, 128, 128, 128, 1024]
    - [121, 11.23]
  - - [128, 1024, 1, 1024, 128, 128, 128, 1024]
    - [123, 16.88]
  - - [128, 1024, 1, 2048, 128, 128, 128, 1024]
    - [123, 22.6]
  - - [128, 1024, 1, 4096, 128, 128, 128, 1024]
    - [135, 25.69]
  - - [128, 1024, 1, 8192, 128, 128, 128, 1024]
    - [138, 27.51]
  - - [128, 2048, 1, 128, 128, 128, 128, 2048]
    - [70, 7.14]
  - - [128, 2048, 1, 256, 128, 128, 128, 2048]
    - [71, 12.54]
  - - [128, 2048, 1, 512, 128, 128, 128, 2048]
    - [116, 20.55]
  - - [128, 2048, 1, 1024, 128, 128, 128, 2048]
    - [119, 29.83]
  - - [128, 2048, 1, 2048, 128, 128, 128, 2048]
    - [132, 38.41]
  - - [128, 2048, 1, 4096, 128, 128, 128, 2048]
    - [134, 46.77]
  - - [128, 2048, 1, 8192, 128, 128, 128, 2048]
    - [134, 53.15]
  - - [128, 4096, 1, 128, 128, 128, 128, 4096]
    - [55, 12.43]
  - - [128, 4096, 1, 256, 128, 128, 128, 4096]
    - [60, 21.87]
  - - [128, 4096, 1, 512, 128, 128, 128, 4096]
    - [99, 34.7]
  - - [128, 4096, 1, 1024, 128, 128, 128, 4096]
    - [109, 50.59]
  - - [128, 4096, 1, 2048, 128, 128, 128, 4096]
    - [129, 64.93]
  - - [128, 4096, 1, 4096, 128, 128, 128, 4096]
    - [129, 80.19]
  - - [128, 4096, 1, 8192, 128, 128, 128, 4096]
    - [129, 90.2]
  - - [128, 8192, 1, 128, 128, 128, 128, 8192]
    - [50, 20.21]
  - - [128, 8192, 1, 256, 128, 128, 128, 8192]
    - [50, 35.11]
  - - [128, 8192, 1, 512, 128, 128, 128, 8192]
    - [50, 56.32]
  - - [128, 8192, 1, 1024, 128, 128, 128, 8192]
    - [95, 80.81]
  - - [128, 8192, 1, 2048, 128, 128, 128, 8192]
    - [95, 101.66]
  - - [128, 8192, 1, 4096, 128, 128, 128, 8192]
    - [95, 120.69]
  - - [128, 8192, 1, 8192, 128, 128, 128, 8192]
    - [127, 127.21]
  - - [256, 128, 1, 128, 256, 256, 256, 128]
    - [73, 0.93]
  - - [256, 128, 1, 256, 256, 256, 256, 128]
    - [75, 1.76]
  - - [256, 128, 1, 512, 256, 256, 256, 128]
    - [121, 2.97]
  - - [256, 128, 1, 1024, 256, 256, 256, 128]
    - [123, 4.43]
  - - [256, 128, 1, 2048, 256, 256, 256, 128]
    - [126, 5.91]
  - - [256, 128, 1, 4096, 256, 256, 256, 128]
    - [126, 7.06]
  - - [256, 128, 1, 8192, 256, 256, 256, 128]
    - [136, 7.88]
  - - [256, 256, 1, 128, 256, 256, 256, 256]
    - [79, 1.93]
  - - [256, 256, 1, 256, 256, 256, 256, 256]
    - [76, 3.46]
  - - [256, 256, 1, 512, 256, 256, 256, 256]
    - [124, 5.69]
  - - [256, 256, 1, 1024, 256, 256, 256, 256]
    - [123, 8.7]
  - - [256, 256, 1, 2048, 256, 256, 256, 256]
    - [126, 11.68]
  - - [256, 256, 1, 4096, 256, 256, 256, 256]
    - [126, 14.03]
  - - [256, 256, 1, 8192, 256, 256, 256, 256]
    - [126, 15.53]
  - - [256, 512, 1, 128, 256, 256, 256, 512]
    - [59, 2.9]
  - - [256, 512, 1, 256, 256, 256, 256, 512]
    - [78, 6.19]
  - - [256, 512, 1, 512, 256, 256, 256, 512]
    - [76, 10.75]
  - - [256, 512, 1, 1024, 256, 256, 256, 512]
    - [124, 16.35]
  - - [256, 512, 1, 2048, 256, 256, 256, 512]
    - [126, 22.35]
  - - [256, 512, 1, 4096, 256, 256, 256, 512]
    - [126, 27.09]
  - - [256, 512, 1, 8192, 256, 256, 256, 512]
    - [136, 29.58]
  - - [256, 1024, 1, 128, 256, 256, 256, 1024]
    - [64, 5.91]
  - - [256, 1024, 1, 256, 256, 256, 256, 1024]
    - [68, 11.0]
  - - [256, 1024, 1, 512, 256, 256, 256, 1024]
    - [67, 19.21]
  - - [256, 1024, 1, 1024, 256, 256, 256, 1024]
    - [110, 29.29]
  - - [256, 1024, 1, 2048, 256, 256, 256, 1024]
    - [131, 39.34]
  - - [256, 1024, 1, 4096, 256, 256, 256, 1024]
    - [132, 47.67]
  - - [256, 1024, 1, 8192, 256, 256, 256, 1024]
    - [134, 53.53]
  - - [256, 2048, 1, 128, 256, 256, 256, 2048]
    - [63, 9.65]
  - - [256, 2048, 1, 256, 256, 256, 256, 2048]
    - [57, 20.7]
  - - [256, 2048, 1, 512, 256, 256, 256, 2048]
    - [100, 33.79]
  - - [256, 2048, 1, 1024, 256, 256, 256, 2048]
    - [100, 50.71]
  - - [256, 2048, 1, 2048, 256, 256, 256, 2048]
    - [101, 64.69]
  - - [256, 2048, 1, 4096, 256, 256, 256, 2048]
    - [101, 77.46]
  - - [256, 2048, 1, 8192, 256, 256, 256, 2048]
    - [130, 86.19]
  - - [256, 4096, 1, 128, 256, 256, 256, 4096]
    - [52, 19.31]
  - - [256, 4096, 1, 256, 256, 256, 256, 4096]
    - [50, 34.07]
  - - [256, 4096, 1, 512, 256, 256, 256, 4096]
    - [47, 54.71]
  - - [256, 4096, 1, 1024, 256, 256, 256, 4096]
    - [47, 79.5]
  - - [256, 4096, 1, 2048, 256, 256, 256, 4096]
    - [95, 101.53]
  - - [256, 4096, 1, 4096, 256, 256, 256, 4096]
    - [96, 120.58]
  - - [256, 4096, 1, 8192, 256, 256, 256, 4096]
    - [128, 128.26]
  - - [256, 8192, 1, 128, 256, 256, 256, 8192]
    - [33, 28.99]
  - - [256, 8192, 1, 256, 256, 256, 256, 8192]
    - [36, 51.12]
  - - [256, 8192, 1, 512, 256, 256, 256, 8192]
    - [36, 80.72]
  - - [256, 8192, 1, 1024, 256, 256, 256, 8192]
    - [33, 114.02]
  - - [256, 8192, 1, 2048, 256, 256, 256, 8192]
    - [36, 145.86]
  - - [256, 8192, 1, 4096, 256, 256, 256, 8192]
    - [94, 169.17]
  - - [256, 8192, 1, 8192, 256, 256, 256, 8192]
    - [94, 168.31]
  - - [512, 128, 1, 128, 512, 512, 512, 128]
    - [76, 2.0]
  - - [512, 128, 1, 256, 512, 512, 512, 128]
    - [73, 3.54]
  - - [512, 128, 1, 512, 512, 512, 512, 128]
    - [126, 5.79]
  - - [512, 128, 1, 1024, 512, 512, 512, 128]
    - [126, 8.65]
  - - [512, 128, 1, 2048, 512, 512, 512, 128]
    - [126, 11.62]
  - - [512, 128, 1, 4096, 512, 512, 512, 128]
    - [126, 13.96]
  - - [512, 128, 1, 8192, 512, 512, 512, 128]
    - [137, 15.01]
  - - [512, 256, 1, 128, 512, 512, 512, 256]
    - [73, 3.93]
  - - [512, 256, 1, 256, 512, 512, 512, 256]
    - [73, 6.92]
  - - [512, 256, 1, 512, 512, 512, 512, 256]
    - [120, 11.41]
  - - [512, 256, 1, 1024, 512, 512, 512, 256]
    - [126, 16.9]
  - - [512, 256, 1, 2048, 512, 512, 512, 256]
    - [126, 22.6]
  - - [512, 256, 1, 4096, 512, 512, 512, 256]
    - [126, 27.48]
  - - [512, 256, 1, 8192, 512, 512, 512, 256]
    - [138, 27.6]
  - - [512, 512, 1, 128, 512, 512, 512, 512]
    - [69, 7.15]
  - - [512, 512, 1, 256, 512, 512, 512, 512]
    - [69, 12.34]
  - - [512, 512, 1, 512, 512, 512, 512, 512]
    - [117, 20.22]
  - - [512, 512, 1, 1024, 512, 512, 512, 512]
    - [118, 29.8]
  - - [512, 512, 1, 2048, 512, 512, 512, 512]
    - [132, 39.79]
  - - [512, 512, 1, 4096, 512, 512, 512, 512]
    - [111, 46.18]
  - - [512, 512, 1, 8192, 512, 512, 512, 512]
    - [114, 49.84]
  - - [512, 1024, 1, 128, 512, 512, 512, 1024]
    - [58, 12.26]
  - - [512, 1024, 1, 256, 512, 512, 512, 1024]
    - [60, 21.37]
  - - [512, 1024, 1, 512, 512, 512, 512, 1024]
    - [100, 34.61]
  - - [512, 1024, 1, 1024, 512, 512, 512, 1024]
    - [102, 50.61]
  - - [512, 1024, 1, 2048, 512, 512, 512, 1024]
    - [101, 66.77]
  - - [512, 1024, 1, 4096, 512, 512, 512, 1024]
    - [106, 74.41]
  - - [512, 1024, 1, 8192, 512, 512, 512, 1024]
    - [106, 79.86]
  - - [512, 2048, 1, 128, 512, 512, 512, 2048]
    - [51, 20.06]
  - - [512, 2048, 1, 256, 512, 512, 512, 2048]
    - [50, 35.07]
  - - [512, 2048, 1, 512, 512, 512, 512, 2048]
    - [95, 55.77]
  - - [512, 2048, 1, 1024, 512, 512, 512, 2048]
    - [95, 80.54]
  - - [512, 2048, 1, 2048, 512, 512, 512, 2048]
    - [95, 102.33]
  - - [512, 2048, 1, 4096, 512, 512, 512, 2048]
    - [96, 120.37]
  - - [512, 2048, 1, 8192, 512, 512, 512, 2048]
    - [96, 126.77]
  - - [512, 4096, 1, 128, 512, 512, 512, 4096]
    - [41, 29.97]
  - - [512, 4096, 1, 256, 512, 512, 512, 4096]
    - [41, 52.52]
  - - [512, 4096, 1, 512, 512, 512, 512, 4096]
    - [37, 81.52]
  - - [512, 4096, 1, 1024, 512, 512, 512, 4096]
    - [36, 116.48]
  - - [512, 4096, 1, 2048, 512, 512, 512, 4096]
    - [34, 147.03]
  - - [512, 4096, 1, 4096, 512, 512, 512, 4096]
    - [36, 167.68]
  - - [512, 4096, 1, 8192, 512, 512, 512, 4096]
    - [36, 167.05]
  - - [512, 8192, 1, 128, 512, 512, 512, 8192]
    - [13, 37.87]
  - - [512, 8192, 1, 256, 512, 512, 512, 8192]
    - [13, 66.62]
  - - [512, 8192, 1, 512, 512, 512, 512, 8192]
    - [9, 105.94]
  - - [512, 8192, 1, 1024, 512, 512, 512, 8192]
    - [10, 152.1]
  - - [512, 8192, 1, 2048, 512, 512, 512, 8192]
    - [17, 196.87]
  - - [512, 8192, 1, 4096, 512, 512, 512, 8192]
    - [86, 211.56]
  - - [512, 8192, 1, 8192, 512, 512, 512, 8192]
    - [86, 209.55]
  - - [1024, 128, 1, 128, 1024, 1024, 1024, 128]
    - [73, 3.85]
  - - [1024, 128, 1, 256, 1024, 1024, 1024, 128]
    - [73, 6.81]
  - - [1024, 128, 1, 512, 1024, 1024, 1024, 128]
    - [125, 11.26]
  - - [1024, 128, 1, 1024, 1024, 1024, 1024, 128]
    - [123, 16.79]
  - - [1024, 128, 1, 2048, 1024, 1024, 1024, 128]
    - [126, 22.75]
  - - [1024, 128, 1, 4096, 1024, 1024, 1024, 128]
    - [138, 24.92]
  - - [1024, 128, 1, 8192, 1024, 1024, 1024, 128]
    - [139, 26.55]
  - - [1024, 256, 1, 128, 1024, 1024, 1024, 256]
    - [69, 7.03]
  - - [1024, 256, 1, 256, 1024, 1024, 1024, 256]
    - [69, 12.43]
  - - [1024, 256, 1, 512, 1024, 1024, 1024, 256]
    - [116, 20.26]
  - - [1024, 256, 1, 1024, 1024, 1024, 1024, 256]
    - [118, 29.87]
  - - [1024, 256, 1, 2048, 1024, 1024, 1024, 256]
    - [132, 40.24]
  - - [1024, 256, 1, 4096, 1024, 1024, 1024, 256]
    - [115, 45.82]
  - - [1024, 256, 1, 8192, 1024, 1024, 1024, 256]
    - [133, 49.01]
  - - [1024, 512, 1, 128, 1024, 1024, 1024, 512]
    - [54, 12.18]
  - - [1024, 512, 1, 256, 1024, 1024, 1024, 512]
    - [62, 21.46]
  - - [1024, 512, 1, 512, 1024, 1024, 1024, 512]
    - [103, 34.24]
  - - [1024, 512, 1, 1024, 1024, 1024, 1024, 512]
    - [105, 50.79]
  - - [1024, 512, 1, 2048, 1024, 1024, 1024, 512]
    - [101, 66.58]
  - - [1024, 512, 1, 4096, 1024, 1024, 1024, 512]
    - [107, 74.52]
  - - [1024, 512, 1, 8192, 1024, 1024, 1024, 512]
    - [107, 81.12]
  - - [1024, 1024, 1, 128, 1024, 1024, 1024, 1024]
    - [53, 19.7]
  - - [1024, 1024, 1, 256, 1024, 1024, 1024, 1024]
    - [53, 34.56]
  - - [1024, 1024, 1, 512, 1024, 1024, 1024, 1024]
    - [45, 55.5]
  - - [1024, 1024, 1, 1024, 1024, 1024, 1024, 1024]
    - [46, 79.65]
  - - [1024, 1024, 1, 2048, 1024, 1024, 1024, 1024]
    - [97, 101.74]
  - - [1024, 1024, 1, 4096, 1024, 1024, 1024, 1024]
    - [96, 119.34]
  - - [1024, 1024, 1, 8192, 1024, 1024, 1024, 1024]
    - [97, 125.44]
  - - [1024, 2048, 1, 128, 1024, 1024, 1024, 2048]
    - [33, 30.03]
  - - [1024, 2048, 1, 256, 1024, 1024, 1024, 2048]
    - [33, 52.4]
  - - [1024, 2048, 1, 512, 1024, 1024, 1024, 2048]
    - [36, 82.5]
  - - [1024, 2048, 1, 1024, 1024, 1024, 1024, 2048]
    - [36, 116.86]
  - - [1024, 2048, 1, 2048, 1024, 1024, 1024, 2048]
    - [39, 147.49]
  - - [1024, 2048, 1, 4096, 1024, 1024, 1024, 2048]
    - [42, 165.66]
  - - [1024, 2048, 1, 8192, 1024, 1024, 1024, 2048]
    - [38, 162.38]
  - - [1024, 4096, 1, 128, 1024, 1024, 1024, 4096]
    - [10, 38.18]
  - - [1024, 4096, 1, 256, 1024, 1024, 1024, 4096]
    - [8, 66.72]
  - - [1024, 4096, 1, 512, 1024, 1024, 1024, 4096]
    - [10, 107.06]
  - - [1024, 4096, 1, 1024, 1024, 1024, 1024, 4096]
    - [11, 154.71]
  - - [1024, 4096, 1, 2048, 1024, 1024, 1024, 4096]
    - [11, 196.51]
  - - [1024, 4096, 1, 4096, 1024, 1024, 1024, 4096]
    - [86, 208.41]
  - - [1024, 4096, 1, 8192, 1024, 1024, 1024, 4096]
    - [88, 209.23]
  - - [1024, 8192, 1, 128, 1024, 1024, 1024, 8192]
    - [21, 41.9]
  - - [1024, 8192, 1, 256, 1024, 1024, 1024, 8192]
    - [20, 73.85]
  - - [1024, 8192, 1, 512, 1024, 1024, 1024, 8192]
    - [25, 118.6]
  - - [1024, 8192, 1, 1024, 1024, 1024, 1024, 8192]
    - [24, 168.4]
  - - [1024, 8192, 1, 2048, 1024, 1024, 1024, 8192]
    - [0, 206.01]
  - - [1024, 8192, 1, 4096, 1024, 1024, 1024, 8192]
    - [92, 228.34]
  - - [1024, 8192, 1, 8192, 1024, 1024, 1024, 8192]
    - [80, 253.56]
  - - [2048, 128, 1, 128, 2048, 2048, 2048, 128]
    - [66, 7.24]
  - - [2048, 128, 1, 256, 2048, 2048, 2048, 128]
    - [65, 12.63]
  - - [2048, 128, 1, 512, 2048, 2048, 2048, 128]
    - [111, 20.62]
  - - [2048, 128, 1, 1024, 2048, 2048, 2048, 128]
    - [118, 29.98]
  - - [2048, 128, 1, 2048, 2048, 2048, 2048, 128]
    - [112, 37.42]
  - - [2048, 128, 1, 4096, 2048, 2048, 2048, 128]
    - [113, 45.0]
  - - [2048, 128, 1, 8192, 2048, 2048, 2048, 128]
    - [113, 50.23]
  - - [2048, 256, 1, 128, 2048, 2048, 2048, 256]
    - [60, 12.72]
  - - [2048, 256, 1, 256, 2048, 2048, 2048, 256]
    - [60, 22.05]
  - - [2048, 256, 1, 512, 2048, 2048, 2048, 256]
    - [61, 35.24]
  - - [2048, 256, 1, 1024, 2048, 2048, 2048, 256]
    - [101, 51.73]
  - - [2048, 256, 1, 2048, 2048, 2048, 2048, 256]
    - [105, 65.41]
  - - [2048, 256, 1, 4096, 2048, 2048, 2048, 256]
    - [104, 76.75]
  - - [2048, 256, 1, 8192, 2048, 2048, 2048, 256]
    - [102, 84.29]
  - - [2048, 512, 1, 128, 2048, 2048, 2048, 512]
    - [50, 20.6]
  - - [2048, 512, 1, 256, 2048, 2048, 2048, 512]
    - [48, 35.73]
  - - [2048, 512, 1, 512, 2048, 2048, 2048, 512]
    - [50, 56.97]
  - - [2048, 512, 1, 1024, 2048, 2048, 2048, 512]
    - [95, 81.39]
  - - [2048, 512, 1, 2048, 2048, 2048, 2048, 512]
    - [97, 102.18]
  - - [2048, 512, 1, 4096, 2048, 2048, 2048, 512]
    - [97, 120.81]
  - - [2048, 512, 1, 8192, 2048, 2048, 2048, 512]
    - [98, 126.65]
  - - [2048, 1024, 1, 128, 2048, 2048, 2048, 1024]
    - [33, 29.93]
  - - [2048, 1024, 1, 256, 2048, 2048, 2048, 1024]
    - [33, 52.28]
  - - [2048, 1024, 1, 512, 2048, 2048, 2048, 1024]
    - [33, 81.95]
  - - [2048, 1024, 1, 1024, 2048, 2048, 2048, 1024]
    - [43, 114.88]
  - - [2048, 1024, 1, 2048, 2048, 2048, 2048, 1024]
    - [44, 147.33]
  - - [2048, 1024, 1, 4096, 2048, 2048, 2048, 1024]
    - [43, 164.2]
  - - [2048, 1024, 1, 8192, 2048, 2048, 2048, 1024]
    - [39, 162.62]
  - - [2048, 2048, 1, 128, 2048, 2048, 2048, 2048]
    - [10, 35.01]
  - - [2048, 2048, 1, 256, 2048, 2048, 2048, 2048]
    - [10, 61.39]
  - - [2048, 2048, 1, 512, 2048, 2048, 2048, 2048]
    - [12, 100.1]
  - - [2048, 2048, 1, 1024, 2048, 2048, 2048, 2048]
    - [12, 147.88]
  - - [2048, 2048, 1, 2048, 2048, 2048, 2048, 2048]
    - [89, 192.82]
  - - [2048, 2048, 1, 4096, 2048, 2048, 2048, 2048]
    - [91, 212.08]
  - - [2048, 2048, 1, 8192, 2048, 2048, 2048, 2048]
    - [89, 210.26]
  - - [2048, 4096, 1, 128, 2048, 2048, 2048, 4096]
    - [11, 37.6]
  - - [2048, 4096, 1, 256, 2048, 2048, 2048, 4096]
    - [10, 67.33]
  - - [2048, 4096, 1, 512, 2048, 2048, 2048, 4096]
    - [11, 109.79]
  - - [2048, 4096, 1, 1024, 2048, 2048, 2048, 4096]
    - [3, 160.4]
  - - [2048, 4096, 1, 2048, 2048, 2048, 2048, 4096]
    - [7, 202.52]
  - - [2048, 4096, 1, 4096, 2048, 2048, 2048, 4096]
    - [88, 226.19]
  - - [2048, 4096, 1, 8192, 2048, 2048, 2048, 4096]
    - [91, 254.16]
  - - [2048, 8192, 1, 128, 2048, 2048, 2048, 8192]
    - [22, 45.95]
  - - [2048, 8192, 1, 256, 2048, 2048, 2048, 8192]
    - [20, 79.39]
  - - [2048, 8192, 1, 512, 2048, 2048, 2048, 8192]
    - [23, 123.78]
  - - [2048, 8192, 1, 1024, 2048, 2048, 2048, 8192]
    - [23, 168.06]
  - - [2048, 8192, 1, 2048, 2048, 2048, 2048, 8192]
    - [12, 205.62]
  - - [2048, 8192, 1, 4096, 2048, 2048, 2048, 8192]
    - [6, 248.49]
  - - [2048, 8192, 1, 8192, 2048, 2048, 2048, 8192]
    - [6, 310.06]
  - - [4096, 128, 1, 128, 4096, 4096, 4096, 128]
    - [56, 12.5]
  - - [4096, 128, 1, 256, 4096, 4096, 4096, 128]
    - [61, 21.51]
  - - [4096, 128, 1, 512, 4096, 4096, 4096, 128]
    - [108, 34.35]
  - - [4096, 128, 1, 1024, 4096, 4096, 4096, 128]
    - [105, 50.98]
  - - [4096, 128, 1, 2048, 4096, 4096, 4096, 128]
    - [102, 63.45]
  - - [4096, 128, 1, 4096, 4096, 4096, 4096, 128]
    - [102, 76.04]
  - - [4096, 128, 1, 8192, 4096, 4096, 4096, 128]
    - [104, 83.34]
  - - [4096, 256, 1, 128, 4096, 4096, 4096, 256]
    - [49, 19.99]
  - - [4096, 256, 1, 256, 4096, 4096, 4096, 256]
    - [50, 35.17]
  - - [4096, 256, 1, 512, 4096, 4096, 4096, 256]
    - [50, 55.58]
  - - [4096, 256, 1, 1024, 4096, 4096, 4096, 256]
    - [47, 78.98]
  - - [4096, 256, 1, 2048, 4096, 4096, 4096, 256]
    - [96, 102.19]
  - - [4096, 256, 1, 4096, 4096, 4096, 4096, 256]
    - [96, 121.25]
  - - [4096, 256, 1, 8192, 4096, 4096, 4096, 256]
    - [96, 130.38]
  - - [4096, 512, 1, 128, 4096, 4096, 4096, 512]
    - [32, 28.59]
  - - [4096, 512, 1, 256, 4096, 4096, 4096, 512]
    - [32, 49.81]
  - - [4096, 512, 1, 512, 4096, 4096, 4096, 512]
    - [44, 79.22]
  - - [4096, 512, 1, 1024, 4096, 4096, 4096, 512]
    - [44, 112.91]
  - - [4096, 512, 1, 2048, 4096, 4096, 4096, 512]
    - [39, 145.23]
  - - [4096, 512, 1, 4096, 4096, 4096, 4096, 512]
    - [44, 167.76]
  - - [4096, 512, 1, 8192, 4096, 4096, 4096, 512]
    - [38, 163.24]
  - - [4096, 1024, 1, 128, 4096, 4096, 4096, 1024]
    - [18, 34.3]
  - - [4096, 1024, 1, 256, 4096, 4096, 4096, 1024]
    - [13, 60.55]
  - - [4096, 1024, 1, 512, 4096, 4096, 4096, 1024]
    - [18, 99.85]
  - - [4096, 1024, 1, 1024, 4096, 4096, 4096, 1024]
    - [91, 147.41]
  - - [4096, 1024, 1, 2048, 4096, 4096, 4096, 1024]
    - [92, 193.25]
  - - [4096, 1024, 1, 4096, 4096, 4096, 4096, 1024]
    - [92, 211.5]
  - - [4096, 1024, 1, 8192, 4096, 4096, 4096, 1024]
    - [93, 211.96]
  - - [4096, 2048, 1, 128, 4096, 4096, 4096, 2048]
    - [10, 35.29]
  - - [4096, 2048, 1, 256, 4096, 4096, 4096, 2048]
    - [10, 63.42]
  - - [4096, 2048, 1, 512, 4096, 4096, 4096, 2048]
    - [10, 104.16]
  - - [4096, 2048, 1, 1024, 4096, 4096, 4096, 2048]
    - [6, 153.59]
  - - [4096, 2048, 1, 2048, 4096, 4096, 4096, 2048]
    - [7, 199.18]
  - - [4096, 2048, 1, 4096, 4096, 4096, 4096, 2048]
    - [10, 225.73]
  - - [4096, 2048, 1, 8192, 4096, 4096, 4096, 2048]
    - [11, 256.42]
  - - [4096, 4096, 1, 128, 4096, 4096, 4096, 4096]
    - [26, 38.86]
  - - [4096, 4096, 1, 256, 4096, 4096, 4096, 4096]
    - [27, 68.17]
  - - [4096, 4096, 1, 512, 4096, 4096, 4096, 4096]
    - [36, 115.88]
  - - [4096, 4096, 1, 1024, 4096, 4096, 4096, 4096]
    - [5, 156.53]
  - - [4096, 4096, 1, 2048, 4096, 4096, 4096, 4096]
    - [15, 203.64]
  - - [4096, 4096, 1, 4096, 4096, 4096, 4096, 4096]
    - [7, 252.69]
  - - [4096, 4096, 1, 8192, 4096, 4096, 4096, 4096]
    - [81, 309.63]
  - - [4096, 8192, 1, 128, 4096, 4096, 4096, 8192]
    - [25, 46.3]
  - - [4096, 8192, 1, 256, 4096, 4096, 4096, 8192]
    - [20, 75.36]
  - - [4096, 8192, 1, 512, 4096, 4096, 4096, 8192]
    - [10, 120.11]
  - - [4096, 8192, 1, 1024, 4096, 4096, 4096, 8192]
    - [10, 167.75]
  - - [4096, 8192, 1, 2048, 4096, 4096, 4096, 8192]
    - [86, 223.95]
  - - [4096, 8192, 1, 4096, 4096, 4096, 4096, 8192]
    - [84, 280.41]
  - - [4096, 8192, 1, 8192, 4096, 4096, 4096, 8192]
    - [82, 325.37]
  - - [8192, 128, 1, 128, 8192, 8192, 8192, 128]
    - [50, 20.48]
  - - [8192, 128, 1, 256, 8192, 8192, 8192, 128]
    - [50, 35.09]
  - - [8192, 128, 1, 512, 8192, 8192, 8192, 128]
    - [50, 56.14]
  - - [8192, 128, 1, 1024, 8192, 8192, 8192, 128]
    - [45, 80.29]
  - - [8192, 128, 1, 2048, 8192, 8192, 8192, 128]
    - [97, 100.57]
  - - [8192, 128, 1, 4096, 8192, 8192, 8192, 128]
    - [98, 120.0]
  - - [8192, 128, 1, 8192, 8192, 8192, 8192, 128]
    - [96, 125.62]
  - - [8192, 256, 1, 128, 8192, 8192, 8192, 256]
    - [32, 28.39]
  - - [8192, 256, 1, 256, 8192, 8192, 8192, 256]
    - [35, 50.1]
  - - [8192, 256, 1, 512, 8192, 8192, 8192, 256]
    - [36, 78.96]
  - - [8192, 256, 1, 1024, 8192, 8192, 8192, 256]
    - [44, 113.07]
  - - [8192, 256, 1, 2048, 8192, 8192, 8192, 256]
    - [43, 142.69]
  - - [8192, 256, 1, 4096, 8192, 8192, 8192, 256]
    - [40, 165.01]
  - - [8192, 256, 1, 8192, 8192, 8192, 8192, 256]
    - [44, 160.62]
  - - [8192, 512, 1, 128, 8192, 8192, 8192, 512]
    - [14, 36.21]
  - - [8192, 512, 1, 256, 8192, 8192, 8192, 512]
    - [16, 63.43]
  - - [8192, 512, 1, 512, 8192, 8192, 8192, 512]
    - [18, 103.17]
  - - [8192, 512, 1, 1024, 8192, 8192, 8192, 512]
    - [17, 150.45]
  - - [8192, 512, 1, 2048, 8192, 8192, 8192, 512]
    - [19, 195.11]
  - - [8192, 512, 1, 4096, 8192, 8192, 8192, 512]
    - [92, 213.05]
  - - [8192, 512, 1, 8192, 8192, 8192, 8192, 512]
    - [19, 212.64]
  - - [8192, 1024, 1, 128, 8192, 8192, 8192, 1024]
    - [28, 40.24]
  - - [8192, 1024, 1, 256, 8192, 8192, 8192, 1024]
    - [29, 71.72]
  - - [8192, 1024, 1, 512, 8192, 8192, 8192, 1024]
    - [28, 115.91]
  - - [8192, 1024, 1, 1024, 8192, 8192, 8192, 1024]
    - [29, 165.72]
  - - [8192, 1024, 1, 2048, 8192, 8192, 8192, 1024]
    - [4, 204.66]
  - - [8192, 1024, 1, 4096, 8192, 8192, 8192, 1024]
    - [87, 230.66]
  - - [8192, 1024, 1, 8192, 8192, 8192, 8192, 1024]
    - [87, 273.68]
  - - [8192, 2048, 1, 128, 8192, 8192, 8192, 2048]
    - [28, 44.49]
  - - [8192, 2048, 1, 256, 8192, 8192, 8192, 2048]
    - [28, 78.04]
  - - [8192, 2048, 1, 512, 8192, 8192, 8192, 2048]
    - [28, 121.86]
  - - [8192, 2048, 1, 1024, 8192, 8192, 8192, 2048]
    - [31, 155.77]
  - - [8192, 2048, 1, 2048, 8192, 8192, 8192, 2048]
    - [17, 209.16]
  - - [8192, 2048, 1, 4096, 8192, 8192, 8192, 2048]
    - [3, 263.99]
  - - [8192, 2048, 1, 8192, 8192, 8192, 8192, 2048]
    - [81, 314.89]
  - - [8192, 4096, 1, 128, 8192, 8192, 8192, 4096]
    - [30, 42.6]
  - - [8192, 4096, 1, 256, 8192, 8192, 8192, 4096]
    - [34, 71.53]
  - - [8192, 4096, 1, 512, 8192, 8192, 8192, 4096]
    - [10, 118.95]
  - - [8192, 4096, 1, 1024, 8192, 8192, 8192, 4096]
    - [90, 169.43]
  - - [8192, 4096, 1, 2048, 8192, 8192, 8192, 4096]
    - [91, 221.87]
  - - [8192, 4096, 1, 4096, 8192, 8192, 8192, 4096]
    - [2, 287.22]
  - - [8192, 4096, 1, 8192, 8192, 8192, 8192, 4096]
    - [1, 332.12]
  - - [8192, 8192, 1, 128, 8192, 8192, 8192, 8192]
    - [21, 40.93]
  - - [8192, 8192, 1, 256, 8192, 8192, 8192, 8192]
    - [10, 72.74]
  - - [8192, 8192, 1, 512, 8192, 8192, 8192, 8192]
    - [10, 118.32]
  - - [8192, 8192, 1, 1024, 8192, 8192, 8192, 8192]
    - [2, 176.91]
  - - [8192, 8192, 1, 2048, 8192, 8192, 8192, 8192]
    - [82, 247.58]
  - - [8192, 8192, 1, 4096, 8192, 8192, 8192, 8192]
    - [85, 309.06]
  - - [8192, 8192, 1, 8192, 8192, 8192, 8192, 8192]
    - [83, 338.13]
- null
- null
- ExperimentalStreamK
- GridBased
