projects/hipblaslt/library/src/amd_detail/rocblaslt/src/Tensile/Logic/asm_full/aquavanjaram/gfx942_228cu/StreamK/aquavanjaram942_Cijk_Ailk_Bljk_B8NHS_BH_Bias_HAS_SAV_UserArgs.yaml
- {MinimumRequiredVersion: 4.33.0}
- aquavanjaram942
- {Architecture: gfx942, CUCount: 228}
- [Device 0049, Device 0050]
    SolutionIndex: 0
    SolutionNameMin: Cijk_Ailk_Bljk_B8NHS_BH_Bias_HAS_SAV_UserArgs_MT256x256x64_MI16x16x1_SN_LDSB1_CLR1_GRVWA16_GRVWB8_GSU0_GSUC0_GSUWGMRR0_K1_LBSPPA2048_LBSPPB512_LPA0_LPB8_LRVW8_MIWT8_8_PLR1_SU0_SUM0_SUS64_VWA8_VWB8_WGM1_WGMXCC1_WGMXCCGn1
    SolutionIndex: 1
    SolutionNameMin: Cijk_Ailk_Bljk_B8NHS_BH_Bias_HAS_SAV_UserArgs_MT256x256x64_MI16x16x1_SN_LDSB1_CLR1_GRVWA16_GRVWB16_GSU0_GSUC0_GSUWGMRR0_K1_LBSPPA2048_LBSPPB512_LPA0_LPB16_LRVW8_MIWT8_8_PLR1_SU0_SUM0_SUS64_VWA8_VWB8_WGM1_WGMXCC1_WGMXCCGn1
    SolutionIndex: 2
    SolutionNameMin: Cijk_Ailk_Bljk_B8NHS_BH_Bias_HAS_SAV_UserArgs_MT256x256x64_MI16x16x1_SN_LDSB1_CLR1_GRVWA16_GRVWB8_GSU0_GSUC0_GSUWGMRR0_K1_LBSPPA2048_LBSPPB512_LPA0_LPB8_LRVW8_MIWT8_8_PLR1_SU0_SUM0_SUS64_VWA8_VWB8_WGM4_WGMXCC1_WGMXCCGn1
    SolutionIndex: 3
    SolutionNameMin: Cijk_Ailk_Bljk_B8NHS_BH_Bias_HAS_SAV_UserArgs_MT256x256x64_MI16x16x1_SN_LDSB1_CLR1_GRVWA8_GRVWB16_GSU0_GSUC0_GSUWGMRR0_K1_LBSPPA2048_LBSPPB512_LPA0_LPB16_LRVW8_MIWT8_8_PLR1_SU0_SUM0_SUS64_VWA8_VWB8_WGM4_WGMXCC1_WGMXCCGn1
    SolutionIndex: 4
    SolutionNameMin: Cijk_Ailk_Bljk_B8NHS_BH_Bias_HAS_SAV_UserArgs_MT256x256x64_MI16x16x1_SN_LDSB1_CLR1_GRVWA16_GRVWB16_GSU0_GSUC0_GSUWGMRR0_K1_LBSPPA2048_LBSPPB512_LPA0_LPB16_LRVW8_MIWT8_8_PLR1_SU0_SUM0_SUS64_VWA8_VWB8_WGM4_WGMXCC1_WGMXCCGn1
    SolutionIndex: 5
    SolutionNameMin: Cijk_Ailk_Bljk_B8NHS_BH_Bias_HAS_SAV_UserArgs_MT256x256x64_MI16x16x1_SN_LDSB1_CLR1_GRVWA16_GRVWB8_GSU0_GSUC0_GSUWGMRR0_K1_LBSPPA2048_LBSPPB512_LPA0_LPB8_LRVW8_MIWT8_8_PLR1_SU0_SUM0_SUS64_VWA8_VWB8_WGM6_WGMXCC1_WGMXCCGn1
    SolutionIndex: 6
    SolutionNameMin: Cijk_Ailk_Bljk_B8NHS_BH_Bias_HAS_SAV_UserArgs_MT256x256x64_MI16x16x1_SN_LDSB1_CLR1_GRVWA8_GRVWB16_GSU0_GSUC0_GSUWGMRR0_K1_LBSPPA2048_LBSPPB512_LPA0_LPB16_LRVW8_MIWT8_8_PLR1_SU0_SUM0_SUS64_VWA8_VWB8_WGM6_WGMXCC1_WGMXCCGn1
    SolutionIndex: 7
    SolutionNameMin: Cijk_Ailk_Bljk_B8NHS_BH_Bias_HAS_SAV_UserArgs_MT256x256x64_MI16x16x1_SN_LDSB1_CLR1_GRVWA16_GRVWB16_GSU0_GSUC0_GSUWGMRR0_K1_LBSPPA2048_LBSPPB512_LPA0_LPB16_LRVW8_MIWT8_8_PLR1_SU0_SUM0_SUS64_VWA8_VWB8_WGM6_WGMXCC1_WGMXCCGn1
    SolutionIndex: 8
    SolutionNameMin: Cijk_Ailk_Bljk_B8NHS_BH_Bias_HAS_SAV_UserArgs_MT256x256x64_MI16x16x1_SN_LDSB1_CLR1_GRVWA16_GRVWB16_GSU0_GSUC0_GSUWGMRR0_K1_LBSPPA2048_LBSPPB512_LPA0_LPB16_LRVW8_MIWT8_8_PLR1_SU0_SUM0_SUS64_VWA8_VWB8_WGM8_WGMXCC1_WGMXCCGn1
    SolutionIndex: 9
    SolutionNameMin: Cijk_Ailk_Bljk_B8NHS_BH_Bias_HAS_SAV_UserArgs_MT128x256x64_MI16x16x1_SN_LDSB1_CLR1_GRVWA16_GRVWB16_GSU0_GSUC0_GSUWGMRR0_K1_LBSPPA1024_LBSPPB512_LPA64_LPB16_LRVW8_MIWT4_8_PLR1_SU0_SUM0_SUS64_VWA4_VWB8_WGM6_WGMXCC1_WGMXCCGn1
    SolutionIndex: 10
    SolutionNameMin: Cijk_Ailk_Bljk_B8NHS_BH_Bias_HAS_SAV_UserArgs_MT256x128x64_MI16x16x1_SN_LDSB1_CLR1_GRVWA8_GRVWB8_GSU0_GSUC0_GSUWGMRR0_K1_LBSPPA2048_LBSPPB256_LPA0_LPB8_LRVW8_MIWT8_4_PLR1_SU0_SUM0_SUS64_VWA8_VWB4_WGM1_WGMXCC1_WGMXCCGn1
    SolutionIndex: 11
    SolutionNameMin: Cijk_Ailk_Bljk_B8NHS_BH_Bias_HAS_SAV_UserArgs_MT256x128x64_MI16x16x1_SN_LDSB1_CLR1_GRVWA16_GRVWB8_GSU0_GSUC0_GSUWGMRR0_K1_LBSPPA2048_LBSPPB256_LPA0_LPB8_LRVW8_MIWT8_4_PLR1_SU0_SUM0_SUS64_VWA8_VWB4_WGM1_WGMXCC1_WGMXCCGn1
    SolutionIndex: 12
    SolutionNameMin: Cijk_Ailk_Bljk_B8NHS_BH_Bias_HAS_SAV_UserArgs_MT256x128x64_MI16x16x1_SN_LDSB1_CLR1_GRVWA8_GRVWB16_GSU0_GSUC0_GSUWGMRR0_K1_LBSPPA2048_LBSPPB256_LPA0_LPB16_LRVW8_MIWT8_4_PLR1_SU0_SUM0_SUS64_VWA8_VWB4_WGM1_WGMXCC1_WGMXCCGn1
    SolutionIndex: 13
    SolutionNameMin: Cijk_Ailk_Bljk_B8NHS_BH_Bias_HAS_SAV_UserArgs_MT256x128x64_MI16x16x1_SN_LDSB1_CLR1_GRVWA16_GRVWB16_GSU0_GSUC0_GSUWGMRR0_K1_LBSPPA2048_LBSPPB256_LPA0_LPB16_LRVW8_MIWT8_4_PLR1_SU0_SUM0_SUS64_VWA8_VWB4_WGM1_WGMXCC1_WGMXCCGn1
    SolutionIndex: 14
    SolutionNameMin: Cijk_Ailk_Bljk_B8NHS_BH_Bias_HAS_SAV_UserArgs_MT256x128x64_MI16x16x1_SN_LDSB1_CLR1_GRVWA16_GRVWB16_GSU0_GSUC0_GSUWGMRR0_K1_LBSPPA2048_LBSPPB256_LPA0_LPB16_LRVW8_MIWT8_4_PLR1_SU0_SUM0_SUS64_VWA8_VWB4_WGM4_WGMXCC1_WGMXCCGn1
    SolutionIndex: 15
    SolutionNameMin: Cijk_Ailk_Bljk_B8NHS_BH_Bias_HAS_SAV_UserArgs_MT256x128x64_MI16x16x1_SN_LDSB1_CLR1_GRVWA8_GRVWB8_GSU0_GSUC0_GSUWGMRR0_K1_LBSPPA2048_LBSPPB256_LPA0_LPB8_LRVW8_MIWT8_4_PLR1_SU0_SUM0_SUS64_VWA8_VWB4_WGM8_WGMXCC1_WGMXCCGn1
    SolutionIndex: 16
    SolutionNameMin: Cijk_Ailk_Bljk_B8NHS_BH_Bias_HAS_SAV_UserArgs_MT256x128x64_MI16x16x1_SN_LDSB1_CLR1_GRVWA8_GRVWB16_GSU0_GSUC0_GSUWGMRR0_K1_LBSPPA2048_LBSPPB256_LPA0_LPB16_LRVW8_MIWT8_4_PLR1_SU0_SUM0_SUS64_VWA8_VWB4_WGM8_WGMXCC1_WGMXCCGn1
    SolutionIndex: 17
    SolutionNameMin: Cijk_Ailk_Bljk_B8NHS_BH_Bias_HAS_SAV_UserArgs_MT256x128x64_MI16x16x1_SN_LDSB1_CLR1_GRVWA16_GRVWB16_GSU0_GSUC0_GSUWGMRR0_K1_LBSPPA2048_LBSPPB256_LPA0_LPB16_LRVW8_MIWT8_4_PLR1_SU0_SUM0_SUS64_VWA8_VWB4_WGM8_WGMXCC1_WGMXCCGn1
    SolutionIndex: 18
    SolutionNameMin: Cijk_Ailk_Bljk_B8NHS_BH_Bias_HAS_SAV_UserArgs_MT256x64x64_MI16x16x1_SN_LDSB1_CLR1_GRVWA16_GRVWB16_GSU0_GSUC0_GSUWGMRR0_K1_LBSPPA2048_LBSPPB128_LPA0_LPB16_LRVW8_MIWT8_2_PLR1_SU0_SUM0_SUS64_VWA8_VWB2_WGM1_WGMXCC1_WGMXCCGn1
    SolutionIndex: 19
    SolutionNameMin: Cijk_Ailk_Bljk_B8NHS_BH_Bias_HAS_SAV_UserArgs_MT128x128x64_MI16x16x1_SN_LDSB1_CLR1_GRVWA8_GRVWB16_GSU0_GSUC0_GSUWGMRR0_K1_LBSPPA1024_LBSPPB128_LPA0_LPB16_LRVW8_MIWT8_2_PLR1_SU0_SUM0_SUS64_VWA8_VWB2_WGM1_WGMXCC1_WGMXCCGn1
    SolutionIndex: 20
    SolutionNameMin: Cijk_Ailk_Bljk_B8NHS_BH_Bias_HAS_SAV_UserArgs_MT128x128x64_MI16x16x1_SN_LDSB1_CLR1_GRVWA16_GRVWB16_GSU0_GSUC0_GSUWGMRR0_K1_LBSPPA1024_LBSPPB128_LPA0_LPB16_LRVW8_MIWT8_2_PLR1_SU0_SUM0_SUS64_VWA8_VWB2_WGM1_WGMXCC1_WGMXCCGn1
    SolutionIndex: 21
    SolutionNameMin: Cijk_Ailk_Bljk_B8NHS_BH_Bias_HAS_SAV_UserArgs_MT64x128x64_MI16x16x1_SN_LDSB0_CLR1_GRVWA16_GRVWB8_GSU0_GSUC0_GSUWGMRR0_K1_LBSPPA512_LBSPPB256_LPA32_LPB8_LRVW8_MIWT2_4_PLR1_SU0_SUM0_SUS64_VWA2_VWB4_WGM1_WGMXCC1_WGMXCCGn1
    SolutionIndex: 22
    SolutionNameMin: Cijk_Ailk_Bljk_B8NHS_BH_Bias_HAS_SAV_UserArgs_MT64x128x64_MI16x16x1_SN_LDSB0_CLR1_GRVWA8_GRVWB16_GSU0_GSUC0_GSUWGMRR0_K1_LBSPPA512_LBSPPB256_LPA32_LPB16_LRVW8_MIWT2_4_PLR1_SU0_SUM0_SUS64_VWA2_VWB4_WGM1_WGMXCC1_WGMXCCGn1
    SolutionIndex: 23
    SolutionNameMin: Cijk_Ailk_Bljk_B8NHS_BH_Bias_HAS_SAV_UserArgs_MT64x128x64_MI16x16x1_SN_LDSB0_CLR1_GRVWA16_GRVWB16_GSU0_GSUC0_GSUWGMRR0_K1_LBSPPA512_LBSPPB256_LPA32_LPB16_LRVW8_MIWT2_4_PLR1_SU0_SUM0_SUS64_VWA2_VWB4_WGM1_WGMXCC1_WGMXCCGn1
    SolutionIndex: 24
    SolutionNameMin: Cijk_Ailk_Bljk_B8NHS_BH_Bias_HAS_SAV_UserArgs_MT128x64x64_MI16x16x1_SN_LDSB0_CLR1_GRVWA8_GRVWB16_GSU0_GSUC0_GSUWGMRR0_K1_LBSPPA1024_LBSPPB128_LPA64_LPB16_LRVW8_MIWT4_2_PLR1_SU0_SUM0_SUS64_VWA4_VWB2_WGM1_WGMXCC1_WGMXCCGn1
    SolutionIndex: 25
    SolutionNameMin: Cijk_Ailk_Bljk_B8NHS_BH_Bias_HAS_SAV_UserArgs_MT128x32x64_MI16x16x1_SN_LDSB0_CLR1_GRVWA8_GRVWB8_GSU0_GSUC0_GSUWGMRR0_K1_LBSPPA1024_LBSPPB128_LPA64_LPB8_LRVW8_MIWT4_1_PLR1_SU0_SUM0_SUS64_VWA4_VWB1_WGM1_WGMXCC1_WGMXCCGn1
    SolutionIndex: 26
    SolutionNameMin: Cijk_Ailk_Bljk_B8NHS_BH_Bias_HAS_SAV_UserArgs_MT64x64x64_MI16x16x1_SN_LDSB0_CLR1_GRVWA8_GRVWB8_GSU0_GSUC0_GSUWGMRR0_K1_LBSPPA512_LBSPPB128_LPA32_LPB8_LRVW8_MIWT2_2_PLR1_SU0_SUM0_SUS64_VWA2_VWB2_WGM1_WGMXCC1_WGMXCCGn1
    SolutionIndex: 27
    SolutionNameMin: Cijk_Ailk_Bljk_B8NHS_BH_Bias_HAS_SAV_UserArgs_MT64x64x64_MI16x16x1_SN_LDSB0_CLR1_GRVWA16_GRVWB8_GSU0_GSUC0_GSUWGMRR0_K1_LBSPPA512_LBSPPB128_LPA32_LPB8_LRVW8_MIWT2_2_PLR1_SU0_SUM0_SUS64_VWA2_VWB2_WGM1_WGMXCC1_WGMXCCGn1
    SolutionIndex: 28
    SolutionNameMin: Cijk_Ailk_Bljk_B8NHS_BH_Bias_HAS_SAV_UserArgs_MT64x64x64_MI16x16x1_SN_LDSB0_CLR1_GRVWA8_GRVWB16_GSU0_GSUC0_GSUWGMRR0_K1_LBSPPA512_LBSPPB128_LPA32_LPB16_LRVW8_MIWT2_2_PLR1_SU0_SUM0_SUS64_VWA2_VWB2_WGM1_WGMXCC1_WGMXCCGn1
    SolutionIndex: 29
    SolutionNameMin: Cijk_Ailk_Bljk_B8NHS_BH_Bias_HAS_SAV_UserArgs_MT64x64x64_MI16x16x1_SN_LDSB0_CLR1_GRVWA16_GRVWB16_GSU0_GSUC0_GSUWGMRR0_K1_LBSPPA512_LBSPPB128_LPA32_LPB16_LRVW8_MIWT2_2_PLR1_SU0_SUM0_SUS64_VWA2_VWB2_WGM1_WGMXCC1_WGMXCCGn1
    SolutionIndex: 30
    SolutionNameMin: Cijk_Ailk_Bljk_B8NHS_BH_Bias_HAS_SAV_UserArgs_MT32x32x64_MI16x16x1_SN_LDSB0_CLR1_GRVWA8_GRVWB8_GSU0_GSUC0_GSUWGMRR0_K1_LBSPPA256_LBSPPB128_LPA16_LPB8_LRVW8_MIWT1_1_PLR1_SU0_SUM0_SUS64_VWA1_VWB1_WGM1_WGMXCC1_WGMXCCGn1
    SolutionIndex: 31
    SolutionNameMin: Cijk_Ailk_Bljk_B8NHS_BH_Bias_HAS_SAV_UserArgs_MT128x256x128_MI16x16x1_SN_LDSB1_CLR1_GRVWA16_GRVWB16_GSU0_GSUC0_GSUWGMRR0_K1_LBSPPA1024_LBSPPB1024_LPA64_LPB16_LRVW8_MIWT4_8_PLR1_SU0_SUM0_SUS128_VWA4_VWB8_WGM1_WGMXCC1_WGMXCCGn1
    SolutionIndex: 32
    SolutionNameMin: Cijk_Ailk_Bljk_B8NHS_BH_Bias_HAS_SAV_UserArgs_MT128x256x128_MI16x16x1_SN_LDSB1_CLR1_GRVWA16_GRVWB16_GSU0_GSUC0_GSUWGMRR0_K1_LBSPPA1024_LBSPPB1024_LPA64_LPB16_LRVW8_MIWT4_8_PLR1_SU0_SUM0_SUS128_VWA4_VWB8_WGM4_WGMXCC1_WGMXCCGn1
    SolutionIndex: 33
    SolutionNameMin: Cijk_Ailk_Bljk_B8NHS_BH_Bias_HAS_SAV_UserArgs_MT128x256x128_MI16x16x1_SN_LDSB1_CLR1_GRVWA8_GRVWB16_GSU0_GSUC0_GSUWGMRR0_K1_LBSPPA1024_LBSPPB1024_LPA64_LPB16_LRVW8_MIWT4_8_PLR1_SU0_SUM0_SUS128_VWA4_VWB8_WGM6_WGMXCC1_WGMXCCGn1
    SolutionIndex: 34
    SolutionNameMin: Cijk_Ailk_Bljk_B8NHS_BH_Bias_HAS_SAV_UserArgs_MT128x256x128_MI16x16x1_SN_LDSB1_CLR1_GRVWA16_GRVWB16_GSU0_GSUC0_GSUWGMRR0_K1_LBSPPA1024_LBSPPB1024_LPA64_LPB16_LRVW8_MIWT4_8_PLR1_SU0_SUM0_SUS128_VWA4_VWB8_WGM6_WGMXCC1_WGMXCCGn1
    SolutionIndex: 35
    SolutionNameMin: Cijk_Ailk_Bljk_B8NHS_BH_Bias_HAS_SAV_UserArgs_MT256x144x128_MI16x16x1_SN_LDSB1_CLR1_GRVWA8_GRVWB8_GSU0_GSUC0_GSUWGMRR0_K1_LBSPPA2048_LBSPPB128_LPA64_LPB8_LRVW8_MIWT4_9_PLR1_SU0_SUM0_SUS128_VWA4_VWB1_WGM1_WGMXCC1_WGMXCCGn1
    SolutionIndex: 36
    SolutionNameMin: Cijk_Ailk_Bljk_B8NHS_BH_Bias_HAS_SAV_UserArgs_MT256x144x128_MI16x16x1_SN_LDSB1_CLR1_GRVWA16_GRVWB8_GSU0_GSUC0_GSUWGMRR0_K1_LBSPPA2048_LBSPPB128_LPA64_LPB8_LRVW8_MIWT4_9_PLR1_SU0_SUM0_SUS128_VWA4_VWB1_WGM1_WGMXCC1_WGMXCCGn1
    SolutionIndex: 37
    SolutionNameMin: Cijk_Ailk_Bljk_B8NHS_BH_Bias_HAS_SAV_UserArgs_MT256x144x128_MI16x16x1_SN_LDSB1_CLR1_GRVWA16_GRVWB8_GSU0_GSUC0_GSUWGMRR0_K1_LBSPPA2048_LBSPPB128_LPA64_LPB8_LRVW8_MIWT4_9_PLR1_SU0_SUM0_SUS128_VWA4_VWB1_WGM4_WGMXCC1_WGMXCCGn1
    SolutionIndex: 38
    SolutionNameMin: Cijk_Ailk_Bljk_B8NHS_BH_Bias_HAS_SAV_UserArgs_MT256x144x128_MI16x16x1_SN_LDSB1_CLR1_GRVWA16_GRVWB8_GSU0_GSUC0_GSUWGMRR0_K1_LBSPPA2048_LBSPPB128_LPA64_LPB8_LRVW8_MIWT4_9_PLR1_SU0_SUM0_SUS128_VWA4_VWB1_WGM6_WGMXCC1_WGMXCCGn1
    SolutionIndex: 39
    SolutionNameMin: Cijk_Ailk_Bljk_B8NHS_BH_Bias_HAS_SAV_UserArgs_MT256x144x128_MI16x16x1_SN_LDSB1_CLR1_GRVWA16_GRVWB8_GSU0_GSUC0_GSUWGMRR0_K1_LBSPPA2048_LBSPPB128_LPA64_LPB8_LRVW8_MIWT4_9_PLR1_SU0_SUM0_SUS128_VWA4_VWB1_WGM8_WGMXCC1_WGMXCCGn1
    SolutionIndex: 40
    SolutionNameMin: Cijk_Ailk_Bljk_B8NHS_BH_Bias_HAS_SAV_UserArgs_MT256x128x128_MI16x16x1_SN_LDSB1_CLR1_GRVWA8_GRVWB8_GSU0_GSUC0_GSUWGMRR0_K1_LBSPPA2048_LBSPPB512_LPA0_LPB8_LRVW8_MIWT8_4_PLR1_SU0_SUM0_SUS128_VWA8_VWB4_WGM1_WGMXCC1_WGMXCCGn1
    SolutionIndex: 41
    SolutionNameMin: Cijk_Ailk_Bljk_B8NHS_BH_Bias_HAS_SAV_UserArgs_MT256x128x128_MI16x16x1_SN_LDSB1_CLR1_GRVWA16_GRVWB8_GSU0_GSUC0_GSUWGMRR0_K1_LBSPPA2048_LBSPPB512_LPA0_LPB8_LRVW8_MIWT8_4_PLR1_SU0_SUM0_SUS128_VWA8_VWB4_WGM6_WGMXCC1_WGMXCCGn1
    SolutionIndex: 42
    SolutionNameMin: Cijk_Ailk_Bljk_B8NHS_BH_Bias_HAS_SAV_UserArgs_MT256x128x128_MI16x16x1_SN_LDSB1_CLR1_GRVWA16_GRVWB8_GSU0_GSUC0_GSUWGMRR0_K1_LBSPPA2048_LBSPPB512_LPA0_LPB8_LRVW8_MIWT8_4_PLR1_SU0_SUM0_SUS128_VWA8_VWB4_WGM8_WGMXCC1_WGMXCCGn1
    SolutionIndex: 43
    SolutionNameMin: Cijk_Ailk_Bljk_B8NHS_BH_Bias_HAS_SAV_UserArgs_MT128x128x128_MI16x16x1_SN_LDSB1_CLR1_GRVWA8_GRVWB16_GSU0_GSUC0_GSUWGMRR0_K1_LBSPPA1024_LBSPPB256_LPA0_LPB16_LRVW8_MIWT8_2_PLR1_SU0_SUM0_SUS128_VWA8_VWB2_WGM1_WGMXCC1_WGMXCCGn1
    SolutionIndex: 44
    SolutionNameMin: Cijk_Ailk_Bljk_B8NHS_BH_Bias_HAS_SAV_UserArgs_MT128x128x128_MI16x16x1_SN_LDSB1_CLR1_GRVWA16_GRVWB16_GSU0_GSUC0_GSUWGMRR0_K1_LBSPPA1024_LBSPPB256_LPA0_LPB16_LRVW8_MIWT8_2_PLR1_SU0_SUM0_SUS128_VWA8_VWB2_WGM1_WGMXCC1_WGMXCCGn1
    SolutionIndex: 45
    SolutionNameMin: Cijk_Ailk_Bljk_B8NHS_BH_Bias_HAS_SAV_UserArgs_MT128x144x128_MI16x16x1_SN_LDSB1_CLR1_GRVWA8_GRVWB8_GSU0_GSUC0_GSUWGMRR0_K1_LBSPPA1024_LBSPPB128_LPA32_LPB8_LRVW8_MIWT2_9_PLR1_SU0_SUM0_SUS128_VWA2_VWB1_WGM1_WGMXCC1_WGMXCCGn1
    SolutionIndex: 46
    SolutionNameMin: Cijk_Ailk_Bljk_B8NHS_BH_Bias_HAS_SAV_UserArgs_MT128x144x128_MI16x16x1_SN_LDSB1_CLR1_GRVWA16_GRVWB8_GSU0_GSUC0_GSUWGMRR0_K1_LBSPPA1024_LBSPPB128_LPA32_LPB8_LRVW8_MIWT2_9_PLR1_SU0_SUM0_SUS128_VWA2_VWB1_WGM1_WGMXCC1_WGMXCCGn1
    SolutionIndex: 47
    SolutionNameMin: Cijk_Ailk_Bljk_B8NHS_BH_Bias_HAS_SAV_UserArgs_MT128x128x128_MI16x16x1_SN_LDSB1_CLR1_GRVWA16_GRVWB16_GSU0_GSUC0_GSUWGMRR0_K1_LBSPPA1024_LBSPPB512_LPA64_LPB16_LRVW8_MIWT4_4_PLR1_SU0_SUM0_SUS128_VWA4_VWB4_WGM1_WGMXCC1_WGMXCCGn1
    SolutionIndex: 48
    SolutionNameMin: Cijk_Ailk_Bljk_B8NHS_BH_Bias_HAS_SAV_UserArgs_MT128x128x128_MI16x16x1_SN_LDSB1_CLR1_GRVWA16_GRVWB16_GSU0_GSUC0_GSUWGMRR0_K1_LBSPPA1024_LBSPPB512_LPA64_LPB16_LRVW8_MIWT4_4_PLR1_SU0_SUM0_SUS128_VWA4_VWB4_WGM4_WGMXCC1_WGMXCCGn1
    SolutionIndex: 49
    SolutionNameMin: Cijk_Ailk_Bljk_B8NHS_BH_Bias_HAS_SAV_UserArgs_MT128x128x128_MI16x16x1_SN_LDSB1_CLR1_GRVWA16_GRVWB16_GSU0_GSUC0_GSUWGMRR0_K1_LBSPPA1024_LBSPPB512_LPA64_LPB16_LRVW8_MIWT4_4_PLR1_SU0_SUM0_SUS128_VWA4_VWB4_WGM6_WGMXCC1_WGMXCCGn1
    SolutionIndex: 50
    SolutionNameMin: Cijk_Ailk_Bljk_B8NHS_BH_Bias_HAS_SAV_UserArgs_MT128x128x128_MI16x16x1_SN_LDSB1_CLR1_GRVWA16_GRVWB16_GSU0_GSUC0_GSUWGMRR0_K1_LBSPPA1024_LBSPPB512_LPA64_LPB16_LRVW8_MIWT4_4_PLR1_SU0_SUM0_SUS128_VWA4_VWB4_WGM8_WGMXCC1_WGMXCCGn1
    SolutionIndex: 51
    SolutionNameMin: Cijk_Ailk_Bljk_B8NHS_BH_Bias_HAS_SAV_UserArgs_MT64x128x128_MI16x16x1_SN_LDSB1_CLR1_GRVWA16_GRVWB16_GSU0_GSUC0_GSUWGMRR0_K1_LBSPPA512_LBSPPB512_LPA32_LPB16_LRVW8_MIWT2_4_PLR1_SU0_SUM0_SUS128_VWA2_VWB4_WGM1_WGMXCC1_WGMXCCGn1
    SolutionIndex: 52
    SolutionNameMin: Cijk_Ailk_Bljk_B8NHS_BH_Bias_HAS_SAV_UserArgs_MT128x64x128_MI16x16x1_SN_LDSB1_CLR1_GRVWA16_GRVWB16_GSU0_GSUC0_GSUWGMRR0_K1_LBSPPA1024_LBSPPB256_LPA64_LPB16_LRVW8_MIWT4_2_PLR1_SU0_SUM0_SUS128_VWA4_VWB2_WGM1_WGMXCC1_WGMXCCGn1
    SolutionIndex: 53
    SolutionNameMin: Cijk_Ailk_Bljk_B8NHS_BH_Bias_HAS_SAV_UserArgs_MT128x64x128_MI16x16x1_SN_LDSB1_CLR1_GRVWA16_GRVWB16_GSU0_GSUC0_GSUWGMRR0_K1_LBSPPA1024_LBSPPB256_LPA64_LPB16_LRVW8_MIWT4_2_PLR1_SU0_SUM0_SUS128_VWA4_VWB2_WGM4_WGMXCC1_WGMXCCGn1
    SolutionIndex: 54
    SolutionNameMin: Cijk_Ailk_Bljk_B8NHS_BH_Bias_HAS_SAV_UserArgs_MT128x64x128_MI16x16x1_SN_LDSB1_CLR1_GRVWA16_GRVWB16_GSU0_GSUC0_GSUWGMRR0_K1_LBSPPA1024_LBSPPB256_LPA64_LPB16_LRVW8_MIWT4_2_PLR1_SU0_SUM0_SUS128_VWA4_VWB2_WGM6_WGMXCC1_WGMXCCGn1
    SolutionIndex: 55
    SolutionNameMin: Cijk_Ailk_Bljk_B8NHS_BH_Bias_HAS_SAV_UserArgs_MT128x64x128_MI16x16x1_SN_LDSB1_CLR1_GRVWA16_GRVWB16_GSU0_GSUC0_GSUWGMRR0_K1_LBSPPA1024_LBSPPB256_LPA64_LPB16_LRVW8_MIWT4_2_PLR1_SU0_SUM0_SUS128_VWA4_VWB2_WGM8_WGMXCC1_WGMXCCGn1
    SolutionIndex: 56
    SolutionNameMin: Cijk_Ailk_Bljk_B8NHS_BH_Bias_HAS_SAV_UserArgs_MT64x64x128_MI16x16x1_SN_LDSB1_CLR1_GRVWA16_GRVWB8_GSU0_GSUC0_GSUWGMRR0_K1_LBSPPA512_LBSPPB256_LPA32_LPB8_LRVW8_MIWT2_2_PLR1_SU0_SUM0_SUS128_VWA2_VWB2_WGM1_WGMXCC1_WGMXCCGn1
    SolutionIndex: 57
    SolutionNameMin: Cijk_Ailk_Bljk_B8NHS_BH_Bias_HAS_SAV_UserArgs_MT64x64x128_MI16x16x1_SN_LDSB1_CLR1_GRVWA8_GRVWB16_GSU0_GSUC0_GSUWGMRR0_K1_LBSPPA512_LBSPPB256_LPA32_LPB16_LRVW8_MIWT2_2_PLR1_SU0_SUM0_SUS128_VWA2_VWB2_WGM1_WGMXCC1_WGMXCCGn1
    SolutionIndex: 58
    SolutionNameMin: Cijk_Ailk_Bljk_B8NHS_BH_Bias_HAS_SAV_UserArgs_MT64x64x128_MI16x16x1_SN_LDSB1_CLR1_GRVWA16_GRVWB16_GSU0_GSUC0_GSUWGMRR0_K1_LBSPPA512_LBSPPB256_LPA32_LPB16_LRVW8_MIWT2_2_PLR1_SU0_SUM0_SUS128_VWA2_VWB2_WGM1_WGMXCC1_WGMXCCGn1
    SolutionIndex: 59
    SolutionNameMin: Cijk_Ailk_Bljk_B8NHS_BH_Bias_HAS_SAV_UserArgs_MT64x64x128_MI16x16x1_SN_LDSB1_CLR1_GRVWA16_GRVWB16_GSU0_GSUC0_GSUWGMRR0_K1_LBSPPA512_LBSPPB256_LPA32_LPB16_LRVW8_MIWT2_2_PLR1_SU0_SUM0_SUS128_VWA2_VWB2_WGM4_WGMXCC1_WGMXCCGn1
    SolutionIndex: 60
    SolutionNameMin: Cijk_Ailk_Bljk_B8NHS_BH_Bias_HAS_SAV_UserArgs_MT64x64x128_MI16x16x1_SN_LDSB1_CLR1_GRVWA16_GRVWB16_GSU0_GSUC0_GSUWGMRR0_K1_LBSPPA512_LBSPPB256_LPA32_LPB16_LRVW8_MIWT2_2_PLR1_SU0_SUM0_SUS128_VWA2_VWB2_WGM6_WGMXCC1_WGMXCCGn1
    SolutionIndex: 61
    SolutionNameMin: Cijk_Ailk_Bljk_B8NHS_BH_Bias_HAS_SAV_UserArgs_MT64x64x128_MI16x16x1_SN_LDSB1_CLR1_GRVWA16_GRVWB16_GSU0_GSUC0_GSUWGMRR0_K1_LBSPPA512_LBSPPB256_LPA32_LPB16_LRVW8_MIWT2_2_PLR1_SU0_SUM0_SUS128_VWA2_VWB2_WGM8_WGMXCC1_WGMXCCGn1
    SolutionIndex: 62
    SolutionNameMin: Cijk_Ailk_Bljk_B8NHS_BH_Bias_HAS_SAV_UserArgs_MT32x64x128_MI16x16x1_SN_LDSB0_CLR1_GRVWA8_GRVWB16_GSU0_GSUC0_GSUWGMRR0_K1_LBSPPA256_LBSPPB256_LPA16_LPB16_LRVW8_MIWT1_2_PLR1_SU0_SUM0_SUS128_VWA1_VWB2_WGM1_WGMXCC1_WGMXCCGn1
    SolutionIndex: 63
    SolutionNameMin: Cijk_Ailk_Bljk_B8NHS_BH_Bias_HAS_SAV_UserArgs_MT32x64x128_MI16x16x1_SN_LDSB0_CLR1_GRVWA8_GRVWB16_GSU0_GSUC0_GSUWGMRR0_K1_LBSPPA256_LBSPPB256_LPA16_LPB16_LRVW8_MIWT1_2_PLR1_SU0_SUM0_SUS128_VWA1_VWB2_WGM4_WGMXCC1_WGMXCCGn1
    SolutionIndex: 64
    SolutionNameMin: Cijk_Ailk_Bljk_B8NHS_BH_Bias_HAS_SAV_UserArgs_MT32x64x128_MI16x16x1_SN_LDSB0_CLR1_GRVWA16_GRVWB16_GSU0_GSUC0_GSUWGMRR0_K1_LBSPPA256_LBSPPB256_LPA16_LPB16_LRVW8_MIWT1_2_PLR1_SU0_SUM0_SUS128_VWA1_VWB2_WGM6_WGMXCC1_WGMXCCGn1
    SolutionIndex: 65
    SolutionNameMin: Cijk_Ailk_Bljk_B8NHS_BH_Bias_HAS_SAV_UserArgs_MT64x32x128_MI16x16x1_SN_LDSB0_CLR1_GRVWA8_GRVWB8_GSU0_GSUC0_GSUWGMRR0_K1_LBSPPA512_LBSPPB128_LPA32_LPB8_LRVW8_MIWT2_1_PLR1_SU0_SUM0_SUS128_VWA2_VWB1_WGM1_WGMXCC1_WGMXCCGn1
    SolutionIndex: 66
    SolutionNameMin: Cijk_Ailk_Bljk_B8NHS_BH_Bias_HAS_SAV_UserArgs_MT64x32x128_MI16x16x1_SN_LDSB0_CLR1_GRVWA16_GRVWB8_GSU0_GSUC0_GSUWGMRR0_K1_LBSPPA512_LBSPPB128_LPA32_LPB8_LRVW8_MIWT2_1_PLR1_SU0_SUM0_SUS128_VWA2_VWB1_WGM1_WGMXCC1_WGMXCCGn1
    SolutionIndex: 67
    SolutionNameMin: Cijk_Ailk_Bljk_B8NHS_BH_Bias_HAS_SAV_UserArgs_MT64x32x128_MI16x16x1_SN_LDSB0_CLR1_GRVWA8_GRVWB16_GSU0_GSUC0_GSUWGMRR0_K1_LBSPPA512_LBSPPB128_LPA32_LPB16_LRVW8_MIWT2_1_PLR1_SU0_SUM0_SUS128_VWA2_VWB1_WGM1_WGMXCC1_WGMXCCGn1
    SolutionIndex: 68
    SolutionNameMin: Cijk_Ailk_Bljk_B8NHS_BH_Bias_HAS_SAV_UserArgs_MT64x32x128_MI16x16x1_SN_LDSB0_CLR1_GRVWA16_GRVWB16_GSU0_GSUC0_GSUWGMRR0_K1_LBSPPA512_LBSPPB128_LPA32_LPB16_LRVW8_MIWT2_1_PLR1_SU0_SUM0_SUS128_VWA2_VWB1_WGM1_WGMXCC1_WGMXCCGn1
    SolutionIndex: 69
    SolutionNameMin: Cijk_Ailk_Bljk_B8NHS_BH_Bias_HAS_SAV_UserArgs_MT32x32x128_MI16x16x1_SN_LDSB0_CLR1_GRVWA8_GRVWB8_GSU0_GSUC0_GSUWGMRR0_K1_LBSPPA256_LBSPPB128_LPA16_LPB8_LRVW8_MIWT1_1_PLR1_SU0_SUM0_SUS128_VWA1_VWB1_WGM1_WGMXCC1_WGMXCCGn1
    SolutionIndex: 70
    SolutionNameMin: Cijk_Ailk_Bljk_B8NHS_BH_Bias_HAS_SAV_UserArgs_MT32x32x128_MI16x16x1_SN_LDSB0_CLR1_GRVWA8_GRVWB16_GSU0_GSUC0_GSUWGMRR0_K1_LBSPPA256_LBSPPB128_LPA16_LPB16_LRVW8_MIWT1_1_PLR1_SU0_SUM0_SUS128_VWA1_VWB1_WGM1_WGMXCC1_WGMXCCGn1
    SolutionIndex: 71
    SolutionNameMin: Cijk_Ailk_Bljk_B8NHS_BH_Bias_HAS_SAV_UserArgs_MT32x32x128_MI16x16x1_SN_LDSB0_CLR1_GRVWA16_GRVWB16_GSU0_GSUC0_GSUWGMRR0_K1_LBSPPA256_LBSPPB128_LPA16_LPB16_LRVW8_MIWT1_1_PLR1_SU0_SUM0_SUS128_VWA1_VWB1_WGM1_WGMXCC1_WGMXCCGn1
    SolutionIndex: 72
    SolutionNameMin: Cijk_Ailk_Bljk_B8NHS_BH_Bias_HAS_SAV_UserArgs_MT64x64x256_MI16x16x1_SN_LDSB1_CLR1_GRVWA16_GRVWB16_GSU0_GSUC0_GSUWGMRR0_K1_LBSPPA512_LBSPPB512_LPA32_LPB16_LRVW8_MIWT2_2_PLR1_SU0_SUM0_SUS256_VWA2_VWB2_WGM1_WGMXCC1_WGMXCCGn1
    SolutionIndex: 73
    SolutionNameMin: Cijk_Ailk_Bljk_B8NHS_BH_Bias_HAS_SAV_UserArgs_MT64x64x256_MI16x16x1_SN_LDSB1_CLR1_GRVWA16_GRVWB16_GSU0_GSUC0_GSUWGMRR0_K1_LBSPPA512_LBSPPB512_LPA32_LPB16_LRVW8_MIWT2_2_PLR1_SU0_SUM0_SUS256_VWA2_VWB2_WGM4_WGMXCC1_WGMXCCGn1
    SolutionIndex: 74
    SolutionNameMin: Cijk_Ailk_Bljk_B8NHS_BH_Bias_HAS_SAV_UserArgs_MT64x32x256_MI16x16x1_SN_LDSB1_CLR1_GRVWA8_GRVWB8_GSU0_GSUC0_GSUWGMRR0_K1_LBSPPA512_LBSPPB256_LPA32_LPB8_LRVW8_MIWT2_1_PLR1_SU0_SUM0_SUS256_VWA2_VWB1_WGM1_WGMXCC1_WGMXCCGn1
    SolutionIndex: 75
    SolutionNameMin: Cijk_Ailk_Bljk_B8NHS_BH_Bias_HAS_SAV_UserArgs_MT64x32x256_MI16x16x1_SN_LDSB1_CLR1_GRVWA16_GRVWB16_GSU0_GSUC0_GSUWGMRR0_K1_LBSPPA512_LBSPPB256_LPA32_LPB16_LRVW8_MIWT2_1_PLR1_SU0_SUM0_SUS256_VWA2_VWB1_WGM1_WGMXCC1_WGMXCCGn1
    SolutionIndex: 76
    SolutionNameMin: Cijk_Ailk_Bljk_B8NHS_BH_Bias_HAS_SAV_UserArgs_MT64x32x256_MI16x16x1_SN_LDSB1_CLR1_GRVWA16_GRVWB16_GSU0_GSUC0_GSUWGMRR0_K1_LBSPPA512_LBSPPB256_LPA32_LPB16_LRVW8_MIWT2_1_PLR1_SU0_SUM0_SUS256_VWA2_VWB1_WGM4_WGMXCC1_WGMXCCGn1
    SolutionIndex: 77
    SolutionNameMin: Cijk_Ailk_Bljk_B8NHS_BH_Bias_HAS_SAV_UserArgs_MT64x32x256_MI16x16x1_SN_LDSB1_CLR1_GRVWA16_GRVWB16_GSU0_GSUC0_GSUWGMRR0_K1_LBSPPA512_LBSPPB256_LPA32_LPB16_LRVW8_MIWT2_1_PLR1_SU0_SUM0_SUS256_VWA2_VWB1_WGM6_WGMXCC1_WGMXCCGn1
    SolutionIndex: 78
    SolutionNameMin: Cijk_Ailk_Bljk_B8NHS_BH_Bias_HAS_SAV_UserArgs_MT64x32x256_MI16x16x1_SN_LDSB1_CLR1_GRVWA16_GRVWB16_GSU0_GSUC0_GSUWGMRR0_K1_LBSPPA512_LBSPPB256_LPA32_LPB16_LRVW8_MIWT2_1_PLR1_SU0_SUM0_SUS256_VWA2_VWB1_WGM8_WGMXCC1_WGMXCCGn1
    SolutionIndex: 79
    SolutionNameMin: Cijk_Ailk_Bljk_B8NHS_BH_Bias_HAS_SAV_UserArgs_MT32x32x256_MI16x16x1_SN_LDSB1_CLR1_GRVWA16_GRVWB16_GSU0_GSUC0_GSUWGMRR0_K1_LBSPPA256_LBSPPB256_LPA16_LPB16_LRVW8_MIWT1_1_PLR1_SU0_SUM0_SUS256_VWA1_VWB1_WGM4_WGMXCC1_WGMXCCGn1
    SolutionIndex: 80
    SolutionNameMin: Cijk_Ailk_Bljk_B8NHS_BH_Bias_HAS_SAV_UserArgs_MT32x32x256_MI16x16x1_SN_LDSB1_CLR1_GRVWA8_GRVWB16_GSU0_GSUC0_GSUWGMRR0_K1_LBSPPA256_LBSPPB256_LPA16_LPB16_LRVW8_MIWT1_1_PLR1_SU0_SUM0_SUS256_VWA1_VWB1_WGM8_WGMXCC1_WGMXCCGn1
    SolutionIndex: 81
    SolutionNameMin: Cijk_Ailk_Bljk_B8NHS_BH_Bias_HAS_SAV_UserArgs_MT32x32x256_MI16x16x1_SN_LDSB1_CLR1_GRVWA16_GRVWB16_GSU0_GSUC0_GSUWGMRR0_K1_LBSPPA256_LBSPPB256_LPA16_LPB16_LRVW8_MIWT1_1_PLR1_SU0_SUM0_SUS256_VWA1_VWB1_WGM8_WGMXCC1_WGMXCCGn1
- - - [128, 128, 1, 128, 128, 128, 128, 128]
    - [30, 0.56]
  - - [128, 128, 1, 256, 128, 128, 128, 256]
    - [30, 1.01]
  - - [128, 128, 1, 512, 128, 128, 128, 512]
    - [70, 1.75]
  - - [128, 128, 1, 1024, 128, 128, 128, 1024]
    - [69, 2.75]
  - - [128, 128, 1, 2048, 128, 128, 128, 2048]
    - [69, 3.82]
  - - [128, 128, 1, 4096, 128, 128, 128, 4096]
    - [69, 4.8]
  - - [128, 128, 1, 8192, 128, 128, 128, 8192]
    - [69, 5.48]
  - - [128, 256, 1, 128, 128, 128, 128, 128]
    - [70, 1.14]
  - - [128, 256, 1, 256, 128, 128, 128, 256]
    - [70, 2.08]
  - - [128, 256, 1, 512, 128, 128, 128, 512]
    - [70, 3.54]
  - - [128, 256, 1, 1024, 128, 128, 128, 1024]
    - [69, 5.51]
  - - [128, 256, 1, 2048, 128, 128, 128, 2048]
    - [69, 7.69]
  - - [128, 256, 1, 4096, 128, 128, 128, 4096]
    - [69, 9.6]
  - - [128, 256, 1, 8192, 128, 128, 128, 8192]
    - [69, 10.95]
  - - [128, 512, 1, 128, 128, 128, 128, 128]
    - [30, 2.23]
  - - [128, 512, 1, 256, 128, 128, 128, 256]
    - [70, 4.02]
  - - [128, 512, 1, 512, 128, 128, 128, 512]
    - [69, 6.95]
  - - [128, 512, 1, 1024, 128, 128, 128, 1024]
    - [70, 10.83]
  - - [128, 512, 1, 2048, 128, 128, 128, 2048]
    - [69, 15.29]
  - - [128, 512, 1, 4096, 128, 128, 128, 4096]
    - [69, 19.04]
  - - [128, 512, 1, 8192, 128, 128, 128, 8192]
    - [71, 21.7]
  - - [128, 1024, 1, 128, 128, 128, 128, 128]
    - [30, 4.3]
  - - [128, 1024, 1, 256, 128, 128, 128, 256]
    - [30, 7.9]
  - - [128, 1024, 1, 512, 128, 128, 128, 512]
    - [69, 13.61]
  - - [128, 1024, 1, 1024, 128, 128, 128, 1024]
    - [69, 21.26]
  - - [128, 1024, 1, 2048, 128, 128, 128, 2048]
    - [69, 30.01]
  - - [128, 1024, 1, 4096, 128, 128, 128, 4096]
    - [69, 37.31]
  - - [128, 1024, 1, 8192, 128, 128, 128, 8192]
    - [69, 42.97]
  - - [128, 2048, 1, 128, 128, 128, 128, 128]
    - [65, 8.42]
  - - [128, 2048, 1, 256, 128, 128, 128, 256]
    - [65, 14.9]
  - - [128, 2048, 1, 512, 128, 128, 128, 512]
    - [68, 24.79]
  - - [128, 2048, 1, 1024, 128, 128, 128, 1024]
    - [62, 38.06]
  - - [128, 2048, 1, 2048, 128, 128, 128, 2048]
    - [75, 51.86]
  - - [128, 2048, 1, 4096, 128, 128, 128, 4096]
    - [75, 63.76]
  - - [128, 2048, 1, 8192, 128, 128, 128, 8192]
    - [75, 72.29]
  - - [128, 4096, 1, 128, 128, 128, 128, 128]
    - [27, 15.07]
  - - [128, 4096, 1, 256, 128, 128, 128, 256]
    - [28, 26.57]
  - - [128, 4096, 1, 512, 128, 128, 128, 512]
    - [26, 43.32]
  - - [128, 4096, 1, 1024, 128, 128, 128, 1024]
    - [56, 64.39]
  - - [128, 4096, 1, 2048, 128, 128, 128, 2048]
    - [56, 85.45]
  - - [128, 4096, 1, 4096, 128, 128, 128, 4096]
    - [72, 102.79]
  - - [128, 4096, 1, 8192, 128, 128, 128, 8192]
    - [73, 112.73]
  - - [128, 8192, 1, 128, 128, 128, 128, 128]
    - [24, 24.99]
  - - [128, 8192, 1, 256, 128, 128, 128, 256]
    - [23, 43.69]
  - - [128, 8192, 1, 512, 128, 128, 128, 512]
    - [22, 70.74]
  - - [128, 8192, 1, 1024, 128, 128, 128, 1024]
    - [21, 102.84]
  - - [128, 8192, 1, 2048, 128, 128, 128, 2048]
    - [21, 132.57]
  - - [128, 8192, 1, 4096, 128, 128, 128, 4096]
    - [51, 142.78]
  - - [128, 8192, 1, 8192, 128, 128, 128, 8192]
    - [51, 153.02]
  - - [256, 128, 1, 128, 256, 256, 256, 128]
    - [71, 1.07]
  - - [256, 128, 1, 256, 256, 256, 256, 256]
    - [69, 2.03]
  - - [256, 128, 1, 512, 256, 256, 256, 512]
    - [70, 3.48]
  - - [256, 128, 1, 1024, 256, 256, 256, 1024]
    - [69, 5.61]
  - - [256, 128, 1, 2048, 256, 256, 256, 2048]
    - [70, 7.73]
  - - [256, 128, 1, 4096, 256, 256, 256, 4096]
    - [69, 9.63]
  - - [256, 128, 1, 8192, 256, 256, 256, 8192]
    - [71, 10.94]
  - - [256, 256, 1, 128, 256, 256, 256, 128]
    - [69, 2.26]
  - - [256, 256, 1, 256, 256, 256, 256, 256]
    - [70, 4.12]
  - - [256, 256, 1, 512, 256, 256, 256, 512]
    - [69, 7.06]
  - - [256, 256, 1, 1024, 256, 256, 256, 1024]
    - [70, 11.11]
  - - [256, 256, 1, 2048, 256, 256, 256, 2048]
    - [70, 15.25]
  - - [256, 256, 1, 4096, 256, 256, 256, 4096]
    - [69, 19.14]
  - - [256, 256, 1, 8192, 256, 256, 256, 8192]
    - [69, 21.86]
  - - [256, 512, 1, 128, 256, 256, 256, 128]
    - [30, 4.38]
  - - [256, 512, 1, 256, 256, 256, 256, 256]
    - [70, 8.02]
  - - [256, 512, 1, 512, 256, 256, 256, 512]
    - [70, 13.74]
  - - [256, 512, 1, 1024, 256, 256, 256, 1024]
    - [70, 21.2]
  - - [256, 512, 1, 2048, 256, 256, 256, 2048]
    - [70, 29.96]
  - - [256, 512, 1, 4096, 256, 256, 256, 4096]
    - [69, 37.75]
  - - [256, 512, 1, 8192, 256, 256, 256, 8192]
    - [69, 43.04]
  - - [256, 1024, 1, 128, 256, 256, 256, 128]
    - [66, 8.24]
  - - [256, 1024, 1, 256, 256, 256, 256, 256]
    - [65, 14.89]
  - - [256, 1024, 1, 512, 256, 256, 256, 512]
    - [67, 24.61]
  - - [256, 1024, 1, 1024, 256, 256, 256, 1024]
    - [67, 37.64]
  - - [256, 1024, 1, 2048, 256, 256, 256, 2048]
    - [75, 51.91]
  - - [256, 1024, 1, 4096, 256, 256, 256, 4096]
    - [75, 63.75]
  - - [256, 1024, 1, 8192, 256, 256, 256, 8192]
    - [75, 72.41]
  - - [256, 2048, 1, 128, 256, 256, 256, 128]
    - [25, 14.76]
  - - [256, 2048, 1, 256, 256, 256, 256, 256]
    - [29, 26.02]
  - - [256, 2048, 1, 512, 256, 256, 256, 512]
    - [57, 42.51]
  - - [256, 2048, 1, 1024, 256, 256, 256, 1024]
    - [56, 63.53]
  - - [256, 2048, 1, 2048, 256, 256, 256, 2048]
    - [56, 84.96]
  - - [256, 2048, 1, 4096, 256, 256, 256, 4096]
    - [72, 102.3]
  - - [256, 2048, 1, 8192, 256, 256, 256, 8192]
    - [56, 110.78]
  - - [256, 4096, 1, 128, 256, 256, 256, 128]
    - [22, 25.49]
  - - [256, 4096, 1, 256, 256, 256, 256, 256]
    - [22, 44.82]
  - - [256, 4096, 1, 512, 256, 256, 256, 512]
    - [22, 71.5]
  - - [256, 4096, 1, 1024, 256, 256, 256, 1024]
    - [21, 103.77]
  - - [256, 4096, 1, 2048, 256, 256, 256, 2048]
    - [21, 133.83]
  - - [256, 4096, 1, 4096, 256, 256, 256, 4096]
    - [51, 145.04]
  - - [256, 4096, 1, 8192, 256, 256, 256, 8192]
    - [51, 156.32]
  - - [256, 8192, 1, 128, 256, 256, 256, 128]
    - [20, 38.86]
  - - [256, 8192, 1, 256, 256, 256, 256, 256]
    - [47, 66.83]
  - - [256, 8192, 1, 512, 256, 256, 256, 512]
    - [48, 105.69]
  - - [256, 8192, 1, 1024, 256, 256, 256, 1024]
    - [47, 155.63]
  - - [256, 8192, 1, 2048, 256, 256, 256, 2048]
    - [47, 195.36]
  - - [256, 8192, 1, 4096, 256, 256, 256, 4096]
    - [47, 219.42]
  - - [256, 8192, 1, 8192, 256, 256, 256, 8192]
    - [50, 217.9]
  - - [512, 128, 1, 128, 512, 512, 512, 128]
    - [30, 2.22]
  - - [512, 128, 1, 256, 512, 512, 512, 256]
    - [30, 4.03]
  - - [512, 128, 1, 512, 512, 512, 512, 512]
    - [70, 7.03]
  - - [512, 128, 1, 1024, 512, 512, 512, 1024]
    - [70, 10.99]
  - - [512, 128, 1, 2048, 512, 512, 512, 2048]
    - [69, 15.28]
  - - [512, 128, 1, 4096, 512, 512, 512, 4096]
    - [69, 18.98]
  - - [512, 128, 1, 8192, 512, 512, 512, 8192]
    - [79, 18.63]
  - - [512, 256, 1, 128, 512, 512, 512, 128]
    - [70, 4.4]
  - - [512, 256, 1, 256, 512, 512, 512, 256]
    - [70, 8.06]
  - - [512, 256, 1, 512, 512, 512, 512, 512]
    - [70, 13.75]
  - - [512, 256, 1, 1024, 512, 512, 512, 1024]
    - [70, 21.64]
  - - [512, 256, 1, 2048, 512, 512, 512, 2048]
    - [69, 30.12]
  - - [512, 256, 1, 4096, 512, 512, 512, 4096]
    - [69, 37.7]
  - - [512, 256, 1, 8192, 512, 512, 512, 8192]
    - [79, 34.58]
  - - [512, 512, 1, 128, 512, 512, 512, 128]
    - [65, 8.01]
  - - [512, 512, 1, 256, 512, 512, 512, 256]
    - [74, 14.06]
  - - [512, 512, 1, 512, 512, 512, 512, 512]
    - [67, 24.13]
  - - [512, 512, 1, 1024, 512, 512, 512, 1024]
    - [67, 37.2]
  - - [512, 512, 1, 2048, 512, 512, 512, 2048]
    - [75, 51.04]
  - - [512, 512, 1, 4096, 512, 512, 512, 4096]
    - [76, 62.03]
  - - [512, 512, 1, 8192, 512, 512, 512, 8192]
    - [68, 61.84]
  - - [512, 1024, 1, 128, 512, 512, 512, 128]
    - [26, 13.72]
  - - [512, 1024, 1, 256, 512, 512, 512, 256]
    - [26, 24.76]
  - - [512, 1024, 1, 512, 512, 512, 512, 512]
    - [57, 41.82]
  - - [512, 1024, 1, 1024, 512, 512, 512, 1024]
    - [58, 62.46]
  - - [512, 1024, 1, 2048, 512, 512, 512, 2048]
    - [56, 83.46]
  - - [512, 1024, 1, 4096, 512, 512, 512, 4096]
    - [56, 99.48]
  - - [512, 1024, 1, 8192, 512, 512, 512, 8192]
    - [58, 103.35]
  - - [512, 2048, 1, 128, 512, 512, 512, 128]
    - [22, 24.69]
  - - [512, 2048, 1, 256, 512, 512, 512, 256]
    - [22, 43.66]
  - - [512, 2048, 1, 512, 512, 512, 512, 512]
    - [22, 70.68]
  - - [512, 2048, 1, 1024, 512, 512, 512, 1024]
    - [21, 102.21]
  - - [512, 2048, 1, 2048, 512, 512, 512, 2048]
    - [21, 133.0]
  - - [512, 2048, 1, 4096, 512, 512, 512, 4096]
    - [52, 140.74]
  - - [512, 2048, 1, 8192, 512, 512, 512, 8192]
    - [52, 147.81]
  - - [512, 4096, 1, 128, 512, 512, 512, 128]
    - [43, 38.46]
  - - [512, 4096, 1, 256, 512, 512, 512, 256]
    - [47, 66.46]
  - - [512, 4096, 1, 512, 512, 512, 512, 512]
    - [47, 107.9]
  - - [512, 4096, 1, 1024, 512, 512, 512, 1024]
    - [47, 156.14]
  - - [512, 4096, 1, 2048, 512, 512, 512, 2048]
    - [47, 198.03]
  - - [512, 4096, 1, 4096, 512, 512, 512, 4096]
    - [48, 204.19]
  - - [512, 4096, 1, 8192, 512, 512, 512, 8192]
    - [49, 204.93]
  - - [512, 8192, 1, 128, 512, 512, 512, 128]
    - [45, 59.08]
  - - [512, 8192, 1, 256, 512, 512, 512, 256]
    - [46, 103.49]
  - - [512, 8192, 1, 512, 512, 512, 512, 512]
    - [46, 167.63]
  - - [512, 8192, 1, 1024, 512, 512, 512, 1024]
    - [46, 215.88]
  - - [512, 8192, 1, 2048, 512, 512, 512, 2048]
    - [13, 238.44]
  - - [512, 8192, 1, 4096, 512, 512, 512, 4096]
    - [38, 259.05]
  - - [512, 8192, 1, 8192, 512, 512, 512, 8192]
    - [31, 252.99]
  - - [1024, 128, 1, 128, 1024, 1024, 1024, 128]
    - [70, 4.33]
  - - [1024, 128, 1, 256, 1024, 1024, 1024, 256]
    - [70, 7.99]
  - - [1024, 128, 1, 512, 1024, 1024, 1024, 512]
    - [69, 13.7]
  - - [1024, 128, 1, 1024, 1024, 1024, 1024, 1024]
    - [69, 21.48]
  - - [1024, 128, 1, 2048, 1024, 1024, 1024, 2048]
    - [69, 29.74]
  - - [1024, 128, 1, 4096, 1024, 1024, 1024, 4096]
    - [81, 31.05]
  - - [1024, 128, 1, 8192, 1024, 1024, 1024, 8192]
    - [80, 30.58]
  - - [1024, 256, 1, 128, 1024, 1024, 1024, 128]
    - [67, 8.21]
  - - [1024, 256, 1, 256, 1024, 1024, 1024, 256]
    - [65, 14.56]
  - - [1024, 256, 1, 512, 1024, 1024, 1024, 512]
    - [67, 24.42]
  - - [1024, 256, 1, 1024, 1024, 1024, 1024, 1024]
    - [67, 37.63]
  - - [1024, 256, 1, 2048, 1024, 1024, 1024, 2048]
    - [75, 51.01]
  - - [1024, 256, 1, 4096, 1024, 1024, 1024, 4096]
    - [63, 55.25]
  - - [1024, 256, 1, 8192, 1024, 1024, 1024, 8192]
    - [77, 58.85]
  - - [1024, 512, 1, 128, 1024, 1024, 1024, 128]
    - [28, 14.82]
  - - [1024, 512, 1, 256, 1024, 1024, 1024, 256]
    - [28, 25.82]
  - - [1024, 512, 1, 512, 1024, 1024, 1024, 512]
    - [58, 42.41]
  - - [1024, 512, 1, 1024, 1024, 1024, 1024, 1024]
    - [56, 62.63]
  - - [1024, 512, 1, 2048, 1024, 1024, 1024, 2048]
    - [56, 83.42]
  - - [1024, 512, 1, 4096, 1024, 1024, 1024, 4096]
    - [59, 93.81]
  - - [1024, 512, 1, 8192, 1024, 1024, 1024, 8192]
    - [61, 102.14]
  - - [1024, 1024, 1, 128, 1024, 1024, 1024, 128]
    - [22, 25.67]
  - - [1024, 1024, 1, 256, 1024, 1024, 1024, 256]
    - [22, 44.95]
  - - [1024, 1024, 1, 512, 1024, 1024, 1024, 512]
    - [22, 71.24]
  - - [1024, 1024, 1, 1024, 1024, 1024, 1024, 1024]
    - [21, 102.79]
  - - [1024, 1024, 1, 2048, 1024, 1024, 1024, 2048]
    - [21, 133.14]
  - - [1024, 1024, 1, 4096, 1024, 1024, 1024, 4096]
    - [53, 139.2]
  - - [1024, 1024, 1, 8192, 1024, 1024, 1024, 8192]
    - [55, 146.91]
  - - [1024, 2048, 1, 128, 1024, 1024, 1024, 128]
    - [20, 39.42]
  - - [1024, 2048, 1, 256, 1024, 1024, 1024, 256]
    - [19, 66.74]
  - - [1024, 2048, 1, 512, 1024, 1024, 1024, 512]
    - [47, 107.31]
  - - [1024, 2048, 1, 1024, 1024, 1024, 1024, 1024]
    - [47, 155.38]
  - - [1024, 2048, 1, 2048, 1024, 1024, 1024, 2048]
    - [47, 192.51]
  - - [1024, 2048, 1, 4096, 1024, 1024, 1024, 4096]
    - [47, 203.96]
  - - [1024, 2048, 1, 8192, 1024, 1024, 1024, 8192]
    - [49, 200.19]
  - - [1024, 4096, 1, 128, 1024, 1024, 1024, 128]
    - [16, 58.27]
  - - [1024, 4096, 1, 256, 1024, 1024, 1024, 256]
    - [15, 98.31]
  - - [1024, 4096, 1, 512, 1024, 1024, 1024, 512]
    - [14, 148.77]
  - - [1024, 4096, 1, 1024, 1024, 1024, 1024, 1024]
    - [10, 202.93]
  - - [1024, 4096, 1, 2048, 1024, 1024, 1024, 2048]
    - [11, 239.72]
  - - [1024, 4096, 1, 4096, 1024, 1024, 1024, 4096]
    - [40, 257.18]
  - - [1024, 4096, 1, 8192, 1024, 1024, 1024, 8192]
    - [39, 248.46]
  - - [1024, 8192, 1, 128, 1024, 1024, 1024, 128]
    - [39, 72.6]
  - - [1024, 8192, 1, 256, 1024, 1024, 1024, 256]
    - [39, 125.92]
  - - [1024, 8192, 1, 512, 1024, 1024, 1024, 512]
    - [38, 200.07]
  - - [1024, 8192, 1, 1024, 1024, 1024, 1024, 1024]
    - [38, 236.02]
  - - [1024, 8192, 1, 2048, 1024, 1024, 1024, 2048]
    - [37, 310.43]
  - - [1024, 8192, 1, 4096, 1024, 1024, 1024, 4096]
    - [38, 362.66]
  - - [1024, 8192, 1, 8192, 1024, 1024, 1024, 8192]
    - [38, 371.35]
  - - [2048, 128, 1, 128, 2048, 2048, 2048, 128]
    - [65, 8.17]
  - - [2048, 128, 1, 256, 2048, 2048, 2048, 256]
    - [67, 14.36]
  - - [2048, 128, 1, 512, 2048, 2048, 2048, 512]
    - [67, 24.15]
  - - [2048, 128, 1, 1024, 2048, 2048, 2048, 1024]
    - [67, 37.14]
  - - [2048, 128, 1, 2048, 2048, 2048, 2048, 2048]
    - [64, 43.8]
  - - [2048, 128, 1, 4096, 2048, 2048, 2048, 4096]
    - [78, 52.33]
  - - [2048, 128, 1, 8192, 2048, 2048, 2048, 8192]
    - [77, 59.18]
  - - [2048, 256, 1, 128, 2048, 2048, 2048, 128]
    - [28, 14.36]
  - - [2048, 256, 1, 256, 2048, 2048, 2048, 256]
    - [26, 25.41]
  - - [2048, 256, 1, 512, 2048, 2048, 2048, 512]
    - [58, 41.34]
  - - [2048, 256, 1, 1024, 2048, 2048, 2048, 1024]
    - [56, 61.92]
  - - [2048, 256, 1, 2048, 2048, 2048, 2048, 2048]
    - [61, 77.55]
  - - [2048, 256, 1, 4096, 2048, 2048, 2048, 4096]
    - [60, 92.79]
  - - [2048, 256, 1, 8192, 2048, 2048, 2048, 8192]
    - [59, 103.84]
  - - [2048, 512, 1, 128, 2048, 2048, 2048, 128]
    - [22, 25.06]
  - - [2048, 512, 1, 256, 2048, 2048, 2048, 256]
    - [22, 44.14]
  - - [2048, 512, 1, 512, 2048, 2048, 2048, 512]
    - [22, 70.74]
  - - [2048, 512, 1, 1024, 2048, 2048, 2048, 1024]
    - [21, 102.78]
  - - [2048, 512, 1, 2048, 2048, 2048, 2048, 2048]
    - [54, 119.56]
  - - [2048, 512, 1, 4096, 2048, 2048, 2048, 4096]
    - [54, 139.6]
  - - [2048, 512, 1, 8192, 2048, 2048, 2048, 8192]
    - [55, 146.58]
  - - [2048, 1024, 1, 128, 2048, 2048, 2048, 128]
    - [20, 38.87]
  - - [2048, 1024, 1, 256, 2048, 2048, 2048, 256]
    - [47, 66.9]
  - - [2048, 1024, 1, 512, 2048, 2048, 2048, 512]
    - [47, 107.77]
  - - [2048, 1024, 1, 1024, 2048, 2048, 2048, 1024]
    - [47, 156.15]
  - - [2048, 1024, 1, 2048, 2048, 2048, 2048, 2048]
    - [48, 179.3]
  - - [2048, 1024, 1, 4096, 2048, 2048, 2048, 4096]
    - [50, 201.72]
  - - [2048, 1024, 1, 8192, 2048, 2048, 2048, 8192]
    - [50, 200.67]
  - - [2048, 2048, 1, 128, 2048, 2048, 2048, 128]
    - [13, 55.61]
  - - [2048, 2048, 1, 256, 2048, 2048, 2048, 256]
    - [13, 96.26]
  - - [2048, 2048, 1, 512, 2048, 2048, 2048, 512]
    - [11, 147.33]
  - - [2048, 2048, 1, 1024, 2048, 2048, 2048, 1024]
    - [13, 202.22]
  - - [2048, 2048, 1, 2048, 2048, 2048, 2048, 2048]
    - [17, 241.64]
  - - [2048, 2048, 1, 4096, 2048, 2048, 2048, 4096]
    - [42, 260.86]
  - - [2048, 2048, 1, 8192, 2048, 2048, 2048, 8192]
    - [33, 245.24]
  - - [2048, 4096, 1, 128, 2048, 2048, 2048, 128]
    - [7, 64.29]
  - - [2048, 4096, 1, 256, 2048, 2048, 2048, 256]
    - [1, 110.14]
  - - [2048, 4096, 1, 512, 2048, 2048, 2048, 512]
    - [7, 169.4]
  - - [2048, 4096, 1, 1024, 2048, 2048, 2048, 1024]
    - [7, 229.91]
  - - [2048, 4096, 1, 2048, 2048, 2048, 2048, 2048]
    - [8, 267.26]
  - - [2048, 4096, 1, 4096, 2048, 2048, 2048, 4096]
    - [38, 280.5]
  - - [2048, 4096, 1, 8192, 2048, 2048, 2048, 8192]
    - [37, 324.25]
  - - [2048, 8192, 1, 128, 2048, 2048, 2048, 128]
    - [38, 75.24]
  - - [2048, 8192, 1, 256, 2048, 2048, 2048, 256]
    - [38, 132.24]
  - - [2048, 8192, 1, 512, 2048, 2048, 2048, 512]
    - [39, 198.89]
  - - [2048, 8192, 1, 1024, 2048, 2048, 2048, 1024]
    - [39, 265.81]
  - - [2048, 8192, 1, 2048, 2048, 2048, 2048, 2048]
    - [36, 309.15]
  - - [2048, 8192, 1, 4096, 2048, 2048, 2048, 4096]
    - [38, 336.69]
  - - [2048, 8192, 1, 8192, 2048, 2048, 2048, 8192]
    - [38, 386.06]
  - - [4096, 128, 1, 128, 4096, 4096, 4096, 128]
    - [28, 14.94]
  - - [4096, 128, 1, 256, 4096, 4096, 4096, 256]
    - [28, 26.19]
  - - [4096, 128, 1, 512, 4096, 4096, 4096, 512]
    - [57, 43.04]
  - - [4096, 128, 1, 1024, 4096, 4096, 4096, 1024]
    - [58, 62.72]
  - - [4096, 128, 1, 2048, 4096, 4096, 4096, 2048]
    - [61, 77.3]
  - - [4096, 128, 1, 4096, 4096, 4096, 4096, 4096]
    - [61, 93.13]
  - - [4096, 128, 1, 8192, 4096, 4096, 4096, 8192]
    - [61, 103.42]
  - - [4096, 256, 1, 128, 4096, 4096, 4096, 128]
    - [24, 24.61]
  - - [4096, 256, 1, 256, 4096, 4096, 4096, 256]
    - [22, 43.49]
  - - [4096, 256, 1, 512, 4096, 4096, 4096, 512]
    - [22, 70.95]
  - - [4096, 256, 1, 1024, 4096, 4096, 4096, 1024]
    - [21, 102.86]
  - - [4096, 256, 1, 2048, 4096, 4096, 4096, 2048]
    - [55, 119.29]
  - - [4096, 256, 1, 4096, 4096, 4096, 4096, 4096]
    - [53, 139.86]
  - - [4096, 256, 1, 8192, 4096, 4096, 4096, 8192]
    - [54, 147.36]
  - - [4096, 512, 1, 128, 4096, 4096, 4096, 128]
    - [20, 38.98]
  - - [4096, 512, 1, 256, 4096, 4096, 4096, 256]
    - [44, 66.63]
  - - [4096, 512, 1, 512, 4096, 4096, 4096, 512]
    - [48, 105.62]
  - - [4096, 512, 1, 1024, 4096, 4096, 4096, 1024]
    - [50, 146.98]
  - - [4096, 512, 1, 2048, 4096, 4096, 4096, 2048]
    - [48, 177.81]
  - - [4096, 512, 1, 4096, 4096, 4096, 4096, 4096]
    - [48, 205.02]
  - - [4096, 512, 1, 8192, 4096, 4096, 4096, 8192]
    - [50, 200.82]
  - - [4096, 1024, 1, 128, 4096, 4096, 4096, 128]
    - [16, 57.52]
  - - [4096, 1024, 1, 256, 4096, 4096, 4096, 256]
    - [17, 97.64]
  - - [4096, 1024, 1, 512, 4096, 4096, 4096, 512]
    - [17, 148.35]
  - - [4096, 1024, 1, 1024, 4096, 4096, 4096, 1024]
    - [15, 200.1]
  - - [4096, 1024, 1, 2048, 4096, 4096, 4096, 2048]
    - [17, 242.15]
  - - [4096, 1024, 1, 4096, 4096, 4096, 4096, 4096]
    - [41, 258.36]
  - - [4096, 1024, 1, 8192, 4096, 4096, 4096, 8192]
    - [34, 248.19]
  - - [4096, 2048, 1, 128, 4096, 4096, 4096, 128]
    - [0, 62.0]
  - - [4096, 2048, 1, 256, 4096, 4096, 4096, 256]
    - [0, 104.72]
  - - [4096, 2048, 1, 512, 4096, 4096, 4096, 512]
    - [1, 164.56]
  - - [4096, 2048, 1, 1024, 4096, 4096, 4096, 1024]
    - [5, 226.72]
  - - [4096, 2048, 1, 2048, 4096, 4096, 4096, 2048]
    - [2, 264.34]
  - - [4096, 2048, 1, 4096, 4096, 4096, 4096, 4096]
    - [31, 266.49]
  - - [4096, 2048, 1, 8192, 4096, 4096, 4096, 8192]
    - [31, 293.49]
  - - [4096, 4096, 1, 128, 4096, 4096, 4096, 128]
    - [13, 68.69]
  - - [4096, 4096, 1, 256, 4096, 4096, 4096, 256]
    - [3, 116.2]
  - - [4096, 4096, 1, 512, 4096, 4096, 4096, 512]
    - [6, 176.99]
  - - [4096, 4096, 1, 1024, 4096, 4096, 4096, 1024]
    - [6, 226.2]
  - - [4096, 4096, 1, 2048, 4096, 4096, 4096, 2048]
    - [38, 266.89]
  - - [4096, 4096, 1, 4096, 4096, 4096, 4096, 4096]
    - [38, 285.94]
  - - [4096, 4096, 1, 8192, 4096, 4096, 4096, 8192]
    - [39, 326.12]
  - - [4096, 8192, 1, 128, 4096, 4096, 4096, 128]
    - [35, 80.11]
  - - [4096, 8192, 1, 256, 4096, 4096, 4096, 256]
    - [36, 136.05]
  - - [4096, 8192, 1, 512, 4096, 4096, 4096, 512]
    - [39, 207.89]
  - - [4096, 8192, 1, 1024, 4096, 4096, 4096, 1024]
    - [39, 259.62]
  - - [4096, 8192, 1, 2048, 4096, 4096, 4096, 2048]
    - [38, 305.22]
  - - [4096, 8192, 1, 4096, 4096, 4096, 4096, 4096]
    - [39, 354.92]
  - - [4096, 8192, 1, 8192, 4096, 4096, 4096, 8192]
    - [38, 401.07]
  - - [8192, 128, 1, 128, 8192, 8192, 8192, 128]
    - [22, 25.33]
  - - [8192, 128, 1, 256, 8192, 8192, 8192, 256]
    - [23, 43.48]
  - - [8192, 128, 1, 512, 8192, 8192, 8192, 512]
    - [22, 71.2]
  - - [8192, 128, 1, 1024, 8192, 8192, 8192, 1024]
    - [21, 102.47]
  - - [8192, 128, 1, 2048, 8192, 8192, 8192, 2048]
    - [54, 117.12]
  - - [8192, 128, 1, 4096, 8192, 8192, 8192, 4096]
    - [54, 138.35]
  - - [8192, 128, 1, 8192, 8192, 8192, 8192, 8192]
    - [54, 143.7]
  - - [8192, 256, 1, 128, 8192, 8192, 8192, 128]
    - [18, 37.98]
  - - [8192, 256, 1, 256, 8192, 8192, 8192, 256]
    - [18, 64.75]
  - - [8192, 256, 1, 512, 8192, 8192, 8192, 512]
    - [48, 105.06]
  - - [8192, 256, 1, 1024, 8192, 8192, 8192, 1024]
    - [49, 148.67]
  - - [8192, 256, 1, 2048, 8192, 8192, 8192, 2048]
    - [48, 177.83]
  - - [8192, 256, 1, 4096, 8192, 8192, 8192, 4096]
    - [49, 203.44]
  - - [8192, 256, 1, 8192, 8192, 8192, 8192, 8192]
    - [50, 196.66]
  - - [8192, 512, 1, 128, 8192, 8192, 8192, 128]
    - [13, 54.05]
  - - [8192, 512, 1, 256, 8192, 8192, 8192, 256]
    - [16, 92.63]
  - - [8192, 512, 1, 512, 8192, 8192, 8192, 512]
    - [14, 141.06]
  - - [8192, 512, 1, 1024, 8192, 8192, 8192, 1024]
    - [9, 192.68]
  - - [8192, 512, 1, 2048, 8192, 8192, 8192, 2048]
    - [42, 238.33]
  - - [8192, 512, 1, 4096, 8192, 8192, 8192, 4096]
    - [34, 255.92]
  - - [8192, 512, 1, 8192, 8192, 8192, 8192, 8192]
    - [32, 243.5]
  - - [8192, 1024, 1, 128, 8192, 8192, 8192, 128]
    - [7, 61.25]
  - - [8192, 1024, 1, 256, 8192, 8192, 8192, 256]
    - [4, 104.6]
  - - [8192, 1024, 1, 512, 8192, 8192, 8192, 512]
    - [4, 164.77]
  - - [8192, 1024, 1, 1024, 8192, 8192, 8192, 1024]
    - [8, 226.67]
  - - [8192, 1024, 1, 2048, 8192, 8192, 8192, 2048]
    - [7, 270.29]
  - - [8192, 1024, 1, 4096, 8192, 8192, 8192, 4096]
    - [31, 268.53]
  - - [8192, 1024, 1, 8192, 8192, 8192, 8192, 8192]
    - [31, 304.64]
  - - [8192, 2048, 1, 128, 8192, 8192, 8192, 128]
    - [12, 67.4]
  - - [8192, 2048, 1, 256, 8192, 8192, 8192, 256]
    - [1, 115.92]
  - - [8192, 2048, 1, 512, 8192, 8192, 8192, 512]
    - [37, 175.12]
  - - [8192, 2048, 1, 1024, 8192, 8192, 8192, 1024]
    - [7, 229.39]
  - - [8192, 2048, 1, 2048, 8192, 8192, 8192, 2048]
    - [37, 245.95]
  - - [8192, 2048, 1, 4096, 8192, 8192, 8192, 4096]
    - [1, 288.99]
  - - [8192, 2048, 1, 8192, 8192, 8192, 8192, 8192]
    - [1, 344.92]
  - - [8192, 4096, 1, 128, 8192, 8192, 8192, 128]
    - [1, 72.02]
  - - [8192, 4096, 1, 256, 8192, 8192, 8192, 256]
    - [1, 120.27]
  - - [8192, 4096, 1, 512, 8192, 8192, 8192, 512]
    - [14, 175.67]
  - - [8192, 4096, 1, 1024, 8192, 8192, 8192, 1024]
    - [39, 233.47]
  - - [8192, 4096, 1, 2048, 8192, 8192, 8192, 2048]
    - [42, 282.11]
  - - [8192, 4096, 1, 4096, 8192, 8192, 8192, 4096]
    - [8, 320.37]
  - - [8192, 4096, 1, 8192, 8192, 8192, 8192, 8192]
    - [7, 373.16]
  - - [8192, 8192, 1, 128, 8192, 8192, 8192, 128]
    - [35, 75.68]
  - - [8192, 8192, 1, 256, 8192, 8192, 8192, 256]
    - [36, 124.1]
  - - [8192, 8192, 1, 512, 8192, 8192, 8192, 512]
    - [7, 179.14]
  - - [8192, 8192, 1, 1024, 8192, 8192, 8192, 1024]
    - [38, 252.12]
  - - [8192, 8192, 1, 2048, 8192, 8192, 8192, 2048]
    - [38, 318.93]
  - - [8192, 8192, 1, 4096, 8192, 8192, 8192, 4096]
    - [38, 369.93]
  - - [8192, 8192, 1, 8192, 8192, 8192, 8192, 8192]
    - [38, 406.61]
- null
- null
- ExperimentalStreamK
- GridBased
