projects/hipblaslt/library/src/amd_detail/rocblaslt/src/Tensile/Logic/asm_full/aquavanjaram/gfx942_228cu/StreamK/aquavanjaram942_Cijk_Alik_Bljk_F8B8NSS_BH_Bias_HAS_SAV_UserArgs.yaml
- {MinimumRequiredVersion: 4.33.0}
- aquavanjaram942
- {Architecture: gfx942, CUCount: 228}
- [Device 0049, Device 0050]
    SolutionIndex: 0
    SolutionNameMin: Cijk_Alik_Bljk_F8B8NSS_BH_Bias_HAS_SAV_UserArgs_MT256x256x64_MI16x16x1_SN_LDSB1_CLR1_GRVWA16_GRVWB16_GSU0_GSUC0_GSUWGMRR0_K1_LBSPPA512_LBSPPB512_LPA16_LPB16_LRVW8_MIWT8_8_PLR1_SU0_SUM0_SUS64_VWA8_VWB8_WGM1_WGMXCC1_WGMXCCGn1
    SolutionIndex: 1
    SolutionNameMin: Cijk_Alik_Bljk_F8B8NSS_BH_Bias_HAS_SAV_UserArgs_MT128x256x64_MI16x16x1_SN_LDSB1_CLR1_GRVWA8_GRVWB8_GSU0_GSUC0_GSUWGMRR0_K1_LBSPPA256_LBSPPB512_LPA8_LPB8_LRVW8_MIWT4_8_PLR1_SU0_SUM0_SUS64_VWA4_VWB8_WGM1_WGMXCC1_WGMXCCGn1
    SolutionIndex: 2
    SolutionNameMin: Cijk_Alik_Bljk_F8B8NSS_BH_Bias_HAS_SAV_UserArgs_MT128x256x64_MI16x16x1_SN_LDSB1_CLR1_GRVWA16_GRVWB8_GSU0_GSUC0_GSUWGMRR0_K1_LBSPPA256_LBSPPB512_LPA16_LPB8_LRVW8_MIWT4_8_PLR1_SU0_SUM0_SUS64_VWA4_VWB8_WGM1_WGMXCC1_WGMXCCGn1
    SolutionIndex: 3
    SolutionNameMin: Cijk_Alik_Bljk_F8B8NSS_BH_Bias_HAS_SAV_UserArgs_MT128x256x64_MI16x16x1_SN_LDSB1_CLR1_GRVWA8_GRVWB16_GSU0_GSUC0_GSUWGMRR0_K1_LBSPPA256_LBSPPB512_LPA8_LPB16_LRVW8_MIWT4_8_PLR1_SU0_SUM0_SUS64_VWA4_VWB8_WGM1_WGMXCC1_WGMXCCGn1
    SolutionIndex: 4
    SolutionNameMin: Cijk_Alik_Bljk_F8B8NSS_BH_Bias_HAS_SAV_UserArgs_MT128x256x64_MI16x16x1_SN_LDSB1_CLR1_GRVWA16_GRVWB16_GSU0_GSUC0_GSUWGMRR0_K1_LBSPPA256_LBSPPB512_LPA16_LPB16_LRVW8_MIWT4_8_PLR1_SU0_SUM0_SUS64_VWA4_VWB8_WGM1_WGMXCC1_WGMXCCGn1
    SolutionIndex: 5
    SolutionNameMin: Cijk_Alik_Bljk_F8B8NSS_BH_Bias_HAS_SAV_UserArgs_MT128x256x64_MI16x16x1_SN_LDSB1_CLR1_GRVWA8_GRVWB8_GSU0_GSUC0_GSUWGMRR0_K1_LBSPPA256_LBSPPB512_LPA8_LPB8_LRVW8_MIWT4_8_PLR1_SU0_SUM0_SUS64_VWA4_VWB8_WGM8_WGMXCC1_WGMXCCGn1
    SolutionIndex: 6
    SolutionNameMin: Cijk_Alik_Bljk_F8B8NSS_BH_Bias_HAS_SAV_UserArgs_MT128x128x64_MI16x16x1_SN_LDSB1_CLR1_GRVWA16_GRVWB8_GSU0_GSUC0_GSUWGMRR0_K1_LBSPPA256_LBSPPB256_LPA16_LPB8_LRVW8_MIWT4_4_PLR1_SU0_SUM0_SUS64_VWA4_VWB4_WGM1_WGMXCC1_WGMXCCGn1
    SolutionIndex: 7
    SolutionNameMin: Cijk_Alik_Bljk_F8B8NSS_BH_Bias_HAS_SAV_UserArgs_MT128x128x64_MI16x16x1_SN_LDSB1_CLR1_GRVWA8_GRVWB16_GSU0_GSUC0_GSUWGMRR0_K1_LBSPPA256_LBSPPB256_LPA8_LPB16_LRVW8_MIWT4_4_PLR1_SU0_SUM0_SUS64_VWA4_VWB4_WGM1_WGMXCC1_WGMXCCGn1
    SolutionIndex: 8
    SolutionNameMin: Cijk_Alik_Bljk_F8B8NSS_BH_Bias_HAS_SAV_UserArgs_MT128x128x64_MI16x16x1_SN_LDSB1_CLR1_GRVWA16_GRVWB16_GSU0_GSUC0_GSUWGMRR0_K1_LBSPPA256_LBSPPB256_LPA16_LPB16_LRVW8_MIWT4_4_PLR1_SU0_SUM0_SUS64_VWA4_VWB4_WGM1_WGMXCC1_WGMXCCGn1
    SolutionIndex: 9
    SolutionNameMin: Cijk_Alik_Bljk_F8B8NSS_BH_Bias_HAS_SAV_UserArgs_MT128x128x64_MI16x16x1_SN_LDSB1_CLR1_GRVWA8_GRVWB16_GSU0_GSUC0_GSUWGMRR0_K1_LBSPPA256_LBSPPB256_LPA8_LPB16_LRVW8_MIWT4_4_PLR1_SU0_SUM0_SUS64_VWA4_VWB4_WGM6_WGMXCC1_WGMXCCGn1
    SolutionIndex: 10
    SolutionNameMin: Cijk_Alik_Bljk_F8B8NSS_BH_Bias_HAS_SAV_UserArgs_MT128x128x64_MI16x16x1_SN_LDSB1_CLR1_GRVWA8_GRVWB16_GSU0_GSUC0_GSUWGMRR0_K1_LBSPPA256_LBSPPB256_LPA8_LPB16_LRVW8_MIWT4_4_PLR1_SU0_SUM0_SUS64_VWA4_VWB4_WGM8_WGMXCC1_WGMXCCGn1
    SolutionIndex: 11
    SolutionNameMin: Cijk_Alik_Bljk_F8B8NSS_BH_Bias_HAS_SAV_UserArgs_MT128x128x64_MI16x16x1_SN_LDSB1_CLR1_GRVWA16_GRVWB16_GSU0_GSUC0_GSUWGMRR0_K1_LBSPPA256_LBSPPB256_LPA16_LPB16_LRVW8_MIWT4_4_PLR1_SU0_SUM0_SUS64_VWA4_VWB4_WGM8_WGMXCC1_WGMXCCGn1
    SolutionIndex: 12
    SolutionNameMin: Cijk_Alik_Bljk_F8B8NSS_BH_Bias_HAS_SAV_UserArgs_MT64x128x64_MI16x16x1_SN_LDSB0_CLR1_GRVWA16_GRVWB16_GSU0_GSUC0_GSUWGMRR0_K1_LBSPPA128_LBSPPB256_LPA16_LPB16_LRVW8_MIWT2_4_PLR1_SU0_SUM0_SUS64_VWA2_VWB4_WGM1_WGMXCC1_WGMXCCGn1
    SolutionIndex: 13
    SolutionNameMin: Cijk_Alik_Bljk_F8B8NSS_BH_Bias_HAS_SAV_UserArgs_MT128x64x64_MI16x16x1_SN_LDSB0_CLR1_GRVWA8_GRVWB8_GSU0_GSUC0_GSUWGMRR0_K1_LBSPPA256_LBSPPB128_LPA8_LPB8_LRVW8_MIWT4_2_PLR1_SU0_SUM0_SUS64_VWA4_VWB2_WGM1_WGMXCC1_WGMXCCGn1
    SolutionIndex: 14
    SolutionNameMin: Cijk_Alik_Bljk_F8B8NSS_BH_Bias_HAS_SAV_UserArgs_MT128x64x64_MI16x16x1_SN_LDSB0_CLR1_GRVWA16_GRVWB8_GSU0_GSUC0_GSUWGMRR0_K1_LBSPPA256_LBSPPB128_LPA16_LPB8_LRVW8_MIWT4_2_PLR1_SU0_SUM0_SUS64_VWA4_VWB2_WGM1_WGMXCC1_WGMXCCGn1
    SolutionIndex: 15
    SolutionNameMin: Cijk_Alik_Bljk_F8B8NSS_BH_Bias_HAS_SAV_UserArgs_MT128x64x64_MI16x16x1_SN_LDSB0_CLR1_GRVWA8_GRVWB16_GSU0_GSUC0_GSUWGMRR0_K1_LBSPPA256_LBSPPB128_LPA8_LPB16_LRVW8_MIWT4_2_PLR1_SU0_SUM0_SUS64_VWA4_VWB2_WGM1_WGMXCC1_WGMXCCGn1
    SolutionIndex: 16
    SolutionNameMin: Cijk_Alik_Bljk_F8B8NSS_BH_Bias_HAS_SAV_UserArgs_MT128x64x64_MI16x16x1_SN_LDSB0_CLR1_GRVWA16_GRVWB16_GSU0_GSUC0_GSUWGMRR0_K1_LBSPPA256_LBSPPB128_LPA16_LPB16_LRVW8_MIWT4_2_PLR1_SU0_SUM0_SUS64_VWA4_VWB2_WGM1_WGMXCC1_WGMXCCGn1
    SolutionIndex: 17
    SolutionNameMin: Cijk_Alik_Bljk_F8B8NSS_BH_Bias_HAS_SAV_UserArgs_MT128x64x64_MI16x16x1_SN_LDSB0_CLR1_GRVWA8_GRVWB16_GSU0_GSUC0_GSUWGMRR0_K1_LBSPPA256_LBSPPB128_LPA8_LPB16_LRVW8_MIWT4_2_PLR1_SU0_SUM0_SUS64_VWA4_VWB2_WGM6_WGMXCC1_WGMXCCGn1
    SolutionIndex: 18
    SolutionNameMin: Cijk_Alik_Bljk_F8B8NSS_BH_Bias_HAS_SAV_UserArgs_MT128x64x64_MI16x16x1_SN_LDSB0_CLR1_GRVWA16_GRVWB16_GSU0_GSUC0_GSUWGMRR0_K1_LBSPPA256_LBSPPB128_LPA16_LPB16_LRVW8_MIWT4_2_PLR1_SU0_SUM0_SUS64_VWA4_VWB2_WGM6_WGMXCC1_WGMXCCGn1
    SolutionIndex: 19
    SolutionNameMin: Cijk_Alik_Bljk_F8B8NSS_BH_Bias_HAS_SAV_UserArgs_MT128x64x64_MI16x16x1_SN_LDSB0_CLR1_GRVWA8_GRVWB16_GSU0_GSUC0_GSUWGMRR0_K1_LBSPPA256_LBSPPB128_LPA8_LPB16_LRVW8_MIWT4_2_PLR1_SU0_SUM0_SUS64_VWA4_VWB2_WGM8_WGMXCC1_WGMXCCGn1
    SolutionIndex: 20
    SolutionNameMin: Cijk_Alik_Bljk_F8B8NSS_BH_Bias_HAS_SAV_UserArgs_MT128x32x64_MI16x16x1_SN_LDSB0_CLR1_GRVWA16_GRVWB8_GSU0_GSUC0_GSUWGMRR0_K1_LBSPPA256_LBSPPB128_LPA16_LPB8_LRVW8_MIWT4_1_PLR1_SU0_SUM0_SUS64_VWA4_VWB1_WGM1_WGMXCC1_WGMXCCGn1
    SolutionIndex: 21
    SolutionNameMin: Cijk_Alik_Bljk_F8B8NSS_BH_Bias_HAS_SAV_UserArgs_MT64x64x64_MI16x16x1_SN_LDSB0_CLR1_GRVWA8_GRVWB8_GSU0_GSUC0_GSUWGMRR0_K1_LBSPPA128_LBSPPB128_LPA8_LPB8_LRVW8_MIWT2_2_PLR1_SU0_SUM0_SUS64_VWA2_VWB2_WGM1_WGMXCC1_WGMXCCGn1
    SolutionIndex: 22
    SolutionNameMin: Cijk_Alik_Bljk_F8B8NSS_BH_Bias_HAS_SAV_UserArgs_MT64x64x64_MI16x16x1_SN_LDSB0_CLR1_GRVWA8_GRVWB16_GSU0_GSUC0_GSUWGMRR0_K1_LBSPPA128_LBSPPB128_LPA8_LPB16_LRVW8_MIWT2_2_PLR1_SU0_SUM0_SUS64_VWA2_VWB2_WGM1_WGMXCC1_WGMXCCGn1
    SolutionIndex: 23
    SolutionNameMin: Cijk_Alik_Bljk_F8B8NSS_BH_Bias_HAS_SAV_UserArgs_MT64x64x64_MI16x16x1_SN_LDSB0_CLR1_GRVWA8_GRVWB8_GSU0_GSUC0_GSUWGMRR0_K1_LBSPPA128_LBSPPB128_LPA8_LPB8_LRVW8_MIWT2_2_PLR1_SU0_SUM0_SUS64_VWA2_VWB2_WGM6_WGMXCC1_WGMXCCGn1
    SolutionIndex: 24
    SolutionNameMin: Cijk_Alik_Bljk_F8B8NSS_BH_Bias_HAS_SAV_UserArgs_MT64x64x64_MI16x16x1_SN_LDSB0_CLR1_GRVWA8_GRVWB16_GSU0_GSUC0_GSUWGMRR0_K1_LBSPPA128_LBSPPB128_LPA8_LPB16_LRVW8_MIWT2_2_PLR1_SU0_SUM0_SUS64_VWA2_VWB2_WGM6_WGMXCC1_WGMXCCGn1
    SolutionIndex: 25
    SolutionNameMin: Cijk_Alik_Bljk_F8B8NSS_BH_Bias_HAS_SAV_UserArgs_MT64x32x64_MI16x16x1_SN_LDSB0_CLR1_GRVWA8_GRVWB8_GSU0_GSUC0_GSUWGMRR0_K1_LBSPPA128_LBSPPB128_LPA8_LPB8_LRVW8_MIWT2_1_PLR1_SU0_SUM0_SUS64_VWA2_VWB1_WGM1_WGMXCC1_WGMXCCGn1
    SolutionIndex: 26
    SolutionNameMin: Cijk_Alik_Bljk_F8B8NSS_BH_Bias_HAS_SAV_UserArgs_MT64x32x64_MI16x16x1_SN_LDSB0_CLR1_GRVWA16_GRVWB8_GSU0_GSUC0_GSUWGMRR0_K1_LBSPPA128_LBSPPB128_LPA16_LPB8_LRVW8_MIWT2_1_PLR1_SU0_SUM0_SUS64_VWA2_VWB1_WGM1_WGMXCC1_WGMXCCGn1
    SolutionIndex: 27
    SolutionNameMin: Cijk_Alik_Bljk_F8B8NSS_BH_Bias_HAS_SAV_UserArgs_MT64x32x64_MI16x16x1_SN_LDSB0_CLR1_GRVWA16_GRVWB8_GSU0_GSUC0_GSUWGMRR0_K1_LBSPPA128_LBSPPB128_LPA16_LPB8_LRVW8_MIWT2_1_PLR1_SU0_SUM0_SUS64_VWA2_VWB1_WGM6_WGMXCC1_WGMXCCGn1
    SolutionIndex: 28
    SolutionNameMin: Cijk_Alik_Bljk_F8B8NSS_BH_Bias_HAS_SAV_UserArgs_MT32x32x64_MI16x16x1_SN_LDSB0_CLR1_GRVWA8_GRVWB8_GSU0_GSUC0_GSUWGMRR0_K1_LBSPPA128_LBSPPB128_LPA8_LPB8_LRVW8_MIWT1_1_PLR1_SU0_SUM0_SUS64_VWA1_VWB1_WGM1_WGMXCC1_WGMXCCGn1
    SolutionIndex: 29
    SolutionNameMin: Cijk_Alik_Bljk_F8B8NSS_BH_Bias_HAS_SAV_UserArgs_MT128x256x128_MI16x16x1_SN_LDSB1_CLR1_GRVWA8_GRVWB16_GSU0_GSUC0_GSUWGMRR0_K1_LBSPPA512_LBSPPB1024_LPA8_LPB16_LRVW8_MIWT4_8_PLR1_SU0_SUM0_SUS128_VWA4_VWB8_WGM1_WGMXCC1_WGMXCCGn1
    SolutionIndex: 30
    SolutionNameMin: Cijk_Alik_Bljk_F8B8NSS_BH_Bias_HAS_SAV_UserArgs_MT128x256x128_MI16x16x1_SN_LDSB1_CLR1_GRVWA8_GRVWB16_GSU0_GSUC0_GSUWGMRR0_K1_LBSPPA512_LBSPPB1024_LPA8_LPB16_LRVW8_MIWT4_8_PLR1_SU0_SUM0_SUS128_VWA4_VWB8_WGM6_WGMXCC1_WGMXCCGn1
    SolutionIndex: 31
    SolutionNameMin: Cijk_Alik_Bljk_F8B8NSS_BH_Bias_HAS_SAV_UserArgs_MT128x256x128_MI16x16x1_SN_LDSB1_CLR1_GRVWA8_GRVWB16_GSU0_GSUC0_GSUWGMRR0_K1_LBSPPA512_LBSPPB1024_LPA8_LPB16_LRVW8_MIWT4_8_PLR1_SU0_SUM0_SUS128_VWA4_VWB8_WGM8_WGMXCC1_WGMXCCGn1
    SolutionIndex: 32
    SolutionNameMin: Cijk_Alik_Bljk_F8B8NSS_BH_Bias_HAS_SAV_UserArgs_MT256x144x128_MI16x16x1_SN_LDSB1_CLR1_GRVWA8_GRVWB8_GSU0_GSUC0_GSUWGMRR0_K1_LBSPPA512_LBSPPB128_LPA8_LPB8_LRVW8_MIWT4_9_PLR1_SU0_SUM0_SUS128_VWA4_VWB1_WGM1_WGMXCC1_WGMXCCGn1
    SolutionIndex: 33
    SolutionNameMin: Cijk_Alik_Bljk_F8B8NSS_BH_Bias_HAS_SAV_UserArgs_MT256x144x128_MI16x16x1_SN_LDSB1_CLR1_GRVWA16_GRVWB8_GSU0_GSUC0_GSUWGMRR0_K1_LBSPPA512_LBSPPB128_LPA16_LPB8_LRVW8_MIWT4_9_PLR1_SU0_SUM0_SUS128_VWA4_VWB1_WGM1_WGMXCC1_WGMXCCGn1
    SolutionIndex: 34
    SolutionNameMin: Cijk_Alik_Bljk_F8B8NSS_BH_Bias_HAS_SAV_UserArgs_MT256x144x128_MI16x16x1_SN_LDSB1_CLR1_GRVWA8_GRVWB8_GSU0_GSUC0_GSUWGMRR0_K1_LBSPPA512_LBSPPB128_LPA8_LPB8_LRVW8_MIWT4_9_PLR1_SU0_SUM0_SUS128_VWA4_VWB1_WGM6_WGMXCC1_WGMXCCGn1
    SolutionIndex: 35
    SolutionNameMin: Cijk_Alik_Bljk_F8B8NSS_BH_Bias_HAS_SAV_UserArgs_MT256x144x128_MI16x16x1_SN_LDSB1_CLR1_GRVWA8_GRVWB8_GSU0_GSUC0_GSUWGMRR0_K1_LBSPPA512_LBSPPB128_LPA8_LPB8_LRVW8_MIWT4_9_PLR1_SU0_SUM0_SUS128_VWA4_VWB1_WGM8_WGMXCC1_WGMXCCGn1
    SolutionIndex: 36
    SolutionNameMin: Cijk_Alik_Bljk_F8B8NSS_BH_Bias_HAS_SAV_UserArgs_MT256x144x128_MI16x16x1_SN_LDSB1_CLR1_GRVWA16_GRVWB8_GSU0_GSUC0_GSUWGMRR0_K1_LBSPPA512_LBSPPB128_LPA16_LPB8_LRVW8_MIWT4_9_PLR1_SU0_SUM0_SUS128_VWA4_VWB1_WGM8_WGMXCC1_WGMXCCGn1
    SolutionIndex: 37
    SolutionNameMin: Cijk_Alik_Bljk_F8B8NSS_BH_Bias_HAS_SAV_UserArgs_MT256x128x128_MI16x16x1_SN_LDSB1_CLR1_GRVWA8_GRVWB16_GSU0_GSUC0_GSUWGMRR0_K1_LBSPPA1024_LBSPPB512_LPA8_LPB16_LRVW8_MIWT8_4_PLR1_SU0_SUM0_SUS128_VWA8_VWB4_WGM8_WGMXCC1_WGMXCCGn1
    SolutionIndex: 38
    SolutionNameMin: Cijk_Alik_Bljk_F8B8NSS_BH_Bias_HAS_SAV_UserArgs_MT144x256x128_MI16x16x1_SN_LDSB1_CLR1_GRVWA8_GRVWB16_GSU0_GSUC0_GSUWGMRR0_K1_LBSPPA128_LBSPPB512_LPA8_LPB16_LRVW8_MIWT9_4_PLR1_SU0_SUM0_SUS128_VWA1_VWB4_WGM1_WGMXCC1_WGMXCCGn1
    SolutionIndex: 39
    SolutionNameMin: Cijk_Alik_Bljk_F8B8NSS_BH_Bias_HAS_SAV_UserArgs_MT144x256x128_MI16x16x1_SN_LDSB1_CLR1_GRVWA8_GRVWB8_GSU0_GSUC0_GSUWGMRR0_K1_LBSPPA128_LBSPPB512_LPA8_LPB8_LRVW8_MIWT9_4_PLR1_SU0_SUM0_SUS128_VWA1_VWB4_WGM6_WGMXCC1_WGMXCCGn1
    SolutionIndex: 40
    SolutionNameMin: Cijk_Alik_Bljk_F8B8NSS_BH_Bias_HAS_SAV_UserArgs_MT144x256x128_MI16x16x1_SN_LDSB1_CLR1_GRVWA8_GRVWB16_GSU0_GSUC0_GSUWGMRR0_K1_LBSPPA128_LBSPPB512_LPA8_LPB16_LRVW8_MIWT9_4_PLR1_SU0_SUM0_SUS128_VWA1_VWB4_WGM6_WGMXCC1_WGMXCCGn1
    SolutionIndex: 41
    SolutionNameMin: Cijk_Alik_Bljk_F8B8NSS_BH_Bias_HAS_SAV_UserArgs_MT144x256x128_MI16x16x1_SN_LDSB1_CLR1_GRVWA8_GRVWB8_GSU0_GSUC0_GSUWGMRR0_K1_LBSPPA128_LBSPPB512_LPA8_LPB8_LRVW8_MIWT9_4_PLR1_SU0_SUM0_SUS128_VWA1_VWB4_WGM8_WGMXCC1_WGMXCCGn1
    SolutionIndex: 42
    SolutionNameMin: Cijk_Alik_Bljk_F8B8NSS_BH_Bias_HAS_SAV_UserArgs_MT144x256x128_MI16x16x1_SN_LDSB1_CLR1_GRVWA8_GRVWB16_GSU0_GSUC0_GSUWGMRR0_K1_LBSPPA128_LBSPPB512_LPA8_LPB16_LRVW8_MIWT9_4_PLR1_SU0_SUM0_SUS128_VWA1_VWB4_WGM8_WGMXCC1_WGMXCCGn1
    SolutionIndex: 43
    SolutionNameMin: Cijk_Alik_Bljk_F8B8NSS_BH_Bias_HAS_SAV_UserArgs_MT64x144x128_MI16x16x1_SN_LDSB1_CLR1_GRVWA16_GRVWB8_GSU0_GSUC0_GSUWGMRR0_K1_LBSPPA128_LBSPPB128_LPA16_LPB8_LRVW8_MIWT1_9_PLR1_SU0_SUM0_SUS128_VWA1_VWB1_WGM1_WGMXCC1_WGMXCCGn1
    SolutionIndex: 44
    SolutionNameMin: Cijk_Alik_Bljk_F8B8NSS_BH_Bias_HAS_SAV_UserArgs_MT128x144x128_MI16x16x1_SN_LDSB1_CLR1_GRVWA16_GRVWB8_GSU0_GSUC0_GSUWGMRR0_K1_LBSPPA256_LBSPPB128_LPA16_LPB8_LRVW8_MIWT2_9_PLR1_SU0_SUM0_SUS128_VWA2_VWB1_WGM1_WGMXCC1_WGMXCCGn1
    SolutionIndex: 45
    SolutionNameMin: Cijk_Alik_Bljk_F8B8NSS_BH_Bias_HAS_SAV_UserArgs_MT128x144x128_MI16x16x1_SN_LDSB1_CLR1_GRVWA8_GRVWB8_GSU0_GSUC0_GSUWGMRR0_K1_LBSPPA256_LBSPPB128_LPA8_LPB8_LRVW8_MIWT2_9_PLR1_SU0_SUM0_SUS128_VWA2_VWB1_WGM6_WGMXCC1_WGMXCCGn1
    SolutionIndex: 46
    SolutionNameMin: Cijk_Alik_Bljk_F8B8NSS_BH_Bias_HAS_SAV_UserArgs_MT128x144x128_MI16x16x1_SN_LDSB1_CLR1_GRVWA16_GRVWB8_GSU0_GSUC0_GSUWGMRR0_K1_LBSPPA256_LBSPPB128_LPA16_LPB8_LRVW8_MIWT2_9_PLR1_SU0_SUM0_SUS128_VWA2_VWB1_WGM8_WGMXCC1_WGMXCCGn1
    SolutionIndex: 47
    SolutionNameMin: Cijk_Alik_Bljk_F8B8NSS_BH_Bias_HAS_SAV_UserArgs_MT144x64x128_MI16x16x1_SN_LDSB1_CLR1_GRVWA8_GRVWB16_GSU0_GSUC0_GSUWGMRR0_K1_LBSPPA128_LBSPPB128_LPA8_LPB16_LRVW8_MIWT9_1_PLR1_SU0_SUM0_SUS128_VWA1_VWB1_WGM6_WGMXCC1_WGMXCCGn1
    SolutionIndex: 48
    SolutionNameMin: Cijk_Alik_Bljk_F8B8NSS_BH_Bias_HAS_SAV_UserArgs_MT144x64x128_MI16x16x1_SN_LDSB1_CLR1_GRVWA8_GRVWB16_GSU0_GSUC0_GSUWGMRR0_K1_LBSPPA128_LBSPPB128_LPA8_LPB16_LRVW8_MIWT9_1_PLR1_SU0_SUM0_SUS128_VWA1_VWB1_WGM8_WGMXCC1_WGMXCCGn1
    SolutionIndex: 49
    SolutionNameMin: Cijk_Alik_Bljk_F8B8NSS_BH_Bias_HAS_SAV_UserArgs_MT144x128x128_MI16x16x1_SN_LDSB1_CLR1_GRVWA8_GRVWB16_GSU0_GSUC0_GSUWGMRR0_K1_LBSPPA128_LBSPPB256_LPA8_LPB16_LRVW8_MIWT9_2_PLR1_SU0_SUM0_SUS128_VWA1_VWB2_WGM1_WGMXCC1_WGMXCCGn1
    SolutionIndex: 50
    SolutionNameMin: Cijk_Alik_Bljk_F8B8NSS_BH_Bias_HAS_SAV_UserArgs_MT144x128x128_MI16x16x1_SN_LDSB1_CLR1_GRVWA8_GRVWB16_GSU0_GSUC0_GSUWGMRR0_K1_LBSPPA128_LBSPPB256_LPA8_LPB16_LRVW8_MIWT9_2_PLR1_SU0_SUM0_SUS128_VWA1_VWB2_WGM6_WGMXCC1_WGMXCCGn1
    SolutionIndex: 51
    SolutionNameMin: Cijk_Alik_Bljk_F8B8NSS_BH_Bias_HAS_SAV_UserArgs_MT144x128x128_MI16x16x1_SN_LDSB1_CLR1_GRVWA8_GRVWB16_GSU0_GSUC0_GSUWGMRR0_K1_LBSPPA128_LBSPPB256_LPA8_LPB16_LRVW8_MIWT9_2_PLR1_SU0_SUM0_SUS128_VWA1_VWB2_WGM8_WGMXCC1_WGMXCCGn1
    SolutionIndex: 52
    SolutionNameMin: Cijk_Alik_Bljk_F8B8NSS_BH_Bias_HAS_SAV_UserArgs_MT128x128x128_MI16x16x1_SN_LDSB1_CLR1_GRVWA8_GRVWB16_GSU0_GSUC0_GSUWGMRR0_K1_LBSPPA512_LBSPPB512_LPA8_LPB16_LRVW8_MIWT4_4_PLR1_SU0_SUM0_SUS128_VWA4_VWB4_WGM1_WGMXCC1_WGMXCCGn1
    SolutionIndex: 53
    SolutionNameMin: Cijk_Alik_Bljk_F8B8NSS_BH_Bias_HAS_SAV_UserArgs_MT128x128x128_MI16x16x1_SN_LDSB1_CLR1_GRVWA16_GRVWB16_GSU0_GSUC0_GSUWGMRR0_K1_LBSPPA512_LBSPPB512_LPA16_LPB16_LRVW8_MIWT4_4_PLR1_SU0_SUM0_SUS128_VWA4_VWB4_WGM1_WGMXCC1_WGMXCCGn1
    SolutionIndex: 54
    SolutionNameMin: Cijk_Alik_Bljk_F8B8NSS_BH_Bias_HAS_SAV_UserArgs_MT128x128x128_MI16x16x1_SN_LDSB1_CLR1_GRVWA8_GRVWB16_GSU0_GSUC0_GSUWGMRR0_K1_LBSPPA512_LBSPPB512_LPA8_LPB16_LRVW8_MIWT4_4_PLR1_SU0_SUM0_SUS128_VWA4_VWB4_WGM6_WGMXCC1_WGMXCCGn1
    SolutionIndex: 55
    SolutionNameMin: Cijk_Alik_Bljk_F8B8NSS_BH_Bias_HAS_SAV_UserArgs_MT128x128x128_MI16x16x1_SN_LDSB1_CLR1_GRVWA8_GRVWB16_GSU0_GSUC0_GSUWGMRR0_K1_LBSPPA512_LBSPPB512_LPA8_LPB16_LRVW8_MIWT4_4_PLR1_SU0_SUM0_SUS128_VWA4_VWB4_WGM8_WGMXCC1_WGMXCCGn1
    SolutionIndex: 56
    SolutionNameMin: Cijk_Alik_Bljk_F8B8NSS_BH_Bias_HAS_SAV_UserArgs_MT128x128x128_MI16x16x1_SN_LDSB1_CLR1_GRVWA16_GRVWB16_GSU0_GSUC0_GSUWGMRR0_K1_LBSPPA512_LBSPPB512_LPA16_LPB16_LRVW8_MIWT4_4_PLR1_SU0_SUM0_SUS128_VWA4_VWB4_WGM8_WGMXCC1_WGMXCCGn1
    SolutionIndex: 57
    SolutionNameMin: Cijk_Alik_Bljk_F8B8NSS_BH_Bias_HAS_SAV_UserArgs_MT64x128x128_MI16x16x1_SN_LDSB1_CLR1_GRVWA8_GRVWB16_GSU0_GSUC0_GSUWGMRR0_K1_LBSPPA256_LBSPPB512_LPA8_LPB16_LRVW8_MIWT2_4_PLR1_SU0_SUM0_SUS128_VWA2_VWB4_WGM1_WGMXCC1_WGMXCCGn1
    SolutionIndex: 58
    SolutionNameMin: Cijk_Alik_Bljk_F8B8NSS_BH_Bias_HAS_SAV_UserArgs_MT64x128x128_MI16x16x1_SN_LDSB1_CLR1_GRVWA8_GRVWB16_GSU0_GSUC0_GSUWGMRR0_K1_LBSPPA256_LBSPPB512_LPA8_LPB16_LRVW8_MIWT2_4_PLR1_SU0_SUM0_SUS128_VWA2_VWB4_WGM6_WGMXCC1_WGMXCCGn1
    SolutionIndex: 59
    SolutionNameMin: Cijk_Alik_Bljk_F8B8NSS_BH_Bias_HAS_SAV_UserArgs_MT64x128x128_MI16x16x1_SN_LDSB1_CLR1_GRVWA8_GRVWB16_GSU0_GSUC0_GSUWGMRR0_K1_LBSPPA256_LBSPPB512_LPA8_LPB16_LRVW8_MIWT2_4_PLR1_SU0_SUM0_SUS128_VWA2_VWB4_WGM8_WGMXCC1_WGMXCCGn1
    SolutionIndex: 60
    SolutionNameMin: Cijk_Alik_Bljk_F8B8NSS_BH_Bias_HAS_SAV_UserArgs_MT128x64x128_MI16x16x1_SN_LDSB1_CLR1_GRVWA16_GRVWB16_GSU0_GSUC0_GSUWGMRR0_K1_LBSPPA512_LBSPPB256_LPA16_LPB16_LRVW8_MIWT4_2_PLR1_SU0_SUM0_SUS128_VWA4_VWB2_WGM1_WGMXCC1_WGMXCCGn1
    SolutionIndex: 61
    SolutionNameMin: Cijk_Alik_Bljk_F8B8NSS_BH_Bias_HAS_SAV_UserArgs_MT128x64x128_MI16x16x1_SN_LDSB1_CLR1_GRVWA16_GRVWB16_GSU0_GSUC0_GSUWGMRR0_K1_LBSPPA512_LBSPPB256_LPA16_LPB16_LRVW8_MIWT4_2_PLR1_SU0_SUM0_SUS128_VWA4_VWB2_WGM8_WGMXCC1_WGMXCCGn1
    SolutionIndex: 62
    SolutionNameMin: Cijk_Alik_Bljk_F8B8NSS_BH_Bias_HAS_SAV_UserArgs_MT64x64x128_MI16x16x1_SN_LDSB1_CLR1_GRVWA16_GRVWB8_GSU0_GSUC0_GSUWGMRR0_K1_LBSPPA256_LBSPPB256_LPA16_LPB8_LRVW8_MIWT2_2_PLR1_SU0_SUM0_SUS128_VWA2_VWB2_WGM1_WGMXCC1_WGMXCCGn1
    SolutionIndex: 63
    SolutionNameMin: Cijk_Alik_Bljk_F8B8NSS_BH_Bias_HAS_SAV_UserArgs_MT64x64x128_MI16x16x1_SN_LDSB1_CLR1_GRVWA8_GRVWB16_GSU0_GSUC0_GSUWGMRR0_K1_LBSPPA256_LBSPPB256_LPA8_LPB16_LRVW8_MIWT2_2_PLR1_SU0_SUM0_SUS128_VWA2_VWB2_WGM1_WGMXCC1_WGMXCCGn1
    SolutionIndex: 64
    SolutionNameMin: Cijk_Alik_Bljk_F8B8NSS_BH_Bias_HAS_SAV_UserArgs_MT64x64x128_MI16x16x1_SN_LDSB1_CLR1_GRVWA8_GRVWB16_GSU0_GSUC0_GSUWGMRR0_K1_LBSPPA256_LBSPPB256_LPA8_LPB16_LRVW8_MIWT2_2_PLR1_SU0_SUM0_SUS128_VWA2_VWB2_WGM6_WGMXCC1_WGMXCCGn1
    SolutionIndex: 65
    SolutionNameMin: Cijk_Alik_Bljk_F8B8NSS_BH_Bias_HAS_SAV_UserArgs_MT64x64x128_MI16x16x1_SN_LDSB1_CLR1_GRVWA16_GRVWB16_GSU0_GSUC0_GSUWGMRR0_K1_LBSPPA256_LBSPPB256_LPA16_LPB16_LRVW8_MIWT2_2_PLR1_SU0_SUM0_SUS128_VWA2_VWB2_WGM6_WGMXCC1_WGMXCCGn1
    SolutionIndex: 66
    SolutionNameMin: Cijk_Alik_Bljk_F8B8NSS_BH_Bias_HAS_SAV_UserArgs_MT64x64x128_MI16x16x1_SN_LDSB1_CLR1_GRVWA8_GRVWB16_GSU0_GSUC0_GSUWGMRR0_K1_LBSPPA256_LBSPPB256_LPA8_LPB16_LRVW8_MIWT2_2_PLR1_SU0_SUM0_SUS128_VWA2_VWB2_WGM8_WGMXCC1_WGMXCCGn1
    SolutionIndex: 67
    SolutionNameMin: Cijk_Alik_Bljk_F8B8NSS_BH_Bias_HAS_SAV_UserArgs_MT32x64x128_MI16x16x1_SN_LDSB0_CLR1_GRVWA8_GRVWB8_GSU0_GSUC0_GSUWGMRR0_K1_LBSPPA128_LBSPPB256_LPA8_LPB8_LRVW8_MIWT1_2_PLR1_SU0_SUM0_SUS128_VWA1_VWB2_WGM1_WGMXCC1_WGMXCCGn1
    SolutionIndex: 68
    SolutionNameMin: Cijk_Alik_Bljk_F8B8NSS_BH_Bias_HAS_SAV_UserArgs_MT32x64x128_MI16x16x1_SN_LDSB0_CLR1_GRVWA16_GRVWB8_GSU0_GSUC0_GSUWGMRR0_K1_LBSPPA128_LBSPPB256_LPA16_LPB8_LRVW8_MIWT1_2_PLR1_SU0_SUM0_SUS128_VWA1_VWB2_WGM1_WGMXCC1_WGMXCCGn1
    SolutionIndex: 69
    SolutionNameMin: Cijk_Alik_Bljk_F8B8NSS_BH_Bias_HAS_SAV_UserArgs_MT32x64x128_MI16x16x1_SN_LDSB0_CLR1_GRVWA8_GRVWB16_GSU0_GSUC0_GSUWGMRR0_K1_LBSPPA128_LBSPPB256_LPA8_LPB16_LRVW8_MIWT1_2_PLR1_SU0_SUM0_SUS128_VWA1_VWB2_WGM1_WGMXCC1_WGMXCCGn1
    SolutionIndex: 70
    SolutionNameMin: Cijk_Alik_Bljk_F8B8NSS_BH_Bias_HAS_SAV_UserArgs_MT32x64x128_MI16x16x1_SN_LDSB0_CLR1_GRVWA16_GRVWB16_GSU0_GSUC0_GSUWGMRR0_K1_LBSPPA128_LBSPPB256_LPA16_LPB16_LRVW8_MIWT1_2_PLR1_SU0_SUM0_SUS128_VWA1_VWB2_WGM1_WGMXCC1_WGMXCCGn1
    SolutionIndex: 71
    SolutionNameMin: Cijk_Alik_Bljk_F8B8NSS_BH_Bias_HAS_SAV_UserArgs_MT32x64x128_MI16x16x1_SN_LDSB0_CLR1_GRVWA8_GRVWB8_GSU0_GSUC0_GSUWGMRR0_K1_LBSPPA128_LBSPPB256_LPA8_LPB8_LRVW8_MIWT1_2_PLR1_SU0_SUM0_SUS128_VWA1_VWB2_WGM6_WGMXCC1_WGMXCCGn1
    SolutionIndex: 72
    SolutionNameMin: Cijk_Alik_Bljk_F8B8NSS_BH_Bias_HAS_SAV_UserArgs_MT32x64x128_MI16x16x1_SN_LDSB0_CLR1_GRVWA8_GRVWB8_GSU0_GSUC0_GSUWGMRR0_K1_LBSPPA128_LBSPPB256_LPA8_LPB8_LRVW8_MIWT1_2_PLR1_SU0_SUM0_SUS128_VWA1_VWB2_WGM8_WGMXCC1_WGMXCCGn1
    SolutionIndex: 73
    SolutionNameMin: Cijk_Alik_Bljk_F8B8NSS_BH_Bias_HAS_SAV_UserArgs_MT64x32x128_MI16x16x1_SN_LDSB0_CLR1_GRVWA8_GRVWB8_GSU0_GSUC0_GSUWGMRR0_K1_LBSPPA256_LBSPPB128_LPA8_LPB8_LRVW8_MIWT2_1_PLR1_SU0_SUM0_SUS128_VWA2_VWB1_WGM1_WGMXCC1_WGMXCCGn1
    SolutionIndex: 74
    SolutionNameMin: Cijk_Alik_Bljk_F8B8NSS_BH_Bias_HAS_SAV_UserArgs_MT64x32x128_MI16x16x1_SN_LDSB0_CLR1_GRVWA16_GRVWB8_GSU0_GSUC0_GSUWGMRR0_K1_LBSPPA256_LBSPPB128_LPA16_LPB8_LRVW8_MIWT2_1_PLR1_SU0_SUM0_SUS128_VWA2_VWB1_WGM1_WGMXCC1_WGMXCCGn1
    SolutionIndex: 75
    SolutionNameMin: Cijk_Alik_Bljk_F8B8NSS_BH_Bias_HAS_SAV_UserArgs_MT64x32x128_MI16x16x1_SN_LDSB0_CLR1_GRVWA8_GRVWB16_GSU0_GSUC0_GSUWGMRR0_K1_LBSPPA256_LBSPPB128_LPA8_LPB16_LRVW8_MIWT2_1_PLR1_SU0_SUM0_SUS128_VWA2_VWB1_WGM1_WGMXCC1_WGMXCCGn1
    SolutionIndex: 76
    SolutionNameMin: Cijk_Alik_Bljk_F8B8NSS_BH_Bias_HAS_SAV_UserArgs_MT64x32x128_MI16x16x1_SN_LDSB0_CLR1_GRVWA16_GRVWB16_GSU0_GSUC0_GSUWGMRR0_K1_LBSPPA256_LBSPPB128_LPA16_LPB16_LRVW8_MIWT2_1_PLR1_SU0_SUM0_SUS128_VWA2_VWB1_WGM1_WGMXCC1_WGMXCCGn1
    SolutionIndex: 77
    SolutionNameMin: Cijk_Alik_Bljk_F8B8NSS_BH_Bias_HAS_SAV_UserArgs_MT32x32x128_MI16x16x1_SN_LDSB0_CLR1_GRVWA8_GRVWB8_GSU0_GSUC0_GSUWGMRR0_K1_LBSPPA128_LBSPPB128_LPA8_LPB8_LRVW8_MIWT1_1_PLR1_SU0_SUM0_SUS128_VWA1_VWB1_WGM1_WGMXCC1_WGMXCCGn1
    SolutionIndex: 78
    SolutionNameMin: Cijk_Alik_Bljk_F8B8NSS_BH_Bias_HAS_SAV_UserArgs_MT32x32x128_MI16x16x1_SN_LDSB0_CLR1_GRVWA16_GRVWB8_GSU0_GSUC0_GSUWGMRR0_K1_LBSPPA128_LBSPPB128_LPA16_LPB8_LRVW8_MIWT1_1_PLR1_SU0_SUM0_SUS128_VWA1_VWB1_WGM1_WGMXCC1_WGMXCCGn1
    SolutionIndex: 79
    SolutionNameMin: Cijk_Alik_Bljk_F8B8NSS_BH_Bias_HAS_SAV_UserArgs_MT32x32x128_MI16x16x1_SN_LDSB0_CLR1_GRVWA8_GRVWB16_GSU0_GSUC0_GSUWGMRR0_K1_LBSPPA128_LBSPPB128_LPA8_LPB16_LRVW8_MIWT1_1_PLR1_SU0_SUM0_SUS128_VWA1_VWB1_WGM1_WGMXCC1_WGMXCCGn1
    SolutionIndex: 80
    SolutionNameMin: Cijk_Alik_Bljk_F8B8NSS_BH_Bias_HAS_SAV_UserArgs_MT32x32x128_MI16x16x1_SN_LDSB0_CLR1_GRVWA16_GRVWB16_GSU0_GSUC0_GSUWGMRR0_K1_LBSPPA128_LBSPPB128_LPA16_LPB16_LRVW8_MIWT1_1_PLR1_SU0_SUM0_SUS128_VWA1_VWB1_WGM1_WGMXCC1_WGMXCCGn1
    SolutionIndex: 81
    SolutionNameMin: Cijk_Alik_Bljk_F8B8NSS_BH_Bias_HAS_SAV_UserArgs_MT32x32x128_MI16x16x1_SN_LDSB0_CLR1_GRVWA8_GRVWB8_GSU0_GSUC0_GSUWGMRR0_K1_LBSPPA128_LBSPPB128_LPA8_LPB8_LRVW8_MIWT1_1_PLR1_SU0_SUM0_SUS128_VWA1_VWB1_WGM6_WGMXCC1_WGMXCCGn1
    SolutionIndex: 82
    SolutionNameMin: Cijk_Alik_Bljk_F8B8NSS_BH_Bias_HAS_SAV_UserArgs_MT32x32x128_MI16x16x1_SN_LDSB0_CLR1_GRVWA16_GRVWB8_GSU0_GSUC0_GSUWGMRR0_K1_LBSPPA128_LBSPPB128_LPA16_LPB8_LRVW8_MIWT1_1_PLR1_SU0_SUM0_SUS128_VWA1_VWB1_WGM6_WGMXCC1_WGMXCCGn1
    SolutionIndex: 83
    SolutionNameMin: Cijk_Alik_Bljk_F8B8NSS_BH_Bias_HAS_SAV_UserArgs_MT32x32x128_MI16x16x1_SN_LDSB0_CLR1_GRVWA8_GRVWB8_GSU0_GSUC0_GSUWGMRR0_K1_LBSPPA128_LBSPPB128_LPA8_LPB8_LRVW8_MIWT1_1_PLR1_SU0_SUM0_SUS128_VWA1_VWB1_WGM8_WGMXCC1_WGMXCCGn1
    SolutionIndex: 84
    SolutionNameMin: Cijk_Alik_Bljk_F8B8NSS_BH_Bias_HAS_SAV_UserArgs_MT32x32x128_MI16x16x1_SN_LDSB0_CLR1_GRVWA8_GRVWB16_GSU0_GSUC0_GSUWGMRR0_K1_LBSPPA128_LBSPPB128_LPA8_LPB16_LRVW8_MIWT1_1_PLR1_SU0_SUM0_SUS128_VWA1_VWB1_WGM8_WGMXCC1_WGMXCCGn1
    SolutionIndex: 85
    SolutionNameMin: Cijk_Alik_Bljk_F8B8NSS_BH_Bias_HAS_SAV_UserArgs_MT128x64x256_MI16x16x1_SN_LDSB1_CLR1_GRVWA8_GRVWB16_GSU0_GSUC0_GSUWGMRR0_K1_LBSPPA1024_LBSPPB512_LPA8_LPB16_LRVW8_MIWT4_2_PLR1_SU0_SUM0_SUS256_VWA4_VWB2_WGM1_WGMXCC1_WGMXCCGn1
    SolutionIndex: 86
    SolutionNameMin: Cijk_Alik_Bljk_F8B8NSS_BH_Bias_HAS_SAV_UserArgs_MT128x64x256_MI16x16x1_SN_LDSB1_CLR1_GRVWA8_GRVWB16_GSU0_GSUC0_GSUWGMRR0_K1_LBSPPA1024_LBSPPB512_LPA8_LPB16_LRVW8_MIWT4_2_PLR1_SU0_SUM0_SUS256_VWA4_VWB2_WGM6_WGMXCC1_WGMXCCGn1
    SolutionIndex: 87
    SolutionNameMin: Cijk_Alik_Bljk_F8B8NSS_BH_Bias_HAS_SAV_UserArgs_MT128x64x256_MI16x16x1_SN_LDSB1_CLR1_GRVWA8_GRVWB16_GSU0_GSUC0_GSUWGMRR0_K1_LBSPPA1024_LBSPPB512_LPA8_LPB16_LRVW8_MIWT4_2_PLR1_SU0_SUM0_SUS256_VWA4_VWB2_WGM8_WGMXCC1_WGMXCCGn1
    SolutionIndex: 88
    SolutionNameMin: Cijk_Alik_Bljk_F8B8NSS_BH_Bias_HAS_SAV_UserArgs_MT64x64x256_MI16x16x1_SN_LDSB1_CLR1_GRVWA8_GRVWB16_GSU0_GSUC0_GSUWGMRR0_K1_LBSPPA512_LBSPPB512_LPA8_LPB16_LRVW8_MIWT2_2_PLR1_SU0_SUM0_SUS256_VWA2_VWB2_WGM1_WGMXCC1_WGMXCCGn1
    SolutionIndex: 89
    SolutionNameMin: Cijk_Alik_Bljk_F8B8NSS_BH_Bias_HAS_SAV_UserArgs_MT64x64x256_MI16x16x1_SN_LDSB1_CLR1_GRVWA8_GRVWB16_GSU0_GSUC0_GSUWGMRR0_K1_LBSPPA512_LBSPPB512_LPA8_LPB16_LRVW8_MIWT2_2_PLR1_SU0_SUM0_SUS256_VWA2_VWB2_WGM6_WGMXCC1_WGMXCCGn1
    SolutionIndex: 90
    SolutionNameMin: Cijk_Alik_Bljk_F8B8NSS_BH_Bias_HAS_SAV_UserArgs_MT64x64x256_MI16x16x1_SN_LDSB1_CLR1_GRVWA8_GRVWB16_GSU0_GSUC0_GSUWGMRR0_K1_LBSPPA512_LBSPPB512_LPA8_LPB16_LRVW8_MIWT2_2_PLR1_SU0_SUM0_SUS256_VWA2_VWB2_WGM8_WGMXCC1_WGMXCCGn1
    SolutionIndex: 91
    SolutionNameMin: Cijk_Alik_Bljk_F8B8NSS_BH_Bias_HAS_SAV_UserArgs_MT32x32x256_MI16x16x1_SN_LDSB1_CLR1_GRVWA8_GRVWB16_GSU0_GSUC0_GSUWGMRR0_K1_LBSPPA256_LBSPPB256_LPA8_LPB16_LRVW8_MIWT1_1_PLR1_SU0_SUM0_SUS256_VWA1_VWB1_WGM1_WGMXCC1_WGMXCCGn1
    SolutionIndex: 92
    SolutionNameMin: Cijk_Alik_Bljk_F8B8NSS_BH_Bias_HAS_SAV_UserArgs_MT32x32x256_MI16x16x1_SN_LDSB1_CLR1_GRVWA8_GRVWB16_GSU0_GSUC0_GSUWGMRR0_K1_LBSPPA256_LBSPPB256_LPA8_LPB16_LRVW8_MIWT1_1_PLR1_SU0_SUM0_SUS256_VWA1_VWB1_WGM6_WGMXCC1_WGMXCCGn1
    SolutionIndex: 93
    SolutionNameMin: Cijk_Alik_Bljk_F8B8NSS_BH_Bias_HAS_SAV_UserArgs_MT32x32x256_MI16x16x1_SN_LDSB1_CLR1_GRVWA8_GRVWB16_GSU0_GSUC0_GSUWGMRR0_K1_LBSPPA256_LBSPPB256_LPA8_LPB16_LRVW8_MIWT1_1_PLR1_SU0_SUM0_SUS256_VWA1_VWB1_WGM8_WGMXCC1_WGMXCCGn1
    SolutionIndex: 94
    SolutionNameMin: Cijk_Alik_Bljk_F8B8NSS_BH_Bias_HAS_SAV_UserArgs_MT32x32x128_MI16x16x1_SN_LDSB0_CLR1_GRVWA16_GRVWB8_GSU0_GSUC0_GSUWGMRR0_K1_LBSPPA128_LBSPPB128_LPA16_LPB8_LRVW8_MIWT1_1_PLR2_SU32_SUM0_SUS256_VWA1_VWB1_WGM1_WGMXCC1_WGMXCCGn1
- - - [128, 128, 1, 128, 128, 128, 128, 128]
    - [28, 0.62]
  - - [128, 128, 1, 256, 128, 128, 256, 256]
    - [78, 1.17]
  - - [128, 128, 1, 512, 128, 128, 512, 512]
    - [78, 2.05]
  - - [128, 128, 1, 1024, 128, 128, 1024, 1024]
    - [77, 3.49]
  - - [128, 128, 1, 2048, 128, 128, 2048, 2048]
    - [77, 5.33]
  - - [128, 128, 1, 4096, 128, 128, 4096, 4096]
    - [77, 7.2]
  - - [128, 128, 1, 8192, 128, 128, 8192, 8192]
    - [77, 8.69]
  - - [128, 256, 1, 128, 128, 128, 128, 128]
    - [81, 1.19]
  - - [128, 256, 1, 256, 128, 128, 256, 256]
    - [80, 2.36]
  - - [128, 256, 1, 512, 128, 128, 512, 512]
    - [79, 4.26]
  - - [128, 256, 1, 1024, 128, 128, 1024, 1024]
    - [79, 7.03]
  - - [128, 256, 1, 2048, 128, 128, 2048, 2048]
    - [77, 10.81]
  - - [128, 256, 1, 4096, 128, 128, 4096, 4096]
    - [77, 14.49]
  - - [128, 256, 1, 8192, 128, 128, 8192, 8192]
    - [77, 17.49]
  - - [128, 512, 1, 128, 128, 128, 128, 128]
    - [80, 2.55]
  - - [128, 512, 1, 256, 128, 128, 256, 256]
    - [80, 4.7]
  - - [128, 512, 1, 512, 128, 128, 512, 512]
    - [80, 8.42]
  - - [128, 512, 1, 1024, 128, 128, 1024, 1024]
    - [77, 13.49]
  - - [128, 512, 1, 2048, 128, 128, 2048, 2048]
    - [77, 20.69]
  - - [128, 512, 1, 4096, 128, 128, 4096, 4096]
    - [77, 28.16]
  - - [128, 512, 1, 8192, 128, 128, 8192, 8192]
    - [77, 34.48]
  - - [128, 1024, 1, 128, 128, 128, 128, 128]
    - [28, 4.93]
  - - [128, 1024, 1, 256, 128, 128, 256, 256]
    - [79, 9.22]
  - - [128, 1024, 1, 512, 128, 128, 512, 512]
    - [80, 16.49]
  - - [128, 1024, 1, 1024, 128, 128, 1024, 1024]
    - [77, 27.42]
  - - [128, 1024, 1, 2048, 128, 128, 2048, 2048]
    - [77, 40.5]
  - - [128, 1024, 1, 4096, 128, 128, 4096, 4096]
    - [77, 55.08]
  - - [128, 1024, 1, 8192, 128, 128, 8192, 8192]
    - [77, 66.89]
  - - [128, 2048, 1, 128, 128, 128, 128, 128]
    - [25, 8.37]
  - - [128, 2048, 1, 256, 128, 128, 256, 256]
    - [74, 15.97]
  - - [128, 2048, 1, 512, 128, 128, 512, 512]
    - [69, 28.16]
  - - [128, 2048, 1, 1024, 128, 128, 1024, 1024]
    - [69, 46.27]
  - - [128, 2048, 1, 2048, 128, 128, 2048, 2048]
    - [67, 66.03]
  - - [128, 2048, 1, 4096, 128, 128, 4096, 4096]
    - [67, 86.11]
  - - [128, 2048, 1, 8192, 128, 128, 8192, 8192]
    - [91, 99.01]
  - - [128, 4096, 1, 128, 128, 128, 128, 128]
    - [20, 14.84]
  - - [128, 4096, 1, 256, 128, 128, 256, 256]
    - [21, 26.7]
  - - [128, 4096, 1, 512, 128, 128, 512, 512]
    - [21, 45.68]
  - - [128, 4096, 1, 1024, 128, 128, 1024, 1024]
    - [62, 71.72]
  - - [128, 4096, 1, 2048, 128, 128, 2048, 2048]
    - [63, 100.6]
  - - [128, 4096, 1, 4096, 128, 128, 4096, 4096]
    - [63, 126.29]
  - - [128, 4096, 1, 8192, 128, 128, 8192, 8192]
    - [88, 138.1]
  - - [128, 8192, 1, 128, 128, 128, 128, 128]
    - [14, 22.44]
  - - [128, 8192, 1, 256, 128, 128, 256, 256]
    - [15, 41.18]
  - - [128, 8192, 1, 512, 128, 128, 512, 512]
    - [15, 70.88]
  - - [128, 8192, 1, 1024, 128, 128, 1024, 1024]
    - [15, 110.55]
  - - [128, 8192, 1, 2048, 128, 128, 2048, 2048]
    - [57, 140.11]
  - - [128, 8192, 1, 4096, 128, 128, 4096, 4096]
    - [85, 153.33]
  - - [128, 8192, 1, 8192, 128, 128, 8192, 8192]
    - [57, 176.32]
  - - [256, 128, 1, 128, 256, 256, 128, 128]
    - [78, 1.05]
  - - [256, 128, 1, 256, 256, 256, 256, 256]
    - [77, 2.14]
  - - [256, 128, 1, 512, 256, 256, 512, 512]
    - [79, 3.95]
  - - [256, 128, 1, 1024, 256, 256, 1024, 1024]
    - [79, 6.67]
  - - [256, 128, 1, 2048, 256, 256, 2048, 2048]
    - [77, 10.71]
  - - [256, 128, 1, 4096, 256, 256, 4096, 4096]
    - [81, 13.96]
  - - [256, 128, 1, 8192, 256, 256, 8192, 8192]
    - [77, 16.96]
  - - [256, 256, 1, 128, 256, 256, 128, 128]
    - [84, 2.03]
  - - [256, 256, 1, 256, 256, 256, 256, 256]
    - [82, 4.43]
  - - [256, 256, 1, 512, 256, 256, 512, 512]
    - [78, 8.32]
  - - [256, 256, 1, 1024, 256, 256, 1024, 1024]
    - [77, 13.96]
  - - [256, 256, 1, 2048, 256, 256, 2048, 2048]
    - [77, 21.16]
  - - [256, 256, 1, 4096, 256, 256, 4096, 4096]
    - [77, 28.62]
  - - [256, 256, 1, 8192, 256, 256, 8192, 8192]
    - [77, 34.65]
  - - [256, 512, 1, 128, 256, 256, 128, 128]
    - [80, 4.85]
  - - [256, 512, 1, 256, 256, 256, 256, 256]
    - [79, 9.0]
  - - [256, 512, 1, 512, 256, 256, 512, 512]
    - [80, 16.4]
  - - [256, 512, 1, 1024, 256, 256, 1024, 1024]
    - [79, 27.16]
  - - [256, 512, 1, 2048, 256, 256, 2048, 2048]
    - [77, 41.73]
  - - [256, 512, 1, 4096, 256, 256, 4096, 4096]
    - [77, 54.8]
  - - [256, 512, 1, 8192, 256, 256, 8192, 8192]
    - [77, 67.67]
  - - [256, 1024, 1, 128, 256, 256, 128, 128]
    - [26, 8.71]
  - - [256, 1024, 1, 256, 256, 256, 256, 256]
    - [70, 16.26]
  - - [256, 1024, 1, 512, 256, 256, 512, 512]
    - [69, 28.54]
  - - [256, 1024, 1, 1024, 256, 256, 1024, 1024]
    - [67, 46.3]
  - - [256, 1024, 1, 2048, 256, 256, 2048, 2048]
    - [68, 66.29]
  - - [256, 1024, 1, 4096, 256, 256, 4096, 4096]
    - [67, 86.07]
  - - [256, 1024, 1, 8192, 256, 256, 8192, 8192]
    - [73, 100.38]
  - - [256, 2048, 1, 128, 256, 256, 128, 128]
    - [20, 14.64]
  - - [256, 2048, 1, 256, 256, 256, 256, 256]
    - [21, 26.85]
  - - [256, 2048, 1, 512, 256, 256, 512, 512]
    - [22, 45.43]
  - - [256, 2048, 1, 1024, 256, 256, 1024, 1024]
    - [63, 71.44]
  - - [256, 2048, 1, 2048, 256, 256, 2048, 2048]
    - [63, 100.76]
  - - [256, 2048, 1, 4096, 256, 256, 4096, 4096]
    - [63, 127.05]
  - - [256, 2048, 1, 8192, 256, 256, 8192, 8192]
    - [88, 139.51]
  - - [256, 4096, 1, 128, 256, 256, 128, 128]
    - [16, 22.42]
  - - [256, 4096, 1, 256, 256, 256, 256, 256]
    - [15, 40.95]
  - - [256, 4096, 1, 512, 256, 256, 512, 512]
    - [19, 71.13]
  - - [256, 4096, 1, 1024, 256, 256, 1024, 1024]
    - [15, 109.99]
  - - [256, 4096, 1, 2048, 256, 256, 2048, 2048]
    - [15, 150.09]
  - - [256, 4096, 1, 4096, 256, 256, 4096, 4096]
    - [85, 161.76]
  - - [256, 4096, 1, 8192, 256, 256, 8192, 8192]
    - [57, 181.91]
  - - [256, 8192, 1, 128, 256, 256, 128, 128]
    - [43, 33.18]
  - - [256, 8192, 1, 256, 256, 256, 256, 256]
    - [43, 60.72]
  - - [256, 8192, 1, 512, 256, 256, 512, 512]
    - [43, 103.88]
  - - [256, 8192, 1, 1024, 256, 256, 1024, 1024]
    - [43, 148.24]
  - - [256, 8192, 1, 2048, 256, 256, 2048, 2048]
    - [53, 167.24]
  - - [256, 8192, 1, 4096, 256, 256, 4096, 4096]
    - [53, 201.07]
  - - [256, 8192, 1, 8192, 256, 256, 8192, 8192]
    - [52, 232.19]
  - - [512, 128, 1, 128, 512, 512, 128, 128]
    - [84, 2.3]
  - - [512, 128, 1, 256, 512, 512, 256, 256]
    - [28, 4.49]
  - - [512, 128, 1, 512, 512, 512, 512, 512]
    - [80, 8.14]
  - - [512, 128, 1, 1024, 512, 512, 1024, 1024]
    - [78, 13.74]
  - - [512, 128, 1, 2048, 512, 512, 2048, 2048]
    - [77, 20.85]
  - - [512, 128, 1, 4096, 512, 512, 4096, 4096]
    - [77, 28.41]
  - - [512, 128, 1, 8192, 512, 512, 8192, 8192]
    - [77, 34.01]
  - - [512, 256, 1, 128, 512, 512, 128, 128]
    - [78, 4.45]
  - - [512, 256, 1, 256, 512, 512, 256, 256]
    - [79, 8.64]
  - - [512, 256, 1, 512, 512, 512, 512, 512]
    - [78, 15.52]
  - - [512, 256, 1, 1024, 512, 512, 1024, 1024]
    - [77, 25.9]
  - - [512, 256, 1, 2048, 512, 512, 2048, 2048]
    - [77, 39.71]
  - - [512, 256, 1, 4096, 512, 512, 4096, 4096]
    - [83, 54.21]
  - - [512, 256, 1, 8192, 512, 512, 8192, 8192]
    - [83, 66.06]
  - - [512, 512, 1, 128, 512, 512, 128, 128]
    - [69, 8.27]
  - - [512, 512, 1, 256, 512, 512, 256, 256]
    - [69, 15.35]
  - - [512, 512, 1, 512, 512, 512, 512, 512]
    - [70, 27.73]
  - - [512, 512, 1, 1024, 512, 512, 1024, 1024]
    - [73, 45.86]
  - - [512, 512, 1, 2048, 512, 512, 2048, 2048]
    - [67, 67.84]
  - - [512, 512, 1, 4096, 512, 512, 4096, 4096]
    - [67, 88.07]
  - - [512, 512, 1, 8192, 512, 512, 8192, 8192]
    - [93, 95.61]
  - - [512, 1024, 1, 128, 512, 512, 128, 128]
    - [22, 13.79]
  - - [512, 1024, 1, 256, 512, 512, 256, 256]
    - [21, 26.75]
  - - [512, 1024, 1, 512, 512, 512, 512, 512]
    - [21, 45.72]
  - - [512, 1024, 1, 1024, 512, 512, 1024, 1024]
    - [62, 71.75]
  - - [512, 1024, 1, 2048, 512, 512, 2048, 2048]
    - [63, 100.95]
  - - [512, 1024, 1, 4096, 512, 512, 4096, 4096]
    - [63, 126.65]
  - - [512, 1024, 1, 8192, 512, 512, 8192, 8192]
    - [90, 139.36]
  - - [512, 2048, 1, 128, 512, 512, 128, 128]
    - [14, 23.08]
  - - [512, 2048, 1, 256, 512, 512, 256, 256]
    - [15, 42.38]
  - - [512, 2048, 1, 512, 512, 512, 512, 512]
    - [15, 72.62]
  - - [512, 2048, 1, 1024, 512, 512, 1024, 1024]
    - [15, 107.91]
  - - [512, 2048, 1, 2048, 512, 512, 2048, 2048]
    - [15, 146.43]
  - - [512, 2048, 1, 4096, 512, 512, 4096, 4096]
    - [85, 163.15]
  - - [512, 2048, 1, 8192, 512, 512, 8192, 8192]
    - [57, 183.32]
  - - [512, 4096, 1, 128, 512, 512, 128, 128]
    - [11, 33.89]
  - - [512, 4096, 1, 256, 512, 512, 256, 256]
    - [10, 60.2]
  - - [512, 4096, 1, 512, 512, 512, 512, 512]
    - [7, 102.24]
  - - [512, 4096, 1, 1024, 512, 512, 1024, 1024]
    - [52, 148.83]
  - - [512, 4096, 1, 2048, 512, 512, 2048, 2048]
    - [52, 194.13]
  - - [512, 4096, 1, 4096, 512, 512, 4096, 4096]
    - [53, 209.75]
  - - [512, 4096, 1, 8192, 512, 512, 8192, 8192]
    - [52, 240.51]
  - - [512, 8192, 1, 128, 512, 512, 128, 128]
    - [45, 40.81]
  - - [512, 8192, 1, 256, 512, 512, 256, 256]
    - [46, 74.58]
  - - [512, 8192, 1, 512, 512, 512, 512, 512]
    - [46, 120.55]
  - - [512, 8192, 1, 1024, 512, 512, 1024, 1024]
    - [44, 160.51]
  - - [512, 8192, 1, 2048, 512, 512, 2048, 2048]
    - [38, 206.82]
  - - [512, 8192, 1, 4096, 512, 512, 4096, 4096]
    - [44, 254.78]
  - - [512, 8192, 1, 8192, 512, 512, 8192, 8192]
    - [44, 271.8]
  - - [1024, 128, 1, 128, 1024, 1024, 128, 128]
    - [26, 4.13]
  - - [1024, 128, 1, 256, 1024, 1024, 256, 256]
    - [91, 8.68]
  - - [1024, 128, 1, 512, 1024, 1024, 512, 512]
    - [80, 15.77]
  - - [1024, 128, 1, 1024, 1024, 1024, 1024, 1024]
    - [79, 26.67]
  - - [1024, 128, 1, 2048, 1024, 1024, 2048, 2048]
    - [77, 40.37]
  - - [1024, 128, 1, 4096, 1024, 1024, 4096, 4096]
    - [81, 53.32]
  - - [1024, 128, 1, 8192, 1024, 1024, 8192, 8192]
    - [81, 65.84]
  - - [1024, 256, 1, 128, 1024, 1024, 128, 128]
    - [76, 8.45]
  - - [1024, 256, 1, 256, 1024, 1024, 256, 256]
    - [74, 15.78]
  - - [1024, 256, 1, 512, 1024, 1024, 512, 512]
    - [75, 27.85]
  - - [1024, 256, 1, 1024, 1024, 1024, 1024, 1024]
    - [73, 45.82]
  - - [1024, 256, 1, 2048, 1024, 1024, 2048, 2048]
    - [71, 66.93]
  - - [1024, 256, 1, 4096, 1024, 1024, 4096, 4096]
    - [72, 87.51]
  - - [1024, 256, 1, 8192, 1024, 1024, 8192, 8192]
    - [72, 98.3]
  - - [1024, 512, 1, 128, 1024, 1024, 128, 128]
    - [65, 14.15]
  - - [1024, 512, 1, 256, 1024, 1024, 256, 256]
    - [23, 26.4]
  - - [1024, 512, 1, 512, 1024, 1024, 512, 512]
    - [24, 44.97]
  - - [1024, 512, 1, 1024, 1024, 1024, 1024, 1024]
    - [66, 71.17]
  - - [1024, 512, 1, 2048, 1024, 1024, 2048, 2048]
    - [64, 100.07]
  - - [1024, 512, 1, 4096, 1024, 1024, 4096, 4096]
    - [66, 120.85]
  - - [1024, 512, 1, 8192, 1024, 1024, 8192, 8192]
    - [89, 138.22]
  - - [1024, 1024, 1, 128, 1024, 1024, 128, 128]
    - [12, 22.04]
  - - [1024, 1024, 1, 256, 1024, 1024, 256, 256]
    - [19, 40.31]
  - - [1024, 1024, 1, 512, 1024, 1024, 512, 512]
    - [17, 68.99]
  - - [1024, 1024, 1, 1024, 1024, 1024, 1024, 1024]
    - [19, 110.29]
  - - [1024, 1024, 1, 2048, 1024, 1024, 2048, 2048]
    - [15, 148.68]
  - - [1024, 1024, 1, 4096, 1024, 1024, 4096, 4096]
    - [87, 164.6]
  - - [1024, 1024, 1, 8192, 1024, 1024, 8192, 8192]
    - [58, 181.61]
  - - [1024, 2048, 1, 128, 1024, 1024, 128, 128]
    - [8, 33.74]
  - - [1024, 2048, 1, 256, 1024, 1024, 256, 256]
    - [7, 60.9]
  - - [1024, 2048, 1, 512, 1024, 1024, 512, 512]
    - [7, 103.28]
  - - [1024, 2048, 1, 1024, 1024, 1024, 1024, 1024]
    - [52, 148.4]
  - - [1024, 2048, 1, 2048, 1024, 1024, 2048, 2048]
    - [52, 187.26]
  - - [1024, 2048, 1, 4096, 1024, 1024, 4096, 4096]
    - [52, 209.29]
  - - [1024, 2048, 1, 8192, 1024, 1024, 8192, 8192]
    - [55, 233.77]
  - - [1024, 4096, 1, 128, 1024, 1024, 128, 128]
    - [4, 40.52]
  - - [1024, 4096, 1, 256, 1024, 1024, 256, 256]
    - [3, 72.47]
  - - [1024, 4096, 1, 512, 1024, 1024, 512, 512]
    - [29, 109.35]
  - - [1024, 4096, 1, 1024, 1024, 1024, 1024, 1024]
    - [29, 157.15]
  - - [1024, 4096, 1, 2048, 1024, 1024, 2048, 2048]
    - [38, 208.47]
  - - [1024, 4096, 1, 4096, 1024, 1024, 4096, 4096]
    - [38, 234.07]
  - - [1024, 4096, 1, 8192, 1024, 1024, 8192, 8192]
    - [29, 241.93]
  - - [1024, 8192, 1, 128, 1024, 1024, 128, 128]
    - [33, 44.8]
  - - [1024, 8192, 1, 256, 1024, 1024, 256, 256]
    - [33, 82.09]
  - - [1024, 8192, 1, 512, 1024, 1024, 512, 512]
    - [33, 134.67]
  - - [1024, 8192, 1, 1024, 1024, 1024, 1024, 1024]
    - [35, 192.97]
  - - [1024, 8192, 1, 2048, 1024, 1024, 2048, 2048]
    - [33, 262.51]
  - - [1024, 8192, 1, 4096, 1024, 1024, 4096, 4096]
    - [32, 307.08]
  - - [1024, 8192, 1, 8192, 1024, 1024, 8192, 8192]
    - [34, 334.57]
  - - [2048, 128, 1, 128, 2048, 2048, 128, 128]
    - [27, 8.44]
  - - [2048, 128, 1, 256, 2048, 2048, 256, 256]
    - [70, 15.43]
  - - [2048, 128, 1, 512, 2048, 2048, 512, 512]
    - [69, 28.31]
  - - [2048, 128, 1, 1024, 2048, 2048, 1024, 1024]
    - [67, 46.0]
  - - [2048, 128, 1, 2048, 2048, 2048, 2048, 2048]
    - [67, 67.99]
  - - [2048, 128, 1, 4096, 2048, 2048, 4096, 4096]
    - [67, 88.4]
  - - [2048, 128, 1, 8192, 2048, 2048, 8192, 8192]
    - [92, 94.64]
  - - [2048, 256, 1, 128, 2048, 2048, 128, 128]
    - [22, 14.36]
  - - [2048, 256, 1, 256, 2048, 2048, 256, 256]
    - [21, 26.17]
  - - [2048, 256, 1, 512, 2048, 2048, 512, 512]
    - [63, 44.39]
  - - [2048, 256, 1, 1024, 2048, 2048, 1024, 1024]
    - [63, 70.5]
  - - [2048, 256, 1, 2048, 2048, 2048, 2048, 2048]
    - [63, 99.79]
  - - [2048, 256, 1, 4096, 2048, 2048, 4096, 4096]
    - [64, 124.17]
  - - [2048, 256, 1, 8192, 2048, 2048, 8192, 8192]
    - [90, 138.57]
  - - [2048, 512, 1, 128, 2048, 2048, 128, 128]
    - [13, 22.57]
  - - [2048, 512, 1, 256, 2048, 2048, 256, 256]
    - [60, 41.8]
  - - [2048, 512, 1, 512, 2048, 2048, 512, 512]
    - [15, 71.0]
  - - [2048, 512, 1, 1024, 2048, 2048, 1024, 1024]
    - [15, 109.12]
  - - [2048, 512, 1, 2048, 2048, 2048, 2048, 2048]
    - [19, 146.07]
  - - [2048, 512, 1, 4096, 2048, 2048, 4096, 4096]
    - [87, 163.12]
  - - [2048, 512, 1, 8192, 2048, 2048, 8192, 8192]
    - [59, 182.23]
  - - [2048, 1024, 1, 128, 2048, 2048, 128, 128]
    - [8, 32.29]
  - - [2048, 1024, 1, 256, 2048, 2048, 256, 256]
    - [6, 58.89]
  - - [2048, 1024, 1, 512, 2048, 2048, 512, 512]
    - [7, 96.84]
  - - [2048, 1024, 1, 1024, 2048, 2048, 1024, 1024]
    - [54, 139.55]
  - - [2048, 1024, 1, 2048, 2048, 2048, 2048, 2048]
    - [54, 179.09]
  - - [2048, 1024, 1, 4096, 2048, 2048, 4096, 4096]
    - [53, 204.56]
  - - [2048, 1024, 1, 8192, 2048, 2048, 8192, 8192]
    - [54, 230.04]
  - - [2048, 2048, 1, 128, 2048, 2048, 128, 128]
    - [3, 37.3]
  - - [2048, 2048, 1, 256, 2048, 2048, 256, 256]
    - [3, 67.2]
  - - [2048, 2048, 1, 512, 2048, 2048, 512, 512]
    - [38, 105.12]
  - - [2048, 2048, 1, 1024, 2048, 2048, 1024, 1024]
    - [38, 157.56]
  - - [2048, 2048, 1, 2048, 2048, 2048, 2048, 2048]
    - [38, 204.65]
  - - [2048, 2048, 1, 4096, 2048, 2048, 4096, 4096]
    - [30, 238.76]
  - - [2048, 2048, 1, 8192, 2048, 2048, 8192, 8192]
    - [37, 242.9]
  - - [2048, 4096, 1, 128, 2048, 2048, 128, 128]
    - [7, 41.16]
  - - [2048, 4096, 1, 256, 2048, 2048, 256, 256]
    - [2, 73.19]
  - - [2048, 4096, 1, 512, 2048, 2048, 512, 512]
    - [49, 114.18]
  - - [2048, 4096, 1, 1024, 2048, 2048, 1024, 1024]
    - [49, 166.89]
  - - [2048, 4096, 1, 2048, 2048, 2048, 2048, 2048]
    - [0, 211.05]
  - - [2048, 4096, 1, 4096, 2048, 2048, 4096, 4096]
    - [35, 253.12]
  - - [2048, 4096, 1, 8192, 2048, 2048, 8192, 8192]
    - [34, 303.1]
  - - [2048, 8192, 1, 128, 2048, 2048, 128, 128]
    - [32, 47.81]
  - - [2048, 8192, 1, 256, 2048, 2048, 256, 256]
    - [33, 87.19]
  - - [2048, 8192, 1, 512, 2048, 2048, 512, 512]
    - [33, 144.63]
  - - [2048, 8192, 1, 1024, 2048, 2048, 1024, 1024]
    - [33, 213.69]
  - - [2048, 8192, 1, 2048, 2048, 2048, 2048, 2048]
    - [34, 269.71]
  - - [2048, 8192, 1, 4096, 2048, 2048, 4096, 4096]
    - [32, 294.06]
  - - [2048, 8192, 1, 8192, 2048, 2048, 8192, 8192]
    - [35, 339.77]
  - - [4096, 128, 1, 128, 4096, 4096, 128, 128]
    - [22, 14.97]
  - - [4096, 128, 1, 256, 4096, 4096, 256, 256]
    - [22, 27.32]
  - - [4096, 128, 1, 512, 4096, 4096, 512, 512]
    - [22, 45.99]
  - - [4096, 128, 1, 1024, 4096, 4096, 1024, 1024]
    - [62, 71.23]
  - - [4096, 128, 1, 2048, 4096, 4096, 2048, 2048]
    - [63, 101.65]
  - - [4096, 128, 1, 4096, 4096, 4096, 4096, 4096]
    - [64, 123.32]
  - - [4096, 128, 1, 8192, 4096, 4096, 8192, 8192]
    - [90, 137.82]
  - - [4096, 256, 1, 128, 4096, 4096, 128, 128]
    - [16, 23.39]
  - - [4096, 256, 1, 256, 4096, 4096, 256, 256]
    - [15, 42.82]
  - - [4096, 256, 1, 512, 4096, 4096, 512, 512]
    - [19, 71.9]
  - - [4096, 256, 1, 1024, 4096, 4096, 1024, 1024]
    - [19, 110.21]
  - - [4096, 256, 1, 2048, 4096, 4096, 2048, 2048]
    - [17, 148.98]
  - - [4096, 256, 1, 4096, 4096, 4096, 4096, 4096]
    - [86, 159.84]
  - - [4096, 256, 1, 8192, 4096, 4096, 8192, 8192]
    - [86, 181.29]
  - - [4096, 512, 1, 128, 4096, 4096, 128, 128]
    - [8, 30.71]
  - - [4096, 512, 1, 256, 4096, 4096, 256, 256]
    - [8, 55.73]
  - - [4096, 512, 1, 512, 4096, 4096, 512, 512]
    - [7, 88.37]
  - - [4096, 512, 1, 1024, 4096, 4096, 1024, 1024]
    - [54, 140.09]
  - - [4096, 512, 1, 2048, 4096, 4096, 2048, 2048]
    - [54, 188.58]
  - - [4096, 512, 1, 4096, 4096, 4096, 4096, 4096]
    - [54, 208.47]
  - - [4096, 512, 1, 8192, 4096, 4096, 8192, 8192]
    - [55, 231.89]
  - - [4096, 1024, 1, 128, 4096, 4096, 128, 128]
    - [36, 35.92]
  - - [4096, 1024, 1, 256, 4096, 4096, 256, 256]
    - [36, 63.28]
  - - [4096, 1024, 1, 512, 4096, 4096, 512, 512]
    - [35, 103.5]
  - - [4096, 1024, 1, 1024, 4096, 4096, 1024, 1024]
    - [30, 156.98]
  - - [4096, 1024, 1, 2048, 4096, 4096, 2048, 2048]
    - [40, 205.52]
  - - [4096, 1024, 1, 4096, 4096, 4096, 4096, 4096]
    - [30, 234.77]
  - - [4096, 1024, 1, 8192, 4096, 4096, 8192, 8192]
    - [50, 256.95]
  - - [4096, 2048, 1, 128, 4096, 4096, 128, 128]
    - [9, 38.3]
  - - [4096, 2048, 1, 256, 4096, 4096, 256, 256]
    - [5, 68.54]
  - - [4096, 2048, 1, 512, 4096, 4096, 512, 512]
    - [31, 110.96]
  - - [4096, 2048, 1, 1024, 4096, 4096, 1024, 1024]
    - [31, 163.46]
  - - [4096, 2048, 1, 2048, 4096, 4096, 2048, 2048]
    - [51, 215.13]
  - - [4096, 2048, 1, 4096, 4096, 4096, 4096, 4096]
    - [40, 259.16]
  - - [4096, 2048, 1, 8192, 4096, 4096, 8192, 8192]
    - [38, 315.83]
  - - [4096, 4096, 1, 128, 4096, 4096, 128, 128]
    - [9, 42.52]
  - - [4096, 4096, 1, 256, 4096, 4096, 256, 256]
    - [16, 76.7]
  - - [4096, 4096, 1, 512, 4096, 4096, 512, 512]
    - [61, 116.75]
  - - [4096, 4096, 1, 1024, 4096, 4096, 1024, 1024]
    - [56, 178.66]
  - - [4096, 4096, 1, 2048, 4096, 4096, 2048, 2048]
    - [38, 232.12]
  - - [4096, 4096, 1, 4096, 4096, 4096, 4096, 4096]
    - [42, 284.37]
  - - [4096, 4096, 1, 8192, 4096, 4096, 8192, 8192]
    - [29, 318.01]
  - - [4096, 8192, 1, 128, 4096, 4096, 128, 128]
    - [34, 49.32]
  - - [4096, 8192, 1, 256, 4096, 4096, 256, 256]
    - [34, 83.51]
  - - [4096, 8192, 1, 512, 4096, 4096, 512, 512]
    - [32, 137.35]
  - - [4096, 8192, 1, 1024, 4096, 4096, 1024, 1024]
    - [32, 193.77]
  - - [4096, 8192, 1, 2048, 4096, 4096, 2048, 2048]
    - [35, 243.69]
  - - [4096, 8192, 1, 4096, 4096, 4096, 4096, 4096]
    - [34, 292.37]
  - - [4096, 8192, 1, 8192, 4096, 4096, 8192, 8192]
    - [35, 351.33]
  - - [8192, 128, 1, 128, 8192, 8192, 128, 128]
    - [15, 22.57]
  - - [8192, 128, 1, 256, 8192, 8192, 256, 256]
    - [15, 41.83]
  - - [8192, 128, 1, 512, 8192, 8192, 512, 512]
    - [17, 71.12]
  - - [8192, 128, 1, 1024, 8192, 8192, 1024, 1024]
    - [17, 109.32]
  - - [8192, 128, 1, 2048, 8192, 8192, 2048, 2048]
    - [57, 142.25]
  - - [8192, 128, 1, 4096, 8192, 8192, 4096, 4096]
    - [86, 158.88]
  - - [8192, 128, 1, 8192, 8192, 8192, 8192, 8192]
    - [86, 174.26]
  - - [8192, 256, 1, 128, 8192, 8192, 128, 128]
    - [47, 33.59]
  - - [8192, 256, 1, 256, 8192, 8192, 256, 256]
    - [48, 61.16]
  - - [8192, 256, 1, 512, 8192, 8192, 512, 512]
    - [47, 101.41]
  - - [8192, 256, 1, 1024, 8192, 8192, 1024, 1024]
    - [47, 145.15]
  - - [8192, 256, 1, 2048, 8192, 8192, 2048, 2048]
    - [54, 176.77]
  - - [8192, 256, 1, 4096, 8192, 8192, 4096, 4096]
    - [56, 205.03]
  - - [8192, 256, 1, 8192, 8192, 8192, 8192, 8192]
    - [54, 233.98]
  - - [8192, 512, 1, 128, 8192, 8192, 128, 128]
    - [49, 42.27]
  - - [8192, 512, 1, 256, 8192, 8192, 256, 256]
    - [51, 74.25]
  - - [8192, 512, 1, 512, 8192, 8192, 512, 512]
    - [50, 124.16]
  - - [8192, 512, 1, 1024, 8192, 8192, 1024, 1024]
    - [50, 159.27]
  - - [8192, 512, 1, 2048, 8192, 8192, 2048, 2048]
    - [51, 214.42]
  - - [8192, 512, 1, 4096, 8192, 8192, 4096, 4096]
    - [50, 266.11]
  - - [8192, 512, 1, 8192, 8192, 8192, 8192, 8192]
    - [50, 301.59]
  - - [8192, 1024, 1, 128, 8192, 8192, 128, 128]
    - [38, 42.68]
  - - [8192, 1024, 1, 256, 8192, 8192, 256, 256]
    - [42, 77.65]
  - - [8192, 1024, 1, 512, 8192, 8192, 512, 512]
    - [40, 129.17]
  - - [8192, 1024, 1, 1024, 8192, 8192, 1024, 1024]
    - [41, 182.55]
  - - [8192, 1024, 1, 2048, 8192, 8192, 2048, 2048]
    - [39, 260.78]
  - - [8192, 1024, 1, 4096, 8192, 8192, 4096, 4096]
    - [40, 316.97]
  - - [8192, 1024, 1, 8192, 8192, 8192, 8192, 8192]
    - [40, 355.28]
  - - [8192, 2048, 1, 128, 8192, 8192, 128, 128]
    - [42, 47.66]
  - - [8192, 2048, 1, 256, 8192, 8192, 256, 256]
    - [40, 84.0]
  - - [8192, 2048, 1, 512, 8192, 8192, 512, 512]
    - [42, 139.11]
  - - [8192, 2048, 1, 1024, 8192, 8192, 1024, 1024]
    - [42, 211.52]
  - - [8192, 2048, 1, 2048, 8192, 8192, 2048, 2048]
    - [42, 277.85]
  - - [8192, 2048, 1, 4096, 8192, 8192, 4096, 4096]
    - [42, 306.6]
  - - [8192, 2048, 1, 8192, 8192, 8192, 8192, 8192]
    - [40, 372.78]
  - - [8192, 4096, 1, 128, 8192, 8192, 128, 128]
    - [18, 47.23]
  - - [8192, 4096, 1, 256, 8192, 8192, 256, 256]
    - [39, 80.55]
  - - [8192, 4096, 1, 512, 8192, 8192, 512, 512]
    - [38, 132.47]
  - - [8192, 4096, 1, 1024, 8192, 8192, 1024, 1024]
    - [41, 190.65]
  - - [8192, 4096, 1, 2048, 8192, 8192, 2048, 2048]
    - [38, 255.16]
  - - [8192, 4096, 1, 4096, 8192, 8192, 4096, 4096]
    - [40, 307.74]
  - - [8192, 4096, 1, 8192, 8192, 8192, 8192, 8192]
    - [40, 384.58]
  - - [8192, 8192, 1, 128, 8192, 8192, 128, 128]
    - [32, 43.33]
  - - [8192, 8192, 1, 256, 8192, 8192, 256, 256]
    - [1, 74.13]
  - - [8192, 8192, 1, 512, 8192, 8192, 512, 512]
    - [33, 121.82]
  - - [8192, 8192, 1, 1024, 8192, 8192, 1024, 1024]
    - [33, 182.82]
  - - [8192, 8192, 1, 2048, 8192, 8192, 2048, 2048]
    - [32, 247.83]
  - - [8192, 8192, 1, 4096, 8192, 8192, 4096, 4096]
    - [32, 300.08]
  - - [8192, 8192, 1, 8192, 8192, 8192, 8192, 8192]
    - [40, 366.77]
  - - [1, 1, 1, 32, 1, 1, 32, 32]
    - [94, 0.0]
- null
- null
- ExperimentalStreamK
- GridBased
