projects/hipblaslt/library/src/amd_detail/rocblaslt/src/Tensile/Logic/asm_full/aquavanjaram/gfx942_228cu/StreamK/aquavanjaram942_Cijk_Ailk_Bljk_B8NSS_BH_Bias_HAS_SAV_UserArgs.yaml
- {MinimumRequiredVersion: 4.33.0}
- aquavanjaram942
- {Architecture: gfx942, CUCount: 228}
- [Device 0049, Device 0050]
    SolutionIndex: 0
    SolutionNameMin: Cijk_Ailk_Bljk_B8NSS_BH_Bias_HAS_SAV_UserArgs_MT256x256x64_MI16x16x1_SN_LDSB1_CLR1_GRVWA16_GRVWB8_GSU0_GSUC0_GSUWGMRR0_K1_LBSPPA2048_LBSPPB512_LPA0_LPB8_LRVW8_MIWT8_8_PLR1_SU0_SUM0_SUS64_VWA8_VWB8_WGM1_WGMXCC1_WGMXCCGn1
    SolutionIndex: 1
    SolutionNameMin: Cijk_Ailk_Bljk_B8NSS_BH_Bias_HAS_SAV_UserArgs_MT256x256x64_MI16x16x1_SN_LDSB1_CLR1_GRVWA16_GRVWB16_GSU0_GSUC0_GSUWGMRR0_K1_LBSPPA2048_LBSPPB512_LPA0_LPB16_LRVW8_MIWT8_8_PLR1_SU0_SUM0_SUS64_VWA8_VWB8_WGM1_WGMXCC1_WGMXCCGn1
    SolutionIndex: 2
    SolutionNameMin: Cijk_Ailk_Bljk_B8NSS_BH_Bias_HAS_SAV_UserArgs_MT256x256x64_MI16x16x1_SN_LDSB1_CLR1_GRVWA16_GRVWB16_GSU0_GSUC0_GSUWGMRR0_K1_LBSPPA2048_LBSPPB512_LPA0_LPB16_LRVW8_MIWT8_8_PLR1_SU0_SUM0_SUS64_VWA8_VWB8_WGM4_WGMXCC1_WGMXCCGn1
    SolutionIndex: 3
    SolutionNameMin: Cijk_Ailk_Bljk_B8NSS_BH_Bias_HAS_SAV_UserArgs_MT256x256x64_MI16x16x1_SN_LDSB1_CLR1_GRVWA8_GRVWB8_GSU0_GSUC0_GSUWGMRR0_K1_LBSPPA2048_LBSPPB512_LPA0_LPB8_LRVW8_MIWT8_8_PLR1_SU0_SUM0_SUS64_VWA8_VWB8_WGM8_WGMXCC1_WGMXCCGn1
    SolutionIndex: 4
    SolutionNameMin: Cijk_Ailk_Bljk_B8NSS_BH_Bias_HAS_SAV_UserArgs_MT256x256x64_MI16x16x1_SN_LDSB1_CLR1_GRVWA16_GRVWB16_GSU0_GSUC0_GSUWGMRR0_K1_LBSPPA2048_LBSPPB512_LPA0_LPB16_LRVW8_MIWT8_8_PLR1_SU0_SUM0_SUS64_VWA8_VWB8_WGM8_WGMXCC1_WGMXCCGn1
    SolutionIndex: 5
    SolutionNameMin: Cijk_Ailk_Bljk_B8NSS_BH_Bias_HAS_SAV_UserArgs_MT128x256x64_MI16x16x1_SN_LDSB1_CLR1_GRVWA8_GRVWB16_GSU0_GSUC0_GSUWGMRR0_K1_LBSPPA1024_LBSPPB512_LPA64_LPB16_LRVW8_MIWT4_8_PLR1_SU0_SUM0_SUS64_VWA4_VWB8_WGM1_WGMXCC1_WGMXCCGn1
    SolutionIndex: 6
    SolutionNameMin: Cijk_Ailk_Bljk_B8NSS_BH_Bias_HAS_SAV_UserArgs_MT128x256x64_MI16x16x1_SN_LDSB1_CLR1_GRVWA16_GRVWB16_GSU0_GSUC0_GSUWGMRR0_K1_LBSPPA1024_LBSPPB512_LPA64_LPB16_LRVW8_MIWT4_8_PLR1_SU0_SUM0_SUS64_VWA4_VWB8_WGM1_WGMXCC1_WGMXCCGn1
    SolutionIndex: 7
    SolutionNameMin: Cijk_Ailk_Bljk_B8NSS_BH_Bias_HAS_SAV_UserArgs_MT128x256x64_MI16x16x1_SN_LDSB1_CLR1_GRVWA8_GRVWB16_GSU0_GSUC0_GSUWGMRR0_K1_LBSPPA1024_LBSPPB512_LPA64_LPB16_LRVW8_MIWT4_8_PLR1_SU0_SUM0_SUS64_VWA4_VWB8_WGM4_WGMXCC1_WGMXCCGn1
    SolutionIndex: 8
    SolutionNameMin: Cijk_Ailk_Bljk_B8NSS_BH_Bias_HAS_SAV_UserArgs_MT128x256x64_MI16x16x1_SN_LDSB1_CLR1_GRVWA16_GRVWB16_GSU0_GSUC0_GSUWGMRR0_K1_LBSPPA1024_LBSPPB512_LPA64_LPB16_LRVW8_MIWT4_8_PLR1_SU0_SUM0_SUS64_VWA4_VWB8_WGM4_WGMXCC1_WGMXCCGn1
    SolutionIndex: 9
    SolutionNameMin: Cijk_Ailk_Bljk_B8NSS_BH_Bias_HAS_SAV_UserArgs_MT128x256x64_MI16x16x1_SN_LDSB1_CLR1_GRVWA8_GRVWB16_GSU0_GSUC0_GSUWGMRR0_K1_LBSPPA1024_LBSPPB512_LPA64_LPB16_LRVW8_MIWT4_8_PLR1_SU0_SUM0_SUS64_VWA4_VWB8_WGM6_WGMXCC1_WGMXCCGn1
    SolutionIndex: 10
    SolutionNameMin: Cijk_Ailk_Bljk_B8NSS_BH_Bias_HAS_SAV_UserArgs_MT128x256x64_MI16x16x1_SN_LDSB1_CLR1_GRVWA16_GRVWB8_GSU0_GSUC0_GSUWGMRR0_K1_LBSPPA1024_LBSPPB512_LPA64_LPB8_LRVW8_MIWT4_8_PLR1_SU0_SUM0_SUS64_VWA4_VWB8_WGM8_WGMXCC1_WGMXCCGn1
    SolutionIndex: 11
    SolutionNameMin: Cijk_Ailk_Bljk_B8NSS_BH_Bias_HAS_SAV_UserArgs_MT128x256x64_MI16x16x1_SN_LDSB1_CLR1_GRVWA8_GRVWB16_GSU0_GSUC0_GSUWGMRR0_K1_LBSPPA1024_LBSPPB512_LPA64_LPB16_LRVW8_MIWT4_8_PLR1_SU0_SUM0_SUS64_VWA4_VWB8_WGM8_WGMXCC1_WGMXCCGn1
    SolutionIndex: 12
    SolutionNameMin: Cijk_Ailk_Bljk_B8NSS_BH_Bias_HAS_SAV_UserArgs_MT256x128x64_MI16x16x1_SN_LDSB1_CLR1_GRVWA16_GRVWB8_GSU0_GSUC0_GSUWGMRR0_K1_LBSPPA2048_LBSPPB256_LPA0_LPB8_LRVW8_MIWT8_4_PLR1_SU0_SUM0_SUS64_VWA8_VWB4_WGM1_WGMXCC1_WGMXCCGn1
    SolutionIndex: 13
    SolutionNameMin: Cijk_Ailk_Bljk_B8NSS_BH_Bias_HAS_SAV_UserArgs_MT128x128x64_MI16x16x1_SN_LDSB1_CLR1_GRVWA8_GRVWB16_GSU0_GSUC0_GSUWGMRR0_K1_LBSPPA1024_LBSPPB256_LPA64_LPB16_LRVW8_MIWT4_4_PLR1_SU0_SUM0_SUS64_VWA4_VWB4_WGM1_WGMXCC1_WGMXCCGn1
    SolutionIndex: 14
    SolutionNameMin: Cijk_Ailk_Bljk_B8NSS_BH_Bias_HAS_SAV_UserArgs_MT128x128x64_MI16x16x1_SN_LDSB1_CLR1_GRVWA16_GRVWB16_GSU0_GSUC0_GSUWGMRR0_K1_LBSPPA1024_LBSPPB256_LPA64_LPB16_LRVW8_MIWT4_4_PLR1_SU0_SUM0_SUS64_VWA4_VWB4_WGM1_WGMXCC1_WGMXCCGn1
    SolutionIndex: 15
    SolutionNameMin: Cijk_Ailk_Bljk_B8NSS_BH_Bias_HAS_SAV_UserArgs_MT128x128x64_MI16x16x1_SN_LDSB1_CLR1_GRVWA16_GRVWB16_GSU0_GSUC0_GSUWGMRR0_K1_LBSPPA1024_LBSPPB256_LPA64_LPB16_LRVW8_MIWT4_4_PLR1_SU0_SUM0_SUS64_VWA4_VWB4_WGM8_WGMXCC1_WGMXCCGn1
    SolutionIndex: 16
    SolutionNameMin: Cijk_Ailk_Bljk_B8NSS_BH_Bias_HAS_SAV_UserArgs_MT64x128x64_MI16x16x1_SN_LDSB0_CLR1_GRVWA16_GRVWB8_GSU0_GSUC0_GSUWGMRR0_K1_LBSPPA512_LBSPPB256_LPA32_LPB8_LRVW8_MIWT2_4_PLR1_SU0_SUM0_SUS64_VWA2_VWB4_WGM1_WGMXCC1_WGMXCCGn1
    SolutionIndex: 17
    SolutionNameMin: Cijk_Ailk_Bljk_B8NSS_BH_Bias_HAS_SAV_UserArgs_MT64x128x64_MI16x16x1_SN_LDSB0_CLR1_GRVWA8_GRVWB16_GSU0_GSUC0_GSUWGMRR0_K1_LBSPPA512_LBSPPB256_LPA32_LPB16_LRVW8_MIWT2_4_PLR1_SU0_SUM0_SUS64_VWA2_VWB4_WGM1_WGMXCC1_WGMXCCGn1
    SolutionIndex: 18
    SolutionNameMin: Cijk_Ailk_Bljk_B8NSS_BH_Bias_HAS_SAV_UserArgs_MT64x128x64_MI16x16x1_SN_LDSB0_CLR1_GRVWA8_GRVWB16_GSU0_GSUC0_GSUWGMRR0_K1_LBSPPA512_LBSPPB256_LPA32_LPB16_LRVW8_MIWT2_4_PLR1_SU0_SUM0_SUS64_VWA2_VWB4_WGM4_WGMXCC1_WGMXCCGn1
    SolutionIndex: 19
    SolutionNameMin: Cijk_Ailk_Bljk_B8NSS_BH_Bias_HAS_SAV_UserArgs_MT128x64x64_MI16x16x1_SN_LDSB0_CLR1_GRVWA8_GRVWB16_GSU0_GSUC0_GSUWGMRR0_K1_LBSPPA1024_LBSPPB128_LPA64_LPB16_LRVW8_MIWT4_2_PLR1_SU0_SUM0_SUS64_VWA4_VWB2_WGM1_WGMXCC1_WGMXCCGn1
    SolutionIndex: 20
    SolutionNameMin: Cijk_Ailk_Bljk_B8NSS_BH_Bias_HAS_SAV_UserArgs_MT128x64x64_MI16x16x1_SN_LDSB0_CLR1_GRVWA16_GRVWB16_GSU0_GSUC0_GSUWGMRR0_K1_LBSPPA1024_LBSPPB128_LPA64_LPB16_LRVW8_MIWT4_2_PLR1_SU0_SUM0_SUS64_VWA4_VWB2_WGM1_WGMXCC1_WGMXCCGn1
    SolutionIndex: 21
    SolutionNameMin: Cijk_Ailk_Bljk_B8NSS_BH_Bias_HAS_SAV_UserArgs_MT128x64x64_MI16x16x1_SN_LDSB0_CLR1_GRVWA8_GRVWB16_GSU0_GSUC0_GSUWGMRR0_K1_LBSPPA1024_LBSPPB128_LPA64_LPB16_LRVW8_MIWT4_2_PLR1_SU0_SUM0_SUS64_VWA4_VWB2_WGM4_WGMXCC1_WGMXCCGn1
    SolutionIndex: 22
    SolutionNameMin: Cijk_Ailk_Bljk_B8NSS_BH_Bias_HAS_SAV_UserArgs_MT128x64x64_MI16x16x1_SN_LDSB0_CLR1_GRVWA16_GRVWB16_GSU0_GSUC0_GSUWGMRR0_K1_LBSPPA1024_LBSPPB128_LPA64_LPB16_LRVW8_MIWT4_2_PLR1_SU0_SUM0_SUS64_VWA4_VWB2_WGM4_WGMXCC1_WGMXCCGn1
    SolutionIndex: 23
    SolutionNameMin: Cijk_Ailk_Bljk_B8NSS_BH_Bias_HAS_SAV_UserArgs_MT128x32x64_MI16x16x1_SN_LDSB0_CLR1_GRVWA8_GRVWB8_GSU0_GSUC0_GSUWGMRR0_K1_LBSPPA1024_LBSPPB128_LPA64_LPB8_LRVW8_MIWT4_1_PLR1_SU0_SUM0_SUS64_VWA4_VWB1_WGM1_WGMXCC1_WGMXCCGn1
    SolutionIndex: 24
    SolutionNameMin: Cijk_Ailk_Bljk_B8NSS_BH_Bias_HAS_SAV_UserArgs_MT128x32x64_MI16x16x1_SN_LDSB0_CLR1_GRVWA16_GRVWB8_GSU0_GSUC0_GSUWGMRR0_K1_LBSPPA1024_LBSPPB128_LPA64_LPB8_LRVW8_MIWT4_1_PLR1_SU0_SUM0_SUS64_VWA4_VWB1_WGM1_WGMXCC1_WGMXCCGn1
    SolutionIndex: 25
    SolutionNameMin: Cijk_Ailk_Bljk_B8NSS_BH_Bias_HAS_SAV_UserArgs_MT64x64x64_MI16x16x1_SN_LDSB0_CLR1_GRVWA8_GRVWB8_GSU0_GSUC0_GSUWGMRR0_K1_LBSPPA512_LBSPPB128_LPA32_LPB8_LRVW8_MIWT2_2_PLR1_SU0_SUM0_SUS64_VWA2_VWB2_WGM1_WGMXCC1_WGMXCCGn1
    SolutionIndex: 26
    SolutionNameMin: Cijk_Ailk_Bljk_B8NSS_BH_Bias_HAS_SAV_UserArgs_MT64x64x64_MI16x16x1_SN_LDSB0_CLR1_GRVWA8_GRVWB16_GSU0_GSUC0_GSUWGMRR0_K1_LBSPPA512_LBSPPB128_LPA32_LPB16_LRVW8_MIWT2_2_PLR1_SU0_SUM0_SUS64_VWA2_VWB2_WGM1_WGMXCC1_WGMXCCGn1
    SolutionIndex: 27
    SolutionNameMin: Cijk_Ailk_Bljk_B8NSS_BH_Bias_HAS_SAV_UserArgs_MT64x64x64_MI16x16x1_SN_LDSB0_CLR1_GRVWA8_GRVWB16_GSU0_GSUC0_GSUWGMRR0_K1_LBSPPA512_LBSPPB128_LPA32_LPB16_LRVW8_MIWT2_2_PLR1_SU0_SUM0_SUS64_VWA2_VWB2_WGM6_WGMXCC1_WGMXCCGn1
    SolutionIndex: 28
    SolutionNameMin: Cijk_Ailk_Bljk_B8NSS_BH_Bias_HAS_SAV_UserArgs_MT64x64x64_MI16x16x1_SN_LDSB0_CLR1_GRVWA8_GRVWB8_GSU0_GSUC0_GSUWGMRR0_K1_LBSPPA512_LBSPPB128_LPA32_LPB8_LRVW8_MIWT2_2_PLR1_SU0_SUM0_SUS64_VWA2_VWB2_WGM8_WGMXCC1_WGMXCCGn1
    SolutionIndex: 29
    SolutionNameMin: Cijk_Ailk_Bljk_B8NSS_BH_Bias_HAS_SAV_UserArgs_MT32x64x64_MI16x16x1_SN_LDSB0_CLR1_GRVWA8_GRVWB8_GSU0_GSUC0_GSUWGMRR0_K1_LBSPPA256_LBSPPB128_LPA16_LPB8_LRVW8_MIWT1_2_PLR1_SU0_SUM0_SUS64_VWA1_VWB2_WGM1_WGMXCC1_WGMXCCGn1
    SolutionIndex: 30
    SolutionNameMin: Cijk_Ailk_Bljk_B8NSS_BH_Bias_HAS_SAV_UserArgs_MT32x64x64_MI16x16x1_SN_LDSB0_CLR1_GRVWA8_GRVWB16_GSU0_GSUC0_GSUWGMRR0_K1_LBSPPA256_LBSPPB128_LPA16_LPB16_LRVW8_MIWT1_2_PLR1_SU0_SUM0_SUS64_VWA1_VWB2_WGM1_WGMXCC1_WGMXCCGn1
    SolutionIndex: 31
    SolutionNameMin: Cijk_Ailk_Bljk_B8NSS_BH_Bias_HAS_SAV_UserArgs_MT64x32x64_MI16x16x1_SN_LDSB0_CLR1_GRVWA8_GRVWB8_GSU0_GSUC0_GSUWGMRR0_K1_LBSPPA512_LBSPPB128_LPA32_LPB8_LRVW8_MIWT2_1_PLR1_SU0_SUM0_SUS64_VWA2_VWB1_WGM1_WGMXCC1_WGMXCCGn1
    SolutionIndex: 32
    SolutionNameMin: Cijk_Ailk_Bljk_B8NSS_BH_Bias_HAS_SAV_UserArgs_MT32x32x64_MI16x16x1_SN_LDSB0_CLR1_GRVWA8_GRVWB8_GSU0_GSUC0_GSUWGMRR0_K1_LBSPPA256_LBSPPB128_LPA16_LPB8_LRVW8_MIWT1_1_PLR1_SU0_SUM0_SUS64_VWA1_VWB1_WGM1_WGMXCC1_WGMXCCGn1
    SolutionIndex: 33
    SolutionNameMin: Cijk_Ailk_Bljk_B8NSS_BH_Bias_HAS_SAV_UserArgs_MT128x256x128_MI16x16x1_SN_LDSB1_CLR1_GRVWA8_GRVWB16_GSU0_GSUC0_GSUWGMRR0_K1_LBSPPA1024_LBSPPB1024_LPA64_LPB16_LRVW8_MIWT4_8_PLR1_SU0_SUM0_SUS128_VWA4_VWB8_WGM1_WGMXCC1_WGMXCCGn1
    SolutionIndex: 34
    SolutionNameMin: Cijk_Ailk_Bljk_B8NSS_BH_Bias_HAS_SAV_UserArgs_MT128x256x128_MI16x16x1_SN_LDSB1_CLR1_GRVWA16_GRVWB16_GSU0_GSUC0_GSUWGMRR0_K1_LBSPPA1024_LBSPPB1024_LPA64_LPB16_LRVW8_MIWT4_8_PLR1_SU0_SUM0_SUS128_VWA4_VWB8_WGM1_WGMXCC1_WGMXCCGn1
    SolutionIndex: 35
    SolutionNameMin: Cijk_Ailk_Bljk_B8NSS_BH_Bias_HAS_SAV_UserArgs_MT128x256x128_MI16x16x1_SN_LDSB1_CLR1_GRVWA16_GRVWB16_GSU0_GSUC0_GSUWGMRR0_K1_LBSPPA1024_LBSPPB1024_LPA64_LPB16_LRVW8_MIWT4_8_PLR1_SU0_SUM0_SUS128_VWA4_VWB8_WGM4_WGMXCC1_WGMXCCGn1
    SolutionIndex: 36
    SolutionNameMin: Cijk_Ailk_Bljk_B8NSS_BH_Bias_HAS_SAV_UserArgs_MT128x256x128_MI16x16x1_SN_LDSB1_CLR1_GRVWA16_GRVWB16_GSU0_GSUC0_GSUWGMRR0_K1_LBSPPA1024_LBSPPB1024_LPA64_LPB16_LRVW8_MIWT4_8_PLR1_SU0_SUM0_SUS128_VWA4_VWB8_WGM6_WGMXCC1_WGMXCCGn1
    SolutionIndex: 37
    SolutionNameMin: Cijk_Ailk_Bljk_B8NSS_BH_Bias_HAS_SAV_UserArgs_MT128x256x128_MI16x16x1_SN_LDSB1_CLR1_GRVWA16_GRVWB8_GSU0_GSUC0_GSUWGMRR0_K1_LBSPPA1024_LBSPPB1024_LPA64_LPB8_LRVW8_MIWT4_8_PLR1_SU0_SUM0_SUS128_VWA4_VWB8_WGM8_WGMXCC1_WGMXCCGn1
    SolutionIndex: 38
    SolutionNameMin: Cijk_Ailk_Bljk_B8NSS_BH_Bias_HAS_SAV_UserArgs_MT128x256x128_MI16x16x1_SN_LDSB1_CLR1_GRVWA16_GRVWB16_GSU0_GSUC0_GSUWGMRR0_K1_LBSPPA1024_LBSPPB1024_LPA64_LPB16_LRVW8_MIWT4_8_PLR1_SU0_SUM0_SUS128_VWA4_VWB8_WGM8_WGMXCC1_WGMXCCGn1
    SolutionIndex: 39
    SolutionNameMin: Cijk_Ailk_Bljk_B8NSS_BH_Bias_HAS_SAV_UserArgs_MT256x144x128_MI16x16x1_SN_LDSB1_CLR1_GRVWA8_GRVWB8_GSU0_GSUC0_GSUWGMRR0_K1_LBSPPA2048_LBSPPB128_LPA64_LPB8_LRVW8_MIWT4_9_PLR1_SU0_SUM0_SUS128_VWA4_VWB1_WGM1_WGMXCC1_WGMXCCGn1
    SolutionIndex: 40
    SolutionNameMin: Cijk_Ailk_Bljk_B8NSS_BH_Bias_HAS_SAV_UserArgs_MT256x144x128_MI16x16x1_SN_LDSB1_CLR1_GRVWA16_GRVWB8_GSU0_GSUC0_GSUWGMRR0_K1_LBSPPA2048_LBSPPB128_LPA64_LPB8_LRVW8_MIWT4_9_PLR1_SU0_SUM0_SUS128_VWA4_VWB1_WGM1_WGMXCC1_WGMXCCGn1
    SolutionIndex: 41
    SolutionNameMin: Cijk_Ailk_Bljk_B8NSS_BH_Bias_HAS_SAV_UserArgs_MT256x144x128_MI16x16x1_SN_LDSB1_CLR1_GRVWA8_GRVWB8_GSU0_GSUC0_GSUWGMRR0_K1_LBSPPA2048_LBSPPB128_LPA64_LPB8_LRVW8_MIWT4_9_PLR1_SU0_SUM0_SUS128_VWA4_VWB1_WGM4_WGMXCC1_WGMXCCGn1
    SolutionIndex: 42
    SolutionNameMin: Cijk_Ailk_Bljk_B8NSS_BH_Bias_HAS_SAV_UserArgs_MT256x144x128_MI16x16x1_SN_LDSB1_CLR1_GRVWA16_GRVWB8_GSU0_GSUC0_GSUWGMRR0_K1_LBSPPA2048_LBSPPB128_LPA64_LPB8_LRVW8_MIWT4_9_PLR1_SU0_SUM0_SUS128_VWA4_VWB1_WGM4_WGMXCC1_WGMXCCGn1
    SolutionIndex: 43
    SolutionNameMin: Cijk_Ailk_Bljk_B8NSS_BH_Bias_HAS_SAV_UserArgs_MT256x144x128_MI16x16x1_SN_LDSB1_CLR1_GRVWA8_GRVWB8_GSU0_GSUC0_GSUWGMRR0_K1_LBSPPA2048_LBSPPB128_LPA64_LPB8_LRVW8_MIWT4_9_PLR1_SU0_SUM0_SUS128_VWA4_VWB1_WGM6_WGMXCC1_WGMXCCGn1
    SolutionIndex: 44
    SolutionNameMin: Cijk_Ailk_Bljk_B8NSS_BH_Bias_HAS_SAV_UserArgs_MT256x144x128_MI16x16x1_SN_LDSB1_CLR1_GRVWA16_GRVWB8_GSU0_GSUC0_GSUWGMRR0_K1_LBSPPA2048_LBSPPB128_LPA64_LPB8_LRVW8_MIWT4_9_PLR1_SU0_SUM0_SUS128_VWA4_VWB1_WGM6_WGMXCC1_WGMXCCGn1
    SolutionIndex: 45
    SolutionNameMin: Cijk_Ailk_Bljk_B8NSS_BH_Bias_HAS_SAV_UserArgs_MT256x144x128_MI16x16x1_SN_LDSB1_CLR1_GRVWA8_GRVWB8_GSU0_GSUC0_GSUWGMRR0_K1_LBSPPA2048_LBSPPB128_LPA64_LPB8_LRVW8_MIWT4_9_PLR1_SU0_SUM0_SUS128_VWA4_VWB1_WGM8_WGMXCC1_WGMXCCGn1
    SolutionIndex: 46
    SolutionNameMin: Cijk_Ailk_Bljk_B8NSS_BH_Bias_HAS_SAV_UserArgs_MT256x144x128_MI16x16x1_SN_LDSB1_CLR1_GRVWA16_GRVWB8_GSU0_GSUC0_GSUWGMRR0_K1_LBSPPA2048_LBSPPB128_LPA64_LPB8_LRVW8_MIWT4_9_PLR1_SU0_SUM0_SUS128_VWA4_VWB1_WGM8_WGMXCC1_WGMXCCGn1
    SolutionIndex: 47
    SolutionNameMin: Cijk_Ailk_Bljk_B8NSS_BH_Bias_HAS_SAV_UserArgs_MT64x144x128_MI16x16x1_SN_LDSB1_CLR1_GRVWA8_GRVWB8_GSU0_GSUC0_GSUWGMRR0_K1_LBSPPA512_LBSPPB128_LPA16_LPB8_LRVW8_MIWT1_9_PLR1_SU0_SUM0_SUS128_VWA1_VWB1_WGM1_WGMXCC1_WGMXCCGn1
    SolutionIndex: 48
    SolutionNameMin: Cijk_Ailk_Bljk_B8NSS_BH_Bias_HAS_SAV_UserArgs_MT64x144x128_MI16x16x1_SN_LDSB1_CLR1_GRVWA16_GRVWB8_GSU0_GSUC0_GSUWGMRR0_K1_LBSPPA512_LBSPPB128_LPA16_LPB8_LRVW8_MIWT1_9_PLR1_SU0_SUM0_SUS128_VWA1_VWB1_WGM1_WGMXCC1_WGMXCCGn1
    SolutionIndex: 49
    SolutionNameMin: Cijk_Ailk_Bljk_B8NSS_BH_Bias_HAS_SAV_UserArgs_MT128x144x128_MI16x16x1_SN_LDSB1_CLR1_GRVWA16_GRVWB8_GSU0_GSUC0_GSUWGMRR0_K1_LBSPPA1024_LBSPPB128_LPA32_LPB8_LRVW8_MIWT2_9_PLR1_SU0_SUM0_SUS128_VWA2_VWB1_WGM1_WGMXCC1_WGMXCCGn1
    SolutionIndex: 50
    SolutionNameMin: Cijk_Ailk_Bljk_B8NSS_BH_Bias_HAS_SAV_UserArgs_MT128x144x128_MI16x16x1_SN_LDSB1_CLR1_GRVWA8_GRVWB8_GSU0_GSUC0_GSUWGMRR0_K1_LBSPPA1024_LBSPPB128_LPA32_LPB8_LRVW8_MIWT2_9_PLR1_SU0_SUM0_SUS128_VWA2_VWB1_WGM6_WGMXCC1_WGMXCCGn1
    SolutionIndex: 51
    SolutionNameMin: Cijk_Ailk_Bljk_B8NSS_BH_Bias_HAS_SAV_UserArgs_MT128x144x128_MI16x16x1_SN_LDSB1_CLR1_GRVWA16_GRVWB8_GSU0_GSUC0_GSUWGMRR0_K1_LBSPPA1024_LBSPPB128_LPA32_LPB8_LRVW8_MIWT2_9_PLR1_SU0_SUM0_SUS128_VWA2_VWB1_WGM6_WGMXCC1_WGMXCCGn1
    SolutionIndex: 52
    SolutionNameMin: Cijk_Ailk_Bljk_B8NSS_BH_Bias_HAS_SAV_UserArgs_MT128x144x128_MI16x16x1_SN_LDSB1_CLR1_GRVWA8_GRVWB8_GSU0_GSUC0_GSUWGMRR0_K1_LBSPPA1024_LBSPPB128_LPA32_LPB8_LRVW8_MIWT2_9_PLR1_SU0_SUM0_SUS128_VWA2_VWB1_WGM8_WGMXCC1_WGMXCCGn1
    SolutionIndex: 53
    SolutionNameMin: Cijk_Ailk_Bljk_B8NSS_BH_Bias_HAS_SAV_UserArgs_MT128x144x128_MI16x16x1_SN_LDSB1_CLR1_GRVWA16_GRVWB8_GSU0_GSUC0_GSUWGMRR0_K1_LBSPPA1024_LBSPPB128_LPA32_LPB8_LRVW8_MIWT2_9_PLR1_SU0_SUM0_SUS128_VWA2_VWB1_WGM8_WGMXCC1_WGMXCCGn1
    SolutionIndex: 54
    SolutionNameMin: Cijk_Ailk_Bljk_B8NSS_BH_Bias_HAS_SAV_UserArgs_MT128x128x128_MI16x16x1_SN_LDSB1_CLR1_GRVWA16_GRVWB16_GSU0_GSUC0_GSUWGMRR0_K1_LBSPPA1024_LBSPPB512_LPA64_LPB16_LRVW8_MIWT4_4_PLR1_SU0_SUM0_SUS128_VWA4_VWB4_WGM1_WGMXCC1_WGMXCCGn1
    SolutionIndex: 55
    SolutionNameMin: Cijk_Ailk_Bljk_B8NSS_BH_Bias_HAS_SAV_UserArgs_MT128x128x128_MI16x16x1_SN_LDSB1_CLR1_GRVWA16_GRVWB16_GSU0_GSUC0_GSUWGMRR0_K1_LBSPPA1024_LBSPPB512_LPA64_LPB16_LRVW8_MIWT4_4_PLR1_SU0_SUM0_SUS128_VWA4_VWB4_WGM4_WGMXCC1_WGMXCCGn1
    SolutionIndex: 56
    SolutionNameMin: Cijk_Ailk_Bljk_B8NSS_BH_Bias_HAS_SAV_UserArgs_MT128x128x128_MI16x16x1_SN_LDSB1_CLR1_GRVWA16_GRVWB16_GSU0_GSUC0_GSUWGMRR0_K1_LBSPPA1024_LBSPPB512_LPA64_LPB16_LRVW8_MIWT4_4_PLR1_SU0_SUM0_SUS128_VWA4_VWB4_WGM6_WGMXCC1_WGMXCCGn1
    SolutionIndex: 57
    SolutionNameMin: Cijk_Ailk_Bljk_B8NSS_BH_Bias_HAS_SAV_UserArgs_MT128x128x128_MI16x16x1_SN_LDSB1_CLR1_GRVWA16_GRVWB16_GSU0_GSUC0_GSUWGMRR0_K1_LBSPPA1024_LBSPPB512_LPA64_LPB16_LRVW8_MIWT4_4_PLR1_SU0_SUM0_SUS128_VWA4_VWB4_WGM8_WGMXCC1_WGMXCCGn1
    SolutionIndex: 58
    SolutionNameMin: Cijk_Ailk_Bljk_B8NSS_BH_Bias_HAS_SAV_UserArgs_MT64x128x128_MI16x16x1_SN_LDSB1_CLR1_GRVWA16_GRVWB16_GSU0_GSUC0_GSUWGMRR0_K1_LBSPPA512_LBSPPB512_LPA32_LPB16_LRVW8_MIWT2_4_PLR1_SU0_SUM0_SUS128_VWA2_VWB4_WGM1_WGMXCC1_WGMXCCGn1
    SolutionIndex: 59
    SolutionNameMin: Cijk_Ailk_Bljk_B8NSS_BH_Bias_HAS_SAV_UserArgs_MT64x128x128_MI16x16x1_SN_LDSB1_CLR1_GRVWA16_GRVWB16_GSU0_GSUC0_GSUWGMRR0_K1_LBSPPA512_LBSPPB512_LPA32_LPB16_LRVW8_MIWT2_4_PLR1_SU0_SUM0_SUS128_VWA2_VWB4_WGM4_WGMXCC1_WGMXCCGn1
    SolutionIndex: 60
    SolutionNameMin: Cijk_Ailk_Bljk_B8NSS_BH_Bias_HAS_SAV_UserArgs_MT64x128x128_MI16x16x1_SN_LDSB1_CLR1_GRVWA16_GRVWB16_GSU0_GSUC0_GSUWGMRR0_K1_LBSPPA512_LBSPPB512_LPA32_LPB16_LRVW8_MIWT2_4_PLR1_SU0_SUM0_SUS128_VWA2_VWB4_WGM8_WGMXCC1_WGMXCCGn1
    SolutionIndex: 61
    SolutionNameMin: Cijk_Ailk_Bljk_B8NSS_BH_Bias_HAS_SAV_UserArgs_MT128x64x128_MI16x16x1_SN_LDSB1_CLR1_GRVWA16_GRVWB16_GSU0_GSUC0_GSUWGMRR0_K1_LBSPPA1024_LBSPPB256_LPA64_LPB16_LRVW8_MIWT4_2_PLR1_SU0_SUM0_SUS128_VWA4_VWB2_WGM1_WGMXCC1_WGMXCCGn1
    SolutionIndex: 62
    SolutionNameMin: Cijk_Ailk_Bljk_B8NSS_BH_Bias_HAS_SAV_UserArgs_MT128x64x128_MI16x16x1_SN_LDSB1_CLR1_GRVWA16_GRVWB16_GSU0_GSUC0_GSUWGMRR0_K1_LBSPPA1024_LBSPPB256_LPA64_LPB16_LRVW8_MIWT4_2_PLR1_SU0_SUM0_SUS128_VWA4_VWB2_WGM4_WGMXCC1_WGMXCCGn1
    SolutionIndex: 63
    SolutionNameMin: Cijk_Ailk_Bljk_B8NSS_BH_Bias_HAS_SAV_UserArgs_MT128x64x128_MI16x16x1_SN_LDSB1_CLR1_GRVWA16_GRVWB16_GSU0_GSUC0_GSUWGMRR0_K1_LBSPPA1024_LBSPPB256_LPA64_LPB16_LRVW8_MIWT4_2_PLR1_SU0_SUM0_SUS128_VWA4_VWB2_WGM6_WGMXCC1_WGMXCCGn1
    SolutionIndex: 64
    SolutionNameMin: Cijk_Ailk_Bljk_B8NSS_BH_Bias_HAS_SAV_UserArgs_MT128x64x128_MI16x16x1_SN_LDSB1_CLR1_GRVWA16_GRVWB16_GSU0_GSUC0_GSUWGMRR0_K1_LBSPPA1024_LBSPPB256_LPA64_LPB16_LRVW8_MIWT4_2_PLR1_SU0_SUM0_SUS128_VWA4_VWB2_WGM8_WGMXCC1_WGMXCCGn1
    SolutionIndex: 65
    SolutionNameMin: Cijk_Ailk_Bljk_B8NSS_BH_Bias_HAS_SAV_UserArgs_MT64x64x128_MI16x16x1_SN_LDSB1_CLR1_GRVWA16_GRVWB8_GSU0_GSUC0_GSUWGMRR0_K1_LBSPPA512_LBSPPB256_LPA32_LPB8_LRVW8_MIWT2_2_PLR1_SU0_SUM0_SUS128_VWA2_VWB2_WGM1_WGMXCC1_WGMXCCGn1
    SolutionIndex: 66
    SolutionNameMin: Cijk_Ailk_Bljk_B8NSS_BH_Bias_HAS_SAV_UserArgs_MT64x64x128_MI16x16x1_SN_LDSB1_CLR1_GRVWA8_GRVWB16_GSU0_GSUC0_GSUWGMRR0_K1_LBSPPA512_LBSPPB256_LPA32_LPB16_LRVW8_MIWT2_2_PLR1_SU0_SUM0_SUS128_VWA2_VWB2_WGM1_WGMXCC1_WGMXCCGn1
    SolutionIndex: 67
    SolutionNameMin: Cijk_Ailk_Bljk_B8NSS_BH_Bias_HAS_SAV_UserArgs_MT64x64x128_MI16x16x1_SN_LDSB1_CLR1_GRVWA16_GRVWB16_GSU0_GSUC0_GSUWGMRR0_K1_LBSPPA512_LBSPPB256_LPA32_LPB16_LRVW8_MIWT2_2_PLR1_SU0_SUM0_SUS128_VWA2_VWB2_WGM1_WGMXCC1_WGMXCCGn1
    SolutionIndex: 68
    SolutionNameMin: Cijk_Ailk_Bljk_B8NSS_BH_Bias_HAS_SAV_UserArgs_MT64x64x128_MI16x16x1_SN_LDSB1_CLR1_GRVWA16_GRVWB8_GSU0_GSUC0_GSUWGMRR0_K1_LBSPPA512_LBSPPB256_LPA32_LPB8_LRVW8_MIWT2_2_PLR1_SU0_SUM0_SUS128_VWA2_VWB2_WGM4_WGMXCC1_WGMXCCGn1
    SolutionIndex: 69
    SolutionNameMin: Cijk_Ailk_Bljk_B8NSS_BH_Bias_HAS_SAV_UserArgs_MT64x64x128_MI16x16x1_SN_LDSB1_CLR1_GRVWA16_GRVWB16_GSU0_GSUC0_GSUWGMRR0_K1_LBSPPA512_LBSPPB256_LPA32_LPB16_LRVW8_MIWT2_2_PLR1_SU0_SUM0_SUS128_VWA2_VWB2_WGM4_WGMXCC1_WGMXCCGn1
    SolutionIndex: 70
    SolutionNameMin: Cijk_Ailk_Bljk_B8NSS_BH_Bias_HAS_SAV_UserArgs_MT64x64x128_MI16x16x1_SN_LDSB1_CLR1_GRVWA16_GRVWB8_GSU0_GSUC0_GSUWGMRR0_K1_LBSPPA512_LBSPPB256_LPA32_LPB8_LRVW8_MIWT2_2_PLR1_SU0_SUM0_SUS128_VWA2_VWB2_WGM6_WGMXCC1_WGMXCCGn1
    SolutionIndex: 71
    SolutionNameMin: Cijk_Ailk_Bljk_B8NSS_BH_Bias_HAS_SAV_UserArgs_MT64x64x128_MI16x16x1_SN_LDSB1_CLR1_GRVWA16_GRVWB16_GSU0_GSUC0_GSUWGMRR0_K1_LBSPPA512_LBSPPB256_LPA32_LPB16_LRVW8_MIWT2_2_PLR1_SU0_SUM0_SUS128_VWA2_VWB2_WGM6_WGMXCC1_WGMXCCGn1
    SolutionIndex: 72
    SolutionNameMin: Cijk_Ailk_Bljk_B8NSS_BH_Bias_HAS_SAV_UserArgs_MT64x64x128_MI16x16x1_SN_LDSB1_CLR1_GRVWA16_GRVWB8_GSU0_GSUC0_GSUWGMRR0_K1_LBSPPA512_LBSPPB256_LPA32_LPB8_LRVW8_MIWT2_2_PLR1_SU0_SUM0_SUS128_VWA2_VWB2_WGM8_WGMXCC1_WGMXCCGn1
    SolutionIndex: 73
    SolutionNameMin: Cijk_Ailk_Bljk_B8NSS_BH_Bias_HAS_SAV_UserArgs_MT64x64x128_MI16x16x1_SN_LDSB1_CLR1_GRVWA16_GRVWB16_GSU0_GSUC0_GSUWGMRR0_K1_LBSPPA512_LBSPPB256_LPA32_LPB16_LRVW8_MIWT2_2_PLR1_SU0_SUM0_SUS128_VWA2_VWB2_WGM8_WGMXCC1_WGMXCCGn1
    SolutionIndex: 74
    SolutionNameMin: Cijk_Ailk_Bljk_B8NSS_BH_Bias_HAS_SAV_UserArgs_MT32x64x128_MI16x16x1_SN_LDSB0_CLR1_GRVWA8_GRVWB8_GSU0_GSUC0_GSUWGMRR0_K1_LBSPPA256_LBSPPB256_LPA16_LPB8_LRVW8_MIWT1_2_PLR1_SU0_SUM0_SUS128_VWA1_VWB2_WGM1_WGMXCC1_WGMXCCGn1
    SolutionIndex: 75
    SolutionNameMin: Cijk_Ailk_Bljk_B8NSS_BH_Bias_HAS_SAV_UserArgs_MT32x64x128_MI16x16x1_SN_LDSB0_CLR1_GRVWA8_GRVWB16_GSU0_GSUC0_GSUWGMRR0_K1_LBSPPA256_LBSPPB256_LPA16_LPB16_LRVW8_MIWT1_2_PLR1_SU0_SUM0_SUS128_VWA1_VWB2_WGM1_WGMXCC1_WGMXCCGn1
    SolutionIndex: 76
    SolutionNameMin: Cijk_Ailk_Bljk_B8NSS_BH_Bias_HAS_SAV_UserArgs_MT32x64x128_MI16x16x1_SN_LDSB0_CLR1_GRVWA16_GRVWB16_GSU0_GSUC0_GSUWGMRR0_K1_LBSPPA256_LBSPPB256_LPA16_LPB16_LRVW8_MIWT1_2_PLR1_SU0_SUM0_SUS128_VWA1_VWB2_WGM1_WGMXCC1_WGMXCCGn1
    SolutionIndex: 77
    SolutionNameMin: Cijk_Ailk_Bljk_B8NSS_BH_Bias_HAS_SAV_UserArgs_MT32x64x128_MI16x16x1_SN_LDSB0_CLR1_GRVWA16_GRVWB16_GSU0_GSUC0_GSUWGMRR0_K1_LBSPPA256_LBSPPB256_LPA16_LPB16_LRVW8_MIWT1_2_PLR1_SU0_SUM0_SUS128_VWA1_VWB2_WGM4_WGMXCC1_WGMXCCGn1
    SolutionIndex: 78
    SolutionNameMin: Cijk_Ailk_Bljk_B8NSS_BH_Bias_HAS_SAV_UserArgs_MT32x64x128_MI16x16x1_SN_LDSB0_CLR1_GRVWA16_GRVWB16_GSU0_GSUC0_GSUWGMRR0_K1_LBSPPA256_LBSPPB256_LPA16_LPB16_LRVW8_MIWT1_2_PLR1_SU0_SUM0_SUS128_VWA1_VWB2_WGM6_WGMXCC1_WGMXCCGn1
    SolutionIndex: 79
    SolutionNameMin: Cijk_Ailk_Bljk_B8NSS_BH_Bias_HAS_SAV_UserArgs_MT64x32x128_MI16x16x1_SN_LDSB0_CLR1_GRVWA8_GRVWB8_GSU0_GSUC0_GSUWGMRR0_K1_LBSPPA512_LBSPPB128_LPA32_LPB8_LRVW8_MIWT2_1_PLR1_SU0_SUM0_SUS128_VWA2_VWB1_WGM1_WGMXCC1_WGMXCCGn1
    SolutionIndex: 80
    SolutionNameMin: Cijk_Ailk_Bljk_B8NSS_BH_Bias_HAS_SAV_UserArgs_MT64x32x128_MI16x16x1_SN_LDSB0_CLR1_GRVWA8_GRVWB16_GSU0_GSUC0_GSUWGMRR0_K1_LBSPPA512_LBSPPB128_LPA32_LPB16_LRVW8_MIWT2_1_PLR1_SU0_SUM0_SUS128_VWA2_VWB1_WGM1_WGMXCC1_WGMXCCGn1
    SolutionIndex: 81
    SolutionNameMin: Cijk_Ailk_Bljk_B8NSS_BH_Bias_HAS_SAV_UserArgs_MT64x32x128_MI16x16x1_SN_LDSB0_CLR1_GRVWA16_GRVWB16_GSU0_GSUC0_GSUWGMRR0_K1_LBSPPA512_LBSPPB128_LPA32_LPB16_LRVW8_MIWT2_1_PLR1_SU0_SUM0_SUS128_VWA2_VWB1_WGM1_WGMXCC1_WGMXCCGn1
    SolutionIndex: 82
    SolutionNameMin: Cijk_Ailk_Bljk_B8NSS_BH_Bias_HAS_SAV_UserArgs_MT32x32x128_MI16x16x1_SN_LDSB0_CLR1_GRVWA8_GRVWB8_GSU0_GSUC0_GSUWGMRR0_K1_LBSPPA256_LBSPPB128_LPA16_LPB8_LRVW8_MIWT1_1_PLR1_SU0_SUM0_SUS128_VWA1_VWB1_WGM1_WGMXCC1_WGMXCCGn1
    SolutionIndex: 83
    SolutionNameMin: Cijk_Ailk_Bljk_B8NSS_BH_Bias_HAS_SAV_UserArgs_MT32x32x128_MI16x16x1_SN_LDSB0_CLR1_GRVWA8_GRVWB16_GSU0_GSUC0_GSUWGMRR0_K1_LBSPPA256_LBSPPB128_LPA16_LPB16_LRVW8_MIWT1_1_PLR1_SU0_SUM0_SUS128_VWA1_VWB1_WGM1_WGMXCC1_WGMXCCGn1
    SolutionIndex: 84
    SolutionNameMin: Cijk_Ailk_Bljk_B8NSS_BH_Bias_HAS_SAV_UserArgs_MT32x32x128_MI16x16x1_SN_LDSB0_CLR1_GRVWA16_GRVWB16_GSU0_GSUC0_GSUWGMRR0_K1_LBSPPA256_LBSPPB128_LPA16_LPB16_LRVW8_MIWT1_1_PLR1_SU0_SUM0_SUS128_VWA1_VWB1_WGM1_WGMXCC1_WGMXCCGn1
    SolutionIndex: 85
    SolutionNameMin: Cijk_Ailk_Bljk_B8NSS_BH_Bias_HAS_SAV_UserArgs_MT128x64x256_MI16x16x1_SN_LDSB1_CLR1_GRVWA16_GRVWB16_GSU0_GSUC0_GSUWGMRR0_K1_LBSPPA1024_LBSPPB512_LPA64_LPB16_LRVW8_MIWT4_2_PLR1_SU0_SUM0_SUS256_VWA4_VWB2_WGM1_WGMXCC1_WGMXCCGn1
    SolutionIndex: 86
    SolutionNameMin: Cijk_Ailk_Bljk_B8NSS_BH_Bias_HAS_SAV_UserArgs_MT64x64x256_MI16x16x1_SN_LDSB1_CLR1_GRVWA16_GRVWB16_GSU0_GSUC0_GSUWGMRR0_K1_LBSPPA512_LBSPPB512_LPA32_LPB16_LRVW8_MIWT2_2_PLR1_SU0_SUM0_SUS256_VWA2_VWB2_WGM1_WGMXCC1_WGMXCCGn1
    SolutionIndex: 87
    SolutionNameMin: Cijk_Ailk_Bljk_B8NSS_BH_Bias_HAS_SAV_UserArgs_MT64x64x256_MI16x16x1_SN_LDSB1_CLR1_GRVWA16_GRVWB16_GSU0_GSUC0_GSUWGMRR0_K1_LBSPPA512_LBSPPB512_LPA32_LPB16_LRVW8_MIWT2_2_PLR1_SU0_SUM0_SUS256_VWA2_VWB2_WGM6_WGMXCC1_WGMXCCGn1
    SolutionIndex: 88
    SolutionNameMin: Cijk_Ailk_Bljk_B8NSS_BH_Bias_HAS_SAV_UserArgs_MT64x32x256_MI16x16x1_SN_LDSB1_CLR1_GRVWA16_GRVWB16_GSU0_GSUC0_GSUWGMRR0_K1_LBSPPA512_LBSPPB256_LPA32_LPB16_LRVW8_MIWT2_1_PLR1_SU0_SUM0_SUS256_VWA2_VWB1_WGM1_WGMXCC1_WGMXCCGn1
    SolutionIndex: 89
    SolutionNameMin: Cijk_Ailk_Bljk_B8NSS_BH_Bias_HAS_SAV_UserArgs_MT64x32x256_MI16x16x1_SN_LDSB1_CLR1_GRVWA16_GRVWB16_GSU0_GSUC0_GSUWGMRR0_K1_LBSPPA512_LBSPPB256_LPA32_LPB16_LRVW8_MIWT2_1_PLR1_SU0_SUM0_SUS256_VWA2_VWB1_WGM4_WGMXCC1_WGMXCCGn1
    SolutionIndex: 90
    SolutionNameMin: Cijk_Ailk_Bljk_B8NSS_BH_Bias_HAS_SAV_UserArgs_MT64x32x256_MI16x16x1_SN_LDSB1_CLR1_GRVWA16_GRVWB16_GSU0_GSUC0_GSUWGMRR0_K1_LBSPPA512_LBSPPB256_LPA32_LPB16_LRVW8_MIWT2_1_PLR1_SU0_SUM0_SUS256_VWA2_VWB1_WGM8_WGMXCC1_WGMXCCGn1
    SolutionIndex: 91
    SolutionNameMin: Cijk_Ailk_Bljk_B8NSS_BH_Bias_HAS_SAV_UserArgs_MT32x32x256_MI16x16x1_SN_LDSB1_CLR1_GRVWA16_GRVWB8_GSU0_GSUC0_GSUWGMRR0_K1_LBSPPA256_LBSPPB256_LPA16_LPB8_LRVW8_MIWT1_1_PLR1_SU0_SUM0_SUS256_VWA1_VWB1_WGM1_WGMXCC1_WGMXCCGn1
    SolutionIndex: 92
    SolutionNameMin: Cijk_Ailk_Bljk_B8NSS_BH_Bias_HAS_SAV_UserArgs_MT32x32x256_MI16x16x1_SN_LDSB1_CLR1_GRVWA8_GRVWB16_GSU0_GSUC0_GSUWGMRR0_K1_LBSPPA256_LBSPPB256_LPA16_LPB16_LRVW8_MIWT1_1_PLR1_SU0_SUM0_SUS256_VWA1_VWB1_WGM4_WGMXCC1_WGMXCCGn1
    SolutionIndex: 93
    SolutionNameMin: Cijk_Ailk_Bljk_B8NSS_BH_Bias_HAS_SAV_UserArgs_MT32x32x256_MI16x16x1_SN_LDSB1_CLR1_GRVWA16_GRVWB16_GSU0_GSUC0_GSUWGMRR0_K1_LBSPPA256_LBSPPB256_LPA16_LPB16_LRVW8_MIWT1_1_PLR1_SU0_SUM0_SUS256_VWA1_VWB1_WGM4_WGMXCC1_WGMXCCGn1
    SolutionIndex: 94
    SolutionNameMin: Cijk_Ailk_Bljk_B8NSS_BH_Bias_HAS_SAV_UserArgs_MT32x32x256_MI16x16x1_SN_LDSB1_CLR1_GRVWA16_GRVWB16_GSU0_GSUC0_GSUWGMRR0_K1_LBSPPA256_LBSPPB256_LPA16_LPB16_LRVW8_MIWT1_1_PLR1_SU0_SUM0_SUS256_VWA1_VWB1_WGM8_WGMXCC1_WGMXCCGn1
- - - [128, 128, 1, 128, 128, 128, 128, 128]
    - [32, 0.56]
  - - [128, 128, 1, 256, 128, 128, 128, 256]
    - [82, 1.0]
  - - [128, 128, 1, 512, 128, 128, 128, 512]
    - [83, 1.74]
  - - [128, 128, 1, 1024, 128, 128, 128, 1024]
    - [82, 2.74]
  - - [128, 128, 1, 2048, 128, 128, 128, 2048]
    - [84, 3.82]
  - - [128, 128, 1, 4096, 128, 128, 128, 4096]
    - [82, 4.79]
  - - [128, 128, 1, 8192, 128, 128, 128, 8192]
    - [84, 5.45]
  - - [128, 256, 1, 128, 128, 128, 128, 128]
    - [82, 1.12]
  - - [128, 256, 1, 256, 128, 128, 128, 256]
    - [83, 1.96]
  - - [128, 256, 1, 512, 128, 128, 128, 512]
    - [82, 3.42]
  - - [128, 256, 1, 1024, 128, 128, 128, 1024]
    - [83, 5.4]
  - - [128, 256, 1, 2048, 128, 128, 128, 2048]
    - [82, 7.56]
  - - [128, 256, 1, 4096, 128, 128, 128, 4096]
    - [82, 9.51]
  - - [128, 256, 1, 8192, 128, 128, 128, 8192]
    - [91, 10.87]
  - - [128, 512, 1, 128, 128, 128, 128, 128]
    - [82, 2.13]
  - - [128, 512, 1, 256, 128, 128, 128, 256]
    - [82, 3.85]
  - - [128, 512, 1, 512, 128, 128, 128, 512]
    - [83, 6.9]
  - - [128, 512, 1, 1024, 128, 128, 128, 1024]
    - [82, 11.02]
  - - [128, 512, 1, 2048, 128, 128, 128, 2048]
    - [82, 15.13]
  - - [128, 512, 1, 4096, 128, 128, 128, 4096]
    - [82, 19.11]
  - - [128, 512, 1, 8192, 128, 128, 128, 8192]
    - [82, 21.71]
  - - [128, 1024, 1, 128, 128, 128, 128, 128]
    - [32, 4.35]
  - - [128, 1024, 1, 256, 128, 128, 128, 256]
    - [82, 7.78]
  - - [128, 1024, 1, 512, 128, 128, 128, 512]
    - [82, 13.4]
  - - [128, 1024, 1, 1024, 128, 128, 128, 1024]
    - [82, 21.42]
  - - [128, 1024, 1, 2048, 128, 128, 128, 2048]
    - [82, 30.06]
  - - [128, 1024, 1, 4096, 128, 128, 128, 4096]
    - [82, 37.34]
  - - [128, 1024, 1, 8192, 128, 128, 128, 8192]
    - [82, 42.7]
  - - [128, 2048, 1, 128, 128, 128, 128, 128]
    - [75, 7.69]
  - - [128, 2048, 1, 256, 128, 128, 128, 256]
    - [75, 14.06]
  - - [128, 2048, 1, 512, 128, 128, 128, 512]
    - [74, 23.38]
  - - [128, 2048, 1, 1024, 128, 128, 128, 1024]
    - [75, 36.34]
  - - [128, 2048, 1, 2048, 128, 128, 128, 2048]
    - [88, 50.27]
  - - [128, 2048, 1, 4096, 128, 128, 128, 4096]
    - [88, 63.07]
  - - [128, 2048, 1, 8192, 128, 128, 128, 8192]
    - [88, 70.55]
  - - [128, 4096, 1, 128, 128, 128, 128, 128]
    - [23, 13.44]
  - - [128, 4096, 1, 256, 128, 128, 128, 256]
    - [24, 23.65]
  - - [128, 4096, 1, 512, 128, 128, 128, 512]
    - [66, 38.78]
  - - [128, 4096, 1, 1024, 128, 128, 128, 1024]
    - [65, 58.7]
  - - [128, 4096, 1, 2048, 128, 128, 128, 2048]
    - [65, 80.98]
  - - [128, 4096, 1, 4096, 128, 128, 128, 4096]
    - [86, 99.91]
  - - [128, 4096, 1, 8192, 128, 128, 128, 8192]
    - [87, 110.61]
  - - [128, 8192, 1, 128, 128, 128, 128, 128]
    - [20, 21.44]
  - - [128, 8192, 1, 256, 128, 128, 128, 256]
    - [17, 38.39]
  - - [128, 8192, 1, 512, 128, 128, 128, 512]
    - [17, 63.0]
  - - [128, 8192, 1, 1024, 128, 128, 128, 1024]
    - [16, 93.93]
  - - [128, 8192, 1, 2048, 128, 128, 128, 2048]
    - [58, 117.39]
  - - [128, 8192, 1, 4096, 128, 128, 128, 4096]
    - [85, 136.01]
  - - [128, 8192, 1, 8192, 128, 128, 128, 8192]
    - [60, 147.71]
  - - [256, 128, 1, 128, 256, 256, 256, 128]
    - [83, 1.13]
  - - [256, 128, 1, 256, 256, 256, 256, 256]
    - [83, 2.05]
  - - [256, 128, 1, 512, 256, 256, 256, 512]
    - [83, 3.54]
  - - [256, 128, 1, 1024, 256, 256, 256, 1024]
    - [82, 5.58]
  - - [256, 128, 1, 2048, 256, 256, 256, 2048]
    - [82, 7.75]
  - - [256, 128, 1, 4096, 256, 256, 256, 4096]
    - [82, 9.63]
  - - [256, 128, 1, 8192, 256, 256, 256, 8192]
    - [82, 10.96]
  - - [256, 256, 1, 128, 256, 256, 256, 128]
    - [83, 2.2]
  - - [256, 256, 1, 256, 256, 256, 256, 256]
    - [83, 4.03]
  - - [256, 256, 1, 512, 256, 256, 256, 512]
    - [82, 6.96]
  - - [256, 256, 1, 1024, 256, 256, 256, 1024]
    - [82, 10.89]
  - - [256, 256, 1, 2048, 256, 256, 256, 2048]
    - [83, 15.24]
  - - [256, 256, 1, 4096, 256, 256, 256, 4096]
    - [83, 18.99]
  - - [256, 256, 1, 8192, 256, 256, 256, 8192]
    - [82, 21.75]
  - - [256, 512, 1, 128, 256, 256, 256, 128]
    - [32, 4.25]
  - - [256, 512, 1, 256, 256, 256, 256, 256]
    - [32, 7.77]
  - - [256, 512, 1, 512, 256, 256, 256, 512]
    - [82, 13.69]
  - - [256, 512, 1, 1024, 256, 256, 256, 1024]
    - [82, 21.32]
  - - [256, 512, 1, 2048, 256, 256, 256, 2048]
    - [82, 29.82]
  - - [256, 512, 1, 4096, 256, 256, 256, 4096]
    - [82, 37.33]
  - - [256, 512, 1, 8192, 256, 256, 256, 8192]
    - [82, 42.55]
  - - [256, 1024, 1, 128, 256, 256, 256, 128]
    - [29, 7.6]
  - - [256, 1024, 1, 256, 256, 256, 256, 256]
    - [75, 14.03]
  - - [256, 1024, 1, 512, 256, 256, 256, 512]
    - [75, 23.56]
  - - [256, 1024, 1, 1024, 256, 256, 256, 1024]
    - [76, 36.3]
  - - [256, 1024, 1, 2048, 256, 256, 256, 2048]
    - [88, 50.19]
  - - [256, 1024, 1, 4096, 256, 256, 256, 4096]
    - [88, 62.61]
  - - [256, 1024, 1, 8192, 256, 256, 256, 8192]
    - [88, 71.59]
  - - [256, 2048, 1, 128, 256, 256, 256, 128]
    - [26, 13.29]
  - - [256, 2048, 1, 256, 256, 256, 256, 256]
    - [25, 23.63]
  - - [256, 2048, 1, 512, 256, 256, 256, 512]
    - [25, 39.4]
  - - [256, 2048, 1, 1024, 256, 256, 256, 1024]
    - [72, 59.21]
  - - [256, 2048, 1, 2048, 256, 256, 256, 2048]
    - [65, 80.89]
  - - [256, 2048, 1, 4096, 256, 256, 256, 4096]
    - [86, 99.43]
  - - [256, 2048, 1, 8192, 256, 256, 256, 8192]
    - [68, 107.77]
  - - [256, 4096, 1, 128, 256, 256, 256, 128]
    - [17, 21.11]
  - - [256, 4096, 1, 256, 256, 256, 256, 256]
    - [17, 37.84]
  - - [256, 4096, 1, 512, 256, 256, 256, 512]
    - [17, 62.31]
  - - [256, 4096, 1, 1024, 256, 256, 256, 1024]
    - [16, 93.41]
  - - [256, 4096, 1, 2048, 256, 256, 256, 2048]
    - [16, 124.59]
  - - [256, 4096, 1, 4096, 256, 256, 256, 4096]
    - [59, 137.56]
  - - [256, 4096, 1, 8192, 256, 256, 256, 8192]
    - [59, 149.3]
  - - [256, 8192, 1, 128, 256, 256, 256, 128]
    - [47, 31.45]
  - - [256, 8192, 1, 256, 256, 256, 256, 256]
    - [47, 55.7]
  - - [256, 8192, 1, 512, 256, 256, 256, 512]
    - [48, 93.03]
  - - [256, 8192, 1, 1024, 256, 256, 256, 1024]
    - [54, 133.58]
  - - [256, 8192, 1, 2048, 256, 256, 256, 2048]
    - [54, 166.73]
  - - [256, 8192, 1, 4096, 256, 256, 256, 4096]
    - [57, 203.66]
  - - [256, 8192, 1, 8192, 256, 256, 256, 8192]
    - [55, 204.64]
  - - [512, 128, 1, 128, 512, 512, 512, 128]
    - [83, 2.17]
  - - [512, 128, 1, 256, 512, 512, 512, 256]
    - [83, 4.03]
  - - [512, 128, 1, 512, 512, 512, 512, 512]
    - [82, 6.87]
  - - [512, 128, 1, 1024, 512, 512, 512, 1024]
    - [83, 10.83]
  - - [512, 128, 1, 2048, 512, 512, 512, 2048]
    - [82, 15.2]
  - - [512, 128, 1, 4096, 512, 512, 512, 4096]
    - [82, 19.05]
  - - [512, 128, 1, 8192, 512, 512, 512, 8192]
    - [94, 18.49]
  - - [512, 256, 1, 128, 512, 512, 512, 128]
    - [32, 4.33]
  - - [512, 256, 1, 256, 512, 512, 512, 256]
    - [83, 7.86]
  - - [512, 256, 1, 512, 512, 512, 512, 512]
    - [83, 13.22]
  - - [512, 256, 1, 1024, 512, 512, 512, 1024]
    - [82, 21.16]
  - - [512, 256, 1, 2048, 512, 512, 512, 2048]
    - [82, 29.73]
  - - [512, 256, 1, 4096, 512, 512, 512, 4096]
    - [82, 37.33]
  - - [512, 256, 1, 8192, 512, 512, 512, 8192]
    - [93, 34.33]
  - - [512, 512, 1, 128, 512, 512, 512, 128]
    - [31, 7.72]
  - - [512, 512, 1, 256, 512, 512, 512, 256]
    - [75, 13.84]
  - - [512, 512, 1, 512, 512, 512, 512, 512]
    - [75, 23.57]
  - - [512, 512, 1, 1024, 512, 512, 512, 1024]
    - [75, 36.29]
  - - [512, 512, 1, 2048, 512, 512, 512, 2048]
    - [88, 50.34]
  - - [512, 512, 1, 4096, 512, 512, 512, 4096]
    - [88, 62.91]
  - - [512, 512, 1, 8192, 512, 512, 512, 8192]
    - [81, 61.99]
  - - [512, 1024, 1, 128, 512, 512, 512, 128]
    - [25, 13.25]
  - - [512, 1024, 1, 256, 512, 512, 512, 256]
    - [25, 23.56]
  - - [512, 1024, 1, 512, 512, 512, 512, 512]
    - [65, 39.16]
  - - [512, 1024, 1, 1024, 512, 512, 512, 1024]
    - [65, 59.65]
  - - [512, 1024, 1, 2048, 512, 512, 512, 2048]
    - [70, 79.93]
  - - [512, 1024, 1, 4096, 512, 512, 512, 4096]
    - [65, 97.84]
  - - [512, 1024, 1, 8192, 512, 512, 512, 8192]
    - [67, 101.58]
  - - [512, 2048, 1, 128, 512, 512, 512, 128]
    - [19, 21.54]
  - - [512, 2048, 1, 256, 512, 512, 512, 256]
    - [17, 38.25]
  - - [512, 2048, 1, 512, 512, 512, 512, 512]
    - [16, 63.23]
  - - [512, 2048, 1, 1024, 512, 512, 512, 1024]
    - [16, 94.79]
  - - [512, 2048, 1, 2048, 512, 512, 512, 2048]
    - [16, 125.36]
  - - [512, 2048, 1, 4096, 512, 512, 512, 4096]
    - [61, 135.8]
  - - [512, 2048, 1, 8192, 512, 512, 512, 8192]
    - [62, 141.16]
  - - [512, 4096, 1, 128, 512, 512, 512, 128]
    - [15, 31.9]
  - - [512, 4096, 1, 256, 512, 512, 512, 256]
    - [15, 56.22]
  - - [512, 4096, 1, 512, 512, 512, 512, 512]
    - [54, 91.85]
  - - [512, 4096, 1, 1024, 512, 512, 512, 1024]
    - [54, 134.11]
  - - [512, 4096, 1, 2048, 512, 512, 512, 2048]
    - [54, 170.7]
  - - [512, 4096, 1, 4096, 512, 512, 512, 4096]
    - [55, 190.74]
  - - [512, 4096, 1, 8192, 512, 512, 512, 8192]
    - [54, 188.21]
  - - [512, 8192, 1, 128, 512, 512, 512, 128]
    - [50, 40.2]
  - - [512, 8192, 1, 256, 512, 512, 512, 256]
    - [52, 72.33]
  - - [512, 8192, 1, 512, 512, 512, 512, 512]
    - [53, 118.78]
  - - [512, 8192, 1, 1024, 512, 512, 512, 1024]
    - [51, 167.57]
  - - [512, 8192, 1, 2048, 512, 512, 512, 2048]
    - [49, 218.58]
  - - [512, 8192, 1, 4096, 512, 512, 512, 4096]
    - [49, 243.15]
  - - [512, 8192, 1, 8192, 512, 512, 512, 8192]
    - [40, 236.78]
  - - [1024, 128, 1, 128, 1024, 1024, 1024, 128]
    - [83, 4.26]
  - - [1024, 128, 1, 256, 1024, 1024, 1024, 256]
    - [32, 7.69]
  - - [1024, 128, 1, 512, 1024, 1024, 1024, 512]
    - [83, 13.28]
  - - [1024, 128, 1, 1024, 1024, 1024, 1024, 1024]
    - [83, 21.05]
  - - [1024, 128, 1, 2048, 1024, 1024, 1024, 2048]
    - [82, 29.89]
  - - [1024, 128, 1, 4096, 1024, 1024, 1024, 4096]
    - [94, 30.33]
  - - [1024, 128, 1, 8192, 1024, 1024, 1024, 8192]
    - [92, 30.37]
  - - [1024, 256, 1, 128, 1024, 1024, 1024, 128]
    - [80, 7.64]
  - - [1024, 256, 1, 256, 1024, 1024, 1024, 256]
    - [79, 13.55]
  - - [1024, 256, 1, 512, 1024, 1024, 1024, 512]
    - [80, 23.36]
  - - [1024, 256, 1, 1024, 1024, 1024, 1024, 1024]
    - [80, 36.12]
  - - [1024, 256, 1, 2048, 1024, 1024, 1024, 2048]
    - [88, 49.88]
  - - [1024, 256, 1, 4096, 1024, 1024, 1024, 4096]
    - [78, 53.84]
  - - [1024, 256, 1, 8192, 1024, 1024, 1024, 8192]
    - [90, 58.28]
  - - [1024, 512, 1, 128, 1024, 1024, 1024, 128]
    - [27, 13.03]
  - - [1024, 512, 1, 256, 1024, 1024, 1024, 256]
    - [28, 23.23]
  - - [1024, 512, 1, 512, 1024, 1024, 1024, 512]
    - [70, 38.6]
  - - [1024, 512, 1, 1024, 1024, 1024, 1024, 1024]
    - [68, 59.19]
  - - [1024, 512, 1, 2048, 1024, 1024, 1024, 2048]
    - [68, 80.4]
  - - [1024, 512, 1, 4096, 1024, 1024, 1024, 4096]
    - [69, 91.92]
  - - [1024, 512, 1, 8192, 1024, 1024, 1024, 8192]
    - [73, 100.03]
  - - [1024, 1024, 1, 128, 1024, 1024, 1024, 128]
    - [21, 21.06]
  - - [1024, 1024, 1, 256, 1024, 1024, 1024, 256]
    - [17, 38.72]
  - - [1024, 1024, 1, 512, 1024, 1024, 1024, 512]
    - [17, 63.54]
  - - [1024, 1024, 1, 1024, 1024, 1024, 1024, 1024]
    - [17, 94.4]
  - - [1024, 1024, 1, 2048, 1024, 1024, 1024, 2048]
    - [17, 120.04]
  - - [1024, 1024, 1, 4096, 1024, 1024, 1024, 4096]
    - [63, 133.91]
  - - [1024, 1024, 1, 8192, 1024, 1024, 1024, 8192]
    - [61, 141.14]
  - - [1024, 2048, 1, 128, 1024, 1024, 1024, 128]
    - [14, 31.73]
  - - [1024, 2048, 1, 256, 1024, 1024, 1024, 256]
    - [14, 56.39]
  - - [1024, 2048, 1, 512, 1024, 1024, 1024, 512]
    - [54, 91.19]
  - - [1024, 2048, 1, 1024, 1024, 1024, 1024, 1024]
    - [54, 133.1]
  - - [1024, 2048, 1, 2048, 1024, 1024, 1024, 2048]
    - [54, 164.14]
  - - [1024, 2048, 1, 4096, 1024, 1024, 1024, 4096]
    - [57, 191.79]
  - - [1024, 2048, 1, 8192, 1024, 1024, 1024, 8192]
    - [54, 189.01]
  - - [1024, 4096, 1, 128, 1024, 1024, 1024, 128]
    - [7, 38.88]
  - - [1024, 4096, 1, 256, 1024, 1024, 1024, 256]
    - [5, 70.02]
  - - [1024, 4096, 1, 512, 1024, 1024, 1024, 512]
    - [5, 112.35]
  - - [1024, 4096, 1, 1024, 1024, 1024, 1024, 1024]
    - [5, 159.51]
  - - [1024, 4096, 1, 2048, 1024, 1024, 1024, 2048]
    - [40, 211.21]
  - - [1024, 4096, 1, 4096, 1024, 1024, 1024, 4096]
    - [38, 234.15]
  - - [1024, 4096, 1, 8192, 1024, 1024, 1024, 8192]
    - [42, 234.77]
  - - [1024, 8192, 1, 128, 1024, 1024, 1024, 128]
    - [40, 43.99]
  - - [1024, 8192, 1, 256, 1024, 1024, 1024, 256]
    - [40, 80.61]
  - - [1024, 8192, 1, 512, 1024, 1024, 1024, 512]
    - [44, 140.34]
  - - [1024, 8192, 1, 1024, 1024, 1024, 1024, 1024]
    - [44, 208.68]
  - - [1024, 8192, 1, 2048, 1024, 1024, 1024, 2048]
    - [44, 274.45]
  - - [1024, 8192, 1, 4096, 1024, 1024, 1024, 4096]
    - [46, 309.51]
  - - [1024, 8192, 1, 8192, 1024, 1024, 1024, 8192]
    - [40, 346.87]
  - - [2048, 128, 1, 128, 2048, 2048, 2048, 128]
    - [30, 7.59]
  - - [2048, 128, 1, 256, 2048, 2048, 2048, 256]
    - [80, 13.71]
  - - [2048, 128, 1, 512, 2048, 2048, 2048, 512]
    - [75, 23.29]
  - - [2048, 128, 1, 1024, 2048, 2048, 2048, 1024]
    - [75, 36.09]
  - - [2048, 128, 1, 2048, 2048, 2048, 2048, 2048]
    - [77, 42.91]
  - - [2048, 128, 1, 4096, 2048, 2048, 2048, 4096]
    - [89, 51.71]
  - - [2048, 128, 1, 8192, 2048, 2048, 2048, 8192]
    - [89, 58.75]
  - - [2048, 256, 1, 128, 2048, 2048, 2048, 128]
    - [26, 13.3]
  - - [2048, 256, 1, 256, 2048, 2048, 2048, 256]
    - [25, 23.29]
  - - [2048, 256, 1, 512, 2048, 2048, 2048, 512]
    - [67, 39.17]
  - - [2048, 256, 1, 1024, 2048, 2048, 2048, 1024]
    - [65, 58.72]
  - - [2048, 256, 1, 2048, 2048, 2048, 2048, 2048]
    - [69, 74.56]
  - - [2048, 256, 1, 4096, 2048, 2048, 2048, 4096]
    - [73, 90.72]
  - - [2048, 256, 1, 8192, 2048, 2048, 2048, 8192]
    - [69, 102.42]
  - - [2048, 512, 1, 128, 2048, 2048, 2048, 128]
    - [19, 21.29]
  - - [2048, 512, 1, 256, 2048, 2048, 2048, 256]
    - [19, 38.08]
  - - [2048, 512, 1, 512, 2048, 2048, 2048, 512]
    - [20, 61.88]
  - - [2048, 512, 1, 1024, 2048, 2048, 2048, 1024]
    - [19, 88.33]
  - - [2048, 512, 1, 2048, 2048, 2048, 2048, 2048]
    - [62, 113.37]
  - - [2048, 512, 1, 4096, 2048, 2048, 2048, 4096]
    - [64, 135.19]
  - - [2048, 512, 1, 8192, 2048, 2048, 2048, 8192]
    - [64, 142.21]
  - - [2048, 1024, 1, 128, 2048, 2048, 2048, 128]
    - [13, 31.2]
  - - [2048, 1024, 1, 256, 2048, 2048, 2048, 256]
    - [14, 54.78]
  - - [2048, 1024, 1, 512, 2048, 2048, 2048, 512]
    - [13, 86.65]
  - - [2048, 1024, 1, 1024, 2048, 2048, 2048, 1024]
    - [55, 125.46]
  - - [2048, 1024, 1, 2048, 2048, 2048, 2048, 2048]
    - [57, 163.47]
  - - [2048, 1024, 1, 4096, 2048, 2048, 2048, 4096]
    - [55, 193.36]
  - - [2048, 1024, 1, 8192, 2048, 2048, 2048, 8192]
    - [55, 189.12]
  - - [2048, 2048, 1, 128, 2048, 2048, 2048, 128]
    - [5, 36.32]
  - - [2048, 2048, 1, 256, 2048, 2048, 2048, 256]
    - [5, 65.18]
  - - [2048, 2048, 1, 512, 2048, 2048, 2048, 512]
    - [5, 104.01]
  - - [2048, 2048, 1, 1024, 2048, 2048, 2048, 1024]
    - [46, 154.83]
  - - [2048, 2048, 1, 2048, 2048, 2048, 2048, 2048]
    - [44, 211.04]
  - - [2048, 2048, 1, 4096, 2048, 2048, 2048, 4096]
    - [44, 230.94]
  - - [2048, 2048, 1, 8192, 2048, 2048, 2048, 8192]
    - [35, 232.77]
  - - [2048, 4096, 1, 128, 2048, 2048, 2048, 128]
    - [5, 39.12]
  - - [2048, 4096, 1, 256, 2048, 2048, 2048, 256]
    - [5, 70.96]
  - - [2048, 4096, 1, 512, 2048, 2048, 2048, 512]
    - [12, 115.26]
  - - [2048, 4096, 1, 1024, 2048, 2048, 2048, 1024]
    - [2, 164.07]
  - - [2048, 4096, 1, 2048, 2048, 2048, 2048, 2048]
    - [7, 213.47]
  - - [2048, 4096, 1, 4096, 2048, 2048, 2048, 4096]
    - [40, 257.95]
  - - [2048, 4096, 1, 8192, 2048, 2048, 2048, 8192]
    - [42, 308.79]
  - - [2048, 8192, 1, 128, 2048, 2048, 2048, 128]
    - [39, 47.76]
  - - [2048, 8192, 1, 256, 2048, 2048, 2048, 256]
    - [43, 85.98]
  - - [2048, 8192, 1, 512, 2048, 2048, 2048, 512]
    - [39, 147.51]
  - - [2048, 8192, 1, 1024, 2048, 2048, 2048, 1024]
    - [40, 216.17]
  - - [2048, 8192, 1, 2048, 2048, 2048, 2048, 2048]
    - [44, 262.09]
  - - [2048, 8192, 1, 4096, 2048, 2048, 2048, 4096]
    - [42, 305.51]
  - - [2048, 8192, 1, 8192, 2048, 2048, 2048, 8192]
    - [40, 360.11]
  - - [4096, 128, 1, 128, 4096, 4096, 4096, 128]
    - [23, 13.35]
  - - [4096, 128, 1, 256, 4096, 4096, 4096, 256]
    - [24, 23.61]
  - - [4096, 128, 1, 512, 4096, 4096, 4096, 512]
    - [67, 38.92]
  - - [4096, 128, 1, 1024, 4096, 4096, 4096, 1024]
    - [65, 58.94]
  - - [4096, 128, 1, 2048, 4096, 4096, 4096, 2048]
    - [71, 74.02]
  - - [4096, 128, 1, 4096, 4096, 4096, 4096, 4096]
    - [73, 91.26]
  - - [4096, 128, 1, 8192, 4096, 4096, 4096, 8192]
    - [69, 101.61]
  - - [4096, 256, 1, 128, 4096, 4096, 4096, 128]
    - [19, 21.66]
  - - [4096, 256, 1, 256, 4096, 4096, 4096, 256]
    - [19, 38.29]
  - - [4096, 256, 1, 512, 4096, 4096, 4096, 512]
    - [18, 61.42]
  - - [4096, 256, 1, 1024, 4096, 4096, 4096, 1024]
    - [16, 91.22]
  - - [4096, 256, 1, 2048, 4096, 4096, 4096, 2048]
    - [64, 112.64]
  - - [4096, 256, 1, 4096, 4096, 4096, 4096, 4096]
    - [63, 134.75]
  - - [4096, 256, 1, 8192, 4096, 4096, 4096, 8192]
    - [62, 141.94]
  - - [4096, 512, 1, 128, 4096, 4096, 4096, 128]
    - [13, 30.16]
  - - [4096, 512, 1, 256, 4096, 4096, 4096, 256]
    - [14, 53.16]
  - - [4096, 512, 1, 512, 4096, 4096, 4096, 512]
    - [13, 84.02]
  - - [4096, 512, 1, 1024, 4096, 4096, 4096, 1024]
    - [57, 124.34]
  - - [4096, 512, 1, 2048, 4096, 4096, 4096, 2048]
    - [57, 160.96]
  - - [4096, 512, 1, 4096, 4096, 4096, 4096, 4096]
    - [55, 190.88]
  - - [4096, 512, 1, 8192, 4096, 4096, 4096, 8192]
    - [55, 186.2]
  - - [4096, 1024, 1, 128, 4096, 4096, 4096, 128]
    - [46, 35.54]
  - - [4096, 1024, 1, 256, 4096, 4096, 4096, 256]
    - [11, 63.88]
  - - [4096, 1024, 1, 512, 4096, 4096, 4096, 512]
    - [46, 105.55]
  - - [4096, 1024, 1, 1024, 4096, 4096, 4096, 1024]
    - [46, 158.11]
  - - [4096, 1024, 1, 2048, 4096, 4096, 4096, 2048]
    - [46, 210.95]
  - - [4096, 1024, 1, 4096, 4096, 4096, 4096, 4096]
    - [36, 229.45]
  - - [4096, 1024, 1, 8192, 4096, 4096, 4096, 8192]
    - [36, 234.41]
  - - [4096, 2048, 1, 128, 4096, 4096, 4096, 128]
    - [45, 37.34]
  - - [4096, 2048, 1, 256, 4096, 4096, 4096, 256]
    - [5, 65.83]
  - - [4096, 2048, 1, 512, 4096, 4096, 4096, 512]
    - [46, 111.02]
  - - [4096, 2048, 1, 1024, 4096, 4096, 4096, 1024]
    - [46, 166.43]
  - - [4096, 2048, 1, 2048, 4096, 4096, 4096, 2048]
    - [4, 207.51]
  - - [4096, 2048, 1, 4096, 4096, 4096, 4096, 4096]
    - [44, 243.86]
  - - [4096, 2048, 1, 8192, 4096, 4096, 4096, 8192]
    - [33, 276.07]
  - - [4096, 4096, 1, 128, 4096, 4096, 4096, 128]
    - [39, 41.35]
  - - [4096, 4096, 1, 256, 4096, 4096, 4096, 256]
    - [19, 74.32]
  - - [4096, 4096, 1, 512, 4096, 4096, 4096, 512]
    - [14, 121.51]
  - - [4096, 4096, 1, 1024, 4096, 4096, 4096, 1024]
    - [54, 165.33]
  - - [4096, 4096, 1, 2048, 4096, 4096, 4096, 2048]
    - [40, 226.15]
  - - [4096, 4096, 1, 4096, 4096, 4096, 4096, 4096]
    - [40, 273.85]
  - - [4096, 4096, 1, 8192, 4096, 4096, 4096, 8192]
    - [40, 304.83]
  - - [4096, 8192, 1, 128, 4096, 4096, 4096, 128]
    - [41, 49.0]
  - - [4096, 8192, 1, 256, 4096, 4096, 4096, 256]
    - [39, 85.18]
  - - [4096, 8192, 1, 512, 4096, 4096, 4096, 512]
    - [40, 136.22]
  - - [4096, 8192, 1, 1024, 4096, 4096, 4096, 1024]
    - [45, 195.25]
  - - [4096, 8192, 1, 2048, 4096, 4096, 4096, 2048]
    - [46, 244.27]
  - - [4096, 8192, 1, 4096, 4096, 4096, 4096, 4096]
    - [42, 308.1]
  - - [4096, 8192, 1, 8192, 4096, 4096, 4096, 8192]
    - [46, 361.09]
  - - [8192, 128, 1, 128, 8192, 8192, 8192, 128]
    - [20, 21.29]
  - - [8192, 128, 1, 256, 8192, 8192, 8192, 256]
    - [19, 38.11]
  - - [8192, 128, 1, 512, 8192, 8192, 8192, 512]
    - [17, 62.47]
  - - [8192, 128, 1, 1024, 8192, 8192, 8192, 1024]
    - [17, 93.38]
  - - [8192, 128, 1, 2048, 8192, 8192, 8192, 2048]
    - [64, 110.55]
  - - [8192, 128, 1, 4096, 8192, 8192, 8192, 4096]
    - [64, 133.87]
  - - [8192, 128, 1, 8192, 8192, 8192, 8192, 8192]
    - [62, 139.41]
  - - [8192, 256, 1, 128, 8192, 8192, 8192, 128]
    - [14, 30.08]
  - - [8192, 256, 1, 256, 8192, 8192, 8192, 256]
    - [14, 53.4]
  - - [8192, 256, 1, 512, 8192, 8192, 8192, 512]
    - [54, 84.51]
  - - [8192, 256, 1, 1024, 8192, 8192, 8192, 1024]
    - [56, 124.43]
  - - [8192, 256, 1, 2048, 8192, 8192, 8192, 2048]
    - [57, 161.25]
  - - [8192, 256, 1, 4096, 8192, 8192, 8192, 4096]
    - [56, 191.63]
  - - [8192, 256, 1, 8192, 8192, 8192, 8192, 8192]
    - [55, 184.17]
  - - [8192, 512, 1, 128, 8192, 8192, 8192, 128]
    - [7, 37.43]
  - - [8192, 512, 1, 256, 8192, 8192, 8192, 256]
    - [9, 67.13]
  - - [8192, 512, 1, 512, 8192, 8192, 8192, 512]
    - [8, 107.05]
  - - [8192, 512, 1, 1024, 8192, 8192, 8192, 1024]
    - [42, 155.15]
  - - [8192, 512, 1, 2048, 8192, 8192, 8192, 2048]
    - [38, 207.21]
  - - [8192, 512, 1, 4096, 8192, 8192, 8192, 4096]
    - [35, 229.41]
  - - [8192, 512, 1, 8192, 8192, 8192, 8192, 8192]
    - [36, 236.08]
  - - [8192, 1024, 1, 128, 8192, 8192, 8192, 128]
    - [5, 40.04]
  - - [8192, 1024, 1, 256, 8192, 8192, 8192, 256]
    - [6, 73.43]
  - - [8192, 1024, 1, 512, 8192, 8192, 8192, 512]
    - [6, 114.67]
  - - [8192, 1024, 1, 1024, 8192, 8192, 8192, 1024]
    - [3, 162.72]
  - - [8192, 1024, 1, 2048, 8192, 8192, 8192, 2048]
    - [10, 214.37]
  - - [8192, 1024, 1, 4096, 8192, 8192, 8192, 4096]
    - [34, 250.82]
  - - [8192, 1024, 1, 8192, 8192, 8192, 8192, 8192]
    - [34, 284.64]
  - - [8192, 2048, 1, 128, 8192, 8192, 8192, 128]
    - [39, 44.68]
  - - [8192, 2048, 1, 256, 8192, 8192, 8192, 256]
    - [45, 77.18]
  - - [8192, 2048, 1, 512, 8192, 8192, 8192, 512]
    - [42, 130.05]
  - - [8192, 2048, 1, 1024, 8192, 8192, 8192, 1024]
    - [46, 175.44]
  - - [8192, 2048, 1, 2048, 8192, 8192, 8192, 2048]
    - [46, 218.21]
  - - [8192, 2048, 1, 4096, 8192, 8192, 8192, 4096]
    - [0, 264.91]
  - - [8192, 2048, 1, 8192, 8192, 8192, 8192, 8192]
    - [1, 325.66]
  - - [8192, 4096, 1, 128, 8192, 8192, 8192, 128]
    - [22, 40.62]
  - - [8192, 4096, 1, 256, 8192, 8192, 8192, 256]
    - [14, 74.12]
  - - [8192, 4096, 1, 512, 8192, 8192, 8192, 512]
    - [6, 121.8]
  - - [8192, 4096, 1, 1024, 8192, 8192, 8192, 1024]
    - [37, 171.75]
  - - [8192, 4096, 1, 2048, 8192, 8192, 8192, 2048]
    - [40, 222.91]
  - - [8192, 4096, 1, 4096, 8192, 8192, 8192, 4096]
    - [40, 285.1]
  - - [8192, 4096, 1, 8192, 8192, 8192, 8192, 8192]
    - [4, 331.26]
  - - [8192, 8192, 1, 128, 8192, 8192, 8192, 128]
    - [43, 41.96]
  - - [8192, 8192, 1, 256, 8192, 8192, 8192, 256]
    - [6, 73.96]
  - - [8192, 8192, 1, 512, 8192, 8192, 8192, 512]
    - [40, 123.06]
  - - [8192, 8192, 1, 1024, 8192, 8192, 8192, 1024]
    - [46, 184.31]
  - - [8192, 8192, 1, 2048, 8192, 8192, 8192, 2048]
    - [40, 255.35]
  - - [8192, 8192, 1, 4096, 8192, 8192, 8192, 4096]
    - [44, 313.85]
  - - [8192, 8192, 1, 8192, 8192, 8192, 8192, 8192]
    - [44, 370.54]
- null
- null
- ExperimentalStreamK
- GridBased
