projects/hipblaslt/library/src/amd_detail/rocblaslt/src/Tensile/Logic/asm_full/aquavanjaram/gfx942_228cu/StreamK/aquavanjaram942_Cijk_Ailk_Bjlk_BSS_BH_Bias_HAS_SAV_UserArgs.yaml
- {MinimumRequiredVersion: 4.33.0}
- aquavanjaram942
- {Architecture: gfx942, CUCount: 228}
- [Device 0049, Device 0050]
    SolutionIndex: 0
    SolutionNameMin: Cijk_Ailk_Bjlk_BSS_BH_Bias_HAS_SAV_UserArgs_MT256x256x32_MI16x16x1_SN_LDSB0_CLR1_GRVWA4_GRVWB2_GSU0_GSUC0_GSUWGMRR0_K1_LBSPPA2048_LBSPPB2048_LPA0_LPB0_MIWT8_8_PLR1_SU0_SUM0_SUS64_VWA8_VWB8_WGM1_WGMXCC1_WGMXCCGn1
    SolutionIndex: 1
    SolutionNameMin: Cijk_Ailk_Bjlk_BSS_BH_Bias_HAS_SAV_UserArgs_MT256x256x32_MI16x16x1_SN_LDSB0_CLR1_GRVWA2_GRVWB4_GSU0_GSUC0_GSUWGMRR0_K1_LBSPPA2048_LBSPPB2048_LPA0_LPB0_MIWT8_8_PLR1_SU0_SUM0_SUS64_VWA8_VWB8_WGM1_WGMXCC1_WGMXCCGn1
    SolutionIndex: 2
    SolutionNameMin: Cijk_Ailk_Bjlk_BSS_BH_Bias_HAS_SAV_UserArgs_MT256x256x32_MI16x16x1_SN_LDSB0_CLR1_GRVWA8_GRVWB4_GSU0_GSUC0_GSUWGMRR0_K1_LBSPPA2048_LBSPPB2048_LPA0_LPB0_MIWT8_8_PLR1_SU0_SUM0_SUS64_VWA8_VWB8_WGM1_WGMXCC1_WGMXCCGn1
    SolutionIndex: 3
    SolutionNameMin: Cijk_Ailk_Bjlk_BSS_BH_Bias_HAS_SAV_UserArgs_MT256x256x32_MI16x16x1_SN_LDSB0_CLR1_GRVWA2_GRVWB8_GSU0_GSUC0_GSUWGMRR0_K1_LBSPPA2048_LBSPPB2048_LPA0_LPB0_MIWT8_8_PLR1_SU0_SUM0_SUS64_VWA8_VWB8_WGM1_WGMXCC1_WGMXCCGn1
    SolutionIndex: 4
    SolutionNameMin: Cijk_Ailk_Bjlk_BSS_BH_Bias_HAS_SAV_UserArgs_MT256x256x32_MI16x16x1_SN_LDSB0_CLR1_GRVWA8_GRVWB8_GSU0_GSUC0_GSUWGMRR0_K1_LBSPPA2048_LBSPPB2048_LPA0_LPB0_MIWT8_8_PLR1_SU0_SUM0_SUS64_VWA8_VWB8_WGM1_WGMXCC1_WGMXCCGn1
    SolutionIndex: 5
    SolutionNameMin: Cijk_Ailk_Bjlk_BSS_BH_Bias_HAS_SAV_UserArgs_MT256x256x32_MI16x16x1_SN_LDSB0_CLR1_GRVWA4_GRVWB4_GSU0_GSUC0_GSUWGMRR0_K1_LBSPPA2048_LBSPPB2048_LPA0_LPB0_MIWT8_8_PLR1_SU0_SUM0_SUS64_VWA8_VWB8_WGM4_WGMXCC1_WGMXCCGn1
    SolutionIndex: 6
    SolutionNameMin: Cijk_Ailk_Bjlk_BSS_BH_Bias_HAS_SAV_UserArgs_MT256x256x32_MI16x16x1_SN_LDSB0_CLR1_GRVWA8_GRVWB8_GSU0_GSUC0_GSUWGMRR0_K1_LBSPPA2048_LBSPPB2048_LPA0_LPB0_MIWT8_8_PLR1_SU0_SUM0_SUS64_VWA8_VWB8_WGM4_WGMXCC1_WGMXCCGn1
    SolutionIndex: 7
    SolutionNameMin: Cijk_Ailk_Bjlk_BSS_BH_Bias_HAS_SAV_UserArgs_MT256x256x32_MI16x16x1_SN_LDSB0_CLR1_GRVWA8_GRVWB8_GSU0_GSUC0_GSUWGMRR0_K1_LBSPPA2048_LBSPPB2048_LPA0_LPB0_MIWT8_8_PLR1_SU0_SUM0_SUS64_VWA8_VWB8_WGM6_WGMXCC1_WGMXCCGn1
    SolutionIndex: 8
    SolutionNameMin: Cijk_Ailk_Bjlk_BSS_BH_Bias_HAS_SAV_UserArgs_MT256x256x32_MI16x16x1_SN_LDSB0_CLR1_GRVWA4_GRVWB4_GSU0_GSUC0_GSUWGMRR0_K1_LBSPPA2048_LBSPPB2048_LPA0_LPB0_MIWT8_8_PLR1_SU0_SUM0_SUS64_VWA8_VWB8_WGM8_WGMXCC1_WGMXCCGn1
    SolutionIndex: 9
    SolutionNameMin: Cijk_Ailk_Bjlk_BSS_BH_Bias_HAS_SAV_UserArgs_MT256x256x32_MI16x16x1_SN_LDSB0_CLR1_GRVWA8_GRVWB8_GSU0_GSUC0_GSUWGMRR0_K1_LBSPPA2048_LBSPPB2048_LPA0_LPB0_MIWT8_8_PLR1_SU0_SUM0_SUS64_VWA8_VWB8_WGM8_WGMXCC1_WGMXCCGn1
    SolutionIndex: 10
    SolutionNameMin: Cijk_Ailk_Bjlk_BSS_BH_Bias_HAS_SAV_UserArgs_MT128x256x32_MI16x16x1_SN_LDSB1_CLR1_GRVWA4_GRVWB2_GSU0_GSUC0_GSUWGMRR0_K1_LBSPPA1024_LBSPPB2048_LPA0_LPB0_MIWT4_8_PLR1_SU0_SUM0_SUS64_VWA4_VWB8_WGM1_WGMXCC1_WGMXCCGn1
    SolutionIndex: 11
    SolutionNameMin: Cijk_Ailk_Bjlk_BSS_BH_Bias_HAS_SAV_UserArgs_MT128x256x32_MI16x16x1_SN_LDSB1_CLR1_GRVWA8_GRVWB2_GSU0_GSUC0_GSUWGMRR0_K1_LBSPPA1024_LBSPPB2048_LPA0_LPB0_MIWT4_8_PLR1_SU0_SUM0_SUS64_VWA4_VWB8_WGM1_WGMXCC1_WGMXCCGn1
    SolutionIndex: 12
    SolutionNameMin: Cijk_Ailk_Bjlk_BSS_BH_Bias_HAS_SAV_UserArgs_MT128x256x32_MI16x16x1_SN_LDSB1_CLR1_GRVWA2_GRVWB4_GSU0_GSUC0_GSUWGMRR0_K1_LBSPPA1024_LBSPPB2048_LPA0_LPB0_MIWT4_8_PLR1_SU0_SUM0_SUS64_VWA4_VWB8_WGM1_WGMXCC1_WGMXCCGn1
    SolutionIndex: 13
    SolutionNameMin: Cijk_Ailk_Bjlk_BSS_BH_Bias_HAS_SAV_UserArgs_MT128x256x32_MI16x16x1_SN_LDSB1_CLR1_GRVWA2_GRVWB8_GSU0_GSUC0_GSUWGMRR0_K1_LBSPPA1024_LBSPPB2048_LPA0_LPB0_MIWT4_8_PLR1_SU0_SUM0_SUS64_VWA4_VWB8_WGM1_WGMXCC1_WGMXCCGn1
    SolutionIndex: 14
    SolutionNameMin: Cijk_Ailk_Bjlk_BSS_BH_Bias_HAS_SAV_UserArgs_MT128x256x32_MI16x16x1_SN_LDSB1_CLR1_GRVWA4_GRVWB8_GSU0_GSUC0_GSUWGMRR0_K1_LBSPPA1024_LBSPPB2048_LPA0_LPB0_MIWT4_8_PLR1_SU0_SUM0_SUS64_VWA4_VWB8_WGM1_WGMXCC1_WGMXCCGn1
    SolutionIndex: 15
    SolutionNameMin: Cijk_Ailk_Bjlk_BSS_BH_Bias_HAS_SAV_UserArgs_MT128x256x32_MI16x16x1_SN_LDSB1_CLR1_GRVWA8_GRVWB8_GSU0_GSUC0_GSUWGMRR0_K1_LBSPPA1024_LBSPPB2048_LPA0_LPB0_MIWT4_8_PLR1_SU0_SUM0_SUS64_VWA4_VWB8_WGM1_WGMXCC1_WGMXCCGn1
    SolutionIndex: 16
    SolutionNameMin: Cijk_Ailk_Bjlk_BSS_BH_Bias_HAS_SAV_UserArgs_MT128x256x32_MI16x16x1_SN_LDSB1_CLR1_GRVWA2_GRVWB8_GSU0_GSUC0_GSUWGMRR0_K1_LBSPPA1024_LBSPPB2048_LPA0_LPB0_MIWT4_8_PLR1_SU0_SUM0_SUS64_VWA4_VWB8_WGM4_WGMXCC1_WGMXCCGn1
    SolutionIndex: 17
    SolutionNameMin: Cijk_Ailk_Bjlk_BSS_BH_Bias_HAS_SAV_UserArgs_MT128x256x32_MI16x16x1_SN_LDSB1_CLR1_GRVWA4_GRVWB8_GSU0_GSUC0_GSUWGMRR0_K1_LBSPPA1024_LBSPPB2048_LPA0_LPB0_MIWT4_8_PLR1_SU0_SUM0_SUS64_VWA4_VWB8_WGM4_WGMXCC1_WGMXCCGn1
    SolutionIndex: 18
    SolutionNameMin: Cijk_Ailk_Bjlk_BSS_BH_Bias_HAS_SAV_UserArgs_MT128x256x32_MI16x16x1_SN_LDSB1_CLR1_GRVWA8_GRVWB8_GSU0_GSUC0_GSUWGMRR0_K1_LBSPPA1024_LBSPPB2048_LPA0_LPB0_MIWT4_8_PLR1_SU0_SUM0_SUS64_VWA4_VWB8_WGM4_WGMXCC1_WGMXCCGn1
    SolutionIndex: 19
    SolutionNameMin: Cijk_Ailk_Bjlk_BSS_BH_Bias_HAS_SAV_UserArgs_MT128x256x32_MI16x16x1_SN_LDSB1_CLR1_GRVWA2_GRVWB8_GSU0_GSUC0_GSUWGMRR0_K1_LBSPPA1024_LBSPPB2048_LPA0_LPB0_MIWT4_8_PLR1_SU0_SUM0_SUS64_VWA4_VWB8_WGM6_WGMXCC1_WGMXCCGn1
    SolutionIndex: 20
    SolutionNameMin: Cijk_Ailk_Bjlk_BSS_BH_Bias_HAS_SAV_UserArgs_MT128x256x32_MI16x16x1_SN_LDSB1_CLR1_GRVWA8_GRVWB8_GSU0_GSUC0_GSUWGMRR0_K1_LBSPPA1024_LBSPPB2048_LPA0_LPB0_MIWT4_8_PLR1_SU0_SUM0_SUS64_VWA4_VWB8_WGM6_WGMXCC1_WGMXCCGn1
    SolutionIndex: 21
    SolutionNameMin: Cijk_Ailk_Bjlk_BSS_BH_Bias_HAS_SAV_UserArgs_MT128x256x32_MI16x16x1_SN_LDSB1_CLR1_GRVWA2_GRVWB8_GSU0_GSUC0_GSUWGMRR0_K1_LBSPPA1024_LBSPPB2048_LPA0_LPB0_MIWT4_8_PLR1_SU0_SUM0_SUS64_VWA4_VWB8_WGM8_WGMXCC1_WGMXCCGn1
    SolutionIndex: 22
    SolutionNameMin: Cijk_Ailk_Bjlk_BSS_BH_Bias_HAS_SAV_UserArgs_MT128x256x32_MI16x16x1_SN_LDSB1_CLR1_GRVWA8_GRVWB8_GSU0_GSUC0_GSUWGMRR0_K1_LBSPPA1024_LBSPPB2048_LPA0_LPB0_MIWT4_8_PLR1_SU0_SUM0_SUS64_VWA4_VWB8_WGM8_WGMXCC1_WGMXCCGn1
    SolutionIndex: 23
    SolutionNameMin: Cijk_Ailk_Bjlk_BSS_BH_Bias_HAS_SAV_UserArgs_MT128x128x32_MI16x16x1_SN_LDSB0_CLR1_GRVWA8_GRVWB8_GSU0_GSUC0_GSUWGMRR0_K1_LBSPPA1024_LBSPPB1024_LPA0_LPB0_MIWT4_4_PLR1_SU0_SUM0_SUS64_VWA4_VWB4_WGM1_WGMXCC1_WGMXCCGn1
    SolutionIndex: 24
    SolutionNameMin: Cijk_Ailk_Bjlk_BSS_BH_Bias_HAS_SAV_UserArgs_MT128x128x32_MI16x16x1_SN_LDSB0_CLR1_GRVWA2_GRVWB8_GSU0_GSUC0_GSUWGMRR0_K1_LBSPPA1024_LBSPPB1024_LPA0_LPB0_MIWT4_4_PLR1_SU0_SUM0_SUS64_VWA4_VWB4_WGM4_WGMXCC1_WGMXCCGn1
    SolutionIndex: 25
    SolutionNameMin: Cijk_Ailk_Bjlk_BSS_BH_Bias_HAS_SAV_UserArgs_MT128x128x32_MI16x16x1_SN_LDSB0_CLR1_GRVWA4_GRVWB8_GSU0_GSUC0_GSUWGMRR0_K1_LBSPPA1024_LBSPPB1024_LPA0_LPB0_MIWT4_4_PLR1_SU0_SUM0_SUS64_VWA4_VWB4_WGM4_WGMXCC1_WGMXCCGn1
    SolutionIndex: 26
    SolutionNameMin: Cijk_Ailk_Bjlk_BSS_BH_Bias_HAS_SAV_UserArgs_MT128x128x32_MI16x16x1_SN_LDSB0_CLR1_GRVWA8_GRVWB2_GSU0_GSUC0_GSUWGMRR0_K1_LBSPPA1024_LBSPPB1024_LPA0_LPB0_MIWT4_4_PLR1_SU0_SUM0_SUS64_VWA4_VWB4_WGM6_WGMXCC1_WGMXCCGn1
    SolutionIndex: 27
    SolutionNameMin: Cijk_Ailk_Bjlk_BSS_BH_Bias_HAS_SAV_UserArgs_MT128x128x32_MI16x16x1_SN_LDSB0_CLR1_GRVWA2_GRVWB4_GSU0_GSUC0_GSUWGMRR0_K1_LBSPPA1024_LBSPPB1024_LPA0_LPB0_MIWT4_4_PLR1_SU0_SUM0_SUS64_VWA4_VWB4_WGM6_WGMXCC1_WGMXCCGn1
    SolutionIndex: 28
    SolutionNameMin: Cijk_Ailk_Bjlk_BSS_BH_Bias_HAS_SAV_UserArgs_MT128x128x32_MI16x16x1_SN_LDSB0_CLR1_GRVWA2_GRVWB2_GSU0_GSUC0_GSUWGMRR0_K1_LBSPPA1024_LBSPPB1024_LPA0_LPB0_MIWT4_4_PLR1_SU0_SUM0_SUS64_VWA4_VWB4_WGM8_WGMXCC1_WGMXCCGn1
    SolutionIndex: 29
    SolutionNameMin: Cijk_Ailk_Bjlk_BSS_BH_Bias_HAS_SAV_UserArgs_MT128x128x32_MI16x16x1_SN_LDSB0_CLR1_GRVWA2_GRVWB4_GSU0_GSUC0_GSUWGMRR0_K1_LBSPPA1024_LBSPPB1024_LPA0_LPB0_MIWT4_4_PLR1_SU0_SUM0_SUS64_VWA4_VWB4_WGM8_WGMXCC1_WGMXCCGn1
    SolutionIndex: 30
    SolutionNameMin: Cijk_Ailk_Bjlk_BSS_BH_Bias_HAS_SAV_UserArgs_MT128x128x32_MI16x16x1_SN_LDSB0_CLR1_GRVWA8_GRVWB8_GSU0_GSUC0_GSUWGMRR0_K1_LBSPPA1024_LBSPPB1024_LPA0_LPB0_MIWT4_4_PLR1_SU0_SUM0_SUS64_VWA4_VWB4_WGM8_WGMXCC1_WGMXCCGn1
    SolutionIndex: 31
    SolutionNameMin: Cijk_Ailk_Bjlk_BSS_BH_Bias_HAS_SAV_UserArgs_MT64x128x32_MI16x16x1_SN_LDSB0_CLR1_GRVWA8_GRVWB8_GSU0_GSUC0_GSUWGMRR0_K1_LBSPPA512_LBSPPB1024_LPA32_LPB0_MIWT2_4_PLR1_SU0_SUM0_SUS64_VWA2_VWB4_WGM4_WGMXCC1_WGMXCCGn1
    SolutionIndex: 32
    SolutionNameMin: Cijk_Ailk_Bjlk_BSS_BH_Bias_HAS_SAV_UserArgs_MT64x128x32_MI16x16x1_SN_LDSB0_CLR1_GRVWA2_GRVWB8_GSU0_GSUC0_GSUWGMRR0_K1_LBSPPA512_LBSPPB1024_LPA32_LPB0_MIWT2_4_PLR1_SU0_SUM0_SUS64_VWA2_VWB4_WGM6_WGMXCC1_WGMXCCGn1
    SolutionIndex: 33
    SolutionNameMin: Cijk_Ailk_Bjlk_BSS_BH_Bias_HAS_SAV_UserArgs_MT64x128x32_MI16x16x1_SN_LDSB0_CLR1_GRVWA2_GRVWB8_GSU0_GSUC0_GSUWGMRR0_K1_LBSPPA512_LBSPPB1024_LPA32_LPB0_MIWT2_4_PLR1_SU0_SUM0_SUS64_VWA2_VWB4_WGM8_WGMXCC1_WGMXCCGn1
    SolutionIndex: 34
    SolutionNameMin: Cijk_Ailk_Bjlk_BSS_BH_Bias_HAS_SAV_UserArgs_MT128x64x32_MI16x16x1_SN_LDSB0_CLR1_GRVWA2_GRVWB2_GSU0_GSUC0_GSUWGMRR0_K1_LBSPPA1024_LBSPPB512_LPA0_LPB32_MIWT4_2_PLR1_SU0_SUM0_SUS64_VWA4_VWB2_WGM1_WGMXCC1_WGMXCCGn1
    SolutionIndex: 35
    SolutionNameMin: Cijk_Ailk_Bjlk_BSS_BH_Bias_HAS_SAV_UserArgs_MT128x64x32_MI16x16x1_SN_LDSB0_CLR1_GRVWA8_GRVWB2_GSU0_GSUC0_GSUWGMRR0_K1_LBSPPA1024_LBSPPB512_LPA0_LPB32_MIWT4_2_PLR1_SU0_SUM0_SUS64_VWA4_VWB2_WGM1_WGMXCC1_WGMXCCGn1
    SolutionIndex: 36
    SolutionNameMin: Cijk_Ailk_Bjlk_BSS_BH_Bias_HAS_SAV_UserArgs_MT128x64x32_MI16x16x1_SN_LDSB0_CLR1_GRVWA2_GRVWB8_GSU0_GSUC0_GSUWGMRR0_K1_LBSPPA1024_LBSPPB512_LPA0_LPB32_MIWT4_2_PLR1_SU0_SUM0_SUS64_VWA4_VWB2_WGM1_WGMXCC1_WGMXCCGn1
    SolutionIndex: 37
    SolutionNameMin: Cijk_Ailk_Bjlk_BSS_BH_Bias_HAS_SAV_UserArgs_MT128x64x32_MI16x16x1_SN_LDSB0_CLR1_GRVWA8_GRVWB8_GSU0_GSUC0_GSUWGMRR0_K1_LBSPPA1024_LBSPPB512_LPA0_LPB32_MIWT4_2_PLR1_SU0_SUM0_SUS64_VWA4_VWB2_WGM1_WGMXCC1_WGMXCCGn1
    SolutionIndex: 38
    SolutionNameMin: Cijk_Ailk_Bjlk_BSS_BH_Bias_HAS_SAV_UserArgs_MT128x64x32_MI16x16x1_SN_LDSB0_CLR1_GRVWA8_GRVWB8_GSU0_GSUC0_GSUWGMRR0_K1_LBSPPA1024_LBSPPB512_LPA0_LPB32_MIWT4_2_PLR1_SU0_SUM0_SUS64_VWA4_VWB2_WGM6_WGMXCC1_WGMXCCGn1
    SolutionIndex: 39
    SolutionNameMin: Cijk_Ailk_Bjlk_BSS_BH_Bias_HAS_SAV_UserArgs_MT64x64x32_MI16x16x1_SN_LDSB0_CLR1_GRVWA2_GRVWB2_GSU0_GSUC0_GSUWGMRR0_K1_LBSPPA512_LBSPPB512_LPA32_LPB32_MIWT2_2_PLR1_SU0_SUM0_SUS64_VWA2_VWB2_WGM1_WGMXCC1_WGMXCCGn1
    SolutionIndex: 40
    SolutionNameMin: Cijk_Ailk_Bjlk_BSS_BH_Bias_HAS_SAV_UserArgs_MT64x64x32_MI16x16x1_SN_LDSB0_CLR1_GRVWA2_GRVWB8_GSU0_GSUC0_GSUWGMRR0_K1_LBSPPA512_LBSPPB512_LPA32_LPB32_MIWT2_2_PLR1_SU0_SUM0_SUS64_VWA2_VWB2_WGM1_WGMXCC1_WGMXCCGn1
    SolutionIndex: 41
    SolutionNameMin: Cijk_Ailk_Bjlk_BSS_BH_Bias_HAS_SAV_UserArgs_MT64x64x32_MI16x16x1_SN_LDSB0_CLR1_GRVWA2_GRVWB4_GSU0_GSUC0_GSUWGMRR0_K1_LBSPPA512_LBSPPB512_LPA32_LPB32_MIWT2_2_PLR1_SU0_SUM0_SUS64_VWA2_VWB2_WGM6_WGMXCC1_WGMXCCGn1
    SolutionIndex: 42
    SolutionNameMin: Cijk_Ailk_Bjlk_BSS_BH_Bias_HAS_SAV_UserArgs_MT64x64x32_MI16x16x1_SN_LDSB0_CLR1_GRVWA2_GRVWB2_GSU0_GSUC0_GSUWGMRR0_K1_LBSPPA512_LBSPPB512_LPA32_LPB32_MIWT2_2_PLR1_SU0_SUM0_SUS64_VWA2_VWB2_WGM8_WGMXCC1_WGMXCCGn1
    SolutionIndex: 43
    SolutionNameMin: Cijk_Ailk_Bjlk_BSS_BH_Bias_HAS_SAV_UserArgs_MT32x64x32_MI16x16x1_SN_LDSB0_CLR1_GRVWA2_GRVWB2_GSU0_GSUC0_GSUWGMRR0_K1_LBSPPA256_LBSPPB512_LPA16_LPB32_MIWT1_2_PLR1_SU0_SUM0_SUS64_VWA1_VWB2_WGM8_WGMXCC1_WGMXCCGn1
    SolutionIndex: 44
    SolutionNameMin: Cijk_Ailk_Bjlk_BSS_BH_Bias_HAS_SAV_UserArgs_MT64x32x32_MI16x16x1_SN_LDSB0_CLR1_GRVWA2_GRVWB2_GSU0_GSUC0_GSUWGMRR0_K1_LBSPPA512_LBSPPB256_LPA32_LPB16_MIWT2_1_PLR1_SU0_SUM0_SUS64_VWA2_VWB1_WGM1_WGMXCC1_WGMXCCGn1
    SolutionIndex: 45
    SolutionNameMin: Cijk_Ailk_Bjlk_BSS_BH_Bias_HAS_SAV_UserArgs_MT32x32x32_MI16x16x1_SN_LDSB0_CLR1_GRVWA2_GRVWB2_GSU0_GSUC0_GSUWGMRR0_K1_LBSPPA256_LBSPPB256_LPA16_LPB16_MIWT1_1_PLR1_SU0_SUM0_SUS64_VWA1_VWB1_WGM1_WGMXCC1_WGMXCCGn1
    SolutionIndex: 46
    SolutionNameMin: Cijk_Ailk_Bjlk_BSS_BH_Bias_HAS_SAV_UserArgs_MT32x32x32_MI16x16x1_SN_LDSB0_CLR1_GRVWA2_GRVWB2_GSU0_GSUC0_GSUWGMRR0_K1_LBSPPA256_LBSPPB256_LPA16_LPB16_MIWT1_1_PLR1_SU0_SUM0_SUS64_VWA1_VWB1_WGM8_WGMXCC1_WGMXCCGn1
    SolutionIndex: 47
    SolutionNameMin: Cijk_Ailk_Bjlk_BSS_BH_Bias_HAS_SAV_UserArgs_MT256x256x64_MI16x16x1_SN_LDSB1_CLR1_GRVWA4_GRVWB8_GSU0_GSUC0_GSUWGMRR0_K1_LBSPPA2048_LBSPPB2048_LPA0_LPB0_MIWT8_8_PLR1_SU0_SUM0_SUS128_VWA8_VWB8_WGM1_WGMXCC1_WGMXCCGn1
    SolutionIndex: 48
    SolutionNameMin: Cijk_Ailk_Bjlk_BSS_BH_Bias_HAS_SAV_UserArgs_MT256x256x64_MI16x16x1_SN_LDSB1_CLR1_GRVWA8_GRVWB8_GSU0_GSUC0_GSUWGMRR0_K1_LBSPPA2048_LBSPPB2048_LPA0_LPB0_MIWT8_8_PLR1_SU0_SUM0_SUS128_VWA8_VWB8_WGM1_WGMXCC1_WGMXCCGn1
    SolutionIndex: 49
    SolutionNameMin: Cijk_Ailk_Bjlk_BSS_BH_Bias_HAS_SAV_UserArgs_MT256x256x64_MI16x16x1_SN_LDSB1_CLR1_GRVWA8_GRVWB4_GSU0_GSUC0_GSUWGMRR0_K1_LBSPPA2048_LBSPPB2048_LPA0_LPB0_MIWT8_8_PLR1_SU0_SUM0_SUS128_VWA8_VWB8_WGM6_WGMXCC1_WGMXCCGn1
    SolutionIndex: 50
    SolutionNameMin: Cijk_Ailk_Bjlk_BSS_BH_Bias_HAS_SAV_UserArgs_MT256x256x64_MI16x16x1_SN_LDSB1_CLR1_GRVWA8_GRVWB8_GSU0_GSUC0_GSUWGMRR0_K1_LBSPPA2048_LBSPPB2048_LPA0_LPB0_MIWT8_8_PLR1_SU0_SUM0_SUS128_VWA8_VWB8_WGM8_WGMXCC1_WGMXCCGn1
    SolutionIndex: 51
    SolutionNameMin: Cijk_Ailk_Bjlk_BSS_BH_Bias_HAS_SAV_UserArgs_MT128x256x64_MI16x16x1_SN_LDSB1_CLR1_GRVWA2_GRVWB8_GSU0_GSUC0_GSUWGMRR0_K1_LBSPPA1024_LBSPPB2048_LPA0_LPB0_MIWT4_8_PLR1_SU0_SUM0_SUS128_VWA4_VWB8_WGM1_WGMXCC1_WGMXCCGn1
    SolutionIndex: 52
    SolutionNameMin: Cijk_Ailk_Bjlk_BSS_BH_Bias_HAS_SAV_UserArgs_MT128x256x64_MI16x16x1_SN_LDSB1_CLR1_GRVWA2_GRVWB8_GSU0_GSUC0_GSUWGMRR0_K1_LBSPPA1024_LBSPPB2048_LPA0_LPB0_MIWT4_8_PLR1_SU0_SUM0_SUS128_VWA4_VWB8_WGM4_WGMXCC1_WGMXCCGn1
    SolutionIndex: 53
    SolutionNameMin: Cijk_Ailk_Bjlk_BSS_BH_Bias_HAS_SAV_UserArgs_MT128x128x64_MI16x16x1_SN_LDSB1_CLR1_GRVWA2_GRVWB8_GSU0_GSUC0_GSUWGMRR0_K1_LBSPPA1024_LBSPPB1024_LPA0_LPB0_MIWT4_4_PLR1_SU0_SUM0_SUS128_VWA4_VWB4_WGM1_WGMXCC1_WGMXCCGn1
    SolutionIndex: 54
    SolutionNameMin: Cijk_Ailk_Bjlk_BSS_BH_Bias_HAS_SAV_UserArgs_MT128x128x64_MI16x16x1_SN_LDSB1_CLR1_GRVWA4_GRVWB8_GSU0_GSUC0_GSUWGMRR0_K1_LBSPPA1024_LBSPPB1024_LPA0_LPB0_MIWT4_4_PLR1_SU0_SUM0_SUS128_VWA4_VWB4_WGM1_WGMXCC1_WGMXCCGn1
    SolutionIndex: 55
    SolutionNameMin: Cijk_Ailk_Bjlk_BSS_BH_Bias_HAS_SAV_UserArgs_MT128x128x64_MI16x16x1_SN_LDSB1_CLR1_GRVWA8_GRVWB8_GSU0_GSUC0_GSUWGMRR0_K1_LBSPPA1024_LBSPPB1024_LPA0_LPB0_MIWT4_4_PLR1_SU0_SUM0_SUS128_VWA4_VWB4_WGM1_WGMXCC1_WGMXCCGn1
    SolutionIndex: 56
    SolutionNameMin: Cijk_Ailk_Bjlk_BSS_BH_Bias_HAS_SAV_UserArgs_MT128x128x64_MI16x16x1_SN_LDSB1_CLR1_GRVWA2_GRVWB8_GSU0_GSUC0_GSUWGMRR0_K1_LBSPPA1024_LBSPPB1024_LPA0_LPB0_MIWT4_4_PLR1_SU0_SUM0_SUS128_VWA4_VWB4_WGM4_WGMXCC1_WGMXCCGn1
    SolutionIndex: 57
    SolutionNameMin: Cijk_Ailk_Bjlk_BSS_BH_Bias_HAS_SAV_UserArgs_MT128x128x64_MI16x16x1_SN_LDSB1_CLR1_GRVWA8_GRVWB8_GSU0_GSUC0_GSUWGMRR0_K1_LBSPPA1024_LBSPPB1024_LPA0_LPB0_MIWT4_4_PLR1_SU0_SUM0_SUS128_VWA4_VWB4_WGM4_WGMXCC1_WGMXCCGn1
    SolutionIndex: 58
    SolutionNameMin: Cijk_Ailk_Bjlk_BSS_BH_Bias_HAS_SAV_UserArgs_MT128x128x64_MI16x16x1_SN_LDSB1_CLR1_GRVWA8_GRVWB8_GSU0_GSUC0_GSUWGMRR0_K1_LBSPPA1024_LBSPPB1024_LPA0_LPB0_MIWT4_4_PLR1_SU0_SUM0_SUS128_VWA4_VWB4_WGM6_WGMXCC1_WGMXCCGn1
    SolutionIndex: 59
    SolutionNameMin: Cijk_Ailk_Bjlk_BSS_BH_Bias_HAS_SAV_UserArgs_MT128x128x64_MI16x16x1_SN_LDSB1_CLR1_GRVWA8_GRVWB8_GSU0_GSUC0_GSUWGMRR0_K1_LBSPPA1024_LBSPPB1024_LPA0_LPB0_MIWT4_4_PLR1_SU0_SUM0_SUS128_VWA4_VWB4_WGM8_WGMXCC1_WGMXCCGn1
    SolutionIndex: 60
    SolutionNameMin: Cijk_Ailk_Bjlk_BSS_BH_Bias_HAS_SAV_UserArgs_MT128x64x64_MI16x16x1_SN_LDSB1_CLR1_GRVWA8_GRVWB2_GSU0_GSUC0_GSUWGMRR0_K1_LBSPPA1024_LBSPPB512_LPA0_LPB32_MIWT4_2_PLR1_SU0_SUM0_SUS128_VWA4_VWB2_WGM1_WGMXCC1_WGMXCCGn1
    SolutionIndex: 61
    SolutionNameMin: Cijk_Ailk_Bjlk_BSS_BH_Bias_HAS_SAV_UserArgs_MT128x64x64_MI16x16x1_SN_LDSB1_CLR1_GRVWA8_GRVWB4_GSU0_GSUC0_GSUWGMRR0_K1_LBSPPA1024_LBSPPB512_LPA0_LPB32_MIWT4_2_PLR1_SU0_SUM0_SUS128_VWA4_VWB2_WGM1_WGMXCC1_WGMXCCGn1
    SolutionIndex: 62
    SolutionNameMin: Cijk_Ailk_Bjlk_BSS_BH_Bias_HAS_SAV_UserArgs_MT128x64x64_MI16x16x1_SN_LDSB1_CLR1_GRVWA8_GRVWB8_GSU0_GSUC0_GSUWGMRR0_K1_LBSPPA1024_LBSPPB512_LPA0_LPB32_MIWT4_2_PLR1_SU0_SUM0_SUS128_VWA4_VWB2_WGM1_WGMXCC1_WGMXCCGn1
    SolutionIndex: 63
    SolutionNameMin: Cijk_Ailk_Bjlk_BSS_BH_Bias_HAS_SAV_UserArgs_MT128x64x64_MI16x16x1_SN_LDSB1_CLR1_GRVWA8_GRVWB8_GSU0_GSUC0_GSUWGMRR0_K1_LBSPPA1024_LBSPPB512_LPA0_LPB32_MIWT4_2_PLR1_SU0_SUM0_SUS128_VWA4_VWB2_WGM4_WGMXCC1_WGMXCCGn1
    SolutionIndex: 64
    SolutionNameMin: Cijk_Ailk_Bjlk_BSS_BH_Bias_HAS_SAV_UserArgs_MT128x64x64_MI16x16x1_SN_LDSB1_CLR1_GRVWA2_GRVWB2_GSU0_GSUC0_GSUWGMRR0_K1_LBSPPA1024_LBSPPB512_LPA0_LPB32_MIWT4_2_PLR1_SU0_SUM0_SUS128_VWA4_VWB2_WGM6_WGMXCC1_WGMXCCGn1
    SolutionIndex: 65
    SolutionNameMin: Cijk_Ailk_Bjlk_BSS_BH_Bias_HAS_SAV_UserArgs_MT128x64x64_MI16x16x1_SN_LDSB1_CLR1_GRVWA2_GRVWB8_GSU0_GSUC0_GSUWGMRR0_K1_LBSPPA1024_LBSPPB512_LPA0_LPB32_MIWT4_2_PLR1_SU0_SUM0_SUS128_VWA4_VWB2_WGM6_WGMXCC1_WGMXCCGn1
    SolutionIndex: 66
    SolutionNameMin: Cijk_Ailk_Bjlk_BSS_BH_Bias_HAS_SAV_UserArgs_MT128x64x64_MI16x16x1_SN_LDSB1_CLR1_GRVWA8_GRVWB8_GSU0_GSUC0_GSUWGMRR0_K1_LBSPPA1024_LBSPPB512_LPA0_LPB32_MIWT4_2_PLR1_SU0_SUM0_SUS128_VWA4_VWB2_WGM6_WGMXCC1_WGMXCCGn1
    SolutionIndex: 67
    SolutionNameMin: Cijk_Ailk_Bjlk_BSS_BH_Bias_HAS_SAV_UserArgs_MT128x64x64_MI16x16x1_SN_LDSB1_CLR1_GRVWA8_GRVWB4_GSU0_GSUC0_GSUWGMRR0_K1_LBSPPA1024_LBSPPB512_LPA0_LPB32_MIWT4_2_PLR1_SU0_SUM0_SUS128_VWA4_VWB2_WGM8_WGMXCC1_WGMXCCGn1
    SolutionIndex: 68
    SolutionNameMin: Cijk_Ailk_Bjlk_BSS_BH_Bias_HAS_SAV_UserArgs_MT128x64x64_MI16x16x1_SN_LDSB1_CLR1_GRVWA2_GRVWB8_GSU0_GSUC0_GSUWGMRR0_K1_LBSPPA1024_LBSPPB512_LPA0_LPB32_MIWT4_2_PLR1_SU0_SUM0_SUS128_VWA4_VWB2_WGM8_WGMXCC1_WGMXCCGn1
    SolutionIndex: 69
    SolutionNameMin: Cijk_Ailk_Bjlk_BSS_BH_Bias_HAS_SAV_UserArgs_MT128x64x64_MI16x16x1_SN_LDSB1_CLR1_GRVWA8_GRVWB8_GSU0_GSUC0_GSUWGMRR0_K1_LBSPPA1024_LBSPPB512_LPA0_LPB32_MIWT4_2_PLR1_SU0_SUM0_SUS128_VWA4_VWB2_WGM8_WGMXCC1_WGMXCCGn1
    SolutionIndex: 70
    SolutionNameMin: Cijk_Ailk_Bjlk_BSS_BH_Bias_HAS_SAV_UserArgs_MT128x32x64_MI16x16x1_SN_LDSB1_CLR1_GRVWA8_GRVWB8_GSU0_GSUC0_GSUWGMRR0_K1_LBSPPA1024_LBSPPB256_LPA0_LPB16_MIWT4_1_PLR1_SU0_SUM0_SUS128_VWA4_VWB1_WGM1_WGMXCC1_WGMXCCGn1
    SolutionIndex: 71
    SolutionNameMin: Cijk_Ailk_Bjlk_BSS_BH_Bias_HAS_SAV_UserArgs_MT64x64x64_MI16x16x1_SN_LDSB1_CLR1_GRVWA2_GRVWB8_GSU0_GSUC0_GSUWGMRR0_K1_LBSPPA512_LBSPPB512_LPA32_LPB32_MIWT2_2_PLR1_SU0_SUM0_SUS128_VWA2_VWB2_WGM1_WGMXCC1_WGMXCCGn1
    SolutionIndex: 72
    SolutionNameMin: Cijk_Ailk_Bjlk_BSS_BH_Bias_HAS_SAV_UserArgs_MT64x64x64_MI16x16x1_SN_LDSB1_CLR1_GRVWA4_GRVWB8_GSU0_GSUC0_GSUWGMRR0_K1_LBSPPA512_LBSPPB512_LPA32_LPB32_MIWT2_2_PLR1_SU0_SUM0_SUS128_VWA2_VWB2_WGM1_WGMXCC1_WGMXCCGn1
    SolutionIndex: 73
    SolutionNameMin: Cijk_Ailk_Bjlk_BSS_BH_Bias_HAS_SAV_UserArgs_MT64x64x64_MI16x16x1_SN_LDSB1_CLR1_GRVWA8_GRVWB8_GSU0_GSUC0_GSUWGMRR0_K1_LBSPPA512_LBSPPB512_LPA32_LPB32_MIWT2_2_PLR1_SU0_SUM0_SUS128_VWA2_VWB2_WGM1_WGMXCC1_WGMXCCGn1
    SolutionIndex: 74
    SolutionNameMin: Cijk_Ailk_Bjlk_BSS_BH_Bias_HAS_SAV_UserArgs_MT64x64x64_MI16x16x1_SN_LDSB1_CLR1_GRVWA2_GRVWB2_GSU0_GSUC0_GSUWGMRR0_K1_LBSPPA512_LBSPPB512_LPA32_LPB32_MIWT2_2_PLR1_SU0_SUM0_SUS128_VWA2_VWB2_WGM6_WGMXCC1_WGMXCCGn1
    SolutionIndex: 75
    SolutionNameMin: Cijk_Ailk_Bjlk_BSS_BH_Bias_HAS_SAV_UserArgs_MT64x64x64_MI16x16x1_SN_LDSB1_CLR1_GRVWA2_GRVWB8_GSU0_GSUC0_GSUWGMRR0_K1_LBSPPA512_LBSPPB512_LPA32_LPB32_MIWT2_2_PLR1_SU0_SUM0_SUS128_VWA2_VWB2_WGM6_WGMXCC1_WGMXCCGn1
    SolutionIndex: 76
    SolutionNameMin: Cijk_Ailk_Bjlk_BSS_BH_Bias_HAS_SAV_UserArgs_MT64x64x64_MI16x16x1_SN_LDSB1_CLR1_GRVWA4_GRVWB8_GSU0_GSUC0_GSUWGMRR0_K1_LBSPPA512_LBSPPB512_LPA32_LPB32_MIWT2_2_PLR1_SU0_SUM0_SUS128_VWA2_VWB2_WGM6_WGMXCC1_WGMXCCGn1
    SolutionIndex: 77
    SolutionNameMin: Cijk_Ailk_Bjlk_BSS_BH_Bias_HAS_SAV_UserArgs_MT64x64x64_MI16x16x1_SN_LDSB1_CLR1_GRVWA8_GRVWB8_GSU0_GSUC0_GSUWGMRR0_K1_LBSPPA512_LBSPPB512_LPA32_LPB32_MIWT2_2_PLR1_SU0_SUM0_SUS128_VWA2_VWB2_WGM6_WGMXCC1_WGMXCCGn1
    SolutionIndex: 78
    SolutionNameMin: Cijk_Ailk_Bjlk_BSS_BH_Bias_HAS_SAV_UserArgs_MT64x64x64_MI16x16x1_SN_LDSB1_CLR1_GRVWA2_GRVWB8_GSU0_GSUC0_GSUWGMRR0_K1_LBSPPA512_LBSPPB512_LPA32_LPB32_MIWT2_2_PLR1_SU0_SUM0_SUS128_VWA2_VWB2_WGM8_WGMXCC1_WGMXCCGn1
    SolutionIndex: 79
    SolutionNameMin: Cijk_Ailk_Bjlk_BSS_BH_Bias_HAS_SAV_UserArgs_MT32x64x64_MI16x16x1_SN_LDSB0_CLR1_GRVWA2_GRVWB2_GSU0_GSUC0_GSUWGMRR0_K1_LBSPPA256_LBSPPB512_LPA16_LPB32_MIWT1_2_PLR1_SU0_SUM0_SUS128_VWA1_VWB2_WGM1_WGMXCC1_WGMXCCGn1
    SolutionIndex: 80
    SolutionNameMin: Cijk_Ailk_Bjlk_BSS_BH_Bias_HAS_SAV_UserArgs_MT32x64x64_MI16x16x1_SN_LDSB0_CLR1_GRVWA8_GRVWB8_GSU0_GSUC0_GSUWGMRR0_K1_LBSPPA256_LBSPPB512_LPA16_LPB32_MIWT1_2_PLR1_SU0_SUM0_SUS128_VWA1_VWB2_WGM1_WGMXCC1_WGMXCCGn1
    SolutionIndex: 81
    SolutionNameMin: Cijk_Ailk_Bjlk_BSS_BH_Bias_HAS_SAV_UserArgs_MT32x64x64_MI16x16x1_SN_LDSB0_CLR1_GRVWA2_GRVWB8_GSU0_GSUC0_GSUWGMRR0_K1_LBSPPA256_LBSPPB512_LPA16_LPB32_MIWT1_2_PLR1_SU0_SUM0_SUS128_VWA1_VWB2_WGM6_WGMXCC1_WGMXCCGn1
    SolutionIndex: 82
    SolutionNameMin: Cijk_Ailk_Bjlk_BSS_BH_Bias_HAS_SAV_UserArgs_MT32x64x64_MI16x16x1_SN_LDSB0_CLR1_GRVWA2_GRVWB2_GSU0_GSUC0_GSUWGMRR0_K1_LBSPPA256_LBSPPB512_LPA16_LPB32_MIWT1_2_PLR1_SU0_SUM0_SUS128_VWA1_VWB2_WGM8_WGMXCC1_WGMXCCGn1
    SolutionIndex: 83
    SolutionNameMin: Cijk_Ailk_Bjlk_BSS_BH_Bias_HAS_SAV_UserArgs_MT64x32x64_MI16x16x1_SN_LDSB0_CLR1_GRVWA2_GRVWB2_GSU0_GSUC0_GSUWGMRR0_K1_LBSPPA512_LBSPPB256_LPA32_LPB16_MIWT2_1_PLR1_SU0_SUM0_SUS128_VWA2_VWB1_WGM1_WGMXCC1_WGMXCCGn1
    SolutionIndex: 84
    SolutionNameMin: Cijk_Ailk_Bjlk_BSS_BH_Bias_HAS_SAV_UserArgs_MT64x32x64_MI16x16x1_SN_LDSB0_CLR1_GRVWA8_GRVWB2_GSU0_GSUC0_GSUWGMRR0_K1_LBSPPA512_LBSPPB256_LPA32_LPB16_MIWT2_1_PLR1_SU0_SUM0_SUS128_VWA2_VWB1_WGM1_WGMXCC1_WGMXCCGn1
    SolutionIndex: 85
    SolutionNameMin: Cijk_Ailk_Bjlk_BSS_BH_Bias_HAS_SAV_UserArgs_MT64x32x64_MI16x16x1_SN_LDSB0_CLR1_GRVWA2_GRVWB8_GSU0_GSUC0_GSUWGMRR0_K1_LBSPPA512_LBSPPB256_LPA32_LPB16_MIWT2_1_PLR1_SU0_SUM0_SUS128_VWA2_VWB1_WGM4_WGMXCC1_WGMXCCGn1
    SolutionIndex: 86
    SolutionNameMin: Cijk_Ailk_Bjlk_BSS_BH_Bias_HAS_SAV_UserArgs_MT32x32x64_MI16x16x1_SN_LDSB0_CLR1_GRVWA2_GRVWB2_GSU0_GSUC0_GSUWGMRR0_K1_LBSPPA256_LBSPPB256_LPA16_LPB16_MIWT1_1_PLR1_SU0_SUM0_SUS128_VWA1_VWB1_WGM1_WGMXCC1_WGMXCCGn1
    SolutionIndex: 87
    SolutionNameMin: Cijk_Ailk_Bjlk_BSS_BH_Bias_HAS_SAV_UserArgs_MT32x32x64_MI16x16x1_SN_LDSB0_CLR1_GRVWA4_GRVWB2_GSU0_GSUC0_GSUWGMRR0_K1_LBSPPA256_LBSPPB256_LPA16_LPB16_MIWT1_1_PLR1_SU0_SUM0_SUS128_VWA1_VWB1_WGM1_WGMXCC1_WGMXCCGn1
    SolutionIndex: 88
    SolutionNameMin: Cijk_Ailk_Bjlk_BSS_BH_Bias_HAS_SAV_UserArgs_MT32x32x64_MI16x16x1_SN_LDSB0_CLR1_GRVWA8_GRVWB2_GSU0_GSUC0_GSUWGMRR0_K1_LBSPPA256_LBSPPB256_LPA16_LPB16_MIWT1_1_PLR1_SU0_SUM0_SUS128_VWA1_VWB1_WGM1_WGMXCC1_WGMXCCGn1
    SolutionIndex: 89
    SolutionNameMin: Cijk_Ailk_Bjlk_BSS_BH_Bias_HAS_SAV_UserArgs_MT32x32x64_MI16x16x1_SN_LDSB0_CLR1_GRVWA2_GRVWB4_GSU0_GSUC0_GSUWGMRR0_K1_LBSPPA256_LBSPPB256_LPA16_LPB16_MIWT1_1_PLR1_SU0_SUM0_SUS128_VWA1_VWB1_WGM1_WGMXCC1_WGMXCCGn1
    SolutionIndex: 90
    SolutionNameMin: Cijk_Ailk_Bjlk_BSS_BH_Bias_HAS_SAV_UserArgs_MT32x32x64_MI16x16x1_SN_LDSB0_CLR1_GRVWA4_GRVWB4_GSU0_GSUC0_GSUWGMRR0_K1_LBSPPA256_LBSPPB256_LPA16_LPB16_MIWT1_1_PLR1_SU0_SUM0_SUS128_VWA1_VWB1_WGM1_WGMXCC1_WGMXCCGn1
    SolutionIndex: 91
    SolutionNameMin: Cijk_Ailk_Bjlk_BSS_BH_Bias_HAS_SAV_UserArgs_MT32x32x64_MI16x16x1_SN_LDSB0_CLR1_GRVWA2_GRVWB8_GSU0_GSUC0_GSUWGMRR0_K1_LBSPPA256_LBSPPB256_LPA16_LPB16_MIWT1_1_PLR1_SU0_SUM0_SUS128_VWA1_VWB1_WGM1_WGMXCC1_WGMXCCGn1
    SolutionIndex: 92
    SolutionNameMin: Cijk_Ailk_Bjlk_BSS_BH_Bias_HAS_SAV_UserArgs_MT32x32x64_MI16x16x1_SN_LDSB0_CLR1_GRVWA2_GRVWB4_GSU0_GSUC0_GSUWGMRR0_K1_LBSPPA256_LBSPPB256_LPA16_LPB16_MIWT1_1_PLR1_SU0_SUM0_SUS128_VWA1_VWB1_WGM4_WGMXCC1_WGMXCCGn1
    SolutionIndex: 93
    SolutionNameMin: Cijk_Ailk_Bjlk_BSS_BH_Bias_HAS_SAV_UserArgs_MT32x32x64_MI16x16x1_SN_LDSB0_CLR1_GRVWA2_GRVWB2_GSU0_GSUC0_GSUWGMRR0_K1_LBSPPA256_LBSPPB256_LPA16_LPB16_MIWT1_1_PLR1_SU0_SUM0_SUS128_VWA1_VWB1_WGM6_WGMXCC1_WGMXCCGn1
    SolutionIndex: 94
    SolutionNameMin: Cijk_Ailk_Bjlk_BSS_BH_Bias_HAS_SAV_UserArgs_MT128x128x128_MI16x16x1_SN_LDSB1_CLR1_GRVWA8_GRVWB8_GSU0_GSUC0_GSUWGMRR0_K1_LBSPPA1024_LBSPPB1024_LPA0_LPB0_MIWT4_4_PLR1_SU0_SUM0_SUS256_VWA4_VWB4_WGM1_WGMXCC1_WGMXCCGn1
    SolutionIndex: 95
    SolutionNameMin: Cijk_Ailk_Bjlk_BSS_BH_Bias_HAS_SAV_UserArgs_MT128x128x128_MI16x16x1_SN_LDSB1_CLR1_GRVWA8_GRVWB8_GSU0_GSUC0_GSUWGMRR0_K1_LBSPPA1024_LBSPPB1024_LPA0_LPB0_MIWT4_4_PLR1_SU0_SUM0_SUS256_VWA4_VWB4_WGM4_WGMXCC1_WGMXCCGn1
    SolutionIndex: 96
    SolutionNameMin: Cijk_Ailk_Bjlk_BSS_BH_Bias_HAS_SAV_UserArgs_MT128x64x128_MI16x16x1_SN_LDSB1_CLR1_GRVWA8_GRVWB8_GSU0_GSUC0_GSUWGMRR0_K1_LBSPPA1024_LBSPPB512_LPA0_LPB32_MIWT4_2_PLR1_SU0_SUM0_SUS256_VWA4_VWB2_WGM1_WGMXCC1_WGMXCCGn1
    SolutionIndex: 97
    SolutionNameMin: Cijk_Ailk_Bjlk_BSS_BH_Bias_HAS_SAV_UserArgs_MT128x64x128_MI16x16x1_SN_LDSB1_CLR1_GRVWA8_GRVWB8_GSU0_GSUC0_GSUWGMRR0_K1_LBSPPA1024_LBSPPB512_LPA0_LPB32_MIWT4_2_PLR1_SU0_SUM0_SUS256_VWA4_VWB2_WGM6_WGMXCC1_WGMXCCGn1
    SolutionIndex: 98
    SolutionNameMin: Cijk_Ailk_Bjlk_BSS_BH_Bias_HAS_SAV_UserArgs_MT128x64x128_MI16x16x1_SN_LDSB1_CLR1_GRVWA8_GRVWB8_GSU0_GSUC0_GSUWGMRR0_K1_LBSPPA1024_LBSPPB512_LPA0_LPB32_MIWT4_2_PLR1_SU0_SUM0_SUS256_VWA4_VWB2_WGM8_WGMXCC1_WGMXCCGn1
    SolutionIndex: 99
    SolutionNameMin: Cijk_Ailk_Bjlk_BSS_BH_Bias_HAS_SAV_UserArgs_MT64x64x128_MI16x16x1_SN_LDSB1_CLR1_GRVWA2_GRVWB8_GSU0_GSUC0_GSUWGMRR0_K1_LBSPPA512_LBSPPB512_LPA32_LPB32_MIWT2_2_PLR1_SU0_SUM0_SUS256_VWA2_VWB2_WGM1_WGMXCC1_WGMXCCGn1
    SolutionIndex: 100
    SolutionNameMin: Cijk_Ailk_Bjlk_BSS_BH_Bias_HAS_SAV_UserArgs_MT64x64x128_MI16x16x1_SN_LDSB1_CLR1_GRVWA8_GRVWB8_GSU0_GSUC0_GSUWGMRR0_K1_LBSPPA512_LBSPPB512_LPA32_LPB32_MIWT2_2_PLR1_SU0_SUM0_SUS256_VWA2_VWB2_WGM1_WGMXCC1_WGMXCCGn1
    SolutionIndex: 101
    SolutionNameMin: Cijk_Ailk_Bjlk_BSS_BH_Bias_HAS_SAV_UserArgs_MT64x64x128_MI16x16x1_SN_LDSB1_CLR1_GRVWA2_GRVWB8_GSU0_GSUC0_GSUWGMRR0_K1_LBSPPA512_LBSPPB512_LPA32_LPB32_MIWT2_2_PLR1_SU0_SUM0_SUS256_VWA2_VWB2_WGM6_WGMXCC1_WGMXCCGn1
    SolutionIndex: 102
    SolutionNameMin: Cijk_Ailk_Bjlk_BSS_BH_Bias_HAS_SAV_UserArgs_MT64x64x128_MI16x16x1_SN_LDSB1_CLR1_GRVWA8_GRVWB8_GSU0_GSUC0_GSUWGMRR0_K1_LBSPPA512_LBSPPB512_LPA32_LPB32_MIWT2_2_PLR1_SU0_SUM0_SUS256_VWA2_VWB2_WGM6_WGMXCC1_WGMXCCGn1
    SolutionIndex: 103
    SolutionNameMin: Cijk_Ailk_Bjlk_BSS_BH_Bias_HAS_SAV_UserArgs_MT32x64x128_MI16x16x1_SN_LDSB1_CLR1_GRVWA2_GRVWB2_GSU0_GSUC0_GSUWGMRR0_K1_LBSPPA256_LBSPPB512_LPA16_LPB32_MIWT1_2_PLR1_SU0_SUM0_SUS256_VWA1_VWB2_WGM1_WGMXCC1_WGMXCCGn1
    SolutionIndex: 104
    SolutionNameMin: Cijk_Ailk_Bjlk_BSS_BH_Bias_HAS_SAV_UserArgs_MT32x64x128_MI16x16x1_SN_LDSB1_CLR1_GRVWA8_GRVWB2_GSU0_GSUC0_GSUWGMRR0_K1_LBSPPA256_LBSPPB512_LPA16_LPB32_MIWT1_2_PLR1_SU0_SUM0_SUS256_VWA1_VWB2_WGM1_WGMXCC1_WGMXCCGn1
    SolutionIndex: 105
    SolutionNameMin: Cijk_Ailk_Bjlk_BSS_BH_Bias_HAS_SAV_UserArgs_MT32x64x128_MI16x16x1_SN_LDSB1_CLR1_GRVWA2_GRVWB8_GSU0_GSUC0_GSUWGMRR0_K1_LBSPPA256_LBSPPB512_LPA16_LPB32_MIWT1_2_PLR1_SU0_SUM0_SUS256_VWA1_VWB2_WGM1_WGMXCC1_WGMXCCGn1
    SolutionIndex: 106
    SolutionNameMin: Cijk_Ailk_Bjlk_BSS_BH_Bias_HAS_SAV_UserArgs_MT32x64x128_MI16x16x1_SN_LDSB1_CLR1_GRVWA8_GRVWB8_GSU0_GSUC0_GSUWGMRR0_K1_LBSPPA256_LBSPPB512_LPA16_LPB32_MIWT1_2_PLR1_SU0_SUM0_SUS256_VWA1_VWB2_WGM1_WGMXCC1_WGMXCCGn1
    SolutionIndex: 107
    SolutionNameMin: Cijk_Ailk_Bjlk_BSS_BH_Bias_HAS_SAV_UserArgs_MT64x32x128_MI16x16x1_SN_LDSB1_CLR1_GRVWA8_GRVWB8_GSU0_GSUC0_GSUWGMRR0_K1_LBSPPA512_LBSPPB256_LPA32_LPB16_MIWT2_1_PLR1_SU0_SUM0_SUS256_VWA2_VWB1_WGM1_WGMXCC1_WGMXCCGn1
    SolutionIndex: 108
    SolutionNameMin: Cijk_Ailk_Bjlk_BSS_BH_Bias_HAS_SAV_UserArgs_MT64x32x128_MI16x16x1_SN_LDSB1_CLR1_GRVWA8_GRVWB8_GSU0_GSUC0_GSUWGMRR0_K1_LBSPPA512_LBSPPB256_LPA32_LPB16_MIWT2_1_PLR1_SU0_SUM0_SUS256_VWA2_VWB1_WGM4_WGMXCC1_WGMXCCGn1
    SolutionIndex: 109
    SolutionNameMin: Cijk_Ailk_Bjlk_BSS_BH_Bias_HAS_SAV_UserArgs_MT64x32x128_MI16x16x1_SN_LDSB1_CLR1_GRVWA8_GRVWB8_GSU0_GSUC0_GSUWGMRR0_K1_LBSPPA512_LBSPPB256_LPA32_LPB16_MIWT2_1_PLR1_SU0_SUM0_SUS256_VWA2_VWB1_WGM8_WGMXCC1_WGMXCCGn1
    SolutionIndex: 110
    SolutionNameMin: Cijk_Ailk_Bjlk_BSS_BH_Bias_HAS_SAV_UserArgs_MT32x32x128_MI16x16x1_SN_LDSB1_CLR1_GRVWA2_GRVWB2_GSU0_GSUC0_GSUWGMRR0_K1_LBSPPA256_LBSPPB256_LPA16_LPB16_MIWT1_1_PLR1_SU0_SUM0_SUS256_VWA1_VWB1_WGM1_WGMXCC1_WGMXCCGn1
    SolutionIndex: 111
    SolutionNameMin: Cijk_Ailk_Bjlk_BSS_BH_Bias_HAS_SAV_UserArgs_MT32x32x128_MI16x16x1_SN_LDSB1_CLR1_GRVWA8_GRVWB2_GSU0_GSUC0_GSUWGMRR0_K1_LBSPPA256_LBSPPB256_LPA16_LPB16_MIWT1_1_PLR1_SU0_SUM0_SUS256_VWA1_VWB1_WGM1_WGMXCC1_WGMXCCGn1
    SolutionIndex: 112
    SolutionNameMin: Cijk_Ailk_Bjlk_BSS_BH_Bias_HAS_SAV_UserArgs_MT32x32x128_MI16x16x1_SN_LDSB1_CLR1_GRVWA2_GRVWB8_GSU0_GSUC0_GSUWGMRR0_K1_LBSPPA256_LBSPPB256_LPA16_LPB16_MIWT1_1_PLR1_SU0_SUM0_SUS256_VWA1_VWB1_WGM1_WGMXCC1_WGMXCCGn1
    SolutionIndex: 113
    SolutionNameMin: Cijk_Ailk_Bjlk_BSS_BH_Bias_HAS_SAV_UserArgs_MT32x32x128_MI16x16x1_SN_LDSB1_CLR1_GRVWA4_GRVWB8_GSU0_GSUC0_GSUWGMRR0_K1_LBSPPA256_LBSPPB256_LPA16_LPB16_MIWT1_1_PLR1_SU0_SUM0_SUS256_VWA1_VWB1_WGM1_WGMXCC1_WGMXCCGn1
    SolutionIndex: 114
    SolutionNameMin: Cijk_Ailk_Bjlk_BSS_BH_Bias_HAS_SAV_UserArgs_MT32x32x128_MI16x16x1_SN_LDSB1_CLR1_GRVWA8_GRVWB8_GSU0_GSUC0_GSUWGMRR0_K1_LBSPPA256_LBSPPB256_LPA16_LPB16_MIWT1_1_PLR1_SU0_SUM0_SUS256_VWA1_VWB1_WGM1_WGMXCC1_WGMXCCGn1
    SolutionIndex: 115
    SolutionNameMin: Cijk_Ailk_Bjlk_BSS_BH_Bias_HAS_SAV_UserArgs_MT32x32x128_MI16x16x1_SN_LDSB1_CLR1_GRVWA2_GRVWB8_GSU0_GSUC0_GSUWGMRR0_K1_LBSPPA256_LBSPPB256_LPA16_LPB16_MIWT1_1_PLR1_SU0_SUM0_SUS256_VWA1_VWB1_WGM4_WGMXCC1_WGMXCCGn1
    SolutionIndex: 116
    SolutionNameMin: Cijk_Ailk_Bjlk_BSS_BH_Bias_HAS_SAV_UserArgs_MT32x32x128_MI16x16x1_SN_LDSB1_CLR1_GRVWA4_GRVWB8_GSU0_GSUC0_GSUWGMRR0_K1_LBSPPA256_LBSPPB256_LPA16_LPB16_MIWT1_1_PLR1_SU0_SUM0_SUS256_VWA1_VWB1_WGM4_WGMXCC1_WGMXCCGn1
    SolutionIndex: 117
    SolutionNameMin: Cijk_Ailk_Bjlk_BSS_BH_Bias_HAS_SAV_UserArgs_MT32x32x128_MI16x16x1_SN_LDSB1_CLR1_GRVWA8_GRVWB8_GSU0_GSUC0_GSUWGMRR0_K1_LBSPPA256_LBSPPB256_LPA16_LPB16_MIWT1_1_PLR1_SU0_SUM0_SUS256_VWA1_VWB1_WGM4_WGMXCC1_WGMXCCGn1
    SolutionIndex: 118
    SolutionNameMin: Cijk_Ailk_Bjlk_BSS_BH_Bias_HAS_SAV_UserArgs_MT32x32x128_MI16x16x1_SN_LDSB1_CLR1_GRVWA2_GRVWB8_GSU0_GSUC0_GSUWGMRR0_K1_LBSPPA256_LBSPPB256_LPA16_LPB16_MIWT1_1_PLR1_SU0_SUM0_SUS256_VWA1_VWB1_WGM6_WGMXCC1_WGMXCCGn1
    SolutionIndex: 119
    SolutionNameMin: Cijk_Ailk_Bjlk_BSS_BH_Bias_HAS_SAV_UserArgs_MT32x32x128_MI16x16x1_SN_LDSB1_CLR1_GRVWA4_GRVWB8_GSU0_GSUC0_GSUWGMRR0_K1_LBSPPA256_LBSPPB256_LPA16_LPB16_MIWT1_1_PLR1_SU0_SUM0_SUS256_VWA1_VWB1_WGM6_WGMXCC1_WGMXCCGn1
    SolutionIndex: 120
    SolutionNameMin: Cijk_Ailk_Bjlk_BSS_BH_Bias_HAS_SAV_UserArgs_MT32x32x128_MI16x16x1_SN_LDSB1_CLR1_GRVWA8_GRVWB8_GSU0_GSUC0_GSUWGMRR0_K1_LBSPPA256_LBSPPB256_LPA16_LPB16_MIWT1_1_PLR1_SU0_SUM0_SUS256_VWA1_VWB1_WGM6_WGMXCC1_WGMXCCGn1
    SolutionIndex: 121
    SolutionNameMin: Cijk_Ailk_Bjlk_BSS_BH_Bias_HAS_SAV_UserArgs_MT32x32x128_MI16x16x1_SN_LDSB1_CLR1_GRVWA2_GRVWB8_GSU0_GSUC0_GSUWGMRR0_K1_LBSPPA256_LBSPPB256_LPA16_LPB16_MIWT1_1_PLR1_SU0_SUM0_SUS256_VWA1_VWB1_WGM8_WGMXCC1_WGMXCCGn1
    SolutionIndex: 122
    SolutionNameMin: Cijk_Ailk_Bjlk_BSS_BH_Bias_HAS_SAV_UserArgs_MT32x32x128_MI16x16x1_SN_LDSB1_CLR1_GRVWA4_GRVWB8_GSU0_GSUC0_GSUWGMRR0_K1_LBSPPA256_LBSPPB256_LPA16_LPB16_MIWT1_1_PLR1_SU0_SUM0_SUS256_VWA1_VWB1_WGM8_WGMXCC1_WGMXCCGn1
    SolutionIndex: 123
    SolutionNameMin: Cijk_Ailk_Bjlk_BSS_BH_Bias_HAS_SAV_UserArgs_MT32x32x128_MI16x16x1_SN_LDSB1_CLR1_GRVWA8_GRVWB8_GSU0_GSUC0_GSUWGMRR0_K1_LBSPPA256_LBSPPB256_LPA16_LPB16_MIWT1_1_PLR1_SU0_SUM0_SUS256_VWA1_VWB1_WGM8_WGMXCC1_WGMXCCGn1
- - - [128, 128, 1, 128, 128, 128, 128, 128]
    - [110, 0.42]
  - - [128, 128, 1, 256, 128, 128, 128, 128]
    - [114, 0.74]
  - - [128, 128, 1, 512, 128, 128, 128, 128]
    - [114, 1.24]
  - - [128, 128, 1, 1024, 128, 128, 128, 128]
    - [114, 1.84]
  - - [128, 128, 1, 2048, 128, 128, 128, 128]
    - [114, 2.41]
  - - [128, 128, 1, 4096, 128, 128, 128, 128]
    - [123, 2.92]
  - - [128, 128, 1, 8192, 128, 128, 128, 128]
    - [117, 3.16]
  - - [128, 256, 1, 128, 128, 128, 128, 256]
    - [86, 0.83]
  - - [128, 256, 1, 256, 128, 128, 128, 256]
    - [114, 1.45]
  - - [128, 256, 1, 512, 128, 128, 128, 256]
    - [113, 2.29]
  - - [128, 256, 1, 1024, 128, 128, 128, 256]
    - [114, 3.25]
  - - [128, 256, 1, 2048, 128, 128, 128, 256]
    - [114, 4.25]
  - - [128, 256, 1, 4096, 128, 128, 128, 256]
    - [114, 5.03]
  - - [128, 256, 1, 8192, 128, 128, 128, 256]
    - [45, 5.5]
  - - [128, 512, 1, 128, 128, 128, 128, 512]
    - [87, 1.65]
  - - [128, 512, 1, 256, 128, 128, 128, 512]
    - [88, 2.83]
  - - [128, 512, 1, 512, 128, 128, 128, 512]
    - [114, 4.48]
  - - [128, 512, 1, 1024, 128, 128, 128, 512]
    - [114, 6.47]
  - - [128, 512, 1, 2048, 128, 128, 128, 512]
    - [112, 8.39]
  - - [128, 512, 1, 4096, 128, 128, 128, 512]
    - [120, 9.81]
  - - [128, 512, 1, 8192, 128, 128, 128, 512]
    - [120, 10.72]
  - - [128, 1024, 1, 128, 128, 128, 128, 1024]
    - [89, 3.17]
  - - [128, 1024, 1, 256, 128, 128, 128, 1024]
    - [86, 5.37]
  - - [128, 1024, 1, 512, 128, 128, 128, 1024]
    - [112, 8.54]
  - - [128, 1024, 1, 1024, 128, 128, 128, 1024]
    - [111, 12.53]
  - - [128, 1024, 1, 2048, 128, 128, 128, 1024]
    - [120, 16.21]
  - - [128, 1024, 1, 4096, 128, 128, 128, 1024]
    - [114, 19.18]
  - - [128, 1024, 1, 8192, 128, 128, 128, 1024]
    - [120, 20.61]
  - - [128, 2048, 1, 128, 128, 128, 128, 2048]
    - [84, 5.75]
  - - [128, 2048, 1, 256, 128, 128, 128, 2048]
    - [83, 10.08]
  - - [128, 2048, 1, 512, 128, 128, 128, 2048]
    - [105, 15.73]
  - - [128, 2048, 1, 1024, 128, 128, 128, 2048]
    - [106, 22.74]
  - - [128, 2048, 1, 2048, 128, 128, 128, 2048]
    - [106, 29.35]
  - - [128, 2048, 1, 4096, 128, 128, 128, 2048]
    - [104, 33.65]
  - - [128, 2048, 1, 8192, 128, 128, 128, 2048]
    - [103, 35.39]
  - - [128, 4096, 1, 128, 128, 128, 128, 4096]
    - [73, 9.8]
  - - [128, 4096, 1, 256, 128, 128, 128, 4096]
    - [73, 17.12]
  - - [128, 4096, 1, 512, 128, 128, 128, 4096]
    - [71, 27.08]
  - - [128, 4096, 1, 1024, 128, 128, 128, 4096]
    - [100, 38.78]
  - - [128, 4096, 1, 2048, 128, 128, 128, 4096]
    - [100, 49.85]
  - - [128, 4096, 1, 4096, 128, 128, 128, 4096]
    - [99, 55.89]
  - - [128, 4096, 1, 8192, 128, 128, 128, 4096]
    - [101, 61.39]
  - - [128, 8192, 1, 128, 128, 128, 128, 8192]
    - [35, 15.65]
  - - [128, 8192, 1, 256, 128, 128, 128, 8192]
    - [62, 26.8]
  - - [128, 8192, 1, 512, 128, 128, 128, 8192]
    - [62, 42.22]
  - - [128, 8192, 1, 1024, 128, 128, 128, 8192]
    - [98, 58.09]
  - - [128, 8192, 1, 2048, 128, 128, 128, 8192]
    - [96, 70.54]
  - - [128, 8192, 1, 4096, 128, 128, 128, 8192]
    - [97, 80.91]
  - - [128, 8192, 1, 8192, 128, 128, 128, 8192]
    - [35, 82.55]
  - - [256, 128, 1, 128, 256, 256, 256, 128]
    - [110, 0.83]
  - - [256, 128, 1, 256, 256, 256, 256, 128]
    - [86, 1.44]
  - - [256, 128, 1, 512, 256, 256, 256, 128]
    - [114, 2.3]
  - - [256, 128, 1, 1024, 256, 256, 256, 128]
    - [114, 3.21]
  - - [256, 128, 1, 2048, 256, 256, 256, 128]
    - [114, 4.14]
  - - [256, 128, 1, 4096, 256, 256, 256, 128]
    - [115, 4.83]
  - - [256, 128, 1, 8192, 256, 256, 256, 128]
    - [46, 5.44]
  - - [256, 256, 1, 128, 256, 256, 256, 256]
    - [89, 1.58]
  - - [256, 256, 1, 256, 256, 256, 256, 256]
    - [91, 2.71]
  - - [256, 256, 1, 512, 256, 256, 256, 256]
    - [113, 4.46]
  - - [256, 256, 1, 1024, 256, 256, 256, 256]
    - [113, 6.27]
  - - [256, 256, 1, 2048, 256, 256, 256, 256]
    - [114, 7.95]
  - - [256, 256, 1, 4096, 256, 256, 256, 256]
    - [120, 9.1]
  - - [256, 256, 1, 8192, 256, 256, 256, 256]
    - [45, 10.56]
  - - [256, 512, 1, 128, 256, 256, 256, 512]
    - [90, 3.19]
  - - [256, 512, 1, 256, 256, 256, 256, 512]
    - [91, 5.35]
  - - [256, 512, 1, 512, 256, 256, 256, 512]
    - [114, 8.53]
  - - [256, 512, 1, 1024, 256, 256, 256, 512]
    - [114, 12.08]
  - - [256, 512, 1, 2048, 256, 256, 256, 512]
    - [120, 15.22]
  - - [256, 512, 1, 4096, 256, 256, 256, 512]
    - [114, 17.63]
  - - [256, 512, 1, 8192, 256, 256, 256, 512]
    - [43, 19.83]
  - - [256, 1024, 1, 128, 256, 256, 256, 1024]
    - [79, 5.65]
  - - [256, 1024, 1, 256, 256, 256, 256, 1024]
    - [79, 9.71]
  - - [256, 1024, 1, 512, 256, 256, 256, 1024]
    - [79, 15.21]
  - - [256, 1024, 1, 1024, 256, 256, 256, 1024]
    - [107, 21.63]
  - - [256, 1024, 1, 2048, 256, 256, 256, 1024]
    - [107, 27.59]
  - - [256, 1024, 1, 4096, 256, 256, 256, 1024]
    - [107, 31.81]
  - - [256, 1024, 1, 8192, 256, 256, 256, 1024]
    - [39, 36.01]
  - - [256, 2048, 1, 128, 256, 256, 256, 2048]
    - [72, 9.8]
  - - [256, 2048, 1, 256, 256, 256, 256, 2048]
    - [71, 16.9]
  - - [256, 2048, 1, 512, 256, 256, 256, 2048]
    - [73, 26.92]
  - - [256, 2048, 1, 1024, 256, 256, 256, 2048]
    - [73, 37.54]
  - - [256, 2048, 1, 2048, 256, 256, 256, 2048]
    - [73, 47.27]
  - - [256, 2048, 1, 4096, 256, 256, 256, 2048]
    - [73, 52.51]
  - - [256, 2048, 1, 8192, 256, 256, 256, 2048]
    - [40, 60.43]
  - - [256, 4096, 1, 128, 256, 256, 256, 4096]
    - [60, 15.6]
  - - [256, 4096, 1, 256, 256, 256, 256, 4096]
    - [62, 27.33]
  - - [256, 4096, 1, 512, 256, 256, 256, 4096]
    - [62, 43.18]
  - - [256, 4096, 1, 1024, 256, 256, 256, 4096]
    - [62, 60.78]
  - - [256, 4096, 1, 2048, 256, 256, 256, 4096]
    - [62, 76.45]
  - - [256, 4096, 1, 4096, 256, 256, 256, 4096]
    - [63, 84.48]
  - - [256, 4096, 1, 8192, 256, 256, 256, 4096]
    - [38, 88.3]
  - - [256, 8192, 1, 128, 256, 256, 256, 8192]
    - [23, 22.28]
  - - [256, 8192, 1, 256, 256, 256, 256, 8192]
    - [55, 38.4]
  - - [256, 8192, 1, 512, 256, 256, 256, 8192]
    - [55, 62.66]
  - - [256, 8192, 1, 1024, 256, 256, 256, 8192]
    - [59, 85.96]
  - - [256, 8192, 1, 2048, 256, 256, 256, 8192]
    - [59, 106.54]
  - - [256, 8192, 1, 4096, 256, 256, 256, 8192]
    - [57, 116.38]
  - - [256, 8192, 1, 8192, 256, 256, 256, 8192]
    - [94, 111.92]
  - - [512, 128, 1, 128, 512, 512, 512, 128]
    - [86, 1.64]
  - - [512, 128, 1, 256, 512, 512, 512, 128]
    - [91, 2.82]
  - - [512, 128, 1, 512, 512, 512, 512, 128]
    - [112, 4.41]
  - - [512, 128, 1, 1024, 512, 512, 512, 128]
    - [122, 6.3]
  - - [512, 128, 1, 2048, 512, 512, 512, 128]
    - [121, 8.09]
  - - [512, 128, 1, 4096, 512, 512, 512, 128]
    - [112, 9.56]
  - - [512, 128, 1, 8192, 512, 512, 512, 128]
    - [112, 10.51]
  - - [512, 256, 1, 128, 512, 512, 512, 256]
    - [87, 3.12]
  - - [512, 256, 1, 256, 512, 512, 512, 256]
    - [92, 5.27]
  - - [512, 256, 1, 512, 512, 512, 512, 256]
    - [116, 8.52]
  - - [512, 256, 1, 1024, 512, 512, 512, 256]
    - [117, 12.13]
  - - [512, 256, 1, 2048, 512, 512, 512, 256]
    - [119, 15.47]
  - - [512, 256, 1, 4096, 512, 512, 512, 256]
    - [117, 17.83]
  - - [512, 256, 1, 8192, 512, 512, 512, 256]
    - [44, 20.02]
  - - [512, 512, 1, 128, 512, 512, 512, 512]
    - [84, 5.67]
  - - [512, 512, 1, 256, 512, 512, 512, 512]
    - [81, 9.78]
  - - [512, 512, 1, 512, 512, 512, 512, 512]
    - [81, 15.35]
  - - [512, 512, 1, 1024, 512, 512, 512, 512]
    - [107, 22.05]
  - - [512, 512, 1, 2048, 512, 512, 512, 512]
    - [107, 27.88]
  - - [512, 512, 1, 4096, 512, 512, 512, 512]
    - [107, 32.02]
  - - [512, 512, 1, 8192, 512, 512, 512, 512]
    - [42, 37.15]
  - - [512, 1024, 1, 128, 512, 512, 512, 1024]
    - [70, 9.82]
  - - [512, 1024, 1, 256, 512, 512, 512, 1024]
    - [75, 16.97]
  - - [512, 1024, 1, 512, 512, 512, 512, 1024]
    - [75, 26.82]
  - - [512, 1024, 1, 1024, 512, 512, 512, 1024]
    - [73, 38.06]
  - - [512, 1024, 1, 2048, 512, 512, 512, 1024]
    - [76, 46.92]
  - - [512, 1024, 1, 4096, 512, 512, 512, 1024]
    - [74, 53.32]
  - - [512, 1024, 1, 8192, 512, 512, 512, 1024]
    - [39, 63.17]
  - - [512, 2048, 1, 128, 512, 512, 512, 2048]
    - [62, 15.65]
  - - [512, 2048, 1, 256, 512, 512, 512, 2048]
    - [61, 27.02]
  - - [512, 2048, 1, 512, 512, 512, 512, 2048]
    - [62, 42.77]
  - - [512, 2048, 1, 1024, 512, 512, 512, 2048]
    - [62, 60.21]
  - - [512, 2048, 1, 2048, 512, 512, 512, 2048]
    - [62, 76.19]
  - - [512, 2048, 1, 4096, 512, 512, 512, 2048]
    - [62, 86.4]
  - - [512, 2048, 1, 8192, 512, 512, 512, 2048]
    - [34, 88.75]
  - - [512, 4096, 1, 128, 512, 512, 512, 4096]
    - [23, 22.61]
  - - [512, 4096, 1, 256, 512, 512, 512, 4096]
    - [55, 39.91]
  - - [512, 4096, 1, 512, 512, 512, 512, 4096]
    - [55, 64.98]
  - - [512, 4096, 1, 1024, 512, 512, 512, 4096]
    - [55, 92.45]
  - - [512, 4096, 1, 2048, 512, 512, 512, 4096]
    - [55, 113.53]
  - - [512, 4096, 1, 4096, 512, 512, 512, 4096]
    - [57, 122.87]
  - - [512, 4096, 1, 8192, 512, 512, 512, 4096]
    - [95, 114.48]
  - - [512, 8192, 1, 128, 512, 512, 512, 8192]
    - [13, 29.56]
  - - [512, 8192, 1, 256, 512, 512, 512, 8192]
    - [15, 50.97]
  - - [512, 8192, 1, 512, 512, 512, 512, 8192]
    - [15, 79.02]
  - - [512, 8192, 1, 1024, 512, 512, 512, 8192]
    - [13, 108.15]
  - - [512, 8192, 1, 2048, 512, 512, 512, 8192]
    - [20, 128.76]
  - - [512, 8192, 1, 4096, 512, 512, 512, 8192]
    - [15, 120.32]
  - - [512, 8192, 1, 8192, 512, 512, 512, 8192]
    - [17, 134.18]
  - - [1024, 128, 1, 128, 1024, 1024, 1024, 128]
    - [110, 3.08]
  - - [1024, 128, 1, 256, 1024, 1024, 1024, 128]
    - [93, 5.3]
  - - [1024, 128, 1, 512, 1024, 1024, 1024, 128]
    - [121, 8.43]
  - - [1024, 128, 1, 1024, 1024, 1024, 1024, 128]
    - [120, 12.25]
  - - [1024, 128, 1, 2048, 1024, 1024, 1024, 128]
    - [114, 15.69]
  - - [1024, 128, 1, 4096, 1024, 1024, 1024, 128]
    - [118, 18.56]
  - - [1024, 128, 1, 8192, 1024, 1024, 1024, 128]
    - [120, 20.2]
  - - [1024, 256, 1, 128, 1024, 1024, 1024, 256]
    - [81, 5.48]
  - - [1024, 256, 1, 256, 1024, 1024, 1024, 256]
    - [82, 9.52]
  - - [1024, 256, 1, 512, 1024, 1024, 1024, 256]
    - [85, 15.17]
  - - [1024, 256, 1, 1024, 1024, 1024, 1024, 256]
    - [108, 21.47]
  - - [1024, 256, 1, 2048, 1024, 1024, 1024, 256]
    - [108, 27.79]
  - - [1024, 256, 1, 4096, 1024, 1024, 1024, 256]
    - [108, 31.99]
  - - [1024, 256, 1, 8192, 1024, 1024, 1024, 256]
    - [39, 36.39]
  - - [1024, 512, 1, 128, 1024, 1024, 1024, 512]
    - [75, 9.91]
  - - [1024, 512, 1, 256, 1024, 1024, 1024, 512]
    - [75, 16.99]
  - - [1024, 512, 1, 512, 1024, 1024, 1024, 512]
    - [75, 26.94]
  - - [1024, 512, 1, 1024, 1024, 1024, 1024, 512]
    - [75, 37.59]
  - - [1024, 512, 1, 2048, 1024, 1024, 1024, 512]
    - [75, 47.1]
  - - [1024, 512, 1, 4096, 1024, 1024, 1024, 512]
    - [75, 53.21]
  - - [1024, 512, 1, 8192, 1024, 1024, 1024, 512]
    - [42, 62.97]
  - - [1024, 1024, 1, 128, 1024, 1024, 1024, 1024]
    - [67, 15.49]
  - - [1024, 1024, 1, 256, 1024, 1024, 1024, 1024]
    - [63, 26.89]
  - - [1024, 1024, 1, 512, 1024, 1024, 1024, 1024]
    - [63, 42.43]
  - - [1024, 1024, 1, 1024, 1024, 1024, 1024, 1024]
    - [69, 59.58]
  - - [1024, 1024, 1, 2048, 1024, 1024, 1024, 1024]
    - [63, 74.92]
  - - [1024, 1024, 1, 4096, 1024, 1024, 1024, 1024]
    - [64, 84.58]
  - - [1024, 1024, 1, 8192, 1024, 1024, 1024, 1024]
    - [30, 84.5]
  - - [1024, 2048, 1, 128, 1024, 1024, 1024, 2048]
    - [23, 22.26]
  - - [1024, 2048, 1, 256, 1024, 1024, 1024, 2048]
    - [55, 39.23]
  - - [1024, 2048, 1, 512, 1024, 1024, 1024, 2048]
    - [53, 62.78]
  - - [1024, 2048, 1, 1024, 1024, 1024, 1024, 2048]
    - [55, 91.36]
  - - [1024, 2048, 1, 2048, 1024, 1024, 1024, 2048]
    - [57, 114.92]
  - - [1024, 2048, 1, 4096, 1024, 1024, 1024, 2048]
    - [55, 123.48]
  - - [1024, 2048, 1, 8192, 1024, 1024, 1024, 2048]
    - [57, 116.38]
  - - [1024, 4096, 1, 128, 1024, 1024, 1024, 4096]
    - [13, 29.28]
  - - [1024, 4096, 1, 256, 1024, 1024, 1024, 4096]
    - [19, 50.22]
  - - [1024, 4096, 1, 512, 1024, 1024, 1024, 4096]
    - [15, 78.74]
  - - [1024, 4096, 1, 1024, 1024, 1024, 1024, 4096]
    - [15, 109.32]
  - - [1024, 4096, 1, 2048, 1024, 1024, 1024, 4096]
    - [20, 127.08]
  - - [1024, 4096, 1, 4096, 1024, 1024, 1024, 4096]
    - [17, 124.3]
  - - [1024, 4096, 1, 8192, 1024, 1024, 1024, 4096]
    - [16, 136.29]
  - - [1024, 8192, 1, 128, 1024, 1024, 1024, 8192]
    - [13, 33.85]
  - - [1024, 8192, 1, 256, 1024, 1024, 1024, 8192]
    - [13, 57.3]
  - - [1024, 8192, 1, 512, 1024, 1024, 1024, 8192]
    - [15, 86.12]
  - - [1024, 8192, 1, 1024, 1024, 1024, 1024, 8192]
    - [4, 114.63]
  - - [1024, 8192, 1, 2048, 1024, 1024, 1024, 8192]
    - [4, 125.72]
  - - [1024, 8192, 1, 4096, 1024, 1024, 1024, 8192]
    - [7, 143.18]
  - - [1024, 8192, 1, 8192, 1024, 1024, 1024, 8192]
    - [5, 160.24]
  - - [2048, 128, 1, 128, 2048, 2048, 2048, 128]
    - [80, 5.39]
  - - [2048, 128, 1, 256, 2048, 2048, 2048, 128]
    - [79, 9.84]
  - - [2048, 128, 1, 512, 2048, 2048, 2048, 128]
    - [106, 15.44]
  - - [2048, 128, 1, 1024, 2048, 2048, 2048, 128]
    - [108, 22.22]
  - - [2048, 128, 1, 2048, 2048, 2048, 2048, 128]
    - [108, 29.0]
  - - [2048, 128, 1, 4096, 2048, 2048, 2048, 128]
    - [108, 33.82]
  - - [2048, 128, 1, 8192, 2048, 2048, 2048, 128]
    - [109, 34.54]
  - - [2048, 256, 1, 128, 2048, 2048, 2048, 256]
    - [78, 9.58]
  - - [2048, 256, 1, 256, 2048, 2048, 2048, 256]
    - [78, 16.88]
  - - [2048, 256, 1, 512, 2048, 2048, 2048, 256]
    - [75, 27.04]
  - - [2048, 256, 1, 1024, 2048, 2048, 2048, 256]
    - [75, 37.74]
  - - [2048, 256, 1, 2048, 2048, 2048, 2048, 256]
    - [78, 46.63]
  - - [2048, 256, 1, 4096, 2048, 2048, 2048, 256]
    - [75, 52.28]
  - - [2048, 256, 1, 8192, 2048, 2048, 2048, 256]
    - [41, 59.8]
  - - [2048, 512, 1, 128, 2048, 2048, 2048, 512]
    - [69, 15.6]
  - - [2048, 512, 1, 256, 2048, 2048, 2048, 512]
    - [69, 26.86]
  - - [2048, 512, 1, 512, 2048, 2048, 2048, 512]
    - [63, 42.72]
  - - [2048, 512, 1, 1024, 2048, 2048, 2048, 512]
    - [63, 59.35]
  - - [2048, 512, 1, 2048, 2048, 2048, 2048, 512]
    - [65, 74.38]
  - - [2048, 512, 1, 4096, 2048, 2048, 2048, 512]
    - [63, 83.64]
  - - [2048, 512, 1, 8192, 2048, 2048, 2048, 512]
    - [31, 88.45]
  - - [2048, 1024, 1, 128, 2048, 2048, 2048, 1024]
    - [23, 22.15]
  - - [2048, 1024, 1, 256, 2048, 2048, 2048, 1024]
    - [59, 39.16]
  - - [2048, 1024, 1, 512, 2048, 2048, 2048, 1024]
    - [57, 63.04]
  - - [2048, 1024, 1, 1024, 2048, 2048, 2048, 1024]
    - [56, 90.17]
  - - [2048, 1024, 1, 2048, 2048, 2048, 2048, 1024]
    - [59, 114.3]
  - - [2048, 1024, 1, 4096, 2048, 2048, 2048, 1024]
    - [57, 124.98]
  - - [2048, 1024, 1, 8192, 2048, 2048, 2048, 1024]
    - [58, 115.74]
  - - [2048, 2048, 1, 128, 2048, 2048, 2048, 2048]
    - [13, 28.04]
  - - [2048, 2048, 1, 256, 2048, 2048, 2048, 2048]
    - [15, 48.93]
  - - [2048, 2048, 1, 512, 2048, 2048, 2048, 2048]
    - [15, 76.77]
  - - [2048, 2048, 1, 1024, 2048, 2048, 2048, 2048]
    - [15, 105.65]
  - - [2048, 2048, 1, 2048, 2048, 2048, 2048, 2048]
    - [18, 128.93]
  - - [2048, 2048, 1, 4096, 2048, 2048, 2048, 2048]
    - [18, 123.59]
  - - [2048, 2048, 1, 8192, 2048, 2048, 2048, 2048]
    - [17, 138.17]
  - - [2048, 4096, 1, 128, 2048, 2048, 2048, 4096]
    - [10, 32.23]
  - - [2048, 4096, 1, 256, 2048, 2048, 2048, 4096]
    - [13, 54.76]
  - - [2048, 4096, 1, 512, 2048, 2048, 2048, 4096]
    - [4, 84.19]
  - - [2048, 4096, 1, 1024, 2048, 2048, 2048, 4096]
    - [4, 113.77]
  - - [2048, 4096, 1, 2048, 2048, 2048, 2048, 4096]
    - [13, 125.11]
  - - [2048, 4096, 1, 4096, 2048, 2048, 2048, 4096]
    - [4, 142.88]
  - - [2048, 4096, 1, 8192, 2048, 2048, 2048, 4096]
    - [6, 155.81]
  - - [2048, 8192, 1, 128, 2048, 2048, 2048, 8192]
    - [15, 34.46]
  - - [2048, 8192, 1, 256, 2048, 2048, 2048, 8192]
    - [27, 57.94]
  - - [2048, 8192, 1, 512, 2048, 2048, 2048, 8192]
    - [59, 86.86]
  - - [2048, 8192, 1, 1024, 2048, 2048, 2048, 8192]
    - [13, 113.53]
  - - [2048, 8192, 1, 2048, 2048, 2048, 2048, 8192]
    - [15, 143.03]
  - - [2048, 8192, 1, 4096, 2048, 2048, 2048, 8192]
    - [15, 167.56]
  - - [2048, 8192, 1, 8192, 2048, 2048, 2048, 8192]
    - [49, 178.04]
  - - [4096, 128, 1, 128, 4096, 4096, 4096, 128]
    - [72, 9.62]
  - - [4096, 128, 1, 256, 4096, 4096, 4096, 128]
    - [71, 16.79]
  - - [4096, 128, 1, 512, 4096, 4096, 4096, 128]
    - [73, 26.43]
  - - [4096, 128, 1, 1024, 4096, 4096, 4096, 128]
    - [77, 37.45]
  - - [4096, 128, 1, 2048, 4096, 4096, 4096, 128]
    - [77, 45.62]
  - - [4096, 128, 1, 4096, 4096, 4096, 4096, 128]
    - [102, 50.13]
  - - [4096, 128, 1, 8192, 4096, 4096, 4096, 128]
    - [36, 55.59]
  - - [4096, 256, 1, 128, 4096, 4096, 4096, 256]
    - [65, 15.48]
  - - [4096, 256, 1, 256, 4096, 4096, 4096, 256]
    - [66, 26.98]
  - - [4096, 256, 1, 512, 4096, 4096, 4096, 256]
    - [66, 43.23]
  - - [4096, 256, 1, 1024, 4096, 4096, 4096, 256]
    - [69, 59.6]
  - - [4096, 256, 1, 2048, 4096, 4096, 4096, 256]
    - [68, 74.91]
  - - [4096, 256, 1, 4096, 4096, 4096, 4096, 256]
    - [64, 82.32]
  - - [4096, 256, 1, 8192, 4096, 4096, 4096, 256]
    - [32, 84.83]
  - - [4096, 512, 1, 128, 4096, 4096, 4096, 512]
    - [24, 21.6]
  - - [4096, 512, 1, 256, 4096, 4096, 4096, 512]
    - [58, 37.98]
  - - [4096, 512, 1, 512, 4096, 4096, 4096, 512]
    - [59, 61.91]
  - - [4096, 512, 1, 1024, 4096, 4096, 4096, 512]
    - [58, 90.21]
  - - [4096, 512, 1, 2048, 4096, 4096, 4096, 512]
    - [58, 112.52]
  - - [4096, 512, 1, 4096, 4096, 4096, 4096, 512]
    - [58, 124.28]
  - - [4096, 512, 1, 8192, 4096, 4096, 4096, 512]
    - [59, 113.89]
  - - [4096, 1024, 1, 128, 4096, 4096, 4096, 1024]
    - [15, 27.18]
  - - [4096, 1024, 1, 256, 4096, 4096, 4096, 1024]
    - [15, 46.93]
  - - [4096, 1024, 1, 512, 4096, 4096, 4096, 1024]
    - [18, 74.56]
  - - [4096, 1024, 1, 1024, 4096, 4096, 4096, 1024]
    - [22, 105.47]
  - - [4096, 1024, 1, 2048, 4096, 4096, 4096, 1024]
    - [22, 126.91]
  - - [4096, 1024, 1, 4096, 4096, 4096, 4096, 1024]
    - [55, 126.88]
  - - [4096, 1024, 1, 8192, 4096, 4096, 4096, 1024]
    - [15, 139.09]
  - - [4096, 2048, 1, 128, 4096, 4096, 4096, 2048]
    - [13, 31.56]
  - - [4096, 2048, 1, 256, 4096, 4096, 4096, 2048]
    - [15, 53.6]
  - - [4096, 2048, 1, 512, 4096, 4096, 4096, 2048]
    - [18, 83.0]
  - - [4096, 2048, 1, 1024, 4096, 4096, 4096, 2048]
    - [6, 109.56]
  - - [4096, 2048, 1, 2048, 4096, 4096, 4096, 2048]
    - [15, 128.33]
  - - [4096, 2048, 1, 4096, 4096, 4096, 4096, 2048]
    - [15, 144.1]
  - - [4096, 2048, 1, 8192, 4096, 4096, 4096, 2048]
    - [9, 156.52]
  - - [4096, 4096, 1, 128, 4096, 4096, 4096, 4096]
    - [13, 33.42]
  - - [4096, 4096, 1, 256, 4096, 4096, 4096, 4096]
    - [25, 56.81]
  - - [4096, 4096, 1, 512, 4096, 4096, 4096, 4096]
    - [56, 86.51]
  - - [4096, 4096, 1, 1024, 4096, 4096, 4096, 4096]
    - [13, 110.46]
  - - [4096, 4096, 1, 2048, 4096, 4096, 4096, 4096]
    - [15, 141.6]
  - - [4096, 4096, 1, 4096, 4096, 4096, 4096, 4096]
    - [47, 160.95]
  - - [4096, 4096, 1, 8192, 4096, 4096, 4096, 4096]
    - [48, 178.9]
  - - [4096, 8192, 1, 128, 4096, 4096, 4096, 8192]
    - [29, 35.35]
  - - [4096, 8192, 1, 256, 4096, 4096, 4096, 8192]
    - [54, 60.07]
  - - [4096, 8192, 1, 512, 4096, 4096, 4096, 8192]
    - [13, 90.61]
  - - [4096, 8192, 1, 1024, 4096, 4096, 4096, 8192]
    - [52, 122.31]
  - - [4096, 8192, 1, 2048, 4096, 4096, 4096, 8192]
    - [2, 158.03]
  - - [4096, 8192, 1, 4096, 4096, 4096, 4096, 8192]
    - [50, 180.85]
  - - [4096, 8192, 1, 8192, 4096, 4096, 4096, 8192]
    - [1, 207.6]
  - - [8192, 128, 1, 128, 8192, 8192, 8192, 128]
    - [37, 15.05]
  - - [8192, 128, 1, 256, 8192, 8192, 8192, 128]
    - [67, 26.03]
  - - [8192, 128, 1, 512, 8192, 8192, 8192, 128]
    - [69, 41.41]
  - - [8192, 128, 1, 1024, 8192, 8192, 8192, 128]
    - [66, 57.8]
  - - [8192, 128, 1, 2048, 8192, 8192, 8192, 128]
    - [69, 70.04]
  - - [8192, 128, 1, 4096, 8192, 8192, 8192, 128]
    - [69, 78.52]
  - - [8192, 128, 1, 8192, 8192, 8192, 8192, 128]
    - [33, 81.96]
  - - [8192, 256, 1, 128, 8192, 8192, 8192, 256]
    - [23, 21.86]
  - - [8192, 256, 1, 256, 8192, 8192, 8192, 256]
    - [59, 37.82]
  - - [8192, 256, 1, 512, 8192, 8192, 8192, 256]
    - [59, 62.37]
  - - [8192, 256, 1, 1024, 8192, 8192, 8192, 256]
    - [59, 85.92]
  - - [8192, 256, 1, 2048, 8192, 8192, 8192, 256]
    - [57, 109.2]
  - - [8192, 256, 1, 4096, 8192, 8192, 8192, 256]
    - [59, 119.57]
  - - [8192, 256, 1, 8192, 8192, 8192, 8192, 256]
    - [58, 111.32]
  - - [8192, 512, 1, 128, 8192, 8192, 8192, 512]
    - [16, 28.23]
  - - [8192, 512, 1, 256, 8192, 8192, 8192, 512]
    - [19, 48.83]
  - - [8192, 512, 1, 512, 8192, 8192, 8192, 512]
    - [20, 77.93]
  - - [8192, 512, 1, 1024, 8192, 8192, 8192, 512]
    - [18, 108.79]
  - - [8192, 512, 1, 2048, 8192, 8192, 8192, 512]
    - [20, 127.11]
  - - [8192, 512, 1, 4096, 8192, 8192, 8192, 512]
    - [18, 125.07]
  - - [8192, 512, 1, 8192, 8192, 8192, 8192, 512]
    - [15, 136.89]
  - - [8192, 1024, 1, 128, 8192, 8192, 8192, 1024]
    - [15, 32.53]
  - - [8192, 1024, 1, 256, 8192, 8192, 8192, 1024]
    - [13, 55.1]
  - - [8192, 1024, 1, 512, 8192, 8192, 8192, 1024]
    - [13, 82.73]
  - - [8192, 1024, 1, 1024, 8192, 8192, 8192, 1024]
    - [8, 110.78]
  - - [8192, 1024, 1, 2048, 8192, 8192, 8192, 1024]
    - [14, 131.76]
  - - [8192, 1024, 1, 4096, 8192, 8192, 8192, 1024]
    - [51, 149.06]
  - - [8192, 1024, 1, 8192, 8192, 8192, 8192, 1024]
    - [3, 155.44]
  - - [8192, 2048, 1, 128, 8192, 8192, 8192, 2048]
    - [13, 34.15]
  - - [8192, 2048, 1, 256, 8192, 8192, 8192, 2048]
    - [28, 57.55]
  - - [8192, 2048, 1, 512, 8192, 8192, 8192, 2048]
    - [59, 88.89]
  - - [8192, 2048, 1, 1024, 8192, 8192, 8192, 2048]
    - [13, 113.95]
  - - [8192, 2048, 1, 2048, 8192, 8192, 8192, 2048]
    - [14, 141.79]
  - - [8192, 2048, 1, 4096, 8192, 8192, 8192, 2048]
    - [0, 168.79]
  - - [8192, 2048, 1, 8192, 8192, 8192, 8192, 2048]
    - [47, 189.9]
  - - [8192, 4096, 1, 128, 8192, 8192, 8192, 4096]
    - [26, 36.23]
  - - [8192, 4096, 1, 256, 8192, 8192, 8192, 4096]
    - [12, 61.34]
  - - [8192, 4096, 1, 512, 8192, 8192, 8192, 4096]
    - [15, 93.25]
  - - [8192, 4096, 1, 1024, 8192, 8192, 8192, 4096]
    - [11, 122.62]
  - - [8192, 4096, 1, 2048, 8192, 8192, 8192, 4096]
    - [4, 158.11]
  - - [8192, 4096, 1, 4096, 8192, 8192, 8192, 4096]
    - [4, 187.84]
  - - [8192, 4096, 1, 8192, 8192, 8192, 8192, 4096]
    - [4, 206.86]
  - - [8192, 8192, 1, 128, 8192, 8192, 8192, 8192]
    - [21, 39.0]
  - - [8192, 8192, 1, 256, 8192, 8192, 8192, 8192]
    - [21, 64.69]
  - - [8192, 8192, 1, 512, 8192, 8192, 8192, 8192]
    - [20, 98.79]
  - - [8192, 8192, 1, 1024, 8192, 8192, 8192, 8192]
    - [13, 136.29]
  - - [8192, 8192, 1, 2048, 8192, 8192, 8192, 8192]
    - [50, 171.71]
  - - [8192, 8192, 1, 4096, 8192, 8192, 8192, 8192]
    - [4, 195.3]
  - - [8192, 8192, 1, 8192, 8192, 8192, 8192, 8192]
    - [6, 209.91]
- null
- null
- ExperimentalStreamK
- GridBased
