projects/hipblaslt/library/src/amd_detail/rocblaslt/src/Tensile/Logic/asm_full/aquavanjaram/gfx942_228cu/StreamK/aquavanjaram942_Cijk_Alik_Bljk_B8NB8NS_BH_Bias_HAS_SAV_UserArgs.yaml
- {MinimumRequiredVersion: 4.33.0}
- aquavanjaram942
- {Architecture: gfx942, CUCount: 228}
- [Device 0049, Device 0050]
    SolutionIndex: 0
    SolutionNameMin: Cijk_Alik_Bljk_B8NB8NS_BH_Bias_HAS_SAV_UserArgs_MT256x256x64_MI16x16x1_SN_LDSB1_CLR1_GRVWA8_GRVWB16_GSU0_GSUC0_GSUWGMRR0_K1_LBSPPA512_LBSPPB512_LPA8_LPB16_LRVW8_MIWT8_8_PLR1_SU0_SUM0_SUS64_VWA8_VWB8_WGM1_WGMXCC1_WGMXCCGn1
    SolutionIndex: 1
    SolutionNameMin: Cijk_Alik_Bljk_B8NB8NS_BH_Bias_HAS_SAV_UserArgs_MT256x256x64_MI16x16x1_SN_LDSB1_CLR1_GRVWA8_GRVWB16_GSU0_GSUC0_GSUWGMRR0_K1_LBSPPA512_LBSPPB512_LPA8_LPB16_LRVW8_MIWT8_8_PLR1_SU0_SUM0_SUS64_VWA8_VWB8_WGM4_WGMXCC1_WGMXCCGn1
    SolutionIndex: 2
    SolutionNameMin: Cijk_Alik_Bljk_B8NB8NS_BH_Bias_HAS_SAV_UserArgs_MT256x256x64_MI16x16x1_SN_LDSB1_CLR1_GRVWA16_GRVWB16_GSU0_GSUC0_GSUWGMRR0_K1_LBSPPA512_LBSPPB512_LPA16_LPB16_LRVW8_MIWT8_8_PLR1_SU0_SUM0_SUS64_VWA8_VWB8_WGM4_WGMXCC1_WGMXCCGn1
    SolutionIndex: 3
    SolutionNameMin: Cijk_Alik_Bljk_B8NB8NS_BH_Bias_HAS_SAV_UserArgs_MT256x256x64_MI16x16x1_SN_LDSB1_CLR1_GRVWA8_GRVWB16_GSU0_GSUC0_GSUWGMRR0_K1_LBSPPA512_LBSPPB512_LPA8_LPB16_LRVW8_MIWT8_8_PLR1_SU0_SUM0_SUS64_VWA8_VWB8_WGM6_WGMXCC1_WGMXCCGn1
    SolutionIndex: 4
    SolutionNameMin: Cijk_Alik_Bljk_B8NB8NS_BH_Bias_HAS_SAV_UserArgs_MT256x256x64_MI16x16x1_SN_LDSB1_CLR1_GRVWA8_GRVWB16_GSU0_GSUC0_GSUWGMRR0_K1_LBSPPA512_LBSPPB512_LPA8_LPB16_LRVW8_MIWT8_8_PLR1_SU0_SUM0_SUS64_VWA8_VWB8_WGM8_WGMXCC1_WGMXCCGn1
    SolutionIndex: 5
    SolutionNameMin: Cijk_Alik_Bljk_B8NB8NS_BH_Bias_HAS_SAV_UserArgs_MT256x256x64_MI16x16x1_SN_LDSB1_CLR1_GRVWA16_GRVWB16_GSU0_GSUC0_GSUWGMRR0_K1_LBSPPA512_LBSPPB512_LPA16_LPB16_LRVW8_MIWT8_8_PLR1_SU0_SUM0_SUS64_VWA8_VWB8_WGM8_WGMXCC1_WGMXCCGn1
    SolutionIndex: 6
    SolutionNameMin: Cijk_Alik_Bljk_B8NB8NS_BH_Bias_HAS_SAV_UserArgs_MT128x256x64_MI16x16x1_SN_LDSB1_CLR1_GRVWA16_GRVWB16_GSU0_GSUC0_GSUWGMRR0_K1_LBSPPA256_LBSPPB512_LPA16_LPB16_LRVW8_MIWT4_8_PLR1_SU0_SUM0_SUS64_VWA4_VWB8_WGM6_WGMXCC1_WGMXCCGn1
    SolutionIndex: 7
    SolutionNameMin: Cijk_Alik_Bljk_B8NB8NS_BH_Bias_HAS_SAV_UserArgs_MT256x128x64_MI16x16x1_SN_LDSB1_CLR1_GRVWA8_GRVWB16_GSU0_GSUC0_GSUWGMRR0_K1_LBSPPA512_LBSPPB256_LPA8_LPB16_LRVW8_MIWT8_4_PLR1_SU0_SUM0_SUS64_VWA8_VWB4_WGM1_WGMXCC1_WGMXCCGn1
    SolutionIndex: 8
    SolutionNameMin: Cijk_Alik_Bljk_B8NB8NS_BH_Bias_HAS_SAV_UserArgs_MT256x128x64_MI16x16x1_SN_LDSB1_CLR1_GRVWA8_GRVWB16_GSU0_GSUC0_GSUWGMRR0_K1_LBSPPA512_LBSPPB256_LPA8_LPB16_LRVW8_MIWT8_4_PLR1_SU0_SUM0_SUS64_VWA8_VWB4_WGM4_WGMXCC1_WGMXCCGn1
    SolutionIndex: 9
    SolutionNameMin: Cijk_Alik_Bljk_B8NB8NS_BH_Bias_HAS_SAV_UserArgs_MT256x128x64_MI16x16x1_SN_LDSB1_CLR1_GRVWA8_GRVWB16_GSU0_GSUC0_GSUWGMRR0_K1_LBSPPA512_LBSPPB256_LPA8_LPB16_LRVW8_MIWT8_4_PLR1_SU0_SUM0_SUS64_VWA8_VWB4_WGM6_WGMXCC1_WGMXCCGn1
    SolutionIndex: 10
    SolutionNameMin: Cijk_Alik_Bljk_B8NB8NS_BH_Bias_HAS_SAV_UserArgs_MT128x128x64_MI16x16x1_SN_LDSB1_CLR1_GRVWA8_GRVWB16_GSU0_GSUC0_GSUWGMRR0_K1_LBSPPA512_LBSPPB128_LPA8_LPB16_LRVW8_MIWT8_2_PLR1_SU0_SUM0_SUS64_VWA8_VWB2_WGM1_WGMXCC1_WGMXCCGn1
    SolutionIndex: 11
    SolutionNameMin: Cijk_Alik_Bljk_B8NB8NS_BH_Bias_HAS_SAV_UserArgs_MT128x64x64_MI16x16x1_SN_LDSB0_CLR1_GRVWA8_GRVWB16_GSU0_GSUC0_GSUWGMRR0_K1_LBSPPA512_LBSPPB128_LPA8_LPB16_LRVW8_MIWT8_1_PLR1_SU0_SUM0_SUS64_VWA8_VWB1_WGM1_WGMXCC1_WGMXCCGn1
    SolutionIndex: 12
    SolutionNameMin: Cijk_Alik_Bljk_B8NB8NS_BH_Bias_HAS_SAV_UserArgs_MT128x128x64_MI16x16x1_SN_LDSB1_CLR1_GRVWA8_GRVWB16_GSU0_GSUC0_GSUWGMRR0_K1_LBSPPA256_LBSPPB256_LPA8_LPB16_LRVW8_MIWT4_4_PLR1_SU0_SUM0_SUS64_VWA4_VWB4_WGM1_WGMXCC1_WGMXCCGn1
    SolutionIndex: 13
    SolutionNameMin: Cijk_Alik_Bljk_B8NB8NS_BH_Bias_HAS_SAV_UserArgs_MT128x64x64_MI16x16x1_SN_LDSB0_CLR1_GRVWA16_GRVWB8_GSU0_GSUC0_GSUWGMRR0_K1_LBSPPA256_LBSPPB128_LPA16_LPB8_LRVW8_MIWT4_2_PLR1_SU0_SUM0_SUS64_VWA4_VWB2_WGM1_WGMXCC1_WGMXCCGn1
    SolutionIndex: 14
    SolutionNameMin: Cijk_Alik_Bljk_B8NB8NS_BH_Bias_HAS_SAV_UserArgs_MT128x64x64_MI16x16x1_SN_LDSB0_CLR1_GRVWA8_GRVWB16_GSU0_GSUC0_GSUWGMRR0_K1_LBSPPA256_LBSPPB128_LPA8_LPB16_LRVW8_MIWT4_2_PLR1_SU0_SUM0_SUS64_VWA4_VWB2_WGM1_WGMXCC1_WGMXCCGn1
    SolutionIndex: 15
    SolutionNameMin: Cijk_Alik_Bljk_B8NB8NS_BH_Bias_HAS_SAV_UserArgs_MT128x64x64_MI16x16x1_SN_LDSB0_CLR1_GRVWA16_GRVWB16_GSU0_GSUC0_GSUWGMRR0_K1_LBSPPA256_LBSPPB128_LPA16_LPB16_LRVW8_MIWT4_2_PLR1_SU0_SUM0_SUS64_VWA4_VWB2_WGM1_WGMXCC1_WGMXCCGn1
    SolutionIndex: 16
    SolutionNameMin: Cijk_Alik_Bljk_B8NB8NS_BH_Bias_HAS_SAV_UserArgs_MT128x64x64_MI16x16x1_SN_LDSB0_CLR1_GRVWA8_GRVWB16_GSU0_GSUC0_GSUWGMRR0_K1_LBSPPA256_LBSPPB128_LPA8_LPB16_LRVW8_MIWT4_2_PLR1_SU0_SUM0_SUS64_VWA4_VWB2_WGM4_WGMXCC1_WGMXCCGn1
    SolutionIndex: 17
    SolutionNameMin: Cijk_Alik_Bljk_B8NB8NS_BH_Bias_HAS_SAV_UserArgs_MT128x64x64_MI16x16x1_SN_LDSB0_CLR1_GRVWA8_GRVWB16_GSU0_GSUC0_GSUWGMRR0_K1_LBSPPA256_LBSPPB128_LPA8_LPB16_LRVW8_MIWT4_2_PLR1_SU0_SUM0_SUS64_VWA4_VWB2_WGM6_WGMXCC1_WGMXCCGn1
    SolutionIndex: 18
    SolutionNameMin: Cijk_Alik_Bljk_B8NB8NS_BH_Bias_HAS_SAV_UserArgs_MT128x64x64_MI16x16x1_SN_LDSB0_CLR1_GRVWA8_GRVWB16_GSU0_GSUC0_GSUWGMRR0_K1_LBSPPA256_LBSPPB128_LPA8_LPB16_LRVW8_MIWT4_2_PLR1_SU0_SUM0_SUS64_VWA4_VWB2_WGM8_WGMXCC1_WGMXCCGn1
    SolutionIndex: 19
    SolutionNameMin: Cijk_Alik_Bljk_B8NB8NS_BH_Bias_HAS_SAV_UserArgs_MT64x64x64_MI16x16x1_SN_LDSB0_CLR1_GRVWA8_GRVWB8_GSU0_GSUC0_GSUWGMRR0_K1_LBSPPA128_LBSPPB128_LPA8_LPB8_LRVW8_MIWT2_2_PLR1_SU0_SUM0_SUS64_VWA2_VWB2_WGM1_WGMXCC1_WGMXCCGn1
    SolutionIndex: 20
    SolutionNameMin: Cijk_Alik_Bljk_B8NB8NS_BH_Bias_HAS_SAV_UserArgs_MT64x64x64_MI16x16x1_SN_LDSB0_CLR1_GRVWA8_GRVWB16_GSU0_GSUC0_GSUWGMRR0_K1_LBSPPA128_LBSPPB128_LPA8_LPB16_LRVW8_MIWT2_2_PLR1_SU0_SUM0_SUS64_VWA2_VWB2_WGM1_WGMXCC1_WGMXCCGn1
    SolutionIndex: 21
    SolutionNameMin: Cijk_Alik_Bljk_B8NB8NS_BH_Bias_HAS_SAV_UserArgs_MT64x64x64_MI16x16x1_SN_LDSB0_CLR1_GRVWA16_GRVWB16_GSU0_GSUC0_GSUWGMRR0_K1_LBSPPA128_LBSPPB128_LPA16_LPB16_LRVW8_MIWT2_2_PLR1_SU0_SUM0_SUS64_VWA2_VWB2_WGM1_WGMXCC1_WGMXCCGn1
    SolutionIndex: 22
    SolutionNameMin: Cijk_Alik_Bljk_B8NB8NS_BH_Bias_HAS_SAV_UserArgs_MT64x32x64_MI16x16x1_SN_LDSB0_CLR1_GRVWA8_GRVWB8_GSU0_GSUC0_GSUWGMRR0_K1_LBSPPA128_LBSPPB128_LPA8_LPB8_LRVW8_MIWT2_1_PLR1_SU0_SUM0_SUS64_VWA2_VWB1_WGM1_WGMXCC1_WGMXCCGn1
    SolutionIndex: 23
    SolutionNameMin: Cijk_Alik_Bljk_B8NB8NS_BH_Bias_HAS_SAV_UserArgs_MT64x32x64_MI16x16x1_SN_LDSB0_CLR1_GRVWA16_GRVWB8_GSU0_GSUC0_GSUWGMRR0_K1_LBSPPA128_LBSPPB128_LPA16_LPB8_LRVW8_MIWT2_1_PLR1_SU0_SUM0_SUS64_VWA2_VWB1_WGM1_WGMXCC1_WGMXCCGn1
    SolutionIndex: 24
    SolutionNameMin: Cijk_Alik_Bljk_B8NB8NS_BH_Bias_HAS_SAV_UserArgs_MT64x32x64_MI16x16x1_SN_LDSB0_CLR1_GRVWA8_GRVWB8_GSU0_GSUC0_GSUWGMRR0_K1_LBSPPA128_LBSPPB128_LPA8_LPB8_LRVW8_MIWT2_1_PLR1_SU0_SUM0_SUS64_VWA2_VWB1_WGM4_WGMXCC1_WGMXCCGn1
    SolutionIndex: 25
    SolutionNameMin: Cijk_Alik_Bljk_B8NB8NS_BH_Bias_HAS_SAV_UserArgs_MT32x32x64_MI16x16x1_SN_LDSB0_CLR1_GRVWA8_GRVWB8_GSU0_GSUC0_GSUWGMRR0_K1_LBSPPA128_LBSPPB128_LPA8_LPB8_LRVW8_MIWT1_1_PLR1_SU0_SUM0_SUS64_VWA1_VWB1_WGM1_WGMXCC1_WGMXCCGn1
    SolutionIndex: 26
    SolutionNameMin: Cijk_Alik_Bljk_B8NB8NS_BH_Bias_HAS_SAV_UserArgs_MT128x256x128_MI16x16x1_SN_LDSB1_CLR1_GRVWA8_GRVWB16_GSU0_GSUC0_GSUWGMRR0_K1_LBSPPA512_LBSPPB1024_LPA8_LPB16_LRVW8_MIWT4_8_PLR1_SU0_SUM0_SUS128_VWA4_VWB8_WGM1_WGMXCC1_WGMXCCGn1
    SolutionIndex: 27
    SolutionNameMin: Cijk_Alik_Bljk_B8NB8NS_BH_Bias_HAS_SAV_UserArgs_MT128x256x128_MI16x16x1_SN_LDSB1_CLR1_GRVWA8_GRVWB16_GSU0_GSUC0_GSUWGMRR0_K1_LBSPPA512_LBSPPB1024_LPA8_LPB16_LRVW8_MIWT4_8_PLR1_SU0_SUM0_SUS128_VWA4_VWB8_WGM4_WGMXCC1_WGMXCCGn1
    SolutionIndex: 28
    SolutionNameMin: Cijk_Alik_Bljk_B8NB8NS_BH_Bias_HAS_SAV_UserArgs_MT256x144x128_MI16x16x1_SN_LDSB1_CLR1_GRVWA8_GRVWB8_GSU0_GSUC0_GSUWGMRR0_K1_LBSPPA512_LBSPPB128_LPA8_LPB8_LRVW8_MIWT4_9_PLR1_SU0_SUM0_SUS128_VWA4_VWB1_WGM1_WGMXCC1_WGMXCCGn1
    SolutionIndex: 29
    SolutionNameMin: Cijk_Alik_Bljk_B8NB8NS_BH_Bias_HAS_SAV_UserArgs_MT256x144x128_MI16x16x1_SN_LDSB1_CLR1_GRVWA16_GRVWB8_GSU0_GSUC0_GSUWGMRR0_K1_LBSPPA512_LBSPPB128_LPA16_LPB8_LRVW8_MIWT4_9_PLR1_SU0_SUM0_SUS128_VWA4_VWB1_WGM1_WGMXCC1_WGMXCCGn1
    SolutionIndex: 30
    SolutionNameMin: Cijk_Alik_Bljk_B8NB8NS_BH_Bias_HAS_SAV_UserArgs_MT256x144x128_MI16x16x1_SN_LDSB1_CLR1_GRVWA8_GRVWB8_GSU0_GSUC0_GSUWGMRR0_K1_LBSPPA512_LBSPPB128_LPA8_LPB8_LRVW8_MIWT4_9_PLR1_SU0_SUM0_SUS128_VWA4_VWB1_WGM4_WGMXCC1_WGMXCCGn1
    SolutionIndex: 31
    SolutionNameMin: Cijk_Alik_Bljk_B8NB8NS_BH_Bias_HAS_SAV_UserArgs_MT256x144x128_MI16x16x1_SN_LDSB1_CLR1_GRVWA16_GRVWB8_GSU0_GSUC0_GSUWGMRR0_K1_LBSPPA512_LBSPPB128_LPA16_LPB8_LRVW8_MIWT4_9_PLR1_SU0_SUM0_SUS128_VWA4_VWB1_WGM4_WGMXCC1_WGMXCCGn1
    SolutionIndex: 32
    SolutionNameMin: Cijk_Alik_Bljk_B8NB8NS_BH_Bias_HAS_SAV_UserArgs_MT256x144x128_MI16x16x1_SN_LDSB1_CLR1_GRVWA8_GRVWB8_GSU0_GSUC0_GSUWGMRR0_K1_LBSPPA512_LBSPPB128_LPA8_LPB8_LRVW8_MIWT4_9_PLR1_SU0_SUM0_SUS128_VWA4_VWB1_WGM6_WGMXCC1_WGMXCCGn1
    SolutionIndex: 33
    SolutionNameMin: Cijk_Alik_Bljk_B8NB8NS_BH_Bias_HAS_SAV_UserArgs_MT256x144x128_MI16x16x1_SN_LDSB1_CLR1_GRVWA16_GRVWB8_GSU0_GSUC0_GSUWGMRR0_K1_LBSPPA512_LBSPPB128_LPA16_LPB8_LRVW8_MIWT4_9_PLR1_SU0_SUM0_SUS128_VWA4_VWB1_WGM6_WGMXCC1_WGMXCCGn1
    SolutionIndex: 34
    SolutionNameMin: Cijk_Alik_Bljk_B8NB8NS_BH_Bias_HAS_SAV_UserArgs_MT256x144x128_MI16x16x1_SN_LDSB1_CLR1_GRVWA8_GRVWB8_GSU0_GSUC0_GSUWGMRR0_K1_LBSPPA512_LBSPPB128_LPA8_LPB8_LRVW8_MIWT4_9_PLR1_SU0_SUM0_SUS128_VWA4_VWB1_WGM8_WGMXCC1_WGMXCCGn1
    SolutionIndex: 35
    SolutionNameMin: Cijk_Alik_Bljk_B8NB8NS_BH_Bias_HAS_SAV_UserArgs_MT256x144x128_MI16x16x1_SN_LDSB1_CLR1_GRVWA16_GRVWB8_GSU0_GSUC0_GSUWGMRR0_K1_LBSPPA512_LBSPPB128_LPA16_LPB8_LRVW8_MIWT4_9_PLR1_SU0_SUM0_SUS128_VWA4_VWB1_WGM8_WGMXCC1_WGMXCCGn1
    SolutionIndex: 36
    SolutionNameMin: Cijk_Alik_Bljk_B8NB8NS_BH_Bias_HAS_SAV_UserArgs_MT256x128x128_MI16x16x1_SN_LDSB1_CLR1_GRVWA8_GRVWB16_GSU0_GSUC0_GSUWGMRR0_K1_LBSPPA1024_LBSPPB512_LPA8_LPB16_LRVW8_MIWT8_4_PLR1_SU0_SUM0_SUS128_VWA8_VWB4_WGM1_WGMXCC1_WGMXCCGn1
    SolutionIndex: 37
    SolutionNameMin: Cijk_Alik_Bljk_B8NB8NS_BH_Bias_HAS_SAV_UserArgs_MT256x128x128_MI16x16x1_SN_LDSB1_CLR1_GRVWA8_GRVWB16_GSU0_GSUC0_GSUWGMRR0_K1_LBSPPA1024_LBSPPB512_LPA8_LPB16_LRVW8_MIWT8_4_PLR1_SU0_SUM0_SUS128_VWA8_VWB4_WGM4_WGMXCC1_WGMXCCGn1
    SolutionIndex: 38
    SolutionNameMin: Cijk_Alik_Bljk_B8NB8NS_BH_Bias_HAS_SAV_UserArgs_MT256x128x128_MI16x16x1_SN_LDSB1_CLR1_GRVWA8_GRVWB16_GSU0_GSUC0_GSUWGMRR0_K1_LBSPPA1024_LBSPPB512_LPA8_LPB16_LRVW8_MIWT8_4_PLR1_SU0_SUM0_SUS128_VWA8_VWB4_WGM8_WGMXCC1_WGMXCCGn1
    SolutionIndex: 39
    SolutionNameMin: Cijk_Alik_Bljk_B8NB8NS_BH_Bias_HAS_SAV_UserArgs_MT144x256x128_MI16x16x1_SN_LDSB1_CLR1_GRVWA8_GRVWB16_GSU0_GSUC0_GSUWGMRR0_K1_LBSPPA128_LBSPPB512_LPA8_LPB16_LRVW8_MIWT9_4_PLR1_SU0_SUM0_SUS128_VWA1_VWB4_WGM4_WGMXCC1_WGMXCCGn1
    SolutionIndex: 40
    SolutionNameMin: Cijk_Alik_Bljk_B8NB8NS_BH_Bias_HAS_SAV_UserArgs_MT144x256x128_MI16x16x1_SN_LDSB1_CLR1_GRVWA8_GRVWB16_GSU0_GSUC0_GSUWGMRR0_K1_LBSPPA128_LBSPPB512_LPA8_LPB16_LRVW8_MIWT9_4_PLR1_SU0_SUM0_SUS128_VWA1_VWB4_WGM6_WGMXCC1_WGMXCCGn1
    SolutionIndex: 41
    SolutionNameMin: Cijk_Alik_Bljk_B8NB8NS_BH_Bias_HAS_SAV_UserArgs_MT144x256x128_MI16x16x1_SN_LDSB1_CLR1_GRVWA8_GRVWB16_GSU0_GSUC0_GSUWGMRR0_K1_LBSPPA128_LBSPPB512_LPA8_LPB16_LRVW8_MIWT9_4_PLR1_SU0_SUM0_SUS128_VWA1_VWB4_WGM8_WGMXCC1_WGMXCCGn1
    SolutionIndex: 42
    SolutionNameMin: Cijk_Alik_Bljk_B8NB8NS_BH_Bias_HAS_SAV_UserArgs_MT128x128x128_MI16x16x1_SN_LDSB1_CLR1_GRVWA8_GRVWB16_GSU0_GSUC0_GSUWGMRR0_K1_LBSPPA1024_LBSPPB256_LPA8_LPB16_LRVW8_MIWT8_2_PLR1_SU0_SUM0_SUS128_VWA8_VWB2_WGM1_WGMXCC1_WGMXCCGn1
    SolutionIndex: 43
    SolutionNameMin: Cijk_Alik_Bljk_B8NB8NS_BH_Bias_HAS_SAV_UserArgs_MT128x128x128_MI16x16x1_SN_LDSB1_CLR1_GRVWA16_GRVWB16_GSU0_GSUC0_GSUWGMRR0_K1_LBSPPA1024_LBSPPB256_LPA16_LPB16_LRVW8_MIWT8_2_PLR1_SU0_SUM0_SUS128_VWA8_VWB2_WGM1_WGMXCC1_WGMXCCGn1
    SolutionIndex: 44
    SolutionNameMin: Cijk_Alik_Bljk_B8NB8NS_BH_Bias_HAS_SAV_UserArgs_MT128x128x128_MI16x16x1_SN_LDSB1_CLR1_GRVWA8_GRVWB16_GSU0_GSUC0_GSUWGMRR0_K1_LBSPPA1024_LBSPPB256_LPA8_LPB16_LRVW8_MIWT8_2_PLR1_SU0_SUM0_SUS128_VWA8_VWB2_WGM4_WGMXCC1_WGMXCCGn1
    SolutionIndex: 45
    SolutionNameMin: Cijk_Alik_Bljk_B8NB8NS_BH_Bias_HAS_SAV_UserArgs_MT128x144x128_MI16x16x1_SN_LDSB1_CLR1_GRVWA8_GRVWB8_GSU0_GSUC0_GSUWGMRR0_K1_LBSPPA256_LBSPPB128_LPA8_LPB8_LRVW8_MIWT2_9_PLR1_SU0_SUM0_SUS128_VWA2_VWB1_WGM1_WGMXCC1_WGMXCCGn1
    SolutionIndex: 46
    SolutionNameMin: Cijk_Alik_Bljk_B8NB8NS_BH_Bias_HAS_SAV_UserArgs_MT128x144x128_MI16x16x1_SN_LDSB1_CLR1_GRVWA16_GRVWB8_GSU0_GSUC0_GSUWGMRR0_K1_LBSPPA256_LBSPPB128_LPA16_LPB8_LRVW8_MIWT2_9_PLR1_SU0_SUM0_SUS128_VWA2_VWB1_WGM1_WGMXCC1_WGMXCCGn1
    SolutionIndex: 47
    SolutionNameMin: Cijk_Alik_Bljk_B8NB8NS_BH_Bias_HAS_SAV_UserArgs_MT144x128x128_MI16x16x1_SN_LDSB1_CLR1_GRVWA8_GRVWB16_GSU0_GSUC0_GSUWGMRR0_K1_LBSPPA128_LBSPPB256_LPA8_LPB16_LRVW8_MIWT9_2_PLR1_SU0_SUM0_SUS128_VWA1_VWB2_WGM6_WGMXCC1_WGMXCCGn1
    SolutionIndex: 48
    SolutionNameMin: Cijk_Alik_Bljk_B8NB8NS_BH_Bias_HAS_SAV_UserArgs_MT144x128x128_MI16x16x1_SN_LDSB1_CLR1_GRVWA8_GRVWB16_GSU0_GSUC0_GSUWGMRR0_K1_LBSPPA128_LBSPPB256_LPA8_LPB16_LRVW8_MIWT9_2_PLR1_SU0_SUM0_SUS128_VWA1_VWB2_WGM8_WGMXCC1_WGMXCCGn1
    SolutionIndex: 49
    SolutionNameMin: Cijk_Alik_Bljk_B8NB8NS_BH_Bias_HAS_SAV_UserArgs_MT128x128x128_MI16x16x1_SN_LDSB1_CLR1_GRVWA8_GRVWB16_GSU0_GSUC0_GSUWGMRR0_K1_LBSPPA512_LBSPPB512_LPA8_LPB16_LRVW8_MIWT4_4_PLR1_SU0_SUM0_SUS128_VWA4_VWB4_WGM1_WGMXCC1_WGMXCCGn1
    SolutionIndex: 50
    SolutionNameMin: Cijk_Alik_Bljk_B8NB8NS_BH_Bias_HAS_SAV_UserArgs_MT128x128x128_MI16x16x1_SN_LDSB1_CLR1_GRVWA16_GRVWB16_GSU0_GSUC0_GSUWGMRR0_K1_LBSPPA512_LBSPPB512_LPA16_LPB16_LRVW8_MIWT4_4_PLR1_SU0_SUM0_SUS128_VWA4_VWB4_WGM1_WGMXCC1_WGMXCCGn1
    SolutionIndex: 51
    SolutionNameMin: Cijk_Alik_Bljk_B8NB8NS_BH_Bias_HAS_SAV_UserArgs_MT128x128x128_MI16x16x1_SN_LDSB1_CLR1_GRVWA8_GRVWB16_GSU0_GSUC0_GSUWGMRR0_K1_LBSPPA512_LBSPPB512_LPA8_LPB16_LRVW8_MIWT4_4_PLR1_SU0_SUM0_SUS128_VWA4_VWB4_WGM4_WGMXCC1_WGMXCCGn1
    SolutionIndex: 52
    SolutionNameMin: Cijk_Alik_Bljk_B8NB8NS_BH_Bias_HAS_SAV_UserArgs_MT128x128x128_MI16x16x1_SN_LDSB1_CLR1_GRVWA16_GRVWB16_GSU0_GSUC0_GSUWGMRR0_K1_LBSPPA512_LBSPPB512_LPA16_LPB16_LRVW8_MIWT4_4_PLR1_SU0_SUM0_SUS128_VWA4_VWB4_WGM4_WGMXCC1_WGMXCCGn1
    SolutionIndex: 53
    SolutionNameMin: Cijk_Alik_Bljk_B8NB8NS_BH_Bias_HAS_SAV_UserArgs_MT128x128x128_MI16x16x1_SN_LDSB1_CLR1_GRVWA8_GRVWB16_GSU0_GSUC0_GSUWGMRR0_K1_LBSPPA512_LBSPPB512_LPA8_LPB16_LRVW8_MIWT4_4_PLR1_SU0_SUM0_SUS128_VWA4_VWB4_WGM6_WGMXCC1_WGMXCCGn1
    SolutionIndex: 54
    SolutionNameMin: Cijk_Alik_Bljk_B8NB8NS_BH_Bias_HAS_SAV_UserArgs_MT128x128x128_MI16x16x1_SN_LDSB1_CLR1_GRVWA16_GRVWB16_GSU0_GSUC0_GSUWGMRR0_K1_LBSPPA512_LBSPPB512_LPA16_LPB16_LRVW8_MIWT4_4_PLR1_SU0_SUM0_SUS128_VWA4_VWB4_WGM6_WGMXCC1_WGMXCCGn1
    SolutionIndex: 55
    SolutionNameMin: Cijk_Alik_Bljk_B8NB8NS_BH_Bias_HAS_SAV_UserArgs_MT128x128x128_MI16x16x1_SN_LDSB1_CLR1_GRVWA8_GRVWB16_GSU0_GSUC0_GSUWGMRR0_K1_LBSPPA512_LBSPPB512_LPA8_LPB16_LRVW8_MIWT4_4_PLR1_SU0_SUM0_SUS128_VWA4_VWB4_WGM8_WGMXCC1_WGMXCCGn1
    SolutionIndex: 56
    SolutionNameMin: Cijk_Alik_Bljk_B8NB8NS_BH_Bias_HAS_SAV_UserArgs_MT64x128x128_MI16x16x1_SN_LDSB1_CLR1_GRVWA8_GRVWB16_GSU0_GSUC0_GSUWGMRR0_K1_LBSPPA256_LBSPPB512_LPA8_LPB16_LRVW8_MIWT2_4_PLR1_SU0_SUM0_SUS128_VWA2_VWB4_WGM1_WGMXCC1_WGMXCCGn1
    SolutionIndex: 57
    SolutionNameMin: Cijk_Alik_Bljk_B8NB8NS_BH_Bias_HAS_SAV_UserArgs_MT64x128x128_MI16x16x1_SN_LDSB1_CLR1_GRVWA8_GRVWB16_GSU0_GSUC0_GSUWGMRR0_K1_LBSPPA256_LBSPPB512_LPA8_LPB16_LRVW8_MIWT2_4_PLR1_SU0_SUM0_SUS128_VWA2_VWB4_WGM4_WGMXCC1_WGMXCCGn1
    SolutionIndex: 58
    SolutionNameMin: Cijk_Alik_Bljk_B8NB8NS_BH_Bias_HAS_SAV_UserArgs_MT64x128x128_MI16x16x1_SN_LDSB1_CLR1_GRVWA8_GRVWB16_GSU0_GSUC0_GSUWGMRR0_K1_LBSPPA256_LBSPPB512_LPA8_LPB16_LRVW8_MIWT2_4_PLR1_SU0_SUM0_SUS128_VWA2_VWB4_WGM6_WGMXCC1_WGMXCCGn1
    SolutionIndex: 59
    SolutionNameMin: Cijk_Alik_Bljk_B8NB8NS_BH_Bias_HAS_SAV_UserArgs_MT128x64x128_MI16x16x1_SN_LDSB1_CLR1_GRVWA16_GRVWB16_GSU0_GSUC0_GSUWGMRR0_K1_LBSPPA512_LBSPPB256_LPA16_LPB16_LRVW8_MIWT4_2_PLR1_SU0_SUM0_SUS128_VWA4_VWB2_WGM1_WGMXCC1_WGMXCCGn1
    SolutionIndex: 60
    SolutionNameMin: Cijk_Alik_Bljk_B8NB8NS_BH_Bias_HAS_SAV_UserArgs_MT128x64x128_MI16x16x1_SN_LDSB1_CLR1_GRVWA16_GRVWB16_GSU0_GSUC0_GSUWGMRR0_K1_LBSPPA512_LBSPPB256_LPA16_LPB16_LRVW8_MIWT4_2_PLR1_SU0_SUM0_SUS128_VWA4_VWB2_WGM4_WGMXCC1_WGMXCCGn1
    SolutionIndex: 61
    SolutionNameMin: Cijk_Alik_Bljk_B8NB8NS_BH_Bias_HAS_SAV_UserArgs_MT64x64x128_MI16x16x1_SN_LDSB1_CLR1_GRVWA16_GRVWB8_GSU0_GSUC0_GSUWGMRR0_K1_LBSPPA256_LBSPPB256_LPA16_LPB8_LRVW8_MIWT2_2_PLR1_SU0_SUM0_SUS128_VWA2_VWB2_WGM1_WGMXCC1_WGMXCCGn1
    SolutionIndex: 62
    SolutionNameMin: Cijk_Alik_Bljk_B8NB8NS_BH_Bias_HAS_SAV_UserArgs_MT64x64x128_MI16x16x1_SN_LDSB1_CLR1_GRVWA8_GRVWB16_GSU0_GSUC0_GSUWGMRR0_K1_LBSPPA256_LBSPPB256_LPA8_LPB16_LRVW8_MIWT2_2_PLR1_SU0_SUM0_SUS128_VWA2_VWB2_WGM1_WGMXCC1_WGMXCCGn1
    SolutionIndex: 63
    SolutionNameMin: Cijk_Alik_Bljk_B8NB8NS_BH_Bias_HAS_SAV_UserArgs_MT64x64x128_MI16x16x1_SN_LDSB1_CLR1_GRVWA8_GRVWB16_GSU0_GSUC0_GSUWGMRR0_K1_LBSPPA256_LBSPPB256_LPA8_LPB16_LRVW8_MIWT2_2_PLR1_SU0_SUM0_SUS128_VWA2_VWB2_WGM4_WGMXCC1_WGMXCCGn1
    SolutionIndex: 64
    SolutionNameMin: Cijk_Alik_Bljk_B8NB8NS_BH_Bias_HAS_SAV_UserArgs_MT64x64x128_MI16x16x1_SN_LDSB1_CLR1_GRVWA8_GRVWB16_GSU0_GSUC0_GSUWGMRR0_K1_LBSPPA256_LBSPPB256_LPA8_LPB16_LRVW8_MIWT2_2_PLR1_SU0_SUM0_SUS128_VWA2_VWB2_WGM6_WGMXCC1_WGMXCCGn1
    SolutionIndex: 65
    SolutionNameMin: Cijk_Alik_Bljk_B8NB8NS_BH_Bias_HAS_SAV_UserArgs_MT64x64x128_MI16x16x1_SN_LDSB1_CLR1_GRVWA8_GRVWB16_GSU0_GSUC0_GSUWGMRR0_K1_LBSPPA256_LBSPPB256_LPA8_LPB16_LRVW8_MIWT2_2_PLR1_SU0_SUM0_SUS128_VWA2_VWB2_WGM8_WGMXCC1_WGMXCCGn1
    SolutionIndex: 66
    SolutionNameMin: Cijk_Alik_Bljk_B8NB8NS_BH_Bias_HAS_SAV_UserArgs_MT32x64x128_MI16x16x1_SN_LDSB0_CLR1_GRVWA8_GRVWB8_GSU0_GSUC0_GSUWGMRR0_K1_LBSPPA128_LBSPPB256_LPA8_LPB8_LRVW8_MIWT1_2_PLR1_SU0_SUM0_SUS128_VWA1_VWB2_WGM1_WGMXCC1_WGMXCCGn1
    SolutionIndex: 67
    SolutionNameMin: Cijk_Alik_Bljk_B8NB8NS_BH_Bias_HAS_SAV_UserArgs_MT32x64x128_MI16x16x1_SN_LDSB0_CLR1_GRVWA16_GRVWB8_GSU0_GSUC0_GSUWGMRR0_K1_LBSPPA128_LBSPPB256_LPA16_LPB8_LRVW8_MIWT1_2_PLR1_SU0_SUM0_SUS128_VWA1_VWB2_WGM1_WGMXCC1_WGMXCCGn1
    SolutionIndex: 68
    SolutionNameMin: Cijk_Alik_Bljk_B8NB8NS_BH_Bias_HAS_SAV_UserArgs_MT32x64x128_MI16x16x1_SN_LDSB0_CLR1_GRVWA8_GRVWB16_GSU0_GSUC0_GSUWGMRR0_K1_LBSPPA128_LBSPPB256_LPA8_LPB16_LRVW8_MIWT1_2_PLR1_SU0_SUM0_SUS128_VWA1_VWB2_WGM1_WGMXCC1_WGMXCCGn1
    SolutionIndex: 69
    SolutionNameMin: Cijk_Alik_Bljk_B8NB8NS_BH_Bias_HAS_SAV_UserArgs_MT32x64x128_MI16x16x1_SN_LDSB0_CLR1_GRVWA8_GRVWB8_GSU0_GSUC0_GSUWGMRR0_K1_LBSPPA128_LBSPPB256_LPA8_LPB8_LRVW8_MIWT1_2_PLR1_SU0_SUM0_SUS128_VWA1_VWB2_WGM6_WGMXCC1_WGMXCCGn1
    SolutionIndex: 70
    SolutionNameMin: Cijk_Alik_Bljk_B8NB8NS_BH_Bias_HAS_SAV_UserArgs_MT32x64x128_MI16x16x1_SN_LDSB0_CLR1_GRVWA8_GRVWB8_GSU0_GSUC0_GSUWGMRR0_K1_LBSPPA128_LBSPPB256_LPA8_LPB8_LRVW8_MIWT1_2_PLR1_SU0_SUM0_SUS128_VWA1_VWB2_WGM8_WGMXCC1_WGMXCCGn1
    SolutionIndex: 71
    SolutionNameMin: Cijk_Alik_Bljk_B8NB8NS_BH_Bias_HAS_SAV_UserArgs_MT64x32x128_MI16x16x1_SN_LDSB0_CLR1_GRVWA8_GRVWB8_GSU0_GSUC0_GSUWGMRR0_K1_LBSPPA256_LBSPPB128_LPA8_LPB8_LRVW8_MIWT2_1_PLR1_SU0_SUM0_SUS128_VWA2_VWB1_WGM1_WGMXCC1_WGMXCCGn1
    SolutionIndex: 72
    SolutionNameMin: Cijk_Alik_Bljk_B8NB8NS_BH_Bias_HAS_SAV_UserArgs_MT64x32x128_MI16x16x1_SN_LDSB0_CLR1_GRVWA16_GRVWB8_GSU0_GSUC0_GSUWGMRR0_K1_LBSPPA256_LBSPPB128_LPA16_LPB8_LRVW8_MIWT2_1_PLR1_SU0_SUM0_SUS128_VWA2_VWB1_WGM1_WGMXCC1_WGMXCCGn1
    SolutionIndex: 73
    SolutionNameMin: Cijk_Alik_Bljk_B8NB8NS_BH_Bias_HAS_SAV_UserArgs_MT64x32x128_MI16x16x1_SN_LDSB0_CLR1_GRVWA8_GRVWB16_GSU0_GSUC0_GSUWGMRR0_K1_LBSPPA256_LBSPPB128_LPA8_LPB16_LRVW8_MIWT2_1_PLR1_SU0_SUM0_SUS128_VWA2_VWB1_WGM1_WGMXCC1_WGMXCCGn1
    SolutionIndex: 74
    SolutionNameMin: Cijk_Alik_Bljk_B8NB8NS_BH_Bias_HAS_SAV_UserArgs_MT64x32x128_MI16x16x1_SN_LDSB0_CLR1_GRVWA16_GRVWB16_GSU0_GSUC0_GSUWGMRR0_K1_LBSPPA256_LBSPPB128_LPA16_LPB16_LRVW8_MIWT2_1_PLR1_SU0_SUM0_SUS128_VWA2_VWB1_WGM1_WGMXCC1_WGMXCCGn1
    SolutionIndex: 75
    SolutionNameMin: Cijk_Alik_Bljk_B8NB8NS_BH_Bias_HAS_SAV_UserArgs_MT64x32x128_MI16x16x1_SN_LDSB0_CLR1_GRVWA8_GRVWB8_GSU0_GSUC0_GSUWGMRR0_K1_LBSPPA256_LBSPPB128_LPA8_LPB8_LRVW8_MIWT2_1_PLR1_SU0_SUM0_SUS128_VWA2_VWB1_WGM6_WGMXCC1_WGMXCCGn1
    SolutionIndex: 76
    SolutionNameMin: Cijk_Alik_Bljk_B8NB8NS_BH_Bias_HAS_SAV_UserArgs_MT32x32x128_MI16x16x1_SN_LDSB0_CLR1_GRVWA8_GRVWB8_GSU0_GSUC0_GSUWGMRR0_K1_LBSPPA128_LBSPPB128_LPA8_LPB8_LRVW8_MIWT1_1_PLR1_SU0_SUM0_SUS128_VWA1_VWB1_WGM1_WGMXCC1_WGMXCCGn1
    SolutionIndex: 77
    SolutionNameMin: Cijk_Alik_Bljk_B8NB8NS_BH_Bias_HAS_SAV_UserArgs_MT32x32x128_MI16x16x1_SN_LDSB0_CLR1_GRVWA16_GRVWB8_GSU0_GSUC0_GSUWGMRR0_K1_LBSPPA128_LBSPPB128_LPA16_LPB8_LRVW8_MIWT1_1_PLR1_SU0_SUM0_SUS128_VWA1_VWB1_WGM1_WGMXCC1_WGMXCCGn1
    SolutionIndex: 78
    SolutionNameMin: Cijk_Alik_Bljk_B8NB8NS_BH_Bias_HAS_SAV_UserArgs_MT32x32x128_MI16x16x1_SN_LDSB0_CLR1_GRVWA8_GRVWB16_GSU0_GSUC0_GSUWGMRR0_K1_LBSPPA128_LBSPPB128_LPA8_LPB16_LRVW8_MIWT1_1_PLR1_SU0_SUM0_SUS128_VWA1_VWB1_WGM1_WGMXCC1_WGMXCCGn1
    SolutionIndex: 79
    SolutionNameMin: Cijk_Alik_Bljk_B8NB8NS_BH_Bias_HAS_SAV_UserArgs_MT32x32x128_MI16x16x1_SN_LDSB0_CLR1_GRVWA16_GRVWB16_GSU0_GSUC0_GSUWGMRR0_K1_LBSPPA128_LBSPPB128_LPA16_LPB16_LRVW8_MIWT1_1_PLR1_SU0_SUM0_SUS128_VWA1_VWB1_WGM1_WGMXCC1_WGMXCCGn1
    SolutionIndex: 80
    SolutionNameMin: Cijk_Alik_Bljk_B8NB8NS_BH_Bias_HAS_SAV_UserArgs_MT32x32x128_MI16x16x1_SN_LDSB0_CLR1_GRVWA8_GRVWB8_GSU0_GSUC0_GSUWGMRR0_K1_LBSPPA128_LBSPPB128_LPA8_LPB8_LRVW8_MIWT1_1_PLR1_SU0_SUM0_SUS128_VWA1_VWB1_WGM6_WGMXCC1_WGMXCCGn1
    SolutionIndex: 81
    SolutionNameMin: Cijk_Alik_Bljk_B8NB8NS_BH_Bias_HAS_SAV_UserArgs_MT32x32x128_MI16x16x1_SN_LDSB0_CLR1_GRVWA8_GRVWB8_GSU0_GSUC0_GSUWGMRR0_K1_LBSPPA128_LBSPPB128_LPA8_LPB8_LRVW8_MIWT1_1_PLR1_SU0_SUM0_SUS128_VWA1_VWB1_WGM8_WGMXCC1_WGMXCCGn1
    SolutionIndex: 82
    SolutionNameMin: Cijk_Alik_Bljk_B8NB8NS_BH_Bias_HAS_SAV_UserArgs_MT64x128x256_MI16x16x1_SN_LDSB1_CLR1_GRVWA8_GRVWB8_GSU0_GSUC0_GSUWGMRR0_K1_LBSPPA512_LBSPPB1024_LPA8_LPB8_LRVW8_MIWT2_4_PLR1_SU0_SUM0_SUS256_VWA2_VWB4_WGM1_WGMXCC1_WGMXCCGn1
    SolutionIndex: 83
    SolutionNameMin: Cijk_Alik_Bljk_B8NB8NS_BH_Bias_HAS_SAV_UserArgs_MT128x64x256_MI16x16x1_SN_LDSB1_CLR1_GRVWA8_GRVWB16_GSU0_GSUC0_GSUWGMRR0_K1_LBSPPA1024_LBSPPB512_LPA8_LPB16_LRVW8_MIWT4_2_PLR1_SU0_SUM0_SUS256_VWA4_VWB2_WGM1_WGMXCC1_WGMXCCGn1
    SolutionIndex: 84
    SolutionNameMin: Cijk_Alik_Bljk_B8NB8NS_BH_Bias_HAS_SAV_UserArgs_MT128x64x256_MI16x16x1_SN_LDSB1_CLR1_GRVWA8_GRVWB16_GSU0_GSUC0_GSUWGMRR0_K1_LBSPPA1024_LBSPPB512_LPA8_LPB16_LRVW8_MIWT4_2_PLR1_SU0_SUM0_SUS256_VWA4_VWB2_WGM4_WGMXCC1_WGMXCCGn1
    SolutionIndex: 85
    SolutionNameMin: Cijk_Alik_Bljk_B8NB8NS_BH_Bias_HAS_SAV_UserArgs_MT128x64x256_MI16x16x1_SN_LDSB1_CLR1_GRVWA8_GRVWB16_GSU0_GSUC0_GSUWGMRR0_K1_LBSPPA1024_LBSPPB512_LPA8_LPB16_LRVW8_MIWT4_2_PLR1_SU0_SUM0_SUS256_VWA4_VWB2_WGM8_WGMXCC1_WGMXCCGn1
    SolutionIndex: 86
    SolutionNameMin: Cijk_Alik_Bljk_B8NB8NS_BH_Bias_HAS_SAV_UserArgs_MT64x64x256_MI16x16x1_SN_LDSB1_CLR1_GRVWA8_GRVWB16_GSU0_GSUC0_GSUWGMRR0_K1_LBSPPA512_LBSPPB512_LPA8_LPB16_LRVW8_MIWT2_2_PLR1_SU0_SUM0_SUS256_VWA2_VWB2_WGM1_WGMXCC1_WGMXCCGn1
    SolutionIndex: 87
    SolutionNameMin: Cijk_Alik_Bljk_B8NB8NS_BH_Bias_HAS_SAV_UserArgs_MT64x64x256_MI16x16x1_SN_LDSB1_CLR1_GRVWA8_GRVWB16_GSU0_GSUC0_GSUWGMRR0_K1_LBSPPA512_LBSPPB512_LPA8_LPB16_LRVW8_MIWT2_2_PLR1_SU0_SUM0_SUS256_VWA2_VWB2_WGM4_WGMXCC1_WGMXCCGn1
    SolutionIndex: 88
    SolutionNameMin: Cijk_Alik_Bljk_B8NB8NS_BH_Bias_HAS_SAV_UserArgs_MT64x64x256_MI16x16x1_SN_LDSB1_CLR1_GRVWA8_GRVWB16_GSU0_GSUC0_GSUWGMRR0_K1_LBSPPA512_LBSPPB512_LPA8_LPB16_LRVW8_MIWT2_2_PLR1_SU0_SUM0_SUS256_VWA2_VWB2_WGM6_WGMXCC1_WGMXCCGn1
    SolutionIndex: 89
    SolutionNameMin: Cijk_Alik_Bljk_B8NB8NS_BH_Bias_HAS_SAV_UserArgs_MT64x64x256_MI16x16x1_SN_LDSB1_CLR1_GRVWA8_GRVWB16_GSU0_GSUC0_GSUWGMRR0_K1_LBSPPA512_LBSPPB512_LPA8_LPB16_LRVW8_MIWT2_2_PLR1_SU0_SUM0_SUS256_VWA2_VWB2_WGM8_WGMXCC1_WGMXCCGn1
    SolutionIndex: 90
    SolutionNameMin: Cijk_Alik_Bljk_B8NB8NS_BH_Bias_HAS_SAV_UserArgs_MT32x32x256_MI16x16x1_SN_LDSB1_CLR1_GRVWA16_GRVWB16_GSU0_GSUC0_GSUWGMRR0_K1_LBSPPA256_LBSPPB256_LPA16_LPB16_LRVW8_MIWT1_1_PLR1_SU0_SUM0_SUS256_VWA1_VWB1_WGM1_WGMXCC1_WGMXCCGn1
    SolutionIndex: 91
    SolutionNameMin: Cijk_Alik_Bljk_B8NB8NS_BH_Bias_HAS_SAV_UserArgs_MT32x32x256_MI16x16x1_SN_LDSB1_CLR1_GRVWA8_GRVWB16_GSU0_GSUC0_GSUWGMRR0_K1_LBSPPA256_LBSPPB256_LPA8_LPB16_LRVW8_MIWT1_1_PLR1_SU0_SUM0_SUS256_VWA1_VWB1_WGM8_WGMXCC1_WGMXCCGn1
    SolutionIndex: 92
    SolutionNameMin: Cijk_Alik_Bljk_B8NB8NS_BH_Bias_HAS_SAV_UserArgs_MT64x64x32_MI16x16x1_SN_LDSB0_CLR0_GRVWA4_GRVWB4_GSU0_GSUC0_GSUWGMRR0_K1_LBSPPA128_LBSPPB128_LPA8_LPB8_LRVW8_MIWT2_2_PLR0_SU32_SUM0_SUS256_VWA2_VWB2_WGM1_WGMXCC1_WGMXCCGn1
- - - [128, 128, 1, 128, 128, 128, 128, 128]
    - [79, 0.63]
  - - [128, 128, 1, 256, 128, 128, 256, 256]
    - [77, 1.17]
  - - [128, 128, 1, 512, 128, 128, 512, 512]
    - [79, 2.1]
  - - [128, 128, 1, 1024, 128, 128, 1024, 1024]
    - [76, 3.51]
  - - [128, 128, 1, 2048, 128, 128, 2048, 2048]
    - [76, 5.37]
  - - [128, 128, 1, 4096, 128, 128, 4096, 4096]
    - [76, 7.2]
  - - [128, 128, 1, 8192, 128, 128, 8192, 8192]
    - [76, 8.72]
  - - [128, 256, 1, 128, 128, 128, 128, 128]
    - [77, 1.28]
  - - [128, 256, 1, 256, 128, 128, 256, 256]
    - [76, 2.38]
  - - [128, 256, 1, 512, 128, 128, 512, 512]
    - [79, 4.27]
  - - [128, 256, 1, 1024, 128, 128, 1024, 1024]
    - [76, 7.19]
  - - [128, 256, 1, 2048, 128, 128, 2048, 2048]
    - [76, 10.88]
  - - [128, 256, 1, 4096, 128, 128, 4096, 4096]
    - [76, 14.5]
  - - [128, 256, 1, 8192, 128, 128, 8192, 8192]
    - [76, 17.43]
  - - [128, 512, 1, 128, 128, 128, 128, 128]
    - [79, 2.52]
  - - [128, 512, 1, 256, 128, 128, 256, 256]
    - [77, 4.72]
  - - [128, 512, 1, 512, 128, 128, 512, 512]
    - [78, 8.46]
  - - [128, 512, 1, 1024, 128, 128, 1024, 1024]
    - [76, 14.11]
  - - [128, 512, 1, 2048, 128, 128, 2048, 2048]
    - [76, 21.44]
  - - [128, 512, 1, 4096, 128, 128, 4096, 4096]
    - [76, 28.81]
  - - [128, 512, 1, 8192, 128, 128, 8192, 8192]
    - [76, 34.55]
  - - [128, 1024, 1, 128, 128, 128, 128, 128]
    - [79, 5.0]
  - - [128, 1024, 1, 256, 128, 128, 256, 256]
    - [78, 9.33]
  - - [128, 1024, 1, 512, 128, 128, 512, 512]
    - [79, 16.52]
  - - [128, 1024, 1, 1024, 128, 128, 1024, 1024]
    - [76, 27.88]
  - - [128, 1024, 1, 2048, 128, 128, 2048, 2048]
    - [76, 41.98]
  - - [128, 1024, 1, 4096, 128, 128, 4096, 4096]
    - [76, 56.02]
  - - [128, 1024, 1, 8192, 128, 128, 8192, 8192]
    - [76, 67.6]
  - - [128, 2048, 1, 128, 128, 128, 128, 128]
    - [23, 9.24]
  - - [128, 2048, 1, 256, 128, 128, 256, 256]
    - [74, 16.85]
  - - [128, 2048, 1, 512, 128, 128, 512, 512]
    - [71, 29.65]
  - - [128, 2048, 1, 1024, 128, 128, 1024, 1024]
    - [71, 47.57]
  - - [128, 2048, 1, 2048, 128, 128, 2048, 2048]
    - [66, 69.53]
  - - [128, 2048, 1, 4096, 128, 128, 4096, 4096]
    - [66, 89.76]
  - - [128, 2048, 1, 8192, 128, 128, 8192, 8192]
    - [71, 101.86]
  - - [128, 4096, 1, 128, 128, 128, 128, 128]
    - [21, 17.05]
  - - [128, 4096, 1, 256, 128, 128, 256, 256]
    - [19, 30.63]
  - - [128, 4096, 1, 512, 128, 128, 512, 512]
    - [19, 50.5]
  - - [128, 4096, 1, 1024, 128, 128, 1024, 1024]
    - [62, 77.37]
  - - [128, 4096, 1, 2048, 128, 128, 2048, 2048]
    - [62, 106.53]
  - - [128, 4096, 1, 4096, 128, 128, 4096, 4096]
    - [62, 131.1]
  - - [128, 4096, 1, 8192, 128, 128, 8192, 8192]
    - [86, 142.67]
  - - [128, 8192, 1, 128, 128, 128, 128, 128]
    - [15, 28.37]
  - - [128, 8192, 1, 256, 128, 128, 256, 256]
    - [14, 50.85]
  - - [128, 8192, 1, 512, 128, 128, 512, 512]
    - [14, 84.34]
  - - [128, 8192, 1, 1024, 128, 128, 1024, 1024]
    - [14, 124.8]
  - - [128, 8192, 1, 2048, 128, 128, 2048, 2048]
    - [14, 162.83]
  - - [128, 8192, 1, 4096, 128, 128, 4096, 4096]
    - [82, 163.82]
  - - [128, 8192, 1, 8192, 128, 128, 8192, 8192]
    - [56, 182.61]
  - - [256, 128, 1, 128, 256, 256, 128, 128]
    - [72, 1.04]
  - - [256, 128, 1, 256, 256, 256, 256, 256]
    - [79, 2.12]
  - - [256, 128, 1, 512, 256, 256, 512, 512]
    - [77, 3.97]
  - - [256, 128, 1, 1024, 256, 256, 1024, 1024]
    - [76, 6.96]
  - - [256, 128, 1, 2048, 256, 256, 2048, 2048]
    - [76, 10.49]
  - - [256, 128, 1, 4096, 256, 256, 4096, 4096]
    - [76, 14.36]
  - - [256, 128, 1, 8192, 256, 256, 8192, 8192]
    - [76, 17.28]
  - - [256, 256, 1, 128, 256, 256, 128, 128]
    - [25, 2.5]
  - - [256, 256, 1, 256, 256, 256, 256, 256]
    - [25, 4.67]
  - - [256, 256, 1, 512, 256, 256, 512, 512]
    - [76, 8.37]
  - - [256, 256, 1, 1024, 256, 256, 1024, 1024]
    - [76, 14.04]
  - - [256, 256, 1, 2048, 256, 256, 2048, 2048]
    - [76, 21.14]
  - - [256, 256, 1, 4096, 256, 256, 4096, 4096]
    - [76, 28.6]
  - - [256, 256, 1, 8192, 256, 256, 8192, 8192]
    - [76, 34.54]
  - - [256, 512, 1, 128, 256, 256, 128, 128]
    - [77, 4.9]
  - - [256, 512, 1, 256, 256, 256, 256, 256]
    - [76, 8.64]
  - - [256, 512, 1, 512, 256, 256, 512, 512]
    - [79, 16.45]
  - - [256, 512, 1, 1024, 256, 256, 1024, 1024]
    - [78, 27.77]
  - - [256, 512, 1, 2048, 256, 256, 2048, 2048]
    - [76, 41.76]
  - - [256, 512, 1, 4096, 256, 256, 4096, 4096]
    - [76, 56.22]
  - - [256, 512, 1, 8192, 256, 256, 8192, 8192]
    - [76, 68.01]
  - - [256, 1024, 1, 128, 256, 256, 128, 128]
    - [75, 8.67]
  - - [256, 1024, 1, 256, 256, 256, 256, 256]
    - [68, 16.41]
  - - [256, 1024, 1, 512, 256, 256, 512, 512]
    - [71, 29.36]
  - - [256, 1024, 1, 1024, 256, 256, 1024, 1024]
    - [71, 47.14]
  - - [256, 1024, 1, 2048, 256, 256, 2048, 2048]
    - [73, 68.26]
  - - [256, 1024, 1, 4096, 256, 256, 4096, 4096]
    - [67, 88.04]
  - - [256, 1024, 1, 8192, 256, 256, 8192, 8192]
    - [71, 102.53]
  - - [256, 2048, 1, 128, 256, 256, 128, 128]
    - [19, 16.27]
  - - [256, 2048, 1, 256, 256, 256, 256, 256]
    - [19, 29.83]
  - - [256, 2048, 1, 512, 256, 256, 512, 512]
    - [19, 50.39]
  - - [256, 2048, 1, 1024, 256, 256, 1024, 1024]
    - [61, 76.15]
  - - [256, 2048, 1, 2048, 256, 256, 2048, 2048]
    - [62, 106.27]
  - - [256, 2048, 1, 4096, 256, 256, 4096, 4096]
    - [62, 130.5]
  - - [256, 2048, 1, 8192, 256, 256, 8192, 8192]
    - [86, 142.92]
  - - [256, 4096, 1, 128, 256, 256, 128, 128]
    - [11, 28.05]
  - - [256, 4096, 1, 256, 256, 256, 256, 256]
    - [14, 50.51]
  - - [256, 4096, 1, 512, 256, 256, 512, 512]
    - [14, 84.31]
  - - [256, 4096, 1, 1024, 256, 256, 1024, 1024]
    - [14, 123.09]
  - - [256, 4096, 1, 2048, 256, 256, 2048, 2048]
    - [14, 163.1]
  - - [256, 4096, 1, 4096, 256, 256, 4096, 4096]
    - [83, 178.16]
  - - [256, 4096, 1, 8192, 256, 256, 8192, 8192]
    - [56, 190.6]
  - - [256, 8192, 1, 128, 256, 256, 128, 128]
    - [10, 44.55]
  - - [256, 8192, 1, 256, 256, 256, 256, 256]
    - [10, 79.1]
  - - [256, 8192, 1, 512, 256, 256, 512, 512]
    - [10, 127.39]
  - - [256, 8192, 1, 1024, 256, 256, 1024, 1024]
    - [10, 183.38]
  - - [256, 8192, 1, 2048, 256, 256, 2048, 2048]
    - [49, 227.37]
  - - [256, 8192, 1, 4096, 256, 256, 4096, 4096]
    - [50, 219.06]
  - - [256, 8192, 1, 8192, 256, 256, 8192, 8192]
    - [49, 244.04]
  - - [512, 128, 1, 128, 512, 512, 128, 128]
    - [77, 2.47]
  - - [512, 128, 1, 256, 512, 512, 256, 256]
    - [79, 4.67]
  - - [512, 128, 1, 512, 512, 512, 512, 512]
    - [79, 8.38]
  - - [512, 128, 1, 1024, 512, 512, 1024, 1024]
    - [76, 14.04]
  - - [512, 128, 1, 2048, 512, 512, 2048, 2048]
    - [76, 21.24]
  - - [512, 128, 1, 4096, 512, 512, 4096, 4096]
    - [76, 28.47]
  - - [512, 128, 1, 8192, 512, 512, 8192, 8192]
    - [76, 34.6]
  - - [512, 256, 1, 128, 512, 512, 128, 128]
    - [24, 4.08]
  - - [512, 256, 1, 256, 512, 512, 256, 256]
    - [90, 7.92]
  - - [512, 256, 1, 512, 512, 512, 512, 512]
    - [78, 16.41]
  - - [512, 256, 1, 1024, 512, 512, 1024, 1024]
    - [78, 27.02]
  - - [512, 256, 1, 2048, 512, 512, 2048, 2048]
    - [76, 40.64]
  - - [512, 256, 1, 4096, 512, 512, 4096, 4096]
    - [76, 54.85]
  - - [512, 256, 1, 8192, 512, 512, 8192, 8192]
    - [81, 66.85]
  - - [512, 512, 1, 128, 512, 512, 128, 128]
    - [72, 8.82]
  - - [512, 512, 1, 256, 512, 512, 256, 256]
    - [22, 16.63]
  - - [512, 512, 1, 512, 512, 512, 512, 512]
    - [73, 29.12]
  - - [512, 512, 1, 1024, 512, 512, 1024, 1024]
    - [71, 45.33]
  - - [512, 512, 1, 2048, 512, 512, 2048, 2048]
    - [73, 66.72]
  - - [512, 512, 1, 4096, 512, 512, 4096, 4096]
    - [66, 88.6]
  - - [512, 512, 1, 8192, 512, 512, 8192, 8192]
    - [91, 98.9]
  - - [512, 1024, 1, 128, 512, 512, 128, 128]
    - [19, 16.39]
  - - [512, 1024, 1, 256, 512, 512, 256, 256]
    - [20, 29.69]
  - - [512, 1024, 1, 512, 512, 512, 512, 512]
    - [19, 50.22]
  - - [512, 1024, 1, 1024, 512, 512, 1024, 1024]
    - [62, 76.42]
  - - [512, 1024, 1, 2048, 512, 512, 2048, 2048]
    - [61, 105.3]
  - - [512, 1024, 1, 4096, 512, 512, 4096, 4096]
    - [62, 130.01]
  - - [512, 1024, 1, 8192, 512, 512, 8192, 8192]
    - [86, 141.94]
  - - [512, 2048, 1, 128, 512, 512, 128, 128]
    - [14, 28.05]
  - - [512, 2048, 1, 256, 512, 512, 256, 256]
    - [14, 50.33]
  - - [512, 2048, 1, 512, 512, 512, 512, 512]
    - [13, 82.22]
  - - [512, 2048, 1, 1024, 512, 512, 1024, 1024]
    - [17, 122.55]
  - - [512, 2048, 1, 2048, 512, 512, 2048, 2048]
    - [14, 160.9]
  - - [512, 2048, 1, 4096, 512, 512, 4096, 4096]
    - [14, 193.32]
  - - [512, 2048, 1, 8192, 512, 512, 8192, 8192]
    - [60, 187.44]
  - - [512, 4096, 1, 128, 512, 512, 128, 128]
    - [10, 44.48]
  - - [512, 4096, 1, 256, 512, 512, 256, 256]
    - [10, 78.22]
  - - [512, 4096, 1, 512, 512, 512, 512, 512]
    - [10, 127.63]
  - - [512, 4096, 1, 1024, 512, 512, 1024, 1024]
    - [42, 182.77]
  - - [512, 4096, 1, 2048, 512, 512, 2048, 2048]
    - [49, 234.64]
  - - [512, 4096, 1, 4096, 512, 512, 4096, 4096]
    - [50, 225.79]
  - - [512, 4096, 1, 8192, 512, 512, 8192, 8192]
    - [51, 249.7]
  - - [512, 8192, 1, 128, 512, 512, 128, 128]
    - [46, 65.2]
  - - [512, 8192, 1, 256, 512, 512, 256, 256]
    - [46, 115.4]
  - - [512, 8192, 1, 512, 512, 512, 512, 512]
    - [46, 184.1]
  - - [512, 8192, 1, 1024, 512, 512, 1024, 1024]
    - [46, 249.86]
  - - [512, 8192, 1, 2048, 512, 512, 2048, 2048]
    - [36, 248.56]
  - - [512, 8192, 1, 4096, 512, 512, 4096, 4096]
    - [45, 270.78]
  - - [512, 8192, 1, 8192, 512, 512, 8192, 8192]
    - [46, 287.18]
  - - [1024, 128, 1, 128, 1024, 1024, 128, 128]
    - [22, 4.39]
  - - [1024, 128, 1, 256, 1024, 1024, 256, 256]
    - [25, 8.47]
  - - [1024, 128, 1, 512, 1024, 1024, 512, 512]
    - [79, 16.28]
  - - [1024, 128, 1, 1024, 1024, 1024, 1024, 1024]
    - [76, 26.81]
  - - [1024, 128, 1, 2048, 1024, 1024, 2048, 2048]
    - [76, 40.63]
  - - [1024, 128, 1, 4096, 1024, 1024, 4096, 4096]
    - [76, 55.22]
  - - [1024, 128, 1, 8192, 1024, 1024, 8192, 8192]
    - [80, 66.88]
  - - [1024, 256, 1, 128, 1024, 1024, 128, 128]
    - [71, 8.94]
  - - [1024, 256, 1, 256, 1024, 1024, 256, 256]
    - [22, 16.55]
  - - [1024, 256, 1, 512, 1024, 1024, 512, 512]
    - [71, 29.71]
  - - [1024, 256, 1, 1024, 1024, 1024, 1024, 1024]
    - [71, 47.68]
  - - [1024, 256, 1, 2048, 1024, 1024, 2048, 2048]
    - [71, 68.87]
  - - [1024, 256, 1, 4096, 1024, 1024, 4096, 4096]
    - [66, 88.79]
  - - [1024, 256, 1, 8192, 1024, 1024, 8192, 8192]
    - [69, 103.47]
  - - [1024, 512, 1, 128, 1024, 1024, 128, 128]
    - [21, 16.73]
  - - [1024, 512, 1, 256, 1024, 1024, 256, 256]
    - [20, 29.99]
  - - [1024, 512, 1, 512, 1024, 1024, 512, 512]
    - [20, 49.72]
  - - [1024, 512, 1, 1024, 1024, 1024, 1024, 1024]
    - [62, 77.29]
  - - [1024, 512, 1, 2048, 1024, 1024, 2048, 2048]
    - [62, 106.19]
  - - [1024, 512, 1, 4096, 1024, 1024, 4096, 4096]
    - [65, 130.1]
  - - [1024, 512, 1, 8192, 1024, 1024, 8192, 8192]
    - [88, 142.04]
  - - [1024, 1024, 1, 128, 1024, 1024, 128, 128]
    - [13, 28.23]
  - - [1024, 1024, 1, 256, 1024, 1024, 256, 256]
    - [14, 51.12]
  - - [1024, 1024, 1, 512, 1024, 1024, 512, 512]
    - [14, 80.63]
  - - [1024, 1024, 1, 1024, 1024, 1024, 1024, 1024]
    - [14, 123.13]
  - - [1024, 1024, 1, 2048, 1024, 1024, 2048, 2048]
    - [18, 158.73]
  - - [1024, 1024, 1, 4096, 1024, 1024, 4096, 4096]
    - [85, 173.1]
  - - [1024, 1024, 1, 8192, 1024, 1024, 8192, 8192]
    - [83, 187.23]
  - - [1024, 2048, 1, 128, 1024, 1024, 128, 128]
    - [10, 43.15]
  - - [1024, 2048, 1, 256, 1024, 1024, 256, 256]
    - [10, 76.41]
  - - [1024, 2048, 1, 512, 1024, 1024, 512, 512]
    - [10, 127.47]
  - - [1024, 2048, 1, 1024, 1024, 1024, 1024, 1024]
    - [42, 183.42]
  - - [1024, 2048, 1, 2048, 1024, 1024, 2048, 2048]
    - [49, 234.67]
  - - [1024, 2048, 1, 4096, 1024, 1024, 4096, 4096]
    - [44, 227.64]
  - - [1024, 2048, 1, 8192, 1024, 1024, 8192, 8192]
    - [53, 247.49]
  - - [1024, 4096, 1, 128, 1024, 1024, 128, 128]
    - [7, 61.77]
  - - [1024, 4096, 1, 256, 1024, 1024, 256, 256]
    - [7, 107.23]
  - - [1024, 4096, 1, 512, 1024, 1024, 512, 512]
    - [7, 170.64]
  - - [1024, 4096, 1, 1024, 1024, 1024, 1024, 1024]
    - [7, 233.77]
  - - [1024, 4096, 1, 2048, 1024, 1024, 2048, 2048]
    - [36, 256.74]
  - - [1024, 4096, 1, 4096, 1024, 1024, 4096, 4096]
    - [36, 271.21]
  - - [1024, 4096, 1, 8192, 1024, 1024, 8192, 8192]
    - [37, 259.29]
  - - [1024, 8192, 1, 128, 1024, 1024, 128, 128]
    - [29, 92.64]
  - - [1024, 8192, 1, 256, 1024, 1024, 256, 256]
    - [29, 158.09]
  - - [1024, 8192, 1, 512, 1024, 1024, 512, 512]
    - [29, 244.96]
  - - [1024, 8192, 1, 1024, 1024, 1024, 1024, 1024]
    - [29, 258.45]
  - - [1024, 8192, 1, 2048, 1024, 1024, 2048, 2048]
    - [30, 309.64]
  - - [1024, 8192, 1, 4096, 1024, 1024, 4096, 4096]
    - [30, 351.35]
  - - [1024, 8192, 1, 8192, 1024, 1024, 8192, 8192]
    - [30, 357.01]
  - - [2048, 128, 1, 128, 2048, 2048, 128, 128]
    - [72, 9.17]
  - - [2048, 128, 1, 256, 2048, 2048, 256, 256]
    - [23, 16.99]
  - - [2048, 128, 1, 512, 2048, 2048, 512, 512]
    - [68, 27.97]
  - - [2048, 128, 1, 1024, 2048, 2048, 1024, 1024]
    - [73, 46.08]
  - - [2048, 128, 1, 2048, 2048, 2048, 2048, 2048]
    - [66, 68.9]
  - - [2048, 128, 1, 4096, 2048, 2048, 4096, 4096]
    - [66, 88.85]
  - - [2048, 128, 1, 8192, 2048, 2048, 8192, 8192]
    - [70, 101.43]
  - - [2048, 256, 1, 128, 2048, 2048, 128, 128]
    - [19, 16.46]
  - - [2048, 256, 1, 256, 2048, 2048, 256, 256]
    - [19, 30.07]
  - - [2048, 256, 1, 512, 2048, 2048, 512, 512]
    - [20, 49.46]
  - - [2048, 256, 1, 1024, 2048, 2048, 1024, 1024]
    - [61, 74.31]
  - - [2048, 256, 1, 2048, 2048, 2048, 2048, 2048]
    - [62, 105.74]
  - - [2048, 256, 1, 4096, 2048, 2048, 4096, 4096]
    - [63, 129.5]
  - - [2048, 256, 1, 8192, 2048, 2048, 8192, 8192]
    - [87, 142.01]
  - - [2048, 512, 1, 128, 2048, 2048, 128, 128]
    - [15, 27.74]
  - - [2048, 512, 1, 256, 2048, 2048, 256, 256]
    - [14, 49.83]
  - - [2048, 512, 1, 512, 2048, 2048, 512, 512]
    - [14, 83.99]
  - - [2048, 512, 1, 1024, 2048, 2048, 1024, 1024]
    - [16, 123.94]
  - - [2048, 512, 1, 2048, 2048, 2048, 2048, 2048]
    - [16, 161.08]
  - - [2048, 512, 1, 4096, 2048, 2048, 4096, 4096]
    - [58, 181.19]
  - - [2048, 512, 1, 8192, 2048, 2048, 8192, 8192]
    - [58, 189.78]
  - - [2048, 1024, 1, 128, 2048, 2048, 128, 128]
    - [42, 44.79]
  - - [2048, 1024, 1, 256, 2048, 2048, 256, 256]
    - [10, 79.42]
  - - [2048, 1024, 1, 512, 2048, 2048, 512, 512]
    - [10, 128.57]
  - - [2048, 1024, 1, 1024, 2048, 2048, 1024, 1024]
    - [10, 183.31]
  - - [2048, 1024, 1, 2048, 2048, 2048, 2048, 2048]
    - [51, 230.03]
  - - [2048, 1024, 1, 4096, 2048, 2048, 4096, 4096]
    - [51, 230.58]
  - - [2048, 1024, 1, 8192, 2048, 2048, 8192, 8192]
    - [51, 242.73]
  - - [2048, 2048, 1, 128, 2048, 2048, 128, 128]
    - [7, 60.32]
  - - [2048, 2048, 1, 256, 2048, 2048, 256, 256]
    - [7, 105.04]
  - - [2048, 2048, 1, 512, 2048, 2048, 512, 512]
    - [7, 167.68]
  - - [2048, 2048, 1, 1024, 2048, 2048, 1024, 1024]
    - [7, 232.83]
  - - [2048, 2048, 1, 2048, 2048, 2048, 2048, 2048]
    - [27, 251.61]
  - - [2048, 2048, 1, 4096, 2048, 2048, 4096, 4096]
    - [38, 264.5]
  - - [2048, 2048, 1, 8192, 2048, 2048, 8192, 8192]
    - [38, 258.92]
  - - [2048, 4096, 1, 128, 2048, 2048, 128, 128]
    - [1, 77.03]
  - - [2048, 4096, 1, 256, 2048, 2048, 256, 256]
    - [0, 130.45]
  - - [2048, 4096, 1, 512, 2048, 2048, 512, 512]
    - [0, 192.22]
  - - [2048, 4096, 1, 1024, 2048, 2048, 1024, 1024]
    - [4, 241.38]
  - - [2048, 4096, 1, 2048, 2048, 2048, 2048, 2048]
    - [4, 267.17]
  - - [2048, 4096, 1, 4096, 2048, 2048, 4096, 4096]
    - [34, 279.13]
  - - [2048, 4096, 1, 8192, 2048, 2048, 8192, 8192]
    - [32, 310.77]
  - - [2048, 8192, 1, 128, 2048, 2048, 128, 128]
    - [29, 99.07]
  - - [2048, 8192, 1, 256, 2048, 2048, 256, 256]
    - [35, 163.09]
  - - [2048, 8192, 1, 512, 2048, 2048, 512, 512]
    - [29, 224.02]
  - - [2048, 8192, 1, 1024, 2048, 2048, 1024, 1024]
    - [35, 276.01]
  - - [2048, 8192, 1, 2048, 2048, 2048, 2048, 2048]
    - [28, 315.71]
  - - [2048, 8192, 1, 4096, 2048, 2048, 4096, 4096]
    - [30, 329.58]
  - - [2048, 8192, 1, 8192, 2048, 2048, 8192, 8192]
    - [28, 368.15]
  - - [4096, 128, 1, 128, 4096, 4096, 128, 128]
    - [21, 16.26]
  - - [4096, 128, 1, 256, 4096, 4096, 256, 256]
    - [20, 29.61]
  - - [4096, 128, 1, 512, 4096, 4096, 512, 512]
    - [20, 48.88]
  - - [4096, 128, 1, 1024, 4096, 4096, 1024, 1024]
    - [62, 75.92]
  - - [4096, 128, 1, 2048, 4096, 4096, 2048, 2048]
    - [62, 104.95]
  - - [4096, 128, 1, 4096, 4096, 4096, 4096, 4096]
    - [64, 129.29]
  - - [4096, 128, 1, 8192, 4096, 4096, 8192, 8192]
    - [89, 141.78]
  - - [4096, 256, 1, 128, 4096, 4096, 128, 128]
    - [59, 27.44]
  - - [4096, 256, 1, 256, 4096, 4096, 256, 256]
    - [16, 49.84]
  - - [4096, 256, 1, 512, 4096, 4096, 512, 512]
    - [18, 82.35]
  - - [4096, 256, 1, 1024, 4096, 4096, 1024, 1024]
    - [16, 120.53]
  - - [4096, 256, 1, 2048, 4096, 4096, 2048, 2048]
    - [16, 158.88]
  - - [4096, 256, 1, 4096, 4096, 4096, 4096, 4096]
    - [57, 178.84]
  - - [4096, 256, 1, 8192, 4096, 4096, 8192, 8192]
    - [84, 190.93]
  - - [4096, 512, 1, 128, 4096, 4096, 128, 128]
    - [10, 44.55]
  - - [4096, 512, 1, 256, 4096, 4096, 256, 256]
    - [12, 78.35]
  - - [4096, 512, 1, 512, 4096, 4096, 512, 512]
    - [10, 127.99]
  - - [4096, 512, 1, 1024, 4096, 4096, 1024, 1024]
    - [42, 183.92]
  - - [4096, 512, 1, 2048, 4096, 4096, 2048, 2048]
    - [55, 230.15]
  - - [4096, 512, 1, 4096, 4096, 4096, 4096, 4096]
    - [52, 231.18]
  - - [4096, 512, 1, 8192, 4096, 4096, 8192, 8192]
    - [51, 245.64]
  - - [4096, 1024, 1, 128, 4096, 4096, 128, 128]
    - [7, 61.87]
  - - [4096, 1024, 1, 256, 4096, 4096, 256, 256]
    - [7, 107.32]
  - - [4096, 1024, 1, 512, 4096, 4096, 512, 512]
    - [7, 171.25]
  - - [4096, 1024, 1, 1024, 4096, 4096, 1024, 1024]
    - [37, 223.39]
  - - [4096, 1024, 1, 2048, 4096, 4096, 2048, 2048]
    - [38, 257.57]
  - - [4096, 1024, 1, 4096, 4096, 4096, 4096, 4096]
    - [38, 262.27]
  - - [4096, 1024, 1, 8192, 4096, 4096, 8192, 8192]
    - [47, 264.41]
  - - [4096, 2048, 1, 128, 4096, 4096, 128, 128]
    - [1, 76.11]
  - - [4096, 2048, 1, 256, 4096, 4096, 256, 256]
    - [0, 128.55]
  - - [4096, 2048, 1, 512, 4096, 4096, 512, 512]
    - [3, 187.92]
  - - [4096, 2048, 1, 1024, 4096, 4096, 1024, 1024]
    - [4, 245.29]
  - - [4096, 2048, 1, 2048, 4096, 4096, 2048, 2048]
    - [2, 272.68]
  - - [4096, 2048, 1, 4096, 4096, 4096, 4096, 4096]
    - [26, 275.32]
  - - [4096, 2048, 1, 8192, 4096, 4096, 8192, 8192]
    - [39, 304.66]
  - - [4096, 4096, 1, 128, 4096, 4096, 128, 128]
    - [3, 82.47]
  - - [4096, 4096, 1, 256, 4096, 4096, 256, 256]
    - [4, 138.25]
  - - [4096, 4096, 1, 512, 4096, 4096, 512, 512]
    - [4, 193.58]
  - - [4096, 4096, 1, 1024, 4096, 4096, 1024, 1024]
    - [2, 238.21]
  - - [4096, 4096, 1, 2048, 4096, 4096, 2048, 2048]
    - [33, 273.18]
  - - [4096, 4096, 1, 4096, 4096, 4096, 4096, 4096]
    - [32, 285.41]
  - - [4096, 4096, 1, 8192, 4096, 4096, 8192, 8192]
    - [27, 322.1]
  - - [4096, 8192, 1, 128, 4096, 4096, 128, 128]
    - [29, 106.62]
  - - [4096, 8192, 1, 256, 4096, 4096, 256, 256]
    - [29, 176.24]
  - - [4096, 8192, 1, 512, 4096, 4096, 512, 512]
    - [29, 232.51]
  - - [4096, 8192, 1, 1024, 4096, 4096, 1024, 1024]
    - [33, 276.31]
  - - [4096, 8192, 1, 2048, 4096, 4096, 2048, 2048]
    - [34, 311.29]
  - - [4096, 8192, 1, 4096, 4096, 4096, 4096, 4096]
    - [34, 337.28]
  - - [4096, 8192, 1, 8192, 4096, 4096, 8192, 8192]
    - [34, 384.95]
  - - [8192, 128, 1, 128, 8192, 8192, 128, 128]
    - [14, 28.94]
  - - [8192, 128, 1, 256, 8192, 8192, 256, 256]
    - [14, 51.25]
  - - [8192, 128, 1, 512, 8192, 8192, 512, 512]
    - [14, 81.92]
  - - [8192, 128, 1, 1024, 8192, 8192, 1024, 1024]
    - [17, 120.27]
  - - [8192, 128, 1, 2048, 8192, 8192, 2048, 2048]
    - [18, 158.56]
  - - [8192, 128, 1, 4096, 8192, 8192, 4096, 4096]
    - [85, 165.39]
  - - [8192, 128, 1, 8192, 8192, 8192, 8192, 8192]
    - [85, 183.14]
  - - [8192, 256, 1, 128, 8192, 8192, 128, 128]
    - [43, 43.73]
  - - [8192, 256, 1, 256, 8192, 8192, 256, 256]
    - [10, 78.26]
  - - [8192, 256, 1, 512, 8192, 8192, 512, 512]
    - [10, 127.1]
  - - [8192, 256, 1, 1024, 8192, 8192, 1024, 1024]
    - [42, 183.41]
  - - [8192, 256, 1, 2048, 8192, 8192, 2048, 2048]
    - [55, 226.88]
  - - [8192, 256, 1, 4096, 8192, 8192, 4096, 4096]
    - [54, 225.83]
  - - [8192, 256, 1, 8192, 8192, 8192, 8192, 8192]
    - [55, 243.35]
  - - [8192, 512, 1, 128, 8192, 8192, 128, 128]
    - [7, 61.84]
  - - [8192, 512, 1, 256, 8192, 8192, 256, 256]
    - [7, 107.43]
  - - [8192, 512, 1, 512, 8192, 8192, 512, 512]
    - [8, 168.88]
  - - [8192, 512, 1, 1024, 8192, 8192, 1024, 1024]
    - [9, 229.11]
  - - [8192, 512, 1, 2048, 8192, 8192, 2048, 2048]
    - [38, 252.67]
  - - [8192, 512, 1, 4096, 8192, 8192, 4096, 4096]
    - [48, 289.59]
  - - [8192, 512, 1, 8192, 8192, 8192, 8192, 8192]
    - [47, 316.22]
  - - [8192, 1024, 1, 128, 8192, 8192, 128, 128]
    - [3, 76.94]
  - - [8192, 1024, 1, 256, 8192, 8192, 256, 256]
    - [3, 129.2]
  - - [8192, 1024, 1, 512, 8192, 8192, 512, 512]
    - [1, 187.92]
  - - [8192, 1024, 1, 1024, 8192, 8192, 1024, 1024]
    - [5, 239.92]
  - - [8192, 1024, 1, 2048, 8192, 8192, 2048, 2048]
    - [41, 297.19]
  - - [8192, 1024, 1, 4096, 8192, 8192, 4096, 4096]
    - [40, 358.54]
  - - [8192, 1024, 1, 8192, 8192, 8192, 8192, 8192]
    - [41, 380.82]
  - - [8192, 2048, 1, 128, 8192, 8192, 128, 128]
    - [0, 81.35]
  - - [8192, 2048, 1, 256, 8192, 8192, 256, 256]
    - [3, 135.9]
  - - [8192, 2048, 1, 512, 8192, 8192, 512, 512]
    - [4, 192.28]
  - - [8192, 2048, 1, 1024, 8192, 8192, 1024, 1024]
    - [5, 242.92]
  - - [8192, 2048, 1, 2048, 8192, 8192, 2048, 2048]
    - [41, 318.75]
  - - [8192, 2048, 1, 4096, 8192, 8192, 4096, 4096]
    - [39, 342.7]
  - - [8192, 2048, 1, 8192, 8192, 8192, 8192, 8192]
    - [39, 407.77]
  - - [8192, 4096, 1, 128, 8192, 8192, 128, 128]
    - [1, 87.15]
  - - [8192, 4096, 1, 256, 8192, 8192, 256, 256]
    - [4, 140.53]
  - - [8192, 4096, 1, 512, 8192, 8192, 512, 512]
    - [6, 199.16]
  - - [8192, 4096, 1, 1024, 8192, 8192, 1024, 1024]
    - [40, 253.41]
  - - [8192, 4096, 1, 2048, 8192, 8192, 2048, 2048]
    - [39, 319.49]
  - - [8192, 4096, 1, 4096, 8192, 8192, 4096, 4096]
    - [40, 359.14]
  - - [8192, 4096, 1, 8192, 8192, 8192, 8192, 8192]
    - [40, 426.4]
  - - [8192, 8192, 1, 128, 8192, 8192, 128, 128]
    - [31, 108.11]
  - - [8192, 8192, 1, 256, 8192, 8192, 256, 256]
    - [35, 164.23]
  - - [8192, 8192, 1, 512, 8192, 8192, 512, 512]
    - [30, 217.77]
  - - [8192, 8192, 1, 1024, 8192, 8192, 1024, 1024]
    - [32, 281.14]
  - - [8192, 8192, 1, 2048, 8192, 8192, 2048, 2048]
    - [40, 319.95]
  - - [8192, 8192, 1, 4096, 8192, 8192, 4096, 4096]
    - [39, 371.73]
  - - [8192, 8192, 1, 8192, 8192, 8192, 8192, 8192]
    - [39, 428.12]
  - - [1, 1, 1, 32, 1, 1, 32, 32]
    - [92, 0.0]
- null
- null
- ExperimentalStreamK
- GridBased
