projects/hipblaslt/library/src/amd_detail/rocblaslt/src/Tensile/Logic/asm_full/aquavanjaram/gfx942_228cu/StreamK/aquavanjaram942_Cijk_Ailk_Bljk_F8B8NF8NS_BH_Bias_HAS_SAV_UserArgs.yaml
- {MinimumRequiredVersion: 4.33.0}
- aquavanjaram942
- {Architecture: gfx942, CUCount: 228}
- [Device 0049, Device 0050]
    SolutionIndex: 0
    SolutionNameMin: Cijk_Ailk_Bljk_F8B8NF8NS_BH_Bias_HAS_SAV_UserArgs_MT256x256x64_MI16x16x1_SN_LDSB1_CLR1_GRVWA8_GRVWB16_GSU0_GSUC0_GSUWGMRR0_K1_LBSPPA2048_LBSPPB512_LPA0_LPB16_LRVW8_MIWT8_8_PLR1_SU0_SUM0_SUS64_VWA8_VWB8_WGM1_WGMXCC1_WGMXCCGn1
    SolutionIndex: 1
    SolutionNameMin: Cijk_Ailk_Bljk_F8B8NF8NS_BH_Bias_HAS_SAV_UserArgs_MT256x256x64_MI16x16x1_SN_LDSB1_CLR1_GRVWA16_GRVWB16_GSU0_GSUC0_GSUWGMRR0_K1_LBSPPA2048_LBSPPB512_LPA0_LPB16_LRVW8_MIWT8_8_PLR1_SU0_SUM0_SUS64_VWA8_VWB8_WGM1_WGMXCC1_WGMXCCGn1
    SolutionIndex: 2
    SolutionNameMin: Cijk_Ailk_Bljk_F8B8NF8NS_BH_Bias_HAS_SAV_UserArgs_MT256x256x64_MI16x16x1_SN_LDSB1_CLR1_GRVWA8_GRVWB8_GSU0_GSUC0_GSUWGMRR0_K1_LBSPPA2048_LBSPPB512_LPA0_LPB8_LRVW8_MIWT8_8_PLR1_SU0_SUM0_SUS64_VWA8_VWB8_WGM4_WGMXCC1_WGMXCCGn1
    SolutionIndex: 3
    SolutionNameMin: Cijk_Ailk_Bljk_F8B8NF8NS_BH_Bias_HAS_SAV_UserArgs_MT256x256x64_MI16x16x1_SN_LDSB1_CLR1_GRVWA16_GRVWB8_GSU0_GSUC0_GSUWGMRR0_K1_LBSPPA2048_LBSPPB512_LPA0_LPB8_LRVW8_MIWT8_8_PLR1_SU0_SUM0_SUS64_VWA8_VWB8_WGM4_WGMXCC1_WGMXCCGn1
    SolutionIndex: 4
    SolutionNameMin: Cijk_Ailk_Bljk_F8B8NF8NS_BH_Bias_HAS_SAV_UserArgs_MT256x256x64_MI16x16x1_SN_LDSB1_CLR1_GRVWA8_GRVWB16_GSU0_GSUC0_GSUWGMRR0_K1_LBSPPA2048_LBSPPB512_LPA0_LPB16_LRVW8_MIWT8_8_PLR1_SU0_SUM0_SUS64_VWA8_VWB8_WGM4_WGMXCC1_WGMXCCGn1
    SolutionIndex: 5
    SolutionNameMin: Cijk_Ailk_Bljk_F8B8NF8NS_BH_Bias_HAS_SAV_UserArgs_MT256x256x64_MI16x16x1_SN_LDSB1_CLR1_GRVWA8_GRVWB8_GSU0_GSUC0_GSUWGMRR0_K1_LBSPPA2048_LBSPPB512_LPA0_LPB8_LRVW8_MIWT8_8_PLR1_SU0_SUM0_SUS64_VWA8_VWB8_WGM6_WGMXCC1_WGMXCCGn1
    SolutionIndex: 6
    SolutionNameMin: Cijk_Ailk_Bljk_F8B8NF8NS_BH_Bias_HAS_SAV_UserArgs_MT256x256x64_MI16x16x1_SN_LDSB1_CLR1_GRVWA8_GRVWB16_GSU0_GSUC0_GSUWGMRR0_K1_LBSPPA2048_LBSPPB512_LPA0_LPB16_LRVW8_MIWT8_8_PLR1_SU0_SUM0_SUS64_VWA8_VWB8_WGM6_WGMXCC1_WGMXCCGn1
    SolutionIndex: 7
    SolutionNameMin: Cijk_Ailk_Bljk_F8B8NF8NS_BH_Bias_HAS_SAV_UserArgs_MT256x256x64_MI16x16x1_SN_LDSB1_CLR1_GRVWA16_GRVWB16_GSU0_GSUC0_GSUWGMRR0_K1_LBSPPA2048_LBSPPB512_LPA0_LPB16_LRVW8_MIWT8_8_PLR1_SU0_SUM0_SUS64_VWA8_VWB8_WGM6_WGMXCC1_WGMXCCGn1
    SolutionIndex: 8
    SolutionNameMin: Cijk_Ailk_Bljk_F8B8NF8NS_BH_Bias_HAS_SAV_UserArgs_MT256x256x64_MI16x16x1_SN_LDSB1_CLR1_GRVWA8_GRVWB8_GSU0_GSUC0_GSUWGMRR0_K1_LBSPPA2048_LBSPPB512_LPA0_LPB8_LRVW8_MIWT8_8_PLR1_SU0_SUM0_SUS64_VWA8_VWB8_WGM8_WGMXCC1_WGMXCCGn1
    SolutionIndex: 9
    SolutionNameMin: Cijk_Ailk_Bljk_F8B8NF8NS_BH_Bias_HAS_SAV_UserArgs_MT256x256x64_MI16x16x1_SN_LDSB1_CLR1_GRVWA16_GRVWB8_GSU0_GSUC0_GSUWGMRR0_K1_LBSPPA2048_LBSPPB512_LPA0_LPB8_LRVW8_MIWT8_8_PLR1_SU0_SUM0_SUS64_VWA8_VWB8_WGM8_WGMXCC1_WGMXCCGn1
    SolutionIndex: 10
    SolutionNameMin: Cijk_Ailk_Bljk_F8B8NF8NS_BH_Bias_HAS_SAV_UserArgs_MT256x256x64_MI16x16x1_SN_LDSB1_CLR1_GRVWA8_GRVWB16_GSU0_GSUC0_GSUWGMRR0_K1_LBSPPA2048_LBSPPB512_LPA0_LPB16_LRVW8_MIWT8_8_PLR1_SU0_SUM0_SUS64_VWA8_VWB8_WGM8_WGMXCC1_WGMXCCGn1
    SolutionIndex: 11
    SolutionNameMin: Cijk_Ailk_Bljk_F8B8NF8NS_BH_Bias_HAS_SAV_UserArgs_MT128x256x64_MI16x16x1_SN_LDSB1_CLR1_GRVWA16_GRVWB8_GSU0_GSUC0_GSUWGMRR0_K1_LBSPPA1024_LBSPPB512_LPA64_LPB8_LRVW8_MIWT4_8_PLR1_SU0_SUM0_SUS64_VWA4_VWB8_WGM1_WGMXCC1_WGMXCCGn1
    SolutionIndex: 12
    SolutionNameMin: Cijk_Ailk_Bljk_F8B8NF8NS_BH_Bias_HAS_SAV_UserArgs_MT128x256x64_MI16x16x1_SN_LDSB1_CLR1_GRVWA8_GRVWB16_GSU0_GSUC0_GSUWGMRR0_K1_LBSPPA1024_LBSPPB512_LPA64_LPB16_LRVW8_MIWT4_8_PLR1_SU0_SUM0_SUS64_VWA4_VWB8_WGM1_WGMXCC1_WGMXCCGn1
    SolutionIndex: 13
    SolutionNameMin: Cijk_Ailk_Bljk_F8B8NF8NS_BH_Bias_HAS_SAV_UserArgs_MT128x256x64_MI16x16x1_SN_LDSB1_CLR1_GRVWA16_GRVWB8_GSU0_GSUC0_GSUWGMRR0_K1_LBSPPA1024_LBSPPB512_LPA64_LPB8_LRVW8_MIWT4_8_PLR1_SU0_SUM0_SUS64_VWA4_VWB8_WGM4_WGMXCC1_WGMXCCGn1
    SolutionIndex: 14
    SolutionNameMin: Cijk_Ailk_Bljk_F8B8NF8NS_BH_Bias_HAS_SAV_UserArgs_MT128x256x64_MI16x16x1_SN_LDSB1_CLR1_GRVWA16_GRVWB8_GSU0_GSUC0_GSUWGMRR0_K1_LBSPPA1024_LBSPPB512_LPA64_LPB8_LRVW8_MIWT4_8_PLR1_SU0_SUM0_SUS64_VWA4_VWB8_WGM8_WGMXCC1_WGMXCCGn1
    SolutionIndex: 15
    SolutionNameMin: Cijk_Ailk_Bljk_F8B8NF8NS_BH_Bias_HAS_SAV_UserArgs_MT256x128x64_MI16x16x1_SN_LDSB1_CLR1_GRVWA16_GRVWB8_GSU0_GSUC0_GSUWGMRR0_K1_LBSPPA2048_LBSPPB256_LPA0_LPB8_LRVW8_MIWT8_4_PLR1_SU0_SUM0_SUS64_VWA8_VWB4_WGM1_WGMXCC1_WGMXCCGn1
    SolutionIndex: 16
    SolutionNameMin: Cijk_Ailk_Bljk_F8B8NF8NS_BH_Bias_HAS_SAV_UserArgs_MT256x128x64_MI16x16x1_SN_LDSB1_CLR1_GRVWA16_GRVWB16_GSU0_GSUC0_GSUWGMRR0_K1_LBSPPA2048_LBSPPB256_LPA0_LPB16_LRVW8_MIWT8_4_PLR1_SU0_SUM0_SUS64_VWA8_VWB4_WGM1_WGMXCC1_WGMXCCGn1
    SolutionIndex: 17
    SolutionNameMin: Cijk_Ailk_Bljk_F8B8NF8NS_BH_Bias_HAS_SAV_UserArgs_MT256x128x64_MI16x16x1_SN_LDSB1_CLR1_GRVWA16_GRVWB16_GSU0_GSUC0_GSUWGMRR0_K1_LBSPPA2048_LBSPPB256_LPA0_LPB16_LRVW8_MIWT8_4_PLR1_SU0_SUM0_SUS64_VWA8_VWB4_WGM6_WGMXCC1_WGMXCCGn1
    SolutionIndex: 18
    SolutionNameMin: Cijk_Ailk_Bljk_F8B8NF8NS_BH_Bias_HAS_SAV_UserArgs_MT256x128x64_MI16x16x1_SN_LDSB1_CLR1_GRVWA16_GRVWB16_GSU0_GSUC0_GSUWGMRR0_K1_LBSPPA2048_LBSPPB256_LPA0_LPB16_LRVW8_MIWT8_4_PLR1_SU0_SUM0_SUS64_VWA8_VWB4_WGM8_WGMXCC1_WGMXCCGn1
    SolutionIndex: 19
    SolutionNameMin: Cijk_Ailk_Bljk_F8B8NF8NS_BH_Bias_HAS_SAV_UserArgs_MT128x128x64_MI16x16x1_SN_LDSB1_CLR1_GRVWA8_GRVWB8_GSU0_GSUC0_GSUWGMRR0_K1_LBSPPA1024_LBSPPB256_LPA64_LPB8_LRVW8_MIWT4_4_PLR1_SU0_SUM0_SUS64_VWA4_VWB4_WGM1_WGMXCC1_WGMXCCGn1
    SolutionIndex: 20
    SolutionNameMin: Cijk_Ailk_Bljk_F8B8NF8NS_BH_Bias_HAS_SAV_UserArgs_MT128x128x64_MI16x16x1_SN_LDSB1_CLR1_GRVWA16_GRVWB8_GSU0_GSUC0_GSUWGMRR0_K1_LBSPPA1024_LBSPPB256_LPA64_LPB8_LRVW8_MIWT4_4_PLR1_SU0_SUM0_SUS64_VWA4_VWB4_WGM1_WGMXCC1_WGMXCCGn1
    SolutionIndex: 21
    SolutionNameMin: Cijk_Ailk_Bljk_F8B8NF8NS_BH_Bias_HAS_SAV_UserArgs_MT128x128x64_MI16x16x1_SN_LDSB1_CLR1_GRVWA8_GRVWB16_GSU0_GSUC0_GSUWGMRR0_K1_LBSPPA1024_LBSPPB256_LPA64_LPB16_LRVW8_MIWT4_4_PLR1_SU0_SUM0_SUS64_VWA4_VWB4_WGM1_WGMXCC1_WGMXCCGn1
    SolutionIndex: 22
    SolutionNameMin: Cijk_Ailk_Bljk_F8B8NF8NS_BH_Bias_HAS_SAV_UserArgs_MT128x128x64_MI16x16x1_SN_LDSB1_CLR1_GRVWA16_GRVWB16_GSU0_GSUC0_GSUWGMRR0_K1_LBSPPA1024_LBSPPB256_LPA64_LPB16_LRVW8_MIWT4_4_PLR1_SU0_SUM0_SUS64_VWA4_VWB4_WGM1_WGMXCC1_WGMXCCGn1
    SolutionIndex: 23
    SolutionNameMin: Cijk_Ailk_Bljk_F8B8NF8NS_BH_Bias_HAS_SAV_UserArgs_MT64x128x64_MI16x16x1_SN_LDSB0_CLR1_GRVWA16_GRVWB8_GSU0_GSUC0_GSUWGMRR0_K1_LBSPPA512_LBSPPB256_LPA32_LPB8_LRVW8_MIWT2_4_PLR1_SU0_SUM0_SUS64_VWA2_VWB4_WGM1_WGMXCC1_WGMXCCGn1
    SolutionIndex: 24
    SolutionNameMin: Cijk_Ailk_Bljk_F8B8NF8NS_BH_Bias_HAS_SAV_UserArgs_MT64x128x64_MI16x16x1_SN_LDSB0_CLR1_GRVWA8_GRVWB16_GSU0_GSUC0_GSUWGMRR0_K1_LBSPPA512_LBSPPB256_LPA32_LPB16_LRVW8_MIWT2_4_PLR1_SU0_SUM0_SUS64_VWA2_VWB4_WGM1_WGMXCC1_WGMXCCGn1
    SolutionIndex: 25
    SolutionNameMin: Cijk_Ailk_Bljk_F8B8NF8NS_BH_Bias_HAS_SAV_UserArgs_MT64x128x64_MI16x16x1_SN_LDSB0_CLR1_GRVWA16_GRVWB16_GSU0_GSUC0_GSUWGMRR0_K1_LBSPPA512_LBSPPB256_LPA32_LPB16_LRVW8_MIWT2_4_PLR1_SU0_SUM0_SUS64_VWA2_VWB4_WGM1_WGMXCC1_WGMXCCGn1
    SolutionIndex: 26
    SolutionNameMin: Cijk_Ailk_Bljk_F8B8NF8NS_BH_Bias_HAS_SAV_UserArgs_MT128x64x64_MI16x16x1_SN_LDSB0_CLR1_GRVWA16_GRVWB8_GSU0_GSUC0_GSUWGMRR0_K1_LBSPPA1024_LBSPPB128_LPA64_LPB8_LRVW8_MIWT4_2_PLR1_SU0_SUM0_SUS64_VWA4_VWB2_WGM1_WGMXCC1_WGMXCCGn1
    SolutionIndex: 27
    SolutionNameMin: Cijk_Ailk_Bljk_F8B8NF8NS_BH_Bias_HAS_SAV_UserArgs_MT128x64x64_MI16x16x1_SN_LDSB0_CLR1_GRVWA8_GRVWB16_GSU0_GSUC0_GSUWGMRR0_K1_LBSPPA1024_LBSPPB128_LPA64_LPB16_LRVW8_MIWT4_2_PLR1_SU0_SUM0_SUS64_VWA4_VWB2_WGM1_WGMXCC1_WGMXCCGn1
    SolutionIndex: 28
    SolutionNameMin: Cijk_Ailk_Bljk_F8B8NF8NS_BH_Bias_HAS_SAV_UserArgs_MT128x64x64_MI16x16x1_SN_LDSB0_CLR1_GRVWA16_GRVWB16_GSU0_GSUC0_GSUWGMRR0_K1_LBSPPA1024_LBSPPB128_LPA64_LPB16_LRVW8_MIWT4_2_PLR1_SU0_SUM0_SUS64_VWA4_VWB2_WGM1_WGMXCC1_WGMXCCGn1
    SolutionIndex: 29
    SolutionNameMin: Cijk_Ailk_Bljk_F8B8NF8NS_BH_Bias_HAS_SAV_UserArgs_MT128x32x64_MI16x16x1_SN_LDSB0_CLR1_GRVWA8_GRVWB8_GSU0_GSUC0_GSUWGMRR0_K1_LBSPPA1024_LBSPPB128_LPA64_LPB8_LRVW8_MIWT4_1_PLR1_SU0_SUM0_SUS64_VWA4_VWB1_WGM1_WGMXCC1_WGMXCCGn1
    SolutionIndex: 30
    SolutionNameMin: Cijk_Ailk_Bljk_F8B8NF8NS_BH_Bias_HAS_SAV_UserArgs_MT128x32x64_MI16x16x1_SN_LDSB0_CLR1_GRVWA16_GRVWB8_GSU0_GSUC0_GSUWGMRR0_K1_LBSPPA1024_LBSPPB128_LPA64_LPB8_LRVW8_MIWT4_1_PLR1_SU0_SUM0_SUS64_VWA4_VWB1_WGM1_WGMXCC1_WGMXCCGn1
    SolutionIndex: 31
    SolutionNameMin: Cijk_Ailk_Bljk_F8B8NF8NS_BH_Bias_HAS_SAV_UserArgs_MT64x64x64_MI16x16x1_SN_LDSB0_CLR1_GRVWA8_GRVWB8_GSU0_GSUC0_GSUWGMRR0_K1_LBSPPA512_LBSPPB128_LPA32_LPB8_LRVW8_MIWT2_2_PLR1_SU0_SUM0_SUS64_VWA2_VWB2_WGM1_WGMXCC1_WGMXCCGn1
    SolutionIndex: 32
    SolutionNameMin: Cijk_Ailk_Bljk_F8B8NF8NS_BH_Bias_HAS_SAV_UserArgs_MT64x64x64_MI16x16x1_SN_LDSB0_CLR1_GRVWA8_GRVWB16_GSU0_GSUC0_GSUWGMRR0_K1_LBSPPA512_LBSPPB128_LPA32_LPB16_LRVW8_MIWT2_2_PLR1_SU0_SUM0_SUS64_VWA2_VWB2_WGM1_WGMXCC1_WGMXCCGn1
    SolutionIndex: 33
    SolutionNameMin: Cijk_Ailk_Bljk_F8B8NF8NS_BH_Bias_HAS_SAV_UserArgs_MT32x64x64_MI16x16x1_SN_LDSB0_CLR1_GRVWA8_GRVWB16_GSU0_GSUC0_GSUWGMRR0_K1_LBSPPA256_LBSPPB128_LPA16_LPB16_LRVW8_MIWT1_2_PLR1_SU0_SUM0_SUS64_VWA1_VWB2_WGM1_WGMXCC1_WGMXCCGn1
    SolutionIndex: 34
    SolutionNameMin: Cijk_Ailk_Bljk_F8B8NF8NS_BH_Bias_HAS_SAV_UserArgs_MT32x32x64_MI16x16x1_SN_LDSB0_CLR1_GRVWA8_GRVWB8_GSU0_GSUC0_GSUWGMRR0_K1_LBSPPA256_LBSPPB128_LPA16_LPB8_LRVW8_MIWT1_1_PLR1_SU0_SUM0_SUS64_VWA1_VWB1_WGM1_WGMXCC1_WGMXCCGn1
    SolutionIndex: 35
    SolutionNameMin: Cijk_Ailk_Bljk_F8B8NF8NS_BH_Bias_HAS_SAV_UserArgs_MT32x32x64_MI16x16x1_SN_LDSB0_CLR1_GRVWA8_GRVWB8_GSU0_GSUC0_GSUWGMRR0_K1_LBSPPA256_LBSPPB128_LPA16_LPB8_LRVW8_MIWT1_1_PLR1_SU0_SUM0_SUS64_VWA1_VWB1_WGM4_WGMXCC1_WGMXCCGn1
    SolutionIndex: 36
    SolutionNameMin: Cijk_Ailk_Bljk_F8B8NF8NS_BH_Bias_HAS_SAV_UserArgs_MT128x256x128_MI16x16x1_SN_LDSB1_CLR1_GRVWA16_GRVWB16_GSU0_GSUC0_GSUWGMRR0_K1_LBSPPA1024_LBSPPB1024_LPA64_LPB16_LRVW8_MIWT4_8_PLR1_SU0_SUM0_SUS128_VWA4_VWB8_WGM1_WGMXCC1_WGMXCCGn1
    SolutionIndex: 37
    SolutionNameMin: Cijk_Ailk_Bljk_F8B8NF8NS_BH_Bias_HAS_SAV_UserArgs_MT128x256x128_MI16x16x1_SN_LDSB1_CLR1_GRVWA16_GRVWB16_GSU0_GSUC0_GSUWGMRR0_K1_LBSPPA1024_LBSPPB1024_LPA64_LPB16_LRVW8_MIWT4_8_PLR1_SU0_SUM0_SUS128_VWA4_VWB8_WGM4_WGMXCC1_WGMXCCGn1
    SolutionIndex: 38
    SolutionNameMin: Cijk_Ailk_Bljk_F8B8NF8NS_BH_Bias_HAS_SAV_UserArgs_MT128x256x128_MI16x16x1_SN_LDSB1_CLR1_GRVWA16_GRVWB16_GSU0_GSUC0_GSUWGMRR0_K1_LBSPPA1024_LBSPPB1024_LPA64_LPB16_LRVW8_MIWT4_8_PLR1_SU0_SUM0_SUS128_VWA4_VWB8_WGM6_WGMXCC1_WGMXCCGn1
    SolutionIndex: 39
    SolutionNameMin: Cijk_Ailk_Bljk_F8B8NF8NS_BH_Bias_HAS_SAV_UserArgs_MT256x144x128_MI16x16x1_SN_LDSB1_CLR1_GRVWA8_GRVWB8_GSU0_GSUC0_GSUWGMRR0_K1_LBSPPA2048_LBSPPB128_LPA64_LPB8_LRVW8_MIWT4_9_PLR1_SU0_SUM0_SUS128_VWA4_VWB1_WGM1_WGMXCC1_WGMXCCGn1
    SolutionIndex: 40
    SolutionNameMin: Cijk_Ailk_Bljk_F8B8NF8NS_BH_Bias_HAS_SAV_UserArgs_MT256x144x128_MI16x16x1_SN_LDSB1_CLR1_GRVWA16_GRVWB8_GSU0_GSUC0_GSUWGMRR0_K1_LBSPPA2048_LBSPPB128_LPA64_LPB8_LRVW8_MIWT4_9_PLR1_SU0_SUM0_SUS128_VWA4_VWB1_WGM1_WGMXCC1_WGMXCCGn1
    SolutionIndex: 41
    SolutionNameMin: Cijk_Ailk_Bljk_F8B8NF8NS_BH_Bias_HAS_SAV_UserArgs_MT256x144x128_MI16x16x1_SN_LDSB1_CLR1_GRVWA16_GRVWB8_GSU0_GSUC0_GSUWGMRR0_K1_LBSPPA2048_LBSPPB128_LPA64_LPB8_LRVW8_MIWT4_9_PLR1_SU0_SUM0_SUS128_VWA4_VWB1_WGM4_WGMXCC1_WGMXCCGn1
    SolutionIndex: 42
    SolutionNameMin: Cijk_Ailk_Bljk_F8B8NF8NS_BH_Bias_HAS_SAV_UserArgs_MT256x144x128_MI16x16x1_SN_LDSB1_CLR1_GRVWA16_GRVWB8_GSU0_GSUC0_GSUWGMRR0_K1_LBSPPA2048_LBSPPB128_LPA64_LPB8_LRVW8_MIWT4_9_PLR1_SU0_SUM0_SUS128_VWA4_VWB1_WGM6_WGMXCC1_WGMXCCGn1
    SolutionIndex: 43
    SolutionNameMin: Cijk_Ailk_Bljk_F8B8NF8NS_BH_Bias_HAS_SAV_UserArgs_MT256x144x128_MI16x16x1_SN_LDSB1_CLR1_GRVWA8_GRVWB8_GSU0_GSUC0_GSUWGMRR0_K1_LBSPPA2048_LBSPPB128_LPA64_LPB8_LRVW8_MIWT4_9_PLR1_SU0_SUM0_SUS128_VWA4_VWB1_WGM8_WGMXCC1_WGMXCCGn1
    SolutionIndex: 44
    SolutionNameMin: Cijk_Ailk_Bljk_F8B8NF8NS_BH_Bias_HAS_SAV_UserArgs_MT256x144x128_MI16x16x1_SN_LDSB1_CLR1_GRVWA16_GRVWB8_GSU0_GSUC0_GSUWGMRR0_K1_LBSPPA2048_LBSPPB128_LPA64_LPB8_LRVW8_MIWT4_9_PLR1_SU0_SUM0_SUS128_VWA4_VWB1_WGM8_WGMXCC1_WGMXCCGn1
    SolutionIndex: 45
    SolutionNameMin: Cijk_Ailk_Bljk_F8B8NF8NS_BH_Bias_HAS_SAV_UserArgs_MT256x128x128_MI16x16x1_SN_LDSB1_CLR1_GRVWA16_GRVWB8_GSU0_GSUC0_GSUWGMRR0_K1_LBSPPA2048_LBSPPB512_LPA0_LPB8_LRVW8_MIWT8_4_PLR1_SU0_SUM0_SUS128_VWA8_VWB4_WGM1_WGMXCC1_WGMXCCGn1
    SolutionIndex: 46
    SolutionNameMin: Cijk_Ailk_Bljk_F8B8NF8NS_BH_Bias_HAS_SAV_UserArgs_MT256x128x128_MI16x16x1_SN_LDSB1_CLR1_GRVWA16_GRVWB8_GSU0_GSUC0_GSUWGMRR0_K1_LBSPPA2048_LBSPPB512_LPA0_LPB8_LRVW8_MIWT8_4_PLR1_SU0_SUM0_SUS128_VWA8_VWB4_WGM8_WGMXCC1_WGMXCCGn1
    SolutionIndex: 47
    SolutionNameMin: Cijk_Ailk_Bljk_F8B8NF8NS_BH_Bias_HAS_SAV_UserArgs_MT128x144x128_MI16x16x1_SN_LDSB1_CLR1_GRVWA8_GRVWB8_GSU0_GSUC0_GSUWGMRR0_K1_LBSPPA1024_LBSPPB128_LPA32_LPB8_LRVW8_MIWT2_9_PLR1_SU0_SUM0_SUS128_VWA2_VWB1_WGM1_WGMXCC1_WGMXCCGn1
    SolutionIndex: 48
    SolutionNameMin: Cijk_Ailk_Bljk_F8B8NF8NS_BH_Bias_HAS_SAV_UserArgs_MT128x144x128_MI16x16x1_SN_LDSB1_CLR1_GRVWA16_GRVWB8_GSU0_GSUC0_GSUWGMRR0_K1_LBSPPA1024_LBSPPB128_LPA32_LPB8_LRVW8_MIWT2_9_PLR1_SU0_SUM0_SUS128_VWA2_VWB1_WGM1_WGMXCC1_WGMXCCGn1
    SolutionIndex: 49
    SolutionNameMin: Cijk_Ailk_Bljk_F8B8NF8NS_BH_Bias_HAS_SAV_UserArgs_MT128x144x128_MI16x16x1_SN_LDSB1_CLR1_GRVWA16_GRVWB8_GSU0_GSUC0_GSUWGMRR0_K1_LBSPPA1024_LBSPPB128_LPA32_LPB8_LRVW8_MIWT2_9_PLR1_SU0_SUM0_SUS128_VWA2_VWB1_WGM6_WGMXCC1_WGMXCCGn1
    SolutionIndex: 50
    SolutionNameMin: Cijk_Ailk_Bljk_F8B8NF8NS_BH_Bias_HAS_SAV_UserArgs_MT128x128x128_MI16x16x1_SN_LDSB1_CLR1_GRVWA16_GRVWB16_GSU0_GSUC0_GSUWGMRR0_K1_LBSPPA1024_LBSPPB512_LPA64_LPB16_LRVW8_MIWT4_4_PLR1_SU0_SUM0_SUS128_VWA4_VWB4_WGM1_WGMXCC1_WGMXCCGn1
    SolutionIndex: 51
    SolutionNameMin: Cijk_Ailk_Bljk_F8B8NF8NS_BH_Bias_HAS_SAV_UserArgs_MT128x128x128_MI16x16x1_SN_LDSB1_CLR1_GRVWA16_GRVWB16_GSU0_GSUC0_GSUWGMRR0_K1_LBSPPA1024_LBSPPB512_LPA64_LPB16_LRVW8_MIWT4_4_PLR1_SU0_SUM0_SUS128_VWA4_VWB4_WGM4_WGMXCC1_WGMXCCGn1
    SolutionIndex: 52
    SolutionNameMin: Cijk_Ailk_Bljk_F8B8NF8NS_BH_Bias_HAS_SAV_UserArgs_MT128x128x128_MI16x16x1_SN_LDSB1_CLR1_GRVWA16_GRVWB16_GSU0_GSUC0_GSUWGMRR0_K1_LBSPPA1024_LBSPPB512_LPA64_LPB16_LRVW8_MIWT4_4_PLR1_SU0_SUM0_SUS128_VWA4_VWB4_WGM6_WGMXCC1_WGMXCCGn1
    SolutionIndex: 53
    SolutionNameMin: Cijk_Ailk_Bljk_F8B8NF8NS_BH_Bias_HAS_SAV_UserArgs_MT128x128x128_MI16x16x1_SN_LDSB1_CLR1_GRVWA16_GRVWB16_GSU0_GSUC0_GSUWGMRR0_K1_LBSPPA1024_LBSPPB512_LPA64_LPB16_LRVW8_MIWT4_4_PLR1_SU0_SUM0_SUS128_VWA4_VWB4_WGM8_WGMXCC1_WGMXCCGn1
    SolutionIndex: 54
    SolutionNameMin: Cijk_Ailk_Bljk_F8B8NF8NS_BH_Bias_HAS_SAV_UserArgs_MT64x128x128_MI16x16x1_SN_LDSB1_CLR1_GRVWA16_GRVWB16_GSU0_GSUC0_GSUWGMRR0_K1_LBSPPA512_LBSPPB512_LPA32_LPB16_LRVW8_MIWT2_4_PLR1_SU0_SUM0_SUS128_VWA2_VWB4_WGM1_WGMXCC1_WGMXCCGn1
    SolutionIndex: 55
    SolutionNameMin: Cijk_Ailk_Bljk_F8B8NF8NS_BH_Bias_HAS_SAV_UserArgs_MT128x64x128_MI16x16x1_SN_LDSB1_CLR1_GRVWA16_GRVWB16_GSU0_GSUC0_GSUWGMRR0_K1_LBSPPA1024_LBSPPB256_LPA64_LPB16_LRVW8_MIWT4_2_PLR1_SU0_SUM0_SUS128_VWA4_VWB2_WGM1_WGMXCC1_WGMXCCGn1
    SolutionIndex: 56
    SolutionNameMin: Cijk_Ailk_Bljk_F8B8NF8NS_BH_Bias_HAS_SAV_UserArgs_MT128x64x128_MI16x16x1_SN_LDSB1_CLR1_GRVWA16_GRVWB16_GSU0_GSUC0_GSUWGMRR0_K1_LBSPPA1024_LBSPPB256_LPA64_LPB16_LRVW8_MIWT4_2_PLR1_SU0_SUM0_SUS128_VWA4_VWB2_WGM4_WGMXCC1_WGMXCCGn1
    SolutionIndex: 57
    SolutionNameMin: Cijk_Ailk_Bljk_F8B8NF8NS_BH_Bias_HAS_SAV_UserArgs_MT128x64x128_MI16x16x1_SN_LDSB1_CLR1_GRVWA16_GRVWB16_GSU0_GSUC0_GSUWGMRR0_K1_LBSPPA1024_LBSPPB256_LPA64_LPB16_LRVW8_MIWT4_2_PLR1_SU0_SUM0_SUS128_VWA4_VWB2_WGM6_WGMXCC1_WGMXCCGn1
    SolutionIndex: 58
    SolutionNameMin: Cijk_Ailk_Bljk_F8B8NF8NS_BH_Bias_HAS_SAV_UserArgs_MT128x64x128_MI16x16x1_SN_LDSB1_CLR1_GRVWA16_GRVWB16_GSU0_GSUC0_GSUWGMRR0_K1_LBSPPA1024_LBSPPB256_LPA64_LPB16_LRVW8_MIWT4_2_PLR1_SU0_SUM0_SUS128_VWA4_VWB2_WGM8_WGMXCC1_WGMXCCGn1
    SolutionIndex: 59
    SolutionNameMin: Cijk_Ailk_Bljk_F8B8NF8NS_BH_Bias_HAS_SAV_UserArgs_MT64x64x128_MI16x16x1_SN_LDSB1_CLR1_GRVWA16_GRVWB8_GSU0_GSUC0_GSUWGMRR0_K1_LBSPPA512_LBSPPB256_LPA32_LPB8_LRVW8_MIWT2_2_PLR1_SU0_SUM0_SUS128_VWA2_VWB2_WGM1_WGMXCC1_WGMXCCGn1
    SolutionIndex: 60
    SolutionNameMin: Cijk_Ailk_Bljk_F8B8NF8NS_BH_Bias_HAS_SAV_UserArgs_MT64x64x128_MI16x16x1_SN_LDSB1_CLR1_GRVWA8_GRVWB16_GSU0_GSUC0_GSUWGMRR0_K1_LBSPPA512_LBSPPB256_LPA32_LPB16_LRVW8_MIWT2_2_PLR1_SU0_SUM0_SUS128_VWA2_VWB2_WGM1_WGMXCC1_WGMXCCGn1
    SolutionIndex: 61
    SolutionNameMin: Cijk_Ailk_Bljk_F8B8NF8NS_BH_Bias_HAS_SAV_UserArgs_MT64x64x128_MI16x16x1_SN_LDSB1_CLR1_GRVWA16_GRVWB16_GSU0_GSUC0_GSUWGMRR0_K1_LBSPPA512_LBSPPB256_LPA32_LPB16_LRVW8_MIWT2_2_PLR1_SU0_SUM0_SUS128_VWA2_VWB2_WGM1_WGMXCC1_WGMXCCGn1
    SolutionIndex: 62
    SolutionNameMin: Cijk_Ailk_Bljk_F8B8NF8NS_BH_Bias_HAS_SAV_UserArgs_MT64x64x128_MI16x16x1_SN_LDSB1_CLR1_GRVWA16_GRVWB16_GSU0_GSUC0_GSUWGMRR0_K1_LBSPPA512_LBSPPB256_LPA32_LPB16_LRVW8_MIWT2_2_PLR1_SU0_SUM0_SUS128_VWA2_VWB2_WGM4_WGMXCC1_WGMXCCGn1
    SolutionIndex: 63
    SolutionNameMin: Cijk_Ailk_Bljk_F8B8NF8NS_BH_Bias_HAS_SAV_UserArgs_MT64x64x128_MI16x16x1_SN_LDSB1_CLR1_GRVWA16_GRVWB16_GSU0_GSUC0_GSUWGMRR0_K1_LBSPPA512_LBSPPB256_LPA32_LPB16_LRVW8_MIWT2_2_PLR1_SU0_SUM0_SUS128_VWA2_VWB2_WGM6_WGMXCC1_WGMXCCGn1
    SolutionIndex: 64
    SolutionNameMin: Cijk_Ailk_Bljk_F8B8NF8NS_BH_Bias_HAS_SAV_UserArgs_MT64x64x128_MI16x16x1_SN_LDSB1_CLR1_GRVWA16_GRVWB16_GSU0_GSUC0_GSUWGMRR0_K1_LBSPPA512_LBSPPB256_LPA32_LPB16_LRVW8_MIWT2_2_PLR1_SU0_SUM0_SUS128_VWA2_VWB2_WGM8_WGMXCC1_WGMXCCGn1
    SolutionIndex: 65
    SolutionNameMin: Cijk_Ailk_Bljk_F8B8NF8NS_BH_Bias_HAS_SAV_UserArgs_MT32x64x128_MI16x16x1_SN_LDSB0_CLR1_GRVWA8_GRVWB16_GSU0_GSUC0_GSUWGMRR0_K1_LBSPPA256_LBSPPB256_LPA16_LPB16_LRVW8_MIWT1_2_PLR1_SU0_SUM0_SUS128_VWA1_VWB2_WGM1_WGMXCC1_WGMXCCGn1
    SolutionIndex: 66
    SolutionNameMin: Cijk_Ailk_Bljk_F8B8NF8NS_BH_Bias_HAS_SAV_UserArgs_MT32x64x128_MI16x16x1_SN_LDSB0_CLR1_GRVWA16_GRVWB16_GSU0_GSUC0_GSUWGMRR0_K1_LBSPPA256_LBSPPB256_LPA16_LPB16_LRVW8_MIWT1_2_PLR1_SU0_SUM0_SUS128_VWA1_VWB2_WGM1_WGMXCC1_WGMXCCGn1
    SolutionIndex: 67
    SolutionNameMin: Cijk_Ailk_Bljk_F8B8NF8NS_BH_Bias_HAS_SAV_UserArgs_MT32x64x128_MI16x16x1_SN_LDSB0_CLR1_GRVWA8_GRVWB16_GSU0_GSUC0_GSUWGMRR0_K1_LBSPPA256_LBSPPB256_LPA16_LPB16_LRVW8_MIWT1_2_PLR1_SU0_SUM0_SUS128_VWA1_VWB2_WGM8_WGMXCC1_WGMXCCGn1
    SolutionIndex: 68
    SolutionNameMin: Cijk_Ailk_Bljk_F8B8NF8NS_BH_Bias_HAS_SAV_UserArgs_MT64x32x128_MI16x16x1_SN_LDSB0_CLR1_GRVWA8_GRVWB8_GSU0_GSUC0_GSUWGMRR0_K1_LBSPPA512_LBSPPB128_LPA32_LPB8_LRVW8_MIWT2_1_PLR1_SU0_SUM0_SUS128_VWA2_VWB1_WGM1_WGMXCC1_WGMXCCGn1
    SolutionIndex: 69
    SolutionNameMin: Cijk_Ailk_Bljk_F8B8NF8NS_BH_Bias_HAS_SAV_UserArgs_MT64x32x128_MI16x16x1_SN_LDSB0_CLR1_GRVWA16_GRVWB8_GSU0_GSUC0_GSUWGMRR0_K1_LBSPPA512_LBSPPB128_LPA32_LPB8_LRVW8_MIWT2_1_PLR1_SU0_SUM0_SUS128_VWA2_VWB1_WGM1_WGMXCC1_WGMXCCGn1
    SolutionIndex: 70
    SolutionNameMin: Cijk_Ailk_Bljk_F8B8NF8NS_BH_Bias_HAS_SAV_UserArgs_MT64x32x128_MI16x16x1_SN_LDSB0_CLR1_GRVWA8_GRVWB16_GSU0_GSUC0_GSUWGMRR0_K1_LBSPPA512_LBSPPB128_LPA32_LPB16_LRVW8_MIWT2_1_PLR1_SU0_SUM0_SUS128_VWA2_VWB1_WGM1_WGMXCC1_WGMXCCGn1
    SolutionIndex: 71
    SolutionNameMin: Cijk_Ailk_Bljk_F8B8NF8NS_BH_Bias_HAS_SAV_UserArgs_MT64x32x128_MI16x16x1_SN_LDSB0_CLR1_GRVWA16_GRVWB16_GSU0_GSUC0_GSUWGMRR0_K1_LBSPPA512_LBSPPB128_LPA32_LPB16_LRVW8_MIWT2_1_PLR1_SU0_SUM0_SUS128_VWA2_VWB1_WGM1_WGMXCC1_WGMXCCGn1
    SolutionIndex: 72
    SolutionNameMin: Cijk_Ailk_Bljk_F8B8NF8NS_BH_Bias_HAS_SAV_UserArgs_MT32x32x128_MI16x16x1_SN_LDSB0_CLR1_GRVWA8_GRVWB8_GSU0_GSUC0_GSUWGMRR0_K1_LBSPPA256_LBSPPB128_LPA16_LPB8_LRVW8_MIWT1_1_PLR1_SU0_SUM0_SUS128_VWA1_VWB1_WGM1_WGMXCC1_WGMXCCGn1
    SolutionIndex: 73
    SolutionNameMin: Cijk_Ailk_Bljk_F8B8NF8NS_BH_Bias_HAS_SAV_UserArgs_MT32x32x128_MI16x16x1_SN_LDSB0_CLR1_GRVWA8_GRVWB16_GSU0_GSUC0_GSUWGMRR0_K1_LBSPPA256_LBSPPB128_LPA16_LPB16_LRVW8_MIWT1_1_PLR1_SU0_SUM0_SUS128_VWA1_VWB1_WGM1_WGMXCC1_WGMXCCGn1
    SolutionIndex: 74
    SolutionNameMin: Cijk_Ailk_Bljk_F8B8NF8NS_BH_Bias_HAS_SAV_UserArgs_MT32x32x128_MI16x16x1_SN_LDSB0_CLR1_GRVWA16_GRVWB16_GSU0_GSUC0_GSUWGMRR0_K1_LBSPPA256_LBSPPB128_LPA16_LPB16_LRVW8_MIWT1_1_PLR1_SU0_SUM0_SUS128_VWA1_VWB1_WGM1_WGMXCC1_WGMXCCGn1
    SolutionIndex: 75
    SolutionNameMin: Cijk_Ailk_Bljk_F8B8NF8NS_BH_Bias_HAS_SAV_UserArgs_MT128x64x256_MI16x16x1_SN_LDSB1_CLR1_GRVWA16_GRVWB16_GSU0_GSUC0_GSUWGMRR0_K1_LBSPPA1024_LBSPPB512_LPA64_LPB16_LRVW8_MIWT4_2_PLR1_SU0_SUM0_SUS256_VWA4_VWB2_WGM1_WGMXCC1_WGMXCCGn1
    SolutionIndex: 76
    SolutionNameMin: Cijk_Ailk_Bljk_F8B8NF8NS_BH_Bias_HAS_SAV_UserArgs_MT64x64x256_MI16x16x1_SN_LDSB1_CLR1_GRVWA16_GRVWB16_GSU0_GSUC0_GSUWGMRR0_K1_LBSPPA512_LBSPPB512_LPA32_LPB16_LRVW8_MIWT2_2_PLR1_SU0_SUM0_SUS256_VWA2_VWB2_WGM1_WGMXCC1_WGMXCCGn1
    SolutionIndex: 77
    SolutionNameMin: Cijk_Ailk_Bljk_F8B8NF8NS_BH_Bias_HAS_SAV_UserArgs_MT64x32x256_MI16x16x1_SN_LDSB1_CLR1_GRVWA16_GRVWB16_GSU0_GSUC0_GSUWGMRR0_K1_LBSPPA512_LBSPPB256_LPA32_LPB16_LRVW8_MIWT2_1_PLR1_SU0_SUM0_SUS256_VWA2_VWB1_WGM1_WGMXCC1_WGMXCCGn1
    SolutionIndex: 78
    SolutionNameMin: Cijk_Ailk_Bljk_F8B8NF8NS_BH_Bias_HAS_SAV_UserArgs_MT64x32x256_MI16x16x1_SN_LDSB1_CLR1_GRVWA16_GRVWB16_GSU0_GSUC0_GSUWGMRR0_K1_LBSPPA512_LBSPPB256_LPA32_LPB16_LRVW8_MIWT2_1_PLR1_SU0_SUM0_SUS256_VWA2_VWB1_WGM4_WGMXCC1_WGMXCCGn1
    SolutionIndex: 79
    SolutionNameMin: Cijk_Ailk_Bljk_F8B8NF8NS_BH_Bias_HAS_SAV_UserArgs_MT64x32x256_MI16x16x1_SN_LDSB1_CLR1_GRVWA16_GRVWB16_GSU0_GSUC0_GSUWGMRR0_K1_LBSPPA512_LBSPPB256_LPA32_LPB16_LRVW8_MIWT2_1_PLR1_SU0_SUM0_SUS256_VWA2_VWB1_WGM6_WGMXCC1_WGMXCCGn1
    SolutionIndex: 80
    SolutionNameMin: Cijk_Ailk_Bljk_F8B8NF8NS_BH_Bias_HAS_SAV_UserArgs_MT32x32x256_MI16x16x1_SN_LDSB1_CLR1_GRVWA8_GRVWB16_GSU0_GSUC0_GSUWGMRR0_K1_LBSPPA256_LBSPPB256_LPA16_LPB16_LRVW8_MIWT1_1_PLR1_SU0_SUM0_SUS256_VWA1_VWB1_WGM1_WGMXCC1_WGMXCCGn1
    SolutionIndex: 81
    SolutionNameMin: Cijk_Ailk_Bljk_F8B8NF8NS_BH_Bias_HAS_SAV_UserArgs_MT32x32x256_MI16x16x1_SN_LDSB1_CLR1_GRVWA8_GRVWB16_GSU0_GSUC0_GSUWGMRR0_K1_LBSPPA256_LBSPPB256_LPA16_LPB16_LRVW8_MIWT1_1_PLR1_SU0_SUM0_SUS256_VWA1_VWB1_WGM6_WGMXCC1_WGMXCCGn1
    SolutionIndex: 82
    SolutionNameMin: Cijk_Ailk_Bljk_F8B8NF8NS_BH_Bias_HAS_SAV_UserArgs_MT32x32x256_MI16x16x1_SN_LDSB1_CLR1_GRVWA16_GRVWB16_GSU0_GSUC0_GSUWGMRR0_K1_LBSPPA256_LBSPPB256_LPA16_LPB16_LRVW8_MIWT1_1_PLR1_SU0_SUM0_SUS256_VWA1_VWB1_WGM6_WGMXCC1_WGMXCCGn1
    SolutionIndex: 83
    SolutionNameMin: Cijk_Ailk_Bljk_F8B8NF8NS_BH_Bias_HAS_SAV_UserArgs_MT32x32x256_MI16x16x1_SN_LDSB1_CLR1_GRVWA16_GRVWB16_GSU0_GSUC0_GSUWGMRR0_K1_LBSPPA256_LBSPPB256_LPA16_LPB16_LRVW8_MIWT1_1_PLR1_SU0_SUM0_SUS256_VWA1_VWB1_WGM8_WGMXCC1_WGMXCCGn1
- - - [128, 128, 1, 128, 128, 128, 128, 128]
    - [34, 0.54]
  - - [128, 128, 1, 256, 128, 128, 128, 256]
    - [73, 1.0]
  - - [128, 128, 1, 512, 128, 128, 128, 512]
    - [73, 1.72]
  - - [128, 128, 1, 1024, 128, 128, 128, 1024]
    - [73, 2.72]
  - - [128, 128, 1, 2048, 128, 128, 128, 2048]
    - [72, 3.8]
  - - [128, 128, 1, 4096, 128, 128, 128, 4096]
    - [72, 4.79]
  - - [128, 128, 1, 8192, 128, 128, 128, 8192]
    - [74, 5.47]
  - - [128, 256, 1, 128, 128, 128, 128, 128]
    - [72, 1.1]
  - - [128, 256, 1, 256, 128, 128, 128, 256]
    - [72, 2.05]
  - - [128, 256, 1, 512, 128, 128, 128, 512]
    - [72, 3.55]
  - - [128, 256, 1, 1024, 128, 128, 128, 1024]
    - [72, 5.51]
  - - [128, 256, 1, 2048, 128, 128, 128, 2048]
    - [73, 7.63]
  - - [128, 256, 1, 4096, 128, 128, 128, 4096]
    - [74, 9.64]
  - - [128, 256, 1, 8192, 128, 128, 128, 8192]
    - [72, 10.96]
  - - [128, 512, 1, 128, 128, 128, 128, 128]
    - [73, 2.25]
  - - [128, 512, 1, 256, 128, 128, 128, 256]
    - [72, 4.06]
  - - [128, 512, 1, 512, 128, 128, 128, 512]
    - [74, 6.93]
  - - [128, 512, 1, 1024, 128, 128, 128, 1024]
    - [73, 10.91]
  - - [128, 512, 1, 2048, 128, 128, 128, 2048]
    - [72, 15.29]
  - - [128, 512, 1, 4096, 128, 128, 128, 4096]
    - [72, 19.05]
  - - [128, 512, 1, 8192, 128, 128, 128, 8192]
    - [72, 21.81]
  - - [128, 1024, 1, 128, 128, 128, 128, 128]
    - [73, 4.42]
  - - [128, 1024, 1, 256, 128, 128, 128, 256]
    - [73, 7.97]
  - - [128, 1024, 1, 512, 128, 128, 128, 512]
    - [73, 13.66]
  - - [128, 1024, 1, 1024, 128, 128, 128, 1024]
    - [73, 21.46]
  - - [128, 1024, 1, 2048, 128, 128, 128, 2048]
    - [72, 30.14]
  - - [128, 1024, 1, 4096, 128, 128, 128, 4096]
    - [72, 37.24]
  - - [128, 1024, 1, 8192, 128, 128, 128, 8192]
    - [72, 42.86]
  - - [128, 2048, 1, 128, 128, 128, 128, 128]
    - [70, 8.03]
  - - [128, 2048, 1, 256, 128, 128, 128, 256]
    - [71, 14.45]
  - - [128, 2048, 1, 512, 128, 128, 128, 512]
    - [70, 24.38]
  - - [128, 2048, 1, 1024, 128, 128, 128, 1024]
    - [65, 37.24]
  - - [128, 2048, 1, 2048, 128, 128, 128, 2048]
    - [77, 51.49]
  - - [128, 2048, 1, 4096, 128, 128, 128, 4096]
    - [77, 63.49]
  - - [128, 2048, 1, 8192, 128, 128, 128, 8192]
    - [77, 72.32]
  - - [128, 4096, 1, 128, 128, 128, 128, 128]
    - [32, 14.84]
  - - [128, 4096, 1, 256, 128, 128, 128, 256]
    - [32, 25.97]
  - - [128, 4096, 1, 512, 128, 128, 128, 512]
    - [61, 42.53]
  - - [128, 4096, 1, 1024, 128, 128, 128, 1024]
    - [59, 63.14]
  - - [128, 4096, 1, 2048, 128, 128, 128, 2048]
    - [76, 84.67]
  - - [128, 4096, 1, 4096, 128, 128, 128, 4096]
    - [76, 102.27]
  - - [128, 4096, 1, 8192, 128, 128, 128, 8192]
    - [76, 113.23]
  - - [128, 8192, 1, 128, 128, 128, 128, 128]
    - [27, 25.75]
  - - [128, 8192, 1, 256, 128, 128, 128, 256]
    - [26, 44.74]
  - - [128, 8192, 1, 512, 128, 128, 128, 512]
    - [24, 71.22]
  - - [128, 8192, 1, 1024, 128, 128, 128, 1024]
    - [23, 103.35]
  - - [128, 8192, 1, 2048, 128, 128, 128, 2048]
    - [23, 132.96]
  - - [128, 8192, 1, 4096, 128, 128, 128, 4096]
    - [54, 144.18]
  - - [128, 8192, 1, 8192, 128, 128, 128, 8192]
    - [54, 155.68]
  - - [256, 128, 1, 128, 256, 256, 256, 128]
    - [35, 1.03]
  - - [256, 128, 1, 256, 256, 256, 256, 256]
    - [73, 1.99]
  - - [256, 128, 1, 512, 256, 256, 256, 512]
    - [74, 3.38]
  - - [256, 128, 1, 1024, 256, 256, 256, 1024]
    - [73, 5.46]
  - - [256, 128, 1, 2048, 256, 256, 256, 2048]
    - [72, 7.63]
  - - [256, 128, 1, 4096, 256, 256, 256, 4096]
    - [72, 9.56]
  - - [256, 128, 1, 8192, 256, 256, 256, 8192]
    - [72, 10.92]
  - - [256, 256, 1, 128, 256, 256, 256, 128]
    - [34, 2.13]
  - - [256, 256, 1, 256, 256, 256, 256, 256]
    - [34, 3.85]
  - - [256, 256, 1, 512, 256, 256, 256, 512]
    - [80, 6.75]
  - - [256, 256, 1, 1024, 256, 256, 256, 1024]
    - [72, 10.84]
  - - [256, 256, 1, 2048, 256, 256, 256, 2048]
    - [73, 15.0]
  - - [256, 256, 1, 4096, 256, 256, 256, 4096]
    - [72, 18.98]
  - - [256, 256, 1, 8192, 256, 256, 256, 8192]
    - [72, 21.7]
  - - [256, 512, 1, 128, 256, 256, 256, 128]
    - [72, 4.12]
  - - [256, 512, 1, 256, 256, 256, 256, 256]
    - [34, 7.71]
  - - [256, 512, 1, 512, 256, 256, 256, 512]
    - [73, 13.45]
  - - [256, 512, 1, 1024, 256, 256, 256, 1024]
    - [73, 21.2]
  - - [256, 512, 1, 2048, 256, 256, 256, 2048]
    - [72, 29.83]
  - - [256, 512, 1, 4096, 256, 256, 256, 4096]
    - [72, 37.38]
  - - [256, 512, 1, 8192, 256, 256, 256, 8192]
    - [72, 42.85]
  - - [256, 1024, 1, 128, 256, 256, 256, 128]
    - [69, 7.83]
  - - [256, 1024, 1, 256, 256, 256, 256, 256]
    - [33, 14.31]
  - - [256, 1024, 1, 512, 256, 256, 256, 512]
    - [71, 24.46]
  - - [256, 1024, 1, 1024, 256, 256, 256, 1024]
    - [70, 37.14]
  - - [256, 1024, 1, 2048, 256, 256, 256, 2048]
    - [77, 51.63]
  - - [256, 1024, 1, 4096, 256, 256, 256, 4096]
    - [77, 63.76]
  - - [256, 1024, 1, 8192, 256, 256, 256, 8192]
    - [77, 72.25]
  - - [256, 2048, 1, 128, 256, 256, 256, 128]
    - [32, 15.08]
  - - [256, 2048, 1, 256, 256, 256, 256, 256]
    - [31, 26.41]
  - - [256, 2048, 1, 512, 256, 256, 256, 512]
    - [61, 43.09]
  - - [256, 2048, 1, 1024, 256, 256, 256, 1024]
    - [59, 64.27]
  - - [256, 2048, 1, 2048, 256, 256, 256, 2048]
    - [59, 84.99]
  - - [256, 2048, 1, 4096, 256, 256, 256, 4096]
    - [76, 102.29]
  - - [256, 2048, 1, 8192, 256, 256, 256, 8192]
    - [59, 111.19]
  - - [256, 4096, 1, 128, 256, 256, 256, 128]
    - [28, 26.47]
  - - [256, 4096, 1, 256, 256, 256, 256, 256]
    - [28, 45.88]
  - - [256, 4096, 1, 512, 256, 256, 256, 512]
    - [25, 72.33]
  - - [256, 4096, 1, 1024, 256, 256, 256, 1024]
    - [23, 103.31]
  - - [256, 4096, 1, 2048, 256, 256, 256, 2048]
    - [23, 133.77]
  - - [256, 4096, 1, 4096, 256, 256, 256, 4096]
    - [54, 146.03]
  - - [256, 4096, 1, 8192, 256, 256, 256, 8192]
    - [54, 156.58]
  - - [256, 8192, 1, 128, 256, 256, 256, 128]
    - [21, 41.61]
  - - [256, 8192, 1, 256, 256, 256, 256, 256]
    - [22, 70.4]
  - - [256, 8192, 1, 512, 256, 256, 256, 512]
    - [50, 112.0]
  - - [256, 8192, 1, 1024, 256, 256, 256, 1024]
    - [50, 159.75]
  - - [256, 8192, 1, 2048, 256, 256, 256, 2048]
    - [50, 200.63]
  - - [256, 8192, 1, 4096, 256, 256, 256, 4096]
    - [51, 222.09]
  - - [256, 8192, 1, 8192, 256, 256, 256, 8192]
    - [52, 221.49]
  - - [512, 128, 1, 128, 512, 512, 512, 128]
    - [35, 2.06]
  - - [512, 128, 1, 256, 512, 512, 512, 256]
    - [34, 3.88]
  - - [512, 128, 1, 512, 512, 512, 512, 512]
    - [73, 6.72]
  - - [512, 128, 1, 1024, 512, 512, 512, 1024]
    - [73, 10.7]
  - - [512, 128, 1, 2048, 512, 512, 512, 2048]
    - [72, 15.21]
  - - [512, 128, 1, 4096, 512, 512, 512, 4096]
    - [72, 19.03]
  - - [512, 128, 1, 8192, 512, 512, 512, 8192]
    - [83, 17.5]
  - - [512, 256, 1, 128, 512, 512, 512, 128]
    - [34, 4.36]
  - - [512, 256, 1, 256, 512, 512, 512, 256]
    - [34, 7.91]
  - - [512, 256, 1, 512, 512, 512, 512, 512]
    - [73, 13.64]
  - - [512, 256, 1, 1024, 512, 512, 512, 1024]
    - [73, 21.43]
  - - [512, 256, 1, 2048, 512, 512, 512, 2048]
    - [72, 29.9]
  - - [512, 256, 1, 4096, 512, 512, 512, 4096]
    - [72, 37.13]
  - - [512, 256, 1, 8192, 512, 512, 512, 8192]
    - [83, 37.33]
  - - [512, 512, 1, 128, 512, 512, 512, 128]
    - [70, 8.24]
  - - [512, 512, 1, 256, 512, 512, 512, 256]
    - [70, 14.7]
  - - [512, 512, 1, 512, 512, 512, 512, 512]
    - [70, 24.66]
  - - [512, 512, 1, 1024, 512, 512, 512, 1024]
    - [70, 37.55]
  - - [512, 512, 1, 2048, 512, 512, 512, 2048]
    - [77, 51.49]
  - - [512, 512, 1, 4096, 512, 512, 512, 4096]
    - [77, 63.27]
  - - [512, 512, 1, 8192, 512, 512, 512, 8192]
    - [71, 62.23]
  - - [512, 1024, 1, 128, 512, 512, 512, 128]
    - [60, 14.83]
  - - [512, 1024, 1, 256, 512, 512, 512, 256]
    - [31, 26.31]
  - - [512, 1024, 1, 512, 512, 512, 512, 512]
    - [60, 42.59]
  - - [512, 1024, 1, 1024, 512, 512, 512, 1024]
    - [59, 63.36]
  - - [512, 1024, 1, 2048, 512, 512, 512, 2048]
    - [59, 83.98]
  - - [512, 1024, 1, 4096, 512, 512, 512, 4096]
    - [59, 100.38]
  - - [512, 1024, 1, 8192, 512, 512, 512, 8192]
    - [61, 103.48]
  - - [512, 2048, 1, 128, 512, 512, 512, 128]
    - [28, 25.84]
  - - [512, 2048, 1, 256, 512, 512, 512, 256]
    - [24, 45.36]
  - - [512, 2048, 1, 512, 512, 512, 512, 512]
    - [24, 72.82]
  - - [512, 2048, 1, 1024, 512, 512, 512, 1024]
    - [24, 103.09]
  - - [512, 2048, 1, 2048, 512, 512, 512, 2048]
    - [23, 133.78]
  - - [512, 2048, 1, 4096, 512, 512, 512, 4096]
    - [75, 145.83]
  - - [512, 2048, 1, 8192, 512, 512, 512, 8192]
    - [55, 148.65]
  - - [512, 4096, 1, 128, 512, 512, 512, 128]
    - [19, 41.72]
  - - [512, 4096, 1, 256, 512, 512, 512, 256]
    - [22, 71.52]
  - - [512, 4096, 1, 512, 512, 512, 512, 512]
    - [50, 111.89]
  - - [512, 4096, 1, 1024, 512, 512, 512, 1024]
    - [50, 160.0]
  - - [512, 4096, 1, 2048, 512, 512, 512, 2048]
    - [50, 203.79]
  - - [512, 4096, 1, 4096, 512, 512, 512, 4096]
    - [50, 209.77]
  - - [512, 4096, 1, 8192, 512, 512, 512, 8192]
    - [52, 203.83]
  - - [512, 8192, 1, 128, 512, 512, 512, 128]
    - [47, 63.33]
  - - [512, 8192, 1, 256, 512, 512, 512, 256]
    - [49, 108.18]
  - - [512, 8192, 1, 512, 512, 512, 512, 512]
    - [48, 175.45]
  - - [512, 8192, 1, 1024, 512, 512, 512, 1024]
    - [48, 243.25]
  - - [512, 8192, 1, 2048, 512, 512, 512, 2048]
    - [45, 248.9]
  - - [512, 8192, 1, 4096, 512, 512, 512, 4096]
    - [40, 263.98]
  - - [512, 8192, 1, 8192, 512, 512, 512, 8192]
    - [48, 255.6]
  - - [1024, 128, 1, 128, 1024, 1024, 1024, 128]
    - [34, 4.31]
  - - [1024, 128, 1, 256, 1024, 1024, 1024, 256]
    - [34, 7.76]
  - - [1024, 128, 1, 512, 1024, 1024, 1024, 512]
    - [73, 13.5]
  - - [1024, 128, 1, 1024, 1024, 1024, 1024, 1024]
    - [72, 21.28]
  - - [1024, 128, 1, 2048, 1024, 1024, 1024, 2048]
    - [72, 29.72]
  - - [1024, 128, 1, 4096, 1024, 1024, 1024, 4096]
    - [82, 31.07]
  - - [1024, 128, 1, 8192, 1024, 1024, 1024, 8192]
    - [81, 30.28]
  - - [1024, 256, 1, 128, 1024, 1024, 1024, 128]
    - [70, 8.16]
  - - [1024, 256, 1, 256, 1024, 1024, 1024, 256]
    - [68, 14.75]
  - - [1024, 256, 1, 512, 1024, 1024, 1024, 512]
    - [70, 24.74]
  - - [1024, 256, 1, 1024, 1024, 1024, 1024, 1024]
    - [70, 37.16]
  - - [1024, 256, 1, 2048, 1024, 1024, 1024, 2048]
    - [77, 51.57]
  - - [1024, 256, 1, 4096, 1024, 1024, 1024, 4096]
    - [67, 54.9]
  - - [1024, 256, 1, 8192, 1024, 1024, 1024, 8192]
    - [79, 58.95]
  - - [1024, 512, 1, 128, 1024, 1024, 1024, 128]
    - [30, 14.91]
  - - [1024, 512, 1, 256, 1024, 1024, 1024, 256]
    - [32, 26.16]
  - - [1024, 512, 1, 512, 1024, 1024, 1024, 512]
    - [59, 42.37]
  - - [1024, 512, 1, 1024, 1024, 1024, 1024, 1024]
    - [60, 63.35]
  - - [1024, 512, 1, 2048, 1024, 1024, 1024, 2048]
    - [59, 83.57]
  - - [1024, 512, 1, 4096, 1024, 1024, 1024, 4096]
    - [62, 93.94]
  - - [1024, 512, 1, 8192, 1024, 1024, 1024, 8192]
    - [64, 102.38]
  - - [1024, 1024, 1, 128, 1024, 1024, 1024, 128]
    - [28, 25.21]
  - - [1024, 1024, 1, 256, 1024, 1024, 1024, 256]
    - [27, 45.48]
  - - [1024, 1024, 1, 512, 1024, 1024, 1024, 512]
    - [24, 71.1]
  - - [1024, 1024, 1, 1024, 1024, 1024, 1024, 1024]
    - [23, 102.59]
  - - [1024, 1024, 1, 2048, 1024, 1024, 1024, 2048]
    - [23, 132.63]
  - - [1024, 1024, 1, 4096, 1024, 1024, 1024, 4096]
    - [58, 139.97]
  - - [1024, 1024, 1, 8192, 1024, 1024, 1024, 8192]
    - [57, 149.42]
  - - [1024, 2048, 1, 128, 1024, 1024, 1024, 128]
    - [21, 40.75]
  - - [1024, 2048, 1, 256, 1024, 1024, 1024, 256]
    - [50, 70.08]
  - - [1024, 2048, 1, 512, 1024, 1024, 1024, 512]
    - [50, 112.38]
  - - [1024, 2048, 1, 1024, 1024, 1024, 1024, 1024]
    - [50, 158.51]
  - - [1024, 2048, 1, 2048, 1024, 1024, 1024, 2048]
    - [50, 202.04]
  - - [1024, 2048, 1, 4096, 1024, 1024, 1024, 4096]
    - [50, 208.38]
  - - [1024, 2048, 1, 8192, 1024, 1024, 1024, 8192]
    - [53, 202.42]
  - - [1024, 4096, 1, 128, 1024, 1024, 1024, 128]
    - [16, 58.03]
  - - [1024, 4096, 1, 256, 1024, 1024, 1024, 256]
    - [16, 99.71]
  - - [1024, 4096, 1, 512, 1024, 1024, 1024, 512]
    - [11, 152.77]
  - - [1024, 4096, 1, 1024, 1024, 1024, 1024, 1024]
    - [11, 214.06]
  - - [1024, 4096, 1, 2048, 1024, 1024, 1024, 2048]
    - [15, 249.9]
  - - [1024, 4096, 1, 4096, 1024, 1024, 1024, 4096]
    - [36, 262.42]
  - - [1024, 4096, 1, 8192, 1024, 1024, 1024, 8192]
    - [40, 250.9]
  - - [1024, 8192, 1, 128, 1024, 1024, 1024, 128]
    - [44, 89.32]
  - - [1024, 8192, 1, 256, 1024, 1024, 1024, 256]
    - [40, 153.56]
  - - [1024, 8192, 1, 512, 1024, 1024, 1024, 512]
    - [40, 241.88]
  - - [1024, 8192, 1, 1024, 1024, 1024, 1024, 1024]
    - [39, 262.38]
  - - [1024, 8192, 1, 2048, 1024, 1024, 1024, 2048]
    - [42, 318.73]
  - - [1024, 8192, 1, 4096, 1024, 1024, 1024, 4096]
    - [42, 364.76]
  - - [1024, 8192, 1, 8192, 1024, 1024, 1024, 8192]
    - [41, 383.81]
  - - [2048, 128, 1, 128, 2048, 2048, 2048, 128]
    - [68, 8.25]
  - - [2048, 128, 1, 256, 2048, 2048, 2048, 256]
    - [70, 14.84]
  - - [2048, 128, 1, 512, 2048, 2048, 2048, 512]
    - [68, 24.5]
  - - [2048, 128, 1, 1024, 2048, 2048, 2048, 1024]
    - [70, 37.29]
  - - [2048, 128, 1, 2048, 2048, 2048, 2048, 2048]
    - [66, 43.97]
  - - [2048, 128, 1, 4096, 2048, 2048, 2048, 4096]
    - [78, 52.08]
  - - [2048, 128, 1, 8192, 2048, 2048, 2048, 8192]
    - [79, 58.61]
  - - [2048, 256, 1, 128, 2048, 2048, 2048, 128]
    - [30, 14.94]
  - - [2048, 256, 1, 256, 2048, 2048, 2048, 256]
    - [32, 26.1]
  - - [2048, 256, 1, 512, 2048, 2048, 2048, 512]
    - [60, 42.54]
  - - [2048, 256, 1, 1024, 2048, 2048, 2048, 1024]
    - [59, 62.89]
  - - [2048, 256, 1, 2048, 2048, 2048, 2048, 2048]
    - [63, 77.54]
  - - [2048, 256, 1, 4096, 2048, 2048, 2048, 4096]
    - [63, 93.05]
  - - [2048, 256, 1, 8192, 2048, 2048, 2048, 8192]
    - [62, 104.4]
  - - [2048, 512, 1, 128, 2048, 2048, 2048, 128]
    - [27, 26.01]
  - - [2048, 512, 1, 256, 2048, 2048, 2048, 256]
    - [28, 44.69]
  - - [2048, 512, 1, 512, 2048, 2048, 2048, 512]
    - [24, 71.83]
  - - [2048, 512, 1, 1024, 2048, 2048, 2048, 1024]
    - [23, 103.86]
  - - [2048, 512, 1, 2048, 2048, 2048, 2048, 2048]
    - [58, 120.1]
  - - [2048, 512, 1, 4096, 2048, 2048, 2048, 4096]
    - [58, 140.47]
  - - [2048, 512, 1, 8192, 2048, 2048, 2048, 8192]
    - [57, 148.8]
  - - [2048, 1024, 1, 128, 2048, 2048, 2048, 128]
    - [21, 41.1]
  - - [2048, 1024, 1, 256, 2048, 2048, 2048, 256]
    - [22, 71.09]
  - - [2048, 1024, 1, 512, 2048, 2048, 2048, 512]
    - [50, 112.99]
  - - [2048, 1024, 1, 1024, 2048, 2048, 2048, 1024]
    - [50, 159.69]
  - - [2048, 1024, 1, 2048, 2048, 2048, 2048, 2048]
    - [53, 182.46]
  - - [2048, 1024, 1, 4096, 2048, 2048, 2048, 4096]
    - [52, 207.82]
  - - [2048, 1024, 1, 8192, 2048, 2048, 2048, 8192]
    - [51, 202.36]
  - - [2048, 2048, 1, 128, 2048, 2048, 2048, 128]
    - [18, 58.69]
  - - [2048, 2048, 1, 256, 2048, 2048, 2048, 256]
    - [16, 99.36]
  - - [2048, 2048, 1, 512, 2048, 2048, 2048, 512]
    - [12, 152.92]
  - - [2048, 2048, 1, 1024, 2048, 2048, 2048, 1024]
    - [16, 208.24]
  - - [2048, 2048, 1, 2048, 2048, 2048, 2048, 2048]
    - [18, 248.35]
  - - [2048, 2048, 1, 4096, 2048, 2048, 2048, 4096]
    - [46, 264.64]
  - - [2048, 2048, 1, 8192, 2048, 2048, 2048, 8192]
    - [44, 248.3]
  - - [2048, 4096, 1, 128, 2048, 2048, 2048, 128]
    - [6, 72.98]
  - - [2048, 4096, 1, 256, 2048, 2048, 2048, 256]
    - [0, 123.21]
  - - [2048, 4096, 1, 512, 2048, 2048, 2048, 512]
    - [0, 183.4]
  - - [2048, 4096, 1, 1024, 2048, 2048, 2048, 1024]
    - [8, 246.52]
  - - [2048, 4096, 1, 2048, 2048, 2048, 2048, 2048]
    - [8, 281.88]
  - - [2048, 4096, 1, 4096, 2048, 2048, 2048, 4096]
    - [44, 282.59]
  - - [2048, 4096, 1, 8192, 2048, 2048, 2048, 8192]
    - [44, 324.97]
  - - [2048, 8192, 1, 128, 2048, 2048, 2048, 128]
    - [41, 97.12]
  - - [2048, 8192, 1, 256, 2048, 2048, 2048, 256]
    - [44, 160.54]
  - - [2048, 8192, 1, 512, 2048, 2048, 2048, 512]
    - [40, 231.21]
  - - [2048, 8192, 1, 1024, 2048, 2048, 2048, 1024]
    - [40, 283.36]
  - - [2048, 8192, 1, 2048, 2048, 2048, 2048, 2048]
    - [40, 330.38]
  - - [2048, 8192, 1, 4096, 2048, 2048, 2048, 4096]
    - [44, 355.35]
  - - [2048, 8192, 1, 8192, 2048, 2048, 2048, 8192]
    - [42, 391.85]
  - - [4096, 128, 1, 128, 4096, 4096, 4096, 128]
    - [29, 14.43]
  - - [4096, 128, 1, 256, 4096, 4096, 4096, 256]
    - [32, 25.19]
  - - [4096, 128, 1, 512, 4096, 4096, 4096, 512]
    - [61, 41.87]
  - - [4096, 128, 1, 1024, 4096, 4096, 4096, 1024]
    - [61, 61.55]
  - - [4096, 128, 1, 2048, 4096, 4096, 4096, 2048]
    - [63, 76.46]
  - - [4096, 128, 1, 4096, 4096, 4096, 4096, 4096]
    - [63, 92.71]
  - - [4096, 128, 1, 8192, 4096, 4096, 4096, 8192]
    - [64, 103.96]
  - - [4096, 256, 1, 128, 4096, 4096, 4096, 128]
    - [24, 25.18]
  - - [4096, 256, 1, 256, 4096, 4096, 4096, 256]
    - [24, 44.1]
  - - [4096, 256, 1, 512, 4096, 4096, 4096, 512]
    - [23, 71.09]
  - - [4096, 256, 1, 1024, 4096, 4096, 4096, 1024]
    - [23, 102.76]
  - - [4096, 256, 1, 2048, 4096, 4096, 4096, 2048]
    - [56, 119.56]
  - - [4096, 256, 1, 4096, 4096, 4096, 4096, 4096]
    - [58, 140.06]
  - - [4096, 256, 1, 8192, 4096, 4096, 4096, 8192]
    - [56, 148.73]
  - - [4096, 512, 1, 128, 4096, 4096, 4096, 128]
    - [21, 41.56]
  - - [4096, 512, 1, 256, 4096, 4096, 4096, 256]
    - [21, 70.49]
  - - [4096, 512, 1, 512, 4096, 4096, 4096, 512]
    - [50, 112.06]
  - - [4096, 512, 1, 1024, 4096, 4096, 4096, 1024]
    - [53, 152.79]
  - - [4096, 512, 1, 2048, 4096, 4096, 4096, 2048]
    - [53, 181.06]
  - - [4096, 512, 1, 4096, 4096, 4096, 4096, 4096]
    - [52, 208.67]
  - - [4096, 512, 1, 8192, 4096, 4096, 4096, 8192]
    - [53, 204.1]
  - - [4096, 1024, 1, 128, 4096, 4096, 4096, 128]
    - [16, 58.41]
  - - [4096, 1024, 1, 256, 4096, 4096, 4096, 256]
    - [16, 99.1]
  - - [4096, 1024, 1, 512, 4096, 4096, 4096, 512]
    - [16, 151.02]
  - - [4096, 1024, 1, 1024, 4096, 4096, 4096, 1024]
    - [17, 202.14]
  - - [4096, 1024, 1, 2048, 4096, 4096, 4096, 2048]
    - [46, 246.05]
  - - [4096, 1024, 1, 4096, 4096, 4096, 4096, 4096]
    - [38, 262.43]
  - - [4096, 1024, 1, 8192, 4096, 4096, 4096, 8192]
    - [38, 248.85]
  - - [4096, 2048, 1, 128, 4096, 4096, 4096, 128]
    - [0, 73.58]
  - - [4096, 2048, 1, 256, 4096, 4096, 4096, 256]
    - [0, 122.26]
  - - [4096, 2048, 1, 512, 4096, 4096, 4096, 512]
    - [0, 180.83]
  - - [4096, 2048, 1, 1024, 4096, 4096, 4096, 1024]
    - [10, 245.37]
  - - [4096, 2048, 1, 2048, 4096, 4096, 4096, 2048]
    - [9, 280.51]
  - - [4096, 2048, 1, 4096, 4096, 4096, 4096, 4096]
    - [41, 271.57]
  - - [4096, 2048, 1, 8192, 4096, 4096, 4096, 8192]
    - [36, 297.68]
  - - [4096, 4096, 1, 128, 4096, 4096, 4096, 128]
    - [6, 78.44]
  - - [4096, 4096, 1, 256, 4096, 4096, 4096, 256]
    - [10, 129.94]
  - - [4096, 4096, 1, 512, 4096, 4096, 4096, 512]
    - [9, 192.54]
  - - [4096, 4096, 1, 1024, 4096, 4096, 4096, 1024]
    - [4, 242.6]
  - - [4096, 4096, 1, 2048, 4096, 4096, 4096, 2048]
    - [42, 279.18]
  - - [4096, 4096, 1, 4096, 4096, 4096, 4096, 4096]
    - [42, 298.27]
  - - [4096, 4096, 1, 8192, 4096, 4096, 4096, 8192]
    - [7, 325.09]
  - - [4096, 8192, 1, 128, 4096, 4096, 4096, 128]
    - [40, 105.41]
  - - [4096, 8192, 1, 256, 4096, 4096, 4096, 256]
    - [40, 172.02]
  - - [4096, 8192, 1, 512, 4096, 4096, 4096, 512]
    - [44, 237.74]
  - - [4096, 8192, 1, 1024, 4096, 4096, 4096, 1024]
    - [44, 274.81]
  - - [4096, 8192, 1, 2048, 4096, 4096, 4096, 2048]
    - [44, 323.71]
  - - [4096, 8192, 1, 4096, 4096, 4096, 4096, 4096]
    - [44, 367.2]
  - - [4096, 8192, 1, 8192, 4096, 4096, 4096, 8192]
    - [44, 412.3]
  - - [8192, 128, 1, 128, 8192, 8192, 8192, 128]
    - [27, 26.3]
  - - [8192, 128, 1, 256, 8192, 8192, 8192, 256]
    - [27, 45.34]
  - - [8192, 128, 1, 512, 8192, 8192, 8192, 512]
    - [24, 72.31]
  - - [8192, 128, 1, 1024, 8192, 8192, 8192, 1024]
    - [23, 103.83]
  - - [8192, 128, 1, 2048, 8192, 8192, 8192, 2048]
    - [55, 119.88]
  - - [8192, 128, 1, 4096, 8192, 8192, 8192, 4096]
    - [56, 140.31]
  - - [8192, 128, 1, 8192, 8192, 8192, 8192, 8192]
    - [56, 144.92]
  - - [8192, 256, 1, 128, 8192, 8192, 8192, 128]
    - [22, 41.6]
  - - [8192, 256, 1, 256, 8192, 8192, 8192, 256]
    - [50, 71.73]
  - - [8192, 256, 1, 512, 8192, 8192, 8192, 512]
    - [53, 110.81]
  - - [8192, 256, 1, 1024, 8192, 8192, 8192, 1024]
    - [51, 158.66]
  - - [8192, 256, 1, 2048, 8192, 8192, 8192, 2048]
    - [51, 183.24]
  - - [8192, 256, 1, 4096, 8192, 8192, 8192, 4096]
    - [51, 210.38]
  - - [8192, 256, 1, 8192, 8192, 8192, 8192, 8192]
    - [53, 199.04]
  - - [8192, 512, 1, 128, 8192, 8192, 8192, 128]
    - [16, 58.92]
  - - [8192, 512, 1, 256, 8192, 8192, 8192, 256]
    - [16, 98.52]
  - - [8192, 512, 1, 512, 8192, 8192, 8192, 512]
    - [14, 151.48]
  - - [8192, 512, 1, 1024, 8192, 8192, 8192, 1024]
    - [13, 206.37]
  - - [8192, 512, 1, 2048, 8192, 8192, 8192, 2048]
    - [18, 245.87]
  - - [8192, 512, 1, 4096, 8192, 8192, 8192, 4096]
    - [37, 262.74]
  - - [8192, 512, 1, 8192, 8192, 8192, 8192, 8192]
    - [37, 251.26]
  - - [8192, 1024, 1, 128, 8192, 8192, 8192, 128]
    - [10, 72.81]
  - - [8192, 1024, 1, 256, 8192, 8192, 8192, 256]
    - [5, 120.53]
  - - [8192, 1024, 1, 512, 8192, 8192, 8192, 512]
    - [10, 180.08]
  - - [8192, 1024, 1, 1024, 8192, 8192, 8192, 1024]
    - [6, 240.51]
  - - [8192, 1024, 1, 2048, 8192, 8192, 8192, 2048]
    - [3, 276.23]
  - - [8192, 1024, 1, 4096, 8192, 8192, 8192, 4096]
    - [9, 277.23]
  - - [8192, 1024, 1, 8192, 8192, 8192, 8192, 8192]
    - [36, 308.19]
  - - [8192, 2048, 1, 128, 8192, 8192, 8192, 128]
    - [40, 77.13]
  - - [8192, 2048, 1, 256, 8192, 8192, 8192, 256]
    - [0, 128.48]
  - - [8192, 2048, 1, 512, 8192, 8192, 8192, 512]
    - [42, 191.03]
  - - [8192, 2048, 1, 1024, 8192, 8192, 8192, 1024]
    - [44, 244.43]
  - - [8192, 2048, 1, 2048, 8192, 8192, 8192, 2048]
    - [42, 254.1]
  - - [8192, 2048, 1, 4096, 8192, 8192, 8192, 4096]
    - [1, 295.8]
  - - [8192, 2048, 1, 8192, 8192, 8192, 8192, 8192]
    - [1, 349.33]
  - - [8192, 4096, 1, 128, 8192, 8192, 8192, 128]
    - [4, 82.31]
  - - [8192, 4096, 1, 256, 8192, 8192, 8192, 256]
    - [20, 139.04]
  - - [8192, 4096, 1, 512, 8192, 8192, 8192, 512]
    - [17, 197.25]
  - - [8192, 4096, 1, 1024, 8192, 8192, 8192, 1024]
    - [41, 245.64]
  - - [8192, 4096, 1, 2048, 8192, 8192, 8192, 2048]
    - [0, 287.76]
  - - [8192, 4096, 1, 4096, 8192, 8192, 8192, 4096]
    - [42, 332.27]
  - - [8192, 4096, 1, 8192, 8192, 8192, 8192, 8192]
    - [1, 370.47]
  - - [8192, 8192, 1, 128, 8192, 8192, 8192, 128]
    - [40, 107.59]
  - - [8192, 8192, 1, 256, 8192, 8192, 8192, 256]
    - [44, 157.09]
  - - [8192, 8192, 1, 512, 8192, 8192, 8192, 512]
    - [43, 218.14]
  - - [8192, 8192, 1, 1024, 8192, 8192, 8192, 1024]
    - [2, 283.95]
  - - [8192, 8192, 1, 2048, 8192, 8192, 8192, 2048]
    - [42, 342.52]
  - - [8192, 8192, 1, 4096, 8192, 8192, 8192, 4096]
    - [42, 388.22]
  - - [8192, 8192, 1, 8192, 8192, 8192, 8192, 8192]
    - [44, 416.21]
- null
- null
- ExperimentalStreamK
- GridBased
