projects/hipblaslt/library/src/amd_detail/rocblaslt/src/Tensile/Logic/asm_full/aquavanjaram/gfx942_228cu/StreamK/aquavanjaram942_Cijk_Alik_Bljk_F8B8NHS_BH_Bias_HAS_SAV_UserArgs.yaml
- {MinimumRequiredVersion: 4.33.0}
- aquavanjaram942
- {Architecture: gfx942, CUCount: 228}
- [Device 0049, Device 0050]
    SolutionIndex: 0
    SolutionNameMin: Cijk_Alik_Bljk_F8B8NHS_BH_Bias_HAS_SAV_UserArgs_MT256x256x64_MI16x16x1_SN_LDSB1_CLR1_GRVWA8_GRVWB8_GSU0_GSUC0_GSUWGMRR0_K1_LBSPPA512_LBSPPB512_LPA8_LPB8_LRVW8_MIWT8_8_PLR1_SU0_SUM0_SUS64_VWA8_VWB8_WGM1_WGMXCC1_WGMXCCGn1
    SolutionIndex: 1
    SolutionNameMin: Cijk_Alik_Bljk_F8B8NHS_BH_Bias_HAS_SAV_UserArgs_MT256x256x64_MI16x16x1_SN_LDSB1_CLR1_GRVWA8_GRVWB16_GSU0_GSUC0_GSUWGMRR0_K1_LBSPPA512_LBSPPB512_LPA8_LPB16_LRVW8_MIWT8_8_PLR1_SU0_SUM0_SUS64_VWA8_VWB8_WGM1_WGMXCC1_WGMXCCGn1
    SolutionIndex: 2
    SolutionNameMin: Cijk_Alik_Bljk_F8B8NHS_BH_Bias_HAS_SAV_UserArgs_MT256x256x64_MI16x16x1_SN_LDSB1_CLR1_GRVWA16_GRVWB16_GSU0_GSUC0_GSUWGMRR0_K1_LBSPPA512_LBSPPB512_LPA16_LPB16_LRVW8_MIWT8_8_PLR1_SU0_SUM0_SUS64_VWA8_VWB8_WGM1_WGMXCC1_WGMXCCGn1
    SolutionIndex: 3
    SolutionNameMin: Cijk_Alik_Bljk_F8B8NHS_BH_Bias_HAS_SAV_UserArgs_MT256x256x64_MI16x16x1_SN_LDSB1_CLR1_GRVWA16_GRVWB16_GSU0_GSUC0_GSUWGMRR0_K1_LBSPPA512_LBSPPB512_LPA16_LPB16_LRVW8_MIWT8_8_PLR1_SU0_SUM0_SUS64_VWA8_VWB8_WGM4_WGMXCC1_WGMXCCGn1
    SolutionIndex: 4
    SolutionNameMin: Cijk_Alik_Bljk_F8B8NHS_BH_Bias_HAS_SAV_UserArgs_MT256x256x64_MI16x16x1_SN_LDSB1_CLR1_GRVWA16_GRVWB16_GSU0_GSUC0_GSUWGMRR0_K1_LBSPPA512_LBSPPB512_LPA16_LPB16_LRVW8_MIWT8_8_PLR1_SU0_SUM0_SUS64_VWA8_VWB8_WGM6_WGMXCC1_WGMXCCGn1
    SolutionIndex: 5
    SolutionNameMin: Cijk_Alik_Bljk_F8B8NHS_BH_Bias_HAS_SAV_UserArgs_MT256x256x64_MI16x16x1_SN_LDSB1_CLR1_GRVWA8_GRVWB16_GSU0_GSUC0_GSUWGMRR0_K1_LBSPPA512_LBSPPB512_LPA8_LPB16_LRVW8_MIWT8_8_PLR1_SU0_SUM0_SUS64_VWA8_VWB8_WGM8_WGMXCC1_WGMXCCGn1
    SolutionIndex: 6
    SolutionNameMin: Cijk_Alik_Bljk_F8B8NHS_BH_Bias_HAS_SAV_UserArgs_MT256x256x64_MI16x16x1_SN_LDSB1_CLR1_GRVWA16_GRVWB16_GSU0_GSUC0_GSUWGMRR0_K1_LBSPPA512_LBSPPB512_LPA16_LPB16_LRVW8_MIWT8_8_PLR1_SU0_SUM0_SUS64_VWA8_VWB8_WGM8_WGMXCC1_WGMXCCGn1
    SolutionIndex: 7
    SolutionNameMin: Cijk_Alik_Bljk_F8B8NHS_BH_Bias_HAS_SAV_UserArgs_MT128x256x64_MI16x16x1_SN_LDSB1_CLR1_GRVWA8_GRVWB16_GSU0_GSUC0_GSUWGMRR0_K1_LBSPPA256_LBSPPB512_LPA8_LPB16_LRVW8_MIWT4_8_PLR1_SU0_SUM0_SUS64_VWA4_VWB8_WGM1_WGMXCC1_WGMXCCGn1
    SolutionIndex: 8
    SolutionNameMin: Cijk_Alik_Bljk_F8B8NHS_BH_Bias_HAS_SAV_UserArgs_MT256x128x64_MI16x16x1_SN_LDSB1_CLR1_GRVWA8_GRVWB16_GSU0_GSUC0_GSUWGMRR0_K1_LBSPPA512_LBSPPB256_LPA8_LPB16_LRVW8_MIWT8_4_PLR1_SU0_SUM0_SUS64_VWA8_VWB4_WGM1_WGMXCC1_WGMXCCGn1
    SolutionIndex: 9
    SolutionNameMin: Cijk_Alik_Bljk_F8B8NHS_BH_Bias_HAS_SAV_UserArgs_MT256x128x64_MI16x16x1_SN_LDSB1_CLR1_GRVWA16_GRVWB16_GSU0_GSUC0_GSUWGMRR0_K1_LBSPPA512_LBSPPB256_LPA16_LPB16_LRVW8_MIWT8_4_PLR1_SU0_SUM0_SUS64_VWA8_VWB4_WGM1_WGMXCC1_WGMXCCGn1
    SolutionIndex: 10
    SolutionNameMin: Cijk_Alik_Bljk_F8B8NHS_BH_Bias_HAS_SAV_UserArgs_MT256x128x64_MI16x16x1_SN_LDSB1_CLR1_GRVWA8_GRVWB16_GSU0_GSUC0_GSUWGMRR0_K1_LBSPPA512_LBSPPB256_LPA8_LPB16_LRVW8_MIWT8_4_PLR1_SU0_SUM0_SUS64_VWA8_VWB4_WGM4_WGMXCC1_WGMXCCGn1
    SolutionIndex: 11
    SolutionNameMin: Cijk_Alik_Bljk_F8B8NHS_BH_Bias_HAS_SAV_UserArgs_MT256x128x64_MI16x16x1_SN_LDSB1_CLR1_GRVWA8_GRVWB16_GSU0_GSUC0_GSUWGMRR0_K1_LBSPPA512_LBSPPB256_LPA8_LPB16_LRVW8_MIWT8_4_PLR1_SU0_SUM0_SUS64_VWA8_VWB4_WGM6_WGMXCC1_WGMXCCGn1
    SolutionIndex: 12
    SolutionNameMin: Cijk_Alik_Bljk_F8B8NHS_BH_Bias_HAS_SAV_UserArgs_MT256x128x64_MI16x16x1_SN_LDSB1_CLR1_GRVWA8_GRVWB16_GSU0_GSUC0_GSUWGMRR0_K1_LBSPPA512_LBSPPB256_LPA8_LPB16_LRVW8_MIWT8_4_PLR1_SU0_SUM0_SUS64_VWA8_VWB4_WGM8_WGMXCC1_WGMXCCGn1
    SolutionIndex: 13
    SolutionNameMin: Cijk_Alik_Bljk_F8B8NHS_BH_Bias_HAS_SAV_UserArgs_MT256x128x64_MI16x16x1_SN_LDSB1_CLR1_GRVWA16_GRVWB16_GSU0_GSUC0_GSUWGMRR0_K1_LBSPPA512_LBSPPB256_LPA16_LPB16_LRVW8_MIWT8_4_PLR1_SU0_SUM0_SUS64_VWA8_VWB4_WGM8_WGMXCC1_WGMXCCGn1
    SolutionIndex: 14
    SolutionNameMin: Cijk_Alik_Bljk_F8B8NHS_BH_Bias_HAS_SAV_UserArgs_MT256x64x64_MI16x16x1_SN_LDSB1_CLR1_GRVWA8_GRVWB8_GSU0_GSUC0_GSUWGMRR0_K1_LBSPPA512_LBSPPB128_LPA8_LPB8_LRVW8_MIWT8_2_PLR1_SU0_SUM0_SUS64_VWA8_VWB2_WGM1_WGMXCC1_WGMXCCGn1
    SolutionIndex: 15
    SolutionNameMin: Cijk_Alik_Bljk_F8B8NHS_BH_Bias_HAS_SAV_UserArgs_MT128x128x64_MI16x16x1_SN_LDSB1_CLR1_GRVWA8_GRVWB16_GSU0_GSUC0_GSUWGMRR0_K1_LBSPPA512_LBSPPB128_LPA8_LPB16_LRVW8_MIWT8_2_PLR1_SU0_SUM0_SUS64_VWA8_VWB2_WGM1_WGMXCC1_WGMXCCGn1
    SolutionIndex: 16
    SolutionNameMin: Cijk_Alik_Bljk_F8B8NHS_BH_Bias_HAS_SAV_UserArgs_MT128x128x64_MI16x16x1_SN_LDSB1_CLR1_GRVWA8_GRVWB16_GSU0_GSUC0_GSUWGMRR0_K1_LBSPPA512_LBSPPB128_LPA8_LPB16_LRVW8_MIWT8_2_PLR1_SU0_SUM0_SUS64_VWA8_VWB2_WGM4_WGMXCC1_WGMXCCGn1
    SolutionIndex: 17
    SolutionNameMin: Cijk_Alik_Bljk_F8B8NHS_BH_Bias_HAS_SAV_UserArgs_MT128x128x64_MI16x16x1_SN_LDSB1_CLR1_GRVWA8_GRVWB16_GSU0_GSUC0_GSUWGMRR0_K1_LBSPPA512_LBSPPB128_LPA8_LPB16_LRVW8_MIWT8_2_PLR1_SU0_SUM0_SUS64_VWA8_VWB2_WGM6_WGMXCC1_WGMXCCGn1
    SolutionIndex: 18
    SolutionNameMin: Cijk_Alik_Bljk_F8B8NHS_BH_Bias_HAS_SAV_UserArgs_MT128x128x64_MI16x16x1_SN_LDSB1_CLR1_GRVWA8_GRVWB16_GSU0_GSUC0_GSUWGMRR0_K1_LBSPPA512_LBSPPB128_LPA8_LPB16_LRVW8_MIWT8_2_PLR1_SU0_SUM0_SUS64_VWA8_VWB2_WGM8_WGMXCC1_WGMXCCGn1
    SolutionIndex: 19
    SolutionNameMin: Cijk_Alik_Bljk_F8B8NHS_BH_Bias_HAS_SAV_UserArgs_MT128x64x64_MI16x16x1_SN_LDSB0_CLR1_GRVWA8_GRVWB16_GSU0_GSUC0_GSUWGMRR0_K1_LBSPPA512_LBSPPB128_LPA8_LPB16_LRVW8_MIWT8_1_PLR1_SU0_SUM0_SUS64_VWA8_VWB1_WGM1_WGMXCC1_WGMXCCGn1
    SolutionIndex: 20
    SolutionNameMin: Cijk_Alik_Bljk_F8B8NHS_BH_Bias_HAS_SAV_UserArgs_MT64x128x64_MI16x16x1_SN_LDSB0_CLR1_GRVWA8_GRVWB8_GSU0_GSUC0_GSUWGMRR0_K1_LBSPPA128_LBSPPB256_LPA8_LPB8_LRVW8_MIWT2_4_PLR1_SU0_SUM0_SUS64_VWA2_VWB4_WGM1_WGMXCC1_WGMXCCGn1
    SolutionIndex: 21
    SolutionNameMin: Cijk_Alik_Bljk_F8B8NHS_BH_Bias_HAS_SAV_UserArgs_MT64x128x64_MI16x16x1_SN_LDSB0_CLR1_GRVWA16_GRVWB8_GSU0_GSUC0_GSUWGMRR0_K1_LBSPPA128_LBSPPB256_LPA16_LPB8_LRVW8_MIWT2_4_PLR1_SU0_SUM0_SUS64_VWA2_VWB4_WGM1_WGMXCC1_WGMXCCGn1
    SolutionIndex: 22
    SolutionNameMin: Cijk_Alik_Bljk_F8B8NHS_BH_Bias_HAS_SAV_UserArgs_MT64x128x64_MI16x16x1_SN_LDSB0_CLR1_GRVWA8_GRVWB16_GSU0_GSUC0_GSUWGMRR0_K1_LBSPPA128_LBSPPB256_LPA8_LPB16_LRVW8_MIWT2_4_PLR1_SU0_SUM0_SUS64_VWA2_VWB4_WGM1_WGMXCC1_WGMXCCGn1
    SolutionIndex: 23
    SolutionNameMin: Cijk_Alik_Bljk_F8B8NHS_BH_Bias_HAS_SAV_UserArgs_MT64x128x64_MI16x16x1_SN_LDSB0_CLR1_GRVWA16_GRVWB16_GSU0_GSUC0_GSUWGMRR0_K1_LBSPPA128_LBSPPB256_LPA16_LPB16_LRVW8_MIWT2_4_PLR1_SU0_SUM0_SUS64_VWA2_VWB4_WGM1_WGMXCC1_WGMXCCGn1
    SolutionIndex: 24
    SolutionNameMin: Cijk_Alik_Bljk_F8B8NHS_BH_Bias_HAS_SAV_UserArgs_MT128x64x64_MI16x16x1_SN_LDSB0_CLR1_GRVWA8_GRVWB16_GSU0_GSUC0_GSUWGMRR0_K1_LBSPPA256_LBSPPB128_LPA8_LPB16_LRVW8_MIWT4_2_PLR1_SU0_SUM0_SUS64_VWA4_VWB2_WGM1_WGMXCC1_WGMXCCGn1
    SolutionIndex: 25
    SolutionNameMin: Cijk_Alik_Bljk_F8B8NHS_BH_Bias_HAS_SAV_UserArgs_MT128x64x64_MI16x16x1_SN_LDSB0_CLR1_GRVWA16_GRVWB16_GSU0_GSUC0_GSUWGMRR0_K1_LBSPPA256_LBSPPB128_LPA16_LPB16_LRVW8_MIWT4_2_PLR1_SU0_SUM0_SUS64_VWA4_VWB2_WGM1_WGMXCC1_WGMXCCGn1
    SolutionIndex: 26
    SolutionNameMin: Cijk_Alik_Bljk_F8B8NHS_BH_Bias_HAS_SAV_UserArgs_MT128x64x64_MI16x16x1_SN_LDSB0_CLR1_GRVWA8_GRVWB16_GSU0_GSUC0_GSUWGMRR0_K1_LBSPPA256_LBSPPB128_LPA8_LPB16_LRVW8_MIWT4_2_PLR1_SU0_SUM0_SUS64_VWA4_VWB2_WGM4_WGMXCC1_WGMXCCGn1
    SolutionIndex: 27
    SolutionNameMin: Cijk_Alik_Bljk_F8B8NHS_BH_Bias_HAS_SAV_UserArgs_MT128x64x64_MI16x16x1_SN_LDSB0_CLR1_GRVWA8_GRVWB16_GSU0_GSUC0_GSUWGMRR0_K1_LBSPPA256_LBSPPB128_LPA8_LPB16_LRVW8_MIWT4_2_PLR1_SU0_SUM0_SUS64_VWA4_VWB2_WGM6_WGMXCC1_WGMXCCGn1
    SolutionIndex: 28
    SolutionNameMin: Cijk_Alik_Bljk_F8B8NHS_BH_Bias_HAS_SAV_UserArgs_MT128x64x64_MI16x16x1_SN_LDSB0_CLR1_GRVWA8_GRVWB16_GSU0_GSUC0_GSUWGMRR0_K1_LBSPPA256_LBSPPB128_LPA8_LPB16_LRVW8_MIWT4_2_PLR1_SU0_SUM0_SUS64_VWA4_VWB2_WGM8_WGMXCC1_WGMXCCGn1
    SolutionIndex: 29
    SolutionNameMin: Cijk_Alik_Bljk_F8B8NHS_BH_Bias_HAS_SAV_UserArgs_MT64x64x64_MI16x16x1_SN_LDSB0_CLR1_GRVWA8_GRVWB8_GSU0_GSUC0_GSUWGMRR0_K1_LBSPPA128_LBSPPB128_LPA8_LPB8_LRVW8_MIWT2_2_PLR1_SU0_SUM0_SUS64_VWA2_VWB2_WGM1_WGMXCC1_WGMXCCGn1
    SolutionIndex: 30
    SolutionNameMin: Cijk_Alik_Bljk_F8B8NHS_BH_Bias_HAS_SAV_UserArgs_MT64x64x64_MI16x16x1_SN_LDSB0_CLR1_GRVWA16_GRVWB8_GSU0_GSUC0_GSUWGMRR0_K1_LBSPPA128_LBSPPB128_LPA16_LPB8_LRVW8_MIWT2_2_PLR1_SU0_SUM0_SUS64_VWA2_VWB2_WGM1_WGMXCC1_WGMXCCGn1
    SolutionIndex: 31
    SolutionNameMin: Cijk_Alik_Bljk_F8B8NHS_BH_Bias_HAS_SAV_UserArgs_MT64x64x64_MI16x16x1_SN_LDSB0_CLR1_GRVWA8_GRVWB16_GSU0_GSUC0_GSUWGMRR0_K1_LBSPPA128_LBSPPB128_LPA8_LPB16_LRVW8_MIWT2_2_PLR1_SU0_SUM0_SUS64_VWA2_VWB2_WGM1_WGMXCC1_WGMXCCGn1
    SolutionIndex: 32
    SolutionNameMin: Cijk_Alik_Bljk_F8B8NHS_BH_Bias_HAS_SAV_UserArgs_MT64x64x64_MI16x16x1_SN_LDSB0_CLR1_GRVWA16_GRVWB16_GSU0_GSUC0_GSUWGMRR0_K1_LBSPPA128_LBSPPB128_LPA16_LPB16_LRVW8_MIWT2_2_PLR1_SU0_SUM0_SUS64_VWA2_VWB2_WGM1_WGMXCC1_WGMXCCGn1
    SolutionIndex: 33
    SolutionNameMin: Cijk_Alik_Bljk_F8B8NHS_BH_Bias_HAS_SAV_UserArgs_MT64x64x64_MI16x16x1_SN_LDSB0_CLR1_GRVWA8_GRVWB16_GSU0_GSUC0_GSUWGMRR0_K1_LBSPPA128_LBSPPB128_LPA8_LPB16_LRVW8_MIWT2_2_PLR1_SU0_SUM0_SUS64_VWA2_VWB2_WGM6_WGMXCC1_WGMXCCGn1
    SolutionIndex: 34
    SolutionNameMin: Cijk_Alik_Bljk_F8B8NHS_BH_Bias_HAS_SAV_UserArgs_MT32x64x64_MI16x16x1_SN_LDSB0_CLR1_GRVWA8_GRVWB16_GSU0_GSUC0_GSUWGMRR0_K1_LBSPPA128_LBSPPB128_LPA8_LPB16_LRVW8_MIWT1_2_PLR1_SU0_SUM0_SUS64_VWA1_VWB2_WGM8_WGMXCC1_WGMXCCGn1
    SolutionIndex: 35
    SolutionNameMin: Cijk_Alik_Bljk_F8B8NHS_BH_Bias_HAS_SAV_UserArgs_MT64x32x64_MI16x16x1_SN_LDSB0_CLR1_GRVWA8_GRVWB8_GSU0_GSUC0_GSUWGMRR0_K1_LBSPPA128_LBSPPB128_LPA8_LPB8_LRVW8_MIWT2_1_PLR1_SU0_SUM0_SUS64_VWA2_VWB1_WGM1_WGMXCC1_WGMXCCGn1
    SolutionIndex: 36
    SolutionNameMin: Cijk_Alik_Bljk_F8B8NHS_BH_Bias_HAS_SAV_UserArgs_MT64x32x64_MI16x16x1_SN_LDSB0_CLR1_GRVWA16_GRVWB8_GSU0_GSUC0_GSUWGMRR0_K1_LBSPPA128_LBSPPB128_LPA16_LPB8_LRVW8_MIWT2_1_PLR1_SU0_SUM0_SUS64_VWA2_VWB1_WGM1_WGMXCC1_WGMXCCGn1
    SolutionIndex: 37
    SolutionNameMin: Cijk_Alik_Bljk_F8B8NHS_BH_Bias_HAS_SAV_UserArgs_MT64x32x64_MI16x16x1_SN_LDSB0_CLR1_GRVWA8_GRVWB8_GSU0_GSUC0_GSUWGMRR0_K1_LBSPPA128_LBSPPB128_LPA8_LPB8_LRVW8_MIWT2_1_PLR1_SU0_SUM0_SUS64_VWA2_VWB1_WGM6_WGMXCC1_WGMXCCGn1
    SolutionIndex: 38
    SolutionNameMin: Cijk_Alik_Bljk_F8B8NHS_BH_Bias_HAS_SAV_UserArgs_MT32x32x64_MI16x16x1_SN_LDSB0_CLR1_GRVWA8_GRVWB8_GSU0_GSUC0_GSUWGMRR0_K1_LBSPPA128_LBSPPB128_LPA8_LPB8_LRVW8_MIWT1_1_PLR1_SU0_SUM0_SUS64_VWA1_VWB1_WGM1_WGMXCC1_WGMXCCGn1
    SolutionIndex: 39
    SolutionNameMin: Cijk_Alik_Bljk_F8B8NHS_BH_Bias_HAS_SAV_UserArgs_MT32x32x64_MI16x16x1_SN_LDSB0_CLR1_GRVWA8_GRVWB8_GSU0_GSUC0_GSUWGMRR0_K1_LBSPPA128_LBSPPB128_LPA8_LPB8_LRVW8_MIWT1_1_PLR1_SU0_SUM0_SUS64_VWA1_VWB1_WGM4_WGMXCC1_WGMXCCGn1
    SolutionIndex: 40
    SolutionNameMin: Cijk_Alik_Bljk_F8B8NHS_BH_Bias_HAS_SAV_UserArgs_MT32x32x64_MI16x16x1_SN_LDSB0_CLR1_GRVWA8_GRVWB8_GSU0_GSUC0_GSUWGMRR0_K1_LBSPPA128_LBSPPB128_LPA8_LPB8_LRVW8_MIWT1_1_PLR1_SU0_SUM0_SUS64_VWA1_VWB1_WGM6_WGMXCC1_WGMXCCGn1
    SolutionIndex: 41
    SolutionNameMin: Cijk_Alik_Bljk_F8B8NHS_BH_Bias_HAS_SAV_UserArgs_MT128x256x128_MI16x16x1_SN_LDSB1_CLR1_GRVWA8_GRVWB8_GSU0_GSUC0_GSUWGMRR0_K1_LBSPPA512_LBSPPB1024_LPA8_LPB8_LRVW8_MIWT4_8_PLR1_SU0_SUM0_SUS128_VWA4_VWB8_WGM1_WGMXCC1_WGMXCCGn1
    SolutionIndex: 42
    SolutionNameMin: Cijk_Alik_Bljk_F8B8NHS_BH_Bias_HAS_SAV_UserArgs_MT128x256x128_MI16x16x1_SN_LDSB1_CLR1_GRVWA8_GRVWB16_GSU0_GSUC0_GSUWGMRR0_K1_LBSPPA512_LBSPPB1024_LPA8_LPB16_LRVW8_MIWT4_8_PLR1_SU0_SUM0_SUS128_VWA4_VWB8_WGM6_WGMXCC1_WGMXCCGn1
    SolutionIndex: 43
    SolutionNameMin: Cijk_Alik_Bljk_F8B8NHS_BH_Bias_HAS_SAV_UserArgs_MT256x144x128_MI16x16x1_SN_LDSB1_CLR1_GRVWA8_GRVWB8_GSU0_GSUC0_GSUWGMRR0_K1_LBSPPA512_LBSPPB128_LPA8_LPB8_LRVW8_MIWT4_9_PLR1_SU0_SUM0_SUS128_VWA4_VWB1_WGM1_WGMXCC1_WGMXCCGn1
    SolutionIndex: 44
    SolutionNameMin: Cijk_Alik_Bljk_F8B8NHS_BH_Bias_HAS_SAV_UserArgs_MT256x144x128_MI16x16x1_SN_LDSB1_CLR1_GRVWA16_GRVWB8_GSU0_GSUC0_GSUWGMRR0_K1_LBSPPA512_LBSPPB128_LPA16_LPB8_LRVW8_MIWT4_9_PLR1_SU0_SUM0_SUS128_VWA4_VWB1_WGM1_WGMXCC1_WGMXCCGn1
    SolutionIndex: 45
    SolutionNameMin: Cijk_Alik_Bljk_F8B8NHS_BH_Bias_HAS_SAV_UserArgs_MT256x144x128_MI16x16x1_SN_LDSB1_CLR1_GRVWA8_GRVWB8_GSU0_GSUC0_GSUWGMRR0_K1_LBSPPA512_LBSPPB128_LPA8_LPB8_LRVW8_MIWT4_9_PLR1_SU0_SUM0_SUS128_VWA4_VWB1_WGM4_WGMXCC1_WGMXCCGn1
    SolutionIndex: 46
    SolutionNameMin: Cijk_Alik_Bljk_F8B8NHS_BH_Bias_HAS_SAV_UserArgs_MT256x144x128_MI16x16x1_SN_LDSB1_CLR1_GRVWA16_GRVWB8_GSU0_GSUC0_GSUWGMRR0_K1_LBSPPA512_LBSPPB128_LPA16_LPB8_LRVW8_MIWT4_9_PLR1_SU0_SUM0_SUS128_VWA4_VWB1_WGM4_WGMXCC1_WGMXCCGn1
    SolutionIndex: 47
    SolutionNameMin: Cijk_Alik_Bljk_F8B8NHS_BH_Bias_HAS_SAV_UserArgs_MT256x144x128_MI16x16x1_SN_LDSB1_CLR1_GRVWA8_GRVWB8_GSU0_GSUC0_GSUWGMRR0_K1_LBSPPA512_LBSPPB128_LPA8_LPB8_LRVW8_MIWT4_9_PLR1_SU0_SUM0_SUS128_VWA4_VWB1_WGM6_WGMXCC1_WGMXCCGn1
    SolutionIndex: 48
    SolutionNameMin: Cijk_Alik_Bljk_F8B8NHS_BH_Bias_HAS_SAV_UserArgs_MT256x144x128_MI16x16x1_SN_LDSB1_CLR1_GRVWA16_GRVWB8_GSU0_GSUC0_GSUWGMRR0_K1_LBSPPA512_LBSPPB128_LPA16_LPB8_LRVW8_MIWT4_9_PLR1_SU0_SUM0_SUS128_VWA4_VWB1_WGM6_WGMXCC1_WGMXCCGn1
    SolutionIndex: 49
    SolutionNameMin: Cijk_Alik_Bljk_F8B8NHS_BH_Bias_HAS_SAV_UserArgs_MT256x144x128_MI16x16x1_SN_LDSB1_CLR1_GRVWA8_GRVWB8_GSU0_GSUC0_GSUWGMRR0_K1_LBSPPA512_LBSPPB128_LPA8_LPB8_LRVW8_MIWT4_9_PLR1_SU0_SUM0_SUS128_VWA4_VWB1_WGM8_WGMXCC1_WGMXCCGn1
    SolutionIndex: 50
    SolutionNameMin: Cijk_Alik_Bljk_F8B8NHS_BH_Bias_HAS_SAV_UserArgs_MT256x144x128_MI16x16x1_SN_LDSB1_CLR1_GRVWA16_GRVWB8_GSU0_GSUC0_GSUWGMRR0_K1_LBSPPA512_LBSPPB128_LPA16_LPB8_LRVW8_MIWT4_9_PLR1_SU0_SUM0_SUS128_VWA4_VWB1_WGM8_WGMXCC1_WGMXCCGn1
    SolutionIndex: 51
    SolutionNameMin: Cijk_Alik_Bljk_F8B8NHS_BH_Bias_HAS_SAV_UserArgs_MT256x128x128_MI16x16x1_SN_LDSB1_CLR1_GRVWA8_GRVWB16_GSU0_GSUC0_GSUWGMRR0_K1_LBSPPA1024_LBSPPB512_LPA8_LPB16_LRVW8_MIWT8_4_PLR1_SU0_SUM0_SUS128_VWA8_VWB4_WGM1_WGMXCC1_WGMXCCGn1
    SolutionIndex: 52
    SolutionNameMin: Cijk_Alik_Bljk_F8B8NHS_BH_Bias_HAS_SAV_UserArgs_MT256x128x128_MI16x16x1_SN_LDSB1_CLR1_GRVWA8_GRVWB16_GSU0_GSUC0_GSUWGMRR0_K1_LBSPPA1024_LBSPPB512_LPA8_LPB16_LRVW8_MIWT8_4_PLR1_SU0_SUM0_SUS128_VWA8_VWB4_WGM4_WGMXCC1_WGMXCCGn1
    SolutionIndex: 53
    SolutionNameMin: Cijk_Alik_Bljk_F8B8NHS_BH_Bias_HAS_SAV_UserArgs_MT256x128x128_MI16x16x1_SN_LDSB1_CLR1_GRVWA8_GRVWB16_GSU0_GSUC0_GSUWGMRR0_K1_LBSPPA1024_LBSPPB512_LPA8_LPB16_LRVW8_MIWT8_4_PLR1_SU0_SUM0_SUS128_VWA8_VWB4_WGM6_WGMXCC1_WGMXCCGn1
    SolutionIndex: 54
    SolutionNameMin: Cijk_Alik_Bljk_F8B8NHS_BH_Bias_HAS_SAV_UserArgs_MT256x128x128_MI16x16x1_SN_LDSB1_CLR1_GRVWA8_GRVWB16_GSU0_GSUC0_GSUWGMRR0_K1_LBSPPA1024_LBSPPB512_LPA8_LPB16_LRVW8_MIWT8_4_PLR1_SU0_SUM0_SUS128_VWA8_VWB4_WGM8_WGMXCC1_WGMXCCGn1
    SolutionIndex: 55
    SolutionNameMin: Cijk_Alik_Bljk_F8B8NHS_BH_Bias_HAS_SAV_UserArgs_MT144x256x128_MI16x16x1_SN_LDSB1_CLR1_GRVWA8_GRVWB16_GSU0_GSUC0_GSUWGMRR0_K1_LBSPPA128_LBSPPB512_LPA8_LPB16_LRVW8_MIWT9_4_PLR1_SU0_SUM0_SUS128_VWA1_VWB4_WGM1_WGMXCC1_WGMXCCGn1
    SolutionIndex: 56
    SolutionNameMin: Cijk_Alik_Bljk_F8B8NHS_BH_Bias_HAS_SAV_UserArgs_MT144x256x128_MI16x16x1_SN_LDSB1_CLR1_GRVWA8_GRVWB16_GSU0_GSUC0_GSUWGMRR0_K1_LBSPPA128_LBSPPB512_LPA8_LPB16_LRVW8_MIWT9_4_PLR1_SU0_SUM0_SUS128_VWA1_VWB4_WGM4_WGMXCC1_WGMXCCGn1
    SolutionIndex: 57
    SolutionNameMin: Cijk_Alik_Bljk_F8B8NHS_BH_Bias_HAS_SAV_UserArgs_MT144x256x128_MI16x16x1_SN_LDSB1_CLR1_GRVWA8_GRVWB8_GSU0_GSUC0_GSUWGMRR0_K1_LBSPPA128_LBSPPB512_LPA8_LPB8_LRVW8_MIWT9_4_PLR1_SU0_SUM0_SUS128_VWA1_VWB4_WGM6_WGMXCC1_WGMXCCGn1
    SolutionIndex: 58
    SolutionNameMin: Cijk_Alik_Bljk_F8B8NHS_BH_Bias_HAS_SAV_UserArgs_MT144x256x128_MI16x16x1_SN_LDSB1_CLR1_GRVWA8_GRVWB16_GSU0_GSUC0_GSUWGMRR0_K1_LBSPPA128_LBSPPB512_LPA8_LPB16_LRVW8_MIWT9_4_PLR1_SU0_SUM0_SUS128_VWA1_VWB4_WGM6_WGMXCC1_WGMXCCGn1
    SolutionIndex: 59
    SolutionNameMin: Cijk_Alik_Bljk_F8B8NHS_BH_Bias_HAS_SAV_UserArgs_MT144x256x128_MI16x16x1_SN_LDSB1_CLR1_GRVWA8_GRVWB16_GSU0_GSUC0_GSUWGMRR0_K1_LBSPPA128_LBSPPB512_LPA8_LPB16_LRVW8_MIWT9_4_PLR1_SU0_SUM0_SUS128_VWA1_VWB4_WGM8_WGMXCC1_WGMXCCGn1
    SolutionIndex: 60
    SolutionNameMin: Cijk_Alik_Bljk_F8B8NHS_BH_Bias_HAS_SAV_UserArgs_MT128x128x128_MI16x16x1_SN_LDSB1_CLR1_GRVWA8_GRVWB16_GSU0_GSUC0_GSUWGMRR0_K1_LBSPPA1024_LBSPPB256_LPA8_LPB16_LRVW8_MIWT8_2_PLR1_SU0_SUM0_SUS128_VWA8_VWB2_WGM1_WGMXCC1_WGMXCCGn1
    SolutionIndex: 61
    SolutionNameMin: Cijk_Alik_Bljk_F8B8NHS_BH_Bias_HAS_SAV_UserArgs_MT128x128x128_MI16x16x1_SN_LDSB1_CLR1_GRVWA8_GRVWB16_GSU0_GSUC0_GSUWGMRR0_K1_LBSPPA1024_LBSPPB256_LPA8_LPB16_LRVW8_MIWT8_2_PLR1_SU0_SUM0_SUS128_VWA8_VWB2_WGM4_WGMXCC1_WGMXCCGn1
    SolutionIndex: 62
    SolutionNameMin: Cijk_Alik_Bljk_F8B8NHS_BH_Bias_HAS_SAV_UserArgs_MT128x128x128_MI16x16x1_SN_LDSB1_CLR1_GRVWA8_GRVWB16_GSU0_GSUC0_GSUWGMRR0_K1_LBSPPA1024_LBSPPB256_LPA8_LPB16_LRVW8_MIWT8_2_PLR1_SU0_SUM0_SUS128_VWA8_VWB2_WGM8_WGMXCC1_WGMXCCGn1
    SolutionIndex: 63
    SolutionNameMin: Cijk_Alik_Bljk_F8B8NHS_BH_Bias_HAS_SAV_UserArgs_MT128x144x128_MI16x16x1_SN_LDSB1_CLR1_GRVWA16_GRVWB8_GSU0_GSUC0_GSUWGMRR0_K1_LBSPPA256_LBSPPB128_LPA16_LPB8_LRVW8_MIWT2_9_PLR1_SU0_SUM0_SUS128_VWA2_VWB1_WGM1_WGMXCC1_WGMXCCGn1
    SolutionIndex: 64
    SolutionNameMin: Cijk_Alik_Bljk_F8B8NHS_BH_Bias_HAS_SAV_UserArgs_MT128x144x128_MI16x16x1_SN_LDSB1_CLR1_GRVWA16_GRVWB8_GSU0_GSUC0_GSUWGMRR0_K1_LBSPPA256_LBSPPB128_LPA16_LPB8_LRVW8_MIWT2_9_PLR1_SU0_SUM0_SUS128_VWA2_VWB1_WGM4_WGMXCC1_WGMXCCGn1
    SolutionIndex: 65
    SolutionNameMin: Cijk_Alik_Bljk_F8B8NHS_BH_Bias_HAS_SAV_UserArgs_MT128x144x128_MI16x16x1_SN_LDSB1_CLR1_GRVWA16_GRVWB8_GSU0_GSUC0_GSUWGMRR0_K1_LBSPPA256_LBSPPB128_LPA16_LPB8_LRVW8_MIWT2_9_PLR1_SU0_SUM0_SUS128_VWA2_VWB1_WGM6_WGMXCC1_WGMXCCGn1
    SolutionIndex: 66
    SolutionNameMin: Cijk_Alik_Bljk_F8B8NHS_BH_Bias_HAS_SAV_UserArgs_MT144x128x128_MI16x16x1_SN_LDSB1_CLR1_GRVWA8_GRVWB16_GSU0_GSUC0_GSUWGMRR0_K1_LBSPPA128_LBSPPB256_LPA8_LPB16_LRVW8_MIWT9_2_PLR1_SU0_SUM0_SUS128_VWA1_VWB2_WGM4_WGMXCC1_WGMXCCGn1
    SolutionIndex: 67
    SolutionNameMin: Cijk_Alik_Bljk_F8B8NHS_BH_Bias_HAS_SAV_UserArgs_MT144x128x128_MI16x16x1_SN_LDSB1_CLR1_GRVWA8_GRVWB16_GSU0_GSUC0_GSUWGMRR0_K1_LBSPPA128_LBSPPB256_LPA8_LPB16_LRVW8_MIWT9_2_PLR1_SU0_SUM0_SUS128_VWA1_VWB2_WGM6_WGMXCC1_WGMXCCGn1
    SolutionIndex: 68
    SolutionNameMin: Cijk_Alik_Bljk_F8B8NHS_BH_Bias_HAS_SAV_UserArgs_MT144x128x128_MI16x16x1_SN_LDSB1_CLR1_GRVWA8_GRVWB16_GSU0_GSUC0_GSUWGMRR0_K1_LBSPPA128_LBSPPB256_LPA8_LPB16_LRVW8_MIWT9_2_PLR1_SU0_SUM0_SUS128_VWA1_VWB2_WGM8_WGMXCC1_WGMXCCGn1
    SolutionIndex: 69
    SolutionNameMin: Cijk_Alik_Bljk_F8B8NHS_BH_Bias_HAS_SAV_UserArgs_MT128x128x128_MI16x16x1_SN_LDSB1_CLR1_GRVWA8_GRVWB16_GSU0_GSUC0_GSUWGMRR0_K1_LBSPPA512_LBSPPB512_LPA8_LPB16_LRVW8_MIWT4_4_PLR1_SU0_SUM0_SUS128_VWA4_VWB4_WGM1_WGMXCC1_WGMXCCGn1
    SolutionIndex: 70
    SolutionNameMin: Cijk_Alik_Bljk_F8B8NHS_BH_Bias_HAS_SAV_UserArgs_MT128x128x128_MI16x16x1_SN_LDSB1_CLR1_GRVWA16_GRVWB16_GSU0_GSUC0_GSUWGMRR0_K1_LBSPPA512_LBSPPB512_LPA16_LPB16_LRVW8_MIWT4_4_PLR1_SU0_SUM0_SUS128_VWA4_VWB4_WGM1_WGMXCC1_WGMXCCGn1
    SolutionIndex: 71
    SolutionNameMin: Cijk_Alik_Bljk_F8B8NHS_BH_Bias_HAS_SAV_UserArgs_MT128x128x128_MI16x16x1_SN_LDSB1_CLR1_GRVWA16_GRVWB16_GSU0_GSUC0_GSUWGMRR0_K1_LBSPPA512_LBSPPB512_LPA16_LPB16_LRVW8_MIWT4_4_PLR1_SU0_SUM0_SUS128_VWA4_VWB4_WGM4_WGMXCC1_WGMXCCGn1
    SolutionIndex: 72
    SolutionNameMin: Cijk_Alik_Bljk_F8B8NHS_BH_Bias_HAS_SAV_UserArgs_MT128x128x128_MI16x16x1_SN_LDSB1_CLR1_GRVWA8_GRVWB16_GSU0_GSUC0_GSUWGMRR0_K1_LBSPPA512_LBSPPB512_LPA8_LPB16_LRVW8_MIWT4_4_PLR1_SU0_SUM0_SUS128_VWA4_VWB4_WGM6_WGMXCC1_WGMXCCGn1
    SolutionIndex: 73
    SolutionNameMin: Cijk_Alik_Bljk_F8B8NHS_BH_Bias_HAS_SAV_UserArgs_MT128x128x128_MI16x16x1_SN_LDSB1_CLR1_GRVWA16_GRVWB16_GSU0_GSUC0_GSUWGMRR0_K1_LBSPPA512_LBSPPB512_LPA16_LPB16_LRVW8_MIWT4_4_PLR1_SU0_SUM0_SUS128_VWA4_VWB4_WGM6_WGMXCC1_WGMXCCGn1
    SolutionIndex: 74
    SolutionNameMin: Cijk_Alik_Bljk_F8B8NHS_BH_Bias_HAS_SAV_UserArgs_MT128x128x128_MI16x16x1_SN_LDSB1_CLR1_GRVWA16_GRVWB16_GSU0_GSUC0_GSUWGMRR0_K1_LBSPPA512_LBSPPB512_LPA16_LPB16_LRVW8_MIWT4_4_PLR1_SU0_SUM0_SUS128_VWA4_VWB4_WGM8_WGMXCC1_WGMXCCGn1
    SolutionIndex: 75
    SolutionNameMin: Cijk_Alik_Bljk_F8B8NHS_BH_Bias_HAS_SAV_UserArgs_MT64x128x128_MI16x16x1_SN_LDSB1_CLR1_GRVWA8_GRVWB16_GSU0_GSUC0_GSUWGMRR0_K1_LBSPPA256_LBSPPB512_LPA8_LPB16_LRVW8_MIWT2_4_PLR1_SU0_SUM0_SUS128_VWA2_VWB4_WGM1_WGMXCC1_WGMXCCGn1
    SolutionIndex: 76
    SolutionNameMin: Cijk_Alik_Bljk_F8B8NHS_BH_Bias_HAS_SAV_UserArgs_MT64x128x128_MI16x16x1_SN_LDSB1_CLR1_GRVWA8_GRVWB16_GSU0_GSUC0_GSUWGMRR0_K1_LBSPPA256_LBSPPB512_LPA8_LPB16_LRVW8_MIWT2_4_PLR1_SU0_SUM0_SUS128_VWA2_VWB4_WGM4_WGMXCC1_WGMXCCGn1
    SolutionIndex: 77
    SolutionNameMin: Cijk_Alik_Bljk_F8B8NHS_BH_Bias_HAS_SAV_UserArgs_MT64x64x128_MI16x16x1_SN_LDSB1_CLR1_GRVWA8_GRVWB8_GSU0_GSUC0_GSUWGMRR0_K1_LBSPPA256_LBSPPB256_LPA8_LPB8_LRVW8_MIWT2_2_PLR1_SU0_SUM0_SUS128_VWA2_VWB2_WGM1_WGMXCC1_WGMXCCGn1
    SolutionIndex: 78
    SolutionNameMin: Cijk_Alik_Bljk_F8B8NHS_BH_Bias_HAS_SAV_UserArgs_MT64x64x128_MI16x16x1_SN_LDSB1_CLR1_GRVWA16_GRVWB8_GSU0_GSUC0_GSUWGMRR0_K1_LBSPPA256_LBSPPB256_LPA16_LPB8_LRVW8_MIWT2_2_PLR1_SU0_SUM0_SUS128_VWA2_VWB2_WGM1_WGMXCC1_WGMXCCGn1
    SolutionIndex: 79
    SolutionNameMin: Cijk_Alik_Bljk_F8B8NHS_BH_Bias_HAS_SAV_UserArgs_MT64x64x128_MI16x16x1_SN_LDSB1_CLR1_GRVWA8_GRVWB16_GSU0_GSUC0_GSUWGMRR0_K1_LBSPPA256_LBSPPB256_LPA8_LPB16_LRVW8_MIWT2_2_PLR1_SU0_SUM0_SUS128_VWA2_VWB2_WGM1_WGMXCC1_WGMXCCGn1
    SolutionIndex: 80
    SolutionNameMin: Cijk_Alik_Bljk_F8B8NHS_BH_Bias_HAS_SAV_UserArgs_MT64x64x128_MI16x16x1_SN_LDSB1_CLR1_GRVWA8_GRVWB16_GSU0_GSUC0_GSUWGMRR0_K1_LBSPPA256_LBSPPB256_LPA8_LPB16_LRVW8_MIWT2_2_PLR1_SU0_SUM0_SUS128_VWA2_VWB2_WGM4_WGMXCC1_WGMXCCGn1
    SolutionIndex: 81
    SolutionNameMin: Cijk_Alik_Bljk_F8B8NHS_BH_Bias_HAS_SAV_UserArgs_MT64x64x128_MI16x16x1_SN_LDSB1_CLR1_GRVWA8_GRVWB16_GSU0_GSUC0_GSUWGMRR0_K1_LBSPPA256_LBSPPB256_LPA8_LPB16_LRVW8_MIWT2_2_PLR1_SU0_SUM0_SUS128_VWA2_VWB2_WGM6_WGMXCC1_WGMXCCGn1
    SolutionIndex: 82
    SolutionNameMin: Cijk_Alik_Bljk_F8B8NHS_BH_Bias_HAS_SAV_UserArgs_MT64x64x128_MI16x16x1_SN_LDSB1_CLR1_GRVWA16_GRVWB8_GSU0_GSUC0_GSUWGMRR0_K1_LBSPPA256_LBSPPB256_LPA16_LPB8_LRVW8_MIWT2_2_PLR1_SU0_SUM0_SUS128_VWA2_VWB2_WGM8_WGMXCC1_WGMXCCGn1
    SolutionIndex: 83
    SolutionNameMin: Cijk_Alik_Bljk_F8B8NHS_BH_Bias_HAS_SAV_UserArgs_MT32x64x128_MI16x16x1_SN_LDSB0_CLR1_GRVWA8_GRVWB8_GSU0_GSUC0_GSUWGMRR0_K1_LBSPPA128_LBSPPB256_LPA8_LPB8_LRVW8_MIWT1_2_PLR1_SU0_SUM0_SUS128_VWA1_VWB2_WGM1_WGMXCC1_WGMXCCGn1
    SolutionIndex: 84
    SolutionNameMin: Cijk_Alik_Bljk_F8B8NHS_BH_Bias_HAS_SAV_UserArgs_MT32x64x128_MI16x16x1_SN_LDSB0_CLR1_GRVWA8_GRVWB8_GSU0_GSUC0_GSUWGMRR0_K1_LBSPPA128_LBSPPB256_LPA8_LPB8_LRVW8_MIWT1_2_PLR1_SU0_SUM0_SUS128_VWA1_VWB2_WGM4_WGMXCC1_WGMXCCGn1
    SolutionIndex: 85
    SolutionNameMin: Cijk_Alik_Bljk_F8B8NHS_BH_Bias_HAS_SAV_UserArgs_MT64x32x128_MI16x16x1_SN_LDSB0_CLR1_GRVWA8_GRVWB8_GSU0_GSUC0_GSUWGMRR0_K1_LBSPPA256_LBSPPB128_LPA8_LPB8_LRVW8_MIWT2_1_PLR1_SU0_SUM0_SUS128_VWA2_VWB1_WGM1_WGMXCC1_WGMXCCGn1
    SolutionIndex: 86
    SolutionNameMin: Cijk_Alik_Bljk_F8B8NHS_BH_Bias_HAS_SAV_UserArgs_MT64x32x128_MI16x16x1_SN_LDSB0_CLR1_GRVWA16_GRVWB8_GSU0_GSUC0_GSUWGMRR0_K1_LBSPPA256_LBSPPB128_LPA16_LPB8_LRVW8_MIWT2_1_PLR1_SU0_SUM0_SUS128_VWA2_VWB1_WGM1_WGMXCC1_WGMXCCGn1
    SolutionIndex: 87
    SolutionNameMin: Cijk_Alik_Bljk_F8B8NHS_BH_Bias_HAS_SAV_UserArgs_MT64x32x128_MI16x16x1_SN_LDSB0_CLR1_GRVWA8_GRVWB16_GSU0_GSUC0_GSUWGMRR0_K1_LBSPPA256_LBSPPB128_LPA8_LPB16_LRVW8_MIWT2_1_PLR1_SU0_SUM0_SUS128_VWA2_VWB1_WGM1_WGMXCC1_WGMXCCGn1
    SolutionIndex: 88
    SolutionNameMin: Cijk_Alik_Bljk_F8B8NHS_BH_Bias_HAS_SAV_UserArgs_MT64x32x128_MI16x16x1_SN_LDSB0_CLR1_GRVWA16_GRVWB16_GSU0_GSUC0_GSUWGMRR0_K1_LBSPPA256_LBSPPB128_LPA16_LPB16_LRVW8_MIWT2_1_PLR1_SU0_SUM0_SUS128_VWA2_VWB1_WGM1_WGMXCC1_WGMXCCGn1
    SolutionIndex: 89
    SolutionNameMin: Cijk_Alik_Bljk_F8B8NHS_BH_Bias_HAS_SAV_UserArgs_MT32x32x128_MI16x16x1_SN_LDSB0_CLR1_GRVWA8_GRVWB8_GSU0_GSUC0_GSUWGMRR0_K1_LBSPPA128_LBSPPB128_LPA8_LPB8_LRVW8_MIWT1_1_PLR1_SU0_SUM0_SUS128_VWA1_VWB1_WGM1_WGMXCC1_WGMXCCGn1
    SolutionIndex: 90
    SolutionNameMin: Cijk_Alik_Bljk_F8B8NHS_BH_Bias_HAS_SAV_UserArgs_MT32x32x128_MI16x16x1_SN_LDSB0_CLR1_GRVWA16_GRVWB8_GSU0_GSUC0_GSUWGMRR0_K1_LBSPPA128_LBSPPB128_LPA16_LPB8_LRVW8_MIWT1_1_PLR1_SU0_SUM0_SUS128_VWA1_VWB1_WGM1_WGMXCC1_WGMXCCGn1
    SolutionIndex: 91
    SolutionNameMin: Cijk_Alik_Bljk_F8B8NHS_BH_Bias_HAS_SAV_UserArgs_MT32x32x128_MI16x16x1_SN_LDSB0_CLR1_GRVWA8_GRVWB16_GSU0_GSUC0_GSUWGMRR0_K1_LBSPPA128_LBSPPB128_LPA8_LPB16_LRVW8_MIWT1_1_PLR1_SU0_SUM0_SUS128_VWA1_VWB1_WGM1_WGMXCC1_WGMXCCGn1
    SolutionIndex: 92
    SolutionNameMin: Cijk_Alik_Bljk_F8B8NHS_BH_Bias_HAS_SAV_UserArgs_MT32x32x128_MI16x16x1_SN_LDSB0_CLR1_GRVWA16_GRVWB16_GSU0_GSUC0_GSUWGMRR0_K1_LBSPPA128_LBSPPB128_LPA16_LPB16_LRVW8_MIWT1_1_PLR1_SU0_SUM0_SUS128_VWA1_VWB1_WGM1_WGMXCC1_WGMXCCGn1
    SolutionIndex: 93
    SolutionNameMin: Cijk_Alik_Bljk_F8B8NHS_BH_Bias_HAS_SAV_UserArgs_MT32x32x128_MI16x16x1_SN_LDSB0_CLR1_GRVWA8_GRVWB8_GSU0_GSUC0_GSUWGMRR0_K1_LBSPPA128_LBSPPB128_LPA8_LPB8_LRVW8_MIWT1_1_PLR1_SU0_SUM0_SUS128_VWA1_VWB1_WGM4_WGMXCC1_WGMXCCGn1
    SolutionIndex: 94
    SolutionNameMin: Cijk_Alik_Bljk_F8B8NHS_BH_Bias_HAS_SAV_UserArgs_MT32x32x128_MI16x16x1_SN_LDSB0_CLR1_GRVWA16_GRVWB8_GSU0_GSUC0_GSUWGMRR0_K1_LBSPPA128_LBSPPB128_LPA16_LPB8_LRVW8_MIWT1_1_PLR1_SU0_SUM0_SUS128_VWA1_VWB1_WGM4_WGMXCC1_WGMXCCGn1
    SolutionIndex: 95
    SolutionNameMin: Cijk_Alik_Bljk_F8B8NHS_BH_Bias_HAS_SAV_UserArgs_MT32x32x128_MI16x16x1_SN_LDSB0_CLR1_GRVWA16_GRVWB16_GSU0_GSUC0_GSUWGMRR0_K1_LBSPPA128_LBSPPB128_LPA16_LPB16_LRVW8_MIWT1_1_PLR1_SU0_SUM0_SUS128_VWA1_VWB1_WGM6_WGMXCC1_WGMXCCGn1
    SolutionIndex: 96
    SolutionNameMin: Cijk_Alik_Bljk_F8B8NHS_BH_Bias_HAS_SAV_UserArgs_MT32x32x128_MI16x16x1_SN_LDSB0_CLR1_GRVWA8_GRVWB8_GSU0_GSUC0_GSUWGMRR0_K1_LBSPPA128_LBSPPB128_LPA8_LPB8_LRVW8_MIWT1_1_PLR1_SU0_SUM0_SUS128_VWA1_VWB1_WGM8_WGMXCC1_WGMXCCGn1
    SolutionIndex: 97
    SolutionNameMin: Cijk_Alik_Bljk_F8B8NHS_BH_Bias_HAS_SAV_UserArgs_MT128x64x256_MI16x16x1_SN_LDSB1_CLR1_GRVWA8_GRVWB16_GSU0_GSUC0_GSUWGMRR0_K1_LBSPPA1024_LBSPPB512_LPA8_LPB16_LRVW8_MIWT4_2_PLR1_SU0_SUM0_SUS256_VWA4_VWB2_WGM1_WGMXCC1_WGMXCCGn1
    SolutionIndex: 98
    SolutionNameMin: Cijk_Alik_Bljk_F8B8NHS_BH_Bias_HAS_SAV_UserArgs_MT128x64x256_MI16x16x1_SN_LDSB1_CLR1_GRVWA8_GRVWB16_GSU0_GSUC0_GSUWGMRR0_K1_LBSPPA1024_LBSPPB512_LPA8_LPB16_LRVW8_MIWT4_2_PLR1_SU0_SUM0_SUS256_VWA4_VWB2_WGM4_WGMXCC1_WGMXCCGn1
    SolutionIndex: 99
    SolutionNameMin: Cijk_Alik_Bljk_F8B8NHS_BH_Bias_HAS_SAV_UserArgs_MT128x64x256_MI16x16x1_SN_LDSB1_CLR1_GRVWA8_GRVWB16_GSU0_GSUC0_GSUWGMRR0_K1_LBSPPA1024_LBSPPB512_LPA8_LPB16_LRVW8_MIWT4_2_PLR1_SU0_SUM0_SUS256_VWA4_VWB2_WGM6_WGMXCC1_WGMXCCGn1
    SolutionIndex: 100
    SolutionNameMin: Cijk_Alik_Bljk_F8B8NHS_BH_Bias_HAS_SAV_UserArgs_MT128x64x256_MI16x16x1_SN_LDSB1_CLR1_GRVWA8_GRVWB16_GSU0_GSUC0_GSUWGMRR0_K1_LBSPPA1024_LBSPPB512_LPA8_LPB16_LRVW8_MIWT4_2_PLR1_SU0_SUM0_SUS256_VWA4_VWB2_WGM8_WGMXCC1_WGMXCCGn1
    SolutionIndex: 101
    SolutionNameMin: Cijk_Alik_Bljk_F8B8NHS_BH_Bias_HAS_SAV_UserArgs_MT64x64x256_MI16x16x1_SN_LDSB1_CLR1_GRVWA8_GRVWB16_GSU0_GSUC0_GSUWGMRR0_K1_LBSPPA512_LBSPPB512_LPA8_LPB16_LRVW8_MIWT2_2_PLR1_SU0_SUM0_SUS256_VWA2_VWB2_WGM1_WGMXCC1_WGMXCCGn1
    SolutionIndex: 102
    SolutionNameMin: Cijk_Alik_Bljk_F8B8NHS_BH_Bias_HAS_SAV_UserArgs_MT64x64x256_MI16x16x1_SN_LDSB1_CLR1_GRVWA8_GRVWB16_GSU0_GSUC0_GSUWGMRR0_K1_LBSPPA512_LBSPPB512_LPA8_LPB16_LRVW8_MIWT2_2_PLR1_SU0_SUM0_SUS256_VWA2_VWB2_WGM4_WGMXCC1_WGMXCCGn1
    SolutionIndex: 103
    SolutionNameMin: Cijk_Alik_Bljk_F8B8NHS_BH_Bias_HAS_SAV_UserArgs_MT64x64x256_MI16x16x1_SN_LDSB1_CLR1_GRVWA8_GRVWB16_GSU0_GSUC0_GSUWGMRR0_K1_LBSPPA512_LBSPPB512_LPA8_LPB16_LRVW8_MIWT2_2_PLR1_SU0_SUM0_SUS256_VWA2_VWB2_WGM6_WGMXCC1_WGMXCCGn1
    SolutionIndex: 104
    SolutionNameMin: Cijk_Alik_Bljk_F8B8NHS_BH_Bias_HAS_SAV_UserArgs_MT64x64x256_MI16x16x1_SN_LDSB1_CLR1_GRVWA8_GRVWB16_GSU0_GSUC0_GSUWGMRR0_K1_LBSPPA512_LBSPPB512_LPA8_LPB16_LRVW8_MIWT2_2_PLR1_SU0_SUM0_SUS256_VWA2_VWB2_WGM8_WGMXCC1_WGMXCCGn1
    SolutionIndex: 105
    SolutionNameMin: Cijk_Alik_Bljk_F8B8NHS_BH_Bias_HAS_SAV_UserArgs_MT32x32x256_MI16x16x1_SN_LDSB1_CLR1_GRVWA8_GRVWB16_GSU0_GSUC0_GSUWGMRR0_K1_LBSPPA256_LBSPPB256_LPA8_LPB16_LRVW8_MIWT1_1_PLR1_SU0_SUM0_SUS256_VWA1_VWB1_WGM1_WGMXCC1_WGMXCCGn1
    SolutionIndex: 106
    SolutionNameMin: Cijk_Alik_Bljk_F8B8NHS_BH_Bias_HAS_SAV_UserArgs_MT32x32x256_MI16x16x1_SN_LDSB1_CLR1_GRVWA8_GRVWB16_GSU0_GSUC0_GSUWGMRR0_K1_LBSPPA256_LBSPPB256_LPA8_LPB16_LRVW8_MIWT1_1_PLR1_SU0_SUM0_SUS256_VWA1_VWB1_WGM8_WGMXCC1_WGMXCCGn1
    SolutionIndex: 107
    SolutionNameMin: Cijk_Alik_Bljk_F8B8NHS_BH_Bias_HAS_SAV_UserArgs_MT32x256x32_MI16x16x1_SN_LDSB0_CLR0_GRVWA4_GRVWB4_GSU0_GSUC0_GSUWGMRR0_K1_LBSPPA128_LBSPPB256_LPA8_LPB8_LRVW8_MIWT1_8_PLR0_SU32_SUM0_SUS256_VWA1_VWB8_WGM1_WGMXCC1_WGMXCCGn1
- - - [128, 128, 1, 128, 128, 128, 128, 128]
    - [87, 0.53]
  - - [128, 128, 1, 256, 128, 128, 256, 256]
    - [38, 1.1]
  - - [128, 128, 1, 512, 128, 128, 512, 512]
    - [92, 1.99]
  - - [128, 128, 1, 1024, 128, 128, 1024, 1024]
    - [89, 3.41]
  - - [128, 128, 1, 2048, 128, 128, 2048, 2048]
    - [89, 5.21]
  - - [128, 128, 1, 4096, 128, 128, 4096, 4096]
    - [89, 7.11]
  - - [128, 128, 1, 8192, 128, 128, 8192, 8192]
    - [89, 8.62]
  - - [128, 256, 1, 128, 128, 128, 128, 128]
    - [39, 1.16]
  - - [128, 256, 1, 256, 128, 128, 256, 256]
    - [38, 2.3]
  - - [128, 256, 1, 512, 128, 128, 512, 512]
    - [91, 4.24]
  - - [128, 256, 1, 1024, 128, 128, 1024, 1024]
    - [89, 7.11]
  - - [128, 256, 1, 2048, 128, 128, 2048, 2048]
    - [89, 10.71]
  - - [128, 256, 1, 4096, 128, 128, 4096, 4096]
    - [89, 14.44]
  - - [128, 256, 1, 8192, 128, 128, 8192, 8192]
    - [89, 17.37]
  - - [128, 512, 1, 128, 128, 128, 128, 128]
    - [90, 2.49]
  - - [128, 512, 1, 256, 128, 128, 256, 256]
    - [38, 4.61]
  - - [128, 512, 1, 512, 128, 128, 512, 512]
    - [92, 8.29]
  - - [128, 512, 1, 1024, 128, 128, 1024, 1024]
    - [89, 13.94]
  - - [128, 512, 1, 2048, 128, 128, 2048, 2048]
    - [89, 21.38]
  - - [128, 512, 1, 4096, 128, 128, 4096, 4096]
    - [89, 28.58]
  - - [128, 512, 1, 8192, 128, 128, 8192, 8192]
    - [89, 34.5]
  - - [128, 1024, 1, 128, 128, 128, 128, 128]
    - [90, 4.9]
  - - [128, 1024, 1, 256, 128, 128, 256, 256]
    - [90, 9.17]
  - - [128, 1024, 1, 512, 128, 128, 512, 512]
    - [89, 16.46]
  - - [128, 1024, 1, 1024, 128, 128, 1024, 1024]
    - [89, 27.32]
  - - [128, 1024, 1, 2048, 128, 128, 2048, 2048]
    - [89, 41.05]
  - - [128, 1024, 1, 4096, 128, 128, 4096, 4096]
    - [89, 55.62]
  - - [128, 1024, 1, 8192, 128, 128, 8192, 8192]
    - [89, 67.36]
  - - [128, 2048, 1, 128, 128, 128, 128, 128]
    - [36, 8.85]
  - - [128, 2048, 1, 256, 128, 128, 256, 256]
    - [88, 16.53]
  - - [128, 2048, 1, 512, 128, 128, 512, 512]
    - [86, 28.94]
  - - [128, 2048, 1, 1024, 128, 128, 1024, 1024]
    - [85, 46.72]
  - - [128, 2048, 1, 2048, 128, 128, 2048, 2048]
    - [83, 68.2]
  - - [128, 2048, 1, 4096, 128, 128, 4096, 4096]
    - [83, 88.62]
  - - [128, 2048, 1, 8192, 128, 128, 8192, 8192]
    - [105, 98.56]
  - - [128, 4096, 1, 128, 128, 128, 128, 128]
    - [31, 16.47]
  - - [128, 4096, 1, 256, 128, 128, 256, 256]
    - [29, 30.64]
  - - [128, 4096, 1, 512, 128, 128, 512, 512]
    - [29, 50.44]
  - - [128, 4096, 1, 1024, 128, 128, 1024, 1024]
    - [78, 77.34]
  - - [128, 4096, 1, 2048, 128, 128, 2048, 2048]
    - [78, 105.97]
  - - [128, 4096, 1, 4096, 128, 128, 4096, 4096]
    - [79, 131.07]
  - - [128, 4096, 1, 8192, 128, 128, 8192, 8192]
    - [101, 142.4]
  - - [128, 8192, 1, 128, 128, 128, 128, 128]
    - [25, 27.25]
  - - [128, 8192, 1, 256, 128, 128, 256, 256]
    - [24, 48.5]
  - - [128, 8192, 1, 512, 128, 128, 512, 512]
    - [24, 82.23]
  - - [128, 8192, 1, 1024, 128, 128, 1024, 1024]
    - [24, 122.72]
  - - [128, 8192, 1, 2048, 128, 128, 2048, 2048]
    - [24, 161.61]
  - - [128, 8192, 1, 4096, 128, 128, 4096, 4096]
    - [98, 164.17]
  - - [128, 8192, 1, 8192, 128, 128, 8192, 8192]
    - [101, 186.03]
  - - [256, 128, 1, 128, 256, 256, 128, 128]
    - [94, 1.08]
  - - [256, 128, 1, 256, 256, 256, 256, 256]
    - [95, 2.16]
  - - [256, 128, 1, 512, 256, 256, 512, 512]
    - [90, 4.08]
  - - [256, 128, 1, 1024, 256, 256, 1024, 1024]
    - [90, 6.81]
  - - [256, 128, 1, 2048, 256, 256, 2048, 2048]
    - [89, 10.49]
  - - [256, 128, 1, 4096, 256, 256, 4096, 4096]
    - [89, 14.21]
  - - [256, 128, 1, 8192, 256, 256, 8192, 8192]
    - [89, 17.29]
  - - [256, 256, 1, 128, 256, 256, 128, 128]
    - [37, 2.12]
  - - [256, 256, 1, 256, 256, 256, 256, 256]
    - [35, 4.18]
  - - [256, 256, 1, 512, 256, 256, 512, 512]
    - [92, 7.98]
  - - [256, 256, 1, 1024, 256, 256, 1024, 1024]
    - [91, 13.47]
  - - [256, 256, 1, 2048, 256, 256, 2048, 2048]
    - [89, 20.73]
  - - [256, 256, 1, 4096, 256, 256, 4096, 4096]
    - [89, 28.19]
  - - [256, 256, 1, 8192, 256, 256, 8192, 8192]
    - [89, 34.35]
  - - [256, 512, 1, 128, 256, 256, 128, 128]
    - [34, 4.23]
  - - [256, 512, 1, 256, 256, 256, 256, 256]
    - [90, 8.3]
  - - [256, 512, 1, 512, 256, 256, 512, 512]
    - [91, 15.75]
  - - [256, 512, 1, 1024, 256, 256, 1024, 1024]
    - [105, 26.29]
  - - [256, 512, 1, 2048, 256, 256, 2048, 2048]
    - [89, 41.21]
  - - [256, 512, 1, 4096, 256, 256, 4096, 4096]
    - [89, 55.74]
  - - [256, 512, 1, 8192, 256, 256, 8192, 8192]
    - [89, 67.46]
  - - [256, 1024, 1, 128, 256, 256, 128, 128]
    - [87, 8.6]
  - - [256, 1024, 1, 256, 256, 256, 256, 256]
    - [36, 16.11]
  - - [256, 1024, 1, 512, 256, 256, 512, 512]
    - [85, 28.19]
  - - [256, 1024, 1, 1024, 256, 256, 1024, 1024]
    - [85, 46.16]
  - - [256, 1024, 1, 2048, 256, 256, 2048, 2048]
    - [83, 67.66]
  - - [256, 1024, 1, 4096, 256, 256, 4096, 4096]
    - [83, 87.89]
  - - [256, 1024, 1, 8192, 256, 256, 8192, 8192]
    - [85, 102.13]
  - - [256, 2048, 1, 128, 256, 256, 128, 128]
    - [29, 15.99]
  - - [256, 2048, 1, 256, 256, 256, 256, 256]
    - [31, 28.95]
  - - [256, 2048, 1, 512, 256, 256, 512, 512]
    - [29, 48.74]
  - - [256, 2048, 1, 1024, 256, 256, 1024, 1024]
    - [78, 75.04]
  - - [256, 2048, 1, 2048, 256, 256, 2048, 2048]
    - [78, 103.98]
  - - [256, 2048, 1, 4096, 256, 256, 4096, 4096]
    - [79, 129.55]
  - - [256, 2048, 1, 8192, 256, 256, 8192, 8192]
    - [101, 142.37]
  - - [256, 4096, 1, 128, 256, 256, 128, 128]
    - [20, 27.01]
  - - [256, 4096, 1, 256, 256, 256, 256, 256]
    - [22, 48.7]
  - - [256, 4096, 1, 512, 256, 256, 512, 512]
    - [21, 80.7]
  - - [256, 4096, 1, 1024, 256, 256, 1024, 1024]
    - [24, 121.28]
  - - [256, 4096, 1, 2048, 256, 256, 2048, 2048]
    - [24, 160.63]
  - - [256, 4096, 1, 4096, 256, 256, 4096, 4096]
    - [97, 176.67]
  - - [256, 4096, 1, 8192, 256, 256, 8192, 8192]
    - [76, 189.97]
  - - [256, 8192, 1, 128, 256, 256, 128, 128]
    - [15, 41.57]
  - - [256, 8192, 1, 256, 256, 256, 256, 256]
    - [15, 74.88]
  - - [256, 8192, 1, 512, 256, 256, 512, 512]
    - [15, 121.8]
  - - [256, 8192, 1, 1024, 256, 256, 1024, 1024]
    - [15, 179.15]
  - - [256, 8192, 1, 2048, 256, 256, 2048, 2048]
    - [60, 220.3]
  - - [256, 8192, 1, 4096, 256, 256, 4096, 4096]
    - [70, 220.45]
  - - [256, 8192, 1, 8192, 256, 256, 8192, 8192]
    - [69, 245.29]
  - - [512, 128, 1, 128, 512, 512, 128, 128]
    - [89, 2.09]
  - - [512, 128, 1, 256, 512, 512, 256, 256]
    - [40, 4.13]
  - - [512, 128, 1, 512, 512, 512, 512, 512]
    - [105, 7.57]
  - - [512, 128, 1, 1024, 512, 512, 1024, 1024]
    - [90, 13.38]
  - - [512, 128, 1, 2048, 512, 512, 2048, 2048]
    - [89, 21.08]
  - - [512, 128, 1, 4096, 512, 512, 4096, 4096]
    - [89, 28.47]
  - - [512, 128, 1, 8192, 512, 512, 8192, 8192]
    - [89, 34.27]
  - - [512, 256, 1, 128, 512, 512, 128, 128]
    - [38, 4.78]
  - - [512, 256, 1, 256, 512, 512, 256, 256]
    - [92, 9.0]
  - - [512, 256, 1, 512, 512, 512, 512, 512]
    - [89, 16.34]
  - - [512, 256, 1, 1024, 512, 512, 1024, 1024]
    - [89, 27.03]
  - - [512, 256, 1, 2048, 512, 512, 2048, 2048]
    - [89, 41.37]
  - - [512, 256, 1, 4096, 512, 512, 4096, 4096]
    - [93, 55.04]
  - - [512, 256, 1, 8192, 512, 512, 8192, 8192]
    - [96, 66.98]
  - - [512, 512, 1, 128, 512, 512, 128, 128]
    - [35, 9.0]
  - - [512, 512, 1, 256, 512, 512, 256, 256]
    - [87, 16.64]
  - - [512, 512, 1, 512, 512, 512, 512, 512]
    - [86, 28.57]
  - - [512, 512, 1, 1024, 512, 512, 1024, 1024]
    - [85, 46.81]
  - - [512, 512, 1, 2048, 512, 512, 2048, 2048]
    - [85, 68.25]
  - - [512, 512, 1, 4096, 512, 512, 4096, 4096]
    - [83, 88.8]
  - - [512, 512, 1, 8192, 512, 512, 8192, 8192]
    - [106, 96.22]
  - - [512, 1024, 1, 128, 512, 512, 128, 128]
    - [31, 16.35]
  - - [512, 1024, 1, 256, 512, 512, 256, 256]
    - [29, 29.54]
  - - [512, 1024, 1, 512, 512, 512, 512, 512]
    - [29, 49.46]
  - - [512, 1024, 1, 1024, 512, 512, 1024, 1024]
    - [29, 76.35]
  - - [512, 1024, 1, 2048, 512, 512, 2048, 2048]
    - [78, 105.4]
  - - [512, 1024, 1, 4096, 512, 512, 4096, 4096]
    - [79, 130.56]
  - - [512, 1024, 1, 8192, 512, 512, 8192, 8192]
    - [104, 141.28]
  - - [512, 2048, 1, 128, 512, 512, 128, 128]
    - [19, 27.15]
  - - [512, 2048, 1, 256, 512, 512, 256, 256]
    - [24, 48.8]
  - - [512, 2048, 1, 512, 512, 512, 512, 512]
    - [24, 81.48]
  - - [512, 2048, 1, 1024, 512, 512, 1024, 1024]
    - [26, 120.51]
  - - [512, 2048, 1, 2048, 512, 512, 2048, 2048]
    - [28, 159.84]
  - - [512, 2048, 1, 4096, 512, 512, 4096, 4096]
    - [97, 177.92]
  - - [512, 2048, 1, 8192, 512, 512, 8192, 8192]
    - [75, 193.02]
  - - [512, 4096, 1, 128, 512, 512, 128, 128]
    - [15, 41.66]
  - - [512, 4096, 1, 256, 512, 512, 256, 256]
    - [15, 74.24]
  - - [512, 4096, 1, 512, 512, 512, 512, 512]
    - [15, 122.01]
  - - [512, 4096, 1, 1024, 512, 512, 1024, 1024]
    - [15, 178.56]
  - - [512, 4096, 1, 2048, 512, 512, 2048, 2048]
    - [60, 232.46]
  - - [512, 4096, 1, 4096, 512, 512, 4096, 4096]
    - [70, 225.07]
  - - [512, 4096, 1, 8192, 512, 512, 8192, 8192]
    - [72, 248.74]
  - - [512, 8192, 1, 128, 512, 512, 128, 128]
    - [63, 61.29]
  - - [512, 8192, 1, 256, 512, 512, 256, 256]
    - [65, 108.7]
  - - [512, 8192, 1, 512, 512, 512, 512, 512]
    - [63, 180.38]
  - - [512, 8192, 1, 1024, 512, 512, 1024, 1024]
    - [63, 231.55]
  - - [512, 8192, 1, 2048, 512, 512, 2048, 2048]
    - [51, 236.27]
  - - [512, 8192, 1, 4096, 512, 512, 4096, 4096]
    - [64, 279.02]
  - - [512, 8192, 1, 8192, 512, 512, 8192, 8192]
    - [63, 288.25]
  - - [1024, 128, 1, 128, 1024, 1024, 128, 128]
    - [91, 4.84]
  - - [1024, 128, 1, 256, 1024, 1024, 256, 256]
    - [92, 9.06]
  - - [1024, 128, 1, 512, 1024, 1024, 512, 512]
    - [90, 16.17]
  - - [1024, 128, 1, 1024, 1024, 1024, 1024, 1024]
    - [89, 26.97]
  - - [1024, 128, 1, 2048, 1024, 1024, 2048, 2048]
    - [89, 41.07]
  - - [1024, 128, 1, 4096, 1024, 1024, 4096, 4096]
    - [89, 54.66]
  - - [1024, 128, 1, 8192, 1024, 1024, 8192, 8192]
    - [96, 67.09]
  - - [1024, 256, 1, 128, 1024, 1024, 128, 128]
    - [87, 9.01]
  - - [1024, 256, 1, 256, 1024, 1024, 256, 256]
    - [88, 16.83]
  - - [1024, 256, 1, 512, 1024, 1024, 512, 512]
    - [88, 29.06]
  - - [1024, 256, 1, 1024, 1024, 1024, 1024, 1024]
    - [85, 46.9]
  - - [1024, 256, 1, 2048, 1024, 1024, 2048, 2048]
    - [83, 67.78]
  - - [1024, 256, 1, 4096, 1024, 1024, 4096, 4096]
    - [83, 87.68]
  - - [1024, 256, 1, 8192, 1024, 1024, 8192, 8192]
    - [84, 101.27]
  - - [1024, 512, 1, 128, 1024, 1024, 128, 128]
    - [30, 16.1]
  - - [1024, 512, 1, 256, 1024, 1024, 256, 256]
    - [29, 29.63]
  - - [1024, 512, 1, 512, 1024, 1024, 512, 512]
    - [31, 49.0]
  - - [1024, 512, 1, 1024, 1024, 1024, 1024, 1024]
    - [79, 76.32]
  - - [1024, 512, 1, 2048, 1024, 1024, 2048, 2048]
    - [79, 104.77]
  - - [1024, 512, 1, 4096, 1024, 1024, 4096, 4096]
    - [80, 129.31]
  - - [1024, 512, 1, 8192, 1024, 1024, 8192, 8192]
    - [101, 141.12]
  - - [1024, 1024, 1, 128, 1024, 1024, 128, 128]
    - [24, 27.14]
  - - [1024, 1024, 1, 256, 1024, 1024, 256, 256]
    - [22, 48.7]
  - - [1024, 1024, 1, 512, 1024, 1024, 512, 512]
    - [24, 82.17]
  - - [1024, 1024, 1, 1024, 1024, 1024, 1024, 1024]
    - [27, 121.98]
  - - [1024, 1024, 1, 2048, 1024, 1024, 2048, 2048]
    - [24, 160.32]
  - - [1024, 1024, 1, 4096, 1024, 1024, 4096, 4096]
    - [100, 175.25]
  - - [1024, 1024, 1, 8192, 1024, 1024, 8192, 8192]
    - [98, 190.14]
  - - [1024, 2048, 1, 128, 1024, 1024, 128, 128]
    - [15, 42.01]
  - - [1024, 2048, 1, 256, 1024, 1024, 256, 256]
    - [15, 75.74]
  - - [1024, 2048, 1, 512, 1024, 1024, 512, 512]
    - [15, 122.13]
  - - [1024, 2048, 1, 1024, 1024, 1024, 1024, 1024]
    - [15, 178.74]
  - - [1024, 2048, 1, 2048, 1024, 1024, 2048, 2048]
    - [60, 226.51]
  - - [1024, 2048, 1, 4096, 1024, 1024, 4096, 4096]
    - [69, 228.12]
  - - [1024, 2048, 1, 8192, 1024, 1024, 8192, 8192]
    - [72, 244.66]
  - - [1024, 4096, 1, 128, 1024, 1024, 128, 128]
    - [13, 61.16]
  - - [1024, 4096, 1, 256, 1024, 1024, 256, 256]
    - [12, 105.98]
  - - [1024, 4096, 1, 512, 1024, 1024, 512, 512]
    - [8, 165.33]
  - - [1024, 4096, 1, 1024, 1024, 1024, 1024, 1024]
    - [8, 214.72]
  - - [1024, 4096, 1, 2048, 1024, 1024, 2048, 2048]
    - [51, 242.79]
  - - [1024, 4096, 1, 4096, 1024, 1024, 4096, 4096]
    - [51, 271.5]
  - - [1024, 4096, 1, 8192, 1024, 1024, 8192, 8192]
    - [51, 260.57]
  - - [1024, 8192, 1, 128, 1024, 1024, 128, 128]
    - [48, 74.97]
  - - [1024, 8192, 1, 256, 1024, 1024, 256, 256]
    - [48, 129.83]
  - - [1024, 8192, 1, 512, 1024, 1024, 512, 512]
    - [50, 197.72]
  - - [1024, 8192, 1, 1024, 1024, 1024, 1024, 1024]
    - [50, 245.54]
  - - [1024, 8192, 1, 2048, 1024, 1024, 2048, 2048]
    - [47, 315.2]
  - - [1024, 8192, 1, 4096, 1024, 1024, 4096, 4096]
    - [43, 343.75]
  - - [1024, 8192, 1, 8192, 1024, 1024, 8192, 8192]
    - [43, 357.11]
  - - [2048, 128, 1, 128, 2048, 2048, 128, 128]
    - [36, 8.39]
  - - [2048, 128, 1, 256, 2048, 2048, 256, 256]
    - [88, 15.75]
  - - [2048, 128, 1, 512, 2048, 2048, 512, 512]
    - [85, 28.25]
  - - [2048, 128, 1, 1024, 2048, 2048, 1024, 1024]
    - [87, 45.69]
  - - [2048, 128, 1, 2048, 2048, 2048, 2048, 2048]
    - [85, 67.04]
  - - [2048, 128, 1, 4096, 2048, 2048, 4096, 4096]
    - [84, 87.13]
  - - [2048, 128, 1, 8192, 2048, 2048, 8192, 8192]
    - [84, 99.91]
  - - [2048, 256, 1, 128, 2048, 2048, 128, 128]
    - [31, 15.32]
  - - [2048, 256, 1, 256, 2048, 2048, 256, 256]
    - [33, 28.32]
  - - [2048, 256, 1, 512, 2048, 2048, 512, 512]
    - [29, 48.28]
  - - [2048, 256, 1, 1024, 2048, 2048, 1024, 1024]
    - [80, 74.91]
  - - [2048, 256, 1, 2048, 2048, 2048, 2048, 2048]
    - [81, 103.72]
  - - [2048, 256, 1, 4096, 2048, 2048, 4096, 4096]
    - [80, 128.91]
  - - [2048, 256, 1, 8192, 2048, 2048, 8192, 8192]
    - [103, 141.31]
  - - [2048, 512, 1, 128, 2048, 2048, 128, 128]
    - [20, 26.38]
  - - [2048, 512, 1, 256, 2048, 2048, 256, 256]
    - [21, 47.66]
  - - [2048, 512, 1, 512, 2048, 2048, 512, 512]
    - [27, 80.36]
  - - [2048, 512, 1, 1024, 2048, 2048, 1024, 1024]
    - [27, 120.33]
  - - [2048, 512, 1, 2048, 2048, 2048, 2048, 2048]
    - [26, 155.41]
  - - [2048, 512, 1, 4096, 2048, 2048, 4096, 4096]
    - [100, 173.21]
  - - [2048, 512, 1, 8192, 2048, 2048, 8192, 8192]
    - [98, 192.38]
  - - [2048, 1024, 1, 128, 2048, 2048, 128, 128]
    - [60, 39.72]
  - - [2048, 1024, 1, 256, 2048, 2048, 256, 256]
    - [15, 71.83]
  - - [2048, 1024, 1, 512, 2048, 2048, 512, 512]
    - [15, 121.34]
  - - [2048, 1024, 1, 1024, 2048, 2048, 1024, 1024]
    - [15, 179.49]
  - - [2048, 1024, 1, 2048, 2048, 2048, 2048, 2048]
    - [61, 225.03]
  - - [2048, 1024, 1, 4096, 2048, 2048, 4096, 4096]
    - [71, 230.23]
  - - [2048, 1024, 1, 8192, 2048, 2048, 8192, 8192]
    - [62, 248.12]
  - - [2048, 2048, 1, 128, 2048, 2048, 128, 128]
    - [9, 58.78]
  - - [2048, 2048, 1, 256, 2048, 2048, 256, 256]
    - [8, 103.27]
  - - [2048, 2048, 1, 512, 2048, 2048, 512, 512]
    - [8, 160.14]
  - - [2048, 2048, 1, 1024, 2048, 2048, 1024, 1024]
    - [51, 207.41]
  - - [2048, 2048, 1, 2048, 2048, 2048, 2048, 2048]
    - [54, 243.07]
  - - [2048, 2048, 1, 4096, 2048, 2048, 4096, 4096]
    - [53, 269.25]
  - - [2048, 2048, 1, 8192, 2048, 2048, 8192, 8192]
    - [54, 255.71]
  - - [2048, 4096, 1, 128, 2048, 2048, 128, 128]
    - [1, 69.19]
  - - [2048, 4096, 1, 256, 2048, 2048, 256, 256]
    - [0, 117.18]
  - - [2048, 4096, 1, 512, 2048, 2048, 512, 512]
    - [3, 174.49]
  - - [2048, 4096, 1, 1024, 2048, 2048, 1024, 1024]
    - [3, 226.4]
  - - [2048, 4096, 1, 2048, 2048, 2048, 2048, 2048]
    - [4, 266.88]
  - - [2048, 4096, 1, 4096, 2048, 2048, 4096, 4096]
    - [45, 282.14]
  - - [2048, 4096, 1, 8192, 2048, 2048, 8192, 8192]
    - [50, 310.18]
  - - [2048, 8192, 1, 128, 2048, 2048, 128, 128]
    - [48, 77.15]
  - - [2048, 8192, 1, 256, 2048, 2048, 256, 256]
    - [44, 133.16]
  - - [2048, 8192, 1, 512, 2048, 2048, 512, 512]
    - [46, 198.44]
  - - [2048, 8192, 1, 1024, 2048, 2048, 1024, 1024]
    - [44, 264.56]
  - - [2048, 8192, 1, 2048, 2048, 2048, 2048, 2048]
    - [43, 313.63]
  - - [2048, 8192, 1, 4096, 2048, 2048, 4096, 4096]
    - [43, 320.15]
  - - [2048, 8192, 1, 8192, 2048, 2048, 8192, 8192]
    - [43, 365.83]
  - - [4096, 128, 1, 128, 4096, 4096, 128, 128]
    - [32, 16.48]
  - - [4096, 128, 1, 256, 4096, 4096, 256, 256]
    - [29, 30.31]
  - - [4096, 128, 1, 512, 4096, 4096, 512, 512]
    - [77, 47.77]
  - - [4096, 128, 1, 1024, 4096, 4096, 1024, 1024]
    - [79, 76.78]
  - - [4096, 128, 1, 2048, 4096, 4096, 2048, 2048]
    - [79, 106.01]
  - - [4096, 128, 1, 4096, 4096, 4096, 4096, 4096]
    - [82, 127.6]
  - - [4096, 128, 1, 8192, 4096, 4096, 8192, 8192]
    - [102, 141.21]
  - - [4096, 256, 1, 128, 4096, 4096, 128, 128]
    - [19, 27.58]
  - - [4096, 256, 1, 256, 4096, 4096, 256, 256]
    - [24, 49.08]
  - - [4096, 256, 1, 512, 4096, 4096, 512, 512]
    - [24, 81.8]
  - - [4096, 256, 1, 1024, 4096, 4096, 1024, 1024]
    - [24, 121.3]
  - - [4096, 256, 1, 2048, 4096, 4096, 2048, 2048]
    - [26, 158.85]
  - - [4096, 256, 1, 4096, 4096, 4096, 4096, 4096]
    - [98, 174.2]
  - - [4096, 256, 1, 8192, 4096, 4096, 8192, 8192]
    - [100, 193.76]
  - - [4096, 512, 1, 128, 4096, 4096, 128, 128]
    - [60, 41.7]
  - - [4096, 512, 1, 256, 4096, 4096, 256, 256]
    - [15, 75.0]
  - - [4096, 512, 1, 512, 4096, 4096, 512, 512]
    - [18, 121.11]
  - - [4096, 512, 1, 1024, 4096, 4096, 1024, 1024]
    - [16, 176.62]
  - - [4096, 512, 1, 2048, 4096, 4096, 2048, 2048]
    - [62, 224.04]
  - - [4096, 512, 1, 4096, 4096, 4096, 4096, 4096]
    - [73, 231.11]
  - - [4096, 512, 1, 8192, 4096, 4096, 8192, 8192]
    - [72, 253.82]
  - - [4096, 1024, 1, 128, 4096, 4096, 128, 128]
    - [8, 57.56]
  - - [4096, 1024, 1, 256, 4096, 4096, 256, 256]
    - [8, 99.91]
  - - [4096, 1024, 1, 512, 4096, 4096, 512, 512]
    - [7, 146.24]
  - - [4096, 1024, 1, 1024, 4096, 4096, 1024, 1024]
    - [52, 202.47]
  - - [4096, 1024, 1, 2048, 4096, 4096, 2048, 2048]
    - [54, 244.08]
  - - [4096, 1024, 1, 4096, 4096, 4096, 4096, 4096]
    - [54, 265.74]
  - - [4096, 1024, 1, 8192, 4096, 4096, 8192, 8192]
    - [69, 262.0]
  - - [4096, 2048, 1, 128, 4096, 4096, 128, 128]
    - [8, 64.58]
  - - [4096, 2048, 1, 256, 4096, 4096, 256, 256]
    - [8, 110.6]
  - - [4096, 2048, 1, 512, 4096, 4096, 512, 512]
    - [3, 165.06]
  - - [4096, 2048, 1, 1024, 4096, 4096, 1024, 1024]
    - [6, 227.6]
  - - [4096, 2048, 1, 2048, 4096, 4096, 2048, 2048]
    - [3, 266.22]
  - - [4096, 2048, 1, 4096, 4096, 4096, 4096, 4096]
    - [59, 278.6]
  - - [4096, 2048, 1, 8192, 4096, 4096, 8192, 8192]
    - [55, 306.54]
  - - [4096, 4096, 1, 128, 4096, 4096, 128, 128]
    - [9, 72.18]
  - - [4096, 4096, 1, 256, 4096, 4096, 256, 256]
    - [0, 122.73]
  - - [4096, 4096, 1, 512, 4096, 4096, 512, 512]
    - [3, 179.63]
  - - [4096, 4096, 1, 1024, 4096, 4096, 1024, 1024]
    - [3, 228.42]
  - - [4096, 4096, 1, 2048, 4096, 4096, 2048, 2048]
    - [47, 255.61]
  - - [4096, 4096, 1, 4096, 4096, 4096, 4096, 4096]
    - [41, 284.84]
  - - [4096, 4096, 1, 8192, 4096, 4096, 8192, 8192]
    - [42, 326.04]
  - - [4096, 8192, 1, 128, 4096, 4096, 128, 128]
    - [43, 83.95]
  - - [4096, 8192, 1, 256, 4096, 4096, 256, 256]
    - [44, 141.83]
  - - [4096, 8192, 1, 512, 4096, 4096, 512, 512]
    - [47, 204.87]
  - - [4096, 8192, 1, 1024, 4096, 4096, 1024, 1024]
    - [49, 252.91]
  - - [4096, 8192, 1, 2048, 4096, 4096, 2048, 2048]
    - [47, 294.45]
  - - [4096, 8192, 1, 4096, 4096, 4096, 4096, 4096]
    - [49, 328.2]
  - - [4096, 8192, 1, 8192, 4096, 4096, 8192, 8192]
    - [47, 380.6]
  - - [8192, 128, 1, 128, 8192, 8192, 128, 128]
    - [23, 27.04]
  - - [8192, 128, 1, 256, 8192, 8192, 256, 256]
    - [22, 48.19]
  - - [8192, 128, 1, 512, 8192, 8192, 512, 512]
    - [22, 80.33]
  - - [8192, 128, 1, 1024, 8192, 8192, 1024, 1024]
    - [28, 121.64]
  - - [8192, 128, 1, 2048, 8192, 8192, 2048, 2048]
    - [27, 159.09]
  - - [8192, 128, 1, 4096, 8192, 8192, 4096, 4096]
    - [98, 168.39]
  - - [8192, 128, 1, 8192, 8192, 8192, 8192, 8192]
    - [99, 190.51]
  - - [8192, 256, 1, 128, 8192, 8192, 128, 128]
    - [14, 40.58]
  - - [8192, 256, 1, 256, 8192, 8192, 256, 256]
    - [17, 72.18]
  - - [8192, 256, 1, 512, 8192, 8192, 512, 512]
    - [18, 118.4]
  - - [8192, 256, 1, 1024, 8192, 8192, 1024, 1024]
    - [17, 175.55]
  - - [8192, 256, 1, 2048, 8192, 8192, 2048, 2048]
    - [61, 217.8]
  - - [8192, 256, 1, 4096, 8192, 8192, 4096, 4096]
    - [74, 227.28]
  - - [8192, 256, 1, 8192, 8192, 8192, 8192, 8192]
    - [72, 248.25]
  - - [8192, 512, 1, 128, 8192, 8192, 128, 128]
    - [13, 56.97]
  - - [8192, 512, 1, 256, 8192, 8192, 256, 256]
    - [11, 98.6]
  - - [8192, 512, 1, 512, 8192, 8192, 512, 512]
    - [68, 154.03]
  - - [8192, 512, 1, 1024, 8192, 8192, 1024, 1024]
    - [66, 227.31]
  - - [8192, 512, 1, 2048, 8192, 8192, 2048, 2048]
    - [68, 244.19]
  - - [8192, 512, 1, 4096, 8192, 8192, 4096, 4096]
    - [67, 293.13]
  - - [8192, 512, 1, 8192, 8192, 8192, 8192, 8192]
    - [66, 313.77]
  - - [8192, 1024, 1, 128, 8192, 8192, 128, 128]
    - [5, 64.68]
  - - [8192, 1024, 1, 256, 8192, 8192, 256, 256]
    - [56, 111.76]
  - - [8192, 1024, 1, 512, 8192, 8192, 512, 512]
    - [56, 183.31]
  - - [8192, 1024, 1, 1024, 8192, 8192, 1024, 1024]
    - [6, 225.34]
  - - [8192, 1024, 1, 2048, 8192, 8192, 2048, 2048]
    - [58, 306.0]
  - - [8192, 1024, 1, 4096, 8192, 8192, 4096, 4096]
    - [59, 355.83]
  - - [8192, 1024, 1, 8192, 8192, 8192, 8192, 8192]
    - [56, 382.87]
  - - [8192, 2048, 1, 128, 8192, 8192, 128, 128]
    - [59, 69.64]
  - - [8192, 2048, 1, 256, 8192, 8192, 256, 256]
    - [59, 119.91]
  - - [8192, 2048, 1, 512, 8192, 8192, 512, 512]
    - [57, 175.69]
  - - [8192, 2048, 1, 1024, 8192, 8192, 1024, 1024]
    - [59, 246.15]
  - - [8192, 2048, 1, 2048, 8192, 8192, 2048, 2048]
    - [56, 314.97]
  - - [8192, 2048, 1, 4096, 8192, 8192, 4096, 4096]
    - [58, 337.05]
  - - [8192, 2048, 1, 8192, 8192, 8192, 8192, 8192]
    - [56, 403.36]
  - - [8192, 4096, 1, 128, 8192, 8192, 128, 128]
    - [10, 76.12]
  - - [8192, 4096, 1, 256, 8192, 8192, 256, 256]
    - [2, 124.56]
  - - [8192, 4096, 1, 512, 8192, 8192, 512, 512]
    - [58, 181.76]
  - - [8192, 4096, 1, 1024, 8192, 8192, 1024, 1024]
    - [59, 232.6]
  - - [8192, 4096, 1, 2048, 8192, 8192, 2048, 2048]
    - [58, 298.74]
  - - [8192, 4096, 1, 4096, 8192, 8192, 4096, 4096]
    - [58, 345.79]
  - - [8192, 4096, 1, 8192, 8192, 8192, 8192, 8192]
    - [58, 412.87]
  - - [8192, 8192, 1, 128, 8192, 8192, 128, 128]
    - [43, 79.31]
  - - [8192, 8192, 1, 256, 8192, 8192, 256, 256]
    - [43, 125.63]
  - - [8192, 8192, 1, 512, 8192, 8192, 512, 512]
    - [43, 176.53]
  - - [8192, 8192, 1, 1024, 8192, 8192, 1024, 1024]
    - [47, 238.48]
  - - [8192, 8192, 1, 2048, 8192, 8192, 2048, 2048]
    - [58, 301.54]
  - - [8192, 8192, 1, 4096, 8192, 8192, 4096, 4096]
    - [58, 354.15]
  - - [8192, 8192, 1, 8192, 8192, 8192, 8192, 8192]
    - [58, 411.87]
  - - [1, 1, 1, 32, 1, 1, 32, 32]
    - [107, 0.0]
- null
- null
- ExperimentalStreamK
- GridBased
