projects/hipblaslt/library/src/amd_detail/rocblaslt/src/Tensile/Logic/asm_full/aquavanjaram/gfx942_228cu/StreamK/aquavanjaram942_Cijk_Alik_Bljk_F8B8NF8NS_BH_Bias_HAS_SAV_UserArgs.yaml
- {MinimumRequiredVersion: 4.33.0}
- aquavanjaram942
- {Architecture: gfx942, CUCount: 228}
- [Device 0049, Device 0050]
    SolutionIndex: 0
    SolutionNameMin: Cijk_Alik_Bljk_F8B8NF8NS_BH_Bias_HAS_SAV_UserArgs_MT256x256x64_MI16x16x1_SN_LDSB1_CLR1_GRVWA8_GRVWB16_GSU0_GSUC0_GSUWGMRR0_K1_LBSPPA512_LBSPPB512_LPA8_LPB16_LRVW8_MIWT8_8_PLR1_SU0_SUM0_SUS64_VWA8_VWB8_WGM1_WGMXCC1_WGMXCCGn1
    SolutionIndex: 1
    SolutionNameMin: Cijk_Alik_Bljk_F8B8NF8NS_BH_Bias_HAS_SAV_UserArgs_MT256x256x64_MI16x16x1_SN_LDSB1_CLR1_GRVWA8_GRVWB16_GSU0_GSUC0_GSUWGMRR0_K1_LBSPPA512_LBSPPB512_LPA8_LPB16_LRVW8_MIWT8_8_PLR1_SU0_SUM0_SUS64_VWA8_VWB8_WGM4_WGMXCC1_WGMXCCGn1
    SolutionIndex: 2
    SolutionNameMin: Cijk_Alik_Bljk_F8B8NF8NS_BH_Bias_HAS_SAV_UserArgs_MT256x256x64_MI16x16x1_SN_LDSB1_CLR1_GRVWA16_GRVWB16_GSU0_GSUC0_GSUWGMRR0_K1_LBSPPA512_LBSPPB512_LPA16_LPB16_LRVW8_MIWT8_8_PLR1_SU0_SUM0_SUS64_VWA8_VWB8_WGM4_WGMXCC1_WGMXCCGn1
    SolutionIndex: 3
    SolutionNameMin: Cijk_Alik_Bljk_F8B8NF8NS_BH_Bias_HAS_SAV_UserArgs_MT256x256x64_MI16x16x1_SN_LDSB1_CLR1_GRVWA8_GRVWB16_GSU0_GSUC0_GSUWGMRR0_K1_LBSPPA512_LBSPPB512_LPA8_LPB16_LRVW8_MIWT8_8_PLR1_SU0_SUM0_SUS64_VWA8_VWB8_WGM6_WGMXCC1_WGMXCCGn1
    SolutionIndex: 4
    SolutionNameMin: Cijk_Alik_Bljk_F8B8NF8NS_BH_Bias_HAS_SAV_UserArgs_MT256x256x64_MI16x16x1_SN_LDSB1_CLR1_GRVWA16_GRVWB16_GSU0_GSUC0_GSUWGMRR0_K1_LBSPPA512_LBSPPB512_LPA16_LPB16_LRVW8_MIWT8_8_PLR1_SU0_SUM0_SUS64_VWA8_VWB8_WGM6_WGMXCC1_WGMXCCGn1
    SolutionIndex: 5
    SolutionNameMin: Cijk_Alik_Bljk_F8B8NF8NS_BH_Bias_HAS_SAV_UserArgs_MT256x256x64_MI16x16x1_SN_LDSB1_CLR1_GRVWA8_GRVWB16_GSU0_GSUC0_GSUWGMRR0_K1_LBSPPA512_LBSPPB512_LPA8_LPB16_LRVW8_MIWT8_8_PLR1_SU0_SUM0_SUS64_VWA8_VWB8_WGM8_WGMXCC1_WGMXCCGn1
    SolutionIndex: 6
    SolutionNameMin: Cijk_Alik_Bljk_F8B8NF8NS_BH_Bias_HAS_SAV_UserArgs_MT256x256x64_MI16x16x1_SN_LDSB1_CLR1_GRVWA16_GRVWB16_GSU0_GSUC0_GSUWGMRR0_K1_LBSPPA512_LBSPPB512_LPA16_LPB16_LRVW8_MIWT8_8_PLR1_SU0_SUM0_SUS64_VWA8_VWB8_WGM8_WGMXCC1_WGMXCCGn1
    SolutionIndex: 7
    SolutionNameMin: Cijk_Alik_Bljk_F8B8NF8NS_BH_Bias_HAS_SAV_UserArgs_MT256x128x64_MI16x16x1_SN_LDSB1_CLR1_GRVWA8_GRVWB16_GSU0_GSUC0_GSUWGMRR0_K1_LBSPPA512_LBSPPB256_LPA8_LPB16_LRVW8_MIWT8_4_PLR1_SU0_SUM0_SUS64_VWA8_VWB4_WGM1_WGMXCC1_WGMXCCGn1
    SolutionIndex: 8
    SolutionNameMin: Cijk_Alik_Bljk_F8B8NF8NS_BH_Bias_HAS_SAV_UserArgs_MT256x128x64_MI16x16x1_SN_LDSB1_CLR1_GRVWA8_GRVWB16_GSU0_GSUC0_GSUWGMRR0_K1_LBSPPA512_LBSPPB256_LPA8_LPB16_LRVW8_MIWT8_4_PLR1_SU0_SUM0_SUS64_VWA8_VWB4_WGM4_WGMXCC1_WGMXCCGn1
    SolutionIndex: 9
    SolutionNameMin: Cijk_Alik_Bljk_F8B8NF8NS_BH_Bias_HAS_SAV_UserArgs_MT128x128x64_MI16x16x1_SN_LDSB1_CLR1_GRVWA8_GRVWB16_GSU0_GSUC0_GSUWGMRR0_K1_LBSPPA512_LBSPPB128_LPA8_LPB16_LRVW8_MIWT8_2_PLR1_SU0_SUM0_SUS64_VWA8_VWB2_WGM1_WGMXCC1_WGMXCCGn1
    SolutionIndex: 10
    SolutionNameMin: Cijk_Alik_Bljk_F8B8NF8NS_BH_Bias_HAS_SAV_UserArgs_MT128x128x64_MI16x16x1_SN_LDSB1_CLR1_GRVWA8_GRVWB16_GSU0_GSUC0_GSUWGMRR0_K1_LBSPPA256_LBSPPB256_LPA8_LPB16_LRVW8_MIWT4_4_PLR1_SU0_SUM0_SUS64_VWA4_VWB4_WGM1_WGMXCC1_WGMXCCGn1
    SolutionIndex: 11
    SolutionNameMin: Cijk_Alik_Bljk_F8B8NF8NS_BH_Bias_HAS_SAV_UserArgs_MT128x128x64_MI16x16x1_SN_LDSB1_CLR1_GRVWA16_GRVWB16_GSU0_GSUC0_GSUWGMRR0_K1_LBSPPA256_LBSPPB256_LPA16_LPB16_LRVW8_MIWT4_4_PLR1_SU0_SUM0_SUS64_VWA4_VWB4_WGM1_WGMXCC1_WGMXCCGn1
    SolutionIndex: 12
    SolutionNameMin: Cijk_Alik_Bljk_F8B8NF8NS_BH_Bias_HAS_SAV_UserArgs_MT64x128x64_MI16x16x1_SN_LDSB0_CLR1_GRVWA8_GRVWB16_GSU0_GSUC0_GSUWGMRR0_K1_LBSPPA128_LBSPPB256_LPA8_LPB16_LRVW8_MIWT2_4_PLR1_SU0_SUM0_SUS64_VWA2_VWB4_WGM1_WGMXCC1_WGMXCCGn1
    SolutionIndex: 13
    SolutionNameMin: Cijk_Alik_Bljk_F8B8NF8NS_BH_Bias_HAS_SAV_UserArgs_MT128x64x64_MI16x16x1_SN_LDSB0_CLR1_GRVWA8_GRVWB8_GSU0_GSUC0_GSUWGMRR0_K1_LBSPPA256_LBSPPB128_LPA8_LPB8_LRVW8_MIWT4_2_PLR1_SU0_SUM0_SUS64_VWA4_VWB2_WGM1_WGMXCC1_WGMXCCGn1
    SolutionIndex: 14
    SolutionNameMin: Cijk_Alik_Bljk_F8B8NF8NS_BH_Bias_HAS_SAV_UserArgs_MT128x64x64_MI16x16x1_SN_LDSB0_CLR1_GRVWA16_GRVWB8_GSU0_GSUC0_GSUWGMRR0_K1_LBSPPA256_LBSPPB128_LPA16_LPB8_LRVW8_MIWT4_2_PLR1_SU0_SUM0_SUS64_VWA4_VWB2_WGM1_WGMXCC1_WGMXCCGn1
    SolutionIndex: 15
    SolutionNameMin: Cijk_Alik_Bljk_F8B8NF8NS_BH_Bias_HAS_SAV_UserArgs_MT128x64x64_MI16x16x1_SN_LDSB0_CLR1_GRVWA8_GRVWB16_GSU0_GSUC0_GSUWGMRR0_K1_LBSPPA256_LBSPPB128_LPA8_LPB16_LRVW8_MIWT4_2_PLR1_SU0_SUM0_SUS64_VWA4_VWB2_WGM1_WGMXCC1_WGMXCCGn1
    SolutionIndex: 16
    SolutionNameMin: Cijk_Alik_Bljk_F8B8NF8NS_BH_Bias_HAS_SAV_UserArgs_MT128x64x64_MI16x16x1_SN_LDSB0_CLR1_GRVWA8_GRVWB16_GSU0_GSUC0_GSUWGMRR0_K1_LBSPPA256_LBSPPB128_LPA8_LPB16_LRVW8_MIWT4_2_PLR1_SU0_SUM0_SUS64_VWA4_VWB2_WGM4_WGMXCC1_WGMXCCGn1
    SolutionIndex: 17
    SolutionNameMin: Cijk_Alik_Bljk_F8B8NF8NS_BH_Bias_HAS_SAV_UserArgs_MT128x64x64_MI16x16x1_SN_LDSB0_CLR1_GRVWA8_GRVWB16_GSU0_GSUC0_GSUWGMRR0_K1_LBSPPA256_LBSPPB128_LPA8_LPB16_LRVW8_MIWT4_2_PLR1_SU0_SUM0_SUS64_VWA4_VWB2_WGM6_WGMXCC1_WGMXCCGn1
    SolutionIndex: 18
    SolutionNameMin: Cijk_Alik_Bljk_F8B8NF8NS_BH_Bias_HAS_SAV_UserArgs_MT128x64x64_MI16x16x1_SN_LDSB0_CLR1_GRVWA8_GRVWB16_GSU0_GSUC0_GSUWGMRR0_K1_LBSPPA256_LBSPPB128_LPA8_LPB16_LRVW8_MIWT4_2_PLR1_SU0_SUM0_SUS64_VWA4_VWB2_WGM8_WGMXCC1_WGMXCCGn1
    SolutionIndex: 19
    SolutionNameMin: Cijk_Alik_Bljk_F8B8NF8NS_BH_Bias_HAS_SAV_UserArgs_MT64x64x64_MI16x16x1_SN_LDSB0_CLR1_GRVWA8_GRVWB8_GSU0_GSUC0_GSUWGMRR0_K1_LBSPPA128_LBSPPB128_LPA8_LPB8_LRVW8_MIWT2_2_PLR1_SU0_SUM0_SUS64_VWA2_VWB2_WGM1_WGMXCC1_WGMXCCGn1
    SolutionIndex: 20
    SolutionNameMin: Cijk_Alik_Bljk_F8B8NF8NS_BH_Bias_HAS_SAV_UserArgs_MT64x64x64_MI16x16x1_SN_LDSB0_CLR1_GRVWA16_GRVWB8_GSU0_GSUC0_GSUWGMRR0_K1_LBSPPA128_LBSPPB128_LPA16_LPB8_LRVW8_MIWT2_2_PLR1_SU0_SUM0_SUS64_VWA2_VWB2_WGM1_WGMXCC1_WGMXCCGn1
    SolutionIndex: 21
    SolutionNameMin: Cijk_Alik_Bljk_F8B8NF8NS_BH_Bias_HAS_SAV_UserArgs_MT64x64x64_MI16x16x1_SN_LDSB0_CLR1_GRVWA8_GRVWB16_GSU0_GSUC0_GSUWGMRR0_K1_LBSPPA128_LBSPPB128_LPA8_LPB16_LRVW8_MIWT2_2_PLR1_SU0_SUM0_SUS64_VWA2_VWB2_WGM1_WGMXCC1_WGMXCCGn1
    SolutionIndex: 22
    SolutionNameMin: Cijk_Alik_Bljk_F8B8NF8NS_BH_Bias_HAS_SAV_UserArgs_MT64x64x64_MI16x16x1_SN_LDSB0_CLR1_GRVWA16_GRVWB16_GSU0_GSUC0_GSUWGMRR0_K1_LBSPPA128_LBSPPB128_LPA16_LPB16_LRVW8_MIWT2_2_PLR1_SU0_SUM0_SUS64_VWA2_VWB2_WGM1_WGMXCC1_WGMXCCGn1
    SolutionIndex: 23
    SolutionNameMin: Cijk_Alik_Bljk_F8B8NF8NS_BH_Bias_HAS_SAV_UserArgs_MT64x32x64_MI16x16x1_SN_LDSB0_CLR1_GRVWA8_GRVWB8_GSU0_GSUC0_GSUWGMRR0_K1_LBSPPA128_LBSPPB128_LPA8_LPB8_LRVW8_MIWT2_1_PLR1_SU0_SUM0_SUS64_VWA2_VWB1_WGM1_WGMXCC1_WGMXCCGn1
    SolutionIndex: 24
    SolutionNameMin: Cijk_Alik_Bljk_F8B8NF8NS_BH_Bias_HAS_SAV_UserArgs_MT32x32x64_MI16x16x1_SN_LDSB0_CLR1_GRVWA8_GRVWB8_GSU0_GSUC0_GSUWGMRR0_K1_LBSPPA128_LBSPPB128_LPA8_LPB8_LRVW8_MIWT1_1_PLR1_SU0_SUM0_SUS64_VWA1_VWB1_WGM1_WGMXCC1_WGMXCCGn1
    SolutionIndex: 25
    SolutionNameMin: Cijk_Alik_Bljk_F8B8NF8NS_BH_Bias_HAS_SAV_UserArgs_MT32x32x64_MI16x16x1_SN_LDSB0_CLR1_GRVWA8_GRVWB8_GSU0_GSUC0_GSUWGMRR0_K1_LBSPPA128_LBSPPB128_LPA8_LPB8_LRVW8_MIWT1_1_PLR1_SU0_SUM0_SUS64_VWA1_VWB1_WGM4_WGMXCC1_WGMXCCGn1
    SolutionIndex: 26
    SolutionNameMin: Cijk_Alik_Bljk_F8B8NF8NS_BH_Bias_HAS_SAV_UserArgs_MT128x256x128_MI16x16x1_SN_LDSB1_CLR1_GRVWA8_GRVWB16_GSU0_GSUC0_GSUWGMRR0_K1_LBSPPA512_LBSPPB1024_LPA8_LPB16_LRVW8_MIWT4_8_PLR1_SU0_SUM0_SUS128_VWA4_VWB8_WGM1_WGMXCC1_WGMXCCGn1
    SolutionIndex: 27
    SolutionNameMin: Cijk_Alik_Bljk_F8B8NF8NS_BH_Bias_HAS_SAV_UserArgs_MT128x256x128_MI16x16x1_SN_LDSB1_CLR1_GRVWA8_GRVWB16_GSU0_GSUC0_GSUWGMRR0_K1_LBSPPA512_LBSPPB1024_LPA8_LPB16_LRVW8_MIWT4_8_PLR1_SU0_SUM0_SUS128_VWA4_VWB8_WGM6_WGMXCC1_WGMXCCGn1
    SolutionIndex: 28
    SolutionNameMin: Cijk_Alik_Bljk_F8B8NF8NS_BH_Bias_HAS_SAV_UserArgs_MT256x144x128_MI16x16x1_SN_LDSB1_CLR1_GRVWA8_GRVWB8_GSU0_GSUC0_GSUWGMRR0_K1_LBSPPA512_LBSPPB128_LPA8_LPB8_LRVW8_MIWT4_9_PLR1_SU0_SUM0_SUS128_VWA4_VWB1_WGM1_WGMXCC1_WGMXCCGn1
    SolutionIndex: 29
    SolutionNameMin: Cijk_Alik_Bljk_F8B8NF8NS_BH_Bias_HAS_SAV_UserArgs_MT256x144x128_MI16x16x1_SN_LDSB1_CLR1_GRVWA16_GRVWB8_GSU0_GSUC0_GSUWGMRR0_K1_LBSPPA512_LBSPPB128_LPA16_LPB8_LRVW8_MIWT4_9_PLR1_SU0_SUM0_SUS128_VWA4_VWB1_WGM1_WGMXCC1_WGMXCCGn1
    SolutionIndex: 30
    SolutionNameMin: Cijk_Alik_Bljk_F8B8NF8NS_BH_Bias_HAS_SAV_UserArgs_MT256x144x128_MI16x16x1_SN_LDSB1_CLR1_GRVWA8_GRVWB8_GSU0_GSUC0_GSUWGMRR0_K1_LBSPPA512_LBSPPB128_LPA8_LPB8_LRVW8_MIWT4_9_PLR1_SU0_SUM0_SUS128_VWA4_VWB1_WGM4_WGMXCC1_WGMXCCGn1
    SolutionIndex: 31
    SolutionNameMin: Cijk_Alik_Bljk_F8B8NF8NS_BH_Bias_HAS_SAV_UserArgs_MT256x144x128_MI16x16x1_SN_LDSB1_CLR1_GRVWA16_GRVWB8_GSU0_GSUC0_GSUWGMRR0_K1_LBSPPA512_LBSPPB128_LPA16_LPB8_LRVW8_MIWT4_9_PLR1_SU0_SUM0_SUS128_VWA4_VWB1_WGM4_WGMXCC1_WGMXCCGn1
    SolutionIndex: 32
    SolutionNameMin: Cijk_Alik_Bljk_F8B8NF8NS_BH_Bias_HAS_SAV_UserArgs_MT256x144x128_MI16x16x1_SN_LDSB1_CLR1_GRVWA8_GRVWB8_GSU0_GSUC0_GSUWGMRR0_K1_LBSPPA512_LBSPPB128_LPA8_LPB8_LRVW8_MIWT4_9_PLR1_SU0_SUM0_SUS128_VWA4_VWB1_WGM6_WGMXCC1_WGMXCCGn1
    SolutionIndex: 33
    SolutionNameMin: Cijk_Alik_Bljk_F8B8NF8NS_BH_Bias_HAS_SAV_UserArgs_MT256x144x128_MI16x16x1_SN_LDSB1_CLR1_GRVWA16_GRVWB8_GSU0_GSUC0_GSUWGMRR0_K1_LBSPPA512_LBSPPB128_LPA16_LPB8_LRVW8_MIWT4_9_PLR1_SU0_SUM0_SUS128_VWA4_VWB1_WGM6_WGMXCC1_WGMXCCGn1
    SolutionIndex: 34
    SolutionNameMin: Cijk_Alik_Bljk_F8B8NF8NS_BH_Bias_HAS_SAV_UserArgs_MT256x144x128_MI16x16x1_SN_LDSB1_CLR1_GRVWA8_GRVWB8_GSU0_GSUC0_GSUWGMRR0_K1_LBSPPA512_LBSPPB128_LPA8_LPB8_LRVW8_MIWT4_9_PLR1_SU0_SUM0_SUS128_VWA4_VWB1_WGM8_WGMXCC1_WGMXCCGn1
    SolutionIndex: 35
    SolutionNameMin: Cijk_Alik_Bljk_F8B8NF8NS_BH_Bias_HAS_SAV_UserArgs_MT256x144x128_MI16x16x1_SN_LDSB1_CLR1_GRVWA16_GRVWB8_GSU0_GSUC0_GSUWGMRR0_K1_LBSPPA512_LBSPPB128_LPA16_LPB8_LRVW8_MIWT4_9_PLR1_SU0_SUM0_SUS128_VWA4_VWB1_WGM8_WGMXCC1_WGMXCCGn1
    SolutionIndex: 36
    SolutionNameMin: Cijk_Alik_Bljk_F8B8NF8NS_BH_Bias_HAS_SAV_UserArgs_MT256x128x128_MI16x16x1_SN_LDSB1_CLR1_GRVWA8_GRVWB16_GSU0_GSUC0_GSUWGMRR0_K1_LBSPPA1024_LBSPPB512_LPA8_LPB16_LRVW8_MIWT8_4_PLR1_SU0_SUM0_SUS128_VWA8_VWB4_WGM1_WGMXCC1_WGMXCCGn1
    SolutionIndex: 37
    SolutionNameMin: Cijk_Alik_Bljk_F8B8NF8NS_BH_Bias_HAS_SAV_UserArgs_MT256x128x128_MI16x16x1_SN_LDSB1_CLR1_GRVWA8_GRVWB16_GSU0_GSUC0_GSUWGMRR0_K1_LBSPPA1024_LBSPPB512_LPA8_LPB16_LRVW8_MIWT8_4_PLR1_SU0_SUM0_SUS128_VWA8_VWB4_WGM4_WGMXCC1_WGMXCCGn1
    SolutionIndex: 38
    SolutionNameMin: Cijk_Alik_Bljk_F8B8NF8NS_BH_Bias_HAS_SAV_UserArgs_MT256x128x128_MI16x16x1_SN_LDSB1_CLR1_GRVWA8_GRVWB16_GSU0_GSUC0_GSUWGMRR0_K1_LBSPPA1024_LBSPPB512_LPA8_LPB16_LRVW8_MIWT8_4_PLR1_SU0_SUM0_SUS128_VWA8_VWB4_WGM8_WGMXCC1_WGMXCCGn1
    SolutionIndex: 39
    SolutionNameMin: Cijk_Alik_Bljk_F8B8NF8NS_BH_Bias_HAS_SAV_UserArgs_MT144x256x128_MI16x16x1_SN_LDSB1_CLR1_GRVWA8_GRVWB16_GSU0_GSUC0_GSUWGMRR0_K1_LBSPPA128_LBSPPB512_LPA8_LPB16_LRVW8_MIWT9_4_PLR1_SU0_SUM0_SUS128_VWA1_VWB4_WGM1_WGMXCC1_WGMXCCGn1
    SolutionIndex: 40
    SolutionNameMin: Cijk_Alik_Bljk_F8B8NF8NS_BH_Bias_HAS_SAV_UserArgs_MT144x256x128_MI16x16x1_SN_LDSB1_CLR1_GRVWA8_GRVWB16_GSU0_GSUC0_GSUWGMRR0_K1_LBSPPA128_LBSPPB512_LPA8_LPB16_LRVW8_MIWT9_4_PLR1_SU0_SUM0_SUS128_VWA1_VWB4_WGM4_WGMXCC1_WGMXCCGn1
    SolutionIndex: 41
    SolutionNameMin: Cijk_Alik_Bljk_F8B8NF8NS_BH_Bias_HAS_SAV_UserArgs_MT144x256x128_MI16x16x1_SN_LDSB1_CLR1_GRVWA8_GRVWB16_GSU0_GSUC0_GSUWGMRR0_K1_LBSPPA128_LBSPPB512_LPA8_LPB16_LRVW8_MIWT9_4_PLR1_SU0_SUM0_SUS128_VWA1_VWB4_WGM6_WGMXCC1_WGMXCCGn1
    SolutionIndex: 42
    SolutionNameMin: Cijk_Alik_Bljk_F8B8NF8NS_BH_Bias_HAS_SAV_UserArgs_MT144x256x128_MI16x16x1_SN_LDSB1_CLR1_GRVWA8_GRVWB8_GSU0_GSUC0_GSUWGMRR0_K1_LBSPPA128_LBSPPB512_LPA8_LPB8_LRVW8_MIWT9_4_PLR1_SU0_SUM0_SUS128_VWA1_VWB4_WGM8_WGMXCC1_WGMXCCGn1
    SolutionIndex: 43
    SolutionNameMin: Cijk_Alik_Bljk_F8B8NF8NS_BH_Bias_HAS_SAV_UserArgs_MT144x256x128_MI16x16x1_SN_LDSB1_CLR1_GRVWA8_GRVWB16_GSU0_GSUC0_GSUWGMRR0_K1_LBSPPA128_LBSPPB512_LPA8_LPB16_LRVW8_MIWT9_4_PLR1_SU0_SUM0_SUS128_VWA1_VWB4_WGM8_WGMXCC1_WGMXCCGn1
    SolutionIndex: 44
    SolutionNameMin: Cijk_Alik_Bljk_F8B8NF8NS_BH_Bias_HAS_SAV_UserArgs_MT128x128x128_MI16x16x1_SN_LDSB1_CLR1_GRVWA8_GRVWB16_GSU0_GSUC0_GSUWGMRR0_K1_LBSPPA1024_LBSPPB256_LPA8_LPB16_LRVW8_MIWT8_2_PLR1_SU0_SUM0_SUS128_VWA8_VWB2_WGM1_WGMXCC1_WGMXCCGn1
    SolutionIndex: 45
    SolutionNameMin: Cijk_Alik_Bljk_F8B8NF8NS_BH_Bias_HAS_SAV_UserArgs_MT128x128x128_MI16x16x1_SN_LDSB1_CLR1_GRVWA16_GRVWB16_GSU0_GSUC0_GSUWGMRR0_K1_LBSPPA1024_LBSPPB256_LPA16_LPB16_LRVW8_MIWT8_2_PLR1_SU0_SUM0_SUS128_VWA8_VWB2_WGM1_WGMXCC1_WGMXCCGn1
    SolutionIndex: 46
    SolutionNameMin: Cijk_Alik_Bljk_F8B8NF8NS_BH_Bias_HAS_SAV_UserArgs_MT128x128x128_MI16x16x1_SN_LDSB1_CLR1_GRVWA8_GRVWB16_GSU0_GSUC0_GSUWGMRR0_K1_LBSPPA1024_LBSPPB256_LPA8_LPB16_LRVW8_MIWT8_2_PLR1_SU0_SUM0_SUS128_VWA8_VWB2_WGM4_WGMXCC1_WGMXCCGn1
    SolutionIndex: 47
    SolutionNameMin: Cijk_Alik_Bljk_F8B8NF8NS_BH_Bias_HAS_SAV_UserArgs_MT128x128x128_MI16x16x1_SN_LDSB1_CLR1_GRVWA8_GRVWB16_GSU0_GSUC0_GSUWGMRR0_K1_LBSPPA1024_LBSPPB256_LPA8_LPB16_LRVW8_MIWT8_2_PLR1_SU0_SUM0_SUS128_VWA8_VWB2_WGM6_WGMXCC1_WGMXCCGn1
    SolutionIndex: 48
    SolutionNameMin: Cijk_Alik_Bljk_F8B8NF8NS_BH_Bias_HAS_SAV_UserArgs_MT128x128x128_MI16x16x1_SN_LDSB1_CLR1_GRVWA8_GRVWB16_GSU0_GSUC0_GSUWGMRR0_K1_LBSPPA1024_LBSPPB256_LPA8_LPB16_LRVW8_MIWT8_2_PLR1_SU0_SUM0_SUS128_VWA8_VWB2_WGM8_WGMXCC1_WGMXCCGn1
    SolutionIndex: 49
    SolutionNameMin: Cijk_Alik_Bljk_F8B8NF8NS_BH_Bias_HAS_SAV_UserArgs_MT128x144x128_MI16x16x1_SN_LDSB1_CLR1_GRVWA8_GRVWB8_GSU0_GSUC0_GSUWGMRR0_K1_LBSPPA256_LBSPPB128_LPA8_LPB8_LRVW8_MIWT2_9_PLR1_SU0_SUM0_SUS128_VWA2_VWB1_WGM1_WGMXCC1_WGMXCCGn1
    SolutionIndex: 50
    SolutionNameMin: Cijk_Alik_Bljk_F8B8NF8NS_BH_Bias_HAS_SAV_UserArgs_MT128x144x128_MI16x16x1_SN_LDSB1_CLR1_GRVWA16_GRVWB8_GSU0_GSUC0_GSUWGMRR0_K1_LBSPPA256_LBSPPB128_LPA16_LPB8_LRVW8_MIWT2_9_PLR1_SU0_SUM0_SUS128_VWA2_VWB1_WGM1_WGMXCC1_WGMXCCGn1
    SolutionIndex: 51
    SolutionNameMin: Cijk_Alik_Bljk_F8B8NF8NS_BH_Bias_HAS_SAV_UserArgs_MT128x144x128_MI16x16x1_SN_LDSB1_CLR1_GRVWA16_GRVWB8_GSU0_GSUC0_GSUWGMRR0_K1_LBSPPA256_LBSPPB128_LPA16_LPB8_LRVW8_MIWT2_9_PLR1_SU0_SUM0_SUS128_VWA2_VWB1_WGM4_WGMXCC1_WGMXCCGn1
    SolutionIndex: 52
    SolutionNameMin: Cijk_Alik_Bljk_F8B8NF8NS_BH_Bias_HAS_SAV_UserArgs_MT128x144x128_MI16x16x1_SN_LDSB1_CLR1_GRVWA16_GRVWB8_GSU0_GSUC0_GSUWGMRR0_K1_LBSPPA256_LBSPPB128_LPA16_LPB8_LRVW8_MIWT2_9_PLR1_SU0_SUM0_SUS128_VWA2_VWB1_WGM6_WGMXCC1_WGMXCCGn1
    SolutionIndex: 53
    SolutionNameMin: Cijk_Alik_Bljk_F8B8NF8NS_BH_Bias_HAS_SAV_UserArgs_MT144x128x128_MI16x16x1_SN_LDSB1_CLR1_GRVWA8_GRVWB16_GSU0_GSUC0_GSUWGMRR0_K1_LBSPPA128_LBSPPB256_LPA8_LPB16_LRVW8_MIWT9_2_PLR1_SU0_SUM0_SUS128_VWA1_VWB2_WGM6_WGMXCC1_WGMXCCGn1
    SolutionIndex: 54
    SolutionNameMin: Cijk_Alik_Bljk_F8B8NF8NS_BH_Bias_HAS_SAV_UserArgs_MT144x128x128_MI16x16x1_SN_LDSB1_CLR1_GRVWA8_GRVWB16_GSU0_GSUC0_GSUWGMRR0_K1_LBSPPA128_LBSPPB256_LPA8_LPB16_LRVW8_MIWT9_2_PLR1_SU0_SUM0_SUS128_VWA1_VWB2_WGM8_WGMXCC1_WGMXCCGn1
    SolutionIndex: 55
    SolutionNameMin: Cijk_Alik_Bljk_F8B8NF8NS_BH_Bias_HAS_SAV_UserArgs_MT128x128x128_MI16x16x1_SN_LDSB1_CLR1_GRVWA8_GRVWB16_GSU0_GSUC0_GSUWGMRR0_K1_LBSPPA512_LBSPPB512_LPA8_LPB16_LRVW8_MIWT4_4_PLR1_SU0_SUM0_SUS128_VWA4_VWB4_WGM1_WGMXCC1_WGMXCCGn1
    SolutionIndex: 56
    SolutionNameMin: Cijk_Alik_Bljk_F8B8NF8NS_BH_Bias_HAS_SAV_UserArgs_MT128x128x128_MI16x16x1_SN_LDSB1_CLR1_GRVWA16_GRVWB16_GSU0_GSUC0_GSUWGMRR0_K1_LBSPPA512_LBSPPB512_LPA16_LPB16_LRVW8_MIWT4_4_PLR1_SU0_SUM0_SUS128_VWA4_VWB4_WGM1_WGMXCC1_WGMXCCGn1
    SolutionIndex: 57
    SolutionNameMin: Cijk_Alik_Bljk_F8B8NF8NS_BH_Bias_HAS_SAV_UserArgs_MT128x128x128_MI16x16x1_SN_LDSB1_CLR1_GRVWA8_GRVWB16_GSU0_GSUC0_GSUWGMRR0_K1_LBSPPA512_LBSPPB512_LPA8_LPB16_LRVW8_MIWT4_4_PLR1_SU0_SUM0_SUS128_VWA4_VWB4_WGM4_WGMXCC1_WGMXCCGn1
    SolutionIndex: 58
    SolutionNameMin: Cijk_Alik_Bljk_F8B8NF8NS_BH_Bias_HAS_SAV_UserArgs_MT128x128x128_MI16x16x1_SN_LDSB1_CLR1_GRVWA8_GRVWB16_GSU0_GSUC0_GSUWGMRR0_K1_LBSPPA512_LBSPPB512_LPA8_LPB16_LRVW8_MIWT4_4_PLR1_SU0_SUM0_SUS128_VWA4_VWB4_WGM6_WGMXCC1_WGMXCCGn1
    SolutionIndex: 59
    SolutionNameMin: Cijk_Alik_Bljk_F8B8NF8NS_BH_Bias_HAS_SAV_UserArgs_MT128x128x128_MI16x16x1_SN_LDSB1_CLR1_GRVWA16_GRVWB16_GSU0_GSUC0_GSUWGMRR0_K1_LBSPPA512_LBSPPB512_LPA16_LPB16_LRVW8_MIWT4_4_PLR1_SU0_SUM0_SUS128_VWA4_VWB4_WGM6_WGMXCC1_WGMXCCGn1
    SolutionIndex: 60
    SolutionNameMin: Cijk_Alik_Bljk_F8B8NF8NS_BH_Bias_HAS_SAV_UserArgs_MT128x128x128_MI16x16x1_SN_LDSB1_CLR1_GRVWA8_GRVWB16_GSU0_GSUC0_GSUWGMRR0_K1_LBSPPA512_LBSPPB512_LPA8_LPB16_LRVW8_MIWT4_4_PLR1_SU0_SUM0_SUS128_VWA4_VWB4_WGM8_WGMXCC1_WGMXCCGn1
    SolutionIndex: 61
    SolutionNameMin: Cijk_Alik_Bljk_F8B8NF8NS_BH_Bias_HAS_SAV_UserArgs_MT64x128x128_MI16x16x1_SN_LDSB1_CLR1_GRVWA8_GRVWB16_GSU0_GSUC0_GSUWGMRR0_K1_LBSPPA256_LBSPPB512_LPA8_LPB16_LRVW8_MIWT2_4_PLR1_SU0_SUM0_SUS128_VWA2_VWB4_WGM1_WGMXCC1_WGMXCCGn1
    SolutionIndex: 62
    SolutionNameMin: Cijk_Alik_Bljk_F8B8NF8NS_BH_Bias_HAS_SAV_UserArgs_MT64x128x128_MI16x16x1_SN_LDSB1_CLR1_GRVWA8_GRVWB16_GSU0_GSUC0_GSUWGMRR0_K1_LBSPPA256_LBSPPB512_LPA8_LPB16_LRVW8_MIWT2_4_PLR1_SU0_SUM0_SUS128_VWA2_VWB4_WGM4_WGMXCC1_WGMXCCGn1
    SolutionIndex: 63
    SolutionNameMin: Cijk_Alik_Bljk_F8B8NF8NS_BH_Bias_HAS_SAV_UserArgs_MT128x64x128_MI16x16x1_SN_LDSB1_CLR1_GRVWA8_GRVWB8_GSU0_GSUC0_GSUWGMRR0_K1_LBSPPA512_LBSPPB256_LPA8_LPB8_LRVW8_MIWT4_2_PLR1_SU0_SUM0_SUS128_VWA4_VWB2_WGM1_WGMXCC1_WGMXCCGn1
    SolutionIndex: 64
    SolutionNameMin: Cijk_Alik_Bljk_F8B8NF8NS_BH_Bias_HAS_SAV_UserArgs_MT128x64x128_MI16x16x1_SN_LDSB1_CLR1_GRVWA16_GRVWB8_GSU0_GSUC0_GSUWGMRR0_K1_LBSPPA512_LBSPPB256_LPA16_LPB8_LRVW8_MIWT4_2_PLR1_SU0_SUM0_SUS128_VWA4_VWB2_WGM1_WGMXCC1_WGMXCCGn1
    SolutionIndex: 65
    SolutionNameMin: Cijk_Alik_Bljk_F8B8NF8NS_BH_Bias_HAS_SAV_UserArgs_MT64x64x128_MI16x16x1_SN_LDSB1_CLR1_GRVWA8_GRVWB8_GSU0_GSUC0_GSUWGMRR0_K1_LBSPPA256_LBSPPB256_LPA8_LPB8_LRVW8_MIWT2_2_PLR1_SU0_SUM0_SUS128_VWA2_VWB2_WGM1_WGMXCC1_WGMXCCGn1
    SolutionIndex: 66
    SolutionNameMin: Cijk_Alik_Bljk_F8B8NF8NS_BH_Bias_HAS_SAV_UserArgs_MT64x64x128_MI16x16x1_SN_LDSB1_CLR1_GRVWA16_GRVWB8_GSU0_GSUC0_GSUWGMRR0_K1_LBSPPA256_LBSPPB256_LPA16_LPB8_LRVW8_MIWT2_2_PLR1_SU0_SUM0_SUS128_VWA2_VWB2_WGM1_WGMXCC1_WGMXCCGn1
    SolutionIndex: 67
    SolutionNameMin: Cijk_Alik_Bljk_F8B8NF8NS_BH_Bias_HAS_SAV_UserArgs_MT64x64x128_MI16x16x1_SN_LDSB1_CLR1_GRVWA8_GRVWB16_GSU0_GSUC0_GSUWGMRR0_K1_LBSPPA256_LBSPPB256_LPA8_LPB16_LRVW8_MIWT2_2_PLR1_SU0_SUM0_SUS128_VWA2_VWB2_WGM1_WGMXCC1_WGMXCCGn1
    SolutionIndex: 68
    SolutionNameMin: Cijk_Alik_Bljk_F8B8NF8NS_BH_Bias_HAS_SAV_UserArgs_MT64x64x128_MI16x16x1_SN_LDSB1_CLR1_GRVWA8_GRVWB16_GSU0_GSUC0_GSUWGMRR0_K1_LBSPPA256_LBSPPB256_LPA8_LPB16_LRVW8_MIWT2_2_PLR1_SU0_SUM0_SUS128_VWA2_VWB2_WGM4_WGMXCC1_WGMXCCGn1
    SolutionIndex: 69
    SolutionNameMin: Cijk_Alik_Bljk_F8B8NF8NS_BH_Bias_HAS_SAV_UserArgs_MT64x64x128_MI16x16x1_SN_LDSB1_CLR1_GRVWA8_GRVWB16_GSU0_GSUC0_GSUWGMRR0_K1_LBSPPA256_LBSPPB256_LPA8_LPB16_LRVW8_MIWT2_2_PLR1_SU0_SUM0_SUS128_VWA2_VWB2_WGM8_WGMXCC1_WGMXCCGn1
    SolutionIndex: 70
    SolutionNameMin: Cijk_Alik_Bljk_F8B8NF8NS_BH_Bias_HAS_SAV_UserArgs_MT32x64x128_MI16x16x1_SN_LDSB0_CLR1_GRVWA8_GRVWB8_GSU0_GSUC0_GSUWGMRR0_K1_LBSPPA128_LBSPPB256_LPA8_LPB8_LRVW8_MIWT1_2_PLR1_SU0_SUM0_SUS128_VWA1_VWB2_WGM1_WGMXCC1_WGMXCCGn1
    SolutionIndex: 71
    SolutionNameMin: Cijk_Alik_Bljk_F8B8NF8NS_BH_Bias_HAS_SAV_UserArgs_MT32x64x128_MI16x16x1_SN_LDSB0_CLR1_GRVWA16_GRVWB8_GSU0_GSUC0_GSUWGMRR0_K1_LBSPPA128_LBSPPB256_LPA16_LPB8_LRVW8_MIWT1_2_PLR1_SU0_SUM0_SUS128_VWA1_VWB2_WGM1_WGMXCC1_WGMXCCGn1
    SolutionIndex: 72
    SolutionNameMin: Cijk_Alik_Bljk_F8B8NF8NS_BH_Bias_HAS_SAV_UserArgs_MT32x64x128_MI16x16x1_SN_LDSB0_CLR1_GRVWA16_GRVWB16_GSU0_GSUC0_GSUWGMRR0_K1_LBSPPA128_LBSPPB256_LPA16_LPB16_LRVW8_MIWT1_2_PLR1_SU0_SUM0_SUS128_VWA1_VWB2_WGM1_WGMXCC1_WGMXCCGn1
    SolutionIndex: 73
    SolutionNameMin: Cijk_Alik_Bljk_F8B8NF8NS_BH_Bias_HAS_SAV_UserArgs_MT32x64x128_MI16x16x1_SN_LDSB0_CLR1_GRVWA8_GRVWB8_GSU0_GSUC0_GSUWGMRR0_K1_LBSPPA128_LBSPPB256_LPA8_LPB8_LRVW8_MIWT1_2_PLR1_SU0_SUM0_SUS128_VWA1_VWB2_WGM4_WGMXCC1_WGMXCCGn1
    SolutionIndex: 74
    SolutionNameMin: Cijk_Alik_Bljk_F8B8NF8NS_BH_Bias_HAS_SAV_UserArgs_MT32x64x128_MI16x16x1_SN_LDSB0_CLR1_GRVWA8_GRVWB8_GSU0_GSUC0_GSUWGMRR0_K1_LBSPPA128_LBSPPB256_LPA8_LPB8_LRVW8_MIWT1_2_PLR1_SU0_SUM0_SUS128_VWA1_VWB2_WGM8_WGMXCC1_WGMXCCGn1
    SolutionIndex: 75
    SolutionNameMin: Cijk_Alik_Bljk_F8B8NF8NS_BH_Bias_HAS_SAV_UserArgs_MT64x32x128_MI16x16x1_SN_LDSB0_CLR1_GRVWA8_GRVWB8_GSU0_GSUC0_GSUWGMRR0_K1_LBSPPA256_LBSPPB128_LPA8_LPB8_LRVW8_MIWT2_1_PLR1_SU0_SUM0_SUS128_VWA2_VWB1_WGM1_WGMXCC1_WGMXCCGn1
    SolutionIndex: 76
    SolutionNameMin: Cijk_Alik_Bljk_F8B8NF8NS_BH_Bias_HAS_SAV_UserArgs_MT64x32x128_MI16x16x1_SN_LDSB0_CLR1_GRVWA16_GRVWB8_GSU0_GSUC0_GSUWGMRR0_K1_LBSPPA256_LBSPPB128_LPA16_LPB8_LRVW8_MIWT2_1_PLR1_SU0_SUM0_SUS128_VWA2_VWB1_WGM1_WGMXCC1_WGMXCCGn1
    SolutionIndex: 77
    SolutionNameMin: Cijk_Alik_Bljk_F8B8NF8NS_BH_Bias_HAS_SAV_UserArgs_MT64x32x128_MI16x16x1_SN_LDSB0_CLR1_GRVWA8_GRVWB16_GSU0_GSUC0_GSUWGMRR0_K1_LBSPPA256_LBSPPB128_LPA8_LPB16_LRVW8_MIWT2_1_PLR1_SU0_SUM0_SUS128_VWA2_VWB1_WGM1_WGMXCC1_WGMXCCGn1
    SolutionIndex: 78
    SolutionNameMin: Cijk_Alik_Bljk_F8B8NF8NS_BH_Bias_HAS_SAV_UserArgs_MT64x32x128_MI16x16x1_SN_LDSB0_CLR1_GRVWA16_GRVWB16_GSU0_GSUC0_GSUWGMRR0_K1_LBSPPA256_LBSPPB128_LPA16_LPB16_LRVW8_MIWT2_1_PLR1_SU0_SUM0_SUS128_VWA2_VWB1_WGM1_WGMXCC1_WGMXCCGn1
    SolutionIndex: 79
    SolutionNameMin: Cijk_Alik_Bljk_F8B8NF8NS_BH_Bias_HAS_SAV_UserArgs_MT64x32x128_MI16x16x1_SN_LDSB0_CLR1_GRVWA16_GRVWB16_GSU0_GSUC0_GSUWGMRR0_K1_LBSPPA256_LBSPPB128_LPA16_LPB16_LRVW8_MIWT2_1_PLR1_SU0_SUM0_SUS128_VWA2_VWB1_WGM8_WGMXCC1_WGMXCCGn1
    SolutionIndex: 80
    SolutionNameMin: Cijk_Alik_Bljk_F8B8NF8NS_BH_Bias_HAS_SAV_UserArgs_MT32x32x128_MI16x16x1_SN_LDSB0_CLR1_GRVWA8_GRVWB8_GSU0_GSUC0_GSUWGMRR0_K1_LBSPPA128_LBSPPB128_LPA8_LPB8_LRVW8_MIWT1_1_PLR1_SU0_SUM0_SUS128_VWA1_VWB1_WGM1_WGMXCC1_WGMXCCGn1
    SolutionIndex: 81
    SolutionNameMin: Cijk_Alik_Bljk_F8B8NF8NS_BH_Bias_HAS_SAV_UserArgs_MT32x32x128_MI16x16x1_SN_LDSB0_CLR1_GRVWA16_GRVWB8_GSU0_GSUC0_GSUWGMRR0_K1_LBSPPA128_LBSPPB128_LPA16_LPB8_LRVW8_MIWT1_1_PLR1_SU0_SUM0_SUS128_VWA1_VWB1_WGM1_WGMXCC1_WGMXCCGn1
    SolutionIndex: 82
    SolutionNameMin: Cijk_Alik_Bljk_F8B8NF8NS_BH_Bias_HAS_SAV_UserArgs_MT32x32x128_MI16x16x1_SN_LDSB0_CLR1_GRVWA8_GRVWB16_GSU0_GSUC0_GSUWGMRR0_K1_LBSPPA128_LBSPPB128_LPA8_LPB16_LRVW8_MIWT1_1_PLR1_SU0_SUM0_SUS128_VWA1_VWB1_WGM1_WGMXCC1_WGMXCCGn1
    SolutionIndex: 83
    SolutionNameMin: Cijk_Alik_Bljk_F8B8NF8NS_BH_Bias_HAS_SAV_UserArgs_MT32x32x128_MI16x16x1_SN_LDSB0_CLR1_GRVWA16_GRVWB16_GSU0_GSUC0_GSUWGMRR0_K1_LBSPPA128_LBSPPB128_LPA16_LPB16_LRVW8_MIWT1_1_PLR1_SU0_SUM0_SUS128_VWA1_VWB1_WGM1_WGMXCC1_WGMXCCGn1
    SolutionIndex: 84
    SolutionNameMin: Cijk_Alik_Bljk_F8B8NF8NS_BH_Bias_HAS_SAV_UserArgs_MT32x32x128_MI16x16x1_SN_LDSB0_CLR1_GRVWA8_GRVWB8_GSU0_GSUC0_GSUWGMRR0_K1_LBSPPA128_LBSPPB128_LPA8_LPB8_LRVW8_MIWT1_1_PLR1_SU0_SUM0_SUS128_VWA1_VWB1_WGM4_WGMXCC1_WGMXCCGn1
    SolutionIndex: 85
    SolutionNameMin: Cijk_Alik_Bljk_F8B8NF8NS_BH_Bias_HAS_SAV_UserArgs_MT32x32x128_MI16x16x1_SN_LDSB0_CLR1_GRVWA8_GRVWB8_GSU0_GSUC0_GSUWGMRR0_K1_LBSPPA128_LBSPPB128_LPA8_LPB8_LRVW8_MIWT1_1_PLR1_SU0_SUM0_SUS128_VWA1_VWB1_WGM8_WGMXCC1_WGMXCCGn1
    SolutionIndex: 86
    SolutionNameMin: Cijk_Alik_Bljk_F8B8NF8NS_BH_Bias_HAS_SAV_UserArgs_MT32x32x128_MI16x16x1_SN_LDSB0_CLR1_GRVWA16_GRVWB16_GSU0_GSUC0_GSUWGMRR0_K1_LBSPPA128_LBSPPB128_LPA16_LPB16_LRVW8_MIWT1_1_PLR1_SU0_SUM0_SUS128_VWA1_VWB1_WGM8_WGMXCC1_WGMXCCGn1
    SolutionIndex: 87
    SolutionNameMin: Cijk_Alik_Bljk_F8B8NF8NS_BH_Bias_HAS_SAV_UserArgs_MT128x64x256_MI16x16x1_SN_LDSB1_CLR1_GRVWA8_GRVWB16_GSU0_GSUC0_GSUWGMRR0_K1_LBSPPA1024_LBSPPB512_LPA8_LPB16_LRVW8_MIWT4_2_PLR1_SU0_SUM0_SUS256_VWA4_VWB2_WGM1_WGMXCC1_WGMXCCGn1
    SolutionIndex: 88
    SolutionNameMin: Cijk_Alik_Bljk_F8B8NF8NS_BH_Bias_HAS_SAV_UserArgs_MT128x64x256_MI16x16x1_SN_LDSB1_CLR1_GRVWA8_GRVWB16_GSU0_GSUC0_GSUWGMRR0_K1_LBSPPA1024_LBSPPB512_LPA8_LPB16_LRVW8_MIWT4_2_PLR1_SU0_SUM0_SUS256_VWA4_VWB2_WGM4_WGMXCC1_WGMXCCGn1
    SolutionIndex: 89
    SolutionNameMin: Cijk_Alik_Bljk_F8B8NF8NS_BH_Bias_HAS_SAV_UserArgs_MT128x64x256_MI16x16x1_SN_LDSB1_CLR1_GRVWA8_GRVWB16_GSU0_GSUC0_GSUWGMRR0_K1_LBSPPA1024_LBSPPB512_LPA8_LPB16_LRVW8_MIWT4_2_PLR1_SU0_SUM0_SUS256_VWA4_VWB2_WGM6_WGMXCC1_WGMXCCGn1
    SolutionIndex: 90
    SolutionNameMin: Cijk_Alik_Bljk_F8B8NF8NS_BH_Bias_HAS_SAV_UserArgs_MT128x64x256_MI16x16x1_SN_LDSB1_CLR1_GRVWA8_GRVWB8_GSU0_GSUC0_GSUWGMRR0_K1_LBSPPA1024_LBSPPB512_LPA8_LPB8_LRVW8_MIWT4_2_PLR1_SU0_SUM0_SUS256_VWA4_VWB2_WGM8_WGMXCC1_WGMXCCGn1
    SolutionIndex: 91
    SolutionNameMin: Cijk_Alik_Bljk_F8B8NF8NS_BH_Bias_HAS_SAV_UserArgs_MT128x64x256_MI16x16x1_SN_LDSB1_CLR1_GRVWA8_GRVWB16_GSU0_GSUC0_GSUWGMRR0_K1_LBSPPA1024_LBSPPB512_LPA8_LPB16_LRVW8_MIWT4_2_PLR1_SU0_SUM0_SUS256_VWA4_VWB2_WGM8_WGMXCC1_WGMXCCGn1
    SolutionIndex: 92
    SolutionNameMin: Cijk_Alik_Bljk_F8B8NF8NS_BH_Bias_HAS_SAV_UserArgs_MT64x64x256_MI16x16x1_SN_LDSB1_CLR1_GRVWA8_GRVWB16_GSU0_GSUC0_GSUWGMRR0_K1_LBSPPA512_LBSPPB512_LPA8_LPB16_LRVW8_MIWT2_2_PLR1_SU0_SUM0_SUS256_VWA2_VWB2_WGM1_WGMXCC1_WGMXCCGn1
    SolutionIndex: 93
    SolutionNameMin: Cijk_Alik_Bljk_F8B8NF8NS_BH_Bias_HAS_SAV_UserArgs_MT64x64x256_MI16x16x1_SN_LDSB1_CLR1_GRVWA8_GRVWB16_GSU0_GSUC0_GSUWGMRR0_K1_LBSPPA512_LBSPPB512_LPA8_LPB16_LRVW8_MIWT2_2_PLR1_SU0_SUM0_SUS256_VWA2_VWB2_WGM6_WGMXCC1_WGMXCCGn1
    SolutionIndex: 94
    SolutionNameMin: Cijk_Alik_Bljk_F8B8NF8NS_BH_Bias_HAS_SAV_UserArgs_MT32x32x256_MI16x16x1_SN_LDSB1_CLR1_GRVWA16_GRVWB8_GSU0_GSUC0_GSUWGMRR0_K1_LBSPPA256_LBSPPB256_LPA16_LPB8_LRVW8_MIWT1_1_PLR1_SU0_SUM0_SUS256_VWA1_VWB1_WGM1_WGMXCC1_WGMXCCGn1
    SolutionIndex: 95
    SolutionNameMin: Cijk_Alik_Bljk_F8B8NF8NS_BH_Bias_HAS_SAV_UserArgs_MT32x32x256_MI16x16x1_SN_LDSB1_CLR1_GRVWA8_GRVWB16_GSU0_GSUC0_GSUWGMRR0_K1_LBSPPA256_LBSPPB256_LPA8_LPB16_LRVW8_MIWT1_1_PLR1_SU0_SUM0_SUS256_VWA1_VWB1_WGM1_WGMXCC1_WGMXCCGn1
    SolutionIndex: 96
    SolutionNameMin: Cijk_Alik_Bljk_F8B8NF8NS_BH_Bias_HAS_SAV_UserArgs_MT32x32x256_MI16x16x1_SN_LDSB1_CLR1_GRVWA8_GRVWB16_GSU0_GSUC0_GSUWGMRR0_K1_LBSPPA256_LBSPPB256_LPA8_LPB16_LRVW8_MIWT1_1_PLR1_SU0_SUM0_SUS256_VWA1_VWB1_WGM4_WGMXCC1_WGMXCCGn1
    SolutionIndex: 97
    SolutionNameMin: Cijk_Alik_Bljk_F8B8NF8NS_BH_Bias_HAS_SAV_UserArgs_MT32x64x32_MI16x16x1_SN_LDSB0_CLR0_GRVWA4_GRVWB8_GSU0_GSUC0_GSUWGMRR0_K1_LBSPPA128_LBSPPB128_LPA8_LPB8_LRVW8_MIWT1_2_PLR0_SU32_SUM0_SUS256_VWA1_VWB2_WGM8_WGMXCC1_WGMXCCGn1
- - - [128, 128, 1, 128, 128, 128, 128, 128]
    - [83, 0.62]
  - - [128, 128, 1, 256, 128, 128, 256, 256]
    - [83, 1.16]
  - - [128, 128, 1, 512, 128, 128, 512, 512]
    - [80, 2.04]
  - - [128, 128, 1, 1024, 128, 128, 1024, 1024]
    - [82, 3.44]
  - - [128, 128, 1, 2048, 128, 128, 2048, 2048]
    - [80, 5.21]
  - - [128, 128, 1, 4096, 128, 128, 4096, 4096]
    - [80, 7.07]
  - - [128, 128, 1, 8192, 128, 128, 8192, 8192]
    - [80, 8.62]
  - - [128, 256, 1, 128, 128, 128, 128, 128]
    - [25, 1.16]
  - - [128, 256, 1, 256, 128, 128, 256, 256]
    - [81, 2.21]
  - - [128, 256, 1, 512, 128, 128, 512, 512]
    - [83, 4.08]
  - - [128, 256, 1, 1024, 128, 128, 1024, 1024]
    - [80, 6.96]
  - - [128, 256, 1, 2048, 128, 128, 2048, 2048]
    - [80, 10.47]
  - - [128, 256, 1, 4096, 128, 128, 4096, 4096]
    - [80, 14.17]
  - - [128, 256, 1, 8192, 128, 128, 8192, 8192]
    - [80, 17.35]
  - - [128, 512, 1, 128, 128, 128, 128, 128]
    - [82, 2.35]
  - - [128, 512, 1, 256, 128, 128, 256, 256]
    - [80, 4.46]
  - - [128, 512, 1, 512, 128, 128, 512, 512]
    - [83, 8.08]
  - - [128, 512, 1, 1024, 128, 128, 1024, 1024]
    - [80, 13.61]
  - - [128, 512, 1, 2048, 128, 128, 2048, 2048]
    - [80, 20.86]
  - - [128, 512, 1, 4096, 128, 128, 4096, 4096]
    - [80, 28.22]
  - - [128, 512, 1, 8192, 128, 128, 8192, 8192]
    - [80, 34.23]
  - - [128, 1024, 1, 128, 128, 128, 128, 128]
    - [24, 4.76]
  - - [128, 1024, 1, 256, 128, 128, 256, 256]
    - [24, 8.81]
  - - [128, 1024, 1, 512, 128, 128, 512, 512]
    - [82, 15.94]
  - - [128, 1024, 1, 1024, 128, 128, 1024, 1024]
    - [80, 26.85]
  - - [128, 1024, 1, 2048, 128, 128, 2048, 2048]
    - [80, 40.98]
  - - [128, 1024, 1, 4096, 128, 128, 4096, 4096]
    - [80, 55.78]
  - - [128, 1024, 1, 8192, 128, 128, 8192, 8192]
    - [80, 67.34]
  - - [128, 2048, 1, 128, 128, 128, 128, 128]
    - [78, 8.86]
  - - [128, 2048, 1, 256, 128, 128, 256, 256]
    - [78, 16.45]
  - - [128, 2048, 1, 512, 128, 128, 512, 512]
    - [78, 28.94]
  - - [128, 2048, 1, 1024, 128, 128, 1024, 1024]
    - [77, 46.76]
  - - [128, 2048, 1, 2048, 128, 128, 2048, 2048]
    - [70, 68.19]
  - - [128, 2048, 1, 4096, 128, 128, 4096, 4096]
    - [70, 88.47]
  - - [128, 2048, 1, 8192, 128, 128, 8192, 8192]
    - [75, 101.68]
  - - [128, 4096, 1, 128, 128, 128, 128, 128]
    - [21, 16.29]
  - - [128, 4096, 1, 256, 128, 128, 256, 256]
    - [19, 29.58]
  - - [128, 4096, 1, 512, 128, 128, 512, 512]
    - [19, 49.55]
  - - [128, 4096, 1, 1024, 128, 128, 1024, 1024]
    - [66, 76.39]
  - - [128, 4096, 1, 2048, 128, 128, 2048, 2048]
    - [67, 105.41]
  - - [128, 4096, 1, 4096, 128, 128, 4096, 4096]
    - [67, 130.51]
  - - [128, 4096, 1, 8192, 128, 128, 8192, 8192]
    - [92, 142.43]
  - - [128, 8192, 1, 128, 128, 128, 128, 128]
    - [13, 27.94]
  - - [128, 8192, 1, 256, 128, 128, 256, 256]
    - [15, 50.33]
  - - [128, 8192, 1, 512, 128, 128, 512, 512]
    - [15, 83.13]
  - - [128, 8192, 1, 1024, 128, 128, 1024, 1024]
    - [15, 124.06]
  - - [128, 8192, 1, 2048, 128, 128, 2048, 2048]
    - [15, 162.18]
  - - [128, 8192, 1, 4096, 128, 128, 4096, 4096]
    - [87, 168.15]
  - - [128, 8192, 1, 8192, 128, 128, 8192, 8192]
    - [92, 188.34]
  - - [256, 128, 1, 128, 256, 256, 128, 128]
    - [81, 1.21]
  - - [256, 128, 1, 256, 256, 256, 256, 256]
    - [24, 2.27]
  - - [256, 128, 1, 512, 256, 256, 512, 512]
    - [82, 4.09]
  - - [256, 128, 1, 1024, 256, 256, 1024, 1024]
    - [80, 6.83]
  - - [256, 128, 1, 2048, 256, 256, 2048, 2048]
    - [80, 10.43]
  - - [256, 128, 1, 4096, 256, 256, 4096, 4096]
    - [80, 14.2]
  - - [256, 128, 1, 8192, 256, 256, 8192, 8192]
    - [80, 17.19]
  - - [256, 256, 1, 128, 256, 256, 128, 128]
    - [83, 2.42]
  - - [256, 256, 1, 256, 256, 256, 256, 256]
    - [83, 4.57]
  - - [256, 256, 1, 512, 256, 256, 512, 512]
    - [80, 8.11]
  - - [256, 256, 1, 1024, 256, 256, 1024, 1024]
    - [80, 13.6]
  - - [256, 256, 1, 2048, 256, 256, 2048, 2048]
    - [95, 20.64]
  - - [256, 256, 1, 4096, 256, 256, 4096, 4096]
    - [80, 28.19]
  - - [256, 256, 1, 8192, 256, 256, 8192, 8192]
    - [80, 34.2]
  - - [256, 512, 1, 128, 256, 256, 128, 128]
    - [83, 4.81]
  - - [256, 512, 1, 256, 256, 256, 256, 256]
    - [83, 8.95]
  - - [256, 512, 1, 512, 256, 256, 512, 512]
    - [82, 16.24]
  - - [256, 512, 1, 1024, 256, 256, 1024, 1024]
    - [80, 26.83]
  - - [256, 512, 1, 2048, 256, 256, 2048, 2048]
    - [80, 41.23]
  - - [256, 512, 1, 4096, 256, 256, 4096, 4096]
    - [80, 55.16]
  - - [256, 512, 1, 8192, 256, 256, 8192, 8192]
    - [80, 66.98]
  - - [256, 1024, 1, 128, 256, 256, 128, 128]
    - [70, 8.45]
  - - [256, 1024, 1, 256, 256, 256, 256, 256]
    - [72, 16.05]
  - - [256, 1024, 1, 512, 256, 256, 512, 512]
    - [76, 28.38]
  - - [256, 1024, 1, 1024, 256, 256, 1024, 1024]
    - [75, 46.59]
  - - [256, 1024, 1, 2048, 256, 256, 2048, 2048]
    - [75, 67.72]
  - - [256, 1024, 1, 4096, 256, 256, 4096, 4096]
    - [70, 88.57]
  - - [256, 1024, 1, 8192, 256, 256, 8192, 8192]
    - [75, 101.72]
  - - [256, 2048, 1, 128, 256, 256, 128, 128]
    - [22, 15.99]
  - - [256, 2048, 1, 256, 256, 256, 256, 256]
    - [21, 29.64]
  - - [256, 2048, 1, 512, 256, 256, 512, 512]
    - [21, 48.96]
  - - [256, 2048, 1, 1024, 256, 256, 1024, 1024]
    - [65, 75.01]
  - - [256, 2048, 1, 2048, 256, 256, 2048, 2048]
    - [67, 104.56]
  - - [256, 2048, 1, 4096, 256, 256, 4096, 4096]
    - [67, 129.51]
  - - [256, 2048, 1, 8192, 256, 256, 8192, 8192]
    - [92, 142.39]
  - - [256, 4096, 1, 128, 256, 256, 128, 128]
    - [13, 27.84]
  - - [256, 4096, 1, 256, 256, 256, 256, 256]
    - [15, 49.73]
  - - [256, 4096, 1, 512, 256, 256, 512, 512]
    - [15, 83.1]
  - - [256, 4096, 1, 1024, 256, 256, 1024, 1024]
    - [16, 122.02]
  - - [256, 4096, 1, 2048, 256, 256, 2048, 2048]
    - [15, 162.53]
  - - [256, 4096, 1, 4096, 256, 256, 4096, 4096]
    - [87, 179.72]
  - - [256, 4096, 1, 8192, 256, 256, 8192, 8192]
    - [61, 192.78]
  - - [256, 8192, 1, 128, 256, 256, 128, 128]
    - [9, 44.3]
  - - [256, 8192, 1, 256, 256, 256, 256, 256]
    - [9, 76.85]
  - - [256, 8192, 1, 512, 256, 256, 512, 512]
    - [9, 126.52]
  - - [256, 8192, 1, 1024, 256, 256, 1024, 1024]
    - [9, 183.12]
  - - [256, 8192, 1, 2048, 256, 256, 2048, 2048]
    - [44, 236.03]
  - - [256, 8192, 1, 4096, 256, 256, 4096, 4096]
    - [64, 226.61]
  - - [256, 8192, 1, 8192, 256, 256, 8192, 8192]
    - [55, 253.05]
  - - [512, 128, 1, 128, 512, 512, 128, 128]
    - [80, 2.48]
  - - [512, 128, 1, 256, 512, 512, 256, 256]
    - [83, 4.64]
  - - [512, 128, 1, 512, 512, 512, 512, 512]
    - [83, 8.24]
  - - [512, 128, 1, 1024, 512, 512, 1024, 1024]
    - [80, 13.86]
  - - [512, 128, 1, 2048, 512, 512, 2048, 2048]
    - [80, 21.13]
  - - [512, 128, 1, 4096, 512, 512, 4096, 4096]
    - [80, 28.21]
  - - [512, 128, 1, 8192, 512, 512, 8192, 8192]
    - [80, 34.61]
  - - [512, 256, 1, 128, 512, 512, 128, 128]
    - [24, 4.82]
  - - [512, 256, 1, 256, 512, 512, 256, 256]
    - [83, 9.16]
  - - [512, 256, 1, 512, 512, 512, 512, 512]
    - [80, 16.38]
  - - [512, 256, 1, 1024, 512, 512, 1024, 1024]
    - [82, 27.51]
  - - [512, 256, 1, 2048, 512, 512, 2048, 2048]
    - [80, 40.2]
  - - [512, 256, 1, 4096, 512, 512, 4096, 4096]
    - [95, 54.44]
  - - [512, 256, 1, 8192, 512, 512, 8192, 8192]
    - [84, 66.44]
  - - [512, 512, 1, 128, 512, 512, 128, 128]
    - [23, 8.61]
  - - [512, 512, 1, 256, 512, 512, 256, 256]
    - [76, 16.14]
  - - [512, 512, 1, 512, 512, 512, 512, 512]
    - [77, 28.27]
  - - [512, 512, 1, 1024, 512, 512, 1024, 1024]
    - [75, 46.43]
  - - [512, 512, 1, 2048, 512, 512, 2048, 2048]
    - [75, 67.22]
  - - [512, 512, 1, 4096, 512, 512, 4096, 4096]
    - [70, 87.88]
  - - [512, 512, 1, 8192, 512, 512, 8192, 8192]
    - [96, 96.68]
  - - [512, 1024, 1, 128, 512, 512, 128, 128]
    - [22, 15.76]
  - - [512, 1024, 1, 256, 512, 512, 256, 256]
    - [21, 28.95]
  - - [512, 1024, 1, 512, 512, 512, 512, 512]
    - [19, 48.88]
  - - [512, 1024, 1, 1024, 512, 512, 1024, 1024]
    - [67, 75.41]
  - - [512, 1024, 1, 2048, 512, 512, 2048, 2048]
    - [67, 104.5]
  - - [512, 1024, 1, 4096, 512, 512, 4096, 4096]
    - [67, 128.81]
  - - [512, 1024, 1, 8192, 512, 512, 8192, 8192]
    - [92, 141.6]
  - - [512, 2048, 1, 128, 512, 512, 128, 128]
    - [13, 27.39]
  - - [512, 2048, 1, 256, 512, 512, 256, 256]
    - [15, 49.38]
  - - [512, 2048, 1, 512, 512, 512, 512, 512]
    - [15, 81.25]
  - - [512, 2048, 1, 1024, 512, 512, 1024, 1024]
    - [16, 121.2]
  - - [512, 2048, 1, 2048, 512, 512, 2048, 2048]
    - [15, 161.36]
  - - [512, 2048, 1, 4096, 512, 512, 4096, 4096]
    - [15, 193.37]
  - - [512, 2048, 1, 8192, 512, 512, 8192, 8192]
    - [89, 193.74]
  - - [512, 4096, 1, 128, 512, 512, 128, 128]
    - [44, 43.34]
  - - [512, 4096, 1, 256, 512, 512, 256, 256]
    - [9, 77.99]
  - - [512, 4096, 1, 512, 512, 512, 512, 512]
    - [9, 125.48]
  - - [512, 4096, 1, 1024, 512, 512, 1024, 1024]
    - [44, 182.66]
  - - [512, 4096, 1, 2048, 512, 512, 2048, 2048]
    - [44, 236.88]
  - - [512, 4096, 1, 4096, 512, 512, 4096, 4096]
    - [56, 234.43]
  - - [512, 4096, 1, 8192, 512, 512, 8192, 8192]
    - [44, 254.56]
  - - [512, 8192, 1, 128, 512, 512, 128, 128]
    - [49, 64.67]
  - - [512, 8192, 1, 256, 512, 512, 256, 256]
    - [50, 116.54]
  - - [512, 8192, 1, 512, 512, 512, 512, 512]
    - [50, 189.35]
  - - [512, 8192, 1, 1024, 512, 512, 1024, 1024]
    - [50, 271.46]
  - - [512, 8192, 1, 2048, 512, 512, 2048, 2048]
    - [36, 256.19]
  - - [512, 8192, 1, 4096, 512, 512, 4096, 4096]
    - [51, 287.77]
  - - [512, 8192, 1, 8192, 512, 512, 8192, 8192]
    - [52, 289.29]
  - - [1024, 128, 1, 128, 1024, 1024, 128, 128]
    - [86, 4.36]
  - - [1024, 128, 1, 256, 1024, 1024, 256, 256]
    - [86, 8.43]
  - - [1024, 128, 1, 512, 1024, 1024, 512, 512]
    - [83, 15.9]
  - - [1024, 128, 1, 1024, 1024, 1024, 1024, 1024]
    - [81, 26.35]
  - - [1024, 128, 1, 2048, 1024, 1024, 2048, 2048]
    - [94, 40.08]
  - - [1024, 128, 1, 4096, 1024, 1024, 4096, 4096]
    - [80, 54.73]
  - - [1024, 128, 1, 8192, 1024, 1024, 8192, 8192]
    - [85, 66.7]
  - - [1024, 256, 1, 128, 1024, 1024, 128, 128]
    - [79, 8.46]
  - - [1024, 256, 1, 256, 1024, 1024, 256, 256]
    - [75, 16.11]
  - - [1024, 256, 1, 512, 1024, 1024, 512, 512]
    - [77, 28.62]
  - - [1024, 256, 1, 1024, 1024, 1024, 1024, 1024]
    - [71, 45.78]
  - - [1024, 256, 1, 2048, 1024, 1024, 2048, 2048]
    - [75, 67.89]
  - - [1024, 256, 1, 4096, 1024, 1024, 4096, 4096]
    - [74, 87.47]
  - - [1024, 256, 1, 8192, 1024, 1024, 8192, 8192]
    - [74, 102.99]
  - - [1024, 512, 1, 128, 1024, 1024, 128, 128]
    - [22, 15.81]
  - - [1024, 512, 1, 256, 1024, 1024, 256, 256]
    - [20, 28.52]
  - - [1024, 512, 1, 512, 1024, 1024, 512, 512]
    - [67, 48.45]
  - - [1024, 512, 1, 1024, 1024, 1024, 1024, 1024]
    - [67, 75.39]
  - - [1024, 512, 1, 2048, 1024, 1024, 2048, 2048]
    - [67, 104.75]
  - - [1024, 512, 1, 4096, 1024, 1024, 4096, 4096]
    - [69, 128.45]
  - - [1024, 512, 1, 8192, 1024, 1024, 8192, 8192]
    - [92, 141.32]
  - - [1024, 1024, 1, 128, 1024, 1024, 128, 128]
    - [63, 27.29]
  - - [1024, 1024, 1, 256, 1024, 1024, 256, 256]
    - [13, 48.88]
  - - [1024, 1024, 1, 512, 1024, 1024, 512, 512]
    - [15, 82.27]
  - - [1024, 1024, 1, 1024, 1024, 1024, 1024, 1024]
    - [15, 121.89]
  - - [1024, 1024, 1, 2048, 1024, 1024, 2048, 2048]
    - [15, 160.92]
  - - [1024, 1024, 1, 4096, 1024, 1024, 4096, 4096]
    - [91, 175.74]
  - - [1024, 1024, 1, 8192, 1024, 1024, 8192, 8192]
    - [88, 194.04]
  - - [1024, 2048, 1, 128, 1024, 1024, 128, 128]
    - [9, 43.6]
  - - [1024, 2048, 1, 256, 1024, 1024, 256, 256]
    - [9, 76.96]
  - - [1024, 2048, 1, 512, 1024, 1024, 512, 512]
    - [9, 126.24]
  - - [1024, 2048, 1, 1024, 1024, 1024, 1024, 1024]
    - [9, 181.67]
  - - [1024, 2048, 1, 2048, 1024, 1024, 2048, 2048]
    - [44, 236.18]
  - - [1024, 2048, 1, 4096, 1024, 1024, 4096, 4096]
    - [44, 237.32]
  - - [1024, 2048, 1, 8192, 1024, 1024, 8192, 8192]
    - [58, 255.47]
  - - [1024, 4096, 1, 128, 1024, 1024, 128, 128]
    - [7, 60.53]
  - - [1024, 4096, 1, 256, 1024, 1024, 256, 256]
    - [7, 105.26]
  - - [1024, 4096, 1, 512, 1024, 1024, 512, 512]
    - [7, 169.13]
  - - [1024, 4096, 1, 1024, 1024, 1024, 1024, 1024]
    - [7, 239.05]
  - - [1024, 4096, 1, 2048, 1024, 1024, 2048, 2048]
    - [36, 262.57]
  - - [1024, 4096, 1, 4096, 1024, 1024, 4096, 4096]
    - [36, 275.71]
  - - [1024, 4096, 1, 8192, 1024, 1024, 8192, 8192]
    - [36, 259.78]
  - - [1024, 8192, 1, 128, 1024, 1024, 128, 128]
    - [29, 92.42]
  - - [1024, 8192, 1, 256, 1024, 1024, 256, 256]
    - [29, 158.75]
  - - [1024, 8192, 1, 512, 1024, 1024, 512, 512]
    - [29, 249.53]
  - - [1024, 8192, 1, 1024, 1024, 1024, 1024, 1024]
    - [31, 282.86]
  - - [1024, 8192, 1, 2048, 1024, 1024, 2048, 2048]
    - [35, 327.19]
  - - [1024, 8192, 1, 4096, 1024, 1024, 4096, 4096]
    - [28, 353.34]
  - - [1024, 8192, 1, 8192, 1024, 1024, 8192, 8192]
    - [28, 363.24]
  - - [2048, 128, 1, 128, 2048, 2048, 128, 128]
    - [78, 8.6]
  - - [2048, 128, 1, 256, 2048, 2048, 256, 256]
    - [78, 16.17]
  - - [2048, 128, 1, 512, 2048, 2048, 512, 512]
    - [77, 28.86]
  - - [2048, 128, 1, 1024, 2048, 2048, 1024, 1024]
    - [77, 46.09]
  - - [2048, 128, 1, 2048, 2048, 2048, 2048, 2048]
    - [75, 67.92]
  - - [2048, 128, 1, 4096, 2048, 2048, 4096, 4096]
    - [70, 88.05]
  - - [2048, 128, 1, 8192, 2048, 2048, 8192, 8192]
    - [73, 101.17]
  - - [2048, 256, 1, 128, 2048, 2048, 128, 128]
    - [21, 15.84]
  - - [2048, 256, 1, 256, 2048, 2048, 256, 256]
    - [19, 28.6]
  - - [2048, 256, 1, 512, 2048, 2048, 512, 512]
    - [21, 48.27]
  - - [2048, 256, 1, 1024, 2048, 2048, 1024, 1024]
    - [67, 76.11]
  - - [2048, 256, 1, 2048, 2048, 2048, 2048, 2048]
    - [67, 105.22]
  - - [2048, 256, 1, 4096, 2048, 2048, 4096, 4096]
    - [69, 128.83]
  - - [2048, 256, 1, 8192, 2048, 2048, 8192, 8192]
    - [93, 141.9]
  - - [2048, 512, 1, 128, 2048, 2048, 128, 128]
    - [14, 27.53]
  - - [2048, 512, 1, 256, 2048, 2048, 256, 256]
    - [15, 49.31]
  - - [2048, 512, 1, 512, 2048, 2048, 512, 512]
    - [15, 81.7]
  - - [2048, 512, 1, 1024, 2048, 2048, 1024, 1024]
    - [15, 122.06]
  - - [2048, 512, 1, 2048, 2048, 2048, 2048, 2048]
    - [16, 159.44]
  - - [2048, 512, 1, 4096, 2048, 2048, 4096, 4096]
    - [62, 180.06]
  - - [2048, 512, 1, 8192, 2048, 2048, 8192, 8192]
    - [88, 192.35]
  - - [2048, 1024, 1, 128, 2048, 2048, 128, 128]
    - [45, 43.54]
  - - [2048, 1024, 1, 256, 2048, 2048, 256, 256]
    - [9, 77.68]
  - - [2048, 1024, 1, 512, 2048, 2048, 512, 512]
    - [10, 124.2]
  - - [2048, 1024, 1, 1024, 2048, 2048, 1024, 1024]
    - [9, 182.46]
  - - [2048, 1024, 1, 2048, 2048, 2048, 2048, 2048]
    - [46, 229.53]
  - - [2048, 1024, 1, 4096, 2048, 2048, 4096, 4096]
    - [46, 230.92]
  - - [2048, 1024, 1, 8192, 2048, 2048, 8192, 8192]
    - [48, 253.3]
  - - [2048, 2048, 1, 128, 2048, 2048, 128, 128]
    - [7, 60.95]
  - - [2048, 2048, 1, 256, 2048, 2048, 256, 256]
    - [7, 106.26]
  - - [2048, 2048, 1, 512, 2048, 2048, 512, 512]
    - [7, 169.03]
  - - [2048, 2048, 1, 1024, 2048, 2048, 1024, 1024]
    - [7, 238.52]
  - - [2048, 2048, 1, 2048, 2048, 2048, 2048, 2048]
    - [38, 257.65]
  - - [2048, 2048, 1, 4096, 2048, 2048, 4096, 4096]
    - [37, 271.06]
  - - [2048, 2048, 1, 8192, 2048, 2048, 8192, 8192]
    - [38, 260.27]
  - - [2048, 4096, 1, 128, 2048, 2048, 128, 128]
    - [1, 75.07]
  - - [2048, 4096, 1, 256, 2048, 2048, 256, 256]
    - [0, 128.41]
  - - [2048, 4096, 1, 512, 2048, 2048, 512, 512]
    - [0, 193.35]
  - - [2048, 4096, 1, 1024, 2048, 2048, 1024, 1024]
    - [0, 249.35]
  - - [2048, 4096, 1, 2048, 2048, 2048, 2048, 2048]
    - [6, 275.23]
  - - [2048, 4096, 1, 4096, 2048, 2048, 4096, 4096]
    - [34, 287.98]
  - - [2048, 4096, 1, 8192, 2048, 2048, 8192, 8192]
    - [32, 311.93]
  - - [2048, 8192, 1, 128, 2048, 2048, 128, 128]
    - [29, 100.81]
  - - [2048, 8192, 1, 256, 2048, 2048, 256, 256]
    - [35, 166.61]
  - - [2048, 8192, 1, 512, 2048, 2048, 512, 512]
    - [29, 244.58]
  - - [2048, 8192, 1, 1024, 2048, 2048, 1024, 1024]
    - [29, 302.82]
  - - [2048, 8192, 1, 2048, 2048, 2048, 2048, 2048]
    - [28, 323.27]
  - - [2048, 8192, 1, 4096, 2048, 2048, 4096, 4096]
    - [34, 328.82]
  - - [2048, 8192, 1, 8192, 2048, 2048, 8192, 8192]
    - [34, 370.56]
  - - [4096, 128, 1, 128, 4096, 4096, 128, 128]
    - [22, 16.05]
  - - [4096, 128, 1, 256, 4096, 4096, 256, 256]
    - [19, 29.43]
  - - [4096, 128, 1, 512, 4096, 4096, 512, 512]
    - [67, 49.1]
  - - [4096, 128, 1, 1024, 4096, 4096, 1024, 1024]
    - [67, 75.5]
  - - [4096, 128, 1, 2048, 4096, 4096, 2048, 2048]
    - [67, 104.94]
  - - [4096, 128, 1, 4096, 4096, 4096, 4096, 4096]
    - [68, 129.39]
  - - [4096, 128, 1, 8192, 4096, 4096, 8192, 8192]
    - [93, 141.81]
  - - [4096, 256, 1, 128, 4096, 4096, 128, 128]
    - [12, 27.38]
  - - [4096, 256, 1, 256, 4096, 4096, 256, 256]
    - [16, 48.94]
  - - [4096, 256, 1, 512, 4096, 4096, 512, 512]
    - [17, 81.88]
  - - [4096, 256, 1, 1024, 4096, 4096, 1024, 1024]
    - [16, 121.54]
  - - [4096, 256, 1, 2048, 4096, 4096, 2048, 2048]
    - [17, 160.4]
  - - [4096, 256, 1, 4096, 4096, 4096, 4096, 4096]
    - [62, 177.91]
  - - [4096, 256, 1, 8192, 4096, 4096, 8192, 8192]
    - [90, 191.14]
  - - [4096, 512, 1, 128, 4096, 4096, 128, 128]
    - [10, 43.48]
  - - [4096, 512, 1, 256, 4096, 4096, 256, 256]
    - [9, 77.0]
  - - [4096, 512, 1, 512, 4096, 4096, 512, 512]
    - [9, 126.41]
  - - [4096, 512, 1, 1024, 4096, 4096, 1024, 1024]
    - [9, 182.7]
  - - [4096, 512, 1, 2048, 4096, 4096, 2048, 2048]
    - [47, 230.21]
  - - [4096, 512, 1, 4096, 4096, 4096, 4096, 4096]
    - [46, 237.21]
  - - [4096, 512, 1, 8192, 4096, 4096, 8192, 8192]
    - [46, 254.82]
  - - [4096, 1024, 1, 128, 4096, 4096, 128, 128]
    - [7, 60.24]
  - - [4096, 1024, 1, 256, 4096, 4096, 256, 256]
    - [7, 105.44]
  - - [4096, 1024, 1, 512, 4096, 4096, 512, 512]
    - [7, 169.17]
  - - [4096, 1024, 1, 1024, 4096, 4096, 1024, 1024]
    - [8, 230.5]
  - - [4096, 1024, 1, 2048, 4096, 4096, 2048, 2048]
    - [38, 270.36]
  - - [4096, 1024, 1, 4096, 4096, 4096, 4096, 4096]
    - [37, 272.82]
  - - [4096, 1024, 1, 8192, 4096, 4096, 8192, 8192]
    - [53, 265.41]
  - - [4096, 2048, 1, 128, 4096, 4096, 128, 128]
    - [3, 75.24]
  - - [4096, 2048, 1, 256, 4096, 4096, 256, 256]
    - [3, 127.13]
  - - [4096, 2048, 1, 512, 4096, 4096, 512, 512]
    - [0, 188.39]
  - - [4096, 2048, 1, 1024, 4096, 4096, 1024, 1024]
    - [5, 246.62]
  - - [4096, 2048, 1, 2048, 4096, 4096, 2048, 2048]
    - [2, 276.41]
  - - [4096, 2048, 1, 4096, 4096, 4096, 4096, 4096]
    - [26, 288.23]
  - - [4096, 2048, 1, 8192, 4096, 4096, 8192, 8192]
    - [39, 308.08]
  - - [4096, 4096, 1, 128, 4096, 4096, 128, 128]
    - [3, 81.29]
  - - [4096, 4096, 1, 256, 4096, 4096, 256, 256]
    - [3, 136.64]
  - - [4096, 4096, 1, 512, 4096, 4096, 512, 512]
    - [10, 195.69]
  - - [4096, 4096, 1, 1024, 4096, 4096, 1024, 1024]
    - [57, 244.47]
  - - [4096, 4096, 1, 2048, 4096, 4096, 2048, 2048]
    - [30, 269.22]
  - - [4096, 4096, 1, 4096, 4096, 4096, 4096, 4096]
    - [30, 280.88]
  - - [4096, 4096, 1, 8192, 4096, 4096, 8192, 8192]
    - [27, 330.88]
  - - [4096, 8192, 1, 128, 4096, 4096, 128, 128]
    - [31, 109.9]
  - - [4096, 8192, 1, 256, 4096, 4096, 256, 256]
    - [28, 177.68]
  - - [4096, 8192, 1, 512, 4096, 4096, 512, 512]
    - [33, 242.57]
  - - [4096, 8192, 1, 1024, 4096, 4096, 1024, 1024]
    - [30, 270.83]
  - - [4096, 8192, 1, 2048, 4096, 4096, 2048, 2048]
    - [34, 306.43]
  - - [4096, 8192, 1, 4096, 4096, 4096, 4096, 4096]
    - [32, 336.93]
  - - [4096, 8192, 1, 8192, 4096, 4096, 8192, 8192]
    - [34, 384.51]
  - - [8192, 128, 1, 128, 8192, 8192, 128, 128]
    - [13, 28.38]
  - - [8192, 128, 1, 256, 8192, 8192, 256, 256]
    - [15, 49.89]
  - - [8192, 128, 1, 512, 8192, 8192, 512, 512]
    - [15, 83.41]
  - - [8192, 128, 1, 1024, 8192, 8192, 1024, 1024]
    - [15, 122.65]
  - - [8192, 128, 1, 2048, 8192, 8192, 2048, 2048]
    - [18, 159.56]
  - - [8192, 128, 1, 4096, 8192, 8192, 4096, 4096]
    - [89, 170.79]
  - - [8192, 128, 1, 8192, 8192, 8192, 8192, 8192]
    - [91, 191.98]
  - - [8192, 256, 1, 128, 8192, 8192, 128, 128]
    - [9, 44.07]
  - - [8192, 256, 1, 256, 8192, 8192, 256, 256]
    - [10, 76.86]
  - - [8192, 256, 1, 512, 8192, 8192, 512, 512]
    - [9, 127.11]
  - - [8192, 256, 1, 1024, 8192, 8192, 1024, 1024]
    - [9, 183.01]
  - - [8192, 256, 1, 2048, 8192, 8192, 2048, 2048]
    - [48, 227.25]
  - - [8192, 256, 1, 4096, 8192, 8192, 4096, 4096]
    - [59, 232.23]
  - - [8192, 256, 1, 8192, 8192, 8192, 8192, 8192]
    - [60, 250.73]
  - - [8192, 512, 1, 128, 8192, 8192, 128, 128]
    - [7, 60.39]
  - - [8192, 512, 1, 256, 8192, 8192, 256, 256]
    - [7, 106.47]
  - - [8192, 512, 1, 512, 8192, 8192, 512, 512]
    - [8, 167.05]
  - - [8192, 512, 1, 1024, 8192, 8192, 1024, 1024]
    - [53, 250.79]
  - - [8192, 512, 1, 2048, 8192, 8192, 2048, 2048]
    - [38, 262.27]
  - - [8192, 512, 1, 4096, 8192, 8192, 4096, 4096]
    - [53, 317.93]
  - - [8192, 512, 1, 8192, 8192, 8192, 8192, 8192]
    - [54, 318.82]
  - - [8192, 1024, 1, 128, 8192, 8192, 128, 128]
    - [0, 75.08]
  - - [8192, 1024, 1, 256, 8192, 8192, 256, 256]
    - [1, 126.51]
  - - [8192, 1024, 1, 512, 8192, 8192, 512, 512]
    - [43, 188.39]
  - - [8192, 1024, 1, 1024, 8192, 8192, 1024, 1024]
    - [4, 243.73]
  - - [8192, 1024, 1, 2048, 8192, 8192, 2048, 2048]
    - [43, 320.01]
  - - [8192, 1024, 1, 4096, 8192, 8192, 4096, 4096]
    - [43, 360.84]
  - - [8192, 1024, 1, 8192, 8192, 8192, 8192, 8192]
    - [43, 382.1]
  - - [8192, 2048, 1, 128, 8192, 8192, 128, 128]
    - [3, 81.49]
  - - [8192, 2048, 1, 256, 8192, 8192, 256, 256]
    - [3, 137.56]
  - - [8192, 2048, 1, 512, 8192, 8192, 512, 512]
    - [42, 197.47]
  - - [8192, 2048, 1, 1024, 8192, 8192, 1024, 1024]
    - [43, 264.94]
  - - [8192, 2048, 1, 2048, 8192, 8192, 2048, 2048]
    - [43, 326.75]
  - - [8192, 2048, 1, 4096, 8192, 8192, 4096, 4096]
    - [40, 344.51]
  - - [8192, 2048, 1, 8192, 8192, 8192, 8192, 8192]
    - [40, 400.8]
  - - [8192, 4096, 1, 128, 8192, 8192, 128, 128]
    - [0, 87.98]
  - - [8192, 4096, 1, 256, 8192, 8192, 256, 256]
    - [11, 149.04]
  - - [8192, 4096, 1, 512, 8192, 8192, 512, 512]
    - [57, 201.37]
  - - [8192, 4096, 1, 1024, 8192, 8192, 1024, 1024]
    - [43, 253.25]
  - - [8192, 4096, 1, 2048, 8192, 8192, 2048, 2048]
    - [41, 310.24]
  - - [8192, 4096, 1, 4096, 8192, 8192, 4096, 4096]
    - [41, 358.01]
  - - [8192, 4096, 1, 8192, 8192, 8192, 8192, 8192]
    - [41, 424.87]
  - - [8192, 8192, 1, 128, 8192, 8192, 128, 128]
    - [31, 110.45]
  - - [8192, 8192, 1, 256, 8192, 8192, 256, 256]
    - [31, 158.83]
  - - [8192, 8192, 1, 512, 8192, 8192, 512, 512]
    - [34, 218.76]
  - - [8192, 8192, 1, 1024, 8192, 8192, 1024, 1024]
    - [33, 278.18]
  - - [8192, 8192, 1, 2048, 8192, 8192, 2048, 2048]
    - [2, 323.22]
  - - [8192, 8192, 1, 4096, 8192, 8192, 4096, 4096]
    - [41, 372.73]
  - - [8192, 8192, 1, 8192, 8192, 8192, 8192, 8192]
    - [40, 425.8]
  - - [1, 1, 1, 32, 1, 1, 32, 32]
    - [97, 0.0]
- null
- null
- ExperimentalStreamK
- GridBased
