projects/hipblaslt/library/src/amd_detail/rocblaslt/src/Tensile/Logic/asm_full/aquavanjaram/gfx942_228cu/StreamK/aquavanjaram942_Cijk_Alik_Bljk_B8NBS_BH_Bias_HAS_SAV_UserArgs.yaml
- {MinimumRequiredVersion: 4.33.0}
- aquavanjaram942
- {Architecture: gfx942, CUCount: 228}
- [Device 0049, Device 0050]
    SolutionIndex: 0
    SolutionNameMin: Cijk_Alik_Bljk_B8NBS_BH_Bias_HAS_SAV_UserArgs_MT256x256x64_MI16x16x1_SN_LDSB1_CLR1_GRVWA8_GRVWB16_GSU0_GSUC0_GSUWGMRR0_K1_LBSPPA512_LBSPPB512_LPA8_LPB16_LRVW8_MIWT8_8_PLR1_SU0_SUM0_SUS64_VWA8_VWB8_WGM1_WGMXCC1_WGMXCCGn1
    SolutionIndex: 1
    SolutionNameMin: Cijk_Alik_Bljk_B8NBS_BH_Bias_HAS_SAV_UserArgs_MT256x256x64_MI16x16x1_SN_LDSB1_CLR1_GRVWA8_GRVWB16_GSU0_GSUC0_GSUWGMRR0_K1_LBSPPA512_LBSPPB512_LPA8_LPB16_LRVW8_MIWT8_8_PLR1_SU0_SUM0_SUS64_VWA8_VWB8_WGM4_WGMXCC1_WGMXCCGn1
    SolutionIndex: 2
    SolutionNameMin: Cijk_Alik_Bljk_B8NBS_BH_Bias_HAS_SAV_UserArgs_MT256x256x64_MI16x16x1_SN_LDSB1_CLR1_GRVWA16_GRVWB16_GSU0_GSUC0_GSUWGMRR0_K1_LBSPPA512_LBSPPB512_LPA16_LPB16_LRVW8_MIWT8_8_PLR1_SU0_SUM0_SUS64_VWA8_VWB8_WGM4_WGMXCC1_WGMXCCGn1
    SolutionIndex: 3
    SolutionNameMin: Cijk_Alik_Bljk_B8NBS_BH_Bias_HAS_SAV_UserArgs_MT256x256x64_MI16x16x1_SN_LDSB1_CLR1_GRVWA16_GRVWB16_GSU0_GSUC0_GSUWGMRR0_K1_LBSPPA512_LBSPPB512_LPA16_LPB16_LRVW8_MIWT8_8_PLR1_SU0_SUM0_SUS64_VWA8_VWB8_WGM6_WGMXCC1_WGMXCCGn1
    SolutionIndex: 4
    SolutionNameMin: Cijk_Alik_Bljk_B8NBS_BH_Bias_HAS_SAV_UserArgs_MT256x256x64_MI16x16x1_SN_LDSB1_CLR1_GRVWA16_GRVWB16_GSU0_GSUC0_GSUWGMRR0_K1_LBSPPA512_LBSPPB512_LPA16_LPB16_LRVW8_MIWT8_8_PLR1_SU0_SUM0_SUS64_VWA8_VWB8_WGM8_WGMXCC1_WGMXCCGn1
    SolutionIndex: 5
    SolutionNameMin: Cijk_Alik_Bljk_B8NBS_BH_Bias_HAS_SAV_UserArgs_MT128x256x64_MI16x16x1_SN_LDSB1_CLR1_GRVWA8_GRVWB16_GSU0_GSUC0_GSUWGMRR0_K1_LBSPPA256_LBSPPB512_LPA8_LPB16_LRVW8_MIWT4_8_PLR1_SU0_SUM0_SUS64_VWA4_VWB8_WGM1_WGMXCC1_WGMXCCGn1
    SolutionIndex: 6
    SolutionNameMin: Cijk_Alik_Bljk_B8NBS_BH_Bias_HAS_SAV_UserArgs_MT256x128x64_MI16x16x1_SN_LDSB1_CLR1_GRVWA8_GRVWB16_GSU0_GSUC0_GSUWGMRR0_K1_LBSPPA512_LBSPPB256_LPA8_LPB16_LRVW8_MIWT8_4_PLR1_SU0_SUM0_SUS64_VWA8_VWB4_WGM1_WGMXCC1_WGMXCCGn1
    SolutionIndex: 7
    SolutionNameMin: Cijk_Alik_Bljk_B8NBS_BH_Bias_HAS_SAV_UserArgs_MT256x128x64_MI16x16x1_SN_LDSB1_CLR1_GRVWA16_GRVWB16_GSU0_GSUC0_GSUWGMRR0_K1_LBSPPA512_LBSPPB256_LPA16_LPB16_LRVW8_MIWT8_4_PLR1_SU0_SUM0_SUS64_VWA8_VWB4_WGM1_WGMXCC1_WGMXCCGn1
    SolutionIndex: 8
    SolutionNameMin: Cijk_Alik_Bljk_B8NBS_BH_Bias_HAS_SAV_UserArgs_MT256x128x64_MI16x16x1_SN_LDSB1_CLR1_GRVWA8_GRVWB16_GSU0_GSUC0_GSUWGMRR0_K1_LBSPPA512_LBSPPB256_LPA8_LPB16_LRVW8_MIWT8_4_PLR1_SU0_SUM0_SUS64_VWA8_VWB4_WGM4_WGMXCC1_WGMXCCGn1
    SolutionIndex: 9
    SolutionNameMin: Cijk_Alik_Bljk_B8NBS_BH_Bias_HAS_SAV_UserArgs_MT256x128x64_MI16x16x1_SN_LDSB1_CLR1_GRVWA8_GRVWB16_GSU0_GSUC0_GSUWGMRR0_K1_LBSPPA512_LBSPPB256_LPA8_LPB16_LRVW8_MIWT8_4_PLR1_SU0_SUM0_SUS64_VWA8_VWB4_WGM8_WGMXCC1_WGMXCCGn1
    SolutionIndex: 10
    SolutionNameMin: Cijk_Alik_Bljk_B8NBS_BH_Bias_HAS_SAV_UserArgs_MT256x128x64_MI16x16x1_SN_LDSB1_CLR1_GRVWA16_GRVWB16_GSU0_GSUC0_GSUWGMRR0_K1_LBSPPA512_LBSPPB256_LPA16_LPB16_LRVW8_MIWT8_4_PLR1_SU0_SUM0_SUS64_VWA8_VWB4_WGM8_WGMXCC1_WGMXCCGn1
    SolutionIndex: 11
    SolutionNameMin: Cijk_Alik_Bljk_B8NBS_BH_Bias_HAS_SAV_UserArgs_MT128x128x64_MI16x16x1_SN_LDSB1_CLR1_GRVWA8_GRVWB16_GSU0_GSUC0_GSUWGMRR0_K1_LBSPPA512_LBSPPB128_LPA8_LPB16_LRVW8_MIWT8_2_PLR1_SU0_SUM0_SUS64_VWA8_VWB2_WGM1_WGMXCC1_WGMXCCGn1
    SolutionIndex: 12
    SolutionNameMin: Cijk_Alik_Bljk_B8NBS_BH_Bias_HAS_SAV_UserArgs_MT128x128x64_MI16x16x1_SN_LDSB1_CLR1_GRVWA8_GRVWB16_GSU0_GSUC0_GSUWGMRR0_K1_LBSPPA512_LBSPPB128_LPA8_LPB16_LRVW8_MIWT8_2_PLR1_SU0_SUM0_SUS64_VWA8_VWB2_WGM4_WGMXCC1_WGMXCCGn1
    SolutionIndex: 13
    SolutionNameMin: Cijk_Alik_Bljk_B8NBS_BH_Bias_HAS_SAV_UserArgs_MT128x128x64_MI16x16x1_SN_LDSB1_CLR1_GRVWA8_GRVWB16_GSU0_GSUC0_GSUWGMRR0_K1_LBSPPA512_LBSPPB128_LPA8_LPB16_LRVW8_MIWT8_2_PLR1_SU0_SUM0_SUS64_VWA8_VWB2_WGM6_WGMXCC1_WGMXCCGn1
    SolutionIndex: 14
    SolutionNameMin: Cijk_Alik_Bljk_B8NBS_BH_Bias_HAS_SAV_UserArgs_MT128x64x64_MI16x16x1_SN_LDSB0_CLR1_GRVWA8_GRVWB16_GSU0_GSUC0_GSUWGMRR0_K1_LBSPPA512_LBSPPB128_LPA8_LPB16_LRVW8_MIWT8_1_PLR1_SU0_SUM0_SUS64_VWA8_VWB1_WGM1_WGMXCC1_WGMXCCGn1
    SolutionIndex: 15
    SolutionNameMin: Cijk_Alik_Bljk_B8NBS_BH_Bias_HAS_SAV_UserArgs_MT64x128x64_MI16x16x1_SN_LDSB0_CLR1_GRVWA16_GRVWB8_GSU0_GSUC0_GSUWGMRR0_K1_LBSPPA128_LBSPPB256_LPA16_LPB8_LRVW8_MIWT2_4_PLR1_SU0_SUM0_SUS64_VWA2_VWB4_WGM1_WGMXCC1_WGMXCCGn1
    SolutionIndex: 16
    SolutionNameMin: Cijk_Alik_Bljk_B8NBS_BH_Bias_HAS_SAV_UserArgs_MT64x128x64_MI16x16x1_SN_LDSB0_CLR1_GRVWA8_GRVWB16_GSU0_GSUC0_GSUWGMRR0_K1_LBSPPA128_LBSPPB256_LPA8_LPB16_LRVW8_MIWT2_4_PLR1_SU0_SUM0_SUS64_VWA2_VWB4_WGM1_WGMXCC1_WGMXCCGn1
    SolutionIndex: 17
    SolutionNameMin: Cijk_Alik_Bljk_B8NBS_BH_Bias_HAS_SAV_UserArgs_MT64x128x64_MI16x16x1_SN_LDSB0_CLR1_GRVWA16_GRVWB16_GSU0_GSUC0_GSUWGMRR0_K1_LBSPPA128_LBSPPB256_LPA16_LPB16_LRVW8_MIWT2_4_PLR1_SU0_SUM0_SUS64_VWA2_VWB4_WGM1_WGMXCC1_WGMXCCGn1
    SolutionIndex: 18
    SolutionNameMin: Cijk_Alik_Bljk_B8NBS_BH_Bias_HAS_SAV_UserArgs_MT128x64x64_MI16x16x1_SN_LDSB0_CLR1_GRVWA16_GRVWB8_GSU0_GSUC0_GSUWGMRR0_K1_LBSPPA256_LBSPPB128_LPA16_LPB8_LRVW8_MIWT4_2_PLR1_SU0_SUM0_SUS64_VWA4_VWB2_WGM1_WGMXCC1_WGMXCCGn1
    SolutionIndex: 19
    SolutionNameMin: Cijk_Alik_Bljk_B8NBS_BH_Bias_HAS_SAV_UserArgs_MT128x64x64_MI16x16x1_SN_LDSB0_CLR1_GRVWA8_GRVWB16_GSU0_GSUC0_GSUWGMRR0_K1_LBSPPA256_LBSPPB128_LPA8_LPB16_LRVW8_MIWT4_2_PLR1_SU0_SUM0_SUS64_VWA4_VWB2_WGM1_WGMXCC1_WGMXCCGn1
    SolutionIndex: 20
    SolutionNameMin: Cijk_Alik_Bljk_B8NBS_BH_Bias_HAS_SAV_UserArgs_MT128x64x64_MI16x16x1_SN_LDSB0_CLR1_GRVWA16_GRVWB16_GSU0_GSUC0_GSUWGMRR0_K1_LBSPPA256_LBSPPB128_LPA16_LPB16_LRVW8_MIWT4_2_PLR1_SU0_SUM0_SUS64_VWA4_VWB2_WGM1_WGMXCC1_WGMXCCGn1
    SolutionIndex: 21
    SolutionNameMin: Cijk_Alik_Bljk_B8NBS_BH_Bias_HAS_SAV_UserArgs_MT128x64x64_MI16x16x1_SN_LDSB0_CLR1_GRVWA8_GRVWB16_GSU0_GSUC0_GSUWGMRR0_K1_LBSPPA256_LBSPPB128_LPA8_LPB16_LRVW8_MIWT4_2_PLR1_SU0_SUM0_SUS64_VWA4_VWB2_WGM4_WGMXCC1_WGMXCCGn1
    SolutionIndex: 22
    SolutionNameMin: Cijk_Alik_Bljk_B8NBS_BH_Bias_HAS_SAV_UserArgs_MT128x64x64_MI16x16x1_SN_LDSB0_CLR1_GRVWA8_GRVWB16_GSU0_GSUC0_GSUWGMRR0_K1_LBSPPA256_LBSPPB128_LPA8_LPB16_LRVW8_MIWT4_2_PLR1_SU0_SUM0_SUS64_VWA4_VWB2_WGM6_WGMXCC1_WGMXCCGn1
    SolutionIndex: 23
    SolutionNameMin: Cijk_Alik_Bljk_B8NBS_BH_Bias_HAS_SAV_UserArgs_MT128x64x64_MI16x16x1_SN_LDSB0_CLR1_GRVWA8_GRVWB16_GSU0_GSUC0_GSUWGMRR0_K1_LBSPPA256_LBSPPB128_LPA8_LPB16_LRVW8_MIWT4_2_PLR1_SU0_SUM0_SUS64_VWA4_VWB2_WGM8_WGMXCC1_WGMXCCGn1
    SolutionIndex: 24
    SolutionNameMin: Cijk_Alik_Bljk_B8NBS_BH_Bias_HAS_SAV_UserArgs_MT64x64x64_MI16x16x1_SN_LDSB0_CLR1_GRVWA8_GRVWB8_GSU0_GSUC0_GSUWGMRR0_K1_LBSPPA128_LBSPPB128_LPA8_LPB8_LRVW8_MIWT2_2_PLR1_SU0_SUM0_SUS64_VWA2_VWB2_WGM1_WGMXCC1_WGMXCCGn1
    SolutionIndex: 25
    SolutionNameMin: Cijk_Alik_Bljk_B8NBS_BH_Bias_HAS_SAV_UserArgs_MT64x64x64_MI16x16x1_SN_LDSB0_CLR1_GRVWA16_GRVWB8_GSU0_GSUC0_GSUWGMRR0_K1_LBSPPA128_LBSPPB128_LPA16_LPB8_LRVW8_MIWT2_2_PLR1_SU0_SUM0_SUS64_VWA2_VWB2_WGM1_WGMXCC1_WGMXCCGn1
    SolutionIndex: 26
    SolutionNameMin: Cijk_Alik_Bljk_B8NBS_BH_Bias_HAS_SAV_UserArgs_MT64x64x64_MI16x16x1_SN_LDSB0_CLR1_GRVWA8_GRVWB16_GSU0_GSUC0_GSUWGMRR0_K1_LBSPPA128_LBSPPB128_LPA8_LPB16_LRVW8_MIWT2_2_PLR1_SU0_SUM0_SUS64_VWA2_VWB2_WGM1_WGMXCC1_WGMXCCGn1
    SolutionIndex: 27
    SolutionNameMin: Cijk_Alik_Bljk_B8NBS_BH_Bias_HAS_SAV_UserArgs_MT64x64x64_MI16x16x1_SN_LDSB0_CLR1_GRVWA8_GRVWB16_GSU0_GSUC0_GSUWGMRR0_K1_LBSPPA128_LBSPPB128_LPA8_LPB16_LRVW8_MIWT2_2_PLR1_SU0_SUM0_SUS64_VWA2_VWB2_WGM6_WGMXCC1_WGMXCCGn1
    SolutionIndex: 28
    SolutionNameMin: Cijk_Alik_Bljk_B8NBS_BH_Bias_HAS_SAV_UserArgs_MT32x64x64_MI16x16x1_SN_LDSB0_CLR1_GRVWA8_GRVWB16_GSU0_GSUC0_GSUWGMRR0_K1_LBSPPA128_LBSPPB128_LPA8_LPB16_LRVW8_MIWT1_2_PLR1_SU0_SUM0_SUS64_VWA1_VWB2_WGM1_WGMXCC1_WGMXCCGn1
    SolutionIndex: 29
    SolutionNameMin: Cijk_Alik_Bljk_B8NBS_BH_Bias_HAS_SAV_UserArgs_MT64x32x64_MI16x16x1_SN_LDSB0_CLR1_GRVWA16_GRVWB8_GSU0_GSUC0_GSUWGMRR0_K1_LBSPPA128_LBSPPB128_LPA16_LPB8_LRVW8_MIWT2_1_PLR1_SU0_SUM0_SUS64_VWA2_VWB1_WGM1_WGMXCC1_WGMXCCGn1
    SolutionIndex: 30
    SolutionNameMin: Cijk_Alik_Bljk_B8NBS_BH_Bias_HAS_SAV_UserArgs_MT64x32x64_MI16x16x1_SN_LDSB0_CLR1_GRVWA16_GRVWB8_GSU0_GSUC0_GSUWGMRR0_K1_LBSPPA128_LBSPPB128_LPA16_LPB8_LRVW8_MIWT2_1_PLR1_SU0_SUM0_SUS64_VWA2_VWB1_WGM4_WGMXCC1_WGMXCCGn1
    SolutionIndex: 31
    SolutionNameMin: Cijk_Alik_Bljk_B8NBS_BH_Bias_HAS_SAV_UserArgs_MT64x32x64_MI16x16x1_SN_LDSB0_CLR1_GRVWA8_GRVWB8_GSU0_GSUC0_GSUWGMRR0_K1_LBSPPA128_LBSPPB128_LPA8_LPB8_LRVW8_MIWT2_1_PLR1_SU0_SUM0_SUS64_VWA2_VWB1_WGM6_WGMXCC1_WGMXCCGn1
    SolutionIndex: 32
    SolutionNameMin: Cijk_Alik_Bljk_B8NBS_BH_Bias_HAS_SAV_UserArgs_MT32x32x64_MI16x16x1_SN_LDSB0_CLR1_GRVWA8_GRVWB8_GSU0_GSUC0_GSUWGMRR0_K1_LBSPPA128_LBSPPB128_LPA8_LPB8_LRVW8_MIWT1_1_PLR1_SU0_SUM0_SUS64_VWA1_VWB1_WGM1_WGMXCC1_WGMXCCGn1
    SolutionIndex: 33
    SolutionNameMin: Cijk_Alik_Bljk_B8NBS_BH_Bias_HAS_SAV_UserArgs_MT32x32x64_MI16x16x1_SN_LDSB0_CLR1_GRVWA8_GRVWB8_GSU0_GSUC0_GSUWGMRR0_K1_LBSPPA128_LBSPPB128_LPA8_LPB8_LRVW8_MIWT1_1_PLR1_SU0_SUM0_SUS64_VWA1_VWB1_WGM4_WGMXCC1_WGMXCCGn1
    SolutionIndex: 34
    SolutionNameMin: Cijk_Alik_Bljk_B8NBS_BH_Bias_HAS_SAV_UserArgs_MT32x32x64_MI16x16x1_SN_LDSB0_CLR1_GRVWA8_GRVWB8_GSU0_GSUC0_GSUWGMRR0_K1_LBSPPA128_LBSPPB128_LPA8_LPB8_LRVW8_MIWT1_1_PLR1_SU0_SUM0_SUS64_VWA1_VWB1_WGM6_WGMXCC1_WGMXCCGn1
    SolutionIndex: 35
    SolutionNameMin: Cijk_Alik_Bljk_B8NBS_BH_Bias_HAS_SAV_UserArgs_MT32x32x64_MI16x16x1_SN_LDSB0_CLR1_GRVWA8_GRVWB8_GSU0_GSUC0_GSUWGMRR0_K1_LBSPPA128_LBSPPB128_LPA8_LPB8_LRVW8_MIWT1_1_PLR1_SU0_SUM0_SUS64_VWA1_VWB1_WGM8_WGMXCC1_WGMXCCGn1
    SolutionIndex: 36
    SolutionNameMin: Cijk_Alik_Bljk_B8NBS_BH_Bias_HAS_SAV_UserArgs_MT128x256x128_MI16x16x1_SN_LDSB1_CLR1_GRVWA8_GRVWB16_GSU0_GSUC0_GSUWGMRR0_K1_LBSPPA512_LBSPPB1024_LPA8_LPB16_LRVW8_MIWT4_8_PLR1_SU0_SUM0_SUS128_VWA4_VWB8_WGM1_WGMXCC1_WGMXCCGn1
    SolutionIndex: 37
    SolutionNameMin: Cijk_Alik_Bljk_B8NBS_BH_Bias_HAS_SAV_UserArgs_MT128x256x128_MI16x16x1_SN_LDSB1_CLR1_GRVWA8_GRVWB16_GSU0_GSUC0_GSUWGMRR0_K1_LBSPPA512_LBSPPB1024_LPA8_LPB16_LRVW8_MIWT4_8_PLR1_SU0_SUM0_SUS128_VWA4_VWB8_WGM6_WGMXCC1_WGMXCCGn1
    SolutionIndex: 38
    SolutionNameMin: Cijk_Alik_Bljk_B8NBS_BH_Bias_HAS_SAV_UserArgs_MT256x144x128_MI16x16x1_SN_LDSB1_CLR1_GRVWA8_GRVWB8_GSU0_GSUC0_GSUWGMRR0_K1_LBSPPA512_LBSPPB128_LPA8_LPB8_LRVW8_MIWT4_9_PLR1_SU0_SUM0_SUS128_VWA4_VWB1_WGM1_WGMXCC1_WGMXCCGn1
    SolutionIndex: 39
    SolutionNameMin: Cijk_Alik_Bljk_B8NBS_BH_Bias_HAS_SAV_UserArgs_MT256x144x128_MI16x16x1_SN_LDSB1_CLR1_GRVWA16_GRVWB8_GSU0_GSUC0_GSUWGMRR0_K1_LBSPPA512_LBSPPB128_LPA16_LPB8_LRVW8_MIWT4_9_PLR1_SU0_SUM0_SUS128_VWA4_VWB1_WGM1_WGMXCC1_WGMXCCGn1
    SolutionIndex: 40
    SolutionNameMin: Cijk_Alik_Bljk_B8NBS_BH_Bias_HAS_SAV_UserArgs_MT256x144x128_MI16x16x1_SN_LDSB1_CLR1_GRVWA8_GRVWB8_GSU0_GSUC0_GSUWGMRR0_K1_LBSPPA512_LBSPPB128_LPA8_LPB8_LRVW8_MIWT4_9_PLR1_SU0_SUM0_SUS128_VWA4_VWB1_WGM4_WGMXCC1_WGMXCCGn1
    SolutionIndex: 41
    SolutionNameMin: Cijk_Alik_Bljk_B8NBS_BH_Bias_HAS_SAV_UserArgs_MT256x144x128_MI16x16x1_SN_LDSB1_CLR1_GRVWA16_GRVWB8_GSU0_GSUC0_GSUWGMRR0_K1_LBSPPA512_LBSPPB128_LPA16_LPB8_LRVW8_MIWT4_9_PLR1_SU0_SUM0_SUS128_VWA4_VWB1_WGM4_WGMXCC1_WGMXCCGn1
    SolutionIndex: 42
    SolutionNameMin: Cijk_Alik_Bljk_B8NBS_BH_Bias_HAS_SAV_UserArgs_MT256x144x128_MI16x16x1_SN_LDSB1_CLR1_GRVWA8_GRVWB8_GSU0_GSUC0_GSUWGMRR0_K1_LBSPPA512_LBSPPB128_LPA8_LPB8_LRVW8_MIWT4_9_PLR1_SU0_SUM0_SUS128_VWA4_VWB1_WGM6_WGMXCC1_WGMXCCGn1
    SolutionIndex: 43
    SolutionNameMin: Cijk_Alik_Bljk_B8NBS_BH_Bias_HAS_SAV_UserArgs_MT256x144x128_MI16x16x1_SN_LDSB1_CLR1_GRVWA16_GRVWB8_GSU0_GSUC0_GSUWGMRR0_K1_LBSPPA512_LBSPPB128_LPA16_LPB8_LRVW8_MIWT4_9_PLR1_SU0_SUM0_SUS128_VWA4_VWB1_WGM6_WGMXCC1_WGMXCCGn1
    SolutionIndex: 44
    SolutionNameMin: Cijk_Alik_Bljk_B8NBS_BH_Bias_HAS_SAV_UserArgs_MT256x144x128_MI16x16x1_SN_LDSB1_CLR1_GRVWA8_GRVWB8_GSU0_GSUC0_GSUWGMRR0_K1_LBSPPA512_LBSPPB128_LPA8_LPB8_LRVW8_MIWT4_9_PLR1_SU0_SUM0_SUS128_VWA4_VWB1_WGM8_WGMXCC1_WGMXCCGn1
    SolutionIndex: 45
    SolutionNameMin: Cijk_Alik_Bljk_B8NBS_BH_Bias_HAS_SAV_UserArgs_MT256x144x128_MI16x16x1_SN_LDSB1_CLR1_GRVWA16_GRVWB8_GSU0_GSUC0_GSUWGMRR0_K1_LBSPPA512_LBSPPB128_LPA16_LPB8_LRVW8_MIWT4_9_PLR1_SU0_SUM0_SUS128_VWA4_VWB1_WGM8_WGMXCC1_WGMXCCGn1
    SolutionIndex: 46
    SolutionNameMin: Cijk_Alik_Bljk_B8NBS_BH_Bias_HAS_SAV_UserArgs_MT256x128x128_MI16x16x1_SN_LDSB1_CLR1_GRVWA8_GRVWB16_GSU0_GSUC0_GSUWGMRR0_K1_LBSPPA1024_LBSPPB512_LPA8_LPB16_LRVW8_MIWT8_4_PLR1_SU0_SUM0_SUS128_VWA8_VWB4_WGM1_WGMXCC1_WGMXCCGn1
    SolutionIndex: 47
    SolutionNameMin: Cijk_Alik_Bljk_B8NBS_BH_Bias_HAS_SAV_UserArgs_MT256x128x128_MI16x16x1_SN_LDSB1_CLR1_GRVWA8_GRVWB16_GSU0_GSUC0_GSUWGMRR0_K1_LBSPPA1024_LBSPPB512_LPA8_LPB16_LRVW8_MIWT8_4_PLR1_SU0_SUM0_SUS128_VWA8_VWB4_WGM4_WGMXCC1_WGMXCCGn1
    SolutionIndex: 48
    SolutionNameMin: Cijk_Alik_Bljk_B8NBS_BH_Bias_HAS_SAV_UserArgs_MT256x128x128_MI16x16x1_SN_LDSB1_CLR1_GRVWA8_GRVWB16_GSU0_GSUC0_GSUWGMRR0_K1_LBSPPA1024_LBSPPB512_LPA8_LPB16_LRVW8_MIWT8_4_PLR1_SU0_SUM0_SUS128_VWA8_VWB4_WGM6_WGMXCC1_WGMXCCGn1
    SolutionIndex: 49
    SolutionNameMin: Cijk_Alik_Bljk_B8NBS_BH_Bias_HAS_SAV_UserArgs_MT256x128x128_MI16x16x1_SN_LDSB1_CLR1_GRVWA8_GRVWB16_GSU0_GSUC0_GSUWGMRR0_K1_LBSPPA1024_LBSPPB512_LPA8_LPB16_LRVW8_MIWT8_4_PLR1_SU0_SUM0_SUS128_VWA8_VWB4_WGM8_WGMXCC1_WGMXCCGn1
    SolutionIndex: 50
    SolutionNameMin: Cijk_Alik_Bljk_B8NBS_BH_Bias_HAS_SAV_UserArgs_MT144x256x128_MI16x16x1_SN_LDSB1_CLR1_GRVWA8_GRVWB16_GSU0_GSUC0_GSUWGMRR0_K1_LBSPPA128_LBSPPB512_LPA8_LPB16_LRVW8_MIWT9_4_PLR1_SU0_SUM0_SUS128_VWA1_VWB4_WGM1_WGMXCC1_WGMXCCGn1
    SolutionIndex: 51
    SolutionNameMin: Cijk_Alik_Bljk_B8NBS_BH_Bias_HAS_SAV_UserArgs_MT144x256x128_MI16x16x1_SN_LDSB1_CLR1_GRVWA8_GRVWB16_GSU0_GSUC0_GSUWGMRR0_K1_LBSPPA128_LBSPPB512_LPA8_LPB16_LRVW8_MIWT9_4_PLR1_SU0_SUM0_SUS128_VWA1_VWB4_WGM4_WGMXCC1_WGMXCCGn1
    SolutionIndex: 52
    SolutionNameMin: Cijk_Alik_Bljk_B8NBS_BH_Bias_HAS_SAV_UserArgs_MT144x256x128_MI16x16x1_SN_LDSB1_CLR1_GRVWA8_GRVWB8_GSU0_GSUC0_GSUWGMRR0_K1_LBSPPA128_LBSPPB512_LPA8_LPB8_LRVW8_MIWT9_4_PLR1_SU0_SUM0_SUS128_VWA1_VWB4_WGM6_WGMXCC1_WGMXCCGn1
    SolutionIndex: 53
    SolutionNameMin: Cijk_Alik_Bljk_B8NBS_BH_Bias_HAS_SAV_UserArgs_MT144x256x128_MI16x16x1_SN_LDSB1_CLR1_GRVWA8_GRVWB16_GSU0_GSUC0_GSUWGMRR0_K1_LBSPPA128_LBSPPB512_LPA8_LPB16_LRVW8_MIWT9_4_PLR1_SU0_SUM0_SUS128_VWA1_VWB4_WGM6_WGMXCC1_WGMXCCGn1
    SolutionIndex: 54
    SolutionNameMin: Cijk_Alik_Bljk_B8NBS_BH_Bias_HAS_SAV_UserArgs_MT144x256x128_MI16x16x1_SN_LDSB1_CLR1_GRVWA8_GRVWB16_GSU0_GSUC0_GSUWGMRR0_K1_LBSPPA128_LBSPPB512_LPA8_LPB16_LRVW8_MIWT9_4_PLR1_SU0_SUM0_SUS128_VWA1_VWB4_WGM8_WGMXCC1_WGMXCCGn1
    SolutionIndex: 55
    SolutionNameMin: Cijk_Alik_Bljk_B8NBS_BH_Bias_HAS_SAV_UserArgs_MT128x128x128_MI16x16x1_SN_LDSB1_CLR1_GRVWA8_GRVWB16_GSU0_GSUC0_GSUWGMRR0_K1_LBSPPA1024_LBSPPB256_LPA8_LPB16_LRVW8_MIWT8_2_PLR1_SU0_SUM0_SUS128_VWA8_VWB2_WGM1_WGMXCC1_WGMXCCGn1
    SolutionIndex: 56
    SolutionNameMin: Cijk_Alik_Bljk_B8NBS_BH_Bias_HAS_SAV_UserArgs_MT128x128x128_MI16x16x1_SN_LDSB1_CLR1_GRVWA8_GRVWB16_GSU0_GSUC0_GSUWGMRR0_K1_LBSPPA1024_LBSPPB256_LPA8_LPB16_LRVW8_MIWT8_2_PLR1_SU0_SUM0_SUS128_VWA8_VWB2_WGM4_WGMXCC1_WGMXCCGn1
    SolutionIndex: 57
    SolutionNameMin: Cijk_Alik_Bljk_B8NBS_BH_Bias_HAS_SAV_UserArgs_MT128x128x128_MI16x16x1_SN_LDSB1_CLR1_GRVWA8_GRVWB16_GSU0_GSUC0_GSUWGMRR0_K1_LBSPPA1024_LBSPPB256_LPA8_LPB16_LRVW8_MIWT8_2_PLR1_SU0_SUM0_SUS128_VWA8_VWB2_WGM6_WGMXCC1_WGMXCCGn1
    SolutionIndex: 58
    SolutionNameMin: Cijk_Alik_Bljk_B8NBS_BH_Bias_HAS_SAV_UserArgs_MT128x128x128_MI16x16x1_SN_LDSB1_CLR1_GRVWA8_GRVWB16_GSU0_GSUC0_GSUWGMRR0_K1_LBSPPA1024_LBSPPB256_LPA8_LPB16_LRVW8_MIWT8_2_PLR1_SU0_SUM0_SUS128_VWA8_VWB2_WGM8_WGMXCC1_WGMXCCGn1
    SolutionIndex: 59
    SolutionNameMin: Cijk_Alik_Bljk_B8NBS_BH_Bias_HAS_SAV_UserArgs_MT128x144x128_MI16x16x1_SN_LDSB1_CLR1_GRVWA8_GRVWB8_GSU0_GSUC0_GSUWGMRR0_K1_LBSPPA256_LBSPPB128_LPA8_LPB8_LRVW8_MIWT2_9_PLR1_SU0_SUM0_SUS128_VWA2_VWB1_WGM1_WGMXCC1_WGMXCCGn1
    SolutionIndex: 60
    SolutionNameMin: Cijk_Alik_Bljk_B8NBS_BH_Bias_HAS_SAV_UserArgs_MT128x144x128_MI16x16x1_SN_LDSB1_CLR1_GRVWA16_GRVWB8_GSU0_GSUC0_GSUWGMRR0_K1_LBSPPA256_LBSPPB128_LPA16_LPB8_LRVW8_MIWT2_9_PLR1_SU0_SUM0_SUS128_VWA2_VWB1_WGM1_WGMXCC1_WGMXCCGn1
    SolutionIndex: 61
    SolutionNameMin: Cijk_Alik_Bljk_B8NBS_BH_Bias_HAS_SAV_UserArgs_MT128x144x128_MI16x16x1_SN_LDSB1_CLR1_GRVWA16_GRVWB8_GSU0_GSUC0_GSUWGMRR0_K1_LBSPPA256_LBSPPB128_LPA16_LPB8_LRVW8_MIWT2_9_PLR1_SU0_SUM0_SUS128_VWA2_VWB1_WGM4_WGMXCC1_WGMXCCGn1
    SolutionIndex: 62
    SolutionNameMin: Cijk_Alik_Bljk_B8NBS_BH_Bias_HAS_SAV_UserArgs_MT144x128x128_MI16x16x1_SN_LDSB1_CLR1_GRVWA8_GRVWB16_GSU0_GSUC0_GSUWGMRR0_K1_LBSPPA128_LBSPPB256_LPA8_LPB16_LRVW8_MIWT9_2_PLR1_SU0_SUM0_SUS128_VWA1_VWB2_WGM4_WGMXCC1_WGMXCCGn1
    SolutionIndex: 63
    SolutionNameMin: Cijk_Alik_Bljk_B8NBS_BH_Bias_HAS_SAV_UserArgs_MT144x128x128_MI16x16x1_SN_LDSB1_CLR1_GRVWA8_GRVWB16_GSU0_GSUC0_GSUWGMRR0_K1_LBSPPA128_LBSPPB256_LPA8_LPB16_LRVW8_MIWT9_2_PLR1_SU0_SUM0_SUS128_VWA1_VWB2_WGM6_WGMXCC1_WGMXCCGn1
    SolutionIndex: 64
    SolutionNameMin: Cijk_Alik_Bljk_B8NBS_BH_Bias_HAS_SAV_UserArgs_MT144x128x128_MI16x16x1_SN_LDSB1_CLR1_GRVWA8_GRVWB16_GSU0_GSUC0_GSUWGMRR0_K1_LBSPPA128_LBSPPB256_LPA8_LPB16_LRVW8_MIWT9_2_PLR1_SU0_SUM0_SUS128_VWA1_VWB2_WGM8_WGMXCC1_WGMXCCGn1
    SolutionIndex: 65
    SolutionNameMin: Cijk_Alik_Bljk_B8NBS_BH_Bias_HAS_SAV_UserArgs_MT128x128x128_MI16x16x1_SN_LDSB1_CLR1_GRVWA8_GRVWB16_GSU0_GSUC0_GSUWGMRR0_K1_LBSPPA512_LBSPPB512_LPA8_LPB16_LRVW8_MIWT4_4_PLR1_SU0_SUM0_SUS128_VWA4_VWB4_WGM1_WGMXCC1_WGMXCCGn1
    SolutionIndex: 66
    SolutionNameMin: Cijk_Alik_Bljk_B8NBS_BH_Bias_HAS_SAV_UserArgs_MT128x128x128_MI16x16x1_SN_LDSB1_CLR1_GRVWA16_GRVWB16_GSU0_GSUC0_GSUWGMRR0_K1_LBSPPA512_LBSPPB512_LPA16_LPB16_LRVW8_MIWT4_4_PLR1_SU0_SUM0_SUS128_VWA4_VWB4_WGM1_WGMXCC1_WGMXCCGn1
    SolutionIndex: 67
    SolutionNameMin: Cijk_Alik_Bljk_B8NBS_BH_Bias_HAS_SAV_UserArgs_MT128x128x128_MI16x16x1_SN_LDSB1_CLR1_GRVWA8_GRVWB16_GSU0_GSUC0_GSUWGMRR0_K1_LBSPPA512_LBSPPB512_LPA8_LPB16_LRVW8_MIWT4_4_PLR1_SU0_SUM0_SUS128_VWA4_VWB4_WGM4_WGMXCC1_WGMXCCGn1
    SolutionIndex: 68
    SolutionNameMin: Cijk_Alik_Bljk_B8NBS_BH_Bias_HAS_SAV_UserArgs_MT128x128x128_MI16x16x1_SN_LDSB1_CLR1_GRVWA8_GRVWB16_GSU0_GSUC0_GSUWGMRR0_K1_LBSPPA512_LBSPPB512_LPA8_LPB16_LRVW8_MIWT4_4_PLR1_SU0_SUM0_SUS128_VWA4_VWB4_WGM6_WGMXCC1_WGMXCCGn1
    SolutionIndex: 69
    SolutionNameMin: Cijk_Alik_Bljk_B8NBS_BH_Bias_HAS_SAV_UserArgs_MT128x128x128_MI16x16x1_SN_LDSB1_CLR1_GRVWA16_GRVWB16_GSU0_GSUC0_GSUWGMRR0_K1_LBSPPA512_LBSPPB512_LPA16_LPB16_LRVW8_MIWT4_4_PLR1_SU0_SUM0_SUS128_VWA4_VWB4_WGM6_WGMXCC1_WGMXCCGn1
    SolutionIndex: 70
    SolutionNameMin: Cijk_Alik_Bljk_B8NBS_BH_Bias_HAS_SAV_UserArgs_MT128x128x128_MI16x16x1_SN_LDSB1_CLR1_GRVWA8_GRVWB16_GSU0_GSUC0_GSUWGMRR0_K1_LBSPPA512_LBSPPB512_LPA8_LPB16_LRVW8_MIWT4_4_PLR1_SU0_SUM0_SUS128_VWA4_VWB4_WGM8_WGMXCC1_WGMXCCGn1
    SolutionIndex: 71
    SolutionNameMin: Cijk_Alik_Bljk_B8NBS_BH_Bias_HAS_SAV_UserArgs_MT64x128x128_MI16x16x1_SN_LDSB1_CLR1_GRVWA8_GRVWB16_GSU0_GSUC0_GSUWGMRR0_K1_LBSPPA256_LBSPPB512_LPA8_LPB16_LRVW8_MIWT2_4_PLR1_SU0_SUM0_SUS128_VWA2_VWB4_WGM1_WGMXCC1_WGMXCCGn1
    SolutionIndex: 72
    SolutionNameMin: Cijk_Alik_Bljk_B8NBS_BH_Bias_HAS_SAV_UserArgs_MT64x128x128_MI16x16x1_SN_LDSB1_CLR1_GRVWA8_GRVWB16_GSU0_GSUC0_GSUWGMRR0_K1_LBSPPA256_LBSPPB512_LPA8_LPB16_LRVW8_MIWT2_4_PLR1_SU0_SUM0_SUS128_VWA2_VWB4_WGM6_WGMXCC1_WGMXCCGn1
    SolutionIndex: 73
    SolutionNameMin: Cijk_Alik_Bljk_B8NBS_BH_Bias_HAS_SAV_UserArgs_MT64x64x128_MI16x16x1_SN_LDSB1_CLR1_GRVWA16_GRVWB8_GSU0_GSUC0_GSUWGMRR0_K1_LBSPPA256_LBSPPB256_LPA16_LPB8_LRVW8_MIWT2_2_PLR1_SU0_SUM0_SUS128_VWA2_VWB2_WGM1_WGMXCC1_WGMXCCGn1
    SolutionIndex: 74
    SolutionNameMin: Cijk_Alik_Bljk_B8NBS_BH_Bias_HAS_SAV_UserArgs_MT64x64x128_MI16x16x1_SN_LDSB1_CLR1_GRVWA8_GRVWB16_GSU0_GSUC0_GSUWGMRR0_K1_LBSPPA256_LBSPPB256_LPA8_LPB16_LRVW8_MIWT2_2_PLR1_SU0_SUM0_SUS128_VWA2_VWB2_WGM1_WGMXCC1_WGMXCCGn1
    SolutionIndex: 75
    SolutionNameMin: Cijk_Alik_Bljk_B8NBS_BH_Bias_HAS_SAV_UserArgs_MT64x64x128_MI16x16x1_SN_LDSB1_CLR1_GRVWA8_GRVWB16_GSU0_GSUC0_GSUWGMRR0_K1_LBSPPA256_LBSPPB256_LPA8_LPB16_LRVW8_MIWT2_2_PLR1_SU0_SUM0_SUS128_VWA2_VWB2_WGM4_WGMXCC1_WGMXCCGn1
    SolutionIndex: 76
    SolutionNameMin: Cijk_Alik_Bljk_B8NBS_BH_Bias_HAS_SAV_UserArgs_MT64x64x128_MI16x16x1_SN_LDSB1_CLR1_GRVWA16_GRVWB8_GSU0_GSUC0_GSUWGMRR0_K1_LBSPPA256_LBSPPB256_LPA16_LPB8_LRVW8_MIWT2_2_PLR1_SU0_SUM0_SUS128_VWA2_VWB2_WGM6_WGMXCC1_WGMXCCGn1
    SolutionIndex: 77
    SolutionNameMin: Cijk_Alik_Bljk_B8NBS_BH_Bias_HAS_SAV_UserArgs_MT32x64x128_MI16x16x1_SN_LDSB0_CLR1_GRVWA8_GRVWB8_GSU0_GSUC0_GSUWGMRR0_K1_LBSPPA128_LBSPPB256_LPA8_LPB8_LRVW8_MIWT1_2_PLR1_SU0_SUM0_SUS128_VWA1_VWB2_WGM1_WGMXCC1_WGMXCCGn1
    SolutionIndex: 78
    SolutionNameMin: Cijk_Alik_Bljk_B8NBS_BH_Bias_HAS_SAV_UserArgs_MT32x64x128_MI16x16x1_SN_LDSB0_CLR1_GRVWA16_GRVWB8_GSU0_GSUC0_GSUWGMRR0_K1_LBSPPA128_LBSPPB256_LPA16_LPB8_LRVW8_MIWT1_2_PLR1_SU0_SUM0_SUS128_VWA1_VWB2_WGM1_WGMXCC1_WGMXCCGn1
    SolutionIndex: 79
    SolutionNameMin: Cijk_Alik_Bljk_B8NBS_BH_Bias_HAS_SAV_UserArgs_MT32x64x128_MI16x16x1_SN_LDSB0_CLR1_GRVWA8_GRVWB16_GSU0_GSUC0_GSUWGMRR0_K1_LBSPPA128_LBSPPB256_LPA8_LPB16_LRVW8_MIWT1_2_PLR1_SU0_SUM0_SUS128_VWA1_VWB2_WGM1_WGMXCC1_WGMXCCGn1
    SolutionIndex: 80
    SolutionNameMin: Cijk_Alik_Bljk_B8NBS_BH_Bias_HAS_SAV_UserArgs_MT32x64x128_MI16x16x1_SN_LDSB0_CLR1_GRVWA8_GRVWB8_GSU0_GSUC0_GSUWGMRR0_K1_LBSPPA128_LBSPPB256_LPA8_LPB8_LRVW8_MIWT1_2_PLR1_SU0_SUM0_SUS128_VWA1_VWB2_WGM6_WGMXCC1_WGMXCCGn1
    SolutionIndex: 81
    SolutionNameMin: Cijk_Alik_Bljk_B8NBS_BH_Bias_HAS_SAV_UserArgs_MT32x64x128_MI16x16x1_SN_LDSB0_CLR1_GRVWA8_GRVWB16_GSU0_GSUC0_GSUWGMRR0_K1_LBSPPA128_LBSPPB256_LPA8_LPB16_LRVW8_MIWT1_2_PLR1_SU0_SUM0_SUS128_VWA1_VWB2_WGM6_WGMXCC1_WGMXCCGn1
    SolutionIndex: 82
    SolutionNameMin: Cijk_Alik_Bljk_B8NBS_BH_Bias_HAS_SAV_UserArgs_MT32x64x128_MI16x16x1_SN_LDSB0_CLR1_GRVWA8_GRVWB8_GSU0_GSUC0_GSUWGMRR0_K1_LBSPPA128_LBSPPB256_LPA8_LPB8_LRVW8_MIWT1_2_PLR1_SU0_SUM0_SUS128_VWA1_VWB2_WGM8_WGMXCC1_WGMXCCGn1
    SolutionIndex: 83
    SolutionNameMin: Cijk_Alik_Bljk_B8NBS_BH_Bias_HAS_SAV_UserArgs_MT32x64x128_MI16x16x1_SN_LDSB0_CLR1_GRVWA8_GRVWB16_GSU0_GSUC0_GSUWGMRR0_K1_LBSPPA128_LBSPPB256_LPA8_LPB16_LRVW8_MIWT1_2_PLR1_SU0_SUM0_SUS128_VWA1_VWB2_WGM8_WGMXCC1_WGMXCCGn1
    SolutionIndex: 84
    SolutionNameMin: Cijk_Alik_Bljk_B8NBS_BH_Bias_HAS_SAV_UserArgs_MT64x32x128_MI16x16x1_SN_LDSB0_CLR1_GRVWA8_GRVWB8_GSU0_GSUC0_GSUWGMRR0_K1_LBSPPA256_LBSPPB128_LPA8_LPB8_LRVW8_MIWT2_1_PLR1_SU0_SUM0_SUS128_VWA2_VWB1_WGM1_WGMXCC1_WGMXCCGn1
    SolutionIndex: 85
    SolutionNameMin: Cijk_Alik_Bljk_B8NBS_BH_Bias_HAS_SAV_UserArgs_MT64x32x128_MI16x16x1_SN_LDSB0_CLR1_GRVWA16_GRVWB8_GSU0_GSUC0_GSUWGMRR0_K1_LBSPPA256_LBSPPB128_LPA16_LPB8_LRVW8_MIWT2_1_PLR1_SU0_SUM0_SUS128_VWA2_VWB1_WGM1_WGMXCC1_WGMXCCGn1
    SolutionIndex: 86
    SolutionNameMin: Cijk_Alik_Bljk_B8NBS_BH_Bias_HAS_SAV_UserArgs_MT64x32x128_MI16x16x1_SN_LDSB0_CLR1_GRVWA8_GRVWB16_GSU0_GSUC0_GSUWGMRR0_K1_LBSPPA256_LBSPPB128_LPA8_LPB16_LRVW8_MIWT2_1_PLR1_SU0_SUM0_SUS128_VWA2_VWB1_WGM1_WGMXCC1_WGMXCCGn1
    SolutionIndex: 87
    SolutionNameMin: Cijk_Alik_Bljk_B8NBS_BH_Bias_HAS_SAV_UserArgs_MT64x32x128_MI16x16x1_SN_LDSB0_CLR1_GRVWA16_GRVWB16_GSU0_GSUC0_GSUWGMRR0_K1_LBSPPA256_LBSPPB128_LPA16_LPB16_LRVW8_MIWT2_1_PLR1_SU0_SUM0_SUS128_VWA2_VWB1_WGM1_WGMXCC1_WGMXCCGn1
    SolutionIndex: 88
    SolutionNameMin: Cijk_Alik_Bljk_B8NBS_BH_Bias_HAS_SAV_UserArgs_MT32x32x128_MI16x16x1_SN_LDSB0_CLR1_GRVWA8_GRVWB8_GSU0_GSUC0_GSUWGMRR0_K1_LBSPPA128_LBSPPB128_LPA8_LPB8_LRVW8_MIWT1_1_PLR1_SU0_SUM0_SUS128_VWA1_VWB1_WGM1_WGMXCC1_WGMXCCGn1
    SolutionIndex: 89
    SolutionNameMin: Cijk_Alik_Bljk_B8NBS_BH_Bias_HAS_SAV_UserArgs_MT32x32x128_MI16x16x1_SN_LDSB0_CLR1_GRVWA16_GRVWB8_GSU0_GSUC0_GSUWGMRR0_K1_LBSPPA128_LBSPPB128_LPA16_LPB8_LRVW8_MIWT1_1_PLR1_SU0_SUM0_SUS128_VWA1_VWB1_WGM1_WGMXCC1_WGMXCCGn1
    SolutionIndex: 90
    SolutionNameMin: Cijk_Alik_Bljk_B8NBS_BH_Bias_HAS_SAV_UserArgs_MT32x32x128_MI16x16x1_SN_LDSB0_CLR1_GRVWA8_GRVWB16_GSU0_GSUC0_GSUWGMRR0_K1_LBSPPA128_LBSPPB128_LPA8_LPB16_LRVW8_MIWT1_1_PLR1_SU0_SUM0_SUS128_VWA1_VWB1_WGM1_WGMXCC1_WGMXCCGn1
    SolutionIndex: 91
    SolutionNameMin: Cijk_Alik_Bljk_B8NBS_BH_Bias_HAS_SAV_UserArgs_MT32x32x128_MI16x16x1_SN_LDSB0_CLR1_GRVWA16_GRVWB16_GSU0_GSUC0_GSUWGMRR0_K1_LBSPPA128_LBSPPB128_LPA16_LPB16_LRVW8_MIWT1_1_PLR1_SU0_SUM0_SUS128_VWA1_VWB1_WGM1_WGMXCC1_WGMXCCGn1
    SolutionIndex: 92
    SolutionNameMin: Cijk_Alik_Bljk_B8NBS_BH_Bias_HAS_SAV_UserArgs_MT32x32x128_MI16x16x1_SN_LDSB0_CLR1_GRVWA8_GRVWB8_GSU0_GSUC0_GSUWGMRR0_K1_LBSPPA128_LBSPPB128_LPA8_LPB8_LRVW8_MIWT1_1_PLR1_SU0_SUM0_SUS128_VWA1_VWB1_WGM4_WGMXCC1_WGMXCCGn1
    SolutionIndex: 93
    SolutionNameMin: Cijk_Alik_Bljk_B8NBS_BH_Bias_HAS_SAV_UserArgs_MT32x32x128_MI16x16x1_SN_LDSB0_CLR1_GRVWA16_GRVWB16_GSU0_GSUC0_GSUWGMRR0_K1_LBSPPA128_LBSPPB128_LPA16_LPB16_LRVW8_MIWT1_1_PLR1_SU0_SUM0_SUS128_VWA1_VWB1_WGM4_WGMXCC1_WGMXCCGn1
    SolutionIndex: 94
    SolutionNameMin: Cijk_Alik_Bljk_B8NBS_BH_Bias_HAS_SAV_UserArgs_MT32x32x128_MI16x16x1_SN_LDSB0_CLR1_GRVWA8_GRVWB8_GSU0_GSUC0_GSUWGMRR0_K1_LBSPPA128_LBSPPB128_LPA8_LPB8_LRVW8_MIWT1_1_PLR1_SU0_SUM0_SUS128_VWA1_VWB1_WGM6_WGMXCC1_WGMXCCGn1
    SolutionIndex: 95
    SolutionNameMin: Cijk_Alik_Bljk_B8NBS_BH_Bias_HAS_SAV_UserArgs_MT32x32x128_MI16x16x1_SN_LDSB0_CLR1_GRVWA16_GRVWB8_GSU0_GSUC0_GSUWGMRR0_K1_LBSPPA128_LBSPPB128_LPA16_LPB8_LRVW8_MIWT1_1_PLR1_SU0_SUM0_SUS128_VWA1_VWB1_WGM6_WGMXCC1_WGMXCCGn1
    SolutionIndex: 96
    SolutionNameMin: Cijk_Alik_Bljk_B8NBS_BH_Bias_HAS_SAV_UserArgs_MT32x32x128_MI16x16x1_SN_LDSB0_CLR1_GRVWA8_GRVWB16_GSU0_GSUC0_GSUWGMRR0_K1_LBSPPA128_LBSPPB128_LPA8_LPB16_LRVW8_MIWT1_1_PLR1_SU0_SUM0_SUS128_VWA1_VWB1_WGM6_WGMXCC1_WGMXCCGn1
    SolutionIndex: 97
    SolutionNameMin: Cijk_Alik_Bljk_B8NBS_BH_Bias_HAS_SAV_UserArgs_MT32x32x128_MI16x16x1_SN_LDSB0_CLR1_GRVWA8_GRVWB8_GSU0_GSUC0_GSUWGMRR0_K1_LBSPPA128_LBSPPB128_LPA8_LPB8_LRVW8_MIWT1_1_PLR1_SU0_SUM0_SUS128_VWA1_VWB1_WGM8_WGMXCC1_WGMXCCGn1
    SolutionIndex: 98
    SolutionNameMin: Cijk_Alik_Bljk_B8NBS_BH_Bias_HAS_SAV_UserArgs_MT32x32x128_MI16x16x1_SN_LDSB0_CLR1_GRVWA16_GRVWB8_GSU0_GSUC0_GSUWGMRR0_K1_LBSPPA128_LBSPPB128_LPA16_LPB8_LRVW8_MIWT1_1_PLR1_SU0_SUM0_SUS128_VWA1_VWB1_WGM8_WGMXCC1_WGMXCCGn1
    SolutionIndex: 99
    SolutionNameMin: Cijk_Alik_Bljk_B8NBS_BH_Bias_HAS_SAV_UserArgs_MT64x128x256_MI16x16x1_SN_LDSB1_CLR1_GRVWA8_GRVWB8_GSU0_GSUC0_GSUWGMRR0_K1_LBSPPA512_LBSPPB1024_LPA8_LPB8_LRVW8_MIWT2_4_PLR1_SU0_SUM0_SUS256_VWA2_VWB4_WGM1_WGMXCC1_WGMXCCGn1
    SolutionIndex: 100
    SolutionNameMin: Cijk_Alik_Bljk_B8NBS_BH_Bias_HAS_SAV_UserArgs_MT128x64x256_MI16x16x1_SN_LDSB1_CLR1_GRVWA8_GRVWB16_GSU0_GSUC0_GSUWGMRR0_K1_LBSPPA1024_LBSPPB512_LPA8_LPB16_LRVW8_MIWT4_2_PLR1_SU0_SUM0_SUS256_VWA4_VWB2_WGM1_WGMXCC1_WGMXCCGn1
    SolutionIndex: 101
    SolutionNameMin: Cijk_Alik_Bljk_B8NBS_BH_Bias_HAS_SAV_UserArgs_MT128x64x256_MI16x16x1_SN_LDSB1_CLR1_GRVWA8_GRVWB16_GSU0_GSUC0_GSUWGMRR0_K1_LBSPPA1024_LBSPPB512_LPA8_LPB16_LRVW8_MIWT4_2_PLR1_SU0_SUM0_SUS256_VWA4_VWB2_WGM4_WGMXCC1_WGMXCCGn1
    SolutionIndex: 102
    SolutionNameMin: Cijk_Alik_Bljk_B8NBS_BH_Bias_HAS_SAV_UserArgs_MT128x64x256_MI16x16x1_SN_LDSB1_CLR1_GRVWA8_GRVWB16_GSU0_GSUC0_GSUWGMRR0_K1_LBSPPA1024_LBSPPB512_LPA8_LPB16_LRVW8_MIWT4_2_PLR1_SU0_SUM0_SUS256_VWA4_VWB2_WGM6_WGMXCC1_WGMXCCGn1
    SolutionIndex: 103
    SolutionNameMin: Cijk_Alik_Bljk_B8NBS_BH_Bias_HAS_SAV_UserArgs_MT128x64x256_MI16x16x1_SN_LDSB1_CLR1_GRVWA8_GRVWB16_GSU0_GSUC0_GSUWGMRR0_K1_LBSPPA1024_LBSPPB512_LPA8_LPB16_LRVW8_MIWT4_2_PLR1_SU0_SUM0_SUS256_VWA4_VWB2_WGM8_WGMXCC1_WGMXCCGn1
    SolutionIndex: 104
    SolutionNameMin: Cijk_Alik_Bljk_B8NBS_BH_Bias_HAS_SAV_UserArgs_MT64x64x256_MI16x16x1_SN_LDSB1_CLR1_GRVWA8_GRVWB16_GSU0_GSUC0_GSUWGMRR0_K1_LBSPPA512_LBSPPB512_LPA8_LPB16_LRVW8_MIWT2_2_PLR1_SU0_SUM0_SUS256_VWA2_VWB2_WGM1_WGMXCC1_WGMXCCGn1
    SolutionIndex: 105
    SolutionNameMin: Cijk_Alik_Bljk_B8NBS_BH_Bias_HAS_SAV_UserArgs_MT64x64x256_MI16x16x1_SN_LDSB1_CLR1_GRVWA8_GRVWB16_GSU0_GSUC0_GSUWGMRR0_K1_LBSPPA512_LBSPPB512_LPA8_LPB16_LRVW8_MIWT2_2_PLR1_SU0_SUM0_SUS256_VWA2_VWB2_WGM4_WGMXCC1_WGMXCCGn1
    SolutionIndex: 106
    SolutionNameMin: Cijk_Alik_Bljk_B8NBS_BH_Bias_HAS_SAV_UserArgs_MT64x64x256_MI16x16x1_SN_LDSB1_CLR1_GRVWA8_GRVWB16_GSU0_GSUC0_GSUWGMRR0_K1_LBSPPA512_LBSPPB512_LPA8_LPB16_LRVW8_MIWT2_2_PLR1_SU0_SUM0_SUS256_VWA2_VWB2_WGM6_WGMXCC1_WGMXCCGn1
    SolutionIndex: 107
    SolutionNameMin: Cijk_Alik_Bljk_B8NBS_BH_Bias_HAS_SAV_UserArgs_MT32x32x256_MI16x16x1_SN_LDSB1_CLR1_GRVWA8_GRVWB16_GSU0_GSUC0_GSUWGMRR0_K1_LBSPPA256_LBSPPB256_LPA8_LPB16_LRVW8_MIWT1_1_PLR1_SU0_SUM0_SUS256_VWA1_VWB1_WGM1_WGMXCC1_WGMXCCGn1
    SolutionIndex: 108
    SolutionNameMin: Cijk_Alik_Bljk_B8NBS_BH_Bias_HAS_SAV_UserArgs_MT32x32x256_MI16x16x1_SN_LDSB1_CLR1_GRVWA8_GRVWB16_GSU0_GSUC0_GSUWGMRR0_K1_LBSPPA256_LBSPPB256_LPA8_LPB16_LRVW8_MIWT1_1_PLR1_SU0_SUM0_SUS256_VWA1_VWB1_WGM4_WGMXCC1_WGMXCCGn1
    SolutionIndex: 109
    SolutionNameMin: Cijk_Alik_Bljk_B8NBS_BH_Bias_HAS_SAV_UserArgs_MT128x64x32_MI16x16x1_SN_LDSB0_CLR0_GRVWA16_GRVWB8_GSU0_GSUC0_GSUWGMRR0_K1_LBSPPA128_LBSPPB128_LPA16_LPB8_LRVW8_MIWT4_2_PLR0_SU32_SUM0_SUS256_VWA4_VWB2_WGM1_WGMXCC1_WGMXCCGn1
- - - [128, 128, 1, 128, 128, 128, 128, 128]
    - [88, 0.6]
  - - [128, 128, 1, 256, 128, 128, 256, 256]
    - [34, 1.07]
  - - [128, 128, 1, 512, 128, 128, 512, 512]
    - [89, 1.99]
  - - [128, 128, 1, 1024, 128, 128, 1024, 1024]
    - [107, 3.33]
  - - [128, 128, 1, 2048, 128, 128, 2048, 2048]
    - [88, 5.15]
  - - [128, 128, 1, 4096, 128, 128, 4096, 4096]
    - [88, 7.03]
  - - [128, 128, 1, 8192, 128, 128, 8192, 8192]
    - [88, 8.66]
  - - [128, 256, 1, 128, 128, 128, 128, 128]
    - [88, 1.19]
  - - [128, 256, 1, 256, 128, 128, 256, 256]
    - [32, 2.22]
  - - [128, 256, 1, 512, 128, 128, 512, 512]
    - [91, 4.03]
  - - [128, 256, 1, 1024, 128, 128, 1024, 1024]
    - [90, 6.68]
  - - [128, 256, 1, 2048, 128, 128, 2048, 2048]
    - [88, 10.43]
  - - [128, 256, 1, 4096, 128, 128, 4096, 4096]
    - [88, 14.12]
  - - [128, 256, 1, 8192, 128, 128, 8192, 8192]
    - [88, 17.32]
  - - [128, 512, 1, 128, 128, 128, 128, 128]
    - [91, 2.37]
  - - [128, 512, 1, 256, 128, 128, 256, 256]
    - [90, 4.48]
  - - [128, 512, 1, 512, 128, 128, 512, 512]
    - [89, 8.18]
  - - [128, 512, 1, 1024, 128, 128, 1024, 1024]
    - [88, 13.66]
  - - [128, 512, 1, 2048, 128, 128, 2048, 2048]
    - [88, 21.02]
  - - [128, 512, 1, 4096, 128, 128, 4096, 4096]
    - [88, 28.12]
  - - [128, 512, 1, 8192, 128, 128, 8192, 8192]
    - [92, 33.93]
  - - [128, 1024, 1, 128, 128, 128, 128, 128]
    - [91, 4.8]
  - - [128, 1024, 1, 256, 128, 128, 256, 256]
    - [90, 9.06]
  - - [128, 1024, 1, 512, 128, 128, 512, 512]
    - [89, 16.12]
  - - [128, 1024, 1, 1024, 128, 128, 1024, 1024]
    - [90, 26.56]
  - - [128, 1024, 1, 2048, 128, 128, 2048, 2048]
    - [88, 40.62]
  - - [128, 1024, 1, 4096, 128, 128, 4096, 4096]
    - [88, 55.0]
  - - [128, 1024, 1, 8192, 128, 128, 8192, 8192]
    - [88, 66.72]
  - - [128, 2048, 1, 128, 128, 128, 128, 128]
    - [79, 8.62]
  - - [128, 2048, 1, 256, 128, 128, 256, 256]
    - [85, 16.02]
  - - [128, 2048, 1, 512, 128, 128, 512, 512]
    - [86, 27.95]
  - - [128, 2048, 1, 1024, 128, 128, 1024, 1024]
    - [77, 45.85]
  - - [128, 2048, 1, 2048, 128, 128, 2048, 2048]
    - [78, 66.78]
  - - [128, 2048, 1, 4096, 128, 128, 4096, 4096]
    - [77, 87.13]
  - - [128, 2048, 1, 8192, 128, 128, 8192, 8192]
    - [84, 100.8]
  - - [128, 4096, 1, 128, 128, 128, 128, 128]
    - [25, 15.71]
  - - [128, 4096, 1, 256, 128, 128, 256, 256]
    - [26, 28.33]
  - - [128, 4096, 1, 512, 128, 128, 512, 512]
    - [74, 47.76]
  - - [128, 4096, 1, 1024, 128, 128, 1024, 1024]
    - [73, 74.11]
  - - [128, 4096, 1, 2048, 128, 128, 2048, 2048]
    - [74, 103.76]
  - - [128, 4096, 1, 4096, 128, 128, 4096, 4096]
    - [74, 129.87]
  - - [128, 4096, 1, 8192, 128, 128, 8192, 8192]
    - [104, 140.3]
  - - [128, 8192, 1, 128, 128, 128, 128, 128]
    - [14, 25.35]
  - - [128, 8192, 1, 256, 128, 128, 256, 256]
    - [19, 45.94]
  - - [128, 8192, 1, 512, 128, 128, 512, 512]
    - [19, 77.31]
  - - [128, 8192, 1, 1024, 128, 128, 1024, 1024]
    - [19, 116.5]
  - - [128, 8192, 1, 2048, 128, 128, 2048, 2048]
    - [19, 155.9]
  - - [128, 8192, 1, 4096, 128, 128, 4096, 4096]
    - [74, 164.1]
  - - [128, 8192, 1, 8192, 128, 128, 8192, 8192]
    - [100, 183.84]
  - - [256, 128, 1, 128, 256, 256, 128, 128]
    - [29, 1.12]
  - - [256, 128, 1, 256, 256, 256, 256, 256]
    - [96, 1.98]
  - - [256, 128, 1, 512, 256, 256, 512, 512]
    - [88, 3.96]
  - - [256, 128, 1, 1024, 256, 256, 1024, 1024]
    - [88, 6.74]
  - - [256, 128, 1, 2048, 256, 256, 2048, 2048]
    - [88, 10.36]
  - - [256, 128, 1, 4096, 256, 256, 4096, 4096]
    - [88, 14.01]
  - - [256, 128, 1, 8192, 256, 256, 8192, 8192]
    - [88, 17.14]
  - - [256, 256, 1, 128, 256, 256, 128, 128]
    - [30, 2.12]
  - - [256, 256, 1, 256, 256, 256, 256, 256]
    - [98, 4.1]
  - - [256, 256, 1, 512, 256, 256, 512, 512]
    - [88, 7.8]
  - - [256, 256, 1, 1024, 256, 256, 1024, 1024]
    - [91, 13.19]
  - - [256, 256, 1, 2048, 256, 256, 2048, 2048]
    - [88, 20.34]
  - - [256, 256, 1, 4096, 256, 256, 4096, 4096]
    - [88, 27.79]
  - - [256, 256, 1, 8192, 256, 256, 8192, 8192]
    - [88, 34.01]
  - - [256, 512, 1, 128, 256, 256, 128, 128]
    - [35, 4.49]
  - - [256, 512, 1, 256, 256, 256, 256, 256]
    - [95, 8.37]
  - - [256, 512, 1, 512, 256, 256, 512, 512]
    - [91, 15.72]
  - - [256, 512, 1, 1024, 256, 256, 1024, 1024]
    - [88, 26.58]
  - - [256, 512, 1, 2048, 256, 256, 2048, 2048]
    - [107, 40.0]
  - - [256, 512, 1, 4096, 256, 256, 4096, 4096]
    - [88, 55.08]
  - - [256, 512, 1, 8192, 256, 256, 8192, 8192]
    - [88, 66.95]
  - - [256, 1024, 1, 128, 256, 256, 128, 128]
    - [28, 8.42]
  - - [256, 1024, 1, 256, 256, 256, 256, 256]
    - [29, 15.67]
  - - [256, 1024, 1, 512, 256, 256, 512, 512]
    - [87, 28.1]
  - - [256, 1024, 1, 1024, 256, 256, 1024, 1024]
    - [84, 45.08]
  - - [256, 1024, 1, 2048, 256, 256, 2048, 2048]
    - [84, 66.78]
  - - [256, 1024, 1, 4096, 256, 256, 4096, 4096]
    - [77, 87.51]
  - - [256, 1024, 1, 8192, 256, 256, 8192, 8192]
    - [84, 101.58]
  - - [256, 2048, 1, 128, 256, 256, 128, 128]
    - [25, 15.18]
  - - [256, 2048, 1, 256, 256, 256, 256, 256]
    - [24, 28.37]
  - - [256, 2048, 1, 512, 256, 256, 512, 512]
    - [26, 47.51]
  - - [256, 2048, 1, 1024, 256, 256, 1024, 1024]
    - [73, 73.28]
  - - [256, 2048, 1, 2048, 256, 256, 2048, 2048]
    - [74, 103.23]
  - - [256, 2048, 1, 4096, 256, 256, 4096, 4096]
    - [74, 128.07]
  - - [256, 2048, 1, 8192, 256, 256, 8192, 8192]
    - [106, 139.97]
  - - [256, 4096, 1, 128, 256, 256, 128, 128]
    - [20, 25.42]
  - - [256, 4096, 1, 256, 256, 256, 256, 256]
    - [19, 45.64]
  - - [256, 4096, 1, 512, 256, 256, 512, 512]
    - [19, 76.75]
  - - [256, 4096, 1, 1024, 256, 256, 1024, 1024]
    - [19, 115.85]
  - - [256, 4096, 1, 2048, 256, 256, 2048, 2048]
    - [19, 156.6]
  - - [256, 4096, 1, 4096, 256, 256, 4096, 4096]
    - [100, 173.6]
  - - [256, 4096, 1, 8192, 256, 256, 8192, 8192]
    - [99, 188.44]
  - - [256, 8192, 1, 128, 256, 256, 128, 128]
    - [55, 39.01]
  - - [256, 8192, 1, 256, 256, 256, 256, 256]
    - [11, 69.7]
  - - [256, 8192, 1, 512, 256, 256, 512, 512]
    - [11, 115.11]
  - - [256, 8192, 1, 1024, 256, 256, 1024, 1024]
    - [11, 171.68]
  - - [256, 8192, 1, 2048, 256, 256, 2048, 2048]
    - [55, 215.02]
  - - [256, 8192, 1, 4096, 256, 256, 4096, 4096]
    - [66, 215.29]
  - - [256, 8192, 1, 8192, 256, 256, 8192, 8192]
    - [67, 242.34]
  - - [512, 128, 1, 128, 512, 512, 128, 128]
    - [33, 2.2]
  - - [512, 128, 1, 256, 512, 512, 256, 256]
    - [94, 4.14]
  - - [512, 128, 1, 512, 512, 512, 512, 512]
    - [88, 7.69]
  - - [512, 128, 1, 1024, 512, 512, 1024, 1024]
    - [88, 13.29]
  - - [512, 128, 1, 2048, 512, 512, 2048, 2048]
    - [88, 20.52]
  - - [512, 128, 1, 4096, 512, 512, 4096, 4096]
    - [88, 27.92]
  - - [512, 128, 1, 8192, 512, 512, 8192, 8192]
    - [88, 34.22]
  - - [512, 256, 1, 128, 512, 512, 128, 128]
    - [81, 4.18]
  - - [512, 256, 1, 256, 512, 512, 256, 256]
    - [93, 7.94]
  - - [512, 256, 1, 512, 512, 512, 512, 512]
    - [91, 15.53]
  - - [512, 256, 1, 1024, 512, 512, 1024, 1024]
    - [90, 25.84]
  - - [512, 256, 1, 2048, 512, 512, 2048, 2048]
    - [88, 40.4]
  - - [512, 256, 1, 4096, 512, 512, 4096, 4096]
    - [97, 54.0]
  - - [512, 256, 1, 8192, 512, 512, 8192, 8192]
    - [97, 66.15]
  - - [512, 512, 1, 128, 512, 512, 128, 128]
    - [31, 8.07]
  - - [512, 512, 1, 256, 512, 512, 256, 256]
    - [87, 15.61]
  - - [512, 512, 1, 512, 512, 512, 512, 512]
    - [87, 27.52]
  - - [512, 512, 1, 1024, 512, 512, 1024, 1024]
    - [77, 45.47]
  - - [512, 512, 1, 2048, 512, 512, 2048, 2048]
    - [77, 67.01]
  - - [512, 512, 1, 4096, 512, 512, 4096, 4096]
    - [77, 87.83]
  - - [512, 512, 1, 8192, 512, 512, 8192, 8192]
    - [108, 97.34]
  - - [512, 1024, 1, 128, 512, 512, 128, 128]
    - [25, 15.13]
  - - [512, 1024, 1, 256, 512, 512, 256, 256]
    - [25, 27.75]
  - - [512, 1024, 1, 512, 512, 512, 512, 512]
    - [74, 47.82]
  - - [512, 1024, 1, 1024, 512, 512, 1024, 1024]
    - [73, 73.04]
  - - [512, 1024, 1, 2048, 512, 512, 2048, 2048]
    - [74, 103.39]
  - - [512, 1024, 1, 4096, 512, 512, 4096, 4096]
    - [74, 128.83]
  - - [512, 1024, 1, 8192, 512, 512, 8192, 8192]
    - [104, 140.21]
  - - [512, 2048, 1, 128, 512, 512, 128, 128]
    - [14, 25.22]
  - - [512, 2048, 1, 256, 512, 512, 256, 256]
    - [19, 45.35]
  - - [512, 2048, 1, 512, 512, 512, 512, 512]
    - [19, 77.12]
  - - [512, 2048, 1, 1024, 512, 512, 1024, 1024]
    - [21, 117.31]
  - - [512, 2048, 1, 2048, 512, 512, 2048, 2048]
    - [19, 156.47]
  - - [512, 2048, 1, 4096, 512, 512, 4096, 4096]
    - [100, 175.97]
  - - [512, 2048, 1, 8192, 512, 512, 8192, 8192]
    - [100, 191.16]
  - - [512, 4096, 1, 128, 512, 512, 128, 128]
    - [55, 38.22]
  - - [512, 4096, 1, 256, 512, 512, 256, 256]
    - [11, 68.88]
  - - [512, 4096, 1, 512, 512, 512, 512, 512]
    - [11, 113.71]
  - - [512, 4096, 1, 1024, 512, 512, 1024, 1024]
    - [11, 172.78]
  - - [512, 4096, 1, 2048, 512, 512, 2048, 2048]
    - [55, 226.75]
  - - [512, 4096, 1, 4096, 512, 512, 4096, 4096]
    - [55, 221.4]
  - - [512, 4096, 1, 8192, 512, 512, 8192, 8192]
    - [55, 251.36]
  - - [512, 8192, 1, 128, 512, 512, 128, 128]
    - [60, 56.6]
  - - [512, 8192, 1, 256, 512, 512, 256, 256]
    - [60, 103.39]
  - - [512, 8192, 1, 512, 512, 512, 512, 512]
    - [60, 171.97]
  - - [512, 8192, 1, 1024, 512, 512, 1024, 1024]
    - [59, 226.59]
  - - [512, 8192, 1, 2048, 512, 512, 2048, 2048]
    - [59, 243.83]
  - - [512, 8192, 1, 4096, 512, 512, 4096, 4096]
    - [61, 274.61]
  - - [512, 8192, 1, 8192, 512, 512, 8192, 8192]
    - [60, 292.95]
  - - [1024, 128, 1, 128, 1024, 1024, 128, 128]
    - [32, 4.76]
  - - [1024, 128, 1, 256, 1024, 1024, 256, 256]
    - [89, 8.93]
  - - [1024, 128, 1, 512, 1024, 1024, 512, 512]
    - [88, 16.14]
  - - [1024, 128, 1, 1024, 1024, 1024, 1024, 1024]
    - [88, 26.97]
  - - [1024, 128, 1, 2048, 1024, 1024, 2048, 2048]
    - [88, 40.4]
  - - [1024, 128, 1, 4096, 1024, 1024, 4096, 4096]
    - [97, 54.63]
  - - [1024, 128, 1, 8192, 1024, 1024, 8192, 8192]
    - [94, 66.94]
  - - [1024, 256, 1, 128, 1024, 1024, 128, 128]
    - [87, 8.81]
  - - [1024, 256, 1, 256, 1024, 1024, 256, 256]
    - [85, 16.22]
  - - [1024, 256, 1, 512, 1024, 1024, 512, 512]
    - [85, 28.59]
  - - [1024, 256, 1, 1024, 1024, 1024, 1024, 1024]
    - [86, 46.47]
  - - [1024, 256, 1, 2048, 1024, 1024, 2048, 2048]
    - [78, 67.38]
  - - [1024, 256, 1, 4096, 1024, 1024, 4096, 4096]
    - [77, 87.27]
  - - [1024, 256, 1, 8192, 1024, 1024, 8192, 8192]
    - [80, 100.35]
  - - [1024, 512, 1, 128, 1024, 1024, 128, 128]
    - [74, 14.77]
  - - [1024, 512, 1, 256, 1024, 1024, 256, 256]
    - [25, 27.59]
  - - [1024, 512, 1, 512, 1024, 1024, 512, 512]
    - [74, 46.72]
  - - [1024, 512, 1, 1024, 1024, 1024, 1024, 1024]
    - [73, 73.02]
  - - [1024, 512, 1, 2048, 1024, 1024, 2048, 2048]
    - [73, 101.99]
  - - [1024, 512, 1, 4096, 1024, 1024, 4096, 4096]
    - [75, 126.85]
  - - [1024, 512, 1, 8192, 1024, 1024, 8192, 8192]
    - [105, 139.68]
  - - [1024, 1024, 1, 128, 1024, 1024, 128, 128]
    - [16, 24.75]
  - - [1024, 1024, 1, 256, 1024, 1024, 256, 256]
    - [18, 45.48]
  - - [1024, 1024, 1, 512, 1024, 1024, 512, 512]
    - [19, 76.42]
  - - [1024, 1024, 1, 1024, 1024, 1024, 1024, 1024]
    - [19, 115.7]
  - - [1024, 1024, 1, 2048, 1024, 1024, 2048, 2048]
    - [22, 153.99]
  - - [1024, 1024, 1, 4096, 1024, 1024, 4096, 4096]
    - [103, 171.84]
  - - [1024, 1024, 1, 8192, 1024, 1024, 8192, 8192]
    - [102, 189.35]
  - - [1024, 2048, 1, 128, 1024, 1024, 128, 128]
    - [55, 38.75]
  - - [1024, 2048, 1, 256, 1024, 1024, 256, 256]
    - [11, 69.57]
  - - [1024, 2048, 1, 512, 1024, 1024, 512, 512]
    - [11, 114.67]
  - - [1024, 2048, 1, 1024, 1024, 1024, 1024, 1024]
    - [11, 171.64]
  - - [1024, 2048, 1, 2048, 1024, 1024, 2048, 2048]
    - [55, 220.43]
  - - [1024, 2048, 1, 4096, 1024, 1024, 4096, 4096]
    - [65, 226.9]
  - - [1024, 2048, 1, 8192, 1024, 1024, 8192, 8192]
    - [57, 244.92]
  - - [1024, 4096, 1, 128, 1024, 1024, 128, 128]
    - [9, 54.86]
  - - [1024, 4096, 1, 256, 1024, 1024, 256, 256]
    - [9, 95.5]
  - - [1024, 4096, 1, 512, 1024, 1024, 512, 512]
    - [6, 153.94]
  - - [1024, 4096, 1, 1024, 1024, 1024, 1024, 1024]
    - [6, 204.2]
  - - [1024, 4096, 1, 2048, 1024, 1024, 2048, 2048]
    - [46, 238.1]
  - - [1024, 4096, 1, 4096, 1024, 1024, 4096, 4096]
    - [47, 265.29]
  - - [1024, 4096, 1, 8192, 1024, 1024, 8192, 8192]
    - [46, 266.24]
  - - [1024, 8192, 1, 128, 1024, 1024, 128, 128]
    - [45, 72.55]
  - - [1024, 8192, 1, 256, 1024, 1024, 256, 256]
    - [41, 126.53]
  - - [1024, 8192, 1, 512, 1024, 1024, 512, 512]
    - [44, 194.95]
  - - [1024, 8192, 1, 1024, 1024, 1024, 1024, 1024]
    - [43, 240.95]
  - - [1024, 8192, 1, 2048, 1024, 1024, 2048, 2048]
    - [43, 307.36]
  - - [1024, 8192, 1, 4096, 1024, 1024, 4096, 4096]
    - [40, 342.84]
  - - [1024, 8192, 1, 8192, 1024, 1024, 8192, 8192]
    - [38, 357.24]
  - - [2048, 128, 1, 128, 2048, 2048, 128, 128]
    - [86, 8.81]
  - - [2048, 128, 1, 256, 2048, 2048, 256, 256]
    - [83, 15.09]
  - - [2048, 128, 1, 512, 2048, 2048, 512, 512]
    - [85, 27.29]
  - - [2048, 128, 1, 1024, 2048, 2048, 1024, 1024]
    - [84, 45.97]
  - - [2048, 128, 1, 2048, 2048, 2048, 2048, 2048]
    - [84, 67.32]
  - - [2048, 128, 1, 4096, 2048, 2048, 4096, 4096]
    - [77, 87.45]
  - - [2048, 128, 1, 8192, 2048, 2048, 8192, 8192]
    - [82, 99.71]
  - - [2048, 256, 1, 128, 2048, 2048, 128, 128]
    - [26, 15.32]
  - - [2048, 256, 1, 256, 2048, 2048, 256, 256]
    - [27, 27.81]
  - - [2048, 256, 1, 512, 2048, 2048, 512, 512]
    - [74, 47.17]
  - - [2048, 256, 1, 1024, 2048, 2048, 1024, 1024]
    - [74, 74.07]
  - - [2048, 256, 1, 2048, 2048, 2048, 2048, 2048]
    - [74, 102.58]
  - - [2048, 256, 1, 4096, 2048, 2048, 4096, 4096]
    - [75, 126.76]
  - - [2048, 256, 1, 8192, 2048, 2048, 8192, 8192]
    - [106, 140.65]
  - - [2048, 512, 1, 128, 2048, 2048, 128, 128]
    - [17, 25.26]
  - - [2048, 512, 1, 256, 2048, 2048, 256, 256]
    - [15, 46.11]
  - - [2048, 512, 1, 512, 2048, 2048, 512, 512]
    - [15, 76.73]
  - - [2048, 512, 1, 1024, 2048, 2048, 1024, 1024]
    - [22, 114.83]
  - - [2048, 512, 1, 2048, 2048, 2048, 2048, 2048]
    - [22, 153.25]
  - - [2048, 512, 1, 4096, 2048, 2048, 4096, 4096]
    - [72, 172.59]
  - - [2048, 512, 1, 8192, 2048, 2048, 8192, 8192]
    - [102, 188.93]
  - - [2048, 1024, 1, 128, 2048, 2048, 128, 128]
    - [55, 38.54]
  - - [2048, 1024, 1, 256, 2048, 2048, 256, 256]
    - [11, 68.76]
  - - [2048, 1024, 1, 512, 2048, 2048, 512, 512]
    - [11, 116.06]
  - - [2048, 1024, 1, 1024, 2048, 2048, 1024, 1024]
    - [11, 172.3]
  - - [2048, 1024, 1, 2048, 2048, 2048, 2048, 2048]
    - [56, 218.16]
  - - [2048, 1024, 1, 4096, 2048, 2048, 4096, 4096]
    - [56, 225.49]
  - - [2048, 1024, 1, 8192, 2048, 2048, 8192, 8192]
    - [57, 250.02]
  - - [2048, 2048, 1, 128, 2048, 2048, 128, 128]
    - [7, 52.41]
  - - [2048, 2048, 1, 256, 2048, 2048, 256, 256]
    - [6, 93.65]
  - - [2048, 2048, 1, 512, 2048, 2048, 512, 512]
    - [6, 145.28]
  - - [2048, 2048, 1, 1024, 2048, 2048, 1024, 1024]
    - [48, 195.04]
  - - [2048, 2048, 1, 2048, 2048, 2048, 2048, 2048]
    - [49, 236.88]
  - - [2048, 2048, 1, 4096, 2048, 2048, 4096, 4096]
    - [49, 262.98]
  - - [2048, 2048, 1, 8192, 2048, 2048, 8192, 8192]
    - [49, 264.33]
  - - [2048, 4096, 1, 128, 2048, 2048, 128, 128]
    - [0, 60.96]
  - - [2048, 4096, 1, 256, 2048, 2048, 256, 256]
    - [0, 105.56]
  - - [2048, 4096, 1, 512, 2048, 2048, 512, 512]
    - [1, 157.73]
  - - [2048, 4096, 1, 1024, 2048, 2048, 1024, 1024]
    - [2, 217.03]
  - - [2048, 4096, 1, 2048, 2048, 2048, 2048, 2048]
    - [2, 257.17]
  - - [2048, 4096, 1, 4096, 2048, 2048, 4096, 4096]
    - [40, 271.4]
  - - [2048, 4096, 1, 8192, 2048, 2048, 8192, 8192]
    - [44, 316.39]
  - - [2048, 8192, 1, 128, 2048, 2048, 128, 128]
    - [43, 72.92]
  - - [2048, 8192, 1, 256, 2048, 2048, 256, 256]
    - [39, 126.43]
  - - [2048, 8192, 1, 512, 2048, 2048, 512, 512]
    - [44, 191.02]
  - - [2048, 8192, 1, 1024, 2048, 2048, 1024, 1024]
    - [42, 261.1]
  - - [2048, 8192, 1, 2048, 2048, 2048, 2048, 2048]
    - [42, 307.23]
  - - [2048, 8192, 1, 4096, 2048, 2048, 4096, 4096]
    - [38, 324.36]
  - - [2048, 8192, 1, 8192, 2048, 2048, 8192, 8192]
    - [38, 363.96]
  - - [4096, 128, 1, 128, 4096, 4096, 128, 128]
    - [26, 15.36]
  - - [4096, 128, 1, 256, 4096, 4096, 256, 256]
    - [25, 27.87]
  - - [4096, 128, 1, 512, 4096, 4096, 512, 512]
    - [74, 47.31]
  - - [4096, 128, 1, 1024, 4096, 4096, 1024, 1024]
    - [74, 74.7]
  - - [4096, 128, 1, 2048, 4096, 4096, 2048, 2048]
    - [74, 103.43]
  - - [4096, 128, 1, 4096, 4096, 4096, 4096, 4096]
    - [76, 125.45]
  - - [4096, 128, 1, 8192, 4096, 4096, 8192, 8192]
    - [106, 140.34]
  - - [4096, 256, 1, 128, 4096, 4096, 128, 128]
    - [20, 25.82]
  - - [4096, 256, 1, 256, 4096, 4096, 256, 256]
    - [19, 46.5]
  - - [4096, 256, 1, 512, 4096, 4096, 512, 512]
    - [19, 78.83]
  - - [4096, 256, 1, 1024, 4096, 4096, 1024, 1024]
    - [22, 116.74]
  - - [4096, 256, 1, 2048, 4096, 4096, 2048, 2048]
    - [21, 155.14]
  - - [4096, 256, 1, 4096, 4096, 4096, 4096, 4096]
    - [102, 172.71]
  - - [4096, 256, 1, 8192, 4096, 4096, 8192, 8192]
    - [103, 189.74]
  - - [4096, 512, 1, 128, 4096, 4096, 128, 128]
    - [55, 38.88]
  - - [4096, 512, 1, 256, 4096, 4096, 256, 256]
    - [11, 69.89]
  - - [4096, 512, 1, 512, 4096, 4096, 512, 512]
    - [12, 114.01]
  - - [4096, 512, 1, 1024, 4096, 4096, 1024, 1024]
    - [13, 169.6]
  - - [4096, 512, 1, 2048, 4096, 4096, 2048, 2048]
    - [58, 218.3]
  - - [4096, 512, 1, 4096, 4096, 4096, 4096, 4096]
    - [56, 230.73]
  - - [4096, 512, 1, 8192, 4096, 4096, 8192, 8192]
    - [68, 250.53]
  - - [4096, 1024, 1, 128, 4096, 4096, 128, 128]
    - [9, 52.89]
  - - [4096, 1024, 1, 256, 4096, 4096, 256, 256]
    - [9, 93.2]
  - - [4096, 1024, 1, 512, 4096, 4096, 512, 512]
    - [5, 135.06]
  - - [4096, 1024, 1, 1024, 4096, 4096, 1024, 1024]
    - [47, 193.17]
  - - [4096, 1024, 1, 2048, 4096, 4096, 2048, 2048]
    - [49, 236.77]
  - - [4096, 1024, 1, 4096, 4096, 4096, 4096, 4096]
    - [49, 263.62]
  - - [4096, 1024, 1, 8192, 4096, 4096, 8192, 8192]
    - [37, 266.75]
  - - [4096, 2048, 1, 128, 4096, 4096, 128, 128]
    - [7, 58.91]
  - - [4096, 2048, 1, 256, 4096, 4096, 256, 256]
    - [6, 103.47]
  - - [4096, 2048, 1, 512, 4096, 4096, 512, 512]
    - [3, 156.72]
  - - [4096, 2048, 1, 1024, 4096, 4096, 1024, 1024]
    - [3, 217.42]
  - - [4096, 2048, 1, 2048, 4096, 4096, 2048, 2048]
    - [4, 260.57]
  - - [4096, 2048, 1, 4096, 4096, 4096, 4096, 4096]
    - [53, 274.19]
  - - [4096, 2048, 1, 8192, 4096, 4096, 8192, 8192]
    - [36, 312.51]
  - - [4096, 4096, 1, 128, 4096, 4096, 128, 128]
    - [6, 67.27]
  - - [4096, 4096, 1, 256, 4096, 4096, 256, 256]
    - [6, 115.3]
  - - [4096, 4096, 1, 512, 4096, 4096, 512, 512]
    - [3, 171.0]
  - - [4096, 4096, 1, 1024, 4096, 4096, 1024, 1024]
    - [56, 218.54]
  - - [4096, 4096, 1, 2048, 4096, 4096, 2048, 2048]
    - [44, 261.42]
  - - [4096, 4096, 1, 4096, 4096, 4096, 4096, 4096]
    - [50, 286.71]
  - - [4096, 4096, 1, 8192, 4096, 4096, 8192, 8192]
    - [36, 337.61]
  - - [4096, 8192, 1, 128, 4096, 4096, 128, 128]
    - [39, 81.24]
  - - [4096, 8192, 1, 256, 4096, 4096, 256, 256]
    - [39, 138.3]
  - - [4096, 8192, 1, 512, 4096, 4096, 512, 512]
    - [45, 202.74]
  - - [4096, 8192, 1, 1024, 4096, 4096, 1024, 1024]
    - [44, 249.91]
  - - [4096, 8192, 1, 2048, 4096, 4096, 2048, 2048]
    - [40, 292.21]
  - - [4096, 8192, 1, 4096, 4096, 4096, 4096, 4096]
    - [40, 330.43]
  - - [4096, 8192, 1, 8192, 4096, 4096, 8192, 8192]
    - [44, 381.78]
  - - [8192, 128, 1, 128, 8192, 8192, 128, 128]
    - [14, 26.0]
  - - [8192, 128, 1, 256, 8192, 8192, 256, 256]
    - [14, 47.03]
  - - [8192, 128, 1, 512, 8192, 8192, 512, 512]
    - [19, 78.58]
  - - [8192, 128, 1, 1024, 8192, 8192, 1024, 1024]
    - [23, 114.27]
  - - [8192, 128, 1, 2048, 8192, 8192, 2048, 2048]
    - [71, 148.7]
  - - [8192, 128, 1, 4096, 8192, 8192, 4096, 4096]
    - [102, 165.17]
  - - [8192, 128, 1, 8192, 8192, 8192, 8192, 8192]
    - [101, 186.95]
  - - [8192, 256, 1, 128, 8192, 8192, 128, 128]
    - [13, 38.27]
  - - [8192, 256, 1, 256, 8192, 8192, 256, 256]
    - [13, 68.67]
  - - [8192, 256, 1, 512, 8192, 8192, 512, 512]
    - [12, 114.63]
  - - [8192, 256, 1, 1024, 8192, 8192, 1024, 1024]
    - [13, 170.55]
  - - [8192, 256, 1, 2048, 8192, 8192, 2048, 2048]
    - [58, 211.92]
  - - [8192, 256, 1, 4096, 8192, 8192, 4096, 4096]
    - [69, 223.65]
  - - [8192, 256, 1, 8192, 8192, 8192, 8192, 8192]
    - [70, 249.37]
  - - [8192, 512, 1, 128, 8192, 8192, 128, 128]
    - [10, 51.88]
  - - [8192, 512, 1, 256, 8192, 8192, 256, 256]
    - [8, 91.51]
  - - [8192, 512, 1, 512, 8192, 8192, 512, 512]
    - [62, 151.01]
  - - [8192, 512, 1, 1024, 8192, 8192, 1024, 1024]
    - [63, 222.36]
  - - [8192, 512, 1, 2048, 8192, 8192, 2048, 2048]
    - [62, 241.27]
  - - [8192, 512, 1, 4096, 8192, 8192, 4096, 4096]
    - [64, 292.62]
  - - [8192, 512, 1, 8192, 8192, 8192, 8192, 8192]
    - [63, 309.28]
  - - [8192, 1024, 1, 128, 8192, 8192, 128, 128]
    - [53, 59.78]
  - - [8192, 1024, 1, 256, 8192, 8192, 256, 256]
    - [53, 107.37]
  - - [8192, 1024, 1, 512, 8192, 8192, 512, 512]
    - [51, 175.68]
  - - [8192, 1024, 1, 1024, 8192, 8192, 1024, 1024]
    - [2, 214.62]
  - - [8192, 1024, 1, 2048, 8192, 8192, 2048, 2048]
    - [52, 296.24]
  - - [8192, 1024, 1, 4096, 8192, 8192, 4096, 4096]
    - [51, 354.9]
  - - [8192, 1024, 1, 8192, 8192, 8192, 8192, 8192]
    - [51, 387.98]
  - - [8192, 2048, 1, 128, 8192, 8192, 128, 128]
    - [54, 68.16]
  - - [8192, 2048, 1, 256, 8192, 8192, 256, 256]
    - [54, 118.46]
  - - [8192, 2048, 1, 512, 8192, 8192, 512, 512]
    - [54, 176.13]
  - - [8192, 2048, 1, 1024, 8192, 8192, 1024, 1024]
    - [53, 250.45]
  - - [8192, 2048, 1, 2048, 8192, 8192, 2048, 2048]
    - [54, 313.76]
  - - [8192, 2048, 1, 4096, 8192, 8192, 4096, 4096]
    - [54, 340.19]
  - - [8192, 2048, 1, 8192, 8192, 8192, 8192, 8192]
    - [53, 397.27]
  - - [8192, 4096, 1, 128, 8192, 8192, 128, 128]
    - [54, 72.58]
  - - [8192, 4096, 1, 256, 8192, 8192, 256, 256]
    - [54, 121.71]
  - - [8192, 4096, 1, 512, 8192, 8192, 512, 512]
    - [53, 177.54]
  - - [8192, 4096, 1, 1024, 8192, 8192, 1024, 1024]
    - [52, 235.67]
  - - [8192, 4096, 1, 2048, 8192, 8192, 2048, 2048]
    - [53, 298.15]
  - - [8192, 4096, 1, 4096, 8192, 8192, 4096, 4096]
    - [53, 347.11]
  - - [8192, 4096, 1, 8192, 8192, 8192, 8192, 8192]
    - [53, 419.98]
  - - [8192, 8192, 1, 128, 8192, 8192, 128, 128]
    - [39, 71.69]
  - - [8192, 8192, 1, 256, 8192, 8192, 256, 256]
    - [43, 118.93]
  - - [8192, 8192, 1, 512, 8192, 8192, 512, 512]
    - [38, 170.29]
  - - [8192, 8192, 1, 1024, 8192, 8192, 1024, 1024]
    - [40, 239.04]
  - - [8192, 8192, 1, 2048, 8192, 8192, 2048, 2048]
    - [53, 298.98]
  - - [8192, 8192, 1, 4096, 8192, 8192, 4096, 4096]
    - [53, 354.86]
  - - [8192, 8192, 1, 8192, 8192, 8192, 8192, 8192]
    - [54, 412.51]
  - - [1, 1, 1, 32, 1, 1, 32, 32]
    - [109, 0.0]
- null
- null
- ExperimentalStreamK
- GridBased
