projects/hipblaslt/library/src/amd_detail/rocblaslt/src/Tensile/Logic/asm_full/aquavanjaram/gfx942_228cu/StreamK/aquavanjaram942_Cijk_Alik_Bjlk_F8B8NB8NS_BH_Bias_HAS_SAV_UserArgs.yaml
- {MinimumRequiredVersion: 4.33.0}
- aquavanjaram942
- {Architecture: gfx942, CUCount: 228}
- [Device 0049, Device 0050]
    SolutionIndex: 0
    SolutionNameMin: Cijk_Alik_Bjlk_F8B8NB8NS_BH_Bias_HAS_SAV_UserArgs_MT256x256x64_MI16x16x1_SN_LDSB1_CLR1_GRVWA8_GRVWB8_GSU0_GSUC0_GSUWGMRR0_K1_LBSPPA512_LBSPPB2048_LPA8_LPB0_LRVW8_MIWT8_8_PLR1_SU0_SUM0_SUS64_VWA8_VWB8_WGM1_WGMXCC1_WGMXCCGn1
    SolutionIndex: 1
    SolutionNameMin: Cijk_Alik_Bjlk_F8B8NB8NS_BH_Bias_HAS_SAV_UserArgs_MT256x256x64_MI16x16x1_SN_LDSB1_CLR1_GRVWA16_GRVWB8_GSU0_GSUC0_GSUWGMRR0_K1_LBSPPA512_LBSPPB2048_LPA16_LPB0_LRVW8_MIWT8_8_PLR1_SU0_SUM0_SUS64_VWA8_VWB8_WGM1_WGMXCC1_WGMXCCGn1
    SolutionIndex: 2
    SolutionNameMin: Cijk_Alik_Bjlk_F8B8NB8NS_BH_Bias_HAS_SAV_UserArgs_MT256x256x64_MI16x16x1_SN_LDSB1_CLR1_GRVWA8_GRVWB16_GSU0_GSUC0_GSUWGMRR0_K1_LBSPPA512_LBSPPB2048_LPA8_LPB0_LRVW8_MIWT8_8_PLR1_SU0_SUM0_SUS64_VWA8_VWB8_WGM1_WGMXCC1_WGMXCCGn1
    SolutionIndex: 3
    SolutionNameMin: Cijk_Alik_Bjlk_F8B8NB8NS_BH_Bias_HAS_SAV_UserArgs_MT256x256x64_MI16x16x1_SN_LDSB1_CLR1_GRVWA8_GRVWB16_GSU0_GSUC0_GSUWGMRR0_K1_LBSPPA512_LBSPPB2048_LPA8_LPB0_LRVW8_MIWT8_8_PLR1_SU0_SUM0_SUS64_VWA8_VWB8_WGM4_WGMXCC1_WGMXCCGn1
    SolutionIndex: 4
    SolutionNameMin: Cijk_Alik_Bjlk_F8B8NB8NS_BH_Bias_HAS_SAV_UserArgs_MT256x256x64_MI16x16x1_SN_LDSB1_CLR1_GRVWA16_GRVWB16_GSU0_GSUC0_GSUWGMRR0_K1_LBSPPA512_LBSPPB2048_LPA16_LPB0_LRVW8_MIWT8_8_PLR1_SU0_SUM0_SUS64_VWA8_VWB8_WGM4_WGMXCC1_WGMXCCGn1
    SolutionIndex: 5
    SolutionNameMin: Cijk_Alik_Bjlk_F8B8NB8NS_BH_Bias_HAS_SAV_UserArgs_MT256x256x64_MI16x16x1_SN_LDSB1_CLR1_GRVWA8_GRVWB8_GSU0_GSUC0_GSUWGMRR0_K1_LBSPPA512_LBSPPB2048_LPA8_LPB0_LRVW8_MIWT8_8_PLR1_SU0_SUM0_SUS64_VWA8_VWB8_WGM6_WGMXCC1_WGMXCCGn1
    SolutionIndex: 6
    SolutionNameMin: Cijk_Alik_Bjlk_F8B8NB8NS_BH_Bias_HAS_SAV_UserArgs_MT256x256x64_MI16x16x1_SN_LDSB1_CLR1_GRVWA8_GRVWB16_GSU0_GSUC0_GSUWGMRR0_K1_LBSPPA512_LBSPPB2048_LPA8_LPB0_LRVW8_MIWT8_8_PLR1_SU0_SUM0_SUS64_VWA8_VWB8_WGM6_WGMXCC1_WGMXCCGn1
    SolutionIndex: 7
    SolutionNameMin: Cijk_Alik_Bjlk_F8B8NB8NS_BH_Bias_HAS_SAV_UserArgs_MT256x256x64_MI16x16x1_SN_LDSB1_CLR1_GRVWA16_GRVWB16_GSU0_GSUC0_GSUWGMRR0_K1_LBSPPA512_LBSPPB2048_LPA16_LPB0_LRVW8_MIWT8_8_PLR1_SU0_SUM0_SUS64_VWA8_VWB8_WGM6_WGMXCC1_WGMXCCGn1
    SolutionIndex: 8
    SolutionNameMin: Cijk_Alik_Bjlk_F8B8NB8NS_BH_Bias_HAS_SAV_UserArgs_MT256x256x64_MI16x16x1_SN_LDSB1_CLR1_GRVWA16_GRVWB8_GSU0_GSUC0_GSUWGMRR0_K1_LBSPPA512_LBSPPB2048_LPA16_LPB0_LRVW8_MIWT8_8_PLR1_SU0_SUM0_SUS64_VWA8_VWB8_WGM8_WGMXCC1_WGMXCCGn1
    SolutionIndex: 9
    SolutionNameMin: Cijk_Alik_Bjlk_F8B8NB8NS_BH_Bias_HAS_SAV_UserArgs_MT256x256x64_MI16x16x1_SN_LDSB1_CLR1_GRVWA8_GRVWB16_GSU0_GSUC0_GSUWGMRR0_K1_LBSPPA512_LBSPPB2048_LPA8_LPB0_LRVW8_MIWT8_8_PLR1_SU0_SUM0_SUS64_VWA8_VWB8_WGM8_WGMXCC1_WGMXCCGn1
    SolutionIndex: 10
    SolutionNameMin: Cijk_Alik_Bjlk_F8B8NB8NS_BH_Bias_HAS_SAV_UserArgs_MT256x256x64_MI16x16x1_SN_LDSB1_CLR1_GRVWA16_GRVWB16_GSU0_GSUC0_GSUWGMRR0_K1_LBSPPA512_LBSPPB2048_LPA16_LPB0_LRVW8_MIWT8_8_PLR1_SU0_SUM0_SUS64_VWA8_VWB8_WGM8_WGMXCC1_WGMXCCGn1
    SolutionIndex: 11
    SolutionNameMin: Cijk_Alik_Bjlk_F8B8NB8NS_BH_Bias_HAS_SAV_UserArgs_MT128x256x64_MI16x16x1_SN_LDSB1_CLR1_GRVWA16_GRVWB16_GSU0_GSUC0_GSUWGMRR0_K1_LBSPPA256_LBSPPB2048_LPA16_LPB0_LRVW8_MIWT4_8_PLR1_SU0_SUM0_SUS64_VWA4_VWB8_WGM1_WGMXCC1_WGMXCCGn1
    SolutionIndex: 12
    SolutionNameMin: Cijk_Alik_Bjlk_F8B8NB8NS_BH_Bias_HAS_SAV_UserArgs_MT128x256x64_MI16x16x1_SN_LDSB1_CLR1_GRVWA16_GRVWB16_GSU0_GSUC0_GSUWGMRR0_K1_LBSPPA256_LBSPPB2048_LPA16_LPB0_LRVW8_MIWT4_8_PLR1_SU0_SUM0_SUS64_VWA4_VWB8_WGM4_WGMXCC1_WGMXCCGn1
    SolutionIndex: 13
    SolutionNameMin: Cijk_Alik_Bjlk_F8B8NB8NS_BH_Bias_HAS_SAV_UserArgs_MT128x256x64_MI16x16x1_SN_LDSB1_CLR1_GRVWA16_GRVWB16_GSU0_GSUC0_GSUWGMRR0_K1_LBSPPA256_LBSPPB2048_LPA16_LPB0_LRVW8_MIWT4_8_PLR1_SU0_SUM0_SUS64_VWA4_VWB8_WGM6_WGMXCC1_WGMXCCGn1
    SolutionIndex: 14
    SolutionNameMin: Cijk_Alik_Bjlk_F8B8NB8NS_BH_Bias_HAS_SAV_UserArgs_MT128x256x64_MI16x16x1_SN_LDSB1_CLR1_GRVWA8_GRVWB16_GSU0_GSUC0_GSUWGMRR0_K1_LBSPPA256_LBSPPB2048_LPA8_LPB0_LRVW8_MIWT4_8_PLR1_SU0_SUM0_SUS64_VWA4_VWB8_WGM8_WGMXCC1_WGMXCCGn1
    SolutionIndex: 15
    SolutionNameMin: Cijk_Alik_Bjlk_F8B8NB8NS_BH_Bias_HAS_SAV_UserArgs_MT256x128x64_MI16x16x1_SN_LDSB1_CLR1_GRVWA8_GRVWB8_GSU0_GSUC0_GSUWGMRR0_K1_LBSPPA512_LBSPPB1024_LPA8_LPB64_LRVW8_MIWT8_4_PLR1_SU0_SUM0_SUS64_VWA8_VWB4_WGM1_WGMXCC1_WGMXCCGn1
    SolutionIndex: 16
    SolutionNameMin: Cijk_Alik_Bjlk_F8B8NB8NS_BH_Bias_HAS_SAV_UserArgs_MT256x128x64_MI16x16x1_SN_LDSB1_CLR1_GRVWA16_GRVWB8_GSU0_GSUC0_GSUWGMRR0_K1_LBSPPA512_LBSPPB1024_LPA16_LPB64_LRVW8_MIWT8_4_PLR1_SU0_SUM0_SUS64_VWA8_VWB4_WGM1_WGMXCC1_WGMXCCGn1
    SolutionIndex: 17
    SolutionNameMin: Cijk_Alik_Bjlk_F8B8NB8NS_BH_Bias_HAS_SAV_UserArgs_MT256x128x64_MI16x16x1_SN_LDSB1_CLR1_GRVWA8_GRVWB16_GSU0_GSUC0_GSUWGMRR0_K1_LBSPPA512_LBSPPB1024_LPA8_LPB64_LRVW8_MIWT8_4_PLR1_SU0_SUM0_SUS64_VWA8_VWB4_WGM1_WGMXCC1_WGMXCCGn1
    SolutionIndex: 18
    SolutionNameMin: Cijk_Alik_Bjlk_F8B8NB8NS_BH_Bias_HAS_SAV_UserArgs_MT256x128x64_MI16x16x1_SN_LDSB1_CLR1_GRVWA8_GRVWB8_GSU0_GSUC0_GSUWGMRR0_K1_LBSPPA512_LBSPPB1024_LPA8_LPB64_LRVW8_MIWT8_4_PLR1_SU0_SUM0_SUS64_VWA8_VWB4_WGM4_WGMXCC1_WGMXCCGn1
    SolutionIndex: 19
    SolutionNameMin: Cijk_Alik_Bjlk_F8B8NB8NS_BH_Bias_HAS_SAV_UserArgs_MT256x128x64_MI16x16x1_SN_LDSB1_CLR1_GRVWA8_GRVWB16_GSU0_GSUC0_GSUWGMRR0_K1_LBSPPA512_LBSPPB1024_LPA8_LPB64_LRVW8_MIWT8_4_PLR1_SU0_SUM0_SUS64_VWA8_VWB4_WGM4_WGMXCC1_WGMXCCGn1
    SolutionIndex: 20
    SolutionNameMin: Cijk_Alik_Bjlk_F8B8NB8NS_BH_Bias_HAS_SAV_UserArgs_MT256x128x64_MI16x16x1_SN_LDSB1_CLR1_GRVWA16_GRVWB8_GSU0_GSUC0_GSUWGMRR0_K1_LBSPPA512_LBSPPB1024_LPA16_LPB64_LRVW8_MIWT8_4_PLR1_SU0_SUM0_SUS64_VWA8_VWB4_WGM8_WGMXCC1_WGMXCCGn1
    SolutionIndex: 21
    SolutionNameMin: Cijk_Alik_Bjlk_F8B8NB8NS_BH_Bias_HAS_SAV_UserArgs_MT128x128x64_MI16x16x1_SN_LDSB1_CLR1_GRVWA8_GRVWB16_GSU0_GSUC0_GSUWGMRR0_K1_LBSPPA512_LBSPPB1024_LPA8_LPB32_LRVW8_MIWT8_2_PLR1_SU0_SUM0_SUS64_VWA8_VWB2_WGM1_WGMXCC1_WGMXCCGn1
    SolutionIndex: 22
    SolutionNameMin: Cijk_Alik_Bjlk_F8B8NB8NS_BH_Bias_HAS_SAV_UserArgs_MT128x64x64_MI16x16x1_SN_LDSB0_CLR1_GRVWA8_GRVWB8_GSU0_GSUC0_GSUWGMRR0_K1_LBSPPA512_LBSPPB512_LPA8_LPB16_LRVW8_MIWT8_1_PLR1_SU0_SUM0_SUS64_VWA8_VWB1_WGM1_WGMXCC1_WGMXCCGn1
    SolutionIndex: 23
    SolutionNameMin: Cijk_Alik_Bjlk_F8B8NB8NS_BH_Bias_HAS_SAV_UserArgs_MT128x64x64_MI16x16x1_SN_LDSB0_CLR1_GRVWA8_GRVWB16_GSU0_GSUC0_GSUWGMRR0_K1_LBSPPA512_LBSPPB512_LPA8_LPB16_LRVW8_MIWT8_1_PLR1_SU0_SUM0_SUS64_VWA8_VWB1_WGM1_WGMXCC1_WGMXCCGn1
    SolutionIndex: 24
    SolutionNameMin: Cijk_Alik_Bjlk_F8B8NB8NS_BH_Bias_HAS_SAV_UserArgs_MT128x64x64_MI16x16x1_SN_LDSB0_CLR1_GRVWA8_GRVWB8_GSU0_GSUC0_GSUWGMRR0_K1_LBSPPA512_LBSPPB512_LPA8_LPB16_LRVW8_MIWT8_1_PLR1_SU0_SUM0_SUS64_VWA8_VWB1_WGM6_WGMXCC1_WGMXCCGn1
    SolutionIndex: 25
    SolutionNameMin: Cijk_Alik_Bjlk_F8B8NB8NS_BH_Bias_HAS_SAV_UserArgs_MT128x128x64_MI16x16x1_SN_LDSB1_CLR1_GRVWA8_GRVWB8_GSU0_GSUC0_GSUWGMRR0_K1_LBSPPA256_LBSPPB1024_LPA8_LPB64_LRVW8_MIWT4_4_PLR1_SU0_SUM0_SUS64_VWA4_VWB4_WGM1_WGMXCC1_WGMXCCGn1
    SolutionIndex: 26
    SolutionNameMin: Cijk_Alik_Bjlk_F8B8NB8NS_BH_Bias_HAS_SAV_UserArgs_MT128x128x64_MI16x16x1_SN_LDSB1_CLR1_GRVWA16_GRVWB8_GSU0_GSUC0_GSUWGMRR0_K1_LBSPPA256_LBSPPB1024_LPA16_LPB64_LRVW8_MIWT4_4_PLR1_SU0_SUM0_SUS64_VWA4_VWB4_WGM1_WGMXCC1_WGMXCCGn1
    SolutionIndex: 27
    SolutionNameMin: Cijk_Alik_Bjlk_F8B8NB8NS_BH_Bias_HAS_SAV_UserArgs_MT128x128x64_MI16x16x1_SN_LDSB1_CLR1_GRVWA8_GRVWB16_GSU0_GSUC0_GSUWGMRR0_K1_LBSPPA256_LBSPPB1024_LPA8_LPB64_LRVW8_MIWT4_4_PLR1_SU0_SUM0_SUS64_VWA4_VWB4_WGM1_WGMXCC1_WGMXCCGn1
    SolutionIndex: 28
    SolutionNameMin: Cijk_Alik_Bjlk_F8B8NB8NS_BH_Bias_HAS_SAV_UserArgs_MT128x64x64_MI16x16x1_SN_LDSB0_CLR1_GRVWA8_GRVWB8_GSU0_GSUC0_GSUWGMRR0_K1_LBSPPA256_LBSPPB512_LPA8_LPB32_LRVW8_MIWT4_2_PLR1_SU0_SUM0_SUS64_VWA4_VWB2_WGM1_WGMXCC1_WGMXCCGn1
    SolutionIndex: 29
    SolutionNameMin: Cijk_Alik_Bjlk_F8B8NB8NS_BH_Bias_HAS_SAV_UserArgs_MT128x64x64_MI16x16x1_SN_LDSB0_CLR1_GRVWA16_GRVWB8_GSU0_GSUC0_GSUWGMRR0_K1_LBSPPA256_LBSPPB512_LPA16_LPB32_LRVW8_MIWT4_2_PLR1_SU0_SUM0_SUS64_VWA4_VWB2_WGM1_WGMXCC1_WGMXCCGn1
    SolutionIndex: 30
    SolutionNameMin: Cijk_Alik_Bjlk_F8B8NB8NS_BH_Bias_HAS_SAV_UserArgs_MT128x64x64_MI16x16x1_SN_LDSB0_CLR1_GRVWA8_GRVWB16_GSU0_GSUC0_GSUWGMRR0_K1_LBSPPA256_LBSPPB512_LPA8_LPB32_LRVW8_MIWT4_2_PLR1_SU0_SUM0_SUS64_VWA4_VWB2_WGM1_WGMXCC1_WGMXCCGn1
    SolutionIndex: 31
    SolutionNameMin: Cijk_Alik_Bjlk_F8B8NB8NS_BH_Bias_HAS_SAV_UserArgs_MT128x64x64_MI16x16x1_SN_LDSB0_CLR1_GRVWA8_GRVWB16_GSU0_GSUC0_GSUWGMRR0_K1_LBSPPA256_LBSPPB512_LPA8_LPB32_LRVW8_MIWT4_2_PLR1_SU0_SUM0_SUS64_VWA4_VWB2_WGM4_WGMXCC1_WGMXCCGn1
    SolutionIndex: 32
    SolutionNameMin: Cijk_Alik_Bjlk_F8B8NB8NS_BH_Bias_HAS_SAV_UserArgs_MT128x64x64_MI16x16x1_SN_LDSB0_CLR1_GRVWA8_GRVWB16_GSU0_GSUC0_GSUWGMRR0_K1_LBSPPA256_LBSPPB512_LPA8_LPB32_LRVW8_MIWT4_2_PLR1_SU0_SUM0_SUS64_VWA4_VWB2_WGM8_WGMXCC1_WGMXCCGn1
    SolutionIndex: 33
    SolutionNameMin: Cijk_Alik_Bjlk_F8B8NB8NS_BH_Bias_HAS_SAV_UserArgs_MT128x32x64_MI16x16x1_SN_LDSB0_CLR1_GRVWA8_GRVWB8_GSU0_GSUC0_GSUWGMRR0_K1_LBSPPA256_LBSPPB256_LPA8_LPB16_LRVW8_MIWT4_1_PLR1_SU0_SUM0_SUS64_VWA4_VWB1_WGM1_WGMXCC1_WGMXCCGn1
    SolutionIndex: 34
    SolutionNameMin: Cijk_Alik_Bjlk_F8B8NB8NS_BH_Bias_HAS_SAV_UserArgs_MT64x64x64_MI16x16x1_SN_LDSB0_CLR1_GRVWA8_GRVWB8_GSU0_GSUC0_GSUWGMRR0_K1_LBSPPA128_LBSPPB512_LPA8_LPB32_LRVW8_MIWT2_2_PLR1_SU0_SUM0_SUS64_VWA2_VWB2_WGM1_WGMXCC1_WGMXCCGn1
    SolutionIndex: 35
    SolutionNameMin: Cijk_Alik_Bjlk_F8B8NB8NS_BH_Bias_HAS_SAV_UserArgs_MT64x64x64_MI16x16x1_SN_LDSB0_CLR1_GRVWA16_GRVWB8_GSU0_GSUC0_GSUWGMRR0_K1_LBSPPA128_LBSPPB512_LPA16_LPB32_LRVW8_MIWT2_2_PLR1_SU0_SUM0_SUS64_VWA2_VWB2_WGM1_WGMXCC1_WGMXCCGn1
    SolutionIndex: 36
    SolutionNameMin: Cijk_Alik_Bjlk_F8B8NB8NS_BH_Bias_HAS_SAV_UserArgs_MT64x32x64_MI16x16x1_SN_LDSB0_CLR1_GRVWA8_GRVWB8_GSU0_GSUC0_GSUWGMRR0_K1_LBSPPA128_LBSPPB256_LPA8_LPB16_LRVW8_MIWT2_1_PLR1_SU0_SUM0_SUS64_VWA2_VWB1_WGM1_WGMXCC1_WGMXCCGn1
    SolutionIndex: 37
    SolutionNameMin: Cijk_Alik_Bjlk_F8B8NB8NS_BH_Bias_HAS_SAV_UserArgs_MT64x32x64_MI16x16x1_SN_LDSB0_CLR1_GRVWA16_GRVWB8_GSU0_GSUC0_GSUWGMRR0_K1_LBSPPA128_LBSPPB256_LPA16_LPB16_LRVW8_MIWT2_1_PLR1_SU0_SUM0_SUS64_VWA2_VWB1_WGM1_WGMXCC1_WGMXCCGn1
    SolutionIndex: 38
    SolutionNameMin: Cijk_Alik_Bjlk_F8B8NB8NS_BH_Bias_HAS_SAV_UserArgs_MT32x32x64_MI16x16x1_SN_LDSB0_CLR1_GRVWA8_GRVWB8_GSU0_GSUC0_GSUWGMRR0_K1_LBSPPA128_LBSPPB256_LPA8_LPB16_LRVW8_MIWT1_1_PLR1_SU0_SUM0_SUS64_VWA1_VWB1_WGM1_WGMXCC1_WGMXCCGn1
    SolutionIndex: 39
    SolutionNameMin: Cijk_Alik_Bjlk_F8B8NB8NS_BH_Bias_HAS_SAV_UserArgs_MT32x32x64_MI16x16x1_SN_LDSB0_CLR1_GRVWA8_GRVWB8_GSU0_GSUC0_GSUWGMRR0_K1_LBSPPA128_LBSPPB256_LPA8_LPB16_LRVW8_MIWT1_1_PLR1_SU0_SUM0_SUS64_VWA1_VWB1_WGM4_WGMXCC1_WGMXCCGn1
    SolutionIndex: 40
    SolutionNameMin: Cijk_Alik_Bjlk_F8B8NB8NS_BH_Bias_HAS_SAV_UserArgs_MT32x32x64_MI16x16x1_SN_LDSB0_CLR1_GRVWA8_GRVWB8_GSU0_GSUC0_GSUWGMRR0_K1_LBSPPA128_LBSPPB256_LPA8_LPB16_LRVW8_MIWT1_1_PLR1_SU0_SUM0_SUS64_VWA1_VWB1_WGM6_WGMXCC1_WGMXCCGn1
    SolutionIndex: 41
    SolutionNameMin: Cijk_Alik_Bjlk_F8B8NB8NS_BH_Bias_HAS_SAV_UserArgs_MT128x256x128_MI16x16x1_SN_LDSB1_CLR1_GRVWA8_GRVWB16_GSU0_GSUC0_GSUWGMRR0_K1_LBSPPA512_LBSPPB2048_LPA8_LPB0_LRVW8_MIWT4_8_PLR1_SU0_SUM0_SUS128_VWA4_VWB8_WGM1_WGMXCC1_WGMXCCGn1
    SolutionIndex: 42
    SolutionNameMin: Cijk_Alik_Bjlk_F8B8NB8NS_BH_Bias_HAS_SAV_UserArgs_MT128x256x128_MI16x16x1_SN_LDSB1_CLR1_GRVWA16_GRVWB16_GSU0_GSUC0_GSUWGMRR0_K1_LBSPPA512_LBSPPB2048_LPA16_LPB0_LRVW8_MIWT4_8_PLR1_SU0_SUM0_SUS128_VWA4_VWB8_WGM1_WGMXCC1_WGMXCCGn1
    SolutionIndex: 43
    SolutionNameMin: Cijk_Alik_Bjlk_F8B8NB8NS_BH_Bias_HAS_SAV_UserArgs_MT128x256x128_MI16x16x1_SN_LDSB1_CLR1_GRVWA8_GRVWB16_GSU0_GSUC0_GSUWGMRR0_K1_LBSPPA512_LBSPPB2048_LPA8_LPB0_LRVW8_MIWT4_8_PLR1_SU0_SUM0_SUS128_VWA4_VWB8_WGM4_WGMXCC1_WGMXCCGn1
    SolutionIndex: 44
    SolutionNameMin: Cijk_Alik_Bjlk_F8B8NB8NS_BH_Bias_HAS_SAV_UserArgs_MT128x256x128_MI16x16x1_SN_LDSB1_CLR1_GRVWA16_GRVWB16_GSU0_GSUC0_GSUWGMRR0_K1_LBSPPA512_LBSPPB2048_LPA16_LPB0_LRVW8_MIWT4_8_PLR1_SU0_SUM0_SUS128_VWA4_VWB8_WGM4_WGMXCC1_WGMXCCGn1
    SolutionIndex: 45
    SolutionNameMin: Cijk_Alik_Bjlk_F8B8NB8NS_BH_Bias_HAS_SAV_UserArgs_MT128x256x128_MI16x16x1_SN_LDSB1_CLR1_GRVWA8_GRVWB16_GSU0_GSUC0_GSUWGMRR0_K1_LBSPPA512_LBSPPB2048_LPA8_LPB0_LRVW8_MIWT4_8_PLR1_SU0_SUM0_SUS128_VWA4_VWB8_WGM6_WGMXCC1_WGMXCCGn1
    SolutionIndex: 46
    SolutionNameMin: Cijk_Alik_Bjlk_F8B8NB8NS_BH_Bias_HAS_SAV_UserArgs_MT256x128x128_MI16x16x1_SN_LDSB1_CLR1_GRVWA8_GRVWB16_GSU0_GSUC0_GSUWGMRR0_K1_LBSPPA1024_LBSPPB1024_LPA8_LPB64_LRVW8_MIWT8_4_PLR1_SU0_SUM0_SUS128_VWA8_VWB4_WGM1_WGMXCC1_WGMXCCGn1
    SolutionIndex: 47
    SolutionNameMin: Cijk_Alik_Bjlk_F8B8NB8NS_BH_Bias_HAS_SAV_UserArgs_MT256x128x128_MI16x16x1_SN_LDSB1_CLR1_GRVWA16_GRVWB16_GSU0_GSUC0_GSUWGMRR0_K1_LBSPPA1024_LBSPPB1024_LPA16_LPB64_LRVW8_MIWT8_4_PLR1_SU0_SUM0_SUS128_VWA8_VWB4_WGM1_WGMXCC1_WGMXCCGn1
    SolutionIndex: 48
    SolutionNameMin: Cijk_Alik_Bjlk_F8B8NB8NS_BH_Bias_HAS_SAV_UserArgs_MT256x128x128_MI16x16x1_SN_LDSB1_CLR1_GRVWA8_GRVWB16_GSU0_GSUC0_GSUWGMRR0_K1_LBSPPA1024_LBSPPB1024_LPA8_LPB64_LRVW8_MIWT8_4_PLR1_SU0_SUM0_SUS128_VWA8_VWB4_WGM4_WGMXCC1_WGMXCCGn1
    SolutionIndex: 49
    SolutionNameMin: Cijk_Alik_Bjlk_F8B8NB8NS_BH_Bias_HAS_SAV_UserArgs_MT256x128x128_MI16x16x1_SN_LDSB1_CLR1_GRVWA8_GRVWB16_GSU0_GSUC0_GSUWGMRR0_K1_LBSPPA1024_LBSPPB1024_LPA8_LPB64_LRVW8_MIWT8_4_PLR1_SU0_SUM0_SUS128_VWA8_VWB4_WGM8_WGMXCC1_WGMXCCGn1
    SolutionIndex: 50
    SolutionNameMin: Cijk_Alik_Bjlk_F8B8NB8NS_BH_Bias_HAS_SAV_UserArgs_MT144x256x128_MI16x16x1_SN_LDSB1_CLR1_GRVWA8_GRVWB16_GSU0_GSUC0_GSUWGMRR0_K1_LBSPPA128_LBSPPB2048_LPA8_LPB64_LRVW8_MIWT9_4_PLR1_SU0_SUM0_SUS128_VWA1_VWB4_WGM4_WGMXCC1_WGMXCCGn1
    SolutionIndex: 51
    SolutionNameMin: Cijk_Alik_Bjlk_F8B8NB8NS_BH_Bias_HAS_SAV_UserArgs_MT144x256x128_MI16x16x1_SN_LDSB1_CLR1_GRVWA8_GRVWB8_GSU0_GSUC0_GSUWGMRR0_K1_LBSPPA128_LBSPPB2048_LPA8_LPB64_LRVW8_MIWT9_4_PLR1_SU0_SUM0_SUS128_VWA1_VWB4_WGM6_WGMXCC1_WGMXCCGn1
    SolutionIndex: 52
    SolutionNameMin: Cijk_Alik_Bjlk_F8B8NB8NS_BH_Bias_HAS_SAV_UserArgs_MT144x256x128_MI16x16x1_SN_LDSB1_CLR1_GRVWA8_GRVWB16_GSU0_GSUC0_GSUWGMRR0_K1_LBSPPA128_LBSPPB2048_LPA8_LPB64_LRVW8_MIWT9_4_PLR1_SU0_SUM0_SUS128_VWA1_VWB4_WGM6_WGMXCC1_WGMXCCGn1
    SolutionIndex: 53
    SolutionNameMin: Cijk_Alik_Bjlk_F8B8NB8NS_BH_Bias_HAS_SAV_UserArgs_MT144x256x128_MI16x16x1_SN_LDSB1_CLR1_GRVWA8_GRVWB16_GSU0_GSUC0_GSUWGMRR0_K1_LBSPPA128_LBSPPB2048_LPA8_LPB64_LRVW8_MIWT9_4_PLR1_SU0_SUM0_SUS128_VWA1_VWB4_WGM8_WGMXCC1_WGMXCCGn1
    SolutionIndex: 54
    SolutionNameMin: Cijk_Alik_Bjlk_F8B8NB8NS_BH_Bias_HAS_SAV_UserArgs_MT144x128x128_MI16x16x1_SN_LDSB1_CLR1_GRVWA8_GRVWB16_GSU0_GSUC0_GSUWGMRR0_K1_LBSPPA128_LBSPPB1024_LPA8_LPB32_LRVW8_MIWT9_2_PLR1_SU0_SUM0_SUS128_VWA1_VWB2_WGM6_WGMXCC1_WGMXCCGn1
    SolutionIndex: 55
    SolutionNameMin: Cijk_Alik_Bjlk_F8B8NB8NS_BH_Bias_HAS_SAV_UserArgs_MT144x128x128_MI16x16x1_SN_LDSB1_CLR1_GRVWA8_GRVWB16_GSU0_GSUC0_GSUWGMRR0_K1_LBSPPA128_LBSPPB1024_LPA8_LPB32_LRVW8_MIWT9_2_PLR1_SU0_SUM0_SUS128_VWA1_VWB2_WGM8_WGMXCC1_WGMXCCGn1
    SolutionIndex: 56
    SolutionNameMin: Cijk_Alik_Bjlk_F8B8NB8NS_BH_Bias_HAS_SAV_UserArgs_MT128x128x128_MI16x16x1_SN_LDSB1_CLR1_GRVWA16_GRVWB8_GSU0_GSUC0_GSUWGMRR0_K1_LBSPPA512_LBSPPB1024_LPA16_LPB64_LRVW8_MIWT4_4_PLR1_SU0_SUM0_SUS128_VWA4_VWB4_WGM1_WGMXCC1_WGMXCCGn1
    SolutionIndex: 57
    SolutionNameMin: Cijk_Alik_Bjlk_F8B8NB8NS_BH_Bias_HAS_SAV_UserArgs_MT128x128x128_MI16x16x1_SN_LDSB1_CLR1_GRVWA16_GRVWB16_GSU0_GSUC0_GSUWGMRR0_K1_LBSPPA512_LBSPPB1024_LPA16_LPB64_LRVW8_MIWT4_4_PLR1_SU0_SUM0_SUS128_VWA4_VWB4_WGM1_WGMXCC1_WGMXCCGn1
    SolutionIndex: 58
    SolutionNameMin: Cijk_Alik_Bjlk_F8B8NB8NS_BH_Bias_HAS_SAV_UserArgs_MT128x128x128_MI16x16x1_SN_LDSB1_CLR1_GRVWA16_GRVWB16_GSU0_GSUC0_GSUWGMRR0_K1_LBSPPA512_LBSPPB1024_LPA16_LPB64_LRVW8_MIWT4_4_PLR1_SU0_SUM0_SUS128_VWA4_VWB4_WGM4_WGMXCC1_WGMXCCGn1
    SolutionIndex: 59
    SolutionNameMin: Cijk_Alik_Bjlk_F8B8NB8NS_BH_Bias_HAS_SAV_UserArgs_MT128x128x128_MI16x16x1_SN_LDSB1_CLR1_GRVWA16_GRVWB16_GSU0_GSUC0_GSUWGMRR0_K1_LBSPPA512_LBSPPB1024_LPA16_LPB64_LRVW8_MIWT4_4_PLR1_SU0_SUM0_SUS128_VWA4_VWB4_WGM6_WGMXCC1_WGMXCCGn1
    SolutionIndex: 60
    SolutionNameMin: Cijk_Alik_Bjlk_F8B8NB8NS_BH_Bias_HAS_SAV_UserArgs_MT128x128x128_MI16x16x1_SN_LDSB1_CLR1_GRVWA16_GRVWB16_GSU0_GSUC0_GSUWGMRR0_K1_LBSPPA512_LBSPPB1024_LPA16_LPB64_LRVW8_MIWT4_4_PLR1_SU0_SUM0_SUS128_VWA4_VWB4_WGM8_WGMXCC1_WGMXCCGn1
    SolutionIndex: 61
    SolutionNameMin: Cijk_Alik_Bjlk_F8B8NB8NS_BH_Bias_HAS_SAV_UserArgs_MT64x128x128_MI16x16x1_SN_LDSB1_CLR1_GRVWA8_GRVWB16_GSU0_GSUC0_GSUWGMRR0_K1_LBSPPA256_LBSPPB1024_LPA8_LPB64_LRVW8_MIWT2_4_PLR1_SU0_SUM0_SUS128_VWA2_VWB4_WGM1_WGMXCC1_WGMXCCGn1
    SolutionIndex: 62
    SolutionNameMin: Cijk_Alik_Bjlk_F8B8NB8NS_BH_Bias_HAS_SAV_UserArgs_MT64x64x128_MI16x16x1_SN_LDSB1_CLR1_GRVWA16_GRVWB8_GSU0_GSUC0_GSUWGMRR0_K1_LBSPPA256_LBSPPB512_LPA16_LPB32_LRVW8_MIWT2_2_PLR1_SU0_SUM0_SUS128_VWA2_VWB2_WGM1_WGMXCC1_WGMXCCGn1
    SolutionIndex: 63
    SolutionNameMin: Cijk_Alik_Bjlk_F8B8NB8NS_BH_Bias_HAS_SAV_UserArgs_MT64x64x128_MI16x16x1_SN_LDSB1_CLR1_GRVWA8_GRVWB16_GSU0_GSUC0_GSUWGMRR0_K1_LBSPPA256_LBSPPB512_LPA8_LPB32_LRVW8_MIWT2_2_PLR1_SU0_SUM0_SUS128_VWA2_VWB2_WGM1_WGMXCC1_WGMXCCGn1
    SolutionIndex: 64
    SolutionNameMin: Cijk_Alik_Bjlk_F8B8NB8NS_BH_Bias_HAS_SAV_UserArgs_MT64x64x128_MI16x16x1_SN_LDSB1_CLR1_GRVWA16_GRVWB16_GSU0_GSUC0_GSUWGMRR0_K1_LBSPPA256_LBSPPB512_LPA16_LPB32_LRVW8_MIWT2_2_PLR1_SU0_SUM0_SUS128_VWA2_VWB2_WGM1_WGMXCC1_WGMXCCGn1
    SolutionIndex: 65
    SolutionNameMin: Cijk_Alik_Bjlk_F8B8NB8NS_BH_Bias_HAS_SAV_UserArgs_MT32x64x128_MI16x16x1_SN_LDSB0_CLR1_GRVWA8_GRVWB8_GSU0_GSUC0_GSUWGMRR0_K1_LBSPPA128_LBSPPB512_LPA8_LPB32_LRVW8_MIWT1_2_PLR1_SU0_SUM0_SUS128_VWA1_VWB2_WGM1_WGMXCC1_WGMXCCGn1
    SolutionIndex: 66
    SolutionNameMin: Cijk_Alik_Bjlk_F8B8NB8NS_BH_Bias_HAS_SAV_UserArgs_MT32x64x128_MI16x16x1_SN_LDSB0_CLR1_GRVWA8_GRVWB16_GSU0_GSUC0_GSUWGMRR0_K1_LBSPPA128_LBSPPB512_LPA8_LPB32_LRVW8_MIWT1_2_PLR1_SU0_SUM0_SUS128_VWA1_VWB2_WGM4_WGMXCC1_WGMXCCGn1
    SolutionIndex: 67
    SolutionNameMin: Cijk_Alik_Bjlk_F8B8NB8NS_BH_Bias_HAS_SAV_UserArgs_MT64x32x128_MI16x16x1_SN_LDSB0_CLR1_GRVWA8_GRVWB8_GSU0_GSUC0_GSUWGMRR0_K1_LBSPPA256_LBSPPB256_LPA8_LPB16_LRVW8_MIWT2_1_PLR1_SU0_SUM0_SUS128_VWA2_VWB1_WGM1_WGMXCC1_WGMXCCGn1
    SolutionIndex: 68
    SolutionNameMin: Cijk_Alik_Bjlk_F8B8NB8NS_BH_Bias_HAS_SAV_UserArgs_MT64x32x128_MI16x16x1_SN_LDSB0_CLR1_GRVWA16_GRVWB8_GSU0_GSUC0_GSUWGMRR0_K1_LBSPPA256_LBSPPB256_LPA16_LPB16_LRVW8_MIWT2_1_PLR1_SU0_SUM0_SUS128_VWA2_VWB1_WGM1_WGMXCC1_WGMXCCGn1
    SolutionIndex: 69
    SolutionNameMin: Cijk_Alik_Bjlk_F8B8NB8NS_BH_Bias_HAS_SAV_UserArgs_MT64x32x128_MI16x16x1_SN_LDSB0_CLR1_GRVWA8_GRVWB16_GSU0_GSUC0_GSUWGMRR0_K1_LBSPPA256_LBSPPB256_LPA8_LPB16_LRVW8_MIWT2_1_PLR1_SU0_SUM0_SUS128_VWA2_VWB1_WGM1_WGMXCC1_WGMXCCGn1
    SolutionIndex: 70
    SolutionNameMin: Cijk_Alik_Bjlk_F8B8NB8NS_BH_Bias_HAS_SAV_UserArgs_MT64x32x128_MI16x16x1_SN_LDSB0_CLR1_GRVWA8_GRVWB16_GSU0_GSUC0_GSUWGMRR0_K1_LBSPPA256_LBSPPB256_LPA8_LPB16_LRVW8_MIWT2_1_PLR1_SU0_SUM0_SUS128_VWA2_VWB1_WGM4_WGMXCC1_WGMXCCGn1
    SolutionIndex: 71
    SolutionNameMin: Cijk_Alik_Bjlk_F8B8NB8NS_BH_Bias_HAS_SAV_UserArgs_MT64x32x128_MI16x16x1_SN_LDSB0_CLR1_GRVWA8_GRVWB16_GSU0_GSUC0_GSUWGMRR0_K1_LBSPPA256_LBSPPB256_LPA8_LPB16_LRVW8_MIWT2_1_PLR1_SU0_SUM0_SUS128_VWA2_VWB1_WGM6_WGMXCC1_WGMXCCGn1
    SolutionIndex: 72
    SolutionNameMin: Cijk_Alik_Bjlk_F8B8NB8NS_BH_Bias_HAS_SAV_UserArgs_MT32x32x128_MI16x16x1_SN_LDSB0_CLR1_GRVWA8_GRVWB8_GSU0_GSUC0_GSUWGMRR0_K1_LBSPPA128_LBSPPB256_LPA8_LPB16_LRVW8_MIWT1_1_PLR1_SU0_SUM0_SUS128_VWA1_VWB1_WGM1_WGMXCC1_WGMXCCGn1
    SolutionIndex: 73
    SolutionNameMin: Cijk_Alik_Bjlk_F8B8NB8NS_BH_Bias_HAS_SAV_UserArgs_MT32x32x128_MI16x16x1_SN_LDSB0_CLR1_GRVWA16_GRVWB8_GSU0_GSUC0_GSUWGMRR0_K1_LBSPPA128_LBSPPB256_LPA16_LPB16_LRVW8_MIWT1_1_PLR1_SU0_SUM0_SUS128_VWA1_VWB1_WGM1_WGMXCC1_WGMXCCGn1
    SolutionIndex: 74
    SolutionNameMin: Cijk_Alik_Bjlk_F8B8NB8NS_BH_Bias_HAS_SAV_UserArgs_MT32x32x128_MI16x16x1_SN_LDSB0_CLR1_GRVWA8_GRVWB16_GSU0_GSUC0_GSUWGMRR0_K1_LBSPPA128_LBSPPB256_LPA8_LPB16_LRVW8_MIWT1_1_PLR1_SU0_SUM0_SUS128_VWA1_VWB1_WGM1_WGMXCC1_WGMXCCGn1
    SolutionIndex: 75
    SolutionNameMin: Cijk_Alik_Bjlk_F8B8NB8NS_BH_Bias_HAS_SAV_UserArgs_MT32x32x128_MI16x16x1_SN_LDSB0_CLR1_GRVWA8_GRVWB16_GSU0_GSUC0_GSUWGMRR0_K1_LBSPPA128_LBSPPB256_LPA8_LPB16_LRVW8_MIWT1_1_PLR1_SU0_SUM0_SUS128_VWA1_VWB1_WGM4_WGMXCC1_WGMXCCGn1
    SolutionIndex: 76
    SolutionNameMin: Cijk_Alik_Bjlk_F8B8NB8NS_BH_Bias_HAS_SAV_UserArgs_MT32x32x128_MI16x16x1_SN_LDSB0_CLR1_GRVWA8_GRVWB16_GSU0_GSUC0_GSUWGMRR0_K1_LBSPPA128_LBSPPB256_LPA8_LPB16_LRVW8_MIWT1_1_PLR1_SU0_SUM0_SUS128_VWA1_VWB1_WGM6_WGMXCC1_WGMXCCGn1
    SolutionIndex: 77
    SolutionNameMin: Cijk_Alik_Bjlk_F8B8NB8NS_BH_Bias_HAS_SAV_UserArgs_MT32x32x128_MI16x16x1_SN_LDSB0_CLR1_GRVWA8_GRVWB16_GSU0_GSUC0_GSUWGMRR0_K1_LBSPPA128_LBSPPB256_LPA8_LPB16_LRVW8_MIWT1_1_PLR1_SU0_SUM0_SUS128_VWA1_VWB1_WGM8_WGMXCC1_WGMXCCGn1
    SolutionIndex: 78
    SolutionNameMin: Cijk_Alik_Bjlk_F8B8NB8NS_BH_Bias_HAS_SAV_UserArgs_MT128x64x256_MI16x16x1_SN_LDSB1_CLR1_GRVWA16_GRVWB16_GSU0_GSUC0_GSUWGMRR0_K1_LBSPPA1024_LBSPPB512_LPA16_LPB32_LRVW8_MIWT4_2_PLR1_SU0_SUM0_SUS256_VWA4_VWB2_WGM1_WGMXCC1_WGMXCCGn1
    SolutionIndex: 79
    SolutionNameMin: Cijk_Alik_Bjlk_F8B8NB8NS_BH_Bias_HAS_SAV_UserArgs_MT128x64x256_MI16x16x1_SN_LDSB1_CLR1_GRVWA16_GRVWB16_GSU0_GSUC0_GSUWGMRR0_K1_LBSPPA1024_LBSPPB512_LPA16_LPB32_LRVW8_MIWT4_2_PLR1_SU0_SUM0_SUS256_VWA4_VWB2_WGM4_WGMXCC1_WGMXCCGn1
    SolutionIndex: 80
    SolutionNameMin: Cijk_Alik_Bjlk_F8B8NB8NS_BH_Bias_HAS_SAV_UserArgs_MT128x64x256_MI16x16x1_SN_LDSB1_CLR1_GRVWA16_GRVWB16_GSU0_GSUC0_GSUWGMRR0_K1_LBSPPA1024_LBSPPB512_LPA16_LPB32_LRVW8_MIWT4_2_PLR1_SU0_SUM0_SUS256_VWA4_VWB2_WGM6_WGMXCC1_WGMXCCGn1
    SolutionIndex: 81
    SolutionNameMin: Cijk_Alik_Bjlk_F8B8NB8NS_BH_Bias_HAS_SAV_UserArgs_MT128x64x256_MI16x16x1_SN_LDSB1_CLR1_GRVWA16_GRVWB16_GSU0_GSUC0_GSUWGMRR0_K1_LBSPPA1024_LBSPPB512_LPA16_LPB32_LRVW8_MIWT4_2_PLR1_SU0_SUM0_SUS256_VWA4_VWB2_WGM8_WGMXCC1_WGMXCCGn1
    SolutionIndex: 82
    SolutionNameMin: Cijk_Alik_Bjlk_F8B8NB8NS_BH_Bias_HAS_SAV_UserArgs_MT64x64x256_MI16x16x1_SN_LDSB1_CLR1_GRVWA16_GRVWB16_GSU0_GSUC0_GSUWGMRR0_K1_LBSPPA512_LBSPPB512_LPA16_LPB32_LRVW8_MIWT2_2_PLR1_SU0_SUM0_SUS256_VWA2_VWB2_WGM1_WGMXCC1_WGMXCCGn1
    SolutionIndex: 83
    SolutionNameMin: Cijk_Alik_Bjlk_F8B8NB8NS_BH_Bias_HAS_SAV_UserArgs_MT64x64x256_MI16x16x1_SN_LDSB1_CLR1_GRVWA16_GRVWB16_GSU0_GSUC0_GSUWGMRR0_K1_LBSPPA512_LBSPPB512_LPA16_LPB32_LRVW8_MIWT2_2_PLR1_SU0_SUM0_SUS256_VWA2_VWB2_WGM4_WGMXCC1_WGMXCCGn1
    SolutionIndex: 84
    SolutionNameMin: Cijk_Alik_Bjlk_F8B8NB8NS_BH_Bias_HAS_SAV_UserArgs_MT64x64x256_MI16x16x1_SN_LDSB1_CLR1_GRVWA16_GRVWB16_GSU0_GSUC0_GSUWGMRR0_K1_LBSPPA512_LBSPPB512_LPA16_LPB32_LRVW8_MIWT2_2_PLR1_SU0_SUM0_SUS256_VWA2_VWB2_WGM6_WGMXCC1_WGMXCCGn1
    SolutionIndex: 85
    SolutionNameMin: Cijk_Alik_Bjlk_F8B8NB8NS_BH_Bias_HAS_SAV_UserArgs_MT64x64x256_MI16x16x1_SN_LDSB1_CLR1_GRVWA16_GRVWB16_GSU0_GSUC0_GSUWGMRR0_K1_LBSPPA512_LBSPPB512_LPA16_LPB32_LRVW8_MIWT2_2_PLR1_SU0_SUM0_SUS256_VWA2_VWB2_WGM8_WGMXCC1_WGMXCCGn1
    SolutionIndex: 86
    SolutionNameMin: Cijk_Alik_Bjlk_F8B8NB8NS_BH_Bias_HAS_SAV_UserArgs_MT32x64x256_MI16x16x1_SN_LDSB1_CLR1_GRVWA16_GRVWB16_GSU0_GSUC0_GSUWGMRR0_K1_LBSPPA256_LBSPPB512_LPA16_LPB32_LRVW8_MIWT1_2_PLR1_SU0_SUM0_SUS256_VWA1_VWB2_WGM1_WGMXCC1_WGMXCCGn1
    SolutionIndex: 87
    SolutionNameMin: Cijk_Alik_Bjlk_F8B8NB8NS_BH_Bias_HAS_SAV_UserArgs_MT32x64x256_MI16x16x1_SN_LDSB1_CLR1_GRVWA8_GRVWB16_GSU0_GSUC0_GSUWGMRR0_K1_LBSPPA256_LBSPPB512_LPA8_LPB32_LRVW8_MIWT1_2_PLR1_SU0_SUM0_SUS256_VWA1_VWB2_WGM6_WGMXCC1_WGMXCCGn1
    SolutionIndex: 88
    SolutionNameMin: Cijk_Alik_Bjlk_F8B8NB8NS_BH_Bias_HAS_SAV_UserArgs_MT32x64x256_MI16x16x1_SN_LDSB1_CLR1_GRVWA16_GRVWB16_GSU0_GSUC0_GSUWGMRR0_K1_LBSPPA256_LBSPPB512_LPA16_LPB32_LRVW8_MIWT1_2_PLR1_SU0_SUM0_SUS256_VWA1_VWB2_WGM6_WGMXCC1_WGMXCCGn1
    SolutionIndex: 89
    SolutionNameMin: Cijk_Alik_Bjlk_F8B8NB8NS_BH_Bias_HAS_SAV_UserArgs_MT32x64x256_MI16x16x1_SN_LDSB1_CLR1_GRVWA8_GRVWB16_GSU0_GSUC0_GSUWGMRR0_K1_LBSPPA256_LBSPPB512_LPA8_LPB32_LRVW8_MIWT1_2_PLR1_SU0_SUM0_SUS256_VWA1_VWB2_WGM8_WGMXCC1_WGMXCCGn1
    SolutionIndex: 90
    SolutionNameMin: Cijk_Alik_Bjlk_F8B8NB8NS_BH_Bias_HAS_SAV_UserArgs_MT64x32x256_MI16x16x1_SN_LDSB1_CLR1_GRVWA16_GRVWB16_GSU0_GSUC0_GSUWGMRR0_K1_LBSPPA512_LBSPPB256_LPA16_LPB16_LRVW8_MIWT2_1_PLR1_SU0_SUM0_SUS256_VWA2_VWB1_WGM8_WGMXCC1_WGMXCCGn1
    SolutionIndex: 91
    SolutionNameMin: Cijk_Alik_Bjlk_F8B8NB8NS_BH_Bias_HAS_SAV_UserArgs_MT32x32x256_MI16x16x1_SN_LDSB1_CLR1_GRVWA8_GRVWB16_GSU0_GSUC0_GSUWGMRR0_K1_LBSPPA256_LBSPPB256_LPA8_LPB16_LRVW8_MIWT1_1_PLR1_SU0_SUM0_SUS256_VWA1_VWB1_WGM1_WGMXCC1_WGMXCCGn1
    SolutionIndex: 92
    SolutionNameMin: Cijk_Alik_Bjlk_F8B8NB8NS_BH_Bias_HAS_SAV_UserArgs_MT32x32x256_MI16x16x1_SN_LDSB1_CLR1_GRVWA16_GRVWB16_GSU0_GSUC0_GSUWGMRR0_K1_LBSPPA256_LBSPPB256_LPA16_LPB16_LRVW8_MIWT1_1_PLR1_SU0_SUM0_SUS256_VWA1_VWB1_WGM1_WGMXCC1_WGMXCCGn1
    SolutionIndex: 93
    SolutionNameMin: Cijk_Alik_Bjlk_F8B8NB8NS_BH_Bias_HAS_SAV_UserArgs_MT32x32x256_MI16x16x1_SN_LDSB1_CLR1_GRVWA16_GRVWB16_GSU0_GSUC0_GSUWGMRR0_K1_LBSPPA256_LBSPPB256_LPA16_LPB16_LRVW8_MIWT1_1_PLR1_SU0_SUM0_SUS256_VWA1_VWB1_WGM6_WGMXCC1_WGMXCCGn1
    SolutionIndex: 94
    SolutionNameMin: Cijk_Alik_Bjlk_F8B8NB8NS_BH_Bias_HAS_SAV_UserArgs_MT32x32x256_MI16x16x1_SN_LDSB1_CLR1_GRVWA16_GRVWB16_GSU0_GSUC0_GSUWGMRR0_K1_LBSPPA256_LBSPPB256_LPA16_LPB16_LRVW8_MIWT1_1_PLR1_SU0_SUM0_SUS256_VWA1_VWB1_WGM8_WGMXCC1_WGMXCCGn1
- - - [128, 128, 1, 128, 128, 128, 128, 128]
    - [38, 0.54]
  - - [128, 128, 1, 256, 128, 128, 256, 128]
    - [72, 0.98]
  - - [128, 128, 1, 512, 128, 128, 512, 128]
    - [72, 1.71]
  - - [128, 128, 1, 1024, 128, 128, 1024, 128]
    - [74, 2.71]
  - - [128, 128, 1, 2048, 128, 128, 2048, 128]
    - [72, 3.8]
  - - [128, 128, 1, 4096, 128, 128, 4096, 128]
    - [74, 4.81]
  - - [128, 128, 1, 8192, 128, 128, 8192, 128]
    - [75, 5.49]
  - - [128, 256, 1, 128, 128, 128, 128, 256]
    - [73, 1.1]
  - - [128, 256, 1, 256, 128, 128, 256, 256]
    - [73, 2.02]
  - - [128, 256, 1, 512, 128, 128, 512, 256]
    - [72, 3.58]
  - - [128, 256, 1, 1024, 128, 128, 1024, 256]
    - [72, 5.59]
  - - [128, 256, 1, 2048, 128, 128, 2048, 256]
    - [72, 7.52]
  - - [128, 256, 1, 4096, 128, 128, 4096, 256]
    - [74, 9.45]
  - - [128, 256, 1, 8192, 128, 128, 8192, 256]
    - [74, 11.06]
  - - [128, 512, 1, 128, 128, 128, 128, 512]
    - [38, 2.16]
  - - [128, 512, 1, 256, 128, 128, 256, 512]
    - [38, 3.89]
  - - [128, 512, 1, 512, 128, 128, 512, 512]
    - [72, 6.78]
  - - [128, 512, 1, 1024, 128, 128, 1024, 512]
    - [72, 10.65]
  - - [128, 512, 1, 2048, 128, 128, 2048, 512]
    - [72, 15.04]
  - - [128, 512, 1, 4096, 128, 128, 4096, 512]
    - [74, 19.04]
  - - [128, 512, 1, 8192, 128, 128, 8192, 512]
    - [92, 18.38]
  - - [128, 1024, 1, 128, 128, 128, 128, 1024]
    - [38, 4.2]
  - - [128, 1024, 1, 256, 128, 128, 256, 1024]
    - [38, 7.64]
  - - [128, 1024, 1, 512, 128, 128, 512, 1024]
    - [72, 13.42]
  - - [128, 1024, 1, 1024, 128, 128, 1024, 1024]
    - [72, 21.06]
  - - [128, 1024, 1, 2048, 128, 128, 2048, 1024]
    - [72, 29.68]
  - - [128, 1024, 1, 4096, 128, 128, 4096, 1024]
    - [94, 30.76]
  - - [128, 1024, 1, 8192, 128, 128, 8192, 1024]
    - [93, 32.27]
  - - [128, 2048, 1, 128, 128, 128, 128, 2048]
    - [36, 8.15]
  - - [128, 2048, 1, 256, 128, 128, 256, 2048]
    - [65, 14.45]
  - - [128, 2048, 1, 512, 128, 128, 512, 2048]
    - [69, 24.28]
  - - [128, 2048, 1, 1024, 128, 128, 1024, 2048]
    - [69, 37.52]
  - - [128, 2048, 1, 2048, 128, 128, 2048, 2048]
    - [86, 43.76]
  - - [128, 2048, 1, 4096, 128, 128, 4096, 2048]
    - [86, 52.67]
  - - [128, 2048, 1, 8192, 128, 128, 8192, 2048]
    - [86, 59.37]
  - - [128, 4096, 1, 128, 128, 128, 128, 4096]
    - [35, 14.69]
  - - [128, 4096, 1, 256, 128, 128, 256, 4096]
    - [34, 25.86]
  - - [128, 4096, 1, 512, 128, 128, 512, 4096]
    - [62, 42.94]
  - - [128, 4096, 1, 1024, 128, 128, 1024, 4096]
    - [63, 65.08]
  - - [128, 4096, 1, 2048, 128, 128, 2048, 4096]
    - [82, 78.29]
  - - [128, 4096, 1, 4096, 128, 128, 4096, 4096]
    - [82, 95.8]
  - - [128, 4096, 1, 8192, 128, 128, 8192, 4096]
    - [82, 108.55]
  - - [128, 8192, 1, 128, 128, 128, 128, 8192]
    - [22, 25.35]
  - - [128, 8192, 1, 256, 128, 128, 256, 8192]
    - [30, 44.59]
  - - [128, 8192, 1, 512, 128, 128, 512, 8192]
    - [30, 73.08]
  - - [128, 8192, 1, 1024, 128, 128, 1024, 8192]
    - [31, 104.9]
  - - [128, 8192, 1, 2048, 128, 128, 2048, 8192]
    - [61, 122.63]
  - - [128, 8192, 1, 4096, 128, 128, 4096, 8192]
    - [79, 144.06]
  - - [128, 8192, 1, 8192, 128, 128, 8192, 8192]
    - [78, 153.18]
  - - [256, 128, 1, 128, 256, 256, 128, 128]
    - [74, 1.04]
  - - [256, 128, 1, 256, 256, 256, 256, 128]
    - [73, 2.01]
  - - [256, 128, 1, 512, 256, 256, 512, 128]
    - [72, 3.36]
  - - [256, 128, 1, 1024, 256, 256, 1024, 128]
    - [74, 5.39]
  - - [256, 128, 1, 2048, 256, 256, 2048, 128]
    - [74, 7.6]
  - - [256, 128, 1, 4096, 256, 256, 4096, 128]
    - [74, 9.68]
  - - [256, 128, 1, 8192, 256, 256, 8192, 128]
    - [74, 11.05]
  - - [256, 256, 1, 128, 256, 256, 128, 256]
    - [38, 2.19]
  - - [256, 256, 1, 256, 256, 256, 256, 256]
    - [72, 3.96]
  - - [256, 256, 1, 512, 256, 256, 512, 256]
    - [72, 6.85]
  - - [256, 256, 1, 1024, 256, 256, 1024, 256]
    - [72, 10.76]
  - - [256, 256, 1, 2048, 256, 256, 2048, 256]
    - [74, 15.25]
  - - [256, 256, 1, 4096, 256, 256, 4096, 256]
    - [74, 19.13]
  - - [256, 256, 1, 8192, 256, 256, 8192, 256]
    - [76, 21.82]
  - - [256, 512, 1, 128, 256, 256, 128, 512]
    - [72, 4.33]
  - - [256, 512, 1, 256, 256, 256, 256, 512]
    - [72, 7.82]
  - - [256, 512, 1, 512, 256, 256, 512, 512]
    - [72, 13.57]
  - - [256, 512, 1, 1024, 256, 256, 1024, 512]
    - [74, 20.88]
  - - [256, 512, 1, 2048, 256, 256, 2048, 512]
    - [74, 29.72]
  - - [256, 512, 1, 4096, 256, 256, 4096, 512]
    - [74, 37.57]
  - - [256, 512, 1, 8192, 256, 256, 8192, 512]
    - [91, 38.73]
  - - [256, 1024, 1, 128, 256, 256, 128, 1024]
    - [67, 8.02]
  - - [256, 1024, 1, 256, 256, 256, 256, 1024]
    - [68, 14.55]
  - - [256, 1024, 1, 512, 256, 256, 512, 1024]
    - [67, 24.41]
  - - [256, 1024, 1, 1024, 256, 256, 1024, 1024]
    - [69, 37.5]
  - - [256, 1024, 1, 2048, 256, 256, 2048, 1024]
    - [69, 51.66]
  - - [256, 1024, 1, 4096, 256, 256, 4096, 1024]
    - [90, 56.71]
  - - [256, 1024, 1, 8192, 256, 256, 8192, 1024]
    - [88, 59.89]
  - - [256, 2048, 1, 128, 256, 256, 128, 2048]
    - [62, 14.87]
  - - [256, 2048, 1, 256, 256, 256, 256, 2048]
    - [34, 26.43]
  - - [256, 2048, 1, 512, 256, 256, 512, 2048]
    - [34, 42.87]
  - - [256, 2048, 1, 1024, 256, 256, 1024, 2048]
    - [63, 64.46]
  - - [256, 2048, 1, 2048, 256, 256, 2048, 2048]
    - [82, 80.47]
  - - [256, 2048, 1, 4096, 256, 256, 4096, 2048]
    - [82, 95.92]
  - - [256, 2048, 1, 8192, 256, 256, 8192, 2048]
    - [82, 107.59]
  - - [256, 4096, 1, 128, 256, 256, 128, 4096]
    - [23, 25.71]
  - - [256, 4096, 1, 256, 256, 256, 256, 4096]
    - [30, 44.89]
  - - [256, 4096, 1, 512, 256, 256, 512, 4096]
    - [30, 72.72]
  - - [256, 4096, 1, 1024, 256, 256, 1024, 4096]
    - [30, 105.79]
  - - [256, 4096, 1, 2048, 256, 256, 2048, 4096]
    - [78, 125.15]
  - - [256, 4096, 1, 4096, 256, 256, 4096, 4096]
    - [78, 150.32]
  - - [256, 4096, 1, 8192, 256, 256, 8192, 4096]
    - [81, 163.71]
  - - [256, 8192, 1, 128, 256, 256, 128, 8192]
    - [56, 40.49]
  - - [256, 8192, 1, 256, 256, 256, 256, 8192]
    - [21, 70.05]
  - - [256, 8192, 1, 512, 256, 256, 512, 8192]
    - [57, 110.5]
  - - [256, 8192, 1, 1024, 256, 256, 1024, 8192]
    - [57, 158.67]
  - - [256, 8192, 1, 2048, 256, 256, 2048, 8192]
    - [57, 187.66]
  - - [256, 8192, 1, 4096, 256, 256, 4096, 8192]
    - [57, 214.98]
  - - [256, 8192, 1, 8192, 256, 256, 8192, 8192]
    - [57, 200.21]
  - - [512, 128, 1, 128, 512, 512, 128, 128]
    - [39, 2.03]
  - - [512, 128, 1, 256, 512, 512, 256, 128]
    - [74, 3.87]
  - - [512, 128, 1, 512, 512, 512, 512, 128]
    - [73, 6.65]
  - - [512, 128, 1, 1024, 512, 512, 1024, 128]
    - [72, 10.69]
  - - [512, 128, 1, 2048, 512, 512, 2048, 128]
    - [72, 15.0]
  - - [512, 128, 1, 4096, 512, 512, 4096, 128]
    - [74, 19.05]
  - - [512, 128, 1, 8192, 512, 512, 8192, 128]
    - [75, 21.81]
  - - [512, 256, 1, 128, 512, 512, 128, 256]
    - [40, 4.11]
  - - [512, 256, 1, 256, 512, 512, 256, 256]
    - [38, 7.72]
  - - [512, 256, 1, 512, 512, 512, 512, 256]
    - [72, 13.43]
  - - [512, 256, 1, 1024, 512, 512, 1024, 256]
    - [72, 21.26]
  - - [512, 256, 1, 2048, 512, 512, 2048, 256]
    - [74, 29.76]
  - - [512, 256, 1, 4096, 512, 512, 4096, 256]
    - [74, 37.49]
  - - [512, 256, 1, 8192, 512, 512, 8192, 256]
    - [77, 42.96]
  - - [512, 512, 1, 128, 512, 512, 128, 512]
    - [37, 7.99]
  - - [512, 512, 1, 256, 512, 512, 256, 512]
    - [68, 14.58]
  - - [512, 512, 1, 512, 512, 512, 512, 512]
    - [67, 24.31]
  - - [512, 512, 1, 1024, 512, 512, 1024, 512]
    - [69, 37.65]
  - - [512, 512, 1, 2048, 512, 512, 2048, 512]
    - [69, 51.63]
  - - [512, 512, 1, 4096, 512, 512, 4096, 512]
    - [71, 63.07]
  - - [512, 512, 1, 8192, 512, 512, 8192, 512]
    - [66, 64.22]
  - - [512, 1024, 1, 128, 512, 512, 128, 1024]
    - [34, 14.8]
  - - [512, 1024, 1, 256, 512, 512, 256, 1024]
    - [34, 25.92]
  - - [512, 1024, 1, 512, 512, 512, 512, 1024]
    - [34, 42.81]
  - - [512, 1024, 1, 1024, 512, 512, 1024, 1024]
    - [64, 63.96]
  - - [512, 1024, 1, 2048, 512, 512, 2048, 1024]
    - [82, 86.21]
  - - [512, 1024, 1, 4096, 512, 512, 4096, 1024]
    - [82, 97.46]
  - - [512, 1024, 1, 8192, 512, 512, 8192, 1024]
    - [84, 106.74]
  - - [512, 2048, 1, 128, 512, 512, 128, 2048]
    - [22, 25.91]
  - - [512, 2048, 1, 256, 512, 512, 256, 2048]
    - [29, 45.25]
  - - [512, 2048, 1, 512, 512, 512, 512, 2048]
    - [30, 73.05]
  - - [512, 2048, 1, 1024, 512, 512, 1024, 2048]
    - [30, 105.99]
  - - [512, 2048, 1, 2048, 512, 512, 2048, 2048]
    - [78, 128.33]
  - - [512, 2048, 1, 4096, 512, 512, 4096, 2048]
    - [78, 151.01]
  - - [512, 2048, 1, 8192, 512, 512, 8192, 2048]
    - [78, 159.97]
  - - [512, 4096, 1, 128, 512, 512, 128, 4096]
    - [56, 40.58]
  - - [512, 4096, 1, 256, 512, 512, 256, 4096]
    - [26, 69.36]
  - - [512, 4096, 1, 512, 512, 512, 512, 4096]
    - [57, 110.7]
  - - [512, 4096, 1, 1024, 512, 512, 1024, 4096]
    - [57, 159.84]
  - - [512, 4096, 1, 2048, 512, 512, 2048, 4096]
    - [57, 193.23]
  - - [512, 4096, 1, 4096, 512, 512, 4096, 4096]
    - [57, 219.9]
  - - [512, 4096, 1, 8192, 512, 512, 8192, 4096]
    - [57, 200.79]
  - - [512, 8192, 1, 128, 512, 512, 128, 8192]
    - [16, 57.56]
  - - [512, 8192, 1, 256, 512, 512, 256, 8192]
    - [17, 98.25]
  - - [512, 8192, 1, 512, 512, 512, 512, 8192]
    - [17, 154.89]
  - - [512, 8192, 1, 1024, 512, 512, 1024, 8192]
    - [17, 217.09]
  - - [512, 8192, 1, 2048, 512, 512, 2048, 8192]
    - [41, 246.65]
  - - [512, 8192, 1, 4096, 512, 512, 4096, 8192]
    - [42, 264.06]
  - - [512, 8192, 1, 8192, 512, 512, 8192, 8192]
    - [41, 237.7]
  - - [1024, 128, 1, 128, 1024, 1024, 128, 128]
    - [38, 4.24]
  - - [1024, 128, 1, 256, 1024, 1024, 256, 128]
    - [38, 7.75]
  - - [1024, 128, 1, 512, 1024, 1024, 512, 128]
    - [72, 13.44]
  - - [1024, 128, 1, 1024, 1024, 1024, 1024, 128]
    - [72, 21.08]
  - - [1024, 128, 1, 2048, 1024, 1024, 2048, 128]
    - [74, 29.72]
  - - [1024, 128, 1, 4096, 1024, 1024, 4096, 128]
    - [74, 37.5]
  - - [1024, 128, 1, 8192, 1024, 1024, 8192, 128]
    - [76, 43.07]
  - - [1024, 256, 1, 128, 1024, 1024, 128, 256]
    - [36, 8.17]
  - - [1024, 256, 1, 256, 1024, 1024, 256, 256]
    - [68, 14.37]
  - - [1024, 256, 1, 512, 1024, 1024, 512, 256]
    - [67, 24.35]
  - - [1024, 256, 1, 1024, 1024, 1024, 1024, 256]
    - [69, 37.26]
  - - [1024, 256, 1, 2048, 1024, 1024, 2048, 256]
    - [69, 51.04]
  - - [1024, 256, 1, 4096, 1024, 1024, 4096, 256]
    - [71, 62.66]
  - - [1024, 256, 1, 8192, 1024, 1024, 8192, 256]
    - [89, 71.15]
  - - [1024, 512, 1, 128, 1024, 1024, 128, 512]
    - [34, 14.6]
  - - [1024, 512, 1, 256, 1024, 1024, 256, 512]
    - [34, 25.84]
  - - [1024, 512, 1, 512, 1024, 1024, 512, 512]
    - [63, 42.85]
  - - [1024, 512, 1, 1024, 1024, 1024, 1024, 512]
    - [63, 64.21]
  - - [1024, 512, 1, 2048, 1024, 1024, 2048, 512]
    - [82, 85.77]
  - - [1024, 512, 1, 4096, 1024, 1024, 4096, 512]
    - [85, 104.03]
  - - [1024, 512, 1, 8192, 1024, 1024, 8192, 512]
    - [85, 107.42]
  - - [1024, 1024, 1, 128, 1024, 1024, 128, 1024]
    - [29, 25.3]
  - - [1024, 1024, 1, 256, 1024, 1024, 256, 1024]
    - [28, 44.88]
  - - [1024, 1024, 1, 512, 1024, 1024, 512, 1024]
    - [30, 73.09]
  - - [1024, 1024, 1, 1024, 1024, 1024, 1024, 1024]
    - [30, 105.87]
  - - [1024, 1024, 1, 2048, 1024, 1024, 2048, 1024]
    - [31, 134.9]
  - - [1024, 1024, 1, 4096, 1024, 1024, 4096, 1024]
    - [79, 148.14]
  - - [1024, 1024, 1, 8192, 1024, 1024, 8192, 1024]
    - [80, 161.1]
  - - [1024, 2048, 1, 128, 1024, 1024, 128, 2048]
    - [26, 41.0]
  - - [1024, 2048, 1, 256, 1024, 1024, 256, 2048]
    - [26, 69.48]
  - - [1024, 2048, 1, 512, 1024, 1024, 512, 2048]
    - [57, 111.43]
  - - [1024, 2048, 1, 1024, 1024, 1024, 1024, 2048]
    - [57, 159.16]
  - - [1024, 2048, 1, 2048, 1024, 1024, 2048, 2048]
    - [57, 193.72]
  - - [1024, 2048, 1, 4096, 1024, 1024, 4096, 2048]
    - [58, 217.89]
  - - [1024, 2048, 1, 8192, 1024, 1024, 8192, 2048]
    - [57, 204.86]
  - - [1024, 4096, 1, 128, 1024, 1024, 128, 4096]
    - [16, 57.6]
  - - [1024, 4096, 1, 256, 1024, 1024, 256, 4096]
    - [15, 99.42]
  - - [1024, 4096, 1, 512, 1024, 1024, 512, 4096]
    - [17, 156.24]
  - - [1024, 4096, 1, 1024, 1024, 1024, 1024, 4096]
    - [15, 211.4]
  - - [1024, 4096, 1, 2048, 1024, 1024, 2048, 4096]
    - [46, 252.14]
  - - [1024, 4096, 1, 4096, 1024, 1024, 4096, 4096]
    - [41, 267.15]
  - - [1024, 4096, 1, 8192, 1024, 1024, 8192, 4096]
    - [47, 240.05]
  - - [1024, 8192, 1, 128, 1024, 1024, 128, 8192]
    - [9, 73.61]
  - - [1024, 8192, 1, 256, 1024, 1024, 256, 8192]
    - [9, 123.34]
  - - [1024, 8192, 1, 512, 1024, 1024, 512, 8192]
    - [2, 184.66]
  - - [1024, 8192, 1, 1024, 1024, 1024, 1024, 8192]
    - [3, 246.51]
  - - [1024, 8192, 1, 2048, 1024, 1024, 2048, 8192]
    - [9, 280.76]
  - - [1024, 8192, 1, 4096, 1024, 1024, 4096, 8192]
    - [6, 264.09]
  - - [1024, 8192, 1, 8192, 1024, 1024, 8192, 8192]
    - [2, 286.0]
  - - [2048, 128, 1, 128, 2048, 2048, 128, 128]
    - [36, 7.93]
  - - [2048, 128, 1, 256, 2048, 2048, 256, 128]
    - [36, 14.46]
  - - [2048, 128, 1, 512, 2048, 2048, 512, 128]
    - [67, 24.26]
  - - [2048, 128, 1, 1024, 2048, 2048, 1024, 128]
    - [69, 37.67]
  - - [2048, 128, 1, 2048, 2048, 2048, 2048, 128]
    - [69, 51.67]
  - - [2048, 128, 1, 4096, 2048, 2048, 4096, 128]
    - [70, 62.72]
  - - [2048, 128, 1, 8192, 2048, 2048, 8192, 128]
    - [87, 70.96]
  - - [2048, 256, 1, 128, 2048, 2048, 128, 256]
    - [35, 14.68]
  - - [2048, 256, 1, 256, 2048, 2048, 256, 256]
    - [35, 26.08]
  - - [2048, 256, 1, 512, 2048, 2048, 512, 256]
    - [63, 43.01]
  - - [2048, 256, 1, 1024, 2048, 2048, 1024, 256]
    - [63, 64.12]
  - - [2048, 256, 1, 2048, 2048, 2048, 2048, 256]
    - [82, 86.52]
  - - [2048, 256, 1, 4096, 2048, 2048, 4096, 256]
    - [85, 104.75]
  - - [2048, 256, 1, 8192, 2048, 2048, 8192, 256]
    - [85, 117.36]
  - - [2048, 512, 1, 128, 2048, 2048, 128, 512]
    - [28, 25.39]
  - - [2048, 512, 1, 256, 2048, 2048, 256, 512]
    - [30, 44.81]
  - - [2048, 512, 1, 512, 2048, 2048, 512, 512]
    - [30, 72.57]
  - - [2048, 512, 1, 1024, 2048, 2048, 1024, 512]
    - [30, 105.6]
  - - [2048, 512, 1, 2048, 2048, 2048, 2048, 512]
    - [31, 135.99]
  - - [2048, 512, 1, 4096, 2048, 2048, 4096, 512]
    - [81, 152.39]
  - - [2048, 512, 1, 8192, 2048, 2048, 8192, 512]
    - [81, 162.28]
  - - [2048, 1024, 1, 128, 2048, 2048, 128, 1024]
    - [26, 40.69]
  - - [2048, 1024, 1, 256, 2048, 2048, 256, 1024]
    - [21, 69.65]
  - - [2048, 1024, 1, 512, 2048, 2048, 512, 1024]
    - [57, 110.98]
  - - [2048, 1024, 1, 1024, 2048, 2048, 1024, 1024]
    - [57, 161.06]
  - - [2048, 1024, 1, 2048, 2048, 2048, 2048, 1024]
    - [60, 198.65]
  - - [2048, 1024, 1, 4096, 2048, 2048, 4096, 1024]
    - [58, 213.38]
  - - [2048, 1024, 1, 8192, 2048, 2048, 8192, 1024]
    - [58, 209.23]
  - - [2048, 2048, 1, 128, 2048, 2048, 128, 2048]
    - [20, 58.4]
  - - [2048, 2048, 1, 256, 2048, 2048, 256, 2048]
    - [15, 99.42]
  - - [2048, 2048, 1, 512, 2048, 2048, 512, 2048]
    - [17, 155.85]
  - - [2048, 2048, 1, 1024, 2048, 2048, 1024, 2048]
    - [17, 205.5]
  - - [2048, 2048, 1, 2048, 2048, 2048, 2048, 2048]
    - [48, 247.86]
  - - [2048, 2048, 1, 4096, 2048, 2048, 4096, 2048]
    - [43, 264.46]
  - - [2048, 2048, 1, 8192, 2048, 2048, 8192, 2048]
    - [50, 237.9]
  - - [2048, 4096, 1, 128, 2048, 2048, 128, 4096]
    - [3, 72.39]
  - - [2048, 4096, 1, 256, 2048, 2048, 256, 4096]
    - [2, 122.4]
  - - [2048, 4096, 1, 512, 2048, 2048, 512, 4096]
    - [2, 183.4]
  - - [2048, 4096, 1, 1024, 2048, 2048, 1024, 4096]
    - [9, 248.07]
  - - [2048, 4096, 1, 2048, 2048, 2048, 2048, 4096]
    - [9, 280.43]
  - - [2048, 4096, 1, 4096, 2048, 2048, 4096, 4096]
    - [6, 266.29]
  - - [2048, 4096, 1, 8192, 2048, 2048, 8192, 4096]
    - [9, 283.64]
  - - [2048, 8192, 1, 128, 2048, 2048, 128, 8192]
    - [1, 79.19]
  - - [2048, 8192, 1, 256, 2048, 2048, 256, 8192]
    - [9, 132.9]
  - - [2048, 8192, 1, 512, 2048, 2048, 512, 8192]
    - [9, 198.68]
  - - [2048, 8192, 1, 1024, 2048, 2048, 1024, 8192]
    - [9, 239.3]
  - - [2048, 8192, 1, 2048, 2048, 2048, 2048, 8192]
    - [11, 245.76]
  - - [2048, 8192, 1, 4096, 2048, 2048, 4096, 8192]
    - [41, 276.29]
  - - [2048, 8192, 1, 8192, 2048, 2048, 8192, 8192]
    - [5, 310.79]
  - - [4096, 128, 1, 128, 4096, 4096, 128, 128]
    - [33, 14.49]
  - - [4096, 128, 1, 256, 4096, 4096, 256, 128]
    - [34, 25.58]
  - - [4096, 128, 1, 512, 4096, 4096, 512, 128]
    - [63, 42.54]
  - - [4096, 128, 1, 1024, 4096, 4096, 1024, 128]
    - [63, 63.61]
  - - [4096, 128, 1, 2048, 4096, 4096, 2048, 128]
    - [82, 86.02]
  - - [4096, 128, 1, 4096, 4096, 4096, 4096, 128]
    - [84, 104.52]
  - - [4096, 128, 1, 8192, 4096, 4096, 8192, 128]
    - [83, 117.34]
  - - [4096, 256, 1, 128, 4096, 4096, 128, 256]
    - [24, 24.95]
  - - [4096, 256, 1, 256, 4096, 4096, 256, 256]
    - [30, 43.58]
  - - [4096, 256, 1, 512, 4096, 4096, 512, 256]
    - [32, 71.91]
  - - [4096, 256, 1, 1024, 4096, 4096, 1024, 256]
    - [31, 105.04]
  - - [4096, 256, 1, 2048, 4096, 4096, 2048, 256]
    - [32, 135.87]
  - - [4096, 256, 1, 4096, 4096, 4096, 4096, 256]
    - [79, 152.46]
  - - [4096, 256, 1, 8192, 4096, 4096, 8192, 256]
    - [81, 161.48]
  - - [4096, 512, 1, 128, 4096, 4096, 128, 512]
    - [26, 41.21]
  - - [4096, 512, 1, 256, 4096, 4096, 256, 512]
    - [21, 70.23]
  - - [4096, 512, 1, 512, 4096, 4096, 512, 512]
    - [57, 111.42]
  - - [4096, 512, 1, 1024, 4096, 4096, 1024, 512]
    - [57, 159.62]
  - - [4096, 512, 1, 2048, 4096, 4096, 2048, 512]
    - [58, 200.4]
  - - [4096, 512, 1, 4096, 4096, 4096, 4096, 512]
    - [60, 211.11]
  - - [4096, 512, 1, 8192, 4096, 4096, 8192, 512]
    - [58, 206.63]
  - - [4096, 1024, 1, 128, 4096, 4096, 128, 1024]
    - [16, 57.67]
  - - [4096, 1024, 1, 256, 4096, 4096, 256, 1024]
    - [15, 98.96]
  - - [4096, 1024, 1, 512, 4096, 4096, 512, 1024]
    - [17, 155.32]
  - - [4096, 1024, 1, 1024, 4096, 4096, 1024, 1024]
    - [19, 208.68]
  - - [4096, 1024, 1, 2048, 4096, 4096, 2048, 1024]
    - [49, 252.49]
  - - [4096, 1024, 1, 4096, 4096, 4096, 4096, 1024]
    - [44, 263.3]
  - - [4096, 1024, 1, 8192, 4096, 4096, 8192, 1024]
    - [45, 243.76]
  - - [4096, 2048, 1, 128, 4096, 4096, 128, 2048]
    - [2, 72.61]
  - - [4096, 2048, 1, 256, 4096, 4096, 256, 2048]
    - [2, 123.11]
  - - [4096, 2048, 1, 512, 4096, 4096, 512, 2048]
    - [3, 184.14]
  - - [4096, 2048, 1, 1024, 4096, 4096, 1024, 2048]
    - [3, 246.22]
  - - [4096, 2048, 1, 2048, 4096, 4096, 2048, 2048]
    - [3, 283.8]
  - - [4096, 2048, 1, 4096, 4096, 4096, 4096, 2048]
    - [52, 268.69]
  - - [4096, 2048, 1, 8192, 4096, 4096, 8192, 2048]
    - [53, 291.1]
  - - [4096, 4096, 1, 128, 4096, 4096, 128, 4096]
    - [9, 78.02]
  - - [4096, 4096, 1, 256, 4096, 4096, 256, 4096]
    - [9, 131.45]
  - - [4096, 4096, 1, 512, 4096, 4096, 512, 4096]
    - [10, 194.08]
  - - [4096, 4096, 1, 1024, 4096, 4096, 1024, 4096]
    - [9, 245.01]
  - - [4096, 4096, 1, 2048, 4096, 4096, 2048, 4096]
    - [14, 245.86]
  - - [4096, 4096, 1, 4096, 4096, 4096, 4096, 4096]
    - [53, 278.81]
  - - [4096, 4096, 1, 8192, 4096, 4096, 8192, 4096]
    - [52, 326.92]
  - - [4096, 8192, 1, 128, 4096, 4096, 128, 8192]
    - [8, 84.1]
  - - [4096, 8192, 1, 256, 4096, 4096, 256, 8192]
    - [25, 141.3]
  - - [4096, 8192, 1, 512, 4096, 4096, 512, 8192]
    - [13, 203.1]
  - - [4096, 8192, 1, 1024, 4096, 4096, 1024, 8192]
    - [43, 236.83]
  - - [4096, 8192, 1, 2048, 4096, 4096, 2048, 8192]
    - [43, 289.41]
  - - [4096, 8192, 1, 4096, 4096, 4096, 4096, 8192]
    - [2, 333.86]
  - - [4096, 8192, 1, 8192, 4096, 4096, 8192, 8192]
    - [2, 364.37]
  - - [8192, 128, 1, 128, 8192, 8192, 128, 128]
    - [23, 26.12]
  - - [8192, 128, 1, 256, 8192, 8192, 256, 128]
    - [29, 45.58]
  - - [8192, 128, 1, 512, 8192, 8192, 512, 128]
    - [30, 74.89]
  - - [8192, 128, 1, 1024, 8192, 8192, 1024, 128]
    - [30, 107.02]
  - - [8192, 128, 1, 2048, 8192, 8192, 2048, 128]
    - [31, 135.32]
  - - [8192, 128, 1, 4096, 8192, 8192, 4096, 128]
    - [61, 146.9]
  - - [8192, 128, 1, 8192, 8192, 8192, 8192, 128]
    - [84, 158.31]
  - - [8192, 256, 1, 128, 8192, 8192, 128, 256]
    - [56, 40.79]
  - - [8192, 256, 1, 256, 8192, 8192, 256, 256]
    - [25, 69.45]
  - - [8192, 256, 1, 512, 8192, 8192, 512, 256]
    - [57, 110.96]
  - - [8192, 256, 1, 1024, 8192, 8192, 1024, 256]
    - [57, 160.17]
  - - [8192, 256, 1, 2048, 8192, 8192, 2048, 256]
    - [59, 198.78]
  - - [8192, 256, 1, 4096, 8192, 8192, 4096, 256]
    - [58, 207.93]
  - - [8192, 256, 1, 8192, 8192, 8192, 8192, 256]
    - [58, 204.05]
  - - [8192, 512, 1, 128, 8192, 8192, 128, 512]
    - [16, 58.12]
  - - [8192, 512, 1, 256, 8192, 8192, 256, 512]
    - [15, 99.87]
  - - [8192, 512, 1, 512, 8192, 8192, 512, 512]
    - [19, 154.78]
  - - [8192, 512, 1, 1024, 8192, 8192, 1024, 512]
    - [55, 225.96]
  - - [8192, 512, 1, 2048, 8192, 8192, 2048, 512]
    - [55, 256.89]
  - - [8192, 512, 1, 4096, 8192, 8192, 4096, 512]
    - [55, 277.1]
  - - [8192, 512, 1, 8192, 8192, 8192, 8192, 512]
    - [54, 264.74]
  - - [8192, 1024, 1, 128, 8192, 8192, 128, 1024]
    - [9, 71.62]
  - - [8192, 1024, 1, 256, 8192, 8192, 256, 1024]
    - [9, 120.52]
  - - [8192, 1024, 1, 512, 8192, 8192, 512, 1024]
    - [53, 186.04]
  - - [8192, 1024, 1, 1024, 8192, 8192, 1024, 1024]
    - [6, 246.16]
  - - [8192, 1024, 1, 2048, 8192, 8192, 2048, 1024]
    - [50, 301.68]
  - - [8192, 1024, 1, 4096, 8192, 8192, 4096, 1024]
    - [52, 339.39]
  - - [8192, 1024, 1, 8192, 8192, 8192, 8192, 1024]
    - [53, 370.74]
  - - [8192, 2048, 1, 128, 8192, 8192, 128, 2048]
    - [9, 77.25]
  - - [8192, 2048, 1, 256, 8192, 8192, 256, 2048]
    - [2, 129.97]
  - - [8192, 2048, 1, 512, 8192, 8192, 512, 2048]
    - [9, 196.6]
  - - [8192, 2048, 1, 1024, 8192, 8192, 1024, 2048]
    - [51, 256.35]
  - - [8192, 2048, 1, 2048, 8192, 8192, 2048, 2048]
    - [50, 300.94]
  - - [8192, 2048, 1, 4096, 8192, 8192, 4096, 2048]
    - [50, 343.57]
  - - [8192, 2048, 1, 8192, 8192, 8192, 8192, 2048]
    - [50, 389.44]
  - - [8192, 4096, 1, 128, 8192, 8192, 128, 4096]
    - [0, 82.92]
  - - [8192, 4096, 1, 256, 8192, 8192, 256, 4096]
    - [27, 136.69]
  - - [8192, 4096, 1, 512, 8192, 8192, 512, 4096]
    - [12, 199.66]
  - - [8192, 4096, 1, 1024, 8192, 8192, 1024, 4096]
    - [52, 240.84]
  - - [8192, 4096, 1, 2048, 8192, 8192, 2048, 4096]
    - [53, 304.1]
  - - [8192, 4096, 1, 4096, 8192, 8192, 4096, 4096]
    - [50, 361.58]
  - - [8192, 4096, 1, 8192, 8192, 8192, 8192, 4096]
    - [52, 407.3]
  - - [8192, 8192, 1, 128, 8192, 8192, 128, 8192]
    - [21, 88.2]
  - - [8192, 8192, 1, 256, 8192, 8192, 256, 8192]
    - [18, 146.45]
  - - [8192, 8192, 1, 512, 8192, 8192, 512, 8192]
    - [4, 209.51]
  - - [8192, 8192, 1, 1024, 8192, 8192, 1024, 8192]
    - [6, 277.85]
  - - [8192, 8192, 1, 2048, 8192, 8192, 2048, 8192]
    - [7, 333.56]
  - - [8192, 8192, 1, 4096, 8192, 8192, 4096, 8192]
    - [53, 374.58]
  - - [8192, 8192, 1, 8192, 8192, 8192, 8192, 8192]
    - [52, 408.58]
- null
- null
- ExperimentalStreamK
- GridBased
