projects/hipblaslt/library/src/amd_detail/rocblaslt/src/Tensile/Logic/asm_full/aquavanjaram/gfx942_228cu/StreamK/aquavanjaram942_Cijk_Ailk_Bjlk_F8B8NB8NS_BH_Bias_HAS_SAV_UserArgs.yaml
- {MinimumRequiredVersion: 4.33.0}
- aquavanjaram942
- {Architecture: gfx942, CUCount: 228}
- [Device 0049, Device 0050]
    SolutionIndex: 0
    SolutionNameMin: Cijk_Ailk_Bjlk_F8B8NB8NS_BH_Bias_HAS_SAV_UserArgs_MT256x256x64_MI16x16x1_SN_LDSB0_CLR1_GRVWA16_GRVWB4_GSU0_GSUC0_GSUWGMRR0_K1_LBSPPA2048_LBSPPB2048_LPA0_LPB0_MIWT8_8_PLR1_SU0_SUM0_SUS64_VWA8_VWB8_WGM1_WGMXCC1_WGMXCCGn1
    SolutionIndex: 1
    SolutionNameMin: Cijk_Ailk_Bjlk_F8B8NB8NS_BH_Bias_HAS_SAV_UserArgs_MT256x256x64_MI16x16x1_SN_LDSB0_CLR1_GRVWA4_GRVWB8_GSU0_GSUC0_GSUWGMRR0_K1_LBSPPA2048_LBSPPB2048_LPA0_LPB0_MIWT8_8_PLR1_SU0_SUM0_SUS64_VWA8_VWB8_WGM1_WGMXCC1_WGMXCCGn1
    SolutionIndex: 2
    SolutionNameMin: Cijk_Ailk_Bjlk_F8B8NB8NS_BH_Bias_HAS_SAV_UserArgs_MT256x256x64_MI16x16x1_SN_LDSB0_CLR1_GRVWA4_GRVWB16_GSU0_GSUC0_GSUWGMRR0_K1_LBSPPA2048_LBSPPB2048_LPA0_LPB0_MIWT8_8_PLR1_SU0_SUM0_SUS64_VWA8_VWB8_WGM1_WGMXCC1_WGMXCCGn1
    SolutionIndex: 3
    SolutionNameMin: Cijk_Ailk_Bjlk_F8B8NB8NS_BH_Bias_HAS_SAV_UserArgs_MT256x256x64_MI16x16x1_SN_LDSB0_CLR1_GRVWA16_GRVWB16_GSU0_GSUC0_GSUWGMRR0_K1_LBSPPA2048_LBSPPB2048_LPA0_LPB0_MIWT8_8_PLR1_SU0_SUM0_SUS64_VWA8_VWB8_WGM1_WGMXCC1_WGMXCCGn1
    SolutionIndex: 4
    SolutionNameMin: Cijk_Ailk_Bjlk_F8B8NB8NS_BH_Bias_HAS_SAV_UserArgs_MT256x256x64_MI16x16x1_SN_LDSB0_CLR1_GRVWA16_GRVWB4_GSU0_GSUC0_GSUWGMRR0_K1_LBSPPA2048_LBSPPB2048_LPA0_LPB0_MIWT8_8_PLR1_SU0_SUM0_SUS64_VWA8_VWB8_WGM4_WGMXCC1_WGMXCCGn1
    SolutionIndex: 5
    SolutionNameMin: Cijk_Ailk_Bjlk_F8B8NB8NS_BH_Bias_HAS_SAV_UserArgs_MT256x256x64_MI16x16x1_SN_LDSB0_CLR1_GRVWA16_GRVWB16_GSU0_GSUC0_GSUWGMRR0_K1_LBSPPA2048_LBSPPB2048_LPA0_LPB0_MIWT8_8_PLR1_SU0_SUM0_SUS64_VWA8_VWB8_WGM4_WGMXCC1_WGMXCCGn1
    SolutionIndex: 6
    SolutionNameMin: Cijk_Ailk_Bjlk_F8B8NB8NS_BH_Bias_HAS_SAV_UserArgs_MT256x256x64_MI16x16x1_SN_LDSB0_CLR1_GRVWA4_GRVWB8_GSU0_GSUC0_GSUWGMRR0_K1_LBSPPA2048_LBSPPB2048_LPA0_LPB0_MIWT8_8_PLR1_SU0_SUM0_SUS64_VWA8_VWB8_WGM6_WGMXCC1_WGMXCCGn1
    SolutionIndex: 7
    SolutionNameMin: Cijk_Ailk_Bjlk_F8B8NB8NS_BH_Bias_HAS_SAV_UserArgs_MT256x256x64_MI16x16x1_SN_LDSB0_CLR1_GRVWA16_GRVWB16_GSU0_GSUC0_GSUWGMRR0_K1_LBSPPA2048_LBSPPB2048_LPA0_LPB0_MIWT8_8_PLR1_SU0_SUM0_SUS64_VWA8_VWB8_WGM6_WGMXCC1_WGMXCCGn1
    SolutionIndex: 8
    SolutionNameMin: Cijk_Ailk_Bjlk_F8B8NB8NS_BH_Bias_HAS_SAV_UserArgs_MT256x256x64_MI16x16x1_SN_LDSB0_CLR1_GRVWA16_GRVWB4_GSU0_GSUC0_GSUWGMRR0_K1_LBSPPA2048_LBSPPB2048_LPA0_LPB0_MIWT8_8_PLR1_SU0_SUM0_SUS64_VWA8_VWB8_WGM8_WGMXCC1_WGMXCCGn1
    SolutionIndex: 9
    SolutionNameMin: Cijk_Ailk_Bjlk_F8B8NB8NS_BH_Bias_HAS_SAV_UserArgs_MT256x256x64_MI16x16x1_SN_LDSB0_CLR1_GRVWA4_GRVWB8_GSU0_GSUC0_GSUWGMRR0_K1_LBSPPA2048_LBSPPB2048_LPA0_LPB0_MIWT8_8_PLR1_SU0_SUM0_SUS64_VWA8_VWB8_WGM8_WGMXCC1_WGMXCCGn1
    SolutionIndex: 10
    SolutionNameMin: Cijk_Ailk_Bjlk_F8B8NB8NS_BH_Bias_HAS_SAV_UserArgs_MT256x256x64_MI16x16x1_SN_LDSB0_CLR1_GRVWA16_GRVWB16_GSU0_GSUC0_GSUWGMRR0_K1_LBSPPA2048_LBSPPB2048_LPA0_LPB0_MIWT8_8_PLR1_SU0_SUM0_SUS64_VWA8_VWB8_WGM8_WGMXCC1_WGMXCCGn1
    SolutionIndex: 11
    SolutionNameMin: Cijk_Ailk_Bjlk_F8B8NB8NS_BH_Bias_HAS_SAV_UserArgs_MT128x256x64_MI16x16x1_SN_LDSB1_CLR1_GRVWA4_GRVWB16_GSU0_GSUC0_GSUWGMRR0_K1_LBSPPA1024_LBSPPB2048_LPA64_LPB0_MIWT4_8_PLR1_SU0_SUM0_SUS64_VWA4_VWB8_WGM1_WGMXCC1_WGMXCCGn1
    SolutionIndex: 12
    SolutionNameMin: Cijk_Ailk_Bjlk_F8B8NB8NS_BH_Bias_HAS_SAV_UserArgs_MT128x256x64_MI16x16x1_SN_LDSB1_CLR1_GRVWA8_GRVWB16_GSU0_GSUC0_GSUWGMRR0_K1_LBSPPA1024_LBSPPB2048_LPA64_LPB0_MIWT4_8_PLR1_SU0_SUM0_SUS64_VWA4_VWB8_WGM1_WGMXCC1_WGMXCCGn1
    SolutionIndex: 13
    SolutionNameMin: Cijk_Ailk_Bjlk_F8B8NB8NS_BH_Bias_HAS_SAV_UserArgs_MT128x256x64_MI16x16x1_SN_LDSB1_CLR1_GRVWA16_GRVWB16_GSU0_GSUC0_GSUWGMRR0_K1_LBSPPA1024_LBSPPB2048_LPA64_LPB0_MIWT4_8_PLR1_SU0_SUM0_SUS64_VWA4_VWB8_WGM1_WGMXCC1_WGMXCCGn1
    SolutionIndex: 14
    SolutionNameMin: Cijk_Ailk_Bjlk_F8B8NB8NS_BH_Bias_HAS_SAV_UserArgs_MT128x256x64_MI16x16x1_SN_LDSB1_CLR1_GRVWA8_GRVWB16_GSU0_GSUC0_GSUWGMRR0_K1_LBSPPA1024_LBSPPB2048_LPA64_LPB0_MIWT4_8_PLR1_SU0_SUM0_SUS64_VWA4_VWB8_WGM4_WGMXCC1_WGMXCCGn1
    SolutionIndex: 15
    SolutionNameMin: Cijk_Ailk_Bjlk_F8B8NB8NS_BH_Bias_HAS_SAV_UserArgs_MT128x256x64_MI16x16x1_SN_LDSB1_CLR1_GRVWA4_GRVWB16_GSU0_GSUC0_GSUWGMRR0_K1_LBSPPA1024_LBSPPB2048_LPA64_LPB0_MIWT4_8_PLR1_SU0_SUM0_SUS64_VWA4_VWB8_WGM6_WGMXCC1_WGMXCCGn1
    SolutionIndex: 16
    SolutionNameMin: Cijk_Ailk_Bjlk_F8B8NB8NS_BH_Bias_HAS_SAV_UserArgs_MT128x256x64_MI16x16x1_SN_LDSB1_CLR1_GRVWA4_GRVWB16_GSU0_GSUC0_GSUWGMRR0_K1_LBSPPA1024_LBSPPB2048_LPA64_LPB0_MIWT4_8_PLR1_SU0_SUM0_SUS64_VWA4_VWB8_WGM8_WGMXCC1_WGMXCCGn1
    SolutionIndex: 17
    SolutionNameMin: Cijk_Ailk_Bjlk_F8B8NB8NS_BH_Bias_HAS_SAV_UserArgs_MT128x256x64_MI16x16x1_SN_LDSB1_CLR1_GRVWA16_GRVWB16_GSU0_GSUC0_GSUWGMRR0_K1_LBSPPA1024_LBSPPB2048_LPA64_LPB0_MIWT4_8_PLR1_SU0_SUM0_SUS64_VWA4_VWB8_WGM8_WGMXCC1_WGMXCCGn1
    SolutionIndex: 18
    SolutionNameMin: Cijk_Ailk_Bjlk_F8B8NB8NS_BH_Bias_HAS_SAV_UserArgs_MT256x144x64_MI16x16x1_SN_LDSB0_CLR1_GRVWA4_GRVWB4_GSU0_GSUC0_GSUWGMRR0_K1_LBSPPA2048_LBSPPB1152_LPA64_LPB16_MIWT4_9_PLR1_SU0_SUM0_SUS64_VWA4_VWB1_WGM1_WGMXCC1_WGMXCCGn1
    SolutionIndex: 19
    SolutionNameMin: Cijk_Ailk_Bjlk_F8B8NB8NS_BH_Bias_HAS_SAV_UserArgs_MT256x144x64_MI16x16x1_SN_LDSB0_CLR1_GRVWA16_GRVWB4_GSU0_GSUC0_GSUWGMRR0_K1_LBSPPA2048_LBSPPB1152_LPA64_LPB16_MIWT4_9_PLR1_SU0_SUM0_SUS64_VWA4_VWB1_WGM1_WGMXCC1_WGMXCCGn1
    SolutionIndex: 20
    SolutionNameMin: Cijk_Ailk_Bjlk_F8B8NB8NS_BH_Bias_HAS_SAV_UserArgs_MT256x144x64_MI16x16x1_SN_LDSB0_CLR1_GRVWA16_GRVWB4_GSU0_GSUC0_GSUWGMRR0_K1_LBSPPA2048_LBSPPB1152_LPA64_LPB16_MIWT4_9_PLR1_SU0_SUM0_SUS64_VWA4_VWB1_WGM4_WGMXCC1_WGMXCCGn1
    SolutionIndex: 21
    SolutionNameMin: Cijk_Ailk_Bjlk_F8B8NB8NS_BH_Bias_HAS_SAV_UserArgs_MT256x144x64_MI16x16x1_SN_LDSB0_CLR1_GRVWA4_GRVWB4_GSU0_GSUC0_GSUWGMRR0_K1_LBSPPA2048_LBSPPB1152_LPA64_LPB16_MIWT4_9_PLR1_SU0_SUM0_SUS64_VWA4_VWB1_WGM8_WGMXCC1_WGMXCCGn1
    SolutionIndex: 22
    SolutionNameMin: Cijk_Ailk_Bjlk_F8B8NB8NS_BH_Bias_HAS_SAV_UserArgs_MT256x144x64_MI16x16x1_SN_LDSB0_CLR1_GRVWA16_GRVWB4_GSU0_GSUC0_GSUWGMRR0_K1_LBSPPA2048_LBSPPB1152_LPA64_LPB16_MIWT4_9_PLR1_SU0_SUM0_SUS64_VWA4_VWB1_WGM8_WGMXCC1_WGMXCCGn1
    SolutionIndex: 23
    SolutionNameMin: Cijk_Ailk_Bjlk_F8B8NB8NS_BH_Bias_HAS_SAV_UserArgs_MT256x128x64_MI16x16x1_SN_LDSB1_CLR1_GRVWA16_GRVWB4_GSU0_GSUC0_GSUWGMRR0_K1_LBSPPA2048_LBSPPB1024_LPA0_LPB64_MIWT8_4_PLR1_SU0_SUM0_SUS64_VWA8_VWB4_WGM1_WGMXCC1_WGMXCCGn1
    SolutionIndex: 24
    SolutionNameMin: Cijk_Ailk_Bjlk_F8B8NB8NS_BH_Bias_HAS_SAV_UserArgs_MT256x128x64_MI16x16x1_SN_LDSB1_CLR1_GRVWA4_GRVWB8_GSU0_GSUC0_GSUWGMRR0_K1_LBSPPA2048_LBSPPB1024_LPA0_LPB64_MIWT8_4_PLR1_SU0_SUM0_SUS64_VWA8_VWB4_WGM1_WGMXCC1_WGMXCCGn1
    SolutionIndex: 25
    SolutionNameMin: Cijk_Ailk_Bjlk_F8B8NB8NS_BH_Bias_HAS_SAV_UserArgs_MT256x128x64_MI16x16x1_SN_LDSB1_CLR1_GRVWA16_GRVWB8_GSU0_GSUC0_GSUWGMRR0_K1_LBSPPA2048_LBSPPB1024_LPA0_LPB64_MIWT8_4_PLR1_SU0_SUM0_SUS64_VWA8_VWB4_WGM1_WGMXCC1_WGMXCCGn1
    SolutionIndex: 26
    SolutionNameMin: Cijk_Ailk_Bjlk_F8B8NB8NS_BH_Bias_HAS_SAV_UserArgs_MT256x128x64_MI16x16x1_SN_LDSB1_CLR1_GRVWA16_GRVWB16_GSU0_GSUC0_GSUWGMRR0_K1_LBSPPA2048_LBSPPB1024_LPA0_LPB64_MIWT8_4_PLR1_SU0_SUM0_SUS64_VWA8_VWB4_WGM1_WGMXCC1_WGMXCCGn1
    SolutionIndex: 27
    SolutionNameMin: Cijk_Ailk_Bjlk_F8B8NB8NS_BH_Bias_HAS_SAV_UserArgs_MT256x128x64_MI16x16x1_SN_LDSB1_CLR1_GRVWA16_GRVWB16_GSU0_GSUC0_GSUWGMRR0_K1_LBSPPA2048_LBSPPB1024_LPA0_LPB64_MIWT8_4_PLR1_SU0_SUM0_SUS64_VWA8_VWB4_WGM4_WGMXCC1_WGMXCCGn1
    SolutionIndex: 28
    SolutionNameMin: Cijk_Ailk_Bjlk_F8B8NB8NS_BH_Bias_HAS_SAV_UserArgs_MT256x128x64_MI16x16x1_SN_LDSB1_CLR1_GRVWA16_GRVWB16_GSU0_GSUC0_GSUWGMRR0_K1_LBSPPA2048_LBSPPB1024_LPA0_LPB64_MIWT8_4_PLR1_SU0_SUM0_SUS64_VWA8_VWB4_WGM6_WGMXCC1_WGMXCCGn1
    SolutionIndex: 29
    SolutionNameMin: Cijk_Ailk_Bjlk_F8B8NB8NS_BH_Bias_HAS_SAV_UserArgs_MT256x128x64_MI16x16x1_SN_LDSB1_CLR1_GRVWA16_GRVWB16_GSU0_GSUC0_GSUWGMRR0_K1_LBSPPA2048_LBSPPB1024_LPA0_LPB64_MIWT8_4_PLR1_SU0_SUM0_SUS64_VWA8_VWB4_WGM8_WGMXCC1_WGMXCCGn1
    SolutionIndex: 30
    SolutionNameMin: Cijk_Ailk_Bjlk_F8B8NB8NS_BH_Bias_HAS_SAV_UserArgs_MT128x128x64_MI16x16x1_SN_LDSB1_CLR1_GRVWA4_GRVWB4_GSU0_GSUC0_GSUWGMRR0_K1_LBSPPA1024_LBSPPB1024_LPA0_LPB32_MIWT8_2_PLR1_SU0_SUM0_SUS64_VWA8_VWB2_WGM1_WGMXCC1_WGMXCCGn1
    SolutionIndex: 31
    SolutionNameMin: Cijk_Ailk_Bjlk_F8B8NB8NS_BH_Bias_HAS_SAV_UserArgs_MT128x128x64_MI16x16x1_SN_LDSB1_CLR1_GRVWA4_GRVWB16_GSU0_GSUC0_GSUWGMRR0_K1_LBSPPA1024_LBSPPB1024_LPA64_LPB64_MIWT4_4_PLR1_SU0_SUM0_SUS64_VWA4_VWB4_WGM1_WGMXCC1_WGMXCCGn1
    SolutionIndex: 32
    SolutionNameMin: Cijk_Ailk_Bjlk_F8B8NB8NS_BH_Bias_HAS_SAV_UserArgs_MT128x128x64_MI16x16x1_SN_LDSB1_CLR1_GRVWA8_GRVWB16_GSU0_GSUC0_GSUWGMRR0_K1_LBSPPA1024_LBSPPB1024_LPA64_LPB64_MIWT4_4_PLR1_SU0_SUM0_SUS64_VWA4_VWB4_WGM1_WGMXCC1_WGMXCCGn1
    SolutionIndex: 33
    SolutionNameMin: Cijk_Ailk_Bjlk_F8B8NB8NS_BH_Bias_HAS_SAV_UserArgs_MT128x128x64_MI16x16x1_SN_LDSB1_CLR1_GRVWA16_GRVWB16_GSU0_GSUC0_GSUWGMRR0_K1_LBSPPA1024_LBSPPB1024_LPA64_LPB64_MIWT4_4_PLR1_SU0_SUM0_SUS64_VWA4_VWB4_WGM1_WGMXCC1_WGMXCCGn1
    SolutionIndex: 34
    SolutionNameMin: Cijk_Ailk_Bjlk_F8B8NB8NS_BH_Bias_HAS_SAV_UserArgs_MT128x128x64_MI16x16x1_SN_LDSB1_CLR1_GRVWA16_GRVWB8_GSU0_GSUC0_GSUWGMRR0_K1_LBSPPA1024_LBSPPB1024_LPA64_LPB64_MIWT4_4_PLR1_SU0_SUM0_SUS64_VWA4_VWB4_WGM4_WGMXCC1_WGMXCCGn1
    SolutionIndex: 35
    SolutionNameMin: Cijk_Ailk_Bjlk_F8B8NB8NS_BH_Bias_HAS_SAV_UserArgs_MT128x128x64_MI16x16x1_SN_LDSB1_CLR1_GRVWA8_GRVWB16_GSU0_GSUC0_GSUWGMRR0_K1_LBSPPA1024_LBSPPB1024_LPA64_LPB64_MIWT4_4_PLR1_SU0_SUM0_SUS64_VWA4_VWB4_WGM4_WGMXCC1_WGMXCCGn1
    SolutionIndex: 36
    SolutionNameMin: Cijk_Ailk_Bjlk_F8B8NB8NS_BH_Bias_HAS_SAV_UserArgs_MT128x128x64_MI16x16x1_SN_LDSB1_CLR1_GRVWA16_GRVWB16_GSU0_GSUC0_GSUWGMRR0_K1_LBSPPA1024_LBSPPB1024_LPA64_LPB64_MIWT4_4_PLR1_SU0_SUM0_SUS64_VWA4_VWB4_WGM4_WGMXCC1_WGMXCCGn1
    SolutionIndex: 37
    SolutionNameMin: Cijk_Ailk_Bjlk_F8B8NB8NS_BH_Bias_HAS_SAV_UserArgs_MT128x128x64_MI16x16x1_SN_LDSB1_CLR1_GRVWA16_GRVWB8_GSU0_GSUC0_GSUWGMRR0_K1_LBSPPA1024_LBSPPB1024_LPA64_LPB64_MIWT4_4_PLR1_SU0_SUM0_SUS64_VWA4_VWB4_WGM6_WGMXCC1_WGMXCCGn1
    SolutionIndex: 38
    SolutionNameMin: Cijk_Ailk_Bjlk_F8B8NB8NS_BH_Bias_HAS_SAV_UserArgs_MT128x128x64_MI16x16x1_SN_LDSB1_CLR1_GRVWA16_GRVWB8_GSU0_GSUC0_GSUWGMRR0_K1_LBSPPA1024_LBSPPB1024_LPA64_LPB64_MIWT4_4_PLR1_SU0_SUM0_SUS64_VWA4_VWB4_WGM8_WGMXCC1_WGMXCCGn1
    SolutionIndex: 39
    SolutionNameMin: Cijk_Ailk_Bjlk_F8B8NB8NS_BH_Bias_HAS_SAV_UserArgs_MT128x128x64_MI16x16x1_SN_LDSB1_CLR1_GRVWA4_GRVWB16_GSU0_GSUC0_GSUWGMRR0_K1_LBSPPA1024_LBSPPB1024_LPA64_LPB64_MIWT4_4_PLR1_SU0_SUM0_SUS64_VWA4_VWB4_WGM8_WGMXCC1_WGMXCCGn1
    SolutionIndex: 40
    SolutionNameMin: Cijk_Ailk_Bjlk_F8B8NB8NS_BH_Bias_HAS_SAV_UserArgs_MT128x128x64_MI16x16x1_SN_LDSB1_CLR1_GRVWA8_GRVWB16_GSU0_GSUC0_GSUWGMRR0_K1_LBSPPA1024_LBSPPB1024_LPA64_LPB64_MIWT4_4_PLR1_SU0_SUM0_SUS64_VWA4_VWB4_WGM8_WGMXCC1_WGMXCCGn1
    SolutionIndex: 41
    SolutionNameMin: Cijk_Ailk_Bjlk_F8B8NB8NS_BH_Bias_HAS_SAV_UserArgs_MT128x128x64_MI16x16x1_SN_LDSB1_CLR1_GRVWA16_GRVWB16_GSU0_GSUC0_GSUWGMRR0_K1_LBSPPA1024_LBSPPB1024_LPA64_LPB64_MIWT4_4_PLR1_SU0_SUM0_SUS64_VWA4_VWB4_WGM8_WGMXCC1_WGMXCCGn1
    SolutionIndex: 42
    SolutionNameMin: Cijk_Ailk_Bjlk_F8B8NB8NS_BH_Bias_HAS_SAV_UserArgs_MT64x128x64_MI16x16x1_SN_LDSB0_CLR1_GRVWA4_GRVWB4_GSU0_GSUC0_GSUWGMRR0_K1_LBSPPA512_LBSPPB1024_LPA32_LPB64_MIWT2_4_PLR1_SU0_SUM0_SUS64_VWA2_VWB4_WGM1_WGMXCC1_WGMXCCGn1
    SolutionIndex: 43
    SolutionNameMin: Cijk_Ailk_Bjlk_F8B8NB8NS_BH_Bias_HAS_SAV_UserArgs_MT64x128x64_MI16x16x1_SN_LDSB0_CLR1_GRVWA16_GRVWB16_GSU0_GSUC0_GSUWGMRR0_K1_LBSPPA512_LBSPPB1024_LPA32_LPB64_MIWT2_4_PLR1_SU0_SUM0_SUS64_VWA2_VWB4_WGM1_WGMXCC1_WGMXCCGn1
    SolutionIndex: 44
    SolutionNameMin: Cijk_Ailk_Bjlk_F8B8NB8NS_BH_Bias_HAS_SAV_UserArgs_MT128x64x64_MI16x16x1_SN_LDSB0_CLR1_GRVWA4_GRVWB4_GSU0_GSUC0_GSUWGMRR0_K1_LBSPPA1024_LBSPPB512_LPA64_LPB32_MIWT4_2_PLR1_SU0_SUM0_SUS64_VWA4_VWB2_WGM1_WGMXCC1_WGMXCCGn1
    SolutionIndex: 45
    SolutionNameMin: Cijk_Ailk_Bjlk_F8B8NB8NS_BH_Bias_HAS_SAV_UserArgs_MT128x64x64_MI16x16x1_SN_LDSB0_CLR1_GRVWA4_GRVWB8_GSU0_GSUC0_GSUWGMRR0_K1_LBSPPA1024_LBSPPB512_LPA64_LPB32_MIWT4_2_PLR1_SU0_SUM0_SUS64_VWA4_VWB2_WGM1_WGMXCC1_WGMXCCGn1
    SolutionIndex: 46
    SolutionNameMin: Cijk_Ailk_Bjlk_F8B8NB8NS_BH_Bias_HAS_SAV_UserArgs_MT128x64x64_MI16x16x1_SN_LDSB0_CLR1_GRVWA16_GRVWB8_GSU0_GSUC0_GSUWGMRR0_K1_LBSPPA1024_LBSPPB512_LPA64_LPB32_MIWT4_2_PLR1_SU0_SUM0_SUS64_VWA4_VWB2_WGM1_WGMXCC1_WGMXCCGn1
    SolutionIndex: 47
    SolutionNameMin: Cijk_Ailk_Bjlk_F8B8NB8NS_BH_Bias_HAS_SAV_UserArgs_MT128x64x64_MI16x16x1_SN_LDSB0_CLR1_GRVWA16_GRVWB4_GSU0_GSUC0_GSUWGMRR0_K1_LBSPPA1024_LBSPPB512_LPA64_LPB32_MIWT4_2_PLR1_SU0_SUM0_SUS64_VWA4_VWB2_WGM4_WGMXCC1_WGMXCCGn1
    SolutionIndex: 48
    SolutionNameMin: Cijk_Ailk_Bjlk_F8B8NB8NS_BH_Bias_HAS_SAV_UserArgs_MT128x64x64_MI16x16x1_SN_LDSB0_CLR1_GRVWA4_GRVWB8_GSU0_GSUC0_GSUWGMRR0_K1_LBSPPA1024_LBSPPB512_LPA64_LPB32_MIWT4_2_PLR1_SU0_SUM0_SUS64_VWA4_VWB2_WGM4_WGMXCC1_WGMXCCGn1
    SolutionIndex: 49
    SolutionNameMin: Cijk_Ailk_Bjlk_F8B8NB8NS_BH_Bias_HAS_SAV_UserArgs_MT128x64x64_MI16x16x1_SN_LDSB0_CLR1_GRVWA4_GRVWB8_GSU0_GSUC0_GSUWGMRR0_K1_LBSPPA1024_LBSPPB512_LPA64_LPB32_MIWT4_2_PLR1_SU0_SUM0_SUS64_VWA4_VWB2_WGM6_WGMXCC1_WGMXCCGn1
    SolutionIndex: 50
    SolutionNameMin: Cijk_Ailk_Bjlk_F8B8NB8NS_BH_Bias_HAS_SAV_UserArgs_MT64x64x64_MI16x16x1_SN_LDSB0_CLR1_GRVWA4_GRVWB4_GSU0_GSUC0_GSUWGMRR0_K1_LBSPPA512_LBSPPB512_LPA32_LPB32_MIWT2_2_PLR1_SU0_SUM0_SUS64_VWA2_VWB2_WGM1_WGMXCC1_WGMXCCGn1
    SolutionIndex: 51
    SolutionNameMin: Cijk_Ailk_Bjlk_F8B8NB8NS_BH_Bias_HAS_SAV_UserArgs_MT64x64x64_MI16x16x1_SN_LDSB0_CLR1_GRVWA8_GRVWB8_GSU0_GSUC0_GSUWGMRR0_K1_LBSPPA512_LBSPPB512_LPA32_LPB32_MIWT2_2_PLR1_SU0_SUM0_SUS64_VWA2_VWB2_WGM1_WGMXCC1_WGMXCCGn1
    SolutionIndex: 52
    SolutionNameMin: Cijk_Ailk_Bjlk_F8B8NB8NS_BH_Bias_HAS_SAV_UserArgs_MT32x64x64_MI16x16x1_SN_LDSB0_CLR1_GRVWA4_GRVWB4_GSU0_GSUC0_GSUWGMRR0_K1_LBSPPA256_LBSPPB512_LPA16_LPB32_MIWT1_2_PLR1_SU0_SUM0_SUS64_VWA1_VWB2_WGM1_WGMXCC1_WGMXCCGn1
    SolutionIndex: 53
    SolutionNameMin: Cijk_Ailk_Bjlk_F8B8NB8NS_BH_Bias_HAS_SAV_UserArgs_MT64x32x64_MI16x16x1_SN_LDSB0_CLR1_GRVWA4_GRVWB4_GSU0_GSUC0_GSUWGMRR0_K1_LBSPPA512_LBSPPB256_LPA32_LPB16_MIWT2_1_PLR1_SU0_SUM0_SUS64_VWA2_VWB1_WGM1_WGMXCC1_WGMXCCGn1
    SolutionIndex: 54
    SolutionNameMin: Cijk_Ailk_Bjlk_F8B8NB8NS_BH_Bias_HAS_SAV_UserArgs_MT32x32x64_MI16x16x1_SN_LDSB0_CLR1_GRVWA4_GRVWB4_GSU0_GSUC0_GSUWGMRR0_K1_LBSPPA256_LBSPPB256_LPA16_LPB16_MIWT1_1_PLR1_SU0_SUM0_SUS64_VWA1_VWB1_WGM1_WGMXCC1_WGMXCCGn1
    SolutionIndex: 55
    SolutionNameMin: Cijk_Ailk_Bjlk_F8B8NB8NS_BH_Bias_HAS_SAV_UserArgs_MT32x32x64_MI16x16x1_SN_LDSB0_CLR1_GRVWA8_GRVWB4_GSU0_GSUC0_GSUWGMRR0_K1_LBSPPA256_LBSPPB256_LPA16_LPB16_MIWT1_1_PLR1_SU0_SUM0_SUS64_VWA1_VWB1_WGM1_WGMXCC1_WGMXCCGn1
    SolutionIndex: 56
    SolutionNameMin: Cijk_Ailk_Bjlk_F8B8NB8NS_BH_Bias_HAS_SAV_UserArgs_MT32x32x64_MI16x16x1_SN_LDSB0_CLR1_GRVWA4_GRVWB8_GSU0_GSUC0_GSUWGMRR0_K1_LBSPPA256_LBSPPB256_LPA16_LPB16_MIWT1_1_PLR1_SU0_SUM0_SUS64_VWA1_VWB1_WGM1_WGMXCC1_WGMXCCGn1
    SolutionIndex: 57
    SolutionNameMin: Cijk_Ailk_Bjlk_F8B8NB8NS_BH_Bias_HAS_SAV_UserArgs_MT32x32x64_MI16x16x1_SN_LDSB0_CLR1_GRVWA8_GRVWB8_GSU0_GSUC0_GSUWGMRR0_K1_LBSPPA256_LBSPPB256_LPA16_LPB16_MIWT1_1_PLR1_SU0_SUM0_SUS64_VWA1_VWB1_WGM1_WGMXCC1_WGMXCCGn1
    SolutionIndex: 58
    SolutionNameMin: Cijk_Ailk_Bjlk_F8B8NB8NS_BH_Bias_HAS_SAV_UserArgs_MT32x32x64_MI16x16x1_SN_LDSB0_CLR1_GRVWA4_GRVWB4_GSU0_GSUC0_GSUWGMRR0_K1_LBSPPA256_LBSPPB256_LPA16_LPB16_MIWT1_1_PLR1_SU0_SUM0_SUS64_VWA1_VWB1_WGM8_WGMXCC1_WGMXCCGn1
    SolutionIndex: 59
    SolutionNameMin: Cijk_Ailk_Bjlk_F8B8NB8NS_BH_Bias_HAS_SAV_UserArgs_MT256x256x128_MI16x16x1_SN_LDSB1_CLR1_GRVWA8_GRVWB16_GSU0_GSUC0_GSUWGMRR0_K1_LBSPPA2048_LBSPPB2048_LPA0_LPB0_MIWT8_8_PLR1_SU0_SUM0_SUS128_VWA8_VWB8_WGM1_WGMXCC1_WGMXCCGn1
    SolutionIndex: 60
    SolutionNameMin: Cijk_Ailk_Bjlk_F8B8NB8NS_BH_Bias_HAS_SAV_UserArgs_MT256x256x128_MI16x16x1_SN_LDSB1_CLR1_GRVWA16_GRVWB16_GSU0_GSUC0_GSUWGMRR0_K1_LBSPPA2048_LBSPPB2048_LPA0_LPB0_MIWT8_8_PLR1_SU0_SUM0_SUS128_VWA8_VWB8_WGM4_WGMXCC1_WGMXCCGn1
    SolutionIndex: 61
    SolutionNameMin: Cijk_Ailk_Bjlk_F8B8NB8NS_BH_Bias_HAS_SAV_UserArgs_MT256x256x128_MI16x16x1_SN_LDSB1_CLR1_GRVWA16_GRVWB8_GSU0_GSUC0_GSUWGMRR0_K1_LBSPPA2048_LBSPPB2048_LPA0_LPB0_MIWT8_8_PLR1_SU0_SUM0_SUS128_VWA8_VWB8_WGM6_WGMXCC1_WGMXCCGn1
    SolutionIndex: 62
    SolutionNameMin: Cijk_Ailk_Bjlk_F8B8NB8NS_BH_Bias_HAS_SAV_UserArgs_MT256x256x128_MI16x16x1_SN_LDSB1_CLR1_GRVWA16_GRVWB16_GSU0_GSUC0_GSUWGMRR0_K1_LBSPPA2048_LBSPPB2048_LPA0_LPB0_MIWT8_8_PLR1_SU0_SUM0_SUS128_VWA8_VWB8_WGM6_WGMXCC1_WGMXCCGn1
    SolutionIndex: 63
    SolutionNameMin: Cijk_Ailk_Bjlk_F8B8NB8NS_BH_Bias_HAS_SAV_UserArgs_MT256x256x128_MI16x16x1_SN_LDSB1_CLR1_GRVWA8_GRVWB16_GSU0_GSUC0_GSUWGMRR0_K1_LBSPPA2048_LBSPPB2048_LPA0_LPB0_MIWT8_8_PLR1_SU0_SUM0_SUS128_VWA8_VWB8_WGM8_WGMXCC1_WGMXCCGn1
    SolutionIndex: 64
    SolutionNameMin: Cijk_Ailk_Bjlk_F8B8NB8NS_BH_Bias_HAS_SAV_UserArgs_MT256x256x128_MI16x16x1_SN_LDSB1_CLR1_GRVWA16_GRVWB16_GSU0_GSUC0_GSUWGMRR0_K1_LBSPPA2048_LBSPPB2048_LPA0_LPB0_MIWT8_8_PLR1_SU0_SUM0_SUS128_VWA8_VWB8_WGM8_WGMXCC1_WGMXCCGn1
    SolutionIndex: 65
    SolutionNameMin: Cijk_Ailk_Bjlk_F8B8NB8NS_BH_Bias_HAS_SAV_UserArgs_MT128x256x128_MI16x16x1_SN_LDSB1_CLR1_GRVWA4_GRVWB16_GSU0_GSUC0_GSUWGMRR0_K1_LBSPPA1024_LBSPPB2048_LPA64_LPB0_MIWT4_8_PLR1_SU0_SUM0_SUS128_VWA4_VWB8_WGM1_WGMXCC1_WGMXCCGn1
    SolutionIndex: 66
    SolutionNameMin: Cijk_Ailk_Bjlk_F8B8NB8NS_BH_Bias_HAS_SAV_UserArgs_MT128x256x128_MI16x16x1_SN_LDSB1_CLR1_GRVWA8_GRVWB16_GSU0_GSUC0_GSUWGMRR0_K1_LBSPPA1024_LBSPPB2048_LPA64_LPB0_MIWT4_8_PLR1_SU0_SUM0_SUS128_VWA4_VWB8_WGM1_WGMXCC1_WGMXCCGn1
    SolutionIndex: 67
    SolutionNameMin: Cijk_Ailk_Bjlk_F8B8NB8NS_BH_Bias_HAS_SAV_UserArgs_MT128x256x128_MI16x16x1_SN_LDSB1_CLR1_GRVWA16_GRVWB16_GSU0_GSUC0_GSUWGMRR0_K1_LBSPPA1024_LBSPPB2048_LPA64_LPB0_MIWT4_8_PLR1_SU0_SUM0_SUS128_VWA4_VWB8_WGM1_WGMXCC1_WGMXCCGn1
    SolutionIndex: 68
    SolutionNameMin: Cijk_Ailk_Bjlk_F8B8NB8NS_BH_Bias_HAS_SAV_UserArgs_MT128x256x128_MI16x16x1_SN_LDSB1_CLR1_GRVWA16_GRVWB16_GSU0_GSUC0_GSUWGMRR0_K1_LBSPPA1024_LBSPPB2048_LPA64_LPB0_MIWT4_8_PLR1_SU0_SUM0_SUS128_VWA4_VWB8_WGM4_WGMXCC1_WGMXCCGn1
    SolutionIndex: 69
    SolutionNameMin: Cijk_Ailk_Bjlk_F8B8NB8NS_BH_Bias_HAS_SAV_UserArgs_MT128x256x128_MI16x16x1_SN_LDSB1_CLR1_GRVWA4_GRVWB16_GSU0_GSUC0_GSUWGMRR0_K1_LBSPPA1024_LBSPPB2048_LPA64_LPB0_MIWT4_8_PLR1_SU0_SUM0_SUS128_VWA4_VWB8_WGM6_WGMXCC1_WGMXCCGn1
    SolutionIndex: 70
    SolutionNameMin: Cijk_Ailk_Bjlk_F8B8NB8NS_BH_Bias_HAS_SAV_UserArgs_MT128x256x128_MI16x16x1_SN_LDSB1_CLR1_GRVWA16_GRVWB16_GSU0_GSUC0_GSUWGMRR0_K1_LBSPPA1024_LBSPPB2048_LPA64_LPB0_MIWT4_8_PLR1_SU0_SUM0_SUS128_VWA4_VWB8_WGM6_WGMXCC1_WGMXCCGn1
    SolutionIndex: 71
    SolutionNameMin: Cijk_Ailk_Bjlk_F8B8NB8NS_BH_Bias_HAS_SAV_UserArgs_MT128x256x128_MI16x16x1_SN_LDSB1_CLR1_GRVWA4_GRVWB16_GSU0_GSUC0_GSUWGMRR0_K1_LBSPPA1024_LBSPPB2048_LPA64_LPB0_MIWT4_8_PLR1_SU0_SUM0_SUS128_VWA4_VWB8_WGM8_WGMXCC1_WGMXCCGn1
    SolutionIndex: 72
    SolutionNameMin: Cijk_Ailk_Bjlk_F8B8NB8NS_BH_Bias_HAS_SAV_UserArgs_MT128x128x128_MI16x16x1_SN_LDSB1_CLR1_GRVWA16_GRVWB16_GSU0_GSUC0_GSUWGMRR0_K1_LBSPPA1024_LBSPPB1024_LPA64_LPB64_MIWT4_4_PLR1_SU0_SUM0_SUS128_VWA4_VWB4_WGM1_WGMXCC1_WGMXCCGn1
    SolutionIndex: 73
    SolutionNameMin: Cijk_Ailk_Bjlk_F8B8NB8NS_BH_Bias_HAS_SAV_UserArgs_MT128x128x128_MI16x16x1_SN_LDSB1_CLR1_GRVWA16_GRVWB16_GSU0_GSUC0_GSUWGMRR0_K1_LBSPPA1024_LBSPPB1024_LPA64_LPB64_MIWT4_4_PLR1_SU0_SUM0_SUS128_VWA4_VWB4_WGM6_WGMXCC1_WGMXCCGn1
    SolutionIndex: 74
    SolutionNameMin: Cijk_Ailk_Bjlk_F8B8NB8NS_BH_Bias_HAS_SAV_UserArgs_MT128x64x128_MI16x16x1_SN_LDSB1_CLR1_GRVWA4_GRVWB8_GSU0_GSUC0_GSUWGMRR0_K1_LBSPPA1024_LBSPPB512_LPA64_LPB32_MIWT4_2_PLR1_SU0_SUM0_SUS128_VWA4_VWB2_WGM1_WGMXCC1_WGMXCCGn1
    SolutionIndex: 75
    SolutionNameMin: Cijk_Ailk_Bjlk_F8B8NB8NS_BH_Bias_HAS_SAV_UserArgs_MT128x64x128_MI16x16x1_SN_LDSB1_CLR1_GRVWA16_GRVWB16_GSU0_GSUC0_GSUWGMRR0_K1_LBSPPA1024_LBSPPB512_LPA64_LPB32_MIWT4_2_PLR1_SU0_SUM0_SUS128_VWA4_VWB2_WGM1_WGMXCC1_WGMXCCGn1
    SolutionIndex: 76
    SolutionNameMin: Cijk_Ailk_Bjlk_F8B8NB8NS_BH_Bias_HAS_SAV_UserArgs_MT128x64x128_MI16x16x1_SN_LDSB1_CLR1_GRVWA16_GRVWB16_GSU0_GSUC0_GSUWGMRR0_K1_LBSPPA1024_LBSPPB512_LPA64_LPB32_MIWT4_2_PLR1_SU0_SUM0_SUS128_VWA4_VWB2_WGM4_WGMXCC1_WGMXCCGn1
    SolutionIndex: 77
    SolutionNameMin: Cijk_Ailk_Bjlk_F8B8NB8NS_BH_Bias_HAS_SAV_UserArgs_MT128x64x128_MI16x16x1_SN_LDSB1_CLR1_GRVWA16_GRVWB16_GSU0_GSUC0_GSUWGMRR0_K1_LBSPPA1024_LBSPPB512_LPA64_LPB32_MIWT4_2_PLR1_SU0_SUM0_SUS128_VWA4_VWB2_WGM6_WGMXCC1_WGMXCCGn1
    SolutionIndex: 78
    SolutionNameMin: Cijk_Ailk_Bjlk_F8B8NB8NS_BH_Bias_HAS_SAV_UserArgs_MT128x64x128_MI16x16x1_SN_LDSB1_CLR1_GRVWA16_GRVWB16_GSU0_GSUC0_GSUWGMRR0_K1_LBSPPA1024_LBSPPB512_LPA64_LPB32_MIWT4_2_PLR1_SU0_SUM0_SUS128_VWA4_VWB2_WGM8_WGMXCC1_WGMXCCGn1
    SolutionIndex: 79
    SolutionNameMin: Cijk_Ailk_Bjlk_F8B8NB8NS_BH_Bias_HAS_SAV_UserArgs_MT64x64x128_MI16x16x1_SN_LDSB1_CLR1_GRVWA4_GRVWB4_GSU0_GSUC0_GSUWGMRR0_K1_LBSPPA512_LBSPPB512_LPA32_LPB32_MIWT2_2_PLR1_SU0_SUM0_SUS128_VWA2_VWB2_WGM1_WGMXCC1_WGMXCCGn1
    SolutionIndex: 80
    SolutionNameMin: Cijk_Ailk_Bjlk_F8B8NB8NS_BH_Bias_HAS_SAV_UserArgs_MT64x64x128_MI16x16x1_SN_LDSB1_CLR1_GRVWA4_GRVWB8_GSU0_GSUC0_GSUWGMRR0_K1_LBSPPA512_LBSPPB512_LPA32_LPB32_MIWT2_2_PLR1_SU0_SUM0_SUS128_VWA2_VWB2_WGM1_WGMXCC1_WGMXCCGn1
    SolutionIndex: 81
    SolutionNameMin: Cijk_Ailk_Bjlk_F8B8NB8NS_BH_Bias_HAS_SAV_UserArgs_MT64x64x128_MI16x16x1_SN_LDSB1_CLR1_GRVWA16_GRVWB8_GSU0_GSUC0_GSUWGMRR0_K1_LBSPPA512_LBSPPB512_LPA32_LPB32_MIWT2_2_PLR1_SU0_SUM0_SUS128_VWA2_VWB2_WGM1_WGMXCC1_WGMXCCGn1
    SolutionIndex: 82
    SolutionNameMin: Cijk_Ailk_Bjlk_F8B8NB8NS_BH_Bias_HAS_SAV_UserArgs_MT64x64x128_MI16x16x1_SN_LDSB1_CLR1_GRVWA4_GRVWB16_GSU0_GSUC0_GSUWGMRR0_K1_LBSPPA512_LBSPPB512_LPA32_LPB32_MIWT2_2_PLR1_SU0_SUM0_SUS128_VWA2_VWB2_WGM1_WGMXCC1_WGMXCCGn1
    SolutionIndex: 83
    SolutionNameMin: Cijk_Ailk_Bjlk_F8B8NB8NS_BH_Bias_HAS_SAV_UserArgs_MT64x64x128_MI16x16x1_SN_LDSB1_CLR1_GRVWA8_GRVWB16_GSU0_GSUC0_GSUWGMRR0_K1_LBSPPA512_LBSPPB512_LPA32_LPB32_MIWT2_2_PLR1_SU0_SUM0_SUS128_VWA2_VWB2_WGM1_WGMXCC1_WGMXCCGn1
    SolutionIndex: 84
    SolutionNameMin: Cijk_Ailk_Bjlk_F8B8NB8NS_BH_Bias_HAS_SAV_UserArgs_MT64x64x128_MI16x16x1_SN_LDSB1_CLR1_GRVWA16_GRVWB16_GSU0_GSUC0_GSUWGMRR0_K1_LBSPPA512_LBSPPB512_LPA32_LPB32_MIWT2_2_PLR1_SU0_SUM0_SUS128_VWA2_VWB2_WGM1_WGMXCC1_WGMXCCGn1
    SolutionIndex: 85
    SolutionNameMin: Cijk_Ailk_Bjlk_F8B8NB8NS_BH_Bias_HAS_SAV_UserArgs_MT64x64x128_MI16x16x1_SN_LDSB1_CLR1_GRVWA4_GRVWB16_GSU0_GSUC0_GSUWGMRR0_K1_LBSPPA512_LBSPPB512_LPA32_LPB32_MIWT2_2_PLR1_SU0_SUM0_SUS128_VWA2_VWB2_WGM4_WGMXCC1_WGMXCCGn1
    SolutionIndex: 86
    SolutionNameMin: Cijk_Ailk_Bjlk_F8B8NB8NS_BH_Bias_HAS_SAV_UserArgs_MT64x64x128_MI16x16x1_SN_LDSB1_CLR1_GRVWA16_GRVWB16_GSU0_GSUC0_GSUWGMRR0_K1_LBSPPA512_LBSPPB512_LPA32_LPB32_MIWT2_2_PLR1_SU0_SUM0_SUS128_VWA2_VWB2_WGM4_WGMXCC1_WGMXCCGn1
    SolutionIndex: 87
    SolutionNameMin: Cijk_Ailk_Bjlk_F8B8NB8NS_BH_Bias_HAS_SAV_UserArgs_MT64x64x128_MI16x16x1_SN_LDSB1_CLR1_GRVWA4_GRVWB16_GSU0_GSUC0_GSUWGMRR0_K1_LBSPPA512_LBSPPB512_LPA32_LPB32_MIWT2_2_PLR1_SU0_SUM0_SUS128_VWA2_VWB2_WGM6_WGMXCC1_WGMXCCGn1
    SolutionIndex: 88
    SolutionNameMin: Cijk_Ailk_Bjlk_F8B8NB8NS_BH_Bias_HAS_SAV_UserArgs_MT64x64x128_MI16x16x1_SN_LDSB1_CLR1_GRVWA8_GRVWB16_GSU0_GSUC0_GSUWGMRR0_K1_LBSPPA512_LBSPPB512_LPA32_LPB32_MIWT2_2_PLR1_SU0_SUM0_SUS128_VWA2_VWB2_WGM6_WGMXCC1_WGMXCCGn1
    SolutionIndex: 89
    SolutionNameMin: Cijk_Ailk_Bjlk_F8B8NB8NS_BH_Bias_HAS_SAV_UserArgs_MT64x64x128_MI16x16x1_SN_LDSB1_CLR1_GRVWA16_GRVWB16_GSU0_GSUC0_GSUWGMRR0_K1_LBSPPA512_LBSPPB512_LPA32_LPB32_MIWT2_2_PLR1_SU0_SUM0_SUS128_VWA2_VWB2_WGM6_WGMXCC1_WGMXCCGn1
    SolutionIndex: 90
    SolutionNameMin: Cijk_Ailk_Bjlk_F8B8NB8NS_BH_Bias_HAS_SAV_UserArgs_MT64x64x128_MI16x16x1_SN_LDSB1_CLR1_GRVWA16_GRVWB16_GSU0_GSUC0_GSUWGMRR0_K1_LBSPPA512_LBSPPB512_LPA32_LPB32_MIWT2_2_PLR1_SU0_SUM0_SUS128_VWA2_VWB2_WGM8_WGMXCC1_WGMXCCGn1
    SolutionIndex: 91
    SolutionNameMin: Cijk_Ailk_Bjlk_F8B8NB8NS_BH_Bias_HAS_SAV_UserArgs_MT32x64x128_MI16x16x1_SN_LDSB0_CLR1_GRVWA16_GRVWB16_GSU0_GSUC0_GSUWGMRR0_K1_LBSPPA256_LBSPPB512_LPA16_LPB32_MIWT1_2_PLR1_SU0_SUM0_SUS128_VWA1_VWB2_WGM4_WGMXCC1_WGMXCCGn1
    SolutionIndex: 92
    SolutionNameMin: Cijk_Ailk_Bjlk_F8B8NB8NS_BH_Bias_HAS_SAV_UserArgs_MT32x64x128_MI16x16x1_SN_LDSB0_CLR1_GRVWA16_GRVWB16_GSU0_GSUC0_GSUWGMRR0_K1_LBSPPA256_LBSPPB512_LPA16_LPB32_MIWT1_2_PLR1_SU0_SUM0_SUS128_VWA1_VWB2_WGM6_WGMXCC1_WGMXCCGn1
    SolutionIndex: 93
    SolutionNameMin: Cijk_Ailk_Bjlk_F8B8NB8NS_BH_Bias_HAS_SAV_UserArgs_MT64x32x128_MI16x16x1_SN_LDSB0_CLR1_GRVWA4_GRVWB4_GSU0_GSUC0_GSUWGMRR0_K1_LBSPPA512_LBSPPB256_LPA32_LPB16_MIWT2_1_PLR1_SU0_SUM0_SUS128_VWA2_VWB1_WGM1_WGMXCC1_WGMXCCGn1
    SolutionIndex: 94
    SolutionNameMin: Cijk_Ailk_Bjlk_F8B8NB8NS_BH_Bias_HAS_SAV_UserArgs_MT64x32x128_MI16x16x1_SN_LDSB0_CLR1_GRVWA4_GRVWB8_GSU0_GSUC0_GSUWGMRR0_K1_LBSPPA512_LBSPPB256_LPA32_LPB16_MIWT2_1_PLR1_SU0_SUM0_SUS128_VWA2_VWB1_WGM1_WGMXCC1_WGMXCCGn1
    SolutionIndex: 95
    SolutionNameMin: Cijk_Ailk_Bjlk_F8B8NB8NS_BH_Bias_HAS_SAV_UserArgs_MT64x32x128_MI16x16x1_SN_LDSB0_CLR1_GRVWA8_GRVWB8_GSU0_GSUC0_GSUWGMRR0_K1_LBSPPA512_LBSPPB256_LPA32_LPB16_MIWT2_1_PLR1_SU0_SUM0_SUS128_VWA2_VWB1_WGM1_WGMXCC1_WGMXCCGn1
    SolutionIndex: 96
    SolutionNameMin: Cijk_Ailk_Bjlk_F8B8NB8NS_BH_Bias_HAS_SAV_UserArgs_MT64x32x128_MI16x16x1_SN_LDSB0_CLR1_GRVWA8_GRVWB16_GSU0_GSUC0_GSUWGMRR0_K1_LBSPPA512_LBSPPB256_LPA32_LPB16_MIWT2_1_PLR1_SU0_SUM0_SUS128_VWA2_VWB1_WGM1_WGMXCC1_WGMXCCGn1
    SolutionIndex: 97
    SolutionNameMin: Cijk_Ailk_Bjlk_F8B8NB8NS_BH_Bias_HAS_SAV_UserArgs_MT64x32x128_MI16x16x1_SN_LDSB0_CLR1_GRVWA16_GRVWB16_GSU0_GSUC0_GSUWGMRR0_K1_LBSPPA512_LBSPPB256_LPA32_LPB16_MIWT2_1_PLR1_SU0_SUM0_SUS128_VWA2_VWB1_WGM1_WGMXCC1_WGMXCCGn1
    SolutionIndex: 98
    SolutionNameMin: Cijk_Ailk_Bjlk_F8B8NB8NS_BH_Bias_HAS_SAV_UserArgs_MT32x32x128_MI16x16x1_SN_LDSB0_CLR1_GRVWA4_GRVWB4_GSU0_GSUC0_GSUWGMRR0_K1_LBSPPA256_LBSPPB256_LPA16_LPB16_MIWT1_1_PLR1_SU0_SUM0_SUS128_VWA1_VWB1_WGM1_WGMXCC1_WGMXCCGn1
    SolutionIndex: 99
    SolutionNameMin: Cijk_Ailk_Bjlk_F8B8NB8NS_BH_Bias_HAS_SAV_UserArgs_MT32x32x128_MI16x16x1_SN_LDSB0_CLR1_GRVWA8_GRVWB4_GSU0_GSUC0_GSUWGMRR0_K1_LBSPPA256_LBSPPB256_LPA16_LPB16_MIWT1_1_PLR1_SU0_SUM0_SUS128_VWA1_VWB1_WGM1_WGMXCC1_WGMXCCGn1
    SolutionIndex: 100
    SolutionNameMin: Cijk_Ailk_Bjlk_F8B8NB8NS_BH_Bias_HAS_SAV_UserArgs_MT32x32x128_MI16x16x1_SN_LDSB0_CLR1_GRVWA4_GRVWB8_GSU0_GSUC0_GSUWGMRR0_K1_LBSPPA256_LBSPPB256_LPA16_LPB16_MIWT1_1_PLR1_SU0_SUM0_SUS128_VWA1_VWB1_WGM1_WGMXCC1_WGMXCCGn1
    SolutionIndex: 101
    SolutionNameMin: Cijk_Ailk_Bjlk_F8B8NB8NS_BH_Bias_HAS_SAV_UserArgs_MT32x32x128_MI16x16x1_SN_LDSB0_CLR1_GRVWA8_GRVWB8_GSU0_GSUC0_GSUWGMRR0_K1_LBSPPA256_LBSPPB256_LPA16_LPB16_MIWT1_1_PLR1_SU0_SUM0_SUS128_VWA1_VWB1_WGM1_WGMXCC1_WGMXCCGn1
    SolutionIndex: 102
    SolutionNameMin: Cijk_Ailk_Bjlk_F8B8NB8NS_BH_Bias_HAS_SAV_UserArgs_MT32x32x128_MI16x16x1_SN_LDSB0_CLR1_GRVWA4_GRVWB16_GSU0_GSUC0_GSUWGMRR0_K1_LBSPPA256_LBSPPB256_LPA16_LPB16_MIWT1_1_PLR1_SU0_SUM0_SUS128_VWA1_VWB1_WGM1_WGMXCC1_WGMXCCGn1
    SolutionIndex: 103
    SolutionNameMin: Cijk_Ailk_Bjlk_F8B8NB8NS_BH_Bias_HAS_SAV_UserArgs_MT32x32x128_MI16x16x1_SN_LDSB0_CLR1_GRVWA8_GRVWB16_GSU0_GSUC0_GSUWGMRR0_K1_LBSPPA256_LBSPPB256_LPA16_LPB16_MIWT1_1_PLR1_SU0_SUM0_SUS128_VWA1_VWB1_WGM1_WGMXCC1_WGMXCCGn1
    SolutionIndex: 104
    SolutionNameMin: Cijk_Ailk_Bjlk_F8B8NB8NS_BH_Bias_HAS_SAV_UserArgs_MT32x32x128_MI16x16x1_SN_LDSB0_CLR1_GRVWA16_GRVWB16_GSU0_GSUC0_GSUWGMRR0_K1_LBSPPA256_LBSPPB256_LPA16_LPB16_MIWT1_1_PLR1_SU0_SUM0_SUS128_VWA1_VWB1_WGM1_WGMXCC1_WGMXCCGn1
    SolutionIndex: 105
    SolutionNameMin: Cijk_Ailk_Bjlk_F8B8NB8NS_BH_Bias_HAS_SAV_UserArgs_MT128x64x256_MI16x16x1_SN_LDSB1_CLR1_GRVWA16_GRVWB16_GSU0_GSUC0_GSUWGMRR0_K1_LBSPPA1024_LBSPPB512_LPA64_LPB32_MIWT4_2_PLR1_SU0_SUM0_SUS256_VWA4_VWB2_WGM6_WGMXCC1_WGMXCCGn1
    SolutionIndex: 106
    SolutionNameMin: Cijk_Ailk_Bjlk_F8B8NB8NS_BH_Bias_HAS_SAV_UserArgs_MT64x64x256_MI16x16x1_SN_LDSB1_CLR1_GRVWA16_GRVWB16_GSU0_GSUC0_GSUWGMRR0_K1_LBSPPA512_LBSPPB512_LPA32_LPB32_MIWT2_2_PLR1_SU0_SUM0_SUS256_VWA2_VWB2_WGM1_WGMXCC1_WGMXCCGn1
    SolutionIndex: 107
    SolutionNameMin: Cijk_Ailk_Bjlk_F8B8NB8NS_BH_Bias_HAS_SAV_UserArgs_MT64x64x256_MI16x16x1_SN_LDSB1_CLR1_GRVWA16_GRVWB16_GSU0_GSUC0_GSUWGMRR0_K1_LBSPPA512_LBSPPB512_LPA32_LPB32_MIWT2_2_PLR1_SU0_SUM0_SUS256_VWA2_VWB2_WGM4_WGMXCC1_WGMXCCGn1
    SolutionIndex: 108
    SolutionNameMin: Cijk_Ailk_Bjlk_F8B8NB8NS_BH_Bias_HAS_SAV_UserArgs_MT64x32x256_MI16x16x1_SN_LDSB1_CLR1_GRVWA16_GRVWB16_GSU0_GSUC0_GSUWGMRR0_K1_LBSPPA512_LBSPPB256_LPA32_LPB16_MIWT2_1_PLR1_SU0_SUM0_SUS256_VWA2_VWB1_WGM1_WGMXCC1_WGMXCCGn1
    SolutionIndex: 109
    SolutionNameMin: Cijk_Ailk_Bjlk_F8B8NB8NS_BH_Bias_HAS_SAV_UserArgs_MT64x32x256_MI16x16x1_SN_LDSB1_CLR1_GRVWA16_GRVWB16_GSU0_GSUC0_GSUWGMRR0_K1_LBSPPA512_LBSPPB256_LPA32_LPB16_MIWT2_1_PLR1_SU0_SUM0_SUS256_VWA2_VWB1_WGM4_WGMXCC1_WGMXCCGn1
    SolutionIndex: 110
    SolutionNameMin: Cijk_Ailk_Bjlk_F8B8NB8NS_BH_Bias_HAS_SAV_UserArgs_MT64x32x256_MI16x16x1_SN_LDSB1_CLR1_GRVWA16_GRVWB16_GSU0_GSUC0_GSUWGMRR0_K1_LBSPPA512_LBSPPB256_LPA32_LPB16_MIWT2_1_PLR1_SU0_SUM0_SUS256_VWA2_VWB1_WGM6_WGMXCC1_WGMXCCGn1
    SolutionIndex: 111
    SolutionNameMin: Cijk_Ailk_Bjlk_F8B8NB8NS_BH_Bias_HAS_SAV_UserArgs_MT32x32x256_MI16x16x1_SN_LDSB1_CLR1_GRVWA8_GRVWB16_GSU0_GSUC0_GSUWGMRR0_K1_LBSPPA256_LBSPPB256_LPA16_LPB16_MIWT1_1_PLR1_SU0_SUM0_SUS256_VWA1_VWB1_WGM1_WGMXCC1_WGMXCCGn1
    SolutionIndex: 112
    SolutionNameMin: Cijk_Ailk_Bjlk_F8B8NB8NS_BH_Bias_HAS_SAV_UserArgs_MT32x32x256_MI16x16x1_SN_LDSB1_CLR1_GRVWA16_GRVWB16_GSU0_GSUC0_GSUWGMRR0_K1_LBSPPA256_LBSPPB256_LPA16_LPB16_MIWT1_1_PLR1_SU0_SUM0_SUS256_VWA1_VWB1_WGM1_WGMXCC1_WGMXCCGn1
    SolutionIndex: 113
    SolutionNameMin: Cijk_Ailk_Bjlk_F8B8NB8NS_BH_Bias_HAS_SAV_UserArgs_MT32x32x256_MI16x16x1_SN_LDSB1_CLR1_GRVWA16_GRVWB16_GSU0_GSUC0_GSUWGMRR0_K1_LBSPPA256_LBSPPB256_LPA16_LPB16_MIWT1_1_PLR1_SU0_SUM0_SUS256_VWA1_VWB1_WGM4_WGMXCC1_WGMXCCGn1
    SolutionIndex: 114
    SolutionNameMin: Cijk_Ailk_Bjlk_F8B8NB8NS_BH_Bias_HAS_SAV_UserArgs_MT32x32x256_MI16x16x1_SN_LDSB1_CLR1_GRVWA8_GRVWB16_GSU0_GSUC0_GSUWGMRR0_K1_LBSPPA256_LBSPPB256_LPA16_LPB16_MIWT1_1_PLR1_SU0_SUM0_SUS256_VWA1_VWB1_WGM6_WGMXCC1_WGMXCCGn1
    SolutionIndex: 115
    SolutionNameMin: Cijk_Ailk_Bjlk_F8B8NB8NS_BH_Bias_HAS_SAV_UserArgs_MT32x32x256_MI16x16x1_SN_LDSB1_CLR1_GRVWA16_GRVWB16_GSU0_GSUC0_GSUWGMRR0_K1_LBSPPA256_LBSPPB256_LPA16_LPB16_MIWT1_1_PLR1_SU0_SUM0_SUS256_VWA1_VWB1_WGM6_WGMXCC1_WGMXCCGn1
    SolutionIndex: 116
    SolutionNameMin: Cijk_Ailk_Bjlk_F8B8NB8NS_BH_Bias_HAS_SAV_UserArgs_MT32x32x256_MI16x16x1_SN_LDSB1_CLR1_GRVWA16_GRVWB16_GSU0_GSUC0_GSUWGMRR0_K1_LBSPPA256_LBSPPB256_LPA16_LPB16_MIWT1_1_PLR1_SU0_SUM0_SUS256_VWA1_VWB1_WGM8_WGMXCC1_WGMXCCGn1
- - - [128, 128, 1, 128, 128, 128, 128, 128]
    - [54, 0.51]
  - - [128, 128, 1, 256, 128, 128, 128, 128]
    - [55, 0.91]
  - - [128, 128, 1, 512, 128, 128, 128, 128]
    - [99, 1.48]
  - - [128, 128, 1, 1024, 128, 128, 128, 128]
    - [102, 2.22]
  - - [128, 128, 1, 2048, 128, 128, 128, 128]
    - [103, 2.89]
  - - [128, 128, 1, 4096, 128, 128, 128, 128]
    - [103, 3.54]
  - - [128, 128, 1, 8192, 128, 128, 128, 128]
    - [112, 3.94]
  - - [128, 256, 1, 128, 128, 128, 128, 256]
    - [54, 1.06]
  - - [128, 256, 1, 256, 128, 128, 128, 256]
    - [55, 1.83]
  - - [128, 256, 1, 512, 128, 128, 128, 256]
    - [98, 3.02]
  - - [128, 256, 1, 1024, 128, 128, 128, 256]
    - [101, 4.5]
  - - [128, 256, 1, 2048, 128, 128, 128, 256]
    - [103, 5.95]
  - - [128, 256, 1, 4096, 128, 128, 128, 256]
    - [112, 7.08]
  - - [128, 256, 1, 8192, 128, 128, 128, 256]
    - [112, 7.88]
  - - [128, 512, 1, 128, 128, 128, 128, 512]
    - [54, 2.11]
  - - [128, 512, 1, 256, 128, 128, 128, 512]
    - [98, 3.66]
  - - [128, 512, 1, 512, 128, 128, 128, 512]
    - [98, 5.99]
  - - [128, 512, 1, 1024, 128, 128, 128, 512]
    - [101, 8.82]
  - - [128, 512, 1, 2048, 128, 128, 128, 512]
    - [104, 11.68]
  - - [128, 512, 1, 4096, 128, 128, 128, 512]
    - [103, 13.85]
  - - [128, 512, 1, 8192, 128, 128, 128, 512]
    - [112, 14.84]
  - - [128, 1024, 1, 128, 128, 128, 128, 1024]
    - [54, 4.05]
  - - [128, 1024, 1, 256, 128, 128, 128, 1024]
    - [54, 7.12]
  - - [128, 1024, 1, 512, 128, 128, 128, 1024]
    - [99, 11.49]
  - - [128, 1024, 1, 1024, 128, 128, 128, 1024]
    - [101, 17.22]
  - - [128, 1024, 1, 2048, 128, 128, 128, 1024]
    - [103, 22.96]
  - - [128, 1024, 1, 4096, 128, 128, 128, 1024]
    - [111, 26.17]
  - - [128, 1024, 1, 8192, 128, 128, 128, 1024]
    - [114, 27.89]
  - - [128, 2048, 1, 128, 128, 128, 128, 2048]
    - [53, 7.83]
  - - [128, 2048, 1, 256, 128, 128, 128, 2048]
    - [53, 13.29]
  - - [128, 2048, 1, 512, 128, 128, 128, 2048]
    - [93, 20.74]
  - - [128, 2048, 1, 1024, 128, 128, 128, 2048]
    - [97, 30.37]
  - - [128, 2048, 1, 2048, 128, 128, 128, 2048]
    - [108, 38.69]
  - - [128, 2048, 1, 4096, 128, 128, 128, 2048]
    - [108, 47.59]
  - - [128, 2048, 1, 8192, 128, 128, 128, 2048]
    - [110, 53.44]
  - - [128, 4096, 1, 128, 128, 128, 128, 4096]
    - [50, 14.2]
  - - [128, 4096, 1, 256, 128, 128, 128, 4096]
    - [50, 23.34]
  - - [128, 4096, 1, 512, 128, 128, 128, 4096]
    - [81, 37.1]
  - - [128, 4096, 1, 1024, 128, 128, 128, 4096]
    - [82, 53.28]
  - - [128, 4096, 1, 2048, 128, 128, 128, 4096]
    - [106, 66.94]
  - - [128, 4096, 1, 4096, 128, 128, 128, 4096]
    - [106, 82.01]
  - - [128, 4096, 1, 8192, 128, 128, 128, 4096]
    - [107, 91.69]
  - - [128, 8192, 1, 128, 128, 128, 128, 8192]
    - [45, 24.93]
  - - [128, 8192, 1, 256, 128, 128, 128, 8192]
    - [44, 41.73]
  - - [128, 8192, 1, 512, 128, 128, 128, 8192]
    - [46, 64.23]
  - - [128, 8192, 1, 1024, 128, 128, 128, 8192]
    - [75, 88.8]
  - - [128, 8192, 1, 2048, 128, 128, 128, 8192]
    - [75, 108.23]
  - - [128, 8192, 1, 4096, 128, 128, 128, 8192]
    - [105, 125.95]
  - - [128, 8192, 1, 8192, 128, 128, 128, 8192]
    - [75, 129.68]
  - - [256, 128, 1, 128, 256, 256, 256, 128]
    - [58, 0.99]
  - - [256, 128, 1, 256, 256, 256, 256, 128]
    - [55, 1.83]
  - - [256, 128, 1, 512, 256, 256, 256, 128]
    - [101, 3.0]
  - - [256, 128, 1, 1024, 256, 256, 256, 128]
    - [103, 4.47]
  - - [256, 128, 1, 2048, 256, 256, 256, 128]
    - [103, 5.91]
  - - [256, 128, 1, 4096, 256, 256, 256, 128]
    - [103, 7.11]
  - - [256, 128, 1, 8192, 256, 256, 256, 128]
    - [112, 7.87]
  - - [256, 256, 1, 128, 256, 256, 256, 256]
    - [54, 2.1]
  - - [256, 256, 1, 256, 256, 256, 256, 256]
    - [55, 3.57]
  - - [256, 256, 1, 512, 256, 256, 256, 256]
    - [101, 6.0]
  - - [256, 256, 1, 1024, 256, 256, 256, 256]
    - [101, 8.92]
  - - [256, 256, 1, 2048, 256, 256, 256, 256]
    - [103, 11.85]
  - - [256, 256, 1, 4096, 256, 256, 256, 256]
    - [103, 14.1]
  - - [256, 256, 1, 8192, 256, 256, 256, 256]
    - [112, 15.64]
  - - [256, 512, 1, 128, 256, 256, 256, 512]
    - [57, 4.05]
  - - [256, 512, 1, 256, 256, 256, 256, 512]
    - [54, 7.12]
  - - [256, 512, 1, 512, 256, 256, 256, 512]
    - [101, 11.61]
  - - [256, 512, 1, 1024, 256, 256, 256, 512]
    - [101, 17.37]
  - - [256, 512, 1, 2048, 256, 256, 256, 512]
    - [103, 22.98]
  - - [256, 512, 1, 4096, 256, 256, 256, 512]
    - [103, 27.55]
  - - [256, 512, 1, 8192, 256, 256, 256, 512]
    - [112, 30.59]
  - - [256, 1024, 1, 128, 256, 256, 256, 1024]
    - [52, 7.6]
  - - [256, 1024, 1, 256, 256, 256, 256, 1024]
    - [53, 13.23]
  - - [256, 1024, 1, 512, 256, 256, 256, 1024]
    - [95, 21.41]
  - - [256, 1024, 1, 1024, 256, 256, 256, 1024]
    - [96, 31.08]
  - - [256, 1024, 1, 2048, 256, 256, 256, 1024]
    - [108, 41.34]
  - - [256, 1024, 1, 4096, 256, 256, 256, 1024]
    - [108, 49.02]
  - - [256, 1024, 1, 8192, 256, 256, 256, 1024]
    - [110, 54.41]
  - - [256, 2048, 1, 128, 256, 256, 256, 2048]
    - [50, 14.34]
  - - [256, 2048, 1, 256, 256, 256, 256, 2048]
    - [50, 24.6]
  - - [256, 2048, 1, 512, 256, 256, 256, 2048]
    - [79, 38.05]
  - - [256, 2048, 1, 1024, 256, 256, 256, 2048]
    - [84, 54.42]
  - - [256, 2048, 1, 2048, 256, 256, 256, 2048]
    - [83, 68.39]
  - - [256, 2048, 1, 4096, 256, 256, 256, 2048]
    - [83, 79.71]
  - - [256, 2048, 1, 8192, 256, 256, 256, 2048]
    - [84, 86.9]
  - - [256, 4096, 1, 128, 256, 256, 256, 4096]
    - [47, 20.08]
  - - [256, 4096, 1, 256, 256, 256, 256, 4096]
    - [48, 40.43]
  - - [256, 4096, 1, 512, 256, 256, 256, 4096]
    - [45, 63.24]
  - - [256, 4096, 1, 1024, 256, 256, 256, 4096]
    - [43, 88.09]
  - - [256, 4096, 1, 2048, 256, 256, 256, 4096]
    - [75, 108.63]
  - - [256, 4096, 1, 4096, 256, 256, 256, 4096]
    - [75, 125.15]
  - - [256, 4096, 1, 8192, 256, 256, 256, 4096]
    - [105, 129.23]
  - - [256, 8192, 1, 128, 256, 256, 256, 8192]
    - [31, 39.15]
  - - [256, 8192, 1, 256, 256, 256, 256, 8192]
    - [33, 65.82]
  - - [256, 8192, 1, 512, 256, 256, 256, 8192]
    - [33, 99.75]
  - - [256, 8192, 1, 1024, 256, 256, 256, 8192]
    - [72, 135.16]
  - - [256, 8192, 1, 2048, 256, 256, 256, 8192]
    - [33, 161.09]
  - - [256, 8192, 1, 4096, 256, 256, 256, 8192]
    - [37, 176.32]
  - - [256, 8192, 1, 8192, 256, 256, 256, 8192]
    - [72, 165.15]
  - - [512, 128, 1, 128, 512, 512, 512, 128]
    - [57, 2.08]
  - - [512, 128, 1, 256, 512, 512, 512, 128]
    - [55, 3.66]
  - - [512, 128, 1, 512, 512, 512, 512, 128]
    - [101, 5.97]
  - - [512, 128, 1, 1024, 512, 512, 512, 128]
    - [101, 8.81]
  - - [512, 128, 1, 2048, 512, 512, 512, 128]
    - [103, 11.77]
  - - [512, 128, 1, 4096, 512, 512, 512, 128]
    - [103, 14.11]
  - - [512, 128, 1, 8192, 512, 512, 512, 128]
    - [115, 14.98]
  - - [512, 256, 1, 128, 512, 512, 512, 256]
    - [56, 4.06]
  - - [512, 256, 1, 256, 512, 512, 512, 256]
    - [54, 7.16]
  - - [512, 256, 1, 512, 512, 512, 512, 256]
    - [100, 11.65]
  - - [512, 256, 1, 1024, 512, 512, 512, 256]
    - [101, 17.37]
  - - [512, 256, 1, 2048, 512, 512, 512, 256]
    - [103, 23.15]
  - - [512, 256, 1, 4096, 512, 512, 512, 256]
    - [103, 27.43]
  - - [512, 256, 1, 8192, 512, 512, 512, 256]
    - [116, 28.8]
  - - [512, 512, 1, 128, 512, 512, 512, 512]
    - [53, 7.77]
  - - [512, 512, 1, 256, 512, 512, 512, 512]
    - [53, 13.36]
  - - [512, 512, 1, 512, 512, 512, 512, 512]
    - [93, 21.27]
  - - [512, 512, 1, 1024, 512, 512, 512, 512]
    - [96, 31.09]
  - - [512, 512, 1, 2048, 512, 512, 512, 512]
    - [96, 40.97]
  - - [512, 512, 1, 4096, 512, 512, 512, 512]
    - [108, 48.88]
  - - [512, 512, 1, 8192, 512, 512, 512, 512]
    - [97, 50.99]
  - - [512, 1024, 1, 128, 512, 512, 512, 1024]
    - [50, 14.13]
  - - [512, 1024, 1, 256, 512, 512, 512, 1024]
    - [50, 23.74]
  - - [512, 1024, 1, 512, 512, 512, 512, 1024]
    - [80, 37.85]
  - - [512, 1024, 1, 1024, 512, 512, 512, 1024]
    - [83, 54.42]
  - - [512, 1024, 1, 2048, 512, 512, 512, 1024]
    - [84, 68.92]
  - - [512, 1024, 1, 4096, 512, 512, 512, 1024]
    - [84, 78.44]
  - - [512, 1024, 1, 8192, 512, 512, 512, 1024]
    - [89, 81.56]
  - - [512, 2048, 1, 128, 512, 512, 512, 2048]
    - [74, 24.21]
  - - [512, 2048, 1, 256, 512, 512, 512, 2048]
    - [45, 41.8]
  - - [512, 2048, 1, 512, 512, 512, 512, 2048]
    - [45, 64.09]
  - - [512, 2048, 1, 1024, 512, 512, 512, 2048]
    - [75, 89.33]
  - - [512, 2048, 1, 2048, 512, 512, 512, 2048]
    - [43, 108.47]
  - - [512, 2048, 1, 4096, 512, 512, 512, 2048]
    - [77, 125.52]
  - - [512, 2048, 1, 8192, 512, 512, 512, 2048]
    - [76, 129.4]
  - - [512, 4096, 1, 128, 512, 512, 512, 4096]
    - [31, 39.36]
  - - [512, 4096, 1, 256, 512, 512, 512, 4096]
    - [31, 65.91]
  - - [512, 4096, 1, 512, 512, 512, 512, 4096]
    - [33, 99.36]
  - - [512, 4096, 1, 1024, 512, 512, 512, 4096]
    - [72, 135.21]
  - - [512, 4096, 1, 2048, 512, 512, 512, 4096]
    - [33, 161.44]
  - - [512, 4096, 1, 4096, 512, 512, 512, 4096]
    - [36, 179.03]
  - - [512, 4096, 1, 8192, 512, 512, 512, 4096]
    - [32, 165.28]
  - - [512, 8192, 1, 128, 512, 512, 512, 8192]
    - [24, 56.75]
  - - [512, 8192, 1, 256, 512, 512, 512, 8192]
    - [24, 94.68]
  - - [512, 8192, 1, 512, 512, 512, 512, 8192]
    - [26, 142.75]
  - - [512, 8192, 1, 1024, 512, 512, 512, 8192]
    - [26, 191.49]
  - - [512, 8192, 1, 2048, 512, 512, 512, 8192]
    - [26, 223.96]
  - - [512, 8192, 1, 4096, 512, 512, 512, 8192]
    - [67, 232.02]
  - - [512, 8192, 1, 8192, 512, 512, 512, 8192]
    - [65, 213.23]
  - - [1024, 128, 1, 128, 1024, 1024, 1024, 128]
    - [56, 4.03]
  - - [1024, 128, 1, 256, 1024, 1024, 1024, 128]
    - [54, 7.11]
  - - [1024, 128, 1, 512, 1024, 1024, 1024, 128]
    - [103, 11.55]
  - - [1024, 128, 1, 1024, 1024, 1024, 1024, 128]
    - [102, 17.38]
  - - [1024, 128, 1, 2048, 1024, 1024, 1024, 128]
    - [103, 23.24]
  - - [1024, 128, 1, 4096, 1024, 1024, 1024, 128]
    - [113, 25.62]
  - - [1024, 128, 1, 8192, 1024, 1024, 1024, 128]
    - [113, 26.44]
  - - [1024, 256, 1, 128, 1024, 1024, 1024, 256]
    - [53, 7.67]
  - - [1024, 256, 1, 256, 1024, 1024, 1024, 256]
    - [53, 13.3]
  - - [1024, 256, 1, 512, 1024, 1024, 1024, 256]
    - [94, 21.35]
  - - [1024, 256, 1, 1024, 1024, 1024, 1024, 256]
    - [96, 31.37]
  - - [1024, 256, 1, 2048, 1024, 1024, 1024, 256]
    - [108, 41.34]
  - - [1024, 256, 1, 4096, 1024, 1024, 1024, 256]
    - [92, 46.33]
  - - [1024, 256, 1, 8192, 1024, 1024, 1024, 256]
    - [109, 49.46]
  - - [1024, 512, 1, 128, 1024, 1024, 1024, 512]
    - [50, 14.31]
  - - [1024, 512, 1, 256, 1024, 1024, 1024, 512]
    - [50, 24.11]
  - - [1024, 512, 1, 512, 1024, 1024, 1024, 512]
    - [80, 37.98]
  - - [1024, 512, 1, 1024, 1024, 1024, 1024, 512]
    - [83, 54.43]
  - - [1024, 512, 1, 2048, 1024, 1024, 1024, 512]
    - [83, 69.88]
  - - [1024, 512, 1, 4096, 1024, 1024, 1024, 512]
    - [85, 76.82]
  - - [1024, 512, 1, 8192, 1024, 1024, 1024, 512]
    - [87, 81.99]
  - - [1024, 1024, 1, 128, 1024, 1024, 1024, 1024]
    - [45, 24.85]
  - - [1024, 1024, 1, 256, 1024, 1024, 1024, 1024]
    - [45, 41.73]
  - - [1024, 1024, 1, 512, 1024, 1024, 1024, 1024]
    - [46, 64.2]
  - - [1024, 1024, 1, 1024, 1024, 1024, 1024, 1024]
    - [75, 89.31]
  - - [1024, 1024, 1, 2048, 1024, 1024, 1024, 1024]
    - [75, 109.72]
  - - [1024, 1024, 1, 4096, 1024, 1024, 1024, 1024]
    - [76, 124.94]
  - - [1024, 1024, 1, 8192, 1024, 1024, 1024, 1024]
    - [75, 128.55]
  - - [1024, 2048, 1, 128, 1024, 1024, 1024, 2048]
    - [31, 39.1]
  - - [1024, 2048, 1, 256, 1024, 1024, 1024, 2048]
    - [31, 65.53]
  - - [1024, 2048, 1, 512, 1024, 1024, 1024, 2048]
    - [32, 99.27]
  - - [1024, 2048, 1, 1024, 1024, 1024, 1024, 2048]
    - [72, 135.13]
  - - [1024, 2048, 1, 2048, 1024, 1024, 1024, 2048]
    - [33, 162.0]
  - - [1024, 2048, 1, 4096, 1024, 1024, 1024, 2048]
    - [33, 175.62]
  - - [1024, 2048, 1, 8192, 1024, 1024, 1024, 2048]
    - [40, 164.93]
  - - [1024, 4096, 1, 128, 1024, 1024, 1024, 4096]
    - [24, 55.45]
  - - [1024, 4096, 1, 256, 1024, 1024, 1024, 4096]
    - [24, 94.69]
  - - [1024, 4096, 1, 512, 1024, 1024, 1024, 4096]
    - [26, 142.5]
  - - [1024, 4096, 1, 1024, 1024, 1024, 1024, 4096]
    - [26, 191.02]
  - - [1024, 4096, 1, 2048, 1024, 1024, 1024, 4096]
    - [25, 221.88]
  - - [1024, 4096, 1, 4096, 1024, 1024, 1024, 4096]
    - [71, 226.75]
  - - [1024, 4096, 1, 8192, 1024, 1024, 1024, 4096]
    - [26, 213.5]
  - - [1024, 8192, 1, 128, 1024, 1024, 1024, 8192]
    - [19, 82.48]
  - - [1024, 8192, 1, 256, 1024, 1024, 1024, 8192]
    - [19, 130.67]
  - - [1024, 8192, 1, 512, 1024, 1024, 1024, 8192]
    - [19, 184.08]
  - - [1024, 8192, 1, 1024, 1024, 1024, 1024, 8192]
    - [5, 230.07]
  - - [1024, 8192, 1, 2048, 1024, 1024, 1024, 8192]
    - [2, 256.27]
  - - [1024, 8192, 1, 4096, 1024, 1024, 1024, 8192]
    - [60, 245.08]
  - - [1024, 8192, 1, 8192, 1024, 1024, 1024, 8192]
    - [7, 261.78]
  - - [2048, 128, 1, 128, 2048, 2048, 2048, 128]
    - [53, 7.77]
  - - [2048, 128, 1, 256, 2048, 2048, 2048, 128]
    - [53, 13.31]
  - - [2048, 128, 1, 512, 2048, 2048, 2048, 128]
    - [94, 21.36]
  - - [2048, 128, 1, 1024, 2048, 2048, 2048, 128]
    - [96, 31.35]
  - - [2048, 128, 1, 2048, 2048, 2048, 2048, 128]
    - [92, 37.75]
  - - [2048, 128, 1, 4096, 2048, 2048, 2048, 128]
    - [92, 45.41]
  - - [2048, 128, 1, 8192, 2048, 2048, 2048, 128]
    - [91, 50.75]
  - - [2048, 256, 1, 128, 2048, 2048, 2048, 256]
    - [50, 14.09]
  - - [2048, 256, 1, 256, 2048, 2048, 2048, 256]
    - [50, 24.11]
  - - [2048, 256, 1, 512, 2048, 2048, 2048, 256]
    - [83, 37.51]
  - - [2048, 256, 1, 1024, 2048, 2048, 2048, 256]
    - [83, 54.13]
  - - [2048, 256, 1, 2048, 2048, 2048, 2048, 256]
    - [88, 67.7]
  - - [2048, 256, 1, 4096, 2048, 2048, 2048, 256]
    - [86, 78.64]
  - - [2048, 256, 1, 8192, 2048, 2048, 2048, 256]
    - [86, 86.08]
  - - [2048, 512, 1, 128, 2048, 2048, 2048, 512]
    - [45, 24.33]
  - - [2048, 512, 1, 256, 2048, 2048, 2048, 512]
    - [45, 41.55]
  - - [2048, 512, 1, 512, 2048, 2048, 2048, 512]
    - [45, 63.61]
  - - [2048, 512, 1, 1024, 2048, 2048, 2048, 512]
    - [75, 87.78]
  - - [2048, 512, 1, 2048, 2048, 2048, 2048, 512]
    - [76, 107.31]
  - - [2048, 512, 1, 4096, 2048, 2048, 2048, 512]
    - [77, 125.24]
  - - [2048, 512, 1, 8192, 2048, 2048, 2048, 512]
    - [76, 129.75]
  - - [2048, 1024, 1, 128, 2048, 2048, 2048, 1024]
    - [31, 39.39]
  - - [2048, 1024, 1, 256, 2048, 2048, 2048, 1024]
    - [31, 65.72]
  - - [2048, 1024, 1, 512, 2048, 2048, 2048, 1024]
    - [32, 99.68]
  - - [2048, 1024, 1, 1024, 2048, 2048, 2048, 1024]
    - [72, 134.72]
  - - [2048, 1024, 1, 2048, 2048, 2048, 2048, 1024]
    - [41, 160.66]
  - - [2048, 1024, 1, 4096, 2048, 2048, 2048, 1024]
    - [37, 177.77]
  - - [2048, 1024, 1, 8192, 2048, 2048, 2048, 1024]
    - [34, 163.78]
  - - [2048, 2048, 1, 128, 2048, 2048, 2048, 2048]
    - [24, 56.05]
  - - [2048, 2048, 1, 256, 2048, 2048, 2048, 2048]
    - [26, 94.06]
  - - [2048, 2048, 1, 512, 2048, 2048, 2048, 2048]
    - [26, 142.58]
  - - [2048, 2048, 1, 1024, 2048, 2048, 2048, 2048]
    - [26, 189.78]
  - - [2048, 2048, 1, 2048, 2048, 2048, 2048, 2048]
    - [14, 221.18]
  - - [2048, 2048, 1, 4096, 2048, 2048, 2048, 2048]
    - [28, 225.79]
  - - [2048, 2048, 1, 8192, 2048, 2048, 2048, 2048]
    - [66, 211.87]
  - - [2048, 4096, 1, 128, 2048, 2048, 2048, 4096]
    - [0, 71.75]
  - - [2048, 4096, 1, 256, 2048, 2048, 2048, 4096]
    - [2, 117.85]
  - - [2048, 4096, 1, 512, 2048, 2048, 2048, 4096]
    - [3, 175.64]
  - - [2048, 4096, 1, 1024, 2048, 2048, 2048, 4096]
    - [10, 228.87]
  - - [2048, 4096, 1, 2048, 2048, 2048, 2048, 4096]
    - [7, 255.8]
  - - [2048, 4096, 1, 4096, 2048, 2048, 2048, 4096]
    - [5, 247.63]
  - - [2048, 4096, 1, 8192, 2048, 2048, 2048, 4096]
    - [3, 260.7]
  - - [2048, 8192, 1, 128, 2048, 2048, 2048, 8192]
    - [21, 88.77]
  - - [2048, 8192, 1, 256, 2048, 2048, 2048, 8192]
    - [22, 136.42]
  - - [2048, 8192, 1, 512, 2048, 2048, 2048, 8192]
    - [10, 185.67]
  - - [2048, 8192, 1, 1024, 2048, 2048, 2048, 8192]
    - [7, 224.13]
  - - [2048, 8192, 1, 2048, 2048, 2048, 2048, 8192]
    - [12, 232.18]
  - - [2048, 8192, 1, 4096, 2048, 2048, 2048, 8192]
    - [6, 279.22]
  - - [2048, 8192, 1, 8192, 2048, 2048, 2048, 8192]
    - [61, 323.15]
  - - [4096, 128, 1, 128, 4096, 4096, 4096, 128]
    - [50, 13.9]
  - - [4096, 128, 1, 256, 4096, 4096, 4096, 128]
    - [51, 22.98]
  - - [4096, 128, 1, 512, 4096, 4096, 4096, 128]
    - [83, 36.34]
  - - [4096, 128, 1, 1024, 4096, 4096, 4096, 128]
    - [83, 54.22]
  - - [4096, 128, 1, 2048, 4096, 4096, 4096, 128]
    - [86, 66.17]
  - - [4096, 128, 1, 4096, 4096, 4096, 4096, 128]
    - [90, 78.26]
  - - [4096, 128, 1, 8192, 4096, 4096, 4096, 128]
    - [89, 84.54]
  - - [4096, 256, 1, 128, 4096, 4096, 4096, 256]
    - [49, 23.93]
  - - [4096, 256, 1, 256, 4096, 4096, 4096, 256]
    - [42, 40.86]
  - - [4096, 256, 1, 512, 4096, 4096, 4096, 256]
    - [43, 62.8]
  - - [4096, 256, 1, 1024, 4096, 4096, 4096, 256]
    - [43, 86.3]
  - - [4096, 256, 1, 2048, 4096, 4096, 4096, 256]
    - [76, 106.7]
  - - [4096, 256, 1, 4096, 4096, 4096, 4096, 256]
    - [77, 125.89]
  - - [4096, 256, 1, 8192, 4096, 4096, 4096, 256]
    - [76, 131.05]
  - - [4096, 512, 1, 128, 4096, 4096, 4096, 512]
    - [31, 39.0]
  - - [4096, 512, 1, 256, 4096, 4096, 4096, 512]
    - [32, 65.44]
  - - [4096, 512, 1, 512, 4096, 4096, 4096, 512]
    - [32, 98.22]
  - - [4096, 512, 1, 1024, 4096, 4096, 4096, 512]
    - [40, 131.74]
  - - [4096, 512, 1, 2048, 4096, 4096, 4096, 512]
    - [41, 160.17]
  - - [4096, 512, 1, 4096, 4096, 4096, 4096, 512]
    - [41, 177.81]
  - - [4096, 512, 1, 8192, 4096, 4096, 4096, 512]
    - [38, 165.23]
  - - [4096, 1024, 1, 128, 4096, 4096, 4096, 1024]
    - [24, 56.44]
  - - [4096, 1024, 1, 256, 4096, 4096, 4096, 1024]
    - [26, 94.37]
  - - [4096, 1024, 1, 512, 4096, 4096, 4096, 1024]
    - [23, 141.83]
  - - [4096, 1024, 1, 1024, 4096, 4096, 4096, 1024]
    - [27, 188.51]
  - - [4096, 1024, 1, 2048, 4096, 4096, 4096, 1024]
    - [29, 221.62]
  - - [4096, 1024, 1, 4096, 4096, 4096, 4096, 1024]
    - [69, 230.19]
  - - [4096, 1024, 1, 8192, 4096, 4096, 4096, 1024]
    - [70, 215.32]
  - - [4096, 2048, 1, 128, 4096, 4096, 4096, 2048]
    - [2, 70.32]
  - - [4096, 2048, 1, 256, 4096, 4096, 4096, 2048]
    - [3, 118.18]
  - - [4096, 2048, 1, 512, 4096, 4096, 4096, 2048]
    - [3, 176.52]
  - - [4096, 2048, 1, 1024, 4096, 4096, 4096, 2048]
    - [5, 227.74]
  - - [4096, 2048, 1, 2048, 4096, 4096, 4096, 2048]
    - [64, 258.24]
  - - [4096, 2048, 1, 4096, 4096, 4096, 4096, 2048]
    - [62, 245.22]
  - - [4096, 2048, 1, 8192, 4096, 4096, 4096, 2048]
    - [11, 263.0]
  - - [4096, 4096, 1, 128, 4096, 4096, 4096, 4096]
    - [8, 76.67]
  - - [4096, 4096, 1, 256, 4096, 4096, 4096, 4096]
    - [8, 125.92]
  - - [4096, 4096, 1, 512, 4096, 4096, 4096, 4096]
    - [8, 186.91]
  - - [4096, 4096, 1, 1024, 4096, 4096, 4096, 4096]
    - [3, 219.51]
  - - [4096, 4096, 1, 2048, 4096, 4096, 4096, 4096]
    - [15, 228.11]
  - - [4096, 4096, 1, 4096, 4096, 4096, 4096, 4096]
    - [5, 278.07]
  - - [4096, 4096, 1, 8192, 4096, 4096, 4096, 4096]
    - [7, 324.38]
  - - [4096, 8192, 1, 128, 4096, 4096, 4096, 8192]
    - [18, 93.42]
  - - [4096, 8192, 1, 256, 4096, 4096, 4096, 8192]
    - [18, 139.14]
  - - [4096, 8192, 1, 512, 4096, 4096, 4096, 8192]
    - [14, 188.66]
  - - [4096, 8192, 1, 1024, 4096, 4096, 4096, 8192]
    - [11, 218.19]
  - - [4096, 8192, 1, 2048, 4096, 4096, 4096, 8192]
    - [1, 260.02]
  - - [4096, 8192, 1, 4096, 4096, 4096, 4096, 8192]
    - [3, 316.34]
  - - [4096, 8192, 1, 8192, 4096, 4096, 4096, 8192]
    - [59, 351.75]
  - - [8192, 128, 1, 128, 8192, 8192, 8192, 128]
    - [45, 24.85]
  - - [8192, 128, 1, 256, 8192, 8192, 8192, 128]
    - [45, 42.03]
  - - [8192, 128, 1, 512, 8192, 8192, 8192, 128]
    - [46, 64.6]
  - - [8192, 128, 1, 1024, 8192, 8192, 8192, 128]
    - [77, 88.22]
  - - [8192, 128, 1, 2048, 8192, 8192, 8192, 128]
    - [76, 107.87]
  - - [8192, 128, 1, 4096, 8192, 8192, 8192, 128]
    - [77, 125.21]
  - - [8192, 128, 1, 8192, 8192, 8192, 8192, 128]
    - [78, 126.05]
  - - [8192, 256, 1, 128, 8192, 8192, 8192, 256]
    - [30, 38.74]
  - - [8192, 256, 1, 256, 8192, 8192, 8192, 256]
    - [32, 65.37]
  - - [8192, 256, 1, 512, 8192, 8192, 8192, 256]
    - [36, 98.0]
  - - [8192, 256, 1, 1024, 8192, 8192, 8192, 256]
    - [73, 133.55]
  - - [8192, 256, 1, 2048, 8192, 8192, 8192, 256]
    - [35, 160.09]
  - - [8192, 256, 1, 4096, 8192, 8192, 8192, 256]
    - [41, 178.91]
  - - [8192, 256, 1, 8192, 8192, 8192, 8192, 256]
    - [39, 160.49]
  - - [8192, 512, 1, 128, 8192, 8192, 8192, 512]
    - [24, 56.51]
  - - [8192, 512, 1, 256, 8192, 8192, 8192, 512]
    - [11, 93.99]
  - - [8192, 512, 1, 512, 8192, 8192, 8192, 512]
    - [27, 141.22]
  - - [8192, 512, 1, 1024, 8192, 8192, 8192, 512]
    - [27, 186.33]
  - - [8192, 512, 1, 2048, 8192, 8192, 8192, 512]
    - [16, 220.79]
  - - [8192, 512, 1, 4096, 8192, 8192, 8192, 512]
    - [17, 229.4]
  - - [8192, 512, 1, 8192, 8192, 8192, 8192, 512]
    - [68, 214.79]
  - - [8192, 1024, 1, 128, 8192, 8192, 8192, 1024]
    - [6, 71.19]
  - - [8192, 1024, 1, 256, 8192, 8192, 8192, 1024]
    - [9, 117.97]
  - - [8192, 1024, 1, 512, 8192, 8192, 8192, 1024]
    - [10, 176.85]
  - - [8192, 1024, 1, 1024, 8192, 8192, 8192, 1024]
    - [6, 228.0]
  - - [8192, 1024, 1, 2048, 8192, 8192, 8192, 1024]
    - [7, 260.25]
  - - [8192, 1024, 1, 4096, 8192, 8192, 8192, 1024]
    - [5, 252.06]
  - - [8192, 1024, 1, 8192, 8192, 8192, 8192, 1024]
    - [65, 275.87]
  - - [8192, 2048, 1, 128, 8192, 8192, 8192, 2048]
    - [4, 76.16]
  - - [8192, 2048, 1, 256, 8192, 8192, 8192, 2048]
    - [0, 124.7]
  - - [8192, 2048, 1, 512, 8192, 8192, 8192, 2048]
    - [10, 182.73]
  - - [8192, 2048, 1, 1024, 8192, 8192, 8192, 2048]
    - [10, 221.44]
  - - [8192, 2048, 1, 2048, 8192, 8192, 8192, 2048]
    - [13, 231.56]
  - - [8192, 2048, 1, 4096, 8192, 8192, 8192, 2048]
    - [7, 280.78]
  - - [8192, 2048, 1, 8192, 8192, 8192, 8192, 2048]
    - [62, 328.9]
  - - [8192, 4096, 1, 128, 8192, 8192, 8192, 4096]
    - [8, 81.88]
  - - [8192, 4096, 1, 256, 8192, 8192, 8192, 4096]
    - [1, 128.11]
  - - [8192, 4096, 1, 512, 8192, 8192, 8192, 4096]
    - [28, 181.74]
  - - [8192, 4096, 1, 1024, 8192, 8192, 8192, 4096]
    - [14, 218.33]
  - - [8192, 4096, 1, 2048, 8192, 8192, 8192, 4096]
    - [17, 257.64]
  - - [8192, 4096, 1, 4096, 8192, 8192, 8192, 4096]
    - [3, 305.11]
  - - [8192, 4096, 1, 8192, 8192, 8192, 8192, 4096]
    - [63, 335.91]
  - - [8192, 8192, 1, 128, 8192, 8192, 8192, 8192]
    - [20, 89.92]
  - - [8192, 8192, 1, 256, 8192, 8192, 8192, 8192]
    - [16, 140.41]
  - - [8192, 8192, 1, 512, 8192, 8192, 8192, 8192]
    - [10, 203.6]
  - - [8192, 8192, 1, 1024, 8192, 8192, 8192, 8192]
    - [64, 263.33]
  - - [8192, 8192, 1, 2048, 8192, 8192, 8192, 8192]
    - [60, 318.86]
  - - [8192, 8192, 1, 4096, 8192, 8192, 8192, 8192]
    - [64, 353.53]
  - - [8192, 8192, 1, 8192, 8192, 8192, 8192, 8192]
    - [3, 345.36]
- null
- null
- ExperimentalStreamK
- GridBased
