projects/hipblaslt/library/src/amd_detail/rocblaslt/src/Tensile/Logic/asm_full/aquavanjaram/gfx942_228cu/StreamK/aquavanjaram942_Cijk_Ailk_Bjlk_B8NB8NS_BH_Bias_HAS_SAV_UserArgs.yaml
- {MinimumRequiredVersion: 4.33.0}
- aquavanjaram942
- {Architecture: gfx942, CUCount: 228}
- [Device 0049, Device 0050]
    SolutionIndex: 0
    SolutionNameMin: Cijk_Ailk_Bjlk_B8NB8NS_BH_Bias_HAS_SAV_UserArgs_MT256x256x64_MI16x16x1_SN_LDSB0_CLR1_GRVWA16_GRVWB4_GSU0_GSUC0_GSUWGMRR0_K1_LBSPPA2048_LBSPPB2048_LPA0_LPB0_MIWT8_8_PLR1_SU0_SUM0_SUS64_VWA8_VWB8_WGM1_WGMXCC1_WGMXCCGn1
    SolutionIndex: 1
    SolutionNameMin: Cijk_Ailk_Bjlk_B8NB8NS_BH_Bias_HAS_SAV_UserArgs_MT256x256x64_MI16x16x1_SN_LDSB0_CLR1_GRVWA4_GRVWB8_GSU0_GSUC0_GSUWGMRR0_K1_LBSPPA2048_LBSPPB2048_LPA0_LPB0_MIWT8_8_PLR1_SU0_SUM0_SUS64_VWA8_VWB8_WGM1_WGMXCC1_WGMXCCGn1
    SolutionIndex: 2
    SolutionNameMin: Cijk_Ailk_Bjlk_B8NB8NS_BH_Bias_HAS_SAV_UserArgs_MT256x256x64_MI16x16x1_SN_LDSB0_CLR1_GRVWA4_GRVWB16_GSU0_GSUC0_GSUWGMRR0_K1_LBSPPA2048_LBSPPB2048_LPA0_LPB0_MIWT8_8_PLR1_SU0_SUM0_SUS64_VWA8_VWB8_WGM1_WGMXCC1_WGMXCCGn1
    SolutionIndex: 3
    SolutionNameMin: Cijk_Ailk_Bjlk_B8NB8NS_BH_Bias_HAS_SAV_UserArgs_MT256x256x64_MI16x16x1_SN_LDSB0_CLR1_GRVWA16_GRVWB16_GSU0_GSUC0_GSUWGMRR0_K1_LBSPPA2048_LBSPPB2048_LPA0_LPB0_MIWT8_8_PLR1_SU0_SUM0_SUS64_VWA8_VWB8_WGM1_WGMXCC1_WGMXCCGn1
    SolutionIndex: 4
    SolutionNameMin: Cijk_Ailk_Bjlk_B8NB8NS_BH_Bias_HAS_SAV_UserArgs_MT256x256x64_MI16x16x1_SN_LDSB0_CLR1_GRVWA16_GRVWB16_GSU0_GSUC0_GSUWGMRR0_K1_LBSPPA2048_LBSPPB2048_LPA0_LPB0_MIWT8_8_PLR1_SU0_SUM0_SUS64_VWA8_VWB8_WGM4_WGMXCC1_WGMXCCGn1
    SolutionIndex: 5
    SolutionNameMin: Cijk_Ailk_Bjlk_B8NB8NS_BH_Bias_HAS_SAV_UserArgs_MT256x256x64_MI16x16x1_SN_LDSB0_CLR1_GRVWA16_GRVWB4_GSU0_GSUC0_GSUWGMRR0_K1_LBSPPA2048_LBSPPB2048_LPA0_LPB0_MIWT8_8_PLR1_SU0_SUM0_SUS64_VWA8_VWB8_WGM6_WGMXCC1_WGMXCCGn1
    SolutionIndex: 6
    SolutionNameMin: Cijk_Ailk_Bjlk_B8NB8NS_BH_Bias_HAS_SAV_UserArgs_MT256x256x64_MI16x16x1_SN_LDSB0_CLR1_GRVWA4_GRVWB8_GSU0_GSUC0_GSUWGMRR0_K1_LBSPPA2048_LBSPPB2048_LPA0_LPB0_MIWT8_8_PLR1_SU0_SUM0_SUS64_VWA8_VWB8_WGM6_WGMXCC1_WGMXCCGn1
    SolutionIndex: 7
    SolutionNameMin: Cijk_Ailk_Bjlk_B8NB8NS_BH_Bias_HAS_SAV_UserArgs_MT256x256x64_MI16x16x1_SN_LDSB0_CLR1_GRVWA16_GRVWB16_GSU0_GSUC0_GSUWGMRR0_K1_LBSPPA2048_LBSPPB2048_LPA0_LPB0_MIWT8_8_PLR1_SU0_SUM0_SUS64_VWA8_VWB8_WGM6_WGMXCC1_WGMXCCGn1
    SolutionIndex: 8
    SolutionNameMin: Cijk_Ailk_Bjlk_B8NB8NS_BH_Bias_HAS_SAV_UserArgs_MT256x256x64_MI16x16x1_SN_LDSB0_CLR1_GRVWA4_GRVWB4_GSU0_GSUC0_GSUWGMRR0_K1_LBSPPA2048_LBSPPB2048_LPA0_LPB0_MIWT8_8_PLR1_SU0_SUM0_SUS64_VWA8_VWB8_WGM8_WGMXCC1_WGMXCCGn1
    SolutionIndex: 9
    SolutionNameMin: Cijk_Ailk_Bjlk_B8NB8NS_BH_Bias_HAS_SAV_UserArgs_MT256x256x64_MI16x16x1_SN_LDSB0_CLR1_GRVWA16_GRVWB4_GSU0_GSUC0_GSUWGMRR0_K1_LBSPPA2048_LBSPPB2048_LPA0_LPB0_MIWT8_8_PLR1_SU0_SUM0_SUS64_VWA8_VWB8_WGM8_WGMXCC1_WGMXCCGn1
    SolutionIndex: 10
    SolutionNameMin: Cijk_Ailk_Bjlk_B8NB8NS_BH_Bias_HAS_SAV_UserArgs_MT256x256x64_MI16x16x1_SN_LDSB0_CLR1_GRVWA4_GRVWB8_GSU0_GSUC0_GSUWGMRR0_K1_LBSPPA2048_LBSPPB2048_LPA0_LPB0_MIWT8_8_PLR1_SU0_SUM0_SUS64_VWA8_VWB8_WGM8_WGMXCC1_WGMXCCGn1
    SolutionIndex: 11
    SolutionNameMin: Cijk_Ailk_Bjlk_B8NB8NS_BH_Bias_HAS_SAV_UserArgs_MT256x256x64_MI16x16x1_SN_LDSB0_CLR1_GRVWA8_GRVWB16_GSU0_GSUC0_GSUWGMRR0_K1_LBSPPA2048_LBSPPB2048_LPA0_LPB0_MIWT8_8_PLR1_SU0_SUM0_SUS64_VWA8_VWB8_WGM8_WGMXCC1_WGMXCCGn1
    SolutionIndex: 12
    SolutionNameMin: Cijk_Ailk_Bjlk_B8NB8NS_BH_Bias_HAS_SAV_UserArgs_MT256x256x64_MI16x16x1_SN_LDSB0_CLR1_GRVWA16_GRVWB16_GSU0_GSUC0_GSUWGMRR0_K1_LBSPPA2048_LBSPPB2048_LPA0_LPB0_MIWT8_8_PLR1_SU0_SUM0_SUS64_VWA8_VWB8_WGM8_WGMXCC1_WGMXCCGn1
    SolutionIndex: 13
    SolutionNameMin: Cijk_Ailk_Bjlk_B8NB8NS_BH_Bias_HAS_SAV_UserArgs_MT128x256x64_MI16x16x1_SN_LDSB1_CLR1_GRVWA4_GRVWB16_GSU0_GSUC0_GSUWGMRR0_K1_LBSPPA1024_LBSPPB2048_LPA64_LPB0_MIWT4_8_PLR1_SU0_SUM0_SUS64_VWA4_VWB8_WGM1_WGMXCC1_WGMXCCGn1
    SolutionIndex: 14
    SolutionNameMin: Cijk_Ailk_Bjlk_B8NB8NS_BH_Bias_HAS_SAV_UserArgs_MT128x256x64_MI16x16x1_SN_LDSB1_CLR1_GRVWA16_GRVWB16_GSU0_GSUC0_GSUWGMRR0_K1_LBSPPA1024_LBSPPB2048_LPA64_LPB0_MIWT4_8_PLR1_SU0_SUM0_SUS64_VWA4_VWB8_WGM4_WGMXCC1_WGMXCCGn1
    SolutionIndex: 15
    SolutionNameMin: Cijk_Ailk_Bjlk_B8NB8NS_BH_Bias_HAS_SAV_UserArgs_MT128x256x64_MI16x16x1_SN_LDSB1_CLR1_GRVWA16_GRVWB16_GSU0_GSUC0_GSUWGMRR0_K1_LBSPPA1024_LBSPPB2048_LPA64_LPB0_MIWT4_8_PLR1_SU0_SUM0_SUS64_VWA4_VWB8_WGM6_WGMXCC1_WGMXCCGn1
    SolutionIndex: 16
    SolutionNameMin: Cijk_Ailk_Bjlk_B8NB8NS_BH_Bias_HAS_SAV_UserArgs_MT128x256x64_MI16x16x1_SN_LDSB1_CLR1_GRVWA16_GRVWB16_GSU0_GSUC0_GSUWGMRR0_K1_LBSPPA1024_LBSPPB2048_LPA64_LPB0_MIWT4_8_PLR1_SU0_SUM0_SUS64_VWA4_VWB8_WGM8_WGMXCC1_WGMXCCGn1
    SolutionIndex: 17
    SolutionNameMin: Cijk_Ailk_Bjlk_B8NB8NS_BH_Bias_HAS_SAV_UserArgs_MT256x144x64_MI16x16x1_SN_LDSB0_CLR1_GRVWA4_GRVWB4_GSU0_GSUC0_GSUWGMRR0_K1_LBSPPA2048_LBSPPB1152_LPA64_LPB16_MIWT4_9_PLR1_SU0_SUM0_SUS64_VWA4_VWB1_WGM1_WGMXCC1_WGMXCCGn1
    SolutionIndex: 18
    SolutionNameMin: Cijk_Ailk_Bjlk_B8NB8NS_BH_Bias_HAS_SAV_UserArgs_MT256x144x64_MI16x16x1_SN_LDSB0_CLR1_GRVWA8_GRVWB4_GSU0_GSUC0_GSUWGMRR0_K1_LBSPPA2048_LBSPPB1152_LPA64_LPB16_MIWT4_9_PLR1_SU0_SUM0_SUS64_VWA4_VWB1_WGM1_WGMXCC1_WGMXCCGn1
    SolutionIndex: 19
    SolutionNameMin: Cijk_Ailk_Bjlk_B8NB8NS_BH_Bias_HAS_SAV_UserArgs_MT256x144x64_MI16x16x1_SN_LDSB0_CLR1_GRVWA16_GRVWB4_GSU0_GSUC0_GSUWGMRR0_K1_LBSPPA2048_LBSPPB1152_LPA64_LPB16_MIWT4_9_PLR1_SU0_SUM0_SUS64_VWA4_VWB1_WGM1_WGMXCC1_WGMXCCGn1
    SolutionIndex: 20
    SolutionNameMin: Cijk_Ailk_Bjlk_B8NB8NS_BH_Bias_HAS_SAV_UserArgs_MT256x144x64_MI16x16x1_SN_LDSB0_CLR1_GRVWA16_GRVWB4_GSU0_GSUC0_GSUWGMRR0_K1_LBSPPA2048_LBSPPB1152_LPA64_LPB16_MIWT4_9_PLR1_SU0_SUM0_SUS64_VWA4_VWB1_WGM4_WGMXCC1_WGMXCCGn1
    SolutionIndex: 21
    SolutionNameMin: Cijk_Ailk_Bjlk_B8NB8NS_BH_Bias_HAS_SAV_UserArgs_MT256x144x64_MI16x16x1_SN_LDSB0_CLR1_GRVWA4_GRVWB4_GSU0_GSUC0_GSUWGMRR0_K1_LBSPPA2048_LBSPPB1152_LPA64_LPB16_MIWT4_9_PLR1_SU0_SUM0_SUS64_VWA4_VWB1_WGM8_WGMXCC1_WGMXCCGn1
    SolutionIndex: 22
    SolutionNameMin: Cijk_Ailk_Bjlk_B8NB8NS_BH_Bias_HAS_SAV_UserArgs_MT256x128x64_MI16x16x1_SN_LDSB1_CLR1_GRVWA4_GRVWB8_GSU0_GSUC0_GSUWGMRR0_K1_LBSPPA2048_LBSPPB1024_LPA0_LPB64_MIWT8_4_PLR1_SU0_SUM0_SUS64_VWA8_VWB4_WGM1_WGMXCC1_WGMXCCGn1
    SolutionIndex: 23
    SolutionNameMin: Cijk_Ailk_Bjlk_B8NB8NS_BH_Bias_HAS_SAV_UserArgs_MT256x128x64_MI16x16x1_SN_LDSB1_CLR1_GRVWA16_GRVWB16_GSU0_GSUC0_GSUWGMRR0_K1_LBSPPA2048_LBSPPB1024_LPA0_LPB64_MIWT8_4_PLR1_SU0_SUM0_SUS64_VWA8_VWB4_WGM1_WGMXCC1_WGMXCCGn1
    SolutionIndex: 24
    SolutionNameMin: Cijk_Ailk_Bjlk_B8NB8NS_BH_Bias_HAS_SAV_UserArgs_MT256x128x64_MI16x16x1_SN_LDSB1_CLR1_GRVWA16_GRVWB16_GSU0_GSUC0_GSUWGMRR0_K1_LBSPPA2048_LBSPPB1024_LPA0_LPB64_MIWT8_4_PLR1_SU0_SUM0_SUS64_VWA8_VWB4_WGM4_WGMXCC1_WGMXCCGn1
    SolutionIndex: 25
    SolutionNameMin: Cijk_Ailk_Bjlk_B8NB8NS_BH_Bias_HAS_SAV_UserArgs_MT256x128x64_MI16x16x1_SN_LDSB1_CLR1_GRVWA16_GRVWB16_GSU0_GSUC0_GSUWGMRR0_K1_LBSPPA2048_LBSPPB1024_LPA0_LPB64_MIWT8_4_PLR1_SU0_SUM0_SUS64_VWA8_VWB4_WGM6_WGMXCC1_WGMXCCGn1
    SolutionIndex: 26
    SolutionNameMin: Cijk_Ailk_Bjlk_B8NB8NS_BH_Bias_HAS_SAV_UserArgs_MT256x128x64_MI16x16x1_SN_LDSB1_CLR1_GRVWA4_GRVWB8_GSU0_GSUC0_GSUWGMRR0_K1_LBSPPA2048_LBSPPB1024_LPA0_LPB64_MIWT8_4_PLR1_SU0_SUM0_SUS64_VWA8_VWB4_WGM8_WGMXCC1_WGMXCCGn1
    SolutionIndex: 27
    SolutionNameMin: Cijk_Ailk_Bjlk_B8NB8NS_BH_Bias_HAS_SAV_UserArgs_MT256x128x64_MI16x16x1_SN_LDSB1_CLR1_GRVWA8_GRVWB8_GSU0_GSUC0_GSUWGMRR0_K1_LBSPPA2048_LBSPPB1024_LPA0_LPB64_MIWT8_4_PLR1_SU0_SUM0_SUS64_VWA8_VWB4_WGM8_WGMXCC1_WGMXCCGn1
    SolutionIndex: 28
    SolutionNameMin: Cijk_Ailk_Bjlk_B8NB8NS_BH_Bias_HAS_SAV_UserArgs_MT256x128x64_MI16x16x1_SN_LDSB1_CLR1_GRVWA16_GRVWB16_GSU0_GSUC0_GSUWGMRR0_K1_LBSPPA2048_LBSPPB1024_LPA0_LPB64_MIWT8_4_PLR1_SU0_SUM0_SUS64_VWA8_VWB4_WGM8_WGMXCC1_WGMXCCGn1
    SolutionIndex: 29
    SolutionNameMin: Cijk_Ailk_Bjlk_B8NB8NS_BH_Bias_HAS_SAV_UserArgs_MT128x128x64_MI16x16x1_SN_LDSB1_CLR1_GRVWA4_GRVWB4_GSU0_GSUC0_GSUWGMRR0_K1_LBSPPA1024_LBSPPB1024_LPA64_LPB64_MIWT4_4_PLR1_SU0_SUM0_SUS64_VWA4_VWB4_WGM1_WGMXCC1_WGMXCCGn1
    SolutionIndex: 30
    SolutionNameMin: Cijk_Ailk_Bjlk_B8NB8NS_BH_Bias_HAS_SAV_UserArgs_MT128x128x64_MI16x16x1_SN_LDSB1_CLR1_GRVWA4_GRVWB16_GSU0_GSUC0_GSUWGMRR0_K1_LBSPPA1024_LBSPPB1024_LPA64_LPB64_MIWT4_4_PLR1_SU0_SUM0_SUS64_VWA4_VWB4_WGM1_WGMXCC1_WGMXCCGn1
    SolutionIndex: 31
    SolutionNameMin: Cijk_Ailk_Bjlk_B8NB8NS_BH_Bias_HAS_SAV_UserArgs_MT128x128x64_MI16x16x1_SN_LDSB1_CLR1_GRVWA8_GRVWB16_GSU0_GSUC0_GSUWGMRR0_K1_LBSPPA1024_LBSPPB1024_LPA64_LPB64_MIWT4_4_PLR1_SU0_SUM0_SUS64_VWA4_VWB4_WGM1_WGMXCC1_WGMXCCGn1
    SolutionIndex: 32
    SolutionNameMin: Cijk_Ailk_Bjlk_B8NB8NS_BH_Bias_HAS_SAV_UserArgs_MT128x128x64_MI16x16x1_SN_LDSB1_CLR1_GRVWA16_GRVWB16_GSU0_GSUC0_GSUWGMRR0_K1_LBSPPA1024_LBSPPB1024_LPA64_LPB64_MIWT4_4_PLR1_SU0_SUM0_SUS64_VWA4_VWB4_WGM1_WGMXCC1_WGMXCCGn1
    SolutionIndex: 33
    SolutionNameMin: Cijk_Ailk_Bjlk_B8NB8NS_BH_Bias_HAS_SAV_UserArgs_MT128x128x64_MI16x16x1_SN_LDSB1_CLR1_GRVWA16_GRVWB16_GSU0_GSUC0_GSUWGMRR0_K1_LBSPPA1024_LBSPPB1024_LPA64_LPB64_MIWT4_4_PLR1_SU0_SUM0_SUS64_VWA4_VWB4_WGM4_WGMXCC1_WGMXCCGn1
    SolutionIndex: 34
    SolutionNameMin: Cijk_Ailk_Bjlk_B8NB8NS_BH_Bias_HAS_SAV_UserArgs_MT128x128x64_MI16x16x1_SN_LDSB1_CLR1_GRVWA8_GRVWB16_GSU0_GSUC0_GSUWGMRR0_K1_LBSPPA1024_LBSPPB1024_LPA64_LPB64_MIWT4_4_PLR1_SU0_SUM0_SUS64_VWA4_VWB4_WGM6_WGMXCC1_WGMXCCGn1
    SolutionIndex: 35
    SolutionNameMin: Cijk_Ailk_Bjlk_B8NB8NS_BH_Bias_HAS_SAV_UserArgs_MT128x128x64_MI16x16x1_SN_LDSB1_CLR1_GRVWA16_GRVWB16_GSU0_GSUC0_GSUWGMRR0_K1_LBSPPA1024_LBSPPB1024_LPA64_LPB64_MIWT4_4_PLR1_SU0_SUM0_SUS64_VWA4_VWB4_WGM6_WGMXCC1_WGMXCCGn1
    SolutionIndex: 36
    SolutionNameMin: Cijk_Ailk_Bjlk_B8NB8NS_BH_Bias_HAS_SAV_UserArgs_MT128x128x64_MI16x16x1_SN_LDSB1_CLR1_GRVWA16_GRVWB8_GSU0_GSUC0_GSUWGMRR0_K1_LBSPPA1024_LBSPPB1024_LPA64_LPB64_MIWT4_4_PLR1_SU0_SUM0_SUS64_VWA4_VWB4_WGM8_WGMXCC1_WGMXCCGn1
    SolutionIndex: 37
    SolutionNameMin: Cijk_Ailk_Bjlk_B8NB8NS_BH_Bias_HAS_SAV_UserArgs_MT128x128x64_MI16x16x1_SN_LDSB1_CLR1_GRVWA8_GRVWB16_GSU0_GSUC0_GSUWGMRR0_K1_LBSPPA1024_LBSPPB1024_LPA64_LPB64_MIWT4_4_PLR1_SU0_SUM0_SUS64_VWA4_VWB4_WGM8_WGMXCC1_WGMXCCGn1
    SolutionIndex: 38
    SolutionNameMin: Cijk_Ailk_Bjlk_B8NB8NS_BH_Bias_HAS_SAV_UserArgs_MT128x128x64_MI16x16x1_SN_LDSB1_CLR1_GRVWA16_GRVWB16_GSU0_GSUC0_GSUWGMRR0_K1_LBSPPA1024_LBSPPB1024_LPA64_LPB64_MIWT4_4_PLR1_SU0_SUM0_SUS64_VWA4_VWB4_WGM8_WGMXCC1_WGMXCCGn1
    SolutionIndex: 39
    SolutionNameMin: Cijk_Ailk_Bjlk_B8NB8NS_BH_Bias_HAS_SAV_UserArgs_MT64x128x64_MI16x16x1_SN_LDSB0_CLR1_GRVWA4_GRVWB4_GSU0_GSUC0_GSUWGMRR0_K1_LBSPPA512_LBSPPB1024_LPA32_LPB64_MIWT2_4_PLR1_SU0_SUM0_SUS64_VWA2_VWB4_WGM1_WGMXCC1_WGMXCCGn1
    SolutionIndex: 40
    SolutionNameMin: Cijk_Ailk_Bjlk_B8NB8NS_BH_Bias_HAS_SAV_UserArgs_MT64x128x64_MI16x16x1_SN_LDSB0_CLR1_GRVWA4_GRVWB8_GSU0_GSUC0_GSUWGMRR0_K1_LBSPPA512_LBSPPB1024_LPA32_LPB64_MIWT2_4_PLR1_SU0_SUM0_SUS64_VWA2_VWB4_WGM1_WGMXCC1_WGMXCCGn1
    SolutionIndex: 41
    SolutionNameMin: Cijk_Ailk_Bjlk_B8NB8NS_BH_Bias_HAS_SAV_UserArgs_MT64x128x64_MI16x16x1_SN_LDSB0_CLR1_GRVWA16_GRVWB16_GSU0_GSUC0_GSUWGMRR0_K1_LBSPPA512_LBSPPB1024_LPA32_LPB64_MIWT2_4_PLR1_SU0_SUM0_SUS64_VWA2_VWB4_WGM1_WGMXCC1_WGMXCCGn1
    SolutionIndex: 42
    SolutionNameMin: Cijk_Ailk_Bjlk_B8NB8NS_BH_Bias_HAS_SAV_UserArgs_MT128x64x64_MI16x16x1_SN_LDSB0_CLR1_GRVWA4_GRVWB4_GSU0_GSUC0_GSUWGMRR0_K1_LBSPPA1024_LBSPPB512_LPA64_LPB32_MIWT4_2_PLR1_SU0_SUM0_SUS64_VWA4_VWB2_WGM1_WGMXCC1_WGMXCCGn1
    SolutionIndex: 43
    SolutionNameMin: Cijk_Ailk_Bjlk_B8NB8NS_BH_Bias_HAS_SAV_UserArgs_MT128x64x64_MI16x16x1_SN_LDSB0_CLR1_GRVWA4_GRVWB8_GSU0_GSUC0_GSUWGMRR0_K1_LBSPPA1024_LBSPPB512_LPA64_LPB32_MIWT4_2_PLR1_SU0_SUM0_SUS64_VWA4_VWB2_WGM1_WGMXCC1_WGMXCCGn1
    SolutionIndex: 44
    SolutionNameMin: Cijk_Ailk_Bjlk_B8NB8NS_BH_Bias_HAS_SAV_UserArgs_MT128x64x64_MI16x16x1_SN_LDSB0_CLR1_GRVWA16_GRVWB8_GSU0_GSUC0_GSUWGMRR0_K1_LBSPPA1024_LBSPPB512_LPA64_LPB32_MIWT4_2_PLR1_SU0_SUM0_SUS64_VWA4_VWB2_WGM1_WGMXCC1_WGMXCCGn1
    SolutionIndex: 45
    SolutionNameMin: Cijk_Ailk_Bjlk_B8NB8NS_BH_Bias_HAS_SAV_UserArgs_MT128x64x64_MI16x16x1_SN_LDSB0_CLR1_GRVWA4_GRVWB8_GSU0_GSUC0_GSUWGMRR0_K1_LBSPPA1024_LBSPPB512_LPA64_LPB32_MIWT4_2_PLR1_SU0_SUM0_SUS64_VWA4_VWB2_WGM6_WGMXCC1_WGMXCCGn1
    SolutionIndex: 46
    SolutionNameMin: Cijk_Ailk_Bjlk_B8NB8NS_BH_Bias_HAS_SAV_UserArgs_MT128x32x64_MI16x16x1_SN_LDSB0_CLR1_GRVWA4_GRVWB4_GSU0_GSUC0_GSUWGMRR0_K1_LBSPPA1024_LBSPPB256_LPA64_LPB16_MIWT4_1_PLR1_SU0_SUM0_SUS64_VWA4_VWB1_WGM1_WGMXCC1_WGMXCCGn1
    SolutionIndex: 47
    SolutionNameMin: Cijk_Ailk_Bjlk_B8NB8NS_BH_Bias_HAS_SAV_UserArgs_MT64x64x64_MI16x16x1_SN_LDSB0_CLR1_GRVWA4_GRVWB4_GSU0_GSUC0_GSUWGMRR0_K1_LBSPPA512_LBSPPB512_LPA32_LPB32_MIWT2_2_PLR1_SU0_SUM0_SUS64_VWA2_VWB2_WGM1_WGMXCC1_WGMXCCGn1
    SolutionIndex: 48
    SolutionNameMin: Cijk_Ailk_Bjlk_B8NB8NS_BH_Bias_HAS_SAV_UserArgs_MT64x64x64_MI16x16x1_SN_LDSB0_CLR1_GRVWA4_GRVWB8_GSU0_GSUC0_GSUWGMRR0_K1_LBSPPA512_LBSPPB512_LPA32_LPB32_MIWT2_2_PLR1_SU0_SUM0_SUS64_VWA2_VWB2_WGM1_WGMXCC1_WGMXCCGn1
    SolutionIndex: 49
    SolutionNameMin: Cijk_Ailk_Bjlk_B8NB8NS_BH_Bias_HAS_SAV_UserArgs_MT64x64x64_MI16x16x1_SN_LDSB0_CLR1_GRVWA8_GRVWB8_GSU0_GSUC0_GSUWGMRR0_K1_LBSPPA512_LBSPPB512_LPA32_LPB32_MIWT2_2_PLR1_SU0_SUM0_SUS64_VWA2_VWB2_WGM1_WGMXCC1_WGMXCCGn1
    SolutionIndex: 50
    SolutionNameMin: Cijk_Ailk_Bjlk_B8NB8NS_BH_Bias_HAS_SAV_UserArgs_MT64x64x64_MI16x16x1_SN_LDSB0_CLR1_GRVWA8_GRVWB16_GSU0_GSUC0_GSUWGMRR0_K1_LBSPPA512_LBSPPB512_LPA32_LPB32_MIWT2_2_PLR1_SU0_SUM0_SUS64_VWA2_VWB2_WGM1_WGMXCC1_WGMXCCGn1
    SolutionIndex: 51
    SolutionNameMin: Cijk_Ailk_Bjlk_B8NB8NS_BH_Bias_HAS_SAV_UserArgs_MT64x32x64_MI16x16x1_SN_LDSB0_CLR1_GRVWA4_GRVWB4_GSU0_GSUC0_GSUWGMRR0_K1_LBSPPA512_LBSPPB256_LPA32_LPB16_MIWT2_1_PLR1_SU0_SUM0_SUS64_VWA2_VWB1_WGM1_WGMXCC1_WGMXCCGn1
    SolutionIndex: 52
    SolutionNameMin: Cijk_Ailk_Bjlk_B8NB8NS_BH_Bias_HAS_SAV_UserArgs_MT64x32x64_MI16x16x1_SN_LDSB0_CLR1_GRVWA8_GRVWB4_GSU0_GSUC0_GSUWGMRR0_K1_LBSPPA512_LBSPPB256_LPA32_LPB16_MIWT2_1_PLR1_SU0_SUM0_SUS64_VWA2_VWB1_WGM1_WGMXCC1_WGMXCCGn1
    SolutionIndex: 53
    SolutionNameMin: Cijk_Ailk_Bjlk_B8NB8NS_BH_Bias_HAS_SAV_UserArgs_MT32x32x64_MI16x16x1_SN_LDSB0_CLR1_GRVWA4_GRVWB4_GSU0_GSUC0_GSUWGMRR0_K1_LBSPPA256_LBSPPB256_LPA16_LPB16_MIWT1_1_PLR1_SU0_SUM0_SUS64_VWA1_VWB1_WGM1_WGMXCC1_WGMXCCGn1
    SolutionIndex: 54
    SolutionNameMin: Cijk_Ailk_Bjlk_B8NB8NS_BH_Bias_HAS_SAV_UserArgs_MT32x32x64_MI16x16x1_SN_LDSB0_CLR1_GRVWA8_GRVWB4_GSU0_GSUC0_GSUWGMRR0_K1_LBSPPA256_LBSPPB256_LPA16_LPB16_MIWT1_1_PLR1_SU0_SUM0_SUS64_VWA1_VWB1_WGM1_WGMXCC1_WGMXCCGn1
    SolutionIndex: 55
    SolutionNameMin: Cijk_Ailk_Bjlk_B8NB8NS_BH_Bias_HAS_SAV_UserArgs_MT32x32x64_MI16x16x1_SN_LDSB0_CLR1_GRVWA4_GRVWB8_GSU0_GSUC0_GSUWGMRR0_K1_LBSPPA256_LBSPPB256_LPA16_LPB16_MIWT1_1_PLR1_SU0_SUM0_SUS64_VWA1_VWB1_WGM1_WGMXCC1_WGMXCCGn1
    SolutionIndex: 56
    SolutionNameMin: Cijk_Ailk_Bjlk_B8NB8NS_BH_Bias_HAS_SAV_UserArgs_MT32x32x64_MI16x16x1_SN_LDSB0_CLR1_GRVWA8_GRVWB8_GSU0_GSUC0_GSUWGMRR0_K1_LBSPPA256_LBSPPB256_LPA16_LPB16_MIWT1_1_PLR1_SU0_SUM0_SUS64_VWA1_VWB1_WGM1_WGMXCC1_WGMXCCGn1
    SolutionIndex: 57
    SolutionNameMin: Cijk_Ailk_Bjlk_B8NB8NS_BH_Bias_HAS_SAV_UserArgs_MT256x256x128_MI16x16x1_SN_LDSB1_CLR1_GRVWA8_GRVWB16_GSU0_GSUC0_GSUWGMRR0_K1_LBSPPA2048_LBSPPB2048_LPA0_LPB0_MIWT8_8_PLR1_SU0_SUM0_SUS128_VWA8_VWB8_WGM1_WGMXCC1_WGMXCCGn1
    SolutionIndex: 58
    SolutionNameMin: Cijk_Ailk_Bjlk_B8NB8NS_BH_Bias_HAS_SAV_UserArgs_MT256x256x128_MI16x16x1_SN_LDSB1_CLR1_GRVWA16_GRVWB16_GSU0_GSUC0_GSUWGMRR0_K1_LBSPPA2048_LBSPPB2048_LPA0_LPB0_MIWT8_8_PLR1_SU0_SUM0_SUS128_VWA8_VWB8_WGM1_WGMXCC1_WGMXCCGn1
    SolutionIndex: 59
    SolutionNameMin: Cijk_Ailk_Bjlk_B8NB8NS_BH_Bias_HAS_SAV_UserArgs_MT256x256x128_MI16x16x1_SN_LDSB1_CLR1_GRVWA16_GRVWB8_GSU0_GSUC0_GSUWGMRR0_K1_LBSPPA2048_LBSPPB2048_LPA0_LPB0_MIWT8_8_PLR1_SU0_SUM0_SUS128_VWA8_VWB8_WGM6_WGMXCC1_WGMXCCGn1
    SolutionIndex: 60
    SolutionNameMin: Cijk_Ailk_Bjlk_B8NB8NS_BH_Bias_HAS_SAV_UserArgs_MT256x256x128_MI16x16x1_SN_LDSB1_CLR1_GRVWA8_GRVWB16_GSU0_GSUC0_GSUWGMRR0_K1_LBSPPA2048_LBSPPB2048_LPA0_LPB0_MIWT8_8_PLR1_SU0_SUM0_SUS128_VWA8_VWB8_WGM6_WGMXCC1_WGMXCCGn1
    SolutionIndex: 61
    SolutionNameMin: Cijk_Ailk_Bjlk_B8NB8NS_BH_Bias_HAS_SAV_UserArgs_MT256x256x128_MI16x16x1_SN_LDSB1_CLR1_GRVWA16_GRVWB16_GSU0_GSUC0_GSUWGMRR0_K1_LBSPPA2048_LBSPPB2048_LPA0_LPB0_MIWT8_8_PLR1_SU0_SUM0_SUS128_VWA8_VWB8_WGM6_WGMXCC1_WGMXCCGn1
    SolutionIndex: 62
    SolutionNameMin: Cijk_Ailk_Bjlk_B8NB8NS_BH_Bias_HAS_SAV_UserArgs_MT256x256x128_MI16x16x1_SN_LDSB1_CLR1_GRVWA8_GRVWB16_GSU0_GSUC0_GSUWGMRR0_K1_LBSPPA2048_LBSPPB2048_LPA0_LPB0_MIWT8_8_PLR1_SU0_SUM0_SUS128_VWA8_VWB8_WGM8_WGMXCC1_WGMXCCGn1
    SolutionIndex: 63
    SolutionNameMin: Cijk_Ailk_Bjlk_B8NB8NS_BH_Bias_HAS_SAV_UserArgs_MT256x256x128_MI16x16x1_SN_LDSB1_CLR1_GRVWA16_GRVWB16_GSU0_GSUC0_GSUWGMRR0_K1_LBSPPA2048_LBSPPB2048_LPA0_LPB0_MIWT8_8_PLR1_SU0_SUM0_SUS128_VWA8_VWB8_WGM8_WGMXCC1_WGMXCCGn1
    SolutionIndex: 64
    SolutionNameMin: Cijk_Ailk_Bjlk_B8NB8NS_BH_Bias_HAS_SAV_UserArgs_MT128x256x128_MI16x16x1_SN_LDSB1_CLR1_GRVWA8_GRVWB16_GSU0_GSUC0_GSUWGMRR0_K1_LBSPPA1024_LBSPPB2048_LPA64_LPB0_MIWT4_8_PLR1_SU0_SUM0_SUS128_VWA4_VWB8_WGM1_WGMXCC1_WGMXCCGn1
    SolutionIndex: 65
    SolutionNameMin: Cijk_Ailk_Bjlk_B8NB8NS_BH_Bias_HAS_SAV_UserArgs_MT128x256x128_MI16x16x1_SN_LDSB1_CLR1_GRVWA8_GRVWB16_GSU0_GSUC0_GSUWGMRR0_K1_LBSPPA1024_LBSPPB2048_LPA64_LPB0_MIWT4_8_PLR1_SU0_SUM0_SUS128_VWA4_VWB8_WGM4_WGMXCC1_WGMXCCGn1
    SolutionIndex: 66
    SolutionNameMin: Cijk_Ailk_Bjlk_B8NB8NS_BH_Bias_HAS_SAV_UserArgs_MT128x256x128_MI16x16x1_SN_LDSB1_CLR1_GRVWA16_GRVWB16_GSU0_GSUC0_GSUWGMRR0_K1_LBSPPA1024_LBSPPB2048_LPA64_LPB0_MIWT4_8_PLR1_SU0_SUM0_SUS128_VWA4_VWB8_WGM4_WGMXCC1_WGMXCCGn1
    SolutionIndex: 67
    SolutionNameMin: Cijk_Ailk_Bjlk_B8NB8NS_BH_Bias_HAS_SAV_UserArgs_MT128x256x128_MI16x16x1_SN_LDSB1_CLR1_GRVWA4_GRVWB16_GSU0_GSUC0_GSUWGMRR0_K1_LBSPPA1024_LBSPPB2048_LPA64_LPB0_MIWT4_8_PLR1_SU0_SUM0_SUS128_VWA4_VWB8_WGM6_WGMXCC1_WGMXCCGn1
    SolutionIndex: 68
    SolutionNameMin: Cijk_Ailk_Bjlk_B8NB8NS_BH_Bias_HAS_SAV_UserArgs_MT128x256x128_MI16x16x1_SN_LDSB1_CLR1_GRVWA16_GRVWB16_GSU0_GSUC0_GSUWGMRR0_K1_LBSPPA1024_LBSPPB2048_LPA64_LPB0_MIWT4_8_PLR1_SU0_SUM0_SUS128_VWA4_VWB8_WGM6_WGMXCC1_WGMXCCGn1
    SolutionIndex: 69
    SolutionNameMin: Cijk_Ailk_Bjlk_B8NB8NS_BH_Bias_HAS_SAV_UserArgs_MT128x256x128_MI16x16x1_SN_LDSB1_CLR1_GRVWA16_GRVWB16_GSU0_GSUC0_GSUWGMRR0_K1_LBSPPA1024_LBSPPB2048_LPA64_LPB0_MIWT4_8_PLR1_SU0_SUM0_SUS128_VWA4_VWB8_WGM8_WGMXCC1_WGMXCCGn1
    SolutionIndex: 70
    SolutionNameMin: Cijk_Ailk_Bjlk_B8NB8NS_BH_Bias_HAS_SAV_UserArgs_MT256x128x128_MI16x16x1_SN_LDSB1_CLR1_GRVWA16_GRVWB8_GSU0_GSUC0_GSUWGMRR0_K1_LBSPPA2048_LBSPPB1024_LPA0_LPB64_MIWT8_4_PLR1_SU0_SUM0_SUS128_VWA8_VWB4_WGM1_WGMXCC1_WGMXCCGn1
    SolutionIndex: 71
    SolutionNameMin: Cijk_Ailk_Bjlk_B8NB8NS_BH_Bias_HAS_SAV_UserArgs_MT256x128x128_MI16x16x1_SN_LDSB1_CLR1_GRVWA16_GRVWB16_GSU0_GSUC0_GSUWGMRR0_K1_LBSPPA2048_LBSPPB1024_LPA0_LPB64_MIWT8_4_PLR1_SU0_SUM0_SUS128_VWA8_VWB4_WGM1_WGMXCC1_WGMXCCGn1
    SolutionIndex: 72
    SolutionNameMin: Cijk_Ailk_Bjlk_B8NB8NS_BH_Bias_HAS_SAV_UserArgs_MT128x128x128_MI16x16x1_SN_LDSB1_CLR1_GRVWA16_GRVWB16_GSU0_GSUC0_GSUWGMRR0_K1_LBSPPA1024_LBSPPB1024_LPA64_LPB64_MIWT4_4_PLR1_SU0_SUM0_SUS128_VWA4_VWB4_WGM1_WGMXCC1_WGMXCCGn1
    SolutionIndex: 73
    SolutionNameMin: Cijk_Ailk_Bjlk_B8NB8NS_BH_Bias_HAS_SAV_UserArgs_MT128x128x128_MI16x16x1_SN_LDSB1_CLR1_GRVWA16_GRVWB16_GSU0_GSUC0_GSUWGMRR0_K1_LBSPPA1024_LBSPPB1024_LPA64_LPB64_MIWT4_4_PLR1_SU0_SUM0_SUS128_VWA4_VWB4_WGM6_WGMXCC1_WGMXCCGn1
    SolutionIndex: 74
    SolutionNameMin: Cijk_Ailk_Bjlk_B8NB8NS_BH_Bias_HAS_SAV_UserArgs_MT128x64x128_MI16x16x1_SN_LDSB1_CLR1_GRVWA4_GRVWB16_GSU0_GSUC0_GSUWGMRR0_K1_LBSPPA1024_LBSPPB512_LPA64_LPB32_MIWT4_2_PLR1_SU0_SUM0_SUS128_VWA4_VWB2_WGM1_WGMXCC1_WGMXCCGn1
    SolutionIndex: 75
    SolutionNameMin: Cijk_Ailk_Bjlk_B8NB8NS_BH_Bias_HAS_SAV_UserArgs_MT128x64x128_MI16x16x1_SN_LDSB1_CLR1_GRVWA16_GRVWB16_GSU0_GSUC0_GSUWGMRR0_K1_LBSPPA1024_LBSPPB512_LPA64_LPB32_MIWT4_2_PLR1_SU0_SUM0_SUS128_VWA4_VWB2_WGM1_WGMXCC1_WGMXCCGn1
    SolutionIndex: 76
    SolutionNameMin: Cijk_Ailk_Bjlk_B8NB8NS_BH_Bias_HAS_SAV_UserArgs_MT128x64x128_MI16x16x1_SN_LDSB1_CLR1_GRVWA16_GRVWB16_GSU0_GSUC0_GSUWGMRR0_K1_LBSPPA1024_LBSPPB512_LPA64_LPB32_MIWT4_2_PLR1_SU0_SUM0_SUS128_VWA4_VWB2_WGM4_WGMXCC1_WGMXCCGn1
    SolutionIndex: 77
    SolutionNameMin: Cijk_Ailk_Bjlk_B8NB8NS_BH_Bias_HAS_SAV_UserArgs_MT128x64x128_MI16x16x1_SN_LDSB1_CLR1_GRVWA16_GRVWB16_GSU0_GSUC0_GSUWGMRR0_K1_LBSPPA1024_LBSPPB512_LPA64_LPB32_MIWT4_2_PLR1_SU0_SUM0_SUS128_VWA4_VWB2_WGM6_WGMXCC1_WGMXCCGn1
    SolutionIndex: 78
    SolutionNameMin: Cijk_Ailk_Bjlk_B8NB8NS_BH_Bias_HAS_SAV_UserArgs_MT128x64x128_MI16x16x1_SN_LDSB1_CLR1_GRVWA16_GRVWB16_GSU0_GSUC0_GSUWGMRR0_K1_LBSPPA1024_LBSPPB512_LPA64_LPB32_MIWT4_2_PLR1_SU0_SUM0_SUS128_VWA4_VWB2_WGM8_WGMXCC1_WGMXCCGn1
    SolutionIndex: 79
    SolutionNameMin: Cijk_Ailk_Bjlk_B8NB8NS_BH_Bias_HAS_SAV_UserArgs_MT64x64x128_MI16x16x1_SN_LDSB1_CLR1_GRVWA4_GRVWB4_GSU0_GSUC0_GSUWGMRR0_K1_LBSPPA512_LBSPPB512_LPA32_LPB32_MIWT2_2_PLR1_SU0_SUM0_SUS128_VWA2_VWB2_WGM1_WGMXCC1_WGMXCCGn1
    SolutionIndex: 80
    SolutionNameMin: Cijk_Ailk_Bjlk_B8NB8NS_BH_Bias_HAS_SAV_UserArgs_MT64x64x128_MI16x16x1_SN_LDSB1_CLR1_GRVWA4_GRVWB8_GSU0_GSUC0_GSUWGMRR0_K1_LBSPPA512_LBSPPB512_LPA32_LPB32_MIWT2_2_PLR1_SU0_SUM0_SUS128_VWA2_VWB2_WGM1_WGMXCC1_WGMXCCGn1
    SolutionIndex: 81
    SolutionNameMin: Cijk_Ailk_Bjlk_B8NB8NS_BH_Bias_HAS_SAV_UserArgs_MT64x64x128_MI16x16x1_SN_LDSB1_CLR1_GRVWA8_GRVWB16_GSU0_GSUC0_GSUWGMRR0_K1_LBSPPA512_LBSPPB512_LPA32_LPB32_MIWT2_2_PLR1_SU0_SUM0_SUS128_VWA2_VWB2_WGM1_WGMXCC1_WGMXCCGn1
    SolutionIndex: 82
    SolutionNameMin: Cijk_Ailk_Bjlk_B8NB8NS_BH_Bias_HAS_SAV_UserArgs_MT64x64x128_MI16x16x1_SN_LDSB1_CLR1_GRVWA16_GRVWB16_GSU0_GSUC0_GSUWGMRR0_K1_LBSPPA512_LBSPPB512_LPA32_LPB32_MIWT2_2_PLR1_SU0_SUM0_SUS128_VWA2_VWB2_WGM1_WGMXCC1_WGMXCCGn1
    SolutionIndex: 83
    SolutionNameMin: Cijk_Ailk_Bjlk_B8NB8NS_BH_Bias_HAS_SAV_UserArgs_MT64x64x128_MI16x16x1_SN_LDSB1_CLR1_GRVWA4_GRVWB16_GSU0_GSUC0_GSUWGMRR0_K1_LBSPPA512_LBSPPB512_LPA32_LPB32_MIWT2_2_PLR1_SU0_SUM0_SUS128_VWA2_VWB2_WGM4_WGMXCC1_WGMXCCGn1
    SolutionIndex: 84
    SolutionNameMin: Cijk_Ailk_Bjlk_B8NB8NS_BH_Bias_HAS_SAV_UserArgs_MT64x64x128_MI16x16x1_SN_LDSB1_CLR1_GRVWA8_GRVWB16_GSU0_GSUC0_GSUWGMRR0_K1_LBSPPA512_LBSPPB512_LPA32_LPB32_MIWT2_2_PLR1_SU0_SUM0_SUS128_VWA2_VWB2_WGM4_WGMXCC1_WGMXCCGn1
    SolutionIndex: 85
    SolutionNameMin: Cijk_Ailk_Bjlk_B8NB8NS_BH_Bias_HAS_SAV_UserArgs_MT64x64x128_MI16x16x1_SN_LDSB1_CLR1_GRVWA4_GRVWB16_GSU0_GSUC0_GSUWGMRR0_K1_LBSPPA512_LBSPPB512_LPA32_LPB32_MIWT2_2_PLR1_SU0_SUM0_SUS128_VWA2_VWB2_WGM6_WGMXCC1_WGMXCCGn1
    SolutionIndex: 86
    SolutionNameMin: Cijk_Ailk_Bjlk_B8NB8NS_BH_Bias_HAS_SAV_UserArgs_MT64x64x128_MI16x16x1_SN_LDSB1_CLR1_GRVWA8_GRVWB16_GSU0_GSUC0_GSUWGMRR0_K1_LBSPPA512_LBSPPB512_LPA32_LPB32_MIWT2_2_PLR1_SU0_SUM0_SUS128_VWA2_VWB2_WGM6_WGMXCC1_WGMXCCGn1
    SolutionIndex: 87
    SolutionNameMin: Cijk_Ailk_Bjlk_B8NB8NS_BH_Bias_HAS_SAV_UserArgs_MT64x64x128_MI16x16x1_SN_LDSB1_CLR1_GRVWA16_GRVWB16_GSU0_GSUC0_GSUWGMRR0_K1_LBSPPA512_LBSPPB512_LPA32_LPB32_MIWT2_2_PLR1_SU0_SUM0_SUS128_VWA2_VWB2_WGM6_WGMXCC1_WGMXCCGn1
    SolutionIndex: 88
    SolutionNameMin: Cijk_Ailk_Bjlk_B8NB8NS_BH_Bias_HAS_SAV_UserArgs_MT64x64x128_MI16x16x1_SN_LDSB1_CLR1_GRVWA16_GRVWB16_GSU0_GSUC0_GSUWGMRR0_K1_LBSPPA512_LBSPPB512_LPA32_LPB32_MIWT2_2_PLR1_SU0_SUM0_SUS128_VWA2_VWB2_WGM8_WGMXCC1_WGMXCCGn1
    SolutionIndex: 89
    SolutionNameMin: Cijk_Ailk_Bjlk_B8NB8NS_BH_Bias_HAS_SAV_UserArgs_MT32x64x128_MI16x16x1_SN_LDSB0_CLR1_GRVWA4_GRVWB4_GSU0_GSUC0_GSUWGMRR0_K1_LBSPPA256_LBSPPB512_LPA16_LPB32_MIWT1_2_PLR1_SU0_SUM0_SUS128_VWA1_VWB2_WGM1_WGMXCC1_WGMXCCGn1
    SolutionIndex: 90
    SolutionNameMin: Cijk_Ailk_Bjlk_B8NB8NS_BH_Bias_HAS_SAV_UserArgs_MT32x64x128_MI16x16x1_SN_LDSB0_CLR1_GRVWA8_GRVWB16_GSU0_GSUC0_GSUWGMRR0_K1_LBSPPA256_LBSPPB512_LPA16_LPB32_MIWT1_2_PLR1_SU0_SUM0_SUS128_VWA1_VWB2_WGM1_WGMXCC1_WGMXCCGn1
    SolutionIndex: 91
    SolutionNameMin: Cijk_Ailk_Bjlk_B8NB8NS_BH_Bias_HAS_SAV_UserArgs_MT32x64x128_MI16x16x1_SN_LDSB0_CLR1_GRVWA16_GRVWB16_GSU0_GSUC0_GSUWGMRR0_K1_LBSPPA256_LBSPPB512_LPA16_LPB32_MIWT1_2_PLR1_SU0_SUM0_SUS128_VWA1_VWB2_WGM1_WGMXCC1_WGMXCCGn1
    SolutionIndex: 92
    SolutionNameMin: Cijk_Ailk_Bjlk_B8NB8NS_BH_Bias_HAS_SAV_UserArgs_MT32x64x128_MI16x16x1_SN_LDSB0_CLR1_GRVWA16_GRVWB16_GSU0_GSUC0_GSUWGMRR0_K1_LBSPPA256_LBSPPB512_LPA16_LPB32_MIWT1_2_PLR1_SU0_SUM0_SUS128_VWA1_VWB2_WGM4_WGMXCC1_WGMXCCGn1
    SolutionIndex: 93
    SolutionNameMin: Cijk_Ailk_Bjlk_B8NB8NS_BH_Bias_HAS_SAV_UserArgs_MT32x64x128_MI16x16x1_SN_LDSB0_CLR1_GRVWA16_GRVWB16_GSU0_GSUC0_GSUWGMRR0_K1_LBSPPA256_LBSPPB512_LPA16_LPB32_MIWT1_2_PLR1_SU0_SUM0_SUS128_VWA1_VWB2_WGM6_WGMXCC1_WGMXCCGn1
    SolutionIndex: 94
    SolutionNameMin: Cijk_Ailk_Bjlk_B8NB8NS_BH_Bias_HAS_SAV_UserArgs_MT32x64x128_MI16x16x1_SN_LDSB0_CLR1_GRVWA16_GRVWB16_GSU0_GSUC0_GSUWGMRR0_K1_LBSPPA256_LBSPPB512_LPA16_LPB32_MIWT1_2_PLR1_SU0_SUM0_SUS128_VWA1_VWB2_WGM8_WGMXCC1_WGMXCCGn1
    SolutionIndex: 95
    SolutionNameMin: Cijk_Ailk_Bjlk_B8NB8NS_BH_Bias_HAS_SAV_UserArgs_MT64x32x128_MI16x16x1_SN_LDSB0_CLR1_GRVWA4_GRVWB4_GSU0_GSUC0_GSUWGMRR0_K1_LBSPPA512_LBSPPB256_LPA32_LPB16_MIWT2_1_PLR1_SU0_SUM0_SUS128_VWA2_VWB1_WGM1_WGMXCC1_WGMXCCGn1
    SolutionIndex: 96
    SolutionNameMin: Cijk_Ailk_Bjlk_B8NB8NS_BH_Bias_HAS_SAV_UserArgs_MT64x32x128_MI16x16x1_SN_LDSB0_CLR1_GRVWA4_GRVWB8_GSU0_GSUC0_GSUWGMRR0_K1_LBSPPA512_LBSPPB256_LPA32_LPB16_MIWT2_1_PLR1_SU0_SUM0_SUS128_VWA2_VWB1_WGM1_WGMXCC1_WGMXCCGn1
    SolutionIndex: 97
    SolutionNameMin: Cijk_Ailk_Bjlk_B8NB8NS_BH_Bias_HAS_SAV_UserArgs_MT64x32x128_MI16x16x1_SN_LDSB0_CLR1_GRVWA8_GRVWB8_GSU0_GSUC0_GSUWGMRR0_K1_LBSPPA512_LBSPPB256_LPA32_LPB16_MIWT2_1_PLR1_SU0_SUM0_SUS128_VWA2_VWB1_WGM1_WGMXCC1_WGMXCCGn1
    SolutionIndex: 98
    SolutionNameMin: Cijk_Ailk_Bjlk_B8NB8NS_BH_Bias_HAS_SAV_UserArgs_MT64x32x128_MI16x16x1_SN_LDSB0_CLR1_GRVWA8_GRVWB16_GSU0_GSUC0_GSUWGMRR0_K1_LBSPPA512_LBSPPB256_LPA32_LPB16_MIWT2_1_PLR1_SU0_SUM0_SUS128_VWA2_VWB1_WGM1_WGMXCC1_WGMXCCGn1
    SolutionIndex: 99
    SolutionNameMin: Cijk_Ailk_Bjlk_B8NB8NS_BH_Bias_HAS_SAV_UserArgs_MT64x32x128_MI16x16x1_SN_LDSB0_CLR1_GRVWA16_GRVWB16_GSU0_GSUC0_GSUWGMRR0_K1_LBSPPA512_LBSPPB256_LPA32_LPB16_MIWT2_1_PLR1_SU0_SUM0_SUS128_VWA2_VWB1_WGM1_WGMXCC1_WGMXCCGn1
    SolutionIndex: 100
    SolutionNameMin: Cijk_Ailk_Bjlk_B8NB8NS_BH_Bias_HAS_SAV_UserArgs_MT64x32x128_MI16x16x1_SN_LDSB0_CLR1_GRVWA4_GRVWB8_GSU0_GSUC0_GSUWGMRR0_K1_LBSPPA512_LBSPPB256_LPA32_LPB16_MIWT2_1_PLR1_SU0_SUM0_SUS128_VWA2_VWB1_WGM4_WGMXCC1_WGMXCCGn1
    SolutionIndex: 101
    SolutionNameMin: Cijk_Ailk_Bjlk_B8NB8NS_BH_Bias_HAS_SAV_UserArgs_MT32x32x128_MI16x16x1_SN_LDSB0_CLR1_GRVWA4_GRVWB4_GSU0_GSUC0_GSUWGMRR0_K1_LBSPPA256_LBSPPB256_LPA16_LPB16_MIWT1_1_PLR1_SU0_SUM0_SUS128_VWA1_VWB1_WGM1_WGMXCC1_WGMXCCGn1
    SolutionIndex: 102
    SolutionNameMin: Cijk_Ailk_Bjlk_B8NB8NS_BH_Bias_HAS_SAV_UserArgs_MT32x32x128_MI16x16x1_SN_LDSB0_CLR1_GRVWA8_GRVWB4_GSU0_GSUC0_GSUWGMRR0_K1_LBSPPA256_LBSPPB256_LPA16_LPB16_MIWT1_1_PLR1_SU0_SUM0_SUS128_VWA1_VWB1_WGM1_WGMXCC1_WGMXCCGn1
    SolutionIndex: 103
    SolutionNameMin: Cijk_Ailk_Bjlk_B8NB8NS_BH_Bias_HAS_SAV_UserArgs_MT32x32x128_MI16x16x1_SN_LDSB0_CLR1_GRVWA4_GRVWB8_GSU0_GSUC0_GSUWGMRR0_K1_LBSPPA256_LBSPPB256_LPA16_LPB16_MIWT1_1_PLR1_SU0_SUM0_SUS128_VWA1_VWB1_WGM1_WGMXCC1_WGMXCCGn1
    SolutionIndex: 104
    SolutionNameMin: Cijk_Ailk_Bjlk_B8NB8NS_BH_Bias_HAS_SAV_UserArgs_MT32x32x128_MI16x16x1_SN_LDSB0_CLR1_GRVWA8_GRVWB8_GSU0_GSUC0_GSUWGMRR0_K1_LBSPPA256_LBSPPB256_LPA16_LPB16_MIWT1_1_PLR1_SU0_SUM0_SUS128_VWA1_VWB1_WGM1_WGMXCC1_WGMXCCGn1
    SolutionIndex: 105
    SolutionNameMin: Cijk_Ailk_Bjlk_B8NB8NS_BH_Bias_HAS_SAV_UserArgs_MT32x32x128_MI16x16x1_SN_LDSB0_CLR1_GRVWA4_GRVWB16_GSU0_GSUC0_GSUWGMRR0_K1_LBSPPA256_LBSPPB256_LPA16_LPB16_MIWT1_1_PLR1_SU0_SUM0_SUS128_VWA1_VWB1_WGM1_WGMXCC1_WGMXCCGn1
    SolutionIndex: 106
    SolutionNameMin: Cijk_Ailk_Bjlk_B8NB8NS_BH_Bias_HAS_SAV_UserArgs_MT32x32x128_MI16x16x1_SN_LDSB0_CLR1_GRVWA8_GRVWB16_GSU0_GSUC0_GSUWGMRR0_K1_LBSPPA256_LBSPPB256_LPA16_LPB16_MIWT1_1_PLR1_SU0_SUM0_SUS128_VWA1_VWB1_WGM1_WGMXCC1_WGMXCCGn1
    SolutionIndex: 107
    SolutionNameMin: Cijk_Ailk_Bjlk_B8NB8NS_BH_Bias_HAS_SAV_UserArgs_MT128x64x256_MI16x16x1_SN_LDSB1_CLR1_GRVWA16_GRVWB16_GSU0_GSUC0_GSUWGMRR0_K1_LBSPPA1024_LBSPPB512_LPA64_LPB32_MIWT4_2_PLR1_SU0_SUM0_SUS256_VWA4_VWB2_WGM1_WGMXCC1_WGMXCCGn1
    SolutionIndex: 108
    SolutionNameMin: Cijk_Ailk_Bjlk_B8NB8NS_BH_Bias_HAS_SAV_UserArgs_MT64x64x256_MI16x16x1_SN_LDSB1_CLR1_GRVWA16_GRVWB16_GSU0_GSUC0_GSUWGMRR0_K1_LBSPPA512_LBSPPB512_LPA32_LPB32_MIWT2_2_PLR1_SU0_SUM0_SUS256_VWA2_VWB2_WGM1_WGMXCC1_WGMXCCGn1
    SolutionIndex: 109
    SolutionNameMin: Cijk_Ailk_Bjlk_B8NB8NS_BH_Bias_HAS_SAV_UserArgs_MT64x64x256_MI16x16x1_SN_LDSB1_CLR1_GRVWA4_GRVWB16_GSU0_GSUC0_GSUWGMRR0_K1_LBSPPA512_LBSPPB512_LPA32_LPB32_MIWT2_2_PLR1_SU0_SUM0_SUS256_VWA2_VWB2_WGM4_WGMXCC1_WGMXCCGn1
    SolutionIndex: 110
    SolutionNameMin: Cijk_Ailk_Bjlk_B8NB8NS_BH_Bias_HAS_SAV_UserArgs_MT64x32x256_MI16x16x1_SN_LDSB1_CLR1_GRVWA16_GRVWB16_GSU0_GSUC0_GSUWGMRR0_K1_LBSPPA512_LBSPPB256_LPA32_LPB16_MIWT2_1_PLR1_SU0_SUM0_SUS256_VWA2_VWB1_WGM1_WGMXCC1_WGMXCCGn1
    SolutionIndex: 111
    SolutionNameMin: Cijk_Ailk_Bjlk_B8NB8NS_BH_Bias_HAS_SAV_UserArgs_MT64x32x256_MI16x16x1_SN_LDSB1_CLR1_GRVWA16_GRVWB16_GSU0_GSUC0_GSUWGMRR0_K1_LBSPPA512_LBSPPB256_LPA32_LPB16_MIWT2_1_PLR1_SU0_SUM0_SUS256_VWA2_VWB1_WGM6_WGMXCC1_WGMXCCGn1
    SolutionIndex: 112
    SolutionNameMin: Cijk_Ailk_Bjlk_B8NB8NS_BH_Bias_HAS_SAV_UserArgs_MT32x32x256_MI16x16x1_SN_LDSB1_CLR1_GRVWA8_GRVWB16_GSU0_GSUC0_GSUWGMRR0_K1_LBSPPA256_LBSPPB256_LPA16_LPB16_MIWT1_1_PLR1_SU0_SUM0_SUS256_VWA1_VWB1_WGM1_WGMXCC1_WGMXCCGn1
    SolutionIndex: 113
    SolutionNameMin: Cijk_Ailk_Bjlk_B8NB8NS_BH_Bias_HAS_SAV_UserArgs_MT32x32x256_MI16x16x1_SN_LDSB1_CLR1_GRVWA16_GRVWB16_GSU0_GSUC0_GSUWGMRR0_K1_LBSPPA256_LBSPPB256_LPA16_LPB16_MIWT1_1_PLR1_SU0_SUM0_SUS256_VWA1_VWB1_WGM1_WGMXCC1_WGMXCCGn1
    SolutionIndex: 114
    SolutionNameMin: Cijk_Ailk_Bjlk_B8NB8NS_BH_Bias_HAS_SAV_UserArgs_MT32x32x256_MI16x16x1_SN_LDSB1_CLR1_GRVWA16_GRVWB16_GSU0_GSUC0_GSUWGMRR0_K1_LBSPPA256_LBSPPB256_LPA16_LPB16_MIWT1_1_PLR1_SU0_SUM0_SUS256_VWA1_VWB1_WGM4_WGMXCC1_WGMXCCGn1
    SolutionIndex: 115
    SolutionNameMin: Cijk_Ailk_Bjlk_B8NB8NS_BH_Bias_HAS_SAV_UserArgs_MT32x32x256_MI16x16x1_SN_LDSB1_CLR1_GRVWA8_GRVWB16_GSU0_GSUC0_GSUWGMRR0_K1_LBSPPA256_LBSPPB256_LPA16_LPB16_MIWT1_1_PLR1_SU0_SUM0_SUS256_VWA1_VWB1_WGM6_WGMXCC1_WGMXCCGn1
    SolutionIndex: 116
    SolutionNameMin: Cijk_Ailk_Bjlk_B8NB8NS_BH_Bias_HAS_SAV_UserArgs_MT32x32x256_MI16x16x1_SN_LDSB1_CLR1_GRVWA16_GRVWB16_GSU0_GSUC0_GSUWGMRR0_K1_LBSPPA256_LBSPPB256_LPA16_LPB16_MIWT1_1_PLR1_SU0_SUM0_SUS256_VWA1_VWB1_WGM8_WGMXCC1_WGMXCCGn1
- - - [128, 128, 1, 128, 128, 128, 128, 128]
    - [53, 0.51]
  - - [128, 128, 1, 256, 128, 128, 128, 128]
    - [53, 0.89]
  - - [128, 128, 1, 512, 128, 128, 128, 128]
    - [103, 1.45]
  - - [128, 128, 1, 1024, 128, 128, 128, 128]
    - [104, 2.2]
  - - [128, 128, 1, 2048, 128, 128, 128, 128]
    - [106, 2.93]
  - - [128, 128, 1, 4096, 128, 128, 128, 128]
    - [106, 3.53]
  - - [128, 128, 1, 8192, 128, 128, 128, 128]
    - [113, 3.93]
  - - [128, 256, 1, 128, 128, 128, 128, 256]
    - [53, 1.04]
  - - [128, 256, 1, 256, 128, 128, 128, 256]
    - [55, 1.82]
  - - [128, 256, 1, 512, 128, 128, 128, 256]
    - [101, 2.94]
  - - [128, 256, 1, 1024, 128, 128, 128, 256]
    - [106, 4.44]
  - - [128, 256, 1, 2048, 128, 128, 128, 256]
    - [106, 5.89]
  - - [128, 256, 1, 4096, 128, 128, 128, 256]
    - [113, 7.01]
  - - [128, 256, 1, 8192, 128, 128, 128, 256]
    - [113, 7.87]
  - - [128, 512, 1, 128, 128, 128, 128, 512]
    - [53, 1.97]
  - - [128, 512, 1, 256, 128, 128, 128, 512]
    - [53, 3.47]
  - - [128, 512, 1, 512, 128, 128, 128, 512]
    - [105, 5.75]
  - - [128, 512, 1, 1024, 128, 128, 128, 512]
    - [104, 8.67]
  - - [128, 512, 1, 2048, 128, 128, 128, 512]
    - [106, 11.49]
  - - [128, 512, 1, 4096, 128, 128, 128, 512]
    - [106, 13.92]
  - - [128, 512, 1, 8192, 128, 128, 128, 512]
    - [112, 14.62]
  - - [128, 1024, 1, 128, 128, 128, 128, 1024]
    - [53, 3.98]
  - - [128, 1024, 1, 256, 128, 128, 128, 1024]
    - [54, 6.96]
  - - [128, 1024, 1, 512, 128, 128, 128, 1024]
    - [54, 11.33]
  - - [128, 1024, 1, 1024, 128, 128, 128, 1024]
    - [104, 16.91]
  - - [128, 1024, 1, 2048, 128, 128, 128, 1024]
    - [106, 22.69]
  - - [128, 1024, 1, 4096, 128, 128, 128, 1024]
    - [112, 25.89]
  - - [128, 1024, 1, 8192, 128, 128, 128, 1024]
    - [115, 27.8]
  - - [128, 2048, 1, 128, 128, 128, 128, 2048]
    - [51, 7.63]
  - - [128, 2048, 1, 256, 128, 128, 128, 2048]
    - [51, 13.33]
  - - [128, 2048, 1, 512, 128, 128, 128, 2048]
    - [95, 20.96]
  - - [128, 2048, 1, 1024, 128, 128, 128, 2048]
    - [98, 30.66]
  - - [128, 2048, 1, 2048, 128, 128, 128, 2048]
    - [110, 39.33]
  - - [128, 2048, 1, 4096, 128, 128, 128, 2048]
    - [111, 47.32]
  - - [128, 2048, 1, 8192, 128, 128, 128, 2048]
    - [111, 53.57]
  - - [128, 4096, 1, 128, 128, 128, 128, 4096]
    - [79, 13.56]
  - - [128, 4096, 1, 256, 128, 128, 128, 4096]
    - [47, 23.57]
  - - [128, 4096, 1, 512, 128, 128, 128, 4096]
    - [79, 37.42]
  - - [128, 4096, 1, 1024, 128, 128, 128, 4096]
    - [82, 53.6]
  - - [128, 4096, 1, 2048, 128, 128, 128, 4096]
    - [108, 67.21]
  - - [128, 4096, 1, 4096, 128, 128, 128, 4096]
    - [108, 82.08]
  - - [128, 4096, 1, 8192, 128, 128, 128, 4096]
    - [108, 91.96]
  - - [128, 8192, 1, 128, 128, 128, 128, 8192]
    - [43, 24.19]
  - - [128, 8192, 1, 256, 128, 128, 128, 8192]
    - [43, 41.73]
  - - [128, 8192, 1, 512, 128, 128, 128, 8192]
    - [43, 63.53]
  - - [128, 8192, 1, 1024, 128, 128, 128, 8192]
    - [75, 88.06]
  - - [128, 8192, 1, 2048, 128, 128, 128, 8192]
    - [75, 108.08]
  - - [128, 8192, 1, 4096, 128, 128, 128, 8192]
    - [107, 125.95]
  - - [128, 8192, 1, 8192, 128, 128, 128, 8192]
    - [107, 128.93]
  - - [256, 128, 1, 128, 256, 256, 256, 128]
    - [53, 1.02]
  - - [256, 128, 1, 256, 256, 256, 256, 128]
    - [101, 1.79]
  - - [256, 128, 1, 512, 256, 256, 256, 128]
    - [103, 2.97]
  - - [256, 128, 1, 1024, 256, 256, 256, 128]
    - [106, 4.4]
  - - [256, 128, 1, 2048, 256, 256, 256, 128]
    - [106, 5.92]
  - - [256, 128, 1, 4096, 256, 256, 256, 128]
    - [106, 7.05]
  - - [256, 128, 1, 8192, 256, 256, 256, 128]
    - [113, 7.87]
  - - [256, 256, 1, 128, 256, 256, 256, 256]
    - [54, 2.03]
  - - [256, 256, 1, 256, 256, 256, 256, 256]
    - [102, 3.6]
  - - [256, 256, 1, 512, 256, 256, 256, 256]
    - [104, 5.88]
  - - [256, 256, 1, 1024, 256, 256, 256, 256]
    - [104, 8.79]
  - - [256, 256, 1, 2048, 256, 256, 256, 256]
    - [106, 11.69]
  - - [256, 256, 1, 4096, 256, 256, 256, 256]
    - [106, 14.04]
  - - [256, 256, 1, 8192, 256, 256, 256, 256]
    - [113, 15.5]
  - - [256, 512, 1, 128, 256, 256, 256, 512]
    - [53, 3.95]
  - - [256, 512, 1, 256, 256, 256, 256, 512]
    - [54, 7.01]
  - - [256, 512, 1, 512, 256, 256, 256, 512]
    - [103, 11.31]
  - - [256, 512, 1, 1024, 256, 256, 256, 512]
    - [104, 16.97]
  - - [256, 512, 1, 2048, 256, 256, 256, 512]
    - [104, 22.63]
  - - [256, 512, 1, 4096, 256, 256, 256, 512]
    - [106, 27.31]
  - - [256, 512, 1, 8192, 256, 256, 256, 512]
    - [113, 30.35]
  - - [256, 1024, 1, 128, 256, 256, 256, 1024]
    - [51, 7.45]
  - - [256, 1024, 1, 256, 256, 256, 256, 1024]
    - [51, 12.88]
  - - [256, 1024, 1, 512, 256, 256, 256, 1024]
    - [89, 20.78]
  - - [256, 1024, 1, 1024, 256, 256, 256, 1024]
    - [90, 30.49]
  - - [256, 1024, 1, 2048, 256, 256, 256, 1024]
    - [110, 40.66]
  - - [256, 1024, 1, 4096, 256, 256, 256, 1024]
    - [110, 48.5]
  - - [256, 1024, 1, 8192, 256, 256, 256, 1024]
    - [111, 53.88]
  - - [256, 2048, 1, 128, 256, 256, 256, 2048]
    - [48, 13.78]
  - - [256, 2048, 1, 256, 256, 256, 256, 2048]
    - [47, 24.12]
  - - [256, 2048, 1, 512, 256, 256, 256, 2048]
    - [49, 37.5]
  - - [256, 2048, 1, 1024, 256, 256, 256, 2048]
    - [81, 53.71]
  - - [256, 2048, 1, 2048, 256, 256, 256, 2048]
    - [81, 67.98]
  - - [256, 2048, 1, 4096, 256, 256, 256, 2048]
    - [82, 79.25]
  - - [256, 2048, 1, 8192, 256, 256, 256, 2048]
    - [109, 86.72]
  - - [256, 4096, 1, 128, 256, 256, 256, 4096]
    - [42, 24.52]
  - - [256, 4096, 1, 256, 256, 256, 256, 4096]
    - [43, 41.45]
  - - [256, 4096, 1, 512, 256, 256, 256, 4096]
    - [44, 64.14]
  - - [256, 4096, 1, 1024, 256, 256, 256, 4096]
    - [74, 88.21]
  - - [256, 4096, 1, 2048, 256, 256, 256, 4096]
    - [75, 107.81]
  - - [256, 4096, 1, 4096, 256, 256, 256, 4096]
    - [75, 125.59]
  - - [256, 4096, 1, 8192, 256, 256, 256, 4096]
    - [75, 131.65]
  - - [256, 8192, 1, 128, 256, 256, 256, 8192]
    - [30, 38.12]
  - - [256, 8192, 1, 256, 256, 256, 256, 8192]
    - [31, 65.21]
  - - [256, 8192, 1, 512, 256, 256, 256, 8192]
    - [32, 98.22]
  - - [256, 8192, 1, 1024, 256, 256, 256, 8192]
    - [32, 132.84]
  - - [256, 8192, 1, 2048, 256, 256, 256, 8192]
    - [72, 160.91]
  - - [256, 8192, 1, 4096, 256, 256, 256, 8192]
    - [72, 180.45]
  - - [256, 8192, 1, 8192, 256, 256, 256, 8192]
    - [72, 164.64]
  - - [512, 128, 1, 128, 512, 512, 512, 128]
    - [54, 1.93]
  - - [512, 128, 1, 256, 512, 512, 512, 128]
    - [102, 3.42]
  - - [512, 128, 1, 512, 512, 512, 512, 128]
    - [105, 5.88]
  - - [512, 128, 1, 1024, 512, 512, 512, 128]
    - [106, 8.76]
  - - [512, 128, 1, 2048, 512, 512, 512, 128]
    - [106, 11.67]
  - - [512, 128, 1, 4096, 512, 512, 512, 128]
    - [106, 14.05]
  - - [512, 128, 1, 8192, 512, 512, 512, 128]
    - [116, 14.51]
  - - [512, 256, 1, 128, 512, 512, 512, 256]
    - [53, 4.07]
  - - [512, 256, 1, 256, 512, 512, 512, 256]
    - [54, 7.1]
  - - [512, 256, 1, 512, 512, 512, 512, 256]
    - [104, 11.58]
  - - [512, 256, 1, 1024, 512, 512, 512, 256]
    - [106, 17.04]
  - - [512, 256, 1, 2048, 512, 512, 512, 256]
    - [106, 22.85]
  - - [512, 256, 1, 4096, 512, 512, 512, 256]
    - [106, 27.45]
  - - [512, 256, 1, 8192, 512, 512, 512, 256]
    - [116, 28.8]
  - - [512, 512, 1, 128, 512, 512, 512, 512]
    - [52, 7.56]
  - - [512, 512, 1, 256, 512, 512, 512, 512]
    - [52, 13.2]
  - - [512, 512, 1, 512, 512, 512, 512, 512]
    - [97, 21.06]
  - - [512, 512, 1, 1024, 512, 512, 512, 512]
    - [98, 30.75]
  - - [512, 512, 1, 2048, 512, 512, 512, 512]
    - [110, 40.04]
  - - [512, 512, 1, 4096, 512, 512, 512, 512]
    - [110, 48.63]
  - - [512, 512, 1, 8192, 512, 512, 512, 512]
    - [99, 50.5]
  - - [512, 1024, 1, 128, 512, 512, 512, 1024]
    - [47, 13.58]
  - - [512, 1024, 1, 256, 512, 512, 512, 1024]
    - [47, 23.36]
  - - [512, 1024, 1, 512, 512, 512, 512, 1024]
    - [49, 36.97]
  - - [512, 1024, 1, 1024, 512, 512, 512, 1024]
    - [81, 53.58]
  - - [512, 1024, 1, 2048, 512, 512, 512, 1024]
    - [108, 69.29]
  - - [512, 1024, 1, 4096, 512, 512, 512, 1024]
    - [82, 77.75]
  - - [512, 1024, 1, 8192, 512, 512, 512, 1024]
    - [85, 81.7]
  - - [512, 2048, 1, 128, 512, 512, 512, 2048]
    - [43, 24.12]
  - - [512, 2048, 1, 256, 512, 512, 512, 2048]
    - [43, 41.26]
  - - [512, 2048, 1, 512, 512, 512, 512, 2048]
    - [43, 63.91]
  - - [512, 2048, 1, 1024, 512, 512, 512, 2048]
    - [75, 88.25]
  - - [512, 2048, 1, 2048, 512, 512, 512, 2048]
    - [75, 108.38]
  - - [512, 2048, 1, 4096, 512, 512, 512, 2048]
    - [75, 124.61]
  - - [512, 2048, 1, 8192, 512, 512, 512, 2048]
    - [75, 128.83]
  - - [512, 4096, 1, 128, 512, 512, 512, 4096]
    - [29, 38.37]
  - - [512, 4096, 1, 256, 512, 512, 512, 4096]
    - [30, 64.89]
  - - [512, 4096, 1, 512, 512, 512, 512, 4096]
    - [32, 98.77]
  - - [512, 4096, 1, 1024, 512, 512, 512, 4096]
    - [31, 133.64]
  - - [512, 4096, 1, 2048, 512, 512, 512, 4096]
    - [31, 160.28]
  - - [512, 4096, 1, 4096, 512, 512, 512, 4096]
    - [32, 178.75]
  - - [512, 4096, 1, 8192, 512, 512, 512, 4096]
    - [31, 167.18]
  - - [512, 8192, 1, 128, 512, 512, 512, 8192]
    - [22, 55.59]
  - - [512, 8192, 1, 256, 512, 512, 512, 8192]
    - [23, 93.76]
  - - [512, 8192, 1, 512, 512, 512, 512, 8192]
    - [23, 140.96]
  - - [512, 8192, 1, 1024, 512, 512, 512, 8192]
    - [23, 190.65]
  - - [512, 8192, 1, 2048, 512, 512, 512, 8192]
    - [24, 226.32]
  - - [512, 8192, 1, 4096, 512, 512, 512, 8192]
    - [64, 233.87]
  - - [512, 8192, 1, 8192, 512, 512, 512, 8192]
    - [64, 212.58]
  - - [1024, 128, 1, 128, 1024, 1024, 1024, 128]
    - [56, 4.03]
  - - [1024, 128, 1, 256, 1024, 1024, 1024, 128]
    - [54, 6.95]
  - - [1024, 128, 1, 512, 1024, 1024, 1024, 128]
    - [104, 11.42]
  - - [1024, 128, 1, 1024, 1024, 1024, 1024, 128]
    - [103, 17.03]
  - - [1024, 128, 1, 2048, 1024, 1024, 1024, 128]
    - [106, 22.86]
  - - [1024, 128, 1, 4096, 1024, 1024, 1024, 128]
    - [114, 25.74]
  - - [1024, 128, 1, 8192, 1024, 1024, 1024, 128]
    - [116, 26.26]
  - - [1024, 256, 1, 128, 1024, 1024, 1024, 256]
    - [51, 7.7]
  - - [1024, 256, 1, 256, 1024, 1024, 1024, 256]
    - [51, 13.24]
  - - [1024, 256, 1, 512, 1024, 1024, 1024, 256]
    - [96, 21.08]
  - - [1024, 256, 1, 1024, 1024, 1024, 1024, 256]
    - [99, 30.93]
  - - [1024, 256, 1, 2048, 1024, 1024, 1024, 256]
    - [110, 40.97]
  - - [1024, 256, 1, 4096, 1024, 1024, 1024, 256]
    - [93, 46.15]
  - - [1024, 256, 1, 8192, 1024, 1024, 1024, 256]
    - [100, 49.44]
  - - [1024, 512, 1, 128, 1024, 1024, 1024, 512]
    - [79, 13.84]
  - - [1024, 512, 1, 256, 1024, 1024, 1024, 512]
    - [48, 23.86]
  - - [1024, 512, 1, 512, 1024, 1024, 1024, 512]
    - [80, 37.88]
  - - [1024, 512, 1, 1024, 1024, 1024, 1024, 512]
    - [81, 54.39]
  - - [1024, 512, 1, 2048, 1024, 1024, 1024, 512]
    - [82, 69.51]
  - - [1024, 512, 1, 4096, 1024, 1024, 1024, 512]
    - [85, 76.29]
  - - [1024, 512, 1, 8192, 1024, 1024, 1024, 512]
    - [85, 82.43]
  - - [1024, 1024, 1, 128, 1024, 1024, 1024, 1024]
    - [43, 23.73]
  - - [1024, 1024, 1, 256, 1024, 1024, 1024, 1024]
    - [43, 40.43]
  - - [1024, 1024, 1, 512, 1024, 1024, 1024, 1024]
    - [75, 63.47]
  - - [1024, 1024, 1, 1024, 1024, 1024, 1024, 1024]
    - [75, 88.35]
  - - [1024, 1024, 1, 2048, 1024, 1024, 1024, 1024]
    - [75, 110.02]
  - - [1024, 1024, 1, 4096, 1024, 1024, 1024, 1024]
    - [77, 124.57]
  - - [1024, 1024, 1, 8192, 1024, 1024, 1024, 1024]
    - [77, 127.98]
  - - [1024, 2048, 1, 128, 1024, 1024, 1024, 2048]
    - [30, 38.62]
  - - [1024, 2048, 1, 256, 1024, 1024, 1024, 2048]
    - [31, 64.87]
  - - [1024, 2048, 1, 512, 1024, 1024, 1024, 2048]
    - [31, 98.79]
  - - [1024, 2048, 1, 1024, 1024, 1024, 1024, 2048]
    - [31, 133.94]
  - - [1024, 2048, 1, 2048, 1024, 1024, 1024, 2048]
    - [33, 159.83]
  - - [1024, 2048, 1, 4096, 1024, 1024, 1024, 2048]
    - [36, 177.54]
  - - [1024, 2048, 1, 8192, 1024, 1024, 1024, 2048]
    - [32, 164.73]
  - - [1024, 4096, 1, 128, 1024, 1024, 1024, 4096]
    - [22, 56.01]
  - - [1024, 4096, 1, 256, 1024, 1024, 1024, 4096]
    - [23, 93.48]
  - - [1024, 4096, 1, 512, 1024, 1024, 1024, 4096]
    - [23, 140.92]
  - - [1024, 4096, 1, 1024, 1024, 1024, 1024, 4096]
    - [23, 189.04]
  - - [1024, 4096, 1, 2048, 1024, 1024, 1024, 4096]
    - [23, 227.72]
  - - [1024, 4096, 1, 4096, 1024, 1024, 1024, 4096]
    - [23, 231.78]
  - - [1024, 4096, 1, 8192, 1024, 1024, 1024, 4096]
    - [70, 212.33]
  - - [1024, 8192, 1, 128, 1024, 1024, 1024, 8192]
    - [18, 81.45]
  - - [1024, 8192, 1, 256, 1024, 1024, 1024, 8192]
    - [17, 132.87]
  - - [1024, 8192, 1, 512, 1024, 1024, 1024, 8192]
    - [20, 190.94]
  - - [1024, 8192, 1, 1024, 1024, 1024, 1024, 8192]
    - [4, 233.55]
  - - [1024, 8192, 1, 2048, 1024, 1024, 1024, 8192]
    - [4, 261.24]
  - - [1024, 8192, 1, 4096, 1024, 1024, 1024, 8192]
    - [4, 247.44]
  - - [1024, 8192, 1, 8192, 1024, 1024, 1024, 8192]
    - [7, 261.18]
  - - [2048, 128, 1, 128, 2048, 2048, 2048, 128]
    - [52, 7.55]
  - - [2048, 128, 1, 256, 2048, 2048, 2048, 128]
    - [51, 13.28]
  - - [2048, 128, 1, 512, 2048, 2048, 2048, 128]
    - [96, 21.12]
  - - [2048, 128, 1, 1024, 2048, 2048, 2048, 128]
    - [99, 31.12]
  - - [2048, 128, 1, 2048, 2048, 2048, 2048, 128]
    - [91, 37.56]
  - - [2048, 128, 1, 4096, 2048, 2048, 2048, 128]
    - [92, 45.25]
  - - [2048, 128, 1, 8192, 2048, 2048, 2048, 128]
    - [94, 50.44]
  - - [2048, 256, 1, 128, 2048, 2048, 2048, 256]
    - [47, 13.48]
  - - [2048, 256, 1, 256, 2048, 2048, 2048, 256]
    - [48, 23.1]
  - - [2048, 256, 1, 512, 2048, 2048, 2048, 256]
    - [50, 36.6]
  - - [2048, 256, 1, 1024, 2048, 2048, 2048, 256]
    - [81, 53.92]
  - - [2048, 256, 1, 2048, 2048, 2048, 2048, 256]
    - [86, 67.36]
  - - [2048, 256, 1, 4096, 2048, 2048, 2048, 256]
    - [83, 77.73]
  - - [2048, 256, 1, 8192, 2048, 2048, 2048, 256]
    - [88, 85.87]
  - - [2048, 512, 1, 128, 2048, 2048, 2048, 512]
    - [43, 24.15]
  - - [2048, 512, 1, 256, 2048, 2048, 2048, 512]
    - [43, 41.16]
  - - [2048, 512, 1, 512, 2048, 2048, 2048, 512]
    - [43, 63.28]
  - - [2048, 512, 1, 1024, 2048, 2048, 2048, 512]
    - [41, 87.71]
  - - [2048, 512, 1, 2048, 2048, 2048, 2048, 512]
    - [78, 107.79]
  - - [2048, 512, 1, 4096, 2048, 2048, 2048, 512]
    - [77, 123.57]
  - - [2048, 512, 1, 8192, 2048, 2048, 2048, 512]
    - [78, 129.94]
  - - [2048, 1024, 1, 128, 2048, 2048, 2048, 1024]
    - [30, 38.76]
  - - [2048, 1024, 1, 256, 2048, 2048, 2048, 1024]
    - [30, 64.69]
  - - [2048, 1024, 1, 512, 2048, 2048, 2048, 1024]
    - [32, 99.15]
  - - [2048, 1024, 1, 1024, 2048, 2048, 2048, 1024]
    - [72, 133.38]
  - - [2048, 1024, 1, 2048, 2048, 2048, 2048, 1024]
    - [35, 160.2]
  - - [2048, 1024, 1, 4096, 2048, 2048, 2048, 1024]
    - [35, 179.74]
  - - [2048, 1024, 1, 8192, 2048, 2048, 2048, 1024]
    - [35, 166.41]
  - - [2048, 2048, 1, 128, 2048, 2048, 2048, 2048]
    - [26, 56.28]
  - - [2048, 2048, 1, 256, 2048, 2048, 2048, 2048]
    - [23, 94.48]
  - - [2048, 2048, 1, 512, 2048, 2048, 2048, 2048]
    - [27, 141.52]
  - - [2048, 2048, 1, 1024, 2048, 2048, 2048, 2048]
    - [23, 189.19]
  - - [2048, 2048, 1, 2048, 2048, 2048, 2048, 2048]
    - [28, 227.74]
  - - [2048, 2048, 1, 4096, 2048, 2048, 2048, 2048]
    - [65, 232.61]
  - - [2048, 2048, 1, 8192, 2048, 2048, 2048, 2048]
    - [68, 214.93]
  - - [2048, 4096, 1, 128, 2048, 2048, 2048, 4096]
    - [5, 70.43]
  - - [2048, 4096, 1, 256, 2048, 2048, 2048, 4096]
    - [0, 117.22]
  - - [2048, 4096, 1, 512, 2048, 2048, 2048, 4096]
    - [3, 175.49]
  - - [2048, 4096, 1, 1024, 2048, 2048, 2048, 4096]
    - [3, 233.34]
  - - [2048, 4096, 1, 2048, 2048, 2048, 2048, 4096]
    - [4, 261.24]
  - - [2048, 4096, 1, 4096, 2048, 2048, 2048, 4096]
    - [59, 244.99]
  - - [2048, 4096, 1, 8192, 2048, 2048, 2048, 4096]
    - [3, 262.22]
  - - [2048, 8192, 1, 128, 2048, 2048, 2048, 8192]
    - [21, 89.77]
  - - [2048, 8192, 1, 256, 2048, 2048, 2048, 8192]
    - [21, 139.4]
  - - [2048, 8192, 1, 512, 2048, 2048, 2048, 8192]
    - [17, 191.26]
  - - [2048, 8192, 1, 1024, 2048, 2048, 2048, 8192]
    - [12, 224.93]
  - - [2048, 8192, 1, 2048, 2048, 2048, 2048, 8192]
    - [14, 229.71]
  - - [2048, 8192, 1, 4096, 2048, 2048, 2048, 8192]
    - [7, 280.31]
  - - [2048, 8192, 1, 8192, 2048, 2048, 2048, 8192]
    - [7, 326.33]
  - - [4096, 128, 1, 128, 4096, 4096, 4096, 128]
    - [46, 13.64]
  - - [4096, 128, 1, 256, 4096, 4096, 4096, 128]
    - [47, 23.14]
  - - [4096, 128, 1, 512, 4096, 4096, 4096, 128]
    - [49, 36.7]
  - - [4096, 128, 1, 1024, 4096, 4096, 4096, 128]
    - [81, 53.14]
  - - [4096, 128, 1, 2048, 4096, 4096, 4096, 128]
    - [84, 65.68]
  - - [4096, 128, 1, 4096, 4096, 4096, 4096, 128]
    - [87, 77.53]
  - - [4096, 128, 1, 8192, 4096, 4096, 4096, 128]
    - [85, 84.59]
  - - [4096, 256, 1, 128, 4096, 4096, 4096, 256]
    - [39, 23.38]
  - - [4096, 256, 1, 256, 4096, 4096, 4096, 256]
    - [45, 40.04]
  - - [4096, 256, 1, 512, 4096, 4096, 4096, 256]
    - [40, 62.12]
  - - [4096, 256, 1, 1024, 4096, 4096, 4096, 256]
    - [41, 87.25]
  - - [4096, 256, 1, 2048, 4096, 4096, 4096, 256]
    - [78, 107.55]
  - - [4096, 256, 1, 4096, 4096, 4096, 4096, 256]
    - [78, 124.46]
  - - [4096, 256, 1, 8192, 4096, 4096, 4096, 256]
    - [77, 130.4]
  - - [4096, 512, 1, 128, 4096, 4096, 4096, 512]
    - [32, 38.26]
  - - [4096, 512, 1, 256, 4096, 4096, 4096, 512]
    - [31, 64.57]
  - - [4096, 512, 1, 512, 4096, 4096, 4096, 512]
    - [32, 98.88]
  - - [4096, 512, 1, 1024, 4096, 4096, 4096, 512]
    - [37, 130.61]
  - - [4096, 512, 1, 2048, 4096, 4096, 4096, 512]
    - [38, 159.06]
  - - [4096, 512, 1, 4096, 4096, 4096, 4096, 512]
    - [33, 177.53]
  - - [4096, 512, 1, 8192, 4096, 4096, 4096, 512]
    - [35, 166.89]
  - - [4096, 1024, 1, 128, 4096, 4096, 4096, 1024]
    - [22, 55.28]
  - - [4096, 1024, 1, 256, 4096, 4096, 4096, 1024]
    - [22, 93.21]
  - - [4096, 1024, 1, 512, 4096, 4096, 4096, 1024]
    - [22, 139.56]
  - - [4096, 1024, 1, 1024, 4096, 4096, 4096, 1024]
    - [24, 186.31]
  - - [4096, 1024, 1, 2048, 4096, 4096, 4096, 1024]
    - [25, 226.1]
  - - [4096, 1024, 1, 4096, 4096, 4096, 4096, 1024]
    - [69, 233.89]
  - - [4096, 1024, 1, 8192, 4096, 4096, 4096, 1024]
    - [68, 214.13]
  - - [4096, 2048, 1, 128, 4096, 4096, 4096, 2048]
    - [1, 70.73]
  - - [4096, 2048, 1, 256, 4096, 4096, 4096, 2048]
    - [3, 117.2]
  - - [4096, 2048, 1, 512, 4096, 4096, 4096, 2048]
    - [3, 175.68]
  - - [4096, 2048, 1, 1024, 4096, 4096, 4096, 2048]
    - [7, 232.24]
  - - [4096, 2048, 1, 2048, 4096, 4096, 4096, 2048]
    - [7, 258.75]
  - - [4096, 2048, 1, 4096, 4096, 4096, 4096, 2048]
    - [7, 245.93]
  - - [4096, 2048, 1, 8192, 4096, 4096, 4096, 2048]
    - [13, 266.47]
  - - [4096, 4096, 1, 128, 4096, 4096, 4096, 4096]
    - [9, 76.79]
  - - [4096, 4096, 1, 256, 4096, 4096, 4096, 4096]
    - [9, 126.46]
  - - [4096, 4096, 1, 512, 4096, 4096, 4096, 4096]
    - [9, 185.61]
  - - [4096, 4096, 1, 1024, 4096, 4096, 4096, 4096]
    - [11, 222.8]
  - - [4096, 4096, 1, 2048, 4096, 4096, 4096, 4096]
    - [13, 231.74]
  - - [4096, 4096, 1, 4096, 4096, 4096, 4096, 4096]
    - [7, 279.47]
  - - [4096, 4096, 1, 8192, 4096, 4096, 4096, 4096]
    - [60, 329.44]
  - - [4096, 8192, 1, 128, 4096, 4096, 4096, 8192]
    - [19, 96.63]
  - - [4096, 8192, 1, 256, 4096, 4096, 4096, 8192]
    - [19, 143.69]
  - - [4096, 8192, 1, 512, 4096, 4096, 4096, 8192]
    - [13, 190.86]
  - - [4096, 8192, 1, 1024, 4096, 4096, 4096, 8192]
    - [71, 218.02]
  - - [4096, 8192, 1, 2048, 4096, 4096, 4096, 8192]
    - [66, 259.99]
  - - [4096, 8192, 1, 4096, 4096, 4096, 4096, 8192]
    - [2, 315.28]
  - - [4096, 8192, 1, 8192, 4096, 4096, 4096, 8192]
    - [57, 353.96]
  - - [8192, 128, 1, 128, 8192, 8192, 8192, 128]
    - [43, 24.38]
  - - [8192, 128, 1, 256, 8192, 8192, 8192, 128]
    - [43, 41.79]
  - - [8192, 128, 1, 512, 8192, 8192, 8192, 128]
    - [75, 63.57]
  - - [8192, 128, 1, 1024, 8192, 8192, 8192, 128]
    - [76, 87.23]
  - - [8192, 128, 1, 2048, 8192, 8192, 8192, 128]
    - [77, 107.5]
  - - [8192, 128, 1, 4096, 8192, 8192, 8192, 128]
    - [78, 124.8]
  - - [8192, 128, 1, 8192, 8192, 8192, 8192, 128]
    - [77, 123.94]
  - - [8192, 256, 1, 128, 8192, 8192, 8192, 256]
    - [30, 38.8]
  - - [8192, 256, 1, 256, 8192, 8192, 8192, 256]
    - [30, 64.6]
  - - [8192, 256, 1, 512, 8192, 8192, 8192, 256]
    - [32, 98.31]
  - - [8192, 256, 1, 1024, 8192, 8192, 8192, 256]
    - [73, 133.07]
  - - [8192, 256, 1, 2048, 8192, 8192, 8192, 256]
    - [34, 159.17]
  - - [8192, 256, 1, 4096, 8192, 8192, 8192, 256]
    - [38, 178.01]
  - - [8192, 256, 1, 8192, 8192, 8192, 8192, 256]
    - [33, 162.05]
  - - [8192, 512, 1, 128, 8192, 8192, 8192, 512]
    - [22, 55.23]
  - - [8192, 512, 1, 256, 8192, 8192, 8192, 512]
    - [23, 92.85]
  - - [8192, 512, 1, 512, 8192, 8192, 8192, 512]
    - [24, 139.65]
  - - [8192, 512, 1, 1024, 8192, 8192, 8192, 512]
    - [28, 188.56]
  - - [8192, 512, 1, 2048, 8192, 8192, 8192, 512]
    - [25, 226.8]
  - - [8192, 512, 1, 4096, 8192, 8192, 8192, 512]
    - [67, 232.47]
  - - [8192, 512, 1, 8192, 8192, 8192, 8192, 512]
    - [68, 214.33]
  - - [8192, 1024, 1, 128, 8192, 8192, 8192, 1024]
    - [10, 71.12]
  - - [8192, 1024, 1, 256, 8192, 8192, 8192, 1024]
    - [10, 117.24]
  - - [8192, 1024, 1, 512, 8192, 8192, 8192, 1024]
    - [12, 175.75]
  - - [8192, 1024, 1, 1024, 8192, 8192, 8192, 1024]
    - [5, 229.94]
  - - [8192, 1024, 1, 2048, 8192, 8192, 8192, 1024]
    - [12, 259.84]
  - - [8192, 1024, 1, 4096, 8192, 8192, 8192, 1024]
    - [63, 247.52]
  - - [8192, 1024, 1, 8192, 8192, 8192, 8192, 1024]
    - [13, 270.08]
  - - [8192, 2048, 1, 128, 8192, 8192, 8192, 2048]
    - [9, 75.86]
  - - [8192, 2048, 1, 256, 8192, 8192, 8192, 2048]
    - [9, 123.82]
  - - [8192, 2048, 1, 512, 8192, 8192, 8192, 2048]
    - [3, 182.75]
  - - [8192, 2048, 1, 1024, 8192, 8192, 8192, 2048]
    - [4, 223.64]
  - - [8192, 2048, 1, 2048, 8192, 8192, 8192, 2048]
    - [15, 231.13]
  - - [8192, 2048, 1, 4096, 8192, 8192, 8192, 2048]
    - [7, 281.44]
  - - [8192, 2048, 1, 8192, 8192, 8192, 8192, 2048]
    - [58, 331.48]
  - - [8192, 4096, 1, 128, 8192, 8192, 8192, 4096]
    - [10, 81.01]
  - - [8192, 4096, 1, 256, 8192, 8192, 8192, 4096]
    - [10, 128.92]
  - - [8192, 4096, 1, 512, 8192, 8192, 8192, 4096]
    - [13, 188.96]
  - - [8192, 4096, 1, 1024, 8192, 8192, 8192, 4096]
    - [16, 214.4]
  - - [8192, 4096, 1, 2048, 8192, 8192, 8192, 4096]
    - [6, 256.76]
  - - [8192, 4096, 1, 4096, 8192, 8192, 8192, 4096]
    - [8, 304.16]
  - - [8192, 4096, 1, 8192, 8192, 8192, 8192, 4096]
    - [62, 336.83]
  - - [8192, 8192, 1, 128, 8192, 8192, 8192, 8192]
    - [17, 93.41]
  - - [8192, 8192, 1, 256, 8192, 8192, 8192, 8192]
    - [15, 139.64]
  - - [8192, 8192, 1, 512, 8192, 8192, 8192, 8192]
    - [12, 202.34]
  - - [8192, 8192, 1, 1024, 8192, 8192, 8192, 8192]
    - [63, 261.92]
  - - [8192, 8192, 1, 2048, 8192, 8192, 8192, 8192]
    - [61, 320.68]
  - - [8192, 8192, 1, 4096, 8192, 8192, 8192, 8192]
    - [63, 354.87]
  - - [8192, 8192, 1, 8192, 8192, 8192, 8192, 8192]
    - [3, 346.22]
- null
- null
- ExperimentalStreamK
- GridBased
