projects/hipblaslt/library/src/amd_detail/rocblaslt/src/Tensile/Logic/asm_full/aquavanjaram/gfx942_228cu/StreamK/aquavanjaram942_Cijk_Alik_Bjlk_B8NSS_BH_Bias_HAS_SAV_UserArgs.yaml
- {MinimumRequiredVersion: 4.33.0}
- aquavanjaram942
- {Architecture: gfx942, CUCount: 228}
- [Device 0049, Device 0050]
    SolutionIndex: 0
    SolutionNameMin: Cijk_Alik_Bjlk_B8NSS_BH_Bias_HAS_SAV_UserArgs_MT256x256x64_MI16x16x1_SN_LDSB1_CLR1_GRVWA8_GRVWB16_GSU0_GSUC0_GSUWGMRR0_K1_LBSPPA512_LBSPPB2048_LPA8_LPB0_LRVW8_MIWT8_8_PLR1_SU0_SUM0_SUS64_VWA8_VWB8_WGM1_WGMXCC1_WGMXCCGn1
    SolutionIndex: 1
    SolutionNameMin: Cijk_Alik_Bjlk_B8NSS_BH_Bias_HAS_SAV_UserArgs_MT256x256x64_MI16x16x1_SN_LDSB1_CLR1_GRVWA16_GRVWB16_GSU0_GSUC0_GSUWGMRR0_K1_LBSPPA512_LBSPPB2048_LPA16_LPB0_LRVW8_MIWT8_8_PLR1_SU0_SUM0_SUS64_VWA8_VWB8_WGM4_WGMXCC1_WGMXCCGn1
    SolutionIndex: 2
    SolutionNameMin: Cijk_Alik_Bjlk_B8NSS_BH_Bias_HAS_SAV_UserArgs_MT256x256x64_MI16x16x1_SN_LDSB1_CLR1_GRVWA16_GRVWB16_GSU0_GSUC0_GSUWGMRR0_K1_LBSPPA512_LBSPPB2048_LPA16_LPB0_LRVW8_MIWT8_8_PLR1_SU0_SUM0_SUS64_VWA8_VWB8_WGM8_WGMXCC1_WGMXCCGn1
    SolutionIndex: 3
    SolutionNameMin: Cijk_Alik_Bjlk_B8NSS_BH_Bias_HAS_SAV_UserArgs_MT128x256x64_MI16x16x1_SN_LDSB1_CLR1_GRVWA8_GRVWB8_GSU0_GSUC0_GSUWGMRR0_K1_LBSPPA256_LBSPPB2048_LPA8_LPB0_LRVW8_MIWT4_8_PLR1_SU0_SUM0_SUS64_VWA4_VWB8_WGM1_WGMXCC1_WGMXCCGn1
    SolutionIndex: 4
    SolutionNameMin: Cijk_Alik_Bjlk_B8NSS_BH_Bias_HAS_SAV_UserArgs_MT128x256x64_MI16x16x1_SN_LDSB1_CLR1_GRVWA16_GRVWB8_GSU0_GSUC0_GSUWGMRR0_K1_LBSPPA256_LBSPPB2048_LPA16_LPB0_LRVW8_MIWT4_8_PLR1_SU0_SUM0_SUS64_VWA4_VWB8_WGM1_WGMXCC1_WGMXCCGn1
    SolutionIndex: 5
    SolutionNameMin: Cijk_Alik_Bjlk_B8NSS_BH_Bias_HAS_SAV_UserArgs_MT128x256x64_MI16x16x1_SN_LDSB1_CLR1_GRVWA8_GRVWB16_GSU0_GSUC0_GSUWGMRR0_K1_LBSPPA256_LBSPPB2048_LPA8_LPB0_LRVW8_MIWT4_8_PLR1_SU0_SUM0_SUS64_VWA4_VWB8_WGM1_WGMXCC1_WGMXCCGn1
    SolutionIndex: 6
    SolutionNameMin: Cijk_Alik_Bjlk_B8NSS_BH_Bias_HAS_SAV_UserArgs_MT128x256x64_MI16x16x1_SN_LDSB1_CLR1_GRVWA16_GRVWB16_GSU0_GSUC0_GSUWGMRR0_K1_LBSPPA256_LBSPPB2048_LPA16_LPB0_LRVW8_MIWT4_8_PLR1_SU0_SUM0_SUS64_VWA4_VWB8_WGM1_WGMXCC1_WGMXCCGn1
    SolutionIndex: 7
    SolutionNameMin: Cijk_Alik_Bjlk_B8NSS_BH_Bias_HAS_SAV_UserArgs_MT128x256x64_MI16x16x1_SN_LDSB1_CLR1_GRVWA16_GRVWB8_GSU0_GSUC0_GSUWGMRR0_K1_LBSPPA256_LBSPPB2048_LPA16_LPB0_LRVW8_MIWT4_8_PLR1_SU0_SUM0_SUS64_VWA4_VWB8_WGM4_WGMXCC1_WGMXCCGn1
    SolutionIndex: 8
    SolutionNameMin: Cijk_Alik_Bjlk_B8NSS_BH_Bias_HAS_SAV_UserArgs_MT128x256x64_MI16x16x1_SN_LDSB1_CLR1_GRVWA8_GRVWB16_GSU0_GSUC0_GSUWGMRR0_K1_LBSPPA256_LBSPPB2048_LPA8_LPB0_LRVW8_MIWT4_8_PLR1_SU0_SUM0_SUS64_VWA4_VWB8_WGM4_WGMXCC1_WGMXCCGn1
    SolutionIndex: 9
    SolutionNameMin: Cijk_Alik_Bjlk_B8NSS_BH_Bias_HAS_SAV_UserArgs_MT128x256x64_MI16x16x1_SN_LDSB1_CLR1_GRVWA16_GRVWB16_GSU0_GSUC0_GSUWGMRR0_K1_LBSPPA256_LBSPPB2048_LPA16_LPB0_LRVW8_MIWT4_8_PLR1_SU0_SUM0_SUS64_VWA4_VWB8_WGM4_WGMXCC1_WGMXCCGn1
    SolutionIndex: 10
    SolutionNameMin: Cijk_Alik_Bjlk_B8NSS_BH_Bias_HAS_SAV_UserArgs_MT128x256x64_MI16x16x1_SN_LDSB1_CLR1_GRVWA8_GRVWB16_GSU0_GSUC0_GSUWGMRR0_K1_LBSPPA256_LBSPPB2048_LPA8_LPB0_LRVW8_MIWT4_8_PLR1_SU0_SUM0_SUS64_VWA4_VWB8_WGM6_WGMXCC1_WGMXCCGn1
    SolutionIndex: 11
    SolutionNameMin: Cijk_Alik_Bjlk_B8NSS_BH_Bias_HAS_SAV_UserArgs_MT128x256x64_MI16x16x1_SN_LDSB1_CLR1_GRVWA16_GRVWB8_GSU0_GSUC0_GSUWGMRR0_K1_LBSPPA256_LBSPPB2048_LPA16_LPB0_LRVW8_MIWT4_8_PLR1_SU0_SUM0_SUS64_VWA4_VWB8_WGM8_WGMXCC1_WGMXCCGn1
    SolutionIndex: 12
    SolutionNameMin: Cijk_Alik_Bjlk_B8NSS_BH_Bias_HAS_SAV_UserArgs_MT256x128x64_MI16x16x1_SN_LDSB1_CLR1_GRVWA8_GRVWB16_GSU0_GSUC0_GSUWGMRR0_K1_LBSPPA512_LBSPPB1024_LPA8_LPB64_LRVW8_MIWT8_4_PLR1_SU0_SUM0_SUS64_VWA8_VWB4_WGM4_WGMXCC1_WGMXCCGn1
    SolutionIndex: 13
    SolutionNameMin: Cijk_Alik_Bjlk_B8NSS_BH_Bias_HAS_SAV_UserArgs_MT128x128x64_MI16x16x1_SN_LDSB1_CLR1_GRVWA8_GRVWB8_GSU0_GSUC0_GSUWGMRR0_K1_LBSPPA256_LBSPPB1024_LPA8_LPB64_LRVW8_MIWT4_4_PLR1_SU0_SUM0_SUS64_VWA4_VWB4_WGM1_WGMXCC1_WGMXCCGn1
    SolutionIndex: 14
    SolutionNameMin: Cijk_Alik_Bjlk_B8NSS_BH_Bias_HAS_SAV_UserArgs_MT128x128x64_MI16x16x1_SN_LDSB1_CLR1_GRVWA8_GRVWB16_GSU0_GSUC0_GSUWGMRR0_K1_LBSPPA256_LBSPPB1024_LPA8_LPB64_LRVW8_MIWT4_4_PLR1_SU0_SUM0_SUS64_VWA4_VWB4_WGM1_WGMXCC1_WGMXCCGn1
    SolutionIndex: 15
    SolutionNameMin: Cijk_Alik_Bjlk_B8NSS_BH_Bias_HAS_SAV_UserArgs_MT128x128x64_MI16x16x1_SN_LDSB1_CLR1_GRVWA16_GRVWB16_GSU0_GSUC0_GSUWGMRR0_K1_LBSPPA256_LBSPPB1024_LPA16_LPB64_LRVW8_MIWT4_4_PLR1_SU0_SUM0_SUS64_VWA4_VWB4_WGM1_WGMXCC1_WGMXCCGn1
    SolutionIndex: 16
    SolutionNameMin: Cijk_Alik_Bjlk_B8NSS_BH_Bias_HAS_SAV_UserArgs_MT128x128x64_MI16x16x1_SN_LDSB1_CLR1_GRVWA16_GRVWB16_GSU0_GSUC0_GSUWGMRR0_K1_LBSPPA256_LBSPPB1024_LPA16_LPB64_LRVW8_MIWT4_4_PLR1_SU0_SUM0_SUS64_VWA4_VWB4_WGM4_WGMXCC1_WGMXCCGn1
    SolutionIndex: 17
    SolutionNameMin: Cijk_Alik_Bjlk_B8NSS_BH_Bias_HAS_SAV_UserArgs_MT128x128x64_MI16x16x1_SN_LDSB1_CLR1_GRVWA16_GRVWB16_GSU0_GSUC0_GSUWGMRR0_K1_LBSPPA256_LBSPPB1024_LPA16_LPB64_LRVW8_MIWT4_4_PLR1_SU0_SUM0_SUS64_VWA4_VWB4_WGM6_WGMXCC1_WGMXCCGn1
    SolutionIndex: 18
    SolutionNameMin: Cijk_Alik_Bjlk_B8NSS_BH_Bias_HAS_SAV_UserArgs_MT128x128x64_MI16x16x1_SN_LDSB1_CLR1_GRVWA16_GRVWB16_GSU0_GSUC0_GSUWGMRR0_K1_LBSPPA256_LBSPPB1024_LPA16_LPB64_LRVW8_MIWT4_4_PLR1_SU0_SUM0_SUS64_VWA4_VWB4_WGM8_WGMXCC1_WGMXCCGn1
    SolutionIndex: 19
    SolutionNameMin: Cijk_Alik_Bjlk_B8NSS_BH_Bias_HAS_SAV_UserArgs_MT128x64x64_MI16x16x1_SN_LDSB0_CLR1_GRVWA16_GRVWB8_GSU0_GSUC0_GSUWGMRR0_K1_LBSPPA256_LBSPPB512_LPA16_LPB32_LRVW8_MIWT4_2_PLR1_SU0_SUM0_SUS64_VWA4_VWB2_WGM1_WGMXCC1_WGMXCCGn1
    SolutionIndex: 20
    SolutionNameMin: Cijk_Alik_Bjlk_B8NSS_BH_Bias_HAS_SAV_UserArgs_MT128x64x64_MI16x16x1_SN_LDSB0_CLR1_GRVWA8_GRVWB16_GSU0_GSUC0_GSUWGMRR0_K1_LBSPPA256_LBSPPB512_LPA8_LPB32_LRVW8_MIWT4_2_PLR1_SU0_SUM0_SUS64_VWA4_VWB2_WGM1_WGMXCC1_WGMXCCGn1
    SolutionIndex: 21
    SolutionNameMin: Cijk_Alik_Bjlk_B8NSS_BH_Bias_HAS_SAV_UserArgs_MT128x64x64_MI16x16x1_SN_LDSB0_CLR1_GRVWA16_GRVWB8_GSU0_GSUC0_GSUWGMRR0_K1_LBSPPA256_LBSPPB512_LPA16_LPB32_LRVW8_MIWT4_2_PLR1_SU0_SUM0_SUS64_VWA4_VWB2_WGM4_WGMXCC1_WGMXCCGn1
    SolutionIndex: 22
    SolutionNameMin: Cijk_Alik_Bjlk_B8NSS_BH_Bias_HAS_SAV_UserArgs_MT128x64x64_MI16x16x1_SN_LDSB0_CLR1_GRVWA8_GRVWB16_GSU0_GSUC0_GSUWGMRR0_K1_LBSPPA256_LBSPPB512_LPA8_LPB32_LRVW8_MIWT4_2_PLR1_SU0_SUM0_SUS64_VWA4_VWB2_WGM4_WGMXCC1_WGMXCCGn1
    SolutionIndex: 23
    SolutionNameMin: Cijk_Alik_Bjlk_B8NSS_BH_Bias_HAS_SAV_UserArgs_MT128x64x64_MI16x16x1_SN_LDSB0_CLR1_GRVWA16_GRVWB16_GSU0_GSUC0_GSUWGMRR0_K1_LBSPPA256_LBSPPB512_LPA16_LPB32_LRVW8_MIWT4_2_PLR1_SU0_SUM0_SUS64_VWA4_VWB2_WGM4_WGMXCC1_WGMXCCGn1
    SolutionIndex: 24
    SolutionNameMin: Cijk_Alik_Bjlk_B8NSS_BH_Bias_HAS_SAV_UserArgs_MT128x64x64_MI16x16x1_SN_LDSB0_CLR1_GRVWA8_GRVWB8_GSU0_GSUC0_GSUWGMRR0_K1_LBSPPA256_LBSPPB512_LPA8_LPB32_LRVW8_MIWT4_2_PLR1_SU0_SUM0_SUS64_VWA4_VWB2_WGM6_WGMXCC1_WGMXCCGn1
    SolutionIndex: 25
    SolutionNameMin: Cijk_Alik_Bjlk_B8NSS_BH_Bias_HAS_SAV_UserArgs_MT128x64x64_MI16x16x1_SN_LDSB0_CLR1_GRVWA16_GRVWB8_GSU0_GSUC0_GSUWGMRR0_K1_LBSPPA256_LBSPPB512_LPA16_LPB32_LRVW8_MIWT4_2_PLR1_SU0_SUM0_SUS64_VWA4_VWB2_WGM6_WGMXCC1_WGMXCCGn1
    SolutionIndex: 26
    SolutionNameMin: Cijk_Alik_Bjlk_B8NSS_BH_Bias_HAS_SAV_UserArgs_MT128x64x64_MI16x16x1_SN_LDSB0_CLR1_GRVWA8_GRVWB16_GSU0_GSUC0_GSUWGMRR0_K1_LBSPPA256_LBSPPB512_LPA8_LPB32_LRVW8_MIWT4_2_PLR1_SU0_SUM0_SUS64_VWA4_VWB2_WGM6_WGMXCC1_WGMXCCGn1
    SolutionIndex: 27
    SolutionNameMin: Cijk_Alik_Bjlk_B8NSS_BH_Bias_HAS_SAV_UserArgs_MT128x64x64_MI16x16x1_SN_LDSB0_CLR1_GRVWA16_GRVWB8_GSU0_GSUC0_GSUWGMRR0_K1_LBSPPA256_LBSPPB512_LPA16_LPB32_LRVW8_MIWT4_2_PLR1_SU0_SUM0_SUS64_VWA4_VWB2_WGM8_WGMXCC1_WGMXCCGn1
    SolutionIndex: 28
    SolutionNameMin: Cijk_Alik_Bjlk_B8NSS_BH_Bias_HAS_SAV_UserArgs_MT128x64x64_MI16x16x1_SN_LDSB0_CLR1_GRVWA8_GRVWB16_GSU0_GSUC0_GSUWGMRR0_K1_LBSPPA256_LBSPPB512_LPA8_LPB32_LRVW8_MIWT4_2_PLR1_SU0_SUM0_SUS64_VWA4_VWB2_WGM8_WGMXCC1_WGMXCCGn1
    SolutionIndex: 29
    SolutionNameMin: Cijk_Alik_Bjlk_B8NSS_BH_Bias_HAS_SAV_UserArgs_MT128x32x64_MI16x16x1_SN_LDSB0_CLR1_GRVWA8_GRVWB8_GSU0_GSUC0_GSUWGMRR0_K1_LBSPPA256_LBSPPB256_LPA8_LPB16_LRVW8_MIWT4_1_PLR1_SU0_SUM0_SUS64_VWA4_VWB1_WGM1_WGMXCC1_WGMXCCGn1
    SolutionIndex: 30
    SolutionNameMin: Cijk_Alik_Bjlk_B8NSS_BH_Bias_HAS_SAV_UserArgs_MT64x64x64_MI16x16x1_SN_LDSB0_CLR1_GRVWA8_GRVWB8_GSU0_GSUC0_GSUWGMRR0_K1_LBSPPA128_LBSPPB512_LPA8_LPB32_LRVW8_MIWT2_2_PLR1_SU0_SUM0_SUS64_VWA2_VWB2_WGM1_WGMXCC1_WGMXCCGn1
    SolutionIndex: 31
    SolutionNameMin: Cijk_Alik_Bjlk_B8NSS_BH_Bias_HAS_SAV_UserArgs_MT64x64x64_MI16x16x1_SN_LDSB0_CLR1_GRVWA16_GRVWB8_GSU0_GSUC0_GSUWGMRR0_K1_LBSPPA128_LBSPPB512_LPA16_LPB32_LRVW8_MIWT2_2_PLR1_SU0_SUM0_SUS64_VWA2_VWB2_WGM1_WGMXCC1_WGMXCCGn1
    SolutionIndex: 32
    SolutionNameMin: Cijk_Alik_Bjlk_B8NSS_BH_Bias_HAS_SAV_UserArgs_MT64x64x64_MI16x16x1_SN_LDSB0_CLR1_GRVWA16_GRVWB8_GSU0_GSUC0_GSUWGMRR0_K1_LBSPPA128_LBSPPB512_LPA16_LPB32_LRVW8_MIWT2_2_PLR1_SU0_SUM0_SUS64_VWA2_VWB2_WGM8_WGMXCC1_WGMXCCGn1
    SolutionIndex: 33
    SolutionNameMin: Cijk_Alik_Bjlk_B8NSS_BH_Bias_HAS_SAV_UserArgs_MT32x64x64_MI16x16x1_SN_LDSB0_CLR1_GRVWA8_GRVWB8_GSU0_GSUC0_GSUWGMRR0_K1_LBSPPA128_LBSPPB512_LPA8_LPB32_LRVW8_MIWT1_2_PLR1_SU0_SUM0_SUS64_VWA1_VWB2_WGM1_WGMXCC1_WGMXCCGn1
    SolutionIndex: 34
    SolutionNameMin: Cijk_Alik_Bjlk_B8NSS_BH_Bias_HAS_SAV_UserArgs_MT32x32x64_MI16x16x1_SN_LDSB0_CLR1_GRVWA8_GRVWB8_GSU0_GSUC0_GSUWGMRR0_K1_LBSPPA128_LBSPPB256_LPA8_LPB16_LRVW8_MIWT1_1_PLR1_SU0_SUM0_SUS64_VWA1_VWB1_WGM1_WGMXCC1_WGMXCCGn1
    SolutionIndex: 35
    SolutionNameMin: Cijk_Alik_Bjlk_B8NSS_BH_Bias_HAS_SAV_UserArgs_MT32x32x64_MI16x16x1_SN_LDSB0_CLR1_GRVWA8_GRVWB8_GSU0_GSUC0_GSUWGMRR0_K1_LBSPPA128_LBSPPB256_LPA8_LPB16_LRVW8_MIWT1_1_PLR1_SU0_SUM0_SUS64_VWA1_VWB1_WGM8_WGMXCC1_WGMXCCGn1
    SolutionIndex: 36
    SolutionNameMin: Cijk_Alik_Bjlk_B8NSS_BH_Bias_HAS_SAV_UserArgs_MT128x256x128_MI16x16x1_SN_LDSB1_CLR1_GRVWA8_GRVWB16_GSU0_GSUC0_GSUWGMRR0_K1_LBSPPA512_LBSPPB2048_LPA8_LPB0_LRVW8_MIWT4_8_PLR1_SU0_SUM0_SUS128_VWA4_VWB8_WGM1_WGMXCC1_WGMXCCGn1
    SolutionIndex: 37
    SolutionNameMin: Cijk_Alik_Bjlk_B8NSS_BH_Bias_HAS_SAV_UserArgs_MT128x256x128_MI16x16x1_SN_LDSB1_CLR1_GRVWA16_GRVWB16_GSU0_GSUC0_GSUWGMRR0_K1_LBSPPA512_LBSPPB2048_LPA16_LPB0_LRVW8_MIWT4_8_PLR1_SU0_SUM0_SUS128_VWA4_VWB8_WGM1_WGMXCC1_WGMXCCGn1
    SolutionIndex: 38
    SolutionNameMin: Cijk_Alik_Bjlk_B8NSS_BH_Bias_HAS_SAV_UserArgs_MT128x256x128_MI16x16x1_SN_LDSB1_CLR1_GRVWA8_GRVWB16_GSU0_GSUC0_GSUWGMRR0_K1_LBSPPA512_LBSPPB2048_LPA8_LPB0_LRVW8_MIWT4_8_PLR1_SU0_SUM0_SUS128_VWA4_VWB8_WGM4_WGMXCC1_WGMXCCGn1
    SolutionIndex: 39
    SolutionNameMin: Cijk_Alik_Bjlk_B8NSS_BH_Bias_HAS_SAV_UserArgs_MT128x256x128_MI16x16x1_SN_LDSB1_CLR1_GRVWA16_GRVWB16_GSU0_GSUC0_GSUWGMRR0_K1_LBSPPA512_LBSPPB2048_LPA16_LPB0_LRVW8_MIWT4_8_PLR1_SU0_SUM0_SUS128_VWA4_VWB8_WGM4_WGMXCC1_WGMXCCGn1
    SolutionIndex: 40
    SolutionNameMin: Cijk_Alik_Bjlk_B8NSS_BH_Bias_HAS_SAV_UserArgs_MT128x256x128_MI16x16x1_SN_LDSB1_CLR1_GRVWA8_GRVWB16_GSU0_GSUC0_GSUWGMRR0_K1_LBSPPA512_LBSPPB2048_LPA8_LPB0_LRVW8_MIWT4_8_PLR1_SU0_SUM0_SUS128_VWA4_VWB8_WGM6_WGMXCC1_WGMXCCGn1
    SolutionIndex: 41
    SolutionNameMin: Cijk_Alik_Bjlk_B8NSS_BH_Bias_HAS_SAV_UserArgs_MT128x256x128_MI16x16x1_SN_LDSB1_CLR1_GRVWA16_GRVWB16_GSU0_GSUC0_GSUWGMRR0_K1_LBSPPA512_LBSPPB2048_LPA16_LPB0_LRVW8_MIWT4_8_PLR1_SU0_SUM0_SUS128_VWA4_VWB8_WGM6_WGMXCC1_WGMXCCGn1
    SolutionIndex: 42
    SolutionNameMin: Cijk_Alik_Bjlk_B8NSS_BH_Bias_HAS_SAV_UserArgs_MT128x256x128_MI16x16x1_SN_LDSB1_CLR1_GRVWA8_GRVWB16_GSU0_GSUC0_GSUWGMRR0_K1_LBSPPA512_LBSPPB2048_LPA8_LPB0_LRVW8_MIWT4_8_PLR1_SU0_SUM0_SUS128_VWA4_VWB8_WGM8_WGMXCC1_WGMXCCGn1
    SolutionIndex: 43
    SolutionNameMin: Cijk_Alik_Bjlk_B8NSS_BH_Bias_HAS_SAV_UserArgs_MT144x256x128_MI16x16x1_SN_LDSB1_CLR1_GRVWA8_GRVWB8_GSU0_GSUC0_GSUWGMRR0_K1_LBSPPA128_LBSPPB2048_LPA8_LPB64_LRVW8_MIWT9_4_PLR1_SU0_SUM0_SUS128_VWA1_VWB4_WGM1_WGMXCC1_WGMXCCGn1
    SolutionIndex: 44
    SolutionNameMin: Cijk_Alik_Bjlk_B8NSS_BH_Bias_HAS_SAV_UserArgs_MT144x256x128_MI16x16x1_SN_LDSB1_CLR1_GRVWA8_GRVWB16_GSU0_GSUC0_GSUWGMRR0_K1_LBSPPA128_LBSPPB2048_LPA8_LPB64_LRVW8_MIWT9_4_PLR1_SU0_SUM0_SUS128_VWA1_VWB4_WGM1_WGMXCC1_WGMXCCGn1
    SolutionIndex: 45
    SolutionNameMin: Cijk_Alik_Bjlk_B8NSS_BH_Bias_HAS_SAV_UserArgs_MT144x256x128_MI16x16x1_SN_LDSB1_CLR1_GRVWA8_GRVWB16_GSU0_GSUC0_GSUWGMRR0_K1_LBSPPA128_LBSPPB2048_LPA8_LPB64_LRVW8_MIWT9_4_PLR1_SU0_SUM0_SUS128_VWA1_VWB4_WGM4_WGMXCC1_WGMXCCGn1
    SolutionIndex: 46
    SolutionNameMin: Cijk_Alik_Bjlk_B8NSS_BH_Bias_HAS_SAV_UserArgs_MT144x256x128_MI16x16x1_SN_LDSB1_CLR1_GRVWA8_GRVWB16_GSU0_GSUC0_GSUWGMRR0_K1_LBSPPA128_LBSPPB2048_LPA8_LPB64_LRVW8_MIWT9_4_PLR1_SU0_SUM0_SUS128_VWA1_VWB4_WGM6_WGMXCC1_WGMXCCGn1
    SolutionIndex: 47
    SolutionNameMin: Cijk_Alik_Bjlk_B8NSS_BH_Bias_HAS_SAV_UserArgs_MT144x256x128_MI16x16x1_SN_LDSB1_CLR1_GRVWA8_GRVWB16_GSU0_GSUC0_GSUWGMRR0_K1_LBSPPA128_LBSPPB2048_LPA8_LPB64_LRVW8_MIWT9_4_PLR1_SU0_SUM0_SUS128_VWA1_VWB4_WGM8_WGMXCC1_WGMXCCGn1
    SolutionIndex: 48
    SolutionNameMin: Cijk_Alik_Bjlk_B8NSS_BH_Bias_HAS_SAV_UserArgs_MT144x64x128_MI16x16x1_SN_LDSB1_CLR1_GRVWA8_GRVWB16_GSU0_GSUC0_GSUWGMRR0_K1_LBSPPA128_LBSPPB512_LPA8_LPB16_LRVW8_MIWT9_1_PLR1_SU0_SUM0_SUS128_VWA1_VWB1_WGM4_WGMXCC1_WGMXCCGn1
    SolutionIndex: 49
    SolutionNameMin: Cijk_Alik_Bjlk_B8NSS_BH_Bias_HAS_SAV_UserArgs_MT144x64x128_MI16x16x1_SN_LDSB1_CLR1_GRVWA8_GRVWB8_GSU0_GSUC0_GSUWGMRR0_K1_LBSPPA128_LBSPPB512_LPA8_LPB16_LRVW8_MIWT9_1_PLR1_SU0_SUM0_SUS128_VWA1_VWB1_WGM6_WGMXCC1_WGMXCCGn1
    SolutionIndex: 50
    SolutionNameMin: Cijk_Alik_Bjlk_B8NSS_BH_Bias_HAS_SAV_UserArgs_MT144x64x128_MI16x16x1_SN_LDSB1_CLR1_GRVWA8_GRVWB8_GSU0_GSUC0_GSUWGMRR0_K1_LBSPPA128_LBSPPB512_LPA8_LPB16_LRVW8_MIWT9_1_PLR1_SU0_SUM0_SUS128_VWA1_VWB1_WGM8_WGMXCC1_WGMXCCGn1
    SolutionIndex: 51
    SolutionNameMin: Cijk_Alik_Bjlk_B8NSS_BH_Bias_HAS_SAV_UserArgs_MT144x64x128_MI16x16x1_SN_LDSB1_CLR1_GRVWA8_GRVWB16_GSU0_GSUC0_GSUWGMRR0_K1_LBSPPA128_LBSPPB512_LPA8_LPB16_LRVW8_MIWT9_1_PLR1_SU0_SUM0_SUS128_VWA1_VWB1_WGM8_WGMXCC1_WGMXCCGn1
    SolutionIndex: 52
    SolutionNameMin: Cijk_Alik_Bjlk_B8NSS_BH_Bias_HAS_SAV_UserArgs_MT144x128x128_MI16x16x1_SN_LDSB1_CLR1_GRVWA8_GRVWB16_GSU0_GSUC0_GSUWGMRR0_K1_LBSPPA128_LBSPPB1024_LPA8_LPB32_LRVW8_MIWT9_2_PLR1_SU0_SUM0_SUS128_VWA1_VWB2_WGM4_WGMXCC1_WGMXCCGn1
    SolutionIndex: 53
    SolutionNameMin: Cijk_Alik_Bjlk_B8NSS_BH_Bias_HAS_SAV_UserArgs_MT144x128x128_MI16x16x1_SN_LDSB1_CLR1_GRVWA8_GRVWB16_GSU0_GSUC0_GSUWGMRR0_K1_LBSPPA128_LBSPPB1024_LPA8_LPB32_LRVW8_MIWT9_2_PLR1_SU0_SUM0_SUS128_VWA1_VWB2_WGM6_WGMXCC1_WGMXCCGn1
    SolutionIndex: 54
    SolutionNameMin: Cijk_Alik_Bjlk_B8NSS_BH_Bias_HAS_SAV_UserArgs_MT144x128x128_MI16x16x1_SN_LDSB1_CLR1_GRVWA8_GRVWB16_GSU0_GSUC0_GSUWGMRR0_K1_LBSPPA128_LBSPPB1024_LPA8_LPB32_LRVW8_MIWT9_2_PLR1_SU0_SUM0_SUS128_VWA1_VWB2_WGM8_WGMXCC1_WGMXCCGn1
    SolutionIndex: 55
    SolutionNameMin: Cijk_Alik_Bjlk_B8NSS_BH_Bias_HAS_SAV_UserArgs_MT128x128x128_MI16x16x1_SN_LDSB1_CLR1_GRVWA16_GRVWB16_GSU0_GSUC0_GSUWGMRR0_K1_LBSPPA512_LBSPPB1024_LPA16_LPB64_LRVW8_MIWT4_4_PLR1_SU0_SUM0_SUS128_VWA4_VWB4_WGM1_WGMXCC1_WGMXCCGn1
    SolutionIndex: 56
    SolutionNameMin: Cijk_Alik_Bjlk_B8NSS_BH_Bias_HAS_SAV_UserArgs_MT128x128x128_MI16x16x1_SN_LDSB1_CLR1_GRVWA16_GRVWB16_GSU0_GSUC0_GSUWGMRR0_K1_LBSPPA512_LBSPPB1024_LPA16_LPB64_LRVW8_MIWT4_4_PLR1_SU0_SUM0_SUS128_VWA4_VWB4_WGM4_WGMXCC1_WGMXCCGn1
    SolutionIndex: 57
    SolutionNameMin: Cijk_Alik_Bjlk_B8NSS_BH_Bias_HAS_SAV_UserArgs_MT128x128x128_MI16x16x1_SN_LDSB1_CLR1_GRVWA16_GRVWB16_GSU0_GSUC0_GSUWGMRR0_K1_LBSPPA512_LBSPPB1024_LPA16_LPB64_LRVW8_MIWT4_4_PLR1_SU0_SUM0_SUS128_VWA4_VWB4_WGM6_WGMXCC1_WGMXCCGn1
    SolutionIndex: 58
    SolutionNameMin: Cijk_Alik_Bjlk_B8NSS_BH_Bias_HAS_SAV_UserArgs_MT128x128x128_MI16x16x1_SN_LDSB1_CLR1_GRVWA16_GRVWB16_GSU0_GSUC0_GSUWGMRR0_K1_LBSPPA512_LBSPPB1024_LPA16_LPB64_LRVW8_MIWT4_4_PLR1_SU0_SUM0_SUS128_VWA4_VWB4_WGM8_WGMXCC1_WGMXCCGn1
    SolutionIndex: 59
    SolutionNameMin: Cijk_Alik_Bjlk_B8NSS_BH_Bias_HAS_SAV_UserArgs_MT64x128x128_MI16x16x1_SN_LDSB1_CLR1_GRVWA8_GRVWB16_GSU0_GSUC0_GSUWGMRR0_K1_LBSPPA256_LBSPPB1024_LPA8_LPB64_LRVW8_MIWT2_4_PLR1_SU0_SUM0_SUS128_VWA2_VWB4_WGM1_WGMXCC1_WGMXCCGn1
    SolutionIndex: 60
    SolutionNameMin: Cijk_Alik_Bjlk_B8NSS_BH_Bias_HAS_SAV_UserArgs_MT64x128x128_MI16x16x1_SN_LDSB1_CLR1_GRVWA16_GRVWB16_GSU0_GSUC0_GSUWGMRR0_K1_LBSPPA256_LBSPPB1024_LPA16_LPB64_LRVW8_MIWT2_4_PLR1_SU0_SUM0_SUS128_VWA2_VWB4_WGM1_WGMXCC1_WGMXCCGn1
    SolutionIndex: 61
    SolutionNameMin: Cijk_Alik_Bjlk_B8NSS_BH_Bias_HAS_SAV_UserArgs_MT128x64x128_MI16x16x1_SN_LDSB1_CLR1_GRVWA16_GRVWB16_GSU0_GSUC0_GSUWGMRR0_K1_LBSPPA512_LBSPPB512_LPA16_LPB32_LRVW8_MIWT4_2_PLR1_SU0_SUM0_SUS128_VWA4_VWB2_WGM8_WGMXCC1_WGMXCCGn1
    SolutionIndex: 62
    SolutionNameMin: Cijk_Alik_Bjlk_B8NSS_BH_Bias_HAS_SAV_UserArgs_MT64x64x128_MI16x16x1_SN_LDSB1_CLR1_GRVWA16_GRVWB8_GSU0_GSUC0_GSUWGMRR0_K1_LBSPPA256_LBSPPB512_LPA16_LPB32_LRVW8_MIWT2_2_PLR1_SU0_SUM0_SUS128_VWA2_VWB2_WGM1_WGMXCC1_WGMXCCGn1
    SolutionIndex: 63
    SolutionNameMin: Cijk_Alik_Bjlk_B8NSS_BH_Bias_HAS_SAV_UserArgs_MT64x64x128_MI16x16x1_SN_LDSB1_CLR1_GRVWA8_GRVWB16_GSU0_GSUC0_GSUWGMRR0_K1_LBSPPA256_LBSPPB512_LPA8_LPB32_LRVW8_MIWT2_2_PLR1_SU0_SUM0_SUS128_VWA2_VWB2_WGM1_WGMXCC1_WGMXCCGn1
    SolutionIndex: 64
    SolutionNameMin: Cijk_Alik_Bjlk_B8NSS_BH_Bias_HAS_SAV_UserArgs_MT64x64x128_MI16x16x1_SN_LDSB1_CLR1_GRVWA16_GRVWB16_GSU0_GSUC0_GSUWGMRR0_K1_LBSPPA256_LBSPPB512_LPA16_LPB32_LRVW8_MIWT2_2_PLR1_SU0_SUM0_SUS128_VWA2_VWB2_WGM1_WGMXCC1_WGMXCCGn1
    SolutionIndex: 65
    SolutionNameMin: Cijk_Alik_Bjlk_B8NSS_BH_Bias_HAS_SAV_UserArgs_MT64x64x128_MI16x16x1_SN_LDSB1_CLR1_GRVWA8_GRVWB16_GSU0_GSUC0_GSUWGMRR0_K1_LBSPPA256_LBSPPB512_LPA8_LPB32_LRVW8_MIWT2_2_PLR1_SU0_SUM0_SUS128_VWA2_VWB2_WGM4_WGMXCC1_WGMXCCGn1
    SolutionIndex: 66
    SolutionNameMin: Cijk_Alik_Bjlk_B8NSS_BH_Bias_HAS_SAV_UserArgs_MT64x64x128_MI16x16x1_SN_LDSB1_CLR1_GRVWA8_GRVWB16_GSU0_GSUC0_GSUWGMRR0_K1_LBSPPA256_LBSPPB512_LPA8_LPB32_LRVW8_MIWT2_2_PLR1_SU0_SUM0_SUS128_VWA2_VWB2_WGM6_WGMXCC1_WGMXCCGn1
    SolutionIndex: 67
    SolutionNameMin: Cijk_Alik_Bjlk_B8NSS_BH_Bias_HAS_SAV_UserArgs_MT64x64x128_MI16x16x1_SN_LDSB1_CLR1_GRVWA16_GRVWB16_GSU0_GSUC0_GSUWGMRR0_K1_LBSPPA256_LBSPPB512_LPA16_LPB32_LRVW8_MIWT2_2_PLR1_SU0_SUM0_SUS128_VWA2_VWB2_WGM6_WGMXCC1_WGMXCCGn1
    SolutionIndex: 68
    SolutionNameMin: Cijk_Alik_Bjlk_B8NSS_BH_Bias_HAS_SAV_UserArgs_MT32x64x128_MI16x16x1_SN_LDSB0_CLR1_GRVWA8_GRVWB8_GSU0_GSUC0_GSUWGMRR0_K1_LBSPPA128_LBSPPB512_LPA8_LPB32_LRVW8_MIWT1_2_PLR1_SU0_SUM0_SUS128_VWA1_VWB2_WGM1_WGMXCC1_WGMXCCGn1
    SolutionIndex: 69
    SolutionNameMin: Cijk_Alik_Bjlk_B8NSS_BH_Bias_HAS_SAV_UserArgs_MT32x64x128_MI16x16x1_SN_LDSB0_CLR1_GRVWA8_GRVWB16_GSU0_GSUC0_GSUWGMRR0_K1_LBSPPA128_LBSPPB512_LPA8_LPB32_LRVW8_MIWT1_2_PLR1_SU0_SUM0_SUS128_VWA1_VWB2_WGM1_WGMXCC1_WGMXCCGn1
    SolutionIndex: 70
    SolutionNameMin: Cijk_Alik_Bjlk_B8NSS_BH_Bias_HAS_SAV_UserArgs_MT32x64x128_MI16x16x1_SN_LDSB0_CLR1_GRVWA8_GRVWB16_GSU0_GSUC0_GSUWGMRR0_K1_LBSPPA128_LBSPPB512_LPA8_LPB32_LRVW8_MIWT1_2_PLR1_SU0_SUM0_SUS128_VWA1_VWB2_WGM4_WGMXCC1_WGMXCCGn1
    SolutionIndex: 71
    SolutionNameMin: Cijk_Alik_Bjlk_B8NSS_BH_Bias_HAS_SAV_UserArgs_MT64x32x128_MI16x16x1_SN_LDSB0_CLR1_GRVWA8_GRVWB8_GSU0_GSUC0_GSUWGMRR0_K1_LBSPPA256_LBSPPB256_LPA8_LPB16_LRVW8_MIWT2_1_PLR1_SU0_SUM0_SUS128_VWA2_VWB1_WGM1_WGMXCC1_WGMXCCGn1
    SolutionIndex: 72
    SolutionNameMin: Cijk_Alik_Bjlk_B8NSS_BH_Bias_HAS_SAV_UserArgs_MT64x32x128_MI16x16x1_SN_LDSB0_CLR1_GRVWA16_GRVWB8_GSU0_GSUC0_GSUWGMRR0_K1_LBSPPA256_LBSPPB256_LPA16_LPB16_LRVW8_MIWT2_1_PLR1_SU0_SUM0_SUS128_VWA2_VWB1_WGM1_WGMXCC1_WGMXCCGn1
    SolutionIndex: 73
    SolutionNameMin: Cijk_Alik_Bjlk_B8NSS_BH_Bias_HAS_SAV_UserArgs_MT64x32x128_MI16x16x1_SN_LDSB0_CLR1_GRVWA8_GRVWB16_GSU0_GSUC0_GSUWGMRR0_K1_LBSPPA256_LBSPPB256_LPA8_LPB16_LRVW8_MIWT2_1_PLR1_SU0_SUM0_SUS128_VWA2_VWB1_WGM1_WGMXCC1_WGMXCCGn1
    SolutionIndex: 74
    SolutionNameMin: Cijk_Alik_Bjlk_B8NSS_BH_Bias_HAS_SAV_UserArgs_MT64x32x128_MI16x16x1_SN_LDSB0_CLR1_GRVWA8_GRVWB16_GSU0_GSUC0_GSUWGMRR0_K1_LBSPPA256_LBSPPB256_LPA8_LPB16_LRVW8_MIWT2_1_PLR1_SU0_SUM0_SUS128_VWA2_VWB1_WGM4_WGMXCC1_WGMXCCGn1
    SolutionIndex: 75
    SolutionNameMin: Cijk_Alik_Bjlk_B8NSS_BH_Bias_HAS_SAV_UserArgs_MT64x32x128_MI16x16x1_SN_LDSB0_CLR1_GRVWA8_GRVWB16_GSU0_GSUC0_GSUWGMRR0_K1_LBSPPA256_LBSPPB256_LPA8_LPB16_LRVW8_MIWT2_1_PLR1_SU0_SUM0_SUS128_VWA2_VWB1_WGM8_WGMXCC1_WGMXCCGn1
    SolutionIndex: 76
    SolutionNameMin: Cijk_Alik_Bjlk_B8NSS_BH_Bias_HAS_SAV_UserArgs_MT32x32x128_MI16x16x1_SN_LDSB0_CLR1_GRVWA8_GRVWB8_GSU0_GSUC0_GSUWGMRR0_K1_LBSPPA128_LBSPPB256_LPA8_LPB16_LRVW8_MIWT1_1_PLR1_SU0_SUM0_SUS128_VWA1_VWB1_WGM1_WGMXCC1_WGMXCCGn1
    SolutionIndex: 77
    SolutionNameMin: Cijk_Alik_Bjlk_B8NSS_BH_Bias_HAS_SAV_UserArgs_MT32x32x128_MI16x16x1_SN_LDSB0_CLR1_GRVWA16_GRVWB8_GSU0_GSUC0_GSUWGMRR0_K1_LBSPPA128_LBSPPB256_LPA16_LPB16_LRVW8_MIWT1_1_PLR1_SU0_SUM0_SUS128_VWA1_VWB1_WGM1_WGMXCC1_WGMXCCGn1
    SolutionIndex: 78
    SolutionNameMin: Cijk_Alik_Bjlk_B8NSS_BH_Bias_HAS_SAV_UserArgs_MT32x32x128_MI16x16x1_SN_LDSB0_CLR1_GRVWA8_GRVWB16_GSU0_GSUC0_GSUWGMRR0_K1_LBSPPA128_LBSPPB256_LPA8_LPB16_LRVW8_MIWT1_1_PLR1_SU0_SUM0_SUS128_VWA1_VWB1_WGM1_WGMXCC1_WGMXCCGn1
    SolutionIndex: 79
    SolutionNameMin: Cijk_Alik_Bjlk_B8NSS_BH_Bias_HAS_SAV_UserArgs_MT32x32x128_MI16x16x1_SN_LDSB0_CLR1_GRVWA8_GRVWB16_GSU0_GSUC0_GSUWGMRR0_K1_LBSPPA128_LBSPPB256_LPA8_LPB16_LRVW8_MIWT1_1_PLR1_SU0_SUM0_SUS128_VWA1_VWB1_WGM4_WGMXCC1_WGMXCCGn1
    SolutionIndex: 80
    SolutionNameMin: Cijk_Alik_Bjlk_B8NSS_BH_Bias_HAS_SAV_UserArgs_MT32x32x128_MI16x16x1_SN_LDSB0_CLR1_GRVWA8_GRVWB8_GSU0_GSUC0_GSUWGMRR0_K1_LBSPPA128_LBSPPB256_LPA8_LPB16_LRVW8_MIWT1_1_PLR1_SU0_SUM0_SUS128_VWA1_VWB1_WGM6_WGMXCC1_WGMXCCGn1
    SolutionIndex: 81
    SolutionNameMin: Cijk_Alik_Bjlk_B8NSS_BH_Bias_HAS_SAV_UserArgs_MT32x32x128_MI16x16x1_SN_LDSB0_CLR1_GRVWA8_GRVWB16_GSU0_GSUC0_GSUWGMRR0_K1_LBSPPA128_LBSPPB256_LPA8_LPB16_LRVW8_MIWT1_1_PLR1_SU0_SUM0_SUS128_VWA1_VWB1_WGM8_WGMXCC1_WGMXCCGn1
    SolutionIndex: 82
    SolutionNameMin: Cijk_Alik_Bjlk_B8NSS_BH_Bias_HAS_SAV_UserArgs_MT128x64x256_MI16x16x1_SN_LDSB1_CLR1_GRVWA16_GRVWB16_GSU0_GSUC0_GSUWGMRR0_K1_LBSPPA1024_LBSPPB512_LPA16_LPB32_LRVW8_MIWT4_2_PLR1_SU0_SUM0_SUS256_VWA4_VWB2_WGM1_WGMXCC1_WGMXCCGn1
    SolutionIndex: 83
    SolutionNameMin: Cijk_Alik_Bjlk_B8NSS_BH_Bias_HAS_SAV_UserArgs_MT128x64x256_MI16x16x1_SN_LDSB1_CLR1_GRVWA16_GRVWB16_GSU0_GSUC0_GSUWGMRR0_K1_LBSPPA1024_LBSPPB512_LPA16_LPB32_LRVW8_MIWT4_2_PLR1_SU0_SUM0_SUS256_VWA4_VWB2_WGM4_WGMXCC1_WGMXCCGn1
    SolutionIndex: 84
    SolutionNameMin: Cijk_Alik_Bjlk_B8NSS_BH_Bias_HAS_SAV_UserArgs_MT128x64x256_MI16x16x1_SN_LDSB1_CLR1_GRVWA16_GRVWB16_GSU0_GSUC0_GSUWGMRR0_K1_LBSPPA1024_LBSPPB512_LPA16_LPB32_LRVW8_MIWT4_2_PLR1_SU0_SUM0_SUS256_VWA4_VWB2_WGM6_WGMXCC1_WGMXCCGn1
    SolutionIndex: 85
    SolutionNameMin: Cijk_Alik_Bjlk_B8NSS_BH_Bias_HAS_SAV_UserArgs_MT128x64x256_MI16x16x1_SN_LDSB1_CLR1_GRVWA16_GRVWB16_GSU0_GSUC0_GSUWGMRR0_K1_LBSPPA1024_LBSPPB512_LPA16_LPB32_LRVW8_MIWT4_2_PLR1_SU0_SUM0_SUS256_VWA4_VWB2_WGM8_WGMXCC1_WGMXCCGn1
    SolutionIndex: 86
    SolutionNameMin: Cijk_Alik_Bjlk_B8NSS_BH_Bias_HAS_SAV_UserArgs_MT64x64x256_MI16x16x1_SN_LDSB1_CLR1_GRVWA16_GRVWB16_GSU0_GSUC0_GSUWGMRR0_K1_LBSPPA512_LBSPPB512_LPA16_LPB32_LRVW8_MIWT2_2_PLR1_SU0_SUM0_SUS256_VWA2_VWB2_WGM1_WGMXCC1_WGMXCCGn1
    SolutionIndex: 87
    SolutionNameMin: Cijk_Alik_Bjlk_B8NSS_BH_Bias_HAS_SAV_UserArgs_MT64x64x256_MI16x16x1_SN_LDSB1_CLR1_GRVWA16_GRVWB16_GSU0_GSUC0_GSUWGMRR0_K1_LBSPPA512_LBSPPB512_LPA16_LPB32_LRVW8_MIWT2_2_PLR1_SU0_SUM0_SUS256_VWA2_VWB2_WGM4_WGMXCC1_WGMXCCGn1
    SolutionIndex: 88
    SolutionNameMin: Cijk_Alik_Bjlk_B8NSS_BH_Bias_HAS_SAV_UserArgs_MT64x64x256_MI16x16x1_SN_LDSB1_CLR1_GRVWA16_GRVWB16_GSU0_GSUC0_GSUWGMRR0_K1_LBSPPA512_LBSPPB512_LPA16_LPB32_LRVW8_MIWT2_2_PLR1_SU0_SUM0_SUS256_VWA2_VWB2_WGM6_WGMXCC1_WGMXCCGn1
    SolutionIndex: 89
    SolutionNameMin: Cijk_Alik_Bjlk_B8NSS_BH_Bias_HAS_SAV_UserArgs_MT64x64x256_MI16x16x1_SN_LDSB1_CLR1_GRVWA16_GRVWB16_GSU0_GSUC0_GSUWGMRR0_K1_LBSPPA512_LBSPPB512_LPA16_LPB32_LRVW8_MIWT2_2_PLR1_SU0_SUM0_SUS256_VWA2_VWB2_WGM8_WGMXCC1_WGMXCCGn1
    SolutionIndex: 90
    SolutionNameMin: Cijk_Alik_Bjlk_B8NSS_BH_Bias_HAS_SAV_UserArgs_MT32x64x256_MI16x16x1_SN_LDSB1_CLR1_GRVWA16_GRVWB16_GSU0_GSUC0_GSUWGMRR0_K1_LBSPPA256_LBSPPB512_LPA16_LPB32_LRVW8_MIWT1_2_PLR1_SU0_SUM0_SUS256_VWA1_VWB2_WGM1_WGMXCC1_WGMXCCGn1
    SolutionIndex: 91
    SolutionNameMin: Cijk_Alik_Bjlk_B8NSS_BH_Bias_HAS_SAV_UserArgs_MT32x64x256_MI16x16x1_SN_LDSB1_CLR1_GRVWA16_GRVWB16_GSU0_GSUC0_GSUWGMRR0_K1_LBSPPA256_LBSPPB512_LPA16_LPB32_LRVW8_MIWT1_2_PLR1_SU0_SUM0_SUS256_VWA1_VWB2_WGM6_WGMXCC1_WGMXCCGn1
    SolutionIndex: 92
    SolutionNameMin: Cijk_Alik_Bjlk_B8NSS_BH_Bias_HAS_SAV_UserArgs_MT32x64x256_MI16x16x1_SN_LDSB1_CLR1_GRVWA8_GRVWB16_GSU0_GSUC0_GSUWGMRR0_K1_LBSPPA256_LBSPPB512_LPA8_LPB32_LRVW8_MIWT1_2_PLR1_SU0_SUM0_SUS256_VWA1_VWB2_WGM8_WGMXCC1_WGMXCCGn1
    SolutionIndex: 93
    SolutionNameMin: Cijk_Alik_Bjlk_B8NSS_BH_Bias_HAS_SAV_UserArgs_MT64x32x256_MI16x16x1_SN_LDSB1_CLR1_GRVWA16_GRVWB16_GSU0_GSUC0_GSUWGMRR0_K1_LBSPPA512_LBSPPB256_LPA16_LPB16_LRVW8_MIWT2_1_PLR1_SU0_SUM0_SUS256_VWA2_VWB1_WGM1_WGMXCC1_WGMXCCGn1
    SolutionIndex: 94
    SolutionNameMin: Cijk_Alik_Bjlk_B8NSS_BH_Bias_HAS_SAV_UserArgs_MT32x32x256_MI16x16x1_SN_LDSB1_CLR1_GRVWA16_GRVWB16_GSU0_GSUC0_GSUWGMRR0_K1_LBSPPA256_LBSPPB256_LPA16_LPB16_LRVW8_MIWT1_1_PLR1_SU0_SUM0_SUS256_VWA1_VWB1_WGM1_WGMXCC1_WGMXCCGn1
    SolutionIndex: 95
    SolutionNameMin: Cijk_Alik_Bjlk_B8NSS_BH_Bias_HAS_SAV_UserArgs_MT32x32x256_MI16x16x1_SN_LDSB1_CLR1_GRVWA16_GRVWB16_GSU0_GSUC0_GSUWGMRR0_K1_LBSPPA256_LBSPPB256_LPA16_LPB16_LRVW8_MIWT1_1_PLR1_SU0_SUM0_SUS256_VWA1_VWB1_WGM4_WGMXCC1_WGMXCCGn1
    SolutionIndex: 96
    SolutionNameMin: Cijk_Alik_Bjlk_B8NSS_BH_Bias_HAS_SAV_UserArgs_MT32x32x256_MI16x16x1_SN_LDSB1_CLR1_GRVWA16_GRVWB16_GSU0_GSUC0_GSUWGMRR0_K1_LBSPPA256_LBSPPB256_LPA16_LPB16_LRVW8_MIWT1_1_PLR1_SU0_SUM0_SUS256_VWA1_VWB1_WGM6_WGMXCC1_WGMXCCGn1
    SolutionIndex: 97
    SolutionNameMin: Cijk_Alik_Bjlk_B8NSS_BH_Bias_HAS_SAV_UserArgs_MT32x32x256_MI16x16x1_SN_LDSB1_CLR1_GRVWA16_GRVWB16_GSU0_GSUC0_GSUWGMRR0_K1_LBSPPA256_LBSPPB256_LPA16_LPB16_LRVW8_MIWT1_1_PLR1_SU0_SUM0_SUS256_VWA1_VWB1_WGM8_WGMXCC1_WGMXCCGn1
- - - [128, 128, 1, 128, 128, 128, 128, 128]
    - [34, 0.56]
  - - [128, 128, 1, 256, 128, 128, 256, 128]
    - [34, 1.01]
  - - [128, 128, 1, 512, 128, 128, 512, 128]
    - [76, 1.72]
  - - [128, 128, 1, 1024, 128, 128, 1024, 128]
    - [76, 2.7]
  - - [128, 128, 1, 2048, 128, 128, 2048, 128]
    - [78, 3.83]
  - - [128, 128, 1, 4096, 128, 128, 4096, 128]
    - [78, 4.82]
  - - [128, 128, 1, 8192, 128, 128, 8192, 128]
    - [79, 5.51]
  - - [128, 256, 1, 128, 128, 128, 128, 256]
    - [77, 1.14]
  - - [128, 256, 1, 256, 128, 128, 256, 256]
    - [76, 2.1]
  - - [128, 256, 1, 512, 128, 128, 512, 256]
    - [76, 3.52]
  - - [128, 256, 1, 1024, 128, 128, 1024, 256]
    - [76, 5.62]
  - - [128, 256, 1, 2048, 128, 128, 2048, 256]
    - [76, 7.78]
  - - [128, 256, 1, 4096, 128, 128, 4096, 256]
    - [78, 9.76]
  - - [128, 256, 1, 8192, 128, 128, 8192, 256]
    - [78, 11.13]
  - - [128, 512, 1, 128, 128, 128, 128, 512]
    - [77, 2.24]
  - - [128, 512, 1, 256, 128, 128, 256, 512]
    - [77, 4.03]
  - - [128, 512, 1, 512, 128, 128, 512, 512]
    - [76, 7.12]
  - - [128, 512, 1, 1024, 128, 128, 1024, 512]
    - [76, 10.94]
  - - [128, 512, 1, 2048, 128, 128, 2048, 512]
    - [78, 15.37]
  - - [128, 512, 1, 4096, 128, 128, 4096, 512]
    - [78, 19.35]
  - - [128, 512, 1, 8192, 128, 128, 8192, 512]
    - [95, 17.51]
  - - [128, 1024, 1, 128, 128, 128, 128, 1024]
    - [76, 4.22]
  - - [128, 1024, 1, 256, 128, 128, 256, 1024]
    - [76, 7.74]
  - - [128, 1024, 1, 512, 128, 128, 512, 1024]
    - [76, 13.42]
  - - [128, 1024, 1, 1024, 128, 128, 1024, 1024]
    - [76, 21.32]
  - - [128, 1024, 1, 2048, 128, 128, 2048, 1024]
    - [78, 29.72]
  - - [128, 1024, 1, 4096, 128, 128, 4096, 1024]
    - [94, 30.54]
  - - [128, 1024, 1, 8192, 128, 128, 8192, 1024]
    - [96, 32.45]
  - - [128, 2048, 1, 128, 128, 128, 128, 2048]
    - [68, 7.8]
  - - [128, 2048, 1, 256, 128, 128, 256, 2048]
    - [73, 13.89]
  - - [128, 2048, 1, 512, 128, 128, 512, 2048]
    - [71, 23.95]
  - - [128, 2048, 1, 1024, 128, 128, 1024, 2048]
    - [73, 37.18]
  - - [128, 2048, 1, 2048, 128, 128, 2048, 2048]
    - [90, 43.14]
  - - [128, 2048, 1, 4096, 128, 128, 4096, 2048]
    - [90, 52.2]
  - - [128, 2048, 1, 8192, 128, 128, 8192, 2048]
    - [91, 58.92]
  - - [128, 4096, 1, 128, 128, 128, 128, 4096]
    - [29, 13.34]
  - - [128, 4096, 1, 256, 128, 128, 256, 4096]
    - [29, 23.89]
  - - [128, 4096, 1, 512, 128, 128, 512, 4096]
    - [62, 39.14]
  - - [128, 4096, 1, 1024, 128, 128, 1024, 4096]
    - [63, 60.28]
  - - [128, 4096, 1, 2048, 128, 128, 2048, 4096]
    - [88, 74.54]
  - - [128, 4096, 1, 4096, 128, 128, 4096, 4096]
    - [86, 94.16]
  - - [128, 4096, 1, 8192, 128, 128, 8192, 4096]
    - [86, 106.47]
  - - [128, 8192, 1, 128, 128, 128, 128, 8192]
    - [19, 21.33]
  - - [128, 8192, 1, 256, 128, 128, 256, 8192]
    - [19, 38.24]
  - - [128, 8192, 1, 512, 128, 128, 512, 8192]
    - [20, 63.46]
  - - [128, 8192, 1, 1024, 128, 128, 1024, 8192]
    - [28, 94.89]
  - - [128, 8192, 1, 2048, 128, 128, 2048, 8192]
    - [59, 114.65]
  - - [128, 8192, 1, 4096, 128, 128, 4096, 8192]
    - [60, 138.43]
  - - [128, 8192, 1, 8192, 128, 128, 8192, 8192]
    - [83, 149.21]
  - - [256, 128, 1, 128, 256, 256, 128, 128]
    - [34, 1.05]
  - - [256, 128, 1, 256, 256, 256, 256, 128]
    - [76, 2.01]
  - - [256, 128, 1, 512, 256, 256, 512, 128]
    - [78, 3.39]
  - - [256, 128, 1, 1024, 256, 256, 1024, 128]
    - [78, 5.49]
  - - [256, 128, 1, 2048, 256, 256, 2048, 128]
    - [78, 7.7]
  - - [256, 128, 1, 4096, 256, 256, 4096, 128]
    - [78, 9.67]
  - - [256, 128, 1, 8192, 256, 256, 8192, 128]
    - [78, 11.06]
  - - [256, 256, 1, 128, 256, 256, 128, 256]
    - [34, 2.08]
  - - [256, 256, 1, 256, 256, 256, 256, 256]
    - [34, 3.91]
  - - [256, 256, 1, 512, 256, 256, 512, 256]
    - [76, 6.8]
  - - [256, 256, 1, 1024, 256, 256, 1024, 256]
    - [78, 10.74]
  - - [256, 256, 1, 2048, 256, 256, 2048, 256]
    - [78, 15.21]
  - - [256, 256, 1, 4096, 256, 256, 4096, 256]
    - [78, 19.23]
  - - [256, 256, 1, 8192, 256, 256, 8192, 256]
    - [79, 21.86]
  - - [256, 512, 1, 128, 256, 256, 128, 512]
    - [35, 4.05]
  - - [256, 512, 1, 256, 256, 256, 256, 512]
    - [76, 7.72]
  - - [256, 512, 1, 512, 256, 256, 512, 512]
    - [76, 13.33]
  - - [256, 512, 1, 1024, 256, 256, 1024, 512]
    - [76, 21.21]
  - - [256, 512, 1, 2048, 256, 256, 2048, 512]
    - [76, 29.63]
  - - [256, 512, 1, 4096, 256, 256, 4096, 512]
    - [78, 37.53]
  - - [256, 512, 1, 8192, 256, 256, 8192, 512]
    - [97, 37.92]
  - - [256, 1024, 1, 128, 256, 256, 128, 1024]
    - [71, 7.73]
  - - [256, 1024, 1, 256, 256, 256, 256, 1024]
    - [72, 13.82]
  - - [256, 1024, 1, 512, 256, 256, 512, 1024]
    - [71, 23.53]
  - - [256, 1024, 1, 1024, 256, 256, 1024, 1024]
    - [73, 36.32]
  - - [256, 1024, 1, 2048, 256, 256, 2048, 1024]
    - [73, 50.46]
  - - [256, 1024, 1, 4096, 256, 256, 4096, 1024]
    - [93, 57.76]
  - - [256, 1024, 1, 8192, 256, 256, 8192, 1024]
    - [91, 59.79]
  - - [256, 2048, 1, 128, 256, 256, 128, 2048]
    - [29, 13.1]
  - - [256, 2048, 1, 256, 256, 256, 256, 2048]
    - [31, 23.63]
  - - [256, 2048, 1, 512, 256, 256, 512, 2048]
    - [64, 39.65]
  - - [256, 2048, 1, 1024, 256, 256, 1024, 2048]
    - [63, 60.58]
  - - [256, 2048, 1, 2048, 256, 256, 2048, 2048]
    - [86, 76.95]
  - - [256, 2048, 1, 4096, 256, 256, 4096, 2048]
    - [86, 94.48]
  - - [256, 2048, 1, 8192, 256, 256, 8192, 2048]
    - [87, 106.15]
  - - [256, 4096, 1, 128, 256, 256, 128, 4096]
    - [23, 20.76]
  - - [256, 4096, 1, 256, 256, 256, 256, 4096]
    - [28, 37.25]
  - - [256, 4096, 1, 512, 256, 256, 512, 4096]
    - [28, 62.26]
  - - [256, 4096, 1, 1024, 256, 256, 1024, 4096]
    - [22, 94.41]
  - - [256, 4096, 1, 2048, 256, 256, 2048, 4096]
    - [82, 117.96]
  - - [256, 4096, 1, 4096, 256, 256, 4096, 4096]
    - [82, 144.11]
  - - [256, 4096, 1, 8192, 256, 256, 8192, 4096]
    - [82, 159.97]
  - - [256, 8192, 1, 128, 256, 256, 128, 8192]
    - [15, 30.94]
  - - [256, 8192, 1, 256, 256, 256, 256, 8192]
    - [15, 54.72]
  - - [256, 8192, 1, 512, 256, 256, 512, 8192]
    - [15, 88.81]
  - - [256, 8192, 1, 1024, 256, 256, 1024, 8192]
    - [55, 131.63]
  - - [256, 8192, 1, 2048, 256, 256, 2048, 8192]
    - [55, 165.82]
  - - [256, 8192, 1, 4096, 256, 256, 4096, 8192]
    - [55, 198.19]
  - - [256, 8192, 1, 8192, 256, 256, 8192, 8192]
    - [55, 195.7]
  - - [512, 128, 1, 128, 512, 512, 128, 128]
    - [80, 2.1]
  - - [512, 128, 1, 256, 512, 512, 256, 128]
    - [76, 3.9]
  - - [512, 128, 1, 512, 512, 512, 512, 128]
    - [76, 6.81]
  - - [512, 128, 1, 1024, 512, 512, 1024, 128]
    - [76, 10.73]
  - - [512, 128, 1, 2048, 512, 512, 2048, 128]
    - [76, 15.17]
  - - [512, 128, 1, 4096, 512, 512, 4096, 128]
    - [78, 19.15]
  - - [512, 128, 1, 8192, 512, 512, 8192, 128]
    - [81, 21.87]
  - - [512, 256, 1, 128, 512, 512, 128, 256]
    - [76, 4.06]
  - - [512, 256, 1, 256, 512, 512, 256, 256]
    - [77, 7.54]
  - - [512, 256, 1, 512, 512, 512, 512, 256]
    - [76, 13.37]
  - - [512, 256, 1, 1024, 512, 512, 1024, 256]
    - [76, 21.61]
  - - [512, 256, 1, 2048, 512, 512, 2048, 256]
    - [78, 30.06]
  - - [512, 256, 1, 4096, 512, 512, 4096, 256]
    - [78, 37.66]
  - - [512, 256, 1, 8192, 512, 512, 8192, 256]
    - [81, 42.99]
  - - [512, 512, 1, 128, 512, 512, 128, 512]
    - [71, 7.75]
  - - [512, 512, 1, 256, 512, 512, 256, 512]
    - [68, 13.88]
  - - [512, 512, 1, 512, 512, 512, 512, 512]
    - [71, 23.61]
  - - [512, 512, 1, 1024, 512, 512, 1024, 512]
    - [73, 36.24]
  - - [512, 512, 1, 2048, 512, 512, 2048, 512]
    - [73, 50.77]
  - - [512, 512, 1, 4096, 512, 512, 4096, 512]
    - [74, 62.53]
  - - [512, 512, 1, 8192, 512, 512, 8192, 512]
    - [70, 63.72]
  - - [512, 1024, 1, 128, 512, 512, 128, 1024]
    - [29, 13.17]
  - - [512, 1024, 1, 256, 512, 512, 256, 1024]
    - [30, 23.85]
  - - [512, 1024, 1, 512, 512, 512, 512, 1024]
    - [64, 39.83]
  - - [512, 1024, 1, 1024, 512, 512, 1024, 1024]
    - [66, 60.64]
  - - [512, 1024, 1, 2048, 512, 512, 2048, 1024]
    - [86, 83.54]
  - - [512, 1024, 1, 4096, 512, 512, 4096, 1024]
    - [88, 94.84]
  - - [512, 1024, 1, 8192, 512, 512, 8192, 1024]
    - [88, 104.83]
  - - [512, 2048, 1, 128, 512, 512, 128, 2048]
    - [19, 21.37]
  - - [512, 2048, 1, 256, 512, 512, 256, 2048]
    - [21, 37.98]
  - - [512, 2048, 1, 512, 512, 512, 512, 2048]
    - [20, 63.34]
  - - [512, 2048, 1, 1024, 512, 512, 1024, 2048]
    - [20, 95.66]
  - - [512, 2048, 1, 2048, 512, 512, 2048, 2048]
    - [82, 121.33]
  - - [512, 2048, 1, 4096, 512, 512, 4096, 2048]
    - [82, 148.17]
  - - [512, 2048, 1, 8192, 512, 512, 8192, 2048]
    - [82, 156.37]
  - - [512, 4096, 1, 128, 512, 512, 128, 4096]
    - [15, 30.85]
  - - [512, 4096, 1, 256, 512, 512, 256, 4096]
    - [18, 55.79]
  - - [512, 4096, 1, 512, 512, 512, 512, 4096]
    - [15, 87.87]
  - - [512, 4096, 1, 1024, 512, 512, 1024, 4096]
    - [55, 132.25]
  - - [512, 4096, 1, 2048, 512, 512, 2048, 4096]
    - [55, 174.04]
  - - [512, 4096, 1, 4096, 512, 512, 4096, 4096]
    - [56, 203.7]
  - - [512, 4096, 1, 8192, 512, 512, 8192, 4096]
    - [56, 195.67]
  - - [512, 8192, 1, 128, 512, 512, 128, 8192]
    - [9, 39.42]
  - - [512, 8192, 1, 256, 512, 512, 256, 8192]
    - [8, 69.88]
  - - [512, 8192, 1, 512, 512, 512, 512, 8192]
    - [9, 114.88]
  - - [512, 8192, 1, 1024, 512, 512, 1024, 8192]
    - [5, 164.09]
  - - [512, 8192, 1, 2048, 512, 512, 2048, 8192]
    - [5, 212.73]
  - - [512, 8192, 1, 4096, 512, 512, 4096, 8192]
    - [39, 233.77]
  - - [512, 8192, 1, 8192, 512, 512, 8192, 8192]
    - [36, 232.97]
  - - [1024, 128, 1, 128, 1024, 1024, 128, 128]
    - [76, 4.27]
  - - [1024, 128, 1, 256, 1024, 1024, 256, 128]
    - [34, 7.81]
  - - [1024, 128, 1, 512, 1024, 1024, 512, 128]
    - [76, 13.27]
  - - [1024, 128, 1, 1024, 1024, 1024, 1024, 128]
    - [76, 21.02]
  - - [1024, 128, 1, 2048, 1024, 1024, 2048, 128]
    - [76, 29.8]
  - - [1024, 128, 1, 4096, 1024, 1024, 4096, 128]
    - [78, 37.55]
  - - [1024, 128, 1, 8192, 1024, 1024, 8192, 128]
    - [81, 43.1]
  - - [1024, 256, 1, 128, 1024, 1024, 128, 256]
    - [72, 7.64]
  - - [1024, 256, 1, 256, 1024, 1024, 256, 256]
    - [72, 13.73]
  - - [1024, 256, 1, 512, 1024, 1024, 512, 256]
    - [72, 23.15]
  - - [1024, 256, 1, 1024, 1024, 1024, 1024, 256]
    - [73, 36.2]
  - - [1024, 256, 1, 2048, 1024, 1024, 2048, 256]
    - [73, 50.65]
  - - [1024, 256, 1, 4096, 1024, 1024, 4096, 256]
    - [75, 62.44]
  - - [1024, 256, 1, 8192, 1024, 1024, 8192, 256]
    - [92, 70.48]
  - - [1024, 512, 1, 128, 1024, 1024, 128, 512]
    - [32, 12.96]
  - - [1024, 512, 1, 256, 1024, 1024, 256, 512]
    - [30, 23.19]
  - - [1024, 512, 1, 512, 1024, 1024, 512, 512]
    - [67, 39.03]
  - - [1024, 512, 1, 1024, 1024, 1024, 1024, 512]
    - [63, 60.08]
  - - [1024, 512, 1, 2048, 1024, 1024, 2048, 512]
    - [88, 82.71]
  - - [1024, 512, 1, 4096, 1024, 1024, 4096, 512]
    - [87, 100.7]
  - - [1024, 512, 1, 8192, 1024, 1024, 8192, 512]
    - [89, 106.49]
  - - [1024, 1024, 1, 128, 1024, 1024, 128, 1024]
    - [25, 21.05]
  - - [1024, 1024, 1, 256, 1024, 1024, 256, 1024]
    - [24, 37.93]
  - - [1024, 1024, 1, 512, 1024, 1024, 512, 1024]
    - [26, 63.13]
  - - [1024, 1024, 1, 1024, 1024, 1024, 1024, 1024]
    - [28, 95.29]
  - - [1024, 1024, 1, 2048, 1024, 1024, 2048, 1024]
    - [84, 120.9]
  - - [1024, 1024, 1, 4096, 1024, 1024, 4096, 1024]
    - [83, 142.86]
  - - [1024, 1024, 1, 8192, 1024, 1024, 8192, 1024]
    - [84, 156.49]
  - - [1024, 2048, 1, 128, 1024, 1024, 128, 2048]
    - [15, 31.08]
  - - [1024, 2048, 1, 256, 1024, 1024, 256, 2048]
    - [14, 55.19]
  - - [1024, 2048, 1, 512, 1024, 1024, 512, 2048]
    - [55, 87.84]
  - - [1024, 2048, 1, 1024, 1024, 1024, 1024, 2048]
    - [55, 132.09]
  - - [1024, 2048, 1, 2048, 1024, 1024, 2048, 2048]
    - [55, 172.5]
  - - [1024, 2048, 1, 4096, 1024, 1024, 4096, 2048]
    - [57, 201.37]
  - - [1024, 2048, 1, 8192, 1024, 1024, 8192, 2048]
    - [56, 195.13]
  - - [1024, 4096, 1, 128, 1024, 1024, 128, 4096]
    - [9, 38.23]
  - - [1024, 4096, 1, 256, 1024, 1024, 256, 4096]
    - [8, 68.47]
  - - [1024, 4096, 1, 512, 1024, 1024, 512, 4096]
    - [9, 112.15]
  - - [1024, 4096, 1, 1024, 1024, 1024, 1024, 4096]
    - [5, 165.04]
  - - [1024, 4096, 1, 2048, 1024, 1024, 2048, 4096]
    - [39, 213.11]
  - - [1024, 4096, 1, 4096, 1024, 1024, 4096, 4096]
    - [37, 236.43]
  - - [1024, 4096, 1, 8192, 1024, 1024, 8192, 4096]
    - [37, 231.95]
  - - [1024, 8192, 1, 128, 1024, 1024, 128, 8192]
    - [3, 40.45]
  - - [1024, 8192, 1, 256, 1024, 1024, 256, 8192]
    - [4, 72.89]
  - - [1024, 8192, 1, 512, 1024, 1024, 512, 8192]
    - [6, 120.65]
  - - [1024, 8192, 1, 1024, 1024, 1024, 1024, 8192]
    - [1, 173.05]
  - - [1024, 8192, 1, 2048, 1024, 1024, 2048, 8192]
    - [1, 218.26]
  - - [1024, 8192, 1, 4096, 1024, 1024, 4096, 8192]
    - [40, 243.89]
  - - [1024, 8192, 1, 8192, 1024, 1024, 8192, 8192]
    - [0, 269.18]
  - - [2048, 128, 1, 128, 2048, 2048, 128, 128]
    - [33, 7.71]
  - - [2048, 128, 1, 256, 2048, 2048, 256, 128]
    - [68, 13.8]
  - - [2048, 128, 1, 512, 2048, 2048, 512, 128]
    - [69, 23.52]
  - - [2048, 128, 1, 1024, 2048, 2048, 1024, 128]
    - [71, 35.91]
  - - [2048, 128, 1, 2048, 2048, 2048, 2048, 128]
    - [73, 50.39]
  - - [2048, 128, 1, 4096, 2048, 2048, 4096, 128]
    - [74, 62.51]
  - - [2048, 128, 1, 8192, 2048, 2048, 8192, 128]
    - [92, 70.4]
  - - [2048, 256, 1, 128, 2048, 2048, 128, 256]
    - [62, 13.27]
  - - [2048, 256, 1, 256, 2048, 2048, 256, 256]
    - [31, 23.8]
  - - [2048, 256, 1, 512, 2048, 2048, 512, 256]
    - [63, 39.99]
  - - [2048, 256, 1, 1024, 2048, 2048, 1024, 256]
    - [63, 61.32]
  - - [2048, 256, 1, 2048, 2048, 2048, 2048, 256]
    - [86, 83.08]
  - - [2048, 256, 1, 4096, 2048, 2048, 4096, 256]
    - [88, 102.98]
  - - [2048, 256, 1, 8192, 2048, 2048, 8192, 256]
    - [88, 114.68]
  - - [2048, 512, 1, 128, 2048, 2048, 128, 512]
    - [19, 21.83]
  - - [2048, 512, 1, 256, 2048, 2048, 256, 512]
    - [19, 38.77]
  - - [2048, 512, 1, 512, 2048, 2048, 512, 512]
    - [20, 64.45]
  - - [2048, 512, 1, 1024, 2048, 2048, 1024, 512]
    - [28, 95.24]
  - - [2048, 512, 1, 2048, 2048, 2048, 2048, 512]
    - [28, 127.33]
  - - [2048, 512, 1, 4096, 2048, 2048, 4096, 512]
    - [83, 141.03]
  - - [2048, 512, 1, 8192, 2048, 2048, 8192, 512]
    - [85, 151.29]
  - - [2048, 1024, 1, 128, 2048, 2048, 128, 1024]
    - [13, 30.76]
  - - [2048, 1024, 1, 256, 2048, 2048, 256, 1024]
    - [15, 54.85]
  - - [2048, 1024, 1, 512, 2048, 2048, 512, 1024]
    - [14, 87.94]
  - - [2048, 1024, 1, 1024, 2048, 2048, 1024, 1024]
    - [56, 129.36]
  - - [2048, 1024, 1, 2048, 2048, 2048, 2048, 1024]
    - [56, 168.09]
  - - [2048, 1024, 1, 4096, 2048, 2048, 4096, 1024]
    - [57, 193.7]
  - - [2048, 1024, 1, 8192, 2048, 2048, 8192, 1024]
    - [56, 196.65]
  - - [2048, 2048, 1, 128, 2048, 2048, 128, 2048]
    - [9, 37.23]
  - - [2048, 2048, 1, 256, 2048, 2048, 256, 2048]
    - [5, 66.61]
  - - [2048, 2048, 1, 512, 2048, 2048, 512, 2048]
    - [8, 109.17]
  - - [2048, 2048, 1, 1024, 2048, 2048, 1024, 2048]
    - [5, 160.55]
  - - [2048, 2048, 1, 2048, 2048, 2048, 2048, 2048]
    - [45, 215.66]
  - - [2048, 2048, 1, 4096, 2048, 2048, 4096, 2048]
    - [38, 235.85]
  - - [2048, 2048, 1, 8192, 2048, 2048, 8192, 2048]
    - [45, 235.23]
  - - [2048, 4096, 1, 128, 2048, 2048, 128, 4096]
    - [3, 38.39]
  - - [2048, 4096, 1, 256, 2048, 2048, 256, 4096]
    - [6, 69.94]
  - - [2048, 4096, 1, 512, 2048, 2048, 512, 4096]
    - [5, 116.02]
  - - [2048, 4096, 1, 1024, 2048, 2048, 1024, 4096]
    - [5, 170.03]
  - - [2048, 4096, 1, 2048, 2048, 2048, 2048, 4096]
    - [1, 213.92]
  - - [2048, 4096, 1, 4096, 2048, 2048, 4096, 4096]
    - [40, 244.5]
  - - [2048, 4096, 1, 8192, 2048, 2048, 8192, 4096]
    - [36, 268.2]
  - - [2048, 8192, 1, 128, 2048, 2048, 128, 8192]
    - [43, 44.69]
  - - [2048, 8192, 1, 256, 2048, 2048, 256, 8192]
    - [43, 78.6]
  - - [2048, 8192, 1, 512, 2048, 2048, 512, 8192]
    - [45, 132.94]
  - - [2048, 8192, 1, 1024, 2048, 2048, 1024, 8192]
    - [44, 181.42]
  - - [2048, 8192, 1, 2048, 2048, 2048, 2048, 8192]
    - [44, 219.12]
  - - [2048, 8192, 1, 4096, 2048, 2048, 4096, 8192]
    - [5, 266.46]
  - - [2048, 8192, 1, 8192, 2048, 2048, 8192, 8192]
    - [45, 298.85]
  - - [4096, 128, 1, 128, 4096, 4096, 128, 128]
    - [29, 13.23]
  - - [4096, 128, 1, 256, 4096, 4096, 256, 128]
    - [30, 23.55]
  - - [4096, 128, 1, 512, 4096, 4096, 512, 128]
    - [63, 39.54]
  - - [4096, 128, 1, 1024, 4096, 4096, 1024, 128]
    - [65, 60.19]
  - - [4096, 128, 1, 2048, 4096, 4096, 2048, 128]
    - [65, 82.88]
  - - [4096, 128, 1, 4096, 4096, 4096, 4096, 128]
    - [89, 102.56]
  - - [4096, 128, 1, 8192, 4096, 4096, 8192, 128]
    - [88, 114.71]
  - - [4096, 256, 1, 128, 4096, 4096, 128, 256]
    - [19, 21.37]
  - - [4096, 256, 1, 256, 4096, 4096, 256, 256]
    - [19, 38.96]
  - - [4096, 256, 1, 512, 4096, 4096, 512, 256]
    - [20, 63.96]
  - - [4096, 256, 1, 1024, 4096, 4096, 1024, 256]
    - [28, 95.74]
  - - [4096, 256, 1, 2048, 4096, 4096, 2048, 256]
    - [26, 127.79]
  - - [4096, 256, 1, 4096, 4096, 4096, 4096, 256]
    - [61, 141.57]
  - - [4096, 256, 1, 8192, 4096, 4096, 8192, 256]
    - [83, 155.38]
  - - [4096, 512, 1, 128, 4096, 4096, 128, 512]
    - [15, 29.66]
  - - [4096, 512, 1, 256, 4096, 4096, 256, 512]
    - [18, 53.21]
  - - [4096, 512, 1, 512, 4096, 4096, 512, 512]
    - [17, 85.28]
  - - [4096, 512, 1, 1024, 4096, 4096, 1024, 512]
    - [58, 129.24]
  - - [4096, 512, 1, 2048, 4096, 4096, 2048, 512]
    - [56, 172.64]
  - - [4096, 512, 1, 4096, 4096, 4096, 4096, 512]
    - [57, 190.42]
  - - [4096, 512, 1, 8192, 4096, 4096, 8192, 512]
    - [56, 197.04]
  - - [4096, 1024, 1, 128, 4096, 4096, 128, 1024]
    - [7, 36.35]
  - - [4096, 1024, 1, 256, 4096, 4096, 256, 1024]
    - [10, 65.07]
  - - [4096, 1024, 1, 512, 4096, 4096, 512, 1024]
    - [10, 106.94]
  - - [4096, 1024, 1, 1024, 4096, 4096, 1024, 1024]
    - [42, 162.38]
  - - [4096, 1024, 1, 2048, 4096, 4096, 2048, 1024]
    - [42, 208.75]
  - - [4096, 1024, 1, 4096, 4096, 4096, 4096, 1024]
    - [47, 240.18]
  - - [4096, 1024, 1, 8192, 4096, 4096, 8192, 1024]
    - [45, 237.6]
  - - [4096, 2048, 1, 128, 4096, 4096, 128, 2048]
    - [11, 36.52]
  - - [4096, 2048, 1, 256, 4096, 4096, 256, 2048]
    - [12, 66.16]
  - - [4096, 2048, 1, 512, 4096, 4096, 512, 2048]
    - [6, 112.63]
  - - [4096, 2048, 1, 1024, 4096, 4096, 1024, 2048]
    - [38, 165.14]
  - - [4096, 2048, 1, 2048, 4096, 4096, 2048, 2048]
    - [2, 210.68]
  - - [4096, 2048, 1, 4096, 4096, 4096, 4096, 2048]
    - [47, 257.02]
  - - [4096, 2048, 1, 8192, 4096, 4096, 8192, 2048]
    - [44, 278.84]
  - - [4096, 4096, 1, 128, 4096, 4096, 128, 4096]
    - [4, 40.13]
  - - [4096, 4096, 1, 256, 4096, 4096, 256, 4096]
    - [3, 71.34]
  - - [4096, 4096, 1, 512, 4096, 4096, 512, 4096]
    - [16, 118.15]
  - - [4096, 4096, 1, 1024, 4096, 4096, 1024, 4096]
    - [58, 162.48]
  - - [4096, 4096, 1, 2048, 4096, 4096, 2048, 4096]
    - [44, 219.65]
  - - [4096, 4096, 1, 4096, 4096, 4096, 4096, 4096]
    - [45, 277.61]
  - - [4096, 4096, 1, 8192, 4096, 4096, 8192, 4096]
    - [44, 307.65]
  - - [4096, 8192, 1, 128, 4096, 4096, 128, 8192]
    - [27, 39.85]
  - - [4096, 8192, 1, 256, 4096, 4096, 256, 8192]
    - [15, 75.28]
  - - [4096, 8192, 1, 512, 4096, 4096, 512, 8192]
    - [5, 122.98]
  - - [4096, 8192, 1, 1024, 4096, 4096, 1024, 8192]
    - [44, 173.0]
  - - [4096, 8192, 1, 2048, 4096, 4096, 2048, 8192]
    - [41, 226.76]
  - - [4096, 8192, 1, 4096, 4096, 4096, 4096, 8192]
    - [0, 284.74]
  - - [4096, 8192, 1, 8192, 4096, 4096, 8192, 8192]
    - [44, 333.76]
  - - [8192, 128, 1, 128, 8192, 8192, 128, 128]
    - [19, 21.38]
  - - [8192, 128, 1, 256, 8192, 8192, 256, 128]
    - [19, 38.07]
  - - [8192, 128, 1, 512, 8192, 8192, 512, 128]
    - [20, 63.27]
  - - [8192, 128, 1, 1024, 8192, 8192, 1024, 128]
    - [22, 94.2]
  - - [8192, 128, 1, 2048, 8192, 8192, 2048, 128]
    - [83, 119.93]
  - - [8192, 128, 1, 4096, 8192, 8192, 4096, 128]
    - [59, 139.99]
  - - [8192, 128, 1, 8192, 8192, 8192, 8192, 128]
    - [84, 153.66]
  - - [8192, 256, 1, 128, 8192, 8192, 128, 256]
    - [50, 31.46]
  - - [8192, 256, 1, 256, 8192, 8192, 256, 256]
    - [49, 56.56]
  - - [8192, 256, 1, 512, 8192, 8192, 512, 256]
    - [51, 93.92]
  - - [8192, 256, 1, 1024, 8192, 8192, 1024, 256]
    - [48, 136.55]
  - - [8192, 256, 1, 2048, 8192, 8192, 2048, 256]
    - [58, 162.75]
  - - [8192, 256, 1, 4096, 8192, 8192, 4096, 256]
    - [57, 188.35]
  - - [8192, 256, 1, 8192, 8192, 8192, 8192, 256]
    - [56, 195.06]
  - - [8192, 512, 1, 128, 8192, 8192, 128, 512]
    - [52, 40.28]
  - - [8192, 512, 1, 256, 8192, 8192, 256, 512]
    - [52, 72.74]
  - - [8192, 512, 1, 512, 8192, 8192, 512, 512]
    - [53, 120.97]
  - - [8192, 512, 1, 1024, 8192, 8192, 1024, 512]
    - [53, 175.87]
  - - [8192, 512, 1, 2048, 8192, 8192, 2048, 512]
    - [53, 218.06]
  - - [8192, 512, 1, 4096, 8192, 8192, 4096, 512]
    - [54, 255.07]
  - - [8192, 512, 1, 8192, 8192, 8192, 8192, 512]
    - [54, 254.64]
  - - [8192, 1024, 1, 128, 8192, 8192, 128, 1024]
    - [44, 42.29]
  - - [8192, 1024, 1, 256, 8192, 8192, 256, 1024]
    - [44, 77.41]
  - - [8192, 1024, 1, 512, 8192, 8192, 512, 1024]
    - [45, 132.7]
  - - [8192, 1024, 1, 1024, 8192, 8192, 1024, 1024]
    - [47, 192.6]
  - - [8192, 1024, 1, 2048, 8192, 8192, 2048, 1024]
    - [45, 274.74]
  - - [8192, 1024, 1, 4096, 8192, 8192, 4096, 1024]
    - [47, 322.68]
  - - [8192, 1024, 1, 8192, 8192, 8192, 8192, 1024]
    - [45, 353.01]
  - - [8192, 2048, 1, 128, 8192, 8192, 128, 2048]
    - [43, 47.07]
  - - [8192, 2048, 1, 256, 8192, 8192, 256, 2048]
    - [45, 84.28]
  - - [8192, 2048, 1, 512, 8192, 8192, 512, 2048]
    - [46, 142.47]
  - - [8192, 2048, 1, 1024, 8192, 8192, 1024, 2048]
    - [45, 211.92]
  - - [8192, 2048, 1, 2048, 8192, 8192, 2048, 2048]
    - [46, 261.31]
  - - [8192, 2048, 1, 4096, 8192, 8192, 4096, 2048]
    - [45, 316.89]
  - - [8192, 2048, 1, 8192, 8192, 8192, 8192, 2048]
    - [45, 365.35]
  - - [8192, 4096, 1, 128, 8192, 8192, 128, 4096]
    - [44, 43.79]
  - - [8192, 4096, 1, 256, 8192, 8192, 256, 4096]
    - [44, 78.32]
  - - [8192, 4096, 1, 512, 8192, 8192, 512, 4096]
    - [46, 128.45]
  - - [8192, 4096, 1, 1024, 8192, 8192, 1024, 4096]
    - [44, 181.0]
  - - [8192, 4096, 1, 2048, 8192, 8192, 2048, 4096]
    - [44, 255.63]
  - - [8192, 4096, 1, 4096, 8192, 8192, 4096, 4096]
    - [45, 317.21]
  - - [8192, 4096, 1, 8192, 8192, 8192, 8192, 4096]
    - [45, 378.09]
  - - [8192, 8192, 1, 128, 8192, 8192, 128, 8192]
    - [17, 39.5]
  - - [8192, 8192, 1, 256, 8192, 8192, 256, 8192]
    - [4, 73.12]
  - - [8192, 8192, 1, 512, 8192, 8192, 512, 8192]
    - [45, 118.89]
  - - [8192, 8192, 1, 1024, 8192, 8192, 1024, 8192]
    - [44, 185.34]
  - - [8192, 8192, 1, 2048, 8192, 8192, 2048, 8192]
    - [45, 255.2]
  - - [8192, 8192, 1, 4096, 8192, 8192, 4096, 8192]
    - [47, 327.65]
  - - [8192, 8192, 1, 8192, 8192, 8192, 8192, 8192]
    - [45, 379.88]
- null
- null
- ExperimentalStreamK
- GridBased
