projects/hipblaslt/library/src/amd_detail/rocblaslt/src/Tensile/Logic/asm_full/aquavanjaram/gfx942_228cu/StreamK/aquavanjaram942_Cijk_Alik_Bjlk_B8F8NBS_BH_Bias_HAS_SAV_UserArgs.yaml
- {MinimumRequiredVersion: 4.33.0}
- aquavanjaram942
- {Architecture: gfx942, CUCount: 228}
- [Device 0049, Device 0050]
    SolutionIndex: 0
    SolutionNameMin: Cijk_Alik_Bjlk_B8F8NBS_BH_Bias_HAS_SAV_UserArgs_MT256x256x64_MI16x16x1_SN_LDSB1_CLR1_GRVWA8_GRVWB16_GSU0_GSUC0_GSUWGMRR0_K1_LBSPPA512_LBSPPB2048_LPA8_LPB0_LRVW8_MIWT8_8_PLR1_SU0_SUM0_SUS64_VWA8_VWB8_WGM1_WGMXCC1_WGMXCCGn1
    SolutionIndex: 1
    SolutionNameMin: Cijk_Alik_Bjlk_B8F8NBS_BH_Bias_HAS_SAV_UserArgs_MT256x256x64_MI16x16x1_SN_LDSB1_CLR1_GRVWA16_GRVWB16_GSU0_GSUC0_GSUWGMRR0_K1_LBSPPA512_LBSPPB2048_LPA16_LPB0_LRVW8_MIWT8_8_PLR1_SU0_SUM0_SUS64_VWA8_VWB8_WGM1_WGMXCC1_WGMXCCGn1
    SolutionIndex: 2
    SolutionNameMin: Cijk_Alik_Bjlk_B8F8NBS_BH_Bias_HAS_SAV_UserArgs_MT256x256x64_MI16x16x1_SN_LDSB1_CLR1_GRVWA8_GRVWB16_GSU0_GSUC0_GSUWGMRR0_K1_LBSPPA512_LBSPPB2048_LPA8_LPB0_LRVW8_MIWT8_8_PLR1_SU0_SUM0_SUS64_VWA8_VWB8_WGM4_WGMXCC1_WGMXCCGn1
    SolutionIndex: 3
    SolutionNameMin: Cijk_Alik_Bjlk_B8F8NBS_BH_Bias_HAS_SAV_UserArgs_MT256x256x64_MI16x16x1_SN_LDSB1_CLR1_GRVWA16_GRVWB16_GSU0_GSUC0_GSUWGMRR0_K1_LBSPPA512_LBSPPB2048_LPA16_LPB0_LRVW8_MIWT8_8_PLR1_SU0_SUM0_SUS64_VWA8_VWB8_WGM4_WGMXCC1_WGMXCCGn1
    SolutionIndex: 4
    SolutionNameMin: Cijk_Alik_Bjlk_B8F8NBS_BH_Bias_HAS_SAV_UserArgs_MT256x256x64_MI16x16x1_SN_LDSB1_CLR1_GRVWA8_GRVWB16_GSU0_GSUC0_GSUWGMRR0_K1_LBSPPA512_LBSPPB2048_LPA8_LPB0_LRVW8_MIWT8_8_PLR1_SU0_SUM0_SUS64_VWA8_VWB8_WGM6_WGMXCC1_WGMXCCGn1
    SolutionIndex: 5
    SolutionNameMin: Cijk_Alik_Bjlk_B8F8NBS_BH_Bias_HAS_SAV_UserArgs_MT256x256x64_MI16x16x1_SN_LDSB1_CLR1_GRVWA16_GRVWB16_GSU0_GSUC0_GSUWGMRR0_K1_LBSPPA512_LBSPPB2048_LPA16_LPB0_LRVW8_MIWT8_8_PLR1_SU0_SUM0_SUS64_VWA8_VWB8_WGM6_WGMXCC1_WGMXCCGn1
    SolutionIndex: 6
    SolutionNameMin: Cijk_Alik_Bjlk_B8F8NBS_BH_Bias_HAS_SAV_UserArgs_MT256x256x64_MI16x16x1_SN_LDSB1_CLR1_GRVWA8_GRVWB16_GSU0_GSUC0_GSUWGMRR0_K1_LBSPPA512_LBSPPB2048_LPA8_LPB0_LRVW8_MIWT8_8_PLR1_SU0_SUM0_SUS64_VWA8_VWB8_WGM8_WGMXCC1_WGMXCCGn1
    SolutionIndex: 7
    SolutionNameMin: Cijk_Alik_Bjlk_B8F8NBS_BH_Bias_HAS_SAV_UserArgs_MT256x256x64_MI16x16x1_SN_LDSB1_CLR1_GRVWA16_GRVWB16_GSU0_GSUC0_GSUWGMRR0_K1_LBSPPA512_LBSPPB2048_LPA16_LPB0_LRVW8_MIWT8_8_PLR1_SU0_SUM0_SUS64_VWA8_VWB8_WGM8_WGMXCC1_WGMXCCGn1
    SolutionIndex: 8
    SolutionNameMin: Cijk_Alik_Bjlk_B8F8NBS_BH_Bias_HAS_SAV_UserArgs_MT128x256x64_MI16x16x1_SN_LDSB1_CLR1_GRVWA8_GRVWB16_GSU0_GSUC0_GSUWGMRR0_K1_LBSPPA256_LBSPPB2048_LPA8_LPB0_LRVW8_MIWT4_8_PLR1_SU0_SUM0_SUS64_VWA4_VWB8_WGM1_WGMXCC1_WGMXCCGn1
    SolutionIndex: 9
    SolutionNameMin: Cijk_Alik_Bjlk_B8F8NBS_BH_Bias_HAS_SAV_UserArgs_MT128x256x64_MI16x16x1_SN_LDSB1_CLR1_GRVWA8_GRVWB16_GSU0_GSUC0_GSUWGMRR0_K1_LBSPPA256_LBSPPB2048_LPA8_LPB0_LRVW8_MIWT4_8_PLR1_SU0_SUM0_SUS64_VWA4_VWB8_WGM4_WGMXCC1_WGMXCCGn1
    SolutionIndex: 10
    SolutionNameMin: Cijk_Alik_Bjlk_B8F8NBS_BH_Bias_HAS_SAV_UserArgs_MT128x256x64_MI16x16x1_SN_LDSB1_CLR1_GRVWA8_GRVWB16_GSU0_GSUC0_GSUWGMRR0_K1_LBSPPA256_LBSPPB2048_LPA8_LPB0_LRVW8_MIWT4_8_PLR1_SU0_SUM0_SUS64_VWA4_VWB8_WGM6_WGMXCC1_WGMXCCGn1
    SolutionIndex: 11
    SolutionNameMin: Cijk_Alik_Bjlk_B8F8NBS_BH_Bias_HAS_SAV_UserArgs_MT256x128x64_MI16x16x1_SN_LDSB1_CLR1_GRVWA8_GRVWB8_GSU0_GSUC0_GSUWGMRR0_K1_LBSPPA512_LBSPPB1024_LPA8_LPB64_LRVW8_MIWT8_4_PLR1_SU0_SUM0_SUS64_VWA8_VWB4_WGM1_WGMXCC1_WGMXCCGn1
    SolutionIndex: 12
    SolutionNameMin: Cijk_Alik_Bjlk_B8F8NBS_BH_Bias_HAS_SAV_UserArgs_MT256x128x64_MI16x16x1_SN_LDSB1_CLR1_GRVWA16_GRVWB8_GSU0_GSUC0_GSUWGMRR0_K1_LBSPPA512_LBSPPB1024_LPA16_LPB64_LRVW8_MIWT8_4_PLR1_SU0_SUM0_SUS64_VWA8_VWB4_WGM1_WGMXCC1_WGMXCCGn1
    SolutionIndex: 13
    SolutionNameMin: Cijk_Alik_Bjlk_B8F8NBS_BH_Bias_HAS_SAV_UserArgs_MT256x128x64_MI16x16x1_SN_LDSB1_CLR1_GRVWA8_GRVWB16_GSU0_GSUC0_GSUWGMRR0_K1_LBSPPA512_LBSPPB1024_LPA8_LPB64_LRVW8_MIWT8_4_PLR1_SU0_SUM0_SUS64_VWA8_VWB4_WGM1_WGMXCC1_WGMXCCGn1
    SolutionIndex: 14
    SolutionNameMin: Cijk_Alik_Bjlk_B8F8NBS_BH_Bias_HAS_SAV_UserArgs_MT256x128x64_MI16x16x1_SN_LDSB1_CLR1_GRVWA16_GRVWB8_GSU0_GSUC0_GSUWGMRR0_K1_LBSPPA512_LBSPPB1024_LPA16_LPB64_LRVW8_MIWT8_4_PLR1_SU0_SUM0_SUS64_VWA8_VWB4_WGM4_WGMXCC1_WGMXCCGn1
    SolutionIndex: 15
    SolutionNameMin: Cijk_Alik_Bjlk_B8F8NBS_BH_Bias_HAS_SAV_UserArgs_MT256x128x64_MI16x16x1_SN_LDSB1_CLR1_GRVWA8_GRVWB16_GSU0_GSUC0_GSUWGMRR0_K1_LBSPPA512_LBSPPB1024_LPA8_LPB64_LRVW8_MIWT8_4_PLR1_SU0_SUM0_SUS64_VWA8_VWB4_WGM6_WGMXCC1_WGMXCCGn1
    SolutionIndex: 16
    SolutionNameMin: Cijk_Alik_Bjlk_B8F8NBS_BH_Bias_HAS_SAV_UserArgs_MT256x128x64_MI16x16x1_SN_LDSB1_CLR1_GRVWA8_GRVWB8_GSU0_GSUC0_GSUWGMRR0_K1_LBSPPA512_LBSPPB1024_LPA8_LPB64_LRVW8_MIWT8_4_PLR1_SU0_SUM0_SUS64_VWA8_VWB4_WGM8_WGMXCC1_WGMXCCGn1
    SolutionIndex: 17
    SolutionNameMin: Cijk_Alik_Bjlk_B8F8NBS_BH_Bias_HAS_SAV_UserArgs_MT256x128x64_MI16x16x1_SN_LDSB1_CLR1_GRVWA16_GRVWB8_GSU0_GSUC0_GSUWGMRR0_K1_LBSPPA512_LBSPPB1024_LPA16_LPB64_LRVW8_MIWT8_4_PLR1_SU0_SUM0_SUS64_VWA8_VWB4_WGM8_WGMXCC1_WGMXCCGn1
    SolutionIndex: 18
    SolutionNameMin: Cijk_Alik_Bjlk_B8F8NBS_BH_Bias_HAS_SAV_UserArgs_MT128x128x64_MI16x16x1_SN_LDSB1_CLR1_GRVWA8_GRVWB16_GSU0_GSUC0_GSUWGMRR0_K1_LBSPPA512_LBSPPB1024_LPA8_LPB32_LRVW8_MIWT8_2_PLR1_SU0_SUM0_SUS64_VWA8_VWB2_WGM1_WGMXCC1_WGMXCCGn1
    SolutionIndex: 19
    SolutionNameMin: Cijk_Alik_Bjlk_B8F8NBS_BH_Bias_HAS_SAV_UserArgs_MT128x128x64_MI16x16x1_SN_LDSB1_CLR1_GRVWA8_GRVWB16_GSU0_GSUC0_GSUWGMRR0_K1_LBSPPA512_LBSPPB1024_LPA8_LPB32_LRVW8_MIWT8_2_PLR1_SU0_SUM0_SUS64_VWA8_VWB2_WGM4_WGMXCC1_WGMXCCGn1
    SolutionIndex: 20
    SolutionNameMin: Cijk_Alik_Bjlk_B8F8NBS_BH_Bias_HAS_SAV_UserArgs_MT128x128x64_MI16x16x1_SN_LDSB1_CLR1_GRVWA8_GRVWB16_GSU0_GSUC0_GSUWGMRR0_K1_LBSPPA512_LBSPPB1024_LPA8_LPB32_LRVW8_MIWT8_2_PLR1_SU0_SUM0_SUS64_VWA8_VWB2_WGM6_WGMXCC1_WGMXCCGn1
    SolutionIndex: 21
    SolutionNameMin: Cijk_Alik_Bjlk_B8F8NBS_BH_Bias_HAS_SAV_UserArgs_MT128x128x64_MI16x16x1_SN_LDSB1_CLR1_GRVWA8_GRVWB16_GSU0_GSUC0_GSUWGMRR0_K1_LBSPPA512_LBSPPB1024_LPA8_LPB32_LRVW8_MIWT8_2_PLR1_SU0_SUM0_SUS64_VWA8_VWB2_WGM8_WGMXCC1_WGMXCCGn1
    SolutionIndex: 22
    SolutionNameMin: Cijk_Alik_Bjlk_B8F8NBS_BH_Bias_HAS_SAV_UserArgs_MT128x64x64_MI16x16x1_SN_LDSB0_CLR1_GRVWA8_GRVWB8_GSU0_GSUC0_GSUWGMRR0_K1_LBSPPA512_LBSPPB512_LPA8_LPB16_LRVW8_MIWT8_1_PLR1_SU0_SUM0_SUS64_VWA8_VWB1_WGM1_WGMXCC1_WGMXCCGn1
    SolutionIndex: 23
    SolutionNameMin: Cijk_Alik_Bjlk_B8F8NBS_BH_Bias_HAS_SAV_UserArgs_MT128x64x64_MI16x16x1_SN_LDSB0_CLR1_GRVWA8_GRVWB16_GSU0_GSUC0_GSUWGMRR0_K1_LBSPPA512_LBSPPB512_LPA8_LPB16_LRVW8_MIWT8_1_PLR1_SU0_SUM0_SUS64_VWA8_VWB1_WGM1_WGMXCC1_WGMXCCGn1
    SolutionIndex: 24
    SolutionNameMin: Cijk_Alik_Bjlk_B8F8NBS_BH_Bias_HAS_SAV_UserArgs_MT64x128x64_MI16x16x1_SN_LDSB0_CLR1_GRVWA8_GRVWB16_GSU0_GSUC0_GSUWGMRR0_K1_LBSPPA128_LBSPPB1024_LPA8_LPB64_LRVW8_MIWT2_4_PLR1_SU0_SUM0_SUS64_VWA2_VWB4_WGM4_WGMXCC1_WGMXCCGn1
    SolutionIndex: 25
    SolutionNameMin: Cijk_Alik_Bjlk_B8F8NBS_BH_Bias_HAS_SAV_UserArgs_MT128x64x64_MI16x16x1_SN_LDSB0_CLR1_GRVWA8_GRVWB8_GSU0_GSUC0_GSUWGMRR0_K1_LBSPPA256_LBSPPB512_LPA8_LPB32_LRVW8_MIWT4_2_PLR1_SU0_SUM0_SUS64_VWA4_VWB2_WGM1_WGMXCC1_WGMXCCGn1
    SolutionIndex: 26
    SolutionNameMin: Cijk_Alik_Bjlk_B8F8NBS_BH_Bias_HAS_SAV_UserArgs_MT128x64x64_MI16x16x1_SN_LDSB0_CLR1_GRVWA16_GRVWB8_GSU0_GSUC0_GSUWGMRR0_K1_LBSPPA256_LBSPPB512_LPA16_LPB32_LRVW8_MIWT4_2_PLR1_SU0_SUM0_SUS64_VWA4_VWB2_WGM1_WGMXCC1_WGMXCCGn1
    SolutionIndex: 27
    SolutionNameMin: Cijk_Alik_Bjlk_B8F8NBS_BH_Bias_HAS_SAV_UserArgs_MT128x64x64_MI16x16x1_SN_LDSB0_CLR1_GRVWA8_GRVWB16_GSU0_GSUC0_GSUWGMRR0_K1_LBSPPA256_LBSPPB512_LPA8_LPB32_LRVW8_MIWT4_2_PLR1_SU0_SUM0_SUS64_VWA4_VWB2_WGM1_WGMXCC1_WGMXCCGn1
    SolutionIndex: 28
    SolutionNameMin: Cijk_Alik_Bjlk_B8F8NBS_BH_Bias_HAS_SAV_UserArgs_MT128x64x64_MI16x16x1_SN_LDSB0_CLR1_GRVWA16_GRVWB16_GSU0_GSUC0_GSUWGMRR0_K1_LBSPPA256_LBSPPB512_LPA16_LPB32_LRVW8_MIWT4_2_PLR1_SU0_SUM0_SUS64_VWA4_VWB2_WGM1_WGMXCC1_WGMXCCGn1
    SolutionIndex: 29
    SolutionNameMin: Cijk_Alik_Bjlk_B8F8NBS_BH_Bias_HAS_SAV_UserArgs_MT128x64x64_MI16x16x1_SN_LDSB0_CLR1_GRVWA8_GRVWB8_GSU0_GSUC0_GSUWGMRR0_K1_LBSPPA256_LBSPPB512_LPA8_LPB32_LRVW8_MIWT4_2_PLR1_SU0_SUM0_SUS64_VWA4_VWB2_WGM4_WGMXCC1_WGMXCCGn1
    SolutionIndex: 30
    SolutionNameMin: Cijk_Alik_Bjlk_B8F8NBS_BH_Bias_HAS_SAV_UserArgs_MT128x64x64_MI16x16x1_SN_LDSB0_CLR1_GRVWA8_GRVWB16_GSU0_GSUC0_GSUWGMRR0_K1_LBSPPA256_LBSPPB512_LPA8_LPB32_LRVW8_MIWT4_2_PLR1_SU0_SUM0_SUS64_VWA4_VWB2_WGM4_WGMXCC1_WGMXCCGn1
    SolutionIndex: 31
    SolutionNameMin: Cijk_Alik_Bjlk_B8F8NBS_BH_Bias_HAS_SAV_UserArgs_MT128x64x64_MI16x16x1_SN_LDSB0_CLR1_GRVWA8_GRVWB8_GSU0_GSUC0_GSUWGMRR0_K1_LBSPPA256_LBSPPB512_LPA8_LPB32_LRVW8_MIWT4_2_PLR1_SU0_SUM0_SUS64_VWA4_VWB2_WGM6_WGMXCC1_WGMXCCGn1
    SolutionIndex: 32
    SolutionNameMin: Cijk_Alik_Bjlk_B8F8NBS_BH_Bias_HAS_SAV_UserArgs_MT128x64x64_MI16x16x1_SN_LDSB0_CLR1_GRVWA16_GRVWB8_GSU0_GSUC0_GSUWGMRR0_K1_LBSPPA256_LBSPPB512_LPA16_LPB32_LRVW8_MIWT4_2_PLR1_SU0_SUM0_SUS64_VWA4_VWB2_WGM6_WGMXCC1_WGMXCCGn1
    SolutionIndex: 33
    SolutionNameMin: Cijk_Alik_Bjlk_B8F8NBS_BH_Bias_HAS_SAV_UserArgs_MT128x64x64_MI16x16x1_SN_LDSB0_CLR1_GRVWA8_GRVWB16_GSU0_GSUC0_GSUWGMRR0_K1_LBSPPA256_LBSPPB512_LPA8_LPB32_LRVW8_MIWT4_2_PLR1_SU0_SUM0_SUS64_VWA4_VWB2_WGM6_WGMXCC1_WGMXCCGn1
    SolutionIndex: 34
    SolutionNameMin: Cijk_Alik_Bjlk_B8F8NBS_BH_Bias_HAS_SAV_UserArgs_MT128x64x64_MI16x16x1_SN_LDSB0_CLR1_GRVWA8_GRVWB16_GSU0_GSUC0_GSUWGMRR0_K1_LBSPPA256_LBSPPB512_LPA8_LPB32_LRVW8_MIWT4_2_PLR1_SU0_SUM0_SUS64_VWA4_VWB2_WGM8_WGMXCC1_WGMXCCGn1
    SolutionIndex: 35
    SolutionNameMin: Cijk_Alik_Bjlk_B8F8NBS_BH_Bias_HAS_SAV_UserArgs_MT32x128x64_MI16x16x1_SN_LDSB0_CLR1_GRVWA8_GRVWB16_GSU0_GSUC0_GSUWGMRR0_K1_LBSPPA128_LBSPPB1024_LPA8_LPB64_LRVW8_MIWT1_4_PLR1_SU0_SUM0_SUS64_VWA1_VWB4_WGM1_WGMXCC1_WGMXCCGn1
    SolutionIndex: 36
    SolutionNameMin: Cijk_Alik_Bjlk_B8F8NBS_BH_Bias_HAS_SAV_UserArgs_MT64x64x64_MI16x16x1_SN_LDSB0_CLR1_GRVWA8_GRVWB8_GSU0_GSUC0_GSUWGMRR0_K1_LBSPPA128_LBSPPB512_LPA8_LPB32_LRVW8_MIWT2_2_PLR1_SU0_SUM0_SUS64_VWA2_VWB2_WGM1_WGMXCC1_WGMXCCGn1
    SolutionIndex: 37
    SolutionNameMin: Cijk_Alik_Bjlk_B8F8NBS_BH_Bias_HAS_SAV_UserArgs_MT64x64x64_MI16x16x1_SN_LDSB0_CLR1_GRVWA16_GRVWB8_GSU0_GSUC0_GSUWGMRR0_K1_LBSPPA128_LBSPPB512_LPA16_LPB32_LRVW8_MIWT2_2_PLR1_SU0_SUM0_SUS64_VWA2_VWB2_WGM1_WGMXCC1_WGMXCCGn1
    SolutionIndex: 38
    SolutionNameMin: Cijk_Alik_Bjlk_B8F8NBS_BH_Bias_HAS_SAV_UserArgs_MT64x64x64_MI16x16x1_SN_LDSB0_CLR1_GRVWA16_GRVWB8_GSU0_GSUC0_GSUWGMRR0_K1_LBSPPA128_LBSPPB512_LPA16_LPB32_LRVW8_MIWT2_2_PLR1_SU0_SUM0_SUS64_VWA2_VWB2_WGM4_WGMXCC1_WGMXCCGn1
    SolutionIndex: 39
    SolutionNameMin: Cijk_Alik_Bjlk_B8F8NBS_BH_Bias_HAS_SAV_UserArgs_MT32x64x64_MI16x16x1_SN_LDSB0_CLR1_GRVWA8_GRVWB8_GSU0_GSUC0_GSUWGMRR0_K1_LBSPPA128_LBSPPB512_LPA8_LPB32_LRVW8_MIWT1_2_PLR1_SU0_SUM0_SUS64_VWA1_VWB2_WGM4_WGMXCC1_WGMXCCGn1
    SolutionIndex: 40
    SolutionNameMin: Cijk_Alik_Bjlk_B8F8NBS_BH_Bias_HAS_SAV_UserArgs_MT32x64x64_MI16x16x1_SN_LDSB0_CLR1_GRVWA8_GRVWB8_GSU0_GSUC0_GSUWGMRR0_K1_LBSPPA128_LBSPPB512_LPA8_LPB32_LRVW8_MIWT1_2_PLR1_SU0_SUM0_SUS64_VWA1_VWB2_WGM6_WGMXCC1_WGMXCCGn1
    SolutionIndex: 41
    SolutionNameMin: Cijk_Alik_Bjlk_B8F8NBS_BH_Bias_HAS_SAV_UserArgs_MT64x32x64_MI16x16x1_SN_LDSB0_CLR1_GRVWA8_GRVWB8_GSU0_GSUC0_GSUWGMRR0_K1_LBSPPA128_LBSPPB256_LPA8_LPB16_LRVW8_MIWT2_1_PLR1_SU0_SUM0_SUS64_VWA2_VWB1_WGM1_WGMXCC1_WGMXCCGn1
    SolutionIndex: 42
    SolutionNameMin: Cijk_Alik_Bjlk_B8F8NBS_BH_Bias_HAS_SAV_UserArgs_MT32x32x64_MI16x16x1_SN_LDSB0_CLR1_GRVWA8_GRVWB8_GSU0_GSUC0_GSUWGMRR0_K1_LBSPPA128_LBSPPB256_LPA8_LPB16_LRVW8_MIWT1_1_PLR1_SU0_SUM0_SUS64_VWA1_VWB1_WGM1_WGMXCC1_WGMXCCGn1
    SolutionIndex: 43
    SolutionNameMin: Cijk_Alik_Bjlk_B8F8NBS_BH_Bias_HAS_SAV_UserArgs_MT128x256x128_MI16x16x1_SN_LDSB1_CLR1_GRVWA8_GRVWB16_GSU0_GSUC0_GSUWGMRR0_K1_LBSPPA512_LBSPPB2048_LPA8_LPB0_LRVW8_MIWT4_8_PLR1_SU0_SUM0_SUS128_VWA4_VWB8_WGM4_WGMXCC1_WGMXCCGn1
    SolutionIndex: 44
    SolutionNameMin: Cijk_Alik_Bjlk_B8F8NBS_BH_Bias_HAS_SAV_UserArgs_MT128x256x128_MI16x16x1_SN_LDSB1_CLR1_GRVWA8_GRVWB16_GSU0_GSUC0_GSUWGMRR0_K1_LBSPPA512_LBSPPB2048_LPA8_LPB0_LRVW8_MIWT4_8_PLR1_SU0_SUM0_SUS128_VWA4_VWB8_WGM6_WGMXCC1_WGMXCCGn1
    SolutionIndex: 45
    SolutionNameMin: Cijk_Alik_Bjlk_B8F8NBS_BH_Bias_HAS_SAV_UserArgs_MT128x256x128_MI16x16x1_SN_LDSB1_CLR1_GRVWA8_GRVWB16_GSU0_GSUC0_GSUWGMRR0_K1_LBSPPA512_LBSPPB2048_LPA8_LPB0_LRVW8_MIWT4_8_PLR1_SU0_SUM0_SUS128_VWA4_VWB8_WGM8_WGMXCC1_WGMXCCGn1
    SolutionIndex: 46
    SolutionNameMin: Cijk_Alik_Bjlk_B8F8NBS_BH_Bias_HAS_SAV_UserArgs_MT256x128x128_MI16x16x1_SN_LDSB1_CLR1_GRVWA8_GRVWB16_GSU0_GSUC0_GSUWGMRR0_K1_LBSPPA1024_LBSPPB1024_LPA8_LPB64_LRVW8_MIWT8_4_PLR1_SU0_SUM0_SUS128_VWA8_VWB4_WGM1_WGMXCC1_WGMXCCGn1
    SolutionIndex: 47
    SolutionNameMin: Cijk_Alik_Bjlk_B8F8NBS_BH_Bias_HAS_SAV_UserArgs_MT256x128x128_MI16x16x1_SN_LDSB1_CLR1_GRVWA16_GRVWB16_GSU0_GSUC0_GSUWGMRR0_K1_LBSPPA1024_LBSPPB1024_LPA16_LPB64_LRVW8_MIWT8_4_PLR1_SU0_SUM0_SUS128_VWA8_VWB4_WGM1_WGMXCC1_WGMXCCGn1
    SolutionIndex: 48
    SolutionNameMin: Cijk_Alik_Bjlk_B8F8NBS_BH_Bias_HAS_SAV_UserArgs_MT256x128x128_MI16x16x1_SN_LDSB1_CLR1_GRVWA8_GRVWB16_GSU0_GSUC0_GSUWGMRR0_K1_LBSPPA1024_LBSPPB1024_LPA8_LPB64_LRVW8_MIWT8_4_PLR1_SU0_SUM0_SUS128_VWA8_VWB4_WGM4_WGMXCC1_WGMXCCGn1
    SolutionIndex: 49
    SolutionNameMin: Cijk_Alik_Bjlk_B8F8NBS_BH_Bias_HAS_SAV_UserArgs_MT256x128x128_MI16x16x1_SN_LDSB1_CLR1_GRVWA8_GRVWB16_GSU0_GSUC0_GSUWGMRR0_K1_LBSPPA1024_LBSPPB1024_LPA8_LPB64_LRVW8_MIWT8_4_PLR1_SU0_SUM0_SUS128_VWA8_VWB4_WGM8_WGMXCC1_WGMXCCGn1
    SolutionIndex: 50
    SolutionNameMin: Cijk_Alik_Bjlk_B8F8NBS_BH_Bias_HAS_SAV_UserArgs_MT256x128x128_MI16x16x1_SN_LDSB1_CLR1_GRVWA16_GRVWB16_GSU0_GSUC0_GSUWGMRR0_K1_LBSPPA1024_LBSPPB1024_LPA16_LPB64_LRVW8_MIWT8_4_PLR1_SU0_SUM0_SUS128_VWA8_VWB4_WGM8_WGMXCC1_WGMXCCGn1
    SolutionIndex: 51
    SolutionNameMin: Cijk_Alik_Bjlk_B8F8NBS_BH_Bias_HAS_SAV_UserArgs_MT144x256x128_MI16x16x1_SN_LDSB1_CLR1_GRVWA8_GRVWB16_GSU0_GSUC0_GSUWGMRR0_K1_LBSPPA128_LBSPPB2048_LPA8_LPB64_LRVW8_MIWT9_4_PLR1_SU0_SUM0_SUS128_VWA1_VWB4_WGM1_WGMXCC1_WGMXCCGn1
    SolutionIndex: 52
    SolutionNameMin: Cijk_Alik_Bjlk_B8F8NBS_BH_Bias_HAS_SAV_UserArgs_MT144x256x128_MI16x16x1_SN_LDSB1_CLR1_GRVWA8_GRVWB16_GSU0_GSUC0_GSUWGMRR0_K1_LBSPPA128_LBSPPB2048_LPA8_LPB64_LRVW8_MIWT9_4_PLR1_SU0_SUM0_SUS128_VWA1_VWB4_WGM4_WGMXCC1_WGMXCCGn1
    SolutionIndex: 53
    SolutionNameMin: Cijk_Alik_Bjlk_B8F8NBS_BH_Bias_HAS_SAV_UserArgs_MT144x256x128_MI16x16x1_SN_LDSB1_CLR1_GRVWA8_GRVWB8_GSU0_GSUC0_GSUWGMRR0_K1_LBSPPA128_LBSPPB2048_LPA8_LPB64_LRVW8_MIWT9_4_PLR1_SU0_SUM0_SUS128_VWA1_VWB4_WGM6_WGMXCC1_WGMXCCGn1
    SolutionIndex: 54
    SolutionNameMin: Cijk_Alik_Bjlk_B8F8NBS_BH_Bias_HAS_SAV_UserArgs_MT144x256x128_MI16x16x1_SN_LDSB1_CLR1_GRVWA8_GRVWB16_GSU0_GSUC0_GSUWGMRR0_K1_LBSPPA128_LBSPPB2048_LPA8_LPB64_LRVW8_MIWT9_4_PLR1_SU0_SUM0_SUS128_VWA1_VWB4_WGM6_WGMXCC1_WGMXCCGn1
    SolutionIndex: 55
    SolutionNameMin: Cijk_Alik_Bjlk_B8F8NBS_BH_Bias_HAS_SAV_UserArgs_MT144x256x128_MI16x16x1_SN_LDSB1_CLR1_GRVWA8_GRVWB8_GSU0_GSUC0_GSUWGMRR0_K1_LBSPPA128_LBSPPB2048_LPA8_LPB64_LRVW8_MIWT9_4_PLR1_SU0_SUM0_SUS128_VWA1_VWB4_WGM8_WGMXCC1_WGMXCCGn1
    SolutionIndex: 56
    SolutionNameMin: Cijk_Alik_Bjlk_B8F8NBS_BH_Bias_HAS_SAV_UserArgs_MT144x256x128_MI16x16x1_SN_LDSB1_CLR1_GRVWA8_GRVWB16_GSU0_GSUC0_GSUWGMRR0_K1_LBSPPA128_LBSPPB2048_LPA8_LPB64_LRVW8_MIWT9_4_PLR1_SU0_SUM0_SUS128_VWA1_VWB4_WGM8_WGMXCC1_WGMXCCGn1
    SolutionIndex: 57
    SolutionNameMin: Cijk_Alik_Bjlk_B8F8NBS_BH_Bias_HAS_SAV_UserArgs_MT128x128x128_MI16x16x1_SN_LDSB1_CLR1_GRVWA8_GRVWB8_GSU0_GSUC0_GSUWGMRR0_K1_LBSPPA1024_LBSPPB1024_LPA8_LPB32_LRVW8_MIWT8_2_PLR1_SU0_SUM0_SUS128_VWA8_VWB2_WGM1_WGMXCC1_WGMXCCGn1
    SolutionIndex: 58
    SolutionNameMin: Cijk_Alik_Bjlk_B8F8NBS_BH_Bias_HAS_SAV_UserArgs_MT128x128x128_MI16x16x1_SN_LDSB1_CLR1_GRVWA8_GRVWB16_GSU0_GSUC0_GSUWGMRR0_K1_LBSPPA1024_LBSPPB1024_LPA8_LPB32_LRVW8_MIWT8_2_PLR1_SU0_SUM0_SUS128_VWA8_VWB2_WGM1_WGMXCC1_WGMXCCGn1
    SolutionIndex: 59
    SolutionNameMin: Cijk_Alik_Bjlk_B8F8NBS_BH_Bias_HAS_SAV_UserArgs_MT128x64x128_MI16x16x1_SN_LDSB1_CLR1_GRVWA8_GRVWB8_GSU0_GSUC0_GSUWGMRR0_K1_LBSPPA1024_LBSPPB512_LPA8_LPB16_LRVW8_MIWT8_1_PLR1_SU0_SUM0_SUS128_VWA8_VWB1_WGM1_WGMXCC1_WGMXCCGn1
    SolutionIndex: 60
    SolutionNameMin: Cijk_Alik_Bjlk_B8F8NBS_BH_Bias_HAS_SAV_UserArgs_MT128x64x128_MI16x16x1_SN_LDSB1_CLR1_GRVWA16_GRVWB16_GSU0_GSUC0_GSUWGMRR0_K1_LBSPPA1024_LBSPPB512_LPA16_LPB16_LRVW8_MIWT8_1_PLR1_SU0_SUM0_SUS128_VWA8_VWB1_WGM1_WGMXCC1_WGMXCCGn1
    SolutionIndex: 61
    SolutionNameMin: Cijk_Alik_Bjlk_B8F8NBS_BH_Bias_HAS_SAV_UserArgs_MT128x64x128_MI16x16x1_SN_LDSB1_CLR1_GRVWA16_GRVWB8_GSU0_GSUC0_GSUWGMRR0_K1_LBSPPA1024_LBSPPB512_LPA16_LPB16_LRVW8_MIWT8_1_PLR1_SU0_SUM0_SUS128_VWA8_VWB1_WGM6_WGMXCC1_WGMXCCGn1
    SolutionIndex: 62
    SolutionNameMin: Cijk_Alik_Bjlk_B8F8NBS_BH_Bias_HAS_SAV_UserArgs_MT128x64x128_MI16x16x1_SN_LDSB1_CLR1_GRVWA8_GRVWB8_GSU0_GSUC0_GSUWGMRR0_K1_LBSPPA1024_LBSPPB512_LPA8_LPB16_LRVW8_MIWT8_1_PLR1_SU0_SUM0_SUS128_VWA8_VWB1_WGM8_WGMXCC1_WGMXCCGn1
    SolutionIndex: 63
    SolutionNameMin: Cijk_Alik_Bjlk_B8F8NBS_BH_Bias_HAS_SAV_UserArgs_MT144x128x128_MI16x16x1_SN_LDSB1_CLR1_GRVWA8_GRVWB16_GSU0_GSUC0_GSUWGMRR0_K1_LBSPPA128_LBSPPB1024_LPA8_LPB32_LRVW8_MIWT9_2_PLR1_SU0_SUM0_SUS128_VWA1_VWB2_WGM4_WGMXCC1_WGMXCCGn1
    SolutionIndex: 64
    SolutionNameMin: Cijk_Alik_Bjlk_B8F8NBS_BH_Bias_HAS_SAV_UserArgs_MT144x128x128_MI16x16x1_SN_LDSB1_CLR1_GRVWA8_GRVWB16_GSU0_GSUC0_GSUWGMRR0_K1_LBSPPA128_LBSPPB1024_LPA8_LPB32_LRVW8_MIWT9_2_PLR1_SU0_SUM0_SUS128_VWA1_VWB2_WGM6_WGMXCC1_WGMXCCGn1
    SolutionIndex: 65
    SolutionNameMin: Cijk_Alik_Bjlk_B8F8NBS_BH_Bias_HAS_SAV_UserArgs_MT128x128x128_MI16x16x1_SN_LDSB1_CLR1_GRVWA16_GRVWB16_GSU0_GSUC0_GSUWGMRR0_K1_LBSPPA512_LBSPPB1024_LPA16_LPB64_LRVW8_MIWT4_4_PLR1_SU0_SUM0_SUS128_VWA4_VWB4_WGM1_WGMXCC1_WGMXCCGn1
    SolutionIndex: 66
    SolutionNameMin: Cijk_Alik_Bjlk_B8F8NBS_BH_Bias_HAS_SAV_UserArgs_MT128x128x128_MI16x16x1_SN_LDSB1_CLR1_GRVWA16_GRVWB16_GSU0_GSUC0_GSUWGMRR0_K1_LBSPPA512_LBSPPB1024_LPA16_LPB64_LRVW8_MIWT4_4_PLR1_SU0_SUM0_SUS128_VWA4_VWB4_WGM4_WGMXCC1_WGMXCCGn1
    SolutionIndex: 67
    SolutionNameMin: Cijk_Alik_Bjlk_B8F8NBS_BH_Bias_HAS_SAV_UserArgs_MT128x128x128_MI16x16x1_SN_LDSB1_CLR1_GRVWA16_GRVWB16_GSU0_GSUC0_GSUWGMRR0_K1_LBSPPA512_LBSPPB1024_LPA16_LPB64_LRVW8_MIWT4_4_PLR1_SU0_SUM0_SUS128_VWA4_VWB4_WGM6_WGMXCC1_WGMXCCGn1
    SolutionIndex: 68
    SolutionNameMin: Cijk_Alik_Bjlk_B8F8NBS_BH_Bias_HAS_SAV_UserArgs_MT128x128x128_MI16x16x1_SN_LDSB1_CLR1_GRVWA16_GRVWB16_GSU0_GSUC0_GSUWGMRR0_K1_LBSPPA512_LBSPPB1024_LPA16_LPB64_LRVW8_MIWT4_4_PLR1_SU0_SUM0_SUS128_VWA4_VWB4_WGM8_WGMXCC1_WGMXCCGn1
    SolutionIndex: 69
    SolutionNameMin: Cijk_Alik_Bjlk_B8F8NBS_BH_Bias_HAS_SAV_UserArgs_MT64x128x128_MI16x16x1_SN_LDSB1_CLR1_GRVWA8_GRVWB16_GSU0_GSUC0_GSUWGMRR0_K1_LBSPPA256_LBSPPB1024_LPA8_LPB64_LRVW8_MIWT2_4_PLR1_SU0_SUM0_SUS128_VWA2_VWB4_WGM1_WGMXCC1_WGMXCCGn1
    SolutionIndex: 70
    SolutionNameMin: Cijk_Alik_Bjlk_B8F8NBS_BH_Bias_HAS_SAV_UserArgs_MT64x128x128_MI16x16x1_SN_LDSB1_CLR1_GRVWA16_GRVWB16_GSU0_GSUC0_GSUWGMRR0_K1_LBSPPA256_LBSPPB1024_LPA16_LPB64_LRVW8_MIWT2_4_PLR1_SU0_SUM0_SUS128_VWA2_VWB4_WGM1_WGMXCC1_WGMXCCGn1
    SolutionIndex: 71
    SolutionNameMin: Cijk_Alik_Bjlk_B8F8NBS_BH_Bias_HAS_SAV_UserArgs_MT64x128x128_MI16x16x1_SN_LDSB1_CLR1_GRVWA8_GRVWB16_GSU0_GSUC0_GSUWGMRR0_K1_LBSPPA256_LBSPPB1024_LPA8_LPB64_LRVW8_MIWT2_4_PLR1_SU0_SUM0_SUS128_VWA2_VWB4_WGM4_WGMXCC1_WGMXCCGn1
    SolutionIndex: 72
    SolutionNameMin: Cijk_Alik_Bjlk_B8F8NBS_BH_Bias_HAS_SAV_UserArgs_MT64x128x128_MI16x16x1_SN_LDSB1_CLR1_GRVWA16_GRVWB16_GSU0_GSUC0_GSUWGMRR0_K1_LBSPPA256_LBSPPB1024_LPA16_LPB64_LRVW8_MIWT2_4_PLR1_SU0_SUM0_SUS128_VWA2_VWB4_WGM4_WGMXCC1_WGMXCCGn1
    SolutionIndex: 73
    SolutionNameMin: Cijk_Alik_Bjlk_B8F8NBS_BH_Bias_HAS_SAV_UserArgs_MT32x128x128_MI16x16x1_SN_LDSB1_CLR1_GRVWA16_GRVWB16_GSU0_GSUC0_GSUWGMRR0_K1_LBSPPA128_LBSPPB1024_LPA16_LPB64_LRVW8_MIWT1_4_PLR1_SU0_SUM0_SUS128_VWA1_VWB4_WGM4_WGMXCC1_WGMXCCGn1
    SolutionIndex: 74
    SolutionNameMin: Cijk_Alik_Bjlk_B8F8NBS_BH_Bias_HAS_SAV_UserArgs_MT64x64x128_MI16x16x1_SN_LDSB1_CLR1_GRVWA16_GRVWB8_GSU0_GSUC0_GSUWGMRR0_K1_LBSPPA256_LBSPPB512_LPA16_LPB32_LRVW8_MIWT2_2_PLR1_SU0_SUM0_SUS128_VWA2_VWB2_WGM1_WGMXCC1_WGMXCCGn1
    SolutionIndex: 75
    SolutionNameMin: Cijk_Alik_Bjlk_B8F8NBS_BH_Bias_HAS_SAV_UserArgs_MT64x64x128_MI16x16x1_SN_LDSB1_CLR1_GRVWA8_GRVWB16_GSU0_GSUC0_GSUWGMRR0_K1_LBSPPA256_LBSPPB512_LPA8_LPB32_LRVW8_MIWT2_2_PLR1_SU0_SUM0_SUS128_VWA2_VWB2_WGM1_WGMXCC1_WGMXCCGn1
    SolutionIndex: 76
    SolutionNameMin: Cijk_Alik_Bjlk_B8F8NBS_BH_Bias_HAS_SAV_UserArgs_MT64x64x128_MI16x16x1_SN_LDSB1_CLR1_GRVWA16_GRVWB16_GSU0_GSUC0_GSUWGMRR0_K1_LBSPPA256_LBSPPB512_LPA16_LPB32_LRVW8_MIWT2_2_PLR1_SU0_SUM0_SUS128_VWA2_VWB2_WGM1_WGMXCC1_WGMXCCGn1
    SolutionIndex: 77
    SolutionNameMin: Cijk_Alik_Bjlk_B8F8NBS_BH_Bias_HAS_SAV_UserArgs_MT64x64x128_MI16x16x1_SN_LDSB1_CLR1_GRVWA8_GRVWB16_GSU0_GSUC0_GSUWGMRR0_K1_LBSPPA256_LBSPPB512_LPA8_LPB32_LRVW8_MIWT2_2_PLR1_SU0_SUM0_SUS128_VWA2_VWB2_WGM4_WGMXCC1_WGMXCCGn1
    SolutionIndex: 78
    SolutionNameMin: Cijk_Alik_Bjlk_B8F8NBS_BH_Bias_HAS_SAV_UserArgs_MT32x64x128_MI16x16x1_SN_LDSB0_CLR1_GRVWA8_GRVWB8_GSU0_GSUC0_GSUWGMRR0_K1_LBSPPA128_LBSPPB512_LPA8_LPB32_LRVW8_MIWT1_2_PLR1_SU0_SUM0_SUS128_VWA1_VWB2_WGM1_WGMXCC1_WGMXCCGn1
    SolutionIndex: 79
    SolutionNameMin: Cijk_Alik_Bjlk_B8F8NBS_BH_Bias_HAS_SAV_UserArgs_MT32x64x128_MI16x16x1_SN_LDSB0_CLR1_GRVWA8_GRVWB16_GSU0_GSUC0_GSUWGMRR0_K1_LBSPPA128_LBSPPB512_LPA8_LPB32_LRVW8_MIWT1_2_PLR1_SU0_SUM0_SUS128_VWA1_VWB2_WGM4_WGMXCC1_WGMXCCGn1
    SolutionIndex: 80
    SolutionNameMin: Cijk_Alik_Bjlk_B8F8NBS_BH_Bias_HAS_SAV_UserArgs_MT64x32x128_MI16x16x1_SN_LDSB0_CLR1_GRVWA8_GRVWB8_GSU0_GSUC0_GSUWGMRR0_K1_LBSPPA256_LBSPPB256_LPA8_LPB16_LRVW8_MIWT2_1_PLR1_SU0_SUM0_SUS128_VWA2_VWB1_WGM1_WGMXCC1_WGMXCCGn1
    SolutionIndex: 81
    SolutionNameMin: Cijk_Alik_Bjlk_B8F8NBS_BH_Bias_HAS_SAV_UserArgs_MT64x32x128_MI16x16x1_SN_LDSB0_CLR1_GRVWA16_GRVWB8_GSU0_GSUC0_GSUWGMRR0_K1_LBSPPA256_LBSPPB256_LPA16_LPB16_LRVW8_MIWT2_1_PLR1_SU0_SUM0_SUS128_VWA2_VWB1_WGM1_WGMXCC1_WGMXCCGn1
    SolutionIndex: 82
    SolutionNameMin: Cijk_Alik_Bjlk_B8F8NBS_BH_Bias_HAS_SAV_UserArgs_MT64x32x128_MI16x16x1_SN_LDSB0_CLR1_GRVWA8_GRVWB16_GSU0_GSUC0_GSUWGMRR0_K1_LBSPPA256_LBSPPB256_LPA8_LPB16_LRVW8_MIWT2_1_PLR1_SU0_SUM0_SUS128_VWA2_VWB1_WGM1_WGMXCC1_WGMXCCGn1
    SolutionIndex: 83
    SolutionNameMin: Cijk_Alik_Bjlk_B8F8NBS_BH_Bias_HAS_SAV_UserArgs_MT64x32x128_MI16x16x1_SN_LDSB0_CLR1_GRVWA8_GRVWB16_GSU0_GSUC0_GSUWGMRR0_K1_LBSPPA256_LBSPPB256_LPA8_LPB16_LRVW8_MIWT2_1_PLR1_SU0_SUM0_SUS128_VWA2_VWB1_WGM6_WGMXCC1_WGMXCCGn1
    SolutionIndex: 84
    SolutionNameMin: Cijk_Alik_Bjlk_B8F8NBS_BH_Bias_HAS_SAV_UserArgs_MT64x32x128_MI16x16x1_SN_LDSB0_CLR1_GRVWA8_GRVWB16_GSU0_GSUC0_GSUWGMRR0_K1_LBSPPA256_LBSPPB256_LPA8_LPB16_LRVW8_MIWT2_1_PLR1_SU0_SUM0_SUS128_VWA2_VWB1_WGM8_WGMXCC1_WGMXCCGn1
    SolutionIndex: 85
    SolutionNameMin: Cijk_Alik_Bjlk_B8F8NBS_BH_Bias_HAS_SAV_UserArgs_MT32x32x128_MI16x16x1_SN_LDSB0_CLR1_GRVWA8_GRVWB8_GSU0_GSUC0_GSUWGMRR0_K1_LBSPPA128_LBSPPB256_LPA8_LPB16_LRVW8_MIWT1_1_PLR1_SU0_SUM0_SUS128_VWA1_VWB1_WGM1_WGMXCC1_WGMXCCGn1
    SolutionIndex: 86
    SolutionNameMin: Cijk_Alik_Bjlk_B8F8NBS_BH_Bias_HAS_SAV_UserArgs_MT32x32x128_MI16x16x1_SN_LDSB0_CLR1_GRVWA16_GRVWB8_GSU0_GSUC0_GSUWGMRR0_K1_LBSPPA128_LBSPPB256_LPA16_LPB16_LRVW8_MIWT1_1_PLR1_SU0_SUM0_SUS128_VWA1_VWB1_WGM1_WGMXCC1_WGMXCCGn1
    SolutionIndex: 87
    SolutionNameMin: Cijk_Alik_Bjlk_B8F8NBS_BH_Bias_HAS_SAV_UserArgs_MT32x32x128_MI16x16x1_SN_LDSB0_CLR1_GRVWA8_GRVWB16_GSU0_GSUC0_GSUWGMRR0_K1_LBSPPA128_LBSPPB256_LPA8_LPB16_LRVW8_MIWT1_1_PLR1_SU0_SUM0_SUS128_VWA1_VWB1_WGM1_WGMXCC1_WGMXCCGn1
    SolutionIndex: 88
    SolutionNameMin: Cijk_Alik_Bjlk_B8F8NBS_BH_Bias_HAS_SAV_UserArgs_MT32x32x128_MI16x16x1_SN_LDSB0_CLR1_GRVWA16_GRVWB16_GSU0_GSUC0_GSUWGMRR0_K1_LBSPPA128_LBSPPB256_LPA16_LPB16_LRVW8_MIWT1_1_PLR1_SU0_SUM0_SUS128_VWA1_VWB1_WGM1_WGMXCC1_WGMXCCGn1
    SolutionIndex: 89
    SolutionNameMin: Cijk_Alik_Bjlk_B8F8NBS_BH_Bias_HAS_SAV_UserArgs_MT32x32x128_MI16x16x1_SN_LDSB0_CLR1_GRVWA8_GRVWB16_GSU0_GSUC0_GSUWGMRR0_K1_LBSPPA128_LBSPPB256_LPA8_LPB16_LRVW8_MIWT1_1_PLR1_SU0_SUM0_SUS128_VWA1_VWB1_WGM4_WGMXCC1_WGMXCCGn1
    SolutionIndex: 90
    SolutionNameMin: Cijk_Alik_Bjlk_B8F8NBS_BH_Bias_HAS_SAV_UserArgs_MT32x32x128_MI16x16x1_SN_LDSB0_CLR1_GRVWA8_GRVWB16_GSU0_GSUC0_GSUWGMRR0_K1_LBSPPA128_LBSPPB256_LPA8_LPB16_LRVW8_MIWT1_1_PLR1_SU0_SUM0_SUS128_VWA1_VWB1_WGM6_WGMXCC1_WGMXCCGn1
    SolutionIndex: 91
    SolutionNameMin: Cijk_Alik_Bjlk_B8F8NBS_BH_Bias_HAS_SAV_UserArgs_MT32x32x128_MI16x16x1_SN_LDSB0_CLR1_GRVWA8_GRVWB8_GSU0_GSUC0_GSUWGMRR0_K1_LBSPPA128_LBSPPB256_LPA8_LPB16_LRVW8_MIWT1_1_PLR1_SU0_SUM0_SUS128_VWA1_VWB1_WGM8_WGMXCC1_WGMXCCGn1
    SolutionIndex: 92
    SolutionNameMin: Cijk_Alik_Bjlk_B8F8NBS_BH_Bias_HAS_SAV_UserArgs_MT32x32x128_MI16x16x1_SN_LDSB0_CLR1_GRVWA16_GRVWB8_GSU0_GSUC0_GSUWGMRR0_K1_LBSPPA128_LBSPPB256_LPA16_LPB16_LRVW8_MIWT1_1_PLR1_SU0_SUM0_SUS128_VWA1_VWB1_WGM8_WGMXCC1_WGMXCCGn1
    SolutionIndex: 93
    SolutionNameMin: Cijk_Alik_Bjlk_B8F8NBS_BH_Bias_HAS_SAV_UserArgs_MT32x32x128_MI16x16x1_SN_LDSB0_CLR1_GRVWA8_GRVWB16_GSU0_GSUC0_GSUWGMRR0_K1_LBSPPA128_LBSPPB256_LPA8_LPB16_LRVW8_MIWT1_1_PLR1_SU0_SUM0_SUS128_VWA1_VWB1_WGM8_WGMXCC1_WGMXCCGn1
    SolutionIndex: 94
    SolutionNameMin: Cijk_Alik_Bjlk_B8F8NBS_BH_Bias_HAS_SAV_UserArgs_MT128x64x256_MI16x16x1_SN_LDSB1_CLR1_GRVWA16_GRVWB16_GSU0_GSUC0_GSUWGMRR0_K1_LBSPPA1024_LBSPPB512_LPA16_LPB32_LRVW8_MIWT4_2_PLR1_SU0_SUM0_SUS256_VWA4_VWB2_WGM1_WGMXCC1_WGMXCCGn1
    SolutionIndex: 95
    SolutionNameMin: Cijk_Alik_Bjlk_B8F8NBS_BH_Bias_HAS_SAV_UserArgs_MT128x64x256_MI16x16x1_SN_LDSB1_CLR1_GRVWA16_GRVWB16_GSU0_GSUC0_GSUWGMRR0_K1_LBSPPA1024_LBSPPB512_LPA16_LPB32_LRVW8_MIWT4_2_PLR1_SU0_SUM0_SUS256_VWA4_VWB2_WGM4_WGMXCC1_WGMXCCGn1
    SolutionIndex: 96
    SolutionNameMin: Cijk_Alik_Bjlk_B8F8NBS_BH_Bias_HAS_SAV_UserArgs_MT128x64x256_MI16x16x1_SN_LDSB1_CLR1_GRVWA16_GRVWB16_GSU0_GSUC0_GSUWGMRR0_K1_LBSPPA1024_LBSPPB512_LPA16_LPB32_LRVW8_MIWT4_2_PLR1_SU0_SUM0_SUS256_VWA4_VWB2_WGM6_WGMXCC1_WGMXCCGn1
    SolutionIndex: 97
    SolutionNameMin: Cijk_Alik_Bjlk_B8F8NBS_BH_Bias_HAS_SAV_UserArgs_MT128x64x256_MI16x16x1_SN_LDSB1_CLR1_GRVWA16_GRVWB16_GSU0_GSUC0_GSUWGMRR0_K1_LBSPPA1024_LBSPPB512_LPA16_LPB32_LRVW8_MIWT4_2_PLR1_SU0_SUM0_SUS256_VWA4_VWB2_WGM8_WGMXCC1_WGMXCCGn1
    SolutionIndex: 98
    SolutionNameMin: Cijk_Alik_Bjlk_B8F8NBS_BH_Bias_HAS_SAV_UserArgs_MT64x64x256_MI16x16x1_SN_LDSB1_CLR1_GRVWA16_GRVWB16_GSU0_GSUC0_GSUWGMRR0_K1_LBSPPA512_LBSPPB512_LPA16_LPB32_LRVW8_MIWT2_2_PLR1_SU0_SUM0_SUS256_VWA2_VWB2_WGM1_WGMXCC1_WGMXCCGn1
    SolutionIndex: 99
    SolutionNameMin: Cijk_Alik_Bjlk_B8F8NBS_BH_Bias_HAS_SAV_UserArgs_MT64x64x256_MI16x16x1_SN_LDSB1_CLR1_GRVWA16_GRVWB16_GSU0_GSUC0_GSUWGMRR0_K1_LBSPPA512_LBSPPB512_LPA16_LPB32_LRVW8_MIWT2_2_PLR1_SU0_SUM0_SUS256_VWA2_VWB2_WGM6_WGMXCC1_WGMXCCGn1
    SolutionIndex: 100
    SolutionNameMin: Cijk_Alik_Bjlk_B8F8NBS_BH_Bias_HAS_SAV_UserArgs_MT64x64x256_MI16x16x1_SN_LDSB1_CLR1_GRVWA16_GRVWB16_GSU0_GSUC0_GSUWGMRR0_K1_LBSPPA512_LBSPPB512_LPA16_LPB32_LRVW8_MIWT2_2_PLR1_SU0_SUM0_SUS256_VWA2_VWB2_WGM8_WGMXCC1_WGMXCCGn1
    SolutionIndex: 101
    SolutionNameMin: Cijk_Alik_Bjlk_B8F8NBS_BH_Bias_HAS_SAV_UserArgs_MT32x64x256_MI16x16x1_SN_LDSB1_CLR1_GRVWA16_GRVWB16_GSU0_GSUC0_GSUWGMRR0_K1_LBSPPA256_LBSPPB512_LPA16_LPB32_LRVW8_MIWT1_2_PLR1_SU0_SUM0_SUS256_VWA1_VWB2_WGM1_WGMXCC1_WGMXCCGn1
    SolutionIndex: 102
    SolutionNameMin: Cijk_Alik_Bjlk_B8F8NBS_BH_Bias_HAS_SAV_UserArgs_MT32x64x256_MI16x16x1_SN_LDSB1_CLR1_GRVWA8_GRVWB16_GSU0_GSUC0_GSUWGMRR0_K1_LBSPPA256_LBSPPB512_LPA8_LPB32_LRVW8_MIWT1_2_PLR1_SU0_SUM0_SUS256_VWA1_VWB2_WGM4_WGMXCC1_WGMXCCGn1
    SolutionIndex: 103
    SolutionNameMin: Cijk_Alik_Bjlk_B8F8NBS_BH_Bias_HAS_SAV_UserArgs_MT32x64x256_MI16x16x1_SN_LDSB1_CLR1_GRVWA16_GRVWB16_GSU0_GSUC0_GSUWGMRR0_K1_LBSPPA256_LBSPPB512_LPA16_LPB32_LRVW8_MIWT1_2_PLR1_SU0_SUM0_SUS256_VWA1_VWB2_WGM6_WGMXCC1_WGMXCCGn1
    SolutionIndex: 104
    SolutionNameMin: Cijk_Alik_Bjlk_B8F8NBS_BH_Bias_HAS_SAV_UserArgs_MT64x32x256_MI16x16x1_SN_LDSB1_CLR1_GRVWA16_GRVWB16_GSU0_GSUC0_GSUWGMRR0_K1_LBSPPA512_LBSPPB256_LPA16_LPB16_LRVW8_MIWT2_1_PLR1_SU0_SUM0_SUS256_VWA2_VWB1_WGM8_WGMXCC1_WGMXCCGn1
    SolutionIndex: 105
    SolutionNameMin: Cijk_Alik_Bjlk_B8F8NBS_BH_Bias_HAS_SAV_UserArgs_MT32x32x256_MI16x16x1_SN_LDSB1_CLR1_GRVWA8_GRVWB16_GSU0_GSUC0_GSUWGMRR0_K1_LBSPPA256_LBSPPB256_LPA8_LPB16_LRVW8_MIWT1_1_PLR1_SU0_SUM0_SUS256_VWA1_VWB1_WGM1_WGMXCC1_WGMXCCGn1
    SolutionIndex: 106
    SolutionNameMin: Cijk_Alik_Bjlk_B8F8NBS_BH_Bias_HAS_SAV_UserArgs_MT32x32x256_MI16x16x1_SN_LDSB1_CLR1_GRVWA16_GRVWB16_GSU0_GSUC0_GSUWGMRR0_K1_LBSPPA256_LBSPPB256_LPA16_LPB16_LRVW8_MIWT1_1_PLR1_SU0_SUM0_SUS256_VWA1_VWB1_WGM1_WGMXCC1_WGMXCCGn1
    SolutionIndex: 107
    SolutionNameMin: Cijk_Alik_Bjlk_B8F8NBS_BH_Bias_HAS_SAV_UserArgs_MT32x32x256_MI16x16x1_SN_LDSB1_CLR1_GRVWA8_GRVWB16_GSU0_GSUC0_GSUWGMRR0_K1_LBSPPA256_LBSPPB256_LPA8_LPB16_LRVW8_MIWT1_1_PLR1_SU0_SUM0_SUS256_VWA1_VWB1_WGM6_WGMXCC1_WGMXCCGn1
- - - [128, 128, 1, 128, 128, 128, 128, 128]
    - [42, 0.57]
  - - [128, 128, 1, 256, 128, 128, 256, 128]
    - [42, 1.01]
  - - [128, 128, 1, 512, 128, 128, 512, 128]
    - [85, 1.72]
  - - [128, 128, 1, 1024, 128, 128, 1024, 128]
    - [85, 2.71]
  - - [128, 128, 1, 2048, 128, 128, 2048, 128]
    - [87, 3.83]
  - - [128, 128, 1, 4096, 128, 128, 4096, 128]
    - [87, 4.8]
  - - [128, 128, 1, 8192, 128, 128, 8192, 128]
    - [89, 5.5]
  - - [128, 256, 1, 128, 128, 128, 128, 256]
    - [42, 1.12]
  - - [128, 256, 1, 256, 128, 128, 256, 256]
    - [86, 2.04]
  - - [128, 256, 1, 512, 128, 128, 512, 256]
    - [85, 3.54]
  - - [128, 256, 1, 1024, 128, 128, 1024, 256]
    - [85, 5.53]
  - - [128, 256, 1, 2048, 128, 128, 2048, 256]
    - [87, 7.76]
  - - [128, 256, 1, 4096, 128, 128, 4096, 256]
    - [87, 9.72]
  - - [128, 256, 1, 8192, 128, 128, 8192, 256]
    - [87, 11.1]
  - - [128, 512, 1, 128, 128, 128, 128, 512]
    - [86, 2.23]
  - - [128, 512, 1, 256, 128, 128, 256, 512]
    - [85, 4.1]
  - - [128, 512, 1, 512, 128, 128, 512, 512]
    - [85, 7.04]
  - - [128, 512, 1, 1024, 128, 128, 1024, 512]
    - [85, 10.96]
  - - [128, 512, 1, 2048, 128, 128, 2048, 512]
    - [85, 15.36]
  - - [128, 512, 1, 4096, 128, 128, 4096, 512]
    - [87, 19.29]
  - - [128, 512, 1, 8192, 128, 128, 8192, 512]
    - [105, 18.15]
  - - [128, 1024, 1, 128, 128, 128, 128, 1024]
    - [42, 4.41]
  - - [128, 1024, 1, 256, 128, 128, 256, 1024]
    - [85, 8.03]
  - - [128, 1024, 1, 512, 128, 128, 512, 1024]
    - [85, 13.76]
  - - [128, 1024, 1, 1024, 128, 128, 1024, 1024]
    - [85, 21.63]
  - - [128, 1024, 1, 2048, 128, 128, 2048, 1024]
    - [85, 30.1]
  - - [128, 1024, 1, 4096, 128, 128, 4096, 1024]
    - [106, 31.27]
  - - [128, 1024, 1, 8192, 128, 128, 8192, 1024]
    - [107, 32.18]
  - - [128, 2048, 1, 128, 128, 128, 128, 2048]
    - [78, 8.2]
  - - [128, 2048, 1, 256, 128, 128, 256, 2048]
    - [41, 14.54]
  - - [128, 2048, 1, 512, 128, 128, 512, 2048]
    - [82, 24.5]
  - - [128, 2048, 1, 1024, 128, 128, 1024, 2048]
    - [82, 37.71]
  - - [128, 2048, 1, 2048, 128, 128, 2048, 2048]
    - [101, 44.21]
  - - [128, 2048, 1, 4096, 128, 128, 4096, 2048]
    - [101, 52.74]
  - - [128, 2048, 1, 8192, 128, 128, 8192, 2048]
    - [101, 59.62]
  - - [128, 4096, 1, 128, 128, 128, 128, 4096]
    - [36, 14.79]
  - - [128, 4096, 1, 256, 128, 128, 256, 4096]
    - [36, 26.33]
  - - [128, 4096, 1, 512, 128, 128, 512, 4096]
    - [75, 42.82]
  - - [128, 4096, 1, 1024, 128, 128, 1024, 4096]
    - [75, 64.77]
  - - [128, 4096, 1, 2048, 128, 128, 2048, 4096]
    - [98, 78.47]
  - - [128, 4096, 1, 4096, 128, 128, 4096, 4096]
    - [98, 96.2]
  - - [128, 4096, 1, 8192, 128, 128, 8192, 4096]
    - [98, 108.82]
  - - [128, 8192, 1, 128, 128, 128, 128, 8192]
    - [22, 24.23]
  - - [128, 8192, 1, 256, 128, 128, 256, 8192]
    - [28, 42.77]
  - - [128, 8192, 1, 512, 128, 128, 512, 8192]
    - [27, 69.86]
  - - [128, 8192, 1, 1024, 128, 128, 1024, 8192]
    - [27, 103.45]
  - - [128, 8192, 1, 2048, 128, 128, 2048, 8192]
    - [70, 120.63]
  - - [128, 8192, 1, 4096, 128, 128, 4096, 8192]
    - [69, 142.63]
  - - [128, 8192, 1, 8192, 128, 128, 8192, 8192]
    - [94, 150.98]
  - - [256, 128, 1, 128, 256, 256, 128, 128]
    - [42, 1.14]
  - - [256, 128, 1, 256, 256, 256, 256, 128]
    - [85, 2.04]
  - - [256, 128, 1, 512, 256, 256, 512, 128]
    - [85, 3.53]
  - - [256, 128, 1, 1024, 256, 256, 1024, 128]
    - [85, 5.54]
  - - [256, 128, 1, 2048, 256, 256, 2048, 128]
    - [87, 7.74]
  - - [256, 128, 1, 4096, 256, 256, 4096, 128]
    - [87, 9.69]
  - - [256, 128, 1, 8192, 256, 256, 8192, 128]
    - [87, 11.08]
  - - [256, 256, 1, 128, 256, 256, 128, 256]
    - [85, 2.24]
  - - [256, 256, 1, 256, 256, 256, 256, 256]
    - [86, 4.08]
  - - [256, 256, 1, 512, 256, 256, 512, 256]
    - [85, 7.0]
  - - [256, 256, 1, 1024, 256, 256, 1024, 256]
    - [85, 10.88]
  - - [256, 256, 1, 2048, 256, 256, 2048, 256]
    - [87, 14.8]
  - - [256, 256, 1, 4096, 256, 256, 4096, 256]
    - [87, 19.23]
  - - [256, 256, 1, 8192, 256, 256, 8192, 256]
    - [89, 21.93]
  - - [256, 512, 1, 128, 256, 256, 128, 512]
    - [85, 4.38]
  - - [256, 512, 1, 256, 256, 256, 256, 512]
    - [85, 7.98]
  - - [256, 512, 1, 512, 256, 256, 512, 512]
    - [85, 13.74]
  - - [256, 512, 1, 1024, 256, 256, 1024, 512]
    - [85, 21.49]
  - - [256, 512, 1, 2048, 256, 256, 2048, 512]
    - [85, 30.09]
  - - [256, 512, 1, 4096, 256, 256, 4096, 512]
    - [87, 37.08]
  - - [256, 512, 1, 8192, 256, 256, 8192, 512]
    - [105, 38.33]
  - - [256, 1024, 1, 128, 256, 256, 128, 1024]
    - [80, 7.55]
  - - [256, 1024, 1, 256, 256, 256, 256, 1024]
    - [81, 14.42]
  - - [256, 1024, 1, 512, 256, 256, 512, 1024]
    - [81, 24.13]
  - - [256, 1024, 1, 1024, 256, 256, 1024, 1024]
    - [82, 37.25]
  - - [256, 1024, 1, 2048, 256, 256, 2048, 1024]
    - [82, 51.63]
  - - [256, 1024, 1, 4096, 256, 256, 4096, 1024]
    - [104, 57.18]
  - - [256, 1024, 1, 8192, 256, 256, 8192, 1024]
    - [103, 60.21]
  - - [256, 2048, 1, 128, 256, 256, 128, 2048]
    - [37, 14.31]
  - - [256, 2048, 1, 256, 256, 256, 256, 2048]
    - [74, 25.6]
  - - [256, 2048, 1, 512, 256, 256, 512, 2048]
    - [74, 42.45]
  - - [256, 2048, 1, 1024, 256, 256, 1024, 2048]
    - [75, 63.92]
  - - [256, 2048, 1, 2048, 256, 256, 2048, 2048]
    - [98, 79.52]
  - - [256, 2048, 1, 4096, 256, 256, 4096, 2048]
    - [98, 96.57]
  - - [256, 2048, 1, 8192, 256, 256, 8192, 2048]
    - [98, 108.22]
  - - [256, 4096, 1, 128, 256, 256, 128, 4096]
    - [22, 24.22]
  - - [256, 4096, 1, 256, 256, 256, 256, 4096]
    - [22, 42.5]
  - - [256, 4096, 1, 512, 256, 256, 512, 4096]
    - [27, 68.82]
  - - [256, 4096, 1, 1024, 256, 256, 1024, 4096]
    - [27, 101.96]
  - - [256, 4096, 1, 2048, 256, 256, 2048, 4096]
    - [94, 123.08]
  - - [256, 4096, 1, 4096, 256, 256, 4096, 4096]
    - [94, 147.22]
  - - [256, 4096, 1, 8192, 256, 256, 8192, 4096]
    - [94, 160.65]
  - - [256, 8192, 1, 128, 256, 256, 128, 8192]
    - [57, 36.36]
  - - [256, 8192, 1, 256, 256, 256, 256, 8192]
    - [18, 63.22]
  - - [256, 8192, 1, 512, 256, 256, 512, 8192]
    - [65, 101.14]
  - - [256, 8192, 1, 1024, 256, 256, 1024, 8192]
    - [65, 150.82]
  - - [256, 8192, 1, 2048, 256, 256, 2048, 8192]
    - [65, 175.18]
  - - [256, 8192, 1, 4096, 256, 256, 4096, 8192]
    - [65, 199.83]
  - - [256, 8192, 1, 8192, 256, 256, 8192, 8192]
    - [65, 197.65]
  - - [512, 128, 1, 128, 512, 512, 128, 128]
    - [92, 2.1]
  - - [512, 128, 1, 256, 512, 512, 256, 128]
    - [85, 3.93]
  - - [512, 128, 1, 512, 512, 512, 512, 128]
    - [88, 6.53]
  - - [512, 128, 1, 1024, 512, 512, 1024, 128]
    - [85, 10.41]
  - - [512, 128, 1, 2048, 512, 512, 2048, 128]
    - [85, 14.8]
  - - [512, 128, 1, 4096, 512, 512, 4096, 128]
    - [87, 18.97]
  - - [512, 128, 1, 8192, 512, 512, 8192, 128]
    - [87, 21.76]
  - - [512, 256, 1, 128, 512, 512, 128, 256]
    - [86, 4.22]
  - - [512, 256, 1, 256, 512, 512, 256, 256]
    - [85, 7.66]
  - - [512, 256, 1, 512, 512, 512, 512, 256]
    - [85, 13.1]
  - - [512, 256, 1, 1024, 512, 512, 1024, 256]
    - [85, 21.11]
  - - [512, 256, 1, 2048, 512, 512, 2048, 256]
    - [85, 29.57]
  - - [512, 256, 1, 4096, 512, 512, 4096, 256]
    - [87, 37.22]
  - - [512, 256, 1, 8192, 512, 512, 8192, 256]
    - [93, 43.23]
  - - [512, 512, 1, 128, 512, 512, 128, 512]
    - [80, 8.16]
  - - [512, 512, 1, 256, 512, 512, 256, 512]
    - [41, 14.54]
  - - [512, 512, 1, 512, 512, 512, 512, 512]
    - [81, 24.47]
  - - [512, 512, 1, 1024, 512, 512, 1024, 512]
    - [82, 37.66]
  - - [512, 512, 1, 2048, 512, 512, 2048, 512]
    - [82, 51.74]
  - - [512, 512, 1, 4096, 512, 512, 4096, 512]
    - [83, 63.15]
  - - [512, 512, 1, 8192, 512, 512, 8192, 512]
    - [79, 64.49]
  - - [512, 1024, 1, 128, 512, 512, 128, 1024]
    - [37, 14.66]
  - - [512, 1024, 1, 256, 512, 512, 256, 1024]
    - [74, 26.12]
  - - [512, 1024, 1, 512, 512, 512, 512, 1024]
    - [76, 42.9]
  - - [512, 1024, 1, 1024, 512, 512, 1024, 1024]
    - [74, 63.96]
  - - [512, 1024, 1, 2048, 512, 512, 2048, 1024]
    - [75, 86.26]
  - - [512, 1024, 1, 4096, 512, 512, 4096, 1024]
    - [98, 97.54]
  - - [512, 1024, 1, 8192, 512, 512, 8192, 1024]
    - [99, 107.06]
  - - [512, 2048, 1, 128, 512, 512, 128, 2048]
    - [26, 23.8]
  - - [512, 2048, 1, 256, 512, 512, 256, 2048]
    - [23, 42.38]
  - - [512, 2048, 1, 512, 512, 512, 512, 2048]
    - [27, 68.82]
  - - [512, 2048, 1, 1024, 512, 512, 1024, 2048]
    - [27, 101.18]
  - - [512, 2048, 1, 2048, 512, 512, 2048, 2048]
    - [94, 126.05]
  - - [512, 2048, 1, 4096, 512, 512, 4096, 2048]
    - [94, 149.44]
  - - [512, 2048, 1, 8192, 512, 512, 8192, 2048]
    - [96, 157.64]
  - - [512, 4096, 1, 128, 512, 512, 128, 4096]
    - [57, 36.6]
  - - [512, 4096, 1, 256, 512, 512, 256, 4096]
    - [18, 63.91]
  - - [512, 4096, 1, 512, 512, 512, 512, 4096]
    - [65, 102.88]
  - - [512, 4096, 1, 1024, 512, 512, 1024, 4096]
    - [65, 151.12]
  - - [512, 4096, 1, 2048, 512, 512, 2048, 4096]
    - [65, 183.67]
  - - [512, 4096, 1, 4096, 512, 512, 4096, 4096]
    - [65, 211.04]
  - - [512, 4096, 1, 8192, 512, 512, 8192, 4096]
    - [65, 197.44]
  - - [512, 8192, 1, 128, 512, 512, 128, 8192]
    - [12, 51.56]
  - - [512, 8192, 1, 256, 512, 512, 256, 8192]
    - [11, 88.57]
  - - [512, 8192, 1, 512, 512, 512, 512, 8192]
    - [13, 142.94]
  - - [512, 8192, 1, 1024, 512, 512, 1024, 8192]
    - [46, 190.51]
  - - [512, 8192, 1, 2048, 512, 512, 2048, 8192]
    - [8, 227.73]
  - - [512, 8192, 1, 4096, 512, 512, 4096, 8192]
    - [46, 247.9]
  - - [512, 8192, 1, 8192, 512, 512, 8192, 8192]
    - [47, 231.8]
  - - [1024, 128, 1, 128, 1024, 1024, 128, 128]
    - [60, 2.46]
  - - [1024, 128, 1, 256, 1024, 1024, 256, 128]
    - [38, 4.88]
  - - [1024, 128, 1, 512, 1024, 1024, 512, 128]
    - [73, 9.36]
  - - [1024, 128, 1, 1024, 1024, 1024, 1024, 128]
    - [91, 17.2]
  - - [1024, 128, 1, 2048, 1024, 1024, 2048, 128]
    - [87, 29.47]
  - - [1024, 128, 1, 4096, 1024, 1024, 4096, 128]
    - [87, 37.66]
  - - [1024, 128, 1, 8192, 1024, 1024, 8192, 128]
    - [90, 42.89]
  - - [1024, 256, 1, 128, 1024, 1024, 128, 256]
    - [61, 4.97]
  - - [1024, 256, 1, 256, 1024, 1024, 256, 256]
    - [59, 10.42]
  - - [1024, 256, 1, 512, 1024, 1024, 512, 256]
    - [39, 18.6]
  - - [1024, 256, 1, 1024, 1024, 1024, 1024, 256]
    - [40, 33.24]
  - - [1024, 256, 1, 2048, 1024, 1024, 2048, 256]
    - [83, 50.1]
  - - [1024, 256, 1, 4096, 1024, 1024, 4096, 256]
    - [84, 62.46]
  - - [1024, 256, 1, 8192, 1024, 1024, 8192, 256]
    - [102, 70.6]
  - - [1024, 512, 1, 128, 1024, 1024, 128, 512]
    - [24, 10.4]
  - - [1024, 512, 1, 256, 1024, 1024, 256, 512]
    - [62, 19.6]
  - - [1024, 512, 1, 512, 1024, 1024, 512, 512]
    - [35, 36.01]
  - - [1024, 512, 1, 1024, 1024, 1024, 1024, 512]
    - [75, 63.2]
  - - [1024, 512, 1, 2048, 1024, 1024, 2048, 512]
    - [98, 84.89]
  - - [1024, 512, 1, 4096, 1024, 1024, 4096, 512]
    - [100, 102.28]
  - - [1024, 512, 1, 8192, 1024, 1024, 8192, 512]
    - [100, 108.03]
  - - [1024, 1024, 1, 128, 1024, 1024, 128, 1024]
    - [72, 20.05]
  - - [1024, 1024, 1, 256, 1024, 1024, 256, 1024]
    - [71, 38.78]
  - - [1024, 1024, 1, 512, 1024, 1024, 512, 1024]
    - [29, 66.37]
  - - [1024, 1024, 1, 1024, 1024, 1024, 1024, 1024]
    - [27, 99.46]
  - - [1024, 1024, 1, 2048, 1024, 1024, 2048, 1024]
    - [94, 124.02]
  - - [1024, 1024, 1, 4096, 1024, 1024, 4096, 1024]
    - [95, 145.52]
  - - [1024, 1024, 1, 8192, 1024, 1024, 8192, 1024]
    - [94, 158.28]
  - - [1024, 2048, 1, 128, 1024, 1024, 128, 2048]
    - [65, 35.38]
  - - [1024, 2048, 1, 256, 1024, 1024, 256, 2048]
    - [20, 62.4]
  - - [1024, 2048, 1, 512, 1024, 1024, 512, 2048]
    - [18, 102.12]
  - - [1024, 2048, 1, 1024, 1024, 1024, 1024, 2048]
    - [65, 146.5]
  - - [1024, 2048, 1, 2048, 1024, 1024, 2048, 2048]
    - [65, 185.93]
  - - [1024, 2048, 1, 4096, 1024, 1024, 4096, 2048]
    - [66, 208.49]
  - - [1024, 2048, 1, 8192, 1024, 1024, 8192, 2048]
    - [65, 199.54]
  - - [1024, 4096, 1, 128, 1024, 1024, 128, 4096]
    - [16, 52.79]
  - - [1024, 4096, 1, 256, 1024, 1024, 256, 4096]
    - [16, 91.28]
  - - [1024, 4096, 1, 512, 1024, 1024, 512, 4096]
    - [11, 138.69]
  - - [1024, 4096, 1, 1024, 1024, 1024, 1024, 4096]
    - [8, 185.99]
  - - [1024, 4096, 1, 2048, 1024, 1024, 2048, 4096]
    - [47, 226.71]
  - - [1024, 4096, 1, 4096, 1024, 1024, 4096, 4096]
    - [44, 247.63]
  - - [1024, 4096, 1, 8192, 1024, 1024, 8192, 4096]
    - [48, 238.51]
  - - [1024, 8192, 1, 128, 1024, 1024, 128, 8192]
    - [3, 61.01]
  - - [1024, 8192, 1, 256, 1024, 1024, 256, 8192]
    - [6, 104.66]
  - - [1024, 8192, 1, 512, 1024, 1024, 512, 8192]
    - [7, 163.78]
  - - [1024, 8192, 1, 1024, 1024, 1024, 1024, 8192]
    - [7, 221.63]
  - - [1024, 8192, 1, 2048, 1024, 1024, 2048, 8192]
    - [6, 263.55]
  - - [1024, 8192, 1, 4096, 1024, 1024, 4096, 8192]
    - [6, 255.73]
  - - [1024, 8192, 1, 8192, 1024, 1024, 8192, 8192]
    - [0, 281.82]
  - - [2048, 128, 1, 128, 2048, 2048, 128, 128]
    - [81, 8.08]
  - - [2048, 128, 1, 256, 2048, 2048, 256, 128]
    - [80, 14.27]
  - - [2048, 128, 1, 512, 2048, 2048, 512, 128]
    - [80, 24.36]
  - - [2048, 128, 1, 1024, 2048, 2048, 1024, 128]
    - [82, 37.47]
  - - [2048, 128, 1, 2048, 2048, 2048, 2048, 128]
    - [82, 51.74]
  - - [2048, 128, 1, 4096, 2048, 2048, 4096, 128]
    - [84, 63.31]
  - - [2048, 128, 1, 8192, 2048, 2048, 8192, 128]
    - [102, 70.98]
  - - [2048, 256, 1, 128, 2048, 2048, 128, 256]
    - [38, 14.05]
  - - [2048, 256, 1, 256, 2048, 2048, 256, 256]
    - [36, 25.11]
  - - [2048, 256, 1, 512, 2048, 2048, 512, 256]
    - [77, 41.73]
  - - [2048, 256, 1, 1024, 2048, 2048, 1024, 256]
    - [77, 63.21]
  - - [2048, 256, 1, 2048, 2048, 2048, 2048, 256]
    - [99, 85.55]
  - - [2048, 256, 1, 4096, 2048, 2048, 4096, 256]
    - [99, 104.59]
  - - [2048, 256, 1, 8192, 2048, 2048, 8192, 256]
    - [100, 117.34]
  - - [2048, 512, 1, 128, 2048, 2048, 128, 512]
    - [32, 23.77]
  - - [2048, 512, 1, 256, 2048, 2048, 256, 512]
    - [31, 41.75]
  - - [2048, 512, 1, 512, 2048, 2048, 512, 512]
    - [34, 66.45]
  - - [2048, 512, 1, 1024, 2048, 2048, 1024, 512]
    - [33, 98.96]
  - - [2048, 512, 1, 2048, 2048, 2048, 2048, 512]
    - [34, 130.55]
  - - [2048, 512, 1, 4096, 2048, 2048, 4096, 512]
    - [97, 147.56]
  - - [2048, 512, 1, 8192, 2048, 2048, 8192, 512]
    - [96, 156.51]
  - - [2048, 1024, 1, 128, 2048, 2048, 128, 1024]
    - [58, 35.73]
  - - [2048, 1024, 1, 256, 2048, 2048, 256, 1024]
    - [18, 64.31]
  - - [2048, 1024, 1, 512, 2048, 2048, 512, 1024]
    - [65, 102.78]
  - - [2048, 1024, 1, 1024, 2048, 2048, 1024, 1024]
    - [66, 148.12]
  - - [2048, 1024, 1, 2048, 2048, 2048, 2048, 1024]
    - [66, 185.54]
  - - [2048, 1024, 1, 4096, 2048, 2048, 4096, 1024]
    - [66, 205.55]
  - - [2048, 1024, 1, 8192, 2048, 2048, 8192, 1024]
    - [67, 203.97]
  - - [2048, 2048, 1, 128, 2048, 2048, 128, 2048]
    - [12, 52.72]
  - - [2048, 2048, 1, 256, 2048, 2048, 256, 2048]
    - [11, 91.68]
  - - [2048, 2048, 1, 512, 2048, 2048, 512, 2048]
    - [13, 139.8]
  - - [2048, 2048, 1, 1024, 2048, 2048, 1024, 2048]
    - [46, 183.54]
  - - [2048, 2048, 1, 2048, 2048, 2048, 2048, 2048]
    - [43, 226.3]
  - - [2048, 2048, 1, 4096, 2048, 2048, 4096, 2048]
    - [43, 246.01]
  - - [2048, 2048, 1, 8192, 2048, 2048, 8192, 2048]
    - [49, 234.15]
  - - [2048, 4096, 1, 128, 2048, 2048, 128, 4096]
    - [1, 59.86]
  - - [2048, 4096, 1, 256, 2048, 2048, 256, 4096]
    - [1, 102.94]
  - - [2048, 4096, 1, 512, 2048, 2048, 512, 4096]
    - [3, 161.15]
  - - [2048, 4096, 1, 1024, 2048, 2048, 1024, 4096]
    - [3, 221.41]
  - - [2048, 4096, 1, 2048, 2048, 2048, 2048, 4096]
    - [5, 260.83]
  - - [2048, 4096, 1, 4096, 2048, 2048, 4096, 4096]
    - [6, 257.81]
  - - [2048, 4096, 1, 8192, 2048, 2048, 8192, 4096]
    - [2, 280.37]
  - - [2048, 8192, 1, 128, 2048, 2048, 128, 8192]
    - [1, 67.05]
  - - [2048, 8192, 1, 256, 2048, 2048, 256, 8192]
    - [2, 113.11]
  - - [2048, 8192, 1, 512, 2048, 2048, 512, 8192]
    - [5, 172.48]
  - - [2048, 8192, 1, 1024, 2048, 2048, 1024, 8192]
    - [2, 213.5]
  - - [2048, 8192, 1, 2048, 2048, 2048, 2048, 8192]
    - [10, 237.65]
  - - [2048, 8192, 1, 4096, 2048, 2048, 4096, 8192]
    - [4, 276.26]
  - - [2048, 8192, 1, 8192, 2048, 2048, 8192, 8192]
    - [45, 305.04]
  - - [4096, 128, 1, 128, 4096, 4096, 128, 128]
    - [37, 14.47]
  - - [4096, 128, 1, 256, 4096, 4096, 256, 128]
    - [36, 25.79]
  - - [4096, 128, 1, 512, 4096, 4096, 512, 128]
    - [75, 42.46]
  - - [4096, 128, 1, 1024, 4096, 4096, 1024, 128]
    - [75, 64.08]
  - - [4096, 128, 1, 2048, 4096, 4096, 2048, 128]
    - [98, 86.73]
  - - [4096, 128, 1, 4096, 4096, 4096, 4096, 128]
    - [99, 104.63]
  - - [4096, 128, 1, 8192, 4096, 4096, 8192, 128]
    - [100, 116.4]
  - - [4096, 256, 1, 128, 4096, 4096, 128, 256]
    - [59, 24.21]
  - - [4096, 256, 1, 256, 4096, 4096, 256, 256]
    - [25, 42.98]
  - - [4096, 256, 1, 512, 4096, 4096, 512, 256]
    - [27, 70.26]
  - - [4096, 256, 1, 1024, 4096, 4096, 1024, 256]
    - [27, 99.52]
  - - [4096, 256, 1, 2048, 4096, 4096, 2048, 256]
    - [30, 131.01]
  - - [4096, 256, 1, 4096, 4096, 4096, 4096, 256]
    - [95, 146.93]
  - - [4096, 256, 1, 8192, 4096, 4096, 8192, 256]
    - [97, 160.04]
  - - [4096, 512, 1, 128, 4096, 4096, 128, 512]
    - [58, 36.61]
  - - [4096, 512, 1, 256, 4096, 4096, 256, 512]
    - [18, 63.68]
  - - [4096, 512, 1, 512, 4096, 4096, 512, 512]
    - [18, 102.61]
  - - [4096, 512, 1, 1024, 4096, 4096, 1024, 512]
    - [66, 148.79]
  - - [4096, 512, 1, 2048, 4096, 4096, 2048, 512]
    - [68, 190.53]
  - - [4096, 512, 1, 4096, 4096, 4096, 4096, 512]
    - [66, 202.12]
  - - [4096, 512, 1, 8192, 4096, 4096, 8192, 512]
    - [66, 206.99]
  - - [4096, 1024, 1, 128, 4096, 4096, 128, 1024]
    - [12, 51.03]
  - - [4096, 1024, 1, 256, 4096, 4096, 256, 1024]
    - [13, 86.12]
  - - [4096, 1024, 1, 512, 4096, 4096, 512, 1024]
    - [10, 134.66]
  - - [4096, 1024, 1, 1024, 4096, 4096, 1024, 1024]
    - [9, 190.53]
  - - [4096, 1024, 1, 2048, 4096, 4096, 2048, 1024]
    - [9, 230.92]
  - - [4096, 1024, 1, 4096, 4096, 4096, 4096, 1024]
    - [45, 251.14]
  - - [4096, 1024, 1, 8192, 4096, 4096, 8192, 1024]
    - [44, 237.26]
  - - [4096, 2048, 1, 128, 4096, 4096, 128, 2048]
    - [12, 58.3]
  - - [4096, 2048, 1, 256, 4096, 4096, 256, 2048]
    - [3, 100.75]
  - - [4096, 2048, 1, 512, 4096, 4096, 512, 2048]
    - [3, 159.37]
  - - [4096, 2048, 1, 1024, 4096, 4096, 1024, 2048]
    - [3, 220.61]
  - - [4096, 2048, 1, 2048, 4096, 4096, 2048, 2048]
    - [7, 258.89]
  - - [4096, 2048, 1, 4096, 4096, 4096, 4096, 2048]
    - [51, 256.61]
  - - [4096, 2048, 1, 8192, 4096, 4096, 8192, 2048]
    - [56, 287.81]
  - - [4096, 4096, 1, 128, 4096, 4096, 128, 4096]
    - [1, 64.28]
  - - [4096, 4096, 1, 256, 4096, 4096, 256, 4096]
    - [1, 112.2]
  - - [4096, 4096, 1, 512, 4096, 4096, 512, 4096]
    - [7, 168.39]
  - - [4096, 4096, 1, 1024, 4096, 4096, 1024, 4096]
    - [2, 216.15]
  - - [4096, 4096, 1, 2048, 4096, 4096, 2048, 4096]
    - [52, 233.22]
  - - [4096, 4096, 1, 4096, 4096, 4096, 4096, 4096]
    - [5, 272.62]
  - - [4096, 4096, 1, 8192, 4096, 4096, 8192, 4096]
    - [4, 312.3]
  - - [4096, 8192, 1, 128, 4096, 4096, 128, 8192]
    - [1, 70.52]
  - - [4096, 8192, 1, 256, 4096, 4096, 256, 8192]
    - [4, 114.53]
  - - [4096, 8192, 1, 512, 4096, 4096, 512, 8192]
    - [10, 171.13]
  - - [4096, 8192, 1, 1024, 4096, 4096, 1024, 8192]
    - [50, 216.59]
  - - [4096, 8192, 1, 2048, 4096, 4096, 2048, 8192]
    - [7, 263.5]
  - - [4096, 8192, 1, 4096, 4096, 4096, 4096, 8192]
    - [0, 319.36]
  - - [4096, 8192, 1, 8192, 4096, 4096, 8192, 8192]
    - [0, 352.7]
  - - [8192, 128, 1, 128, 8192, 8192, 128, 128]
    - [22, 23.06]
  - - [8192, 128, 1, 256, 8192, 8192, 256, 128]
    - [27, 40.92]
  - - [8192, 128, 1, 512, 8192, 8192, 512, 128]
    - [27, 67.35]
  - - [8192, 128, 1, 1024, 8192, 8192, 1024, 128]
    - [34, 99.13]
  - - [8192, 128, 1, 2048, 8192, 8192, 2048, 128]
    - [97, 126.29]
  - - [8192, 128, 1, 4096, 8192, 8192, 4096, 128]
    - [69, 143.5]
  - - [8192, 128, 1, 8192, 8192, 8192, 8192, 128]
    - [96, 155.7]
  - - [8192, 256, 1, 128, 8192, 8192, 128, 256]
    - [18, 35.95]
  - - [8192, 256, 1, 256, 8192, 8192, 256, 256]
    - [18, 63.66]
  - - [8192, 256, 1, 512, 8192, 8192, 512, 256]
    - [21, 101.05]
  - - [8192, 256, 1, 1024, 8192, 8192, 1024, 256]
    - [68, 148.93]
  - - [8192, 256, 1, 2048, 8192, 8192, 2048, 256]
    - [67, 183.96]
  - - [8192, 256, 1, 4096, 8192, 8192, 4096, 256]
    - [67, 199.91]
  - - [8192, 256, 1, 8192, 8192, 8192, 8192, 256]
    - [68, 203.07]
  - - [8192, 512, 1, 128, 8192, 8192, 128, 512]
    - [14, 51.45]
  - - [8192, 512, 1, 256, 8192, 8192, 256, 512]
    - [15, 88.98]
  - - [8192, 512, 1, 512, 8192, 8192, 512, 512]
    - [64, 137.33]
  - - [8192, 512, 1, 1024, 8192, 8192, 1024, 512]
    - [64, 188.87]
  - - [8192, 512, 1, 2048, 8192, 8192, 2048, 512]
    - [45, 224.82]
  - - [8192, 512, 1, 4096, 8192, 8192, 4096, 512]
    - [63, 255.83]
  - - [8192, 512, 1, 8192, 8192, 8192, 8192, 512]
    - [64, 254.61]
  - - [8192, 1024, 1, 128, 8192, 8192, 128, 1024]
    - [52, 57.74]
  - - [8192, 1024, 1, 256, 8192, 8192, 256, 1024]
    - [55, 101.36]
  - - [8192, 1024, 1, 512, 8192, 8192, 512, 1024]
    - [54, 150.92]
  - - [8192, 1024, 1, 1024, 8192, 8192, 1024, 1024]
    - [5, 210.29]
  - - [8192, 1024, 1, 2048, 8192, 8192, 2048, 1024]
    - [53, 276.22]
  - - [8192, 1024, 1, 4096, 8192, 8192, 4096, 1024]
    - [54, 328.09]
  - - [8192, 1024, 1, 8192, 8192, 8192, 8192, 1024]
    - [52, 356.24]
  - - [8192, 2048, 1, 128, 8192, 8192, 128, 2048]
    - [56, 65.14]
  - - [8192, 2048, 1, 256, 8192, 8192, 256, 2048]
    - [56, 108.66]
  - - [8192, 2048, 1, 512, 8192, 8192, 512, 2048]
    - [0, 166.21]
  - - [8192, 2048, 1, 1024, 8192, 8192, 1024, 2048]
    - [55, 229.98]
  - - [8192, 2048, 1, 2048, 8192, 8192, 2048, 2048]
    - [56, 307.99]
  - - [8192, 2048, 1, 4096, 8192, 8192, 4096, 2048]
    - [52, 332.56]
  - - [8192, 2048, 1, 8192, 8192, 8192, 8192, 2048]
    - [56, 385.19]
  - - [8192, 4096, 1, 128, 8192, 8192, 128, 4096]
    - [0, 68.77]
  - - [8192, 4096, 1, 256, 8192, 8192, 256, 4096]
    - [1, 112.51]
  - - [8192, 4096, 1, 512, 8192, 8192, 512, 4096]
    - [54, 174.69]
  - - [8192, 4096, 1, 1024, 8192, 8192, 1024, 4096]
    - [56, 227.05]
  - - [8192, 4096, 1, 2048, 8192, 8192, 2048, 4096]
    - [54, 296.78]
  - - [8192, 4096, 1, 4096, 8192, 8192, 4096, 4096]
    - [56, 352.06]
  - - [8192, 4096, 1, 8192, 8192, 8192, 8192, 4096]
    - [54, 401.12]
  - - [8192, 8192, 1, 128, 8192, 8192, 128, 8192]
    - [19, 60.69]
  - - [8192, 8192, 1, 256, 8192, 8192, 256, 8192]
    - [17, 111.93]
  - - [8192, 8192, 1, 512, 8192, 8192, 512, 8192]
    - [6, 160.75]
  - - [8192, 8192, 1, 1024, 8192, 8192, 1024, 8192]
    - [2, 234.67]
  - - [8192, 8192, 1, 2048, 8192, 8192, 2048, 8192]
    - [54, 303.27]
  - - [8192, 8192, 1, 4096, 8192, 8192, 4096, 8192]
    - [52, 363.27]
  - - [8192, 8192, 1, 8192, 8192, 8192, 8192, 8192]
    - [52, 401.37]
- null
- null
- ExperimentalStreamK
- GridBased
