projects/hipblaslt/library/src/amd_detail/rocblaslt/src/Tensile/Logic/asm_full/aquavanjaram/gfx942_228cu/StreamK/aquavanjaram942_Cijk_Ailk_Bjlk_F8NHS_BH_Bias_HAS_SAV_UserArgs.yaml
- {MinimumRequiredVersion: 4.33.0}
- aquavanjaram942
- {Architecture: gfx942, CUCount: 228}
- [Device 0049, Device 0050]
    SolutionIndex: 0
    SolutionNameMin: Cijk_Ailk_Bjlk_F8NHS_BH_Bias_HAS_SAV_UserArgs_MT256x256x64_MI16x16x1_SN_LDSB0_CLR1_GRVWA4_GRVWB8_GSU0_GSUC0_GSUWGMRR0_K1_LBSPPA2048_LBSPPB2048_LPA0_LPB0_MIWT8_8_PLR1_SU0_SUM0_SUS64_VWA8_VWB8_WGM1_WGMXCC1_WGMXCCGn1
    SolutionIndex: 1
    SolutionNameMin: Cijk_Ailk_Bjlk_F8NHS_BH_Bias_HAS_SAV_UserArgs_MT256x256x64_MI16x16x1_SN_LDSB0_CLR1_GRVWA16_GRVWB8_GSU0_GSUC0_GSUWGMRR0_K1_LBSPPA2048_LBSPPB2048_LPA0_LPB0_MIWT8_8_PLR1_SU0_SUM0_SUS64_VWA8_VWB8_WGM1_WGMXCC1_WGMXCCGn1
    SolutionIndex: 2
    SolutionNameMin: Cijk_Ailk_Bjlk_F8NHS_BH_Bias_HAS_SAV_UserArgs_MT256x256x64_MI16x16x1_SN_LDSB0_CLR1_GRVWA4_GRVWB16_GSU0_GSUC0_GSUWGMRR0_K1_LBSPPA2048_LBSPPB2048_LPA0_LPB0_MIWT8_8_PLR1_SU0_SUM0_SUS64_VWA8_VWB8_WGM1_WGMXCC1_WGMXCCGn1
    SolutionIndex: 3
    SolutionNameMin: Cijk_Ailk_Bjlk_F8NHS_BH_Bias_HAS_SAV_UserArgs_MT256x256x64_MI16x16x1_SN_LDSB0_CLR1_GRVWA8_GRVWB16_GSU0_GSUC0_GSUWGMRR0_K1_LBSPPA2048_LBSPPB2048_LPA0_LPB0_MIWT8_8_PLR1_SU0_SUM0_SUS64_VWA8_VWB8_WGM1_WGMXCC1_WGMXCCGn1
    SolutionIndex: 4
    SolutionNameMin: Cijk_Ailk_Bjlk_F8NHS_BH_Bias_HAS_SAV_UserArgs_MT256x256x64_MI16x16x1_SN_LDSB0_CLR1_GRVWA16_GRVWB16_GSU0_GSUC0_GSUWGMRR0_K1_LBSPPA2048_LBSPPB2048_LPA0_LPB0_MIWT8_8_PLR1_SU0_SUM0_SUS64_VWA8_VWB8_WGM1_WGMXCC1_WGMXCCGn1
    SolutionIndex: 5
    SolutionNameMin: Cijk_Ailk_Bjlk_F8NHS_BH_Bias_HAS_SAV_UserArgs_MT256x256x64_MI16x16x1_SN_LDSB0_CLR1_GRVWA4_GRVWB4_GSU0_GSUC0_GSUWGMRR0_K1_LBSPPA2048_LBSPPB2048_LPA0_LPB0_MIWT8_8_PLR1_SU0_SUM0_SUS64_VWA8_VWB8_WGM4_WGMXCC1_WGMXCCGn1
    SolutionIndex: 6
    SolutionNameMin: Cijk_Ailk_Bjlk_F8NHS_BH_Bias_HAS_SAV_UserArgs_MT256x256x64_MI16x16x1_SN_LDSB0_CLR1_GRVWA4_GRVWB8_GSU0_GSUC0_GSUWGMRR0_K1_LBSPPA2048_LBSPPB2048_LPA0_LPB0_MIWT8_8_PLR1_SU0_SUM0_SUS64_VWA8_VWB8_WGM4_WGMXCC1_WGMXCCGn1
    SolutionIndex: 7
    SolutionNameMin: Cijk_Ailk_Bjlk_F8NHS_BH_Bias_HAS_SAV_UserArgs_MT256x256x64_MI16x16x1_SN_LDSB0_CLR1_GRVWA16_GRVWB16_GSU0_GSUC0_GSUWGMRR0_K1_LBSPPA2048_LBSPPB2048_LPA0_LPB0_MIWT8_8_PLR1_SU0_SUM0_SUS64_VWA8_VWB8_WGM4_WGMXCC1_WGMXCCGn1
    SolutionIndex: 8
    SolutionNameMin: Cijk_Ailk_Bjlk_F8NHS_BH_Bias_HAS_SAV_UserArgs_MT256x256x64_MI16x16x1_SN_LDSB0_CLR1_GRVWA4_GRVWB4_GSU0_GSUC0_GSUWGMRR0_K1_LBSPPA2048_LBSPPB2048_LPA0_LPB0_MIWT8_8_PLR1_SU0_SUM0_SUS64_VWA8_VWB8_WGM6_WGMXCC1_WGMXCCGn1
    SolutionIndex: 9
    SolutionNameMin: Cijk_Ailk_Bjlk_F8NHS_BH_Bias_HAS_SAV_UserArgs_MT256x256x64_MI16x16x1_SN_LDSB0_CLR1_GRVWA16_GRVWB4_GSU0_GSUC0_GSUWGMRR0_K1_LBSPPA2048_LBSPPB2048_LPA0_LPB0_MIWT8_8_PLR1_SU0_SUM0_SUS64_VWA8_VWB8_WGM6_WGMXCC1_WGMXCCGn1
    SolutionIndex: 10
    SolutionNameMin: Cijk_Ailk_Bjlk_F8NHS_BH_Bias_HAS_SAV_UserArgs_MT256x256x64_MI16x16x1_SN_LDSB0_CLR1_GRVWA4_GRVWB8_GSU0_GSUC0_GSUWGMRR0_K1_LBSPPA2048_LBSPPB2048_LPA0_LPB0_MIWT8_8_PLR1_SU0_SUM0_SUS64_VWA8_VWB8_WGM6_WGMXCC1_WGMXCCGn1
    SolutionIndex: 11
    SolutionNameMin: Cijk_Ailk_Bjlk_F8NHS_BH_Bias_HAS_SAV_UserArgs_MT256x256x64_MI16x16x1_SN_LDSB0_CLR1_GRVWA4_GRVWB16_GSU0_GSUC0_GSUWGMRR0_K1_LBSPPA2048_LBSPPB2048_LPA0_LPB0_MIWT8_8_PLR1_SU0_SUM0_SUS64_VWA8_VWB8_WGM6_WGMXCC1_WGMXCCGn1
    SolutionIndex: 12
    SolutionNameMin: Cijk_Ailk_Bjlk_F8NHS_BH_Bias_HAS_SAV_UserArgs_MT256x256x64_MI16x16x1_SN_LDSB0_CLR1_GRVWA8_GRVWB16_GSU0_GSUC0_GSUWGMRR0_K1_LBSPPA2048_LBSPPB2048_LPA0_LPB0_MIWT8_8_PLR1_SU0_SUM0_SUS64_VWA8_VWB8_WGM6_WGMXCC1_WGMXCCGn1
    SolutionIndex: 13
    SolutionNameMin: Cijk_Ailk_Bjlk_F8NHS_BH_Bias_HAS_SAV_UserArgs_MT256x256x64_MI16x16x1_SN_LDSB0_CLR1_GRVWA16_GRVWB16_GSU0_GSUC0_GSUWGMRR0_K1_LBSPPA2048_LBSPPB2048_LPA0_LPB0_MIWT8_8_PLR1_SU0_SUM0_SUS64_VWA8_VWB8_WGM6_WGMXCC1_WGMXCCGn1
    SolutionIndex: 14
    SolutionNameMin: Cijk_Ailk_Bjlk_F8NHS_BH_Bias_HAS_SAV_UserArgs_MT256x256x64_MI16x16x1_SN_LDSB0_CLR1_GRVWA4_GRVWB4_GSU0_GSUC0_GSUWGMRR0_K1_LBSPPA2048_LBSPPB2048_LPA0_LPB0_MIWT8_8_PLR1_SU0_SUM0_SUS64_VWA8_VWB8_WGM8_WGMXCC1_WGMXCCGn1
    SolutionIndex: 15
    SolutionNameMin: Cijk_Ailk_Bjlk_F8NHS_BH_Bias_HAS_SAV_UserArgs_MT256x256x64_MI16x16x1_SN_LDSB0_CLR1_GRVWA16_GRVWB16_GSU0_GSUC0_GSUWGMRR0_K1_LBSPPA2048_LBSPPB2048_LPA0_LPB0_MIWT8_8_PLR1_SU0_SUM0_SUS64_VWA8_VWB8_WGM8_WGMXCC1_WGMXCCGn1
    SolutionIndex: 16
    SolutionNameMin: Cijk_Ailk_Bjlk_F8NHS_BH_Bias_HAS_SAV_UserArgs_MT128x256x64_MI16x16x1_SN_LDSB1_CLR1_GRVWA4_GRVWB16_GSU0_GSUC0_GSUWGMRR0_K1_LBSPPA1024_LBSPPB2048_LPA64_LPB0_MIWT4_8_PLR1_SU0_SUM0_SUS64_VWA4_VWB8_WGM1_WGMXCC1_WGMXCCGn1
    SolutionIndex: 17
    SolutionNameMin: Cijk_Ailk_Bjlk_F8NHS_BH_Bias_HAS_SAV_UserArgs_MT128x256x64_MI16x16x1_SN_LDSB1_CLR1_GRVWA8_GRVWB16_GSU0_GSUC0_GSUWGMRR0_K1_LBSPPA1024_LBSPPB2048_LPA64_LPB0_MIWT4_8_PLR1_SU0_SUM0_SUS64_VWA4_VWB8_WGM1_WGMXCC1_WGMXCCGn1
    SolutionIndex: 18
    SolutionNameMin: Cijk_Ailk_Bjlk_F8NHS_BH_Bias_HAS_SAV_UserArgs_MT128x256x64_MI16x16x1_SN_LDSB1_CLR1_GRVWA16_GRVWB16_GSU0_GSUC0_GSUWGMRR0_K1_LBSPPA1024_LBSPPB2048_LPA64_LPB0_MIWT4_8_PLR1_SU0_SUM0_SUS64_VWA4_VWB8_WGM1_WGMXCC1_WGMXCCGn1
    SolutionIndex: 19
    SolutionNameMin: Cijk_Ailk_Bjlk_F8NHS_BH_Bias_HAS_SAV_UserArgs_MT128x256x64_MI16x16x1_SN_LDSB1_CLR1_GRVWA16_GRVWB16_GSU0_GSUC0_GSUWGMRR0_K1_LBSPPA1024_LBSPPB2048_LPA64_LPB0_MIWT4_8_PLR1_SU0_SUM0_SUS64_VWA4_VWB8_WGM4_WGMXCC1_WGMXCCGn1
    SolutionIndex: 20
    SolutionNameMin: Cijk_Ailk_Bjlk_F8NHS_BH_Bias_HAS_SAV_UserArgs_MT128x256x64_MI16x16x1_SN_LDSB1_CLR1_GRVWA8_GRVWB16_GSU0_GSUC0_GSUWGMRR0_K1_LBSPPA1024_LBSPPB2048_LPA64_LPB0_MIWT4_8_PLR1_SU0_SUM0_SUS64_VWA4_VWB8_WGM6_WGMXCC1_WGMXCCGn1
    SolutionIndex: 21
    SolutionNameMin: Cijk_Ailk_Bjlk_F8NHS_BH_Bias_HAS_SAV_UserArgs_MT128x256x64_MI16x16x1_SN_LDSB1_CLR1_GRVWA16_GRVWB16_GSU0_GSUC0_GSUWGMRR0_K1_LBSPPA1024_LBSPPB2048_LPA64_LPB0_MIWT4_8_PLR1_SU0_SUM0_SUS64_VWA4_VWB8_WGM6_WGMXCC1_WGMXCCGn1
    SolutionIndex: 22
    SolutionNameMin: Cijk_Ailk_Bjlk_F8NHS_BH_Bias_HAS_SAV_UserArgs_MT256x144x64_MI16x16x1_SN_LDSB0_CLR1_GRVWA4_GRVWB4_GSU0_GSUC0_GSUWGMRR0_K1_LBSPPA2048_LBSPPB1152_LPA64_LPB16_MIWT4_9_PLR1_SU0_SUM0_SUS64_VWA4_VWB1_WGM1_WGMXCC1_WGMXCCGn1
    SolutionIndex: 23
    SolutionNameMin: Cijk_Ailk_Bjlk_F8NHS_BH_Bias_HAS_SAV_UserArgs_MT256x144x64_MI16x16x1_SN_LDSB0_CLR1_GRVWA8_GRVWB4_GSU0_GSUC0_GSUWGMRR0_K1_LBSPPA2048_LBSPPB1152_LPA64_LPB16_MIWT4_9_PLR1_SU0_SUM0_SUS64_VWA4_VWB1_WGM1_WGMXCC1_WGMXCCGn1
    SolutionIndex: 24
    SolutionNameMin: Cijk_Ailk_Bjlk_F8NHS_BH_Bias_HAS_SAV_UserArgs_MT256x144x64_MI16x16x1_SN_LDSB0_CLR1_GRVWA16_GRVWB4_GSU0_GSUC0_GSUWGMRR0_K1_LBSPPA2048_LBSPPB1152_LPA64_LPB16_MIWT4_9_PLR1_SU0_SUM0_SUS64_VWA4_VWB1_WGM1_WGMXCC1_WGMXCCGn1
    SolutionIndex: 25
    SolutionNameMin: Cijk_Ailk_Bjlk_F8NHS_BH_Bias_HAS_SAV_UserArgs_MT256x144x64_MI16x16x1_SN_LDSB0_CLR1_GRVWA4_GRVWB4_GSU0_GSUC0_GSUWGMRR0_K1_LBSPPA2048_LBSPPB1152_LPA64_LPB16_MIWT4_9_PLR1_SU0_SUM0_SUS64_VWA4_VWB1_WGM8_WGMXCC1_WGMXCCGn1
    SolutionIndex: 26
    SolutionNameMin: Cijk_Ailk_Bjlk_F8NHS_BH_Bias_HAS_SAV_UserArgs_MT256x128x64_MI16x16x1_SN_LDSB1_CLR1_GRVWA4_GRVWB8_GSU0_GSUC0_GSUWGMRR0_K1_LBSPPA2048_LBSPPB1024_LPA0_LPB64_MIWT8_4_PLR1_SU0_SUM0_SUS64_VWA8_VWB4_WGM1_WGMXCC1_WGMXCCGn1
    SolutionIndex: 27
    SolutionNameMin: Cijk_Ailk_Bjlk_F8NHS_BH_Bias_HAS_SAV_UserArgs_MT256x128x64_MI16x16x1_SN_LDSB1_CLR1_GRVWA16_GRVWB8_GSU0_GSUC0_GSUWGMRR0_K1_LBSPPA2048_LBSPPB1024_LPA0_LPB64_MIWT8_4_PLR1_SU0_SUM0_SUS64_VWA8_VWB4_WGM1_WGMXCC1_WGMXCCGn1
    SolutionIndex: 28
    SolutionNameMin: Cijk_Ailk_Bjlk_F8NHS_BH_Bias_HAS_SAV_UserArgs_MT256x128x64_MI16x16x1_SN_LDSB1_CLR1_GRVWA16_GRVWB16_GSU0_GSUC0_GSUWGMRR0_K1_LBSPPA2048_LBSPPB1024_LPA0_LPB64_MIWT8_4_PLR1_SU0_SUM0_SUS64_VWA8_VWB4_WGM1_WGMXCC1_WGMXCCGn1
    SolutionIndex: 29
    SolutionNameMin: Cijk_Ailk_Bjlk_F8NHS_BH_Bias_HAS_SAV_UserArgs_MT256x128x64_MI16x16x1_SN_LDSB1_CLR1_GRVWA16_GRVWB16_GSU0_GSUC0_GSUWGMRR0_K1_LBSPPA2048_LBSPPB1024_LPA0_LPB64_MIWT8_4_PLR1_SU0_SUM0_SUS64_VWA8_VWB4_WGM4_WGMXCC1_WGMXCCGn1
    SolutionIndex: 30
    SolutionNameMin: Cijk_Ailk_Bjlk_F8NHS_BH_Bias_HAS_SAV_UserArgs_MT256x128x64_MI16x16x1_SN_LDSB1_CLR1_GRVWA16_GRVWB16_GSU0_GSUC0_GSUWGMRR0_K1_LBSPPA2048_LBSPPB1024_LPA0_LPB64_MIWT8_4_PLR1_SU0_SUM0_SUS64_VWA8_VWB4_WGM6_WGMXCC1_WGMXCCGn1
    SolutionIndex: 31
    SolutionNameMin: Cijk_Ailk_Bjlk_F8NHS_BH_Bias_HAS_SAV_UserArgs_MT256x128x64_MI16x16x1_SN_LDSB1_CLR1_GRVWA4_GRVWB8_GSU0_GSUC0_GSUWGMRR0_K1_LBSPPA2048_LBSPPB1024_LPA0_LPB64_MIWT8_4_PLR1_SU0_SUM0_SUS64_VWA8_VWB4_WGM8_WGMXCC1_WGMXCCGn1
    SolutionIndex: 32
    SolutionNameMin: Cijk_Ailk_Bjlk_F8NHS_BH_Bias_HAS_SAV_UserArgs_MT256x128x64_MI16x16x1_SN_LDSB1_CLR1_GRVWA8_GRVWB16_GSU0_GSUC0_GSUWGMRR0_K1_LBSPPA2048_LBSPPB1024_LPA0_LPB64_MIWT8_4_PLR1_SU0_SUM0_SUS64_VWA8_VWB4_WGM8_WGMXCC1_WGMXCCGn1
    SolutionIndex: 33
    SolutionNameMin: Cijk_Ailk_Bjlk_F8NHS_BH_Bias_HAS_SAV_UserArgs_MT256x128x64_MI16x16x1_SN_LDSB1_CLR1_GRVWA16_GRVWB16_GSU0_GSUC0_GSUWGMRR0_K1_LBSPPA2048_LBSPPB1024_LPA0_LPB64_MIWT8_4_PLR1_SU0_SUM0_SUS64_VWA8_VWB4_WGM8_WGMXCC1_WGMXCCGn1
    SolutionIndex: 34
    SolutionNameMin: Cijk_Ailk_Bjlk_F8NHS_BH_Bias_HAS_SAV_UserArgs_MT128x128x64_MI16x16x1_SN_LDSB1_CLR1_GRVWA4_GRVWB4_GSU0_GSUC0_GSUWGMRR0_K1_LBSPPA1024_LBSPPB1024_LPA0_LPB32_MIWT8_2_PLR1_SU0_SUM0_SUS64_VWA8_VWB2_WGM1_WGMXCC1_WGMXCCGn1
    SolutionIndex: 35
    SolutionNameMin: Cijk_Ailk_Bjlk_F8NHS_BH_Bias_HAS_SAV_UserArgs_MT128x128x64_MI16x16x1_SN_LDSB1_CLR1_GRVWA16_GRVWB8_GSU0_GSUC0_GSUWGMRR0_K1_LBSPPA1024_LBSPPB1024_LPA0_LPB32_MIWT8_2_PLR1_SU0_SUM0_SUS64_VWA8_VWB2_WGM1_WGMXCC1_WGMXCCGn1
    SolutionIndex: 36
    SolutionNameMin: Cijk_Ailk_Bjlk_F8NHS_BH_Bias_HAS_SAV_UserArgs_MT128x128x64_MI16x16x1_SN_LDSB1_CLR1_GRVWA16_GRVWB16_GSU0_GSUC0_GSUWGMRR0_K1_LBSPPA1024_LBSPPB1024_LPA0_LPB32_MIWT8_2_PLR1_SU0_SUM0_SUS64_VWA8_VWB2_WGM1_WGMXCC1_WGMXCCGn1
    SolutionIndex: 37
    SolutionNameMin: Cijk_Ailk_Bjlk_F8NHS_BH_Bias_HAS_SAV_UserArgs_MT128x128x64_MI16x16x1_SN_LDSB1_CLR1_GRVWA4_GRVWB4_GSU0_GSUC0_GSUWGMRR0_K1_LBSPPA1024_LBSPPB1024_LPA0_LPB32_MIWT8_2_PLR1_SU0_SUM0_SUS64_VWA8_VWB2_WGM6_WGMXCC1_WGMXCCGn1
    SolutionIndex: 38
    SolutionNameMin: Cijk_Ailk_Bjlk_F8NHS_BH_Bias_HAS_SAV_UserArgs_MT128x128x64_MI16x16x1_SN_LDSB1_CLR1_GRVWA4_GRVWB4_GSU0_GSUC0_GSUWGMRR0_K1_LBSPPA1024_LBSPPB1024_LPA0_LPB32_MIWT8_2_PLR1_SU0_SUM0_SUS64_VWA8_VWB2_WGM8_WGMXCC1_WGMXCCGn1
    SolutionIndex: 39
    SolutionNameMin: Cijk_Ailk_Bjlk_F8NHS_BH_Bias_HAS_SAV_UserArgs_MT128x128x64_MI16x16x1_SN_LDSB1_CLR1_GRVWA16_GRVWB8_GSU0_GSUC0_GSUWGMRR0_K1_LBSPPA1024_LBSPPB1024_LPA64_LPB64_MIWT4_4_PLR1_SU0_SUM0_SUS64_VWA4_VWB4_WGM1_WGMXCC1_WGMXCCGn1
    SolutionIndex: 40
    SolutionNameMin: Cijk_Ailk_Bjlk_F8NHS_BH_Bias_HAS_SAV_UserArgs_MT128x128x64_MI16x16x1_SN_LDSB1_CLR1_GRVWA8_GRVWB16_GSU0_GSUC0_GSUWGMRR0_K1_LBSPPA1024_LBSPPB1024_LPA64_LPB64_MIWT4_4_PLR1_SU0_SUM0_SUS64_VWA4_VWB4_WGM1_WGMXCC1_WGMXCCGn1
    SolutionIndex: 41
    SolutionNameMin: Cijk_Ailk_Bjlk_F8NHS_BH_Bias_HAS_SAV_UserArgs_MT128x128x64_MI16x16x1_SN_LDSB1_CLR1_GRVWA16_GRVWB16_GSU0_GSUC0_GSUWGMRR0_K1_LBSPPA1024_LBSPPB1024_LPA64_LPB64_MIWT4_4_PLR1_SU0_SUM0_SUS64_VWA4_VWB4_WGM1_WGMXCC1_WGMXCCGn1
    SolutionIndex: 42
    SolutionNameMin: Cijk_Ailk_Bjlk_F8NHS_BH_Bias_HAS_SAV_UserArgs_MT128x128x64_MI16x16x1_SN_LDSB1_CLR1_GRVWA8_GRVWB16_GSU0_GSUC0_GSUWGMRR0_K1_LBSPPA1024_LBSPPB1024_LPA64_LPB64_MIWT4_4_PLR1_SU0_SUM0_SUS64_VWA4_VWB4_WGM4_WGMXCC1_WGMXCCGn1
    SolutionIndex: 43
    SolutionNameMin: Cijk_Ailk_Bjlk_F8NHS_BH_Bias_HAS_SAV_UserArgs_MT128x128x64_MI16x16x1_SN_LDSB1_CLR1_GRVWA16_GRVWB16_GSU0_GSUC0_GSUWGMRR0_K1_LBSPPA1024_LBSPPB1024_LPA64_LPB64_MIWT4_4_PLR1_SU0_SUM0_SUS64_VWA4_VWB4_WGM4_WGMXCC1_WGMXCCGn1
    SolutionIndex: 44
    SolutionNameMin: Cijk_Ailk_Bjlk_F8NHS_BH_Bias_HAS_SAV_UserArgs_MT128x128x64_MI16x16x1_SN_LDSB1_CLR1_GRVWA16_GRVWB8_GSU0_GSUC0_GSUWGMRR0_K1_LBSPPA1024_LBSPPB1024_LPA64_LPB64_MIWT4_4_PLR1_SU0_SUM0_SUS64_VWA4_VWB4_WGM6_WGMXCC1_WGMXCCGn1
    SolutionIndex: 45
    SolutionNameMin: Cijk_Ailk_Bjlk_F8NHS_BH_Bias_HAS_SAV_UserArgs_MT128x128x64_MI16x16x1_SN_LDSB1_CLR1_GRVWA8_GRVWB16_GSU0_GSUC0_GSUWGMRR0_K1_LBSPPA1024_LBSPPB1024_LPA64_LPB64_MIWT4_4_PLR1_SU0_SUM0_SUS64_VWA4_VWB4_WGM6_WGMXCC1_WGMXCCGn1
    SolutionIndex: 46
    SolutionNameMin: Cijk_Ailk_Bjlk_F8NHS_BH_Bias_HAS_SAV_UserArgs_MT128x128x64_MI16x16x1_SN_LDSB1_CLR1_GRVWA16_GRVWB16_GSU0_GSUC0_GSUWGMRR0_K1_LBSPPA1024_LBSPPB1024_LPA64_LPB64_MIWT4_4_PLR1_SU0_SUM0_SUS64_VWA4_VWB4_WGM6_WGMXCC1_WGMXCCGn1
    SolutionIndex: 47
    SolutionNameMin: Cijk_Ailk_Bjlk_F8NHS_BH_Bias_HAS_SAV_UserArgs_MT128x128x64_MI16x16x1_SN_LDSB1_CLR1_GRVWA8_GRVWB16_GSU0_GSUC0_GSUWGMRR0_K1_LBSPPA1024_LBSPPB1024_LPA64_LPB64_MIWT4_4_PLR1_SU0_SUM0_SUS64_VWA4_VWB4_WGM8_WGMXCC1_WGMXCCGn1
    SolutionIndex: 48
    SolutionNameMin: Cijk_Ailk_Bjlk_F8NHS_BH_Bias_HAS_SAV_UserArgs_MT128x128x64_MI16x16x1_SN_LDSB1_CLR1_GRVWA16_GRVWB16_GSU0_GSUC0_GSUWGMRR0_K1_LBSPPA1024_LBSPPB1024_LPA64_LPB64_MIWT4_4_PLR1_SU0_SUM0_SUS64_VWA4_VWB4_WGM8_WGMXCC1_WGMXCCGn1
    SolutionIndex: 49
    SolutionNameMin: Cijk_Ailk_Bjlk_F8NHS_BH_Bias_HAS_SAV_UserArgs_MT64x128x64_MI16x16x1_SN_LDSB0_CLR1_GRVWA4_GRVWB4_GSU0_GSUC0_GSUWGMRR0_K1_LBSPPA512_LBSPPB1024_LPA32_LPB64_MIWT2_4_PLR1_SU0_SUM0_SUS64_VWA2_VWB4_WGM1_WGMXCC1_WGMXCCGn1
    SolutionIndex: 50
    SolutionNameMin: Cijk_Ailk_Bjlk_F8NHS_BH_Bias_HAS_SAV_UserArgs_MT64x128x64_MI16x16x1_SN_LDSB0_CLR1_GRVWA4_GRVWB8_GSU0_GSUC0_GSUWGMRR0_K1_LBSPPA512_LBSPPB1024_LPA32_LPB64_MIWT2_4_PLR1_SU0_SUM0_SUS64_VWA2_VWB4_WGM1_WGMXCC1_WGMXCCGn1
    SolutionIndex: 51
    SolutionNameMin: Cijk_Ailk_Bjlk_F8NHS_BH_Bias_HAS_SAV_UserArgs_MT64x128x64_MI16x16x1_SN_LDSB0_CLR1_GRVWA8_GRVWB16_GSU0_GSUC0_GSUWGMRR0_K1_LBSPPA512_LBSPPB1024_LPA32_LPB64_MIWT2_4_PLR1_SU0_SUM0_SUS64_VWA2_VWB4_WGM1_WGMXCC1_WGMXCCGn1
    SolutionIndex: 52
    SolutionNameMin: Cijk_Ailk_Bjlk_F8NHS_BH_Bias_HAS_SAV_UserArgs_MT64x128x64_MI16x16x1_SN_LDSB0_CLR1_GRVWA16_GRVWB16_GSU0_GSUC0_GSUWGMRR0_K1_LBSPPA512_LBSPPB1024_LPA32_LPB64_MIWT2_4_PLR1_SU0_SUM0_SUS64_VWA2_VWB4_WGM1_WGMXCC1_WGMXCCGn1
    SolutionIndex: 53
    SolutionNameMin: Cijk_Ailk_Bjlk_F8NHS_BH_Bias_HAS_SAV_UserArgs_MT128x64x64_MI16x16x1_SN_LDSB0_CLR1_GRVWA4_GRVWB8_GSU0_GSUC0_GSUWGMRR0_K1_LBSPPA1024_LBSPPB512_LPA64_LPB32_MIWT4_2_PLR1_SU0_SUM0_SUS64_VWA4_VWB2_WGM1_WGMXCC1_WGMXCCGn1
    SolutionIndex: 54
    SolutionNameMin: Cijk_Ailk_Bjlk_F8NHS_BH_Bias_HAS_SAV_UserArgs_MT128x64x64_MI16x16x1_SN_LDSB0_CLR1_GRVWA8_GRVWB8_GSU0_GSUC0_GSUWGMRR0_K1_LBSPPA1024_LBSPPB512_LPA64_LPB32_MIWT4_2_PLR1_SU0_SUM0_SUS64_VWA4_VWB2_WGM1_WGMXCC1_WGMXCCGn1
    SolutionIndex: 55
    SolutionNameMin: Cijk_Ailk_Bjlk_F8NHS_BH_Bias_HAS_SAV_UserArgs_MT128x64x64_MI16x16x1_SN_LDSB0_CLR1_GRVWA16_GRVWB16_GSU0_GSUC0_GSUWGMRR0_K1_LBSPPA1024_LBSPPB512_LPA64_LPB32_MIWT4_2_PLR1_SU0_SUM0_SUS64_VWA4_VWB2_WGM8_WGMXCC1_WGMXCCGn1
    SolutionIndex: 56
    SolutionNameMin: Cijk_Ailk_Bjlk_F8NHS_BH_Bias_HAS_SAV_UserArgs_MT128x32x64_MI16x16x1_SN_LDSB0_CLR1_GRVWA4_GRVWB4_GSU0_GSUC0_GSUWGMRR0_K1_LBSPPA1024_LBSPPB256_LPA64_LPB16_MIWT4_1_PLR1_SU0_SUM0_SUS64_VWA4_VWB1_WGM1_WGMXCC1_WGMXCCGn1
    SolutionIndex: 57
    SolutionNameMin: Cijk_Ailk_Bjlk_F8NHS_BH_Bias_HAS_SAV_UserArgs_MT128x32x64_MI16x16x1_SN_LDSB0_CLR1_GRVWA16_GRVWB4_GSU0_GSUC0_GSUWGMRR0_K1_LBSPPA1024_LBSPPB256_LPA64_LPB16_MIWT4_1_PLR1_SU0_SUM0_SUS64_VWA4_VWB1_WGM1_WGMXCC1_WGMXCCGn1
    SolutionIndex: 58
    SolutionNameMin: Cijk_Ailk_Bjlk_F8NHS_BH_Bias_HAS_SAV_UserArgs_MT128x32x64_MI16x16x1_SN_LDSB0_CLR1_GRVWA16_GRVWB4_GSU0_GSUC0_GSUWGMRR0_K1_LBSPPA1024_LBSPPB256_LPA64_LPB16_MIWT4_1_PLR1_SU0_SUM0_SUS64_VWA4_VWB1_WGM4_WGMXCC1_WGMXCCGn1
    SolutionIndex: 59
    SolutionNameMin: Cijk_Ailk_Bjlk_F8NHS_BH_Bias_HAS_SAV_UserArgs_MT128x32x64_MI16x16x1_SN_LDSB0_CLR1_GRVWA4_GRVWB8_GSU0_GSUC0_GSUWGMRR0_K1_LBSPPA1024_LBSPPB256_LPA64_LPB16_MIWT4_1_PLR1_SU0_SUM0_SUS64_VWA4_VWB1_WGM8_WGMXCC1_WGMXCCGn1
    SolutionIndex: 60
    SolutionNameMin: Cijk_Ailk_Bjlk_F8NHS_BH_Bias_HAS_SAV_UserArgs_MT64x64x64_MI16x16x1_SN_LDSB0_CLR1_GRVWA4_GRVWB4_GSU0_GSUC0_GSUWGMRR0_K1_LBSPPA512_LBSPPB512_LPA32_LPB32_MIWT2_2_PLR1_SU0_SUM0_SUS64_VWA2_VWB2_WGM1_WGMXCC1_WGMXCCGn1
    SolutionIndex: 61
    SolutionNameMin: Cijk_Ailk_Bjlk_F8NHS_BH_Bias_HAS_SAV_UserArgs_MT64x64x64_MI16x16x1_SN_LDSB0_CLR1_GRVWA4_GRVWB8_GSU0_GSUC0_GSUWGMRR0_K1_LBSPPA512_LBSPPB512_LPA32_LPB32_MIWT2_2_PLR1_SU0_SUM0_SUS64_VWA2_VWB2_WGM1_WGMXCC1_WGMXCCGn1
    SolutionIndex: 62
    SolutionNameMin: Cijk_Ailk_Bjlk_F8NHS_BH_Bias_HAS_SAV_UserArgs_MT64x64x64_MI16x16x1_SN_LDSB0_CLR1_GRVWA4_GRVWB16_GSU0_GSUC0_GSUWGMRR0_K1_LBSPPA512_LBSPPB512_LPA32_LPB32_MIWT2_2_PLR1_SU0_SUM0_SUS64_VWA2_VWB2_WGM1_WGMXCC1_WGMXCCGn1
    SolutionIndex: 63
    SolutionNameMin: Cijk_Ailk_Bjlk_F8NHS_BH_Bias_HAS_SAV_UserArgs_MT64x64x64_MI16x16x1_SN_LDSB0_CLR1_GRVWA4_GRVWB8_GSU0_GSUC0_GSUWGMRR0_K1_LBSPPA512_LBSPPB512_LPA32_LPB32_MIWT2_2_PLR1_SU0_SUM0_SUS64_VWA2_VWB2_WGM6_WGMXCC1_WGMXCCGn1
    SolutionIndex: 64
    SolutionNameMin: Cijk_Ailk_Bjlk_F8NHS_BH_Bias_HAS_SAV_UserArgs_MT32x64x64_MI16x16x1_SN_LDSB0_CLR1_GRVWA4_GRVWB8_GSU0_GSUC0_GSUWGMRR0_K1_LBSPPA256_LBSPPB512_LPA16_LPB32_MIWT1_2_PLR1_SU0_SUM0_SUS64_VWA1_VWB2_WGM8_WGMXCC1_WGMXCCGn1
    SolutionIndex: 65
    SolutionNameMin: Cijk_Ailk_Bjlk_F8NHS_BH_Bias_HAS_SAV_UserArgs_MT64x32x64_MI16x16x1_SN_LDSB0_CLR1_GRVWA4_GRVWB4_GSU0_GSUC0_GSUWGMRR0_K1_LBSPPA512_LBSPPB256_LPA32_LPB16_MIWT2_1_PLR1_SU0_SUM0_SUS64_VWA2_VWB1_WGM1_WGMXCC1_WGMXCCGn1
    SolutionIndex: 66
    SolutionNameMin: Cijk_Ailk_Bjlk_F8NHS_BH_Bias_HAS_SAV_UserArgs_MT64x32x64_MI16x16x1_SN_LDSB0_CLR1_GRVWA8_GRVWB4_GSU0_GSUC0_GSUWGMRR0_K1_LBSPPA512_LBSPPB256_LPA32_LPB16_MIWT2_1_PLR1_SU0_SUM0_SUS64_VWA2_VWB1_WGM1_WGMXCC1_WGMXCCGn1
    SolutionIndex: 67
    SolutionNameMin: Cijk_Ailk_Bjlk_F8NHS_BH_Bias_HAS_SAV_UserArgs_MT64x32x64_MI16x16x1_SN_LDSB0_CLR1_GRVWA4_GRVWB8_GSU0_GSUC0_GSUWGMRR0_K1_LBSPPA512_LBSPPB256_LPA32_LPB16_MIWT2_1_PLR1_SU0_SUM0_SUS64_VWA2_VWB1_WGM1_WGMXCC1_WGMXCCGn1
    SolutionIndex: 68
    SolutionNameMin: Cijk_Ailk_Bjlk_F8NHS_BH_Bias_HAS_SAV_UserArgs_MT64x32x64_MI16x16x1_SN_LDSB0_CLR1_GRVWA8_GRVWB8_GSU0_GSUC0_GSUWGMRR0_K1_LBSPPA512_LBSPPB256_LPA32_LPB16_MIWT2_1_PLR1_SU0_SUM0_SUS64_VWA2_VWB1_WGM1_WGMXCC1_WGMXCCGn1
    SolutionIndex: 69
    SolutionNameMin: Cijk_Ailk_Bjlk_F8NHS_BH_Bias_HAS_SAV_UserArgs_MT32x32x64_MI16x16x1_SN_LDSB0_CLR1_GRVWA4_GRVWB4_GSU0_GSUC0_GSUWGMRR0_K1_LBSPPA256_LBSPPB256_LPA16_LPB16_MIWT1_1_PLR1_SU0_SUM0_SUS64_VWA1_VWB1_WGM1_WGMXCC1_WGMXCCGn1
    SolutionIndex: 70
    SolutionNameMin: Cijk_Ailk_Bjlk_F8NHS_BH_Bias_HAS_SAV_UserArgs_MT32x32x64_MI16x16x1_SN_LDSB0_CLR1_GRVWA8_GRVWB4_GSU0_GSUC0_GSUWGMRR0_K1_LBSPPA256_LBSPPB256_LPA16_LPB16_MIWT1_1_PLR1_SU0_SUM0_SUS64_VWA1_VWB1_WGM1_WGMXCC1_WGMXCCGn1
    SolutionIndex: 71
    SolutionNameMin: Cijk_Ailk_Bjlk_F8NHS_BH_Bias_HAS_SAV_UserArgs_MT32x32x64_MI16x16x1_SN_LDSB0_CLR1_GRVWA4_GRVWB8_GSU0_GSUC0_GSUWGMRR0_K1_LBSPPA256_LBSPPB256_LPA16_LPB16_MIWT1_1_PLR1_SU0_SUM0_SUS64_VWA1_VWB1_WGM1_WGMXCC1_WGMXCCGn1
    SolutionIndex: 72
    SolutionNameMin: Cijk_Ailk_Bjlk_F8NHS_BH_Bias_HAS_SAV_UserArgs_MT32x32x64_MI16x16x1_SN_LDSB0_CLR1_GRVWA8_GRVWB8_GSU0_GSUC0_GSUWGMRR0_K1_LBSPPA256_LBSPPB256_LPA16_LPB16_MIWT1_1_PLR1_SU0_SUM0_SUS64_VWA1_VWB1_WGM1_WGMXCC1_WGMXCCGn1
    SolutionIndex: 73
    SolutionNameMin: Cijk_Ailk_Bjlk_F8NHS_BH_Bias_HAS_SAV_UserArgs_MT256x256x128_MI16x16x1_SN_LDSB1_CLR1_GRVWA16_GRVWB8_GSU0_GSUC0_GSUWGMRR0_K1_LBSPPA2048_LBSPPB2048_LPA0_LPB0_MIWT8_8_PLR1_SU0_SUM0_SUS128_VWA8_VWB8_WGM1_WGMXCC1_WGMXCCGn1
    SolutionIndex: 74
    SolutionNameMin: Cijk_Ailk_Bjlk_F8NHS_BH_Bias_HAS_SAV_UserArgs_MT256x256x128_MI16x16x1_SN_LDSB1_CLR1_GRVWA16_GRVWB16_GSU0_GSUC0_GSUWGMRR0_K1_LBSPPA2048_LBSPPB2048_LPA0_LPB0_MIWT8_8_PLR1_SU0_SUM0_SUS128_VWA8_VWB8_WGM1_WGMXCC1_WGMXCCGn1
    SolutionIndex: 75
    SolutionNameMin: Cijk_Ailk_Bjlk_F8NHS_BH_Bias_HAS_SAV_UserArgs_MT256x256x128_MI16x16x1_SN_LDSB1_CLR1_GRVWA16_GRVWB8_GSU0_GSUC0_GSUWGMRR0_K1_LBSPPA2048_LBSPPB2048_LPA0_LPB0_MIWT8_8_PLR1_SU0_SUM0_SUS128_VWA8_VWB8_WGM4_WGMXCC1_WGMXCCGn1
    SolutionIndex: 76
    SolutionNameMin: Cijk_Ailk_Bjlk_F8NHS_BH_Bias_HAS_SAV_UserArgs_MT256x256x128_MI16x16x1_SN_LDSB1_CLR1_GRVWA16_GRVWB16_GSU0_GSUC0_GSUWGMRR0_K1_LBSPPA2048_LBSPPB2048_LPA0_LPB0_MIWT8_8_PLR1_SU0_SUM0_SUS128_VWA8_VWB8_WGM4_WGMXCC1_WGMXCCGn1
    SolutionIndex: 77
    SolutionNameMin: Cijk_Ailk_Bjlk_F8NHS_BH_Bias_HAS_SAV_UserArgs_MT256x256x128_MI16x16x1_SN_LDSB1_CLR1_GRVWA8_GRVWB16_GSU0_GSUC0_GSUWGMRR0_K1_LBSPPA2048_LBSPPB2048_LPA0_LPB0_MIWT8_8_PLR1_SU0_SUM0_SUS128_VWA8_VWB8_WGM6_WGMXCC1_WGMXCCGn1
    SolutionIndex: 78
    SolutionNameMin: Cijk_Ailk_Bjlk_F8NHS_BH_Bias_HAS_SAV_UserArgs_MT256x256x128_MI16x16x1_SN_LDSB1_CLR1_GRVWA16_GRVWB16_GSU0_GSUC0_GSUWGMRR0_K1_LBSPPA2048_LBSPPB2048_LPA0_LPB0_MIWT8_8_PLR1_SU0_SUM0_SUS128_VWA8_VWB8_WGM6_WGMXCC1_WGMXCCGn1
    SolutionIndex: 79
    SolutionNameMin: Cijk_Ailk_Bjlk_F8NHS_BH_Bias_HAS_SAV_UserArgs_MT256x256x128_MI16x16x1_SN_LDSB1_CLR1_GRVWA8_GRVWB16_GSU0_GSUC0_GSUWGMRR0_K1_LBSPPA2048_LBSPPB2048_LPA0_LPB0_MIWT8_8_PLR1_SU0_SUM0_SUS128_VWA8_VWB8_WGM8_WGMXCC1_WGMXCCGn1
    SolutionIndex: 80
    SolutionNameMin: Cijk_Ailk_Bjlk_F8NHS_BH_Bias_HAS_SAV_UserArgs_MT256x256x128_MI16x16x1_SN_LDSB1_CLR1_GRVWA16_GRVWB16_GSU0_GSUC0_GSUWGMRR0_K1_LBSPPA2048_LBSPPB2048_LPA0_LPB0_MIWT8_8_PLR1_SU0_SUM0_SUS128_VWA8_VWB8_WGM8_WGMXCC1_WGMXCCGn1
    SolutionIndex: 81
    SolutionNameMin: Cijk_Ailk_Bjlk_F8NHS_BH_Bias_HAS_SAV_UserArgs_MT128x256x128_MI16x16x1_SN_LDSB1_CLR1_GRVWA4_GRVWB16_GSU0_GSUC0_GSUWGMRR0_K1_LBSPPA1024_LBSPPB2048_LPA64_LPB0_MIWT4_8_PLR1_SU0_SUM0_SUS128_VWA4_VWB8_WGM1_WGMXCC1_WGMXCCGn1
    SolutionIndex: 82
    SolutionNameMin: Cijk_Ailk_Bjlk_F8NHS_BH_Bias_HAS_SAV_UserArgs_MT128x256x128_MI16x16x1_SN_LDSB1_CLR1_GRVWA16_GRVWB16_GSU0_GSUC0_GSUWGMRR0_K1_LBSPPA1024_LBSPPB2048_LPA64_LPB0_MIWT4_8_PLR1_SU0_SUM0_SUS128_VWA4_VWB8_WGM1_WGMXCC1_WGMXCCGn1
    SolutionIndex: 83
    SolutionNameMin: Cijk_Ailk_Bjlk_F8NHS_BH_Bias_HAS_SAV_UserArgs_MT128x256x128_MI16x16x1_SN_LDSB1_CLR1_GRVWA4_GRVWB16_GSU0_GSUC0_GSUWGMRR0_K1_LBSPPA1024_LBSPPB2048_LPA64_LPB0_MIWT4_8_PLR1_SU0_SUM0_SUS128_VWA4_VWB8_WGM4_WGMXCC1_WGMXCCGn1
    SolutionIndex: 84
    SolutionNameMin: Cijk_Ailk_Bjlk_F8NHS_BH_Bias_HAS_SAV_UserArgs_MT128x256x128_MI16x16x1_SN_LDSB1_CLR1_GRVWA8_GRVWB16_GSU0_GSUC0_GSUWGMRR0_K1_LBSPPA1024_LBSPPB2048_LPA64_LPB0_MIWT4_8_PLR1_SU0_SUM0_SUS128_VWA4_VWB8_WGM4_WGMXCC1_WGMXCCGn1
    SolutionIndex: 85
    SolutionNameMin: Cijk_Ailk_Bjlk_F8NHS_BH_Bias_HAS_SAV_UserArgs_MT128x256x128_MI16x16x1_SN_LDSB1_CLR1_GRVWA16_GRVWB16_GSU0_GSUC0_GSUWGMRR0_K1_LBSPPA1024_LBSPPB2048_LPA64_LPB0_MIWT4_8_PLR1_SU0_SUM0_SUS128_VWA4_VWB8_WGM4_WGMXCC1_WGMXCCGn1
    SolutionIndex: 86
    SolutionNameMin: Cijk_Ailk_Bjlk_F8NHS_BH_Bias_HAS_SAV_UserArgs_MT128x256x128_MI16x16x1_SN_LDSB1_CLR1_GRVWA4_GRVWB16_GSU0_GSUC0_GSUWGMRR0_K1_LBSPPA1024_LBSPPB2048_LPA64_LPB0_MIWT4_8_PLR1_SU0_SUM0_SUS128_VWA4_VWB8_WGM6_WGMXCC1_WGMXCCGn1
    SolutionIndex: 87
    SolutionNameMin: Cijk_Ailk_Bjlk_F8NHS_BH_Bias_HAS_SAV_UserArgs_MT128x256x128_MI16x16x1_SN_LDSB1_CLR1_GRVWA4_GRVWB16_GSU0_GSUC0_GSUWGMRR0_K1_LBSPPA1024_LBSPPB2048_LPA64_LPB0_MIWT4_8_PLR1_SU0_SUM0_SUS128_VWA4_VWB8_WGM8_WGMXCC1_WGMXCCGn1
    SolutionIndex: 88
    SolutionNameMin: Cijk_Ailk_Bjlk_F8NHS_BH_Bias_HAS_SAV_UserArgs_MT128x256x128_MI16x16x1_SN_LDSB1_CLR1_GRVWA16_GRVWB16_GSU0_GSUC0_GSUWGMRR0_K1_LBSPPA1024_LBSPPB2048_LPA64_LPB0_MIWT4_8_PLR1_SU0_SUM0_SUS128_VWA4_VWB8_WGM8_WGMXCC1_WGMXCCGn1
    SolutionIndex: 89
    SolutionNameMin: Cijk_Ailk_Bjlk_F8NHS_BH_Bias_HAS_SAV_UserArgs_MT128x128x128_MI16x16x1_SN_LDSB1_CLR1_GRVWA16_GRVWB16_GSU0_GSUC0_GSUWGMRR0_K1_LBSPPA1024_LBSPPB1024_LPA64_LPB64_MIWT4_4_PLR1_SU0_SUM0_SUS128_VWA4_VWB4_WGM1_WGMXCC1_WGMXCCGn1
    SolutionIndex: 90
    SolutionNameMin: Cijk_Ailk_Bjlk_F8NHS_BH_Bias_HAS_SAV_UserArgs_MT128x128x128_MI16x16x1_SN_LDSB1_CLR1_GRVWA16_GRVWB16_GSU0_GSUC0_GSUWGMRR0_K1_LBSPPA1024_LBSPPB1024_LPA64_LPB64_MIWT4_4_PLR1_SU0_SUM0_SUS128_VWA4_VWB4_WGM4_WGMXCC1_WGMXCCGn1
    SolutionIndex: 91
    SolutionNameMin: Cijk_Ailk_Bjlk_F8NHS_BH_Bias_HAS_SAV_UserArgs_MT128x128x128_MI16x16x1_SN_LDSB1_CLR1_GRVWA16_GRVWB16_GSU0_GSUC0_GSUWGMRR0_K1_LBSPPA1024_LBSPPB1024_LPA64_LPB64_MIWT4_4_PLR1_SU0_SUM0_SUS128_VWA4_VWB4_WGM6_WGMXCC1_WGMXCCGn1
    SolutionIndex: 92
    SolutionNameMin: Cijk_Ailk_Bjlk_F8NHS_BH_Bias_HAS_SAV_UserArgs_MT128x64x128_MI16x16x1_SN_LDSB1_CLR1_GRVWA4_GRVWB8_GSU0_GSUC0_GSUWGMRR0_K1_LBSPPA1024_LBSPPB512_LPA64_LPB32_MIWT4_2_PLR1_SU0_SUM0_SUS128_VWA4_VWB2_WGM1_WGMXCC1_WGMXCCGn1
    SolutionIndex: 93
    SolutionNameMin: Cijk_Ailk_Bjlk_F8NHS_BH_Bias_HAS_SAV_UserArgs_MT128x64x128_MI16x16x1_SN_LDSB1_CLR1_GRVWA16_GRVWB16_GSU0_GSUC0_GSUWGMRR0_K1_LBSPPA1024_LBSPPB512_LPA64_LPB32_MIWT4_2_PLR1_SU0_SUM0_SUS128_VWA4_VWB2_WGM1_WGMXCC1_WGMXCCGn1
    SolutionIndex: 94
    SolutionNameMin: Cijk_Ailk_Bjlk_F8NHS_BH_Bias_HAS_SAV_UserArgs_MT128x64x128_MI16x16x1_SN_LDSB1_CLR1_GRVWA16_GRVWB16_GSU0_GSUC0_GSUWGMRR0_K1_LBSPPA1024_LBSPPB512_LPA64_LPB32_MIWT4_2_PLR1_SU0_SUM0_SUS128_VWA4_VWB2_WGM4_WGMXCC1_WGMXCCGn1
    SolutionIndex: 95
    SolutionNameMin: Cijk_Ailk_Bjlk_F8NHS_BH_Bias_HAS_SAV_UserArgs_MT128x64x128_MI16x16x1_SN_LDSB1_CLR1_GRVWA16_GRVWB16_GSU0_GSUC0_GSUWGMRR0_K1_LBSPPA1024_LBSPPB512_LPA64_LPB32_MIWT4_2_PLR1_SU0_SUM0_SUS128_VWA4_VWB2_WGM6_WGMXCC1_WGMXCCGn1
    SolutionIndex: 96
    SolutionNameMin: Cijk_Ailk_Bjlk_F8NHS_BH_Bias_HAS_SAV_UserArgs_MT128x64x128_MI16x16x1_SN_LDSB1_CLR1_GRVWA16_GRVWB16_GSU0_GSUC0_GSUWGMRR0_K1_LBSPPA1024_LBSPPB512_LPA64_LPB32_MIWT4_2_PLR1_SU0_SUM0_SUS128_VWA4_VWB2_WGM8_WGMXCC1_WGMXCCGn1
    SolutionIndex: 97
    SolutionNameMin: Cijk_Ailk_Bjlk_F8NHS_BH_Bias_HAS_SAV_UserArgs_MT128x32x128_MI16x16x1_SN_LDSB1_CLR1_GRVWA4_GRVWB4_GSU0_GSUC0_GSUWGMRR0_K1_LBSPPA1024_LBSPPB256_LPA64_LPB16_MIWT4_1_PLR1_SU0_SUM0_SUS128_VWA4_VWB1_WGM1_WGMXCC1_WGMXCCGn1
    SolutionIndex: 98
    SolutionNameMin: Cijk_Ailk_Bjlk_F8NHS_BH_Bias_HAS_SAV_UserArgs_MT64x64x128_MI16x16x1_SN_LDSB1_CLR1_GRVWA4_GRVWB8_GSU0_GSUC0_GSUWGMRR0_K1_LBSPPA512_LBSPPB512_LPA32_LPB32_MIWT2_2_PLR1_SU0_SUM0_SUS128_VWA2_VWB2_WGM1_WGMXCC1_WGMXCCGn1
    SolutionIndex: 99
    SolutionNameMin: Cijk_Ailk_Bjlk_F8NHS_BH_Bias_HAS_SAV_UserArgs_MT64x64x128_MI16x16x1_SN_LDSB1_CLR1_GRVWA4_GRVWB16_GSU0_GSUC0_GSUWGMRR0_K1_LBSPPA512_LBSPPB512_LPA32_LPB32_MIWT2_2_PLR1_SU0_SUM0_SUS128_VWA2_VWB2_WGM1_WGMXCC1_WGMXCCGn1
    SolutionIndex: 100
    SolutionNameMin: Cijk_Ailk_Bjlk_F8NHS_BH_Bias_HAS_SAV_UserArgs_MT64x64x128_MI16x16x1_SN_LDSB1_CLR1_GRVWA8_GRVWB16_GSU0_GSUC0_GSUWGMRR0_K1_LBSPPA512_LBSPPB512_LPA32_LPB32_MIWT2_2_PLR1_SU0_SUM0_SUS128_VWA2_VWB2_WGM1_WGMXCC1_WGMXCCGn1
    SolutionIndex: 101
    SolutionNameMin: Cijk_Ailk_Bjlk_F8NHS_BH_Bias_HAS_SAV_UserArgs_MT64x64x128_MI16x16x1_SN_LDSB1_CLR1_GRVWA16_GRVWB16_GSU0_GSUC0_GSUWGMRR0_K1_LBSPPA512_LBSPPB512_LPA32_LPB32_MIWT2_2_PLR1_SU0_SUM0_SUS128_VWA2_VWB2_WGM1_WGMXCC1_WGMXCCGn1
    SolutionIndex: 102
    SolutionNameMin: Cijk_Ailk_Bjlk_F8NHS_BH_Bias_HAS_SAV_UserArgs_MT64x64x128_MI16x16x1_SN_LDSB1_CLR1_GRVWA8_GRVWB16_GSU0_GSUC0_GSUWGMRR0_K1_LBSPPA512_LBSPPB512_LPA32_LPB32_MIWT2_2_PLR1_SU0_SUM0_SUS128_VWA2_VWB2_WGM4_WGMXCC1_WGMXCCGn1
    SolutionIndex: 103
    SolutionNameMin: Cijk_Ailk_Bjlk_F8NHS_BH_Bias_HAS_SAV_UserArgs_MT64x64x128_MI16x16x1_SN_LDSB1_CLR1_GRVWA16_GRVWB16_GSU0_GSUC0_GSUWGMRR0_K1_LBSPPA512_LBSPPB512_LPA32_LPB32_MIWT2_2_PLR1_SU0_SUM0_SUS128_VWA2_VWB2_WGM4_WGMXCC1_WGMXCCGn1
    SolutionIndex: 104
    SolutionNameMin: Cijk_Ailk_Bjlk_F8NHS_BH_Bias_HAS_SAV_UserArgs_MT64x64x128_MI16x16x1_SN_LDSB1_CLR1_GRVWA4_GRVWB16_GSU0_GSUC0_GSUWGMRR0_K1_LBSPPA512_LBSPPB512_LPA32_LPB32_MIWT2_2_PLR1_SU0_SUM0_SUS128_VWA2_VWB2_WGM6_WGMXCC1_WGMXCCGn1
    SolutionIndex: 105
    SolutionNameMin: Cijk_Ailk_Bjlk_F8NHS_BH_Bias_HAS_SAV_UserArgs_MT64x64x128_MI16x16x1_SN_LDSB1_CLR1_GRVWA8_GRVWB16_GSU0_GSUC0_GSUWGMRR0_K1_LBSPPA512_LBSPPB512_LPA32_LPB32_MIWT2_2_PLR1_SU0_SUM0_SUS128_VWA2_VWB2_WGM6_WGMXCC1_WGMXCCGn1
    SolutionIndex: 106
    SolutionNameMin: Cijk_Ailk_Bjlk_F8NHS_BH_Bias_HAS_SAV_UserArgs_MT64x64x128_MI16x16x1_SN_LDSB1_CLR1_GRVWA16_GRVWB16_GSU0_GSUC0_GSUWGMRR0_K1_LBSPPA512_LBSPPB512_LPA32_LPB32_MIWT2_2_PLR1_SU0_SUM0_SUS128_VWA2_VWB2_WGM6_WGMXCC1_WGMXCCGn1
    SolutionIndex: 107
    SolutionNameMin: Cijk_Ailk_Bjlk_F8NHS_BH_Bias_HAS_SAV_UserArgs_MT64x64x128_MI16x16x1_SN_LDSB1_CLR1_GRVWA4_GRVWB16_GSU0_GSUC0_GSUWGMRR0_K1_LBSPPA512_LBSPPB512_LPA32_LPB32_MIWT2_2_PLR1_SU0_SUM0_SUS128_VWA2_VWB2_WGM8_WGMXCC1_WGMXCCGn1
    SolutionIndex: 108
    SolutionNameMin: Cijk_Ailk_Bjlk_F8NHS_BH_Bias_HAS_SAV_UserArgs_MT64x64x128_MI16x16x1_SN_LDSB1_CLR1_GRVWA16_GRVWB16_GSU0_GSUC0_GSUWGMRR0_K1_LBSPPA512_LBSPPB512_LPA32_LPB32_MIWT2_2_PLR1_SU0_SUM0_SUS128_VWA2_VWB2_WGM8_WGMXCC1_WGMXCCGn1
    SolutionIndex: 109
    SolutionNameMin: Cijk_Ailk_Bjlk_F8NHS_BH_Bias_HAS_SAV_UserArgs_MT32x64x128_MI16x16x1_SN_LDSB0_CLR1_GRVWA16_GRVWB16_GSU0_GSUC0_GSUWGMRR0_K1_LBSPPA256_LBSPPB512_LPA16_LPB32_MIWT1_2_PLR1_SU0_SUM0_SUS128_VWA1_VWB2_WGM1_WGMXCC1_WGMXCCGn1
    SolutionIndex: 110
    SolutionNameMin: Cijk_Ailk_Bjlk_F8NHS_BH_Bias_HAS_SAV_UserArgs_MT32x64x128_MI16x16x1_SN_LDSB0_CLR1_GRVWA16_GRVWB16_GSU0_GSUC0_GSUWGMRR0_K1_LBSPPA256_LBSPPB512_LPA16_LPB32_MIWT1_2_PLR1_SU0_SUM0_SUS128_VWA1_VWB2_WGM4_WGMXCC1_WGMXCCGn1
    SolutionIndex: 111
    SolutionNameMin: Cijk_Ailk_Bjlk_F8NHS_BH_Bias_HAS_SAV_UserArgs_MT32x64x128_MI16x16x1_SN_LDSB0_CLR1_GRVWA8_GRVWB16_GSU0_GSUC0_GSUWGMRR0_K1_LBSPPA256_LBSPPB512_LPA16_LPB32_MIWT1_2_PLR1_SU0_SUM0_SUS128_VWA1_VWB2_WGM6_WGMXCC1_WGMXCCGn1
    SolutionIndex: 112
    SolutionNameMin: Cijk_Ailk_Bjlk_F8NHS_BH_Bias_HAS_SAV_UserArgs_MT32x64x128_MI16x16x1_SN_LDSB0_CLR1_GRVWA16_GRVWB16_GSU0_GSUC0_GSUWGMRR0_K1_LBSPPA256_LBSPPB512_LPA16_LPB32_MIWT1_2_PLR1_SU0_SUM0_SUS128_VWA1_VWB2_WGM6_WGMXCC1_WGMXCCGn1
    SolutionIndex: 113
    SolutionNameMin: Cijk_Ailk_Bjlk_F8NHS_BH_Bias_HAS_SAV_UserArgs_MT32x64x128_MI16x16x1_SN_LDSB0_CLR1_GRVWA16_GRVWB16_GSU0_GSUC0_GSUWGMRR0_K1_LBSPPA256_LBSPPB512_LPA16_LPB32_MIWT1_2_PLR1_SU0_SUM0_SUS128_VWA1_VWB2_WGM8_WGMXCC1_WGMXCCGn1
    SolutionIndex: 114
    SolutionNameMin: Cijk_Ailk_Bjlk_F8NHS_BH_Bias_HAS_SAV_UserArgs_MT64x32x128_MI16x16x1_SN_LDSB0_CLR1_GRVWA4_GRVWB4_GSU0_GSUC0_GSUWGMRR0_K1_LBSPPA512_LBSPPB256_LPA32_LPB16_MIWT2_1_PLR1_SU0_SUM0_SUS128_VWA2_VWB1_WGM1_WGMXCC1_WGMXCCGn1
    SolutionIndex: 115
    SolutionNameMin: Cijk_Ailk_Bjlk_F8NHS_BH_Bias_HAS_SAV_UserArgs_MT64x32x128_MI16x16x1_SN_LDSB0_CLR1_GRVWA4_GRVWB8_GSU0_GSUC0_GSUWGMRR0_K1_LBSPPA512_LBSPPB256_LPA32_LPB16_MIWT2_1_PLR1_SU0_SUM0_SUS128_VWA2_VWB1_WGM1_WGMXCC1_WGMXCCGn1
    SolutionIndex: 116
    SolutionNameMin: Cijk_Ailk_Bjlk_F8NHS_BH_Bias_HAS_SAV_UserArgs_MT64x32x128_MI16x16x1_SN_LDSB0_CLR1_GRVWA8_GRVWB8_GSU0_GSUC0_GSUWGMRR0_K1_LBSPPA512_LBSPPB256_LPA32_LPB16_MIWT2_1_PLR1_SU0_SUM0_SUS128_VWA2_VWB1_WGM1_WGMXCC1_WGMXCCGn1
    SolutionIndex: 117
    SolutionNameMin: Cijk_Ailk_Bjlk_F8NHS_BH_Bias_HAS_SAV_UserArgs_MT64x32x128_MI16x16x1_SN_LDSB0_CLR1_GRVWA8_GRVWB16_GSU0_GSUC0_GSUWGMRR0_K1_LBSPPA512_LBSPPB256_LPA32_LPB16_MIWT2_1_PLR1_SU0_SUM0_SUS128_VWA2_VWB1_WGM1_WGMXCC1_WGMXCCGn1
    SolutionIndex: 118
    SolutionNameMin: Cijk_Ailk_Bjlk_F8NHS_BH_Bias_HAS_SAV_UserArgs_MT64x32x128_MI16x16x1_SN_LDSB0_CLR1_GRVWA16_GRVWB16_GSU0_GSUC0_GSUWGMRR0_K1_LBSPPA512_LBSPPB256_LPA32_LPB16_MIWT2_1_PLR1_SU0_SUM0_SUS128_VWA2_VWB1_WGM1_WGMXCC1_WGMXCCGn1
    SolutionIndex: 119
    SolutionNameMin: Cijk_Ailk_Bjlk_F8NHS_BH_Bias_HAS_SAV_UserArgs_MT32x32x128_MI16x16x1_SN_LDSB0_CLR1_GRVWA4_GRVWB4_GSU0_GSUC0_GSUWGMRR0_K1_LBSPPA256_LBSPPB256_LPA16_LPB16_MIWT1_1_PLR1_SU0_SUM0_SUS128_VWA1_VWB1_WGM1_WGMXCC1_WGMXCCGn1
    SolutionIndex: 120
    SolutionNameMin: Cijk_Ailk_Bjlk_F8NHS_BH_Bias_HAS_SAV_UserArgs_MT32x32x128_MI16x16x1_SN_LDSB0_CLR1_GRVWA8_GRVWB4_GSU0_GSUC0_GSUWGMRR0_K1_LBSPPA256_LBSPPB256_LPA16_LPB16_MIWT1_1_PLR1_SU0_SUM0_SUS128_VWA1_VWB1_WGM1_WGMXCC1_WGMXCCGn1
    SolutionIndex: 121
    SolutionNameMin: Cijk_Ailk_Bjlk_F8NHS_BH_Bias_HAS_SAV_UserArgs_MT32x32x128_MI16x16x1_SN_LDSB0_CLR1_GRVWA4_GRVWB8_GSU0_GSUC0_GSUWGMRR0_K1_LBSPPA256_LBSPPB256_LPA16_LPB16_MIWT1_1_PLR1_SU0_SUM0_SUS128_VWA1_VWB1_WGM1_WGMXCC1_WGMXCCGn1
    SolutionIndex: 122
    SolutionNameMin: Cijk_Ailk_Bjlk_F8NHS_BH_Bias_HAS_SAV_UserArgs_MT32x32x128_MI16x16x1_SN_LDSB0_CLR1_GRVWA8_GRVWB8_GSU0_GSUC0_GSUWGMRR0_K1_LBSPPA256_LBSPPB256_LPA16_LPB16_MIWT1_1_PLR1_SU0_SUM0_SUS128_VWA1_VWB1_WGM1_WGMXCC1_WGMXCCGn1
    SolutionIndex: 123
    SolutionNameMin: Cijk_Ailk_Bjlk_F8NHS_BH_Bias_HAS_SAV_UserArgs_MT32x32x128_MI16x16x1_SN_LDSB0_CLR1_GRVWA16_GRVWB8_GSU0_GSUC0_GSUWGMRR0_K1_LBSPPA256_LBSPPB256_LPA16_LPB16_MIWT1_1_PLR1_SU0_SUM0_SUS128_VWA1_VWB1_WGM1_WGMXCC1_WGMXCCGn1
    SolutionIndex: 124
    SolutionNameMin: Cijk_Ailk_Bjlk_F8NHS_BH_Bias_HAS_SAV_UserArgs_MT32x32x128_MI16x16x1_SN_LDSB0_CLR1_GRVWA8_GRVWB16_GSU0_GSUC0_GSUWGMRR0_K1_LBSPPA256_LBSPPB256_LPA16_LPB16_MIWT1_1_PLR1_SU0_SUM0_SUS128_VWA1_VWB1_WGM1_WGMXCC1_WGMXCCGn1
    SolutionIndex: 125
    SolutionNameMin: Cijk_Ailk_Bjlk_F8NHS_BH_Bias_HAS_SAV_UserArgs_MT32x32x128_MI16x16x1_SN_LDSB0_CLR1_GRVWA4_GRVWB16_GSU0_GSUC0_GSUWGMRR0_K1_LBSPPA256_LBSPPB256_LPA16_LPB16_MIWT1_1_PLR1_SU0_SUM0_SUS128_VWA1_VWB1_WGM6_WGMXCC1_WGMXCCGn1
    SolutionIndex: 126
    SolutionNameMin: Cijk_Ailk_Bjlk_F8NHS_BH_Bias_HAS_SAV_UserArgs_MT32x32x128_MI16x16x1_SN_LDSB0_CLR1_GRVWA4_GRVWB4_GSU0_GSUC0_GSUWGMRR0_K1_LBSPPA256_LBSPPB256_LPA16_LPB16_MIWT1_1_PLR1_SU0_SUM0_SUS128_VWA1_VWB1_WGM8_WGMXCC1_WGMXCCGn1
    SolutionIndex: 127
    SolutionNameMin: Cijk_Ailk_Bjlk_F8NHS_BH_Bias_HAS_SAV_UserArgs_MT128x64x256_MI16x16x1_SN_LDSB1_CLR1_GRVWA16_GRVWB16_GSU0_GSUC0_GSUWGMRR0_K1_LBSPPA1024_LBSPPB512_LPA64_LPB32_MIWT4_2_PLR1_SU0_SUM0_SUS256_VWA4_VWB2_WGM1_WGMXCC1_WGMXCCGn1
    SolutionIndex: 128
    SolutionNameMin: Cijk_Ailk_Bjlk_F8NHS_BH_Bias_HAS_SAV_UserArgs_MT128x64x256_MI16x16x1_SN_LDSB1_CLR1_GRVWA16_GRVWB16_GSU0_GSUC0_GSUWGMRR0_K1_LBSPPA1024_LBSPPB512_LPA64_LPB32_MIWT4_2_PLR1_SU0_SUM0_SUS256_VWA4_VWB2_WGM4_WGMXCC1_WGMXCCGn1
    SolutionIndex: 129
    SolutionNameMin: Cijk_Ailk_Bjlk_F8NHS_BH_Bias_HAS_SAV_UserArgs_MT64x64x256_MI16x16x1_SN_LDSB1_CLR1_GRVWA16_GRVWB16_GSU0_GSUC0_GSUWGMRR0_K1_LBSPPA512_LBSPPB512_LPA32_LPB32_MIWT2_2_PLR1_SU0_SUM0_SUS256_VWA2_VWB2_WGM1_WGMXCC1_WGMXCCGn1
    SolutionIndex: 130
    SolutionNameMin: Cijk_Ailk_Bjlk_F8NHS_BH_Bias_HAS_SAV_UserArgs_MT64x64x256_MI16x16x1_SN_LDSB1_CLR1_GRVWA4_GRVWB16_GSU0_GSUC0_GSUWGMRR0_K1_LBSPPA512_LBSPPB512_LPA32_LPB32_MIWT2_2_PLR1_SU0_SUM0_SUS256_VWA2_VWB2_WGM6_WGMXCC1_WGMXCCGn1
    SolutionIndex: 131
    SolutionNameMin: Cijk_Ailk_Bjlk_F8NHS_BH_Bias_HAS_SAV_UserArgs_MT64x32x256_MI16x16x1_SN_LDSB1_CLR1_GRVWA16_GRVWB16_GSU0_GSUC0_GSUWGMRR0_K1_LBSPPA512_LBSPPB256_LPA32_LPB16_MIWT2_1_PLR1_SU0_SUM0_SUS256_VWA2_VWB1_WGM1_WGMXCC1_WGMXCCGn1
    SolutionIndex: 132
    SolutionNameMin: Cijk_Ailk_Bjlk_F8NHS_BH_Bias_HAS_SAV_UserArgs_MT64x32x256_MI16x16x1_SN_LDSB1_CLR1_GRVWA16_GRVWB16_GSU0_GSUC0_GSUWGMRR0_K1_LBSPPA512_LBSPPB256_LPA32_LPB16_MIWT2_1_PLR1_SU0_SUM0_SUS256_VWA2_VWB1_WGM4_WGMXCC1_WGMXCCGn1
    SolutionIndex: 133
    SolutionNameMin: Cijk_Ailk_Bjlk_F8NHS_BH_Bias_HAS_SAV_UserArgs_MT64x32x256_MI16x16x1_SN_LDSB1_CLR1_GRVWA16_GRVWB16_GSU0_GSUC0_GSUWGMRR0_K1_LBSPPA512_LBSPPB256_LPA32_LPB16_MIWT2_1_PLR1_SU0_SUM0_SUS256_VWA2_VWB1_WGM6_WGMXCC1_WGMXCCGn1
    SolutionIndex: 134
    SolutionNameMin: Cijk_Ailk_Bjlk_F8NHS_BH_Bias_HAS_SAV_UserArgs_MT32x32x256_MI16x16x1_SN_LDSB1_CLR1_GRVWA8_GRVWB16_GSU0_GSUC0_GSUWGMRR0_K1_LBSPPA256_LBSPPB256_LPA16_LPB16_MIWT1_1_PLR1_SU0_SUM0_SUS256_VWA1_VWB1_WGM1_WGMXCC1_WGMXCCGn1
    SolutionIndex: 135
    SolutionNameMin: Cijk_Ailk_Bjlk_F8NHS_BH_Bias_HAS_SAV_UserArgs_MT32x32x256_MI16x16x1_SN_LDSB1_CLR1_GRVWA16_GRVWB16_GSU0_GSUC0_GSUWGMRR0_K1_LBSPPA256_LBSPPB256_LPA16_LPB16_MIWT1_1_PLR1_SU0_SUM0_SUS256_VWA1_VWB1_WGM1_WGMXCC1_WGMXCCGn1
    SolutionIndex: 136
    SolutionNameMin: Cijk_Ailk_Bjlk_F8NHS_BH_Bias_HAS_SAV_UserArgs_MT32x32x256_MI16x16x1_SN_LDSB1_CLR1_GRVWA16_GRVWB16_GSU0_GSUC0_GSUWGMRR0_K1_LBSPPA256_LBSPPB256_LPA16_LPB16_MIWT1_1_PLR1_SU0_SUM0_SUS256_VWA1_VWB1_WGM4_WGMXCC1_WGMXCCGn1
    SolutionIndex: 137
    SolutionNameMin: Cijk_Ailk_Bjlk_F8NHS_BH_Bias_HAS_SAV_UserArgs_MT32x32x256_MI16x16x1_SN_LDSB1_CLR1_GRVWA16_GRVWB16_GSU0_GSUC0_GSUWGMRR0_K1_LBSPPA256_LBSPPB256_LPA16_LPB16_MIWT1_1_PLR1_SU0_SUM0_SUS256_VWA1_VWB1_WGM6_WGMXCC1_WGMXCCGn1
    SolutionIndex: 138
    SolutionNameMin: Cijk_Ailk_Bjlk_F8NHS_BH_Bias_HAS_SAV_UserArgs_MT32x32x256_MI16x16x1_SN_LDSB1_CLR1_GRVWA16_GRVWB16_GSU0_GSUC0_GSUWGMRR0_K1_LBSPPA256_LBSPPB256_LPA16_LPB16_MIWT1_1_PLR1_SU0_SUM0_SUS256_VWA1_VWB1_WGM8_WGMXCC1_WGMXCCGn1
- - - [128, 128, 1, 128, 128, 128, 128, 128]
    - [126, 0.49]
  - - [128, 128, 1, 256, 128, 128, 128, 128]
    - [69, 0.93]
  - - [128, 128, 1, 512, 128, 128, 128, 128]
    - [121, 1.5]
  - - [128, 128, 1, 1024, 128, 128, 128, 128]
    - [124, 2.25]
  - - [128, 128, 1, 2048, 128, 128, 128, 128]
    - [124, 2.98]
  - - [128, 128, 1, 4096, 128, 128, 128, 128]
    - [124, 3.55]
  - - [128, 128, 1, 8192, 128, 128, 128, 128]
    - [135, 3.93]
  - - [128, 256, 1, 128, 128, 128, 128, 256]
    - [121, 1.02]
  - - [128, 256, 1, 256, 128, 128, 128, 256]
    - [121, 1.84]
  - - [128, 256, 1, 512, 128, 128, 128, 256]
    - [119, 3.02]
  - - [128, 256, 1, 1024, 128, 128, 128, 256]
    - [122, 4.55]
  - - [128, 256, 1, 2048, 128, 128, 128, 256]
    - [124, 5.95]
  - - [128, 256, 1, 4096, 128, 128, 128, 256]
    - [124, 7.07]
  - - [128, 256, 1, 8192, 128, 128, 128, 256]
    - [135, 7.9]
  - - [128, 512, 1, 128, 128, 128, 128, 512]
    - [71, 2.09]
  - - [128, 512, 1, 256, 128, 128, 128, 512]
    - [69, 3.52]
  - - [128, 512, 1, 512, 128, 128, 128, 512]
    - [72, 5.77]
  - - [128, 512, 1, 1024, 128, 128, 128, 512]
    - [123, 8.59]
  - - [128, 512, 1, 2048, 128, 128, 128, 512]
    - [124, 11.48]
  - - [128, 512, 1, 4096, 128, 128, 128, 512]
    - [124, 13.95]
  - - [128, 512, 1, 8192, 128, 128, 128, 512]
    - [134, 14.89]
  - - [128, 1024, 1, 128, 128, 128, 128, 1024]
    - [69, 4.09]
  - - [128, 1024, 1, 256, 128, 128, 128, 1024]
    - [69, 7.2]
  - - [128, 1024, 1, 512, 128, 128, 128, 1024]
    - [119, 11.49]
  - - [128, 1024, 1, 1024, 128, 128, 128, 1024]
    - [122, 17.2]
  - - [128, 1024, 1, 2048, 128, 128, 128, 1024]
    - [124, 23.08]
  - - [128, 1024, 1, 4096, 128, 128, 128, 1024]
    - [134, 25.88]
  - - [128, 1024, 1, 8192, 128, 128, 128, 1024]
    - [125, 27.78]
  - - [128, 2048, 1, 128, 128, 128, 128, 2048]
    - [65, 7.74]
  - - [128, 2048, 1, 256, 128, 128, 128, 2048]
    - [114, 13.3]
  - - [128, 2048, 1, 512, 128, 128, 128, 2048]
    - [114, 21.52]
  - - [128, 2048, 1, 1024, 128, 128, 128, 2048]
    - [115, 31.15]
  - - [128, 2048, 1, 2048, 128, 128, 128, 2048]
    - [131, 38.4]
  - - [128, 2048, 1, 4096, 128, 128, 128, 2048]
    - [131, 47.54]
  - - [128, 2048, 1, 8192, 128, 128, 128, 2048]
    - [133, 53.81]
  - - [128, 4096, 1, 128, 128, 128, 128, 4096]
    - [97, 13.76]
  - - [128, 4096, 1, 256, 128, 128, 128, 4096]
    - [60, 24.35]
  - - [128, 4096, 1, 512, 128, 128, 128, 4096]
    - [98, 38.21]
  - - [128, 4096, 1, 1024, 128, 128, 128, 4096]
    - [100, 54.57]
  - - [128, 4096, 1, 2048, 128, 128, 128, 4096]
    - [129, 67.3]
  - - [128, 4096, 1, 4096, 128, 128, 128, 4096]
    - [129, 82.62]
  - - [128, 4096, 1, 8192, 128, 128, 128, 4096]
    - [129, 91.88]
  - - [128, 8192, 1, 128, 128, 128, 128, 8192]
    - [53, 24.12]
  - - [128, 8192, 1, 256, 128, 128, 128, 8192]
    - [53, 40.94]
  - - [128, 8192, 1, 512, 128, 128, 128, 8192]
    - [51, 63.21]
  - - [128, 8192, 1, 1024, 128, 128, 128, 8192]
    - [52, 88.55]
  - - [128, 8192, 1, 2048, 128, 128, 128, 8192]
    - [93, 107.15]
  - - [128, 8192, 1, 4096, 128, 128, 128, 8192]
    - [128, 125.23]
  - - [128, 8192, 1, 8192, 128, 128, 128, 8192]
    - [128, 126.94]
  - - [256, 128, 1, 128, 256, 256, 256, 128]
    - [70, 1.08]
  - - [256, 128, 1, 256, 256, 256, 256, 128]
    - [120, 1.89]
  - - [256, 128, 1, 512, 256, 256, 256, 128]
    - [124, 3.07]
  - - [256, 128, 1, 1024, 256, 256, 256, 128]
    - [122, 4.55]
  - - [256, 128, 1, 2048, 256, 256, 256, 128]
    - [124, 6.02]
  - - [256, 128, 1, 4096, 256, 256, 256, 128]
    - [124, 7.13]
  - - [256, 128, 1, 8192, 256, 256, 256, 128]
    - [135, 7.92]
  - - [256, 256, 1, 128, 256, 256, 256, 256]
    - [71, 2.16]
  - - [256, 256, 1, 256, 256, 256, 256, 256]
    - [72, 3.7]
  - - [256, 256, 1, 512, 256, 256, 256, 256]
    - [122, 6.04]
  - - [256, 256, 1, 1024, 256, 256, 256, 256]
    - [122, 9.07]
  - - [256, 256, 1, 2048, 256, 256, 256, 256]
    - [124, 11.92]
  - - [256, 256, 1, 4096, 256, 256, 256, 256]
    - [124, 14.22]
  - - [256, 256, 1, 8192, 256, 256, 256, 256]
    - [135, 15.71]
  - - [256, 512, 1, 128, 256, 256, 256, 512]
    - [69, 4.2]
  - - [256, 512, 1, 256, 256, 256, 256, 512]
    - [71, 7.3]
  - - [256, 512, 1, 512, 256, 256, 256, 512]
    - [121, 11.77]
  - - [256, 512, 1, 1024, 256, 256, 256, 512]
    - [122, 17.45]
  - - [256, 512, 1, 2048, 256, 256, 256, 512]
    - [124, 23.18]
  - - [256, 512, 1, 4096, 256, 256, 256, 512]
    - [124, 27.73]
  - - [256, 512, 1, 8192, 256, 256, 256, 512]
    - [135, 30.45]
  - - [256, 1024, 1, 128, 256, 256, 256, 1024]
    - [65, 7.88]
  - - [256, 1024, 1, 256, 256, 256, 256, 1024]
    - [67, 13.43]
  - - [256, 1024, 1, 512, 256, 256, 256, 1024]
    - [116, 21.44]
  - - [256, 1024, 1, 1024, 256, 256, 256, 1024]
    - [118, 31.4]
  - - [256, 1024, 1, 2048, 256, 256, 256, 1024]
    - [131, 41.41]
  - - [256, 1024, 1, 4096, 256, 256, 256, 1024]
    - [131, 48.93]
  - - [256, 1024, 1, 8192, 256, 256, 256, 1024]
    - [133, 53.8]
  - - [256, 2048, 1, 128, 256, 256, 256, 2048]
    - [60, 14.24]
  - - [256, 2048, 1, 256, 256, 256, 256, 2048]
    - [60, 24.21]
  - - [256, 2048, 1, 512, 256, 256, 256, 2048]
    - [98, 37.53]
  - - [256, 2048, 1, 1024, 256, 256, 256, 2048]
    - [100, 54.33]
  - - [256, 2048, 1, 2048, 256, 256, 256, 2048]
    - [101, 68.14]
  - - [256, 2048, 1, 4096, 256, 256, 256, 2048]
    - [100, 79.1]
  - - [256, 2048, 1, 8192, 256, 256, 256, 2048]
    - [130, 87.17]
  - - [256, 4096, 1, 128, 256, 256, 256, 4096]
    - [49, 23.88]
  - - [256, 4096, 1, 256, 256, 256, 256, 4096]
    - [49, 40.73]
  - - [256, 4096, 1, 512, 256, 256, 256, 4096]
    - [50, 63.27]
  - - [256, 4096, 1, 1024, 256, 256, 256, 4096]
    - [52, 88.11]
  - - [256, 4096, 1, 2048, 256, 256, 256, 4096]
    - [93, 107.87]
  - - [256, 4096, 1, 4096, 256, 256, 256, 4096]
    - [95, 124.43]
  - - [256, 4096, 1, 8192, 256, 256, 256, 4096]
    - [127, 129.71]
  - - [256, 8192, 1, 128, 256, 256, 256, 8192]
    - [34, 36.63]
  - - [256, 8192, 1, 256, 256, 256, 256, 8192]
    - [34, 61.37]
  - - [256, 8192, 1, 512, 256, 256, 256, 8192]
    - [41, 94.12]
  - - [256, 8192, 1, 1024, 256, 256, 256, 8192]
    - [89, 130.68]
  - - [256, 8192, 1, 2048, 256, 256, 256, 8192]
    - [89, 157.08]
  - - [256, 8192, 1, 4096, 256, 256, 256, 8192]
    - [91, 172.38]
  - - [256, 8192, 1, 8192, 256, 256, 256, 8192]
    - [90, 162.88]
  - - [512, 128, 1, 128, 512, 512, 512, 128]
    - [71, 2.0]
  - - [512, 128, 1, 256, 512, 512, 512, 128]
    - [70, 3.69]
  - - [512, 128, 1, 512, 512, 512, 512, 128]
    - [120, 5.95]
  - - [512, 128, 1, 1024, 512, 512, 512, 128]
    - [124, 8.94]
  - - [512, 128, 1, 2048, 512, 512, 512, 128]
    - [124, 11.83]
  - - [512, 128, 1, 4096, 512, 512, 512, 128]
    - [124, 14.01]
  - - [512, 128, 1, 8192, 512, 512, 512, 128]
    - [136, 14.82]
  - - [512, 256, 1, 128, 512, 512, 512, 256]
    - [72, 3.95]
  - - [512, 256, 1, 256, 512, 512, 512, 256]
    - [72, 7.2]
  - - [512, 256, 1, 512, 512, 512, 512, 256]
    - [122, 11.22]
  - - [512, 256, 1, 1024, 512, 512, 512, 256]
    - [121, 17.18]
  - - [512, 256, 1, 2048, 512, 512, 512, 256]
    - [124, 22.84]
  - - [512, 256, 1, 4096, 512, 512, 512, 256]
    - [124, 27.55]
  - - [512, 256, 1, 8192, 512, 512, 512, 256]
    - [136, 28.11]
  - - [512, 512, 1, 128, 512, 512, 512, 512]
    - [65, 7.81]
  - - [512, 512, 1, 256, 512, 512, 512, 512]
    - [66, 13.35]
  - - [512, 512, 1, 512, 512, 512, 512, 512]
    - [114, 21.31]
  - - [512, 512, 1, 1024, 512, 512, 512, 512]
    - [117, 31.0]
  - - [512, 512, 1, 2048, 512, 512, 512, 512]
    - [131, 40.7]
  - - [512, 512, 1, 4096, 512, 512, 512, 512]
    - [131, 47.96]
  - - [512, 512, 1, 8192, 512, 512, 512, 512]
    - [109, 50.44]
  - - [512, 1024, 1, 128, 512, 512, 512, 1024]
    - [60, 13.86]
  - - [512, 1024, 1, 256, 512, 512, 512, 1024]
    - [61, 23.86]
  - - [512, 1024, 1, 512, 512, 512, 512, 1024]
    - [100, 37.86]
  - - [512, 1024, 1, 1024, 512, 512, 512, 1024]
    - [100, 54.34]
  - - [512, 1024, 1, 2048, 512, 512, 512, 1024]
    - [101, 69.76]
  - - [512, 1024, 1, 4096, 512, 512, 512, 1024]
    - [106, 76.27]
  - - [512, 1024, 1, 8192, 512, 512, 512, 1024]
    - [99, 81.34]
  - - [512, 2048, 1, 128, 512, 512, 512, 2048]
    - [54, 23.65]
  - - [512, 2048, 1, 256, 512, 512, 512, 2048]
    - [53, 40.39]
  - - [512, 2048, 1, 512, 512, 512, 512, 2048]
    - [50, 62.64]
  - - [512, 2048, 1, 1024, 512, 512, 512, 2048]
    - [52, 87.37]
  - - [512, 2048, 1, 2048, 512, 512, 512, 2048]
    - [93, 106.68]
  - - [512, 2048, 1, 4096, 512, 512, 512, 2048]
    - [93, 123.88]
  - - [512, 2048, 1, 8192, 512, 512, 512, 2048]
    - [94, 127.3]
  - - [512, 4096, 1, 128, 512, 512, 512, 4096]
    - [34, 37.37]
  - - [512, 4096, 1, 256, 512, 512, 512, 4096]
    - [36, 61.95]
  - - [512, 4096, 1, 512, 512, 512, 512, 4096]
    - [41, 94.67]
  - - [512, 4096, 1, 1024, 512, 512, 512, 4096]
    - [40, 130.14]
  - - [512, 4096, 1, 2048, 512, 512, 512, 4096]
    - [41, 157.53]
  - - [512, 4096, 1, 4096, 512, 512, 512, 4096]
    - [39, 173.03]
  - - [512, 4096, 1, 8192, 512, 512, 512, 4096]
    - [41, 160.95]
  - - [512, 8192, 1, 128, 512, 512, 512, 8192]
    - [27, 53.78]
  - - [512, 8192, 1, 256, 512, 512, 512, 8192]
    - [28, 90.75]
  - - [512, 8192, 1, 512, 512, 512, 512, 8192]
    - [27, 137.98]
  - - [512, 8192, 1, 1024, 512, 512, 512, 8192]
    - [28, 184.96]
  - - [512, 8192, 1, 2048, 512, 512, 512, 8192]
    - [28, 213.81]
  - - [512, 8192, 1, 4096, 512, 512, 512, 8192]
    - [28, 223.28]
  - - [512, 8192, 1, 8192, 512, 512, 512, 8192]
    - [82, 211.91]
  - - [1024, 128, 1, 128, 1024, 1024, 1024, 128]
    - [58, 2.8]
  - - [1024, 128, 1, 256, 1024, 1024, 1024, 128]
    - [57, 5.82]
  - - [1024, 128, 1, 512, 1024, 1024, 1024, 128]
    - [71, 10.88]
  - - [1024, 128, 1, 1024, 1024, 1024, 1024, 128]
    - [125, 16.55]
  - - [1024, 128, 1, 2048, 1024, 1024, 1024, 128]
    - [124, 22.6]
  - - [1024, 128, 1, 4096, 1024, 1024, 1024, 128]
    - [138, 25.37]
  - - [1024, 128, 1, 8192, 1024, 1024, 1024, 128]
    - [137, 26.51]
  - - [1024, 256, 1, 128, 1024, 1024, 1024, 256]
    - [64, 5.75]
  - - [1024, 256, 1, 256, 1024, 1024, 1024, 256]
    - [63, 11.11]
  - - [1024, 256, 1, 512, 1024, 1024, 1024, 256]
    - [68, 20.72]
  - - [1024, 256, 1, 1024, 1024, 1024, 1024, 256]
    - [117, 30.62]
  - - [1024, 256, 1, 2048, 1024, 1024, 1024, 256]
    - [131, 40.84]
  - - [1024, 256, 1, 4096, 1024, 1024, 1024, 256]
    - [111, 46.29]
  - - [1024, 256, 1, 8192, 1024, 1024, 1024, 256]
    - [132, 49.4]
  - - [1024, 512, 1, 128, 1024, 1024, 1024, 512]
    - [55, 11.38]
  - - [1024, 512, 1, 256, 1024, 1024, 1024, 512]
    - [59, 21.27]
  - - [1024, 512, 1, 512, 1024, 1024, 1024, 512]
    - [62, 36.98]
  - - [1024, 512, 1, 1024, 1024, 1024, 1024, 512]
    - [100, 53.47]
  - - [1024, 512, 1, 2048, 1024, 1024, 1024, 512]
    - [100, 69.19]
  - - [1024, 512, 1, 4096, 1024, 1024, 1024, 512]
    - [107, 76.13]
  - - [1024, 512, 1, 8192, 1024, 1024, 1024, 512]
    - [104, 81.81]
  - - [1024, 1024, 1, 128, 1024, 1024, 1024, 1024]
    - [49, 23.81]
  - - [1024, 1024, 1, 256, 1024, 1024, 1024, 1024]
    - [49, 40.58]
  - - [1024, 1024, 1, 512, 1024, 1024, 1024, 1024]
    - [50, 63.26]
  - - [1024, 1024, 1, 1024, 1024, 1024, 1024, 1024]
    - [52, 87.96]
  - - [1024, 1024, 1, 2048, 1024, 1024, 1024, 1024]
    - [93, 107.97]
  - - [1024, 1024, 1, 4096, 1024, 1024, 1024, 1024]
    - [94, 123.87]
  - - [1024, 1024, 1, 8192, 1024, 1024, 1024, 1024]
    - [95, 128.98]
  - - [1024, 2048, 1, 128, 1024, 1024, 1024, 2048]
    - [35, 36.92]
  - - [1024, 2048, 1, 256, 1024, 1024, 1024, 2048]
    - [36, 61.78]
  - - [1024, 2048, 1, 512, 1024, 1024, 1024, 2048]
    - [41, 94.98]
  - - [1024, 2048, 1, 1024, 1024, 1024, 1024, 2048]
    - [40, 128.89]
  - - [1024, 2048, 1, 2048, 1024, 1024, 1024, 2048]
    - [41, 158.17]
  - - [1024, 2048, 1, 4096, 1024, 1024, 1024, 2048]
    - [43, 172.34]
  - - [1024, 2048, 1, 8192, 1024, 1024, 1024, 2048]
    - [42, 160.73]
  - - [1024, 4096, 1, 128, 1024, 1024, 1024, 4096]
    - [31, 56.78]
  - - [1024, 4096, 1, 256, 1024, 1024, 1024, 4096]
    - [33, 94.74]
  - - [1024, 4096, 1, 512, 1024, 1024, 1024, 4096]
    - [28, 139.93]
  - - [1024, 4096, 1, 1024, 1024, 1024, 1024, 4096]
    - [28, 186.06]
  - - [1024, 4096, 1, 2048, 1024, 1024, 1024, 4096]
    - [18, 218.86]
  - - [1024, 4096, 1, 4096, 1024, 1024, 1024, 4096]
    - [81, 224.0]
  - - [1024, 4096, 1, 8192, 1024, 1024, 1024, 4096]
    - [84, 210.85]
  - - [1024, 8192, 1, 128, 1024, 1024, 1024, 8192]
    - [25, 68.01]
  - - [1024, 8192, 1, 256, 1024, 1024, 1024, 8192]
    - [6, 112.63]
  - - [1024, 8192, 1, 512, 1024, 1024, 1024, 8192]
    - [7, 170.45]
  - - [1024, 8192, 1, 1024, 1024, 1024, 1024, 8192]
    - [74, 217.72]
  - - [1024, 8192, 1, 2048, 1024, 1024, 1024, 8192]
    - [15, 248.94]
  - - [1024, 8192, 1, 4096, 1024, 1024, 1024, 8192]
    - [4, 244.67]
  - - [1024, 8192, 1, 8192, 1024, 1024, 1024, 8192]
    - [13, 258.68]
  - - [2048, 128, 1, 128, 2048, 2048, 2048, 128]
    - [65, 7.77]
  - - [2048, 128, 1, 256, 2048, 2048, 2048, 128]
    - [65, 13.32]
  - - [2048, 128, 1, 512, 2048, 2048, 2048, 128]
    - [115, 21.55]
  - - [2048, 128, 1, 1024, 2048, 2048, 2048, 128]
    - [117, 31.3]
  - - [2048, 128, 1, 2048, 2048, 2048, 2048, 128]
    - [113, 37.92]
  - - [2048, 128, 1, 4096, 2048, 2048, 2048, 128]
    - [112, 45.43]
  - - [2048, 128, 1, 8192, 2048, 2048, 2048, 128]
    - [110, 50.71]
  - - [2048, 256, 1, 128, 2048, 2048, 2048, 256]
    - [56, 13.71]
  - - [2048, 256, 1, 256, 2048, 2048, 2048, 256]
    - [60, 23.79]
  - - [2048, 256, 1, 512, 2048, 2048, 2048, 256]
    - [102, 37.02]
  - - [2048, 256, 1, 1024, 2048, 2048, 2048, 256]
    - [100, 53.61]
  - - [2048, 256, 1, 2048, 2048, 2048, 2048, 256]
    - [105, 67.51]
  - - [2048, 256, 1, 4096, 2048, 2048, 2048, 256]
    - [106, 78.59]
  - - [2048, 256, 1, 8192, 2048, 2048, 2048, 256]
    - [106, 85.55]
  - - [2048, 512, 1, 128, 2048, 2048, 2048, 512]
    - [50, 23.52]
  - - [2048, 512, 1, 256, 2048, 2048, 2048, 512]
    - [50, 40.3]
  - - [2048, 512, 1, 512, 2048, 2048, 2048, 512]
    - [50, 62.79]
  - - [2048, 512, 1, 1024, 2048, 2048, 2048, 512]
    - [52, 87.65]
  - - [2048, 512, 1, 2048, 2048, 2048, 2048, 512]
    - [94, 107.04]
  - - [2048, 512, 1, 4096, 2048, 2048, 2048, 512]
    - [96, 124.74]
  - - [2048, 512, 1, 8192, 2048, 2048, 2048, 512]
    - [96, 128.36]
  - - [2048, 1024, 1, 128, 2048, 2048, 2048, 1024]
    - [34, 37.23]
  - - [2048, 1024, 1, 256, 2048, 2048, 2048, 1024]
    - [34, 62.14]
  - - [2048, 1024, 1, 512, 2048, 2048, 2048, 1024]
    - [41, 94.78]
  - - [2048, 1024, 1, 1024, 2048, 2048, 2048, 1024]
    - [40, 128.56]
  - - [2048, 1024, 1, 2048, 2048, 2048, 2048, 1024]
    - [48, 157.25]
  - - [2048, 1024, 1, 4096, 2048, 2048, 2048, 1024]
    - [47, 174.66]
  - - [2048, 1024, 1, 8192, 2048, 2048, 2048, 1024]
    - [42, 160.18]
  - - [2048, 2048, 1, 128, 2048, 2048, 2048, 2048]
    - [28, 53.77]
  - - [2048, 2048, 1, 256, 2048, 2048, 2048, 2048]
    - [26, 90.59]
  - - [2048, 2048, 1, 512, 2048, 2048, 2048, 2048]
    - [28, 138.04]
  - - [2048, 2048, 1, 1024, 2048, 2048, 2048, 2048]
    - [28, 184.18]
  - - [2048, 2048, 1, 2048, 2048, 2048, 2048, 2048]
    - [19, 213.58]
  - - [2048, 2048, 1, 4096, 2048, 2048, 2048, 2048]
    - [85, 223.98]
  - - [2048, 2048, 1, 8192, 2048, 2048, 2048, 2048]
    - [83, 212.71]
  - - [2048, 4096, 1, 128, 2048, 2048, 2048, 4096]
    - [2, 65.22]
  - - [2048, 4096, 1, 256, 2048, 2048, 2048, 4096]
    - [2, 109.68]
  - - [2048, 4096, 1, 512, 2048, 2048, 2048, 4096]
    - [2, 166.69]
  - - [2048, 4096, 1, 1024, 2048, 2048, 2048, 4096]
    - [5, 218.63]
  - - [2048, 4096, 1, 2048, 2048, 2048, 2048, 4096]
    - [76, 248.7]
  - - [2048, 4096, 1, 4096, 2048, 2048, 2048, 4096]
    - [4, 242.0]
  - - [2048, 4096, 1, 8192, 2048, 2048, 2048, 4096]
    - [4, 260.0]
  - - [2048, 8192, 1, 128, 2048, 2048, 2048, 8192]
    - [0, 69.89]
  - - [2048, 8192, 1, 256, 2048, 2048, 2048, 8192]
    - [2, 117.4]
  - - [2048, 8192, 1, 512, 2048, 2048, 2048, 8192]
    - [1, 172.13]
  - - [2048, 8192, 1, 1024, 2048, 2048, 2048, 8192]
    - [9, 208.15]
  - - [2048, 8192, 1, 2048, 2048, 2048, 2048, 8192]
    - [20, 225.79]
  - - [2048, 8192, 1, 4096, 2048, 2048, 2048, 8192]
    - [12, 268.88]
  - - [2048, 8192, 1, 8192, 2048, 2048, 2048, 8192]
    - [77, 318.73]
  - - [4096, 128, 1, 128, 4096, 4096, 4096, 128]
    - [60, 14.43]
  - - [4096, 128, 1, 256, 4096, 4096, 4096, 128]
    - [60, 24.23]
  - - [4096, 128, 1, 512, 4096, 4096, 4096, 128]
    - [60, 37.92]
  - - [4096, 128, 1, 1024, 4096, 4096, 4096, 128]
    - [100, 54.52]
  - - [4096, 128, 1, 2048, 4096, 4096, 4096, 128]
    - [103, 65.71]
  - - [4096, 128, 1, 4096, 4096, 4096, 4096, 128]
    - [108, 77.67]
  - - [4096, 128, 1, 8192, 4096, 4096, 4096, 128]
    - [103, 85.01]
  - - [4096, 256, 1, 128, 4096, 4096, 4096, 256]
    - [53, 23.68]
  - - [4096, 256, 1, 256, 4096, 4096, 4096, 256]
    - [53, 40.05]
  - - [4096, 256, 1, 512, 4096, 4096, 4096, 256]
    - [92, 63.39]
  - - [4096, 256, 1, 1024, 4096, 4096, 4096, 256]
    - [52, 88.0]
  - - [4096, 256, 1, 2048, 4096, 4096, 4096, 256]
    - [96, 107.11]
  - - [4096, 256, 1, 4096, 4096, 4096, 4096, 256]
    - [95, 124.85]
  - - [4096, 256, 1, 8192, 4096, 4096, 4096, 256]
    - [96, 129.01]
  - - [4096, 512, 1, 128, 4096, 4096, 4096, 512]
    - [34, 36.79]
  - - [4096, 512, 1, 256, 4096, 4096, 4096, 512]
    - [36, 61.67]
  - - [4096, 512, 1, 512, 4096, 4096, 4096, 512]
    - [36, 93.36]
  - - [4096, 512, 1, 1024, 4096, 4096, 4096, 512]
    - [47, 127.32]
  - - [4096, 512, 1, 2048, 4096, 4096, 4096, 512]
    - [43, 155.93]
  - - [4096, 512, 1, 4096, 4096, 4096, 4096, 512]
    - [48, 173.12]
  - - [4096, 512, 1, 8192, 4096, 4096, 4096, 512]
    - [45, 164.53]
  - - [4096, 1024, 1, 128, 4096, 4096, 4096, 1024]
    - [27, 55.17]
  - - [4096, 1024, 1, 256, 4096, 4096, 4096, 1024]
    - [28, 92.41]
  - - [4096, 1024, 1, 512, 4096, 4096, 4096, 1024]
    - [30, 134.32]
  - - [4096, 1024, 1, 1024, 4096, 4096, 4096, 1024]
    - [33, 181.29]
  - - [4096, 1024, 1, 2048, 4096, 4096, 4096, 1024]
    - [21, 212.5]
  - - [4096, 1024, 1, 4096, 4096, 4096, 4096, 1024]
    - [83, 223.59]
  - - [4096, 1024, 1, 8192, 4096, 4096, 4096, 1024]
    - [88, 211.93]
  - - [4096, 2048, 1, 128, 4096, 4096, 4096, 2048]
    - [2, 61.64]
  - - [4096, 2048, 1, 256, 4096, 4096, 4096, 2048]
    - [11, 104.44]
  - - [4096, 2048, 1, 512, 4096, 4096, 4096, 2048]
    - [8, 160.97]
  - - [4096, 2048, 1, 1024, 4096, 4096, 4096, 2048]
    - [5, 212.41]
  - - [4096, 2048, 1, 2048, 4096, 4096, 4096, 2048]
    - [13, 242.95]
  - - [4096, 2048, 1, 4096, 4096, 4096, 4096, 2048]
    - [76, 241.88]
  - - [4096, 2048, 1, 8192, 4096, 4096, 4096, 2048]
    - [18, 263.12]
  - - [4096, 4096, 1, 128, 4096, 4096, 4096, 4096]
    - [0, 66.4]
  - - [4096, 4096, 1, 256, 4096, 4096, 4096, 4096]
    - [1, 113.83]
  - - [4096, 4096, 1, 512, 4096, 4096, 4096, 4096]
    - [1, 167.92]
  - - [4096, 4096, 1, 1024, 4096, 4096, 4096, 4096]
    - [7, 207.15]
  - - [4096, 4096, 1, 2048, 4096, 4096, 4096, 4096]
    - [18, 222.07]
  - - [4096, 4096, 1, 4096, 4096, 4096, 4096, 4096]
    - [74, 271.96]
  - - [4096, 4096, 1, 8192, 4096, 4096, 4096, 4096]
    - [78, 318.49]
  - - [4096, 8192, 1, 128, 4096, 4096, 4096, 8192]
    - [23, 73.02]
  - - [4096, 8192, 1, 256, 4096, 4096, 4096, 8192]
    - [22, 117.52]
  - - [4096, 8192, 1, 512, 4096, 4096, 4096, 8192]
    - [17, 168.85]
  - - [4096, 8192, 1, 1024, 4096, 4096, 4096, 8192]
    - [87, 206.08]
  - - [4096, 8192, 1, 2048, 4096, 4096, 4096, 8192]
    - [15, 259.4]
  - - [4096, 8192, 1, 4096, 4096, 4096, 4096, 8192]
    - [3, 301.02]
  - - [4096, 8192, 1, 8192, 4096, 4096, 4096, 8192]
    - [73, 338.24]
  - - [8192, 128, 1, 128, 8192, 8192, 8192, 128]
    - [49, 23.68]
  - - [8192, 128, 1, 256, 8192, 8192, 8192, 128]
    - [50, 40.41]
  - - [8192, 128, 1, 512, 8192, 8192, 8192, 128]
    - [50, 63.21]
  - - [8192, 128, 1, 1024, 8192, 8192, 8192, 128]
    - [52, 87.52]
  - - [8192, 128, 1, 2048, 8192, 8192, 8192, 128]
    - [95, 107.28]
  - - [8192, 128, 1, 4096, 8192, 8192, 8192, 128]
    - [95, 124.73]
  - - [8192, 128, 1, 8192, 8192, 8192, 8192, 128]
    - [95, 125.26]
  - - [8192, 256, 1, 128, 8192, 8192, 8192, 256]
    - [37, 36.12]
  - - [8192, 256, 1, 256, 8192, 8192, 8192, 256]
    - [38, 60.32]
  - - [8192, 256, 1, 512, 8192, 8192, 8192, 256]
    - [48, 93.32]
  - - [8192, 256, 1, 1024, 8192, 8192, 8192, 256]
    - [90, 127.41]
  - - [8192, 256, 1, 2048, 8192, 8192, 8192, 256]
    - [46, 155.23]
  - - [8192, 256, 1, 4096, 8192, 8192, 8192, 256]
    - [47, 172.46]
  - - [8192, 256, 1, 8192, 8192, 8192, 8192, 256]
    - [44, 157.2]
  - - [8192, 512, 1, 128, 8192, 8192, 8192, 512]
    - [33, 52.72]
  - - [8192, 512, 1, 256, 8192, 8192, 8192, 512]
    - [29, 89.63]
  - - [8192, 512, 1, 512, 8192, 8192, 8192, 512]
    - [30, 134.77]
  - - [8192, 512, 1, 1024, 8192, 8192, 8192, 512]
    - [29, 177.86]
  - - [8192, 512, 1, 2048, 8192, 8192, 8192, 512]
    - [21, 215.67]
  - - [8192, 512, 1, 4096, 8192, 8192, 8192, 512]
    - [19, 221.67]
  - - [8192, 512, 1, 8192, 8192, 8192, 8192, 512]
    - [86, 210.51]
  - - [8192, 1024, 1, 128, 8192, 8192, 8192, 1024]
    - [2, 58.52]
  - - [8192, 1024, 1, 256, 8192, 8192, 8192, 1024]
    - [2, 99.02]
  - - [8192, 1024, 1, 512, 8192, 8192, 8192, 1024]
    - [4, 154.99]
  - - [8192, 1024, 1, 1024, 8192, 8192, 8192, 1024]
    - [2, 207.06]
  - - [8192, 1024, 1, 2048, 8192, 8192, 8192, 1024]
    - [14, 240.76]
  - - [8192, 1024, 1, 4096, 8192, 8192, 8192, 1024]
    - [13, 239.1]
  - - [8192, 1024, 1, 8192, 8192, 8192, 8192, 1024]
    - [82, 275.15]
  - - [8192, 2048, 1, 128, 8192, 8192, 8192, 2048]
    - [0, 65.44]
  - - [8192, 2048, 1, 256, 8192, 8192, 8192, 2048]
    - [0, 112.73]
  - - [8192, 2048, 1, 512, 8192, 8192, 8192, 2048]
    - [4, 165.4]
  - - [8192, 2048, 1, 1024, 8192, 8192, 8192, 2048]
    - [7, 204.35]
  - - [8192, 2048, 1, 2048, 8192, 8192, 8192, 2048]
    - [10, 220.87]
  - - [8192, 2048, 1, 4096, 8192, 8192, 8192, 2048]
    - [78, 273.43]
  - - [8192, 2048, 1, 8192, 8192, 8192, 8192, 2048]
    - [74, 323.46]
  - - [8192, 4096, 1, 128, 8192, 8192, 8192, 4096]
    - [1, 71.34]
  - - [8192, 4096, 1, 256, 8192, 8192, 8192, 4096]
    - [4, 116.95]
  - - [8192, 4096, 1, 512, 8192, 8192, 8192, 4096]
    - [16, 169.05]
  - - [8192, 4096, 1, 1024, 8192, 8192, 8192, 4096]
    - [32, 207.2]
  - - [8192, 4096, 1, 2048, 8192, 8192, 8192, 4096]
    - [7, 260.18]
  - - [8192, 4096, 1, 4096, 8192, 8192, 8192, 4096]
    - [3, 290.02]
  - - [8192, 4096, 1, 8192, 8192, 8192, 8192, 4096]
    - [80, 324.41]
  - - [8192, 8192, 1, 128, 8192, 8192, 8192, 8192]
    - [24, 68.47]
  - - [8192, 8192, 1, 256, 8192, 8192, 8192, 8192]
    - [28, 112.69]
  - - [8192, 8192, 1, 512, 8192, 8192, 8192, 8192]
    - [0, 171.06]
  - - [8192, 8192, 1, 1024, 8192, 8192, 8192, 8192]
    - [75, 230.16]
  - - [8192, 8192, 1, 2048, 8192, 8192, 8192, 8192]
    - [79, 287.18]
  - - [8192, 8192, 1, 4096, 8192, 8192, 8192, 8192]
    - [80, 332.08]
  - - [8192, 8192, 1, 8192, 8192, 8192, 8192, 8192]
    - [4, 335.2]
- null
- null
- ExperimentalStreamK
- GridBased
