projects/hipblaslt/library/src/amd_detail/rocblaslt/src/Tensile/Logic/asm_full/aquavanjaram/gfx942_228cu/StreamK/aquavanjaram942_Cijk_Ailk_Bjlk_B8F8NSS_BH_Bias_HAS_SAV_UserArgs.yaml
- {MinimumRequiredVersion: 4.33.0}
- aquavanjaram942
- {Architecture: gfx942, CUCount: 228}
- [Device 0049, Device 0050]
    SolutionIndex: 0
    SolutionNameMin: Cijk_Ailk_Bjlk_B8F8NSS_BH_Bias_HAS_SAV_UserArgs_MT256x256x64_MI16x16x1_SN_LDSB0_CLR1_GRVWA8_GRVWB8_GSU0_GSUC0_GSUWGMRR0_K1_LBSPPA2048_LBSPPB2048_LPA0_LPB0_MIWT8_8_PLR1_SU0_SUM0_SUS64_VWA8_VWB8_WGM1_WGMXCC1_WGMXCCGn1
    SolutionIndex: 1
    SolutionNameMin: Cijk_Ailk_Bjlk_B8F8NSS_BH_Bias_HAS_SAV_UserArgs_MT256x256x64_MI16x16x1_SN_LDSB0_CLR1_GRVWA16_GRVWB8_GSU0_GSUC0_GSUWGMRR0_K1_LBSPPA2048_LBSPPB2048_LPA0_LPB0_MIWT8_8_PLR1_SU0_SUM0_SUS64_VWA8_VWB8_WGM1_WGMXCC1_WGMXCCGn1
    SolutionIndex: 2
    SolutionNameMin: Cijk_Ailk_Bjlk_B8F8NSS_BH_Bias_HAS_SAV_UserArgs_MT256x256x64_MI16x16x1_SN_LDSB0_CLR1_GRVWA16_GRVWB16_GSU0_GSUC0_GSUWGMRR0_K1_LBSPPA2048_LBSPPB2048_LPA0_LPB0_MIWT8_8_PLR1_SU0_SUM0_SUS64_VWA8_VWB8_WGM1_WGMXCC1_WGMXCCGn1
    SolutionIndex: 3
    SolutionNameMin: Cijk_Ailk_Bjlk_B8F8NSS_BH_Bias_HAS_SAV_UserArgs_MT256x256x64_MI16x16x1_SN_LDSB0_CLR1_GRVWA16_GRVWB16_GSU0_GSUC0_GSUWGMRR0_K1_LBSPPA2048_LBSPPB2048_LPA0_LPB0_MIWT8_8_PLR1_SU0_SUM0_SUS64_VWA8_VWB8_WGM4_WGMXCC1_WGMXCCGn1
    SolutionIndex: 4
    SolutionNameMin: Cijk_Ailk_Bjlk_B8F8NSS_BH_Bias_HAS_SAV_UserArgs_MT256x256x64_MI16x16x1_SN_LDSB0_CLR1_GRVWA4_GRVWB4_GSU0_GSUC0_GSUWGMRR0_K1_LBSPPA2048_LBSPPB2048_LPA0_LPB0_MIWT8_8_PLR1_SU0_SUM0_SUS64_VWA8_VWB8_WGM6_WGMXCC1_WGMXCCGn1
    SolutionIndex: 5
    SolutionNameMin: Cijk_Ailk_Bjlk_B8F8NSS_BH_Bias_HAS_SAV_UserArgs_MT256x256x64_MI16x16x1_SN_LDSB0_CLR1_GRVWA16_GRVWB8_GSU0_GSUC0_GSUWGMRR0_K1_LBSPPA2048_LBSPPB2048_LPA0_LPB0_MIWT8_8_PLR1_SU0_SUM0_SUS64_VWA8_VWB8_WGM6_WGMXCC1_WGMXCCGn1
    SolutionIndex: 6
    SolutionNameMin: Cijk_Ailk_Bjlk_B8F8NSS_BH_Bias_HAS_SAV_UserArgs_MT256x256x64_MI16x16x1_SN_LDSB0_CLR1_GRVWA8_GRVWB16_GSU0_GSUC0_GSUWGMRR0_K1_LBSPPA2048_LBSPPB2048_LPA0_LPB0_MIWT8_8_PLR1_SU0_SUM0_SUS64_VWA8_VWB8_WGM6_WGMXCC1_WGMXCCGn1
    SolutionIndex: 7
    SolutionNameMin: Cijk_Ailk_Bjlk_B8F8NSS_BH_Bias_HAS_SAV_UserArgs_MT256x256x64_MI16x16x1_SN_LDSB0_CLR1_GRVWA16_GRVWB16_GSU0_GSUC0_GSUWGMRR0_K1_LBSPPA2048_LBSPPB2048_LPA0_LPB0_MIWT8_8_PLR1_SU0_SUM0_SUS64_VWA8_VWB8_WGM6_WGMXCC1_WGMXCCGn1
    SolutionIndex: 8
    SolutionNameMin: Cijk_Ailk_Bjlk_B8F8NSS_BH_Bias_HAS_SAV_UserArgs_MT256x256x64_MI16x16x1_SN_LDSB0_CLR1_GRVWA4_GRVWB16_GSU0_GSUC0_GSUWGMRR0_K1_LBSPPA2048_LBSPPB2048_LPA0_LPB0_MIWT8_8_PLR1_SU0_SUM0_SUS64_VWA8_VWB8_WGM8_WGMXCC1_WGMXCCGn1
    SolutionIndex: 9
    SolutionNameMin: Cijk_Ailk_Bjlk_B8F8NSS_BH_Bias_HAS_SAV_UserArgs_MT256x256x64_MI16x16x1_SN_LDSB0_CLR1_GRVWA16_GRVWB16_GSU0_GSUC0_GSUWGMRR0_K1_LBSPPA2048_LBSPPB2048_LPA0_LPB0_MIWT8_8_PLR1_SU0_SUM0_SUS64_VWA8_VWB8_WGM8_WGMXCC1_WGMXCCGn1
    SolutionIndex: 10
    SolutionNameMin: Cijk_Ailk_Bjlk_B8F8NSS_BH_Bias_HAS_SAV_UserArgs_MT128x256x64_MI16x16x1_SN_LDSB1_CLR1_GRVWA4_GRVWB4_GSU0_GSUC0_GSUWGMRR0_K1_LBSPPA1024_LBSPPB2048_LPA64_LPB0_MIWT4_8_PLR1_SU0_SUM0_SUS64_VWA4_VWB8_WGM1_WGMXCC1_WGMXCCGn1
    SolutionIndex: 11
    SolutionNameMin: Cijk_Ailk_Bjlk_B8F8NSS_BH_Bias_HAS_SAV_UserArgs_MT128x256x64_MI16x16x1_SN_LDSB1_CLR1_GRVWA4_GRVWB8_GSU0_GSUC0_GSUWGMRR0_K1_LBSPPA1024_LBSPPB2048_LPA64_LPB0_MIWT4_8_PLR1_SU0_SUM0_SUS64_VWA4_VWB8_WGM1_WGMXCC1_WGMXCCGn1
    SolutionIndex: 12
    SolutionNameMin: Cijk_Ailk_Bjlk_B8F8NSS_BH_Bias_HAS_SAV_UserArgs_MT128x256x64_MI16x16x1_SN_LDSB1_CLR1_GRVWA16_GRVWB8_GSU0_GSUC0_GSUWGMRR0_K1_LBSPPA1024_LBSPPB2048_LPA64_LPB0_MIWT4_8_PLR1_SU0_SUM0_SUS64_VWA4_VWB8_WGM1_WGMXCC1_WGMXCCGn1
    SolutionIndex: 13
    SolutionNameMin: Cijk_Ailk_Bjlk_B8F8NSS_BH_Bias_HAS_SAV_UserArgs_MT128x256x64_MI16x16x1_SN_LDSB1_CLR1_GRVWA4_GRVWB16_GSU0_GSUC0_GSUWGMRR0_K1_LBSPPA1024_LBSPPB2048_LPA64_LPB0_MIWT4_8_PLR1_SU0_SUM0_SUS64_VWA4_VWB8_WGM1_WGMXCC1_WGMXCCGn1
    SolutionIndex: 14
    SolutionNameMin: Cijk_Ailk_Bjlk_B8F8NSS_BH_Bias_HAS_SAV_UserArgs_MT128x256x64_MI16x16x1_SN_LDSB1_CLR1_GRVWA8_GRVWB16_GSU0_GSUC0_GSUWGMRR0_K1_LBSPPA1024_LBSPPB2048_LPA64_LPB0_MIWT4_8_PLR1_SU0_SUM0_SUS64_VWA4_VWB8_WGM1_WGMXCC1_WGMXCCGn1
    SolutionIndex: 15
    SolutionNameMin: Cijk_Ailk_Bjlk_B8F8NSS_BH_Bias_HAS_SAV_UserArgs_MT128x256x64_MI16x16x1_SN_LDSB1_CLR1_GRVWA16_GRVWB16_GSU0_GSUC0_GSUWGMRR0_K1_LBSPPA1024_LBSPPB2048_LPA64_LPB0_MIWT4_8_PLR1_SU0_SUM0_SUS64_VWA4_VWB8_WGM1_WGMXCC1_WGMXCCGn1
    SolutionIndex: 16
    SolutionNameMin: Cijk_Ailk_Bjlk_B8F8NSS_BH_Bias_HAS_SAV_UserArgs_MT128x256x64_MI16x16x1_SN_LDSB1_CLR1_GRVWA4_GRVWB16_GSU0_GSUC0_GSUWGMRR0_K1_LBSPPA1024_LBSPPB2048_LPA64_LPB0_MIWT4_8_PLR1_SU0_SUM0_SUS64_VWA4_VWB8_WGM4_WGMXCC1_WGMXCCGn1
    SolutionIndex: 17
    SolutionNameMin: Cijk_Ailk_Bjlk_B8F8NSS_BH_Bias_HAS_SAV_UserArgs_MT128x256x64_MI16x16x1_SN_LDSB1_CLR1_GRVWA4_GRVWB16_GSU0_GSUC0_GSUWGMRR0_K1_LBSPPA1024_LBSPPB2048_LPA64_LPB0_MIWT4_8_PLR1_SU0_SUM0_SUS64_VWA4_VWB8_WGM6_WGMXCC1_WGMXCCGn1
    SolutionIndex: 18
    SolutionNameMin: Cijk_Ailk_Bjlk_B8F8NSS_BH_Bias_HAS_SAV_UserArgs_MT128x256x64_MI16x16x1_SN_LDSB1_CLR1_GRVWA8_GRVWB16_GSU0_GSUC0_GSUWGMRR0_K1_LBSPPA1024_LBSPPB2048_LPA64_LPB0_MIWT4_8_PLR1_SU0_SUM0_SUS64_VWA4_VWB8_WGM6_WGMXCC1_WGMXCCGn1
    SolutionIndex: 19
    SolutionNameMin: Cijk_Ailk_Bjlk_B8F8NSS_BH_Bias_HAS_SAV_UserArgs_MT128x256x64_MI16x16x1_SN_LDSB1_CLR1_GRVWA16_GRVWB16_GSU0_GSUC0_GSUWGMRR0_K1_LBSPPA1024_LBSPPB2048_LPA64_LPB0_MIWT4_8_PLR1_SU0_SUM0_SUS64_VWA4_VWB8_WGM6_WGMXCC1_WGMXCCGn1
    SolutionIndex: 20
    SolutionNameMin: Cijk_Ailk_Bjlk_B8F8NSS_BH_Bias_HAS_SAV_UserArgs_MT128x256x64_MI16x16x1_SN_LDSB1_CLR1_GRVWA4_GRVWB16_GSU0_GSUC0_GSUWGMRR0_K1_LBSPPA1024_LBSPPB2048_LPA64_LPB0_MIWT4_8_PLR1_SU0_SUM0_SUS64_VWA4_VWB8_WGM8_WGMXCC1_WGMXCCGn1
    SolutionIndex: 21
    SolutionNameMin: Cijk_Ailk_Bjlk_B8F8NSS_BH_Bias_HAS_SAV_UserArgs_MT128x256x64_MI16x16x1_SN_LDSB1_CLR1_GRVWA16_GRVWB16_GSU0_GSUC0_GSUWGMRR0_K1_LBSPPA1024_LBSPPB2048_LPA64_LPB0_MIWT4_8_PLR1_SU0_SUM0_SUS64_VWA4_VWB8_WGM8_WGMXCC1_WGMXCCGn1
    SolutionIndex: 22
    SolutionNameMin: Cijk_Ailk_Bjlk_B8F8NSS_BH_Bias_HAS_SAV_UserArgs_MT256x144x64_MI16x16x1_SN_LDSB0_CLR1_GRVWA4_GRVWB4_GSU0_GSUC0_GSUWGMRR0_K1_LBSPPA2048_LBSPPB1152_LPA64_LPB16_MIWT4_9_PLR1_SU0_SUM0_SUS64_VWA4_VWB1_WGM1_WGMXCC1_WGMXCCGn1
    SolutionIndex: 23
    SolutionNameMin: Cijk_Ailk_Bjlk_B8F8NSS_BH_Bias_HAS_SAV_UserArgs_MT256x144x64_MI16x16x1_SN_LDSB0_CLR1_GRVWA8_GRVWB4_GSU0_GSUC0_GSUWGMRR0_K1_LBSPPA2048_LBSPPB1152_LPA64_LPB16_MIWT4_9_PLR1_SU0_SUM0_SUS64_VWA4_VWB1_WGM1_WGMXCC1_WGMXCCGn1
    SolutionIndex: 24
    SolutionNameMin: Cijk_Ailk_Bjlk_B8F8NSS_BH_Bias_HAS_SAV_UserArgs_MT256x144x64_MI16x16x1_SN_LDSB0_CLR1_GRVWA16_GRVWB4_GSU0_GSUC0_GSUWGMRR0_K1_LBSPPA2048_LBSPPB1152_LPA64_LPB16_MIWT4_9_PLR1_SU0_SUM0_SUS64_VWA4_VWB1_WGM1_WGMXCC1_WGMXCCGn1
    SolutionIndex: 25
    SolutionNameMin: Cijk_Ailk_Bjlk_B8F8NSS_BH_Bias_HAS_SAV_UserArgs_MT256x144x64_MI16x16x1_SN_LDSB0_CLR1_GRVWA4_GRVWB4_GSU0_GSUC0_GSUWGMRR0_K1_LBSPPA2048_LBSPPB1152_LPA64_LPB16_MIWT4_9_PLR1_SU0_SUM0_SUS64_VWA4_VWB1_WGM4_WGMXCC1_WGMXCCGn1
    SolutionIndex: 26
    SolutionNameMin: Cijk_Ailk_Bjlk_B8F8NSS_BH_Bias_HAS_SAV_UserArgs_MT256x144x64_MI16x16x1_SN_LDSB0_CLR1_GRVWA8_GRVWB4_GSU0_GSUC0_GSUWGMRR0_K1_LBSPPA2048_LBSPPB1152_LPA64_LPB16_MIWT4_9_PLR1_SU0_SUM0_SUS64_VWA4_VWB1_WGM4_WGMXCC1_WGMXCCGn1
    SolutionIndex: 27
    SolutionNameMin: Cijk_Ailk_Bjlk_B8F8NSS_BH_Bias_HAS_SAV_UserArgs_MT256x144x64_MI16x16x1_SN_LDSB0_CLR1_GRVWA16_GRVWB4_GSU0_GSUC0_GSUWGMRR0_K1_LBSPPA2048_LBSPPB1152_LPA64_LPB16_MIWT4_9_PLR1_SU0_SUM0_SUS64_VWA4_VWB1_WGM4_WGMXCC1_WGMXCCGn1
    SolutionIndex: 28
    SolutionNameMin: Cijk_Ailk_Bjlk_B8F8NSS_BH_Bias_HAS_SAV_UserArgs_MT144x256x64_MI16x16x1_SN_LDSB0_CLR1_GRVWA4_GRVWB16_GSU0_GSUC0_GSUWGMRR0_K1_LBSPPA1152_LBSPPB2048_LPA16_LPB64_MIWT9_4_PLR1_SU0_SUM0_SUS64_VWA1_VWB4_WGM1_WGMXCC1_WGMXCCGn1
    SolutionIndex: 29
    SolutionNameMin: Cijk_Ailk_Bjlk_B8F8NSS_BH_Bias_HAS_SAV_UserArgs_MT144x256x64_MI16x16x1_SN_LDSB0_CLR1_GRVWA4_GRVWB16_GSU0_GSUC0_GSUWGMRR0_K1_LBSPPA1152_LBSPPB2048_LPA16_LPB64_MIWT9_4_PLR1_SU0_SUM0_SUS64_VWA1_VWB4_WGM6_WGMXCC1_WGMXCCGn1
    SolutionIndex: 30
    SolutionNameMin: Cijk_Ailk_Bjlk_B8F8NSS_BH_Bias_HAS_SAV_UserArgs_MT144x256x64_MI16x16x1_SN_LDSB0_CLR1_GRVWA4_GRVWB4_GSU0_GSUC0_GSUWGMRR0_K1_LBSPPA1152_LBSPPB2048_LPA16_LPB64_MIWT9_4_PLR1_SU0_SUM0_SUS64_VWA1_VWB4_WGM8_WGMXCC1_WGMXCCGn1
    SolutionIndex: 31
    SolutionNameMin: Cijk_Ailk_Bjlk_B8F8NSS_BH_Bias_HAS_SAV_UserArgs_MT144x256x64_MI16x16x1_SN_LDSB0_CLR1_GRVWA4_GRVWB16_GSU0_GSUC0_GSUWGMRR0_K1_LBSPPA1152_LBSPPB2048_LPA16_LPB64_MIWT9_4_PLR1_SU0_SUM0_SUS64_VWA1_VWB4_WGM8_WGMXCC1_WGMXCCGn1
    SolutionIndex: 32
    SolutionNameMin: Cijk_Ailk_Bjlk_B8F8NSS_BH_Bias_HAS_SAV_UserArgs_MT144x128x64_MI16x16x1_SN_LDSB1_CLR1_GRVWA4_GRVWB16_GSU0_GSUC0_GSUWGMRR0_K1_LBSPPA1152_LBSPPB1024_LPA16_LPB32_MIWT9_2_PLR1_SU0_SUM0_SUS64_VWA1_VWB2_WGM1_WGMXCC1_WGMXCCGn1
    SolutionIndex: 33
    SolutionNameMin: Cijk_Ailk_Bjlk_B8F8NSS_BH_Bias_HAS_SAV_UserArgs_MT128x128x64_MI16x16x1_SN_LDSB1_CLR1_GRVWA4_GRVWB4_GSU0_GSUC0_GSUWGMRR0_K1_LBSPPA1024_LBSPPB1024_LPA64_LPB64_MIWT4_4_PLR1_SU0_SUM0_SUS64_VWA4_VWB4_WGM1_WGMXCC1_WGMXCCGn1
    SolutionIndex: 34
    SolutionNameMin: Cijk_Ailk_Bjlk_B8F8NSS_BH_Bias_HAS_SAV_UserArgs_MT128x128x64_MI16x16x1_SN_LDSB1_CLR1_GRVWA4_GRVWB8_GSU0_GSUC0_GSUWGMRR0_K1_LBSPPA1024_LBSPPB1024_LPA64_LPB64_MIWT4_4_PLR1_SU0_SUM0_SUS64_VWA4_VWB4_WGM1_WGMXCC1_WGMXCCGn1
    SolutionIndex: 35
    SolutionNameMin: Cijk_Ailk_Bjlk_B8F8NSS_BH_Bias_HAS_SAV_UserArgs_MT128x128x64_MI16x16x1_SN_LDSB1_CLR1_GRVWA16_GRVWB8_GSU0_GSUC0_GSUWGMRR0_K1_LBSPPA1024_LBSPPB1024_LPA64_LPB64_MIWT4_4_PLR1_SU0_SUM0_SUS64_VWA4_VWB4_WGM1_WGMXCC1_WGMXCCGn1
    SolutionIndex: 36
    SolutionNameMin: Cijk_Ailk_Bjlk_B8F8NSS_BH_Bias_HAS_SAV_UserArgs_MT128x128x64_MI16x16x1_SN_LDSB1_CLR1_GRVWA4_GRVWB16_GSU0_GSUC0_GSUWGMRR0_K1_LBSPPA1024_LBSPPB1024_LPA64_LPB64_MIWT4_4_PLR1_SU0_SUM0_SUS64_VWA4_VWB4_WGM1_WGMXCC1_WGMXCCGn1
    SolutionIndex: 37
    SolutionNameMin: Cijk_Ailk_Bjlk_B8F8NSS_BH_Bias_HAS_SAV_UserArgs_MT128x128x64_MI16x16x1_SN_LDSB1_CLR1_GRVWA8_GRVWB16_GSU0_GSUC0_GSUWGMRR0_K1_LBSPPA1024_LBSPPB1024_LPA64_LPB64_MIWT4_4_PLR1_SU0_SUM0_SUS64_VWA4_VWB4_WGM1_WGMXCC1_WGMXCCGn1
    SolutionIndex: 38
    SolutionNameMin: Cijk_Ailk_Bjlk_B8F8NSS_BH_Bias_HAS_SAV_UserArgs_MT128x128x64_MI16x16x1_SN_LDSB1_CLR1_GRVWA16_GRVWB16_GSU0_GSUC0_GSUWGMRR0_K1_LBSPPA1024_LBSPPB1024_LPA64_LPB64_MIWT4_4_PLR1_SU0_SUM0_SUS64_VWA4_VWB4_WGM1_WGMXCC1_WGMXCCGn1
    SolutionIndex: 39
    SolutionNameMin: Cijk_Ailk_Bjlk_B8F8NSS_BH_Bias_HAS_SAV_UserArgs_MT128x128x64_MI16x16x1_SN_LDSB1_CLR1_GRVWA16_GRVWB16_GSU0_GSUC0_GSUWGMRR0_K1_LBSPPA1024_LBSPPB1024_LPA64_LPB64_MIWT4_4_PLR1_SU0_SUM0_SUS64_VWA4_VWB4_WGM4_WGMXCC1_WGMXCCGn1
    SolutionIndex: 40
    SolutionNameMin: Cijk_Ailk_Bjlk_B8F8NSS_BH_Bias_HAS_SAV_UserArgs_MT128x128x64_MI16x16x1_SN_LDSB1_CLR1_GRVWA4_GRVWB4_GSU0_GSUC0_GSUWGMRR0_K1_LBSPPA1024_LBSPPB1024_LPA64_LPB64_MIWT4_4_PLR1_SU0_SUM0_SUS64_VWA4_VWB4_WGM6_WGMXCC1_WGMXCCGn1
    SolutionIndex: 41
    SolutionNameMin: Cijk_Ailk_Bjlk_B8F8NSS_BH_Bias_HAS_SAV_UserArgs_MT128x128x64_MI16x16x1_SN_LDSB1_CLR1_GRVWA8_GRVWB16_GSU0_GSUC0_GSUWGMRR0_K1_LBSPPA1024_LBSPPB1024_LPA64_LPB64_MIWT4_4_PLR1_SU0_SUM0_SUS64_VWA4_VWB4_WGM6_WGMXCC1_WGMXCCGn1
    SolutionIndex: 42
    SolutionNameMin: Cijk_Ailk_Bjlk_B8F8NSS_BH_Bias_HAS_SAV_UserArgs_MT128x128x64_MI16x16x1_SN_LDSB1_CLR1_GRVWA16_GRVWB16_GSU0_GSUC0_GSUWGMRR0_K1_LBSPPA1024_LBSPPB1024_LPA64_LPB64_MIWT4_4_PLR1_SU0_SUM0_SUS64_VWA4_VWB4_WGM6_WGMXCC1_WGMXCCGn1
    SolutionIndex: 43
    SolutionNameMin: Cijk_Ailk_Bjlk_B8F8NSS_BH_Bias_HAS_SAV_UserArgs_MT128x128x64_MI16x16x1_SN_LDSB1_CLR1_GRVWA8_GRVWB4_GSU0_GSUC0_GSUWGMRR0_K1_LBSPPA1024_LBSPPB1024_LPA64_LPB64_MIWT4_4_PLR1_SU0_SUM0_SUS64_VWA4_VWB4_WGM8_WGMXCC1_WGMXCCGn1
    SolutionIndex: 44
    SolutionNameMin: Cijk_Ailk_Bjlk_B8F8NSS_BH_Bias_HAS_SAV_UserArgs_MT128x128x64_MI16x16x1_SN_LDSB1_CLR1_GRVWA4_GRVWB8_GSU0_GSUC0_GSUWGMRR0_K1_LBSPPA1024_LBSPPB1024_LPA64_LPB64_MIWT4_4_PLR1_SU0_SUM0_SUS64_VWA4_VWB4_WGM8_WGMXCC1_WGMXCCGn1
    SolutionIndex: 45
    SolutionNameMin: Cijk_Ailk_Bjlk_B8F8NSS_BH_Bias_HAS_SAV_UserArgs_MT128x128x64_MI16x16x1_SN_LDSB1_CLR1_GRVWA4_GRVWB16_GSU0_GSUC0_GSUWGMRR0_K1_LBSPPA1024_LBSPPB1024_LPA64_LPB64_MIWT4_4_PLR1_SU0_SUM0_SUS64_VWA4_VWB4_WGM8_WGMXCC1_WGMXCCGn1
    SolutionIndex: 46
    SolutionNameMin: Cijk_Ailk_Bjlk_B8F8NSS_BH_Bias_HAS_SAV_UserArgs_MT128x128x64_MI16x16x1_SN_LDSB1_CLR1_GRVWA8_GRVWB16_GSU0_GSUC0_GSUWGMRR0_K1_LBSPPA1024_LBSPPB1024_LPA64_LPB64_MIWT4_4_PLR1_SU0_SUM0_SUS64_VWA4_VWB4_WGM8_WGMXCC1_WGMXCCGn1
    SolutionIndex: 47
    SolutionNameMin: Cijk_Ailk_Bjlk_B8F8NSS_BH_Bias_HAS_SAV_UserArgs_MT128x128x64_MI16x16x1_SN_LDSB1_CLR1_GRVWA16_GRVWB16_GSU0_GSUC0_GSUWGMRR0_K1_LBSPPA1024_LBSPPB1024_LPA64_LPB64_MIWT4_4_PLR1_SU0_SUM0_SUS64_VWA4_VWB4_WGM8_WGMXCC1_WGMXCCGn1
    SolutionIndex: 48
    SolutionNameMin: Cijk_Ailk_Bjlk_B8F8NSS_BH_Bias_HAS_SAV_UserArgs_MT64x128x64_MI16x16x1_SN_LDSB0_CLR1_GRVWA4_GRVWB8_GSU0_GSUC0_GSUWGMRR0_K1_LBSPPA512_LBSPPB1024_LPA32_LPB64_MIWT2_4_PLR1_SU0_SUM0_SUS64_VWA2_VWB4_WGM1_WGMXCC1_WGMXCCGn1
    SolutionIndex: 49
    SolutionNameMin: Cijk_Ailk_Bjlk_B8F8NSS_BH_Bias_HAS_SAV_UserArgs_MT64x128x64_MI16x16x1_SN_LDSB0_CLR1_GRVWA8_GRVWB16_GSU0_GSUC0_GSUWGMRR0_K1_LBSPPA512_LBSPPB1024_LPA32_LPB64_MIWT2_4_PLR1_SU0_SUM0_SUS64_VWA2_VWB4_WGM1_WGMXCC1_WGMXCCGn1
    SolutionIndex: 50
    SolutionNameMin: Cijk_Ailk_Bjlk_B8F8NSS_BH_Bias_HAS_SAV_UserArgs_MT64x128x64_MI16x16x1_SN_LDSB0_CLR1_GRVWA16_GRVWB16_GSU0_GSUC0_GSUWGMRR0_K1_LBSPPA512_LBSPPB1024_LPA32_LPB64_MIWT2_4_PLR1_SU0_SUM0_SUS64_VWA2_VWB4_WGM1_WGMXCC1_WGMXCCGn1
    SolutionIndex: 51
    SolutionNameMin: Cijk_Ailk_Bjlk_B8F8NSS_BH_Bias_HAS_SAV_UserArgs_MT128x64x64_MI16x16x1_SN_LDSB0_CLR1_GRVWA4_GRVWB4_GSU0_GSUC0_GSUWGMRR0_K1_LBSPPA1024_LBSPPB512_LPA64_LPB32_MIWT4_2_PLR1_SU0_SUM0_SUS64_VWA4_VWB2_WGM1_WGMXCC1_WGMXCCGn1
    SolutionIndex: 52
    SolutionNameMin: Cijk_Ailk_Bjlk_B8F8NSS_BH_Bias_HAS_SAV_UserArgs_MT128x64x64_MI16x16x1_SN_LDSB0_CLR1_GRVWA16_GRVWB4_GSU0_GSUC0_GSUWGMRR0_K1_LBSPPA1024_LBSPPB512_LPA64_LPB32_MIWT4_2_PLR1_SU0_SUM0_SUS64_VWA4_VWB2_WGM1_WGMXCC1_WGMXCCGn1
    SolutionIndex: 53
    SolutionNameMin: Cijk_Ailk_Bjlk_B8F8NSS_BH_Bias_HAS_SAV_UserArgs_MT128x64x64_MI16x16x1_SN_LDSB0_CLR1_GRVWA4_GRVWB8_GSU0_GSUC0_GSUWGMRR0_K1_LBSPPA1024_LBSPPB512_LPA64_LPB32_MIWT4_2_PLR1_SU0_SUM0_SUS64_VWA4_VWB2_WGM1_WGMXCC1_WGMXCCGn1
    SolutionIndex: 54
    SolutionNameMin: Cijk_Ailk_Bjlk_B8F8NSS_BH_Bias_HAS_SAV_UserArgs_MT128x64x64_MI16x16x1_SN_LDSB0_CLR1_GRVWA8_GRVWB8_GSU0_GSUC0_GSUWGMRR0_K1_LBSPPA1024_LBSPPB512_LPA64_LPB32_MIWT4_2_PLR1_SU0_SUM0_SUS64_VWA4_VWB2_WGM1_WGMXCC1_WGMXCCGn1
    SolutionIndex: 55
    SolutionNameMin: Cijk_Ailk_Bjlk_B8F8NSS_BH_Bias_HAS_SAV_UserArgs_MT128x64x64_MI16x16x1_SN_LDSB0_CLR1_GRVWA16_GRVWB8_GSU0_GSUC0_GSUWGMRR0_K1_LBSPPA1024_LBSPPB512_LPA64_LPB32_MIWT4_2_PLR1_SU0_SUM0_SUS64_VWA4_VWB2_WGM1_WGMXCC1_WGMXCCGn1
    SolutionIndex: 56
    SolutionNameMin: Cijk_Ailk_Bjlk_B8F8NSS_BH_Bias_HAS_SAV_UserArgs_MT128x64x64_MI16x16x1_SN_LDSB0_CLR1_GRVWA4_GRVWB8_GSU0_GSUC0_GSUWGMRR0_K1_LBSPPA1024_LBSPPB512_LPA64_LPB32_MIWT4_2_PLR1_SU0_SUM0_SUS64_VWA4_VWB2_WGM4_WGMXCC1_WGMXCCGn1
    SolutionIndex: 57
    SolutionNameMin: Cijk_Ailk_Bjlk_B8F8NSS_BH_Bias_HAS_SAV_UserArgs_MT128x64x64_MI16x16x1_SN_LDSB0_CLR1_GRVWA4_GRVWB8_GSU0_GSUC0_GSUWGMRR0_K1_LBSPPA1024_LBSPPB512_LPA64_LPB32_MIWT4_2_PLR1_SU0_SUM0_SUS64_VWA4_VWB2_WGM6_WGMXCC1_WGMXCCGn1
    SolutionIndex: 58
    SolutionNameMin: Cijk_Ailk_Bjlk_B8F8NSS_BH_Bias_HAS_SAV_UserArgs_MT128x64x64_MI16x16x1_SN_LDSB0_CLR1_GRVWA4_GRVWB8_GSU0_GSUC0_GSUWGMRR0_K1_LBSPPA1024_LBSPPB512_LPA64_LPB32_MIWT4_2_PLR1_SU0_SUM0_SUS64_VWA4_VWB2_WGM8_WGMXCC1_WGMXCCGn1
    SolutionIndex: 59
    SolutionNameMin: Cijk_Ailk_Bjlk_B8F8NSS_BH_Bias_HAS_SAV_UserArgs_MT128x32x64_MI16x16x1_SN_LDSB0_CLR1_GRVWA4_GRVWB4_GSU0_GSUC0_GSUWGMRR0_K1_LBSPPA1024_LBSPPB256_LPA64_LPB16_MIWT4_1_PLR1_SU0_SUM0_SUS64_VWA4_VWB1_WGM1_WGMXCC1_WGMXCCGn1
    SolutionIndex: 60
    SolutionNameMin: Cijk_Ailk_Bjlk_B8F8NSS_BH_Bias_HAS_SAV_UserArgs_MT128x32x64_MI16x16x1_SN_LDSB0_CLR1_GRVWA16_GRVWB4_GSU0_GSUC0_GSUWGMRR0_K1_LBSPPA1024_LBSPPB256_LPA64_LPB16_MIWT4_1_PLR1_SU0_SUM0_SUS64_VWA4_VWB1_WGM1_WGMXCC1_WGMXCCGn1
    SolutionIndex: 61
    SolutionNameMin: Cijk_Ailk_Bjlk_B8F8NSS_BH_Bias_HAS_SAV_UserArgs_MT128x32x64_MI16x16x1_SN_LDSB0_CLR1_GRVWA8_GRVWB8_GSU0_GSUC0_GSUWGMRR0_K1_LBSPPA1024_LBSPPB256_LPA64_LPB16_MIWT4_1_PLR1_SU0_SUM0_SUS64_VWA4_VWB1_WGM4_WGMXCC1_WGMXCCGn1
    SolutionIndex: 62
    SolutionNameMin: Cijk_Ailk_Bjlk_B8F8NSS_BH_Bias_HAS_SAV_UserArgs_MT64x64x64_MI16x16x1_SN_LDSB0_CLR1_GRVWA4_GRVWB4_GSU0_GSUC0_GSUWGMRR0_K1_LBSPPA512_LBSPPB512_LPA32_LPB32_MIWT2_2_PLR1_SU0_SUM0_SUS64_VWA2_VWB2_WGM1_WGMXCC1_WGMXCCGn1
    SolutionIndex: 63
    SolutionNameMin: Cijk_Ailk_Bjlk_B8F8NSS_BH_Bias_HAS_SAV_UserArgs_MT64x64x64_MI16x16x1_SN_LDSB0_CLR1_GRVWA8_GRVWB4_GSU0_GSUC0_GSUWGMRR0_K1_LBSPPA512_LBSPPB512_LPA32_LPB32_MIWT2_2_PLR1_SU0_SUM0_SUS64_VWA2_VWB2_WGM1_WGMXCC1_WGMXCCGn1
    SolutionIndex: 64
    SolutionNameMin: Cijk_Ailk_Bjlk_B8F8NSS_BH_Bias_HAS_SAV_UserArgs_MT64x64x64_MI16x16x1_SN_LDSB0_CLR1_GRVWA8_GRVWB8_GSU0_GSUC0_GSUWGMRR0_K1_LBSPPA512_LBSPPB512_LPA32_LPB32_MIWT2_2_PLR1_SU0_SUM0_SUS64_VWA2_VWB2_WGM1_WGMXCC1_WGMXCCGn1
    SolutionIndex: 65
    SolutionNameMin: Cijk_Ailk_Bjlk_B8F8NSS_BH_Bias_HAS_SAV_UserArgs_MT64x64x64_MI16x16x1_SN_LDSB0_CLR1_GRVWA4_GRVWB8_GSU0_GSUC0_GSUWGMRR0_K1_LBSPPA512_LBSPPB512_LPA32_LPB32_MIWT2_2_PLR1_SU0_SUM0_SUS64_VWA2_VWB2_WGM4_WGMXCC1_WGMXCCGn1
    SolutionIndex: 66
    SolutionNameMin: Cijk_Ailk_Bjlk_B8F8NSS_BH_Bias_HAS_SAV_UserArgs_MT32x64x64_MI16x16x1_SN_LDSB0_CLR1_GRVWA4_GRVWB4_GSU0_GSUC0_GSUWGMRR0_K1_LBSPPA256_LBSPPB512_LPA16_LPB32_MIWT1_2_PLR1_SU0_SUM0_SUS64_VWA1_VWB2_WGM1_WGMXCC1_WGMXCCGn1
    SolutionIndex: 67
    SolutionNameMin: Cijk_Ailk_Bjlk_B8F8NSS_BH_Bias_HAS_SAV_UserArgs_MT32x64x64_MI16x16x1_SN_LDSB0_CLR1_GRVWA8_GRVWB4_GSU0_GSUC0_GSUWGMRR0_K1_LBSPPA256_LBSPPB512_LPA16_LPB32_MIWT1_2_PLR1_SU0_SUM0_SUS64_VWA1_VWB2_WGM1_WGMXCC1_WGMXCCGn1
    SolutionIndex: 68
    SolutionNameMin: Cijk_Ailk_Bjlk_B8F8NSS_BH_Bias_HAS_SAV_UserArgs_MT32x64x64_MI16x16x1_SN_LDSB0_CLR1_GRVWA4_GRVWB8_GSU0_GSUC0_GSUWGMRR0_K1_LBSPPA256_LBSPPB512_LPA16_LPB32_MIWT1_2_PLR1_SU0_SUM0_SUS64_VWA1_VWB2_WGM1_WGMXCC1_WGMXCCGn1
    SolutionIndex: 69
    SolutionNameMin: Cijk_Ailk_Bjlk_B8F8NSS_BH_Bias_HAS_SAV_UserArgs_MT32x64x64_MI16x16x1_SN_LDSB0_CLR1_GRVWA4_GRVWB4_GSU0_GSUC0_GSUWGMRR0_K1_LBSPPA256_LBSPPB512_LPA16_LPB32_MIWT1_2_PLR1_SU0_SUM0_SUS64_VWA1_VWB2_WGM8_WGMXCC1_WGMXCCGn1
    SolutionIndex: 70
    SolutionNameMin: Cijk_Ailk_Bjlk_B8F8NSS_BH_Bias_HAS_SAV_UserArgs_MT64x32x64_MI16x16x1_SN_LDSB0_CLR1_GRVWA4_GRVWB4_GSU0_GSUC0_GSUWGMRR0_K1_LBSPPA512_LBSPPB256_LPA32_LPB16_MIWT2_1_PLR1_SU0_SUM0_SUS64_VWA2_VWB1_WGM1_WGMXCC1_WGMXCCGn1
    SolutionIndex: 71
    SolutionNameMin: Cijk_Ailk_Bjlk_B8F8NSS_BH_Bias_HAS_SAV_UserArgs_MT64x32x64_MI16x16x1_SN_LDSB0_CLR1_GRVWA8_GRVWB4_GSU0_GSUC0_GSUWGMRR0_K1_LBSPPA512_LBSPPB256_LPA32_LPB16_MIWT2_1_PLR1_SU0_SUM0_SUS64_VWA2_VWB1_WGM1_WGMXCC1_WGMXCCGn1
    SolutionIndex: 72
    SolutionNameMin: Cijk_Ailk_Bjlk_B8F8NSS_BH_Bias_HAS_SAV_UserArgs_MT32x32x64_MI16x16x1_SN_LDSB0_CLR1_GRVWA4_GRVWB4_GSU0_GSUC0_GSUWGMRR0_K1_LBSPPA256_LBSPPB256_LPA16_LPB16_MIWT1_1_PLR1_SU0_SUM0_SUS64_VWA1_VWB1_WGM1_WGMXCC1_WGMXCCGn1
    SolutionIndex: 73
    SolutionNameMin: Cijk_Ailk_Bjlk_B8F8NSS_BH_Bias_HAS_SAV_UserArgs_MT32x32x64_MI16x16x1_SN_LDSB0_CLR1_GRVWA8_GRVWB4_GSU0_GSUC0_GSUWGMRR0_K1_LBSPPA256_LBSPPB256_LPA16_LPB16_MIWT1_1_PLR1_SU0_SUM0_SUS64_VWA1_VWB1_WGM1_WGMXCC1_WGMXCCGn1
    SolutionIndex: 74
    SolutionNameMin: Cijk_Ailk_Bjlk_B8F8NSS_BH_Bias_HAS_SAV_UserArgs_MT32x32x64_MI16x16x1_SN_LDSB0_CLR1_GRVWA4_GRVWB8_GSU0_GSUC0_GSUWGMRR0_K1_LBSPPA256_LBSPPB256_LPA16_LPB16_MIWT1_1_PLR1_SU0_SUM0_SUS64_VWA1_VWB1_WGM1_WGMXCC1_WGMXCCGn1
    SolutionIndex: 75
    SolutionNameMin: Cijk_Ailk_Bjlk_B8F8NSS_BH_Bias_HAS_SAV_UserArgs_MT32x32x64_MI16x16x1_SN_LDSB0_CLR1_GRVWA8_GRVWB8_GSU0_GSUC0_GSUWGMRR0_K1_LBSPPA256_LBSPPB256_LPA16_LPB16_MIWT1_1_PLR1_SU0_SUM0_SUS64_VWA1_VWB1_WGM1_WGMXCC1_WGMXCCGn1
    SolutionIndex: 76
    SolutionNameMin: Cijk_Ailk_Bjlk_B8F8NSS_BH_Bias_HAS_SAV_UserArgs_MT256x256x128_MI16x16x1_SN_LDSB1_CLR1_GRVWA16_GRVWB16_GSU0_GSUC0_GSUWGMRR0_K1_LBSPPA2048_LBSPPB2048_LPA0_LPB0_MIWT8_8_PLR1_SU0_SUM0_SUS128_VWA8_VWB8_WGM1_WGMXCC1_WGMXCCGn1
    SolutionIndex: 77
    SolutionNameMin: Cijk_Ailk_Bjlk_B8F8NSS_BH_Bias_HAS_SAV_UserArgs_MT256x256x128_MI16x16x1_SN_LDSB1_CLR1_GRVWA16_GRVWB8_GSU0_GSUC0_GSUWGMRR0_K1_LBSPPA2048_LBSPPB2048_LPA0_LPB0_MIWT8_8_PLR1_SU0_SUM0_SUS128_VWA8_VWB8_WGM6_WGMXCC1_WGMXCCGn1
    SolutionIndex: 78
    SolutionNameMin: Cijk_Ailk_Bjlk_B8F8NSS_BH_Bias_HAS_SAV_UserArgs_MT256x256x128_MI16x16x1_SN_LDSB1_CLR1_GRVWA16_GRVWB16_GSU0_GSUC0_GSUWGMRR0_K1_LBSPPA2048_LBSPPB2048_LPA0_LPB0_MIWT8_8_PLR1_SU0_SUM0_SUS128_VWA8_VWB8_WGM6_WGMXCC1_WGMXCCGn1
    SolutionIndex: 79
    SolutionNameMin: Cijk_Ailk_Bjlk_B8F8NSS_BH_Bias_HAS_SAV_UserArgs_MT256x256x128_MI16x16x1_SN_LDSB1_CLR1_GRVWA16_GRVWB16_GSU0_GSUC0_GSUWGMRR0_K1_LBSPPA2048_LBSPPB2048_LPA0_LPB0_MIWT8_8_PLR1_SU0_SUM0_SUS128_VWA8_VWB8_WGM8_WGMXCC1_WGMXCCGn1
    SolutionIndex: 80
    SolutionNameMin: Cijk_Ailk_Bjlk_B8F8NSS_BH_Bias_HAS_SAV_UserArgs_MT128x256x128_MI16x16x1_SN_LDSB1_CLR1_GRVWA4_GRVWB16_GSU0_GSUC0_GSUWGMRR0_K1_LBSPPA1024_LBSPPB2048_LPA64_LPB0_MIWT4_8_PLR1_SU0_SUM0_SUS128_VWA4_VWB8_WGM1_WGMXCC1_WGMXCCGn1
    SolutionIndex: 81
    SolutionNameMin: Cijk_Ailk_Bjlk_B8F8NSS_BH_Bias_HAS_SAV_UserArgs_MT128x256x128_MI16x16x1_SN_LDSB1_CLR1_GRVWA8_GRVWB16_GSU0_GSUC0_GSUWGMRR0_K1_LBSPPA1024_LBSPPB2048_LPA64_LPB0_MIWT4_8_PLR1_SU0_SUM0_SUS128_VWA4_VWB8_WGM1_WGMXCC1_WGMXCCGn1
    SolutionIndex: 82
    SolutionNameMin: Cijk_Ailk_Bjlk_B8F8NSS_BH_Bias_HAS_SAV_UserArgs_MT128x256x128_MI16x16x1_SN_LDSB1_CLR1_GRVWA16_GRVWB16_GSU0_GSUC0_GSUWGMRR0_K1_LBSPPA1024_LBSPPB2048_LPA64_LPB0_MIWT4_8_PLR1_SU0_SUM0_SUS128_VWA4_VWB8_WGM1_WGMXCC1_WGMXCCGn1
    SolutionIndex: 83
    SolutionNameMin: Cijk_Ailk_Bjlk_B8F8NSS_BH_Bias_HAS_SAV_UserArgs_MT128x256x128_MI16x16x1_SN_LDSB1_CLR1_GRVWA4_GRVWB16_GSU0_GSUC0_GSUWGMRR0_K1_LBSPPA1024_LBSPPB2048_LPA64_LPB0_MIWT4_8_PLR1_SU0_SUM0_SUS128_VWA4_VWB8_WGM4_WGMXCC1_WGMXCCGn1
    SolutionIndex: 84
    SolutionNameMin: Cijk_Ailk_Bjlk_B8F8NSS_BH_Bias_HAS_SAV_UserArgs_MT128x256x128_MI16x16x1_SN_LDSB1_CLR1_GRVWA8_GRVWB16_GSU0_GSUC0_GSUWGMRR0_K1_LBSPPA1024_LBSPPB2048_LPA64_LPB0_MIWT4_8_PLR1_SU0_SUM0_SUS128_VWA4_VWB8_WGM4_WGMXCC1_WGMXCCGn1
    SolutionIndex: 85
    SolutionNameMin: Cijk_Ailk_Bjlk_B8F8NSS_BH_Bias_HAS_SAV_UserArgs_MT128x256x128_MI16x16x1_SN_LDSB1_CLR1_GRVWA16_GRVWB16_GSU0_GSUC0_GSUWGMRR0_K1_LBSPPA1024_LBSPPB2048_LPA64_LPB0_MIWT4_8_PLR1_SU0_SUM0_SUS128_VWA4_VWB8_WGM4_WGMXCC1_WGMXCCGn1
    SolutionIndex: 86
    SolutionNameMin: Cijk_Ailk_Bjlk_B8F8NSS_BH_Bias_HAS_SAV_UserArgs_MT128x256x128_MI16x16x1_SN_LDSB1_CLR1_GRVWA4_GRVWB16_GSU0_GSUC0_GSUWGMRR0_K1_LBSPPA1024_LBSPPB2048_LPA64_LPB0_MIWT4_8_PLR1_SU0_SUM0_SUS128_VWA4_VWB8_WGM6_WGMXCC1_WGMXCCGn1
    SolutionIndex: 87
    SolutionNameMin: Cijk_Ailk_Bjlk_B8F8NSS_BH_Bias_HAS_SAV_UserArgs_MT128x256x128_MI16x16x1_SN_LDSB1_CLR1_GRVWA16_GRVWB16_GSU0_GSUC0_GSUWGMRR0_K1_LBSPPA1024_LBSPPB2048_LPA64_LPB0_MIWT4_8_PLR1_SU0_SUM0_SUS128_VWA4_VWB8_WGM6_WGMXCC1_WGMXCCGn1
    SolutionIndex: 88
    SolutionNameMin: Cijk_Ailk_Bjlk_B8F8NSS_BH_Bias_HAS_SAV_UserArgs_MT128x256x128_MI16x16x1_SN_LDSB1_CLR1_GRVWA4_GRVWB16_GSU0_GSUC0_GSUWGMRR0_K1_LBSPPA1024_LBSPPB2048_LPA64_LPB0_MIWT4_8_PLR1_SU0_SUM0_SUS128_VWA4_VWB8_WGM8_WGMXCC1_WGMXCCGn1
    SolutionIndex: 89
    SolutionNameMin: Cijk_Ailk_Bjlk_B8F8NSS_BH_Bias_HAS_SAV_UserArgs_MT128x256x128_MI16x16x1_SN_LDSB1_CLR1_GRVWA8_GRVWB16_GSU0_GSUC0_GSUWGMRR0_K1_LBSPPA1024_LBSPPB2048_LPA64_LPB0_MIWT4_8_PLR1_SU0_SUM0_SUS128_VWA4_VWB8_WGM8_WGMXCC1_WGMXCCGn1
    SolutionIndex: 90
    SolutionNameMin: Cijk_Ailk_Bjlk_B8F8NSS_BH_Bias_HAS_SAV_UserArgs_MT128x128x128_MI16x16x1_SN_LDSB1_CLR1_GRVWA16_GRVWB16_GSU0_GSUC0_GSUWGMRR0_K1_LBSPPA1024_LBSPPB1024_LPA64_LPB64_MIWT4_4_PLR1_SU0_SUM0_SUS128_VWA4_VWB4_WGM1_WGMXCC1_WGMXCCGn1
    SolutionIndex: 91
    SolutionNameMin: Cijk_Ailk_Bjlk_B8F8NSS_BH_Bias_HAS_SAV_UserArgs_MT64x128x128_MI16x16x1_SN_LDSB1_CLR1_GRVWA16_GRVWB16_GSU0_GSUC0_GSUWGMRR0_K1_LBSPPA512_LBSPPB1024_LPA32_LPB64_MIWT2_4_PLR1_SU0_SUM0_SUS128_VWA2_VWB4_WGM1_WGMXCC1_WGMXCCGn1
    SolutionIndex: 92
    SolutionNameMin: Cijk_Ailk_Bjlk_B8F8NSS_BH_Bias_HAS_SAV_UserArgs_MT128x64x128_MI16x16x1_SN_LDSB1_CLR1_GRVWA4_GRVWB8_GSU0_GSUC0_GSUWGMRR0_K1_LBSPPA1024_LBSPPB512_LPA64_LPB32_MIWT4_2_PLR1_SU0_SUM0_SUS128_VWA4_VWB2_WGM1_WGMXCC1_WGMXCCGn1
    SolutionIndex: 93
    SolutionNameMin: Cijk_Ailk_Bjlk_B8F8NSS_BH_Bias_HAS_SAV_UserArgs_MT128x64x128_MI16x16x1_SN_LDSB1_CLR1_GRVWA16_GRVWB16_GSU0_GSUC0_GSUWGMRR0_K1_LBSPPA1024_LBSPPB512_LPA64_LPB32_MIWT4_2_PLR1_SU0_SUM0_SUS128_VWA4_VWB2_WGM1_WGMXCC1_WGMXCCGn1
    SolutionIndex: 94
    SolutionNameMin: Cijk_Ailk_Bjlk_B8F8NSS_BH_Bias_HAS_SAV_UserArgs_MT128x64x128_MI16x16x1_SN_LDSB1_CLR1_GRVWA16_GRVWB16_GSU0_GSUC0_GSUWGMRR0_K1_LBSPPA1024_LBSPPB512_LPA64_LPB32_MIWT4_2_PLR1_SU0_SUM0_SUS128_VWA4_VWB2_WGM4_WGMXCC1_WGMXCCGn1
    SolutionIndex: 95
    SolutionNameMin: Cijk_Ailk_Bjlk_B8F8NSS_BH_Bias_HAS_SAV_UserArgs_MT128x64x128_MI16x16x1_SN_LDSB1_CLR1_GRVWA16_GRVWB16_GSU0_GSUC0_GSUWGMRR0_K1_LBSPPA1024_LBSPPB512_LPA64_LPB32_MIWT4_2_PLR1_SU0_SUM0_SUS128_VWA4_VWB2_WGM6_WGMXCC1_WGMXCCGn1
    SolutionIndex: 96
    SolutionNameMin: Cijk_Ailk_Bjlk_B8F8NSS_BH_Bias_HAS_SAV_UserArgs_MT128x64x128_MI16x16x1_SN_LDSB1_CLR1_GRVWA16_GRVWB16_GSU0_GSUC0_GSUWGMRR0_K1_LBSPPA1024_LBSPPB512_LPA64_LPB32_MIWT4_2_PLR1_SU0_SUM0_SUS128_VWA4_VWB2_WGM8_WGMXCC1_WGMXCCGn1
    SolutionIndex: 97
    SolutionNameMin: Cijk_Ailk_Bjlk_B8F8NSS_BH_Bias_HAS_SAV_UserArgs_MT64x64x128_MI16x16x1_SN_LDSB1_CLR1_GRVWA16_GRVWB8_GSU0_GSUC0_GSUWGMRR0_K1_LBSPPA512_LBSPPB512_LPA32_LPB32_MIWT2_2_PLR1_SU0_SUM0_SUS128_VWA2_VWB2_WGM1_WGMXCC1_WGMXCCGn1
    SolutionIndex: 98
    SolutionNameMin: Cijk_Ailk_Bjlk_B8F8NSS_BH_Bias_HAS_SAV_UserArgs_MT64x64x128_MI16x16x1_SN_LDSB1_CLR1_GRVWA8_GRVWB16_GSU0_GSUC0_GSUWGMRR0_K1_LBSPPA512_LBSPPB512_LPA32_LPB32_MIWT2_2_PLR1_SU0_SUM0_SUS128_VWA2_VWB2_WGM1_WGMXCC1_WGMXCCGn1
    SolutionIndex: 99
    SolutionNameMin: Cijk_Ailk_Bjlk_B8F8NSS_BH_Bias_HAS_SAV_UserArgs_MT64x64x128_MI16x16x1_SN_LDSB1_CLR1_GRVWA16_GRVWB16_GSU0_GSUC0_GSUWGMRR0_K1_LBSPPA512_LBSPPB512_LPA32_LPB32_MIWT2_2_PLR1_SU0_SUM0_SUS128_VWA2_VWB2_WGM1_WGMXCC1_WGMXCCGn1
    SolutionIndex: 100
    SolutionNameMin: Cijk_Ailk_Bjlk_B8F8NSS_BH_Bias_HAS_SAV_UserArgs_MT64x64x128_MI16x16x1_SN_LDSB1_CLR1_GRVWA8_GRVWB16_GSU0_GSUC0_GSUWGMRR0_K1_LBSPPA512_LBSPPB512_LPA32_LPB32_MIWT2_2_PLR1_SU0_SUM0_SUS128_VWA2_VWB2_WGM4_WGMXCC1_WGMXCCGn1
    SolutionIndex: 101
    SolutionNameMin: Cijk_Ailk_Bjlk_B8F8NSS_BH_Bias_HAS_SAV_UserArgs_MT64x64x128_MI16x16x1_SN_LDSB1_CLR1_GRVWA16_GRVWB16_GSU0_GSUC0_GSUWGMRR0_K1_LBSPPA512_LBSPPB512_LPA32_LPB32_MIWT2_2_PLR1_SU0_SUM0_SUS128_VWA2_VWB2_WGM4_WGMXCC1_WGMXCCGn1
    SolutionIndex: 102
    SolutionNameMin: Cijk_Ailk_Bjlk_B8F8NSS_BH_Bias_HAS_SAV_UserArgs_MT64x64x128_MI16x16x1_SN_LDSB1_CLR1_GRVWA4_GRVWB8_GSU0_GSUC0_GSUWGMRR0_K1_LBSPPA512_LBSPPB512_LPA32_LPB32_MIWT2_2_PLR1_SU0_SUM0_SUS128_VWA2_VWB2_WGM6_WGMXCC1_WGMXCCGn1
    SolutionIndex: 103
    SolutionNameMin: Cijk_Ailk_Bjlk_B8F8NSS_BH_Bias_HAS_SAV_UserArgs_MT64x64x128_MI16x16x1_SN_LDSB1_CLR1_GRVWA4_GRVWB16_GSU0_GSUC0_GSUWGMRR0_K1_LBSPPA512_LBSPPB512_LPA32_LPB32_MIWT2_2_PLR1_SU0_SUM0_SUS128_VWA2_VWB2_WGM6_WGMXCC1_WGMXCCGn1
    SolutionIndex: 104
    SolutionNameMin: Cijk_Ailk_Bjlk_B8F8NSS_BH_Bias_HAS_SAV_UserArgs_MT64x64x128_MI16x16x1_SN_LDSB1_CLR1_GRVWA8_GRVWB16_GSU0_GSUC0_GSUWGMRR0_K1_LBSPPA512_LBSPPB512_LPA32_LPB32_MIWT2_2_PLR1_SU0_SUM0_SUS128_VWA2_VWB2_WGM6_WGMXCC1_WGMXCCGn1
    SolutionIndex: 105
    SolutionNameMin: Cijk_Ailk_Bjlk_B8F8NSS_BH_Bias_HAS_SAV_UserArgs_MT64x64x128_MI16x16x1_SN_LDSB1_CLR1_GRVWA16_GRVWB16_GSU0_GSUC0_GSUWGMRR0_K1_LBSPPA512_LBSPPB512_LPA32_LPB32_MIWT2_2_PLR1_SU0_SUM0_SUS128_VWA2_VWB2_WGM6_WGMXCC1_WGMXCCGn1
    SolutionIndex: 106
    SolutionNameMin: Cijk_Ailk_Bjlk_B8F8NSS_BH_Bias_HAS_SAV_UserArgs_MT64x64x128_MI16x16x1_SN_LDSB1_CLR1_GRVWA4_GRVWB16_GSU0_GSUC0_GSUWGMRR0_K1_LBSPPA512_LBSPPB512_LPA32_LPB32_MIWT2_2_PLR1_SU0_SUM0_SUS128_VWA2_VWB2_WGM8_WGMXCC1_WGMXCCGn1
    SolutionIndex: 107
    SolutionNameMin: Cijk_Ailk_Bjlk_B8F8NSS_BH_Bias_HAS_SAV_UserArgs_MT64x64x128_MI16x16x1_SN_LDSB1_CLR1_GRVWA16_GRVWB16_GSU0_GSUC0_GSUWGMRR0_K1_LBSPPA512_LBSPPB512_LPA32_LPB32_MIWT2_2_PLR1_SU0_SUM0_SUS128_VWA2_VWB2_WGM8_WGMXCC1_WGMXCCGn1
    SolutionIndex: 108
    SolutionNameMin: Cijk_Ailk_Bjlk_B8F8NSS_BH_Bias_HAS_SAV_UserArgs_MT32x64x128_MI16x16x1_SN_LDSB0_CLR1_GRVWA4_GRVWB16_GSU0_GSUC0_GSUWGMRR0_K1_LBSPPA256_LBSPPB512_LPA16_LPB32_MIWT1_2_PLR1_SU0_SUM0_SUS128_VWA1_VWB2_WGM1_WGMXCC1_WGMXCCGn1
    SolutionIndex: 109
    SolutionNameMin: Cijk_Ailk_Bjlk_B8F8NSS_BH_Bias_HAS_SAV_UserArgs_MT32x64x128_MI16x16x1_SN_LDSB0_CLR1_GRVWA8_GRVWB16_GSU0_GSUC0_GSUWGMRR0_K1_LBSPPA256_LBSPPB512_LPA16_LPB32_MIWT1_2_PLR1_SU0_SUM0_SUS128_VWA1_VWB2_WGM1_WGMXCC1_WGMXCCGn1
    SolutionIndex: 110
    SolutionNameMin: Cijk_Ailk_Bjlk_B8F8NSS_BH_Bias_HAS_SAV_UserArgs_MT32x64x128_MI16x16x1_SN_LDSB0_CLR1_GRVWA16_GRVWB16_GSU0_GSUC0_GSUWGMRR0_K1_LBSPPA256_LBSPPB512_LPA16_LPB32_MIWT1_2_PLR1_SU0_SUM0_SUS128_VWA1_VWB2_WGM1_WGMXCC1_WGMXCCGn1
    SolutionIndex: 111
    SolutionNameMin: Cijk_Ailk_Bjlk_B8F8NSS_BH_Bias_HAS_SAV_UserArgs_MT32x64x128_MI16x16x1_SN_LDSB0_CLR1_GRVWA8_GRVWB16_GSU0_GSUC0_GSUWGMRR0_K1_LBSPPA256_LBSPPB512_LPA16_LPB32_MIWT1_2_PLR1_SU0_SUM0_SUS128_VWA1_VWB2_WGM4_WGMXCC1_WGMXCCGn1
    SolutionIndex: 112
    SolutionNameMin: Cijk_Ailk_Bjlk_B8F8NSS_BH_Bias_HAS_SAV_UserArgs_MT32x64x128_MI16x16x1_SN_LDSB0_CLR1_GRVWA16_GRVWB16_GSU0_GSUC0_GSUWGMRR0_K1_LBSPPA256_LBSPPB512_LPA16_LPB32_MIWT1_2_PLR1_SU0_SUM0_SUS128_VWA1_VWB2_WGM4_WGMXCC1_WGMXCCGn1
    SolutionIndex: 113
    SolutionNameMin: Cijk_Ailk_Bjlk_B8F8NSS_BH_Bias_HAS_SAV_UserArgs_MT64x32x128_MI16x16x1_SN_LDSB0_CLR1_GRVWA8_GRVWB8_GSU0_GSUC0_GSUWGMRR0_K1_LBSPPA512_LBSPPB256_LPA32_LPB16_MIWT2_1_PLR1_SU0_SUM0_SUS128_VWA2_VWB1_WGM1_WGMXCC1_WGMXCCGn1
    SolutionIndex: 114
    SolutionNameMin: Cijk_Ailk_Bjlk_B8F8NSS_BH_Bias_HAS_SAV_UserArgs_MT64x32x128_MI16x16x1_SN_LDSB0_CLR1_GRVWA4_GRVWB16_GSU0_GSUC0_GSUWGMRR0_K1_LBSPPA512_LBSPPB256_LPA32_LPB16_MIWT2_1_PLR1_SU0_SUM0_SUS128_VWA2_VWB1_WGM1_WGMXCC1_WGMXCCGn1
    SolutionIndex: 115
    SolutionNameMin: Cijk_Ailk_Bjlk_B8F8NSS_BH_Bias_HAS_SAV_UserArgs_MT64x32x128_MI16x16x1_SN_LDSB0_CLR1_GRVWA8_GRVWB16_GSU0_GSUC0_GSUWGMRR0_K1_LBSPPA512_LBSPPB256_LPA32_LPB16_MIWT2_1_PLR1_SU0_SUM0_SUS128_VWA2_VWB1_WGM1_WGMXCC1_WGMXCCGn1
    SolutionIndex: 116
    SolutionNameMin: Cijk_Ailk_Bjlk_B8F8NSS_BH_Bias_HAS_SAV_UserArgs_MT64x32x128_MI16x16x1_SN_LDSB0_CLR1_GRVWA16_GRVWB16_GSU0_GSUC0_GSUWGMRR0_K1_LBSPPA512_LBSPPB256_LPA32_LPB16_MIWT2_1_PLR1_SU0_SUM0_SUS128_VWA2_VWB1_WGM1_WGMXCC1_WGMXCCGn1
    SolutionIndex: 117
    SolutionNameMin: Cijk_Ailk_Bjlk_B8F8NSS_BH_Bias_HAS_SAV_UserArgs_MT64x32x128_MI16x16x1_SN_LDSB0_CLR1_GRVWA4_GRVWB8_GSU0_GSUC0_GSUWGMRR0_K1_LBSPPA512_LBSPPB256_LPA32_LPB16_MIWT2_1_PLR1_SU0_SUM0_SUS128_VWA2_VWB1_WGM4_WGMXCC1_WGMXCCGn1
    SolutionIndex: 118
    SolutionNameMin: Cijk_Ailk_Bjlk_B8F8NSS_BH_Bias_HAS_SAV_UserArgs_MT32x32x128_MI16x16x1_SN_LDSB0_CLR1_GRVWA4_GRVWB4_GSU0_GSUC0_GSUWGMRR0_K1_LBSPPA256_LBSPPB256_LPA16_LPB16_MIWT1_1_PLR1_SU0_SUM0_SUS128_VWA1_VWB1_WGM1_WGMXCC1_WGMXCCGn1
    SolutionIndex: 119
    SolutionNameMin: Cijk_Ailk_Bjlk_B8F8NSS_BH_Bias_HAS_SAV_UserArgs_MT32x32x128_MI16x16x1_SN_LDSB0_CLR1_GRVWA8_GRVWB4_GSU0_GSUC0_GSUWGMRR0_K1_LBSPPA256_LBSPPB256_LPA16_LPB16_MIWT1_1_PLR1_SU0_SUM0_SUS128_VWA1_VWB1_WGM1_WGMXCC1_WGMXCCGn1
    SolutionIndex: 120
    SolutionNameMin: Cijk_Ailk_Bjlk_B8F8NSS_BH_Bias_HAS_SAV_UserArgs_MT32x32x128_MI16x16x1_SN_LDSB0_CLR1_GRVWA4_GRVWB8_GSU0_GSUC0_GSUWGMRR0_K1_LBSPPA256_LBSPPB256_LPA16_LPB16_MIWT1_1_PLR1_SU0_SUM0_SUS128_VWA1_VWB1_WGM1_WGMXCC1_WGMXCCGn1
    SolutionIndex: 121
    SolutionNameMin: Cijk_Ailk_Bjlk_B8F8NSS_BH_Bias_HAS_SAV_UserArgs_MT32x32x128_MI16x16x1_SN_LDSB0_CLR1_GRVWA8_GRVWB8_GSU0_GSUC0_GSUWGMRR0_K1_LBSPPA256_LBSPPB256_LPA16_LPB16_MIWT1_1_PLR1_SU0_SUM0_SUS128_VWA1_VWB1_WGM1_WGMXCC1_WGMXCCGn1
    SolutionIndex: 122
    SolutionNameMin: Cijk_Ailk_Bjlk_B8F8NSS_BH_Bias_HAS_SAV_UserArgs_MT32x32x128_MI16x16x1_SN_LDSB0_CLR1_GRVWA4_GRVWB16_GSU0_GSUC0_GSUWGMRR0_K1_LBSPPA256_LBSPPB256_LPA16_LPB16_MIWT1_1_PLR1_SU0_SUM0_SUS128_VWA1_VWB1_WGM1_WGMXCC1_WGMXCCGn1
    SolutionIndex: 123
    SolutionNameMin: Cijk_Ailk_Bjlk_B8F8NSS_BH_Bias_HAS_SAV_UserArgs_MT32x32x128_MI16x16x1_SN_LDSB0_CLR1_GRVWA8_GRVWB16_GSU0_GSUC0_GSUWGMRR0_K1_LBSPPA256_LBSPPB256_LPA16_LPB16_MIWT1_1_PLR1_SU0_SUM0_SUS128_VWA1_VWB1_WGM1_WGMXCC1_WGMXCCGn1
    SolutionIndex: 124
    SolutionNameMin: Cijk_Ailk_Bjlk_B8F8NSS_BH_Bias_HAS_SAV_UserArgs_MT32x32x128_MI16x16x1_SN_LDSB0_CLR1_GRVWA16_GRVWB16_GSU0_GSUC0_GSUWGMRR0_K1_LBSPPA256_LBSPPB256_LPA16_LPB16_MIWT1_1_PLR1_SU0_SUM0_SUS128_VWA1_VWB1_WGM1_WGMXCC1_WGMXCCGn1
    SolutionIndex: 125
    SolutionNameMin: Cijk_Ailk_Bjlk_B8F8NSS_BH_Bias_HAS_SAV_UserArgs_MT32x32x128_MI16x16x1_SN_LDSB0_CLR1_GRVWA16_GRVWB16_GSU0_GSUC0_GSUWGMRR0_K1_LBSPPA256_LBSPPB256_LPA16_LPB16_MIWT1_1_PLR1_SU0_SUM0_SUS128_VWA1_VWB1_WGM4_WGMXCC1_WGMXCCGn1
    SolutionIndex: 126
    SolutionNameMin: Cijk_Ailk_Bjlk_B8F8NSS_BH_Bias_HAS_SAV_UserArgs_MT128x64x256_MI16x16x1_SN_LDSB1_CLR1_GRVWA16_GRVWB16_GSU0_GSUC0_GSUWGMRR0_K1_LBSPPA1024_LBSPPB512_LPA64_LPB32_MIWT4_2_PLR1_SU0_SUM0_SUS256_VWA4_VWB2_WGM1_WGMXCC1_WGMXCCGn1
    SolutionIndex: 127
    SolutionNameMin: Cijk_Ailk_Bjlk_B8F8NSS_BH_Bias_HAS_SAV_UserArgs_MT128x64x256_MI16x16x1_SN_LDSB1_CLR1_GRVWA16_GRVWB16_GSU0_GSUC0_GSUWGMRR0_K1_LBSPPA1024_LBSPPB512_LPA64_LPB32_MIWT4_2_PLR1_SU0_SUM0_SUS256_VWA4_VWB2_WGM4_WGMXCC1_WGMXCCGn1
    SolutionIndex: 128
    SolutionNameMin: Cijk_Ailk_Bjlk_B8F8NSS_BH_Bias_HAS_SAV_UserArgs_MT128x32x256_MI16x16x1_SN_LDSB1_CLR1_GRVWA16_GRVWB8_GSU0_GSUC0_GSUWGMRR0_K1_LBSPPA1024_LBSPPB256_LPA64_LPB16_MIWT4_1_PLR1_SU0_SUM0_SUS256_VWA4_VWB1_WGM6_WGMXCC1_WGMXCCGn1
    SolutionIndex: 129
    SolutionNameMin: Cijk_Ailk_Bjlk_B8F8NSS_BH_Bias_HAS_SAV_UserArgs_MT64x64x256_MI16x16x1_SN_LDSB1_CLR1_GRVWA16_GRVWB16_GSU0_GSUC0_GSUWGMRR0_K1_LBSPPA512_LBSPPB512_LPA32_LPB32_MIWT2_2_PLR1_SU0_SUM0_SUS256_VWA2_VWB2_WGM1_WGMXCC1_WGMXCCGn1
    SolutionIndex: 130
    SolutionNameMin: Cijk_Ailk_Bjlk_B8F8NSS_BH_Bias_HAS_SAV_UserArgs_MT64x64x256_MI16x16x1_SN_LDSB1_CLR1_GRVWA16_GRVWB16_GSU0_GSUC0_GSUWGMRR0_K1_LBSPPA512_LBSPPB512_LPA32_LPB32_MIWT2_2_PLR1_SU0_SUM0_SUS256_VWA2_VWB2_WGM8_WGMXCC1_WGMXCCGn1
    SolutionIndex: 131
    SolutionNameMin: Cijk_Ailk_Bjlk_B8F8NSS_BH_Bias_HAS_SAV_UserArgs_MT64x32x256_MI16x16x1_SN_LDSB1_CLR1_GRVWA16_GRVWB16_GSU0_GSUC0_GSUWGMRR0_K1_LBSPPA512_LBSPPB256_LPA32_LPB16_MIWT2_1_PLR1_SU0_SUM0_SUS256_VWA2_VWB1_WGM1_WGMXCC1_WGMXCCGn1
    SolutionIndex: 132
    SolutionNameMin: Cijk_Ailk_Bjlk_B8F8NSS_BH_Bias_HAS_SAV_UserArgs_MT64x32x256_MI16x16x1_SN_LDSB1_CLR1_GRVWA16_GRVWB16_GSU0_GSUC0_GSUWGMRR0_K1_LBSPPA512_LBSPPB256_LPA32_LPB16_MIWT2_1_PLR1_SU0_SUM0_SUS256_VWA2_VWB1_WGM6_WGMXCC1_WGMXCCGn1
    SolutionIndex: 133
    SolutionNameMin: Cijk_Ailk_Bjlk_B8F8NSS_BH_Bias_HAS_SAV_UserArgs_MT32x32x256_MI16x16x1_SN_LDSB1_CLR1_GRVWA8_GRVWB16_GSU0_GSUC0_GSUWGMRR0_K1_LBSPPA256_LBSPPB256_LPA16_LPB16_MIWT1_1_PLR1_SU0_SUM0_SUS256_VWA1_VWB1_WGM1_WGMXCC1_WGMXCCGn1
    SolutionIndex: 134
    SolutionNameMin: Cijk_Ailk_Bjlk_B8F8NSS_BH_Bias_HAS_SAV_UserArgs_MT32x32x256_MI16x16x1_SN_LDSB1_CLR1_GRVWA16_GRVWB16_GSU0_GSUC0_GSUWGMRR0_K1_LBSPPA256_LBSPPB256_LPA16_LPB16_MIWT1_1_PLR1_SU0_SUM0_SUS256_VWA1_VWB1_WGM1_WGMXCC1_WGMXCCGn1
    SolutionIndex: 135
    SolutionNameMin: Cijk_Ailk_Bjlk_B8F8NSS_BH_Bias_HAS_SAV_UserArgs_MT32x32x256_MI16x16x1_SN_LDSB1_CLR1_GRVWA16_GRVWB16_GSU0_GSUC0_GSUWGMRR0_K1_LBSPPA256_LBSPPB256_LPA16_LPB16_MIWT1_1_PLR1_SU0_SUM0_SUS256_VWA1_VWB1_WGM4_WGMXCC1_WGMXCCGn1
    SolutionIndex: 136
    SolutionNameMin: Cijk_Ailk_Bjlk_B8F8NSS_BH_Bias_HAS_SAV_UserArgs_MT32x32x256_MI16x16x1_SN_LDSB1_CLR1_GRVWA8_GRVWB16_GSU0_GSUC0_GSUWGMRR0_K1_LBSPPA256_LBSPPB256_LPA16_LPB16_MIWT1_1_PLR1_SU0_SUM0_SUS256_VWA1_VWB1_WGM6_WGMXCC1_WGMXCCGn1
    SolutionIndex: 137
    SolutionNameMin: Cijk_Ailk_Bjlk_B8F8NSS_BH_Bias_HAS_SAV_UserArgs_MT32x32x256_MI16x16x1_SN_LDSB1_CLR1_GRVWA16_GRVWB16_GSU0_GSUC0_GSUWGMRR0_K1_LBSPPA256_LBSPPB256_LPA16_LPB16_MIWT1_1_PLR1_SU0_SUM0_SUS256_VWA1_VWB1_WGM6_WGMXCC1_WGMXCCGn1
- - - [128, 128, 1, 128, 128, 128, 128, 128]
    - [118, 0.51]
  - - [128, 128, 1, 256, 128, 128, 128, 128]
    - [72, 0.9]
  - - [128, 128, 1, 512, 128, 128, 128, 128]
    - [121, 1.47]
  - - [128, 128, 1, 1024, 128, 128, 128, 128]
    - [122, 2.2]
  - - [128, 128, 1, 2048, 128, 128, 128, 128]
    - [123, 2.92]
  - - [128, 128, 1, 4096, 128, 128, 128, 128]
    - [123, 3.52]
  - - [128, 128, 1, 8192, 128, 128, 128, 128]
    - [134, 3.93]
  - - [128, 256, 1, 128, 128, 128, 128, 256]
    - [118, 1.0]
  - - [128, 256, 1, 256, 128, 128, 128, 256]
    - [75, 1.83]
  - - [128, 256, 1, 512, 128, 128, 128, 256]
    - [120, 3.0]
  - - [128, 256, 1, 1024, 128, 128, 128, 256]
    - [121, 4.45]
  - - [128, 256, 1, 2048, 128, 128, 128, 256]
    - [123, 5.93]
  - - [128, 256, 1, 4096, 128, 128, 128, 256]
    - [123, 7.06]
  - - [128, 256, 1, 8192, 128, 128, 128, 256]
    - [134, 7.89]
  - - [128, 512, 1, 128, 128, 128, 128, 512]
    - [73, 1.97]
  - - [128, 512, 1, 256, 128, 128, 128, 512]
    - [72, 3.62]
  - - [128, 512, 1, 512, 128, 128, 128, 512]
    - [118, 5.94]
  - - [128, 512, 1, 1024, 128, 128, 128, 512]
    - [118, 8.74]
  - - [128, 512, 1, 2048, 128, 128, 128, 512]
    - [124, 11.65]
  - - [128, 512, 1, 4096, 128, 128, 128, 512]
    - [123, 14.0]
  - - [128, 512, 1, 8192, 128, 128, 128, 512]
    - [134, 15.28]
  - - [128, 1024, 1, 128, 128, 128, 128, 1024]
    - [72, 3.97]
  - - [128, 1024, 1, 256, 128, 128, 128, 1024]
    - [72, 6.91]
  - - [128, 1024, 1, 512, 128, 128, 128, 1024]
    - [119, 11.2]
  - - [128, 1024, 1, 1024, 128, 128, 128, 1024]
    - [120, 16.83]
  - - [128, 1024, 1, 2048, 128, 128, 128, 1024]
    - [123, 22.64]
  - - [128, 1024, 1, 4096, 128, 128, 128, 1024]
    - [134, 25.89]
  - - [128, 1024, 1, 8192, 128, 128, 128, 1024]
    - [136, 27.5]
  - - [128, 2048, 1, 128, 128, 128, 128, 2048]
    - [70, 7.34]
  - - [128, 2048, 1, 256, 128, 128, 128, 2048]
    - [70, 12.68]
  - - [128, 2048, 1, 512, 128, 128, 128, 2048]
    - [113, 20.52]
  - - [128, 2048, 1, 1024, 128, 128, 128, 2048]
    - [116, 30.16]
  - - [128, 2048, 1, 2048, 128, 128, 128, 2048]
    - [131, 38.49]
  - - [128, 2048, 1, 4096, 128, 128, 128, 2048]
    - [132, 46.92]
  - - [128, 2048, 1, 8192, 128, 128, 128, 2048]
    - [131, 52.77]
  - - [128, 4096, 1, 128, 128, 128, 128, 4096]
    - [59, 12.56]
  - - [128, 4096, 1, 256, 128, 128, 128, 4096]
    - [62, 21.78]
  - - [128, 4096, 1, 512, 128, 128, 128, 4096]
    - [64, 34.71]
  - - [128, 4096, 1, 1024, 128, 128, 128, 4096]
    - [98, 50.68]
  - - [128, 4096, 1, 2048, 128, 128, 128, 4096]
    - [98, 64.73]
  - - [128, 4096, 1, 4096, 128, 128, 128, 4096]
    - [130, 79.77]
  - - [128, 4096, 1, 8192, 128, 128, 128, 4096]
    - [129, 90.13]
  - - [128, 8192, 1, 128, 128, 128, 128, 8192]
    - [52, 20.18]
  - - [128, 8192, 1, 256, 128, 128, 128, 8192]
    - [51, 35.46]
  - - [128, 8192, 1, 512, 128, 128, 128, 8192]
    - [92, 56.15]
  - - [128, 8192, 1, 1024, 128, 128, 128, 8192]
    - [93, 81.2]
  - - [128, 8192, 1, 2048, 128, 128, 128, 8192]
    - [93, 102.31]
  - - [128, 8192, 1, 4096, 128, 128, 128, 8192]
    - [126, 121.55]
  - - [128, 8192, 1, 8192, 128, 128, 128, 8192]
    - [126, 125.22]
  - - [256, 128, 1, 128, 256, 256, 256, 128]
    - [118, 1.03]
  - - [256, 128, 1, 256, 256, 256, 256, 128]
    - [72, 1.83]
  - - [256, 128, 1, 512, 256, 256, 256, 128]
    - [120, 2.99]
  - - [256, 128, 1, 1024, 256, 256, 256, 128]
    - [120, 4.45]
  - - [256, 128, 1, 2048, 256, 256, 256, 128]
    - [123, 5.93]
  - - [256, 128, 1, 4096, 256, 256, 256, 128]
    - [134, 7.08]
  - - [256, 128, 1, 8192, 256, 256, 256, 128]
    - [134, 7.88]
  - - [256, 256, 1, 128, 256, 256, 256, 256]
    - [72, 2.05]
  - - [256, 256, 1, 256, 256, 256, 256, 256]
    - [118, 3.63]
  - - [256, 256, 1, 512, 256, 256, 256, 256]
    - [121, 5.85]
  - - [256, 256, 1, 1024, 256, 256, 256, 256]
    - [121, 8.88]
  - - [256, 256, 1, 2048, 256, 256, 256, 256]
    - [123, 11.73]
  - - [256, 256, 1, 4096, 256, 256, 256, 256]
    - [123, 14.01]
  - - [256, 256, 1, 8192, 256, 256, 256, 256]
    - [135, 15.4]
  - - [256, 512, 1, 128, 256, 256, 256, 512]
    - [72, 3.94]
  - - [256, 512, 1, 256, 256, 256, 256, 512]
    - [72, 6.82]
  - - [256, 512, 1, 512, 256, 256, 256, 512]
    - [121, 11.14]
  - - [256, 512, 1, 1024, 256, 256, 256, 512]
    - [121, 16.77]
  - - [256, 512, 1, 2048, 256, 256, 256, 512]
    - [123, 22.45]
  - - [256, 512, 1, 4096, 256, 256, 256, 512]
    - [123, 27.12]
  - - [256, 512, 1, 8192, 256, 256, 256, 512]
    - [133, 28.89]
  - - [256, 1024, 1, 128, 256, 256, 256, 1024]
    - [66, 7.05]
  - - [256, 1024, 1, 256, 256, 256, 256, 1024]
    - [66, 12.47]
  - - [256, 1024, 1, 512, 256, 256, 256, 1024]
    - [109, 20.18]
  - - [256, 1024, 1, 1024, 256, 256, 256, 1024]
    - [109, 30.21]
  - - [256, 1024, 1, 2048, 256, 256, 256, 1024]
    - [131, 40.15]
  - - [256, 1024, 1, 4096, 256, 256, 256, 1024]
    - [131, 48.12]
  - - [256, 1024, 1, 8192, 256, 256, 256, 1024]
    - [132, 53.39]
  - - [256, 2048, 1, 128, 256, 256, 256, 2048]
    - [63, 12.46]
  - - [256, 2048, 1, 256, 256, 256, 256, 2048]
    - [62, 21.82]
  - - [256, 2048, 1, 512, 256, 256, 256, 2048]
    - [97, 35.0]
  - - [256, 2048, 1, 1024, 256, 256, 256, 2048]
    - [99, 51.51]
  - - [256, 2048, 1, 2048, 256, 256, 256, 2048]
    - [97, 65.51]
  - - [256, 2048, 1, 4096, 256, 256, 256, 2048]
    - [99, 77.79]
  - - [256, 2048, 1, 8192, 256, 256, 256, 2048]
    - [129, 86.16]
  - - [256, 4096, 1, 128, 256, 256, 256, 4096]
    - [56, 20.14]
  - - [256, 4096, 1, 256, 256, 256, 256, 4096]
    - [57, 34.89]
  - - [256, 4096, 1, 512, 256, 256, 256, 4096]
    - [48, 56.03]
  - - [256, 4096, 1, 1024, 256, 256, 256, 4096]
    - [50, 80.69]
  - - [256, 4096, 1, 2048, 256, 256, 256, 4096]
    - [95, 102.03]
  - - [256, 4096, 1, 4096, 256, 256, 256, 4096]
    - [127, 120.45]
  - - [256, 4096, 1, 8192, 256, 256, 256, 4096]
    - [126, 128.1]
  - - [256, 8192, 1, 128, 256, 256, 256, 8192]
    - [33, 29.69]
  - - [256, 8192, 1, 256, 256, 256, 256, 8192]
    - [34, 51.78]
  - - [256, 8192, 1, 512, 256, 256, 256, 8192]
    - [38, 82.69]
  - - [256, 8192, 1, 1024, 256, 256, 256, 8192]
    - [37, 115.99]
  - - [256, 8192, 1, 2048, 256, 256, 256, 8192]
    - [38, 147.4]
  - - [256, 8192, 1, 4096, 256, 256, 256, 8192]
    - [90, 165.31]
  - - [256, 8192, 1, 8192, 256, 256, 256, 8192]
    - [90, 158.44]
  - - [512, 128, 1, 128, 512, 512, 512, 128]
    - [74, 2.04]
  - - [512, 128, 1, 256, 512, 512, 512, 128]
    - [118, 3.58]
  - - [512, 128, 1, 512, 512, 512, 512, 128]
    - [121, 5.8]
  - - [512, 128, 1, 1024, 512, 512, 512, 128]
    - [122, 8.78]
  - - [512, 128, 1, 2048, 512, 512, 512, 128]
    - [123, 11.67]
  - - [512, 128, 1, 4096, 512, 512, 512, 128]
    - [123, 14.0]
  - - [512, 128, 1, 8192, 512, 512, 512, 128]
    - [137, 14.51]
  - - [512, 256, 1, 128, 512, 512, 512, 256]
    - [72, 3.97]
  - - [512, 256, 1, 256, 512, 512, 512, 256]
    - [73, 6.92]
  - - [512, 256, 1, 512, 512, 512, 512, 256]
    - [121, 11.37]
  - - [512, 256, 1, 1024, 512, 512, 512, 256]
    - [120, 17.06]
  - - [512, 256, 1, 2048, 512, 512, 512, 256]
    - [123, 22.84]
  - - [512, 256, 1, 4096, 512, 512, 512, 256]
    - [123, 27.35]
  - - [512, 256, 1, 8192, 512, 512, 512, 256]
    - [125, 27.65]
  - - [512, 512, 1, 128, 512, 512, 512, 512]
    - [70, 7.16]
  - - [512, 512, 1, 256, 512, 512, 512, 512]
    - [71, 12.47]
  - - [512, 512, 1, 512, 512, 512, 512, 512]
    - [113, 20.08]
  - - [512, 512, 1, 1024, 512, 512, 512, 512]
    - [115, 30.16]
  - - [512, 512, 1, 2048, 512, 512, 512, 512]
    - [131, 39.84]
  - - [512, 512, 1, 4096, 512, 512, 512, 512]
    - [110, 45.94]
  - - [512, 512, 1, 8192, 512, 512, 512, 512]
    - [116, 49.82]
  - - [512, 1024, 1, 128, 512, 512, 512, 1024]
    - [59, 12.53]
  - - [512, 1024, 1, 256, 512, 512, 512, 1024]
    - [62, 21.79]
  - - [512, 1024, 1, 512, 512, 512, 512, 1024]
    - [64, 34.86]
  - - [512, 1024, 1, 1024, 512, 512, 512, 1024]
    - [98, 51.05]
  - - [512, 1024, 1, 2048, 512, 512, 512, 1024]
    - [129, 67.02]
  - - [512, 1024, 1, 4096, 512, 512, 512, 1024]
    - [105, 74.71]
  - - [512, 1024, 1, 8192, 512, 512, 512, 1024]
    - [103, 79.79]
  - - [512, 2048, 1, 128, 512, 512, 512, 2048]
    - [51, 20.1]
  - - [512, 2048, 1, 256, 512, 512, 512, 2048]
    - [51, 35.31]
  - - [512, 2048, 1, 512, 512, 512, 512, 2048]
    - [50, 55.75]
  - - [512, 2048, 1, 1024, 512, 512, 512, 2048]
    - [93, 80.7]
  - - [512, 2048, 1, 2048, 512, 512, 512, 2048]
    - [93, 102.05]
  - - [512, 2048, 1, 4096, 512, 512, 512, 2048]
    - [93, 120.74]
  - - [512, 2048, 1, 8192, 512, 512, 512, 2048]
    - [93, 126.08]
  - - [512, 4096, 1, 128, 512, 512, 512, 4096]
    - [43, 29.87]
  - - [512, 4096, 1, 256, 512, 512, 512, 4096]
    - [45, 52.04]
  - - [512, 4096, 1, 512, 512, 512, 512, 4096]
    - [47, 81.81]
  - - [512, 4096, 1, 1024, 512, 512, 512, 4096]
    - [38, 116.29]
  - - [512, 4096, 1, 2048, 512, 512, 512, 4096]
    - [38, 148.44]
  - - [512, 4096, 1, 4096, 512, 512, 512, 4096]
    - [38, 169.49]
  - - [512, 4096, 1, 8192, 512, 512, 512, 4096]
    - [37, 159.56]
  - - [512, 8192, 1, 128, 512, 512, 512, 8192]
    - [16, 38.58]
  - - [512, 8192, 1, 256, 512, 512, 512, 8192]
    - [16, 67.16]
  - - [512, 8192, 1, 512, 512, 512, 512, 8192]
    - [16, 107.48]
  - - [512, 8192, 1, 1024, 512, 512, 512, 8192]
    - [12, 153.21]
  - - [512, 8192, 1, 2048, 512, 512, 512, 8192]
    - [15, 195.43]
  - - [512, 8192, 1, 4096, 512, 512, 512, 8192]
    - [11, 206.91]
  - - [512, 8192, 1, 8192, 512, 512, 512, 8192]
    - [82, 206.47]
  - - [1024, 128, 1, 128, 1024, 1024, 1024, 128]
    - [73, 3.95]
  - - [1024, 128, 1, 256, 1024, 1024, 1024, 128]
    - [72, 6.98]
  - - [1024, 128, 1, 512, 1024, 1024, 1024, 128]
    - [118, 11.26]
  - - [1024, 128, 1, 1024, 1024, 1024, 1024, 128]
    - [120, 16.46]
  - - [1024, 128, 1, 2048, 1024, 1024, 1024, 128]
    - [123, 22.55]
  - - [1024, 128, 1, 4096, 1024, 1024, 1024, 128]
    - [135, 25.8]
  - - [1024, 128, 1, 8192, 1024, 1024, 1024, 128]
    - [137, 26.44]
  - - [1024, 256, 1, 128, 1024, 1024, 1024, 256]
    - [128, 5.09]
  - - [1024, 256, 1, 256, 1024, 1024, 1024, 256]
    - [69, 11.93]
  - - [1024, 256, 1, 512, 1024, 1024, 1024, 256]
    - [67, 18.22]
  - - [1024, 256, 1, 1024, 1024, 1024, 1024, 256]
    - [114, 29.21]
  - - [1024, 256, 1, 2048, 1024, 1024, 1024, 256]
    - [131, 39.4]
  - - [1024, 256, 1, 4096, 1024, 1024, 1024, 256]
    - [111, 45.55]
  - - [1024, 256, 1, 8192, 1024, 1024, 1024, 256]
    - [117, 48.75]
  - - [1024, 512, 1, 128, 1024, 1024, 1024, 512]
    - [65, 12.0]
  - - [1024, 512, 1, 256, 1024, 1024, 1024, 512]
    - [61, 18.87]
  - - [1024, 512, 1, 512, 1024, 1024, 1024, 512]
    - [102, 34.44]
  - - [1024, 512, 1, 1024, 1024, 1024, 1024, 512]
    - [98, 50.75]
  - - [1024, 512, 1, 2048, 1024, 1024, 1024, 512]
    - [99, 66.61]
  - - [1024, 512, 1, 4096, 1024, 1024, 1024, 512]
    - [106, 74.13]
  - - [1024, 512, 1, 8192, 1024, 1024, 1024, 512]
    - [103, 80.71]
  - - [1024, 1024, 1, 128, 1024, 1024, 1024, 1024]
    - [57, 20.0]
  - - [1024, 1024, 1, 256, 1024, 1024, 1024, 1024]
    - [58, 34.99]
  - - [1024, 1024, 1, 512, 1024, 1024, 1024, 1024]
    - [48, 56.05]
  - - [1024, 1024, 1, 1024, 1024, 1024, 1024, 1024]
    - [95, 80.67]
  - - [1024, 1024, 1, 2048, 1024, 1024, 1024, 1024]
    - [95, 102.18]
  - - [1024, 1024, 1, 4096, 1024, 1024, 1024, 1024]
    - [95, 119.72]
  - - [1024, 1024, 1, 8192, 1024, 1024, 1024, 1024]
    - [95, 124.14]
  - - [1024, 2048, 1, 128, 1024, 1024, 1024, 2048]
    - [36, 29.94]
  - - [1024, 2048, 1, 256, 1024, 1024, 1024, 2048]
    - [38, 51.96]
  - - [1024, 2048, 1, 512, 1024, 1024, 1024, 2048]
    - [34, 82.24]
  - - [1024, 2048, 1, 1024, 1024, 1024, 1024, 2048]
    - [37, 116.34]
  - - [1024, 2048, 1, 2048, 1024, 1024, 1024, 2048]
    - [35, 147.63]
  - - [1024, 2048, 1, 4096, 1024, 1024, 1024, 2048]
    - [35, 162.87]
  - - [1024, 2048, 1, 8192, 1024, 1024, 1024, 2048]
    - [39, 158.63]
  - - [1024, 4096, 1, 128, 1024, 1024, 1024, 4096]
    - [10, 37.63]
  - - [1024, 4096, 1, 256, 1024, 1024, 1024, 4096]
    - [13, 66.34]
  - - [1024, 4096, 1, 512, 1024, 1024, 1024, 4096]
    - [13, 106.46]
  - - [1024, 4096, 1, 1024, 1024, 1024, 1024, 4096]
    - [13, 153.94]
  - - [1024, 4096, 1, 2048, 1024, 1024, 1024, 4096]
    - [15, 195.96]
  - - [1024, 4096, 1, 4096, 1024, 1024, 1024, 4096]
    - [19, 206.05]
  - - [1024, 4096, 1, 8192, 1024, 1024, 1024, 4096]
    - [82, 205.83]
  - - [1024, 8192, 1, 128, 1024, 1024, 1024, 8192]
    - [23, 41.9]
  - - [1024, 8192, 1, 256, 1024, 1024, 1024, 8192]
    - [22, 74.86]
  - - [1024, 8192, 1, 512, 1024, 1024, 1024, 8192]
    - [24, 120.54]
  - - [1024, 8192, 1, 1024, 1024, 1024, 1024, 8192]
    - [25, 168.95]
  - - [1024, 8192, 1, 2048, 1024, 1024, 1024, 8192]
    - [1, 203.17]
  - - [1024, 8192, 1, 4096, 1024, 1024, 1024, 8192]
    - [18, 222.44]
  - - [1024, 8192, 1, 8192, 1024, 1024, 1024, 8192]
    - [7, 249.05]
  - - [2048, 128, 1, 128, 2048, 2048, 2048, 128]
    - [70, 7.13]
  - - [2048, 128, 1, 256, 2048, 2048, 2048, 128]
    - [68, 12.49]
  - - [2048, 128, 1, 512, 2048, 2048, 2048, 128]
    - [108, 20.14]
  - - [2048, 128, 1, 1024, 2048, 2048, 2048, 128]
    - [115, 30.02]
  - - [2048, 128, 1, 2048, 2048, 2048, 2048, 128]
    - [110, 37.4]
  - - [2048, 128, 1, 4096, 2048, 2048, 2048, 128]
    - [112, 44.96]
  - - [2048, 128, 1, 8192, 2048, 2048, 2048, 128]
    - [112, 50.34]
  - - [2048, 256, 1, 128, 2048, 2048, 2048, 256]
    - [62, 12.47]
  - - [2048, 256, 1, 256, 2048, 2048, 2048, 256]
    - [62, 21.81]
  - - [2048, 256, 1, 512, 2048, 2048, 2048, 256]
    - [64, 35.11]
  - - [2048, 256, 1, 1024, 2048, 2048, 2048, 256]
    - [98, 51.45]
  - - [2048, 256, 1, 2048, 2048, 2048, 2048, 256]
    - [100, 65.28]
  - - [2048, 256, 1, 4096, 2048, 2048, 2048, 256]
    - [103, 76.62]
  - - [2048, 256, 1, 8192, 2048, 2048, 2048, 256]
    - [101, 84.47]
  - - [2048, 512, 1, 128, 2048, 2048, 2048, 512]
    - [53, 19.64]
  - - [2048, 512, 1, 256, 2048, 2048, 2048, 512]
    - [53, 34.71]
  - - [2048, 512, 1, 512, 2048, 2048, 2048, 512]
    - [93, 54.62]
  - - [2048, 512, 1, 1024, 2048, 2048, 2048, 512]
    - [55, 77.98]
  - - [2048, 512, 1, 2048, 2048, 2048, 2048, 512]
    - [94, 100.91]
  - - [2048, 512, 1, 4096, 2048, 2048, 2048, 512]
    - [96, 120.29]
  - - [2048, 512, 1, 8192, 2048, 2048, 2048, 512]
    - [95, 126.04]
  - - [2048, 1024, 1, 128, 2048, 2048, 2048, 1024]
    - [33, 30.27]
  - - [2048, 1024, 1, 256, 2048, 2048, 2048, 1024]
    - [34, 52.13]
  - - [2048, 1024, 1, 512, 2048, 2048, 2048, 1024]
    - [36, 81.75]
  - - [2048, 1024, 1, 1024, 2048, 2048, 2048, 1024]
    - [46, 114.74]
  - - [2048, 1024, 1, 2048, 2048, 2048, 2048, 1024]
    - [47, 146.1]
  - - [2048, 1024, 1, 4096, 2048, 2048, 2048, 1024]
    - [47, 163.04]
  - - [2048, 1024, 1, 8192, 2048, 2048, 2048, 1024]
    - [41, 158.27]
  - - [2048, 2048, 1, 128, 2048, 2048, 2048, 2048]
    - [11, 35.27]
  - - [2048, 2048, 1, 256, 2048, 2048, 2048, 2048]
    - [11, 62.44]
  - - [2048, 2048, 1, 512, 2048, 2048, 2048, 2048]
    - [14, 100.82]
  - - [2048, 2048, 1, 1024, 2048, 2048, 2048, 2048]
    - [15, 149.01]
  - - [2048, 2048, 1, 2048, 2048, 2048, 2048, 2048]
    - [86, 193.08]
  - - [2048, 2048, 1, 4096, 2048, 2048, 2048, 2048]
    - [83, 210.69]
  - - [2048, 2048, 1, 8192, 2048, 2048, 2048, 2048]
    - [85, 207.71]
  - - [2048, 4096, 1, 128, 2048, 2048, 2048, 4096]
    - [14, 37.54]
  - - [2048, 4096, 1, 256, 2048, 2048, 2048, 4096]
    - [14, 66.89]
  - - [2048, 4096, 1, 512, 2048, 2048, 2048, 4096]
    - [14, 109.78]
  - - [2048, 4096, 1, 1024, 2048, 2048, 2048, 4096]
    - [2, 158.67]
  - - [2048, 4096, 1, 2048, 2048, 2048, 2048, 4096]
    - [9, 199.77]
  - - [2048, 4096, 1, 4096, 2048, 2048, 2048, 4096]
    - [19, 223.41]
  - - [2048, 4096, 1, 8192, 2048, 2048, 2048, 4096]
    - [7, 246.15]
  - - [2048, 8192, 1, 128, 2048, 2048, 2048, 8192]
    - [22, 46.65]
  - - [2048, 8192, 1, 256, 2048, 2048, 2048, 8192]
    - [22, 80.78]
  - - [2048, 8192, 1, 512, 2048, 2048, 2048, 8192]
    - [27, 125.14]
  - - [2048, 8192, 1, 1024, 2048, 2048, 2048, 8192]
    - [22, 163.35]
  - - [2048, 8192, 1, 2048, 2048, 2048, 2048, 8192]
    - [14, 204.58]
  - - [2048, 8192, 1, 4096, 2048, 2048, 2048, 8192]
    - [78, 249.3]
  - - [2048, 8192, 1, 8192, 2048, 2048, 2048, 8192]
    - [78, 306.49]
  - - [4096, 128, 1, 128, 4096, 4096, 4096, 128]
    - [59, 12.56]
  - - [4096, 128, 1, 256, 4096, 4096, 4096, 128]
    - [60, 21.42]
  - - [4096, 128, 1, 512, 4096, 4096, 4096, 128]
    - [98, 34.7]
  - - [4096, 128, 1, 1024, 4096, 4096, 4096, 128]
    - [101, 50.08]
  - - [4096, 128, 1, 2048, 4096, 4096, 4096, 128]
    - [104, 64.01]
  - - [4096, 128, 1, 4096, 4096, 4096, 4096, 128]
    - [107, 76.88]
  - - [4096, 128, 1, 8192, 4096, 4096, 4096, 128]
    - [105, 83.9]
  - - [4096, 256, 1, 128, 4096, 4096, 4096, 256]
    - [53, 20.18]
  - - [4096, 256, 1, 256, 4096, 4096, 4096, 256]
    - [51, 35.51]
  - - [4096, 256, 1, 512, 4096, 4096, 4096, 256]
    - [56, 55.14]
  - - [4096, 256, 1, 1024, 4096, 4096, 4096, 256]
    - [93, 78.49]
  - - [4096, 256, 1, 2048, 4096, 4096, 4096, 256]
    - [96, 102.25]
  - - [4096, 256, 1, 4096, 4096, 4096, 4096, 256]
    - [95, 121.65]
  - - [4096, 256, 1, 8192, 4096, 4096, 4096, 256]
    - [96, 127.16]
  - - [4096, 512, 1, 128, 4096, 4096, 4096, 512]
    - [40, 27.45]
  - - [4096, 512, 1, 256, 4096, 4096, 4096, 512]
    - [40, 48.39]
  - - [4096, 512, 1, 512, 4096, 4096, 4096, 512]
    - [33, 76.87]
  - - [4096, 512, 1, 1024, 4096, 4096, 4096, 512]
    - [38, 110.72]
  - - [4096, 512, 1, 2048, 4096, 4096, 4096, 512]
    - [37, 142.1]
  - - [4096, 512, 1, 4096, 4096, 4096, 4096, 512]
    - [42, 163.3]
  - - [4096, 512, 1, 8192, 4096, 4096, 4096, 512]
    - [41, 159.81]
  - - [4096, 1024, 1, 128, 4096, 4096, 4096, 1024]
    - [89, 33.9]
  - - [4096, 1024, 1, 256, 4096, 4096, 4096, 1024]
    - [83, 59.57]
  - - [4096, 1024, 1, 512, 4096, 4096, 4096, 1024]
    - [88, 98.93]
  - - [4096, 1024, 1, 1024, 4096, 4096, 4096, 1024]
    - [83, 147.79]
  - - [4096, 1024, 1, 2048, 4096, 4096, 4096, 1024]
    - [88, 196.37]
  - - [4096, 1024, 1, 4096, 4096, 4096, 4096, 1024]
    - [86, 211.02]
  - - [4096, 1024, 1, 8192, 4096, 4096, 4096, 1024]
    - [84, 205.85]
  - - [4096, 2048, 1, 128, 4096, 4096, 4096, 2048]
    - [16, 35.62]
  - - [4096, 2048, 1, 256, 4096, 4096, 4096, 2048]
    - [20, 63.71]
  - - [4096, 2048, 1, 512, 4096, 4096, 4096, 2048]
    - [20, 104.46]
  - - [4096, 2048, 1, 1024, 4096, 4096, 4096, 2048]
    - [3, 153.8]
  - - [4096, 2048, 1, 2048, 4096, 4096, 4096, 2048]
    - [3, 197.86]
  - - [4096, 2048, 1, 4096, 4096, 4096, 4096, 2048]
    - [81, 224.28]
  - - [4096, 2048, 1, 8192, 4096, 4096, 4096, 2048]
    - [14, 253.84]
  - - [4096, 4096, 1, 128, 4096, 4096, 4096, 4096]
    - [17, 38.93]
  - - [4096, 4096, 1, 256, 4096, 4096, 4096, 4096]
    - [13, 68.14]
  - - [4096, 4096, 1, 512, 4096, 4096, 4096, 4096]
    - [40, 113.31]
  - - [4096, 4096, 1, 1024, 4096, 4096, 4096, 4096]
    - [4, 152.12]
  - - [4096, 4096, 1, 2048, 4096, 4096, 4096, 4096]
    - [12, 200.78]
  - - [4096, 4096, 1, 4096, 4096, 4096, 4096, 4096]
    - [6, 247.98]
  - - [4096, 4096, 1, 8192, 4096, 4096, 4096, 4096]
    - [77, 304.49]
  - - [4096, 8192, 1, 128, 4096, 4096, 4096, 8192]
    - [23, 46.58]
  - - [4096, 8192, 1, 256, 4096, 4096, 4096, 8192]
    - [25, 75.62]
  - - [4096, 8192, 1, 512, 4096, 4096, 4096, 8192]
    - [17, 115.59]
  - - [4096, 8192, 1, 1024, 4096, 4096, 4096, 8192]
    - [85, 165.76]
  - - [4096, 8192, 1, 2048, 4096, 4096, 4096, 8192]
    - [0, 215.07]
  - - [4096, 8192, 1, 4096, 4096, 4096, 4096, 8192]
    - [89, 265.47]
  - - [4096, 8192, 1, 8192, 4096, 4096, 4096, 8192]
    - [76, 311.93]
  - - [8192, 128, 1, 128, 8192, 8192, 8192, 128]
    - [92, 20.17]
  - - [8192, 128, 1, 256, 8192, 8192, 8192, 128]
    - [54, 34.4]
  - - [8192, 128, 1, 512, 8192, 8192, 8192, 128]
    - [49, 55.08]
  - - [8192, 128, 1, 1024, 8192, 8192, 8192, 128]
    - [91, 79.66]
  - - [8192, 128, 1, 2048, 8192, 8192, 8192, 128]
    - [95, 100.75]
  - - [8192, 128, 1, 4096, 8192, 8192, 8192, 128]
    - [94, 120.11]
  - - [8192, 128, 1, 8192, 8192, 8192, 8192, 128]
    - [96, 123.36]
  - - [8192, 256, 1, 128, 8192, 8192, 8192, 256]
    - [34, 28.91]
  - - [8192, 256, 1, 256, 8192, 8192, 8192, 256]
    - [36, 49.95]
  - - [8192, 256, 1, 512, 8192, 8192, 8192, 256]
    - [36, 78.84]
  - - [8192, 256, 1, 1024, 8192, 8192, 8192, 256]
    - [46, 111.74]
  - - [8192, 256, 1, 2048, 8192, 8192, 8192, 256]
    - [42, 143.22]
  - - [8192, 256, 1, 4096, 8192, 8192, 8192, 256]
    - [44, 162.56]
  - - [8192, 256, 1, 8192, 8192, 8192, 8192, 256]
    - [39, 159.46]
  - - [8192, 512, 1, 128, 8192, 8192, 8192, 512]
    - [32, 36.44]
  - - [8192, 512, 1, 256, 8192, 8192, 8192, 512]
    - [17, 63.54]
  - - [8192, 512, 1, 512, 8192, 8192, 8192, 512]
    - [16, 103.56]
  - - [8192, 512, 1, 1024, 8192, 8192, 8192, 512]
    - [16, 151.46]
  - - [8192, 512, 1, 2048, 8192, 8192, 8192, 512]
    - [16, 195.24]
  - - [8192, 512, 1, 4096, 8192, 8192, 8192, 512]
    - [86, 211.98]
  - - [8192, 512, 1, 8192, 8192, 8192, 8192, 512]
    - [87, 207.46]
  - - [8192, 1024, 1, 128, 8192, 8192, 8192, 1024]
    - [28, 40.48]
  - - [8192, 1024, 1, 256, 8192, 8192, 8192, 1024]
    - [28, 72.37]
  - - [8192, 1024, 1, 512, 8192, 8192, 8192, 1024]
    - [28, 117.05]
  - - [8192, 1024, 1, 1024, 8192, 8192, 8192, 1024]
    - [31, 169.85]
  - - [8192, 1024, 1, 2048, 8192, 8192, 8192, 1024]
    - [21, 206.92]
  - - [8192, 1024, 1, 4096, 8192, 8192, 8192, 1024]
    - [14, 228.85]
  - - [8192, 1024, 1, 8192, 8192, 8192, 8192, 1024]
    - [80, 265.98]
  - - [8192, 2048, 1, 128, 8192, 8192, 8192, 2048]
    - [28, 44.59]
  - - [8192, 2048, 1, 256, 8192, 8192, 8192, 2048]
    - [29, 78.87]
  - - [8192, 2048, 1, 512, 8192, 8192, 8192, 2048]
    - [31, 123.97]
  - - [8192, 2048, 1, 1024, 8192, 8192, 8192, 2048]
    - [28, 164.42]
  - - [8192, 2048, 1, 2048, 8192, 8192, 8192, 2048]
    - [18, 207.52]
  - - [8192, 2048, 1, 4096, 8192, 8192, 8192, 2048]
    - [5, 252.59]
  - - [8192, 2048, 1, 8192, 8192, 8192, 8192, 2048]
    - [78, 312.89]
  - - [8192, 4096, 1, 128, 8192, 8192, 8192, 4096]
    - [30, 41.95]
  - - [8192, 4096, 1, 256, 8192, 8192, 8192, 4096]
    - [28, 72.22]
  - - [8192, 4096, 1, 512, 8192, 8192, 8192, 4096]
    - [17, 119.03]
  - - [8192, 4096, 1, 1024, 8192, 8192, 8192, 4096]
    - [89, 166.06]
  - - [8192, 4096, 1, 2048, 8192, 8192, 8192, 4096]
    - [2, 216.82]
  - - [8192, 4096, 1, 4096, 8192, 8192, 8192, 4096]
    - [85, 267.7]
  - - [8192, 4096, 1, 8192, 8192, 8192, 8192, 4096]
    - [79, 303.44]
  - - [8192, 8192, 1, 128, 8192, 8192, 8192, 8192]
    - [26, 40.28]
  - - [8192, 8192, 1, 256, 8192, 8192, 8192, 8192]
    - [10, 70.57]
  - - [8192, 8192, 1, 512, 8192, 8192, 8192, 8192]
    - [13, 116.96]
  - - [8192, 8192, 1, 1024, 8192, 8192, 8192, 8192]
    - [8, 172.87]
  - - [8192, 8192, 1, 2048, 8192, 8192, 8192, 8192]
    - [78, 239.98]
  - - [8192, 8192, 1, 4096, 8192, 8192, 8192, 8192]
    - [79, 296.91]
  - - [8192, 8192, 1, 8192, 8192, 8192, 8192, 8192]
    - [2, 316.23]
- null
- null
- ExperimentalStreamK
- GridBased
