projects/hipblaslt/library/src/amd_detail/rocblaslt/src/Tensile/Logic/asm_full/aquavanjaram/gfx942_228cu/StreamK/aquavanjaram942_Cijk_Alik_Bljk_B8NF8NS_BH_Bias_HAS_SAV_UserArgs.yaml
- {MinimumRequiredVersion: 4.33.0}
- aquavanjaram942
- {Architecture: gfx942, CUCount: 228}
- [Device 0049, Device 0050]
    SolutionIndex: 0
    SolutionNameMin: Cijk_Alik_Bljk_B8NF8NS_BH_Bias_HAS_SAV_UserArgs_MT256x256x64_MI16x16x1_SN_LDSB1_CLR1_GRVWA16_GRVWB8_GSU0_GSUC0_GSUWGMRR0_K1_LBSPPA512_LBSPPB512_LPA16_LPB8_LRVW8_MIWT8_8_PLR1_SU0_SUM0_SUS64_VWA8_VWB8_WGM1_WGMXCC1_WGMXCCGn1
    SolutionIndex: 1
    SolutionNameMin: Cijk_Alik_Bljk_B8NF8NS_BH_Bias_HAS_SAV_UserArgs_MT256x256x64_MI16x16x1_SN_LDSB1_CLR1_GRVWA8_GRVWB16_GSU0_GSUC0_GSUWGMRR0_K1_LBSPPA512_LBSPPB512_LPA8_LPB16_LRVW8_MIWT8_8_PLR1_SU0_SUM0_SUS64_VWA8_VWB8_WGM1_WGMXCC1_WGMXCCGn1
    SolutionIndex: 2
    SolutionNameMin: Cijk_Alik_Bljk_B8NF8NS_BH_Bias_HAS_SAV_UserArgs_MT256x256x64_MI16x16x1_SN_LDSB1_CLR1_GRVWA8_GRVWB16_GSU0_GSUC0_GSUWGMRR0_K1_LBSPPA512_LBSPPB512_LPA8_LPB16_LRVW8_MIWT8_8_PLR1_SU0_SUM0_SUS64_VWA8_VWB8_WGM4_WGMXCC1_WGMXCCGn1
    SolutionIndex: 3
    SolutionNameMin: Cijk_Alik_Bljk_B8NF8NS_BH_Bias_HAS_SAV_UserArgs_MT256x256x64_MI16x16x1_SN_LDSB1_CLR1_GRVWA16_GRVWB16_GSU0_GSUC0_GSUWGMRR0_K1_LBSPPA512_LBSPPB512_LPA16_LPB16_LRVW8_MIWT8_8_PLR1_SU0_SUM0_SUS64_VWA8_VWB8_WGM4_WGMXCC1_WGMXCCGn1
    SolutionIndex: 4
    SolutionNameMin: Cijk_Alik_Bljk_B8NF8NS_BH_Bias_HAS_SAV_UserArgs_MT256x256x64_MI16x16x1_SN_LDSB1_CLR1_GRVWA8_GRVWB16_GSU0_GSUC0_GSUWGMRR0_K1_LBSPPA512_LBSPPB512_LPA8_LPB16_LRVW8_MIWT8_8_PLR1_SU0_SUM0_SUS64_VWA8_VWB8_WGM6_WGMXCC1_WGMXCCGn1
    SolutionIndex: 5
    SolutionNameMin: Cijk_Alik_Bljk_B8NF8NS_BH_Bias_HAS_SAV_UserArgs_MT256x256x64_MI16x16x1_SN_LDSB1_CLR1_GRVWA16_GRVWB16_GSU0_GSUC0_GSUWGMRR0_K1_LBSPPA512_LBSPPB512_LPA16_LPB16_LRVW8_MIWT8_8_PLR1_SU0_SUM0_SUS64_VWA8_VWB8_WGM6_WGMXCC1_WGMXCCGn1
    SolutionIndex: 6
    SolutionNameMin: Cijk_Alik_Bljk_B8NF8NS_BH_Bias_HAS_SAV_UserArgs_MT256x256x64_MI16x16x1_SN_LDSB1_CLR1_GRVWA8_GRVWB16_GSU0_GSUC0_GSUWGMRR0_K1_LBSPPA512_LBSPPB512_LPA8_LPB16_LRVW8_MIWT8_8_PLR1_SU0_SUM0_SUS64_VWA8_VWB8_WGM8_WGMXCC1_WGMXCCGn1
    SolutionIndex: 7
    SolutionNameMin: Cijk_Alik_Bljk_B8NF8NS_BH_Bias_HAS_SAV_UserArgs_MT256x256x64_MI16x16x1_SN_LDSB1_CLR1_GRVWA16_GRVWB16_GSU0_GSUC0_GSUWGMRR0_K1_LBSPPA512_LBSPPB512_LPA16_LPB16_LRVW8_MIWT8_8_PLR1_SU0_SUM0_SUS64_VWA8_VWB8_WGM8_WGMXCC1_WGMXCCGn1
    SolutionIndex: 8
    SolutionNameMin: Cijk_Alik_Bljk_B8NF8NS_BH_Bias_HAS_SAV_UserArgs_MT128x256x64_MI16x16x1_SN_LDSB1_CLR1_GRVWA8_GRVWB16_GSU0_GSUC0_GSUWGMRR0_K1_LBSPPA256_LBSPPB512_LPA8_LPB16_LRVW8_MIWT4_8_PLR1_SU0_SUM0_SUS64_VWA4_VWB8_WGM1_WGMXCC1_WGMXCCGn1
    SolutionIndex: 9
    SolutionNameMin: Cijk_Alik_Bljk_B8NF8NS_BH_Bias_HAS_SAV_UserArgs_MT128x256x64_MI16x16x1_SN_LDSB1_CLR1_GRVWA8_GRVWB8_GSU0_GSUC0_GSUWGMRR0_K1_LBSPPA256_LBSPPB512_LPA8_LPB8_LRVW8_MIWT4_8_PLR1_SU0_SUM0_SUS64_VWA4_VWB8_WGM6_WGMXCC1_WGMXCCGn1
    SolutionIndex: 10
    SolutionNameMin: Cijk_Alik_Bljk_B8NF8NS_BH_Bias_HAS_SAV_UserArgs_MT256x128x64_MI16x16x1_SN_LDSB1_CLR1_GRVWA8_GRVWB16_GSU0_GSUC0_GSUWGMRR0_K1_LBSPPA512_LBSPPB256_LPA8_LPB16_LRVW8_MIWT8_4_PLR1_SU0_SUM0_SUS64_VWA8_VWB4_WGM1_WGMXCC1_WGMXCCGn1
    SolutionIndex: 11
    SolutionNameMin: Cijk_Alik_Bljk_B8NF8NS_BH_Bias_HAS_SAV_UserArgs_MT256x128x64_MI16x16x1_SN_LDSB1_CLR1_GRVWA8_GRVWB16_GSU0_GSUC0_GSUWGMRR0_K1_LBSPPA512_LBSPPB256_LPA8_LPB16_LRVW8_MIWT8_4_PLR1_SU0_SUM0_SUS64_VWA8_VWB4_WGM4_WGMXCC1_WGMXCCGn1
    SolutionIndex: 12
    SolutionNameMin: Cijk_Alik_Bljk_B8NF8NS_BH_Bias_HAS_SAV_UserArgs_MT256x128x64_MI16x16x1_SN_LDSB1_CLR1_GRVWA8_GRVWB16_GSU0_GSUC0_GSUWGMRR0_K1_LBSPPA512_LBSPPB256_LPA8_LPB16_LRVW8_MIWT8_4_PLR1_SU0_SUM0_SUS64_VWA8_VWB4_WGM8_WGMXCC1_WGMXCCGn1
    SolutionIndex: 13
    SolutionNameMin: Cijk_Alik_Bljk_B8NF8NS_BH_Bias_HAS_SAV_UserArgs_MT128x128x64_MI16x16x1_SN_LDSB1_CLR1_GRVWA8_GRVWB16_GSU0_GSUC0_GSUWGMRR0_K1_LBSPPA512_LBSPPB128_LPA8_LPB16_LRVW8_MIWT8_2_PLR1_SU0_SUM0_SUS64_VWA8_VWB2_WGM1_WGMXCC1_WGMXCCGn1
    SolutionIndex: 14
    SolutionNameMin: Cijk_Alik_Bljk_B8NF8NS_BH_Bias_HAS_SAV_UserArgs_MT128x128x64_MI16x16x1_SN_LDSB1_CLR1_GRVWA8_GRVWB16_GSU0_GSUC0_GSUWGMRR0_K1_LBSPPA512_LBSPPB128_LPA8_LPB16_LRVW8_MIWT8_2_PLR1_SU0_SUM0_SUS64_VWA8_VWB2_WGM4_WGMXCC1_WGMXCCGn1
    SolutionIndex: 15
    SolutionNameMin: Cijk_Alik_Bljk_B8NF8NS_BH_Bias_HAS_SAV_UserArgs_MT128x64x64_MI16x16x1_SN_LDSB0_CLR1_GRVWA8_GRVWB16_GSU0_GSUC0_GSUWGMRR0_K1_LBSPPA512_LBSPPB128_LPA8_LPB16_LRVW8_MIWT8_1_PLR1_SU0_SUM0_SUS64_VWA8_VWB1_WGM1_WGMXCC1_WGMXCCGn1
    SolutionIndex: 16
    SolutionNameMin: Cijk_Alik_Bljk_B8NF8NS_BH_Bias_HAS_SAV_UserArgs_MT128x128x64_MI16x16x1_SN_LDSB1_CLR1_GRVWA16_GRVWB16_GSU0_GSUC0_GSUWGMRR0_K1_LBSPPA256_LBSPPB256_LPA16_LPB16_LRVW8_MIWT4_4_PLR1_SU0_SUM0_SUS64_VWA4_VWB4_WGM1_WGMXCC1_WGMXCCGn1
    SolutionIndex: 17
    SolutionNameMin: Cijk_Alik_Bljk_B8NF8NS_BH_Bias_HAS_SAV_UserArgs_MT64x128x64_MI16x16x1_SN_LDSB0_CLR1_GRVWA16_GRVWB8_GSU0_GSUC0_GSUWGMRR0_K1_LBSPPA128_LBSPPB256_LPA16_LPB8_LRVW8_MIWT2_4_PLR1_SU0_SUM0_SUS64_VWA2_VWB4_WGM1_WGMXCC1_WGMXCCGn1
    SolutionIndex: 18
    SolutionNameMin: Cijk_Alik_Bljk_B8NF8NS_BH_Bias_HAS_SAV_UserArgs_MT64x128x64_MI16x16x1_SN_LDSB0_CLR1_GRVWA16_GRVWB16_GSU0_GSUC0_GSUWGMRR0_K1_LBSPPA128_LBSPPB256_LPA16_LPB16_LRVW8_MIWT2_4_PLR1_SU0_SUM0_SUS64_VWA2_VWB4_WGM1_WGMXCC1_WGMXCCGn1
    SolutionIndex: 19
    SolutionNameMin: Cijk_Alik_Bljk_B8NF8NS_BH_Bias_HAS_SAV_UserArgs_MT128x64x64_MI16x16x1_SN_LDSB0_CLR1_GRVWA8_GRVWB8_GSU0_GSUC0_GSUWGMRR0_K1_LBSPPA256_LBSPPB128_LPA8_LPB8_LRVW8_MIWT4_2_PLR1_SU0_SUM0_SUS64_VWA4_VWB2_WGM1_WGMXCC1_WGMXCCGn1
    SolutionIndex: 20
    SolutionNameMin: Cijk_Alik_Bljk_B8NF8NS_BH_Bias_HAS_SAV_UserArgs_MT128x64x64_MI16x16x1_SN_LDSB0_CLR1_GRVWA16_GRVWB8_GSU0_GSUC0_GSUWGMRR0_K1_LBSPPA256_LBSPPB128_LPA16_LPB8_LRVW8_MIWT4_2_PLR1_SU0_SUM0_SUS64_VWA4_VWB2_WGM1_WGMXCC1_WGMXCCGn1
    SolutionIndex: 21
    SolutionNameMin: Cijk_Alik_Bljk_B8NF8NS_BH_Bias_HAS_SAV_UserArgs_MT128x64x64_MI16x16x1_SN_LDSB0_CLR1_GRVWA8_GRVWB16_GSU0_GSUC0_GSUWGMRR0_K1_LBSPPA256_LBSPPB128_LPA8_LPB16_LRVW8_MIWT4_2_PLR1_SU0_SUM0_SUS64_VWA4_VWB2_WGM1_WGMXCC1_WGMXCCGn1
    SolutionIndex: 22
    SolutionNameMin: Cijk_Alik_Bljk_B8NF8NS_BH_Bias_HAS_SAV_UserArgs_MT128x64x64_MI16x16x1_SN_LDSB0_CLR1_GRVWA16_GRVWB16_GSU0_GSUC0_GSUWGMRR0_K1_LBSPPA256_LBSPPB128_LPA16_LPB16_LRVW8_MIWT4_2_PLR1_SU0_SUM0_SUS64_VWA4_VWB2_WGM1_WGMXCC1_WGMXCCGn1
    SolutionIndex: 23
    SolutionNameMin: Cijk_Alik_Bljk_B8NF8NS_BH_Bias_HAS_SAV_UserArgs_MT128x64x64_MI16x16x1_SN_LDSB0_CLR1_GRVWA8_GRVWB16_GSU0_GSUC0_GSUWGMRR0_K1_LBSPPA256_LBSPPB128_LPA8_LPB16_LRVW8_MIWT4_2_PLR1_SU0_SUM0_SUS64_VWA4_VWB2_WGM4_WGMXCC1_WGMXCCGn1
    SolutionIndex: 24
    SolutionNameMin: Cijk_Alik_Bljk_B8NF8NS_BH_Bias_HAS_SAV_UserArgs_MT128x64x64_MI16x16x1_SN_LDSB0_CLR1_GRVWA8_GRVWB16_GSU0_GSUC0_GSUWGMRR0_K1_LBSPPA256_LBSPPB128_LPA8_LPB16_LRVW8_MIWT4_2_PLR1_SU0_SUM0_SUS64_VWA4_VWB2_WGM6_WGMXCC1_WGMXCCGn1
    SolutionIndex: 25
    SolutionNameMin: Cijk_Alik_Bljk_B8NF8NS_BH_Bias_HAS_SAV_UserArgs_MT128x64x64_MI16x16x1_SN_LDSB0_CLR1_GRVWA8_GRVWB16_GSU0_GSUC0_GSUWGMRR0_K1_LBSPPA256_LBSPPB128_LPA8_LPB16_LRVW8_MIWT4_2_PLR1_SU0_SUM0_SUS64_VWA4_VWB2_WGM8_WGMXCC1_WGMXCCGn1
    SolutionIndex: 26
    SolutionNameMin: Cijk_Alik_Bljk_B8NF8NS_BH_Bias_HAS_SAV_UserArgs_MT64x64x64_MI16x16x1_SN_LDSB0_CLR1_GRVWA8_GRVWB8_GSU0_GSUC0_GSUWGMRR0_K1_LBSPPA128_LBSPPB128_LPA8_LPB8_LRVW8_MIWT2_2_PLR1_SU0_SUM0_SUS64_VWA2_VWB2_WGM1_WGMXCC1_WGMXCCGn1
    SolutionIndex: 27
    SolutionNameMin: Cijk_Alik_Bljk_B8NF8NS_BH_Bias_HAS_SAV_UserArgs_MT64x64x64_MI16x16x1_SN_LDSB0_CLR1_GRVWA16_GRVWB8_GSU0_GSUC0_GSUWGMRR0_K1_LBSPPA128_LBSPPB128_LPA16_LPB8_LRVW8_MIWT2_2_PLR1_SU0_SUM0_SUS64_VWA2_VWB2_WGM1_WGMXCC1_WGMXCCGn1
    SolutionIndex: 28
    SolutionNameMin: Cijk_Alik_Bljk_B8NF8NS_BH_Bias_HAS_SAV_UserArgs_MT64x64x64_MI16x16x1_SN_LDSB0_CLR1_GRVWA8_GRVWB16_GSU0_GSUC0_GSUWGMRR0_K1_LBSPPA128_LBSPPB128_LPA8_LPB16_LRVW8_MIWT2_2_PLR1_SU0_SUM0_SUS64_VWA2_VWB2_WGM1_WGMXCC1_WGMXCCGn1
    SolutionIndex: 29
    SolutionNameMin: Cijk_Alik_Bljk_B8NF8NS_BH_Bias_HAS_SAV_UserArgs_MT64x64x64_MI16x16x1_SN_LDSB0_CLR1_GRVWA16_GRVWB16_GSU0_GSUC0_GSUWGMRR0_K1_LBSPPA128_LBSPPB128_LPA16_LPB16_LRVW8_MIWT2_2_PLR1_SU0_SUM0_SUS64_VWA2_VWB2_WGM1_WGMXCC1_WGMXCCGn1
    SolutionIndex: 30
    SolutionNameMin: Cijk_Alik_Bljk_B8NF8NS_BH_Bias_HAS_SAV_UserArgs_MT64x32x64_MI16x16x1_SN_LDSB0_CLR1_GRVWA8_GRVWB8_GSU0_GSUC0_GSUWGMRR0_K1_LBSPPA128_LBSPPB128_LPA8_LPB8_LRVW8_MIWT2_1_PLR1_SU0_SUM0_SUS64_VWA2_VWB1_WGM1_WGMXCC1_WGMXCCGn1
    SolutionIndex: 31
    SolutionNameMin: Cijk_Alik_Bljk_B8NF8NS_BH_Bias_HAS_SAV_UserArgs_MT64x32x64_MI16x16x1_SN_LDSB0_CLR1_GRVWA16_GRVWB8_GSU0_GSUC0_GSUWGMRR0_K1_LBSPPA128_LBSPPB128_LPA16_LPB8_LRVW8_MIWT2_1_PLR1_SU0_SUM0_SUS64_VWA2_VWB1_WGM1_WGMXCC1_WGMXCCGn1
    SolutionIndex: 32
    SolutionNameMin: Cijk_Alik_Bljk_B8NF8NS_BH_Bias_HAS_SAV_UserArgs_MT32x32x64_MI16x16x1_SN_LDSB0_CLR1_GRVWA8_GRVWB8_GSU0_GSUC0_GSUWGMRR0_K1_LBSPPA128_LBSPPB128_LPA8_LPB8_LRVW8_MIWT1_1_PLR1_SU0_SUM0_SUS64_VWA1_VWB1_WGM6_WGMXCC1_WGMXCCGn1
    SolutionIndex: 33
    SolutionNameMin: Cijk_Alik_Bljk_B8NF8NS_BH_Bias_HAS_SAV_UserArgs_MT128x256x128_MI16x16x1_SN_LDSB1_CLR1_GRVWA8_GRVWB16_GSU0_GSUC0_GSUWGMRR0_K1_LBSPPA512_LBSPPB1024_LPA8_LPB16_LRVW8_MIWT4_8_PLR1_SU0_SUM0_SUS128_VWA4_VWB8_WGM1_WGMXCC1_WGMXCCGn1
    SolutionIndex: 34
    SolutionNameMin: Cijk_Alik_Bljk_B8NF8NS_BH_Bias_HAS_SAV_UserArgs_MT128x256x128_MI16x16x1_SN_LDSB1_CLR1_GRVWA8_GRVWB8_GSU0_GSUC0_GSUWGMRR0_K1_LBSPPA512_LBSPPB1024_LPA8_LPB8_LRVW8_MIWT4_8_PLR1_SU0_SUM0_SUS128_VWA4_VWB8_WGM4_WGMXCC1_WGMXCCGn1
    SolutionIndex: 35
    SolutionNameMin: Cijk_Alik_Bljk_B8NF8NS_BH_Bias_HAS_SAV_UserArgs_MT256x144x128_MI16x16x1_SN_LDSB1_CLR1_GRVWA8_GRVWB8_GSU0_GSUC0_GSUWGMRR0_K1_LBSPPA512_LBSPPB128_LPA8_LPB8_LRVW8_MIWT4_9_PLR1_SU0_SUM0_SUS128_VWA4_VWB1_WGM1_WGMXCC1_WGMXCCGn1
    SolutionIndex: 36
    SolutionNameMin: Cijk_Alik_Bljk_B8NF8NS_BH_Bias_HAS_SAV_UserArgs_MT256x144x128_MI16x16x1_SN_LDSB1_CLR1_GRVWA16_GRVWB8_GSU0_GSUC0_GSUWGMRR0_K1_LBSPPA512_LBSPPB128_LPA16_LPB8_LRVW8_MIWT4_9_PLR1_SU0_SUM0_SUS128_VWA4_VWB1_WGM1_WGMXCC1_WGMXCCGn1
    SolutionIndex: 37
    SolutionNameMin: Cijk_Alik_Bljk_B8NF8NS_BH_Bias_HAS_SAV_UserArgs_MT256x144x128_MI16x16x1_SN_LDSB1_CLR1_GRVWA8_GRVWB8_GSU0_GSUC0_GSUWGMRR0_K1_LBSPPA512_LBSPPB128_LPA8_LPB8_LRVW8_MIWT4_9_PLR1_SU0_SUM0_SUS128_VWA4_VWB1_WGM4_WGMXCC1_WGMXCCGn1
    SolutionIndex: 38
    SolutionNameMin: Cijk_Alik_Bljk_B8NF8NS_BH_Bias_HAS_SAV_UserArgs_MT256x144x128_MI16x16x1_SN_LDSB1_CLR1_GRVWA16_GRVWB8_GSU0_GSUC0_GSUWGMRR0_K1_LBSPPA512_LBSPPB128_LPA16_LPB8_LRVW8_MIWT4_9_PLR1_SU0_SUM0_SUS128_VWA4_VWB1_WGM4_WGMXCC1_WGMXCCGn1
    SolutionIndex: 39
    SolutionNameMin: Cijk_Alik_Bljk_B8NF8NS_BH_Bias_HAS_SAV_UserArgs_MT256x144x128_MI16x16x1_SN_LDSB1_CLR1_GRVWA8_GRVWB8_GSU0_GSUC0_GSUWGMRR0_K1_LBSPPA512_LBSPPB128_LPA8_LPB8_LRVW8_MIWT4_9_PLR1_SU0_SUM0_SUS128_VWA4_VWB1_WGM6_WGMXCC1_WGMXCCGn1
    SolutionIndex: 40
    SolutionNameMin: Cijk_Alik_Bljk_B8NF8NS_BH_Bias_HAS_SAV_UserArgs_MT256x144x128_MI16x16x1_SN_LDSB1_CLR1_GRVWA16_GRVWB8_GSU0_GSUC0_GSUWGMRR0_K1_LBSPPA512_LBSPPB128_LPA16_LPB8_LRVW8_MIWT4_9_PLR1_SU0_SUM0_SUS128_VWA4_VWB1_WGM6_WGMXCC1_WGMXCCGn1
    SolutionIndex: 41
    SolutionNameMin: Cijk_Alik_Bljk_B8NF8NS_BH_Bias_HAS_SAV_UserArgs_MT256x144x128_MI16x16x1_SN_LDSB1_CLR1_GRVWA8_GRVWB8_GSU0_GSUC0_GSUWGMRR0_K1_LBSPPA512_LBSPPB128_LPA8_LPB8_LRVW8_MIWT4_9_PLR1_SU0_SUM0_SUS128_VWA4_VWB1_WGM8_WGMXCC1_WGMXCCGn1
    SolutionIndex: 42
    SolutionNameMin: Cijk_Alik_Bljk_B8NF8NS_BH_Bias_HAS_SAV_UserArgs_MT256x144x128_MI16x16x1_SN_LDSB1_CLR1_GRVWA16_GRVWB8_GSU0_GSUC0_GSUWGMRR0_K1_LBSPPA512_LBSPPB128_LPA16_LPB8_LRVW8_MIWT4_9_PLR1_SU0_SUM0_SUS128_VWA4_VWB1_WGM8_WGMXCC1_WGMXCCGn1
    SolutionIndex: 43
    SolutionNameMin: Cijk_Alik_Bljk_B8NF8NS_BH_Bias_HAS_SAV_UserArgs_MT256x128x128_MI16x16x1_SN_LDSB1_CLR1_GRVWA8_GRVWB16_GSU0_GSUC0_GSUWGMRR0_K1_LBSPPA1024_LBSPPB512_LPA8_LPB16_LRVW8_MIWT8_4_PLR1_SU0_SUM0_SUS128_VWA8_VWB4_WGM1_WGMXCC1_WGMXCCGn1
    SolutionIndex: 44
    SolutionNameMin: Cijk_Alik_Bljk_B8NF8NS_BH_Bias_HAS_SAV_UserArgs_MT256x128x128_MI16x16x1_SN_LDSB1_CLR1_GRVWA8_GRVWB16_GSU0_GSUC0_GSUWGMRR0_K1_LBSPPA1024_LBSPPB512_LPA8_LPB16_LRVW8_MIWT8_4_PLR1_SU0_SUM0_SUS128_VWA8_VWB4_WGM4_WGMXCC1_WGMXCCGn1
    SolutionIndex: 45
    SolutionNameMin: Cijk_Alik_Bljk_B8NF8NS_BH_Bias_HAS_SAV_UserArgs_MT256x128x128_MI16x16x1_SN_LDSB1_CLR1_GRVWA8_GRVWB16_GSU0_GSUC0_GSUWGMRR0_K1_LBSPPA1024_LBSPPB512_LPA8_LPB16_LRVW8_MIWT8_4_PLR1_SU0_SUM0_SUS128_VWA8_VWB4_WGM8_WGMXCC1_WGMXCCGn1
    SolutionIndex: 46
    SolutionNameMin: Cijk_Alik_Bljk_B8NF8NS_BH_Bias_HAS_SAV_UserArgs_MT144x256x128_MI16x16x1_SN_LDSB1_CLR1_GRVWA8_GRVWB16_GSU0_GSUC0_GSUWGMRR0_K1_LBSPPA128_LBSPPB512_LPA8_LPB16_LRVW8_MIWT9_4_PLR1_SU0_SUM0_SUS128_VWA1_VWB4_WGM1_WGMXCC1_WGMXCCGn1
    SolutionIndex: 47
    SolutionNameMin: Cijk_Alik_Bljk_B8NF8NS_BH_Bias_HAS_SAV_UserArgs_MT144x256x128_MI16x16x1_SN_LDSB1_CLR1_GRVWA8_GRVWB8_GSU0_GSUC0_GSUWGMRR0_K1_LBSPPA128_LBSPPB512_LPA8_LPB8_LRVW8_MIWT9_4_PLR1_SU0_SUM0_SUS128_VWA1_VWB4_WGM4_WGMXCC1_WGMXCCGn1
    SolutionIndex: 48
    SolutionNameMin: Cijk_Alik_Bljk_B8NF8NS_BH_Bias_HAS_SAV_UserArgs_MT144x256x128_MI16x16x1_SN_LDSB1_CLR1_GRVWA8_GRVWB16_GSU0_GSUC0_GSUWGMRR0_K1_LBSPPA128_LBSPPB512_LPA8_LPB16_LRVW8_MIWT9_4_PLR1_SU0_SUM0_SUS128_VWA1_VWB4_WGM4_WGMXCC1_WGMXCCGn1
    SolutionIndex: 49
    SolutionNameMin: Cijk_Alik_Bljk_B8NF8NS_BH_Bias_HAS_SAV_UserArgs_MT144x256x128_MI16x16x1_SN_LDSB1_CLR1_GRVWA8_GRVWB16_GSU0_GSUC0_GSUWGMRR0_K1_LBSPPA128_LBSPPB512_LPA8_LPB16_LRVW8_MIWT9_4_PLR1_SU0_SUM0_SUS128_VWA1_VWB4_WGM6_WGMXCC1_WGMXCCGn1
    SolutionIndex: 50
    SolutionNameMin: Cijk_Alik_Bljk_B8NF8NS_BH_Bias_HAS_SAV_UserArgs_MT144x256x128_MI16x16x1_SN_LDSB1_CLR1_GRVWA8_GRVWB8_GSU0_GSUC0_GSUWGMRR0_K1_LBSPPA128_LBSPPB512_LPA8_LPB8_LRVW8_MIWT9_4_PLR1_SU0_SUM0_SUS128_VWA1_VWB4_WGM8_WGMXCC1_WGMXCCGn1
    SolutionIndex: 51
    SolutionNameMin: Cijk_Alik_Bljk_B8NF8NS_BH_Bias_HAS_SAV_UserArgs_MT144x256x128_MI16x16x1_SN_LDSB1_CLR1_GRVWA8_GRVWB16_GSU0_GSUC0_GSUWGMRR0_K1_LBSPPA128_LBSPPB512_LPA8_LPB16_LRVW8_MIWT9_4_PLR1_SU0_SUM0_SUS128_VWA1_VWB4_WGM8_WGMXCC1_WGMXCCGn1
    SolutionIndex: 52
    SolutionNameMin: Cijk_Alik_Bljk_B8NF8NS_BH_Bias_HAS_SAV_UserArgs_MT128x128x128_MI16x16x1_SN_LDSB1_CLR1_GRVWA8_GRVWB16_GSU0_GSUC0_GSUWGMRR0_K1_LBSPPA1024_LBSPPB256_LPA8_LPB16_LRVW8_MIWT8_2_PLR1_SU0_SUM0_SUS128_VWA8_VWB2_WGM1_WGMXCC1_WGMXCCGn1
    SolutionIndex: 53
    SolutionNameMin: Cijk_Alik_Bljk_B8NF8NS_BH_Bias_HAS_SAV_UserArgs_MT128x128x128_MI16x16x1_SN_LDSB1_CLR1_GRVWA8_GRVWB16_GSU0_GSUC0_GSUWGMRR0_K1_LBSPPA1024_LBSPPB256_LPA8_LPB16_LRVW8_MIWT8_2_PLR1_SU0_SUM0_SUS128_VWA8_VWB2_WGM4_WGMXCC1_WGMXCCGn1
    SolutionIndex: 54
    SolutionNameMin: Cijk_Alik_Bljk_B8NF8NS_BH_Bias_HAS_SAV_UserArgs_MT128x128x128_MI16x16x1_SN_LDSB1_CLR1_GRVWA8_GRVWB16_GSU0_GSUC0_GSUWGMRR0_K1_LBSPPA1024_LBSPPB256_LPA8_LPB16_LRVW8_MIWT8_2_PLR1_SU0_SUM0_SUS128_VWA8_VWB2_WGM6_WGMXCC1_WGMXCCGn1
    SolutionIndex: 55
    SolutionNameMin: Cijk_Alik_Bljk_B8NF8NS_BH_Bias_HAS_SAV_UserArgs_MT128x128x128_MI16x16x1_SN_LDSB1_CLR1_GRVWA8_GRVWB16_GSU0_GSUC0_GSUWGMRR0_K1_LBSPPA1024_LBSPPB256_LPA8_LPB16_LRVW8_MIWT8_2_PLR1_SU0_SUM0_SUS128_VWA8_VWB2_WGM8_WGMXCC1_WGMXCCGn1
    SolutionIndex: 56
    SolutionNameMin: Cijk_Alik_Bljk_B8NF8NS_BH_Bias_HAS_SAV_UserArgs_MT128x144x128_MI16x16x1_SN_LDSB1_CLR1_GRVWA16_GRVWB8_GSU0_GSUC0_GSUWGMRR0_K1_LBSPPA256_LBSPPB128_LPA16_LPB8_LRVW8_MIWT2_9_PLR1_SU0_SUM0_SUS128_VWA2_VWB1_WGM1_WGMXCC1_WGMXCCGn1
    SolutionIndex: 57
    SolutionNameMin: Cijk_Alik_Bljk_B8NF8NS_BH_Bias_HAS_SAV_UserArgs_MT128x144x128_MI16x16x1_SN_LDSB1_CLR1_GRVWA16_GRVWB8_GSU0_GSUC0_GSUWGMRR0_K1_LBSPPA256_LBSPPB128_LPA16_LPB8_LRVW8_MIWT2_9_PLR1_SU0_SUM0_SUS128_VWA2_VWB1_WGM8_WGMXCC1_WGMXCCGn1
    SolutionIndex: 58
    SolutionNameMin: Cijk_Alik_Bljk_B8NF8NS_BH_Bias_HAS_SAV_UserArgs_MT144x128x128_MI16x16x1_SN_LDSB1_CLR1_GRVWA8_GRVWB16_GSU0_GSUC0_GSUWGMRR0_K1_LBSPPA128_LBSPPB256_LPA8_LPB16_LRVW8_MIWT9_2_PLR1_SU0_SUM0_SUS128_VWA1_VWB2_WGM4_WGMXCC1_WGMXCCGn1
    SolutionIndex: 59
    SolutionNameMin: Cijk_Alik_Bljk_B8NF8NS_BH_Bias_HAS_SAV_UserArgs_MT144x128x128_MI16x16x1_SN_LDSB1_CLR1_GRVWA8_GRVWB16_GSU0_GSUC0_GSUWGMRR0_K1_LBSPPA128_LBSPPB256_LPA8_LPB16_LRVW8_MIWT9_2_PLR1_SU0_SUM0_SUS128_VWA1_VWB2_WGM8_WGMXCC1_WGMXCCGn1
    SolutionIndex: 60
    SolutionNameMin: Cijk_Alik_Bljk_B8NF8NS_BH_Bias_HAS_SAV_UserArgs_MT128x128x128_MI16x16x1_SN_LDSB1_CLR1_GRVWA8_GRVWB16_GSU0_GSUC0_GSUWGMRR0_K1_LBSPPA512_LBSPPB512_LPA8_LPB16_LRVW8_MIWT4_4_PLR1_SU0_SUM0_SUS128_VWA4_VWB4_WGM1_WGMXCC1_WGMXCCGn1
    SolutionIndex: 61
    SolutionNameMin: Cijk_Alik_Bljk_B8NF8NS_BH_Bias_HAS_SAV_UserArgs_MT128x128x128_MI16x16x1_SN_LDSB1_CLR1_GRVWA16_GRVWB16_GSU0_GSUC0_GSUWGMRR0_K1_LBSPPA512_LBSPPB512_LPA16_LPB16_LRVW8_MIWT4_4_PLR1_SU0_SUM0_SUS128_VWA4_VWB4_WGM1_WGMXCC1_WGMXCCGn1
    SolutionIndex: 62
    SolutionNameMin: Cijk_Alik_Bljk_B8NF8NS_BH_Bias_HAS_SAV_UserArgs_MT128x128x128_MI16x16x1_SN_LDSB1_CLR1_GRVWA8_GRVWB16_GSU0_GSUC0_GSUWGMRR0_K1_LBSPPA512_LBSPPB512_LPA8_LPB16_LRVW8_MIWT4_4_PLR1_SU0_SUM0_SUS128_VWA4_VWB4_WGM6_WGMXCC1_WGMXCCGn1
    SolutionIndex: 63
    SolutionNameMin: Cijk_Alik_Bljk_B8NF8NS_BH_Bias_HAS_SAV_UserArgs_MT128x128x128_MI16x16x1_SN_LDSB1_CLR1_GRVWA8_GRVWB16_GSU0_GSUC0_GSUWGMRR0_K1_LBSPPA512_LBSPPB512_LPA8_LPB16_LRVW8_MIWT4_4_PLR1_SU0_SUM0_SUS128_VWA4_VWB4_WGM8_WGMXCC1_WGMXCCGn1
    SolutionIndex: 64
    SolutionNameMin: Cijk_Alik_Bljk_B8NF8NS_BH_Bias_HAS_SAV_UserArgs_MT128x128x128_MI16x16x1_SN_LDSB1_CLR1_GRVWA16_GRVWB16_GSU0_GSUC0_GSUWGMRR0_K1_LBSPPA512_LBSPPB512_LPA16_LPB16_LRVW8_MIWT4_4_PLR1_SU0_SUM0_SUS128_VWA4_VWB4_WGM8_WGMXCC1_WGMXCCGn1
    SolutionIndex: 65
    SolutionNameMin: Cijk_Alik_Bljk_B8NF8NS_BH_Bias_HAS_SAV_UserArgs_MT64x128x128_MI16x16x1_SN_LDSB1_CLR1_GRVWA8_GRVWB16_GSU0_GSUC0_GSUWGMRR0_K1_LBSPPA256_LBSPPB512_LPA8_LPB16_LRVW8_MIWT2_4_PLR1_SU0_SUM0_SUS128_VWA2_VWB4_WGM1_WGMXCC1_WGMXCCGn1
    SolutionIndex: 66
    SolutionNameMin: Cijk_Alik_Bljk_B8NF8NS_BH_Bias_HAS_SAV_UserArgs_MT64x128x128_MI16x16x1_SN_LDSB1_CLR1_GRVWA8_GRVWB16_GSU0_GSUC0_GSUWGMRR0_K1_LBSPPA256_LBSPPB512_LPA8_LPB16_LRVW8_MIWT2_4_PLR1_SU0_SUM0_SUS128_VWA2_VWB4_WGM6_WGMXCC1_WGMXCCGn1
    SolutionIndex: 67
    SolutionNameMin: Cijk_Alik_Bljk_B8NF8NS_BH_Bias_HAS_SAV_UserArgs_MT64x128x128_MI16x16x1_SN_LDSB1_CLR1_GRVWA8_GRVWB16_GSU0_GSUC0_GSUWGMRR0_K1_LBSPPA256_LBSPPB512_LPA8_LPB16_LRVW8_MIWT2_4_PLR1_SU0_SUM0_SUS128_VWA2_VWB4_WGM8_WGMXCC1_WGMXCCGn1
    SolutionIndex: 68
    SolutionNameMin: Cijk_Alik_Bljk_B8NF8NS_BH_Bias_HAS_SAV_UserArgs_MT128x64x128_MI16x16x1_SN_LDSB1_CLR1_GRVWA8_GRVWB8_GSU0_GSUC0_GSUWGMRR0_K1_LBSPPA512_LBSPPB256_LPA8_LPB8_LRVW8_MIWT4_2_PLR1_SU0_SUM0_SUS128_VWA4_VWB2_WGM1_WGMXCC1_WGMXCCGn1
    SolutionIndex: 69
    SolutionNameMin: Cijk_Alik_Bljk_B8NF8NS_BH_Bias_HAS_SAV_UserArgs_MT128x64x128_MI16x16x1_SN_LDSB1_CLR1_GRVWA8_GRVWB16_GSU0_GSUC0_GSUWGMRR0_K1_LBSPPA512_LBSPPB256_LPA8_LPB16_LRVW8_MIWT4_2_PLR1_SU0_SUM0_SUS128_VWA4_VWB2_WGM1_WGMXCC1_WGMXCCGn1
    SolutionIndex: 70
    SolutionNameMin: Cijk_Alik_Bljk_B8NF8NS_BH_Bias_HAS_SAV_UserArgs_MT64x64x128_MI16x16x1_SN_LDSB1_CLR1_GRVWA16_GRVWB8_GSU0_GSUC0_GSUWGMRR0_K1_LBSPPA256_LBSPPB256_LPA16_LPB8_LRVW8_MIWT2_2_PLR1_SU0_SUM0_SUS128_VWA2_VWB2_WGM1_WGMXCC1_WGMXCCGn1
    SolutionIndex: 71
    SolutionNameMin: Cijk_Alik_Bljk_B8NF8NS_BH_Bias_HAS_SAV_UserArgs_MT64x64x128_MI16x16x1_SN_LDSB1_CLR1_GRVWA8_GRVWB16_GSU0_GSUC0_GSUWGMRR0_K1_LBSPPA256_LBSPPB256_LPA8_LPB16_LRVW8_MIWT2_2_PLR1_SU0_SUM0_SUS128_VWA2_VWB2_WGM1_WGMXCC1_WGMXCCGn1
    SolutionIndex: 72
    SolutionNameMin: Cijk_Alik_Bljk_B8NF8NS_BH_Bias_HAS_SAV_UserArgs_MT64x64x128_MI16x16x1_SN_LDSB1_CLR1_GRVWA8_GRVWB16_GSU0_GSUC0_GSUWGMRR0_K1_LBSPPA256_LBSPPB256_LPA8_LPB16_LRVW8_MIWT2_2_PLR1_SU0_SUM0_SUS128_VWA2_VWB2_WGM4_WGMXCC1_WGMXCCGn1
    SolutionIndex: 73
    SolutionNameMin: Cijk_Alik_Bljk_B8NF8NS_BH_Bias_HAS_SAV_UserArgs_MT64x64x128_MI16x16x1_SN_LDSB1_CLR1_GRVWA8_GRVWB16_GSU0_GSUC0_GSUWGMRR0_K1_LBSPPA256_LBSPPB256_LPA8_LPB16_LRVW8_MIWT2_2_PLR1_SU0_SUM0_SUS128_VWA2_VWB2_WGM6_WGMXCC1_WGMXCCGn1
    SolutionIndex: 74
    SolutionNameMin: Cijk_Alik_Bljk_B8NF8NS_BH_Bias_HAS_SAV_UserArgs_MT64x64x128_MI16x16x1_SN_LDSB1_CLR1_GRVWA8_GRVWB16_GSU0_GSUC0_GSUWGMRR0_K1_LBSPPA256_LBSPPB256_LPA8_LPB16_LRVW8_MIWT2_2_PLR1_SU0_SUM0_SUS128_VWA2_VWB2_WGM8_WGMXCC1_WGMXCCGn1
    SolutionIndex: 75
    SolutionNameMin: Cijk_Alik_Bljk_B8NF8NS_BH_Bias_HAS_SAV_UserArgs_MT32x64x128_MI16x16x1_SN_LDSB0_CLR1_GRVWA8_GRVWB8_GSU0_GSUC0_GSUWGMRR0_K1_LBSPPA128_LBSPPB256_LPA8_LPB8_LRVW8_MIWT1_2_PLR1_SU0_SUM0_SUS128_VWA1_VWB2_WGM1_WGMXCC1_WGMXCCGn1
    SolutionIndex: 76
    SolutionNameMin: Cijk_Alik_Bljk_B8NF8NS_BH_Bias_HAS_SAV_UserArgs_MT32x64x128_MI16x16x1_SN_LDSB0_CLR1_GRVWA8_GRVWB8_GSU0_GSUC0_GSUWGMRR0_K1_LBSPPA128_LBSPPB256_LPA8_LPB8_LRVW8_MIWT1_2_PLR1_SU0_SUM0_SUS128_VWA1_VWB2_WGM6_WGMXCC1_WGMXCCGn1
    SolutionIndex: 77
    SolutionNameMin: Cijk_Alik_Bljk_B8NF8NS_BH_Bias_HAS_SAV_UserArgs_MT32x64x128_MI16x16x1_SN_LDSB0_CLR1_GRVWA8_GRVWB8_GSU0_GSUC0_GSUWGMRR0_K1_LBSPPA128_LBSPPB256_LPA8_LPB8_LRVW8_MIWT1_2_PLR1_SU0_SUM0_SUS128_VWA1_VWB2_WGM8_WGMXCC1_WGMXCCGn1
    SolutionIndex: 78
    SolutionNameMin: Cijk_Alik_Bljk_B8NF8NS_BH_Bias_HAS_SAV_UserArgs_MT64x32x128_MI16x16x1_SN_LDSB0_CLR1_GRVWA8_GRVWB8_GSU0_GSUC0_GSUWGMRR0_K1_LBSPPA256_LBSPPB128_LPA8_LPB8_LRVW8_MIWT2_1_PLR1_SU0_SUM0_SUS128_VWA2_VWB1_WGM1_WGMXCC1_WGMXCCGn1
    SolutionIndex: 79
    SolutionNameMin: Cijk_Alik_Bljk_B8NF8NS_BH_Bias_HAS_SAV_UserArgs_MT64x32x128_MI16x16x1_SN_LDSB0_CLR1_GRVWA16_GRVWB8_GSU0_GSUC0_GSUWGMRR0_K1_LBSPPA256_LBSPPB128_LPA16_LPB8_LRVW8_MIWT2_1_PLR1_SU0_SUM0_SUS128_VWA2_VWB1_WGM1_WGMXCC1_WGMXCCGn1
    SolutionIndex: 80
    SolutionNameMin: Cijk_Alik_Bljk_B8NF8NS_BH_Bias_HAS_SAV_UserArgs_MT64x32x128_MI16x16x1_SN_LDSB0_CLR1_GRVWA8_GRVWB16_GSU0_GSUC0_GSUWGMRR0_K1_LBSPPA256_LBSPPB128_LPA8_LPB16_LRVW8_MIWT2_1_PLR1_SU0_SUM0_SUS128_VWA2_VWB1_WGM1_WGMXCC1_WGMXCCGn1
    SolutionIndex: 81
    SolutionNameMin: Cijk_Alik_Bljk_B8NF8NS_BH_Bias_HAS_SAV_UserArgs_MT64x32x128_MI16x16x1_SN_LDSB0_CLR1_GRVWA16_GRVWB16_GSU0_GSUC0_GSUWGMRR0_K1_LBSPPA256_LBSPPB128_LPA16_LPB16_LRVW8_MIWT2_1_PLR1_SU0_SUM0_SUS128_VWA2_VWB1_WGM1_WGMXCC1_WGMXCCGn1
    SolutionIndex: 82
    SolutionNameMin: Cijk_Alik_Bljk_B8NF8NS_BH_Bias_HAS_SAV_UserArgs_MT32x32x128_MI16x16x1_SN_LDSB0_CLR1_GRVWA8_GRVWB8_GSU0_GSUC0_GSUWGMRR0_K1_LBSPPA128_LBSPPB128_LPA8_LPB8_LRVW8_MIWT1_1_PLR1_SU0_SUM0_SUS128_VWA1_VWB1_WGM1_WGMXCC1_WGMXCCGn1
    SolutionIndex: 83
    SolutionNameMin: Cijk_Alik_Bljk_B8NF8NS_BH_Bias_HAS_SAV_UserArgs_MT32x32x128_MI16x16x1_SN_LDSB0_CLR1_GRVWA16_GRVWB8_GSU0_GSUC0_GSUWGMRR0_K1_LBSPPA128_LBSPPB128_LPA16_LPB8_LRVW8_MIWT1_1_PLR1_SU0_SUM0_SUS128_VWA1_VWB1_WGM1_WGMXCC1_WGMXCCGn1
    SolutionIndex: 84
    SolutionNameMin: Cijk_Alik_Bljk_B8NF8NS_BH_Bias_HAS_SAV_UserArgs_MT32x32x128_MI16x16x1_SN_LDSB0_CLR1_GRVWA8_GRVWB16_GSU0_GSUC0_GSUWGMRR0_K1_LBSPPA128_LBSPPB128_LPA8_LPB16_LRVW8_MIWT1_1_PLR1_SU0_SUM0_SUS128_VWA1_VWB1_WGM1_WGMXCC1_WGMXCCGn1
    SolutionIndex: 85
    SolutionNameMin: Cijk_Alik_Bljk_B8NF8NS_BH_Bias_HAS_SAV_UserArgs_MT32x32x128_MI16x16x1_SN_LDSB0_CLR1_GRVWA16_GRVWB16_GSU0_GSUC0_GSUWGMRR0_K1_LBSPPA128_LBSPPB128_LPA16_LPB16_LRVW8_MIWT1_1_PLR1_SU0_SUM0_SUS128_VWA1_VWB1_WGM1_WGMXCC1_WGMXCCGn1
    SolutionIndex: 86
    SolutionNameMin: Cijk_Alik_Bljk_B8NF8NS_BH_Bias_HAS_SAV_UserArgs_MT32x32x128_MI16x16x1_SN_LDSB0_CLR1_GRVWA8_GRVWB8_GSU0_GSUC0_GSUWGMRR0_K1_LBSPPA128_LBSPPB128_LPA8_LPB8_LRVW8_MIWT1_1_PLR1_SU0_SUM0_SUS128_VWA1_VWB1_WGM4_WGMXCC1_WGMXCCGn1
    SolutionIndex: 87
    SolutionNameMin: Cijk_Alik_Bljk_B8NF8NS_BH_Bias_HAS_SAV_UserArgs_MT32x32x128_MI16x16x1_SN_LDSB0_CLR1_GRVWA8_GRVWB8_GSU0_GSUC0_GSUWGMRR0_K1_LBSPPA128_LBSPPB128_LPA8_LPB8_LRVW8_MIWT1_1_PLR1_SU0_SUM0_SUS128_VWA1_VWB1_WGM6_WGMXCC1_WGMXCCGn1
    SolutionIndex: 88
    SolutionNameMin: Cijk_Alik_Bljk_B8NF8NS_BH_Bias_HAS_SAV_UserArgs_MT32x32x128_MI16x16x1_SN_LDSB0_CLR1_GRVWA8_GRVWB8_GSU0_GSUC0_GSUWGMRR0_K1_LBSPPA128_LBSPPB128_LPA8_LPB8_LRVW8_MIWT1_1_PLR1_SU0_SUM0_SUS128_VWA1_VWB1_WGM8_WGMXCC1_WGMXCCGn1
    SolutionIndex: 89
    SolutionNameMin: Cijk_Alik_Bljk_B8NF8NS_BH_Bias_HAS_SAV_UserArgs_MT128x64x256_MI16x16x1_SN_LDSB1_CLR1_GRVWA8_GRVWB16_GSU0_GSUC0_GSUWGMRR0_K1_LBSPPA1024_LBSPPB512_LPA8_LPB16_LRVW8_MIWT4_2_PLR1_SU0_SUM0_SUS256_VWA4_VWB2_WGM1_WGMXCC1_WGMXCCGn1
    SolutionIndex: 90
    SolutionNameMin: Cijk_Alik_Bljk_B8NF8NS_BH_Bias_HAS_SAV_UserArgs_MT128x64x256_MI16x16x1_SN_LDSB1_CLR1_GRVWA8_GRVWB16_GSU0_GSUC0_GSUWGMRR0_K1_LBSPPA1024_LBSPPB512_LPA8_LPB16_LRVW8_MIWT4_2_PLR1_SU0_SUM0_SUS256_VWA4_VWB2_WGM4_WGMXCC1_WGMXCCGn1
    SolutionIndex: 91
    SolutionNameMin: Cijk_Alik_Bljk_B8NF8NS_BH_Bias_HAS_SAV_UserArgs_MT128x64x256_MI16x16x1_SN_LDSB1_CLR1_GRVWA8_GRVWB16_GSU0_GSUC0_GSUWGMRR0_K1_LBSPPA1024_LBSPPB512_LPA8_LPB16_LRVW8_MIWT4_2_PLR1_SU0_SUM0_SUS256_VWA4_VWB2_WGM6_WGMXCC1_WGMXCCGn1
    SolutionIndex: 92
    SolutionNameMin: Cijk_Alik_Bljk_B8NF8NS_BH_Bias_HAS_SAV_UserArgs_MT128x64x256_MI16x16x1_SN_LDSB1_CLR1_GRVWA8_GRVWB16_GSU0_GSUC0_GSUWGMRR0_K1_LBSPPA1024_LBSPPB512_LPA8_LPB16_LRVW8_MIWT4_2_PLR1_SU0_SUM0_SUS256_VWA4_VWB2_WGM8_WGMXCC1_WGMXCCGn1
    SolutionIndex: 93
    SolutionNameMin: Cijk_Alik_Bljk_B8NF8NS_BH_Bias_HAS_SAV_UserArgs_MT64x64x256_MI16x16x1_SN_LDSB1_CLR1_GRVWA8_GRVWB16_GSU0_GSUC0_GSUWGMRR0_K1_LBSPPA512_LBSPPB512_LPA8_LPB16_LRVW8_MIWT2_2_PLR1_SU0_SUM0_SUS256_VWA2_VWB2_WGM1_WGMXCC1_WGMXCCGn1
    SolutionIndex: 94
    SolutionNameMin: Cijk_Alik_Bljk_B8NF8NS_BH_Bias_HAS_SAV_UserArgs_MT64x64x256_MI16x16x1_SN_LDSB1_CLR1_GRVWA8_GRVWB16_GSU0_GSUC0_GSUWGMRR0_K1_LBSPPA512_LBSPPB512_LPA8_LPB16_LRVW8_MIWT2_2_PLR1_SU0_SUM0_SUS256_VWA2_VWB2_WGM4_WGMXCC1_WGMXCCGn1
    SolutionIndex: 95
    SolutionNameMin: Cijk_Alik_Bljk_B8NF8NS_BH_Bias_HAS_SAV_UserArgs_MT64x64x256_MI16x16x1_SN_LDSB1_CLR1_GRVWA8_GRVWB16_GSU0_GSUC0_GSUWGMRR0_K1_LBSPPA512_LBSPPB512_LPA8_LPB16_LRVW8_MIWT2_2_PLR1_SU0_SUM0_SUS256_VWA2_VWB2_WGM6_WGMXCC1_WGMXCCGn1
    SolutionIndex: 96
    SolutionNameMin: Cijk_Alik_Bljk_B8NF8NS_BH_Bias_HAS_SAV_UserArgs_MT64x64x256_MI16x16x1_SN_LDSB1_CLR1_GRVWA16_GRVWB16_GSU0_GSUC0_GSUWGMRR0_K1_LBSPPA512_LBSPPB512_LPA16_LPB16_LRVW8_MIWT2_2_PLR1_SU0_SUM0_SUS256_VWA2_VWB2_WGM8_WGMXCC1_WGMXCCGn1
    SolutionIndex: 97
    SolutionNameMin: Cijk_Alik_Bljk_B8NF8NS_BH_Bias_HAS_SAV_UserArgs_MT32x64x256_MI16x16x1_SN_LDSB1_CLR1_GRVWA8_GRVWB16_GSU0_GSUC0_GSUWGMRR0_K1_LBSPPA256_LBSPPB512_LPA8_LPB16_LRVW8_MIWT1_2_PLR1_SU0_SUM0_SUS256_VWA1_VWB2_WGM4_WGMXCC1_WGMXCCGn1
    SolutionIndex: 98
    SolutionNameMin: Cijk_Alik_Bljk_B8NF8NS_BH_Bias_HAS_SAV_UserArgs_MT32x32x256_MI16x16x1_SN_LDSB1_CLR1_GRVWA16_GRVWB8_GSU0_GSUC0_GSUWGMRR0_K1_LBSPPA256_LBSPPB256_LPA16_LPB8_LRVW8_MIWT1_1_PLR1_SU0_SUM0_SUS256_VWA1_VWB1_WGM8_WGMXCC1_WGMXCCGn1
    SolutionIndex: 99
    SolutionNameMin: Cijk_Alik_Bljk_B8NF8NS_BH_Bias_HAS_SAV_UserArgs_MT256x32x32_MI16x16x1_SN_LDSB0_CLR0_GRVWA8_GRVWB4_GSU0_GSUC0_GSUWGMRR0_K1_LBSPPA256_LBSPPB128_LPA8_LPB8_LRVW8_MIWT8_1_PLR0_SU32_SUM0_SUS256_VWA8_VWB1_WGM4_WGMXCC1_WGMXCCGn1
- - - [128, 128, 1, 128, 128, 128, 128, 128]
    - [32, 0.51]
  - - [128, 128, 1, 256, 128, 128, 256, 256]
    - [85, 1.14]
  - - [128, 128, 1, 512, 128, 128, 512, 512]
    - [82, 2.06]
  - - [128, 128, 1, 1024, 128, 128, 1024, 1024]
    - [84, 3.37]
  - - [128, 128, 1, 2048, 128, 128, 2048, 2048]
    - [82, 5.18]
  - - [128, 128, 1, 4096, 128, 128, 4096, 4096]
    - [82, 7.08]
  - - [128, 128, 1, 8192, 128, 128, 8192, 8192]
    - [82, 8.62]
  - - [128, 256, 1, 128, 128, 128, 128, 128]
    - [83, 1.21]
  - - [128, 256, 1, 256, 128, 128, 256, 256]
    - [85, 2.3]
  - - [128, 256, 1, 512, 128, 128, 512, 512]
    - [84, 4.11]
  - - [128, 256, 1, 1024, 128, 128, 1024, 1024]
    - [84, 6.92]
  - - [128, 256, 1, 2048, 128, 128, 2048, 2048]
    - [82, 10.62]
  - - [128, 256, 1, 4096, 128, 128, 4096, 4096]
    - [82, 14.22]
  - - [128, 256, 1, 8192, 128, 128, 8192, 8192]
    - [82, 17.39]
  - - [128, 512, 1, 128, 128, 128, 128, 128]
    - [84, 2.35]
  - - [128, 512, 1, 256, 128, 128, 256, 256]
    - [84, 4.54]
  - - [128, 512, 1, 512, 128, 128, 512, 512]
    - [82, 8.16]
  - - [128, 512, 1, 1024, 128, 128, 1024, 1024]
    - [82, 13.58]
  - - [128, 512, 1, 2048, 128, 128, 2048, 2048]
    - [82, 20.76]
  - - [128, 512, 1, 4096, 128, 128, 4096, 4096]
    - [82, 28.34]
  - - [128, 512, 1, 8192, 128, 128, 8192, 8192]
    - [82, 34.2]
  - - [128, 1024, 1, 128, 128, 128, 128, 128]
    - [84, 4.71]
  - - [128, 1024, 1, 256, 128, 128, 256, 256]
    - [82, 8.94]
  - - [128, 1024, 1, 512, 128, 128, 512, 512]
    - [83, 16.26]
  - - [128, 1024, 1, 1024, 128, 128, 1024, 1024]
    - [82, 27.06]
  - - [128, 1024, 1, 2048, 128, 128, 2048, 2048]
    - [82, 41.21]
  - - [128, 1024, 1, 4096, 128, 128, 4096, 4096]
    - [88, 55.37]
  - - [128, 1024, 1, 8192, 128, 128, 8192, 8192]
    - [82, 67.54]
  - - [128, 2048, 1, 128, 128, 128, 128, 128]
    - [30, 9.12]
  - - [128, 2048, 1, 256, 128, 128, 256, 256]
    - [30, 16.87]
  - - [128, 2048, 1, 512, 128, 128, 512, 512]
    - [80, 29.53]
  - - [128, 2048, 1, 1024, 128, 128, 1024, 1024]
    - [78, 47.5]
  - - [128, 2048, 1, 2048, 128, 128, 2048, 2048]
    - [75, 68.69]
  - - [128, 2048, 1, 4096, 128, 128, 4096, 4096]
    - [75, 89.01]
  - - [128, 2048, 1, 8192, 128, 128, 8192, 8192]
    - [78, 101.21]
  - - [128, 4096, 1, 128, 128, 128, 128, 128]
    - [27, 16.23]
  - - [128, 4096, 1, 256, 128, 128, 256, 256]
    - [28, 29.58]
  - - [128, 4096, 1, 512, 128, 128, 512, 512]
    - [26, 49.59]
  - - [128, 4096, 1, 1024, 128, 128, 1024, 1024]
    - [71, 76.52]
  - - [128, 4096, 1, 2048, 128, 128, 2048, 2048]
    - [70, 105.22]
  - - [128, 4096, 1, 4096, 128, 128, 4096, 4096]
    - [71, 130.54]
  - - [128, 4096, 1, 8192, 128, 128, 8192, 8192]
    - [93, 141.61]
  - - [128, 8192, 1, 128, 128, 128, 128, 128]
    - [20, 27.91]
  - - [128, 8192, 1, 256, 128, 128, 256, 256]
    - [21, 49.76]
  - - [128, 8192, 1, 512, 128, 128, 512, 512]
    - [21, 83.32]
  - - [128, 8192, 1, 1024, 128, 128, 1024, 1024]
    - [21, 124.41]
  - - [128, 8192, 1, 2048, 128, 128, 2048, 2048]
    - [21, 160.78]
  - - [128, 8192, 1, 4096, 128, 128, 4096, 4096]
    - [70, 167.54]
  - - [128, 8192, 1, 8192, 128, 128, 8192, 8192]
    - [96, 191.05]
  - - [256, 128, 1, 128, 256, 256, 128, 128]
    - [85, 1.24]
  - - [256, 128, 1, 256, 256, 256, 256, 256]
    - [85, 2.32]
  - - [256, 128, 1, 512, 256, 256, 512, 512]
    - [83, 4.17]
  - - [256, 128, 1, 1024, 256, 256, 1024, 1024]
    - [84, 6.92]
  - - [256, 128, 1, 2048, 256, 256, 2048, 2048]
    - [82, 10.52]
  - - [256, 128, 1, 4096, 256, 256, 4096, 4096]
    - [82, 14.43]
  - - [256, 128, 1, 8192, 256, 256, 8192, 8192]
    - [82, 17.38]
  - - [256, 256, 1, 128, 256, 256, 128, 128]
    - [83, 2.44]
  - - [256, 256, 1, 256, 256, 256, 256, 256]
    - [85, 4.53]
  - - [256, 256, 1, 512, 256, 256, 512, 512]
    - [82, 8.18]
  - - [256, 256, 1, 1024, 256, 256, 1024, 1024]
    - [82, 13.88]
  - - [256, 256, 1, 2048, 256, 256, 2048, 2048]
    - [82, 20.96]
  - - [256, 256, 1, 4096, 256, 256, 4096, 4096]
    - [82, 28.39]
  - - [256, 256, 1, 8192, 256, 256, 8192, 8192]
    - [82, 34.34]
  - - [256, 512, 1, 128, 256, 256, 128, 128]
    - [85, 4.82]
  - - [256, 512, 1, 256, 256, 256, 256, 256]
    - [84, 9.01]
  - - [256, 512, 1, 512, 256, 256, 512, 512]
    - [83, 16.26]
  - - [256, 512, 1, 1024, 256, 256, 1024, 1024]
    - [82, 27.08]
  - - [256, 512, 1, 2048, 256, 256, 2048, 2048]
    - [82, 40.62]
  - - [256, 512, 1, 4096, 256, 256, 4096, 4096]
    - [82, 55.63]
  - - [256, 512, 1, 8192, 256, 256, 8192, 8192]
    - [82, 67.79]
  - - [256, 1024, 1, 128, 256, 256, 128, 128]
    - [30, 8.94]
  - - [256, 1024, 1, 256, 256, 256, 256, 256]
    - [30, 16.62]
  - - [256, 1024, 1, 512, 256, 256, 512, 512]
    - [81, 28.99]
  - - [256, 1024, 1, 1024, 256, 256, 1024, 1024]
    - [78, 46.81]
  - - [256, 1024, 1, 2048, 256, 256, 2048, 2048]
    - [75, 69.0]
  - - [256, 1024, 1, 4096, 256, 256, 4096, 4096]
    - [75, 88.01]
  - - [256, 1024, 1, 8192, 256, 256, 8192, 8192]
    - [78, 101.97]
  - - [256, 2048, 1, 128, 256, 256, 128, 128]
    - [26, 16.27]
  - - [256, 2048, 1, 256, 256, 256, 256, 256]
    - [29, 30.22]
  - - [256, 2048, 1, 512, 256, 256, 512, 512]
    - [26, 49.63]
  - - [256, 2048, 1, 1024, 256, 256, 1024, 1024]
    - [70, 76.07]
  - - [256, 2048, 1, 2048, 256, 256, 2048, 2048]
    - [71, 105.4]
  - - [256, 2048, 1, 4096, 256, 256, 4096, 4096]
    - [71, 130.04]
  - - [256, 2048, 1, 8192, 256, 256, 8192, 8192]
    - [93, 141.8]
  - - [256, 4096, 1, 128, 256, 256, 128, 128]
    - [68, 27.28]
  - - [256, 4096, 1, 256, 256, 256, 256, 256]
    - [21, 49.81]
  - - [256, 4096, 1, 512, 256, 256, 512, 512]
    - [21, 83.27]
  - - [256, 4096, 1, 1024, 256, 256, 1024, 1024]
    - [21, 122.77]
  - - [256, 4096, 1, 2048, 256, 256, 2048, 2048]
    - [21, 161.52]
  - - [256, 4096, 1, 4096, 256, 256, 4096, 4096]
    - [89, 178.92]
  - - [256, 4096, 1, 8192, 256, 256, 8192, 8192]
    - [65, 193.91]
  - - [256, 8192, 1, 128, 256, 256, 128, 128]
    - [52, 43.62]
  - - [256, 8192, 1, 256, 256, 256, 256, 256]
    - [13, 77.46]
  - - [256, 8192, 1, 512, 256, 256, 512, 512]
    - [13, 126.63]
  - - [256, 8192, 1, 1024, 256, 256, 1024, 1024]
    - [13, 184.14]
  - - [256, 8192, 1, 2048, 256, 256, 2048, 2048]
    - [52, 228.88]
  - - [256, 8192, 1, 4096, 256, 256, 4096, 4096]
    - [69, 222.52]
  - - [256, 8192, 1, 8192, 256, 256, 8192, 8192]
    - [62, 249.69]
  - - [512, 128, 1, 128, 512, 512, 128, 128]
    - [83, 2.46]
  - - [512, 128, 1, 256, 512, 512, 256, 256]
    - [85, 4.6]
  - - [512, 128, 1, 512, 512, 512, 512, 512]
    - [82, 8.2]
  - - [512, 128, 1, 1024, 512, 512, 1024, 1024]
    - [82, 13.9]
  - - [512, 128, 1, 2048, 512, 512, 2048, 2048]
    - [82, 21.05]
  - - [512, 128, 1, 4096, 512, 512, 4096, 4096]
    - [82, 28.23]
  - - [512, 128, 1, 8192, 512, 512, 8192, 8192]
    - [82, 34.37]
  - - [512, 256, 1, 128, 512, 512, 128, 128]
    - [85, 4.88]
  - - [512, 256, 1, 256, 512, 512, 256, 256]
    - [82, 9.02]
  - - [512, 256, 1, 512, 512, 512, 512, 512]
    - [84, 16.26]
  - - [512, 256, 1, 1024, 512, 512, 1024, 1024]
    - [82, 27.23]
  - - [512, 256, 1, 2048, 512, 512, 2048, 2048]
    - [82, 41.57]
  - - [512, 256, 1, 4096, 512, 512, 4096, 4096]
    - [88, 54.92]
  - - [512, 256, 1, 8192, 512, 512, 8192, 8192]
    - [86, 66.94]
  - - [512, 512, 1, 128, 512, 512, 128, 128]
    - [30, 9.15]
  - - [512, 512, 1, 256, 512, 512, 256, 256]
    - [30, 16.92]
  - - [512, 512, 1, 512, 512, 512, 512, 512]
    - [80, 29.45]
  - - [512, 512, 1, 1024, 512, 512, 1024, 1024]
    - [80, 46.67]
  - - [512, 512, 1, 2048, 512, 512, 2048, 2048]
    - [78, 67.74]
  - - [512, 512, 1, 4096, 512, 512, 4096, 4096]
    - [75, 88.21]
  - - [512, 512, 1, 8192, 512, 512, 8192, 8192]
    - [98, 97.97]
  - - [512, 1024, 1, 128, 512, 512, 128, 128]
    - [26, 16.68]
  - - [512, 1024, 1, 256, 512, 512, 256, 256]
    - [29, 29.98]
  - - [512, 1024, 1, 512, 512, 512, 512, 512]
    - [26, 49.53]
  - - [512, 1024, 1, 1024, 512, 512, 1024, 1024]
    - [71, 77.12]
  - - [512, 1024, 1, 2048, 512, 512, 2048, 2048]
    - [70, 105.79]
  - - [512, 1024, 1, 4096, 512, 512, 4096, 4096]
    - [71, 130.26]
  - - [512, 1024, 1, 8192, 512, 512, 8192, 8192]
    - [94, 141.72]
  - - [512, 2048, 1, 128, 512, 512, 128, 128]
    - [22, 28.37]
  - - [512, 2048, 1, 256, 512, 512, 256, 256]
    - [21, 50.88]
  - - [512, 2048, 1, 512, 512, 512, 512, 512]
    - [21, 83.75]
  - - [512, 2048, 1, 1024, 512, 512, 1024, 1024]
    - [21, 123.18]
  - - [512, 2048, 1, 2048, 512, 512, 2048, 2048]
    - [21, 161.76]
  - - [512, 2048, 1, 4096, 512, 512, 4096, 4096]
    - [21, 195.2]
  - - [512, 2048, 1, 8192, 512, 512, 8192, 8192]
    - [90, 192.27]
  - - [512, 4096, 1, 128, 512, 512, 128, 128]
    - [13, 43.86]
  - - [512, 4096, 1, 256, 512, 512, 256, 256]
    - [13, 77.46]
  - - [512, 4096, 1, 512, 512, 512, 512, 512]
    - [13, 125.88]
  - - [512, 4096, 1, 1024, 512, 512, 1024, 1024]
    - [13, 183.19]
  - - [512, 4096, 1, 2048, 512, 512, 2048, 2048]
    - [52, 236.23]
  - - [512, 4096, 1, 4096, 512, 512, 4096, 4096]
    - [61, 233.43]
  - - [512, 4096, 1, 8192, 512, 512, 8192, 8192]
    - [60, 249.16]
  - - [512, 8192, 1, 128, 512, 512, 128, 128]
    - [56, 64.15]
  - - [512, 8192, 1, 256, 512, 512, 256, 256]
    - [56, 115.81]
  - - [512, 8192, 1, 512, 512, 512, 512, 512]
    - [56, 187.73]
  - - [512, 8192, 1, 1024, 512, 512, 1024, 1024]
    - [56, 269.34]
  - - [512, 8192, 1, 2048, 512, 512, 2048, 2048]
    - [43, 256.15]
  - - [512, 8192, 1, 4096, 512, 512, 4096, 4096]
    - [57, 285.86]
  - - [512, 8192, 1, 8192, 512, 512, 8192, 8192]
    - [56, 287.18]
  - - [1024, 128, 1, 128, 1024, 1024, 128, 128]
    - [79, 4.39]
  - - [1024, 128, 1, 256, 1024, 1024, 256, 256]
    - [83, 8.74]
  - - [1024, 128, 1, 512, 1024, 1024, 512, 512]
    - [82, 15.87]
  - - [1024, 128, 1, 1024, 1024, 1024, 1024, 1024]
    - [82, 26.87]
  - - [1024, 128, 1, 2048, 1024, 1024, 2048, 2048]
    - [82, 40.17]
  - - [1024, 128, 1, 4096, 1024, 1024, 4096, 4096]
    - [82, 54.66]
  - - [1024, 128, 1, 8192, 1024, 1024, 8192, 8192]
    - [87, 66.7]
  - - [1024, 256, 1, 128, 1024, 1024, 128, 128]
    - [31, 8.88]
  - - [1024, 256, 1, 256, 1024, 1024, 256, 256]
    - [79, 16.43]
  - - [1024, 256, 1, 512, 1024, 1024, 512, 512]
    - [80, 28.7]
  - - [1024, 256, 1, 1024, 1024, 1024, 1024, 1024]
    - [80, 46.21]
  - - [1024, 256, 1, 2048, 1024, 1024, 2048, 2048]
    - [80, 67.6]
  - - [1024, 256, 1, 4096, 1024, 1024, 4096, 4096]
    - [75, 87.75]
  - - [1024, 256, 1, 8192, 1024, 1024, 8192, 8192]
    - [76, 102.81]
  - - [1024, 512, 1, 128, 1024, 1024, 128, 128]
    - [27, 15.85]
  - - [1024, 512, 1, 256, 1024, 1024, 256, 256]
    - [27, 29.28]
  - - [1024, 512, 1, 512, 1024, 1024, 512, 512]
    - [28, 48.7]
  - - [1024, 512, 1, 1024, 1024, 1024, 1024, 1024]
    - [71, 76.18]
  - - [1024, 512, 1, 2048, 1024, 1024, 2048, 2048]
    - [71, 105.47]
  - - [1024, 512, 1, 4096, 1024, 1024, 4096, 4096]
    - [72, 128.75]
  - - [1024, 512, 1, 8192, 1024, 1024, 8192, 8192]
    - [97, 141.61]
  - - [1024, 1024, 1, 128, 1024, 1024, 128, 128]
    - [19, 27.45]
  - - [1024, 1024, 1, 256, 1024, 1024, 256, 256]
    - [20, 49.65]
  - - [1024, 1024, 1, 512, 1024, 1024, 512, 512]
    - [21, 82.36]
  - - [1024, 1024, 1, 1024, 1024, 1024, 1024, 1024]
    - [21, 122.84]
  - - [1024, 1024, 1, 2048, 1024, 1024, 2048, 2048]
    - [21, 161.52]
  - - [1024, 1024, 1, 4096, 1024, 1024, 4096, 4096]
    - [92, 175.73]
  - - [1024, 1024, 1, 8192, 1024, 1024, 8192, 8192]
    - [91, 191.69]
  - - [1024, 2048, 1, 128, 1024, 1024, 128, 128]
    - [13, 44.07]
  - - [1024, 2048, 1, 256, 1024, 1024, 256, 256]
    - [13, 77.98]
  - - [1024, 2048, 1, 512, 1024, 1024, 512, 512]
    - [13, 126.04]
  - - [1024, 2048, 1, 1024, 1024, 1024, 1024, 1024]
    - [13, 183.12]
  - - [1024, 2048, 1, 2048, 1024, 1024, 2048, 2048]
    - [52, 236.09]
  - - [1024, 2048, 1, 4096, 1024, 1024, 4096, 4096]
    - [52, 235.31]
  - - [1024, 2048, 1, 8192, 1024, 1024, 8192, 8192]
    - [55, 254.86]
  - - [1024, 4096, 1, 128, 1024, 1024, 128, 128]
    - [10, 61.08]
  - - [1024, 4096, 1, 256, 1024, 1024, 256, 256]
    - [8, 105.05]
  - - [1024, 4096, 1, 512, 1024, 1024, 512, 512]
    - [10, 168.01]
  - - [1024, 4096, 1, 1024, 1024, 1024, 1024, 1024]
    - [10, 239.79]
  - - [1024, 4096, 1, 2048, 1024, 1024, 2048, 2048]
    - [43, 265.05]
  - - [1024, 4096, 1, 4096, 1024, 1024, 4096, 4096]
    - [43, 276.38]
  - - [1024, 4096, 1, 8192, 1024, 1024, 8192, 8192]
    - [43, 259.64]
  - - [1024, 8192, 1, 128, 1024, 1024, 128, 128]
    - [36, 91.92]
  - - [1024, 8192, 1, 256, 1024, 1024, 256, 256]
    - [36, 158.24]
  - - [1024, 8192, 1, 512, 1024, 1024, 512, 512]
    - [36, 254.74]
  - - [1024, 8192, 1, 1024, 1024, 1024, 1024, 1024]
    - [36, 284.64]
  - - [1024, 8192, 1, 2048, 1024, 1024, 2048, 2048]
    - [37, 327.68]
  - - [1024, 8192, 1, 4096, 1024, 1024, 4096, 4096]
    - [35, 348.26]
  - - [1024, 8192, 1, 8192, 1024, 1024, 8192, 8192]
    - [37, 363.47]
  - - [2048, 128, 1, 128, 2048, 2048, 128, 128]
    - [80, 8.69]
  - - [2048, 128, 1, 256, 2048, 2048, 256, 256]
    - [80, 16.07]
  - - [2048, 128, 1, 512, 2048, 2048, 512, 512]
    - [79, 28.71]
  - - [2048, 128, 1, 1024, 2048, 2048, 1024, 1024]
    - [78, 46.01]
  - - [2048, 128, 1, 2048, 2048, 2048, 2048, 2048]
    - [78, 67.4]
  - - [2048, 128, 1, 4096, 2048, 2048, 4096, 4096]
    - [75, 87.45]
  - - [2048, 128, 1, 8192, 2048, 2048, 8192, 8192]
    - [77, 100.96]
  - - [2048, 256, 1, 128, 2048, 2048, 128, 128]
    - [28, 16.04]
  - - [2048, 256, 1, 256, 2048, 2048, 256, 256]
    - [28, 29.26]
  - - [2048, 256, 1, 512, 2048, 2048, 512, 512]
    - [28, 48.91]
  - - [2048, 256, 1, 1024, 2048, 2048, 1024, 1024]
    - [71, 75.29]
  - - [2048, 256, 1, 2048, 2048, 2048, 2048, 2048]
    - [71, 104.29]
  - - [2048, 256, 1, 4096, 2048, 2048, 4096, 4096]
    - [74, 128.7]
  - - [2048, 256, 1, 8192, 2048, 2048, 8192, 8192]
    - [97, 141.98]
  - - [2048, 512, 1, 128, 2048, 2048, 128, 128]
    - [15, 27.36]
  - - [2048, 512, 1, 256, 2048, 2048, 256, 256]
    - [21, 49.48]
  - - [2048, 512, 1, 512, 2048, 2048, 512, 512]
    - [21, 81.52]
  - - [2048, 512, 1, 1024, 2048, 2048, 1024, 1024]
    - [21, 123.73]
  - - [2048, 512, 1, 2048, 2048, 2048, 2048, 2048]
    - [23, 159.68]
  - - [2048, 512, 1, 4096, 2048, 2048, 4096, 4096]
    - [67, 179.79]
  - - [2048, 512, 1, 8192, 2048, 2048, 8192, 8192]
    - [91, 195.98]
  - - [2048, 1024, 1, 128, 2048, 2048, 128, 128]
    - [52, 44.15]
  - - [2048, 1024, 1, 256, 2048, 2048, 256, 256]
    - [13, 78.48]
  - - [2048, 1024, 1, 512, 2048, 2048, 512, 512]
    - [13, 127.79]
  - - [2048, 1024, 1, 1024, 2048, 2048, 1024, 1024]
    - [13, 181.47]
  - - [2048, 1024, 1, 2048, 2048, 2048, 2048, 2048]
    - [53, 230.39]
  - - [2048, 1024, 1, 4096, 2048, 2048, 4096, 4096]
    - [53, 236.52]
  - - [2048, 1024, 1, 8192, 2048, 2048, 8192, 8192]
    - [63, 252.56]
  - - [2048, 2048, 1, 128, 2048, 2048, 128, 128]
    - [12, 61.3]
  - - [2048, 2048, 1, 256, 2048, 2048, 256, 256]
    - [10, 106.57]
  - - [2048, 2048, 1, 512, 2048, 2048, 512, 512]
    - [10, 168.82]
  - - [2048, 2048, 1, 1024, 2048, 2048, 1024, 1024]
    - [10, 237.99]
  - - [2048, 2048, 1, 2048, 2048, 2048, 2048, 2048]
    - [34, 257.76]
  - - [2048, 2048, 1, 4096, 2048, 2048, 4096, 4096]
    - [44, 273.94]
  - - [2048, 2048, 1, 8192, 2048, 2048, 8192, 8192]
    - [45, 258.29]
  - - [2048, 4096, 1, 128, 2048, 2048, 128, 128]
    - [4, 75.57]
  - - [2048, 4096, 1, 256, 2048, 2048, 256, 256]
    - [1, 128.84]
  - - [2048, 4096, 1, 512, 2048, 2048, 512, 512]
    - [1, 193.31]
  - - [2048, 4096, 1, 1024, 2048, 2048, 1024, 1024]
    - [6, 252.45]
  - - [2048, 4096, 1, 2048, 2048, 2048, 2048, 2048]
    - [5, 275.99]
  - - [2048, 4096, 1, 4096, 2048, 2048, 4096, 4096]
    - [41, 293.64]
  - - [2048, 4096, 1, 8192, 2048, 2048, 8192, 8192]
    - [33, 301.68]
  - - [2048, 8192, 1, 128, 2048, 2048, 128, 128]
    - [36, 100.56]
  - - [2048, 8192, 1, 256, 2048, 2048, 256, 256]
    - [42, 166.03]
  - - [2048, 8192, 1, 512, 2048, 2048, 512, 512]
    - [36, 247.14]
  - - [2048, 8192, 1, 1024, 2048, 2048, 1024, 1024]
    - [35, 298.48]
  - - [2048, 8192, 1, 2048, 2048, 2048, 2048, 2048]
    - [41, 326.14]
  - - [2048, 8192, 1, 4096, 2048, 2048, 4096, 4096]
    - [35, 325.35]
  - - [2048, 8192, 1, 8192, 2048, 2048, 8192, 8192]
    - [37, 369.76]
  - - [4096, 128, 1, 128, 4096, 4096, 128, 128]
    - [26, 15.76]
  - - [4096, 128, 1, 256, 4096, 4096, 256, 256]
    - [27, 28.81]
  - - [4096, 128, 1, 512, 4096, 4096, 512, 512]
    - [71, 48.4]
  - - [4096, 128, 1, 1024, 4096, 4096, 1024, 1024]
    - [71, 74.73]
  - - [4096, 128, 1, 2048, 4096, 4096, 2048, 2048]
    - [70, 103.96]
  - - [4096, 128, 1, 4096, 4096, 4096, 4096, 4096]
    - [73, 128.35]
  - - [4096, 128, 1, 8192, 4096, 4096, 8192, 8192]
    - [95, 141.35]
  - - [4096, 256, 1, 128, 4096, 4096, 128, 128]
    - [18, 27.15]
  - - [4096, 256, 1, 256, 4096, 4096, 256, 256]
    - [17, 48.52]
  - - [4096, 256, 1, 512, 4096, 4096, 512, 512]
    - [25, 81.24]
  - - [4096, 256, 1, 1024, 4096, 4096, 1024, 1024]
    - [23, 121.57]
  - - [4096, 256, 1, 2048, 4096, 4096, 2048, 2048]
    - [25, 159.97]
  - - [4096, 256, 1, 4096, 4096, 4096, 4096, 4096]
    - [66, 177.66]
  - - [4096, 256, 1, 8192, 4096, 4096, 8192, 8192]
    - [92, 194.73]
  - - [4096, 512, 1, 128, 4096, 4096, 128, 128]
    - [52, 44.38]
  - - [4096, 512, 1, 256, 4096, 4096, 256, 256]
    - [13, 77.5]
  - - [4096, 512, 1, 512, 4096, 4096, 512, 512]
    - [13, 125.66]
  - - [4096, 512, 1, 1024, 4096, 4096, 1024, 1024]
    - [13, 183.57]
  - - [4096, 512, 1, 2048, 4096, 4096, 2048, 2048]
    - [55, 230.39]
  - - [4096, 512, 1, 4096, 4096, 4096, 4096, 4096]
    - [54, 238.9]
  - - [4096, 512, 1, 8192, 4096, 4096, 8192, 8192]
    - [63, 255.94]
  - - [4096, 1024, 1, 128, 4096, 4096, 128, 128]
    - [10, 60.77]
  - - [4096, 1024, 1, 256, 4096, 4096, 256, 256]
    - [10, 106.41]
  - - [4096, 1024, 1, 512, 4096, 4096, 512, 512]
    - [10, 169.21]
  - - [4096, 1024, 1, 1024, 4096, 4096, 1024, 1024]
    - [11, 225.08]
  - - [4096, 1024, 1, 2048, 4096, 4096, 2048, 2048]
    - [45, 271.55]
  - - [4096, 1024, 1, 4096, 4096, 4096, 4096, 4096]
    - [44, 274.3]
  - - [4096, 1024, 1, 8192, 4096, 4096, 8192, 8192]
    - [60, 267.17]
  - - [4096, 2048, 1, 128, 4096, 4096, 128, 128]
    - [2, 75.39]
  - - [4096, 2048, 1, 256, 4096, 4096, 256, 256]
    - [1, 128.4]
  - - [4096, 2048, 1, 512, 4096, 4096, 512, 512]
    - [1, 190.64]
  - - [4096, 2048, 1, 1024, 4096, 4096, 1024, 1024]
    - [6, 247.12]
  - - [4096, 2048, 1, 2048, 4096, 4096, 2048, 2048]
    - [3, 279.27]
  - - [4096, 2048, 1, 4096, 4096, 4096, 4096, 4096]
    - [51, 283.08]
  - - [4096, 2048, 1, 8192, 4096, 4096, 8192, 8192]
    - [46, 306.16]
  - - [4096, 4096, 1, 128, 4096, 4096, 128, 128]
    - [1, 82.49]
  - - [4096, 4096, 1, 256, 4096, 4096, 256, 256]
    - [6, 138.29]
  - - [4096, 4096, 1, 512, 4096, 4096, 512, 512]
    - [2, 196.74]
  - - [4096, 4096, 1, 1024, 4096, 4096, 1024, 1024]
    - [53, 248.45]
  - - [4096, 4096, 1, 2048, 4096, 4096, 2048, 2048]
    - [42, 274.47]
  - - [4096, 4096, 1, 4096, 4096, 4096, 4096, 4096]
    - [43, 287.52]
  - - [4096, 4096, 1, 8192, 4096, 4096, 8192, 8192]
    - [43, 327.95]
  - - [4096, 8192, 1, 128, 4096, 4096, 128, 128]
    - [36, 110.55]
  - - [4096, 8192, 1, 256, 4096, 4096, 256, 256]
    - [38, 178.72]
  - - [4096, 8192, 1, 512, 4096, 4096, 512, 512]
    - [41, 243.57]
  - - [4096, 8192, 1, 1024, 4096, 4096, 1024, 1024]
    - [39, 280.92]
  - - [4096, 8192, 1, 2048, 4096, 4096, 2048, 2048]
    - [41, 309.06]
  - - [4096, 8192, 1, 4096, 4096, 4096, 4096, 4096]
    - [41, 338.09]
  - - [4096, 8192, 1, 8192, 4096, 4096, 8192, 8192]
    - [41, 385.15]
  - - [8192, 128, 1, 128, 8192, 8192, 128, 128]
    - [22, 28.06]
  - - [8192, 128, 1, 256, 8192, 8192, 256, 256]
    - [21, 50.3]
  - - [8192, 128, 1, 512, 8192, 8192, 512, 512]
    - [21, 82.6]
  - - [8192, 128, 1, 1024, 8192, 8192, 1024, 1024]
    - [24, 122.67]
  - - [8192, 128, 1, 2048, 8192, 8192, 2048, 2048]
    - [24, 160.65]
  - - [8192, 128, 1, 4096, 8192, 8192, 4096, 4096]
    - [92, 170.9]
  - - [8192, 128, 1, 8192, 8192, 8192, 8192, 8192]
    - [90, 192.2]
  - - [8192, 256, 1, 128, 8192, 8192, 128, 128]
    - [13, 43.98]
  - - [8192, 256, 1, 256, 8192, 8192, 256, 256]
    - [13, 78.22]
  - - [8192, 256, 1, 512, 8192, 8192, 512, 512]
    - [13, 125.86]
  - - [8192, 256, 1, 1024, 8192, 8192, 1024, 1024]
    - [14, 181.97]
  - - [8192, 256, 1, 2048, 8192, 8192, 2048, 2048]
    - [55, 228.76]
  - - [8192, 256, 1, 4096, 8192, 8192, 4096, 4096]
    - [64, 231.99]
  - - [8192, 256, 1, 8192, 8192, 8192, 8192, 8192]
    - [53, 249.34]
  - - [8192, 512, 1, 128, 8192, 8192, 128, 128]
    - [10, 61.21]
  - - [8192, 512, 1, 256, 8192, 8192, 256, 256]
    - [12, 105.45]
  - - [8192, 512, 1, 512, 8192, 8192, 512, 512]
    - [12, 167.43]
  - - [8192, 512, 1, 1024, 8192, 8192, 1024, 1024]
    - [58, 250.48]
  - - [8192, 512, 1, 2048, 8192, 8192, 2048, 2048]
    - [45, 263.01]
  - - [8192, 512, 1, 4096, 8192, 8192, 4096, 4096]
    - [58, 313.92]
  - - [8192, 512, 1, 8192, 8192, 8192, 8192, 8192]
    - [59, 310.18]
  - - [8192, 1024, 1, 128, 8192, 8192, 128, 128]
    - [0, 74.22]
  - - [8192, 1024, 1, 256, 8192, 8192, 256, 256]
    - [1, 125.78]
  - - [8192, 1024, 1, 512, 8192, 8192, 512, 512]
    - [48, 189.56]
  - - [8192, 1024, 1, 1024, 8192, 8192, 1024, 1024]
    - [50, 240.3]
  - - [8192, 1024, 1, 2048, 8192, 8192, 2048, 2048]
    - [49, 321.58]
  - - [8192, 1024, 1, 4096, 8192, 8192, 4096, 4096]
    - [51, 354.66]
  - - [8192, 1024, 1, 8192, 8192, 8192, 8192, 8192]
    - [51, 378.16]
  - - [8192, 2048, 1, 128, 8192, 8192, 128, 128]
    - [1, 81.84]
  - - [8192, 2048, 1, 256, 8192, 8192, 256, 256]
    - [51, 137.23]
  - - [8192, 2048, 1, 512, 8192, 8192, 512, 512]
    - [56, 198.31]
  - - [8192, 2048, 1, 1024, 8192, 8192, 1024, 1024]
    - [51, 268.09]
  - - [8192, 2048, 1, 2048, 8192, 8192, 2048, 2048]
    - [47, 311.13]
  - - [8192, 2048, 1, 4096, 8192, 8192, 4096, 4096]
    - [48, 342.95]
  - - [8192, 2048, 1, 8192, 8192, 8192, 8192, 8192]
    - [48, 399.13]
  - - [8192, 4096, 1, 128, 8192, 8192, 128, 128]
    - [1, 87.42]
  - - [8192, 4096, 1, 256, 8192, 8192, 256, 256]
    - [16, 150.8]
  - - [8192, 4096, 1, 512, 8192, 8192, 512, 512]
    - [9, 205.02]
  - - [8192, 4096, 1, 1024, 8192, 8192, 1024, 1024]
    - [51, 249.91]
  - - [8192, 4096, 1, 2048, 8192, 8192, 2048, 2048]
    - [48, 304.41]
  - - [8192, 4096, 1, 4096, 8192, 8192, 4096, 4096]
    - [49, 352.29]
  - - [8192, 4096, 1, 8192, 8192, 8192, 8192, 8192]
    - [49, 422.47]
  - - [8192, 8192, 1, 128, 8192, 8192, 128, 128]
    - [36, 110.65]
  - - [8192, 8192, 1, 256, 8192, 8192, 256, 256]
    - [40, 163.48]
  - - [8192, 8192, 1, 512, 8192, 8192, 512, 512]
    - [40, 217.33]
  - - [8192, 8192, 1, 1024, 8192, 8192, 1024, 1024]
    - [7, 278.98]
  - - [8192, 8192, 1, 2048, 8192, 8192, 2048, 2048]
    - [7, 327.33]
  - - [8192, 8192, 1, 4096, 8192, 8192, 4096, 4096]
    - [49, 369.89]
  - - [8192, 8192, 1, 8192, 8192, 8192, 8192, 8192]
    - [48, 426.17]
  - - [1, 1, 1, 32, 1, 1, 32, 32]
    - [99, 0.0]
- null
- null
- ExperimentalStreamK
- GridBased
