projects/hipblaslt/library/src/amd_detail/rocblaslt/src/Tensile/Logic/asm_full/aquavanjaram/gfx942_228cu/StreamK/aquavanjaram942_Cijk_Ailk_Bljk_HSS_BH_Bias_HAS_SAV_UserArgs.yaml
- {MinimumRequiredVersion: 4.33.0}
- aquavanjaram942
- {Architecture: gfx942, CUCount: 228}
- [Device 0049, Device 0050]
    SolutionIndex: 0
    SolutionNameMin: Cijk_Ailk_Bljk_HSS_BH_Bias_HAS_SAV_UserArgs_MT256x256x32_MI16x16x1_SN_LDSB1_CLR1_GRVWA4_GSU0_GSUC0_GSUWGMRR0_K1_LBSPPA2048_LBSPPB512_LPA0_MIWT8_8_PLR1_SU0_SUM0_SUS64_VWA8_VWB8_WGM1_WGMXCC1_WGMXCCGn1
    SolutionIndex: 1
    SolutionNameMin: Cijk_Ailk_Bljk_HSS_BH_Bias_HAS_SAV_UserArgs_MT256x256x32_MI16x16x1_SN_LDSB1_CLR1_GRVWA4_GSU0_GSUC0_GSUWGMRR0_K1_LBSPPA2048_LBSPPB512_LPA0_MIWT8_8_PLR1_SU0_SUM0_SUS64_VWA8_VWB8_WGM1_WGMXCC1_WGMXCCGn1
    SolutionIndex: 2
    SolutionNameMin: Cijk_Ailk_Bljk_HSS_BH_Bias_HAS_SAV_UserArgs_MT256x256x32_MI16x16x1_SN_LDSB1_CLR1_GRVWA8_GSU0_GSUC0_GSUWGMRR0_K1_LBSPPA2048_LBSPPB512_LPA0_MIWT8_8_PLR1_SU0_SUM0_SUS64_VWA8_VWB8_WGM1_WGMXCC1_WGMXCCGn1
    SolutionIndex: 3
    SolutionNameMin: Cijk_Ailk_Bljk_HSS_BH_Bias_HAS_SAV_UserArgs_MT256x256x32_MI16x16x1_SN_LDSB1_CLR1_GRVWA8_GSU0_GSUC0_GSUWGMRR0_K1_LBSPPA4096_LBSPPB512_LPA0_MIWT8_8_PLR1_SU0_SUM0_SUS64_VWA8_VWB8_WGM1_WGMXCC1_WGMXCCGn1
    SolutionIndex: 4
    SolutionNameMin: Cijk_Ailk_Bljk_HSS_BH_Bias_HAS_SAV_UserArgs_MT256x256x32_MI16x16x1_SN_LDSB1_CLR1_GRVWA8_GSU0_GSUC0_GSUWGMRR0_K1_LBSPPA4096_LBSPPB512_LPA0_MIWT8_8_PLR1_SU0_SUM0_SUS64_VWA8_VWB8_WGM1_WGMXCC1_WGMXCCGn1
    SolutionIndex: 5
    SolutionNameMin: Cijk_Ailk_Bljk_HSS_BH_Bias_HAS_SAV_UserArgs_MT256x256x32_MI16x16x1_SN_LDSB1_CLR1_GRVWA2_GSU0_GSUC0_GSUWGMRR0_K1_LBSPPA2048_LBSPPB512_LPA0_MIWT8_8_PLR1_SU0_SUM0_SUS64_VWA8_VWB8_WGM4_WGMXCC1_WGMXCCGn1
    SolutionIndex: 6
    SolutionNameMin: Cijk_Ailk_Bljk_HSS_BH_Bias_HAS_SAV_UserArgs_MT256x256x32_MI16x16x1_SN_LDSB1_CLR1_GRVWA8_GSU0_GSUC0_GSUWGMRR0_K1_LBSPPA2048_LBSPPB512_LPA0_MIWT8_8_PLR1_SU0_SUM0_SUS64_VWA8_VWB8_WGM4_WGMXCC1_WGMXCCGn1
    SolutionIndex: 7
    SolutionNameMin: Cijk_Ailk_Bljk_HSS_BH_Bias_HAS_SAV_UserArgs_MT256x256x32_MI16x16x1_SN_LDSB1_CLR1_GRVWA8_GSU0_GSUC0_GSUWGMRR0_K1_LBSPPA2048_LBSPPB512_LPA0_MIWT8_8_PLR1_SU0_SUM0_SUS64_VWA8_VWB8_WGM4_WGMXCC1_WGMXCCGn1
    SolutionIndex: 8
    SolutionNameMin: Cijk_Ailk_Bljk_HSS_BH_Bias_HAS_SAV_UserArgs_MT256x256x32_MI16x16x1_SN_LDSB1_CLR1_GRVWA2_GSU0_GSUC0_GSUWGMRR0_K1_LBSPPA2048_LBSPPB512_LPA0_MIWT8_8_PLR1_SU0_SUM0_SUS64_VWA8_VWB8_WGM6_WGMXCC1_WGMXCCGn1
    SolutionIndex: 9
    SolutionNameMin: Cijk_Ailk_Bljk_HSS_BH_Bias_HAS_SAV_UserArgs_MT256x256x32_MI16x16x1_SN_LDSB1_CLR1_GRVWA8_GSU0_GSUC0_GSUWGMRR0_K1_LBSPPA2048_LBSPPB512_LPA0_MIWT8_8_PLR1_SU0_SUM0_SUS64_VWA8_VWB8_WGM6_WGMXCC1_WGMXCCGn1
    SolutionIndex: 10
    SolutionNameMin: Cijk_Ailk_Bljk_HSS_BH_Bias_HAS_SAV_UserArgs_MT256x256x32_MI16x16x1_SN_LDSB1_CLR1_GRVWA8_GSU0_GSUC0_GSUWGMRR0_K1_LBSPPA2048_LBSPPB512_LPA0_MIWT8_8_PLR1_SU0_SUM0_SUS64_VWA8_VWB8_WGM6_WGMXCC1_WGMXCCGn1
    SolutionIndex: 11
    SolutionNameMin: Cijk_Ailk_Bljk_HSS_BH_Bias_HAS_SAV_UserArgs_MT256x256x32_MI16x16x1_SN_LDSB1_CLR1_GRVWA4_GSU0_GSUC0_GSUWGMRR0_K1_LBSPPA2048_LBSPPB512_LPA0_MIWT8_8_PLR1_SU0_SUM0_SUS64_VWA8_VWB8_WGM6_WGMXCC1_WGMXCCGn1
    SolutionIndex: 12
    SolutionNameMin: Cijk_Ailk_Bljk_HSS_BH_Bias_HAS_SAV_UserArgs_MT256x256x32_MI16x16x1_SN_LDSB1_CLR1_GRVWA8_GSU0_GSUC0_GSUWGMRR0_K1_LBSPPA2048_LBSPPB512_LPA0_MIWT8_8_PLR1_SU0_SUM0_SUS64_VWA8_VWB8_WGM8_WGMXCC1_WGMXCCGn1
    SolutionIndex: 13
    SolutionNameMin: Cijk_Ailk_Bljk_HSS_BH_Bias_HAS_SAV_UserArgs_MT128x256x32_MI16x16x1_SN_LDSB1_CLR1_GRVWA8_GSU0_GSUC0_GSUWGMRR0_K1_LBSPPA1024_LBSPPB512_LPA0_MIWT4_8_PLR1_SU0_SUM0_SUS64_VWA4_VWB8_WGM1_WGMXCC1_WGMXCCGn1
    SolutionIndex: 14
    SolutionNameMin: Cijk_Ailk_Bljk_HSS_BH_Bias_HAS_SAV_UserArgs_MT128x256x32_MI16x16x1_SN_LDSB1_CLR1_GRVWA2_GSU0_GSUC0_GSUWGMRR0_K1_LBSPPA2048_LBSPPB512_LPA0_MIWT4_8_PLR1_SU0_SUM0_SUS64_VWA4_VWB8_WGM1_WGMXCC1_WGMXCCGn1
    SolutionIndex: 15
    SolutionNameMin: Cijk_Ailk_Bljk_HSS_BH_Bias_HAS_SAV_UserArgs_MT128x256x32_MI16x16x1_SN_LDSB1_CLR1_GRVWA8_GSU0_GSUC0_GSUWGMRR0_K1_LBSPPA2048_LBSPPB512_LPA0_MIWT4_8_PLR1_SU0_SUM0_SUS64_VWA4_VWB8_WGM1_WGMXCC1_WGMXCCGn1
    SolutionIndex: 16
    SolutionNameMin: Cijk_Ailk_Bljk_HSS_BH_Bias_HAS_SAV_UserArgs_MT128x256x32_MI16x16x1_SN_LDSB1_CLR1_GRVWA8_GSU0_GSUC0_GSUWGMRR0_K1_LBSPPA1024_LBSPPB512_LPA0_MIWT4_8_PLR1_SU0_SUM0_SUS64_VWA4_VWB8_WGM4_WGMXCC1_WGMXCCGn1
    SolutionIndex: 17
    SolutionNameMin: Cijk_Ailk_Bljk_HSS_BH_Bias_HAS_SAV_UserArgs_MT128x256x32_MI16x16x1_SN_LDSB1_CLR1_GRVWA2_GSU0_GSUC0_GSUWGMRR0_K1_LBSPPA1024_LBSPPB512_LPA0_MIWT4_8_PLR1_SU0_SUM0_SUS64_VWA4_VWB8_WGM8_WGMXCC1_WGMXCCGn1
    SolutionIndex: 18
    SolutionNameMin: Cijk_Ailk_Bljk_HSS_BH_Bias_HAS_SAV_UserArgs_MT256x128x32_MI16x16x1_SN_LDSB1_CLR1_GRVWA8_GSU0_GSUC0_GSUWGMRR0_K1_LBSPPA2048_LBSPPB256_LPA0_MIWT8_4_PLR1_SU0_SUM0_SUS64_VWA8_VWB4_WGM1_WGMXCC1_WGMXCCGn1
    SolutionIndex: 19
    SolutionNameMin: Cijk_Ailk_Bljk_HSS_BH_Bias_HAS_SAV_UserArgs_MT256x128x32_MI16x16x1_SN_LDSB1_CLR1_GRVWA8_GSU0_GSUC0_GSUWGMRR0_K1_LBSPPA2048_LBSPPB256_LPA0_MIWT8_4_PLR1_SU0_SUM0_SUS64_VWA8_VWB4_WGM4_WGMXCC1_WGMXCCGn1
    SolutionIndex: 20
    SolutionNameMin: Cijk_Ailk_Bljk_HSS_BH_Bias_HAS_SAV_UserArgs_MT256x128x32_MI16x16x1_SN_LDSB1_CLR1_GRVWA8_GSU0_GSUC0_GSUWGMRR0_K1_LBSPPA2048_LBSPPB256_LPA0_MIWT8_4_PLR1_SU0_SUM0_SUS64_VWA8_VWB4_WGM4_WGMXCC1_WGMXCCGn1
    SolutionIndex: 21
    SolutionNameMin: Cijk_Ailk_Bljk_HSS_BH_Bias_HAS_SAV_UserArgs_MT256x128x32_MI16x16x1_SN_LDSB1_CLR1_GRVWA8_GSU0_GSUC0_GSUWGMRR0_K1_LBSPPA2048_LBSPPB256_LPA0_MIWT8_4_PLR1_SU0_SUM0_SUS64_VWA8_VWB4_WGM4_WGMXCC1_WGMXCCGn1
    SolutionIndex: 22
    SolutionNameMin: Cijk_Ailk_Bljk_HSS_BH_Bias_HAS_SAV_UserArgs_MT256x128x32_MI16x16x1_SN_LDSB1_CLR1_GRVWA8_GSU0_GSUC0_GSUWGMRR0_K1_LBSPPA2048_LBSPPB256_LPA0_MIWT8_4_PLR1_SU0_SUM0_SUS64_VWA8_VWB4_WGM6_WGMXCC1_WGMXCCGn1
    SolutionIndex: 23
    SolutionNameMin: Cijk_Ailk_Bljk_HSS_BH_Bias_HAS_SAV_UserArgs_MT256x128x32_MI16x16x1_SN_LDSB1_CLR1_GRVWA8_GSU0_GSUC0_GSUWGMRR0_K1_LBSPPA2048_LBSPPB256_LPA0_MIWT8_4_PLR1_SU0_SUM0_SUS64_VWA8_VWB4_WGM8_WGMXCC1_WGMXCCGn1
    SolutionIndex: 24
    SolutionNameMin: Cijk_Ailk_Bljk_HSS_BH_Bias_HAS_SAV_UserArgs_MT256x128x32_MI16x16x1_SN_LDSB1_CLR1_GRVWA8_GSU0_GSUC0_GSUWGMRR0_K1_LBSPPA2048_LBSPPB256_LPA0_MIWT8_4_PLR1_SU0_SUM0_SUS64_VWA8_VWB4_WGM8_WGMXCC1_WGMXCCGn1
    SolutionIndex: 25
    SolutionNameMin: Cijk_Ailk_Bljk_HSS_BH_Bias_HAS_SAV_UserArgs_MT256x128x32_MI16x16x1_SN_LDSB1_CLR1_GRVWA8_GSU0_GSUC0_GSUWGMRR0_K1_LBSPPA2048_LBSPPB256_LPA0_MIWT8_4_PLR1_SU0_SUM0_SUS64_VWA8_VWB4_WGM8_WGMXCC1_WGMXCCGn1
    SolutionIndex: 26
    SolutionNameMin: Cijk_Ailk_Bljk_HSS_BH_Bias_HAS_SAV_UserArgs_MT128x128x32_MI16x16x1_SN_LDSB1_CLR1_GRVWA2_GSU0_GSUC0_GSUWGMRR0_K1_LBSPPA1024_LBSPPB256_LPA0_MIWT4_4_PLR1_SU0_SUM0_SUS64_VWA4_VWB4_WGM1_WGMXCC1_WGMXCCGn1
    SolutionIndex: 27
    SolutionNameMin: Cijk_Ailk_Bljk_HSS_BH_Bias_HAS_SAV_UserArgs_MT128x128x32_MI16x16x1_SN_LDSB1_CLR1_GRVWA8_GSU0_GSUC0_GSUWGMRR0_K1_LBSPPA1024_LBSPPB256_LPA0_MIWT4_4_PLR1_SU0_SUM0_SUS64_VWA4_VWB4_WGM1_WGMXCC1_WGMXCCGn1
    SolutionIndex: 28
    SolutionNameMin: Cijk_Ailk_Bljk_HSS_BH_Bias_HAS_SAV_UserArgs_MT128x128x32_MI16x16x1_SN_LDSB1_CLR1_GRVWA2_GSU0_GSUC0_GSUWGMRR0_K1_LBSPPA1024_LBSPPB256_LPA0_MIWT4_4_PLR1_SU0_SUM0_SUS64_VWA4_VWB4_WGM4_WGMXCC1_WGMXCCGn1
    SolutionIndex: 29
    SolutionNameMin: Cijk_Ailk_Bljk_HSS_BH_Bias_HAS_SAV_UserArgs_MT128x128x32_MI16x16x1_SN_LDSB1_CLR1_GRVWA8_GSU0_GSUC0_GSUWGMRR0_K1_LBSPPA1024_LBSPPB256_LPA0_MIWT4_4_PLR1_SU0_SUM0_SUS64_VWA4_VWB4_WGM4_WGMXCC1_WGMXCCGn1
    SolutionIndex: 30
    SolutionNameMin: Cijk_Ailk_Bljk_HSS_BH_Bias_HAS_SAV_UserArgs_MT128x128x32_MI16x16x1_SN_LDSB1_CLR1_GRVWA8_GSU0_GSUC0_GSUWGMRR0_K1_LBSPPA2048_LBSPPB256_LPA0_MIWT4_4_PLR1_SU0_SUM0_SUS64_VWA4_VWB4_WGM4_WGMXCC1_WGMXCCGn1
    SolutionIndex: 31
    SolutionNameMin: Cijk_Ailk_Bljk_HSS_BH_Bias_HAS_SAV_UserArgs_MT128x128x32_MI16x16x1_SN_LDSB1_CLR1_GRVWA2_GSU0_GSUC0_GSUWGMRR0_K1_LBSPPA2048_LBSPPB256_LPA0_MIWT4_4_PLR1_SU0_SUM0_SUS64_VWA4_VWB4_WGM6_WGMXCC1_WGMXCCGn1
    SolutionIndex: 32
    SolutionNameMin: Cijk_Ailk_Bljk_HSS_BH_Bias_HAS_SAV_UserArgs_MT128x128x32_MI16x16x1_SN_LDSB1_CLR1_GRVWA4_GSU0_GSUC0_GSUWGMRR0_K1_LBSPPA1024_LBSPPB256_LPA0_MIWT4_4_PLR1_SU0_SUM0_SUS64_VWA4_VWB4_WGM8_WGMXCC1_WGMXCCGn1
    SolutionIndex: 33
    SolutionNameMin: Cijk_Ailk_Bljk_HSS_BH_Bias_HAS_SAV_UserArgs_MT128x64x32_MI16x16x1_SN_LDSB0_CLR1_GRVWA2_GSU0_GSUC0_GSUWGMRR0_K1_LBSPPA1024_LBSPPB128_LPA0_MIWT4_2_PLR1_SU0_SUM0_SUS64_VWA4_VWB2_WGM1_WGMXCC1_WGMXCCGn1
    SolutionIndex: 34
    SolutionNameMin: Cijk_Ailk_Bljk_HSS_BH_Bias_HAS_SAV_UserArgs_MT128x64x32_MI16x16x1_SN_LDSB0_CLR1_GRVWA8_GSU0_GSUC0_GSUWGMRR0_K1_LBSPPA1024_LBSPPB128_LPA0_MIWT4_2_PLR1_SU0_SUM0_SUS64_VWA4_VWB2_WGM1_WGMXCC1_WGMXCCGn1
    SolutionIndex: 35
    SolutionNameMin: Cijk_Ailk_Bljk_HSS_BH_Bias_HAS_SAV_UserArgs_MT128x64x32_MI16x16x1_SN_LDSB0_CLR1_GRVWA2_GSU0_GSUC0_GSUWGMRR0_K1_LBSPPA1024_LBSPPB128_LPA0_MIWT4_2_PLR1_SU0_SUM0_SUS64_VWA4_VWB2_WGM6_WGMXCC1_WGMXCCGn1
    SolutionIndex: 36
    SolutionNameMin: Cijk_Ailk_Bljk_HSS_BH_Bias_HAS_SAV_UserArgs_MT128x64x32_MI16x16x1_SN_LDSB0_CLR1_GRVWA8_GSU0_GSUC0_GSUWGMRR0_K1_LBSPPA1024_LBSPPB128_LPA0_MIWT4_2_PLR1_SU0_SUM0_SUS64_VWA4_VWB2_WGM6_WGMXCC1_WGMXCCGn1
    SolutionIndex: 37
    SolutionNameMin: Cijk_Ailk_Bljk_HSS_BH_Bias_HAS_SAV_UserArgs_MT64x64x32_MI16x16x1_SN_LDSB0_CLR1_GRVWA2_GSU0_GSUC0_GSUWGMRR0_K1_LBSPPA512_LBSPPB128_LPA32_MIWT2_2_PLR1_SU0_SUM0_SUS64_VWA2_VWB2_WGM1_WGMXCC1_WGMXCCGn1
    SolutionIndex: 38
    SolutionNameMin: Cijk_Ailk_Bljk_HSS_BH_Bias_HAS_SAV_UserArgs_MT64x64x32_MI16x16x1_SN_LDSB0_CLR1_GRVWA2_GSU0_GSUC0_GSUWGMRR0_K1_LBSPPA512_LBSPPB128_LPA32_MIWT2_2_PLR1_SU0_SUM0_SUS64_VWA2_VWB2_WGM4_WGMXCC1_WGMXCCGn1
    SolutionIndex: 39
    SolutionNameMin: Cijk_Ailk_Bljk_HSS_BH_Bias_HAS_SAV_UserArgs_MT64x64x32_MI16x16x1_SN_LDSB0_CLR1_GRVWA2_GSU0_GSUC0_GSUWGMRR0_K1_LBSPPA512_LBSPPB128_LPA32_MIWT2_2_PLR1_SU0_SUM0_SUS64_VWA2_VWB2_WGM8_WGMXCC1_WGMXCCGn1
    SolutionIndex: 40
    SolutionNameMin: Cijk_Ailk_Bljk_HSS_BH_Bias_HAS_SAV_UserArgs_MT128x256x64_MI16x16x1_SN_LDSB1_CLR1_GRVWA2_GSU0_GSUC0_GSUWGMRR0_K1_LBSPPA2048_LBSPPB1024_LPA0_MIWT4_8_PLR1_SU0_SUM0_SUS128_VWA4_VWB8_WGM1_WGMXCC1_WGMXCCGn1
    SolutionIndex: 41
    SolutionNameMin: Cijk_Ailk_Bljk_HSS_BH_Bias_HAS_SAV_UserArgs_MT128x256x64_MI16x16x1_SN_LDSB1_CLR1_GRVWA4_GSU0_GSUC0_GSUWGMRR0_K1_LBSPPA2048_LBSPPB1024_LPA0_MIWT4_8_PLR1_SU0_SUM0_SUS128_VWA4_VWB8_WGM1_WGMXCC1_WGMXCCGn1
    SolutionIndex: 42
    SolutionNameMin: Cijk_Ailk_Bljk_HSS_BH_Bias_HAS_SAV_UserArgs_MT128x256x64_MI16x16x1_SN_LDSB1_CLR1_GRVWA8_GSU0_GSUC0_GSUWGMRR0_K1_LBSPPA2048_LBSPPB1024_LPA0_MIWT4_8_PLR1_SU0_SUM0_SUS128_VWA4_VWB8_WGM1_WGMXCC1_WGMXCCGn1
    SolutionIndex: 43
    SolutionNameMin: Cijk_Ailk_Bljk_HSS_BH_Bias_HAS_SAV_UserArgs_MT128x256x64_MI16x16x1_SN_LDSB1_CLR1_GRVWA2_GSU0_GSUC0_GSUWGMRR0_K1_LBSPPA2048_LBSPPB1024_LPA0_MIWT4_8_PLR1_SU0_SUM0_SUS128_VWA4_VWB8_WGM4_WGMXCC1_WGMXCCGn1
    SolutionIndex: 44
    SolutionNameMin: Cijk_Ailk_Bljk_HSS_BH_Bias_HAS_SAV_UserArgs_MT128x256x64_MI16x16x1_SN_LDSB1_CLR1_GRVWA8_GSU0_GSUC0_GSUWGMRR0_K1_LBSPPA2048_LBSPPB1024_LPA0_MIWT4_8_PLR1_SU0_SUM0_SUS128_VWA4_VWB8_WGM4_WGMXCC1_WGMXCCGn1
    SolutionIndex: 45
    SolutionNameMin: Cijk_Ailk_Bljk_HSS_BH_Bias_HAS_SAV_UserArgs_MT128x256x64_MI16x16x1_SN_LDSB1_CLR1_GRVWA4_GSU0_GSUC0_GSUWGMRR0_K1_LBSPPA2048_LBSPPB1024_LPA0_MIWT4_8_PLR1_SU0_SUM0_SUS128_VWA4_VWB8_WGM6_WGMXCC1_WGMXCCGn1
    SolutionIndex: 46
    SolutionNameMin: Cijk_Ailk_Bljk_HSS_BH_Bias_HAS_SAV_UserArgs_MT128x256x64_MI16x16x1_SN_LDSB1_CLR1_GRVWA8_GSU0_GSUC0_GSUWGMRR0_K1_LBSPPA2048_LBSPPB1024_LPA0_MIWT4_8_PLR1_SU0_SUM0_SUS128_VWA4_VWB8_WGM6_WGMXCC1_WGMXCCGn1
    SolutionIndex: 47
    SolutionNameMin: Cijk_Ailk_Bljk_HSS_BH_Bias_HAS_SAV_UserArgs_MT128x256x64_MI16x16x1_SN_LDSB1_CLR1_GRVWA2_GSU0_GSUC0_GSUWGMRR0_K1_LBSPPA2048_LBSPPB1024_LPA0_MIWT4_8_PLR1_SU0_SUM0_SUS128_VWA4_VWB8_WGM8_WGMXCC1_WGMXCCGn1
    SolutionIndex: 48
    SolutionNameMin: Cijk_Ailk_Bljk_HSS_BH_Bias_HAS_SAV_UserArgs_MT128x256x64_MI16x16x1_SN_LDSB1_CLR1_GRVWA8_GSU0_GSUC0_GSUWGMRR0_K1_LBSPPA2048_LBSPPB1024_LPA0_MIWT4_8_PLR1_SU0_SUM0_SUS128_VWA4_VWB8_WGM8_WGMXCC1_WGMXCCGn1
    SolutionIndex: 49
    SolutionNameMin: Cijk_Ailk_Bljk_HSS_BH_Bias_HAS_SAV_UserArgs_MT256x128x64_MI16x16x1_SN_LDSB1_CLR1_GRVWA8_GSU0_GSUC0_GSUWGMRR0_K1_LBSPPA4096_LBSPPB512_LPA0_MIWT8_4_PLR1_SU0_SUM0_SUS128_VWA8_VWB4_WGM1_WGMXCC1_WGMXCCGn1
    SolutionIndex: 50
    SolutionNameMin: Cijk_Ailk_Bljk_HSS_BH_Bias_HAS_SAV_UserArgs_MT256x128x64_MI16x16x1_SN_LDSB1_CLR1_GRVWA8_GSU0_GSUC0_GSUWGMRR0_K1_LBSPPA4096_LBSPPB512_LPA0_MIWT8_4_PLR1_SU0_SUM0_SUS128_VWA8_VWB4_WGM8_WGMXCC1_WGMXCCGn1
    SolutionIndex: 51
    SolutionNameMin: Cijk_Ailk_Bljk_HSS_BH_Bias_HAS_SAV_UserArgs_MT128x128x64_MI16x16x1_SN_LDSB1_CLR1_GRVWA2_GSU0_GSUC0_GSUWGMRR0_K1_LBSPPA1024_LBSPPB512_LPA0_MIWT4_4_PLR1_SU0_SUM0_SUS128_VWA4_VWB4_WGM1_WGMXCC1_WGMXCCGn1
    SolutionIndex: 52
    SolutionNameMin: Cijk_Ailk_Bljk_HSS_BH_Bias_HAS_SAV_UserArgs_MT128x128x64_MI16x16x1_SN_LDSB1_CLR1_GRVWA8_GSU0_GSUC0_GSUWGMRR0_K1_LBSPPA1024_LBSPPB512_LPA0_MIWT4_4_PLR1_SU0_SUM0_SUS128_VWA4_VWB4_WGM1_WGMXCC1_WGMXCCGn1
    SolutionIndex: 53
    SolutionNameMin: Cijk_Ailk_Bljk_HSS_BH_Bias_HAS_SAV_UserArgs_MT128x128x64_MI16x16x1_SN_LDSB1_CLR1_GRVWA4_GSU0_GSUC0_GSUWGMRR0_K1_LBSPPA2048_LBSPPB512_LPA0_MIWT4_4_PLR1_SU0_SUM0_SUS128_VWA4_VWB4_WGM1_WGMXCC1_WGMXCCGn1
    SolutionIndex: 54
    SolutionNameMin: Cijk_Ailk_Bljk_HSS_BH_Bias_HAS_SAV_UserArgs_MT128x128x64_MI16x16x1_SN_LDSB1_CLR1_GRVWA8_GSU0_GSUC0_GSUWGMRR0_K1_LBSPPA2048_LBSPPB512_LPA0_MIWT4_4_PLR1_SU0_SUM0_SUS128_VWA4_VWB4_WGM1_WGMXCC1_WGMXCCGn1
    SolutionIndex: 55
    SolutionNameMin: Cijk_Ailk_Bljk_HSS_BH_Bias_HAS_SAV_UserArgs_MT128x128x64_MI16x16x1_SN_LDSB1_CLR1_GRVWA2_GSU0_GSUC0_GSUWGMRR0_K1_LBSPPA2048_LBSPPB512_LPA0_MIWT4_4_PLR1_SU0_SUM0_SUS128_VWA4_VWB4_WGM4_WGMXCC1_WGMXCCGn1
    SolutionIndex: 56
    SolutionNameMin: Cijk_Ailk_Bljk_HSS_BH_Bias_HAS_SAV_UserArgs_MT128x128x64_MI16x16x1_SN_LDSB1_CLR1_GRVWA8_GSU0_GSUC0_GSUWGMRR0_K1_LBSPPA2048_LBSPPB512_LPA0_MIWT4_4_PLR1_SU0_SUM0_SUS128_VWA4_VWB4_WGM4_WGMXCC1_WGMXCCGn1
    SolutionIndex: 57
    SolutionNameMin: Cijk_Ailk_Bljk_HSS_BH_Bias_HAS_SAV_UserArgs_MT128x128x64_MI16x16x1_SN_LDSB1_CLR1_GRVWA8_GSU0_GSUC0_GSUWGMRR0_K1_LBSPPA1024_LBSPPB512_LPA0_MIWT4_4_PLR1_SU0_SUM0_SUS128_VWA4_VWB4_WGM6_WGMXCC1_WGMXCCGn1
    SolutionIndex: 58
    SolutionNameMin: Cijk_Ailk_Bljk_HSS_BH_Bias_HAS_SAV_UserArgs_MT128x128x64_MI16x16x1_SN_LDSB1_CLR1_GRVWA8_GSU0_GSUC0_GSUWGMRR0_K1_LBSPPA2048_LBSPPB512_LPA0_MIWT4_4_PLR1_SU0_SUM0_SUS128_VWA4_VWB4_WGM6_WGMXCC1_WGMXCCGn1
    SolutionIndex: 59
    SolutionNameMin: Cijk_Ailk_Bljk_HSS_BH_Bias_HAS_SAV_UserArgs_MT128x128x64_MI16x16x1_SN_LDSB1_CLR1_GRVWA2_GSU0_GSUC0_GSUWGMRR0_K1_LBSPPA2048_LBSPPB512_LPA0_MIWT4_4_PLR1_SU0_SUM0_SUS128_VWA4_VWB4_WGM6_WGMXCC1_WGMXCCGn1
    SolutionIndex: 60
    SolutionNameMin: Cijk_Ailk_Bljk_HSS_BH_Bias_HAS_SAV_UserArgs_MT128x128x64_MI16x16x1_SN_LDSB1_CLR1_GRVWA8_GSU0_GSUC0_GSUWGMRR0_K1_LBSPPA2048_LBSPPB512_LPA0_MIWT4_4_PLR1_SU0_SUM0_SUS128_VWA4_VWB4_WGM6_WGMXCC1_WGMXCCGn1
    SolutionIndex: 61
    SolutionNameMin: Cijk_Ailk_Bljk_HSS_BH_Bias_HAS_SAV_UserArgs_MT128x128x64_MI16x16x1_SN_LDSB1_CLR1_GRVWA2_GSU0_GSUC0_GSUWGMRR0_K1_LBSPPA2048_LBSPPB512_LPA0_MIWT4_4_PLR1_SU0_SUM0_SUS128_VWA4_VWB4_WGM8_WGMXCC1_WGMXCCGn1
    SolutionIndex: 62
    SolutionNameMin: Cijk_Ailk_Bljk_HSS_BH_Bias_HAS_SAV_UserArgs_MT128x128x64_MI16x16x1_SN_LDSB1_CLR1_GRVWA8_GSU0_GSUC0_GSUWGMRR0_K1_LBSPPA2048_LBSPPB512_LPA0_MIWT4_4_PLR1_SU0_SUM0_SUS128_VWA4_VWB4_WGM8_WGMXCC1_WGMXCCGn1
    SolutionIndex: 63
    SolutionNameMin: Cijk_Ailk_Bljk_HSS_BH_Bias_HAS_SAV_UserArgs_MT128x64x64_MI16x16x1_SN_LDSB1_CLR1_GRVWA4_GSU0_GSUC0_GSUWGMRR0_K1_LBSPPA1024_LBSPPB256_LPA0_MIWT4_2_PLR1_SU0_SUM0_SUS128_VWA4_VWB2_WGM1_WGMXCC1_WGMXCCGn1
    SolutionIndex: 64
    SolutionNameMin: Cijk_Ailk_Bljk_HSS_BH_Bias_HAS_SAV_UserArgs_MT128x64x64_MI16x16x1_SN_LDSB1_CLR1_GRVWA8_GSU0_GSUC0_GSUWGMRR0_K1_LBSPPA2048_LBSPPB256_LPA0_MIWT4_2_PLR1_SU0_SUM0_SUS128_VWA4_VWB2_WGM1_WGMXCC1_WGMXCCGn1
    SolutionIndex: 65
    SolutionNameMin: Cijk_Ailk_Bljk_HSS_BH_Bias_HAS_SAV_UserArgs_MT128x64x64_MI16x16x1_SN_LDSB1_CLR1_GRVWA8_GSU0_GSUC0_GSUWGMRR0_K1_LBSPPA2048_LBSPPB256_LPA0_MIWT4_2_PLR1_SU0_SUM0_SUS128_VWA4_VWB2_WGM4_WGMXCC1_WGMXCCGn1
    SolutionIndex: 66
    SolutionNameMin: Cijk_Ailk_Bljk_HSS_BH_Bias_HAS_SAV_UserArgs_MT128x64x64_MI16x16x1_SN_LDSB1_CLR1_GRVWA8_GSU0_GSUC0_GSUWGMRR0_K1_LBSPPA2048_LBSPPB256_LPA0_MIWT4_2_PLR1_SU0_SUM0_SUS128_VWA4_VWB2_WGM6_WGMXCC1_WGMXCCGn1
    SolutionIndex: 67
    SolutionNameMin: Cijk_Ailk_Bljk_HSS_BH_Bias_HAS_SAV_UserArgs_MT128x64x64_MI16x16x1_SN_LDSB1_CLR1_GRVWA2_GSU0_GSUC0_GSUWGMRR0_K1_LBSPPA2048_LBSPPB256_LPA0_MIWT4_2_PLR1_SU0_SUM0_SUS128_VWA4_VWB2_WGM8_WGMXCC1_WGMXCCGn1
    SolutionIndex: 68
    SolutionNameMin: Cijk_Ailk_Bljk_HSS_BH_Bias_HAS_SAV_UserArgs_MT128x64x64_MI16x16x1_SN_LDSB1_CLR1_GRVWA8_GSU0_GSUC0_GSUWGMRR0_K1_LBSPPA2048_LBSPPB256_LPA0_MIWT4_2_PLR1_SU0_SUM0_SUS128_VWA4_VWB2_WGM8_WGMXCC1_WGMXCCGn1
    SolutionIndex: 69
    SolutionNameMin: Cijk_Ailk_Bljk_HSS_BH_Bias_HAS_SAV_UserArgs_MT128x32x64_MI16x16x1_SN_LDSB1_CLR1_GRVWA8_GSU0_GSUC0_GSUWGMRR0_K1_LBSPPA1024_LBSPPB128_LPA0_MIWT4_1_PLR1_SU0_SUM0_SUS128_VWA4_VWB1_WGM1_WGMXCC1_WGMXCCGn1
    SolutionIndex: 70
    SolutionNameMin: Cijk_Ailk_Bljk_HSS_BH_Bias_HAS_SAV_UserArgs_MT64x64x64_MI16x16x1_SN_LDSB1_CLR1_GRVWA2_GSU0_GSUC0_GSUWGMRR0_K1_LBSPPA512_LBSPPB256_LPA32_MIWT2_2_PLR1_SU0_SUM0_SUS128_VWA2_VWB2_WGM1_WGMXCC1_WGMXCCGn1
    SolutionIndex: 71
    SolutionNameMin: Cijk_Ailk_Bljk_HSS_BH_Bias_HAS_SAV_UserArgs_MT64x64x64_MI16x16x1_SN_LDSB1_CLR1_GRVWA4_GSU0_GSUC0_GSUWGMRR0_K1_LBSPPA512_LBSPPB256_LPA32_MIWT2_2_PLR1_SU0_SUM0_SUS128_VWA2_VWB2_WGM1_WGMXCC1_WGMXCCGn1
    SolutionIndex: 72
    SolutionNameMin: Cijk_Ailk_Bljk_HSS_BH_Bias_HAS_SAV_UserArgs_MT64x64x64_MI16x16x1_SN_LDSB1_CLR1_GRVWA2_GSU0_GSUC0_GSUWGMRR0_K1_LBSPPA1024_LBSPPB256_LPA32_MIWT2_2_PLR1_SU0_SUM0_SUS128_VWA2_VWB2_WGM1_WGMXCC1_WGMXCCGn1
    SolutionIndex: 73
    SolutionNameMin: Cijk_Ailk_Bljk_HSS_BH_Bias_HAS_SAV_UserArgs_MT64x64x64_MI16x16x1_SN_LDSB1_CLR1_GRVWA2_GSU0_GSUC0_GSUWGMRR0_K1_LBSPPA1024_LBSPPB256_LPA32_MIWT2_2_PLR1_SU0_SUM0_SUS128_VWA2_VWB2_WGM4_WGMXCC1_WGMXCCGn1
    SolutionIndex: 74
    SolutionNameMin: Cijk_Ailk_Bljk_HSS_BH_Bias_HAS_SAV_UserArgs_MT64x64x64_MI16x16x1_SN_LDSB1_CLR1_GRVWA4_GSU0_GSUC0_GSUWGMRR0_K1_LBSPPA1024_LBSPPB256_LPA32_MIWT2_2_PLR1_SU0_SUM0_SUS128_VWA2_VWB2_WGM4_WGMXCC1_WGMXCCGn1
    SolutionIndex: 75
    SolutionNameMin: Cijk_Ailk_Bljk_HSS_BH_Bias_HAS_SAV_UserArgs_MT64x64x64_MI16x16x1_SN_LDSB1_CLR1_GRVWA2_GSU0_GSUC0_GSUWGMRR0_K1_LBSPPA1024_LBSPPB256_LPA32_MIWT2_2_PLR1_SU0_SUM0_SUS128_VWA2_VWB2_WGM6_WGMXCC1_WGMXCCGn1
    SolutionIndex: 76
    SolutionNameMin: Cijk_Ailk_Bljk_HSS_BH_Bias_HAS_SAV_UserArgs_MT64x64x64_MI16x16x1_SN_LDSB1_CLR1_GRVWA2_GSU0_GSUC0_GSUWGMRR0_K1_LBSPPA1024_LBSPPB256_LPA32_MIWT2_2_PLR1_SU0_SUM0_SUS128_VWA2_VWB2_WGM8_WGMXCC1_WGMXCCGn1
    SolutionIndex: 77
    SolutionNameMin: Cijk_Ailk_Bljk_HSS_BH_Bias_HAS_SAV_UserArgs_MT32x64x64_MI16x16x1_SN_LDSB0_CLR1_GRVWA2_GSU0_GSUC0_GSUWGMRR0_K1_LBSPPA256_LBSPPB256_LPA16_MIWT1_2_PLR1_SU0_SUM0_SUS128_VWA1_VWB2_WGM1_WGMXCC1_WGMXCCGn1
    SolutionIndex: 78
    SolutionNameMin: Cijk_Ailk_Bljk_HSS_BH_Bias_HAS_SAV_UserArgs_MT32x64x64_MI16x16x1_SN_LDSB0_CLR1_GRVWA2_GSU0_GSUC0_GSUWGMRR0_K1_LBSPPA512_LBSPPB256_LPA16_MIWT1_2_PLR1_SU0_SUM0_SUS128_VWA1_VWB2_WGM1_WGMXCC1_WGMXCCGn1
    SolutionIndex: 79
    SolutionNameMin: Cijk_Ailk_Bljk_HSS_BH_Bias_HAS_SAV_UserArgs_MT32x64x64_MI16x16x1_SN_LDSB0_CLR1_GRVWA2_GSU0_GSUC0_GSUWGMRR0_K1_LBSPPA512_LBSPPB256_LPA16_MIWT1_2_PLR1_SU0_SUM0_SUS128_VWA1_VWB2_WGM4_WGMXCC1_WGMXCCGn1
    SolutionIndex: 80
    SolutionNameMin: Cijk_Ailk_Bljk_HSS_BH_Bias_HAS_SAV_UserArgs_MT32x64x64_MI16x16x1_SN_LDSB0_CLR1_GRVWA2_GSU0_GSUC0_GSUWGMRR0_K1_LBSPPA512_LBSPPB256_LPA16_MIWT1_2_PLR1_SU0_SUM0_SUS128_VWA1_VWB2_WGM6_WGMXCC1_WGMXCCGn1
    SolutionIndex: 81
    SolutionNameMin: Cijk_Ailk_Bljk_HSS_BH_Bias_HAS_SAV_UserArgs_MT32x64x64_MI16x16x1_SN_LDSB0_CLR1_GRVWA2_GSU0_GSUC0_GSUWGMRR0_K1_LBSPPA512_LBSPPB256_LPA16_MIWT1_2_PLR1_SU0_SUM0_SUS128_VWA1_VWB2_WGM8_WGMXCC1_WGMXCCGn1
    SolutionIndex: 82
    SolutionNameMin: Cijk_Ailk_Bljk_HSS_BH_Bias_HAS_SAV_UserArgs_MT64x32x64_MI16x16x1_SN_LDSB0_CLR1_GRVWA2_GSU0_GSUC0_GSUWGMRR0_K1_LBSPPA1024_LBSPPB128_LPA32_MIWT2_1_PLR1_SU0_SUM0_SUS128_VWA2_VWB1_WGM1_WGMXCC1_WGMXCCGn1
    SolutionIndex: 83
    SolutionNameMin: Cijk_Ailk_Bljk_HSS_BH_Bias_HAS_SAV_UserArgs_MT64x32x64_MI16x16x1_SN_LDSB0_CLR1_GRVWA8_GSU0_GSUC0_GSUWGMRR0_K1_LBSPPA1024_LBSPPB128_LPA32_MIWT2_1_PLR1_SU0_SUM0_SUS128_VWA2_VWB1_WGM1_WGMXCC1_WGMXCCGn1
    SolutionIndex: 84
    SolutionNameMin: Cijk_Ailk_Bljk_HSS_BH_Bias_HAS_SAV_UserArgs_MT32x32x64_MI16x16x1_SN_LDSB0_CLR1_GRVWA2_GSU0_GSUC0_GSUWGMRR0_K1_LBSPPA256_LBSPPB128_LPA16_MIWT1_1_PLR1_SU0_SUM0_SUS128_VWA1_VWB1_WGM1_WGMXCC1_WGMXCCGn1
    SolutionIndex: 85
    SolutionNameMin: Cijk_Ailk_Bljk_HSS_BH_Bias_HAS_SAV_UserArgs_MT32x32x64_MI16x16x1_SN_LDSB0_CLR1_GRVWA2_GSU0_GSUC0_GSUWGMRR0_K1_LBSPPA512_LBSPPB128_LPA16_MIWT1_1_PLR1_SU0_SUM0_SUS128_VWA1_VWB1_WGM1_WGMXCC1_WGMXCCGn1
    SolutionIndex: 86
    SolutionNameMin: Cijk_Ailk_Bljk_HSS_BH_Bias_HAS_SAV_UserArgs_MT32x32x64_MI16x16x1_SN_LDSB0_CLR1_GRVWA8_GSU0_GSUC0_GSUWGMRR0_K1_LBSPPA512_LBSPPB128_LPA16_MIWT1_1_PLR1_SU0_SUM0_SUS128_VWA1_VWB1_WGM1_WGMXCC1_WGMXCCGn1
    SolutionIndex: 87
    SolutionNameMin: Cijk_Ailk_Bljk_HSS_BH_Bias_HAS_SAV_UserArgs_MT32x32x64_MI16x16x1_SN_LDSB0_CLR1_GRVWA2_GSU0_GSUC0_GSUWGMRR0_K1_LBSPPA512_LBSPPB128_LPA16_MIWT1_1_PLR1_SU0_SUM0_SUS128_VWA1_VWB1_WGM8_WGMXCC1_WGMXCCGn1
    SolutionIndex: 88
    SolutionNameMin: Cijk_Ailk_Bljk_HSS_BH_Bias_HAS_SAV_UserArgs_MT128x64x128_MI16x16x1_SN_LDSB1_CLR1_GRVWA8_GSU0_GSUC0_GSUWGMRR0_K1_LBSPPA2048_LBSPPB512_LPA0_MIWT4_2_PLR1_SU0_SUM0_SUS256_VWA4_VWB2_WGM1_WGMXCC1_WGMXCCGn1
    SolutionIndex: 89
    SolutionNameMin: Cijk_Ailk_Bljk_HSS_BH_Bias_HAS_SAV_UserArgs_MT128x64x128_MI16x16x1_SN_LDSB1_CLR1_GRVWA8_GSU0_GSUC0_GSUWGMRR0_K1_LBSPPA2048_LBSPPB512_LPA0_MIWT4_2_PLR1_SU0_SUM0_SUS256_VWA4_VWB2_WGM4_WGMXCC1_WGMXCCGn1
    SolutionIndex: 90
    SolutionNameMin: Cijk_Ailk_Bljk_HSS_BH_Bias_HAS_SAV_UserArgs_MT128x64x128_MI16x16x1_SN_LDSB1_CLR1_GRVWA8_GSU0_GSUC0_GSUWGMRR0_K1_LBSPPA2048_LBSPPB512_LPA0_MIWT4_2_PLR1_SU0_SUM0_SUS256_VWA4_VWB2_WGM6_WGMXCC1_WGMXCCGn1
    SolutionIndex: 91
    SolutionNameMin: Cijk_Ailk_Bljk_HSS_BH_Bias_HAS_SAV_UserArgs_MT128x64x128_MI16x16x1_SN_LDSB1_CLR1_GRVWA8_GSU0_GSUC0_GSUWGMRR0_K1_LBSPPA2048_LBSPPB512_LPA0_MIWT4_2_PLR1_SU0_SUM0_SUS256_VWA4_VWB2_WGM8_WGMXCC1_WGMXCCGn1
    SolutionIndex: 92
    SolutionNameMin: Cijk_Ailk_Bljk_HSS_BH_Bias_HAS_SAV_UserArgs_MT64x64x128_MI16x16x1_SN_LDSB1_CLR1_GRVWA8_GSU0_GSUC0_GSUWGMRR0_K1_LBSPPA1024_LBSPPB512_LPA32_MIWT2_2_PLR1_SU0_SUM0_SUS256_VWA2_VWB2_WGM1_WGMXCC1_WGMXCCGn1
    SolutionIndex: 93
    SolutionNameMin: Cijk_Ailk_Bljk_HSS_BH_Bias_HAS_SAV_UserArgs_MT64x64x128_MI16x16x1_SN_LDSB1_CLR1_GRVWA2_GSU0_GSUC0_GSUWGMRR0_K1_LBSPPA1024_LBSPPB512_LPA32_MIWT2_2_PLR1_SU0_SUM0_SUS256_VWA2_VWB2_WGM4_WGMXCC1_WGMXCCGn1
    SolutionIndex: 94
    SolutionNameMin: Cijk_Ailk_Bljk_HSS_BH_Bias_HAS_SAV_UserArgs_MT64x64x128_MI16x16x1_SN_LDSB1_CLR1_GRVWA8_GSU0_GSUC0_GSUWGMRR0_K1_LBSPPA1024_LBSPPB512_LPA32_MIWT2_2_PLR1_SU0_SUM0_SUS256_VWA2_VWB2_WGM4_WGMXCC1_WGMXCCGn1
    SolutionIndex: 95
    SolutionNameMin: Cijk_Ailk_Bljk_HSS_BH_Bias_HAS_SAV_UserArgs_MT64x64x128_MI16x16x1_SN_LDSB1_CLR1_GRVWA2_GSU0_GSUC0_GSUWGMRR0_K1_LBSPPA1024_LBSPPB512_LPA32_MIWT2_2_PLR1_SU0_SUM0_SUS256_VWA2_VWB2_WGM6_WGMXCC1_WGMXCCGn1
    SolutionIndex: 96
    SolutionNameMin: Cijk_Ailk_Bljk_HSS_BH_Bias_HAS_SAV_UserArgs_MT64x64x128_MI16x16x1_SN_LDSB1_CLR1_GRVWA8_GSU0_GSUC0_GSUWGMRR0_K1_LBSPPA1024_LBSPPB512_LPA32_MIWT2_2_PLR1_SU0_SUM0_SUS256_VWA2_VWB2_WGM6_WGMXCC1_WGMXCCGn1
    SolutionIndex: 97
    SolutionNameMin: Cijk_Ailk_Bljk_HSS_BH_Bias_HAS_SAV_UserArgs_MT64x64x128_MI16x16x1_SN_LDSB1_CLR1_GRVWA8_GSU0_GSUC0_GSUWGMRR0_K1_LBSPPA1024_LBSPPB512_LPA32_MIWT2_2_PLR1_SU0_SUM0_SUS256_VWA2_VWB2_WGM8_WGMXCC1_WGMXCCGn1
    SolutionIndex: 98
    SolutionNameMin: Cijk_Ailk_Bljk_HSS_BH_Bias_HAS_SAV_UserArgs_MT32x64x128_MI16x16x1_SN_LDSB1_CLR1_GRVWA8_GSU0_GSUC0_GSUWGMRR0_K1_LBSPPA512_LBSPPB512_LPA16_MIWT1_2_PLR1_SU0_SUM0_SUS256_VWA1_VWB2_WGM1_WGMXCC1_WGMXCCGn1
    SolutionIndex: 99
    SolutionNameMin: Cijk_Ailk_Bljk_HSS_BH_Bias_HAS_SAV_UserArgs_MT64x32x128_MI16x16x1_SN_LDSB1_CLR1_GRVWA8_GSU0_GSUC0_GSUWGMRR0_K1_LBSPPA1024_LBSPPB256_LPA32_MIWT2_1_PLR1_SU0_SUM0_SUS256_VWA2_VWB1_WGM1_WGMXCC1_WGMXCCGn1
    SolutionIndex: 100
    SolutionNameMin: Cijk_Ailk_Bljk_HSS_BH_Bias_HAS_SAV_UserArgs_MT64x32x128_MI16x16x1_SN_LDSB1_CLR1_GRVWA8_GSU0_GSUC0_GSUWGMRR0_K1_LBSPPA512_LBSPPB256_LPA32_MIWT2_1_PLR1_SU0_SUM0_SUS256_VWA2_VWB1_WGM4_WGMXCC1_WGMXCCGn1
    SolutionIndex: 101
    SolutionNameMin: Cijk_Ailk_Bljk_HSS_BH_Bias_HAS_SAV_UserArgs_MT64x32x128_MI16x16x1_SN_LDSB1_CLR1_GRVWA8_GSU0_GSUC0_GSUWGMRR0_K1_LBSPPA1024_LBSPPB256_LPA32_MIWT2_1_PLR1_SU0_SUM0_SUS256_VWA2_VWB1_WGM4_WGMXCC1_WGMXCCGn1
    SolutionIndex: 102
    SolutionNameMin: Cijk_Ailk_Bljk_HSS_BH_Bias_HAS_SAV_UserArgs_MT64x32x128_MI16x16x1_SN_LDSB1_CLR1_GRVWA2_GSU0_GSUC0_GSUWGMRR0_K1_LBSPPA1024_LBSPPB256_LPA32_MIWT2_1_PLR1_SU0_SUM0_SUS256_VWA2_VWB1_WGM6_WGMXCC1_WGMXCCGn1
    SolutionIndex: 103
    SolutionNameMin: Cijk_Ailk_Bljk_HSS_BH_Bias_HAS_SAV_UserArgs_MT64x32x128_MI16x16x1_SN_LDSB1_CLR1_GRVWA8_GSU0_GSUC0_GSUWGMRR0_K1_LBSPPA1024_LBSPPB256_LPA32_MIWT2_1_PLR1_SU0_SUM0_SUS256_VWA2_VWB1_WGM6_WGMXCC1_WGMXCCGn1
    SolutionIndex: 104
    SolutionNameMin: Cijk_Ailk_Bljk_HSS_BH_Bias_HAS_SAV_UserArgs_MT64x32x128_MI16x16x1_SN_LDSB1_CLR1_GRVWA8_GSU0_GSUC0_GSUWGMRR0_K1_LBSPPA1024_LBSPPB256_LPA32_MIWT2_1_PLR1_SU0_SUM0_SUS256_VWA2_VWB1_WGM8_WGMXCC1_WGMXCCGn1
    SolutionIndex: 105
    SolutionNameMin: Cijk_Ailk_Bljk_HSS_BH_Bias_HAS_SAV_UserArgs_MT32x32x128_MI16x16x1_SN_LDSB1_CLR1_GRVWA8_GSU0_GSUC0_GSUWGMRR0_K1_LBSPPA256_LBSPPB256_LPA16_MIWT1_1_PLR1_SU0_SUM0_SUS256_VWA1_VWB1_WGM1_WGMXCC1_WGMXCCGn1
    SolutionIndex: 106
    SolutionNameMin: Cijk_Ailk_Bljk_HSS_BH_Bias_HAS_SAV_UserArgs_MT32x32x128_MI16x16x1_SN_LDSB1_CLR1_GRVWA2_GSU0_GSUC0_GSUWGMRR0_K1_LBSPPA512_LBSPPB256_LPA16_MIWT1_1_PLR1_SU0_SUM0_SUS256_VWA1_VWB1_WGM1_WGMXCC1_WGMXCCGn1
    SolutionIndex: 107
    SolutionNameMin: Cijk_Ailk_Bljk_HSS_BH_Bias_HAS_SAV_UserArgs_MT32x32x128_MI16x16x1_SN_LDSB1_CLR1_GRVWA2_GSU0_GSUC0_GSUWGMRR0_K1_LBSPPA512_LBSPPB256_LPA16_MIWT1_1_PLR1_SU0_SUM0_SUS256_VWA1_VWB1_WGM1_WGMXCC1_WGMXCCGn1
    SolutionIndex: 108
    SolutionNameMin: Cijk_Ailk_Bljk_HSS_BH_Bias_HAS_SAV_UserArgs_MT32x32x128_MI16x16x1_SN_LDSB1_CLR1_GRVWA4_GSU0_GSUC0_GSUWGMRR0_K1_LBSPPA512_LBSPPB256_LPA16_MIWT1_1_PLR1_SU0_SUM0_SUS256_VWA1_VWB1_WGM1_WGMXCC1_WGMXCCGn1
    SolutionIndex: 109
    SolutionNameMin: Cijk_Ailk_Bljk_HSS_BH_Bias_HAS_SAV_UserArgs_MT32x32x128_MI16x16x1_SN_LDSB1_CLR1_GRVWA8_GSU0_GSUC0_GSUWGMRR0_K1_LBSPPA512_LBSPPB256_LPA16_MIWT1_1_PLR1_SU0_SUM0_SUS256_VWA1_VWB1_WGM1_WGMXCC1_WGMXCCGn1
    SolutionIndex: 110
    SolutionNameMin: Cijk_Ailk_Bljk_HSS_BH_Bias_HAS_SAV_UserArgs_MT32x32x128_MI16x16x1_SN_LDSB1_CLR1_GRVWA4_GSU0_GSUC0_GSUWGMRR0_K1_LBSPPA512_LBSPPB256_LPA16_MIWT1_1_PLR1_SU0_SUM0_SUS256_VWA1_VWB1_WGM4_WGMXCC1_WGMXCCGn1
    SolutionIndex: 111
    SolutionNameMin: Cijk_Ailk_Bljk_HSS_BH_Bias_HAS_SAV_UserArgs_MT32x32x128_MI16x16x1_SN_LDSB1_CLR1_GRVWA8_GSU0_GSUC0_GSUWGMRR0_K1_LBSPPA512_LBSPPB256_LPA16_MIWT1_1_PLR1_SU0_SUM0_SUS256_VWA1_VWB1_WGM4_WGMXCC1_WGMXCCGn1
    SolutionIndex: 112
    SolutionNameMin: Cijk_Ailk_Bljk_HSS_BH_Bias_HAS_SAV_UserArgs_MT32x32x128_MI16x16x1_SN_LDSB1_CLR1_GRVWA4_GSU0_GSUC0_GSUWGMRR0_K1_LBSPPA512_LBSPPB256_LPA16_MIWT1_1_PLR1_SU0_SUM0_SUS256_VWA1_VWB1_WGM6_WGMXCC1_WGMXCCGn1
    SolutionIndex: 113
    SolutionNameMin: Cijk_Ailk_Bljk_HSS_BH_Bias_HAS_SAV_UserArgs_MT32x32x128_MI16x16x1_SN_LDSB1_CLR1_GRVWA8_GSU0_GSUC0_GSUWGMRR0_K1_LBSPPA512_LBSPPB256_LPA16_MIWT1_1_PLR1_SU0_SUM0_SUS256_VWA1_VWB1_WGM6_WGMXCC1_WGMXCCGn1
    SolutionIndex: 114
    SolutionNameMin: Cijk_Ailk_Bljk_HSS_BH_Bias_HAS_SAV_UserArgs_MT32x32x128_MI16x16x1_SN_LDSB1_CLR1_GRVWA4_GSU0_GSUC0_GSUWGMRR0_K1_LBSPPA512_LBSPPB256_LPA16_MIWT1_1_PLR1_SU0_SUM0_SUS256_VWA1_VWB1_WGM8_WGMXCC1_WGMXCCGn1
    SolutionIndex: 115
    SolutionNameMin: Cijk_Ailk_Bljk_HSS_BH_Bias_HAS_SAV_UserArgs_MT32x32x128_MI16x16x1_SN_LDSB1_CLR1_GRVWA8_GSU0_GSUC0_GSUWGMRR0_K1_LBSPPA512_LBSPPB256_LPA16_MIWT1_1_PLR1_SU0_SUM0_SUS256_VWA1_VWB1_WGM8_WGMXCC1_WGMXCCGn1
- - - [128, 128, 1, 128, 128, 128, 128, 128]
    - [109, 0.46]
  - - [128, 128, 1, 256, 128, 128, 128, 256]
    - [109, 0.77]
  - - [128, 128, 1, 512, 128, 128, 128, 512]
    - [109, 1.31]
  - - [128, 128, 1, 1024, 128, 128, 128, 1024]
    - [109, 1.93]
  - - [128, 128, 1, 2048, 128, 128, 128, 2048]
    - [109, 2.52]
  - - [128, 128, 1, 4096, 128, 128, 128, 4096]
    - [109, 3.04]
  - - [128, 128, 1, 8192, 128, 128, 128, 8192]
    - [113, 3.42]
  - - [128, 256, 1, 128, 128, 128, 128, 128]
    - [109, 0.9]
  - - [128, 256, 1, 256, 128, 128, 128, 256]
    - [109, 1.57]
  - - [128, 256, 1, 512, 128, 128, 128, 512]
    - [109, 2.63]
  - - [128, 256, 1, 1024, 128, 128, 128, 1024]
    - [109, 3.85]
  - - [128, 256, 1, 2048, 128, 128, 128, 2048]
    - [108, 5.04]
  - - [128, 256, 1, 4096, 128, 128, 128, 4096]
    - [109, 6.06]
  - - [128, 256, 1, 8192, 128, 128, 128, 8192]
    - [109, 6.82]
  - - [128, 512, 1, 128, 128, 128, 128, 128]
    - [107, 1.77]
  - - [128, 512, 1, 256, 128, 128, 128, 256]
    - [109, 3.1]
  - - [128, 512, 1, 512, 128, 128, 128, 512]
    - [109, 5.15]
  - - [128, 512, 1, 1024, 128, 128, 128, 1024]
    - [109, 7.51]
  - - [128, 512, 1, 2048, 128, 128, 128, 2048]
    - [108, 9.99]
  - - [128, 512, 1, 4096, 128, 128, 128, 4096]
    - [108, 12.01]
  - - [128, 512, 1, 8192, 128, 128, 128, 8192]
    - [109, 13.69]
  - - [128, 1024, 1, 128, 128, 128, 128, 128]
    - [107, 3.5]
  - - [128, 1024, 1, 256, 128, 128, 128, 256]
    - [108, 5.98]
  - - [128, 1024, 1, 512, 128, 128, 128, 512]
    - [109, 10.0]
  - - [128, 1024, 1, 1024, 128, 128, 128, 1024]
    - [109, 14.94]
  - - [128, 1024, 1, 2048, 128, 128, 128, 2048]
    - [109, 19.92]
  - - [128, 1024, 1, 4096, 128, 128, 128, 4096]
    - [109, 23.88]
  - - [128, 1024, 1, 8192, 128, 128, 128, 8192]
    - [109, 27.3]
  - - [128, 2048, 1, 128, 128, 128, 128, 128]
    - [82, 6.2]
  - - [128, 2048, 1, 256, 128, 128, 128, 256]
    - [99, 10.54]
  - - [128, 2048, 1, 512, 128, 128, 128, 512]
    - [99, 17.74]
  - - [128, 2048, 1, 1024, 128, 128, 128, 1024]
    - [99, 26.32]
  - - [128, 2048, 1, 2048, 128, 128, 128, 2048]
    - [99, 35.22]
  - - [128, 2048, 1, 4096, 128, 128, 128, 4096]
    - [99, 42.38]
  - - [128, 2048, 1, 8192, 128, 128, 128, 8192]
    - [99, 45.39]
  - - [128, 4096, 1, 128, 128, 128, 128, 128]
    - [70, 10.41]
  - - [128, 4096, 1, 256, 128, 128, 128, 256]
    - [72, 17.64]
  - - [128, 4096, 1, 512, 128, 128, 128, 512]
    - [92, 28.84]
  - - [128, 4096, 1, 1024, 128, 128, 128, 1024]
    - [92, 42.25]
  - - [128, 4096, 1, 2048, 128, 128, 128, 2048]
    - [92, 55.44]
  - - [128, 4096, 1, 4096, 128, 128, 128, 4096]
    - [94, 63.37]
  - - [128, 4096, 1, 8192, 128, 128, 128, 8192]
    - [94, 69.34]
  - - [128, 8192, 1, 128, 128, 128, 128, 128]
    - [64, 16.6]
  - - [128, 8192, 1, 256, 128, 128, 128, 256]
    - [64, 27.73]
  - - [128, 8192, 1, 512, 128, 128, 128, 512]
    - [88, 45.81]
  - - [128, 8192, 1, 1024, 128, 128, 128, 1024]
    - [88, 65.06]
  - - [128, 8192, 1, 2048, 128, 128, 128, 2048]
    - [90, 76.15]
  - - [128, 8192, 1, 4096, 128, 128, 128, 4096]
    - [88, 88.68]
  - - [128, 8192, 1, 8192, 128, 128, 128, 8192]
    - [89, 90.42]
  - - [256, 128, 1, 128, 256, 256, 256, 128]
    - [106, 0.84]
  - - [256, 128, 1, 256, 256, 256, 256, 256]
    - [109, 1.49]
  - - [256, 128, 1, 512, 256, 256, 256, 512]
    - [108, 2.47]
  - - [256, 128, 1, 1024, 256, 256, 256, 1024]
    - [108, 3.44]
  - - [256, 128, 1, 2048, 256, 256, 256, 2048]
    - [108, 4.42]
  - - [256, 128, 1, 4096, 256, 256, 256, 4096]
    - [108, 5.17]
  - - [256, 128, 1, 8192, 256, 256, 256, 8192]
    - [108, 5.7]
  - - [256, 256, 1, 128, 256, 256, 256, 128]
    - [85, 1.75]
  - - [256, 256, 1, 256, 256, 256, 256, 256]
    - [85, 2.9]
  - - [256, 256, 1, 512, 256, 256, 256, 512]
    - [109, 4.67]
  - - [256, 256, 1, 1024, 256, 256, 256, 1024]
    - [108, 6.88]
  - - [256, 256, 1, 2048, 256, 256, 256, 2048]
    - [108, 8.93]
  - - [256, 256, 1, 4096, 256, 256, 256, 4096]
    - [108, 10.62]
  - - [256, 256, 1, 8192, 256, 256, 256, 8192]
    - [108, 11.73]
  - - [256, 512, 1, 128, 256, 256, 256, 128]
    - [86, 3.39]
  - - [256, 512, 1, 256, 256, 256, 256, 256]
    - [105, 5.82]
  - - [256, 512, 1, 512, 256, 256, 256, 512]
    - [109, 9.42]
  - - [256, 512, 1, 1024, 256, 256, 256, 1024]
    - [108, 14.02]
  - - [256, 512, 1, 2048, 256, 256, 256, 2048]
    - [108, 18.16]
  - - [256, 512, 1, 4096, 256, 256, 256, 4096]
    - [108, 21.53]
  - - [256, 512, 1, 8192, 256, 256, 256, 8192]
    - [108, 23.95]
  - - [256, 1024, 1, 128, 256, 256, 256, 128]
    - [78, 6.16]
  - - [256, 1024, 1, 256, 256, 256, 256, 256]
    - [98, 10.41]
  - - [256, 1024, 1, 512, 256, 256, 256, 512]
    - [98, 17.1]
  - - [256, 1024, 1, 1024, 256, 256, 256, 1024]
    - [99, 25.12]
  - - [256, 1024, 1, 2048, 256, 256, 256, 2048]
    - [99, 32.61]
  - - [256, 1024, 1, 4096, 256, 256, 256, 4096]
    - [99, 38.72]
  - - [256, 1024, 1, 8192, 256, 256, 256, 8192]
    - [101, 42.01]
  - - [256, 2048, 1, 128, 256, 256, 256, 128]
    - [69, 10.22]
  - - [256, 2048, 1, 256, 256, 256, 256, 256]
    - [72, 17.85]
  - - [256, 2048, 1, 512, 256, 256, 256, 512]
    - [92, 28.15]
  - - [256, 2048, 1, 1024, 256, 256, 256, 1024]
    - [92, 39.14]
  - - [256, 2048, 1, 2048, 256, 256, 256, 2048]
    - [92, 49.45]
  - - [256, 2048, 1, 4096, 256, 256, 256, 4096]
    - [99, 61.28]
  - - [256, 2048, 1, 8192, 256, 256, 256, 8192]
    - [37, 62.66]
  - - [256, 4096, 1, 128, 256, 256, 256, 128]
    - [33, 16.25]
  - - [256, 4096, 1, 256, 256, 256, 256, 256]
    - [64, 28.87]
  - - [256, 4096, 1, 512, 256, 256, 256, 512]
    - [64, 45.56]
  - - [256, 4096, 1, 1024, 256, 256, 256, 1024]
    - [64, 64.93]
  - - [256, 4096, 1, 2048, 256, 256, 256, 2048]
    - [88, 79.39]
  - - [256, 4096, 1, 4096, 256, 256, 256, 4096]
    - [64, 87.38]
  - - [256, 4096, 1, 8192, 256, 256, 256, 8192]
    - [88, 88.71]
  - - [256, 8192, 1, 128, 256, 256, 256, 128]
    - [27, 23.14]
  - - [256, 8192, 1, 256, 256, 256, 256, 256]
    - [54, 38.55]
  - - [256, 8192, 1, 512, 256, 256, 256, 512]
    - [54, 59.9]
  - - [256, 8192, 1, 1024, 256, 256, 256, 1024]
    - [52, 78.88]
  - - [256, 8192, 1, 2048, 256, 256, 256, 2048]
    - [51, 97.24]
  - - [256, 8192, 1, 4096, 256, 256, 256, 4096]
    - [60, 111.68]
  - - [256, 8192, 1, 8192, 256, 256, 256, 8192]
    - [56, 106.16]
  - - [512, 128, 1, 128, 512, 512, 512, 128]
    - [85, 1.71]
  - - [512, 128, 1, 256, 512, 512, 512, 256]
    - [84, 2.97]
  - - [512, 128, 1, 512, 512, 512, 512, 512]
    - [108, 4.62]
  - - [512, 128, 1, 1024, 512, 512, 512, 1024]
    - [112, 6.7]
  - - [512, 128, 1, 2048, 512, 512, 512, 2048]
    - [114, 8.66]
  - - [512, 128, 1, 4096, 512, 512, 512, 4096]
    - [108, 10.17]
  - - [512, 128, 1, 8192, 512, 512, 512, 8192]
    - [114, 11.18]
  - - [512, 256, 1, 128, 512, 512, 512, 128]
    - [109, 3.35]
  - - [512, 256, 1, 256, 512, 512, 512, 256]
    - [85, 5.6]
  - - [512, 256, 1, 512, 512, 512, 512, 512]
    - [108, 9.08]
  - - [512, 256, 1, 1024, 512, 512, 512, 1024]
    - [110, 13.41]
  - - [512, 256, 1, 2048, 512, 512, 512, 2048]
    - [114, 17.27]
  - - [512, 256, 1, 4096, 512, 512, 512, 4096]
    - [114, 20.45]
  - - [512, 256, 1, 8192, 512, 512, 512, 8192]
    - [112, 22.76]
  - - [512, 512, 1, 128, 512, 512, 512, 128]
    - [83, 5.94]
  - - [512, 512, 1, 256, 512, 512, 512, 256]
    - [80, 10.2]
  - - [512, 512, 1, 512, 512, 512, 512, 512]
    - [104, 16.71]
  - - [512, 512, 1, 1024, 512, 512, 512, 1024]
    - [104, 24.78]
  - - [512, 512, 1, 2048, 512, 512, 512, 2048]
    - [104, 32.14]
  - - [512, 512, 1, 4096, 512, 512, 512, 4096]
    - [99, 38.13]
  - - [512, 512, 1, 8192, 512, 512, 512, 8192]
    - [103, 42.13]
  - - [512, 1024, 1, 128, 512, 512, 512, 128]
    - [69, 10.16]
  - - [512, 1024, 1, 256, 512, 512, 512, 256]
    - [70, 17.63]
  - - [512, 1024, 1, 512, 512, 512, 512, 512]
    - [75, 27.97]
  - - [512, 1024, 1, 1024, 512, 512, 512, 1024]
    - [97, 39.37]
  - - [512, 1024, 1, 2048, 512, 512, 512, 2048]
    - [97, 49.77]
  - - [512, 1024, 1, 4096, 512, 512, 512, 4096]
    - [94, 57.6]
  - - [512, 1024, 1, 8192, 512, 512, 512, 8192]
    - [37, 63.1]
  - - [512, 2048, 1, 128, 512, 512, 512, 128]
    - [64, 15.97]
  - - [512, 2048, 1, 256, 512, 512, 512, 256]
    - [68, 28.02]
  - - [512, 2048, 1, 512, 512, 512, 512, 512]
    - [64, 45.11]
  - - [512, 2048, 1, 1024, 512, 512, 512, 1024]
    - [88, 64.35]
  - - [512, 2048, 1, 2048, 512, 512, 512, 2048]
    - [64, 81.74]
  - - [512, 2048, 1, 4096, 512, 512, 512, 4096]
    - [88, 94.54]
  - - [512, 2048, 1, 8192, 512, 512, 512, 8192]
    - [88, 90.4]
  - - [512, 4096, 1, 128, 512, 512, 512, 128]
    - [27, 23.38]
  - - [512, 4096, 1, 256, 512, 512, 512, 256]
    - [54, 39.33]
  - - [512, 4096, 1, 512, 512, 512, 512, 512]
    - [54, 63.05]
  - - [512, 4096, 1, 1024, 512, 512, 512, 1024]
    - [62, 85.25]
  - - [512, 4096, 1, 2048, 512, 512, 512, 2048]
    - [54, 103.0]
  - - [512, 4096, 1, 4096, 512, 512, 512, 4096]
    - [56, 115.47]
  - - [512, 4096, 1, 8192, 512, 512, 512, 8192]
    - [54, 111.33]
  - - [512, 8192, 1, 128, 512, 512, 512, 128]
    - [16, 28.96]
  - - [512, 8192, 1, 256, 512, 512, 512, 256]
    - [48, 46.27]
  - - [512, 8192, 1, 512, 512, 512, 512, 512]
    - [42, 70.38]
  - - [512, 8192, 1, 1024, 512, 512, 512, 1024]
    - [49, 97.29]
  - - [512, 8192, 1, 2048, 512, 512, 512, 2048]
    - [54, 121.59]
  - - [512, 8192, 1, 4096, 512, 512, 512, 4096]
    - [42, 117.77]
  - - [512, 8192, 1, 8192, 512, 512, 512, 8192]
    - [19, 130.59]
  - - [1024, 128, 1, 128, 1024, 1024, 1024, 128]
    - [85, 3.18]
  - - [1024, 128, 1, 256, 1024, 1024, 1024, 256]
    - [87, 5.46]
  - - [1024, 128, 1, 512, 1024, 1024, 1024, 512]
    - [111, 8.79]
  - - [1024, 128, 1, 1024, 1024, 1024, 1024, 1024]
    - [109, 12.82]
  - - [1024, 128, 1, 2048, 1024, 1024, 1024, 2048]
    - [111, 16.55]
  - - [1024, 128, 1, 4096, 1024, 1024, 1024, 4096]
    - [111, 19.36]
  - - [1024, 128, 1, 8192, 1024, 1024, 1024, 8192]
    - [115, 21.19]
  - - [1024, 256, 1, 128, 1024, 1024, 1024, 128]
    - [81, 5.7]
  - - [1024, 256, 1, 256, 1024, 1024, 1024, 256]
    - [79, 10.0]
  - - [1024, 256, 1, 512, 1024, 1024, 1024, 512]
    - [100, 16.13]
  - - [1024, 256, 1, 1024, 1024, 1024, 1024, 1024]
    - [101, 23.72]
  - - [1024, 256, 1, 2048, 1024, 1024, 1024, 2048]
    - [103, 30.47]
  - - [1024, 256, 1, 4096, 1024, 1024, 1024, 4096]
    - [103, 36.3]
  - - [1024, 256, 1, 8192, 1024, 1024, 1024, 8192]
    - [101, 39.37]
  - - [1024, 512, 1, 128, 1024, 1024, 1024, 128]
    - [74, 9.93]
  - - [1024, 512, 1, 256, 1024, 1024, 1024, 256]
    - [76, 17.41]
  - - [1024, 512, 1, 512, 1024, 1024, 1024, 512]
    - [75, 27.55]
  - - [1024, 512, 1, 1024, 1024, 1024, 1024, 1024]
    - [73, 39.21]
  - - [1024, 512, 1, 2048, 1024, 1024, 1024, 2048]
    - [94, 48.9]
  - - [1024, 512, 1, 4096, 1024, 1024, 1024, 4096]
    - [93, 57.55]
  - - [1024, 512, 1, 8192, 1024, 1024, 1024, 8192]
    - [39, 62.34]
  - - [1024, 1024, 1, 128, 1024, 1024, 1024, 128]
    - [36, 16.14]
  - - [1024, 1024, 1, 256, 1024, 1024, 1024, 256]
    - [68, 28.52]
  - - [1024, 1024, 1, 512, 1024, 1024, 1024, 512]
    - [68, 45.94]
  - - [1024, 1024, 1, 1024, 1024, 1024, 1024, 1024]
    - [68, 64.95]
  - - [1024, 1024, 1, 2048, 1024, 1024, 1024, 2048]
    - [91, 82.34]
  - - [1024, 1024, 1, 4096, 1024, 1024, 1024, 4096]
    - [90, 94.84]
  - - [1024, 1024, 1, 8192, 1024, 1024, 1024, 8192]
    - [91, 88.75]
  - - [1024, 2048, 1, 128, 1024, 1024, 1024, 128]
    - [26, 23.91]
  - - [1024, 2048, 1, 256, 1024, 1024, 1024, 256]
    - [52, 39.94]
  - - [1024, 2048, 1, 512, 1024, 1024, 1024, 512]
    - [54, 63.73]
  - - [1024, 2048, 1, 1024, 1024, 1024, 1024, 1024]
    - [60, 87.47]
  - - [1024, 2048, 1, 2048, 1024, 1024, 1024, 2048]
    - [56, 105.28]
  - - [1024, 2048, 1, 4096, 1024, 1024, 1024, 4096]
    - [60, 115.88]
  - - [1024, 2048, 1, 8192, 1024, 1024, 1024, 8192]
    - [54, 117.52]
  - - [1024, 4096, 1, 128, 1024, 1024, 1024, 128]
    - [14, 29.02]
  - - [1024, 4096, 1, 256, 1024, 1024, 1024, 256]
    - [42, 46.64]
  - - [1024, 4096, 1, 512, 1024, 1024, 1024, 512]
    - [25, 71.7]
  - - [1024, 4096, 1, 1024, 1024, 1024, 1024, 1024]
    - [50, 98.83]
  - - [1024, 4096, 1, 2048, 1024, 1024, 1024, 2048]
    - [49, 119.83]
  - - [1024, 4096, 1, 4096, 1024, 1024, 1024, 4096]
    - [42, 123.44]
  - - [1024, 4096, 1, 8192, 1024, 1024, 1024, 8192]
    - [48, 133.06]
  - - [1024, 8192, 1, 128, 1024, 1024, 1024, 128]
    - [13, 33.49]
  - - [1024, 8192, 1, 256, 1024, 1024, 1024, 256]
    - [2, 52.62]
  - - [1024, 8192, 1, 512, 1024, 1024, 1024, 512]
    - [7, 81.69]
  - - [1024, 8192, 1, 1024, 1024, 1024, 1024, 1024]
    - [7, 104.28]
  - - [1024, 8192, 1, 2048, 1024, 1024, 1024, 2048]
    - [46, 121.09]
  - - [1024, 8192, 1, 4096, 1024, 1024, 1024, 4096]
    - [45, 138.45]
  - - [1024, 8192, 1, 8192, 1024, 1024, 1024, 8192]
    - [5, 160.01]
  - - [2048, 128, 1, 128, 2048, 2048, 2048, 128]
    - [77, 5.84]
  - - [2048, 128, 1, 256, 2048, 2048, 2048, 256]
    - [78, 10.06]
  - - [2048, 128, 1, 512, 2048, 2048, 2048, 512]
    - [98, 15.96]
  - - [2048, 128, 1, 1024, 2048, 2048, 2048, 1024]
    - [101, 22.91]
  - - [2048, 128, 1, 2048, 2048, 2048, 2048, 2048]
    - [101, 29.57]
  - - [2048, 128, 1, 4096, 2048, 2048, 2048, 4096]
    - [103, 34.78]
  - - [2048, 128, 1, 8192, 2048, 2048, 2048, 8192]
    - [102, 34.19]
  - - [2048, 256, 1, 128, 2048, 2048, 2048, 128]
    - [71, 9.77]
  - - [2048, 256, 1, 256, 2048, 2048, 2048, 256]
    - [72, 17.28]
  - - [2048, 256, 1, 512, 2048, 2048, 2048, 512]
    - [75, 27.45]
  - - [2048, 256, 1, 1024, 2048, 2048, 2048, 1024]
    - [76, 38.22]
  - - [2048, 256, 1, 2048, 2048, 2048, 2048, 2048]
    - [96, 48.64]
  - - [2048, 256, 1, 4096, 2048, 2048, 2048, 4096]
    - [96, 56.24]
  - - [2048, 256, 1, 8192, 2048, 2048, 2048, 8192]
    - [38, 59.19]
  - - [2048, 512, 1, 128, 2048, 2048, 2048, 128]
    - [63, 16.2]
  - - [2048, 512, 1, 256, 2048, 2048, 2048, 256]
    - [68, 28.25]
  - - [2048, 512, 1, 512, 2048, 2048, 2048, 512]
    - [68, 45.46]
  - - [2048, 512, 1, 1024, 2048, 2048, 2048, 1024]
    - [65, 64.25]
  - - [2048, 512, 1, 2048, 2048, 2048, 2048, 2048]
    - [89, 81.6]
  - - [2048, 512, 1, 4096, 2048, 2048, 2048, 4096]
    - [90, 91.02]
  - - [2048, 512, 1, 8192, 2048, 2048, 2048, 8192]
    - [91, 87.11]
  - - [2048, 1024, 1, 128, 2048, 2048, 2048, 128]
    - [26, 23.25]
  - - [2048, 1024, 1, 256, 2048, 2048, 2048, 256]
    - [54, 39.36]
  - - [2048, 1024, 1, 512, 2048, 2048, 2048, 512]
    - [56, 62.59]
  - - [2048, 1024, 1, 1024, 2048, 2048, 2048, 1024]
    - [55, 86.78]
  - - [2048, 1024, 1, 2048, 2048, 2048, 2048, 2048]
    - [56, 107.67]
  - - [2048, 1024, 1, 4096, 2048, 2048, 2048, 4096]
    - [55, 114.98]
  - - [2048, 1024, 1, 8192, 2048, 2048, 2048, 8192]
    - [55, 115.03]
  - - [2048, 2048, 1, 128, 2048, 2048, 2048, 128]
    - [13, 27.92]
  - - [2048, 2048, 1, 256, 2048, 2048, 2048, 256]
    - [18, 45.87]
  - - [2048, 2048, 1, 512, 2048, 2048, 2048, 512]
    - [21, 70.77]
  - - [2048, 2048, 1, 1024, 2048, 2048, 2048, 1024]
    - [50, 99.04]
  - - [2048, 2048, 1, 2048, 2048, 2048, 2048, 2048]
    - [50, 118.01]
  - - [2048, 2048, 1, 4096, 2048, 2048, 2048, 4096]
    - [44, 122.26]
  - - [2048, 2048, 1, 8192, 2048, 2048, 2048, 8192]
    - [43, 132.71]
  - - [2048, 4096, 1, 128, 2048, 2048, 2048, 128]
    - [13, 32.61]
  - - [2048, 4096, 1, 256, 2048, 2048, 2048, 256]
    - [25, 52.7]
  - - [2048, 4096, 1, 512, 2048, 2048, 2048, 512]
    - [2, 78.92]
  - - [2048, 4096, 1, 1024, 2048, 2048, 2048, 1024]
    - [2, 105.26]
  - - [2048, 4096, 1, 2048, 2048, 2048, 2048, 2048]
    - [40, 126.05]
  - - [2048, 4096, 1, 4096, 2048, 2048, 2048, 4096]
    - [42, 141.33]
  - - [2048, 4096, 1, 8192, 2048, 2048, 2048, 8192]
    - [10, 151.61]
  - - [2048, 8192, 1, 128, 2048, 2048, 2048, 128]
    - [14, 34.71]
  - - [2048, 8192, 1, 256, 2048, 2048, 2048, 256]
    - [29, 56.41]
  - - [2048, 8192, 1, 512, 2048, 2048, 2048, 512]
    - [57, 87.2]
  - - [2048, 8192, 1, 1024, 2048, 2048, 2048, 1024]
    - [62, 106.84]
  - - [2048, 8192, 1, 2048, 2048, 2048, 2048, 2048]
    - [42, 137.92]
  - - [2048, 8192, 1, 4096, 2048, 2048, 2048, 4096]
    - [42, 160.48]
  - - [2048, 8192, 1, 8192, 2048, 2048, 2048, 8192]
    - [40, 173.93]
  - - [4096, 128, 1, 128, 4096, 4096, 4096, 128]
    - [70, 9.96]
  - - [4096, 128, 1, 256, 4096, 4096, 4096, 256]
    - [72, 17.19]
  - - [4096, 128, 1, 512, 4096, 4096, 4096, 512]
    - [72, 27.04]
  - - [4096, 128, 1, 1024, 4096, 4096, 4096, 1024]
    - [92, 37.62]
  - - [4096, 128, 1, 2048, 4096, 4096, 4096, 2048]
    - [97, 48.3]
  - - [4096, 128, 1, 4096, 4096, 4096, 4096, 4096]
    - [95, 51.93]
  - - [4096, 128, 1, 8192, 4096, 4096, 4096, 8192]
    - [94, 54.78]
  - - [4096, 256, 1, 128, 4096, 4096, 4096, 128]
    - [66, 15.8]
  - - [4096, 256, 1, 256, 4096, 4096, 4096, 256]
    - [67, 27.85]
  - - [4096, 256, 1, 512, 4096, 4096, 4096, 512]
    - [66, 44.96]
  - - [4096, 256, 1, 1024, 4096, 4096, 4096, 1024]
    - [65, 63.75]
  - - [4096, 256, 1, 2048, 4096, 4096, 4096, 2048]
    - [89, 79.29]
  - - [4096, 256, 1, 4096, 4096, 4096, 4096, 4096]
    - [91, 88.07]
  - - [4096, 256, 1, 8192, 4096, 4096, 4096, 8192]
    - [91, 86.41]
  - - [4096, 512, 1, 128, 4096, 4096, 4096, 128]
    - [26, 22.47]
  - - [4096, 512, 1, 256, 4096, 4096, 4096, 256]
    - [62, 38.34]
  - - [4096, 512, 1, 512, 4096, 4096, 4096, 512]
    - [60, 61.56]
  - - [4096, 512, 1, 1024, 4096, 4096, 4096, 1024]
    - [60, 86.84]
  - - [4096, 512, 1, 2048, 4096, 4096, 4096, 2048]
    - [55, 104.11]
  - - [4096, 512, 1, 4096, 4096, 4096, 4096, 4096]
    - [59, 114.78]
  - - [4096, 512, 1, 8192, 4096, 4096, 4096, 8192]
    - [61, 112.7]
  - - [4096, 1024, 1, 128, 4096, 4096, 4096, 128]
    - [13, 27.35]
  - - [4096, 1024, 1, 256, 4096, 4096, 4096, 256]
    - [23, 44.93]
  - - [4096, 1024, 1, 512, 4096, 4096, 4096, 512]
    - [20, 70.55]
  - - [4096, 1024, 1, 1024, 4096, 4096, 4096, 1024]
    - [25, 97.26]
  - - [4096, 1024, 1, 2048, 4096, 4096, 4096, 2048]
    - [58, 119.55]
  - - [4096, 1024, 1, 4096, 4096, 4096, 4096, 4096]
    - [54, 128.96]
  - - [4096, 1024, 1, 8192, 4096, 4096, 4096, 8192]
    - [48, 133.42]
  - - [4096, 2048, 1, 128, 4096, 4096, 4096, 128]
    - [15, 31.39]
  - - [4096, 2048, 1, 256, 4096, 4096, 4096, 256]
    - [22, 51.95]
  - - [4096, 2048, 1, 512, 4096, 4096, 4096, 512]
    - [24, 77.99]
  - - [4096, 2048, 1, 1024, 4096, 4096, 4096, 1024]
    - [7, 104.41]
  - - [4096, 2048, 1, 2048, 4096, 4096, 4096, 2048]
    - [42, 130.64]
  - - [4096, 2048, 1, 4096, 4096, 4096, 4096, 4096]
    - [42, 145.48]
  - - [4096, 2048, 1, 8192, 4096, 4096, 4096, 8192]
    - [42, 157.35]
  - - [4096, 4096, 1, 128, 4096, 4096, 4096, 128]
    - [34, 33.97]
  - - [4096, 4096, 1, 256, 4096, 4096, 4096, 256]
    - [28, 55.63]
  - - [4096, 4096, 1, 512, 4096, 4096, 4096, 512]
    - [57, 85.61]
  - - [4096, 4096, 1, 1024, 4096, 4096, 4096, 1024]
    - [62, 106.76]
  - - [4096, 4096, 1, 2048, 4096, 4096, 4096, 2048]
    - [42, 137.44]
  - - [4096, 4096, 1, 4096, 4096, 4096, 4096, 4096]
    - [40, 160.37]
  - - [4096, 4096, 1, 8192, 4096, 4096, 4096, 8192]
    - [1, 173.54]
  - - [4096, 8192, 1, 128, 4096, 4096, 4096, 128]
    - [32, 36.95]
  - - [4096, 8192, 1, 256, 4096, 4096, 4096, 256]
    - [53, 58.94]
  - - [4096, 8192, 1, 512, 4096, 4096, 4096, 512]
    - [54, 83.63]
  - - [4096, 8192, 1, 1024, 4096, 4096, 4096, 1024]
    - [47, 114.71]
  - - [4096, 8192, 1, 2048, 4096, 4096, 4096, 2048]
    - [50, 146.92]
  - - [4096, 8192, 1, 4096, 4096, 4096, 4096, 4096]
    - [9, 170.41]
  - - [4096, 8192, 1, 8192, 4096, 4096, 4096, 8192]
    - [11, 187.29]
  - - [8192, 128, 1, 128, 8192, 8192, 8192, 128]
    - [35, 15.79]
  - - [8192, 128, 1, 256, 8192, 8192, 8192, 256]
    - [65, 27.47]
  - - [8192, 128, 1, 512, 8192, 8192, 8192, 512]
    - [66, 43.55]
  - - [8192, 128, 1, 1024, 8192, 8192, 8192, 1024]
    - [91, 60.67]
  - - [8192, 128, 1, 2048, 8192, 8192, 8192, 2048]
    - [90, 72.69]
  - - [8192, 128, 1, 4096, 8192, 8192, 8192, 4096]
    - [90, 83.02]
  - - [8192, 128, 1, 8192, 8192, 8192, 8192, 8192]
    - [89, 77.16]
  - - [8192, 256, 1, 128, 8192, 8192, 8192, 128]
    - [27, 22.74]
  - - [8192, 256, 1, 256, 8192, 8192, 8192, 256]
    - [57, 38.01]
  - - [8192, 256, 1, 512, 8192, 8192, 8192, 512]
    - [62, 60.25]
  - - [8192, 256, 1, 1024, 8192, 8192, 8192, 1024]
    - [56, 82.06]
  - - [8192, 256, 1, 2048, 8192, 8192, 8192, 2048]
    - [61, 99.23]
  - - [8192, 256, 1, 4096, 8192, 8192, 8192, 4096]
    - [60, 112.59]
  - - [8192, 256, 1, 8192, 8192, 8192, 8192, 8192]
    - [62, 107.16]
  - - [8192, 512, 1, 128, 8192, 8192, 8192, 128]
    - [17, 27.76]
  - - [8192, 512, 1, 256, 8192, 8192, 8192, 256]
    - [15, 44.62]
  - - [8192, 512, 1, 512, 8192, 8192, 8192, 512]
    - [46, 69.01]
  - - [8192, 512, 1, 1024, 8192, 8192, 8192, 1024]
    - [21, 96.04]
  - - [8192, 512, 1, 2048, 8192, 8192, 8192, 2048]
    - [59, 117.16]
  - - [8192, 512, 1, 4096, 8192, 8192, 8192, 4096]
    - [53, 128.49]
  - - [8192, 512, 1, 8192, 8192, 8192, 8192, 8192]
    - [13, 135.61]
  - - [8192, 1024, 1, 128, 8192, 8192, 8192, 128]
    - [13, 31.96]
  - - [8192, 1024, 1, 256, 8192, 8192, 8192, 256]
    - [21, 50.81]
  - - [8192, 1024, 1, 512, 8192, 8192, 8192, 512]
    - [12, 79.07]
  - - [8192, 1024, 1, 1024, 8192, 8192, 8192, 1024]
    - [6, 104.95]
  - - [8192, 1024, 1, 2048, 8192, 8192, 8192, 2048]
    - [42, 130.54]
  - - [8192, 1024, 1, 4096, 8192, 8192, 8192, 4096]
    - [42, 152.6]
  - - [8192, 1024, 1, 8192, 8192, 8192, 8192, 8192]
    - [0, 158.84]
  - - [8192, 2048, 1, 128, 8192, 8192, 8192, 128]
    - [13, 34.81]
  - - [8192, 2048, 1, 256, 8192, 8192, 8192, 256]
    - [30, 56.54]
  - - [8192, 2048, 1, 512, 8192, 8192, 8192, 512]
    - [57, 86.95]
  - - [8192, 2048, 1, 1024, 8192, 8192, 8192, 1024]
    - [62, 108.52]
  - - [8192, 2048, 1, 2048, 8192, 8192, 8192, 2048]
    - [46, 138.64]
  - - [8192, 2048, 1, 4096, 8192, 8192, 8192, 4096]
    - [45, 163.07]
  - - [8192, 2048, 1, 8192, 8192, 8192, 8192, 8192]
    - [4, 177.49]
  - - [8192, 4096, 1, 128, 8192, 8192, 8192, 128]
    - [31, 37.65]
  - - [8192, 4096, 1, 256, 8192, 8192, 8192, 256]
    - [54, 58.5]
  - - [8192, 4096, 1, 512, 8192, 8192, 8192, 512]
    - [42, 84.38]
  - - [8192, 4096, 1, 1024, 8192, 8192, 8192, 1024]
    - [44, 116.21]
  - - [8192, 4096, 1, 2048, 8192, 8192, 8192, 2048]
    - [50, 146.86]
  - - [8192, 4096, 1, 4096, 8192, 8192, 8192, 4096]
    - [41, 169.88]
  - - [8192, 4096, 1, 8192, 8192, 8192, 8192, 8192]
    - [3, 193.53]
  - - [8192, 8192, 1, 128, 8192, 8192, 8192, 128]
    - [13, 37.94]
  - - [8192, 8192, 1, 256, 8192, 8192, 8192, 256]
    - [45, 59.65]
  - - [8192, 8192, 1, 512, 8192, 8192, 8192, 512]
    - [42, 90.92]
  - - [8192, 8192, 1, 1024, 8192, 8192, 8192, 1024]
    - [10, 131.64]
  - - [8192, 8192, 1, 2048, 8192, 8192, 8192, 2048]
    - [50, 158.35]
  - - [8192, 8192, 1, 4096, 8192, 8192, 8192, 4096]
    - [46, 185.97]
  - - [8192, 8192, 1, 8192, 8192, 8192, 8192, 8192]
    - [8, 202.15]
- null
- null
- ExperimentalStreamK
- GridBased
