projects/hipblaslt/library/src/amd_detail/rocblaslt/src/Tensile/Logic/asm_full/aquavanjaram/gfx942_228cu/StreamK/aquavanjaram942_Cijk_Ailk_Bljk_BBS_BH_Bias_HAS_SAV_UserArgs.yaml
- {MinimumRequiredVersion: 4.33.0}
- aquavanjaram942
- {Architecture: gfx942, CUCount: 228}
- [Device 0049, Device 0050]
    SolutionIndex: 0
    SolutionNameMin: Cijk_Ailk_Bljk_BBS_BH_Bias_AS_SAV_UserArgs_MT256x256x32_MI16x16x1_SN_LDSB1_CLR1_GRVWA4_GSU0_GSUC0_GSUWGMRR0_K1_LBSPPA2048_LBSPPB512_LPA0_MIWT8_8_PLR1_SU0_SUM0_SUS64_VWA8_VWB8_WGM1_WGMXCC1_WGMXCCGn1
    SolutionIndex: 1
    SolutionNameMin: Cijk_Ailk_Bljk_BBS_BH_Bias_AS_SAV_UserArgs_MT256x256x32_MI16x16x1_SN_LDSB1_CLR1_GRVWA8_GSU0_GSUC0_GSUWGMRR0_K1_LBSPPA2048_LBSPPB512_LPA0_MIWT8_8_PLR1_SU0_SUM0_SUS64_VWA8_VWB8_WGM1_WGMXCC1_WGMXCCGn1
    SolutionIndex: 2
    SolutionNameMin: Cijk_Ailk_Bljk_BBS_BH_Bias_AS_SAV_UserArgs_MT256x256x32_MI16x16x1_SN_LDSB1_CLR1_GRVWA2_GSU0_GSUC0_GSUWGMRR0_K1_LBSPPA2048_LBSPPB512_LPA0_MIWT8_8_PLR1_SU0_SUM0_SUS64_VWA8_VWB8_WGM1_WGMXCC1_WGMXCCGn1
    SolutionIndex: 3
    SolutionNameMin: Cijk_Ailk_Bljk_BBS_BH_Bias_AS_SAV_UserArgs_MT256x256x32_MI16x16x1_SN_LDSB1_CLR1_GRVWA4_GSU0_GSUC0_GSUWGMRR0_K1_LBSPPA2048_LBSPPB512_LPA0_MIWT8_8_PLR1_SU0_SUM0_SUS64_VWA8_VWB8_WGM1_WGMXCC1_WGMXCCGn1
    SolutionIndex: 4
    SolutionNameMin: Cijk_Ailk_Bljk_BBS_BH_Bias_AS_SAV_UserArgs_MT256x256x32_MI16x16x1_SN_LDSB1_CLR1_GRVWA8_GSU0_GSUC0_GSUWGMRR0_K1_LBSPPA2048_LBSPPB512_LPA0_MIWT8_8_PLR1_SU0_SUM0_SUS64_VWA8_VWB8_WGM1_WGMXCC1_WGMXCCGn1
    SolutionIndex: 5
    SolutionNameMin: Cijk_Ailk_Bljk_BBS_BH_Bias_AS_SAV_UserArgs_MT256x256x32_MI16x16x1_SN_LDSB1_CLR1_GRVWA4_GSU0_GSUC0_GSUWGMRR0_K1_LBSPPA4096_LBSPPB512_LPA0_MIWT8_8_PLR1_SU0_SUM0_SUS64_VWA8_VWB8_WGM1_WGMXCC1_WGMXCCGn1
    SolutionIndex: 6
    SolutionNameMin: Cijk_Ailk_Bljk_BBS_BH_Bias_AS_SAV_UserArgs_MT256x256x32_MI16x16x1_SN_LDSB1_CLR1_GRVWA8_GSU0_GSUC0_GSUWGMRR0_K1_LBSPPA2048_LBSPPB512_LPA0_MIWT8_8_PLR1_SU0_SUM0_SUS64_VWA8_VWB8_WGM4_WGMXCC1_WGMXCCGn1
    SolutionIndex: 7
    SolutionNameMin: Cijk_Ailk_Bljk_BBS_BH_Bias_AS_SAV_UserArgs_MT256x256x32_MI16x16x1_SN_LDSB1_CLR1_GRVWA8_GSU0_GSUC0_GSUWGMRR0_K1_LBSPPA2048_LBSPPB512_LPA0_MIWT8_8_PLR1_SU0_SUM0_SUS64_VWA8_VWB8_WGM4_WGMXCC1_WGMXCCGn1
    SolutionIndex: 8
    SolutionNameMin: Cijk_Ailk_Bljk_BBS_BH_Bias_AS_SAV_UserArgs_MT256x256x32_MI16x16x1_SN_LDSB1_CLR1_GRVWA8_GSU0_GSUC0_GSUWGMRR0_K1_LBSPPA4096_LBSPPB512_LPA0_MIWT8_8_PLR1_SU0_SUM0_SUS64_VWA8_VWB8_WGM4_WGMXCC1_WGMXCCGn1
    SolutionIndex: 9
    SolutionNameMin: Cijk_Ailk_Bljk_BBS_BH_Bias_AS_SAV_UserArgs_MT256x256x32_MI16x16x1_SN_LDSB1_CLR1_GRVWA8_GSU0_GSUC0_GSUWGMRR0_K1_LBSPPA2048_LBSPPB512_LPA0_MIWT8_8_PLR1_SU0_SUM0_SUS64_VWA8_VWB8_WGM6_WGMXCC1_WGMXCCGn1
    SolutionIndex: 10
    SolutionNameMin: Cijk_Ailk_Bljk_BBS_BH_Bias_AS_SAV_UserArgs_MT256x256x32_MI16x16x1_SN_LDSB1_CLR1_GRVWA8_GSU0_GSUC0_GSUWGMRR0_K1_LBSPPA2048_LBSPPB512_LPA0_MIWT8_8_PLR1_SU0_SUM0_SUS64_VWA8_VWB8_WGM6_WGMXCC1_WGMXCCGn1
    SolutionIndex: 11
    SolutionNameMin: Cijk_Ailk_Bljk_BBS_BH_Bias_AS_SAV_UserArgs_MT256x256x32_MI16x16x1_SN_LDSB1_CLR1_GRVWA8_GSU0_GSUC0_GSUWGMRR0_K1_LBSPPA2048_LBSPPB512_LPA0_MIWT8_8_PLR1_SU0_SUM0_SUS64_VWA8_VWB8_WGM6_WGMXCC1_WGMXCCGn1
    SolutionIndex: 12
    SolutionNameMin: Cijk_Ailk_Bljk_BBS_BH_Bias_AS_SAV_UserArgs_MT256x256x32_MI16x16x1_SN_LDSB1_CLR1_GRVWA8_GSU0_GSUC0_GSUWGMRR0_K1_LBSPPA4096_LBSPPB512_LPA0_MIWT8_8_PLR1_SU0_SUM0_SUS64_VWA8_VWB8_WGM6_WGMXCC1_WGMXCCGn1
    SolutionIndex: 13
    SolutionNameMin: Cijk_Ailk_Bljk_BBS_BH_Bias_AS_SAV_UserArgs_MT256x256x32_MI16x16x1_SN_LDSB1_CLR1_GRVWA8_GSU0_GSUC0_GSUWGMRR0_K1_LBSPPA2048_LBSPPB512_LPA0_MIWT8_8_PLR1_SU0_SUM0_SUS64_VWA8_VWB8_WGM8_WGMXCC1_WGMXCCGn1
    SolutionIndex: 14
    SolutionNameMin: Cijk_Ailk_Bljk_BBS_BH_Bias_AS_SAV_UserArgs_MT128x256x32_MI16x16x1_SN_LDSB1_CLR1_GRVWA8_GSU0_GSUC0_GSUWGMRR0_K1_LBSPPA1024_LBSPPB512_LPA0_MIWT4_8_PLR1_SU0_SUM0_SUS64_VWA4_VWB8_WGM1_WGMXCC1_WGMXCCGn1
    SolutionIndex: 15
    SolutionNameMin: Cijk_Ailk_Bljk_BBS_BH_Bias_AS_SAV_UserArgs_MT256x128x32_MI16x16x1_SN_LDSB1_CLR1_GRVWA8_GSU0_GSUC0_GSUWGMRR0_K1_LBSPPA2048_LBSPPB256_LPA0_MIWT8_4_PLR1_SU0_SUM0_SUS64_VWA8_VWB4_WGM1_WGMXCC1_WGMXCCGn1
    SolutionIndex: 16
    SolutionNameMin: Cijk_Ailk_Bljk_BBS_BH_Bias_AS_SAV_UserArgs_MT256x128x32_MI16x16x1_SN_LDSB1_CLR1_GRVWA8_GSU0_GSUC0_GSUWGMRR0_K1_LBSPPA2048_LBSPPB256_LPA0_MIWT8_4_PLR1_SU0_SUM0_SUS64_VWA8_VWB4_WGM1_WGMXCC1_WGMXCCGn1
    SolutionIndex: 17
    SolutionNameMin: Cijk_Ailk_Bljk_BBS_BH_Bias_AS_SAV_UserArgs_MT256x128x32_MI16x16x1_SN_LDSB1_CLR1_GRVWA2_GSU0_GSUC0_GSUWGMRR0_K1_LBSPPA2048_LBSPPB256_LPA0_MIWT8_4_PLR1_SU0_SUM0_SUS64_VWA8_VWB4_WGM1_WGMXCC1_WGMXCCGn1
    SolutionIndex: 18
    SolutionNameMin: Cijk_Ailk_Bljk_BBS_BH_Bias_AS_SAV_UserArgs_MT256x128x32_MI16x16x1_SN_LDSB1_CLR1_GRVWA8_GSU0_GSUC0_GSUWGMRR0_K1_LBSPPA2048_LBSPPB256_LPA0_MIWT8_4_PLR1_SU0_SUM0_SUS64_VWA8_VWB4_WGM1_WGMXCC1_WGMXCCGn1
    SolutionIndex: 19
    SolutionNameMin: Cijk_Ailk_Bljk_BBS_BH_Bias_AS_SAV_UserArgs_MT256x128x32_MI16x16x1_SN_LDSB1_CLR1_GRVWA8_GSU0_GSUC0_GSUWGMRR0_K1_LBSPPA2048_LBSPPB256_LPA0_MIWT8_4_PLR1_SU0_SUM0_SUS64_VWA8_VWB4_WGM4_WGMXCC1_WGMXCCGn1
    SolutionIndex: 20
    SolutionNameMin: Cijk_Ailk_Bljk_BBS_BH_Bias_AS_SAV_UserArgs_MT256x128x32_MI16x16x1_SN_LDSB1_CLR1_GRVWA8_GSU0_GSUC0_GSUWGMRR0_K1_LBSPPA2048_LBSPPB256_LPA0_MIWT8_4_PLR1_SU0_SUM0_SUS64_VWA8_VWB4_WGM6_WGMXCC1_WGMXCCGn1
    SolutionIndex: 21
    SolutionNameMin: Cijk_Ailk_Bljk_BBS_BH_Bias_AS_SAV_UserArgs_MT256x128x32_MI16x16x1_SN_LDSB1_CLR1_GRVWA8_GSU0_GSUC0_GSUWGMRR0_K1_LBSPPA2048_LBSPPB256_LPA0_MIWT8_4_PLR1_SU0_SUM0_SUS64_VWA8_VWB4_WGM8_WGMXCC1_WGMXCCGn1
    SolutionIndex: 22
    SolutionNameMin: Cijk_Ailk_Bljk_BBS_BH_Bias_AS_SAV_UserArgs_MT256x128x32_MI16x16x1_SN_LDSB1_CLR1_GRVWA8_GSU0_GSUC0_GSUWGMRR0_K1_LBSPPA2048_LBSPPB256_LPA0_MIWT8_4_PLR1_SU0_SUM0_SUS64_VWA8_VWB4_WGM8_WGMXCC1_WGMXCCGn1
    SolutionIndex: 23
    SolutionNameMin: Cijk_Ailk_Bljk_BBS_BH_Bias_AS_SAV_UserArgs_MT256x64x32_MI16x16x1_SN_LDSB1_CLR1_GRVWA8_GSU0_GSUC0_GSUWGMRR0_K1_LBSPPA2048_LBSPPB128_LPA0_MIWT8_2_PLR1_SU0_SUM0_SUS64_VWA8_VWB2_WGM1_WGMXCC1_WGMXCCGn1
    SolutionIndex: 24
    SolutionNameMin: Cijk_Ailk_Bljk_BBS_BH_Bias_AS_SAV_UserArgs_MT128x64x32_MI16x16x1_SN_LDSB0_CLR1_GRVWA8_GSU0_GSUC0_GSUWGMRR0_K1_LBSPPA1024_LBSPPB128_LPA0_MIWT4_2_PLR1_SU0_SUM0_SUS64_VWA4_VWB2_WGM1_WGMXCC1_WGMXCCGn1
    SolutionIndex: 25
    SolutionNameMin: Cijk_Ailk_Bljk_BBS_BH_Bias_AS_SAV_UserArgs_MT128x32x32_MI16x16x1_SN_LDSB0_CLR1_GRVWA8_GSU0_GSUC0_GSUWGMRR0_K1_LBSPPA1024_LBSPPB128_LPA0_MIWT4_1_PLR1_SU0_SUM0_SUS64_VWA4_VWB1_WGM1_WGMXCC1_WGMXCCGn1
    SolutionIndex: 26
    SolutionNameMin: Cijk_Ailk_Bljk_BBS_BH_Bias_AS_SAV_UserArgs_MT64x64x32_MI16x16x1_SN_LDSB0_CLR1_GRVWA2_GSU0_GSUC0_GSUWGMRR0_K1_LBSPPA512_LBSPPB128_LPA32_MIWT2_2_PLR1_SU0_SUM0_SUS64_VWA2_VWB2_WGM1_WGMXCC1_WGMXCCGn1
    SolutionIndex: 27
    SolutionNameMin: Cijk_Ailk_Bljk_BBS_BH_Bias_AS_SAV_UserArgs_MT64x64x32_MI16x16x1_SN_LDSB0_CLR1_GRVWA8_GSU0_GSUC0_GSUWGMRR0_K1_LBSPPA512_LBSPPB128_LPA32_MIWT2_2_PLR1_SU0_SUM0_SUS64_VWA2_VWB2_WGM1_WGMXCC1_WGMXCCGn1
    SolutionIndex: 28
    SolutionNameMin: Cijk_Ailk_Bljk_BBS_BH_Bias_AS_SAV_UserArgs_MT64x64x32_MI16x16x1_SN_LDSB0_CLR1_GRVWA2_GSU0_GSUC0_GSUWGMRR0_K1_LBSPPA512_LBSPPB128_LPA32_MIWT2_2_PLR1_SU0_SUM0_SUS64_VWA2_VWB2_WGM6_WGMXCC1_WGMXCCGn1
    SolutionIndex: 29
    SolutionNameMin: Cijk_Ailk_Bljk_BBS_BH_Bias_AS_SAV_UserArgs_MT128x256x64_MI16x16x1_SN_LDSB1_CLR1_GRVWA8_GSU0_GSUC0_GSUWGMRR0_K1_LBSPPA2048_LBSPPB1024_LPA0_MIWT4_8_PLR1_SU0_SUM0_SUS128_VWA4_VWB8_WGM1_WGMXCC1_WGMXCCGn1
    SolutionIndex: 30
    SolutionNameMin: Cijk_Ailk_Bljk_BBS_BH_Bias_AS_SAV_UserArgs_MT128x256x64_MI16x16x1_SN_LDSB1_CLR1_GRVWA2_GSU0_GSUC0_GSUWGMRR0_K1_LBSPPA2048_LBSPPB1024_LPA0_MIWT4_8_PLR1_SU0_SUM0_SUS128_VWA4_VWB8_WGM1_WGMXCC1_WGMXCCGn1
    SolutionIndex: 31
    SolutionNameMin: Cijk_Ailk_Bljk_BBS_BH_Bias_AS_SAV_UserArgs_MT128x256x64_MI16x16x1_SN_LDSB1_CLR1_GRVWA4_GSU0_GSUC0_GSUWGMRR0_K1_LBSPPA2048_LBSPPB1024_LPA0_MIWT4_8_PLR1_SU0_SUM0_SUS128_VWA4_VWB8_WGM1_WGMXCC1_WGMXCCGn1
    SolutionIndex: 32
    SolutionNameMin: Cijk_Ailk_Bljk_BBS_BH_Bias_AS_SAV_UserArgs_MT128x256x64_MI16x16x1_SN_LDSB1_CLR1_GRVWA8_GSU0_GSUC0_GSUWGMRR0_K1_LBSPPA2048_LBSPPB1024_LPA0_MIWT4_8_PLR1_SU0_SUM0_SUS128_VWA4_VWB8_WGM1_WGMXCC1_WGMXCCGn1
    SolutionIndex: 33
    SolutionNameMin: Cijk_Ailk_Bljk_BBS_BH_Bias_AS_SAV_UserArgs_MT128x256x64_MI16x16x1_SN_LDSB1_CLR1_GRVWA8_GSU0_GSUC0_GSUWGMRR0_K1_LBSPPA2048_LBSPPB1024_LPA0_MIWT4_8_PLR1_SU0_SUM0_SUS128_VWA4_VWB8_WGM4_WGMXCC1_WGMXCCGn1
    SolutionIndex: 34
    SolutionNameMin: Cijk_Ailk_Bljk_BBS_BH_Bias_AS_SAV_UserArgs_MT128x256x64_MI16x16x1_SN_LDSB1_CLR1_GRVWA4_GSU0_GSUC0_GSUWGMRR0_K1_LBSPPA2048_LBSPPB1024_LPA0_MIWT4_8_PLR1_SU0_SUM0_SUS128_VWA4_VWB8_WGM6_WGMXCC1_WGMXCCGn1
    SolutionIndex: 35
    SolutionNameMin: Cijk_Ailk_Bljk_BBS_BH_Bias_AS_SAV_UserArgs_MT128x256x64_MI16x16x1_SN_LDSB1_CLR1_GRVWA8_GSU0_GSUC0_GSUWGMRR0_K1_LBSPPA2048_LBSPPB1024_LPA0_MIWT4_8_PLR1_SU0_SUM0_SUS128_VWA4_VWB8_WGM6_WGMXCC1_WGMXCCGn1
    SolutionIndex: 36
    SolutionNameMin: Cijk_Ailk_Bljk_BBS_BH_Bias_AS_SAV_UserArgs_MT128x256x64_MI16x16x1_SN_LDSB1_CLR1_GRVWA8_GSU0_GSUC0_GSUWGMRR0_K1_LBSPPA2048_LBSPPB1024_LPA0_MIWT4_8_PLR1_SU0_SUM0_SUS128_VWA4_VWB8_WGM8_WGMXCC1_WGMXCCGn1
    SolutionIndex: 37
    SolutionNameMin: Cijk_Ailk_Bljk_BBS_BH_Bias_AS_SAV_UserArgs_MT256x128x64_MI16x16x1_SN_LDSB1_CLR1_GRVWA2_GSU0_GSUC0_GSUWGMRR0_K1_LBSPPA4096_LBSPPB512_LPA0_MIWT8_4_PLR1_SU0_SUM0_SUS128_VWA8_VWB4_WGM1_WGMXCC1_WGMXCCGn1
    SolutionIndex: 38
    SolutionNameMin: Cijk_Ailk_Bljk_BBS_BH_Bias_AS_SAV_UserArgs_MT256x128x64_MI16x16x1_SN_LDSB1_CLR1_GRVWA8_GSU0_GSUC0_GSUWGMRR0_K1_LBSPPA4096_LBSPPB512_LPA0_MIWT8_4_PLR1_SU0_SUM0_SUS128_VWA8_VWB4_WGM1_WGMXCC1_WGMXCCGn1
    SolutionIndex: 39
    SolutionNameMin: Cijk_Ailk_Bljk_BBS_BH_Bias_AS_SAV_UserArgs_MT256x128x64_MI16x16x1_SN_LDSB1_CLR1_GRVWA8_GSU0_GSUC0_GSUWGMRR0_K1_LBSPPA4096_LBSPPB512_LPA0_MIWT8_4_PLR1_SU0_SUM0_SUS128_VWA8_VWB4_WGM4_WGMXCC1_WGMXCCGn1
    SolutionIndex: 40
    SolutionNameMin: Cijk_Ailk_Bljk_BBS_BH_Bias_AS_SAV_UserArgs_MT256x128x64_MI16x16x1_SN_LDSB1_CLR1_GRVWA8_GSU0_GSUC0_GSUWGMRR0_K1_LBSPPA4096_LBSPPB512_LPA0_MIWT8_4_PLR1_SU0_SUM0_SUS128_VWA8_VWB4_WGM4_WGMXCC1_WGMXCCGn1
    SolutionIndex: 41
    SolutionNameMin: Cijk_Ailk_Bljk_BBS_BH_Bias_AS_SAV_UserArgs_MT256x128x64_MI16x16x1_SN_LDSB1_CLR1_GRVWA8_GSU0_GSUC0_GSUWGMRR0_K1_LBSPPA4096_LBSPPB512_LPA0_MIWT8_4_PLR1_SU0_SUM0_SUS128_VWA8_VWB4_WGM6_WGMXCC1_WGMXCCGn1
    SolutionIndex: 42
    SolutionNameMin: Cijk_Ailk_Bljk_BBS_BH_Bias_AS_SAV_UserArgs_MT256x128x64_MI16x16x1_SN_LDSB1_CLR1_GRVWA8_GSU0_GSUC0_GSUWGMRR0_K1_LBSPPA4096_LBSPPB512_LPA0_MIWT8_4_PLR1_SU0_SUM0_SUS128_VWA8_VWB4_WGM6_WGMXCC1_WGMXCCGn1
    SolutionIndex: 43
    SolutionNameMin: Cijk_Ailk_Bljk_BBS_BH_Bias_AS_SAV_UserArgs_MT256x128x64_MI16x16x1_SN_LDSB1_CLR1_GRVWA8_GSU0_GSUC0_GSUWGMRR0_K1_LBSPPA4096_LBSPPB512_LPA0_MIWT8_4_PLR1_SU0_SUM0_SUS128_VWA8_VWB4_WGM8_WGMXCC1_WGMXCCGn1
    SolutionIndex: 44
    SolutionNameMin: Cijk_Ailk_Bljk_BBS_BH_Bias_AS_SAV_UserArgs_MT256x64x64_MI16x16x1_SN_LDSB1_CLR1_GRVWA8_GSU0_GSUC0_GSUWGMRR0_K1_LBSPPA4096_LBSPPB256_LPA0_MIWT8_2_PLR1_SU0_SUM0_SUS128_VWA8_VWB2_WGM1_WGMXCC1_WGMXCCGn1
    SolutionIndex: 45
    SolutionNameMin: Cijk_Ailk_Bljk_BBS_BH_Bias_AS_SAV_UserArgs_MT256x64x64_MI16x16x1_SN_LDSB1_CLR1_GRVWA8_GSU0_GSUC0_GSUWGMRR0_K1_LBSPPA4096_LBSPPB256_LPA0_MIWT8_2_PLR1_SU0_SUM0_SUS128_VWA8_VWB2_WGM4_WGMXCC1_WGMXCCGn1
    SolutionIndex: 46
    SolutionNameMin: Cijk_Ailk_Bljk_BBS_BH_Bias_AS_SAV_UserArgs_MT256x64x64_MI16x16x1_SN_LDSB1_CLR1_GRVWA8_GSU0_GSUC0_GSUWGMRR0_K1_LBSPPA4096_LBSPPB256_LPA0_MIWT8_2_PLR1_SU0_SUM0_SUS128_VWA8_VWB2_WGM8_WGMXCC1_WGMXCCGn1
    SolutionIndex: 47
    SolutionNameMin: Cijk_Ailk_Bljk_BBS_BH_Bias_AS_SAV_UserArgs_MT128x128x64_MI16x16x1_SN_LDSB1_CLR1_GRVWA8_GSU0_GSUC0_GSUWGMRR0_K1_LBSPPA1024_LBSPPB512_LPA0_MIWT4_4_PLR1_SU0_SUM0_SUS128_VWA4_VWB4_WGM1_WGMXCC1_WGMXCCGn1
    SolutionIndex: 48
    SolutionNameMin: Cijk_Ailk_Bljk_BBS_BH_Bias_AS_SAV_UserArgs_MT128x128x64_MI16x16x1_SN_LDSB1_CLR1_GRVWA8_GSU0_GSUC0_GSUWGMRR0_K1_LBSPPA2048_LBSPPB512_LPA0_MIWT4_4_PLR1_SU0_SUM0_SUS128_VWA4_VWB4_WGM1_WGMXCC1_WGMXCCGn1
    SolutionIndex: 49
    SolutionNameMin: Cijk_Ailk_Bljk_BBS_BH_Bias_AS_SAV_UserArgs_MT128x128x64_MI16x16x1_SN_LDSB1_CLR1_GRVWA8_GSU0_GSUC0_GSUWGMRR0_K1_LBSPPA1024_LBSPPB512_LPA0_MIWT4_4_PLR1_SU0_SUM0_SUS128_VWA4_VWB4_WGM4_WGMXCC1_WGMXCCGn1
    SolutionIndex: 50
    SolutionNameMin: Cijk_Ailk_Bljk_BBS_BH_Bias_AS_SAV_UserArgs_MT128x128x64_MI16x16x1_SN_LDSB1_CLR1_GRVWA2_GSU0_GSUC0_GSUWGMRR0_K1_LBSPPA2048_LBSPPB512_LPA0_MIWT4_4_PLR1_SU0_SUM0_SUS128_VWA4_VWB4_WGM4_WGMXCC1_WGMXCCGn1
    SolutionIndex: 51
    SolutionNameMin: Cijk_Ailk_Bljk_BBS_BH_Bias_AS_SAV_UserArgs_MT128x128x64_MI16x16x1_SN_LDSB1_CLR1_GRVWA8_GSU0_GSUC0_GSUWGMRR0_K1_LBSPPA2048_LBSPPB512_LPA0_MIWT4_4_PLR1_SU0_SUM0_SUS128_VWA4_VWB4_WGM4_WGMXCC1_WGMXCCGn1
    SolutionIndex: 52
    SolutionNameMin: Cijk_Ailk_Bljk_BBS_BH_Bias_AS_SAV_UserArgs_MT128x128x64_MI16x16x1_SN_LDSB1_CLR1_GRVWA2_GSU0_GSUC0_GSUWGMRR0_K1_LBSPPA2048_LBSPPB512_LPA0_MIWT4_4_PLR1_SU0_SUM0_SUS128_VWA4_VWB4_WGM6_WGMXCC1_WGMXCCGn1
    SolutionIndex: 53
    SolutionNameMin: Cijk_Ailk_Bljk_BBS_BH_Bias_AS_SAV_UserArgs_MT128x128x64_MI16x16x1_SN_LDSB1_CLR1_GRVWA8_GSU0_GSUC0_GSUWGMRR0_K1_LBSPPA2048_LBSPPB512_LPA0_MIWT4_4_PLR1_SU0_SUM0_SUS128_VWA4_VWB4_WGM6_WGMXCC1_WGMXCCGn1
    SolutionIndex: 54
    SolutionNameMin: Cijk_Ailk_Bljk_BBS_BH_Bias_AS_SAV_UserArgs_MT128x128x64_MI16x16x1_SN_LDSB1_CLR1_GRVWA2_GSU0_GSUC0_GSUWGMRR0_K1_LBSPPA2048_LBSPPB512_LPA0_MIWT4_4_PLR1_SU0_SUM0_SUS128_VWA4_VWB4_WGM8_WGMXCC1_WGMXCCGn1
    SolutionIndex: 55
    SolutionNameMin: Cijk_Ailk_Bljk_BBS_BH_Bias_AS_SAV_UserArgs_MT128x128x64_MI16x16x1_SN_LDSB1_CLR1_GRVWA8_GSU0_GSUC0_GSUWGMRR0_K1_LBSPPA2048_LBSPPB512_LPA0_MIWT4_4_PLR1_SU0_SUM0_SUS128_VWA4_VWB4_WGM8_WGMXCC1_WGMXCCGn1
    SolutionIndex: 56
    SolutionNameMin: Cijk_Ailk_Bljk_BBS_BH_Bias_AS_SAV_UserArgs_MT64x128x64_MI16x16x1_SN_LDSB1_CLR1_GRVWA4_GSU0_GSUC0_GSUWGMRR0_K1_LBSPPA1024_LBSPPB512_LPA32_MIWT2_4_PLR1_SU0_SUM0_SUS128_VWA2_VWB4_WGM1_WGMXCC1_WGMXCCGn1
    SolutionIndex: 57
    SolutionNameMin: Cijk_Ailk_Bljk_BBS_BH_Bias_AS_SAV_UserArgs_MT128x64x64_MI16x16x1_SN_LDSB1_CLR1_GRVWA8_GSU0_GSUC0_GSUWGMRR0_K1_LBSPPA1024_LBSPPB256_LPA0_MIWT4_2_PLR1_SU0_SUM0_SUS128_VWA4_VWB2_WGM1_WGMXCC1_WGMXCCGn1
    SolutionIndex: 58
    SolutionNameMin: Cijk_Ailk_Bljk_BBS_BH_Bias_AS_SAV_UserArgs_MT128x64x64_MI16x16x1_SN_LDSB1_CLR1_GRVWA8_GSU0_GSUC0_GSUWGMRR0_K1_LBSPPA2048_LBSPPB256_LPA0_MIWT4_2_PLR1_SU0_SUM0_SUS128_VWA4_VWB2_WGM1_WGMXCC1_WGMXCCGn1
    SolutionIndex: 59
    SolutionNameMin: Cijk_Ailk_Bljk_BBS_BH_Bias_AS_SAV_UserArgs_MT128x64x64_MI16x16x1_SN_LDSB1_CLR1_GRVWA8_GSU0_GSUC0_GSUWGMRR0_K1_LBSPPA2048_LBSPPB256_LPA0_MIWT4_2_PLR1_SU0_SUM0_SUS128_VWA4_VWB2_WGM1_WGMXCC1_WGMXCCGn1
    SolutionIndex: 60
    SolutionNameMin: Cijk_Ailk_Bljk_BBS_BH_Bias_AS_SAV_UserArgs_MT128x64x64_MI16x16x1_SN_LDSB1_CLR1_GRVWA2_GSU0_GSUC0_GSUWGMRR0_K1_LBSPPA2048_LBSPPB256_LPA0_MIWT4_2_PLR1_SU0_SUM0_SUS128_VWA4_VWB2_WGM4_WGMXCC1_WGMXCCGn1
    SolutionIndex: 61
    SolutionNameMin: Cijk_Ailk_Bljk_BBS_BH_Bias_AS_SAV_UserArgs_MT128x64x64_MI16x16x1_SN_LDSB1_CLR1_GRVWA8_GSU0_GSUC0_GSUWGMRR0_K1_LBSPPA2048_LBSPPB256_LPA0_MIWT4_2_PLR1_SU0_SUM0_SUS128_VWA4_VWB2_WGM4_WGMXCC1_WGMXCCGn1
    SolutionIndex: 62
    SolutionNameMin: Cijk_Ailk_Bljk_BBS_BH_Bias_AS_SAV_UserArgs_MT128x64x64_MI16x16x1_SN_LDSB1_CLR1_GRVWA8_GSU0_GSUC0_GSUWGMRR0_K1_LBSPPA2048_LBSPPB256_LPA0_MIWT4_2_PLR1_SU0_SUM0_SUS128_VWA4_VWB2_WGM6_WGMXCC1_WGMXCCGn1
    SolutionIndex: 63
    SolutionNameMin: Cijk_Ailk_Bljk_BBS_BH_Bias_AS_SAV_UserArgs_MT128x64x64_MI16x16x1_SN_LDSB1_CLR1_GRVWA8_GSU0_GSUC0_GSUWGMRR0_K1_LBSPPA2048_LBSPPB256_LPA0_MIWT4_2_PLR1_SU0_SUM0_SUS128_VWA4_VWB2_WGM8_WGMXCC1_WGMXCCGn1
    SolutionIndex: 64
    SolutionNameMin: Cijk_Ailk_Bljk_BBS_BH_Bias_AS_SAV_UserArgs_MT128x32x64_MI16x16x1_SN_LDSB1_CLR1_GRVWA8_GSU0_GSUC0_GSUWGMRR0_K1_LBSPPA1024_LBSPPB128_LPA0_MIWT4_1_PLR1_SU0_SUM0_SUS128_VWA4_VWB1_WGM1_WGMXCC1_WGMXCCGn1
    SolutionIndex: 65
    SolutionNameMin: Cijk_Ailk_Bljk_BBS_BH_Bias_AS_SAV_UserArgs_MT64x64x64_MI16x16x1_SN_LDSB1_CLR1_GRVWA2_GSU0_GSUC0_GSUWGMRR0_K1_LBSPPA1024_LBSPPB256_LPA32_MIWT2_2_PLR1_SU0_SUM0_SUS128_VWA2_VWB2_WGM1_WGMXCC1_WGMXCCGn1
    SolutionIndex: 66
    SolutionNameMin: Cijk_Ailk_Bljk_BBS_BH_Bias_AS_SAV_UserArgs_MT64x64x64_MI16x16x1_SN_LDSB1_CLR1_GRVWA8_GSU0_GSUC0_GSUWGMRR0_K1_LBSPPA1024_LBSPPB256_LPA32_MIWT2_2_PLR1_SU0_SUM0_SUS128_VWA2_VWB2_WGM1_WGMXCC1_WGMXCCGn1
    SolutionIndex: 67
    SolutionNameMin: Cijk_Ailk_Bljk_BBS_BH_Bias_AS_SAV_UserArgs_MT64x64x64_MI16x16x1_SN_LDSB1_CLR1_GRVWA2_GSU0_GSUC0_GSUWGMRR0_K1_LBSPPA1024_LBSPPB256_LPA32_MIWT2_2_PLR1_SU0_SUM0_SUS128_VWA2_VWB2_WGM4_WGMXCC1_WGMXCCGn1
    SolutionIndex: 68
    SolutionNameMin: Cijk_Ailk_Bljk_BBS_BH_Bias_AS_SAV_UserArgs_MT64x64x64_MI16x16x1_SN_LDSB1_CLR1_GRVWA2_GSU0_GSUC0_GSUWGMRR0_K1_LBSPPA1024_LBSPPB256_LPA32_MIWT2_2_PLR1_SU0_SUM0_SUS128_VWA2_VWB2_WGM6_WGMXCC1_WGMXCCGn1
    SolutionIndex: 69
    SolutionNameMin: Cijk_Ailk_Bljk_BBS_BH_Bias_AS_SAV_UserArgs_MT64x64x64_MI16x16x1_SN_LDSB1_CLR1_GRVWA2_GSU0_GSUC0_GSUWGMRR0_K1_LBSPPA512_LBSPPB256_LPA32_MIWT2_2_PLR1_SU0_SUM0_SUS128_VWA2_VWB2_WGM8_WGMXCC1_WGMXCCGn1
    SolutionIndex: 70
    SolutionNameMin: Cijk_Ailk_Bljk_BBS_BH_Bias_AS_SAV_UserArgs_MT64x64x64_MI16x16x1_SN_LDSB1_CLR1_GRVWA2_GSU0_GSUC0_GSUWGMRR0_K1_LBSPPA1024_LBSPPB256_LPA32_MIWT2_2_PLR1_SU0_SUM0_SUS128_VWA2_VWB2_WGM8_WGMXCC1_WGMXCCGn1
    SolutionIndex: 71
    SolutionNameMin: Cijk_Ailk_Bljk_BBS_BH_Bias_AS_SAV_UserArgs_MT32x64x64_MI16x16x1_SN_LDSB0_CLR1_GRVWA2_GSU0_GSUC0_GSUWGMRR0_K1_LBSPPA256_LBSPPB256_LPA16_MIWT1_2_PLR1_SU0_SUM0_SUS128_VWA1_VWB2_WGM1_WGMXCC1_WGMXCCGn1
    SolutionIndex: 72
    SolutionNameMin: Cijk_Ailk_Bljk_BBS_BH_Bias_AS_SAV_UserArgs_MT32x64x64_MI16x16x1_SN_LDSB0_CLR1_GRVWA2_GSU0_GSUC0_GSUWGMRR0_K1_LBSPPA512_LBSPPB256_LPA16_MIWT1_2_PLR1_SU0_SUM0_SUS128_VWA1_VWB2_WGM1_WGMXCC1_WGMXCCGn1
    SolutionIndex: 73
    SolutionNameMin: Cijk_Ailk_Bljk_BBS_BH_Bias_AS_SAV_UserArgs_MT64x32x64_MI16x16x1_SN_LDSB0_CLR1_GRVWA2_GSU0_GSUC0_GSUWGMRR0_K1_LBSPPA512_LBSPPB128_LPA32_MIWT2_1_PLR1_SU0_SUM0_SUS128_VWA2_VWB1_WGM1_WGMXCC1_WGMXCCGn1
    SolutionIndex: 74
    SolutionNameMin: Cijk_Ailk_Bljk_BBS_BH_Bias_AS_SAV_UserArgs_MT64x32x64_MI16x16x1_SN_LDSB0_CLR1_GRVWA8_GSU0_GSUC0_GSUWGMRR0_K1_LBSPPA512_LBSPPB128_LPA32_MIWT2_1_PLR1_SU0_SUM0_SUS128_VWA2_VWB1_WGM1_WGMXCC1_WGMXCCGn1
    SolutionIndex: 75
    SolutionNameMin: Cijk_Ailk_Bljk_BBS_BH_Bias_AS_SAV_UserArgs_MT64x32x64_MI16x16x1_SN_LDSB0_CLR1_GRVWA2_GSU0_GSUC0_GSUWGMRR0_K1_LBSPPA1024_LBSPPB128_LPA32_MIWT2_1_PLR1_SU0_SUM0_SUS128_VWA2_VWB1_WGM1_WGMXCC1_WGMXCCGn1
    SolutionIndex: 76
    SolutionNameMin: Cijk_Ailk_Bljk_BBS_BH_Bias_AS_SAV_UserArgs_MT64x32x64_MI16x16x1_SN_LDSB0_CLR1_GRVWA8_GSU0_GSUC0_GSUWGMRR0_K1_LBSPPA1024_LBSPPB128_LPA32_MIWT2_1_PLR1_SU0_SUM0_SUS128_VWA2_VWB1_WGM1_WGMXCC1_WGMXCCGn1
    SolutionIndex: 77
    SolutionNameMin: Cijk_Ailk_Bljk_BBS_BH_Bias_AS_SAV_UserArgs_MT64x32x64_MI16x16x1_SN_LDSB0_CLR1_GRVWA2_GSU0_GSUC0_GSUWGMRR0_K1_LBSPPA1024_LBSPPB128_LPA32_MIWT2_1_PLR1_SU0_SUM0_SUS128_VWA2_VWB1_WGM4_WGMXCC1_WGMXCCGn1
    SolutionIndex: 78
    SolutionNameMin: Cijk_Ailk_Bljk_BBS_BH_Bias_AS_SAV_UserArgs_MT64x32x64_MI16x16x1_SN_LDSB0_CLR1_GRVWA2_GSU0_GSUC0_GSUWGMRR0_K1_LBSPPA1024_LBSPPB128_LPA32_MIWT2_1_PLR1_SU0_SUM0_SUS128_VWA2_VWB1_WGM6_WGMXCC1_WGMXCCGn1
    SolutionIndex: 79
    SolutionNameMin: Cijk_Ailk_Bljk_BBS_BH_Bias_AS_SAV_UserArgs_MT64x32x64_MI16x16x1_SN_LDSB0_CLR1_GRVWA2_GSU0_GSUC0_GSUWGMRR0_K1_LBSPPA1024_LBSPPB128_LPA32_MIWT2_1_PLR1_SU0_SUM0_SUS128_VWA2_VWB1_WGM6_WGMXCC1_WGMXCCGn1
    SolutionIndex: 80
    SolutionNameMin: Cijk_Ailk_Bljk_BBS_BH_Bias_AS_SAV_UserArgs_MT32x32x64_MI16x16x1_SN_LDSB0_CLR1_GRVWA2_GSU0_GSUC0_GSUWGMRR0_K1_LBSPPA256_LBSPPB128_LPA16_MIWT1_1_PLR1_SU0_SUM0_SUS128_VWA1_VWB1_WGM1_WGMXCC1_WGMXCCGn1
    SolutionIndex: 81
    SolutionNameMin: Cijk_Ailk_Bljk_BBS_BH_Bias_AS_SAV_UserArgs_MT32x32x64_MI16x16x1_SN_LDSB0_CLR1_GRVWA8_GSU0_GSUC0_GSUWGMRR0_K1_LBSPPA256_LBSPPB128_LPA16_MIWT1_1_PLR1_SU0_SUM0_SUS128_VWA1_VWB1_WGM1_WGMXCC1_WGMXCCGn1
    SolutionIndex: 82
    SolutionNameMin: Cijk_Ailk_Bljk_BBS_BH_Bias_AS_SAV_UserArgs_MT32x32x64_MI16x16x1_SN_LDSB0_CLR1_GRVWA2_GSU0_GSUC0_GSUWGMRR0_K1_LBSPPA512_LBSPPB128_LPA16_MIWT1_1_PLR1_SU0_SUM0_SUS128_VWA1_VWB1_WGM1_WGMXCC1_WGMXCCGn1
    SolutionIndex: 83
    SolutionNameMin: Cijk_Ailk_Bljk_BBS_BH_Bias_AS_SAV_UserArgs_MT32x32x64_MI16x16x1_SN_LDSB0_CLR1_GRVWA2_GSU0_GSUC0_GSUWGMRR0_K1_LBSPPA256_LBSPPB128_LPA16_MIWT1_1_PLR1_SU0_SUM0_SUS128_VWA1_VWB1_WGM4_WGMXCC1_WGMXCCGn1
    SolutionIndex: 84
    SolutionNameMin: Cijk_Ailk_Bljk_BBS_BH_Bias_AS_SAV_UserArgs_MT32x32x64_MI16x16x1_SN_LDSB0_CLR1_GRVWA8_GSU0_GSUC0_GSUWGMRR0_K1_LBSPPA512_LBSPPB128_LPA16_MIWT1_1_PLR1_SU0_SUM0_SUS128_VWA1_VWB1_WGM6_WGMXCC1_WGMXCCGn1
    SolutionIndex: 85
    SolutionNameMin: Cijk_Ailk_Bljk_BBS_BH_Bias_AS_SAV_UserArgs_MT32x32x64_MI16x16x1_SN_LDSB0_CLR1_GRVWA2_GSU0_GSUC0_GSUWGMRR0_K1_LBSPPA512_LBSPPB128_LPA16_MIWT1_1_PLR1_SU0_SUM0_SUS128_VWA1_VWB1_WGM8_WGMXCC1_WGMXCCGn1
    SolutionIndex: 86
    SolutionNameMin: Cijk_Ailk_Bljk_BBS_BH_Bias_AS_SAV_UserArgs_MT128x64x128_MI16x16x1_SN_LDSB1_CLR1_GRVWA8_GSU0_GSUC0_GSUWGMRR0_K1_LBSPPA1024_LBSPPB512_LPA0_MIWT4_2_PLR1_SU0_SUM0_SUS256_VWA4_VWB2_WGM1_WGMXCC1_WGMXCCGn1
    SolutionIndex: 87
    SolutionNameMin: Cijk_Ailk_Bljk_BBS_BH_Bias_AS_SAV_UserArgs_MT128x64x128_MI16x16x1_SN_LDSB1_CLR1_GRVWA8_GSU0_GSUC0_GSUWGMRR0_K1_LBSPPA2048_LBSPPB512_LPA0_MIWT4_2_PLR1_SU0_SUM0_SUS256_VWA4_VWB2_WGM1_WGMXCC1_WGMXCCGn1
    SolutionIndex: 88
    SolutionNameMin: Cijk_Ailk_Bljk_BBS_BH_Bias_AS_SAV_UserArgs_MT128x64x128_MI16x16x1_SN_LDSB1_CLR1_GRVWA8_GSU0_GSUC0_GSUWGMRR0_K1_LBSPPA2048_LBSPPB512_LPA0_MIWT4_2_PLR1_SU0_SUM0_SUS256_VWA4_VWB2_WGM4_WGMXCC1_WGMXCCGn1
    SolutionIndex: 89
    SolutionNameMin: Cijk_Ailk_Bljk_BBS_BH_Bias_AS_SAV_UserArgs_MT128x64x128_MI16x16x1_SN_LDSB1_CLR1_GRVWA8_GSU0_GSUC0_GSUWGMRR0_K1_LBSPPA2048_LBSPPB512_LPA0_MIWT4_2_PLR1_SU0_SUM0_SUS256_VWA4_VWB2_WGM6_WGMXCC1_WGMXCCGn1
    SolutionIndex: 90
    SolutionNameMin: Cijk_Ailk_Bljk_BBS_BH_Bias_AS_SAV_UserArgs_MT128x64x128_MI16x16x1_SN_LDSB1_CLR1_GRVWA8_GSU0_GSUC0_GSUWGMRR0_K1_LBSPPA2048_LBSPPB512_LPA0_MIWT4_2_PLR1_SU0_SUM0_SUS256_VWA4_VWB2_WGM8_WGMXCC1_WGMXCCGn1
    SolutionIndex: 91
    SolutionNameMin: Cijk_Ailk_Bljk_BBS_BH_Bias_AS_SAV_UserArgs_MT64x64x128_MI16x16x1_SN_LDSB1_CLR1_GRVWA8_GSU0_GSUC0_GSUWGMRR0_K1_LBSPPA1024_LBSPPB512_LPA32_MIWT2_2_PLR1_SU0_SUM0_SUS256_VWA2_VWB2_WGM1_WGMXCC1_WGMXCCGn1
    SolutionIndex: 92
    SolutionNameMin: Cijk_Ailk_Bljk_BBS_BH_Bias_AS_SAV_UserArgs_MT64x64x128_MI16x16x1_SN_LDSB1_CLR1_GRVWA2_GSU0_GSUC0_GSUWGMRR0_K1_LBSPPA1024_LBSPPB512_LPA32_MIWT2_2_PLR1_SU0_SUM0_SUS256_VWA2_VWB2_WGM4_WGMXCC1_WGMXCCGn1
    SolutionIndex: 93
    SolutionNameMin: Cijk_Ailk_Bljk_BBS_BH_Bias_AS_SAV_UserArgs_MT64x64x128_MI16x16x1_SN_LDSB1_CLR1_GRVWA8_GSU0_GSUC0_GSUWGMRR0_K1_LBSPPA1024_LBSPPB512_LPA32_MIWT2_2_PLR1_SU0_SUM0_SUS256_VWA2_VWB2_WGM4_WGMXCC1_WGMXCCGn1
    SolutionIndex: 94
    SolutionNameMin: Cijk_Ailk_Bljk_BBS_BH_Bias_AS_SAV_UserArgs_MT64x64x128_MI16x16x1_SN_LDSB1_CLR1_GRVWA8_GSU0_GSUC0_GSUWGMRR0_K1_LBSPPA1024_LBSPPB512_LPA32_MIWT2_2_PLR1_SU0_SUM0_SUS256_VWA2_VWB2_WGM6_WGMXCC1_WGMXCCGn1
    SolutionIndex: 95
    SolutionNameMin: Cijk_Ailk_Bljk_BBS_BH_Bias_AS_SAV_UserArgs_MT64x64x128_MI16x16x1_SN_LDSB1_CLR1_GRVWA8_GSU0_GSUC0_GSUWGMRR0_K1_LBSPPA1024_LBSPPB512_LPA32_MIWT2_2_PLR1_SU0_SUM0_SUS256_VWA2_VWB2_WGM8_WGMXCC1_WGMXCCGn1
    SolutionIndex: 96
    SolutionNameMin: Cijk_Ailk_Bljk_BBS_BH_Bias_AS_SAV_UserArgs_MT64x32x128_MI16x16x1_SN_LDSB1_CLR1_GRVWA8_GSU0_GSUC0_GSUWGMRR0_K1_LBSPPA512_LBSPPB256_LPA32_MIWT2_1_PLR1_SU0_SUM0_SUS256_VWA2_VWB1_WGM1_WGMXCC1_WGMXCCGn1
    SolutionIndex: 97
    SolutionNameMin: Cijk_Ailk_Bljk_BBS_BH_Bias_AS_SAV_UserArgs_MT64x32x128_MI16x16x1_SN_LDSB1_CLR1_GRVWA4_GSU0_GSUC0_GSUWGMRR0_K1_LBSPPA1024_LBSPPB256_LPA32_MIWT2_1_PLR1_SU0_SUM0_SUS256_VWA2_VWB1_WGM1_WGMXCC1_WGMXCCGn1
    SolutionIndex: 98
    SolutionNameMin: Cijk_Ailk_Bljk_BBS_BH_Bias_AS_SAV_UserArgs_MT64x32x128_MI16x16x1_SN_LDSB1_CLR1_GRVWA8_GSU0_GSUC0_GSUWGMRR0_K1_LBSPPA1024_LBSPPB256_LPA32_MIWT2_1_PLR1_SU0_SUM0_SUS256_VWA2_VWB1_WGM1_WGMXCC1_WGMXCCGn1
    SolutionIndex: 99
    SolutionNameMin: Cijk_Ailk_Bljk_BBS_BH_Bias_AS_SAV_UserArgs_MT64x32x128_MI16x16x1_SN_LDSB1_CLR1_GRVWA8_GSU0_GSUC0_GSUWGMRR0_K1_LBSPPA512_LBSPPB256_LPA32_MIWT2_1_PLR1_SU0_SUM0_SUS256_VWA2_VWB1_WGM4_WGMXCC1_WGMXCCGn1
    SolutionIndex: 100
    SolutionNameMin: Cijk_Ailk_Bljk_BBS_BH_Bias_AS_SAV_UserArgs_MT64x32x128_MI16x16x1_SN_LDSB1_CLR1_GRVWA8_GSU0_GSUC0_GSUWGMRR0_K1_LBSPPA1024_LBSPPB256_LPA32_MIWT2_1_PLR1_SU0_SUM0_SUS256_VWA2_VWB1_WGM4_WGMXCC1_WGMXCCGn1
    SolutionIndex: 101
    SolutionNameMin: Cijk_Ailk_Bljk_BBS_BH_Bias_AS_SAV_UserArgs_MT64x32x128_MI16x16x1_SN_LDSB1_CLR1_GRVWA8_GSU0_GSUC0_GSUWGMRR0_K1_LBSPPA1024_LBSPPB256_LPA32_MIWT2_1_PLR1_SU0_SUM0_SUS256_VWA2_VWB1_WGM6_WGMXCC1_WGMXCCGn1
    SolutionIndex: 102
    SolutionNameMin: Cijk_Ailk_Bljk_BBS_BH_Bias_AS_SAV_UserArgs_MT64x32x128_MI16x16x1_SN_LDSB1_CLR1_GRVWA8_GSU0_GSUC0_GSUWGMRR0_K1_LBSPPA1024_LBSPPB256_LPA32_MIWT2_1_PLR1_SU0_SUM0_SUS256_VWA2_VWB1_WGM8_WGMXCC1_WGMXCCGn1
    SolutionIndex: 103
    SolutionNameMin: Cijk_Ailk_Bljk_BBS_BH_Bias_AS_SAV_UserArgs_MT32x32x128_MI16x16x1_SN_LDSB1_CLR1_GRVWA4_GSU0_GSUC0_GSUWGMRR0_K1_LBSPPA512_LBSPPB256_LPA16_MIWT1_1_PLR1_SU0_SUM0_SUS256_VWA1_VWB1_WGM1_WGMXCC1_WGMXCCGn1
    SolutionIndex: 104
    SolutionNameMin: Cijk_Ailk_Bljk_BBS_BH_Bias_AS_SAV_UserArgs_MT32x32x128_MI16x16x1_SN_LDSB1_CLR1_GRVWA8_GSU0_GSUC0_GSUWGMRR0_K1_LBSPPA512_LBSPPB256_LPA16_MIWT1_1_PLR1_SU0_SUM0_SUS256_VWA1_VWB1_WGM1_WGMXCC1_WGMXCCGn1
    SolutionIndex: 105
    SolutionNameMin: Cijk_Ailk_Bljk_BBS_BH_Bias_AS_SAV_UserArgs_MT32x32x128_MI16x16x1_SN_LDSB1_CLR1_GRVWA2_GSU0_GSUC0_GSUWGMRR0_K1_LBSPPA512_LBSPPB256_LPA16_MIWT1_1_PLR1_SU0_SUM0_SUS256_VWA1_VWB1_WGM1_WGMXCC1_WGMXCCGn1
    SolutionIndex: 106
    SolutionNameMin: Cijk_Ailk_Bljk_BBS_BH_Bias_AS_SAV_UserArgs_MT32x32x128_MI16x16x1_SN_LDSB1_CLR1_GRVWA4_GSU0_GSUC0_GSUWGMRR0_K1_LBSPPA512_LBSPPB256_LPA16_MIWT1_1_PLR1_SU0_SUM0_SUS256_VWA1_VWB1_WGM1_WGMXCC1_WGMXCCGn1
    SolutionIndex: 107
    SolutionNameMin: Cijk_Ailk_Bljk_BBS_BH_Bias_AS_SAV_UserArgs_MT32x32x128_MI16x16x1_SN_LDSB1_CLR1_GRVWA8_GSU0_GSUC0_GSUWGMRR0_K1_LBSPPA512_LBSPPB256_LPA16_MIWT1_1_PLR1_SU0_SUM0_SUS256_VWA1_VWB1_WGM1_WGMXCC1_WGMXCCGn1
    SolutionIndex: 108
    SolutionNameMin: Cijk_Ailk_Bljk_BBS_BH_Bias_AS_SAV_UserArgs_MT32x32x128_MI16x16x1_SN_LDSB1_CLR1_GRVWA8_GSU0_GSUC0_GSUWGMRR0_K1_LBSPPA512_LBSPPB256_LPA16_MIWT1_1_PLR1_SU0_SUM0_SUS256_VWA1_VWB1_WGM4_WGMXCC1_WGMXCCGn1
    SolutionIndex: 109
    SolutionNameMin: Cijk_Ailk_Bljk_BBS_BH_Bias_AS_SAV_UserArgs_MT32x32x128_MI16x16x1_SN_LDSB1_CLR1_GRVWA4_GSU0_GSUC0_GSUWGMRR0_K1_LBSPPA512_LBSPPB256_LPA16_MIWT1_1_PLR1_SU0_SUM0_SUS256_VWA1_VWB1_WGM6_WGMXCC1_WGMXCCGn1
    SolutionIndex: 110
    SolutionNameMin: Cijk_Ailk_Bljk_BBS_BH_Bias_AS_SAV_UserArgs_MT32x32x128_MI16x16x1_SN_LDSB1_CLR1_GRVWA8_GSU0_GSUC0_GSUWGMRR0_K1_LBSPPA512_LBSPPB256_LPA16_MIWT1_1_PLR1_SU0_SUM0_SUS256_VWA1_VWB1_WGM6_WGMXCC1_WGMXCCGn1
    SolutionIndex: 111
    SolutionNameMin: Cijk_Ailk_Bljk_BBS_BH_Bias_AS_SAV_UserArgs_MT32x32x128_MI16x16x1_SN_LDSB1_CLR1_GRVWA4_GSU0_GSUC0_GSUWGMRR0_K1_LBSPPA512_LBSPPB256_LPA16_MIWT1_1_PLR1_SU0_SUM0_SUS256_VWA1_VWB1_WGM8_WGMXCC1_WGMXCCGn1
- - - [128, 128, 1, 128, 128, 128, 128, 128]
    - [82, 0.45]
  - - [128, 128, 1, 256, 128, 128, 128, 256]
    - [105, 0.77]
  - - [128, 128, 1, 512, 128, 128, 128, 512]
    - [107, 1.3]
  - - [128, 128, 1, 1024, 128, 128, 128, 1024]
    - [107, 1.91]
  - - [128, 128, 1, 2048, 128, 128, 128, 2048]
    - [107, 2.5]
  - - [128, 128, 1, 4096, 128, 128, 128, 4096]
    - [107, 3.03]
  - - [128, 128, 1, 8192, 128, 128, 128, 8192]
    - [107, 3.43]
  - - [128, 256, 1, 128, 128, 128, 128, 128]
    - [107, 0.9]
  - - [128, 256, 1, 256, 128, 128, 128, 256]
    - [105, 1.55]
  - - [128, 256, 1, 512, 128, 128, 128, 512]
    - [107, 2.62]
  - - [128, 256, 1, 1024, 128, 128, 128, 1024]
    - [106, 3.84]
  - - [128, 256, 1, 2048, 128, 128, 128, 2048]
    - [107, 5.04]
  - - [128, 256, 1, 4096, 128, 128, 128, 4096]
    - [107, 6.1]
  - - [128, 256, 1, 8192, 128, 128, 128, 8192]
    - [107, 6.84]
  - - [128, 512, 1, 128, 128, 128, 128, 128]
    - [107, 1.78]
  - - [128, 512, 1, 256, 128, 128, 128, 256]
    - [107, 3.06]
  - - [128, 512, 1, 512, 128, 128, 128, 512]
    - [107, 5.22]
  - - [128, 512, 1, 1024, 128, 128, 128, 1024]
    - [107, 7.68]
  - - [128, 512, 1, 2048, 128, 128, 128, 2048]
    - [106, 10.04]
  - - [128, 512, 1, 4096, 128, 128, 128, 4096]
    - [107, 12.1]
  - - [128, 512, 1, 8192, 128, 128, 128, 8192]
    - [107, 13.73]
  - - [128, 1024, 1, 128, 128, 128, 128, 128]
    - [103, 3.59]
  - - [128, 1024, 1, 256, 128, 128, 128, 256]
    - [107, 6.15]
  - - [128, 1024, 1, 512, 128, 128, 128, 512]
    - [107, 10.44]
  - - [128, 1024, 1, 1024, 128, 128, 128, 1024]
    - [107, 15.22]
  - - [128, 1024, 1, 2048, 128, 128, 128, 2048]
    - [107, 20.02]
  - - [128, 1024, 1, 4096, 128, 128, 128, 4096]
    - [107, 24.18]
  - - [128, 1024, 1, 8192, 128, 128, 128, 8192]
    - [107, 27.47]
  - - [128, 2048, 1, 128, 128, 128, 128, 128]
    - [75, 6.57]
  - - [128, 2048, 1, 256, 128, 128, 128, 256]
    - [98, 11.13]
  - - [128, 2048, 1, 512, 128, 128, 128, 512]
    - [98, 18.53]
  - - [128, 2048, 1, 1024, 128, 128, 128, 1024]
    - [98, 26.97]
  - - [128, 2048, 1, 2048, 128, 128, 128, 2048]
    - [98, 35.4]
  - - [128, 2048, 1, 4096, 128, 128, 128, 4096]
    - [98, 42.78]
  - - [128, 2048, 1, 8192, 128, 128, 128, 8192]
    - [98, 46.65]
  - - [128, 4096, 1, 128, 128, 128, 128, 128]
    - [66, 11.55]
  - - [128, 4096, 1, 256, 128, 128, 128, 256]
    - [65, 19.49]
  - - [128, 4096, 1, 512, 128, 128, 128, 512]
    - [91, 30.85]
  - - [128, 4096, 1, 1024, 128, 128, 128, 1024]
    - [91, 44.01]
  - - [128, 4096, 1, 2048, 128, 128, 128, 2048]
    - [91, 56.84]
  - - [128, 4096, 1, 4096, 128, 128, 128, 4096]
    - [91, 65.4]
  - - [128, 4096, 1, 8192, 128, 128, 128, 8192]
    - [91, 73.68]
  - - [128, 8192, 1, 128, 128, 128, 128, 128]
    - [57, 18.62]
  - - [128, 8192, 1, 256, 128, 128, 128, 256]
    - [59, 30.81]
  - - [128, 8192, 1, 512, 128, 128, 128, 512]
    - [87, 50.02]
  - - [128, 8192, 1, 1024, 128, 128, 128, 1024]
    - [88, 70.17]
  - - [128, 8192, 1, 2048, 128, 128, 128, 2048]
    - [86, 80.09]
  - - [128, 8192, 1, 4096, 128, 128, 128, 4096]
    - [90, 93.39]
  - - [128, 8192, 1, 8192, 128, 128, 128, 8192]
    - [88, 96.54]
  - - [256, 128, 1, 128, 256, 256, 256, 128]
    - [82, 0.89]
  - - [256, 128, 1, 256, 256, 256, 256, 256]
    - [81, 1.51]
  - - [256, 128, 1, 512, 256, 256, 256, 512]
    - [107, 2.44]
  - - [256, 128, 1, 1024, 256, 256, 256, 1024]
    - [106, 3.44]
  - - [256, 128, 1, 2048, 256, 256, 256, 2048]
    - [106, 4.38]
  - - [256, 128, 1, 4096, 256, 256, 256, 4096]
    - [106, 5.18]
  - - [256, 128, 1, 8192, 256, 256, 256, 8192]
    - [111, 5.69]
  - - [256, 256, 1, 128, 256, 256, 256, 128]
    - [79, 1.3]
  - - [256, 256, 1, 256, 256, 256, 256, 256]
    - [78, 2.51]
  - - [256, 256, 1, 512, 256, 256, 256, 512]
    - [83, 4.41]
  - - [256, 256, 1, 1024, 256, 256, 256, 1024]
    - [104, 6.76]
  - - [256, 256, 1, 2048, 256, 256, 256, 2048]
    - [106, 9.0]
  - - [256, 256, 1, 4096, 256, 256, 256, 4096]
    - [106, 10.64]
  - - [256, 256, 1, 8192, 256, 256, 256, 8192]
    - [106, 11.7]
  - - [256, 512, 1, 128, 256, 256, 256, 128]
    - [74, 2.43]
  - - [256, 512, 1, 256, 256, 256, 256, 256]
    - [84, 4.89]
  - - [256, 512, 1, 512, 256, 256, 256, 512]
    - [85, 8.74]
  - - [256, 512, 1, 1024, 256, 256, 256, 1024]
    - [107, 14.08]
  - - [256, 512, 1, 2048, 256, 256, 256, 2048]
    - [106, 18.3]
  - - [256, 512, 1, 4096, 256, 256, 256, 4096]
    - [106, 21.59]
  - - [256, 512, 1, 8192, 256, 256, 256, 8192]
    - [106, 23.93]
  - - [256, 1024, 1, 128, 256, 256, 256, 128]
    - [76, 6.44]
  - - [256, 1024, 1, 256, 256, 256, 256, 256]
    - [98, 11.12]
  - - [256, 1024, 1, 512, 256, 256, 256, 512]
    - [96, 17.7]
  - - [256, 1024, 1, 1024, 256, 256, 256, 1024]
    - [98, 25.83]
  - - [256, 1024, 1, 2048, 256, 256, 256, 2048]
    - [98, 33.29]
  - - [256, 1024, 1, 4096, 256, 256, 256, 4096]
    - [98, 39.35]
  - - [256, 1024, 1, 8192, 256, 256, 256, 8192]
    - [98, 42.93]
  - - [256, 2048, 1, 128, 256, 256, 256, 128]
    - [64, 11.38]
  - - [256, 2048, 1, 256, 256, 256, 256, 256]
    - [66, 19.4]
  - - [256, 2048, 1, 512, 256, 256, 256, 512]
    - [66, 29.79]
  - - [256, 2048, 1, 1024, 256, 256, 256, 1024]
    - [91, 40.96]
  - - [256, 2048, 1, 2048, 256, 256, 256, 2048]
    - [91, 50.89]
  - - [256, 2048, 1, 4096, 256, 256, 256, 4096]
    - [98, 63.11]
  - - [256, 2048, 1, 8192, 256, 256, 256, 8192]
    - [27, 64.46]
  - - [256, 4096, 1, 128, 256, 256, 256, 128]
    - [24, 18.67]
  - - [256, 4096, 1, 256, 256, 256, 256, 256]
    - [59, 32.22]
  - - [256, 4096, 1, 512, 256, 256, 256, 512]
    - [59, 49.77]
  - - [256, 4096, 1, 1024, 256, 256, 256, 1024]
    - [59, 68.64]
  - - [256, 4096, 1, 2048, 256, 256, 256, 2048]
    - [59, 84.65]
  - - [256, 4096, 1, 4096, 256, 256, 256, 4096]
    - [58, 91.78]
  - - [256, 4096, 1, 8192, 256, 256, 256, 8192]
    - [59, 93.64]
  - - [256, 8192, 1, 128, 256, 256, 256, 128]
    - [47, 28.14]
  - - [256, 8192, 1, 256, 256, 256, 256, 256]
    - [47, 46.76]
  - - [256, 8192, 1, 512, 256, 256, 256, 512]
    - [44, 71.03]
  - - [256, 8192, 1, 1024, 256, 256, 256, 1024]
    - [45, 91.4]
  - - [256, 8192, 1, 2048, 256, 256, 256, 2048]
    - [44, 106.63]
  - - [256, 8192, 1, 4096, 256, 256, 256, 4096]
    - [48, 116.5]
  - - [256, 8192, 1, 8192, 256, 256, 256, 8192]
    - [53, 113.49]
  - - [512, 128, 1, 128, 512, 512, 512, 128]
    - [82, 1.76]
  - - [512, 128, 1, 256, 512, 512, 512, 256]
    - [82, 3.02]
  - - [512, 128, 1, 512, 512, 512, 512, 512]
    - [106, 4.62]
  - - [512, 128, 1, 1024, 512, 512, 512, 1024]
    - [106, 6.77]
  - - [512, 128, 1, 2048, 512, 512, 512, 2048]
    - [109, 8.73]
  - - [512, 128, 1, 4096, 512, 512, 512, 4096]
    - [109, 10.12]
  - - [512, 128, 1, 8192, 512, 512, 512, 8192]
    - [109, 11.27]
  - - [512, 256, 1, 128, 512, 512, 512, 128]
    - [80, 3.45]
  - - [512, 256, 1, 256, 512, 512, 512, 256]
    - [82, 5.81]
  - - [512, 256, 1, 512, 512, 512, 512, 512]
    - [109, 9.38]
  - - [512, 256, 1, 1024, 512, 512, 512, 1024]
    - [111, 13.8]
  - - [512, 256, 1, 2048, 512, 512, 512, 2048]
    - [109, 17.72]
  - - [512, 256, 1, 4096, 512, 512, 512, 4096]
    - [109, 20.8]
  - - [512, 256, 1, 8192, 512, 512, 512, 8192]
    - [109, 23.0]
  - - [512, 512, 1, 128, 512, 512, 512, 128]
    - [97, 6.36]
  - - [512, 512, 1, 256, 512, 512, 512, 256]
    - [73, 10.75]
  - - [512, 512, 1, 512, 512, 512, 512, 512]
    - [102, 17.5]
  - - [512, 512, 1, 1024, 512, 512, 512, 1024]
    - [101, 25.3]
  - - [512, 512, 1, 2048, 512, 512, 512, 2048]
    - [98, 32.62]
  - - [512, 512, 1, 4096, 512, 512, 512, 4096]
    - [98, 38.43]
  - - [512, 512, 1, 8192, 512, 512, 512, 8192]
    - [98, 42.29]
  - - [512, 1024, 1, 128, 512, 512, 512, 128]
    - [65, 11.4]
  - - [512, 1024, 1, 256, 512, 512, 512, 256]
    - [66, 19.33]
  - - [512, 1024, 1, 512, 512, 512, 512, 512]
    - [65, 30.09]
  - - [512, 1024, 1, 1024, 512, 512, 512, 1024]
    - [65, 41.5]
  - - [512, 1024, 1, 2048, 512, 512, 512, 2048]
    - [94, 50.71]
  - - [512, 1024, 1, 4096, 512, 512, 512, 4096]
    - [96, 59.22]
  - - [512, 1024, 1, 8192, 512, 512, 512, 8192]
    - [25, 65.6]
  - - [512, 2048, 1, 128, 512, 512, 512, 128]
    - [59, 19.09]
  - - [512, 2048, 1, 256, 512, 512, 512, 256]
    - [59, 32.81]
  - - [512, 2048, 1, 512, 512, 512, 512, 512]
    - [59, 50.8]
  - - [512, 2048, 1, 1024, 512, 512, 512, 1024]
    - [87, 69.54]
  - - [512, 2048, 1, 2048, 512, 512, 512, 2048]
    - [59, 86.18]
  - - [512, 2048, 1, 4096, 512, 512, 512, 4096]
    - [87, 98.36]
  - - [512, 2048, 1, 8192, 512, 512, 512, 8192]
    - [90, 95.44]
  - - [512, 4096, 1, 128, 512, 512, 512, 128]
    - [23, 28.2]
  - - [512, 4096, 1, 256, 512, 512, 512, 256]
    - [44, 47.38]
  - - [512, 4096, 1, 512, 512, 512, 512, 512]
    - [44, 73.43]
  - - [512, 4096, 1, 1024, 512, 512, 512, 1024]
    - [44, 96.73]
  - - [512, 4096, 1, 2048, 512, 512, 512, 2048]
    - [45, 113.11]
  - - [512, 4096, 1, 4096, 512, 512, 512, 4096]
    - [48, 121.96]
  - - [512, 4096, 1, 8192, 512, 512, 512, 8192]
    - [48, 124.53]
  - - [512, 8192, 1, 128, 512, 512, 512, 128]
    - [17, 39.31]
  - - [512, 8192, 1, 256, 512, 512, 512, 256]
    - [15, 62.55]
  - - [512, 8192, 1, 512, 512, 512, 512, 512]
    - [42, 92.91]
  - - [512, 8192, 1, 1024, 512, 512, 512, 1024]
    - [42, 119.76]
  - - [512, 8192, 1, 2048, 512, 512, 512, 2048]
    - [37, 139.68]
  - - [512, 8192, 1, 4096, 512, 512, 512, 4096]
    - [32, 131.45]
  - - [512, 8192, 1, 8192, 512, 512, 512, 8192]
    - [32, 142.6]
  - - [1024, 128, 1, 128, 1024, 1024, 1024, 128]
    - [82, 3.42]
  - - [1024, 128, 1, 256, 1024, 1024, 1024, 256]
    - [82, 5.59]
  - - [1024, 128, 1, 512, 1024, 1024, 1024, 512]
    - [105, 9.0]
  - - [1024, 128, 1, 1024, 1024, 1024, 1024, 1024]
    - [107, 13.11]
  - - [1024, 128, 1, 2048, 1024, 1024, 1024, 2048]
    - [108, 16.64]
  - - [1024, 128, 1, 4096, 1024, 1024, 1024, 4096]
    - [110, 19.41]
  - - [1024, 128, 1, 8192, 1024, 1024, 1024, 8192]
    - [109, 21.31]
  - - [1024, 256, 1, 128, 1024, 1024, 1024, 128]
    - [72, 5.96]
  - - [1024, 256, 1, 256, 1024, 1024, 1024, 256]
    - [71, 10.37]
  - - [1024, 256, 1, 512, 1024, 1024, 1024, 512]
    - [100, 16.97]
  - - [1024, 256, 1, 1024, 1024, 1024, 1024, 1024]
    - [100, 24.51]
  - - [1024, 256, 1, 2048, 1024, 1024, 1024, 2048]
    - [100, 31.69]
  - - [1024, 256, 1, 4096, 1024, 1024, 1024, 4096]
    - [100, 37.05]
  - - [1024, 256, 1, 8192, 1024, 1024, 1024, 8192]
    - [101, 40.81]
  - - [1024, 512, 1, 128, 1024, 1024, 1024, 128]
    - [64, 10.99]
  - - [1024, 512, 1, 256, 1024, 1024, 1024, 256]
    - [69, 19.0]
  - - [1024, 512, 1, 512, 1024, 1024, 1024, 512]
    - [68, 29.59]
  - - [1024, 512, 1, 1024, 1024, 1024, 1024, 1024]
    - [68, 40.91]
  - - [1024, 512, 1, 2048, 1024, 1024, 1024, 2048]
    - [93, 50.42]
  - - [1024, 512, 1, 4096, 1024, 1024, 1024, 4096]
    - [92, 58.38]
  - - [1024, 512, 1, 8192, 1024, 1024, 1024, 8192]
    - [26, 64.4]
  - - [1024, 1024, 1, 128, 1024, 1024, 1024, 128]
    - [56, 18.32]
  - - [1024, 1024, 1, 256, 1024, 1024, 1024, 256]
    - [63, 31.84]
  - - [1024, 1024, 1, 512, 1024, 1024, 1024, 512]
    - [61, 50.02]
  - - [1024, 1024, 1, 1024, 1024, 1024, 1024, 1024]
    - [62, 68.61]
  - - [1024, 1024, 1, 2048, 1024, 1024, 1024, 2048]
    - [89, 84.77]
  - - [1024, 1024, 1, 4096, 1024, 1024, 1024, 4096]
    - [89, 96.98]
  - - [1024, 1024, 1, 8192, 1024, 1024, 1024, 8192]
    - [61, 93.8]
  - - [1024, 2048, 1, 128, 1024, 1024, 1024, 128]
    - [47, 28.76]
  - - [1024, 2048, 1, 256, 1024, 1024, 1024, 256]
    - [48, 48.18]
  - - [1024, 2048, 1, 512, 1024, 1024, 1024, 512]
    - [48, 73.74]
  - - [1024, 2048, 1, 1024, 1024, 1024, 1024, 1024]
    - [48, 97.73]
  - - [1024, 2048, 1, 2048, 1024, 1024, 1024, 2048]
    - [44, 116.41]
  - - [1024, 2048, 1, 4096, 1024, 1024, 1024, 4096]
    - [54, 124.28]
  - - [1024, 2048, 1, 8192, 1024, 1024, 1024, 8192]
    - [53, 122.35]
  - - [1024, 4096, 1, 128, 1024, 1024, 1024, 128]
    - [15, 39.75]
  - - [1024, 4096, 1, 256, 1024, 1024, 1024, 256]
    - [18, 64.44]
  - - [1024, 4096, 1, 512, 1024, 1024, 1024, 512]
    - [38, 95.73]
  - - [1024, 4096, 1, 1024, 1024, 1024, 1024, 1024]
    - [38, 124.44]
  - - [1024, 4096, 1, 2048, 1024, 1024, 1024, 2048]
    - [43, 140.41]
  - - [1024, 4096, 1, 4096, 1024, 1024, 1024, 4096]
    - [41, 130.5]
  - - [1024, 4096, 1, 8192, 1024, 1024, 1024, 8192]
    - [32, 141.06]
  - - [1024, 8192, 1, 128, 1024, 1024, 1024, 128]
    - [4, 47.66]
  - - [1024, 8192, 1, 256, 1024, 1024, 1024, 256]
    - [7, 76.39]
  - - [1024, 8192, 1, 512, 1024, 1024, 1024, 512]
    - [4, 107.51]
  - - [1024, 8192, 1, 1024, 1024, 1024, 1024, 1024]
    - [4, 135.73]
  - - [1024, 8192, 1, 2048, 1024, 1024, 1024, 2048]
    - [6, 136.48]
  - - [1024, 8192, 1, 4096, 1024, 1024, 1024, 4096]
    - [1, 150.69]
  - - [1024, 8192, 1, 8192, 1024, 1024, 1024, 8192]
    - [8, 162.11]
  - - [2048, 128, 1, 128, 2048, 2048, 2048, 128]
    - [72, 5.98]
  - - [2048, 128, 1, 256, 2048, 2048, 2048, 256]
    - [77, 10.2]
  - - [2048, 128, 1, 512, 2048, 2048, 2048, 512]
    - [100, 16.47]
  - - [2048, 128, 1, 1024, 2048, 2048, 2048, 1024]
    - [99, 23.72]
  - - [2048, 128, 1, 2048, 2048, 2048, 2048, 2048]
    - [102, 30.12]
  - - [2048, 128, 1, 4096, 2048, 2048, 2048, 4096]
    - [101, 35.66]
  - - [2048, 128, 1, 8192, 2048, 2048, 2048, 8192]
    - [100, 35.1]
  - - [2048, 256, 1, 128, 2048, 2048, 2048, 128]
    - [67, 10.77]
  - - [2048, 256, 1, 256, 2048, 2048, 2048, 256]
    - [68, 18.75]
  - - [2048, 256, 1, 512, 2048, 2048, 2048, 512]
    - [67, 29.07]
  - - [2048, 256, 1, 1024, 2048, 2048, 2048, 1024]
    - [70, 39.88]
  - - [2048, 256, 1, 2048, 2048, 2048, 2048, 2048]
    - [93, 49.99]
  - - [2048, 256, 1, 4096, 2048, 2048, 2048, 4096]
    - [93, 57.62]
  - - [2048, 256, 1, 8192, 2048, 2048, 2048, 8192]
    - [28, 61.48]
  - - [2048, 512, 1, 128, 2048, 2048, 2048, 128]
    - [61, 18.32]
  - - [2048, 512, 1, 256, 2048, 2048, 2048, 256]
    - [62, 31.35]
  - - [2048, 512, 1, 512, 2048, 2048, 2048, 512]
    - [62, 48.96]
  - - [2048, 512, 1, 1024, 2048, 2048, 2048, 1024]
    - [63, 67.5]
  - - [2048, 512, 1, 2048, 2048, 2048, 2048, 2048]
    - [88, 83.42]
  - - [2048, 512, 1, 4096, 2048, 2048, 2048, 4096]
    - [88, 95.26]
  - - [2048, 512, 1, 8192, 2048, 2048, 2048, 8192]
    - [89, 89.85]
  - - [2048, 1024, 1, 128, 2048, 2048, 2048, 128]
    - [47, 27.96]
  - - [2048, 1024, 1, 256, 2048, 2048, 2048, 256]
    - [46, 47.19]
  - - [2048, 1024, 1, 512, 2048, 2048, 2048, 512]
    - [51, 71.5]
  - - [2048, 1024, 1, 1024, 2048, 2048, 2048, 1024]
    - [46, 96.24]
  - - [2048, 1024, 1, 2048, 2048, 2048, 2048, 2048]
    - [51, 115.95]
  - - [2048, 1024, 1, 4096, 2048, 2048, 2048, 4096]
    - [51, 124.24]
  - - [2048, 1024, 1, 8192, 2048, 2048, 2048, 8192]
    - [50, 120.47]
  - - [2048, 2048, 1, 128, 2048, 2048, 2048, 128]
    - [21, 39.73]
  - - [2048, 2048, 1, 256, 2048, 2048, 2048, 256]
    - [15, 64.47]
  - - [2048, 2048, 1, 512, 2048, 2048, 2048, 512]
    - [38, 94.66]
  - - [2048, 2048, 1, 1024, 2048, 2048, 2048, 1024]
    - [42, 124.81]
  - - [2048, 2048, 1, 2048, 2048, 2048, 2048, 2048]
    - [38, 142.57]
  - - [2048, 2048, 1, 4096, 2048, 2048, 2048, 4096]
    - [33, 132.78]
  - - [2048, 2048, 1, 8192, 2048, 2048, 2048, 8192]
    - [33, 144.96]
  - - [2048, 4096, 1, 128, 2048, 2048, 2048, 128]
    - [4, 47.92]
  - - [2048, 4096, 1, 256, 2048, 2048, 2048, 256]
    - [4, 76.4]
  - - [2048, 4096, 1, 512, 2048, 2048, 2048, 512]
    - [4, 108.91]
  - - [2048, 4096, 1, 1024, 2048, 2048, 2048, 1024]
    - [11, 134.4]
  - - [2048, 4096, 1, 2048, 2048, 2048, 2048, 2048]
    - [13, 139.95]
  - - [2048, 4096, 1, 4096, 2048, 2048, 2048, 4096]
    - [32, 154.53]
  - - [2048, 4096, 1, 8192, 2048, 2048, 2048, 8192]
    - [9, 165.02]
  - - [2048, 8192, 1, 128, 2048, 2048, 2048, 128]
    - [4, 53.92]
  - - [2048, 8192, 1, 256, 2048, 2048, 2048, 256]
    - [4, 83.56]
  - - [2048, 8192, 1, 512, 2048, 2048, 2048, 512]
    - [7, 111.57]
  - - [2048, 8192, 1, 1024, 2048, 2048, 2048, 1024]
    - [53, 123.85]
  - - [2048, 8192, 1, 2048, 2048, 2048, 2048, 2048]
    - [29, 146.25]
  - - [2048, 8192, 1, 4096, 2048, 2048, 2048, 4096]
    - [32, 173.67]
  - - [2048, 8192, 1, 8192, 2048, 2048, 2048, 8192]
    - [32, 181.98]
  - - [4096, 128, 1, 128, 4096, 4096, 4096, 128]
    - [66, 10.96]
  - - [4096, 128, 1, 256, 4096, 4096, 4096, 256]
    - [66, 18.82]
  - - [4096, 128, 1, 512, 4096, 4096, 4096, 512]
    - [66, 28.72]
  - - [4096, 128, 1, 1024, 4096, 4096, 4096, 1024]
    - [91, 39.32]
  - - [4096, 128, 1, 2048, 4096, 4096, 4096, 2048]
    - [94, 49.83]
  - - [4096, 128, 1, 4096, 4096, 4096, 4096, 4096]
    - [93, 53.47]
  - - [4096, 128, 1, 8192, 4096, 4096, 4096, 8192]
    - [95, 56.24]
  - - [4096, 256, 1, 128, 4096, 4096, 4096, 128]
    - [63, 18.49]
  - - [4096, 256, 1, 256, 4096, 4096, 4096, 256]
    - [61, 31.99]
  - - [4096, 256, 1, 512, 4096, 4096, 4096, 512]
    - [62, 48.52]
  - - [4096, 256, 1, 1024, 4096, 4096, 4096, 1024]
    - [88, 67.84]
  - - [4096, 256, 1, 2048, 4096, 4096, 4096, 2048]
    - [90, 84.31]
  - - [4096, 256, 1, 4096, 4096, 4096, 4096, 4096]
    - [88, 90.79]
  - - [4096, 256, 1, 8192, 4096, 4096, 4096, 8192]
    - [90, 89.93]
  - - [4096, 512, 1, 128, 4096, 4096, 4096, 128]
    - [46, 28.09]
  - - [4096, 512, 1, 256, 4096, 4096, 4096, 256]
    - [55, 47.56]
  - - [4096, 512, 1, 512, 4096, 4096, 4096, 512]
    - [46, 73.82]
  - - [4096, 512, 1, 1024, 4096, 4096, 4096, 1024]
    - [55, 96.98]
  - - [4096, 512, 1, 2048, 4096, 4096, 4096, 2048]
    - [52, 115.77]
  - - [4096, 512, 1, 4096, 4096, 4096, 4096, 4096]
    - [54, 124.1]
  - - [4096, 512, 1, 8192, 4096, 4096, 4096, 8192]
    - [51, 122.3]
  - - [4096, 1024, 1, 128, 4096, 4096, 4096, 128]
    - [16, 39.45]
  - - [4096, 1024, 1, 256, 4096, 4096, 4096, 256]
    - [20, 63.53]
  - - [4096, 1024, 1, 512, 4096, 4096, 4096, 512]
    - [43, 94.86]
  - - [4096, 1024, 1, 1024, 4096, 4096, 4096, 1024]
    - [40, 121.56]
  - - [4096, 1024, 1, 2048, 4096, 4096, 4096, 2048]
    - [40, 140.49]
  - - [4096, 1024, 1, 4096, 4096, 4096, 4096, 4096]
    - [48, 137.22]
  - - [4096, 1024, 1, 8192, 4096, 4096, 4096, 8192]
    - [36, 144.33]
  - - [4096, 2048, 1, 128, 4096, 4096, 4096, 128]
    - [4, 46.61]
  - - [4096, 2048, 1, 256, 4096, 4096, 4096, 256]
    - [4, 74.56]
  - - [4096, 2048, 1, 512, 4096, 4096, 4096, 512]
    - [11, 106.57]
  - - [4096, 2048, 1, 1024, 4096, 4096, 4096, 1024]
    - [4, 131.71]
  - - [4096, 2048, 1, 2048, 4096, 4096, 4096, 2048]
    - [31, 145.39]
  - - [4096, 2048, 1, 4096, 4096, 4096, 4096, 4096]
    - [30, 162.48]
  - - [4096, 2048, 1, 8192, 4096, 4096, 4096, 8192]
    - [30, 171.63]
  - - [4096, 4096, 1, 128, 4096, 4096, 4096, 128]
    - [4, 53.74]
  - - [4096, 4096, 1, 256, 4096, 4096, 4096, 256]
    - [4, 82.83]
  - - [4096, 4096, 1, 512, 4096, 4096, 4096, 512]
    - [11, 112.13]
  - - [4096, 4096, 1, 1024, 4096, 4096, 4096, 1024]
    - [21, 125.69]
  - - [4096, 4096, 1, 2048, 4096, 4096, 4096, 2048]
    - [35, 151.11]
  - - [4096, 4096, 1, 4096, 4096, 4096, 4096, 4096]
    - [32, 173.38]
  - - [4096, 4096, 1, 8192, 4096, 4096, 4096, 8192]
    - [10, 184.8]
  - - [4096, 8192, 1, 128, 4096, 4096, 4096, 128]
    - [4, 55.56]
  - - [4096, 8192, 1, 256, 4096, 4096, 4096, 256]
    - [22, 87.33]
  - - [4096, 8192, 1, 512, 4096, 4096, 4096, 512]
    - [43, 115.57]
  - - [4096, 8192, 1, 1024, 4096, 4096, 4096, 1024]
    - [43, 145.33]
  - - [4096, 8192, 1, 2048, 4096, 4096, 4096, 2048]
    - [43, 174.97]
  - - [4096, 8192, 1, 4096, 4096, 4096, 4096, 4096]
    - [5, 197.41]
  - - [4096, 8192, 1, 8192, 4096, 4096, 4096, 8192]
    - [13, 210.55]
  - - [8192, 128, 1, 128, 8192, 8192, 8192, 128]
    - [24, 18.08]
  - - [8192, 128, 1, 256, 8192, 8192, 8192, 256]
    - [59, 30.23]
  - - [8192, 128, 1, 512, 8192, 8192, 8192, 512]
    - [60, 46.56]
  - - [8192, 128, 1, 1024, 8192, 8192, 8192, 1024]
    - [89, 64.16]
  - - [8192, 128, 1, 2048, 8192, 8192, 8192, 2048]
    - [89, 75.6]
  - - [8192, 128, 1, 4096, 8192, 8192, 8192, 4096]
    - [89, 85.64]
  - - [8192, 128, 1, 8192, 8192, 8192, 8192, 8192]
    - [88, 82.96]
  - - [8192, 256, 1, 128, 8192, 8192, 8192, 128]
    - [46, 26.83]
  - - [8192, 256, 1, 256, 8192, 8192, 8192, 256]
    - [49, 46.11]
  - - [8192, 256, 1, 512, 8192, 8192, 8192, 512]
    - [53, 71.4]
  - - [8192, 256, 1, 1024, 8192, 8192, 8192, 1024]
    - [51, 94.91]
  - - [8192, 256, 1, 2048, 8192, 8192, 8192, 2048]
    - [46, 107.75]
  - - [8192, 256, 1, 4096, 8192, 8192, 8192, 4096]
    - [52, 121.38]
  - - [8192, 256, 1, 8192, 8192, 8192, 8192, 8192]
    - [51, 117.97]
  - - [8192, 512, 1, 128, 8192, 8192, 8192, 128]
    - [18, 37.95]
  - - [8192, 512, 1, 256, 8192, 8192, 8192, 256]
    - [19, 61.58]
  - - [8192, 512, 1, 512, 8192, 8192, 8192, 512]
    - [42, 92.03]
  - - [8192, 512, 1, 1024, 8192, 8192, 8192, 1024]
    - [42, 117.81]
  - - [8192, 512, 1, 2048, 8192, 8192, 8192, 2048]
    - [42, 137.03]
  - - [8192, 512, 1, 4096, 8192, 8192, 8192, 4096]
    - [48, 138.27]
  - - [8192, 512, 1, 8192, 8192, 8192, 8192, 8192]
    - [14, 144.02]
  - - [8192, 1024, 1, 128, 8192, 8192, 8192, 128]
    - [4, 45.04]
  - - [8192, 1024, 1, 256, 8192, 8192, 8192, 256]
    - [4, 72.33]
  - - [8192, 1024, 1, 512, 8192, 8192, 8192, 512]
    - [7, 104.48]
  - - [8192, 1024, 1, 1024, 8192, 8192, 8192, 1024]
    - [11, 131.51]
  - - [8192, 1024, 1, 2048, 8192, 8192, 8192, 2048]
    - [32, 146.14]
  - - [8192, 1024, 1, 4096, 8192, 8192, 8192, 4096]
    - [32, 162.18]
  - - [8192, 1024, 1, 8192, 8192, 8192, 8192, 8192]
    - [0, 162.64]
  - - [8192, 2048, 1, 128, 8192, 8192, 8192, 128]
    - [4, 52.78]
  - - [8192, 2048, 1, 256, 8192, 8192, 8192, 256]
    - [4, 80.65]
  - - [8192, 2048, 1, 512, 8192, 8192, 8192, 512]
    - [4, 110.36]
  - - [8192, 2048, 1, 1024, 8192, 8192, 8192, 1024]
    - [53, 128.37]
  - - [8192, 2048, 1, 2048, 8192, 8192, 8192, 2048]
    - [34, 154.14]
  - - [8192, 2048, 1, 4096, 8192, 8192, 8192, 4096]
    - [4, 177.11]
  - - [8192, 2048, 1, 8192, 8192, 8192, 8192, 8192]
    - [4, 187.89]
  - - [8192, 4096, 1, 128, 8192, 8192, 8192, 128]
    - [2, 53.46]
  - - [8192, 4096, 1, 256, 8192, 8192, 8192, 256]
    - [22, 85.9]
  - - [8192, 4096, 1, 512, 8192, 8192, 8192, 512]
    - [39, 112.24]
  - - [8192, 4096, 1, 1024, 8192, 8192, 8192, 1024]
    - [43, 144.16]
  - - [8192, 4096, 1, 2048, 8192, 8192, 8192, 2048]
    - [43, 175.41]
  - - [8192, 4096, 1, 4096, 8192, 8192, 8192, 4096]
    - [4, 204.57]
  - - [8192, 4096, 1, 8192, 8192, 8192, 8192, 8192]
    - [1, 217.89]
  - - [8192, 8192, 1, 128, 8192, 8192, 8192, 128]
    - [16, 57.79]
  - - [8192, 8192, 1, 256, 8192, 8192, 8192, 256]
    - [3, 85.88]
  - - [8192, 8192, 1, 512, 8192, 8192, 8192, 512]
    - [12, 124.13]
  - - [8192, 8192, 1, 1024, 8192, 8192, 8192, 1024]
    - [11, 161.38]
  - - [8192, 8192, 1, 2048, 8192, 8192, 8192, 2048]
    - [43, 192.82]
  - - [8192, 8192, 1, 4096, 8192, 8192, 8192, 4096]
    - [9, 207.41]
  - - [8192, 8192, 1, 8192, 8192, 8192, 8192, 8192]
    - [33, 223.02]
- null
- null
- ExperimentalStreamK
- GridBased
