projects/hipblaslt/library/src/amd_detail/rocblaslt/src/Tensile/Logic/asm_full/aquavanjaram/gfx942_228cu/StreamK/aquavanjaram942_Cijk_Ailk_Bljk_B8F8NHS_BH_Bias_HAS_SAV_UserArgs.yaml
- {MinimumRequiredVersion: 4.33.0}
- aquavanjaram942
- {Architecture: gfx942, CUCount: 228}
- [Device 0049, Device 0050]
    SolutionIndex: 0
    SolutionNameMin: Cijk_Ailk_Bljk_B8F8NHS_BH_Bias_HAS_SAV_UserArgs_MT256x256x64_MI16x16x1_SN_LDSB1_CLR1_GRVWA16_GRVWB8_GSU0_GSUC0_GSUWGMRR0_K1_LBSPPA2048_LBSPPB512_LPA0_LPB8_LRVW8_MIWT8_8_PLR1_SU0_SUM0_SUS64_VWA8_VWB8_WGM1_WGMXCC1_WGMXCCGn1
    SolutionIndex: 1
    SolutionNameMin: Cijk_Ailk_Bljk_B8F8NHS_BH_Bias_HAS_SAV_UserArgs_MT256x256x64_MI16x16x1_SN_LDSB1_CLR1_GRVWA8_GRVWB16_GSU0_GSUC0_GSUWGMRR0_K1_LBSPPA2048_LBSPPB512_LPA0_LPB16_LRVW8_MIWT8_8_PLR1_SU0_SUM0_SUS64_VWA8_VWB8_WGM1_WGMXCC1_WGMXCCGn1
    SolutionIndex: 2
    SolutionNameMin: Cijk_Ailk_Bljk_B8F8NHS_BH_Bias_HAS_SAV_UserArgs_MT256x256x64_MI16x16x1_SN_LDSB1_CLR1_GRVWA16_GRVWB16_GSU0_GSUC0_GSUWGMRR0_K1_LBSPPA2048_LBSPPB512_LPA0_LPB16_LRVW8_MIWT8_8_PLR1_SU0_SUM0_SUS64_VWA8_VWB8_WGM1_WGMXCC1_WGMXCCGn1
    SolutionIndex: 3
    SolutionNameMin: Cijk_Ailk_Bljk_B8F8NHS_BH_Bias_HAS_SAV_UserArgs_MT256x256x64_MI16x16x1_SN_LDSB1_CLR1_GRVWA16_GRVWB8_GSU0_GSUC0_GSUWGMRR0_K1_LBSPPA2048_LBSPPB512_LPA0_LPB8_LRVW8_MIWT8_8_PLR1_SU0_SUM0_SUS64_VWA8_VWB8_WGM4_WGMXCC1_WGMXCCGn1
    SolutionIndex: 4
    SolutionNameMin: Cijk_Ailk_Bljk_B8F8NHS_BH_Bias_HAS_SAV_UserArgs_MT256x256x64_MI16x16x1_SN_LDSB1_CLR1_GRVWA8_GRVWB16_GSU0_GSUC0_GSUWGMRR0_K1_LBSPPA2048_LBSPPB512_LPA0_LPB16_LRVW8_MIWT8_8_PLR1_SU0_SUM0_SUS64_VWA8_VWB8_WGM4_WGMXCC1_WGMXCCGn1
    SolutionIndex: 5
    SolutionNameMin: Cijk_Ailk_Bljk_B8F8NHS_BH_Bias_HAS_SAV_UserArgs_MT256x256x64_MI16x16x1_SN_LDSB1_CLR1_GRVWA16_GRVWB16_GSU0_GSUC0_GSUWGMRR0_K1_LBSPPA2048_LBSPPB512_LPA0_LPB16_LRVW8_MIWT8_8_PLR1_SU0_SUM0_SUS64_VWA8_VWB8_WGM4_WGMXCC1_WGMXCCGn1
    SolutionIndex: 6
    SolutionNameMin: Cijk_Ailk_Bljk_B8F8NHS_BH_Bias_HAS_SAV_UserArgs_MT256x256x64_MI16x16x1_SN_LDSB1_CLR1_GRVWA8_GRVWB8_GSU0_GSUC0_GSUWGMRR0_K1_LBSPPA2048_LBSPPB512_LPA0_LPB8_LRVW8_MIWT8_8_PLR1_SU0_SUM0_SUS64_VWA8_VWB8_WGM6_WGMXCC1_WGMXCCGn1
    SolutionIndex: 7
    SolutionNameMin: Cijk_Ailk_Bljk_B8F8NHS_BH_Bias_HAS_SAV_UserArgs_MT256x256x64_MI16x16x1_SN_LDSB1_CLR1_GRVWA16_GRVWB8_GSU0_GSUC0_GSUWGMRR0_K1_LBSPPA2048_LBSPPB512_LPA0_LPB8_LRVW8_MIWT8_8_PLR1_SU0_SUM0_SUS64_VWA8_VWB8_WGM6_WGMXCC1_WGMXCCGn1
    SolutionIndex: 8
    SolutionNameMin: Cijk_Ailk_Bljk_B8F8NHS_BH_Bias_HAS_SAV_UserArgs_MT256x256x64_MI16x16x1_SN_LDSB1_CLR1_GRVWA8_GRVWB16_GSU0_GSUC0_GSUWGMRR0_K1_LBSPPA2048_LBSPPB512_LPA0_LPB16_LRVW8_MIWT8_8_PLR1_SU0_SUM0_SUS64_VWA8_VWB8_WGM6_WGMXCC1_WGMXCCGn1
    SolutionIndex: 9
    SolutionNameMin: Cijk_Ailk_Bljk_B8F8NHS_BH_Bias_HAS_SAV_UserArgs_MT256x256x64_MI16x16x1_SN_LDSB1_CLR1_GRVWA16_GRVWB16_GSU0_GSUC0_GSUWGMRR0_K1_LBSPPA2048_LBSPPB512_LPA0_LPB16_LRVW8_MIWT8_8_PLR1_SU0_SUM0_SUS64_VWA8_VWB8_WGM6_WGMXCC1_WGMXCCGn1
    SolutionIndex: 10
    SolutionNameMin: Cijk_Ailk_Bljk_B8F8NHS_BH_Bias_HAS_SAV_UserArgs_MT256x256x64_MI16x16x1_SN_LDSB1_CLR1_GRVWA8_GRVWB16_GSU0_GSUC0_GSUWGMRR0_K1_LBSPPA2048_LBSPPB512_LPA0_LPB16_LRVW8_MIWT8_8_PLR1_SU0_SUM0_SUS64_VWA8_VWB8_WGM8_WGMXCC1_WGMXCCGn1
    SolutionIndex: 11
    SolutionNameMin: Cijk_Ailk_Bljk_B8F8NHS_BH_Bias_HAS_SAV_UserArgs_MT256x256x64_MI16x16x1_SN_LDSB1_CLR1_GRVWA16_GRVWB16_GSU0_GSUC0_GSUWGMRR0_K1_LBSPPA2048_LBSPPB512_LPA0_LPB16_LRVW8_MIWT8_8_PLR1_SU0_SUM0_SUS64_VWA8_VWB8_WGM8_WGMXCC1_WGMXCCGn1
    SolutionIndex: 12
    SolutionNameMin: Cijk_Ailk_Bljk_B8F8NHS_BH_Bias_HAS_SAV_UserArgs_MT128x256x64_MI16x16x1_SN_LDSB1_CLR1_GRVWA8_GRVWB16_GSU0_GSUC0_GSUWGMRR0_K1_LBSPPA1024_LBSPPB512_LPA64_LPB16_LRVW8_MIWT4_8_PLR1_SU0_SUM0_SUS64_VWA4_VWB8_WGM4_WGMXCC1_WGMXCCGn1
    SolutionIndex: 13
    SolutionNameMin: Cijk_Ailk_Bljk_B8F8NHS_BH_Bias_HAS_SAV_UserArgs_MT128x256x64_MI16x16x1_SN_LDSB1_CLR1_GRVWA8_GRVWB16_GSU0_GSUC0_GSUWGMRR0_K1_LBSPPA1024_LBSPPB512_LPA64_LPB16_LRVW8_MIWT4_8_PLR1_SU0_SUM0_SUS64_VWA4_VWB8_WGM6_WGMXCC1_WGMXCCGn1
    SolutionIndex: 14
    SolutionNameMin: Cijk_Ailk_Bljk_B8F8NHS_BH_Bias_HAS_SAV_UserArgs_MT128x256x64_MI16x16x1_SN_LDSB1_CLR1_GRVWA8_GRVWB16_GSU0_GSUC0_GSUWGMRR0_K1_LBSPPA1024_LBSPPB512_LPA64_LPB16_LRVW8_MIWT4_8_PLR1_SU0_SUM0_SUS64_VWA4_VWB8_WGM8_WGMXCC1_WGMXCCGn1
    SolutionIndex: 15
    SolutionNameMin: Cijk_Ailk_Bljk_B8F8NHS_BH_Bias_HAS_SAV_UserArgs_MT128x256x64_MI16x16x1_SN_LDSB1_CLR1_GRVWA16_GRVWB16_GSU0_GSUC0_GSUWGMRR0_K1_LBSPPA1024_LBSPPB512_LPA64_LPB16_LRVW8_MIWT4_8_PLR1_SU0_SUM0_SUS64_VWA4_VWB8_WGM8_WGMXCC1_WGMXCCGn1
    SolutionIndex: 16
    SolutionNameMin: Cijk_Ailk_Bljk_B8F8NHS_BH_Bias_HAS_SAV_UserArgs_MT256x128x64_MI16x16x1_SN_LDSB1_CLR1_GRVWA16_GRVWB8_GSU0_GSUC0_GSUWGMRR0_K1_LBSPPA2048_LBSPPB256_LPA0_LPB8_LRVW8_MIWT8_4_PLR1_SU0_SUM0_SUS64_VWA8_VWB4_WGM1_WGMXCC1_WGMXCCGn1
    SolutionIndex: 17
    SolutionNameMin: Cijk_Ailk_Bljk_B8F8NHS_BH_Bias_HAS_SAV_UserArgs_MT256x128x64_MI16x16x1_SN_LDSB1_CLR1_GRVWA8_GRVWB16_GSU0_GSUC0_GSUWGMRR0_K1_LBSPPA2048_LBSPPB256_LPA0_LPB16_LRVW8_MIWT8_4_PLR1_SU0_SUM0_SUS64_VWA8_VWB4_WGM1_WGMXCC1_WGMXCCGn1
    SolutionIndex: 18
    SolutionNameMin: Cijk_Ailk_Bljk_B8F8NHS_BH_Bias_HAS_SAV_UserArgs_MT256x128x64_MI16x16x1_SN_LDSB1_CLR1_GRVWA16_GRVWB16_GSU0_GSUC0_GSUWGMRR0_K1_LBSPPA2048_LBSPPB256_LPA0_LPB16_LRVW8_MIWT8_4_PLR1_SU0_SUM0_SUS64_VWA8_VWB4_WGM1_WGMXCC1_WGMXCCGn1
    SolutionIndex: 19
    SolutionNameMin: Cijk_Ailk_Bljk_B8F8NHS_BH_Bias_HAS_SAV_UserArgs_MT256x128x64_MI16x16x1_SN_LDSB1_CLR1_GRVWA16_GRVWB16_GSU0_GSUC0_GSUWGMRR0_K1_LBSPPA2048_LBSPPB256_LPA0_LPB16_LRVW8_MIWT8_4_PLR1_SU0_SUM0_SUS64_VWA8_VWB4_WGM4_WGMXCC1_WGMXCCGn1
    SolutionIndex: 20
    SolutionNameMin: Cijk_Ailk_Bljk_B8F8NHS_BH_Bias_HAS_SAV_UserArgs_MT256x128x64_MI16x16x1_SN_LDSB1_CLR1_GRVWA8_GRVWB16_GSU0_GSUC0_GSUWGMRR0_K1_LBSPPA2048_LBSPPB256_LPA0_LPB16_LRVW8_MIWT8_4_PLR1_SU0_SUM0_SUS64_VWA8_VWB4_WGM8_WGMXCC1_WGMXCCGn1
    SolutionIndex: 21
    SolutionNameMin: Cijk_Ailk_Bljk_B8F8NHS_BH_Bias_HAS_SAV_UserArgs_MT256x128x64_MI16x16x1_SN_LDSB1_CLR1_GRVWA16_GRVWB16_GSU0_GSUC0_GSUWGMRR0_K1_LBSPPA2048_LBSPPB256_LPA0_LPB16_LRVW8_MIWT8_4_PLR1_SU0_SUM0_SUS64_VWA8_VWB4_WGM8_WGMXCC1_WGMXCCGn1
    SolutionIndex: 22
    SolutionNameMin: Cijk_Ailk_Bljk_B8F8NHS_BH_Bias_HAS_SAV_UserArgs_MT128x128x64_MI16x16x1_SN_LDSB1_CLR1_GRVWA16_GRVWB16_GSU0_GSUC0_GSUWGMRR0_K1_LBSPPA1024_LBSPPB128_LPA0_LPB16_LRVW8_MIWT8_2_PLR1_SU0_SUM0_SUS64_VWA8_VWB2_WGM1_WGMXCC1_WGMXCCGn1
    SolutionIndex: 23
    SolutionNameMin: Cijk_Ailk_Bljk_B8F8NHS_BH_Bias_HAS_SAV_UserArgs_MT128x128x64_MI16x16x1_SN_LDSB1_CLR1_GRVWA8_GRVWB8_GSU0_GSUC0_GSUWGMRR0_K1_LBSPPA1024_LBSPPB128_LPA0_LPB8_LRVW8_MIWT8_2_PLR1_SU0_SUM0_SUS64_VWA8_VWB2_WGM6_WGMXCC1_WGMXCCGn1
    SolutionIndex: 24
    SolutionNameMin: Cijk_Ailk_Bljk_B8F8NHS_BH_Bias_HAS_SAV_UserArgs_MT256x32x64_MI16x16x1_SN_LDSB1_CLR1_GRVWA8_GRVWB8_GSU0_GSUC0_GSUWGMRR0_K1_LBSPPA2048_LBSPPB128_LPA0_LPB8_LRVW8_MIWT8_1_PLR1_SU0_SUM0_SUS64_VWA8_VWB1_WGM1_WGMXCC1_WGMXCCGn1
    SolutionIndex: 25
    SolutionNameMin: Cijk_Ailk_Bljk_B8F8NHS_BH_Bias_HAS_SAV_UserArgs_MT128x64x64_MI16x16x1_SN_LDSB0_CLR1_GRVWA8_GRVWB16_GSU0_GSUC0_GSUWGMRR0_K1_LBSPPA1024_LBSPPB128_LPA0_LPB16_LRVW8_MIWT8_1_PLR1_SU0_SUM0_SUS64_VWA8_VWB1_WGM1_WGMXCC1_WGMXCCGn1
    SolutionIndex: 26
    SolutionNameMin: Cijk_Ailk_Bljk_B8F8NHS_BH_Bias_HAS_SAV_UserArgs_MT128x64x64_MI16x16x1_SN_LDSB0_CLR1_GRVWA16_GRVWB16_GSU0_GSUC0_GSUWGMRR0_K1_LBSPPA1024_LBSPPB128_LPA0_LPB16_LRVW8_MIWT8_1_PLR1_SU0_SUM0_SUS64_VWA8_VWB1_WGM1_WGMXCC1_WGMXCCGn1
    SolutionIndex: 27
    SolutionNameMin: Cijk_Ailk_Bljk_B8F8NHS_BH_Bias_HAS_SAV_UserArgs_MT64x128x64_MI16x16x1_SN_LDSB0_CLR1_GRVWA16_GRVWB8_GSU0_GSUC0_GSUWGMRR0_K1_LBSPPA512_LBSPPB256_LPA32_LPB8_LRVW8_MIWT2_4_PLR1_SU0_SUM0_SUS64_VWA2_VWB4_WGM1_WGMXCC1_WGMXCCGn1
    SolutionIndex: 28
    SolutionNameMin: Cijk_Ailk_Bljk_B8F8NHS_BH_Bias_HAS_SAV_UserArgs_MT64x128x64_MI16x16x1_SN_LDSB0_CLR1_GRVWA8_GRVWB16_GSU0_GSUC0_GSUWGMRR0_K1_LBSPPA512_LBSPPB256_LPA32_LPB16_LRVW8_MIWT2_4_PLR1_SU0_SUM0_SUS64_VWA2_VWB4_WGM1_WGMXCC1_WGMXCCGn1
    SolutionIndex: 29
    SolutionNameMin: Cijk_Ailk_Bljk_B8F8NHS_BH_Bias_HAS_SAV_UserArgs_MT64x128x64_MI16x16x1_SN_LDSB0_CLR1_GRVWA16_GRVWB16_GSU0_GSUC0_GSUWGMRR0_K1_LBSPPA512_LBSPPB256_LPA32_LPB16_LRVW8_MIWT2_4_PLR1_SU0_SUM0_SUS64_VWA2_VWB4_WGM1_WGMXCC1_WGMXCCGn1
    SolutionIndex: 30
    SolutionNameMin: Cijk_Ailk_Bljk_B8F8NHS_BH_Bias_HAS_SAV_UserArgs_MT64x128x64_MI16x16x1_SN_LDSB0_CLR1_GRVWA16_GRVWB8_GSU0_GSUC0_GSUWGMRR0_K1_LBSPPA512_LBSPPB256_LPA32_LPB8_LRVW8_MIWT2_4_PLR1_SU0_SUM0_SUS64_VWA2_VWB4_WGM8_WGMXCC1_WGMXCCGn1
    SolutionIndex: 31
    SolutionNameMin: Cijk_Ailk_Bljk_B8F8NHS_BH_Bias_HAS_SAV_UserArgs_MT128x64x64_MI16x16x1_SN_LDSB0_CLR1_GRVWA8_GRVWB16_GSU0_GSUC0_GSUWGMRR0_K1_LBSPPA1024_LBSPPB128_LPA64_LPB16_LRVW8_MIWT4_2_PLR1_SU0_SUM0_SUS64_VWA4_VWB2_WGM1_WGMXCC1_WGMXCCGn1
    SolutionIndex: 32
    SolutionNameMin: Cijk_Ailk_Bljk_B8F8NHS_BH_Bias_HAS_SAV_UserArgs_MT64x64x64_MI16x16x1_SN_LDSB0_CLR1_GRVWA8_GRVWB8_GSU0_GSUC0_GSUWGMRR0_K1_LBSPPA512_LBSPPB128_LPA32_LPB8_LRVW8_MIWT2_2_PLR1_SU0_SUM0_SUS64_VWA2_VWB2_WGM1_WGMXCC1_WGMXCCGn1
    SolutionIndex: 33
    SolutionNameMin: Cijk_Ailk_Bljk_B8F8NHS_BH_Bias_HAS_SAV_UserArgs_MT64x64x64_MI16x16x1_SN_LDSB0_CLR1_GRVWA8_GRVWB16_GSU0_GSUC0_GSUWGMRR0_K1_LBSPPA512_LBSPPB128_LPA32_LPB16_LRVW8_MIWT2_2_PLR1_SU0_SUM0_SUS64_VWA2_VWB2_WGM1_WGMXCC1_WGMXCCGn1
    SolutionIndex: 34
    SolutionNameMin: Cijk_Ailk_Bljk_B8F8NHS_BH_Bias_HAS_SAV_UserArgs_MT32x32x64_MI16x16x1_SN_LDSB0_CLR1_GRVWA8_GRVWB8_GSU0_GSUC0_GSUWGMRR0_K1_LBSPPA256_LBSPPB128_LPA16_LPB8_LRVW8_MIWT1_1_PLR1_SU0_SUM0_SUS64_VWA1_VWB1_WGM1_WGMXCC1_WGMXCCGn1
    SolutionIndex: 35
    SolutionNameMin: Cijk_Ailk_Bljk_B8F8NHS_BH_Bias_HAS_SAV_UserArgs_MT32x32x64_MI16x16x1_SN_LDSB0_CLR1_GRVWA8_GRVWB8_GSU0_GSUC0_GSUWGMRR0_K1_LBSPPA256_LBSPPB128_LPA16_LPB8_LRVW8_MIWT1_1_PLR1_SU0_SUM0_SUS64_VWA1_VWB1_WGM4_WGMXCC1_WGMXCCGn1
    SolutionIndex: 36
    SolutionNameMin: Cijk_Ailk_Bljk_B8F8NHS_BH_Bias_HAS_SAV_UserArgs_MT128x256x128_MI16x16x1_SN_LDSB1_CLR1_GRVWA16_GRVWB16_GSU0_GSUC0_GSUWGMRR0_K1_LBSPPA1024_LBSPPB1024_LPA64_LPB16_LRVW8_MIWT4_8_PLR1_SU0_SUM0_SUS128_VWA4_VWB8_WGM1_WGMXCC1_WGMXCCGn1
    SolutionIndex: 37
    SolutionNameMin: Cijk_Ailk_Bljk_B8F8NHS_BH_Bias_HAS_SAV_UserArgs_MT128x256x128_MI16x16x1_SN_LDSB1_CLR1_GRVWA8_GRVWB16_GSU0_GSUC0_GSUWGMRR0_K1_LBSPPA1024_LBSPPB1024_LPA64_LPB16_LRVW8_MIWT4_8_PLR1_SU0_SUM0_SUS128_VWA4_VWB8_WGM4_WGMXCC1_WGMXCCGn1
    SolutionIndex: 38
    SolutionNameMin: Cijk_Ailk_Bljk_B8F8NHS_BH_Bias_HAS_SAV_UserArgs_MT128x256x128_MI16x16x1_SN_LDSB1_CLR1_GRVWA16_GRVWB16_GSU0_GSUC0_GSUWGMRR0_K1_LBSPPA1024_LBSPPB1024_LPA64_LPB16_LRVW8_MIWT4_8_PLR1_SU0_SUM0_SUS128_VWA4_VWB8_WGM4_WGMXCC1_WGMXCCGn1
    SolutionIndex: 39
    SolutionNameMin: Cijk_Ailk_Bljk_B8F8NHS_BH_Bias_HAS_SAV_UserArgs_MT128x256x128_MI16x16x1_SN_LDSB1_CLR1_GRVWA16_GRVWB16_GSU0_GSUC0_GSUWGMRR0_K1_LBSPPA1024_LBSPPB1024_LPA64_LPB16_LRVW8_MIWT4_8_PLR1_SU0_SUM0_SUS128_VWA4_VWB8_WGM6_WGMXCC1_WGMXCCGn1
    SolutionIndex: 40
    SolutionNameMin: Cijk_Ailk_Bljk_B8F8NHS_BH_Bias_HAS_SAV_UserArgs_MT256x144x128_MI16x16x1_SN_LDSB1_CLR1_GRVWA8_GRVWB8_GSU0_GSUC0_GSUWGMRR0_K1_LBSPPA2048_LBSPPB128_LPA64_LPB8_LRVW8_MIWT4_9_PLR1_SU0_SUM0_SUS128_VWA4_VWB1_WGM1_WGMXCC1_WGMXCCGn1
    SolutionIndex: 41
    SolutionNameMin: Cijk_Ailk_Bljk_B8F8NHS_BH_Bias_HAS_SAV_UserArgs_MT256x144x128_MI16x16x1_SN_LDSB1_CLR1_GRVWA16_GRVWB8_GSU0_GSUC0_GSUWGMRR0_K1_LBSPPA2048_LBSPPB128_LPA64_LPB8_LRVW8_MIWT4_9_PLR1_SU0_SUM0_SUS128_VWA4_VWB1_WGM1_WGMXCC1_WGMXCCGn1
    SolutionIndex: 42
    SolutionNameMin: Cijk_Ailk_Bljk_B8F8NHS_BH_Bias_HAS_SAV_UserArgs_MT256x144x128_MI16x16x1_SN_LDSB1_CLR1_GRVWA8_GRVWB8_GSU0_GSUC0_GSUWGMRR0_K1_LBSPPA2048_LBSPPB128_LPA64_LPB8_LRVW8_MIWT4_9_PLR1_SU0_SUM0_SUS128_VWA4_VWB1_WGM4_WGMXCC1_WGMXCCGn1
    SolutionIndex: 43
    SolutionNameMin: Cijk_Ailk_Bljk_B8F8NHS_BH_Bias_HAS_SAV_UserArgs_MT256x144x128_MI16x16x1_SN_LDSB1_CLR1_GRVWA16_GRVWB8_GSU0_GSUC0_GSUWGMRR0_K1_LBSPPA2048_LBSPPB128_LPA64_LPB8_LRVW8_MIWT4_9_PLR1_SU0_SUM0_SUS128_VWA4_VWB1_WGM4_WGMXCC1_WGMXCCGn1
    SolutionIndex: 44
    SolutionNameMin: Cijk_Ailk_Bljk_B8F8NHS_BH_Bias_HAS_SAV_UserArgs_MT256x144x128_MI16x16x1_SN_LDSB1_CLR1_GRVWA8_GRVWB8_GSU0_GSUC0_GSUWGMRR0_K1_LBSPPA2048_LBSPPB128_LPA64_LPB8_LRVW8_MIWT4_9_PLR1_SU0_SUM0_SUS128_VWA4_VWB1_WGM6_WGMXCC1_WGMXCCGn1
    SolutionIndex: 45
    SolutionNameMin: Cijk_Ailk_Bljk_B8F8NHS_BH_Bias_HAS_SAV_UserArgs_MT256x144x128_MI16x16x1_SN_LDSB1_CLR1_GRVWA16_GRVWB8_GSU0_GSUC0_GSUWGMRR0_K1_LBSPPA2048_LBSPPB128_LPA64_LPB8_LRVW8_MIWT4_9_PLR1_SU0_SUM0_SUS128_VWA4_VWB1_WGM6_WGMXCC1_WGMXCCGn1
    SolutionIndex: 46
    SolutionNameMin: Cijk_Ailk_Bljk_B8F8NHS_BH_Bias_HAS_SAV_UserArgs_MT256x144x128_MI16x16x1_SN_LDSB1_CLR1_GRVWA16_GRVWB8_GSU0_GSUC0_GSUWGMRR0_K1_LBSPPA2048_LBSPPB128_LPA64_LPB8_LRVW8_MIWT4_9_PLR1_SU0_SUM0_SUS128_VWA4_VWB1_WGM8_WGMXCC1_WGMXCCGn1
    SolutionIndex: 47
    SolutionNameMin: Cijk_Ailk_Bljk_B8F8NHS_BH_Bias_HAS_SAV_UserArgs_MT256x128x128_MI16x16x1_SN_LDSB1_CLR1_GRVWA16_GRVWB16_GSU0_GSUC0_GSUWGMRR0_K1_LBSPPA2048_LBSPPB512_LPA0_LPB16_LRVW8_MIWT8_4_PLR1_SU0_SUM0_SUS128_VWA8_VWB4_WGM1_WGMXCC1_WGMXCCGn1
    SolutionIndex: 48
    SolutionNameMin: Cijk_Ailk_Bljk_B8F8NHS_BH_Bias_HAS_SAV_UserArgs_MT256x128x128_MI16x16x1_SN_LDSB1_CLR1_GRVWA16_GRVWB8_GSU0_GSUC0_GSUWGMRR0_K1_LBSPPA2048_LBSPPB512_LPA0_LPB8_LRVW8_MIWT8_4_PLR1_SU0_SUM0_SUS128_VWA8_VWB4_WGM4_WGMXCC1_WGMXCCGn1
    SolutionIndex: 49
    SolutionNameMin: Cijk_Ailk_Bljk_B8F8NHS_BH_Bias_HAS_SAV_UserArgs_MT256x128x128_MI16x16x1_SN_LDSB1_CLR1_GRVWA16_GRVWB16_GSU0_GSUC0_GSUWGMRR0_K1_LBSPPA2048_LBSPPB512_LPA0_LPB16_LRVW8_MIWT8_4_PLR1_SU0_SUM0_SUS128_VWA8_VWB4_WGM4_WGMXCC1_WGMXCCGn1
    SolutionIndex: 50
    SolutionNameMin: Cijk_Ailk_Bljk_B8F8NHS_BH_Bias_HAS_SAV_UserArgs_MT256x128x128_MI16x16x1_SN_LDSB1_CLR1_GRVWA8_GRVWB8_GSU0_GSUC0_GSUWGMRR0_K1_LBSPPA2048_LBSPPB512_LPA0_LPB8_LRVW8_MIWT8_4_PLR1_SU0_SUM0_SUS128_VWA8_VWB4_WGM8_WGMXCC1_WGMXCCGn1
    SolutionIndex: 51
    SolutionNameMin: Cijk_Ailk_Bljk_B8F8NHS_BH_Bias_HAS_SAV_UserArgs_MT256x128x128_MI16x16x1_SN_LDSB1_CLR1_GRVWA16_GRVWB8_GSU0_GSUC0_GSUWGMRR0_K1_LBSPPA2048_LBSPPB512_LPA0_LPB8_LRVW8_MIWT8_4_PLR1_SU0_SUM0_SUS128_VWA8_VWB4_WGM8_WGMXCC1_WGMXCCGn1
    SolutionIndex: 52
    SolutionNameMin: Cijk_Ailk_Bljk_B8F8NHS_BH_Bias_HAS_SAV_UserArgs_MT256x128x128_MI16x16x1_SN_LDSB1_CLR1_GRVWA16_GRVWB16_GSU0_GSUC0_GSUWGMRR0_K1_LBSPPA2048_LBSPPB512_LPA0_LPB16_LRVW8_MIWT8_4_PLR1_SU0_SUM0_SUS128_VWA8_VWB4_WGM8_WGMXCC1_WGMXCCGn1
    SolutionIndex: 53
    SolutionNameMin: Cijk_Ailk_Bljk_B8F8NHS_BH_Bias_HAS_SAV_UserArgs_MT128x128x128_MI16x16x1_SN_LDSB1_CLR1_GRVWA16_GRVWB16_GSU0_GSUC0_GSUWGMRR0_K1_LBSPPA1024_LBSPPB256_LPA0_LPB16_LRVW8_MIWT8_2_PLR1_SU0_SUM0_SUS128_VWA8_VWB2_WGM1_WGMXCC1_WGMXCCGn1
    SolutionIndex: 54
    SolutionNameMin: Cijk_Ailk_Bljk_B8F8NHS_BH_Bias_HAS_SAV_UserArgs_MT128x144x128_MI16x16x1_SN_LDSB1_CLR1_GRVWA8_GRVWB8_GSU0_GSUC0_GSUWGMRR0_K1_LBSPPA1024_LBSPPB128_LPA32_LPB8_LRVW8_MIWT2_9_PLR1_SU0_SUM0_SUS128_VWA2_VWB1_WGM1_WGMXCC1_WGMXCCGn1
    SolutionIndex: 55
    SolutionNameMin: Cijk_Ailk_Bljk_B8F8NHS_BH_Bias_HAS_SAV_UserArgs_MT128x144x128_MI16x16x1_SN_LDSB1_CLR1_GRVWA16_GRVWB8_GSU0_GSUC0_GSUWGMRR0_K1_LBSPPA1024_LBSPPB128_LPA32_LPB8_LRVW8_MIWT2_9_PLR1_SU0_SUM0_SUS128_VWA2_VWB1_WGM1_WGMXCC1_WGMXCCGn1
    SolutionIndex: 56
    SolutionNameMin: Cijk_Ailk_Bljk_B8F8NHS_BH_Bias_HAS_SAV_UserArgs_MT128x144x128_MI16x16x1_SN_LDSB1_CLR1_GRVWA16_GRVWB8_GSU0_GSUC0_GSUWGMRR0_K1_LBSPPA1024_LBSPPB128_LPA32_LPB8_LRVW8_MIWT2_9_PLR1_SU0_SUM0_SUS128_VWA2_VWB1_WGM4_WGMXCC1_WGMXCCGn1
    SolutionIndex: 57
    SolutionNameMin: Cijk_Ailk_Bljk_B8F8NHS_BH_Bias_HAS_SAV_UserArgs_MT128x128x128_MI16x16x1_SN_LDSB1_CLR1_GRVWA16_GRVWB16_GSU0_GSUC0_GSUWGMRR0_K1_LBSPPA1024_LBSPPB512_LPA64_LPB16_LRVW8_MIWT4_4_PLR1_SU0_SUM0_SUS128_VWA4_VWB4_WGM1_WGMXCC1_WGMXCCGn1
    SolutionIndex: 58
    SolutionNameMin: Cijk_Ailk_Bljk_B8F8NHS_BH_Bias_HAS_SAV_UserArgs_MT128x128x128_MI16x16x1_SN_LDSB1_CLR1_GRVWA16_GRVWB16_GSU0_GSUC0_GSUWGMRR0_K1_LBSPPA1024_LBSPPB512_LPA64_LPB16_LRVW8_MIWT4_4_PLR1_SU0_SUM0_SUS128_VWA4_VWB4_WGM4_WGMXCC1_WGMXCCGn1
    SolutionIndex: 59
    SolutionNameMin: Cijk_Ailk_Bljk_B8F8NHS_BH_Bias_HAS_SAV_UserArgs_MT128x128x128_MI16x16x1_SN_LDSB1_CLR1_GRVWA8_GRVWB16_GSU0_GSUC0_GSUWGMRR0_K1_LBSPPA1024_LBSPPB512_LPA64_LPB16_LRVW8_MIWT4_4_PLR1_SU0_SUM0_SUS128_VWA4_VWB4_WGM6_WGMXCC1_WGMXCCGn1
    SolutionIndex: 60
    SolutionNameMin: Cijk_Ailk_Bljk_B8F8NHS_BH_Bias_HAS_SAV_UserArgs_MT128x128x128_MI16x16x1_SN_LDSB1_CLR1_GRVWA16_GRVWB16_GSU0_GSUC0_GSUWGMRR0_K1_LBSPPA1024_LBSPPB512_LPA64_LPB16_LRVW8_MIWT4_4_PLR1_SU0_SUM0_SUS128_VWA4_VWB4_WGM6_WGMXCC1_WGMXCCGn1
    SolutionIndex: 61
    SolutionNameMin: Cijk_Ailk_Bljk_B8F8NHS_BH_Bias_HAS_SAV_UserArgs_MT128x128x128_MI16x16x1_SN_LDSB1_CLR1_GRVWA16_GRVWB16_GSU0_GSUC0_GSUWGMRR0_K1_LBSPPA1024_LBSPPB512_LPA64_LPB16_LRVW8_MIWT4_4_PLR1_SU0_SUM0_SUS128_VWA4_VWB4_WGM8_WGMXCC1_WGMXCCGn1
    SolutionIndex: 62
    SolutionNameMin: Cijk_Ailk_Bljk_B8F8NHS_BH_Bias_HAS_SAV_UserArgs_MT64x128x128_MI16x16x1_SN_LDSB1_CLR1_GRVWA16_GRVWB16_GSU0_GSUC0_GSUWGMRR0_K1_LBSPPA512_LBSPPB512_LPA32_LPB16_LRVW8_MIWT2_4_PLR1_SU0_SUM0_SUS128_VWA2_VWB4_WGM1_WGMXCC1_WGMXCCGn1
    SolutionIndex: 63
    SolutionNameMin: Cijk_Ailk_Bljk_B8F8NHS_BH_Bias_HAS_SAV_UserArgs_MT64x128x128_MI16x16x1_SN_LDSB1_CLR1_GRVWA16_GRVWB16_GSU0_GSUC0_GSUWGMRR0_K1_LBSPPA512_LBSPPB512_LPA32_LPB16_LRVW8_MIWT2_4_PLR1_SU0_SUM0_SUS128_VWA2_VWB4_WGM4_WGMXCC1_WGMXCCGn1
    SolutionIndex: 64
    SolutionNameMin: Cijk_Ailk_Bljk_B8F8NHS_BH_Bias_HAS_SAV_UserArgs_MT128x64x128_MI16x16x1_SN_LDSB1_CLR1_GRVWA16_GRVWB16_GSU0_GSUC0_GSUWGMRR0_K1_LBSPPA1024_LBSPPB256_LPA64_LPB16_LRVW8_MIWT4_2_PLR1_SU0_SUM0_SUS128_VWA4_VWB2_WGM1_WGMXCC1_WGMXCCGn1
    SolutionIndex: 65
    SolutionNameMin: Cijk_Ailk_Bljk_B8F8NHS_BH_Bias_HAS_SAV_UserArgs_MT128x64x128_MI16x16x1_SN_LDSB1_CLR1_GRVWA16_GRVWB16_GSU0_GSUC0_GSUWGMRR0_K1_LBSPPA1024_LBSPPB256_LPA64_LPB16_LRVW8_MIWT4_2_PLR1_SU0_SUM0_SUS128_VWA4_VWB2_WGM4_WGMXCC1_WGMXCCGn1
    SolutionIndex: 66
    SolutionNameMin: Cijk_Ailk_Bljk_B8F8NHS_BH_Bias_HAS_SAV_UserArgs_MT128x64x128_MI16x16x1_SN_LDSB1_CLR1_GRVWA16_GRVWB16_GSU0_GSUC0_GSUWGMRR0_K1_LBSPPA1024_LBSPPB256_LPA64_LPB16_LRVW8_MIWT4_2_PLR1_SU0_SUM0_SUS128_VWA4_VWB2_WGM6_WGMXCC1_WGMXCCGn1
    SolutionIndex: 67
    SolutionNameMin: Cijk_Ailk_Bljk_B8F8NHS_BH_Bias_HAS_SAV_UserArgs_MT128x64x128_MI16x16x1_SN_LDSB1_CLR1_GRVWA16_GRVWB16_GSU0_GSUC0_GSUWGMRR0_K1_LBSPPA1024_LBSPPB256_LPA64_LPB16_LRVW8_MIWT4_2_PLR1_SU0_SUM0_SUS128_VWA4_VWB2_WGM8_WGMXCC1_WGMXCCGn1
    SolutionIndex: 68
    SolutionNameMin: Cijk_Ailk_Bljk_B8F8NHS_BH_Bias_HAS_SAV_UserArgs_MT64x64x128_MI16x16x1_SN_LDSB1_CLR1_GRVWA16_GRVWB8_GSU0_GSUC0_GSUWGMRR0_K1_LBSPPA512_LBSPPB256_LPA32_LPB8_LRVW8_MIWT2_2_PLR1_SU0_SUM0_SUS128_VWA2_VWB2_WGM1_WGMXCC1_WGMXCCGn1
    SolutionIndex: 69
    SolutionNameMin: Cijk_Ailk_Bljk_B8F8NHS_BH_Bias_HAS_SAV_UserArgs_MT64x64x128_MI16x16x1_SN_LDSB1_CLR1_GRVWA8_GRVWB16_GSU0_GSUC0_GSUWGMRR0_K1_LBSPPA512_LBSPPB256_LPA32_LPB16_LRVW8_MIWT2_2_PLR1_SU0_SUM0_SUS128_VWA2_VWB2_WGM1_WGMXCC1_WGMXCCGn1
    SolutionIndex: 70
    SolutionNameMin: Cijk_Ailk_Bljk_B8F8NHS_BH_Bias_HAS_SAV_UserArgs_MT64x64x128_MI16x16x1_SN_LDSB1_CLR1_GRVWA16_GRVWB16_GSU0_GSUC0_GSUWGMRR0_K1_LBSPPA512_LBSPPB256_LPA32_LPB16_LRVW8_MIWT2_2_PLR1_SU0_SUM0_SUS128_VWA2_VWB2_WGM1_WGMXCC1_WGMXCCGn1
    SolutionIndex: 71
    SolutionNameMin: Cijk_Ailk_Bljk_B8F8NHS_BH_Bias_HAS_SAV_UserArgs_MT64x64x128_MI16x16x1_SN_LDSB1_CLR1_GRVWA16_GRVWB16_GSU0_GSUC0_GSUWGMRR0_K1_LBSPPA512_LBSPPB256_LPA32_LPB16_LRVW8_MIWT2_2_PLR1_SU0_SUM0_SUS128_VWA2_VWB2_WGM4_WGMXCC1_WGMXCCGn1
    SolutionIndex: 72
    SolutionNameMin: Cijk_Ailk_Bljk_B8F8NHS_BH_Bias_HAS_SAV_UserArgs_MT64x64x128_MI16x16x1_SN_LDSB1_CLR1_GRVWA16_GRVWB16_GSU0_GSUC0_GSUWGMRR0_K1_LBSPPA512_LBSPPB256_LPA32_LPB16_LRVW8_MIWT2_2_PLR1_SU0_SUM0_SUS128_VWA2_VWB2_WGM6_WGMXCC1_WGMXCCGn1
    SolutionIndex: 73
    SolutionNameMin: Cijk_Ailk_Bljk_B8F8NHS_BH_Bias_HAS_SAV_UserArgs_MT64x64x128_MI16x16x1_SN_LDSB1_CLR1_GRVWA16_GRVWB8_GSU0_GSUC0_GSUWGMRR0_K1_LBSPPA512_LBSPPB256_LPA32_LPB8_LRVW8_MIWT2_2_PLR1_SU0_SUM0_SUS128_VWA2_VWB2_WGM8_WGMXCC1_WGMXCCGn1
    SolutionIndex: 74
    SolutionNameMin: Cijk_Ailk_Bljk_B8F8NHS_BH_Bias_HAS_SAV_UserArgs_MT64x64x128_MI16x16x1_SN_LDSB1_CLR1_GRVWA8_GRVWB16_GSU0_GSUC0_GSUWGMRR0_K1_LBSPPA512_LBSPPB256_LPA32_LPB16_LRVW8_MIWT2_2_PLR1_SU0_SUM0_SUS128_VWA2_VWB2_WGM8_WGMXCC1_WGMXCCGn1
    SolutionIndex: 75
    SolutionNameMin: Cijk_Ailk_Bljk_B8F8NHS_BH_Bias_HAS_SAV_UserArgs_MT64x64x128_MI16x16x1_SN_LDSB1_CLR1_GRVWA16_GRVWB16_GSU0_GSUC0_GSUWGMRR0_K1_LBSPPA512_LBSPPB256_LPA32_LPB16_LRVW8_MIWT2_2_PLR1_SU0_SUM0_SUS128_VWA2_VWB2_WGM8_WGMXCC1_WGMXCCGn1
    SolutionIndex: 76
    SolutionNameMin: Cijk_Ailk_Bljk_B8F8NHS_BH_Bias_HAS_SAV_UserArgs_MT32x64x128_MI16x16x1_SN_LDSB0_CLR1_GRVWA8_GRVWB16_GSU0_GSUC0_GSUWGMRR0_K1_LBSPPA256_LBSPPB256_LPA16_LPB16_LRVW8_MIWT1_2_PLR1_SU0_SUM0_SUS128_VWA1_VWB2_WGM1_WGMXCC1_WGMXCCGn1
    SolutionIndex: 77
    SolutionNameMin: Cijk_Ailk_Bljk_B8F8NHS_BH_Bias_HAS_SAV_UserArgs_MT32x64x128_MI16x16x1_SN_LDSB0_CLR1_GRVWA8_GRVWB16_GSU0_GSUC0_GSUWGMRR0_K1_LBSPPA256_LBSPPB256_LPA16_LPB16_LRVW8_MIWT1_2_PLR1_SU0_SUM0_SUS128_VWA1_VWB2_WGM4_WGMXCC1_WGMXCCGn1
    SolutionIndex: 78
    SolutionNameMin: Cijk_Ailk_Bljk_B8F8NHS_BH_Bias_HAS_SAV_UserArgs_MT32x64x128_MI16x16x1_SN_LDSB0_CLR1_GRVWA16_GRVWB16_GSU0_GSUC0_GSUWGMRR0_K1_LBSPPA256_LBSPPB256_LPA16_LPB16_LRVW8_MIWT1_2_PLR1_SU0_SUM0_SUS128_VWA1_VWB2_WGM6_WGMXCC1_WGMXCCGn1
    SolutionIndex: 79
    SolutionNameMin: Cijk_Ailk_Bljk_B8F8NHS_BH_Bias_HAS_SAV_UserArgs_MT64x32x128_MI16x16x1_SN_LDSB0_CLR1_GRVWA8_GRVWB8_GSU0_GSUC0_GSUWGMRR0_K1_LBSPPA512_LBSPPB128_LPA32_LPB8_LRVW8_MIWT2_1_PLR1_SU0_SUM0_SUS128_VWA2_VWB1_WGM1_WGMXCC1_WGMXCCGn1
    SolutionIndex: 80
    SolutionNameMin: Cijk_Ailk_Bljk_B8F8NHS_BH_Bias_HAS_SAV_UserArgs_MT64x32x128_MI16x16x1_SN_LDSB0_CLR1_GRVWA16_GRVWB8_GSU0_GSUC0_GSUWGMRR0_K1_LBSPPA512_LBSPPB128_LPA32_LPB8_LRVW8_MIWT2_1_PLR1_SU0_SUM0_SUS128_VWA2_VWB1_WGM1_WGMXCC1_WGMXCCGn1
    SolutionIndex: 81
    SolutionNameMin: Cijk_Ailk_Bljk_B8F8NHS_BH_Bias_HAS_SAV_UserArgs_MT64x32x128_MI16x16x1_SN_LDSB0_CLR1_GRVWA8_GRVWB16_GSU0_GSUC0_GSUWGMRR0_K1_LBSPPA512_LBSPPB128_LPA32_LPB16_LRVW8_MIWT2_1_PLR1_SU0_SUM0_SUS128_VWA2_VWB1_WGM1_WGMXCC1_WGMXCCGn1
    SolutionIndex: 82
    SolutionNameMin: Cijk_Ailk_Bljk_B8F8NHS_BH_Bias_HAS_SAV_UserArgs_MT64x32x128_MI16x16x1_SN_LDSB0_CLR1_GRVWA16_GRVWB16_GSU0_GSUC0_GSUWGMRR0_K1_LBSPPA512_LBSPPB128_LPA32_LPB16_LRVW8_MIWT2_1_PLR1_SU0_SUM0_SUS128_VWA2_VWB1_WGM1_WGMXCC1_WGMXCCGn1
    SolutionIndex: 83
    SolutionNameMin: Cijk_Ailk_Bljk_B8F8NHS_BH_Bias_HAS_SAV_UserArgs_MT64x32x128_MI16x16x1_SN_LDSB0_CLR1_GRVWA8_GRVWB16_GSU0_GSUC0_GSUWGMRR0_K1_LBSPPA512_LBSPPB128_LPA32_LPB16_LRVW8_MIWT2_1_PLR1_SU0_SUM0_SUS128_VWA2_VWB1_WGM6_WGMXCC1_WGMXCCGn1
    SolutionIndex: 84
    SolutionNameMin: Cijk_Ailk_Bljk_B8F8NHS_BH_Bias_HAS_SAV_UserArgs_MT64x32x128_MI16x16x1_SN_LDSB0_CLR1_GRVWA8_GRVWB16_GSU0_GSUC0_GSUWGMRR0_K1_LBSPPA512_LBSPPB128_LPA32_LPB16_LRVW8_MIWT2_1_PLR1_SU0_SUM0_SUS128_VWA2_VWB1_WGM8_WGMXCC1_WGMXCCGn1
    SolutionIndex: 85
    SolutionNameMin: Cijk_Ailk_Bljk_B8F8NHS_BH_Bias_HAS_SAV_UserArgs_MT32x32x128_MI16x16x1_SN_LDSB0_CLR1_GRVWA8_GRVWB8_GSU0_GSUC0_GSUWGMRR0_K1_LBSPPA256_LBSPPB128_LPA16_LPB8_LRVW8_MIWT1_1_PLR1_SU0_SUM0_SUS128_VWA1_VWB1_WGM1_WGMXCC1_WGMXCCGn1
    SolutionIndex: 86
    SolutionNameMin: Cijk_Ailk_Bljk_B8F8NHS_BH_Bias_HAS_SAV_UserArgs_MT32x32x128_MI16x16x1_SN_LDSB0_CLR1_GRVWA8_GRVWB16_GSU0_GSUC0_GSUWGMRR0_K1_LBSPPA256_LBSPPB128_LPA16_LPB16_LRVW8_MIWT1_1_PLR1_SU0_SUM0_SUS128_VWA1_VWB1_WGM1_WGMXCC1_WGMXCCGn1
    SolutionIndex: 87
    SolutionNameMin: Cijk_Ailk_Bljk_B8F8NHS_BH_Bias_HAS_SAV_UserArgs_MT32x32x128_MI16x16x1_SN_LDSB0_CLR1_GRVWA16_GRVWB16_GSU0_GSUC0_GSUWGMRR0_K1_LBSPPA256_LBSPPB128_LPA16_LPB16_LRVW8_MIWT1_1_PLR1_SU0_SUM0_SUS128_VWA1_VWB1_WGM1_WGMXCC1_WGMXCCGn1
    SolutionIndex: 88
    SolutionNameMin: Cijk_Ailk_Bljk_B8F8NHS_BH_Bias_HAS_SAV_UserArgs_MT32x32x128_MI16x16x1_SN_LDSB0_CLR1_GRVWA8_GRVWB16_GSU0_GSUC0_GSUWGMRR0_K1_LBSPPA256_LBSPPB128_LPA16_LPB16_LRVW8_MIWT1_1_PLR1_SU0_SUM0_SUS128_VWA1_VWB1_WGM8_WGMXCC1_WGMXCCGn1
    SolutionIndex: 89
    SolutionNameMin: Cijk_Ailk_Bljk_B8F8NHS_BH_Bias_HAS_SAV_UserArgs_MT128x64x256_MI16x16x1_SN_LDSB1_CLR1_GRVWA16_GRVWB16_GSU0_GSUC0_GSUWGMRR0_K1_LBSPPA1024_LBSPPB512_LPA64_LPB16_LRVW8_MIWT4_2_PLR1_SU0_SUM0_SUS256_VWA4_VWB2_WGM1_WGMXCC1_WGMXCCGn1
    SolutionIndex: 90
    SolutionNameMin: Cijk_Ailk_Bljk_B8F8NHS_BH_Bias_HAS_SAV_UserArgs_MT64x64x256_MI16x16x1_SN_LDSB1_CLR1_GRVWA16_GRVWB16_GSU0_GSUC0_GSUWGMRR0_K1_LBSPPA512_LBSPPB512_LPA32_LPB16_LRVW8_MIWT2_2_PLR1_SU0_SUM0_SUS256_VWA2_VWB2_WGM1_WGMXCC1_WGMXCCGn1
    SolutionIndex: 91
    SolutionNameMin: Cijk_Ailk_Bljk_B8F8NHS_BH_Bias_HAS_SAV_UserArgs_MT64x64x256_MI16x16x1_SN_LDSB1_CLR1_GRVWA16_GRVWB16_GSU0_GSUC0_GSUWGMRR0_K1_LBSPPA512_LBSPPB512_LPA32_LPB16_LRVW8_MIWT2_2_PLR1_SU0_SUM0_SUS256_VWA2_VWB2_WGM4_WGMXCC1_WGMXCCGn1
    SolutionIndex: 92
    SolutionNameMin: Cijk_Ailk_Bljk_B8F8NHS_BH_Bias_HAS_SAV_UserArgs_MT64x32x256_MI16x16x1_SN_LDSB1_CLR1_GRVWA16_GRVWB16_GSU0_GSUC0_GSUWGMRR0_K1_LBSPPA512_LBSPPB256_LPA32_LPB16_LRVW8_MIWT2_1_PLR1_SU0_SUM0_SUS256_VWA2_VWB1_WGM1_WGMXCC1_WGMXCCGn1
    SolutionIndex: 93
    SolutionNameMin: Cijk_Ailk_Bljk_B8F8NHS_BH_Bias_HAS_SAV_UserArgs_MT64x32x256_MI16x16x1_SN_LDSB1_CLR1_GRVWA16_GRVWB16_GSU0_GSUC0_GSUWGMRR0_K1_LBSPPA512_LBSPPB256_LPA32_LPB16_LRVW8_MIWT2_1_PLR1_SU0_SUM0_SUS256_VWA2_VWB1_WGM4_WGMXCC1_WGMXCCGn1
    SolutionIndex: 94
    SolutionNameMin: Cijk_Ailk_Bljk_B8F8NHS_BH_Bias_HAS_SAV_UserArgs_MT64x32x256_MI16x16x1_SN_LDSB1_CLR1_GRVWA16_GRVWB16_GSU0_GSUC0_GSUWGMRR0_K1_LBSPPA512_LBSPPB256_LPA32_LPB16_LRVW8_MIWT2_1_PLR1_SU0_SUM0_SUS256_VWA2_VWB1_WGM8_WGMXCC1_WGMXCCGn1
    SolutionIndex: 95
    SolutionNameMin: Cijk_Ailk_Bljk_B8F8NHS_BH_Bias_HAS_SAV_UserArgs_MT32x32x256_MI16x16x1_SN_LDSB1_CLR1_GRVWA16_GRVWB16_GSU0_GSUC0_GSUWGMRR0_K1_LBSPPA256_LBSPPB256_LPA16_LPB16_LRVW8_MIWT1_1_PLR1_SU0_SUM0_SUS256_VWA1_VWB1_WGM4_WGMXCC1_WGMXCCGn1
    SolutionIndex: 96
    SolutionNameMin: Cijk_Ailk_Bljk_B8F8NHS_BH_Bias_HAS_SAV_UserArgs_MT32x32x256_MI16x16x1_SN_LDSB1_CLR1_GRVWA8_GRVWB16_GSU0_GSUC0_GSUWGMRR0_K1_LBSPPA256_LBSPPB256_LPA16_LPB16_LRVW8_MIWT1_1_PLR1_SU0_SUM0_SUS256_VWA1_VWB1_WGM6_WGMXCC1_WGMXCCGn1
    SolutionIndex: 97
    SolutionNameMin: Cijk_Ailk_Bljk_B8F8NHS_BH_Bias_HAS_SAV_UserArgs_MT32x32x256_MI16x16x1_SN_LDSB1_CLR1_GRVWA16_GRVWB16_GSU0_GSUC0_GSUWGMRR0_K1_LBSPPA256_LBSPPB256_LPA16_LPB16_LRVW8_MIWT1_1_PLR1_SU0_SUM0_SUS256_VWA1_VWB1_WGM8_WGMXCC1_WGMXCCGn1
- - - [128, 128, 1, 128, 128, 128, 128, 128]
    - [86, 0.57]
  - - [128, 128, 1, 256, 128, 128, 128, 256]
    - [86, 1.05]
  - - [128, 128, 1, 512, 128, 128, 128, 512]
    - [86, 1.76]
  - - [128, 128, 1, 1024, 128, 128, 128, 1024]
    - [86, 2.78]
  - - [128, 128, 1, 2048, 128, 128, 128, 2048]
    - [86, 3.88]
  - - [128, 128, 1, 4096, 128, 128, 128, 4096]
    - [85, 4.83]
  - - [128, 128, 1, 8192, 128, 128, 128, 8192]
    - [87, 5.5]
  - - [128, 256, 1, 128, 128, 128, 128, 128]
    - [85, 1.16]
  - - [128, 256, 1, 256, 128, 128, 128, 256]
    - [85, 2.1]
  - - [128, 256, 1, 512, 128, 128, 128, 512]
    - [86, 3.58]
  - - [128, 256, 1, 1024, 128, 128, 128, 1024]
    - [85, 5.65]
  - - [128, 256, 1, 2048, 128, 128, 128, 2048]
    - [86, 7.75]
  - - [128, 256, 1, 4096, 128, 128, 128, 4096]
    - [85, 9.66]
  - - [128, 256, 1, 8192, 128, 128, 128, 8192]
    - [85, 11.0]
  - - [128, 512, 1, 128, 128, 128, 128, 128]
    - [34, 2.25]
  - - [128, 512, 1, 256, 128, 128, 128, 256]
    - [34, 4.14]
  - - [128, 512, 1, 512, 128, 128, 128, 512]
    - [86, 7.06]
  - - [128, 512, 1, 1024, 128, 128, 128, 1024]
    - [85, 11.07]
  - - [128, 512, 1, 2048, 128, 128, 128, 2048]
    - [85, 15.49]
  - - [128, 512, 1, 4096, 128, 128, 128, 4096]
    - [85, 19.18]
  - - [128, 512, 1, 8192, 128, 128, 128, 8192]
    - [85, 21.9]
  - - [128, 1024, 1, 128, 128, 128, 128, 128]
    - [34, 4.45]
  - - [128, 1024, 1, 256, 128, 128, 128, 256]
    - [34, 8.04]
  - - [128, 1024, 1, 512, 128, 128, 128, 512]
    - [86, 13.76]
  - - [128, 1024, 1, 1024, 128, 128, 128, 1024]
    - [85, 21.74]
  - - [128, 1024, 1, 2048, 128, 128, 128, 2048]
    - [85, 30.32]
  - - [128, 1024, 1, 4096, 128, 128, 128, 4096]
    - [85, 37.96]
  - - [128, 1024, 1, 8192, 128, 128, 128, 8192]
    - [85, 43.1]
  - - [128, 2048, 1, 128, 128, 128, 128, 128]
    - [79, 8.54]
  - - [128, 2048, 1, 256, 128, 128, 128, 256]
    - [76, 15.15]
  - - [128, 2048, 1, 512, 128, 128, 128, 512]
    - [81, 25.17]
  - - [128, 2048, 1, 1024, 128, 128, 128, 1024]
    - [76, 38.17]
  - - [128, 2048, 1, 2048, 128, 128, 128, 2048]
    - [92, 52.25]
  - - [128, 2048, 1, 4096, 128, 128, 128, 4096]
    - [92, 64.2]
  - - [128, 2048, 1, 8192, 128, 128, 128, 8192]
    - [92, 72.71]
  - - [128, 4096, 1, 128, 128, 128, 128, 128]
    - [32, 15.53]
  - - [128, 4096, 1, 256, 128, 128, 128, 256]
    - [33, 27.11]
  - - [128, 4096, 1, 512, 128, 128, 128, 512]
    - [68, 43.67]
  - - [128, 4096, 1, 1024, 128, 128, 128, 1024]
    - [68, 64.83]
  - - [128, 4096, 1, 2048, 128, 128, 128, 2048]
    - [68, 85.86]
  - - [128, 4096, 1, 4096, 128, 128, 128, 4096]
    - [90, 103.04]
  - - [128, 4096, 1, 8192, 128, 128, 128, 8192]
    - [91, 113.28]
  - - [128, 8192, 1, 128, 128, 128, 128, 128]
    - [26, 25.71]
  - - [128, 8192, 1, 256, 128, 128, 128, 256]
    - [28, 44.91]
  - - [128, 8192, 1, 512, 128, 128, 128, 512]
    - [28, 72.71]
  - - [128, 8192, 1, 1024, 128, 128, 128, 1024]
    - [27, 104.51]
  - - [128, 8192, 1, 2048, 128, 128, 128, 2048]
    - [27, 134.6]
  - - [128, 8192, 1, 4096, 128, 128, 128, 4096]
    - [62, 142.26]
  - - [128, 8192, 1, 8192, 128, 128, 128, 8192]
    - [63, 153.24]
  - - [256, 128, 1, 128, 256, 256, 256, 128]
    - [34, 1.09]
  - - [256, 128, 1, 256, 256, 256, 256, 256]
    - [88, 2.04]
  - - [256, 128, 1, 512, 256, 256, 256, 512]
    - [85, 3.46]
  - - [256, 128, 1, 1024, 256, 256, 256, 1024]
    - [86, 5.46]
  - - [256, 128, 1, 2048, 256, 256, 256, 2048]
    - [86, 7.64]
  - - [256, 128, 1, 4096, 256, 256, 256, 4096]
    - [85, 9.66]
  - - [256, 128, 1, 8192, 256, 256, 256, 8192]
    - [85, 10.98]
  - - [256, 256, 1, 128, 256, 256, 256, 128]
    - [35, 2.17]
  - - [256, 256, 1, 256, 256, 256, 256, 256]
    - [85, 4.11]
  - - [256, 256, 1, 512, 256, 256, 256, 512]
    - [85, 7.07]
  - - [256, 256, 1, 1024, 256, 256, 256, 1024]
    - [86, 11.19]
  - - [256, 256, 1, 2048, 256, 256, 256, 2048]
    - [86, 15.36]
  - - [256, 256, 1, 4096, 256, 256, 256, 4096]
    - [85, 19.17]
  - - [256, 256, 1, 8192, 256, 256, 256, 8192]
    - [85, 21.69]
  - - [256, 512, 1, 128, 256, 256, 256, 128]
    - [86, 4.21]
  - - [256, 512, 1, 256, 256, 256, 256, 256]
    - [86, 8.2]
  - - [256, 512, 1, 512, 256, 256, 256, 512]
    - [86, 13.97]
  - - [256, 512, 1, 1024, 256, 256, 256, 1024]
    - [85, 21.84]
  - - [256, 512, 1, 2048, 256, 256, 256, 2048]
    - [85, 30.5]
  - - [256, 512, 1, 4096, 256, 256, 256, 4096]
    - [85, 37.96]
  - - [256, 512, 1, 8192, 256, 256, 256, 8192]
    - [85, 43.06]
  - - [256, 1024, 1, 128, 256, 256, 256, 128]
    - [79, 8.22]
  - - [256, 1024, 1, 256, 256, 256, 256, 256]
    - [81, 14.93]
  - - [256, 1024, 1, 512, 256, 256, 256, 512]
    - [81, 24.88]
  - - [256, 1024, 1, 1024, 256, 256, 256, 1024]
    - [81, 37.95]
  - - [256, 1024, 1, 2048, 256, 256, 256, 2048]
    - [92, 52.06]
  - - [256, 1024, 1, 4096, 256, 256, 256, 4096]
    - [92, 64.12]
  - - [256, 1024, 1, 8192, 256, 256, 256, 8192]
    - [92, 72.66]
  - - [256, 2048, 1, 128, 256, 256, 256, 128]
    - [33, 14.98]
  - - [256, 2048, 1, 256, 256, 256, 256, 256]
    - [32, 26.22]
  - - [256, 2048, 1, 512, 256, 256, 256, 512]
    - [70, 42.5]
  - - [256, 2048, 1, 1024, 256, 256, 256, 1024]
    - [68, 63.78]
  - - [256, 2048, 1, 2048, 256, 256, 256, 2048]
    - [68, 85.01]
  - - [256, 2048, 1, 4096, 256, 256, 256, 4096]
    - [90, 102.86]
  - - [256, 2048, 1, 8192, 256, 256, 256, 8192]
    - [68, 110.7]
  - - [256, 4096, 1, 128, 256, 256, 256, 128]
    - [28, 25.18]
  - - [256, 4096, 1, 256, 256, 256, 256, 256]
    - [28, 44.3]
  - - [256, 4096, 1, 512, 256, 256, 256, 512]
    - [29, 70.3]
  - - [256, 4096, 1, 1024, 256, 256, 256, 1024]
    - [27, 104.18]
  - - [256, 4096, 1, 2048, 256, 256, 256, 2048]
    - [27, 132.23]
  - - [256, 4096, 1, 4096, 256, 256, 256, 4096]
    - [62, 144.42]
  - - [256, 4096, 1, 8192, 256, 256, 256, 8192]
    - [62, 154.43]
  - - [256, 8192, 1, 128, 256, 256, 256, 128]
    - [22, 37.84]
  - - [256, 8192, 1, 256, 256, 256, 256, 256]
    - [57, 65.65]
  - - [256, 8192, 1, 512, 256, 256, 256, 512]
    - [57, 108.01]
  - - [256, 8192, 1, 1024, 256, 256, 256, 1024]
    - [57, 155.35]
  - - [256, 8192, 1, 2048, 256, 256, 256, 2048]
    - [57, 196.31]
  - - [256, 8192, 1, 4096, 256, 256, 256, 4096]
    - [57, 211.54]
  - - [256, 8192, 1, 8192, 256, 256, 256, 8192]
    - [57, 213.05]
  - - [512, 128, 1, 128, 512, 512, 512, 128]
    - [34, 2.26]
  - - [512, 128, 1, 256, 512, 512, 512, 256]
    - [86, 4.15]
  - - [512, 128, 1, 512, 512, 512, 512, 512]
    - [86, 7.15]
  - - [512, 128, 1, 1024, 512, 512, 512, 1024]
    - [86, 11.15]
  - - [512, 128, 1, 2048, 512, 512, 512, 2048]
    - [85, 15.5]
  - - [512, 128, 1, 4096, 512, 512, 512, 4096]
    - [85, 19.19]
  - - [512, 128, 1, 8192, 512, 512, 512, 8192]
    - [97, 18.52]
  - - [512, 256, 1, 128, 512, 512, 512, 128]
    - [85, 4.35]
  - - [512, 256, 1, 256, 512, 512, 512, 256]
    - [85, 7.99]
  - - [512, 256, 1, 512, 512, 512, 512, 512]
    - [86, 13.88]
  - - [512, 256, 1, 1024, 512, 512, 512, 1024]
    - [86, 20.94]
  - - [512, 256, 1, 2048, 512, 512, 512, 2048]
    - [85, 29.56]
  - - [512, 256, 1, 4096, 512, 512, 512, 4096]
    - [85, 37.16]
  - - [512, 256, 1, 8192, 512, 512, 512, 8192]
    - [95, 33.86]
  - - [512, 512, 1, 128, 512, 512, 512, 128]
    - [84, 7.63]
  - - [512, 512, 1, 256, 512, 512, 512, 256]
    - [82, 14.04]
  - - [512, 512, 1, 512, 512, 512, 512, 512]
    - [80, 23.94]
  - - [512, 512, 1, 1024, 512, 512, 512, 1024]
    - [81, 36.86]
  - - [512, 512, 1, 2048, 512, 512, 512, 2048]
    - [92, 51.05]
  - - [512, 512, 1, 4096, 512, 512, 512, 4096]
    - [92, 62.84]
  - - [512, 512, 1, 8192, 512, 512, 512, 8192]
    - [82, 61.98]
  - - [512, 1024, 1, 128, 512, 512, 512, 128]
    - [33, 14.38]
  - - [512, 1024, 1, 256, 512, 512, 512, 256]
    - [69, 26.23]
  - - [512, 1024, 1, 512, 512, 512, 512, 512]
    - [32, 42.93]
  - - [512, 1024, 1, 1024, 512, 512, 512, 1024]
    - [68, 63.5]
  - - [512, 1024, 1, 2048, 512, 512, 512, 2048]
    - [68, 84.07]
  - - [512, 1024, 1, 4096, 512, 512, 512, 4096]
    - [68, 100.22]
  - - [512, 1024, 1, 8192, 512, 512, 512, 8192]
    - [70, 102.85]
  - - [512, 2048, 1, 128, 512, 512, 512, 128]
    - [28, 25.34]
  - - [512, 2048, 1, 256, 512, 512, 512, 256]
    - [28, 44.85]
  - - [512, 2048, 1, 512, 512, 512, 512, 512]
    - [28, 72.32]
  - - [512, 2048, 1, 1024, 512, 512, 512, 1024]
    - [27, 103.03]
  - - [512, 2048, 1, 2048, 512, 512, 512, 2048]
    - [27, 133.39]
  - - [512, 2048, 1, 4096, 512, 512, 512, 4096]
    - [89, 141.96]
  - - [512, 2048, 1, 8192, 512, 512, 512, 8192]
    - [64, 146.61]
  - - [512, 4096, 1, 128, 512, 512, 512, 128]
    - [22, 39.2]
  - - [512, 4096, 1, 256, 512, 512, 512, 256]
    - [57, 67.39]
  - - [512, 4096, 1, 512, 512, 512, 512, 512]
    - [57, 108.06]
  - - [512, 4096, 1, 1024, 512, 512, 512, 1024]
    - [57, 156.61]
  - - [512, 4096, 1, 2048, 512, 512, 512, 2048]
    - [57, 198.0]
  - - [512, 4096, 1, 4096, 512, 512, 512, 4096]
    - [57, 202.73]
  - - [512, 4096, 1, 8192, 512, 512, 512, 8192]
    - [57, 197.54]
  - - [512, 8192, 1, 128, 512, 512, 512, 128]
    - [54, 58.27]
  - - [512, 8192, 1, 256, 512, 512, 512, 256]
    - [55, 102.38]
  - - [512, 8192, 1, 512, 512, 512, 512, 512]
    - [55, 163.47]
  - - [512, 8192, 1, 1024, 512, 512, 512, 1024]
    - [56, 206.07]
  - - [512, 8192, 1, 2048, 512, 512, 512, 2048]
    - [47, 233.31]
  - - [512, 8192, 1, 4096, 512, 512, 512, 4096]
    - [41, 252.75]
  - - [512, 8192, 1, 8192, 512, 512, 512, 8192]
    - [56, 249.71]
  - - [1024, 128, 1, 128, 1024, 1024, 1024, 128]
    - [34, 4.4]
  - - [1024, 128, 1, 256, 1024, 1024, 1024, 256]
    - [85, 8.01]
  - - [1024, 128, 1, 512, 1024, 1024, 1024, 512]
    - [86, 13.28]
  - - [1024, 128, 1, 1024, 1024, 1024, 1024, 1024]
    - [86, 20.63]
  - - [1024, 128, 1, 2048, 1024, 1024, 1024, 2048]
    - [85, 29.21]
  - - [1024, 128, 1, 4096, 1024, 1024, 1024, 4096]
    - [95, 29.44]
  - - [1024, 128, 1, 8192, 1024, 1024, 1024, 8192]
    - [96, 30.71]
  - - [1024, 256, 1, 128, 1024, 1024, 1024, 128]
    - [81, 8.41]
  - - [1024, 256, 1, 256, 1024, 1024, 1024, 256]
    - [79, 14.64]
  - - [1024, 256, 1, 512, 1024, 1024, 1024, 512]
    - [81, 23.9]
  - - [1024, 256, 1, 1024, 1024, 1024, 1024, 1024]
    - [92, 37.12]
  - - [1024, 256, 1, 2048, 1024, 1024, 1024, 2048]
    - [92, 50.39]
  - - [1024, 256, 1, 4096, 1024, 1024, 1024, 4096]
    - [77, 53.61]
  - - [1024, 256, 1, 8192, 1024, 1024, 1024, 8192]
    - [84, 59.38]
  - - [1024, 512, 1, 128, 1024, 1024, 1024, 128]
    - [33, 15.01]
  - - [1024, 512, 1, 256, 1024, 1024, 1024, 256]
    - [33, 26.36]
  - - [1024, 512, 1, 512, 1024, 1024, 1024, 512]
    - [69, 42.84]
  - - [1024, 512, 1, 1024, 1024, 1024, 1024, 1024]
    - [68, 63.32]
  - - [1024, 512, 1, 2048, 1024, 1024, 1024, 2048]
    - [68, 83.95]
  - - [1024, 512, 1, 4096, 1024, 1024, 1024, 4096]
    - [71, 94.46]
  - - [1024, 512, 1, 8192, 1024, 1024, 1024, 8192]
    - [75, 103.04]
  - - [1024, 1024, 1, 128, 1024, 1024, 1024, 128]
    - [28, 24.62]
  - - [1024, 1024, 1, 256, 1024, 1024, 1024, 256]
    - [28, 45.52]
  - - [1024, 1024, 1, 512, 1024, 1024, 1024, 512]
    - [28, 72.68]
  - - [1024, 1024, 1, 1024, 1024, 1024, 1024, 1024]
    - [27, 103.94]
  - - [1024, 1024, 1, 2048, 1024, 1024, 1024, 2048]
    - [27, 133.07]
  - - [1024, 1024, 1, 4096, 1024, 1024, 1024, 4096]
    - [67, 140.04]
  - - [1024, 1024, 1, 8192, 1024, 1024, 1024, 8192]
    - [66, 145.91]
  - - [1024, 2048, 1, 128, 1024, 1024, 1024, 128]
    - [22, 39.96]
  - - [1024, 2048, 1, 256, 1024, 1024, 1024, 256]
    - [57, 67.56]
  - - [1024, 2048, 1, 512, 1024, 1024, 1024, 512]
    - [57, 109.06]
  - - [1024, 2048, 1, 1024, 1024, 1024, 1024, 1024]
    - [57, 156.5]
  - - [1024, 2048, 1, 2048, 1024, 1024, 1024, 2048]
    - [57, 193.16]
  - - [1024, 2048, 1, 4096, 1024, 1024, 1024, 4096]
    - [61, 201.43]
  - - [1024, 2048, 1, 8192, 1024, 1024, 1024, 8192]
    - [60, 198.8]
  - - [1024, 4096, 1, 128, 1024, 1024, 1024, 128]
    - [20, 58.27]
  - - [1024, 4096, 1, 256, 1024, 1024, 1024, 256]
    - [20, 99.43]
  - - [1024, 4096, 1, 512, 1024, 1024, 1024, 512]
    - [19, 148.29]
  - - [1024, 4096, 1, 1024, 1024, 1024, 1024, 1024]
    - [16, 199.57]
  - - [1024, 4096, 1, 2048, 1024, 1024, 1024, 2048]
    - [16, 234.61]
  - - [1024, 4096, 1, 4096, 1024, 1024, 1024, 4096]
    - [41, 253.44]
  - - [1024, 4096, 1, 8192, 1024, 1024, 1024, 8192]
    - [41, 247.21]
  - - [1024, 8192, 1, 128, 1024, 1024, 1024, 128]
    - [45, 72.75]
  - - [1024, 8192, 1, 256, 1024, 1024, 1024, 256]
    - [45, 124.81]
  - - [1024, 8192, 1, 512, 1024, 1024, 1024, 512]
    - [41, 193.2]
  - - [1024, 8192, 1, 1024, 1024, 1024, 1024, 1024]
    - [9, 227.2]
  - - [1024, 8192, 1, 2048, 1024, 1024, 1024, 2048]
    - [40, 283.16]
  - - [1024, 8192, 1, 4096, 1024, 1024, 1024, 4096]
    - [43, 340.11]
  - - [1024, 8192, 1, 8192, 1024, 1024, 1024, 8192]
    - [41, 366.62]
  - - [2048, 128, 1, 128, 2048, 2048, 2048, 128]
    - [23, 5.62]
  - - [2048, 128, 1, 256, 2048, 2048, 2048, 256]
    - [24, 9.98]
  - - [2048, 128, 1, 512, 2048, 2048, 2048, 512]
    - [81, 23.91]
  - - [2048, 128, 1, 1024, 2048, 2048, 2048, 1024]
    - [83, 37.26]
  - - [2048, 128, 1, 2048, 2048, 2048, 2048, 2048]
    - [78, 43.58]
  - - [2048, 128, 1, 4096, 2048, 2048, 2048, 4096]
    - [93, 52.9]
  - - [2048, 128, 1, 8192, 2048, 2048, 2048, 8192]
    - [94, 59.42]
  - - [2048, 256, 1, 128, 2048, 2048, 2048, 128]
    - [33, 14.63]
  - - [2048, 256, 1, 256, 2048, 2048, 2048, 256]
    - [73, 25.0]
  - - [2048, 256, 1, 512, 2048, 2048, 2048, 512]
    - [74, 42.2]
  - - [2048, 256, 1, 1024, 2048, 2048, 2048, 1024]
    - [68, 62.38]
  - - [2048, 256, 1, 2048, 2048, 2048, 2048, 2048]
    - [75, 77.88]
  - - [2048, 256, 1, 4096, 2048, 2048, 2048, 4096]
    - [72, 93.34]
  - - [2048, 256, 1, 8192, 2048, 2048, 2048, 8192]
    - [75, 104.45]
  - - [2048, 512, 1, 128, 2048, 2048, 2048, 128]
    - [28, 25.18]
  - - [2048, 512, 1, 256, 2048, 2048, 2048, 256]
    - [28, 44.37]
  - - [2048, 512, 1, 512, 2048, 2048, 2048, 512]
    - [28, 71.04]
  - - [2048, 512, 1, 1024, 2048, 2048, 2048, 1024]
    - [27, 103.33]
  - - [2048, 512, 1, 2048, 2048, 2048, 2048, 2048]
    - [67, 118.31]
  - - [2048, 512, 1, 4096, 2048, 2048, 2048, 4096]
    - [67, 140.47]
  - - [2048, 512, 1, 8192, 2048, 2048, 2048, 8192]
    - [65, 147.42]
  - - [2048, 1024, 1, 128, 2048, 2048, 2048, 128]
    - [22, 39.59]
  - - [2048, 1024, 1, 256, 2048, 2048, 2048, 256]
    - [57, 67.73]
  - - [2048, 1024, 1, 512, 2048, 2048, 2048, 512]
    - [57, 108.43]
  - - [2048, 1024, 1, 1024, 2048, 2048, 2048, 1024]
    - [57, 156.07]
  - - [2048, 1024, 1, 2048, 2048, 2048, 2048, 2048]
    - [61, 178.91]
  - - [2048, 1024, 1, 4096, 2048, 2048, 2048, 4096]
    - [58, 199.99]
  - - [2048, 1024, 1, 8192, 2048, 2048, 2048, 8192]
    - [58, 195.25]
  - - [2048, 2048, 1, 128, 2048, 2048, 2048, 128]
    - [17, 55.32]
  - - [2048, 2048, 1, 256, 2048, 2048, 2048, 256]
    - [18, 95.52]
  - - [2048, 2048, 1, 512, 2048, 2048, 2048, 512]
    - [18, 147.52]
  - - [2048, 2048, 1, 1024, 2048, 2048, 2048, 1024]
    - [18, 199.23]
  - - [2048, 2048, 1, 2048, 2048, 2048, 2048, 2048]
    - [52, 234.83]
  - - [2048, 2048, 1, 4096, 2048, 2048, 2048, 4096]
    - [48, 248.67]
  - - [2048, 2048, 1, 8192, 2048, 2048, 2048, 8192]
    - [38, 237.19]
  - - [2048, 4096, 1, 128, 2048, 2048, 2048, 128]
    - [1, 66.53]
  - - [2048, 4096, 1, 256, 2048, 2048, 2048, 256]
    - [1, 111.88]
  - - [2048, 4096, 1, 512, 2048, 2048, 2048, 512]
    - [5, 169.82]
  - - [2048, 4096, 1, 1024, 2048, 2048, 2048, 1024]
    - [5, 226.05]
  - - [2048, 4096, 1, 2048, 2048, 2048, 2048, 2048]
    - [2, 264.45]
  - - [2048, 4096, 1, 4096, 2048, 2048, 2048, 4096]
    - [46, 272.5]
  - - [2048, 4096, 1, 8192, 2048, 2048, 2048, 8192]
    - [46, 312.53]
  - - [2048, 8192, 1, 128, 2048, 2048, 2048, 128]
    - [44, 74.01]
  - - [2048, 8192, 1, 256, 2048, 2048, 2048, 256]
    - [46, 124.88]
  - - [2048, 8192, 1, 512, 2048, 2048, 2048, 512]
    - [41, 186.28]
  - - [2048, 8192, 1, 1024, 2048, 2048, 2048, 1024]
    - [41, 247.23]
  - - [2048, 8192, 1, 2048, 2048, 2048, 2048, 2048]
    - [45, 310.19]
  - - [2048, 8192, 1, 4096, 2048, 2048, 2048, 4096]
    - [41, 340.86]
  - - [2048, 8192, 1, 8192, 2048, 2048, 2048, 8192]
    - [41, 382.25]
  - - [4096, 128, 1, 128, 4096, 4096, 4096, 128]
    - [33, 15.18]
  - - [4096, 128, 1, 256, 4096, 4096, 4096, 256]
    - [69, 26.41]
  - - [4096, 128, 1, 512, 4096, 4096, 4096, 512]
    - [69, 43.37]
  - - [4096, 128, 1, 1024, 4096, 4096, 4096, 1024]
    - [68, 63.48]
  - - [4096, 128, 1, 2048, 4096, 4096, 4096, 2048]
    - [71, 77.46]
  - - [4096, 128, 1, 4096, 4096, 4096, 4096, 4096]
    - [72, 93.56]
  - - [4096, 128, 1, 8192, 4096, 4096, 4096, 8192]
    - [75, 104.03]
  - - [4096, 256, 1, 128, 4096, 4096, 4096, 128]
    - [31, 25.45]
  - - [4096, 256, 1, 256, 4096, 4096, 4096, 256]
    - [28, 44.69]
  - - [4096, 256, 1, 512, 4096, 4096, 4096, 512]
    - [27, 71.23]
  - - [4096, 256, 1, 1024, 4096, 4096, 4096, 1024]
    - [30, 101.68]
  - - [4096, 256, 1, 2048, 4096, 4096, 4096, 2048]
    - [66, 119.32]
  - - [4096, 256, 1, 4096, 4096, 4096, 4096, 4096]
    - [65, 140.41]
  - - [4096, 256, 1, 8192, 4096, 4096, 4096, 8192]
    - [66, 145.51]
  - - [4096, 512, 1, 128, 4096, 4096, 4096, 128]
    - [22, 38.43]
  - - [4096, 512, 1, 256, 4096, 4096, 4096, 256]
    - [53, 64.94]
  - - [4096, 512, 1, 512, 4096, 4096, 4096, 512]
    - [61, 106.42]
  - - [4096, 512, 1, 1024, 4096, 4096, 4096, 1024]
    - [60, 148.71]
  - - [4096, 512, 1, 2048, 4096, 4096, 4096, 2048]
    - [58, 176.75]
  - - [4096, 512, 1, 4096, 4096, 4096, 4096, 4096]
    - [61, 202.75]
  - - [4096, 512, 1, 8192, 4096, 4096, 4096, 8192]
    - [60, 196.99]
  - - [4096, 1024, 1, 128, 4096, 4096, 4096, 128]
    - [17, 55.31]
  - - [4096, 1024, 1, 256, 4096, 4096, 4096, 256]
    - [18, 94.13]
  - - [4096, 1024, 1, 512, 4096, 4096, 4096, 512]
    - [21, 145.03]
  - - [4096, 1024, 1, 1024, 4096, 4096, 4096, 1024]
    - [21, 194.36]
  - - [4096, 1024, 1, 2048, 4096, 4096, 4096, 2048]
    - [52, 231.82]
  - - [4096, 1024, 1, 4096, 4096, 4096, 4096, 4096]
    - [51, 247.64]
  - - [4096, 1024, 1, 8192, 4096, 4096, 4096, 8192]
    - [37, 235.82]
  - - [4096, 2048, 1, 128, 4096, 4096, 4096, 128]
    - [9, 62.55]
  - - [4096, 2048, 1, 256, 4096, 4096, 4096, 256]
    - [9, 108.56]
  - - [4096, 2048, 1, 512, 4096, 4096, 4096, 512]
    - [8, 167.55]
  - - [4096, 2048, 1, 1024, 4096, 4096, 4096, 1024]
    - [8, 225.26]
  - - [4096, 2048, 1, 2048, 4096, 4096, 4096, 2048]
    - [6, 260.01]
  - - [4096, 2048, 1, 4096, 4096, 4096, 4096, 4096]
    - [36, 264.13]
  - - [4096, 2048, 1, 8192, 4096, 4096, 4096, 8192]
    - [36, 298.08]
  - - [4096, 4096, 1, 128, 4096, 4096, 4096, 128]
    - [2, 69.59]
  - - [4096, 4096, 1, 256, 4096, 4096, 4096, 256]
    - [9, 117.64]
  - - [4096, 4096, 1, 512, 4096, 4096, 4096, 512]
    - [8, 174.12]
  - - [4096, 4096, 1, 1024, 4096, 4096, 4096, 1024]
    - [6, 222.74]
  - - [4096, 4096, 1, 2048, 4096, 4096, 4096, 2048]
    - [46, 249.93]
  - - [4096, 4096, 1, 4096, 4096, 4096, 4096, 4096]
    - [45, 285.24]
  - - [4096, 4096, 1, 8192, 4096, 4096, 4096, 8192]
    - [1, 317.83]
  - - [4096, 8192, 1, 128, 4096, 4096, 4096, 128]
    - [42, 76.94]
  - - [4096, 8192, 1, 256, 4096, 4096, 4096, 256]
    - [42, 132.81]
  - - [4096, 8192, 1, 512, 4096, 4096, 4096, 512]
    - [41, 198.96]
  - - [4096, 8192, 1, 1024, 4096, 4096, 4096, 1024]
    - [41, 255.96]
  - - [4096, 8192, 1, 2048, 4096, 4096, 4096, 2048]
    - [46, 303.94]
  - - [4096, 8192, 1, 4096, 4096, 4096, 4096, 4096]
    - [45, 352.06]
  - - [4096, 8192, 1, 8192, 4096, 4096, 4096, 8192]
    - [46, 396.58]
  - - [8192, 128, 1, 128, 8192, 8192, 8192, 128]
    - [25, 25.48]
  - - [8192, 128, 1, 256, 8192, 8192, 8192, 256]
    - [31, 44.07]
  - - [8192, 128, 1, 512, 8192, 8192, 8192, 512]
    - [28, 69.09]
  - - [8192, 128, 1, 1024, 8192, 8192, 8192, 1024]
    - [27, 99.37]
  - - [8192, 128, 1, 2048, 8192, 8192, 8192, 2048]
    - [64, 117.08]
  - - [8192, 128, 1, 4096, 8192, 8192, 8192, 4096]
    - [66, 137.24]
  - - [8192, 128, 1, 8192, 8192, 8192, 8192, 8192]
    - [67, 142.46]
  - - [8192, 256, 1, 128, 8192, 8192, 8192, 128]
    - [59, 37.43]
  - - [8192, 256, 1, 256, 8192, 8192, 8192, 256]
    - [60, 63.63]
  - - [8192, 256, 1, 512, 8192, 8192, 8192, 512]
    - [58, 106.73]
  - - [8192, 256, 1, 1024, 8192, 8192, 8192, 1024]
    - [60, 148.46]
  - - [8192, 256, 1, 2048, 8192, 8192, 8192, 2048]
    - [61, 178.24]
  - - [8192, 256, 1, 4096, 8192, 8192, 8192, 4096]
    - [60, 202.41]
  - - [8192, 256, 1, 8192, 8192, 8192, 8192, 8192]
    - [61, 194.33]
  - - [8192, 512, 1, 128, 8192, 8192, 8192, 128]
    - [12, 53.3]
  - - [8192, 512, 1, 256, 8192, 8192, 8192, 256]
    - [13, 91.85]
  - - [8192, 512, 1, 512, 8192, 8192, 8192, 512]
    - [14, 140.57]
  - - [8192, 512, 1, 1024, 8192, 8192, 8192, 1024]
    - [15, 191.39]
  - - [8192, 512, 1, 2048, 8192, 8192, 8192, 2048]
    - [49, 231.02]
  - - [8192, 512, 1, 4096, 8192, 8192, 8192, 4096]
    - [39, 249.51]
  - - [8192, 512, 1, 8192, 8192, 8192, 8192, 8192]
    - [14, 236.09]
  - - [8192, 1024, 1, 128, 8192, 8192, 8192, 128]
    - [9, 62.41]
  - - [8192, 1024, 1, 256, 8192, 8192, 8192, 256]
    - [10, 106.65]
  - - [8192, 1024, 1, 512, 8192, 8192, 8192, 512]
    - [4, 167.98]
  - - [8192, 1024, 1, 1024, 8192, 8192, 8192, 1024]
    - [8, 222.72]
  - - [8192, 1024, 1, 2048, 8192, 8192, 8192, 2048]
    - [7, 260.36]
  - - [8192, 1024, 1, 4096, 8192, 8192, 8192, 4096]
    - [36, 259.86]
  - - [8192, 1024, 1, 8192, 8192, 8192, 8192, 8192]
    - [36, 298.0]
  - - [8192, 2048, 1, 128, 8192, 8192, 8192, 128]
    - [2, 67.17]
  - - [8192, 2048, 1, 256, 8192, 8192, 8192, 256]
    - [11, 112.36]
  - - [8192, 2048, 1, 512, 8192, 8192, 8192, 512]
    - [10, 171.81]
  - - [8192, 2048, 1, 1024, 8192, 8192, 8192, 1024]
    - [43, 220.55]
  - - [8192, 2048, 1, 2048, 8192, 8192, 8192, 2048]
    - [45, 244.88]
  - - [8192, 2048, 1, 4096, 8192, 8192, 8192, 4096]
    - [2, 283.3]
  - - [8192, 2048, 1, 8192, 8192, 8192, 8192, 8192]
    - [2, 336.77]
  - - [8192, 4096, 1, 128, 8192, 8192, 8192, 128]
    - [2, 73.01]
  - - [8192, 4096, 1, 256, 8192, 8192, 8192, 256]
    - [0, 118.03]
  - - [8192, 4096, 1, 512, 8192, 8192, 8192, 512]
    - [12, 175.01]
  - - [8192, 4096, 1, 1024, 8192, 8192, 8192, 1024]
    - [50, 222.3]
  - - [8192, 4096, 1, 2048, 8192, 8192, 8192, 2048]
    - [45, 277.61]
  - - [8192, 4096, 1, 4096, 8192, 8192, 8192, 4096]
    - [45, 316.66]
  - - [8192, 4096, 1, 8192, 8192, 8192, 8192, 8192]
    - [2, 346.09]
  - - [8192, 8192, 1, 128, 8192, 8192, 8192, 128]
    - [41, 74.98]
  - - [8192, 8192, 1, 256, 8192, 8192, 8192, 256]
    - [17, 119.6]
  - - [8192, 8192, 1, 512, 8192, 8192, 8192, 512]
    - [3, 177.44]
  - - [8192, 8192, 1, 1024, 8192, 8192, 8192, 1024]
    - [45, 251.97]
  - - [8192, 8192, 1, 2048, 8192, 8192, 8192, 2048]
    - [45, 313.58]
  - - [8192, 8192, 1, 4096, 8192, 8192, 8192, 4096]
    - [45, 367.46]
  - - [8192, 8192, 1, 8192, 8192, 8192, 8192, 8192]
    - [46, 397.72]
- null
- null
- ExperimentalStreamK
- GridBased
