projects/hipblaslt/library/src/amd_detail/rocblaslt/src/Tensile/Logic/asm_full/aquavanjaram/gfx942_228cu/StreamK/aquavanjaram942_Cijk_Ailk_Bjlk_F8B8NHS_BH_Bias_HAS_SAV_UserArgs.yaml
- {MinimumRequiredVersion: 4.33.0}
- aquavanjaram942
- {Architecture: gfx942, CUCount: 228}
- [Device 0049, Device 0050]
    SolutionIndex: 0
    SolutionNameMin: Cijk_Ailk_Bjlk_F8B8NHS_BH_Bias_HAS_SAV_UserArgs_MT256x256x64_MI16x16x1_SN_LDSB0_CLR1_GRVWA4_GRVWB4_GSU0_GSUC0_GSUWGMRR0_K1_LBSPPA2048_LBSPPB2048_LPA0_LPB0_MIWT8_8_PLR1_SU0_SUM0_SUS64_VWA8_VWB8_WGM1_WGMXCC1_WGMXCCGn1
    SolutionIndex: 1
    SolutionNameMin: Cijk_Ailk_Bjlk_F8B8NHS_BH_Bias_HAS_SAV_UserArgs_MT256x256x64_MI16x16x1_SN_LDSB0_CLR1_GRVWA16_GRVWB4_GSU0_GSUC0_GSUWGMRR0_K1_LBSPPA2048_LBSPPB2048_LPA0_LPB0_MIWT8_8_PLR1_SU0_SUM0_SUS64_VWA8_VWB8_WGM1_WGMXCC1_WGMXCCGn1
    SolutionIndex: 2
    SolutionNameMin: Cijk_Ailk_Bjlk_F8B8NHS_BH_Bias_HAS_SAV_UserArgs_MT256x256x64_MI16x16x1_SN_LDSB0_CLR1_GRVWA4_GRVWB8_GSU0_GSUC0_GSUWGMRR0_K1_LBSPPA2048_LBSPPB2048_LPA0_LPB0_MIWT8_8_PLR1_SU0_SUM0_SUS64_VWA8_VWB8_WGM1_WGMXCC1_WGMXCCGn1
    SolutionIndex: 3
    SolutionNameMin: Cijk_Ailk_Bjlk_F8B8NHS_BH_Bias_HAS_SAV_UserArgs_MT256x256x64_MI16x16x1_SN_LDSB0_CLR1_GRVWA8_GRVWB8_GSU0_GSUC0_GSUWGMRR0_K1_LBSPPA2048_LBSPPB2048_LPA0_LPB0_MIWT8_8_PLR1_SU0_SUM0_SUS64_VWA8_VWB8_WGM1_WGMXCC1_WGMXCCGn1
    SolutionIndex: 4
    SolutionNameMin: Cijk_Ailk_Bjlk_F8B8NHS_BH_Bias_HAS_SAV_UserArgs_MT256x256x64_MI16x16x1_SN_LDSB0_CLR1_GRVWA4_GRVWB16_GSU0_GSUC0_GSUWGMRR0_K1_LBSPPA2048_LBSPPB2048_LPA0_LPB0_MIWT8_8_PLR1_SU0_SUM0_SUS64_VWA8_VWB8_WGM1_WGMXCC1_WGMXCCGn1
    SolutionIndex: 5
    SolutionNameMin: Cijk_Ailk_Bjlk_F8B8NHS_BH_Bias_HAS_SAV_UserArgs_MT256x256x64_MI16x16x1_SN_LDSB0_CLR1_GRVWA16_GRVWB16_GSU0_GSUC0_GSUWGMRR0_K1_LBSPPA2048_LBSPPB2048_LPA0_LPB0_MIWT8_8_PLR1_SU0_SUM0_SUS64_VWA8_VWB8_WGM1_WGMXCC1_WGMXCCGn1
    SolutionIndex: 6
    SolutionNameMin: Cijk_Ailk_Bjlk_F8B8NHS_BH_Bias_HAS_SAV_UserArgs_MT256x256x64_MI16x16x1_SN_LDSB0_CLR1_GRVWA4_GRVWB4_GSU0_GSUC0_GSUWGMRR0_K1_LBSPPA2048_LBSPPB2048_LPA0_LPB0_MIWT8_8_PLR1_SU0_SUM0_SUS64_VWA8_VWB8_WGM4_WGMXCC1_WGMXCCGn1
    SolutionIndex: 7
    SolutionNameMin: Cijk_Ailk_Bjlk_F8B8NHS_BH_Bias_HAS_SAV_UserArgs_MT256x256x64_MI16x16x1_SN_LDSB0_CLR1_GRVWA16_GRVWB16_GSU0_GSUC0_GSUWGMRR0_K1_LBSPPA2048_LBSPPB2048_LPA0_LPB0_MIWT8_8_PLR1_SU0_SUM0_SUS64_VWA8_VWB8_WGM4_WGMXCC1_WGMXCCGn1
    SolutionIndex: 8
    SolutionNameMin: Cijk_Ailk_Bjlk_F8B8NHS_BH_Bias_HAS_SAV_UserArgs_MT256x256x64_MI16x16x1_SN_LDSB0_CLR1_GRVWA16_GRVWB4_GSU0_GSUC0_GSUWGMRR0_K1_LBSPPA2048_LBSPPB2048_LPA0_LPB0_MIWT8_8_PLR1_SU0_SUM0_SUS64_VWA8_VWB8_WGM6_WGMXCC1_WGMXCCGn1
    SolutionIndex: 9
    SolutionNameMin: Cijk_Ailk_Bjlk_F8B8NHS_BH_Bias_HAS_SAV_UserArgs_MT256x256x64_MI16x16x1_SN_LDSB0_CLR1_GRVWA8_GRVWB8_GSU0_GSUC0_GSUWGMRR0_K1_LBSPPA2048_LBSPPB2048_LPA0_LPB0_MIWT8_8_PLR1_SU0_SUM0_SUS64_VWA8_VWB8_WGM6_WGMXCC1_WGMXCCGn1
    SolutionIndex: 10
    SolutionNameMin: Cijk_Ailk_Bjlk_F8B8NHS_BH_Bias_HAS_SAV_UserArgs_MT256x256x64_MI16x16x1_SN_LDSB0_CLR1_GRVWA4_GRVWB16_GSU0_GSUC0_GSUWGMRR0_K1_LBSPPA2048_LBSPPB2048_LPA0_LPB0_MIWT8_8_PLR1_SU0_SUM0_SUS64_VWA8_VWB8_WGM6_WGMXCC1_WGMXCCGn1
    SolutionIndex: 11
    SolutionNameMin: Cijk_Ailk_Bjlk_F8B8NHS_BH_Bias_HAS_SAV_UserArgs_MT256x256x64_MI16x16x1_SN_LDSB0_CLR1_GRVWA16_GRVWB16_GSU0_GSUC0_GSUWGMRR0_K1_LBSPPA2048_LBSPPB2048_LPA0_LPB0_MIWT8_8_PLR1_SU0_SUM0_SUS64_VWA8_VWB8_WGM6_WGMXCC1_WGMXCCGn1
    SolutionIndex: 12
    SolutionNameMin: Cijk_Ailk_Bjlk_F8B8NHS_BH_Bias_HAS_SAV_UserArgs_MT256x256x64_MI16x16x1_SN_LDSB0_CLR1_GRVWA4_GRVWB4_GSU0_GSUC0_GSUWGMRR0_K1_LBSPPA2048_LBSPPB2048_LPA0_LPB0_MIWT8_8_PLR1_SU0_SUM0_SUS64_VWA8_VWB8_WGM8_WGMXCC1_WGMXCCGn1
    SolutionIndex: 13
    SolutionNameMin: Cijk_Ailk_Bjlk_F8B8NHS_BH_Bias_HAS_SAV_UserArgs_MT256x256x64_MI16x16x1_SN_LDSB0_CLR1_GRVWA4_GRVWB8_GSU0_GSUC0_GSUWGMRR0_K1_LBSPPA2048_LBSPPB2048_LPA0_LPB0_MIWT8_8_PLR1_SU0_SUM0_SUS64_VWA8_VWB8_WGM8_WGMXCC1_WGMXCCGn1
    SolutionIndex: 14
    SolutionNameMin: Cijk_Ailk_Bjlk_F8B8NHS_BH_Bias_HAS_SAV_UserArgs_MT256x256x64_MI16x16x1_SN_LDSB0_CLR1_GRVWA16_GRVWB8_GSU0_GSUC0_GSUWGMRR0_K1_LBSPPA2048_LBSPPB2048_LPA0_LPB0_MIWT8_8_PLR1_SU0_SUM0_SUS64_VWA8_VWB8_WGM8_WGMXCC1_WGMXCCGn1
    SolutionIndex: 15
    SolutionNameMin: Cijk_Ailk_Bjlk_F8B8NHS_BH_Bias_HAS_SAV_UserArgs_MT256x256x64_MI16x16x1_SN_LDSB0_CLR1_GRVWA4_GRVWB16_GSU0_GSUC0_GSUWGMRR0_K1_LBSPPA2048_LBSPPB2048_LPA0_LPB0_MIWT8_8_PLR1_SU0_SUM0_SUS64_VWA8_VWB8_WGM8_WGMXCC1_WGMXCCGn1
    SolutionIndex: 16
    SolutionNameMin: Cijk_Ailk_Bjlk_F8B8NHS_BH_Bias_HAS_SAV_UserArgs_MT256x256x64_MI16x16x1_SN_LDSB0_CLR1_GRVWA16_GRVWB16_GSU0_GSUC0_GSUWGMRR0_K1_LBSPPA2048_LBSPPB2048_LPA0_LPB0_MIWT8_8_PLR1_SU0_SUM0_SUS64_VWA8_VWB8_WGM8_WGMXCC1_WGMXCCGn1
    SolutionIndex: 17
    SolutionNameMin: Cijk_Ailk_Bjlk_F8B8NHS_BH_Bias_HAS_SAV_UserArgs_MT128x256x64_MI16x16x1_SN_LDSB1_CLR1_GRVWA8_GRVWB16_GSU0_GSUC0_GSUWGMRR0_K1_LBSPPA1024_LBSPPB2048_LPA64_LPB0_MIWT4_8_PLR1_SU0_SUM0_SUS64_VWA4_VWB8_WGM1_WGMXCC1_WGMXCCGn1
    SolutionIndex: 18
    SolutionNameMin: Cijk_Ailk_Bjlk_F8B8NHS_BH_Bias_HAS_SAV_UserArgs_MT128x256x64_MI16x16x1_SN_LDSB1_CLR1_GRVWA16_GRVWB16_GSU0_GSUC0_GSUWGMRR0_K1_LBSPPA1024_LBSPPB2048_LPA64_LPB0_MIWT4_8_PLR1_SU0_SUM0_SUS64_VWA4_VWB8_WGM1_WGMXCC1_WGMXCCGn1
    SolutionIndex: 19
    SolutionNameMin: Cijk_Ailk_Bjlk_F8B8NHS_BH_Bias_HAS_SAV_UserArgs_MT128x256x64_MI16x16x1_SN_LDSB1_CLR1_GRVWA8_GRVWB16_GSU0_GSUC0_GSUWGMRR0_K1_LBSPPA1024_LBSPPB2048_LPA64_LPB0_MIWT4_8_PLR1_SU0_SUM0_SUS64_VWA4_VWB8_WGM4_WGMXCC1_WGMXCCGn1
    SolutionIndex: 20
    SolutionNameMin: Cijk_Ailk_Bjlk_F8B8NHS_BH_Bias_HAS_SAV_UserArgs_MT128x256x64_MI16x16x1_SN_LDSB1_CLR1_GRVWA16_GRVWB16_GSU0_GSUC0_GSUWGMRR0_K1_LBSPPA1024_LBSPPB2048_LPA64_LPB0_MIWT4_8_PLR1_SU0_SUM0_SUS64_VWA4_VWB8_WGM4_WGMXCC1_WGMXCCGn1
    SolutionIndex: 21
    SolutionNameMin: Cijk_Ailk_Bjlk_F8B8NHS_BH_Bias_HAS_SAV_UserArgs_MT128x256x64_MI16x16x1_SN_LDSB1_CLR1_GRVWA4_GRVWB16_GSU0_GSUC0_GSUWGMRR0_K1_LBSPPA1024_LBSPPB2048_LPA64_LPB0_MIWT4_8_PLR1_SU0_SUM0_SUS64_VWA4_VWB8_WGM6_WGMXCC1_WGMXCCGn1
    SolutionIndex: 22
    SolutionNameMin: Cijk_Ailk_Bjlk_F8B8NHS_BH_Bias_HAS_SAV_UserArgs_MT128x256x64_MI16x16x1_SN_LDSB1_CLR1_GRVWA8_GRVWB16_GSU0_GSUC0_GSUWGMRR0_K1_LBSPPA1024_LBSPPB2048_LPA64_LPB0_MIWT4_8_PLR1_SU0_SUM0_SUS64_VWA4_VWB8_WGM6_WGMXCC1_WGMXCCGn1
    SolutionIndex: 23
    SolutionNameMin: Cijk_Ailk_Bjlk_F8B8NHS_BH_Bias_HAS_SAV_UserArgs_MT128x256x64_MI16x16x1_SN_LDSB1_CLR1_GRVWA4_GRVWB16_GSU0_GSUC0_GSUWGMRR0_K1_LBSPPA1024_LBSPPB2048_LPA64_LPB0_MIWT4_8_PLR1_SU0_SUM0_SUS64_VWA4_VWB8_WGM8_WGMXCC1_WGMXCCGn1
    SolutionIndex: 24
    SolutionNameMin: Cijk_Ailk_Bjlk_F8B8NHS_BH_Bias_HAS_SAV_UserArgs_MT256x144x64_MI16x16x1_SN_LDSB0_CLR1_GRVWA8_GRVWB4_GSU0_GSUC0_GSUWGMRR0_K1_LBSPPA2048_LBSPPB1152_LPA64_LPB16_MIWT4_9_PLR1_SU0_SUM0_SUS64_VWA4_VWB1_WGM1_WGMXCC1_WGMXCCGn1
    SolutionIndex: 25
    SolutionNameMin: Cijk_Ailk_Bjlk_F8B8NHS_BH_Bias_HAS_SAV_UserArgs_MT256x144x64_MI16x16x1_SN_LDSB0_CLR1_GRVWA16_GRVWB4_GSU0_GSUC0_GSUWGMRR0_K1_LBSPPA2048_LBSPPB1152_LPA64_LPB16_MIWT4_9_PLR1_SU0_SUM0_SUS64_VWA4_VWB1_WGM1_WGMXCC1_WGMXCCGn1
    SolutionIndex: 26
    SolutionNameMin: Cijk_Ailk_Bjlk_F8B8NHS_BH_Bias_HAS_SAV_UserArgs_MT256x144x64_MI16x16x1_SN_LDSB0_CLR1_GRVWA16_GRVWB4_GSU0_GSUC0_GSUWGMRR0_K1_LBSPPA2048_LBSPPB1152_LPA64_LPB16_MIWT4_9_PLR1_SU0_SUM0_SUS64_VWA4_VWB1_WGM4_WGMXCC1_WGMXCCGn1
    SolutionIndex: 27
    SolutionNameMin: Cijk_Ailk_Bjlk_F8B8NHS_BH_Bias_HAS_SAV_UserArgs_MT256x144x64_MI16x16x1_SN_LDSB0_CLR1_GRVWA16_GRVWB4_GSU0_GSUC0_GSUWGMRR0_K1_LBSPPA2048_LBSPPB1152_LPA64_LPB16_MIWT4_9_PLR1_SU0_SUM0_SUS64_VWA4_VWB1_WGM6_WGMXCC1_WGMXCCGn1
    SolutionIndex: 28
    SolutionNameMin: Cijk_Ailk_Bjlk_F8B8NHS_BH_Bias_HAS_SAV_UserArgs_MT256x128x64_MI16x16x1_SN_LDSB1_CLR1_GRVWA4_GRVWB4_GSU0_GSUC0_GSUWGMRR0_K1_LBSPPA2048_LBSPPB1024_LPA0_LPB64_MIWT8_4_PLR1_SU0_SUM0_SUS64_VWA8_VWB4_WGM1_WGMXCC1_WGMXCCGn1
    SolutionIndex: 29
    SolutionNameMin: Cijk_Ailk_Bjlk_F8B8NHS_BH_Bias_HAS_SAV_UserArgs_MT256x128x64_MI16x16x1_SN_LDSB1_CLR1_GRVWA16_GRVWB4_GSU0_GSUC0_GSUWGMRR0_K1_LBSPPA2048_LBSPPB1024_LPA0_LPB64_MIWT8_4_PLR1_SU0_SUM0_SUS64_VWA8_VWB4_WGM1_WGMXCC1_WGMXCCGn1
    SolutionIndex: 30
    SolutionNameMin: Cijk_Ailk_Bjlk_F8B8NHS_BH_Bias_HAS_SAV_UserArgs_MT256x128x64_MI16x16x1_SN_LDSB1_CLR1_GRVWA4_GRVWB8_GSU0_GSUC0_GSUWGMRR0_K1_LBSPPA2048_LBSPPB1024_LPA0_LPB64_MIWT8_4_PLR1_SU0_SUM0_SUS64_VWA8_VWB4_WGM1_WGMXCC1_WGMXCCGn1
    SolutionIndex: 31
    SolutionNameMin: Cijk_Ailk_Bjlk_F8B8NHS_BH_Bias_HAS_SAV_UserArgs_MT256x128x64_MI16x16x1_SN_LDSB1_CLR1_GRVWA16_GRVWB16_GSU0_GSUC0_GSUWGMRR0_K1_LBSPPA2048_LBSPPB1024_LPA0_LPB64_MIWT8_4_PLR1_SU0_SUM0_SUS64_VWA8_VWB4_WGM1_WGMXCC1_WGMXCCGn1
    SolutionIndex: 32
    SolutionNameMin: Cijk_Ailk_Bjlk_F8B8NHS_BH_Bias_HAS_SAV_UserArgs_MT256x128x64_MI16x16x1_SN_LDSB1_CLR1_GRVWA16_GRVWB16_GSU0_GSUC0_GSUWGMRR0_K1_LBSPPA2048_LBSPPB1024_LPA0_LPB64_MIWT8_4_PLR1_SU0_SUM0_SUS64_VWA8_VWB4_WGM4_WGMXCC1_WGMXCCGn1
    SolutionIndex: 33
    SolutionNameMin: Cijk_Ailk_Bjlk_F8B8NHS_BH_Bias_HAS_SAV_UserArgs_MT256x128x64_MI16x16x1_SN_LDSB1_CLR1_GRVWA4_GRVWB16_GSU0_GSUC0_GSUWGMRR0_K1_LBSPPA2048_LBSPPB1024_LPA0_LPB64_MIWT8_4_PLR1_SU0_SUM0_SUS64_VWA8_VWB4_WGM6_WGMXCC1_WGMXCCGn1
    SolutionIndex: 34
    SolutionNameMin: Cijk_Ailk_Bjlk_F8B8NHS_BH_Bias_HAS_SAV_UserArgs_MT256x128x64_MI16x16x1_SN_LDSB1_CLR1_GRVWA16_GRVWB16_GSU0_GSUC0_GSUWGMRR0_K1_LBSPPA2048_LBSPPB1024_LPA0_LPB64_MIWT8_4_PLR1_SU0_SUM0_SUS64_VWA8_VWB4_WGM6_WGMXCC1_WGMXCCGn1
    SolutionIndex: 35
    SolutionNameMin: Cijk_Ailk_Bjlk_F8B8NHS_BH_Bias_HAS_SAV_UserArgs_MT256x128x64_MI16x16x1_SN_LDSB1_CLR1_GRVWA4_GRVWB8_GSU0_GSUC0_GSUWGMRR0_K1_LBSPPA2048_LBSPPB1024_LPA0_LPB64_MIWT8_4_PLR1_SU0_SUM0_SUS64_VWA8_VWB4_WGM8_WGMXCC1_WGMXCCGn1
    SolutionIndex: 36
    SolutionNameMin: Cijk_Ailk_Bjlk_F8B8NHS_BH_Bias_HAS_SAV_UserArgs_MT256x128x64_MI16x16x1_SN_LDSB1_CLR1_GRVWA8_GRVWB16_GSU0_GSUC0_GSUWGMRR0_K1_LBSPPA2048_LBSPPB1024_LPA0_LPB64_MIWT8_4_PLR1_SU0_SUM0_SUS64_VWA8_VWB4_WGM8_WGMXCC1_WGMXCCGn1
    SolutionIndex: 37
    SolutionNameMin: Cijk_Ailk_Bjlk_F8B8NHS_BH_Bias_HAS_SAV_UserArgs_MT256x128x64_MI16x16x1_SN_LDSB1_CLR1_GRVWA16_GRVWB16_GSU0_GSUC0_GSUWGMRR0_K1_LBSPPA2048_LBSPPB1024_LPA0_LPB64_MIWT8_4_PLR1_SU0_SUM0_SUS64_VWA8_VWB4_WGM8_WGMXCC1_WGMXCCGn1
    SolutionIndex: 38
    SolutionNameMin: Cijk_Ailk_Bjlk_F8B8NHS_BH_Bias_HAS_SAV_UserArgs_MT256x64x64_MI16x16x1_SN_LDSB1_CLR1_GRVWA4_GRVWB4_GSU0_GSUC0_GSUWGMRR0_K1_LBSPPA2048_LBSPPB512_LPA0_LPB32_MIWT8_2_PLR1_SU0_SUM0_SUS64_VWA8_VWB2_WGM1_WGMXCC1_WGMXCCGn1
    SolutionIndex: 39
    SolutionNameMin: Cijk_Ailk_Bjlk_F8B8NHS_BH_Bias_HAS_SAV_UserArgs_MT128x128x64_MI16x16x1_SN_LDSB1_CLR1_GRVWA4_GRVWB4_GSU0_GSUC0_GSUWGMRR0_K1_LBSPPA1024_LBSPPB1024_LPA0_LPB32_MIWT8_2_PLR1_SU0_SUM0_SUS64_VWA8_VWB2_WGM1_WGMXCC1_WGMXCCGn1
    SolutionIndex: 40
    SolutionNameMin: Cijk_Ailk_Bjlk_F8B8NHS_BH_Bias_HAS_SAV_UserArgs_MT128x128x64_MI16x16x1_SN_LDSB1_CLR1_GRVWA4_GRVWB8_GSU0_GSUC0_GSUWGMRR0_K1_LBSPPA1024_LBSPPB1024_LPA0_LPB32_MIWT8_2_PLR1_SU0_SUM0_SUS64_VWA8_VWB2_WGM1_WGMXCC1_WGMXCCGn1
    SolutionIndex: 41
    SolutionNameMin: Cijk_Ailk_Bjlk_F8B8NHS_BH_Bias_HAS_SAV_UserArgs_MT128x128x64_MI16x16x1_SN_LDSB1_CLR1_GRVWA4_GRVWB16_GSU0_GSUC0_GSUWGMRR0_K1_LBSPPA1024_LBSPPB1024_LPA0_LPB32_MIWT8_2_PLR1_SU0_SUM0_SUS64_VWA8_VWB2_WGM1_WGMXCC1_WGMXCCGn1
    SolutionIndex: 42
    SolutionNameMin: Cijk_Ailk_Bjlk_F8B8NHS_BH_Bias_HAS_SAV_UserArgs_MT128x128x64_MI16x16x1_SN_LDSB1_CLR1_GRVWA4_GRVWB8_GSU0_GSUC0_GSUWGMRR0_K1_LBSPPA1024_LBSPPB1024_LPA0_LPB32_MIWT8_2_PLR1_SU0_SUM0_SUS64_VWA8_VWB2_WGM4_WGMXCC1_WGMXCCGn1
    SolutionIndex: 43
    SolutionNameMin: Cijk_Ailk_Bjlk_F8B8NHS_BH_Bias_HAS_SAV_UserArgs_MT128x64x64_MI16x16x1_SN_LDSB0_CLR1_GRVWA4_GRVWB4_GSU0_GSUC0_GSUWGMRR0_K1_LBSPPA1024_LBSPPB512_LPA0_LPB16_MIWT8_1_PLR1_SU0_SUM0_SUS64_VWA8_VWB1_WGM1_WGMXCC1_WGMXCCGn1
    SolutionIndex: 44
    SolutionNameMin: Cijk_Ailk_Bjlk_F8B8NHS_BH_Bias_HAS_SAV_UserArgs_MT128x64x64_MI16x16x1_SN_LDSB0_CLR1_GRVWA16_GRVWB8_GSU0_GSUC0_GSUWGMRR0_K1_LBSPPA1024_LBSPPB512_LPA0_LPB16_MIWT8_1_PLR1_SU0_SUM0_SUS64_VWA8_VWB1_WGM6_WGMXCC1_WGMXCCGn1
    SolutionIndex: 45
    SolutionNameMin: Cijk_Ailk_Bjlk_F8B8NHS_BH_Bias_HAS_SAV_UserArgs_MT128x128x64_MI16x16x1_SN_LDSB1_CLR1_GRVWA8_GRVWB16_GSU0_GSUC0_GSUWGMRR0_K1_LBSPPA1024_LBSPPB1024_LPA64_LPB64_MIWT4_4_PLR1_SU0_SUM0_SUS64_VWA4_VWB4_WGM1_WGMXCC1_WGMXCCGn1
    SolutionIndex: 46
    SolutionNameMin: Cijk_Ailk_Bjlk_F8B8NHS_BH_Bias_HAS_SAV_UserArgs_MT128x128x64_MI16x16x1_SN_LDSB1_CLR1_GRVWA16_GRVWB16_GSU0_GSUC0_GSUWGMRR0_K1_LBSPPA1024_LBSPPB1024_LPA64_LPB64_MIWT4_4_PLR1_SU0_SUM0_SUS64_VWA4_VWB4_WGM1_WGMXCC1_WGMXCCGn1
    SolutionIndex: 47
    SolutionNameMin: Cijk_Ailk_Bjlk_F8B8NHS_BH_Bias_HAS_SAV_UserArgs_MT128x128x64_MI16x16x1_SN_LDSB1_CLR1_GRVWA8_GRVWB16_GSU0_GSUC0_GSUWGMRR0_K1_LBSPPA1024_LBSPPB1024_LPA64_LPB64_MIWT4_4_PLR1_SU0_SUM0_SUS64_VWA4_VWB4_WGM4_WGMXCC1_WGMXCCGn1
    SolutionIndex: 48
    SolutionNameMin: Cijk_Ailk_Bjlk_F8B8NHS_BH_Bias_HAS_SAV_UserArgs_MT128x128x64_MI16x16x1_SN_LDSB1_CLR1_GRVWA16_GRVWB8_GSU0_GSUC0_GSUWGMRR0_K1_LBSPPA1024_LBSPPB1024_LPA64_LPB64_MIWT4_4_PLR1_SU0_SUM0_SUS64_VWA4_VWB4_WGM6_WGMXCC1_WGMXCCGn1
    SolutionIndex: 49
    SolutionNameMin: Cijk_Ailk_Bjlk_F8B8NHS_BH_Bias_HAS_SAV_UserArgs_MT128x128x64_MI16x16x1_SN_LDSB1_CLR1_GRVWA8_GRVWB16_GSU0_GSUC0_GSUWGMRR0_K1_LBSPPA1024_LBSPPB1024_LPA64_LPB64_MIWT4_4_PLR1_SU0_SUM0_SUS64_VWA4_VWB4_WGM6_WGMXCC1_WGMXCCGn1
    SolutionIndex: 50
    SolutionNameMin: Cijk_Ailk_Bjlk_F8B8NHS_BH_Bias_HAS_SAV_UserArgs_MT128x128x64_MI16x16x1_SN_LDSB1_CLR1_GRVWA16_GRVWB16_GSU0_GSUC0_GSUWGMRR0_K1_LBSPPA1024_LBSPPB1024_LPA64_LPB64_MIWT4_4_PLR1_SU0_SUM0_SUS64_VWA4_VWB4_WGM6_WGMXCC1_WGMXCCGn1
    SolutionIndex: 51
    SolutionNameMin: Cijk_Ailk_Bjlk_F8B8NHS_BH_Bias_HAS_SAV_UserArgs_MT128x128x64_MI16x16x1_SN_LDSB1_CLR1_GRVWA16_GRVWB8_GSU0_GSUC0_GSUWGMRR0_K1_LBSPPA1024_LBSPPB1024_LPA64_LPB64_MIWT4_4_PLR1_SU0_SUM0_SUS64_VWA4_VWB4_WGM8_WGMXCC1_WGMXCCGn1
    SolutionIndex: 52
    SolutionNameMin: Cijk_Ailk_Bjlk_F8B8NHS_BH_Bias_HAS_SAV_UserArgs_MT128x128x64_MI16x16x1_SN_LDSB1_CLR1_GRVWA16_GRVWB16_GSU0_GSUC0_GSUWGMRR0_K1_LBSPPA1024_LBSPPB1024_LPA64_LPB64_MIWT4_4_PLR1_SU0_SUM0_SUS64_VWA4_VWB4_WGM8_WGMXCC1_WGMXCCGn1
    SolutionIndex: 53
    SolutionNameMin: Cijk_Ailk_Bjlk_F8B8NHS_BH_Bias_HAS_SAV_UserArgs_MT64x128x64_MI16x16x1_SN_LDSB0_CLR1_GRVWA4_GRVWB4_GSU0_GSUC0_GSUWGMRR0_K1_LBSPPA512_LBSPPB1024_LPA32_LPB64_MIWT2_4_PLR1_SU0_SUM0_SUS64_VWA2_VWB4_WGM1_WGMXCC1_WGMXCCGn1
    SolutionIndex: 54
    SolutionNameMin: Cijk_Ailk_Bjlk_F8B8NHS_BH_Bias_HAS_SAV_UserArgs_MT64x128x64_MI16x16x1_SN_LDSB0_CLR1_GRVWA4_GRVWB8_GSU0_GSUC0_GSUWGMRR0_K1_LBSPPA512_LBSPPB1024_LPA32_LPB64_MIWT2_4_PLR1_SU0_SUM0_SUS64_VWA2_VWB4_WGM1_WGMXCC1_WGMXCCGn1
    SolutionIndex: 55
    SolutionNameMin: Cijk_Ailk_Bjlk_F8B8NHS_BH_Bias_HAS_SAV_UserArgs_MT64x128x64_MI16x16x1_SN_LDSB0_CLR1_GRVWA8_GRVWB8_GSU0_GSUC0_GSUWGMRR0_K1_LBSPPA512_LBSPPB1024_LPA32_LPB64_MIWT2_4_PLR1_SU0_SUM0_SUS64_VWA2_VWB4_WGM1_WGMXCC1_WGMXCCGn1
    SolutionIndex: 56
    SolutionNameMin: Cijk_Ailk_Bjlk_F8B8NHS_BH_Bias_HAS_SAV_UserArgs_MT64x128x64_MI16x16x1_SN_LDSB0_CLR1_GRVWA4_GRVWB16_GSU0_GSUC0_GSUWGMRR0_K1_LBSPPA512_LBSPPB1024_LPA32_LPB64_MIWT2_4_PLR1_SU0_SUM0_SUS64_VWA2_VWB4_WGM1_WGMXCC1_WGMXCCGn1
    SolutionIndex: 57
    SolutionNameMin: Cijk_Ailk_Bjlk_F8B8NHS_BH_Bias_HAS_SAV_UserArgs_MT64x128x64_MI16x16x1_SN_LDSB0_CLR1_GRVWA16_GRVWB16_GSU0_GSUC0_GSUWGMRR0_K1_LBSPPA512_LBSPPB1024_LPA32_LPB64_MIWT2_4_PLR1_SU0_SUM0_SUS64_VWA2_VWB4_WGM1_WGMXCC1_WGMXCCGn1
    SolutionIndex: 58
    SolutionNameMin: Cijk_Ailk_Bjlk_F8B8NHS_BH_Bias_HAS_SAV_UserArgs_MT128x64x64_MI16x16x1_SN_LDSB0_CLR1_GRVWA4_GRVWB4_GSU0_GSUC0_GSUWGMRR0_K1_LBSPPA1024_LBSPPB512_LPA64_LPB32_MIWT4_2_PLR1_SU0_SUM0_SUS64_VWA4_VWB2_WGM1_WGMXCC1_WGMXCCGn1
    SolutionIndex: 59
    SolutionNameMin: Cijk_Ailk_Bjlk_F8B8NHS_BH_Bias_HAS_SAV_UserArgs_MT128x64x64_MI16x16x1_SN_LDSB0_CLR1_GRVWA4_GRVWB8_GSU0_GSUC0_GSUWGMRR0_K1_LBSPPA1024_LBSPPB512_LPA64_LPB32_MIWT4_2_PLR1_SU0_SUM0_SUS64_VWA4_VWB2_WGM1_WGMXCC1_WGMXCCGn1
    SolutionIndex: 60
    SolutionNameMin: Cijk_Ailk_Bjlk_F8B8NHS_BH_Bias_HAS_SAV_UserArgs_MT128x64x64_MI16x16x1_SN_LDSB0_CLR1_GRVWA8_GRVWB8_GSU0_GSUC0_GSUWGMRR0_K1_LBSPPA1024_LBSPPB512_LPA64_LPB32_MIWT4_2_PLR1_SU0_SUM0_SUS64_VWA4_VWB2_WGM1_WGMXCC1_WGMXCCGn1
    SolutionIndex: 61
    SolutionNameMin: Cijk_Ailk_Bjlk_F8B8NHS_BH_Bias_HAS_SAV_UserArgs_MT128x64x64_MI16x16x1_SN_LDSB0_CLR1_GRVWA16_GRVWB8_GSU0_GSUC0_GSUWGMRR0_K1_LBSPPA1024_LBSPPB512_LPA64_LPB32_MIWT4_2_PLR1_SU0_SUM0_SUS64_VWA4_VWB2_WGM1_WGMXCC1_WGMXCCGn1
    SolutionIndex: 62
    SolutionNameMin: Cijk_Ailk_Bjlk_F8B8NHS_BH_Bias_HAS_SAV_UserArgs_MT128x32x64_MI16x16x1_SN_LDSB0_CLR1_GRVWA4_GRVWB4_GSU0_GSUC0_GSUWGMRR0_K1_LBSPPA1024_LBSPPB256_LPA64_LPB16_MIWT4_1_PLR1_SU0_SUM0_SUS64_VWA4_VWB1_WGM1_WGMXCC1_WGMXCCGn1
    SolutionIndex: 63
    SolutionNameMin: Cijk_Ailk_Bjlk_F8B8NHS_BH_Bias_HAS_SAV_UserArgs_MT64x64x64_MI16x16x1_SN_LDSB0_CLR1_GRVWA4_GRVWB4_GSU0_GSUC0_GSUWGMRR0_K1_LBSPPA512_LBSPPB512_LPA32_LPB32_MIWT2_2_PLR1_SU0_SUM0_SUS64_VWA2_VWB2_WGM1_WGMXCC1_WGMXCCGn1
    SolutionIndex: 64
    SolutionNameMin: Cijk_Ailk_Bjlk_F8B8NHS_BH_Bias_HAS_SAV_UserArgs_MT64x64x64_MI16x16x1_SN_LDSB0_CLR1_GRVWA4_GRVWB8_GSU0_GSUC0_GSUWGMRR0_K1_LBSPPA512_LBSPPB512_LPA32_LPB32_MIWT2_2_PLR1_SU0_SUM0_SUS64_VWA2_VWB2_WGM1_WGMXCC1_WGMXCCGn1
    SolutionIndex: 65
    SolutionNameMin: Cijk_Ailk_Bjlk_F8B8NHS_BH_Bias_HAS_SAV_UserArgs_MT64x64x64_MI16x16x1_SN_LDSB0_CLR1_GRVWA8_GRVWB8_GSU0_GSUC0_GSUWGMRR0_K1_LBSPPA512_LBSPPB512_LPA32_LPB32_MIWT2_2_PLR1_SU0_SUM0_SUS64_VWA2_VWB2_WGM1_WGMXCC1_WGMXCCGn1
    SolutionIndex: 66
    SolutionNameMin: Cijk_Ailk_Bjlk_F8B8NHS_BH_Bias_HAS_SAV_UserArgs_MT64x64x64_MI16x16x1_SN_LDSB0_CLR1_GRVWA16_GRVWB8_GSU0_GSUC0_GSUWGMRR0_K1_LBSPPA512_LBSPPB512_LPA32_LPB32_MIWT2_2_PLR1_SU0_SUM0_SUS64_VWA2_VWB2_WGM1_WGMXCC1_WGMXCCGn1
    SolutionIndex: 67
    SolutionNameMin: Cijk_Ailk_Bjlk_F8B8NHS_BH_Bias_HAS_SAV_UserArgs_MT64x64x64_MI16x16x1_SN_LDSB0_CLR1_GRVWA8_GRVWB16_GSU0_GSUC0_GSUWGMRR0_K1_LBSPPA512_LBSPPB512_LPA32_LPB32_MIWT2_2_PLR1_SU0_SUM0_SUS64_VWA2_VWB2_WGM1_WGMXCC1_WGMXCCGn1
    SolutionIndex: 68
    SolutionNameMin: Cijk_Ailk_Bjlk_F8B8NHS_BH_Bias_HAS_SAV_UserArgs_MT64x64x64_MI16x16x1_SN_LDSB0_CLR1_GRVWA4_GRVWB8_GSU0_GSUC0_GSUWGMRR0_K1_LBSPPA512_LBSPPB512_LPA32_LPB32_MIWT2_2_PLR1_SU0_SUM0_SUS64_VWA2_VWB2_WGM6_WGMXCC1_WGMXCCGn1
    SolutionIndex: 69
    SolutionNameMin: Cijk_Ailk_Bjlk_F8B8NHS_BH_Bias_HAS_SAV_UserArgs_MT64x64x64_MI16x16x1_SN_LDSB0_CLR1_GRVWA8_GRVWB8_GSU0_GSUC0_GSUWGMRR0_K1_LBSPPA512_LBSPPB512_LPA32_LPB32_MIWT2_2_PLR1_SU0_SUM0_SUS64_VWA2_VWB2_WGM6_WGMXCC1_WGMXCCGn1
    SolutionIndex: 70
    SolutionNameMin: Cijk_Ailk_Bjlk_F8B8NHS_BH_Bias_HAS_SAV_UserArgs_MT64x64x64_MI16x16x1_SN_LDSB0_CLR1_GRVWA4_GRVWB4_GSU0_GSUC0_GSUWGMRR0_K1_LBSPPA512_LBSPPB512_LPA32_LPB32_MIWT2_2_PLR1_SU0_SUM0_SUS64_VWA2_VWB2_WGM8_WGMXCC1_WGMXCCGn1
    SolutionIndex: 71
    SolutionNameMin: Cijk_Ailk_Bjlk_F8B8NHS_BH_Bias_HAS_SAV_UserArgs_MT64x32x64_MI16x16x1_SN_LDSB0_CLR1_GRVWA4_GRVWB4_GSU0_GSUC0_GSUWGMRR0_K1_LBSPPA512_LBSPPB256_LPA32_LPB16_MIWT2_1_PLR1_SU0_SUM0_SUS64_VWA2_VWB1_WGM1_WGMXCC1_WGMXCCGn1
    SolutionIndex: 72
    SolutionNameMin: Cijk_Ailk_Bjlk_F8B8NHS_BH_Bias_HAS_SAV_UserArgs_MT64x32x64_MI16x16x1_SN_LDSB0_CLR1_GRVWA4_GRVWB8_GSU0_GSUC0_GSUWGMRR0_K1_LBSPPA512_LBSPPB256_LPA32_LPB16_MIWT2_1_PLR1_SU0_SUM0_SUS64_VWA2_VWB1_WGM1_WGMXCC1_WGMXCCGn1
    SolutionIndex: 73
    SolutionNameMin: Cijk_Ailk_Bjlk_F8B8NHS_BH_Bias_HAS_SAV_UserArgs_MT32x32x64_MI16x16x1_SN_LDSB0_CLR1_GRVWA4_GRVWB4_GSU0_GSUC0_GSUWGMRR0_K1_LBSPPA256_LBSPPB256_LPA16_LPB16_MIWT1_1_PLR1_SU0_SUM0_SUS64_VWA1_VWB1_WGM1_WGMXCC1_WGMXCCGn1
    SolutionIndex: 74
    SolutionNameMin: Cijk_Ailk_Bjlk_F8B8NHS_BH_Bias_HAS_SAV_UserArgs_MT32x32x64_MI16x16x1_SN_LDSB0_CLR1_GRVWA4_GRVWB8_GSU0_GSUC0_GSUWGMRR0_K1_LBSPPA256_LBSPPB256_LPA16_LPB16_MIWT1_1_PLR1_SU0_SUM0_SUS64_VWA1_VWB1_WGM1_WGMXCC1_WGMXCCGn1
    SolutionIndex: 75
    SolutionNameMin: Cijk_Ailk_Bjlk_F8B8NHS_BH_Bias_HAS_SAV_UserArgs_MT32x32x64_MI16x16x1_SN_LDSB0_CLR1_GRVWA8_GRVWB8_GSU0_GSUC0_GSUWGMRR0_K1_LBSPPA256_LBSPPB256_LPA16_LPB16_MIWT1_1_PLR1_SU0_SUM0_SUS64_VWA1_VWB1_WGM1_WGMXCC1_WGMXCCGn1
    SolutionIndex: 76
    SolutionNameMin: Cijk_Ailk_Bjlk_F8B8NHS_BH_Bias_HAS_SAV_UserArgs_MT32x32x64_MI16x16x1_SN_LDSB0_CLR1_GRVWA4_GRVWB4_GSU0_GSUC0_GSUWGMRR0_K1_LBSPPA256_LBSPPB256_LPA16_LPB16_MIWT1_1_PLR1_SU0_SUM0_SUS64_VWA1_VWB1_WGM8_WGMXCC1_WGMXCCGn1
    SolutionIndex: 77
    SolutionNameMin: Cijk_Ailk_Bjlk_F8B8NHS_BH_Bias_HAS_SAV_UserArgs_MT256x256x128_MI16x16x1_SN_LDSB1_CLR1_GRVWA16_GRVWB16_GSU0_GSUC0_GSUWGMRR0_K1_LBSPPA2048_LBSPPB2048_LPA0_LPB0_MIWT8_8_PLR1_SU0_SUM0_SUS128_VWA8_VWB8_WGM1_WGMXCC1_WGMXCCGn1
    SolutionIndex: 78
    SolutionNameMin: Cijk_Ailk_Bjlk_F8B8NHS_BH_Bias_HAS_SAV_UserArgs_MT256x256x128_MI16x16x1_SN_LDSB1_CLR1_GRVWA8_GRVWB16_GSU0_GSUC0_GSUWGMRR0_K1_LBSPPA2048_LBSPPB2048_LPA0_LPB0_MIWT8_8_PLR1_SU0_SUM0_SUS128_VWA8_VWB8_WGM4_WGMXCC1_WGMXCCGn1
    SolutionIndex: 79
    SolutionNameMin: Cijk_Ailk_Bjlk_F8B8NHS_BH_Bias_HAS_SAV_UserArgs_MT256x256x128_MI16x16x1_SN_LDSB1_CLR1_GRVWA16_GRVWB16_GSU0_GSUC0_GSUWGMRR0_K1_LBSPPA2048_LBSPPB2048_LPA0_LPB0_MIWT8_8_PLR1_SU0_SUM0_SUS128_VWA8_VWB8_WGM4_WGMXCC1_WGMXCCGn1
    SolutionIndex: 80
    SolutionNameMin: Cijk_Ailk_Bjlk_F8B8NHS_BH_Bias_HAS_SAV_UserArgs_MT256x256x128_MI16x16x1_SN_LDSB1_CLR1_GRVWA16_GRVWB16_GSU0_GSUC0_GSUWGMRR0_K1_LBSPPA2048_LBSPPB2048_LPA0_LPB0_MIWT8_8_PLR1_SU0_SUM0_SUS128_VWA8_VWB8_WGM6_WGMXCC1_WGMXCCGn1
    SolutionIndex: 81
    SolutionNameMin: Cijk_Ailk_Bjlk_F8B8NHS_BH_Bias_HAS_SAV_UserArgs_MT256x256x128_MI16x16x1_SN_LDSB1_CLR1_GRVWA16_GRVWB8_GSU0_GSUC0_GSUWGMRR0_K1_LBSPPA2048_LBSPPB2048_LPA0_LPB0_MIWT8_8_PLR1_SU0_SUM0_SUS128_VWA8_VWB8_WGM8_WGMXCC1_WGMXCCGn1
    SolutionIndex: 82
    SolutionNameMin: Cijk_Ailk_Bjlk_F8B8NHS_BH_Bias_HAS_SAV_UserArgs_MT256x256x128_MI16x16x1_SN_LDSB1_CLR1_GRVWA16_GRVWB16_GSU0_GSUC0_GSUWGMRR0_K1_LBSPPA2048_LBSPPB2048_LPA0_LPB0_MIWT8_8_PLR1_SU0_SUM0_SUS128_VWA8_VWB8_WGM8_WGMXCC1_WGMXCCGn1
    SolutionIndex: 83
    SolutionNameMin: Cijk_Ailk_Bjlk_F8B8NHS_BH_Bias_HAS_SAV_UserArgs_MT128x256x128_MI16x16x1_SN_LDSB1_CLR1_GRVWA4_GRVWB16_GSU0_GSUC0_GSUWGMRR0_K1_LBSPPA1024_LBSPPB2048_LPA64_LPB0_MIWT4_8_PLR1_SU0_SUM0_SUS128_VWA4_VWB8_WGM1_WGMXCC1_WGMXCCGn1
    SolutionIndex: 84
    SolutionNameMin: Cijk_Ailk_Bjlk_F8B8NHS_BH_Bias_HAS_SAV_UserArgs_MT128x256x128_MI16x16x1_SN_LDSB1_CLR1_GRVWA4_GRVWB16_GSU0_GSUC0_GSUWGMRR0_K1_LBSPPA1024_LBSPPB2048_LPA64_LPB0_MIWT4_8_PLR1_SU0_SUM0_SUS128_VWA4_VWB8_WGM4_WGMXCC1_WGMXCCGn1
    SolutionIndex: 85
    SolutionNameMin: Cijk_Ailk_Bjlk_F8B8NHS_BH_Bias_HAS_SAV_UserArgs_MT128x256x128_MI16x16x1_SN_LDSB1_CLR1_GRVWA16_GRVWB16_GSU0_GSUC0_GSUWGMRR0_K1_LBSPPA1024_LBSPPB2048_LPA64_LPB0_MIWT4_8_PLR1_SU0_SUM0_SUS128_VWA4_VWB8_WGM4_WGMXCC1_WGMXCCGn1
    SolutionIndex: 86
    SolutionNameMin: Cijk_Ailk_Bjlk_F8B8NHS_BH_Bias_HAS_SAV_UserArgs_MT128x256x128_MI16x16x1_SN_LDSB1_CLR1_GRVWA8_GRVWB16_GSU0_GSUC0_GSUWGMRR0_K1_LBSPPA1024_LBSPPB2048_LPA64_LPB0_MIWT4_8_PLR1_SU0_SUM0_SUS128_VWA4_VWB8_WGM6_WGMXCC1_WGMXCCGn1
    SolutionIndex: 87
    SolutionNameMin: Cijk_Ailk_Bjlk_F8B8NHS_BH_Bias_HAS_SAV_UserArgs_MT128x256x128_MI16x16x1_SN_LDSB1_CLR1_GRVWA16_GRVWB16_GSU0_GSUC0_GSUWGMRR0_K1_LBSPPA1024_LBSPPB2048_LPA64_LPB0_MIWT4_8_PLR1_SU0_SUM0_SUS128_VWA4_VWB8_WGM8_WGMXCC1_WGMXCCGn1
    SolutionIndex: 88
    SolutionNameMin: Cijk_Ailk_Bjlk_F8B8NHS_BH_Bias_HAS_SAV_UserArgs_MT256x128x128_MI16x16x1_SN_LDSB1_CLR1_GRVWA16_GRVWB8_GSU0_GSUC0_GSUWGMRR0_K1_LBSPPA2048_LBSPPB1024_LPA0_LPB64_MIWT8_4_PLR1_SU0_SUM0_SUS128_VWA8_VWB4_WGM4_WGMXCC1_WGMXCCGn1
    SolutionIndex: 89
    SolutionNameMin: Cijk_Ailk_Bjlk_F8B8NHS_BH_Bias_HAS_SAV_UserArgs_MT128x128x128_MI16x16x1_SN_LDSB1_CLR1_GRVWA4_GRVWB4_GSU0_GSUC0_GSUWGMRR0_K1_LBSPPA1024_LBSPPB1024_LPA0_LPB32_MIWT8_2_PLR1_SU0_SUM0_SUS128_VWA8_VWB2_WGM1_WGMXCC1_WGMXCCGn1
    SolutionIndex: 90
    SolutionNameMin: Cijk_Ailk_Bjlk_F8B8NHS_BH_Bias_HAS_SAV_UserArgs_MT128x128x128_MI16x16x1_SN_LDSB1_CLR1_GRVWA16_GRVWB16_GSU0_GSUC0_GSUWGMRR0_K1_LBSPPA1024_LBSPPB1024_LPA0_LPB32_MIWT8_2_PLR1_SU0_SUM0_SUS128_VWA8_VWB2_WGM1_WGMXCC1_WGMXCCGn1
    SolutionIndex: 91
    SolutionNameMin: Cijk_Ailk_Bjlk_F8B8NHS_BH_Bias_HAS_SAV_UserArgs_MT128x128x128_MI16x16x1_SN_LDSB1_CLR1_GRVWA16_GRVWB16_GSU0_GSUC0_GSUWGMRR0_K1_LBSPPA1024_LBSPPB1024_LPA64_LPB64_MIWT4_4_PLR1_SU0_SUM0_SUS128_VWA4_VWB4_WGM1_WGMXCC1_WGMXCCGn1
    SolutionIndex: 92
    SolutionNameMin: Cijk_Ailk_Bjlk_F8B8NHS_BH_Bias_HAS_SAV_UserArgs_MT128x128x128_MI16x16x1_SN_LDSB1_CLR1_GRVWA16_GRVWB16_GSU0_GSUC0_GSUWGMRR0_K1_LBSPPA1024_LBSPPB1024_LPA64_LPB64_MIWT4_4_PLR1_SU0_SUM0_SUS128_VWA4_VWB4_WGM6_WGMXCC1_WGMXCCGn1
    SolutionIndex: 93
    SolutionNameMin: Cijk_Ailk_Bjlk_F8B8NHS_BH_Bias_HAS_SAV_UserArgs_MT128x128x128_MI16x16x1_SN_LDSB1_CLR1_GRVWA16_GRVWB16_GSU0_GSUC0_GSUWGMRR0_K1_LBSPPA1024_LBSPPB1024_LPA64_LPB64_MIWT4_4_PLR1_SU0_SUM0_SUS128_VWA4_VWB4_WGM8_WGMXCC1_WGMXCCGn1
    SolutionIndex: 94
    SolutionNameMin: Cijk_Ailk_Bjlk_F8B8NHS_BH_Bias_HAS_SAV_UserArgs_MT128x64x128_MI16x16x1_SN_LDSB1_CLR1_GRVWA16_GRVWB16_GSU0_GSUC0_GSUWGMRR0_K1_LBSPPA1024_LBSPPB512_LPA64_LPB32_MIWT4_2_PLR1_SU0_SUM0_SUS128_VWA4_VWB2_WGM1_WGMXCC1_WGMXCCGn1
    SolutionIndex: 95
    SolutionNameMin: Cijk_Ailk_Bjlk_F8B8NHS_BH_Bias_HAS_SAV_UserArgs_MT128x64x128_MI16x16x1_SN_LDSB1_CLR1_GRVWA16_GRVWB16_GSU0_GSUC0_GSUWGMRR0_K1_LBSPPA1024_LBSPPB512_LPA64_LPB32_MIWT4_2_PLR1_SU0_SUM0_SUS128_VWA4_VWB2_WGM4_WGMXCC1_WGMXCCGn1
    SolutionIndex: 96
    SolutionNameMin: Cijk_Ailk_Bjlk_F8B8NHS_BH_Bias_HAS_SAV_UserArgs_MT128x64x128_MI16x16x1_SN_LDSB1_CLR1_GRVWA16_GRVWB16_GSU0_GSUC0_GSUWGMRR0_K1_LBSPPA1024_LBSPPB512_LPA64_LPB32_MIWT4_2_PLR1_SU0_SUM0_SUS128_VWA4_VWB2_WGM6_WGMXCC1_WGMXCCGn1
    SolutionIndex: 97
    SolutionNameMin: Cijk_Ailk_Bjlk_F8B8NHS_BH_Bias_HAS_SAV_UserArgs_MT128x64x128_MI16x16x1_SN_LDSB1_CLR1_GRVWA16_GRVWB16_GSU0_GSUC0_GSUWGMRR0_K1_LBSPPA1024_LBSPPB512_LPA64_LPB32_MIWT4_2_PLR1_SU0_SUM0_SUS128_VWA4_VWB2_WGM8_WGMXCC1_WGMXCCGn1
    SolutionIndex: 98
    SolutionNameMin: Cijk_Ailk_Bjlk_F8B8NHS_BH_Bias_HAS_SAV_UserArgs_MT64x64x128_MI16x16x1_SN_LDSB1_CLR1_GRVWA4_GRVWB8_GSU0_GSUC0_GSUWGMRR0_K1_LBSPPA512_LBSPPB512_LPA32_LPB32_MIWT2_2_PLR1_SU0_SUM0_SUS128_VWA2_VWB2_WGM1_WGMXCC1_WGMXCCGn1
    SolutionIndex: 99
    SolutionNameMin: Cijk_Ailk_Bjlk_F8B8NHS_BH_Bias_HAS_SAV_UserArgs_MT64x64x128_MI16x16x1_SN_LDSB1_CLR1_GRVWA4_GRVWB16_GSU0_GSUC0_GSUWGMRR0_K1_LBSPPA512_LBSPPB512_LPA32_LPB32_MIWT2_2_PLR1_SU0_SUM0_SUS128_VWA2_VWB2_WGM1_WGMXCC1_WGMXCCGn1
    SolutionIndex: 100
    SolutionNameMin: Cijk_Ailk_Bjlk_F8B8NHS_BH_Bias_HAS_SAV_UserArgs_MT64x64x128_MI16x16x1_SN_LDSB1_CLR1_GRVWA8_GRVWB16_GSU0_GSUC0_GSUWGMRR0_K1_LBSPPA512_LBSPPB512_LPA32_LPB32_MIWT2_2_PLR1_SU0_SUM0_SUS128_VWA2_VWB2_WGM1_WGMXCC1_WGMXCCGn1
    SolutionIndex: 101
    SolutionNameMin: Cijk_Ailk_Bjlk_F8B8NHS_BH_Bias_HAS_SAV_UserArgs_MT64x64x128_MI16x16x1_SN_LDSB1_CLR1_GRVWA16_GRVWB16_GSU0_GSUC0_GSUWGMRR0_K1_LBSPPA512_LBSPPB512_LPA32_LPB32_MIWT2_2_PLR1_SU0_SUM0_SUS128_VWA2_VWB2_WGM1_WGMXCC1_WGMXCCGn1
    SolutionIndex: 102
    SolutionNameMin: Cijk_Ailk_Bjlk_F8B8NHS_BH_Bias_HAS_SAV_UserArgs_MT64x64x128_MI16x16x1_SN_LDSB1_CLR1_GRVWA8_GRVWB16_GSU0_GSUC0_GSUWGMRR0_K1_LBSPPA512_LBSPPB512_LPA32_LPB32_MIWT2_2_PLR1_SU0_SUM0_SUS128_VWA2_VWB2_WGM4_WGMXCC1_WGMXCCGn1
    SolutionIndex: 103
    SolutionNameMin: Cijk_Ailk_Bjlk_F8B8NHS_BH_Bias_HAS_SAV_UserArgs_MT64x64x128_MI16x16x1_SN_LDSB1_CLR1_GRVWA16_GRVWB16_GSU0_GSUC0_GSUWGMRR0_K1_LBSPPA512_LBSPPB512_LPA32_LPB32_MIWT2_2_PLR1_SU0_SUM0_SUS128_VWA2_VWB2_WGM4_WGMXCC1_WGMXCCGn1
    SolutionIndex: 104
    SolutionNameMin: Cijk_Ailk_Bjlk_F8B8NHS_BH_Bias_HAS_SAV_UserArgs_MT64x64x128_MI16x16x1_SN_LDSB1_CLR1_GRVWA4_GRVWB16_GSU0_GSUC0_GSUWGMRR0_K1_LBSPPA512_LBSPPB512_LPA32_LPB32_MIWT2_2_PLR1_SU0_SUM0_SUS128_VWA2_VWB2_WGM6_WGMXCC1_WGMXCCGn1
    SolutionIndex: 105
    SolutionNameMin: Cijk_Ailk_Bjlk_F8B8NHS_BH_Bias_HAS_SAV_UserArgs_MT64x64x128_MI16x16x1_SN_LDSB1_CLR1_GRVWA8_GRVWB16_GSU0_GSUC0_GSUWGMRR0_K1_LBSPPA512_LBSPPB512_LPA32_LPB32_MIWT2_2_PLR1_SU0_SUM0_SUS128_VWA2_VWB2_WGM6_WGMXCC1_WGMXCCGn1
    SolutionIndex: 106
    SolutionNameMin: Cijk_Ailk_Bjlk_F8B8NHS_BH_Bias_HAS_SAV_UserArgs_MT64x64x128_MI16x16x1_SN_LDSB1_CLR1_GRVWA16_GRVWB16_GSU0_GSUC0_GSUWGMRR0_K1_LBSPPA512_LBSPPB512_LPA32_LPB32_MIWT2_2_PLR1_SU0_SUM0_SUS128_VWA2_VWB2_WGM6_WGMXCC1_WGMXCCGn1
    SolutionIndex: 107
    SolutionNameMin: Cijk_Ailk_Bjlk_F8B8NHS_BH_Bias_HAS_SAV_UserArgs_MT64x64x128_MI16x16x1_SN_LDSB1_CLR1_GRVWA4_GRVWB16_GSU0_GSUC0_GSUWGMRR0_K1_LBSPPA512_LBSPPB512_LPA32_LPB32_MIWT2_2_PLR1_SU0_SUM0_SUS128_VWA2_VWB2_WGM8_WGMXCC1_WGMXCCGn1
    SolutionIndex: 108
    SolutionNameMin: Cijk_Ailk_Bjlk_F8B8NHS_BH_Bias_HAS_SAV_UserArgs_MT64x64x128_MI16x16x1_SN_LDSB1_CLR1_GRVWA16_GRVWB16_GSU0_GSUC0_GSUWGMRR0_K1_LBSPPA512_LBSPPB512_LPA32_LPB32_MIWT2_2_PLR1_SU0_SUM0_SUS128_VWA2_VWB2_WGM8_WGMXCC1_WGMXCCGn1
    SolutionIndex: 109
    SolutionNameMin: Cijk_Ailk_Bjlk_F8B8NHS_BH_Bias_HAS_SAV_UserArgs_MT32x64x128_MI16x16x1_SN_LDSB0_CLR1_GRVWA16_GRVWB16_GSU0_GSUC0_GSUWGMRR0_K1_LBSPPA256_LBSPPB512_LPA16_LPB32_MIWT1_2_PLR1_SU0_SUM0_SUS128_VWA1_VWB2_WGM4_WGMXCC1_WGMXCCGn1
    SolutionIndex: 110
    SolutionNameMin: Cijk_Ailk_Bjlk_F8B8NHS_BH_Bias_HAS_SAV_UserArgs_MT32x64x128_MI16x16x1_SN_LDSB0_CLR1_GRVWA16_GRVWB16_GSU0_GSUC0_GSUWGMRR0_K1_LBSPPA256_LBSPPB512_LPA16_LPB32_MIWT1_2_PLR1_SU0_SUM0_SUS128_VWA1_VWB2_WGM6_WGMXCC1_WGMXCCGn1
    SolutionIndex: 111
    SolutionNameMin: Cijk_Ailk_Bjlk_F8B8NHS_BH_Bias_HAS_SAV_UserArgs_MT64x32x128_MI16x16x1_SN_LDSB0_CLR1_GRVWA4_GRVWB4_GSU0_GSUC0_GSUWGMRR0_K1_LBSPPA512_LBSPPB256_LPA32_LPB16_MIWT2_1_PLR1_SU0_SUM0_SUS128_VWA2_VWB1_WGM1_WGMXCC1_WGMXCCGn1
    SolutionIndex: 112
    SolutionNameMin: Cijk_Ailk_Bjlk_F8B8NHS_BH_Bias_HAS_SAV_UserArgs_MT64x32x128_MI16x16x1_SN_LDSB0_CLR1_GRVWA4_GRVWB8_GSU0_GSUC0_GSUWGMRR0_K1_LBSPPA512_LBSPPB256_LPA32_LPB16_MIWT2_1_PLR1_SU0_SUM0_SUS128_VWA2_VWB1_WGM1_WGMXCC1_WGMXCCGn1
    SolutionIndex: 113
    SolutionNameMin: Cijk_Ailk_Bjlk_F8B8NHS_BH_Bias_HAS_SAV_UserArgs_MT64x32x128_MI16x16x1_SN_LDSB0_CLR1_GRVWA8_GRVWB8_GSU0_GSUC0_GSUWGMRR0_K1_LBSPPA512_LBSPPB256_LPA32_LPB16_MIWT2_1_PLR1_SU0_SUM0_SUS128_VWA2_VWB1_WGM1_WGMXCC1_WGMXCCGn1
    SolutionIndex: 114
    SolutionNameMin: Cijk_Ailk_Bjlk_F8B8NHS_BH_Bias_HAS_SAV_UserArgs_MT64x32x128_MI16x16x1_SN_LDSB0_CLR1_GRVWA4_GRVWB16_GSU0_GSUC0_GSUWGMRR0_K1_LBSPPA512_LBSPPB256_LPA32_LPB16_MIWT2_1_PLR1_SU0_SUM0_SUS128_VWA2_VWB1_WGM1_WGMXCC1_WGMXCCGn1
    SolutionIndex: 115
    SolutionNameMin: Cijk_Ailk_Bjlk_F8B8NHS_BH_Bias_HAS_SAV_UserArgs_MT64x32x128_MI16x16x1_SN_LDSB0_CLR1_GRVWA8_GRVWB16_GSU0_GSUC0_GSUWGMRR0_K1_LBSPPA512_LBSPPB256_LPA32_LPB16_MIWT2_1_PLR1_SU0_SUM0_SUS128_VWA2_VWB1_WGM1_WGMXCC1_WGMXCCGn1
    SolutionIndex: 116
    SolutionNameMin: Cijk_Ailk_Bjlk_F8B8NHS_BH_Bias_HAS_SAV_UserArgs_MT64x32x128_MI16x16x1_SN_LDSB0_CLR1_GRVWA16_GRVWB16_GSU0_GSUC0_GSUWGMRR0_K1_LBSPPA512_LBSPPB256_LPA32_LPB16_MIWT2_1_PLR1_SU0_SUM0_SUS128_VWA2_VWB1_WGM1_WGMXCC1_WGMXCCGn1
    SolutionIndex: 117
    SolutionNameMin: Cijk_Ailk_Bjlk_F8B8NHS_BH_Bias_HAS_SAV_UserArgs_MT64x32x128_MI16x16x1_SN_LDSB0_CLR1_GRVWA4_GRVWB8_GSU0_GSUC0_GSUWGMRR0_K1_LBSPPA512_LBSPPB256_LPA32_LPB16_MIWT2_1_PLR1_SU0_SUM0_SUS128_VWA2_VWB1_WGM4_WGMXCC1_WGMXCCGn1
    SolutionIndex: 118
    SolutionNameMin: Cijk_Ailk_Bjlk_F8B8NHS_BH_Bias_HAS_SAV_UserArgs_MT32x32x128_MI16x16x1_SN_LDSB0_CLR1_GRVWA4_GRVWB4_GSU0_GSUC0_GSUWGMRR0_K1_LBSPPA256_LBSPPB256_LPA16_LPB16_MIWT1_1_PLR1_SU0_SUM0_SUS128_VWA1_VWB1_WGM1_WGMXCC1_WGMXCCGn1
    SolutionIndex: 119
    SolutionNameMin: Cijk_Ailk_Bjlk_F8B8NHS_BH_Bias_HAS_SAV_UserArgs_MT32x32x128_MI16x16x1_SN_LDSB0_CLR1_GRVWA8_GRVWB8_GSU0_GSUC0_GSUWGMRR0_K1_LBSPPA256_LBSPPB256_LPA16_LPB16_MIWT1_1_PLR1_SU0_SUM0_SUS128_VWA1_VWB1_WGM1_WGMXCC1_WGMXCCGn1
    SolutionIndex: 120
    SolutionNameMin: Cijk_Ailk_Bjlk_F8B8NHS_BH_Bias_HAS_SAV_UserArgs_MT32x32x128_MI16x16x1_SN_LDSB0_CLR1_GRVWA4_GRVWB16_GSU0_GSUC0_GSUWGMRR0_K1_LBSPPA256_LBSPPB256_LPA16_LPB16_MIWT1_1_PLR1_SU0_SUM0_SUS128_VWA1_VWB1_WGM1_WGMXCC1_WGMXCCGn1
    SolutionIndex: 121
    SolutionNameMin: Cijk_Ailk_Bjlk_F8B8NHS_BH_Bias_HAS_SAV_UserArgs_MT32x32x128_MI16x16x1_SN_LDSB0_CLR1_GRVWA8_GRVWB16_GSU0_GSUC0_GSUWGMRR0_K1_LBSPPA256_LBSPPB256_LPA16_LPB16_MIWT1_1_PLR1_SU0_SUM0_SUS128_VWA1_VWB1_WGM1_WGMXCC1_WGMXCCGn1
    SolutionIndex: 122
    SolutionNameMin: Cijk_Ailk_Bjlk_F8B8NHS_BH_Bias_HAS_SAV_UserArgs_MT128x64x256_MI16x16x1_SN_LDSB1_CLR1_GRVWA4_GRVWB16_GSU0_GSUC0_GSUWGMRR0_K1_LBSPPA1024_LBSPPB512_LPA64_LPB32_MIWT4_2_PLR1_SU0_SUM0_SUS256_VWA4_VWB2_WGM1_WGMXCC1_WGMXCCGn1
    SolutionIndex: 123
    SolutionNameMin: Cijk_Ailk_Bjlk_F8B8NHS_BH_Bias_HAS_SAV_UserArgs_MT128x64x256_MI16x16x1_SN_LDSB1_CLR1_GRVWA16_GRVWB16_GSU0_GSUC0_GSUWGMRR0_K1_LBSPPA1024_LBSPPB512_LPA64_LPB32_MIWT4_2_PLR1_SU0_SUM0_SUS256_VWA4_VWB2_WGM1_WGMXCC1_WGMXCCGn1
    SolutionIndex: 124
    SolutionNameMin: Cijk_Ailk_Bjlk_F8B8NHS_BH_Bias_HAS_SAV_UserArgs_MT128x64x256_MI16x16x1_SN_LDSB1_CLR1_GRVWA16_GRVWB16_GSU0_GSUC0_GSUWGMRR0_K1_LBSPPA1024_LBSPPB512_LPA64_LPB32_MIWT4_2_PLR1_SU0_SUM0_SUS256_VWA4_VWB2_WGM4_WGMXCC1_WGMXCCGn1
    SolutionIndex: 125
    SolutionNameMin: Cijk_Ailk_Bjlk_F8B8NHS_BH_Bias_HAS_SAV_UserArgs_MT64x64x256_MI16x16x1_SN_LDSB1_CLR1_GRVWA4_GRVWB16_GSU0_GSUC0_GSUWGMRR0_K1_LBSPPA512_LBSPPB512_LPA32_LPB32_MIWT2_2_PLR1_SU0_SUM0_SUS256_VWA2_VWB2_WGM1_WGMXCC1_WGMXCCGn1
    SolutionIndex: 126
    SolutionNameMin: Cijk_Ailk_Bjlk_F8B8NHS_BH_Bias_HAS_SAV_UserArgs_MT64x64x256_MI16x16x1_SN_LDSB1_CLR1_GRVWA16_GRVWB16_GSU0_GSUC0_GSUWGMRR0_K1_LBSPPA512_LBSPPB512_LPA32_LPB32_MIWT2_2_PLR1_SU0_SUM0_SUS256_VWA2_VWB2_WGM1_WGMXCC1_WGMXCCGn1
    SolutionIndex: 127
    SolutionNameMin: Cijk_Ailk_Bjlk_F8B8NHS_BH_Bias_HAS_SAV_UserArgs_MT64x32x256_MI16x16x1_SN_LDSB1_CLR1_GRVWA16_GRVWB16_GSU0_GSUC0_GSUWGMRR0_K1_LBSPPA512_LBSPPB256_LPA32_LPB16_MIWT2_1_PLR1_SU0_SUM0_SUS256_VWA2_VWB1_WGM1_WGMXCC1_WGMXCCGn1
    SolutionIndex: 128
    SolutionNameMin: Cijk_Ailk_Bjlk_F8B8NHS_BH_Bias_HAS_SAV_UserArgs_MT64x32x256_MI16x16x1_SN_LDSB1_CLR1_GRVWA16_GRVWB16_GSU0_GSUC0_GSUWGMRR0_K1_LBSPPA512_LBSPPB256_LPA32_LPB16_MIWT2_1_PLR1_SU0_SUM0_SUS256_VWA2_VWB1_WGM6_WGMXCC1_WGMXCCGn1
    SolutionIndex: 129
    SolutionNameMin: Cijk_Ailk_Bjlk_F8B8NHS_BH_Bias_HAS_SAV_UserArgs_MT32x32x256_MI16x16x1_SN_LDSB1_CLR1_GRVWA8_GRVWB16_GSU0_GSUC0_GSUWGMRR0_K1_LBSPPA256_LBSPPB256_LPA16_LPB16_MIWT1_1_PLR1_SU0_SUM0_SUS256_VWA1_VWB1_WGM1_WGMXCC1_WGMXCCGn1
    SolutionIndex: 130
    SolutionNameMin: Cijk_Ailk_Bjlk_F8B8NHS_BH_Bias_HAS_SAV_UserArgs_MT32x32x256_MI16x16x1_SN_LDSB1_CLR1_GRVWA16_GRVWB16_GSU0_GSUC0_GSUWGMRR0_K1_LBSPPA256_LBSPPB256_LPA16_LPB16_MIWT1_1_PLR1_SU0_SUM0_SUS256_VWA1_VWB1_WGM1_WGMXCC1_WGMXCCGn1
    SolutionIndex: 131
    SolutionNameMin: Cijk_Ailk_Bjlk_F8B8NHS_BH_Bias_HAS_SAV_UserArgs_MT32x32x256_MI16x16x1_SN_LDSB1_CLR1_GRVWA16_GRVWB16_GSU0_GSUC0_GSUWGMRR0_K1_LBSPPA256_LBSPPB256_LPA16_LPB16_MIWT1_1_PLR1_SU0_SUM0_SUS256_VWA1_VWB1_WGM4_WGMXCC1_WGMXCCGn1
    SolutionIndex: 132
    SolutionNameMin: Cijk_Ailk_Bjlk_F8B8NHS_BH_Bias_HAS_SAV_UserArgs_MT32x32x256_MI16x16x1_SN_LDSB1_CLR1_GRVWA8_GRVWB16_GSU0_GSUC0_GSUWGMRR0_K1_LBSPPA256_LBSPPB256_LPA16_LPB16_MIWT1_1_PLR1_SU0_SUM0_SUS256_VWA1_VWB1_WGM6_WGMXCC1_WGMXCCGn1
    SolutionIndex: 133
    SolutionNameMin: Cijk_Ailk_Bjlk_F8B8NHS_BH_Bias_HAS_SAV_UserArgs_MT32x32x256_MI16x16x1_SN_LDSB1_CLR1_GRVWA16_GRVWB16_GSU0_GSUC0_GSUWGMRR0_K1_LBSPPA256_LBSPPB256_LPA16_LPB16_MIWT1_1_PLR1_SU0_SUM0_SUS256_VWA1_VWB1_WGM6_WGMXCC1_WGMXCCGn1
    SolutionIndex: 134
    SolutionNameMin: Cijk_Ailk_Bjlk_F8B8NHS_BH_Bias_HAS_SAV_UserArgs_MT32x32x256_MI16x16x1_SN_LDSB1_CLR1_GRVWA8_GRVWB16_GSU0_GSUC0_GSUWGMRR0_K1_LBSPPA256_LBSPPB256_LPA16_LPB16_MIWT1_1_PLR1_SU0_SUM0_SUS256_VWA1_VWB1_WGM8_WGMXCC1_WGMXCCGn1
- - - [128, 128, 1, 128, 128, 128, 128, 128]
    - [76, 0.49]
  - - [128, 128, 1, 256, 128, 128, 128, 128]
    - [118, 0.89]
  - - [128, 128, 1, 512, 128, 128, 128, 128]
    - [119, 1.5]
  - - [128, 128, 1, 1024, 128, 128, 128, 128]
    - [121, 2.22]
  - - [128, 128, 1, 2048, 128, 128, 128, 128]
    - [121, 2.95]
  - - [128, 128, 1, 4096, 128, 128, 128, 128]
    - [121, 3.53]
  - - [128, 128, 1, 8192, 128, 128, 128, 128]
    - [130, 3.94]
  - - [128, 256, 1, 128, 128, 128, 128, 256]
    - [73, 1.05]
  - - [128, 256, 1, 256, 128, 128, 128, 256]
    - [118, 1.83]
  - - [128, 256, 1, 512, 128, 128, 128, 256]
    - [119, 3.03]
  - - [128, 256, 1, 1024, 128, 128, 128, 256]
    - [120, 4.42]
  - - [128, 256, 1, 2048, 128, 128, 128, 256]
    - [121, 5.91]
  - - [128, 256, 1, 4096, 128, 128, 128, 256]
    - [130, 7.09]
  - - [128, 256, 1, 8192, 128, 128, 128, 256]
    - [130, 7.91]
  - - [128, 512, 1, 128, 128, 128, 128, 512]
    - [118, 2.05]
  - - [128, 512, 1, 256, 128, 128, 128, 512]
    - [74, 3.63]
  - - [128, 512, 1, 512, 128, 128, 128, 512]
    - [118, 5.95]
  - - [128, 512, 1, 1024, 128, 128, 128, 512]
    - [119, 8.84]
  - - [128, 512, 1, 2048, 128, 128, 128, 512]
    - [121, 11.75]
  - - [128, 512, 1, 4096, 128, 128, 128, 512]
    - [121, 14.0]
  - - [128, 512, 1, 8192, 128, 128, 128, 512]
    - [129, 15.01]
  - - [128, 1024, 1, 128, 128, 128, 128, 1024]
    - [72, 3.93]
  - - [128, 1024, 1, 256, 128, 128, 128, 1024]
    - [73, 7.13]
  - - [128, 1024, 1, 512, 128, 128, 128, 1024]
    - [118, 11.43]
  - - [128, 1024, 1, 1024, 128, 128, 128, 1024]
    - [119, 17.06]
  - - [128, 1024, 1, 2048, 128, 128, 128, 1024]
    - [121, 22.82]
  - - [128, 1024, 1, 4096, 128, 128, 128, 1024]
    - [134, 25.65]
  - - [128, 1024, 1, 8192, 128, 128, 128, 1024]
    - [132, 27.82]
  - - [128, 2048, 1, 128, 128, 128, 128, 2048]
    - [72, 7.43]
  - - [128, 2048, 1, 256, 128, 128, 128, 2048]
    - [72, 13.04]
  - - [128, 2048, 1, 512, 128, 128, 128, 2048]
    - [112, 20.96]
  - - [128, 2048, 1, 1024, 128, 128, 128, 2048]
    - [114, 30.59]
  - - [128, 2048, 1, 2048, 128, 128, 128, 2048]
    - [127, 38.9]
  - - [128, 2048, 1, 4096, 128, 128, 128, 2048]
    - [128, 47.37]
  - - [128, 2048, 1, 8192, 128, 128, 128, 2048]
    - [128, 53.45]
  - - [128, 4096, 1, 128, 128, 128, 128, 4096]
    - [63, 13.98]
  - - [128, 4096, 1, 256, 128, 128, 128, 4096]
    - [63, 24.07]
  - - [128, 4096, 1, 512, 128, 128, 128, 4096]
    - [98, 37.58]
  - - [128, 4096, 1, 1024, 128, 128, 128, 4096]
    - [100, 54.2]
  - - [128, 4096, 1, 2048, 128, 128, 128, 4096]
    - [126, 67.25]
  - - [128, 4096, 1, 4096, 128, 128, 128, 4096]
    - [126, 82.21]
  - - [128, 4096, 1, 8192, 128, 128, 128, 4096]
    - [126, 92.08]
  - - [128, 8192, 1, 128, 128, 128, 128, 8192]
    - [60, 23.57]
  - - [128, 8192, 1, 256, 128, 128, 128, 8192]
    - [59, 40.88]
  - - [128, 8192, 1, 512, 128, 128, 128, 8192]
    - [54, 63.04]
  - - [128, 8192, 1, 1024, 128, 128, 128, 8192]
    - [57, 88.3]
  - - [128, 8192, 1, 2048, 128, 128, 128, 8192]
    - [94, 106.67]
  - - [128, 8192, 1, 4096, 128, 128, 128, 8192]
    - [123, 125.37]
  - - [128, 8192, 1, 8192, 128, 128, 128, 8192]
    - [122, 129.39]
  - - [256, 128, 1, 128, 256, 256, 256, 128]
    - [75, 1.04]
  - - [256, 128, 1, 256, 256, 256, 256, 128]
    - [118, 1.85]
  - - [256, 128, 1, 512, 256, 256, 256, 128]
    - [119, 3.0]
  - - [256, 128, 1, 1024, 256, 256, 256, 128]
    - [121, 4.49]
  - - [256, 128, 1, 2048, 256, 256, 256, 128]
    - [121, 5.96]
  - - [256, 128, 1, 4096, 256, 256, 256, 128]
    - [121, 7.1]
  - - [256, 128, 1, 8192, 256, 256, 256, 128]
    - [130, 7.88]
  - - [256, 256, 1, 128, 256, 256, 256, 256]
    - [119, 2.05]
  - - [256, 256, 1, 256, 256, 256, 256, 256]
    - [74, 3.67]
  - - [256, 256, 1, 512, 256, 256, 256, 256]
    - [119, 5.91]
  - - [256, 256, 1, 1024, 256, 256, 256, 256]
    - [119, 8.94]
  - - [256, 256, 1, 2048, 256, 256, 256, 256]
    - [121, 11.78]
  - - [256, 256, 1, 4096, 256, 256, 256, 256]
    - [121, 14.15]
  - - [256, 256, 1, 8192, 256, 256, 256, 256]
    - [130, 15.68]
  - - [256, 512, 1, 128, 256, 256, 256, 512]
    - [73, 4.09]
  - - [256, 512, 1, 256, 256, 256, 256, 512]
    - [73, 7.15]
  - - [256, 512, 1, 512, 256, 256, 256, 512]
    - [119, 11.57]
  - - [256, 512, 1, 1024, 256, 256, 256, 512]
    - [119, 17.26]
  - - [256, 512, 1, 2048, 256, 256, 256, 512]
    - [121, 22.89]
  - - [256, 512, 1, 4096, 256, 256, 256, 512]
    - [121, 27.56]
  - - [256, 512, 1, 8192, 256, 256, 256, 512]
    - [130, 30.4]
  - - [256, 1024, 1, 128, 256, 256, 256, 1024]
    - [111, 7.59]
  - - [256, 1024, 1, 256, 256, 256, 256, 1024]
    - [71, 13.31]
  - - [256, 1024, 1, 512, 256, 256, 256, 1024]
    - [113, 21.05]
  - - [256, 1024, 1, 1024, 256, 256, 256, 1024]
    - [115, 30.81]
  - - [256, 1024, 1, 2048, 256, 256, 256, 1024]
    - [127, 41.03]
  - - [256, 1024, 1, 4096, 256, 256, 256, 1024]
    - [127, 48.56]
  - - [256, 1024, 1, 8192, 256, 256, 256, 1024]
    - [128, 53.57]
  - - [256, 2048, 1, 128, 256, 256, 256, 2048]
    - [62, 13.65]
  - - [256, 2048, 1, 256, 256, 256, 256, 2048]
    - [63, 23.49]
  - - [256, 2048, 1, 512, 256, 256, 256, 2048]
    - [98, 37.18]
  - - [256, 2048, 1, 1024, 256, 256, 256, 2048]
    - [101, 53.73]
  - - [256, 2048, 1, 2048, 256, 256, 256, 2048]
    - [101, 67.64]
  - - [256, 2048, 1, 4096, 256, 256, 256, 2048]
    - [101, 79.03]
  - - [256, 2048, 1, 8192, 256, 256, 256, 2048]
    - [125, 86.63]
  - - [256, 4096, 1, 128, 256, 256, 256, 4096]
    - [53, 23.44]
  - - [256, 4096, 1, 256, 256, 256, 256, 4096]
    - [53, 40.2]
  - - [256, 4096, 1, 512, 256, 256, 256, 4096]
    - [54, 63.31]
  - - [256, 4096, 1, 1024, 256, 256, 256, 4096]
    - [57, 87.7]
  - - [256, 4096, 1, 2048, 256, 256, 256, 4096]
    - [94, 107.59]
  - - [256, 4096, 1, 4096, 256, 256, 256, 4096]
    - [94, 125.28]
  - - [256, 4096, 1, 8192, 256, 256, 256, 4096]
    - [124, 129.88]
  - - [256, 8192, 1, 128, 256, 256, 256, 8192]
    - [39, 36.27]
  - - [256, 8192, 1, 256, 256, 256, 256, 8192]
    - [39, 61.19]
  - - [256, 8192, 1, 512, 256, 256, 256, 8192]
    - [46, 94.33]
  - - [256, 8192, 1, 1024, 256, 256, 256, 8192]
    - [91, 130.31]
  - - [256, 8192, 1, 2048, 256, 256, 256, 8192]
    - [91, 158.32]
  - - [256, 8192, 1, 4096, 256, 256, 256, 8192]
    - [91, 178.25]
  - - [256, 8192, 1, 8192, 256, 256, 256, 8192]
    - [92, 167.13]
  - - [512, 128, 1, 128, 512, 512, 512, 128]
    - [73, 2.1]
  - - [512, 128, 1, 256, 512, 512, 512, 128]
    - [73, 3.61]
  - - [512, 128, 1, 512, 512, 512, 512, 128]
    - [120, 5.89]
  - - [512, 128, 1, 1024, 512, 512, 512, 128]
    - [121, 8.8]
  - - [512, 128, 1, 2048, 512, 512, 512, 128]
    - [121, 11.73]
  - - [512, 128, 1, 4096, 512, 512, 512, 128]
    - [121, 14.04]
  - - [512, 128, 1, 8192, 512, 512, 512, 128]
    - [133, 15.16]
  - - [512, 256, 1, 128, 512, 512, 512, 256]
    - [74, 3.98]
  - - [512, 256, 1, 256, 512, 512, 512, 256]
    - [74, 7.03]
  - - [512, 256, 1, 512, 512, 512, 512, 256]
    - [119, 11.55]
  - - [512, 256, 1, 1024, 512, 512, 512, 256]
    - [119, 17.24]
  - - [512, 256, 1, 2048, 512, 512, 512, 256]
    - [119, 22.98]
  - - [512, 256, 1, 4096, 512, 512, 512, 256]
    - [121, 27.74]
  - - [512, 256, 1, 8192, 512, 512, 512, 256]
    - [131, 28.15]
  - - [512, 512, 1, 128, 512, 512, 512, 512]
    - [71, 7.59]
  - - [512, 512, 1, 256, 512, 512, 512, 512]
    - [71, 13.1]
  - - [512, 512, 1, 512, 512, 512, 512, 512]
    - [113, 21.29]
  - - [512, 512, 1, 1024, 512, 512, 512, 512]
    - [116, 30.74]
  - - [512, 512, 1, 2048, 512, 512, 512, 512]
    - [127, 40.85]
  - - [512, 512, 1, 4096, 512, 512, 512, 512]
    - [127, 47.12]
  - - [512, 512, 1, 8192, 512, 512, 512, 512]
    - [116, 50.67]
  - - [512, 1024, 1, 128, 512, 512, 512, 1024]
    - [63, 13.86]
  - - [512, 1024, 1, 256, 512, 512, 512, 1024]
    - [63, 23.89]
  - - [512, 1024, 1, 512, 512, 512, 512, 1024]
    - [99, 37.45]
  - - [512, 1024, 1, 1024, 512, 512, 512, 1024]
    - [101, 53.84]
  - - [512, 1024, 1, 2048, 512, 512, 512, 1024]
    - [101, 69.59]
  - - [512, 1024, 1, 4096, 512, 512, 512, 1024]
    - [101, 76.91]
  - - [512, 1024, 1, 8192, 512, 512, 512, 1024]
    - [99, 80.85]
  - - [512, 2048, 1, 128, 512, 512, 512, 2048]
    - [59, 23.32]
  - - [512, 2048, 1, 256, 512, 512, 512, 2048]
    - [59, 40.05]
  - - [512, 2048, 1, 512, 512, 512, 512, 2048]
    - [54, 62.49]
  - - [512, 2048, 1, 1024, 512, 512, 512, 2048]
    - [57, 87.67]
  - - [512, 2048, 1, 2048, 512, 512, 512, 2048]
    - [94, 107.3]
  - - [512, 2048, 1, 4096, 512, 512, 512, 2048]
    - [96, 124.03]
  - - [512, 2048, 1, 8192, 512, 512, 512, 2048]
    - [94, 127.74]
  - - [512, 4096, 1, 128, 512, 512, 512, 4096]
    - [39, 36.76]
  - - [512, 4096, 1, 256, 512, 512, 512, 4096]
    - [39, 61.6]
  - - [512, 4096, 1, 512, 512, 512, 512, 4096]
    - [46, 94.09]
  - - [512, 4096, 1, 1024, 512, 512, 512, 4096]
    - [91, 130.84]
  - - [512, 4096, 1, 2048, 512, 512, 512, 4096]
    - [46, 157.2]
  - - [512, 4096, 1, 4096, 512, 512, 512, 4096]
    - [45, 175.06]
  - - [512, 4096, 1, 8192, 512, 512, 512, 4096]
    - [45, 163.21]
  - - [512, 8192, 1, 128, 512, 512, 512, 8192]
    - [30, 53.87]
  - - [512, 8192, 1, 256, 512, 512, 512, 8192]
    - [31, 91.87]
  - - [512, 8192, 1, 512, 512, 512, 512, 8192]
    - [31, 138.98]
  - - [512, 8192, 1, 1024, 512, 512, 512, 8192]
    - [31, 182.09]
  - - [512, 8192, 1, 2048, 512, 512, 512, 8192]
    - [31, 221.85]
  - - [512, 8192, 1, 4096, 512, 512, 512, 8192]
    - [83, 230.41]
  - - [512, 8192, 1, 8192, 512, 512, 512, 8192]
    - [88, 212.24]
  - - [1024, 128, 1, 128, 1024, 1024, 1024, 128]
    - [75, 3.9]
  - - [1024, 128, 1, 256, 1024, 1024, 1024, 128]
    - [73, 6.99]
  - - [1024, 128, 1, 512, 1024, 1024, 1024, 128]
    - [73, 11.42]
  - - [1024, 128, 1, 1024, 1024, 1024, 1024, 128]
    - [120, 17.08]
  - - [1024, 128, 1, 2048, 1024, 1024, 1024, 128]
    - [121, 22.93]
  - - [1024, 128, 1, 4096, 1024, 1024, 1024, 128]
    - [131, 25.22]
  - - [1024, 128, 1, 8192, 1024, 1024, 1024, 128]
    - [133, 26.46]
  - - [1024, 256, 1, 128, 1024, 1024, 1024, 256]
    - [72, 7.48]
  - - [1024, 256, 1, 256, 1024, 1024, 1024, 256]
    - [71, 13.11]
  - - [1024, 256, 1, 512, 1024, 1024, 1024, 256]
    - [115, 20.93]
  - - [1024, 256, 1, 1024, 1024, 1024, 1024, 256]
    - [115, 30.78]
  - - [1024, 256, 1, 2048, 1024, 1024, 1024, 256]
    - [127, 40.53]
  - - [1024, 256, 1, 4096, 1024, 1024, 1024, 256]
    - [110, 46.26]
  - - [1024, 256, 1, 8192, 1024, 1024, 1024, 256]
    - [117, 49.35]
  - - [1024, 512, 1, 128, 1024, 1024, 1024, 512]
    - [63, 13.86]
  - - [1024, 512, 1, 256, 1024, 1024, 1024, 512]
    - [64, 23.7]
  - - [1024, 512, 1, 512, 1024, 1024, 1024, 512]
    - [65, 37.2]
  - - [1024, 512, 1, 1024, 1024, 1024, 1024, 512]
    - [100, 53.73]
  - - [1024, 512, 1, 2048, 1024, 1024, 1024, 512]
    - [100, 69.23]
  - - [1024, 512, 1, 4096, 1024, 1024, 1024, 512]
    - [107, 75.7]
  - - [1024, 512, 1, 8192, 1024, 1024, 1024, 512]
    - [104, 82.21]
  - - [1024, 1024, 1, 128, 1024, 1024, 1024, 1024]
    - [54, 23.49]
  - - [1024, 1024, 1, 256, 1024, 1024, 1024, 1024]
    - [55, 40.22]
  - - [1024, 1024, 1, 512, 1024, 1024, 1024, 1024]
    - [57, 62.56]
  - - [1024, 1024, 1, 1024, 1024, 1024, 1024, 1024]
    - [57, 88.16]
  - - [1024, 1024, 1, 2048, 1024, 1024, 1024, 1024]
    - [94, 108.72]
  - - [1024, 1024, 1, 4096, 1024, 1024, 1024, 1024]
    - [96, 123.59]
  - - [1024, 1024, 1, 8192, 1024, 1024, 1024, 1024]
    - [94, 127.75]
  - - [1024, 2048, 1, 128, 1024, 1024, 1024, 2048]
    - [39, 36.79]
  - - [1024, 2048, 1, 256, 1024, 1024, 1024, 2048]
    - [40, 61.23]
  - - [1024, 2048, 1, 512, 1024, 1024, 1024, 2048]
    - [46, 94.23]
  - - [1024, 2048, 1, 1024, 1024, 1024, 1024, 2048]
    - [46, 128.73]
  - - [1024, 2048, 1, 2048, 1024, 1024, 1024, 2048]
    - [46, 157.97]
  - - [1024, 2048, 1, 4096, 1024, 1024, 1024, 2048]
    - [46, 174.45]
  - - [1024, 2048, 1, 8192, 1024, 1024, 1024, 2048]
    - [48, 163.72]
  - - [1024, 4096, 1, 128, 1024, 1024, 1024, 4096]
    - [35, 56.33]
  - - [1024, 4096, 1, 256, 1024, 1024, 1024, 4096]
    - [37, 94.02]
  - - [1024, 4096, 1, 512, 1024, 1024, 1024, 4096]
    - [32, 139.53]
  - - [1024, 4096, 1, 1024, 1024, 1024, 1024, 4096]
    - [31, 188.0]
  - - [1024, 4096, 1, 2048, 1024, 1024, 1024, 4096]
    - [31, 227.37]
  - - [1024, 4096, 1, 4096, 1024, 1024, 1024, 4096]
    - [88, 224.88]
  - - [1024, 4096, 1, 8192, 1024, 1024, 1024, 4096]
    - [83, 211.16]
  - - [1024, 8192, 1, 128, 1024, 1024, 1024, 8192]
    - [27, 67.99]
  - - [1024, 8192, 1, 256, 1024, 1024, 1024, 8192]
    - [6, 113.27]
  - - [1024, 8192, 1, 512, 1024, 1024, 1024, 8192]
    - [7, 170.59]
  - - [1024, 8192, 1, 1024, 1024, 1024, 1024, 8192]
    - [5, 224.1]
  - - [1024, 8192, 1, 2048, 1024, 1024, 1024, 8192]
    - [77, 252.55]
  - - [1024, 8192, 1, 4096, 1024, 1024, 1024, 8192]
    - [7, 246.53]
  - - [1024, 8192, 1, 8192, 1024, 1024, 1024, 8192]
    - [78, 261.3]
  - - [2048, 128, 1, 128, 2048, 2048, 2048, 128]
    - [71, 7.59]
  - - [2048, 128, 1, 256, 2048, 2048, 2048, 128]
    - [71, 13.17]
  - - [2048, 128, 1, 512, 2048, 2048, 2048, 128]
    - [112, 20.99]
  - - [2048, 128, 1, 1024, 2048, 2048, 2048, 128]
    - [115, 30.79]
  - - [2048, 128, 1, 2048, 2048, 2048, 2048, 128]
    - [110, 37.85]
  - - [2048, 128, 1, 4096, 2048, 2048, 2048, 128]
    - [109, 45.47]
  - - [2048, 128, 1, 8192, 2048, 2048, 2048, 128]
    - [110, 50.7]
  - - [2048, 256, 1, 128, 2048, 2048, 2048, 256]
    - [70, 13.71]
  - - [2048, 256, 1, 256, 2048, 2048, 2048, 256]
    - [68, 23.31]
  - - [2048, 256, 1, 512, 2048, 2048, 2048, 256]
    - [69, 36.94]
  - - [2048, 256, 1, 1024, 2048, 2048, 2048, 256]
    - [105, 53.82]
  - - [2048, 256, 1, 2048, 2048, 2048, 2048, 256]
    - [102, 67.63]
  - - [2048, 256, 1, 4096, 2048, 2048, 2048, 256]
    - [104, 78.27]
  - - [2048, 256, 1, 8192, 2048, 2048, 2048, 256]
    - [108, 85.97]
  - - [2048, 512, 1, 128, 2048, 2048, 2048, 512]
    - [53, 23.46]
  - - [2048, 512, 1, 256, 2048, 2048, 2048, 512]
    - [56, 39.7]
  - - [2048, 512, 1, 512, 2048, 2048, 2048, 512]
    - [54, 62.31]
  - - [2048, 512, 1, 1024, 2048, 2048, 2048, 512]
    - [57, 86.84]
  - - [2048, 512, 1, 2048, 2048, 2048, 2048, 512]
    - [95, 107.19]
  - - [2048, 512, 1, 4096, 2048, 2048, 2048, 512]
    - [97, 123.7]
  - - [2048, 512, 1, 8192, 2048, 2048, 2048, 512]
    - [96, 129.93]
  - - [2048, 1024, 1, 128, 2048, 2048, 2048, 1024]
    - [89, 36.62]
  - - [2048, 1024, 1, 256, 2048, 2048, 2048, 1024]
    - [39, 61.86]
  - - [2048, 1024, 1, 512, 2048, 2048, 2048, 1024]
    - [91, 94.51]
  - - [2048, 1024, 1, 1024, 2048, 2048, 2048, 1024]
    - [45, 127.57]
  - - [2048, 1024, 1, 2048, 2048, 2048, 2048, 1024]
    - [52, 157.17]
  - - [2048, 1024, 1, 4096, 2048, 2048, 2048, 1024]
    - [50, 174.9]
  - - [2048, 1024, 1, 8192, 2048, 2048, 2048, 1024]
    - [52, 164.9]
  - - [2048, 2048, 1, 128, 2048, 2048, 2048, 2048]
    - [31, 53.25]
  - - [2048, 2048, 1, 256, 2048, 2048, 2048, 2048]
    - [31, 90.83]
  - - [2048, 2048, 1, 512, 2048, 2048, 2048, 2048]
    - [31, 137.66]
  - - [2048, 2048, 1, 1024, 2048, 2048, 2048, 2048]
    - [31, 186.63]
  - - [2048, 2048, 1, 2048, 2048, 2048, 2048, 2048]
    - [32, 221.0]
  - - [2048, 2048, 1, 4096, 2048, 2048, 2048, 2048]
    - [20, 226.33]
  - - [2048, 2048, 1, 8192, 2048, 2048, 2048, 2048]
    - [85, 212.96]
  - - [2048, 4096, 1, 128, 2048, 2048, 2048, 4096]
    - [4, 65.21]
  - - [2048, 4096, 1, 256, 2048, 2048, 2048, 4096]
    - [4, 107.88]
  - - [2048, 4096, 1, 512, 2048, 2048, 2048, 4096]
    - [5, 162.82]
  - - [2048, 4096, 1, 1024, 2048, 2048, 2048, 4096]
    - [5, 217.85]
  - - [2048, 4096, 1, 2048, 2048, 2048, 2048, 4096]
    - [16, 251.9]
  - - [2048, 4096, 1, 4096, 2048, 2048, 2048, 4096]
    - [16, 242.0]
  - - [2048, 4096, 1, 8192, 2048, 2048, 2048, 4096]
    - [16, 261.14]
  - - [2048, 8192, 1, 128, 2048, 2048, 2048, 8192]
    - [25, 71.13]
  - - [2048, 8192, 1, 256, 2048, 2048, 2048, 8192]
    - [0, 118.03]
  - - [2048, 8192, 1, 512, 2048, 2048, 2048, 8192]
    - [0, 175.21]
  - - [2048, 8192, 1, 1024, 2048, 2048, 2048, 8192]
    - [0, 212.97]
  - - [2048, 8192, 1, 2048, 2048, 2048, 2048, 8192]
    - [22, 227.36]
  - - [2048, 8192, 1, 4096, 2048, 2048, 2048, 8192]
    - [9, 267.46]
  - - [2048, 8192, 1, 8192, 2048, 2048, 2048, 8192]
    - [10, 324.02]
  - - [4096, 128, 1, 128, 4096, 4096, 4096, 128]
    - [63, 14.29]
  - - [4096, 128, 1, 256, 4096, 4096, 4096, 128]
    - [66, 23.14]
  - - [4096, 128, 1, 512, 4096, 4096, 4096, 128]
    - [67, 36.98]
  - - [4096, 128, 1, 1024, 4096, 4096, 4096, 128]
    - [100, 54.21]
  - - [4096, 128, 1, 2048, 4096, 4096, 4096, 128]
    - [106, 65.89]
  - - [4096, 128, 1, 4096, 4096, 4096, 4096, 128]
    - [103, 77.89]
  - - [4096, 128, 1, 8192, 4096, 4096, 4096, 128]
    - [106, 85.36]
  - - [4096, 256, 1, 128, 4096, 4096, 4096, 256]
    - [44, 21.66]
  - - [4096, 256, 1, 256, 4096, 4096, 4096, 256]
    - [61, 40.46]
  - - [4096, 256, 1, 512, 4096, 4096, 4096, 256]
    - [56, 62.32]
  - - [4096, 256, 1, 1024, 4096, 4096, 4096, 256]
    - [57, 86.66]
  - - [4096, 256, 1, 2048, 4096, 4096, 4096, 256]
    - [97, 107.23]
  - - [4096, 256, 1, 4096, 4096, 4096, 4096, 256]
    - [96, 125.43]
  - - [4096, 256, 1, 8192, 4096, 4096, 4096, 256]
    - [96, 128.22]
  - - [4096, 512, 1, 128, 4096, 4096, 4096, 512]
    - [39, 36.56]
  - - [4096, 512, 1, 256, 4096, 4096, 4096, 512]
    - [41, 61.3]
  - - [4096, 512, 1, 512, 4096, 4096, 4096, 512]
    - [90, 92.94]
  - - [4096, 512, 1, 1024, 4096, 4096, 4096, 512]
    - [49, 126.97]
  - - [4096, 512, 1, 2048, 4096, 4096, 4096, 512]
    - [47, 155.75]
  - - [4096, 512, 1, 4096, 4096, 4096, 4096, 512]
    - [51, 174.5]
  - - [4096, 512, 1, 8192, 4096, 4096, 4096, 512]
    - [52, 165.07]
  - - [4096, 1024, 1, 128, 4096, 4096, 4096, 1024]
    - [28, 53.99]
  - - [4096, 1024, 1, 256, 4096, 4096, 4096, 1024]
    - [31, 90.68]
  - - [4096, 1024, 1, 512, 4096, 4096, 4096, 1024]
    - [37, 135.85]
  - - [4096, 1024, 1, 1024, 4096, 4096, 4096, 1024]
    - [37, 183.08]
  - - [4096, 1024, 1, 2048, 4096, 4096, 4096, 1024]
    - [37, 220.79]
  - - [4096, 1024, 1, 4096, 4096, 4096, 4096, 1024]
    - [19, 227.14]
  - - [4096, 1024, 1, 8192, 4096, 4096, 4096, 1024]
    - [87, 215.66]
  - - [4096, 2048, 1, 128, 4096, 4096, 4096, 2048]
    - [5, 61.09]
  - - [4096, 2048, 1, 256, 4096, 4096, 4096, 2048]
    - [13, 103.74]
  - - [4096, 2048, 1, 512, 4096, 4096, 4096, 2048]
    - [16, 159.94]
  - - [4096, 2048, 1, 1024, 4096, 4096, 4096, 2048]
    - [6, 216.4]
  - - [4096, 2048, 1, 2048, 4096, 4096, 4096, 2048]
    - [6, 248.06]
  - - [4096, 2048, 1, 4096, 4096, 4096, 4096, 2048]
    - [79, 243.98]
  - - [4096, 2048, 1, 8192, 4096, 4096, 4096, 2048]
    - [86, 262.71]
  - - [4096, 4096, 1, 128, 4096, 4096, 4096, 4096]
    - [2, 66.97]
  - - [4096, 4096, 1, 256, 4096, 4096, 4096, 4096]
    - [0, 113.97]
  - - [4096, 4096, 1, 512, 4096, 4096, 4096, 4096]
    - [5, 171.59]
  - - [4096, 4096, 1, 1024, 4096, 4096, 4096, 4096]
    - [14, 209.0]
  - - [4096, 4096, 1, 2048, 4096, 4096, 4096, 4096]
    - [81, 221.76]
  - - [4096, 4096, 1, 4096, 4096, 4096, 4096, 4096]
    - [8, 272.34]
  - - [4096, 4096, 1, 8192, 4096, 4096, 4096, 4096]
    - [11, 325.04]
  - - [4096, 8192, 1, 128, 4096, 4096, 4096, 8192]
    - [26, 75.16]
  - - [4096, 8192, 1, 256, 4096, 4096, 4096, 8192]
    - [25, 119.61]
  - - [4096, 8192, 1, 512, 4096, 4096, 4096, 8192]
    - [23, 172.06]
  - - [4096, 8192, 1, 1024, 4096, 4096, 4096, 8192]
    - [33, 207.65]
  - - [4096, 8192, 1, 2048, 4096, 4096, 4096, 8192]
    - [15, 262.91]
  - - [4096, 8192, 1, 4096, 4096, 4096, 4096, 8192]
    - [5, 302.25]
  - - [4096, 8192, 1, 8192, 4096, 4096, 4096, 8192]
    - [77, 343.13]
  - - [8192, 128, 1, 128, 8192, 8192, 8192, 128]
    - [43, 23.26]
  - - [8192, 128, 1, 256, 8192, 8192, 8192, 128]
    - [58, 39.82]
  - - [8192, 128, 1, 512, 8192, 8192, 8192, 128]
    - [61, 61.44]
  - - [8192, 128, 1, 1024, 8192, 8192, 8192, 128]
    - [57, 85.13]
  - - [8192, 128, 1, 2048, 8192, 8192, 8192, 128]
    - [95, 105.48]
  - - [8192, 128, 1, 4096, 8192, 8192, 8192, 128]
    - [95, 123.98]
  - - [8192, 128, 1, 8192, 8192, 8192, 8192, 128]
    - [97, 126.76]
  - - [8192, 256, 1, 128, 8192, 8192, 8192, 256]
    - [38, 35.46]
  - - [8192, 256, 1, 256, 8192, 8192, 8192, 256]
    - [42, 59.55]
  - - [8192, 256, 1, 512, 8192, 8192, 8192, 256]
    - [92, 92.14]
  - - [8192, 256, 1, 1024, 8192, 8192, 8192, 256]
    - [93, 127.49]
  - - [8192, 256, 1, 2048, 8192, 8192, 8192, 256]
    - [50, 154.56]
  - - [8192, 256, 1, 4096, 8192, 8192, 8192, 256]
    - [52, 174.32]
  - - [8192, 256, 1, 8192, 8192, 8192, 8192, 256]
    - [50, 164.23]
  - - [8192, 512, 1, 128, 8192, 8192, 8192, 512]
    - [30, 52.16]
  - - [8192, 512, 1, 256, 8192, 8192, 8192, 512]
    - [31, 88.69]
  - - [8192, 512, 1, 512, 8192, 8192, 8192, 512]
    - [34, 133.5]
  - - [8192, 512, 1, 1024, 8192, 8192, 8192, 512]
    - [37, 181.57]
  - - [8192, 512, 1, 2048, 8192, 8192, 8192, 512]
    - [32, 220.49]
  - - [8192, 512, 1, 4096, 8192, 8192, 8192, 512]
    - [84, 228.79]
  - - [8192, 512, 1, 8192, 8192, 8192, 8192, 512]
    - [88, 213.63]
  - - [8192, 1024, 1, 128, 8192, 8192, 8192, 1024]
    - [10, 62.06]
  - - [8192, 1024, 1, 256, 8192, 8192, 8192, 1024]
    - [13, 105.23]
  - - [8192, 1024, 1, 512, 8192, 8192, 8192, 1024]
    - [7, 159.57]
  - - [8192, 1024, 1, 1024, 8192, 8192, 8192, 1024]
    - [12, 214.44]
  - - [8192, 1024, 1, 2048, 8192, 8192, 8192, 1024]
    - [12, 249.16]
  - - [8192, 1024, 1, 4096, 8192, 8192, 8192, 1024]
    - [16, 244.36]
  - - [8192, 1024, 1, 8192, 8192, 8192, 8192, 1024]
    - [18, 272.13]
  - - [8192, 2048, 1, 128, 8192, 8192, 8192, 2048]
    - [28, 65.31]
  - - [8192, 2048, 1, 256, 8192, 8192, 8192, 2048]
    - [5, 111.95]
  - - [8192, 2048, 1, 512, 8192, 8192, 8192, 2048]
    - [5, 165.71]
  - - [8192, 2048, 1, 1024, 8192, 8192, 8192, 2048]
    - [5, 204.55]
  - - [8192, 2048, 1, 2048, 8192, 8192, 8192, 2048]
    - [17, 224.47]
  - - [8192, 2048, 1, 4096, 8192, 8192, 8192, 2048]
    - [11, 276.92]
  - - [8192, 2048, 1, 8192, 8192, 8192, 8192, 2048]
    - [77, 325.86]
  - - [8192, 4096, 1, 128, 8192, 8192, 8192, 4096]
    - [4, 70.91]
  - - [8192, 4096, 1, 256, 8192, 8192, 8192, 4096]
    - [5, 118.65]
  - - [8192, 4096, 1, 512, 8192, 8192, 8192, 4096]
    - [21, 170.37]
  - - [8192, 4096, 1, 1024, 8192, 8192, 8192, 4096]
    - [36, 208.9]
  - - [8192, 4096, 1, 2048, 8192, 8192, 8192, 4096]
    - [11, 263.82]
  - - [8192, 4096, 1, 4096, 8192, 8192, 8192, 4096]
    - [5, 290.24]
  - - [8192, 4096, 1, 8192, 8192, 8192, 8192, 4096]
    - [82, 326.41]
  - - [8192, 8192, 1, 128, 8192, 8192, 8192, 8192]
    - [24, 68.25]
  - - [8192, 8192, 1, 256, 8192, 8192, 8192, 8192]
    - [29, 115.63]
  - - [8192, 8192, 1, 512, 8192, 8192, 8192, 8192]
    - [3, 170.93]
  - - [8192, 8192, 1, 1024, 8192, 8192, 8192, 8192]
    - [1, 232.15]
  - - [8192, 8192, 1, 2048, 8192, 8192, 8192, 8192]
    - [80, 294.55]
  - - [8192, 8192, 1, 4096, 8192, 8192, 8192, 8192]
    - [79, 337.07]
  - - [8192, 8192, 1, 8192, 8192, 8192, 8192, 8192]
    - [1, 349.11]
- null
- null
- ExperimentalStreamK
- GridBased
