projects/hipblaslt/library/src/amd_detail/rocblaslt/src/Tensile/Logic/asm_full/aquavanjaram/gfx942_228cu/StreamK/aquavanjaram942_Cijk_Ailk_Bjlk_F8NB8NS_BH_Bias_HAS_SAV_UserArgs.yaml
- {MinimumRequiredVersion: 4.33.0}
- aquavanjaram942
- {Architecture: gfx942, CUCount: 228}
- [Device 0049, Device 0050]
    SolutionIndex: 0
    SolutionNameMin: Cijk_Ailk_Bjlk_F8NB8NS_BH_Bias_HAS_SAV_UserArgs_MT256x256x64_MI16x16x1_SN_LDSB0_CLR1_GRVWA16_GRVWB4_GSU0_GSUC0_GSUWGMRR0_K1_LBSPPA2048_LBSPPB2048_LPA0_LPB0_MIWT8_8_PLR1_SU0_SUM0_SUS64_VWA8_VWB8_WGM1_WGMXCC1_WGMXCCGn1
    SolutionIndex: 1
    SolutionNameMin: Cijk_Ailk_Bjlk_F8NB8NS_BH_Bias_HAS_SAV_UserArgs_MT256x256x64_MI16x16x1_SN_LDSB0_CLR1_GRVWA4_GRVWB8_GSU0_GSUC0_GSUWGMRR0_K1_LBSPPA2048_LBSPPB2048_LPA0_LPB0_MIWT8_8_PLR1_SU0_SUM0_SUS64_VWA8_VWB8_WGM1_WGMXCC1_WGMXCCGn1
    SolutionIndex: 2
    SolutionNameMin: Cijk_Ailk_Bjlk_F8NB8NS_BH_Bias_HAS_SAV_UserArgs_MT256x256x64_MI16x16x1_SN_LDSB0_CLR1_GRVWA4_GRVWB16_GSU0_GSUC0_GSUWGMRR0_K1_LBSPPA2048_LBSPPB2048_LPA0_LPB0_MIWT8_8_PLR1_SU0_SUM0_SUS64_VWA8_VWB8_WGM1_WGMXCC1_WGMXCCGn1
    SolutionIndex: 3
    SolutionNameMin: Cijk_Ailk_Bjlk_F8NB8NS_BH_Bias_HAS_SAV_UserArgs_MT256x256x64_MI16x16x1_SN_LDSB0_CLR1_GRVWA16_GRVWB16_GSU0_GSUC0_GSUWGMRR0_K1_LBSPPA2048_LBSPPB2048_LPA0_LPB0_MIWT8_8_PLR1_SU0_SUM0_SUS64_VWA8_VWB8_WGM1_WGMXCC1_WGMXCCGn1
    SolutionIndex: 4
    SolutionNameMin: Cijk_Ailk_Bjlk_F8NB8NS_BH_Bias_HAS_SAV_UserArgs_MT256x256x64_MI16x16x1_SN_LDSB0_CLR1_GRVWA16_GRVWB4_GSU0_GSUC0_GSUWGMRR0_K1_LBSPPA2048_LBSPPB2048_LPA0_LPB0_MIWT8_8_PLR1_SU0_SUM0_SUS64_VWA8_VWB8_WGM4_WGMXCC1_WGMXCCGn1
    SolutionIndex: 5
    SolutionNameMin: Cijk_Ailk_Bjlk_F8NB8NS_BH_Bias_HAS_SAV_UserArgs_MT256x256x64_MI16x16x1_SN_LDSB0_CLR1_GRVWA4_GRVWB8_GSU0_GSUC0_GSUWGMRR0_K1_LBSPPA2048_LBSPPB2048_LPA0_LPB0_MIWT8_8_PLR1_SU0_SUM0_SUS64_VWA8_VWB8_WGM4_WGMXCC1_WGMXCCGn1
    SolutionIndex: 6
    SolutionNameMin: Cijk_Ailk_Bjlk_F8NB8NS_BH_Bias_HAS_SAV_UserArgs_MT256x256x64_MI16x16x1_SN_LDSB0_CLR1_GRVWA16_GRVWB8_GSU0_GSUC0_GSUWGMRR0_K1_LBSPPA2048_LBSPPB2048_LPA0_LPB0_MIWT8_8_PLR1_SU0_SUM0_SUS64_VWA8_VWB8_WGM4_WGMXCC1_WGMXCCGn1
    SolutionIndex: 7
    SolutionNameMin: Cijk_Ailk_Bjlk_F8NB8NS_BH_Bias_HAS_SAV_UserArgs_MT256x256x64_MI16x16x1_SN_LDSB0_CLR1_GRVWA16_GRVWB16_GSU0_GSUC0_GSUWGMRR0_K1_LBSPPA2048_LBSPPB2048_LPA0_LPB0_MIWT8_8_PLR1_SU0_SUM0_SUS64_VWA8_VWB8_WGM4_WGMXCC1_WGMXCCGn1
    SolutionIndex: 8
    SolutionNameMin: Cijk_Ailk_Bjlk_F8NB8NS_BH_Bias_HAS_SAV_UserArgs_MT256x256x64_MI16x16x1_SN_LDSB0_CLR1_GRVWA4_GRVWB4_GSU0_GSUC0_GSUWGMRR0_K1_LBSPPA2048_LBSPPB2048_LPA0_LPB0_MIWT8_8_PLR1_SU0_SUM0_SUS64_VWA8_VWB8_WGM6_WGMXCC1_WGMXCCGn1
    SolutionIndex: 9
    SolutionNameMin: Cijk_Ailk_Bjlk_F8NB8NS_BH_Bias_HAS_SAV_UserArgs_MT256x256x64_MI16x16x1_SN_LDSB0_CLR1_GRVWA16_GRVWB4_GSU0_GSUC0_GSUWGMRR0_K1_LBSPPA2048_LBSPPB2048_LPA0_LPB0_MIWT8_8_PLR1_SU0_SUM0_SUS64_VWA8_VWB8_WGM6_WGMXCC1_WGMXCCGn1
    SolutionIndex: 10
    SolutionNameMin: Cijk_Ailk_Bjlk_F8NB8NS_BH_Bias_HAS_SAV_UserArgs_MT256x256x64_MI16x16x1_SN_LDSB0_CLR1_GRVWA4_GRVWB16_GSU0_GSUC0_GSUWGMRR0_K1_LBSPPA2048_LBSPPB2048_LPA0_LPB0_MIWT8_8_PLR1_SU0_SUM0_SUS64_VWA8_VWB8_WGM6_WGMXCC1_WGMXCCGn1
    SolutionIndex: 11
    SolutionNameMin: Cijk_Ailk_Bjlk_F8NB8NS_BH_Bias_HAS_SAV_UserArgs_MT256x256x64_MI16x16x1_SN_LDSB0_CLR1_GRVWA16_GRVWB16_GSU0_GSUC0_GSUWGMRR0_K1_LBSPPA2048_LBSPPB2048_LPA0_LPB0_MIWT8_8_PLR1_SU0_SUM0_SUS64_VWA8_VWB8_WGM6_WGMXCC1_WGMXCCGn1
    SolutionIndex: 12
    SolutionNameMin: Cijk_Ailk_Bjlk_F8NB8NS_BH_Bias_HAS_SAV_UserArgs_MT256x256x64_MI16x16x1_SN_LDSB0_CLR1_GRVWA16_GRVWB4_GSU0_GSUC0_GSUWGMRR0_K1_LBSPPA2048_LBSPPB2048_LPA0_LPB0_MIWT8_8_PLR1_SU0_SUM0_SUS64_VWA8_VWB8_WGM8_WGMXCC1_WGMXCCGn1
    SolutionIndex: 13
    SolutionNameMin: Cijk_Ailk_Bjlk_F8NB8NS_BH_Bias_HAS_SAV_UserArgs_MT256x256x64_MI16x16x1_SN_LDSB0_CLR1_GRVWA4_GRVWB8_GSU0_GSUC0_GSUWGMRR0_K1_LBSPPA2048_LBSPPB2048_LPA0_LPB0_MIWT8_8_PLR1_SU0_SUM0_SUS64_VWA8_VWB8_WGM8_WGMXCC1_WGMXCCGn1
    SolutionIndex: 14
    SolutionNameMin: Cijk_Ailk_Bjlk_F8NB8NS_BH_Bias_HAS_SAV_UserArgs_MT256x256x64_MI16x16x1_SN_LDSB0_CLR1_GRVWA4_GRVWB16_GSU0_GSUC0_GSUWGMRR0_K1_LBSPPA2048_LBSPPB2048_LPA0_LPB0_MIWT8_8_PLR1_SU0_SUM0_SUS64_VWA8_VWB8_WGM8_WGMXCC1_WGMXCCGn1
    SolutionIndex: 15
    SolutionNameMin: Cijk_Ailk_Bjlk_F8NB8NS_BH_Bias_HAS_SAV_UserArgs_MT256x256x64_MI16x16x1_SN_LDSB0_CLR1_GRVWA16_GRVWB16_GSU0_GSUC0_GSUWGMRR0_K1_LBSPPA2048_LBSPPB2048_LPA0_LPB0_MIWT8_8_PLR1_SU0_SUM0_SUS64_VWA8_VWB8_WGM8_WGMXCC1_WGMXCCGn1
    SolutionIndex: 16
    SolutionNameMin: Cijk_Ailk_Bjlk_F8NB8NS_BH_Bias_HAS_SAV_UserArgs_MT128x256x64_MI16x16x1_SN_LDSB1_CLR1_GRVWA4_GRVWB8_GSU0_GSUC0_GSUWGMRR0_K1_LBSPPA1024_LBSPPB2048_LPA64_LPB0_MIWT4_8_PLR1_SU0_SUM0_SUS64_VWA4_VWB8_WGM1_WGMXCC1_WGMXCCGn1
    SolutionIndex: 17
    SolutionNameMin: Cijk_Ailk_Bjlk_F8NB8NS_BH_Bias_HAS_SAV_UserArgs_MT128x256x64_MI16x16x1_SN_LDSB1_CLR1_GRVWA8_GRVWB16_GSU0_GSUC0_GSUWGMRR0_K1_LBSPPA1024_LBSPPB2048_LPA64_LPB0_MIWT4_8_PLR1_SU0_SUM0_SUS64_VWA4_VWB8_WGM1_WGMXCC1_WGMXCCGn1
    SolutionIndex: 18
    SolutionNameMin: Cijk_Ailk_Bjlk_F8NB8NS_BH_Bias_HAS_SAV_UserArgs_MT128x256x64_MI16x16x1_SN_LDSB1_CLR1_GRVWA16_GRVWB16_GSU0_GSUC0_GSUWGMRR0_K1_LBSPPA1024_LBSPPB2048_LPA64_LPB0_MIWT4_8_PLR1_SU0_SUM0_SUS64_VWA4_VWB8_WGM1_WGMXCC1_WGMXCCGn1
    SolutionIndex: 19
    SolutionNameMin: Cijk_Ailk_Bjlk_F8NB8NS_BH_Bias_HAS_SAV_UserArgs_MT128x256x64_MI16x16x1_SN_LDSB1_CLR1_GRVWA16_GRVWB16_GSU0_GSUC0_GSUWGMRR0_K1_LBSPPA1024_LBSPPB2048_LPA64_LPB0_MIWT4_8_PLR1_SU0_SUM0_SUS64_VWA4_VWB8_WGM4_WGMXCC1_WGMXCCGn1
    SolutionIndex: 20
    SolutionNameMin: Cijk_Ailk_Bjlk_F8NB8NS_BH_Bias_HAS_SAV_UserArgs_MT128x256x64_MI16x16x1_SN_LDSB1_CLR1_GRVWA16_GRVWB8_GSU0_GSUC0_GSUWGMRR0_K1_LBSPPA1024_LBSPPB2048_LPA64_LPB0_MIWT4_8_PLR1_SU0_SUM0_SUS64_VWA4_VWB8_WGM6_WGMXCC1_WGMXCCGn1
    SolutionIndex: 21
    SolutionNameMin: Cijk_Ailk_Bjlk_F8NB8NS_BH_Bias_HAS_SAV_UserArgs_MT128x256x64_MI16x16x1_SN_LDSB1_CLR1_GRVWA8_GRVWB16_GSU0_GSUC0_GSUWGMRR0_K1_LBSPPA1024_LBSPPB2048_LPA64_LPB0_MIWT4_8_PLR1_SU0_SUM0_SUS64_VWA4_VWB8_WGM6_WGMXCC1_WGMXCCGn1
    SolutionIndex: 22
    SolutionNameMin: Cijk_Ailk_Bjlk_F8NB8NS_BH_Bias_HAS_SAV_UserArgs_MT128x256x64_MI16x16x1_SN_LDSB1_CLR1_GRVWA4_GRVWB8_GSU0_GSUC0_GSUWGMRR0_K1_LBSPPA1024_LBSPPB2048_LPA64_LPB0_MIWT4_8_PLR1_SU0_SUM0_SUS64_VWA4_VWB8_WGM8_WGMXCC1_WGMXCCGn1
    SolutionIndex: 23
    SolutionNameMin: Cijk_Ailk_Bjlk_F8NB8NS_BH_Bias_HAS_SAV_UserArgs_MT256x144x64_MI16x16x1_SN_LDSB0_CLR1_GRVWA4_GRVWB4_GSU0_GSUC0_GSUWGMRR0_K1_LBSPPA2048_LBSPPB1152_LPA64_LPB16_MIWT4_9_PLR1_SU0_SUM0_SUS64_VWA4_VWB1_WGM1_WGMXCC1_WGMXCCGn1
    SolutionIndex: 24
    SolutionNameMin: Cijk_Ailk_Bjlk_F8NB8NS_BH_Bias_HAS_SAV_UserArgs_MT256x144x64_MI16x16x1_SN_LDSB0_CLR1_GRVWA16_GRVWB4_GSU0_GSUC0_GSUWGMRR0_K1_LBSPPA2048_LBSPPB1152_LPA64_LPB16_MIWT4_9_PLR1_SU0_SUM0_SUS64_VWA4_VWB1_WGM1_WGMXCC1_WGMXCCGn1
    SolutionIndex: 25
    SolutionNameMin: Cijk_Ailk_Bjlk_F8NB8NS_BH_Bias_HAS_SAV_UserArgs_MT256x144x64_MI16x16x1_SN_LDSB0_CLR1_GRVWA16_GRVWB4_GSU0_GSUC0_GSUWGMRR0_K1_LBSPPA2048_LBSPPB1152_LPA64_LPB16_MIWT4_9_PLR1_SU0_SUM0_SUS64_VWA4_VWB1_WGM4_WGMXCC1_WGMXCCGn1
    SolutionIndex: 26
    SolutionNameMin: Cijk_Ailk_Bjlk_F8NB8NS_BH_Bias_HAS_SAV_UserArgs_MT256x144x64_MI16x16x1_SN_LDSB0_CLR1_GRVWA4_GRVWB4_GSU0_GSUC0_GSUWGMRR0_K1_LBSPPA2048_LBSPPB1152_LPA64_LPB16_MIWT4_9_PLR1_SU0_SUM0_SUS64_VWA4_VWB1_WGM6_WGMXCC1_WGMXCCGn1
    SolutionIndex: 27
    SolutionNameMin: Cijk_Ailk_Bjlk_F8NB8NS_BH_Bias_HAS_SAV_UserArgs_MT256x144x64_MI16x16x1_SN_LDSB0_CLR1_GRVWA16_GRVWB4_GSU0_GSUC0_GSUWGMRR0_K1_LBSPPA2048_LBSPPB1152_LPA64_LPB16_MIWT4_9_PLR1_SU0_SUM0_SUS64_VWA4_VWB1_WGM6_WGMXCC1_WGMXCCGn1
    SolutionIndex: 28
    SolutionNameMin: Cijk_Ailk_Bjlk_F8NB8NS_BH_Bias_HAS_SAV_UserArgs_MT256x144x64_MI16x16x1_SN_LDSB0_CLR1_GRVWA4_GRVWB4_GSU0_GSUC0_GSUWGMRR0_K1_LBSPPA2048_LBSPPB1152_LPA64_LPB16_MIWT4_9_PLR1_SU0_SUM0_SUS64_VWA4_VWB1_WGM8_WGMXCC1_WGMXCCGn1
    SolutionIndex: 29
    SolutionNameMin: Cijk_Ailk_Bjlk_F8NB8NS_BH_Bias_HAS_SAV_UserArgs_MT256x128x64_MI16x16x1_SN_LDSB1_CLR1_GRVWA4_GRVWB8_GSU0_GSUC0_GSUWGMRR0_K1_LBSPPA2048_LBSPPB1024_LPA0_LPB64_MIWT8_4_PLR1_SU0_SUM0_SUS64_VWA8_VWB4_WGM1_WGMXCC1_WGMXCCGn1
    SolutionIndex: 30
    SolutionNameMin: Cijk_Ailk_Bjlk_F8NB8NS_BH_Bias_HAS_SAV_UserArgs_MT256x128x64_MI16x16x1_SN_LDSB1_CLR1_GRVWA16_GRVWB16_GSU0_GSUC0_GSUWGMRR0_K1_LBSPPA2048_LBSPPB1024_LPA0_LPB64_MIWT8_4_PLR1_SU0_SUM0_SUS64_VWA8_VWB4_WGM1_WGMXCC1_WGMXCCGn1
    SolutionIndex: 31
    SolutionNameMin: Cijk_Ailk_Bjlk_F8NB8NS_BH_Bias_HAS_SAV_UserArgs_MT256x128x64_MI16x16x1_SN_LDSB1_CLR1_GRVWA16_GRVWB16_GSU0_GSUC0_GSUWGMRR0_K1_LBSPPA2048_LBSPPB1024_LPA0_LPB64_MIWT8_4_PLR1_SU0_SUM0_SUS64_VWA8_VWB4_WGM4_WGMXCC1_WGMXCCGn1
    SolutionIndex: 32
    SolutionNameMin: Cijk_Ailk_Bjlk_F8NB8NS_BH_Bias_HAS_SAV_UserArgs_MT256x128x64_MI16x16x1_SN_LDSB1_CLR1_GRVWA16_GRVWB16_GSU0_GSUC0_GSUWGMRR0_K1_LBSPPA2048_LBSPPB1024_LPA0_LPB64_MIWT8_4_PLR1_SU0_SUM0_SUS64_VWA8_VWB4_WGM6_WGMXCC1_WGMXCCGn1
    SolutionIndex: 33
    SolutionNameMin: Cijk_Ailk_Bjlk_F8NB8NS_BH_Bias_HAS_SAV_UserArgs_MT256x128x64_MI16x16x1_SN_LDSB1_CLR1_GRVWA16_GRVWB16_GSU0_GSUC0_GSUWGMRR0_K1_LBSPPA2048_LBSPPB1024_LPA0_LPB64_MIWT8_4_PLR1_SU0_SUM0_SUS64_VWA8_VWB4_WGM8_WGMXCC1_WGMXCCGn1
    SolutionIndex: 34
    SolutionNameMin: Cijk_Ailk_Bjlk_F8NB8NS_BH_Bias_HAS_SAV_UserArgs_MT128x64x64_MI16x16x1_SN_LDSB0_CLR1_GRVWA4_GRVWB4_GSU0_GSUC0_GSUWGMRR0_K1_LBSPPA1024_LBSPPB512_LPA0_LPB16_MIWT8_1_PLR1_SU0_SUM0_SUS64_VWA8_VWB1_WGM1_WGMXCC1_WGMXCCGn1
    SolutionIndex: 35
    SolutionNameMin: Cijk_Ailk_Bjlk_F8NB8NS_BH_Bias_HAS_SAV_UserArgs_MT128x128x64_MI16x16x1_SN_LDSB1_CLR1_GRVWA16_GRVWB8_GSU0_GSUC0_GSUWGMRR0_K1_LBSPPA1024_LBSPPB1024_LPA64_LPB64_MIWT4_4_PLR1_SU0_SUM0_SUS64_VWA4_VWB4_WGM1_WGMXCC1_WGMXCCGn1
    SolutionIndex: 36
    SolutionNameMin: Cijk_Ailk_Bjlk_F8NB8NS_BH_Bias_HAS_SAV_UserArgs_MT128x128x64_MI16x16x1_SN_LDSB1_CLR1_GRVWA4_GRVWB16_GSU0_GSUC0_GSUWGMRR0_K1_LBSPPA1024_LBSPPB1024_LPA64_LPB64_MIWT4_4_PLR1_SU0_SUM0_SUS64_VWA4_VWB4_WGM1_WGMXCC1_WGMXCCGn1
    SolutionIndex: 37
    SolutionNameMin: Cijk_Ailk_Bjlk_F8NB8NS_BH_Bias_HAS_SAV_UserArgs_MT128x128x64_MI16x16x1_SN_LDSB1_CLR1_GRVWA8_GRVWB16_GSU0_GSUC0_GSUWGMRR0_K1_LBSPPA1024_LBSPPB1024_LPA64_LPB64_MIWT4_4_PLR1_SU0_SUM0_SUS64_VWA4_VWB4_WGM1_WGMXCC1_WGMXCCGn1
    SolutionIndex: 38
    SolutionNameMin: Cijk_Ailk_Bjlk_F8NB8NS_BH_Bias_HAS_SAV_UserArgs_MT128x128x64_MI16x16x1_SN_LDSB1_CLR1_GRVWA16_GRVWB16_GSU0_GSUC0_GSUWGMRR0_K1_LBSPPA1024_LBSPPB1024_LPA64_LPB64_MIWT4_4_PLR1_SU0_SUM0_SUS64_VWA4_VWB4_WGM1_WGMXCC1_WGMXCCGn1
    SolutionIndex: 39
    SolutionNameMin: Cijk_Ailk_Bjlk_F8NB8NS_BH_Bias_HAS_SAV_UserArgs_MT128x128x64_MI16x16x1_SN_LDSB1_CLR1_GRVWA16_GRVWB16_GSU0_GSUC0_GSUWGMRR0_K1_LBSPPA1024_LBSPPB1024_LPA64_LPB64_MIWT4_4_PLR1_SU0_SUM0_SUS64_VWA4_VWB4_WGM4_WGMXCC1_WGMXCCGn1
    SolutionIndex: 40
    SolutionNameMin: Cijk_Ailk_Bjlk_F8NB8NS_BH_Bias_HAS_SAV_UserArgs_MT128x128x64_MI16x16x1_SN_LDSB1_CLR1_GRVWA8_GRVWB16_GSU0_GSUC0_GSUWGMRR0_K1_LBSPPA1024_LBSPPB1024_LPA64_LPB64_MIWT4_4_PLR1_SU0_SUM0_SUS64_VWA4_VWB4_WGM6_WGMXCC1_WGMXCCGn1
    SolutionIndex: 41
    SolutionNameMin: Cijk_Ailk_Bjlk_F8NB8NS_BH_Bias_HAS_SAV_UserArgs_MT128x128x64_MI16x16x1_SN_LDSB1_CLR1_GRVWA16_GRVWB16_GSU0_GSUC0_GSUWGMRR0_K1_LBSPPA1024_LBSPPB1024_LPA64_LPB64_MIWT4_4_PLR1_SU0_SUM0_SUS64_VWA4_VWB4_WGM6_WGMXCC1_WGMXCCGn1
    SolutionIndex: 42
    SolutionNameMin: Cijk_Ailk_Bjlk_F8NB8NS_BH_Bias_HAS_SAV_UserArgs_MT128x128x64_MI16x16x1_SN_LDSB1_CLR1_GRVWA8_GRVWB16_GSU0_GSUC0_GSUWGMRR0_K1_LBSPPA1024_LBSPPB1024_LPA64_LPB64_MIWT4_4_PLR1_SU0_SUM0_SUS64_VWA4_VWB4_WGM8_WGMXCC1_WGMXCCGn1
    SolutionIndex: 43
    SolutionNameMin: Cijk_Ailk_Bjlk_F8NB8NS_BH_Bias_HAS_SAV_UserArgs_MT128x128x64_MI16x16x1_SN_LDSB1_CLR1_GRVWA16_GRVWB16_GSU0_GSUC0_GSUWGMRR0_K1_LBSPPA1024_LBSPPB1024_LPA64_LPB64_MIWT4_4_PLR1_SU0_SUM0_SUS64_VWA4_VWB4_WGM8_WGMXCC1_WGMXCCGn1
    SolutionIndex: 44
    SolutionNameMin: Cijk_Ailk_Bjlk_F8NB8NS_BH_Bias_HAS_SAV_UserArgs_MT64x128x64_MI16x16x1_SN_LDSB0_CLR1_GRVWA4_GRVWB8_GSU0_GSUC0_GSUWGMRR0_K1_LBSPPA512_LBSPPB1024_LPA32_LPB64_MIWT2_4_PLR1_SU0_SUM0_SUS64_VWA2_VWB4_WGM1_WGMXCC1_WGMXCCGn1
    SolutionIndex: 45
    SolutionNameMin: Cijk_Ailk_Bjlk_F8NB8NS_BH_Bias_HAS_SAV_UserArgs_MT64x128x64_MI16x16x1_SN_LDSB0_CLR1_GRVWA16_GRVWB16_GSU0_GSUC0_GSUWGMRR0_K1_LBSPPA512_LBSPPB1024_LPA32_LPB64_MIWT2_4_PLR1_SU0_SUM0_SUS64_VWA2_VWB4_WGM1_WGMXCC1_WGMXCCGn1
    SolutionIndex: 46
    SolutionNameMin: Cijk_Ailk_Bjlk_F8NB8NS_BH_Bias_HAS_SAV_UserArgs_MT128x64x64_MI16x16x1_SN_LDSB0_CLR1_GRVWA16_GRVWB4_GSU0_GSUC0_GSUWGMRR0_K1_LBSPPA1024_LBSPPB512_LPA64_LPB32_MIWT4_2_PLR1_SU0_SUM0_SUS64_VWA4_VWB2_WGM1_WGMXCC1_WGMXCCGn1
    SolutionIndex: 47
    SolutionNameMin: Cijk_Ailk_Bjlk_F8NB8NS_BH_Bias_HAS_SAV_UserArgs_MT128x64x64_MI16x16x1_SN_LDSB0_CLR1_GRVWA4_GRVWB8_GSU0_GSUC0_GSUWGMRR0_K1_LBSPPA1024_LBSPPB512_LPA64_LPB32_MIWT4_2_PLR1_SU0_SUM0_SUS64_VWA4_VWB2_WGM1_WGMXCC1_WGMXCCGn1
    SolutionIndex: 48
    SolutionNameMin: Cijk_Ailk_Bjlk_F8NB8NS_BH_Bias_HAS_SAV_UserArgs_MT128x64x64_MI16x16x1_SN_LDSB0_CLR1_GRVWA16_GRVWB16_GSU0_GSUC0_GSUWGMRR0_K1_LBSPPA1024_LBSPPB512_LPA64_LPB32_MIWT4_2_PLR1_SU0_SUM0_SUS64_VWA4_VWB2_WGM1_WGMXCC1_WGMXCCGn1
    SolutionIndex: 49
    SolutionNameMin: Cijk_Ailk_Bjlk_F8NB8NS_BH_Bias_HAS_SAV_UserArgs_MT128x32x64_MI16x16x1_SN_LDSB0_CLR1_GRVWA4_GRVWB4_GSU0_GSUC0_GSUWGMRR0_K1_LBSPPA1024_LBSPPB256_LPA64_LPB16_MIWT4_1_PLR1_SU0_SUM0_SUS64_VWA4_VWB1_WGM1_WGMXCC1_WGMXCCGn1
    SolutionIndex: 50
    SolutionNameMin: Cijk_Ailk_Bjlk_F8NB8NS_BH_Bias_HAS_SAV_UserArgs_MT64x64x64_MI16x16x1_SN_LDSB0_CLR1_GRVWA4_GRVWB4_GSU0_GSUC0_GSUWGMRR0_K1_LBSPPA512_LBSPPB512_LPA32_LPB32_MIWT2_2_PLR1_SU0_SUM0_SUS64_VWA2_VWB2_WGM1_WGMXCC1_WGMXCCGn1
    SolutionIndex: 51
    SolutionNameMin: Cijk_Ailk_Bjlk_F8NB8NS_BH_Bias_HAS_SAV_UserArgs_MT64x64x64_MI16x16x1_SN_LDSB0_CLR1_GRVWA4_GRVWB8_GSU0_GSUC0_GSUWGMRR0_K1_LBSPPA512_LBSPPB512_LPA32_LPB32_MIWT2_2_PLR1_SU0_SUM0_SUS64_VWA2_VWB2_WGM1_WGMXCC1_WGMXCCGn1
    SolutionIndex: 52
    SolutionNameMin: Cijk_Ailk_Bjlk_F8NB8NS_BH_Bias_HAS_SAV_UserArgs_MT64x64x64_MI16x16x1_SN_LDSB0_CLR1_GRVWA8_GRVWB8_GSU0_GSUC0_GSUWGMRR0_K1_LBSPPA512_LBSPPB512_LPA32_LPB32_MIWT2_2_PLR1_SU0_SUM0_SUS64_VWA2_VWB2_WGM1_WGMXCC1_WGMXCCGn1
    SolutionIndex: 53
    SolutionNameMin: Cijk_Ailk_Bjlk_F8NB8NS_BH_Bias_HAS_SAV_UserArgs_MT64x64x64_MI16x16x1_SN_LDSB0_CLR1_GRVWA4_GRVWB16_GSU0_GSUC0_GSUWGMRR0_K1_LBSPPA512_LBSPPB512_LPA32_LPB32_MIWT2_2_PLR1_SU0_SUM0_SUS64_VWA2_VWB2_WGM1_WGMXCC1_WGMXCCGn1
    SolutionIndex: 54
    SolutionNameMin: Cijk_Ailk_Bjlk_F8NB8NS_BH_Bias_HAS_SAV_UserArgs_MT64x32x64_MI16x16x1_SN_LDSB0_CLR1_GRVWA4_GRVWB4_GSU0_GSUC0_GSUWGMRR0_K1_LBSPPA512_LBSPPB256_LPA32_LPB16_MIWT2_1_PLR1_SU0_SUM0_SUS64_VWA2_VWB1_WGM1_WGMXCC1_WGMXCCGn1
    SolutionIndex: 55
    SolutionNameMin: Cijk_Ailk_Bjlk_F8NB8NS_BH_Bias_HAS_SAV_UserArgs_MT64x32x64_MI16x16x1_SN_LDSB0_CLR1_GRVWA8_GRVWB4_GSU0_GSUC0_GSUWGMRR0_K1_LBSPPA512_LBSPPB256_LPA32_LPB16_MIWT2_1_PLR1_SU0_SUM0_SUS64_VWA2_VWB1_WGM1_WGMXCC1_WGMXCCGn1
    SolutionIndex: 56
    SolutionNameMin: Cijk_Ailk_Bjlk_F8NB8NS_BH_Bias_HAS_SAV_UserArgs_MT64x32x64_MI16x16x1_SN_LDSB0_CLR1_GRVWA4_GRVWB8_GSU0_GSUC0_GSUWGMRR0_K1_LBSPPA512_LBSPPB256_LPA32_LPB16_MIWT2_1_PLR1_SU0_SUM0_SUS64_VWA2_VWB1_WGM1_WGMXCC1_WGMXCCGn1
    SolutionIndex: 57
    SolutionNameMin: Cijk_Ailk_Bjlk_F8NB8NS_BH_Bias_HAS_SAV_UserArgs_MT32x32x64_MI16x16x1_SN_LDSB0_CLR1_GRVWA4_GRVWB4_GSU0_GSUC0_GSUWGMRR0_K1_LBSPPA256_LBSPPB256_LPA16_LPB16_MIWT1_1_PLR1_SU0_SUM0_SUS64_VWA1_VWB1_WGM1_WGMXCC1_WGMXCCGn1
    SolutionIndex: 58
    SolutionNameMin: Cijk_Ailk_Bjlk_F8NB8NS_BH_Bias_HAS_SAV_UserArgs_MT32x32x64_MI16x16x1_SN_LDSB0_CLR1_GRVWA8_GRVWB4_GSU0_GSUC0_GSUWGMRR0_K1_LBSPPA256_LBSPPB256_LPA16_LPB16_MIWT1_1_PLR1_SU0_SUM0_SUS64_VWA1_VWB1_WGM1_WGMXCC1_WGMXCCGn1
    SolutionIndex: 59
    SolutionNameMin: Cijk_Ailk_Bjlk_F8NB8NS_BH_Bias_HAS_SAV_UserArgs_MT32x32x64_MI16x16x1_SN_LDSB0_CLR1_GRVWA4_GRVWB8_GSU0_GSUC0_GSUWGMRR0_K1_LBSPPA256_LBSPPB256_LPA16_LPB16_MIWT1_1_PLR1_SU0_SUM0_SUS64_VWA1_VWB1_WGM1_WGMXCC1_WGMXCCGn1
    SolutionIndex: 60
    SolutionNameMin: Cijk_Ailk_Bjlk_F8NB8NS_BH_Bias_HAS_SAV_UserArgs_MT32x32x64_MI16x16x1_SN_LDSB0_CLR1_GRVWA8_GRVWB8_GSU0_GSUC0_GSUWGMRR0_K1_LBSPPA256_LBSPPB256_LPA16_LPB16_MIWT1_1_PLR1_SU0_SUM0_SUS64_VWA1_VWB1_WGM1_WGMXCC1_WGMXCCGn1
    SolutionIndex: 61
    SolutionNameMin: Cijk_Ailk_Bjlk_F8NB8NS_BH_Bias_HAS_SAV_UserArgs_MT256x256x128_MI16x16x1_SN_LDSB1_CLR1_GRVWA8_GRVWB16_GSU0_GSUC0_GSUWGMRR0_K1_LBSPPA2048_LBSPPB2048_LPA0_LPB0_MIWT8_8_PLR1_SU0_SUM0_SUS128_VWA8_VWB8_WGM1_WGMXCC1_WGMXCCGn1
    SolutionIndex: 62
    SolutionNameMin: Cijk_Ailk_Bjlk_F8NB8NS_BH_Bias_HAS_SAV_UserArgs_MT256x256x128_MI16x16x1_SN_LDSB1_CLR1_GRVWA16_GRVWB16_GSU0_GSUC0_GSUWGMRR0_K1_LBSPPA2048_LBSPPB2048_LPA0_LPB0_MIWT8_8_PLR1_SU0_SUM0_SUS128_VWA8_VWB8_WGM8_WGMXCC1_WGMXCCGn1
    SolutionIndex: 63
    SolutionNameMin: Cijk_Ailk_Bjlk_F8NB8NS_BH_Bias_HAS_SAV_UserArgs_MT128x256x128_MI16x16x1_SN_LDSB1_CLR1_GRVWA4_GRVWB16_GSU0_GSUC0_GSUWGMRR0_K1_LBSPPA1024_LBSPPB2048_LPA64_LPB0_MIWT4_8_PLR1_SU0_SUM0_SUS128_VWA4_VWB8_WGM1_WGMXCC1_WGMXCCGn1
    SolutionIndex: 64
    SolutionNameMin: Cijk_Ailk_Bjlk_F8NB8NS_BH_Bias_HAS_SAV_UserArgs_MT128x256x128_MI16x16x1_SN_LDSB1_CLR1_GRVWA16_GRVWB16_GSU0_GSUC0_GSUWGMRR0_K1_LBSPPA1024_LBSPPB2048_LPA64_LPB0_MIWT4_8_PLR1_SU0_SUM0_SUS128_VWA4_VWB8_WGM1_WGMXCC1_WGMXCCGn1
    SolutionIndex: 65
    SolutionNameMin: Cijk_Ailk_Bjlk_F8NB8NS_BH_Bias_HAS_SAV_UserArgs_MT128x256x128_MI16x16x1_SN_LDSB1_CLR1_GRVWA4_GRVWB16_GSU0_GSUC0_GSUWGMRR0_K1_LBSPPA1024_LBSPPB2048_LPA64_LPB0_MIWT4_8_PLR1_SU0_SUM0_SUS128_VWA4_VWB8_WGM4_WGMXCC1_WGMXCCGn1
    SolutionIndex: 66
    SolutionNameMin: Cijk_Ailk_Bjlk_F8NB8NS_BH_Bias_HAS_SAV_UserArgs_MT128x256x128_MI16x16x1_SN_LDSB1_CLR1_GRVWA4_GRVWB16_GSU0_GSUC0_GSUWGMRR0_K1_LBSPPA1024_LBSPPB2048_LPA64_LPB0_MIWT4_8_PLR1_SU0_SUM0_SUS128_VWA4_VWB8_WGM6_WGMXCC1_WGMXCCGn1
    SolutionIndex: 67
    SolutionNameMin: Cijk_Ailk_Bjlk_F8NB8NS_BH_Bias_HAS_SAV_UserArgs_MT128x256x128_MI16x16x1_SN_LDSB1_CLR1_GRVWA16_GRVWB16_GSU0_GSUC0_GSUWGMRR0_K1_LBSPPA1024_LBSPPB2048_LPA64_LPB0_MIWT4_8_PLR1_SU0_SUM0_SUS128_VWA4_VWB8_WGM8_WGMXCC1_WGMXCCGn1
    SolutionIndex: 68
    SolutionNameMin: Cijk_Ailk_Bjlk_F8NB8NS_BH_Bias_HAS_SAV_UserArgs_MT256x128x128_MI16x16x1_SN_LDSB1_CLR1_GRVWA16_GRVWB8_GSU0_GSUC0_GSUWGMRR0_K1_LBSPPA2048_LBSPPB1024_LPA0_LPB64_MIWT8_4_PLR1_SU0_SUM0_SUS128_VWA8_VWB4_WGM6_WGMXCC1_WGMXCCGn1
    SolutionIndex: 69
    SolutionNameMin: Cijk_Ailk_Bjlk_F8NB8NS_BH_Bias_HAS_SAV_UserArgs_MT256x128x128_MI16x16x1_SN_LDSB1_CLR1_GRVWA8_GRVWB16_GSU0_GSUC0_GSUWGMRR0_K1_LBSPPA2048_LBSPPB1024_LPA0_LPB64_MIWT8_4_PLR1_SU0_SUM0_SUS128_VWA8_VWB4_WGM6_WGMXCC1_WGMXCCGn1
    SolutionIndex: 70
    SolutionNameMin: Cijk_Ailk_Bjlk_F8NB8NS_BH_Bias_HAS_SAV_UserArgs_MT128x128x128_MI16x16x1_SN_LDSB1_CLR1_GRVWA16_GRVWB16_GSU0_GSUC0_GSUWGMRR0_K1_LBSPPA1024_LBSPPB1024_LPA64_LPB64_MIWT4_4_PLR1_SU0_SUM0_SUS128_VWA4_VWB4_WGM1_WGMXCC1_WGMXCCGn1
    SolutionIndex: 71
    SolutionNameMin: Cijk_Ailk_Bjlk_F8NB8NS_BH_Bias_HAS_SAV_UserArgs_MT128x128x128_MI16x16x1_SN_LDSB1_CLR1_GRVWA16_GRVWB16_GSU0_GSUC0_GSUWGMRR0_K1_LBSPPA1024_LBSPPB1024_LPA64_LPB64_MIWT4_4_PLR1_SU0_SUM0_SUS128_VWA4_VWB4_WGM4_WGMXCC1_WGMXCCGn1
    SolutionIndex: 72
    SolutionNameMin: Cijk_Ailk_Bjlk_F8NB8NS_BH_Bias_HAS_SAV_UserArgs_MT128x128x128_MI16x16x1_SN_LDSB1_CLR1_GRVWA16_GRVWB16_GSU0_GSUC0_GSUWGMRR0_K1_LBSPPA1024_LBSPPB1024_LPA64_LPB64_MIWT4_4_PLR1_SU0_SUM0_SUS128_VWA4_VWB4_WGM8_WGMXCC1_WGMXCCGn1
    SolutionIndex: 73
    SolutionNameMin: Cijk_Ailk_Bjlk_F8NB8NS_BH_Bias_HAS_SAV_UserArgs_MT128x64x128_MI16x16x1_SN_LDSB1_CLR1_GRVWA4_GRVWB8_GSU0_GSUC0_GSUWGMRR0_K1_LBSPPA1024_LBSPPB512_LPA64_LPB32_MIWT4_2_PLR1_SU0_SUM0_SUS128_VWA4_VWB2_WGM1_WGMXCC1_WGMXCCGn1
    SolutionIndex: 74
    SolutionNameMin: Cijk_Ailk_Bjlk_F8NB8NS_BH_Bias_HAS_SAV_UserArgs_MT128x64x128_MI16x16x1_SN_LDSB1_CLR1_GRVWA16_GRVWB8_GSU0_GSUC0_GSUWGMRR0_K1_LBSPPA1024_LBSPPB512_LPA64_LPB32_MIWT4_2_PLR1_SU0_SUM0_SUS128_VWA4_VWB2_WGM1_WGMXCC1_WGMXCCGn1
    SolutionIndex: 75
    SolutionNameMin: Cijk_Ailk_Bjlk_F8NB8NS_BH_Bias_HAS_SAV_UserArgs_MT128x64x128_MI16x16x1_SN_LDSB1_CLR1_GRVWA16_GRVWB16_GSU0_GSUC0_GSUWGMRR0_K1_LBSPPA1024_LBSPPB512_LPA64_LPB32_MIWT4_2_PLR1_SU0_SUM0_SUS128_VWA4_VWB2_WGM1_WGMXCC1_WGMXCCGn1
    SolutionIndex: 76
    SolutionNameMin: Cijk_Ailk_Bjlk_F8NB8NS_BH_Bias_HAS_SAV_UserArgs_MT128x64x128_MI16x16x1_SN_LDSB1_CLR1_GRVWA16_GRVWB16_GSU0_GSUC0_GSUWGMRR0_K1_LBSPPA1024_LBSPPB512_LPA64_LPB32_MIWT4_2_PLR1_SU0_SUM0_SUS128_VWA4_VWB2_WGM4_WGMXCC1_WGMXCCGn1
    SolutionIndex: 77
    SolutionNameMin: Cijk_Ailk_Bjlk_F8NB8NS_BH_Bias_HAS_SAV_UserArgs_MT128x64x128_MI16x16x1_SN_LDSB1_CLR1_GRVWA16_GRVWB16_GSU0_GSUC0_GSUWGMRR0_K1_LBSPPA1024_LBSPPB512_LPA64_LPB32_MIWT4_2_PLR1_SU0_SUM0_SUS128_VWA4_VWB2_WGM6_WGMXCC1_WGMXCCGn1
    SolutionIndex: 78
    SolutionNameMin: Cijk_Ailk_Bjlk_F8NB8NS_BH_Bias_HAS_SAV_UserArgs_MT128x64x128_MI16x16x1_SN_LDSB1_CLR1_GRVWA16_GRVWB16_GSU0_GSUC0_GSUWGMRR0_K1_LBSPPA1024_LBSPPB512_LPA64_LPB32_MIWT4_2_PLR1_SU0_SUM0_SUS128_VWA4_VWB2_WGM8_WGMXCC1_WGMXCCGn1
    SolutionIndex: 79
    SolutionNameMin: Cijk_Ailk_Bjlk_F8NB8NS_BH_Bias_HAS_SAV_UserArgs_MT64x64x128_MI16x16x1_SN_LDSB1_CLR1_GRVWA4_GRVWB4_GSU0_GSUC0_GSUWGMRR0_K1_LBSPPA512_LBSPPB512_LPA32_LPB32_MIWT2_2_PLR1_SU0_SUM0_SUS128_VWA2_VWB2_WGM1_WGMXCC1_WGMXCCGn1
    SolutionIndex: 80
    SolutionNameMin: Cijk_Ailk_Bjlk_F8NB8NS_BH_Bias_HAS_SAV_UserArgs_MT64x64x128_MI16x16x1_SN_LDSB1_CLR1_GRVWA4_GRVWB16_GSU0_GSUC0_GSUWGMRR0_K1_LBSPPA512_LBSPPB512_LPA32_LPB32_MIWT2_2_PLR1_SU0_SUM0_SUS128_VWA2_VWB2_WGM1_WGMXCC1_WGMXCCGn1
    SolutionIndex: 81
    SolutionNameMin: Cijk_Ailk_Bjlk_F8NB8NS_BH_Bias_HAS_SAV_UserArgs_MT64x64x128_MI16x16x1_SN_LDSB1_CLR1_GRVWA8_GRVWB16_GSU0_GSUC0_GSUWGMRR0_K1_LBSPPA512_LBSPPB512_LPA32_LPB32_MIWT2_2_PLR1_SU0_SUM0_SUS128_VWA2_VWB2_WGM1_WGMXCC1_WGMXCCGn1
    SolutionIndex: 82
    SolutionNameMin: Cijk_Ailk_Bjlk_F8NB8NS_BH_Bias_HAS_SAV_UserArgs_MT64x64x128_MI16x16x1_SN_LDSB1_CLR1_GRVWA16_GRVWB16_GSU0_GSUC0_GSUWGMRR0_K1_LBSPPA512_LBSPPB512_LPA32_LPB32_MIWT2_2_PLR1_SU0_SUM0_SUS128_VWA2_VWB2_WGM1_WGMXCC1_WGMXCCGn1
    SolutionIndex: 83
    SolutionNameMin: Cijk_Ailk_Bjlk_F8NB8NS_BH_Bias_HAS_SAV_UserArgs_MT64x64x128_MI16x16x1_SN_LDSB1_CLR1_GRVWA4_GRVWB16_GSU0_GSUC0_GSUWGMRR0_K1_LBSPPA512_LBSPPB512_LPA32_LPB32_MIWT2_2_PLR1_SU0_SUM0_SUS128_VWA2_VWB2_WGM4_WGMXCC1_WGMXCCGn1
    SolutionIndex: 84
    SolutionNameMin: Cijk_Ailk_Bjlk_F8NB8NS_BH_Bias_HAS_SAV_UserArgs_MT64x64x128_MI16x16x1_SN_LDSB1_CLR1_GRVWA16_GRVWB16_GSU0_GSUC0_GSUWGMRR0_K1_LBSPPA512_LBSPPB512_LPA32_LPB32_MIWT2_2_PLR1_SU0_SUM0_SUS128_VWA2_VWB2_WGM4_WGMXCC1_WGMXCCGn1
    SolutionIndex: 85
    SolutionNameMin: Cijk_Ailk_Bjlk_F8NB8NS_BH_Bias_HAS_SAV_UserArgs_MT64x64x128_MI16x16x1_SN_LDSB1_CLR1_GRVWA8_GRVWB16_GSU0_GSUC0_GSUWGMRR0_K1_LBSPPA512_LBSPPB512_LPA32_LPB32_MIWT2_2_PLR1_SU0_SUM0_SUS128_VWA2_VWB2_WGM6_WGMXCC1_WGMXCCGn1
    SolutionIndex: 86
    SolutionNameMin: Cijk_Ailk_Bjlk_F8NB8NS_BH_Bias_HAS_SAV_UserArgs_MT64x64x128_MI16x16x1_SN_LDSB1_CLR1_GRVWA16_GRVWB16_GSU0_GSUC0_GSUWGMRR0_K1_LBSPPA512_LBSPPB512_LPA32_LPB32_MIWT2_2_PLR1_SU0_SUM0_SUS128_VWA2_VWB2_WGM6_WGMXCC1_WGMXCCGn1
    SolutionIndex: 87
    SolutionNameMin: Cijk_Ailk_Bjlk_F8NB8NS_BH_Bias_HAS_SAV_UserArgs_MT64x64x128_MI16x16x1_SN_LDSB1_CLR1_GRVWA16_GRVWB16_GSU0_GSUC0_GSUWGMRR0_K1_LBSPPA512_LBSPPB512_LPA32_LPB32_MIWT2_2_PLR1_SU0_SUM0_SUS128_VWA2_VWB2_WGM8_WGMXCC1_WGMXCCGn1
    SolutionIndex: 88
    SolutionNameMin: Cijk_Ailk_Bjlk_F8NB8NS_BH_Bias_HAS_SAV_UserArgs_MT32x64x128_MI16x16x1_SN_LDSB0_CLR1_GRVWA16_GRVWB16_GSU0_GSUC0_GSUWGMRR0_K1_LBSPPA256_LBSPPB512_LPA16_LPB32_MIWT1_2_PLR1_SU0_SUM0_SUS128_VWA1_VWB2_WGM1_WGMXCC1_WGMXCCGn1
    SolutionIndex: 89
    SolutionNameMin: Cijk_Ailk_Bjlk_F8NB8NS_BH_Bias_HAS_SAV_UserArgs_MT32x64x128_MI16x16x1_SN_LDSB0_CLR1_GRVWA16_GRVWB16_GSU0_GSUC0_GSUWGMRR0_K1_LBSPPA256_LBSPPB512_LPA16_LPB32_MIWT1_2_PLR1_SU0_SUM0_SUS128_VWA1_VWB2_WGM6_WGMXCC1_WGMXCCGn1
    SolutionIndex: 90
    SolutionNameMin: Cijk_Ailk_Bjlk_F8NB8NS_BH_Bias_HAS_SAV_UserArgs_MT32x64x128_MI16x16x1_SN_LDSB0_CLR1_GRVWA16_GRVWB16_GSU0_GSUC0_GSUWGMRR0_K1_LBSPPA256_LBSPPB512_LPA16_LPB32_MIWT1_2_PLR1_SU0_SUM0_SUS128_VWA1_VWB2_WGM8_WGMXCC1_WGMXCCGn1
    SolutionIndex: 91
    SolutionNameMin: Cijk_Ailk_Bjlk_F8NB8NS_BH_Bias_HAS_SAV_UserArgs_MT64x32x128_MI16x16x1_SN_LDSB0_CLR1_GRVWA4_GRVWB4_GSU0_GSUC0_GSUWGMRR0_K1_LBSPPA512_LBSPPB256_LPA32_LPB16_MIWT2_1_PLR1_SU0_SUM0_SUS128_VWA2_VWB1_WGM1_WGMXCC1_WGMXCCGn1
    SolutionIndex: 92
    SolutionNameMin: Cijk_Ailk_Bjlk_F8NB8NS_BH_Bias_HAS_SAV_UserArgs_MT64x32x128_MI16x16x1_SN_LDSB0_CLR1_GRVWA4_GRVWB8_GSU0_GSUC0_GSUWGMRR0_K1_LBSPPA512_LBSPPB256_LPA32_LPB16_MIWT2_1_PLR1_SU0_SUM0_SUS128_VWA2_VWB1_WGM1_WGMXCC1_WGMXCCGn1
    SolutionIndex: 93
    SolutionNameMin: Cijk_Ailk_Bjlk_F8NB8NS_BH_Bias_HAS_SAV_UserArgs_MT64x32x128_MI16x16x1_SN_LDSB0_CLR1_GRVWA8_GRVWB8_GSU0_GSUC0_GSUWGMRR0_K1_LBSPPA512_LBSPPB256_LPA32_LPB16_MIWT2_1_PLR1_SU0_SUM0_SUS128_VWA2_VWB1_WGM1_WGMXCC1_WGMXCCGn1
    SolutionIndex: 94
    SolutionNameMin: Cijk_Ailk_Bjlk_F8NB8NS_BH_Bias_HAS_SAV_UserArgs_MT64x32x128_MI16x16x1_SN_LDSB0_CLR1_GRVWA16_GRVWB8_GSU0_GSUC0_GSUWGMRR0_K1_LBSPPA512_LBSPPB256_LPA32_LPB16_MIWT2_1_PLR1_SU0_SUM0_SUS128_VWA2_VWB1_WGM1_WGMXCC1_WGMXCCGn1
    SolutionIndex: 95
    SolutionNameMin: Cijk_Ailk_Bjlk_F8NB8NS_BH_Bias_HAS_SAV_UserArgs_MT64x32x128_MI16x16x1_SN_LDSB0_CLR1_GRVWA8_GRVWB16_GSU0_GSUC0_GSUWGMRR0_K1_LBSPPA512_LBSPPB256_LPA32_LPB16_MIWT2_1_PLR1_SU0_SUM0_SUS128_VWA2_VWB1_WGM1_WGMXCC1_WGMXCCGn1
    SolutionIndex: 96
    SolutionNameMin: Cijk_Ailk_Bjlk_F8NB8NS_BH_Bias_HAS_SAV_UserArgs_MT64x32x128_MI16x16x1_SN_LDSB0_CLR1_GRVWA16_GRVWB16_GSU0_GSUC0_GSUWGMRR0_K1_LBSPPA512_LBSPPB256_LPA32_LPB16_MIWT2_1_PLR1_SU0_SUM0_SUS128_VWA2_VWB1_WGM1_WGMXCC1_WGMXCCGn1
    SolutionIndex: 97
    SolutionNameMin: Cijk_Ailk_Bjlk_F8NB8NS_BH_Bias_HAS_SAV_UserArgs_MT64x32x128_MI16x16x1_SN_LDSB0_CLR1_GRVWA4_GRVWB8_GSU0_GSUC0_GSUWGMRR0_K1_LBSPPA512_LBSPPB256_LPA32_LPB16_MIWT2_1_PLR1_SU0_SUM0_SUS128_VWA2_VWB1_WGM4_WGMXCC1_WGMXCCGn1
    SolutionIndex: 98
    SolutionNameMin: Cijk_Ailk_Bjlk_F8NB8NS_BH_Bias_HAS_SAV_UserArgs_MT32x32x128_MI16x16x1_SN_LDSB0_CLR1_GRVWA4_GRVWB4_GSU0_GSUC0_GSUWGMRR0_K1_LBSPPA256_LBSPPB256_LPA16_LPB16_MIWT1_1_PLR1_SU0_SUM0_SUS128_VWA1_VWB1_WGM1_WGMXCC1_WGMXCCGn1
    SolutionIndex: 99
    SolutionNameMin: Cijk_Ailk_Bjlk_F8NB8NS_BH_Bias_HAS_SAV_UserArgs_MT32x32x128_MI16x16x1_SN_LDSB0_CLR1_GRVWA4_GRVWB8_GSU0_GSUC0_GSUWGMRR0_K1_LBSPPA256_LBSPPB256_LPA16_LPB16_MIWT1_1_PLR1_SU0_SUM0_SUS128_VWA1_VWB1_WGM1_WGMXCC1_WGMXCCGn1
    SolutionIndex: 100
    SolutionNameMin: Cijk_Ailk_Bjlk_F8NB8NS_BH_Bias_HAS_SAV_UserArgs_MT32x32x128_MI16x16x1_SN_LDSB0_CLR1_GRVWA8_GRVWB8_GSU0_GSUC0_GSUWGMRR0_K1_LBSPPA256_LBSPPB256_LPA16_LPB16_MIWT1_1_PLR1_SU0_SUM0_SUS128_VWA1_VWB1_WGM1_WGMXCC1_WGMXCCGn1
    SolutionIndex: 101
    SolutionNameMin: Cijk_Ailk_Bjlk_F8NB8NS_BH_Bias_HAS_SAV_UserArgs_MT32x32x128_MI16x16x1_SN_LDSB0_CLR1_GRVWA4_GRVWB16_GSU0_GSUC0_GSUWGMRR0_K1_LBSPPA256_LBSPPB256_LPA16_LPB16_MIWT1_1_PLR1_SU0_SUM0_SUS128_VWA1_VWB1_WGM1_WGMXCC1_WGMXCCGn1
    SolutionIndex: 102
    SolutionNameMin: Cijk_Ailk_Bjlk_F8NB8NS_BH_Bias_HAS_SAV_UserArgs_MT32x32x128_MI16x16x1_SN_LDSB0_CLR1_GRVWA8_GRVWB16_GSU0_GSUC0_GSUWGMRR0_K1_LBSPPA256_LBSPPB256_LPA16_LPB16_MIWT1_1_PLR1_SU0_SUM0_SUS128_VWA1_VWB1_WGM1_WGMXCC1_WGMXCCGn1
    SolutionIndex: 103
    SolutionNameMin: Cijk_Ailk_Bjlk_F8NB8NS_BH_Bias_HAS_SAV_UserArgs_MT32x32x128_MI16x16x1_SN_LDSB0_CLR1_GRVWA16_GRVWB16_GSU0_GSUC0_GSUWGMRR0_K1_LBSPPA256_LBSPPB256_LPA16_LPB16_MIWT1_1_PLR1_SU0_SUM0_SUS128_VWA1_VWB1_WGM1_WGMXCC1_WGMXCCGn1
    SolutionIndex: 104
    SolutionNameMin: Cijk_Ailk_Bjlk_F8NB8NS_BH_Bias_HAS_SAV_UserArgs_MT128x64x256_MI16x16x1_SN_LDSB1_CLR1_GRVWA16_GRVWB16_GSU0_GSUC0_GSUWGMRR0_K1_LBSPPA1024_LBSPPB512_LPA64_LPB32_MIWT4_2_PLR1_SU0_SUM0_SUS256_VWA4_VWB2_WGM1_WGMXCC1_WGMXCCGn1
    SolutionIndex: 105
    SolutionNameMin: Cijk_Ailk_Bjlk_F8NB8NS_BH_Bias_HAS_SAV_UserArgs_MT64x64x256_MI16x16x1_SN_LDSB1_CLR1_GRVWA4_GRVWB16_GSU0_GSUC0_GSUWGMRR0_K1_LBSPPA512_LBSPPB512_LPA32_LPB32_MIWT2_2_PLR1_SU0_SUM0_SUS256_VWA2_VWB2_WGM1_WGMXCC1_WGMXCCGn1
    SolutionIndex: 106
    SolutionNameMin: Cijk_Ailk_Bjlk_F8NB8NS_BH_Bias_HAS_SAV_UserArgs_MT64x64x256_MI16x16x1_SN_LDSB1_CLR1_GRVWA16_GRVWB16_GSU0_GSUC0_GSUWGMRR0_K1_LBSPPA512_LBSPPB512_LPA32_LPB32_MIWT2_2_PLR1_SU0_SUM0_SUS256_VWA2_VWB2_WGM1_WGMXCC1_WGMXCCGn1
    SolutionIndex: 107
    SolutionNameMin: Cijk_Ailk_Bjlk_F8NB8NS_BH_Bias_HAS_SAV_UserArgs_MT64x64x256_MI16x16x1_SN_LDSB1_CLR1_GRVWA16_GRVWB16_GSU0_GSUC0_GSUWGMRR0_K1_LBSPPA512_LBSPPB512_LPA32_LPB32_MIWT2_2_PLR1_SU0_SUM0_SUS256_VWA2_VWB2_WGM8_WGMXCC1_WGMXCCGn1
    SolutionIndex: 108
    SolutionNameMin: Cijk_Ailk_Bjlk_F8NB8NS_BH_Bias_HAS_SAV_UserArgs_MT64x32x256_MI16x16x1_SN_LDSB1_CLR1_GRVWA16_GRVWB16_GSU0_GSUC0_GSUWGMRR0_K1_LBSPPA512_LBSPPB256_LPA32_LPB16_MIWT2_1_PLR1_SU0_SUM0_SUS256_VWA2_VWB1_WGM1_WGMXCC1_WGMXCCGn1
    SolutionIndex: 109
    SolutionNameMin: Cijk_Ailk_Bjlk_F8NB8NS_BH_Bias_HAS_SAV_UserArgs_MT64x32x256_MI16x16x1_SN_LDSB1_CLR1_GRVWA16_GRVWB16_GSU0_GSUC0_GSUWGMRR0_K1_LBSPPA512_LBSPPB256_LPA32_LPB16_MIWT2_1_PLR1_SU0_SUM0_SUS256_VWA2_VWB1_WGM6_WGMXCC1_WGMXCCGn1
    SolutionIndex: 110
    SolutionNameMin: Cijk_Ailk_Bjlk_F8NB8NS_BH_Bias_HAS_SAV_UserArgs_MT32x32x256_MI16x16x1_SN_LDSB1_CLR1_GRVWA8_GRVWB16_GSU0_GSUC0_GSUWGMRR0_K1_LBSPPA256_LBSPPB256_LPA16_LPB16_MIWT1_1_PLR1_SU0_SUM0_SUS256_VWA1_VWB1_WGM1_WGMXCC1_WGMXCCGn1
    SolutionIndex: 111
    SolutionNameMin: Cijk_Ailk_Bjlk_F8NB8NS_BH_Bias_HAS_SAV_UserArgs_MT32x32x256_MI16x16x1_SN_LDSB1_CLR1_GRVWA16_GRVWB16_GSU0_GSUC0_GSUWGMRR0_K1_LBSPPA256_LBSPPB256_LPA16_LPB16_MIWT1_1_PLR1_SU0_SUM0_SUS256_VWA1_VWB1_WGM1_WGMXCC1_WGMXCCGn1
    SolutionIndex: 112
    SolutionNameMin: Cijk_Ailk_Bjlk_F8NB8NS_BH_Bias_HAS_SAV_UserArgs_MT32x32x256_MI16x16x1_SN_LDSB1_CLR1_GRVWA8_GRVWB16_GSU0_GSUC0_GSUWGMRR0_K1_LBSPPA256_LBSPPB256_LPA16_LPB16_MIWT1_1_PLR1_SU0_SUM0_SUS256_VWA1_VWB1_WGM6_WGMXCC1_WGMXCCGn1
    SolutionIndex: 113
    SolutionNameMin: Cijk_Ailk_Bjlk_F8NB8NS_BH_Bias_HAS_SAV_UserArgs_MT32x32x256_MI16x16x1_SN_LDSB1_CLR1_GRVWA16_GRVWB16_GSU0_GSUC0_GSUWGMRR0_K1_LBSPPA256_LBSPPB256_LPA16_LPB16_MIWT1_1_PLR1_SU0_SUM0_SUS256_VWA1_VWB1_WGM6_WGMXCC1_WGMXCCGn1
    SolutionIndex: 114
    SolutionNameMin: Cijk_Ailk_Bjlk_F8NB8NS_BH_Bias_HAS_SAV_UserArgs_MT32x32x256_MI16x16x1_SN_LDSB1_CLR1_GRVWA16_GRVWB16_GSU0_GSUC0_GSUWGMRR0_K1_LBSPPA256_LBSPPB256_LPA16_LPB16_MIWT1_1_PLR1_SU0_SUM0_SUS256_VWA1_VWB1_WGM8_WGMXCC1_WGMXCCGn1
- - - [128, 128, 1, 128, 128, 128, 128, 128]
    - [57, 0.49]
  - - [128, 128, 1, 256, 128, 128, 128, 128]
    - [57, 0.89]
  - - [128, 128, 1, 512, 128, 128, 128, 128]
    - [98, 1.48]
  - - [128, 128, 1, 1024, 128, 128, 128, 128]
    - [102, 2.22]
  - - [128, 128, 1, 2048, 128, 128, 128, 128]
    - [102, 2.94]
  - - [128, 128, 1, 4096, 128, 128, 128, 128]
    - [102, 3.52]
  - - [128, 128, 1, 8192, 128, 128, 128, 128]
    - [111, 3.94]
  - - [128, 256, 1, 128, 128, 128, 128, 256]
    - [57, 1.04]
  - - [128, 256, 1, 256, 128, 128, 128, 256]
    - [98, 1.84]
  - - [128, 256, 1, 512, 128, 128, 128, 256]
    - [100, 3.06]
  - - [128, 256, 1, 1024, 128, 128, 128, 256]
    - [100, 4.43]
  - - [128, 256, 1, 2048, 128, 128, 128, 256]
    - [102, 5.89]
  - - [128, 256, 1, 4096, 128, 128, 128, 256]
    - [111, 7.07]
  - - [128, 256, 1, 8192, 128, 128, 128, 256]
    - [111, 7.91]
  - - [128, 512, 1, 128, 128, 128, 128, 512]
    - [57, 2.04]
  - - [128, 512, 1, 256, 128, 128, 128, 512]
    - [57, 3.63]
  - - [128, 512, 1, 512, 128, 128, 128, 512]
    - [98, 5.94]
  - - [128, 512, 1, 1024, 128, 128, 128, 512]
    - [100, 8.84]
  - - [128, 512, 1, 2048, 128, 128, 128, 512]
    - [103, 11.62]
  - - [128, 512, 1, 4096, 128, 128, 128, 512]
    - [102, 14.03]
  - - [128, 512, 1, 8192, 128, 128, 128, 512]
    - [110, 14.76]
  - - [128, 1024, 1, 128, 128, 128, 128, 1024]
    - [48, 3.03]
  - - [128, 1024, 1, 256, 128, 128, 128, 1024]
    - [98, 6.85]
  - - [128, 1024, 1, 512, 128, 128, 128, 1024]
    - [100, 11.48]
  - - [128, 1024, 1, 1024, 128, 128, 128, 1024]
    - [100, 17.08]
  - - [128, 1024, 1, 2048, 128, 128, 128, 1024]
    - [102, 22.78]
  - - [128, 1024, 1, 4096, 128, 128, 128, 1024]
    - [111, 25.45]
  - - [128, 1024, 1, 8192, 128, 128, 128, 1024]
    - [112, 27.78]
  - - [128, 2048, 1, 128, 128, 128, 128, 2048]
    - [55, 7.39]
  - - [128, 2048, 1, 256, 128, 128, 128, 2048]
    - [56, 12.88]
  - - [128, 2048, 1, 512, 128, 128, 128, 2048]
    - [92, 20.76]
  - - [128, 2048, 1, 1024, 128, 128, 128, 2048]
    - [96, 30.54]
  - - [128, 2048, 1, 2048, 128, 128, 128, 2048]
    - [108, 39.23]
  - - [128, 2048, 1, 4096, 128, 128, 128, 2048]
    - [109, 47.34]
  - - [128, 2048, 1, 8192, 128, 128, 128, 2048]
    - [108, 53.0]
  - - [128, 4096, 1, 128, 128, 128, 128, 4096]
    - [50, 13.9]
  - - [128, 4096, 1, 256, 128, 128, 128, 4096]
    - [50, 24.02]
  - - [128, 4096, 1, 512, 128, 128, 128, 4096]
    - [79, 37.7]
  - - [128, 4096, 1, 1024, 128, 128, 128, 4096]
    - [82, 53.93]
  - - [128, 4096, 1, 2048, 128, 128, 128, 4096]
    - [106, 67.14]
  - - [128, 4096, 1, 4096, 128, 128, 128, 4096]
    - [106, 82.1]
  - - [128, 4096, 1, 8192, 128, 128, 128, 4096]
    - [107, 91.83]
  - - [128, 8192, 1, 128, 128, 128, 128, 8192]
    - [46, 24.01]
  - - [128, 8192, 1, 256, 128, 128, 128, 8192]
    - [47, 41.85]
  - - [128, 8192, 1, 512, 128, 128, 128, 8192]
    - [47, 63.39]
  - - [128, 8192, 1, 1024, 128, 128, 128, 8192]
    - [75, 87.68]
  - - [128, 8192, 1, 2048, 128, 128, 128, 8192]
    - [75, 107.53]
  - - [128, 8192, 1, 4096, 128, 128, 128, 8192]
    - [104, 125.77]
  - - [128, 8192, 1, 8192, 128, 128, 128, 8192]
    - [78, 128.93]
  - - [256, 128, 1, 128, 256, 256, 256, 128]
    - [58, 1.0]
  - - [256, 128, 1, 256, 256, 256, 256, 128]
    - [57, 1.79]
  - - [256, 128, 1, 512, 256, 256, 256, 128]
    - [100, 2.97]
  - - [256, 128, 1, 1024, 256, 256, 256, 128]
    - [102, 4.45]
  - - [256, 128, 1, 2048, 256, 256, 256, 128]
    - [102, 5.95]
  - - [256, 128, 1, 4096, 256, 256, 256, 128]
    - [102, 7.09]
  - - [256, 128, 1, 8192, 256, 256, 256, 128]
    - [102, 7.87]
  - - [256, 256, 1, 128, 256, 256, 256, 256]
    - [57, 1.97]
  - - [256, 256, 1, 256, 256, 256, 256, 256]
    - [57, 3.55]
  - - [256, 256, 1, 512, 256, 256, 256, 256]
    - [100, 5.92]
  - - [256, 256, 1, 1024, 256, 256, 256, 256]
    - [100, 8.74]
  - - [256, 256, 1, 2048, 256, 256, 256, 256]
    - [102, 11.67]
  - - [256, 256, 1, 4096, 256, 256, 256, 256]
    - [102, 14.1]
  - - [256, 256, 1, 8192, 256, 256, 256, 256]
    - [111, 15.51]
  - - [256, 512, 1, 128, 256, 256, 256, 512]
    - [57, 4.03]
  - - [256, 512, 1, 256, 256, 256, 256, 512]
    - [58, 7.06]
  - - [256, 512, 1, 512, 256, 256, 256, 512]
    - [100, 11.44]
  - - [256, 512, 1, 1024, 256, 256, 256, 512]
    - [100, 17.2]
  - - [256, 512, 1, 2048, 256, 256, 256, 512]
    - [102, 22.93]
  - - [256, 512, 1, 4096, 256, 256, 256, 512]
    - [102, 27.54]
  - - [256, 512, 1, 8192, 256, 256, 256, 512]
    - [111, 30.31]
  - - [256, 1024, 1, 128, 256, 256, 256, 1024]
    - [54, 7.53]
  - - [256, 1024, 1, 256, 256, 256, 256, 1024]
    - [54, 13.09]
  - - [256, 1024, 1, 512, 256, 256, 256, 1024]
    - [94, 21.01]
  - - [256, 1024, 1, 1024, 256, 256, 256, 1024]
    - [91, 30.53]
  - - [256, 1024, 1, 2048, 256, 256, 256, 1024]
    - [108, 40.9]
  - - [256, 1024, 1, 4096, 256, 256, 256, 1024]
    - [108, 48.68]
  - - [256, 1024, 1, 8192, 256, 256, 256, 1024]
    - [109, 53.85]
  - - [256, 2048, 1, 128, 256, 256, 256, 2048]
    - [50, 14.05]
  - - [256, 2048, 1, 256, 256, 256, 256, 2048]
    - [50, 23.74]
  - - [256, 2048, 1, 512, 256, 256, 256, 2048]
    - [79, 37.81]
  - - [256, 2048, 1, 1024, 256, 256, 256, 2048]
    - [81, 54.01]
  - - [256, 2048, 1, 2048, 256, 256, 256, 2048]
    - [82, 68.14]
  - - [256, 2048, 1, 4096, 256, 256, 256, 2048]
    - [106, 79.47]
  - - [256, 2048, 1, 8192, 256, 256, 256, 2048]
    - [105, 86.88]
  - - [256, 4096, 1, 128, 256, 256, 256, 4096]
    - [47, 24.72]
  - - [256, 4096, 1, 256, 256, 256, 256, 4096]
    - [47, 41.46]
  - - [256, 4096, 1, 512, 256, 256, 256, 4096]
    - [47, 63.66]
  - - [256, 4096, 1, 1024, 256, 256, 256, 4096]
    - [78, 88.3]
  - - [256, 4096, 1, 2048, 256, 256, 256, 4096]
    - [75, 108.74]
  - - [256, 4096, 1, 4096, 256, 256, 256, 4096]
    - [75, 125.31]
  - - [256, 4096, 1, 8192, 256, 256, 256, 4096]
    - [75, 130.54]
  - - [256, 8192, 1, 128, 256, 256, 256, 8192]
    - [36, 38.63]
  - - [256, 8192, 1, 256, 256, 256, 256, 8192]
    - [37, 65.0]
  - - [256, 8192, 1, 512, 256, 256, 256, 8192]
    - [38, 98.91]
  - - [256, 8192, 1, 1024, 256, 256, 256, 8192]
    - [70, 134.13]
  - - [256, 8192, 1, 2048, 256, 256, 256, 8192]
    - [70, 161.05]
  - - [256, 8192, 1, 4096, 256, 256, 256, 8192]
    - [70, 179.02]
  - - [256, 8192, 1, 8192, 256, 256, 256, 8192]
    - [71, 163.94]
  - - [512, 128, 1, 128, 512, 512, 512, 128]
    - [60, 1.99]
  - - [512, 128, 1, 256, 512, 512, 512, 128]
    - [57, 3.54]
  - - [512, 128, 1, 512, 512, 512, 512, 128]
    - [101, 5.78]
  - - [512, 128, 1, 1024, 512, 512, 512, 128]
    - [101, 8.78]
  - - [512, 128, 1, 2048, 512, 512, 512, 128]
    - [102, 11.64]
  - - [512, 128, 1, 4096, 512, 512, 512, 128]
    - [102, 13.99]
  - - [512, 128, 1, 8192, 512, 512, 512, 128]
    - [114, 14.61]
  - - [512, 256, 1, 128, 512, 512, 512, 256]
    - [58, 3.97]
  - - [512, 256, 1, 256, 512, 512, 512, 256]
    - [58, 6.93]
  - - [512, 256, 1, 512, 512, 512, 512, 256]
    - [99, 11.43]
  - - [512, 256, 1, 1024, 512, 512, 512, 256]
    - [102, 17.15]
  - - [512, 256, 1, 2048, 512, 512, 512, 256]
    - [102, 22.85]
  - - [512, 256, 1, 4096, 512, 512, 512, 256]
    - [102, 27.55]
  - - [512, 256, 1, 8192, 512, 512, 512, 256]
    - [114, 28.77]
  - - [512, 512, 1, 128, 512, 512, 512, 512]
    - [54, 7.59]
  - - [512, 512, 1, 256, 512, 512, 512, 512]
    - [54, 13.21]
  - - [512, 512, 1, 512, 512, 512, 512, 512]
    - [92, 21.11]
  - - [512, 512, 1, 1024, 512, 512, 512, 512]
    - [92, 30.63]
  - - [512, 512, 1, 2048, 512, 512, 512, 512]
    - [108, 40.46]
  - - [512, 512, 1, 4096, 512, 512, 512, 512]
    - [108, 48.73]
  - - [512, 512, 1, 8192, 512, 512, 512, 512]
    - [96, 50.5]
  - - [512, 1024, 1, 128, 512, 512, 512, 1024]
    - [50, 13.87]
  - - [512, 1024, 1, 256, 512, 512, 512, 1024]
    - [50, 23.99]
  - - [512, 1024, 1, 512, 512, 512, 512, 1024]
    - [79, 37.59]
  - - [512, 1024, 1, 1024, 512, 512, 512, 1024]
    - [82, 53.89]
  - - [512, 1024, 1, 2048, 512, 512, 512, 1024]
    - [81, 69.45]
  - - [512, 1024, 1, 4096, 512, 512, 512, 1024]
    - [82, 78.1]
  - - [512, 1024, 1, 8192, 512, 512, 512, 1024]
    - [80, 82.11]
  - - [512, 2048, 1, 128, 512, 512, 512, 2048]
    - [34, 24.32]
  - - [512, 2048, 1, 256, 512, 512, 512, 2048]
    - [47, 41.75]
  - - [512, 2048, 1, 512, 512, 512, 512, 2048]
    - [47, 63.51]
  - - [512, 2048, 1, 1024, 512, 512, 512, 2048]
    - [74, 88.04]
  - - [512, 2048, 1, 2048, 512, 512, 512, 2048]
    - [75, 109.06]
  - - [512, 2048, 1, 4096, 512, 512, 512, 2048]
    - [77, 125.15]
  - - [512, 2048, 1, 8192, 512, 512, 512, 2048]
    - [76, 127.64]
  - - [512, 4096, 1, 128, 512, 512, 512, 4096]
    - [37, 38.8]
  - - [512, 4096, 1, 256, 512, 512, 512, 4096]
    - [36, 65.36]
  - - [512, 4096, 1, 512, 512, 512, 512, 4096]
    - [37, 99.2]
  - - [512, 4096, 1, 1024, 512, 512, 512, 4096]
    - [70, 134.37]
  - - [512, 4096, 1, 2048, 512, 512, 512, 4096]
    - [37, 159.54]
  - - [512, 4096, 1, 4096, 512, 512, 512, 4096]
    - [35, 177.54]
  - - [512, 4096, 1, 8192, 512, 512, 512, 4096]
    - [37, 162.94]
  - - [512, 8192, 1, 128, 512, 512, 512, 8192]
    - [29, 55.5]
  - - [512, 8192, 1, 256, 512, 512, 512, 8192]
    - [29, 93.44]
  - - [512, 8192, 1, 512, 512, 512, 512, 8192]
    - [30, 141.01]
  - - [512, 8192, 1, 1024, 512, 512, 512, 8192]
    - [30, 190.01]
  - - [512, 8192, 1, 2048, 512, 512, 512, 8192]
    - [30, 228.38]
  - - [512, 8192, 1, 4096, 512, 512, 512, 8192]
    - [69, 232.89]
  - - [512, 8192, 1, 8192, 512, 512, 512, 8192]
    - [64, 211.38]
  - - [1024, 128, 1, 128, 1024, 1024, 1024, 128]
    - [59, 4.01]
  - - [1024, 128, 1, 256, 1024, 1024, 1024, 128]
    - [98, 7.05]
  - - [1024, 128, 1, 512, 1024, 1024, 1024, 128]
    - [99, 11.44]
  - - [1024, 128, 1, 1024, 1024, 1024, 1024, 128]
    - [102, 17.06]
  - - [1024, 128, 1, 2048, 1024, 1024, 1024, 128]
    - [102, 22.98]
  - - [1024, 128, 1, 4096, 1024, 1024, 1024, 128]
    - [113, 25.86]
  - - [1024, 128, 1, 8192, 1024, 1024, 1024, 128]
    - [114, 26.17]
  - - [1024, 256, 1, 128, 1024, 1024, 1024, 256]
    - [54, 7.57]
  - - [1024, 256, 1, 256, 1024, 1024, 1024, 256]
    - [54, 13.25]
  - - [1024, 256, 1, 512, 1024, 1024, 1024, 256]
    - [92, 21.15]
  - - [1024, 256, 1, 1024, 1024, 1024, 1024, 256]
    - [95, 30.74]
  - - [1024, 256, 1, 2048, 1024, 1024, 1024, 256]
    - [108, 40.72]
  - - [1024, 256, 1, 4096, 1024, 1024, 1024, 256]
    - [89, 46.03]
  - - [1024, 256, 1, 8192, 1024, 1024, 1024, 256]
    - [97, 49.25]
  - - [1024, 512, 1, 128, 1024, 1024, 1024, 512]
    - [51, 13.84]
  - - [1024, 512, 1, 256, 1024, 1024, 1024, 512]
    - [50, 23.88]
  - - [1024, 512, 1, 512, 1024, 1024, 1024, 512]
    - [52, 37.58]
  - - [1024, 512, 1, 1024, 1024, 1024, 1024, 512]
    - [81, 54.0]
  - - [1024, 512, 1, 2048, 1024, 1024, 1024, 512]
    - [81, 69.35]
  - - [1024, 512, 1, 4096, 1024, 1024, 1024, 512]
    - [83, 76.57]
  - - [1024, 512, 1, 8192, 1024, 1024, 1024, 512]
    - [86, 82.08]
  - - [1024, 1024, 1, 128, 1024, 1024, 1024, 1024]
    - [47, 24.0]
  - - [1024, 1024, 1, 256, 1024, 1024, 1024, 1024]
    - [47, 40.77]
  - - [1024, 1024, 1, 512, 1024, 1024, 1024, 1024]
    - [47, 63.18]
  - - [1024, 1024, 1, 1024, 1024, 1024, 1024, 1024]
    - [75, 88.6]
  - - [1024, 1024, 1, 2048, 1024, 1024, 1024, 1024]
    - [75, 108.72]
  - - [1024, 1024, 1, 4096, 1024, 1024, 1024, 1024]
    - [77, 124.61]
  - - [1024, 1024, 1, 8192, 1024, 1024, 1024, 1024]
    - [77, 128.24]
  - - [1024, 2048, 1, 128, 1024, 1024, 1024, 2048]
    - [37, 38.06]
  - - [1024, 2048, 1, 256, 1024, 1024, 1024, 2048]
    - [36, 65.31]
  - - [1024, 2048, 1, 512, 1024, 1024, 1024, 2048]
    - [38, 98.52]
  - - [1024, 2048, 1, 1024, 1024, 1024, 1024, 2048]
    - [70, 132.91]
  - - [1024, 2048, 1, 2048, 1024, 1024, 1024, 2048]
    - [38, 159.81]
  - - [1024, 2048, 1, 4096, 1024, 1024, 1024, 2048]
    - [40, 178.02]
  - - [1024, 2048, 1, 8192, 1024, 1024, 1024, 2048]
    - [38, 164.14]
  - - [1024, 4096, 1, 128, 1024, 1024, 1024, 4096]
    - [29, 55.46]
  - - [1024, 4096, 1, 256, 1024, 1024, 1024, 4096]
    - [30, 93.12]
  - - [1024, 4096, 1, 512, 1024, 1024, 1024, 4096]
    - [30, 141.63]
  - - [1024, 4096, 1, 1024, 1024, 1024, 1024, 4096]
    - [30, 188.48]
  - - [1024, 4096, 1, 2048, 1024, 1024, 1024, 4096]
    - [31, 226.68]
  - - [1024, 4096, 1, 4096, 1024, 1024, 1024, 4096]
    - [68, 230.06]
  - - [1024, 4096, 1, 8192, 1024, 1024, 1024, 4096]
    - [63, 211.73]
  - - [1024, 8192, 1, 128, 1024, 1024, 1024, 8192]
    - [24, 81.62]
  - - [1024, 8192, 1, 256, 1024, 1024, 1024, 8192]
    - [23, 132.23]
  - - [1024, 8192, 1, 512, 1024, 1024, 1024, 8192]
    - [26, 188.41]
  - - [1024, 8192, 1, 1024, 1024, 1024, 1024, 8192]
    - [4, 231.18]
  - - [1024, 8192, 1, 2048, 1024, 1024, 1024, 8192]
    - [7, 259.15]
  - - [1024, 8192, 1, 4096, 1024, 1024, 1024, 8192]
    - [3, 246.21]
  - - [1024, 8192, 1, 8192, 1024, 1024, 1024, 8192]
    - [3, 262.96]
  - - [2048, 128, 1, 128, 2048, 2048, 2048, 128]
    - [54, 7.67]
  - - [2048, 128, 1, 256, 2048, 2048, 2048, 128]
    - [54, 13.16]
  - - [2048, 128, 1, 512, 2048, 2048, 2048, 128]
    - [93, 21.2]
  - - [2048, 128, 1, 1024, 2048, 2048, 2048, 128]
    - [95, 30.97]
  - - [2048, 128, 1, 2048, 2048, 2048, 2048, 128]
    - [90, 37.45]
  - - [2048, 128, 1, 4096, 2048, 2048, 2048, 128]
    - [88, 45.14]
  - - [2048, 128, 1, 8192, 2048, 2048, 2048, 128]
    - [90, 50.46]
  - - [2048, 256, 1, 128, 2048, 2048, 2048, 256]
    - [49, 13.86]
  - - [2048, 256, 1, 256, 2048, 2048, 2048, 256]
    - [50, 23.98]
  - - [2048, 256, 1, 512, 2048, 2048, 2048, 256]
    - [52, 37.65]
  - - [2048, 256, 1, 1024, 2048, 2048, 2048, 256]
    - [81, 53.61]
  - - [2048, 256, 1, 2048, 2048, 2048, 2048, 256]
    - [85, 67.15]
  - - [2048, 256, 1, 4096, 2048, 2048, 2048, 256]
    - [84, 77.74]
  - - [2048, 256, 1, 8192, 2048, 2048, 2048, 256]
    - [84, 85.12]
  - - [2048, 512, 1, 128, 2048, 2048, 2048, 512]
    - [47, 23.89]
  - - [2048, 512, 1, 256, 2048, 2048, 2048, 512]
    - [47, 41.33]
  - - [2048, 512, 1, 512, 2048, 2048, 2048, 512]
    - [73, 63.31]
  - - [2048, 512, 1, 1024, 2048, 2048, 2048, 512]
    - [75, 87.92]
  - - [2048, 512, 1, 2048, 2048, 2048, 2048, 512]
    - [76, 107.49]
  - - [2048, 512, 1, 4096, 2048, 2048, 2048, 512]
    - [77, 124.62]
  - - [2048, 512, 1, 8192, 2048, 2048, 2048, 512]
    - [78, 129.59]
  - - [2048, 1024, 1, 128, 2048, 2048, 2048, 1024]
    - [36, 38.96]
  - - [2048, 1024, 1, 256, 2048, 2048, 2048, 1024]
    - [37, 64.89]
  - - [2048, 1024, 1, 512, 2048, 2048, 2048, 1024]
    - [38, 99.09]
  - - [2048, 1024, 1, 1024, 2048, 2048, 2048, 1024]
    - [70, 133.84]
  - - [2048, 1024, 1, 2048, 2048, 2048, 2048, 1024]
    - [41, 160.01]
  - - [2048, 1024, 1, 4096, 2048, 2048, 2048, 1024]
    - [41, 178.36]
  - - [2048, 1024, 1, 8192, 2048, 2048, 2048, 1024]
    - [42, 161.53]
  - - [2048, 2048, 1, 128, 2048, 2048, 2048, 2048]
    - [29, 56.29]
  - - [2048, 2048, 1, 256, 2048, 2048, 2048, 2048]
    - [33, 94.25]
  - - [2048, 2048, 1, 512, 2048, 2048, 2048, 2048]
    - [30, 140.89]
  - - [2048, 2048, 1, 1024, 2048, 2048, 2048, 2048]
    - [33, 189.68]
  - - [2048, 2048, 1, 2048, 2048, 2048, 2048, 2048]
    - [33, 227.91]
  - - [2048, 2048, 1, 4096, 2048, 2048, 2048, 2048]
    - [31, 229.96]
  - - [2048, 2048, 1, 8192, 2048, 2048, 2048, 2048]
    - [65, 210.64]
  - - [2048, 4096, 1, 128, 2048, 2048, 2048, 4096]
    - [9, 70.47]
  - - [2048, 4096, 1, 256, 2048, 2048, 2048, 4096]
    - [0, 117.63]
  - - [2048, 4096, 1, 512, 2048, 2048, 2048, 4096]
    - [3, 175.34]
  - - [2048, 4096, 1, 1024, 2048, 2048, 2048, 4096]
    - [11, 232.67]
  - - [2048, 4096, 1, 2048, 2048, 2048, 2048, 4096]
    - [15, 261.8]
  - - [2048, 4096, 1, 4096, 2048, 2048, 2048, 4096]
    - [7, 245.35]
  - - [2048, 4096, 1, 8192, 2048, 2048, 2048, 4096]
    - [7, 259.63]
  - - [2048, 8192, 1, 128, 2048, 2048, 2048, 8192]
    - [28, 89.68]
  - - [2048, 8192, 1, 256, 2048, 2048, 2048, 8192]
    - [27, 138.82]
  - - [2048, 8192, 1, 512, 2048, 2048, 2048, 8192]
    - [13, 187.9]
  - - [2048, 8192, 1, 1024, 2048, 2048, 2048, 8192]
    - [12, 221.74]
  - - [2048, 8192, 1, 2048, 2048, 2048, 2048, 8192]
    - [18, 231.54]
  - - [2048, 8192, 1, 4096, 2048, 2048, 2048, 8192]
    - [9, 276.1]
  - - [2048, 8192, 1, 8192, 2048, 2048, 2048, 8192]
    - [11, 328.45]
  - - [4096, 128, 1, 128, 4096, 4096, 4096, 128]
    - [50, 13.62]
  - - [4096, 128, 1, 256, 4096, 4096, 4096, 128]
    - [53, 23.1]
  - - [4096, 128, 1, 512, 4096, 4096, 4096, 128]
    - [52, 37.15]
  - - [4096, 128, 1, 1024, 4096, 4096, 4096, 128]
    - [81, 53.86]
  - - [4096, 128, 1, 2048, 4096, 4096, 4096, 128]
    - [84, 65.95]
  - - [4096, 128, 1, 4096, 4096, 4096, 4096, 128]
    - [87, 78.14]
  - - [4096, 128, 1, 8192, 4096, 4096, 4096, 128]
    - [87, 85.28]
  - - [4096, 256, 1, 128, 4096, 4096, 4096, 256]
    - [47, 23.6]
  - - [4096, 256, 1, 256, 4096, 4096, 4096, 256]
    - [47, 40.19]
  - - [4096, 256, 1, 512, 4096, 4096, 4096, 256]
    - [44, 62.55]
  - - [4096, 256, 1, 1024, 4096, 4096, 4096, 256]
    - [76, 87.56]
  - - [4096, 256, 1, 2048, 4096, 4096, 4096, 256]
    - [78, 107.67]
  - - [4096, 256, 1, 4096, 4096, 4096, 4096, 256]
    - [76, 124.85]
  - - [4096, 256, 1, 8192, 4096, 4096, 4096, 256]
    - [76, 130.04]
  - - [4096, 512, 1, 128, 4096, 4096, 4096, 512]
    - [36, 38.27]
  - - [4096, 512, 1, 256, 4096, 4096, 4096, 512]
    - [36, 65.19]
  - - [4096, 512, 1, 512, 4096, 4096, 4096, 512]
    - [38, 98.68]
  - - [4096, 512, 1, 1024, 4096, 4096, 4096, 512]
    - [43, 131.01]
  - - [4096, 512, 1, 2048, 4096, 4096, 4096, 512]
    - [39, 159.15]
  - - [4096, 512, 1, 4096, 4096, 4096, 4096, 512]
    - [43, 178.25]
  - - [4096, 512, 1, 8192, 4096, 4096, 4096, 512]
    - [41, 167.52]
  - - [4096, 1024, 1, 128, 4096, 4096, 4096, 1024]
    - [29, 55.74]
  - - [4096, 1024, 1, 256, 4096, 4096, 4096, 1024]
    - [29, 93.82]
  - - [4096, 1024, 1, 512, 4096, 4096, 4096, 1024]
    - [30, 140.45]
  - - [4096, 1024, 1, 1024, 4096, 4096, 4096, 1024]
    - [31, 187.19]
  - - [4096, 1024, 1, 2048, 4096, 4096, 4096, 1024]
    - [33, 226.31]
  - - [4096, 1024, 1, 4096, 4096, 4096, 4096, 1024]
    - [69, 230.74]
  - - [4096, 1024, 1, 8192, 4096, 4096, 4096, 1024]
    - [66, 214.74]
  - - [4096, 2048, 1, 128, 4096, 4096, 4096, 2048]
    - [2, 69.85]
  - - [4096, 2048, 1, 256, 4096, 4096, 4096, 2048]
    - [3, 116.25]
  - - [4096, 2048, 1, 512, 4096, 4096, 4096, 2048]
    - [3, 174.35]
  - - [4096, 2048, 1, 1024, 4096, 4096, 4096, 2048]
    - [15, 231.82]
  - - [4096, 2048, 1, 2048, 4096, 4096, 4096, 2048]
    - [15, 263.54]
  - - [4096, 2048, 1, 4096, 4096, 4096, 4096, 2048]
    - [7, 246.07]
  - - [4096, 2048, 1, 8192, 4096, 4096, 4096, 2048]
    - [17, 266.31]
  - - [4096, 4096, 1, 128, 4096, 4096, 4096, 4096]
    - [13, 77.35]
  - - [4096, 4096, 1, 256, 4096, 4096, 4096, 4096]
    - [12, 126.6]
  - - [4096, 4096, 1, 512, 4096, 4096, 4096, 4096]
    - [12, 185.18]
  - - [4096, 4096, 1, 1024, 4096, 4096, 4096, 4096]
    - [4, 221.07]
  - - [4096, 4096, 1, 2048, 4096, 4096, 4096, 4096]
    - [16, 227.85]
  - - [4096, 4096, 1, 4096, 4096, 4096, 4096, 4096]
    - [9, 275.66]
  - - [4096, 4096, 1, 8192, 4096, 4096, 4096, 4096]
    - [11, 329.51]
  - - [4096, 8192, 1, 128, 4096, 4096, 4096, 8192]
    - [28, 96.83]
  - - [4096, 8192, 1, 256, 4096, 4096, 4096, 8192]
    - [23, 145.18]
  - - [4096, 8192, 1, 512, 4096, 4096, 4096, 8192]
    - [18, 187.55]
  - - [4096, 8192, 1, 1024, 4096, 4096, 4096, 8192]
    - [22, 215.72]
  - - [4096, 8192, 1, 2048, 4096, 4096, 4096, 8192]
    - [1, 259.25]
  - - [4096, 8192, 1, 4096, 4096, 4096, 4096, 8192]
    - [1, 314.88]
  - - [4096, 8192, 1, 8192, 4096, 4096, 4096, 8192]
    - [61, 353.56]
  - - [8192, 128, 1, 128, 8192, 8192, 8192, 128]
    - [47, 24.4]
  - - [8192, 128, 1, 256, 8192, 8192, 8192, 128]
    - [47, 41.74]
  - - [8192, 128, 1, 512, 8192, 8192, 8192, 128]
    - [47, 63.55]
  - - [8192, 128, 1, 1024, 8192, 8192, 8192, 128]
    - [45, 87.73]
  - - [8192, 128, 1, 2048, 8192, 8192, 8192, 128]
    - [77, 107.5]
  - - [8192, 128, 1, 4096, 8192, 8192, 8192, 128]
    - [77, 125.15]
  - - [8192, 128, 1, 8192, 8192, 8192, 8192, 128]
    - [76, 127.41]
  - - [8192, 256, 1, 128, 8192, 8192, 8192, 256]
    - [36, 38.78]
  - - [8192, 256, 1, 256, 8192, 8192, 8192, 256]
    - [37, 65.56]
  - - [8192, 256, 1, 512, 8192, 8192, 8192, 256]
    - [38, 99.19]
  - - [8192, 256, 1, 1024, 8192, 8192, 8192, 256]
    - [72, 132.62]
  - - [8192, 256, 1, 2048, 8192, 8192, 8192, 256]
    - [37, 159.14]
  - - [8192, 256, 1, 4096, 8192, 8192, 8192, 256]
    - [41, 177.63]
  - - [8192, 256, 1, 8192, 8192, 8192, 8192, 256]
    - [43, 161.13]
  - - [8192, 512, 1, 128, 8192, 8192, 8192, 512]
    - [29, 55.85]
  - - [8192, 512, 1, 256, 8192, 8192, 8192, 512]
    - [30, 93.46]
  - - [8192, 512, 1, 512, 8192, 8192, 8192, 512]
    - [32, 139.46]
  - - [8192, 512, 1, 1024, 8192, 8192, 8192, 512]
    - [33, 188.51]
  - - [8192, 512, 1, 2048, 8192, 8192, 8192, 512]
    - [31, 225.59]
  - - [8192, 512, 1, 4096, 8192, 8192, 8192, 512]
    - [65, 231.62]
  - - [8192, 512, 1, 8192, 8192, 8192, 8192, 512]
    - [67, 213.63]
  - - [8192, 1024, 1, 128, 8192, 8192, 8192, 1024]
    - [5, 69.57]
  - - [8192, 1024, 1, 256, 8192, 8192, 8192, 1024]
    - [15, 115.99]
  - - [8192, 1024, 1, 512, 8192, 8192, 8192, 1024]
    - [11, 174.38]
  - - [8192, 1024, 1, 1024, 8192, 8192, 8192, 1024]
    - [11, 228.69]
  - - [8192, 1024, 1, 2048, 8192, 8192, 8192, 1024]
    - [11, 258.05]
  - - [8192, 1024, 1, 4096, 8192, 8192, 8192, 1024]
    - [15, 248.44]
  - - [8192, 1024, 1, 8192, 8192, 8192, 8192, 1024]
    - [18, 271.73]
  - - [8192, 2048, 1, 128, 8192, 8192, 8192, 2048]
    - [9, 75.72]
  - - [8192, 2048, 1, 256, 8192, 8192, 8192, 2048]
    - [9, 124.73]
  - - [8192, 2048, 1, 512, 8192, 8192, 8192, 2048]
    - [9, 182.73]
  - - [8192, 2048, 1, 1024, 8192, 8192, 8192, 2048]
    - [4, 222.02]
  - - [8192, 2048, 1, 2048, 8192, 8192, 8192, 2048]
    - [8, 228.14]
  - - [8192, 2048, 1, 4096, 8192, 8192, 8192, 2048]
    - [10, 282.48]
  - - [8192, 2048, 1, 8192, 8192, 8192, 8192, 2048]
    - [61, 332.56]
  - - [8192, 4096, 1, 128, 8192, 8192, 8192, 4096]
    - [12, 81.63]
  - - [8192, 4096, 1, 256, 8192, 8192, 8192, 4096]
    - [13, 128.67]
  - - [8192, 4096, 1, 512, 8192, 8192, 8192, 4096]
    - [21, 184.59]
  - - [8192, 4096, 1, 1024, 8192, 8192, 8192, 4096]
    - [19, 220.22]
  - - [8192, 4096, 1, 2048, 8192, 8192, 8192, 4096]
    - [14, 274.63]
  - - [8192, 4096, 1, 4096, 8192, 8192, 8192, 4096]
    - [3, 303.52]
  - - [8192, 4096, 1, 8192, 8192, 8192, 8192, 4096]
    - [62, 336.85]
  - - [8192, 8192, 1, 128, 8192, 8192, 8192, 8192]
    - [25, 91.89]
  - - [8192, 8192, 1, 256, 8192, 8192, 8192, 8192]
    - [20, 138.26]
  - - [8192, 8192, 1, 512, 8192, 8192, 8192, 8192]
    - [4, 204.33]
  - - [8192, 8192, 1, 1024, 8192, 8192, 8192, 8192]
    - [15, 264.26]
  - - [8192, 8192, 1, 2048, 8192, 8192, 8192, 8192]
    - [62, 319.96]
  - - [8192, 8192, 1, 4096, 8192, 8192, 8192, 8192]
    - [62, 354.74]
  - - [8192, 8192, 1, 8192, 8192, 8192, 8192, 8192]
    - [6, 362.27]
- null
- null
- ExperimentalStreamK
- GridBased
