projects/hipblaslt/library/src/amd_detail/rocblaslt/src/Tensile/Logic/asm_full/aquavanjaram/gfx942_228cu/StreamK/aquavanjaram942_Cijk_Alik_Bljk_B8NSS_BH_Bias_HAS_SAV_UserArgs.yaml
- {MinimumRequiredVersion: 4.33.0}
- aquavanjaram942
- {Architecture: gfx942, CUCount: 228}
- [Device 0049, Device 0050]
    SolutionIndex: 0
    SolutionNameMin: Cijk_Alik_Bljk_B8NSS_BH_Bias_HAS_SAV_UserArgs_MT256x256x64_MI16x16x1_SN_LDSB1_CLR1_GRVWA16_GRVWB16_GSU0_GSUC0_GSUWGMRR0_K1_LBSPPA512_LBSPPB512_LPA16_LPB16_LRVW8_MIWT8_8_PLR1_SU0_SUM0_SUS64_VWA8_VWB8_WGM6_WGMXCC1_WGMXCCGn1
    SolutionIndex: 1
    SolutionNameMin: Cijk_Alik_Bljk_B8NSS_BH_Bias_HAS_SAV_UserArgs_MT128x256x64_MI16x16x1_SN_LDSB1_CLR1_GRVWA8_GRVWB8_GSU0_GSUC0_GSUWGMRR0_K1_LBSPPA256_LBSPPB512_LPA8_LPB8_LRVW8_MIWT4_8_PLR1_SU0_SUM0_SUS64_VWA4_VWB8_WGM1_WGMXCC1_WGMXCCGn1
    SolutionIndex: 2
    SolutionNameMin: Cijk_Alik_Bljk_B8NSS_BH_Bias_HAS_SAV_UserArgs_MT128x256x64_MI16x16x1_SN_LDSB1_CLR1_GRVWA16_GRVWB8_GSU0_GSUC0_GSUWGMRR0_K1_LBSPPA256_LBSPPB512_LPA16_LPB8_LRVW8_MIWT4_8_PLR1_SU0_SUM0_SUS64_VWA4_VWB8_WGM1_WGMXCC1_WGMXCCGn1
    SolutionIndex: 3
    SolutionNameMin: Cijk_Alik_Bljk_B8NSS_BH_Bias_HAS_SAV_UserArgs_MT128x256x64_MI16x16x1_SN_LDSB1_CLR1_GRVWA8_GRVWB16_GSU0_GSUC0_GSUWGMRR0_K1_LBSPPA256_LBSPPB512_LPA8_LPB16_LRVW8_MIWT4_8_PLR1_SU0_SUM0_SUS64_VWA4_VWB8_WGM1_WGMXCC1_WGMXCCGn1
    SolutionIndex: 4
    SolutionNameMin: Cijk_Alik_Bljk_B8NSS_BH_Bias_HAS_SAV_UserArgs_MT128x256x64_MI16x16x1_SN_LDSB1_CLR1_GRVWA16_GRVWB16_GSU0_GSUC0_GSUWGMRR0_K1_LBSPPA256_LBSPPB512_LPA16_LPB16_LRVW8_MIWT4_8_PLR1_SU0_SUM0_SUS64_VWA4_VWB8_WGM1_WGMXCC1_WGMXCCGn1
    SolutionIndex: 5
    SolutionNameMin: Cijk_Alik_Bljk_B8NSS_BH_Bias_HAS_SAV_UserArgs_MT128x128x64_MI16x16x1_SN_LDSB1_CLR1_GRVWA16_GRVWB8_GSU0_GSUC0_GSUWGMRR0_K1_LBSPPA256_LBSPPB256_LPA16_LPB8_LRVW8_MIWT4_4_PLR1_SU0_SUM0_SUS64_VWA4_VWB4_WGM1_WGMXCC1_WGMXCCGn1
    SolutionIndex: 6
    SolutionNameMin: Cijk_Alik_Bljk_B8NSS_BH_Bias_HAS_SAV_UserArgs_MT128x128x64_MI16x16x1_SN_LDSB1_CLR1_GRVWA8_GRVWB16_GSU0_GSUC0_GSUWGMRR0_K1_LBSPPA256_LBSPPB256_LPA8_LPB16_LRVW8_MIWT4_4_PLR1_SU0_SUM0_SUS64_VWA4_VWB4_WGM1_WGMXCC1_WGMXCCGn1
    SolutionIndex: 7
    SolutionNameMin: Cijk_Alik_Bljk_B8NSS_BH_Bias_HAS_SAV_UserArgs_MT128x128x64_MI16x16x1_SN_LDSB1_CLR1_GRVWA16_GRVWB16_GSU0_GSUC0_GSUWGMRR0_K1_LBSPPA256_LBSPPB256_LPA16_LPB16_LRVW8_MIWT4_4_PLR1_SU0_SUM0_SUS64_VWA4_VWB4_WGM1_WGMXCC1_WGMXCCGn1
    SolutionIndex: 8
    SolutionNameMin: Cijk_Alik_Bljk_B8NSS_BH_Bias_HAS_SAV_UserArgs_MT128x128x64_MI16x16x1_SN_LDSB1_CLR1_GRVWA8_GRVWB16_GSU0_GSUC0_GSUWGMRR0_K1_LBSPPA256_LBSPPB256_LPA8_LPB16_LRVW8_MIWT4_4_PLR1_SU0_SUM0_SUS64_VWA4_VWB4_WGM8_WGMXCC1_WGMXCCGn1
    SolutionIndex: 9
    SolutionNameMin: Cijk_Alik_Bljk_B8NSS_BH_Bias_HAS_SAV_UserArgs_MT64x128x64_MI16x16x1_SN_LDSB0_CLR1_GRVWA16_GRVWB8_GSU0_GSUC0_GSUWGMRR0_K1_LBSPPA128_LBSPPB256_LPA16_LPB8_LRVW8_MIWT2_4_PLR1_SU0_SUM0_SUS64_VWA2_VWB4_WGM1_WGMXCC1_WGMXCCGn1
    SolutionIndex: 10
    SolutionNameMin: Cijk_Alik_Bljk_B8NSS_BH_Bias_HAS_SAV_UserArgs_MT64x128x64_MI16x16x1_SN_LDSB0_CLR1_GRVWA16_GRVWB16_GSU0_GSUC0_GSUWGMRR0_K1_LBSPPA128_LBSPPB256_LPA16_LPB16_LRVW8_MIWT2_4_PLR1_SU0_SUM0_SUS64_VWA2_VWB4_WGM1_WGMXCC1_WGMXCCGn1
    SolutionIndex: 11
    SolutionNameMin: Cijk_Alik_Bljk_B8NSS_BH_Bias_HAS_SAV_UserArgs_MT128x64x64_MI16x16x1_SN_LDSB0_CLR1_GRVWA16_GRVWB8_GSU0_GSUC0_GSUWGMRR0_K1_LBSPPA256_LBSPPB128_LPA16_LPB8_LRVW8_MIWT4_2_PLR1_SU0_SUM0_SUS64_VWA4_VWB2_WGM1_WGMXCC1_WGMXCCGn1
    SolutionIndex: 12
    SolutionNameMin: Cijk_Alik_Bljk_B8NSS_BH_Bias_HAS_SAV_UserArgs_MT128x64x64_MI16x16x1_SN_LDSB0_CLR1_GRVWA8_GRVWB16_GSU0_GSUC0_GSUWGMRR0_K1_LBSPPA256_LBSPPB128_LPA8_LPB16_LRVW8_MIWT4_2_PLR1_SU0_SUM0_SUS64_VWA4_VWB2_WGM1_WGMXCC1_WGMXCCGn1
    SolutionIndex: 13
    SolutionNameMin: Cijk_Alik_Bljk_B8NSS_BH_Bias_HAS_SAV_UserArgs_MT128x64x64_MI16x16x1_SN_LDSB0_CLR1_GRVWA16_GRVWB16_GSU0_GSUC0_GSUWGMRR0_K1_LBSPPA256_LBSPPB128_LPA16_LPB16_LRVW8_MIWT4_2_PLR1_SU0_SUM0_SUS64_VWA4_VWB2_WGM1_WGMXCC1_WGMXCCGn1
    SolutionIndex: 14
    SolutionNameMin: Cijk_Alik_Bljk_B8NSS_BH_Bias_HAS_SAV_UserArgs_MT128x64x64_MI16x16x1_SN_LDSB0_CLR1_GRVWA8_GRVWB16_GSU0_GSUC0_GSUWGMRR0_K1_LBSPPA256_LBSPPB128_LPA8_LPB16_LRVW8_MIWT4_2_PLR1_SU0_SUM0_SUS64_VWA4_VWB2_WGM6_WGMXCC1_WGMXCCGn1
    SolutionIndex: 15
    SolutionNameMin: Cijk_Alik_Bljk_B8NSS_BH_Bias_HAS_SAV_UserArgs_MT128x64x64_MI16x16x1_SN_LDSB0_CLR1_GRVWA16_GRVWB16_GSU0_GSUC0_GSUWGMRR0_K1_LBSPPA256_LBSPPB128_LPA16_LPB16_LRVW8_MIWT4_2_PLR1_SU0_SUM0_SUS64_VWA4_VWB2_WGM6_WGMXCC1_WGMXCCGn1
    SolutionIndex: 16
    SolutionNameMin: Cijk_Alik_Bljk_B8NSS_BH_Bias_HAS_SAV_UserArgs_MT128x64x64_MI16x16x1_SN_LDSB0_CLR1_GRVWA8_GRVWB16_GSU0_GSUC0_GSUWGMRR0_K1_LBSPPA256_LBSPPB128_LPA8_LPB16_LRVW8_MIWT4_2_PLR1_SU0_SUM0_SUS64_VWA4_VWB2_WGM8_WGMXCC1_WGMXCCGn1
    SolutionIndex: 17
    SolutionNameMin: Cijk_Alik_Bljk_B8NSS_BH_Bias_HAS_SAV_UserArgs_MT128x64x64_MI16x16x1_SN_LDSB0_CLR1_GRVWA16_GRVWB16_GSU0_GSUC0_GSUWGMRR0_K1_LBSPPA256_LBSPPB128_LPA16_LPB16_LRVW8_MIWT4_2_PLR1_SU0_SUM0_SUS64_VWA4_VWB2_WGM8_WGMXCC1_WGMXCCGn1
    SolutionIndex: 18
    SolutionNameMin: Cijk_Alik_Bljk_B8NSS_BH_Bias_HAS_SAV_UserArgs_MT32x128x64_MI16x16x1_SN_LDSB0_CLR1_GRVWA8_GRVWB16_GSU0_GSUC0_GSUWGMRR0_K1_LBSPPA128_LBSPPB256_LPA8_LPB16_LRVW8_MIWT1_4_PLR1_SU0_SUM0_SUS64_VWA1_VWB4_WGM1_WGMXCC1_WGMXCCGn1
    SolutionIndex: 19
    SolutionNameMin: Cijk_Alik_Bljk_B8NSS_BH_Bias_HAS_SAV_UserArgs_MT128x32x64_MI16x16x1_SN_LDSB0_CLR1_GRVWA8_GRVWB8_GSU0_GSUC0_GSUWGMRR0_K1_LBSPPA256_LBSPPB128_LPA8_LPB8_LRVW8_MIWT4_1_PLR1_SU0_SUM0_SUS64_VWA4_VWB1_WGM1_WGMXCC1_WGMXCCGn1
    SolutionIndex: 20
    SolutionNameMin: Cijk_Alik_Bljk_B8NSS_BH_Bias_HAS_SAV_UserArgs_MT128x32x64_MI16x16x1_SN_LDSB0_CLR1_GRVWA16_GRVWB8_GSU0_GSUC0_GSUWGMRR0_K1_LBSPPA256_LBSPPB128_LPA16_LPB8_LRVW8_MIWT4_1_PLR1_SU0_SUM0_SUS64_VWA4_VWB1_WGM1_WGMXCC1_WGMXCCGn1
    SolutionIndex: 21
    SolutionNameMin: Cijk_Alik_Bljk_B8NSS_BH_Bias_HAS_SAV_UserArgs_MT128x32x64_MI16x16x1_SN_LDSB0_CLR1_GRVWA16_GRVWB8_GSU0_GSUC0_GSUWGMRR0_K1_LBSPPA256_LBSPPB128_LPA16_LPB8_LRVW8_MIWT4_1_PLR1_SU0_SUM0_SUS64_VWA4_VWB1_WGM6_WGMXCC1_WGMXCCGn1
    SolutionIndex: 22
    SolutionNameMin: Cijk_Alik_Bljk_B8NSS_BH_Bias_HAS_SAV_UserArgs_MT64x64x64_MI16x16x1_SN_LDSB0_CLR1_GRVWA8_GRVWB8_GSU0_GSUC0_GSUWGMRR0_K1_LBSPPA128_LBSPPB128_LPA8_LPB8_LRVW8_MIWT2_2_PLR1_SU0_SUM0_SUS64_VWA2_VWB2_WGM1_WGMXCC1_WGMXCCGn1
    SolutionIndex: 23
    SolutionNameMin: Cijk_Alik_Bljk_B8NSS_BH_Bias_HAS_SAV_UserArgs_MT64x64x64_MI16x16x1_SN_LDSB0_CLR1_GRVWA16_GRVWB8_GSU0_GSUC0_GSUWGMRR0_K1_LBSPPA128_LBSPPB128_LPA16_LPB8_LRVW8_MIWT2_2_PLR1_SU0_SUM0_SUS64_VWA2_VWB2_WGM1_WGMXCC1_WGMXCCGn1
    SolutionIndex: 24
    SolutionNameMin: Cijk_Alik_Bljk_B8NSS_BH_Bias_HAS_SAV_UserArgs_MT64x64x64_MI16x16x1_SN_LDSB0_CLR1_GRVWA8_GRVWB16_GSU0_GSUC0_GSUWGMRR0_K1_LBSPPA128_LBSPPB128_LPA8_LPB16_LRVW8_MIWT2_2_PLR1_SU0_SUM0_SUS64_VWA2_VWB2_WGM1_WGMXCC1_WGMXCCGn1
    SolutionIndex: 25
    SolutionNameMin: Cijk_Alik_Bljk_B8NSS_BH_Bias_HAS_SAV_UserArgs_MT64x64x64_MI16x16x1_SN_LDSB0_CLR1_GRVWA16_GRVWB16_GSU0_GSUC0_GSUWGMRR0_K1_LBSPPA128_LBSPPB128_LPA16_LPB16_LRVW8_MIWT2_2_PLR1_SU0_SUM0_SUS64_VWA2_VWB2_WGM1_WGMXCC1_WGMXCCGn1
    SolutionIndex: 26
    SolutionNameMin: Cijk_Alik_Bljk_B8NSS_BH_Bias_HAS_SAV_UserArgs_MT64x64x64_MI16x16x1_SN_LDSB0_CLR1_GRVWA8_GRVWB8_GSU0_GSUC0_GSUWGMRR0_K1_LBSPPA128_LBSPPB128_LPA8_LPB8_LRVW8_MIWT2_2_PLR1_SU0_SUM0_SUS64_VWA2_VWB2_WGM6_WGMXCC1_WGMXCCGn1
    SolutionIndex: 27
    SolutionNameMin: Cijk_Alik_Bljk_B8NSS_BH_Bias_HAS_SAV_UserArgs_MT64x64x64_MI16x16x1_SN_LDSB0_CLR1_GRVWA8_GRVWB16_GSU0_GSUC0_GSUWGMRR0_K1_LBSPPA128_LBSPPB128_LPA8_LPB16_LRVW8_MIWT2_2_PLR1_SU0_SUM0_SUS64_VWA2_VWB2_WGM8_WGMXCC1_WGMXCCGn1
    SolutionIndex: 28
    SolutionNameMin: Cijk_Alik_Bljk_B8NSS_BH_Bias_HAS_SAV_UserArgs_MT32x64x64_MI16x16x1_SN_LDSB0_CLR1_GRVWA8_GRVWB8_GSU0_GSUC0_GSUWGMRR0_K1_LBSPPA128_LBSPPB128_LPA8_LPB8_LRVW8_MIWT1_2_PLR1_SU0_SUM0_SUS64_VWA1_VWB2_WGM1_WGMXCC1_WGMXCCGn1
    SolutionIndex: 29
    SolutionNameMin: Cijk_Alik_Bljk_B8NSS_BH_Bias_HAS_SAV_UserArgs_MT32x64x64_MI16x16x1_SN_LDSB0_CLR1_GRVWA8_GRVWB16_GSU0_GSUC0_GSUWGMRR0_K1_LBSPPA128_LBSPPB128_LPA8_LPB16_LRVW8_MIWT1_2_PLR1_SU0_SUM0_SUS64_VWA1_VWB2_WGM1_WGMXCC1_WGMXCCGn1
    SolutionIndex: 30
    SolutionNameMin: Cijk_Alik_Bljk_B8NSS_BH_Bias_HAS_SAV_UserArgs_MT32x64x64_MI16x16x1_SN_LDSB0_CLR1_GRVWA8_GRVWB16_GSU0_GSUC0_GSUWGMRR0_K1_LBSPPA128_LBSPPB128_LPA8_LPB16_LRVW8_MIWT1_2_PLR1_SU0_SUM0_SUS64_VWA1_VWB2_WGM8_WGMXCC1_WGMXCCGn1
    SolutionIndex: 31
    SolutionNameMin: Cijk_Alik_Bljk_B8NSS_BH_Bias_HAS_SAV_UserArgs_MT64x32x64_MI16x16x1_SN_LDSB0_CLR1_GRVWA8_GRVWB8_GSU0_GSUC0_GSUWGMRR0_K1_LBSPPA128_LBSPPB128_LPA8_LPB8_LRVW8_MIWT2_1_PLR1_SU0_SUM0_SUS64_VWA2_VWB1_WGM1_WGMXCC1_WGMXCCGn1
    SolutionIndex: 32
    SolutionNameMin: Cijk_Alik_Bljk_B8NSS_BH_Bias_HAS_SAV_UserArgs_MT64x32x64_MI16x16x1_SN_LDSB0_CLR1_GRVWA16_GRVWB8_GSU0_GSUC0_GSUWGMRR0_K1_LBSPPA128_LBSPPB128_LPA16_LPB8_LRVW8_MIWT2_1_PLR1_SU0_SUM0_SUS64_VWA2_VWB1_WGM1_WGMXCC1_WGMXCCGn1
    SolutionIndex: 33
    SolutionNameMin: Cijk_Alik_Bljk_B8NSS_BH_Bias_HAS_SAV_UserArgs_MT32x32x64_MI16x16x1_SN_LDSB0_CLR1_GRVWA8_GRVWB8_GSU0_GSUC0_GSUWGMRR0_K1_LBSPPA128_LBSPPB128_LPA8_LPB8_LRVW8_MIWT1_1_PLR1_SU0_SUM0_SUS64_VWA1_VWB1_WGM1_WGMXCC1_WGMXCCGn1
    SolutionIndex: 34
    SolutionNameMin: Cijk_Alik_Bljk_B8NSS_BH_Bias_HAS_SAV_UserArgs_MT128x256x128_MI16x16x1_SN_LDSB1_CLR1_GRVWA8_GRVWB16_GSU0_GSUC0_GSUWGMRR0_K1_LBSPPA512_LBSPPB1024_LPA8_LPB16_LRVW8_MIWT4_8_PLR1_SU0_SUM0_SUS128_VWA4_VWB8_WGM1_WGMXCC1_WGMXCCGn1
    SolutionIndex: 35
    SolutionNameMin: Cijk_Alik_Bljk_B8NSS_BH_Bias_HAS_SAV_UserArgs_MT128x256x128_MI16x16x1_SN_LDSB1_CLR1_GRVWA8_GRVWB16_GSU0_GSUC0_GSUWGMRR0_K1_LBSPPA512_LBSPPB1024_LPA8_LPB16_LRVW8_MIWT4_8_PLR1_SU0_SUM0_SUS128_VWA4_VWB8_WGM6_WGMXCC1_WGMXCCGn1
    SolutionIndex: 36
    SolutionNameMin: Cijk_Alik_Bljk_B8NSS_BH_Bias_HAS_SAV_UserArgs_MT128x256x128_MI16x16x1_SN_LDSB1_CLR1_GRVWA8_GRVWB16_GSU0_GSUC0_GSUWGMRR0_K1_LBSPPA512_LBSPPB1024_LPA8_LPB16_LRVW8_MIWT4_8_PLR1_SU0_SUM0_SUS128_VWA4_VWB8_WGM8_WGMXCC1_WGMXCCGn1
    SolutionIndex: 37
    SolutionNameMin: Cijk_Alik_Bljk_B8NSS_BH_Bias_HAS_SAV_UserArgs_MT256x144x128_MI16x16x1_SN_LDSB1_CLR1_GRVWA8_GRVWB8_GSU0_GSUC0_GSUWGMRR0_K1_LBSPPA512_LBSPPB128_LPA8_LPB8_LRVW8_MIWT4_9_PLR1_SU0_SUM0_SUS128_VWA4_VWB1_WGM1_WGMXCC1_WGMXCCGn1
    SolutionIndex: 38
    SolutionNameMin: Cijk_Alik_Bljk_B8NSS_BH_Bias_HAS_SAV_UserArgs_MT256x144x128_MI16x16x1_SN_LDSB1_CLR1_GRVWA16_GRVWB8_GSU0_GSUC0_GSUWGMRR0_K1_LBSPPA512_LBSPPB128_LPA16_LPB8_LRVW8_MIWT4_9_PLR1_SU0_SUM0_SUS128_VWA4_VWB1_WGM1_WGMXCC1_WGMXCCGn1
    SolutionIndex: 39
    SolutionNameMin: Cijk_Alik_Bljk_B8NSS_BH_Bias_HAS_SAV_UserArgs_MT256x144x128_MI16x16x1_SN_LDSB1_CLR1_GRVWA8_GRVWB8_GSU0_GSUC0_GSUWGMRR0_K1_LBSPPA512_LBSPPB128_LPA8_LPB8_LRVW8_MIWT4_9_PLR1_SU0_SUM0_SUS128_VWA4_VWB1_WGM6_WGMXCC1_WGMXCCGn1
    SolutionIndex: 40
    SolutionNameMin: Cijk_Alik_Bljk_B8NSS_BH_Bias_HAS_SAV_UserArgs_MT256x144x128_MI16x16x1_SN_LDSB1_CLR1_GRVWA16_GRVWB8_GSU0_GSUC0_GSUWGMRR0_K1_LBSPPA512_LBSPPB128_LPA16_LPB8_LRVW8_MIWT4_9_PLR1_SU0_SUM0_SUS128_VWA4_VWB1_WGM6_WGMXCC1_WGMXCCGn1
    SolutionIndex: 41
    SolutionNameMin: Cijk_Alik_Bljk_B8NSS_BH_Bias_HAS_SAV_UserArgs_MT256x144x128_MI16x16x1_SN_LDSB1_CLR1_GRVWA8_GRVWB8_GSU0_GSUC0_GSUWGMRR0_K1_LBSPPA512_LBSPPB128_LPA8_LPB8_LRVW8_MIWT4_9_PLR1_SU0_SUM0_SUS128_VWA4_VWB1_WGM8_WGMXCC1_WGMXCCGn1
    SolutionIndex: 42
    SolutionNameMin: Cijk_Alik_Bljk_B8NSS_BH_Bias_HAS_SAV_UserArgs_MT256x144x128_MI16x16x1_SN_LDSB1_CLR1_GRVWA16_GRVWB8_GSU0_GSUC0_GSUWGMRR0_K1_LBSPPA512_LBSPPB128_LPA16_LPB8_LRVW8_MIWT4_9_PLR1_SU0_SUM0_SUS128_VWA4_VWB1_WGM8_WGMXCC1_WGMXCCGn1
    SolutionIndex: 43
    SolutionNameMin: Cijk_Alik_Bljk_B8NSS_BH_Bias_HAS_SAV_UserArgs_MT256x128x128_MI16x16x1_SN_LDSB1_CLR1_GRVWA8_GRVWB16_GSU0_GSUC0_GSUWGMRR0_K1_LBSPPA1024_LBSPPB512_LPA8_LPB16_LRVW8_MIWT8_4_PLR1_SU0_SUM0_SUS128_VWA8_VWB4_WGM8_WGMXCC1_WGMXCCGn1
    SolutionIndex: 44
    SolutionNameMin: Cijk_Alik_Bljk_B8NSS_BH_Bias_HAS_SAV_UserArgs_MT144x256x128_MI16x16x1_SN_LDSB1_CLR1_GRVWA8_GRVWB16_GSU0_GSUC0_GSUWGMRR0_K1_LBSPPA128_LBSPPB512_LPA8_LPB16_LRVW8_MIWT9_4_PLR1_SU0_SUM0_SUS128_VWA1_VWB4_WGM1_WGMXCC1_WGMXCCGn1
    SolutionIndex: 45
    SolutionNameMin: Cijk_Alik_Bljk_B8NSS_BH_Bias_HAS_SAV_UserArgs_MT144x256x128_MI16x16x1_SN_LDSB1_CLR1_GRVWA8_GRVWB8_GSU0_GSUC0_GSUWGMRR0_K1_LBSPPA128_LBSPPB512_LPA8_LPB8_LRVW8_MIWT9_4_PLR1_SU0_SUM0_SUS128_VWA1_VWB4_WGM6_WGMXCC1_WGMXCCGn1
    SolutionIndex: 46
    SolutionNameMin: Cijk_Alik_Bljk_B8NSS_BH_Bias_HAS_SAV_UserArgs_MT144x256x128_MI16x16x1_SN_LDSB1_CLR1_GRVWA8_GRVWB16_GSU0_GSUC0_GSUWGMRR0_K1_LBSPPA128_LBSPPB512_LPA8_LPB16_LRVW8_MIWT9_4_PLR1_SU0_SUM0_SUS128_VWA1_VWB4_WGM6_WGMXCC1_WGMXCCGn1
    SolutionIndex: 47
    SolutionNameMin: Cijk_Alik_Bljk_B8NSS_BH_Bias_HAS_SAV_UserArgs_MT144x256x128_MI16x16x1_SN_LDSB1_CLR1_GRVWA8_GRVWB16_GSU0_GSUC0_GSUWGMRR0_K1_LBSPPA128_LBSPPB512_LPA8_LPB16_LRVW8_MIWT9_4_PLR1_SU0_SUM0_SUS128_VWA1_VWB4_WGM8_WGMXCC1_WGMXCCGn1
    SolutionIndex: 48
    SolutionNameMin: Cijk_Alik_Bljk_B8NSS_BH_Bias_HAS_SAV_UserArgs_MT64x144x128_MI16x16x1_SN_LDSB1_CLR1_GRVWA16_GRVWB8_GSU0_GSUC0_GSUWGMRR0_K1_LBSPPA128_LBSPPB128_LPA16_LPB8_LRVW8_MIWT1_9_PLR1_SU0_SUM0_SUS128_VWA1_VWB1_WGM1_WGMXCC1_WGMXCCGn1
    SolutionIndex: 49
    SolutionNameMin: Cijk_Alik_Bljk_B8NSS_BH_Bias_HAS_SAV_UserArgs_MT128x144x128_MI16x16x1_SN_LDSB1_CLR1_GRVWA8_GRVWB8_GSU0_GSUC0_GSUWGMRR0_K1_LBSPPA256_LBSPPB128_LPA8_LPB8_LRVW8_MIWT2_9_PLR1_SU0_SUM0_SUS128_VWA2_VWB1_WGM1_WGMXCC1_WGMXCCGn1
    SolutionIndex: 50
    SolutionNameMin: Cijk_Alik_Bljk_B8NSS_BH_Bias_HAS_SAV_UserArgs_MT128x144x128_MI16x16x1_SN_LDSB1_CLR1_GRVWA16_GRVWB8_GSU0_GSUC0_GSUWGMRR0_K1_LBSPPA256_LBSPPB128_LPA16_LPB8_LRVW8_MIWT2_9_PLR1_SU0_SUM0_SUS128_VWA2_VWB1_WGM1_WGMXCC1_WGMXCCGn1
    SolutionIndex: 51
    SolutionNameMin: Cijk_Alik_Bljk_B8NSS_BH_Bias_HAS_SAV_UserArgs_MT128x144x128_MI16x16x1_SN_LDSB1_CLR1_GRVWA16_GRVWB8_GSU0_GSUC0_GSUWGMRR0_K1_LBSPPA256_LBSPPB128_LPA16_LPB8_LRVW8_MIWT2_9_PLR1_SU0_SUM0_SUS128_VWA2_VWB1_WGM8_WGMXCC1_WGMXCCGn1
    SolutionIndex: 52
    SolutionNameMin: Cijk_Alik_Bljk_B8NSS_BH_Bias_HAS_SAV_UserArgs_MT144x64x128_MI16x16x1_SN_LDSB1_CLR1_GRVWA8_GRVWB16_GSU0_GSUC0_GSUWGMRR0_K1_LBSPPA128_LBSPPB128_LPA8_LPB16_LRVW8_MIWT9_1_PLR1_SU0_SUM0_SUS128_VWA1_VWB1_WGM1_WGMXCC1_WGMXCCGn1
    SolutionIndex: 53
    SolutionNameMin: Cijk_Alik_Bljk_B8NSS_BH_Bias_HAS_SAV_UserArgs_MT144x64x128_MI16x16x1_SN_LDSB1_CLR1_GRVWA8_GRVWB8_GSU0_GSUC0_GSUWGMRR0_K1_LBSPPA128_LBSPPB128_LPA8_LPB8_LRVW8_MIWT9_1_PLR1_SU0_SUM0_SUS128_VWA1_VWB1_WGM6_WGMXCC1_WGMXCCGn1
    SolutionIndex: 54
    SolutionNameMin: Cijk_Alik_Bljk_B8NSS_BH_Bias_HAS_SAV_UserArgs_MT144x64x128_MI16x16x1_SN_LDSB1_CLR1_GRVWA8_GRVWB16_GSU0_GSUC0_GSUWGMRR0_K1_LBSPPA128_LBSPPB128_LPA8_LPB16_LRVW8_MIWT9_1_PLR1_SU0_SUM0_SUS128_VWA1_VWB1_WGM6_WGMXCC1_WGMXCCGn1
    SolutionIndex: 55
    SolutionNameMin: Cijk_Alik_Bljk_B8NSS_BH_Bias_HAS_SAV_UserArgs_MT144x64x128_MI16x16x1_SN_LDSB1_CLR1_GRVWA8_GRVWB16_GSU0_GSUC0_GSUWGMRR0_K1_LBSPPA128_LBSPPB128_LPA8_LPB16_LRVW8_MIWT9_1_PLR1_SU0_SUM0_SUS128_VWA1_VWB1_WGM8_WGMXCC1_WGMXCCGn1
    SolutionIndex: 56
    SolutionNameMin: Cijk_Alik_Bljk_B8NSS_BH_Bias_HAS_SAV_UserArgs_MT144x128x128_MI16x16x1_SN_LDSB1_CLR1_GRVWA8_GRVWB16_GSU0_GSUC0_GSUWGMRR0_K1_LBSPPA128_LBSPPB256_LPA8_LPB16_LRVW8_MIWT9_2_PLR1_SU0_SUM0_SUS128_VWA1_VWB2_WGM1_WGMXCC1_WGMXCCGn1
    SolutionIndex: 57
    SolutionNameMin: Cijk_Alik_Bljk_B8NSS_BH_Bias_HAS_SAV_UserArgs_MT144x128x128_MI16x16x1_SN_LDSB1_CLR1_GRVWA8_GRVWB16_GSU0_GSUC0_GSUWGMRR0_K1_LBSPPA128_LBSPPB256_LPA8_LPB16_LRVW8_MIWT9_2_PLR1_SU0_SUM0_SUS128_VWA1_VWB2_WGM6_WGMXCC1_WGMXCCGn1
    SolutionIndex: 58
    SolutionNameMin: Cijk_Alik_Bljk_B8NSS_BH_Bias_HAS_SAV_UserArgs_MT144x128x128_MI16x16x1_SN_LDSB1_CLR1_GRVWA8_GRVWB16_GSU0_GSUC0_GSUWGMRR0_K1_LBSPPA128_LBSPPB256_LPA8_LPB16_LRVW8_MIWT9_2_PLR1_SU0_SUM0_SUS128_VWA1_VWB2_WGM8_WGMXCC1_WGMXCCGn1
    SolutionIndex: 59
    SolutionNameMin: Cijk_Alik_Bljk_B8NSS_BH_Bias_HAS_SAV_UserArgs_MT128x128x128_MI16x16x1_SN_LDSB1_CLR1_GRVWA8_GRVWB16_GSU0_GSUC0_GSUWGMRR0_K1_LBSPPA512_LBSPPB512_LPA8_LPB16_LRVW8_MIWT4_4_PLR1_SU0_SUM0_SUS128_VWA4_VWB4_WGM1_WGMXCC1_WGMXCCGn1
    SolutionIndex: 60
    SolutionNameMin: Cijk_Alik_Bljk_B8NSS_BH_Bias_HAS_SAV_UserArgs_MT128x128x128_MI16x16x1_SN_LDSB1_CLR1_GRVWA16_GRVWB16_GSU0_GSUC0_GSUWGMRR0_K1_LBSPPA512_LBSPPB512_LPA16_LPB16_LRVW8_MIWT4_4_PLR1_SU0_SUM0_SUS128_VWA4_VWB4_WGM1_WGMXCC1_WGMXCCGn1
    SolutionIndex: 61
    SolutionNameMin: Cijk_Alik_Bljk_B8NSS_BH_Bias_HAS_SAV_UserArgs_MT128x128x128_MI16x16x1_SN_LDSB1_CLR1_GRVWA8_GRVWB16_GSU0_GSUC0_GSUWGMRR0_K1_LBSPPA512_LBSPPB512_LPA8_LPB16_LRVW8_MIWT4_4_PLR1_SU0_SUM0_SUS128_VWA4_VWB4_WGM6_WGMXCC1_WGMXCCGn1
    SolutionIndex: 62
    SolutionNameMin: Cijk_Alik_Bljk_B8NSS_BH_Bias_HAS_SAV_UserArgs_MT128x128x128_MI16x16x1_SN_LDSB1_CLR1_GRVWA16_GRVWB16_GSU0_GSUC0_GSUWGMRR0_K1_LBSPPA512_LBSPPB512_LPA16_LPB16_LRVW8_MIWT4_4_PLR1_SU0_SUM0_SUS128_VWA4_VWB4_WGM6_WGMXCC1_WGMXCCGn1
    SolutionIndex: 63
    SolutionNameMin: Cijk_Alik_Bljk_B8NSS_BH_Bias_HAS_SAV_UserArgs_MT128x128x128_MI16x16x1_SN_LDSB1_CLR1_GRVWA8_GRVWB16_GSU0_GSUC0_GSUWGMRR0_K1_LBSPPA512_LBSPPB512_LPA8_LPB16_LRVW8_MIWT4_4_PLR1_SU0_SUM0_SUS128_VWA4_VWB4_WGM8_WGMXCC1_WGMXCCGn1
    SolutionIndex: 64
    SolutionNameMin: Cijk_Alik_Bljk_B8NSS_BH_Bias_HAS_SAV_UserArgs_MT64x128x128_MI16x16x1_SN_LDSB1_CLR1_GRVWA8_GRVWB16_GSU0_GSUC0_GSUWGMRR0_K1_LBSPPA256_LBSPPB512_LPA8_LPB16_LRVW8_MIWT2_4_PLR1_SU0_SUM0_SUS128_VWA2_VWB4_WGM1_WGMXCC1_WGMXCCGn1
    SolutionIndex: 65
    SolutionNameMin: Cijk_Alik_Bljk_B8NSS_BH_Bias_HAS_SAV_UserArgs_MT64x128x128_MI16x16x1_SN_LDSB1_CLR1_GRVWA8_GRVWB16_GSU0_GSUC0_GSUWGMRR0_K1_LBSPPA256_LBSPPB512_LPA8_LPB16_LRVW8_MIWT2_4_PLR1_SU0_SUM0_SUS128_VWA2_VWB4_WGM6_WGMXCC1_WGMXCCGn1
    SolutionIndex: 66
    SolutionNameMin: Cijk_Alik_Bljk_B8NSS_BH_Bias_HAS_SAV_UserArgs_MT128x64x128_MI16x16x1_SN_LDSB1_CLR1_GRVWA16_GRVWB16_GSU0_GSUC0_GSUWGMRR0_K1_LBSPPA512_LBSPPB256_LPA16_LPB16_LRVW8_MIWT4_2_PLR1_SU0_SUM0_SUS128_VWA4_VWB2_WGM1_WGMXCC1_WGMXCCGn1
    SolutionIndex: 67
    SolutionNameMin: Cijk_Alik_Bljk_B8NSS_BH_Bias_HAS_SAV_UserArgs_MT128x64x128_MI16x16x1_SN_LDSB1_CLR1_GRVWA16_GRVWB16_GSU0_GSUC0_GSUWGMRR0_K1_LBSPPA512_LBSPPB256_LPA16_LPB16_LRVW8_MIWT4_2_PLR1_SU0_SUM0_SUS128_VWA4_VWB2_WGM6_WGMXCC1_WGMXCCGn1
    SolutionIndex: 68
    SolutionNameMin: Cijk_Alik_Bljk_B8NSS_BH_Bias_HAS_SAV_UserArgs_MT128x32x128_MI16x16x1_SN_LDSB1_CLR1_GRVWA8_GRVWB8_GSU0_GSUC0_GSUWGMRR0_K1_LBSPPA512_LBSPPB128_LPA8_LPB8_LRVW8_MIWT4_1_PLR1_SU0_SUM0_SUS128_VWA4_VWB1_WGM1_WGMXCC1_WGMXCCGn1
    SolutionIndex: 69
    SolutionNameMin: Cijk_Alik_Bljk_B8NSS_BH_Bias_HAS_SAV_UserArgs_MT128x32x128_MI16x16x1_SN_LDSB1_CLR1_GRVWA16_GRVWB16_GSU0_GSUC0_GSUWGMRR0_K1_LBSPPA512_LBSPPB128_LPA16_LPB16_LRVW8_MIWT4_1_PLR1_SU0_SUM0_SUS128_VWA4_VWB1_WGM1_WGMXCC1_WGMXCCGn1
    SolutionIndex: 70
    SolutionNameMin: Cijk_Alik_Bljk_B8NSS_BH_Bias_HAS_SAV_UserArgs_MT64x64x128_MI16x16x1_SN_LDSB1_CLR1_GRVWA16_GRVWB8_GSU0_GSUC0_GSUWGMRR0_K1_LBSPPA256_LBSPPB256_LPA16_LPB8_LRVW8_MIWT2_2_PLR1_SU0_SUM0_SUS128_VWA2_VWB2_WGM1_WGMXCC1_WGMXCCGn1
    SolutionIndex: 71
    SolutionNameMin: Cijk_Alik_Bljk_B8NSS_BH_Bias_HAS_SAV_UserArgs_MT64x64x128_MI16x16x1_SN_LDSB1_CLR1_GRVWA8_GRVWB16_GSU0_GSUC0_GSUWGMRR0_K1_LBSPPA256_LBSPPB256_LPA8_LPB16_LRVW8_MIWT2_2_PLR1_SU0_SUM0_SUS128_VWA2_VWB2_WGM1_WGMXCC1_WGMXCCGn1
    SolutionIndex: 72
    SolutionNameMin: Cijk_Alik_Bljk_B8NSS_BH_Bias_HAS_SAV_UserArgs_MT64x64x128_MI16x16x1_SN_LDSB1_CLR1_GRVWA8_GRVWB16_GSU0_GSUC0_GSUWGMRR0_K1_LBSPPA256_LBSPPB256_LPA8_LPB16_LRVW8_MIWT2_2_PLR1_SU0_SUM0_SUS128_VWA2_VWB2_WGM6_WGMXCC1_WGMXCCGn1
    SolutionIndex: 73
    SolutionNameMin: Cijk_Alik_Bljk_B8NSS_BH_Bias_HAS_SAV_UserArgs_MT64x64x128_MI16x16x1_SN_LDSB1_CLR1_GRVWA8_GRVWB16_GSU0_GSUC0_GSUWGMRR0_K1_LBSPPA256_LBSPPB256_LPA8_LPB16_LRVW8_MIWT2_2_PLR1_SU0_SUM0_SUS128_VWA2_VWB2_WGM8_WGMXCC1_WGMXCCGn1
    SolutionIndex: 74
    SolutionNameMin: Cijk_Alik_Bljk_B8NSS_BH_Bias_HAS_SAV_UserArgs_MT32x64x128_MI16x16x1_SN_LDSB0_CLR1_GRVWA8_GRVWB8_GSU0_GSUC0_GSUWGMRR0_K1_LBSPPA128_LBSPPB256_LPA8_LPB8_LRVW8_MIWT1_2_PLR1_SU0_SUM0_SUS128_VWA1_VWB2_WGM1_WGMXCC1_WGMXCCGn1
    SolutionIndex: 75
    SolutionNameMin: Cijk_Alik_Bljk_B8NSS_BH_Bias_HAS_SAV_UserArgs_MT32x64x128_MI16x16x1_SN_LDSB0_CLR1_GRVWA8_GRVWB16_GSU0_GSUC0_GSUWGMRR0_K1_LBSPPA128_LBSPPB256_LPA8_LPB16_LRVW8_MIWT1_2_PLR1_SU0_SUM0_SUS128_VWA1_VWB2_WGM1_WGMXCC1_WGMXCCGn1
    SolutionIndex: 76
    SolutionNameMin: Cijk_Alik_Bljk_B8NSS_BH_Bias_HAS_SAV_UserArgs_MT32x64x128_MI16x16x1_SN_LDSB0_CLR1_GRVWA16_GRVWB16_GSU0_GSUC0_GSUWGMRR0_K1_LBSPPA128_LBSPPB256_LPA16_LPB16_LRVW8_MIWT1_2_PLR1_SU0_SUM0_SUS128_VWA1_VWB2_WGM1_WGMXCC1_WGMXCCGn1
    SolutionIndex: 77
    SolutionNameMin: Cijk_Alik_Bljk_B8NSS_BH_Bias_HAS_SAV_UserArgs_MT32x64x128_MI16x16x1_SN_LDSB0_CLR1_GRVWA8_GRVWB8_GSU0_GSUC0_GSUWGMRR0_K1_LBSPPA128_LBSPPB256_LPA8_LPB8_LRVW8_MIWT1_2_PLR1_SU0_SUM0_SUS128_VWA1_VWB2_WGM8_WGMXCC1_WGMXCCGn1
    SolutionIndex: 78
    SolutionNameMin: Cijk_Alik_Bljk_B8NSS_BH_Bias_HAS_SAV_UserArgs_MT32x64x128_MI16x16x1_SN_LDSB0_CLR1_GRVWA16_GRVWB8_GSU0_GSUC0_GSUWGMRR0_K1_LBSPPA128_LBSPPB256_LPA16_LPB8_LRVW8_MIWT1_2_PLR1_SU0_SUM0_SUS128_VWA1_VWB2_WGM8_WGMXCC1_WGMXCCGn1
    SolutionIndex: 79
    SolutionNameMin: Cijk_Alik_Bljk_B8NSS_BH_Bias_HAS_SAV_UserArgs_MT32x64x128_MI16x16x1_SN_LDSB0_CLR1_GRVWA8_GRVWB16_GSU0_GSUC0_GSUWGMRR0_K1_LBSPPA128_LBSPPB256_LPA8_LPB16_LRVW8_MIWT1_2_PLR1_SU0_SUM0_SUS128_VWA1_VWB2_WGM8_WGMXCC1_WGMXCCGn1
    SolutionIndex: 80
    SolutionNameMin: Cijk_Alik_Bljk_B8NSS_BH_Bias_HAS_SAV_UserArgs_MT64x32x128_MI16x16x1_SN_LDSB0_CLR1_GRVWA8_GRVWB8_GSU0_GSUC0_GSUWGMRR0_K1_LBSPPA256_LBSPPB128_LPA8_LPB8_LRVW8_MIWT2_1_PLR1_SU0_SUM0_SUS128_VWA2_VWB1_WGM1_WGMXCC1_WGMXCCGn1
    SolutionIndex: 81
    SolutionNameMin: Cijk_Alik_Bljk_B8NSS_BH_Bias_HAS_SAV_UserArgs_MT64x32x128_MI16x16x1_SN_LDSB0_CLR1_GRVWA16_GRVWB8_GSU0_GSUC0_GSUWGMRR0_K1_LBSPPA256_LBSPPB128_LPA16_LPB8_LRVW8_MIWT2_1_PLR1_SU0_SUM0_SUS128_VWA2_VWB1_WGM1_WGMXCC1_WGMXCCGn1
    SolutionIndex: 82
    SolutionNameMin: Cijk_Alik_Bljk_B8NSS_BH_Bias_HAS_SAV_UserArgs_MT64x32x128_MI16x16x1_SN_LDSB0_CLR1_GRVWA8_GRVWB16_GSU0_GSUC0_GSUWGMRR0_K1_LBSPPA256_LBSPPB128_LPA8_LPB16_LRVW8_MIWT2_1_PLR1_SU0_SUM0_SUS128_VWA2_VWB1_WGM1_WGMXCC1_WGMXCCGn1
    SolutionIndex: 83
    SolutionNameMin: Cijk_Alik_Bljk_B8NSS_BH_Bias_HAS_SAV_UserArgs_MT64x32x128_MI16x16x1_SN_LDSB0_CLR1_GRVWA16_GRVWB16_GSU0_GSUC0_GSUWGMRR0_K1_LBSPPA256_LBSPPB128_LPA16_LPB16_LRVW8_MIWT2_1_PLR1_SU0_SUM0_SUS128_VWA2_VWB1_WGM1_WGMXCC1_WGMXCCGn1
    SolutionIndex: 84
    SolutionNameMin: Cijk_Alik_Bljk_B8NSS_BH_Bias_HAS_SAV_UserArgs_MT64x32x128_MI16x16x1_SN_LDSB0_CLR1_GRVWA8_GRVWB8_GSU0_GSUC0_GSUWGMRR0_K1_LBSPPA256_LBSPPB128_LPA8_LPB8_LRVW8_MIWT2_1_PLR1_SU0_SUM0_SUS128_VWA2_VWB1_WGM8_WGMXCC1_WGMXCCGn1
    SolutionIndex: 85
    SolutionNameMin: Cijk_Alik_Bljk_B8NSS_BH_Bias_HAS_SAV_UserArgs_MT64x32x128_MI16x16x1_SN_LDSB0_CLR1_GRVWA16_GRVWB16_GSU0_GSUC0_GSUWGMRR0_K1_LBSPPA256_LBSPPB128_LPA16_LPB16_LRVW8_MIWT2_1_PLR1_SU0_SUM0_SUS128_VWA2_VWB1_WGM8_WGMXCC1_WGMXCCGn1
    SolutionIndex: 86
    SolutionNameMin: Cijk_Alik_Bljk_B8NSS_BH_Bias_HAS_SAV_UserArgs_MT32x32x128_MI16x16x1_SN_LDSB0_CLR1_GRVWA8_GRVWB8_GSU0_GSUC0_GSUWGMRR0_K1_LBSPPA128_LBSPPB128_LPA8_LPB8_LRVW8_MIWT1_1_PLR1_SU0_SUM0_SUS128_VWA1_VWB1_WGM1_WGMXCC1_WGMXCCGn1
    SolutionIndex: 87
    SolutionNameMin: Cijk_Alik_Bljk_B8NSS_BH_Bias_HAS_SAV_UserArgs_MT32x32x128_MI16x16x1_SN_LDSB0_CLR1_GRVWA16_GRVWB8_GSU0_GSUC0_GSUWGMRR0_K1_LBSPPA128_LBSPPB128_LPA16_LPB8_LRVW8_MIWT1_1_PLR1_SU0_SUM0_SUS128_VWA1_VWB1_WGM1_WGMXCC1_WGMXCCGn1
    SolutionIndex: 88
    SolutionNameMin: Cijk_Alik_Bljk_B8NSS_BH_Bias_HAS_SAV_UserArgs_MT32x32x128_MI16x16x1_SN_LDSB0_CLR1_GRVWA8_GRVWB16_GSU0_GSUC0_GSUWGMRR0_K1_LBSPPA128_LBSPPB128_LPA8_LPB16_LRVW8_MIWT1_1_PLR1_SU0_SUM0_SUS128_VWA1_VWB1_WGM1_WGMXCC1_WGMXCCGn1
    SolutionIndex: 89
    SolutionNameMin: Cijk_Alik_Bljk_B8NSS_BH_Bias_HAS_SAV_UserArgs_MT32x32x128_MI16x16x1_SN_LDSB0_CLR1_GRVWA16_GRVWB16_GSU0_GSUC0_GSUWGMRR0_K1_LBSPPA128_LBSPPB128_LPA16_LPB16_LRVW8_MIWT1_1_PLR1_SU0_SUM0_SUS128_VWA1_VWB1_WGM1_WGMXCC1_WGMXCCGn1
    SolutionIndex: 90
    SolutionNameMin: Cijk_Alik_Bljk_B8NSS_BH_Bias_HAS_SAV_UserArgs_MT32x32x128_MI16x16x1_SN_LDSB0_CLR1_GRVWA16_GRVWB16_GSU0_GSUC0_GSUWGMRR0_K1_LBSPPA128_LBSPPB128_LPA16_LPB16_LRVW8_MIWT1_1_PLR1_SU0_SUM0_SUS128_VWA1_VWB1_WGM6_WGMXCC1_WGMXCCGn1
    SolutionIndex: 91
    SolutionNameMin: Cijk_Alik_Bljk_B8NSS_BH_Bias_HAS_SAV_UserArgs_MT32x32x128_MI16x16x1_SN_LDSB0_CLR1_GRVWA8_GRVWB8_GSU0_GSUC0_GSUWGMRR0_K1_LBSPPA128_LBSPPB128_LPA8_LPB8_LRVW8_MIWT1_1_PLR1_SU0_SUM0_SUS128_VWA1_VWB1_WGM8_WGMXCC1_WGMXCCGn1
    SolutionIndex: 92
    SolutionNameMin: Cijk_Alik_Bljk_B8NSS_BH_Bias_HAS_SAV_UserArgs_MT32x32x128_MI16x16x1_SN_LDSB0_CLR1_GRVWA16_GRVWB8_GSU0_GSUC0_GSUWGMRR0_K1_LBSPPA128_LBSPPB128_LPA16_LPB8_LRVW8_MIWT1_1_PLR1_SU0_SUM0_SUS128_VWA1_VWB1_WGM8_WGMXCC1_WGMXCCGn1
    SolutionIndex: 93
    SolutionNameMin: Cijk_Alik_Bljk_B8NSS_BH_Bias_HAS_SAV_UserArgs_MT64x144x256_MI16x16x1_SN_LDSB1_CLR1_GRVWA16_GRVWB8_GSU0_GSUC0_GSUWGMRR0_K1_LBSPPA256_LBSPPB256_LPA16_LPB8_LRVW8_MIWT1_9_PLR1_SU0_SUM0_SUS256_VWA1_VWB1_WGM1_WGMXCC1_WGMXCCGn1
    SolutionIndex: 94
    SolutionNameMin: Cijk_Alik_Bljk_B8NSS_BH_Bias_HAS_SAV_UserArgs_MT144x64x256_MI16x16x1_SN_LDSB1_CLR1_GRVWA8_GRVWB16_GSU0_GSUC0_GSUWGMRR0_K1_LBSPPA256_LBSPPB256_LPA8_LPB16_LRVW8_MIWT9_1_PLR1_SU0_SUM0_SUS256_VWA1_VWB1_WGM6_WGMXCC1_WGMXCCGn1
    SolutionIndex: 95
    SolutionNameMin: Cijk_Alik_Bljk_B8NSS_BH_Bias_HAS_SAV_UserArgs_MT64x128x256_MI16x16x1_SN_LDSB1_CLR1_GRVWA8_GRVWB8_GSU0_GSUC0_GSUWGMRR0_K1_LBSPPA512_LBSPPB1024_LPA8_LPB8_LRVW8_MIWT2_4_PLR1_SU0_SUM0_SUS256_VWA2_VWB4_WGM1_WGMXCC1_WGMXCCGn1
    SolutionIndex: 96
    SolutionNameMin: Cijk_Alik_Bljk_B8NSS_BH_Bias_HAS_SAV_UserArgs_MT128x64x256_MI16x16x1_SN_LDSB1_CLR1_GRVWA8_GRVWB16_GSU0_GSUC0_GSUWGMRR0_K1_LBSPPA1024_LBSPPB512_LPA8_LPB16_LRVW8_MIWT4_2_PLR1_SU0_SUM0_SUS256_VWA4_VWB2_WGM1_WGMXCC1_WGMXCCGn1
    SolutionIndex: 97
    SolutionNameMin: Cijk_Alik_Bljk_B8NSS_BH_Bias_HAS_SAV_UserArgs_MT128x64x256_MI16x16x1_SN_LDSB1_CLR1_GRVWA8_GRVWB16_GSU0_GSUC0_GSUWGMRR0_K1_LBSPPA1024_LBSPPB512_LPA8_LPB16_LRVW8_MIWT4_2_PLR1_SU0_SUM0_SUS256_VWA4_VWB2_WGM6_WGMXCC1_WGMXCCGn1
    SolutionIndex: 98
    SolutionNameMin: Cijk_Alik_Bljk_B8NSS_BH_Bias_HAS_SAV_UserArgs_MT128x64x256_MI16x16x1_SN_LDSB1_CLR1_GRVWA8_GRVWB16_GSU0_GSUC0_GSUWGMRR0_K1_LBSPPA1024_LBSPPB512_LPA8_LPB16_LRVW8_MIWT4_2_PLR1_SU0_SUM0_SUS256_VWA4_VWB2_WGM8_WGMXCC1_WGMXCCGn1
    SolutionIndex: 99
    SolutionNameMin: Cijk_Alik_Bljk_B8NSS_BH_Bias_HAS_SAV_UserArgs_MT64x64x256_MI16x16x1_SN_LDSB1_CLR1_GRVWA8_GRVWB16_GSU0_GSUC0_GSUWGMRR0_K1_LBSPPA512_LBSPPB512_LPA8_LPB16_LRVW8_MIWT2_2_PLR1_SU0_SUM0_SUS256_VWA2_VWB2_WGM1_WGMXCC1_WGMXCCGn1
    SolutionIndex: 100
    SolutionNameMin: Cijk_Alik_Bljk_B8NSS_BH_Bias_HAS_SAV_UserArgs_MT64x64x256_MI16x16x1_SN_LDSB1_CLR1_GRVWA8_GRVWB16_GSU0_GSUC0_GSUWGMRR0_K1_LBSPPA512_LBSPPB512_LPA8_LPB16_LRVW8_MIWT2_2_PLR1_SU0_SUM0_SUS256_VWA2_VWB2_WGM6_WGMXCC1_WGMXCCGn1
    SolutionIndex: 101
    SolutionNameMin: Cijk_Alik_Bljk_B8NSS_BH_Bias_HAS_SAV_UserArgs_MT64x64x256_MI16x16x1_SN_LDSB1_CLR1_GRVWA8_GRVWB16_GSU0_GSUC0_GSUWGMRR0_K1_LBSPPA512_LBSPPB512_LPA8_LPB16_LRVW8_MIWT2_2_PLR1_SU0_SUM0_SUS256_VWA2_VWB2_WGM8_WGMXCC1_WGMXCCGn1
    SolutionIndex: 102
    SolutionNameMin: Cijk_Alik_Bljk_B8NSS_BH_Bias_HAS_SAV_UserArgs_MT32x64x256_MI16x16x1_SN_LDSB1_CLR1_GRVWA8_GRVWB16_GSU0_GSUC0_GSUWGMRR0_K1_LBSPPA256_LBSPPB512_LPA8_LPB16_LRVW8_MIWT1_2_PLR1_SU0_SUM0_SUS256_VWA1_VWB2_WGM6_WGMXCC1_WGMXCCGn1
    SolutionIndex: 103
    SolutionNameMin: Cijk_Alik_Bljk_B8NSS_BH_Bias_HAS_SAV_UserArgs_MT32x64x256_MI16x16x1_SN_LDSB1_CLR1_GRVWA8_GRVWB16_GSU0_GSUC0_GSUWGMRR0_K1_LBSPPA256_LBSPPB512_LPA8_LPB16_LRVW8_MIWT1_2_PLR1_SU0_SUM0_SUS256_VWA1_VWB2_WGM8_WGMXCC1_WGMXCCGn1
    SolutionIndex: 104
    SolutionNameMin: Cijk_Alik_Bljk_B8NSS_BH_Bias_HAS_SAV_UserArgs_MT64x32x256_MI16x16x1_SN_LDSB1_CLR1_GRVWA16_GRVWB8_GSU0_GSUC0_GSUWGMRR0_K1_LBSPPA512_LBSPPB256_LPA16_LPB8_LRVW8_MIWT2_1_PLR1_SU0_SUM0_SUS256_VWA2_VWB1_WGM6_WGMXCC1_WGMXCCGn1
    SolutionIndex: 105
    SolutionNameMin: Cijk_Alik_Bljk_B8NSS_BH_Bias_HAS_SAV_UserArgs_MT32x32x256_MI16x16x1_SN_LDSB1_CLR1_GRVWA8_GRVWB16_GSU0_GSUC0_GSUWGMRR0_K1_LBSPPA256_LBSPPB256_LPA8_LPB16_LRVW8_MIWT1_1_PLR1_SU0_SUM0_SUS256_VWA1_VWB1_WGM1_WGMXCC1_WGMXCCGn1
    SolutionIndex: 106
    SolutionNameMin: Cijk_Alik_Bljk_B8NSS_BH_Bias_HAS_SAV_UserArgs_MT32x64x32_MI16x16x1_SN_LDSB0_CLR0_GRVWA4_GRVWB8_GSU0_GSUC0_GSUWGMRR0_K1_LBSPPA128_LBSPPB128_LPA8_LPB8_LRVW8_MIWT1_2_PLR0_SU32_SUM0_SUS256_VWA1_VWB1_WGM6_WGMXCC1_WGMXCCGn1
- - - [128, 128, 1, 128, 128, 128, 128, 128]
    - [33, 0.62]
  - - [128, 128, 1, 256, 128, 128, 256, 256]
    - [89, 1.14]
  - - [128, 128, 1, 512, 128, 128, 512, 512]
    - [88, 2.05]
  - - [128, 128, 1, 1024, 128, 128, 1024, 1024]
    - [86, 3.49]
  - - [128, 128, 1, 2048, 128, 128, 2048, 2048]
    - [86, 5.33]
  - - [128, 128, 1, 4096, 128, 128, 4096, 4096]
    - [86, 7.15]
  - - [128, 128, 1, 8192, 128, 128, 8192, 8192]
    - [86, 8.65]
  - - [128, 256, 1, 128, 128, 128, 128, 128]
    - [33, 1.25]
  - - [128, 256, 1, 256, 128, 128, 256, 256]
    - [89, 2.34]
  - - [128, 256, 1, 512, 128, 128, 512, 512]
    - [89, 4.13]
  - - [128, 256, 1, 1024, 128, 128, 1024, 1024]
    - [88, 6.89]
  - - [128, 256, 1, 2048, 128, 128, 2048, 2048]
    - [86, 10.42]
  - - [128, 256, 1, 4096, 128, 128, 4096, 4096]
    - [86, 14.34]
  - - [128, 256, 1, 8192, 128, 128, 8192, 8192]
    - [86, 17.31]
  - - [128, 512, 1, 128, 128, 128, 128, 128]
    - [87, 2.44]
  - - [128, 512, 1, 256, 128, 128, 256, 256]
    - [89, 4.5]
  - - [128, 512, 1, 512, 128, 128, 512, 512]
    - [88, 8.08]
  - - [128, 512, 1, 1024, 128, 128, 1024, 1024]
    - [86, 13.77]
  - - [128, 512, 1, 2048, 128, 128, 2048, 2048]
    - [86, 20.92]
  - - [128, 512, 1, 4096, 128, 128, 4096, 4096]
    - [86, 28.38]
  - - [128, 512, 1, 8192, 128, 128, 8192, 8192]
    - [86, 34.29]
  - - [128, 1024, 1, 128, 128, 128, 128, 128]
    - [88, 4.74]
  - - [128, 1024, 1, 256, 128, 128, 256, 256]
    - [89, 9.05]
  - - [128, 1024, 1, 512, 128, 128, 512, 512]
    - [88, 15.83]
  - - [128, 1024, 1, 1024, 128, 128, 1024, 1024]
    - [86, 27.33]
  - - [128, 1024, 1, 2048, 128, 128, 2048, 2048]
    - [86, 40.97]
  - - [128, 1024, 1, 4096, 128, 128, 4096, 4096]
    - [86, 55.88]
  - - [128, 1024, 1, 8192, 128, 128, 8192, 8192]
    - [86, 67.14]
  - - [128, 2048, 1, 128, 128, 128, 128, 128]
    - [31, 8.69]
  - - [128, 2048, 1, 256, 128, 128, 256, 256]
    - [32, 15.96]
  - - [128, 2048, 1, 512, 128, 128, 512, 512]
    - [81, 27.88]
  - - [128, 2048, 1, 1024, 128, 128, 1024, 1024]
    - [82, 46.11]
  - - [128, 2048, 1, 2048, 128, 128, 2048, 2048]
    - [74, 66.6]
  - - [128, 2048, 1, 4096, 128, 128, 4096, 4096]
    - [74, 86.98]
  - - [128, 2048, 1, 8192, 128, 128, 8192, 8192]
    - [105, 97.71]
  - - [128, 4096, 1, 128, 128, 128, 128, 128]
    - [20, 14.09]
  - - [128, 4096, 1, 256, 128, 128, 256, 256]
    - [22, 25.8]
  - - [128, 4096, 1, 512, 128, 128, 512, 512]
    - [22, 44.29]
  - - [128, 4096, 1, 1024, 128, 128, 1024, 1024]
    - [71, 69.72]
  - - [128, 4096, 1, 2048, 128, 128, 2048, 2048]
    - [71, 99.26]
  - - [128, 4096, 1, 4096, 128, 128, 4096, 4096]
    - [71, 124.49]
  - - [128, 4096, 1, 8192, 128, 128, 8192, 8192]
    - [99, 137.28]
  - - [128, 8192, 1, 128, 128, 128, 128, 128]
    - [13, 21.99]
  - - [128, 8192, 1, 256, 128, 128, 256, 256]
    - [13, 39.95]
  - - [128, 8192, 1, 512, 128, 128, 512, 512]
    - [12, 69.53]
  - - [128, 8192, 1, 1024, 128, 128, 1024, 1024]
    - [12, 108.49]
  - - [128, 8192, 1, 2048, 128, 128, 2048, 2048]
    - [64, 139.18]
  - - [128, 8192, 1, 4096, 128, 128, 4096, 4096]
    - [95, 157.24]
  - - [128, 8192, 1, 8192, 128, 128, 8192, 8192]
    - [96, 180.96]
  - - [256, 128, 1, 128, 256, 256, 128, 128]
    - [74, 0.98]
  - - [256, 128, 1, 256, 256, 256, 256, 256]
    - [29, 1.95]
  - - [256, 128, 1, 512, 256, 256, 512, 512]
    - [92, 3.71]
  - - [256, 128, 1, 1024, 256, 256, 1024, 1024]
    - [87, 6.44]
  - - [256, 128, 1, 2048, 256, 256, 2048, 2048]
    - [86, 10.28]
  - - [256, 128, 1, 4096, 256, 256, 4096, 4096]
    - [86, 13.91]
  - - [256, 128, 1, 8192, 256, 256, 8192, 8192]
    - [86, 16.98]
  - - [256, 256, 1, 128, 256, 256, 128, 128]
    - [29, 1.99]
  - - [256, 256, 1, 256, 256, 256, 256, 256]
    - [30, 3.78]
  - - [256, 256, 1, 512, 256, 256, 512, 512]
    - [89, 7.67]
  - - [256, 256, 1, 1024, 256, 256, 1024, 1024]
    - [86, 12.99]
  - - [256, 256, 1, 2048, 256, 256, 2048, 2048]
    - [86, 20.24]
  - - [256, 256, 1, 4096, 256, 256, 4096, 4096]
    - [86, 27.75]
  - - [256, 256, 1, 8192, 256, 256, 8192, 8192]
    - [86, 33.82]
  - - [256, 512, 1, 128, 256, 256, 128, 128]
    - [83, 4.16]
  - - [256, 512, 1, 256, 256, 256, 256, 256]
    - [90, 7.99]
  - - [256, 512, 1, 512, 256, 256, 512, 512]
    - [89, 15.07]
  - - [256, 512, 1, 1024, 256, 256, 1024, 1024]
    - [86, 25.36]
  - - [256, 512, 1, 2048, 256, 256, 2048, 2048]
    - [86, 39.63]
  - - [256, 512, 1, 4096, 256, 256, 4096, 4096]
    - [86, 53.83]
  - - [256, 512, 1, 8192, 256, 256, 8192, 8192]
    - [86, 66.26]
  - - [256, 1024, 1, 128, 256, 256, 128, 128]
    - [30, 7.53]
  - - [256, 1024, 1, 256, 256, 256, 256, 256]
    - [32, 15.63]
  - - [256, 1024, 1, 512, 256, 256, 512, 512]
    - [75, 27.45]
  - - [256, 1024, 1, 1024, 256, 256, 1024, 1024]
    - [75, 45.8]
  - - [256, 1024, 1, 2048, 256, 256, 2048, 2048]
    - [74, 66.99]
  - - [256, 1024, 1, 4096, 256, 256, 4096, 4096]
    - [74, 87.49]
  - - [256, 1024, 1, 8192, 256, 256, 8192, 8192]
    - [80, 100.82]
  - - [256, 2048, 1, 128, 256, 256, 128, 128]
    - [25, 14.38]
  - - [256, 2048, 1, 256, 256, 256, 256, 256]
    - [24, 26.07]
  - - [256, 2048, 1, 512, 256, 256, 512, 512]
    - [71, 44.84]
  - - [256, 2048, 1, 1024, 256, 256, 1024, 1024]
    - [71, 71.52]
  - - [256, 2048, 1, 2048, 256, 256, 2048, 2048]
    - [71, 100.0]
  - - [256, 2048, 1, 4096, 256, 256, 4096, 4096]
    - [71, 125.77]
  - - [256, 2048, 1, 8192, 256, 256, 8192, 8192]
    - [99, 138.86]
  - - [256, 4096, 1, 128, 256, 256, 128, 128]
    - [17, 22.31]
  - - [256, 4096, 1, 256, 256, 256, 256, 256]
    - [12, 40.7]
  - - [256, 4096, 1, 512, 256, 256, 512, 512]
    - [12, 70.21]
  - - [256, 4096, 1, 1024, 256, 256, 1024, 1024]
    - [16, 109.38]
  - - [256, 4096, 1, 2048, 256, 256, 2048, 2048]
    - [12, 149.85]
  - - [256, 4096, 1, 4096, 256, 256, 4096, 4096]
    - [71, 166.48]
  - - [256, 4096, 1, 8192, 256, 256, 8192, 8192]
    - [95, 182.44]
  - - [256, 8192, 1, 128, 256, 256, 128, 128]
    - [48, 33.56]
  - - [256, 8192, 1, 256, 256, 256, 256, 256]
    - [48, 60.21]
  - - [256, 8192, 1, 512, 256, 256, 512, 512]
    - [48, 103.8]
  - - [256, 8192, 1, 1024, 256, 256, 1024, 1024]
    - [48, 151.36]
  - - [256, 8192, 1, 2048, 256, 256, 2048, 2048]
    - [93, 176.77]
  - - [256, 8192, 1, 4096, 256, 256, 4096, 4096]
    - [66, 211.48]
  - - [256, 8192, 1, 8192, 256, 256, 8192, 8192]
    - [61, 230.92]
  - - [512, 128, 1, 128, 512, 512, 128, 128]
    - [89, 2.43]
  - - [512, 128, 1, 256, 512, 512, 256, 256]
    - [33, 4.54]
  - - [512, 128, 1, 512, 512, 512, 512, 512]
    - [89, 8.17]
  - - [512, 128, 1, 1024, 512, 512, 1024, 1024]
    - [86, 13.62]
  - - [512, 128, 1, 2048, 512, 512, 2048, 2048]
    - [86, 20.64]
  - - [512, 128, 1, 4096, 512, 512, 4096, 4096]
    - [86, 27.96]
  - - [512, 128, 1, 8192, 512, 512, 8192, 8192]
    - [86, 33.87]
  - - [512, 256, 1, 128, 512, 512, 128, 128]
    - [92, 4.32]
  - - [512, 256, 1, 256, 512, 512, 256, 256]
    - [33, 8.36]
  - - [512, 256, 1, 512, 512, 512, 512, 512]
    - [88, 15.3]
  - - [512, 256, 1, 1024, 512, 512, 1024, 1024]
    - [89, 25.95]
  - - [512, 256, 1, 2048, 512, 512, 2048, 2048]
    - [86, 39.54]
  - - [512, 256, 1, 4096, 512, 512, 4096, 4096]
    - [86, 54.05]
  - - [512, 256, 1, 8192, 512, 512, 8192, 8192]
    - [91, 66.26]
  - - [512, 512, 1, 128, 512, 512, 128, 128]
    - [28, 8.02]
  - - [512, 512, 1, 256, 512, 512, 256, 256]
    - [83, 15.26]
  - - [512, 512, 1, 512, 512, 512, 512, 512]
    - [74, 26.9]
  - - [512, 512, 1, 1024, 512, 512, 1024, 1024]
    - [82, 44.44]
  - - [512, 512, 1, 2048, 512, 512, 2048, 2048]
    - [74, 66.03]
  - - [512, 512, 1, 4096, 512, 512, 4096, 4096]
    - [74, 86.42]
  - - [512, 512, 1, 8192, 512, 512, 8192, 8192]
    - [105, 93.83]
  - - [512, 1024, 1, 128, 512, 512, 128, 128]
    - [23, 14.08]
  - - [512, 1024, 1, 256, 512, 512, 256, 256]
    - [24, 25.49]
  - - [512, 1024, 1, 512, 512, 512, 512, 512]
    - [70, 43.9]
  - - [512, 1024, 1, 1024, 512, 512, 1024, 1024]
    - [71, 70.06]
  - - [512, 1024, 1, 2048, 512, 512, 2048, 2048]
    - [71, 99.26]
  - - [512, 1024, 1, 4096, 512, 512, 4096, 4096]
    - [71, 124.96]
  - - [512, 1024, 1, 8192, 512, 512, 8192, 8192]
    - [100, 138.43]
  - - [512, 2048, 1, 128, 512, 512, 128, 128]
    - [13, 22.34]
  - - [512, 2048, 1, 256, 512, 512, 256, 256]
    - [12, 41.16]
  - - [512, 2048, 1, 512, 512, 512, 512, 512]
    - [12, 70.83]
  - - [512, 2048, 1, 1024, 512, 512, 1024, 1024]
    - [12, 109.13]
  - - [512, 2048, 1, 2048, 512, 512, 2048, 2048]
    - [12, 148.39]
  - - [512, 2048, 1, 4096, 512, 512, 4096, 4096]
    - [96, 166.98]
  - - [512, 2048, 1, 8192, 512, 512, 8192, 8192]
    - [96, 185.51]
  - - [512, 4096, 1, 128, 512, 512, 128, 128]
    - [8, 32.85]
  - - [512, 4096, 1, 256, 512, 512, 256, 256]
    - [6, 59.0]
  - - [512, 4096, 1, 512, 512, 512, 512, 512]
    - [6, 100.21]
  - - [512, 4096, 1, 1024, 512, 512, 1024, 1024]
    - [59, 145.46]
  - - [512, 4096, 1, 2048, 512, 512, 2048, 2048]
    - [59, 192.08]
  - - [512, 4096, 1, 4096, 512, 512, 4096, 4096]
    - [60, 210.4]
  - - [512, 4096, 1, 8192, 512, 512, 8192, 8192]
    - [63, 231.63]
  - - [512, 8192, 1, 128, 512, 512, 128, 128]
    - [51, 40.98]
  - - [512, 8192, 1, 256, 512, 512, 256, 256]
    - [51, 75.55]
  - - [512, 8192, 1, 512, 512, 512, 512, 512]
    - [50, 125.25]
  - - [512, 8192, 1, 1024, 512, 512, 1024, 1024]
    - [50, 174.68]
  - - [512, 8192, 1, 2048, 512, 512, 2048, 2048]
    - [50, 223.76]
  - - [512, 8192, 1, 4096, 512, 512, 4096, 4096]
    - [50, 260.38]
  - - [512, 8192, 1, 8192, 512, 512, 8192, 8192]
    - [49, 269.9]
  - - [1024, 128, 1, 128, 1024, 1024, 128, 128]
    - [12, 3.51]
  - - [1024, 128, 1, 256, 1024, 1024, 256, 256]
    - [33, 7.9]
  - - [1024, 128, 1, 512, 1024, 1024, 512, 512]
    - [104, 12.48]
  - - [1024, 128, 1, 1024, 1024, 1024, 1024, 1024]
    - [91, 24.77]
  - - [1024, 128, 1, 2048, 1024, 1024, 2048, 2048]
    - [91, 39.49]
  - - [1024, 128, 1, 4096, 1024, 1024, 4096, 4096]
    - [91, 53.57]
  - - [1024, 128, 1, 8192, 1024, 1024, 8192, 8192]
    - [91, 65.79]
  - - [1024, 256, 1, 128, 1024, 1024, 128, 128]
    - [21, 6.47]
  - - [1024, 256, 1, 256, 1024, 1024, 256, 256]
    - [68, 12.68]
  - - [1024, 256, 1, 512, 1024, 1024, 512, 512]
    - [84, 25.94]
  - - [1024, 256, 1, 1024, 1024, 1024, 1024, 1024]
    - [78, 42.58]
  - - [1024, 256, 1, 2048, 1024, 1024, 2048, 2048]
    - [79, 64.12]
  - - [1024, 256, 1, 4096, 1024, 1024, 4096, 4096]
    - [77, 85.17]
  - - [1024, 256, 1, 8192, 1024, 1024, 8192, 8192]
    - [77, 98.55]
  - - [1024, 512, 1, 128, 1024, 1024, 128, 128]
    - [9, 12.16]
  - - [1024, 512, 1, 256, 1024, 1024, 256, 256]
    - [18, 24.28]
  - - [1024, 512, 1, 512, 1024, 1024, 512, 512]
    - [27, 43.13]
  - - [1024, 512, 1, 1024, 1024, 1024, 1024, 1024]
    - [73, 69.01]
  - - [1024, 512, 1, 2048, 1024, 1024, 2048, 2048]
    - [72, 97.46]
  - - [1024, 512, 1, 4096, 1024, 1024, 4096, 4096]
    - [73, 121.2]
  - - [1024, 512, 1, 8192, 1024, 1024, 8192, 8192]
    - [100, 137.87]
  - - [1024, 1024, 1, 128, 1024, 1024, 128, 128]
    - [67, 21.59]
  - - [1024, 1024, 1, 256, 1024, 1024, 256, 256]
    - [10, 40.29]
  - - [1024, 1024, 1, 512, 1024, 1024, 512, 512]
    - [16, 70.18]
  - - [1024, 1024, 1, 1024, 1024, 1024, 1024, 1024]
    - [16, 107.48]
  - - [1024, 1024, 1, 2048, 1024, 1024, 2048, 2048]
    - [14, 146.55]
  - - [1024, 1024, 1, 4096, 1024, 1024, 4096, 4096]
    - [98, 164.19]
  - - [1024, 1024, 1, 8192, 1024, 1024, 8192, 8192]
    - [96, 183.08]
  - - [1024, 2048, 1, 128, 1024, 1024, 128, 128]
    - [5, 32.47]
  - - [1024, 2048, 1, 256, 1024, 1024, 256, 256]
    - [6, 59.4]
  - - [1024, 2048, 1, 512, 1024, 1024, 512, 512]
    - [6, 101.4]
  - - [1024, 2048, 1, 1024, 1024, 1024, 1024, 1024]
    - [6, 146.11]
  - - [1024, 2048, 1, 2048, 1024, 1024, 2048, 2048]
    - [59, 186.91]
  - - [1024, 2048, 1, 4096, 1024, 1024, 4096, 4096]
    - [59, 214.24]
  - - [1024, 2048, 1, 8192, 1024, 1024, 8192, 8192]
    - [61, 235.98]
  - - [1024, 4096, 1, 128, 1024, 1024, 128, 128]
    - [1, 40.36]
  - - [1024, 4096, 1, 256, 1024, 1024, 256, 256]
    - [4, 71.22]
  - - [1024, 4096, 1, 512, 1024, 1024, 512, 512]
    - [34, 109.43]
  - - [1024, 4096, 1, 1024, 1024, 1024, 1024, 1024]
    - [44, 157.96]
  - - [1024, 4096, 1, 2048, 1024, 1024, 2048, 2048]
    - [44, 215.09]
  - - [1024, 4096, 1, 4096, 1024, 1024, 4096, 4096]
    - [44, 243.73]
  - - [1024, 4096, 1, 8192, 1024, 1024, 8192, 8192]
    - [43, 242.44]
  - - [1024, 8192, 1, 128, 1024, 1024, 128, 128]
    - [38, 44.57]
  - - [1024, 8192, 1, 256, 1024, 1024, 256, 256]
    - [38, 81.91]
  - - [1024, 8192, 1, 512, 1024, 1024, 512, 512]
    - [38, 140.1]
  - - [1024, 8192, 1, 1024, 1024, 1024, 1024, 1024]
    - [37, 203.8]
  - - [1024, 8192, 1, 2048, 1024, 1024, 2048, 2048]
    - [38, 276.06]
  - - [1024, 8192, 1, 4096, 1024, 1024, 4096, 4096]
    - [41, 295.97]
  - - [1024, 8192, 1, 8192, 1024, 1024, 8192, 8192]
    - [37, 334.57]
  - - [2048, 128, 1, 128, 2048, 2048, 128, 128]
    - [85, 7.99]
  - - [2048, 128, 1, 256, 2048, 2048, 256, 256]
    - [75, 15.77]
  - - [2048, 128, 1, 512, 2048, 2048, 512, 512]
    - [76, 27.84]
  - - [2048, 128, 1, 1024, 2048, 2048, 1024, 1024]
    - [74, 45.11]
  - - [2048, 128, 1, 2048, 2048, 2048, 2048, 2048]
    - [74, 66.38]
  - - [2048, 128, 1, 4096, 2048, 2048, 4096, 4096]
    - [74, 87.02]
  - - [2048, 128, 1, 8192, 2048, 2048, 8192, 8192]
    - [103, 94.19]
  - - [2048, 256, 1, 128, 2048, 2048, 128, 128]
    - [25, 14.65]
  - - [2048, 256, 1, 256, 2048, 2048, 256, 256]
    - [24, 26.82]
  - - [2048, 256, 1, 512, 2048, 2048, 512, 512]
    - [71, 45.04]
  - - [2048, 256, 1, 1024, 2048, 2048, 1024, 1024]
    - [70, 70.92]
  - - [2048, 256, 1, 2048, 2048, 2048, 2048, 2048]
    - [71, 99.54]
  - - [2048, 256, 1, 4096, 2048, 2048, 4096, 4096]
    - [72, 125.09]
  - - [2048, 256, 1, 8192, 2048, 2048, 8192, 8192]
    - [103, 139.65]
  - - [2048, 512, 1, 128, 2048, 2048, 128, 128]
    - [13, 22.63]
  - - [2048, 512, 1, 256, 2048, 2048, 256, 256]
    - [12, 42.13]
  - - [2048, 512, 1, 512, 2048, 2048, 512, 512]
    - [12, 71.76]
  - - [2048, 512, 1, 1024, 2048, 2048, 1024, 1024]
    - [16, 108.9]
  - - [2048, 512, 1, 2048, 2048, 2048, 2048, 2048]
    - [16, 147.75]
  - - [2048, 512, 1, 4096, 2048, 2048, 4096, 4096]
    - [98, 165.19]
  - - [2048, 512, 1, 8192, 2048, 2048, 8192, 8192]
    - [65, 185.5]
  - - [2048, 1024, 1, 128, 2048, 2048, 128, 128]
    - [8, 33.31]
  - - [2048, 1024, 1, 256, 2048, 2048, 256, 256]
    - [8, 59.65]
  - - [2048, 1024, 1, 512, 2048, 2048, 512, 512]
    - [59, 91.76]
  - - [2048, 1024, 1, 1024, 2048, 2048, 1024, 1024]
    - [61, 141.06]
  - - [2048, 1024, 1, 2048, 2048, 2048, 2048, 2048]
    - [63, 178.24]
  - - [2048, 1024, 1, 4096, 2048, 2048, 4096, 4096]
    - [62, 215.5]
  - - [2048, 1024, 1, 8192, 2048, 2048, 8192, 8192]
    - [61, 231.65]
  - - [2048, 2048, 1, 128, 2048, 2048, 128, 128]
    - [2, 37.17]
  - - [2048, 2048, 1, 256, 2048, 2048, 256, 256]
    - [3, 66.69]
  - - [2048, 2048, 1, 512, 2048, 2048, 512, 512]
    - [44, 104.69]
  - - [2048, 2048, 1, 1024, 2048, 2048, 1024, 1024]
    - [44, 158.17]
  - - [2048, 2048, 1, 2048, 2048, 2048, 2048, 2048]
    - [44, 212.79]
  - - [2048, 2048, 1, 4096, 2048, 2048, 4096, 4096]
    - [46, 240.4]
  - - [2048, 2048, 1, 8192, 2048, 2048, 8192, 8192]
    - [35, 244.98]
  - - [2048, 4096, 1, 128, 2048, 2048, 128, 128]
    - [6, 41.48]
  - - [2048, 4096, 1, 256, 2048, 2048, 256, 256]
    - [6, 72.03]
  - - [2048, 4096, 1, 512, 2048, 2048, 512, 512]
    - [56, 118.44]
  - - [2048, 4096, 1, 1024, 2048, 2048, 1024, 1024]
    - [56, 178.66]
  - - [2048, 4096, 1, 2048, 2048, 2048, 2048, 2048]
    - [0, 211.12]
  - - [2048, 4096, 1, 4096, 2048, 2048, 4096, 4096]
    - [47, 261.79]
  - - [2048, 4096, 1, 8192, 2048, 2048, 8192, 8192]
    - [41, 302.97]
  - - [2048, 8192, 1, 128, 2048, 2048, 128, 128]
    - [39, 49.27]
  - - [2048, 8192, 1, 256, 2048, 2048, 256, 256]
    - [40, 88.29]
  - - [2048, 8192, 1, 512, 2048, 2048, 512, 512]
    - [40, 148.93]
  - - [2048, 8192, 1, 1024, 2048, 2048, 1024, 1024]
    - [37, 222.43]
  - - [2048, 8192, 1, 2048, 2048, 2048, 2048, 2048]
    - [39, 262.69]
  - - [2048, 8192, 1, 4096, 2048, 2048, 4096, 4096]
    - [37, 291.86]
  - - [2048, 8192, 1, 8192, 2048, 2048, 8192, 8192]
    - [39, 341.51]
  - - [4096, 128, 1, 128, 4096, 4096, 128, 128]
    - [69, 14.47]
  - - [4096, 128, 1, 256, 4096, 4096, 256, 256]
    - [19, 25.96]
  - - [4096, 128, 1, 512, 4096, 4096, 512, 512]
    - [26, 44.15]
  - - [4096, 128, 1, 1024, 4096, 4096, 1024, 1024]
    - [70, 69.41]
  - - [4096, 128, 1, 2048, 4096, 4096, 2048, 2048]
    - [73, 98.75]
  - - [4096, 128, 1, 4096, 4096, 4096, 4096, 4096]
    - [100, 120.95]
  - - [4096, 128, 1, 8192, 4096, 4096, 8192, 8192]
    - [102, 137.05]
  - - [4096, 256, 1, 128, 4096, 4096, 128, 128]
    - [13, 22.92]
  - - [4096, 256, 1, 256, 4096, 4096, 256, 256]
    - [11, 41.86]
  - - [4096, 256, 1, 512, 4096, 4096, 512, 512]
    - [12, 70.58]
  - - [4096, 256, 1, 1024, 4096, 4096, 1024, 1024]
    - [14, 108.43]
  - - [4096, 256, 1, 2048, 4096, 4096, 2048, 2048]
    - [16, 148.93]
  - - [4096, 256, 1, 4096, 4096, 4096, 4096, 4096]
    - [97, 165.53]
  - - [4096, 256, 1, 8192, 4096, 4096, 8192, 8192]
    - [97, 186.26]
  - - [4096, 512, 1, 128, 4096, 4096, 128, 128]
    - [7, 31.78]
  - - [4096, 512, 1, 256, 4096, 4096, 256, 256]
    - [6, 57.14]
  - - [4096, 512, 1, 512, 4096, 4096, 512, 512]
    - [6, 89.88]
  - - [4096, 512, 1, 1024, 4096, 4096, 1024, 1024]
    - [63, 138.69]
  - - [4096, 512, 1, 2048, 4096, 4096, 2048, 2048]
    - [61, 189.74]
  - - [4096, 512, 1, 4096, 4096, 4096, 4096, 4096]
    - [63, 213.28]
  - - [4096, 512, 1, 8192, 4096, 4096, 8192, 8192]
    - [61, 241.03]
  - - [4096, 1024, 1, 128, 4096, 4096, 128, 128]
    - [42, 36.47]
  - - [4096, 1024, 1, 256, 4096, 4096, 256, 256]
    - [42, 63.74]
  - - [4096, 1024, 1, 512, 4096, 4096, 512, 512]
    - [36, 104.97]
  - - [4096, 1024, 1, 1024, 4096, 4096, 1024, 1024]
    - [36, 158.36]
  - - [4096, 1024, 1, 2048, 4096, 4096, 2048, 2048]
    - [47, 206.52]
  - - [4096, 1024, 1, 4096, 4096, 4096, 4096, 4096]
    - [57, 246.74]
  - - [4096, 1024, 1, 8192, 4096, 4096, 8192, 8192]
    - [56, 256.05]
  - - [4096, 2048, 1, 128, 4096, 4096, 128, 128]
    - [7, 38.64]
  - - [4096, 2048, 1, 256, 4096, 4096, 256, 256]
    - [6, 69.05]
  - - [4096, 2048, 1, 512, 4096, 4096, 512, 512]
    - [50, 110.08]
  - - [4096, 2048, 1, 1024, 4096, 4096, 1024, 1024]
    - [46, 163.41]
  - - [4096, 2048, 1, 2048, 4096, 4096, 2048, 2048]
    - [58, 219.72]
  - - [4096, 2048, 1, 4096, 4096, 4096, 4096, 4096]
    - [44, 272.4]
  - - [4096, 2048, 1, 8192, 4096, 4096, 8192, 8192]
    - [47, 293.32]
  - - [4096, 4096, 1, 128, 4096, 4096, 128, 128]
    - [7, 42.72]
  - - [4096, 4096, 1, 256, 4096, 4096, 256, 256]
    - [13, 80.77]
  - - [4096, 4096, 1, 512, 4096, 4096, 512, 512]
    - [66, 122.92]
  - - [4096, 4096, 1, 1024, 4096, 4096, 1024, 1024]
    - [60, 182.1]
  - - [4096, 4096, 1, 2048, 4096, 4096, 2048, 2048]
    - [47, 234.88]
  - - [4096, 4096, 1, 4096, 4096, 4096, 4096, 4096]
    - [47, 285.4]
  - - [4096, 4096, 1, 8192, 4096, 4096, 8192, 8192]
    - [44, 333.72]
  - - [4096, 8192, 1, 128, 4096, 4096, 128, 128]
    - [41, 50.18]
  - - [4096, 8192, 1, 256, 4096, 4096, 256, 256]
    - [39, 85.32]
  - - [4096, 8192, 1, 512, 4096, 4096, 512, 512]
    - [41, 135.54]
  - - [4096, 8192, 1, 1024, 4096, 4096, 1024, 1024]
    - [37, 193.94]
  - - [4096, 8192, 1, 2048, 4096, 4096, 2048, 2048]
    - [44, 240.76]
  - - [4096, 8192, 1, 4096, 4096, 4096, 4096, 4096]
    - [39, 293.65]
  - - [4096, 8192, 1, 8192, 4096, 4096, 8192, 8192]
    - [41, 349.92]
  - - [8192, 128, 1, 128, 8192, 8192, 128, 128]
    - [12, 22.52]
  - - [8192, 128, 1, 256, 8192, 8192, 256, 256]
    - [12, 41.41]
  - - [8192, 128, 1, 512, 8192, 8192, 512, 512]
    - [16, 68.33]
  - - [8192, 128, 1, 1024, 8192, 8192, 1024, 1024]
    - [14, 106.91]
  - - [8192, 128, 1, 2048, 8192, 8192, 2048, 2048]
    - [64, 140.47]
  - - [8192, 128, 1, 4096, 8192, 8192, 4096, 4096]
    - [98, 160.69]
  - - [8192, 128, 1, 8192, 8192, 8192, 8192, 8192]
    - [101, 182.03]
  - - [8192, 256, 1, 128, 8192, 8192, 128, 128]
    - [52, 32.94]
  - - [8192, 256, 1, 256, 8192, 8192, 256, 256]
    - [53, 58.38]
  - - [8192, 256, 1, 512, 8192, 8192, 512, 512]
    - [54, 101.05]
  - - [8192, 256, 1, 1024, 8192, 8192, 1024, 1024]
    - [55, 152.72]
  - - [8192, 256, 1, 2048, 8192, 8192, 2048, 2048]
    - [54, 180.37]
  - - [8192, 256, 1, 4096, 8192, 8192, 4096, 4096]
    - [55, 213.87]
  - - [8192, 256, 1, 8192, 8192, 8192, 8192, 8192]
    - [94, 229.32]
  - - [8192, 512, 1, 128, 8192, 8192, 128, 128]
    - [57, 41.51]
  - - [8192, 512, 1, 256, 8192, 8192, 256, 256]
    - [57, 76.46]
  - - [8192, 512, 1, 512, 8192, 8192, 512, 512]
    - [57, 129.98]
  - - [8192, 512, 1, 1024, 8192, 8192, 1024, 1024]
    - [58, 181.97]
  - - [8192, 512, 1, 2048, 8192, 8192, 2048, 2048]
    - [58, 231.99]
  - - [8192, 512, 1, 4096, 8192, 8192, 4096, 4096]
    - [57, 295.17]
  - - [8192, 512, 1, 8192, 8192, 8192, 8192, 8192]
    - [57, 300.63]
  - - [8192, 1024, 1, 128, 8192, 8192, 128, 128]
    - [56, 42.88]
  - - [8192, 1024, 1, 256, 8192, 8192, 256, 256]
    - [57, 79.06]
  - - [8192, 1024, 1, 512, 8192, 8192, 512, 512]
    - [47, 135.01]
  - - [8192, 1024, 1, 1024, 8192, 8192, 1024, 1024]
    - [47, 196.42]
  - - [8192, 1024, 1, 2048, 8192, 8192, 2048, 2048]
    - [47, 274.54]
  - - [8192, 1024, 1, 4096, 8192, 8192, 4096, 4096]
    - [47, 323.6]
  - - [8192, 1024, 1, 8192, 8192, 8192, 8192, 8192]
    - [46, 361.39]
  - - [8192, 2048, 1, 128, 8192, 8192, 128, 128]
    - [45, 47.38]
  - - [8192, 2048, 1, 256, 8192, 8192, 256, 256]
    - [46, 86.99]
  - - [8192, 2048, 1, 512, 8192, 8192, 512, 512]
    - [46, 143.36]
  - - [8192, 2048, 1, 1024, 8192, 8192, 1024, 1024]
    - [46, 210.0]
  - - [8192, 2048, 1, 2048, 8192, 8192, 2048, 2048]
    - [46, 267.27]
  - - [8192, 2048, 1, 4096, 8192, 8192, 4096, 4096]
    - [46, 312.36]
  - - [8192, 2048, 1, 8192, 8192, 8192, 8192, 8192]
    - [46, 374.78]
  - - [8192, 4096, 1, 128, 8192, 8192, 128, 128]
    - [15, 45.99]
  - - [8192, 4096, 1, 256, 8192, 8192, 256, 256]
    - [46, 81.47]
  - - [8192, 4096, 1, 512, 8192, 8192, 512, 512]
    - [46, 131.1]
  - - [8192, 4096, 1, 1024, 8192, 8192, 1024, 1024]
    - [47, 182.58]
  - - [8192, 4096, 1, 2048, 8192, 8192, 2048, 2048]
    - [44, 256.38]
  - - [8192, 4096, 1, 4096, 8192, 8192, 4096, 4096]
    - [46, 306.4]
  - - [8192, 4096, 1, 8192, 8192, 8192, 8192, 8192]
    - [46, 375.89]
  - - [8192, 8192, 1, 128, 8192, 8192, 128, 128]
    - [38, 42.49]
  - - [8192, 8192, 1, 256, 8192, 8192, 256, 256]
    - [3, 75.13]
  - - [8192, 8192, 1, 512, 8192, 8192, 512, 512]
    - [38, 120.58]
  - - [8192, 8192, 1, 1024, 8192, 8192, 1024, 1024]
    - [39, 180.64]
  - - [8192, 8192, 1, 2048, 8192, 8192, 2048, 2048]
    - [37, 248.68]
  - - [8192, 8192, 1, 4096, 8192, 8192, 4096, 4096]
    - [44, 299.36]
  - - [8192, 8192, 1, 8192, 8192, 8192, 8192, 8192]
    - [46, 365.0]
  - - [1, 1, 1, 32, 1, 1, 32, 32]
    - [106, 0.0]
- null
- null
- ExperimentalStreamK
- GridBased
