projects/hipblaslt/library/src/amd_detail/rocblaslt/src/Tensile/Logic/asm_full/aquavanjaram/gfx942_228cu/StreamK/aquavanjaram942_Cijk_Alik_Bjlk_HSS_BH_Bias_HAS_SAV_UserArgs.yaml
- {MinimumRequiredVersion: 4.33.0}
- aquavanjaram942
- {Architecture: gfx942, CUCount: 228}
- [Device 0049, Device 0050]
    SolutionIndex: 0
    SolutionNameMin: Cijk_Alik_Bjlk_HSS_BH_Bias_HAS_SAV_UserArgs_MT256x256x32_MI16x16x1_SN_LDSB1_CLR1_GRVWB8_GSU0_GSUC0_GSUWGMRR0_K1_LBSPPA512_LBSPPB2048_LPB0_MIWT8_8_PLR1_SU0_SUM0_SUS64_VWA8_VWB8_WGM1_WGMXCC1_WGMXCCGn1
    SolutionIndex: 1
    SolutionNameMin: Cijk_Alik_Bjlk_HSS_BH_Bias_HAS_SAV_UserArgs_MT256x256x32_MI16x16x1_SN_LDSB1_CLR1_GRVWB8_GSU0_GSUC0_GSUWGMRR0_K1_LBSPPA512_LBSPPB2048_LPB0_MIWT8_8_PLR1_SU0_SUM0_SUS64_VWA8_VWB8_WGM1_WGMXCC1_WGMXCCGn1
    SolutionIndex: 2
    SolutionNameMin: Cijk_Alik_Bjlk_HSS_BH_Bias_HAS_SAV_UserArgs_MT256x256x32_MI16x16x1_SN_LDSB1_CLR1_GRVWB8_GSU0_GSUC0_GSUWGMRR0_K1_LBSPPA512_LBSPPB2048_LPB0_MIWT8_8_PLR1_SU0_SUM0_SUS64_VWA8_VWB8_WGM4_WGMXCC1_WGMXCCGn1
    SolutionIndex: 3
    SolutionNameMin: Cijk_Alik_Bjlk_HSS_BH_Bias_HAS_SAV_UserArgs_MT256x256x32_MI16x16x1_SN_LDSB1_CLR1_GRVWB8_GSU0_GSUC0_GSUWGMRR0_K1_LBSPPA512_LBSPPB2048_LPB0_MIWT8_8_PLR1_SU0_SUM0_SUS64_VWA8_VWB8_WGM4_WGMXCC1_WGMXCCGn1
    SolutionIndex: 4
    SolutionNameMin: Cijk_Alik_Bjlk_HSS_BH_Bias_HAS_SAV_UserArgs_MT256x256x32_MI16x16x1_SN_LDSB1_CLR1_GRVWB8_GSU0_GSUC0_GSUWGMRR0_K1_LBSPPA512_LBSPPB2048_LPB0_MIWT8_8_PLR1_SU0_SUM0_SUS64_VWA8_VWB8_WGM6_WGMXCC1_WGMXCCGn1
    SolutionIndex: 5
    SolutionNameMin: Cijk_Alik_Bjlk_HSS_BH_Bias_HAS_SAV_UserArgs_MT256x256x32_MI16x16x1_SN_LDSB1_CLR1_GRVWB8_GSU0_GSUC0_GSUWGMRR0_K1_LBSPPA512_LBSPPB2048_LPB0_MIWT8_8_PLR1_SU0_SUM0_SUS64_VWA8_VWB8_WGM6_WGMXCC1_WGMXCCGn1
    SolutionIndex: 6
    SolutionNameMin: Cijk_Alik_Bjlk_HSS_BH_Bias_HAS_SAV_UserArgs_MT256x256x32_MI16x16x1_SN_LDSB1_CLR1_GRVWB8_GSU0_GSUC0_GSUWGMRR0_K1_LBSPPA512_LBSPPB2048_LPB0_MIWT8_8_PLR1_SU0_SUM0_SUS64_VWA8_VWB8_WGM6_WGMXCC1_WGMXCCGn1
    SolutionIndex: 7
    SolutionNameMin: Cijk_Alik_Bjlk_HSS_BH_Bias_HAS_SAV_UserArgs_MT256x256x32_MI16x16x1_SN_LDSB1_CLR1_GRVWB8_GSU0_GSUC0_GSUWGMRR0_K1_LBSPPA512_LBSPPB2048_LPB0_MIWT8_8_PLR1_SU0_SUM0_SUS64_VWA8_VWB8_WGM8_WGMXCC1_WGMXCCGn1
    SolutionIndex: 8
    SolutionNameMin: Cijk_Alik_Bjlk_HSS_BH_Bias_HAS_SAV_UserArgs_MT256x256x32_MI16x16x1_SN_LDSB1_CLR1_GRVWB8_GSU0_GSUC0_GSUWGMRR0_K1_LBSPPA512_LBSPPB2048_LPB0_MIWT8_8_PLR1_SU0_SUM0_SUS64_VWA8_VWB8_WGM8_WGMXCC1_WGMXCCGn1
    SolutionIndex: 9
    SolutionNameMin: Cijk_Alik_Bjlk_HSS_BH_Bias_HAS_SAV_UserArgs_MT128x256x32_MI16x16x1_SN_LDSB1_CLR1_GRVWB8_GSU0_GSUC0_GSUWGMRR0_K1_LBSPPA256_LBSPPB2048_LPB0_MIWT4_8_PLR1_SU0_SUM0_SUS64_VWA4_VWB8_WGM1_WGMXCC1_WGMXCCGn1
    SolutionIndex: 10
    SolutionNameMin: Cijk_Alik_Bjlk_HSS_BH_Bias_HAS_SAV_UserArgs_MT128x256x32_MI16x16x1_SN_LDSB1_CLR1_GRVWB8_GSU0_GSUC0_GSUWGMRR0_K1_LBSPPA256_LBSPPB2048_LPB0_MIWT4_8_PLR1_SU0_SUM0_SUS64_VWA4_VWB8_WGM1_WGMXCC1_WGMXCCGn1
    SolutionIndex: 11
    SolutionNameMin: Cijk_Alik_Bjlk_HSS_BH_Bias_HAS_SAV_UserArgs_MT128x256x32_MI16x16x1_SN_LDSB1_CLR1_GRVWB8_GSU0_GSUC0_GSUWGMRR0_K1_LBSPPA256_LBSPPB2048_LPB0_MIWT4_8_PLR1_SU0_SUM0_SUS64_VWA4_VWB8_WGM4_WGMXCC1_WGMXCCGn1
    SolutionIndex: 12
    SolutionNameMin: Cijk_Alik_Bjlk_HSS_BH_Bias_HAS_SAV_UserArgs_MT128x256x32_MI16x16x1_SN_LDSB1_CLR1_GRVWB8_GSU0_GSUC0_GSUWGMRR0_K1_LBSPPA256_LBSPPB2048_LPB0_MIWT4_8_PLR1_SU0_SUM0_SUS64_VWA4_VWB8_WGM4_WGMXCC1_WGMXCCGn1
    SolutionIndex: 13
    SolutionNameMin: Cijk_Alik_Bjlk_HSS_BH_Bias_HAS_SAV_UserArgs_MT128x256x32_MI16x16x1_SN_LDSB1_CLR1_GRVWB8_GSU0_GSUC0_GSUWGMRR0_K1_LBSPPA256_LBSPPB2048_LPB0_MIWT4_8_PLR1_SU0_SUM0_SUS64_VWA4_VWB8_WGM6_WGMXCC1_WGMXCCGn1
    SolutionIndex: 14
    SolutionNameMin: Cijk_Alik_Bjlk_HSS_BH_Bias_HAS_SAV_UserArgs_MT128x256x32_MI16x16x1_SN_LDSB1_CLR1_GRVWB8_GSU0_GSUC0_GSUWGMRR0_K1_LBSPPA256_LBSPPB2048_LPB0_MIWT4_8_PLR1_SU0_SUM0_SUS64_VWA4_VWB8_WGM6_WGMXCC1_WGMXCCGn1
    SolutionIndex: 15
    SolutionNameMin: Cijk_Alik_Bjlk_HSS_BH_Bias_HAS_SAV_UserArgs_MT128x256x32_MI16x16x1_SN_LDSB1_CLR1_GRVWB8_GSU0_GSUC0_GSUWGMRR0_K1_LBSPPA256_LBSPPB2048_LPB0_MIWT4_8_PLR1_SU0_SUM0_SUS64_VWA4_VWB8_WGM6_WGMXCC1_WGMXCCGn1
    SolutionIndex: 16
    SolutionNameMin: Cijk_Alik_Bjlk_HSS_BH_Bias_HAS_SAV_UserArgs_MT128x256x32_MI16x16x1_SN_LDSB1_CLR1_GRVWB8_GSU0_GSUC0_GSUWGMRR0_K1_LBSPPA256_LBSPPB2048_LPB0_MIWT4_8_PLR1_SU0_SUM0_SUS64_VWA4_VWB8_WGM8_WGMXCC1_WGMXCCGn1
    SolutionIndex: 17
    SolutionNameMin: Cijk_Alik_Bjlk_HSS_BH_Bias_HAS_SAV_UserArgs_MT128x256x32_MI16x16x1_SN_LDSB1_CLR1_GRVWB8_GSU0_GSUC0_GSUWGMRR0_K1_LBSPPA256_LBSPPB2048_LPB0_MIWT4_8_PLR1_SU0_SUM0_SUS64_VWA4_VWB8_WGM8_WGMXCC1_WGMXCCGn1
    SolutionIndex: 18
    SolutionNameMin: Cijk_Alik_Bjlk_HSS_BH_Bias_HAS_SAV_UserArgs_MT128x128x32_MI16x16x1_SN_LDSB1_CLR1_GRVWB4_GSU0_GSUC0_GSUWGMRR0_K1_LBSPPA256_LBSPPB1024_LPB0_MIWT4_4_PLR1_SU0_SUM0_SUS64_VWA4_VWB4_WGM1_WGMXCC1_WGMXCCGn1
    SolutionIndex: 19
    SolutionNameMin: Cijk_Alik_Bjlk_HSS_BH_Bias_HAS_SAV_UserArgs_MT128x128x32_MI16x16x1_SN_LDSB1_CLR1_GRVWB8_GSU0_GSUC0_GSUWGMRR0_K1_LBSPPA256_LBSPPB1024_LPB0_MIWT4_4_PLR1_SU0_SUM0_SUS64_VWA4_VWB4_WGM1_WGMXCC1_WGMXCCGn1
    SolutionIndex: 20
    SolutionNameMin: Cijk_Alik_Bjlk_HSS_BH_Bias_HAS_SAV_UserArgs_MT128x128x32_MI16x16x1_SN_LDSB1_CLR1_GRVWB8_GSU0_GSUC0_GSUWGMRR0_K1_LBSPPA256_LBSPPB1024_LPB0_MIWT4_4_PLR1_SU0_SUM0_SUS64_VWA4_VWB4_WGM1_WGMXCC1_WGMXCCGn1
    SolutionIndex: 21
    SolutionNameMin: Cijk_Alik_Bjlk_HSS_BH_Bias_HAS_SAV_UserArgs_MT128x128x32_MI16x16x1_SN_LDSB1_CLR1_GRVWB2_GSU0_GSUC0_GSUWGMRR0_K1_LBSPPA256_LBSPPB1024_LPB0_MIWT4_4_PLR1_SU0_SUM0_SUS64_VWA4_VWB4_WGM6_WGMXCC1_WGMXCCGn1
    SolutionIndex: 22
    SolutionNameMin: Cijk_Alik_Bjlk_HSS_BH_Bias_HAS_SAV_UserArgs_MT128x128x32_MI16x16x1_SN_LDSB1_CLR1_GRVWB8_GSU0_GSUC0_GSUWGMRR0_K1_LBSPPA256_LBSPPB1024_LPB0_MIWT4_4_PLR1_SU0_SUM0_SUS64_VWA4_VWB4_WGM6_WGMXCC1_WGMXCCGn1
    SolutionIndex: 23
    SolutionNameMin: Cijk_Alik_Bjlk_HSS_BH_Bias_HAS_SAV_UserArgs_MT128x128x32_MI16x16x1_SN_LDSB1_CLR1_GRVWB8_GSU0_GSUC0_GSUWGMRR0_K1_LBSPPA256_LBSPPB2048_LPB0_MIWT4_4_PLR1_SU0_SUM0_SUS64_VWA4_VWB4_WGM6_WGMXCC1_WGMXCCGn1
    SolutionIndex: 24
    SolutionNameMin: Cijk_Alik_Bjlk_HSS_BH_Bias_HAS_SAV_UserArgs_MT128x128x32_MI16x16x1_SN_LDSB1_CLR1_GRVWB8_GSU0_GSUC0_GSUWGMRR0_K1_LBSPPA256_LBSPPB1024_LPB0_MIWT4_4_PLR1_SU0_SUM0_SUS64_VWA4_VWB4_WGM8_WGMXCC1_WGMXCCGn1
    SolutionIndex: 25
    SolutionNameMin: Cijk_Alik_Bjlk_HSS_BH_Bias_HAS_SAV_UserArgs_MT128x128x32_MI16x16x1_SN_LDSB1_CLR1_GRVWB8_GSU0_GSUC0_GSUWGMRR0_K1_LBSPPA256_LBSPPB1024_LPB0_MIWT4_4_PLR1_SU0_SUM0_SUS64_VWA4_VWB4_WGM8_WGMXCC1_WGMXCCGn1
    SolutionIndex: 26
    SolutionNameMin: Cijk_Alik_Bjlk_HSS_BH_Bias_HAS_SAV_UserArgs_MT128x128x32_MI16x16x1_SN_LDSB1_CLR1_GRVWB8_GSU0_GSUC0_GSUWGMRR0_K1_LBSPPA256_LBSPPB1024_LPB0_MIWT4_4_PLR1_SU0_SUM0_SUS64_VWA4_VWB4_WGM8_WGMXCC1_WGMXCCGn1
    SolutionIndex: 27
    SolutionNameMin: Cijk_Alik_Bjlk_HSS_BH_Bias_HAS_SAV_UserArgs_MT128x256x64_MI16x16x1_SN_LDSB1_CLR1_GRVWB8_GSU0_GSUC0_GSUWGMRR0_K1_LBSPPA512_LBSPPB2048_LPB0_MIWT4_8_PLR1_SU0_SUM0_SUS128_VWA4_VWB8_WGM1_WGMXCC1_WGMXCCGn1
    SolutionIndex: 28
    SolutionNameMin: Cijk_Alik_Bjlk_HSS_BH_Bias_HAS_SAV_UserArgs_MT128x256x64_MI16x16x1_SN_LDSB1_CLR1_GRVWB8_GSU0_GSUC0_GSUWGMRR0_K1_LBSPPA512_LBSPPB4096_LPB0_MIWT4_8_PLR1_SU0_SUM0_SUS128_VWA4_VWB8_WGM1_WGMXCC1_WGMXCCGn1
    SolutionIndex: 29
    SolutionNameMin: Cijk_Alik_Bjlk_HSS_BH_Bias_HAS_SAV_UserArgs_MT128x256x64_MI16x16x1_SN_LDSB1_CLR1_GRVWB8_GSU0_GSUC0_GSUWGMRR0_K1_LBSPPA512_LBSPPB4096_LPB0_MIWT4_8_PLR1_SU0_SUM0_SUS128_VWA4_VWB8_WGM1_WGMXCC1_WGMXCCGn1
    SolutionIndex: 30
    SolutionNameMin: Cijk_Alik_Bjlk_HSS_BH_Bias_HAS_SAV_UserArgs_MT128x256x64_MI16x16x1_SN_LDSB1_CLR1_GRVWB8_GSU0_GSUC0_GSUWGMRR0_K1_LBSPPA512_LBSPPB4096_LPB0_MIWT4_8_PLR1_SU0_SUM0_SUS128_VWA4_VWB8_WGM1_WGMXCC1_WGMXCCGn1
    SolutionIndex: 31
    SolutionNameMin: Cijk_Alik_Bjlk_HSS_BH_Bias_HAS_SAV_UserArgs_MT128x256x64_MI16x16x1_SN_LDSB1_CLR1_GRVWB8_GSU0_GSUC0_GSUWGMRR0_K1_LBSPPA512_LBSPPB4096_LPB0_MIWT4_8_PLR1_SU0_SUM0_SUS128_VWA4_VWB8_WGM4_WGMXCC1_WGMXCCGn1
    SolutionIndex: 32
    SolutionNameMin: Cijk_Alik_Bjlk_HSS_BH_Bias_HAS_SAV_UserArgs_MT128x256x64_MI16x16x1_SN_LDSB1_CLR1_GRVWB8_GSU0_GSUC0_GSUWGMRR0_K1_LBSPPA512_LBSPPB4096_LPB0_MIWT4_8_PLR1_SU0_SUM0_SUS128_VWA4_VWB8_WGM4_WGMXCC1_WGMXCCGn1
    SolutionIndex: 33
    SolutionNameMin: Cijk_Alik_Bjlk_HSS_BH_Bias_HAS_SAV_UserArgs_MT128x256x64_MI16x16x1_SN_LDSB1_CLR1_GRVWB8_GSU0_GSUC0_GSUWGMRR0_K1_LBSPPA512_LBSPPB4096_LPB0_MIWT4_8_PLR1_SU0_SUM0_SUS128_VWA4_VWB8_WGM4_WGMXCC1_WGMXCCGn1
    SolutionIndex: 34
    SolutionNameMin: Cijk_Alik_Bjlk_HSS_BH_Bias_HAS_SAV_UserArgs_MT128x256x64_MI16x16x1_SN_LDSB1_CLR1_GRVWB8_GSU0_GSUC0_GSUWGMRR0_K1_LBSPPA512_LBSPPB2048_LPB0_MIWT4_8_PLR1_SU0_SUM0_SUS128_VWA4_VWB8_WGM6_WGMXCC1_WGMXCCGn1
    SolutionIndex: 35
    SolutionNameMin: Cijk_Alik_Bjlk_HSS_BH_Bias_HAS_SAV_UserArgs_MT128x256x64_MI16x16x1_SN_LDSB1_CLR1_GRVWB8_GSU0_GSUC0_GSUWGMRR0_K1_LBSPPA512_LBSPPB4096_LPB0_MIWT4_8_PLR1_SU0_SUM0_SUS128_VWA4_VWB8_WGM6_WGMXCC1_WGMXCCGn1
    SolutionIndex: 36
    SolutionNameMin: Cijk_Alik_Bjlk_HSS_BH_Bias_HAS_SAV_UserArgs_MT128x256x64_MI16x16x1_SN_LDSB1_CLR1_GRVWB8_GSU0_GSUC0_GSUWGMRR0_K1_LBSPPA512_LBSPPB4096_LPB0_MIWT4_8_PLR1_SU0_SUM0_SUS128_VWA4_VWB8_WGM6_WGMXCC1_WGMXCCGn1
    SolutionIndex: 37
    SolutionNameMin: Cijk_Alik_Bjlk_HSS_BH_Bias_HAS_SAV_UserArgs_MT128x256x64_MI16x16x1_SN_LDSB1_CLR1_GRVWB8_GSU0_GSUC0_GSUWGMRR0_K1_LBSPPA512_LBSPPB4096_LPB0_MIWT4_8_PLR1_SU0_SUM0_SUS128_VWA4_VWB8_WGM8_WGMXCC1_WGMXCCGn1
    SolutionIndex: 38
    SolutionNameMin: Cijk_Alik_Bjlk_HSS_BH_Bias_HAS_SAV_UserArgs_MT128x256x64_MI16x16x1_SN_LDSB1_CLR1_GRVWB8_GSU0_GSUC0_GSUWGMRR0_K1_LBSPPA512_LBSPPB4096_LPB0_MIWT4_8_PLR1_SU0_SUM0_SUS128_VWA4_VWB8_WGM8_WGMXCC1_WGMXCCGn1
    SolutionIndex: 39
    SolutionNameMin: Cijk_Alik_Bjlk_HSS_BH_Bias_HAS_SAV_UserArgs_MT128x256x64_MI16x16x1_SN_LDSB1_CLR1_GRVWB8_GSU0_GSUC0_GSUWGMRR0_K1_LBSPPA512_LBSPPB4096_LPB0_MIWT4_8_PLR1_SU0_SUM0_SUS128_VWA4_VWB8_WGM8_WGMXCC1_WGMXCCGn1
    SolutionIndex: 40
    SolutionNameMin: Cijk_Alik_Bjlk_HSS_BH_Bias_HAS_SAV_UserArgs_MT128x128x64_MI16x16x1_SN_LDSB1_CLR1_GRVWB8_GSU0_GSUC0_GSUWGMRR0_K1_LBSPPA512_LBSPPB1024_LPB0_MIWT4_4_PLR1_SU0_SUM0_SUS128_VWA4_VWB4_WGM1_WGMXCC1_WGMXCCGn1
    SolutionIndex: 41
    SolutionNameMin: Cijk_Alik_Bjlk_HSS_BH_Bias_HAS_SAV_UserArgs_MT128x128x64_MI16x16x1_SN_LDSB1_CLR1_GRVWB8_GSU0_GSUC0_GSUWGMRR0_K1_LBSPPA512_LBSPPB2048_LPB0_MIWT4_4_PLR1_SU0_SUM0_SUS128_VWA4_VWB4_WGM1_WGMXCC1_WGMXCCGn1
    SolutionIndex: 42
    SolutionNameMin: Cijk_Alik_Bjlk_HSS_BH_Bias_HAS_SAV_UserArgs_MT128x128x64_MI16x16x1_SN_LDSB1_CLR1_GRVWB8_GSU0_GSUC0_GSUWGMRR0_K1_LBSPPA512_LBSPPB2048_LPB0_MIWT4_4_PLR1_SU0_SUM0_SUS128_VWA4_VWB4_WGM1_WGMXCC1_WGMXCCGn1
    SolutionIndex: 43
    SolutionNameMin: Cijk_Alik_Bjlk_HSS_BH_Bias_HAS_SAV_UserArgs_MT128x128x64_MI16x16x1_SN_LDSB1_CLR1_GRVWB8_GSU0_GSUC0_GSUWGMRR0_K1_LBSPPA512_LBSPPB2048_LPB0_MIWT4_4_PLR1_SU0_SUM0_SUS128_VWA4_VWB4_WGM4_WGMXCC1_WGMXCCGn1
    SolutionIndex: 44
    SolutionNameMin: Cijk_Alik_Bjlk_HSS_BH_Bias_HAS_SAV_UserArgs_MT128x128x64_MI16x16x1_SN_LDSB1_CLR1_GRVWB8_GSU0_GSUC0_GSUWGMRR0_K1_LBSPPA512_LBSPPB2048_LPB0_MIWT4_4_PLR1_SU0_SUM0_SUS128_VWA4_VWB4_WGM4_WGMXCC1_WGMXCCGn1
    SolutionIndex: 45
    SolutionNameMin: Cijk_Alik_Bjlk_HSS_BH_Bias_HAS_SAV_UserArgs_MT128x128x64_MI16x16x1_SN_LDSB1_CLR1_GRVWB8_GSU0_GSUC0_GSUWGMRR0_K1_LBSPPA512_LBSPPB2048_LPB0_MIWT4_4_PLR1_SU0_SUM0_SUS128_VWA4_VWB4_WGM6_WGMXCC1_WGMXCCGn1
    SolutionIndex: 46
    SolutionNameMin: Cijk_Alik_Bjlk_HSS_BH_Bias_HAS_SAV_UserArgs_MT128x128x64_MI16x16x1_SN_LDSB1_CLR1_GRVWB8_GSU0_GSUC0_GSUWGMRR0_K1_LBSPPA512_LBSPPB2048_LPB0_MIWT4_4_PLR1_SU0_SUM0_SUS128_VWA4_VWB4_WGM6_WGMXCC1_WGMXCCGn1
    SolutionIndex: 47
    SolutionNameMin: Cijk_Alik_Bjlk_HSS_BH_Bias_HAS_SAV_UserArgs_MT128x128x64_MI16x16x1_SN_LDSB1_CLR1_GRVWB8_GSU0_GSUC0_GSUWGMRR0_K1_LBSPPA512_LBSPPB2048_LPB0_MIWT4_4_PLR1_SU0_SUM0_SUS128_VWA4_VWB4_WGM8_WGMXCC1_WGMXCCGn1
    SolutionIndex: 48
    SolutionNameMin: Cijk_Alik_Bjlk_HSS_BH_Bias_HAS_SAV_UserArgs_MT128x128x64_MI16x16x1_SN_LDSB1_CLR1_GRVWB8_GSU0_GSUC0_GSUWGMRR0_K1_LBSPPA512_LBSPPB2048_LPB0_MIWT4_4_PLR1_SU0_SUM0_SUS128_VWA4_VWB4_WGM8_WGMXCC1_WGMXCCGn1
    SolutionIndex: 49
    SolutionNameMin: Cijk_Alik_Bjlk_HSS_BH_Bias_HAS_SAV_UserArgs_MT64x128x64_MI16x16x1_SN_LDSB1_CLR1_GRVWB8_GSU0_GSUC0_GSUWGMRR0_K1_LBSPPA256_LBSPPB1024_LPB0_MIWT2_4_PLR1_SU0_SUM0_SUS128_VWA2_VWB4_WGM1_WGMXCC1_WGMXCCGn1
    SolutionIndex: 50
    SolutionNameMin: Cijk_Alik_Bjlk_HSS_BH_Bias_HAS_SAV_UserArgs_MT64x128x64_MI16x16x1_SN_LDSB1_CLR1_GRVWB8_GSU0_GSUC0_GSUWGMRR0_K1_LBSPPA256_LBSPPB2048_LPB0_MIWT2_4_PLR1_SU0_SUM0_SUS128_VWA2_VWB4_WGM1_WGMXCC1_WGMXCCGn1
    SolutionIndex: 51
    SolutionNameMin: Cijk_Alik_Bjlk_HSS_BH_Bias_HAS_SAV_UserArgs_MT64x128x64_MI16x16x1_SN_LDSB1_CLR1_GRVWB8_GSU0_GSUC0_GSUWGMRR0_K1_LBSPPA256_LBSPPB2048_LPB0_MIWT2_4_PLR1_SU0_SUM0_SUS128_VWA2_VWB4_WGM1_WGMXCC1_WGMXCCGn1
    SolutionIndex: 52
    SolutionNameMin: Cijk_Alik_Bjlk_HSS_BH_Bias_HAS_SAV_UserArgs_MT64x128x64_MI16x16x1_SN_LDSB1_CLR1_GRVWB8_GSU0_GSUC0_GSUWGMRR0_K1_LBSPPA256_LBSPPB2048_LPB0_MIWT2_4_PLR1_SU0_SUM0_SUS128_VWA2_VWB4_WGM1_WGMXCC1_WGMXCCGn1
    SolutionIndex: 53
    SolutionNameMin: Cijk_Alik_Bjlk_HSS_BH_Bias_HAS_SAV_UserArgs_MT64x128x64_MI16x16x1_SN_LDSB1_CLR1_GRVWB8_GSU0_GSUC0_GSUWGMRR0_K1_LBSPPA256_LBSPPB2048_LPB0_MIWT2_4_PLR1_SU0_SUM0_SUS128_VWA2_VWB4_WGM4_WGMXCC1_WGMXCCGn1
    SolutionIndex: 54
    SolutionNameMin: Cijk_Alik_Bjlk_HSS_BH_Bias_HAS_SAV_UserArgs_MT128x64x64_MI16x16x1_SN_LDSB1_CLR1_GRVWB4_GSU0_GSUC0_GSUWGMRR0_K1_LBSPPA512_LBSPPB1024_LPB32_MIWT4_2_PLR1_SU0_SUM0_SUS128_VWA4_VWB2_WGM1_WGMXCC1_WGMXCCGn1
    SolutionIndex: 55
    SolutionNameMin: Cijk_Alik_Bjlk_HSS_BH_Bias_HAS_SAV_UserArgs_MT128x64x64_MI16x16x1_SN_LDSB1_CLR1_GRVWB8_GSU0_GSUC0_GSUWGMRR0_K1_LBSPPA512_LBSPPB1024_LPB32_MIWT4_2_PLR1_SU0_SUM0_SUS128_VWA4_VWB2_WGM1_WGMXCC1_WGMXCCGn1
    SolutionIndex: 56
    SolutionNameMin: Cijk_Alik_Bjlk_HSS_BH_Bias_HAS_SAV_UserArgs_MT128x64x64_MI16x16x1_SN_LDSB1_CLR1_GRVWB8_GSU0_GSUC0_GSUWGMRR0_K1_LBSPPA512_LBSPPB1024_LPB32_MIWT4_2_PLR1_SU0_SUM0_SUS128_VWA4_VWB2_WGM4_WGMXCC1_WGMXCCGn1
    SolutionIndex: 57
    SolutionNameMin: Cijk_Alik_Bjlk_HSS_BH_Bias_HAS_SAV_UserArgs_MT128x64x64_MI16x16x1_SN_LDSB1_CLR1_GRVWB8_GSU0_GSUC0_GSUWGMRR0_K1_LBSPPA512_LBSPPB1024_LPB32_MIWT4_2_PLR1_SU0_SUM0_SUS128_VWA4_VWB2_WGM6_WGMXCC1_WGMXCCGn1
    SolutionIndex: 58
    SolutionNameMin: Cijk_Alik_Bjlk_HSS_BH_Bias_HAS_SAV_UserArgs_MT128x64x64_MI16x16x1_SN_LDSB1_CLR1_GRVWB8_GSU0_GSUC0_GSUWGMRR0_K1_LBSPPA512_LBSPPB1024_LPB32_MIWT4_2_PLR1_SU0_SUM0_SUS128_VWA4_VWB2_WGM8_WGMXCC1_WGMXCCGn1
    SolutionIndex: 59
    SolutionNameMin: Cijk_Alik_Bjlk_HSS_BH_Bias_HAS_SAV_UserArgs_MT128x32x64_MI16x16x1_SN_LDSB1_CLR1_GRVWB4_GSU0_GSUC0_GSUWGMRR0_K1_LBSPPA512_LBSPPB512_LPB16_MIWT4_1_PLR1_SU0_SUM0_SUS128_VWA4_VWB1_WGM1_WGMXCC1_WGMXCCGn1
    SolutionIndex: 60
    SolutionNameMin: Cijk_Alik_Bjlk_HSS_BH_Bias_HAS_SAV_UserArgs_MT64x64x64_MI16x16x1_SN_LDSB1_CLR1_GRVWB8_GSU0_GSUC0_GSUWGMRR0_K1_LBSPPA256_LBSPPB512_LPB32_MIWT2_2_PLR1_SU0_SUM0_SUS128_VWA2_VWB2_WGM1_WGMXCC1_WGMXCCGn1
    SolutionIndex: 61
    SolutionNameMin: Cijk_Alik_Bjlk_HSS_BH_Bias_HAS_SAV_UserArgs_MT64x64x64_MI16x16x1_SN_LDSB1_CLR1_GRVWB2_GSU0_GSUC0_GSUWGMRR0_K1_LBSPPA256_LBSPPB1024_LPB32_MIWT2_2_PLR1_SU0_SUM0_SUS128_VWA2_VWB2_WGM1_WGMXCC1_WGMXCCGn1
    SolutionIndex: 62
    SolutionNameMin: Cijk_Alik_Bjlk_HSS_BH_Bias_HAS_SAV_UserArgs_MT64x64x64_MI16x16x1_SN_LDSB1_CLR1_GRVWB4_GSU0_GSUC0_GSUWGMRR0_K1_LBSPPA256_LBSPPB1024_LPB32_MIWT2_2_PLR1_SU0_SUM0_SUS128_VWA2_VWB2_WGM1_WGMXCC1_WGMXCCGn1
    SolutionIndex: 63
    SolutionNameMin: Cijk_Alik_Bjlk_HSS_BH_Bias_HAS_SAV_UserArgs_MT64x64x64_MI16x16x1_SN_LDSB1_CLR1_GRVWB8_GSU0_GSUC0_GSUWGMRR0_K1_LBSPPA256_LBSPPB1024_LPB32_MIWT2_2_PLR1_SU0_SUM0_SUS128_VWA2_VWB2_WGM1_WGMXCC1_WGMXCCGn1
    SolutionIndex: 64
    SolutionNameMin: Cijk_Alik_Bjlk_HSS_BH_Bias_HAS_SAV_UserArgs_MT64x64x64_MI16x16x1_SN_LDSB1_CLR1_GRVWB8_GSU0_GSUC0_GSUWGMRR0_K1_LBSPPA256_LBSPPB1024_LPB32_MIWT2_2_PLR1_SU0_SUM0_SUS128_VWA2_VWB2_WGM1_WGMXCC1_WGMXCCGn1
    SolutionIndex: 65
    SolutionNameMin: Cijk_Alik_Bjlk_HSS_BH_Bias_HAS_SAV_UserArgs_MT64x64x64_MI16x16x1_SN_LDSB1_CLR1_GRVWB4_GSU0_GSUC0_GSUWGMRR0_K1_LBSPPA256_LBSPPB1024_LPB32_MIWT2_2_PLR1_SU0_SUM0_SUS128_VWA2_VWB2_WGM4_WGMXCC1_WGMXCCGn1
    SolutionIndex: 66
    SolutionNameMin: Cijk_Alik_Bjlk_HSS_BH_Bias_HAS_SAV_UserArgs_MT64x64x64_MI16x16x1_SN_LDSB1_CLR1_GRVWB8_GSU0_GSUC0_GSUWGMRR0_K1_LBSPPA256_LBSPPB1024_LPB32_MIWT2_2_PLR1_SU0_SUM0_SUS128_VWA2_VWB2_WGM4_WGMXCC1_WGMXCCGn1
    SolutionIndex: 67
    SolutionNameMin: Cijk_Alik_Bjlk_HSS_BH_Bias_HAS_SAV_UserArgs_MT64x64x64_MI16x16x1_SN_LDSB1_CLR1_GRVWB8_GSU0_GSUC0_GSUWGMRR0_K1_LBSPPA256_LBSPPB1024_LPB32_MIWT2_2_PLR1_SU0_SUM0_SUS128_VWA2_VWB2_WGM6_WGMXCC1_WGMXCCGn1
    SolutionIndex: 68
    SolutionNameMin: Cijk_Alik_Bjlk_HSS_BH_Bias_HAS_SAV_UserArgs_MT64x64x64_MI16x16x1_SN_LDSB1_CLR1_GRVWB8_GSU0_GSUC0_GSUWGMRR0_K1_LBSPPA256_LBSPPB1024_LPB32_MIWT2_2_PLR1_SU0_SUM0_SUS128_VWA2_VWB2_WGM8_WGMXCC1_WGMXCCGn1
    SolutionIndex: 69
    SolutionNameMin: Cijk_Alik_Bjlk_HSS_BH_Bias_HAS_SAV_UserArgs_MT32x64x64_MI16x16x1_SN_LDSB0_CLR1_GRVWB2_GSU0_GSUC0_GSUWGMRR0_K1_LBSPPA128_LBSPPB1024_LPB32_MIWT1_2_PLR1_SU0_SUM0_SUS128_VWA1_VWB2_WGM1_WGMXCC1_WGMXCCGn1
    SolutionIndex: 70
    SolutionNameMin: Cijk_Alik_Bjlk_HSS_BH_Bias_HAS_SAV_UserArgs_MT32x32x64_MI16x16x1_SN_LDSB0_CLR1_GRVWB2_GSU0_GSUC0_GSUWGMRR0_K1_LBSPPA128_LBSPPB256_LPB16_MIWT1_1_PLR1_SU0_SUM0_SUS128_VWA1_VWB1_WGM1_WGMXCC1_WGMXCCGn1
    SolutionIndex: 71
    SolutionNameMin: Cijk_Alik_Bjlk_HSS_BH_Bias_HAS_SAV_UserArgs_MT32x32x64_MI16x16x1_SN_LDSB0_CLR1_GRVWB2_GSU0_GSUC0_GSUWGMRR0_K1_LBSPPA128_LBSPPB512_LPB16_MIWT1_1_PLR1_SU0_SUM0_SUS128_VWA1_VWB1_WGM1_WGMXCC1_WGMXCCGn1
    SolutionIndex: 72
    SolutionNameMin: Cijk_Alik_Bjlk_HSS_BH_Bias_HAS_SAV_UserArgs_MT32x32x64_MI16x16x1_SN_LDSB0_CLR1_GRVWB4_GSU0_GSUC0_GSUWGMRR0_K1_LBSPPA128_LBSPPB512_LPB16_MIWT1_1_PLR1_SU0_SUM0_SUS128_VWA1_VWB1_WGM1_WGMXCC1_WGMXCCGn1
    SolutionIndex: 73
    SolutionNameMin: Cijk_Alik_Bjlk_HSS_BH_Bias_HAS_SAV_UserArgs_MT64x128x128_MI16x16x1_SN_LDSB1_CLR1_GRVWB8_GSU0_GSUC0_GSUWGMRR0_K1_LBSPPA512_LBSPPB1024_LPB0_MIWT2_4_PLR1_SU0_SUM0_SUS256_VWA2_VWB4_WGM1_WGMXCC1_WGMXCCGn1
    SolutionIndex: 74
    SolutionNameMin: Cijk_Alik_Bjlk_HSS_BH_Bias_HAS_SAV_UserArgs_MT64x128x128_MI16x16x1_SN_LDSB1_CLR1_GRVWB8_GSU0_GSUC0_GSUWGMRR0_K1_LBSPPA512_LBSPPB2048_LPB0_MIWT2_4_PLR1_SU0_SUM0_SUS256_VWA2_VWB4_WGM1_WGMXCC1_WGMXCCGn1
    SolutionIndex: 75
    SolutionNameMin: Cijk_Alik_Bjlk_HSS_BH_Bias_HAS_SAV_UserArgs_MT64x128x128_MI16x16x1_SN_LDSB1_CLR1_GRVWB8_GSU0_GSUC0_GSUWGMRR0_K1_LBSPPA512_LBSPPB2048_LPB0_MIWT2_4_PLR1_SU0_SUM0_SUS256_VWA2_VWB4_WGM1_WGMXCC1_WGMXCCGn1
    SolutionIndex: 76
    SolutionNameMin: Cijk_Alik_Bjlk_HSS_BH_Bias_HAS_SAV_UserArgs_MT64x128x128_MI16x16x1_SN_LDSB1_CLR1_GRVWB8_GSU0_GSUC0_GSUWGMRR0_K1_LBSPPA512_LBSPPB2048_LPB0_MIWT2_4_PLR1_SU0_SUM0_SUS256_VWA2_VWB4_WGM1_WGMXCC1_WGMXCCGn1
    SolutionIndex: 77
    SolutionNameMin: Cijk_Alik_Bjlk_HSS_BH_Bias_HAS_SAV_UserArgs_MT64x128x128_MI16x16x1_SN_LDSB1_CLR1_GRVWB8_GSU0_GSUC0_GSUWGMRR0_K1_LBSPPA512_LBSPPB2048_LPB0_MIWT2_4_PLR1_SU0_SUM0_SUS256_VWA2_VWB4_WGM4_WGMXCC1_WGMXCCGn1
    SolutionIndex: 78
    SolutionNameMin: Cijk_Alik_Bjlk_HSS_BH_Bias_HAS_SAV_UserArgs_MT64x128x128_MI16x16x1_SN_LDSB1_CLR1_GRVWB8_GSU0_GSUC0_GSUWGMRR0_K1_LBSPPA512_LBSPPB2048_LPB0_MIWT2_4_PLR1_SU0_SUM0_SUS256_VWA2_VWB4_WGM4_WGMXCC1_WGMXCCGn1
    SolutionIndex: 79
    SolutionNameMin: Cijk_Alik_Bjlk_HSS_BH_Bias_HAS_SAV_UserArgs_MT64x128x128_MI16x16x1_SN_LDSB1_CLR1_GRVWB8_GSU0_GSUC0_GSUWGMRR0_K1_LBSPPA512_LBSPPB2048_LPB0_MIWT2_4_PLR1_SU0_SUM0_SUS256_VWA2_VWB4_WGM6_WGMXCC1_WGMXCCGn1
    SolutionIndex: 80
    SolutionNameMin: Cijk_Alik_Bjlk_HSS_BH_Bias_HAS_SAV_UserArgs_MT64x128x128_MI16x16x1_SN_LDSB1_CLR1_GRVWB8_GSU0_GSUC0_GSUWGMRR0_K1_LBSPPA512_LBSPPB2048_LPB0_MIWT2_4_PLR1_SU0_SUM0_SUS256_VWA2_VWB4_WGM8_WGMXCC1_WGMXCCGn1
    SolutionIndex: 81
    SolutionNameMin: Cijk_Alik_Bjlk_HSS_BH_Bias_HAS_SAV_UserArgs_MT64x64x128_MI16x16x1_SN_LDSB1_CLR1_GRVWB8_GSU0_GSUC0_GSUWGMRR0_K1_LBSPPA512_LBSPPB512_LPB32_MIWT2_2_PLR1_SU0_SUM0_SUS256_VWA2_VWB2_WGM1_WGMXCC1_WGMXCCGn1
    SolutionIndex: 82
    SolutionNameMin: Cijk_Alik_Bjlk_HSS_BH_Bias_HAS_SAV_UserArgs_MT64x64x128_MI16x16x1_SN_LDSB1_CLR1_GRVWB8_GSU0_GSUC0_GSUWGMRR0_K1_LBSPPA512_LBSPPB1024_LPB32_MIWT2_2_PLR1_SU0_SUM0_SUS256_VWA2_VWB2_WGM1_WGMXCC1_WGMXCCGn1
    SolutionIndex: 83
    SolutionNameMin: Cijk_Alik_Bjlk_HSS_BH_Bias_HAS_SAV_UserArgs_MT64x64x128_MI16x16x1_SN_LDSB1_CLR1_GRVWB8_GSU0_GSUC0_GSUWGMRR0_K1_LBSPPA512_LBSPPB1024_LPB32_MIWT2_2_PLR1_SU0_SUM0_SUS256_VWA2_VWB2_WGM4_WGMXCC1_WGMXCCGn1
    SolutionIndex: 84
    SolutionNameMin: Cijk_Alik_Bjlk_HSS_BH_Bias_HAS_SAV_UserArgs_MT64x64x128_MI16x16x1_SN_LDSB1_CLR1_GRVWB8_GSU0_GSUC0_GSUWGMRR0_K1_LBSPPA512_LBSPPB512_LPB32_MIWT2_2_PLR1_SU0_SUM0_SUS256_VWA2_VWB2_WGM6_WGMXCC1_WGMXCCGn1
    SolutionIndex: 85
    SolutionNameMin: Cijk_Alik_Bjlk_HSS_BH_Bias_HAS_SAV_UserArgs_MT64x64x128_MI16x16x1_SN_LDSB1_CLR1_GRVWB8_GSU0_GSUC0_GSUWGMRR0_K1_LBSPPA512_LBSPPB1024_LPB32_MIWT2_2_PLR1_SU0_SUM0_SUS256_VWA2_VWB2_WGM6_WGMXCC1_WGMXCCGn1
    SolutionIndex: 86
    SolutionNameMin: Cijk_Alik_Bjlk_HSS_BH_Bias_HAS_SAV_UserArgs_MT64x64x128_MI16x16x1_SN_LDSB1_CLR1_GRVWB8_GSU0_GSUC0_GSUWGMRR0_K1_LBSPPA512_LBSPPB1024_LPB32_MIWT2_2_PLR1_SU0_SUM0_SUS256_VWA2_VWB2_WGM8_WGMXCC1_WGMXCCGn1
    SolutionIndex: 87
    SolutionNameMin: Cijk_Alik_Bjlk_HSS_BH_Bias_HAS_SAV_UserArgs_MT32x64x128_MI16x16x1_SN_LDSB1_CLR1_GRVWB8_GSU0_GSUC0_GSUWGMRR0_K1_LBSPPA256_LBSPPB512_LPB32_MIWT1_2_PLR1_SU0_SUM0_SUS256_VWA1_VWB2_WGM1_WGMXCC1_WGMXCCGn1
    SolutionIndex: 88
    SolutionNameMin: Cijk_Alik_Bjlk_HSS_BH_Bias_HAS_SAV_UserArgs_MT32x64x128_MI16x16x1_SN_LDSB1_CLR1_GRVWB8_GSU0_GSUC0_GSUWGMRR0_K1_LBSPPA256_LBSPPB512_LPB32_MIWT1_2_PLR1_SU0_SUM0_SUS256_VWA1_VWB2_WGM1_WGMXCC1_WGMXCCGn1
    SolutionIndex: 89
    SolutionNameMin: Cijk_Alik_Bjlk_HSS_BH_Bias_HAS_SAV_UserArgs_MT32x64x128_MI16x16x1_SN_LDSB1_CLR1_GRVWB8_GSU0_GSUC0_GSUWGMRR0_K1_LBSPPA256_LBSPPB512_LPB32_MIWT1_2_PLR1_SU0_SUM0_SUS256_VWA1_VWB2_WGM1_WGMXCC1_WGMXCCGn1
    SolutionIndex: 90
    SolutionNameMin: Cijk_Alik_Bjlk_HSS_BH_Bias_HAS_SAV_UserArgs_MT32x64x128_MI16x16x1_SN_LDSB1_CLR1_GRVWB2_GSU0_GSUC0_GSUWGMRR0_K1_LBSPPA256_LBSPPB1024_LPB32_MIWT1_2_PLR1_SU0_SUM0_SUS256_VWA1_VWB2_WGM1_WGMXCC1_WGMXCCGn1
    SolutionIndex: 91
    SolutionNameMin: Cijk_Alik_Bjlk_HSS_BH_Bias_HAS_SAV_UserArgs_MT32x64x128_MI16x16x1_SN_LDSB1_CLR1_GRVWB8_GSU0_GSUC0_GSUWGMRR0_K1_LBSPPA256_LBSPPB1024_LPB32_MIWT1_2_PLR1_SU0_SUM0_SUS256_VWA1_VWB2_WGM1_WGMXCC1_WGMXCCGn1
    SolutionIndex: 92
    SolutionNameMin: Cijk_Alik_Bjlk_HSS_BH_Bias_HAS_SAV_UserArgs_MT32x64x128_MI16x16x1_SN_LDSB1_CLR1_GRVWB8_GSU0_GSUC0_GSUWGMRR0_K1_LBSPPA256_LBSPPB1024_LPB32_MIWT1_2_PLR1_SU0_SUM0_SUS256_VWA1_VWB2_WGM1_WGMXCC1_WGMXCCGn1
    SolutionIndex: 93
    SolutionNameMin: Cijk_Alik_Bjlk_HSS_BH_Bias_HAS_SAV_UserArgs_MT32x64x128_MI16x16x1_SN_LDSB1_CLR1_GRVWB8_GSU0_GSUC0_GSUWGMRR0_K1_LBSPPA256_LBSPPB1024_LPB32_MIWT1_2_PLR1_SU0_SUM0_SUS256_VWA1_VWB2_WGM1_WGMXCC1_WGMXCCGn1
    SolutionIndex: 94
    SolutionNameMin: Cijk_Alik_Bjlk_HSS_BH_Bias_HAS_SAV_UserArgs_MT32x64x128_MI16x16x1_SN_LDSB1_CLR1_GRVWB8_GSU0_GSUC0_GSUWGMRR0_K1_LBSPPA256_LBSPPB1024_LPB32_MIWT1_2_PLR1_SU0_SUM0_SUS256_VWA1_VWB2_WGM4_WGMXCC1_WGMXCCGn1
    SolutionIndex: 95
    SolutionNameMin: Cijk_Alik_Bjlk_HSS_BH_Bias_HAS_SAV_UserArgs_MT32x64x128_MI16x16x1_SN_LDSB1_CLR1_GRVWB8_GSU0_GSUC0_GSUWGMRR0_K1_LBSPPA256_LBSPPB1024_LPB32_MIWT1_2_PLR1_SU0_SUM0_SUS256_VWA1_VWB2_WGM4_WGMXCC1_WGMXCCGn1
    SolutionIndex: 96
    SolutionNameMin: Cijk_Alik_Bjlk_HSS_BH_Bias_HAS_SAV_UserArgs_MT32x64x128_MI16x16x1_SN_LDSB1_CLR1_GRVWB8_GSU0_GSUC0_GSUWGMRR0_K1_LBSPPA256_LBSPPB512_LPB32_MIWT1_2_PLR1_SU0_SUM0_SUS256_VWA1_VWB2_WGM6_WGMXCC1_WGMXCCGn1
    SolutionIndex: 97
    SolutionNameMin: Cijk_Alik_Bjlk_HSS_BH_Bias_HAS_SAV_UserArgs_MT32x64x128_MI16x16x1_SN_LDSB1_CLR1_GRVWB8_GSU0_GSUC0_GSUWGMRR0_K1_LBSPPA256_LBSPPB1024_LPB32_MIWT1_2_PLR1_SU0_SUM0_SUS256_VWA1_VWB2_WGM6_WGMXCC1_WGMXCCGn1
    SolutionIndex: 98
    SolutionNameMin: Cijk_Alik_Bjlk_HSS_BH_Bias_HAS_SAV_UserArgs_MT32x64x128_MI16x16x1_SN_LDSB1_CLR1_GRVWB8_GSU0_GSUC0_GSUWGMRR0_K1_LBSPPA256_LBSPPB1024_LPB32_MIWT1_2_PLR1_SU0_SUM0_SUS256_VWA1_VWB2_WGM6_WGMXCC1_WGMXCCGn1
    SolutionIndex: 99
    SolutionNameMin: Cijk_Alik_Bjlk_HSS_BH_Bias_HAS_SAV_UserArgs_MT32x64x128_MI16x16x1_SN_LDSB1_CLR1_GRVWB8_GSU0_GSUC0_GSUWGMRR0_K1_LBSPPA256_LBSPPB1024_LPB32_MIWT1_2_PLR1_SU0_SUM0_SUS256_VWA1_VWB2_WGM8_WGMXCC1_WGMXCCGn1
    SolutionIndex: 100
    SolutionNameMin: Cijk_Alik_Bjlk_HSS_BH_Bias_HAS_SAV_UserArgs_MT32x64x128_MI16x16x1_SN_LDSB1_CLR1_GRVWB8_GSU0_GSUC0_GSUWGMRR0_K1_LBSPPA256_LBSPPB1024_LPB32_MIWT1_2_PLR1_SU0_SUM0_SUS256_VWA1_VWB2_WGM8_WGMXCC1_WGMXCCGn1
    SolutionIndex: 101
    SolutionNameMin: Cijk_Alik_Bjlk_HSS_BH_Bias_HAS_SAV_UserArgs_MT64x32x128_MI16x16x1_SN_LDSB1_CLR1_GRVWB8_GSU0_GSUC0_GSUWGMRR0_K1_LBSPPA512_LBSPPB512_LPB16_MIWT2_1_PLR1_SU0_SUM0_SUS256_VWA2_VWB1_WGM1_WGMXCC1_WGMXCCGn1
    SolutionIndex: 102
    SolutionNameMin: Cijk_Alik_Bjlk_HSS_BH_Bias_HAS_SAV_UserArgs_MT32x32x128_MI16x16x1_SN_LDSB1_CLR1_GRVWB2_GSU0_GSUC0_GSUWGMRR0_K1_LBSPPA256_LBSPPB256_LPB16_MIWT1_1_PLR1_SU0_SUM0_SUS256_VWA1_VWB1_WGM1_WGMXCC1_WGMXCCGn1
    SolutionIndex: 103
    SolutionNameMin: Cijk_Alik_Bjlk_HSS_BH_Bias_HAS_SAV_UserArgs_MT32x32x128_MI16x16x1_SN_LDSB1_CLR1_GRVWB4_GSU0_GSUC0_GSUWGMRR0_K1_LBSPPA256_LBSPPB256_LPB16_MIWT1_1_PLR1_SU0_SUM0_SUS256_VWA1_VWB1_WGM1_WGMXCC1_WGMXCCGn1
    SolutionIndex: 104
    SolutionNameMin: Cijk_Alik_Bjlk_HSS_BH_Bias_HAS_SAV_UserArgs_MT32x32x128_MI16x16x1_SN_LDSB1_CLR1_GRVWB2_GSU0_GSUC0_GSUWGMRR0_K1_LBSPPA256_LBSPPB512_LPB16_MIWT1_1_PLR1_SU0_SUM0_SUS256_VWA1_VWB1_WGM1_WGMXCC1_WGMXCCGn1
    SolutionIndex: 105
    SolutionNameMin: Cijk_Alik_Bjlk_HSS_BH_Bias_HAS_SAV_UserArgs_MT32x32x128_MI16x16x1_SN_LDSB1_CLR1_GRVWB2_GSU0_GSUC0_GSUWGMRR0_K1_LBSPPA256_LBSPPB512_LPB16_MIWT1_1_PLR1_SU0_SUM0_SUS256_VWA1_VWB1_WGM1_WGMXCC1_WGMXCCGn1
    SolutionIndex: 106
    SolutionNameMin: Cijk_Alik_Bjlk_HSS_BH_Bias_HAS_SAV_UserArgs_MT32x32x128_MI16x16x1_SN_LDSB1_CLR1_GRVWB4_GSU0_GSUC0_GSUWGMRR0_K1_LBSPPA256_LBSPPB512_LPB16_MIWT1_1_PLR1_SU0_SUM0_SUS256_VWA1_VWB1_WGM1_WGMXCC1_WGMXCCGn1
    SolutionIndex: 107
    SolutionNameMin: Cijk_Alik_Bjlk_HSS_BH_Bias_HAS_SAV_UserArgs_MT32x32x128_MI16x16x1_SN_LDSB1_CLR1_GRVWB4_GSU0_GSUC0_GSUWGMRR0_K1_LBSPPA256_LBSPPB512_LPB16_MIWT1_1_PLR1_SU0_SUM0_SUS256_VWA1_VWB1_WGM1_WGMXCC1_WGMXCCGn1
    SolutionIndex: 108
    SolutionNameMin: Cijk_Alik_Bjlk_HSS_BH_Bias_HAS_SAV_UserArgs_MT32x32x128_MI16x16x1_SN_LDSB1_CLR1_GRVWB8_GSU0_GSUC0_GSUWGMRR0_K1_LBSPPA256_LBSPPB512_LPB16_MIWT1_1_PLR1_SU0_SUM0_SUS256_VWA1_VWB1_WGM1_WGMXCC1_WGMXCCGn1
    SolutionIndex: 109
    SolutionNameMin: Cijk_Alik_Bjlk_HSS_BH_Bias_HAS_SAV_UserArgs_MT32x32x128_MI16x16x1_SN_LDSB1_CLR1_GRVWB8_GSU0_GSUC0_GSUWGMRR0_K1_LBSPPA256_LBSPPB512_LPB16_MIWT1_1_PLR1_SU0_SUM0_SUS256_VWA1_VWB1_WGM1_WGMXCC1_WGMXCCGn1
    SolutionIndex: 110
    SolutionNameMin: Cijk_Alik_Bjlk_HSS_BH_Bias_HAS_SAV_UserArgs_MT32x32x128_MI16x16x1_SN_LDSB1_CLR1_GRVWB8_GSU0_GSUC0_GSUWGMRR0_K1_LBSPPA256_LBSPPB512_LPB16_MIWT1_1_PLR1_SU0_SUM0_SUS256_VWA1_VWB1_WGM4_WGMXCC1_WGMXCCGn1
    SolutionIndex: 111
    SolutionNameMin: Cijk_Alik_Bjlk_HSS_BH_Bias_HAS_SAV_UserArgs_MT32x32x128_MI16x16x1_SN_LDSB1_CLR1_GRVWB8_GSU0_GSUC0_GSUWGMRR0_K1_LBSPPA256_LBSPPB512_LPB16_MIWT1_1_PLR1_SU0_SUM0_SUS256_VWA1_VWB1_WGM4_WGMXCC1_WGMXCCGn1
    SolutionIndex: 112
    SolutionNameMin: Cijk_Alik_Bjlk_HSS_BH_Bias_HAS_SAV_UserArgs_MT32x32x128_MI16x16x1_SN_LDSB1_CLR1_GRVWB8_GSU0_GSUC0_GSUWGMRR0_K1_LBSPPA256_LBSPPB512_LPB16_MIWT1_1_PLR1_SU0_SUM0_SUS256_VWA1_VWB1_WGM6_WGMXCC1_WGMXCCGn1
    SolutionIndex: 113
    SolutionNameMin: Cijk_Alik_Bjlk_HSS_BH_Bias_HAS_SAV_UserArgs_MT32x32x128_MI16x16x1_SN_LDSB1_CLR1_GRVWB8_GSU0_GSUC0_GSUWGMRR0_K1_LBSPPA256_LBSPPB512_LPB16_MIWT1_1_PLR1_SU0_SUM0_SUS256_VWA1_VWB1_WGM6_WGMXCC1_WGMXCCGn1
    SolutionIndex: 114
    SolutionNameMin: Cijk_Alik_Bjlk_HSS_BH_Bias_HAS_SAV_UserArgs_MT32x32x128_MI16x16x1_SN_LDSB1_CLR1_GRVWB8_GSU0_GSUC0_GSUWGMRR0_K1_LBSPPA256_LBSPPB512_LPB16_MIWT1_1_PLR1_SU0_SUM0_SUS256_VWA1_VWB1_WGM8_WGMXCC1_WGMXCCGn1
    SolutionIndex: 115
    SolutionNameMin: Cijk_Alik_Bjlk_HSS_BH_Bias_HAS_SAV_UserArgs_MT32x32x128_MI16x16x1_SN_LDSB1_CLR1_GRVWB8_GSU0_GSUC0_GSUWGMRR0_K1_LBSPPA256_LBSPPB512_LPB16_MIWT1_1_PLR1_SU0_SUM0_SUS256_VWA1_VWB1_WGM8_WGMXCC1_WGMXCCGn1
- - - [128, 128, 1, 128, 128, 128, 128, 128]
    - [72, 0.45]
  - - [128, 128, 1, 256, 128, 128, 256, 128]
    - [105, 0.79]
  - - [128, 128, 1, 512, 128, 128, 512, 128]
    - [109, 1.32]
  - - [128, 128, 1, 1024, 128, 128, 1024, 128]
    - [109, 1.92]
  - - [128, 128, 1, 2048, 128, 128, 2048, 128]
    - [109, 2.58]
  - - [128, 128, 1, 4096, 128, 128, 4096, 128]
    - [109, 3.08]
  - - [128, 128, 1, 8192, 128, 128, 8192, 128]
    - [109, 3.52]
  - - [128, 256, 1, 128, 128, 128, 128, 256]
    - [70, 0.89]
  - - [128, 256, 1, 256, 128, 128, 256, 256]
    - [109, 1.53]
  - - [128, 256, 1, 512, 128, 128, 512, 256]
    - [109, 2.49]
  - - [128, 256, 1, 1024, 128, 128, 1024, 256]
    - [109, 3.53]
  - - [128, 256, 1, 2048, 128, 128, 2048, 256]
    - [109, 4.46]
  - - [128, 256, 1, 4096, 128, 128, 4096, 256]
    - [109, 5.31]
  - - [128, 256, 1, 8192, 128, 128, 8192, 256]
    - [109, 5.84]
  - - [128, 512, 1, 128, 128, 128, 128, 512]
    - [105, 1.73]
  - - [128, 512, 1, 256, 128, 128, 256, 512]
    - [71, 3.08]
  - - [128, 512, 1, 512, 128, 128, 512, 512]
    - [109, 4.77]
  - - [128, 512, 1, 1024, 128, 128, 1024, 512]
    - [109, 6.92]
  - - [128, 512, 1, 2048, 128, 128, 2048, 512]
    - [109, 8.96]
  - - [128, 512, 1, 4096, 128, 128, 4096, 512]
    - [109, 10.35]
  - - [128, 512, 1, 8192, 128, 128, 8192, 512]
    - [113, 11.31]
  - - [128, 1024, 1, 128, 128, 128, 128, 1024]
    - [104, 3.42]
  - - [128, 1024, 1, 256, 128, 128, 256, 1024]
    - [71, 5.69]
  - - [128, 1024, 1, 512, 128, 128, 512, 1024]
    - [109, 9.2]
  - - [128, 1024, 1, 1024, 128, 128, 1024, 1024]
    - [105, 13.45]
  - - [128, 1024, 1, 2048, 128, 128, 2048, 1024]
    - [109, 17.17]
  - - [128, 1024, 1, 4096, 128, 128, 4096, 1024]
    - [113, 20.25]
  - - [128, 1024, 1, 8192, 128, 128, 8192, 1024]
    - [111, 22.45]
  - - [128, 2048, 1, 128, 128, 128, 128, 2048]
    - [88, 5.93]
  - - [128, 2048, 1, 256, 128, 128, 256, 2048]
    - [69, 10.2]
  - - [128, 2048, 1, 512, 128, 128, 512, 2048]
    - [91, 16.31]
  - - [128, 2048, 1, 1024, 128, 128, 1024, 2048]
    - [91, 23.51]
  - - [128, 2048, 1, 2048, 128, 128, 2048, 2048]
    - [91, 30.33]
  - - [128, 2048, 1, 4096, 128, 128, 4096, 2048]
    - [91, 35.69]
  - - [128, 2048, 1, 8192, 128, 128, 8192, 2048]
    - [90, 35.35]
  - - [128, 4096, 1, 128, 128, 128, 128, 4096]
    - [64, 10.15]
  - - [128, 4096, 1, 256, 128, 128, 256, 4096]
    - [63, 17.42]
  - - [128, 4096, 1, 512, 128, 128, 512, 4096]
    - [82, 27.78]
  - - [128, 4096, 1, 1024, 128, 128, 1024, 4096]
    - [82, 39.76]
  - - [128, 4096, 1, 2048, 128, 128, 2048, 4096]
    - [82, 50.72]
  - - [128, 4096, 1, 4096, 128, 128, 4096, 4096]
    - [81, 54.47]
  - - [128, 4096, 1, 8192, 128, 128, 8192, 4096]
    - [81, 61.41]
  - - [128, 8192, 1, 128, 128, 128, 128, 8192]
    - [54, 16.03]
  - - [128, 8192, 1, 256, 128, 128, 256, 8192]
    - [50, 27.27]
  - - [128, 8192, 1, 512, 128, 128, 512, 8192]
    - [50, 42.77]
  - - [128, 8192, 1, 1024, 128, 128, 1024, 8192]
    - [76, 58.57]
  - - [128, 8192, 1, 2048, 128, 128, 2048, 8192]
    - [75, 66.91]
  - - [128, 8192, 1, 4096, 128, 128, 4096, 8192]
    - [74, 77.75]
  - - [128, 8192, 1, 8192, 128, 128, 8192, 8192]
    - [79, 81.83]
  - - [256, 128, 1, 128, 256, 256, 128, 128]
    - [109, 0.92]
  - - [256, 128, 1, 256, 256, 256, 256, 128]
    - [109, 1.6]
  - - [256, 128, 1, 512, 256, 256, 512, 128]
    - [109, 2.64]
  - - [256, 128, 1, 1024, 256, 256, 1024, 128]
    - [109, 3.89]
  - - [256, 128, 1, 2048, 256, 256, 2048, 128]
    - [109, 5.15]
  - - [256, 128, 1, 4096, 256, 256, 4096, 128]
    - [109, 6.26]
  - - [256, 128, 1, 8192, 256, 256, 8192, 128]
    - [109, 6.96]
  - - [256, 256, 1, 128, 256, 256, 128, 256]
    - [71, 1.75]
  - - [256, 256, 1, 256, 256, 256, 256, 256]
    - [103, 2.96]
  - - [256, 256, 1, 512, 256, 256, 512, 256]
    - [109, 4.82]
  - - [256, 256, 1, 1024, 256, 256, 1024, 256]
    - [108, 7.09]
  - - [256, 256, 1, 2048, 256, 256, 2048, 256]
    - [112, 9.15]
  - - [256, 256, 1, 4096, 256, 256, 4096, 256]
    - [113, 10.91]
  - - [256, 256, 1, 8192, 256, 256, 8192, 256]
    - [107, 11.96]
  - - [256, 512, 1, 128, 256, 256, 128, 512]
    - [102, 3.49]
  - - [256, 512, 1, 256, 256, 256, 256, 512]
    - [104, 5.83]
  - - [256, 512, 1, 512, 256, 256, 512, 512]
    - [107, 9.61]
  - - [256, 512, 1, 1024, 256, 256, 1024, 512]
    - [113, 13.93]
  - - [256, 512, 1, 2048, 256, 256, 2048, 512]
    - [113, 18.07]
  - - [256, 512, 1, 4096, 256, 256, 4096, 512]
    - [109, 21.15]
  - - [256, 512, 1, 8192, 256, 256, 8192, 512]
    - [112, 23.24]
  - - [256, 1024, 1, 128, 256, 256, 128, 1024]
    - [88, 6.08]
  - - [256, 1024, 1, 256, 256, 256, 256, 1024]
    - [91, 10.46]
  - - [256, 1024, 1, 512, 256, 256, 512, 1024]
    - [91, 17.1]
  - - [256, 1024, 1, 1024, 256, 256, 1024, 1024]
    - [91, 24.61]
  - - [256, 1024, 1, 2048, 256, 256, 2048, 1024]
    - [93, 31.38]
  - - [256, 1024, 1, 4096, 256, 256, 4096, 1024]
    - [93, 36.92]
  - - [256, 1024, 1, 8192, 256, 256, 8192, 1024]
    - [96, 40.01]
  - - [256, 2048, 1, 128, 256, 256, 128, 2048]
    - [61, 9.92]
  - - [256, 2048, 1, 256, 256, 256, 256, 2048]
    - [63, 17.53]
  - - [256, 2048, 1, 512, 256, 256, 512, 2048]
    - [82, 28.16]
  - - [256, 2048, 1, 1024, 256, 256, 1024, 2048]
    - [82, 40.36]
  - - [256, 2048, 1, 2048, 256, 256, 2048, 2048]
    - [82, 51.6]
  - - [256, 2048, 1, 4096, 256, 256, 4096, 2048]
    - [82, 59.5]
  - - [256, 2048, 1, 8192, 256, 256, 8192, 2048]
    - [85, 60.57]
  - - [256, 4096, 1, 128, 256, 256, 128, 4096]
    - [55, 16.17]
  - - [256, 4096, 1, 256, 256, 256, 256, 4096]
    - [55, 26.97]
  - - [256, 4096, 1, 512, 256, 256, 512, 4096]
    - [76, 43.19]
  - - [256, 4096, 1, 1024, 256, 256, 1024, 4096]
    - [76, 62.77]
  - - [256, 4096, 1, 2048, 256, 256, 2048, 4096]
    - [76, 76.38]
  - - [256, 4096, 1, 4096, 256, 256, 4096, 4096]
    - [74, 85.25]
  - - [256, 4096, 1, 8192, 256, 256, 8192, 4096]
    - [76, 89.81]
  - - [256, 8192, 1, 128, 256, 256, 128, 8192]
    - [18, 23.05]
  - - [256, 8192, 1, 256, 256, 256, 256, 8192]
    - [42, 38.38]
  - - [256, 8192, 1, 512, 256, 256, 512, 8192]
    - [42, 59.08]
  - - [256, 8192, 1, 1024, 256, 256, 1024, 8192]
    - [42, 76.63]
  - - [256, 8192, 1, 2048, 256, 256, 2048, 8192]
    - [42, 90.6]
  - - [256, 8192, 1, 4096, 256, 256, 4096, 8192]
    - [42, 105.11]
  - - [256, 8192, 1, 8192, 256, 256, 8192, 8192]
    - [26, 105.74]
  - - [512, 128, 1, 128, 512, 512, 128, 128]
    - [109, 1.83]
  - - [512, 128, 1, 256, 512, 512, 256, 128]
    - [109, 3.13]
  - - [512, 128, 1, 512, 512, 512, 512, 128]
    - [109, 5.14]
  - - [512, 128, 1, 1024, 512, 512, 1024, 128]
    - [111, 7.71]
  - - [512, 128, 1, 2048, 512, 512, 2048, 128]
    - [115, 10.31]
  - - [512, 128, 1, 4096, 512, 512, 4096, 128]
    - [109, 12.38]
  - - [512, 128, 1, 8192, 512, 512, 8192, 128]
    - [113, 13.77]
  - - [512, 256, 1, 128, 512, 512, 128, 256]
    - [106, 3.47]
  - - [512, 256, 1, 256, 512, 512, 256, 256]
    - [109, 5.84]
  - - [512, 256, 1, 512, 512, 512, 512, 256]
    - [113, 9.59]
  - - [512, 256, 1, 1024, 512, 512, 1024, 256]
    - [115, 14.06]
  - - [512, 256, 1, 2048, 512, 512, 2048, 256]
    - [115, 18.56]
  - - [512, 256, 1, 4096, 512, 512, 4096, 256]
    - [113, 21.98]
  - - [512, 256, 1, 8192, 512, 512, 8192, 256]
    - [114, 24.01]
  - - [512, 512, 1, 128, 512, 512, 128, 512]
    - [92, 6.03]
  - - [512, 512, 1, 256, 512, 512, 256, 512]
    - [101, 10.55]
  - - [512, 512, 1, 512, 512, 512, 512, 512]
    - [101, 16.57]
  - - [512, 512, 1, 1024, 512, 512, 1024, 512]
    - [97, 24.87]
  - - [512, 512, 1, 2048, 512, 512, 2048, 512]
    - [98, 32.1]
  - - [512, 512, 1, 4096, 512, 512, 4096, 512]
    - [100, 37.73]
  - - [512, 512, 1, 8192, 512, 512, 8192, 512]
    - [98, 41.29]
  - - [512, 1024, 1, 128, 512, 512, 128, 1024]
    - [59, 10.1]
  - - [512, 1024, 1, 256, 512, 512, 256, 1024]
    - [62, 17.4]
  - - [512, 1024, 1, 512, 512, 512, 512, 1024]
    - [82, 28.5]
  - - [512, 1024, 1, 1024, 512, 512, 1024, 1024]
    - [85, 40.84]
  - - [512, 1024, 1, 2048, 512, 512, 2048, 1024]
    - [85, 51.66]
  - - [512, 1024, 1, 4096, 512, 512, 4096, 1024]
    - [85, 60.84]
  - - [512, 1024, 1, 8192, 512, 512, 8192, 1024]
    - [85, 62.9]
  - - [512, 2048, 1, 128, 512, 512, 128, 2048]
    - [55, 15.81]
  - - [512, 2048, 1, 256, 512, 512, 256, 2048]
    - [52, 27.49]
  - - [512, 2048, 1, 512, 512, 512, 512, 2048]
    - [76, 44.09]
  - - [512, 2048, 1, 1024, 512, 512, 1024, 2048]
    - [78, 62.87]
  - - [512, 2048, 1, 2048, 512, 512, 2048, 2048]
    - [78, 78.84]
  - - [512, 2048, 1, 4096, 512, 512, 4096, 2048]
    - [74, 89.75]
  - - [512, 2048, 1, 8192, 512, 512, 8192, 2048]
    - [76, 89.9]
  - - [512, 4096, 1, 128, 512, 512, 128, 4096]
    - [20, 23.62]
  - - [512, 4096, 1, 256, 512, 512, 256, 4096]
    - [42, 38.7]
  - - [512, 4096, 1, 512, 512, 512, 512, 4096]
    - [42, 60.26]
  - - [512, 4096, 1, 1024, 512, 512, 1024, 4096]
    - [42, 81.17]
  - - [512, 4096, 1, 2048, 512, 512, 2048, 4096]
    - [41, 94.85]
  - - [512, 4096, 1, 4096, 512, 512, 4096, 4096]
    - [42, 106.39]
  - - [512, 4096, 1, 8192, 512, 512, 8192, 4096]
    - [41, 110.78]
  - - [512, 8192, 1, 128, 512, 512, 128, 8192]
    - [17, 29.04]
  - - [512, 8192, 1, 256, 512, 512, 256, 8192]
    - [15, 47.11]
  - - [512, 8192, 1, 512, 512, 512, 512, 8192]
    - [10, 71.13]
  - - [512, 8192, 1, 1024, 512, 512, 1024, 8192]
    - [13, 94.28]
  - - [512, 8192, 1, 2048, 512, 512, 2048, 8192]
    - [9, 113.56]
  - - [512, 8192, 1, 4096, 512, 512, 4096, 8192]
    - [28, 118.7]
  - - [512, 8192, 1, 8192, 512, 512, 8192, 8192]
    - [12, 133.42]
  - - [1024, 128, 1, 128, 1024, 1024, 128, 128]
    - [105, 3.47]
  - - [1024, 128, 1, 256, 1024, 1024, 256, 128]
    - [115, 5.96]
  - - [1024, 128, 1, 512, 1024, 1024, 512, 128]
    - [111, 10.06]
  - - [1024, 128, 1, 1024, 1024, 1024, 1024, 128]
    - [113, 15.28]
  - - [1024, 128, 1, 2048, 1024, 1024, 2048, 128]
    - [110, 20.4]
  - - [1024, 128, 1, 4096, 1024, 1024, 4096, 128]
    - [113, 24.93]
  - - [1024, 128, 1, 8192, 1024, 1024, 8192, 128]
    - [115, 27.73]
  - - [1024, 256, 1, 128, 1024, 1024, 128, 256]
    - [88, 5.93]
  - - [1024, 256, 1, 256, 1024, 1024, 256, 256]
    - [97, 10.31]
  - - [1024, 256, 1, 512, 1024, 1024, 512, 256]
    - [97, 17.05]
  - - [1024, 256, 1, 1024, 1024, 1024, 1024, 256]
    - [94, 25.24]
  - - [1024, 256, 1, 2048, 1024, 1024, 2048, 256]
    - [95, 32.87]
  - - [1024, 256, 1, 4096, 1024, 1024, 4096, 256]
    - [95, 38.46]
  - - [1024, 256, 1, 8192, 1024, 1024, 8192, 256]
    - [98, 42.42]
  - - [1024, 512, 1, 128, 1024, 1024, 128, 512]
    - [65, 10.21]
  - - [1024, 512, 1, 256, 1024, 1024, 256, 512]
    - [67, 17.84]
  - - [1024, 512, 1, 512, 1024, 1024, 512, 512]
    - [83, 29.1]
  - - [1024, 512, 1, 1024, 1024, 1024, 1024, 512]
    - [83, 41.49]
  - - [1024, 512, 1, 2048, 1024, 1024, 2048, 512]
    - [83, 52.39]
  - - [1024, 512, 1, 4096, 1024, 1024, 4096, 512]
    - [83, 60.96]
  - - [1024, 512, 1, 8192, 1024, 1024, 8192, 512]
    - [86, 65.14]
  - - [1024, 1024, 1, 128, 1024, 1024, 128, 1024]
    - [56, 15.79]
  - - [1024, 1024, 1, 256, 1024, 1024, 256, 1024]
    - [52, 27.69]
  - - [1024, 1024, 1, 512, 1024, 1024, 512, 1024]
    - [78, 44.1]
  - - [1024, 1024, 1, 1024, 1024, 1024, 1024, 1024]
    - [78, 63.24]
  - - [1024, 1024, 1, 2048, 1024, 1024, 2048, 1024]
    - [78, 80.55]
  - - [1024, 1024, 1, 4096, 1024, 1024, 4096, 1024]
    - [78, 92.43]
  - - [1024, 1024, 1, 8192, 1024, 1024, 8192, 1024]
    - [78, 90.76]
  - - [1024, 2048, 1, 128, 1024, 1024, 128, 2048]
    - [20, 22.99]
  - - [1024, 2048, 1, 256, 1024, 1024, 256, 2048]
    - [46, 38.7]
  - - [1024, 2048, 1, 512, 1024, 1024, 512, 2048]
    - [42, 60.48]
  - - [1024, 2048, 1, 1024, 1024, 1024, 1024, 2048]
    - [47, 81.1]
  - - [1024, 2048, 1, 2048, 1024, 1024, 2048, 2048]
    - [40, 97.98]
  - - [1024, 2048, 1, 4096, 1024, 1024, 4096, 2048]
    - [41, 107.62]
  - - [1024, 2048, 1, 8192, 1024, 1024, 8192, 2048]
    - [43, 111.21]
  - - [1024, 4096, 1, 128, 1024, 1024, 128, 4096]
    - [10, 29.05]
  - - [1024, 4096, 1, 256, 1024, 1024, 256, 4096]
    - [15, 47.59]
  - - [1024, 4096, 1, 512, 1024, 1024, 512, 4096]
    - [30, 70.33]
  - - [1024, 4096, 1, 1024, 1024, 1024, 1024, 4096]
    - [13, 94.21]
  - - [1024, 4096, 1, 2048, 1024, 1024, 2048, 4096]
    - [28, 113.87]
  - - [1024, 4096, 1, 4096, 1024, 1024, 4096, 4096]
    - [33, 117.76]
  - - [1024, 4096, 1, 8192, 1024, 1024, 8192, 4096]
    - [14, 130.42]
  - - [1024, 8192, 1, 128, 1024, 1024, 128, 8192]
    - [9, 32.3]
  - - [1024, 8192, 1, 256, 1024, 1024, 256, 8192]
    - [10, 52.73]
  - - [1024, 8192, 1, 512, 1024, 1024, 512, 8192]
    - [9, 78.03]
  - - [1024, 8192, 1, 1024, 1024, 1024, 1024, 8192]
    - [0, 105.61]
  - - [1024, 8192, 1, 2048, 1024, 1024, 2048, 8192]
    - [42, 118.8]
  - - [1024, 8192, 1, 4096, 1024, 1024, 4096, 8192]
    - [36, 133.87]
  - - [1024, 8192, 1, 8192, 1024, 1024, 8192, 8192]
    - [3, 157.6]
  - - [2048, 128, 1, 128, 2048, 2048, 128, 128]
    - [89, 6.27]
  - - [2048, 128, 1, 256, 2048, 2048, 256, 128]
    - [91, 10.8]
  - - [2048, 128, 1, 512, 2048, 2048, 512, 128]
    - [93, 17.86]
  - - [2048, 128, 1, 1024, 2048, 2048, 1024, 128]
    - [87, 26.59]
  - - [2048, 128, 1, 2048, 2048, 2048, 2048, 128]
    - [97, 35.4]
  - - [2048, 128, 1, 4096, 2048, 2048, 4096, 128]
    - [97, 42.06]
  - - [2048, 128, 1, 8192, 2048, 2048, 8192, 128]
    - [99, 45.71]
  - - [2048, 256, 1, 128, 2048, 2048, 128, 256]
    - [68, 10.22]
  - - [2048, 256, 1, 256, 2048, 2048, 256, 256]
    - [66, 17.58]
  - - [2048, 256, 1, 512, 2048, 2048, 512, 256]
    - [83, 28.99]
  - - [2048, 256, 1, 1024, 2048, 2048, 1024, 256]
    - [86, 41.58]
  - - [2048, 256, 1, 2048, 2048, 2048, 2048, 256]
    - [83, 52.42]
  - - [2048, 256, 1, 4096, 2048, 2048, 4096, 256]
    - [86, 61.66]
  - - [2048, 256, 1, 8192, 2048, 2048, 8192, 256]
    - [84, 62.73]
  - - [2048, 512, 1, 128, 2048, 2048, 128, 512]
    - [55, 16.27]
  - - [2048, 512, 1, 256, 2048, 2048, 256, 512]
    - [49, 27.3]
  - - [2048, 512, 1, 512, 2048, 2048, 512, 512]
    - [79, 43.68]
  - - [2048, 512, 1, 1024, 2048, 2048, 1024, 512]
    - [79, 63.21]
  - - [2048, 512, 1, 2048, 2048, 2048, 2048, 512]
    - [80, 80.65]
  - - [2048, 512, 1, 4096, 2048, 2048, 4096, 512]
    - [77, 90.72]
  - - [2048, 512, 1, 8192, 2048, 2048, 8192, 512]
    - [80, 90.86]
  - - [2048, 1024, 1, 128, 2048, 2048, 128, 1024]
    - [26, 23.15]
  - - [2048, 1024, 1, 256, 2048, 2048, 256, 1024]
    - [44, 38.49]
  - - [2048, 1024, 1, 512, 2048, 2048, 512, 1024]
    - [48, 60.63]
  - - [2048, 1024, 1, 1024, 2048, 2048, 1024, 1024]
    - [44, 81.87]
  - - [2048, 1024, 1, 2048, 2048, 2048, 2048, 1024]
    - [43, 98.86]
  - - [2048, 1024, 1, 4096, 2048, 2048, 4096, 1024]
    - [48, 107.8]
  - - [2048, 1024, 1, 8192, 2048, 2048, 8192, 1024]
    - [48, 112.18]
  - - [2048, 2048, 1, 128, 2048, 2048, 128, 2048]
    - [10, 27.97]
  - - [2048, 2048, 1, 256, 2048, 2048, 256, 2048]
    - [10, 46.72]
  - - [2048, 2048, 1, 512, 2048, 2048, 512, 2048]
    - [11, 69.37]
  - - [2048, 2048, 1, 1024, 2048, 2048, 1024, 2048]
    - [36, 93.45]
  - - [2048, 2048, 1, 2048, 2048, 2048, 2048, 2048]
    - [34, 112.09]
  - - [2048, 2048, 1, 4096, 2048, 2048, 4096, 2048]
    - [33, 118.07]
  - - [2048, 2048, 1, 8192, 2048, 2048, 8192, 2048]
    - [17, 132.2]
  - - [2048, 4096, 1, 128, 2048, 2048, 128, 4096]
    - [9, 31.54]
  - - [2048, 4096, 1, 256, 2048, 2048, 256, 4096]
    - [12, 51.23]
  - - [2048, 4096, 1, 512, 2048, 2048, 512, 4096]
    - [0, 78.19]
  - - [2048, 4096, 1, 1024, 2048, 2048, 1024, 4096]
    - [7, 104.16]
  - - [2048, 4096, 1, 2048, 2048, 2048, 2048, 4096]
    - [30, 121.86]
  - - [2048, 4096, 1, 4096, 2048, 2048, 4096, 4096]
    - [30, 135.86]
  - - [2048, 4096, 1, 8192, 2048, 2048, 8192, 4096]
    - [5, 154.62]
  - - [2048, 8192, 1, 128, 2048, 2048, 128, 8192]
    - [10, 33.81]
  - - [2048, 8192, 1, 256, 2048, 2048, 256, 8192]
    - [15, 54.65]
  - - [2048, 8192, 1, 512, 2048, 2048, 512, 8192]
    - [42, 82.86]
  - - [2048, 8192, 1, 1024, 2048, 2048, 1024, 8192]
    - [15, 105.69]
  - - [2048, 8192, 1, 2048, 2048, 2048, 2048, 8192]
    - [30, 138.8]
  - - [2048, 8192, 1, 4096, 2048, 2048, 4096, 8192]
    - [9, 158.78]
  - - [2048, 8192, 1, 8192, 2048, 2048, 8192, 8192]
    - [9, 174.45]
  - - [4096, 128, 1, 128, 4096, 4096, 128, 128]
    - [60, 10.15]
  - - [4096, 128, 1, 256, 4096, 4096, 256, 128]
    - [82, 17.49]
  - - [4096, 128, 1, 512, 4096, 4096, 512, 128]
    - [86, 28.7]
  - - [4096, 128, 1, 1024, 4096, 4096, 1024, 128]
    - [85, 42.08]
  - - [4096, 128, 1, 2048, 4096, 4096, 2048, 128]
    - [85, 54.65]
  - - [4096, 128, 1, 4096, 4096, 4096, 4096, 128]
    - [83, 61.36]
  - - [4096, 128, 1, 8192, 4096, 4096, 8192, 128]
    - [83, 68.96]
  - - [4096, 256, 1, 128, 4096, 4096, 128, 256]
    - [57, 16.0]
  - - [4096, 256, 1, 256, 4096, 4096, 256, 256]
    - [57, 26.9]
  - - [4096, 256, 1, 512, 4096, 4096, 512, 256]
    - [53, 42.78]
  - - [4096, 256, 1, 1024, 4096, 4096, 1024, 256]
    - [79, 61.45]
  - - [4096, 256, 1, 2048, 4096, 4096, 2048, 256]
    - [79, 75.38]
  - - [4096, 256, 1, 4096, 4096, 4096, 4096, 256]
    - [77, 86.58]
  - - [4096, 256, 1, 8192, 4096, 4096, 8192, 256]
    - [79, 89.38]
  - - [4096, 512, 1, 128, 4096, 4096, 128, 512]
    - [22, 22.4]
  - - [4096, 512, 1, 256, 4096, 4096, 256, 512]
    - [44, 37.5]
  - - [4096, 512, 1, 512, 4096, 4096, 512, 512]
    - [44, 59.76]
  - - [4096, 512, 1, 1024, 4096, 4096, 1024, 512]
    - [43, 79.22]
  - - [4096, 512, 1, 2048, 4096, 4096, 2048, 512]
    - [43, 96.03]
  - - [4096, 512, 1, 4096, 4096, 4096, 4096, 512]
    - [44, 107.58]
  - - [4096, 512, 1, 8192, 4096, 4096, 8192, 512]
    - [45, 110.86]
  - - [4096, 1024, 1, 128, 4096, 4096, 128, 1024]
    - [10, 27.05]
  - - [4096, 1024, 1, 256, 4096, 4096, 256, 1024]
    - [10, 45.42]
  - - [4096, 1024, 1, 512, 4096, 4096, 512, 1024]
    - [13, 68.73]
  - - [4096, 1024, 1, 1024, 4096, 4096, 1024, 1024]
    - [13, 93.21]
  - - [4096, 1024, 1, 2048, 4096, 4096, 2048, 1024]
    - [33, 111.55]
  - - [4096, 1024, 1, 4096, 4096, 4096, 4096, 1024]
    - [40, 123.78]
  - - [4096, 1024, 1, 8192, 4096, 4096, 8192, 1024]
    - [13, 131.2]
  - - [4096, 2048, 1, 128, 4096, 4096, 128, 2048]
    - [10, 31.28]
  - - [4096, 2048, 1, 256, 4096, 4096, 256, 2048]
    - [11, 50.74]
  - - [4096, 2048, 1, 512, 4096, 4096, 512, 2048]
    - [30, 76.75]
  - - [4096, 2048, 1, 1024, 4096, 4096, 1024, 2048]
    - [4, 100.63]
  - - [4096, 2048, 1, 2048, 4096, 4096, 2048, 2048]
    - [10, 121.1]
  - - [4096, 2048, 1, 4096, 4096, 4096, 4096, 2048]
    - [28, 139.05]
  - - [4096, 2048, 1, 8192, 4096, 4096, 8192, 2048]
    - [8, 151.64]
  - - [4096, 4096, 1, 128, 4096, 4096, 128, 4096]
    - [10, 33.35]
  - - [4096, 4096, 1, 256, 4096, 4096, 256, 4096]
    - [23, 53.3]
  - - [4096, 4096, 1, 512, 4096, 4096, 512, 4096]
    - [44, 80.17]
  - - [4096, 4096, 1, 1024, 4096, 4096, 1024, 4096]
    - [42, 106.39]
  - - [4096, 4096, 1, 2048, 4096, 4096, 2048, 4096]
    - [28, 137.59]
  - - [4096, 4096, 1, 4096, 4096, 4096, 4096, 4096]
    - [29, 153.68]
  - - [4096, 4096, 1, 8192, 4096, 4096, 8192, 4096]
    - [4, 168.82]
  - - [4096, 8192, 1, 128, 4096, 4096, 128, 8192]
    - [19, 34.53]
  - - [4096, 8192, 1, 256, 4096, 4096, 256, 8192]
    - [16, 57.39]
  - - [4096, 8192, 1, 512, 4096, 4096, 512, 8192]
    - [9, 88.1]
  - - [4096, 8192, 1, 1024, 4096, 4096, 1024, 8192]
    - [38, 115.46]
  - - [4096, 8192, 1, 2048, 4096, 4096, 2048, 8192]
    - [31, 145.61]
  - - [4096, 8192, 1, 4096, 4096, 4096, 4096, 8192]
    - [0, 169.78]
  - - [4096, 8192, 1, 8192, 4096, 4096, 8192, 8192]
    - [1, 193.25]
  - - [8192, 128, 1, 128, 8192, 8192, 128, 128]
    - [58, 15.74]
  - - [8192, 128, 1, 256, 8192, 8192, 256, 128]
    - [51, 26.25]
  - - [8192, 128, 1, 512, 8192, 8192, 512, 128]
    - [49, 42.02]
  - - [8192, 128, 1, 1024, 8192, 8192, 1024, 128]
    - [74, 56.79]
  - - [8192, 128, 1, 2048, 8192, 8192, 2048, 128]
    - [73, 68.46]
  - - [8192, 128, 1, 4096, 8192, 8192, 4096, 128]
    - [74, 79.42]
  - - [8192, 128, 1, 8192, 8192, 8192, 8192, 128]
    - [73, 79.45]
  - - [8192, 256, 1, 128, 8192, 8192, 128, 256]
    - [25, 22.4]
  - - [8192, 256, 1, 256, 8192, 8192, 256, 256]
    - [42, 36.9]
  - - [8192, 256, 1, 512, 8192, 8192, 512, 256]
    - [46, 56.93]
  - - [8192, 256, 1, 1024, 8192, 8192, 1024, 256]
    - [44, 74.06]
  - - [8192, 256, 1, 2048, 8192, 8192, 2048, 256]
    - [44, 91.0]
  - - [8192, 256, 1, 4096, 8192, 8192, 4096, 256]
    - [46, 103.11]
  - - [8192, 256, 1, 8192, 8192, 8192, 8192, 256]
    - [73, 103.74]
  - - [8192, 512, 1, 128, 8192, 8192, 128, 512]
    - [9, 28.21]
  - - [8192, 512, 1, 256, 8192, 8192, 256, 512]
    - [10, 45.95]
  - - [8192, 512, 1, 512, 8192, 8192, 512, 512]
    - [11, 68.97]
  - - [8192, 512, 1, 1024, 8192, 8192, 1024, 512]
    - [36, 92.58]
  - - [8192, 512, 1, 2048, 8192, 8192, 2048, 512]
    - [39, 111.21]
  - - [8192, 512, 1, 4096, 8192, 8192, 4096, 512]
    - [41, 117.91]
  - - [8192, 512, 1, 8192, 8192, 8192, 8192, 512]
    - [37, 125.38]
  - - [8192, 1024, 1, 128, 8192, 8192, 128, 1024]
    - [10, 31.47]
  - - [8192, 1024, 1, 256, 8192, 8192, 256, 1024]
    - [10, 50.52]
  - - [8192, 1024, 1, 512, 8192, 8192, 512, 1024]
    - [30, 75.53]
  - - [8192, 1024, 1, 1024, 8192, 8192, 1024, 1024]
    - [11, 101.24]
  - - [8192, 1024, 1, 2048, 8192, 8192, 2048, 1024]
    - [9, 121.65]
  - - [8192, 1024, 1, 4096, 8192, 8192, 4096, 1024]
    - [28, 141.56]
  - - [8192, 1024, 1, 8192, 8192, 8192, 8192, 1024]
    - [2, 152.18]
  - - [8192, 2048, 1, 128, 8192, 8192, 128, 2048]
    - [10, 33.8]
  - - [8192, 2048, 1, 256, 8192, 8192, 256, 2048]
    - [24, 53.56]
  - - [8192, 2048, 1, 512, 8192, 8192, 512, 2048]
    - [48, 82.98]
  - - [8192, 2048, 1, 1024, 8192, 8192, 1024, 2048]
    - [13, 105.83]
  - - [8192, 2048, 1, 2048, 8192, 8192, 2048, 2048]
    - [35, 136.76]
  - - [8192, 2048, 1, 4096, 8192, 8192, 4096, 2048]
    - [30, 153.27]
  - - [8192, 2048, 1, 8192, 8192, 8192, 8192, 2048]
    - [6, 163.13]
  - - [8192, 4096, 1, 128, 8192, 8192, 128, 4096]
    - [21, 35.18]
  - - [8192, 4096, 1, 256, 8192, 8192, 256, 4096]
    - [16, 58.65]
  - - [8192, 4096, 1, 512, 8192, 8192, 512, 4096]
    - [9, 88.05]
  - - [8192, 4096, 1, 1024, 8192, 8192, 1024, 4096]
    - [32, 116.78]
  - - [8192, 4096, 1, 2048, 8192, 8192, 2048, 4096]
    - [31, 148.2]
  - - [8192, 4096, 1, 4096, 8192, 8192, 4096, 4096]
    - [0, 166.87]
  - - [8192, 4096, 1, 8192, 8192, 8192, 8192, 4096]
    - [2, 186.57]
  - - [8192, 8192, 1, 128, 8192, 8192, 128, 8192]
    - [9, 38.96]
  - - [8192, 8192, 1, 256, 8192, 8192, 256, 8192]
    - [10, 61.26]
  - - [8192, 8192, 1, 512, 8192, 8192, 512, 8192]
    - [27, 94.89]
  - - [8192, 8192, 1, 1024, 8192, 8192, 1024, 8192]
    - [5, 127.55]
  - - [8192, 8192, 1, 2048, 8192, 8192, 2048, 8192]
    - [31, 162.23]
  - - [8192, 8192, 1, 4096, 8192, 8192, 4096, 8192]
    - [31, 181.39]
  - - [8192, 8192, 1, 8192, 8192, 8192, 8192, 8192]
    - [7, 197.86]
- null
- null
- ExperimentalStreamK
- GridBased
