projects/hipblaslt/library/src/amd_detail/rocblaslt/src/Tensile/Logic/asm_full/aquavanjaram/gfx942_228cu/StreamK/aquavanjaram942_Cijk_Alik_Bljk_BBS_BH_Bias_HAS_SAV_UserArgs.yaml
- {MinimumRequiredVersion: 4.33.0}
- aquavanjaram942
- {Architecture: gfx942, CUCount: 228}
- [Device 0049, Device 0050]
    SolutionIndex: 0
    SolutionNameMin: Cijk_Alik_Bljk_BBS_BH_Bias_AS_SAV_UserArgs_MT256x256x32_MI16x16x1_SN_LDSB1_CLR1_GSU0_GSUC0_GSUWGMRR0_K1_LBSPPA512_LBSPPB512_MIWT8_8_PLR1_SU0_SUM0_SUS64_VWA8_VWB8_WGM1_WGMXCC1_WGMXCCGn1
    SolutionIndex: 1
    SolutionNameMin: Cijk_Alik_Bljk_BBS_BH_Bias_AS_SAV_UserArgs_MT256x256x32_MI16x16x1_SN_LDSB1_CLR1_GSU0_GSUC0_GSUWGMRR0_K1_LBSPPA512_LBSPPB512_MIWT8_8_PLR1_SU0_SUM0_SUS64_VWA8_VWB8_WGM1_WGMXCC1_WGMXCCGn1
    SolutionIndex: 2
    SolutionNameMin: Cijk_Alik_Bljk_BBS_BH_Bias_AS_SAV_UserArgs_MT256x256x32_MI16x16x1_SN_LDSB1_CLR1_GSU0_GSUC0_GSUWGMRR0_K1_LBSPPA512_LBSPPB512_MIWT8_8_PLR1_SU0_SUM0_SUS64_VWA8_VWB8_WGM4_WGMXCC1_WGMXCCGn1
    SolutionIndex: 3
    SolutionNameMin: Cijk_Alik_Bljk_BBS_BH_Bias_AS_SAV_UserArgs_MT256x256x32_MI16x16x1_SN_LDSB1_CLR1_GSU0_GSUC0_GSUWGMRR0_K1_LBSPPA512_LBSPPB512_MIWT8_8_PLR1_SU0_SUM0_SUS64_VWA8_VWB8_WGM4_WGMXCC1_WGMXCCGn1
    SolutionIndex: 4
    SolutionNameMin: Cijk_Alik_Bljk_BBS_BH_Bias_AS_SAV_UserArgs_MT256x256x32_MI16x16x1_SN_LDSB1_CLR1_GSU0_GSUC0_GSUWGMRR0_K1_LBSPPA512_LBSPPB512_MIWT8_8_PLR1_SU0_SUM0_SUS64_VWA8_VWB8_WGM6_WGMXCC1_WGMXCCGn1
    SolutionIndex: 5
    SolutionNameMin: Cijk_Alik_Bljk_BBS_BH_Bias_AS_SAV_UserArgs_MT256x256x32_MI16x16x1_SN_LDSB1_CLR1_GSU0_GSUC0_GSUWGMRR0_K1_LBSPPA512_LBSPPB512_MIWT8_8_PLR1_SU0_SUM0_SUS64_VWA8_VWB8_WGM8_WGMXCC1_WGMXCCGn1
    SolutionIndex: 6
    SolutionNameMin: Cijk_Alik_Bljk_BBS_BH_Bias_AS_SAV_UserArgs_MT256x256x32_MI16x16x1_SN_LDSB1_CLR1_GSU0_GSUC0_GSUWGMRR0_K1_LBSPPA512_LBSPPB512_MIWT8_8_PLR1_SU0_SUM0_SUS64_VWA8_VWB8_WGM8_WGMXCC1_WGMXCCGn1
    SolutionIndex: 7
    SolutionNameMin: Cijk_Alik_Bljk_BBS_BH_Bias_AS_SAV_UserArgs_MT128x256x32_MI16x16x1_SN_LDSB1_CLR1_GSU0_GSUC0_GSUWGMRR0_K1_LBSPPA256_LBSPPB512_MIWT4_8_PLR1_SU0_SUM0_SUS64_VWA4_VWB8_WGM1_WGMXCC1_WGMXCCGn1
    SolutionIndex: 8
    SolutionNameMin: Cijk_Alik_Bljk_BBS_BH_Bias_AS_SAV_UserArgs_MT128x256x32_MI16x16x1_SN_LDSB1_CLR1_GSU0_GSUC0_GSUWGMRR0_K1_LBSPPA256_LBSPPB512_MIWT4_8_PLR1_SU0_SUM0_SUS64_VWA4_VWB8_WGM6_WGMXCC1_WGMXCCGn1
    SolutionIndex: 9
    SolutionNameMin: Cijk_Alik_Bljk_BBS_BH_Bias_AS_SAV_UserArgs_MT256x128x32_MI16x16x1_SN_LDSB1_CLR1_GSU0_GSUC0_GSUWGMRR0_K1_LBSPPA512_LBSPPB256_MIWT8_4_PLR1_SU0_SUM0_SUS64_VWA8_VWB4_WGM1_WGMXCC1_WGMXCCGn1
    SolutionIndex: 10
    SolutionNameMin: Cijk_Alik_Bljk_BBS_BH_Bias_AS_SAV_UserArgs_MT256x128x32_MI16x16x1_SN_LDSB1_CLR1_GSU0_GSUC0_GSUWGMRR0_K1_LBSPPA512_LBSPPB256_MIWT8_4_PLR1_SU0_SUM0_SUS64_VWA8_VWB4_WGM4_WGMXCC1_WGMXCCGn1
    SolutionIndex: 11
    SolutionNameMin: Cijk_Alik_Bljk_BBS_BH_Bias_AS_SAV_UserArgs_MT256x128x32_MI16x16x1_SN_LDSB1_CLR1_GSU0_GSUC0_GSUWGMRR0_K1_LBSPPA512_LBSPPB256_MIWT8_4_PLR1_SU0_SUM0_SUS64_VWA8_VWB4_WGM6_WGMXCC1_WGMXCCGn1
    SolutionIndex: 12
    SolutionNameMin: Cijk_Alik_Bljk_BBS_BH_Bias_AS_SAV_UserArgs_MT256x128x32_MI16x16x1_SN_LDSB1_CLR1_GSU0_GSUC0_GSUWGMRR0_K1_LBSPPA512_LBSPPB256_MIWT8_4_PLR1_SU0_SUM0_SUS64_VWA8_VWB4_WGM8_WGMXCC1_WGMXCCGn1
    SolutionIndex: 13
    SolutionNameMin: Cijk_Alik_Bljk_BBS_BH_Bias_AS_SAV_UserArgs_MT128x64x32_MI16x16x1_SN_LDSB0_CLR1_GSU0_GSUC0_GSUWGMRR0_K1_LBSPPA256_LBSPPB128_MIWT4_2_PLR1_SU0_SUM0_SUS64_VWA4_VWB2_WGM1_WGMXCC1_WGMXCCGn1
    SolutionIndex: 14
    SolutionNameMin: Cijk_Alik_Bljk_BBS_BH_Bias_AS_SAV_UserArgs_MT32x64x32_MI16x16x1_SN_LDSB0_CLR1_GSU0_GSUC0_GSUWGMRR0_K1_LBSPPA128_LBSPPB128_MIWT1_2_PLR1_SU0_SUM0_SUS64_VWA1_VWB2_WGM1_WGMXCC1_WGMXCCGn1
    SolutionIndex: 15
    SolutionNameMin: Cijk_Alik_Bljk_BBS_BH_Bias_AS_SAV_UserArgs_MT32x32x32_MI16x16x1_SN_LDSB0_CLR1_GSU0_GSUC0_GSUWGMRR0_K1_LBSPPA128_LBSPPB128_MIWT1_1_PLR1_SU0_SUM0_SUS64_VWA1_VWB1_WGM6_WGMXCC1_WGMXCCGn1
    SolutionIndex: 16
    SolutionNameMin: Cijk_Alik_Bljk_BBS_BH_Bias_AS_SAV_UserArgs_MT128x256x64_MI16x16x1_SN_LDSB1_CLR1_GSU0_GSUC0_GSUWGMRR0_K1_LBSPPA512_LBSPPB1024_MIWT4_8_PLR1_SU0_SUM0_SUS128_VWA4_VWB8_WGM1_WGMXCC1_WGMXCCGn1
    SolutionIndex: 17
    SolutionNameMin: Cijk_Alik_Bljk_BBS_BH_Bias_AS_SAV_UserArgs_MT128x256x64_MI16x16x1_SN_LDSB1_CLR1_GSU0_GSUC0_GSUWGMRR0_K1_LBSPPA512_LBSPPB1024_MIWT4_8_PLR1_SU0_SUM0_SUS128_VWA4_VWB8_WGM1_WGMXCC1_WGMXCCGn1
    SolutionIndex: 18
    SolutionNameMin: Cijk_Alik_Bljk_BBS_BH_Bias_AS_SAV_UserArgs_MT128x256x64_MI16x16x1_SN_LDSB1_CLR1_GSU0_GSUC0_GSUWGMRR0_K1_LBSPPA512_LBSPPB1024_MIWT4_8_PLR1_SU0_SUM0_SUS128_VWA4_VWB8_WGM1_WGMXCC1_WGMXCCGn1
    SolutionIndex: 19
    SolutionNameMin: Cijk_Alik_Bljk_BBS_BH_Bias_AS_SAV_UserArgs_MT128x256x64_MI16x16x1_SN_LDSB1_CLR1_GSU0_GSUC0_GSUWGMRR0_K1_LBSPPA512_LBSPPB1024_MIWT4_8_PLR1_SU0_SUM0_SUS128_VWA4_VWB8_WGM1_WGMXCC1_WGMXCCGn1
    SolutionIndex: 20
    SolutionNameMin: Cijk_Alik_Bljk_BBS_BH_Bias_AS_SAV_UserArgs_MT128x256x64_MI16x16x1_SN_LDSB1_CLR1_GSU0_GSUC0_GSUWGMRR0_K1_LBSPPA512_LBSPPB1024_MIWT4_8_PLR1_SU0_SUM0_SUS128_VWA4_VWB8_WGM4_WGMXCC1_WGMXCCGn1
    SolutionIndex: 21
    SolutionNameMin: Cijk_Alik_Bljk_BBS_BH_Bias_AS_SAV_UserArgs_MT128x256x64_MI16x16x1_SN_LDSB1_CLR1_GSU0_GSUC0_GSUWGMRR0_K1_LBSPPA512_LBSPPB1024_MIWT4_8_PLR1_SU0_SUM0_SUS128_VWA4_VWB8_WGM6_WGMXCC1_WGMXCCGn1
    SolutionIndex: 22
    SolutionNameMin: Cijk_Alik_Bljk_BBS_BH_Bias_AS_SAV_UserArgs_MT128x256x64_MI16x16x1_SN_LDSB1_CLR1_GSU0_GSUC0_GSUWGMRR0_K1_LBSPPA512_LBSPPB1024_MIWT4_8_PLR1_SU0_SUM0_SUS128_VWA4_VWB8_WGM6_WGMXCC1_WGMXCCGn1
    SolutionIndex: 23
    SolutionNameMin: Cijk_Alik_Bljk_BBS_BH_Bias_AS_SAV_UserArgs_MT128x256x64_MI16x16x1_SN_LDSB1_CLR1_GSU0_GSUC0_GSUWGMRR0_K1_LBSPPA512_LBSPPB1024_MIWT4_8_PLR1_SU0_SUM0_SUS128_VWA4_VWB8_WGM8_WGMXCC1_WGMXCCGn1
    SolutionIndex: 24
    SolutionNameMin: Cijk_Alik_Bljk_BBS_BH_Bias_AS_SAV_UserArgs_MT256x128x64_MI16x16x1_SN_LDSB1_CLR1_GSU0_GSUC0_GSUWGMRR0_K1_LBSPPA1024_LBSPPB512_MIWT8_4_PLR1_SU0_SUM0_SUS128_VWA8_VWB4_WGM1_WGMXCC1_WGMXCCGn1
    SolutionIndex: 25
    SolutionNameMin: Cijk_Alik_Bljk_BBS_BH_Bias_AS_SAV_UserArgs_MT256x128x64_MI16x16x1_SN_LDSB1_CLR1_GSU0_GSUC0_GSUWGMRR0_K1_LBSPPA1024_LBSPPB512_MIWT8_4_PLR1_SU0_SUM0_SUS128_VWA8_VWB4_WGM1_WGMXCC1_WGMXCCGn1
    SolutionIndex: 26
    SolutionNameMin: Cijk_Alik_Bljk_BBS_BH_Bias_AS_SAV_UserArgs_MT256x128x64_MI16x16x1_SN_LDSB1_CLR1_GSU0_GSUC0_GSUWGMRR0_K1_LBSPPA1024_LBSPPB512_MIWT8_4_PLR1_SU0_SUM0_SUS128_VWA8_VWB4_WGM4_WGMXCC1_WGMXCCGn1
    SolutionIndex: 27
    SolutionNameMin: Cijk_Alik_Bljk_BBS_BH_Bias_AS_SAV_UserArgs_MT256x128x64_MI16x16x1_SN_LDSB1_CLR1_GSU0_GSUC0_GSUWGMRR0_K1_LBSPPA1024_LBSPPB512_MIWT8_4_PLR1_SU0_SUM0_SUS128_VWA8_VWB4_WGM4_WGMXCC1_WGMXCCGn1
    SolutionIndex: 28
    SolutionNameMin: Cijk_Alik_Bljk_BBS_BH_Bias_AS_SAV_UserArgs_MT256x128x64_MI16x16x1_SN_LDSB1_CLR1_GSU0_GSUC0_GSUWGMRR0_K1_LBSPPA1024_LBSPPB512_MIWT8_4_PLR1_SU0_SUM0_SUS128_VWA8_VWB4_WGM6_WGMXCC1_WGMXCCGn1
    SolutionIndex: 29
    SolutionNameMin: Cijk_Alik_Bljk_BBS_BH_Bias_AS_SAV_UserArgs_MT256x128x64_MI16x16x1_SN_LDSB1_CLR1_GSU0_GSUC0_GSUWGMRR0_K1_LBSPPA1024_LBSPPB512_MIWT8_4_PLR1_SU0_SUM0_SUS128_VWA8_VWB4_WGM6_WGMXCC1_WGMXCCGn1
    SolutionIndex: 30
    SolutionNameMin: Cijk_Alik_Bljk_BBS_BH_Bias_AS_SAV_UserArgs_MT256x128x64_MI16x16x1_SN_LDSB1_CLR1_GSU0_GSUC0_GSUWGMRR0_K1_LBSPPA1024_LBSPPB512_MIWT8_4_PLR1_SU0_SUM0_SUS128_VWA8_VWB4_WGM8_WGMXCC1_WGMXCCGn1
    SolutionIndex: 31
    SolutionNameMin: Cijk_Alik_Bljk_BBS_BH_Bias_AS_SAV_UserArgs_MT256x128x64_MI16x16x1_SN_LDSB1_CLR1_GSU0_GSUC0_GSUWGMRR0_K1_LBSPPA1024_LBSPPB512_MIWT8_4_PLR1_SU0_SUM0_SUS128_VWA8_VWB4_WGM8_WGMXCC1_WGMXCCGn1
    SolutionIndex: 32
    SolutionNameMin: Cijk_Alik_Bljk_BBS_BH_Bias_AS_SAV_UserArgs_MT256x128x64_MI16x16x1_SN_LDSB1_CLR1_GSU0_GSUC0_GSUWGMRR0_K1_LBSPPA1024_LBSPPB512_MIWT8_4_PLR1_SU0_SUM0_SUS128_VWA8_VWB4_WGM8_WGMXCC1_WGMXCCGn1
    SolutionIndex: 33
    SolutionNameMin: Cijk_Alik_Bljk_BBS_BH_Bias_AS_SAV_UserArgs_MT128x128x64_MI16x16x1_SN_LDSB1_CLR1_GSU0_GSUC0_GSUWGMRR0_K1_LBSPPA512_LBSPPB512_MIWT4_4_PLR1_SU0_SUM0_SUS128_VWA4_VWB4_WGM1_WGMXCC1_WGMXCCGn1
    SolutionIndex: 34
    SolutionNameMin: Cijk_Alik_Bljk_BBS_BH_Bias_AS_SAV_UserArgs_MT128x128x64_MI16x16x1_SN_LDSB1_CLR1_GSU0_GSUC0_GSUWGMRR0_K1_LBSPPA512_LBSPPB512_MIWT4_4_PLR1_SU0_SUM0_SUS128_VWA4_VWB4_WGM1_WGMXCC1_WGMXCCGn1
    SolutionIndex: 35
    SolutionNameMin: Cijk_Alik_Bljk_BBS_BH_Bias_AS_SAV_UserArgs_MT128x128x64_MI16x16x1_SN_LDSB1_CLR1_GSU0_GSUC0_GSUWGMRR0_K1_LBSPPA512_LBSPPB512_MIWT4_4_PLR1_SU0_SUM0_SUS128_VWA4_VWB4_WGM1_WGMXCC1_WGMXCCGn1
    SolutionIndex: 36
    SolutionNameMin: Cijk_Alik_Bljk_BBS_BH_Bias_AS_SAV_UserArgs_MT128x128x64_MI16x16x1_SN_LDSB1_CLR1_GSU0_GSUC0_GSUWGMRR0_K1_LBSPPA512_LBSPPB512_MIWT4_4_PLR1_SU0_SUM0_SUS128_VWA4_VWB4_WGM4_WGMXCC1_WGMXCCGn1
    SolutionIndex: 37
    SolutionNameMin: Cijk_Alik_Bljk_BBS_BH_Bias_AS_SAV_UserArgs_MT128x128x64_MI16x16x1_SN_LDSB1_CLR1_GSU0_GSUC0_GSUWGMRR0_K1_LBSPPA512_LBSPPB512_MIWT4_4_PLR1_SU0_SUM0_SUS128_VWA4_VWB4_WGM4_WGMXCC1_WGMXCCGn1
    SolutionIndex: 38
    SolutionNameMin: Cijk_Alik_Bljk_BBS_BH_Bias_AS_SAV_UserArgs_MT128x128x64_MI16x16x1_SN_LDSB1_CLR1_GSU0_GSUC0_GSUWGMRR0_K1_LBSPPA512_LBSPPB512_MIWT4_4_PLR1_SU0_SUM0_SUS128_VWA4_VWB4_WGM6_WGMXCC1_WGMXCCGn1
    SolutionIndex: 39
    SolutionNameMin: Cijk_Alik_Bljk_BBS_BH_Bias_AS_SAV_UserArgs_MT128x128x64_MI16x16x1_SN_LDSB1_CLR1_GSU0_GSUC0_GSUWGMRR0_K1_LBSPPA512_LBSPPB512_MIWT4_4_PLR1_SU0_SUM0_SUS128_VWA4_VWB4_WGM6_WGMXCC1_WGMXCCGn1
    SolutionIndex: 40
    SolutionNameMin: Cijk_Alik_Bljk_BBS_BH_Bias_AS_SAV_UserArgs_MT128x128x64_MI16x16x1_SN_LDSB1_CLR1_GSU0_GSUC0_GSUWGMRR0_K1_LBSPPA512_LBSPPB512_MIWT4_4_PLR1_SU0_SUM0_SUS128_VWA4_VWB4_WGM8_WGMXCC1_WGMXCCGn1
    SolutionIndex: 41
    SolutionNameMin: Cijk_Alik_Bljk_BBS_BH_Bias_AS_SAV_UserArgs_MT64x128x64_MI16x16x1_SN_LDSB1_CLR1_GSU0_GSUC0_GSUWGMRR0_K1_LBSPPA256_LBSPPB512_MIWT2_4_PLR1_SU0_SUM0_SUS128_VWA2_VWB4_WGM1_WGMXCC1_WGMXCCGn1
    SolutionIndex: 42
    SolutionNameMin: Cijk_Alik_Bljk_BBS_BH_Bias_AS_SAV_UserArgs_MT64x128x64_MI16x16x1_SN_LDSB1_CLR1_GSU0_GSUC0_GSUWGMRR0_K1_LBSPPA256_LBSPPB512_MIWT2_4_PLR1_SU0_SUM0_SUS128_VWA2_VWB4_WGM1_WGMXCC1_WGMXCCGn1
    SolutionIndex: 43
    SolutionNameMin: Cijk_Alik_Bljk_BBS_BH_Bias_AS_SAV_UserArgs_MT64x128x64_MI16x16x1_SN_LDSB1_CLR1_GSU0_GSUC0_GSUWGMRR0_K1_LBSPPA256_LBSPPB512_MIWT2_4_PLR1_SU0_SUM0_SUS128_VWA2_VWB4_WGM6_WGMXCC1_WGMXCCGn1
    SolutionIndex: 44
    SolutionNameMin: Cijk_Alik_Bljk_BBS_BH_Bias_AS_SAV_UserArgs_MT64x128x64_MI16x16x1_SN_LDSB1_CLR1_GSU0_GSUC0_GSUWGMRR0_K1_LBSPPA256_LBSPPB512_MIWT2_4_PLR1_SU0_SUM0_SUS128_VWA2_VWB4_WGM6_WGMXCC1_WGMXCCGn1
    SolutionIndex: 45
    SolutionNameMin: Cijk_Alik_Bljk_BBS_BH_Bias_AS_SAV_UserArgs_MT128x64x64_MI16x16x1_SN_LDSB1_CLR1_GSU0_GSUC0_GSUWGMRR0_K1_LBSPPA512_LBSPPB256_MIWT4_2_PLR1_SU0_SUM0_SUS128_VWA4_VWB2_WGM1_WGMXCC1_WGMXCCGn1
    SolutionIndex: 46
    SolutionNameMin: Cijk_Alik_Bljk_BBS_BH_Bias_AS_SAV_UserArgs_MT128x64x64_MI16x16x1_SN_LDSB1_CLR1_GSU0_GSUC0_GSUWGMRR0_K1_LBSPPA512_LBSPPB256_MIWT4_2_PLR1_SU0_SUM0_SUS128_VWA4_VWB2_WGM1_WGMXCC1_WGMXCCGn1
    SolutionIndex: 47
    SolutionNameMin: Cijk_Alik_Bljk_BBS_BH_Bias_AS_SAV_UserArgs_MT128x64x64_MI16x16x1_SN_LDSB1_CLR1_GSU0_GSUC0_GSUWGMRR0_K1_LBSPPA512_LBSPPB256_MIWT4_2_PLR1_SU0_SUM0_SUS128_VWA4_VWB2_WGM8_WGMXCC1_WGMXCCGn1
    SolutionIndex: 48
    SolutionNameMin: Cijk_Alik_Bljk_BBS_BH_Bias_AS_SAV_UserArgs_MT128x32x64_MI16x16x1_SN_LDSB1_CLR1_GSU0_GSUC0_GSUWGMRR0_K1_LBSPPA512_LBSPPB128_MIWT4_1_PLR1_SU0_SUM0_SUS128_VWA4_VWB1_WGM4_WGMXCC1_WGMXCCGn1
    SolutionIndex: 49
    SolutionNameMin: Cijk_Alik_Bljk_BBS_BH_Bias_AS_SAV_UserArgs_MT64x64x64_MI16x16x1_SN_LDSB1_CLR1_GSU0_GSUC0_GSUWGMRR0_K1_LBSPPA256_LBSPPB256_MIWT2_2_PLR1_SU0_SUM0_SUS128_VWA2_VWB2_WGM1_WGMXCC1_WGMXCCGn1
    SolutionIndex: 50
    SolutionNameMin: Cijk_Alik_Bljk_BBS_BH_Bias_AS_SAV_UserArgs_MT64x64x64_MI16x16x1_SN_LDSB1_CLR1_GSU0_GSUC0_GSUWGMRR0_K1_LBSPPA256_LBSPPB256_MIWT2_2_PLR1_SU0_SUM0_SUS128_VWA2_VWB2_WGM4_WGMXCC1_WGMXCCGn1
    SolutionIndex: 51
    SolutionNameMin: Cijk_Alik_Bljk_BBS_BH_Bias_AS_SAV_UserArgs_MT32x64x64_MI16x16x1_SN_LDSB0_CLR1_GSU0_GSUC0_GSUWGMRR0_K1_LBSPPA128_LBSPPB256_MIWT1_2_PLR1_SU0_SUM0_SUS128_VWA1_VWB2_WGM1_WGMXCC1_WGMXCCGn1
    SolutionIndex: 52
    SolutionNameMin: Cijk_Alik_Bljk_BBS_BH_Bias_AS_SAV_UserArgs_MT64x32x64_MI16x16x1_SN_LDSB0_CLR1_GSU0_GSUC0_GSUWGMRR0_K1_LBSPPA256_LBSPPB128_MIWT2_1_PLR1_SU0_SUM0_SUS128_VWA2_VWB1_WGM1_WGMXCC1_WGMXCCGn1
    SolutionIndex: 53
    SolutionNameMin: Cijk_Alik_Bljk_BBS_BH_Bias_AS_SAV_UserArgs_MT32x32x64_MI16x16x1_SN_LDSB0_CLR1_GSU0_GSUC0_GSUWGMRR0_K1_LBSPPA128_LBSPPB128_MIWT1_1_PLR1_SU0_SUM0_SUS128_VWA1_VWB1_WGM1_WGMXCC1_WGMXCCGn1
    SolutionIndex: 54
    SolutionNameMin: Cijk_Alik_Bljk_BBS_BH_Bias_AS_SAV_UserArgs_MT32x32x64_MI16x16x1_SN_LDSB0_CLR1_GSU0_GSUC0_GSUWGMRR0_K1_LBSPPA128_LBSPPB128_MIWT1_1_PLR1_SU0_SUM0_SUS128_VWA1_VWB1_WGM1_WGMXCC1_WGMXCCGn1
    SolutionIndex: 55
    SolutionNameMin: Cijk_Alik_Bljk_BBS_BH_Bias_AS_SAV_UserArgs_MT32x32x64_MI16x16x1_SN_LDSB0_CLR1_GSU0_GSUC0_GSUWGMRR0_K1_LBSPPA128_LBSPPB128_MIWT1_1_PLR1_SU0_SUM0_SUS128_VWA1_VWB1_WGM1_WGMXCC1_WGMXCCGn1
    SolutionIndex: 56
    SolutionNameMin: Cijk_Alik_Bljk_BBS_BH_Bias_AS_SAV_UserArgs_MT64x128x128_MI16x16x1_SN_LDSB1_CLR1_GSU0_GSUC0_GSUWGMRR0_K1_LBSPPA512_LBSPPB1024_MIWT2_4_PLR1_SU0_SUM0_SUS256_VWA2_VWB4_WGM1_WGMXCC1_WGMXCCGn1
    SolutionIndex: 57
    SolutionNameMin: Cijk_Alik_Bljk_BBS_BH_Bias_AS_SAV_UserArgs_MT64x128x128_MI16x16x1_SN_LDSB1_CLR1_GSU0_GSUC0_GSUWGMRR0_K1_LBSPPA512_LBSPPB1024_MIWT2_4_PLR1_SU0_SUM0_SUS256_VWA2_VWB4_WGM1_WGMXCC1_WGMXCCGn1
    SolutionIndex: 58
    SolutionNameMin: Cijk_Alik_Bljk_BBS_BH_Bias_AS_SAV_UserArgs_MT64x128x128_MI16x16x1_SN_LDSB1_CLR1_GSU0_GSUC0_GSUWGMRR0_K1_LBSPPA512_LBSPPB1024_MIWT2_4_PLR1_SU0_SUM0_SUS256_VWA2_VWB4_WGM4_WGMXCC1_WGMXCCGn1
    SolutionIndex: 59
    SolutionNameMin: Cijk_Alik_Bljk_BBS_BH_Bias_AS_SAV_UserArgs_MT64x128x128_MI16x16x1_SN_LDSB1_CLR1_GSU0_GSUC0_GSUWGMRR0_K1_LBSPPA512_LBSPPB1024_MIWT2_4_PLR1_SU0_SUM0_SUS256_VWA2_VWB4_WGM4_WGMXCC1_WGMXCCGn1
    SolutionIndex: 60
    SolutionNameMin: Cijk_Alik_Bljk_BBS_BH_Bias_AS_SAV_UserArgs_MT64x128x128_MI16x16x1_SN_LDSB1_CLR1_GSU0_GSUC0_GSUWGMRR0_K1_LBSPPA512_LBSPPB1024_MIWT2_4_PLR1_SU0_SUM0_SUS256_VWA2_VWB4_WGM6_WGMXCC1_WGMXCCGn1
    SolutionIndex: 61
    SolutionNameMin: Cijk_Alik_Bljk_BBS_BH_Bias_AS_SAV_UserArgs_MT128x64x128_MI16x16x1_SN_LDSB1_CLR1_GSU0_GSUC0_GSUWGMRR0_K1_LBSPPA1024_LBSPPB512_MIWT4_2_PLR1_SU0_SUM0_SUS256_VWA4_VWB2_WGM1_WGMXCC1_WGMXCCGn1
    SolutionIndex: 62
    SolutionNameMin: Cijk_Alik_Bljk_BBS_BH_Bias_AS_SAV_UserArgs_MT128x64x128_MI16x16x1_SN_LDSB1_CLR1_GSU0_GSUC0_GSUWGMRR0_K1_LBSPPA1024_LBSPPB512_MIWT4_2_PLR1_SU0_SUM0_SUS256_VWA4_VWB2_WGM4_WGMXCC1_WGMXCCGn1
    SolutionIndex: 63
    SolutionNameMin: Cijk_Alik_Bljk_BBS_BH_Bias_AS_SAV_UserArgs_MT128x64x128_MI16x16x1_SN_LDSB1_CLR1_GSU0_GSUC0_GSUWGMRR0_K1_LBSPPA1024_LBSPPB512_MIWT4_2_PLR1_SU0_SUM0_SUS256_VWA4_VWB2_WGM6_WGMXCC1_WGMXCCGn1
    SolutionIndex: 64
    SolutionNameMin: Cijk_Alik_Bljk_BBS_BH_Bias_AS_SAV_UserArgs_MT128x64x128_MI16x16x1_SN_LDSB1_CLR1_GSU0_GSUC0_GSUWGMRR0_K1_LBSPPA1024_LBSPPB512_MIWT4_2_PLR1_SU0_SUM0_SUS256_VWA4_VWB2_WGM8_WGMXCC1_WGMXCCGn1
    SolutionIndex: 65
    SolutionNameMin: Cijk_Alik_Bljk_BBS_BH_Bias_AS_SAV_UserArgs_MT64x64x128_MI16x16x1_SN_LDSB1_CLR1_GSU0_GSUC0_GSUWGMRR0_K1_LBSPPA512_LBSPPB512_MIWT2_2_PLR1_SU0_SUM0_SUS256_VWA2_VWB2_WGM1_WGMXCC1_WGMXCCGn1
    SolutionIndex: 66
    SolutionNameMin: Cijk_Alik_Bljk_BBS_BH_Bias_AS_SAV_UserArgs_MT64x64x128_MI16x16x1_SN_LDSB1_CLR1_GSU0_GSUC0_GSUWGMRR0_K1_LBSPPA512_LBSPPB512_MIWT2_2_PLR1_SU0_SUM0_SUS256_VWA2_VWB2_WGM1_WGMXCC1_WGMXCCGn1
    SolutionIndex: 67
    SolutionNameMin: Cijk_Alik_Bljk_BBS_BH_Bias_AS_SAV_UserArgs_MT64x64x128_MI16x16x1_SN_LDSB1_CLR1_GSU0_GSUC0_GSUWGMRR0_K1_LBSPPA512_LBSPPB512_MIWT2_2_PLR1_SU0_SUM0_SUS256_VWA2_VWB2_WGM4_WGMXCC1_WGMXCCGn1
    SolutionIndex: 68
    SolutionNameMin: Cijk_Alik_Bljk_BBS_BH_Bias_AS_SAV_UserArgs_MT64x64x128_MI16x16x1_SN_LDSB1_CLR1_GSU0_GSUC0_GSUWGMRR0_K1_LBSPPA512_LBSPPB512_MIWT2_2_PLR1_SU0_SUM0_SUS256_VWA2_VWB2_WGM4_WGMXCC1_WGMXCCGn1
    SolutionIndex: 69
    SolutionNameMin: Cijk_Alik_Bljk_BBS_BH_Bias_AS_SAV_UserArgs_MT64x64x128_MI16x16x1_SN_LDSB1_CLR1_GSU0_GSUC0_GSUWGMRR0_K1_LBSPPA512_LBSPPB512_MIWT2_2_PLR1_SU0_SUM0_SUS256_VWA2_VWB2_WGM6_WGMXCC1_WGMXCCGn1
    SolutionIndex: 70
    SolutionNameMin: Cijk_Alik_Bljk_BBS_BH_Bias_AS_SAV_UserArgs_MT64x64x128_MI16x16x1_SN_LDSB1_CLR1_GSU0_GSUC0_GSUWGMRR0_K1_LBSPPA512_LBSPPB512_MIWT2_2_PLR1_SU0_SUM0_SUS256_VWA2_VWB2_WGM6_WGMXCC1_WGMXCCGn1
    SolutionIndex: 71
    SolutionNameMin: Cijk_Alik_Bljk_BBS_BH_Bias_AS_SAV_UserArgs_MT64x64x128_MI16x16x1_SN_LDSB1_CLR1_GSU0_GSUC0_GSUWGMRR0_K1_LBSPPA512_LBSPPB512_MIWT2_2_PLR1_SU0_SUM0_SUS256_VWA2_VWB2_WGM6_WGMXCC1_WGMXCCGn1
    SolutionIndex: 72
    SolutionNameMin: Cijk_Alik_Bljk_BBS_BH_Bias_AS_SAV_UserArgs_MT64x64x128_MI16x16x1_SN_LDSB1_CLR1_GSU0_GSUC0_GSUWGMRR0_K1_LBSPPA512_LBSPPB512_MIWT2_2_PLR1_SU0_SUM0_SUS256_VWA2_VWB2_WGM8_WGMXCC1_WGMXCCGn1
    SolutionIndex: 73
    SolutionNameMin: Cijk_Alik_Bljk_BBS_BH_Bias_AS_SAV_UserArgs_MT32x64x128_MI16x16x1_SN_LDSB1_CLR1_GSU0_GSUC0_GSUWGMRR0_K1_LBSPPA256_LBSPPB512_MIWT1_2_PLR1_SU0_SUM0_SUS256_VWA1_VWB2_WGM1_WGMXCC1_WGMXCCGn1
    SolutionIndex: 74
    SolutionNameMin: Cijk_Alik_Bljk_BBS_BH_Bias_AS_SAV_UserArgs_MT32x64x128_MI16x16x1_SN_LDSB1_CLR1_GSU0_GSUC0_GSUWGMRR0_K1_LBSPPA256_LBSPPB512_MIWT1_2_PLR1_SU0_SUM0_SUS256_VWA1_VWB2_WGM1_WGMXCC1_WGMXCCGn1
    SolutionIndex: 75
    SolutionNameMin: Cijk_Alik_Bljk_BBS_BH_Bias_AS_SAV_UserArgs_MT32x64x128_MI16x16x1_SN_LDSB1_CLR1_GSU0_GSUC0_GSUWGMRR0_K1_LBSPPA256_LBSPPB512_MIWT1_2_PLR1_SU0_SUM0_SUS256_VWA1_VWB2_WGM1_WGMXCC1_WGMXCCGn1
    SolutionIndex: 76
    SolutionNameMin: Cijk_Alik_Bljk_BBS_BH_Bias_AS_SAV_UserArgs_MT32x64x128_MI16x16x1_SN_LDSB1_CLR1_GSU0_GSUC0_GSUWGMRR0_K1_LBSPPA256_LBSPPB512_MIWT1_2_PLR1_SU0_SUM0_SUS256_VWA1_VWB2_WGM4_WGMXCC1_WGMXCCGn1
    SolutionIndex: 77
    SolutionNameMin: Cijk_Alik_Bljk_BBS_BH_Bias_AS_SAV_UserArgs_MT32x64x128_MI16x16x1_SN_LDSB1_CLR1_GSU0_GSUC0_GSUWGMRR0_K1_LBSPPA256_LBSPPB512_MIWT1_2_PLR1_SU0_SUM0_SUS256_VWA1_VWB2_WGM4_WGMXCC1_WGMXCCGn1
    SolutionIndex: 78
    SolutionNameMin: Cijk_Alik_Bljk_BBS_BH_Bias_AS_SAV_UserArgs_MT32x64x128_MI16x16x1_SN_LDSB1_CLR1_GSU0_GSUC0_GSUWGMRR0_K1_LBSPPA256_LBSPPB512_MIWT1_2_PLR1_SU0_SUM0_SUS256_VWA1_VWB2_WGM6_WGMXCC1_WGMXCCGn1
    SolutionIndex: 79
    SolutionNameMin: Cijk_Alik_Bljk_BBS_BH_Bias_AS_SAV_UserArgs_MT32x64x128_MI16x16x1_SN_LDSB1_CLR1_GSU0_GSUC0_GSUWGMRR0_K1_LBSPPA256_LBSPPB512_MIWT1_2_PLR1_SU0_SUM0_SUS256_VWA1_VWB2_WGM6_WGMXCC1_WGMXCCGn1
    SolutionIndex: 80
    SolutionNameMin: Cijk_Alik_Bljk_BBS_BH_Bias_AS_SAV_UserArgs_MT32x64x128_MI16x16x1_SN_LDSB1_CLR1_GSU0_GSUC0_GSUWGMRR0_K1_LBSPPA256_LBSPPB512_MIWT1_2_PLR1_SU0_SUM0_SUS256_VWA1_VWB2_WGM8_WGMXCC1_WGMXCCGn1
    SolutionIndex: 81
    SolutionNameMin: Cijk_Alik_Bljk_BBS_BH_Bias_AS_SAV_UserArgs_MT32x64x128_MI16x16x1_SN_LDSB1_CLR1_GSU0_GSUC0_GSUWGMRR0_K1_LBSPPA256_LBSPPB512_MIWT1_2_PLR1_SU0_SUM0_SUS256_VWA1_VWB2_WGM8_WGMXCC1_WGMXCCGn1
    SolutionIndex: 82
    SolutionNameMin: Cijk_Alik_Bljk_BBS_BH_Bias_AS_SAV_UserArgs_MT64x32x128_MI16x16x1_SN_LDSB1_CLR1_GSU0_GSUC0_GSUWGMRR0_K1_LBSPPA512_LBSPPB256_MIWT2_1_PLR1_SU0_SUM0_SUS256_VWA2_VWB1_WGM1_WGMXCC1_WGMXCCGn1
    SolutionIndex: 83
    SolutionNameMin: Cijk_Alik_Bljk_BBS_BH_Bias_AS_SAV_UserArgs_MT64x32x128_MI16x16x1_SN_LDSB1_CLR1_GSU0_GSUC0_GSUWGMRR0_K1_LBSPPA512_LBSPPB256_MIWT2_1_PLR1_SU0_SUM0_SUS256_VWA2_VWB1_WGM1_WGMXCC1_WGMXCCGn1
    SolutionIndex: 84
    SolutionNameMin: Cijk_Alik_Bljk_BBS_BH_Bias_AS_SAV_UserArgs_MT64x32x128_MI16x16x1_SN_LDSB1_CLR1_GSU0_GSUC0_GSUWGMRR0_K1_LBSPPA512_LBSPPB256_MIWT2_1_PLR1_SU0_SUM0_SUS256_VWA2_VWB1_WGM1_WGMXCC1_WGMXCCGn1
    SolutionIndex: 85
    SolutionNameMin: Cijk_Alik_Bljk_BBS_BH_Bias_AS_SAV_UserArgs_MT64x32x128_MI16x16x1_SN_LDSB1_CLR1_GSU0_GSUC0_GSUWGMRR0_K1_LBSPPA512_LBSPPB256_MIWT2_1_PLR1_SU0_SUM0_SUS256_VWA2_VWB1_WGM1_WGMXCC1_WGMXCCGn1
    SolutionIndex: 86
    SolutionNameMin: Cijk_Alik_Bljk_BBS_BH_Bias_AS_SAV_UserArgs_MT32x32x128_MI16x16x1_SN_LDSB1_CLR1_GSU0_GSUC0_GSUWGMRR0_K1_LBSPPA256_LBSPPB256_MIWT1_1_PLR1_SU0_SUM0_SUS256_VWA1_VWB1_WGM1_WGMXCC1_WGMXCCGn1
    SolutionIndex: 87
    SolutionNameMin: Cijk_Alik_Bljk_BBS_BH_Bias_AS_SAV_UserArgs_MT32x32x128_MI16x16x1_SN_LDSB1_CLR1_GSU0_GSUC0_GSUWGMRR0_K1_LBSPPA256_LBSPPB256_MIWT1_1_PLR1_SU0_SUM0_SUS256_VWA1_VWB1_WGM1_WGMXCC1_WGMXCCGn1
    SolutionIndex: 88
    SolutionNameMin: Cijk_Alik_Bljk_BBS_BH_Bias_AS_SAV_UserArgs_MT32x32x128_MI16x16x1_SN_LDSB1_CLR1_GSU0_GSUC0_GSUWGMRR0_K1_LBSPPA256_LBSPPB256_MIWT1_1_PLR1_SU0_SUM0_SUS256_VWA1_VWB1_WGM1_WGMXCC1_WGMXCCGn1
    SolutionIndex: 89
    SolutionNameMin: Cijk_Alik_Bljk_BBS_BH_Bias_AS_SAV_UserArgs_MT32x32x128_MI16x16x1_SN_LDSB1_CLR1_GSU0_GSUC0_GSUWGMRR0_K1_LBSPPA256_LBSPPB256_MIWT1_1_PLR1_SU0_SUM0_SUS256_VWA1_VWB1_WGM1_WGMXCC1_WGMXCCGn1
    SolutionIndex: 90
    SolutionNameMin: Cijk_Alik_Bljk_BBS_BH_Bias_AS_SAV_UserArgs_MT32x32x128_MI16x16x1_SN_LDSB1_CLR1_GSU0_GSUC0_GSUWGMRR0_K1_LBSPPA256_LBSPPB256_MIWT1_1_PLR1_SU0_SUM0_SUS256_VWA1_VWB1_WGM1_WGMXCC1_WGMXCCGn1
    SolutionIndex: 91
    SolutionNameMin: Cijk_Alik_Bljk_BBS_BH_Bias_AS_SAV_UserArgs_MT32x32x128_MI16x16x1_SN_LDSB1_CLR1_GSU0_GSUC0_GSUWGMRR0_K1_LBSPPA256_LBSPPB256_MIWT1_1_PLR1_SU0_SUM0_SUS256_VWA1_VWB1_WGM4_WGMXCC1_WGMXCCGn1
    SolutionIndex: 92
    SolutionNameMin: Cijk_Alik_Bljk_BBS_BH_Bias_AS_SAV_UserArgs_MT32x32x128_MI16x16x1_SN_LDSB1_CLR1_GSU0_GSUC0_GSUWGMRR0_K1_LBSPPA256_LBSPPB256_MIWT1_1_PLR1_SU0_SUM0_SUS256_VWA1_VWB1_WGM4_WGMXCC1_WGMXCCGn1
    SolutionIndex: 93
    SolutionNameMin: Cijk_Alik_Bljk_BBS_BH_Bias_AS_SAV_UserArgs_MT32x32x128_MI16x16x1_SN_LDSB1_CLR1_GSU0_GSUC0_GSUWGMRR0_K1_LBSPPA256_LBSPPB256_MIWT1_1_PLR1_SU0_SUM0_SUS256_VWA1_VWB1_WGM4_WGMXCC1_WGMXCCGn1
    SolutionIndex: 94
    SolutionNameMin: Cijk_Alik_Bljk_BBS_BH_Bias_AS_SAV_UserArgs_MT32x32x128_MI16x16x1_SN_LDSB1_CLR1_GSU0_GSUC0_GSUWGMRR0_K1_LBSPPA256_LBSPPB256_MIWT1_1_PLR1_SU0_SUM0_SUS256_VWA1_VWB1_WGM4_WGMXCC1_WGMXCCGn1
    SolutionIndex: 95
    SolutionNameMin: Cijk_Alik_Bljk_BBS_BH_Bias_AS_SAV_UserArgs_MT32x32x128_MI16x16x1_SN_LDSB1_CLR1_GSU0_GSUC0_GSUWGMRR0_K1_LBSPPA256_LBSPPB256_MIWT1_1_PLR1_SU0_SUM0_SUS256_VWA1_VWB1_WGM6_WGMXCC1_WGMXCCGn1
    SolutionIndex: 96
    SolutionNameMin: Cijk_Alik_Bljk_BBS_BH_Bias_AS_SAV_UserArgs_MT32x32x128_MI16x16x1_SN_LDSB1_CLR1_GSU0_GSUC0_GSUWGMRR0_K1_LBSPPA256_LBSPPB256_MIWT1_1_PLR1_SU0_SUM0_SUS256_VWA1_VWB1_WGM6_WGMXCC1_WGMXCCGn1
    SolutionIndex: 97
    SolutionNameMin: Cijk_Alik_Bljk_BBS_BH_Bias_AS_SAV_UserArgs_MT32x32x128_MI16x16x1_SN_LDSB1_CLR1_GSU0_GSUC0_GSUWGMRR0_K1_LBSPPA256_LBSPPB256_MIWT1_1_PLR1_SU0_SUM0_SUS256_VWA1_VWB1_WGM8_WGMXCC1_WGMXCCGn1
    SolutionIndex: 98
    SolutionNameMin: Cijk_Alik_Bljk_BBS_BH_Bias_AS_SAV_UserArgs_MT32x32x128_MI16x16x1_SN_LDSB1_CLR1_GSU0_GSUC0_GSUWGMRR0_K1_LBSPPA256_LBSPPB256_MIWT1_1_PLR1_SU0_SUM0_SUS256_VWA1_VWB1_WGM8_WGMXCC1_WGMXCCGn1
    SolutionIndex: 99
    SolutionNameMin: Cijk_Alik_Bljk_BBS_BH_Bias_AS_SAV_UserArgs_MT32x32x128_MI16x16x1_SN_LDSB1_CLR1_GSU0_GSUC0_GSUWGMRR0_K1_LBSPPA256_LBSPPB256_MIWT1_1_PLR1_SU0_SUM0_SUS256_VWA1_VWB1_WGM8_WGMXCC1_WGMXCCGn1
    SolutionIndex: 100
    SolutionNameMin: Cijk_Alik_Bljk_BBS_BH_Bias_AS_SAV_UserArgs_MT32x32x32_MI16x16x1_SN_LDSB0_CLR0_GSU0_GSUC0_GSUWGMRR0_K1_LBSPPA128_LBSPPB128_MIWT1_1_PLR0_SU0_SUM0_SUS64_VWA1_VWB1_WGM6_WGMXCC1_WGMXCCGn1
- - - [128, 128, 1, 128, 128, 128, 128, 128]
    - [84, 0.29]
  - - [128, 128, 1, 256, 128, 128, 256, 256]
    - [15, 0.74]
  - - [128, 128, 1, 512, 128, 128, 512, 512]
    - [54, 1.3]
  - - [128, 128, 1, 1024, 128, 128, 1024, 1024]
    - [98, 2.12]
  - - [128, 128, 1, 2048, 128, 128, 2048, 2048]
    - [87, 3.05]
  - - [128, 128, 1, 4096, 128, 128, 4096, 4096]
    - [87, 3.89]
  - - [128, 128, 1, 8192, 128, 128, 8192, 8192]
    - [87, 4.52]
  - - [128, 256, 1, 128, 128, 128, 128, 128]
    - [48, 0.73]
  - - [128, 256, 1, 256, 128, 128, 256, 256]
    - [51, 1.46]
  - - [128, 256, 1, 512, 128, 128, 512, 512]
    - [53, 2.45]
  - - [128, 256, 1, 1024, 128, 128, 1024, 1024]
    - [90, 4.5]
  - - [128, 256, 1, 2048, 128, 128, 2048, 2048]
    - [87, 6.09]
  - - [128, 256, 1, 4096, 128, 128, 4096, 4096]
    - [91, 7.58]
  - - [128, 256, 1, 8192, 128, 128, 8192, 8192]
    - [95, 9.01]
  - - [128, 512, 1, 128, 128, 128, 128, 128]
    - [14, 1.74]
  - - [128, 512, 1, 256, 128, 128, 256, 256]
    - [54, 3.26]
  - - [128, 512, 1, 512, 128, 128, 512, 512]
    - [86, 5.63]
  - - [128, 512, 1, 1024, 128, 128, 1024, 1024]
    - [90, 8.86]
  - - [128, 512, 1, 2048, 128, 128, 2048, 2048]
    - [87, 12.07]
  - - [128, 512, 1, 4096, 128, 128, 4096, 4096]
    - [87, 15.23]
  - - [128, 512, 1, 8192, 128, 128, 8192, 8192]
    - [96, 17.68]
  - - [128, 1024, 1, 128, 128, 128, 128, 128]
    - [90, 3.98]
  - - [128, 1024, 1, 256, 128, 128, 256, 256]
    - [90, 6.77]
  - - [128, 1024, 1, 512, 128, 128, 512, 512]
    - [90, 11.68]
  - - [128, 1024, 1, 1024, 128, 128, 1024, 1024]
    - [90, 17.58]
  - - [128, 1024, 1, 2048, 128, 128, 2048, 2048]
    - [90, 23.59]
  - - [128, 1024, 1, 4096, 128, 128, 4096, 4096]
    - [88, 29.36]
  - - [128, 1024, 1, 8192, 128, 128, 8192, 8192]
    - [90, 35.13]
  - - [128, 2048, 1, 128, 128, 128, 128, 128]
    - [84, 7.16]
  - - [128, 2048, 1, 256, 128, 128, 256, 256]
    - [85, 12.17]
  - - [128, 2048, 1, 512, 128, 128, 512, 512]
    - [85, 19.96]
  - - [128, 2048, 1, 1024, 128, 128, 1024, 1024]
    - [85, 29.16]
  - - [128, 2048, 1, 2048, 128, 128, 2048, 2048]
    - [75, 38.35]
  - - [128, 2048, 1, 4096, 128, 128, 4096, 4096]
    - [73, 48.07]
  - - [128, 2048, 1, 8192, 128, 128, 8192, 8192]
    - [82, 52.92]
  - - [128, 4096, 1, 128, 128, 128, 128, 128]
    - [66, 12.24]
  - - [128, 4096, 1, 256, 128, 128, 256, 256]
    - [66, 19.85]
  - - [128, 4096, 1, 512, 128, 128, 512, 512]
    - [66, 32.7]
  - - [128, 4096, 1, 1024, 128, 128, 1024, 1024]
    - [66, 47.17]
  - - [128, 4096, 1, 2048, 128, 128, 2048, 2048]
    - [66, 61.49]
  - - [128, 4096, 1, 4096, 128, 128, 4096, 4096]
    - [66, 67.62]
  - - [128, 4096, 1, 8192, 128, 128, 8192, 8192]
    - [65, 78.65]
  - - [128, 8192, 1, 128, 128, 128, 128, 128]
    - [61, 18.61]
  - - [128, 8192, 1, 256, 128, 128, 256, 256]
    - [61, 30.8]
  - - [128, 8192, 1, 512, 128, 128, 512, 512]
    - [61, 48.3]
  - - [128, 8192, 1, 1024, 128, 128, 1024, 1024]
    - [57, 65.72]
  - - [128, 8192, 1, 2048, 128, 128, 2048, 2048]
    - [57, 72.75]
  - - [128, 8192, 1, 4096, 128, 128, 4096, 4096]
    - [56, 84.46]
  - - [128, 8192, 1, 8192, 128, 128, 8192, 8192]
    - [57, 89.71]
  - - [256, 128, 1, 128, 256, 256, 128, 128]
    - [52, 0.82]
  - - [256, 128, 1, 256, 256, 256, 256, 256]
    - [55, 1.59]
  - - [256, 128, 1, 512, 256, 256, 512, 512]
    - [97, 2.56]
  - - [256, 128, 1, 1024, 256, 256, 1024, 1024]
    - [94, 4.4]
  - - [256, 128, 1, 2048, 256, 256, 2048, 2048]
    - [91, 6.03]
  - - [256, 128, 1, 4096, 256, 256, 4096, 4096]
    - [87, 7.82]
  - - [256, 128, 1, 8192, 256, 256, 8192, 8192]
    - [87, 8.97]
  - - [256, 256, 1, 128, 256, 256, 128, 128]
    - [90, 2.01]
  - - [256, 256, 1, 256, 256, 256, 256, 256]
    - [90, 3.37]
  - - [256, 256, 1, 512, 256, 256, 512, 512]
    - [90, 5.93]
  - - [256, 256, 1, 1024, 256, 256, 1024, 1024]
    - [90, 8.92]
  - - [256, 256, 1, 2048, 256, 256, 2048, 2048]
    - [95, 12.03]
  - - [256, 256, 1, 4096, 256, 256, 4096, 4096]
    - [95, 15.14]
  - - [256, 256, 1, 8192, 256, 256, 8192, 8192]
    - [96, 17.9]
  - - [256, 512, 1, 128, 256, 256, 128, 128]
    - [90, 3.94]
  - - [256, 512, 1, 256, 256, 256, 256, 256]
    - [90, 7.03]
  - - [256, 512, 1, 512, 256, 256, 512, 512]
    - [90, 11.75]
  - - [256, 512, 1, 1024, 256, 256, 1024, 1024]
    - [90, 17.77]
  - - [256, 512, 1, 2048, 256, 256, 2048, 2048]
    - [87, 23.88]
  - - [256, 512, 1, 4096, 256, 256, 4096, 4096]
    - [87, 29.45]
  - - [256, 512, 1, 8192, 256, 256, 8192, 8192]
    - [96, 35.8]
  - - [256, 1024, 1, 128, 256, 256, 128, 128]
    - [85, 7.2]
  - - [256, 1024, 1, 256, 256, 256, 256, 256]
    - [83, 11.97]
  - - [256, 1024, 1, 512, 256, 256, 512, 512]
    - [85, 19.82]
  - - [256, 1024, 1, 1024, 256, 256, 1024, 1024]
    - [85, 29.65]
  - - [256, 1024, 1, 2048, 256, 256, 2048, 2048]
    - [75, 39.06]
  - - [256, 1024, 1, 4096, 256, 256, 4096, 4096]
    - [90, 49.12]
  - - [256, 1024, 1, 8192, 256, 256, 8192, 8192]
    - [75, 57.21]
  - - [256, 2048, 1, 128, 256, 256, 128, 128]
    - [66, 12.57]
  - - [256, 2048, 1, 256, 256, 256, 256, 256]
    - [66, 20.31]
  - - [256, 2048, 1, 512, 256, 256, 512, 512]
    - [66, 33.56]
  - - [256, 2048, 1, 1024, 256, 256, 1024, 1024]
    - [66, 49.72]
  - - [256, 2048, 1, 2048, 256, 256, 2048, 2048]
    - [66, 64.38]
  - - [256, 2048, 1, 4096, 256, 256, 4096, 4096]
    - [66, 77.18]
  - - [256, 2048, 1, 8192, 256, 256, 8192, 8192]
    - [66, 84.26]
  - - [256, 4096, 1, 128, 256, 256, 128, 128]
    - [61, 19.46]
  - - [256, 4096, 1, 256, 256, 256, 256, 256]
    - [61, 31.45]
  - - [256, 4096, 1, 512, 256, 256, 512, 512]
    - [61, 50.38]
  - - [256, 4096, 1, 1024, 256, 256, 1024, 1024]
    - [57, 68.66]
  - - [256, 4096, 1, 2048, 256, 256, 2048, 2048]
    - [57, 84.29]
  - - [256, 4096, 1, 4096, 256, 256, 4096, 4096]
    - [57, 92.38]
  - - [256, 4096, 1, 8192, 256, 256, 8192, 8192]
    - [62, 100.98]
  - - [256, 8192, 1, 128, 256, 256, 128, 128]
    - [33, 28.73]
  - - [256, 8192, 1, 256, 256, 256, 256, 256]
    - [35, 44.23]
  - - [256, 8192, 1, 512, 256, 256, 512, 512]
    - [35, 63.25]
  - - [256, 8192, 1, 1024, 256, 256, 1024, 1024]
    - [61, 78.86]
  - - [256, 8192, 1, 2048, 256, 256, 2048, 2048]
    - [45, 91.71]
  - - [256, 8192, 1, 4096, 256, 256, 4096, 4096]
    - [61, 116.01]
  - - [256, 8192, 1, 8192, 256, 256, 8192, 8192]
    - [61, 113.29]
  - - [512, 128, 1, 128, 512, 512, 128, 128]
    - [90, 1.99]
  - - [512, 128, 1, 256, 512, 512, 256, 256]
    - [90, 3.52]
  - - [512, 128, 1, 512, 512, 512, 512, 512]
    - [90, 5.89]
  - - [512, 128, 1, 1024, 512, 512, 1024, 1024]
    - [90, 8.92]
  - - [512, 128, 1, 2048, 512, 512, 2048, 2048]
    - [90, 12.07]
  - - [512, 128, 1, 4096, 512, 512, 4096, 4096]
    - [87, 15.21]
  - - [512, 128, 1, 8192, 512, 512, 8192, 8192]
    - [93, 17.77]
  - - [512, 256, 1, 128, 512, 512, 128, 128]
    - [90, 3.84]
  - - [512, 256, 1, 256, 512, 512, 256, 256]
    - [94, 6.76]
  - - [512, 256, 1, 512, 512, 512, 512, 512]
    - [99, 11.41]
  - - [512, 256, 1, 1024, 512, 512, 1024, 1024]
    - [94, 16.99]
  - - [512, 256, 1, 2048, 512, 512, 2048, 2048]
    - [91, 23.82]
  - - [512, 256, 1, 4096, 512, 512, 4096, 4096]
    - [91, 29.78]
  - - [512, 256, 1, 8192, 512, 512, 8192, 8192]
    - [96, 35.92]
  - - [512, 512, 1, 128, 512, 512, 128, 128]
    - [85, 6.85]
  - - [512, 512, 1, 256, 512, 512, 256, 256]
    - [74, 11.74]
  - - [512, 512, 1, 512, 512, 512, 512, 512]
    - [85, 19.87]
  - - [512, 512, 1, 1024, 512, 512, 1024, 1024]
    - [75, 29.68]
  - - [512, 512, 1, 2048, 512, 512, 2048, 2048]
    - [76, 39.24]
  - - [512, 512, 1, 4096, 512, 512, 4096, 4096]
    - [99, 49.47]
  - - [512, 512, 1, 8192, 512, 512, 8192, 8192]
    - [77, 57.15]
  - - [512, 1024, 1, 128, 512, 512, 128, 128]
    - [50, 10.83]
  - - [512, 1024, 1, 256, 512, 512, 256, 256]
    - [49, 19.09]
  - - [512, 1024, 1, 512, 512, 512, 512, 512]
    - [70, 31.87]
  - - [512, 1024, 1, 1024, 512, 512, 1024, 1024]
    - [66, 49.64]
  - - [512, 1024, 1, 2048, 512, 512, 2048, 2048]
    - [66, 64.54]
  - - [512, 1024, 1, 4096, 512, 512, 4096, 4096]
    - [68, 77.68]
  - - [512, 1024, 1, 8192, 512, 512, 8192, 8192]
    - [72, 88.26]
  - - [512, 2048, 1, 128, 512, 512, 128, 128]
    - [13, 18.81]
  - - [512, 2048, 1, 256, 512, 512, 256, 256]
    - [61, 31.83]
  - - [512, 2048, 1, 512, 512, 512, 512, 512]
    - [61, 50.91]
  - - [512, 2048, 1, 1024, 512, 512, 1024, 1024]
    - [61, 69.75]
  - - [512, 2048, 1, 2048, 512, 512, 2048, 2048]
    - [57, 85.91]
  - - [512, 2048, 1, 4096, 512, 512, 4096, 4096]
    - [57, 98.72]
  - - [512, 2048, 1, 8192, 512, 512, 8192, 8192]
    - [57, 106.01]
  - - [512, 4096, 1, 128, 512, 512, 128, 128]
    - [35, 28.52]
  - - [512, 4096, 1, 256, 512, 512, 256, 256]
    - [35, 45.28]
  - - [512, 4096, 1, 512, 512, 512, 512, 512]
    - [35, 64.39]
  - - [512, 4096, 1, 1024, 512, 512, 1024, 1024]
    - [61, 83.08]
  - - [512, 4096, 1, 2048, 512, 512, 2048, 2048]
    - [47, 95.7]
  - - [512, 4096, 1, 4096, 512, 512, 4096, 4096]
    - [62, 98.54]
  - - [512, 4096, 1, 8192, 512, 512, 8192, 8192]
    - [38, 109.64]
  - - [512, 8192, 1, 128, 512, 512, 128, 128]
    - [9, 38.71]
  - - [512, 8192, 1, 256, 512, 512, 256, 256]
    - [25, 59.49]
  - - [512, 8192, 1, 512, 512, 512, 512, 512]
    - [25, 82.56]
  - - [512, 8192, 1, 1024, 512, 512, 1024, 1024]
    - [26, 100.22]
  - - [512, 8192, 1, 2048, 512, 512, 2048, 2048]
    - [40, 116.93]
  - - [512, 8192, 1, 4096, 512, 512, 4096, 4096]
    - [38, 123.92]
  - - [512, 8192, 1, 8192, 512, 512, 8192, 8192]
    - [27, 129.87]
  - - [1024, 128, 1, 128, 1024, 1024, 128, 128]
    - [89, 3.8]
  - - [1024, 128, 1, 256, 1024, 1024, 256, 256]
    - [96, 6.64]
  - - [1024, 128, 1, 512, 1024, 1024, 512, 512]
    - [96, 11.21]
  - - [1024, 128, 1, 1024, 1024, 1024, 1024, 1024]
    - [92, 16.86]
  - - [1024, 128, 1, 2048, 1024, 1024, 2048, 2048]
    - [99, 23.26]
  - - [1024, 128, 1, 4096, 1024, 1024, 4096, 4096]
    - [95, 29.29]
  - - [1024, 128, 1, 8192, 1024, 1024, 8192, 8192]
    - [94, 35.5]
  - - [1024, 256, 1, 128, 1024, 1024, 128, 128]
    - [74, 7.09]
  - - [1024, 256, 1, 256, 1024, 1024, 256, 256]
    - [79, 11.71]
  - - [1024, 256, 1, 512, 1024, 1024, 512, 512]
    - [76, 19.85]
  - - [1024, 256, 1, 1024, 1024, 1024, 1024, 1024]
    - [80, 29.68]
  - - [1024, 256, 1, 2048, 1024, 1024, 2048, 2048]
    - [76, 38.85]
  - - [1024, 256, 1, 4096, 1024, 1024, 4096, 4096]
    - [99, 48.23]
  - - [1024, 256, 1, 8192, 1024, 1024, 8192, 8192]
    - [81, 56.83]
  - - [1024, 512, 1, 128, 1024, 1024, 128, 128]
    - [72, 11.38]
  - - [1024, 512, 1, 256, 1024, 1024, 256, 256]
    - [68, 20.5]
  - - [1024, 512, 1, 512, 1024, 1024, 512, 512]
    - [68, 34.04]
  - - [1024, 512, 1, 1024, 1024, 1024, 1024, 1024]
    - [71, 49.45]
  - - [1024, 512, 1, 2048, 1024, 1024, 2048, 2048]
    - [68, 65.99]
  - - [1024, 512, 1, 4096, 1024, 1024, 4096, 4096]
    - [68, 78.9]
  - - [1024, 512, 1, 8192, 1024, 1024, 8192, 8192]
    - [68, 90.31]
  - - [1024, 1024, 1, 128, 1024, 1024, 128, 128]
    - [64, 19.31]
  - - [1024, 1024, 1, 256, 1024, 1024, 256, 256]
    - [64, 31.46]
  - - [1024, 1024, 1, 512, 1024, 1024, 512, 512]
    - [64, 50.5]
  - - [1024, 1024, 1, 1024, 1024, 1024, 1024, 1024]
    - [63, 70.14]
  - - [1024, 1024, 1, 2048, 1024, 1024, 2048, 2048]
    - [58, 87.06]
  - - [1024, 1024, 1, 4096, 1024, 1024, 4096, 4096]
    - [64, 101.91]
  - - [1024, 1024, 1, 8192, 1024, 1024, 8192, 8192]
    - [59, 104.12]
  - - [1024, 2048, 1, 128, 1024, 1024, 128, 128]
    - [34, 29.18]
  - - [1024, 2048, 1, 256, 1024, 1024, 256, 256]
    - [35, 47.01]
  - - [1024, 2048, 1, 512, 1024, 1024, 512, 512]
    - [35, 66.37]
  - - [1024, 2048, 1, 1024, 1024, 1024, 1024, 1024]
    - [61, 83.48]
  - - [1024, 2048, 1, 2048, 1024, 1024, 2048, 2048]
    - [41, 98.81]
  - - [1024, 2048, 1, 4096, 1024, 1024, 4096, 4096]
    - [35, 103.71]
  - - [1024, 2048, 1, 8192, 1024, 1024, 8192, 8192]
    - [36, 109.18]
  - - [1024, 4096, 1, 128, 1024, 1024, 128, 128]
    - [9, 39.55]
  - - [1024, 4096, 1, 256, 1024, 1024, 256, 256]
    - [25, 59.8]
  - - [1024, 4096, 1, 512, 1024, 1024, 512, 512]
    - [25, 85.06]
  - - [1024, 4096, 1, 1024, 1024, 1024, 1024, 1024]
    - [24, 103.47]
  - - [1024, 4096, 1, 2048, 1024, 1024, 2048, 2048]
    - [33, 119.03]
  - - [1024, 4096, 1, 4096, 1024, 1024, 4096, 4096]
    - [27, 120.24]
  - - [1024, 4096, 1, 8192, 1024, 1024, 8192, 8192]
    - [19, 133.32]
  - - [1024, 8192, 1, 128, 1024, 1024, 128, 128]
    - [6, 46.84]
  - - [1024, 8192, 1, 256, 1024, 1024, 256, 256]
    - [6, 68.07]
  - - [1024, 8192, 1, 512, 1024, 1024, 512, 512]
    - [0, 89.74]
  - - [1024, 8192, 1, 1024, 1024, 1024, 1024, 1024]
    - [61, 110.12]
  - - [1024, 8192, 1, 2048, 1024, 1024, 2048, 2048]
    - [22, 132.29]
  - - [1024, 8192, 1, 4096, 1024, 1024, 4096, 4096]
    - [22, 147.81]
  - - [1024, 8192, 1, 8192, 1024, 1024, 8192, 8192]
    - [3, 157.12]
  - - [2048, 128, 1, 128, 2048, 2048, 128, 128]
    - [75, 6.9]
  - - [2048, 128, 1, 256, 2048, 2048, 256, 256]
    - [74, 11.62]
  - - [2048, 128, 1, 512, 2048, 2048, 512, 512]
    - [79, 19.65]
  - - [2048, 128, 1, 1024, 2048, 2048, 1024, 1024]
    - [79, 29.25]
  - - [2048, 128, 1, 2048, 2048, 2048, 2048, 2048]
    - [78, 38.78]
  - - [2048, 128, 1, 4096, 2048, 2048, 4096, 4096]
    - [79, 48.0]
  - - [2048, 128, 1, 8192, 2048, 2048, 8192, 8192]
    - [78, 53.59]
  - - [2048, 256, 1, 128, 2048, 2048, 128, 128]
    - [72, 12.03]
  - - [2048, 256, 1, 256, 2048, 2048, 256, 256]
    - [71, 20.33]
  - - [2048, 256, 1, 512, 2048, 2048, 512, 512]
    - [68, 34.02]
  - - [2048, 256, 1, 1024, 2048, 2048, 1024, 1024]
    - [68, 50.47]
  - - [2048, 256, 1, 2048, 2048, 2048, 2048, 2048]
    - [71, 65.43]
  - - [2048, 256, 1, 4096, 2048, 2048, 4096, 4096]
    - [72, 78.42]
  - - [2048, 256, 1, 8192, 2048, 2048, 8192, 8192]
    - [69, 83.84]
  - - [2048, 512, 1, 128, 2048, 2048, 128, 128]
    - [64, 19.2]
  - - [2048, 512, 1, 256, 2048, 2048, 256, 256]
    - [62, 31.26]
  - - [2048, 512, 1, 512, 2048, 2048, 512, 512]
    - [64, 50.58]
  - - [2048, 512, 1, 1024, 2048, 2048, 1024, 1024]
    - [62, 69.88]
  - - [2048, 512, 1, 2048, 2048, 2048, 2048, 2048]
    - [62, 87.76]
  - - [2048, 512, 1, 4096, 2048, 2048, 4096, 4096]
    - [59, 97.73]
  - - [2048, 512, 1, 8192, 2048, 2048, 8192, 8192]
    - [60, 101.28]
  - - [2048, 1024, 1, 128, 2048, 2048, 128, 128]
    - [35, 28.99]
  - - [2048, 1024, 1, 256, 2048, 2048, 256, 256]
    - [37, 46.1]
  - - [2048, 1024, 1, 512, 2048, 2048, 512, 512]
    - [35, 66.25]
  - - [2048, 1024, 1, 1024, 2048, 2048, 1024, 1024]
    - [62, 83.89]
  - - [2048, 1024, 1, 2048, 2048, 2048, 2048, 2048]
    - [62, 97.61]
  - - [2048, 1024, 1, 4096, 2048, 2048, 4096, 4096]
    - [57, 118.1]
  - - [2048, 1024, 1, 8192, 2048, 2048, 8192, 8192]
    - [57, 115.15]
  - - [2048, 2048, 1, 128, 2048, 2048, 128, 128]
    - [9, 39.17]
  - - [2048, 2048, 1, 256, 2048, 2048, 256, 256]
    - [32, 60.25]
  - - [2048, 2048, 1, 512, 2048, 2048, 512, 512]
    - [29, 85.12]
  - - [2048, 2048, 1, 1024, 2048, 2048, 1024, 1024]
    - [30, 104.85]
  - - [2048, 2048, 1, 2048, 2048, 2048, 2048, 2048]
    - [38, 119.04]
  - - [2048, 2048, 1, 4096, 2048, 2048, 4096, 4096]
    - [35, 128.11]
  - - [2048, 2048, 1, 8192, 2048, 2048, 8192, 8192]
    - [30, 136.23]
  - - [2048, 4096, 1, 128, 2048, 2048, 128, 128]
    - [1, 46.75]
  - - [2048, 4096, 1, 256, 2048, 2048, 256, 256]
    - [4, 68.17]
  - - [2048, 4096, 1, 512, 2048, 2048, 512, 512]
    - [0, 90.94]
  - - [2048, 4096, 1, 1024, 2048, 2048, 1024, 1024]
    - [30, 109.61]
  - - [2048, 4096, 1, 2048, 2048, 2048, 2048, 2048]
    - [19, 136.06]
  - - [2048, 4096, 1, 4096, 2048, 2048, 4096, 4096]
    - [19, 153.29]
  - - [2048, 4096, 1, 8192, 2048, 2048, 8192, 8192]
    - [5, 156.16]
  - - [2048, 8192, 1, 128, 2048, 2048, 128, 128]
    - [1, 51.89]
  - - [2048, 8192, 1, 256, 2048, 2048, 256, 256]
    - [3, 75.39]
  - - [2048, 8192, 1, 512, 2048, 2048, 512, 512]
    - [35, 102.84]
  - - [2048, 8192, 1, 1024, 2048, 2048, 1024, 1024]
    - [40, 113.34]
  - - [2048, 8192, 1, 2048, 2048, 2048, 2048, 2048]
    - [17, 137.34]
  - - [2048, 8192, 1, 4096, 2048, 2048, 4096, 4096]
    - [18, 162.57]
  - - [2048, 8192, 1, 8192, 2048, 2048, 8192, 8192]
    - [17, 185.75]
  - - [4096, 128, 1, 128, 4096, 4096, 128, 128]
    - [66, 12.0]
  - - [4096, 128, 1, 256, 4096, 4096, 256, 256]
    - [66, 20.06]
  - - [4096, 128, 1, 512, 4096, 4096, 512, 512]
    - [72, 32.78]
  - - [4096, 128, 1, 1024, 4096, 4096, 1024, 1024]
    - [71, 47.59]
  - - [4096, 128, 1, 2048, 4096, 4096, 2048, 2048]
    - [69, 62.22]
  - - [4096, 128, 1, 4096, 4096, 4096, 4096, 4096]
    - [69, 68.67]
  - - [4096, 128, 1, 8192, 4096, 4096, 8192, 8192]
    - [67, 78.65]
  - - [4096, 256, 1, 128, 4096, 4096, 128, 128]
    - [42, 19.12]
  - - [4096, 256, 1, 256, 4096, 4096, 256, 256]
    - [62, 31.03]
  - - [4096, 256, 1, 512, 4096, 4096, 512, 512]
    - [62, 49.19]
  - - [4096, 256, 1, 1024, 4096, 4096, 1024, 1024]
    - [63, 69.96]
  - - [4096, 256, 1, 2048, 4096, 4096, 2048, 2048]
    - [59, 86.1]
  - - [4096, 256, 1, 4096, 4096, 4096, 4096, 4096]
    - [59, 93.78]
  - - [4096, 256, 1, 8192, 4096, 4096, 8192, 8192]
    - [60, 99.42]
  - - [4096, 512, 1, 128, 4096, 4096, 128, 128]
    - [40, 28.49]
  - - [4096, 512, 1, 256, 4096, 4096, 256, 256]
    - [39, 45.4]
  - - [4096, 512, 1, 512, 4096, 4096, 512, 512]
    - [39, 65.14]
  - - [4096, 512, 1, 1024, 4096, 4096, 1024, 1024]
    - [62, 83.48]
  - - [4096, 512, 1, 2048, 4096, 4096, 2048, 2048]
    - [44, 97.03]
  - - [4096, 512, 1, 4096, 4096, 4096, 4096, 4096]
    - [56, 109.56]
  - - [4096, 512, 1, 8192, 4096, 4096, 8192, 8192]
    - [56, 115.85]
  - - [4096, 1024, 1, 128, 4096, 4096, 128, 128]
    - [12, 38.66]
  - - [4096, 1024, 1, 256, 4096, 4096, 256, 256]
    - [27, 59.6]
  - - [4096, 1024, 1, 512, 4096, 4096, 512, 512]
    - [27, 84.37]
  - - [4096, 1024, 1, 1024, 4096, 4096, 1024, 1024]
    - [26, 104.13]
  - - [4096, 1024, 1, 2048, 4096, 4096, 2048, 2048]
    - [37, 122.43]
  - - [4096, 1024, 1, 4096, 4096, 4096, 4096, 4096]
    - [33, 135.47]
  - - [4096, 1024, 1, 8192, 4096, 4096, 8192, 8192]
    - [35, 138.44]
  - - [4096, 2048, 1, 128, 4096, 4096, 128, 128]
    - [0, 46.02]
  - - [4096, 2048, 1, 256, 4096, 4096, 256, 256]
    - [3, 66.49]
  - - [4096, 2048, 1, 512, 4096, 4096, 512, 512]
    - [29, 90.88]
  - - [4096, 2048, 1, 1024, 4096, 4096, 1024, 1024]
    - [7, 111.86]
  - - [4096, 2048, 1, 2048, 4096, 4096, 2048, 2048]
    - [19, 141.09]
  - - [4096, 2048, 1, 4096, 4096, 4096, 4096, 4096]
    - [17, 159.23]
  - - [4096, 2048, 1, 8192, 4096, 4096, 8192, 8192]
    - [19, 167.93]
  - - [4096, 4096, 1, 128, 4096, 4096, 128, 128]
    - [3, 51.63]
  - - [4096, 4096, 1, 256, 4096, 4096, 256, 256]
    - [6, 74.33]
  - - [4096, 4096, 1, 512, 4096, 4096, 512, 512]
    - [40, 100.82]
  - - [4096, 4096, 1, 1024, 4096, 4096, 1024, 1024]
    - [40, 119.44]
  - - [4096, 4096, 1, 2048, 4096, 4096, 2048, 2048]
    - [22, 141.43]
  - - [4096, 4096, 1, 4096, 4096, 4096, 4096, 4096]
    - [21, 162.95]
  - - [4096, 4096, 1, 8192, 4096, 4096, 8192, 8192]
    - [18, 173.48]
  - - [4096, 8192, 1, 128, 4096, 4096, 128, 128]
    - [2, 53.37]
  - - [4096, 8192, 1, 256, 4096, 4096, 256, 256]
    - [11, 77.86]
  - - [4096, 8192, 1, 512, 4096, 4096, 512, 512]
    - [30, 109.62]
  - - [4096, 8192, 1, 1024, 4096, 4096, 1024, 1024]
    - [28, 134.14]
  - - [4096, 8192, 1, 2048, 4096, 4096, 2048, 2048]
    - [32, 162.78]
  - - [4096, 8192, 1, 4096, 4096, 4096, 4096, 4096]
    - [19, 173.27]
  - - [4096, 8192, 1, 8192, 4096, 4096, 8192, 8192]
    - [39, 186.53]
  - - [8192, 128, 1, 128, 8192, 8192, 128, 128]
    - [46, 18.55]
  - - [8192, 128, 1, 256, 8192, 8192, 256, 256]
    - [57, 29.77]
  - - [8192, 128, 1, 512, 8192, 8192, 512, 512]
    - [62, 47.02]
  - - [8192, 128, 1, 1024, 8192, 8192, 1024, 1024]
    - [59, 65.68]
  - - [8192, 128, 1, 2048, 8192, 8192, 2048, 2048]
    - [56, 73.96]
  - - [8192, 128, 1, 4096, 8192, 8192, 4096, 4096]
    - [56, 85.75]
  - - [8192, 128, 1, 8192, 8192, 8192, 8192, 8192]
    - [57, 88.43]
  - - [8192, 256, 1, 128, 8192, 8192, 128, 128]
    - [37, 27.88]
  - - [8192, 256, 1, 256, 8192, 8192, 256, 256]
    - [39, 42.93]
  - - [8192, 256, 1, 512, 8192, 8192, 512, 512]
    - [40, 62.94]
  - - [8192, 256, 1, 1024, 8192, 8192, 1024, 1024]
    - [38, 75.98]
  - - [8192, 256, 1, 2048, 8192, 8192, 2048, 2048]
    - [43, 91.33]
  - - [8192, 256, 1, 4096, 8192, 8192, 4096, 4096]
    - [58, 110.41]
  - - [8192, 256, 1, 8192, 8192, 8192, 8192, 8192]
    - [57, 117.13]
  - - [8192, 512, 1, 128, 8192, 8192, 128, 128]
    - [27, 36.48]
  - - [8192, 512, 1, 256, 8192, 8192, 256, 256]
    - [32, 56.73]
  - - [8192, 512, 1, 512, 8192, 8192, 512, 512]
    - [27, 79.25]
  - - [8192, 512, 1, 1024, 8192, 8192, 1024, 1024]
    - [27, 96.06]
  - - [8192, 512, 1, 2048, 8192, 8192, 2048, 2048]
    - [38, 117.59]
  - - [8192, 512, 1, 4096, 8192, 8192, 4096, 4096]
    - [33, 133.72]
  - - [8192, 512, 1, 8192, 8192, 8192, 8192, 8192]
    - [35, 135.47]
  - - [8192, 1024, 1, 128, 8192, 8192, 128, 128]
    - [1, 44.14]
  - - [8192, 1024, 1, 256, 8192, 8192, 256, 256]
    - [1, 65.16]
  - - [8192, 1024, 1, 512, 8192, 8192, 512, 512]
    - [27, 88.62]
  - - [8192, 1024, 1, 1024, 8192, 8192, 1024, 1024]
    - [8, 110.51]
  - - [8192, 1024, 1, 2048, 8192, 8192, 2048, 2048]
    - [19, 136.88]
  - - [8192, 1024, 1, 4096, 8192, 8192, 4096, 4096]
    - [17, 158.8]
  - - [8192, 1024, 1, 8192, 8192, 8192, 8192, 8192]
    - [18, 163.93]
  - - [8192, 2048, 1, 128, 8192, 8192, 128, 128]
    - [1, 50.78]
  - - [8192, 2048, 1, 256, 8192, 8192, 256, 256]
    - [1, 72.81]
  - - [8192, 2048, 1, 512, 8192, 8192, 512, 512]
    - [40, 100.93]
  - - [8192, 2048, 1, 1024, 8192, 8192, 1024, 1024]
    - [40, 115.89]
  - - [8192, 2048, 1, 2048, 8192, 8192, 2048, 2048]
    - [25, 138.93]
  - - [8192, 2048, 1, 4096, 8192, 8192, 4096, 4096]
    - [22, 167.74]
  - - [8192, 2048, 1, 8192, 8192, 8192, 8192, 8192]
    - [16, 172.81]
  - - [8192, 4096, 1, 128, 8192, 8192, 128, 128]
    - [1, 52.95]
  - - [8192, 4096, 1, 256, 8192, 8192, 256, 256]
    - [40, 78.03]
  - - [8192, 4096, 1, 512, 8192, 8192, 512, 512]
    - [31, 108.17]
  - - [8192, 4096, 1, 1024, 8192, 8192, 1024, 1024]
    - [23, 138.71]
  - - [8192, 4096, 1, 2048, 8192, 8192, 2048, 2048]
    - [32, 161.45]
  - - [8192, 4096, 1, 4096, 8192, 8192, 4096, 4096]
    - [39, 178.95]
  - - [8192, 4096, 1, 8192, 8192, 8192, 8192, 8192]
    - [40, 188.32]
  - - [8192, 8192, 1, 128, 8192, 8192, 128, 128]
    - [10, 55.87]
  - - [8192, 8192, 1, 256, 8192, 8192, 256, 256]
    - [25, 83.09]
  - - [8192, 8192, 1, 512, 8192, 8192, 512, 512]
    - [29, 116.42]
  - - [8192, 8192, 1, 1024, 8192, 8192, 1024, 1024]
    - [21, 150.05]
  - - [8192, 8192, 1, 2048, 8192, 8192, 2048, 2048]
    - [22, 177.82]
  - - [8192, 8192, 1, 4096, 8192, 8192, 4096, 4096]
    - [23, 199.23]
  - - [8192, 8192, 1, 8192, 8192, 8192, 8192, 8192]
    - [20, 214.52]
  - - [1, 1, 1, 32, 1, 1, 32, 32]
    - [100, 0.0]
- null
- null
- ExperimentalStreamK
- GridBased
