projects/hipblaslt/library/src/amd_detail/rocblaslt/src/Tensile/Logic/asm_full/aquavanjaram/gfx942_228cu/StreamK/aquavanjaram942_Cijk_Alik_Bjlk_F8B8NBS_BH_Bias_HAS_SAV_UserArgs.yaml
- {MinimumRequiredVersion: 4.33.0}
- aquavanjaram942
- {Architecture: gfx942, CUCount: 228}
- [Device 0049, Device 0050]
    SolutionIndex: 0
    SolutionNameMin: Cijk_Alik_Bjlk_F8B8NBS_BH_Bias_HAS_SAV_UserArgs_MT256x256x64_MI16x16x1_SN_LDSB1_CLR1_GRVWA8_GRVWB8_GSU0_GSUC0_GSUWGMRR0_K1_LBSPPA512_LBSPPB2048_LPA8_LPB0_LRVW8_MIWT8_8_PLR1_SU0_SUM0_SUS64_VWA8_VWB8_WGM1_WGMXCC1_WGMXCCGn1
    SolutionIndex: 1
    SolutionNameMin: Cijk_Alik_Bjlk_F8B8NBS_BH_Bias_HAS_SAV_UserArgs_MT256x256x64_MI16x16x1_SN_LDSB1_CLR1_GRVWA8_GRVWB16_GSU0_GSUC0_GSUWGMRR0_K1_LBSPPA512_LBSPPB2048_LPA8_LPB0_LRVW8_MIWT8_8_PLR1_SU0_SUM0_SUS64_VWA8_VWB8_WGM1_WGMXCC1_WGMXCCGn1
    SolutionIndex: 2
    SolutionNameMin: Cijk_Alik_Bjlk_F8B8NBS_BH_Bias_HAS_SAV_UserArgs_MT256x256x64_MI16x16x1_SN_LDSB1_CLR1_GRVWA16_GRVWB16_GSU0_GSUC0_GSUWGMRR0_K1_LBSPPA512_LBSPPB2048_LPA16_LPB0_LRVW8_MIWT8_8_PLR1_SU0_SUM0_SUS64_VWA8_VWB8_WGM1_WGMXCC1_WGMXCCGn1
    SolutionIndex: 3
    SolutionNameMin: Cijk_Alik_Bjlk_F8B8NBS_BH_Bias_HAS_SAV_UserArgs_MT256x256x64_MI16x16x1_SN_LDSB1_CLR1_GRVWA8_GRVWB16_GSU0_GSUC0_GSUWGMRR0_K1_LBSPPA512_LBSPPB2048_LPA8_LPB0_LRVW8_MIWT8_8_PLR1_SU0_SUM0_SUS64_VWA8_VWB8_WGM4_WGMXCC1_WGMXCCGn1
    SolutionIndex: 4
    SolutionNameMin: Cijk_Alik_Bjlk_F8B8NBS_BH_Bias_HAS_SAV_UserArgs_MT256x256x64_MI16x16x1_SN_LDSB1_CLR1_GRVWA16_GRVWB16_GSU0_GSUC0_GSUWGMRR0_K1_LBSPPA512_LBSPPB2048_LPA16_LPB0_LRVW8_MIWT8_8_PLR1_SU0_SUM0_SUS64_VWA8_VWB8_WGM4_WGMXCC1_WGMXCCGn1
    SolutionIndex: 5
    SolutionNameMin: Cijk_Alik_Bjlk_F8B8NBS_BH_Bias_HAS_SAV_UserArgs_MT256x256x64_MI16x16x1_SN_LDSB1_CLR1_GRVWA8_GRVWB8_GSU0_GSUC0_GSUWGMRR0_K1_LBSPPA512_LBSPPB2048_LPA8_LPB0_LRVW8_MIWT8_8_PLR1_SU0_SUM0_SUS64_VWA8_VWB8_WGM6_WGMXCC1_WGMXCCGn1
    SolutionIndex: 6
    SolutionNameMin: Cijk_Alik_Bjlk_F8B8NBS_BH_Bias_HAS_SAV_UserArgs_MT256x256x64_MI16x16x1_SN_LDSB1_CLR1_GRVWA8_GRVWB16_GSU0_GSUC0_GSUWGMRR0_K1_LBSPPA512_LBSPPB2048_LPA8_LPB0_LRVW8_MIWT8_8_PLR1_SU0_SUM0_SUS64_VWA8_VWB8_WGM6_WGMXCC1_WGMXCCGn1
    SolutionIndex: 7
    SolutionNameMin: Cijk_Alik_Bjlk_F8B8NBS_BH_Bias_HAS_SAV_UserArgs_MT256x256x64_MI16x16x1_SN_LDSB1_CLR1_GRVWA16_GRVWB16_GSU0_GSUC0_GSUWGMRR0_K1_LBSPPA512_LBSPPB2048_LPA16_LPB0_LRVW8_MIWT8_8_PLR1_SU0_SUM0_SUS64_VWA8_VWB8_WGM6_WGMXCC1_WGMXCCGn1
    SolutionIndex: 8
    SolutionNameMin: Cijk_Alik_Bjlk_F8B8NBS_BH_Bias_HAS_SAV_UserArgs_MT256x256x64_MI16x16x1_SN_LDSB1_CLR1_GRVWA8_GRVWB8_GSU0_GSUC0_GSUWGMRR0_K1_LBSPPA512_LBSPPB2048_LPA8_LPB0_LRVW8_MIWT8_8_PLR1_SU0_SUM0_SUS64_VWA8_VWB8_WGM8_WGMXCC1_WGMXCCGn1
    SolutionIndex: 9
    SolutionNameMin: Cijk_Alik_Bjlk_F8B8NBS_BH_Bias_HAS_SAV_UserArgs_MT256x256x64_MI16x16x1_SN_LDSB1_CLR1_GRVWA8_GRVWB16_GSU0_GSUC0_GSUWGMRR0_K1_LBSPPA512_LBSPPB2048_LPA8_LPB0_LRVW8_MIWT8_8_PLR1_SU0_SUM0_SUS64_VWA8_VWB8_WGM8_WGMXCC1_WGMXCCGn1
    SolutionIndex: 10
    SolutionNameMin: Cijk_Alik_Bjlk_F8B8NBS_BH_Bias_HAS_SAV_UserArgs_MT256x256x64_MI16x16x1_SN_LDSB1_CLR1_GRVWA16_GRVWB16_GSU0_GSUC0_GSUWGMRR0_K1_LBSPPA512_LBSPPB2048_LPA16_LPB0_LRVW8_MIWT8_8_PLR1_SU0_SUM0_SUS64_VWA8_VWB8_WGM8_WGMXCC1_WGMXCCGn1
    SolutionIndex: 11
    SolutionNameMin: Cijk_Alik_Bjlk_F8B8NBS_BH_Bias_HAS_SAV_UserArgs_MT128x256x64_MI16x16x1_SN_LDSB1_CLR1_GRVWA8_GRVWB16_GSU0_GSUC0_GSUWGMRR0_K1_LBSPPA256_LBSPPB2048_LPA8_LPB0_LRVW8_MIWT4_8_PLR1_SU0_SUM0_SUS64_VWA4_VWB8_WGM1_WGMXCC1_WGMXCCGn1
    SolutionIndex: 12
    SolutionNameMin: Cijk_Alik_Bjlk_F8B8NBS_BH_Bias_HAS_SAV_UserArgs_MT128x256x64_MI16x16x1_SN_LDSB1_CLR1_GRVWA16_GRVWB16_GSU0_GSUC0_GSUWGMRR0_K1_LBSPPA256_LBSPPB2048_LPA16_LPB0_LRVW8_MIWT4_8_PLR1_SU0_SUM0_SUS64_VWA4_VWB8_WGM1_WGMXCC1_WGMXCCGn1
    SolutionIndex: 13
    SolutionNameMin: Cijk_Alik_Bjlk_F8B8NBS_BH_Bias_HAS_SAV_UserArgs_MT128x256x64_MI16x16x1_SN_LDSB1_CLR1_GRVWA8_GRVWB16_GSU0_GSUC0_GSUWGMRR0_K1_LBSPPA256_LBSPPB2048_LPA8_LPB0_LRVW8_MIWT4_8_PLR1_SU0_SUM0_SUS64_VWA4_VWB8_WGM4_WGMXCC1_WGMXCCGn1
    SolutionIndex: 14
    SolutionNameMin: Cijk_Alik_Bjlk_F8B8NBS_BH_Bias_HAS_SAV_UserArgs_MT128x256x64_MI16x16x1_SN_LDSB1_CLR1_GRVWA8_GRVWB16_GSU0_GSUC0_GSUWGMRR0_K1_LBSPPA256_LBSPPB2048_LPA8_LPB0_LRVW8_MIWT4_8_PLR1_SU0_SUM0_SUS64_VWA4_VWB8_WGM6_WGMXCC1_WGMXCCGn1
    SolutionIndex: 15
    SolutionNameMin: Cijk_Alik_Bjlk_F8B8NBS_BH_Bias_HAS_SAV_UserArgs_MT256x128x64_MI16x16x1_SN_LDSB1_CLR1_GRVWA8_GRVWB8_GSU0_GSUC0_GSUWGMRR0_K1_LBSPPA512_LBSPPB1024_LPA8_LPB64_LRVW8_MIWT8_4_PLR1_SU0_SUM0_SUS64_VWA8_VWB4_WGM1_WGMXCC1_WGMXCCGn1
    SolutionIndex: 16
    SolutionNameMin: Cijk_Alik_Bjlk_F8B8NBS_BH_Bias_HAS_SAV_UserArgs_MT256x128x64_MI16x16x1_SN_LDSB1_CLR1_GRVWA16_GRVWB8_GSU0_GSUC0_GSUWGMRR0_K1_LBSPPA512_LBSPPB1024_LPA16_LPB64_LRVW8_MIWT8_4_PLR1_SU0_SUM0_SUS64_VWA8_VWB4_WGM1_WGMXCC1_WGMXCCGn1
    SolutionIndex: 17
    SolutionNameMin: Cijk_Alik_Bjlk_F8B8NBS_BH_Bias_HAS_SAV_UserArgs_MT256x128x64_MI16x16x1_SN_LDSB1_CLR1_GRVWA8_GRVWB16_GSU0_GSUC0_GSUWGMRR0_K1_LBSPPA512_LBSPPB1024_LPA8_LPB64_LRVW8_MIWT8_4_PLR1_SU0_SUM0_SUS64_VWA8_VWB4_WGM1_WGMXCC1_WGMXCCGn1
    SolutionIndex: 18
    SolutionNameMin: Cijk_Alik_Bjlk_F8B8NBS_BH_Bias_HAS_SAV_UserArgs_MT256x128x64_MI16x16x1_SN_LDSB1_CLR1_GRVWA16_GRVWB16_GSU0_GSUC0_GSUWGMRR0_K1_LBSPPA512_LBSPPB1024_LPA16_LPB64_LRVW8_MIWT8_4_PLR1_SU0_SUM0_SUS64_VWA8_VWB4_WGM1_WGMXCC1_WGMXCCGn1
    SolutionIndex: 19
    SolutionNameMin: Cijk_Alik_Bjlk_F8B8NBS_BH_Bias_HAS_SAV_UserArgs_MT256x128x64_MI16x16x1_SN_LDSB1_CLR1_GRVWA8_GRVWB16_GSU0_GSUC0_GSUWGMRR0_K1_LBSPPA512_LBSPPB1024_LPA8_LPB64_LRVW8_MIWT8_4_PLR1_SU0_SUM0_SUS64_VWA8_VWB4_WGM4_WGMXCC1_WGMXCCGn1
    SolutionIndex: 20
    SolutionNameMin: Cijk_Alik_Bjlk_F8B8NBS_BH_Bias_HAS_SAV_UserArgs_MT256x128x64_MI16x16x1_SN_LDSB1_CLR1_GRVWA16_GRVWB16_GSU0_GSUC0_GSUWGMRR0_K1_LBSPPA512_LBSPPB1024_LPA16_LPB64_LRVW8_MIWT8_4_PLR1_SU0_SUM0_SUS64_VWA8_VWB4_WGM4_WGMXCC1_WGMXCCGn1
    SolutionIndex: 21
    SolutionNameMin: Cijk_Alik_Bjlk_F8B8NBS_BH_Bias_HAS_SAV_UserArgs_MT256x128x64_MI16x16x1_SN_LDSB1_CLR1_GRVWA8_GRVWB16_GSU0_GSUC0_GSUWGMRR0_K1_LBSPPA512_LBSPPB1024_LPA8_LPB64_LRVW8_MIWT8_4_PLR1_SU0_SUM0_SUS64_VWA8_VWB4_WGM6_WGMXCC1_WGMXCCGn1
    SolutionIndex: 22
    SolutionNameMin: Cijk_Alik_Bjlk_F8B8NBS_BH_Bias_HAS_SAV_UserArgs_MT256x128x64_MI16x16x1_SN_LDSB1_CLR1_GRVWA16_GRVWB16_GSU0_GSUC0_GSUWGMRR0_K1_LBSPPA512_LBSPPB1024_LPA16_LPB64_LRVW8_MIWT8_4_PLR1_SU0_SUM0_SUS64_VWA8_VWB4_WGM6_WGMXCC1_WGMXCCGn1
    SolutionIndex: 23
    SolutionNameMin: Cijk_Alik_Bjlk_F8B8NBS_BH_Bias_HAS_SAV_UserArgs_MT256x128x64_MI16x16x1_SN_LDSB1_CLR1_GRVWA8_GRVWB8_GSU0_GSUC0_GSUWGMRR0_K1_LBSPPA512_LBSPPB1024_LPA8_LPB64_LRVW8_MIWT8_4_PLR1_SU0_SUM0_SUS64_VWA8_VWB4_WGM8_WGMXCC1_WGMXCCGn1
    SolutionIndex: 24
    SolutionNameMin: Cijk_Alik_Bjlk_F8B8NBS_BH_Bias_HAS_SAV_UserArgs_MT256x128x64_MI16x16x1_SN_LDSB1_CLR1_GRVWA8_GRVWB16_GSU0_GSUC0_GSUWGMRR0_K1_LBSPPA512_LBSPPB1024_LPA8_LPB64_LRVW8_MIWT8_4_PLR1_SU0_SUM0_SUS64_VWA8_VWB4_WGM8_WGMXCC1_WGMXCCGn1
    SolutionIndex: 25
    SolutionNameMin: Cijk_Alik_Bjlk_F8B8NBS_BH_Bias_HAS_SAV_UserArgs_MT128x128x64_MI16x16x1_SN_LDSB1_CLR1_GRVWA8_GRVWB16_GSU0_GSUC0_GSUWGMRR0_K1_LBSPPA512_LBSPPB1024_LPA8_LPB32_LRVW8_MIWT8_2_PLR1_SU0_SUM0_SUS64_VWA8_VWB2_WGM1_WGMXCC1_WGMXCCGn1
    SolutionIndex: 26
    SolutionNameMin: Cijk_Alik_Bjlk_F8B8NBS_BH_Bias_HAS_SAV_UserArgs_MT128x128x64_MI16x16x1_SN_LDSB1_CLR1_GRVWA8_GRVWB8_GSU0_GSUC0_GSUWGMRR0_K1_LBSPPA512_LBSPPB1024_LPA8_LPB32_LRVW8_MIWT8_2_PLR1_SU0_SUM0_SUS64_VWA8_VWB2_WGM4_WGMXCC1_WGMXCCGn1
    SolutionIndex: 27
    SolutionNameMin: Cijk_Alik_Bjlk_F8B8NBS_BH_Bias_HAS_SAV_UserArgs_MT128x128x64_MI16x16x1_SN_LDSB1_CLR1_GRVWA8_GRVWB16_GSU0_GSUC0_GSUWGMRR0_K1_LBSPPA512_LBSPPB1024_LPA8_LPB32_LRVW8_MIWT8_2_PLR1_SU0_SUM0_SUS64_VWA8_VWB2_WGM6_WGMXCC1_WGMXCCGn1
    SolutionIndex: 28
    SolutionNameMin: Cijk_Alik_Bjlk_F8B8NBS_BH_Bias_HAS_SAV_UserArgs_MT128x128x64_MI16x16x1_SN_LDSB1_CLR1_GRVWA8_GRVWB16_GSU0_GSUC0_GSUWGMRR0_K1_LBSPPA512_LBSPPB1024_LPA8_LPB32_LRVW8_MIWT8_2_PLR1_SU0_SUM0_SUS64_VWA8_VWB2_WGM8_WGMXCC1_WGMXCCGn1
    SolutionIndex: 29
    SolutionNameMin: Cijk_Alik_Bjlk_F8B8NBS_BH_Bias_HAS_SAV_UserArgs_MT128x64x64_MI16x16x1_SN_LDSB0_CLR1_GRVWA8_GRVWB8_GSU0_GSUC0_GSUWGMRR0_K1_LBSPPA512_LBSPPB512_LPA8_LPB16_LRVW8_MIWT8_1_PLR1_SU0_SUM0_SUS64_VWA8_VWB1_WGM1_WGMXCC1_WGMXCCGn1
    SolutionIndex: 30
    SolutionNameMin: Cijk_Alik_Bjlk_F8B8NBS_BH_Bias_HAS_SAV_UserArgs_MT128x64x64_MI16x16x1_SN_LDSB0_CLR1_GRVWA16_GRVWB8_GSU0_GSUC0_GSUWGMRR0_K1_LBSPPA512_LBSPPB512_LPA16_LPB16_LRVW8_MIWT8_1_PLR1_SU0_SUM0_SUS64_VWA8_VWB1_WGM1_WGMXCC1_WGMXCCGn1
    SolutionIndex: 31
    SolutionNameMin: Cijk_Alik_Bjlk_F8B8NBS_BH_Bias_HAS_SAV_UserArgs_MT128x64x64_MI16x16x1_SN_LDSB0_CLR1_GRVWA8_GRVWB8_GSU0_GSUC0_GSUWGMRR0_K1_LBSPPA512_LBSPPB512_LPA8_LPB16_LRVW8_MIWT8_1_PLR1_SU0_SUM0_SUS64_VWA8_VWB1_WGM6_WGMXCC1_WGMXCCGn1
    SolutionIndex: 32
    SolutionNameMin: Cijk_Alik_Bjlk_F8B8NBS_BH_Bias_HAS_SAV_UserArgs_MT128x64x64_MI16x16x1_SN_LDSB0_CLR1_GRVWA8_GRVWB16_GSU0_GSUC0_GSUWGMRR0_K1_LBSPPA512_LBSPPB512_LPA8_LPB16_LRVW8_MIWT8_1_PLR1_SU0_SUM0_SUS64_VWA8_VWB1_WGM8_WGMXCC1_WGMXCCGn1
    SolutionIndex: 33
    SolutionNameMin: Cijk_Alik_Bjlk_F8B8NBS_BH_Bias_HAS_SAV_UserArgs_MT64x128x64_MI16x16x1_SN_LDSB0_CLR1_GRVWA8_GRVWB16_GSU0_GSUC0_GSUWGMRR0_K1_LBSPPA128_LBSPPB1024_LPA8_LPB64_LRVW8_MIWT2_4_PLR1_SU0_SUM0_SUS64_VWA2_VWB4_WGM1_WGMXCC1_WGMXCCGn1
    SolutionIndex: 34
    SolutionNameMin: Cijk_Alik_Bjlk_F8B8NBS_BH_Bias_HAS_SAV_UserArgs_MT128x64x64_MI16x16x1_SN_LDSB0_CLR1_GRVWA8_GRVWB8_GSU0_GSUC0_GSUWGMRR0_K1_LBSPPA256_LBSPPB512_LPA8_LPB32_LRVW8_MIWT4_2_PLR1_SU0_SUM0_SUS64_VWA4_VWB2_WGM1_WGMXCC1_WGMXCCGn1
    SolutionIndex: 35
    SolutionNameMin: Cijk_Alik_Bjlk_F8B8NBS_BH_Bias_HAS_SAV_UserArgs_MT128x64x64_MI16x16x1_SN_LDSB0_CLR1_GRVWA16_GRVWB8_GSU0_GSUC0_GSUWGMRR0_K1_LBSPPA256_LBSPPB512_LPA16_LPB32_LRVW8_MIWT4_2_PLR1_SU0_SUM0_SUS64_VWA4_VWB2_WGM1_WGMXCC1_WGMXCCGn1
    SolutionIndex: 36
    SolutionNameMin: Cijk_Alik_Bjlk_F8B8NBS_BH_Bias_HAS_SAV_UserArgs_MT128x64x64_MI16x16x1_SN_LDSB0_CLR1_GRVWA8_GRVWB16_GSU0_GSUC0_GSUWGMRR0_K1_LBSPPA256_LBSPPB512_LPA8_LPB32_LRVW8_MIWT4_2_PLR1_SU0_SUM0_SUS64_VWA4_VWB2_WGM1_WGMXCC1_WGMXCCGn1
    SolutionIndex: 37
    SolutionNameMin: Cijk_Alik_Bjlk_F8B8NBS_BH_Bias_HAS_SAV_UserArgs_MT128x64x64_MI16x16x1_SN_LDSB0_CLR1_GRVWA8_GRVWB16_GSU0_GSUC0_GSUWGMRR0_K1_LBSPPA256_LBSPPB512_LPA8_LPB32_LRVW8_MIWT4_2_PLR1_SU0_SUM0_SUS64_VWA4_VWB2_WGM4_WGMXCC1_WGMXCCGn1
    SolutionIndex: 38
    SolutionNameMin: Cijk_Alik_Bjlk_F8B8NBS_BH_Bias_HAS_SAV_UserArgs_MT128x64x64_MI16x16x1_SN_LDSB0_CLR1_GRVWA8_GRVWB16_GSU0_GSUC0_GSUWGMRR0_K1_LBSPPA256_LBSPPB512_LPA8_LPB32_LRVW8_MIWT4_2_PLR1_SU0_SUM0_SUS64_VWA4_VWB2_WGM6_WGMXCC1_WGMXCCGn1
    SolutionIndex: 39
    SolutionNameMin: Cijk_Alik_Bjlk_F8B8NBS_BH_Bias_HAS_SAV_UserArgs_MT128x64x64_MI16x16x1_SN_LDSB0_CLR1_GRVWA8_GRVWB16_GSU0_GSUC0_GSUWGMRR0_K1_LBSPPA256_LBSPPB512_LPA8_LPB32_LRVW8_MIWT4_2_PLR1_SU0_SUM0_SUS64_VWA4_VWB2_WGM8_WGMXCC1_WGMXCCGn1
    SolutionIndex: 40
    SolutionNameMin: Cijk_Alik_Bjlk_F8B8NBS_BH_Bias_HAS_SAV_UserArgs_MT32x128x64_MI16x16x1_SN_LDSB0_CLR1_GRVWA8_GRVWB8_GSU0_GSUC0_GSUWGMRR0_K1_LBSPPA128_LBSPPB1024_LPA8_LPB64_LRVW8_MIWT1_4_PLR1_SU0_SUM0_SUS64_VWA1_VWB4_WGM4_WGMXCC1_WGMXCCGn1
    SolutionIndex: 41
    SolutionNameMin: Cijk_Alik_Bjlk_F8B8NBS_BH_Bias_HAS_SAV_UserArgs_MT128x32x64_MI16x16x1_SN_LDSB0_CLR1_GRVWA16_GRVWB8_GSU0_GSUC0_GSUWGMRR0_K1_LBSPPA256_LBSPPB256_LPA16_LPB16_LRVW8_MIWT4_1_PLR1_SU0_SUM0_SUS64_VWA4_VWB1_WGM6_WGMXCC1_WGMXCCGn1
    SolutionIndex: 42
    SolutionNameMin: Cijk_Alik_Bjlk_F8B8NBS_BH_Bias_HAS_SAV_UserArgs_MT64x64x64_MI16x16x1_SN_LDSB0_CLR1_GRVWA8_GRVWB8_GSU0_GSUC0_GSUWGMRR0_K1_LBSPPA128_LBSPPB512_LPA8_LPB32_LRVW8_MIWT2_2_PLR1_SU0_SUM0_SUS64_VWA2_VWB2_WGM1_WGMXCC1_WGMXCCGn1
    SolutionIndex: 43
    SolutionNameMin: Cijk_Alik_Bjlk_F8B8NBS_BH_Bias_HAS_SAV_UserArgs_MT64x64x64_MI16x16x1_SN_LDSB0_CLR1_GRVWA16_GRVWB8_GSU0_GSUC0_GSUWGMRR0_K1_LBSPPA128_LBSPPB512_LPA16_LPB32_LRVW8_MIWT2_2_PLR1_SU0_SUM0_SUS64_VWA2_VWB2_WGM1_WGMXCC1_WGMXCCGn1
    SolutionIndex: 44
    SolutionNameMin: Cijk_Alik_Bjlk_F8B8NBS_BH_Bias_HAS_SAV_UserArgs_MT64x64x64_MI16x16x1_SN_LDSB0_CLR1_GRVWA8_GRVWB16_GSU0_GSUC0_GSUWGMRR0_K1_LBSPPA128_LBSPPB512_LPA8_LPB32_LRVW8_MIWT2_2_PLR1_SU0_SUM0_SUS64_VWA2_VWB2_WGM1_WGMXCC1_WGMXCCGn1
    SolutionIndex: 45
    SolutionNameMin: Cijk_Alik_Bjlk_F8B8NBS_BH_Bias_HAS_SAV_UserArgs_MT64x64x64_MI16x16x1_SN_LDSB0_CLR1_GRVWA16_GRVWB8_GSU0_GSUC0_GSUWGMRR0_K1_LBSPPA128_LBSPPB512_LPA16_LPB32_LRVW8_MIWT2_2_PLR1_SU0_SUM0_SUS64_VWA2_VWB2_WGM6_WGMXCC1_WGMXCCGn1
    SolutionIndex: 46
    SolutionNameMin: Cijk_Alik_Bjlk_F8B8NBS_BH_Bias_HAS_SAV_UserArgs_MT64x64x64_MI16x16x1_SN_LDSB0_CLR1_GRVWA8_GRVWB16_GSU0_GSUC0_GSUWGMRR0_K1_LBSPPA128_LBSPPB512_LPA8_LPB32_LRVW8_MIWT2_2_PLR1_SU0_SUM0_SUS64_VWA2_VWB2_WGM8_WGMXCC1_WGMXCCGn1
    SolutionIndex: 47
    SolutionNameMin: Cijk_Alik_Bjlk_F8B8NBS_BH_Bias_HAS_SAV_UserArgs_MT64x32x64_MI16x16x1_SN_LDSB0_CLR1_GRVWA8_GRVWB8_GSU0_GSUC0_GSUWGMRR0_K1_LBSPPA128_LBSPPB256_LPA8_LPB16_LRVW8_MIWT2_1_PLR1_SU0_SUM0_SUS64_VWA2_VWB1_WGM1_WGMXCC1_WGMXCCGn1
    SolutionIndex: 48
    SolutionNameMin: Cijk_Alik_Bjlk_F8B8NBS_BH_Bias_HAS_SAV_UserArgs_MT64x32x64_MI16x16x1_SN_LDSB0_CLR1_GRVWA16_GRVWB8_GSU0_GSUC0_GSUWGMRR0_K1_LBSPPA128_LBSPPB256_LPA16_LPB16_LRVW8_MIWT2_1_PLR1_SU0_SUM0_SUS64_VWA2_VWB1_WGM1_WGMXCC1_WGMXCCGn1
    SolutionIndex: 49
    SolutionNameMin: Cijk_Alik_Bjlk_F8B8NBS_BH_Bias_HAS_SAV_UserArgs_MT64x32x64_MI16x16x1_SN_LDSB0_CLR1_GRVWA16_GRVWB8_GSU0_GSUC0_GSUWGMRR0_K1_LBSPPA128_LBSPPB256_LPA16_LPB16_LRVW8_MIWT2_1_PLR1_SU0_SUM0_SUS64_VWA2_VWB1_WGM8_WGMXCC1_WGMXCCGn1
    SolutionIndex: 50
    SolutionNameMin: Cijk_Alik_Bjlk_F8B8NBS_BH_Bias_HAS_SAV_UserArgs_MT32x32x64_MI16x16x1_SN_LDSB0_CLR1_GRVWA8_GRVWB8_GSU0_GSUC0_GSUWGMRR0_K1_LBSPPA128_LBSPPB256_LPA8_LPB16_LRVW8_MIWT1_1_PLR1_SU0_SUM0_SUS64_VWA1_VWB1_WGM1_WGMXCC1_WGMXCCGn1
    SolutionIndex: 51
    SolutionNameMin: Cijk_Alik_Bjlk_F8B8NBS_BH_Bias_HAS_SAV_UserArgs_MT32x32x64_MI16x16x1_SN_LDSB0_CLR1_GRVWA8_GRVWB8_GSU0_GSUC0_GSUWGMRR0_K1_LBSPPA128_LBSPPB256_LPA8_LPB16_LRVW8_MIWT1_1_PLR1_SU0_SUM0_SUS64_VWA1_VWB1_WGM8_WGMXCC1_WGMXCCGn1
    SolutionIndex: 52
    SolutionNameMin: Cijk_Alik_Bjlk_F8B8NBS_BH_Bias_HAS_SAV_UserArgs_MT128x256x128_MI16x16x1_SN_LDSB1_CLR1_GRVWA8_GRVWB16_GSU0_GSUC0_GSUWGMRR0_K1_LBSPPA512_LBSPPB2048_LPA8_LPB0_LRVW8_MIWT4_8_PLR1_SU0_SUM0_SUS128_VWA4_VWB8_WGM1_WGMXCC1_WGMXCCGn1
    SolutionIndex: 53
    SolutionNameMin: Cijk_Alik_Bjlk_F8B8NBS_BH_Bias_HAS_SAV_UserArgs_MT128x256x128_MI16x16x1_SN_LDSB1_CLR1_GRVWA16_GRVWB16_GSU0_GSUC0_GSUWGMRR0_K1_LBSPPA512_LBSPPB2048_LPA16_LPB0_LRVW8_MIWT4_8_PLR1_SU0_SUM0_SUS128_VWA4_VWB8_WGM1_WGMXCC1_WGMXCCGn1
    SolutionIndex: 54
    SolutionNameMin: Cijk_Alik_Bjlk_F8B8NBS_BH_Bias_HAS_SAV_UserArgs_MT128x256x128_MI16x16x1_SN_LDSB1_CLR1_GRVWA8_GRVWB16_GSU0_GSUC0_GSUWGMRR0_K1_LBSPPA512_LBSPPB2048_LPA8_LPB0_LRVW8_MIWT4_8_PLR1_SU0_SUM0_SUS128_VWA4_VWB8_WGM4_WGMXCC1_WGMXCCGn1
    SolutionIndex: 55
    SolutionNameMin: Cijk_Alik_Bjlk_F8B8NBS_BH_Bias_HAS_SAV_UserArgs_MT128x256x128_MI16x16x1_SN_LDSB1_CLR1_GRVWA16_GRVWB16_GSU0_GSUC0_GSUWGMRR0_K1_LBSPPA512_LBSPPB2048_LPA16_LPB0_LRVW8_MIWT4_8_PLR1_SU0_SUM0_SUS128_VWA4_VWB8_WGM4_WGMXCC1_WGMXCCGn1
    SolutionIndex: 56
    SolutionNameMin: Cijk_Alik_Bjlk_F8B8NBS_BH_Bias_HAS_SAV_UserArgs_MT128x256x128_MI16x16x1_SN_LDSB1_CLR1_GRVWA8_GRVWB16_GSU0_GSUC0_GSUWGMRR0_K1_LBSPPA512_LBSPPB2048_LPA8_LPB0_LRVW8_MIWT4_8_PLR1_SU0_SUM0_SUS128_VWA4_VWB8_WGM6_WGMXCC1_WGMXCCGn1
    SolutionIndex: 57
    SolutionNameMin: Cijk_Alik_Bjlk_F8B8NBS_BH_Bias_HAS_SAV_UserArgs_MT128x256x128_MI16x16x1_SN_LDSB1_CLR1_GRVWA8_GRVWB16_GSU0_GSUC0_GSUWGMRR0_K1_LBSPPA512_LBSPPB2048_LPA8_LPB0_LRVW8_MIWT4_8_PLR1_SU0_SUM0_SUS128_VWA4_VWB8_WGM8_WGMXCC1_WGMXCCGn1
    SolutionIndex: 58
    SolutionNameMin: Cijk_Alik_Bjlk_F8B8NBS_BH_Bias_HAS_SAV_UserArgs_MT256x128x128_MI16x16x1_SN_LDSB1_CLR1_GRVWA16_GRVWB16_GSU0_GSUC0_GSUWGMRR0_K1_LBSPPA1024_LBSPPB1024_LPA16_LPB64_LRVW8_MIWT8_4_PLR1_SU0_SUM0_SUS128_VWA8_VWB4_WGM1_WGMXCC1_WGMXCCGn1
    SolutionIndex: 59
    SolutionNameMin: Cijk_Alik_Bjlk_F8B8NBS_BH_Bias_HAS_SAV_UserArgs_MT256x128x128_MI16x16x1_SN_LDSB1_CLR1_GRVWA8_GRVWB16_GSU0_GSUC0_GSUWGMRR0_K1_LBSPPA1024_LBSPPB1024_LPA8_LPB64_LRVW8_MIWT8_4_PLR1_SU0_SUM0_SUS128_VWA8_VWB4_WGM4_WGMXCC1_WGMXCCGn1
    SolutionIndex: 60
    SolutionNameMin: Cijk_Alik_Bjlk_F8B8NBS_BH_Bias_HAS_SAV_UserArgs_MT144x256x128_MI16x16x1_SN_LDSB1_CLR1_GRVWA8_GRVWB8_GSU0_GSUC0_GSUWGMRR0_K1_LBSPPA128_LBSPPB2048_LPA8_LPB64_LRVW8_MIWT9_4_PLR1_SU0_SUM0_SUS128_VWA1_VWB4_WGM1_WGMXCC1_WGMXCCGn1
    SolutionIndex: 61
    SolutionNameMin: Cijk_Alik_Bjlk_F8B8NBS_BH_Bias_HAS_SAV_UserArgs_MT144x256x128_MI16x16x1_SN_LDSB1_CLR1_GRVWA8_GRVWB8_GSU0_GSUC0_GSUWGMRR0_K1_LBSPPA128_LBSPPB2048_LPA8_LPB64_LRVW8_MIWT9_4_PLR1_SU0_SUM0_SUS128_VWA1_VWB4_WGM4_WGMXCC1_WGMXCCGn1
    SolutionIndex: 62
    SolutionNameMin: Cijk_Alik_Bjlk_F8B8NBS_BH_Bias_HAS_SAV_UserArgs_MT144x256x128_MI16x16x1_SN_LDSB1_CLR1_GRVWA8_GRVWB16_GSU0_GSUC0_GSUWGMRR0_K1_LBSPPA128_LBSPPB2048_LPA8_LPB64_LRVW8_MIWT9_4_PLR1_SU0_SUM0_SUS128_VWA1_VWB4_WGM4_WGMXCC1_WGMXCCGn1
    SolutionIndex: 63
    SolutionNameMin: Cijk_Alik_Bjlk_F8B8NBS_BH_Bias_HAS_SAV_UserArgs_MT144x256x128_MI16x16x1_SN_LDSB1_CLR1_GRVWA8_GRVWB8_GSU0_GSUC0_GSUWGMRR0_K1_LBSPPA128_LBSPPB2048_LPA8_LPB64_LRVW8_MIWT9_4_PLR1_SU0_SUM0_SUS128_VWA1_VWB4_WGM6_WGMXCC1_WGMXCCGn1
    SolutionIndex: 64
    SolutionNameMin: Cijk_Alik_Bjlk_F8B8NBS_BH_Bias_HAS_SAV_UserArgs_MT144x256x128_MI16x16x1_SN_LDSB1_CLR1_GRVWA8_GRVWB16_GSU0_GSUC0_GSUWGMRR0_K1_LBSPPA128_LBSPPB2048_LPA8_LPB64_LRVW8_MIWT9_4_PLR1_SU0_SUM0_SUS128_VWA1_VWB4_WGM6_WGMXCC1_WGMXCCGn1
    SolutionIndex: 65
    SolutionNameMin: Cijk_Alik_Bjlk_F8B8NBS_BH_Bias_HAS_SAV_UserArgs_MT144x256x128_MI16x16x1_SN_LDSB1_CLR1_GRVWA8_GRVWB16_GSU0_GSUC0_GSUWGMRR0_K1_LBSPPA128_LBSPPB2048_LPA8_LPB64_LRVW8_MIWT9_4_PLR1_SU0_SUM0_SUS128_VWA1_VWB4_WGM8_WGMXCC1_WGMXCCGn1
    SolutionIndex: 66
    SolutionNameMin: Cijk_Alik_Bjlk_F8B8NBS_BH_Bias_HAS_SAV_UserArgs_MT128x128x128_MI16x16x1_SN_LDSB1_CLR1_GRVWA8_GRVWB8_GSU0_GSUC0_GSUWGMRR0_K1_LBSPPA1024_LBSPPB1024_LPA8_LPB32_LRVW8_MIWT8_2_PLR1_SU0_SUM0_SUS128_VWA8_VWB2_WGM1_WGMXCC1_WGMXCCGn1
    SolutionIndex: 67
    SolutionNameMin: Cijk_Alik_Bjlk_F8B8NBS_BH_Bias_HAS_SAV_UserArgs_MT128x128x128_MI16x16x1_SN_LDSB1_CLR1_GRVWA8_GRVWB16_GSU0_GSUC0_GSUWGMRR0_K1_LBSPPA1024_LBSPPB1024_LPA8_LPB32_LRVW8_MIWT8_2_PLR1_SU0_SUM0_SUS128_VWA8_VWB2_WGM1_WGMXCC1_WGMXCCGn1
    SolutionIndex: 68
    SolutionNameMin: Cijk_Alik_Bjlk_F8B8NBS_BH_Bias_HAS_SAV_UserArgs_MT144x64x128_MI16x16x1_SN_LDSB1_CLR1_GRVWA8_GRVWB16_GSU0_GSUC0_GSUWGMRR0_K1_LBSPPA128_LBSPPB512_LPA8_LPB16_LRVW8_MIWT9_1_PLR1_SU0_SUM0_SUS128_VWA1_VWB1_WGM8_WGMXCC1_WGMXCCGn1
    SolutionIndex: 69
    SolutionNameMin: Cijk_Alik_Bjlk_F8B8NBS_BH_Bias_HAS_SAV_UserArgs_MT144x128x128_MI16x16x1_SN_LDSB1_CLR1_GRVWA8_GRVWB16_GSU0_GSUC0_GSUWGMRR0_K1_LBSPPA128_LBSPPB1024_LPA8_LPB32_LRVW8_MIWT9_2_PLR1_SU0_SUM0_SUS128_VWA1_VWB2_WGM4_WGMXCC1_WGMXCCGn1
    SolutionIndex: 70
    SolutionNameMin: Cijk_Alik_Bjlk_F8B8NBS_BH_Bias_HAS_SAV_UserArgs_MT144x128x128_MI16x16x1_SN_LDSB1_CLR1_GRVWA8_GRVWB16_GSU0_GSUC0_GSUWGMRR0_K1_LBSPPA128_LBSPPB1024_LPA8_LPB32_LRVW8_MIWT9_2_PLR1_SU0_SUM0_SUS128_VWA1_VWB2_WGM6_WGMXCC1_WGMXCCGn1
    SolutionIndex: 71
    SolutionNameMin: Cijk_Alik_Bjlk_F8B8NBS_BH_Bias_HAS_SAV_UserArgs_MT144x128x128_MI16x16x1_SN_LDSB1_CLR1_GRVWA8_GRVWB16_GSU0_GSUC0_GSUWGMRR0_K1_LBSPPA128_LBSPPB1024_LPA8_LPB32_LRVW8_MIWT9_2_PLR1_SU0_SUM0_SUS128_VWA1_VWB2_WGM8_WGMXCC1_WGMXCCGn1
    SolutionIndex: 72
    SolutionNameMin: Cijk_Alik_Bjlk_F8B8NBS_BH_Bias_HAS_SAV_UserArgs_MT128x128x128_MI16x16x1_SN_LDSB1_CLR1_GRVWA16_GRVWB16_GSU0_GSUC0_GSUWGMRR0_K1_LBSPPA512_LBSPPB1024_LPA16_LPB64_LRVW8_MIWT4_4_PLR1_SU0_SUM0_SUS128_VWA4_VWB4_WGM1_WGMXCC1_WGMXCCGn1
    SolutionIndex: 73
    SolutionNameMin: Cijk_Alik_Bjlk_F8B8NBS_BH_Bias_HAS_SAV_UserArgs_MT128x128x128_MI16x16x1_SN_LDSB1_CLR1_GRVWA16_GRVWB16_GSU0_GSUC0_GSUWGMRR0_K1_LBSPPA512_LBSPPB1024_LPA16_LPB64_LRVW8_MIWT4_4_PLR1_SU0_SUM0_SUS128_VWA4_VWB4_WGM4_WGMXCC1_WGMXCCGn1
    SolutionIndex: 74
    SolutionNameMin: Cijk_Alik_Bjlk_F8B8NBS_BH_Bias_HAS_SAV_UserArgs_MT128x128x128_MI16x16x1_SN_LDSB1_CLR1_GRVWA16_GRVWB8_GSU0_GSUC0_GSUWGMRR0_K1_LBSPPA512_LBSPPB1024_LPA16_LPB64_LRVW8_MIWT4_4_PLR1_SU0_SUM0_SUS128_VWA4_VWB4_WGM6_WGMXCC1_WGMXCCGn1
    SolutionIndex: 75
    SolutionNameMin: Cijk_Alik_Bjlk_F8B8NBS_BH_Bias_HAS_SAV_UserArgs_MT128x128x128_MI16x16x1_SN_LDSB1_CLR1_GRVWA16_GRVWB16_GSU0_GSUC0_GSUWGMRR0_K1_LBSPPA512_LBSPPB1024_LPA16_LPB64_LRVW8_MIWT4_4_PLR1_SU0_SUM0_SUS128_VWA4_VWB4_WGM6_WGMXCC1_WGMXCCGn1
    SolutionIndex: 76
    SolutionNameMin: Cijk_Alik_Bjlk_F8B8NBS_BH_Bias_HAS_SAV_UserArgs_MT128x128x128_MI16x16x1_SN_LDSB1_CLR1_GRVWA16_GRVWB16_GSU0_GSUC0_GSUWGMRR0_K1_LBSPPA512_LBSPPB1024_LPA16_LPB64_LRVW8_MIWT4_4_PLR1_SU0_SUM0_SUS128_VWA4_VWB4_WGM8_WGMXCC1_WGMXCCGn1
    SolutionIndex: 77
    SolutionNameMin: Cijk_Alik_Bjlk_F8B8NBS_BH_Bias_HAS_SAV_UserArgs_MT64x128x128_MI16x16x1_SN_LDSB1_CLR1_GRVWA8_GRVWB16_GSU0_GSUC0_GSUWGMRR0_K1_LBSPPA256_LBSPPB1024_LPA8_LPB64_LRVW8_MIWT2_4_PLR1_SU0_SUM0_SUS128_VWA2_VWB4_WGM1_WGMXCC1_WGMXCCGn1
    SolutionIndex: 78
    SolutionNameMin: Cijk_Alik_Bjlk_F8B8NBS_BH_Bias_HAS_SAV_UserArgs_MT64x64x128_MI16x16x1_SN_LDSB1_CLR1_GRVWA16_GRVWB8_GSU0_GSUC0_GSUWGMRR0_K1_LBSPPA256_LBSPPB512_LPA16_LPB32_LRVW8_MIWT2_2_PLR1_SU0_SUM0_SUS128_VWA2_VWB2_WGM1_WGMXCC1_WGMXCCGn1
    SolutionIndex: 79
    SolutionNameMin: Cijk_Alik_Bjlk_F8B8NBS_BH_Bias_HAS_SAV_UserArgs_MT64x64x128_MI16x16x1_SN_LDSB1_CLR1_GRVWA8_GRVWB16_GSU0_GSUC0_GSUWGMRR0_K1_LBSPPA256_LBSPPB512_LPA8_LPB32_LRVW8_MIWT2_2_PLR1_SU0_SUM0_SUS128_VWA2_VWB2_WGM1_WGMXCC1_WGMXCCGn1
    SolutionIndex: 80
    SolutionNameMin: Cijk_Alik_Bjlk_F8B8NBS_BH_Bias_HAS_SAV_UserArgs_MT64x64x128_MI16x16x1_SN_LDSB1_CLR1_GRVWA16_GRVWB16_GSU0_GSUC0_GSUWGMRR0_K1_LBSPPA256_LBSPPB512_LPA16_LPB32_LRVW8_MIWT2_2_PLR1_SU0_SUM0_SUS128_VWA2_VWB2_WGM1_WGMXCC1_WGMXCCGn1
    SolutionIndex: 81
    SolutionNameMin: Cijk_Alik_Bjlk_F8B8NBS_BH_Bias_HAS_SAV_UserArgs_MT64x64x128_MI16x16x1_SN_LDSB1_CLR1_GRVWA8_GRVWB16_GSU0_GSUC0_GSUWGMRR0_K1_LBSPPA256_LBSPPB512_LPA8_LPB32_LRVW8_MIWT2_2_PLR1_SU0_SUM0_SUS128_VWA2_VWB2_WGM4_WGMXCC1_WGMXCCGn1
    SolutionIndex: 82
    SolutionNameMin: Cijk_Alik_Bjlk_F8B8NBS_BH_Bias_HAS_SAV_UserArgs_MT32x64x128_MI16x16x1_SN_LDSB0_CLR1_GRVWA8_GRVWB8_GSU0_GSUC0_GSUWGMRR0_K1_LBSPPA128_LBSPPB512_LPA8_LPB32_LRVW8_MIWT1_2_PLR1_SU0_SUM0_SUS128_VWA1_VWB2_WGM1_WGMXCC1_WGMXCCGn1
    SolutionIndex: 83
    SolutionNameMin: Cijk_Alik_Bjlk_F8B8NBS_BH_Bias_HAS_SAV_UserArgs_MT32x64x128_MI16x16x1_SN_LDSB0_CLR1_GRVWA16_GRVWB8_GSU0_GSUC0_GSUWGMRR0_K1_LBSPPA128_LBSPPB512_LPA16_LPB32_LRVW8_MIWT1_2_PLR1_SU0_SUM0_SUS128_VWA1_VWB2_WGM1_WGMXCC1_WGMXCCGn1
    SolutionIndex: 84
    SolutionNameMin: Cijk_Alik_Bjlk_F8B8NBS_BH_Bias_HAS_SAV_UserArgs_MT32x64x128_MI16x16x1_SN_LDSB0_CLR1_GRVWA8_GRVWB16_GSU0_GSUC0_GSUWGMRR0_K1_LBSPPA128_LBSPPB512_LPA8_LPB32_LRVW8_MIWT1_2_PLR1_SU0_SUM0_SUS128_VWA1_VWB2_WGM4_WGMXCC1_WGMXCCGn1
    SolutionIndex: 85
    SolutionNameMin: Cijk_Alik_Bjlk_F8B8NBS_BH_Bias_HAS_SAV_UserArgs_MT64x32x128_MI16x16x1_SN_LDSB0_CLR1_GRVWA8_GRVWB8_GSU0_GSUC0_GSUWGMRR0_K1_LBSPPA256_LBSPPB256_LPA8_LPB16_LRVW8_MIWT2_1_PLR1_SU0_SUM0_SUS128_VWA2_VWB1_WGM1_WGMXCC1_WGMXCCGn1
    SolutionIndex: 86
    SolutionNameMin: Cijk_Alik_Bjlk_F8B8NBS_BH_Bias_HAS_SAV_UserArgs_MT64x32x128_MI16x16x1_SN_LDSB0_CLR1_GRVWA16_GRVWB8_GSU0_GSUC0_GSUWGMRR0_K1_LBSPPA256_LBSPPB256_LPA16_LPB16_LRVW8_MIWT2_1_PLR1_SU0_SUM0_SUS128_VWA2_VWB1_WGM1_WGMXCC1_WGMXCCGn1
    SolutionIndex: 87
    SolutionNameMin: Cijk_Alik_Bjlk_F8B8NBS_BH_Bias_HAS_SAV_UserArgs_MT64x32x128_MI16x16x1_SN_LDSB0_CLR1_GRVWA8_GRVWB16_GSU0_GSUC0_GSUWGMRR0_K1_LBSPPA256_LBSPPB256_LPA8_LPB16_LRVW8_MIWT2_1_PLR1_SU0_SUM0_SUS128_VWA2_VWB1_WGM1_WGMXCC1_WGMXCCGn1
    SolutionIndex: 88
    SolutionNameMin: Cijk_Alik_Bjlk_F8B8NBS_BH_Bias_HAS_SAV_UserArgs_MT64x32x128_MI16x16x1_SN_LDSB0_CLR1_GRVWA8_GRVWB16_GSU0_GSUC0_GSUWGMRR0_K1_LBSPPA256_LBSPPB256_LPA8_LPB16_LRVW8_MIWT2_1_PLR1_SU0_SUM0_SUS128_VWA2_VWB1_WGM4_WGMXCC1_WGMXCCGn1
    SolutionIndex: 89
    SolutionNameMin: Cijk_Alik_Bjlk_F8B8NBS_BH_Bias_HAS_SAV_UserArgs_MT64x32x128_MI16x16x1_SN_LDSB0_CLR1_GRVWA8_GRVWB16_GSU0_GSUC0_GSUWGMRR0_K1_LBSPPA256_LBSPPB256_LPA8_LPB16_LRVW8_MIWT2_1_PLR1_SU0_SUM0_SUS128_VWA2_VWB1_WGM8_WGMXCC1_WGMXCCGn1
    SolutionIndex: 90
    SolutionNameMin: Cijk_Alik_Bjlk_F8B8NBS_BH_Bias_HAS_SAV_UserArgs_MT32x32x128_MI16x16x1_SN_LDSB0_CLR1_GRVWA8_GRVWB8_GSU0_GSUC0_GSUWGMRR0_K1_LBSPPA128_LBSPPB256_LPA8_LPB16_LRVW8_MIWT1_1_PLR1_SU0_SUM0_SUS128_VWA1_VWB1_WGM1_WGMXCC1_WGMXCCGn1
    SolutionIndex: 91
    SolutionNameMin: Cijk_Alik_Bjlk_F8B8NBS_BH_Bias_HAS_SAV_UserArgs_MT32x32x128_MI16x16x1_SN_LDSB0_CLR1_GRVWA16_GRVWB8_GSU0_GSUC0_GSUWGMRR0_K1_LBSPPA128_LBSPPB256_LPA16_LPB16_LRVW8_MIWT1_1_PLR1_SU0_SUM0_SUS128_VWA1_VWB1_WGM1_WGMXCC1_WGMXCCGn1
    SolutionIndex: 92
    SolutionNameMin: Cijk_Alik_Bjlk_F8B8NBS_BH_Bias_HAS_SAV_UserArgs_MT32x32x128_MI16x16x1_SN_LDSB0_CLR1_GRVWA8_GRVWB16_GSU0_GSUC0_GSUWGMRR0_K1_LBSPPA128_LBSPPB256_LPA8_LPB16_LRVW8_MIWT1_1_PLR1_SU0_SUM0_SUS128_VWA1_VWB1_WGM1_WGMXCC1_WGMXCCGn1
    SolutionIndex: 93
    SolutionNameMin: Cijk_Alik_Bjlk_F8B8NBS_BH_Bias_HAS_SAV_UserArgs_MT32x32x128_MI16x16x1_SN_LDSB0_CLR1_GRVWA8_GRVWB8_GSU0_GSUC0_GSUWGMRR0_K1_LBSPPA128_LBSPPB256_LPA8_LPB16_LRVW8_MIWT1_1_PLR1_SU0_SUM0_SUS128_VWA1_VWB1_WGM6_WGMXCC1_WGMXCCGn1
    SolutionIndex: 94
    SolutionNameMin: Cijk_Alik_Bjlk_F8B8NBS_BH_Bias_HAS_SAV_UserArgs_MT32x32x128_MI16x16x1_SN_LDSB0_CLR1_GRVWA8_GRVWB16_GSU0_GSUC0_GSUWGMRR0_K1_LBSPPA128_LBSPPB256_LPA8_LPB16_LRVW8_MIWT1_1_PLR1_SU0_SUM0_SUS128_VWA1_VWB1_WGM8_WGMXCC1_WGMXCCGn1
    SolutionIndex: 95
    SolutionNameMin: Cijk_Alik_Bjlk_F8B8NBS_BH_Bias_HAS_SAV_UserArgs_MT128x64x256_MI16x16x1_SN_LDSB1_CLR1_GRVWA16_GRVWB16_GSU0_GSUC0_GSUWGMRR0_K1_LBSPPA1024_LBSPPB512_LPA16_LPB32_LRVW8_MIWT4_2_PLR1_SU0_SUM0_SUS256_VWA4_VWB2_WGM1_WGMXCC1_WGMXCCGn1
    SolutionIndex: 96
    SolutionNameMin: Cijk_Alik_Bjlk_F8B8NBS_BH_Bias_HAS_SAV_UserArgs_MT128x64x256_MI16x16x1_SN_LDSB1_CLR1_GRVWA16_GRVWB16_GSU0_GSUC0_GSUWGMRR0_K1_LBSPPA1024_LBSPPB512_LPA16_LPB32_LRVW8_MIWT4_2_PLR1_SU0_SUM0_SUS256_VWA4_VWB2_WGM4_WGMXCC1_WGMXCCGn1
    SolutionIndex: 97
    SolutionNameMin: Cijk_Alik_Bjlk_F8B8NBS_BH_Bias_HAS_SAV_UserArgs_MT128x64x256_MI16x16x1_SN_LDSB1_CLR1_GRVWA16_GRVWB16_GSU0_GSUC0_GSUWGMRR0_K1_LBSPPA1024_LBSPPB512_LPA16_LPB32_LRVW8_MIWT4_2_PLR1_SU0_SUM0_SUS256_VWA4_VWB2_WGM6_WGMXCC1_WGMXCCGn1
    SolutionIndex: 98
    SolutionNameMin: Cijk_Alik_Bjlk_F8B8NBS_BH_Bias_HAS_SAV_UserArgs_MT128x64x256_MI16x16x1_SN_LDSB1_CLR1_GRVWA16_GRVWB16_GSU0_GSUC0_GSUWGMRR0_K1_LBSPPA1024_LBSPPB512_LPA16_LPB32_LRVW8_MIWT4_2_PLR1_SU0_SUM0_SUS256_VWA4_VWB2_WGM8_WGMXCC1_WGMXCCGn1
    SolutionIndex: 99
    SolutionNameMin: Cijk_Alik_Bjlk_F8B8NBS_BH_Bias_HAS_SAV_UserArgs_MT64x64x256_MI16x16x1_SN_LDSB1_CLR1_GRVWA16_GRVWB16_GSU0_GSUC0_GSUWGMRR0_K1_LBSPPA512_LBSPPB512_LPA16_LPB32_LRVW8_MIWT2_2_PLR1_SU0_SUM0_SUS256_VWA2_VWB2_WGM1_WGMXCC1_WGMXCCGn1
    SolutionIndex: 100
    SolutionNameMin: Cijk_Alik_Bjlk_F8B8NBS_BH_Bias_HAS_SAV_UserArgs_MT64x64x256_MI16x16x1_SN_LDSB1_CLR1_GRVWA16_GRVWB16_GSU0_GSUC0_GSUWGMRR0_K1_LBSPPA512_LBSPPB512_LPA16_LPB32_LRVW8_MIWT2_2_PLR1_SU0_SUM0_SUS256_VWA2_VWB2_WGM4_WGMXCC1_WGMXCCGn1
    SolutionIndex: 101
    SolutionNameMin: Cijk_Alik_Bjlk_F8B8NBS_BH_Bias_HAS_SAV_UserArgs_MT64x64x256_MI16x16x1_SN_LDSB1_CLR1_GRVWA16_GRVWB16_GSU0_GSUC0_GSUWGMRR0_K1_LBSPPA512_LBSPPB512_LPA16_LPB32_LRVW8_MIWT2_2_PLR1_SU0_SUM0_SUS256_VWA2_VWB2_WGM6_WGMXCC1_WGMXCCGn1
    SolutionIndex: 102
    SolutionNameMin: Cijk_Alik_Bjlk_F8B8NBS_BH_Bias_HAS_SAV_UserArgs_MT64x64x256_MI16x16x1_SN_LDSB1_CLR1_GRVWA16_GRVWB16_GSU0_GSUC0_GSUWGMRR0_K1_LBSPPA512_LBSPPB512_LPA16_LPB32_LRVW8_MIWT2_2_PLR1_SU0_SUM0_SUS256_VWA2_VWB2_WGM8_WGMXCC1_WGMXCCGn1
    SolutionIndex: 103
    SolutionNameMin: Cijk_Alik_Bjlk_F8B8NBS_BH_Bias_HAS_SAV_UserArgs_MT32x64x256_MI16x16x1_SN_LDSB1_CLR1_GRVWA16_GRVWB16_GSU0_GSUC0_GSUWGMRR0_K1_LBSPPA256_LBSPPB512_LPA16_LPB32_LRVW8_MIWT1_2_PLR1_SU0_SUM0_SUS256_VWA1_VWB2_WGM1_WGMXCC1_WGMXCCGn1
    SolutionIndex: 104
    SolutionNameMin: Cijk_Alik_Bjlk_F8B8NBS_BH_Bias_HAS_SAV_UserArgs_MT32x64x256_MI16x16x1_SN_LDSB1_CLR1_GRVWA8_GRVWB16_GSU0_GSUC0_GSUWGMRR0_K1_LBSPPA256_LBSPPB512_LPA8_LPB32_LRVW8_MIWT1_2_PLR1_SU0_SUM0_SUS256_VWA1_VWB2_WGM4_WGMXCC1_WGMXCCGn1
    SolutionIndex: 105
    SolutionNameMin: Cijk_Alik_Bjlk_F8B8NBS_BH_Bias_HAS_SAV_UserArgs_MT32x64x256_MI16x16x1_SN_LDSB1_CLR1_GRVWA8_GRVWB16_GSU0_GSUC0_GSUWGMRR0_K1_LBSPPA256_LBSPPB512_LPA8_LPB32_LRVW8_MIWT1_2_PLR1_SU0_SUM0_SUS256_VWA1_VWB2_WGM6_WGMXCC1_WGMXCCGn1
    SolutionIndex: 106
    SolutionNameMin: Cijk_Alik_Bjlk_F8B8NBS_BH_Bias_HAS_SAV_UserArgs_MT32x64x256_MI16x16x1_SN_LDSB1_CLR1_GRVWA16_GRVWB16_GSU0_GSUC0_GSUWGMRR0_K1_LBSPPA256_LBSPPB512_LPA16_LPB32_LRVW8_MIWT1_2_PLR1_SU0_SUM0_SUS256_VWA1_VWB2_WGM6_WGMXCC1_WGMXCCGn1
    SolutionIndex: 107
    SolutionNameMin: Cijk_Alik_Bjlk_F8B8NBS_BH_Bias_HAS_SAV_UserArgs_MT64x32x256_MI16x16x1_SN_LDSB1_CLR1_GRVWA16_GRVWB16_GSU0_GSUC0_GSUWGMRR0_K1_LBSPPA512_LBSPPB256_LPA16_LPB16_LRVW8_MIWT2_1_PLR1_SU0_SUM0_SUS256_VWA2_VWB1_WGM4_WGMXCC1_WGMXCCGn1
    SolutionIndex: 108
    SolutionNameMin: Cijk_Alik_Bjlk_F8B8NBS_BH_Bias_HAS_SAV_UserArgs_MT32x32x256_MI16x16x1_SN_LDSB1_CLR1_GRVWA8_GRVWB8_GSU0_GSUC0_GSUWGMRR0_K1_LBSPPA256_LBSPPB256_LPA8_LPB16_LRVW8_MIWT1_1_PLR1_SU0_SUM0_SUS256_VWA1_VWB1_WGM1_WGMXCC1_WGMXCCGn1
    SolutionIndex: 109
    SolutionNameMin: Cijk_Alik_Bjlk_F8B8NBS_BH_Bias_HAS_SAV_UserArgs_MT32x32x256_MI16x16x1_SN_LDSB1_CLR1_GRVWA8_GRVWB16_GSU0_GSUC0_GSUWGMRR0_K1_LBSPPA256_LBSPPB256_LPA8_LPB16_LRVW8_MIWT1_1_PLR1_SU0_SUM0_SUS256_VWA1_VWB1_WGM1_WGMXCC1_WGMXCCGn1
    SolutionIndex: 110
    SolutionNameMin: Cijk_Alik_Bjlk_F8B8NBS_BH_Bias_HAS_SAV_UserArgs_MT32x32x256_MI16x16x1_SN_LDSB1_CLR1_GRVWA16_GRVWB16_GSU0_GSUC0_GSUWGMRR0_K1_LBSPPA256_LBSPPB256_LPA16_LPB16_LRVW8_MIWT1_1_PLR1_SU0_SUM0_SUS256_VWA1_VWB1_WGM1_WGMXCC1_WGMXCCGn1
    SolutionIndex: 111
    SolutionNameMin: Cijk_Alik_Bjlk_F8B8NBS_BH_Bias_HAS_SAV_UserArgs_MT32x32x256_MI16x16x1_SN_LDSB1_CLR1_GRVWA16_GRVWB16_GSU0_GSUC0_GSUWGMRR0_K1_LBSPPA256_LBSPPB256_LPA16_LPB16_LRVW8_MIWT1_1_PLR1_SU0_SUM0_SUS256_VWA1_VWB1_WGM6_WGMXCC1_WGMXCCGn1
- - - [128, 128, 1, 128, 128, 128, 128, 128]
    - [90, 0.53]
  - - [128, 128, 1, 256, 128, 128, 256, 128]
    - [50, 0.99]
  - - [128, 128, 1, 512, 128, 128, 512, 128]
    - [90, 1.69]
  - - [128, 128, 1, 1024, 128, 128, 1024, 128]
    - [90, 2.72]
  - - [128, 128, 1, 2048, 128, 128, 2048, 128]
    - [92, 3.79]
  - - [128, 128, 1, 4096, 128, 128, 4096, 128]
    - [92, 4.78]
  - - [128, 128, 1, 8192, 128, 128, 8192, 128]
    - [92, 5.5]
  - - [128, 256, 1, 128, 128, 128, 128, 256]
    - [91, 1.1]
  - - [128, 256, 1, 256, 128, 128, 256, 256]
    - [108, 1.95]
  - - [128, 256, 1, 512, 128, 128, 512, 256]
    - [90, 3.46]
  - - [128, 256, 1, 1024, 128, 128, 1024, 256]
    - [90, 5.5]
  - - [128, 256, 1, 2048, 128, 128, 2048, 256]
    - [92, 7.64]
  - - [128, 256, 1, 4096, 128, 128, 4096, 256]
    - [92, 9.69]
  - - [128, 256, 1, 8192, 128, 128, 8192, 256]
    - [92, 11.07]
  - - [128, 512, 1, 128, 128, 128, 128, 512]
    - [50, 2.22]
  - - [128, 512, 1, 256, 128, 128, 256, 512]
    - [90, 3.98]
  - - [128, 512, 1, 512, 128, 128, 512, 512]
    - [90, 7.04]
  - - [128, 512, 1, 1024, 128, 128, 1024, 512]
    - [92, 10.79]
  - - [128, 512, 1, 2048, 128, 128, 2048, 512]
    - [92, 15.23]
  - - [128, 512, 1, 4096, 128, 128, 4096, 512]
    - [92, 19.17]
  - - [128, 512, 1, 8192, 128, 128, 8192, 512]
    - [109, 18.08]
  - - [128, 1024, 1, 128, 128, 128, 128, 1024]
    - [91, 4.33]
  - - [128, 1024, 1, 256, 128, 128, 256, 1024]
    - [91, 7.8]
  - - [128, 1024, 1, 512, 128, 128, 512, 1024]
    - [90, 13.37]
  - - [128, 1024, 1, 1024, 128, 128, 1024, 1024]
    - [90, 21.02]
  - - [128, 1024, 1, 2048, 128, 128, 2048, 1024]
    - [92, 29.81]
  - - [128, 1024, 1, 4096, 128, 128, 4096, 1024]
    - [110, 30.66]
  - - [128, 1024, 1, 8192, 128, 128, 8192, 1024]
    - [111, 31.63]
  - - [128, 2048, 1, 128, 128, 128, 128, 2048]
    - [82, 7.87]
  - - [128, 2048, 1, 256, 128, 128, 256, 2048]
    - [83, 14.26]
  - - [128, 2048, 1, 512, 128, 128, 512, 2048]
    - [86, 24.12]
  - - [128, 2048, 1, 1024, 128, 128, 1024, 2048]
    - [87, 36.57]
  - - [128, 2048, 1, 2048, 128, 128, 2048, 2048]
    - [103, 43.48]
  - - [128, 2048, 1, 4096, 128, 128, 4096, 2048]
    - [106, 52.12]
  - - [128, 2048, 1, 8192, 128, 128, 8192, 2048]
    - [106, 59.31]
  - - [128, 4096, 1, 128, 128, 128, 128, 4096]
    - [43, 14.49]
  - - [128, 4096, 1, 256, 128, 128, 256, 4096]
    - [43, 25.44]
  - - [128, 4096, 1, 512, 128, 128, 512, 4096]
    - [42, 41.8]
  - - [128, 4096, 1, 1024, 128, 128, 1024, 4096]
    - [79, 63.04]
  - - [128, 4096, 1, 2048, 128, 128, 2048, 4096]
    - [99, 77.23]
  - - [128, 4096, 1, 4096, 128, 128, 4096, 4096]
    - [99, 95.46]
  - - [128, 4096, 1, 8192, 128, 128, 8192, 4096]
    - [99, 107.71]
  - - [128, 8192, 1, 128, 128, 128, 128, 8192]
    - [30, 23.72]
  - - [128, 8192, 1, 256, 128, 128, 256, 8192]
    - [34, 42.14]
  - - [128, 8192, 1, 512, 128, 128, 512, 8192]
    - [36, 68.84]
  - - [128, 8192, 1, 1024, 128, 128, 1024, 8192]
    - [36, 101.67]
  - - [128, 8192, 1, 2048, 128, 128, 2048, 8192]
    - [95, 120.74]
  - - [128, 8192, 1, 4096, 128, 128, 4096, 8192]
    - [77, 143.36]
  - - [128, 8192, 1, 8192, 128, 128, 8192, 8192]
    - [95, 152.69]
  - - [256, 128, 1, 128, 256, 256, 128, 128]
    - [51, 1.05]
  - - [256, 128, 1, 256, 256, 256, 256, 128]
    - [50, 1.99]
  - - [256, 128, 1, 512, 256, 256, 512, 128]
    - [91, 3.42]
  - - [256, 128, 1, 1024, 256, 256, 1024, 128]
    - [90, 5.41]
  - - [256, 128, 1, 2048, 256, 256, 2048, 128]
    - [92, 7.66]
  - - [256, 128, 1, 4096, 256, 256, 4096, 128]
    - [92, 9.68]
  - - [256, 128, 1, 8192, 256, 256, 8192, 128]
    - [92, 11.02]
  - - [256, 256, 1, 128, 256, 256, 128, 256]
    - [47, 2.05]
  - - [256, 256, 1, 256, 256, 256, 256, 256]
    - [93, 3.85]
  - - [256, 256, 1, 512, 256, 256, 512, 256]
    - [91, 6.9]
  - - [256, 256, 1, 1024, 256, 256, 1024, 256]
    - [90, 10.95]
  - - [256, 256, 1, 2048, 256, 256, 2048, 256]
    - [92, 15.21]
  - - [256, 256, 1, 4096, 256, 256, 4096, 256]
    - [92, 19.09]
  - - [256, 256, 1, 8192, 256, 256, 8192, 256]
    - [94, 21.8]
  - - [256, 512, 1, 128, 256, 256, 128, 512]
    - [41, 2.5]
  - - [256, 512, 1, 256, 256, 256, 256, 512]
    - [49, 4.93]
  - - [256, 512, 1, 512, 256, 256, 512, 512]
    - [51, 9.59]
  - - [256, 512, 1, 1024, 256, 256, 1024, 512]
    - [85, 18.81]
  - - [256, 512, 1, 2048, 256, 256, 2048, 512]
    - [92, 29.57]
  - - [256, 512, 1, 4096, 256, 256, 4096, 512]
    - [92, 37.43]
  - - [256, 512, 1, 8192, 256, 256, 8192, 512]
    - [109, 38.51]
  - - [256, 1024, 1, 128, 256, 256, 128, 1024]
    - [32, 5.36]
  - - [256, 1024, 1, 256, 256, 256, 256, 1024]
    - [40, 10.54]
  - - [256, 1024, 1, 512, 256, 256, 512, 1024]
    - [46, 20.52]
  - - [256, 1024, 1, 1024, 256, 256, 1024, 1024]
    - [89, 36.2]
  - - [256, 1024, 1, 2048, 256, 256, 2048, 1024]
    - [87, 51.06]
  - - [256, 1024, 1, 4096, 256, 256, 4096, 1024]
    - [107, 56.8]
  - - [256, 1024, 1, 8192, 256, 256, 8192, 1024]
    - [106, 60.03]
  - - [256, 2048, 1, 128, 256, 256, 128, 2048]
    - [43, 14.59]
  - - [256, 2048, 1, 256, 256, 256, 256, 2048]
    - [43, 25.63]
  - - [256, 2048, 1, 512, 256, 256, 512, 2048]
    - [42, 42.43]
  - - [256, 2048, 1, 1024, 256, 256, 1024, 2048]
    - [79, 63.75]
  - - [256, 2048, 1, 2048, 256, 256, 2048, 2048]
    - [99, 79.52]
  - - [256, 2048, 1, 4096, 256, 256, 4096, 2048]
    - [99, 95.78]
  - - [256, 2048, 1, 8192, 256, 256, 8192, 2048]
    - [99, 108.07]
  - - [256, 4096, 1, 128, 256, 256, 128, 4096]
    - [34, 24.09]
  - - [256, 4096, 1, 256, 256, 256, 256, 4096]
    - [35, 42.36]
  - - [256, 4096, 1, 512, 256, 256, 512, 4096]
    - [36, 69.33]
  - - [256, 4096, 1, 1024, 256, 256, 1024, 4096]
    - [36, 101.52]
  - - [256, 4096, 1, 2048, 256, 256, 2048, 4096]
    - [95, 122.99]
  - - [256, 4096, 1, 4096, 256, 256, 4096, 4096]
    - [95, 148.84]
  - - [256, 4096, 1, 8192, 256, 256, 8192, 4096]
    - [96, 161.55]
  - - [256, 8192, 1, 128, 256, 256, 128, 8192]
    - [67, 36.73]
  - - [256, 8192, 1, 256, 256, 256, 256, 8192]
    - [72, 63.19]
  - - [256, 8192, 1, 512, 256, 256, 512, 8192]
    - [72, 103.38]
  - - [256, 8192, 1, 1024, 256, 256, 1024, 8192]
    - [72, 151.53]
  - - [256, 8192, 1, 2048, 256, 256, 2048, 8192]
    - [72, 180.24]
  - - [256, 8192, 1, 4096, 256, 256, 4096, 8192]
    - [72, 207.56]
  - - [256, 8192, 1, 8192, 256, 256, 8192, 8192]
    - [75, 193.07]
  - - [512, 128, 1, 128, 512, 512, 128, 128]
    - [90, 2.22]
  - - [512, 128, 1, 256, 512, 512, 256, 128]
    - [90, 3.97]
  - - [512, 128, 1, 512, 512, 512, 512, 128]
    - [90, 6.87]
  - - [512, 128, 1, 1024, 512, 512, 1024, 128]
    - [92, 10.84]
  - - [512, 128, 1, 2048, 512, 512, 2048, 128]
    - [90, 15.14]
  - - [512, 128, 1, 4096, 512, 512, 4096, 128]
    - [92, 19.26]
  - - [512, 128, 1, 8192, 512, 512, 8192, 128]
    - [92, 22.0]
  - - [512, 256, 1, 128, 512, 512, 128, 256]
    - [90, 4.25]
  - - [512, 256, 1, 256, 512, 512, 256, 256]
    - [50, 7.91]
  - - [512, 256, 1, 512, 512, 512, 512, 256]
    - [90, 13.63]
  - - [512, 256, 1, 1024, 512, 512, 1024, 256]
    - [90, 21.34]
  - - [512, 256, 1, 2048, 512, 512, 2048, 256]
    - [92, 29.94]
  - - [512, 256, 1, 4096, 512, 512, 4096, 256]
    - [92, 37.71]
  - - [512, 256, 1, 8192, 512, 512, 8192, 256]
    - [94, 43.05]
  - - [512, 512, 1, 128, 512, 512, 128, 512]
    - [47, 7.95]
  - - [512, 512, 1, 256, 512, 512, 256, 512]
    - [86, 14.42]
  - - [512, 512, 1, 512, 512, 512, 512, 512]
    - [85, 24.2]
  - - [512, 512, 1, 1024, 512, 512, 1024, 512]
    - [87, 37.2]
  - - [512, 512, 1, 2048, 512, 512, 2048, 512]
    - [87, 51.33]
  - - [512, 512, 1, 4096, 512, 512, 4096, 512]
    - [88, 62.92]
  - - [512, 512, 1, 8192, 512, 512, 8192, 512]
    - [84, 63.06]
  - - [512, 1024, 1, 128, 512, 512, 128, 1024]
    - [42, 14.41]
  - - [512, 1024, 1, 256, 512, 512, 256, 1024]
    - [43, 25.47]
  - - [512, 1024, 1, 512, 512, 512, 512, 1024]
    - [42, 42.19]
  - - [512, 1024, 1, 1024, 512, 512, 1024, 1024]
    - [80, 63.69]
  - - [512, 1024, 1, 2048, 512, 512, 2048, 1024]
    - [99, 85.87]
  - - [512, 1024, 1, 4096, 512, 512, 4096, 1024]
    - [99, 96.67]
  - - [512, 1024, 1, 8192, 512, 512, 8192, 1024]
    - [101, 106.57]
  - - [512, 2048, 1, 128, 512, 512, 128, 2048]
    - [29, 23.82]
  - - [512, 2048, 1, 256, 512, 512, 256, 2048]
    - [29, 42.03]
  - - [512, 2048, 1, 512, 512, 512, 512, 2048]
    - [36, 68.7]
  - - [512, 2048, 1, 1024, 512, 512, 1024, 2048]
    - [36, 101.3]
  - - [512, 2048, 1, 2048, 512, 512, 2048, 2048]
    - [95, 125.23]
  - - [512, 2048, 1, 4096, 512, 512, 4096, 2048]
    - [96, 149.35]
  - - [512, 2048, 1, 8192, 512, 512, 8192, 2048]
    - [95, 158.2]
  - - [512, 4096, 1, 128, 512, 512, 128, 4096]
    - [66, 36.44]
  - - [512, 4096, 1, 256, 512, 512, 256, 4096]
    - [25, 63.41]
  - - [512, 4096, 1, 512, 512, 512, 512, 4096]
    - [72, 101.28]
  - - [512, 4096, 1, 1024, 512, 512, 1024, 4096]
    - [72, 150.61]
  - - [512, 4096, 1, 2048, 512, 512, 2048, 4096]
    - [72, 185.43]
  - - [512, 4096, 1, 4096, 512, 512, 4096, 4096]
    - [72, 214.07]
  - - [512, 4096, 1, 8192, 512, 512, 8192, 4096]
    - [75, 203.32]
  - - [512, 8192, 1, 128, 512, 512, 128, 8192]
    - [15, 50.61]
  - - [512, 8192, 1, 256, 512, 512, 256, 8192]
    - [18, 87.74]
  - - [512, 8192, 1, 512, 512, 512, 512, 8192]
    - [17, 140.41]
  - - [512, 8192, 1, 1024, 512, 512, 1024, 8192]
    - [17, 192.34]
  - - [512, 8192, 1, 2048, 512, 512, 2048, 8192]
    - [52, 234.85]
  - - [512, 8192, 1, 4096, 512, 512, 4096, 8192]
    - [53, 253.38]
  - - [512, 8192, 1, 8192, 512, 512, 8192, 8192]
    - [53, 236.22]
  - - [1024, 128, 1, 128, 1024, 1024, 128, 128]
    - [50, 4.32]
  - - [1024, 128, 1, 256, 1024, 1024, 256, 128]
    - [90, 7.84]
  - - [1024, 128, 1, 512, 1024, 1024, 512, 128]
    - [90, 13.45]
  - - [1024, 128, 1, 1024, 1024, 1024, 1024, 128]
    - [90, 21.36]
  - - [1024, 128, 1, 2048, 1024, 1024, 2048, 128]
    - [92, 29.79]
  - - [1024, 128, 1, 4096, 1024, 1024, 4096, 128]
    - [92, 37.55]
  - - [1024, 128, 1, 8192, 1024, 1024, 8192, 128]
    - [94, 43.02]
  - - [1024, 256, 1, 128, 1024, 1024, 128, 256]
    - [85, 7.99]
  - - [1024, 256, 1, 256, 1024, 1024, 256, 256]
    - [47, 14.18]
  - - [1024, 256, 1, 512, 1024, 1024, 512, 256]
    - [86, 23.84]
  - - [1024, 256, 1, 1024, 1024, 1024, 1024, 256]
    - [87, 36.95]
  - - [1024, 256, 1, 2048, 1024, 1024, 2048, 256]
    - [87, 51.47]
  - - [1024, 256, 1, 4096, 1024, 1024, 4096, 256]
    - [89, 62.97]
  - - [1024, 256, 1, 8192, 1024, 1024, 8192, 256]
    - [104, 70.8]
  - - [1024, 512, 1, 128, 1024, 1024, 128, 512]
    - [43, 14.45]
  - - [1024, 512, 1, 256, 1024, 1024, 256, 512]
    - [44, 25.11]
  - - [1024, 512, 1, 512, 1024, 1024, 512, 512]
    - [78, 42.2]
  - - [1024, 512, 1, 1024, 1024, 1024, 1024, 512]
    - [79, 64.17]
  - - [1024, 512, 1, 2048, 1024, 1024, 2048, 512]
    - [99, 86.25]
  - - [1024, 512, 1, 4096, 1024, 1024, 4096, 512]
    - [100, 102.7]
  - - [1024, 512, 1, 8192, 1024, 1024, 8192, 512]
    - [102, 107.33]
  - - [1024, 1024, 1, 128, 1024, 1024, 128, 1024]
    - [29, 23.87]
  - - [1024, 1024, 1, 256, 1024, 1024, 256, 1024]
    - [34, 42.22]
  - - [1024, 1024, 1, 512, 1024, 1024, 512, 1024]
    - [37, 68.3]
  - - [1024, 1024, 1, 1024, 1024, 1024, 1024, 1024]
    - [36, 101.12]
  - - [1024, 1024, 1, 2048, 1024, 1024, 2048, 1024]
    - [38, 126.85]
  - - [1024, 1024, 1, 4096, 1024, 1024, 4096, 1024]
    - [96, 146.14]
  - - [1024, 1024, 1, 8192, 1024, 1024, 8192, 1024]
    - [98, 157.16]
  - - [1024, 2048, 1, 128, 1024, 1024, 128, 2048]
    - [67, 36.72]
  - - [1024, 2048, 1, 256, 1024, 1024, 256, 2048]
    - [27, 63.49]
  - - [1024, 2048, 1, 512, 1024, 1024, 512, 2048]
    - [72, 102.7]
  - - [1024, 2048, 1, 1024, 1024, 1024, 1024, 2048]
    - [72, 147.64]
  - - [1024, 2048, 1, 2048, 1024, 1024, 2048, 2048]
    - [72, 186.68]
  - - [1024, 2048, 1, 4096, 1024, 1024, 4096, 2048]
    - [75, 209.18]
  - - [1024, 2048, 1, 8192, 1024, 1024, 8192, 2048]
    - [72, 199.05]
  - - [1024, 4096, 1, 128, 1024, 1024, 128, 4096]
    - [23, 52.96]
  - - [1024, 4096, 1, 256, 1024, 1024, 256, 4096]
    - [23, 91.48]
  - - [1024, 4096, 1, 512, 1024, 1024, 512, 4096]
    - [17, 140.09]
  - - [1024, 4096, 1, 1024, 1024, 1024, 1024, 4096]
    - [18, 187.24]
  - - [1024, 4096, 1, 2048, 1024, 1024, 2048, 4096]
    - [11, 235.75]
  - - [1024, 4096, 1, 4096, 1024, 1024, 4096, 4096]
    - [56, 250.56]
  - - [1024, 4096, 1, 8192, 1024, 1024, 8192, 4096]
    - [59, 233.7]
  - - [1024, 8192, 1, 128, 1024, 1024, 128, 8192]
    - [4, 62.3]
  - - [1024, 8192, 1, 256, 1024, 1024, 256, 8192]
    - [4, 107.11]
  - - [1024, 8192, 1, 512, 1024, 1024, 512, 8192]
    - [4, 164.62]
  - - [1024, 8192, 1, 1024, 1024, 1024, 1024, 8192]
    - [9, 227.96]
  - - [1024, 8192, 1, 2048, 1024, 1024, 2048, 8192]
    - [10, 267.66]
  - - [1024, 8192, 1, 4096, 1024, 1024, 4096, 8192]
    - [4, 255.83]
  - - [1024, 8192, 1, 8192, 1024, 1024, 8192, 8192]
    - [2, 280.82]
  - - [2048, 128, 1, 128, 2048, 2048, 128, 128]
    - [48, 7.64]
  - - [2048, 128, 1, 256, 2048, 2048, 256, 128]
    - [86, 13.92]
  - - [2048, 128, 1, 512, 2048, 2048, 512, 128]
    - [85, 23.97]
  - - [2048, 128, 1, 1024, 2048, 2048, 1024, 128]
    - [87, 37.17]
  - - [2048, 128, 1, 2048, 2048, 2048, 2048, 128]
    - [87, 51.16]
  - - [2048, 128, 1, 4096, 2048, 2048, 4096, 128]
    - [89, 62.76]
  - - [2048, 128, 1, 8192, 2048, 2048, 8192, 128]
    - [105, 70.94]
  - - [2048, 256, 1, 128, 2048, 2048, 128, 256]
    - [45, 14.07]
  - - [2048, 256, 1, 256, 2048, 2048, 256, 256]
    - [43, 25.11]
  - - [2048, 256, 1, 512, 2048, 2048, 512, 256]
    - [81, 41.35]
  - - [2048, 256, 1, 1024, 2048, 2048, 1024, 256]
    - [79, 63.09]
  - - [2048, 256, 1, 2048, 2048, 2048, 2048, 256]
    - [100, 85.49]
  - - [2048, 256, 1, 4096, 2048, 2048, 4096, 256]
    - [101, 104.19]
  - - [2048, 256, 1, 8192, 2048, 2048, 8192, 256]
    - [100, 116.7]
  - - [2048, 512, 1, 128, 2048, 2048, 128, 512]
    - [31, 23.64]
  - - [2048, 512, 1, 256, 2048, 2048, 256, 512]
    - [33, 41.57]
  - - [2048, 512, 1, 512, 2048, 2048, 512, 512]
    - [37, 68.26]
  - - [2048, 512, 1, 1024, 2048, 2048, 1024, 512]
    - [37, 101.31]
  - - [2048, 512, 1, 2048, 2048, 2048, 2048, 512]
    - [37, 132.24]
  - - [2048, 512, 1, 4096, 2048, 2048, 4096, 512]
    - [98, 147.79]
  - - [2048, 512, 1, 8192, 2048, 2048, 8192, 512]
    - [98, 158.34]
  - - [2048, 1024, 1, 128, 2048, 2048, 128, 1024]
    - [67, 36.67]
  - - [2048, 1024, 1, 256, 2048, 2048, 256, 1024]
    - [25, 63.62]
  - - [2048, 1024, 1, 512, 2048, 2048, 512, 1024]
    - [72, 102.51]
  - - [2048, 1024, 1, 1024, 2048, 2048, 1024, 1024]
    - [73, 148.54]
  - - [2048, 1024, 1, 2048, 2048, 2048, 2048, 1024]
    - [76, 186.97]
  - - [2048, 1024, 1, 4096, 2048, 2048, 4096, 1024]
    - [75, 204.88]
  - - [2048, 1024, 1, 8192, 2048, 2048, 8192, 1024]
    - [76, 202.16]
  - - [2048, 2048, 1, 128, 2048, 2048, 128, 2048]
    - [16, 50.84]
  - - [2048, 2048, 1, 256, 2048, 2048, 256, 2048]
    - [15, 88.64]
  - - [2048, 2048, 1, 512, 2048, 2048, 512, 2048]
    - [17, 136.11]
  - - [2048, 2048, 1, 1024, 2048, 2048, 1024, 2048]
    - [17, 186.38]
  - - [2048, 2048, 1, 2048, 2048, 2048, 2048, 2048]
    - [13, 234.6]
  - - [2048, 2048, 1, 4096, 2048, 2048, 4096, 2048]
    - [55, 251.47]
  - - [2048, 2048, 1, 8192, 2048, 2048, 8192, 2048]
    - [59, 234.12]
  - - [2048, 4096, 1, 128, 2048, 2048, 128, 4096]
    - [2, 61.6]
  - - [2048, 4096, 1, 256, 2048, 2048, 256, 4096]
    - [2, 105.54]
  - - [2048, 4096, 1, 512, 2048, 2048, 512, 4096]
    - [4, 164.85]
  - - [2048, 4096, 1, 1024, 2048, 2048, 1024, 4096]
    - [1, 221.79]
  - - [2048, 4096, 1, 2048, 2048, 2048, 2048, 4096]
    - [4, 265.68]
  - - [2048, 4096, 1, 4096, 2048, 2048, 4096, 4096]
    - [9, 255.05]
  - - [2048, 4096, 1, 8192, 2048, 2048, 8192, 4096]
    - [3, 277.45]
  - - [2048, 8192, 1, 128, 2048, 2048, 128, 8192]
    - [2, 66.66]
  - - [2048, 8192, 1, 256, 2048, 2048, 256, 8192]
    - [0, 113.64]
  - - [2048, 8192, 1, 512, 2048, 2048, 512, 8192]
    - [10, 177.02]
  - - [2048, 8192, 1, 1024, 2048, 2048, 1024, 8192]
    - [9, 220.9]
  - - [2048, 8192, 1, 2048, 2048, 2048, 2048, 8192]
    - [14, 230.6]
  - - [2048, 8192, 1, 4096, 2048, 2048, 4096, 8192]
    - [3, 269.92]
  - - [2048, 8192, 1, 8192, 2048, 2048, 8192, 8192]
    - [57, 304.7]
  - - [4096, 128, 1, 128, 4096, 4096, 128, 128]
    - [43, 14.21]
  - - [4096, 128, 1, 256, 4096, 4096, 256, 128]
    - [42, 25.84]
  - - [4096, 128, 1, 512, 4096, 4096, 512, 128]
    - [79, 42.96]
  - - [4096, 128, 1, 1024, 4096, 4096, 1024, 128]
    - [79, 64.18]
  - - [4096, 128, 1, 2048, 4096, 4096, 2048, 128]
    - [99, 86.35]
  - - [4096, 128, 1, 4096, 4096, 4096, 4096, 128]
    - [101, 104.42]
  - - [4096, 128, 1, 8192, 4096, 4096, 8192, 128]
    - [102, 117.3]
  - - [4096, 256, 1, 128, 4096, 4096, 128, 256]
    - [29, 24.63]
  - - [4096, 256, 1, 256, 4096, 4096, 256, 256]
    - [34, 42.87]
  - - [4096, 256, 1, 512, 4096, 4096, 512, 256]
    - [36, 70.21]
  - - [4096, 256, 1, 1024, 4096, 4096, 1024, 256]
    - [39, 101.38]
  - - [4096, 256, 1, 2048, 4096, 4096, 2048, 256]
    - [38, 132.77]
  - - [4096, 256, 1, 4096, 4096, 4096, 4096, 256]
    - [98, 146.67]
  - - [4096, 256, 1, 8192, 4096, 4096, 8192, 256]
    - [98, 158.38]
  - - [4096, 512, 1, 128, 4096, 4096, 128, 512]
    - [66, 36.88]
  - - [4096, 512, 1, 256, 4096, 4096, 256, 512]
    - [25, 64.01]
  - - [4096, 512, 1, 512, 4096, 4096, 512, 512]
    - [25, 102.09]
  - - [4096, 512, 1, 1024, 4096, 4096, 1024, 512]
    - [75, 149.71]
  - - [4096, 512, 1, 2048, 4096, 4096, 2048, 512]
    - [73, 191.54]
  - - [4096, 512, 1, 4096, 4096, 4096, 4096, 512]
    - [73, 203.04]
  - - [4096, 512, 1, 8192, 4096, 4096, 8192, 512]
    - [76, 201.09]
  - - [4096, 1024, 1, 128, 4096, 4096, 128, 1024]
    - [18, 50.6]
  - - [4096, 1024, 1, 256, 4096, 4096, 256, 1024]
    - [15, 87.94]
  - - [4096, 1024, 1, 512, 4096, 4096, 512, 1024]
    - [21, 132.98]
  - - [4096, 1024, 1, 1024, 4096, 4096, 1024, 1024]
    - [19, 186.63]
  - - [4096, 1024, 1, 2048, 4096, 4096, 2048, 1024]
    - [56, 235.53]
  - - [4096, 1024, 1, 4096, 4096, 4096, 4096, 1024]
    - [56, 256.64]
  - - [4096, 1024, 1, 8192, 4096, 4096, 8192, 1024]
    - [54, 237.63]
  - - [4096, 2048, 1, 128, 4096, 4096, 128, 2048]
    - [4, 58.88]
  - - [4096, 2048, 1, 256, 4096, 4096, 256, 2048]
    - [4, 101.89]
  - - [4096, 2048, 1, 512, 4096, 4096, 512, 2048]
    - [4, 160.64]
  - - [4096, 2048, 1, 1024, 4096, 4096, 1024, 2048]
    - [10, 224.91]
  - - [4096, 2048, 1, 2048, 4096, 4096, 2048, 2048]
    - [9, 264.82]
  - - [4096, 2048, 1, 4096, 4096, 4096, 4096, 2048]
    - [62, 261.98]
  - - [4096, 2048, 1, 8192, 4096, 4096, 8192, 2048]
    - [62, 287.97]
  - - [4096, 4096, 1, 128, 4096, 4096, 128, 4096]
    - [2, 64.46]
  - - [4096, 4096, 1, 256, 4096, 4096, 256, 4096]
    - [0, 112.75]
  - - [4096, 4096, 1, 512, 4096, 4096, 512, 4096]
    - [3, 171.69]
  - - [4096, 4096, 1, 1024, 4096, 4096, 1024, 4096]
    - [6, 216.67]
  - - [4096, 4096, 1, 2048, 4096, 4096, 2048, 4096]
    - [62, 235.19]
  - - [4096, 4096, 1, 4096, 4096, 4096, 4096, 4096]
    - [60, 274.32]
  - - [4096, 4096, 1, 8192, 4096, 4096, 8192, 4096]
    - [58, 311.59]
  - - [4096, 8192, 1, 128, 4096, 4096, 128, 8192]
    - [2, 71.17]
  - - [4096, 8192, 1, 256, 4096, 4096, 256, 8192]
    - [2, 116.72]
  - - [4096, 8192, 1, 512, 4096, 4096, 512, 8192]
    - [24, 169.77]
  - - [4096, 8192, 1, 1024, 4096, 4096, 1024, 8192]
    - [57, 217.36]
  - - [4096, 8192, 1, 2048, 4096, 4096, 2048, 8192]
    - [56, 266.98]
  - - [4096, 8192, 1, 4096, 4096, 4096, 4096, 8192]
    - [2, 322.07]
  - - [4096, 8192, 1, 8192, 4096, 4096, 8192, 8192]
    - [7, 356.5]
  - - [8192, 128, 1, 128, 8192, 8192, 128, 128]
    - [29, 23.59]
  - - [8192, 128, 1, 256, 8192, 8192, 256, 128]
    - [29, 41.32]
  - - [8192, 128, 1, 512, 8192, 8192, 512, 128]
    - [36, 67.09]
  - - [8192, 128, 1, 1024, 8192, 8192, 1024, 128]
    - [39, 99.09]
  - - [8192, 128, 1, 2048, 8192, 8192, 2048, 128]
    - [98, 126.75]
  - - [8192, 128, 1, 4096, 8192, 8192, 4096, 128]
    - [77, 144.64]
  - - [8192, 128, 1, 8192, 8192, 8192, 8192, 128]
    - [97, 155.24]
  - - [8192, 256, 1, 128, 8192, 8192, 128, 256]
    - [74, 34.25]
  - - [8192, 256, 1, 256, 8192, 8192, 256, 256]
    - [28, 61.24]
  - - [8192, 256, 1, 512, 8192, 8192, 512, 256]
    - [27, 99.58]
  - - [8192, 256, 1, 1024, 8192, 8192, 1024, 256]
    - [76, 148.15]
  - - [8192, 256, 1, 2048, 8192, 8192, 2048, 256]
    - [68, 185.42]
  - - [8192, 256, 1, 4096, 8192, 8192, 4096, 256]
    - [75, 202.58]
  - - [8192, 256, 1, 8192, 8192, 8192, 8192, 256]
    - [76, 199.6]
  - - [8192, 512, 1, 128, 8192, 8192, 128, 512]
    - [20, 49.08]
  - - [8192, 512, 1, 256, 8192, 8192, 256, 512]
    - [22, 84.89]
  - - [8192, 512, 1, 512, 8192, 8192, 512, 512]
    - [69, 140.53]
  - - [8192, 512, 1, 1024, 8192, 8192, 1024, 512]
    - [69, 206.54]
  - - [8192, 512, 1, 2048, 8192, 8192, 2048, 512]
    - [70, 239.88]
  - - [8192, 512, 1, 4096, 8192, 8192, 4096, 512]
    - [71, 274.93]
  - - [8192, 512, 1, 8192, 8192, 8192, 8192, 512]
    - [71, 261.1]
  - - [8192, 1024, 1, 128, 8192, 8192, 128, 1024]
    - [61, 60.64]
  - - [8192, 1024, 1, 256, 8192, 8192, 256, 1024]
    - [62, 106.48]
  - - [8192, 1024, 1, 512, 8192, 8192, 512, 1024]
    - [64, 176.11]
  - - [8192, 1024, 1, 1024, 8192, 8192, 1024, 1024]
    - [63, 222.73]
  - - [8192, 1024, 1, 2048, 8192, 8192, 2048, 1024]
    - [65, 305.54]
  - - [8192, 1024, 1, 4096, 8192, 8192, 4096, 1024]
    - [62, 334.85]
  - - [8192, 1024, 1, 8192, 8192, 8192, 8192, 1024]
    - [65, 363.65]
  - - [8192, 2048, 1, 128, 8192, 8192, 128, 2048]
    - [63, 65.55]
  - - [8192, 2048, 1, 256, 8192, 8192, 256, 2048]
    - [64, 114.17]
  - - [8192, 2048, 1, 512, 8192, 8192, 512, 2048]
    - [65, 181.28]
  - - [8192, 2048, 1, 1024, 8192, 8192, 1024, 2048]
    - [64, 242.03]
  - - [8192, 2048, 1, 2048, 8192, 8192, 2048, 2048]
    - [65, 289.34]
  - - [8192, 2048, 1, 4096, 8192, 8192, 4096, 2048]
    - [64, 334.63]
  - - [8192, 2048, 1, 8192, 8192, 8192, 8192, 2048]
    - [62, 383.76]
  - - [8192, 4096, 1, 128, 8192, 8192, 128, 4096]
    - [63, 67.11]
  - - [8192, 4096, 1, 256, 8192, 8192, 256, 4096]
    - [64, 113.06]
  - - [8192, 4096, 1, 512, 8192, 8192, 512, 4096]
    - [12, 169.49]
  - - [8192, 4096, 1, 1024, 8192, 8192, 1024, 4096]
    - [64, 222.36]
  - - [8192, 4096, 1, 2048, 8192, 8192, 2048, 4096]
    - [64, 299.43]
  - - [8192, 4096, 1, 4096, 8192, 8192, 4096, 4096]
    - [62, 351.02]
  - - [8192, 4096, 1, 8192, 8192, 8192, 8192, 4096]
    - [62, 403.08]
  - - [8192, 8192, 1, 128, 8192, 8192, 128, 8192]
    - [26, 59.5]
  - - [8192, 8192, 1, 256, 8192, 8192, 256, 8192]
    - [23, 111.48]
  - - [8192, 8192, 1, 512, 8192, 8192, 512, 8192]
    - [8, 171.16]
  - - [8192, 8192, 1, 1024, 8192, 8192, 1024, 8192]
    - [5, 233.55]
  - - [8192, 8192, 1, 2048, 8192, 8192, 2048, 8192]
    - [62, 303.73]
  - - [8192, 8192, 1, 4096, 8192, 8192, 4096, 8192]
    - [62, 360.07]
  - - [8192, 8192, 1, 8192, 8192, 8192, 8192, 8192]
    - [64, 398.53]
- null
- null
- ExperimentalStreamK
- GridBased
