projects/hipblaslt/library/src/amd_detail/rocblaslt/src/Tensile/Logic/asm_full/aquavanjaram/gfx942_228cu/StreamK/aquavanjaram942_Cijk_Alik_Bjlk_F8B8NHS_BH_Bias_HAS_SAV_UserArgs.yaml
- {MinimumRequiredVersion: 4.33.0}
- aquavanjaram942
- {Architecture: gfx942, CUCount: 228}
- [Device 0049, Device 0050]
    SolutionIndex: 0
    SolutionNameMin: Cijk_Alik_Bjlk_F8B8NHS_BH_Bias_HAS_SAV_UserArgs_MT256x256x64_MI16x16x1_SN_LDSB1_CLR1_GRVWA8_GRVWB8_GSU0_GSUC0_GSUWGMRR0_K1_LBSPPA512_LBSPPB2048_LPA8_LPB0_LRVW8_MIWT8_8_PLR1_SU0_SUM0_SUS64_VWA8_VWB8_WGM1_WGMXCC1_WGMXCCGn1
    SolutionIndex: 1
    SolutionNameMin: Cijk_Alik_Bjlk_F8B8NHS_BH_Bias_HAS_SAV_UserArgs_MT256x256x64_MI16x16x1_SN_LDSB1_CLR1_GRVWA8_GRVWB16_GSU0_GSUC0_GSUWGMRR0_K1_LBSPPA512_LBSPPB2048_LPA8_LPB0_LRVW8_MIWT8_8_PLR1_SU0_SUM0_SUS64_VWA8_VWB8_WGM1_WGMXCC1_WGMXCCGn1
    SolutionIndex: 2
    SolutionNameMin: Cijk_Alik_Bjlk_F8B8NHS_BH_Bias_HAS_SAV_UserArgs_MT256x256x64_MI16x16x1_SN_LDSB1_CLR1_GRVWA16_GRVWB16_GSU0_GSUC0_GSUWGMRR0_K1_LBSPPA512_LBSPPB2048_LPA16_LPB0_LRVW8_MIWT8_8_PLR1_SU0_SUM0_SUS64_VWA8_VWB8_WGM1_WGMXCC1_WGMXCCGn1
    SolutionIndex: 3
    SolutionNameMin: Cijk_Alik_Bjlk_F8B8NHS_BH_Bias_HAS_SAV_UserArgs_MT256x256x64_MI16x16x1_SN_LDSB1_CLR1_GRVWA8_GRVWB16_GSU0_GSUC0_GSUWGMRR0_K1_LBSPPA512_LBSPPB2048_LPA8_LPB0_LRVW8_MIWT8_8_PLR1_SU0_SUM0_SUS64_VWA8_VWB8_WGM4_WGMXCC1_WGMXCCGn1
    SolutionIndex: 4
    SolutionNameMin: Cijk_Alik_Bjlk_F8B8NHS_BH_Bias_HAS_SAV_UserArgs_MT256x256x64_MI16x16x1_SN_LDSB1_CLR1_GRVWA16_GRVWB16_GSU0_GSUC0_GSUWGMRR0_K1_LBSPPA512_LBSPPB2048_LPA16_LPB0_LRVW8_MIWT8_8_PLR1_SU0_SUM0_SUS64_VWA8_VWB8_WGM4_WGMXCC1_WGMXCCGn1
    SolutionIndex: 5
    SolutionNameMin: Cijk_Alik_Bjlk_F8B8NHS_BH_Bias_HAS_SAV_UserArgs_MT256x256x64_MI16x16x1_SN_LDSB1_CLR1_GRVWA8_GRVWB16_GSU0_GSUC0_GSUWGMRR0_K1_LBSPPA512_LBSPPB2048_LPA8_LPB0_LRVW8_MIWT8_8_PLR1_SU0_SUM0_SUS64_VWA8_VWB8_WGM6_WGMXCC1_WGMXCCGn1
    SolutionIndex: 6
    SolutionNameMin: Cijk_Alik_Bjlk_F8B8NHS_BH_Bias_HAS_SAV_UserArgs_MT256x256x64_MI16x16x1_SN_LDSB1_CLR1_GRVWA16_GRVWB16_GSU0_GSUC0_GSUWGMRR0_K1_LBSPPA512_LBSPPB2048_LPA16_LPB0_LRVW8_MIWT8_8_PLR1_SU0_SUM0_SUS64_VWA8_VWB8_WGM6_WGMXCC1_WGMXCCGn1
    SolutionIndex: 7
    SolutionNameMin: Cijk_Alik_Bjlk_F8B8NHS_BH_Bias_HAS_SAV_UserArgs_MT256x256x64_MI16x16x1_SN_LDSB1_CLR1_GRVWA8_GRVWB16_GSU0_GSUC0_GSUWGMRR0_K1_LBSPPA512_LBSPPB2048_LPA8_LPB0_LRVW8_MIWT8_8_PLR1_SU0_SUM0_SUS64_VWA8_VWB8_WGM8_WGMXCC1_WGMXCCGn1
    SolutionIndex: 8
    SolutionNameMin: Cijk_Alik_Bjlk_F8B8NHS_BH_Bias_HAS_SAV_UserArgs_MT256x256x64_MI16x16x1_SN_LDSB1_CLR1_GRVWA16_GRVWB16_GSU0_GSUC0_GSUWGMRR0_K1_LBSPPA512_LBSPPB2048_LPA16_LPB0_LRVW8_MIWT8_8_PLR1_SU0_SUM0_SUS64_VWA8_VWB8_WGM8_WGMXCC1_WGMXCCGn1
    SolutionIndex: 9
    SolutionNameMin: Cijk_Alik_Bjlk_F8B8NHS_BH_Bias_HAS_SAV_UserArgs_MT128x256x64_MI16x16x1_SN_LDSB1_CLR1_GRVWA8_GRVWB16_GSU0_GSUC0_GSUWGMRR0_K1_LBSPPA256_LBSPPB2048_LPA8_LPB0_LRVW8_MIWT4_8_PLR1_SU0_SUM0_SUS64_VWA4_VWB8_WGM1_WGMXCC1_WGMXCCGn1
    SolutionIndex: 10
    SolutionNameMin: Cijk_Alik_Bjlk_F8B8NHS_BH_Bias_HAS_SAV_UserArgs_MT128x256x64_MI16x16x1_SN_LDSB1_CLR1_GRVWA16_GRVWB16_GSU0_GSUC0_GSUWGMRR0_K1_LBSPPA256_LBSPPB2048_LPA16_LPB0_LRVW8_MIWT4_8_PLR1_SU0_SUM0_SUS64_VWA4_VWB8_WGM1_WGMXCC1_WGMXCCGn1
    SolutionIndex: 11
    SolutionNameMin: Cijk_Alik_Bjlk_F8B8NHS_BH_Bias_HAS_SAV_UserArgs_MT128x256x64_MI16x16x1_SN_LDSB1_CLR1_GRVWA8_GRVWB16_GSU0_GSUC0_GSUWGMRR0_K1_LBSPPA256_LBSPPB2048_LPA8_LPB0_LRVW8_MIWT4_8_PLR1_SU0_SUM0_SUS64_VWA4_VWB8_WGM6_WGMXCC1_WGMXCCGn1
    SolutionIndex: 12
    SolutionNameMin: Cijk_Alik_Bjlk_F8B8NHS_BH_Bias_HAS_SAV_UserArgs_MT256x128x64_MI16x16x1_SN_LDSB1_CLR1_GRVWA8_GRVWB8_GSU0_GSUC0_GSUWGMRR0_K1_LBSPPA512_LBSPPB1024_LPA8_LPB64_LRVW8_MIWT8_4_PLR1_SU0_SUM0_SUS64_VWA8_VWB4_WGM1_WGMXCC1_WGMXCCGn1
    SolutionIndex: 13
    SolutionNameMin: Cijk_Alik_Bjlk_F8B8NHS_BH_Bias_HAS_SAV_UserArgs_MT256x128x64_MI16x16x1_SN_LDSB1_CLR1_GRVWA16_GRVWB8_GSU0_GSUC0_GSUWGMRR0_K1_LBSPPA512_LBSPPB1024_LPA16_LPB64_LRVW8_MIWT8_4_PLR1_SU0_SUM0_SUS64_VWA8_VWB4_WGM1_WGMXCC1_WGMXCCGn1
    SolutionIndex: 14
    SolutionNameMin: Cijk_Alik_Bjlk_F8B8NHS_BH_Bias_HAS_SAV_UserArgs_MT256x128x64_MI16x16x1_SN_LDSB1_CLR1_GRVWA8_GRVWB16_GSU0_GSUC0_GSUWGMRR0_K1_LBSPPA512_LBSPPB1024_LPA8_LPB64_LRVW8_MIWT8_4_PLR1_SU0_SUM0_SUS64_VWA8_VWB4_WGM1_WGMXCC1_WGMXCCGn1
    SolutionIndex: 15
    SolutionNameMin: Cijk_Alik_Bjlk_F8B8NHS_BH_Bias_HAS_SAV_UserArgs_MT256x128x64_MI16x16x1_SN_LDSB1_CLR1_GRVWA16_GRVWB16_GSU0_GSUC0_GSUWGMRR0_K1_LBSPPA512_LBSPPB1024_LPA16_LPB64_LRVW8_MIWT8_4_PLR1_SU0_SUM0_SUS64_VWA8_VWB4_WGM1_WGMXCC1_WGMXCCGn1
    SolutionIndex: 16
    SolutionNameMin: Cijk_Alik_Bjlk_F8B8NHS_BH_Bias_HAS_SAV_UserArgs_MT256x128x64_MI16x16x1_SN_LDSB1_CLR1_GRVWA8_GRVWB16_GSU0_GSUC0_GSUWGMRR0_K1_LBSPPA512_LBSPPB1024_LPA8_LPB64_LRVW8_MIWT8_4_PLR1_SU0_SUM0_SUS64_VWA8_VWB4_WGM4_WGMXCC1_WGMXCCGn1
    SolutionIndex: 17
    SolutionNameMin: Cijk_Alik_Bjlk_F8B8NHS_BH_Bias_HAS_SAV_UserArgs_MT256x128x64_MI16x16x1_SN_LDSB1_CLR1_GRVWA16_GRVWB16_GSU0_GSUC0_GSUWGMRR0_K1_LBSPPA512_LBSPPB1024_LPA16_LPB64_LRVW8_MIWT8_4_PLR1_SU0_SUM0_SUS64_VWA8_VWB4_WGM4_WGMXCC1_WGMXCCGn1
    SolutionIndex: 18
    SolutionNameMin: Cijk_Alik_Bjlk_F8B8NHS_BH_Bias_HAS_SAV_UserArgs_MT256x128x64_MI16x16x1_SN_LDSB1_CLR1_GRVWA16_GRVWB8_GSU0_GSUC0_GSUWGMRR0_K1_LBSPPA512_LBSPPB1024_LPA16_LPB64_LRVW8_MIWT8_4_PLR1_SU0_SUM0_SUS64_VWA8_VWB4_WGM8_WGMXCC1_WGMXCCGn1
    SolutionIndex: 19
    SolutionNameMin: Cijk_Alik_Bjlk_F8B8NHS_BH_Bias_HAS_SAV_UserArgs_MT256x128x64_MI16x16x1_SN_LDSB1_CLR1_GRVWA8_GRVWB16_GSU0_GSUC0_GSUWGMRR0_K1_LBSPPA512_LBSPPB1024_LPA8_LPB64_LRVW8_MIWT8_4_PLR1_SU0_SUM0_SUS64_VWA8_VWB4_WGM8_WGMXCC1_WGMXCCGn1
    SolutionIndex: 20
    SolutionNameMin: Cijk_Alik_Bjlk_F8B8NHS_BH_Bias_HAS_SAV_UserArgs_MT256x128x64_MI16x16x1_SN_LDSB1_CLR1_GRVWA16_GRVWB16_GSU0_GSUC0_GSUWGMRR0_K1_LBSPPA512_LBSPPB1024_LPA16_LPB64_LRVW8_MIWT8_4_PLR1_SU0_SUM0_SUS64_VWA8_VWB4_WGM8_WGMXCC1_WGMXCCGn1
    SolutionIndex: 21
    SolutionNameMin: Cijk_Alik_Bjlk_F8B8NHS_BH_Bias_HAS_SAV_UserArgs_MT256x64x64_MI16x16x1_SN_LDSB1_CLR1_GRVWA8_GRVWB8_GSU0_GSUC0_GSUWGMRR0_K1_LBSPPA512_LBSPPB512_LPA8_LPB32_LRVW8_MIWT8_2_PLR1_SU0_SUM0_SUS64_VWA8_VWB2_WGM1_WGMXCC1_WGMXCCGn1
    SolutionIndex: 22
    SolutionNameMin: Cijk_Alik_Bjlk_F8B8NHS_BH_Bias_HAS_SAV_UserArgs_MT128x128x64_MI16x16x1_SN_LDSB1_CLR1_GRVWA8_GRVWB8_GSU0_GSUC0_GSUWGMRR0_K1_LBSPPA512_LBSPPB1024_LPA8_LPB32_LRVW8_MIWT8_2_PLR1_SU0_SUM0_SUS64_VWA8_VWB2_WGM1_WGMXCC1_WGMXCCGn1
    SolutionIndex: 23
    SolutionNameMin: Cijk_Alik_Bjlk_F8B8NHS_BH_Bias_HAS_SAV_UserArgs_MT128x128x64_MI16x16x1_SN_LDSB1_CLR1_GRVWA8_GRVWB16_GSU0_GSUC0_GSUWGMRR0_K1_LBSPPA512_LBSPPB1024_LPA8_LPB32_LRVW8_MIWT8_2_PLR1_SU0_SUM0_SUS64_VWA8_VWB2_WGM1_WGMXCC1_WGMXCCGn1
    SolutionIndex: 24
    SolutionNameMin: Cijk_Alik_Bjlk_F8B8NHS_BH_Bias_HAS_SAV_UserArgs_MT128x64x64_MI16x16x1_SN_LDSB0_CLR1_GRVWA8_GRVWB8_GSU0_GSUC0_GSUWGMRR0_K1_LBSPPA512_LBSPPB512_LPA8_LPB16_LRVW8_MIWT8_1_PLR1_SU0_SUM0_SUS64_VWA8_VWB1_WGM1_WGMXCC1_WGMXCCGn1
    SolutionIndex: 25
    SolutionNameMin: Cijk_Alik_Bjlk_F8B8NHS_BH_Bias_HAS_SAV_UserArgs_MT128x64x64_MI16x16x1_SN_LDSB0_CLR1_GRVWA8_GRVWB8_GSU0_GSUC0_GSUWGMRR0_K1_LBSPPA256_LBSPPB512_LPA8_LPB32_LRVW8_MIWT4_2_PLR1_SU0_SUM0_SUS64_VWA4_VWB2_WGM1_WGMXCC1_WGMXCCGn1
    SolutionIndex: 26
    SolutionNameMin: Cijk_Alik_Bjlk_F8B8NHS_BH_Bias_HAS_SAV_UserArgs_MT128x64x64_MI16x16x1_SN_LDSB0_CLR1_GRVWA16_GRVWB8_GSU0_GSUC0_GSUWGMRR0_K1_LBSPPA256_LBSPPB512_LPA16_LPB32_LRVW8_MIWT4_2_PLR1_SU0_SUM0_SUS64_VWA4_VWB2_WGM1_WGMXCC1_WGMXCCGn1
    SolutionIndex: 27
    SolutionNameMin: Cijk_Alik_Bjlk_F8B8NHS_BH_Bias_HAS_SAV_UserArgs_MT128x64x64_MI16x16x1_SN_LDSB0_CLR1_GRVWA8_GRVWB16_GSU0_GSUC0_GSUWGMRR0_K1_LBSPPA256_LBSPPB512_LPA8_LPB32_LRVW8_MIWT4_2_PLR1_SU0_SUM0_SUS64_VWA4_VWB2_WGM1_WGMXCC1_WGMXCCGn1
    SolutionIndex: 28
    SolutionNameMin: Cijk_Alik_Bjlk_F8B8NHS_BH_Bias_HAS_SAV_UserArgs_MT128x64x64_MI16x16x1_SN_LDSB0_CLR1_GRVWA16_GRVWB8_GSU0_GSUC0_GSUWGMRR0_K1_LBSPPA256_LBSPPB512_LPA16_LPB32_LRVW8_MIWT4_2_PLR1_SU0_SUM0_SUS64_VWA4_VWB2_WGM4_WGMXCC1_WGMXCCGn1
    SolutionIndex: 29
    SolutionNameMin: Cijk_Alik_Bjlk_F8B8NHS_BH_Bias_HAS_SAV_UserArgs_MT128x64x64_MI16x16x1_SN_LDSB0_CLR1_GRVWA8_GRVWB16_GSU0_GSUC0_GSUWGMRR0_K1_LBSPPA256_LBSPPB512_LPA8_LPB32_LRVW8_MIWT4_2_PLR1_SU0_SUM0_SUS64_VWA4_VWB2_WGM4_WGMXCC1_WGMXCCGn1
    SolutionIndex: 30
    SolutionNameMin: Cijk_Alik_Bjlk_F8B8NHS_BH_Bias_HAS_SAV_UserArgs_MT128x64x64_MI16x16x1_SN_LDSB0_CLR1_GRVWA8_GRVWB16_GSU0_GSUC0_GSUWGMRR0_K1_LBSPPA256_LBSPPB512_LPA8_LPB32_LRVW8_MIWT4_2_PLR1_SU0_SUM0_SUS64_VWA4_VWB2_WGM6_WGMXCC1_WGMXCCGn1
    SolutionIndex: 31
    SolutionNameMin: Cijk_Alik_Bjlk_F8B8NHS_BH_Bias_HAS_SAV_UserArgs_MT128x64x64_MI16x16x1_SN_LDSB0_CLR1_GRVWA16_GRVWB8_GSU0_GSUC0_GSUWGMRR0_K1_LBSPPA256_LBSPPB512_LPA16_LPB32_LRVW8_MIWT4_2_PLR1_SU0_SUM0_SUS64_VWA4_VWB2_WGM8_WGMXCC1_WGMXCCGn1
    SolutionIndex: 32
    SolutionNameMin: Cijk_Alik_Bjlk_F8B8NHS_BH_Bias_HAS_SAV_UserArgs_MT128x64x64_MI16x16x1_SN_LDSB0_CLR1_GRVWA8_GRVWB16_GSU0_GSUC0_GSUWGMRR0_K1_LBSPPA256_LBSPPB512_LPA8_LPB32_LRVW8_MIWT4_2_PLR1_SU0_SUM0_SUS64_VWA4_VWB2_WGM8_WGMXCC1_WGMXCCGn1
    SolutionIndex: 33
    SolutionNameMin: Cijk_Alik_Bjlk_F8B8NHS_BH_Bias_HAS_SAV_UserArgs_MT64x64x64_MI16x16x1_SN_LDSB0_CLR1_GRVWA8_GRVWB8_GSU0_GSUC0_GSUWGMRR0_K1_LBSPPA128_LBSPPB512_LPA8_LPB32_LRVW8_MIWT2_2_PLR1_SU0_SUM0_SUS64_VWA2_VWB2_WGM1_WGMXCC1_WGMXCCGn1
    SolutionIndex: 34
    SolutionNameMin: Cijk_Alik_Bjlk_F8B8NHS_BH_Bias_HAS_SAV_UserArgs_MT64x64x64_MI16x16x1_SN_LDSB0_CLR1_GRVWA16_GRVWB8_GSU0_GSUC0_GSUWGMRR0_K1_LBSPPA128_LBSPPB512_LPA16_LPB32_LRVW8_MIWT2_2_PLR1_SU0_SUM0_SUS64_VWA2_VWB2_WGM1_WGMXCC1_WGMXCCGn1
    SolutionIndex: 35
    SolutionNameMin: Cijk_Alik_Bjlk_F8B8NHS_BH_Bias_HAS_SAV_UserArgs_MT64x64x64_MI16x16x1_SN_LDSB0_CLR1_GRVWA8_GRVWB8_GSU0_GSUC0_GSUWGMRR0_K1_LBSPPA128_LBSPPB512_LPA8_LPB32_LRVW8_MIWT2_2_PLR1_SU0_SUM0_SUS64_VWA2_VWB2_WGM4_WGMXCC1_WGMXCCGn1
    SolutionIndex: 36
    SolutionNameMin: Cijk_Alik_Bjlk_F8B8NHS_BH_Bias_HAS_SAV_UserArgs_MT64x64x64_MI16x16x1_SN_LDSB0_CLR1_GRVWA8_GRVWB8_GSU0_GSUC0_GSUWGMRR0_K1_LBSPPA128_LBSPPB512_LPA8_LPB32_LRVW8_MIWT2_2_PLR1_SU0_SUM0_SUS64_VWA2_VWB2_WGM8_WGMXCC1_WGMXCCGn1
    SolutionIndex: 37
    SolutionNameMin: Cijk_Alik_Bjlk_F8B8NHS_BH_Bias_HAS_SAV_UserArgs_MT64x32x64_MI16x16x1_SN_LDSB0_CLR1_GRVWA8_GRVWB8_GSU0_GSUC0_GSUWGMRR0_K1_LBSPPA128_LBSPPB256_LPA8_LPB16_LRVW8_MIWT2_1_PLR1_SU0_SUM0_SUS64_VWA2_VWB1_WGM1_WGMXCC1_WGMXCCGn1
    SolutionIndex: 38
    SolutionNameMin: Cijk_Alik_Bjlk_F8B8NHS_BH_Bias_HAS_SAV_UserArgs_MT32x32x64_MI16x16x1_SN_LDSB0_CLR1_GRVWA8_GRVWB8_GSU0_GSUC0_GSUWGMRR0_K1_LBSPPA128_LBSPPB256_LPA8_LPB16_LRVW8_MIWT1_1_PLR1_SU0_SUM0_SUS64_VWA1_VWB1_WGM1_WGMXCC1_WGMXCCGn1
    SolutionIndex: 39
    SolutionNameMin: Cijk_Alik_Bjlk_F8B8NHS_BH_Bias_HAS_SAV_UserArgs_MT128x256x128_MI16x16x1_SN_LDSB1_CLR1_GRVWA8_GRVWB16_GSU0_GSUC0_GSUWGMRR0_K1_LBSPPA512_LBSPPB2048_LPA8_LPB0_LRVW8_MIWT4_8_PLR1_SU0_SUM0_SUS128_VWA4_VWB8_WGM1_WGMXCC1_WGMXCCGn1
    SolutionIndex: 40
    SolutionNameMin: Cijk_Alik_Bjlk_F8B8NHS_BH_Bias_HAS_SAV_UserArgs_MT128x256x128_MI16x16x1_SN_LDSB1_CLR1_GRVWA8_GRVWB16_GSU0_GSUC0_GSUWGMRR0_K1_LBSPPA512_LBSPPB2048_LPA8_LPB0_LRVW8_MIWT4_8_PLR1_SU0_SUM0_SUS128_VWA4_VWB8_WGM4_WGMXCC1_WGMXCCGn1
    SolutionIndex: 41
    SolutionNameMin: Cijk_Alik_Bjlk_F8B8NHS_BH_Bias_HAS_SAV_UserArgs_MT128x256x128_MI16x16x1_SN_LDSB1_CLR1_GRVWA8_GRVWB16_GSU0_GSUC0_GSUWGMRR0_K1_LBSPPA512_LBSPPB2048_LPA8_LPB0_LRVW8_MIWT4_8_PLR1_SU0_SUM0_SUS128_VWA4_VWB8_WGM6_WGMXCC1_WGMXCCGn1
    SolutionIndex: 42
    SolutionNameMin: Cijk_Alik_Bjlk_F8B8NHS_BH_Bias_HAS_SAV_UserArgs_MT128x256x128_MI16x16x1_SN_LDSB1_CLR1_GRVWA16_GRVWB16_GSU0_GSUC0_GSUWGMRR0_K1_LBSPPA512_LBSPPB2048_LPA16_LPB0_LRVW8_MIWT4_8_PLR1_SU0_SUM0_SUS128_VWA4_VWB8_WGM6_WGMXCC1_WGMXCCGn1
    SolutionIndex: 43
    SolutionNameMin: Cijk_Alik_Bjlk_F8B8NHS_BH_Bias_HAS_SAV_UserArgs_MT128x256x128_MI16x16x1_SN_LDSB1_CLR1_GRVWA8_GRVWB16_GSU0_GSUC0_GSUWGMRR0_K1_LBSPPA512_LBSPPB2048_LPA8_LPB0_LRVW8_MIWT4_8_PLR1_SU0_SUM0_SUS128_VWA4_VWB8_WGM8_WGMXCC1_WGMXCCGn1
    SolutionIndex: 44
    SolutionNameMin: Cijk_Alik_Bjlk_F8B8NHS_BH_Bias_HAS_SAV_UserArgs_MT128x256x128_MI16x16x1_SN_LDSB1_CLR1_GRVWA16_GRVWB16_GSU0_GSUC0_GSUWGMRR0_K1_LBSPPA512_LBSPPB2048_LPA16_LPB0_LRVW8_MIWT4_8_PLR1_SU0_SUM0_SUS128_VWA4_VWB8_WGM8_WGMXCC1_WGMXCCGn1
    SolutionIndex: 45
    SolutionNameMin: Cijk_Alik_Bjlk_F8B8NHS_BH_Bias_HAS_SAV_UserArgs_MT256x128x128_MI16x16x1_SN_LDSB1_CLR1_GRVWA8_GRVWB16_GSU0_GSUC0_GSUWGMRR0_K1_LBSPPA1024_LBSPPB1024_LPA8_LPB64_LRVW8_MIWT8_4_PLR1_SU0_SUM0_SUS128_VWA8_VWB4_WGM1_WGMXCC1_WGMXCCGn1
    SolutionIndex: 46
    SolutionNameMin: Cijk_Alik_Bjlk_F8B8NHS_BH_Bias_HAS_SAV_UserArgs_MT256x128x128_MI16x16x1_SN_LDSB1_CLR1_GRVWA8_GRVWB16_GSU0_GSUC0_GSUWGMRR0_K1_LBSPPA1024_LBSPPB1024_LPA8_LPB64_LRVW8_MIWT8_4_PLR1_SU0_SUM0_SUS128_VWA8_VWB4_WGM4_WGMXCC1_WGMXCCGn1
    SolutionIndex: 47
    SolutionNameMin: Cijk_Alik_Bjlk_F8B8NHS_BH_Bias_HAS_SAV_UserArgs_MT256x128x128_MI16x16x1_SN_LDSB1_CLR1_GRVWA16_GRVWB16_GSU0_GSUC0_GSUWGMRR0_K1_LBSPPA1024_LBSPPB1024_LPA16_LPB64_LRVW8_MIWT8_4_PLR1_SU0_SUM0_SUS128_VWA8_VWB4_WGM6_WGMXCC1_WGMXCCGn1
    SolutionIndex: 48
    SolutionNameMin: Cijk_Alik_Bjlk_F8B8NHS_BH_Bias_HAS_SAV_UserArgs_MT144x256x128_MI16x16x1_SN_LDSB1_CLR1_GRVWA8_GRVWB16_GSU0_GSUC0_GSUWGMRR0_K1_LBSPPA128_LBSPPB2048_LPA8_LPB64_LRVW8_MIWT9_4_PLR1_SU0_SUM0_SUS128_VWA1_VWB4_WGM1_WGMXCC1_WGMXCCGn1
    SolutionIndex: 49
    SolutionNameMin: Cijk_Alik_Bjlk_F8B8NHS_BH_Bias_HAS_SAV_UserArgs_MT144x256x128_MI16x16x1_SN_LDSB1_CLR1_GRVWA8_GRVWB16_GSU0_GSUC0_GSUWGMRR0_K1_LBSPPA128_LBSPPB2048_LPA8_LPB64_LRVW8_MIWT9_4_PLR1_SU0_SUM0_SUS128_VWA1_VWB4_WGM4_WGMXCC1_WGMXCCGn1
    SolutionIndex: 50
    SolutionNameMin: Cijk_Alik_Bjlk_F8B8NHS_BH_Bias_HAS_SAV_UserArgs_MT144x256x128_MI16x16x1_SN_LDSB1_CLR1_GRVWA8_GRVWB16_GSU0_GSUC0_GSUWGMRR0_K1_LBSPPA128_LBSPPB2048_LPA8_LPB64_LRVW8_MIWT9_4_PLR1_SU0_SUM0_SUS128_VWA1_VWB4_WGM6_WGMXCC1_WGMXCCGn1
    SolutionIndex: 51
    SolutionNameMin: Cijk_Alik_Bjlk_F8B8NHS_BH_Bias_HAS_SAV_UserArgs_MT144x256x128_MI16x16x1_SN_LDSB1_CLR1_GRVWA8_GRVWB8_GSU0_GSUC0_GSUWGMRR0_K1_LBSPPA128_LBSPPB2048_LPA8_LPB64_LRVW8_MIWT9_4_PLR1_SU0_SUM0_SUS128_VWA1_VWB4_WGM8_WGMXCC1_WGMXCCGn1
    SolutionIndex: 52
    SolutionNameMin: Cijk_Alik_Bjlk_F8B8NHS_BH_Bias_HAS_SAV_UserArgs_MT144x256x128_MI16x16x1_SN_LDSB1_CLR1_GRVWA8_GRVWB16_GSU0_GSUC0_GSUWGMRR0_K1_LBSPPA128_LBSPPB2048_LPA8_LPB64_LRVW8_MIWT9_4_PLR1_SU0_SUM0_SUS128_VWA1_VWB4_WGM8_WGMXCC1_WGMXCCGn1
    SolutionIndex: 53
    SolutionNameMin: Cijk_Alik_Bjlk_F8B8NHS_BH_Bias_HAS_SAV_UserArgs_MT128x128x128_MI16x16x1_SN_LDSB1_CLR1_GRVWA8_GRVWB16_GSU0_GSUC0_GSUWGMRR0_K1_LBSPPA1024_LBSPPB1024_LPA8_LPB32_LRVW8_MIWT8_2_PLR1_SU0_SUM0_SUS128_VWA8_VWB2_WGM1_WGMXCC1_WGMXCCGn1
    SolutionIndex: 54
    SolutionNameMin: Cijk_Alik_Bjlk_F8B8NHS_BH_Bias_HAS_SAV_UserArgs_MT144x128x128_MI16x16x1_SN_LDSB1_CLR1_GRVWA8_GRVWB16_GSU0_GSUC0_GSUWGMRR0_K1_LBSPPA128_LBSPPB1024_LPA8_LPB32_LRVW8_MIWT9_2_PLR1_SU0_SUM0_SUS128_VWA1_VWB2_WGM4_WGMXCC1_WGMXCCGn1
    SolutionIndex: 55
    SolutionNameMin: Cijk_Alik_Bjlk_F8B8NHS_BH_Bias_HAS_SAV_UserArgs_MT144x128x128_MI16x16x1_SN_LDSB1_CLR1_GRVWA8_GRVWB16_GSU0_GSUC0_GSUWGMRR0_K1_LBSPPA128_LBSPPB1024_LPA8_LPB32_LRVW8_MIWT9_2_PLR1_SU0_SUM0_SUS128_VWA1_VWB2_WGM6_WGMXCC1_WGMXCCGn1
    SolutionIndex: 56
    SolutionNameMin: Cijk_Alik_Bjlk_F8B8NHS_BH_Bias_HAS_SAV_UserArgs_MT144x128x128_MI16x16x1_SN_LDSB1_CLR1_GRVWA8_GRVWB16_GSU0_GSUC0_GSUWGMRR0_K1_LBSPPA128_LBSPPB1024_LPA8_LPB32_LRVW8_MIWT9_2_PLR1_SU0_SUM0_SUS128_VWA1_VWB2_WGM8_WGMXCC1_WGMXCCGn1
    SolutionIndex: 57
    SolutionNameMin: Cijk_Alik_Bjlk_F8B8NHS_BH_Bias_HAS_SAV_UserArgs_MT128x128x128_MI16x16x1_SN_LDSB1_CLR1_GRVWA16_GRVWB16_GSU0_GSUC0_GSUWGMRR0_K1_LBSPPA512_LBSPPB1024_LPA16_LPB64_LRVW8_MIWT4_4_PLR1_SU0_SUM0_SUS128_VWA4_VWB4_WGM1_WGMXCC1_WGMXCCGn1
    SolutionIndex: 58
    SolutionNameMin: Cijk_Alik_Bjlk_F8B8NHS_BH_Bias_HAS_SAV_UserArgs_MT128x128x128_MI16x16x1_SN_LDSB1_CLR1_GRVWA16_GRVWB16_GSU0_GSUC0_GSUWGMRR0_K1_LBSPPA512_LBSPPB1024_LPA16_LPB64_LRVW8_MIWT4_4_PLR1_SU0_SUM0_SUS128_VWA4_VWB4_WGM4_WGMXCC1_WGMXCCGn1
    SolutionIndex: 59
    SolutionNameMin: Cijk_Alik_Bjlk_F8B8NHS_BH_Bias_HAS_SAV_UserArgs_MT128x128x128_MI16x16x1_SN_LDSB1_CLR1_GRVWA16_GRVWB16_GSU0_GSUC0_GSUWGMRR0_K1_LBSPPA512_LBSPPB1024_LPA16_LPB64_LRVW8_MIWT4_4_PLR1_SU0_SUM0_SUS128_VWA4_VWB4_WGM6_WGMXCC1_WGMXCCGn1
    SolutionIndex: 60
    SolutionNameMin: Cijk_Alik_Bjlk_F8B8NHS_BH_Bias_HAS_SAV_UserArgs_MT128x128x128_MI16x16x1_SN_LDSB1_CLR1_GRVWA16_GRVWB16_GSU0_GSUC0_GSUWGMRR0_K1_LBSPPA512_LBSPPB1024_LPA16_LPB64_LRVW8_MIWT4_4_PLR1_SU0_SUM0_SUS128_VWA4_VWB4_WGM8_WGMXCC1_WGMXCCGn1
    SolutionIndex: 61
    SolutionNameMin: Cijk_Alik_Bjlk_F8B8NHS_BH_Bias_HAS_SAV_UserArgs_MT64x128x128_MI16x16x1_SN_LDSB1_CLR1_GRVWA8_GRVWB16_GSU0_GSUC0_GSUWGMRR0_K1_LBSPPA256_LBSPPB1024_LPA8_LPB64_LRVW8_MIWT2_4_PLR1_SU0_SUM0_SUS128_VWA2_VWB4_WGM1_WGMXCC1_WGMXCCGn1
    SolutionIndex: 62
    SolutionNameMin: Cijk_Alik_Bjlk_F8B8NHS_BH_Bias_HAS_SAV_UserArgs_MT128x64x128_MI16x16x1_SN_LDSB1_CLR1_GRVWA16_GRVWB16_GSU0_GSUC0_GSUWGMRR0_K1_LBSPPA512_LBSPPB512_LPA16_LPB32_LRVW8_MIWT4_2_PLR1_SU0_SUM0_SUS128_VWA4_VWB2_WGM4_WGMXCC1_WGMXCCGn1
    SolutionIndex: 63
    SolutionNameMin: Cijk_Alik_Bjlk_F8B8NHS_BH_Bias_HAS_SAV_UserArgs_MT64x64x128_MI16x16x1_SN_LDSB1_CLR1_GRVWA8_GRVWB16_GSU0_GSUC0_GSUWGMRR0_K1_LBSPPA256_LBSPPB512_LPA8_LPB32_LRVW8_MIWT2_2_PLR1_SU0_SUM0_SUS128_VWA2_VWB2_WGM1_WGMXCC1_WGMXCCGn1
    SolutionIndex: 64
    SolutionNameMin: Cijk_Alik_Bjlk_F8B8NHS_BH_Bias_HAS_SAV_UserArgs_MT64x64x128_MI16x16x1_SN_LDSB1_CLR1_GRVWA16_GRVWB16_GSU0_GSUC0_GSUWGMRR0_K1_LBSPPA256_LBSPPB512_LPA16_LPB32_LRVW8_MIWT2_2_PLR1_SU0_SUM0_SUS128_VWA2_VWB2_WGM1_WGMXCC1_WGMXCCGn1
    SolutionIndex: 65
    SolutionNameMin: Cijk_Alik_Bjlk_F8B8NHS_BH_Bias_HAS_SAV_UserArgs_MT64x64x128_MI16x16x1_SN_LDSB1_CLR1_GRVWA8_GRVWB16_GSU0_GSUC0_GSUWGMRR0_K1_LBSPPA256_LBSPPB512_LPA8_LPB32_LRVW8_MIWT2_2_PLR1_SU0_SUM0_SUS128_VWA2_VWB2_WGM4_WGMXCC1_WGMXCCGn1
    SolutionIndex: 66
    SolutionNameMin: Cijk_Alik_Bjlk_F8B8NHS_BH_Bias_HAS_SAV_UserArgs_MT64x64x128_MI16x16x1_SN_LDSB1_CLR1_GRVWA8_GRVWB16_GSU0_GSUC0_GSUWGMRR0_K1_LBSPPA256_LBSPPB512_LPA8_LPB32_LRVW8_MIWT2_2_PLR1_SU0_SUM0_SUS128_VWA2_VWB2_WGM8_WGMXCC1_WGMXCCGn1
    SolutionIndex: 67
    SolutionNameMin: Cijk_Alik_Bjlk_F8B8NHS_BH_Bias_HAS_SAV_UserArgs_MT32x64x128_MI16x16x1_SN_LDSB0_CLR1_GRVWA8_GRVWB8_GSU0_GSUC0_GSUWGMRR0_K1_LBSPPA128_LBSPPB512_LPA8_LPB32_LRVW8_MIWT1_2_PLR1_SU0_SUM0_SUS128_VWA1_VWB2_WGM1_WGMXCC1_WGMXCCGn1
    SolutionIndex: 68
    SolutionNameMin: Cijk_Alik_Bjlk_F8B8NHS_BH_Bias_HAS_SAV_UserArgs_MT32x64x128_MI16x16x1_SN_LDSB0_CLR1_GRVWA8_GRVWB16_GSU0_GSUC0_GSUWGMRR0_K1_LBSPPA128_LBSPPB512_LPA8_LPB32_LRVW8_MIWT1_2_PLR1_SU0_SUM0_SUS128_VWA1_VWB2_WGM4_WGMXCC1_WGMXCCGn1
    SolutionIndex: 69
    SolutionNameMin: Cijk_Alik_Bjlk_F8B8NHS_BH_Bias_HAS_SAV_UserArgs_MT64x32x128_MI16x16x1_SN_LDSB0_CLR1_GRVWA8_GRVWB8_GSU0_GSUC0_GSUWGMRR0_K1_LBSPPA256_LBSPPB256_LPA8_LPB16_LRVW8_MIWT2_1_PLR1_SU0_SUM0_SUS128_VWA2_VWB1_WGM1_WGMXCC1_WGMXCCGn1
    SolutionIndex: 70
    SolutionNameMin: Cijk_Alik_Bjlk_F8B8NHS_BH_Bias_HAS_SAV_UserArgs_MT64x32x128_MI16x16x1_SN_LDSB0_CLR1_GRVWA16_GRVWB8_GSU0_GSUC0_GSUWGMRR0_K1_LBSPPA256_LBSPPB256_LPA16_LPB16_LRVW8_MIWT2_1_PLR1_SU0_SUM0_SUS128_VWA2_VWB1_WGM1_WGMXCC1_WGMXCCGn1
    SolutionIndex: 71
    SolutionNameMin: Cijk_Alik_Bjlk_F8B8NHS_BH_Bias_HAS_SAV_UserArgs_MT64x32x128_MI16x16x1_SN_LDSB0_CLR1_GRVWA8_GRVWB16_GSU0_GSUC0_GSUWGMRR0_K1_LBSPPA256_LBSPPB256_LPA8_LPB16_LRVW8_MIWT2_1_PLR1_SU0_SUM0_SUS128_VWA2_VWB1_WGM1_WGMXCC1_WGMXCCGn1
    SolutionIndex: 72
    SolutionNameMin: Cijk_Alik_Bjlk_F8B8NHS_BH_Bias_HAS_SAV_UserArgs_MT64x32x128_MI16x16x1_SN_LDSB0_CLR1_GRVWA8_GRVWB16_GSU0_GSUC0_GSUWGMRR0_K1_LBSPPA256_LBSPPB256_LPA8_LPB16_LRVW8_MIWT2_1_PLR1_SU0_SUM0_SUS128_VWA2_VWB1_WGM4_WGMXCC1_WGMXCCGn1
    SolutionIndex: 73
    SolutionNameMin: Cijk_Alik_Bjlk_F8B8NHS_BH_Bias_HAS_SAV_UserArgs_MT64x32x128_MI16x16x1_SN_LDSB0_CLR1_GRVWA8_GRVWB16_GSU0_GSUC0_GSUWGMRR0_K1_LBSPPA256_LBSPPB256_LPA8_LPB16_LRVW8_MIWT2_1_PLR1_SU0_SUM0_SUS128_VWA2_VWB1_WGM6_WGMXCC1_WGMXCCGn1
    SolutionIndex: 74
    SolutionNameMin: Cijk_Alik_Bjlk_F8B8NHS_BH_Bias_HAS_SAV_UserArgs_MT64x32x128_MI16x16x1_SN_LDSB0_CLR1_GRVWA8_GRVWB16_GSU0_GSUC0_GSUWGMRR0_K1_LBSPPA256_LBSPPB256_LPA8_LPB16_LRVW8_MIWT2_1_PLR1_SU0_SUM0_SUS128_VWA2_VWB1_WGM8_WGMXCC1_WGMXCCGn1
    SolutionIndex: 75
    SolutionNameMin: Cijk_Alik_Bjlk_F8B8NHS_BH_Bias_HAS_SAV_UserArgs_MT32x32x128_MI16x16x1_SN_LDSB0_CLR1_GRVWA8_GRVWB8_GSU0_GSUC0_GSUWGMRR0_K1_LBSPPA128_LBSPPB256_LPA8_LPB16_LRVW8_MIWT1_1_PLR1_SU0_SUM0_SUS128_VWA1_VWB1_WGM1_WGMXCC1_WGMXCCGn1
    SolutionIndex: 76
    SolutionNameMin: Cijk_Alik_Bjlk_F8B8NHS_BH_Bias_HAS_SAV_UserArgs_MT32x32x128_MI16x16x1_SN_LDSB0_CLR1_GRVWA16_GRVWB8_GSU0_GSUC0_GSUWGMRR0_K1_LBSPPA128_LBSPPB256_LPA16_LPB16_LRVW8_MIWT1_1_PLR1_SU0_SUM0_SUS128_VWA1_VWB1_WGM1_WGMXCC1_WGMXCCGn1
    SolutionIndex: 77
    SolutionNameMin: Cijk_Alik_Bjlk_F8B8NHS_BH_Bias_HAS_SAV_UserArgs_MT32x32x128_MI16x16x1_SN_LDSB0_CLR1_GRVWA8_GRVWB16_GSU0_GSUC0_GSUWGMRR0_K1_LBSPPA128_LBSPPB256_LPA8_LPB16_LRVW8_MIWT1_1_PLR1_SU0_SUM0_SUS128_VWA1_VWB1_WGM1_WGMXCC1_WGMXCCGn1
    SolutionIndex: 78
    SolutionNameMin: Cijk_Alik_Bjlk_F8B8NHS_BH_Bias_HAS_SAV_UserArgs_MT32x32x128_MI16x16x1_SN_LDSB0_CLR1_GRVWA8_GRVWB16_GSU0_GSUC0_GSUWGMRR0_K1_LBSPPA128_LBSPPB256_LPA8_LPB16_LRVW8_MIWT1_1_PLR1_SU0_SUM0_SUS128_VWA1_VWB1_WGM4_WGMXCC1_WGMXCCGn1
    SolutionIndex: 79
    SolutionNameMin: Cijk_Alik_Bjlk_F8B8NHS_BH_Bias_HAS_SAV_UserArgs_MT32x32x128_MI16x16x1_SN_LDSB0_CLR1_GRVWA8_GRVWB16_GSU0_GSUC0_GSUWGMRR0_K1_LBSPPA128_LBSPPB256_LPA8_LPB16_LRVW8_MIWT1_1_PLR1_SU0_SUM0_SUS128_VWA1_VWB1_WGM6_WGMXCC1_WGMXCCGn1
    SolutionIndex: 80
    SolutionNameMin: Cijk_Alik_Bjlk_F8B8NHS_BH_Bias_HAS_SAV_UserArgs_MT128x64x256_MI16x16x1_SN_LDSB1_CLR1_GRVWA16_GRVWB16_GSU0_GSUC0_GSUWGMRR0_K1_LBSPPA1024_LBSPPB512_LPA16_LPB32_LRVW8_MIWT4_2_PLR1_SU0_SUM0_SUS256_VWA4_VWB2_WGM1_WGMXCC1_WGMXCCGn1
    SolutionIndex: 81
    SolutionNameMin: Cijk_Alik_Bjlk_F8B8NHS_BH_Bias_HAS_SAV_UserArgs_MT128x64x256_MI16x16x1_SN_LDSB1_CLR1_GRVWA16_GRVWB16_GSU0_GSUC0_GSUWGMRR0_K1_LBSPPA1024_LBSPPB512_LPA16_LPB32_LRVW8_MIWT4_2_PLR1_SU0_SUM0_SUS256_VWA4_VWB2_WGM4_WGMXCC1_WGMXCCGn1
    SolutionIndex: 82
    SolutionNameMin: Cijk_Alik_Bjlk_F8B8NHS_BH_Bias_HAS_SAV_UserArgs_MT128x64x256_MI16x16x1_SN_LDSB1_CLR1_GRVWA16_GRVWB16_GSU0_GSUC0_GSUWGMRR0_K1_LBSPPA1024_LBSPPB512_LPA16_LPB32_LRVW8_MIWT4_2_PLR1_SU0_SUM0_SUS256_VWA4_VWB2_WGM6_WGMXCC1_WGMXCCGn1
    SolutionIndex: 83
    SolutionNameMin: Cijk_Alik_Bjlk_F8B8NHS_BH_Bias_HAS_SAV_UserArgs_MT128x64x256_MI16x16x1_SN_LDSB1_CLR1_GRVWA16_GRVWB16_GSU0_GSUC0_GSUWGMRR0_K1_LBSPPA1024_LBSPPB512_LPA16_LPB32_LRVW8_MIWT4_2_PLR1_SU0_SUM0_SUS256_VWA4_VWB2_WGM8_WGMXCC1_WGMXCCGn1
    SolutionIndex: 84
    SolutionNameMin: Cijk_Alik_Bjlk_F8B8NHS_BH_Bias_HAS_SAV_UserArgs_MT64x64x256_MI16x16x1_SN_LDSB1_CLR1_GRVWA16_GRVWB16_GSU0_GSUC0_GSUWGMRR0_K1_LBSPPA512_LBSPPB512_LPA16_LPB32_LRVW8_MIWT2_2_PLR1_SU0_SUM0_SUS256_VWA2_VWB2_WGM1_WGMXCC1_WGMXCCGn1
    SolutionIndex: 85
    SolutionNameMin: Cijk_Alik_Bjlk_F8B8NHS_BH_Bias_HAS_SAV_UserArgs_MT64x64x256_MI16x16x1_SN_LDSB1_CLR1_GRVWA16_GRVWB16_GSU0_GSUC0_GSUWGMRR0_K1_LBSPPA512_LBSPPB512_LPA16_LPB32_LRVW8_MIWT2_2_PLR1_SU0_SUM0_SUS256_VWA2_VWB2_WGM4_WGMXCC1_WGMXCCGn1
    SolutionIndex: 86
    SolutionNameMin: Cijk_Alik_Bjlk_F8B8NHS_BH_Bias_HAS_SAV_UserArgs_MT64x64x256_MI16x16x1_SN_LDSB1_CLR1_GRVWA16_GRVWB16_GSU0_GSUC0_GSUWGMRR0_K1_LBSPPA512_LBSPPB512_LPA16_LPB32_LRVW8_MIWT2_2_PLR1_SU0_SUM0_SUS256_VWA2_VWB2_WGM6_WGMXCC1_WGMXCCGn1
    SolutionIndex: 87
    SolutionNameMin: Cijk_Alik_Bjlk_F8B8NHS_BH_Bias_HAS_SAV_UserArgs_MT64x64x256_MI16x16x1_SN_LDSB1_CLR1_GRVWA16_GRVWB16_GSU0_GSUC0_GSUWGMRR0_K1_LBSPPA512_LBSPPB512_LPA16_LPB32_LRVW8_MIWT2_2_PLR1_SU0_SUM0_SUS256_VWA2_VWB2_WGM8_WGMXCC1_WGMXCCGn1
    SolutionIndex: 88
    SolutionNameMin: Cijk_Alik_Bjlk_F8B8NHS_BH_Bias_HAS_SAV_UserArgs_MT32x64x256_MI16x16x1_SN_LDSB1_CLR1_GRVWA16_GRVWB16_GSU0_GSUC0_GSUWGMRR0_K1_LBSPPA256_LBSPPB512_LPA16_LPB32_LRVW8_MIWT1_2_PLR1_SU0_SUM0_SUS256_VWA1_VWB2_WGM1_WGMXCC1_WGMXCCGn1
    SolutionIndex: 89
    SolutionNameMin: Cijk_Alik_Bjlk_F8B8NHS_BH_Bias_HAS_SAV_UserArgs_MT32x64x256_MI16x16x1_SN_LDSB1_CLR1_GRVWA8_GRVWB16_GSU0_GSUC0_GSUWGMRR0_K1_LBSPPA256_LBSPPB512_LPA8_LPB32_LRVW8_MIWT1_2_PLR1_SU0_SUM0_SUS256_VWA1_VWB2_WGM4_WGMXCC1_WGMXCCGn1
    SolutionIndex: 90
    SolutionNameMin: Cijk_Alik_Bjlk_F8B8NHS_BH_Bias_HAS_SAV_UserArgs_MT32x64x256_MI16x16x1_SN_LDSB1_CLR1_GRVWA16_GRVWB16_GSU0_GSUC0_GSUWGMRR0_K1_LBSPPA256_LBSPPB512_LPA16_LPB32_LRVW8_MIWT1_2_PLR1_SU0_SUM0_SUS256_VWA1_VWB2_WGM6_WGMXCC1_WGMXCCGn1
    SolutionIndex: 91
    SolutionNameMin: Cijk_Alik_Bjlk_F8B8NHS_BH_Bias_HAS_SAV_UserArgs_MT32x64x256_MI16x16x1_SN_LDSB1_CLR1_GRVWA8_GRVWB16_GSU0_GSUC0_GSUWGMRR0_K1_LBSPPA256_LBSPPB512_LPA8_LPB32_LRVW8_MIWT1_2_PLR1_SU0_SUM0_SUS256_VWA1_VWB2_WGM8_WGMXCC1_WGMXCCGn1
    SolutionIndex: 92
    SolutionNameMin: Cijk_Alik_Bjlk_F8B8NHS_BH_Bias_HAS_SAV_UserArgs_MT64x32x256_MI16x16x1_SN_LDSB1_CLR1_GRVWA16_GRVWB16_GSU0_GSUC0_GSUWGMRR0_K1_LBSPPA512_LBSPPB256_LPA16_LPB16_LRVW8_MIWT2_1_PLR1_SU0_SUM0_SUS256_VWA2_VWB1_WGM8_WGMXCC1_WGMXCCGn1
    SolutionIndex: 93
    SolutionNameMin: Cijk_Alik_Bjlk_F8B8NHS_BH_Bias_HAS_SAV_UserArgs_MT32x32x256_MI16x16x1_SN_LDSB1_CLR1_GRVWA8_GRVWB16_GSU0_GSUC0_GSUWGMRR0_K1_LBSPPA256_LBSPPB256_LPA8_LPB16_LRVW8_MIWT1_1_PLR1_SU0_SUM0_SUS256_VWA1_VWB1_WGM1_WGMXCC1_WGMXCCGn1
    SolutionIndex: 94
    SolutionNameMin: Cijk_Alik_Bjlk_F8B8NHS_BH_Bias_HAS_SAV_UserArgs_MT32x32x256_MI16x16x1_SN_LDSB1_CLR1_GRVWA16_GRVWB16_GSU0_GSUC0_GSUWGMRR0_K1_LBSPPA256_LBSPPB256_LPA16_LPB16_LRVW8_MIWT1_1_PLR1_SU0_SUM0_SUS256_VWA1_VWB1_WGM1_WGMXCC1_WGMXCCGn1
    SolutionIndex: 95
    SolutionNameMin: Cijk_Alik_Bjlk_F8B8NHS_BH_Bias_HAS_SAV_UserArgs_MT32x32x256_MI16x16x1_SN_LDSB1_CLR1_GRVWA8_GRVWB16_GSU0_GSUC0_GSUWGMRR0_K1_LBSPPA256_LBSPPB256_LPA8_LPB16_LRVW8_MIWT1_1_PLR1_SU0_SUM0_SUS256_VWA1_VWB1_WGM6_WGMXCC1_WGMXCCGn1
    SolutionIndex: 96
    SolutionNameMin: Cijk_Alik_Bjlk_F8B8NHS_BH_Bias_HAS_SAV_UserArgs_MT32x32x256_MI16x16x1_SN_LDSB1_CLR1_GRVWA16_GRVWB16_GSU0_GSUC0_GSUWGMRR0_K1_LBSPPA256_LBSPPB256_LPA16_LPB16_LRVW8_MIWT1_1_PLR1_SU0_SUM0_SUS256_VWA1_VWB1_WGM8_WGMXCC1_WGMXCCGn1
- - - [128, 128, 1, 128, 128, 128, 128, 128]
    - [38, 0.56]
  - - [128, 128, 1, 256, 128, 128, 256, 128]
    - [38, 1.01]
  - - [128, 128, 1, 512, 128, 128, 512, 128]
    - [75, 1.74]
  - - [128, 128, 1, 1024, 128, 128, 1024, 128]
    - [75, 2.73]
  - - [128, 128, 1, 2048, 128, 128, 2048, 128]
    - [78, 3.8]
  - - [128, 128, 1, 4096, 128, 128, 4096, 128]
    - [77, 4.81]
  - - [128, 128, 1, 8192, 128, 128, 8192, 128]
    - [77, 5.5]
  - - [128, 256, 1, 128, 128, 128, 128, 256]
    - [38, 1.13]
  - - [128, 256, 1, 256, 128, 128, 256, 256]
    - [75, 2.05]
  - - [128, 256, 1, 512, 128, 128, 512, 256]
    - [75, 3.55]
  - - [128, 256, 1, 1024, 128, 128, 1024, 256]
    - [75, 5.48]
  - - [128, 256, 1, 2048, 128, 128, 2048, 256]
    - [77, 7.73]
  - - [128, 256, 1, 4096, 128, 128, 4096, 256]
    - [77, 9.63]
  - - [128, 256, 1, 8192, 128, 128, 8192, 256]
    - [77, 11.06]
  - - [128, 512, 1, 128, 128, 128, 128, 512]
    - [38, 2.25]
  - - [128, 512, 1, 256, 128, 128, 256, 512]
    - [75, 4.08]
  - - [128, 512, 1, 512, 128, 128, 512, 512]
    - [75, 7.05]
  - - [128, 512, 1, 1024, 128, 128, 1024, 512]
    - [75, 10.97]
  - - [128, 512, 1, 2048, 128, 128, 2048, 512]
    - [77, 15.24]
  - - [128, 512, 1, 4096, 128, 128, 4096, 512]
    - [77, 19.22]
  - - [128, 512, 1, 8192, 128, 128, 8192, 512]
    - [94, 18.88]
  - - [128, 1024, 1, 128, 128, 128, 128, 1024]
    - [75, 4.41]
  - - [128, 1024, 1, 256, 128, 128, 256, 1024]
    - [38, 7.93]
  - - [128, 1024, 1, 512, 128, 128, 512, 1024]
    - [75, 13.57]
  - - [128, 1024, 1, 1024, 128, 128, 1024, 1024]
    - [75, 21.2]
  - - [128, 1024, 1, 2048, 128, 128, 2048, 1024]
    - [77, 29.98]
  - - [128, 1024, 1, 4096, 128, 128, 4096, 1024]
    - [96, 31.17]
  - - [128, 1024, 1, 8192, 128, 128, 8192, 1024]
    - [95, 31.91]
  - - [128, 2048, 1, 128, 128, 128, 128, 2048]
    - [37, 8.09]
  - - [128, 2048, 1, 256, 128, 128, 256, 2048]
    - [67, 14.49]
  - - [128, 2048, 1, 512, 128, 128, 512, 2048]
    - [69, 24.28]
  - - [128, 2048, 1, 1024, 128, 128, 1024, 2048]
    - [71, 37.95]
  - - [128, 2048, 1, 2048, 128, 128, 2048, 2048]
    - [88, 43.8]
  - - [128, 2048, 1, 4096, 128, 128, 4096, 2048]
    - [88, 52.47]
  - - [128, 2048, 1, 8192, 128, 128, 8192, 2048]
    - [88, 59.47]
  - - [128, 4096, 1, 128, 128, 128, 128, 4096]
    - [34, 14.85]
  - - [128, 4096, 1, 256, 128, 128, 256, 4096]
    - [34, 26.17]
  - - [128, 4096, 1, 512, 128, 128, 512, 4096]
    - [33, 43.23]
  - - [128, 4096, 1, 1024, 128, 128, 1024, 4096]
    - [63, 64.62]
  - - [128, 4096, 1, 2048, 128, 128, 2048, 4096]
    - [84, 78.15]
  - - [128, 4096, 1, 4096, 128, 128, 4096, 4096]
    - [84, 96.15]
  - - [128, 4096, 1, 8192, 128, 128, 8192, 4096]
    - [84, 107.61]
  - - [128, 8192, 1, 128, 128, 128, 128, 8192]
    - [24, 24.97]
  - - [128, 8192, 1, 256, 128, 128, 256, 8192]
    - [26, 44.56]
  - - [128, 8192, 1, 512, 128, 128, 512, 8192]
    - [27, 72.08]
  - - [128, 8192, 1, 1024, 128, 128, 1024, 8192]
    - [27, 105.31]
  - - [128, 8192, 1, 2048, 128, 128, 2048, 8192]
    - [61, 122.34]
  - - [128, 8192, 1, 4096, 128, 128, 4096, 8192]
    - [61, 145.0]
  - - [128, 8192, 1, 8192, 128, 128, 8192, 8192]
    - [81, 153.88]
  - - [256, 128, 1, 128, 256, 256, 128, 128]
    - [38, 1.08]
  - - [256, 128, 1, 256, 256, 256, 256, 128]
    - [76, 1.99]
  - - [256, 128, 1, 512, 256, 256, 512, 128]
    - [75, 3.4]
  - - [256, 128, 1, 1024, 256, 256, 1024, 128]
    - [75, 5.44]
  - - [256, 128, 1, 2048, 256, 256, 2048, 128]
    - [77, 7.68]
  - - [256, 128, 1, 4096, 256, 256, 4096, 128]
    - [77, 9.61]
  - - [256, 128, 1, 8192, 256, 256, 8192, 128]
    - [77, 11.08]
  - - [256, 256, 1, 128, 256, 256, 128, 256]
    - [38, 2.14]
  - - [256, 256, 1, 256, 256, 256, 256, 256]
    - [75, 4.02]
  - - [256, 256, 1, 512, 256, 256, 512, 256]
    - [75, 6.87]
  - - [256, 256, 1, 1024, 256, 256, 1024, 256]
    - [75, 10.83]
  - - [256, 256, 1, 2048, 256, 256, 2048, 256]
    - [77, 15.27]
  - - [256, 256, 1, 4096, 256, 256, 4096, 256]
    - [77, 19.07]
  - - [256, 256, 1, 8192, 256, 256, 8192, 256]
    - [79, 21.88]
  - - [256, 512, 1, 128, 256, 256, 128, 512]
    - [76, 4.23]
  - - [256, 512, 1, 256, 256, 256, 256, 512]
    - [75, 7.73]
  - - [256, 512, 1, 512, 256, 256, 512, 512]
    - [75, 13.26]
  - - [256, 512, 1, 1024, 256, 256, 1024, 512]
    - [75, 21.28]
  - - [256, 512, 1, 2048, 256, 256, 2048, 512]
    - [77, 29.67]
  - - [256, 512, 1, 4096, 256, 256, 4096, 512]
    - [77, 37.7]
  - - [256, 512, 1, 8192, 256, 256, 8192, 512]
    - [93, 38.13]
  - - [256, 1024, 1, 128, 256, 256, 128, 1024]
    - [70, 7.97]
  - - [256, 1024, 1, 256, 256, 256, 256, 1024]
    - [70, 14.39]
  - - [256, 1024, 1, 512, 256, 256, 512, 1024]
    - [71, 24.08]
  - - [256, 1024, 1, 1024, 256, 256, 1024, 1024]
    - [71, 37.39]
  - - [256, 1024, 1, 2048, 256, 256, 2048, 1024]
    - [71, 50.99]
  - - [256, 1024, 1, 4096, 256, 256, 4096, 1024]
    - [92, 57.53]
  - - [256, 1024, 1, 8192, 256, 256, 8192, 1024]
    - [90, 59.63]
  - - [256, 2048, 1, 128, 256, 256, 128, 2048]
    - [33, 14.49]
  - - [256, 2048, 1, 256, 256, 256, 256, 2048]
    - [33, 25.94]
  - - [256, 2048, 1, 512, 256, 256, 512, 2048]
    - [63, 42.3]
  - - [256, 2048, 1, 1024, 256, 256, 1024, 2048]
    - [63, 64.07]
  - - [256, 2048, 1, 2048, 256, 256, 2048, 2048]
    - [84, 79.14]
  - - [256, 2048, 1, 4096, 256, 256, 4096, 2048]
    - [84, 96.09]
  - - [256, 2048, 1, 8192, 256, 256, 8192, 2048]
    - [84, 107.83]
  - - [256, 4096, 1, 128, 256, 256, 128, 4096]
    - [24, 24.61]
  - - [256, 4096, 1, 256, 256, 256, 256, 4096]
    - [26, 43.17]
  - - [256, 4096, 1, 512, 256, 256, 512, 4096]
    - [27, 70.55]
  - - [256, 4096, 1, 1024, 256, 256, 1024, 4096]
    - [27, 102.93]
  - - [256, 4096, 1, 2048, 256, 256, 2048, 4096]
    - [80, 124.31]
  - - [256, 4096, 1, 4096, 256, 256, 4096, 4096]
    - [80, 149.5]
  - - [256, 4096, 1, 8192, 256, 256, 8192, 4096]
    - [80, 163.75]
  - - [256, 8192, 1, 128, 256, 256, 128, 8192]
    - [23, 38.47]
  - - [256, 8192, 1, 256, 256, 256, 256, 8192]
    - [23, 66.43]
  - - [256, 8192, 1, 512, 256, 256, 512, 8192]
    - [57, 105.95]
  - - [256, 8192, 1, 1024, 256, 256, 1024, 8192]
    - [57, 155.73]
  - - [256, 8192, 1, 2048, 256, 256, 2048, 8192]
    - [57, 183.62]
  - - [256, 8192, 1, 4096, 256, 256, 4096, 8192]
    - [58, 210.27]
  - - [256, 8192, 1, 8192, 256, 256, 8192, 8192]
    - [57, 198.08]
  - - [512, 128, 1, 128, 512, 512, 128, 128]
    - [38, 2.24]
  - - [512, 128, 1, 256, 512, 512, 256, 128]
    - [38, 4.02]
  - - [512, 128, 1, 512, 512, 512, 512, 128]
    - [75, 6.83]
  - - [512, 128, 1, 1024, 512, 512, 1024, 128]
    - [75, 10.96]
  - - [512, 128, 1, 2048, 512, 512, 2048, 128]
    - [75, 15.27]
  - - [512, 128, 1, 4096, 512, 512, 4096, 128]
    - [77, 19.35]
  - - [512, 128, 1, 8192, 512, 512, 8192, 128]
    - [77, 21.97]
  - - [512, 256, 1, 128, 512, 512, 128, 256]
    - [38, 4.25]
  - - [512, 256, 1, 256, 512, 512, 256, 256]
    - [75, 7.73]
  - - [512, 256, 1, 512, 512, 512, 512, 256]
    - [75, 13.65]
  - - [512, 256, 1, 1024, 512, 512, 1024, 256]
    - [75, 21.26]
  - - [512, 256, 1, 2048, 512, 512, 2048, 256]
    - [75, 29.64]
  - - [512, 256, 1, 4096, 512, 512, 4096, 256]
    - [77, 37.57]
  - - [512, 256, 1, 8192, 512, 512, 8192, 256]
    - [78, 43.09]
  - - [512, 512, 1, 128, 512, 512, 128, 512]
    - [37, 8.13]
  - - [512, 512, 1, 256, 512, 512, 256, 512]
    - [70, 14.4]
  - - [512, 512, 1, 512, 512, 512, 512, 512]
    - [70, 24.33]
  - - [512, 512, 1, 1024, 512, 512, 1024, 512]
    - [71, 37.77]
  - - [512, 512, 1, 2048, 512, 512, 2048, 512]
    - [71, 51.54]
  - - [512, 512, 1, 4096, 512, 512, 4096, 512]
    - [73, 63.09]
  - - [512, 512, 1, 8192, 512, 512, 8192, 512]
    - [68, 64.25]
  - - [512, 1024, 1, 128, 512, 512, 128, 1024]
    - [34, 14.45]
  - - [512, 1024, 1, 256, 512, 512, 256, 1024]
    - [34, 25.98]
  - - [512, 1024, 1, 512, 512, 512, 512, 1024]
    - [33, 42.58]
  - - [512, 1024, 1, 1024, 512, 512, 1024, 1024]
    - [64, 63.93]
  - - [512, 1024, 1, 2048, 512, 512, 2048, 1024]
    - [84, 86.27]
  - - [512, 1024, 1, 4096, 512, 512, 4096, 1024]
    - [84, 97.96]
  - - [512, 1024, 1, 8192, 512, 512, 8192, 1024]
    - [86, 106.75]
  - - [512, 2048, 1, 128, 512, 512, 128, 2048]
    - [26, 24.81]
  - - [512, 2048, 1, 256, 512, 512, 256, 2048]
    - [26, 44.25]
  - - [512, 2048, 1, 512, 512, 512, 512, 2048]
    - [27, 70.29]
  - - [512, 2048, 1, 1024, 512, 512, 1024, 2048]
    - [30, 102.62]
  - - [512, 2048, 1, 2048, 512, 512, 2048, 2048]
    - [80, 125.21]
  - - [512, 2048, 1, 4096, 512, 512, 4096, 2048]
    - [80, 150.4]
  - - [512, 2048, 1, 8192, 512, 512, 8192, 2048]
    - [82, 158.82]
  - - [512, 4096, 1, 128, 512, 512, 128, 4096]
    - [22, 38.63]
  - - [512, 4096, 1, 256, 512, 512, 256, 4096]
    - [23, 66.34]
  - - [512, 4096, 1, 512, 512, 512, 512, 4096]
    - [23, 105.07]
  - - [512, 4096, 1, 1024, 512, 512, 1024, 4096]
    - [57, 154.96]
  - - [512, 4096, 1, 2048, 512, 512, 2048, 4096]
    - [57, 188.97]
  - - [512, 4096, 1, 4096, 512, 512, 4096, 4096]
    - [57, 217.08]
  - - [512, 4096, 1, 8192, 512, 512, 8192, 4096]
    - [57, 201.98]
  - - [512, 8192, 1, 128, 512, 512, 128, 8192]
    - [13, 55.51]
  - - [512, 8192, 1, 256, 512, 512, 256, 8192]
    - [13, 94.55]
  - - [512, 8192, 1, 512, 512, 512, 512, 8192]
    - [14, 150.71]
  - - [512, 8192, 1, 1024, 512, 512, 1024, 8192]
    - [14, 202.93]
  - - [512, 8192, 1, 2048, 512, 512, 2048, 8192]
    - [39, 240.8]
  - - [512, 8192, 1, 4096, 512, 512, 4096, 8192]
    - [39, 264.38]
  - - [512, 8192, 1, 8192, 512, 512, 8192, 8192]
    - [40, 233.39]
  - - [1024, 128, 1, 128, 1024, 1024, 128, 128]
    - [75, 4.16]
  - - [1024, 128, 1, 256, 1024, 1024, 256, 128]
    - [75, 7.88]
  - - [1024, 128, 1, 512, 1024, 1024, 512, 128]
    - [75, 13.48]
  - - [1024, 128, 1, 1024, 1024, 1024, 1024, 128]
    - [77, 21.09]
  - - [1024, 128, 1, 2048, 1024, 1024, 2048, 128]
    - [77, 30.09]
  - - [1024, 128, 1, 4096, 1024, 1024, 4096, 128]
    - [77, 37.54]
  - - [1024, 128, 1, 8192, 1024, 1024, 8192, 128]
    - [78, 42.94]
  - - [1024, 256, 1, 128, 1024, 1024, 128, 256]
    - [70, 7.84]
  - - [1024, 256, 1, 256, 1024, 1024, 256, 256]
    - [37, 14.3]
  - - [1024, 256, 1, 512, 1024, 1024, 512, 256]
    - [70, 24.29]
  - - [1024, 256, 1, 1024, 1024, 1024, 1024, 256]
    - [71, 37.09]
  - - [1024, 256, 1, 2048, 1024, 1024, 2048, 256]
    - [71, 51.04]
  - - [1024, 256, 1, 4096, 1024, 1024, 4096, 256]
    - [72, 62.7]
  - - [1024, 256, 1, 8192, 1024, 1024, 8192, 256]
    - [91, 70.64]
  - - [1024, 512, 1, 128, 1024, 1024, 128, 512]
    - [34, 14.45]
  - - [1024, 512, 1, 256, 1024, 1024, 256, 512]
    - [33, 25.61]
  - - [1024, 512, 1, 512, 1024, 1024, 512, 512]
    - [33, 42.21]
  - - [1024, 512, 1, 1024, 1024, 1024, 1024, 512]
    - [64, 63.67]
  - - [1024, 512, 1, 2048, 1024, 1024, 2048, 512]
    - [84, 86.75]
  - - [1024, 512, 1, 4096, 1024, 1024, 4096, 512]
    - [85, 102.44]
  - - [1024, 512, 1, 8192, 1024, 1024, 8192, 512]
    - [87, 107.3]
  - - [1024, 1024, 1, 128, 1024, 1024, 128, 1024]
    - [26, 24.74]
  - - [1024, 1024, 1, 256, 1024, 1024, 256, 1024]
    - [25, 43.32]
  - - [1024, 1024, 1, 512, 1024, 1024, 512, 1024]
    - [27, 70.19]
  - - [1024, 1024, 1, 1024, 1024, 1024, 1024, 1024]
    - [27, 103.22]
  - - [1024, 1024, 1, 2048, 1024, 1024, 2048, 1024]
    - [30, 127.77]
  - - [1024, 1024, 1, 4096, 1024, 1024, 4096, 1024]
    - [82, 147.32]
  - - [1024, 1024, 1, 8192, 1024, 1024, 8192, 1024]
    - [82, 159.16]
  - - [1024, 2048, 1, 128, 1024, 1024, 128, 2048]
    - [53, 38.57]
  - - [1024, 2048, 1, 256, 1024, 1024, 256, 2048]
    - [23, 67.42]
  - - [1024, 2048, 1, 512, 1024, 1024, 512, 2048]
    - [57, 106.62]
  - - [1024, 2048, 1, 1024, 1024, 1024, 1024, 2048]
    - [57, 152.63]
  - - [1024, 2048, 1, 2048, 1024, 1024, 2048, 2048]
    - [57, 191.82]
  - - [1024, 2048, 1, 4096, 1024, 1024, 4096, 2048]
    - [58, 216.82]
  - - [1024, 2048, 1, 8192, 1024, 1024, 8192, 2048]
    - [57, 205.3]
  - - [1024, 4096, 1, 128, 1024, 1024, 128, 4096]
    - [18, 58.16]
  - - [1024, 4096, 1, 256, 1024, 1024, 256, 4096]
    - [19, 99.68]
  - - [1024, 4096, 1, 512, 1024, 1024, 512, 4096]
    - [14, 149.53]
  - - [1024, 4096, 1, 1024, 1024, 1024, 1024, 4096]
    - [15, 196.3]
  - - [1024, 4096, 1, 2048, 1024, 1024, 2048, 4096]
    - [45, 245.35]
  - - [1024, 4096, 1, 4096, 1024, 1024, 4096, 4096]
    - [44, 256.09]
  - - [1024, 4096, 1, 8192, 1024, 1024, 8192, 4096]
    - [41, 234.66]
  - - [1024, 8192, 1, 128, 1024, 1024, 128, 8192]
    - [4, 66.55]
  - - [1024, 8192, 1, 256, 1024, 1024, 256, 8192]
    - [4, 112.27]
  - - [1024, 8192, 1, 512, 1024, 1024, 512, 8192]
    - [4, 175.22]
  - - [1024, 8192, 1, 1024, 1024, 1024, 1024, 8192]
    - [8, 238.09]
  - - [1024, 8192, 1, 2048, 1024, 1024, 2048, 8192]
    - [6, 275.15]
  - - [1024, 8192, 1, 4096, 1024, 1024, 4096, 8192]
    - [2, 262.16]
  - - [1024, 8192, 1, 8192, 1024, 1024, 8192, 8192]
    - [5, 282.44]
  - - [2048, 128, 1, 128, 2048, 2048, 128, 128]
    - [37, 8.16]
  - - [2048, 128, 1, 256, 2048, 2048, 256, 128]
    - [69, 14.34]
  - - [2048, 128, 1, 512, 2048, 2048, 512, 128]
    - [70, 24.26]
  - - [2048, 128, 1, 1024, 2048, 2048, 1024, 128]
    - [71, 37.18]
  - - [2048, 128, 1, 2048, 2048, 2048, 2048, 128]
    - [71, 51.5]
  - - [2048, 128, 1, 4096, 2048, 2048, 4096, 128]
    - [74, 62.97]
  - - [2048, 128, 1, 8192, 2048, 2048, 8192, 128]
    - [89, 70.8]
  - - [2048, 256, 1, 128, 2048, 2048, 128, 256]
    - [35, 14.31]
  - - [2048, 256, 1, 256, 2048, 2048, 256, 256]
    - [36, 25.56]
  - - [2048, 256, 1, 512, 2048, 2048, 512, 256]
    - [65, 41.94]
  - - [2048, 256, 1, 1024, 2048, 2048, 1024, 256]
    - [66, 64.12]
  - - [2048, 256, 1, 2048, 2048, 2048, 2048, 256]
    - [86, 86.45]
  - - [2048, 256, 1, 4096, 2048, 2048, 4096, 256]
    - [86, 105.05]
  - - [2048, 256, 1, 8192, 2048, 2048, 8192, 256]
    - [85, 117.21]
  - - [2048, 512, 1, 128, 2048, 2048, 128, 512]
    - [28, 24.85]
  - - [2048, 512, 1, 256, 2048, 2048, 256, 512]
    - [31, 43.47]
  - - [2048, 512, 1, 512, 2048, 2048, 512, 512]
    - [30, 71.38]
  - - [2048, 512, 1, 1024, 2048, 2048, 1024, 512]
    - [29, 103.76]
  - - [2048, 512, 1, 2048, 2048, 2048, 2048, 512]
    - [29, 134.18]
  - - [2048, 512, 1, 4096, 2048, 2048, 4096, 512]
    - [83, 149.58]
  - - [2048, 512, 1, 8192, 2048, 2048, 8192, 512]
    - [83, 159.43]
  - - [2048, 1024, 1, 128, 2048, 2048, 128, 1024]
    - [53, 38.83]
  - - [2048, 1024, 1, 256, 2048, 2048, 256, 1024]
    - [23, 66.91]
  - - [2048, 1024, 1, 512, 2048, 2048, 512, 1024]
    - [57, 106.26]
  - - [2048, 1024, 1, 1024, 2048, 2048, 1024, 1024]
    - [58, 153.18]
  - - [2048, 1024, 1, 2048, 2048, 2048, 2048, 1024]
    - [58, 190.72]
  - - [2048, 1024, 1, 4096, 2048, 2048, 4096, 1024]
    - [58, 207.09]
  - - [2048, 1024, 1, 8192, 2048, 2048, 8192, 1024]
    - [60, 203.99]
  - - [2048, 2048, 1, 128, 2048, 2048, 128, 2048]
    - [15, 57.79]
  - - [2048, 2048, 1, 256, 2048, 2048, 256, 2048]
    - [12, 99.11]
  - - [2048, 2048, 1, 512, 2048, 2048, 512, 2048]
    - [14, 149.62]
  - - [2048, 2048, 1, 1024, 2048, 2048, 1024, 2048]
    - [14, 193.45]
  - - [2048, 2048, 1, 2048, 2048, 2048, 2048, 2048]
    - [40, 243.22]
  - - [2048, 2048, 1, 4096, 2048, 2048, 4096, 2048]
    - [43, 257.37]
  - - [2048, 2048, 1, 8192, 2048, 2048, 8192, 2048]
    - [49, 236.9]
  - - [2048, 4096, 1, 128, 2048, 2048, 128, 4096]
    - [2, 66.79]
  - - [2048, 4096, 1, 256, 2048, 2048, 256, 4096]
    - [1, 112.74]
  - - [2048, 4096, 1, 512, 2048, 2048, 512, 4096]
    - [6, 173.2]
  - - [2048, 4096, 1, 1024, 2048, 2048, 1024, 4096]
    - [4, 234.81]
  - - [2048, 4096, 1, 2048, 2048, 2048, 2048, 4096]
    - [7, 271.29]
  - - [2048, 4096, 1, 4096, 2048, 2048, 4096, 4096]
    - [3, 259.54]
  - - [2048, 4096, 1, 8192, 2048, 2048, 8192, 4096]
    - [7, 281.68]
  - - [2048, 8192, 1, 128, 2048, 2048, 128, 8192]
    - [2, 71.47]
  - - [2048, 8192, 1, 256, 2048, 2048, 256, 8192]
    - [1, 119.44]
  - - [2048, 8192, 1, 512, 2048, 2048, 512, 8192]
    - [8, 183.25]
  - - [2048, 8192, 1, 1024, 2048, 2048, 1024, 8192]
    - [6, 226.47]
  - - [2048, 8192, 1, 2048, 2048, 2048, 2048, 8192]
    - [11, 242.06]
  - - [2048, 8192, 1, 4096, 2048, 2048, 4096, 8192]
    - [41, 278.0]
  - - [2048, 8192, 1, 8192, 2048, 2048, 8192, 8192]
    - [9, 306.54]
  - - [4096, 128, 1, 128, 4096, 4096, 128, 128]
    - [34, 14.78]
  - - [4096, 128, 1, 256, 4096, 4096, 256, 128]
    - [34, 26.33]
  - - [4096, 128, 1, 512, 4096, 4096, 512, 128]
    - [63, 43.05]
  - - [4096, 128, 1, 1024, 4096, 4096, 1024, 128]
    - [63, 65.38]
  - - [4096, 128, 1, 2048, 4096, 4096, 2048, 128]
    - [84, 87.73]
  - - [4096, 128, 1, 4096, 4096, 4096, 4096, 128]
    - [85, 105.19]
  - - [4096, 128, 1, 8192, 4096, 4096, 8192, 128]
    - [84, 117.22]
  - - [4096, 256, 1, 128, 4096, 4096, 128, 256]
    - [24, 25.78]
  - - [4096, 256, 1, 256, 4096, 4096, 256, 256]
    - [26, 44.91]
  - - [4096, 256, 1, 512, 4096, 4096, 512, 256]
    - [27, 72.47]
  - - [4096, 256, 1, 1024, 4096, 4096, 1024, 256]
    - [27, 104.65]
  - - [4096, 256, 1, 2048, 4096, 4096, 2048, 256]
    - [30, 135.11]
  - - [4096, 256, 1, 4096, 4096, 4096, 4096, 256]
    - [81, 147.95]
  - - [4096, 256, 1, 8192, 4096, 4096, 8192, 256]
    - [81, 160.04]
  - - [4096, 512, 1, 128, 4096, 4096, 128, 512]
    - [53, 39.23]
  - - [4096, 512, 1, 256, 4096, 4096, 256, 512]
    - [23, 67.14]
  - - [4096, 512, 1, 512, 4096, 4096, 512, 512]
    - [23, 106.5]
  - - [4096, 512, 1, 1024, 4096, 4096, 1024, 512]
    - [58, 153.91]
  - - [4096, 512, 1, 2048, 4096, 4096, 2048, 512]
    - [60, 194.89]
  - - [4096, 512, 1, 4096, 4096, 4096, 4096, 512]
    - [58, 203.08]
  - - [4096, 512, 1, 8192, 4096, 4096, 8192, 512]
    - [58, 206.05]
  - - [4096, 1024, 1, 128, 4096, 4096, 128, 1024]
    - [15, 56.54]
  - - [4096, 1024, 1, 256, 4096, 4096, 256, 1024]
    - [13, 96.14]
  - - [4096, 1024, 1, 512, 4096, 4096, 512, 1024]
    - [20, 142.53]
  - - [4096, 1024, 1, 1024, 4096, 4096, 1024, 1024]
    - [46, 192.71]
  - - [4096, 1024, 1, 2048, 4096, 4096, 2048, 1024]
    - [40, 240.72]
  - - [4096, 1024, 1, 4096, 4096, 4096, 4096, 1024]
    - [40, 262.42]
  - - [4096, 1024, 1, 8192, 4096, 4096, 8192, 1024]
    - [42, 237.68]
  - - [4096, 2048, 1, 128, 4096, 4096, 128, 2048]
    - [2, 64.44]
  - - [4096, 2048, 1, 256, 4096, 4096, 256, 2048]
    - [1, 107.64]
  - - [4096, 2048, 1, 512, 4096, 4096, 512, 2048]
    - [4, 169.24]
  - - [4096, 2048, 1, 1024, 4096, 4096, 1024, 2048]
    - [6, 232.4]
  - - [4096, 2048, 1, 2048, 4096, 4096, 2048, 2048]
    - [8, 268.76]
  - - [4096, 2048, 1, 4096, 4096, 4096, 4096, 2048]
    - [48, 264.53]
  - - [4096, 2048, 1, 8192, 4096, 4096, 8192, 2048]
    - [52, 282.53]
  - - [4096, 4096, 1, 128, 4096, 4096, 128, 4096]
    - [2, 68.86]
  - - [4096, 4096, 1, 256, 4096, 4096, 256, 4096]
    - [0, 117.88]
  - - [4096, 4096, 1, 512, 4096, 4096, 512, 4096]
    - [3, 178.82]
  - - [4096, 4096, 1, 1024, 4096, 4096, 1024, 4096]
    - [4, 231.55]
  - - [4096, 4096, 1, 2048, 4096, 4096, 2048, 4096]
    - [50, 238.4]
  - - [4096, 4096, 1, 4096, 4096, 4096, 4096, 4096]
    - [10, 275.34]
  - - [4096, 4096, 1, 8192, 4096, 4096, 8192, 4096]
    - [48, 313.94]
  - - [4096, 8192, 1, 128, 4096, 4096, 128, 8192]
    - [2, 75.96]
  - - [4096, 8192, 1, 256, 4096, 4096, 256, 8192]
    - [2, 127.07]
  - - [4096, 8192, 1, 512, 4096, 4096, 512, 8192]
    - [10, 182.53]
  - - [4096, 8192, 1, 1024, 4096, 4096, 1024, 8192]
    - [47, 223.8]
  - - [4096, 8192, 1, 2048, 4096, 4096, 2048, 8192]
    - [43, 275.69]
  - - [4096, 8192, 1, 4096, 4096, 4096, 4096, 8192]
    - [1, 318.17]
  - - [4096, 8192, 1, 8192, 4096, 4096, 8192, 8192]
    - [2, 355.45]
  - - [8192, 128, 1, 128, 8192, 8192, 128, 128]
    - [24, 24.68]
  - - [8192, 128, 1, 256, 8192, 8192, 256, 128]
    - [25, 43.06]
  - - [8192, 128, 1, 512, 8192, 8192, 512, 128]
    - [27, 70.25]
  - - [8192, 128, 1, 1024, 8192, 8192, 1024, 128]
    - [32, 103.46]
  - - [8192, 128, 1, 2048, 8192, 8192, 2048, 128]
    - [82, 129.53]
  - - [8192, 128, 1, 4096, 8192, 8192, 4096, 128]
    - [62, 145.66]
  - - [8192, 128, 1, 8192, 8192, 8192, 8192, 128]
    - [86, 160.27]
  - - [8192, 256, 1, 128, 8192, 8192, 128, 256]
    - [21, 37.96]
  - - [8192, 256, 1, 256, 8192, 8192, 256, 256]
    - [23, 65.31]
  - - [8192, 256, 1, 512, 8192, 8192, 512, 256]
    - [59, 105.57]
  - - [8192, 256, 1, 1024, 8192, 8192, 1024, 256]
    - [59, 153.19]
  - - [8192, 256, 1, 2048, 8192, 8192, 2048, 256]
    - [60, 188.83]
  - - [8192, 256, 1, 4096, 8192, 8192, 4096, 256]
    - [59, 202.66]
  - - [8192, 256, 1, 8192, 8192, 8192, 8192, 256]
    - [58, 202.9]
  - - [8192, 512, 1, 128, 8192, 8192, 128, 512]
    - [17, 53.79]
  - - [8192, 512, 1, 256, 8192, 8192, 256, 512]
    - [16, 91.92]
  - - [8192, 512, 1, 512, 8192, 8192, 512, 512]
    - [54, 145.78]
  - - [8192, 512, 1, 1024, 8192, 8192, 1024, 512]
    - [56, 210.77]
  - - [8192, 512, 1, 2048, 8192, 8192, 2048, 512]
    - [56, 243.62]
  - - [8192, 512, 1, 4096, 8192, 8192, 4096, 512]
    - [55, 272.34]
  - - [8192, 512, 1, 8192, 8192, 8192, 8192, 512]
    - [56, 262.88]
  - - [8192, 1024, 1, 128, 8192, 8192, 128, 1024]
    - [6, 64.54]
  - - [8192, 1024, 1, 256, 8192, 8192, 256, 1024]
    - [8, 109.33]
  - - [8192, 1024, 1, 512, 8192, 8192, 512, 1024]
    - [50, 184.26]
  - - [8192, 1024, 1, 1024, 8192, 8192, 1024, 1024]
    - [50, 236.6]
  - - [8192, 1024, 1, 2048, 8192, 8192, 2048, 1024]
    - [49, 305.51]
  - - [8192, 1024, 1, 4096, 8192, 8192, 4096, 1024]
    - [49, 350.39]
  - - [8192, 1024, 1, 8192, 8192, 8192, 8192, 1024]
    - [49, 364.75]
  - - [8192, 2048, 1, 128, 8192, 8192, 128, 2048]
    - [50, 66.88]
  - - [8192, 2048, 1, 256, 8192, 8192, 256, 2048]
    - [49, 117.4]
  - - [8192, 2048, 1, 512, 8192, 8192, 512, 2048]
    - [49, 178.46]
  - - [8192, 2048, 1, 1024, 8192, 8192, 1024, 2048]
    - [52, 250.1]
  - - [8192, 2048, 1, 2048, 8192, 8192, 2048, 2048]
    - [52, 288.78]
  - - [8192, 2048, 1, 4096, 8192, 8192, 4096, 2048]
    - [52, 334.51]
  - - [8192, 2048, 1, 8192, 8192, 8192, 8192, 2048]
    - [49, 384.21]
  - - [8192, 4096, 1, 128, 8192, 8192, 128, 4096]
    - [51, 72.09]
  - - [8192, 4096, 1, 256, 8192, 8192, 256, 4096]
    - [52, 120.57]
  - - [8192, 4096, 1, 512, 8192, 8192, 512, 4096]
    - [10, 182.33]
  - - [8192, 4096, 1, 1024, 8192, 8192, 1024, 4096]
    - [49, 232.4]
  - - [8192, 4096, 1, 2048, 8192, 8192, 2048, 4096]
    - [52, 293.8]
  - - [8192, 4096, 1, 4096, 8192, 8192, 4096, 4096]
    - [49, 352.44]
  - - [8192, 4096, 1, 8192, 8192, 8192, 8192, 4096]
    - [49, 402.7]
  - - [8192, 8192, 1, 128, 8192, 8192, 128, 8192]
    - [2, 68.11]
  - - [8192, 8192, 1, 256, 8192, 8192, 256, 8192]
    - [15, 119.43]
  - - [8192, 8192, 1, 512, 8192, 8192, 512, 8192]
    - [1, 173.67]
  - - [8192, 8192, 1, 1024, 8192, 8192, 1024, 8192]
    - [3, 237.2]
  - - [8192, 8192, 1, 2048, 8192, 8192, 2048, 8192]
    - [50, 308.03]
  - - [8192, 8192, 1, 4096, 8192, 8192, 4096, 8192]
    - [52, 363.55]
  - - [8192, 8192, 1, 8192, 8192, 8192, 8192, 8192]
    - [49, 402.27]
- null
- null
- ExperimentalStreamK
- GridBased
