projects/hipblaslt/library/src/amd_detail/rocblaslt/src/Tensile/Logic/asm_full/aquavanjaram/gfx942_228cu/StreamK/aquavanjaram942_Cijk_Ailk_Bjlk_B8F8NF8NS_BH_Bias_HAS_SAV_UserArgs.yaml
- {MinimumRequiredVersion: 4.33.0}
- aquavanjaram942
- {Architecture: gfx942, CUCount: 228}
- [Device 0049, Device 0050]
    SolutionIndex: 0
    SolutionNameMin: Cijk_Ailk_Bjlk_B8F8NF8NS_BH_Bias_HAS_SAV_UserArgs_MT256x256x64_MI16x16x1_SN_LDSB0_CLR1_GRVWA16_GRVWB4_GSU0_GSUC0_GSUWGMRR0_K1_LBSPPA2048_LBSPPB2048_LPA0_LPB0_MIWT8_8_PLR1_SU0_SUM0_SUS64_VWA8_VWB8_WGM1_WGMXCC1_WGMXCCGn1
    SolutionIndex: 1
    SolutionNameMin: Cijk_Ailk_Bjlk_B8F8NF8NS_BH_Bias_HAS_SAV_UserArgs_MT256x256x64_MI16x16x1_SN_LDSB0_CLR1_GRVWA4_GRVWB8_GSU0_GSUC0_GSUWGMRR0_K1_LBSPPA2048_LBSPPB2048_LPA0_LPB0_MIWT8_8_PLR1_SU0_SUM0_SUS64_VWA8_VWB8_WGM1_WGMXCC1_WGMXCCGn1
    SolutionIndex: 2
    SolutionNameMin: Cijk_Ailk_Bjlk_B8F8NF8NS_BH_Bias_HAS_SAV_UserArgs_MT256x256x64_MI16x16x1_SN_LDSB0_CLR1_GRVWA4_GRVWB16_GSU0_GSUC0_GSUWGMRR0_K1_LBSPPA2048_LBSPPB2048_LPA0_LPB0_MIWT8_8_PLR1_SU0_SUM0_SUS64_VWA8_VWB8_WGM1_WGMXCC1_WGMXCCGn1
    SolutionIndex: 3
    SolutionNameMin: Cijk_Ailk_Bjlk_B8F8NF8NS_BH_Bias_HAS_SAV_UserArgs_MT256x256x64_MI16x16x1_SN_LDSB0_CLR1_GRVWA8_GRVWB16_GSU0_GSUC0_GSUWGMRR0_K1_LBSPPA2048_LBSPPB2048_LPA0_LPB0_MIWT8_8_PLR1_SU0_SUM0_SUS64_VWA8_VWB8_WGM1_WGMXCC1_WGMXCCGn1
    SolutionIndex: 4
    SolutionNameMin: Cijk_Ailk_Bjlk_B8F8NF8NS_BH_Bias_HAS_SAV_UserArgs_MT256x256x64_MI16x16x1_SN_LDSB0_CLR1_GRVWA16_GRVWB16_GSU0_GSUC0_GSUWGMRR0_K1_LBSPPA2048_LBSPPB2048_LPA0_LPB0_MIWT8_8_PLR1_SU0_SUM0_SUS64_VWA8_VWB8_WGM1_WGMXCC1_WGMXCCGn1
    SolutionIndex: 5
    SolutionNameMin: Cijk_Ailk_Bjlk_B8F8NF8NS_BH_Bias_HAS_SAV_UserArgs_MT256x256x64_MI16x16x1_SN_LDSB0_CLR1_GRVWA16_GRVWB4_GSU0_GSUC0_GSUWGMRR0_K1_LBSPPA2048_LBSPPB2048_LPA0_LPB0_MIWT8_8_PLR1_SU0_SUM0_SUS64_VWA8_VWB8_WGM4_WGMXCC1_WGMXCCGn1
    SolutionIndex: 6
    SolutionNameMin: Cijk_Ailk_Bjlk_B8F8NF8NS_BH_Bias_HAS_SAV_UserArgs_MT256x256x64_MI16x16x1_SN_LDSB0_CLR1_GRVWA16_GRVWB16_GSU0_GSUC0_GSUWGMRR0_K1_LBSPPA2048_LBSPPB2048_LPA0_LPB0_MIWT8_8_PLR1_SU0_SUM0_SUS64_VWA8_VWB8_WGM4_WGMXCC1_WGMXCCGn1
    SolutionIndex: 7
    SolutionNameMin: Cijk_Ailk_Bjlk_B8F8NF8NS_BH_Bias_HAS_SAV_UserArgs_MT256x256x64_MI16x16x1_SN_LDSB0_CLR1_GRVWA16_GRVWB4_GSU0_GSUC0_GSUWGMRR0_K1_LBSPPA2048_LBSPPB2048_LPA0_LPB0_MIWT8_8_PLR1_SU0_SUM0_SUS64_VWA8_VWB8_WGM6_WGMXCC1_WGMXCCGn1
    SolutionIndex: 8
    SolutionNameMin: Cijk_Ailk_Bjlk_B8F8NF8NS_BH_Bias_HAS_SAV_UserArgs_MT256x256x64_MI16x16x1_SN_LDSB0_CLR1_GRVWA4_GRVWB8_GSU0_GSUC0_GSUWGMRR0_K1_LBSPPA2048_LBSPPB2048_LPA0_LPB0_MIWT8_8_PLR1_SU0_SUM0_SUS64_VWA8_VWB8_WGM6_WGMXCC1_WGMXCCGn1
    SolutionIndex: 9
    SolutionNameMin: Cijk_Ailk_Bjlk_B8F8NF8NS_BH_Bias_HAS_SAV_UserArgs_MT256x256x64_MI16x16x1_SN_LDSB0_CLR1_GRVWA16_GRVWB8_GSU0_GSUC0_GSUWGMRR0_K1_LBSPPA2048_LBSPPB2048_LPA0_LPB0_MIWT8_8_PLR1_SU0_SUM0_SUS64_VWA8_VWB8_WGM6_WGMXCC1_WGMXCCGn1
    SolutionIndex: 10
    SolutionNameMin: Cijk_Ailk_Bjlk_B8F8NF8NS_BH_Bias_HAS_SAV_UserArgs_MT256x256x64_MI16x16x1_SN_LDSB0_CLR1_GRVWA4_GRVWB16_GSU0_GSUC0_GSUWGMRR0_K1_LBSPPA2048_LBSPPB2048_LPA0_LPB0_MIWT8_8_PLR1_SU0_SUM0_SUS64_VWA8_VWB8_WGM6_WGMXCC1_WGMXCCGn1
    SolutionIndex: 11
    SolutionNameMin: Cijk_Ailk_Bjlk_B8F8NF8NS_BH_Bias_HAS_SAV_UserArgs_MT256x256x64_MI16x16x1_SN_LDSB0_CLR1_GRVWA16_GRVWB16_GSU0_GSUC0_GSUWGMRR0_K1_LBSPPA2048_LBSPPB2048_LPA0_LPB0_MIWT8_8_PLR1_SU0_SUM0_SUS64_VWA8_VWB8_WGM6_WGMXCC1_WGMXCCGn1
    SolutionIndex: 12
    SolutionNameMin: Cijk_Ailk_Bjlk_B8F8NF8NS_BH_Bias_HAS_SAV_UserArgs_MT256x256x64_MI16x16x1_SN_LDSB0_CLR1_GRVWA16_GRVWB4_GSU0_GSUC0_GSUWGMRR0_K1_LBSPPA2048_LBSPPB2048_LPA0_LPB0_MIWT8_8_PLR1_SU0_SUM0_SUS64_VWA8_VWB8_WGM8_WGMXCC1_WGMXCCGn1
    SolutionIndex: 13
    SolutionNameMin: Cijk_Ailk_Bjlk_B8F8NF8NS_BH_Bias_HAS_SAV_UserArgs_MT256x256x64_MI16x16x1_SN_LDSB0_CLR1_GRVWA4_GRVWB8_GSU0_GSUC0_GSUWGMRR0_K1_LBSPPA2048_LBSPPB2048_LPA0_LPB0_MIWT8_8_PLR1_SU0_SUM0_SUS64_VWA8_VWB8_WGM8_WGMXCC1_WGMXCCGn1
    SolutionIndex: 14
    SolutionNameMin: Cijk_Ailk_Bjlk_B8F8NF8NS_BH_Bias_HAS_SAV_UserArgs_MT256x256x64_MI16x16x1_SN_LDSB0_CLR1_GRVWA4_GRVWB16_GSU0_GSUC0_GSUWGMRR0_K1_LBSPPA2048_LBSPPB2048_LPA0_LPB0_MIWT8_8_PLR1_SU0_SUM0_SUS64_VWA8_VWB8_WGM8_WGMXCC1_WGMXCCGn1
    SolutionIndex: 15
    SolutionNameMin: Cijk_Ailk_Bjlk_B8F8NF8NS_BH_Bias_HAS_SAV_UserArgs_MT256x256x64_MI16x16x1_SN_LDSB0_CLR1_GRVWA16_GRVWB16_GSU0_GSUC0_GSUWGMRR0_K1_LBSPPA2048_LBSPPB2048_LPA0_LPB0_MIWT8_8_PLR1_SU0_SUM0_SUS64_VWA8_VWB8_WGM8_WGMXCC1_WGMXCCGn1
    SolutionIndex: 16
    SolutionNameMin: Cijk_Ailk_Bjlk_B8F8NF8NS_BH_Bias_HAS_SAV_UserArgs_MT128x256x64_MI16x16x1_SN_LDSB1_CLR1_GRVWA4_GRVWB16_GSU0_GSUC0_GSUWGMRR0_K1_LBSPPA1024_LBSPPB2048_LPA64_LPB0_MIWT4_8_PLR1_SU0_SUM0_SUS64_VWA4_VWB8_WGM1_WGMXCC1_WGMXCCGn1
    SolutionIndex: 17
    SolutionNameMin: Cijk_Ailk_Bjlk_B8F8NF8NS_BH_Bias_HAS_SAV_UserArgs_MT128x256x64_MI16x16x1_SN_LDSB1_CLR1_GRVWA16_GRVWB16_GSU0_GSUC0_GSUWGMRR0_K1_LBSPPA1024_LBSPPB2048_LPA64_LPB0_MIWT4_8_PLR1_SU0_SUM0_SUS64_VWA4_VWB8_WGM1_WGMXCC1_WGMXCCGn1
    SolutionIndex: 18
    SolutionNameMin: Cijk_Ailk_Bjlk_B8F8NF8NS_BH_Bias_HAS_SAV_UserArgs_MT128x256x64_MI16x16x1_SN_LDSB1_CLR1_GRVWA8_GRVWB16_GSU0_GSUC0_GSUWGMRR0_K1_LBSPPA1024_LBSPPB2048_LPA64_LPB0_MIWT4_8_PLR1_SU0_SUM0_SUS64_VWA4_VWB8_WGM4_WGMXCC1_WGMXCCGn1
    SolutionIndex: 19
    SolutionNameMin: Cijk_Ailk_Bjlk_B8F8NF8NS_BH_Bias_HAS_SAV_UserArgs_MT128x256x64_MI16x16x1_SN_LDSB1_CLR1_GRVWA16_GRVWB16_GSU0_GSUC0_GSUWGMRR0_K1_LBSPPA1024_LBSPPB2048_LPA64_LPB0_MIWT4_8_PLR1_SU0_SUM0_SUS64_VWA4_VWB8_WGM4_WGMXCC1_WGMXCCGn1
    SolutionIndex: 20
    SolutionNameMin: Cijk_Ailk_Bjlk_B8F8NF8NS_BH_Bias_HAS_SAV_UserArgs_MT256x144x64_MI16x16x1_SN_LDSB0_CLR1_GRVWA4_GRVWB4_GSU0_GSUC0_GSUWGMRR0_K1_LBSPPA2048_LBSPPB1152_LPA64_LPB16_MIWT4_9_PLR1_SU0_SUM0_SUS64_VWA4_VWB1_WGM1_WGMXCC1_WGMXCCGn1
    SolutionIndex: 21
    SolutionNameMin: Cijk_Ailk_Bjlk_B8F8NF8NS_BH_Bias_HAS_SAV_UserArgs_MT256x144x64_MI16x16x1_SN_LDSB0_CLR1_GRVWA16_GRVWB4_GSU0_GSUC0_GSUWGMRR0_K1_LBSPPA2048_LBSPPB1152_LPA64_LPB16_MIWT4_9_PLR1_SU0_SUM0_SUS64_VWA4_VWB1_WGM1_WGMXCC1_WGMXCCGn1
    SolutionIndex: 22
    SolutionNameMin: Cijk_Ailk_Bjlk_B8F8NF8NS_BH_Bias_HAS_SAV_UserArgs_MT256x144x64_MI16x16x1_SN_LDSB0_CLR1_GRVWA16_GRVWB4_GSU0_GSUC0_GSUWGMRR0_K1_LBSPPA2048_LBSPPB1152_LPA64_LPB16_MIWT4_9_PLR1_SU0_SUM0_SUS64_VWA4_VWB1_WGM4_WGMXCC1_WGMXCCGn1
    SolutionIndex: 23
    SolutionNameMin: Cijk_Ailk_Bjlk_B8F8NF8NS_BH_Bias_HAS_SAV_UserArgs_MT256x144x64_MI16x16x1_SN_LDSB0_CLR1_GRVWA16_GRVWB4_GSU0_GSUC0_GSUWGMRR0_K1_LBSPPA2048_LBSPPB1152_LPA64_LPB16_MIWT4_9_PLR1_SU0_SUM0_SUS64_VWA4_VWB1_WGM8_WGMXCC1_WGMXCCGn1
    SolutionIndex: 24
    SolutionNameMin: Cijk_Ailk_Bjlk_B8F8NF8NS_BH_Bias_HAS_SAV_UserArgs_MT256x128x64_MI16x16x1_SN_LDSB1_CLR1_GRVWA4_GRVWB4_GSU0_GSUC0_GSUWGMRR0_K1_LBSPPA2048_LBSPPB1024_LPA0_LPB64_MIWT8_4_PLR1_SU0_SUM0_SUS64_VWA8_VWB4_WGM1_WGMXCC1_WGMXCCGn1
    SolutionIndex: 25
    SolutionNameMin: Cijk_Ailk_Bjlk_B8F8NF8NS_BH_Bias_HAS_SAV_UserArgs_MT256x128x64_MI16x16x1_SN_LDSB1_CLR1_GRVWA16_GRVWB4_GSU0_GSUC0_GSUWGMRR0_K1_LBSPPA2048_LBSPPB1024_LPA0_LPB64_MIWT8_4_PLR1_SU0_SUM0_SUS64_VWA8_VWB4_WGM1_WGMXCC1_WGMXCCGn1
    SolutionIndex: 26
    SolutionNameMin: Cijk_Ailk_Bjlk_B8F8NF8NS_BH_Bias_HAS_SAV_UserArgs_MT256x128x64_MI16x16x1_SN_LDSB1_CLR1_GRVWA4_GRVWB8_GSU0_GSUC0_GSUWGMRR0_K1_LBSPPA2048_LBSPPB1024_LPA0_LPB64_MIWT8_4_PLR1_SU0_SUM0_SUS64_VWA8_VWB4_WGM1_WGMXCC1_WGMXCCGn1
    SolutionIndex: 27
    SolutionNameMin: Cijk_Ailk_Bjlk_B8F8NF8NS_BH_Bias_HAS_SAV_UserArgs_MT256x128x64_MI16x16x1_SN_LDSB1_CLR1_GRVWA16_GRVWB8_GSU0_GSUC0_GSUWGMRR0_K1_LBSPPA2048_LBSPPB1024_LPA0_LPB64_MIWT8_4_PLR1_SU0_SUM0_SUS64_VWA8_VWB4_WGM1_WGMXCC1_WGMXCCGn1
    SolutionIndex: 28
    SolutionNameMin: Cijk_Ailk_Bjlk_B8F8NF8NS_BH_Bias_HAS_SAV_UserArgs_MT256x128x64_MI16x16x1_SN_LDSB1_CLR1_GRVWA16_GRVWB16_GSU0_GSUC0_GSUWGMRR0_K1_LBSPPA2048_LBSPPB1024_LPA0_LPB64_MIWT8_4_PLR1_SU0_SUM0_SUS64_VWA8_VWB4_WGM1_WGMXCC1_WGMXCCGn1
    SolutionIndex: 29
    SolutionNameMin: Cijk_Ailk_Bjlk_B8F8NF8NS_BH_Bias_HAS_SAV_UserArgs_MT256x128x64_MI16x16x1_SN_LDSB1_CLR1_GRVWA16_GRVWB16_GSU0_GSUC0_GSUWGMRR0_K1_LBSPPA2048_LBSPPB1024_LPA0_LPB64_MIWT8_4_PLR1_SU0_SUM0_SUS64_VWA8_VWB4_WGM4_WGMXCC1_WGMXCCGn1
    SolutionIndex: 30
    SolutionNameMin: Cijk_Ailk_Bjlk_B8F8NF8NS_BH_Bias_HAS_SAV_UserArgs_MT256x128x64_MI16x16x1_SN_LDSB1_CLR1_GRVWA4_GRVWB8_GSU0_GSUC0_GSUWGMRR0_K1_LBSPPA2048_LBSPPB1024_LPA0_LPB64_MIWT8_4_PLR1_SU0_SUM0_SUS64_VWA8_VWB4_WGM8_WGMXCC1_WGMXCCGn1
    SolutionIndex: 31
    SolutionNameMin: Cijk_Ailk_Bjlk_B8F8NF8NS_BH_Bias_HAS_SAV_UserArgs_MT256x128x64_MI16x16x1_SN_LDSB1_CLR1_GRVWA8_GRVWB8_GSU0_GSUC0_GSUWGMRR0_K1_LBSPPA2048_LBSPPB1024_LPA0_LPB64_MIWT8_4_PLR1_SU0_SUM0_SUS64_VWA8_VWB4_WGM8_WGMXCC1_WGMXCCGn1
    SolutionIndex: 32
    SolutionNameMin: Cijk_Ailk_Bjlk_B8F8NF8NS_BH_Bias_HAS_SAV_UserArgs_MT256x128x64_MI16x16x1_SN_LDSB1_CLR1_GRVWA16_GRVWB8_GSU0_GSUC0_GSUWGMRR0_K1_LBSPPA2048_LBSPPB1024_LPA0_LPB64_MIWT8_4_PLR1_SU0_SUM0_SUS64_VWA8_VWB4_WGM8_WGMXCC1_WGMXCCGn1
    SolutionIndex: 33
    SolutionNameMin: Cijk_Ailk_Bjlk_B8F8NF8NS_BH_Bias_HAS_SAV_UserArgs_MT256x128x64_MI16x16x1_SN_LDSB1_CLR1_GRVWA8_GRVWB16_GSU0_GSUC0_GSUWGMRR0_K1_LBSPPA2048_LBSPPB1024_LPA0_LPB64_MIWT8_4_PLR1_SU0_SUM0_SUS64_VWA8_VWB4_WGM8_WGMXCC1_WGMXCCGn1
    SolutionIndex: 34
    SolutionNameMin: Cijk_Ailk_Bjlk_B8F8NF8NS_BH_Bias_HAS_SAV_UserArgs_MT256x128x64_MI16x16x1_SN_LDSB1_CLR1_GRVWA16_GRVWB16_GSU0_GSUC0_GSUWGMRR0_K1_LBSPPA2048_LBSPPB1024_LPA0_LPB64_MIWT8_4_PLR1_SU0_SUM0_SUS64_VWA8_VWB4_WGM8_WGMXCC1_WGMXCCGn1
    SolutionIndex: 35
    SolutionNameMin: Cijk_Ailk_Bjlk_B8F8NF8NS_BH_Bias_HAS_SAV_UserArgs_MT128x128x64_MI16x16x1_SN_LDSB1_CLR1_GRVWA4_GRVWB16_GSU0_GSUC0_GSUWGMRR0_K1_LBSPPA1024_LBSPPB1024_LPA64_LPB64_MIWT4_4_PLR1_SU0_SUM0_SUS64_VWA4_VWB4_WGM1_WGMXCC1_WGMXCCGn1
    SolutionIndex: 36
    SolutionNameMin: Cijk_Ailk_Bjlk_B8F8NF8NS_BH_Bias_HAS_SAV_UserArgs_MT128x128x64_MI16x16x1_SN_LDSB1_CLR1_GRVWA8_GRVWB16_GSU0_GSUC0_GSUWGMRR0_K1_LBSPPA1024_LBSPPB1024_LPA64_LPB64_MIWT4_4_PLR1_SU0_SUM0_SUS64_VWA4_VWB4_WGM1_WGMXCC1_WGMXCCGn1
    SolutionIndex: 37
    SolutionNameMin: Cijk_Ailk_Bjlk_B8F8NF8NS_BH_Bias_HAS_SAV_UserArgs_MT128x128x64_MI16x16x1_SN_LDSB1_CLR1_GRVWA16_GRVWB16_GSU0_GSUC0_GSUWGMRR0_K1_LBSPPA1024_LBSPPB1024_LPA64_LPB64_MIWT4_4_PLR1_SU0_SUM0_SUS64_VWA4_VWB4_WGM1_WGMXCC1_WGMXCCGn1
    SolutionIndex: 38
    SolutionNameMin: Cijk_Ailk_Bjlk_B8F8NF8NS_BH_Bias_HAS_SAV_UserArgs_MT128x128x64_MI16x16x1_SN_LDSB1_CLR1_GRVWA16_GRVWB8_GSU0_GSUC0_GSUWGMRR0_K1_LBSPPA1024_LBSPPB1024_LPA64_LPB64_MIWT4_4_PLR1_SU0_SUM0_SUS64_VWA4_VWB4_WGM4_WGMXCC1_WGMXCCGn1
    SolutionIndex: 39
    SolutionNameMin: Cijk_Ailk_Bjlk_B8F8NF8NS_BH_Bias_HAS_SAV_UserArgs_MT128x128x64_MI16x16x1_SN_LDSB1_CLR1_GRVWA8_GRVWB16_GSU0_GSUC0_GSUWGMRR0_K1_LBSPPA1024_LBSPPB1024_LPA64_LPB64_MIWT4_4_PLR1_SU0_SUM0_SUS64_VWA4_VWB4_WGM4_WGMXCC1_WGMXCCGn1
    SolutionIndex: 40
    SolutionNameMin: Cijk_Ailk_Bjlk_B8F8NF8NS_BH_Bias_HAS_SAV_UserArgs_MT128x128x64_MI16x16x1_SN_LDSB1_CLR1_GRVWA16_GRVWB16_GSU0_GSUC0_GSUWGMRR0_K1_LBSPPA1024_LBSPPB1024_LPA64_LPB64_MIWT4_4_PLR1_SU0_SUM0_SUS64_VWA4_VWB4_WGM4_WGMXCC1_WGMXCCGn1
    SolutionIndex: 41
    SolutionNameMin: Cijk_Ailk_Bjlk_B8F8NF8NS_BH_Bias_HAS_SAV_UserArgs_MT128x128x64_MI16x16x1_SN_LDSB1_CLR1_GRVWA8_GRVWB16_GSU0_GSUC0_GSUWGMRR0_K1_LBSPPA1024_LBSPPB1024_LPA64_LPB64_MIWT4_4_PLR1_SU0_SUM0_SUS64_VWA4_VWB4_WGM6_WGMXCC1_WGMXCCGn1
    SolutionIndex: 42
    SolutionNameMin: Cijk_Ailk_Bjlk_B8F8NF8NS_BH_Bias_HAS_SAV_UserArgs_MT128x128x64_MI16x16x1_SN_LDSB1_CLR1_GRVWA16_GRVWB16_GSU0_GSUC0_GSUWGMRR0_K1_LBSPPA1024_LBSPPB1024_LPA64_LPB64_MIWT4_4_PLR1_SU0_SUM0_SUS64_VWA4_VWB4_WGM6_WGMXCC1_WGMXCCGn1
    SolutionIndex: 43
    SolutionNameMin: Cijk_Ailk_Bjlk_B8F8NF8NS_BH_Bias_HAS_SAV_UserArgs_MT128x128x64_MI16x16x1_SN_LDSB1_CLR1_GRVWA8_GRVWB16_GSU0_GSUC0_GSUWGMRR0_K1_LBSPPA1024_LBSPPB1024_LPA64_LPB64_MIWT4_4_PLR1_SU0_SUM0_SUS64_VWA4_VWB4_WGM8_WGMXCC1_WGMXCCGn1
    SolutionIndex: 44
    SolutionNameMin: Cijk_Ailk_Bjlk_B8F8NF8NS_BH_Bias_HAS_SAV_UserArgs_MT128x128x64_MI16x16x1_SN_LDSB1_CLR1_GRVWA16_GRVWB16_GSU0_GSUC0_GSUWGMRR0_K1_LBSPPA1024_LBSPPB1024_LPA64_LPB64_MIWT4_4_PLR1_SU0_SUM0_SUS64_VWA4_VWB4_WGM8_WGMXCC1_WGMXCCGn1
    SolutionIndex: 45
    SolutionNameMin: Cijk_Ailk_Bjlk_B8F8NF8NS_BH_Bias_HAS_SAV_UserArgs_MT64x128x64_MI16x16x1_SN_LDSB0_CLR1_GRVWA4_GRVWB8_GSU0_GSUC0_GSUWGMRR0_K1_LBSPPA512_LBSPPB1024_LPA32_LPB64_MIWT2_4_PLR1_SU0_SUM0_SUS64_VWA2_VWB4_WGM1_WGMXCC1_WGMXCCGn1
    SolutionIndex: 46
    SolutionNameMin: Cijk_Ailk_Bjlk_B8F8NF8NS_BH_Bias_HAS_SAV_UserArgs_MT64x128x64_MI16x16x1_SN_LDSB0_CLR1_GRVWA4_GRVWB16_GSU0_GSUC0_GSUWGMRR0_K1_LBSPPA512_LBSPPB1024_LPA32_LPB64_MIWT2_4_PLR1_SU0_SUM0_SUS64_VWA2_VWB4_WGM1_WGMXCC1_WGMXCCGn1
    SolutionIndex: 47
    SolutionNameMin: Cijk_Ailk_Bjlk_B8F8NF8NS_BH_Bias_HAS_SAV_UserArgs_MT64x128x64_MI16x16x1_SN_LDSB0_CLR1_GRVWA16_GRVWB16_GSU0_GSUC0_GSUWGMRR0_K1_LBSPPA512_LBSPPB1024_LPA32_LPB64_MIWT2_4_PLR1_SU0_SUM0_SUS64_VWA2_VWB4_WGM1_WGMXCC1_WGMXCCGn1
    SolutionIndex: 48
    SolutionNameMin: Cijk_Ailk_Bjlk_B8F8NF8NS_BH_Bias_HAS_SAV_UserArgs_MT128x64x64_MI16x16x1_SN_LDSB0_CLR1_GRVWA4_GRVWB8_GSU0_GSUC0_GSUWGMRR0_K1_LBSPPA1024_LBSPPB512_LPA64_LPB32_MIWT4_2_PLR1_SU0_SUM0_SUS64_VWA4_VWB2_WGM1_WGMXCC1_WGMXCCGn1
    SolutionIndex: 49
    SolutionNameMin: Cijk_Ailk_Bjlk_B8F8NF8NS_BH_Bias_HAS_SAV_UserArgs_MT128x64x64_MI16x16x1_SN_LDSB0_CLR1_GRVWA16_GRVWB8_GSU0_GSUC0_GSUWGMRR0_K1_LBSPPA1024_LBSPPB512_LPA64_LPB32_MIWT4_2_PLR1_SU0_SUM0_SUS64_VWA4_VWB2_WGM1_WGMXCC1_WGMXCCGn1
    SolutionIndex: 50
    SolutionNameMin: Cijk_Ailk_Bjlk_B8F8NF8NS_BH_Bias_HAS_SAV_UserArgs_MT128x64x64_MI16x16x1_SN_LDSB0_CLR1_GRVWA4_GRVWB8_GSU0_GSUC0_GSUWGMRR0_K1_LBSPPA1024_LBSPPB512_LPA64_LPB32_MIWT4_2_PLR1_SU0_SUM0_SUS64_VWA4_VWB2_WGM8_WGMXCC1_WGMXCCGn1
    SolutionIndex: 51
    SolutionNameMin: Cijk_Ailk_Bjlk_B8F8NF8NS_BH_Bias_HAS_SAV_UserArgs_MT64x64x64_MI16x16x1_SN_LDSB0_CLR1_GRVWA4_GRVWB4_GSU0_GSUC0_GSUWGMRR0_K1_LBSPPA512_LBSPPB512_LPA32_LPB32_MIWT2_2_PLR1_SU0_SUM0_SUS64_VWA2_VWB2_WGM1_WGMXCC1_WGMXCCGn1
    SolutionIndex: 52
    SolutionNameMin: Cijk_Ailk_Bjlk_B8F8NF8NS_BH_Bias_HAS_SAV_UserArgs_MT64x64x64_MI16x16x1_SN_LDSB0_CLR1_GRVWA8_GRVWB8_GSU0_GSUC0_GSUWGMRR0_K1_LBSPPA512_LBSPPB512_LPA32_LPB32_MIWT2_2_PLR1_SU0_SUM0_SUS64_VWA2_VWB2_WGM1_WGMXCC1_WGMXCCGn1
    SolutionIndex: 53
    SolutionNameMin: Cijk_Ailk_Bjlk_B8F8NF8NS_BH_Bias_HAS_SAV_UserArgs_MT64x64x64_MI16x16x1_SN_LDSB0_CLR1_GRVWA8_GRVWB16_GSU0_GSUC0_GSUWGMRR0_K1_LBSPPA512_LBSPPB512_LPA32_LPB32_MIWT2_2_PLR1_SU0_SUM0_SUS64_VWA2_VWB2_WGM1_WGMXCC1_WGMXCCGn1
    SolutionIndex: 54
    SolutionNameMin: Cijk_Ailk_Bjlk_B8F8NF8NS_BH_Bias_HAS_SAV_UserArgs_MT64x32x64_MI16x16x1_SN_LDSB0_CLR1_GRVWA4_GRVWB4_GSU0_GSUC0_GSUWGMRR0_K1_LBSPPA512_LBSPPB256_LPA32_LPB16_MIWT2_1_PLR1_SU0_SUM0_SUS64_VWA2_VWB1_WGM1_WGMXCC1_WGMXCCGn1
    SolutionIndex: 55
    SolutionNameMin: Cijk_Ailk_Bjlk_B8F8NF8NS_BH_Bias_HAS_SAV_UserArgs_MT64x32x64_MI16x16x1_SN_LDSB0_CLR1_GRVWA8_GRVWB4_GSU0_GSUC0_GSUWGMRR0_K1_LBSPPA512_LBSPPB256_LPA32_LPB16_MIWT2_1_PLR1_SU0_SUM0_SUS64_VWA2_VWB1_WGM1_WGMXCC1_WGMXCCGn1
    SolutionIndex: 56
    SolutionNameMin: Cijk_Ailk_Bjlk_B8F8NF8NS_BH_Bias_HAS_SAV_UserArgs_MT64x32x64_MI16x16x1_SN_LDSB0_CLR1_GRVWA4_GRVWB8_GSU0_GSUC0_GSUWGMRR0_K1_LBSPPA512_LBSPPB256_LPA32_LPB16_MIWT2_1_PLR1_SU0_SUM0_SUS64_VWA2_VWB1_WGM1_WGMXCC1_WGMXCCGn1
    SolutionIndex: 57
    SolutionNameMin: Cijk_Ailk_Bjlk_B8F8NF8NS_BH_Bias_HAS_SAV_UserArgs_MT32x32x64_MI16x16x1_SN_LDSB0_CLR1_GRVWA4_GRVWB4_GSU0_GSUC0_GSUWGMRR0_K1_LBSPPA256_LBSPPB256_LPA16_LPB16_MIWT1_1_PLR1_SU0_SUM0_SUS64_VWA1_VWB1_WGM1_WGMXCC1_WGMXCCGn1
    SolutionIndex: 58
    SolutionNameMin: Cijk_Ailk_Bjlk_B8F8NF8NS_BH_Bias_HAS_SAV_UserArgs_MT32x32x64_MI16x16x1_SN_LDSB0_CLR1_GRVWA8_GRVWB4_GSU0_GSUC0_GSUWGMRR0_K1_LBSPPA256_LBSPPB256_LPA16_LPB16_MIWT1_1_PLR1_SU0_SUM0_SUS64_VWA1_VWB1_WGM1_WGMXCC1_WGMXCCGn1
    SolutionIndex: 59
    SolutionNameMin: Cijk_Ailk_Bjlk_B8F8NF8NS_BH_Bias_HAS_SAV_UserArgs_MT32x32x64_MI16x16x1_SN_LDSB0_CLR1_GRVWA4_GRVWB8_GSU0_GSUC0_GSUWGMRR0_K1_LBSPPA256_LBSPPB256_LPA16_LPB16_MIWT1_1_PLR1_SU0_SUM0_SUS64_VWA1_VWB1_WGM1_WGMXCC1_WGMXCCGn1
    SolutionIndex: 60
    SolutionNameMin: Cijk_Ailk_Bjlk_B8F8NF8NS_BH_Bias_HAS_SAV_UserArgs_MT32x32x64_MI16x16x1_SN_LDSB0_CLR1_GRVWA8_GRVWB8_GSU0_GSUC0_GSUWGMRR0_K1_LBSPPA256_LBSPPB256_LPA16_LPB16_MIWT1_1_PLR1_SU0_SUM0_SUS64_VWA1_VWB1_WGM1_WGMXCC1_WGMXCCGn1
    SolutionIndex: 61
    SolutionNameMin: Cijk_Ailk_Bjlk_B8F8NF8NS_BH_Bias_HAS_SAV_UserArgs_MT32x32x64_MI16x16x1_SN_LDSB0_CLR1_GRVWA4_GRVWB4_GSU0_GSUC0_GSUWGMRR0_K1_LBSPPA256_LBSPPB256_LPA16_LPB16_MIWT1_1_PLR1_SU0_SUM0_SUS64_VWA1_VWB1_WGM6_WGMXCC1_WGMXCCGn1
    SolutionIndex: 62
    SolutionNameMin: Cijk_Ailk_Bjlk_B8F8NF8NS_BH_Bias_HAS_SAV_UserArgs_MT256x256x128_MI16x16x1_SN_LDSB1_CLR1_GRVWA16_GRVWB8_GSU0_GSUC0_GSUWGMRR0_K1_LBSPPA2048_LBSPPB2048_LPA0_LPB0_MIWT8_8_PLR1_SU0_SUM0_SUS128_VWA8_VWB8_WGM1_WGMXCC1_WGMXCCGn1
    SolutionIndex: 63
    SolutionNameMin: Cijk_Ailk_Bjlk_B8F8NF8NS_BH_Bias_HAS_SAV_UserArgs_MT256x256x128_MI16x16x1_SN_LDSB1_CLR1_GRVWA16_GRVWB16_GSU0_GSUC0_GSUWGMRR0_K1_LBSPPA2048_LBSPPB2048_LPA0_LPB0_MIWT8_8_PLR1_SU0_SUM0_SUS128_VWA8_VWB8_WGM1_WGMXCC1_WGMXCCGn1
    SolutionIndex: 64
    SolutionNameMin: Cijk_Ailk_Bjlk_B8F8NF8NS_BH_Bias_HAS_SAV_UserArgs_MT256x256x128_MI16x16x1_SN_LDSB1_CLR1_GRVWA8_GRVWB16_GSU0_GSUC0_GSUWGMRR0_K1_LBSPPA2048_LBSPPB2048_LPA0_LPB0_MIWT8_8_PLR1_SU0_SUM0_SUS128_VWA8_VWB8_WGM6_WGMXCC1_WGMXCCGn1
    SolutionIndex: 65
    SolutionNameMin: Cijk_Ailk_Bjlk_B8F8NF8NS_BH_Bias_HAS_SAV_UserArgs_MT256x256x128_MI16x16x1_SN_LDSB1_CLR1_GRVWA8_GRVWB16_GSU0_GSUC0_GSUWGMRR0_K1_LBSPPA2048_LBSPPB2048_LPA0_LPB0_MIWT8_8_PLR1_SU0_SUM0_SUS128_VWA8_VWB8_WGM8_WGMXCC1_WGMXCCGn1
    SolutionIndex: 66
    SolutionNameMin: Cijk_Ailk_Bjlk_B8F8NF8NS_BH_Bias_HAS_SAV_UserArgs_MT256x256x128_MI16x16x1_SN_LDSB1_CLR1_GRVWA16_GRVWB16_GSU0_GSUC0_GSUWGMRR0_K1_LBSPPA2048_LBSPPB2048_LPA0_LPB0_MIWT8_8_PLR1_SU0_SUM0_SUS128_VWA8_VWB8_WGM8_WGMXCC1_WGMXCCGn1
    SolutionIndex: 67
    SolutionNameMin: Cijk_Ailk_Bjlk_B8F8NF8NS_BH_Bias_HAS_SAV_UserArgs_MT128x256x128_MI16x16x1_SN_LDSB1_CLR1_GRVWA8_GRVWB16_GSU0_GSUC0_GSUWGMRR0_K1_LBSPPA1024_LBSPPB2048_LPA64_LPB0_MIWT4_8_PLR1_SU0_SUM0_SUS128_VWA4_VWB8_WGM1_WGMXCC1_WGMXCCGn1
    SolutionIndex: 68
    SolutionNameMin: Cijk_Ailk_Bjlk_B8F8NF8NS_BH_Bias_HAS_SAV_UserArgs_MT128x256x128_MI16x16x1_SN_LDSB1_CLR1_GRVWA16_GRVWB16_GSU0_GSUC0_GSUWGMRR0_K1_LBSPPA1024_LBSPPB2048_LPA64_LPB0_MIWT4_8_PLR1_SU0_SUM0_SUS128_VWA4_VWB8_WGM1_WGMXCC1_WGMXCCGn1
    SolutionIndex: 69
    SolutionNameMin: Cijk_Ailk_Bjlk_B8F8NF8NS_BH_Bias_HAS_SAV_UserArgs_MT128x256x128_MI16x16x1_SN_LDSB1_CLR1_GRVWA4_GRVWB16_GSU0_GSUC0_GSUWGMRR0_K1_LBSPPA1024_LBSPPB2048_LPA64_LPB0_MIWT4_8_PLR1_SU0_SUM0_SUS128_VWA4_VWB8_WGM4_WGMXCC1_WGMXCCGn1
    SolutionIndex: 70
    SolutionNameMin: Cijk_Ailk_Bjlk_B8F8NF8NS_BH_Bias_HAS_SAV_UserArgs_MT128x256x128_MI16x16x1_SN_LDSB1_CLR1_GRVWA16_GRVWB16_GSU0_GSUC0_GSUWGMRR0_K1_LBSPPA1024_LBSPPB2048_LPA64_LPB0_MIWT4_8_PLR1_SU0_SUM0_SUS128_VWA4_VWB8_WGM4_WGMXCC1_WGMXCCGn1
    SolutionIndex: 71
    SolutionNameMin: Cijk_Ailk_Bjlk_B8F8NF8NS_BH_Bias_HAS_SAV_UserArgs_MT128x256x128_MI16x16x1_SN_LDSB1_CLR1_GRVWA4_GRVWB16_GSU0_GSUC0_GSUWGMRR0_K1_LBSPPA1024_LBSPPB2048_LPA64_LPB0_MIWT4_8_PLR1_SU0_SUM0_SUS128_VWA4_VWB8_WGM6_WGMXCC1_WGMXCCGn1
    SolutionIndex: 72
    SolutionNameMin: Cijk_Ailk_Bjlk_B8F8NF8NS_BH_Bias_HAS_SAV_UserArgs_MT128x256x128_MI16x16x1_SN_LDSB1_CLR1_GRVWA8_GRVWB16_GSU0_GSUC0_GSUWGMRR0_K1_LBSPPA1024_LBSPPB2048_LPA64_LPB0_MIWT4_8_PLR1_SU0_SUM0_SUS128_VWA4_VWB8_WGM6_WGMXCC1_WGMXCCGn1
    SolutionIndex: 73
    SolutionNameMin: Cijk_Ailk_Bjlk_B8F8NF8NS_BH_Bias_HAS_SAV_UserArgs_MT128x256x128_MI16x16x1_SN_LDSB1_CLR1_GRVWA4_GRVWB16_GSU0_GSUC0_GSUWGMRR0_K1_LBSPPA1024_LBSPPB2048_LPA64_LPB0_MIWT4_8_PLR1_SU0_SUM0_SUS128_VWA4_VWB8_WGM8_WGMXCC1_WGMXCCGn1
    SolutionIndex: 74
    SolutionNameMin: Cijk_Ailk_Bjlk_B8F8NF8NS_BH_Bias_HAS_SAV_UserArgs_MT128x256x128_MI16x16x1_SN_LDSB1_CLR1_GRVWA8_GRVWB16_GSU0_GSUC0_GSUWGMRR0_K1_LBSPPA1024_LBSPPB2048_LPA64_LPB0_MIWT4_8_PLR1_SU0_SUM0_SUS128_VWA4_VWB8_WGM8_WGMXCC1_WGMXCCGn1
    SolutionIndex: 75
    SolutionNameMin: Cijk_Ailk_Bjlk_B8F8NF8NS_BH_Bias_HAS_SAV_UserArgs_MT128x256x128_MI16x16x1_SN_LDSB1_CLR1_GRVWA16_GRVWB16_GSU0_GSUC0_GSUWGMRR0_K1_LBSPPA1024_LBSPPB2048_LPA64_LPB0_MIWT4_8_PLR1_SU0_SUM0_SUS128_VWA4_VWB8_WGM8_WGMXCC1_WGMXCCGn1
    SolutionIndex: 76
    SolutionNameMin: Cijk_Ailk_Bjlk_B8F8NF8NS_BH_Bias_HAS_SAV_UserArgs_MT256x128x128_MI16x16x1_SN_LDSB1_CLR1_GRVWA16_GRVWB4_GSU0_GSUC0_GSUWGMRR0_K1_LBSPPA2048_LBSPPB1024_LPA0_LPB64_MIWT8_4_PLR1_SU0_SUM0_SUS128_VWA8_VWB4_WGM4_WGMXCC1_WGMXCCGn1
    SolutionIndex: 77
    SolutionNameMin: Cijk_Ailk_Bjlk_B8F8NF8NS_BH_Bias_HAS_SAV_UserArgs_MT128x128x128_MI16x16x1_SN_LDSB1_CLR1_GRVWA4_GRVWB16_GSU0_GSUC0_GSUWGMRR0_K1_LBSPPA1024_LBSPPB1024_LPA64_LPB64_MIWT4_4_PLR1_SU0_SUM0_SUS128_VWA4_VWB4_WGM1_WGMXCC1_WGMXCCGn1
    SolutionIndex: 78
    SolutionNameMin: Cijk_Ailk_Bjlk_B8F8NF8NS_BH_Bias_HAS_SAV_UserArgs_MT128x128x128_MI16x16x1_SN_LDSB1_CLR1_GRVWA16_GRVWB16_GSU0_GSUC0_GSUWGMRR0_K1_LBSPPA1024_LBSPPB1024_LPA64_LPB64_MIWT4_4_PLR1_SU0_SUM0_SUS128_VWA4_VWB4_WGM1_WGMXCC1_WGMXCCGn1
    SolutionIndex: 79
    SolutionNameMin: Cijk_Ailk_Bjlk_B8F8NF8NS_BH_Bias_HAS_SAV_UserArgs_MT128x128x128_MI16x16x1_SN_LDSB1_CLR1_GRVWA16_GRVWB16_GSU0_GSUC0_GSUWGMRR0_K1_LBSPPA1024_LBSPPB1024_LPA64_LPB64_MIWT4_4_PLR1_SU0_SUM0_SUS128_VWA4_VWB4_WGM8_WGMXCC1_WGMXCCGn1
    SolutionIndex: 80
    SolutionNameMin: Cijk_Ailk_Bjlk_B8F8NF8NS_BH_Bias_HAS_SAV_UserArgs_MT128x64x128_MI16x16x1_SN_LDSB1_CLR1_GRVWA4_GRVWB8_GSU0_GSUC0_GSUWGMRR0_K1_LBSPPA1024_LBSPPB512_LPA64_LPB32_MIWT4_2_PLR1_SU0_SUM0_SUS128_VWA4_VWB2_WGM1_WGMXCC1_WGMXCCGn1
    SolutionIndex: 81
    SolutionNameMin: Cijk_Ailk_Bjlk_B8F8NF8NS_BH_Bias_HAS_SAV_UserArgs_MT128x64x128_MI16x16x1_SN_LDSB1_CLR1_GRVWA16_GRVWB8_GSU0_GSUC0_GSUWGMRR0_K1_LBSPPA1024_LBSPPB512_LPA64_LPB32_MIWT4_2_PLR1_SU0_SUM0_SUS128_VWA4_VWB2_WGM1_WGMXCC1_WGMXCCGn1
    SolutionIndex: 82
    SolutionNameMin: Cijk_Ailk_Bjlk_B8F8NF8NS_BH_Bias_HAS_SAV_UserArgs_MT128x64x128_MI16x16x1_SN_LDSB1_CLR1_GRVWA16_GRVWB16_GSU0_GSUC0_GSUWGMRR0_K1_LBSPPA1024_LBSPPB512_LPA64_LPB32_MIWT4_2_PLR1_SU0_SUM0_SUS128_VWA4_VWB2_WGM1_WGMXCC1_WGMXCCGn1
    SolutionIndex: 83
    SolutionNameMin: Cijk_Ailk_Bjlk_B8F8NF8NS_BH_Bias_HAS_SAV_UserArgs_MT128x64x128_MI16x16x1_SN_LDSB1_CLR1_GRVWA16_GRVWB16_GSU0_GSUC0_GSUWGMRR0_K1_LBSPPA1024_LBSPPB512_LPA64_LPB32_MIWT4_2_PLR1_SU0_SUM0_SUS128_VWA4_VWB2_WGM4_WGMXCC1_WGMXCCGn1
    SolutionIndex: 84
    SolutionNameMin: Cijk_Ailk_Bjlk_B8F8NF8NS_BH_Bias_HAS_SAV_UserArgs_MT128x64x128_MI16x16x1_SN_LDSB1_CLR1_GRVWA16_GRVWB16_GSU0_GSUC0_GSUWGMRR0_K1_LBSPPA1024_LBSPPB512_LPA64_LPB32_MIWT4_2_PLR1_SU0_SUM0_SUS128_VWA4_VWB2_WGM6_WGMXCC1_WGMXCCGn1
    SolutionIndex: 85
    SolutionNameMin: Cijk_Ailk_Bjlk_B8F8NF8NS_BH_Bias_HAS_SAV_UserArgs_MT128x64x128_MI16x16x1_SN_LDSB1_CLR1_GRVWA16_GRVWB16_GSU0_GSUC0_GSUWGMRR0_K1_LBSPPA1024_LBSPPB512_LPA64_LPB32_MIWT4_2_PLR1_SU0_SUM0_SUS128_VWA4_VWB2_WGM8_WGMXCC1_WGMXCCGn1
    SolutionIndex: 86
    SolutionNameMin: Cijk_Ailk_Bjlk_B8F8NF8NS_BH_Bias_HAS_SAV_UserArgs_MT64x64x128_MI16x16x1_SN_LDSB1_CLR1_GRVWA4_GRVWB4_GSU0_GSUC0_GSUWGMRR0_K1_LBSPPA512_LBSPPB512_LPA32_LPB32_MIWT2_2_PLR1_SU0_SUM0_SUS128_VWA2_VWB2_WGM1_WGMXCC1_WGMXCCGn1
    SolutionIndex: 87
    SolutionNameMin: Cijk_Ailk_Bjlk_B8F8NF8NS_BH_Bias_HAS_SAV_UserArgs_MT64x64x128_MI16x16x1_SN_LDSB1_CLR1_GRVWA16_GRVWB8_GSU0_GSUC0_GSUWGMRR0_K1_LBSPPA512_LBSPPB512_LPA32_LPB32_MIWT2_2_PLR1_SU0_SUM0_SUS128_VWA2_VWB2_WGM1_WGMXCC1_WGMXCCGn1
    SolutionIndex: 88
    SolutionNameMin: Cijk_Ailk_Bjlk_B8F8NF8NS_BH_Bias_HAS_SAV_UserArgs_MT64x64x128_MI16x16x1_SN_LDSB1_CLR1_GRVWA4_GRVWB16_GSU0_GSUC0_GSUWGMRR0_K1_LBSPPA512_LBSPPB512_LPA32_LPB32_MIWT2_2_PLR1_SU0_SUM0_SUS128_VWA2_VWB2_WGM1_WGMXCC1_WGMXCCGn1
    SolutionIndex: 89
    SolutionNameMin: Cijk_Ailk_Bjlk_B8F8NF8NS_BH_Bias_HAS_SAV_UserArgs_MT64x64x128_MI16x16x1_SN_LDSB1_CLR1_GRVWA8_GRVWB16_GSU0_GSUC0_GSUWGMRR0_K1_LBSPPA512_LBSPPB512_LPA32_LPB32_MIWT2_2_PLR1_SU0_SUM0_SUS128_VWA2_VWB2_WGM1_WGMXCC1_WGMXCCGn1
    SolutionIndex: 90
    SolutionNameMin: Cijk_Ailk_Bjlk_B8F8NF8NS_BH_Bias_HAS_SAV_UserArgs_MT64x64x128_MI16x16x1_SN_LDSB1_CLR1_GRVWA16_GRVWB16_GSU0_GSUC0_GSUWGMRR0_K1_LBSPPA512_LBSPPB512_LPA32_LPB32_MIWT2_2_PLR1_SU0_SUM0_SUS128_VWA2_VWB2_WGM1_WGMXCC1_WGMXCCGn1
    SolutionIndex: 91
    SolutionNameMin: Cijk_Ailk_Bjlk_B8F8NF8NS_BH_Bias_HAS_SAV_UserArgs_MT64x64x128_MI16x16x1_SN_LDSB1_CLR1_GRVWA4_GRVWB16_GSU0_GSUC0_GSUWGMRR0_K1_LBSPPA512_LBSPPB512_LPA32_LPB32_MIWT2_2_PLR1_SU0_SUM0_SUS128_VWA2_VWB2_WGM4_WGMXCC1_WGMXCCGn1
    SolutionIndex: 92
    SolutionNameMin: Cijk_Ailk_Bjlk_B8F8NF8NS_BH_Bias_HAS_SAV_UserArgs_MT64x64x128_MI16x16x1_SN_LDSB1_CLR1_GRVWA16_GRVWB16_GSU0_GSUC0_GSUWGMRR0_K1_LBSPPA512_LBSPPB512_LPA32_LPB32_MIWT2_2_PLR1_SU0_SUM0_SUS128_VWA2_VWB2_WGM4_WGMXCC1_WGMXCCGn1
    SolutionIndex: 93
    SolutionNameMin: Cijk_Ailk_Bjlk_B8F8NF8NS_BH_Bias_HAS_SAV_UserArgs_MT64x64x128_MI16x16x1_SN_LDSB1_CLR1_GRVWA4_GRVWB16_GSU0_GSUC0_GSUWGMRR0_K1_LBSPPA512_LBSPPB512_LPA32_LPB32_MIWT2_2_PLR1_SU0_SUM0_SUS128_VWA2_VWB2_WGM6_WGMXCC1_WGMXCCGn1
    SolutionIndex: 94
    SolutionNameMin: Cijk_Ailk_Bjlk_B8F8NF8NS_BH_Bias_HAS_SAV_UserArgs_MT64x64x128_MI16x16x1_SN_LDSB1_CLR1_GRVWA8_GRVWB16_GSU0_GSUC0_GSUWGMRR0_K1_LBSPPA512_LBSPPB512_LPA32_LPB32_MIWT2_2_PLR1_SU0_SUM0_SUS128_VWA2_VWB2_WGM6_WGMXCC1_WGMXCCGn1
    SolutionIndex: 95
    SolutionNameMin: Cijk_Ailk_Bjlk_B8F8NF8NS_BH_Bias_HAS_SAV_UserArgs_MT64x64x128_MI16x16x1_SN_LDSB1_CLR1_GRVWA16_GRVWB16_GSU0_GSUC0_GSUWGMRR0_K1_LBSPPA512_LBSPPB512_LPA32_LPB32_MIWT2_2_PLR1_SU0_SUM0_SUS128_VWA2_VWB2_WGM6_WGMXCC1_WGMXCCGn1
    SolutionIndex: 96
    SolutionNameMin: Cijk_Ailk_Bjlk_B8F8NF8NS_BH_Bias_HAS_SAV_UserArgs_MT64x64x128_MI16x16x1_SN_LDSB1_CLR1_GRVWA16_GRVWB16_GSU0_GSUC0_GSUWGMRR0_K1_LBSPPA512_LBSPPB512_LPA32_LPB32_MIWT2_2_PLR1_SU0_SUM0_SUS128_VWA2_VWB2_WGM8_WGMXCC1_WGMXCCGn1
    SolutionIndex: 97
    SolutionNameMin: Cijk_Ailk_Bjlk_B8F8NF8NS_BH_Bias_HAS_SAV_UserArgs_MT32x64x128_MI16x16x1_SN_LDSB0_CLR1_GRVWA16_GRVWB16_GSU0_GSUC0_GSUWGMRR0_K1_LBSPPA256_LBSPPB512_LPA16_LPB32_MIWT1_2_PLR1_SU0_SUM0_SUS128_VWA1_VWB2_WGM1_WGMXCC1_WGMXCCGn1
    SolutionIndex: 98
    SolutionNameMin: Cijk_Ailk_Bjlk_B8F8NF8NS_BH_Bias_HAS_SAV_UserArgs_MT32x64x128_MI16x16x1_SN_LDSB0_CLR1_GRVWA16_GRVWB16_GSU0_GSUC0_GSUWGMRR0_K1_LBSPPA256_LBSPPB512_LPA16_LPB32_MIWT1_2_PLR1_SU0_SUM0_SUS128_VWA1_VWB2_WGM6_WGMXCC1_WGMXCCGn1
    SolutionIndex: 99
    SolutionNameMin: Cijk_Ailk_Bjlk_B8F8NF8NS_BH_Bias_HAS_SAV_UserArgs_MT32x64x128_MI16x16x1_SN_LDSB0_CLR1_GRVWA16_GRVWB16_GSU0_GSUC0_GSUWGMRR0_K1_LBSPPA256_LBSPPB512_LPA16_LPB32_MIWT1_2_PLR1_SU0_SUM0_SUS128_VWA1_VWB2_WGM8_WGMXCC1_WGMXCCGn1
    SolutionIndex: 100
    SolutionNameMin: Cijk_Ailk_Bjlk_B8F8NF8NS_BH_Bias_HAS_SAV_UserArgs_MT64x32x128_MI16x16x1_SN_LDSB0_CLR1_GRVWA4_GRVWB4_GSU0_GSUC0_GSUWGMRR0_K1_LBSPPA512_LBSPPB256_LPA32_LPB16_MIWT2_1_PLR1_SU0_SUM0_SUS128_VWA2_VWB1_WGM1_WGMXCC1_WGMXCCGn1
    SolutionIndex: 101
    SolutionNameMin: Cijk_Ailk_Bjlk_B8F8NF8NS_BH_Bias_HAS_SAV_UserArgs_MT64x32x128_MI16x16x1_SN_LDSB0_CLR1_GRVWA4_GRVWB8_GSU0_GSUC0_GSUWGMRR0_K1_LBSPPA512_LBSPPB256_LPA32_LPB16_MIWT2_1_PLR1_SU0_SUM0_SUS128_VWA2_VWB1_WGM1_WGMXCC1_WGMXCCGn1
    SolutionIndex: 102
    SolutionNameMin: Cijk_Ailk_Bjlk_B8F8NF8NS_BH_Bias_HAS_SAV_UserArgs_MT64x32x128_MI16x16x1_SN_LDSB0_CLR1_GRVWA8_GRVWB8_GSU0_GSUC0_GSUWGMRR0_K1_LBSPPA512_LBSPPB256_LPA32_LPB16_MIWT2_1_PLR1_SU0_SUM0_SUS128_VWA2_VWB1_WGM1_WGMXCC1_WGMXCCGn1
    SolutionIndex: 103
    SolutionNameMin: Cijk_Ailk_Bjlk_B8F8NF8NS_BH_Bias_HAS_SAV_UserArgs_MT64x32x128_MI16x16x1_SN_LDSB0_CLR1_GRVWA8_GRVWB16_GSU0_GSUC0_GSUWGMRR0_K1_LBSPPA512_LBSPPB256_LPA32_LPB16_MIWT2_1_PLR1_SU0_SUM0_SUS128_VWA2_VWB1_WGM1_WGMXCC1_WGMXCCGn1
    SolutionIndex: 104
    SolutionNameMin: Cijk_Ailk_Bjlk_B8F8NF8NS_BH_Bias_HAS_SAV_UserArgs_MT64x32x128_MI16x16x1_SN_LDSB0_CLR1_GRVWA16_GRVWB16_GSU0_GSUC0_GSUWGMRR0_K1_LBSPPA512_LBSPPB256_LPA32_LPB16_MIWT2_1_PLR1_SU0_SUM0_SUS128_VWA2_VWB1_WGM1_WGMXCC1_WGMXCCGn1
    SolutionIndex: 105
    SolutionNameMin: Cijk_Ailk_Bjlk_B8F8NF8NS_BH_Bias_HAS_SAV_UserArgs_MT64x32x128_MI16x16x1_SN_LDSB0_CLR1_GRVWA16_GRVWB16_GSU0_GSUC0_GSUWGMRR0_K1_LBSPPA512_LBSPPB256_LPA32_LPB16_MIWT2_1_PLR1_SU0_SUM0_SUS128_VWA2_VWB1_WGM8_WGMXCC1_WGMXCCGn1
    SolutionIndex: 106
    SolutionNameMin: Cijk_Ailk_Bjlk_B8F8NF8NS_BH_Bias_HAS_SAV_UserArgs_MT32x32x128_MI16x16x1_SN_LDSB0_CLR1_GRVWA4_GRVWB4_GSU0_GSUC0_GSUWGMRR0_K1_LBSPPA256_LBSPPB256_LPA16_LPB16_MIWT1_1_PLR1_SU0_SUM0_SUS128_VWA1_VWB1_WGM1_WGMXCC1_WGMXCCGn1
    SolutionIndex: 107
    SolutionNameMin: Cijk_Ailk_Bjlk_B8F8NF8NS_BH_Bias_HAS_SAV_UserArgs_MT32x32x128_MI16x16x1_SN_LDSB0_CLR1_GRVWA8_GRVWB4_GSU0_GSUC0_GSUWGMRR0_K1_LBSPPA256_LBSPPB256_LPA16_LPB16_MIWT1_1_PLR1_SU0_SUM0_SUS128_VWA1_VWB1_WGM1_WGMXCC1_WGMXCCGn1
    SolutionIndex: 108
    SolutionNameMin: Cijk_Ailk_Bjlk_B8F8NF8NS_BH_Bias_HAS_SAV_UserArgs_MT32x32x128_MI16x16x1_SN_LDSB0_CLR1_GRVWA4_GRVWB8_GSU0_GSUC0_GSUWGMRR0_K1_LBSPPA256_LBSPPB256_LPA16_LPB16_MIWT1_1_PLR1_SU0_SUM0_SUS128_VWA1_VWB1_WGM1_WGMXCC1_WGMXCCGn1
    SolutionIndex: 109
    SolutionNameMin: Cijk_Ailk_Bjlk_B8F8NF8NS_BH_Bias_HAS_SAV_UserArgs_MT32x32x128_MI16x16x1_SN_LDSB0_CLR1_GRVWA8_GRVWB8_GSU0_GSUC0_GSUWGMRR0_K1_LBSPPA256_LBSPPB256_LPA16_LPB16_MIWT1_1_PLR1_SU0_SUM0_SUS128_VWA1_VWB1_WGM1_WGMXCC1_WGMXCCGn1
    SolutionIndex: 110
    SolutionNameMin: Cijk_Ailk_Bjlk_B8F8NF8NS_BH_Bias_HAS_SAV_UserArgs_MT32x32x128_MI16x16x1_SN_LDSB0_CLR1_GRVWA4_GRVWB16_GSU0_GSUC0_GSUWGMRR0_K1_LBSPPA256_LBSPPB256_LPA16_LPB16_MIWT1_1_PLR1_SU0_SUM0_SUS128_VWA1_VWB1_WGM1_WGMXCC1_WGMXCCGn1
    SolutionIndex: 111
    SolutionNameMin: Cijk_Ailk_Bjlk_B8F8NF8NS_BH_Bias_HAS_SAV_UserArgs_MT32x32x128_MI16x16x1_SN_LDSB0_CLR1_GRVWA8_GRVWB16_GSU0_GSUC0_GSUWGMRR0_K1_LBSPPA256_LBSPPB256_LPA16_LPB16_MIWT1_1_PLR1_SU0_SUM0_SUS128_VWA1_VWB1_WGM1_WGMXCC1_WGMXCCGn1
    SolutionIndex: 112
    SolutionNameMin: Cijk_Ailk_Bjlk_B8F8NF8NS_BH_Bias_HAS_SAV_UserArgs_MT128x64x256_MI16x16x1_SN_LDSB1_CLR1_GRVWA4_GRVWB16_GSU0_GSUC0_GSUWGMRR0_K1_LBSPPA1024_LBSPPB512_LPA64_LPB32_MIWT4_2_PLR1_SU0_SUM0_SUS256_VWA4_VWB2_WGM1_WGMXCC1_WGMXCCGn1
    SolutionIndex: 113
    SolutionNameMin: Cijk_Ailk_Bjlk_B8F8NF8NS_BH_Bias_HAS_SAV_UserArgs_MT128x64x256_MI16x16x1_SN_LDSB1_CLR1_GRVWA16_GRVWB16_GSU0_GSUC0_GSUWGMRR0_K1_LBSPPA1024_LBSPPB512_LPA64_LPB32_MIWT4_2_PLR1_SU0_SUM0_SUS256_VWA4_VWB2_WGM1_WGMXCC1_WGMXCCGn1
    SolutionIndex: 114
    SolutionNameMin: Cijk_Ailk_Bjlk_B8F8NF8NS_BH_Bias_HAS_SAV_UserArgs_MT128x64x256_MI16x16x1_SN_LDSB1_CLR1_GRVWA16_GRVWB16_GSU0_GSUC0_GSUWGMRR0_K1_LBSPPA1024_LBSPPB512_LPA64_LPB32_MIWT4_2_PLR1_SU0_SUM0_SUS256_VWA4_VWB2_WGM8_WGMXCC1_WGMXCCGn1
    SolutionIndex: 115
    SolutionNameMin: Cijk_Ailk_Bjlk_B8F8NF8NS_BH_Bias_HAS_SAV_UserArgs_MT64x64x256_MI16x16x1_SN_LDSB1_CLR1_GRVWA16_GRVWB16_GSU0_GSUC0_GSUWGMRR0_K1_LBSPPA512_LBSPPB512_LPA32_LPB32_MIWT2_2_PLR1_SU0_SUM0_SUS256_VWA2_VWB2_WGM1_WGMXCC1_WGMXCCGn1
    SolutionIndex: 116
    SolutionNameMin: Cijk_Ailk_Bjlk_B8F8NF8NS_BH_Bias_HAS_SAV_UserArgs_MT64x64x256_MI16x16x1_SN_LDSB1_CLR1_GRVWA16_GRVWB16_GSU0_GSUC0_GSUWGMRR0_K1_LBSPPA512_LBSPPB512_LPA32_LPB32_MIWT2_2_PLR1_SU0_SUM0_SUS256_VWA2_VWB2_WGM4_WGMXCC1_WGMXCCGn1
    SolutionIndex: 117
    SolutionNameMin: Cijk_Ailk_Bjlk_B8F8NF8NS_BH_Bias_HAS_SAV_UserArgs_MT64x64x256_MI16x16x1_SN_LDSB1_CLR1_GRVWA16_GRVWB16_GSU0_GSUC0_GSUWGMRR0_K1_LBSPPA512_LBSPPB512_LPA32_LPB32_MIWT2_2_PLR1_SU0_SUM0_SUS256_VWA2_VWB2_WGM6_WGMXCC1_WGMXCCGn1
    SolutionIndex: 118
    SolutionNameMin: Cijk_Ailk_Bjlk_B8F8NF8NS_BH_Bias_HAS_SAV_UserArgs_MT64x32x256_MI16x16x1_SN_LDSB1_CLR1_GRVWA16_GRVWB16_GSU0_GSUC0_GSUWGMRR0_K1_LBSPPA512_LBSPPB256_LPA32_LPB16_MIWT2_1_PLR1_SU0_SUM0_SUS256_VWA2_VWB1_WGM1_WGMXCC1_WGMXCCGn1
    SolutionIndex: 119
    SolutionNameMin: Cijk_Ailk_Bjlk_B8F8NF8NS_BH_Bias_HAS_SAV_UserArgs_MT64x32x256_MI16x16x1_SN_LDSB1_CLR1_GRVWA16_GRVWB16_GSU0_GSUC0_GSUWGMRR0_K1_LBSPPA512_LBSPPB256_LPA32_LPB16_MIWT2_1_PLR1_SU0_SUM0_SUS256_VWA2_VWB1_WGM6_WGMXCC1_WGMXCCGn1
    SolutionIndex: 120
    SolutionNameMin: Cijk_Ailk_Bjlk_B8F8NF8NS_BH_Bias_HAS_SAV_UserArgs_MT32x32x256_MI16x16x1_SN_LDSB1_CLR1_GRVWA8_GRVWB16_GSU0_GSUC0_GSUWGMRR0_K1_LBSPPA256_LBSPPB256_LPA16_LPB16_MIWT1_1_PLR1_SU0_SUM0_SUS256_VWA1_VWB1_WGM1_WGMXCC1_WGMXCCGn1
    SolutionIndex: 121
    SolutionNameMin: Cijk_Ailk_Bjlk_B8F8NF8NS_BH_Bias_HAS_SAV_UserArgs_MT32x32x256_MI16x16x1_SN_LDSB1_CLR1_GRVWA16_GRVWB16_GSU0_GSUC0_GSUWGMRR0_K1_LBSPPA256_LBSPPB256_LPA16_LPB16_MIWT1_1_PLR1_SU0_SUM0_SUS256_VWA1_VWB1_WGM1_WGMXCC1_WGMXCCGn1
    SolutionIndex: 122
    SolutionNameMin: Cijk_Ailk_Bjlk_B8F8NF8NS_BH_Bias_HAS_SAV_UserArgs_MT32x32x256_MI16x16x1_SN_LDSB1_CLR1_GRVWA16_GRVWB16_GSU0_GSUC0_GSUWGMRR0_K1_LBSPPA256_LBSPPB256_LPA16_LPB16_MIWT1_1_PLR1_SU0_SUM0_SUS256_VWA1_VWB1_WGM6_WGMXCC1_WGMXCCGn1
    SolutionIndex: 123
    SolutionNameMin: Cijk_Ailk_Bjlk_B8F8NF8NS_BH_Bias_HAS_SAV_UserArgs_MT32x32x256_MI16x16x1_SN_LDSB1_CLR1_GRVWA16_GRVWB16_GSU0_GSUC0_GSUWGMRR0_K1_LBSPPA256_LBSPPB256_LPA16_LPB16_MIWT1_1_PLR1_SU0_SUM0_SUS256_VWA1_VWB1_WGM8_WGMXCC1_WGMXCCGn1
- - - [128, 128, 1, 128, 128, 128, 128, 128]
    - [107, 0.5]
  - - [128, 128, 1, 256, 128, 128, 128, 128]
    - [58, 0.89]
  - - [128, 128, 1, 512, 128, 128, 128, 128]
    - [108, 1.45]
  - - [128, 128, 1, 1024, 128, 128, 128, 128]
    - [110, 2.2]
  - - [128, 128, 1, 2048, 128, 128, 128, 128]
    - [111, 2.95]
  - - [128, 128, 1, 4096, 128, 128, 128, 128]
    - [111, 3.53]
  - - [128, 128, 1, 8192, 128, 128, 128, 128]
    - [121, 3.94]
  - - [128, 256, 1, 128, 128, 128, 128, 256]
    - [60, 1.02]
  - - [128, 256, 1, 256, 128, 128, 128, 256]
    - [59, 1.77]
  - - [128, 256, 1, 512, 128, 128, 128, 256]
    - [109, 2.93]
  - - [128, 256, 1, 1024, 128, 128, 128, 256]
    - [111, 4.43]
  - - [128, 256, 1, 2048, 128, 128, 128, 256]
    - [111, 5.87]
  - - [128, 256, 1, 4096, 128, 128, 128, 256]
    - [111, 7.04]
  - - [128, 256, 1, 8192, 128, 128, 128, 256]
    - [121, 7.88]
  - - [128, 512, 1, 128, 128, 128, 128, 512]
    - [60, 1.98]
  - - [128, 512, 1, 256, 128, 128, 128, 512]
    - [57, 3.53]
  - - [128, 512, 1, 512, 128, 128, 128, 512]
    - [106, 5.81]
  - - [128, 512, 1, 1024, 128, 128, 128, 512]
    - [111, 8.65]
  - - [128, 512, 1, 2048, 128, 128, 128, 512]
    - [111, 11.48]
  - - [128, 512, 1, 4096, 128, 128, 128, 512]
    - [111, 13.84]
  - - [128, 512, 1, 8192, 128, 128, 128, 512]
    - [120, 14.63]
  - - [128, 1024, 1, 128, 128, 128, 128, 1024]
    - [59, 3.88]
  - - [128, 1024, 1, 256, 128, 128, 128, 1024]
    - [57, 6.87]
  - - [128, 1024, 1, 512, 128, 128, 128, 1024]
    - [106, 11.27]
  - - [128, 1024, 1, 1024, 128, 128, 128, 1024]
    - [109, 16.9]
  - - [128, 1024, 1, 2048, 128, 128, 128, 1024]
    - [111, 22.5]
  - - [128, 1024, 1, 4096, 128, 128, 128, 1024]
    - [121, 25.29]
  - - [128, 1024, 1, 8192, 128, 128, 128, 1024]
    - [122, 27.69]
  - - [128, 2048, 1, 128, 128, 128, 128, 2048]
    - [56, 7.44]
  - - [128, 2048, 1, 256, 128, 128, 128, 2048]
    - [54, 12.99]
  - - [128, 2048, 1, 512, 128, 128, 128, 2048]
    - [100, 20.8]
  - - [128, 2048, 1, 1024, 128, 128, 128, 2048]
    - [104, 30.53]
  - - [128, 2048, 1, 2048, 128, 128, 128, 2048]
    - [118, 39.09]
  - - [128, 2048, 1, 4096, 128, 128, 128, 2048]
    - [119, 47.17]
  - - [128, 2048, 1, 8192, 128, 128, 128, 2048]
    - [119, 53.46]
  - - [128, 4096, 1, 128, 128, 128, 128, 4096]
    - [51, 13.9]
  - - [128, 4096, 1, 256, 128, 128, 128, 4096]
    - [51, 23.76]
  - - [128, 4096, 1, 512, 128, 128, 128, 4096]
    - [88, 37.28]
  - - [128, 4096, 1, 1024, 128, 128, 128, 4096]
    - [89, 53.78]
  - - [128, 4096, 1, 2048, 128, 128, 128, 4096]
    - [115, 67.21]
  - - [128, 4096, 1, 4096, 128, 128, 128, 4096]
    - [115, 81.98]
  - - [128, 4096, 1, 8192, 128, 128, 128, 4096]
    - [116, 90.94]
  - - [128, 8192, 1, 128, 128, 128, 128, 8192]
    - [48, 24.31]
  - - [128, 8192, 1, 256, 128, 128, 128, 8192]
    - [48, 41.58]
  - - [128, 8192, 1, 512, 128, 128, 128, 8192]
    - [49, 63.59]
  - - [128, 8192, 1, 1024, 128, 128, 128, 8192]
    - [82, 88.05]
  - - [128, 8192, 1, 2048, 128, 128, 128, 8192]
    - [82, 107.47]
  - - [128, 8192, 1, 4096, 128, 128, 128, 8192]
    - [113, 125.46]
  - - [128, 8192, 1, 8192, 128, 128, 128, 8192]
    - [112, 129.78]
  - - [256, 128, 1, 128, 256, 256, 256, 128]
    - [61, 0.96]
  - - [256, 128, 1, 256, 256, 256, 256, 128]
    - [57, 1.77]
  - - [256, 128, 1, 512, 256, 256, 256, 128]
    - [109, 2.93]
  - - [256, 128, 1, 1024, 256, 256, 256, 128]
    - [109, 4.4]
  - - [256, 128, 1, 2048, 256, 256, 256, 128]
    - [111, 5.88]
  - - [256, 128, 1, 4096, 256, 256, 256, 128]
    - [111, 7.06]
  - - [256, 128, 1, 8192, 256, 256, 256, 128]
    - [121, 7.87]
  - - [256, 256, 1, 128, 256, 256, 256, 256]
    - [109, 2.05]
  - - [256, 256, 1, 256, 256, 256, 256, 256]
    - [60, 3.61]
  - - [256, 256, 1, 512, 256, 256, 256, 256]
    - [109, 5.95]
  - - [256, 256, 1, 1024, 256, 256, 256, 256]
    - [109, 8.87]
  - - [256, 256, 1, 2048, 256, 256, 256, 256]
    - [111, 11.76]
  - - [256, 256, 1, 4096, 256, 256, 256, 256]
    - [111, 14.12]
  - - [256, 256, 1, 8192, 256, 256, 256, 256]
    - [121, 15.54]
  - - [256, 512, 1, 128, 256, 256, 256, 512]
    - [59, 4.0]
  - - [256, 512, 1, 256, 256, 256, 256, 512]
    - [60, 7.03]
  - - [256, 512, 1, 512, 256, 256, 256, 512]
    - [109, 11.44]
  - - [256, 512, 1, 1024, 256, 256, 256, 512]
    - [109, 17.04]
  - - [256, 512, 1, 2048, 256, 256, 256, 512]
    - [111, 22.85]
  - - [256, 512, 1, 4096, 256, 256, 256, 512]
    - [111, 27.47]
  - - [256, 512, 1, 8192, 256, 256, 256, 512]
    - [121, 30.19]
  - - [256, 1024, 1, 128, 256, 256, 256, 1024]
    - [54, 7.62]
  - - [256, 1024, 1, 256, 256, 256, 256, 1024]
    - [54, 13.09]
  - - [256, 1024, 1, 512, 256, 256, 256, 1024]
    - [102, 21.15]
  - - [256, 1024, 1, 1024, 256, 256, 256, 1024]
    - [103, 30.9]
  - - [256, 1024, 1, 2048, 256, 256, 256, 1024]
    - [118, 40.98]
  - - [256, 1024, 1, 4096, 256, 256, 256, 1024]
    - [118, 48.47]
  - - [256, 1024, 1, 8192, 256, 256, 256, 1024]
    - [119, 53.88]
  - - [256, 2048, 1, 128, 256, 256, 256, 2048]
    - [51, 14.09]
  - - [256, 2048, 1, 256, 256, 256, 256, 2048]
    - [51, 23.96]
  - - [256, 2048, 1, 512, 256, 256, 256, 2048]
    - [86, 37.85]
  - - [256, 2048, 1, 1024, 256, 256, 256, 2048]
    - [87, 54.35]
  - - [256, 2048, 1, 2048, 256, 256, 256, 2048]
    - [90, 68.23]
  - - [256, 2048, 1, 4096, 256, 256, 256, 2048]
    - [115, 79.22]
  - - [256, 2048, 1, 8192, 256, 256, 256, 2048]
    - [117, 86.96]
  - - [256, 4096, 1, 128, 256, 256, 256, 4096]
    - [48, 24.51]
  - - [256, 4096, 1, 256, 256, 256, 256, 4096]
    - [48, 41.86]
  - - [256, 4096, 1, 512, 256, 256, 256, 4096]
    - [48, 63.92]
  - - [256, 4096, 1, 1024, 256, 256, 256, 4096]
    - [80, 88.23]
  - - [256, 4096, 1, 2048, 256, 256, 256, 4096]
    - [82, 108.77]
  - - [256, 4096, 1, 4096, 256, 256, 256, 4096]
    - [82, 125.62]
  - - [256, 4096, 1, 8192, 256, 256, 256, 4096]
    - [114, 129.27]
  - - [256, 8192, 1, 128, 256, 256, 256, 8192]
    - [37, 38.63]
  - - [256, 8192, 1, 256, 256, 256, 256, 8192]
    - [35, 65.23]
  - - [256, 8192, 1, 512, 256, 256, 256, 8192]
    - [36, 98.74]
  - - [256, 8192, 1, 1024, 256, 256, 256, 8192]
    - [37, 133.92]
  - - [256, 8192, 1, 2048, 256, 256, 256, 8192]
    - [78, 160.97]
  - - [256, 8192, 1, 4096, 256, 256, 256, 8192]
    - [79, 179.44]
  - - [256, 8192, 1, 8192, 256, 256, 256, 8192]
    - [78, 164.45]
  - - [512, 128, 1, 128, 512, 512, 512, 128]
    - [58, 2.0]
  - - [512, 128, 1, 256, 512, 512, 512, 128]
    - [60, 3.58]
  - - [512, 128, 1, 512, 512, 512, 512, 128]
    - [108, 5.8]
  - - [512, 128, 1, 1024, 512, 512, 512, 128]
    - [111, 8.76]
  - - [512, 128, 1, 2048, 512, 512, 512, 128]
    - [111, 11.76]
  - - [512, 128, 1, 4096, 512, 512, 512, 128]
    - [111, 14.02]
  - - [512, 128, 1, 8192, 512, 512, 512, 128]
    - [122, 14.64]
  - - [512, 256, 1, 128, 512, 512, 512, 256]
    - [58, 4.04]
  - - [512, 256, 1, 256, 512, 512, 512, 256]
    - [58, 7.11]
  - - [512, 256, 1, 512, 512, 512, 512, 256]
    - [108, 11.44]
  - - [512, 256, 1, 1024, 512, 512, 512, 256]
    - [108, 17.33]
  - - [512, 256, 1, 2048, 512, 512, 512, 256]
    - [111, 22.95]
  - - [512, 256, 1, 4096, 512, 512, 512, 256]
    - [111, 27.53]
  - - [512, 256, 1, 8192, 512, 512, 512, 256]
    - [123, 28.77]
  - - [512, 512, 1, 128, 512, 512, 512, 512]
    - [55, 7.65]
  - - [512, 512, 1, 256, 512, 512, 512, 512]
    - [54, 13.08]
  - - [512, 512, 1, 512, 512, 512, 512, 512]
    - [101, 21.31]
  - - [512, 512, 1, 1024, 512, 512, 512, 512]
    - [103, 31.0]
  - - [512, 512, 1, 2048, 512, 512, 512, 512]
    - [118, 40.72]
  - - [512, 512, 1, 4096, 512, 512, 512, 512]
    - [118, 48.9]
  - - [512, 512, 1, 8192, 512, 512, 512, 512]
    - [97, 50.28]
  - - [512, 1024, 1, 128, 512, 512, 512, 1024]
    - [51, 13.93]
  - - [512, 1024, 1, 256, 512, 512, 512, 1024]
    - [51, 23.76]
  - - [512, 1024, 1, 512, 512, 512, 512, 1024]
    - [88, 37.35]
  - - [512, 1024, 1, 1024, 512, 512, 512, 1024]
    - [90, 54.02]
  - - [512, 1024, 1, 2048, 512, 512, 512, 1024]
    - [89, 69.26]
  - - [512, 1024, 1, 4096, 512, 512, 512, 1024]
    - [90, 78.1]
  - - [512, 1024, 1, 8192, 512, 512, 512, 1024]
    - [88, 81.95]
  - - [512, 2048, 1, 128, 512, 512, 512, 2048]
    - [48, 24.24]
  - - [512, 2048, 1, 256, 512, 512, 512, 2048]
    - [48, 41.06]
  - - [512, 2048, 1, 512, 512, 512, 512, 2048]
    - [48, 63.81]
  - - [512, 2048, 1, 1024, 512, 512, 512, 2048]
    - [82, 88.75]
  - - [512, 2048, 1, 2048, 512, 512, 512, 2048]
    - [82, 109.1]
  - - [512, 2048, 1, 4096, 512, 512, 512, 2048]
    - [82, 124.54]
  - - [512, 2048, 1, 8192, 512, 512, 512, 2048]
    - [82, 130.02]
  - - [512, 4096, 1, 128, 512, 512, 512, 4096]
    - [77, 37.92]
  - - [512, 4096, 1, 256, 512, 512, 512, 4096]
    - [35, 65.29]
  - - [512, 4096, 1, 512, 512, 512, 512, 4096]
    - [37, 98.85]
  - - [512, 4096, 1, 1024, 512, 512, 512, 4096]
    - [78, 134.31]
  - - [512, 4096, 1, 2048, 512, 512, 512, 4096]
    - [36, 160.37]
  - - [512, 4096, 1, 4096, 512, 512, 512, 4096]
    - [41, 176.47]
  - - [512, 4096, 1, 8192, 512, 512, 512, 4096]
    - [37, 163.05]
  - - [512, 8192, 1, 128, 512, 512, 512, 8192]
    - [26, 55.52]
  - - [512, 8192, 1, 256, 512, 512, 512, 8192]
    - [26, 93.44]
  - - [512, 8192, 1, 512, 512, 512, 512, 8192]
    - [28, 141.46]
  - - [512, 8192, 1, 1024, 512, 512, 512, 8192]
    - [28, 190.53]
  - - [512, 8192, 1, 2048, 512, 512, 512, 8192]
    - [28, 228.69]
  - - [512, 8192, 1, 4096, 512, 512, 512, 8192]
    - [76, 231.77]
  - - [512, 8192, 1, 8192, 512, 512, 512, 8192]
    - [67, 213.62]
  - - [1024, 128, 1, 128, 1024, 1024, 1024, 128]
    - [58, 3.91]
  - - [1024, 128, 1, 256, 1024, 1024, 1024, 128]
    - [57, 6.91]
  - - [1024, 128, 1, 512, 1024, 1024, 1024, 128]
    - [106, 11.29]
  - - [1024, 128, 1, 1024, 1024, 1024, 1024, 128]
    - [111, 16.86]
  - - [1024, 128, 1, 2048, 1024, 1024, 1024, 128]
    - [111, 22.82]
  - - [1024, 128, 1, 4096, 1024, 1024, 1024, 128]
    - [123, 25.09]
  - - [1024, 128, 1, 8192, 1024, 1024, 1024, 128]
    - [122, 26.35]
  - - [1024, 256, 1, 128, 1024, 1024, 1024, 256]
    - [55, 7.44]
  - - [1024, 256, 1, 256, 1024, 1024, 1024, 256]
    - [54, 12.99]
  - - [1024, 256, 1, 512, 1024, 1024, 1024, 256]
    - [101, 20.9]
  - - [1024, 256, 1, 1024, 1024, 1024, 1024, 256]
    - [103, 30.66]
  - - [1024, 256, 1, 2048, 1024, 1024, 1024, 256]
    - [118, 40.59]
  - - [1024, 256, 1, 4096, 1024, 1024, 1024, 256]
    - [105, 46.05]
  - - [1024, 256, 1, 8192, 1024, 1024, 1024, 256]
    - [119, 49.22]
  - - [1024, 512, 1, 128, 1024, 1024, 1024, 512]
    - [51, 13.86]
  - - [1024, 512, 1, 256, 1024, 1024, 1024, 512]
    - [51, 24.03]
  - - [1024, 512, 1, 512, 1024, 1024, 1024, 512]
    - [53, 37.54]
  - - [1024, 512, 1, 1024, 1024, 1024, 1024, 512]
    - [89, 54.29]
  - - [1024, 512, 1, 2048, 1024, 1024, 1024, 512]
    - [90, 69.42]
  - - [1024, 512, 1, 4096, 1024, 1024, 1024, 512]
    - [93, 76.66]
  - - [1024, 512, 1, 8192, 1024, 1024, 1024, 512]
    - [93, 81.82]
  - - [1024, 1024, 1, 128, 1024, 1024, 1024, 1024]
    - [48, 24.48]
  - - [1024, 1024, 1, 256, 1024, 1024, 1024, 1024]
    - [49, 40.85]
  - - [1024, 1024, 1, 512, 1024, 1024, 1024, 1024]
    - [81, 63.07]
  - - [1024, 1024, 1, 1024, 1024, 1024, 1024, 1024]
    - [82, 88.2]
  - - [1024, 1024, 1, 2048, 1024, 1024, 1024, 1024]
    - [82, 109.57]
  - - [1024, 1024, 1, 4096, 1024, 1024, 1024, 1024]
    - [84, 124.47]
  - - [1024, 1024, 1, 8192, 1024, 1024, 1024, 1024]
    - [82, 127.99]
  - - [1024, 2048, 1, 128, 1024, 1024, 1024, 2048]
    - [35, 38.12]
  - - [1024, 2048, 1, 256, 1024, 1024, 1024, 2048]
    - [35, 64.39]
  - - [1024, 2048, 1, 512, 1024, 1024, 1024, 2048]
    - [37, 98.01]
  - - [1024, 2048, 1, 1024, 1024, 1024, 1024, 2048]
    - [78, 133.07]
  - - [1024, 2048, 1, 2048, 1024, 1024, 1024, 2048]
    - [37, 160.06]
  - - [1024, 2048, 1, 4096, 1024, 1024, 1024, 2048]
    - [39, 175.32]
  - - [1024, 2048, 1, 8192, 1024, 1024, 1024, 2048]
    - [44, 161.28]
  - - [1024, 4096, 1, 128, 1024, 1024, 1024, 4096]
    - [26, 55.25]
  - - [1024, 4096, 1, 256, 1024, 1024, 1024, 4096]
    - [28, 93.13]
  - - [1024, 4096, 1, 512, 1024, 1024, 1024, 4096]
    - [28, 141.23]
  - - [1024, 4096, 1, 1024, 1024, 1024, 1024, 4096]
    - [28, 188.88]
  - - [1024, 4096, 1, 2048, 1024, 1024, 1024, 4096]
    - [28, 226.8]
  - - [1024, 4096, 1, 4096, 1024, 1024, 1024, 4096]
    - [28, 229.12]
  - - [1024, 4096, 1, 8192, 1024, 1024, 1024, 4096]
    - [68, 212.84]
  - - [1024, 8192, 1, 128, 1024, 1024, 1024, 8192]
    - [21, 82.12]
  - - [1024, 8192, 1, 256, 1024, 1024, 1024, 8192]
    - [20, 133.31]
  - - [1024, 8192, 1, 512, 1024, 1024, 1024, 8192]
    - [22, 191.33]
  - - [1024, 8192, 1, 1024, 1024, 1024, 1024, 8192]
    - [6, 232.32]
  - - [1024, 8192, 1, 2048, 1024, 1024, 1024, 8192]
    - [3, 259.42]
  - - [1024, 8192, 1, 4096, 1024, 1024, 1024, 8192]
    - [63, 246.01]
  - - [1024, 8192, 1, 8192, 1024, 1024, 1024, 8192]
    - [11, 262.56]
  - - [2048, 128, 1, 128, 2048, 2048, 2048, 128]
    - [55, 7.51]
  - - [2048, 128, 1, 256, 2048, 2048, 2048, 128]
    - [54, 13.1]
  - - [2048, 128, 1, 512, 2048, 2048, 2048, 128]
    - [101, 21.15]
  - - [2048, 128, 1, 1024, 2048, 2048, 2048, 128]
    - [101, 30.9]
  - - [2048, 128, 1, 2048, 2048, 2048, 2048, 128]
    - [98, 37.49]
  - - [2048, 128, 1, 4096, 2048, 2048, 2048, 128]
    - [99, 45.12]
  - - [2048, 128, 1, 8192, 2048, 2048, 2048, 128]
    - [98, 50.6]
  - - [2048, 256, 1, 128, 2048, 2048, 2048, 256]
    - [51, 13.89]
  - - [2048, 256, 1, 256, 2048, 2048, 2048, 256]
    - [51, 23.88]
  - - [2048, 256, 1, 512, 2048, 2048, 2048, 256]
    - [52, 37.49]
  - - [2048, 256, 1, 1024, 2048, 2048, 2048, 256]
    - [89, 53.59]
  - - [2048, 256, 1, 2048, 2048, 2048, 2048, 256]
    - [94, 66.95]
  - - [2048, 256, 1, 4096, 2048, 2048, 2048, 256]
    - [91, 77.85]
  - - [2048, 256, 1, 8192, 2048, 2048, 2048, 256]
    - [96, 85.1]
  - - [2048, 512, 1, 128, 2048, 2048, 2048, 512]
    - [48, 23.73]
  - - [2048, 512, 1, 256, 2048, 2048, 2048, 512]
    - [48, 41.02]
  - - [2048, 512, 1, 512, 2048, 2048, 2048, 512]
    - [48, 62.91]
  - - [2048, 512, 1, 1024, 2048, 2048, 2048, 512]
    - [82, 87.78]
  - - [2048, 512, 1, 2048, 2048, 2048, 2048, 512]
    - [83, 107.56]
  - - [2048, 512, 1, 4096, 2048, 2048, 2048, 512]
    - [84, 124.46]
  - - [2048, 512, 1, 8192, 2048, 2048, 2048, 512]
    - [85, 128.04]
  - - [2048, 1024, 1, 128, 2048, 2048, 2048, 1024]
    - [35, 38.58]
  - - [2048, 1024, 1, 256, 2048, 2048, 2048, 1024]
    - [35, 65.47]
  - - [2048, 1024, 1, 512, 2048, 2048, 2048, 1024]
    - [37, 98.5]
  - - [2048, 1024, 1, 1024, 2048, 2048, 2048, 1024]
    - [37, 133.53]
  - - [2048, 1024, 1, 2048, 2048, 2048, 2048, 1024]
    - [42, 159.88]
  - - [2048, 1024, 1, 4096, 2048, 2048, 2048, 1024]
    - [36, 176.55]
  - - [2048, 1024, 1, 8192, 2048, 2048, 2048, 1024]
    - [38, 161.24]
  - - [2048, 2048, 1, 128, 2048, 2048, 2048, 2048]
    - [30, 55.79]
  - - [2048, 2048, 1, 256, 2048, 2048, 2048, 2048]
    - [28, 93.04]
  - - [2048, 2048, 1, 512, 2048, 2048, 2048, 2048]
    - [28, 140.98]
  - - [2048, 2048, 1, 1024, 2048, 2048, 2048, 2048]
    - [34, 188.94]
  - - [2048, 2048, 1, 2048, 2048, 2048, 2048, 2048]
    - [34, 227.04]
  - - [2048, 2048, 1, 4096, 2048, 2048, 2048, 2048]
    - [73, 228.64]
  - - [2048, 2048, 1, 8192, 2048, 2048, 2048, 2048]
    - [69, 213.46]
  - - [2048, 4096, 1, 128, 2048, 2048, 2048, 4096]
    - [8, 70.35]
  - - [2048, 4096, 1, 256, 2048, 2048, 2048, 4096]
    - [1, 117.0]
  - - [2048, 4096, 1, 512, 2048, 2048, 2048, 4096]
    - [4, 176.33]
  - - [2048, 4096, 1, 1024, 2048, 2048, 2048, 4096]
    - [6, 232.7]
  - - [2048, 4096, 1, 2048, 2048, 2048, 2048, 4096]
    - [4, 262.17]
  - - [2048, 4096, 1, 4096, 2048, 2048, 2048, 4096]
    - [63, 246.38]
  - - [2048, 4096, 1, 8192, 2048, 2048, 2048, 4096]
    - [11, 261.17]
  - - [2048, 8192, 1, 128, 2048, 2048, 2048, 8192]
    - [20, 90.25]
  - - [2048, 8192, 1, 256, 2048, 2048, 2048, 8192]
    - [23, 139.21]
  - - [2048, 8192, 1, 512, 2048, 2048, 2048, 8192]
    - [21, 189.68]
  - - [2048, 8192, 1, 1024, 2048, 2048, 2048, 8192]
    - [4, 225.85]
  - - [2048, 8192, 1, 2048, 2048, 2048, 2048, 8192]
    - [16, 228.29]
  - - [2048, 8192, 1, 4096, 2048, 2048, 2048, 8192]
    - [11, 281.1]
  - - [2048, 8192, 1, 8192, 2048, 2048, 2048, 8192]
    - [64, 330.24]
  - - [4096, 128, 1, 128, 4096, 4096, 4096, 128]
    - [51, 13.69]
  - - [4096, 128, 1, 256, 4096, 4096, 4096, 128]
    - [51, 23.54]
  - - [4096, 128, 1, 512, 4096, 4096, 4096, 128]
    - [89, 37.05]
  - - [4096, 128, 1, 1024, 4096, 4096, 4096, 128]
    - [89, 53.65]
  - - [4096, 128, 1, 2048, 4096, 4096, 4096, 128]
    - [92, 65.86]
  - - [4096, 128, 1, 4096, 4096, 4096, 4096, 128]
    - [92, 77.94]
  - - [4096, 128, 1, 8192, 4096, 4096, 4096, 128]
    - [95, 85.0]
  - - [4096, 256, 1, 128, 4096, 4096, 4096, 256]
    - [50, 23.75]
  - - [4096, 256, 1, 256, 4096, 4096, 4096, 256]
    - [45, 40.69]
  - - [4096, 256, 1, 512, 4096, 4096, 4096, 256]
    - [46, 63.23]
  - - [4096, 256, 1, 1024, 4096, 4096, 4096, 256]
    - [47, 88.01]
  - - [4096, 256, 1, 2048, 4096, 4096, 4096, 256]
    - [83, 108.08]
  - - [4096, 256, 1, 4096, 4096, 4096, 4096, 256]
    - [85, 125.2]
  - - [4096, 256, 1, 8192, 4096, 4096, 4096, 256]
    - [85, 129.49]
  - - [4096, 512, 1, 128, 4096, 4096, 4096, 512]
    - [35, 38.79]
  - - [4096, 512, 1, 256, 4096, 4096, 4096, 512]
    - [36, 65.13]
  - - [4096, 512, 1, 512, 4096, 4096, 4096, 512]
    - [37, 98.93]
  - - [4096, 512, 1, 1024, 4096, 4096, 4096, 512]
    - [43, 130.25]
  - - [4096, 512, 1, 2048, 4096, 4096, 4096, 512]
    - [39, 158.61]
  - - [4096, 512, 1, 4096, 4096, 4096, 4096, 512]
    - [40, 177.37]
  - - [4096, 512, 1, 8192, 4096, 4096, 4096, 512]
    - [38, 165.82]
  - - [4096, 1024, 1, 128, 4096, 4096, 4096, 1024]
    - [28, 55.13]
  - - [4096, 1024, 1, 256, 4096, 4096, 4096, 1024]
    - [28, 94.21]
  - - [4096, 1024, 1, 512, 4096, 4096, 4096, 1024]
    - [25, 140.72]
  - - [4096, 1024, 1, 1024, 4096, 4096, 4096, 1024]
    - [29, 188.57]
  - - [4096, 1024, 1, 2048, 4096, 4096, 4096, 1024]
    - [32, 225.96]
  - - [4096, 1024, 1, 4096, 4096, 4096, 4096, 1024]
    - [72, 231.88]
  - - [4096, 1024, 1, 8192, 4096, 4096, 4096, 1024]
    - [75, 216.82]
  - - [4096, 2048, 1, 128, 4096, 4096, 4096, 2048]
    - [4, 69.94]
  - - [4096, 2048, 1, 256, 4096, 4096, 4096, 2048]
    - [1, 116.86]
  - - [4096, 2048, 1, 512, 4096, 4096, 4096, 2048]
    - [4, 175.65]
  - - [4096, 2048, 1, 1024, 4096, 4096, 4096, 2048]
    - [12, 226.46]
  - - [4096, 2048, 1, 2048, 4096, 4096, 4096, 2048]
    - [11, 260.7]
  - - [4096, 2048, 1, 4096, 4096, 4096, 4096, 2048]
    - [11, 246.25]
  - - [4096, 2048, 1, 8192, 4096, 4096, 4096, 2048]
    - [17, 263.7]
  - - [4096, 4096, 1, 128, 4096, 4096, 4096, 4096]
    - [8, 76.9]
  - - [4096, 4096, 1, 256, 4096, 4096, 4096, 4096]
    - [12, 126.4]
  - - [4096, 4096, 1, 512, 4096, 4096, 4096, 4096]
    - [2, 184.75]
  - - [4096, 4096, 1, 1024, 4096, 4096, 4096, 4096]
    - [5, 222.25]
  - - [4096, 4096, 1, 2048, 4096, 4096, 4096, 4096]
    - [4, 228.78]
  - - [4096, 4096, 1, 4096, 4096, 4096, 4096, 4096]
    - [9, 275.68]
  - - [4096, 4096, 1, 8192, 4096, 4096, 4096, 4096]
    - [7, 329.02]
  - - [4096, 8192, 1, 128, 4096, 4096, 4096, 8192]
    - [20, 97.64]
  - - [4096, 8192, 1, 256, 4096, 4096, 4096, 8192]
    - [21, 142.14]
  - - [4096, 8192, 1, 512, 4096, 4096, 4096, 8192]
    - [27, 192.77]
  - - [4096, 8192, 1, 1024, 4096, 4096, 4096, 8192]
    - [33, 216.87]
  - - [4096, 8192, 1, 2048, 4096, 4096, 4096, 8192]
    - [4, 260.84]
  - - [4096, 8192, 1, 4096, 4096, 4096, 4096, 8192]
    - [1, 317.84]
  - - [4096, 8192, 1, 8192, 4096, 4096, 4096, 8192]
    - [62, 354.51]
  - - [8192, 128, 1, 128, 8192, 8192, 8192, 128]
    - [48, 24.68]
  - - [8192, 128, 1, 256, 8192, 8192, 8192, 128]
    - [48, 41.66]
  - - [8192, 128, 1, 512, 8192, 8192, 8192, 128]
    - [48, 63.82]
  - - [8192, 128, 1, 1024, 8192, 8192, 8192, 128]
    - [47, 88.26]
  - - [8192, 128, 1, 2048, 8192, 8192, 8192, 128]
    - [85, 108.16]
  - - [8192, 128, 1, 4096, 8192, 8192, 8192, 128]
    - [84, 125.22]
  - - [8192, 128, 1, 8192, 8192, 8192, 8192, 128]
    - [84, 126.37]
  - - [8192, 256, 1, 128, 8192, 8192, 8192, 256]
    - [36, 38.3]
  - - [8192, 256, 1, 256, 8192, 8192, 8192, 256]
    - [36, 65.39]
  - - [8192, 256, 1, 512, 8192, 8192, 8192, 256]
    - [37, 99.09]
  - - [8192, 256, 1, 1024, 8192, 8192, 8192, 256]
    - [79, 132.92]
  - - [8192, 256, 1, 2048, 8192, 8192, 8192, 256]
    - [44, 160.29]
  - - [8192, 256, 1, 4096, 8192, 8192, 8192, 256]
    - [39, 175.67]
  - - [8192, 256, 1, 8192, 8192, 8192, 8192, 256]
    - [44, 162.48]
  - - [8192, 512, 1, 128, 8192, 8192, 8192, 512]
    - [26, 55.91]
  - - [8192, 512, 1, 256, 8192, 8192, 8192, 512]
    - [16, 92.88]
  - - [8192, 512, 1, 512, 8192, 8192, 8192, 512]
    - [29, 140.11]
  - - [8192, 512, 1, 1024, 8192, 8192, 8192, 512]
    - [29, 187.56]
  - - [8192, 512, 1, 2048, 8192, 8192, 8192, 512]
    - [31, 224.12]
  - - [8192, 512, 1, 4096, 8192, 8192, 8192, 512]
    - [74, 231.64]
  - - [8192, 512, 1, 8192, 8192, 8192, 8192, 512]
    - [70, 214.6]
  - - [8192, 1024, 1, 128, 8192, 8192, 8192, 1024]
    - [8, 71.14]
  - - [8192, 1024, 1, 256, 8192, 8192, 8192, 1024]
    - [14, 117.6]
  - - [8192, 1024, 1, 512, 8192, 8192, 8192, 1024]
    - [11, 176.17]
  - - [8192, 1024, 1, 1024, 8192, 8192, 8192, 1024]
    - [15, 230.57]
  - - [8192, 1024, 1, 2048, 8192, 8192, 8192, 1024]
    - [15, 259.83]
  - - [8192, 1024, 1, 4096, 8192, 8192, 8192, 1024]
    - [11, 248.06]
  - - [8192, 1024, 1, 8192, 8192, 8192, 8192, 1024]
    - [17, 273.97]
  - - [8192, 2048, 1, 128, 8192, 8192, 8192, 2048]
    - [12, 76.28]
  - - [8192, 2048, 1, 256, 8192, 8192, 8192, 2048]
    - [13, 125.07]
  - - [8192, 2048, 1, 512, 8192, 8192, 8192, 2048]
    - [15, 182.92]
  - - [8192, 2048, 1, 1024, 8192, 8192, 8192, 2048]
    - [15, 221.37]
  - - [8192, 2048, 1, 2048, 8192, 8192, 8192, 2048]
    - [19, 231.26]
  - - [8192, 2048, 1, 4096, 8192, 8192, 8192, 2048]
    - [10, 285.27]
  - - [8192, 2048, 1, 8192, 8192, 8192, 8192, 2048]
    - [4, 332.17]
  - - [8192, 4096, 1, 128, 8192, 8192, 8192, 4096]
    - [0, 81.29]
  - - [8192, 4096, 1, 256, 8192, 8192, 8192, 4096]
    - [1, 128.45]
  - - [8192, 4096, 1, 512, 8192, 8192, 8192, 4096]
    - [18, 188.9]
  - - [8192, 4096, 1, 1024, 8192, 8192, 8192, 4096]
    - [71, 217.39]
  - - [8192, 4096, 1, 2048, 8192, 8192, 8192, 4096]
    - [74, 256.68]
  - - [8192, 4096, 1, 4096, 8192, 8192, 8192, 4096]
    - [12, 305.27]
  - - [8192, 4096, 1, 8192, 8192, 8192, 8192, 4096]
    - [65, 335.61]
  - - [8192, 8192, 1, 128, 8192, 8192, 8192, 8192]
    - [20, 90.24]
  - - [8192, 8192, 1, 256, 8192, 8192, 8192, 8192]
    - [24, 137.91]
  - - [8192, 8192, 1, 512, 8192, 8192, 8192, 8192]
    - [1, 202.06]
  - - [8192, 8192, 1, 1024, 8192, 8192, 8192, 8192]
    - [66, 264.23]
  - - [8192, 8192, 1, 2048, 8192, 8192, 8192, 8192]
    - [66, 320.26]
  - - [8192, 8192, 1, 4096, 8192, 8192, 8192, 8192]
    - [66, 355.99]
  - - [8192, 8192, 1, 8192, 8192, 8192, 8192, 8192]
    - [4, 347.47]
- null
- null
- ExperimentalStreamK
- GridBased
