projects/hipblaslt/library/src/amd_detail/rocblaslt/src/Tensile/Logic/asm_full/aquavanjaram/gfx942_228cu/StreamK/aquavanjaram942_Cijk_Ailk_Bjlk_F8NF8NS_BH_Bias_HAS_SAV_UserArgs.yaml
- {MinimumRequiredVersion: 4.33.0}
- aquavanjaram942
- {Architecture: gfx942, CUCount: 228}
- [Device 0049, Device 0050]
    SolutionIndex: 0
    SolutionNameMin: Cijk_Ailk_Bjlk_F8NF8NS_BH_Bias_HAS_SAV_UserArgs_MT256x256x64_MI16x16x1_SN_LDSB0_CLR1_GRVWA16_GRVWB4_GSU0_GSUC0_GSUWGMRR0_K1_LBSPPA2048_LBSPPB2048_LPA0_LPB0_MIWT8_8_PLR1_SU0_SUM0_SUS64_VWA8_VWB8_WGM1_WGMXCC1_WGMXCCGn1
    SolutionIndex: 1
    SolutionNameMin: Cijk_Ailk_Bjlk_F8NF8NS_BH_Bias_HAS_SAV_UserArgs_MT256x256x64_MI16x16x1_SN_LDSB0_CLR1_GRVWA4_GRVWB16_GSU0_GSUC0_GSUWGMRR0_K1_LBSPPA2048_LBSPPB2048_LPA0_LPB0_MIWT8_8_PLR1_SU0_SUM0_SUS64_VWA8_VWB8_WGM1_WGMXCC1_WGMXCCGn1
    SolutionIndex: 2
    SolutionNameMin: Cijk_Ailk_Bjlk_F8NF8NS_BH_Bias_HAS_SAV_UserArgs_MT256x256x64_MI16x16x1_SN_LDSB0_CLR1_GRVWA16_GRVWB16_GSU0_GSUC0_GSUWGMRR0_K1_LBSPPA2048_LBSPPB2048_LPA0_LPB0_MIWT8_8_PLR1_SU0_SUM0_SUS64_VWA8_VWB8_WGM1_WGMXCC1_WGMXCCGn1
    SolutionIndex: 3
    SolutionNameMin: Cijk_Ailk_Bjlk_F8NF8NS_BH_Bias_HAS_SAV_UserArgs_MT256x256x64_MI16x16x1_SN_LDSB0_CLR1_GRVWA4_GRVWB8_GSU0_GSUC0_GSUWGMRR0_K1_LBSPPA2048_LBSPPB2048_LPA0_LPB0_MIWT8_8_PLR1_SU0_SUM0_SUS64_VWA8_VWB8_WGM4_WGMXCC1_WGMXCCGn1
    SolutionIndex: 4
    SolutionNameMin: Cijk_Ailk_Bjlk_F8NF8NS_BH_Bias_HAS_SAV_UserArgs_MT256x256x64_MI16x16x1_SN_LDSB0_CLR1_GRVWA16_GRVWB8_GSU0_GSUC0_GSUWGMRR0_K1_LBSPPA2048_LBSPPB2048_LPA0_LPB0_MIWT8_8_PLR1_SU0_SUM0_SUS64_VWA8_VWB8_WGM4_WGMXCC1_WGMXCCGn1
    SolutionIndex: 5
    SolutionNameMin: Cijk_Ailk_Bjlk_F8NF8NS_BH_Bias_HAS_SAV_UserArgs_MT256x256x64_MI16x16x1_SN_LDSB0_CLR1_GRVWA4_GRVWB16_GSU0_GSUC0_GSUWGMRR0_K1_LBSPPA2048_LBSPPB2048_LPA0_LPB0_MIWT8_8_PLR1_SU0_SUM0_SUS64_VWA8_VWB8_WGM4_WGMXCC1_WGMXCCGn1
    SolutionIndex: 6
    SolutionNameMin: Cijk_Ailk_Bjlk_F8NF8NS_BH_Bias_HAS_SAV_UserArgs_MT256x256x64_MI16x16x1_SN_LDSB0_CLR1_GRVWA16_GRVWB16_GSU0_GSUC0_GSUWGMRR0_K1_LBSPPA2048_LBSPPB2048_LPA0_LPB0_MIWT8_8_PLR1_SU0_SUM0_SUS64_VWA8_VWB8_WGM4_WGMXCC1_WGMXCCGn1
    SolutionIndex: 7
    SolutionNameMin: Cijk_Ailk_Bjlk_F8NF8NS_BH_Bias_HAS_SAV_UserArgs_MT256x256x64_MI16x16x1_SN_LDSB0_CLR1_GRVWA4_GRVWB4_GSU0_GSUC0_GSUWGMRR0_K1_LBSPPA2048_LBSPPB2048_LPA0_LPB0_MIWT8_8_PLR1_SU0_SUM0_SUS64_VWA8_VWB8_WGM6_WGMXCC1_WGMXCCGn1
    SolutionIndex: 8
    SolutionNameMin: Cijk_Ailk_Bjlk_F8NF8NS_BH_Bias_HAS_SAV_UserArgs_MT256x256x64_MI16x16x1_SN_LDSB0_CLR1_GRVWA16_GRVWB4_GSU0_GSUC0_GSUWGMRR0_K1_LBSPPA2048_LBSPPB2048_LPA0_LPB0_MIWT8_8_PLR1_SU0_SUM0_SUS64_VWA8_VWB8_WGM6_WGMXCC1_WGMXCCGn1
    SolutionIndex: 9
    SolutionNameMin: Cijk_Ailk_Bjlk_F8NF8NS_BH_Bias_HAS_SAV_UserArgs_MT256x256x64_MI16x16x1_SN_LDSB0_CLR1_GRVWA4_GRVWB8_GSU0_GSUC0_GSUWGMRR0_K1_LBSPPA2048_LBSPPB2048_LPA0_LPB0_MIWT8_8_PLR1_SU0_SUM0_SUS64_VWA8_VWB8_WGM6_WGMXCC1_WGMXCCGn1
    SolutionIndex: 10
    SolutionNameMin: Cijk_Ailk_Bjlk_F8NF8NS_BH_Bias_HAS_SAV_UserArgs_MT256x256x64_MI16x16x1_SN_LDSB0_CLR1_GRVWA16_GRVWB16_GSU0_GSUC0_GSUWGMRR0_K1_LBSPPA2048_LBSPPB2048_LPA0_LPB0_MIWT8_8_PLR1_SU0_SUM0_SUS64_VWA8_VWB8_WGM6_WGMXCC1_WGMXCCGn1
    SolutionIndex: 11
    SolutionNameMin: Cijk_Ailk_Bjlk_F8NF8NS_BH_Bias_HAS_SAV_UserArgs_MT256x256x64_MI16x16x1_SN_LDSB0_CLR1_GRVWA16_GRVWB4_GSU0_GSUC0_GSUWGMRR0_K1_LBSPPA2048_LBSPPB2048_LPA0_LPB0_MIWT8_8_PLR1_SU0_SUM0_SUS64_VWA8_VWB8_WGM8_WGMXCC1_WGMXCCGn1
    SolutionIndex: 12
    SolutionNameMin: Cijk_Ailk_Bjlk_F8NF8NS_BH_Bias_HAS_SAV_UserArgs_MT256x256x64_MI16x16x1_SN_LDSB0_CLR1_GRVWA4_GRVWB8_GSU0_GSUC0_GSUWGMRR0_K1_LBSPPA2048_LBSPPB2048_LPA0_LPB0_MIWT8_8_PLR1_SU0_SUM0_SUS64_VWA8_VWB8_WGM8_WGMXCC1_WGMXCCGn1
    SolutionIndex: 13
    SolutionNameMin: Cijk_Ailk_Bjlk_F8NF8NS_BH_Bias_HAS_SAV_UserArgs_MT256x256x64_MI16x16x1_SN_LDSB0_CLR1_GRVWA16_GRVWB16_GSU0_GSUC0_GSUWGMRR0_K1_LBSPPA2048_LBSPPB2048_LPA0_LPB0_MIWT8_8_PLR1_SU0_SUM0_SUS64_VWA8_VWB8_WGM8_WGMXCC1_WGMXCCGn1
    SolutionIndex: 14
    SolutionNameMin: Cijk_Ailk_Bjlk_F8NF8NS_BH_Bias_HAS_SAV_UserArgs_MT128x256x64_MI16x16x1_SN_LDSB1_CLR1_GRVWA4_GRVWB16_GSU0_GSUC0_GSUWGMRR0_K1_LBSPPA1024_LBSPPB2048_LPA64_LPB0_MIWT4_8_PLR1_SU0_SUM0_SUS64_VWA4_VWB8_WGM1_WGMXCC1_WGMXCCGn1
    SolutionIndex: 15
    SolutionNameMin: Cijk_Ailk_Bjlk_F8NF8NS_BH_Bias_HAS_SAV_UserArgs_MT128x256x64_MI16x16x1_SN_LDSB1_CLR1_GRVWA8_GRVWB16_GSU0_GSUC0_GSUWGMRR0_K1_LBSPPA1024_LBSPPB2048_LPA64_LPB0_MIWT4_8_PLR1_SU0_SUM0_SUS64_VWA4_VWB8_WGM1_WGMXCC1_WGMXCCGn1
    SolutionIndex: 16
    SolutionNameMin: Cijk_Ailk_Bjlk_F8NF8NS_BH_Bias_HAS_SAV_UserArgs_MT128x256x64_MI16x16x1_SN_LDSB1_CLR1_GRVWA16_GRVWB16_GSU0_GSUC0_GSUWGMRR0_K1_LBSPPA1024_LBSPPB2048_LPA64_LPB0_MIWT4_8_PLR1_SU0_SUM0_SUS64_VWA4_VWB8_WGM1_WGMXCC1_WGMXCCGn1
    SolutionIndex: 17
    SolutionNameMin: Cijk_Ailk_Bjlk_F8NF8NS_BH_Bias_HAS_SAV_UserArgs_MT128x256x64_MI16x16x1_SN_LDSB1_CLR1_GRVWA4_GRVWB16_GSU0_GSUC0_GSUWGMRR0_K1_LBSPPA1024_LBSPPB2048_LPA64_LPB0_MIWT4_8_PLR1_SU0_SUM0_SUS64_VWA4_VWB8_WGM6_WGMXCC1_WGMXCCGn1
    SolutionIndex: 18
    SolutionNameMin: Cijk_Ailk_Bjlk_F8NF8NS_BH_Bias_HAS_SAV_UserArgs_MT128x256x64_MI16x16x1_SN_LDSB1_CLR1_GRVWA16_GRVWB16_GSU0_GSUC0_GSUWGMRR0_K1_LBSPPA1024_LBSPPB2048_LPA64_LPB0_MIWT4_8_PLR1_SU0_SUM0_SUS64_VWA4_VWB8_WGM6_WGMXCC1_WGMXCCGn1
    SolutionIndex: 19
    SolutionNameMin: Cijk_Ailk_Bjlk_F8NF8NS_BH_Bias_HAS_SAV_UserArgs_MT256x144x64_MI16x16x1_SN_LDSB0_CLR1_GRVWA4_GRVWB4_GSU0_GSUC0_GSUWGMRR0_K1_LBSPPA2048_LBSPPB1152_LPA64_LPB16_MIWT4_9_PLR1_SU0_SUM0_SUS64_VWA4_VWB1_WGM1_WGMXCC1_WGMXCCGn1
    SolutionIndex: 20
    SolutionNameMin: Cijk_Ailk_Bjlk_F8NF8NS_BH_Bias_HAS_SAV_UserArgs_MT256x144x64_MI16x16x1_SN_LDSB0_CLR1_GRVWA8_GRVWB4_GSU0_GSUC0_GSUWGMRR0_K1_LBSPPA2048_LBSPPB1152_LPA64_LPB16_MIWT4_9_PLR1_SU0_SUM0_SUS64_VWA4_VWB1_WGM1_WGMXCC1_WGMXCCGn1
    SolutionIndex: 21
    SolutionNameMin: Cijk_Ailk_Bjlk_F8NF8NS_BH_Bias_HAS_SAV_UserArgs_MT256x144x64_MI16x16x1_SN_LDSB0_CLR1_GRVWA16_GRVWB4_GSU0_GSUC0_GSUWGMRR0_K1_LBSPPA2048_LBSPPB1152_LPA64_LPB16_MIWT4_9_PLR1_SU0_SUM0_SUS64_VWA4_VWB1_WGM1_WGMXCC1_WGMXCCGn1
    SolutionIndex: 22
    SolutionNameMin: Cijk_Ailk_Bjlk_F8NF8NS_BH_Bias_HAS_SAV_UserArgs_MT256x144x64_MI16x16x1_SN_LDSB0_CLR1_GRVWA4_GRVWB4_GSU0_GSUC0_GSUWGMRR0_K1_LBSPPA2048_LBSPPB1152_LPA64_LPB16_MIWT4_9_PLR1_SU0_SUM0_SUS64_VWA4_VWB1_WGM4_WGMXCC1_WGMXCCGn1
    SolutionIndex: 23
    SolutionNameMin: Cijk_Ailk_Bjlk_F8NF8NS_BH_Bias_HAS_SAV_UserArgs_MT256x144x64_MI16x16x1_SN_LDSB0_CLR1_GRVWA16_GRVWB4_GSU0_GSUC0_GSUWGMRR0_K1_LBSPPA2048_LBSPPB1152_LPA64_LPB16_MIWT4_9_PLR1_SU0_SUM0_SUS64_VWA4_VWB1_WGM4_WGMXCC1_WGMXCCGn1
    SolutionIndex: 24
    SolutionNameMin: Cijk_Ailk_Bjlk_F8NF8NS_BH_Bias_HAS_SAV_UserArgs_MT256x144x64_MI16x16x1_SN_LDSB0_CLR1_GRVWA4_GRVWB4_GSU0_GSUC0_GSUWGMRR0_K1_LBSPPA2048_LBSPPB1152_LPA64_LPB16_MIWT4_9_PLR1_SU0_SUM0_SUS64_VWA4_VWB1_WGM8_WGMXCC1_WGMXCCGn1
    SolutionIndex: 25
    SolutionNameMin: Cijk_Ailk_Bjlk_F8NF8NS_BH_Bias_HAS_SAV_UserArgs_MT256x128x64_MI16x16x1_SN_LDSB1_CLR1_GRVWA4_GRVWB8_GSU0_GSUC0_GSUWGMRR0_K1_LBSPPA2048_LBSPPB1024_LPA0_LPB64_MIWT8_4_PLR1_SU0_SUM0_SUS64_VWA8_VWB4_WGM1_WGMXCC1_WGMXCCGn1
    SolutionIndex: 26
    SolutionNameMin: Cijk_Ailk_Bjlk_F8NF8NS_BH_Bias_HAS_SAV_UserArgs_MT256x128x64_MI16x16x1_SN_LDSB1_CLR1_GRVWA16_GRVWB16_GSU0_GSUC0_GSUWGMRR0_K1_LBSPPA2048_LBSPPB1024_LPA0_LPB64_MIWT8_4_PLR1_SU0_SUM0_SUS64_VWA8_VWB4_WGM1_WGMXCC1_WGMXCCGn1
    SolutionIndex: 27
    SolutionNameMin: Cijk_Ailk_Bjlk_F8NF8NS_BH_Bias_HAS_SAV_UserArgs_MT256x128x64_MI16x16x1_SN_LDSB1_CLR1_GRVWA16_GRVWB8_GSU0_GSUC0_GSUWGMRR0_K1_LBSPPA2048_LBSPPB1024_LPA0_LPB64_MIWT8_4_PLR1_SU0_SUM0_SUS64_VWA8_VWB4_WGM4_WGMXCC1_WGMXCCGn1
    SolutionIndex: 28
    SolutionNameMin: Cijk_Ailk_Bjlk_F8NF8NS_BH_Bias_HAS_SAV_UserArgs_MT256x128x64_MI16x16x1_SN_LDSB1_CLR1_GRVWA16_GRVWB16_GSU0_GSUC0_GSUWGMRR0_K1_LBSPPA2048_LBSPPB1024_LPA0_LPB64_MIWT8_4_PLR1_SU0_SUM0_SUS64_VWA8_VWB4_WGM4_WGMXCC1_WGMXCCGn1
    SolutionIndex: 29
    SolutionNameMin: Cijk_Ailk_Bjlk_F8NF8NS_BH_Bias_HAS_SAV_UserArgs_MT256x128x64_MI16x16x1_SN_LDSB1_CLR1_GRVWA16_GRVWB16_GSU0_GSUC0_GSUWGMRR0_K1_LBSPPA2048_LBSPPB1024_LPA0_LPB64_MIWT8_4_PLR1_SU0_SUM0_SUS64_VWA8_VWB4_WGM6_WGMXCC1_WGMXCCGn1
    SolutionIndex: 30
    SolutionNameMin: Cijk_Ailk_Bjlk_F8NF8NS_BH_Bias_HAS_SAV_UserArgs_MT256x128x64_MI16x16x1_SN_LDSB1_CLR1_GRVWA4_GRVWB8_GSU0_GSUC0_GSUWGMRR0_K1_LBSPPA2048_LBSPPB1024_LPA0_LPB64_MIWT8_4_PLR1_SU0_SUM0_SUS64_VWA8_VWB4_WGM8_WGMXCC1_WGMXCCGn1
    SolutionIndex: 31
    SolutionNameMin: Cijk_Ailk_Bjlk_F8NF8NS_BH_Bias_HAS_SAV_UserArgs_MT256x128x64_MI16x16x1_SN_LDSB1_CLR1_GRVWA16_GRVWB16_GSU0_GSUC0_GSUWGMRR0_K1_LBSPPA2048_LBSPPB1024_LPA0_LPB64_MIWT8_4_PLR1_SU0_SUM0_SUS64_VWA8_VWB4_WGM8_WGMXCC1_WGMXCCGn1
    SolutionIndex: 32
    SolutionNameMin: Cijk_Ailk_Bjlk_F8NF8NS_BH_Bias_HAS_SAV_UserArgs_MT128x128x64_MI16x16x1_SN_LDSB1_CLR1_GRVWA8_GRVWB16_GSU0_GSUC0_GSUWGMRR0_K1_LBSPPA1024_LBSPPB1024_LPA0_LPB32_MIWT8_2_PLR1_SU0_SUM0_SUS64_VWA8_VWB2_WGM1_WGMXCC1_WGMXCCGn1
    SolutionIndex: 33
    SolutionNameMin: Cijk_Ailk_Bjlk_F8NF8NS_BH_Bias_HAS_SAV_UserArgs_MT128x64x64_MI16x16x1_SN_LDSB0_CLR1_GRVWA4_GRVWB4_GSU0_GSUC0_GSUWGMRR0_K1_LBSPPA1024_LBSPPB512_LPA0_LPB16_MIWT8_1_PLR1_SU0_SUM0_SUS64_VWA8_VWB1_WGM1_WGMXCC1_WGMXCCGn1
    SolutionIndex: 34
    SolutionNameMin: Cijk_Ailk_Bjlk_F8NF8NS_BH_Bias_HAS_SAV_UserArgs_MT128x64x64_MI16x16x1_SN_LDSB0_CLR1_GRVWA8_GRVWB16_GSU0_GSUC0_GSUWGMRR0_K1_LBSPPA1024_LBSPPB512_LPA0_LPB16_MIWT8_1_PLR1_SU0_SUM0_SUS64_VWA8_VWB1_WGM1_WGMXCC1_WGMXCCGn1
    SolutionIndex: 35
    SolutionNameMin: Cijk_Ailk_Bjlk_F8NF8NS_BH_Bias_HAS_SAV_UserArgs_MT128x128x64_MI16x16x1_SN_LDSB1_CLR1_GRVWA4_GRVWB4_GSU0_GSUC0_GSUWGMRR0_K1_LBSPPA1024_LBSPPB1024_LPA64_LPB64_MIWT4_4_PLR1_SU0_SUM0_SUS64_VWA4_VWB4_WGM1_WGMXCC1_WGMXCCGn1
    SolutionIndex: 36
    SolutionNameMin: Cijk_Ailk_Bjlk_F8NF8NS_BH_Bias_HAS_SAV_UserArgs_MT128x128x64_MI16x16x1_SN_LDSB1_CLR1_GRVWA4_GRVWB8_GSU0_GSUC0_GSUWGMRR0_K1_LBSPPA1024_LBSPPB1024_LPA64_LPB64_MIWT4_4_PLR1_SU0_SUM0_SUS64_VWA4_VWB4_WGM1_WGMXCC1_WGMXCCGn1
    SolutionIndex: 37
    SolutionNameMin: Cijk_Ailk_Bjlk_F8NF8NS_BH_Bias_HAS_SAV_UserArgs_MT128x128x64_MI16x16x1_SN_LDSB1_CLR1_GRVWA4_GRVWB16_GSU0_GSUC0_GSUWGMRR0_K1_LBSPPA1024_LBSPPB1024_LPA64_LPB64_MIWT4_4_PLR1_SU0_SUM0_SUS64_VWA4_VWB4_WGM1_WGMXCC1_WGMXCCGn1
    SolutionIndex: 38
    SolutionNameMin: Cijk_Ailk_Bjlk_F8NF8NS_BH_Bias_HAS_SAV_UserArgs_MT128x128x64_MI16x16x1_SN_LDSB1_CLR1_GRVWA8_GRVWB16_GSU0_GSUC0_GSUWGMRR0_K1_LBSPPA1024_LBSPPB1024_LPA64_LPB64_MIWT4_4_PLR1_SU0_SUM0_SUS64_VWA4_VWB4_WGM1_WGMXCC1_WGMXCCGn1
    SolutionIndex: 39
    SolutionNameMin: Cijk_Ailk_Bjlk_F8NF8NS_BH_Bias_HAS_SAV_UserArgs_MT128x128x64_MI16x16x1_SN_LDSB1_CLR1_GRVWA16_GRVWB16_GSU0_GSUC0_GSUWGMRR0_K1_LBSPPA1024_LBSPPB1024_LPA64_LPB64_MIWT4_4_PLR1_SU0_SUM0_SUS64_VWA4_VWB4_WGM1_WGMXCC1_WGMXCCGn1
    SolutionIndex: 40
    SolutionNameMin: Cijk_Ailk_Bjlk_F8NF8NS_BH_Bias_HAS_SAV_UserArgs_MT128x128x64_MI16x16x1_SN_LDSB1_CLR1_GRVWA16_GRVWB16_GSU0_GSUC0_GSUWGMRR0_K1_LBSPPA1024_LBSPPB1024_LPA64_LPB64_MIWT4_4_PLR1_SU0_SUM0_SUS64_VWA4_VWB4_WGM4_WGMXCC1_WGMXCCGn1
    SolutionIndex: 41
    SolutionNameMin: Cijk_Ailk_Bjlk_F8NF8NS_BH_Bias_HAS_SAV_UserArgs_MT128x128x64_MI16x16x1_SN_LDSB1_CLR1_GRVWA16_GRVWB16_GSU0_GSUC0_GSUWGMRR0_K1_LBSPPA1024_LBSPPB1024_LPA64_LPB64_MIWT4_4_PLR1_SU0_SUM0_SUS64_VWA4_VWB4_WGM6_WGMXCC1_WGMXCCGn1
    SolutionIndex: 42
    SolutionNameMin: Cijk_Ailk_Bjlk_F8NF8NS_BH_Bias_HAS_SAV_UserArgs_MT128x128x64_MI16x16x1_SN_LDSB1_CLR1_GRVWA4_GRVWB16_GSU0_GSUC0_GSUWGMRR0_K1_LBSPPA1024_LBSPPB1024_LPA64_LPB64_MIWT4_4_PLR1_SU0_SUM0_SUS64_VWA4_VWB4_WGM8_WGMXCC1_WGMXCCGn1
    SolutionIndex: 43
    SolutionNameMin: Cijk_Ailk_Bjlk_F8NF8NS_BH_Bias_HAS_SAV_UserArgs_MT128x128x64_MI16x16x1_SN_LDSB1_CLR1_GRVWA16_GRVWB16_GSU0_GSUC0_GSUWGMRR0_K1_LBSPPA1024_LBSPPB1024_LPA64_LPB64_MIWT4_4_PLR1_SU0_SUM0_SUS64_VWA4_VWB4_WGM8_WGMXCC1_WGMXCCGn1
    SolutionIndex: 44
    SolutionNameMin: Cijk_Ailk_Bjlk_F8NF8NS_BH_Bias_HAS_SAV_UserArgs_MT64x128x64_MI16x16x1_SN_LDSB0_CLR1_GRVWA4_GRVWB8_GSU0_GSUC0_GSUWGMRR0_K1_LBSPPA512_LBSPPB1024_LPA32_LPB64_MIWT2_4_PLR1_SU0_SUM0_SUS64_VWA2_VWB4_WGM1_WGMXCC1_WGMXCCGn1
    SolutionIndex: 45
    SolutionNameMin: Cijk_Ailk_Bjlk_F8NF8NS_BH_Bias_HAS_SAV_UserArgs_MT64x128x64_MI16x16x1_SN_LDSB0_CLR1_GRVWA16_GRVWB16_GSU0_GSUC0_GSUWGMRR0_K1_LBSPPA512_LBSPPB1024_LPA32_LPB64_MIWT2_4_PLR1_SU0_SUM0_SUS64_VWA2_VWB4_WGM1_WGMXCC1_WGMXCCGn1
    SolutionIndex: 46
    SolutionNameMin: Cijk_Ailk_Bjlk_F8NF8NS_BH_Bias_HAS_SAV_UserArgs_MT128x64x64_MI16x16x1_SN_LDSB0_CLR1_GRVWA16_GRVWB4_GSU0_GSUC0_GSUWGMRR0_K1_LBSPPA1024_LBSPPB512_LPA64_LPB32_MIWT4_2_PLR1_SU0_SUM0_SUS64_VWA4_VWB2_WGM1_WGMXCC1_WGMXCCGn1
    SolutionIndex: 47
    SolutionNameMin: Cijk_Ailk_Bjlk_F8NF8NS_BH_Bias_HAS_SAV_UserArgs_MT128x64x64_MI16x16x1_SN_LDSB0_CLR1_GRVWA4_GRVWB8_GSU0_GSUC0_GSUWGMRR0_K1_LBSPPA1024_LBSPPB512_LPA64_LPB32_MIWT4_2_PLR1_SU0_SUM0_SUS64_VWA4_VWB2_WGM1_WGMXCC1_WGMXCCGn1
    SolutionIndex: 48
    SolutionNameMin: Cijk_Ailk_Bjlk_F8NF8NS_BH_Bias_HAS_SAV_UserArgs_MT128x64x64_MI16x16x1_SN_LDSB0_CLR1_GRVWA16_GRVWB8_GSU0_GSUC0_GSUWGMRR0_K1_LBSPPA1024_LBSPPB512_LPA64_LPB32_MIWT4_2_PLR1_SU0_SUM0_SUS64_VWA4_VWB2_WGM1_WGMXCC1_WGMXCCGn1
    SolutionIndex: 49
    SolutionNameMin: Cijk_Ailk_Bjlk_F8NF8NS_BH_Bias_HAS_SAV_UserArgs_MT128x32x64_MI16x16x1_SN_LDSB0_CLR1_GRVWA4_GRVWB4_GSU0_GSUC0_GSUWGMRR0_K1_LBSPPA1024_LBSPPB256_LPA64_LPB16_MIWT4_1_PLR1_SU0_SUM0_SUS64_VWA4_VWB1_WGM1_WGMXCC1_WGMXCCGn1
    SolutionIndex: 50
    SolutionNameMin: Cijk_Ailk_Bjlk_F8NF8NS_BH_Bias_HAS_SAV_UserArgs_MT64x64x64_MI16x16x1_SN_LDSB0_CLR1_GRVWA4_GRVWB4_GSU0_GSUC0_GSUWGMRR0_K1_LBSPPA512_LBSPPB512_LPA32_LPB32_MIWT2_2_PLR1_SU0_SUM0_SUS64_VWA2_VWB2_WGM1_WGMXCC1_WGMXCCGn1
    SolutionIndex: 51
    SolutionNameMin: Cijk_Ailk_Bjlk_F8NF8NS_BH_Bias_HAS_SAV_UserArgs_MT64x64x64_MI16x16x1_SN_LDSB0_CLR1_GRVWA8_GRVWB8_GSU0_GSUC0_GSUWGMRR0_K1_LBSPPA512_LBSPPB512_LPA32_LPB32_MIWT2_2_PLR1_SU0_SUM0_SUS64_VWA2_VWB2_WGM1_WGMXCC1_WGMXCCGn1
    SolutionIndex: 52
    SolutionNameMin: Cijk_Ailk_Bjlk_F8NF8NS_BH_Bias_HAS_SAV_UserArgs_MT64x64x64_MI16x16x1_SN_LDSB0_CLR1_GRVWA4_GRVWB16_GSU0_GSUC0_GSUWGMRR0_K1_LBSPPA512_LBSPPB512_LPA32_LPB32_MIWT2_2_PLR1_SU0_SUM0_SUS64_VWA2_VWB2_WGM1_WGMXCC1_WGMXCCGn1
    SolutionIndex: 53
    SolutionNameMin: Cijk_Ailk_Bjlk_F8NF8NS_BH_Bias_HAS_SAV_UserArgs_MT32x64x64_MI16x16x1_SN_LDSB0_CLR1_GRVWA4_GRVWB8_GSU0_GSUC0_GSUWGMRR0_K1_LBSPPA256_LBSPPB512_LPA16_LPB32_MIWT1_2_PLR1_SU0_SUM0_SUS64_VWA1_VWB2_WGM1_WGMXCC1_WGMXCCGn1
    SolutionIndex: 54
    SolutionNameMin: Cijk_Ailk_Bjlk_F8NF8NS_BH_Bias_HAS_SAV_UserArgs_MT64x32x64_MI16x16x1_SN_LDSB0_CLR1_GRVWA4_GRVWB4_GSU0_GSUC0_GSUWGMRR0_K1_LBSPPA512_LBSPPB256_LPA32_LPB16_MIWT2_1_PLR1_SU0_SUM0_SUS64_VWA2_VWB1_WGM1_WGMXCC1_WGMXCCGn1
    SolutionIndex: 55
    SolutionNameMin: Cijk_Ailk_Bjlk_F8NF8NS_BH_Bias_HAS_SAV_UserArgs_MT64x32x64_MI16x16x1_SN_LDSB0_CLR1_GRVWA8_GRVWB4_GSU0_GSUC0_GSUWGMRR0_K1_LBSPPA512_LBSPPB256_LPA32_LPB16_MIWT2_1_PLR1_SU0_SUM0_SUS64_VWA2_VWB1_WGM1_WGMXCC1_WGMXCCGn1
    SolutionIndex: 56
    SolutionNameMin: Cijk_Ailk_Bjlk_F8NF8NS_BH_Bias_HAS_SAV_UserArgs_MT64x32x64_MI16x16x1_SN_LDSB0_CLR1_GRVWA4_GRVWB8_GSU0_GSUC0_GSUWGMRR0_K1_LBSPPA512_LBSPPB256_LPA32_LPB16_MIWT2_1_PLR1_SU0_SUM0_SUS64_VWA2_VWB1_WGM1_WGMXCC1_WGMXCCGn1
    SolutionIndex: 57
    SolutionNameMin: Cijk_Ailk_Bjlk_F8NF8NS_BH_Bias_HAS_SAV_UserArgs_MT64x32x64_MI16x16x1_SN_LDSB0_CLR1_GRVWA8_GRVWB8_GSU0_GSUC0_GSUWGMRR0_K1_LBSPPA512_LBSPPB256_LPA32_LPB16_MIWT2_1_PLR1_SU0_SUM0_SUS64_VWA2_VWB1_WGM1_WGMXCC1_WGMXCCGn1
    SolutionIndex: 58
    SolutionNameMin: Cijk_Ailk_Bjlk_F8NF8NS_BH_Bias_HAS_SAV_UserArgs_MT64x32x64_MI16x16x1_SN_LDSB0_CLR1_GRVWA8_GRVWB4_GSU0_GSUC0_GSUWGMRR0_K1_LBSPPA512_LBSPPB256_LPA32_LPB16_MIWT2_1_PLR1_SU0_SUM0_SUS64_VWA2_VWB1_WGM8_WGMXCC1_WGMXCCGn1
    SolutionIndex: 59
    SolutionNameMin: Cijk_Ailk_Bjlk_F8NF8NS_BH_Bias_HAS_SAV_UserArgs_MT32x32x64_MI16x16x1_SN_LDSB0_CLR1_GRVWA4_GRVWB4_GSU0_GSUC0_GSUWGMRR0_K1_LBSPPA256_LBSPPB256_LPA16_LPB16_MIWT1_1_PLR1_SU0_SUM0_SUS64_VWA1_VWB1_WGM1_WGMXCC1_WGMXCCGn1
    SolutionIndex: 60
    SolutionNameMin: Cijk_Ailk_Bjlk_F8NF8NS_BH_Bias_HAS_SAV_UserArgs_MT32x32x64_MI16x16x1_SN_LDSB0_CLR1_GRVWA8_GRVWB4_GSU0_GSUC0_GSUWGMRR0_K1_LBSPPA256_LBSPPB256_LPA16_LPB16_MIWT1_1_PLR1_SU0_SUM0_SUS64_VWA1_VWB1_WGM1_WGMXCC1_WGMXCCGn1
    SolutionIndex: 61
    SolutionNameMin: Cijk_Ailk_Bjlk_F8NF8NS_BH_Bias_HAS_SAV_UserArgs_MT32x32x64_MI16x16x1_SN_LDSB0_CLR1_GRVWA4_GRVWB8_GSU0_GSUC0_GSUWGMRR0_K1_LBSPPA256_LBSPPB256_LPA16_LPB16_MIWT1_1_PLR1_SU0_SUM0_SUS64_VWA1_VWB1_WGM1_WGMXCC1_WGMXCCGn1
    SolutionIndex: 62
    SolutionNameMin: Cijk_Ailk_Bjlk_F8NF8NS_BH_Bias_HAS_SAV_UserArgs_MT32x32x64_MI16x16x1_SN_LDSB0_CLR1_GRVWA8_GRVWB8_GSU0_GSUC0_GSUWGMRR0_K1_LBSPPA256_LBSPPB256_LPA16_LPB16_MIWT1_1_PLR1_SU0_SUM0_SUS64_VWA1_VWB1_WGM1_WGMXCC1_WGMXCCGn1
    SolutionIndex: 63
    SolutionNameMin: Cijk_Ailk_Bjlk_F8NF8NS_BH_Bias_HAS_SAV_UserArgs_MT32x32x64_MI16x16x1_SN_LDSB0_CLR1_GRVWA8_GRVWB4_GSU0_GSUC0_GSUWGMRR0_K1_LBSPPA256_LBSPPB256_LPA16_LPB16_MIWT1_1_PLR1_SU0_SUM0_SUS64_VWA1_VWB1_WGM6_WGMXCC1_WGMXCCGn1
    SolutionIndex: 64
    SolutionNameMin: Cijk_Ailk_Bjlk_F8NF8NS_BH_Bias_HAS_SAV_UserArgs_MT32x32x64_MI16x16x1_SN_LDSB0_CLR1_GRVWA8_GRVWB4_GSU0_GSUC0_GSUWGMRR0_K1_LBSPPA256_LBSPPB256_LPA16_LPB16_MIWT1_1_PLR1_SU0_SUM0_SUS64_VWA1_VWB1_WGM8_WGMXCC1_WGMXCCGn1
    SolutionIndex: 65
    SolutionNameMin: Cijk_Ailk_Bjlk_F8NF8NS_BH_Bias_HAS_SAV_UserArgs_MT256x256x128_MI16x16x1_SN_LDSB1_CLR1_GRVWA16_GRVWB8_GSU0_GSUC0_GSUWGMRR0_K1_LBSPPA2048_LBSPPB2048_LPA0_LPB0_MIWT8_8_PLR1_SU0_SUM0_SUS128_VWA8_VWB8_WGM1_WGMXCC1_WGMXCCGn1
    SolutionIndex: 66
    SolutionNameMin: Cijk_Ailk_Bjlk_F8NF8NS_BH_Bias_HAS_SAV_UserArgs_MT256x256x128_MI16x16x1_SN_LDSB1_CLR1_GRVWA8_GRVWB16_GSU0_GSUC0_GSUWGMRR0_K1_LBSPPA2048_LBSPPB2048_LPA0_LPB0_MIWT8_8_PLR1_SU0_SUM0_SUS128_VWA8_VWB8_WGM4_WGMXCC1_WGMXCCGn1
    SolutionIndex: 67
    SolutionNameMin: Cijk_Ailk_Bjlk_F8NF8NS_BH_Bias_HAS_SAV_UserArgs_MT256x256x128_MI16x16x1_SN_LDSB1_CLR1_GRVWA16_GRVWB8_GSU0_GSUC0_GSUWGMRR0_K1_LBSPPA2048_LBSPPB2048_LPA0_LPB0_MIWT8_8_PLR1_SU0_SUM0_SUS128_VWA8_VWB8_WGM6_WGMXCC1_WGMXCCGn1
    SolutionIndex: 68
    SolutionNameMin: Cijk_Ailk_Bjlk_F8NF8NS_BH_Bias_HAS_SAV_UserArgs_MT256x256x128_MI16x16x1_SN_LDSB1_CLR1_GRVWA8_GRVWB16_GSU0_GSUC0_GSUWGMRR0_K1_LBSPPA2048_LBSPPB2048_LPA0_LPB0_MIWT8_8_PLR1_SU0_SUM0_SUS128_VWA8_VWB8_WGM8_WGMXCC1_WGMXCCGn1
    SolutionIndex: 69
    SolutionNameMin: Cijk_Ailk_Bjlk_F8NF8NS_BH_Bias_HAS_SAV_UserArgs_MT256x256x128_MI16x16x1_SN_LDSB1_CLR1_GRVWA16_GRVWB16_GSU0_GSUC0_GSUWGMRR0_K1_LBSPPA2048_LBSPPB2048_LPA0_LPB0_MIWT8_8_PLR1_SU0_SUM0_SUS128_VWA8_VWB8_WGM8_WGMXCC1_WGMXCCGn1
    SolutionIndex: 70
    SolutionNameMin: Cijk_Ailk_Bjlk_F8NF8NS_BH_Bias_HAS_SAV_UserArgs_MT128x256x128_MI16x16x1_SN_LDSB1_CLR1_GRVWA4_GRVWB16_GSU0_GSUC0_GSUWGMRR0_K1_LBSPPA1024_LBSPPB2048_LPA64_LPB0_MIWT4_8_PLR1_SU0_SUM0_SUS128_VWA4_VWB8_WGM1_WGMXCC1_WGMXCCGn1
    SolutionIndex: 71
    SolutionNameMin: Cijk_Ailk_Bjlk_F8NF8NS_BH_Bias_HAS_SAV_UserArgs_MT128x256x128_MI16x16x1_SN_LDSB1_CLR1_GRVWA8_GRVWB16_GSU0_GSUC0_GSUWGMRR0_K1_LBSPPA1024_LBSPPB2048_LPA64_LPB0_MIWT4_8_PLR1_SU0_SUM0_SUS128_VWA4_VWB8_WGM1_WGMXCC1_WGMXCCGn1
    SolutionIndex: 72
    SolutionNameMin: Cijk_Ailk_Bjlk_F8NF8NS_BH_Bias_HAS_SAV_UserArgs_MT128x256x128_MI16x16x1_SN_LDSB1_CLR1_GRVWA16_GRVWB16_GSU0_GSUC0_GSUWGMRR0_K1_LBSPPA1024_LBSPPB2048_LPA64_LPB0_MIWT4_8_PLR1_SU0_SUM0_SUS128_VWA4_VWB8_WGM4_WGMXCC1_WGMXCCGn1
    SolutionIndex: 73
    SolutionNameMin: Cijk_Ailk_Bjlk_F8NF8NS_BH_Bias_HAS_SAV_UserArgs_MT128x256x128_MI16x16x1_SN_LDSB1_CLR1_GRVWA16_GRVWB16_GSU0_GSUC0_GSUWGMRR0_K1_LBSPPA1024_LBSPPB2048_LPA64_LPB0_MIWT4_8_PLR1_SU0_SUM0_SUS128_VWA4_VWB8_WGM6_WGMXCC1_WGMXCCGn1
    SolutionIndex: 74
    SolutionNameMin: Cijk_Ailk_Bjlk_F8NF8NS_BH_Bias_HAS_SAV_UserArgs_MT128x256x128_MI16x16x1_SN_LDSB1_CLR1_GRVWA4_GRVWB16_GSU0_GSUC0_GSUWGMRR0_K1_LBSPPA1024_LBSPPB2048_LPA64_LPB0_MIWT4_8_PLR1_SU0_SUM0_SUS128_VWA4_VWB8_WGM8_WGMXCC1_WGMXCCGn1
    SolutionIndex: 75
    SolutionNameMin: Cijk_Ailk_Bjlk_F8NF8NS_BH_Bias_HAS_SAV_UserArgs_MT128x128x128_MI16x16x1_SN_LDSB1_CLR1_GRVWA16_GRVWB16_GSU0_GSUC0_GSUWGMRR0_K1_LBSPPA1024_LBSPPB1024_LPA64_LPB64_MIWT4_4_PLR1_SU0_SUM0_SUS128_VWA4_VWB4_WGM1_WGMXCC1_WGMXCCGn1
    SolutionIndex: 76
    SolutionNameMin: Cijk_Ailk_Bjlk_F8NF8NS_BH_Bias_HAS_SAV_UserArgs_MT128x128x128_MI16x16x1_SN_LDSB1_CLR1_GRVWA16_GRVWB16_GSU0_GSUC0_GSUWGMRR0_K1_LBSPPA1024_LBSPPB1024_LPA64_LPB64_MIWT4_4_PLR1_SU0_SUM0_SUS128_VWA4_VWB4_WGM4_WGMXCC1_WGMXCCGn1
    SolutionIndex: 77
    SolutionNameMin: Cijk_Ailk_Bjlk_F8NF8NS_BH_Bias_HAS_SAV_UserArgs_MT128x128x128_MI16x16x1_SN_LDSB1_CLR1_GRVWA16_GRVWB16_GSU0_GSUC0_GSUWGMRR0_K1_LBSPPA1024_LBSPPB1024_LPA64_LPB64_MIWT4_4_PLR1_SU0_SUM0_SUS128_VWA4_VWB4_WGM6_WGMXCC1_WGMXCCGn1
    SolutionIndex: 78
    SolutionNameMin: Cijk_Ailk_Bjlk_F8NF8NS_BH_Bias_HAS_SAV_UserArgs_MT128x64x128_MI16x16x1_SN_LDSB1_CLR1_GRVWA4_GRVWB8_GSU0_GSUC0_GSUWGMRR0_K1_LBSPPA1024_LBSPPB512_LPA64_LPB32_MIWT4_2_PLR1_SU0_SUM0_SUS128_VWA4_VWB2_WGM1_WGMXCC1_WGMXCCGn1
    SolutionIndex: 79
    SolutionNameMin: Cijk_Ailk_Bjlk_F8NF8NS_BH_Bias_HAS_SAV_UserArgs_MT128x64x128_MI16x16x1_SN_LDSB1_CLR1_GRVWA16_GRVWB16_GSU0_GSUC0_GSUWGMRR0_K1_LBSPPA1024_LBSPPB512_LPA64_LPB32_MIWT4_2_PLR1_SU0_SUM0_SUS128_VWA4_VWB2_WGM1_WGMXCC1_WGMXCCGn1
    SolutionIndex: 80
    SolutionNameMin: Cijk_Ailk_Bjlk_F8NF8NS_BH_Bias_HAS_SAV_UserArgs_MT128x64x128_MI16x16x1_SN_LDSB1_CLR1_GRVWA16_GRVWB16_GSU0_GSUC0_GSUWGMRR0_K1_LBSPPA1024_LBSPPB512_LPA64_LPB32_MIWT4_2_PLR1_SU0_SUM0_SUS128_VWA4_VWB2_WGM4_WGMXCC1_WGMXCCGn1
    SolutionIndex: 81
    SolutionNameMin: Cijk_Ailk_Bjlk_F8NF8NS_BH_Bias_HAS_SAV_UserArgs_MT128x64x128_MI16x16x1_SN_LDSB1_CLR1_GRVWA16_GRVWB16_GSU0_GSUC0_GSUWGMRR0_K1_LBSPPA1024_LBSPPB512_LPA64_LPB32_MIWT4_2_PLR1_SU0_SUM0_SUS128_VWA4_VWB2_WGM6_WGMXCC1_WGMXCCGn1
    SolutionIndex: 82
    SolutionNameMin: Cijk_Ailk_Bjlk_F8NF8NS_BH_Bias_HAS_SAV_UserArgs_MT128x64x128_MI16x16x1_SN_LDSB1_CLR1_GRVWA16_GRVWB16_GSU0_GSUC0_GSUWGMRR0_K1_LBSPPA1024_LBSPPB512_LPA64_LPB32_MIWT4_2_PLR1_SU0_SUM0_SUS128_VWA4_VWB2_WGM8_WGMXCC1_WGMXCCGn1
    SolutionIndex: 83
    SolutionNameMin: Cijk_Ailk_Bjlk_F8NF8NS_BH_Bias_HAS_SAV_UserArgs_MT64x64x128_MI16x16x1_SN_LDSB1_CLR1_GRVWA4_GRVWB4_GSU0_GSUC0_GSUWGMRR0_K1_LBSPPA512_LBSPPB512_LPA32_LPB32_MIWT2_2_PLR1_SU0_SUM0_SUS128_VWA2_VWB2_WGM1_WGMXCC1_WGMXCCGn1
    SolutionIndex: 84
    SolutionNameMin: Cijk_Ailk_Bjlk_F8NF8NS_BH_Bias_HAS_SAV_UserArgs_MT64x64x128_MI16x16x1_SN_LDSB1_CLR1_GRVWA8_GRVWB16_GSU0_GSUC0_GSUWGMRR0_K1_LBSPPA512_LBSPPB512_LPA32_LPB32_MIWT2_2_PLR1_SU0_SUM0_SUS128_VWA2_VWB2_WGM1_WGMXCC1_WGMXCCGn1
    SolutionIndex: 85
    SolutionNameMin: Cijk_Ailk_Bjlk_F8NF8NS_BH_Bias_HAS_SAV_UserArgs_MT64x64x128_MI16x16x1_SN_LDSB1_CLR1_GRVWA16_GRVWB16_GSU0_GSUC0_GSUWGMRR0_K1_LBSPPA512_LBSPPB512_LPA32_LPB32_MIWT2_2_PLR1_SU0_SUM0_SUS128_VWA2_VWB2_WGM1_WGMXCC1_WGMXCCGn1
    SolutionIndex: 86
    SolutionNameMin: Cijk_Ailk_Bjlk_F8NF8NS_BH_Bias_HAS_SAV_UserArgs_MT64x64x128_MI16x16x1_SN_LDSB1_CLR1_GRVWA4_GRVWB16_GSU0_GSUC0_GSUWGMRR0_K1_LBSPPA512_LBSPPB512_LPA32_LPB32_MIWT2_2_PLR1_SU0_SUM0_SUS128_VWA2_VWB2_WGM4_WGMXCC1_WGMXCCGn1
    SolutionIndex: 87
    SolutionNameMin: Cijk_Ailk_Bjlk_F8NF8NS_BH_Bias_HAS_SAV_UserArgs_MT64x64x128_MI16x16x1_SN_LDSB1_CLR1_GRVWA8_GRVWB16_GSU0_GSUC0_GSUWGMRR0_K1_LBSPPA512_LBSPPB512_LPA32_LPB32_MIWT2_2_PLR1_SU0_SUM0_SUS128_VWA2_VWB2_WGM4_WGMXCC1_WGMXCCGn1
    SolutionIndex: 88
    SolutionNameMin: Cijk_Ailk_Bjlk_F8NF8NS_BH_Bias_HAS_SAV_UserArgs_MT64x64x128_MI16x16x1_SN_LDSB1_CLR1_GRVWA16_GRVWB16_GSU0_GSUC0_GSUWGMRR0_K1_LBSPPA512_LBSPPB512_LPA32_LPB32_MIWT2_2_PLR1_SU0_SUM0_SUS128_VWA2_VWB2_WGM4_WGMXCC1_WGMXCCGn1
    SolutionIndex: 89
    SolutionNameMin: Cijk_Ailk_Bjlk_F8NF8NS_BH_Bias_HAS_SAV_UserArgs_MT64x64x128_MI16x16x1_SN_LDSB1_CLR1_GRVWA4_GRVWB16_GSU0_GSUC0_GSUWGMRR0_K1_LBSPPA512_LBSPPB512_LPA32_LPB32_MIWT2_2_PLR1_SU0_SUM0_SUS128_VWA2_VWB2_WGM6_WGMXCC1_WGMXCCGn1
    SolutionIndex: 90
    SolutionNameMin: Cijk_Ailk_Bjlk_F8NF8NS_BH_Bias_HAS_SAV_UserArgs_MT64x64x128_MI16x16x1_SN_LDSB1_CLR1_GRVWA16_GRVWB16_GSU0_GSUC0_GSUWGMRR0_K1_LBSPPA512_LBSPPB512_LPA32_LPB32_MIWT2_2_PLR1_SU0_SUM0_SUS128_VWA2_VWB2_WGM6_WGMXCC1_WGMXCCGn1
    SolutionIndex: 91
    SolutionNameMin: Cijk_Ailk_Bjlk_F8NF8NS_BH_Bias_HAS_SAV_UserArgs_MT64x64x128_MI16x16x1_SN_LDSB1_CLR1_GRVWA16_GRVWB16_GSU0_GSUC0_GSUWGMRR0_K1_LBSPPA512_LBSPPB512_LPA32_LPB32_MIWT2_2_PLR1_SU0_SUM0_SUS128_VWA2_VWB2_WGM8_WGMXCC1_WGMXCCGn1
    SolutionIndex: 92
    SolutionNameMin: Cijk_Ailk_Bjlk_F8NF8NS_BH_Bias_HAS_SAV_UserArgs_MT32x64x128_MI16x16x1_SN_LDSB0_CLR1_GRVWA4_GRVWB8_GSU0_GSUC0_GSUWGMRR0_K1_LBSPPA256_LBSPPB512_LPA16_LPB32_MIWT1_2_PLR1_SU0_SUM0_SUS128_VWA1_VWB2_WGM1_WGMXCC1_WGMXCCGn1
    SolutionIndex: 93
    SolutionNameMin: Cijk_Ailk_Bjlk_F8NF8NS_BH_Bias_HAS_SAV_UserArgs_MT32x64x128_MI16x16x1_SN_LDSB0_CLR1_GRVWA8_GRVWB8_GSU0_GSUC0_GSUWGMRR0_K1_LBSPPA256_LBSPPB512_LPA16_LPB32_MIWT1_2_PLR1_SU0_SUM0_SUS128_VWA1_VWB2_WGM1_WGMXCC1_WGMXCCGn1
    SolutionIndex: 94
    SolutionNameMin: Cijk_Ailk_Bjlk_F8NF8NS_BH_Bias_HAS_SAV_UserArgs_MT32x64x128_MI16x16x1_SN_LDSB0_CLR1_GRVWA16_GRVWB16_GSU0_GSUC0_GSUWGMRR0_K1_LBSPPA256_LBSPPB512_LPA16_LPB32_MIWT1_2_PLR1_SU0_SUM0_SUS128_VWA1_VWB2_WGM4_WGMXCC1_WGMXCCGn1
    SolutionIndex: 95
    SolutionNameMin: Cijk_Ailk_Bjlk_F8NF8NS_BH_Bias_HAS_SAV_UserArgs_MT32x64x128_MI16x16x1_SN_LDSB0_CLR1_GRVWA16_GRVWB16_GSU0_GSUC0_GSUWGMRR0_K1_LBSPPA256_LBSPPB512_LPA16_LPB32_MIWT1_2_PLR1_SU0_SUM0_SUS128_VWA1_VWB2_WGM6_WGMXCC1_WGMXCCGn1
    SolutionIndex: 96
    SolutionNameMin: Cijk_Ailk_Bjlk_F8NF8NS_BH_Bias_HAS_SAV_UserArgs_MT32x64x128_MI16x16x1_SN_LDSB0_CLR1_GRVWA16_GRVWB16_GSU0_GSUC0_GSUWGMRR0_K1_LBSPPA256_LBSPPB512_LPA16_LPB32_MIWT1_2_PLR1_SU0_SUM0_SUS128_VWA1_VWB2_WGM8_WGMXCC1_WGMXCCGn1
    SolutionIndex: 97
    SolutionNameMin: Cijk_Ailk_Bjlk_F8NF8NS_BH_Bias_HAS_SAV_UserArgs_MT64x32x128_MI16x16x1_SN_LDSB0_CLR1_GRVWA4_GRVWB4_GSU0_GSUC0_GSUWGMRR0_K1_LBSPPA512_LBSPPB256_LPA32_LPB16_MIWT2_1_PLR1_SU0_SUM0_SUS128_VWA2_VWB1_WGM1_WGMXCC1_WGMXCCGn1
    SolutionIndex: 98
    SolutionNameMin: Cijk_Ailk_Bjlk_F8NF8NS_BH_Bias_HAS_SAV_UserArgs_MT64x32x128_MI16x16x1_SN_LDSB0_CLR1_GRVWA4_GRVWB8_GSU0_GSUC0_GSUWGMRR0_K1_LBSPPA512_LBSPPB256_LPA32_LPB16_MIWT2_1_PLR1_SU0_SUM0_SUS128_VWA2_VWB1_WGM1_WGMXCC1_WGMXCCGn1
    SolutionIndex: 99
    SolutionNameMin: Cijk_Ailk_Bjlk_F8NF8NS_BH_Bias_HAS_SAV_UserArgs_MT64x32x128_MI16x16x1_SN_LDSB0_CLR1_GRVWA8_GRVWB8_GSU0_GSUC0_GSUWGMRR0_K1_LBSPPA512_LBSPPB256_LPA32_LPB16_MIWT2_1_PLR1_SU0_SUM0_SUS128_VWA2_VWB1_WGM1_WGMXCC1_WGMXCCGn1
    SolutionIndex: 100
    SolutionNameMin: Cijk_Ailk_Bjlk_F8NF8NS_BH_Bias_HAS_SAV_UserArgs_MT64x32x128_MI16x16x1_SN_LDSB0_CLR1_GRVWA8_GRVWB16_GSU0_GSUC0_GSUWGMRR0_K1_LBSPPA512_LBSPPB256_LPA32_LPB16_MIWT2_1_PLR1_SU0_SUM0_SUS128_VWA2_VWB1_WGM1_WGMXCC1_WGMXCCGn1
    SolutionIndex: 101
    SolutionNameMin: Cijk_Ailk_Bjlk_F8NF8NS_BH_Bias_HAS_SAV_UserArgs_MT64x32x128_MI16x16x1_SN_LDSB0_CLR1_GRVWA16_GRVWB16_GSU0_GSUC0_GSUWGMRR0_K1_LBSPPA512_LBSPPB256_LPA32_LPB16_MIWT2_1_PLR1_SU0_SUM0_SUS128_VWA2_VWB1_WGM1_WGMXCC1_WGMXCCGn1
    SolutionIndex: 102
    SolutionNameMin: Cijk_Ailk_Bjlk_F8NF8NS_BH_Bias_HAS_SAV_UserArgs_MT64x32x128_MI16x16x1_SN_LDSB0_CLR1_GRVWA4_GRVWB8_GSU0_GSUC0_GSUWGMRR0_K1_LBSPPA512_LBSPPB256_LPA32_LPB16_MIWT2_1_PLR1_SU0_SUM0_SUS128_VWA2_VWB1_WGM6_WGMXCC1_WGMXCCGn1
    SolutionIndex: 103
    SolutionNameMin: Cijk_Ailk_Bjlk_F8NF8NS_BH_Bias_HAS_SAV_UserArgs_MT32x32x128_MI16x16x1_SN_LDSB0_CLR1_GRVWA4_GRVWB4_GSU0_GSUC0_GSUWGMRR0_K1_LBSPPA256_LBSPPB256_LPA16_LPB16_MIWT1_1_PLR1_SU0_SUM0_SUS128_VWA1_VWB1_WGM1_WGMXCC1_WGMXCCGn1
    SolutionIndex: 104
    SolutionNameMin: Cijk_Ailk_Bjlk_F8NF8NS_BH_Bias_HAS_SAV_UserArgs_MT32x32x128_MI16x16x1_SN_LDSB0_CLR1_GRVWA8_GRVWB4_GSU0_GSUC0_GSUWGMRR0_K1_LBSPPA256_LBSPPB256_LPA16_LPB16_MIWT1_1_PLR1_SU0_SUM0_SUS128_VWA1_VWB1_WGM1_WGMXCC1_WGMXCCGn1
    SolutionIndex: 105
    SolutionNameMin: Cijk_Ailk_Bjlk_F8NF8NS_BH_Bias_HAS_SAV_UserArgs_MT32x32x128_MI16x16x1_SN_LDSB0_CLR1_GRVWA4_GRVWB8_GSU0_GSUC0_GSUWGMRR0_K1_LBSPPA256_LBSPPB256_LPA16_LPB16_MIWT1_1_PLR1_SU0_SUM0_SUS128_VWA1_VWB1_WGM1_WGMXCC1_WGMXCCGn1
    SolutionIndex: 106
    SolutionNameMin: Cijk_Ailk_Bjlk_F8NF8NS_BH_Bias_HAS_SAV_UserArgs_MT32x32x128_MI16x16x1_SN_LDSB0_CLR1_GRVWA8_GRVWB8_GSU0_GSUC0_GSUWGMRR0_K1_LBSPPA256_LBSPPB256_LPA16_LPB16_MIWT1_1_PLR1_SU0_SUM0_SUS128_VWA1_VWB1_WGM1_WGMXCC1_WGMXCCGn1
    SolutionIndex: 107
    SolutionNameMin: Cijk_Ailk_Bjlk_F8NF8NS_BH_Bias_HAS_SAV_UserArgs_MT32x32x128_MI16x16x1_SN_LDSB0_CLR1_GRVWA4_GRVWB16_GSU0_GSUC0_GSUWGMRR0_K1_LBSPPA256_LBSPPB256_LPA16_LPB16_MIWT1_1_PLR1_SU0_SUM0_SUS128_VWA1_VWB1_WGM1_WGMXCC1_WGMXCCGn1
    SolutionIndex: 108
    SolutionNameMin: Cijk_Ailk_Bjlk_F8NF8NS_BH_Bias_HAS_SAV_UserArgs_MT32x32x128_MI16x16x1_SN_LDSB0_CLR1_GRVWA8_GRVWB16_GSU0_GSUC0_GSUWGMRR0_K1_LBSPPA256_LBSPPB256_LPA16_LPB16_MIWT1_1_PLR1_SU0_SUM0_SUS128_VWA1_VWB1_WGM1_WGMXCC1_WGMXCCGn1
    SolutionIndex: 109
    SolutionNameMin: Cijk_Ailk_Bjlk_F8NF8NS_BH_Bias_HAS_SAV_UserArgs_MT32x32x128_MI16x16x1_SN_LDSB0_CLR1_GRVWA16_GRVWB16_GSU0_GSUC0_GSUWGMRR0_K1_LBSPPA256_LBSPPB256_LPA16_LPB16_MIWT1_1_PLR1_SU0_SUM0_SUS128_VWA1_VWB1_WGM1_WGMXCC1_WGMXCCGn1
    SolutionIndex: 110
    SolutionNameMin: Cijk_Ailk_Bjlk_F8NF8NS_BH_Bias_HAS_SAV_UserArgs_MT32x32x128_MI16x16x1_SN_LDSB0_CLR1_GRVWA4_GRVWB16_GSU0_GSUC0_GSUWGMRR0_K1_LBSPPA256_LBSPPB256_LPA16_LPB16_MIWT1_1_PLR1_SU0_SUM0_SUS128_VWA1_VWB1_WGM6_WGMXCC1_WGMXCCGn1
    SolutionIndex: 111
    SolutionNameMin: Cijk_Ailk_Bjlk_F8NF8NS_BH_Bias_HAS_SAV_UserArgs_MT128x64x256_MI16x16x1_SN_LDSB1_CLR1_GRVWA16_GRVWB16_GSU0_GSUC0_GSUWGMRR0_K1_LBSPPA1024_LBSPPB512_LPA64_LPB32_MIWT4_2_PLR1_SU0_SUM0_SUS256_VWA4_VWB2_WGM1_WGMXCC1_WGMXCCGn1
    SolutionIndex: 112
    SolutionNameMin: Cijk_Ailk_Bjlk_F8NF8NS_BH_Bias_HAS_SAV_UserArgs_MT128x64x256_MI16x16x1_SN_LDSB1_CLR1_GRVWA16_GRVWB16_GSU0_GSUC0_GSUWGMRR0_K1_LBSPPA1024_LBSPPB512_LPA64_LPB32_MIWT4_2_PLR1_SU0_SUM0_SUS256_VWA4_VWB2_WGM8_WGMXCC1_WGMXCCGn1
    SolutionIndex: 113
    SolutionNameMin: Cijk_Ailk_Bjlk_F8NF8NS_BH_Bias_HAS_SAV_UserArgs_MT64x64x256_MI16x16x1_SN_LDSB1_CLR1_GRVWA16_GRVWB16_GSU0_GSUC0_GSUWGMRR0_K1_LBSPPA512_LBSPPB512_LPA32_LPB32_MIWT2_2_PLR1_SU0_SUM0_SUS256_VWA2_VWB2_WGM1_WGMXCC1_WGMXCCGn1
    SolutionIndex: 114
    SolutionNameMin: Cijk_Ailk_Bjlk_F8NF8NS_BH_Bias_HAS_SAV_UserArgs_MT64x64x256_MI16x16x1_SN_LDSB1_CLR1_GRVWA16_GRVWB16_GSU0_GSUC0_GSUWGMRR0_K1_LBSPPA512_LBSPPB512_LPA32_LPB32_MIWT2_2_PLR1_SU0_SUM0_SUS256_VWA2_VWB2_WGM6_WGMXCC1_WGMXCCGn1
    SolutionIndex: 115
    SolutionNameMin: Cijk_Ailk_Bjlk_F8NF8NS_BH_Bias_HAS_SAV_UserArgs_MT64x64x256_MI16x16x1_SN_LDSB1_CLR1_GRVWA16_GRVWB16_GSU0_GSUC0_GSUWGMRR0_K1_LBSPPA512_LBSPPB512_LPA32_LPB32_MIWT2_2_PLR1_SU0_SUM0_SUS256_VWA2_VWB2_WGM8_WGMXCC1_WGMXCCGn1
    SolutionIndex: 116
    SolutionNameMin: Cijk_Ailk_Bjlk_F8NF8NS_BH_Bias_HAS_SAV_UserArgs_MT64x32x256_MI16x16x1_SN_LDSB1_CLR1_GRVWA16_GRVWB16_GSU0_GSUC0_GSUWGMRR0_K1_LBSPPA512_LBSPPB256_LPA32_LPB16_MIWT2_1_PLR1_SU0_SUM0_SUS256_VWA2_VWB1_WGM1_WGMXCC1_WGMXCCGn1
    SolutionIndex: 117
    SolutionNameMin: Cijk_Ailk_Bjlk_F8NF8NS_BH_Bias_HAS_SAV_UserArgs_MT64x32x256_MI16x16x1_SN_LDSB1_CLR1_GRVWA16_GRVWB16_GSU0_GSUC0_GSUWGMRR0_K1_LBSPPA512_LBSPPB256_LPA32_LPB16_MIWT2_1_PLR1_SU0_SUM0_SUS256_VWA2_VWB1_WGM4_WGMXCC1_WGMXCCGn1
    SolutionIndex: 118
    SolutionNameMin: Cijk_Ailk_Bjlk_F8NF8NS_BH_Bias_HAS_SAV_UserArgs_MT64x32x256_MI16x16x1_SN_LDSB1_CLR1_GRVWA16_GRVWB16_GSU0_GSUC0_GSUWGMRR0_K1_LBSPPA512_LBSPPB256_LPA32_LPB16_MIWT2_1_PLR1_SU0_SUM0_SUS256_VWA2_VWB1_WGM6_WGMXCC1_WGMXCCGn1
    SolutionIndex: 119
    SolutionNameMin: Cijk_Ailk_Bjlk_F8NF8NS_BH_Bias_HAS_SAV_UserArgs_MT32x32x256_MI16x16x1_SN_LDSB1_CLR1_GRVWA8_GRVWB16_GSU0_GSUC0_GSUWGMRR0_K1_LBSPPA256_LBSPPB256_LPA16_LPB16_MIWT1_1_PLR1_SU0_SUM0_SUS256_VWA1_VWB1_WGM1_WGMXCC1_WGMXCCGn1
    SolutionIndex: 120
    SolutionNameMin: Cijk_Ailk_Bjlk_F8NF8NS_BH_Bias_HAS_SAV_UserArgs_MT32x32x256_MI16x16x1_SN_LDSB1_CLR1_GRVWA16_GRVWB16_GSU0_GSUC0_GSUWGMRR0_K1_LBSPPA256_LBSPPB256_LPA16_LPB16_MIWT1_1_PLR1_SU0_SUM0_SUS256_VWA1_VWB1_WGM1_WGMXCC1_WGMXCCGn1
    SolutionIndex: 121
    SolutionNameMin: Cijk_Ailk_Bjlk_F8NF8NS_BH_Bias_HAS_SAV_UserArgs_MT32x32x256_MI16x16x1_SN_LDSB1_CLR1_GRVWA16_GRVWB16_GSU0_GSUC0_GSUWGMRR0_K1_LBSPPA256_LBSPPB256_LPA16_LPB16_MIWT1_1_PLR1_SU0_SUM0_SUS256_VWA1_VWB1_WGM4_WGMXCC1_WGMXCCGn1
    SolutionIndex: 122
    SolutionNameMin: Cijk_Ailk_Bjlk_F8NF8NS_BH_Bias_HAS_SAV_UserArgs_MT32x32x256_MI16x16x1_SN_LDSB1_CLR1_GRVWA8_GRVWB16_GSU0_GSUC0_GSUWGMRR0_K1_LBSPPA256_LBSPPB256_LPA16_LPB16_MIWT1_1_PLR1_SU0_SUM0_SUS256_VWA1_VWB1_WGM8_WGMXCC1_WGMXCCGn1
    SolutionIndex: 123
    SolutionNameMin: Cijk_Ailk_Bjlk_F8NF8NS_BH_Bias_HAS_SAV_UserArgs_MT32x32x256_MI16x16x1_SN_LDSB1_CLR1_GRVWA16_GRVWB16_GSU0_GSUC0_GSUWGMRR0_K1_LBSPPA256_LBSPPB256_LPA16_LPB16_MIWT1_1_PLR1_SU0_SUM0_SUS256_VWA1_VWB1_WGM8_WGMXCC1_WGMXCCGn1
- - - [128, 128, 1, 128, 128, 128, 128, 128]
    - [61, 0.49]
  - - [128, 128, 1, 256, 128, 128, 128, 128]
    - [59, 0.9]
  - - [128, 128, 1, 512, 128, 128, 128, 128]
    - [108, 1.46]
  - - [128, 128, 1, 1024, 128, 128, 128, 128]
    - [108, 2.22]
  - - [128, 128, 1, 2048, 128, 128, 128, 128]
    - [109, 2.94]
  - - [128, 128, 1, 4096, 128, 128, 128, 128]
    - [120, 3.52]
  - - [128, 128, 1, 8192, 128, 128, 128, 128]
    - [120, 3.94]
  - - [128, 256, 1, 128, 128, 128, 128, 256]
    - [59, 1.03]
  - - [128, 256, 1, 256, 128, 128, 128, 256]
    - [62, 1.82]
  - - [128, 256, 1, 512, 128, 128, 128, 256]
    - [105, 2.99]
  - - [128, 256, 1, 1024, 128, 128, 128, 256]
    - [108, 4.43]
  - - [128, 256, 1, 2048, 128, 128, 128, 256]
    - [108, 5.88]
  - - [128, 256, 1, 4096, 128, 128, 128, 256]
    - [108, 7.04]
  - - [128, 256, 1, 8192, 128, 128, 128, 256]
    - [120, 7.89]
  - - [128, 512, 1, 128, 128, 128, 128, 512]
    - [60, 2.02]
  - - [128, 512, 1, 256, 128, 128, 128, 512]
    - [60, 3.56]
  - - [128, 512, 1, 512, 128, 128, 128, 512]
    - [103, 5.85]
  - - [128, 512, 1, 1024, 128, 128, 128, 512]
    - [106, 8.64]
  - - [128, 512, 1, 2048, 128, 128, 128, 512]
    - [108, 11.56]
  - - [128, 512, 1, 4096, 128, 128, 128, 512]
    - [108, 13.87]
  - - [128, 512, 1, 8192, 128, 128, 128, 512]
    - [120, 15.35]
  - - [128, 1024, 1, 128, 128, 128, 128, 1024]
    - [60, 3.9]
  - - [128, 1024, 1, 256, 128, 128, 128, 1024]
    - [62, 6.96]
  - - [128, 1024, 1, 512, 128, 128, 128, 1024]
    - [104, 11.28]
  - - [128, 1024, 1, 1024, 128, 128, 128, 1024]
    - [106, 16.9]
  - - [128, 1024, 1, 2048, 128, 128, 128, 1024]
    - [108, 22.46]
  - - [128, 1024, 1, 4096, 128, 128, 128, 1024]
    - [122, 25.76]
  - - [128, 1024, 1, 8192, 128, 128, 128, 1024]
    - [110, 27.64]
  - - [128, 2048, 1, 128, 128, 128, 128, 2048]
    - [54, 7.56]
  - - [128, 2048, 1, 256, 128, 128, 128, 2048]
    - [97, 12.98]
  - - [128, 2048, 1, 512, 128, 128, 128, 2048]
    - [97, 21.07]
  - - [128, 2048, 1, 1024, 128, 128, 128, 2048]
    - [101, 30.79]
  - - [128, 2048, 1, 2048, 128, 128, 128, 2048]
    - [116, 39.01]
  - - [128, 2048, 1, 4096, 128, 128, 128, 2048]
    - [118, 47.09]
  - - [128, 2048, 1, 8192, 128, 128, 128, 2048]
    - [118, 53.25]
  - - [128, 4096, 1, 128, 128, 128, 128, 4096]
    - [49, 13.88]
  - - [128, 4096, 1, 256, 128, 128, 128, 4096]
    - [50, 23.86]
  - - [128, 4096, 1, 512, 128, 128, 128, 4096]
    - [83, 37.74]
  - - [128, 4096, 1, 1024, 128, 128, 128, 4096]
    - [85, 53.7]
  - - [128, 4096, 1, 2048, 128, 128, 128, 4096]
    - [113, 66.87]
  - - [128, 4096, 1, 4096, 128, 128, 128, 4096]
    - [113, 82.05]
  - - [128, 4096, 1, 8192, 128, 128, 128, 4096]
    - [115, 91.78]
  - - [128, 8192, 1, 128, 128, 128, 128, 8192]
    - [47, 24.57]
  - - [128, 8192, 1, 256, 128, 128, 128, 8192]
    - [47, 41.51]
  - - [128, 8192, 1, 512, 128, 128, 128, 8192]
    - [47, 63.57]
  - - [128, 8192, 1, 1024, 128, 128, 128, 8192]
    - [79, 88.37]
  - - [128, 8192, 1, 2048, 128, 128, 128, 8192]
    - [79, 107.44]
  - - [128, 8192, 1, 4096, 128, 128, 128, 8192]
    - [112, 125.35]
  - - [128, 8192, 1, 8192, 128, 128, 128, 8192]
    - [111, 130.54]
  - - [256, 128, 1, 128, 256, 256, 256, 128]
    - [59, 1.01]
  - - [256, 128, 1, 256, 256, 256, 256, 128]
    - [59, 1.8]
  - - [256, 128, 1, 512, 256, 256, 256, 128]
    - [106, 2.93]
  - - [256, 128, 1, 1024, 256, 256, 256, 128]
    - [108, 4.43]
  - - [256, 128, 1, 2048, 256, 256, 256, 128]
    - [108, 5.87]
  - - [256, 128, 1, 4096, 256, 256, 256, 128]
    - [108, 7.05]
  - - [256, 128, 1, 8192, 256, 256, 256, 128]
    - [120, 7.88]
  - - [256, 256, 1, 128, 256, 256, 256, 256]
    - [63, 1.93]
  - - [256, 256, 1, 256, 256, 256, 256, 256]
    - [58, 2.7]
  - - [256, 256, 1, 512, 256, 256, 256, 256]
    - [53, 5.17]
  - - [256, 256, 1, 1024, 256, 256, 256, 256]
    - [119, 8.61]
  - - [256, 256, 1, 2048, 256, 256, 256, 256]
    - [108, 11.83]
  - - [256, 256, 1, 4096, 256, 256, 256, 256]
    - [108, 14.1]
  - - [256, 256, 1, 8192, 256, 256, 256, 256]
    - [120, 15.64]
  - - [256, 512, 1, 128, 256, 256, 256, 512]
    - [61, 4.0]
  - - [256, 512, 1, 256, 256, 256, 256, 512]
    - [60, 7.07]
  - - [256, 512, 1, 512, 256, 256, 256, 512]
    - [105, 11.46]
  - - [256, 512, 1, 1024, 256, 256, 256, 512]
    - [106, 17.3]
  - - [256, 512, 1, 2048, 256, 256, 256, 512]
    - [108, 22.83]
  - - [256, 512, 1, 4096, 256, 256, 256, 512]
    - [108, 27.6]
  - - [256, 512, 1, 8192, 256, 256, 256, 512]
    - [120, 30.61]
  - - [256, 1024, 1, 128, 256, 256, 256, 1024]
    - [54, 7.65]
  - - [256, 1024, 1, 256, 256, 256, 256, 1024]
    - [54, 13.35]
  - - [256, 1024, 1, 512, 256, 256, 256, 1024]
    - [99, 21.07]
  - - [256, 1024, 1, 1024, 256, 256, 256, 1024]
    - [92, 31.0]
  - - [256, 1024, 1, 2048, 256, 256, 256, 1024]
    - [117, 40.59]
  - - [256, 1024, 1, 4096, 256, 256, 256, 1024]
    - [116, 48.65]
  - - [256, 1024, 1, 8192, 256, 256, 256, 1024]
    - [118, 54.02]
  - - [256, 2048, 1, 128, 256, 256, 256, 2048]
    - [50, 13.87]
  - - [256, 2048, 1, 256, 256, 256, 256, 2048]
    - [50, 23.99]
  - - [256, 2048, 1, 512, 256, 256, 256, 2048]
    - [51, 37.69]
  - - [256, 2048, 1, 1024, 256, 256, 256, 2048]
    - [85, 53.92]
  - - [256, 2048, 1, 2048, 256, 256, 256, 2048]
    - [85, 68.17]
  - - [256, 2048, 1, 4096, 256, 256, 256, 2048]
    - [85, 79.49]
  - - [256, 2048, 1, 8192, 256, 256, 256, 2048]
    - [114, 87.31]
  - - [256, 4096, 1, 128, 256, 256, 256, 4096]
    - [46, 23.96]
  - - [256, 4096, 1, 256, 256, 256, 256, 4096]
    - [47, 41.04]
  - - [256, 4096, 1, 512, 256, 256, 256, 4096]
    - [78, 62.95]
  - - [256, 4096, 1, 1024, 256, 256, 256, 4096]
    - [78, 88.08]
  - - [256, 4096, 1, 2048, 256, 256, 256, 4096]
    - [79, 107.68]
  - - [256, 4096, 1, 4096, 256, 256, 256, 4096]
    - [79, 125.69]
  - - [256, 4096, 1, 8192, 256, 256, 256, 4096]
    - [111, 131.25]
  - - [256, 8192, 1, 128, 256, 256, 256, 8192]
    - [37, 38.3]
  - - [256, 8192, 1, 256, 256, 256, 256, 8192]
    - [38, 64.44]
  - - [256, 8192, 1, 512, 256, 256, 256, 8192]
    - [39, 98.35]
  - - [256, 8192, 1, 1024, 256, 256, 256, 8192]
    - [75, 133.6]
  - - [256, 8192, 1, 2048, 256, 256, 256, 8192]
    - [75, 160.16]
  - - [256, 8192, 1, 4096, 256, 256, 256, 8192]
    - [76, 179.51]
  - - [256, 8192, 1, 8192, 256, 256, 256, 8192]
    - [75, 170.04]
  - - [512, 128, 1, 128, 512, 512, 512, 128]
    - [64, 1.94]
  - - [512, 128, 1, 256, 512, 512, 512, 128]
    - [59, 3.37]
  - - [512, 128, 1, 512, 512, 512, 512, 128]
    - [103, 5.74]
  - - [512, 128, 1, 1024, 512, 512, 512, 128]
    - [107, 8.75]
  - - [512, 128, 1, 2048, 512, 512, 512, 128]
    - [108, 11.72]
  - - [512, 128, 1, 4096, 512, 512, 512, 128]
    - [108, 14.07]
  - - [512, 128, 1, 8192, 512, 512, 512, 128]
    - [121, 14.77]
  - - [512, 256, 1, 128, 512, 512, 512, 256]
    - [59, 3.79]
  - - [512, 256, 1, 256, 512, 512, 512, 256]
    - [61, 7.01]
  - - [512, 256, 1, 512, 512, 512, 512, 256]
    - [105, 11.42]
  - - [512, 256, 1, 1024, 512, 512, 512, 256]
    - [106, 17.14]
  - - [512, 256, 1, 2048, 512, 512, 512, 256]
    - [108, 22.76]
  - - [512, 256, 1, 4096, 512, 512, 512, 256]
    - [108, 27.61]
  - - [512, 256, 1, 8192, 512, 512, 512, 256]
    - [123, 28.64]
  - - [512, 512, 1, 128, 512, 512, 512, 512]
    - [57, 7.35]
  - - [512, 512, 1, 256, 512, 512, 512, 512]
    - [55, 12.96]
  - - [512, 512, 1, 512, 512, 512, 512, 512]
    - [93, 20.51]
  - - [512, 512, 1, 1024, 512, 512, 512, 512]
    - [100, 30.66]
  - - [512, 512, 1, 2048, 512, 512, 512, 512]
    - [116, 40.57]
  - - [512, 512, 1, 4096, 512, 512, 512, 512]
    - [116, 48.89]
  - - [512, 512, 1, 8192, 512, 512, 512, 512]
    - [101, 50.52]
  - - [512, 1024, 1, 128, 512, 512, 512, 1024]
    - [51, 13.66]
  - - [512, 1024, 1, 256, 512, 512, 512, 1024]
    - [50, 23.71]
  - - [512, 1024, 1, 512, 512, 512, 512, 1024]
    - [84, 37.41]
  - - [512, 1024, 1, 1024, 512, 512, 512, 1024]
    - [84, 53.76]
  - - [512, 1024, 1, 2048, 512, 512, 512, 1024]
    - [84, 69.17]
  - - [512, 1024, 1, 4096, 512, 512, 512, 1024]
    - [85, 78.12]
  - - [512, 1024, 1, 8192, 512, 512, 512, 1024]
    - [90, 82.0]
  - - [512, 2048, 1, 128, 512, 512, 512, 2048]
    - [33, 24.15]
  - - [512, 2048, 1, 256, 512, 512, 512, 2048]
    - [47, 41.23]
  - - [512, 2048, 1, 512, 512, 512, 512, 2048]
    - [48, 63.72]
  - - [512, 2048, 1, 1024, 512, 512, 512, 2048]
    - [79, 88.88]
  - - [512, 2048, 1, 2048, 512, 512, 512, 2048]
    - [79, 108.54]
  - - [512, 2048, 1, 4096, 512, 512, 512, 2048]
    - [79, 124.97]
  - - [512, 2048, 1, 8192, 512, 512, 512, 2048]
    - [80, 129.82]
  - - [512, 4096, 1, 128, 512, 512, 512, 4096]
    - [37, 38.67]
  - - [512, 4096, 1, 256, 512, 512, 512, 4096]
    - [37, 65.19]
  - - [512, 4096, 1, 512, 512, 512, 512, 4096]
    - [38, 98.71]
  - - [512, 4096, 1, 1024, 512, 512, 512, 4096]
    - [75, 134.43]
  - - [512, 4096, 1, 2048, 512, 512, 512, 4096]
    - [39, 160.32]
  - - [512, 4096, 1, 4096, 512, 512, 512, 4096]
    - [41, 177.67]
  - - [512, 4096, 1, 8192, 512, 512, 512, 4096]
    - [40, 169.68]
  - - [512, 8192, 1, 128, 512, 512, 512, 8192]
    - [25, 55.86]
  - - [512, 8192, 1, 256, 512, 512, 512, 8192]
    - [26, 93.25]
  - - [512, 8192, 1, 512, 512, 512, 512, 8192]
    - [26, 141.23]
  - - [512, 8192, 1, 1024, 512, 512, 512, 8192]
    - [26, 190.36]
  - - [512, 8192, 1, 2048, 512, 512, 512, 8192]
    - [26, 226.75]
  - - [512, 8192, 1, 4096, 512, 512, 512, 8192]
    - [72, 234.89]
  - - [512, 8192, 1, 8192, 512, 512, 512, 8192]
    - [70, 218.97]
  - - [1024, 128, 1, 128, 1024, 1024, 1024, 128]
    - [60, 3.98]
  - - [1024, 128, 1, 256, 1024, 1024, 1024, 128]
    - [103, 6.92]
  - - [1024, 128, 1, 512, 1024, 1024, 1024, 128]
    - [107, 11.43]
  - - [1024, 128, 1, 1024, 1024, 1024, 1024, 128]
    - [107, 17.2]
  - - [1024, 128, 1, 2048, 1024, 1024, 1024, 128]
    - [108, 22.87]
  - - [1024, 128, 1, 4096, 1024, 1024, 1024, 128]
    - [121, 24.91]
  - - [1024, 128, 1, 8192, 1024, 1024, 1024, 128]
    - [121, 26.5]
  - - [1024, 256, 1, 128, 1024, 1024, 1024, 256]
    - [54, 7.54]
  - - [1024, 256, 1, 256, 1024, 1024, 1024, 256]
    - [54, 13.28]
  - - [1024, 256, 1, 512, 1024, 1024, 1024, 256]
    - [99, 21.4]
  - - [1024, 256, 1, 1024, 1024, 1024, 1024, 256]
    - [101, 30.82]
  - - [1024, 256, 1, 2048, 1024, 1024, 1024, 256]
    - [116, 40.95]
  - - [1024, 256, 1, 4096, 1024, 1024, 1024, 256]
    - [96, 45.95]
  - - [1024, 256, 1, 8192, 1024, 1024, 1024, 256]
    - [102, 49.3]
  - - [1024, 512, 1, 128, 1024, 1024, 1024, 512]
    - [50, 13.95]
  - - [1024, 512, 1, 256, 1024, 1024, 1024, 512]
    - [52, 23.79]
  - - [1024, 512, 1, 512, 1024, 1024, 1024, 512]
    - [51, 37.45]
  - - [1024, 512, 1, 1024, 1024, 1024, 1024, 512]
    - [84, 53.95]
  - - [1024, 512, 1, 2048, 1024, 1024, 1024, 512]
    - [84, 69.31]
  - - [1024, 512, 1, 4096, 1024, 1024, 1024, 512]
    - [86, 76.67]
  - - [1024, 512, 1, 8192, 1024, 1024, 1024, 512]
    - [89, 82.74]
  - - [1024, 1024, 1, 128, 1024, 1024, 1024, 1024]
    - [47, 24.26]
  - - [1024, 1024, 1, 256, 1024, 1024, 1024, 1024]
    - [47, 41.14]
  - - [1024, 1024, 1, 512, 1024, 1024, 1024, 1024]
    - [48, 63.44]
  - - [1024, 1024, 1, 1024, 1024, 1024, 1024, 1024]
    - [79, 88.8]
  - - [1024, 1024, 1, 2048, 1024, 1024, 1024, 1024]
    - [79, 109.27]
  - - [1024, 1024, 1, 4096, 1024, 1024, 1024, 1024]
    - [81, 124.62]
  - - [1024, 1024, 1, 8192, 1024, 1024, 1024, 1024]
    - [80, 129.92]
  - - [1024, 2048, 1, 128, 1024, 1024, 1024, 2048]
    - [37, 38.52]
  - - [1024, 2048, 1, 256, 1024, 1024, 1024, 2048]
    - [37, 64.13]
  - - [1024, 2048, 1, 512, 1024, 1024, 1024, 2048]
    - [39, 98.12]
  - - [1024, 2048, 1, 1024, 1024, 1024, 1024, 2048]
    - [38, 133.78]
  - - [1024, 2048, 1, 2048, 1024, 1024, 1024, 2048]
    - [38, 161.12]
  - - [1024, 2048, 1, 4096, 1024, 1024, 1024, 2048]
    - [38, 178.49]
  - - [1024, 2048, 1, 8192, 1024, 1024, 1024, 2048]
    - [39, 167.18]
  - - [1024, 4096, 1, 128, 1024, 1024, 1024, 4096]
    - [14, 55.62]
  - - [1024, 4096, 1, 256, 1024, 1024, 1024, 4096]
    - [25, 93.41]
  - - [1024, 4096, 1, 512, 1024, 1024, 1024, 4096]
    - [26, 141.83]
  - - [1024, 4096, 1, 1024, 1024, 1024, 1024, 4096]
    - [26, 189.06]
  - - [1024, 4096, 1, 2048, 1024, 1024, 1024, 4096]
    - [26, 227.61]
  - - [1024, 4096, 1, 4096, 1024, 1024, 1024, 4096]
    - [72, 234.62]
  - - [1024, 4096, 1, 8192, 1024, 1024, 1024, 4096]
    - [71, 219.03]
  - - [1024, 8192, 1, 128, 1024, 1024, 1024, 8192]
    - [20, 81.48]
  - - [1024, 8192, 1, 256, 1024, 1024, 1024, 8192]
    - [19, 131.99]
  - - [1024, 8192, 1, 512, 1024, 1024, 1024, 8192]
    - [23, 188.4]
  - - [1024, 8192, 1, 1024, 1024, 1024, 1024, 8192]
    - [2, 231.9]
  - - [1024, 8192, 1, 2048, 1024, 1024, 1024, 8192]
    - [2, 263.62]
  - - [1024, 8192, 1, 4096, 1024, 1024, 1024, 8192]
    - [65, 253.79]
  - - [1024, 8192, 1, 8192, 1024, 1024, 1024, 8192]
    - [2, 265.81]
  - - [2048, 128, 1, 128, 2048, 2048, 2048, 128]
    - [56, 7.37]
  - - [2048, 128, 1, 256, 2048, 2048, 2048, 128]
    - [57, 12.82]
  - - [2048, 128, 1, 512, 2048, 2048, 2048, 128]
    - [98, 20.99]
  - - [2048, 128, 1, 1024, 2048, 2048, 2048, 128]
    - [100, 30.71]
  - - [2048, 128, 1, 2048, 2048, 2048, 2048, 128]
    - [95, 37.52]
  - - [2048, 128, 1, 4096, 2048, 2048, 2048, 128]
    - [94, 44.94]
  - - [2048, 128, 1, 8192, 2048, 2048, 2048, 128]
    - [94, 50.45]
  - - [2048, 256, 1, 128, 2048, 2048, 2048, 256]
    - [50, 13.7]
  - - [2048, 256, 1, 256, 2048, 2048, 2048, 256]
    - [50, 23.64]
  - - [2048, 256, 1, 512, 2048, 2048, 2048, 256]
    - [51, 37.56]
  - - [2048, 256, 1, 1024, 2048, 2048, 2048, 256]
    - [84, 53.17]
  - - [2048, 256, 1, 2048, 2048, 2048, 2048, 256]
    - [87, 67.03]
  - - [2048, 256, 1, 4096, 2048, 2048, 2048, 256]
    - [89, 77.7]
  - - [2048, 256, 1, 8192, 2048, 2048, 2048, 256]
    - [88, 85.81]
  - - [2048, 512, 1, 128, 2048, 2048, 2048, 512]
    - [44, 19.07]
  - - [2048, 512, 1, 256, 2048, 2048, 2048, 512]
    - [34, 38.34]
  - - [2048, 512, 1, 512, 2048, 2048, 2048, 512]
    - [47, 62.66]
  - - [2048, 512, 1, 1024, 2048, 2048, 2048, 512]
    - [79, 87.97]
  - - [2048, 512, 1, 2048, 2048, 2048, 2048, 512]
    - [82, 106.76]
  - - [2048, 512, 1, 4096, 2048, 2048, 2048, 512]
    - [81, 124.08]
  - - [2048, 512, 1, 8192, 2048, 2048, 2048, 512]
    - [80, 131.58]
  - - [2048, 1024, 1, 128, 2048, 2048, 2048, 1024]
    - [42, 35.63]
  - - [2048, 1024, 1, 256, 2048, 2048, 2048, 1024]
    - [32, 62.73]
  - - [2048, 1024, 1, 512, 2048, 2048, 2048, 1024]
    - [39, 98.61]
  - - [2048, 1024, 1, 1024, 2048, 2048, 2048, 1024]
    - [75, 133.65]
  - - [2048, 1024, 1, 2048, 2048, 2048, 2048, 1024]
    - [41, 159.84]
  - - [2048, 1024, 1, 4096, 2048, 2048, 2048, 1024]
    - [41, 179.67]
  - - [2048, 1024, 1, 8192, 2048, 2048, 2048, 1024]
    - [43, 166.64]
  - - [2048, 2048, 1, 128, 2048, 2048, 2048, 2048]
    - [25, 55.69]
  - - [2048, 2048, 1, 256, 2048, 2048, 2048, 2048]
    - [30, 93.71]
  - - [2048, 2048, 1, 512, 2048, 2048, 2048, 2048]
    - [26, 140.9]
  - - [2048, 2048, 1, 1024, 2048, 2048, 2048, 2048]
    - [26, 187.94]
  - - [2048, 2048, 1, 2048, 2048, 2048, 2048, 2048]
    - [31, 226.52]
  - - [2048, 2048, 1, 4096, 2048, 2048, 2048, 2048]
    - [72, 232.35]
  - - [2048, 2048, 1, 8192, 2048, 2048, 2048, 2048]
    - [73, 217.08]
  - - [2048, 4096, 1, 128, 2048, 2048, 2048, 4096]
    - [1, 70.4]
  - - [2048, 4096, 1, 256, 2048, 2048, 2048, 4096]
    - [0, 117.39]
  - - [2048, 4096, 1, 512, 2048, 2048, 2048, 4096]
    - [2, 176.36]
  - - [2048, 4096, 1, 1024, 2048, 2048, 2048, 4096]
    - [2, 233.83]
  - - [2048, 4096, 1, 2048, 2048, 2048, 2048, 4096]
    - [69, 267.11]
  - - [2048, 4096, 1, 4096, 2048, 2048, 2048, 4096]
    - [13, 251.37]
  - - [2048, 4096, 1, 8192, 2048, 2048, 2048, 4096]
    - [6, 263.65]
  - - [2048, 8192, 1, 128, 2048, 2048, 2048, 8192]
    - [22, 90.14]
  - - [2048, 8192, 1, 256, 2048, 2048, 2048, 8192]
    - [24, 138.65]
  - - [2048, 8192, 1, 512, 2048, 2048, 2048, 8192]
    - [11, 186.68]
  - - [2048, 8192, 1, 1024, 2048, 2048, 2048, 8192]
    - [2, 225.09]
  - - [2048, 8192, 1, 2048, 2048, 2048, 2048, 8192]
    - [14, 235.95]
  - - [2048, 8192, 1, 4096, 2048, 2048, 2048, 8192]
    - [7, 280.22]
  - - [2048, 8192, 1, 8192, 2048, 2048, 2048, 8192]
    - [9, 331.79]
  - - [4096, 128, 1, 128, 4096, 4096, 4096, 128]
    - [50, 13.63]
  - - [4096, 128, 1, 256, 4096, 4096, 4096, 128]
    - [52, 23.19]
  - - [4096, 128, 1, 512, 4096, 4096, 4096, 128]
    - [84, 37.07]
  - - [4096, 128, 1, 1024, 4096, 4096, 4096, 128]
    - [84, 53.14]
  - - [4096, 128, 1, 2048, 4096, 4096, 4096, 128]
    - [88, 65.86]
  - - [4096, 128, 1, 4096, 4096, 4096, 4096, 128]
    - [91, 77.95]
  - - [4096, 128, 1, 8192, 4096, 4096, 4096, 128]
    - [90, 84.95]
  - - [4096, 256, 1, 128, 4096, 4096, 4096, 256]
    - [47, 23.5]
  - - [4096, 256, 1, 256, 4096, 4096, 4096, 256]
    - [44, 40.66]
  - - [4096, 256, 1, 512, 4096, 4096, 4096, 256]
    - [44, 62.6]
  - - [4096, 256, 1, 1024, 4096, 4096, 4096, 256]
    - [45, 87.45]
  - - [4096, 256, 1, 2048, 4096, 4096, 4096, 256]
    - [82, 107.44]
  - - [4096, 256, 1, 4096, 4096, 4096, 4096, 256]
    - [82, 125.37]
  - - [4096, 256, 1, 8192, 4096, 4096, 4096, 256]
    - [80, 130.5]
  - - [4096, 512, 1, 128, 4096, 4096, 4096, 512]
    - [36, 38.61]
  - - [4096, 512, 1, 256, 4096, 4096, 4096, 512]
    - [39, 64.78]
  - - [4096, 512, 1, 512, 4096, 4096, 4096, 512]
    - [39, 98.44]
  - - [4096, 512, 1, 1024, 4096, 4096, 4096, 512]
    - [43, 130.66]
  - - [4096, 512, 1, 2048, 4096, 4096, 4096, 512]
    - [40, 159.29]
  - - [4096, 512, 1, 4096, 4096, 4096, 4096, 512]
    - [40, 178.03]
  - - [4096, 512, 1, 8192, 4096, 4096, 4096, 512]
    - [40, 170.16]
  - - [4096, 1024, 1, 128, 4096, 4096, 4096, 1024]
    - [25, 55.43]
  - - [4096, 1024, 1, 256, 4096, 4096, 4096, 1024]
    - [26, 93.69]
  - - [4096, 1024, 1, 512, 4096, 4096, 4096, 1024]
    - [26, 140.34]
  - - [4096, 1024, 1, 1024, 4096, 4096, 4096, 1024]
    - [28, 187.57]
  - - [4096, 1024, 1, 2048, 4096, 4096, 4096, 1024]
    - [31, 225.35]
  - - [4096, 1024, 1, 4096, 4096, 4096, 4096, 1024]
    - [74, 235.61]
  - - [4096, 1024, 1, 8192, 4096, 4096, 4096, 1024]
    - [74, 218.8]
  - - [4096, 2048, 1, 128, 4096, 4096, 4096, 2048]
    - [1, 69.72]
  - - [4096, 2048, 1, 256, 4096, 4096, 4096, 2048]
    - [0, 116.5]
  - - [4096, 2048, 1, 512, 4096, 4096, 4096, 2048]
    - [2, 174.82]
  - - [4096, 2048, 1, 1024, 4096, 4096, 4096, 2048]
    - [10, 231.83]
  - - [4096, 2048, 1, 2048, 4096, 4096, 4096, 2048]
    - [68, 261.95]
  - - [4096, 2048, 1, 4096, 4096, 4096, 4096, 2048]
    - [6, 250.7]
  - - [4096, 2048, 1, 8192, 4096, 4096, 4096, 2048]
    - [16, 271.13]
  - - [4096, 4096, 1, 128, 4096, 4096, 4096, 4096]
    - [9, 76.7]
  - - [4096, 4096, 1, 256, 4096, 4096, 4096, 4096]
    - [11, 125.93]
  - - [4096, 4096, 1, 512, 4096, 4096, 4096, 4096]
    - [8, 183.96]
  - - [4096, 4096, 1, 1024, 4096, 4096, 4096, 4096]
    - [8, 225.82]
  - - [4096, 4096, 1, 2048, 4096, 4096, 4096, 4096]
    - [15, 233.26]
  - - [4096, 4096, 1, 4096, 4096, 4096, 4096, 4096]
    - [10, 285.43]
  - - [4096, 4096, 1, 8192, 4096, 4096, 4096, 4096]
    - [10, 332.25]
  - - [4096, 8192, 1, 128, 4096, 4096, 4096, 8192]
    - [21, 96.84]
  - - [4096, 8192, 1, 256, 4096, 4096, 4096, 8192]
    - [21, 141.55]
  - - [4096, 8192, 1, 512, 4096, 4096, 4096, 8192]
    - [16, 191.54]
  - - [4096, 8192, 1, 1024, 4096, 4096, 4096, 8192]
    - [16, 224.67]
  - - [4096, 8192, 1, 2048, 4096, 4096, 4096, 8192]
    - [8, 263.87]
  - - [4096, 8192, 1, 4096, 4096, 4096, 4096, 8192]
    - [66, 330.96]
  - - [4096, 8192, 1, 8192, 4096, 4096, 4096, 8192]
    - [5, 363.45]
  - - [8192, 128, 1, 128, 8192, 8192, 8192, 128]
    - [47, 24.51]
  - - [8192, 128, 1, 256, 8192, 8192, 8192, 128]
    - [47, 41.49]
  - - [8192, 128, 1, 512, 8192, 8192, 8192, 128]
    - [48, 63.59]
  - - [8192, 128, 1, 1024, 8192, 8192, 8192, 128]
    - [82, 87.67]
  - - [8192, 128, 1, 2048, 8192, 8192, 8192, 128]
    - [80, 107.78]
  - - [8192, 128, 1, 4096, 8192, 8192, 8192, 128]
    - [82, 125.27]
  - - [8192, 128, 1, 8192, 8192, 8192, 8192, 128]
    - [81, 128.16]
  - - [8192, 256, 1, 128, 8192, 8192, 8192, 256]
    - [37, 38.24]
  - - [8192, 256, 1, 256, 8192, 8192, 8192, 256]
    - [35, 64.36]
  - - [8192, 256, 1, 512, 8192, 8192, 8192, 256]
    - [39, 98.27]
  - - [8192, 256, 1, 1024, 8192, 8192, 8192, 256]
    - [77, 132.65]
  - - [8192, 256, 1, 2048, 8192, 8192, 8192, 256]
    - [41, 160.13]
  - - [8192, 256, 1, 4096, 8192, 8192, 8192, 256]
    - [43, 178.38]
  - - [8192, 256, 1, 8192, 8192, 8192, 8192, 256]
    - [41, 168.2]
  - - [8192, 512, 1, 128, 8192, 8192, 8192, 512]
    - [26, 55.15]
  - - [8192, 512, 1, 256, 8192, 8192, 8192, 512]
    - [26, 92.5]
  - - [8192, 512, 1, 512, 8192, 8192, 8192, 512]
    - [28, 139.93]
  - - [8192, 512, 1, 1024, 8192, 8192, 8192, 512]
    - [29, 187.67]
  - - [8192, 512, 1, 2048, 8192, 8192, 8192, 512]
    - [31, 224.65]
  - - [8192, 512, 1, 4096, 8192, 8192, 8192, 512]
    - [27, 231.99]
  - - [8192, 512, 1, 8192, 8192, 8192, 8192, 512]
    - [73, 217.92]
  - - [8192, 1024, 1, 128, 8192, 8192, 8192, 1024]
    - [3, 69.53]
  - - [8192, 1024, 1, 256, 8192, 8192, 8192, 1024]
    - [3, 115.73]
  - - [8192, 1024, 1, 512, 8192, 8192, 8192, 1024]
    - [13, 173.98]
  - - [8192, 1024, 1, 1024, 8192, 8192, 8192, 1024]
    - [10, 229.31]
  - - [8192, 1024, 1, 2048, 8192, 8192, 8192, 1024]
    - [6, 263.29]
  - - [8192, 1024, 1, 4096, 8192, 8192, 8192, 1024]
    - [6, 252.18]
  - - [8192, 1024, 1, 8192, 8192, 8192, 8192, 1024]
    - [14, 273.79]
  - - [8192, 2048, 1, 128, 8192, 8192, 8192, 2048]
    - [9, 75.41]
  - - [8192, 2048, 1, 256, 8192, 8192, 8192, 2048]
    - [8, 123.99]
  - - [8192, 2048, 1, 512, 8192, 8192, 8192, 2048]
    - [13, 181.66]
  - - [8192, 2048, 1, 1024, 8192, 8192, 8192, 2048]
    - [11, 224.51]
  - - [8192, 2048, 1, 2048, 8192, 8192, 8192, 2048]
    - [18, 233.57]
  - - [8192, 2048, 1, 4096, 8192, 8192, 8192, 2048]
    - [0, 284.67]
  - - [8192, 2048, 1, 8192, 8192, 8192, 8192, 2048]
    - [2, 337.25]
  - - [8192, 4096, 1, 128, 8192, 8192, 8192, 4096]
    - [11, 81.59]
  - - [8192, 4096, 1, 256, 8192, 8192, 8192, 4096]
    - [11, 130.26]
  - - [8192, 4096, 1, 512, 8192, 8192, 8192, 4096]
    - [17, 188.17]
  - - [8192, 4096, 1, 1024, 8192, 8192, 8192, 4096]
    - [17, 220.72]
  - - [8192, 4096, 1, 2048, 8192, 8192, 8192, 4096]
    - [0, 280.27]
  - - [8192, 4096, 1, 4096, 8192, 8192, 8192, 4096]
    - [68, 333.14]
  - - [8192, 4096, 1, 8192, 8192, 8192, 8192, 4096]
    - [67, 357.44]
  - - [8192, 8192, 1, 128, 8192, 8192, 8192, 8192]
    - [19, 95.2]
  - - [8192, 8192, 1, 256, 8192, 8192, 8192, 8192]
    - [14, 142.01]
  - - [8192, 8192, 1, 512, 8192, 8192, 8192, 8192]
    - [11, 209.45]
  - - [8192, 8192, 1, 1024, 8192, 8192, 8192, 8192]
    - [12, 269.0]
  - - [8192, 8192, 1, 2048, 8192, 8192, 8192, 8192]
    - [69, 327.77]
  - - [8192, 8192, 1, 4096, 8192, 8192, 8192, 8192]
    - [69, 361.7]
  - - [8192, 8192, 1, 8192, 8192, 8192, 8192, 8192]
    - [4, 367.82]
- null
- null
- ExperimentalStreamK
- GridBased
