projects/hipblaslt/library/src/amd_detail/rocblaslt/src/Tensile/Logic/asm_full/aquavanjaram/gfx942_228cu/StreamK/aquavanjaram942_Cijk_Ailk_Bjlk_B8NF8NS_BH_Bias_HAS_SAV_UserArgs.yaml
- {MinimumRequiredVersion: 4.33.0}
- aquavanjaram942
- {Architecture: gfx942, CUCount: 228}
- [Device 0049, Device 0050]
    SolutionIndex: 0
    SolutionNameMin: Cijk_Ailk_Bjlk_B8NF8NS_BH_Bias_HAS_SAV_UserArgs_MT256x256x64_MI16x16x1_SN_LDSB0_CLR1_GRVWA16_GRVWB4_GSU0_GSUC0_GSUWGMRR0_K1_LBSPPA2048_LBSPPB2048_LPA0_LPB0_MIWT8_8_PLR1_SU0_SUM0_SUS64_VWA8_VWB8_WGM1_WGMXCC1_WGMXCCGn1
    SolutionIndex: 1
    SolutionNameMin: Cijk_Ailk_Bjlk_B8NF8NS_BH_Bias_HAS_SAV_UserArgs_MT256x256x64_MI16x16x1_SN_LDSB0_CLR1_GRVWA4_GRVWB8_GSU0_GSUC0_GSUWGMRR0_K1_LBSPPA2048_LBSPPB2048_LPA0_LPB0_MIWT8_8_PLR1_SU0_SUM0_SUS64_VWA8_VWB8_WGM1_WGMXCC1_WGMXCCGn1
    SolutionIndex: 2
    SolutionNameMin: Cijk_Ailk_Bjlk_B8NF8NS_BH_Bias_HAS_SAV_UserArgs_MT256x256x64_MI16x16x1_SN_LDSB0_CLR1_GRVWA4_GRVWB16_GSU0_GSUC0_GSUWGMRR0_K1_LBSPPA2048_LBSPPB2048_LPA0_LPB0_MIWT8_8_PLR1_SU0_SUM0_SUS64_VWA8_VWB8_WGM1_WGMXCC1_WGMXCCGn1
    SolutionIndex: 3
    SolutionNameMin: Cijk_Ailk_Bjlk_B8NF8NS_BH_Bias_HAS_SAV_UserArgs_MT256x256x64_MI16x16x1_SN_LDSB0_CLR1_GRVWA16_GRVWB16_GSU0_GSUC0_GSUWGMRR0_K1_LBSPPA2048_LBSPPB2048_LPA0_LPB0_MIWT8_8_PLR1_SU0_SUM0_SUS64_VWA8_VWB8_WGM1_WGMXCC1_WGMXCCGn1
    SolutionIndex: 4
    SolutionNameMin: Cijk_Ailk_Bjlk_B8NF8NS_BH_Bias_HAS_SAV_UserArgs_MT256x256x64_MI16x16x1_SN_LDSB0_CLR1_GRVWA16_GRVWB4_GSU0_GSUC0_GSUWGMRR0_K1_LBSPPA2048_LBSPPB2048_LPA0_LPB0_MIWT8_8_PLR1_SU0_SUM0_SUS64_VWA8_VWB8_WGM4_WGMXCC1_WGMXCCGn1
    SolutionIndex: 5
    SolutionNameMin: Cijk_Ailk_Bjlk_B8NF8NS_BH_Bias_HAS_SAV_UserArgs_MT256x256x64_MI16x16x1_SN_LDSB0_CLR1_GRVWA4_GRVWB16_GSU0_GSUC0_GSUWGMRR0_K1_LBSPPA2048_LBSPPB2048_LPA0_LPB0_MIWT8_8_PLR1_SU0_SUM0_SUS64_VWA8_VWB8_WGM4_WGMXCC1_WGMXCCGn1
    SolutionIndex: 6
    SolutionNameMin: Cijk_Ailk_Bjlk_B8NF8NS_BH_Bias_HAS_SAV_UserArgs_MT256x256x64_MI16x16x1_SN_LDSB0_CLR1_GRVWA16_GRVWB16_GSU0_GSUC0_GSUWGMRR0_K1_LBSPPA2048_LBSPPB2048_LPA0_LPB0_MIWT8_8_PLR1_SU0_SUM0_SUS64_VWA8_VWB8_WGM4_WGMXCC1_WGMXCCGn1
    SolutionIndex: 7
    SolutionNameMin: Cijk_Ailk_Bjlk_B8NF8NS_BH_Bias_HAS_SAV_UserArgs_MT256x256x64_MI16x16x1_SN_LDSB0_CLR1_GRVWA4_GRVWB4_GSU0_GSUC0_GSUWGMRR0_K1_LBSPPA2048_LBSPPB2048_LPA0_LPB0_MIWT8_8_PLR1_SU0_SUM0_SUS64_VWA8_VWB8_WGM6_WGMXCC1_WGMXCCGn1
    SolutionIndex: 8
    SolutionNameMin: Cijk_Ailk_Bjlk_B8NF8NS_BH_Bias_HAS_SAV_UserArgs_MT256x256x64_MI16x16x1_SN_LDSB0_CLR1_GRVWA16_GRVWB4_GSU0_GSUC0_GSUWGMRR0_K1_LBSPPA2048_LBSPPB2048_LPA0_LPB0_MIWT8_8_PLR1_SU0_SUM0_SUS64_VWA8_VWB8_WGM6_WGMXCC1_WGMXCCGn1
    SolutionIndex: 9
    SolutionNameMin: Cijk_Ailk_Bjlk_B8NF8NS_BH_Bias_HAS_SAV_UserArgs_MT256x256x64_MI16x16x1_SN_LDSB0_CLR1_GRVWA4_GRVWB8_GSU0_GSUC0_GSUWGMRR0_K1_LBSPPA2048_LBSPPB2048_LPA0_LPB0_MIWT8_8_PLR1_SU0_SUM0_SUS64_VWA8_VWB8_WGM6_WGMXCC1_WGMXCCGn1
    SolutionIndex: 10
    SolutionNameMin: Cijk_Ailk_Bjlk_B8NF8NS_BH_Bias_HAS_SAV_UserArgs_MT256x256x64_MI16x16x1_SN_LDSB0_CLR1_GRVWA4_GRVWB16_GSU0_GSUC0_GSUWGMRR0_K1_LBSPPA2048_LBSPPB2048_LPA0_LPB0_MIWT8_8_PLR1_SU0_SUM0_SUS64_VWA8_VWB8_WGM6_WGMXCC1_WGMXCCGn1
    SolutionIndex: 11
    SolutionNameMin: Cijk_Ailk_Bjlk_B8NF8NS_BH_Bias_HAS_SAV_UserArgs_MT256x256x64_MI16x16x1_SN_LDSB0_CLR1_GRVWA16_GRVWB16_GSU0_GSUC0_GSUWGMRR0_K1_LBSPPA2048_LBSPPB2048_LPA0_LPB0_MIWT8_8_PLR1_SU0_SUM0_SUS64_VWA8_VWB8_WGM6_WGMXCC1_WGMXCCGn1
    SolutionIndex: 12
    SolutionNameMin: Cijk_Ailk_Bjlk_B8NF8NS_BH_Bias_HAS_SAV_UserArgs_MT256x256x64_MI16x16x1_SN_LDSB0_CLR1_GRVWA16_GRVWB4_GSU0_GSUC0_GSUWGMRR0_K1_LBSPPA2048_LBSPPB2048_LPA0_LPB0_MIWT8_8_PLR1_SU0_SUM0_SUS64_VWA8_VWB8_WGM8_WGMXCC1_WGMXCCGn1
    SolutionIndex: 13
    SolutionNameMin: Cijk_Ailk_Bjlk_B8NF8NS_BH_Bias_HAS_SAV_UserArgs_MT256x256x64_MI16x16x1_SN_LDSB0_CLR1_GRVWA4_GRVWB8_GSU0_GSUC0_GSUWGMRR0_K1_LBSPPA2048_LBSPPB2048_LPA0_LPB0_MIWT8_8_PLR1_SU0_SUM0_SUS64_VWA8_VWB8_WGM8_WGMXCC1_WGMXCCGn1
    SolutionIndex: 14
    SolutionNameMin: Cijk_Ailk_Bjlk_B8NF8NS_BH_Bias_HAS_SAV_UserArgs_MT256x256x64_MI16x16x1_SN_LDSB0_CLR1_GRVWA16_GRVWB16_GSU0_GSUC0_GSUWGMRR0_K1_LBSPPA2048_LBSPPB2048_LPA0_LPB0_MIWT8_8_PLR1_SU0_SUM0_SUS64_VWA8_VWB8_WGM8_WGMXCC1_WGMXCCGn1
    SolutionIndex: 15
    SolutionNameMin: Cijk_Ailk_Bjlk_B8NF8NS_BH_Bias_HAS_SAV_UserArgs_MT128x256x64_MI16x16x1_SN_LDSB1_CLR1_GRVWA4_GRVWB8_GSU0_GSUC0_GSUWGMRR0_K1_LBSPPA1024_LBSPPB2048_LPA64_LPB0_MIWT4_8_PLR1_SU0_SUM0_SUS64_VWA4_VWB8_WGM1_WGMXCC1_WGMXCCGn1
    SolutionIndex: 16
    SolutionNameMin: Cijk_Ailk_Bjlk_B8NF8NS_BH_Bias_HAS_SAV_UserArgs_MT128x256x64_MI16x16x1_SN_LDSB1_CLR1_GRVWA4_GRVWB16_GSU0_GSUC0_GSUWGMRR0_K1_LBSPPA1024_LBSPPB2048_LPA64_LPB0_MIWT4_8_PLR1_SU0_SUM0_SUS64_VWA4_VWB8_WGM1_WGMXCC1_WGMXCCGn1
    SolutionIndex: 17
    SolutionNameMin: Cijk_Ailk_Bjlk_B8NF8NS_BH_Bias_HAS_SAV_UserArgs_MT128x256x64_MI16x16x1_SN_LDSB1_CLR1_GRVWA16_GRVWB16_GSU0_GSUC0_GSUWGMRR0_K1_LBSPPA1024_LBSPPB2048_LPA64_LPB0_MIWT4_8_PLR1_SU0_SUM0_SUS64_VWA4_VWB8_WGM1_WGMXCC1_WGMXCCGn1
    SolutionIndex: 18
    SolutionNameMin: Cijk_Ailk_Bjlk_B8NF8NS_BH_Bias_HAS_SAV_UserArgs_MT128x256x64_MI16x16x1_SN_LDSB1_CLR1_GRVWA4_GRVWB16_GSU0_GSUC0_GSUWGMRR0_K1_LBSPPA1024_LBSPPB2048_LPA64_LPB0_MIWT4_8_PLR1_SU0_SUM0_SUS64_VWA4_VWB8_WGM6_WGMXCC1_WGMXCCGn1
    SolutionIndex: 19
    SolutionNameMin: Cijk_Ailk_Bjlk_B8NF8NS_BH_Bias_HAS_SAV_UserArgs_MT128x256x64_MI16x16x1_SN_LDSB1_CLR1_GRVWA16_GRVWB16_GSU0_GSUC0_GSUWGMRR0_K1_LBSPPA1024_LBSPPB2048_LPA64_LPB0_MIWT4_8_PLR1_SU0_SUM0_SUS64_VWA4_VWB8_WGM8_WGMXCC1_WGMXCCGn1
    SolutionIndex: 20
    SolutionNameMin: Cijk_Ailk_Bjlk_B8NF8NS_BH_Bias_HAS_SAV_UserArgs_MT256x144x64_MI16x16x1_SN_LDSB0_CLR1_GRVWA4_GRVWB4_GSU0_GSUC0_GSUWGMRR0_K1_LBSPPA2048_LBSPPB1152_LPA64_LPB16_MIWT4_9_PLR1_SU0_SUM0_SUS64_VWA4_VWB1_WGM1_WGMXCC1_WGMXCCGn1
    SolutionIndex: 21
    SolutionNameMin: Cijk_Ailk_Bjlk_B8NF8NS_BH_Bias_HAS_SAV_UserArgs_MT256x144x64_MI16x16x1_SN_LDSB0_CLR1_GRVWA16_GRVWB4_GSU0_GSUC0_GSUWGMRR0_K1_LBSPPA2048_LBSPPB1152_LPA64_LPB16_MIWT4_9_PLR1_SU0_SUM0_SUS64_VWA4_VWB1_WGM1_WGMXCC1_WGMXCCGn1
    SolutionIndex: 22
    SolutionNameMin: Cijk_Ailk_Bjlk_B8NF8NS_BH_Bias_HAS_SAV_UserArgs_MT256x144x64_MI16x16x1_SN_LDSB0_CLR1_GRVWA4_GRVWB4_GSU0_GSUC0_GSUWGMRR0_K1_LBSPPA2048_LBSPPB1152_LPA64_LPB16_MIWT4_9_PLR1_SU0_SUM0_SUS64_VWA4_VWB1_WGM4_WGMXCC1_WGMXCCGn1
    SolutionIndex: 23
    SolutionNameMin: Cijk_Ailk_Bjlk_B8NF8NS_BH_Bias_HAS_SAV_UserArgs_MT256x144x64_MI16x16x1_SN_LDSB0_CLR1_GRVWA16_GRVWB4_GSU0_GSUC0_GSUWGMRR0_K1_LBSPPA2048_LBSPPB1152_LPA64_LPB16_MIWT4_9_PLR1_SU0_SUM0_SUS64_VWA4_VWB1_WGM4_WGMXCC1_WGMXCCGn1
    SolutionIndex: 24
    SolutionNameMin: Cijk_Ailk_Bjlk_B8NF8NS_BH_Bias_HAS_SAV_UserArgs_MT256x144x64_MI16x16x1_SN_LDSB0_CLR1_GRVWA4_GRVWB4_GSU0_GSUC0_GSUWGMRR0_K1_LBSPPA2048_LBSPPB1152_LPA64_LPB16_MIWT4_9_PLR1_SU0_SUM0_SUS64_VWA4_VWB1_WGM8_WGMXCC1_WGMXCCGn1
    SolutionIndex: 25
    SolutionNameMin: Cijk_Ailk_Bjlk_B8NF8NS_BH_Bias_HAS_SAV_UserArgs_MT256x128x64_MI16x16x1_SN_LDSB1_CLR1_GRVWA4_GRVWB8_GSU0_GSUC0_GSUWGMRR0_K1_LBSPPA2048_LBSPPB1024_LPA0_LPB64_MIWT8_4_PLR1_SU0_SUM0_SUS64_VWA8_VWB4_WGM1_WGMXCC1_WGMXCCGn1
    SolutionIndex: 26
    SolutionNameMin: Cijk_Ailk_Bjlk_B8NF8NS_BH_Bias_HAS_SAV_UserArgs_MT256x128x64_MI16x16x1_SN_LDSB1_CLR1_GRVWA16_GRVWB8_GSU0_GSUC0_GSUWGMRR0_K1_LBSPPA2048_LBSPPB1024_LPA0_LPB64_MIWT8_4_PLR1_SU0_SUM0_SUS64_VWA8_VWB4_WGM1_WGMXCC1_WGMXCCGn1
    SolutionIndex: 27
    SolutionNameMin: Cijk_Ailk_Bjlk_B8NF8NS_BH_Bias_HAS_SAV_UserArgs_MT256x128x64_MI16x16x1_SN_LDSB1_CLR1_GRVWA16_GRVWB16_GSU0_GSUC0_GSUWGMRR0_K1_LBSPPA2048_LBSPPB1024_LPA0_LPB64_MIWT8_4_PLR1_SU0_SUM0_SUS64_VWA8_VWB4_WGM1_WGMXCC1_WGMXCCGn1
    SolutionIndex: 28
    SolutionNameMin: Cijk_Ailk_Bjlk_B8NF8NS_BH_Bias_HAS_SAV_UserArgs_MT256x128x64_MI16x16x1_SN_LDSB1_CLR1_GRVWA16_GRVWB16_GSU0_GSUC0_GSUWGMRR0_K1_LBSPPA2048_LBSPPB1024_LPA0_LPB64_MIWT8_4_PLR1_SU0_SUM0_SUS64_VWA8_VWB4_WGM4_WGMXCC1_WGMXCCGn1
    SolutionIndex: 29
    SolutionNameMin: Cijk_Ailk_Bjlk_B8NF8NS_BH_Bias_HAS_SAV_UserArgs_MT256x128x64_MI16x16x1_SN_LDSB1_CLR1_GRVWA16_GRVWB8_GSU0_GSUC0_GSUWGMRR0_K1_LBSPPA2048_LBSPPB1024_LPA0_LPB64_MIWT8_4_PLR1_SU0_SUM0_SUS64_VWA8_VWB4_WGM6_WGMXCC1_WGMXCCGn1
    SolutionIndex: 30
    SolutionNameMin: Cijk_Ailk_Bjlk_B8NF8NS_BH_Bias_HAS_SAV_UserArgs_MT256x128x64_MI16x16x1_SN_LDSB1_CLR1_GRVWA16_GRVWB16_GSU0_GSUC0_GSUWGMRR0_K1_LBSPPA2048_LBSPPB1024_LPA0_LPB64_MIWT8_4_PLR1_SU0_SUM0_SUS64_VWA8_VWB4_WGM6_WGMXCC1_WGMXCCGn1
    SolutionIndex: 31
    SolutionNameMin: Cijk_Ailk_Bjlk_B8NF8NS_BH_Bias_HAS_SAV_UserArgs_MT256x128x64_MI16x16x1_SN_LDSB1_CLR1_GRVWA8_GRVWB16_GSU0_GSUC0_GSUWGMRR0_K1_LBSPPA2048_LBSPPB1024_LPA0_LPB64_MIWT8_4_PLR1_SU0_SUM0_SUS64_VWA8_VWB4_WGM8_WGMXCC1_WGMXCCGn1
    SolutionIndex: 32
    SolutionNameMin: Cijk_Ailk_Bjlk_B8NF8NS_BH_Bias_HAS_SAV_UserArgs_MT256x128x64_MI16x16x1_SN_LDSB1_CLR1_GRVWA16_GRVWB16_GSU0_GSUC0_GSUWGMRR0_K1_LBSPPA2048_LBSPPB1024_LPA0_LPB64_MIWT8_4_PLR1_SU0_SUM0_SUS64_VWA8_VWB4_WGM8_WGMXCC1_WGMXCCGn1
    SolutionIndex: 33
    SolutionNameMin: Cijk_Ailk_Bjlk_B8NF8NS_BH_Bias_HAS_SAV_UserArgs_MT128x128x64_MI16x16x1_SN_LDSB1_CLR1_GRVWA8_GRVWB16_GSU0_GSUC0_GSUWGMRR0_K1_LBSPPA1024_LBSPPB1024_LPA0_LPB32_MIWT8_2_PLR1_SU0_SUM0_SUS64_VWA8_VWB2_WGM1_WGMXCC1_WGMXCCGn1
    SolutionIndex: 34
    SolutionNameMin: Cijk_Ailk_Bjlk_B8NF8NS_BH_Bias_HAS_SAV_UserArgs_MT128x128x64_MI16x16x1_SN_LDSB1_CLR1_GRVWA4_GRVWB16_GSU0_GSUC0_GSUWGMRR0_K1_LBSPPA1024_LBSPPB1024_LPA64_LPB64_MIWT4_4_PLR1_SU0_SUM0_SUS64_VWA4_VWB4_WGM1_WGMXCC1_WGMXCCGn1
    SolutionIndex: 35
    SolutionNameMin: Cijk_Ailk_Bjlk_B8NF8NS_BH_Bias_HAS_SAV_UserArgs_MT128x128x64_MI16x16x1_SN_LDSB1_CLR1_GRVWA8_GRVWB16_GSU0_GSUC0_GSUWGMRR0_K1_LBSPPA1024_LBSPPB1024_LPA64_LPB64_MIWT4_4_PLR1_SU0_SUM0_SUS64_VWA4_VWB4_WGM1_WGMXCC1_WGMXCCGn1
    SolutionIndex: 36
    SolutionNameMin: Cijk_Ailk_Bjlk_B8NF8NS_BH_Bias_HAS_SAV_UserArgs_MT128x128x64_MI16x16x1_SN_LDSB1_CLR1_GRVWA16_GRVWB16_GSU0_GSUC0_GSUWGMRR0_K1_LBSPPA1024_LBSPPB1024_LPA64_LPB64_MIWT4_4_PLR1_SU0_SUM0_SUS64_VWA4_VWB4_WGM1_WGMXCC1_WGMXCCGn1
    SolutionIndex: 37
    SolutionNameMin: Cijk_Ailk_Bjlk_B8NF8NS_BH_Bias_HAS_SAV_UserArgs_MT128x128x64_MI16x16x1_SN_LDSB1_CLR1_GRVWA8_GRVWB16_GSU0_GSUC0_GSUWGMRR0_K1_LBSPPA1024_LBSPPB1024_LPA64_LPB64_MIWT4_4_PLR1_SU0_SUM0_SUS64_VWA4_VWB4_WGM4_WGMXCC1_WGMXCCGn1
    SolutionIndex: 38
    SolutionNameMin: Cijk_Ailk_Bjlk_B8NF8NS_BH_Bias_HAS_SAV_UserArgs_MT128x128x64_MI16x16x1_SN_LDSB1_CLR1_GRVWA16_GRVWB16_GSU0_GSUC0_GSUWGMRR0_K1_LBSPPA1024_LBSPPB1024_LPA64_LPB64_MIWT4_4_PLR1_SU0_SUM0_SUS64_VWA4_VWB4_WGM4_WGMXCC1_WGMXCCGn1
    SolutionIndex: 39
    SolutionNameMin: Cijk_Ailk_Bjlk_B8NF8NS_BH_Bias_HAS_SAV_UserArgs_MT128x128x64_MI16x16x1_SN_LDSB1_CLR1_GRVWA8_GRVWB16_GSU0_GSUC0_GSUWGMRR0_K1_LBSPPA1024_LBSPPB1024_LPA64_LPB64_MIWT4_4_PLR1_SU0_SUM0_SUS64_VWA4_VWB4_WGM6_WGMXCC1_WGMXCCGn1
    SolutionIndex: 40
    SolutionNameMin: Cijk_Ailk_Bjlk_B8NF8NS_BH_Bias_HAS_SAV_UserArgs_MT128x128x64_MI16x16x1_SN_LDSB1_CLR1_GRVWA16_GRVWB16_GSU0_GSUC0_GSUWGMRR0_K1_LBSPPA1024_LBSPPB1024_LPA64_LPB64_MIWT4_4_PLR1_SU0_SUM0_SUS64_VWA4_VWB4_WGM6_WGMXCC1_WGMXCCGn1
    SolutionIndex: 41
    SolutionNameMin: Cijk_Ailk_Bjlk_B8NF8NS_BH_Bias_HAS_SAV_UserArgs_MT128x128x64_MI16x16x1_SN_LDSB1_CLR1_GRVWA8_GRVWB16_GSU0_GSUC0_GSUWGMRR0_K1_LBSPPA1024_LBSPPB1024_LPA64_LPB64_MIWT4_4_PLR1_SU0_SUM0_SUS64_VWA4_VWB4_WGM8_WGMXCC1_WGMXCCGn1
    SolutionIndex: 42
    SolutionNameMin: Cijk_Ailk_Bjlk_B8NF8NS_BH_Bias_HAS_SAV_UserArgs_MT128x128x64_MI16x16x1_SN_LDSB1_CLR1_GRVWA16_GRVWB16_GSU0_GSUC0_GSUWGMRR0_K1_LBSPPA1024_LBSPPB1024_LPA64_LPB64_MIWT4_4_PLR1_SU0_SUM0_SUS64_VWA4_VWB4_WGM8_WGMXCC1_WGMXCCGn1
    SolutionIndex: 43
    SolutionNameMin: Cijk_Ailk_Bjlk_B8NF8NS_BH_Bias_HAS_SAV_UserArgs_MT64x128x64_MI16x16x1_SN_LDSB0_CLR1_GRVWA4_GRVWB8_GSU0_GSUC0_GSUWGMRR0_K1_LBSPPA512_LBSPPB1024_LPA32_LPB64_MIWT2_4_PLR1_SU0_SUM0_SUS64_VWA2_VWB4_WGM1_WGMXCC1_WGMXCCGn1
    SolutionIndex: 44
    SolutionNameMin: Cijk_Ailk_Bjlk_B8NF8NS_BH_Bias_HAS_SAV_UserArgs_MT64x128x64_MI16x16x1_SN_LDSB0_CLR1_GRVWA16_GRVWB16_GSU0_GSUC0_GSUWGMRR0_K1_LBSPPA512_LBSPPB1024_LPA32_LPB64_MIWT2_4_PLR1_SU0_SUM0_SUS64_VWA2_VWB4_WGM1_WGMXCC1_WGMXCCGn1
    SolutionIndex: 45
    SolutionNameMin: Cijk_Ailk_Bjlk_B8NF8NS_BH_Bias_HAS_SAV_UserArgs_MT128x64x64_MI16x16x1_SN_LDSB0_CLR1_GRVWA4_GRVWB4_GSU0_GSUC0_GSUWGMRR0_K1_LBSPPA1024_LBSPPB512_LPA64_LPB32_MIWT4_2_PLR1_SU0_SUM0_SUS64_VWA4_VWB2_WGM1_WGMXCC1_WGMXCCGn1
    SolutionIndex: 46
    SolutionNameMin: Cijk_Ailk_Bjlk_B8NF8NS_BH_Bias_HAS_SAV_UserArgs_MT128x64x64_MI16x16x1_SN_LDSB0_CLR1_GRVWA4_GRVWB8_GSU0_GSUC0_GSUWGMRR0_K1_LBSPPA1024_LBSPPB512_LPA64_LPB32_MIWT4_2_PLR1_SU0_SUM0_SUS64_VWA4_VWB2_WGM1_WGMXCC1_WGMXCCGn1
    SolutionIndex: 47
    SolutionNameMin: Cijk_Ailk_Bjlk_B8NF8NS_BH_Bias_HAS_SAV_UserArgs_MT128x64x64_MI16x16x1_SN_LDSB0_CLR1_GRVWA16_GRVWB8_GSU0_GSUC0_GSUWGMRR0_K1_LBSPPA1024_LBSPPB512_LPA64_LPB32_MIWT4_2_PLR1_SU0_SUM0_SUS64_VWA4_VWB2_WGM1_WGMXCC1_WGMXCCGn1
    SolutionIndex: 48
    SolutionNameMin: Cijk_Ailk_Bjlk_B8NF8NS_BH_Bias_HAS_SAV_UserArgs_MT128x64x64_MI16x16x1_SN_LDSB0_CLR1_GRVWA4_GRVWB8_GSU0_GSUC0_GSUWGMRR0_K1_LBSPPA1024_LBSPPB512_LPA64_LPB32_MIWT4_2_PLR1_SU0_SUM0_SUS64_VWA4_VWB2_WGM6_WGMXCC1_WGMXCCGn1
    SolutionIndex: 49
    SolutionNameMin: Cijk_Ailk_Bjlk_B8NF8NS_BH_Bias_HAS_SAV_UserArgs_MT128x64x64_MI16x16x1_SN_LDSB0_CLR1_GRVWA4_GRVWB8_GSU0_GSUC0_GSUWGMRR0_K1_LBSPPA1024_LBSPPB512_LPA64_LPB32_MIWT4_2_PLR1_SU0_SUM0_SUS64_VWA4_VWB2_WGM8_WGMXCC1_WGMXCCGn1
    SolutionIndex: 50
    SolutionNameMin: Cijk_Ailk_Bjlk_B8NF8NS_BH_Bias_HAS_SAV_UserArgs_MT128x32x64_MI16x16x1_SN_LDSB0_CLR1_GRVWA4_GRVWB4_GSU0_GSUC0_GSUWGMRR0_K1_LBSPPA1024_LBSPPB256_LPA64_LPB16_MIWT4_1_PLR1_SU0_SUM0_SUS64_VWA4_VWB1_WGM1_WGMXCC1_WGMXCCGn1
    SolutionIndex: 51
    SolutionNameMin: Cijk_Ailk_Bjlk_B8NF8NS_BH_Bias_HAS_SAV_UserArgs_MT64x64x64_MI16x16x1_SN_LDSB0_CLR1_GRVWA4_GRVWB4_GSU0_GSUC0_GSUWGMRR0_K1_LBSPPA512_LBSPPB512_LPA32_LPB32_MIWT2_2_PLR1_SU0_SUM0_SUS64_VWA2_VWB2_WGM1_WGMXCC1_WGMXCCGn1
    SolutionIndex: 52
    SolutionNameMin: Cijk_Ailk_Bjlk_B8NF8NS_BH_Bias_HAS_SAV_UserArgs_MT64x64x64_MI16x16x1_SN_LDSB0_CLR1_GRVWA8_GRVWB4_GSU0_GSUC0_GSUWGMRR0_K1_LBSPPA512_LBSPPB512_LPA32_LPB32_MIWT2_2_PLR1_SU0_SUM0_SUS64_VWA2_VWB2_WGM1_WGMXCC1_WGMXCCGn1
    SolutionIndex: 53
    SolutionNameMin: Cijk_Ailk_Bjlk_B8NF8NS_BH_Bias_HAS_SAV_UserArgs_MT64x64x64_MI16x16x1_SN_LDSB0_CLR1_GRVWA8_GRVWB8_GSU0_GSUC0_GSUWGMRR0_K1_LBSPPA512_LBSPPB512_LPA32_LPB32_MIWT2_2_PLR1_SU0_SUM0_SUS64_VWA2_VWB2_WGM1_WGMXCC1_WGMXCCGn1
    SolutionIndex: 54
    SolutionNameMin: Cijk_Ailk_Bjlk_B8NF8NS_BH_Bias_HAS_SAV_UserArgs_MT64x32x64_MI16x16x1_SN_LDSB0_CLR1_GRVWA4_GRVWB4_GSU0_GSUC0_GSUWGMRR0_K1_LBSPPA512_LBSPPB256_LPA32_LPB16_MIWT2_1_PLR1_SU0_SUM0_SUS64_VWA2_VWB1_WGM1_WGMXCC1_WGMXCCGn1
    SolutionIndex: 55
    SolutionNameMin: Cijk_Ailk_Bjlk_B8NF8NS_BH_Bias_HAS_SAV_UserArgs_MT64x32x64_MI16x16x1_SN_LDSB0_CLR1_GRVWA8_GRVWB4_GSU0_GSUC0_GSUWGMRR0_K1_LBSPPA512_LBSPPB256_LPA32_LPB16_MIWT2_1_PLR1_SU0_SUM0_SUS64_VWA2_VWB1_WGM1_WGMXCC1_WGMXCCGn1
    SolutionIndex: 56
    SolutionNameMin: Cijk_Ailk_Bjlk_B8NF8NS_BH_Bias_HAS_SAV_UserArgs_MT64x32x64_MI16x16x1_SN_LDSB0_CLR1_GRVWA4_GRVWB8_GSU0_GSUC0_GSUWGMRR0_K1_LBSPPA512_LBSPPB256_LPA32_LPB16_MIWT2_1_PLR1_SU0_SUM0_SUS64_VWA2_VWB1_WGM1_WGMXCC1_WGMXCCGn1
    SolutionIndex: 57
    SolutionNameMin: Cijk_Ailk_Bjlk_B8NF8NS_BH_Bias_HAS_SAV_UserArgs_MT32x32x64_MI16x16x1_SN_LDSB0_CLR1_GRVWA4_GRVWB4_GSU0_GSUC0_GSUWGMRR0_K1_LBSPPA256_LBSPPB256_LPA16_LPB16_MIWT1_1_PLR1_SU0_SUM0_SUS64_VWA1_VWB1_WGM1_WGMXCC1_WGMXCCGn1
    SolutionIndex: 58
    SolutionNameMin: Cijk_Ailk_Bjlk_B8NF8NS_BH_Bias_HAS_SAV_UserArgs_MT32x32x64_MI16x16x1_SN_LDSB0_CLR1_GRVWA8_GRVWB4_GSU0_GSUC0_GSUWGMRR0_K1_LBSPPA256_LBSPPB256_LPA16_LPB16_MIWT1_1_PLR1_SU0_SUM0_SUS64_VWA1_VWB1_WGM1_WGMXCC1_WGMXCCGn1
    SolutionIndex: 59
    SolutionNameMin: Cijk_Ailk_Bjlk_B8NF8NS_BH_Bias_HAS_SAV_UserArgs_MT32x32x64_MI16x16x1_SN_LDSB0_CLR1_GRVWA4_GRVWB8_GSU0_GSUC0_GSUWGMRR0_K1_LBSPPA256_LBSPPB256_LPA16_LPB16_MIWT1_1_PLR1_SU0_SUM0_SUS64_VWA1_VWB1_WGM1_WGMXCC1_WGMXCCGn1
    SolutionIndex: 60
    SolutionNameMin: Cijk_Ailk_Bjlk_B8NF8NS_BH_Bias_HAS_SAV_UserArgs_MT32x32x64_MI16x16x1_SN_LDSB0_CLR1_GRVWA8_GRVWB8_GSU0_GSUC0_GSUWGMRR0_K1_LBSPPA256_LBSPPB256_LPA16_LPB16_MIWT1_1_PLR1_SU0_SUM0_SUS64_VWA1_VWB1_WGM4_WGMXCC1_WGMXCCGn1
    SolutionIndex: 61
    SolutionNameMin: Cijk_Ailk_Bjlk_B8NF8NS_BH_Bias_HAS_SAV_UserArgs_MT256x256x128_MI16x16x1_SN_LDSB1_CLR1_GRVWA16_GRVWB8_GSU0_GSUC0_GSUWGMRR0_K1_LBSPPA2048_LBSPPB2048_LPA0_LPB0_MIWT8_8_PLR1_SU0_SUM0_SUS128_VWA8_VWB8_WGM1_WGMXCC1_WGMXCCGn1
    SolutionIndex: 62
    SolutionNameMin: Cijk_Ailk_Bjlk_B8NF8NS_BH_Bias_HAS_SAV_UserArgs_MT256x256x128_MI16x16x1_SN_LDSB1_CLR1_GRVWA8_GRVWB16_GSU0_GSUC0_GSUWGMRR0_K1_LBSPPA2048_LBSPPB2048_LPA0_LPB0_MIWT8_8_PLR1_SU0_SUM0_SUS128_VWA8_VWB8_WGM1_WGMXCC1_WGMXCCGn1
    SolutionIndex: 63
    SolutionNameMin: Cijk_Ailk_Bjlk_B8NF8NS_BH_Bias_HAS_SAV_UserArgs_MT256x256x128_MI16x16x1_SN_LDSB1_CLR1_GRVWA16_GRVWB16_GSU0_GSUC0_GSUWGMRR0_K1_LBSPPA2048_LBSPPB2048_LPA0_LPB0_MIWT8_8_PLR1_SU0_SUM0_SUS128_VWA8_VWB8_WGM4_WGMXCC1_WGMXCCGn1
    SolutionIndex: 64
    SolutionNameMin: Cijk_Ailk_Bjlk_B8NF8NS_BH_Bias_HAS_SAV_UserArgs_MT256x256x128_MI16x16x1_SN_LDSB1_CLR1_GRVWA16_GRVWB16_GSU0_GSUC0_GSUWGMRR0_K1_LBSPPA2048_LBSPPB2048_LPA0_LPB0_MIWT8_8_PLR1_SU0_SUM0_SUS128_VWA8_VWB8_WGM6_WGMXCC1_WGMXCCGn1
    SolutionIndex: 65
    SolutionNameMin: Cijk_Ailk_Bjlk_B8NF8NS_BH_Bias_HAS_SAV_UserArgs_MT256x256x128_MI16x16x1_SN_LDSB1_CLR1_GRVWA16_GRVWB16_GSU0_GSUC0_GSUWGMRR0_K1_LBSPPA2048_LBSPPB2048_LPA0_LPB0_MIWT8_8_PLR1_SU0_SUM0_SUS128_VWA8_VWB8_WGM8_WGMXCC1_WGMXCCGn1
    SolutionIndex: 66
    SolutionNameMin: Cijk_Ailk_Bjlk_B8NF8NS_BH_Bias_HAS_SAV_UserArgs_MT128x256x128_MI16x16x1_SN_LDSB1_CLR1_GRVWA16_GRVWB16_GSU0_GSUC0_GSUWGMRR0_K1_LBSPPA1024_LBSPPB2048_LPA64_LPB0_MIWT4_8_PLR1_SU0_SUM0_SUS128_VWA4_VWB8_WGM1_WGMXCC1_WGMXCCGn1
    SolutionIndex: 67
    SolutionNameMin: Cijk_Ailk_Bjlk_B8NF8NS_BH_Bias_HAS_SAV_UserArgs_MT128x256x128_MI16x16x1_SN_LDSB1_CLR1_GRVWA4_GRVWB16_GSU0_GSUC0_GSUWGMRR0_K1_LBSPPA1024_LBSPPB2048_LPA64_LPB0_MIWT4_8_PLR1_SU0_SUM0_SUS128_VWA4_VWB8_WGM4_WGMXCC1_WGMXCCGn1
    SolutionIndex: 68
    SolutionNameMin: Cijk_Ailk_Bjlk_B8NF8NS_BH_Bias_HAS_SAV_UserArgs_MT128x256x128_MI16x16x1_SN_LDSB1_CLR1_GRVWA8_GRVWB16_GSU0_GSUC0_GSUWGMRR0_K1_LBSPPA1024_LBSPPB2048_LPA64_LPB0_MIWT4_8_PLR1_SU0_SUM0_SUS128_VWA4_VWB8_WGM4_WGMXCC1_WGMXCCGn1
    SolutionIndex: 69
    SolutionNameMin: Cijk_Ailk_Bjlk_B8NF8NS_BH_Bias_HAS_SAV_UserArgs_MT128x256x128_MI16x16x1_SN_LDSB1_CLR1_GRVWA16_GRVWB16_GSU0_GSUC0_GSUWGMRR0_K1_LBSPPA1024_LBSPPB2048_LPA64_LPB0_MIWT4_8_PLR1_SU0_SUM0_SUS128_VWA4_VWB8_WGM4_WGMXCC1_WGMXCCGn1
    SolutionIndex: 70
    SolutionNameMin: Cijk_Ailk_Bjlk_B8NF8NS_BH_Bias_HAS_SAV_UserArgs_MT128x256x128_MI16x16x1_SN_LDSB1_CLR1_GRVWA8_GRVWB16_GSU0_GSUC0_GSUWGMRR0_K1_LBSPPA1024_LBSPPB2048_LPA64_LPB0_MIWT4_8_PLR1_SU0_SUM0_SUS128_VWA4_VWB8_WGM6_WGMXCC1_WGMXCCGn1
    SolutionIndex: 71
    SolutionNameMin: Cijk_Ailk_Bjlk_B8NF8NS_BH_Bias_HAS_SAV_UserArgs_MT128x256x128_MI16x16x1_SN_LDSB1_CLR1_GRVWA4_GRVWB16_GSU0_GSUC0_GSUWGMRR0_K1_LBSPPA1024_LBSPPB2048_LPA64_LPB0_MIWT4_8_PLR1_SU0_SUM0_SUS128_VWA4_VWB8_WGM8_WGMXCC1_WGMXCCGn1
    SolutionIndex: 72
    SolutionNameMin: Cijk_Ailk_Bjlk_B8NF8NS_BH_Bias_HAS_SAV_UserArgs_MT128x256x128_MI16x16x1_SN_LDSB1_CLR1_GRVWA16_GRVWB16_GSU0_GSUC0_GSUWGMRR0_K1_LBSPPA1024_LBSPPB2048_LPA64_LPB0_MIWT4_8_PLR1_SU0_SUM0_SUS128_VWA4_VWB8_WGM8_WGMXCC1_WGMXCCGn1
    SolutionIndex: 73
    SolutionNameMin: Cijk_Ailk_Bjlk_B8NF8NS_BH_Bias_HAS_SAV_UserArgs_MT256x128x128_MI16x16x1_SN_LDSB1_CLR1_GRVWA16_GRVWB8_GSU0_GSUC0_GSUWGMRR0_K1_LBSPPA2048_LBSPPB1024_LPA0_LPB64_MIWT8_4_PLR1_SU0_SUM0_SUS128_VWA8_VWB4_WGM1_WGMXCC1_WGMXCCGn1
    SolutionIndex: 74
    SolutionNameMin: Cijk_Ailk_Bjlk_B8NF8NS_BH_Bias_HAS_SAV_UserArgs_MT256x128x128_MI16x16x1_SN_LDSB1_CLR1_GRVWA16_GRVWB16_GSU0_GSUC0_GSUWGMRR0_K1_LBSPPA2048_LBSPPB1024_LPA0_LPB64_MIWT8_4_PLR1_SU0_SUM0_SUS128_VWA8_VWB4_WGM4_WGMXCC1_WGMXCCGn1
    SolutionIndex: 75
    SolutionNameMin: Cijk_Ailk_Bjlk_B8NF8NS_BH_Bias_HAS_SAV_UserArgs_MT128x128x128_MI16x16x1_SN_LDSB1_CLR1_GRVWA16_GRVWB16_GSU0_GSUC0_GSUWGMRR0_K1_LBSPPA1024_LBSPPB1024_LPA64_LPB64_MIWT4_4_PLR1_SU0_SUM0_SUS128_VWA4_VWB4_WGM1_WGMXCC1_WGMXCCGn1
    SolutionIndex: 76
    SolutionNameMin: Cijk_Ailk_Bjlk_B8NF8NS_BH_Bias_HAS_SAV_UserArgs_MT128x128x128_MI16x16x1_SN_LDSB1_CLR1_GRVWA16_GRVWB16_GSU0_GSUC0_GSUWGMRR0_K1_LBSPPA1024_LBSPPB1024_LPA64_LPB64_MIWT4_4_PLR1_SU0_SUM0_SUS128_VWA4_VWB4_WGM6_WGMXCC1_WGMXCCGn1
    SolutionIndex: 77
    SolutionNameMin: Cijk_Ailk_Bjlk_B8NF8NS_BH_Bias_HAS_SAV_UserArgs_MT128x64x128_MI16x16x1_SN_LDSB1_CLR1_GRVWA16_GRVWB16_GSU0_GSUC0_GSUWGMRR0_K1_LBSPPA1024_LBSPPB512_LPA64_LPB32_MIWT4_2_PLR1_SU0_SUM0_SUS128_VWA4_VWB2_WGM1_WGMXCC1_WGMXCCGn1
    SolutionIndex: 78
    SolutionNameMin: Cijk_Ailk_Bjlk_B8NF8NS_BH_Bias_HAS_SAV_UserArgs_MT128x64x128_MI16x16x1_SN_LDSB1_CLR1_GRVWA16_GRVWB16_GSU0_GSUC0_GSUWGMRR0_K1_LBSPPA1024_LBSPPB512_LPA64_LPB32_MIWT4_2_PLR1_SU0_SUM0_SUS128_VWA4_VWB2_WGM4_WGMXCC1_WGMXCCGn1
    SolutionIndex: 79
    SolutionNameMin: Cijk_Ailk_Bjlk_B8NF8NS_BH_Bias_HAS_SAV_UserArgs_MT128x64x128_MI16x16x1_SN_LDSB1_CLR1_GRVWA16_GRVWB16_GSU0_GSUC0_GSUWGMRR0_K1_LBSPPA1024_LBSPPB512_LPA64_LPB32_MIWT4_2_PLR1_SU0_SUM0_SUS128_VWA4_VWB2_WGM6_WGMXCC1_WGMXCCGn1
    SolutionIndex: 80
    SolutionNameMin: Cijk_Ailk_Bjlk_B8NF8NS_BH_Bias_HAS_SAV_UserArgs_MT128x64x128_MI16x16x1_SN_LDSB1_CLR1_GRVWA16_GRVWB16_GSU0_GSUC0_GSUWGMRR0_K1_LBSPPA1024_LBSPPB512_LPA64_LPB32_MIWT4_2_PLR1_SU0_SUM0_SUS128_VWA4_VWB2_WGM8_WGMXCC1_WGMXCCGn1
    SolutionIndex: 81
    SolutionNameMin: Cijk_Ailk_Bjlk_B8NF8NS_BH_Bias_HAS_SAV_UserArgs_MT64x64x128_MI16x16x1_SN_LDSB1_CLR1_GRVWA4_GRVWB8_GSU0_GSUC0_GSUWGMRR0_K1_LBSPPA512_LBSPPB512_LPA32_LPB32_MIWT2_2_PLR1_SU0_SUM0_SUS128_VWA2_VWB2_WGM1_WGMXCC1_WGMXCCGn1
    SolutionIndex: 82
    SolutionNameMin: Cijk_Ailk_Bjlk_B8NF8NS_BH_Bias_HAS_SAV_UserArgs_MT64x64x128_MI16x16x1_SN_LDSB1_CLR1_GRVWA4_GRVWB16_GSU0_GSUC0_GSUWGMRR0_K1_LBSPPA512_LBSPPB512_LPA32_LPB32_MIWT2_2_PLR1_SU0_SUM0_SUS128_VWA2_VWB2_WGM1_WGMXCC1_WGMXCCGn1
    SolutionIndex: 83
    SolutionNameMin: Cijk_Ailk_Bjlk_B8NF8NS_BH_Bias_HAS_SAV_UserArgs_MT64x64x128_MI16x16x1_SN_LDSB1_CLR1_GRVWA8_GRVWB16_GSU0_GSUC0_GSUWGMRR0_K1_LBSPPA512_LBSPPB512_LPA32_LPB32_MIWT2_2_PLR1_SU0_SUM0_SUS128_VWA2_VWB2_WGM1_WGMXCC1_WGMXCCGn1
    SolutionIndex: 84
    SolutionNameMin: Cijk_Ailk_Bjlk_B8NF8NS_BH_Bias_HAS_SAV_UserArgs_MT64x64x128_MI16x16x1_SN_LDSB1_CLR1_GRVWA16_GRVWB16_GSU0_GSUC0_GSUWGMRR0_K1_LBSPPA512_LBSPPB512_LPA32_LPB32_MIWT2_2_PLR1_SU0_SUM0_SUS128_VWA2_VWB2_WGM1_WGMXCC1_WGMXCCGn1
    SolutionIndex: 85
    SolutionNameMin: Cijk_Ailk_Bjlk_B8NF8NS_BH_Bias_HAS_SAV_UserArgs_MT64x64x128_MI16x16x1_SN_LDSB1_CLR1_GRVWA4_GRVWB16_GSU0_GSUC0_GSUWGMRR0_K1_LBSPPA512_LBSPPB512_LPA32_LPB32_MIWT2_2_PLR1_SU0_SUM0_SUS128_VWA2_VWB2_WGM4_WGMXCC1_WGMXCCGn1
    SolutionIndex: 86
    SolutionNameMin: Cijk_Ailk_Bjlk_B8NF8NS_BH_Bias_HAS_SAV_UserArgs_MT64x64x128_MI16x16x1_SN_LDSB1_CLR1_GRVWA16_GRVWB16_GSU0_GSUC0_GSUWGMRR0_K1_LBSPPA512_LBSPPB512_LPA32_LPB32_MIWT2_2_PLR1_SU0_SUM0_SUS128_VWA2_VWB2_WGM4_WGMXCC1_WGMXCCGn1
    SolutionIndex: 87
    SolutionNameMin: Cijk_Ailk_Bjlk_B8NF8NS_BH_Bias_HAS_SAV_UserArgs_MT64x64x128_MI16x16x1_SN_LDSB1_CLR1_GRVWA4_GRVWB16_GSU0_GSUC0_GSUWGMRR0_K1_LBSPPA512_LBSPPB512_LPA32_LPB32_MIWT2_2_PLR1_SU0_SUM0_SUS128_VWA2_VWB2_WGM6_WGMXCC1_WGMXCCGn1
    SolutionIndex: 88
    SolutionNameMin: Cijk_Ailk_Bjlk_B8NF8NS_BH_Bias_HAS_SAV_UserArgs_MT64x64x128_MI16x16x1_SN_LDSB1_CLR1_GRVWA16_GRVWB16_GSU0_GSUC0_GSUWGMRR0_K1_LBSPPA512_LBSPPB512_LPA32_LPB32_MIWT2_2_PLR1_SU0_SUM0_SUS128_VWA2_VWB2_WGM6_WGMXCC1_WGMXCCGn1
    SolutionIndex: 89
    SolutionNameMin: Cijk_Ailk_Bjlk_B8NF8NS_BH_Bias_HAS_SAV_UserArgs_MT64x64x128_MI16x16x1_SN_LDSB1_CLR1_GRVWA4_GRVWB16_GSU0_GSUC0_GSUWGMRR0_K1_LBSPPA512_LBSPPB512_LPA32_LPB32_MIWT2_2_PLR1_SU0_SUM0_SUS128_VWA2_VWB2_WGM8_WGMXCC1_WGMXCCGn1
    SolutionIndex: 90
    SolutionNameMin: Cijk_Ailk_Bjlk_B8NF8NS_BH_Bias_HAS_SAV_UserArgs_MT32x64x128_MI16x16x1_SN_LDSB0_CLR1_GRVWA4_GRVWB8_GSU0_GSUC0_GSUWGMRR0_K1_LBSPPA256_LBSPPB512_LPA16_LPB32_MIWT1_2_PLR1_SU0_SUM0_SUS128_VWA1_VWB2_WGM1_WGMXCC1_WGMXCCGn1
    SolutionIndex: 91
    SolutionNameMin: Cijk_Ailk_Bjlk_B8NF8NS_BH_Bias_HAS_SAV_UserArgs_MT32x64x128_MI16x16x1_SN_LDSB0_CLR1_GRVWA8_GRVWB16_GSU0_GSUC0_GSUWGMRR0_K1_LBSPPA256_LBSPPB512_LPA16_LPB32_MIWT1_2_PLR1_SU0_SUM0_SUS128_VWA1_VWB2_WGM1_WGMXCC1_WGMXCCGn1
    SolutionIndex: 92
    SolutionNameMin: Cijk_Ailk_Bjlk_B8NF8NS_BH_Bias_HAS_SAV_UserArgs_MT32x64x128_MI16x16x1_SN_LDSB0_CLR1_GRVWA16_GRVWB16_GSU0_GSUC0_GSUWGMRR0_K1_LBSPPA256_LBSPPB512_LPA16_LPB32_MIWT1_2_PLR1_SU0_SUM0_SUS128_VWA1_VWB2_WGM6_WGMXCC1_WGMXCCGn1
    SolutionIndex: 93
    SolutionNameMin: Cijk_Ailk_Bjlk_B8NF8NS_BH_Bias_HAS_SAV_UserArgs_MT32x64x128_MI16x16x1_SN_LDSB0_CLR1_GRVWA16_GRVWB16_GSU0_GSUC0_GSUWGMRR0_K1_LBSPPA256_LBSPPB512_LPA16_LPB32_MIWT1_2_PLR1_SU0_SUM0_SUS128_VWA1_VWB2_WGM8_WGMXCC1_WGMXCCGn1
    SolutionIndex: 94
    SolutionNameMin: Cijk_Ailk_Bjlk_B8NF8NS_BH_Bias_HAS_SAV_UserArgs_MT64x32x128_MI16x16x1_SN_LDSB0_CLR1_GRVWA4_GRVWB8_GSU0_GSUC0_GSUWGMRR0_K1_LBSPPA512_LBSPPB256_LPA32_LPB16_MIWT2_1_PLR1_SU0_SUM0_SUS128_VWA2_VWB1_WGM1_WGMXCC1_WGMXCCGn1
    SolutionIndex: 95
    SolutionNameMin: Cijk_Ailk_Bjlk_B8NF8NS_BH_Bias_HAS_SAV_UserArgs_MT64x32x128_MI16x16x1_SN_LDSB0_CLR1_GRVWA8_GRVWB16_GSU0_GSUC0_GSUWGMRR0_K1_LBSPPA512_LBSPPB256_LPA32_LPB16_MIWT2_1_PLR1_SU0_SUM0_SUS128_VWA2_VWB1_WGM1_WGMXCC1_WGMXCCGn1
    SolutionIndex: 96
    SolutionNameMin: Cijk_Ailk_Bjlk_B8NF8NS_BH_Bias_HAS_SAV_UserArgs_MT64x32x128_MI16x16x1_SN_LDSB0_CLR1_GRVWA16_GRVWB16_GSU0_GSUC0_GSUWGMRR0_K1_LBSPPA512_LBSPPB256_LPA32_LPB16_MIWT2_1_PLR1_SU0_SUM0_SUS128_VWA2_VWB1_WGM1_WGMXCC1_WGMXCCGn1
    SolutionIndex: 97
    SolutionNameMin: Cijk_Ailk_Bjlk_B8NF8NS_BH_Bias_HAS_SAV_UserArgs_MT64x32x128_MI16x16x1_SN_LDSB0_CLR1_GRVWA16_GRVWB16_GSU0_GSUC0_GSUWGMRR0_K1_LBSPPA512_LBSPPB256_LPA32_LPB16_MIWT2_1_PLR1_SU0_SUM0_SUS128_VWA2_VWB1_WGM8_WGMXCC1_WGMXCCGn1
    SolutionIndex: 98
    SolutionNameMin: Cijk_Ailk_Bjlk_B8NF8NS_BH_Bias_HAS_SAV_UserArgs_MT32x32x128_MI16x16x1_SN_LDSB0_CLR1_GRVWA4_GRVWB4_GSU0_GSUC0_GSUWGMRR0_K1_LBSPPA256_LBSPPB256_LPA16_LPB16_MIWT1_1_PLR1_SU0_SUM0_SUS128_VWA1_VWB1_WGM1_WGMXCC1_WGMXCCGn1
    SolutionIndex: 99
    SolutionNameMin: Cijk_Ailk_Bjlk_B8NF8NS_BH_Bias_HAS_SAV_UserArgs_MT32x32x128_MI16x16x1_SN_LDSB0_CLR1_GRVWA4_GRVWB8_GSU0_GSUC0_GSUWGMRR0_K1_LBSPPA256_LBSPPB256_LPA16_LPB16_MIWT1_1_PLR1_SU0_SUM0_SUS128_VWA1_VWB1_WGM1_WGMXCC1_WGMXCCGn1
    SolutionIndex: 100
    SolutionNameMin: Cijk_Ailk_Bjlk_B8NF8NS_BH_Bias_HAS_SAV_UserArgs_MT32x32x128_MI16x16x1_SN_LDSB0_CLR1_GRVWA8_GRVWB8_GSU0_GSUC0_GSUWGMRR0_K1_LBSPPA256_LBSPPB256_LPA16_LPB16_MIWT1_1_PLR1_SU0_SUM0_SUS128_VWA1_VWB1_WGM1_WGMXCC1_WGMXCCGn1
    SolutionIndex: 101
    SolutionNameMin: Cijk_Ailk_Bjlk_B8NF8NS_BH_Bias_HAS_SAV_UserArgs_MT32x32x128_MI16x16x1_SN_LDSB0_CLR1_GRVWA4_GRVWB16_GSU0_GSUC0_GSUWGMRR0_K1_LBSPPA256_LBSPPB256_LPA16_LPB16_MIWT1_1_PLR1_SU0_SUM0_SUS128_VWA1_VWB1_WGM1_WGMXCC1_WGMXCCGn1
    SolutionIndex: 102
    SolutionNameMin: Cijk_Ailk_Bjlk_B8NF8NS_BH_Bias_HAS_SAV_UserArgs_MT32x32x128_MI16x16x1_SN_LDSB0_CLR1_GRVWA8_GRVWB16_GSU0_GSUC0_GSUWGMRR0_K1_LBSPPA256_LBSPPB256_LPA16_LPB16_MIWT1_1_PLR1_SU0_SUM0_SUS128_VWA1_VWB1_WGM1_WGMXCC1_WGMXCCGn1
    SolutionIndex: 103
    SolutionNameMin: Cijk_Ailk_Bjlk_B8NF8NS_BH_Bias_HAS_SAV_UserArgs_MT128x64x256_MI16x16x1_SN_LDSB1_CLR1_GRVWA16_GRVWB16_GSU0_GSUC0_GSUWGMRR0_K1_LBSPPA1024_LBSPPB512_LPA64_LPB32_MIWT4_2_PLR1_SU0_SUM0_SUS256_VWA4_VWB2_WGM4_WGMXCC1_WGMXCCGn1
    SolutionIndex: 104
    SolutionNameMin: Cijk_Ailk_Bjlk_B8NF8NS_BH_Bias_HAS_SAV_UserArgs_MT64x64x256_MI16x16x1_SN_LDSB1_CLR1_GRVWA16_GRVWB16_GSU0_GSUC0_GSUWGMRR0_K1_LBSPPA512_LBSPPB512_LPA32_LPB32_MIWT2_2_PLR1_SU0_SUM0_SUS256_VWA2_VWB2_WGM1_WGMXCC1_WGMXCCGn1
    SolutionIndex: 105
    SolutionNameMin: Cijk_Ailk_Bjlk_B8NF8NS_BH_Bias_HAS_SAV_UserArgs_MT64x64x256_MI16x16x1_SN_LDSB1_CLR1_GRVWA16_GRVWB16_GSU0_GSUC0_GSUWGMRR0_K1_LBSPPA512_LBSPPB512_LPA32_LPB32_MIWT2_2_PLR1_SU0_SUM0_SUS256_VWA2_VWB2_WGM6_WGMXCC1_WGMXCCGn1
    SolutionIndex: 106
    SolutionNameMin: Cijk_Ailk_Bjlk_B8NF8NS_BH_Bias_HAS_SAV_UserArgs_MT64x32x256_MI16x16x1_SN_LDSB1_CLR1_GRVWA16_GRVWB16_GSU0_GSUC0_GSUWGMRR0_K1_LBSPPA512_LBSPPB256_LPA32_LPB16_MIWT2_1_PLR1_SU0_SUM0_SUS256_VWA2_VWB1_WGM1_WGMXCC1_WGMXCCGn1
    SolutionIndex: 107
    SolutionNameMin: Cijk_Ailk_Bjlk_B8NF8NS_BH_Bias_HAS_SAV_UserArgs_MT64x32x256_MI16x16x1_SN_LDSB1_CLR1_GRVWA16_GRVWB16_GSU0_GSUC0_GSUWGMRR0_K1_LBSPPA512_LBSPPB256_LPA32_LPB16_MIWT2_1_PLR1_SU0_SUM0_SUS256_VWA2_VWB1_WGM4_WGMXCC1_WGMXCCGn1
    SolutionIndex: 108
    SolutionNameMin: Cijk_Ailk_Bjlk_B8NF8NS_BH_Bias_HAS_SAV_UserArgs_MT64x32x256_MI16x16x1_SN_LDSB1_CLR1_GRVWA16_GRVWB16_GSU0_GSUC0_GSUWGMRR0_K1_LBSPPA512_LBSPPB256_LPA32_LPB16_MIWT2_1_PLR1_SU0_SUM0_SUS256_VWA2_VWB1_WGM6_WGMXCC1_WGMXCCGn1
    SolutionIndex: 109
    SolutionNameMin: Cijk_Ailk_Bjlk_B8NF8NS_BH_Bias_HAS_SAV_UserArgs_MT32x32x256_MI16x16x1_SN_LDSB1_CLR1_GRVWA8_GRVWB16_GSU0_GSUC0_GSUWGMRR0_K1_LBSPPA256_LBSPPB256_LPA16_LPB16_MIWT1_1_PLR1_SU0_SUM0_SUS256_VWA1_VWB1_WGM1_WGMXCC1_WGMXCCGn1
    SolutionIndex: 110
    SolutionNameMin: Cijk_Ailk_Bjlk_B8NF8NS_BH_Bias_HAS_SAV_UserArgs_MT32x32x256_MI16x16x1_SN_LDSB1_CLR1_GRVWA16_GRVWB16_GSU0_GSUC0_GSUWGMRR0_K1_LBSPPA256_LBSPPB256_LPA16_LPB16_MIWT1_1_PLR1_SU0_SUM0_SUS256_VWA1_VWB1_WGM1_WGMXCC1_WGMXCCGn1
    SolutionIndex: 111
    SolutionNameMin: Cijk_Ailk_Bjlk_B8NF8NS_BH_Bias_HAS_SAV_UserArgs_MT32x32x256_MI16x16x1_SN_LDSB1_CLR1_GRVWA16_GRVWB16_GSU0_GSUC0_GSUWGMRR0_K1_LBSPPA256_LBSPPB256_LPA16_LPB16_MIWT1_1_PLR1_SU0_SUM0_SUS256_VWA1_VWB1_WGM4_WGMXCC1_WGMXCCGn1
    SolutionIndex: 112
    SolutionNameMin: Cijk_Ailk_Bjlk_B8NF8NS_BH_Bias_HAS_SAV_UserArgs_MT32x32x256_MI16x16x1_SN_LDSB1_CLR1_GRVWA16_GRVWB16_GSU0_GSUC0_GSUWGMRR0_K1_LBSPPA256_LBSPPB256_LPA16_LPB16_MIWT1_1_PLR1_SU0_SUM0_SUS256_VWA1_VWB1_WGM6_WGMXCC1_WGMXCCGn1
    SolutionIndex: 113
    SolutionNameMin: Cijk_Ailk_Bjlk_B8NF8NS_BH_Bias_HAS_SAV_UserArgs_MT32x32x256_MI16x16x1_SN_LDSB1_CLR1_GRVWA16_GRVWB16_GSU0_GSUC0_GSUWGMRR0_K1_LBSPPA256_LBSPPB256_LPA16_LPB16_MIWT1_1_PLR1_SU0_SUM0_SUS256_VWA1_VWB1_WGM8_WGMXCC1_WGMXCCGn1
- - - [128, 128, 1, 128, 128, 128, 128, 128]
    - [57, 0.5]
  - - [128, 128, 1, 256, 128, 128, 128, 128]
    - [98, 0.9]
  - - [128, 128, 1, 512, 128, 128, 128, 128]
    - [98, 1.49]
  - - [128, 128, 1, 1024, 128, 128, 128, 128]
    - [102, 2.21]
  - - [128, 128, 1, 2048, 128, 128, 128, 128]
    - [102, 2.95]
  - - [128, 128, 1, 4096, 128, 128, 128, 128]
    - [102, 3.54]
  - - [128, 128, 1, 8192, 128, 128, 128, 128]
    - [110, 3.94]
  - - [128, 256, 1, 128, 128, 128, 128, 256]
    - [60, 0.97]
  - - [128, 256, 1, 256, 128, 128, 128, 256]
    - [58, 1.77]
  - - [128, 256, 1, 512, 128, 128, 128, 256]
    - [99, 2.99]
  - - [128, 256, 1, 1024, 128, 128, 128, 256]
    - [102, 4.43]
  - - [128, 256, 1, 2048, 128, 128, 128, 256]
    - [102, 5.91]
  - - [128, 256, 1, 4096, 128, 128, 128, 256]
    - [102, 7.07]
  - - [128, 256, 1, 8192, 128, 128, 128, 256]
    - [102, 7.89]
  - - [128, 512, 1, 128, 128, 128, 128, 512]
    - [98, 2.06]
  - - [128, 512, 1, 256, 128, 128, 128, 512]
    - [57, 3.66]
  - - [128, 512, 1, 512, 128, 128, 128, 512]
    - [99, 5.86]
  - - [128, 512, 1, 1024, 128, 128, 128, 512]
    - [98, 8.65]
  - - [128, 512, 1, 2048, 128, 128, 128, 512]
    - [102, 11.58]
  - - [128, 512, 1, 4096, 128, 128, 128, 512]
    - [102, 14.02]
  - - [128, 512, 1, 8192, 128, 128, 128, 512]
    - [109, 14.86]
  - - [128, 1024, 1, 128, 128, 128, 128, 1024]
    - [57, 4.06]
  - - [128, 1024, 1, 256, 128, 128, 128, 1024]
    - [57, 7.13]
  - - [128, 1024, 1, 512, 128, 128, 128, 1024]
    - [100, 11.53]
  - - [128, 1024, 1, 1024, 128, 128, 128, 1024]
    - [98, 17.03]
  - - [128, 1024, 1, 2048, 128, 128, 128, 1024]
    - [102, 22.85]
  - - [128, 1024, 1, 4096, 128, 128, 128, 1024]
    - [110, 25.69]
  - - [128, 1024, 1, 8192, 128, 128, 128, 1024]
    - [112, 27.81]
  - - [128, 2048, 1, 128, 128, 128, 128, 2048]
    - [54, 7.72]
  - - [128, 2048, 1, 256, 128, 128, 128, 2048]
    - [54, 13.27]
  - - [128, 2048, 1, 512, 128, 128, 128, 2048]
    - [94, 21.28]
  - - [128, 2048, 1, 1024, 128, 128, 128, 2048]
    - [91, 31.04]
  - - [128, 2048, 1, 2048, 128, 128, 128, 2048]
    - [106, 39.31]
  - - [128, 2048, 1, 4096, 128, 128, 128, 2048]
    - [108, 47.47]
  - - [128, 2048, 1, 8192, 128, 128, 128, 2048]
    - [108, 53.39]
  - - [128, 4096, 1, 128, 128, 128, 128, 4096]
    - [52, 13.99]
  - - [128, 4096, 1, 256, 128, 128, 128, 4096]
    - [51, 24.4]
  - - [128, 4096, 1, 512, 128, 128, 128, 4096]
    - [81, 38.02]
  - - [128, 4096, 1, 1024, 128, 128, 128, 4096]
    - [84, 54.32]
  - - [128, 4096, 1, 2048, 128, 128, 128, 4096]
    - [104, 67.98]
  - - [128, 4096, 1, 4096, 128, 128, 128, 4096]
    - [104, 82.59]
  - - [128, 4096, 1, 8192, 128, 128, 128, 4096]
    - [105, 92.15]
  - - [128, 8192, 1, 128, 128, 128, 128, 8192]
    - [46, 24.81]
  - - [128, 8192, 1, 256, 128, 128, 128, 8192]
    - [46, 42.21]
  - - [128, 8192, 1, 512, 128, 128, 128, 8192]
    - [46, 64.23]
  - - [128, 8192, 1, 1024, 128, 128, 128, 8192]
    - [77, 88.58]
  - - [128, 8192, 1, 2048, 128, 128, 128, 8192]
    - [77, 108.5]
  - - [128, 8192, 1, 4096, 128, 128, 128, 8192]
    - [103, 126.17]
  - - [128, 8192, 1, 8192, 128, 128, 128, 8192]
    - [79, 128.22]
  - - [256, 128, 1, 128, 256, 256, 256, 128]
    - [58, 1.05]
  - - [256, 128, 1, 256, 256, 256, 256, 128]
    - [99, 1.84]
  - - [256, 128, 1, 512, 256, 256, 256, 128]
    - [101, 2.99]
  - - [256, 128, 1, 1024, 256, 256, 256, 128]
    - [100, 4.44]
  - - [256, 128, 1, 2048, 256, 256, 256, 128]
    - [102, 5.95]
  - - [256, 128, 1, 4096, 256, 256, 256, 128]
    - [102, 7.08]
  - - [256, 128, 1, 8192, 256, 256, 256, 128]
    - [110, 7.9]
  - - [256, 256, 1, 128, 256, 256, 256, 256]
    - [57, 1.96]
  - - [256, 256, 1, 256, 256, 256, 256, 256]
    - [57, 3.53]
  - - [256, 256, 1, 512, 256, 256, 256, 256]
    - [100, 5.86]
  - - [256, 256, 1, 1024, 256, 256, 256, 256]
    - [102, 8.81]
  - - [256, 256, 1, 2048, 256, 256, 256, 256]
    - [102, 11.68]
  - - [256, 256, 1, 4096, 256, 256, 256, 256]
    - [102, 14.07]
  - - [256, 256, 1, 8192, 256, 256, 256, 256]
    - [110, 15.63]
  - - [256, 512, 1, 128, 256, 256, 256, 512]
    - [59, 3.9]
  - - [256, 512, 1, 256, 256, 256, 256, 512]
    - [59, 6.99]
  - - [256, 512, 1, 512, 256, 256, 256, 512]
    - [100, 11.34]
  - - [256, 512, 1, 1024, 256, 256, 256, 512]
    - [100, 17.21]
  - - [256, 512, 1, 2048, 256, 256, 256, 512]
    - [102, 22.93]
  - - [256, 512, 1, 4096, 256, 256, 256, 512]
    - [102, 27.6]
  - - [256, 512, 1, 8192, 256, 256, 256, 512]
    - [110, 30.51]
  - - [256, 1024, 1, 128, 256, 256, 256, 1024]
    - [55, 7.73]
  - - [256, 1024, 1, 256, 256, 256, 256, 1024]
    - [55, 13.26]
  - - [256, 1024, 1, 512, 256, 256, 256, 1024]
    - [90, 21.26]
  - - [256, 1024, 1, 1024, 256, 256, 256, 1024]
    - [95, 31.26]
  - - [256, 1024, 1, 2048, 256, 256, 256, 1024]
    - [106, 40.98]
  - - [256, 1024, 1, 4096, 256, 256, 256, 1024]
    - [106, 48.78]
  - - [256, 1024, 1, 8192, 256, 256, 256, 1024]
    - [108, 54.24]
  - - [256, 2048, 1, 128, 256, 256, 256, 2048]
    - [51, 14.28]
  - - [256, 2048, 1, 256, 256, 256, 256, 2048]
    - [53, 23.82]
  - - [256, 2048, 1, 512, 256, 256, 256, 2048]
    - [53, 37.78]
  - - [256, 2048, 1, 1024, 256, 256, 256, 2048]
    - [83, 54.53]
  - - [256, 2048, 1, 2048, 256, 256, 256, 2048]
    - [84, 68.18]
  - - [256, 2048, 1, 4096, 256, 256, 256, 2048]
    - [83, 79.5]
  - - [256, 2048, 1, 8192, 256, 256, 256, 2048]
    - [104, 87.67]
  - - [256, 4096, 1, 128, 256, 256, 256, 4096]
    - [46, 24.75]
  - - [256, 4096, 1, 256, 256, 256, 256, 4096]
    - [47, 41.7]
  - - [256, 4096, 1, 512, 256, 256, 256, 4096]
    - [47, 64.33]
  - - [256, 4096, 1, 1024, 256, 256, 256, 4096]
    - [77, 88.67]
  - - [256, 4096, 1, 2048, 256, 256, 256, 4096]
    - [77, 109.04]
  - - [256, 4096, 1, 4096, 256, 256, 256, 4096]
    - [78, 125.51]
  - - [256, 4096, 1, 8192, 256, 256, 256, 4096]
    - [103, 131.19]
  - - [256, 8192, 1, 128, 256, 256, 256, 8192]
    - [33, 39.0]
  - - [256, 8192, 1, 256, 256, 256, 256, 8192]
    - [35, 65.53]
  - - [256, 8192, 1, 512, 256, 256, 256, 8192]
    - [35, 99.04]
  - - [256, 8192, 1, 1024, 256, 256, 256, 8192]
    - [75, 134.36]
  - - [256, 8192, 1, 2048, 256, 256, 256, 8192]
    - [36, 161.19]
  - - [256, 8192, 1, 4096, 256, 256, 256, 8192]
    - [76, 179.99]
  - - [256, 8192, 1, 8192, 256, 256, 256, 8192]
    - [75, 170.55]
  - - [512, 128, 1, 128, 512, 512, 512, 128]
    - [58, 2.04]
  - - [512, 128, 1, 256, 512, 512, 512, 128]
    - [98, 3.61]
  - - [512, 128, 1, 512, 512, 512, 512, 128]
    - [101, 5.92]
  - - [512, 128, 1, 1024, 512, 512, 512, 128]
    - [102, 8.93]
  - - [512, 128, 1, 2048, 512, 512, 512, 128]
    - [102, 11.79]
  - - [512, 128, 1, 4096, 512, 512, 512, 128]
    - [102, 14.07]
  - - [512, 128, 1, 8192, 512, 512, 512, 128]
    - [111, 15.11]
  - - [512, 256, 1, 128, 512, 512, 512, 256]
    - [57, 4.11]
  - - [512, 256, 1, 256, 512, 512, 512, 256]
    - [57, 7.07]
  - - [512, 256, 1, 512, 512, 512, 512, 256]
    - [98, 11.61]
  - - [512, 256, 1, 1024, 512, 512, 512, 256]
    - [101, 17.27]
  - - [512, 256, 1, 2048, 512, 512, 512, 256]
    - [102, 23.15]
  - - [512, 256, 1, 4096, 512, 512, 512, 256]
    - [102, 27.69]
  - - [512, 256, 1, 8192, 512, 512, 512, 256]
    - [113, 28.71]
  - - [512, 512, 1, 128, 512, 512, 512, 512]
    - [54, 7.7]
  - - [512, 512, 1, 256, 512, 512, 512, 512]
    - [94, 13.17]
  - - [512, 512, 1, 512, 512, 512, 512, 512]
    - [94, 21.46]
  - - [512, 512, 1, 1024, 512, 512, 512, 512]
    - [94, 31.12]
  - - [512, 512, 1, 2048, 512, 512, 512, 512]
    - [95, 40.71]
  - - [512, 512, 1, 4096, 512, 512, 512, 512]
    - [106, 48.92]
  - - [512, 512, 1, 8192, 512, 512, 512, 512]
    - [96, 50.7]
  - - [512, 1024, 1, 128, 512, 512, 512, 1024]
    - [51, 14.08]
  - - [512, 1024, 1, 256, 512, 512, 512, 1024]
    - [51, 24.24]
  - - [512, 1024, 1, 512, 512, 512, 512, 1024]
    - [81, 38.08]
  - - [512, 1024, 1, 1024, 512, 512, 512, 1024]
    - [84, 54.28]
  - - [512, 1024, 1, 2048, 512, 512, 512, 1024]
    - [84, 69.98]
  - - [512, 1024, 1, 4096, 512, 512, 512, 1024]
    - [84, 78.25]
  - - [512, 1024, 1, 8192, 512, 512, 512, 1024]
    - [82, 81.81]
  - - [512, 2048, 1, 128, 512, 512, 512, 2048]
    - [45, 24.28]
  - - [512, 2048, 1, 256, 512, 512, 512, 2048]
    - [46, 41.12]
  - - [512, 2048, 1, 512, 512, 512, 512, 2048]
    - [46, 63.4]
  - - [512, 2048, 1, 1024, 512, 512, 512, 2048]
    - [77, 89.5]
  - - [512, 2048, 1, 2048, 512, 512, 512, 2048]
    - [77, 109.12]
  - - [512, 2048, 1, 4096, 512, 512, 512, 2048]
    - [77, 125.03]
  - - [512, 2048, 1, 8192, 512, 512, 512, 2048]
    - [79, 129.79]
  - - [512, 4096, 1, 128, 512, 512, 512, 4096]
    - [34, 38.57]
  - - [512, 4096, 1, 256, 512, 512, 512, 4096]
    - [35, 64.92]
  - - [512, 4096, 1, 512, 512, 512, 512, 4096]
    - [35, 98.48]
  - - [512, 4096, 1, 1024, 512, 512, 512, 4096]
    - [75, 133.82]
  - - [512, 4096, 1, 2048, 512, 512, 512, 4096]
    - [35, 160.74]
  - - [512, 4096, 1, 4096, 512, 512, 512, 4096]
    - [37, 178.49]
  - - [512, 4096, 1, 8192, 512, 512, 512, 4096]
    - [36, 168.22]
  - - [512, 8192, 1, 128, 512, 512, 512, 8192]
    - [25, 56.07]
  - - [512, 8192, 1, 256, 512, 512, 512, 8192]
    - [27, 94.25]
  - - [512, 8192, 1, 512, 512, 512, 512, 8192]
    - [27, 142.16]
  - - [512, 8192, 1, 1024, 512, 512, 512, 8192]
    - [27, 191.28]
  - - [512, 8192, 1, 2048, 512, 512, 512, 8192]
    - [27, 229.49]
  - - [512, 8192, 1, 4096, 512, 512, 512, 8192]
    - [66, 231.37]
  - - [512, 8192, 1, 8192, 512, 512, 512, 8192]
    - [73, 215.05]
  - - [1024, 128, 1, 128, 1024, 1024, 1024, 128]
    - [59, 3.93]
  - - [1024, 128, 1, 256, 1024, 1024, 1024, 128]
    - [59, 7.05]
  - - [1024, 128, 1, 512, 1024, 1024, 1024, 128]
    - [101, 11.34]
  - - [1024, 128, 1, 1024, 1024, 1024, 1024, 128]
    - [100, 17.12]
  - - [1024, 128, 1, 2048, 1024, 1024, 1024, 128]
    - [102, 23.12]
  - - [1024, 128, 1, 4096, 1024, 1024, 1024, 128]
    - [113, 25.66]
  - - [1024, 128, 1, 8192, 1024, 1024, 1024, 128]
    - [111, 26.47]
  - - [1024, 256, 1, 128, 1024, 1024, 1024, 256]
    - [54, 7.68]
  - - [1024, 256, 1, 256, 1024, 1024, 1024, 256]
    - [56, 13.16]
  - - [1024, 256, 1, 512, 1024, 1024, 1024, 256]
    - [94, 21.34]
  - - [1024, 256, 1, 1024, 1024, 1024, 1024, 256]
    - [94, 30.91]
  - - [1024, 256, 1, 2048, 1024, 1024, 1024, 256]
    - [106, 40.89]
  - - [1024, 256, 1, 4096, 1024, 1024, 1024, 256]
    - [97, 46.27]
  - - [1024, 256, 1, 8192, 1024, 1024, 1024, 256]
    - [107, 49.33]
  - - [1024, 512, 1, 128, 1024, 1024, 1024, 512]
    - [50, 13.79]
  - - [1024, 512, 1, 256, 1024, 1024, 1024, 512]
    - [51, 23.77]
  - - [1024, 512, 1, 512, 1024, 1024, 1024, 512]
    - [81, 37.48]
  - - [1024, 512, 1, 1024, 1024, 1024, 1024, 512]
    - [83, 54.7]
  - - [1024, 512, 1, 2048, 1024, 1024, 1024, 512]
    - [83, 69.25]
  - - [1024, 512, 1, 4096, 1024, 1024, 1024, 512]
    - [85, 75.91]
  - - [1024, 512, 1, 8192, 1024, 1024, 1024, 512]
    - [87, 82.64]
  - - [1024, 1024, 1, 128, 1024, 1024, 1024, 1024]
    - [46, 24.29]
  - - [1024, 1024, 1, 256, 1024, 1024, 1024, 1024]
    - [46, 41.42]
  - - [1024, 1024, 1, 512, 1024, 1024, 1024, 1024]
    - [46, 63.5]
  - - [1024, 1024, 1, 1024, 1024, 1024, 1024, 1024]
    - [77, 88.58]
  - - [1024, 1024, 1, 2048, 1024, 1024, 1024, 1024]
    - [77, 109.69]
  - - [1024, 1024, 1, 4096, 1024, 1024, 1024, 1024]
    - [79, 123.62]
  - - [1024, 1024, 1, 8192, 1024, 1024, 1024, 1024]
    - [78, 129.28]
  - - [1024, 2048, 1, 128, 1024, 1024, 1024, 2048]
    - [35, 39.07]
  - - [1024, 2048, 1, 256, 1024, 1024, 1024, 2048]
    - [36, 64.8]
  - - [1024, 2048, 1, 512, 1024, 1024, 1024, 2048]
    - [36, 99.68]
  - - [1024, 2048, 1, 1024, 1024, 1024, 1024, 2048]
    - [75, 134.66]
  - - [1024, 2048, 1, 2048, 1024, 1024, 1024, 2048]
    - [36, 160.7]
  - - [1024, 2048, 1, 4096, 1024, 1024, 1024, 2048]
    - [41, 177.65]
  - - [1024, 2048, 1, 8192, 1024, 1024, 1024, 2048]
    - [41, 163.5]
  - - [1024, 4096, 1, 128, 1024, 1024, 1024, 4096]
    - [25, 56.28]
  - - [1024, 4096, 1, 256, 1024, 1024, 1024, 4096]
    - [25, 94.19]
  - - [1024, 4096, 1, 512, 1024, 1024, 1024, 4096]
    - [27, 141.53]
  - - [1024, 4096, 1, 1024, 1024, 1024, 1024, 4096]
    - [27, 189.84]
  - - [1024, 4096, 1, 2048, 1024, 1024, 1024, 4096]
    - [26, 227.16]
  - - [1024, 4096, 1, 4096, 1024, 1024, 1024, 4096]
    - [69, 230.35]
  - - [1024, 4096, 1, 8192, 1024, 1024, 1024, 4096]
    - [73, 213.47]
  - - [1024, 8192, 1, 128, 1024, 1024, 1024, 8192]
    - [20, 81.91]
  - - [1024, 8192, 1, 256, 1024, 1024, 1024, 8192]
    - [22, 132.95]
  - - [1024, 8192, 1, 512, 1024, 1024, 1024, 8192]
    - [23, 188.39]
  - - [1024, 8192, 1, 1024, 1024, 1024, 1024, 8192]
    - [3, 233.09]
  - - [1024, 8192, 1, 2048, 1024, 1024, 1024, 8192]
    - [14, 261.09]
  - - [1024, 8192, 1, 4096, 1024, 1024, 1024, 8192]
    - [3, 247.49]
  - - [1024, 8192, 1, 8192, 1024, 1024, 1024, 8192]
    - [6, 260.99]
  - - [2048, 128, 1, 128, 2048, 2048, 2048, 128]
    - [56, 7.44]
  - - [2048, 128, 1, 256, 2048, 2048, 2048, 128]
    - [56, 12.83]
  - - [2048, 128, 1, 512, 2048, 2048, 2048, 128]
    - [94, 21.06]
  - - [2048, 128, 1, 1024, 2048, 2048, 2048, 128]
    - [95, 30.83]
  - - [2048, 128, 1, 2048, 2048, 2048, 2048, 128]
    - [92, 37.72]
  - - [2048, 128, 1, 4096, 2048, 2048, 2048, 128]
    - [92, 45.27]
  - - [2048, 128, 1, 8192, 2048, 2048, 2048, 128]
    - [93, 50.7]
  - - [2048, 256, 1, 128, 2048, 2048, 2048, 256]
    - [51, 13.98]
  - - [2048, 256, 1, 256, 2048, 2048, 2048, 256]
    - [51, 23.66]
  - - [2048, 256, 1, 512, 2048, 2048, 2048, 256]
    - [81, 37.44]
  - - [2048, 256, 1, 1024, 2048, 2048, 2048, 256]
    - [83, 53.95]
  - - [2048, 256, 1, 2048, 2048, 2048, 2048, 256]
    - [86, 67.5]
  - - [2048, 256, 1, 4096, 2048, 2048, 2048, 256]
    - [89, 77.92]
  - - [2048, 256, 1, 8192, 2048, 2048, 2048, 256]
    - [86, 84.95]
  - - [2048, 512, 1, 128, 2048, 2048, 2048, 512]
    - [46, 24.1]
  - - [2048, 512, 1, 256, 2048, 2048, 2048, 512]
    - [46, 40.72]
  - - [2048, 512, 1, 512, 2048, 2048, 2048, 512]
    - [43, 62.93]
  - - [2048, 512, 1, 1024, 2048, 2048, 2048, 512]
    - [77, 87.93]
  - - [2048, 512, 1, 2048, 2048, 2048, 2048, 512]
    - [78, 107.62]
  - - [2048, 512, 1, 4096, 2048, 2048, 2048, 512]
    - [79, 124.72]
  - - [2048, 512, 1, 8192, 2048, 2048, 2048, 512]
    - [80, 126.46]
  - - [2048, 1024, 1, 128, 2048, 2048, 2048, 1024]
    - [34, 38.7]
  - - [2048, 1024, 1, 256, 2048, 2048, 2048, 1024]
    - [35, 65.27]
  - - [2048, 1024, 1, 512, 2048, 2048, 2048, 1024]
    - [36, 99.23]
  - - [2048, 1024, 1, 1024, 2048, 2048, 2048, 1024]
    - [35, 134.63]
  - - [2048, 1024, 1, 2048, 2048, 2048, 2048, 1024]
    - [37, 160.05]
  - - [2048, 1024, 1, 4096, 2048, 2048, 2048, 1024]
    - [38, 178.79]
  - - [2048, 1024, 1, 8192, 2048, 2048, 2048, 1024]
    - [38, 165.04]
  - - [2048, 2048, 1, 128, 2048, 2048, 2048, 2048]
    - [25, 56.27]
  - - [2048, 2048, 1, 256, 2048, 2048, 2048, 2048]
    - [32, 93.92]
  - - [2048, 2048, 1, 512, 2048, 2048, 2048, 2048]
    - [27, 141.42]
  - - [2048, 2048, 1, 1024, 2048, 2048, 2048, 2048]
    - [27, 190.17]
  - - [2048, 2048, 1, 2048, 2048, 2048, 2048, 2048]
    - [32, 228.19]
  - - [2048, 2048, 1, 4096, 2048, 2048, 2048, 2048]
    - [68, 234.32]
  - - [2048, 2048, 1, 8192, 2048, 2048, 2048, 2048]
    - [68, 216.02]
  - - [2048, 4096, 1, 128, 2048, 2048, 2048, 4096]
    - [5, 70.27]
  - - [2048, 4096, 1, 256, 2048, 2048, 2048, 4096]
    - [0, 118.34]
  - - [2048, 4096, 1, 512, 2048, 2048, 2048, 4096]
    - [3, 176.61]
  - - [2048, 4096, 1, 1024, 2048, 2048, 2048, 4096]
    - [14, 233.8]
  - - [2048, 4096, 1, 2048, 2048, 2048, 2048, 4096]
    - [10, 262.44]
  - - [2048, 4096, 1, 4096, 2048, 2048, 2048, 4096]
    - [11, 248.0]
  - - [2048, 4096, 1, 8192, 2048, 2048, 2048, 4096]
    - [3, 263.34]
  - - [2048, 8192, 1, 128, 2048, 2048, 2048, 8192]
    - [24, 90.29]
  - - [2048, 8192, 1, 256, 2048, 2048, 2048, 8192]
    - [24, 139.02]
  - - [2048, 8192, 1, 512, 2048, 2048, 2048, 8192]
    - [14, 187.62]
  - - [2048, 8192, 1, 1024, 2048, 2048, 2048, 8192]
    - [12, 223.3]
  - - [2048, 8192, 1, 2048, 2048, 2048, 2048, 8192]
    - [17, 232.77]
  - - [2048, 8192, 1, 4096, 2048, 2048, 2048, 8192]
    - [6, 276.8]
  - - [2048, 8192, 1, 8192, 2048, 2048, 2048, 8192]
    - [11, 328.92]
  - - [4096, 128, 1, 128, 4096, 4096, 4096, 128]
    - [51, 13.83]
  - - [4096, 128, 1, 256, 4096, 4096, 4096, 128]
    - [51, 23.62]
  - - [4096, 128, 1, 512, 4096, 4096, 4096, 128]
    - [53, 37.24]
  - - [4096, 128, 1, 1024, 4096, 4096, 4096, 128]
    - [83, 53.98]
  - - [4096, 128, 1, 2048, 4096, 4096, 4096, 128]
    - [88, 66.0]
  - - [4096, 128, 1, 4096, 4096, 4096, 4096, 128]
    - [88, 78.16]
  - - [4096, 128, 1, 8192, 4096, 4096, 4096, 128]
    - [86, 85.47]
  - - [4096, 256, 1, 128, 4096, 4096, 4096, 256]
    - [49, 23.89]
  - - [4096, 256, 1, 256, 4096, 4096, 4096, 256]
    - [48, 40.73]
  - - [4096, 256, 1, 512, 4096, 4096, 4096, 256]
    - [44, 63.07]
  - - [4096, 256, 1, 1024, 4096, 4096, 4096, 256]
    - [44, 88.18]
  - - [4096, 256, 1, 2048, 4096, 4096, 4096, 256]
    - [78, 108.05]
  - - [4096, 256, 1, 4096, 4096, 4096, 4096, 256]
    - [78, 125.46]
  - - [4096, 256, 1, 8192, 4096, 4096, 4096, 256]
    - [78, 130.28]
  - - [4096, 512, 1, 128, 4096, 4096, 4096, 512]
    - [34, 38.77]
  - - [4096, 512, 1, 256, 4096, 4096, 4096, 512]
    - [34, 65.52]
  - - [4096, 512, 1, 512, 4096, 4096, 4096, 512]
    - [36, 99.19]
  - - [4096, 512, 1, 1024, 4096, 4096, 4096, 512]
    - [40, 131.59]
  - - [4096, 512, 1, 2048, 4096, 4096, 4096, 512]
    - [37, 159.69]
  - - [4096, 512, 1, 4096, 4096, 4096, 4096, 512]
    - [42, 177.29]
  - - [4096, 512, 1, 8192, 4096, 4096, 4096, 512]
    - [37, 172.29]
  - - [4096, 1024, 1, 128, 4096, 4096, 4096, 1024]
    - [25, 55.93]
  - - [4096, 1024, 1, 256, 4096, 4096, 4096, 1024]
    - [27, 93.39]
  - - [4096, 1024, 1, 512, 4096, 4096, 4096, 1024]
    - [27, 141.39]
  - - [4096, 1024, 1, 1024, 4096, 4096, 4096, 1024]
    - [28, 188.44]
  - - [4096, 1024, 1, 2048, 4096, 4096, 4096, 1024]
    - [31, 225.15]
  - - [4096, 1024, 1, 4096, 4096, 4096, 4096, 1024]
    - [69, 232.65]
  - - [4096, 1024, 1, 8192, 4096, 4096, 4096, 1024]
    - [72, 215.33]
  - - [4096, 2048, 1, 128, 4096, 4096, 4096, 2048]
    - [1, 70.83]
  - - [4096, 2048, 1, 256, 4096, 4096, 4096, 2048]
    - [1, 117.03]
  - - [4096, 2048, 1, 512, 4096, 4096, 4096, 2048]
    - [3, 176.09]
  - - [4096, 2048, 1, 1024, 4096, 4096, 4096, 2048]
    - [6, 232.98]
  - - [4096, 2048, 1, 2048, 4096, 4096, 4096, 2048]
    - [14, 263.31]
  - - [4096, 2048, 1, 4096, 4096, 4096, 4096, 2048]
    - [64, 244.91]
  - - [4096, 2048, 1, 8192, 4096, 4096, 4096, 2048]
    - [70, 263.2]
  - - [4096, 4096, 1, 128, 4096, 4096, 4096, 4096]
    - [12, 76.76]
  - - [4096, 4096, 1, 256, 4096, 4096, 4096, 4096]
    - [12, 126.16]
  - - [4096, 4096, 1, 512, 4096, 4096, 4096, 4096]
    - [12, 185.15]
  - - [4096, 4096, 1, 1024, 4096, 4096, 4096, 4096]
    - [9, 226.22]
  - - [4096, 4096, 1, 2048, 4096, 4096, 4096, 4096]
    - [17, 234.12]
  - - [4096, 4096, 1, 4096, 4096, 4096, 4096, 4096]
    - [11, 279.19]
  - - [4096, 4096, 1, 8192, 4096, 4096, 4096, 4096]
    - [11, 329.89]
  - - [4096, 8192, 1, 128, 4096, 4096, 4096, 8192]
    - [21, 95.95]
  - - [4096, 8192, 1, 256, 4096, 4096, 4096, 8192]
    - [21, 145.12]
  - - [4096, 8192, 1, 512, 4096, 4096, 4096, 8192]
    - [18, 190.79]
  - - [4096, 8192, 1, 1024, 4096, 4096, 4096, 8192]
    - [19, 219.89]
  - - [4096, 8192, 1, 2048, 4096, 4096, 4096, 8192]
    - [0, 266.77]
  - - [4096, 8192, 1, 4096, 4096, 4096, 4096, 8192]
    - [2, 318.3]
  - - [4096, 8192, 1, 8192, 4096, 4096, 4096, 8192]
    - [61, 353.57]
  - - [8192, 128, 1, 128, 8192, 8192, 8192, 128]
    - [46, 24.66]
  - - [8192, 128, 1, 256, 8192, 8192, 8192, 128]
    - [46, 41.54]
  - - [8192, 128, 1, 512, 8192, 8192, 8192, 128]
    - [46, 64.71]
  - - [8192, 128, 1, 1024, 8192, 8192, 8192, 128]
    - [44, 88.12]
  - - [8192, 128, 1, 2048, 8192, 8192, 8192, 128]
    - [79, 108.03]
  - - [8192, 128, 1, 4096, 8192, 8192, 8192, 128]
    - [79, 124.94]
  - - [8192, 128, 1, 8192, 8192, 8192, 8192, 128]
    - [77, 124.24]
  - - [8192, 256, 1, 128, 8192, 8192, 8192, 256]
    - [34, 38.94]
  - - [8192, 256, 1, 256, 8192, 8192, 8192, 256]
    - [34, 65.56]
  - - [8192, 256, 1, 512, 8192, 8192, 8192, 256]
    - [36, 99.61]
  - - [8192, 256, 1, 1024, 8192, 8192, 8192, 256]
    - [76, 132.99]
  - - [8192, 256, 1, 2048, 8192, 8192, 8192, 256]
    - [39, 159.89]
  - - [8192, 256, 1, 4096, 8192, 8192, 8192, 256]
    - [40, 179.05]
  - - [8192, 256, 1, 8192, 8192, 8192, 8192, 256]
    - [39, 161.94]
  - - [8192, 512, 1, 128, 8192, 8192, 8192, 512]
    - [25, 55.9]
  - - [8192, 512, 1, 256, 8192, 8192, 8192, 512]
    - [25, 94.34]
  - - [8192, 512, 1, 512, 8192, 8192, 8192, 512]
    - [32, 140.81]
  - - [8192, 512, 1, 1024, 8192, 8192, 8192, 512]
    - [30, 189.31]
  - - [8192, 512, 1, 2048, 8192, 8192, 8192, 512]
    - [29, 224.92]
  - - [8192, 512, 1, 4096, 8192, 8192, 8192, 512]
    - [67, 231.92]
  - - [8192, 512, 1, 8192, 8192, 8192, 8192, 512]
    - [69, 215.8]
  - - [8192, 1024, 1, 128, 8192, 8192, 8192, 1024]
    - [13, 70.09]
  - - [8192, 1024, 1, 256, 8192, 8192, 8192, 1024]
    - [3, 116.11]
  - - [8192, 1024, 1, 512, 8192, 8192, 8192, 1024]
    - [11, 171.61]
  - - [8192, 1024, 1, 1024, 8192, 8192, 8192, 1024]
    - [6, 225.57]
  - - [8192, 1024, 1, 2048, 8192, 8192, 8192, 1024]
    - [7, 255.84]
  - - [8192, 1024, 1, 4096, 8192, 8192, 8192, 1024]
    - [63, 246.96]
  - - [8192, 1024, 1, 8192, 8192, 8192, 8192, 1024]
    - [15, 261.24]
  - - [8192, 2048, 1, 128, 8192, 8192, 8192, 2048]
    - [1, 75.41]
  - - [8192, 2048, 1, 256, 8192, 8192, 8192, 2048]
    - [0, 125.09]
  - - [8192, 2048, 1, 512, 8192, 8192, 8192, 2048]
    - [13, 181.18]
  - - [8192, 2048, 1, 1024, 8192, 8192, 8192, 2048]
    - [8, 221.17]
  - - [8192, 2048, 1, 2048, 8192, 8192, 8192, 2048]
    - [17, 232.41]
  - - [8192, 2048, 1, 4096, 8192, 8192, 8192, 2048]
    - [62, 282.88]
  - - [8192, 2048, 1, 8192, 8192, 8192, 8192, 2048]
    - [62, 332.63]
  - - [8192, 4096, 1, 128, 8192, 8192, 8192, 4096]
    - [12, 80.23]
  - - [8192, 4096, 1, 256, 8192, 8192, 8192, 4096]
    - [4, 128.26]
  - - [8192, 4096, 1, 512, 8192, 8192, 8192, 4096]
    - [19, 187.24]
  - - [8192, 4096, 1, 1024, 8192, 8192, 8192, 4096]
    - [74, 218.92]
  - - [8192, 4096, 1, 2048, 8192, 8192, 8192, 4096]
    - [71, 261.0]
  - - [8192, 4096, 1, 4096, 8192, 8192, 8192, 4096]
    - [3, 303.75]
  - - [8192, 4096, 1, 8192, 8192, 8192, 8192, 4096]
    - [65, 337.88]
  - - [8192, 8192, 1, 128, 8192, 8192, 8192, 8192]
    - [21, 90.62]
  - - [8192, 8192, 1, 256, 8192, 8192, 8192, 8192]
    - [16, 140.28]
  - - [8192, 8192, 1, 512, 8192, 8192, 8192, 8192]
    - [0, 209.8]
  - - [8192, 8192, 1, 1024, 8192, 8192, 8192, 8192]
    - [65, 267.42]
  - - [8192, 8192, 1, 2048, 8192, 8192, 8192, 8192]
    - [63, 323.18]
  - - [8192, 8192, 1, 4096, 8192, 8192, 8192, 8192]
    - [65, 358.01]
  - - [8192, 8192, 1, 8192, 8192, 8192, 8192, 8192]
    - [3, 347.83]
- null
- null
- ExperimentalStreamK
- GridBased
