projects/hipblaslt/library/src/amd_detail/rocblaslt/src/Tensile/Logic/asm_full/aquavanjaram/gfx942_228cu/StreamK/aquavanjaram942_Cijk_Ailk_Bljk_F8B8NB8NS_BH_Bias_HAS_SAV_UserArgs.yaml
- {MinimumRequiredVersion: 4.33.0}
- aquavanjaram942
- {Architecture: gfx942, CUCount: 228}
- [Device 0049, Device 0050]
    SolutionIndex: 0
    SolutionNameMin: Cijk_Ailk_Bljk_F8B8NB8NS_BH_Bias_HAS_SAV_UserArgs_MT256x256x64_MI16x16x1_SN_LDSB1_CLR1_GRVWA16_GRVWB8_GSU0_GSUC0_GSUWGMRR0_K1_LBSPPA2048_LBSPPB512_LPA0_LPB8_LRVW8_MIWT8_8_PLR1_SU0_SUM0_SUS64_VWA8_VWB8_WGM1_WGMXCC1_WGMXCCGn1
    SolutionIndex: 1
    SolutionNameMin: Cijk_Ailk_Bljk_F8B8NB8NS_BH_Bias_HAS_SAV_UserArgs_MT256x256x64_MI16x16x1_SN_LDSB1_CLR1_GRVWA8_GRVWB16_GSU0_GSUC0_GSUWGMRR0_K1_LBSPPA2048_LBSPPB512_LPA0_LPB16_LRVW8_MIWT8_8_PLR1_SU0_SUM0_SUS64_VWA8_VWB8_WGM1_WGMXCC1_WGMXCCGn1
    SolutionIndex: 2
    SolutionNameMin: Cijk_Ailk_Bljk_F8B8NB8NS_BH_Bias_HAS_SAV_UserArgs_MT256x256x64_MI16x16x1_SN_LDSB1_CLR1_GRVWA16_GRVWB16_GSU0_GSUC0_GSUWGMRR0_K1_LBSPPA2048_LBSPPB512_LPA0_LPB16_LRVW8_MIWT8_8_PLR1_SU0_SUM0_SUS64_VWA8_VWB8_WGM1_WGMXCC1_WGMXCCGn1
    SolutionIndex: 3
    SolutionNameMin: Cijk_Ailk_Bljk_F8B8NB8NS_BH_Bias_HAS_SAV_UserArgs_MT256x256x64_MI16x16x1_SN_LDSB1_CLR1_GRVWA16_GRVWB16_GSU0_GSUC0_GSUWGMRR0_K1_LBSPPA2048_LBSPPB512_LPA0_LPB16_LRVW8_MIWT8_8_PLR1_SU0_SUM0_SUS64_VWA8_VWB8_WGM4_WGMXCC1_WGMXCCGn1
    SolutionIndex: 4
    SolutionNameMin: Cijk_Ailk_Bljk_F8B8NB8NS_BH_Bias_HAS_SAV_UserArgs_MT256x256x64_MI16x16x1_SN_LDSB1_CLR1_GRVWA8_GRVWB8_GSU0_GSUC0_GSUWGMRR0_K1_LBSPPA2048_LBSPPB512_LPA0_LPB8_LRVW8_MIWT8_8_PLR1_SU0_SUM0_SUS64_VWA8_VWB8_WGM6_WGMXCC1_WGMXCCGn1
    SolutionIndex: 5
    SolutionNameMin: Cijk_Ailk_Bljk_F8B8NB8NS_BH_Bias_HAS_SAV_UserArgs_MT256x256x64_MI16x16x1_SN_LDSB1_CLR1_GRVWA16_GRVWB8_GSU0_GSUC0_GSUWGMRR0_K1_LBSPPA2048_LBSPPB512_LPA0_LPB8_LRVW8_MIWT8_8_PLR1_SU0_SUM0_SUS64_VWA8_VWB8_WGM6_WGMXCC1_WGMXCCGn1
    SolutionIndex: 6
    SolutionNameMin: Cijk_Ailk_Bljk_F8B8NB8NS_BH_Bias_HAS_SAV_UserArgs_MT256x256x64_MI16x16x1_SN_LDSB1_CLR1_GRVWA8_GRVWB16_GSU0_GSUC0_GSUWGMRR0_K1_LBSPPA2048_LBSPPB512_LPA0_LPB16_LRVW8_MIWT8_8_PLR1_SU0_SUM0_SUS64_VWA8_VWB8_WGM6_WGMXCC1_WGMXCCGn1
    SolutionIndex: 7
    SolutionNameMin: Cijk_Ailk_Bljk_F8B8NB8NS_BH_Bias_HAS_SAV_UserArgs_MT256x256x64_MI16x16x1_SN_LDSB1_CLR1_GRVWA8_GRVWB8_GSU0_GSUC0_GSUWGMRR0_K1_LBSPPA2048_LBSPPB512_LPA0_LPB8_LRVW8_MIWT8_8_PLR1_SU0_SUM0_SUS64_VWA8_VWB8_WGM8_WGMXCC1_WGMXCCGn1
    SolutionIndex: 8
    SolutionNameMin: Cijk_Ailk_Bljk_F8B8NB8NS_BH_Bias_HAS_SAV_UserArgs_MT256x256x64_MI16x16x1_SN_LDSB1_CLR1_GRVWA16_GRVWB8_GSU0_GSUC0_GSUWGMRR0_K1_LBSPPA2048_LBSPPB512_LPA0_LPB8_LRVW8_MIWT8_8_PLR1_SU0_SUM0_SUS64_VWA8_VWB8_WGM8_WGMXCC1_WGMXCCGn1
    SolutionIndex: 9
    SolutionNameMin: Cijk_Ailk_Bljk_F8B8NB8NS_BH_Bias_HAS_SAV_UserArgs_MT256x256x64_MI16x16x1_SN_LDSB1_CLR1_GRVWA8_GRVWB16_GSU0_GSUC0_GSUWGMRR0_K1_LBSPPA2048_LBSPPB512_LPA0_LPB16_LRVW8_MIWT8_8_PLR1_SU0_SUM0_SUS64_VWA8_VWB8_WGM8_WGMXCC1_WGMXCCGn1
    SolutionIndex: 10
    SolutionNameMin: Cijk_Ailk_Bljk_F8B8NB8NS_BH_Bias_HAS_SAV_UserArgs_MT128x256x64_MI16x16x1_SN_LDSB1_CLR1_GRVWA16_GRVWB8_GSU0_GSUC0_GSUWGMRR0_K1_LBSPPA1024_LBSPPB512_LPA64_LPB8_LRVW8_MIWT4_8_PLR1_SU0_SUM0_SUS64_VWA4_VWB8_WGM1_WGMXCC1_WGMXCCGn1
    SolutionIndex: 11
    SolutionNameMin: Cijk_Ailk_Bljk_F8B8NB8NS_BH_Bias_HAS_SAV_UserArgs_MT128x256x64_MI16x16x1_SN_LDSB1_CLR1_GRVWA8_GRVWB16_GSU0_GSUC0_GSUWGMRR0_K1_LBSPPA1024_LBSPPB512_LPA64_LPB16_LRVW8_MIWT4_8_PLR1_SU0_SUM0_SUS64_VWA4_VWB8_WGM1_WGMXCC1_WGMXCCGn1
    SolutionIndex: 12
    SolutionNameMin: Cijk_Ailk_Bljk_F8B8NB8NS_BH_Bias_HAS_SAV_UserArgs_MT128x256x64_MI16x16x1_SN_LDSB1_CLR1_GRVWA16_GRVWB8_GSU0_GSUC0_GSUWGMRR0_K1_LBSPPA1024_LBSPPB512_LPA64_LPB8_LRVW8_MIWT4_8_PLR1_SU0_SUM0_SUS64_VWA4_VWB8_WGM6_WGMXCC1_WGMXCCGn1
    SolutionIndex: 13
    SolutionNameMin: Cijk_Ailk_Bljk_F8B8NB8NS_BH_Bias_HAS_SAV_UserArgs_MT128x256x64_MI16x16x1_SN_LDSB1_CLR1_GRVWA16_GRVWB8_GSU0_GSUC0_GSUWGMRR0_K1_LBSPPA1024_LBSPPB512_LPA64_LPB8_LRVW8_MIWT4_8_PLR1_SU0_SUM0_SUS64_VWA4_VWB8_WGM8_WGMXCC1_WGMXCCGn1
    SolutionIndex: 14
    SolutionNameMin: Cijk_Ailk_Bljk_F8B8NB8NS_BH_Bias_HAS_SAV_UserArgs_MT256x128x64_MI16x16x1_SN_LDSB1_CLR1_GRVWA16_GRVWB8_GSU0_GSUC0_GSUWGMRR0_K1_LBSPPA2048_LBSPPB256_LPA0_LPB8_LRVW8_MIWT8_4_PLR1_SU0_SUM0_SUS64_VWA8_VWB4_WGM1_WGMXCC1_WGMXCCGn1
    SolutionIndex: 15
    SolutionNameMin: Cijk_Ailk_Bljk_F8B8NB8NS_BH_Bias_HAS_SAV_UserArgs_MT256x128x64_MI16x16x1_SN_LDSB1_CLR1_GRVWA16_GRVWB16_GSU0_GSUC0_GSUWGMRR0_K1_LBSPPA2048_LBSPPB256_LPA0_LPB16_LRVW8_MIWT8_4_PLR1_SU0_SUM0_SUS64_VWA8_VWB4_WGM1_WGMXCC1_WGMXCCGn1
    SolutionIndex: 16
    SolutionNameMin: Cijk_Ailk_Bljk_F8B8NB8NS_BH_Bias_HAS_SAV_UserArgs_MT256x128x64_MI16x16x1_SN_LDSB1_CLR1_GRVWA16_GRVWB16_GSU0_GSUC0_GSUWGMRR0_K1_LBSPPA2048_LBSPPB256_LPA0_LPB16_LRVW8_MIWT8_4_PLR1_SU0_SUM0_SUS64_VWA8_VWB4_WGM4_WGMXCC1_WGMXCCGn1
    SolutionIndex: 17
    SolutionNameMin: Cijk_Ailk_Bljk_F8B8NB8NS_BH_Bias_HAS_SAV_UserArgs_MT256x128x64_MI16x16x1_SN_LDSB1_CLR1_GRVWA16_GRVWB8_GSU0_GSUC0_GSUWGMRR0_K1_LBSPPA2048_LBSPPB256_LPA0_LPB8_LRVW8_MIWT8_4_PLR1_SU0_SUM0_SUS64_VWA8_VWB4_WGM8_WGMXCC1_WGMXCCGn1
    SolutionIndex: 18
    SolutionNameMin: Cijk_Ailk_Bljk_F8B8NB8NS_BH_Bias_HAS_SAV_UserArgs_MT128x64x64_MI16x16x1_SN_LDSB0_CLR1_GRVWA8_GRVWB16_GSU0_GSUC0_GSUWGMRR0_K1_LBSPPA1024_LBSPPB128_LPA0_LPB16_LRVW8_MIWT8_1_PLR1_SU0_SUM0_SUS64_VWA8_VWB1_WGM1_WGMXCC1_WGMXCCGn1
    SolutionIndex: 19
    SolutionNameMin: Cijk_Ailk_Bljk_F8B8NB8NS_BH_Bias_HAS_SAV_UserArgs_MT128x128x64_MI16x16x1_SN_LDSB1_CLR1_GRVWA16_GRVWB8_GSU0_GSUC0_GSUWGMRR0_K1_LBSPPA1024_LBSPPB256_LPA64_LPB8_LRVW8_MIWT4_4_PLR1_SU0_SUM0_SUS64_VWA4_VWB4_WGM1_WGMXCC1_WGMXCCGn1
    SolutionIndex: 20
    SolutionNameMin: Cijk_Ailk_Bljk_F8B8NB8NS_BH_Bias_HAS_SAV_UserArgs_MT128x128x64_MI16x16x1_SN_LDSB1_CLR1_GRVWA8_GRVWB16_GSU0_GSUC0_GSUWGMRR0_K1_LBSPPA1024_LBSPPB256_LPA64_LPB16_LRVW8_MIWT4_4_PLR1_SU0_SUM0_SUS64_VWA4_VWB4_WGM1_WGMXCC1_WGMXCCGn1
    SolutionIndex: 21
    SolutionNameMin: Cijk_Ailk_Bljk_F8B8NB8NS_BH_Bias_HAS_SAV_UserArgs_MT128x128x64_MI16x16x1_SN_LDSB1_CLR1_GRVWA16_GRVWB16_GSU0_GSUC0_GSUWGMRR0_K1_LBSPPA1024_LBSPPB256_LPA64_LPB16_LRVW8_MIWT4_4_PLR1_SU0_SUM0_SUS64_VWA4_VWB4_WGM1_WGMXCC1_WGMXCCGn1
    SolutionIndex: 22
    SolutionNameMin: Cijk_Ailk_Bljk_F8B8NB8NS_BH_Bias_HAS_SAV_UserArgs_MT64x128x64_MI16x16x1_SN_LDSB0_CLR1_GRVWA16_GRVWB8_GSU0_GSUC0_GSUWGMRR0_K1_LBSPPA512_LBSPPB256_LPA32_LPB8_LRVW8_MIWT2_4_PLR1_SU0_SUM0_SUS64_VWA2_VWB4_WGM1_WGMXCC1_WGMXCCGn1
    SolutionIndex: 23
    SolutionNameMin: Cijk_Ailk_Bljk_F8B8NB8NS_BH_Bias_HAS_SAV_UserArgs_MT64x128x64_MI16x16x1_SN_LDSB0_CLR1_GRVWA8_GRVWB16_GSU0_GSUC0_GSUWGMRR0_K1_LBSPPA512_LBSPPB256_LPA32_LPB16_LRVW8_MIWT2_4_PLR1_SU0_SUM0_SUS64_VWA2_VWB4_WGM1_WGMXCC1_WGMXCCGn1
    SolutionIndex: 24
    SolutionNameMin: Cijk_Ailk_Bljk_F8B8NB8NS_BH_Bias_HAS_SAV_UserArgs_MT64x128x64_MI16x16x1_SN_LDSB0_CLR1_GRVWA16_GRVWB16_GSU0_GSUC0_GSUWGMRR0_K1_LBSPPA512_LBSPPB256_LPA32_LPB16_LRVW8_MIWT2_4_PLR1_SU0_SUM0_SUS64_VWA2_VWB4_WGM1_WGMXCC1_WGMXCCGn1
    SolutionIndex: 25
    SolutionNameMin: Cijk_Ailk_Bljk_F8B8NB8NS_BH_Bias_HAS_SAV_UserArgs_MT128x64x64_MI16x16x1_SN_LDSB0_CLR1_GRVWA8_GRVWB16_GSU0_GSUC0_GSUWGMRR0_K1_LBSPPA1024_LBSPPB128_LPA64_LPB16_LRVW8_MIWT4_2_PLR1_SU0_SUM0_SUS64_VWA4_VWB2_WGM1_WGMXCC1_WGMXCCGn1
    SolutionIndex: 26
    SolutionNameMin: Cijk_Ailk_Bljk_F8B8NB8NS_BH_Bias_HAS_SAV_UserArgs_MT128x64x64_MI16x16x1_SN_LDSB0_CLR1_GRVWA16_GRVWB16_GSU0_GSUC0_GSUWGMRR0_K1_LBSPPA1024_LBSPPB128_LPA64_LPB16_LRVW8_MIWT4_2_PLR1_SU0_SUM0_SUS64_VWA4_VWB2_WGM1_WGMXCC1_WGMXCCGn1
    SolutionIndex: 27
    SolutionNameMin: Cijk_Ailk_Bljk_F8B8NB8NS_BH_Bias_HAS_SAV_UserArgs_MT128x32x64_MI16x16x1_SN_LDSB0_CLR1_GRVWA8_GRVWB8_GSU0_GSUC0_GSUWGMRR0_K1_LBSPPA1024_LBSPPB128_LPA64_LPB8_LRVW8_MIWT4_1_PLR1_SU0_SUM0_SUS64_VWA4_VWB1_WGM1_WGMXCC1_WGMXCCGn1
    SolutionIndex: 28
    SolutionNameMin: Cijk_Ailk_Bljk_F8B8NB8NS_BH_Bias_HAS_SAV_UserArgs_MT64x64x64_MI16x16x1_SN_LDSB0_CLR1_GRVWA8_GRVWB8_GSU0_GSUC0_GSUWGMRR0_K1_LBSPPA512_LBSPPB128_LPA32_LPB8_LRVW8_MIWT2_2_PLR1_SU0_SUM0_SUS64_VWA2_VWB2_WGM1_WGMXCC1_WGMXCCGn1
    SolutionIndex: 29
    SolutionNameMin: Cijk_Ailk_Bljk_F8B8NB8NS_BH_Bias_HAS_SAV_UserArgs_MT64x64x64_MI16x16x1_SN_LDSB0_CLR1_GRVWA8_GRVWB16_GSU0_GSUC0_GSUWGMRR0_K1_LBSPPA512_LBSPPB128_LPA32_LPB16_LRVW8_MIWT2_2_PLR1_SU0_SUM0_SUS64_VWA2_VWB2_WGM1_WGMXCC1_WGMXCCGn1
    SolutionIndex: 30
    SolutionNameMin: Cijk_Ailk_Bljk_F8B8NB8NS_BH_Bias_HAS_SAV_UserArgs_MT32x64x64_MI16x16x1_SN_LDSB0_CLR1_GRVWA8_GRVWB8_GSU0_GSUC0_GSUWGMRR0_K1_LBSPPA256_LBSPPB128_LPA16_LPB8_LRVW8_MIWT1_2_PLR1_SU0_SUM0_SUS64_VWA1_VWB2_WGM1_WGMXCC1_WGMXCCGn1
    SolutionIndex: 31
    SolutionNameMin: Cijk_Ailk_Bljk_F8B8NB8NS_BH_Bias_HAS_SAV_UserArgs_MT64x32x64_MI16x16x1_SN_LDSB0_CLR1_GRVWA8_GRVWB8_GSU0_GSUC0_GSUWGMRR0_K1_LBSPPA512_LBSPPB128_LPA32_LPB8_LRVW8_MIWT2_1_PLR1_SU0_SUM0_SUS64_VWA2_VWB1_WGM1_WGMXCC1_WGMXCCGn1
    SolutionIndex: 32
    SolutionNameMin: Cijk_Ailk_Bljk_F8B8NB8NS_BH_Bias_HAS_SAV_UserArgs_MT64x32x64_MI16x16x1_SN_LDSB0_CLR1_GRVWA16_GRVWB8_GSU0_GSUC0_GSUWGMRR0_K1_LBSPPA512_LBSPPB128_LPA32_LPB8_LRVW8_MIWT2_1_PLR1_SU0_SUM0_SUS64_VWA2_VWB1_WGM1_WGMXCC1_WGMXCCGn1
    SolutionIndex: 33
    SolutionNameMin: Cijk_Ailk_Bljk_F8B8NB8NS_BH_Bias_HAS_SAV_UserArgs_MT32x32x64_MI16x16x1_SN_LDSB0_CLR1_GRVWA8_GRVWB8_GSU0_GSUC0_GSUWGMRR0_K1_LBSPPA256_LBSPPB128_LPA16_LPB8_LRVW8_MIWT1_1_PLR1_SU0_SUM0_SUS64_VWA1_VWB1_WGM1_WGMXCC1_WGMXCCGn1
    SolutionIndex: 34
    SolutionNameMin: Cijk_Ailk_Bljk_F8B8NB8NS_BH_Bias_HAS_SAV_UserArgs_MT32x32x64_MI16x16x1_SN_LDSB0_CLR1_GRVWA8_GRVWB8_GSU0_GSUC0_GSUWGMRR0_K1_LBSPPA256_LBSPPB128_LPA16_LPB8_LRVW8_MIWT1_1_PLR1_SU0_SUM0_SUS64_VWA1_VWB1_WGM4_WGMXCC1_WGMXCCGn1
    SolutionIndex: 35
    SolutionNameMin: Cijk_Ailk_Bljk_F8B8NB8NS_BH_Bias_HAS_SAV_UserArgs_MT128x256x128_MI16x16x1_SN_LDSB1_CLR1_GRVWA8_GRVWB16_GSU0_GSUC0_GSUWGMRR0_K1_LBSPPA1024_LBSPPB1024_LPA64_LPB16_LRVW8_MIWT4_8_PLR1_SU0_SUM0_SUS128_VWA4_VWB8_WGM1_WGMXCC1_WGMXCCGn1
    SolutionIndex: 36
    SolutionNameMin: Cijk_Ailk_Bljk_F8B8NB8NS_BH_Bias_HAS_SAV_UserArgs_MT128x256x128_MI16x16x1_SN_LDSB1_CLR1_GRVWA16_GRVWB16_GSU0_GSUC0_GSUWGMRR0_K1_LBSPPA1024_LBSPPB1024_LPA64_LPB16_LRVW8_MIWT4_8_PLR1_SU0_SUM0_SUS128_VWA4_VWB8_WGM1_WGMXCC1_WGMXCCGn1
    SolutionIndex: 37
    SolutionNameMin: Cijk_Ailk_Bljk_F8B8NB8NS_BH_Bias_HAS_SAV_UserArgs_MT128x256x128_MI16x16x1_SN_LDSB1_CLR1_GRVWA16_GRVWB16_GSU0_GSUC0_GSUWGMRR0_K1_LBSPPA1024_LBSPPB1024_LPA64_LPB16_LRVW8_MIWT4_8_PLR1_SU0_SUM0_SUS128_VWA4_VWB8_WGM4_WGMXCC1_WGMXCCGn1
    SolutionIndex: 38
    SolutionNameMin: Cijk_Ailk_Bljk_F8B8NB8NS_BH_Bias_HAS_SAV_UserArgs_MT128x256x128_MI16x16x1_SN_LDSB1_CLR1_GRVWA8_GRVWB16_GSU0_GSUC0_GSUWGMRR0_K1_LBSPPA1024_LBSPPB1024_LPA64_LPB16_LRVW8_MIWT4_8_PLR1_SU0_SUM0_SUS128_VWA4_VWB8_WGM6_WGMXCC1_WGMXCCGn1
    SolutionIndex: 39
    SolutionNameMin: Cijk_Ailk_Bljk_F8B8NB8NS_BH_Bias_HAS_SAV_UserArgs_MT128x256x128_MI16x16x1_SN_LDSB1_CLR1_GRVWA16_GRVWB16_GSU0_GSUC0_GSUWGMRR0_K1_LBSPPA1024_LBSPPB1024_LPA64_LPB16_LRVW8_MIWT4_8_PLR1_SU0_SUM0_SUS128_VWA4_VWB8_WGM6_WGMXCC1_WGMXCCGn1
    SolutionIndex: 40
    SolutionNameMin: Cijk_Ailk_Bljk_F8B8NB8NS_BH_Bias_HAS_SAV_UserArgs_MT128x256x128_MI16x16x1_SN_LDSB1_CLR1_GRVWA16_GRVWB16_GSU0_GSUC0_GSUWGMRR0_K1_LBSPPA1024_LBSPPB1024_LPA64_LPB16_LRVW8_MIWT4_8_PLR1_SU0_SUM0_SUS128_VWA4_VWB8_WGM8_WGMXCC1_WGMXCCGn1
    SolutionIndex: 41
    SolutionNameMin: Cijk_Ailk_Bljk_F8B8NB8NS_BH_Bias_HAS_SAV_UserArgs_MT256x144x128_MI16x16x1_SN_LDSB1_CLR1_GRVWA8_GRVWB8_GSU0_GSUC0_GSUWGMRR0_K1_LBSPPA2048_LBSPPB128_LPA64_LPB8_LRVW8_MIWT4_9_PLR1_SU0_SUM0_SUS128_VWA4_VWB1_WGM1_WGMXCC1_WGMXCCGn1
    SolutionIndex: 42
    SolutionNameMin: Cijk_Ailk_Bljk_F8B8NB8NS_BH_Bias_HAS_SAV_UserArgs_MT256x144x128_MI16x16x1_SN_LDSB1_CLR1_GRVWA16_GRVWB8_GSU0_GSUC0_GSUWGMRR0_K1_LBSPPA2048_LBSPPB128_LPA64_LPB8_LRVW8_MIWT4_9_PLR1_SU0_SUM0_SUS128_VWA4_VWB1_WGM1_WGMXCC1_WGMXCCGn1
    SolutionIndex: 43
    SolutionNameMin: Cijk_Ailk_Bljk_F8B8NB8NS_BH_Bias_HAS_SAV_UserArgs_MT256x144x128_MI16x16x1_SN_LDSB1_CLR1_GRVWA16_GRVWB8_GSU0_GSUC0_GSUWGMRR0_K1_LBSPPA2048_LBSPPB128_LPA64_LPB8_LRVW8_MIWT4_9_PLR1_SU0_SUM0_SUS128_VWA4_VWB1_WGM4_WGMXCC1_WGMXCCGn1
    SolutionIndex: 44
    SolutionNameMin: Cijk_Ailk_Bljk_F8B8NB8NS_BH_Bias_HAS_SAV_UserArgs_MT256x144x128_MI16x16x1_SN_LDSB1_CLR1_GRVWA8_GRVWB8_GSU0_GSUC0_GSUWGMRR0_K1_LBSPPA2048_LBSPPB128_LPA64_LPB8_LRVW8_MIWT4_9_PLR1_SU0_SUM0_SUS128_VWA4_VWB1_WGM6_WGMXCC1_WGMXCCGn1
    SolutionIndex: 45
    SolutionNameMin: Cijk_Ailk_Bljk_F8B8NB8NS_BH_Bias_HAS_SAV_UserArgs_MT256x144x128_MI16x16x1_SN_LDSB1_CLR1_GRVWA16_GRVWB8_GSU0_GSUC0_GSUWGMRR0_K1_LBSPPA2048_LBSPPB128_LPA64_LPB8_LRVW8_MIWT4_9_PLR1_SU0_SUM0_SUS128_VWA4_VWB1_WGM6_WGMXCC1_WGMXCCGn1
    SolutionIndex: 46
    SolutionNameMin: Cijk_Ailk_Bljk_F8B8NB8NS_BH_Bias_HAS_SAV_UserArgs_MT256x144x128_MI16x16x1_SN_LDSB1_CLR1_GRVWA16_GRVWB8_GSU0_GSUC0_GSUWGMRR0_K1_LBSPPA2048_LBSPPB128_LPA64_LPB8_LRVW8_MIWT4_9_PLR1_SU0_SUM0_SUS128_VWA4_VWB1_WGM8_WGMXCC1_WGMXCCGn1
    SolutionIndex: 47
    SolutionNameMin: Cijk_Ailk_Bljk_F8B8NB8NS_BH_Bias_HAS_SAV_UserArgs_MT256x128x128_MI16x16x1_SN_LDSB1_CLR1_GRVWA16_GRVWB8_GSU0_GSUC0_GSUWGMRR0_K1_LBSPPA2048_LBSPPB512_LPA0_LPB8_LRVW8_MIWT8_4_PLR1_SU0_SUM0_SUS128_VWA8_VWB4_WGM1_WGMXCC1_WGMXCCGn1
    SolutionIndex: 48
    SolutionNameMin: Cijk_Ailk_Bljk_F8B8NB8NS_BH_Bias_HAS_SAV_UserArgs_MT256x128x128_MI16x16x1_SN_LDSB1_CLR1_GRVWA16_GRVWB16_GSU0_GSUC0_GSUWGMRR0_K1_LBSPPA2048_LBSPPB512_LPA0_LPB16_LRVW8_MIWT8_4_PLR1_SU0_SUM0_SUS128_VWA8_VWB4_WGM4_WGMXCC1_WGMXCCGn1
    SolutionIndex: 49
    SolutionNameMin: Cijk_Ailk_Bljk_F8B8NB8NS_BH_Bias_HAS_SAV_UserArgs_MT256x128x128_MI16x16x1_SN_LDSB1_CLR1_GRVWA16_GRVWB8_GSU0_GSUC0_GSUWGMRR0_K1_LBSPPA2048_LBSPPB512_LPA0_LPB8_LRVW8_MIWT8_4_PLR1_SU0_SUM0_SUS128_VWA8_VWB4_WGM6_WGMXCC1_WGMXCCGn1
    SolutionIndex: 50
    SolutionNameMin: Cijk_Ailk_Bljk_F8B8NB8NS_BH_Bias_HAS_SAV_UserArgs_MT256x128x128_MI16x16x1_SN_LDSB1_CLR1_GRVWA16_GRVWB8_GSU0_GSUC0_GSUWGMRR0_K1_LBSPPA2048_LBSPPB512_LPA0_LPB8_LRVW8_MIWT8_4_PLR1_SU0_SUM0_SUS128_VWA8_VWB4_WGM8_WGMXCC1_WGMXCCGn1
    SolutionIndex: 51
    SolutionNameMin: Cijk_Ailk_Bljk_F8B8NB8NS_BH_Bias_HAS_SAV_UserArgs_MT128x144x128_MI16x16x1_SN_LDSB1_CLR1_GRVWA16_GRVWB8_GSU0_GSUC0_GSUWGMRR0_K1_LBSPPA1024_LBSPPB128_LPA32_LPB8_LRVW8_MIWT2_9_PLR1_SU0_SUM0_SUS128_VWA2_VWB1_WGM1_WGMXCC1_WGMXCCGn1
    SolutionIndex: 52
    SolutionNameMin: Cijk_Ailk_Bljk_F8B8NB8NS_BH_Bias_HAS_SAV_UserArgs_MT128x144x128_MI16x16x1_SN_LDSB1_CLR1_GRVWA16_GRVWB8_GSU0_GSUC0_GSUWGMRR0_K1_LBSPPA1024_LBSPPB128_LPA32_LPB8_LRVW8_MIWT2_9_PLR1_SU0_SUM0_SUS128_VWA2_VWB1_WGM4_WGMXCC1_WGMXCCGn1
    SolutionIndex: 53
    SolutionNameMin: Cijk_Ailk_Bljk_F8B8NB8NS_BH_Bias_HAS_SAV_UserArgs_MT128x128x128_MI16x16x1_SN_LDSB1_CLR1_GRVWA16_GRVWB16_GSU0_GSUC0_GSUWGMRR0_K1_LBSPPA1024_LBSPPB512_LPA64_LPB16_LRVW8_MIWT4_4_PLR1_SU0_SUM0_SUS128_VWA4_VWB4_WGM1_WGMXCC1_WGMXCCGn1
    SolutionIndex: 54
    SolutionNameMin: Cijk_Ailk_Bljk_F8B8NB8NS_BH_Bias_HAS_SAV_UserArgs_MT128x128x128_MI16x16x1_SN_LDSB1_CLR1_GRVWA16_GRVWB16_GSU0_GSUC0_GSUWGMRR0_K1_LBSPPA1024_LBSPPB512_LPA64_LPB16_LRVW8_MIWT4_4_PLR1_SU0_SUM0_SUS128_VWA4_VWB4_WGM4_WGMXCC1_WGMXCCGn1
    SolutionIndex: 55
    SolutionNameMin: Cijk_Ailk_Bljk_F8B8NB8NS_BH_Bias_HAS_SAV_UserArgs_MT128x128x128_MI16x16x1_SN_LDSB1_CLR1_GRVWA16_GRVWB16_GSU0_GSUC0_GSUWGMRR0_K1_LBSPPA1024_LBSPPB512_LPA64_LPB16_LRVW8_MIWT4_4_PLR1_SU0_SUM0_SUS128_VWA4_VWB4_WGM6_WGMXCC1_WGMXCCGn1
    SolutionIndex: 56
    SolutionNameMin: Cijk_Ailk_Bljk_F8B8NB8NS_BH_Bias_HAS_SAV_UserArgs_MT128x128x128_MI16x16x1_SN_LDSB1_CLR1_GRVWA16_GRVWB16_GSU0_GSUC0_GSUWGMRR0_K1_LBSPPA1024_LBSPPB512_LPA64_LPB16_LRVW8_MIWT4_4_PLR1_SU0_SUM0_SUS128_VWA4_VWB4_WGM8_WGMXCC1_WGMXCCGn1
    SolutionIndex: 57
    SolutionNameMin: Cijk_Ailk_Bljk_F8B8NB8NS_BH_Bias_HAS_SAV_UserArgs_MT64x128x128_MI16x16x1_SN_LDSB1_CLR1_GRVWA16_GRVWB16_GSU0_GSUC0_GSUWGMRR0_K1_LBSPPA512_LBSPPB512_LPA32_LPB16_LRVW8_MIWT2_4_PLR1_SU0_SUM0_SUS128_VWA2_VWB4_WGM1_WGMXCC1_WGMXCCGn1
    SolutionIndex: 58
    SolutionNameMin: Cijk_Ailk_Bljk_F8B8NB8NS_BH_Bias_HAS_SAV_UserArgs_MT64x128x128_MI16x16x1_SN_LDSB1_CLR1_GRVWA16_GRVWB16_GSU0_GSUC0_GSUWGMRR0_K1_LBSPPA512_LBSPPB512_LPA32_LPB16_LRVW8_MIWT2_4_PLR1_SU0_SUM0_SUS128_VWA2_VWB4_WGM4_WGMXCC1_WGMXCCGn1
    SolutionIndex: 59
    SolutionNameMin: Cijk_Ailk_Bljk_F8B8NB8NS_BH_Bias_HAS_SAV_UserArgs_MT128x64x128_MI16x16x1_SN_LDSB1_CLR1_GRVWA16_GRVWB16_GSU0_GSUC0_GSUWGMRR0_K1_LBSPPA1024_LBSPPB256_LPA64_LPB16_LRVW8_MIWT4_2_PLR1_SU0_SUM0_SUS128_VWA4_VWB2_WGM4_WGMXCC1_WGMXCCGn1
    SolutionIndex: 60
    SolutionNameMin: Cijk_Ailk_Bljk_F8B8NB8NS_BH_Bias_HAS_SAV_UserArgs_MT128x64x128_MI16x16x1_SN_LDSB1_CLR1_GRVWA16_GRVWB16_GSU0_GSUC0_GSUWGMRR0_K1_LBSPPA1024_LBSPPB256_LPA64_LPB16_LRVW8_MIWT4_2_PLR1_SU0_SUM0_SUS128_VWA4_VWB2_WGM8_WGMXCC1_WGMXCCGn1
    SolutionIndex: 61
    SolutionNameMin: Cijk_Ailk_Bljk_F8B8NB8NS_BH_Bias_HAS_SAV_UserArgs_MT64x64x128_MI16x16x1_SN_LDSB1_CLR1_GRVWA16_GRVWB8_GSU0_GSUC0_GSUWGMRR0_K1_LBSPPA512_LBSPPB256_LPA32_LPB8_LRVW8_MIWT2_2_PLR1_SU0_SUM0_SUS128_VWA2_VWB2_WGM1_WGMXCC1_WGMXCCGn1
    SolutionIndex: 62
    SolutionNameMin: Cijk_Ailk_Bljk_F8B8NB8NS_BH_Bias_HAS_SAV_UserArgs_MT64x64x128_MI16x16x1_SN_LDSB1_CLR1_GRVWA8_GRVWB16_GSU0_GSUC0_GSUWGMRR0_K1_LBSPPA512_LBSPPB256_LPA32_LPB16_LRVW8_MIWT2_2_PLR1_SU0_SUM0_SUS128_VWA2_VWB2_WGM1_WGMXCC1_WGMXCCGn1
    SolutionIndex: 63
    SolutionNameMin: Cijk_Ailk_Bljk_F8B8NB8NS_BH_Bias_HAS_SAV_UserArgs_MT64x64x128_MI16x16x1_SN_LDSB1_CLR1_GRVWA16_GRVWB16_GSU0_GSUC0_GSUWGMRR0_K1_LBSPPA512_LBSPPB256_LPA32_LPB16_LRVW8_MIWT2_2_PLR1_SU0_SUM0_SUS128_VWA2_VWB2_WGM1_WGMXCC1_WGMXCCGn1
    SolutionIndex: 64
    SolutionNameMin: Cijk_Ailk_Bljk_F8B8NB8NS_BH_Bias_HAS_SAV_UserArgs_MT64x64x128_MI16x16x1_SN_LDSB1_CLR1_GRVWA16_GRVWB16_GSU0_GSUC0_GSUWGMRR0_K1_LBSPPA512_LBSPPB256_LPA32_LPB16_LRVW8_MIWT2_2_PLR1_SU0_SUM0_SUS128_VWA2_VWB2_WGM4_WGMXCC1_WGMXCCGn1
    SolutionIndex: 65
    SolutionNameMin: Cijk_Ailk_Bljk_F8B8NB8NS_BH_Bias_HAS_SAV_UserArgs_MT64x64x128_MI16x16x1_SN_LDSB1_CLR1_GRVWA16_GRVWB16_GSU0_GSUC0_GSUWGMRR0_K1_LBSPPA512_LBSPPB256_LPA32_LPB16_LRVW8_MIWT2_2_PLR1_SU0_SUM0_SUS128_VWA2_VWB2_WGM6_WGMXCC1_WGMXCCGn1
    SolutionIndex: 66
    SolutionNameMin: Cijk_Ailk_Bljk_F8B8NB8NS_BH_Bias_HAS_SAV_UserArgs_MT64x64x128_MI16x16x1_SN_LDSB1_CLR1_GRVWA16_GRVWB16_GSU0_GSUC0_GSUWGMRR0_K1_LBSPPA512_LBSPPB256_LPA32_LPB16_LRVW8_MIWT2_2_PLR1_SU0_SUM0_SUS128_VWA2_VWB2_WGM8_WGMXCC1_WGMXCCGn1
    SolutionIndex: 67
    SolutionNameMin: Cijk_Ailk_Bljk_F8B8NB8NS_BH_Bias_HAS_SAV_UserArgs_MT32x64x128_MI16x16x1_SN_LDSB0_CLR1_GRVWA8_GRVWB8_GSU0_GSUC0_GSUWGMRR0_K1_LBSPPA256_LBSPPB256_LPA16_LPB8_LRVW8_MIWT1_2_PLR1_SU0_SUM0_SUS128_VWA1_VWB2_WGM1_WGMXCC1_WGMXCCGn1
    SolutionIndex: 68
    SolutionNameMin: Cijk_Ailk_Bljk_F8B8NB8NS_BH_Bias_HAS_SAV_UserArgs_MT32x64x128_MI16x16x1_SN_LDSB0_CLR1_GRVWA8_GRVWB16_GSU0_GSUC0_GSUWGMRR0_K1_LBSPPA256_LBSPPB256_LPA16_LPB16_LRVW8_MIWT1_2_PLR1_SU0_SUM0_SUS128_VWA1_VWB2_WGM1_WGMXCC1_WGMXCCGn1
    SolutionIndex: 69
    SolutionNameMin: Cijk_Ailk_Bljk_F8B8NB8NS_BH_Bias_HAS_SAV_UserArgs_MT32x64x128_MI16x16x1_SN_LDSB0_CLR1_GRVWA16_GRVWB16_GSU0_GSUC0_GSUWGMRR0_K1_LBSPPA256_LBSPPB256_LPA16_LPB16_LRVW8_MIWT1_2_PLR1_SU0_SUM0_SUS128_VWA1_VWB2_WGM1_WGMXCC1_WGMXCCGn1
    SolutionIndex: 70
    SolutionNameMin: Cijk_Ailk_Bljk_F8B8NB8NS_BH_Bias_HAS_SAV_UserArgs_MT32x64x128_MI16x16x1_SN_LDSB0_CLR1_GRVWA8_GRVWB16_GSU0_GSUC0_GSUWGMRR0_K1_LBSPPA256_LBSPPB256_LPA16_LPB16_LRVW8_MIWT1_2_PLR1_SU0_SUM0_SUS128_VWA1_VWB2_WGM4_WGMXCC1_WGMXCCGn1
    SolutionIndex: 71
    SolutionNameMin: Cijk_Ailk_Bljk_F8B8NB8NS_BH_Bias_HAS_SAV_UserArgs_MT64x32x128_MI16x16x1_SN_LDSB0_CLR1_GRVWA8_GRVWB8_GSU0_GSUC0_GSUWGMRR0_K1_LBSPPA512_LBSPPB128_LPA32_LPB8_LRVW8_MIWT2_1_PLR1_SU0_SUM0_SUS128_VWA2_VWB1_WGM1_WGMXCC1_WGMXCCGn1
    SolutionIndex: 72
    SolutionNameMin: Cijk_Ailk_Bljk_F8B8NB8NS_BH_Bias_HAS_SAV_UserArgs_MT64x32x128_MI16x16x1_SN_LDSB0_CLR1_GRVWA16_GRVWB8_GSU0_GSUC0_GSUWGMRR0_K1_LBSPPA512_LBSPPB128_LPA32_LPB8_LRVW8_MIWT2_1_PLR1_SU0_SUM0_SUS128_VWA2_VWB1_WGM1_WGMXCC1_WGMXCCGn1
    SolutionIndex: 73
    SolutionNameMin: Cijk_Ailk_Bljk_F8B8NB8NS_BH_Bias_HAS_SAV_UserArgs_MT64x32x128_MI16x16x1_SN_LDSB0_CLR1_GRVWA8_GRVWB16_GSU0_GSUC0_GSUWGMRR0_K1_LBSPPA512_LBSPPB128_LPA32_LPB16_LRVW8_MIWT2_1_PLR1_SU0_SUM0_SUS128_VWA2_VWB1_WGM1_WGMXCC1_WGMXCCGn1
    SolutionIndex: 74
    SolutionNameMin: Cijk_Ailk_Bljk_F8B8NB8NS_BH_Bias_HAS_SAV_UserArgs_MT64x32x128_MI16x16x1_SN_LDSB0_CLR1_GRVWA16_GRVWB16_GSU0_GSUC0_GSUWGMRR0_K1_LBSPPA512_LBSPPB128_LPA32_LPB16_LRVW8_MIWT2_1_PLR1_SU0_SUM0_SUS128_VWA2_VWB1_WGM1_WGMXCC1_WGMXCCGn1
    SolutionIndex: 75
    SolutionNameMin: Cijk_Ailk_Bljk_F8B8NB8NS_BH_Bias_HAS_SAV_UserArgs_MT32x32x128_MI16x16x1_SN_LDSB0_CLR1_GRVWA8_GRVWB8_GSU0_GSUC0_GSUWGMRR0_K1_LBSPPA256_LBSPPB128_LPA16_LPB8_LRVW8_MIWT1_1_PLR1_SU0_SUM0_SUS128_VWA1_VWB1_WGM1_WGMXCC1_WGMXCCGn1
    SolutionIndex: 76
    SolutionNameMin: Cijk_Ailk_Bljk_F8B8NB8NS_BH_Bias_HAS_SAV_UserArgs_MT32x32x128_MI16x16x1_SN_LDSB0_CLR1_GRVWA8_GRVWB16_GSU0_GSUC0_GSUWGMRR0_K1_LBSPPA256_LBSPPB128_LPA16_LPB16_LRVW8_MIWT1_1_PLR1_SU0_SUM0_SUS128_VWA1_VWB1_WGM1_WGMXCC1_WGMXCCGn1
    SolutionIndex: 77
    SolutionNameMin: Cijk_Ailk_Bljk_F8B8NB8NS_BH_Bias_HAS_SAV_UserArgs_MT32x32x128_MI16x16x1_SN_LDSB0_CLR1_GRVWA16_GRVWB16_GSU0_GSUC0_GSUWGMRR0_K1_LBSPPA256_LBSPPB128_LPA16_LPB16_LRVW8_MIWT1_1_PLR1_SU0_SUM0_SUS128_VWA1_VWB1_WGM1_WGMXCC1_WGMXCCGn1
    SolutionIndex: 78
    SolutionNameMin: Cijk_Ailk_Bljk_F8B8NB8NS_BH_Bias_HAS_SAV_UserArgs_MT128x64x256_MI16x16x1_SN_LDSB1_CLR1_GRVWA16_GRVWB16_GSU0_GSUC0_GSUWGMRR0_K1_LBSPPA1024_LBSPPB512_LPA64_LPB16_LRVW8_MIWT4_2_PLR1_SU0_SUM0_SUS256_VWA4_VWB2_WGM1_WGMXCC1_WGMXCCGn1
    SolutionIndex: 79
    SolutionNameMin: Cijk_Ailk_Bljk_F8B8NB8NS_BH_Bias_HAS_SAV_UserArgs_MT64x64x256_MI16x16x1_SN_LDSB1_CLR1_GRVWA16_GRVWB16_GSU0_GSUC0_GSUWGMRR0_K1_LBSPPA512_LBSPPB512_LPA32_LPB16_LRVW8_MIWT2_2_PLR1_SU0_SUM0_SUS256_VWA2_VWB2_WGM1_WGMXCC1_WGMXCCGn1
    SolutionIndex: 80
    SolutionNameMin: Cijk_Ailk_Bljk_F8B8NB8NS_BH_Bias_HAS_SAV_UserArgs_MT64x32x256_MI16x16x1_SN_LDSB1_CLR1_GRVWA16_GRVWB16_GSU0_GSUC0_GSUWGMRR0_K1_LBSPPA512_LBSPPB256_LPA32_LPB16_LRVW8_MIWT2_1_PLR1_SU0_SUM0_SUS256_VWA2_VWB1_WGM1_WGMXCC1_WGMXCCGn1
    SolutionIndex: 81
    SolutionNameMin: Cijk_Ailk_Bljk_F8B8NB8NS_BH_Bias_HAS_SAV_UserArgs_MT64x32x256_MI16x16x1_SN_LDSB1_CLR1_GRVWA16_GRVWB16_GSU0_GSUC0_GSUWGMRR0_K1_LBSPPA512_LBSPPB256_LPA32_LPB16_LRVW8_MIWT2_1_PLR1_SU0_SUM0_SUS256_VWA2_VWB1_WGM4_WGMXCC1_WGMXCCGn1
    SolutionIndex: 82
    SolutionNameMin: Cijk_Ailk_Bljk_F8B8NB8NS_BH_Bias_HAS_SAV_UserArgs_MT64x32x256_MI16x16x1_SN_LDSB1_CLR1_GRVWA16_GRVWB16_GSU0_GSUC0_GSUWGMRR0_K1_LBSPPA512_LBSPPB256_LPA32_LPB16_LRVW8_MIWT2_1_PLR1_SU0_SUM0_SUS256_VWA2_VWB1_WGM6_WGMXCC1_WGMXCCGn1
    SolutionIndex: 83
    SolutionNameMin: Cijk_Ailk_Bljk_F8B8NB8NS_BH_Bias_HAS_SAV_UserArgs_MT32x32x256_MI16x16x1_SN_LDSB1_CLR1_GRVWA16_GRVWB8_GSU0_GSUC0_GSUWGMRR0_K1_LBSPPA256_LBSPPB256_LPA16_LPB8_LRVW8_MIWT1_1_PLR1_SU0_SUM0_SUS256_VWA1_VWB1_WGM1_WGMXCC1_WGMXCCGn1
    SolutionIndex: 84
    SolutionNameMin: Cijk_Ailk_Bljk_F8B8NB8NS_BH_Bias_HAS_SAV_UserArgs_MT32x32x256_MI16x16x1_SN_LDSB1_CLR1_GRVWA8_GRVWB16_GSU0_GSUC0_GSUWGMRR0_K1_LBSPPA256_LBSPPB256_LPA16_LPB16_LRVW8_MIWT1_1_PLR1_SU0_SUM0_SUS256_VWA1_VWB1_WGM1_WGMXCC1_WGMXCCGn1
    SolutionIndex: 85
    SolutionNameMin: Cijk_Ailk_Bljk_F8B8NB8NS_BH_Bias_HAS_SAV_UserArgs_MT32x32x256_MI16x16x1_SN_LDSB1_CLR1_GRVWA16_GRVWB16_GSU0_GSUC0_GSUWGMRR0_K1_LBSPPA256_LBSPPB256_LPA16_LPB16_LRVW8_MIWT1_1_PLR1_SU0_SUM0_SUS256_VWA1_VWB1_WGM4_WGMXCC1_WGMXCCGn1
    SolutionIndex: 86
    SolutionNameMin: Cijk_Ailk_Bljk_F8B8NB8NS_BH_Bias_HAS_SAV_UserArgs_MT32x32x256_MI16x16x1_SN_LDSB1_CLR1_GRVWA8_GRVWB16_GSU0_GSUC0_GSUWGMRR0_K1_LBSPPA256_LBSPPB256_LPA16_LPB16_LRVW8_MIWT1_1_PLR1_SU0_SUM0_SUS256_VWA1_VWB1_WGM8_WGMXCC1_WGMXCCGn1
    SolutionIndex: 87
    SolutionNameMin: Cijk_Ailk_Bljk_F8B8NB8NS_BH_Bias_HAS_SAV_UserArgs_MT32x32x256_MI16x16x1_SN_LDSB1_CLR1_GRVWA16_GRVWB16_GSU0_GSUC0_GSUWGMRR0_K1_LBSPPA256_LBSPPB256_LPA16_LPB16_LRVW8_MIWT1_1_PLR1_SU0_SUM0_SUS256_VWA1_VWB1_WGM8_WGMXCC1_WGMXCCGn1
- - - [128, 128, 1, 128, 128, 128, 128, 128]
    - [33, 0.56]
  - - [128, 128, 1, 256, 128, 128, 128, 256]
    - [76, 1.01]
  - - [128, 128, 1, 512, 128, 128, 128, 512]
    - [76, 1.77]
  - - [128, 128, 1, 1024, 128, 128, 128, 1024]
    - [75, 2.75]
  - - [128, 128, 1, 2048, 128, 128, 128, 2048]
    - [75, 3.86]
  - - [128, 128, 1, 4096, 128, 128, 128, 4096]
    - [77, 4.79]
  - - [128, 128, 1, 8192, 128, 128, 128, 8192]
    - [77, 5.47]
  - - [128, 256, 1, 128, 128, 128, 128, 128]
    - [76, 1.15]
  - - [128, 256, 1, 256, 128, 128, 128, 256]
    - [76, 2.03]
  - - [128, 256, 1, 512, 128, 128, 128, 512]
    - [75, 3.54]
  - - [128, 256, 1, 1024, 128, 128, 128, 1024]
    - [76, 5.56]
  - - [128, 256, 1, 2048, 128, 128, 128, 2048]
    - [76, 7.67]
  - - [128, 256, 1, 4096, 128, 128, 128, 4096]
    - [77, 9.6]
  - - [128, 256, 1, 8192, 128, 128, 128, 8192]
    - [77, 10.93]
  - - [128, 512, 1, 128, 128, 128, 128, 128]
    - [76, 2.28]
  - - [128, 512, 1, 256, 128, 128, 128, 256]
    - [75, 4.07]
  - - [128, 512, 1, 512, 128, 128, 128, 512]
    - [76, 7.09]
  - - [128, 512, 1, 1024, 128, 128, 128, 1024]
    - [75, 10.98]
  - - [128, 512, 1, 2048, 128, 128, 128, 2048]
    - [76, 15.3]
  - - [128, 512, 1, 4096, 128, 128, 128, 4096]
    - [75, 19.11]
  - - [128, 512, 1, 8192, 128, 128, 128, 8192]
    - [83, 21.76]
  - - [128, 1024, 1, 128, 128, 128, 128, 128]
    - [33, 4.52]
  - - [128, 1024, 1, 256, 128, 128, 128, 256]
    - [33, 8.0]
  - - [128, 1024, 1, 512, 128, 128, 128, 512]
    - [75, 13.65]
  - - [128, 1024, 1, 1024, 128, 128, 128, 1024]
    - [75, 21.58]
  - - [128, 1024, 1, 2048, 128, 128, 128, 2048]
    - [75, 29.97]
  - - [128, 1024, 1, 4096, 128, 128, 128, 4096]
    - [75, 37.58]
  - - [128, 1024, 1, 8192, 128, 128, 128, 8192]
    - [77, 42.9]
  - - [128, 2048, 1, 128, 128, 128, 128, 128]
    - [71, 8.27]
  - - [128, 2048, 1, 256, 128, 128, 128, 256]
    - [73, 14.72]
  - - [128, 2048, 1, 512, 128, 128, 128, 512]
    - [74, 24.78]
  - - [128, 2048, 1, 1024, 128, 128, 128, 1024]
    - [73, 37.64]
  - - [128, 2048, 1, 2048, 128, 128, 128, 2048]
    - [80, 51.71]
  - - [128, 2048, 1, 4096, 128, 128, 128, 4096]
    - [80, 63.77]
  - - [128, 2048, 1, 8192, 128, 128, 128, 8192]
    - [80, 72.25]
  - - [128, 4096, 1, 128, 128, 128, 128, 128]
    - [29, 15.19]
  - - [128, 4096, 1, 256, 128, 128, 128, 256]
    - [29, 26.56]
  - - [128, 4096, 1, 512, 128, 128, 128, 512]
    - [61, 42.96]
  - - [128, 4096, 1, 1024, 128, 128, 128, 1024]
    - [61, 63.83]
  - - [128, 4096, 1, 2048, 128, 128, 128, 2048]
    - [61, 84.57]
  - - [128, 4096, 1, 4096, 128, 128, 128, 4096]
    - [79, 102.3]
  - - [128, 4096, 1, 8192, 128, 128, 128, 8192]
    - [79, 112.36]
  - - [128, 8192, 1, 128, 128, 128, 128, 128]
    - [18, 26.08]
  - - [128, 8192, 1, 256, 128, 128, 128, 256]
    - [25, 44.72]
  - - [128, 8192, 1, 512, 128, 128, 128, 512]
    - [23, 71.56]
  - - [128, 8192, 1, 1024, 128, 128, 128, 1024]
    - [22, 103.24]
  - - [128, 8192, 1, 2048, 128, 128, 128, 2048]
    - [22, 133.54]
  - - [128, 8192, 1, 4096, 128, 128, 128, 4096]
    - [57, 143.46]
  - - [128, 8192, 1, 8192, 128, 128, 128, 8192]
    - [58, 155.56]
  - - [256, 128, 1, 128, 256, 256, 256, 128]
    - [30, 1.01]
  - - [256, 128, 1, 256, 256, 256, 256, 256]
    - [33, 1.98]
  - - [256, 128, 1, 512, 256, 256, 256, 512]
    - [75, 3.47]
  - - [256, 128, 1, 1024, 256, 256, 256, 1024]
    - [76, 5.51]
  - - [256, 128, 1, 2048, 256, 256, 256, 2048]
    - [75, 7.58]
  - - [256, 128, 1, 4096, 256, 256, 256, 4096]
    - [75, 9.55]
  - - [256, 128, 1, 8192, 256, 256, 256, 8192]
    - [75, 10.89]
  - - [256, 256, 1, 128, 256, 256, 256, 128]
    - [34, 2.12]
  - - [256, 256, 1, 256, 256, 256, 256, 256]
    - [84, 3.9]
  - - [256, 256, 1, 512, 256, 256, 256, 512]
    - [75, 6.84]
  - - [256, 256, 1, 1024, 256, 256, 256, 1024]
    - [76, 10.94]
  - - [256, 256, 1, 2048, 256, 256, 256, 2048]
    - [76, 15.26]
  - - [256, 256, 1, 4096, 256, 256, 256, 4096]
    - [75, 19.07]
  - - [256, 256, 1, 8192, 256, 256, 256, 8192]
    - [75, 21.72]
  - - [256, 512, 1, 128, 256, 256, 256, 128]
    - [77, 4.13]
  - - [256, 512, 1, 256, 256, 256, 256, 256]
    - [75, 7.74]
  - - [256, 512, 1, 512, 256, 256, 256, 512]
    - [76, 13.52]
  - - [256, 512, 1, 1024, 256, 256, 256, 1024]
    - [76, 21.44]
  - - [256, 512, 1, 2048, 256, 256, 256, 2048]
    - [75, 29.78]
  - - [256, 512, 1, 4096, 256, 256, 256, 4096]
    - [75, 37.33]
  - - [256, 512, 1, 8192, 256, 256, 256, 8192]
    - [75, 42.81]
  - - [256, 1024, 1, 128, 256, 256, 256, 128]
    - [67, 8.01]
  - - [256, 1024, 1, 256, 256, 256, 256, 256]
    - [32, 14.37]
  - - [256, 1024, 1, 512, 256, 256, 256, 512]
    - [68, 24.51]
  - - [256, 1024, 1, 1024, 256, 256, 256, 1024]
    - [73, 37.44]
  - - [256, 1024, 1, 2048, 256, 256, 256, 2048]
    - [80, 51.86]
  - - [256, 1024, 1, 4096, 256, 256, 256, 4096]
    - [80, 63.59]
  - - [256, 1024, 1, 8192, 256, 256, 256, 8192]
    - [80, 72.22]
  - - [256, 2048, 1, 128, 256, 256, 256, 128]
    - [62, 14.6]
  - - [256, 2048, 1, 256, 256, 256, 256, 256]
    - [29, 26.18]
  - - [256, 2048, 1, 512, 256, 256, 256, 512]
    - [61, 42.91]
  - - [256, 2048, 1, 1024, 256, 256, 256, 1024]
    - [61, 63.87]
  - - [256, 2048, 1, 2048, 256, 256, 256, 2048]
    - [61, 84.17]
  - - [256, 2048, 1, 4096, 256, 256, 256, 4096]
    - [79, 101.98]
  - - [256, 2048, 1, 8192, 256, 256, 256, 8192]
    - [80, 111.03]
  - - [256, 4096, 1, 128, 256, 256, 256, 128]
    - [25, 25.86]
  - - [256, 4096, 1, 256, 256, 256, 256, 256]
    - [25, 44.85]
  - - [256, 4096, 1, 512, 256, 256, 256, 512]
    - [23, 71.13]
  - - [256, 4096, 1, 1024, 256, 256, 256, 1024]
    - [22, 102.84]
  - - [256, 4096, 1, 2048, 256, 256, 256, 2048]
    - [22, 133.57]
  - - [256, 4096, 1, 4096, 256, 256, 256, 4096]
    - [57, 145.9]
  - - [256, 4096, 1, 8192, 256, 256, 256, 8192]
    - [57, 154.14]
  - - [256, 8192, 1, 128, 256, 256, 256, 128]
    - [20, 41.78]
  - - [256, 8192, 1, 256, 256, 256, 256, 256]
    - [21, 71.42]
  - - [256, 8192, 1, 512, 256, 256, 256, 512]
    - [53, 113.94]
  - - [256, 8192, 1, 1024, 256, 256, 256, 1024]
    - [53, 159.3]
  - - [256, 8192, 1, 2048, 256, 256, 256, 2048]
    - [53, 203.0]
  - - [256, 8192, 1, 4096, 256, 256, 256, 4096]
    - [56, 224.36]
  - - [256, 8192, 1, 8192, 256, 256, 256, 8192]
    - [55, 222.57]
  - - [512, 128, 1, 128, 512, 512, 512, 128]
    - [76, 2.23]
  - - [512, 128, 1, 256, 512, 512, 512, 256]
    - [76, 4.03]
  - - [512, 128, 1, 512, 512, 512, 512, 512]
    - [76, 7.03]
  - - [512, 128, 1, 1024, 512, 512, 512, 1024]
    - [76, 10.92]
  - - [512, 128, 1, 2048, 512, 512, 512, 2048]
    - [75, 15.34]
  - - [512, 128, 1, 4096, 512, 512, 512, 4096]
    - [75, 19.03]
  - - [512, 128, 1, 8192, 512, 512, 512, 8192]
    - [85, 18.5]
  - - [512, 256, 1, 128, 512, 512, 512, 128]
    - [33, 4.33]
  - - [512, 256, 1, 256, 512, 512, 512, 256]
    - [75, 7.85]
  - - [512, 256, 1, 512, 512, 512, 512, 512]
    - [76, 13.45]
  - - [512, 256, 1, 1024, 512, 512, 512, 1024]
    - [76, 21.35]
  - - [512, 256, 1, 2048, 512, 512, 512, 2048]
    - [75, 29.79]
  - - [512, 256, 1, 4096, 512, 512, 512, 4096]
    - [75, 37.41]
  - - [512, 256, 1, 8192, 512, 512, 512, 8192]
    - [87, 37.28]
  - - [512, 512, 1, 128, 512, 512, 512, 128]
    - [71, 8.3]
  - - [512, 512, 1, 256, 512, 512, 512, 256]
    - [72, 14.68]
  - - [512, 512, 1, 512, 512, 512, 512, 512]
    - [73, 24.68]
  - - [512, 512, 1, 1024, 512, 512, 512, 1024]
    - [73, 37.81]
  - - [512, 512, 1, 2048, 512, 512, 512, 2048]
    - [80, 51.62]
  - - [512, 512, 1, 4096, 512, 512, 512, 4096]
    - [80, 63.87]
  - - [512, 512, 1, 8192, 512, 512, 512, 8192]
    - [74, 62.58]
  - - [512, 1024, 1, 128, 512, 512, 512, 128]
    - [29, 15.28]
  - - [512, 1024, 1, 256, 512, 512, 512, 256]
    - [29, 26.53]
  - - [512, 1024, 1, 512, 512, 512, 512, 512]
    - [61, 43.22]
  - - [512, 1024, 1, 1024, 512, 512, 512, 1024]
    - [61, 63.74]
  - - [512, 1024, 1, 2048, 512, 512, 512, 2048]
    - [61, 84.53]
  - - [512, 1024, 1, 4096, 512, 512, 512, 4096]
    - [61, 100.5]
  - - [512, 1024, 1, 8192, 512, 512, 512, 8192]
    - [63, 104.11]
  - - [512, 2048, 1, 128, 512, 512, 512, 128]
    - [25, 25.93]
  - - [512, 2048, 1, 256, 512, 512, 512, 256]
    - [23, 45.44]
  - - [512, 2048, 1, 512, 512, 512, 512, 512]
    - [23, 71.85]
  - - [512, 2048, 1, 1024, 512, 512, 512, 1024]
    - [22, 103.81]
  - - [512, 2048, 1, 2048, 512, 512, 512, 2048]
    - [22, 133.5]
  - - [512, 2048, 1, 4096, 512, 512, 512, 4096]
    - [78, 146.1]
  - - [512, 2048, 1, 8192, 512, 512, 512, 8192]
    - [59, 147.43]
  - - [512, 4096, 1, 128, 512, 512, 512, 128]
    - [20, 41.64]
  - - [512, 4096, 1, 256, 512, 512, 512, 256]
    - [53, 70.91]
  - - [512, 4096, 1, 512, 512, 512, 512, 512]
    - [53, 113.48]
  - - [512, 4096, 1, 1024, 512, 512, 512, 1024]
    - [53, 158.49]
  - - [512, 4096, 1, 2048, 512, 512, 512, 2048]
    - [53, 202.28]
  - - [512, 4096, 1, 4096, 512, 512, 512, 4096]
    - [53, 210.26]
  - - [512, 4096, 1, 8192, 512, 512, 512, 8192]
    - [53, 202.83]
  - - [512, 8192, 1, 128, 512, 512, 512, 128]
    - [52, 61.41]
  - - [512, 8192, 1, 256, 512, 512, 512, 256]
    - [51, 108.1]
  - - [512, 8192, 1, 512, 512, 512, 512, 512]
    - [51, 173.23]
  - - [512, 8192, 1, 1024, 512, 512, 512, 1024]
    - [51, 244.31]
  - - [512, 8192, 1, 2048, 512, 512, 512, 2048]
    - [47, 253.14]
  - - [512, 8192, 1, 4096, 512, 512, 512, 4096]
    - [43, 267.53]
  - - [512, 8192, 1, 8192, 512, 512, 512, 8192]
    - [51, 252.21]
  - - [1024, 128, 1, 128, 1024, 1024, 1024, 128]
    - [75, 4.36]
  - - [1024, 128, 1, 256, 1024, 1024, 1024, 256]
    - [75, 7.96]
  - - [1024, 128, 1, 512, 1024, 1024, 1024, 512]
    - [76, 13.5]
  - - [1024, 128, 1, 1024, 1024, 1024, 1024, 1024]
    - [76, 21.66]
  - - [1024, 128, 1, 2048, 1024, 1024, 1024, 2048]
    - [75, 30.09]
  - - [1024, 128, 1, 4096, 1024, 1024, 1024, 4096]
    - [87, 30.91]
  - - [1024, 128, 1, 8192, 1024, 1024, 1024, 8192]
    - [86, 30.17]
  - - [1024, 256, 1, 128, 1024, 1024, 1024, 128]
    - [73, 8.33]
  - - [1024, 256, 1, 256, 1024, 1024, 1024, 256]
    - [31, 14.65]
  - - [1024, 256, 1, 512, 1024, 1024, 1024, 512]
    - [73, 25.02]
  - - [1024, 256, 1, 1024, 1024, 1024, 1024, 1024]
    - [73, 37.58]
  - - [1024, 256, 1, 2048, 1024, 1024, 1024, 2048]
    - [80, 51.27]
  - - [1024, 256, 1, 4096, 1024, 1024, 1024, 4096]
    - [70, 55.02]
  - - [1024, 256, 1, 8192, 1024, 1024, 1024, 8192]
    - [82, 58.85]
  - - [1024, 512, 1, 128, 1024, 1024, 1024, 128]
    - [29, 15.22]
  - - [1024, 512, 1, 256, 1024, 1024, 1024, 256]
    - [28, 26.33]
  - - [1024, 512, 1, 512, 1024, 1024, 1024, 512]
    - [61, 43.11]
  - - [1024, 512, 1, 1024, 1024, 1024, 1024, 1024]
    - [61, 63.74]
  - - [1024, 512, 1, 2048, 1024, 1024, 1024, 2048]
    - [61, 84.02]
  - - [1024, 512, 1, 4096, 1024, 1024, 1024, 4096]
    - [64, 94.42]
  - - [1024, 512, 1, 8192, 1024, 1024, 1024, 8192]
    - [66, 102.32]
  - - [1024, 1024, 1, 128, 1024, 1024, 1024, 128]
    - [25, 25.43]
  - - [1024, 1024, 1, 256, 1024, 1024, 1024, 256]
    - [23, 44.43]
  - - [1024, 1024, 1, 512, 1024, 1024, 1024, 512]
    - [23, 72.26]
  - - [1024, 1024, 1, 1024, 1024, 1024, 1024, 1024]
    - [22, 103.0]
  - - [1024, 1024, 1, 2048, 1024, 1024, 1024, 2048]
    - [22, 132.94]
  - - [1024, 1024, 1, 4096, 1024, 1024, 1024, 4096]
    - [59, 140.23]
  - - [1024, 1024, 1, 8192, 1024, 1024, 1024, 8192]
    - [59, 146.98]
  - - [1024, 2048, 1, 128, 1024, 1024, 1024, 128]
    - [20, 41.0]
  - - [1024, 2048, 1, 256, 1024, 1024, 1024, 256]
    - [53, 70.51]
  - - [1024, 2048, 1, 512, 1024, 1024, 1024, 512]
    - [53, 112.39]
  - - [1024, 2048, 1, 1024, 1024, 1024, 1024, 1024]
    - [53, 160.24]
  - - [1024, 2048, 1, 2048, 1024, 1024, 1024, 2048]
    - [53, 202.76]
  - - [1024, 2048, 1, 4096, 1024, 1024, 1024, 4096]
    - [55, 208.19]
  - - [1024, 2048, 1, 8192, 1024, 1024, 1024, 8192]
    - [54, 198.72]
  - - [1024, 4096, 1, 128, 1024, 1024, 1024, 128]
    - [15, 58.8]
  - - [1024, 4096, 1, 256, 1024, 1024, 1024, 256]
    - [15, 99.34]
  - - [1024, 4096, 1, 512, 1024, 1024, 1024, 512]
    - [15, 153.56]
  - - [1024, 4096, 1, 1024, 1024, 1024, 1024, 1024]
    - [10, 215.48]
  - - [1024, 4096, 1, 2048, 1024, 1024, 1024, 2048]
    - [47, 254.36]
  - - [1024, 4096, 1, 4096, 1024, 1024, 1024, 4096]
    - [42, 264.24]
  - - [1024, 4096, 1, 8192, 1024, 1024, 1024, 8192]
    - [35, 245.08]
  - - [1024, 8192, 1, 128, 1024, 1024, 1024, 128]
    - [42, 89.74]
  - - [1024, 8192, 1, 256, 1024, 1024, 1024, 256]
    - [46, 152.09]
  - - [1024, 8192, 1, 512, 1024, 1024, 1024, 512]
    - [42, 243.14]
  - - [1024, 8192, 1, 1024, 1024, 1024, 1024, 1024]
    - [42, 274.95]
  - - [1024, 8192, 1, 2048, 1024, 1024, 1024, 2048]
    - [44, 330.18]
  - - [1024, 8192, 1, 4096, 1024, 1024, 1024, 4096]
    - [45, 360.67]
  - - [1024, 8192, 1, 8192, 1024, 1024, 1024, 8192]
    - [42, 362.6]
  - - [2048, 128, 1, 128, 2048, 2048, 2048, 128]
    - [71, 8.26]
  - - [2048, 128, 1, 256, 2048, 2048, 2048, 256]
    - [72, 14.49]
  - - [2048, 128, 1, 512, 2048, 2048, 2048, 512]
    - [73, 24.64]
  - - [2048, 128, 1, 1024, 2048, 2048, 2048, 1024]
    - [73, 37.72]
  - - [2048, 128, 1, 2048, 2048, 2048, 2048, 2048]
    - [69, 43.58]
  - - [2048, 128, 1, 4096, 2048, 2048, 2048, 4096]
    - [82, 51.91]
  - - [2048, 128, 1, 8192, 2048, 2048, 2048, 8192]
    - [81, 58.71]
  - - [2048, 256, 1, 128, 2048, 2048, 2048, 128]
    - [29, 15.12]
  - - [2048, 256, 1, 256, 2048, 2048, 2048, 256]
    - [29, 26.53]
  - - [2048, 256, 1, 512, 2048, 2048, 2048, 512]
    - [62, 42.79]
  - - [2048, 256, 1, 1024, 2048, 2048, 2048, 1024]
    - [61, 62.92]
  - - [2048, 256, 1, 2048, 2048, 2048, 2048, 2048]
    - [64, 77.86]
  - - [2048, 256, 1, 4096, 2048, 2048, 2048, 4096]
    - [64, 92.46]
  - - [2048, 256, 1, 8192, 2048, 2048, 2048, 8192]
    - [65, 102.85]
  - - [2048, 512, 1, 128, 2048, 2048, 2048, 128]
    - [26, 25.55]
  - - [2048, 512, 1, 256, 2048, 2048, 2048, 256]
    - [23, 44.63]
  - - [2048, 512, 1, 512, 2048, 2048, 2048, 512]
    - [22, 71.21]
  - - [2048, 512, 1, 1024, 2048, 2048, 2048, 1024]
    - [22, 103.29]
  - - [2048, 512, 1, 2048, 2048, 2048, 2048, 2048]
    - [60, 120.65]
  - - [2048, 512, 1, 4096, 2048, 2048, 2048, 4096]
    - [59, 139.57]
  - - [2048, 512, 1, 8192, 2048, 2048, 2048, 8192]
    - [60, 146.25]
  - - [2048, 1024, 1, 128, 2048, 2048, 2048, 128]
    - [20, 42.08]
  - - [2048, 1024, 1, 256, 2048, 2048, 2048, 256]
    - [20, 71.53]
  - - [2048, 1024, 1, 512, 2048, 2048, 2048, 512]
    - [53, 113.53]
  - - [2048, 1024, 1, 1024, 2048, 2048, 2048, 1024]
    - [53, 160.51]
  - - [2048, 1024, 1, 2048, 2048, 2048, 2048, 2048]
    - [56, 182.92]
  - - [2048, 1024, 1, 4096, 2048, 2048, 2048, 4096]
    - [55, 208.29]
  - - [2048, 1024, 1, 8192, 2048, 2048, 2048, 8192]
    - [54, 199.62]
  - - [2048, 2048, 1, 128, 2048, 2048, 2048, 128]
    - [15, 58.12]
  - - [2048, 2048, 1, 256, 2048, 2048, 2048, 256]
    - [15, 98.44]
  - - [2048, 2048, 1, 512, 2048, 2048, 2048, 512]
    - [10, 154.63]
  - - [2048, 2048, 1, 1024, 2048, 2048, 2048, 1024]
    - [14, 208.45]
  - - [2048, 2048, 1, 2048, 2048, 2048, 2048, 2048]
    - [17, 249.05]
  - - [2048, 2048, 1, 4096, 2048, 2048, 2048, 4096]
    - [49, 263.57]
  - - [2048, 2048, 1, 8192, 2048, 2048, 2048, 8192]
    - [45, 241.36]
  - - [2048, 4096, 1, 128, 2048, 2048, 2048, 128]
    - [6, 72.98]
  - - [2048, 4096, 1, 256, 2048, 2048, 2048, 256]
    - [1, 123.4]
  - - [2048, 4096, 1, 512, 2048, 2048, 2048, 512]
    - [3, 183.35]
  - - [2048, 4096, 1, 1024, 2048, 2048, 2048, 1024]
    - [9, 247.91]
  - - [2048, 4096, 1, 2048, 2048, 2048, 2048, 2048]
    - [4, 282.83]
  - - [2048, 4096, 1, 4096, 2048, 2048, 2048, 4096]
    - [46, 285.9]
  - - [2048, 4096, 1, 8192, 2048, 2048, 2048, 8192]
    - [43, 317.03]
  - - [2048, 8192, 1, 128, 2048, 2048, 2048, 128]
    - [43, 97.69]
  - - [2048, 8192, 1, 256, 2048, 2048, 2048, 256]
    - [46, 162.47]
  - - [2048, 8192, 1, 512, 2048, 2048, 2048, 512]
    - [42, 233.74]
  - - [2048, 8192, 1, 1024, 2048, 2048, 2048, 1024]
    - [42, 288.67]
  - - [2048, 8192, 1, 2048, 2048, 2048, 2048, 2048]
    - [46, 318.51]
  - - [2048, 8192, 1, 4096, 2048, 2048, 2048, 4096]
    - [46, 352.74]
  - - [2048, 8192, 1, 8192, 2048, 2048, 2048, 8192]
    - [45, 383.17]
  - - [4096, 128, 1, 128, 4096, 4096, 4096, 128]
    - [27, 14.7]
  - - [4096, 128, 1, 256, 4096, 4096, 4096, 256]
    - [62, 25.27]
  - - [4096, 128, 1, 512, 4096, 4096, 4096, 512]
    - [62, 41.66]
  - - [4096, 128, 1, 1024, 4096, 4096, 4096, 1024]
    - [61, 61.81]
  - - [4096, 128, 1, 2048, 4096, 4096, 4096, 2048]
    - [64, 76.22]
  - - [4096, 128, 1, 4096, 4096, 4096, 4096, 4096]
    - [64, 92.81]
  - - [4096, 128, 1, 8192, 4096, 4096, 4096, 8192]
    - [66, 103.57]
  - - [4096, 256, 1, 128, 4096, 4096, 4096, 128]
    - [24, 24.92]
  - - [4096, 256, 1, 256, 4096, 4096, 4096, 256]
    - [23, 43.92]
  - - [4096, 256, 1, 512, 4096, 4096, 4096, 512]
    - [22, 71.1]
  - - [4096, 256, 1, 1024, 4096, 4096, 4096, 1024]
    - [22, 102.33]
  - - [4096, 256, 1, 2048, 4096, 4096, 4096, 2048]
    - [59, 119.37]
  - - [4096, 256, 1, 4096, 4096, 4096, 4096, 4096]
    - [60, 139.41]
  - - [4096, 256, 1, 8192, 4096, 4096, 4096, 8192]
    - [60, 146.38]
  - - [4096, 512, 1, 128, 4096, 4096, 4096, 128]
    - [20, 41.03]
  - - [4096, 512, 1, 256, 4096, 4096, 4096, 256]
    - [20, 70.59]
  - - [4096, 512, 1, 512, 4096, 4096, 4096, 512]
    - [53, 113.57]
  - - [4096, 512, 1, 1024, 4096, 4096, 4096, 1024]
    - [56, 152.49]
  - - [4096, 512, 1, 2048, 4096, 4096, 4096, 2048]
    - [55, 180.71]
  - - [4096, 512, 1, 4096, 4096, 4096, 4096, 4096]
    - [56, 205.71]
  - - [4096, 512, 1, 8192, 4096, 4096, 4096, 8192]
    - [56, 199.97]
  - - [4096, 1024, 1, 128, 4096, 4096, 4096, 128]
    - [15, 58.36]
  - - [4096, 1024, 1, 256, 4096, 4096, 4096, 256]
    - [15, 98.93]
  - - [4096, 1024, 1, 512, 4096, 4096, 4096, 512]
    - [15, 152.83]
  - - [4096, 1024, 1, 1024, 4096, 4096, 4096, 1024]
    - [16, 203.35]
  - - [4096, 1024, 1, 2048, 4096, 4096, 4096, 2048]
    - [50, 248.28]
  - - [4096, 1024, 1, 4096, 4096, 4096, 4096, 4096]
    - [39, 268.58]
  - - [4096, 1024, 1, 8192, 4096, 4096, 4096, 8192]
    - [38, 239.73]
  - - [4096, 2048, 1, 128, 4096, 4096, 4096, 128]
    - [0, 72.08]
  - - [4096, 2048, 1, 256, 4096, 4096, 4096, 256]
    - [1, 122.31]
  - - [4096, 2048, 1, 512, 4096, 4096, 4096, 512]
    - [6, 180.81]
  - - [4096, 2048, 1, 1024, 4096, 4096, 4096, 1024]
    - [8, 244.74]
  - - [4096, 2048, 1, 2048, 4096, 4096, 4096, 2048]
    - [8, 281.21]
  - - [4096, 2048, 1, 4096, 4096, 4096, 4096, 4096]
    - [36, 269.12]
  - - [4096, 2048, 1, 8192, 4096, 4096, 4096, 8192]
    - [35, 290.83]
  - - [4096, 4096, 1, 128, 4096, 4096, 4096, 128]
    - [9, 78.91]
  - - [4096, 4096, 1, 256, 4096, 4096, 4096, 256]
    - [1, 130.59]
  - - [4096, 4096, 1, 512, 4096, 4096, 4096, 512]
    - [9, 198.19]
  - - [4096, 4096, 1, 1024, 4096, 4096, 4096, 1024]
    - [7, 243.34]
  - - [4096, 4096, 1, 2048, 4096, 4096, 4096, 2048]
    - [46, 261.43]
  - - [4096, 4096, 1, 4096, 4096, 4096, 4096, 4096]
    - [43, 294.58]
  - - [4096, 4096, 1, 8192, 4096, 4096, 4096, 8192]
    - [2, 322.3]
  - - [4096, 8192, 1, 128, 4096, 4096, 4096, 128]
    - [42, 106.91]
  - - [4096, 8192, 1, 256, 4096, 4096, 4096, 256]
    - [42, 172.22]
  - - [4096, 8192, 1, 512, 4096, 4096, 4096, 512]
    - [45, 233.59]
  - - [4096, 8192, 1, 1024, 4096, 4096, 4096, 1024]
    - [45, 273.41]
  - - [4096, 8192, 1, 2048, 4096, 4096, 4096, 2048]
    - [45, 315.11]
  - - [4096, 8192, 1, 4096, 4096, 4096, 4096, 4096]
    - [46, 359.24]
  - - [4096, 8192, 1, 8192, 4096, 4096, 4096, 8192]
    - [45, 402.63]
  - - [8192, 128, 1, 128, 8192, 8192, 8192, 128]
    - [25, 26.33]
  - - [8192, 128, 1, 256, 8192, 8192, 8192, 256]
    - [25, 44.86]
  - - [8192, 128, 1, 512, 8192, 8192, 8192, 512]
    - [22, 71.83]
  - - [8192, 128, 1, 1024, 8192, 8192, 8192, 1024]
    - [22, 103.51]
  - - [8192, 128, 1, 2048, 8192, 8192, 8192, 2048]
    - [60, 119.29]
  - - [8192, 128, 1, 4096, 8192, 8192, 8192, 4096]
    - [59, 139.23]
  - - [8192, 128, 1, 8192, 8192, 8192, 8192, 8192]
    - [59, 141.56]
  - - [8192, 256, 1, 128, 8192, 8192, 8192, 128]
    - [19, 41.18]
  - - [8192, 256, 1, 256, 8192, 8192, 8192, 256]
    - [20, 71.51]
  - - [8192, 256, 1, 512, 8192, 8192, 8192, 512]
    - [53, 112.79]
  - - [8192, 256, 1, 1024, 8192, 8192, 8192, 1024]
    - [55, 159.26]
  - - [8192, 256, 1, 2048, 8192, 8192, 8192, 2048]
    - [55, 183.19]
  - - [8192, 256, 1, 4096, 8192, 8192, 8192, 4096]
    - [56, 210.89]
  - - [8192, 256, 1, 8192, 8192, 8192, 8192, 8192]
    - [55, 198.24]
  - - [8192, 512, 1, 128, 8192, 8192, 8192, 128]
    - [15, 58.51]
  - - [8192, 512, 1, 256, 8192, 8192, 8192, 256]
    - [16, 98.6]
  - - [8192, 512, 1, 512, 8192, 8192, 8192, 512]
    - [12, 152.34]
  - - [8192, 512, 1, 1024, 8192, 8192, 8192, 1024]
    - [13, 206.95]
  - - [8192, 512, 1, 2048, 8192, 8192, 8192, 2048]
    - [48, 246.59]
  - - [8192, 512, 1, 4096, 8192, 8192, 8192, 4096]
    - [40, 261.67]
  - - [8192, 512, 1, 8192, 8192, 8192, 8192, 8192]
    - [37, 248.14]
  - - [8192, 1024, 1, 128, 8192, 8192, 8192, 128]
    - [6, 73.14]
  - - [8192, 1024, 1, 256, 8192, 8192, 8192, 256]
    - [4, 121.74]
  - - [8192, 1024, 1, 512, 8192, 8192, 8192, 512]
    - [6, 182.65]
  - - [8192, 1024, 1, 1024, 8192, 8192, 8192, 1024]
    - [6, 245.42]
  - - [8192, 1024, 1, 2048, 8192, 8192, 8192, 2048]
    - [5, 280.3]
  - - [8192, 1024, 1, 4096, 8192, 8192, 8192, 4096]
    - [35, 272.96]
  - - [8192, 1024, 1, 8192, 8192, 8192, 8192, 8192]
    - [36, 305.45]
  - - [8192, 2048, 1, 128, 8192, 8192, 8192, 128]
    - [6, 77.81]
  - - [8192, 2048, 1, 256, 8192, 8192, 8192, 256]
    - [6, 129.33]
  - - [8192, 2048, 1, 512, 8192, 8192, 8192, 512]
    - [9, 195.56]
  - - [8192, 2048, 1, 1024, 8192, 8192, 8192, 1024]
    - [4, 242.03]
  - - [8192, 2048, 1, 2048, 8192, 8192, 8192, 2048]
    - [45, 248.03]
  - - [8192, 2048, 1, 4096, 8192, 8192, 8192, 4096]
    - [5, 281.43]
  - - [8192, 2048, 1, 8192, 8192, 8192, 8192, 8192]
    - [1, 349.25]
  - - [8192, 4096, 1, 128, 8192, 8192, 8192, 128]
    - [9, 84.29]
  - - [8192, 4096, 1, 256, 8192, 8192, 8192, 256]
    - [21, 141.93]
  - - [8192, 4096, 1, 512, 8192, 8192, 8192, 512]
    - [11, 199.2]
  - - [8192, 4096, 1, 1024, 8192, 8192, 8192, 1024]
    - [39, 238.19]
  - - [8192, 4096, 1, 2048, 8192, 8192, 8192, 2048]
    - [45, 290.47]
  - - [8192, 4096, 1, 4096, 8192, 8192, 8192, 4096]
    - [45, 325.68]
  - - [8192, 4096, 1, 8192, 8192, 8192, 8192, 8192]
    - [2, 368.23]
  - - [8192, 8192, 1, 128, 8192, 8192, 8192, 128]
    - [41, 105.26]
  - - [8192, 8192, 1, 256, 8192, 8192, 8192, 256]
    - [43, 150.37]
  - - [8192, 8192, 1, 512, 8192, 8192, 8192, 512]
    - [46, 216.57]
  - - [8192, 8192, 1, 1024, 8192, 8192, 8192, 1024]
    - [46, 280.83]
  - - [8192, 8192, 1, 2048, 8192, 8192, 8192, 2048]
    - [45, 343.8]
  - - [8192, 8192, 1, 4096, 8192, 8192, 8192, 4096]
    - [45, 382.12]
  - - [8192, 8192, 1, 8192, 8192, 8192, 8192, 8192]
    - [46, 410.98]
- null
- null
- ExperimentalStreamK
- GridBased
