projects/hipblaslt/library/src/amd_detail/rocblaslt/src/Tensile/Logic/asm_full/aquavanjaram/gfx942_228cu/StreamK/aquavanjaram942_Cijk_Alik_Bjlk_F8NSS_BH_Bias_HAS_SAV_UserArgs.yaml
- {MinimumRequiredVersion: 4.33.0}
- aquavanjaram942
- {Architecture: gfx942, CUCount: 228}
- [Device 0049, Device 0050]
    SolutionIndex: 0
    SolutionNameMin: Cijk_Alik_Bjlk_F8NSS_BH_Bias_HAS_SAV_UserArgs_MT256x256x64_MI16x16x1_SN_LDSB1_CLR1_GRVWA8_GRVWB16_GSU0_GSUC0_GSUWGMRR0_K1_LBSPPA512_LBSPPB2048_LPA8_LPB0_LRVW8_MIWT8_8_PLR1_SU0_SUM0_SUS64_VWA8_VWB8_WGM1_WGMXCC1_WGMXCCGn1
    SolutionIndex: 1
    SolutionNameMin: Cijk_Alik_Bjlk_F8NSS_BH_Bias_HAS_SAV_UserArgs_MT256x256x64_MI16x16x1_SN_LDSB1_CLR1_GRVWA8_GRVWB16_GSU0_GSUC0_GSUWGMRR0_K1_LBSPPA512_LBSPPB2048_LPA8_LPB0_LRVW8_MIWT8_8_PLR1_SU0_SUM0_SUS64_VWA8_VWB8_WGM4_WGMXCC1_WGMXCCGn1
    SolutionIndex: 2
    SolutionNameMin: Cijk_Alik_Bjlk_F8NSS_BH_Bias_HAS_SAV_UserArgs_MT256x256x64_MI16x16x1_SN_LDSB1_CLR1_GRVWA8_GRVWB16_GSU0_GSUC0_GSUWGMRR0_K1_LBSPPA512_LBSPPB2048_LPA8_LPB0_LRVW8_MIWT8_8_PLR1_SU0_SUM0_SUS64_VWA8_VWB8_WGM8_WGMXCC1_WGMXCCGn1
    SolutionIndex: 3
    SolutionNameMin: Cijk_Alik_Bjlk_F8NSS_BH_Bias_HAS_SAV_UserArgs_MT128x256x64_MI16x16x1_SN_LDSB1_CLR1_GRVWA16_GRVWB8_GSU0_GSUC0_GSUWGMRR0_K1_LBSPPA256_LBSPPB2048_LPA16_LPB0_LRVW8_MIWT4_8_PLR1_SU0_SUM0_SUS64_VWA4_VWB8_WGM1_WGMXCC1_WGMXCCGn1
    SolutionIndex: 4
    SolutionNameMin: Cijk_Alik_Bjlk_F8NSS_BH_Bias_HAS_SAV_UserArgs_MT128x256x64_MI16x16x1_SN_LDSB1_CLR1_GRVWA8_GRVWB16_GSU0_GSUC0_GSUWGMRR0_K1_LBSPPA256_LBSPPB2048_LPA8_LPB0_LRVW8_MIWT4_8_PLR1_SU0_SUM0_SUS64_VWA4_VWB8_WGM1_WGMXCC1_WGMXCCGn1
    SolutionIndex: 5
    SolutionNameMin: Cijk_Alik_Bjlk_F8NSS_BH_Bias_HAS_SAV_UserArgs_MT128x256x64_MI16x16x1_SN_LDSB1_CLR1_GRVWA16_GRVWB16_GSU0_GSUC0_GSUWGMRR0_K1_LBSPPA256_LBSPPB2048_LPA16_LPB0_LRVW8_MIWT4_8_PLR1_SU0_SUM0_SUS64_VWA4_VWB8_WGM1_WGMXCC1_WGMXCCGn1
    SolutionIndex: 6
    SolutionNameMin: Cijk_Alik_Bjlk_F8NSS_BH_Bias_HAS_SAV_UserArgs_MT128x256x64_MI16x16x1_SN_LDSB1_CLR1_GRVWA16_GRVWB8_GSU0_GSUC0_GSUWGMRR0_K1_LBSPPA256_LBSPPB2048_LPA16_LPB0_LRVW8_MIWT4_8_PLR1_SU0_SUM0_SUS64_VWA4_VWB8_WGM4_WGMXCC1_WGMXCCGn1
    SolutionIndex: 7
    SolutionNameMin: Cijk_Alik_Bjlk_F8NSS_BH_Bias_HAS_SAV_UserArgs_MT128x256x64_MI16x16x1_SN_LDSB1_CLR1_GRVWA8_GRVWB16_GSU0_GSUC0_GSUWGMRR0_K1_LBSPPA256_LBSPPB2048_LPA8_LPB0_LRVW8_MIWT4_8_PLR1_SU0_SUM0_SUS64_VWA4_VWB8_WGM4_WGMXCC1_WGMXCCGn1
    SolutionIndex: 8
    SolutionNameMin: Cijk_Alik_Bjlk_F8NSS_BH_Bias_HAS_SAV_UserArgs_MT128x256x64_MI16x16x1_SN_LDSB1_CLR1_GRVWA16_GRVWB16_GSU0_GSUC0_GSUWGMRR0_K1_LBSPPA256_LBSPPB2048_LPA16_LPB0_LRVW8_MIWT4_8_PLR1_SU0_SUM0_SUS64_VWA4_VWB8_WGM4_WGMXCC1_WGMXCCGn1
    SolutionIndex: 9
    SolutionNameMin: Cijk_Alik_Bjlk_F8NSS_BH_Bias_HAS_SAV_UserArgs_MT128x256x64_MI16x16x1_SN_LDSB1_CLR1_GRVWA8_GRVWB16_GSU0_GSUC0_GSUWGMRR0_K1_LBSPPA256_LBSPPB2048_LPA8_LPB0_LRVW8_MIWT4_8_PLR1_SU0_SUM0_SUS64_VWA4_VWB8_WGM6_WGMXCC1_WGMXCCGn1
    SolutionIndex: 10
    SolutionNameMin: Cijk_Alik_Bjlk_F8NSS_BH_Bias_HAS_SAV_UserArgs_MT128x256x64_MI16x16x1_SN_LDSB1_CLR1_GRVWA16_GRVWB16_GSU0_GSUC0_GSUWGMRR0_K1_LBSPPA256_LBSPPB2048_LPA16_LPB0_LRVW8_MIWT4_8_PLR1_SU0_SUM0_SUS64_VWA4_VWB8_WGM6_WGMXCC1_WGMXCCGn1
    SolutionIndex: 11
    SolutionNameMin: Cijk_Alik_Bjlk_F8NSS_BH_Bias_HAS_SAV_UserArgs_MT256x128x64_MI16x16x1_SN_LDSB1_CLR1_GRVWA8_GRVWB16_GSU0_GSUC0_GSUWGMRR0_K1_LBSPPA512_LBSPPB1024_LPA8_LPB64_LRVW8_MIWT8_4_PLR1_SU0_SUM0_SUS64_VWA8_VWB4_WGM1_WGMXCC1_WGMXCCGn1
    SolutionIndex: 12
    SolutionNameMin: Cijk_Alik_Bjlk_F8NSS_BH_Bias_HAS_SAV_UserArgs_MT256x128x64_MI16x16x1_SN_LDSB1_CLR1_GRVWA16_GRVWB16_GSU0_GSUC0_GSUWGMRR0_K1_LBSPPA512_LBSPPB1024_LPA16_LPB64_LRVW8_MIWT8_4_PLR1_SU0_SUM0_SUS64_VWA8_VWB4_WGM1_WGMXCC1_WGMXCCGn1
    SolutionIndex: 13
    SolutionNameMin: Cijk_Alik_Bjlk_F8NSS_BH_Bias_HAS_SAV_UserArgs_MT256x128x64_MI16x16x1_SN_LDSB1_CLR1_GRVWA8_GRVWB8_GSU0_GSUC0_GSUWGMRR0_K1_LBSPPA512_LBSPPB1024_LPA8_LPB64_LRVW8_MIWT8_4_PLR1_SU0_SUM0_SUS64_VWA8_VWB4_WGM6_WGMXCC1_WGMXCCGn1
    SolutionIndex: 14
    SolutionNameMin: Cijk_Alik_Bjlk_F8NSS_BH_Bias_HAS_SAV_UserArgs_MT64x128x64_MI16x16x1_SN_LDSB0_CLR1_GRVWA16_GRVWB16_GSU0_GSUC0_GSUWGMRR0_K1_LBSPPA128_LBSPPB1024_LPA16_LPB0_LRVW8_MIWT1_8_PLR1_SU0_SUM0_SUS64_VWA1_VWB8_WGM1_WGMXCC1_WGMXCCGn1
    SolutionIndex: 15
    SolutionNameMin: Cijk_Alik_Bjlk_F8NSS_BH_Bias_HAS_SAV_UserArgs_MT128x128x64_MI16x16x1_SN_LDSB1_CLR1_GRVWA8_GRVWB8_GSU0_GSUC0_GSUWGMRR0_K1_LBSPPA256_LBSPPB1024_LPA8_LPB64_LRVW8_MIWT4_4_PLR1_SU0_SUM0_SUS64_VWA4_VWB4_WGM1_WGMXCC1_WGMXCCGn1
    SolutionIndex: 16
    SolutionNameMin: Cijk_Alik_Bjlk_F8NSS_BH_Bias_HAS_SAV_UserArgs_MT128x128x64_MI16x16x1_SN_LDSB1_CLR1_GRVWA8_GRVWB16_GSU0_GSUC0_GSUWGMRR0_K1_LBSPPA256_LBSPPB1024_LPA8_LPB64_LRVW8_MIWT4_4_PLR1_SU0_SUM0_SUS64_VWA4_VWB4_WGM1_WGMXCC1_WGMXCCGn1
    SolutionIndex: 17
    SolutionNameMin: Cijk_Alik_Bjlk_F8NSS_BH_Bias_HAS_SAV_UserArgs_MT128x128x64_MI16x16x1_SN_LDSB1_CLR1_GRVWA16_GRVWB16_GSU0_GSUC0_GSUWGMRR0_K1_LBSPPA256_LBSPPB1024_LPA16_LPB64_LRVW8_MIWT4_4_PLR1_SU0_SUM0_SUS64_VWA4_VWB4_WGM1_WGMXCC1_WGMXCCGn1
    SolutionIndex: 18
    SolutionNameMin: Cijk_Alik_Bjlk_F8NSS_BH_Bias_HAS_SAV_UserArgs_MT128x128x64_MI16x16x1_SN_LDSB1_CLR1_GRVWA16_GRVWB16_GSU0_GSUC0_GSUWGMRR0_K1_LBSPPA256_LBSPPB1024_LPA16_LPB64_LRVW8_MIWT4_4_PLR1_SU0_SUM0_SUS64_VWA4_VWB4_WGM6_WGMXCC1_WGMXCCGn1
    SolutionIndex: 19
    SolutionNameMin: Cijk_Alik_Bjlk_F8NSS_BH_Bias_HAS_SAV_UserArgs_MT128x64x64_MI16x16x1_SN_LDSB0_CLR1_GRVWA8_GRVWB8_GSU0_GSUC0_GSUWGMRR0_K1_LBSPPA256_LBSPPB512_LPA8_LPB32_LRVW8_MIWT4_2_PLR1_SU0_SUM0_SUS64_VWA4_VWB2_WGM1_WGMXCC1_WGMXCCGn1
    SolutionIndex: 20
    SolutionNameMin: Cijk_Alik_Bjlk_F8NSS_BH_Bias_HAS_SAV_UserArgs_MT128x64x64_MI16x16x1_SN_LDSB0_CLR1_GRVWA16_GRVWB8_GSU0_GSUC0_GSUWGMRR0_K1_LBSPPA256_LBSPPB512_LPA16_LPB32_LRVW8_MIWT4_2_PLR1_SU0_SUM0_SUS64_VWA4_VWB2_WGM1_WGMXCC1_WGMXCCGn1
    SolutionIndex: 21
    SolutionNameMin: Cijk_Alik_Bjlk_F8NSS_BH_Bias_HAS_SAV_UserArgs_MT128x64x64_MI16x16x1_SN_LDSB0_CLR1_GRVWA8_GRVWB16_GSU0_GSUC0_GSUWGMRR0_K1_LBSPPA256_LBSPPB512_LPA8_LPB32_LRVW8_MIWT4_2_PLR1_SU0_SUM0_SUS64_VWA4_VWB2_WGM1_WGMXCC1_WGMXCCGn1
    SolutionIndex: 22
    SolutionNameMin: Cijk_Alik_Bjlk_F8NSS_BH_Bias_HAS_SAV_UserArgs_MT128x64x64_MI16x16x1_SN_LDSB0_CLR1_GRVWA16_GRVWB8_GSU0_GSUC0_GSUWGMRR0_K1_LBSPPA256_LBSPPB512_LPA16_LPB32_LRVW8_MIWT4_2_PLR1_SU0_SUM0_SUS64_VWA4_VWB2_WGM4_WGMXCC1_WGMXCCGn1
    SolutionIndex: 23
    SolutionNameMin: Cijk_Alik_Bjlk_F8NSS_BH_Bias_HAS_SAV_UserArgs_MT128x64x64_MI16x16x1_SN_LDSB0_CLR1_GRVWA8_GRVWB16_GSU0_GSUC0_GSUWGMRR0_K1_LBSPPA256_LBSPPB512_LPA8_LPB32_LRVW8_MIWT4_2_PLR1_SU0_SUM0_SUS64_VWA4_VWB2_WGM4_WGMXCC1_WGMXCCGn1
    SolutionIndex: 24
    SolutionNameMin: Cijk_Alik_Bjlk_F8NSS_BH_Bias_HAS_SAV_UserArgs_MT128x64x64_MI16x16x1_SN_LDSB0_CLR1_GRVWA16_GRVWB8_GSU0_GSUC0_GSUWGMRR0_K1_LBSPPA256_LBSPPB512_LPA16_LPB32_LRVW8_MIWT4_2_PLR1_SU0_SUM0_SUS64_VWA4_VWB2_WGM6_WGMXCC1_WGMXCCGn1
    SolutionIndex: 25
    SolutionNameMin: Cijk_Alik_Bjlk_F8NSS_BH_Bias_HAS_SAV_UserArgs_MT128x64x64_MI16x16x1_SN_LDSB0_CLR1_GRVWA8_GRVWB16_GSU0_GSUC0_GSUWGMRR0_K1_LBSPPA256_LBSPPB512_LPA8_LPB32_LRVW8_MIWT4_2_PLR1_SU0_SUM0_SUS64_VWA4_VWB2_WGM6_WGMXCC1_WGMXCCGn1
    SolutionIndex: 26
    SolutionNameMin: Cijk_Alik_Bjlk_F8NSS_BH_Bias_HAS_SAV_UserArgs_MT128x64x64_MI16x16x1_SN_LDSB0_CLR1_GRVWA8_GRVWB8_GSU0_GSUC0_GSUWGMRR0_K1_LBSPPA256_LBSPPB512_LPA8_LPB32_LRVW8_MIWT4_2_PLR1_SU0_SUM0_SUS64_VWA4_VWB2_WGM8_WGMXCC1_WGMXCCGn1
    SolutionIndex: 27
    SolutionNameMin: Cijk_Alik_Bjlk_F8NSS_BH_Bias_HAS_SAV_UserArgs_MT128x64x64_MI16x16x1_SN_LDSB0_CLR1_GRVWA16_GRVWB8_GSU0_GSUC0_GSUWGMRR0_K1_LBSPPA256_LBSPPB512_LPA16_LPB32_LRVW8_MIWT4_2_PLR1_SU0_SUM0_SUS64_VWA4_VWB2_WGM8_WGMXCC1_WGMXCCGn1
    SolutionIndex: 28
    SolutionNameMin: Cijk_Alik_Bjlk_F8NSS_BH_Bias_HAS_SAV_UserArgs_MT128x64x64_MI16x16x1_SN_LDSB0_CLR1_GRVWA8_GRVWB16_GSU0_GSUC0_GSUWGMRR0_K1_LBSPPA256_LBSPPB512_LPA8_LPB32_LRVW8_MIWT4_2_PLR1_SU0_SUM0_SUS64_VWA4_VWB2_WGM8_WGMXCC1_WGMXCCGn1
    SolutionIndex: 29
    SolutionNameMin: Cijk_Alik_Bjlk_F8NSS_BH_Bias_HAS_SAV_UserArgs_MT32x128x64_MI16x16x1_SN_LDSB0_CLR1_GRVWA8_GRVWB16_GSU0_GSUC0_GSUWGMRR0_K1_LBSPPA128_LBSPPB1024_LPA8_LPB64_LRVW8_MIWT1_4_PLR1_SU0_SUM0_SUS64_VWA1_VWB4_WGM8_WGMXCC1_WGMXCCGn1
    SolutionIndex: 30
    SolutionNameMin: Cijk_Alik_Bjlk_F8NSS_BH_Bias_HAS_SAV_UserArgs_MT128x32x64_MI16x16x1_SN_LDSB0_CLR1_GRVWA8_GRVWB8_GSU0_GSUC0_GSUWGMRR0_K1_LBSPPA256_LBSPPB256_LPA8_LPB16_LRVW8_MIWT4_1_PLR1_SU0_SUM0_SUS64_VWA4_VWB1_WGM1_WGMXCC1_WGMXCCGn1
    SolutionIndex: 31
    SolutionNameMin: Cijk_Alik_Bjlk_F8NSS_BH_Bias_HAS_SAV_UserArgs_MT128x32x64_MI16x16x1_SN_LDSB0_CLR1_GRVWA16_GRVWB8_GSU0_GSUC0_GSUWGMRR0_K1_LBSPPA256_LBSPPB256_LPA16_LPB16_LRVW8_MIWT4_1_PLR1_SU0_SUM0_SUS64_VWA4_VWB1_WGM1_WGMXCC1_WGMXCCGn1
    SolutionIndex: 32
    SolutionNameMin: Cijk_Alik_Bjlk_F8NSS_BH_Bias_HAS_SAV_UserArgs_MT64x64x64_MI16x16x1_SN_LDSB0_CLR1_GRVWA8_GRVWB8_GSU0_GSUC0_GSUWGMRR0_K1_LBSPPA128_LBSPPB512_LPA8_LPB32_LRVW8_MIWT2_2_PLR1_SU0_SUM0_SUS64_VWA2_VWB2_WGM1_WGMXCC1_WGMXCCGn1
    SolutionIndex: 33
    SolutionNameMin: Cijk_Alik_Bjlk_F8NSS_BH_Bias_HAS_SAV_UserArgs_MT64x64x64_MI16x16x1_SN_LDSB0_CLR1_GRVWA16_GRVWB8_GSU0_GSUC0_GSUWGMRR0_K1_LBSPPA128_LBSPPB512_LPA16_LPB32_LRVW8_MIWT2_2_PLR1_SU0_SUM0_SUS64_VWA2_VWB2_WGM1_WGMXCC1_WGMXCCGn1
    SolutionIndex: 34
    SolutionNameMin: Cijk_Alik_Bjlk_F8NSS_BH_Bias_HAS_SAV_UserArgs_MT64x64x64_MI16x16x1_SN_LDSB0_CLR1_GRVWA16_GRVWB8_GSU0_GSUC0_GSUWGMRR0_K1_LBSPPA128_LBSPPB512_LPA16_LPB32_LRVW8_MIWT2_2_PLR1_SU0_SUM0_SUS64_VWA2_VWB2_WGM4_WGMXCC1_WGMXCCGn1
    SolutionIndex: 35
    SolutionNameMin: Cijk_Alik_Bjlk_F8NSS_BH_Bias_HAS_SAV_UserArgs_MT64x64x64_MI16x16x1_SN_LDSB0_CLR1_GRVWA16_GRVWB8_GSU0_GSUC0_GSUWGMRR0_K1_LBSPPA128_LBSPPB512_LPA16_LPB32_LRVW8_MIWT2_2_PLR1_SU0_SUM0_SUS64_VWA2_VWB2_WGM6_WGMXCC1_WGMXCCGn1
    SolutionIndex: 36
    SolutionNameMin: Cijk_Alik_Bjlk_F8NSS_BH_Bias_HAS_SAV_UserArgs_MT64x64x64_MI16x16x1_SN_LDSB0_CLR1_GRVWA16_GRVWB16_GSU0_GSUC0_GSUWGMRR0_K1_LBSPPA128_LBSPPB512_LPA16_LPB32_LRVW8_MIWT2_2_PLR1_SU0_SUM0_SUS64_VWA2_VWB2_WGM6_WGMXCC1_WGMXCCGn1
    SolutionIndex: 37
    SolutionNameMin: Cijk_Alik_Bjlk_F8NSS_BH_Bias_HAS_SAV_UserArgs_MT32x64x64_MI16x16x1_SN_LDSB0_CLR1_GRVWA8_GRVWB16_GSU0_GSUC0_GSUWGMRR0_K1_LBSPPA128_LBSPPB512_LPA8_LPB32_LRVW8_MIWT1_2_PLR1_SU0_SUM0_SUS64_VWA1_VWB2_WGM8_WGMXCC1_WGMXCCGn1
    SolutionIndex: 38
    SolutionNameMin: Cijk_Alik_Bjlk_F8NSS_BH_Bias_HAS_SAV_UserArgs_MT64x32x64_MI16x16x1_SN_LDSB0_CLR1_GRVWA16_GRVWB8_GSU0_GSUC0_GSUWGMRR0_K1_LBSPPA128_LBSPPB256_LPA16_LPB16_LRVW8_MIWT2_1_PLR1_SU0_SUM0_SUS64_VWA2_VWB1_WGM1_WGMXCC1_WGMXCCGn1
    SolutionIndex: 39
    SolutionNameMin: Cijk_Alik_Bjlk_F8NSS_BH_Bias_HAS_SAV_UserArgs_MT64x32x64_MI16x16x1_SN_LDSB0_CLR1_GRVWA8_GRVWB8_GSU0_GSUC0_GSUWGMRR0_K1_LBSPPA128_LBSPPB256_LPA8_LPB16_LRVW8_MIWT2_1_PLR1_SU0_SUM0_SUS64_VWA2_VWB1_WGM6_WGMXCC1_WGMXCCGn1
    SolutionIndex: 40
    SolutionNameMin: Cijk_Alik_Bjlk_F8NSS_BH_Bias_HAS_SAV_UserArgs_MT64x32x64_MI16x16x1_SN_LDSB0_CLR1_GRVWA16_GRVWB8_GSU0_GSUC0_GSUWGMRR0_K1_LBSPPA128_LBSPPB256_LPA16_LPB16_LRVW8_MIWT2_1_PLR1_SU0_SUM0_SUS64_VWA2_VWB1_WGM8_WGMXCC1_WGMXCCGn1
    SolutionIndex: 41
    SolutionNameMin: Cijk_Alik_Bjlk_F8NSS_BH_Bias_HAS_SAV_UserArgs_MT32x32x64_MI16x16x1_SN_LDSB0_CLR1_GRVWA8_GRVWB8_GSU0_GSUC0_GSUWGMRR0_K1_LBSPPA128_LBSPPB256_LPA8_LPB16_LRVW8_MIWT1_1_PLR1_SU0_SUM0_SUS64_VWA1_VWB1_WGM1_WGMXCC1_WGMXCCGn1
    SolutionIndex: 42
    SolutionNameMin: Cijk_Alik_Bjlk_F8NSS_BH_Bias_HAS_SAV_UserArgs_MT32x32x64_MI16x16x1_SN_LDSB0_CLR1_GRVWA8_GRVWB8_GSU0_GSUC0_GSUWGMRR0_K1_LBSPPA128_LBSPPB256_LPA8_LPB16_LRVW8_MIWT1_1_PLR1_SU0_SUM0_SUS64_VWA1_VWB1_WGM6_WGMXCC1_WGMXCCGn1
    SolutionIndex: 43
    SolutionNameMin: Cijk_Alik_Bjlk_F8NSS_BH_Bias_HAS_SAV_UserArgs_MT128x256x128_MI16x16x1_SN_LDSB1_CLR1_GRVWA8_GRVWB16_GSU0_GSUC0_GSUWGMRR0_K1_LBSPPA512_LBSPPB2048_LPA8_LPB0_LRVW8_MIWT4_8_PLR1_SU0_SUM0_SUS128_VWA4_VWB8_WGM1_WGMXCC1_WGMXCCGn1
    SolutionIndex: 44
    SolutionNameMin: Cijk_Alik_Bjlk_F8NSS_BH_Bias_HAS_SAV_UserArgs_MT128x256x128_MI16x16x1_SN_LDSB1_CLR1_GRVWA8_GRVWB16_GSU0_GSUC0_GSUWGMRR0_K1_LBSPPA512_LBSPPB2048_LPA8_LPB0_LRVW8_MIWT4_8_PLR1_SU0_SUM0_SUS128_VWA4_VWB8_WGM4_WGMXCC1_WGMXCCGn1
    SolutionIndex: 45
    SolutionNameMin: Cijk_Alik_Bjlk_F8NSS_BH_Bias_HAS_SAV_UserArgs_MT128x256x128_MI16x16x1_SN_LDSB1_CLR1_GRVWA8_GRVWB16_GSU0_GSUC0_GSUWGMRR0_K1_LBSPPA512_LBSPPB2048_LPA8_LPB0_LRVW8_MIWT4_8_PLR1_SU0_SUM0_SUS128_VWA4_VWB8_WGM6_WGMXCC1_WGMXCCGn1
    SolutionIndex: 46
    SolutionNameMin: Cijk_Alik_Bjlk_F8NSS_BH_Bias_HAS_SAV_UserArgs_MT128x256x128_MI16x16x1_SN_LDSB1_CLR1_GRVWA16_GRVWB16_GSU0_GSUC0_GSUWGMRR0_K1_LBSPPA512_LBSPPB2048_LPA16_LPB0_LRVW8_MIWT4_8_PLR1_SU0_SUM0_SUS128_VWA4_VWB8_WGM6_WGMXCC1_WGMXCCGn1
    SolutionIndex: 47
    SolutionNameMin: Cijk_Alik_Bjlk_F8NSS_BH_Bias_HAS_SAV_UserArgs_MT128x256x128_MI16x16x1_SN_LDSB1_CLR1_GRVWA8_GRVWB16_GSU0_GSUC0_GSUWGMRR0_K1_LBSPPA512_LBSPPB2048_LPA8_LPB0_LRVW8_MIWT4_8_PLR1_SU0_SUM0_SUS128_VWA4_VWB8_WGM8_WGMXCC1_WGMXCCGn1
    SolutionIndex: 48
    SolutionNameMin: Cijk_Alik_Bjlk_F8NSS_BH_Bias_HAS_SAV_UserArgs_MT128x256x128_MI16x16x1_SN_LDSB1_CLR1_GRVWA16_GRVWB16_GSU0_GSUC0_GSUWGMRR0_K1_LBSPPA512_LBSPPB2048_LPA16_LPB0_LRVW8_MIWT4_8_PLR1_SU0_SUM0_SUS128_VWA4_VWB8_WGM8_WGMXCC1_WGMXCCGn1
    SolutionIndex: 49
    SolutionNameMin: Cijk_Alik_Bjlk_F8NSS_BH_Bias_HAS_SAV_UserArgs_MT144x256x128_MI16x16x1_SN_LDSB1_CLR1_GRVWA8_GRVWB8_GSU0_GSUC0_GSUWGMRR0_K1_LBSPPA128_LBSPPB2048_LPA8_LPB64_LRVW8_MIWT9_4_PLR1_SU0_SUM0_SUS128_VWA1_VWB4_WGM1_WGMXCC1_WGMXCCGn1
    SolutionIndex: 50
    SolutionNameMin: Cijk_Alik_Bjlk_F8NSS_BH_Bias_HAS_SAV_UserArgs_MT144x256x128_MI16x16x1_SN_LDSB1_CLR1_GRVWA8_GRVWB16_GSU0_GSUC0_GSUWGMRR0_K1_LBSPPA128_LBSPPB2048_LPA8_LPB64_LRVW8_MIWT9_4_PLR1_SU0_SUM0_SUS128_VWA1_VWB4_WGM1_WGMXCC1_WGMXCCGn1
    SolutionIndex: 51
    SolutionNameMin: Cijk_Alik_Bjlk_F8NSS_BH_Bias_HAS_SAV_UserArgs_MT144x256x128_MI16x16x1_SN_LDSB1_CLR1_GRVWA8_GRVWB8_GSU0_GSUC0_GSUWGMRR0_K1_LBSPPA128_LBSPPB2048_LPA8_LPB64_LRVW8_MIWT9_4_PLR1_SU0_SUM0_SUS128_VWA1_VWB4_WGM4_WGMXCC1_WGMXCCGn1
    SolutionIndex: 52
    SolutionNameMin: Cijk_Alik_Bjlk_F8NSS_BH_Bias_HAS_SAV_UserArgs_MT144x256x128_MI16x16x1_SN_LDSB1_CLR1_GRVWA8_GRVWB16_GSU0_GSUC0_GSUWGMRR0_K1_LBSPPA128_LBSPPB2048_LPA8_LPB64_LRVW8_MIWT9_4_PLR1_SU0_SUM0_SUS128_VWA1_VWB4_WGM4_WGMXCC1_WGMXCCGn1
    SolutionIndex: 53
    SolutionNameMin: Cijk_Alik_Bjlk_F8NSS_BH_Bias_HAS_SAV_UserArgs_MT144x256x128_MI16x16x1_SN_LDSB1_CLR1_GRVWA8_GRVWB8_GSU0_GSUC0_GSUWGMRR0_K1_LBSPPA128_LBSPPB2048_LPA8_LPB64_LRVW8_MIWT9_4_PLR1_SU0_SUM0_SUS128_VWA1_VWB4_WGM6_WGMXCC1_WGMXCCGn1
    SolutionIndex: 54
    SolutionNameMin: Cijk_Alik_Bjlk_F8NSS_BH_Bias_HAS_SAV_UserArgs_MT144x256x128_MI16x16x1_SN_LDSB1_CLR1_GRVWA8_GRVWB16_GSU0_GSUC0_GSUWGMRR0_K1_LBSPPA128_LBSPPB2048_LPA8_LPB64_LRVW8_MIWT9_4_PLR1_SU0_SUM0_SUS128_VWA1_VWB4_WGM6_WGMXCC1_WGMXCCGn1
    SolutionIndex: 55
    SolutionNameMin: Cijk_Alik_Bjlk_F8NSS_BH_Bias_HAS_SAV_UserArgs_MT144x256x128_MI16x16x1_SN_LDSB1_CLR1_GRVWA8_GRVWB16_GSU0_GSUC0_GSUWGMRR0_K1_LBSPPA128_LBSPPB2048_LPA8_LPB64_LRVW8_MIWT9_4_PLR1_SU0_SUM0_SUS128_VWA1_VWB4_WGM8_WGMXCC1_WGMXCCGn1
    SolutionIndex: 56
    SolutionNameMin: Cijk_Alik_Bjlk_F8NSS_BH_Bias_HAS_SAV_UserArgs_MT64x128x128_MI16x16x1_SN_LDSB1_CLR1_GRVWA16_GRVWB8_GSU0_GSUC0_GSUWGMRR0_K1_LBSPPA128_LBSPPB1024_LPA16_LPB0_LRVW8_MIWT1_8_PLR1_SU0_SUM0_SUS128_VWA1_VWB8_WGM1_WGMXCC1_WGMXCCGn1
    SolutionIndex: 57
    SolutionNameMin: Cijk_Alik_Bjlk_F8NSS_BH_Bias_HAS_SAV_UserArgs_MT144x64x128_MI16x16x1_SN_LDSB1_CLR1_GRVWA8_GRVWB8_GSU0_GSUC0_GSUWGMRR0_K1_LBSPPA128_LBSPPB512_LPA8_LPB16_LRVW8_MIWT9_1_PLR1_SU0_SUM0_SUS128_VWA1_VWB1_WGM1_WGMXCC1_WGMXCCGn1
    SolutionIndex: 58
    SolutionNameMin: Cijk_Alik_Bjlk_F8NSS_BH_Bias_HAS_SAV_UserArgs_MT144x64x128_MI16x16x1_SN_LDSB1_CLR1_GRVWA8_GRVWB16_GSU0_GSUC0_GSUWGMRR0_K1_LBSPPA128_LBSPPB512_LPA8_LPB16_LRVW8_MIWT9_1_PLR1_SU0_SUM0_SUS128_VWA1_VWB1_WGM4_WGMXCC1_WGMXCCGn1
    SolutionIndex: 59
    SolutionNameMin: Cijk_Alik_Bjlk_F8NSS_BH_Bias_HAS_SAV_UserArgs_MT144x64x128_MI16x16x1_SN_LDSB1_CLR1_GRVWA8_GRVWB8_GSU0_GSUC0_GSUWGMRR0_K1_LBSPPA128_LBSPPB512_LPA8_LPB16_LRVW8_MIWT9_1_PLR1_SU0_SUM0_SUS128_VWA1_VWB1_WGM6_WGMXCC1_WGMXCCGn1
    SolutionIndex: 60
    SolutionNameMin: Cijk_Alik_Bjlk_F8NSS_BH_Bias_HAS_SAV_UserArgs_MT144x128x128_MI16x16x1_SN_LDSB1_CLR1_GRVWA8_GRVWB8_GSU0_GSUC0_GSUWGMRR0_K1_LBSPPA128_LBSPPB1024_LPA8_LPB32_LRVW8_MIWT9_2_PLR1_SU0_SUM0_SUS128_VWA1_VWB2_WGM1_WGMXCC1_WGMXCCGn1
    SolutionIndex: 61
    SolutionNameMin: Cijk_Alik_Bjlk_F8NSS_BH_Bias_HAS_SAV_UserArgs_MT144x128x128_MI16x16x1_SN_LDSB1_CLR1_GRVWA8_GRVWB16_GSU0_GSUC0_GSUWGMRR0_K1_LBSPPA128_LBSPPB1024_LPA8_LPB32_LRVW8_MIWT9_2_PLR1_SU0_SUM0_SUS128_VWA1_VWB2_WGM4_WGMXCC1_WGMXCCGn1
    SolutionIndex: 62
    SolutionNameMin: Cijk_Alik_Bjlk_F8NSS_BH_Bias_HAS_SAV_UserArgs_MT144x128x128_MI16x16x1_SN_LDSB1_CLR1_GRVWA8_GRVWB16_GSU0_GSUC0_GSUWGMRR0_K1_LBSPPA128_LBSPPB1024_LPA8_LPB32_LRVW8_MIWT9_2_PLR1_SU0_SUM0_SUS128_VWA1_VWB2_WGM6_WGMXCC1_WGMXCCGn1
    SolutionIndex: 63
    SolutionNameMin: Cijk_Alik_Bjlk_F8NSS_BH_Bias_HAS_SAV_UserArgs_MT144x128x128_MI16x16x1_SN_LDSB1_CLR1_GRVWA8_GRVWB16_GSU0_GSUC0_GSUWGMRR0_K1_LBSPPA128_LBSPPB1024_LPA8_LPB32_LRVW8_MIWT9_2_PLR1_SU0_SUM0_SUS128_VWA1_VWB2_WGM8_WGMXCC1_WGMXCCGn1
    SolutionIndex: 64
    SolutionNameMin: Cijk_Alik_Bjlk_F8NSS_BH_Bias_HAS_SAV_UserArgs_MT128x128x128_MI16x16x1_SN_LDSB1_CLR1_GRVWA16_GRVWB16_GSU0_GSUC0_GSUWGMRR0_K1_LBSPPA512_LBSPPB1024_LPA16_LPB64_LRVW8_MIWT4_4_PLR1_SU0_SUM0_SUS128_VWA4_VWB4_WGM1_WGMXCC1_WGMXCCGn1
    SolutionIndex: 65
    SolutionNameMin: Cijk_Alik_Bjlk_F8NSS_BH_Bias_HAS_SAV_UserArgs_MT128x128x128_MI16x16x1_SN_LDSB1_CLR1_GRVWA16_GRVWB16_GSU0_GSUC0_GSUWGMRR0_K1_LBSPPA512_LBSPPB1024_LPA16_LPB64_LRVW8_MIWT4_4_PLR1_SU0_SUM0_SUS128_VWA4_VWB4_WGM4_WGMXCC1_WGMXCCGn1
    SolutionIndex: 66
    SolutionNameMin: Cijk_Alik_Bjlk_F8NSS_BH_Bias_HAS_SAV_UserArgs_MT128x128x128_MI16x16x1_SN_LDSB1_CLR1_GRVWA16_GRVWB16_GSU0_GSUC0_GSUWGMRR0_K1_LBSPPA512_LBSPPB1024_LPA16_LPB64_LRVW8_MIWT4_4_PLR1_SU0_SUM0_SUS128_VWA4_VWB4_WGM6_WGMXCC1_WGMXCCGn1
    SolutionIndex: 67
    SolutionNameMin: Cijk_Alik_Bjlk_F8NSS_BH_Bias_HAS_SAV_UserArgs_MT128x128x128_MI16x16x1_SN_LDSB1_CLR1_GRVWA8_GRVWB16_GSU0_GSUC0_GSUWGMRR0_K1_LBSPPA512_LBSPPB1024_LPA8_LPB64_LRVW8_MIWT4_4_PLR1_SU0_SUM0_SUS128_VWA4_VWB4_WGM8_WGMXCC1_WGMXCCGn1
    SolutionIndex: 68
    SolutionNameMin: Cijk_Alik_Bjlk_F8NSS_BH_Bias_HAS_SAV_UserArgs_MT128x128x128_MI16x16x1_SN_LDSB1_CLR1_GRVWA16_GRVWB16_GSU0_GSUC0_GSUWGMRR0_K1_LBSPPA512_LBSPPB1024_LPA16_LPB64_LRVW8_MIWT4_4_PLR1_SU0_SUM0_SUS128_VWA4_VWB4_WGM8_WGMXCC1_WGMXCCGn1
    SolutionIndex: 69
    SolutionNameMin: Cijk_Alik_Bjlk_F8NSS_BH_Bias_HAS_SAV_UserArgs_MT64x128x128_MI16x16x1_SN_LDSB1_CLR1_GRVWA8_GRVWB16_GSU0_GSUC0_GSUWGMRR0_K1_LBSPPA256_LBSPPB1024_LPA8_LPB64_LRVW8_MIWT2_4_PLR1_SU0_SUM0_SUS128_VWA2_VWB4_WGM1_WGMXCC1_WGMXCCGn1
    SolutionIndex: 70
    SolutionNameMin: Cijk_Alik_Bjlk_F8NSS_BH_Bias_HAS_SAV_UserArgs_MT128x64x128_MI16x16x1_SN_LDSB1_CLR1_GRVWA8_GRVWB16_GSU0_GSUC0_GSUWGMRR0_K1_LBSPPA512_LBSPPB512_LPA8_LPB32_LRVW8_MIWT4_2_PLR1_SU0_SUM0_SUS128_VWA4_VWB2_WGM1_WGMXCC1_WGMXCCGn1
    SolutionIndex: 71
    SolutionNameMin: Cijk_Alik_Bjlk_F8NSS_BH_Bias_HAS_SAV_UserArgs_MT128x64x128_MI16x16x1_SN_LDSB1_CLR1_GRVWA16_GRVWB16_GSU0_GSUC0_GSUWGMRR0_K1_LBSPPA512_LBSPPB512_LPA16_LPB32_LRVW8_MIWT4_2_PLR1_SU0_SUM0_SUS128_VWA4_VWB2_WGM4_WGMXCC1_WGMXCCGn1
    SolutionIndex: 72
    SolutionNameMin: Cijk_Alik_Bjlk_F8NSS_BH_Bias_HAS_SAV_UserArgs_MT32x128x128_MI16x16x1_SN_LDSB1_CLR1_GRVWA8_GRVWB8_GSU0_GSUC0_GSUWGMRR0_K1_LBSPPA128_LBSPPB1024_LPA8_LPB64_LRVW8_MIWT1_4_PLR1_SU0_SUM0_SUS128_VWA1_VWB4_WGM8_WGMXCC1_WGMXCCGn1
    SolutionIndex: 73
    SolutionNameMin: Cijk_Alik_Bjlk_F8NSS_BH_Bias_HAS_SAV_UserArgs_MT64x64x128_MI16x16x1_SN_LDSB1_CLR1_GRVWA16_GRVWB8_GSU0_GSUC0_GSUWGMRR0_K1_LBSPPA256_LBSPPB512_LPA16_LPB32_LRVW8_MIWT2_2_PLR1_SU0_SUM0_SUS128_VWA2_VWB2_WGM1_WGMXCC1_WGMXCCGn1
    SolutionIndex: 74
    SolutionNameMin: Cijk_Alik_Bjlk_F8NSS_BH_Bias_HAS_SAV_UserArgs_MT64x64x128_MI16x16x1_SN_LDSB1_CLR1_GRVWA8_GRVWB16_GSU0_GSUC0_GSUWGMRR0_K1_LBSPPA256_LBSPPB512_LPA8_LPB32_LRVW8_MIWT2_2_PLR1_SU0_SUM0_SUS128_VWA2_VWB2_WGM1_WGMXCC1_WGMXCCGn1
    SolutionIndex: 75
    SolutionNameMin: Cijk_Alik_Bjlk_F8NSS_BH_Bias_HAS_SAV_UserArgs_MT64x64x128_MI16x16x1_SN_LDSB1_CLR1_GRVWA16_GRVWB16_GSU0_GSUC0_GSUWGMRR0_K1_LBSPPA256_LBSPPB512_LPA16_LPB32_LRVW8_MIWT2_2_PLR1_SU0_SUM0_SUS128_VWA2_VWB2_WGM1_WGMXCC1_WGMXCCGn1
    SolutionIndex: 76
    SolutionNameMin: Cijk_Alik_Bjlk_F8NSS_BH_Bias_HAS_SAV_UserArgs_MT64x64x128_MI16x16x1_SN_LDSB1_CLR1_GRVWA8_GRVWB16_GSU0_GSUC0_GSUWGMRR0_K1_LBSPPA256_LBSPPB512_LPA8_LPB32_LRVW8_MIWT2_2_PLR1_SU0_SUM0_SUS128_VWA2_VWB2_WGM4_WGMXCC1_WGMXCCGn1
    SolutionIndex: 77
    SolutionNameMin: Cijk_Alik_Bjlk_F8NSS_BH_Bias_HAS_SAV_UserArgs_MT64x64x128_MI16x16x1_SN_LDSB1_CLR1_GRVWA8_GRVWB16_GSU0_GSUC0_GSUWGMRR0_K1_LBSPPA256_LBSPPB512_LPA8_LPB32_LRVW8_MIWT2_2_PLR1_SU0_SUM0_SUS128_VWA2_VWB2_WGM6_WGMXCC1_WGMXCCGn1
    SolutionIndex: 78
    SolutionNameMin: Cijk_Alik_Bjlk_F8NSS_BH_Bias_HAS_SAV_UserArgs_MT64x64x128_MI16x16x1_SN_LDSB1_CLR1_GRVWA8_GRVWB16_GSU0_GSUC0_GSUWGMRR0_K1_LBSPPA256_LBSPPB512_LPA8_LPB32_LRVW8_MIWT2_2_PLR1_SU0_SUM0_SUS128_VWA2_VWB2_WGM8_WGMXCC1_WGMXCCGn1
    SolutionIndex: 79
    SolutionNameMin: Cijk_Alik_Bjlk_F8NSS_BH_Bias_HAS_SAV_UserArgs_MT32x64x128_MI16x16x1_SN_LDSB0_CLR1_GRVWA8_GRVWB8_GSU0_GSUC0_GSUWGMRR0_K1_LBSPPA128_LBSPPB512_LPA8_LPB32_LRVW8_MIWT1_2_PLR1_SU0_SUM0_SUS128_VWA1_VWB2_WGM1_WGMXCC1_WGMXCCGn1
    SolutionIndex: 80
    SolutionNameMin: Cijk_Alik_Bjlk_F8NSS_BH_Bias_HAS_SAV_UserArgs_MT32x64x128_MI16x16x1_SN_LDSB0_CLR1_GRVWA8_GRVWB16_GSU0_GSUC0_GSUWGMRR0_K1_LBSPPA128_LBSPPB512_LPA8_LPB32_LRVW8_MIWT1_2_PLR1_SU0_SUM0_SUS128_VWA1_VWB2_WGM1_WGMXCC1_WGMXCCGn1
    SolutionIndex: 81
    SolutionNameMin: Cijk_Alik_Bjlk_F8NSS_BH_Bias_HAS_SAV_UserArgs_MT32x64x128_MI16x16x1_SN_LDSB0_CLR1_GRVWA8_GRVWB16_GSU0_GSUC0_GSUWGMRR0_K1_LBSPPA128_LBSPPB512_LPA8_LPB32_LRVW8_MIWT1_2_PLR1_SU0_SUM0_SUS128_VWA1_VWB2_WGM4_WGMXCC1_WGMXCCGn1
    SolutionIndex: 82
    SolutionNameMin: Cijk_Alik_Bjlk_F8NSS_BH_Bias_HAS_SAV_UserArgs_MT32x64x128_MI16x16x1_SN_LDSB0_CLR1_GRVWA16_GRVWB16_GSU0_GSUC0_GSUWGMRR0_K1_LBSPPA128_LBSPPB512_LPA16_LPB32_LRVW8_MIWT1_2_PLR1_SU0_SUM0_SUS128_VWA1_VWB2_WGM8_WGMXCC1_WGMXCCGn1
    SolutionIndex: 83
    SolutionNameMin: Cijk_Alik_Bjlk_F8NSS_BH_Bias_HAS_SAV_UserArgs_MT64x32x128_MI16x16x1_SN_LDSB0_CLR1_GRVWA8_GRVWB8_GSU0_GSUC0_GSUWGMRR0_K1_LBSPPA256_LBSPPB256_LPA8_LPB16_LRVW8_MIWT2_1_PLR1_SU0_SUM0_SUS128_VWA2_VWB1_WGM1_WGMXCC1_WGMXCCGn1
    SolutionIndex: 84
    SolutionNameMin: Cijk_Alik_Bjlk_F8NSS_BH_Bias_HAS_SAV_UserArgs_MT64x32x128_MI16x16x1_SN_LDSB0_CLR1_GRVWA16_GRVWB8_GSU0_GSUC0_GSUWGMRR0_K1_LBSPPA256_LBSPPB256_LPA16_LPB16_LRVW8_MIWT2_1_PLR1_SU0_SUM0_SUS128_VWA2_VWB1_WGM1_WGMXCC1_WGMXCCGn1
    SolutionIndex: 85
    SolutionNameMin: Cijk_Alik_Bjlk_F8NSS_BH_Bias_HAS_SAV_UserArgs_MT64x32x128_MI16x16x1_SN_LDSB0_CLR1_GRVWA8_GRVWB16_GSU0_GSUC0_GSUWGMRR0_K1_LBSPPA256_LBSPPB256_LPA8_LPB16_LRVW8_MIWT2_1_PLR1_SU0_SUM0_SUS128_VWA2_VWB1_WGM1_WGMXCC1_WGMXCCGn1
    SolutionIndex: 86
    SolutionNameMin: Cijk_Alik_Bjlk_F8NSS_BH_Bias_HAS_SAV_UserArgs_MT64x32x128_MI16x16x1_SN_LDSB0_CLR1_GRVWA8_GRVWB16_GSU0_GSUC0_GSUWGMRR0_K1_LBSPPA256_LBSPPB256_LPA8_LPB16_LRVW8_MIWT2_1_PLR1_SU0_SUM0_SUS128_VWA2_VWB1_WGM4_WGMXCC1_WGMXCCGn1
    SolutionIndex: 87
    SolutionNameMin: Cijk_Alik_Bjlk_F8NSS_BH_Bias_HAS_SAV_UserArgs_MT64x32x128_MI16x16x1_SN_LDSB0_CLR1_GRVWA8_GRVWB16_GSU0_GSUC0_GSUWGMRR0_K1_LBSPPA256_LBSPPB256_LPA8_LPB16_LRVW8_MIWT2_1_PLR1_SU0_SUM0_SUS128_VWA2_VWB1_WGM8_WGMXCC1_WGMXCCGn1
    SolutionIndex: 88
    SolutionNameMin: Cijk_Alik_Bjlk_F8NSS_BH_Bias_HAS_SAV_UserArgs_MT32x32x128_MI16x16x1_SN_LDSB0_CLR1_GRVWA8_GRVWB8_GSU0_GSUC0_GSUWGMRR0_K1_LBSPPA128_LBSPPB256_LPA8_LPB16_LRVW8_MIWT1_1_PLR1_SU0_SUM0_SUS128_VWA1_VWB1_WGM1_WGMXCC1_WGMXCCGn1
    SolutionIndex: 89
    SolutionNameMin: Cijk_Alik_Bjlk_F8NSS_BH_Bias_HAS_SAV_UserArgs_MT32x32x128_MI16x16x1_SN_LDSB0_CLR1_GRVWA16_GRVWB8_GSU0_GSUC0_GSUWGMRR0_K1_LBSPPA128_LBSPPB256_LPA16_LPB16_LRVW8_MIWT1_1_PLR1_SU0_SUM0_SUS128_VWA1_VWB1_WGM1_WGMXCC1_WGMXCCGn1
    SolutionIndex: 90
    SolutionNameMin: Cijk_Alik_Bjlk_F8NSS_BH_Bias_HAS_SAV_UserArgs_MT32x32x128_MI16x16x1_SN_LDSB0_CLR1_GRVWA8_GRVWB16_GSU0_GSUC0_GSUWGMRR0_K1_LBSPPA128_LBSPPB256_LPA8_LPB16_LRVW8_MIWT1_1_PLR1_SU0_SUM0_SUS128_VWA1_VWB1_WGM1_WGMXCC1_WGMXCCGn1
    SolutionIndex: 91
    SolutionNameMin: Cijk_Alik_Bjlk_F8NSS_BH_Bias_HAS_SAV_UserArgs_MT32x32x128_MI16x16x1_SN_LDSB0_CLR1_GRVWA8_GRVWB16_GSU0_GSUC0_GSUWGMRR0_K1_LBSPPA128_LBSPPB256_LPA8_LPB16_LRVW8_MIWT1_1_PLR1_SU0_SUM0_SUS128_VWA1_VWB1_WGM4_WGMXCC1_WGMXCCGn1
    SolutionIndex: 92
    SolutionNameMin: Cijk_Alik_Bjlk_F8NSS_BH_Bias_HAS_SAV_UserArgs_MT32x32x128_MI16x16x1_SN_LDSB0_CLR1_GRVWA8_GRVWB16_GSU0_GSUC0_GSUWGMRR0_K1_LBSPPA128_LBSPPB256_LPA8_LPB16_LRVW8_MIWT1_1_PLR1_SU0_SUM0_SUS128_VWA1_VWB1_WGM6_WGMXCC1_WGMXCCGn1
    SolutionIndex: 93
    SolutionNameMin: Cijk_Alik_Bjlk_F8NSS_BH_Bias_HAS_SAV_UserArgs_MT32x32x128_MI16x16x1_SN_LDSB0_CLR1_GRVWA8_GRVWB8_GSU0_GSUC0_GSUWGMRR0_K1_LBSPPA128_LBSPPB256_LPA8_LPB16_LRVW8_MIWT1_1_PLR1_SU0_SUM0_SUS128_VWA1_VWB1_WGM8_WGMXCC1_WGMXCCGn1
    SolutionIndex: 94
    SolutionNameMin: Cijk_Alik_Bjlk_F8NSS_BH_Bias_HAS_SAV_UserArgs_MT32x32x128_MI16x16x1_SN_LDSB0_CLR1_GRVWA8_GRVWB16_GSU0_GSUC0_GSUWGMRR0_K1_LBSPPA128_LBSPPB256_LPA8_LPB16_LRVW8_MIWT1_1_PLR1_SU0_SUM0_SUS128_VWA1_VWB1_WGM8_WGMXCC1_WGMXCCGn1
    SolutionIndex: 95
    SolutionNameMin: Cijk_Alik_Bjlk_F8NSS_BH_Bias_HAS_SAV_UserArgs_MT128x64x256_MI16x16x1_SN_LDSB1_CLR1_GRVWA16_GRVWB16_GSU0_GSUC0_GSUWGMRR0_K1_LBSPPA1024_LBSPPB512_LPA16_LPB32_LRVW8_MIWT4_2_PLR1_SU0_SUM0_SUS256_VWA4_VWB2_WGM1_WGMXCC1_WGMXCCGn1
    SolutionIndex: 96
    SolutionNameMin: Cijk_Alik_Bjlk_F8NSS_BH_Bias_HAS_SAV_UserArgs_MT128x64x256_MI16x16x1_SN_LDSB1_CLR1_GRVWA16_GRVWB16_GSU0_GSUC0_GSUWGMRR0_K1_LBSPPA1024_LBSPPB512_LPA16_LPB32_LRVW8_MIWT4_2_PLR1_SU0_SUM0_SUS256_VWA4_VWB2_WGM4_WGMXCC1_WGMXCCGn1
    SolutionIndex: 97
    SolutionNameMin: Cijk_Alik_Bjlk_F8NSS_BH_Bias_HAS_SAV_UserArgs_MT128x64x256_MI16x16x1_SN_LDSB1_CLR1_GRVWA16_GRVWB16_GSU0_GSUC0_GSUWGMRR0_K1_LBSPPA1024_LBSPPB512_LPA16_LPB32_LRVW8_MIWT4_2_PLR1_SU0_SUM0_SUS256_VWA4_VWB2_WGM6_WGMXCC1_WGMXCCGn1
    SolutionIndex: 98
    SolutionNameMin: Cijk_Alik_Bjlk_F8NSS_BH_Bias_HAS_SAV_UserArgs_MT128x64x256_MI16x16x1_SN_LDSB1_CLR1_GRVWA16_GRVWB16_GSU0_GSUC0_GSUWGMRR0_K1_LBSPPA1024_LBSPPB512_LPA16_LPB32_LRVW8_MIWT4_2_PLR1_SU0_SUM0_SUS256_VWA4_VWB2_WGM8_WGMXCC1_WGMXCCGn1
    SolutionIndex: 99
    SolutionNameMin: Cijk_Alik_Bjlk_F8NSS_BH_Bias_HAS_SAV_UserArgs_MT64x64x256_MI16x16x1_SN_LDSB1_CLR1_GRVWA16_GRVWB16_GSU0_GSUC0_GSUWGMRR0_K1_LBSPPA512_LBSPPB512_LPA16_LPB32_LRVW8_MIWT2_2_PLR1_SU0_SUM0_SUS256_VWA2_VWB2_WGM1_WGMXCC1_WGMXCCGn1
    SolutionIndex: 100
    SolutionNameMin: Cijk_Alik_Bjlk_F8NSS_BH_Bias_HAS_SAV_UserArgs_MT64x64x256_MI16x16x1_SN_LDSB1_CLR1_GRVWA16_GRVWB16_GSU0_GSUC0_GSUWGMRR0_K1_LBSPPA512_LBSPPB512_LPA16_LPB32_LRVW8_MIWT2_2_PLR1_SU0_SUM0_SUS256_VWA2_VWB2_WGM4_WGMXCC1_WGMXCCGn1
    SolutionIndex: 101
    SolutionNameMin: Cijk_Alik_Bjlk_F8NSS_BH_Bias_HAS_SAV_UserArgs_MT64x64x256_MI16x16x1_SN_LDSB1_CLR1_GRVWA16_GRVWB16_GSU0_GSUC0_GSUWGMRR0_K1_LBSPPA512_LBSPPB512_LPA16_LPB32_LRVW8_MIWT2_2_PLR1_SU0_SUM0_SUS256_VWA2_VWB2_WGM6_WGMXCC1_WGMXCCGn1
    SolutionIndex: 102
    SolutionNameMin: Cijk_Alik_Bjlk_F8NSS_BH_Bias_HAS_SAV_UserArgs_MT64x64x256_MI16x16x1_SN_LDSB1_CLR1_GRVWA16_GRVWB16_GSU0_GSUC0_GSUWGMRR0_K1_LBSPPA512_LBSPPB512_LPA16_LPB32_LRVW8_MIWT2_2_PLR1_SU0_SUM0_SUS256_VWA2_VWB2_WGM8_WGMXCC1_WGMXCCGn1
    SolutionIndex: 103
    SolutionNameMin: Cijk_Alik_Bjlk_F8NSS_BH_Bias_HAS_SAV_UserArgs_MT32x64x256_MI16x16x1_SN_LDSB1_CLR1_GRVWA16_GRVWB16_GSU0_GSUC0_GSUWGMRR0_K1_LBSPPA256_LBSPPB512_LPA16_LPB32_LRVW8_MIWT1_2_PLR1_SU0_SUM0_SUS256_VWA1_VWB2_WGM1_WGMXCC1_WGMXCCGn1
    SolutionIndex: 104
    SolutionNameMin: Cijk_Alik_Bjlk_F8NSS_BH_Bias_HAS_SAV_UserArgs_MT32x64x256_MI16x16x1_SN_LDSB1_CLR1_GRVWA8_GRVWB16_GSU0_GSUC0_GSUWGMRR0_K1_LBSPPA256_LBSPPB512_LPA8_LPB32_LRVW8_MIWT1_2_PLR1_SU0_SUM0_SUS256_VWA1_VWB2_WGM4_WGMXCC1_WGMXCCGn1
    SolutionIndex: 105
    SolutionNameMin: Cijk_Alik_Bjlk_F8NSS_BH_Bias_HAS_SAV_UserArgs_MT32x64x256_MI16x16x1_SN_LDSB1_CLR1_GRVWA16_GRVWB16_GSU0_GSUC0_GSUWGMRR0_K1_LBSPPA256_LBSPPB512_LPA16_LPB32_LRVW8_MIWT1_2_PLR1_SU0_SUM0_SUS256_VWA1_VWB2_WGM6_WGMXCC1_WGMXCCGn1
    SolutionIndex: 106
    SolutionNameMin: Cijk_Alik_Bjlk_F8NSS_BH_Bias_HAS_SAV_UserArgs_MT32x64x256_MI16x16x1_SN_LDSB1_CLR1_GRVWA8_GRVWB16_GSU0_GSUC0_GSUWGMRR0_K1_LBSPPA256_LBSPPB512_LPA8_LPB32_LRVW8_MIWT1_2_PLR1_SU0_SUM0_SUS256_VWA1_VWB2_WGM8_WGMXCC1_WGMXCCGn1
    SolutionIndex: 107
    SolutionNameMin: Cijk_Alik_Bjlk_F8NSS_BH_Bias_HAS_SAV_UserArgs_MT64x32x256_MI16x16x1_SN_LDSB1_CLR1_GRVWA16_GRVWB16_GSU0_GSUC0_GSUWGMRR0_K1_LBSPPA512_LBSPPB256_LPA16_LPB16_LRVW8_MIWT2_1_PLR1_SU0_SUM0_SUS256_VWA2_VWB1_WGM8_WGMXCC1_WGMXCCGn1
    SolutionIndex: 108
    SolutionNameMin: Cijk_Alik_Bjlk_F8NSS_BH_Bias_HAS_SAV_UserArgs_MT32x32x256_MI16x16x1_SN_LDSB1_CLR1_GRVWA16_GRVWB16_GSU0_GSUC0_GSUWGMRR0_K1_LBSPPA256_LBSPPB256_LPA16_LPB16_LRVW8_MIWT1_1_PLR1_SU0_SUM0_SUS256_VWA1_VWB1_WGM1_WGMXCC1_WGMXCCGn1
    SolutionIndex: 109
    SolutionNameMin: Cijk_Alik_Bjlk_F8NSS_BH_Bias_HAS_SAV_UserArgs_MT32x32x256_MI16x16x1_SN_LDSB1_CLR1_GRVWA16_GRVWB16_GSU0_GSUC0_GSUWGMRR0_K1_LBSPPA256_LBSPPB256_LPA16_LPB16_LRVW8_MIWT1_1_PLR1_SU0_SUM0_SUS256_VWA1_VWB1_WGM4_WGMXCC1_WGMXCCGn1
    SolutionIndex: 110
    SolutionNameMin: Cijk_Alik_Bjlk_F8NSS_BH_Bias_HAS_SAV_UserArgs_MT32x32x256_MI16x16x1_SN_LDSB1_CLR1_GRVWA16_GRVWB16_GSU0_GSUC0_GSUWGMRR0_K1_LBSPPA256_LBSPPB256_LPA16_LPB16_LRVW8_MIWT1_1_PLR1_SU0_SUM0_SUS256_VWA1_VWB1_WGM6_WGMXCC1_WGMXCCGn1
    SolutionIndex: 111
    SolutionNameMin: Cijk_Alik_Bjlk_F8NSS_BH_Bias_HAS_SAV_UserArgs_MT32x32x256_MI16x16x1_SN_LDSB1_CLR1_GRVWA16_GRVWB16_GSU0_GSUC0_GSUWGMRR0_K1_LBSPPA256_LBSPPB256_LPA16_LPB16_LRVW8_MIWT1_1_PLR1_SU0_SUM0_SUS256_VWA1_VWB1_WGM8_WGMXCC1_WGMXCCGn1
- - - [128, 128, 1, 128, 128, 128, 128, 128]
    - [72, 0.3]
  - - [128, 128, 1, 256, 128, 128, 256, 128]
    - [20, 0.7]
  - - [128, 128, 1, 512, 128, 128, 512, 128]
    - [37, 1.38]
  - - [128, 128, 1, 1024, 128, 128, 1024, 128]
    - [42, 2.33]
  - - [128, 128, 1, 2048, 128, 128, 2048, 128]
    - [90, 3.85]
  - - [128, 128, 1, 4096, 128, 128, 4096, 128]
    - [90, 4.85]
  - - [128, 128, 1, 8192, 128, 128, 8192, 128]
    - [92, 5.51]
  - - [128, 256, 1, 128, 128, 128, 128, 256]
    - [79, 0.97]
  - - [128, 256, 1, 256, 128, 128, 256, 256]
    - [41, 1.99]
  - - [128, 256, 1, 512, 128, 128, 512, 256]
    - [39, 2.87]
  - - [128, 256, 1, 1024, 128, 128, 1024, 256]
    - [93, 5.24]
  - - [128, 256, 1, 2048, 128, 128, 2048, 256]
    - [90, 7.59]
  - - [128, 256, 1, 4096, 128, 128, 4096, 256]
    - [90, 9.56]
  - - [128, 256, 1, 8192, 128, 128, 8192, 256]
    - [90, 11.02]
  - - [128, 512, 1, 128, 128, 128, 128, 512]
    - [40, 1.93]
  - - [128, 512, 1, 256, 128, 128, 256, 512]
    - [104, 3.38]
  - - [128, 512, 1, 512, 128, 128, 512, 512]
    - [91, 6.02]
  - - [128, 512, 1, 1024, 128, 128, 1024, 512]
    - [88, 10.65]
  - - [128, 512, 1, 2048, 128, 128, 2048, 512]
    - [90, 14.87]
  - - [128, 512, 1, 4096, 128, 128, 4096, 512]
    - [90, 19.06]
  - - [128, 512, 1, 8192, 128, 128, 8192, 512]
    - [108, 18.25]
  - - [128, 1024, 1, 128, 128, 128, 128, 1024]
    - [76, 2.82]
  - - [128, 1024, 1, 256, 128, 128, 256, 1024]
    - [25, 5.62]
  - - [128, 1024, 1, 512, 128, 128, 512, 1024]
    - [82, 10.86]
  - - [128, 1024, 1, 1024, 128, 128, 1024, 1024]
    - [79, 17.6]
  - - [128, 1024, 1, 2048, 128, 128, 2048, 1024]
    - [90, 29.06]
  - - [128, 1024, 1, 4096, 128, 128, 4096, 1024]
    - [111, 30.52]
  - - [128, 1024, 1, 8192, 128, 128, 8192, 1024]
    - [110, 31.96]
  - - [128, 2048, 1, 128, 128, 128, 128, 2048]
    - [25, 5.93]
  - - [128, 2048, 1, 256, 128, 128, 256, 2048]
    - [31, 12.76]
  - - [128, 2048, 1, 512, 128, 128, 512, 2048]
    - [75, 21.22]
  - - [128, 2048, 1, 1024, 128, 128, 1024, 2048]
    - [87, 35.73]
  - - [128, 2048, 1, 2048, 128, 128, 2048, 2048]
    - [103, 43.27]
  - - [128, 2048, 1, 4096, 128, 128, 4096, 2048]
    - [103, 52.56]
  - - [128, 2048, 1, 8192, 128, 128, 8192, 2048]
    - [103, 59.37]
  - - [128, 4096, 1, 128, 128, 128, 128, 4096]
    - [14, 11.64]
  - - [128, 4096, 1, 256, 128, 128, 256, 4096]
    - [36, 20.53]
  - - [128, 4096, 1, 512, 128, 128, 512, 4096]
    - [29, 36.74]
  - - [128, 4096, 1, 1024, 128, 128, 1024, 4096]
    - [75, 60.11]
  - - [128, 4096, 1, 2048, 128, 128, 2048, 4096]
    - [99, 76.09]
  - - [128, 4096, 1, 4096, 128, 128, 4096, 4096]
    - [99, 94.45]
  - - [128, 4096, 1, 8192, 128, 128, 8192, 4096]
    - [99, 107.19]
  - - [128, 8192, 1, 128, 128, 128, 128, 8192]
    - [56, 20.41]
  - - [128, 8192, 1, 256, 128, 128, 256, 8192]
    - [70, 36.89]
  - - [128, 8192, 1, 512, 128, 128, 512, 8192]
    - [21, 64.58]
  - - [128, 8192, 1, 1024, 128, 128, 1024, 8192]
    - [21, 96.89]
  - - [128, 8192, 1, 2048, 128, 128, 2048, 8192]
    - [69, 115.05]
  - - [128, 8192, 1, 4096, 128, 128, 4096, 8192]
    - [69, 137.39]
  - - [128, 8192, 1, 8192, 128, 128, 8192, 8192]
    - [96, 148.38]
  - - [256, 128, 1, 128, 256, 256, 128, 128]
    - [41, 1.14]
  - - [256, 128, 1, 256, 256, 256, 256, 128]
    - [89, 2.07]
  - - [256, 128, 1, 512, 256, 256, 512, 128]
    - [88, 3.56]
  - - [256, 128, 1, 1024, 256, 256, 1024, 128]
    - [88, 5.56]
  - - [256, 128, 1, 2048, 256, 256, 2048, 128]
    - [90, 7.77]
  - - [256, 128, 1, 4096, 256, 256, 4096, 128]
    - [90, 9.74]
  - - [256, 128, 1, 8192, 256, 256, 8192, 128]
    - [90, 11.13]
  - - [256, 256, 1, 128, 256, 256, 128, 256]
    - [41, 2.25]
  - - [256, 256, 1, 256, 256, 256, 256, 256]
    - [88, 4.14]
  - - [256, 256, 1, 512, 256, 256, 512, 256]
    - [88, 7.04]
  - - [256, 256, 1, 1024, 256, 256, 1024, 256]
    - [88, 10.67]
  - - [256, 256, 1, 2048, 256, 256, 2048, 256]
    - [90, 15.49]
  - - [256, 256, 1, 4096, 256, 256, 4096, 256]
    - [90, 19.29]
  - - [256, 256, 1, 8192, 256, 256, 8192, 256]
    - [94, 21.95]
  - - [256, 512, 1, 128, 256, 256, 128, 512]
    - [41, 4.26]
  - - [256, 512, 1, 256, 256, 256, 256, 512]
    - [88, 7.88]
  - - [256, 512, 1, 512, 256, 256, 512, 512]
    - [88, 13.54]
  - - [256, 512, 1, 1024, 256, 256, 1024, 512]
    - [88, 21.13]
  - - [256, 512, 1, 2048, 256, 256, 2048, 512]
    - [88, 29.94]
  - - [256, 512, 1, 4096, 256, 256, 4096, 512]
    - [90, 37.57]
  - - [256, 512, 1, 8192, 256, 256, 8192, 512]
    - [109, 37.9]
  - - [256, 1024, 1, 128, 256, 256, 128, 1024]
    - [79, 7.82]
  - - [256, 1024, 1, 256, 256, 256, 256, 1024]
    - [79, 13.98]
  - - [256, 1024, 1, 512, 256, 256, 512, 1024]
    - [83, 23.79]
  - - [256, 1024, 1, 1024, 256, 256, 1024, 1024]
    - [85, 36.71]
  - - [256, 1024, 1, 2048, 256, 256, 2048, 1024]
    - [85, 51.0]
  - - [256, 1024, 1, 4096, 256, 256, 4096, 1024]
    - [107, 56.06]
  - - [256, 1024, 1, 8192, 256, 256, 8192, 1024]
    - [105, 60.36]
  - - [256, 2048, 1, 128, 256, 256, 128, 2048]
    - [31, 13.35]
  - - [256, 2048, 1, 256, 256, 256, 256, 2048]
    - [33, 23.92]
  - - [256, 2048, 1, 512, 256, 256, 512, 2048]
    - [73, 39.77]
  - - [256, 2048, 1, 1024, 256, 256, 1024, 2048]
    - [74, 61.15]
  - - [256, 2048, 1, 2048, 256, 256, 2048, 2048]
    - [99, 77.7]
  - - [256, 2048, 1, 4096, 256, 256, 4096, 2048]
    - [99, 95.73]
  - - [256, 2048, 1, 8192, 256, 256, 8192, 2048]
    - [101, 107.31]
  - - [256, 4096, 1, 128, 256, 256, 128, 4096]
    - [27, 21.31]
  - - [256, 4096, 1, 256, 256, 256, 256, 4096]
    - [24, 38.04]
  - - [256, 4096, 1, 512, 256, 256, 512, 4096]
    - [23, 63.49]
  - - [256, 4096, 1, 1024, 256, 256, 1024, 4096]
    - [23, 95.63]
  - - [256, 4096, 1, 2048, 256, 256, 2048, 4096]
    - [95, 118.93]
  - - [256, 4096, 1, 4096, 256, 256, 4096, 4096]
    - [95, 143.29]
  - - [256, 4096, 1, 8192, 256, 256, 8192, 4096]
    - [95, 158.34]
  - - [256, 8192, 1, 128, 256, 256, 128, 8192]
    - [17, 31.28]
  - - [256, 8192, 1, 256, 256, 256, 256, 8192]
    - [17, 55.46]
  - - [256, 8192, 1, 512, 256, 256, 512, 8192]
    - [16, 89.11]
  - - [256, 8192, 1, 1024, 256, 256, 1024, 8192]
    - [64, 131.21]
  - - [256, 8192, 1, 2048, 256, 256, 2048, 8192]
    - [64, 162.34]
  - - [256, 8192, 1, 4096, 256, 256, 4096, 8192]
    - [64, 190.31]
  - - [256, 8192, 1, 8192, 256, 256, 8192, 8192]
    - [64, 188.0]
  - - [512, 128, 1, 128, 512, 512, 128, 128]
    - [41, 2.25]
  - - [512, 128, 1, 256, 512, 512, 256, 128]
    - [88, 4.07]
  - - [512, 128, 1, 512, 512, 512, 512, 128]
    - [88, 7.02]
  - - [512, 128, 1, 1024, 512, 512, 1024, 128]
    - [88, 10.5]
  - - [512, 128, 1, 2048, 512, 512, 2048, 128]
    - [88, 14.87]
  - - [512, 128, 1, 4096, 512, 512, 4096, 128]
    - [90, 19.27]
  - - [512, 128, 1, 8192, 512, 512, 8192, 128]
    - [92, 21.92]
  - - [512, 256, 1, 128, 512, 512, 128, 256]
    - [41, 4.31]
  - - [512, 256, 1, 256, 512, 512, 256, 256]
    - [89, 7.78]
  - - [512, 256, 1, 512, 512, 512, 512, 256]
    - [88, 13.36]
  - - [512, 256, 1, 1024, 512, 512, 1024, 256]
    - [88, 21.3]
  - - [512, 256, 1, 2048, 512, 512, 2048, 256]
    - [90, 29.79]
  - - [512, 256, 1, 4096, 512, 512, 4096, 256]
    - [90, 37.87]
  - - [512, 256, 1, 8192, 512, 512, 8192, 256]
    - [94, 43.1]
  - - [512, 512, 1, 128, 512, 512, 128, 512]
    - [38, 7.68]
  - - [512, 512, 1, 256, 512, 512, 256, 512]
    - [83, 13.88]
  - - [512, 512, 1, 512, 512, 512, 512, 512]
    - [84, 23.88]
  - - [512, 512, 1, 1024, 512, 512, 1024, 512]
    - [85, 36.83]
  - - [512, 512, 1, 2048, 512, 512, 2048, 512]
    - [85, 50.95]
  - - [512, 512, 1, 4096, 512, 512, 4096, 512]
    - [86, 62.69]
  - - [512, 512, 1, 8192, 512, 512, 8192, 512]
    - [81, 64.17]
  - - [512, 1024, 1, 128, 512, 512, 128, 1024]
    - [33, 13.36]
  - - [512, 1024, 1, 256, 512, 512, 256, 1024]
    - [73, 23.55]
  - - [512, 1024, 1, 512, 512, 512, 512, 1024]
    - [73, 39.92]
  - - [512, 1024, 1, 1024, 512, 512, 1024, 1024]
    - [77, 59.35]
  - - [512, 1024, 1, 2048, 512, 512, 2048, 1024]
    - [99, 83.44]
  - - [512, 1024, 1, 4096, 512, 512, 4096, 1024]
    - [101, 95.04]
  - - [512, 1024, 1, 8192, 512, 512, 8192, 1024]
    - [101, 106.14]
  - - [512, 2048, 1, 128, 512, 512, 128, 2048]
    - [24, 21.5]
  - - [512, 2048, 1, 256, 512, 512, 256, 2048]
    - [20, 38.31]
  - - [512, 2048, 1, 512, 512, 512, 512, 2048]
    - [21, 63.85]
  - - [512, 2048, 1, 1024, 512, 512, 1024, 2048]
    - [21, 95.74]
  - - [512, 2048, 1, 2048, 512, 512, 2048, 2048]
    - [95, 120.8]
  - - [512, 2048, 1, 4096, 512, 512, 4096, 2048]
    - [95, 147.04]
  - - [512, 2048, 1, 8192, 512, 512, 8192, 2048]
    - [96, 155.12]
  - - [512, 4096, 1, 128, 512, 512, 128, 4096]
    - [17, 31.38]
  - - [512, 4096, 1, 256, 512, 512, 256, 4096]
    - [17, 55.69]
  - - [512, 4096, 1, 512, 512, 512, 512, 4096]
    - [17, 86.6]
  - - [512, 4096, 1, 1024, 512, 512, 1024, 4096]
    - [64, 131.94]
  - - [512, 4096, 1, 2048, 512, 512, 2048, 4096]
    - [64, 174.2]
  - - [512, 4096, 1, 4096, 512, 512, 4096, 4096]
    - [64, 198.31]
  - - [512, 4096, 1, 8192, 512, 512, 8192, 4096]
    - [64, 193.31]
  - - [512, 8192, 1, 128, 512, 512, 128, 8192]
    - [8, 38.95]
  - - [512, 8192, 1, 256, 512, 512, 256, 8192]
    - [6, 68.38]
  - - [512, 8192, 1, 512, 512, 512, 512, 8192]
    - [10, 111.26]
  - - [512, 8192, 1, 1024, 512, 512, 1024, 8192]
    - [4, 161.58]
  - - [512, 8192, 1, 2048, 512, 512, 2048, 8192]
    - [5, 207.74]
  - - [512, 8192, 1, 4096, 512, 512, 4096, 8192]
    - [43, 227.85]
  - - [512, 8192, 1, 8192, 512, 512, 8192, 8192]
    - [50, 226.5]
  - - [1024, 128, 1, 128, 1024, 1024, 128, 128]
    - [41, 4.32]
  - - [1024, 128, 1, 256, 1024, 1024, 256, 128]
    - [88, 7.86]
  - - [1024, 128, 1, 512, 1024, 1024, 512, 128]
    - [88, 13.51]
  - - [1024, 128, 1, 1024, 1024, 1024, 1024, 128]
    - [88, 21.18]
  - - [1024, 128, 1, 2048, 1024, 1024, 2048, 128]
    - [90, 30.01]
  - - [1024, 128, 1, 4096, 1024, 1024, 4096, 128]
    - [94, 37.47]
  - - [1024, 128, 1, 8192, 1024, 1024, 8192, 128]
    - [94, 43.25]
  - - [1024, 256, 1, 128, 1024, 1024, 128, 256]
    - [84, 7.77]
  - - [1024, 256, 1, 256, 1024, 1024, 256, 256]
    - [84, 13.97]
  - - [1024, 256, 1, 512, 1024, 1024, 512, 256]
    - [83, 23.51]
  - - [1024, 256, 1, 1024, 1024, 1024, 1024, 256]
    - [85, 36.05]
  - - [1024, 256, 1, 2048, 1024, 1024, 2048, 256]
    - [86, 50.76]
  - - [1024, 256, 1, 4096, 1024, 1024, 4096, 256]
    - [86, 62.67]
  - - [1024, 256, 1, 8192, 1024, 1024, 8192, 256]
    - [106, 70.58]
  - - [1024, 512, 1, 128, 1024, 1024, 128, 512]
    - [35, 12.6]
  - - [1024, 512, 1, 256, 1024, 1024, 256, 512]
    - [34, 22.95]
  - - [1024, 512, 1, 512, 1024, 1024, 512, 512]
    - [78, 38.19]
  - - [1024, 512, 1, 1024, 1024, 1024, 1024, 512]
    - [77, 60.7]
  - - [1024, 512, 1, 2048, 1024, 1024, 2048, 512]
    - [101, 83.08]
  - - [1024, 512, 1, 4096, 1024, 1024, 4096, 512]
    - [100, 101.12]
  - - [1024, 512, 1, 8192, 1024, 1024, 8192, 512]
    - [102, 105.95]
  - - [1024, 1024, 1, 128, 1024, 1024, 128, 1024]
    - [24, 21.3]
  - - [1024, 1024, 1, 256, 1024, 1024, 256, 1024]
    - [22, 37.94]
  - - [1024, 1024, 1, 512, 1024, 1024, 512, 1024]
    - [25, 62.32]
  - - [1024, 1024, 1, 1024, 1024, 1024, 1024, 1024]
    - [28, 94.09]
  - - [1024, 1024, 1, 2048, 1024, 1024, 2048, 1024]
    - [98, 120.01]
  - - [1024, 1024, 1, 4096, 1024, 1024, 4096, 1024]
    - [96, 140.51]
  - - [1024, 1024, 1, 8192, 1024, 1024, 8192, 1024]
    - [95, 153.7]
  - - [1024, 2048, 1, 128, 1024, 1024, 128, 2048]
    - [17, 31.03]
  - - [1024, 2048, 1, 256, 1024, 1024, 256, 2048]
    - [17, 55.31]
  - - [1024, 2048, 1, 512, 1024, 1024, 512, 2048]
    - [64, 87.92]
  - - [1024, 2048, 1, 1024, 1024, 1024, 1024, 2048]
    - [64, 130.7]
  - - [1024, 2048, 1, 2048, 1024, 1024, 2048, 2048]
    - [64, 171.02]
  - - [1024, 2048, 1, 4096, 1024, 1024, 4096, 2048]
    - [66, 194.75]
  - - [1024, 2048, 1, 8192, 1024, 1024, 8192, 2048]
    - [66, 194.49]
  - - [1024, 4096, 1, 128, 1024, 1024, 128, 4096]
    - [3, 38.61]
  - - [1024, 4096, 1, 256, 1024, 1024, 256, 4096]
    - [4, 68.53]
  - - [1024, 4096, 1, 512, 1024, 1024, 512, 4096]
    - [5, 112.09]
  - - [1024, 4096, 1, 1024, 1024, 1024, 1024, 4096]
    - [4, 164.86]
  - - [1024, 4096, 1, 2048, 1024, 1024, 2048, 4096]
    - [43, 208.35]
  - - [1024, 4096, 1, 4096, 1024, 1024, 4096, 4096]
    - [4, 229.34]
  - - [1024, 4096, 1, 8192, 1024, 1024, 8192, 4096]
    - [44, 228.29]
  - - [1024, 8192, 1, 128, 1024, 1024, 128, 8192]
    - [5, 41.05]
  - - [1024, 8192, 1, 256, 1024, 1024, 256, 8192]
    - [5, 73.31]
  - - [1024, 8192, 1, 512, 1024, 1024, 512, 8192]
    - [5, 119.82]
  - - [1024, 8192, 1, 1024, 1024, 1024, 1024, 8192]
    - [4, 168.96]
  - - [1024, 8192, 1, 2048, 1024, 1024, 2048, 8192]
    - [2, 213.39]
  - - [1024, 8192, 1, 4096, 1024, 1024, 4096, 8192]
    - [9, 238.84]
  - - [1024, 8192, 1, 8192, 1024, 1024, 8192, 8192]
    - [2, 266.13]
  - - [2048, 128, 1, 128, 2048, 2048, 128, 128]
    - [79, 7.99]
  - - [2048, 128, 1, 256, 2048, 2048, 256, 128]
    - [79, 14.24]
  - - [2048, 128, 1, 512, 2048, 2048, 512, 128]
    - [80, 23.97]
  - - [2048, 128, 1, 1024, 2048, 2048, 1024, 128]
    - [85, 36.78]
  - - [2048, 128, 1, 2048, 2048, 2048, 2048, 128]
    - [85, 51.22]
  - - [2048, 128, 1, 4096, 2048, 2048, 4096, 128]
    - [86, 63.03]
  - - [2048, 128, 1, 8192, 2048, 2048, 8192, 128]
    - [106, 70.73]
  - - [2048, 256, 1, 128, 2048, 2048, 128, 256]
    - [33, 13.84]
  - - [2048, 256, 1, 256, 2048, 2048, 256, 256]
    - [33, 24.69]
  - - [2048, 256, 1, 512, 2048, 2048, 512, 256]
    - [75, 39.19]
  - - [2048, 256, 1, 1024, 2048, 2048, 1024, 256]
    - [74, 62.34]
  - - [2048, 256, 1, 2048, 2048, 2048, 2048, 256]
    - [99, 84.21]
  - - [2048, 256, 1, 4096, 2048, 2048, 4096, 256]
    - [100, 103.23]
  - - [2048, 256, 1, 8192, 2048, 2048, 8192, 256]
    - [101, 114.43]
  - - [2048, 512, 1, 128, 2048, 2048, 128, 512]
    - [20, 22.07]
  - - [2048, 512, 1, 256, 2048, 2048, 256, 512]
    - [20, 39.48]
  - - [2048, 512, 1, 512, 2048, 2048, 512, 512]
    - [21, 64.91]
  - - [2048, 512, 1, 1024, 2048, 2048, 1024, 512]
    - [28, 95.13]
  - - [2048, 512, 1, 2048, 2048, 2048, 2048, 512]
    - [28, 127.99]
  - - [2048, 512, 1, 4096, 2048, 2048, 4096, 512]
    - [96, 140.49]
  - - [2048, 512, 1, 8192, 2048, 2048, 8192, 512]
    - [97, 153.79]
  - - [2048, 1024, 1, 128, 2048, 2048, 128, 1024]
    - [16, 31.6]
  - - [2048, 1024, 1, 256, 2048, 2048, 256, 1024]
    - [16, 55.73]
  - - [2048, 1024, 1, 512, 2048, 2048, 512, 1024]
    - [16, 89.17]
  - - [2048, 1024, 1, 1024, 2048, 2048, 1024, 1024]
    - [65, 130.87]
  - - [2048, 1024, 1, 2048, 2048, 2048, 2048, 1024]
    - [65, 166.01]
  - - [2048, 1024, 1, 4096, 2048, 2048, 4096, 1024]
    - [65, 194.59]
  - - [2048, 1024, 1, 8192, 2048, 2048, 8192, 1024]
    - [66, 193.03]
  - - [2048, 2048, 1, 128, 2048, 2048, 128, 2048]
    - [3, 37.2]
  - - [2048, 2048, 1, 256, 2048, 2048, 256, 2048]
    - [4, 66.79]
  - - [2048, 2048, 1, 512, 2048, 2048, 512, 2048]
    - [4, 108.6]
  - - [2048, 2048, 1, 1024, 2048, 2048, 1024, 2048]
    - [7, 159.27]
  - - [2048, 2048, 1, 2048, 2048, 2048, 2048, 2048]
    - [52, 208.41]
  - - [2048, 2048, 1, 4096, 2048, 2048, 4096, 2048]
    - [45, 234.1]
  - - [2048, 2048, 1, 8192, 2048, 2048, 8192, 2048]
    - [52, 229.88]
  - - [2048, 4096, 1, 128, 2048, 2048, 128, 4096]
    - [17, 38.16]
  - - [2048, 4096, 1, 256, 2048, 2048, 256, 4096]
    - [3, 69.47]
  - - [2048, 4096, 1, 512, 2048, 2048, 512, 4096]
    - [4, 116.63]
  - - [2048, 4096, 1, 1024, 2048, 2048, 1024, 4096]
    - [4, 166.2]
  - - [2048, 4096, 1, 2048, 2048, 2048, 2048, 4096]
    - [1, 213.56]
  - - [2048, 4096, 1, 4096, 2048, 2048, 4096, 4096]
    - [55, 242.33]
  - - [2048, 4096, 1, 8192, 2048, 2048, 8192, 4096]
    - [1, 266.13]
  - - [2048, 8192, 1, 128, 2048, 2048, 128, 8192]
    - [49, 45.41]
  - - [2048, 8192, 1, 256, 2048, 2048, 256, 8192]
    - [49, 77.81]
  - - [2048, 8192, 1, 512, 2048, 2048, 512, 8192]
    - [50, 129.32]
  - - [2048, 8192, 1, 1024, 2048, 2048, 1024, 8192]
    - [52, 174.29]
  - - [2048, 8192, 1, 2048, 2048, 2048, 2048, 8192]
    - [52, 213.1]
  - - [2048, 8192, 1, 4096, 2048, 2048, 4096, 8192]
    - [44, 255.08]
  - - [2048, 8192, 1, 8192, 2048, 2048, 8192, 8192]
    - [52, 294.94]
  - - [4096, 128, 1, 128, 4096, 4096, 128, 128]
    - [30, 13.64]
  - - [4096, 128, 1, 256, 4096, 4096, 256, 128]
    - [33, 24.15]
  - - [4096, 128, 1, 512, 4096, 4096, 512, 128]
    - [32, 39.72]
  - - [4096, 128, 1, 1024, 4096, 4096, 1024, 128]
    - [74, 60.67]
  - - [4096, 128, 1, 2048, 4096, 4096, 2048, 128]
    - [99, 83.31]
  - - [4096, 128, 1, 4096, 4096, 4096, 4096, 128]
    - [101, 102.11]
  - - [4096, 128, 1, 8192, 4096, 4096, 8192, 128]
    - [102, 114.48]
  - - [4096, 256, 1, 128, 4096, 4096, 128, 256]
    - [20, 21.86]
  - - [4096, 256, 1, 256, 4096, 4096, 256, 256]
    - [19, 38.98]
  - - [4096, 256, 1, 512, 4096, 4096, 512, 256]
    - [21, 64.48]
  - - [4096, 256, 1, 1024, 4096, 4096, 1024, 256]
    - [25, 96.74]
  - - [4096, 256, 1, 2048, 4096, 4096, 2048, 256]
    - [25, 128.7]
  - - [4096, 256, 1, 4096, 4096, 4096, 4096, 256]
    - [71, 141.77]
  - - [4096, 256, 1, 8192, 4096, 4096, 8192, 256]
    - [96, 156.46]
  - - [4096, 512, 1, 128, 4096, 4096, 128, 512]
    - [17, 30.08]
  - - [4096, 512, 1, 256, 4096, 4096, 256, 512]
    - [64, 53.74]
  - - [4096, 512, 1, 512, 4096, 4096, 512, 512]
    - [16, 86.71]
  - - [4096, 512, 1, 1024, 4096, 4096, 1024, 512]
    - [65, 130.14]
  - - [4096, 512, 1, 2048, 4096, 4096, 2048, 512]
    - [65, 170.67]
  - - [4096, 512, 1, 4096, 4096, 4096, 4096, 512]
    - [65, 187.3]
  - - [4096, 512, 1, 8192, 4096, 4096, 8192, 512]
    - [67, 191.14]
  - - [4096, 1024, 1, 128, 4096, 4096, 128, 1024]
    - [45, 34.69]
  - - [4096, 1024, 1, 256, 4096, 4096, 256, 1024]
    - [47, 61.35]
  - - [4096, 1024, 1, 512, 4096, 4096, 512, 1024]
    - [45, 105.15]
  - - [4096, 1024, 1, 1024, 4096, 4096, 1024, 1024]
    - [44, 161.58]
  - - [4096, 1024, 1, 2048, 4096, 4096, 2048, 1024]
    - [44, 205.45]
  - - [4096, 1024, 1, 4096, 4096, 4096, 4096, 1024]
    - [48, 236.94]
  - - [4096, 1024, 1, 8192, 4096, 4096, 8192, 1024]
    - [54, 233.35]
  - - [4096, 2048, 1, 128, 4096, 4096, 128, 2048]
    - [15, 36.23]
  - - [4096, 2048, 1, 256, 4096, 4096, 256, 2048]
    - [13, 65.54]
  - - [4096, 2048, 1, 512, 4096, 4096, 512, 2048]
    - [8, 109.96]
  - - [4096, 2048, 1, 1024, 4096, 4096, 1024, 2048]
    - [55, 162.08]
  - - [4096, 2048, 1, 2048, 4096, 4096, 2048, 2048]
    - [1, 210.57]
  - - [4096, 2048, 1, 4096, 4096, 4096, 4096, 2048]
    - [54, 250.86]
  - - [4096, 2048, 1, 8192, 4096, 4096, 8192, 2048]
    - [54, 279.62]
  - - [4096, 4096, 1, 128, 4096, 4096, 128, 4096]
    - [12, 40.16]
  - - [4096, 4096, 1, 256, 4096, 4096, 256, 4096]
    - [11, 71.3]
  - - [4096, 4096, 1, 512, 4096, 4096, 512, 4096]
    - [17, 116.98]
  - - [4096, 4096, 1, 1024, 4096, 4096, 1024, 4096]
    - [61, 161.12]
  - - [4096, 4096, 1, 2048, 4096, 4096, 2048, 4096]
    - [54, 212.55]
  - - [4096, 4096, 1, 4096, 4096, 4096, 4096, 4096]
    - [55, 271.85]
  - - [4096, 4096, 1, 8192, 4096, 4096, 8192, 4096]
    - [50, 300.42]
  - - [4096, 8192, 1, 128, 4096, 4096, 128, 8192]
    - [26, 39.36]
  - - [4096, 8192, 1, 256, 4096, 4096, 256, 8192]
    - [18, 74.27]
  - - [4096, 8192, 1, 512, 4096, 4096, 512, 8192]
    - [5, 120.01]
  - - [4096, 8192, 1, 1024, 4096, 4096, 1024, 8192]
    - [44, 175.94]
  - - [4096, 8192, 1, 2048, 4096, 4096, 2048, 8192]
    - [46, 230.52]
  - - [4096, 8192, 1, 4096, 4096, 4096, 4096, 8192]
    - [50, 285.49]
  - - [4096, 8192, 1, 8192, 4096, 4096, 8192, 8192]
    - [0, 328.8]
  - - [8192, 128, 1, 128, 8192, 8192, 128, 128]
    - [20, 21.71]
  - - [8192, 128, 1, 256, 8192, 8192, 256, 128]
    - [20, 38.99]
  - - [8192, 128, 1, 512, 8192, 8192, 512, 128]
    - [23, 63.13]
  - - [8192, 128, 1, 1024, 8192, 8192, 1024, 128]
    - [25, 94.99]
  - - [8192, 128, 1, 2048, 8192, 8192, 2048, 128]
    - [98, 120.41]
  - - [8192, 128, 1, 4096, 8192, 8192, 4096, 128]
    - [96, 137.73]
  - - [8192, 128, 1, 8192, 8192, 8192, 8192, 128]
    - [98, 153.65]
  - - [8192, 256, 1, 128, 8192, 8192, 128, 256]
    - [57, 32.55]
  - - [8192, 256, 1, 256, 8192, 8192, 256, 256]
    - [59, 56.84]
  - - [8192, 256, 1, 512, 8192, 8192, 512, 256]
    - [58, 94.28]
  - - [8192, 256, 1, 1024, 8192, 8192, 1024, 256]
    - [58, 134.91]
  - - [8192, 256, 1, 2048, 8192, 8192, 2048, 256]
    - [66, 162.84]
  - - [8192, 256, 1, 4096, 8192, 8192, 4096, 256]
    - [68, 187.92]
  - - [8192, 256, 1, 8192, 8192, 8192, 8192, 256]
    - [68, 188.3]
  - - [8192, 512, 1, 128, 8192, 8192, 128, 512]
    - [60, 40.56]
  - - [8192, 512, 1, 256, 8192, 8192, 256, 512]
    - [62, 71.24]
  - - [8192, 512, 1, 512, 8192, 8192, 512, 512]
    - [63, 120.62]
  - - [8192, 512, 1, 1024, 8192, 8192, 1024, 512]
    - [61, 163.04]
  - - [8192, 512, 1, 2048, 8192, 8192, 2048, 512]
    - [9, 208.21]
  - - [8192, 512, 1, 4096, 8192, 8192, 4096, 512]
    - [63, 244.08]
  - - [8192, 512, 1, 8192, 8192, 8192, 8192, 512]
    - [62, 258.25]
  - - [8192, 1024, 1, 128, 8192, 8192, 128, 1024]
    - [50, 41.81]
  - - [8192, 1024, 1, 256, 8192, 8192, 256, 1024]
    - [50, 75.22]
  - - [8192, 1024, 1, 512, 8192, 8192, 512, 1024]
    - [55, 124.35]
  - - [8192, 1024, 1, 1024, 8192, 8192, 1024, 1024]
    - [52, 175.91]
  - - [8192, 1024, 1, 2048, 8192, 8192, 2048, 1024]
    - [54, 256.01]
  - - [8192, 1024, 1, 4096, 8192, 8192, 4096, 1024]
    - [54, 311.14]
  - - [8192, 1024, 1, 8192, 8192, 8192, 8192, 1024]
    - [54, 345.68]
  - - [8192, 2048, 1, 128, 8192, 8192, 128, 2048]
    - [55, 46.3]
  - - [8192, 2048, 1, 256, 8192, 8192, 256, 2048]
    - [55, 82.84]
  - - [8192, 2048, 1, 512, 8192, 8192, 512, 2048]
    - [52, 136.63]
  - - [8192, 2048, 1, 1024, 8192, 8192, 1024, 2048]
    - [53, 198.36]
  - - [8192, 2048, 1, 2048, 8192, 8192, 2048, 2048]
    - [55, 248.45]
  - - [8192, 2048, 1, 4096, 8192, 8192, 4096, 2048]
    - [52, 307.91]
  - - [8192, 2048, 1, 8192, 8192, 8192, 8192, 2048]
    - [52, 362.8]
  - - [8192, 4096, 1, 128, 8192, 8192, 128, 4096]
    - [51, 46.18]
  - - [8192, 4096, 1, 256, 8192, 8192, 256, 4096]
    - [54, 80.19]
  - - [8192, 4096, 1, 512, 8192, 8192, 512, 4096]
    - [54, 129.01]
  - - [8192, 4096, 1, 1024, 8192, 8192, 1024, 4096]
    - [54, 189.0]
  - - [8192, 4096, 1, 2048, 8192, 8192, 2048, 4096]
    - [54, 248.95]
  - - [8192, 4096, 1, 4096, 8192, 8192, 4096, 4096]
    - [54, 316.8]
  - - [8192, 4096, 1, 8192, 8192, 8192, 8192, 4096]
    - [52, 375.96]
  - - [8192, 8192, 1, 128, 8192, 8192, 128, 8192]
    - [52, 39.67]
  - - [8192, 8192, 1, 256, 8192, 8192, 256, 8192]
    - [5, 73.18]
  - - [8192, 8192, 1, 512, 8192, 8192, 512, 8192]
    - [52, 120.81]
  - - [8192, 8192, 1, 1024, 8192, 8192, 1024, 8192]
    - [50, 184.18]
  - - [8192, 8192, 1, 2048, 8192, 8192, 2048, 8192]
    - [52, 254.69]
  - - [8192, 8192, 1, 4096, 8192, 8192, 4096, 8192]
    - [55, 324.79]
  - - [8192, 8192, 1, 8192, 8192, 8192, 8192, 8192]
    - [52, 378.46]
- null
- null
- ExperimentalStreamK
- GridBased
