projects/hipblaslt/library/src/amd_detail/rocblaslt/src/Tensile/Logic/asm_full/aquavanjaram/gfx942_228cu/StreamK/aquavanjaram942_Cijk_Alik_Bjlk_F8B8NF8NS_BH_Bias_HAS_SAV_UserArgs.yaml
- {MinimumRequiredVersion: 4.33.0}
- aquavanjaram942
- {Architecture: gfx942, CUCount: 228}
- [Device 0049, Device 0050]
    SolutionIndex: 0
    SolutionNameMin: Cijk_Alik_Bjlk_F8B8NF8NS_BH_Bias_HAS_SAV_UserArgs_MT256x256x64_MI16x16x1_SN_LDSB1_CLR1_GRVWA16_GRVWB8_GSU0_GSUC0_GSUWGMRR0_K1_LBSPPA512_LBSPPB2048_LPA16_LPB0_LRVW8_MIWT8_8_PLR1_SU0_SUM0_SUS64_VWA8_VWB8_WGM1_WGMXCC1_WGMXCCGn1
    SolutionIndex: 1
    SolutionNameMin: Cijk_Alik_Bjlk_F8B8NF8NS_BH_Bias_HAS_SAV_UserArgs_MT256x256x64_MI16x16x1_SN_LDSB1_CLR1_GRVWA8_GRVWB16_GSU0_GSUC0_GSUWGMRR0_K1_LBSPPA512_LBSPPB2048_LPA8_LPB0_LRVW8_MIWT8_8_PLR1_SU0_SUM0_SUS64_VWA8_VWB8_WGM1_WGMXCC1_WGMXCCGn1
    SolutionIndex: 2
    SolutionNameMin: Cijk_Alik_Bjlk_F8B8NF8NS_BH_Bias_HAS_SAV_UserArgs_MT256x256x64_MI16x16x1_SN_LDSB1_CLR1_GRVWA16_GRVWB16_GSU0_GSUC0_GSUWGMRR0_K1_LBSPPA512_LBSPPB2048_LPA16_LPB0_LRVW8_MIWT8_8_PLR1_SU0_SUM0_SUS64_VWA8_VWB8_WGM1_WGMXCC1_WGMXCCGn1
    SolutionIndex: 3
    SolutionNameMin: Cijk_Alik_Bjlk_F8B8NF8NS_BH_Bias_HAS_SAV_UserArgs_MT256x256x64_MI16x16x1_SN_LDSB1_CLR1_GRVWA8_GRVWB16_GSU0_GSUC0_GSUWGMRR0_K1_LBSPPA512_LBSPPB2048_LPA8_LPB0_LRVW8_MIWT8_8_PLR1_SU0_SUM0_SUS64_VWA8_VWB8_WGM4_WGMXCC1_WGMXCCGn1
    SolutionIndex: 4
    SolutionNameMin: Cijk_Alik_Bjlk_F8B8NF8NS_BH_Bias_HAS_SAV_UserArgs_MT256x256x64_MI16x16x1_SN_LDSB1_CLR1_GRVWA16_GRVWB16_GSU0_GSUC0_GSUWGMRR0_K1_LBSPPA512_LBSPPB2048_LPA16_LPB0_LRVW8_MIWT8_8_PLR1_SU0_SUM0_SUS64_VWA8_VWB8_WGM4_WGMXCC1_WGMXCCGn1
    SolutionIndex: 5
    SolutionNameMin: Cijk_Alik_Bjlk_F8B8NF8NS_BH_Bias_HAS_SAV_UserArgs_MT256x256x64_MI16x16x1_SN_LDSB1_CLR1_GRVWA16_GRVWB8_GSU0_GSUC0_GSUWGMRR0_K1_LBSPPA512_LBSPPB2048_LPA16_LPB0_LRVW8_MIWT8_8_PLR1_SU0_SUM0_SUS64_VWA8_VWB8_WGM6_WGMXCC1_WGMXCCGn1
    SolutionIndex: 6
    SolutionNameMin: Cijk_Alik_Bjlk_F8B8NF8NS_BH_Bias_HAS_SAV_UserArgs_MT256x256x64_MI16x16x1_SN_LDSB1_CLR1_GRVWA8_GRVWB16_GSU0_GSUC0_GSUWGMRR0_K1_LBSPPA512_LBSPPB2048_LPA8_LPB0_LRVW8_MIWT8_8_PLR1_SU0_SUM0_SUS64_VWA8_VWB8_WGM6_WGMXCC1_WGMXCCGn1
    SolutionIndex: 7
    SolutionNameMin: Cijk_Alik_Bjlk_F8B8NF8NS_BH_Bias_HAS_SAV_UserArgs_MT256x256x64_MI16x16x1_SN_LDSB1_CLR1_GRVWA16_GRVWB16_GSU0_GSUC0_GSUWGMRR0_K1_LBSPPA512_LBSPPB2048_LPA16_LPB0_LRVW8_MIWT8_8_PLR1_SU0_SUM0_SUS64_VWA8_VWB8_WGM6_WGMXCC1_WGMXCCGn1
    SolutionIndex: 8
    SolutionNameMin: Cijk_Alik_Bjlk_F8B8NF8NS_BH_Bias_HAS_SAV_UserArgs_MT256x256x64_MI16x16x1_SN_LDSB1_CLR1_GRVWA16_GRVWB8_GSU0_GSUC0_GSUWGMRR0_K1_LBSPPA512_LBSPPB2048_LPA16_LPB0_LRVW8_MIWT8_8_PLR1_SU0_SUM0_SUS64_VWA8_VWB8_WGM8_WGMXCC1_WGMXCCGn1
    SolutionIndex: 9
    SolutionNameMin: Cijk_Alik_Bjlk_F8B8NF8NS_BH_Bias_HAS_SAV_UserArgs_MT256x256x64_MI16x16x1_SN_LDSB1_CLR1_GRVWA8_GRVWB16_GSU0_GSUC0_GSUWGMRR0_K1_LBSPPA512_LBSPPB2048_LPA8_LPB0_LRVW8_MIWT8_8_PLR1_SU0_SUM0_SUS64_VWA8_VWB8_WGM8_WGMXCC1_WGMXCCGn1
    SolutionIndex: 10
    SolutionNameMin: Cijk_Alik_Bjlk_F8B8NF8NS_BH_Bias_HAS_SAV_UserArgs_MT256x256x64_MI16x16x1_SN_LDSB1_CLR1_GRVWA16_GRVWB16_GSU0_GSUC0_GSUWGMRR0_K1_LBSPPA512_LBSPPB2048_LPA16_LPB0_LRVW8_MIWT8_8_PLR1_SU0_SUM0_SUS64_VWA8_VWB8_WGM8_WGMXCC1_WGMXCCGn1
    SolutionIndex: 11
    SolutionNameMin: Cijk_Alik_Bjlk_F8B8NF8NS_BH_Bias_HAS_SAV_UserArgs_MT128x256x64_MI16x16x1_SN_LDSB1_CLR1_GRVWA16_GRVWB16_GSU0_GSUC0_GSUWGMRR0_K1_LBSPPA256_LBSPPB2048_LPA16_LPB0_LRVW8_MIWT4_8_PLR1_SU0_SUM0_SUS64_VWA4_VWB8_WGM1_WGMXCC1_WGMXCCGn1
    SolutionIndex: 12
    SolutionNameMin: Cijk_Alik_Bjlk_F8B8NF8NS_BH_Bias_HAS_SAV_UserArgs_MT128x256x64_MI16x16x1_SN_LDSB1_CLR1_GRVWA16_GRVWB16_GSU0_GSUC0_GSUWGMRR0_K1_LBSPPA256_LBSPPB2048_LPA16_LPB0_LRVW8_MIWT4_8_PLR1_SU0_SUM0_SUS64_VWA4_VWB8_WGM6_WGMXCC1_WGMXCCGn1
    SolutionIndex: 13
    SolutionNameMin: Cijk_Alik_Bjlk_F8B8NF8NS_BH_Bias_HAS_SAV_UserArgs_MT128x256x64_MI16x16x1_SN_LDSB1_CLR1_GRVWA16_GRVWB16_GSU0_GSUC0_GSUWGMRR0_K1_LBSPPA256_LBSPPB2048_LPA16_LPB0_LRVW8_MIWT4_8_PLR1_SU0_SUM0_SUS64_VWA4_VWB8_WGM8_WGMXCC1_WGMXCCGn1
    SolutionIndex: 14
    SolutionNameMin: Cijk_Alik_Bjlk_F8B8NF8NS_BH_Bias_HAS_SAV_UserArgs_MT256x128x64_MI16x16x1_SN_LDSB1_CLR1_GRVWA8_GRVWB8_GSU0_GSUC0_GSUWGMRR0_K1_LBSPPA512_LBSPPB1024_LPA8_LPB64_LRVW8_MIWT8_4_PLR1_SU0_SUM0_SUS64_VWA8_VWB4_WGM1_WGMXCC1_WGMXCCGn1
    SolutionIndex: 15
    SolutionNameMin: Cijk_Alik_Bjlk_F8B8NF8NS_BH_Bias_HAS_SAV_UserArgs_MT256x128x64_MI16x16x1_SN_LDSB1_CLR1_GRVWA16_GRVWB8_GSU0_GSUC0_GSUWGMRR0_K1_LBSPPA512_LBSPPB1024_LPA16_LPB64_LRVW8_MIWT8_4_PLR1_SU0_SUM0_SUS64_VWA8_VWB4_WGM1_WGMXCC1_WGMXCCGn1
    SolutionIndex: 16
    SolutionNameMin: Cijk_Alik_Bjlk_F8B8NF8NS_BH_Bias_HAS_SAV_UserArgs_MT256x128x64_MI16x16x1_SN_LDSB1_CLR1_GRVWA8_GRVWB16_GSU0_GSUC0_GSUWGMRR0_K1_LBSPPA512_LBSPPB1024_LPA8_LPB64_LRVW8_MIWT8_4_PLR1_SU0_SUM0_SUS64_VWA8_VWB4_WGM1_WGMXCC1_WGMXCCGn1
    SolutionIndex: 17
    SolutionNameMin: Cijk_Alik_Bjlk_F8B8NF8NS_BH_Bias_HAS_SAV_UserArgs_MT256x128x64_MI16x16x1_SN_LDSB1_CLR1_GRVWA8_GRVWB16_GSU0_GSUC0_GSUWGMRR0_K1_LBSPPA512_LBSPPB1024_LPA8_LPB64_LRVW8_MIWT8_4_PLR1_SU0_SUM0_SUS64_VWA8_VWB4_WGM4_WGMXCC1_WGMXCCGn1
    SolutionIndex: 18
    SolutionNameMin: Cijk_Alik_Bjlk_F8B8NF8NS_BH_Bias_HAS_SAV_UserArgs_MT256x128x64_MI16x16x1_SN_LDSB1_CLR1_GRVWA8_GRVWB8_GSU0_GSUC0_GSUWGMRR0_K1_LBSPPA512_LBSPPB1024_LPA8_LPB64_LRVW8_MIWT8_4_PLR1_SU0_SUM0_SUS64_VWA8_VWB4_WGM6_WGMXCC1_WGMXCCGn1
    SolutionIndex: 19
    SolutionNameMin: Cijk_Alik_Bjlk_F8B8NF8NS_BH_Bias_HAS_SAV_UserArgs_MT128x128x64_MI16x16x1_SN_LDSB1_CLR1_GRVWA8_GRVWB16_GSU0_GSUC0_GSUWGMRR0_K1_LBSPPA512_LBSPPB1024_LPA8_LPB32_LRVW8_MIWT8_2_PLR1_SU0_SUM0_SUS64_VWA8_VWB2_WGM1_WGMXCC1_WGMXCCGn1
    SolutionIndex: 20
    SolutionNameMin: Cijk_Alik_Bjlk_F8B8NF8NS_BH_Bias_HAS_SAV_UserArgs_MT128x128x64_MI16x16x1_SN_LDSB1_CLR1_GRVWA8_GRVWB16_GSU0_GSUC0_GSUWGMRR0_K1_LBSPPA512_LBSPPB1024_LPA8_LPB32_LRVW8_MIWT8_2_PLR1_SU0_SUM0_SUS64_VWA8_VWB2_WGM4_WGMXCC1_WGMXCCGn1
    SolutionIndex: 21
    SolutionNameMin: Cijk_Alik_Bjlk_F8B8NF8NS_BH_Bias_HAS_SAV_UserArgs_MT128x64x64_MI16x16x1_SN_LDSB0_CLR1_GRVWA8_GRVWB8_GSU0_GSUC0_GSUWGMRR0_K1_LBSPPA512_LBSPPB512_LPA8_LPB16_LRVW8_MIWT8_1_PLR1_SU0_SUM0_SUS64_VWA8_VWB1_WGM1_WGMXCC1_WGMXCCGn1
    SolutionIndex: 22
    SolutionNameMin: Cijk_Alik_Bjlk_F8B8NF8NS_BH_Bias_HAS_SAV_UserArgs_MT128x128x64_MI16x16x1_SN_LDSB1_CLR1_GRVWA8_GRVWB8_GSU0_GSUC0_GSUWGMRR0_K1_LBSPPA256_LBSPPB1024_LPA8_LPB64_LRVW8_MIWT4_4_PLR1_SU0_SUM0_SUS64_VWA4_VWB4_WGM1_WGMXCC1_WGMXCCGn1
    SolutionIndex: 23
    SolutionNameMin: Cijk_Alik_Bjlk_F8B8NF8NS_BH_Bias_HAS_SAV_UserArgs_MT128x128x64_MI16x16x1_SN_LDSB1_CLR1_GRVWA16_GRVWB8_GSU0_GSUC0_GSUWGMRR0_K1_LBSPPA256_LBSPPB1024_LPA16_LPB64_LRVW8_MIWT4_4_PLR1_SU0_SUM0_SUS64_VWA4_VWB4_WGM1_WGMXCC1_WGMXCCGn1
    SolutionIndex: 24
    SolutionNameMin: Cijk_Alik_Bjlk_F8B8NF8NS_BH_Bias_HAS_SAV_UserArgs_MT128x64x64_MI16x16x1_SN_LDSB0_CLR1_GRVWA16_GRVWB8_GSU0_GSUC0_GSUWGMRR0_K1_LBSPPA256_LBSPPB512_LPA16_LPB32_LRVW8_MIWT4_2_PLR1_SU0_SUM0_SUS64_VWA4_VWB2_WGM1_WGMXCC1_WGMXCCGn1
    SolutionIndex: 25
    SolutionNameMin: Cijk_Alik_Bjlk_F8B8NF8NS_BH_Bias_HAS_SAV_UserArgs_MT128x64x64_MI16x16x1_SN_LDSB0_CLR1_GRVWA8_GRVWB16_GSU0_GSUC0_GSUWGMRR0_K1_LBSPPA256_LBSPPB512_LPA8_LPB32_LRVW8_MIWT4_2_PLR1_SU0_SUM0_SUS64_VWA4_VWB2_WGM1_WGMXCC1_WGMXCCGn1
    SolutionIndex: 26
    SolutionNameMin: Cijk_Alik_Bjlk_F8B8NF8NS_BH_Bias_HAS_SAV_UserArgs_MT128x64x64_MI16x16x1_SN_LDSB0_CLR1_GRVWA8_GRVWB16_GSU0_GSUC0_GSUWGMRR0_K1_LBSPPA256_LBSPPB512_LPA8_LPB32_LRVW8_MIWT4_2_PLR1_SU0_SUM0_SUS64_VWA4_VWB2_WGM4_WGMXCC1_WGMXCCGn1
    SolutionIndex: 27
    SolutionNameMin: Cijk_Alik_Bjlk_F8B8NF8NS_BH_Bias_HAS_SAV_UserArgs_MT128x64x64_MI16x16x1_SN_LDSB0_CLR1_GRVWA8_GRVWB16_GSU0_GSUC0_GSUWGMRR0_K1_LBSPPA256_LBSPPB512_LPA8_LPB32_LRVW8_MIWT4_2_PLR1_SU0_SUM0_SUS64_VWA4_VWB2_WGM6_WGMXCC1_WGMXCCGn1
    SolutionIndex: 28
    SolutionNameMin: Cijk_Alik_Bjlk_F8B8NF8NS_BH_Bias_HAS_SAV_UserArgs_MT128x64x64_MI16x16x1_SN_LDSB0_CLR1_GRVWA8_GRVWB16_GSU0_GSUC0_GSUWGMRR0_K1_LBSPPA256_LBSPPB512_LPA8_LPB32_LRVW8_MIWT4_2_PLR1_SU0_SUM0_SUS64_VWA4_VWB2_WGM8_WGMXCC1_WGMXCCGn1
    SolutionIndex: 29
    SolutionNameMin: Cijk_Alik_Bjlk_F8B8NF8NS_BH_Bias_HAS_SAV_UserArgs_MT128x32x64_MI16x16x1_SN_LDSB0_CLR1_GRVWA8_GRVWB8_GSU0_GSUC0_GSUWGMRR0_K1_LBSPPA256_LBSPPB256_LPA8_LPB16_LRVW8_MIWT4_1_PLR1_SU0_SUM0_SUS64_VWA4_VWB1_WGM1_WGMXCC1_WGMXCCGn1
    SolutionIndex: 30
    SolutionNameMin: Cijk_Alik_Bjlk_F8B8NF8NS_BH_Bias_HAS_SAV_UserArgs_MT64x64x64_MI16x16x1_SN_LDSB0_CLR1_GRVWA8_GRVWB8_GSU0_GSUC0_GSUWGMRR0_K1_LBSPPA128_LBSPPB512_LPA8_LPB32_LRVW8_MIWT2_2_PLR1_SU0_SUM0_SUS64_VWA2_VWB2_WGM1_WGMXCC1_WGMXCCGn1
    SolutionIndex: 31
    SolutionNameMin: Cijk_Alik_Bjlk_F8B8NF8NS_BH_Bias_HAS_SAV_UserArgs_MT64x64x64_MI16x16x1_SN_LDSB0_CLR1_GRVWA16_GRVWB8_GSU0_GSUC0_GSUWGMRR0_K1_LBSPPA128_LBSPPB512_LPA16_LPB32_LRVW8_MIWT2_2_PLR1_SU0_SUM0_SUS64_VWA2_VWB2_WGM1_WGMXCC1_WGMXCCGn1
    SolutionIndex: 32
    SolutionNameMin: Cijk_Alik_Bjlk_F8B8NF8NS_BH_Bias_HAS_SAV_UserArgs_MT64x32x64_MI16x16x1_SN_LDSB0_CLR1_GRVWA8_GRVWB8_GSU0_GSUC0_GSUWGMRR0_K1_LBSPPA128_LBSPPB256_LPA8_LPB16_LRVW8_MIWT2_1_PLR1_SU0_SUM0_SUS64_VWA2_VWB1_WGM1_WGMXCC1_WGMXCCGn1
    SolutionIndex: 33
    SolutionNameMin: Cijk_Alik_Bjlk_F8B8NF8NS_BH_Bias_HAS_SAV_UserArgs_MT32x32x64_MI16x16x1_SN_LDSB0_CLR1_GRVWA8_GRVWB8_GSU0_GSUC0_GSUWGMRR0_K1_LBSPPA128_LBSPPB256_LPA8_LPB16_LRVW8_MIWT1_1_PLR1_SU0_SUM0_SUS64_VWA1_VWB1_WGM1_WGMXCC1_WGMXCCGn1
    SolutionIndex: 34
    SolutionNameMin: Cijk_Alik_Bjlk_F8B8NF8NS_BH_Bias_HAS_SAV_UserArgs_MT32x32x64_MI16x16x1_SN_LDSB0_CLR1_GRVWA8_GRVWB8_GSU0_GSUC0_GSUWGMRR0_K1_LBSPPA128_LBSPPB256_LPA8_LPB16_LRVW8_MIWT1_1_PLR1_SU0_SUM0_SUS64_VWA1_VWB1_WGM4_WGMXCC1_WGMXCCGn1
    SolutionIndex: 35
    SolutionNameMin: Cijk_Alik_Bjlk_F8B8NF8NS_BH_Bias_HAS_SAV_UserArgs_MT128x256x128_MI16x16x1_SN_LDSB1_CLR1_GRVWA8_GRVWB16_GSU0_GSUC0_GSUWGMRR0_K1_LBSPPA512_LBSPPB2048_LPA8_LPB0_LRVW8_MIWT4_8_PLR1_SU0_SUM0_SUS128_VWA4_VWB8_WGM1_WGMXCC1_WGMXCCGn1
    SolutionIndex: 36
    SolutionNameMin: Cijk_Alik_Bjlk_F8B8NF8NS_BH_Bias_HAS_SAV_UserArgs_MT128x256x128_MI16x16x1_SN_LDSB1_CLR1_GRVWA16_GRVWB16_GSU0_GSUC0_GSUWGMRR0_K1_LBSPPA512_LBSPPB2048_LPA16_LPB0_LRVW8_MIWT4_8_PLR1_SU0_SUM0_SUS128_VWA4_VWB8_WGM1_WGMXCC1_WGMXCCGn1
    SolutionIndex: 37
    SolutionNameMin: Cijk_Alik_Bjlk_F8B8NF8NS_BH_Bias_HAS_SAV_UserArgs_MT128x256x128_MI16x16x1_SN_LDSB1_CLR1_GRVWA8_GRVWB16_GSU0_GSUC0_GSUWGMRR0_K1_LBSPPA512_LBSPPB2048_LPA8_LPB0_LRVW8_MIWT4_8_PLR1_SU0_SUM0_SUS128_VWA4_VWB8_WGM4_WGMXCC1_WGMXCCGn1
    SolutionIndex: 38
    SolutionNameMin: Cijk_Alik_Bjlk_F8B8NF8NS_BH_Bias_HAS_SAV_UserArgs_MT128x256x128_MI16x16x1_SN_LDSB1_CLR1_GRVWA8_GRVWB16_GSU0_GSUC0_GSUWGMRR0_K1_LBSPPA512_LBSPPB2048_LPA8_LPB0_LRVW8_MIWT4_8_PLR1_SU0_SUM0_SUS128_VWA4_VWB8_WGM6_WGMXCC1_WGMXCCGn1
    SolutionIndex: 39
    SolutionNameMin: Cijk_Alik_Bjlk_F8B8NF8NS_BH_Bias_HAS_SAV_UserArgs_MT128x256x128_MI16x16x1_SN_LDSB1_CLR1_GRVWA8_GRVWB16_GSU0_GSUC0_GSUWGMRR0_K1_LBSPPA512_LBSPPB2048_LPA8_LPB0_LRVW8_MIWT4_8_PLR1_SU0_SUM0_SUS128_VWA4_VWB8_WGM8_WGMXCC1_WGMXCCGn1
    SolutionIndex: 40
    SolutionNameMin: Cijk_Alik_Bjlk_F8B8NF8NS_BH_Bias_HAS_SAV_UserArgs_MT256x128x128_MI16x16x1_SN_LDSB1_CLR1_GRVWA8_GRVWB16_GSU0_GSUC0_GSUWGMRR0_K1_LBSPPA1024_LBSPPB1024_LPA8_LPB64_LRVW8_MIWT8_4_PLR1_SU0_SUM0_SUS128_VWA8_VWB4_WGM1_WGMXCC1_WGMXCCGn1
    SolutionIndex: 41
    SolutionNameMin: Cijk_Alik_Bjlk_F8B8NF8NS_BH_Bias_HAS_SAV_UserArgs_MT256x128x128_MI16x16x1_SN_LDSB1_CLR1_GRVWA16_GRVWB16_GSU0_GSUC0_GSUWGMRR0_K1_LBSPPA1024_LBSPPB1024_LPA16_LPB64_LRVW8_MIWT8_4_PLR1_SU0_SUM0_SUS128_VWA8_VWB4_WGM1_WGMXCC1_WGMXCCGn1
    SolutionIndex: 42
    SolutionNameMin: Cijk_Alik_Bjlk_F8B8NF8NS_BH_Bias_HAS_SAV_UserArgs_MT256x128x128_MI16x16x1_SN_LDSB1_CLR1_GRVWA8_GRVWB16_GSU0_GSUC0_GSUWGMRR0_K1_LBSPPA1024_LBSPPB1024_LPA8_LPB64_LRVW8_MIWT8_4_PLR1_SU0_SUM0_SUS128_VWA8_VWB4_WGM4_WGMXCC1_WGMXCCGn1
    SolutionIndex: 43
    SolutionNameMin: Cijk_Alik_Bjlk_F8B8NF8NS_BH_Bias_HAS_SAV_UserArgs_MT144x256x128_MI16x16x1_SN_LDSB1_CLR1_GRVWA8_GRVWB16_GSU0_GSUC0_GSUWGMRR0_K1_LBSPPA128_LBSPPB2048_LPA8_LPB64_LRVW8_MIWT9_4_PLR1_SU0_SUM0_SUS128_VWA1_VWB4_WGM1_WGMXCC1_WGMXCCGn1
    SolutionIndex: 44
    SolutionNameMin: Cijk_Alik_Bjlk_F8B8NF8NS_BH_Bias_HAS_SAV_UserArgs_MT144x256x128_MI16x16x1_SN_LDSB1_CLR1_GRVWA8_GRVWB16_GSU0_GSUC0_GSUWGMRR0_K1_LBSPPA128_LBSPPB2048_LPA8_LPB64_LRVW8_MIWT9_4_PLR1_SU0_SUM0_SUS128_VWA1_VWB4_WGM4_WGMXCC1_WGMXCCGn1
    SolutionIndex: 45
    SolutionNameMin: Cijk_Alik_Bjlk_F8B8NF8NS_BH_Bias_HAS_SAV_UserArgs_MT144x256x128_MI16x16x1_SN_LDSB1_CLR1_GRVWA8_GRVWB16_GSU0_GSUC0_GSUWGMRR0_K1_LBSPPA128_LBSPPB2048_LPA8_LPB64_LRVW8_MIWT9_4_PLR1_SU0_SUM0_SUS128_VWA1_VWB4_WGM6_WGMXCC1_WGMXCCGn1
    SolutionIndex: 46
    SolutionNameMin: Cijk_Alik_Bjlk_F8B8NF8NS_BH_Bias_HAS_SAV_UserArgs_MT144x256x128_MI16x16x1_SN_LDSB1_CLR1_GRVWA8_GRVWB16_GSU0_GSUC0_GSUWGMRR0_K1_LBSPPA128_LBSPPB2048_LPA8_LPB64_LRVW8_MIWT9_4_PLR1_SU0_SUM0_SUS128_VWA1_VWB4_WGM8_WGMXCC1_WGMXCCGn1
    SolutionIndex: 47
    SolutionNameMin: Cijk_Alik_Bjlk_F8B8NF8NS_BH_Bias_HAS_SAV_UserArgs_MT144x128x128_MI16x16x1_SN_LDSB1_CLR1_GRVWA8_GRVWB16_GSU0_GSUC0_GSUWGMRR0_K1_LBSPPA128_LBSPPB1024_LPA8_LPB32_LRVW8_MIWT9_2_PLR1_SU0_SUM0_SUS128_VWA1_VWB2_WGM6_WGMXCC1_WGMXCCGn1
    SolutionIndex: 48
    SolutionNameMin: Cijk_Alik_Bjlk_F8B8NF8NS_BH_Bias_HAS_SAV_UserArgs_MT144x128x128_MI16x16x1_SN_LDSB1_CLR1_GRVWA8_GRVWB16_GSU0_GSUC0_GSUWGMRR0_K1_LBSPPA128_LBSPPB1024_LPA8_LPB32_LRVW8_MIWT9_2_PLR1_SU0_SUM0_SUS128_VWA1_VWB2_WGM8_WGMXCC1_WGMXCCGn1
    SolutionIndex: 49
    SolutionNameMin: Cijk_Alik_Bjlk_F8B8NF8NS_BH_Bias_HAS_SAV_UserArgs_MT128x128x128_MI16x16x1_SN_LDSB1_CLR1_GRVWA16_GRVWB8_GSU0_GSUC0_GSUWGMRR0_K1_LBSPPA512_LBSPPB1024_LPA16_LPB64_LRVW8_MIWT4_4_PLR1_SU0_SUM0_SUS128_VWA4_VWB4_WGM1_WGMXCC1_WGMXCCGn1
    SolutionIndex: 50
    SolutionNameMin: Cijk_Alik_Bjlk_F8B8NF8NS_BH_Bias_HAS_SAV_UserArgs_MT128x128x128_MI16x16x1_SN_LDSB1_CLR1_GRVWA16_GRVWB16_GSU0_GSUC0_GSUWGMRR0_K1_LBSPPA512_LBSPPB1024_LPA16_LPB64_LRVW8_MIWT4_4_PLR1_SU0_SUM0_SUS128_VWA4_VWB4_WGM1_WGMXCC1_WGMXCCGn1
    SolutionIndex: 51
    SolutionNameMin: Cijk_Alik_Bjlk_F8B8NF8NS_BH_Bias_HAS_SAV_UserArgs_MT128x128x128_MI16x16x1_SN_LDSB1_CLR1_GRVWA16_GRVWB16_GSU0_GSUC0_GSUWGMRR0_K1_LBSPPA512_LBSPPB1024_LPA16_LPB64_LRVW8_MIWT4_4_PLR1_SU0_SUM0_SUS128_VWA4_VWB4_WGM4_WGMXCC1_WGMXCCGn1
    SolutionIndex: 52
    SolutionNameMin: Cijk_Alik_Bjlk_F8B8NF8NS_BH_Bias_HAS_SAV_UserArgs_MT128x128x128_MI16x16x1_SN_LDSB1_CLR1_GRVWA16_GRVWB16_GSU0_GSUC0_GSUWGMRR0_K1_LBSPPA512_LBSPPB1024_LPA16_LPB64_LRVW8_MIWT4_4_PLR1_SU0_SUM0_SUS128_VWA4_VWB4_WGM6_WGMXCC1_WGMXCCGn1
    SolutionIndex: 53
    SolutionNameMin: Cijk_Alik_Bjlk_F8B8NF8NS_BH_Bias_HAS_SAV_UserArgs_MT128x128x128_MI16x16x1_SN_LDSB1_CLR1_GRVWA16_GRVWB16_GSU0_GSUC0_GSUWGMRR0_K1_LBSPPA512_LBSPPB1024_LPA16_LPB64_LRVW8_MIWT4_4_PLR1_SU0_SUM0_SUS128_VWA4_VWB4_WGM8_WGMXCC1_WGMXCCGn1
    SolutionIndex: 54
    SolutionNameMin: Cijk_Alik_Bjlk_F8B8NF8NS_BH_Bias_HAS_SAV_UserArgs_MT64x128x128_MI16x16x1_SN_LDSB1_CLR1_GRVWA8_GRVWB16_GSU0_GSUC0_GSUWGMRR0_K1_LBSPPA256_LBSPPB1024_LPA8_LPB64_LRVW8_MIWT2_4_PLR1_SU0_SUM0_SUS128_VWA2_VWB4_WGM1_WGMXCC1_WGMXCCGn1
    SolutionIndex: 55
    SolutionNameMin: Cijk_Alik_Bjlk_F8B8NF8NS_BH_Bias_HAS_SAV_UserArgs_MT128x64x128_MI16x16x1_SN_LDSB1_CLR1_GRVWA16_GRVWB16_GSU0_GSUC0_GSUWGMRR0_K1_LBSPPA512_LBSPPB512_LPA16_LPB32_LRVW8_MIWT4_2_PLR1_SU0_SUM0_SUS128_VWA4_VWB2_WGM6_WGMXCC1_WGMXCCGn1
    SolutionIndex: 56
    SolutionNameMin: Cijk_Alik_Bjlk_F8B8NF8NS_BH_Bias_HAS_SAV_UserArgs_MT64x64x128_MI16x16x1_SN_LDSB1_CLR1_GRVWA16_GRVWB8_GSU0_GSUC0_GSUWGMRR0_K1_LBSPPA256_LBSPPB512_LPA16_LPB32_LRVW8_MIWT2_2_PLR1_SU0_SUM0_SUS128_VWA2_VWB2_WGM1_WGMXCC1_WGMXCCGn1
    SolutionIndex: 57
    SolutionNameMin: Cijk_Alik_Bjlk_F8B8NF8NS_BH_Bias_HAS_SAV_UserArgs_MT64x64x128_MI16x16x1_SN_LDSB1_CLR1_GRVWA8_GRVWB16_GSU0_GSUC0_GSUWGMRR0_K1_LBSPPA256_LBSPPB512_LPA8_LPB32_LRVW8_MIWT2_2_PLR1_SU0_SUM0_SUS128_VWA2_VWB2_WGM1_WGMXCC1_WGMXCCGn1
    SolutionIndex: 58
    SolutionNameMin: Cijk_Alik_Bjlk_F8B8NF8NS_BH_Bias_HAS_SAV_UserArgs_MT64x64x128_MI16x16x1_SN_LDSB1_CLR1_GRVWA16_GRVWB16_GSU0_GSUC0_GSUWGMRR0_K1_LBSPPA256_LBSPPB512_LPA16_LPB32_LRVW8_MIWT2_2_PLR1_SU0_SUM0_SUS128_VWA2_VWB2_WGM1_WGMXCC1_WGMXCCGn1
    SolutionIndex: 59
    SolutionNameMin: Cijk_Alik_Bjlk_F8B8NF8NS_BH_Bias_HAS_SAV_UserArgs_MT32x64x128_MI16x16x1_SN_LDSB0_CLR1_GRVWA8_GRVWB16_GSU0_GSUC0_GSUWGMRR0_K1_LBSPPA128_LBSPPB512_LPA8_LPB32_LRVW8_MIWT1_2_PLR1_SU0_SUM0_SUS128_VWA1_VWB2_WGM4_WGMXCC1_WGMXCCGn1
    SolutionIndex: 60
    SolutionNameMin: Cijk_Alik_Bjlk_F8B8NF8NS_BH_Bias_HAS_SAV_UserArgs_MT64x32x128_MI16x16x1_SN_LDSB0_CLR1_GRVWA8_GRVWB8_GSU0_GSUC0_GSUWGMRR0_K1_LBSPPA256_LBSPPB256_LPA8_LPB16_LRVW8_MIWT2_1_PLR1_SU0_SUM0_SUS128_VWA2_VWB1_WGM1_WGMXCC1_WGMXCCGn1
    SolutionIndex: 61
    SolutionNameMin: Cijk_Alik_Bjlk_F8B8NF8NS_BH_Bias_HAS_SAV_UserArgs_MT64x32x128_MI16x16x1_SN_LDSB0_CLR1_GRVWA16_GRVWB8_GSU0_GSUC0_GSUWGMRR0_K1_LBSPPA256_LBSPPB256_LPA16_LPB16_LRVW8_MIWT2_1_PLR1_SU0_SUM0_SUS128_VWA2_VWB1_WGM1_WGMXCC1_WGMXCCGn1
    SolutionIndex: 62
    SolutionNameMin: Cijk_Alik_Bjlk_F8B8NF8NS_BH_Bias_HAS_SAV_UserArgs_MT64x32x128_MI16x16x1_SN_LDSB0_CLR1_GRVWA8_GRVWB16_GSU0_GSUC0_GSUWGMRR0_K1_LBSPPA256_LBSPPB256_LPA8_LPB16_LRVW8_MIWT2_1_PLR1_SU0_SUM0_SUS128_VWA2_VWB1_WGM1_WGMXCC1_WGMXCCGn1
    SolutionIndex: 63
    SolutionNameMin: Cijk_Alik_Bjlk_F8B8NF8NS_BH_Bias_HAS_SAV_UserArgs_MT64x32x128_MI16x16x1_SN_LDSB0_CLR1_GRVWA8_GRVWB16_GSU0_GSUC0_GSUWGMRR0_K1_LBSPPA256_LBSPPB256_LPA8_LPB16_LRVW8_MIWT2_1_PLR1_SU0_SUM0_SUS128_VWA2_VWB1_WGM6_WGMXCC1_WGMXCCGn1
    SolutionIndex: 64
    SolutionNameMin: Cijk_Alik_Bjlk_F8B8NF8NS_BH_Bias_HAS_SAV_UserArgs_MT64x32x128_MI16x16x1_SN_LDSB0_CLR1_GRVWA8_GRVWB16_GSU0_GSUC0_GSUWGMRR0_K1_LBSPPA256_LBSPPB256_LPA8_LPB16_LRVW8_MIWT2_1_PLR1_SU0_SUM0_SUS128_VWA2_VWB1_WGM8_WGMXCC1_WGMXCCGn1
    SolutionIndex: 65
    SolutionNameMin: Cijk_Alik_Bjlk_F8B8NF8NS_BH_Bias_HAS_SAV_UserArgs_MT32x32x128_MI16x16x1_SN_LDSB0_CLR1_GRVWA8_GRVWB8_GSU0_GSUC0_GSUWGMRR0_K1_LBSPPA128_LBSPPB256_LPA8_LPB16_LRVW8_MIWT1_1_PLR1_SU0_SUM0_SUS128_VWA1_VWB1_WGM1_WGMXCC1_WGMXCCGn1
    SolutionIndex: 66
    SolutionNameMin: Cijk_Alik_Bjlk_F8B8NF8NS_BH_Bias_HAS_SAV_UserArgs_MT32x32x128_MI16x16x1_SN_LDSB0_CLR1_GRVWA16_GRVWB8_GSU0_GSUC0_GSUWGMRR0_K1_LBSPPA128_LBSPPB256_LPA16_LPB16_LRVW8_MIWT1_1_PLR1_SU0_SUM0_SUS128_VWA1_VWB1_WGM1_WGMXCC1_WGMXCCGn1
    SolutionIndex: 67
    SolutionNameMin: Cijk_Alik_Bjlk_F8B8NF8NS_BH_Bias_HAS_SAV_UserArgs_MT32x32x128_MI16x16x1_SN_LDSB0_CLR1_GRVWA8_GRVWB16_GSU0_GSUC0_GSUWGMRR0_K1_LBSPPA128_LBSPPB256_LPA8_LPB16_LRVW8_MIWT1_1_PLR1_SU0_SUM0_SUS128_VWA1_VWB1_WGM1_WGMXCC1_WGMXCCGn1
    SolutionIndex: 68
    SolutionNameMin: Cijk_Alik_Bjlk_F8B8NF8NS_BH_Bias_HAS_SAV_UserArgs_MT32x32x128_MI16x16x1_SN_LDSB0_CLR1_GRVWA8_GRVWB16_GSU0_GSUC0_GSUWGMRR0_K1_LBSPPA128_LBSPPB256_LPA8_LPB16_LRVW8_MIWT1_1_PLR1_SU0_SUM0_SUS128_VWA1_VWB1_WGM4_WGMXCC1_WGMXCCGn1
    SolutionIndex: 69
    SolutionNameMin: Cijk_Alik_Bjlk_F8B8NF8NS_BH_Bias_HAS_SAV_UserArgs_MT32x32x128_MI16x16x1_SN_LDSB0_CLR1_GRVWA8_GRVWB16_GSU0_GSUC0_GSUWGMRR0_K1_LBSPPA128_LBSPPB256_LPA8_LPB16_LRVW8_MIWT1_1_PLR1_SU0_SUM0_SUS128_VWA1_VWB1_WGM6_WGMXCC1_WGMXCCGn1
    SolutionIndex: 70
    SolutionNameMin: Cijk_Alik_Bjlk_F8B8NF8NS_BH_Bias_HAS_SAV_UserArgs_MT32x32x128_MI16x16x1_SN_LDSB0_CLR1_GRVWA8_GRVWB16_GSU0_GSUC0_GSUWGMRR0_K1_LBSPPA128_LBSPPB256_LPA8_LPB16_LRVW8_MIWT1_1_PLR1_SU0_SUM0_SUS128_VWA1_VWB1_WGM8_WGMXCC1_WGMXCCGn1
    SolutionIndex: 71
    SolutionNameMin: Cijk_Alik_Bjlk_F8B8NF8NS_BH_Bias_HAS_SAV_UserArgs_MT128x64x256_MI16x16x1_SN_LDSB1_CLR1_GRVWA16_GRVWB16_GSU0_GSUC0_GSUWGMRR0_K1_LBSPPA1024_LBSPPB512_LPA16_LPB32_LRVW8_MIWT4_2_PLR1_SU0_SUM0_SUS256_VWA4_VWB2_WGM1_WGMXCC1_WGMXCCGn1
    SolutionIndex: 72
    SolutionNameMin: Cijk_Alik_Bjlk_F8B8NF8NS_BH_Bias_HAS_SAV_UserArgs_MT128x64x256_MI16x16x1_SN_LDSB1_CLR1_GRVWA16_GRVWB16_GSU0_GSUC0_GSUWGMRR0_K1_LBSPPA1024_LBSPPB512_LPA16_LPB32_LRVW8_MIWT4_2_PLR1_SU0_SUM0_SUS256_VWA4_VWB2_WGM4_WGMXCC1_WGMXCCGn1
    SolutionIndex: 73
    SolutionNameMin: Cijk_Alik_Bjlk_F8B8NF8NS_BH_Bias_HAS_SAV_UserArgs_MT128x64x256_MI16x16x1_SN_LDSB1_CLR1_GRVWA16_GRVWB16_GSU0_GSUC0_GSUWGMRR0_K1_LBSPPA1024_LBSPPB512_LPA16_LPB32_LRVW8_MIWT4_2_PLR1_SU0_SUM0_SUS256_VWA4_VWB2_WGM6_WGMXCC1_WGMXCCGn1
    SolutionIndex: 74
    SolutionNameMin: Cijk_Alik_Bjlk_F8B8NF8NS_BH_Bias_HAS_SAV_UserArgs_MT128x64x256_MI16x16x1_SN_LDSB1_CLR1_GRVWA16_GRVWB16_GSU0_GSUC0_GSUWGMRR0_K1_LBSPPA1024_LBSPPB512_LPA16_LPB32_LRVW8_MIWT4_2_PLR1_SU0_SUM0_SUS256_VWA4_VWB2_WGM8_WGMXCC1_WGMXCCGn1
    SolutionIndex: 75
    SolutionNameMin: Cijk_Alik_Bjlk_F8B8NF8NS_BH_Bias_HAS_SAV_UserArgs_MT64x64x256_MI16x16x1_SN_LDSB1_CLR1_GRVWA16_GRVWB16_GSU0_GSUC0_GSUWGMRR0_K1_LBSPPA512_LBSPPB512_LPA16_LPB32_LRVW8_MIWT2_2_PLR1_SU0_SUM0_SUS256_VWA2_VWB2_WGM1_WGMXCC1_WGMXCCGn1
    SolutionIndex: 76
    SolutionNameMin: Cijk_Alik_Bjlk_F8B8NF8NS_BH_Bias_HAS_SAV_UserArgs_MT64x64x256_MI16x16x1_SN_LDSB1_CLR1_GRVWA16_GRVWB16_GSU0_GSUC0_GSUWGMRR0_K1_LBSPPA512_LBSPPB512_LPA16_LPB32_LRVW8_MIWT2_2_PLR1_SU0_SUM0_SUS256_VWA2_VWB2_WGM4_WGMXCC1_WGMXCCGn1
    SolutionIndex: 77
    SolutionNameMin: Cijk_Alik_Bjlk_F8B8NF8NS_BH_Bias_HAS_SAV_UserArgs_MT64x64x256_MI16x16x1_SN_LDSB1_CLR1_GRVWA16_GRVWB16_GSU0_GSUC0_GSUWGMRR0_K1_LBSPPA512_LBSPPB512_LPA16_LPB32_LRVW8_MIWT2_2_PLR1_SU0_SUM0_SUS256_VWA2_VWB2_WGM6_WGMXCC1_WGMXCCGn1
    SolutionIndex: 78
    SolutionNameMin: Cijk_Alik_Bjlk_F8B8NF8NS_BH_Bias_HAS_SAV_UserArgs_MT64x64x256_MI16x16x1_SN_LDSB1_CLR1_GRVWA16_GRVWB16_GSU0_GSUC0_GSUWGMRR0_K1_LBSPPA512_LBSPPB512_LPA16_LPB32_LRVW8_MIWT2_2_PLR1_SU0_SUM0_SUS256_VWA2_VWB2_WGM8_WGMXCC1_WGMXCCGn1
    SolutionIndex: 79
    SolutionNameMin: Cijk_Alik_Bjlk_F8B8NF8NS_BH_Bias_HAS_SAV_UserArgs_MT32x64x256_MI16x16x1_SN_LDSB1_CLR1_GRVWA8_GRVWB16_GSU0_GSUC0_GSUWGMRR0_K1_LBSPPA256_LBSPPB512_LPA8_LPB32_LRVW8_MIWT1_2_PLR1_SU0_SUM0_SUS256_VWA1_VWB2_WGM1_WGMXCC1_WGMXCCGn1
    SolutionIndex: 80
    SolutionNameMin: Cijk_Alik_Bjlk_F8B8NF8NS_BH_Bias_HAS_SAV_UserArgs_MT32x64x256_MI16x16x1_SN_LDSB1_CLR1_GRVWA16_GRVWB16_GSU0_GSUC0_GSUWGMRR0_K1_LBSPPA256_LBSPPB512_LPA16_LPB32_LRVW8_MIWT1_2_PLR1_SU0_SUM0_SUS256_VWA1_VWB2_WGM1_WGMXCC1_WGMXCCGn1
    SolutionIndex: 81
    SolutionNameMin: Cijk_Alik_Bjlk_F8B8NF8NS_BH_Bias_HAS_SAV_UserArgs_MT32x64x256_MI16x16x1_SN_LDSB1_CLR1_GRVWA16_GRVWB16_GSU0_GSUC0_GSUWGMRR0_K1_LBSPPA256_LBSPPB512_LPA16_LPB32_LRVW8_MIWT1_2_PLR1_SU0_SUM0_SUS256_VWA1_VWB2_WGM6_WGMXCC1_WGMXCCGn1
    SolutionIndex: 82
    SolutionNameMin: Cijk_Alik_Bjlk_F8B8NF8NS_BH_Bias_HAS_SAV_UserArgs_MT32x64x256_MI16x16x1_SN_LDSB1_CLR1_GRVWA8_GRVWB16_GSU0_GSUC0_GSUWGMRR0_K1_LBSPPA256_LBSPPB512_LPA8_LPB32_LRVW8_MIWT1_2_PLR1_SU0_SUM0_SUS256_VWA1_VWB2_WGM8_WGMXCC1_WGMXCCGn1
    SolutionIndex: 83
    SolutionNameMin: Cijk_Alik_Bjlk_F8B8NF8NS_BH_Bias_HAS_SAV_UserArgs_MT64x32x256_MI16x16x1_SN_LDSB1_CLR1_GRVWA16_GRVWB16_GSU0_GSUC0_GSUWGMRR0_K1_LBSPPA512_LBSPPB256_LPA16_LPB16_LRVW8_MIWT2_1_PLR1_SU0_SUM0_SUS256_VWA2_VWB1_WGM8_WGMXCC1_WGMXCCGn1
    SolutionIndex: 84
    SolutionNameMin: Cijk_Alik_Bjlk_F8B8NF8NS_BH_Bias_HAS_SAV_UserArgs_MT32x32x256_MI16x16x1_SN_LDSB1_CLR1_GRVWA16_GRVWB8_GSU0_GSUC0_GSUWGMRR0_K1_LBSPPA256_LBSPPB256_LPA16_LPB16_LRVW8_MIWT1_1_PLR1_SU0_SUM0_SUS256_VWA1_VWB1_WGM1_WGMXCC1_WGMXCCGn1
    SolutionIndex: 85
    SolutionNameMin: Cijk_Alik_Bjlk_F8B8NF8NS_BH_Bias_HAS_SAV_UserArgs_MT32x32x256_MI16x16x1_SN_LDSB1_CLR1_GRVWA16_GRVWB16_GSU0_GSUC0_GSUWGMRR0_K1_LBSPPA256_LBSPPB256_LPA16_LPB16_LRVW8_MIWT1_1_PLR1_SU0_SUM0_SUS256_VWA1_VWB1_WGM1_WGMXCC1_WGMXCCGn1
    SolutionIndex: 86
    SolutionNameMin: Cijk_Alik_Bjlk_F8B8NF8NS_BH_Bias_HAS_SAV_UserArgs_MT32x32x256_MI16x16x1_SN_LDSB1_CLR1_GRVWA8_GRVWB16_GSU0_GSUC0_GSUWGMRR0_K1_LBSPPA256_LBSPPB256_LPA8_LPB16_LRVW8_MIWT1_1_PLR1_SU0_SUM0_SUS256_VWA1_VWB1_WGM6_WGMXCC1_WGMXCCGn1
- - - [128, 128, 1, 128, 128, 128, 128, 128]
    - [33, 0.56]
  - - [128, 128, 1, 256, 128, 128, 256, 128]
    - [65, 1.03]
  - - [128, 128, 1, 512, 128, 128, 512, 128]
    - [65, 1.79]
  - - [128, 128, 1, 1024, 128, 128, 1024, 128]
    - [65, 2.78]
  - - [128, 128, 1, 2048, 128, 128, 2048, 128]
    - [67, 3.87]
  - - [128, 128, 1, 4096, 128, 128, 4096, 128]
    - [67, 4.83]
  - - [128, 128, 1, 8192, 128, 128, 8192, 128]
    - [67, 5.49]
  - - [128, 256, 1, 128, 128, 128, 128, 256]
    - [33, 1.16]
  - - [128, 256, 1, 256, 128, 128, 256, 256]
    - [65, 2.1]
  - - [128, 256, 1, 512, 128, 128, 512, 256]
    - [65, 3.6]
  - - [128, 256, 1, 1024, 128, 128, 1024, 256]
    - [65, 5.6]
  - - [128, 256, 1, 2048, 128, 128, 2048, 256]
    - [67, 7.82]
  - - [128, 256, 1, 4096, 128, 128, 4096, 256]
    - [67, 9.76]
  - - [128, 256, 1, 8192, 128, 128, 8192, 256]
    - [67, 11.11]
  - - [128, 512, 1, 128, 128, 128, 128, 512]
    - [65, 2.25]
  - - [128, 512, 1, 256, 128, 128, 256, 512]
    - [33, 4.0]
  - - [128, 512, 1, 512, 128, 128, 512, 512]
    - [65, 7.04]
  - - [128, 512, 1, 1024, 128, 128, 1024, 512]
    - [65, 11.01]
  - - [128, 512, 1, 2048, 128, 128, 2048, 512]
    - [67, 15.27]
  - - [128, 512, 1, 4096, 128, 128, 4096, 512]
    - [67, 19.23]
  - - [128, 512, 1, 8192, 128, 128, 8192, 512]
    - [85, 18.0]
  - - [128, 1024, 1, 128, 128, 128, 128, 1024]
    - [33, 4.24]
  - - [128, 1024, 1, 256, 128, 128, 256, 1024]
    - [65, 8.04]
  - - [128, 1024, 1, 512, 128, 128, 512, 1024]
    - [65, 13.92]
  - - [128, 1024, 1, 1024, 128, 128, 1024, 1024]
    - [65, 21.67]
  - - [128, 1024, 1, 2048, 128, 128, 2048, 1024]
    - [65, 30.19]
  - - [128, 1024, 1, 4096, 128, 128, 4096, 1024]
    - [85, 31.32]
  - - [128, 1024, 1, 8192, 128, 128, 8192, 1024]
    - [86, 32.32]
  - - [128, 2048, 1, 128, 128, 128, 128, 2048]
    - [32, 8.26]
  - - [128, 2048, 1, 256, 128, 128, 256, 2048]
    - [32, 14.8]
  - - [128, 2048, 1, 512, 128, 128, 512, 2048]
    - [62, 24.87]
  - - [128, 2048, 1, 1024, 128, 128, 1024, 2048]
    - [62, 38.12]
  - - [128, 2048, 1, 2048, 128, 128, 2048, 2048]
    - [80, 44.26]
  - - [128, 2048, 1, 4096, 128, 128, 4096, 2048]
    - [80, 53.04]
  - - [128, 2048, 1, 8192, 128, 128, 8192, 2048]
    - [80, 59.68]
  - - [128, 4096, 1, 128, 128, 128, 128, 4096]
    - [31, 15.26]
  - - [128, 4096, 1, 256, 128, 128, 256, 4096]
    - [30, 27.15]
  - - [128, 4096, 1, 512, 128, 128, 512, 4096]
    - [56, 43.87]
  - - [128, 4096, 1, 1024, 128, 128, 1024, 4096]
    - [57, 65.54]
  - - [128, 4096, 1, 2048, 128, 128, 2048, 4096]
    - [75, 79.01]
  - - [128, 4096, 1, 4096, 128, 128, 4096, 4096]
    - [75, 95.99]
  - - [128, 4096, 1, 8192, 128, 128, 8192, 4096]
    - [75, 108.72]
  - - [128, 8192, 1, 128, 128, 128, 128, 8192]
    - [21, 25.54]
  - - [128, 8192, 1, 256, 128, 128, 256, 8192]
    - [25, 44.91]
  - - [128, 8192, 1, 512, 128, 128, 512, 8192]
    - [25, 72.58]
  - - [128, 8192, 1, 1024, 128, 128, 1024, 8192]
    - [25, 105.74]
  - - [128, 8192, 1, 2048, 128, 128, 2048, 8192]
    - [54, 122.22]
  - - [128, 8192, 1, 4096, 128, 128, 4096, 8192]
    - [54, 143.29]
  - - [128, 8192, 1, 8192, 128, 128, 8192, 8192]
    - [71, 151.98]
  - - [256, 128, 1, 128, 256, 256, 128, 128]
    - [34, 1.04]
  - - [256, 128, 1, 256, 256, 256, 256, 128]
    - [84, 2.01]
  - - [256, 128, 1, 512, 256, 256, 512, 128]
    - [65, 3.5]
  - - [256, 128, 1, 1024, 256, 256, 1024, 128]
    - [65, 5.55]
  - - [256, 128, 1, 2048, 256, 256, 2048, 128]
    - [67, 7.77]
  - - [256, 128, 1, 4096, 256, 256, 4096, 128]
    - [67, 9.68]
  - - [256, 128, 1, 8192, 256, 256, 8192, 128]
    - [67, 11.08]
  - - [256, 256, 1, 128, 256, 256, 128, 256]
    - [65, 2.28]
  - - [256, 256, 1, 256, 256, 256, 256, 256]
    - [33, 4.02]
  - - [256, 256, 1, 512, 256, 256, 512, 256]
    - [65, 7.05]
  - - [256, 256, 1, 1024, 256, 256, 1024, 256]
    - [65, 11.09]
  - - [256, 256, 1, 2048, 256, 256, 2048, 256]
    - [67, 15.45]
  - - [256, 256, 1, 4096, 256, 256, 4096, 256]
    - [67, 19.31]
  - - [256, 256, 1, 8192, 256, 256, 8192, 256]
    - [68, 21.91]
  - - [256, 512, 1, 128, 256, 256, 128, 512]
    - [33, 4.43]
  - - [256, 512, 1, 256, 256, 256, 256, 512]
    - [66, 7.95]
  - - [256, 512, 1, 512, 256, 256, 512, 512]
    - [65, 13.51]
  - - [256, 512, 1, 1024, 256, 256, 1024, 512]
    - [65, 21.29]
  - - [256, 512, 1, 2048, 256, 256, 2048, 512]
    - [65, 29.98]
  - - [256, 512, 1, 4096, 256, 256, 4096, 512]
    - [67, 37.7]
  - - [256, 512, 1, 8192, 256, 256, 8192, 512]
    - [85, 38.8]
  - - [256, 1024, 1, 128, 256, 256, 128, 1024]
    - [32, 8.08]
  - - [256, 1024, 1, 256, 256, 256, 256, 1024]
    - [60, 14.52]
  - - [256, 1024, 1, 512, 256, 256, 512, 1024]
    - [60, 24.2]
  - - [256, 1024, 1, 1024, 256, 256, 1024, 1024]
    - [62, 37.47]
  - - [256, 1024, 1, 2048, 256, 256, 2048, 1024]
    - [62, 52.17]
  - - [256, 1024, 1, 4096, 256, 256, 4096, 1024]
    - [83, 55.44]
  - - [256, 1024, 1, 8192, 256, 256, 8192, 1024]
    - [81, 60.16]
  - - [256, 2048, 1, 128, 256, 256, 128, 2048]
    - [30, 14.79]
  - - [256, 2048, 1, 256, 256, 256, 256, 2048]
    - [30, 26.77]
  - - [256, 2048, 1, 512, 256, 256, 512, 2048]
    - [56, 43.53]
  - - [256, 2048, 1, 1024, 256, 256, 1024, 2048]
    - [57, 64.75]
  - - [256, 2048, 1, 2048, 256, 256, 2048, 2048]
    - [75, 80.59]
  - - [256, 2048, 1, 4096, 256, 256, 4096, 2048]
    - [75, 96.76]
  - - [256, 2048, 1, 8192, 256, 256, 8192, 2048]
    - [75, 109.47]
  - - [256, 4096, 1, 128, 256, 256, 128, 4096]
    - [24, 26.03]
  - - [256, 4096, 1, 256, 256, 256, 256, 4096]
    - [25, 45.47]
  - - [256, 4096, 1, 512, 256, 256, 512, 4096]
    - [25, 74.01]
  - - [256, 4096, 1, 1024, 256, 256, 1024, 4096]
    - [25, 107.11]
  - - [256, 4096, 1, 2048, 256, 256, 2048, 4096]
    - [71, 125.46]
  - - [256, 4096, 1, 4096, 256, 256, 4096, 4096]
    - [71, 148.88]
  - - [256, 4096, 1, 8192, 256, 256, 8192, 4096]
    - [71, 163.75]
  - - [256, 8192, 1, 128, 256, 256, 128, 8192]
    - [49, 40.91]
  - - [256, 8192, 1, 256, 256, 256, 256, 8192]
    - [19, 70.09]
  - - [256, 8192, 1, 512, 256, 256, 512, 8192]
    - [50, 111.77]
  - - [256, 8192, 1, 1024, 256, 256, 1024, 8192]
    - [50, 160.54]
  - - [256, 8192, 1, 2048, 256, 256, 2048, 8192]
    - [50, 182.93]
  - - [256, 8192, 1, 4096, 256, 256, 4096, 8192]
    - [50, 208.0]
  - - [256, 8192, 1, 8192, 256, 256, 8192, 8192]
    - [50, 201.66]
  - - [512, 128, 1, 128, 512, 512, 128, 128]
    - [32, 2.13]
  - - [512, 128, 1, 256, 512, 512, 256, 128]
    - [33, 4.01]
  - - [512, 128, 1, 512, 512, 512, 512, 128]
    - [65, 7.05]
  - - [512, 128, 1, 1024, 512, 512, 1024, 128]
    - [67, 10.62]
  - - [512, 128, 1, 2048, 512, 512, 2048, 128]
    - [65, 14.89]
  - - [512, 128, 1, 4096, 512, 512, 4096, 128]
    - [67, 18.9]
  - - [512, 128, 1, 8192, 512, 512, 8192, 128]
    - [67, 21.89]
  - - [512, 256, 1, 128, 512, 512, 128, 256]
    - [65, 4.19]
  - - [512, 256, 1, 256, 512, 512, 256, 256]
    - [65, 7.64]
  - - [512, 256, 1, 512, 512, 512, 512, 256]
    - [65, 13.21]
  - - [512, 256, 1, 1024, 512, 512, 1024, 256]
    - [65, 20.95]
  - - [512, 256, 1, 2048, 512, 512, 2048, 256]
    - [65, 29.53]
  - - [512, 256, 1, 4096, 512, 512, 4096, 256]
    - [67, 37.64]
  - - [512, 256, 1, 8192, 512, 512, 8192, 256]
    - [70, 43.4]
  - - [512, 512, 1, 128, 512, 512, 128, 512]
    - [32, 8.17]
  - - [512, 512, 1, 256, 512, 512, 256, 512]
    - [61, 14.79]
  - - [512, 512, 1, 512, 512, 512, 512, 512]
    - [61, 24.69]
  - - [512, 512, 1, 1024, 512, 512, 1024, 512]
    - [61, 37.21]
  - - [512, 512, 1, 2048, 512, 512, 2048, 512]
    - [62, 52.08]
  - - [512, 512, 1, 4096, 512, 512, 4096, 512]
    - [64, 63.02]
  - - [512, 512, 1, 8192, 512, 512, 8192, 512]
    - [59, 64.39]
  - - [512, 1024, 1, 128, 512, 512, 128, 1024]
    - [31, 15.05]
  - - [512, 1024, 1, 256, 512, 512, 256, 1024]
    - [31, 26.59]
  - - [512, 1024, 1, 512, 512, 512, 512, 1024]
    - [30, 43.19]
  - - [512, 1024, 1, 1024, 512, 512, 1024, 1024]
    - [75, 64.43]
  - - [512, 1024, 1, 2048, 512, 512, 2048, 1024]
    - [75, 87.46]
  - - [512, 1024, 1, 4096, 512, 512, 4096, 1024]
    - [75, 98.06]
  - - [512, 1024, 1, 8192, 512, 512, 8192, 1024]
    - [77, 107.2]
  - - [512, 2048, 1, 128, 512, 512, 128, 2048]
    - [24, 26.06]
  - - [512, 2048, 1, 256, 512, 512, 256, 2048]
    - [24, 45.45]
  - - [512, 2048, 1, 512, 512, 512, 512, 2048]
    - [25, 73.19]
  - - [512, 2048, 1, 1024, 512, 512, 1024, 2048]
    - [25, 105.7]
  - - [512, 2048, 1, 2048, 512, 512, 2048, 2048]
    - [71, 128.03]
  - - [512, 2048, 1, 4096, 512, 512, 4096, 2048]
    - [71, 151.68]
  - - [512, 2048, 1, 8192, 512, 512, 8192, 2048]
    - [71, 158.19]
  - - [512, 4096, 1, 128, 512, 512, 128, 4096]
    - [23, 41.25]
  - - [512, 4096, 1, 256, 512, 512, 256, 4096]
    - [19, 70.47]
  - - [512, 4096, 1, 512, 512, 512, 512, 4096]
    - [50, 112.09]
  - - [512, 4096, 1, 1024, 512, 512, 1024, 4096]
    - [50, 160.19]
  - - [512, 4096, 1, 2048, 512, 512, 2048, 4096]
    - [50, 189.54]
  - - [512, 4096, 1, 4096, 512, 512, 4096, 4096]
    - [50, 218.97]
  - - [512, 4096, 1, 8192, 512, 512, 8192, 4096]
    - [50, 201.28]
  - - [512, 8192, 1, 128, 512, 512, 128, 8192]
    - [15, 58.47]
  - - [512, 8192, 1, 256, 512, 512, 256, 8192]
    - [15, 99.32]
  - - [512, 8192, 1, 512, 512, 512, 512, 8192]
    - [14, 156.44]
  - - [512, 8192, 1, 1024, 512, 512, 1024, 8192]
    - [17, 213.03]
  - - [512, 8192, 1, 2048, 512, 512, 2048, 8192]
    - [36, 240.64]
  - - [512, 8192, 1, 4096, 512, 512, 4096, 8192]
    - [36, 258.32]
  - - [512, 8192, 1, 8192, 512, 512, 8192, 8192]
    - [35, 238.23]
  - - [1024, 128, 1, 128, 1024, 1024, 128, 128]
    - [33, 4.17]
  - - [1024, 128, 1, 256, 1024, 1024, 256, 128]
    - [33, 7.53]
  - - [1024, 128, 1, 512, 1024, 1024, 512, 128]
    - [33, 13.23]
  - - [1024, 128, 1, 1024, 1024, 1024, 1024, 128]
    - [65, 20.91]
  - - [1024, 128, 1, 2048, 1024, 1024, 2048, 128]
    - [67, 29.49]
  - - [1024, 128, 1, 4096, 1024, 1024, 4096, 128]
    - [67, 37.4]
  - - [1024, 128, 1, 8192, 1024, 1024, 8192, 128]
    - [69, 42.9]
  - - [1024, 256, 1, 128, 1024, 1024, 128, 256]
    - [32, 7.86]
  - - [1024, 256, 1, 256, 1024, 1024, 256, 256]
    - [32, 15.02]
  - - [1024, 256, 1, 512, 1024, 1024, 512, 256]
    - [61, 24.92]
  - - [1024, 256, 1, 1024, 1024, 1024, 1024, 256]
    - [62, 38.03]
  - - [1024, 256, 1, 2048, 1024, 1024, 2048, 256]
    - [62, 52.32]
  - - [1024, 256, 1, 4096, 1024, 1024, 4096, 256]
    - [64, 63.61]
  - - [1024, 256, 1, 8192, 1024, 1024, 8192, 256]
    - [82, 71.58]
  - - [1024, 512, 1, 128, 1024, 1024, 128, 512]
    - [31, 15.27]
  - - [1024, 512, 1, 256, 1024, 1024, 256, 512]
    - [30, 26.56]
  - - [1024, 512, 1, 512, 1024, 1024, 512, 512]
    - [57, 44.03]
  - - [1024, 512, 1, 1024, 1024, 1024, 1024, 512]
    - [57, 66.13]
  - - [1024, 512, 1, 2048, 1024, 1024, 2048, 512]
    - [75, 87.8]
  - - [1024, 512, 1, 4096, 1024, 1024, 4096, 512]
    - [76, 105.57]
  - - [1024, 512, 1, 8192, 1024, 1024, 8192, 512]
    - [78, 109.08]
  - - [1024, 1024, 1, 128, 1024, 1024, 128, 1024]
    - [24, 26.23]
  - - [1024, 1024, 1, 256, 1024, 1024, 256, 1024]
    - [25, 45.59]
  - - [1024, 1024, 1, 512, 1024, 1024, 512, 1024]
    - [25, 73.98]
  - - [1024, 1024, 1, 1024, 1024, 1024, 1024, 1024]
    - [27, 105.43]
  - - [1024, 1024, 1, 2048, 1024, 1024, 2048, 1024]
    - [26, 136.16]
  - - [1024, 1024, 1, 4096, 1024, 1024, 4096, 1024]
    - [72, 147.8]
  - - [1024, 1024, 1, 8192, 1024, 1024, 8192, 1024]
    - [74, 160.25]
  - - [1024, 2048, 1, 128, 1024, 1024, 128, 2048]
    - [23, 41.22]
  - - [1024, 2048, 1, 256, 1024, 1024, 256, 2048]
    - [23, 70.43]
  - - [1024, 2048, 1, 512, 1024, 1024, 512, 2048]
    - [50, 111.59]
  - - [1024, 2048, 1, 1024, 1024, 1024, 1024, 2048]
    - [50, 160.9]
  - - [1024, 2048, 1, 2048, 1024, 1024, 2048, 2048]
    - [50, 194.29]
  - - [1024, 2048, 1, 4096, 1024, 1024, 4096, 2048]
    - [51, 214.34]
  - - [1024, 2048, 1, 8192, 1024, 1024, 8192, 2048]
    - [53, 201.5]
  - - [1024, 4096, 1, 128, 1024, 1024, 128, 4096]
    - [15, 58.83]
  - - [1024, 4096, 1, 256, 1024, 1024, 256, 4096]
    - [14, 99.72]
  - - [1024, 4096, 1, 512, 1024, 1024, 512, 4096]
    - [16, 156.23]
  - - [1024, 4096, 1, 1024, 1024, 1024, 1024, 4096]
    - [16, 212.55]
  - - [1024, 4096, 1, 2048, 1024, 1024, 2048, 4096]
    - [40, 245.76]
  - - [1024, 4096, 1, 4096, 1024, 1024, 4096, 4096]
    - [35, 257.23]
  - - [1024, 4096, 1, 8192, 1024, 1024, 8192, 4096]
    - [37, 237.16]
  - - [1024, 8192, 1, 128, 1024, 1024, 128, 8192]
    - [9, 74.09]
  - - [1024, 8192, 1, 256, 1024, 1024, 256, 8192]
    - [9, 124.43]
  - - [1024, 8192, 1, 512, 1024, 1024, 512, 8192]
    - [1, 184.19]
  - - [1024, 8192, 1, 1024, 1024, 1024, 1024, 8192]
    - [3, 244.2]
  - - [1024, 8192, 1, 2048, 1024, 1024, 2048, 8192]
    - [7, 273.95]
  - - [1024, 8192, 1, 4096, 1024, 1024, 4096, 8192]
    - [6, 266.89]
  - - [1024, 8192, 1, 8192, 1024, 1024, 8192, 8192]
    - [3, 284.29]
  - - [2048, 128, 1, 128, 2048, 2048, 128, 128]
    - [32, 8.33]
  - - [2048, 128, 1, 256, 2048, 2048, 256, 128]
    - [60, 14.78]
  - - [2048, 128, 1, 512, 2048, 2048, 512, 128]
    - [62, 24.89]
  - - [2048, 128, 1, 1024, 2048, 2048, 1024, 128]
    - [62, 38.27]
  - - [2048, 128, 1, 2048, 2048, 2048, 2048, 128]
    - [62, 52.48]
  - - [2048, 128, 1, 4096, 2048, 2048, 4096, 128]
    - [63, 63.56]
  - - [2048, 128, 1, 8192, 2048, 2048, 8192, 128]
    - [79, 71.42]
  - - [2048, 256, 1, 128, 2048, 2048, 128, 256]
    - [31, 15.22]
  - - [2048, 256, 1, 256, 2048, 2048, 256, 256]
    - [30, 26.54]
  - - [2048, 256, 1, 512, 2048, 2048, 512, 256]
    - [58, 43.21]
  - - [2048, 256, 1, 1024, 2048, 2048, 1024, 256]
    - [57, 65.19]
  - - [2048, 256, 1, 2048, 2048, 2048, 2048, 256]
    - [75, 87.45]
  - - [2048, 256, 1, 4096, 2048, 2048, 4096, 256]
    - [77, 105.44]
  - - [2048, 256, 1, 8192, 2048, 2048, 8192, 256]
    - [78, 117.69]
  - - [2048, 512, 1, 128, 2048, 2048, 128, 512]
    - [21, 25.59]
  - - [2048, 512, 1, 256, 2048, 2048, 256, 512]
    - [25, 45.07]
  - - [2048, 512, 1, 512, 2048, 2048, 512, 512]
    - [25, 71.44]
  - - [2048, 512, 1, 1024, 2048, 2048, 1024, 512]
    - [25, 104.42]
  - - [2048, 512, 1, 2048, 2048, 2048, 2048, 512]
    - [28, 136.42]
  - - [2048, 512, 1, 4096, 2048, 2048, 4096, 512]
    - [74, 152.79]
  - - [2048, 512, 1, 8192, 2048, 2048, 8192, 512]
    - [72, 159.16]
  - - [2048, 1024, 1, 128, 2048, 2048, 128, 1024]
    - [22, 41.3]
  - - [2048, 1024, 1, 256, 2048, 2048, 256, 1024]
    - [23, 69.24]
  - - [2048, 1024, 1, 512, 2048, 2048, 512, 1024]
    - [50, 111.54]
  - - [2048, 1024, 1, 1024, 2048, 2048, 1024, 1024]
    - [50, 160.96]
  - - [2048, 1024, 1, 2048, 2048, 2048, 2048, 1024]
    - [53, 197.49]
  - - [2048, 1024, 1, 4096, 2048, 2048, 4096, 1024]
    - [51, 211.39]
  - - [2048, 1024, 1, 8192, 2048, 2048, 8192, 1024]
    - [52, 204.48]
  - - [2048, 2048, 1, 128, 2048, 2048, 128, 2048]
    - [15, 58.84]
  - - [2048, 2048, 1, 256, 2048, 2048, 256, 2048]
    - [14, 99.93]
  - - [2048, 2048, 1, 512, 2048, 2048, 512, 2048]
    - [16, 156.41]
  - - [2048, 2048, 1, 1024, 2048, 2048, 1024, 2048]
    - [16, 203.83]
  - - [2048, 2048, 1, 2048, 2048, 2048, 2048, 2048]
    - [37, 240.69]
  - - [2048, 2048, 1, 4096, 2048, 2048, 4096, 2048]
    - [37, 257.23]
  - - [2048, 2048, 1, 8192, 2048, 2048, 8192, 2048]
    - [45, 236.87]
  - - [2048, 4096, 1, 128, 2048, 2048, 128, 4096]
    - [3, 72.93]
  - - [2048, 4096, 1, 256, 2048, 2048, 256, 4096]
    - [1, 123.85]
  - - [2048, 4096, 1, 512, 2048, 2048, 512, 4096]
    - [6, 183.24]
  - - [2048, 4096, 1, 1024, 2048, 2048, 1024, 4096]
    - [10, 243.88]
  - - [2048, 4096, 1, 2048, 2048, 2048, 2048, 4096]
    - [6, 273.93]
  - - [2048, 4096, 1, 4096, 2048, 2048, 4096, 4096]
    - [6, 263.15]
  - - [2048, 4096, 1, 8192, 2048, 2048, 8192, 4096]
    - [6, 281.38]
  - - [2048, 8192, 1, 128, 2048, 2048, 128, 8192]
    - [9, 79.9]
  - - [2048, 8192, 1, 256, 2048, 2048, 256, 8192]
    - [9, 133.36]
  - - [2048, 8192, 1, 512, 2048, 2048, 512, 8192]
    - [6, 195.05]
  - - [2048, 8192, 1, 1024, 2048, 2048, 1024, 8192]
    - [10, 238.27]
  - - [2048, 8192, 1, 2048, 2048, 2048, 2048, 8192]
    - [11, 250.9]
  - - [2048, 8192, 1, 4096, 2048, 2048, 4096, 8192]
    - [7, 282.65]
  - - [2048, 8192, 1, 8192, 2048, 2048, 8192, 8192]
    - [39, 309.48]
  - - [4096, 128, 1, 128, 4096, 4096, 128, 128]
    - [29, 14.98]
  - - [4096, 128, 1, 256, 4096, 4096, 256, 128]
    - [30, 26.64]
  - - [4096, 128, 1, 512, 4096, 4096, 512, 128]
    - [57, 43.21]
  - - [4096, 128, 1, 1024, 4096, 4096, 1024, 128]
    - [57, 65.24]
  - - [4096, 128, 1, 2048, 4096, 4096, 2048, 128]
    - [75, 87.46]
  - - [4096, 128, 1, 4096, 4096, 4096, 4096, 128]
    - [76, 105.49]
  - - [4096, 128, 1, 8192, 4096, 4096, 8192, 128]
    - [76, 118.28]
  - - [4096, 256, 1, 128, 4096, 4096, 128, 256]
    - [21, 25.53]
  - - [4096, 256, 1, 256, 4096, 4096, 256, 256]
    - [27, 44.78]
  - - [4096, 256, 1, 512, 4096, 4096, 512, 256]
    - [25, 73.01]
  - - [4096, 256, 1, 1024, 4096, 4096, 1024, 256]
    - [28, 105.94]
  - - [4096, 256, 1, 2048, 4096, 4096, 2048, 256]
    - [28, 137.1]
  - - [4096, 256, 1, 4096, 4096, 4096, 4096, 256]
    - [73, 152.07]
  - - [4096, 256, 1, 8192, 4096, 4096, 8192, 256]
    - [72, 160.43]
  - - [4096, 512, 1, 128, 4096, 4096, 128, 512]
    - [20, 39.71]
  - - [4096, 512, 1, 256, 4096, 4096, 256, 512]
    - [23, 70.38]
  - - [4096, 512, 1, 512, 4096, 4096, 512, 512]
    - [50, 111.56]
  - - [4096, 512, 1, 1024, 4096, 4096, 1024, 512]
    - [50, 159.3]
  - - [4096, 512, 1, 2048, 4096, 4096, 2048, 512]
    - [51, 198.92]
  - - [4096, 512, 1, 4096, 4096, 4096, 4096, 512]
    - [51, 204.95]
  - - [4096, 512, 1, 8192, 4096, 4096, 8192, 512]
    - [52, 208.72]
  - - [4096, 1024, 1, 128, 4096, 4096, 128, 1024]
    - [15, 58.03]
  - - [4096, 1024, 1, 256, 4096, 4096, 256, 1024]
    - [14, 99.75]
  - - [4096, 1024, 1, 512, 4096, 4096, 512, 1024]
    - [16, 155.9]
  - - [4096, 1024, 1, 1024, 4096, 4096, 1024, 1024]
    - [42, 208.15]
  - - [4096, 1024, 1, 2048, 4096, 4096, 2048, 1024]
    - [37, 245.6]
  - - [4096, 1024, 1, 4096, 4096, 4096, 4096, 1024]
    - [37, 262.1]
  - - [4096, 1024, 1, 8192, 4096, 4096, 8192, 1024]
    - [44, 244.73]
  - - [4096, 2048, 1, 128, 4096, 4096, 128, 2048]
    - [1, 72.64]
  - - [4096, 2048, 1, 256, 4096, 4096, 256, 2048]
    - [1, 121.97]
  - - [4096, 2048, 1, 512, 4096, 4096, 512, 2048]
    - [6, 183.16]
  - - [4096, 2048, 1, 1024, 4096, 4096, 1024, 2048]
    - [9, 245.75]
  - - [4096, 2048, 1, 2048, 4096, 4096, 2048, 2048]
    - [4, 273.55]
  - - [4096, 2048, 1, 4096, 4096, 4096, 4096, 2048]
    - [43, 268.24]
  - - [4096, 2048, 1, 8192, 4096, 4096, 8192, 2048]
    - [46, 293.97]
  - - [4096, 4096, 1, 128, 4096, 4096, 128, 4096]
    - [9, 79.4]
  - - [4096, 4096, 1, 256, 4096, 4096, 256, 4096]
    - [9, 132.13]
  - - [4096, 4096, 1, 512, 4096, 4096, 512, 4096]
    - [10, 193.76]
  - - [4096, 4096, 1, 1024, 4096, 4096, 1024, 4096]
    - [10, 237.02]
  - - [4096, 4096, 1, 2048, 4096, 4096, 2048, 4096]
    - [45, 246.9]
  - - [4096, 4096, 1, 4096, 4096, 4096, 4096, 4096]
    - [7, 280.42]
  - - [4096, 4096, 1, 8192, 4096, 4096, 8192, 4096]
    - [41, 315.28]
  - - [4096, 8192, 1, 128, 4096, 4096, 128, 8192]
    - [5, 83.08]
  - - [4096, 8192, 1, 256, 4096, 4096, 256, 8192]
    - [9, 135.22]
  - - [4096, 8192, 1, 512, 4096, 4096, 512, 8192]
    - [12, 197.58]
  - - [4096, 8192, 1, 1024, 4096, 4096, 1024, 8192]
    - [39, 236.23]
  - - [4096, 8192, 1, 2048, 4096, 4096, 2048, 8192]
    - [38, 282.82]
  - - [4096, 8192, 1, 4096, 4096, 4096, 4096, 8192]
    - [2, 329.86]
  - - [4096, 8192, 1, 8192, 4096, 4096, 8192, 8192]
    - [1, 362.17]
  - - [8192, 128, 1, 128, 8192, 8192, 128, 128]
    - [21, 26.64]
  - - [8192, 128, 1, 256, 8192, 8192, 256, 128]
    - [25, 46.47]
  - - [8192, 128, 1, 512, 8192, 8192, 512, 128]
    - [25, 73.93]
  - - [8192, 128, 1, 1024, 8192, 8192, 1024, 128]
    - [25, 107.73]
  - - [8192, 128, 1, 2048, 8192, 8192, 2048, 128]
    - [26, 136.69]
  - - [8192, 128, 1, 4096, 8192, 8192, 4096, 128]
    - [54, 146.55]
  - - [8192, 128, 1, 8192, 8192, 8192, 8192, 128]
    - [55, 156.56]
  - - [8192, 256, 1, 128, 8192, 8192, 128, 256]
    - [49, 41.1]
  - - [8192, 256, 1, 256, 8192, 8192, 256, 256]
    - [19, 70.18]
  - - [8192, 256, 1, 512, 8192, 8192, 512, 256]
    - [50, 111.54]
  - - [8192, 256, 1, 1024, 8192, 8192, 1024, 256]
    - [50, 161.48]
  - - [8192, 256, 1, 2048, 8192, 8192, 2048, 256]
    - [53, 199.84]
  - - [8192, 256, 1, 4096, 8192, 8192, 4096, 256]
    - [51, 204.14]
  - - [8192, 256, 1, 8192, 8192, 8192, 8192, 256]
    - [53, 204.18]
  - - [8192, 512, 1, 128, 8192, 8192, 128, 512]
    - [15, 58.05]
  - - [8192, 512, 1, 256, 8192, 8192, 256, 512]
    - [14, 99.51]
  - - [8192, 512, 1, 512, 8192, 8192, 512, 512]
    - [18, 154.34]
  - - [8192, 512, 1, 1024, 8192, 8192, 1024, 512]
    - [47, 216.85]
  - - [8192, 512, 1, 2048, 8192, 8192, 2048, 512]
    - [37, 243.06]
  - - [8192, 512, 1, 4096, 8192, 8192, 4096, 512]
    - [38, 259.18]
  - - [8192, 512, 1, 8192, 8192, 8192, 8192, 512]
    - [48, 262.32]
  - - [8192, 1024, 1, 128, 8192, 8192, 128, 1024]
    - [6, 72.67]
  - - [8192, 1024, 1, 256, 8192, 8192, 256, 1024]
    - [9, 122.49]
  - - [8192, 1024, 1, 512, 8192, 8192, 512, 1024]
    - [6, 181.23]
  - - [8192, 1024, 1, 1024, 8192, 8192, 1024, 1024]
    - [6, 240.01]
  - - [8192, 1024, 1, 2048, 8192, 8192, 2048, 1024]
    - [3, 276.26]
  - - [8192, 1024, 1, 4096, 8192, 8192, 4096, 1024]
    - [45, 337.37]
  - - [8192, 1024, 1, 8192, 8192, 8192, 8192, 1024]
    - [45, 376.41]
  - - [8192, 2048, 1, 128, 8192, 8192, 128, 2048]
    - [1, 77.15]
  - - [8192, 2048, 1, 256, 8192, 8192, 256, 2048]
    - [1, 128.67]
  - - [8192, 2048, 1, 512, 8192, 8192, 512, 2048]
    - [7, 188.79]
  - - [8192, 2048, 1, 1024, 8192, 8192, 1024, 2048]
    - [3, 236.13]
  - - [8192, 2048, 1, 2048, 8192, 8192, 2048, 2048]
    - [44, 306.72]
  - - [8192, 2048, 1, 4096, 8192, 8192, 4096, 2048]
    - [44, 344.59]
  - - [8192, 2048, 1, 8192, 8192, 8192, 8192, 2048]
    - [46, 393.14]
  - - [8192, 4096, 1, 128, 8192, 8192, 128, 4096]
    - [0, 83.28]
  - - [8192, 4096, 1, 256, 8192, 8192, 256, 4096]
    - [8, 133.25]
  - - [8192, 4096, 1, 512, 8192, 8192, 512, 4096]
    - [13, 197.73]
  - - [8192, 4096, 1, 1024, 8192, 8192, 1024, 4096]
    - [45, 245.51]
  - - [8192, 4096, 1, 2048, 8192, 8192, 2048, 4096]
    - [46, 308.46]
  - - [8192, 4096, 1, 4096, 8192, 8192, 4096, 4096]
    - [45, 364.24]
  - - [8192, 4096, 1, 8192, 8192, 8192, 8192, 4096]
    - [44, 411.07]
  - - [8192, 8192, 1, 128, 8192, 8192, 128, 8192]
    - [22, 86.07]
  - - [8192, 8192, 1, 256, 8192, 8192, 256, 8192]
    - [13, 147.9]
  - - [8192, 8192, 1, 512, 8192, 8192, 512, 8192]
    - [3, 211.95]
  - - [8192, 8192, 1, 1024, 8192, 8192, 1024, 8192]
    - [9, 281.75]
  - - [8192, 8192, 1, 2048, 8192, 8192, 2048, 8192]
    - [9, 333.92]
  - - [8192, 8192, 1, 4096, 8192, 8192, 4096, 8192]
    - [46, 377.55]
  - - [8192, 8192, 1, 8192, 8192, 8192, 8192, 8192]
    - [45, 410.65]
- null
- null
- ExperimentalStreamK
- GridBased
