projects/hipblaslt/library/src/amd_detail/rocblaslt/src/Tensile/Logic/asm_full/aquavanjaram/gfx942_228cu/StreamK/aquavanjaram942_Cijk_Ailk_Bljk_B8F8NF8NS_BH_Bias_HAS_SAV_UserArgs.yaml
- {MinimumRequiredVersion: 4.33.0}
- aquavanjaram942
- {Architecture: gfx942, CUCount: 228}
- [Device 0049, Device 0050]
    SolutionIndex: 0
    SolutionNameMin: Cijk_Ailk_Bljk_B8F8NF8NS_BH_Bias_HAS_SAV_UserArgs_MT256x256x64_MI16x16x1_SN_LDSB1_CLR1_GRVWA16_GRVWB8_GSU0_GSUC0_GSUWGMRR0_K1_LBSPPA2048_LBSPPB512_LPA0_LPB8_LRVW8_MIWT8_8_PLR1_SU0_SUM0_SUS64_VWA8_VWB8_WGM1_WGMXCC1_WGMXCCGn1
    SolutionIndex: 1
    SolutionNameMin: Cijk_Ailk_Bljk_B8F8NF8NS_BH_Bias_HAS_SAV_UserArgs_MT256x256x64_MI16x16x1_SN_LDSB1_CLR1_GRVWA8_GRVWB16_GSU0_GSUC0_GSUWGMRR0_K1_LBSPPA2048_LBSPPB512_LPA0_LPB16_LRVW8_MIWT8_8_PLR1_SU0_SUM0_SUS64_VWA8_VWB8_WGM1_WGMXCC1_WGMXCCGn1
    SolutionIndex: 2
    SolutionNameMin: Cijk_Ailk_Bljk_B8F8NF8NS_BH_Bias_HAS_SAV_UserArgs_MT256x256x64_MI16x16x1_SN_LDSB1_CLR1_GRVWA16_GRVWB16_GSU0_GSUC0_GSUWGMRR0_K1_LBSPPA2048_LBSPPB512_LPA0_LPB16_LRVW8_MIWT8_8_PLR1_SU0_SUM0_SUS64_VWA8_VWB8_WGM1_WGMXCC1_WGMXCCGn1
    SolutionIndex: 3
    SolutionNameMin: Cijk_Ailk_Bljk_B8F8NF8NS_BH_Bias_HAS_SAV_UserArgs_MT256x256x64_MI16x16x1_SN_LDSB1_CLR1_GRVWA16_GRVWB8_GSU0_GSUC0_GSUWGMRR0_K1_LBSPPA2048_LBSPPB512_LPA0_LPB8_LRVW8_MIWT8_8_PLR1_SU0_SUM0_SUS64_VWA8_VWB8_WGM4_WGMXCC1_WGMXCCGn1
    SolutionIndex: 4
    SolutionNameMin: Cijk_Ailk_Bljk_B8F8NF8NS_BH_Bias_HAS_SAV_UserArgs_MT256x256x64_MI16x16x1_SN_LDSB1_CLR1_GRVWA8_GRVWB16_GSU0_GSUC0_GSUWGMRR0_K1_LBSPPA2048_LBSPPB512_LPA0_LPB16_LRVW8_MIWT8_8_PLR1_SU0_SUM0_SUS64_VWA8_VWB8_WGM4_WGMXCC1_WGMXCCGn1
    SolutionIndex: 5
    SolutionNameMin: Cijk_Ailk_Bljk_B8F8NF8NS_BH_Bias_HAS_SAV_UserArgs_MT256x256x64_MI16x16x1_SN_LDSB1_CLR1_GRVWA16_GRVWB16_GSU0_GSUC0_GSUWGMRR0_K1_LBSPPA2048_LBSPPB512_LPA0_LPB16_LRVW8_MIWT8_8_PLR1_SU0_SUM0_SUS64_VWA8_VWB8_WGM4_WGMXCC1_WGMXCCGn1
    SolutionIndex: 6
    SolutionNameMin: Cijk_Ailk_Bljk_B8F8NF8NS_BH_Bias_HAS_SAV_UserArgs_MT256x256x64_MI16x16x1_SN_LDSB1_CLR1_GRVWA8_GRVWB16_GSU0_GSUC0_GSUWGMRR0_K1_LBSPPA2048_LBSPPB512_LPA0_LPB16_LRVW8_MIWT8_8_PLR1_SU0_SUM0_SUS64_VWA8_VWB8_WGM6_WGMXCC1_WGMXCCGn1
    SolutionIndex: 7
    SolutionNameMin: Cijk_Ailk_Bljk_B8F8NF8NS_BH_Bias_HAS_SAV_UserArgs_MT256x256x64_MI16x16x1_SN_LDSB1_CLR1_GRVWA16_GRVWB16_GSU0_GSUC0_GSUWGMRR0_K1_LBSPPA2048_LBSPPB512_LPA0_LPB16_LRVW8_MIWT8_8_PLR1_SU0_SUM0_SUS64_VWA8_VWB8_WGM6_WGMXCC1_WGMXCCGn1
    SolutionIndex: 8
    SolutionNameMin: Cijk_Ailk_Bljk_B8F8NF8NS_BH_Bias_HAS_SAV_UserArgs_MT256x256x64_MI16x16x1_SN_LDSB1_CLR1_GRVWA8_GRVWB8_GSU0_GSUC0_GSUWGMRR0_K1_LBSPPA2048_LBSPPB512_LPA0_LPB8_LRVW8_MIWT8_8_PLR1_SU0_SUM0_SUS64_VWA8_VWB8_WGM8_WGMXCC1_WGMXCCGn1
    SolutionIndex: 9
    SolutionNameMin: Cijk_Ailk_Bljk_B8F8NF8NS_BH_Bias_HAS_SAV_UserArgs_MT256x256x64_MI16x16x1_SN_LDSB1_CLR1_GRVWA16_GRVWB8_GSU0_GSUC0_GSUWGMRR0_K1_LBSPPA2048_LBSPPB512_LPA0_LPB8_LRVW8_MIWT8_8_PLR1_SU0_SUM0_SUS64_VWA8_VWB8_WGM8_WGMXCC1_WGMXCCGn1
    SolutionIndex: 10
    SolutionNameMin: Cijk_Ailk_Bljk_B8F8NF8NS_BH_Bias_HAS_SAV_UserArgs_MT256x256x64_MI16x16x1_SN_LDSB1_CLR1_GRVWA8_GRVWB16_GSU0_GSUC0_GSUWGMRR0_K1_LBSPPA2048_LBSPPB512_LPA0_LPB16_LRVW8_MIWT8_8_PLR1_SU0_SUM0_SUS64_VWA8_VWB8_WGM8_WGMXCC1_WGMXCCGn1
    SolutionIndex: 11
    SolutionNameMin: Cijk_Ailk_Bljk_B8F8NF8NS_BH_Bias_HAS_SAV_UserArgs_MT256x256x64_MI16x16x1_SN_LDSB1_CLR1_GRVWA16_GRVWB16_GSU0_GSUC0_GSUWGMRR0_K1_LBSPPA2048_LBSPPB512_LPA0_LPB16_LRVW8_MIWT8_8_PLR1_SU0_SUM0_SUS64_VWA8_VWB8_WGM8_WGMXCC1_WGMXCCGn1
    SolutionIndex: 12
    SolutionNameMin: Cijk_Ailk_Bljk_B8F8NF8NS_BH_Bias_HAS_SAV_UserArgs_MT128x256x64_MI16x16x1_SN_LDSB1_CLR1_GRVWA16_GRVWB8_GSU0_GSUC0_GSUWGMRR0_K1_LBSPPA1024_LBSPPB512_LPA64_LPB8_LRVW8_MIWT4_8_PLR1_SU0_SUM0_SUS64_VWA4_VWB8_WGM1_WGMXCC1_WGMXCCGn1
    SolutionIndex: 13
    SolutionNameMin: Cijk_Ailk_Bljk_B8F8NF8NS_BH_Bias_HAS_SAV_UserArgs_MT128x256x64_MI16x16x1_SN_LDSB1_CLR1_GRVWA16_GRVWB8_GSU0_GSUC0_GSUWGMRR0_K1_LBSPPA1024_LBSPPB512_LPA64_LPB8_LRVW8_MIWT4_8_PLR1_SU0_SUM0_SUS64_VWA4_VWB8_WGM6_WGMXCC1_WGMXCCGn1
    SolutionIndex: 14
    SolutionNameMin: Cijk_Ailk_Bljk_B8F8NF8NS_BH_Bias_HAS_SAV_UserArgs_MT128x256x64_MI16x16x1_SN_LDSB1_CLR1_GRVWA16_GRVWB8_GSU0_GSUC0_GSUWGMRR0_K1_LBSPPA1024_LBSPPB512_LPA64_LPB8_LRVW8_MIWT4_8_PLR1_SU0_SUM0_SUS64_VWA4_VWB8_WGM8_WGMXCC1_WGMXCCGn1
    SolutionIndex: 15
    SolutionNameMin: Cijk_Ailk_Bljk_B8F8NF8NS_BH_Bias_HAS_SAV_UserArgs_MT256x128x64_MI16x16x1_SN_LDSB1_CLR1_GRVWA16_GRVWB16_GSU0_GSUC0_GSUWGMRR0_K1_LBSPPA2048_LBSPPB256_LPA0_LPB16_LRVW8_MIWT8_4_PLR1_SU0_SUM0_SUS64_VWA8_VWB4_WGM1_WGMXCC1_WGMXCCGn1
    SolutionIndex: 16
    SolutionNameMin: Cijk_Ailk_Bljk_B8F8NF8NS_BH_Bias_HAS_SAV_UserArgs_MT256x128x64_MI16x16x1_SN_LDSB1_CLR1_GRVWA16_GRVWB16_GSU0_GSUC0_GSUWGMRR0_K1_LBSPPA2048_LBSPPB256_LPA0_LPB16_LRVW8_MIWT8_4_PLR1_SU0_SUM0_SUS64_VWA8_VWB4_WGM6_WGMXCC1_WGMXCCGn1
    SolutionIndex: 17
    SolutionNameMin: Cijk_Ailk_Bljk_B8F8NF8NS_BH_Bias_HAS_SAV_UserArgs_MT256x128x64_MI16x16x1_SN_LDSB1_CLR1_GRVWA16_GRVWB8_GSU0_GSUC0_GSUWGMRR0_K1_LBSPPA2048_LBSPPB256_LPA0_LPB8_LRVW8_MIWT8_4_PLR1_SU0_SUM0_SUS64_VWA8_VWB4_WGM8_WGMXCC1_WGMXCCGn1
    SolutionIndex: 18
    SolutionNameMin: Cijk_Ailk_Bljk_B8F8NF8NS_BH_Bias_HAS_SAV_UserArgs_MT256x128x64_MI16x16x1_SN_LDSB1_CLR1_GRVWA16_GRVWB16_GSU0_GSUC0_GSUWGMRR0_K1_LBSPPA2048_LBSPPB256_LPA0_LPB16_LRVW8_MIWT8_4_PLR1_SU0_SUM0_SUS64_VWA8_VWB4_WGM8_WGMXCC1_WGMXCCGn1
    SolutionIndex: 19
    SolutionNameMin: Cijk_Ailk_Bljk_B8F8NF8NS_BH_Bias_HAS_SAV_UserArgs_MT128x128x64_MI16x16x1_SN_LDSB1_CLR1_GRVWA8_GRVWB8_GSU0_GSUC0_GSUWGMRR0_K1_LBSPPA1024_LBSPPB128_LPA0_LPB8_LRVW8_MIWT8_2_PLR1_SU0_SUM0_SUS64_VWA8_VWB2_WGM8_WGMXCC1_WGMXCCGn1
    SolutionIndex: 20
    SolutionNameMin: Cijk_Ailk_Bljk_B8F8NF8NS_BH_Bias_HAS_SAV_UserArgs_MT256x32x64_MI16x16x1_SN_LDSB1_CLR1_GRVWA16_GRVWB8_GSU0_GSUC0_GSUWGMRR0_K1_LBSPPA2048_LBSPPB128_LPA0_LPB8_LRVW8_MIWT8_1_PLR1_SU0_SUM0_SUS64_VWA8_VWB1_WGM8_WGMXCC1_WGMXCCGn1
    SolutionIndex: 21
    SolutionNameMin: Cijk_Ailk_Bljk_B8F8NF8NS_BH_Bias_HAS_SAV_UserArgs_MT128x128x64_MI16x16x1_SN_LDSB1_CLR1_GRVWA16_GRVWB8_GSU0_GSUC0_GSUWGMRR0_K1_LBSPPA1024_LBSPPB256_LPA64_LPB8_LRVW8_MIWT4_4_PLR1_SU0_SUM0_SUS64_VWA4_VWB4_WGM1_WGMXCC1_WGMXCCGn1
    SolutionIndex: 22
    SolutionNameMin: Cijk_Ailk_Bljk_B8F8NF8NS_BH_Bias_HAS_SAV_UserArgs_MT128x128x64_MI16x16x1_SN_LDSB1_CLR1_GRVWA8_GRVWB16_GSU0_GSUC0_GSUWGMRR0_K1_LBSPPA1024_LBSPPB256_LPA64_LPB16_LRVW8_MIWT4_4_PLR1_SU0_SUM0_SUS64_VWA4_VWB4_WGM1_WGMXCC1_WGMXCCGn1
    SolutionIndex: 23
    SolutionNameMin: Cijk_Ailk_Bljk_B8F8NF8NS_BH_Bias_HAS_SAV_UserArgs_MT128x128x64_MI16x16x1_SN_LDSB1_CLR1_GRVWA16_GRVWB16_GSU0_GSUC0_GSUWGMRR0_K1_LBSPPA1024_LBSPPB256_LPA64_LPB16_LRVW8_MIWT4_4_PLR1_SU0_SUM0_SUS64_VWA4_VWB4_WGM1_WGMXCC1_WGMXCCGn1
    SolutionIndex: 24
    SolutionNameMin: Cijk_Ailk_Bljk_B8F8NF8NS_BH_Bias_HAS_SAV_UserArgs_MT64x128x64_MI16x16x1_SN_LDSB0_CLR1_GRVWA16_GRVWB8_GSU0_GSUC0_GSUWGMRR0_K1_LBSPPA512_LBSPPB256_LPA32_LPB8_LRVW8_MIWT2_4_PLR1_SU0_SUM0_SUS64_VWA2_VWB4_WGM1_WGMXCC1_WGMXCCGn1
    SolutionIndex: 25
    SolutionNameMin: Cijk_Ailk_Bljk_B8F8NF8NS_BH_Bias_HAS_SAV_UserArgs_MT64x128x64_MI16x16x1_SN_LDSB0_CLR1_GRVWA8_GRVWB16_GSU0_GSUC0_GSUWGMRR0_K1_LBSPPA512_LBSPPB256_LPA32_LPB16_LRVW8_MIWT2_4_PLR1_SU0_SUM0_SUS64_VWA2_VWB4_WGM1_WGMXCC1_WGMXCCGn1
    SolutionIndex: 26
    SolutionNameMin: Cijk_Ailk_Bljk_B8F8NF8NS_BH_Bias_HAS_SAV_UserArgs_MT64x128x64_MI16x16x1_SN_LDSB0_CLR1_GRVWA16_GRVWB16_GSU0_GSUC0_GSUWGMRR0_K1_LBSPPA512_LBSPPB256_LPA32_LPB16_LRVW8_MIWT2_4_PLR1_SU0_SUM0_SUS64_VWA2_VWB4_WGM1_WGMXCC1_WGMXCCGn1
    SolutionIndex: 27
    SolutionNameMin: Cijk_Ailk_Bljk_B8F8NF8NS_BH_Bias_HAS_SAV_UserArgs_MT64x128x64_MI16x16x1_SN_LDSB0_CLR1_GRVWA16_GRVWB8_GSU0_GSUC0_GSUWGMRR0_K1_LBSPPA512_LBSPPB256_LPA32_LPB8_LRVW8_MIWT2_4_PLR1_SU0_SUM0_SUS64_VWA2_VWB4_WGM4_WGMXCC1_WGMXCCGn1
    SolutionIndex: 28
    SolutionNameMin: Cijk_Ailk_Bljk_B8F8NF8NS_BH_Bias_HAS_SAV_UserArgs_MT64x128x64_MI16x16x1_SN_LDSB0_CLR1_GRVWA8_GRVWB16_GSU0_GSUC0_GSUWGMRR0_K1_LBSPPA512_LBSPPB256_LPA32_LPB16_LRVW8_MIWT2_4_PLR1_SU0_SUM0_SUS64_VWA2_VWB4_WGM4_WGMXCC1_WGMXCCGn1
    SolutionIndex: 29
    SolutionNameMin: Cijk_Ailk_Bljk_B8F8NF8NS_BH_Bias_HAS_SAV_UserArgs_MT128x64x64_MI16x16x1_SN_LDSB0_CLR1_GRVWA8_GRVWB8_GSU0_GSUC0_GSUWGMRR0_K1_LBSPPA1024_LBSPPB128_LPA64_LPB8_LRVW8_MIWT4_2_PLR1_SU0_SUM0_SUS64_VWA4_VWB2_WGM1_WGMXCC1_WGMXCCGn1
    SolutionIndex: 30
    SolutionNameMin: Cijk_Ailk_Bljk_B8F8NF8NS_BH_Bias_HAS_SAV_UserArgs_MT128x64x64_MI16x16x1_SN_LDSB0_CLR1_GRVWA16_GRVWB8_GSU0_GSUC0_GSUWGMRR0_K1_LBSPPA1024_LBSPPB128_LPA64_LPB8_LRVW8_MIWT4_2_PLR1_SU0_SUM0_SUS64_VWA4_VWB2_WGM1_WGMXCC1_WGMXCCGn1
    SolutionIndex: 31
    SolutionNameMin: Cijk_Ailk_Bljk_B8F8NF8NS_BH_Bias_HAS_SAV_UserArgs_MT128x64x64_MI16x16x1_SN_LDSB0_CLR1_GRVWA8_GRVWB16_GSU0_GSUC0_GSUWGMRR0_K1_LBSPPA1024_LBSPPB128_LPA64_LPB16_LRVW8_MIWT4_2_PLR1_SU0_SUM0_SUS64_VWA4_VWB2_WGM1_WGMXCC1_WGMXCCGn1
    SolutionIndex: 32
    SolutionNameMin: Cijk_Ailk_Bljk_B8F8NF8NS_BH_Bias_HAS_SAV_UserArgs_MT128x64x64_MI16x16x1_SN_LDSB0_CLR1_GRVWA16_GRVWB16_GSU0_GSUC0_GSUWGMRR0_K1_LBSPPA1024_LBSPPB128_LPA64_LPB16_LRVW8_MIWT4_2_PLR1_SU0_SUM0_SUS64_VWA4_VWB2_WGM1_WGMXCC1_WGMXCCGn1
    SolutionIndex: 33
    SolutionNameMin: Cijk_Ailk_Bljk_B8F8NF8NS_BH_Bias_HAS_SAV_UserArgs_MT64x64x64_MI16x16x1_SN_LDSB0_CLR1_GRVWA8_GRVWB8_GSU0_GSUC0_GSUWGMRR0_K1_LBSPPA512_LBSPPB128_LPA32_LPB8_LRVW8_MIWT2_2_PLR1_SU0_SUM0_SUS64_VWA2_VWB2_WGM1_WGMXCC1_WGMXCCGn1
    SolutionIndex: 34
    SolutionNameMin: Cijk_Ailk_Bljk_B8F8NF8NS_BH_Bias_HAS_SAV_UserArgs_MT64x64x64_MI16x16x1_SN_LDSB0_CLR1_GRVWA8_GRVWB16_GSU0_GSUC0_GSUWGMRR0_K1_LBSPPA512_LBSPPB128_LPA32_LPB16_LRVW8_MIWT2_2_PLR1_SU0_SUM0_SUS64_VWA2_VWB2_WGM1_WGMXCC1_WGMXCCGn1
    SolutionIndex: 35
    SolutionNameMin: Cijk_Ailk_Bljk_B8F8NF8NS_BH_Bias_HAS_SAV_UserArgs_MT32x64x64_MI16x16x1_SN_LDSB0_CLR1_GRVWA8_GRVWB8_GSU0_GSUC0_GSUWGMRR0_K1_LBSPPA256_LBSPPB128_LPA16_LPB8_LRVW8_MIWT1_2_PLR1_SU0_SUM0_SUS64_VWA1_VWB2_WGM1_WGMXCC1_WGMXCCGn1
    SolutionIndex: 36
    SolutionNameMin: Cijk_Ailk_Bljk_B8F8NF8NS_BH_Bias_HAS_SAV_UserArgs_MT64x32x64_MI16x16x1_SN_LDSB0_CLR1_GRVWA8_GRVWB8_GSU0_GSUC0_GSUWGMRR0_K1_LBSPPA512_LBSPPB128_LPA32_LPB8_LRVW8_MIWT2_1_PLR1_SU0_SUM0_SUS64_VWA2_VWB1_WGM1_WGMXCC1_WGMXCCGn1
    SolutionIndex: 37
    SolutionNameMin: Cijk_Ailk_Bljk_B8F8NF8NS_BH_Bias_HAS_SAV_UserArgs_MT32x32x64_MI16x16x1_SN_LDSB0_CLR1_GRVWA8_GRVWB8_GSU0_GSUC0_GSUWGMRR0_K1_LBSPPA256_LBSPPB128_LPA16_LPB8_LRVW8_MIWT1_1_PLR1_SU0_SUM0_SUS64_VWA1_VWB1_WGM1_WGMXCC1_WGMXCCGn1
    SolutionIndex: 38
    SolutionNameMin: Cijk_Ailk_Bljk_B8F8NF8NS_BH_Bias_HAS_SAV_UserArgs_MT128x256x128_MI16x16x1_SN_LDSB1_CLR1_GRVWA16_GRVWB16_GSU0_GSUC0_GSUWGMRR0_K1_LBSPPA1024_LBSPPB1024_LPA64_LPB16_LRVW8_MIWT4_8_PLR1_SU0_SUM0_SUS128_VWA4_VWB8_WGM1_WGMXCC1_WGMXCCGn1
    SolutionIndex: 39
    SolutionNameMin: Cijk_Ailk_Bljk_B8F8NF8NS_BH_Bias_HAS_SAV_UserArgs_MT128x256x128_MI16x16x1_SN_LDSB1_CLR1_GRVWA16_GRVWB16_GSU0_GSUC0_GSUWGMRR0_K1_LBSPPA1024_LBSPPB1024_LPA64_LPB16_LRVW8_MIWT4_8_PLR1_SU0_SUM0_SUS128_VWA4_VWB8_WGM4_WGMXCC1_WGMXCCGn1
    SolutionIndex: 40
    SolutionNameMin: Cijk_Ailk_Bljk_B8F8NF8NS_BH_Bias_HAS_SAV_UserArgs_MT128x256x128_MI16x16x1_SN_LDSB1_CLR1_GRVWA16_GRVWB16_GSU0_GSUC0_GSUWGMRR0_K1_LBSPPA1024_LBSPPB1024_LPA64_LPB16_LRVW8_MIWT4_8_PLR1_SU0_SUM0_SUS128_VWA4_VWB8_WGM6_WGMXCC1_WGMXCCGn1
    SolutionIndex: 41
    SolutionNameMin: Cijk_Ailk_Bljk_B8F8NF8NS_BH_Bias_HAS_SAV_UserArgs_MT256x144x128_MI16x16x1_SN_LDSB1_CLR1_GRVWA16_GRVWB8_GSU0_GSUC0_GSUWGMRR0_K1_LBSPPA2048_LBSPPB128_LPA64_LPB8_LRVW8_MIWT4_9_PLR1_SU0_SUM0_SUS128_VWA4_VWB1_WGM1_WGMXCC1_WGMXCCGn1
    SolutionIndex: 42
    SolutionNameMin: Cijk_Ailk_Bljk_B8F8NF8NS_BH_Bias_HAS_SAV_UserArgs_MT256x144x128_MI16x16x1_SN_LDSB1_CLR1_GRVWA16_GRVWB8_GSU0_GSUC0_GSUWGMRR0_K1_LBSPPA2048_LBSPPB128_LPA64_LPB8_LRVW8_MIWT4_9_PLR1_SU0_SUM0_SUS128_VWA4_VWB1_WGM4_WGMXCC1_WGMXCCGn1
    SolutionIndex: 43
    SolutionNameMin: Cijk_Ailk_Bljk_B8F8NF8NS_BH_Bias_HAS_SAV_UserArgs_MT256x144x128_MI16x16x1_SN_LDSB1_CLR1_GRVWA16_GRVWB8_GSU0_GSUC0_GSUWGMRR0_K1_LBSPPA2048_LBSPPB128_LPA64_LPB8_LRVW8_MIWT4_9_PLR1_SU0_SUM0_SUS128_VWA4_VWB1_WGM6_WGMXCC1_WGMXCCGn1
    SolutionIndex: 44
    SolutionNameMin: Cijk_Ailk_Bljk_B8F8NF8NS_BH_Bias_HAS_SAV_UserArgs_MT256x144x128_MI16x16x1_SN_LDSB1_CLR1_GRVWA16_GRVWB8_GSU0_GSUC0_GSUWGMRR0_K1_LBSPPA2048_LBSPPB128_LPA64_LPB8_LRVW8_MIWT4_9_PLR1_SU0_SUM0_SUS128_VWA4_VWB1_WGM8_WGMXCC1_WGMXCCGn1
    SolutionIndex: 45
    SolutionNameMin: Cijk_Ailk_Bljk_B8F8NF8NS_BH_Bias_HAS_SAV_UserArgs_MT256x128x128_MI16x16x1_SN_LDSB1_CLR1_GRVWA16_GRVWB8_GSU0_GSUC0_GSUWGMRR0_K1_LBSPPA2048_LBSPPB512_LPA0_LPB8_LRVW8_MIWT8_4_PLR1_SU0_SUM0_SUS128_VWA8_VWB4_WGM1_WGMXCC1_WGMXCCGn1
    SolutionIndex: 46
    SolutionNameMin: Cijk_Ailk_Bljk_B8F8NF8NS_BH_Bias_HAS_SAV_UserArgs_MT256x128x128_MI16x16x1_SN_LDSB1_CLR1_GRVWA8_GRVWB8_GSU0_GSUC0_GSUWGMRR0_K1_LBSPPA2048_LBSPPB512_LPA0_LPB8_LRVW8_MIWT8_4_PLR1_SU0_SUM0_SUS128_VWA8_VWB4_WGM6_WGMXCC1_WGMXCCGn1
    SolutionIndex: 47
    SolutionNameMin: Cijk_Ailk_Bljk_B8F8NF8NS_BH_Bias_HAS_SAV_UserArgs_MT256x128x128_MI16x16x1_SN_LDSB1_CLR1_GRVWA16_GRVWB8_GSU0_GSUC0_GSUWGMRR0_K1_LBSPPA2048_LBSPPB512_LPA0_LPB8_LRVW8_MIWT8_4_PLR1_SU0_SUM0_SUS128_VWA8_VWB4_WGM6_WGMXCC1_WGMXCCGn1
    SolutionIndex: 48
    SolutionNameMin: Cijk_Ailk_Bljk_B8F8NF8NS_BH_Bias_HAS_SAV_UserArgs_MT256x128x128_MI16x16x1_SN_LDSB1_CLR1_GRVWA16_GRVWB8_GSU0_GSUC0_GSUWGMRR0_K1_LBSPPA2048_LBSPPB512_LPA0_LPB8_LRVW8_MIWT8_4_PLR1_SU0_SUM0_SUS128_VWA8_VWB4_WGM8_WGMXCC1_WGMXCCGn1
    SolutionIndex: 49
    SolutionNameMin: Cijk_Ailk_Bljk_B8F8NF8NS_BH_Bias_HAS_SAV_UserArgs_MT128x144x128_MI16x16x1_SN_LDSB1_CLR1_GRVWA16_GRVWB8_GSU0_GSUC0_GSUWGMRR0_K1_LBSPPA1024_LBSPPB128_LPA32_LPB8_LRVW8_MIWT2_9_PLR1_SU0_SUM0_SUS128_VWA2_VWB1_WGM1_WGMXCC1_WGMXCCGn1
    SolutionIndex: 50
    SolutionNameMin: Cijk_Ailk_Bljk_B8F8NF8NS_BH_Bias_HAS_SAV_UserArgs_MT128x128x128_MI16x16x1_SN_LDSB1_CLR1_GRVWA16_GRVWB16_GSU0_GSUC0_GSUWGMRR0_K1_LBSPPA1024_LBSPPB512_LPA64_LPB16_LRVW8_MIWT4_4_PLR1_SU0_SUM0_SUS128_VWA4_VWB4_WGM1_WGMXCC1_WGMXCCGn1
    SolutionIndex: 51
    SolutionNameMin: Cijk_Ailk_Bljk_B8F8NF8NS_BH_Bias_HAS_SAV_UserArgs_MT128x128x128_MI16x16x1_SN_LDSB1_CLR1_GRVWA16_GRVWB16_GSU0_GSUC0_GSUWGMRR0_K1_LBSPPA1024_LBSPPB512_LPA64_LPB16_LRVW8_MIWT4_4_PLR1_SU0_SUM0_SUS128_VWA4_VWB4_WGM4_WGMXCC1_WGMXCCGn1
    SolutionIndex: 52
    SolutionNameMin: Cijk_Ailk_Bljk_B8F8NF8NS_BH_Bias_HAS_SAV_UserArgs_MT128x128x128_MI16x16x1_SN_LDSB1_CLR1_GRVWA8_GRVWB16_GSU0_GSUC0_GSUWGMRR0_K1_LBSPPA1024_LBSPPB512_LPA64_LPB16_LRVW8_MIWT4_4_PLR1_SU0_SUM0_SUS128_VWA4_VWB4_WGM6_WGMXCC1_WGMXCCGn1
    SolutionIndex: 53
    SolutionNameMin: Cijk_Ailk_Bljk_B8F8NF8NS_BH_Bias_HAS_SAV_UserArgs_MT128x128x128_MI16x16x1_SN_LDSB1_CLR1_GRVWA16_GRVWB16_GSU0_GSUC0_GSUWGMRR0_K1_LBSPPA1024_LBSPPB512_LPA64_LPB16_LRVW8_MIWT4_4_PLR1_SU0_SUM0_SUS128_VWA4_VWB4_WGM6_WGMXCC1_WGMXCCGn1
    SolutionIndex: 54
    SolutionNameMin: Cijk_Ailk_Bljk_B8F8NF8NS_BH_Bias_HAS_SAV_UserArgs_MT128x128x128_MI16x16x1_SN_LDSB1_CLR1_GRVWA16_GRVWB16_GSU0_GSUC0_GSUWGMRR0_K1_LBSPPA1024_LBSPPB512_LPA64_LPB16_LRVW8_MIWT4_4_PLR1_SU0_SUM0_SUS128_VWA4_VWB4_WGM8_WGMXCC1_WGMXCCGn1
    SolutionIndex: 55
    SolutionNameMin: Cijk_Ailk_Bljk_B8F8NF8NS_BH_Bias_HAS_SAV_UserArgs_MT64x128x128_MI16x16x1_SN_LDSB1_CLR1_GRVWA8_GRVWB16_GSU0_GSUC0_GSUWGMRR0_K1_LBSPPA512_LBSPPB512_LPA32_LPB16_LRVW8_MIWT2_4_PLR1_SU0_SUM0_SUS128_VWA2_VWB4_WGM1_WGMXCC1_WGMXCCGn1
    SolutionIndex: 56
    SolutionNameMin: Cijk_Ailk_Bljk_B8F8NF8NS_BH_Bias_HAS_SAV_UserArgs_MT64x128x128_MI16x16x1_SN_LDSB1_CLR1_GRVWA16_GRVWB16_GSU0_GSUC0_GSUWGMRR0_K1_LBSPPA512_LBSPPB512_LPA32_LPB16_LRVW8_MIWT2_4_PLR1_SU0_SUM0_SUS128_VWA2_VWB4_WGM1_WGMXCC1_WGMXCCGn1
    SolutionIndex: 57
    SolutionNameMin: Cijk_Ailk_Bljk_B8F8NF8NS_BH_Bias_HAS_SAV_UserArgs_MT64x128x128_MI16x16x1_SN_LDSB1_CLR1_GRVWA16_GRVWB16_GSU0_GSUC0_GSUWGMRR0_K1_LBSPPA512_LBSPPB512_LPA32_LPB16_LRVW8_MIWT2_4_PLR1_SU0_SUM0_SUS128_VWA2_VWB4_WGM4_WGMXCC1_WGMXCCGn1
    SolutionIndex: 58
    SolutionNameMin: Cijk_Ailk_Bljk_B8F8NF8NS_BH_Bias_HAS_SAV_UserArgs_MT128x64x128_MI16x16x1_SN_LDSB1_CLR1_GRVWA16_GRVWB16_GSU0_GSUC0_GSUWGMRR0_K1_LBSPPA1024_LBSPPB256_LPA64_LPB16_LRVW8_MIWT4_2_PLR1_SU0_SUM0_SUS128_VWA4_VWB2_WGM1_WGMXCC1_WGMXCCGn1
    SolutionIndex: 59
    SolutionNameMin: Cijk_Ailk_Bljk_B8F8NF8NS_BH_Bias_HAS_SAV_UserArgs_MT128x64x128_MI16x16x1_SN_LDSB1_CLR1_GRVWA16_GRVWB16_GSU0_GSUC0_GSUWGMRR0_K1_LBSPPA1024_LBSPPB256_LPA64_LPB16_LRVW8_MIWT4_2_PLR1_SU0_SUM0_SUS128_VWA4_VWB2_WGM4_WGMXCC1_WGMXCCGn1
    SolutionIndex: 60
    SolutionNameMin: Cijk_Ailk_Bljk_B8F8NF8NS_BH_Bias_HAS_SAV_UserArgs_MT128x64x128_MI16x16x1_SN_LDSB1_CLR1_GRVWA16_GRVWB16_GSU0_GSUC0_GSUWGMRR0_K1_LBSPPA1024_LBSPPB256_LPA64_LPB16_LRVW8_MIWT4_2_PLR1_SU0_SUM0_SUS128_VWA4_VWB2_WGM6_WGMXCC1_WGMXCCGn1
    SolutionIndex: 61
    SolutionNameMin: Cijk_Ailk_Bljk_B8F8NF8NS_BH_Bias_HAS_SAV_UserArgs_MT128x64x128_MI16x16x1_SN_LDSB1_CLR1_GRVWA16_GRVWB16_GSU0_GSUC0_GSUWGMRR0_K1_LBSPPA1024_LBSPPB256_LPA64_LPB16_LRVW8_MIWT4_2_PLR1_SU0_SUM0_SUS128_VWA4_VWB2_WGM8_WGMXCC1_WGMXCCGn1
    SolutionIndex: 62
    SolutionNameMin: Cijk_Ailk_Bljk_B8F8NF8NS_BH_Bias_HAS_SAV_UserArgs_MT64x64x128_MI16x16x1_SN_LDSB1_CLR1_GRVWA16_GRVWB8_GSU0_GSUC0_GSUWGMRR0_K1_LBSPPA512_LBSPPB256_LPA32_LPB8_LRVW8_MIWT2_2_PLR1_SU0_SUM0_SUS128_VWA2_VWB2_WGM1_WGMXCC1_WGMXCCGn1
    SolutionIndex: 63
    SolutionNameMin: Cijk_Ailk_Bljk_B8F8NF8NS_BH_Bias_HAS_SAV_UserArgs_MT64x64x128_MI16x16x1_SN_LDSB1_CLR1_GRVWA8_GRVWB16_GSU0_GSUC0_GSUWGMRR0_K1_LBSPPA512_LBSPPB256_LPA32_LPB16_LRVW8_MIWT2_2_PLR1_SU0_SUM0_SUS128_VWA2_VWB2_WGM1_WGMXCC1_WGMXCCGn1
    SolutionIndex: 64
    SolutionNameMin: Cijk_Ailk_Bljk_B8F8NF8NS_BH_Bias_HAS_SAV_UserArgs_MT64x64x128_MI16x16x1_SN_LDSB1_CLR1_GRVWA16_GRVWB16_GSU0_GSUC0_GSUWGMRR0_K1_LBSPPA512_LBSPPB256_LPA32_LPB16_LRVW8_MIWT2_2_PLR1_SU0_SUM0_SUS128_VWA2_VWB2_WGM1_WGMXCC1_WGMXCCGn1
    SolutionIndex: 65
    SolutionNameMin: Cijk_Ailk_Bljk_B8F8NF8NS_BH_Bias_HAS_SAV_UserArgs_MT64x64x128_MI16x16x1_SN_LDSB1_CLR1_GRVWA16_GRVWB8_GSU0_GSUC0_GSUWGMRR0_K1_LBSPPA512_LBSPPB256_LPA32_LPB8_LRVW8_MIWT2_2_PLR1_SU0_SUM0_SUS128_VWA2_VWB2_WGM4_WGMXCC1_WGMXCCGn1
    SolutionIndex: 66
    SolutionNameMin: Cijk_Ailk_Bljk_B8F8NF8NS_BH_Bias_HAS_SAV_UserArgs_MT64x64x128_MI16x16x1_SN_LDSB1_CLR1_GRVWA16_GRVWB16_GSU0_GSUC0_GSUWGMRR0_K1_LBSPPA512_LBSPPB256_LPA32_LPB16_LRVW8_MIWT2_2_PLR1_SU0_SUM0_SUS128_VWA2_VWB2_WGM4_WGMXCC1_WGMXCCGn1
    SolutionIndex: 67
    SolutionNameMin: Cijk_Ailk_Bljk_B8F8NF8NS_BH_Bias_HAS_SAV_UserArgs_MT64x64x128_MI16x16x1_SN_LDSB1_CLR1_GRVWA16_GRVWB16_GSU0_GSUC0_GSUWGMRR0_K1_LBSPPA512_LBSPPB256_LPA32_LPB16_LRVW8_MIWT2_2_PLR1_SU0_SUM0_SUS128_VWA2_VWB2_WGM6_WGMXCC1_WGMXCCGn1
    SolutionIndex: 68
    SolutionNameMin: Cijk_Ailk_Bljk_B8F8NF8NS_BH_Bias_HAS_SAV_UserArgs_MT64x64x128_MI16x16x1_SN_LDSB1_CLR1_GRVWA16_GRVWB16_GSU0_GSUC0_GSUWGMRR0_K1_LBSPPA512_LBSPPB256_LPA32_LPB16_LRVW8_MIWT2_2_PLR1_SU0_SUM0_SUS128_VWA2_VWB2_WGM8_WGMXCC1_WGMXCCGn1
    SolutionIndex: 69
    SolutionNameMin: Cijk_Ailk_Bljk_B8F8NF8NS_BH_Bias_HAS_SAV_UserArgs_MT32x64x128_MI16x16x1_SN_LDSB0_CLR1_GRVWA8_GRVWB16_GSU0_GSUC0_GSUWGMRR0_K1_LBSPPA256_LBSPPB256_LPA16_LPB16_LRVW8_MIWT1_2_PLR1_SU0_SUM0_SUS128_VWA1_VWB2_WGM4_WGMXCC1_WGMXCCGn1
    SolutionIndex: 70
    SolutionNameMin: Cijk_Ailk_Bljk_B8F8NF8NS_BH_Bias_HAS_SAV_UserArgs_MT64x32x128_MI16x16x1_SN_LDSB0_CLR1_GRVWA8_GRVWB8_GSU0_GSUC0_GSUWGMRR0_K1_LBSPPA512_LBSPPB128_LPA32_LPB8_LRVW8_MIWT2_1_PLR1_SU0_SUM0_SUS128_VWA2_VWB1_WGM1_WGMXCC1_WGMXCCGn1
    SolutionIndex: 71
    SolutionNameMin: Cijk_Ailk_Bljk_B8F8NF8NS_BH_Bias_HAS_SAV_UserArgs_MT64x32x128_MI16x16x1_SN_LDSB0_CLR1_GRVWA8_GRVWB16_GSU0_GSUC0_GSUWGMRR0_K1_LBSPPA512_LBSPPB128_LPA32_LPB16_LRVW8_MIWT2_1_PLR1_SU0_SUM0_SUS128_VWA2_VWB1_WGM1_WGMXCC1_WGMXCCGn1
    SolutionIndex: 72
    SolutionNameMin: Cijk_Ailk_Bljk_B8F8NF8NS_BH_Bias_HAS_SAV_UserArgs_MT64x32x128_MI16x16x1_SN_LDSB0_CLR1_GRVWA16_GRVWB16_GSU0_GSUC0_GSUWGMRR0_K1_LBSPPA512_LBSPPB128_LPA32_LPB16_LRVW8_MIWT2_1_PLR1_SU0_SUM0_SUS128_VWA2_VWB1_WGM1_WGMXCC1_WGMXCCGn1
    SolutionIndex: 73
    SolutionNameMin: Cijk_Ailk_Bljk_B8F8NF8NS_BH_Bias_HAS_SAV_UserArgs_MT64x32x128_MI16x16x1_SN_LDSB0_CLR1_GRVWA8_GRVWB16_GSU0_GSUC0_GSUWGMRR0_K1_LBSPPA512_LBSPPB128_LPA32_LPB16_LRVW8_MIWT2_1_PLR1_SU0_SUM0_SUS128_VWA2_VWB1_WGM4_WGMXCC1_WGMXCCGn1
    SolutionIndex: 74
    SolutionNameMin: Cijk_Ailk_Bljk_B8F8NF8NS_BH_Bias_HAS_SAV_UserArgs_MT32x32x128_MI16x16x1_SN_LDSB0_CLR1_GRVWA8_GRVWB8_GSU0_GSUC0_GSUWGMRR0_K1_LBSPPA256_LBSPPB128_LPA16_LPB8_LRVW8_MIWT1_1_PLR1_SU0_SUM0_SUS128_VWA1_VWB1_WGM1_WGMXCC1_WGMXCCGn1
    SolutionIndex: 75
    SolutionNameMin: Cijk_Ailk_Bljk_B8F8NF8NS_BH_Bias_HAS_SAV_UserArgs_MT32x32x128_MI16x16x1_SN_LDSB0_CLR1_GRVWA16_GRVWB8_GSU0_GSUC0_GSUWGMRR0_K1_LBSPPA256_LBSPPB128_LPA16_LPB8_LRVW8_MIWT1_1_PLR1_SU0_SUM0_SUS128_VWA1_VWB1_WGM1_WGMXCC1_WGMXCCGn1
    SolutionIndex: 76
    SolutionNameMin: Cijk_Ailk_Bljk_B8F8NF8NS_BH_Bias_HAS_SAV_UserArgs_MT32x32x128_MI16x16x1_SN_LDSB0_CLR1_GRVWA8_GRVWB16_GSU0_GSUC0_GSUWGMRR0_K1_LBSPPA256_LBSPPB128_LPA16_LPB16_LRVW8_MIWT1_1_PLR1_SU0_SUM0_SUS128_VWA1_VWB1_WGM1_WGMXCC1_WGMXCCGn1
    SolutionIndex: 77
    SolutionNameMin: Cijk_Ailk_Bljk_B8F8NF8NS_BH_Bias_HAS_SAV_UserArgs_MT32x32x128_MI16x16x1_SN_LDSB0_CLR1_GRVWA16_GRVWB16_GSU0_GSUC0_GSUWGMRR0_K1_LBSPPA256_LBSPPB128_LPA16_LPB16_LRVW8_MIWT1_1_PLR1_SU0_SUM0_SUS128_VWA1_VWB1_WGM1_WGMXCC1_WGMXCCGn1
    SolutionIndex: 78
    SolutionNameMin: Cijk_Ailk_Bljk_B8F8NF8NS_BH_Bias_HAS_SAV_UserArgs_MT32x32x128_MI16x16x1_SN_LDSB0_CLR1_GRVWA8_GRVWB16_GSU0_GSUC0_GSUWGMRR0_K1_LBSPPA256_LBSPPB128_LPA16_LPB16_LRVW8_MIWT1_1_PLR1_SU0_SUM0_SUS128_VWA1_VWB1_WGM6_WGMXCC1_WGMXCCGn1
    SolutionIndex: 79
    SolutionNameMin: Cijk_Ailk_Bljk_B8F8NF8NS_BH_Bias_HAS_SAV_UserArgs_MT128x64x256_MI16x16x1_SN_LDSB1_CLR1_GRVWA16_GRVWB16_GSU0_GSUC0_GSUWGMRR0_K1_LBSPPA1024_LBSPPB512_LPA64_LPB16_LRVW8_MIWT4_2_PLR1_SU0_SUM0_SUS256_VWA4_VWB2_WGM1_WGMXCC1_WGMXCCGn1
    SolutionIndex: 80
    SolutionNameMin: Cijk_Ailk_Bljk_B8F8NF8NS_BH_Bias_HAS_SAV_UserArgs_MT64x64x256_MI16x16x1_SN_LDSB1_CLR1_GRVWA16_GRVWB16_GSU0_GSUC0_GSUWGMRR0_K1_LBSPPA512_LBSPPB512_LPA32_LPB16_LRVW8_MIWT2_2_PLR1_SU0_SUM0_SUS256_VWA2_VWB2_WGM1_WGMXCC1_WGMXCCGn1
    SolutionIndex: 81
    SolutionNameMin: Cijk_Ailk_Bljk_B8F8NF8NS_BH_Bias_HAS_SAV_UserArgs_MT64x64x256_MI16x16x1_SN_LDSB1_CLR1_GRVWA16_GRVWB16_GSU0_GSUC0_GSUWGMRR0_K1_LBSPPA512_LBSPPB512_LPA32_LPB16_LRVW8_MIWT2_2_PLR1_SU0_SUM0_SUS256_VWA2_VWB2_WGM8_WGMXCC1_WGMXCCGn1
    SolutionIndex: 82
    SolutionNameMin: Cijk_Ailk_Bljk_B8F8NF8NS_BH_Bias_HAS_SAV_UserArgs_MT64x32x256_MI16x16x1_SN_LDSB1_CLR1_GRVWA8_GRVWB16_GSU0_GSUC0_GSUWGMRR0_K1_LBSPPA512_LBSPPB256_LPA32_LPB16_LRVW8_MIWT2_1_PLR1_SU0_SUM0_SUS256_VWA2_VWB1_WGM1_WGMXCC1_WGMXCCGn1
    SolutionIndex: 83
    SolutionNameMin: Cijk_Ailk_Bljk_B8F8NF8NS_BH_Bias_HAS_SAV_UserArgs_MT64x32x256_MI16x16x1_SN_LDSB1_CLR1_GRVWA16_GRVWB16_GSU0_GSUC0_GSUWGMRR0_K1_LBSPPA512_LBSPPB256_LPA32_LPB16_LRVW8_MIWT2_1_PLR1_SU0_SUM0_SUS256_VWA2_VWB1_WGM1_WGMXCC1_WGMXCCGn1
    SolutionIndex: 84
    SolutionNameMin: Cijk_Ailk_Bljk_B8F8NF8NS_BH_Bias_HAS_SAV_UserArgs_MT64x32x256_MI16x16x1_SN_LDSB1_CLR1_GRVWA16_GRVWB16_GSU0_GSUC0_GSUWGMRR0_K1_LBSPPA512_LBSPPB256_LPA32_LPB16_LRVW8_MIWT2_1_PLR1_SU0_SUM0_SUS256_VWA2_VWB1_WGM6_WGMXCC1_WGMXCCGn1
    SolutionIndex: 85
    SolutionNameMin: Cijk_Ailk_Bljk_B8F8NF8NS_BH_Bias_HAS_SAV_UserArgs_MT64x32x256_MI16x16x1_SN_LDSB1_CLR1_GRVWA16_GRVWB16_GSU0_GSUC0_GSUWGMRR0_K1_LBSPPA512_LBSPPB256_LPA32_LPB16_LRVW8_MIWT2_1_PLR1_SU0_SUM0_SUS256_VWA2_VWB1_WGM8_WGMXCC1_WGMXCCGn1
    SolutionIndex: 86
    SolutionNameMin: Cijk_Ailk_Bljk_B8F8NF8NS_BH_Bias_HAS_SAV_UserArgs_MT32x32x256_MI16x16x1_SN_LDSB1_CLR1_GRVWA16_GRVWB8_GSU0_GSUC0_GSUWGMRR0_K1_LBSPPA256_LBSPPB256_LPA16_LPB8_LRVW8_MIWT1_1_PLR1_SU0_SUM0_SUS256_VWA1_VWB1_WGM1_WGMXCC1_WGMXCCGn1
    SolutionIndex: 87
    SolutionNameMin: Cijk_Ailk_Bljk_B8F8NF8NS_BH_Bias_HAS_SAV_UserArgs_MT32x32x256_MI16x16x1_SN_LDSB1_CLR1_GRVWA8_GRVWB16_GSU0_GSUC0_GSUWGMRR0_K1_LBSPPA256_LBSPPB256_LPA16_LPB16_LRVW8_MIWT1_1_PLR1_SU0_SUM0_SUS256_VWA1_VWB1_WGM6_WGMXCC1_WGMXCCGn1
    SolutionIndex: 88
    SolutionNameMin: Cijk_Ailk_Bljk_B8F8NF8NS_BH_Bias_HAS_SAV_UserArgs_MT32x32x256_MI16x16x1_SN_LDSB1_CLR1_GRVWA16_GRVWB16_GSU0_GSUC0_GSUWGMRR0_K1_LBSPPA256_LBSPPB256_LPA16_LPB16_LRVW8_MIWT1_1_PLR1_SU0_SUM0_SUS256_VWA1_VWB1_WGM6_WGMXCC1_WGMXCCGn1
    SolutionIndex: 89
    SolutionNameMin: Cijk_Ailk_Bljk_B8F8NF8NS_BH_Bias_HAS_SAV_UserArgs_MT32x32x256_MI16x16x1_SN_LDSB1_CLR1_GRVWA16_GRVWB16_GSU0_GSUC0_GSUWGMRR0_K1_LBSPPA256_LBSPPB256_LPA16_LPB16_LRVW8_MIWT1_1_PLR1_SU0_SUM0_SUS256_VWA1_VWB1_WGM8_WGMXCC1_WGMXCCGn1
- - - [128, 128, 1, 128, 128, 128, 128, 128]
    - [78, 0.53]
  - - [128, 128, 1, 256, 128, 128, 128, 256]
    - [76, 1.02]
  - - [128, 128, 1, 512, 128, 128, 128, 512]
    - [76, 1.77]
  - - [128, 128, 1, 1024, 128, 128, 128, 1024]
    - [74, 2.77]
  - - [128, 128, 1, 2048, 128, 128, 128, 2048]
    - [76, 3.85]
  - - [128, 128, 1, 4096, 128, 128, 128, 4096]
    - [77, 4.79]
  - - [128, 128, 1, 8192, 128, 128, 128, 8192]
    - [74, 5.48]
  - - [128, 256, 1, 128, 128, 128, 128, 128]
    - [37, 1.14]
  - - [128, 256, 1, 256, 128, 128, 128, 256]
    - [76, 2.05]
  - - [128, 256, 1, 512, 128, 128, 128, 512]
    - [76, 3.57]
  - - [128, 256, 1, 1024, 128, 128, 128, 1024]
    - [76, 5.52]
  - - [128, 256, 1, 2048, 128, 128, 128, 2048]
    - [74, 7.71]
  - - [128, 256, 1, 4096, 128, 128, 128, 4096]
    - [74, 9.65]
  - - [128, 256, 1, 8192, 128, 128, 128, 8192]
    - [86, 10.97]
  - - [128, 512, 1, 128, 128, 128, 128, 128]
    - [76, 2.24]
  - - [128, 512, 1, 256, 128, 128, 128, 256]
    - [37, 4.07]
  - - [128, 512, 1, 512, 128, 128, 128, 512]
    - [74, 7.0]
  - - [128, 512, 1, 1024, 128, 128, 128, 1024]
    - [76, 10.91]
  - - [128, 512, 1, 2048, 128, 128, 128, 2048]
    - [74, 15.36]
  - - [128, 512, 1, 4096, 128, 128, 128, 4096]
    - [74, 19.08]
  - - [128, 512, 1, 8192, 128, 128, 128, 8192]
    - [74, 21.8]
  - - [128, 1024, 1, 128, 128, 128, 128, 128]
    - [37, 4.4]
  - - [128, 1024, 1, 256, 128, 128, 128, 256]
    - [76, 7.94]
  - - [128, 1024, 1, 512, 128, 128, 128, 512]
    - [74, 13.8]
  - - [128, 1024, 1, 1024, 128, 128, 128, 1024]
    - [74, 21.44]
  - - [128, 1024, 1, 2048, 128, 128, 128, 2048]
    - [74, 30.16]
  - - [128, 1024, 1, 4096, 128, 128, 128, 4096]
    - [74, 37.5]
  - - [128, 1024, 1, 8192, 128, 128, 128, 8192]
    - [74, 43.03]
  - - [128, 2048, 1, 128, 128, 128, 128, 128]
    - [70, 8.35]
  - - [128, 2048, 1, 256, 128, 128, 128, 256]
    - [70, 14.84]
  - - [128, 2048, 1, 512, 128, 128, 128, 512]
    - [72, 25.04]
  - - [128, 2048, 1, 1024, 128, 128, 128, 1024]
    - [71, 37.88]
  - - [128, 2048, 1, 2048, 128, 128, 128, 2048]
    - [83, 52.04]
  - - [128, 2048, 1, 4096, 128, 128, 128, 4096]
    - [83, 64.05]
  - - [128, 2048, 1, 8192, 128, 128, 128, 8192]
    - [83, 72.47]
  - - [128, 4096, 1, 128, 128, 128, 128, 128]
    - [33, 15.08]
  - - [128, 4096, 1, 256, 128, 128, 128, 256]
    - [33, 26.69]
  - - [128, 4096, 1, 512, 128, 128, 128, 512]
    - [62, 43.16]
  - - [128, 4096, 1, 1024, 128, 128, 128, 1024]
    - [62, 64.12]
  - - [128, 4096, 1, 2048, 128, 128, 128, 2048]
    - [62, 84.9]
  - - [128, 4096, 1, 4096, 128, 128, 128, 4096]
    - [80, 102.88]
  - - [128, 4096, 1, 8192, 128, 128, 128, 8192]
    - [81, 113.03]
  - - [128, 8192, 1, 128, 128, 128, 128, 128]
    - [32, 26.35]
  - - [128, 8192, 1, 256, 128, 128, 128, 256]
    - [30, 45.33]
  - - [128, 8192, 1, 512, 128, 128, 128, 512]
    - [26, 72.06]
  - - [128, 8192, 1, 1024, 128, 128, 128, 1024]
    - [24, 104.16]
  - - [128, 8192, 1, 2048, 128, 128, 128, 2048]
    - [24, 134.31]
  - - [128, 8192, 1, 4096, 128, 128, 128, 4096]
    - [55, 144.36]
  - - [128, 8192, 1, 8192, 128, 128, 128, 8192]
    - [55, 153.2]
  - - [256, 128, 1, 128, 256, 256, 256, 128]
    - [35, 0.99]
  - - [256, 128, 1, 256, 256, 256, 256, 256]
    - [75, 1.93]
  - - [256, 128, 1, 512, 256, 256, 256, 512]
    - [76, 3.41]
  - - [256, 128, 1, 1024, 256, 256, 256, 1024]
    - [76, 5.55]
  - - [256, 128, 1, 2048, 256, 256, 256, 2048]
    - [74, 7.71]
  - - [256, 128, 1, 4096, 256, 256, 256, 4096]
    - [74, 9.63]
  - - [256, 128, 1, 8192, 256, 256, 256, 8192]
    - [74, 10.95]
  - - [256, 256, 1, 128, 256, 256, 256, 128]
    - [74, 2.2]
  - - [256, 256, 1, 256, 256, 256, 256, 256]
    - [76, 4.04]
  - - [256, 256, 1, 512, 256, 256, 256, 512]
    - [76, 7.05]
  - - [256, 256, 1, 1024, 256, 256, 256, 1024]
    - [76, 10.9]
  - - [256, 256, 1, 2048, 256, 256, 256, 2048]
    - [77, 15.22]
  - - [256, 256, 1, 4096, 256, 256, 256, 4096]
    - [74, 19.08]
  - - [256, 256, 1, 8192, 256, 256, 256, 8192]
    - [74, 21.78]
  - - [256, 512, 1, 128, 256, 256, 256, 128]
    - [37, 4.33]
  - - [256, 512, 1, 256, 256, 256, 256, 256]
    - [74, 7.93]
  - - [256, 512, 1, 512, 256, 256, 256, 512]
    - [76, 13.56]
  - - [256, 512, 1, 1024, 256, 256, 256, 1024]
    - [76, 21.34]
  - - [256, 512, 1, 2048, 256, 256, 256, 2048]
    - [74, 29.97]
  - - [256, 512, 1, 4096, 256, 256, 256, 4096]
    - [74, 37.63]
  - - [256, 512, 1, 8192, 256, 256, 256, 8192]
    - [74, 42.83]
  - - [256, 1024, 1, 128, 256, 256, 256, 128]
    - [70, 8.28]
  - - [256, 1024, 1, 256, 256, 256, 256, 256]
    - [71, 14.84]
  - - [256, 1024, 1, 512, 256, 256, 256, 512]
    - [72, 24.45]
  - - [256, 1024, 1, 1024, 256, 256, 256, 1024]
    - [71, 37.71]
  - - [256, 1024, 1, 2048, 256, 256, 256, 2048]
    - [83, 51.95]
  - - [256, 1024, 1, 4096, 256, 256, 256, 4096]
    - [83, 64.1]
  - - [256, 1024, 1, 8192, 256, 256, 256, 8192]
    - [83, 72.46]
  - - [256, 2048, 1, 128, 256, 256, 256, 128]
    - [33, 14.97]
  - - [256, 2048, 1, 256, 256, 256, 256, 256]
    - [34, 26.7]
  - - [256, 2048, 1, 512, 256, 256, 256, 512]
    - [63, 42.74]
  - - [256, 2048, 1, 1024, 256, 256, 256, 1024]
    - [62, 63.89]
  - - [256, 2048, 1, 2048, 256, 256, 256, 2048]
    - [62, 85.01]
  - - [256, 2048, 1, 4096, 256, 256, 256, 4096]
    - [80, 102.27]
  - - [256, 2048, 1, 8192, 256, 256, 256, 8192]
    - [65, 110.67]
  - - [256, 4096, 1, 128, 256, 256, 256, 128]
    - [31, 26.29]
  - - [256, 4096, 1, 256, 256, 256, 256, 256]
    - [31, 45.33]
  - - [256, 4096, 1, 512, 256, 256, 256, 512]
    - [25, 71.89]
  - - [256, 4096, 1, 1024, 256, 256, 256, 1024]
    - [24, 103.42]
  - - [256, 4096, 1, 2048, 256, 256, 256, 2048]
    - [27, 132.83]
  - - [256, 4096, 1, 4096, 256, 256, 256, 4096]
    - [56, 146.76]
  - - [256, 4096, 1, 8192, 256, 256, 256, 8192]
    - [57, 155.14]
  - - [256, 8192, 1, 128, 256, 256, 256, 128]
    - [23, 41.52]
  - - [256, 8192, 1, 256, 256, 256, 256, 256]
    - [22, 71.0]
  - - [256, 8192, 1, 512, 256, 256, 256, 512]
    - [50, 113.41]
  - - [256, 8192, 1, 1024, 256, 256, 256, 1024]
    - [50, 161.15]
  - - [256, 8192, 1, 2048, 256, 256, 256, 2048]
    - [50, 201.31]
  - - [256, 8192, 1, 4096, 256, 256, 256, 4096]
    - [53, 222.92]
  - - [256, 8192, 1, 8192, 256, 256, 256, 8192]
    - [50, 219.22]
  - - [512, 128, 1, 128, 512, 512, 512, 128]
    - [76, 2.22]
  - - [512, 128, 1, 256, 512, 512, 512, 256]
    - [76, 3.98]
  - - [512, 128, 1, 512, 512, 512, 512, 512]
    - [76, 7.03]
  - - [512, 128, 1, 1024, 512, 512, 512, 1024]
    - [76, 10.93]
  - - [512, 128, 1, 2048, 512, 512, 512, 2048]
    - [74, 15.25]
  - - [512, 128, 1, 4096, 512, 512, 512, 4096]
    - [74, 19.11]
  - - [512, 128, 1, 8192, 512, 512, 512, 8192]
    - [89, 17.17]
  - - [512, 256, 1, 128, 512, 512, 512, 128]
    - [37, 4.37]
  - - [512, 256, 1, 256, 512, 512, 512, 256]
    - [76, 7.97]
  - - [512, 256, 1, 512, 512, 512, 512, 512]
    - [76, 13.65]
  - - [512, 256, 1, 1024, 512, 512, 512, 1024]
    - [74, 21.41]
  - - [512, 256, 1, 2048, 512, 512, 512, 2048]
    - [76, 29.98]
  - - [512, 256, 1, 4096, 512, 512, 512, 4096]
    - [74, 37.63]
  - - [512, 256, 1, 8192, 512, 512, 512, 8192]
    - [89, 37.32]
  - - [512, 512, 1, 128, 512, 512, 512, 128]
    - [71, 8.26]
  - - [512, 512, 1, 256, 512, 512, 512, 256]
    - [71, 14.76]
  - - [512, 512, 1, 512, 512, 512, 512, 512]
    - [71, 24.93]
  - - [512, 512, 1, 1024, 512, 512, 512, 1024]
    - [71, 37.69]
  - - [512, 512, 1, 2048, 512, 512, 512, 2048]
    - [83, 51.99]
  - - [512, 512, 1, 4096, 512, 512, 512, 4096]
    - [83, 63.84]
  - - [512, 512, 1, 8192, 512, 512, 512, 8192]
    - [72, 62.79]
  - - [512, 1024, 1, 128, 512, 512, 512, 128]
    - [34, 14.96]
  - - [512, 1024, 1, 256, 512, 512, 512, 256]
    - [34, 26.34]
  - - [512, 1024, 1, 512, 512, 512, 512, 512]
    - [64, 42.95]
  - - [512, 1024, 1, 1024, 512, 512, 512, 1024]
    - [62, 63.55]
  - - [512, 1024, 1, 2048, 512, 512, 512, 2048]
    - [62, 84.19]
  - - [512, 1024, 1, 4096, 512, 512, 512, 4096]
    - [62, 100.57]
  - - [512, 1024, 1, 8192, 512, 512, 512, 8192]
    - [64, 103.92]
  - - [512, 2048, 1, 128, 512, 512, 512, 128]
    - [31, 26.01]
  - - [512, 2048, 1, 256, 512, 512, 512, 256]
    - [25, 45.12]
  - - [512, 2048, 1, 512, 512, 512, 512, 512]
    - [25, 72.21]
  - - [512, 2048, 1, 1024, 512, 512, 512, 1024]
    - [24, 103.92]
  - - [512, 2048, 1, 2048, 512, 512, 512, 2048]
    - [24, 133.75]
  - - [512, 2048, 1, 4096, 512, 512, 512, 4096]
    - [79, 145.84]
  - - [512, 2048, 1, 8192, 512, 512, 512, 8192]
    - [60, 148.88]
  - - [512, 4096, 1, 128, 512, 512, 512, 128]
    - [23, 41.68]
  - - [512, 4096, 1, 256, 512, 512, 512, 256]
    - [50, 71.34]
  - - [512, 4096, 1, 512, 512, 512, 512, 512]
    - [50, 113.17]
  - - [512, 4096, 1, 1024, 512, 512, 512, 1024]
    - [50, 160.42]
  - - [512, 4096, 1, 2048, 512, 512, 512, 2048]
    - [50, 203.12]
  - - [512, 4096, 1, 4096, 512, 512, 512, 4096]
    - [53, 208.99]
  - - [512, 4096, 1, 8192, 512, 512, 512, 8192]
    - [54, 205.52]
  - - [512, 8192, 1, 128, 512, 512, 512, 128]
    - [49, 62.11]
  - - [512, 8192, 1, 256, 512, 512, 512, 256]
    - [49, 108.02]
  - - [512, 8192, 1, 512, 512, 512, 512, 512]
    - [49, 173.26]
  - - [512, 8192, 1, 1024, 512, 512, 512, 1024]
    - [49, 240.91]
  - - [512, 8192, 1, 2048, 512, 512, 512, 2048]
    - [45, 251.32]
  - - [512, 8192, 1, 4096, 512, 512, 512, 4096]
    - [49, 265.19]
  - - [512, 8192, 1, 8192, 512, 512, 512, 8192]
    - [41, 249.38]
  - - [1024, 128, 1, 128, 1024, 1024, 1024, 128]
    - [76, 4.34]
  - - [1024, 128, 1, 256, 1024, 1024, 1024, 256]
    - [76, 7.81]
  - - [1024, 128, 1, 512, 1024, 1024, 1024, 512]
    - [76, 13.7]
  - - [1024, 128, 1, 1024, 1024, 1024, 1024, 1024]
    - [74, 21.39]
  - - [1024, 128, 1, 2048, 1024, 1024, 1024, 2048]
    - [74, 29.77]
  - - [1024, 128, 1, 4096, 1024, 1024, 1024, 4096]
    - [88, 31.86]
  - - [1024, 128, 1, 8192, 1024, 1024, 1024, 8192]
    - [87, 30.37]
  - - [1024, 256, 1, 128, 1024, 1024, 1024, 128]
    - [71, 8.22]
  - - [1024, 256, 1, 256, 1024, 1024, 1024, 256]
    - [82, 14.48]
  - - [1024, 256, 1, 512, 1024, 1024, 1024, 512]
    - [71, 25.0]
  - - [1024, 256, 1, 1024, 1024, 1024, 1024, 1024]
    - [71, 37.24]
  - - [1024, 256, 1, 2048, 1024, 1024, 1024, 2048]
    - [83, 51.4]
  - - [1024, 256, 1, 4096, 1024, 1024, 1024, 4096]
    - [69, 55.75]
  - - [1024, 256, 1, 8192, 1024, 1024, 1024, 8192]
    - [84, 58.76]
  - - [1024, 512, 1, 128, 1024, 1024, 1024, 128]
    - [34, 14.94]
  - - [1024, 512, 1, 256, 1024, 1024, 1024, 256]
    - [33, 26.45]
  - - [1024, 512, 1, 512, 1024, 1024, 1024, 512]
    - [63, 42.79]
  - - [1024, 512, 1, 1024, 1024, 1024, 1024, 1024]
    - [62, 63.73]
  - - [1024, 512, 1, 2048, 1024, 1024, 1024, 2048]
    - [62, 83.82]
  - - [1024, 512, 1, 4096, 1024, 1024, 1024, 4096]
    - [66, 94.08]
  - - [1024, 512, 1, 8192, 1024, 1024, 1024, 8192]
    - [68, 103.21]
  - - [1024, 1024, 1, 128, 1024, 1024, 1024, 128]
    - [31, 26.21]
  - - [1024, 1024, 1, 256, 1024, 1024, 1024, 256]
    - [32, 45.39]
  - - [1024, 1024, 1, 512, 1024, 1024, 1024, 512]
    - [25, 72.54]
  - - [1024, 1024, 1, 1024, 1024, 1024, 1024, 1024]
    - [24, 104.24]
  - - [1024, 1024, 1, 2048, 1024, 1024, 1024, 2048]
    - [24, 134.05]
  - - [1024, 1024, 1, 4096, 1024, 1024, 1024, 4096]
    - [61, 140.69]
  - - [1024, 1024, 1, 8192, 1024, 1024, 1024, 8192]
    - [61, 149.65]
  - - [1024, 2048, 1, 128, 1024, 1024, 1024, 128]
    - [22, 42.1]
  - - [1024, 2048, 1, 256, 1024, 1024, 1024, 256]
    - [50, 71.24]
  - - [1024, 2048, 1, 512, 1024, 1024, 1024, 512]
    - [50, 112.87]
  - - [1024, 2048, 1, 1024, 1024, 1024, 1024, 1024]
    - [50, 160.63]
  - - [1024, 2048, 1, 2048, 1024, 1024, 1024, 2048]
    - [50, 203.28]
  - - [1024, 2048, 1, 4096, 1024, 1024, 1024, 4096]
    - [53, 207.84]
  - - [1024, 2048, 1, 8192, 1024, 1024, 1024, 8192]
    - [53, 202.08]
  - - [1024, 4096, 1, 128, 1024, 1024, 1024, 128]
    - [15, 59.04]
  - - [1024, 4096, 1, 256, 1024, 1024, 1024, 256]
    - [15, 99.77]
  - - [1024, 4096, 1, 512, 1024, 1024, 1024, 512]
    - [12, 154.12]
  - - [1024, 4096, 1, 1024, 1024, 1024, 1024, 1024]
    - [12, 216.27]
  - - [1024, 4096, 1, 2048, 1024, 1024, 1024, 2048]
    - [45, 251.06]
  - - [1024, 4096, 1, 4096, 1024, 1024, 1024, 4096]
    - [41, 262.95]
  - - [1024, 4096, 1, 8192, 1024, 1024, 1024, 8192]
    - [41, 248.08]
  - - [1024, 8192, 1, 128, 1024, 1024, 1024, 128]
    - [41, 90.26]
  - - [1024, 8192, 1, 256, 1024, 1024, 1024, 256]
    - [42, 153.39]
  - - [1024, 8192, 1, 512, 1024, 1024, 1024, 512]
    - [41, 243.2]
  - - [1024, 8192, 1, 1024, 1024, 1024, 1024, 1024]
    - [42, 267.37]
  - - [1024, 8192, 1, 2048, 1024, 1024, 1024, 2048]
    - [42, 314.29]
  - - [1024, 8192, 1, 4096, 1024, 1024, 1024, 4096]
    - [41, 357.32]
  - - [1024, 8192, 1, 8192, 1024, 1024, 1024, 8192]
    - [42, 368.2]
  - - [2048, 128, 1, 128, 2048, 2048, 2048, 128]
    - [36, 8.27]
  - - [2048, 128, 1, 256, 2048, 2048, 2048, 256]
    - [71, 14.81]
  - - [2048, 128, 1, 512, 2048, 2048, 2048, 512]
    - [71, 25.03]
  - - [2048, 128, 1, 1024, 2048, 2048, 2048, 1024]
    - [71, 37.9]
  - - [2048, 128, 1, 2048, 2048, 2048, 2048, 2048]
    - [73, 43.24]
  - - [2048, 128, 1, 4096, 2048, 2048, 2048, 4096]
    - [85, 52.14]
  - - [2048, 128, 1, 8192, 2048, 2048, 2048, 8192]
    - [84, 58.95]
  - - [2048, 256, 1, 128, 2048, 2048, 2048, 128]
    - [34, 14.9]
  - - [2048, 256, 1, 256, 2048, 2048, 2048, 256]
    - [33, 26.2]
  - - [2048, 256, 1, 512, 2048, 2048, 2048, 512]
    - [64, 42.59]
  - - [2048, 256, 1, 1024, 2048, 2048, 2048, 1024]
    - [62, 62.81]
  - - [2048, 256, 1, 2048, 2048, 2048, 2048, 2048]
    - [68, 77.5]
  - - [2048, 256, 1, 4096, 2048, 2048, 2048, 4096]
    - [68, 92.97]
  - - [2048, 256, 1, 8192, 2048, 2048, 2048, 8192]
    - [67, 103.74]
  - - [2048, 512, 1, 128, 2048, 2048, 2048, 128]
    - [31, 25.9]
  - - [2048, 512, 1, 256, 2048, 2048, 2048, 256]
    - [32, 45.13]
  - - [2048, 512, 1, 512, 2048, 2048, 2048, 512]
    - [25, 72.17]
  - - [2048, 512, 1, 1024, 2048, 2048, 2048, 1024]
    - [24, 104.6]
  - - [2048, 512, 1, 2048, 2048, 2048, 2048, 2048]
    - [61, 121.18]
  - - [2048, 512, 1, 4096, 2048, 2048, 2048, 4096]
    - [60, 140.65]
  - - [2048, 512, 1, 8192, 2048, 2048, 2048, 8192]
    - [60, 148.42]
  - - [2048, 1024, 1, 128, 2048, 2048, 2048, 128]
    - [22, 42.24]
  - - [2048, 1024, 1, 256, 2048, 2048, 2048, 256]
    - [50, 71.62]
  - - [2048, 1024, 1, 512, 2048, 2048, 2048, 512]
    - [50, 113.55]
  - - [2048, 1024, 1, 1024, 2048, 2048, 2048, 1024]
    - [50, 161.47]
  - - [2048, 1024, 1, 2048, 2048, 2048, 2048, 2048]
    - [54, 184.49]
  - - [2048, 1024, 1, 4096, 2048, 2048, 2048, 4096]
    - [51, 205.9]
  - - [2048, 1024, 1, 8192, 2048, 2048, 2048, 8192]
    - [51, 201.01]
  - - [2048, 2048, 1, 128, 2048, 2048, 2048, 128]
    - [18, 59.39]
  - - [2048, 2048, 1, 256, 2048, 2048, 2048, 256]
    - [15, 99.83]
  - - [2048, 2048, 1, 512, 2048, 2048, 2048, 512]
    - [12, 154.23]
  - - [2048, 2048, 1, 1024, 2048, 2048, 2048, 1024]
    - [15, 209.39]
  - - [2048, 2048, 1, 2048, 2048, 2048, 2048, 2048]
    - [18, 249.24]
  - - [2048, 2048, 1, 4096, 2048, 2048, 2048, 4096]
    - [46, 260.21]
  - - [2048, 2048, 1, 8192, 2048, 2048, 2048, 8192]
    - [39, 239.4]
  - - [2048, 4096, 1, 128, 2048, 2048, 2048, 128]
    - [4, 73.04]
  - - [2048, 4096, 1, 256, 2048, 2048, 2048, 256]
    - [0, 123.1]
  - - [2048, 4096, 1, 512, 2048, 2048, 2048, 512]
    - [0, 184.77]
  - - [2048, 4096, 1, 1024, 2048, 2048, 2048, 1024]
    - [8, 247.39]
  - - [2048, 4096, 1, 2048, 2048, 2048, 2048, 2048]
    - [6, 278.19]
  - - [2048, 4096, 1, 4096, 2048, 2048, 2048, 4096]
    - [42, 283.19]
  - - [2048, 4096, 1, 8192, 2048, 2048, 2048, 8192]
    - [42, 318.29]
  - - [2048, 8192, 1, 128, 2048, 2048, 2048, 128]
    - [44, 97.97]
  - - [2048, 8192, 1, 256, 2048, 2048, 2048, 256]
    - [44, 161.56]
  - - [2048, 8192, 1, 512, 2048, 2048, 2048, 512]
    - [41, 228.0]
  - - [2048, 8192, 1, 1024, 2048, 2048, 2048, 1024]
    - [41, 283.78]
  - - [2048, 8192, 1, 2048, 2048, 2048, 2048, 2048]
    - [44, 338.63]
  - - [2048, 8192, 1, 4096, 2048, 2048, 2048, 4096]
    - [43, 350.21]
  - - [2048, 8192, 1, 8192, 2048, 2048, 2048, 8192]
    - [41, 385.5]
  - - [4096, 128, 1, 128, 4096, 4096, 4096, 128]
    - [34, 14.79]
  - - [4096, 128, 1, 256, 4096, 4096, 4096, 256]
    - [63, 25.83]
  - - [4096, 128, 1, 512, 4096, 4096, 4096, 512]
    - [62, 39.05]
  - - [4096, 128, 1, 1024, 4096, 4096, 4096, 1024]
    - [63, 61.49]
  - - [4096, 128, 1, 2048, 4096, 4096, 4096, 2048]
    - [66, 76.41]
  - - [4096, 128, 1, 4096, 4096, 4096, 4096, 4096]
    - [66, 92.74]
  - - [4096, 128, 1, 8192, 4096, 4096, 4096, 8192]
    - [68, 103.45]
  - - [4096, 256, 1, 128, 4096, 4096, 4096, 128]
    - [20, 22.22]
  - - [4096, 256, 1, 256, 4096, 4096, 4096, 256]
    - [28, 39.99]
  - - [4096, 256, 1, 512, 4096, 4096, 4096, 512]
    - [24, 70.85]
  - - [4096, 256, 1, 1024, 4096, 4096, 4096, 1024]
    - [24, 102.92]
  - - [4096, 256, 1, 2048, 4096, 4096, 4096, 2048]
    - [60, 119.66]
  - - [4096, 256, 1, 4096, 4096, 4096, 4096, 4096]
    - [59, 140.37]
  - - [4096, 256, 1, 8192, 4096, 4096, 4096, 8192]
    - [60, 148.28]
  - - [4096, 512, 1, 128, 4096, 4096, 4096, 128]
    - [19, 39.48]
  - - [4096, 512, 1, 256, 4096, 4096, 4096, 256]
    - [52, 66.99]
  - - [4096, 512, 1, 512, 4096, 4096, 4096, 512]
    - [50, 110.82]
  - - [4096, 512, 1, 1024, 4096, 4096, 4096, 1024]
    - [53, 152.31]
  - - [4096, 512, 1, 2048, 4096, 4096, 4096, 2048]
    - [51, 181.33]
  - - [4096, 512, 1, 4096, 4096, 4096, 4096, 4096]
    - [53, 206.11]
  - - [4096, 512, 1, 8192, 4096, 4096, 4096, 8192]
    - [51, 203.75]
  - - [4096, 1024, 1, 128, 4096, 4096, 4096, 128]
    - [15, 57.95]
  - - [4096, 1024, 1, 256, 4096, 4096, 4096, 256]
    - [15, 99.2]
  - - [4096, 1024, 1, 512, 4096, 4096, 4096, 512]
    - [15, 152.03]
  - - [4096, 1024, 1, 1024, 4096, 4096, 4096, 1024]
    - [16, 202.27]
  - - [4096, 1024, 1, 2048, 4096, 4096, 4096, 2048]
    - [48, 246.79]
  - - [4096, 1024, 1, 4096, 4096, 4096, 4096, 4096]
    - [48, 272.03]
  - - [4096, 1024, 1, 8192, 4096, 4096, 4096, 8192]
    - [40, 244.09]
  - - [4096, 2048, 1, 128, 4096, 4096, 4096, 128]
    - [6, 72.07]
  - - [4096, 2048, 1, 256, 4096, 4096, 4096, 256]
    - [6, 120.43]
  - - [4096, 2048, 1, 512, 4096, 4096, 4096, 512]
    - [6, 182.08]
  - - [4096, 2048, 1, 1024, 4096, 4096, 4096, 1024]
    - [9, 244.42]
  - - [4096, 2048, 1, 2048, 4096, 4096, 4096, 2048]
    - [9, 277.87]
  - - [4096, 2048, 1, 4096, 4096, 4096, 4096, 4096]
    - [5, 268.69]
  - - [4096, 2048, 1, 8192, 4096, 4096, 4096, 8192]
    - [38, 288.97]
  - - [4096, 4096, 1, 128, 4096, 4096, 4096, 128]
    - [10, 78.72]
  - - [4096, 4096, 1, 256, 4096, 4096, 4096, 256]
    - [10, 131.25]
  - - [4096, 4096, 1, 512, 4096, 4096, 4096, 512]
    - [6, 194.83]
  - - [4096, 4096, 1, 1024, 4096, 4096, 4096, 1024]
    - [11, 238.22]
  - - [4096, 4096, 1, 2048, 4096, 4096, 4096, 2048]
    - [41, 267.62]
  - - [4096, 4096, 1, 4096, 4096, 4096, 4096, 4096]
    - [43, 296.95]
  - - [4096, 4096, 1, 8192, 4096, 4096, 4096, 8192]
    - [7, 321.92]
  - - [4096, 8192, 1, 128, 4096, 4096, 4096, 128]
    - [41, 106.11]
  - - [4096, 8192, 1, 256, 4096, 4096, 4096, 256]
    - [41, 172.65]
  - - [4096, 8192, 1, 512, 4096, 4096, 4096, 512]
    - [44, 228.8]
  - - [4096, 8192, 1, 1024, 4096, 4096, 4096, 1024]
    - [43, 277.96]
  - - [4096, 8192, 1, 2048, 4096, 4096, 4096, 2048]
    - [43, 325.58]
  - - [4096, 8192, 1, 4096, 4096, 4096, 4096, 4096]
    - [43, 362.83]
  - - [4096, 8192, 1, 8192, 4096, 4096, 4096, 8192]
    - [44, 405.92]
  - - [8192, 128, 1, 128, 8192, 8192, 8192, 128]
    - [29, 25.42]
  - - [8192, 128, 1, 256, 8192, 8192, 8192, 256]
    - [32, 45.23]
  - - [8192, 128, 1, 512, 8192, 8192, 8192, 512]
    - [25, 71.93]
  - - [8192, 128, 1, 1024, 8192, 8192, 8192, 1024]
    - [24, 104.0]
  - - [8192, 128, 1, 2048, 8192, 8192, 8192, 2048]
    - [58, 120.1]
  - - [8192, 128, 1, 4096, 8192, 8192, 8192, 4096]
    - [59, 140.33]
  - - [8192, 128, 1, 8192, 8192, 8192, 8192, 8192]
    - [61, 144.76]
  - - [8192, 256, 1, 128, 8192, 8192, 8192, 128]
    - [23, 41.48]
  - - [8192, 256, 1, 256, 8192, 8192, 8192, 256]
    - [22, 70.82]
  - - [8192, 256, 1, 512, 8192, 8192, 8192, 512]
    - [50, 112.3]
  - - [8192, 256, 1, 1024, 8192, 8192, 8192, 1024]
    - [53, 158.58]
  - - [8192, 256, 1, 2048, 8192, 8192, 8192, 2048]
    - [51, 182.44]
  - - [8192, 256, 1, 4096, 8192, 8192, 8192, 4096]
    - [51, 209.66]
  - - [8192, 256, 1, 8192, 8192, 8192, 8192, 8192]
    - [51, 196.45]
  - - [8192, 512, 1, 128, 8192, 8192, 8192, 128]
    - [15, 58.14]
  - - [8192, 512, 1, 256, 8192, 8192, 8192, 256]
    - [15, 99.45]
  - - [8192, 512, 1, 512, 8192, 8192, 8192, 512]
    - [13, 152.87]
  - - [8192, 512, 1, 1024, 8192, 8192, 8192, 1024]
    - [14, 207.29]
  - - [8192, 512, 1, 2048, 8192, 8192, 8192, 2048]
    - [47, 246.01]
  - - [8192, 512, 1, 4096, 8192, 8192, 8192, 4096]
    - [40, 264.96]
  - - [8192, 512, 1, 8192, 8192, 8192, 8192, 8192]
    - [47, 240.85]
  - - [8192, 1024, 1, 128, 8192, 8192, 8192, 128]
    - [4, 71.97]
  - - [8192, 1024, 1, 256, 8192, 8192, 8192, 256]
    - [8, 119.94]
  - - [8192, 1024, 1, 512, 8192, 8192, 8192, 512]
    - [9, 181.16]
  - - [8192, 1024, 1, 1024, 8192, 8192, 8192, 1024]
    - [4, 241.4]
  - - [8192, 1024, 1, 2048, 8192, 8192, 8192, 2048]
    - [3, 278.92]
  - - [8192, 1024, 1, 4096, 8192, 8192, 8192, 4096]
    - [38, 283.27]
  - - [8192, 1024, 1, 8192, 8192, 8192, 8192, 8192]
    - [38, 306.71]
  - - [8192, 2048, 1, 128, 8192, 8192, 8192, 128]
    - [10, 77.45]
  - - [8192, 2048, 1, 256, 8192, 8192, 8192, 256]
    - [10, 129.18]
  - - [8192, 2048, 1, 512, 8192, 8192, 8192, 512]
    - [8, 194.22]
  - - [8192, 2048, 1, 1024, 8192, 8192, 8192, 1024]
    - [10, 244.85]
  - - [8192, 2048, 1, 2048, 8192, 8192, 8192, 2048]
    - [44, 248.95]
  - - [8192, 2048, 1, 4096, 8192, 8192, 8192, 4096]
    - [2, 287.23]
  - - [8192, 2048, 1, 8192, 8192, 8192, 8192, 8192]
    - [1, 341.35]
  - - [8192, 4096, 1, 128, 8192, 8192, 8192, 128]
    - [10, 83.96]
  - - [8192, 4096, 1, 256, 8192, 8192, 8192, 256]
    - [21, 136.65]
  - - [8192, 4096, 1, 512, 8192, 8192, 8192, 512]
    - [17, 196.35]
  - - [8192, 4096, 1, 1024, 8192, 8192, 8192, 1024]
    - [39, 239.55]
  - - [8192, 4096, 1, 2048, 8192, 8192, 8192, 2048]
    - [43, 290.25]
  - - [8192, 4096, 1, 4096, 8192, 8192, 8192, 4096]
    - [43, 328.64]
  - - [8192, 4096, 1, 8192, 8192, 8192, 8192, 8192]
    - [2, 367.2]
  - - [8192, 8192, 1, 128, 8192, 8192, 8192, 128]
    - [42, 105.95]
  - - [8192, 8192, 1, 256, 8192, 8192, 8192, 256]
    - [42, 155.62]
  - - [8192, 8192, 1, 512, 8192, 8192, 8192, 512]
    - [43, 215.42]
  - - [8192, 8192, 1, 1024, 8192, 8192, 8192, 1024]
    - [43, 284.64]
  - - [8192, 8192, 1, 2048, 8192, 8192, 8192, 2048]
    - [43, 340.41]
  - - [8192, 8192, 1, 4096, 8192, 8192, 8192, 4096]
    - [43, 384.66]
  - - [8192, 8192, 1, 8192, 8192, 8192, 8192, 8192]
    - [43, 415.64]
- null
- null
- ExperimentalStreamK
- GridBased
