projects/hipblaslt/library/src/amd_detail/rocblaslt/src/Tensile/Logic/asm_full/aquavanjaram/gfx942_228cu/StreamK/aquavanjaram942_Cijk_Ailk_Bjlk_F8B8NF8NS_BH_Bias_HAS_SAV_UserArgs.yaml
- {MinimumRequiredVersion: 4.33.0}
- aquavanjaram942
- {Architecture: gfx942, CUCount: 228}
- [Device 0049, Device 0050]
    SolutionIndex: 0
    SolutionNameMin: Cijk_Ailk_Bjlk_F8B8NF8NS_BH_Bias_HAS_SAV_UserArgs_MT256x256x64_MI16x16x1_SN_LDSB0_CLR1_GRVWA16_GRVWB4_GSU0_GSUC0_GSUWGMRR0_K1_LBSPPA2048_LBSPPB2048_LPA0_LPB0_MIWT8_8_PLR1_SU0_SUM0_SUS64_VWA8_VWB8_WGM1_WGMXCC1_WGMXCCGn1
    SolutionIndex: 1
    SolutionNameMin: Cijk_Ailk_Bjlk_F8B8NF8NS_BH_Bias_HAS_SAV_UserArgs_MT256x256x64_MI16x16x1_SN_LDSB0_CLR1_GRVWA4_GRVWB8_GSU0_GSUC0_GSUWGMRR0_K1_LBSPPA2048_LBSPPB2048_LPA0_LPB0_MIWT8_8_PLR1_SU0_SUM0_SUS64_VWA8_VWB8_WGM1_WGMXCC1_WGMXCCGn1
    SolutionIndex: 2
    SolutionNameMin: Cijk_Ailk_Bjlk_F8B8NF8NS_BH_Bias_HAS_SAV_UserArgs_MT256x256x64_MI16x16x1_SN_LDSB0_CLR1_GRVWA4_GRVWB16_GSU0_GSUC0_GSUWGMRR0_K1_LBSPPA2048_LBSPPB2048_LPA0_LPB0_MIWT8_8_PLR1_SU0_SUM0_SUS64_VWA8_VWB8_WGM1_WGMXCC1_WGMXCCGn1
    SolutionIndex: 3
    SolutionNameMin: Cijk_Ailk_Bjlk_F8B8NF8NS_BH_Bias_HAS_SAV_UserArgs_MT256x256x64_MI16x16x1_SN_LDSB0_CLR1_GRVWA16_GRVWB16_GSU0_GSUC0_GSUWGMRR0_K1_LBSPPA2048_LBSPPB2048_LPA0_LPB0_MIWT8_8_PLR1_SU0_SUM0_SUS64_VWA8_VWB8_WGM1_WGMXCC1_WGMXCCGn1
    SolutionIndex: 4
    SolutionNameMin: Cijk_Ailk_Bjlk_F8B8NF8NS_BH_Bias_HAS_SAV_UserArgs_MT256x256x64_MI16x16x1_SN_LDSB0_CLR1_GRVWA16_GRVWB4_GSU0_GSUC0_GSUWGMRR0_K1_LBSPPA2048_LBSPPB2048_LPA0_LPB0_MIWT8_8_PLR1_SU0_SUM0_SUS64_VWA8_VWB8_WGM4_WGMXCC1_WGMXCCGn1
    SolutionIndex: 5
    SolutionNameMin: Cijk_Ailk_Bjlk_F8B8NF8NS_BH_Bias_HAS_SAV_UserArgs_MT256x256x64_MI16x16x1_SN_LDSB0_CLR1_GRVWA4_GRVWB8_GSU0_GSUC0_GSUWGMRR0_K1_LBSPPA2048_LBSPPB2048_LPA0_LPB0_MIWT8_8_PLR1_SU0_SUM0_SUS64_VWA8_VWB8_WGM4_WGMXCC1_WGMXCCGn1
    SolutionIndex: 6
    SolutionNameMin: Cijk_Ailk_Bjlk_F8B8NF8NS_BH_Bias_HAS_SAV_UserArgs_MT256x256x64_MI16x16x1_SN_LDSB0_CLR1_GRVWA16_GRVWB16_GSU0_GSUC0_GSUWGMRR0_K1_LBSPPA2048_LBSPPB2048_LPA0_LPB0_MIWT8_8_PLR1_SU0_SUM0_SUS64_VWA8_VWB8_WGM4_WGMXCC1_WGMXCCGn1
    SolutionIndex: 7
    SolutionNameMin: Cijk_Ailk_Bjlk_F8B8NF8NS_BH_Bias_HAS_SAV_UserArgs_MT256x256x64_MI16x16x1_SN_LDSB0_CLR1_GRVWA16_GRVWB4_GSU0_GSUC0_GSUWGMRR0_K1_LBSPPA2048_LBSPPB2048_LPA0_LPB0_MIWT8_8_PLR1_SU0_SUM0_SUS64_VWA8_VWB8_WGM6_WGMXCC1_WGMXCCGn1
    SolutionIndex: 8
    SolutionNameMin: Cijk_Ailk_Bjlk_F8B8NF8NS_BH_Bias_HAS_SAV_UserArgs_MT256x256x64_MI16x16x1_SN_LDSB0_CLR1_GRVWA16_GRVWB16_GSU0_GSUC0_GSUWGMRR0_K1_LBSPPA2048_LBSPPB2048_LPA0_LPB0_MIWT8_8_PLR1_SU0_SUM0_SUS64_VWA8_VWB8_WGM6_WGMXCC1_WGMXCCGn1
    SolutionIndex: 9
    SolutionNameMin: Cijk_Ailk_Bjlk_F8B8NF8NS_BH_Bias_HAS_SAV_UserArgs_MT256x256x64_MI16x16x1_SN_LDSB0_CLR1_GRVWA16_GRVWB4_GSU0_GSUC0_GSUWGMRR0_K1_LBSPPA2048_LBSPPB2048_LPA0_LPB0_MIWT8_8_PLR1_SU0_SUM0_SUS64_VWA8_VWB8_WGM8_WGMXCC1_WGMXCCGn1
    SolutionIndex: 10
    SolutionNameMin: Cijk_Ailk_Bjlk_F8B8NF8NS_BH_Bias_HAS_SAV_UserArgs_MT256x256x64_MI16x16x1_SN_LDSB0_CLR1_GRVWA4_GRVWB8_GSU0_GSUC0_GSUWGMRR0_K1_LBSPPA2048_LBSPPB2048_LPA0_LPB0_MIWT8_8_PLR1_SU0_SUM0_SUS64_VWA8_VWB8_WGM8_WGMXCC1_WGMXCCGn1
    SolutionIndex: 11
    SolutionNameMin: Cijk_Ailk_Bjlk_F8B8NF8NS_BH_Bias_HAS_SAV_UserArgs_MT256x256x64_MI16x16x1_SN_LDSB0_CLR1_GRVWA16_GRVWB16_GSU0_GSUC0_GSUWGMRR0_K1_LBSPPA2048_LBSPPB2048_LPA0_LPB0_MIWT8_8_PLR1_SU0_SUM0_SUS64_VWA8_VWB8_WGM8_WGMXCC1_WGMXCCGn1
    SolutionIndex: 12
    SolutionNameMin: Cijk_Ailk_Bjlk_F8B8NF8NS_BH_Bias_HAS_SAV_UserArgs_MT128x256x64_MI16x16x1_SN_LDSB1_CLR1_GRVWA4_GRVWB16_GSU0_GSUC0_GSUWGMRR0_K1_LBSPPA1024_LBSPPB2048_LPA64_LPB0_MIWT4_8_PLR1_SU0_SUM0_SUS64_VWA4_VWB8_WGM1_WGMXCC1_WGMXCCGn1
    SolutionIndex: 13
    SolutionNameMin: Cijk_Ailk_Bjlk_F8B8NF8NS_BH_Bias_HAS_SAV_UserArgs_MT128x256x64_MI16x16x1_SN_LDSB1_CLR1_GRVWA8_GRVWB16_GSU0_GSUC0_GSUWGMRR0_K1_LBSPPA1024_LBSPPB2048_LPA64_LPB0_MIWT4_8_PLR1_SU0_SUM0_SUS64_VWA4_VWB8_WGM1_WGMXCC1_WGMXCCGn1
    SolutionIndex: 14
    SolutionNameMin: Cijk_Ailk_Bjlk_F8B8NF8NS_BH_Bias_HAS_SAV_UserArgs_MT128x256x64_MI16x16x1_SN_LDSB1_CLR1_GRVWA16_GRVWB16_GSU0_GSUC0_GSUWGMRR0_K1_LBSPPA1024_LBSPPB2048_LPA64_LPB0_MIWT4_8_PLR1_SU0_SUM0_SUS64_VWA4_VWB8_WGM1_WGMXCC1_WGMXCCGn1
    SolutionIndex: 15
    SolutionNameMin: Cijk_Ailk_Bjlk_F8B8NF8NS_BH_Bias_HAS_SAV_UserArgs_MT128x256x64_MI16x16x1_SN_LDSB1_CLR1_GRVWA8_GRVWB16_GSU0_GSUC0_GSUWGMRR0_K1_LBSPPA1024_LBSPPB2048_LPA64_LPB0_MIWT4_8_PLR1_SU0_SUM0_SUS64_VWA4_VWB8_WGM6_WGMXCC1_WGMXCCGn1
    SolutionIndex: 16
    SolutionNameMin: Cijk_Ailk_Bjlk_F8B8NF8NS_BH_Bias_HAS_SAV_UserArgs_MT128x256x64_MI16x16x1_SN_LDSB1_CLR1_GRVWA16_GRVWB16_GSU0_GSUC0_GSUWGMRR0_K1_LBSPPA1024_LBSPPB2048_LPA64_LPB0_MIWT4_8_PLR1_SU0_SUM0_SUS64_VWA4_VWB8_WGM6_WGMXCC1_WGMXCCGn1
    SolutionIndex: 17
    SolutionNameMin: Cijk_Ailk_Bjlk_F8B8NF8NS_BH_Bias_HAS_SAV_UserArgs_MT128x256x64_MI16x16x1_SN_LDSB1_CLR1_GRVWA4_GRVWB16_GSU0_GSUC0_GSUWGMRR0_K1_LBSPPA1024_LBSPPB2048_LPA64_LPB0_MIWT4_8_PLR1_SU0_SUM0_SUS64_VWA4_VWB8_WGM8_WGMXCC1_WGMXCCGn1
    SolutionIndex: 18
    SolutionNameMin: Cijk_Ailk_Bjlk_F8B8NF8NS_BH_Bias_HAS_SAV_UserArgs_MT128x256x64_MI16x16x1_SN_LDSB1_CLR1_GRVWA16_GRVWB16_GSU0_GSUC0_GSUWGMRR0_K1_LBSPPA1024_LBSPPB2048_LPA64_LPB0_MIWT4_8_PLR1_SU0_SUM0_SUS64_VWA4_VWB8_WGM8_WGMXCC1_WGMXCCGn1
    SolutionIndex: 19
    SolutionNameMin: Cijk_Ailk_Bjlk_F8B8NF8NS_BH_Bias_HAS_SAV_UserArgs_MT256x144x64_MI16x16x1_SN_LDSB0_CLR1_GRVWA4_GRVWB4_GSU0_GSUC0_GSUWGMRR0_K1_LBSPPA2048_LBSPPB1152_LPA64_LPB16_MIWT4_9_PLR1_SU0_SUM0_SUS64_VWA4_VWB1_WGM1_WGMXCC1_WGMXCCGn1
    SolutionIndex: 20
    SolutionNameMin: Cijk_Ailk_Bjlk_F8B8NF8NS_BH_Bias_HAS_SAV_UserArgs_MT256x144x64_MI16x16x1_SN_LDSB0_CLR1_GRVWA16_GRVWB4_GSU0_GSUC0_GSUWGMRR0_K1_LBSPPA2048_LBSPPB1152_LPA64_LPB16_MIWT4_9_PLR1_SU0_SUM0_SUS64_VWA4_VWB1_WGM1_WGMXCC1_WGMXCCGn1
    SolutionIndex: 21
    SolutionNameMin: Cijk_Ailk_Bjlk_F8B8NF8NS_BH_Bias_HAS_SAV_UserArgs_MT256x144x64_MI16x16x1_SN_LDSB0_CLR1_GRVWA16_GRVWB4_GSU0_GSUC0_GSUWGMRR0_K1_LBSPPA2048_LBSPPB1152_LPA64_LPB16_MIWT4_9_PLR1_SU0_SUM0_SUS64_VWA4_VWB1_WGM4_WGMXCC1_WGMXCCGn1
    SolutionIndex: 22
    SolutionNameMin: Cijk_Ailk_Bjlk_F8B8NF8NS_BH_Bias_HAS_SAV_UserArgs_MT256x144x64_MI16x16x1_SN_LDSB0_CLR1_GRVWA16_GRVWB4_GSU0_GSUC0_GSUWGMRR0_K1_LBSPPA2048_LBSPPB1152_LPA64_LPB16_MIWT4_9_PLR1_SU0_SUM0_SUS64_VWA4_VWB1_WGM6_WGMXCC1_WGMXCCGn1
    SolutionIndex: 23
    SolutionNameMin: Cijk_Ailk_Bjlk_F8B8NF8NS_BH_Bias_HAS_SAV_UserArgs_MT256x128x64_MI16x16x1_SN_LDSB1_CLR1_GRVWA4_GRVWB8_GSU0_GSUC0_GSUWGMRR0_K1_LBSPPA2048_LBSPPB1024_LPA0_LPB64_MIWT8_4_PLR1_SU0_SUM0_SUS64_VWA8_VWB4_WGM1_WGMXCC1_WGMXCCGn1
    SolutionIndex: 24
    SolutionNameMin: Cijk_Ailk_Bjlk_F8B8NF8NS_BH_Bias_HAS_SAV_UserArgs_MT256x128x64_MI16x16x1_SN_LDSB1_CLR1_GRVWA16_GRVWB16_GSU0_GSUC0_GSUWGMRR0_K1_LBSPPA2048_LBSPPB1024_LPA0_LPB64_MIWT8_4_PLR1_SU0_SUM0_SUS64_VWA8_VWB4_WGM1_WGMXCC1_WGMXCCGn1
    SolutionIndex: 25
    SolutionNameMin: Cijk_Ailk_Bjlk_F8B8NF8NS_BH_Bias_HAS_SAV_UserArgs_MT256x128x64_MI16x16x1_SN_LDSB1_CLR1_GRVWA16_GRVWB16_GSU0_GSUC0_GSUWGMRR0_K1_LBSPPA2048_LBSPPB1024_LPA0_LPB64_MIWT8_4_PLR1_SU0_SUM0_SUS64_VWA8_VWB4_WGM4_WGMXCC1_WGMXCCGn1
    SolutionIndex: 26
    SolutionNameMin: Cijk_Ailk_Bjlk_F8B8NF8NS_BH_Bias_HAS_SAV_UserArgs_MT256x128x64_MI16x16x1_SN_LDSB1_CLR1_GRVWA8_GRVWB16_GSU0_GSUC0_GSUWGMRR0_K1_LBSPPA2048_LBSPPB1024_LPA0_LPB64_MIWT8_4_PLR1_SU0_SUM0_SUS64_VWA8_VWB4_WGM6_WGMXCC1_WGMXCCGn1
    SolutionIndex: 27
    SolutionNameMin: Cijk_Ailk_Bjlk_F8B8NF8NS_BH_Bias_HAS_SAV_UserArgs_MT256x128x64_MI16x16x1_SN_LDSB1_CLR1_GRVWA16_GRVWB16_GSU0_GSUC0_GSUWGMRR0_K1_LBSPPA2048_LBSPPB1024_LPA0_LPB64_MIWT8_4_PLR1_SU0_SUM0_SUS64_VWA8_VWB4_WGM6_WGMXCC1_WGMXCCGn1
    SolutionIndex: 28
    SolutionNameMin: Cijk_Ailk_Bjlk_F8B8NF8NS_BH_Bias_HAS_SAV_UserArgs_MT256x128x64_MI16x16x1_SN_LDSB1_CLR1_GRVWA4_GRVWB8_GSU0_GSUC0_GSUWGMRR0_K1_LBSPPA2048_LBSPPB1024_LPA0_LPB64_MIWT8_4_PLR1_SU0_SUM0_SUS64_VWA8_VWB4_WGM8_WGMXCC1_WGMXCCGn1
    SolutionIndex: 29
    SolutionNameMin: Cijk_Ailk_Bjlk_F8B8NF8NS_BH_Bias_HAS_SAV_UserArgs_MT256x128x64_MI16x16x1_SN_LDSB1_CLR1_GRVWA16_GRVWB16_GSU0_GSUC0_GSUWGMRR0_K1_LBSPPA2048_LBSPPB1024_LPA0_LPB64_MIWT8_4_PLR1_SU0_SUM0_SUS64_VWA8_VWB4_WGM8_WGMXCC1_WGMXCCGn1
    SolutionIndex: 30
    SolutionNameMin: Cijk_Ailk_Bjlk_F8B8NF8NS_BH_Bias_HAS_SAV_UserArgs_MT128x128x64_MI16x16x1_SN_LDSB1_CLR1_GRVWA4_GRVWB16_GSU0_GSUC0_GSUWGMRR0_K1_LBSPPA1024_LBSPPB1024_LPA64_LPB64_MIWT4_4_PLR1_SU0_SUM0_SUS64_VWA4_VWB4_WGM1_WGMXCC1_WGMXCCGn1
    SolutionIndex: 31
    SolutionNameMin: Cijk_Ailk_Bjlk_F8B8NF8NS_BH_Bias_HAS_SAV_UserArgs_MT128x128x64_MI16x16x1_SN_LDSB1_CLR1_GRVWA8_GRVWB16_GSU0_GSUC0_GSUWGMRR0_K1_LBSPPA1024_LBSPPB1024_LPA64_LPB64_MIWT4_4_PLR1_SU0_SUM0_SUS64_VWA4_VWB4_WGM1_WGMXCC1_WGMXCCGn1
    SolutionIndex: 32
    SolutionNameMin: Cijk_Ailk_Bjlk_F8B8NF8NS_BH_Bias_HAS_SAV_UserArgs_MT128x128x64_MI16x16x1_SN_LDSB1_CLR1_GRVWA16_GRVWB16_GSU0_GSUC0_GSUWGMRR0_K1_LBSPPA1024_LBSPPB1024_LPA64_LPB64_MIWT4_4_PLR1_SU0_SUM0_SUS64_VWA4_VWB4_WGM1_WGMXCC1_WGMXCCGn1
    SolutionIndex: 33
    SolutionNameMin: Cijk_Ailk_Bjlk_F8B8NF8NS_BH_Bias_HAS_SAV_UserArgs_MT128x128x64_MI16x16x1_SN_LDSB1_CLR1_GRVWA8_GRVWB16_GSU0_GSUC0_GSUWGMRR0_K1_LBSPPA1024_LBSPPB1024_LPA64_LPB64_MIWT4_4_PLR1_SU0_SUM0_SUS64_VWA4_VWB4_WGM4_WGMXCC1_WGMXCCGn1
    SolutionIndex: 34
    SolutionNameMin: Cijk_Ailk_Bjlk_F8B8NF8NS_BH_Bias_HAS_SAV_UserArgs_MT128x128x64_MI16x16x1_SN_LDSB1_CLR1_GRVWA16_GRVWB16_GSU0_GSUC0_GSUWGMRR0_K1_LBSPPA1024_LBSPPB1024_LPA64_LPB64_MIWT4_4_PLR1_SU0_SUM0_SUS64_VWA4_VWB4_WGM4_WGMXCC1_WGMXCCGn1
    SolutionIndex: 35
    SolutionNameMin: Cijk_Ailk_Bjlk_F8B8NF8NS_BH_Bias_HAS_SAV_UserArgs_MT128x128x64_MI16x16x1_SN_LDSB1_CLR1_GRVWA16_GRVWB16_GSU0_GSUC0_GSUWGMRR0_K1_LBSPPA1024_LBSPPB1024_LPA64_LPB64_MIWT4_4_PLR1_SU0_SUM0_SUS64_VWA4_VWB4_WGM6_WGMXCC1_WGMXCCGn1
    SolutionIndex: 36
    SolutionNameMin: Cijk_Ailk_Bjlk_F8B8NF8NS_BH_Bias_HAS_SAV_UserArgs_MT128x128x64_MI16x16x1_SN_LDSB1_CLR1_GRVWA8_GRVWB16_GSU0_GSUC0_GSUWGMRR0_K1_LBSPPA1024_LBSPPB1024_LPA64_LPB64_MIWT4_4_PLR1_SU0_SUM0_SUS64_VWA4_VWB4_WGM8_WGMXCC1_WGMXCCGn1
    SolutionIndex: 37
    SolutionNameMin: Cijk_Ailk_Bjlk_F8B8NF8NS_BH_Bias_HAS_SAV_UserArgs_MT128x128x64_MI16x16x1_SN_LDSB1_CLR1_GRVWA16_GRVWB16_GSU0_GSUC0_GSUWGMRR0_K1_LBSPPA1024_LBSPPB1024_LPA64_LPB64_MIWT4_4_PLR1_SU0_SUM0_SUS64_VWA4_VWB4_WGM8_WGMXCC1_WGMXCCGn1
    SolutionIndex: 38
    SolutionNameMin: Cijk_Ailk_Bjlk_F8B8NF8NS_BH_Bias_HAS_SAV_UserArgs_MT64x128x64_MI16x16x1_SN_LDSB0_CLR1_GRVWA4_GRVWB4_GSU0_GSUC0_GSUWGMRR0_K1_LBSPPA512_LBSPPB1024_LPA32_LPB64_MIWT2_4_PLR1_SU0_SUM0_SUS64_VWA2_VWB4_WGM1_WGMXCC1_WGMXCCGn1
    SolutionIndex: 39
    SolutionNameMin: Cijk_Ailk_Bjlk_F8B8NF8NS_BH_Bias_HAS_SAV_UserArgs_MT64x128x64_MI16x16x1_SN_LDSB0_CLR1_GRVWA4_GRVWB8_GSU0_GSUC0_GSUWGMRR0_K1_LBSPPA512_LBSPPB1024_LPA32_LPB64_MIWT2_4_PLR1_SU0_SUM0_SUS64_VWA2_VWB4_WGM1_WGMXCC1_WGMXCCGn1
    SolutionIndex: 40
    SolutionNameMin: Cijk_Ailk_Bjlk_F8B8NF8NS_BH_Bias_HAS_SAV_UserArgs_MT64x128x64_MI16x16x1_SN_LDSB0_CLR1_GRVWA16_GRVWB16_GSU0_GSUC0_GSUWGMRR0_K1_LBSPPA512_LBSPPB1024_LPA32_LPB64_MIWT2_4_PLR1_SU0_SUM0_SUS64_VWA2_VWB4_WGM1_WGMXCC1_WGMXCCGn1
    SolutionIndex: 41
    SolutionNameMin: Cijk_Ailk_Bjlk_F8B8NF8NS_BH_Bias_HAS_SAV_UserArgs_MT64x128x64_MI16x16x1_SN_LDSB0_CLR1_GRVWA16_GRVWB16_GSU0_GSUC0_GSUWGMRR0_K1_LBSPPA512_LBSPPB1024_LPA32_LPB64_MIWT2_4_PLR1_SU0_SUM0_SUS64_VWA2_VWB4_WGM6_WGMXCC1_WGMXCCGn1
    SolutionIndex: 42
    SolutionNameMin: Cijk_Ailk_Bjlk_F8B8NF8NS_BH_Bias_HAS_SAV_UserArgs_MT128x64x64_MI16x16x1_SN_LDSB0_CLR1_GRVWA4_GRVWB4_GSU0_GSUC0_GSUWGMRR0_K1_LBSPPA1024_LBSPPB512_LPA64_LPB32_MIWT4_2_PLR1_SU0_SUM0_SUS64_VWA4_VWB2_WGM1_WGMXCC1_WGMXCCGn1
    SolutionIndex: 43
    SolutionNameMin: Cijk_Ailk_Bjlk_F8B8NF8NS_BH_Bias_HAS_SAV_UserArgs_MT128x64x64_MI16x16x1_SN_LDSB0_CLR1_GRVWA4_GRVWB8_GSU0_GSUC0_GSUWGMRR0_K1_LBSPPA1024_LBSPPB512_LPA64_LPB32_MIWT4_2_PLR1_SU0_SUM0_SUS64_VWA4_VWB2_WGM1_WGMXCC1_WGMXCCGn1
    SolutionIndex: 44
    SolutionNameMin: Cijk_Ailk_Bjlk_F8B8NF8NS_BH_Bias_HAS_SAV_UserArgs_MT128x64x64_MI16x16x1_SN_LDSB0_CLR1_GRVWA8_GRVWB8_GSU0_GSUC0_GSUWGMRR0_K1_LBSPPA1024_LBSPPB512_LPA64_LPB32_MIWT4_2_PLR1_SU0_SUM0_SUS64_VWA4_VWB2_WGM1_WGMXCC1_WGMXCCGn1
    SolutionIndex: 45
    SolutionNameMin: Cijk_Ailk_Bjlk_F8B8NF8NS_BH_Bias_HAS_SAV_UserArgs_MT128x64x64_MI16x16x1_SN_LDSB0_CLR1_GRVWA16_GRVWB8_GSU0_GSUC0_GSUWGMRR0_K1_LBSPPA1024_LBSPPB512_LPA64_LPB32_MIWT4_2_PLR1_SU0_SUM0_SUS64_VWA4_VWB2_WGM1_WGMXCC1_WGMXCCGn1
    SolutionIndex: 46
    SolutionNameMin: Cijk_Ailk_Bjlk_F8B8NF8NS_BH_Bias_HAS_SAV_UserArgs_MT128x64x64_MI16x16x1_SN_LDSB0_CLR1_GRVWA4_GRVWB8_GSU0_GSUC0_GSUWGMRR0_K1_LBSPPA1024_LBSPPB512_LPA64_LPB32_MIWT4_2_PLR1_SU0_SUM0_SUS64_VWA4_VWB2_WGM6_WGMXCC1_WGMXCCGn1
    SolutionIndex: 47
    SolutionNameMin: Cijk_Ailk_Bjlk_F8B8NF8NS_BH_Bias_HAS_SAV_UserArgs_MT32x128x64_MI16x16x1_SN_LDSB0_CLR1_GRVWA8_GRVWB4_GSU0_GSUC0_GSUWGMRR0_K1_LBSPPA256_LBSPPB1024_LPA16_LPB64_MIWT1_4_PLR1_SU0_SUM0_SUS64_VWA1_VWB4_WGM8_WGMXCC1_WGMXCCGn1
    SolutionIndex: 48
    SolutionNameMin: Cijk_Ailk_Bjlk_F8B8NF8NS_BH_Bias_HAS_SAV_UserArgs_MT128x32x64_MI16x16x1_SN_LDSB0_CLR1_GRVWA4_GRVWB4_GSU0_GSUC0_GSUWGMRR0_K1_LBSPPA1024_LBSPPB256_LPA64_LPB16_MIWT4_1_PLR1_SU0_SUM0_SUS64_VWA4_VWB1_WGM1_WGMXCC1_WGMXCCGn1
    SolutionIndex: 49
    SolutionNameMin: Cijk_Ailk_Bjlk_F8B8NF8NS_BH_Bias_HAS_SAV_UserArgs_MT128x32x64_MI16x16x1_SN_LDSB0_CLR1_GRVWA8_GRVWB8_GSU0_GSUC0_GSUWGMRR0_K1_LBSPPA1024_LBSPPB256_LPA64_LPB16_MIWT4_1_PLR1_SU0_SUM0_SUS64_VWA4_VWB1_WGM1_WGMXCC1_WGMXCCGn1
    SolutionIndex: 50
    SolutionNameMin: Cijk_Ailk_Bjlk_F8B8NF8NS_BH_Bias_HAS_SAV_UserArgs_MT64x64x64_MI16x16x1_SN_LDSB0_CLR1_GRVWA4_GRVWB4_GSU0_GSUC0_GSUWGMRR0_K1_LBSPPA512_LBSPPB512_LPA32_LPB32_MIWT2_2_PLR1_SU0_SUM0_SUS64_VWA2_VWB2_WGM1_WGMXCC1_WGMXCCGn1
    SolutionIndex: 51
    SolutionNameMin: Cijk_Ailk_Bjlk_F8B8NF8NS_BH_Bias_HAS_SAV_UserArgs_MT64x64x64_MI16x16x1_SN_LDSB0_CLR1_GRVWA8_GRVWB4_GSU0_GSUC0_GSUWGMRR0_K1_LBSPPA512_LBSPPB512_LPA32_LPB32_MIWT2_2_PLR1_SU0_SUM0_SUS64_VWA2_VWB2_WGM1_WGMXCC1_WGMXCCGn1
    SolutionIndex: 52
    SolutionNameMin: Cijk_Ailk_Bjlk_F8B8NF8NS_BH_Bias_HAS_SAV_UserArgs_MT64x64x64_MI16x16x1_SN_LDSB0_CLR1_GRVWA4_GRVWB8_GSU0_GSUC0_GSUWGMRR0_K1_LBSPPA512_LBSPPB512_LPA32_LPB32_MIWT2_2_PLR1_SU0_SUM0_SUS64_VWA2_VWB2_WGM1_WGMXCC1_WGMXCCGn1
    SolutionIndex: 53
    SolutionNameMin: Cijk_Ailk_Bjlk_F8B8NF8NS_BH_Bias_HAS_SAV_UserArgs_MT64x64x64_MI16x16x1_SN_LDSB0_CLR1_GRVWA8_GRVWB8_GSU0_GSUC0_GSUWGMRR0_K1_LBSPPA512_LBSPPB512_LPA32_LPB32_MIWT2_2_PLR1_SU0_SUM0_SUS64_VWA2_VWB2_WGM1_WGMXCC1_WGMXCCGn1
    SolutionIndex: 54
    SolutionNameMin: Cijk_Ailk_Bjlk_F8B8NF8NS_BH_Bias_HAS_SAV_UserArgs_MT64x64x64_MI16x16x1_SN_LDSB0_CLR1_GRVWA16_GRVWB8_GSU0_GSUC0_GSUWGMRR0_K1_LBSPPA512_LBSPPB512_LPA32_LPB32_MIWT2_2_PLR1_SU0_SUM0_SUS64_VWA2_VWB2_WGM1_WGMXCC1_WGMXCCGn1
    SolutionIndex: 55
    SolutionNameMin: Cijk_Ailk_Bjlk_F8B8NF8NS_BH_Bias_HAS_SAV_UserArgs_MT64x64x64_MI16x16x1_SN_LDSB0_CLR1_GRVWA8_GRVWB16_GSU0_GSUC0_GSUWGMRR0_K1_LBSPPA512_LBSPPB512_LPA32_LPB32_MIWT2_2_PLR1_SU0_SUM0_SUS64_VWA2_VWB2_WGM1_WGMXCC1_WGMXCCGn1
    SolutionIndex: 56
    SolutionNameMin: Cijk_Ailk_Bjlk_F8B8NF8NS_BH_Bias_HAS_SAV_UserArgs_MT32x64x64_MI16x16x1_SN_LDSB0_CLR1_GRVWA8_GRVWB4_GSU0_GSUC0_GSUWGMRR0_K1_LBSPPA256_LBSPPB512_LPA16_LPB32_MIWT1_2_PLR1_SU0_SUM0_SUS64_VWA1_VWB2_WGM6_WGMXCC1_WGMXCCGn1
    SolutionIndex: 57
    SolutionNameMin: Cijk_Ailk_Bjlk_F8B8NF8NS_BH_Bias_HAS_SAV_UserArgs_MT64x32x64_MI16x16x1_SN_LDSB0_CLR1_GRVWA4_GRVWB4_GSU0_GSUC0_GSUWGMRR0_K1_LBSPPA512_LBSPPB256_LPA32_LPB16_MIWT2_1_PLR1_SU0_SUM0_SUS64_VWA2_VWB1_WGM1_WGMXCC1_WGMXCCGn1
    SolutionIndex: 58
    SolutionNameMin: Cijk_Ailk_Bjlk_F8B8NF8NS_BH_Bias_HAS_SAV_UserArgs_MT64x32x64_MI16x16x1_SN_LDSB0_CLR1_GRVWA8_GRVWB4_GSU0_GSUC0_GSUWGMRR0_K1_LBSPPA512_LBSPPB256_LPA32_LPB16_MIWT2_1_PLR1_SU0_SUM0_SUS64_VWA2_VWB1_WGM1_WGMXCC1_WGMXCCGn1
    SolutionIndex: 59
    SolutionNameMin: Cijk_Ailk_Bjlk_F8B8NF8NS_BH_Bias_HAS_SAV_UserArgs_MT64x32x64_MI16x16x1_SN_LDSB0_CLR1_GRVWA8_GRVWB8_GSU0_GSUC0_GSUWGMRR0_K1_LBSPPA512_LBSPPB256_LPA32_LPB16_MIWT2_1_PLR1_SU0_SUM0_SUS64_VWA2_VWB1_WGM1_WGMXCC1_WGMXCCGn1
    SolutionIndex: 60
    SolutionNameMin: Cijk_Ailk_Bjlk_F8B8NF8NS_BH_Bias_HAS_SAV_UserArgs_MT64x32x64_MI16x16x1_SN_LDSB0_CLR1_GRVWA4_GRVWB4_GSU0_GSUC0_GSUWGMRR0_K1_LBSPPA512_LBSPPB256_LPA32_LPB16_MIWT2_1_PLR1_SU0_SUM0_SUS64_VWA2_VWB1_WGM6_WGMXCC1_WGMXCCGn1
    SolutionIndex: 61
    SolutionNameMin: Cijk_Ailk_Bjlk_F8B8NF8NS_BH_Bias_HAS_SAV_UserArgs_MT32x32x64_MI16x16x1_SN_LDSB0_CLR1_GRVWA4_GRVWB4_GSU0_GSUC0_GSUWGMRR0_K1_LBSPPA256_LBSPPB256_LPA16_LPB16_MIWT1_1_PLR1_SU0_SUM0_SUS64_VWA1_VWB1_WGM1_WGMXCC1_WGMXCCGn1
    SolutionIndex: 62
    SolutionNameMin: Cijk_Ailk_Bjlk_F8B8NF8NS_BH_Bias_HAS_SAV_UserArgs_MT32x32x64_MI16x16x1_SN_LDSB0_CLR1_GRVWA8_GRVWB4_GSU0_GSUC0_GSUWGMRR0_K1_LBSPPA256_LBSPPB256_LPA16_LPB16_MIWT1_1_PLR1_SU0_SUM0_SUS64_VWA1_VWB1_WGM1_WGMXCC1_WGMXCCGn1
    SolutionIndex: 63
    SolutionNameMin: Cijk_Ailk_Bjlk_F8B8NF8NS_BH_Bias_HAS_SAV_UserArgs_MT32x32x64_MI16x16x1_SN_LDSB0_CLR1_GRVWA4_GRVWB8_GSU0_GSUC0_GSUWGMRR0_K1_LBSPPA256_LBSPPB256_LPA16_LPB16_MIWT1_1_PLR1_SU0_SUM0_SUS64_VWA1_VWB1_WGM1_WGMXCC1_WGMXCCGn1
    SolutionIndex: 64
    SolutionNameMin: Cijk_Ailk_Bjlk_F8B8NF8NS_BH_Bias_HAS_SAV_UserArgs_MT32x32x64_MI16x16x1_SN_LDSB0_CLR1_GRVWA8_GRVWB8_GSU0_GSUC0_GSUWGMRR0_K1_LBSPPA256_LBSPPB256_LPA16_LPB16_MIWT1_1_PLR1_SU0_SUM0_SUS64_VWA1_VWB1_WGM1_WGMXCC1_WGMXCCGn1
    SolutionIndex: 65
    SolutionNameMin: Cijk_Ailk_Bjlk_F8B8NF8NS_BH_Bias_HAS_SAV_UserArgs_MT256x256x128_MI16x16x1_SN_LDSB1_CLR1_GRVWA16_GRVWB8_GSU0_GSUC0_GSUWGMRR0_K1_LBSPPA2048_LBSPPB2048_LPA0_LPB0_MIWT8_8_PLR1_SU0_SUM0_SUS128_VWA8_VWB8_WGM1_WGMXCC1_WGMXCCGn1
    SolutionIndex: 66
    SolutionNameMin: Cijk_Ailk_Bjlk_F8B8NF8NS_BH_Bias_HAS_SAV_UserArgs_MT256x256x128_MI16x16x1_SN_LDSB1_CLR1_GRVWA16_GRVWB16_GSU0_GSUC0_GSUWGMRR0_K1_LBSPPA2048_LBSPPB2048_LPA0_LPB0_MIWT8_8_PLR1_SU0_SUM0_SUS128_VWA8_VWB8_WGM1_WGMXCC1_WGMXCCGn1
    SolutionIndex: 67
    SolutionNameMin: Cijk_Ailk_Bjlk_F8B8NF8NS_BH_Bias_HAS_SAV_UserArgs_MT256x256x128_MI16x16x1_SN_LDSB1_CLR1_GRVWA16_GRVWB8_GSU0_GSUC0_GSUWGMRR0_K1_LBSPPA2048_LBSPPB2048_LPA0_LPB0_MIWT8_8_PLR1_SU0_SUM0_SUS128_VWA8_VWB8_WGM6_WGMXCC1_WGMXCCGn1
    SolutionIndex: 68
    SolutionNameMin: Cijk_Ailk_Bjlk_F8B8NF8NS_BH_Bias_HAS_SAV_UserArgs_MT256x256x128_MI16x16x1_SN_LDSB1_CLR1_GRVWA16_GRVWB16_GSU0_GSUC0_GSUWGMRR0_K1_LBSPPA2048_LBSPPB2048_LPA0_LPB0_MIWT8_8_PLR1_SU0_SUM0_SUS128_VWA8_VWB8_WGM6_WGMXCC1_WGMXCCGn1
    SolutionIndex: 69
    SolutionNameMin: Cijk_Ailk_Bjlk_F8B8NF8NS_BH_Bias_HAS_SAV_UserArgs_MT256x256x128_MI16x16x1_SN_LDSB1_CLR1_GRVWA8_GRVWB16_GSU0_GSUC0_GSUWGMRR0_K1_LBSPPA2048_LBSPPB2048_LPA0_LPB0_MIWT8_8_PLR1_SU0_SUM0_SUS128_VWA8_VWB8_WGM8_WGMXCC1_WGMXCCGn1
    SolutionIndex: 70
    SolutionNameMin: Cijk_Ailk_Bjlk_F8B8NF8NS_BH_Bias_HAS_SAV_UserArgs_MT256x256x128_MI16x16x1_SN_LDSB1_CLR1_GRVWA16_GRVWB16_GSU0_GSUC0_GSUWGMRR0_K1_LBSPPA2048_LBSPPB2048_LPA0_LPB0_MIWT8_8_PLR1_SU0_SUM0_SUS128_VWA8_VWB8_WGM8_WGMXCC1_WGMXCCGn1
    SolutionIndex: 71
    SolutionNameMin: Cijk_Ailk_Bjlk_F8B8NF8NS_BH_Bias_HAS_SAV_UserArgs_MT128x256x128_MI16x16x1_SN_LDSB1_CLR1_GRVWA4_GRVWB16_GSU0_GSUC0_GSUWGMRR0_K1_LBSPPA1024_LBSPPB2048_LPA64_LPB0_MIWT4_8_PLR1_SU0_SUM0_SUS128_VWA4_VWB8_WGM4_WGMXCC1_WGMXCCGn1
    SolutionIndex: 72
    SolutionNameMin: Cijk_Ailk_Bjlk_F8B8NF8NS_BH_Bias_HAS_SAV_UserArgs_MT128x256x128_MI16x16x1_SN_LDSB1_CLR1_GRVWA4_GRVWB16_GSU0_GSUC0_GSUWGMRR0_K1_LBSPPA1024_LBSPPB2048_LPA64_LPB0_MIWT4_8_PLR1_SU0_SUM0_SUS128_VWA4_VWB8_WGM6_WGMXCC1_WGMXCCGn1
    SolutionIndex: 73
    SolutionNameMin: Cijk_Ailk_Bjlk_F8B8NF8NS_BH_Bias_HAS_SAV_UserArgs_MT128x256x128_MI16x16x1_SN_LDSB1_CLR1_GRVWA16_GRVWB16_GSU0_GSUC0_GSUWGMRR0_K1_LBSPPA1024_LBSPPB2048_LPA64_LPB0_MIWT4_8_PLR1_SU0_SUM0_SUS128_VWA4_VWB8_WGM6_WGMXCC1_WGMXCCGn1
    SolutionIndex: 74
    SolutionNameMin: Cijk_Ailk_Bjlk_F8B8NF8NS_BH_Bias_HAS_SAV_UserArgs_MT256x128x128_MI16x16x1_SN_LDSB1_CLR1_GRVWA16_GRVWB8_GSU0_GSUC0_GSUWGMRR0_K1_LBSPPA2048_LBSPPB1024_LPA0_LPB64_MIWT8_4_PLR1_SU0_SUM0_SUS128_VWA8_VWB4_WGM1_WGMXCC1_WGMXCCGn1
    SolutionIndex: 75
    SolutionNameMin: Cijk_Ailk_Bjlk_F8B8NF8NS_BH_Bias_HAS_SAV_UserArgs_MT256x128x128_MI16x16x1_SN_LDSB1_CLR1_GRVWA8_GRVWB16_GSU0_GSUC0_GSUWGMRR0_K1_LBSPPA2048_LBSPPB1024_LPA0_LPB64_MIWT8_4_PLR1_SU0_SUM0_SUS128_VWA8_VWB4_WGM1_WGMXCC1_WGMXCCGn1
    SolutionIndex: 76
    SolutionNameMin: Cijk_Ailk_Bjlk_F8B8NF8NS_BH_Bias_HAS_SAV_UserArgs_MT128x128x128_MI16x16x1_SN_LDSB1_CLR1_GRVWA16_GRVWB16_GSU0_GSUC0_GSUWGMRR0_K1_LBSPPA1024_LBSPPB1024_LPA64_LPB64_MIWT4_4_PLR1_SU0_SUM0_SUS128_VWA4_VWB4_WGM1_WGMXCC1_WGMXCCGn1
    SolutionIndex: 77
    SolutionNameMin: Cijk_Ailk_Bjlk_F8B8NF8NS_BH_Bias_HAS_SAV_UserArgs_MT128x128x128_MI16x16x1_SN_LDSB1_CLR1_GRVWA16_GRVWB16_GSU0_GSUC0_GSUWGMRR0_K1_LBSPPA1024_LBSPPB1024_LPA64_LPB64_MIWT4_4_PLR1_SU0_SUM0_SUS128_VWA4_VWB4_WGM4_WGMXCC1_WGMXCCGn1
    SolutionIndex: 78
    SolutionNameMin: Cijk_Ailk_Bjlk_F8B8NF8NS_BH_Bias_HAS_SAV_UserArgs_MT128x128x128_MI16x16x1_SN_LDSB1_CLR1_GRVWA16_GRVWB16_GSU0_GSUC0_GSUWGMRR0_K1_LBSPPA1024_LBSPPB1024_LPA64_LPB64_MIWT4_4_PLR1_SU0_SUM0_SUS128_VWA4_VWB4_WGM8_WGMXCC1_WGMXCCGn1
    SolutionIndex: 79
    SolutionNameMin: Cijk_Ailk_Bjlk_F8B8NF8NS_BH_Bias_HAS_SAV_UserArgs_MT128x64x128_MI16x16x1_SN_LDSB1_CLR1_GRVWA4_GRVWB8_GSU0_GSUC0_GSUWGMRR0_K1_LBSPPA1024_LBSPPB512_LPA64_LPB32_MIWT4_2_PLR1_SU0_SUM0_SUS128_VWA4_VWB2_WGM1_WGMXCC1_WGMXCCGn1
    SolutionIndex: 80
    SolutionNameMin: Cijk_Ailk_Bjlk_F8B8NF8NS_BH_Bias_HAS_SAV_UserArgs_MT128x64x128_MI16x16x1_SN_LDSB1_CLR1_GRVWA16_GRVWB16_GSU0_GSUC0_GSUWGMRR0_K1_LBSPPA1024_LBSPPB512_LPA64_LPB32_MIWT4_2_PLR1_SU0_SUM0_SUS128_VWA4_VWB2_WGM1_WGMXCC1_WGMXCCGn1
    SolutionIndex: 81
    SolutionNameMin: Cijk_Ailk_Bjlk_F8B8NF8NS_BH_Bias_HAS_SAV_UserArgs_MT128x64x128_MI16x16x1_SN_LDSB1_CLR1_GRVWA16_GRVWB16_GSU0_GSUC0_GSUWGMRR0_K1_LBSPPA1024_LBSPPB512_LPA64_LPB32_MIWT4_2_PLR1_SU0_SUM0_SUS128_VWA4_VWB2_WGM4_WGMXCC1_WGMXCCGn1
    SolutionIndex: 82
    SolutionNameMin: Cijk_Ailk_Bjlk_F8B8NF8NS_BH_Bias_HAS_SAV_UserArgs_MT128x64x128_MI16x16x1_SN_LDSB1_CLR1_GRVWA16_GRVWB16_GSU0_GSUC0_GSUWGMRR0_K1_LBSPPA1024_LBSPPB512_LPA64_LPB32_MIWT4_2_PLR1_SU0_SUM0_SUS128_VWA4_VWB2_WGM6_WGMXCC1_WGMXCCGn1
    SolutionIndex: 83
    SolutionNameMin: Cijk_Ailk_Bjlk_F8B8NF8NS_BH_Bias_HAS_SAV_UserArgs_MT128x64x128_MI16x16x1_SN_LDSB1_CLR1_GRVWA16_GRVWB16_GSU0_GSUC0_GSUWGMRR0_K1_LBSPPA1024_LBSPPB512_LPA64_LPB32_MIWT4_2_PLR1_SU0_SUM0_SUS128_VWA4_VWB2_WGM8_WGMXCC1_WGMXCCGn1
    SolutionIndex: 84
    SolutionNameMin: Cijk_Ailk_Bjlk_F8B8NF8NS_BH_Bias_HAS_SAV_UserArgs_MT128x32x128_MI16x16x1_SN_LDSB1_CLR1_GRVWA4_GRVWB8_GSU0_GSUC0_GSUWGMRR0_K1_LBSPPA1024_LBSPPB256_LPA64_LPB16_MIWT4_1_PLR1_SU0_SUM0_SUS128_VWA4_VWB1_WGM1_WGMXCC1_WGMXCCGn1
    SolutionIndex: 85
    SolutionNameMin: Cijk_Ailk_Bjlk_F8B8NF8NS_BH_Bias_HAS_SAV_UserArgs_MT64x64x128_MI16x16x1_SN_LDSB1_CLR1_GRVWA4_GRVWB8_GSU0_GSUC0_GSUWGMRR0_K1_LBSPPA512_LBSPPB512_LPA32_LPB32_MIWT2_2_PLR1_SU0_SUM0_SUS128_VWA2_VWB2_WGM1_WGMXCC1_WGMXCCGn1
    SolutionIndex: 86
    SolutionNameMin: Cijk_Ailk_Bjlk_F8B8NF8NS_BH_Bias_HAS_SAV_UserArgs_MT64x64x128_MI16x16x1_SN_LDSB1_CLR1_GRVWA4_GRVWB16_GSU0_GSUC0_GSUWGMRR0_K1_LBSPPA512_LBSPPB512_LPA32_LPB32_MIWT2_2_PLR1_SU0_SUM0_SUS128_VWA2_VWB2_WGM1_WGMXCC1_WGMXCCGn1
    SolutionIndex: 87
    SolutionNameMin: Cijk_Ailk_Bjlk_F8B8NF8NS_BH_Bias_HAS_SAV_UserArgs_MT64x64x128_MI16x16x1_SN_LDSB1_CLR1_GRVWA8_GRVWB16_GSU0_GSUC0_GSUWGMRR0_K1_LBSPPA512_LBSPPB512_LPA32_LPB32_MIWT2_2_PLR1_SU0_SUM0_SUS128_VWA2_VWB2_WGM1_WGMXCC1_WGMXCCGn1
    SolutionIndex: 88
    SolutionNameMin: Cijk_Ailk_Bjlk_F8B8NF8NS_BH_Bias_HAS_SAV_UserArgs_MT64x64x128_MI16x16x1_SN_LDSB1_CLR1_GRVWA16_GRVWB16_GSU0_GSUC0_GSUWGMRR0_K1_LBSPPA512_LBSPPB512_LPA32_LPB32_MIWT2_2_PLR1_SU0_SUM0_SUS128_VWA2_VWB2_WGM1_WGMXCC1_WGMXCCGn1
    SolutionIndex: 89
    SolutionNameMin: Cijk_Ailk_Bjlk_F8B8NF8NS_BH_Bias_HAS_SAV_UserArgs_MT64x64x128_MI16x16x1_SN_LDSB1_CLR1_GRVWA4_GRVWB16_GSU0_GSUC0_GSUWGMRR0_K1_LBSPPA512_LBSPPB512_LPA32_LPB32_MIWT2_2_PLR1_SU0_SUM0_SUS128_VWA2_VWB2_WGM4_WGMXCC1_WGMXCCGn1
    SolutionIndex: 90
    SolutionNameMin: Cijk_Ailk_Bjlk_F8B8NF8NS_BH_Bias_HAS_SAV_UserArgs_MT64x64x128_MI16x16x1_SN_LDSB1_CLR1_GRVWA16_GRVWB16_GSU0_GSUC0_GSUWGMRR0_K1_LBSPPA512_LBSPPB512_LPA32_LPB32_MIWT2_2_PLR1_SU0_SUM0_SUS128_VWA2_VWB2_WGM4_WGMXCC1_WGMXCCGn1
    SolutionIndex: 91
    SolutionNameMin: Cijk_Ailk_Bjlk_F8B8NF8NS_BH_Bias_HAS_SAV_UserArgs_MT64x64x128_MI16x16x1_SN_LDSB1_CLR1_GRVWA16_GRVWB16_GSU0_GSUC0_GSUWGMRR0_K1_LBSPPA512_LBSPPB512_LPA32_LPB32_MIWT2_2_PLR1_SU0_SUM0_SUS128_VWA2_VWB2_WGM6_WGMXCC1_WGMXCCGn1
    SolutionIndex: 92
    SolutionNameMin: Cijk_Ailk_Bjlk_F8B8NF8NS_BH_Bias_HAS_SAV_UserArgs_MT64x64x128_MI16x16x1_SN_LDSB1_CLR1_GRVWA4_GRVWB16_GSU0_GSUC0_GSUWGMRR0_K1_LBSPPA512_LBSPPB512_LPA32_LPB32_MIWT2_2_PLR1_SU0_SUM0_SUS128_VWA2_VWB2_WGM8_WGMXCC1_WGMXCCGn1
    SolutionIndex: 93
    SolutionNameMin: Cijk_Ailk_Bjlk_F8B8NF8NS_BH_Bias_HAS_SAV_UserArgs_MT64x64x128_MI16x16x1_SN_LDSB1_CLR1_GRVWA8_GRVWB16_GSU0_GSUC0_GSUWGMRR0_K1_LBSPPA512_LBSPPB512_LPA32_LPB32_MIWT2_2_PLR1_SU0_SUM0_SUS128_VWA2_VWB2_WGM8_WGMXCC1_WGMXCCGn1
    SolutionIndex: 94
    SolutionNameMin: Cijk_Ailk_Bjlk_F8B8NF8NS_BH_Bias_HAS_SAV_UserArgs_MT32x64x128_MI16x16x1_SN_LDSB0_CLR1_GRVWA16_GRVWB16_GSU0_GSUC0_GSUWGMRR0_K1_LBSPPA256_LBSPPB512_LPA16_LPB32_MIWT1_2_PLR1_SU0_SUM0_SUS128_VWA1_VWB2_WGM6_WGMXCC1_WGMXCCGn1
    SolutionIndex: 95
    SolutionNameMin: Cijk_Ailk_Bjlk_F8B8NF8NS_BH_Bias_HAS_SAV_UserArgs_MT32x64x128_MI16x16x1_SN_LDSB0_CLR1_GRVWA16_GRVWB16_GSU0_GSUC0_GSUWGMRR0_K1_LBSPPA256_LBSPPB512_LPA16_LPB32_MIWT1_2_PLR1_SU0_SUM0_SUS128_VWA1_VWB2_WGM8_WGMXCC1_WGMXCCGn1
    SolutionIndex: 96
    SolutionNameMin: Cijk_Ailk_Bjlk_F8B8NF8NS_BH_Bias_HAS_SAV_UserArgs_MT64x32x128_MI16x16x1_SN_LDSB0_CLR1_GRVWA4_GRVWB4_GSU0_GSUC0_GSUWGMRR0_K1_LBSPPA512_LBSPPB256_LPA32_LPB16_MIWT2_1_PLR1_SU0_SUM0_SUS128_VWA2_VWB1_WGM1_WGMXCC1_WGMXCCGn1
    SolutionIndex: 97
    SolutionNameMin: Cijk_Ailk_Bjlk_F8B8NF8NS_BH_Bias_HAS_SAV_UserArgs_MT64x32x128_MI16x16x1_SN_LDSB0_CLR1_GRVWA4_GRVWB8_GSU0_GSUC0_GSUWGMRR0_K1_LBSPPA512_LBSPPB256_LPA32_LPB16_MIWT2_1_PLR1_SU0_SUM0_SUS128_VWA2_VWB1_WGM1_WGMXCC1_WGMXCCGn1
    SolutionIndex: 98
    SolutionNameMin: Cijk_Ailk_Bjlk_F8B8NF8NS_BH_Bias_HAS_SAV_UserArgs_MT64x32x128_MI16x16x1_SN_LDSB0_CLR1_GRVWA8_GRVWB8_GSU0_GSUC0_GSUWGMRR0_K1_LBSPPA512_LBSPPB256_LPA32_LPB16_MIWT2_1_PLR1_SU0_SUM0_SUS128_VWA2_VWB1_WGM1_WGMXCC1_WGMXCCGn1
    SolutionIndex: 99
    SolutionNameMin: Cijk_Ailk_Bjlk_F8B8NF8NS_BH_Bias_HAS_SAV_UserArgs_MT64x32x128_MI16x16x1_SN_LDSB0_CLR1_GRVWA8_GRVWB16_GSU0_GSUC0_GSUWGMRR0_K1_LBSPPA512_LBSPPB256_LPA32_LPB16_MIWT2_1_PLR1_SU0_SUM0_SUS128_VWA2_VWB1_WGM1_WGMXCC1_WGMXCCGn1
    SolutionIndex: 100
    SolutionNameMin: Cijk_Ailk_Bjlk_F8B8NF8NS_BH_Bias_HAS_SAV_UserArgs_MT64x32x128_MI16x16x1_SN_LDSB0_CLR1_GRVWA16_GRVWB16_GSU0_GSUC0_GSUWGMRR0_K1_LBSPPA512_LBSPPB256_LPA32_LPB16_MIWT2_1_PLR1_SU0_SUM0_SUS128_VWA2_VWB1_WGM1_WGMXCC1_WGMXCCGn1
    SolutionIndex: 101
    SolutionNameMin: Cijk_Ailk_Bjlk_F8B8NF8NS_BH_Bias_HAS_SAV_UserArgs_MT32x32x128_MI16x16x1_SN_LDSB0_CLR1_GRVWA4_GRVWB4_GSU0_GSUC0_GSUWGMRR0_K1_LBSPPA256_LBSPPB256_LPA16_LPB16_MIWT1_1_PLR1_SU0_SUM0_SUS128_VWA1_VWB1_WGM1_WGMXCC1_WGMXCCGn1
    SolutionIndex: 102
    SolutionNameMin: Cijk_Ailk_Bjlk_F8B8NF8NS_BH_Bias_HAS_SAV_UserArgs_MT32x32x128_MI16x16x1_SN_LDSB0_CLR1_GRVWA4_GRVWB8_GSU0_GSUC0_GSUWGMRR0_K1_LBSPPA256_LBSPPB256_LPA16_LPB16_MIWT1_1_PLR1_SU0_SUM0_SUS128_VWA1_VWB1_WGM1_WGMXCC1_WGMXCCGn1
    SolutionIndex: 103
    SolutionNameMin: Cijk_Ailk_Bjlk_F8B8NF8NS_BH_Bias_HAS_SAV_UserArgs_MT32x32x128_MI16x16x1_SN_LDSB0_CLR1_GRVWA8_GRVWB8_GSU0_GSUC0_GSUWGMRR0_K1_LBSPPA256_LBSPPB256_LPA16_LPB16_MIWT1_1_PLR1_SU0_SUM0_SUS128_VWA1_VWB1_WGM1_WGMXCC1_WGMXCCGn1
    SolutionIndex: 104
    SolutionNameMin: Cijk_Ailk_Bjlk_F8B8NF8NS_BH_Bias_HAS_SAV_UserArgs_MT32x32x128_MI16x16x1_SN_LDSB0_CLR1_GRVWA4_GRVWB16_GSU0_GSUC0_GSUWGMRR0_K1_LBSPPA256_LBSPPB256_LPA16_LPB16_MIWT1_1_PLR1_SU0_SUM0_SUS128_VWA1_VWB1_WGM1_WGMXCC1_WGMXCCGn1
    SolutionIndex: 105
    SolutionNameMin: Cijk_Ailk_Bjlk_F8B8NF8NS_BH_Bias_HAS_SAV_UserArgs_MT32x32x128_MI16x16x1_SN_LDSB0_CLR1_GRVWA8_GRVWB16_GSU0_GSUC0_GSUWGMRR0_K1_LBSPPA256_LBSPPB256_LPA16_LPB16_MIWT1_1_PLR1_SU0_SUM0_SUS128_VWA1_VWB1_WGM1_WGMXCC1_WGMXCCGn1
    SolutionIndex: 106
    SolutionNameMin: Cijk_Ailk_Bjlk_F8B8NF8NS_BH_Bias_HAS_SAV_UserArgs_MT32x32x128_MI16x16x1_SN_LDSB0_CLR1_GRVWA4_GRVWB16_GSU0_GSUC0_GSUWGMRR0_K1_LBSPPA256_LBSPPB256_LPA16_LPB16_MIWT1_1_PLR1_SU0_SUM0_SUS128_VWA1_VWB1_WGM6_WGMXCC1_WGMXCCGn1
    SolutionIndex: 107
    SolutionNameMin: Cijk_Ailk_Bjlk_F8B8NF8NS_BH_Bias_HAS_SAV_UserArgs_MT128x64x256_MI16x16x1_SN_LDSB1_CLR1_GRVWA16_GRVWB16_GSU0_GSUC0_GSUWGMRR0_K1_LBSPPA1024_LBSPPB512_LPA64_LPB32_MIWT4_2_PLR1_SU0_SUM0_SUS256_VWA4_VWB2_WGM6_WGMXCC1_WGMXCCGn1
    SolutionIndex: 108
    SolutionNameMin: Cijk_Ailk_Bjlk_F8B8NF8NS_BH_Bias_HAS_SAV_UserArgs_MT64x64x256_MI16x16x1_SN_LDSB1_CLR1_GRVWA4_GRVWB16_GSU0_GSUC0_GSUWGMRR0_K1_LBSPPA512_LBSPPB512_LPA32_LPB32_MIWT2_2_PLR1_SU0_SUM0_SUS256_VWA2_VWB2_WGM1_WGMXCC1_WGMXCCGn1
    SolutionIndex: 109
    SolutionNameMin: Cijk_Ailk_Bjlk_F8B8NF8NS_BH_Bias_HAS_SAV_UserArgs_MT64x64x256_MI16x16x1_SN_LDSB1_CLR1_GRVWA16_GRVWB16_GSU0_GSUC0_GSUWGMRR0_K1_LBSPPA512_LBSPPB512_LPA32_LPB32_MIWT2_2_PLR1_SU0_SUM0_SUS256_VWA2_VWB2_WGM1_WGMXCC1_WGMXCCGn1
    SolutionIndex: 110
    SolutionNameMin: Cijk_Ailk_Bjlk_F8B8NF8NS_BH_Bias_HAS_SAV_UserArgs_MT64x64x256_MI16x16x1_SN_LDSB1_CLR1_GRVWA16_GRVWB16_GSU0_GSUC0_GSUWGMRR0_K1_LBSPPA512_LBSPPB512_LPA32_LPB32_MIWT2_2_PLR1_SU0_SUM0_SUS256_VWA2_VWB2_WGM8_WGMXCC1_WGMXCCGn1
    SolutionIndex: 111
    SolutionNameMin: Cijk_Ailk_Bjlk_F8B8NF8NS_BH_Bias_HAS_SAV_UserArgs_MT64x32x256_MI16x16x1_SN_LDSB1_CLR1_GRVWA16_GRVWB16_GSU0_GSUC0_GSUWGMRR0_K1_LBSPPA512_LBSPPB256_LPA32_LPB16_MIWT2_1_PLR1_SU0_SUM0_SUS256_VWA2_VWB1_WGM1_WGMXCC1_WGMXCCGn1
    SolutionIndex: 112
    SolutionNameMin: Cijk_Ailk_Bjlk_F8B8NF8NS_BH_Bias_HAS_SAV_UserArgs_MT64x32x256_MI16x16x1_SN_LDSB1_CLR1_GRVWA16_GRVWB16_GSU0_GSUC0_GSUWGMRR0_K1_LBSPPA512_LBSPPB256_LPA32_LPB16_MIWT2_1_PLR1_SU0_SUM0_SUS256_VWA2_VWB1_WGM4_WGMXCC1_WGMXCCGn1
    SolutionIndex: 113
    SolutionNameMin: Cijk_Ailk_Bjlk_F8B8NF8NS_BH_Bias_HAS_SAV_UserArgs_MT64x32x256_MI16x16x1_SN_LDSB1_CLR1_GRVWA16_GRVWB16_GSU0_GSUC0_GSUWGMRR0_K1_LBSPPA512_LBSPPB256_LPA32_LPB16_MIWT2_1_PLR1_SU0_SUM0_SUS256_VWA2_VWB1_WGM6_WGMXCC1_WGMXCCGn1
    SolutionIndex: 114
    SolutionNameMin: Cijk_Ailk_Bjlk_F8B8NF8NS_BH_Bias_HAS_SAV_UserArgs_MT32x32x256_MI16x16x1_SN_LDSB1_CLR1_GRVWA8_GRVWB16_GSU0_GSUC0_GSUWGMRR0_K1_LBSPPA256_LBSPPB256_LPA16_LPB16_MIWT1_1_PLR1_SU0_SUM0_SUS256_VWA1_VWB1_WGM1_WGMXCC1_WGMXCCGn1
    SolutionIndex: 115
    SolutionNameMin: Cijk_Ailk_Bjlk_F8B8NF8NS_BH_Bias_HAS_SAV_UserArgs_MT32x32x256_MI16x16x1_SN_LDSB1_CLR1_GRVWA16_GRVWB16_GSU0_GSUC0_GSUWGMRR0_K1_LBSPPA256_LBSPPB256_LPA16_LPB16_MIWT1_1_PLR1_SU0_SUM0_SUS256_VWA1_VWB1_WGM1_WGMXCC1_WGMXCCGn1
    SolutionIndex: 116
    SolutionNameMin: Cijk_Ailk_Bjlk_F8B8NF8NS_BH_Bias_HAS_SAV_UserArgs_MT32x32x256_MI16x16x1_SN_LDSB1_CLR1_GRVWA16_GRVWB16_GSU0_GSUC0_GSUWGMRR0_K1_LBSPPA256_LBSPPB256_LPA16_LPB16_MIWT1_1_PLR1_SU0_SUM0_SUS256_VWA1_VWB1_WGM4_WGMXCC1_WGMXCCGn1
    SolutionIndex: 117
    SolutionNameMin: Cijk_Ailk_Bjlk_F8B8NF8NS_BH_Bias_HAS_SAV_UserArgs_MT32x32x256_MI16x16x1_SN_LDSB1_CLR1_GRVWA16_GRVWB16_GSU0_GSUC0_GSUWGMRR0_K1_LBSPPA256_LBSPPB256_LPA16_LPB16_MIWT1_1_PLR1_SU0_SUM0_SUS256_VWA1_VWB1_WGM6_WGMXCC1_WGMXCCGn1
    SolutionIndex: 118
    SolutionNameMin: Cijk_Ailk_Bjlk_F8B8NF8NS_BH_Bias_HAS_SAV_UserArgs_MT32x32x256_MI16x16x1_SN_LDSB1_CLR1_GRVWA16_GRVWB16_GSU0_GSUC0_GSUWGMRR0_K1_LBSPPA256_LBSPPB256_LPA16_LPB16_MIWT1_1_PLR1_SU0_SUM0_SUS256_VWA1_VWB1_WGM8_WGMXCC1_WGMXCCGn1
- - - [128, 128, 1, 128, 128, 128, 128, 128]
    - [63, 0.53]
  - - [128, 128, 1, 256, 128, 128, 128, 128]
    - [61, 0.93]
  - - [128, 128, 1, 512, 128, 128, 128, 128]
    - [101, 1.51]
  - - [128, 128, 1, 1024, 128, 128, 128, 128]
    - [105, 2.24]
  - - [128, 128, 1, 2048, 128, 128, 128, 128]
    - [105, 2.96]
  - - [128, 128, 1, 4096, 128, 128, 128, 128]
    - [105, 3.55]
  - - [128, 128, 1, 8192, 128, 128, 128, 128]
    - [115, 3.95]
  - - [128, 256, 1, 128, 128, 128, 128, 256]
    - [63, 1.02]
  - - [128, 256, 1, 256, 128, 128, 128, 256]
    - [101, 1.86]
  - - [128, 256, 1, 512, 128, 128, 128, 256]
    - [101, 3.05]
  - - [128, 256, 1, 1024, 128, 128, 128, 256]
    - [103, 4.5]
  - - [128, 256, 1, 2048, 128, 128, 128, 256]
    - [105, 5.93]
  - - [128, 256, 1, 4096, 128, 128, 128, 256]
    - [105, 7.08]
  - - [128, 256, 1, 8192, 128, 128, 128, 256]
    - [115, 7.9]
  - - [128, 512, 1, 128, 128, 128, 128, 512]
    - [62, 2.07]
  - - [128, 512, 1, 256, 128, 128, 128, 512]
    - [61, 3.62]
  - - [128, 512, 1, 512, 128, 128, 128, 512]
    - [101, 5.9]
  - - [128, 512, 1, 1024, 128, 128, 128, 512]
    - [105, 8.65]
  - - [128, 512, 1, 2048, 128, 128, 128, 512]
    - [115, 11.54]
  - - [128, 512, 1, 4096, 128, 128, 128, 512]
    - [105, 14.06]
  - - [128, 512, 1, 8192, 128, 128, 128, 512]
    - [114, 14.99]
  - - [128, 1024, 1, 128, 128, 128, 128, 1024]
    - [62, 4.14]
  - - [128, 1024, 1, 256, 128, 128, 128, 1024]
    - [61, 7.24]
  - - [128, 1024, 1, 512, 128, 128, 128, 1024]
    - [103, 11.68]
  - - [128, 1024, 1, 1024, 128, 128, 128, 1024]
    - [103, 17.29]
  - - [128, 1024, 1, 2048, 128, 128, 128, 1024]
    - [105, 22.95]
  - - [128, 1024, 1, 4096, 128, 128, 128, 1024]
    - [114, 26.11]
  - - [128, 1024, 1, 8192, 128, 128, 128, 1024]
    - [106, 27.95]
  - - [128, 2048, 1, 128, 128, 128, 128, 2048]
    - [57, 7.7]
  - - [128, 2048, 1, 256, 128, 128, 128, 2048]
    - [57, 13.35]
  - - [128, 2048, 1, 512, 128, 128, 128, 2048]
    - [97, 21.35]
  - - [128, 2048, 1, 1024, 128, 128, 128, 2048]
    - [97, 31.11]
  - - [128, 2048, 1, 2048, 128, 128, 128, 2048]
    - [111, 39.19]
  - - [128, 2048, 1, 4096, 128, 128, 128, 2048]
    - [111, 47.49]
  - - [128, 2048, 1, 8192, 128, 128, 128, 2048]
    - [113, 53.54]
  - - [128, 4096, 1, 128, 128, 128, 128, 4096]
    - [50, 14.41]
  - - [128, 4096, 1, 256, 128, 128, 128, 4096]
    - [50, 24.48]
  - - [128, 4096, 1, 512, 128, 128, 128, 4096]
    - [85, 38.11]
  - - [128, 4096, 1, 1024, 128, 128, 128, 4096]
    - [87, 54.7]
  - - [128, 4096, 1, 2048, 128, 128, 128, 4096]
    - [109, 67.94]
  - - [128, 4096, 1, 4096, 128, 128, 128, 4096]
    - [109, 82.62]
  - - [128, 4096, 1, 8192, 128, 128, 128, 4096]
    - [110, 91.88]
  - - [128, 8192, 1, 128, 128, 128, 128, 8192]
    - [43, 24.76]
  - - [128, 8192, 1, 256, 128, 128, 128, 8192]
    - [43, 42.54]
  - - [128, 8192, 1, 512, 128, 128, 128, 8192]
    - [45, 64.61]
  - - [128, 8192, 1, 1024, 128, 128, 128, 8192]
    - [80, 89.38]
  - - [128, 8192, 1, 2048, 128, 128, 128, 8192]
    - [80, 108.83]
  - - [128, 8192, 1, 4096, 128, 128, 128, 8192]
    - [80, 125.82]
  - - [128, 8192, 1, 8192, 128, 128, 128, 8192]
    - [80, 130.58]
  - - [256, 128, 1, 128, 256, 256, 256, 128]
    - [64, 1.03]
  - - [256, 128, 1, 256, 256, 256, 256, 128]
    - [62, 1.83]
  - - [256, 128, 1, 512, 256, 256, 256, 128]
    - [103, 3.0]
  - - [256, 128, 1, 1024, 256, 256, 256, 128]
    - [105, 4.48]
  - - [256, 128, 1, 2048, 256, 256, 256, 128]
    - [105, 5.84]
  - - [256, 128, 1, 4096, 256, 256, 256, 128]
    - [105, 7.01]
  - - [256, 128, 1, 8192, 256, 256, 256, 128]
    - [105, 7.83]
  - - [256, 256, 1, 128, 256, 256, 256, 256]
    - [96, 2.02]
  - - [256, 256, 1, 256, 256, 256, 256, 256]
    - [61, 3.51]
  - - [256, 256, 1, 512, 256, 256, 256, 256]
    - [105, 5.75]
  - - [256, 256, 1, 1024, 256, 256, 256, 256]
    - [105, 8.72]
  - - [256, 256, 1, 2048, 256, 256, 256, 256]
    - [103, 11.57]
  - - [256, 256, 1, 4096, 256, 256, 256, 256]
    - [105, 13.96]
  - - [256, 256, 1, 8192, 256, 256, 256, 256]
    - [105, 15.53]
  - - [256, 512, 1, 128, 256, 256, 256, 512]
    - [47, 2.76]
  - - [256, 512, 1, 256, 256, 256, 256, 512]
    - [60, 5.72]
  - - [256, 512, 1, 512, 256, 256, 256, 512]
    - [64, 9.83]
  - - [256, 512, 1, 1024, 256, 256, 256, 512]
    - [103, 16.5]
  - - [256, 512, 1, 2048, 256, 256, 256, 512]
    - [103, 22.3]
  - - [256, 512, 1, 4096, 256, 256, 256, 512]
    - [105, 27.52]
  - - [256, 512, 1, 8192, 256, 256, 256, 512]
    - [115, 30.43]
  - - [256, 1024, 1, 128, 256, 256, 256, 1024]
    - [49, 6.58]
  - - [256, 1024, 1, 256, 256, 256, 256, 1024]
    - [56, 12.11]
  - - [256, 1024, 1, 512, 256, 256, 256, 1024]
    - [59, 20.22]
  - - [256, 1024, 1, 1024, 256, 256, 256, 1024]
    - [98, 30.51]
  - - [256, 1024, 1, 2048, 256, 256, 256, 1024]
    - [111, 40.63]
  - - [256, 1024, 1, 4096, 256, 256, 256, 1024]
    - [111, 48.66]
  - - [256, 1024, 1, 8192, 256, 256, 256, 1024]
    - [113, 53.9]
  - - [256, 2048, 1, 128, 256, 256, 256, 2048]
    - [51, 11.54]
  - - [256, 2048, 1, 256, 256, 256, 256, 2048]
    - [54, 22.51]
  - - [256, 2048, 1, 512, 256, 256, 256, 2048]
    - [52, 36.55]
  - - [256, 2048, 1, 1024, 256, 256, 256, 2048]
    - [88, 54.0]
  - - [256, 2048, 1, 2048, 256, 256, 256, 2048]
    - [88, 68.15]
  - - [256, 2048, 1, 4096, 256, 256, 256, 2048]
    - [87, 79.4]
  - - [256, 2048, 1, 8192, 256, 256, 256, 2048]
    - [108, 87.23]
  - - [256, 4096, 1, 128, 256, 256, 256, 4096]
    - [42, 22.9]
  - - [256, 4096, 1, 256, 256, 256, 256, 4096]
    - [44, 40.55]
  - - [256, 4096, 1, 512, 256, 256, 256, 4096]
    - [43, 62.85]
  - - [256, 4096, 1, 1024, 256, 256, 256, 4096]
    - [79, 87.36]
  - - [256, 4096, 1, 2048, 256, 256, 256, 4096]
    - [80, 107.82]
  - - [256, 4096, 1, 4096, 256, 256, 256, 4096]
    - [82, 125.13]
  - - [256, 4096, 1, 8192, 256, 256, 256, 4096]
    - [107, 130.44]
  - - [256, 8192, 1, 128, 256, 256, 256, 8192]
    - [30, 39.37]
  - - [256, 8192, 1, 256, 256, 256, 256, 8192]
    - [31, 65.55]
  - - [256, 8192, 1, 512, 256, 256, 256, 8192]
    - [32, 99.75]
  - - [256, 8192, 1, 1024, 256, 256, 256, 8192]
    - [76, 134.84]
  - - [256, 8192, 1, 2048, 256, 256, 256, 8192]
    - [32, 161.49]
  - - [256, 8192, 1, 4096, 256, 256, 256, 8192]
    - [78, 177.2]
  - - [256, 8192, 1, 8192, 256, 256, 256, 8192]
    - [78, 165.01]
  - - [512, 128, 1, 128, 512, 512, 512, 128]
    - [57, 1.91]
  - - [512, 128, 1, 256, 512, 512, 512, 128]
    - [101, 3.64]
  - - [512, 128, 1, 512, 512, 512, 512, 128]
    - [104, 5.96]
  - - [512, 128, 1, 1024, 512, 512, 512, 128]
    - [105, 8.86]
  - - [512, 128, 1, 2048, 512, 512, 512, 128]
    - [105, 11.82]
  - - [512, 128, 1, 4096, 512, 512, 512, 128]
    - [105, 14.1]
  - - [512, 128, 1, 8192, 512, 512, 512, 128]
    - [117, 14.69]
  - - [512, 256, 1, 128, 512, 512, 512, 256]
    - [61, 4.11]
  - - [512, 256, 1, 256, 512, 512, 512, 256]
    - [61, 7.18]
  - - [512, 256, 1, 512, 512, 512, 512, 256]
    - [103, 11.59]
  - - [512, 256, 1, 1024, 512, 512, 512, 256]
    - [103, 17.4]
  - - [512, 256, 1, 2048, 512, 512, 512, 256]
    - [105, 23.13]
  - - [512, 256, 1, 4096, 512, 512, 512, 256]
    - [105, 27.76]
  - - [512, 256, 1, 8192, 512, 512, 512, 256]
    - [118, 28.74]
  - - [512, 512, 1, 128, 512, 512, 512, 512]
    - [57, 7.87]
  - - [512, 512, 1, 256, 512, 512, 512, 512]
    - [58, 13.28]
  - - [512, 512, 1, 512, 512, 512, 512, 512]
    - [98, 21.51]
  - - [512, 512, 1, 1024, 512, 512, 512, 512]
    - [99, 31.19]
  - - [512, 512, 1, 2048, 512, 512, 512, 512]
    - [111, 41.16]
  - - [512, 512, 1, 4096, 512, 512, 512, 512]
    - [111, 47.51]
  - - [512, 512, 1, 8192, 512, 512, 512, 512]
    - [100, 50.48]
  - - [512, 1024, 1, 128, 512, 512, 512, 1024]
    - [50, 13.64]
  - - [512, 1024, 1, 256, 512, 512, 512, 1024]
    - [85, 23.61]
  - - [512, 1024, 1, 512, 512, 512, 512, 1024]
    - [86, 37.95]
  - - [512, 1024, 1, 1024, 512, 512, 512, 1024]
    - [87, 54.29]
  - - [512, 1024, 1, 2048, 512, 512, 512, 1024]
    - [109, 69.55]
  - - [512, 1024, 1, 4096, 512, 512, 512, 1024]
    - [88, 78.52]
  - - [512, 1024, 1, 8192, 512, 512, 512, 1024]
    - [88, 82.14]
  - - [512, 2048, 1, 128, 512, 512, 512, 2048]
    - [43, 24.76]
  - - [512, 2048, 1, 256, 512, 512, 512, 2048]
    - [43, 40.62]
  - - [512, 2048, 1, 512, 512, 512, 512, 2048]
    - [43, 62.46]
  - - [512, 2048, 1, 1024, 512, 512, 512, 2048]
    - [80, 87.33]
  - - [512, 2048, 1, 2048, 512, 512, 512, 2048]
    - [40, 108.02]
  - - [512, 2048, 1, 4096, 512, 512, 512, 2048]
    - [80, 125.41]
  - - [512, 2048, 1, 8192, 512, 512, 512, 2048]
    - [80, 128.5]
  - - [512, 4096, 1, 128, 512, 512, 512, 4096]
    - [30, 38.84]
  - - [512, 4096, 1, 256, 512, 512, 512, 4096]
    - [30, 65.84]
  - - [512, 4096, 1, 512, 512, 512, 512, 4096]
    - [31, 98.46]
  - - [512, 4096, 1, 1024, 512, 512, 512, 4096]
    - [76, 134.1]
  - - [512, 4096, 1, 2048, 512, 512, 512, 4096]
    - [32, 161.15]
  - - [512, 4096, 1, 4096, 512, 512, 512, 4096]
    - [31, 179.41]
  - - [512, 4096, 1, 8192, 512, 512, 512, 4096]
    - [32, 164.96]
  - - [512, 8192, 1, 128, 512, 512, 512, 8192]
    - [23, 56.34]
  - - [512, 8192, 1, 256, 512, 512, 512, 8192]
    - [24, 94.41]
  - - [512, 8192, 1, 512, 512, 512, 512, 8192]
    - [24, 142.92]
  - - [512, 8192, 1, 1024, 512, 512, 512, 8192]
    - [24, 191.44]
  - - [512, 8192, 1, 2048, 512, 512, 512, 8192]
    - [24, 223.42]
  - - [512, 8192, 1, 4096, 512, 512, 512, 8192]
    - [26, 233.92]
  - - [512, 8192, 1, 8192, 512, 512, 512, 8192]
    - [74, 214.39]
  - - [1024, 128, 1, 128, 1024, 1024, 1024, 128]
    - [61, 4.13]
  - - [1024, 128, 1, 256, 1024, 1024, 1024, 128]
    - [61, 7.17]
  - - [1024, 128, 1, 512, 1024, 1024, 1024, 128]
    - [102, 11.62]
  - - [1024, 128, 1, 1024, 1024, 1024, 1024, 128]
    - [104, 17.41]
  - - [1024, 128, 1, 2048, 1024, 1024, 1024, 128]
    - [105, 23.14]
  - - [1024, 128, 1, 4096, 1024, 1024, 1024, 128]
    - [116, 25.17]
  - - [1024, 128, 1, 8192, 1024, 1024, 1024, 128]
    - [116, 26.63]
  - - [1024, 256, 1, 128, 1024, 1024, 1024, 256]
    - [57, 7.79]
  - - [1024, 256, 1, 256, 1024, 1024, 1024, 256]
    - [58, 13.39]
  - - [1024, 256, 1, 512, 1024, 1024, 1024, 256]
    - [96, 21.0]
  - - [1024, 256, 1, 1024, 1024, 1024, 1024, 256]
    - [99, 30.36]
  - - [1024, 256, 1, 2048, 1024, 1024, 1024, 256]
    - [111, 41.11]
  - - [1024, 256, 1, 4096, 1024, 1024, 1024, 256]
    - [95, 46.24]
  - - [1024, 256, 1, 8192, 1024, 1024, 1024, 256]
    - [112, 48.96]
  - - [1024, 512, 1, 128, 1024, 1024, 1024, 512]
    - [48, 14.03]
  - - [1024, 512, 1, 256, 1024, 1024, 1024, 512]
    - [50, 24.0]
  - - [1024, 512, 1, 512, 1024, 1024, 1024, 512]
    - [53, 37.71]
  - - [1024, 512, 1, 1024, 1024, 1024, 1024, 512]
    - [87, 54.38]
  - - [1024, 512, 1, 2048, 1024, 1024, 1024, 512]
    - [88, 69.22]
  - - [1024, 512, 1, 4096, 1024, 1024, 1024, 512]
    - [89, 75.82]
  - - [1024, 512, 1, 8192, 1024, 1024, 1024, 512]
    - [92, 81.83]
  - - [1024, 1024, 1, 128, 1024, 1024, 1024, 1024]
    - [43, 24.81]
  - - [1024, 1024, 1, 256, 1024, 1024, 1024, 1024]
    - [43, 41.95]
  - - [1024, 1024, 1, 512, 1024, 1024, 1024, 1024]
    - [45, 63.92]
  - - [1024, 1024, 1, 1024, 1024, 1024, 1024, 1024]
    - [80, 89.21]
  - - [1024, 1024, 1, 2048, 1024, 1024, 1024, 1024]
    - [80, 109.18]
  - - [1024, 1024, 1, 4096, 1024, 1024, 1024, 1024]
    - [82, 125.0]
  - - [1024, 1024, 1, 8192, 1024, 1024, 1024, 1024]
    - [81, 130.48]
  - - [1024, 2048, 1, 128, 1024, 1024, 1024, 2048]
    - [30, 39.08]
  - - [1024, 2048, 1, 256, 1024, 1024, 1024, 2048]
    - [30, 65.45]
  - - [1024, 2048, 1, 512, 1024, 1024, 1024, 2048]
    - [32, 99.57]
  - - [1024, 2048, 1, 1024, 1024, 1024, 1024, 2048]
    - [76, 134.44]
  - - [1024, 2048, 1, 2048, 1024, 1024, 1024, 2048]
    - [32, 161.28]
  - - [1024, 2048, 1, 4096, 1024, 1024, 1024, 2048]
    - [31, 176.85]
  - - [1024, 2048, 1, 8192, 1024, 1024, 1024, 2048]
    - [31, 163.02]
  - - [1024, 4096, 1, 128, 1024, 1024, 1024, 4096]
    - [23, 55.61]
  - - [1024, 4096, 1, 256, 1024, 1024, 1024, 4096]
    - [24, 92.61]
  - - [1024, 4096, 1, 512, 1024, 1024, 1024, 4096]
    - [24, 142.17]
  - - [1024, 4096, 1, 1024, 1024, 1024, 1024, 4096]
    - [24, 190.09]
  - - [1024, 4096, 1, 2048, 1024, 1024, 1024, 4096]
    - [24, 225.8]
  - - [1024, 4096, 1, 4096, 1024, 1024, 1024, 4096]
    - [75, 227.85]
  - - [1024, 4096, 1, 8192, 1024, 1024, 1024, 4096]
    - [71, 213.28]
  - - [1024, 8192, 1, 128, 1024, 1024, 1024, 8192]
    - [20, 82.41]
  - - [1024, 8192, 1, 256, 1024, 1024, 1024, 8192]
    - [19, 131.26]
  - - [1024, 8192, 1, 512, 1024, 1024, 1024, 8192]
    - [21, 186.23]
  - - [1024, 8192, 1, 1024, 1024, 1024, 1024, 8192]
    - [6, 232.17]
  - - [1024, 8192, 1, 2048, 1024, 1024, 1024, 8192]
    - [3, 258.56]
  - - [1024, 8192, 1, 4096, 1024, 1024, 1024, 8192]
    - [68, 246.14]
  - - [1024, 8192, 1, 8192, 1024, 1024, 1024, 8192]
    - [65, 262.63]
  - - [2048, 128, 1, 128, 2048, 2048, 2048, 128]
    - [57, 7.89]
  - - [2048, 128, 1, 256, 2048, 2048, 2048, 128]
    - [57, 13.41]
  - - [2048, 128, 1, 512, 2048, 2048, 2048, 128]
    - [97, 21.49]
  - - [2048, 128, 1, 1024, 2048, 2048, 2048, 128]
    - [99, 31.31]
  - - [2048, 128, 1, 2048, 2048, 2048, 2048, 128]
    - [95, 37.65]
  - - [2048, 128, 1, 4096, 2048, 2048, 2048, 128]
    - [94, 45.22]
  - - [2048, 128, 1, 8192, 2048, 2048, 2048, 128]
    - [94, 50.6]
  - - [2048, 256, 1, 128, 2048, 2048, 2048, 256]
    - [50, 13.96]
  - - [2048, 256, 1, 256, 2048, 2048, 2048, 256]
    - [50, 24.01]
  - - [2048, 256, 1, 512, 2048, 2048, 2048, 256]
    - [55, 37.56]
  - - [2048, 256, 1, 1024, 2048, 2048, 2048, 256]
    - [87, 54.21]
  - - [2048, 256, 1, 2048, 2048, 2048, 2048, 256]
    - [93, 67.27]
  - - [2048, 256, 1, 4096, 2048, 2048, 2048, 256]
    - [92, 78.4]
  - - [2048, 256, 1, 8192, 2048, 2048, 2048, 256]
    - [90, 86.46]
  - - [2048, 512, 1, 128, 2048, 2048, 2048, 512]
    - [43, 24.6]
  - - [2048, 512, 1, 256, 2048, 2048, 2048, 512]
    - [43, 41.17]
  - - [2048, 512, 1, 512, 2048, 2048, 2048, 512]
    - [43, 63.4]
  - - [2048, 512, 1, 1024, 2048, 2048, 2048, 512]
    - [80, 88.72]
  - - [2048, 512, 1, 2048, 2048, 2048, 2048, 512]
    - [83, 108.03]
  - - [2048, 512, 1, 4096, 2048, 2048, 2048, 512]
    - [83, 124.93]
  - - [2048, 512, 1, 8192, 2048, 2048, 2048, 512]
    - [82, 129.68]
  - - [2048, 1024, 1, 128, 2048, 2048, 2048, 1024]
    - [32, 38.74]
  - - [2048, 1024, 1, 256, 2048, 2048, 2048, 1024]
    - [31, 65.18]
  - - [2048, 1024, 1, 512, 2048, 2048, 2048, 1024]
    - [32, 99.04]
  - - [2048, 1024, 1, 1024, 2048, 2048, 2048, 1024]
    - [76, 134.45]
  - - [2048, 1024, 1, 2048, 2048, 2048, 2048, 1024]
    - [37, 159.17]
  - - [2048, 1024, 1, 4096, 2048, 2048, 2048, 1024]
    - [37, 177.57]
  - - [2048, 1024, 1, 8192, 2048, 2048, 2048, 1024]
    - [34, 163.1]
  - - [2048, 2048, 1, 128, 2048, 2048, 2048, 2048]
    - [28, 55.37]
  - - [2048, 2048, 1, 256, 2048, 2048, 2048, 2048]
    - [28, 93.48]
  - - [2048, 2048, 1, 512, 2048, 2048, 2048, 2048]
    - [24, 142.63]
  - - [2048, 2048, 1, 1024, 2048, 2048, 2048, 2048]
    - [24, 189.5]
  - - [2048, 2048, 1, 2048, 2048, 2048, 2048, 2048]
    - [29, 220.05]
  - - [2048, 2048, 1, 4096, 2048, 2048, 2048, 2048]
    - [71, 226.03]
  - - [2048, 2048, 1, 8192, 2048, 2048, 2048, 2048]
    - [71, 211.6]
  - - [2048, 4096, 1, 128, 2048, 2048, 2048, 4096]
    - [1, 70.74]
  - - [2048, 4096, 1, 256, 2048, 2048, 2048, 4096]
    - [0, 117.96]
  - - [2048, 4096, 1, 512, 2048, 2048, 2048, 4096]
    - [3, 177.08]
  - - [2048, 4096, 1, 1024, 2048, 2048, 2048, 4096]
    - [11, 230.33]
  - - [2048, 4096, 1, 2048, 2048, 2048, 2048, 4096]
    - [11, 261.28]
  - - [2048, 4096, 1, 4096, 2048, 2048, 2048, 4096]
    - [8, 246.94]
  - - [2048, 4096, 1, 8192, 2048, 2048, 2048, 4096]
    - [11, 261.95]
  - - [2048, 8192, 1, 128, 2048, 2048, 2048, 8192]
    - [19, 89.58]
  - - [2048, 8192, 1, 256, 2048, 2048, 2048, 8192]
    - [20, 134.22]
  - - [2048, 8192, 1, 512, 2048, 2048, 2048, 8192]
    - [3, 184.51]
  - - [2048, 8192, 1, 1024, 2048, 2048, 2048, 8192]
    - [10, 221.97]
  - - [2048, 8192, 1, 2048, 2048, 2048, 2048, 8192]
    - [14, 232.55]
  - - [2048, 8192, 1, 4096, 2048, 2048, 2048, 8192]
    - [67, 279.11]
  - - [2048, 8192, 1, 8192, 2048, 2048, 2048, 8192]
    - [8, 324.05]
  - - [4096, 128, 1, 128, 4096, 4096, 4096, 128]
    - [84, 13.74]
  - - [4096, 128, 1, 256, 4096, 4096, 4096, 128]
    - [50, 24.05]
  - - [4096, 128, 1, 512, 4096, 4096, 4096, 128]
    - [86, 37.66]
  - - [4096, 128, 1, 1024, 4096, 4096, 4096, 128]
    - [87, 54.47]
  - - [4096, 128, 1, 2048, 4096, 4096, 4096, 128]
    - [90, 66.35]
  - - [4096, 128, 1, 4096, 4096, 4096, 4096, 128]
    - [91, 77.91]
  - - [4096, 128, 1, 8192, 4096, 4096, 4096, 128]
    - [90, 84.89]
  - - [4096, 256, 1, 128, 4096, 4096, 4096, 256]
    - [46, 23.77]
  - - [4096, 256, 1, 256, 4096, 4096, 4096, 256]
    - [38, 40.83]
  - - [4096, 256, 1, 512, 4096, 4096, 4096, 256]
    - [39, 63.59]
  - - [4096, 256, 1, 1024, 4096, 4096, 4096, 256]
    - [82, 88.09]
  - - [4096, 256, 1, 2048, 4096, 4096, 4096, 256]
    - [81, 108.12]
  - - [4096, 256, 1, 4096, 4096, 4096, 4096, 256]
    - [82, 126.06]
  - - [4096, 256, 1, 8192, 4096, 4096, 4096, 256]
    - [41, 127.45]
  - - [4096, 512, 1, 128, 4096, 4096, 4096, 512]
    - [32, 39.2]
  - - [4096, 512, 1, 256, 4096, 4096, 4096, 512]
    - [31, 65.98]
  - - [4096, 512, 1, 512, 4096, 4096, 4096, 512]
    - [32, 99.97]
  - - [4096, 512, 1, 1024, 4096, 4096, 4096, 512]
    - [33, 132.16]
  - - [4096, 512, 1, 2048, 4096, 4096, 4096, 512]
    - [37, 160.19]
  - - [4096, 512, 1, 4096, 4096, 4096, 4096, 512]
    - [35, 179.37]
  - - [4096, 512, 1, 8192, 4096, 4096, 4096, 512]
    - [36, 167.91]
  - - [4096, 1024, 1, 128, 4096, 4096, 4096, 1024]
    - [23, 56.54]
  - - [4096, 1024, 1, 256, 4096, 4096, 4096, 1024]
    - [24, 94.12]
  - - [4096, 1024, 1, 512, 4096, 4096, 4096, 1024]
    - [24, 140.98]
  - - [4096, 1024, 1, 1024, 4096, 4096, 4096, 1024]
    - [25, 187.9]
  - - [4096, 1024, 1, 2048, 4096, 4096, 4096, 1024]
    - [29, 221.24]
  - - [4096, 1024, 1, 4096, 4096, 4096, 4096, 1024]
    - [73, 230.99]
  - - [4096, 1024, 1, 8192, 4096, 4096, 4096, 1024]
    - [72, 215.33]
  - - [4096, 2048, 1, 128, 4096, 4096, 4096, 2048]
    - [0, 71.44]
  - - [4096, 2048, 1, 256, 4096, 4096, 4096, 2048]
    - [3, 117.85]
  - - [4096, 2048, 1, 512, 4096, 4096, 4096, 2048]
    - [3, 176.26]
  - - [4096, 2048, 1, 1024, 4096, 4096, 4096, 2048]
    - [11, 227.84]
  - - [4096, 2048, 1, 2048, 4096, 4096, 4096, 2048]
    - [11, 257.86]
  - - [4096, 2048, 1, 4096, 4096, 4096, 4096, 2048]
    - [67, 244.26]
  - - [4096, 2048, 1, 8192, 4096, 4096, 4096, 2048]
    - [13, 262.8]
  - - [4096, 4096, 1, 128, 4096, 4096, 4096, 4096]
    - [7, 76.49]
  - - [4096, 4096, 1, 256, 4096, 4096, 4096, 4096]
    - [9, 126.24]
  - - [4096, 4096, 1, 512, 4096, 4096, 4096, 4096]
    - [10, 184.73]
  - - [4096, 4096, 1, 1024, 4096, 4096, 4096, 4096]
    - [3, 221.72]
  - - [4096, 4096, 1, 2048, 4096, 4096, 4096, 4096]
    - [14, 232.54]
  - - [4096, 4096, 1, 4096, 4096, 4096, 4096, 4096]
    - [0, 277.86]
  - - [4096, 4096, 1, 8192, 4096, 4096, 4096, 4096]
    - [67, 325.39]
  - - [4096, 8192, 1, 128, 4096, 4096, 4096, 8192]
    - [19, 93.82]
  - - [4096, 8192, 1, 256, 4096, 4096, 4096, 8192]
    - [22, 138.87]
  - - [4096, 8192, 1, 512, 4096, 4096, 4096, 8192]
    - [12, 189.7]
  - - [4096, 8192, 1, 1024, 4096, 4096, 4096, 8192]
    - [16, 218.71]
  - - [4096, 8192, 1, 2048, 4096, 4096, 4096, 8192]
    - [3, 260.41]
  - - [4096, 8192, 1, 4096, 4096, 4096, 4096, 8192]
    - [2, 317.36]
  - - [4096, 8192, 1, 8192, 4096, 4096, 4096, 8192]
    - [65, 353.54]
  - - [8192, 128, 1, 128, 8192, 8192, 8192, 128]
    - [43, 24.93]
  - - [8192, 128, 1, 256, 8192, 8192, 8192, 128]
    - [43, 42.65]
  - - [8192, 128, 1, 512, 8192, 8192, 8192, 128]
    - [45, 64.48]
  - - [8192, 128, 1, 1024, 8192, 8192, 8192, 128]
    - [40, 88.46]
  - - [8192, 128, 1, 2048, 8192, 8192, 8192, 128]
    - [82, 108.17]
  - - [8192, 128, 1, 4096, 8192, 8192, 8192, 128]
    - [83, 125.49]
  - - [8192, 128, 1, 8192, 8192, 8192, 8192, 128]
    - [83, 126.52]
  - - [8192, 256, 1, 128, 8192, 8192, 8192, 256]
    - [30, 39.44]
  - - [8192, 256, 1, 256, 8192, 8192, 8192, 256]
    - [31, 65.35]
  - - [8192, 256, 1, 512, 8192, 8192, 8192, 256]
    - [31, 99.27]
  - - [8192, 256, 1, 1024, 8192, 8192, 8192, 256]
    - [77, 133.39]
  - - [8192, 256, 1, 2048, 8192, 8192, 8192, 256]
    - [37, 159.83]
  - - [8192, 256, 1, 4096, 8192, 8192, 8192, 256]
    - [37, 177.55]
  - - [8192, 256, 1, 8192, 8192, 8192, 8192, 256]
    - [33, 162.27]
  - - [8192, 512, 1, 128, 8192, 8192, 8192, 512]
    - [23, 55.87]
  - - [8192, 512, 1, 256, 8192, 8192, 8192, 512]
    - [24, 94.6]
  - - [8192, 512, 1, 512, 8192, 8192, 8192, 512]
    - [27, 141.09]
  - - [8192, 512, 1, 1024, 8192, 8192, 8192, 512]
    - [25, 189.88]
  - - [8192, 512, 1, 2048, 8192, 8192, 8192, 512]
    - [15, 220.52]
  - - [8192, 512, 1, 4096, 8192, 8192, 8192, 512]
    - [71, 229.5]
  - - [8192, 512, 1, 8192, 8192, 8192, 8192, 512]
    - [73, 215.98]
  - - [8192, 1024, 1, 128, 8192, 8192, 8192, 1024]
    - [5, 70.46]
  - - [8192, 1024, 1, 256, 8192, 8192, 8192, 1024]
    - [3, 116.64]
  - - [8192, 1024, 1, 512, 8192, 8192, 8192, 1024]
    - [11, 174.51]
  - - [8192, 1024, 1, 1024, 8192, 8192, 8192, 1024]
    - [11, 227.19]
  - - [8192, 1024, 1, 2048, 8192, 8192, 8192, 1024]
    - [8, 256.91]
  - - [8192, 1024, 1, 4096, 8192, 8192, 8192, 1024]
    - [11, 249.67]
  - - [8192, 1024, 1, 8192, 8192, 8192, 8192, 1024]
    - [11, 261.7]
  - - [8192, 2048, 1, 128, 8192, 8192, 8192, 2048]
    - [4, 76.06]
  - - [8192, 2048, 1, 256, 8192, 8192, 8192, 2048]
    - [9, 125.27]
  - - [8192, 2048, 1, 512, 8192, 8192, 8192, 2048]
    - [10, 183.11]
  - - [8192, 2048, 1, 1024, 8192, 8192, 8192, 2048]
    - [6, 225.27]
  - - [8192, 2048, 1, 2048, 8192, 8192, 8192, 2048]
    - [12, 229.08]
  - - [8192, 2048, 1, 4096, 8192, 8192, 8192, 2048]
    - [8, 279.63]
  - - [8192, 2048, 1, 8192, 8192, 8192, 8192, 2048]
    - [66, 330.47]
  - - [8192, 4096, 1, 128, 8192, 8192, 8192, 4096]
    - [9, 82.28]
  - - [8192, 4096, 1, 256, 8192, 8192, 8192, 4096]
    - [11, 128.3]
  - - [8192, 4096, 1, 512, 8192, 8192, 8192, 4096]
    - [18, 184.0]
  - - [8192, 4096, 1, 1024, 8192, 8192, 8192, 4096]
    - [18, 217.28]
  - - [8192, 4096, 1, 2048, 8192, 8192, 8192, 4096]
    - [10, 256.94]
  - - [8192, 4096, 1, 4096, 8192, 8192, 8192, 4096]
    - [3, 304.82]
  - - [8192, 4096, 1, 8192, 8192, 8192, 8192, 4096]
    - [69, 334.84]
  - - [8192, 8192, 1, 128, 8192, 8192, 8192, 8192]
    - [20, 89.79]
  - - [8192, 8192, 1, 256, 8192, 8192, 8192, 8192]
    - [17, 140.23]
  - - [8192, 8192, 1, 512, 8192, 8192, 8192, 8192]
    - [3, 204.26]
  - - [8192, 8192, 1, 1024, 8192, 8192, 8192, 8192]
    - [69, 264.47]
  - - [8192, 8192, 1, 2048, 8192, 8192, 8192, 8192]
    - [70, 322.49]
  - - [8192, 8192, 1, 4096, 8192, 8192, 8192, 8192]
    - [70, 354.46]
  - - [8192, 8192, 1, 8192, 8192, 8192, 8192, 8192]
    - [3, 346.06]
- null
- null
- ExperimentalStreamK
- GridBased
