projects/hipblaslt/library/src/amd_detail/rocblaslt/src/Tensile/Logic/asm_full/aquavanjaram/gfx942_228cu/StreamK/aquavanjaram942_Cijk_Alik_Bljk_HHS_BH_Bias_HAS_SAV_UserArgs.yaml
- {MinimumRequiredVersion: 4.33.0}
- aquavanjaram942
- {Architecture: gfx942, CUCount: 228}
- [Device 0049, Device 0050]
    SolutionIndex: 0
    SolutionNameMin: Cijk_Alik_Bljk_HHS_BH_Bias_AS_SAV_UserArgs_MT256x256x32_MI16x16x1_SN_LDSB1_CLR1_GSU0_GSUC0_GSUWGMRR0_K1_LBSPPA512_LBSPPB512_MIWT8_8_PLR1_SU0_SUM0_SUS64_VWA8_VWB8_WGM1_WGMXCC1_WGMXCCGn1
    SolutionIndex: 1
    SolutionNameMin: Cijk_Alik_Bljk_HHS_BH_Bias_AS_SAV_UserArgs_MT256x256x32_MI16x16x1_SN_LDSB1_CLR1_GSU0_GSUC0_GSUWGMRR0_K1_LBSPPA512_LBSPPB512_MIWT8_8_PLR1_SU0_SUM0_SUS64_VWA8_VWB8_WGM1_WGMXCC1_WGMXCCGn1
    SolutionIndex: 2
    SolutionNameMin: Cijk_Alik_Bljk_HHS_BH_Bias_AS_SAV_UserArgs_MT256x256x32_MI16x16x1_SN_LDSB1_CLR1_GSU0_GSUC0_GSUWGMRR0_K1_LBSPPA512_LBSPPB512_MIWT8_8_PLR1_SU0_SUM0_SUS64_VWA8_VWB8_WGM1_WGMXCC1_WGMXCCGn1
    SolutionIndex: 3
    SolutionNameMin: Cijk_Alik_Bljk_HHS_BH_Bias_AS_SAV_UserArgs_MT256x256x32_MI16x16x1_SN_LDSB1_CLR1_GSU0_GSUC0_GSUWGMRR0_K1_LBSPPA512_LBSPPB512_MIWT8_8_PLR1_SU0_SUM0_SUS64_VWA8_VWB8_WGM4_WGMXCC1_WGMXCCGn1
    SolutionIndex: 4
    SolutionNameMin: Cijk_Alik_Bljk_HHS_BH_Bias_AS_SAV_UserArgs_MT256x256x32_MI16x16x1_SN_LDSB1_CLR1_GSU0_GSUC0_GSUWGMRR0_K1_LBSPPA512_LBSPPB512_MIWT8_8_PLR1_SU0_SUM0_SUS64_VWA8_VWB8_WGM4_WGMXCC1_WGMXCCGn1
    SolutionIndex: 5
    SolutionNameMin: Cijk_Alik_Bljk_HHS_BH_Bias_AS_SAV_UserArgs_MT256x256x32_MI16x16x1_SN_LDSB1_CLR1_GSU0_GSUC0_GSUWGMRR0_K1_LBSPPA512_LBSPPB512_MIWT8_8_PLR1_SU0_SUM0_SUS64_VWA8_VWB8_WGM4_WGMXCC1_WGMXCCGn1
    SolutionIndex: 6
    SolutionNameMin: Cijk_Alik_Bljk_HHS_BH_Bias_AS_SAV_UserArgs_MT256x256x32_MI16x16x1_SN_LDSB1_CLR1_GSU0_GSUC0_GSUWGMRR0_K1_LBSPPA512_LBSPPB512_MIWT8_8_PLR1_SU0_SUM0_SUS64_VWA8_VWB8_WGM6_WGMXCC1_WGMXCCGn1
    SolutionIndex: 7
    SolutionNameMin: Cijk_Alik_Bljk_HHS_BH_Bias_AS_SAV_UserArgs_MT256x256x32_MI16x16x1_SN_LDSB1_CLR1_GSU0_GSUC0_GSUWGMRR0_K1_LBSPPA512_LBSPPB512_MIWT8_8_PLR1_SU0_SUM0_SUS64_VWA8_VWB8_WGM8_WGMXCC1_WGMXCCGn1
    SolutionIndex: 8
    SolutionNameMin: Cijk_Alik_Bljk_HHS_BH_Bias_AS_SAV_UserArgs_MT256x256x32_MI16x16x1_SN_LDSB1_CLR1_GSU0_GSUC0_GSUWGMRR0_K1_LBSPPA512_LBSPPB512_MIWT8_8_PLR1_SU0_SUM0_SUS64_VWA8_VWB8_WGM8_WGMXCC1_WGMXCCGn1
    SolutionIndex: 9
    SolutionNameMin: Cijk_Alik_Bljk_HHS_BH_Bias_AS_SAV_UserArgs_MT256x256x32_MI16x16x1_SN_LDSB1_CLR1_GSU0_GSUC0_GSUWGMRR0_K1_LBSPPA512_LBSPPB512_MIWT8_8_PLR1_SU0_SUM0_SUS64_VWA8_VWB8_WGM8_WGMXCC1_WGMXCCGn1
    SolutionIndex: 10
    SolutionNameMin: Cijk_Alik_Bljk_HHS_BH_Bias_AS_SAV_UserArgs_MT128x256x32_MI16x16x1_SN_LDSB1_CLR1_GSU0_GSUC0_GSUWGMRR0_K1_LBSPPA256_LBSPPB512_MIWT4_8_PLR1_SU0_SUM0_SUS64_VWA4_VWB8_WGM1_WGMXCC1_WGMXCCGn1
    SolutionIndex: 11
    SolutionNameMin: Cijk_Alik_Bljk_HHS_BH_Bias_AS_SAV_UserArgs_MT128x256x32_MI16x16x1_SN_LDSB1_CLR1_GSU0_GSUC0_GSUWGMRR0_K1_LBSPPA256_LBSPPB512_MIWT4_8_PLR1_SU0_SUM0_SUS64_VWA4_VWB8_WGM4_WGMXCC1_WGMXCCGn1
    SolutionIndex: 12
    SolutionNameMin: Cijk_Alik_Bljk_HHS_BH_Bias_AS_SAV_UserArgs_MT128x256x32_MI16x16x1_SN_LDSB1_CLR1_GSU0_GSUC0_GSUWGMRR0_K1_LBSPPA256_LBSPPB512_MIWT4_8_PLR1_SU0_SUM0_SUS64_VWA4_VWB8_WGM4_WGMXCC1_WGMXCCGn1
    SolutionIndex: 13
    SolutionNameMin: Cijk_Alik_Bljk_HHS_BH_Bias_AS_SAV_UserArgs_MT128x256x32_MI16x16x1_SN_LDSB1_CLR1_GSU0_GSUC0_GSUWGMRR0_K1_LBSPPA256_LBSPPB512_MIWT4_8_PLR1_SU0_SUM0_SUS64_VWA4_VWB8_WGM6_WGMXCC1_WGMXCCGn1
    SolutionIndex: 14
    SolutionNameMin: Cijk_Alik_Bljk_HHS_BH_Bias_AS_SAV_UserArgs_MT256x128x32_MI16x16x1_SN_LDSB1_CLR1_GSU0_GSUC0_GSUWGMRR0_K1_LBSPPA512_LBSPPB256_MIWT8_4_PLR1_SU0_SUM0_SUS64_VWA8_VWB4_WGM1_WGMXCC1_WGMXCCGn1
    SolutionIndex: 15
    SolutionNameMin: Cijk_Alik_Bljk_HHS_BH_Bias_AS_SAV_UserArgs_MT256x128x32_MI16x16x1_SN_LDSB1_CLR1_GSU0_GSUC0_GSUWGMRR0_K1_LBSPPA512_LBSPPB256_MIWT8_4_PLR1_SU0_SUM0_SUS64_VWA8_VWB4_WGM1_WGMXCC1_WGMXCCGn1
    SolutionIndex: 16
    SolutionNameMin: Cijk_Alik_Bljk_HHS_BH_Bias_AS_SAV_UserArgs_MT256x128x32_MI16x16x1_SN_LDSB1_CLR1_GSU0_GSUC0_GSUWGMRR0_K1_LBSPPA512_LBSPPB256_MIWT8_4_PLR1_SU0_SUM0_SUS64_VWA8_VWB4_WGM6_WGMXCC1_WGMXCCGn1
    SolutionIndex: 17
    SolutionNameMin: Cijk_Alik_Bljk_HHS_BH_Bias_AS_SAV_UserArgs_MT256x128x32_MI16x16x1_SN_LDSB1_CLR1_GSU0_GSUC0_GSUWGMRR0_K1_LBSPPA512_LBSPPB256_MIWT8_4_PLR1_SU0_SUM0_SUS64_VWA8_VWB4_WGM6_WGMXCC1_WGMXCCGn1
    SolutionIndex: 18
    SolutionNameMin: Cijk_Alik_Bljk_HHS_BH_Bias_AS_SAV_UserArgs_MT256x128x32_MI16x16x1_SN_LDSB1_CLR1_GSU0_GSUC0_GSUWGMRR0_K1_LBSPPA512_LBSPPB256_MIWT8_4_PLR1_SU0_SUM0_SUS64_VWA8_VWB4_WGM8_WGMXCC1_WGMXCCGn1
    SolutionIndex: 19
    SolutionNameMin: Cijk_Alik_Bljk_HHS_BH_Bias_AS_SAV_UserArgs_MT128x256x64_MI16x16x1_SN_LDSB1_CLR1_GSU0_GSUC0_GSUWGMRR0_K1_LBSPPA512_LBSPPB1024_MIWT4_8_PLR1_SU0_SUM0_SUS128_VWA4_VWB8_WGM1_WGMXCC1_WGMXCCGn1
    SolutionIndex: 20
    SolutionNameMin: Cijk_Alik_Bljk_HHS_BH_Bias_AS_SAV_UserArgs_MT128x256x64_MI16x16x1_SN_LDSB1_CLR1_GSU0_GSUC0_GSUWGMRR0_K1_LBSPPA512_LBSPPB1024_MIWT4_8_PLR1_SU0_SUM0_SUS128_VWA4_VWB8_WGM1_WGMXCC1_WGMXCCGn1
    SolutionIndex: 21
    SolutionNameMin: Cijk_Alik_Bljk_HHS_BH_Bias_AS_SAV_UserArgs_MT128x256x64_MI16x16x1_SN_LDSB1_CLR1_GSU0_GSUC0_GSUWGMRR0_K1_LBSPPA512_LBSPPB1024_MIWT4_8_PLR1_SU0_SUM0_SUS128_VWA4_VWB8_WGM1_WGMXCC1_WGMXCCGn1
    SolutionIndex: 22
    SolutionNameMin: Cijk_Alik_Bljk_HHS_BH_Bias_AS_SAV_UserArgs_MT128x256x64_MI16x16x1_SN_LDSB1_CLR1_GSU0_GSUC0_GSUWGMRR0_K1_LBSPPA512_LBSPPB1024_MIWT4_8_PLR1_SU0_SUM0_SUS128_VWA4_VWB8_WGM1_WGMXCC1_WGMXCCGn1
    SolutionIndex: 23
    SolutionNameMin: Cijk_Alik_Bljk_HHS_BH_Bias_AS_SAV_UserArgs_MT128x256x64_MI16x16x1_SN_LDSB1_CLR1_GSU0_GSUC0_GSUWGMRR0_K1_LBSPPA512_LBSPPB1024_MIWT4_8_PLR1_SU0_SUM0_SUS128_VWA4_VWB8_WGM1_WGMXCC1_WGMXCCGn1
    SolutionIndex: 24
    SolutionNameMin: Cijk_Alik_Bljk_HHS_BH_Bias_AS_SAV_UserArgs_MT128x256x64_MI16x16x1_SN_LDSB1_CLR1_GSU0_GSUC0_GSUWGMRR0_K1_LBSPPA512_LBSPPB1024_MIWT4_8_PLR1_SU0_SUM0_SUS128_VWA4_VWB8_WGM4_WGMXCC1_WGMXCCGn1
    SolutionIndex: 25
    SolutionNameMin: Cijk_Alik_Bljk_HHS_BH_Bias_AS_SAV_UserArgs_MT128x256x64_MI16x16x1_SN_LDSB1_CLR1_GSU0_GSUC0_GSUWGMRR0_K1_LBSPPA512_LBSPPB1024_MIWT4_8_PLR1_SU0_SUM0_SUS128_VWA4_VWB8_WGM4_WGMXCC1_WGMXCCGn1
    SolutionIndex: 26
    SolutionNameMin: Cijk_Alik_Bljk_HHS_BH_Bias_AS_SAV_UserArgs_MT128x256x64_MI16x16x1_SN_LDSB1_CLR1_GSU0_GSUC0_GSUWGMRR0_K1_LBSPPA512_LBSPPB1024_MIWT4_8_PLR1_SU0_SUM0_SUS128_VWA4_VWB8_WGM6_WGMXCC1_WGMXCCGn1
    SolutionIndex: 27
    SolutionNameMin: Cijk_Alik_Bljk_HHS_BH_Bias_AS_SAV_UserArgs_MT128x256x64_MI16x16x1_SN_LDSB1_CLR1_GSU0_GSUC0_GSUWGMRR0_K1_LBSPPA512_LBSPPB1024_MIWT4_8_PLR1_SU0_SUM0_SUS128_VWA4_VWB8_WGM6_WGMXCC1_WGMXCCGn1
    SolutionIndex: 28
    SolutionNameMin: Cijk_Alik_Bljk_HHS_BH_Bias_AS_SAV_UserArgs_MT128x256x64_MI16x16x1_SN_LDSB1_CLR1_GSU0_GSUC0_GSUWGMRR0_K1_LBSPPA512_LBSPPB1024_MIWT4_8_PLR1_SU0_SUM0_SUS128_VWA4_VWB8_WGM6_WGMXCC1_WGMXCCGn1
    SolutionIndex: 29
    SolutionNameMin: Cijk_Alik_Bljk_HHS_BH_Bias_AS_SAV_UserArgs_MT128x256x64_MI16x16x1_SN_LDSB1_CLR1_GSU0_GSUC0_GSUWGMRR0_K1_LBSPPA512_LBSPPB1024_MIWT4_8_PLR1_SU0_SUM0_SUS128_VWA4_VWB8_WGM8_WGMXCC1_WGMXCCGn1
    SolutionIndex: 30
    SolutionNameMin: Cijk_Alik_Bljk_HHS_BH_Bias_AS_SAV_UserArgs_MT256x128x64_MI16x16x1_SN_LDSB1_CLR1_GSU0_GSUC0_GSUWGMRR0_K1_LBSPPA1024_LBSPPB512_MIWT8_4_PLR1_SU0_SUM0_SUS128_VWA8_VWB4_WGM1_WGMXCC1_WGMXCCGn1
    SolutionIndex: 31
    SolutionNameMin: Cijk_Alik_Bljk_HHS_BH_Bias_AS_SAV_UserArgs_MT256x128x64_MI16x16x1_SN_LDSB1_CLR1_GSU0_GSUC0_GSUWGMRR0_K1_LBSPPA1024_LBSPPB512_MIWT8_4_PLR1_SU0_SUM0_SUS128_VWA8_VWB4_WGM1_WGMXCC1_WGMXCCGn1
    SolutionIndex: 32
    SolutionNameMin: Cijk_Alik_Bljk_HHS_BH_Bias_AS_SAV_UserArgs_MT256x128x64_MI16x16x1_SN_LDSB1_CLR1_GSU0_GSUC0_GSUWGMRR0_K1_LBSPPA1024_LBSPPB512_MIWT8_4_PLR1_SU0_SUM0_SUS128_VWA8_VWB4_WGM4_WGMXCC1_WGMXCCGn1
    SolutionIndex: 33
    SolutionNameMin: Cijk_Alik_Bljk_HHS_BH_Bias_AS_SAV_UserArgs_MT256x128x64_MI16x16x1_SN_LDSB1_CLR1_GSU0_GSUC0_GSUWGMRR0_K1_LBSPPA1024_LBSPPB512_MIWT8_4_PLR1_SU0_SUM0_SUS128_VWA8_VWB4_WGM4_WGMXCC1_WGMXCCGn1
    SolutionIndex: 34
    SolutionNameMin: Cijk_Alik_Bljk_HHS_BH_Bias_AS_SAV_UserArgs_MT256x128x64_MI16x16x1_SN_LDSB1_CLR1_GSU0_GSUC0_GSUWGMRR0_K1_LBSPPA1024_LBSPPB512_MIWT8_4_PLR1_SU0_SUM0_SUS128_VWA8_VWB4_WGM6_WGMXCC1_WGMXCCGn1
    SolutionIndex: 35
    SolutionNameMin: Cijk_Alik_Bljk_HHS_BH_Bias_AS_SAV_UserArgs_MT256x128x64_MI16x16x1_SN_LDSB1_CLR1_GSU0_GSUC0_GSUWGMRR0_K1_LBSPPA1024_LBSPPB512_MIWT8_4_PLR1_SU0_SUM0_SUS128_VWA8_VWB4_WGM6_WGMXCC1_WGMXCCGn1
    SolutionIndex: 36
    SolutionNameMin: Cijk_Alik_Bljk_HHS_BH_Bias_AS_SAV_UserArgs_MT256x128x64_MI16x16x1_SN_LDSB1_CLR1_GSU0_GSUC0_GSUWGMRR0_K1_LBSPPA1024_LBSPPB512_MIWT8_4_PLR1_SU0_SUM0_SUS128_VWA8_VWB4_WGM8_WGMXCC1_WGMXCCGn1
    SolutionIndex: 37
    SolutionNameMin: Cijk_Alik_Bljk_HHS_BH_Bias_AS_SAV_UserArgs_MT256x128x64_MI16x16x1_SN_LDSB1_CLR1_GSU0_GSUC0_GSUWGMRR0_K1_LBSPPA1024_LBSPPB512_MIWT8_4_PLR1_SU0_SUM0_SUS128_VWA8_VWB4_WGM8_WGMXCC1_WGMXCCGn1
    SolutionIndex: 38
    SolutionNameMin: Cijk_Alik_Bljk_HHS_BH_Bias_AS_SAV_UserArgs_MT128x128x64_MI16x16x1_SN_LDSB1_CLR1_GSU0_GSUC0_GSUWGMRR0_K1_LBSPPA512_LBSPPB512_MIWT4_4_PLR1_SU0_SUM0_SUS128_VWA4_VWB4_WGM1_WGMXCC1_WGMXCCGn1
    SolutionIndex: 39
    SolutionNameMin: Cijk_Alik_Bljk_HHS_BH_Bias_AS_SAV_UserArgs_MT128x128x64_MI16x16x1_SN_LDSB1_CLR1_GSU0_GSUC0_GSUWGMRR0_K1_LBSPPA512_LBSPPB512_MIWT4_4_PLR1_SU0_SUM0_SUS128_VWA4_VWB4_WGM1_WGMXCC1_WGMXCCGn1
    SolutionIndex: 40
    SolutionNameMin: Cijk_Alik_Bljk_HHS_BH_Bias_AS_SAV_UserArgs_MT128x128x64_MI16x16x1_SN_LDSB1_CLR1_GSU0_GSUC0_GSUWGMRR0_K1_LBSPPA512_LBSPPB512_MIWT4_4_PLR1_SU0_SUM0_SUS128_VWA4_VWB4_WGM1_WGMXCC1_WGMXCCGn1
    SolutionIndex: 41
    SolutionNameMin: Cijk_Alik_Bljk_HHS_BH_Bias_AS_SAV_UserArgs_MT128x128x64_MI16x16x1_SN_LDSB1_CLR1_GSU0_GSUC0_GSUWGMRR0_K1_LBSPPA512_LBSPPB512_MIWT4_4_PLR1_SU0_SUM0_SUS128_VWA4_VWB4_WGM4_WGMXCC1_WGMXCCGn1
    SolutionIndex: 42
    SolutionNameMin: Cijk_Alik_Bljk_HHS_BH_Bias_AS_SAV_UserArgs_MT128x128x64_MI16x16x1_SN_LDSB1_CLR1_GSU0_GSUC0_GSUWGMRR0_K1_LBSPPA512_LBSPPB512_MIWT4_4_PLR1_SU0_SUM0_SUS128_VWA4_VWB4_WGM6_WGMXCC1_WGMXCCGn1
    SolutionIndex: 43
    SolutionNameMin: Cijk_Alik_Bljk_HHS_BH_Bias_AS_SAV_UserArgs_MT128x128x64_MI16x16x1_SN_LDSB1_CLR1_GSU0_GSUC0_GSUWGMRR0_K1_LBSPPA512_LBSPPB512_MIWT4_4_PLR1_SU0_SUM0_SUS128_VWA4_VWB4_WGM6_WGMXCC1_WGMXCCGn1
    SolutionIndex: 44
    SolutionNameMin: Cijk_Alik_Bljk_HHS_BH_Bias_AS_SAV_UserArgs_MT128x128x64_MI16x16x1_SN_LDSB1_CLR1_GSU0_GSUC0_GSUWGMRR0_K1_LBSPPA512_LBSPPB512_MIWT4_4_PLR1_SU0_SUM0_SUS128_VWA4_VWB4_WGM8_WGMXCC1_WGMXCCGn1
    SolutionIndex: 45
    SolutionNameMin: Cijk_Alik_Bljk_HHS_BH_Bias_AS_SAV_UserArgs_MT64x128x64_MI16x16x1_SN_LDSB1_CLR1_GSU0_GSUC0_GSUWGMRR0_K1_LBSPPA256_LBSPPB512_MIWT2_4_PLR1_SU0_SUM0_SUS128_VWA2_VWB4_WGM1_WGMXCC1_WGMXCCGn1
    SolutionIndex: 46
    SolutionNameMin: Cijk_Alik_Bljk_HHS_BH_Bias_AS_SAV_UserArgs_MT64x128x64_MI16x16x1_SN_LDSB1_CLR1_GSU0_GSUC0_GSUWGMRR0_K1_LBSPPA256_LBSPPB512_MIWT2_4_PLR1_SU0_SUM0_SUS128_VWA2_VWB4_WGM4_WGMXCC1_WGMXCCGn1
    SolutionIndex: 47
    SolutionNameMin: Cijk_Alik_Bljk_HHS_BH_Bias_AS_SAV_UserArgs_MT64x128x64_MI16x16x1_SN_LDSB1_CLR1_GSU0_GSUC0_GSUWGMRR0_K1_LBSPPA256_LBSPPB512_MIWT2_4_PLR1_SU0_SUM0_SUS128_VWA2_VWB4_WGM4_WGMXCC1_WGMXCCGn1
    SolutionIndex: 48
    SolutionNameMin: Cijk_Alik_Bljk_HHS_BH_Bias_AS_SAV_UserArgs_MT64x128x64_MI16x16x1_SN_LDSB1_CLR1_GSU0_GSUC0_GSUWGMRR0_K1_LBSPPA256_LBSPPB512_MIWT2_4_PLR1_SU0_SUM0_SUS128_VWA2_VWB4_WGM8_WGMXCC1_WGMXCCGn1
    SolutionIndex: 49
    SolutionNameMin: Cijk_Alik_Bljk_HHS_BH_Bias_AS_SAV_UserArgs_MT128x64x64_MI16x16x1_SN_LDSB1_CLR1_GSU0_GSUC0_GSUWGMRR0_K1_LBSPPA512_LBSPPB256_MIWT4_2_PLR1_SU0_SUM0_SUS128_VWA4_VWB2_WGM1_WGMXCC1_WGMXCCGn1
    SolutionIndex: 50
    SolutionNameMin: Cijk_Alik_Bljk_HHS_BH_Bias_AS_SAV_UserArgs_MT128x64x64_MI16x16x1_SN_LDSB1_CLR1_GSU0_GSUC0_GSUWGMRR0_K1_LBSPPA512_LBSPPB256_MIWT4_2_PLR1_SU0_SUM0_SUS128_VWA4_VWB2_WGM1_WGMXCC1_WGMXCCGn1
    SolutionIndex: 51
    SolutionNameMin: Cijk_Alik_Bljk_HHS_BH_Bias_AS_SAV_UserArgs_MT128x64x64_MI16x16x1_SN_LDSB1_CLR1_GSU0_GSUC0_GSUWGMRR0_K1_LBSPPA512_LBSPPB256_MIWT4_2_PLR1_SU0_SUM0_SUS128_VWA4_VWB2_WGM1_WGMXCC1_WGMXCCGn1
    SolutionIndex: 52
    SolutionNameMin: Cijk_Alik_Bljk_HHS_BH_Bias_AS_SAV_UserArgs_MT128x64x64_MI16x16x1_SN_LDSB1_CLR1_GSU0_GSUC0_GSUWGMRR0_K1_LBSPPA512_LBSPPB256_MIWT4_2_PLR1_SU0_SUM0_SUS128_VWA4_VWB2_WGM6_WGMXCC1_WGMXCCGn1
    SolutionIndex: 53
    SolutionNameMin: Cijk_Alik_Bljk_HHS_BH_Bias_AS_SAV_UserArgs_MT64x64x64_MI16x16x1_SN_LDSB1_CLR1_GSU0_GSUC0_GSUWGMRR0_K1_LBSPPA256_LBSPPB256_MIWT2_2_PLR1_SU0_SUM0_SUS128_VWA2_VWB2_WGM6_WGMXCC1_WGMXCCGn1
    SolutionIndex: 54
    SolutionNameMin: Cijk_Alik_Bljk_HHS_BH_Bias_AS_SAV_UserArgs_MT32x64x64_MI16x16x1_SN_LDSB0_CLR1_GSU0_GSUC0_GSUWGMRR0_K1_LBSPPA128_LBSPPB256_MIWT1_2_PLR1_SU0_SUM0_SUS128_VWA1_VWB2_WGM4_WGMXCC1_WGMXCCGn1
    SolutionIndex: 55
    SolutionNameMin: Cijk_Alik_Bljk_HHS_BH_Bias_AS_SAV_UserArgs_MT32x32x64_MI16x16x1_SN_LDSB0_CLR1_GSU0_GSUC0_GSUWGMRR0_K1_LBSPPA128_LBSPPB128_MIWT1_1_PLR1_SU0_SUM0_SUS128_VWA1_VWB1_WGM1_WGMXCC1_WGMXCCGn1
    SolutionIndex: 56
    SolutionNameMin: Cijk_Alik_Bljk_HHS_BH_Bias_AS_SAV_UserArgs_MT32x32x64_MI16x16x1_SN_LDSB0_CLR1_GSU0_GSUC0_GSUWGMRR0_K1_LBSPPA128_LBSPPB128_MIWT1_1_PLR1_SU0_SUM0_SUS128_VWA1_VWB1_WGM6_WGMXCC1_WGMXCCGn1
    SolutionIndex: 57
    SolutionNameMin: Cijk_Alik_Bljk_HHS_BH_Bias_AS_SAV_UserArgs_MT32x32x64_MI16x16x1_SN_LDSB0_CLR1_GSU0_GSUC0_GSUWGMRR0_K1_LBSPPA128_LBSPPB128_MIWT1_1_PLR1_SU0_SUM0_SUS128_VWA1_VWB1_WGM8_WGMXCC1_WGMXCCGn1
    SolutionIndex: 58
    SolutionNameMin: Cijk_Alik_Bljk_HHS_BH_Bias_AS_SAV_UserArgs_MT64x128x128_MI16x16x1_SN_LDSB1_CLR1_GSU0_GSUC0_GSUWGMRR0_K1_LBSPPA512_LBSPPB1024_MIWT2_4_PLR1_SU0_SUM0_SUS256_VWA2_VWB4_WGM1_WGMXCC1_WGMXCCGn1
    SolutionIndex: 59
    SolutionNameMin: Cijk_Alik_Bljk_HHS_BH_Bias_AS_SAV_UserArgs_MT64x128x128_MI16x16x1_SN_LDSB1_CLR1_GSU0_GSUC0_GSUWGMRR0_K1_LBSPPA512_LBSPPB1024_MIWT2_4_PLR1_SU0_SUM0_SUS256_VWA2_VWB4_WGM1_WGMXCC1_WGMXCCGn1
    SolutionIndex: 60
    SolutionNameMin: Cijk_Alik_Bljk_HHS_BH_Bias_AS_SAV_UserArgs_MT64x128x128_MI16x16x1_SN_LDSB1_CLR1_GSU0_GSUC0_GSUWGMRR0_K1_LBSPPA512_LBSPPB1024_MIWT2_4_PLR1_SU0_SUM0_SUS256_VWA2_VWB4_WGM4_WGMXCC1_WGMXCCGn1
    SolutionIndex: 61
    SolutionNameMin: Cijk_Alik_Bljk_HHS_BH_Bias_AS_SAV_UserArgs_MT64x128x128_MI16x16x1_SN_LDSB1_CLR1_GSU0_GSUC0_GSUWGMRR0_K1_LBSPPA512_LBSPPB1024_MIWT2_4_PLR1_SU0_SUM0_SUS256_VWA2_VWB4_WGM4_WGMXCC1_WGMXCCGn1
    SolutionIndex: 62
    SolutionNameMin: Cijk_Alik_Bljk_HHS_BH_Bias_AS_SAV_UserArgs_MT64x128x128_MI16x16x1_SN_LDSB1_CLR1_GSU0_GSUC0_GSUWGMRR0_K1_LBSPPA512_LBSPPB1024_MIWT2_4_PLR1_SU0_SUM0_SUS256_VWA2_VWB4_WGM6_WGMXCC1_WGMXCCGn1
    SolutionIndex: 63
    SolutionNameMin: Cijk_Alik_Bljk_HHS_BH_Bias_AS_SAV_UserArgs_MT64x128x128_MI16x16x1_SN_LDSB1_CLR1_GSU0_GSUC0_GSUWGMRR0_K1_LBSPPA512_LBSPPB1024_MIWT2_4_PLR1_SU0_SUM0_SUS256_VWA2_VWB4_WGM8_WGMXCC1_WGMXCCGn1
    SolutionIndex: 64
    SolutionNameMin: Cijk_Alik_Bljk_HHS_BH_Bias_AS_SAV_UserArgs_MT128x64x128_MI16x16x1_SN_LDSB1_CLR1_GSU0_GSUC0_GSUWGMRR0_K1_LBSPPA1024_LBSPPB512_MIWT4_2_PLR1_SU0_SUM0_SUS256_VWA4_VWB2_WGM1_WGMXCC1_WGMXCCGn1
    SolutionIndex: 65
    SolutionNameMin: Cijk_Alik_Bljk_HHS_BH_Bias_AS_SAV_UserArgs_MT128x64x128_MI16x16x1_SN_LDSB1_CLR1_GSU0_GSUC0_GSUWGMRR0_K1_LBSPPA1024_LBSPPB512_MIWT4_2_PLR1_SU0_SUM0_SUS256_VWA4_VWB2_WGM1_WGMXCC1_WGMXCCGn1
    SolutionIndex: 66
    SolutionNameMin: Cijk_Alik_Bljk_HHS_BH_Bias_AS_SAV_UserArgs_MT128x64x128_MI16x16x1_SN_LDSB1_CLR1_GSU0_GSUC0_GSUWGMRR0_K1_LBSPPA1024_LBSPPB512_MIWT4_2_PLR1_SU0_SUM0_SUS256_VWA4_VWB2_WGM4_WGMXCC1_WGMXCCGn1
    SolutionIndex: 67
    SolutionNameMin: Cijk_Alik_Bljk_HHS_BH_Bias_AS_SAV_UserArgs_MT128x64x128_MI16x16x1_SN_LDSB1_CLR1_GSU0_GSUC0_GSUWGMRR0_K1_LBSPPA1024_LBSPPB512_MIWT4_2_PLR1_SU0_SUM0_SUS256_VWA4_VWB2_WGM6_WGMXCC1_WGMXCCGn1
    SolutionIndex: 68
    SolutionNameMin: Cijk_Alik_Bljk_HHS_BH_Bias_AS_SAV_UserArgs_MT128x64x128_MI16x16x1_SN_LDSB1_CLR1_GSU0_GSUC0_GSUWGMRR0_K1_LBSPPA1024_LBSPPB512_MIWT4_2_PLR1_SU0_SUM0_SUS256_VWA4_VWB2_WGM6_WGMXCC1_WGMXCCGn1
    SolutionIndex: 69
    SolutionNameMin: Cijk_Alik_Bljk_HHS_BH_Bias_AS_SAV_UserArgs_MT128x64x128_MI16x16x1_SN_LDSB1_CLR1_GSU0_GSUC0_GSUWGMRR0_K1_LBSPPA1024_LBSPPB512_MIWT4_2_PLR1_SU0_SUM0_SUS256_VWA4_VWB2_WGM8_WGMXCC1_WGMXCCGn1
    SolutionIndex: 70
    SolutionNameMin: Cijk_Alik_Bljk_HHS_BH_Bias_AS_SAV_UserArgs_MT64x64x128_MI16x16x1_SN_LDSB1_CLR1_GSU0_GSUC0_GSUWGMRR0_K1_LBSPPA512_LBSPPB512_MIWT2_2_PLR1_SU0_SUM0_SUS256_VWA2_VWB2_WGM1_WGMXCC1_WGMXCCGn1
    SolutionIndex: 71
    SolutionNameMin: Cijk_Alik_Bljk_HHS_BH_Bias_AS_SAV_UserArgs_MT64x64x128_MI16x16x1_SN_LDSB1_CLR1_GSU0_GSUC0_GSUWGMRR0_K1_LBSPPA512_LBSPPB512_MIWT2_2_PLR1_SU0_SUM0_SUS256_VWA2_VWB2_WGM4_WGMXCC1_WGMXCCGn1
    SolutionIndex: 72
    SolutionNameMin: Cijk_Alik_Bljk_HHS_BH_Bias_AS_SAV_UserArgs_MT64x64x128_MI16x16x1_SN_LDSB1_CLR1_GSU0_GSUC0_GSUWGMRR0_K1_LBSPPA512_LBSPPB512_MIWT2_2_PLR1_SU0_SUM0_SUS256_VWA2_VWB2_WGM4_WGMXCC1_WGMXCCGn1
    SolutionIndex: 73
    SolutionNameMin: Cijk_Alik_Bljk_HHS_BH_Bias_AS_SAV_UserArgs_MT64x64x128_MI16x16x1_SN_LDSB1_CLR1_GSU0_GSUC0_GSUWGMRR0_K1_LBSPPA512_LBSPPB512_MIWT2_2_PLR1_SU0_SUM0_SUS256_VWA2_VWB2_WGM6_WGMXCC1_WGMXCCGn1
    SolutionIndex: 74
    SolutionNameMin: Cijk_Alik_Bljk_HHS_BH_Bias_AS_SAV_UserArgs_MT64x64x128_MI16x16x1_SN_LDSB1_CLR1_GSU0_GSUC0_GSUWGMRR0_K1_LBSPPA512_LBSPPB512_MIWT2_2_PLR1_SU0_SUM0_SUS256_VWA2_VWB2_WGM6_WGMXCC1_WGMXCCGn1
    SolutionIndex: 75
    SolutionNameMin: Cijk_Alik_Bljk_HHS_BH_Bias_AS_SAV_UserArgs_MT64x64x128_MI16x16x1_SN_LDSB1_CLR1_GSU0_GSUC0_GSUWGMRR0_K1_LBSPPA512_LBSPPB512_MIWT2_2_PLR1_SU0_SUM0_SUS256_VWA2_VWB2_WGM8_WGMXCC1_WGMXCCGn1
    SolutionIndex: 76
    SolutionNameMin: Cijk_Alik_Bljk_HHS_BH_Bias_AS_SAV_UserArgs_MT64x64x128_MI16x16x1_SN_LDSB1_CLR1_GSU0_GSUC0_GSUWGMRR0_K1_LBSPPA512_LBSPPB512_MIWT2_2_PLR1_SU0_SUM0_SUS256_VWA2_VWB2_WGM8_WGMXCC1_WGMXCCGn1
    SolutionIndex: 77
    SolutionNameMin: Cijk_Alik_Bljk_HHS_BH_Bias_AS_SAV_UserArgs_MT32x64x128_MI16x16x1_SN_LDSB1_CLR1_GSU0_GSUC0_GSUWGMRR0_K1_LBSPPA256_LBSPPB512_MIWT1_2_PLR1_SU0_SUM0_SUS256_VWA1_VWB2_WGM1_WGMXCC1_WGMXCCGn1
    SolutionIndex: 78
    SolutionNameMin: Cijk_Alik_Bljk_HHS_BH_Bias_AS_SAV_UserArgs_MT32x64x128_MI16x16x1_SN_LDSB1_CLR1_GSU0_GSUC0_GSUWGMRR0_K1_LBSPPA256_LBSPPB512_MIWT1_2_PLR1_SU0_SUM0_SUS256_VWA1_VWB2_WGM1_WGMXCC1_WGMXCCGn1
    SolutionIndex: 79
    SolutionNameMin: Cijk_Alik_Bljk_HHS_BH_Bias_AS_SAV_UserArgs_MT32x64x128_MI16x16x1_SN_LDSB1_CLR1_GSU0_GSUC0_GSUWGMRR0_K1_LBSPPA256_LBSPPB512_MIWT1_2_PLR1_SU0_SUM0_SUS256_VWA1_VWB2_WGM1_WGMXCC1_WGMXCCGn1
    SolutionIndex: 80
    SolutionNameMin: Cijk_Alik_Bljk_HHS_BH_Bias_AS_SAV_UserArgs_MT32x64x128_MI16x16x1_SN_LDSB1_CLR1_GSU0_GSUC0_GSUWGMRR0_K1_LBSPPA256_LBSPPB512_MIWT1_2_PLR1_SU0_SUM0_SUS256_VWA1_VWB2_WGM4_WGMXCC1_WGMXCCGn1
    SolutionIndex: 81
    SolutionNameMin: Cijk_Alik_Bljk_HHS_BH_Bias_AS_SAV_UserArgs_MT32x64x128_MI16x16x1_SN_LDSB1_CLR1_GSU0_GSUC0_GSUWGMRR0_K1_LBSPPA256_LBSPPB512_MIWT1_2_PLR1_SU0_SUM0_SUS256_VWA1_VWB2_WGM4_WGMXCC1_WGMXCCGn1
    SolutionIndex: 82
    SolutionNameMin: Cijk_Alik_Bljk_HHS_BH_Bias_AS_SAV_UserArgs_MT32x64x128_MI16x16x1_SN_LDSB1_CLR1_GSU0_GSUC0_GSUWGMRR0_K1_LBSPPA256_LBSPPB512_MIWT1_2_PLR1_SU0_SUM0_SUS256_VWA1_VWB2_WGM4_WGMXCC1_WGMXCCGn1
    SolutionIndex: 83
    SolutionNameMin: Cijk_Alik_Bljk_HHS_BH_Bias_AS_SAV_UserArgs_MT32x64x128_MI16x16x1_SN_LDSB1_CLR1_GSU0_GSUC0_GSUWGMRR0_K1_LBSPPA256_LBSPPB512_MIWT1_2_PLR1_SU0_SUM0_SUS256_VWA1_VWB2_WGM6_WGMXCC1_WGMXCCGn1
    SolutionIndex: 84
    SolutionNameMin: Cijk_Alik_Bljk_HHS_BH_Bias_AS_SAV_UserArgs_MT32x64x128_MI16x16x1_SN_LDSB1_CLR1_GSU0_GSUC0_GSUWGMRR0_K1_LBSPPA256_LBSPPB512_MIWT1_2_PLR1_SU0_SUM0_SUS256_VWA1_VWB2_WGM6_WGMXCC1_WGMXCCGn1
    SolutionIndex: 85
    SolutionNameMin: Cijk_Alik_Bljk_HHS_BH_Bias_AS_SAV_UserArgs_MT32x64x128_MI16x16x1_SN_LDSB1_CLR1_GSU0_GSUC0_GSUWGMRR0_K1_LBSPPA256_LBSPPB512_MIWT1_2_PLR1_SU0_SUM0_SUS256_VWA1_VWB2_WGM8_WGMXCC1_WGMXCCGn1
    SolutionIndex: 86
    SolutionNameMin: Cijk_Alik_Bljk_HHS_BH_Bias_AS_SAV_UserArgs_MT32x64x128_MI16x16x1_SN_LDSB1_CLR1_GSU0_GSUC0_GSUWGMRR0_K1_LBSPPA256_LBSPPB512_MIWT1_2_PLR1_SU0_SUM0_SUS256_VWA1_VWB2_WGM8_WGMXCC1_WGMXCCGn1
    SolutionIndex: 87
    SolutionNameMin: Cijk_Alik_Bljk_HHS_BH_Bias_AS_SAV_UserArgs_MT32x64x128_MI16x16x1_SN_LDSB1_CLR1_GSU0_GSUC0_GSUWGMRR0_K1_LBSPPA256_LBSPPB512_MIWT1_2_PLR1_SU0_SUM0_SUS256_VWA1_VWB2_WGM8_WGMXCC1_WGMXCCGn1
    SolutionIndex: 88
    SolutionNameMin: Cijk_Alik_Bljk_HHS_BH_Bias_AS_SAV_UserArgs_MT64x32x128_MI16x16x1_SN_LDSB1_CLR1_GSU0_GSUC0_GSUWGMRR0_K1_LBSPPA512_LBSPPB256_MIWT2_1_PLR1_SU0_SUM0_SUS256_VWA2_VWB1_WGM1_WGMXCC1_WGMXCCGn1
    SolutionIndex: 89
    SolutionNameMin: Cijk_Alik_Bljk_HHS_BH_Bias_AS_SAV_UserArgs_MT64x32x128_MI16x16x1_SN_LDSB1_CLR1_GSU0_GSUC0_GSUWGMRR0_K1_LBSPPA512_LBSPPB256_MIWT2_1_PLR1_SU0_SUM0_SUS256_VWA2_VWB1_WGM1_WGMXCC1_WGMXCCGn1
    SolutionIndex: 90
    SolutionNameMin: Cijk_Alik_Bljk_HHS_BH_Bias_AS_SAV_UserArgs_MT64x32x128_MI16x16x1_SN_LDSB1_CLR1_GSU0_GSUC0_GSUWGMRR0_K1_LBSPPA512_LBSPPB256_MIWT2_1_PLR1_SU0_SUM0_SUS256_VWA2_VWB1_WGM4_WGMXCC1_WGMXCCGn1
    SolutionIndex: 91
    SolutionNameMin: Cijk_Alik_Bljk_HHS_BH_Bias_AS_SAV_UserArgs_MT64x32x128_MI16x16x1_SN_LDSB1_CLR1_GSU0_GSUC0_GSUWGMRR0_K1_LBSPPA512_LBSPPB256_MIWT2_1_PLR1_SU0_SUM0_SUS256_VWA2_VWB1_WGM4_WGMXCC1_WGMXCCGn1
    SolutionIndex: 92
    SolutionNameMin: Cijk_Alik_Bljk_HHS_BH_Bias_AS_SAV_UserArgs_MT32x32x128_MI16x16x1_SN_LDSB1_CLR1_GSU0_GSUC0_GSUWGMRR0_K1_LBSPPA256_LBSPPB256_MIWT1_1_PLR1_SU0_SUM0_SUS256_VWA1_VWB1_WGM1_WGMXCC1_WGMXCCGn1
    SolutionIndex: 93
    SolutionNameMin: Cijk_Alik_Bljk_HHS_BH_Bias_AS_SAV_UserArgs_MT32x32x128_MI16x16x1_SN_LDSB1_CLR1_GSU0_GSUC0_GSUWGMRR0_K1_LBSPPA256_LBSPPB256_MIWT1_1_PLR1_SU0_SUM0_SUS256_VWA1_VWB1_WGM1_WGMXCC1_WGMXCCGn1
    SolutionIndex: 94
    SolutionNameMin: Cijk_Alik_Bljk_HHS_BH_Bias_AS_SAV_UserArgs_MT32x32x128_MI16x16x1_SN_LDSB1_CLR1_GSU0_GSUC0_GSUWGMRR0_K1_LBSPPA256_LBSPPB256_MIWT1_1_PLR1_SU0_SUM0_SUS256_VWA1_VWB1_WGM1_WGMXCC1_WGMXCCGn1
    SolutionIndex: 95
    SolutionNameMin: Cijk_Alik_Bljk_HHS_BH_Bias_AS_SAV_UserArgs_MT32x32x128_MI16x16x1_SN_LDSB1_CLR1_GSU0_GSUC0_GSUWGMRR0_K1_LBSPPA256_LBSPPB256_MIWT1_1_PLR1_SU0_SUM0_SUS256_VWA1_VWB1_WGM1_WGMXCC1_WGMXCCGn1
    SolutionIndex: 96
    SolutionNameMin: Cijk_Alik_Bljk_HHS_BH_Bias_AS_SAV_UserArgs_MT32x32x128_MI16x16x1_SN_LDSB1_CLR1_GSU0_GSUC0_GSUWGMRR0_K1_LBSPPA256_LBSPPB256_MIWT1_1_PLR1_SU0_SUM0_SUS256_VWA1_VWB1_WGM4_WGMXCC1_WGMXCCGn1
    SolutionIndex: 97
    SolutionNameMin: Cijk_Alik_Bljk_HHS_BH_Bias_AS_SAV_UserArgs_MT32x32x128_MI16x16x1_SN_LDSB1_CLR1_GSU0_GSUC0_GSUWGMRR0_K1_LBSPPA256_LBSPPB256_MIWT1_1_PLR1_SU0_SUM0_SUS256_VWA1_VWB1_WGM4_WGMXCC1_WGMXCCGn1
    SolutionIndex: 98
    SolutionNameMin: Cijk_Alik_Bljk_HHS_BH_Bias_AS_SAV_UserArgs_MT32x32x128_MI16x16x1_SN_LDSB1_CLR1_GSU0_GSUC0_GSUWGMRR0_K1_LBSPPA256_LBSPPB256_MIWT1_1_PLR1_SU0_SUM0_SUS256_VWA1_VWB1_WGM4_WGMXCC1_WGMXCCGn1
    SolutionIndex: 99
    SolutionNameMin: Cijk_Alik_Bljk_HHS_BH_Bias_AS_SAV_UserArgs_MT32x32x128_MI16x16x1_SN_LDSB1_CLR1_GSU0_GSUC0_GSUWGMRR0_K1_LBSPPA256_LBSPPB256_MIWT1_1_PLR1_SU0_SUM0_SUS256_VWA1_VWB1_WGM6_WGMXCC1_WGMXCCGn1
    SolutionIndex: 100
    SolutionNameMin: Cijk_Alik_Bljk_HHS_BH_Bias_AS_SAV_UserArgs_MT32x32x128_MI16x16x1_SN_LDSB1_CLR1_GSU0_GSUC0_GSUWGMRR0_K1_LBSPPA256_LBSPPB256_MIWT1_1_PLR1_SU0_SUM0_SUS256_VWA1_VWB1_WGM6_WGMXCC1_WGMXCCGn1
    SolutionIndex: 101
    SolutionNameMin: Cijk_Alik_Bljk_HHS_BH_Bias_AS_SAV_UserArgs_MT32x32x128_MI16x16x1_SN_LDSB1_CLR1_GSU0_GSUC0_GSUWGMRR0_K1_LBSPPA256_LBSPPB256_MIWT1_1_PLR1_SU0_SUM0_SUS256_VWA1_VWB1_WGM8_WGMXCC1_WGMXCCGn1
    SolutionIndex: 102
    SolutionNameMin: Cijk_Alik_Bljk_HHS_BH_Bias_AS_SAV_UserArgs_MT32x32x128_MI16x16x1_SN_LDSB1_CLR1_GSU0_GSUC0_GSUWGMRR0_K1_LBSPPA256_LBSPPB256_MIWT1_1_PLR1_SU0_SUM0_SUS256_VWA1_VWB1_WGM8_WGMXCC1_WGMXCCGn1
    SolutionIndex: 103
    SolutionNameMin: Cijk_Alik_Bljk_HHS_BH_Bias_AS_SAV_UserArgs_MT32x64x32_MI16x16x1_SN_LDSB0_CLR0_GSU0_GSUC0_GSUWGMRR0_K1_LBSPPA128_LBSPPB128_MIWT1_2_PLR0_SU0_SUM0_SUS64_VWA1_VWB2_WGM8_WGMXCC1_WGMXCCGn1
- - - [128, 128, 1, 128, 128, 128, 128, 128]
    - [95, 0.49]
  - - [128, 128, 1, 256, 128, 128, 256, 256]
    - [95, 0.86]
  - - [128, 128, 1, 512, 128, 128, 512, 512]
    - [95, 1.48]
  - - [128, 128, 1, 1024, 128, 128, 1024, 1024]
    - [95, 2.36]
  - - [128, 128, 1, 2048, 128, 128, 2048, 2048]
    - [92, 3.12]
  - - [128, 128, 1, 4096, 128, 128, 4096, 4096]
    - [92, 3.93]
  - - [128, 128, 1, 8192, 128, 128, 8192, 8192]
    - [92, 4.59]
  - - [128, 256, 1, 128, 128, 128, 128, 128]
    - [95, 1.0]
  - - [128, 256, 1, 256, 128, 128, 256, 256]
    - [95, 1.77]
  - - [128, 256, 1, 512, 128, 128, 512, 512]
    - [95, 2.97]
  - - [128, 256, 1, 1024, 128, 128, 1024, 1024]
    - [95, 4.58]
  - - [128, 256, 1, 2048, 128, 128, 2048, 2048]
    - [92, 6.21]
  - - [128, 256, 1, 4096, 128, 128, 4096, 4096]
    - [92, 7.78]
  - - [128, 256, 1, 8192, 128, 128, 8192, 8192]
    - [99, 8.92]
  - - [128, 512, 1, 128, 128, 128, 128, 128]
    - [95, 1.93]
  - - [128, 512, 1, 256, 128, 128, 256, 256]
    - [95, 3.46]
  - - [128, 512, 1, 512, 128, 128, 512, 512]
    - [95, 5.96]
  - - [128, 512, 1, 1024, 128, 128, 1024, 1024]
    - [95, 8.84]
  - - [128, 512, 1, 2048, 128, 128, 2048, 2048]
    - [92, 12.09]
  - - [128, 512, 1, 4096, 128, 128, 4096, 4096]
    - [92, 15.13]
  - - [128, 512, 1, 8192, 128, 128, 8192, 8192]
    - [95, 17.61]
  - - [128, 1024, 1, 128, 128, 128, 128, 128]
    - [95, 3.86]
  - - [128, 1024, 1, 256, 128, 128, 256, 256]
    - [95, 6.87]
  - - [128, 1024, 1, 512, 128, 128, 512, 512]
    - [95, 11.65]
  - - [128, 1024, 1, 1024, 128, 128, 1024, 1024]
    - [95, 17.55]
  - - [128, 1024, 1, 2048, 128, 128, 2048, 2048]
    - [93, 23.55]
  - - [128, 1024, 1, 4096, 128, 128, 4096, 4096]
    - [92, 29.37]
  - - [128, 1024, 1, 8192, 128, 128, 8192, 8192]
    - [95, 35.25]
  - - [128, 2048, 1, 128, 128, 128, 128, 128]
    - [79, 6.93]
  - - [128, 2048, 1, 256, 128, 128, 256, 256]
    - [89, 11.67]
  - - [128, 2048, 1, 512, 128, 128, 512, 512]
    - [89, 19.46]
  - - [128, 2048, 1, 1024, 128, 128, 1024, 1024]
    - [89, 28.82]
  - - [128, 2048, 1, 2048, 128, 128, 2048, 2048]
    - [77, 38.02]
  - - [128, 2048, 1, 4096, 128, 128, 4096, 4096]
    - [77, 47.58]
  - - [128, 2048, 1, 8192, 128, 128, 8192, 8192]
    - [90, 53.66]
  - - [128, 4096, 1, 128, 128, 128, 128, 128]
    - [70, 12.07]
  - - [128, 4096, 1, 256, 128, 128, 256, 256]
    - [70, 19.72]
  - - [128, 4096, 1, 512, 128, 128, 512, 512]
    - [70, 32.84]
  - - [128, 4096, 1, 1024, 128, 128, 1024, 1024]
    - [70, 47.3]
  - - [128, 4096, 1, 2048, 128, 128, 2048, 2048]
    - [70, 62.41]
  - - [128, 4096, 1, 4096, 128, 128, 4096, 4096]
    - [70, 69.58]
  - - [128, 4096, 1, 8192, 128, 128, 8192, 8192]
    - [72, 78.54]
  - - [128, 8192, 1, 128, 128, 128, 128, 128]
    - [65, 19.63]
  - - [128, 8192, 1, 256, 128, 128, 256, 256]
    - [65, 31.38]
  - - [128, 8192, 1, 512, 128, 128, 512, 512]
    - [65, 48.96]
  - - [128, 8192, 1, 1024, 128, 128, 1024, 1024]
    - [59, 66.94]
  - - [128, 8192, 1, 2048, 128, 128, 2048, 2048]
    - [59, 75.1]
  - - [128, 8192, 1, 4096, 128, 128, 4096, 4096]
    - [59, 88.52]
  - - [128, 8192, 1, 8192, 128, 128, 8192, 8192]
    - [62, 88.3]
  - - [256, 128, 1, 128, 256, 256, 128, 128]
    - [92, 0.93]
  - - [256, 128, 1, 256, 256, 256, 256, 256]
    - [95, 1.68]
  - - [256, 128, 1, 512, 256, 256, 512, 512]
    - [95, 2.86]
  - - [256, 128, 1, 1024, 256, 256, 1024, 1024]
    - [95, 4.52]
  - - [256, 128, 1, 2048, 256, 256, 2048, 2048]
    - [92, 6.09]
  - - [256, 128, 1, 4096, 256, 256, 4096, 4096]
    - [92, 7.78]
  - - [256, 128, 1, 8192, 256, 256, 8192, 8192]
    - [92, 8.96]
  - - [256, 256, 1, 128, 256, 256, 128, 128]
    - [95, 1.96]
  - - [256, 256, 1, 256, 256, 256, 256, 256]
    - [94, 3.38]
  - - [256, 256, 1, 512, 256, 256, 512, 512]
    - [95, 5.79]
  - - [256, 256, 1, 1024, 256, 256, 1024, 1024]
    - [95, 8.88]
  - - [256, 256, 1, 2048, 256, 256, 2048, 2048]
    - [92, 12.03]
  - - [256, 256, 1, 4096, 256, 256, 4096, 4096]
    - [97, 15.23]
  - - [256, 256, 1, 8192, 256, 256, 8192, 8192]
    - [100, 17.8]
  - - [256, 512, 1, 128, 256, 256, 128, 128]
    - [94, 3.84]
  - - [256, 512, 1, 256, 256, 256, 256, 256]
    - [95, 6.94]
  - - [256, 512, 1, 512, 256, 256, 512, 512]
    - [95, 11.41]
  - - [256, 512, 1, 1024, 256, 256, 1024, 1024]
    - [95, 17.68]
  - - [256, 512, 1, 2048, 256, 256, 2048, 2048]
    - [92, 23.73]
  - - [256, 512, 1, 4096, 256, 256, 4096, 4096]
    - [92, 29.84]
  - - [256, 512, 1, 8192, 256, 256, 8192, 8192]
    - [100, 35.46]
  - - [256, 1024, 1, 128, 256, 256, 128, 128]
    - [89, 7.14]
  - - [256, 1024, 1, 256, 256, 256, 256, 256]
    - [89, 12.1]
  - - [256, 1024, 1, 512, 256, 256, 512, 512]
    - [89, 19.82]
  - - [256, 1024, 1, 1024, 256, 256, 1024, 1024]
    - [89, 29.91]
  - - [256, 1024, 1, 2048, 256, 256, 2048, 2048]
    - [78, 39.2]
  - - [256, 1024, 1, 4096, 256, 256, 4096, 4096]
    - [95, 49.67]
  - - [256, 1024, 1, 8192, 256, 256, 8192, 8192]
    - [79, 57.12]
  - - [256, 2048, 1, 128, 256, 256, 128, 128]
    - [70, 12.36]
  - - [256, 2048, 1, 256, 256, 256, 256, 256]
    - [70, 20.92]
  - - [256, 2048, 1, 512, 256, 256, 512, 512]
    - [70, 34.39]
  - - [256, 2048, 1, 1024, 256, 256, 1024, 1024]
    - [72, 49.38]
  - - [256, 2048, 1, 2048, 256, 256, 2048, 2048]
    - [70, 65.61]
  - - [256, 2048, 1, 4096, 256, 256, 4096, 4096]
    - [70, 78.71]
  - - [256, 2048, 1, 8192, 256, 256, 8192, 8192]
    - [70, 85.76]
  - - [256, 4096, 1, 128, 256, 256, 128, 128]
    - [64, 19.79]
  - - [256, 4096, 1, 256, 256, 256, 256, 256]
    - [65, 32.02]
  - - [256, 4096, 1, 512, 256, 256, 512, 512]
    - [65, 51.08]
  - - [256, 4096, 1, 1024, 256, 256, 1024, 1024]
    - [59, 69.63]
  - - [256, 4096, 1, 2048, 256, 256, 2048, 2048]
    - [58, 85.78]
  - - [256, 4096, 1, 4096, 256, 256, 4096, 4096]
    - [59, 94.52]
  - - [256, 4096, 1, 8192, 256, 256, 8192, 8192]
    - [65, 98.85]
  - - [256, 8192, 1, 128, 256, 256, 128, 128]
    - [40, 29.49]
  - - [256, 8192, 1, 256, 256, 256, 256, 256]
    - [40, 44.91]
  - - [256, 8192, 1, 512, 256, 256, 512, 512]
    - [40, 63.98]
  - - [256, 8192, 1, 1024, 256, 256, 1024, 1024]
    - [65, 81.87]
  - - [256, 8192, 1, 2048, 256, 256, 2048, 2048]
    - [49, 96.69]
  - - [256, 8192, 1, 4096, 256, 256, 4096, 4096]
    - [65, 117.28]
  - - [256, 8192, 1, 8192, 256, 256, 8192, 8192]
    - [65, 110.64]
  - - [512, 128, 1, 128, 512, 512, 128, 128]
    - [55, 1.89]
  - - [512, 128, 1, 256, 512, 512, 256, 256]
    - [95, 3.45]
  - - [512, 128, 1, 512, 512, 512, 512, 512]
    - [98, 5.73]
  - - [512, 128, 1, 1024, 512, 512, 1024, 1024]
    - [95, 8.79]
  - - [512, 128, 1, 2048, 512, 512, 2048, 2048]
    - [93, 11.86]
  - - [512, 128, 1, 4096, 512, 512, 4096, 4096]
    - [92, 15.06]
  - - [512, 128, 1, 8192, 512, 512, 8192, 8192]
    - [102, 17.6]
  - - [512, 256, 1, 128, 512, 512, 128, 128]
    - [93, 3.69]
  - - [512, 256, 1, 256, 512, 512, 256, 256]
    - [100, 6.55]
  - - [512, 256, 1, 512, 512, 512, 512, 512]
    - [95, 11.24]
  - - [512, 256, 1, 1024, 512, 512, 1024, 1024]
    - [100, 17.29]
  - - [512, 256, 1, 2048, 512, 512, 2048, 2048]
    - [96, 23.38]
  - - [512, 256, 1, 4096, 512, 512, 4096, 4096]
    - [96, 29.64]
  - - [512, 256, 1, 8192, 512, 512, 8192, 8192]
    - [98, 35.78]
  - - [512, 512, 1, 128, 512, 512, 128, 128]
    - [89, 6.95]
  - - [512, 512, 1, 256, 512, 512, 256, 256]
    - [88, 11.84]
  - - [512, 512, 1, 512, 512, 512, 512, 512]
    - [89, 19.89]
  - - [512, 512, 1, 1024, 512, 512, 1024, 1024]
    - [89, 29.85]
  - - [512, 512, 1, 2048, 512, 512, 2048, 2048]
    - [78, 39.16]
  - - [512, 512, 1, 4096, 512, 512, 4096, 4096]
    - [102, 49.32]
  - - [512, 512, 1, 8192, 512, 512, 8192, 8192]
    - [81, 57.23]
  - - [512, 1024, 1, 128, 512, 512, 128, 128]
    - [70, 12.19]
  - - [512, 1024, 1, 256, 512, 512, 256, 256]
    - [70, 20.38]
  - - [512, 1024, 1, 512, 512, 512, 512, 512]
    - [70, 33.92]
  - - [512, 1024, 1, 1024, 512, 512, 1024, 1024]
    - [70, 51.07]
  - - [512, 1024, 1, 2048, 512, 512, 2048, 2048]
    - [70, 66.48]
  - - [512, 1024, 1, 4096, 512, 512, 4096, 4096]
    - [70, 78.72]
  - - [512, 1024, 1, 8192, 512, 512, 8192, 8192]
    - [74, 90.23]
  - - [512, 2048, 1, 128, 512, 512, 128, 128]
    - [65, 19.43]
  - - [512, 2048, 1, 256, 512, 512, 256, 256]
    - [65, 31.65]
  - - [512, 2048, 1, 512, 512, 512, 512, 512]
    - [65, 51.0]
  - - [512, 2048, 1, 1024, 512, 512, 1024, 1024]
    - [65, 70.53]
  - - [512, 2048, 1, 2048, 512, 512, 2048, 2048]
    - [59, 86.83]
  - - [512, 2048, 1, 4096, 512, 512, 4096, 4096]
    - [65, 102.77]
  - - [512, 2048, 1, 8192, 512, 512, 8192, 8192]
    - [59, 100.97]
  - - [512, 4096, 1, 128, 512, 512, 128, 128]
    - [40, 29.24]
  - - [512, 4096, 1, 256, 512, 512, 256, 256]
    - [40, 45.9]
  - - [512, 4096, 1, 512, 512, 512, 512, 512]
    - [40, 65.96]
  - - [512, 4096, 1, 1024, 512, 512, 1024, 1024]
    - [65, 84.36]
  - - [512, 4096, 1, 2048, 512, 512, 2048, 2048]
    - [50, 102.37]
  - - [512, 4096, 1, 4096, 512, 512, 4096, 4096]
    - [66, 100.71]
  - - [512, 4096, 1, 8192, 512, 512, 8192, 8192]
    - [40, 106.96]
  - - [512, 8192, 1, 128, 512, 512, 128, 128]
    - [14, 40.28]
  - - [512, 8192, 1, 256, 512, 512, 256, 256]
    - [31, 61.8]
  - - [512, 8192, 1, 512, 512, 512, 512, 512]
    - [35, 84.1]
  - - [512, 8192, 1, 1024, 512, 512, 1024, 1024]
    - [36, 101.61]
  - - [512, 8192, 1, 2048, 512, 512, 2048, 2048]
    - [40, 120.26]
  - - [512, 8192, 1, 4096, 512, 512, 4096, 4096]
    - [38, 121.21]
  - - [512, 8192, 1, 8192, 512, 512, 8192, 8192]
    - [11, 128.15]
  - - [1024, 128, 1, 128, 1024, 1024, 128, 128]
    - [67, 2.52]
  - - [1024, 128, 1, 256, 1024, 1024, 256, 256]
    - [56, 4.83]
  - - [1024, 128, 1, 512, 1024, 1024, 512, 512]
    - [57, 8.73]
  - - [1024, 128, 1, 1024, 1024, 1024, 1024, 1024]
    - [96, 16.34]
  - - [1024, 128, 1, 2048, 1024, 1024, 2048, 2048]
    - [100, 23.1]
  - - [1024, 128, 1, 4096, 1024, 1024, 4096, 4096]
    - [101, 29.07]
  - - [1024, 128, 1, 8192, 1024, 1024, 8192, 8192]
    - [101, 35.2]
  - - [1024, 256, 1, 128, 1024, 1024, 128, 128]
    - [53, 5.02]
  - - [1024, 256, 1, 256, 1024, 1024, 256, 256]
    - [54, 8.99]
  - - [1024, 256, 1, 512, 1024, 1024, 512, 512]
    - [79, 19.53]
  - - [1024, 256, 1, 1024, 1024, 1024, 1024, 1024]
    - [91, 29.48]
  - - [1024, 256, 1, 2048, 1024, 1024, 2048, 2048]
    - [84, 39.03]
  - - [1024, 256, 1, 4096, 1024, 1024, 4096, 4096]
    - [102, 48.73]
  - - [1024, 256, 1, 8192, 1024, 1024, 8192, 8192]
    - [82, 57.54]
  - - [1024, 512, 1, 128, 1024, 1024, 128, 128]
    - [70, 11.7]
  - - [1024, 512, 1, 256, 1024, 1024, 256, 256]
    - [76, 20.25]
  - - [1024, 512, 1, 512, 1024, 1024, 512, 512]
    - [72, 34.49]
  - - [1024, 512, 1, 1024, 1024, 1024, 1024, 1024]
    - [74, 50.33]
  - - [1024, 512, 1, 2048, 1024, 1024, 2048, 2048]
    - [72, 66.0]
  - - [1024, 512, 1, 4096, 1024, 1024, 4096, 4096]
    - [72, 79.86]
  - - [1024, 512, 1, 8192, 1024, 1024, 8192, 8192]
    - [72, 89.93]
  - - [1024, 1024, 1, 128, 1024, 1024, 128, 128]
    - [68, 19.4]
  - - [1024, 1024, 1, 256, 1024, 1024, 256, 256]
    - [68, 31.68]
  - - [1024, 1024, 1, 512, 1024, 1024, 512, 512]
    - [69, 51.16]
  - - [1024, 1024, 1, 1024, 1024, 1024, 1024, 1024]
    - [69, 70.79]
  - - [1024, 1024, 1, 2048, 1024, 1024, 2048, 2048]
    - [61, 87.77]
  - - [1024, 1024, 1, 4096, 1024, 1024, 4096, 4096]
    - [61, 104.11]
  - - [1024, 1024, 1, 8192, 1024, 1024, 8192, 8192]
    - [65, 102.55]
  - - [1024, 2048, 1, 128, 1024, 1024, 128, 128]
    - [39, 30.07]
  - - [1024, 2048, 1, 256, 1024, 1024, 256, 256]
    - [40, 47.68]
  - - [1024, 2048, 1, 512, 1024, 1024, 512, 512]
    - [43, 67.08]
  - - [1024, 2048, 1, 1024, 1024, 1024, 1024, 1024]
    - [65, 84.88]
  - - [1024, 2048, 1, 2048, 1024, 1024, 2048, 2048]
    - [45, 101.17]
  - - [1024, 2048, 1, 4096, 1024, 1024, 4096, 4096]
    - [40, 104.21]
  - - [1024, 2048, 1, 8192, 1024, 1024, 8192, 8192]
    - [41, 106.74]
  - - [1024, 4096, 1, 128, 1024, 1024, 128, 128]
    - [18, 41.7]
  - - [1024, 4096, 1, 256, 1024, 1024, 256, 256]
    - [31, 62.36]
  - - [1024, 4096, 1, 512, 1024, 1024, 512, 512]
    - [31, 87.46]
  - - [1024, 4096, 1, 1024, 1024, 1024, 1024, 1024]
    - [30, 105.83]
  - - [1024, 4096, 1, 2048, 1024, 1024, 2048, 2048]
    - [40, 121.32]
  - - [1024, 4096, 1, 4096, 1024, 1024, 4096, 4096]
    - [31, 119.69]
  - - [1024, 4096, 1, 8192, 1024, 1024, 8192, 8192]
    - [10, 128.48]
  - - [1024, 8192, 1, 128, 1024, 1024, 128, 128]
    - [3, 49.41]
  - - [1024, 8192, 1, 256, 1024, 1024, 256, 256]
    - [9, 70.9]
  - - [1024, 8192, 1, 512, 1024, 1024, 512, 512]
    - [31, 94.13]
  - - [1024, 8192, 1, 1024, 1024, 1024, 1024, 1024]
    - [68, 113.7]
  - - [1024, 8192, 1, 2048, 1024, 1024, 2048, 2048]
    - [26, 133.56]
  - - [1024, 8192, 1, 4096, 1024, 1024, 4096, 4096]
    - [27, 143.92]
  - - [1024, 8192, 1, 8192, 1024, 1024, 8192, 8192]
    - [3, 155.18]
  - - [2048, 128, 1, 128, 2048, 2048, 128, 128]
    - [91, 6.79]
  - - [2048, 128, 1, 256, 2048, 2048, 256, 256]
    - [85, 11.5]
  - - [2048, 128, 1, 512, 2048, 2048, 512, 512]
    - [85, 19.62]
  - - [2048, 128, 1, 1024, 2048, 2048, 1024, 1024]
    - [87, 29.24]
  - - [2048, 128, 1, 2048, 2048, 2048, 2048, 2048]
    - [83, 38.74]
  - - [2048, 128, 1, 4096, 2048, 2048, 4096, 4096]
    - [86, 47.87]
  - - [2048, 128, 1, 8192, 2048, 2048, 8192, 8192]
    - [80, 53.69]
  - - [2048, 256, 1, 128, 2048, 2048, 128, 128]
    - [74, 11.95]
  - - [2048, 256, 1, 256, 2048, 2048, 256, 256]
    - [72, 20.68]
  - - [2048, 256, 1, 512, 2048, 2048, 512, 512]
    - [74, 34.18]
  - - [2048, 256, 1, 1024, 2048, 2048, 1024, 1024]
    - [74, 50.3]
  - - [2048, 256, 1, 2048, 2048, 2048, 2048, 2048]
    - [74, 65.81]
  - - [2048, 256, 1, 4096, 2048, 2048, 4096, 4096]
    - [74, 79.48]
  - - [2048, 256, 1, 8192, 2048, 2048, 8192, 8192]
    - [76, 87.25]
  - - [2048, 512, 1, 128, 2048, 2048, 128, 128]
    - [52, 19.31]
  - - [2048, 512, 1, 256, 2048, 2048, 256, 256]
    - [69, 31.51]
  - - [2048, 512, 1, 512, 2048, 2048, 512, 512]
    - [68, 50.45]
  - - [2048, 512, 1, 1024, 2048, 2048, 1024, 1024]
    - [66, 70.56]
  - - [2048, 512, 1, 2048, 2048, 2048, 2048, 2048]
    - [66, 87.71]
  - - [2048, 512, 1, 4096, 2048, 2048, 4096, 4096]
    - [68, 100.22]
  - - [2048, 512, 1, 8192, 2048, 2048, 8192, 8192]
    - [63, 99.13]
  - - [2048, 1024, 1, 128, 2048, 2048, 128, 128]
    - [39, 29.27]
  - - [2048, 1024, 1, 256, 2048, 2048, 256, 256]
    - [40, 47.07]
  - - [2048, 1024, 1, 512, 2048, 2048, 512, 512]
    - [41, 67.21]
  - - [2048, 1024, 1, 1024, 2048, 2048, 1024, 1024]
    - [66, 85.28]
  - - [2048, 1024, 1, 2048, 2048, 2048, 2048, 2048]
    - [47, 100.99]
  - - [2048, 1024, 1, 4096, 2048, 2048, 4096, 4096]
    - [59, 119.61]
  - - [2048, 1024, 1, 8192, 2048, 2048, 8192, 8192]
    - [58, 112.21]
  - - [2048, 2048, 1, 128, 2048, 2048, 128, 128]
    - [15, 41.02]
  - - [2048, 2048, 1, 256, 2048, 2048, 256, 256]
    - [37, 61.91]
  - - [2048, 2048, 1, 512, 2048, 2048, 512, 512]
    - [37, 87.75]
  - - [2048, 2048, 1, 1024, 2048, 2048, 1024, 1024]
    - [34, 107.85]
  - - [2048, 2048, 1, 2048, 2048, 2048, 2048, 2048]
    - [44, 123.23]
  - - [2048, 2048, 1, 4096, 2048, 2048, 4096, 4096]
    - [38, 124.77]
  - - [2048, 2048, 1, 8192, 2048, 2048, 8192, 8192]
    - [24, 132.99]
  - - [2048, 4096, 1, 128, 2048, 2048, 128, 128]
    - [1, 49.04]
  - - [2048, 4096, 1, 256, 2048, 2048, 256, 256]
    - [2, 71.08]
  - - [2048, 4096, 1, 512, 2048, 2048, 512, 512]
    - [1, 93.44]
  - - [2048, 4096, 1, 1024, 2048, 2048, 1024, 1024]
    - [10, 112.01]
  - - [2048, 4096, 1, 2048, 2048, 2048, 2048, 2048]
    - [23, 139.37]
  - - [2048, 4096, 1, 4096, 2048, 2048, 4096, 4096]
    - [22, 150.67]
  - - [2048, 4096, 1, 8192, 2048, 2048, 8192, 8192]
    - [0, 152.6]
  - - [2048, 8192, 1, 128, 2048, 2048, 128, 128]
    - [3, 55.6]
  - - [2048, 8192, 1, 256, 2048, 2048, 256, 256]
    - [6, 78.75]
  - - [2048, 8192, 1, 512, 2048, 2048, 512, 512]
    - [40, 107.42]
  - - [2048, 8192, 1, 1024, 2048, 2048, 1024, 1024]
    - [43, 113.13]
  - - [2048, 8192, 1, 2048, 2048, 2048, 2048, 2048]
    - [24, 137.38]
  - - [2048, 8192, 1, 4096, 2048, 2048, 4096, 4096]
    - [30, 159.45]
  - - [2048, 8192, 1, 8192, 2048, 2048, 8192, 8192]
    - [21, 184.85]
  - - [4096, 128, 1, 128, 4096, 4096, 128, 128]
    - [74, 12.0]
  - - [4096, 128, 1, 256, 4096, 4096, 256, 256]
    - [74, 19.83]
  - - [4096, 128, 1, 512, 4096, 4096, 512, 512]
    - [76, 32.62]
  - - [4096, 128, 1, 1024, 4096, 4096, 1024, 1024]
    - [76, 47.99]
  - - [4096, 128, 1, 2048, 4096, 4096, 2048, 2048]
    - [75, 63.18]
  - - [4096, 128, 1, 4096, 4096, 4096, 4096, 4096]
    - [71, 70.77]
  - - [4096, 128, 1, 8192, 4096, 4096, 8192, 8192]
    - [73, 80.86]
  - - [4096, 256, 1, 128, 4096, 4096, 128, 128]
    - [69, 19.53]
  - - [4096, 256, 1, 256, 4096, 4096, 256, 256]
    - [66, 31.24]
  - - [4096, 256, 1, 512, 4096, 4096, 512, 512]
    - [68, 50.37]
  - - [4096, 256, 1, 1024, 4096, 4096, 1024, 1024]
    - [69, 70.7]
  - - [4096, 256, 1, 2048, 4096, 4096, 2048, 2048]
    - [66, 87.06]
  - - [4096, 256, 1, 4096, 4096, 4096, 4096, 4096]
    - [62, 94.95]
  - - [4096, 256, 1, 8192, 4096, 4096, 8192, 8192]
    - [68, 96.82]
  - - [4096, 512, 1, 128, 4096, 4096, 128, 128]
    - [39, 29.32]
  - - [4096, 512, 1, 256, 4096, 4096, 256, 256]
    - [43, 46.73]
  - - [4096, 512, 1, 512, 4096, 4096, 512, 512]
    - [44, 66.99]
  - - [4096, 512, 1, 1024, 4096, 4096, 1024, 1024]
    - [66, 85.39]
  - - [4096, 512, 1, 2048, 4096, 4096, 2048, 2048]
    - [46, 98.96]
  - - [4096, 512, 1, 4096, 4096, 4096, 4096, 4096]
    - [59, 115.89]
  - - [4096, 512, 1, 8192, 4096, 4096, 8192, 8192]
    - [59, 114.25]
  - - [4096, 1024, 1, 128, 4096, 4096, 128, 128]
    - [17, 40.07]
  - - [4096, 1024, 1, 256, 4096, 4096, 256, 256]
    - [33, 60.88]
  - - [4096, 1024, 1, 512, 4096, 4096, 512, 512]
    - [33, 87.64]
  - - [4096, 1024, 1, 1024, 4096, 4096, 1024, 1024]
    - [32, 106.96]
  - - [4096, 1024, 1, 2048, 4096, 4096, 2048, 2048]
    - [41, 125.63]
  - - [4096, 1024, 1, 4096, 4096, 4096, 4096, 4096]
    - [40, 135.49]
  - - [4096, 1024, 1, 8192, 4096, 4096, 8192, 8192]
    - [40, 137.63]
  - - [4096, 2048, 1, 128, 4096, 4096, 128, 128]
    - [0, 47.32]
  - - [4096, 2048, 1, 256, 4096, 4096, 256, 256]
    - [2, 69.67]
  - - [4096, 2048, 1, 512, 4096, 4096, 512, 512]
    - [33, 95.0]
  - - [4096, 2048, 1, 1024, 4096, 4096, 1024, 1024]
    - [12, 115.91]
  - - [4096, 2048, 1, 2048, 4096, 4096, 2048, 2048]
    - [21, 141.28]
  - - [4096, 2048, 1, 4096, 4096, 4096, 4096, 4096]
    - [23, 156.0]
  - - [4096, 2048, 1, 8192, 4096, 4096, 8192, 8192]
    - [23, 163.56]
  - - [4096, 4096, 1, 128, 4096, 4096, 128, 128]
    - [2, 54.97]
  - - [4096, 4096, 1, 256, 4096, 4096, 256, 256]
    - [5, 77.34]
  - - [4096, 4096, 1, 512, 4096, 4096, 512, 512]
    - [41, 104.93]
  - - [4096, 4096, 1, 1024, 4096, 4096, 1024, 1024]
    - [43, 116.23]
  - - [4096, 4096, 1, 2048, 4096, 4096, 2048, 2048]
    - [36, 134.55]
  - - [4096, 4096, 1, 4096, 4096, 4096, 4096, 4096]
    - [31, 158.57]
  - - [4096, 4096, 1, 8192, 4096, 4096, 8192, 8192]
    - [23, 172.23]
  - - [4096, 8192, 1, 128, 4096, 4096, 128, 128]
    - [2, 56.56]
  - - [4096, 8192, 1, 256, 4096, 4096, 256, 256]
    - [16, 81.86]
  - - [4096, 8192, 1, 512, 4096, 4096, 512, 512]
    - [36, 109.17]
  - - [4096, 8192, 1, 1024, 4096, 4096, 1024, 1024]
    - [28, 130.79]
  - - [4096, 8192, 1, 2048, 4096, 4096, 2048, 2048]
    - [35, 161.06]
  - - [4096, 8192, 1, 4096, 4096, 4096, 4096, 4096]
    - [23, 171.32]
  - - [4096, 8192, 1, 8192, 4096, 4096, 8192, 8192]
    - [43, 181.28]
  - - [8192, 128, 1, 128, 8192, 8192, 128, 128]
    - [51, 18.62]
  - - [8192, 128, 1, 256, 8192, 8192, 256, 256]
    - [66, 29.86]
  - - [8192, 128, 1, 512, 8192, 8192, 512, 512]
    - [68, 47.22]
  - - [8192, 128, 1, 1024, 8192, 8192, 1024, 1024]
    - [59, 66.57]
  - - [8192, 128, 1, 2048, 8192, 8192, 2048, 2048]
    - [59, 75.78]
  - - [8192, 128, 1, 4096, 8192, 8192, 4096, 4096]
    - [60, 87.38]
  - - [8192, 128, 1, 8192, 8192, 8192, 8192, 8192]
    - [69, 88.21]
  - - [8192, 256, 1, 128, 8192, 8192, 128, 128]
    - [41, 28.48]
  - - [8192, 256, 1, 256, 8192, 8192, 256, 256]
    - [41, 43.6]
  - - [8192, 256, 1, 512, 8192, 8192, 512, 512]
    - [41, 63.13]
  - - [8192, 256, 1, 1024, 8192, 8192, 1024, 1024]
    - [40, 76.49]
  - - [8192, 256, 1, 2048, 8192, 8192, 2048, 2048]
    - [48, 93.94]
  - - [8192, 256, 1, 4096, 8192, 8192, 4096, 4096]
    - [61, 116.41]
  - - [8192, 256, 1, 8192, 8192, 8192, 8192, 8192]
    - [59, 111.2]
  - - [8192, 512, 1, 128, 8192, 8192, 128, 128]
    - [17, 38.88]
  - - [8192, 512, 1, 256, 8192, 8192, 256, 256]
    - [37, 58.75]
  - - [8192, 512, 1, 512, 8192, 8192, 512, 512]
    - [35, 80.55]
  - - [8192, 512, 1, 1024, 8192, 8192, 1024, 1024]
    - [36, 98.17]
  - - [8192, 512, 1, 2048, 8192, 8192, 2048, 2048]
    - [42, 123.29]
  - - [8192, 512, 1, 4096, 8192, 8192, 4096, 4096]
    - [40, 135.26]
  - - [8192, 512, 1, 8192, 8192, 8192, 8192, 8192]
    - [40, 133.44]
  - - [8192, 1024, 1, 128, 8192, 8192, 128, 128]
    - [1, 46.45]
  - - [8192, 1024, 1, 256, 8192, 8192, 256, 256]
    - [2, 67.59]
  - - [8192, 1024, 1, 512, 8192, 8192, 512, 512]
    - [33, 91.44]
  - - [8192, 1024, 1, 1024, 8192, 8192, 1024, 1024]
    - [13, 113.74]
  - - [8192, 1024, 1, 2048, 8192, 8192, 2048, 2048]
    - [21, 141.5]
  - - [8192, 1024, 1, 4096, 8192, 8192, 4096, 4096]
    - [23, 158.44]
  - - [8192, 1024, 1, 8192, 8192, 8192, 8192, 8192]
    - [19, 156.98]
  - - [8192, 2048, 1, 128, 8192, 8192, 128, 128]
    - [0, 54.15]
  - - [8192, 2048, 1, 256, 8192, 8192, 256, 256]
    - [4, 76.23]
  - - [8192, 2048, 1, 512, 8192, 8192, 512, 512]
    - [43, 105.13]
  - - [8192, 2048, 1, 1024, 8192, 8192, 1024, 1024]
    - [44, 115.08]
  - - [8192, 2048, 1, 2048, 8192, 8192, 2048, 2048]
    - [30, 140.57]
  - - [8192, 2048, 1, 4096, 8192, 8192, 4096, 4096]
    - [27, 165.6]
  - - [8192, 2048, 1, 8192, 8192, 8192, 8192, 8192]
    - [20, 172.8]
  - - [8192, 4096, 1, 128, 8192, 8192, 128, 128]
    - [1, 56.37]
  - - [8192, 4096, 1, 256, 8192, 8192, 256, 256]
    - [43, 81.01]
  - - [8192, 4096, 1, 512, 8192, 8192, 512, 512]
    - [30, 107.89]
  - - [8192, 4096, 1, 1024, 8192, 8192, 1024, 1024]
    - [28, 135.38]
  - - [8192, 4096, 1, 2048, 8192, 8192, 2048, 2048]
    - [37, 163.12]
  - - [8192, 4096, 1, 4096, 8192, 8192, 4096, 4096]
    - [22, 173.41]
  - - [8192, 4096, 1, 8192, 8192, 8192, 8192, 8192]
    - [23, 184.27]
  - - [8192, 8192, 1, 128, 8192, 8192, 128, 128]
    - [15, 58.84]
  - - [8192, 8192, 1, 256, 8192, 8192, 256, 256]
    - [8, 84.79]
  - - [8192, 8192, 1, 512, 8192, 8192, 512, 512]
    - [29, 118.13]
  - - [8192, 8192, 1, 1024, 8192, 8192, 1024, 1024]
    - [7, 148.09]
  - - [8192, 8192, 1, 2048, 8192, 8192, 2048, 2048]
    - [25, 173.66]
  - - [8192, 8192, 1, 4096, 8192, 8192, 4096, 4096]
    - [34, 192.99]
  - - [8192, 8192, 1, 8192, 8192, 8192, 8192, 8192]
    - [34, 205.71]
  - - [1, 1, 1, 32, 1, 1, 32, 32]
    - [103, 0.0]
- null
- null
- ExperimentalStreamK
- GridBased
