projects/hipblaslt/library/src/amd_detail/rocblaslt/src/Tensile/Logic/asm_full/aquavanjaram/gfx942_228cu/StreamK/aquavanjaram942_Cijk_Alik_Bljk_B8F8NB8NS_BH_Bias_HAS_SAV_UserArgs.yaml
- {MinimumRequiredVersion: 4.33.0}
- aquavanjaram942
- {Architecture: gfx942, CUCount: 228}
- [Device 0049, Device 0050]
    SolutionIndex: 0
    SolutionNameMin: Cijk_Alik_Bljk_B8F8NB8NS_BH_Bias_HAS_SAV_UserArgs_MT256x256x64_MI16x16x1_SN_LDSB1_CLR1_GRVWA8_GRVWB16_GSU0_GSUC0_GSUWGMRR0_K1_LBSPPA512_LBSPPB512_LPA8_LPB16_LRVW8_MIWT8_8_PLR1_SU0_SUM0_SUS64_VWA8_VWB8_WGM1_WGMXCC1_WGMXCCGn1
    SolutionIndex: 1
    SolutionNameMin: Cijk_Alik_Bljk_B8F8NB8NS_BH_Bias_HAS_SAV_UserArgs_MT256x256x64_MI16x16x1_SN_LDSB1_CLR1_GRVWA8_GRVWB16_GSU0_GSUC0_GSUWGMRR0_K1_LBSPPA512_LBSPPB512_LPA8_LPB16_LRVW8_MIWT8_8_PLR1_SU0_SUM0_SUS64_VWA8_VWB8_WGM4_WGMXCC1_WGMXCCGn1
    SolutionIndex: 2
    SolutionNameMin: Cijk_Alik_Bljk_B8F8NB8NS_BH_Bias_HAS_SAV_UserArgs_MT256x256x64_MI16x16x1_SN_LDSB1_CLR1_GRVWA8_GRVWB16_GSU0_GSUC0_GSUWGMRR0_K1_LBSPPA512_LBSPPB512_LPA8_LPB16_LRVW8_MIWT8_8_PLR1_SU0_SUM0_SUS64_VWA8_VWB8_WGM6_WGMXCC1_WGMXCCGn1
    SolutionIndex: 3
    SolutionNameMin: Cijk_Alik_Bljk_B8F8NB8NS_BH_Bias_HAS_SAV_UserArgs_MT256x256x64_MI16x16x1_SN_LDSB1_CLR1_GRVWA16_GRVWB16_GSU0_GSUC0_GSUWGMRR0_K1_LBSPPA512_LBSPPB512_LPA16_LPB16_LRVW8_MIWT8_8_PLR1_SU0_SUM0_SUS64_VWA8_VWB8_WGM6_WGMXCC1_WGMXCCGn1
    SolutionIndex: 4
    SolutionNameMin: Cijk_Alik_Bljk_B8F8NB8NS_BH_Bias_HAS_SAV_UserArgs_MT256x256x64_MI16x16x1_SN_LDSB1_CLR1_GRVWA16_GRVWB8_GSU0_GSUC0_GSUWGMRR0_K1_LBSPPA512_LBSPPB512_LPA16_LPB8_LRVW8_MIWT8_8_PLR1_SU0_SUM0_SUS64_VWA8_VWB8_WGM8_WGMXCC1_WGMXCCGn1
    SolutionIndex: 5
    SolutionNameMin: Cijk_Alik_Bljk_B8F8NB8NS_BH_Bias_HAS_SAV_UserArgs_MT256x256x64_MI16x16x1_SN_LDSB1_CLR1_GRVWA8_GRVWB16_GSU0_GSUC0_GSUWGMRR0_K1_LBSPPA512_LBSPPB512_LPA8_LPB16_LRVW8_MIWT8_8_PLR1_SU0_SUM0_SUS64_VWA8_VWB8_WGM8_WGMXCC1_WGMXCCGn1
    SolutionIndex: 6
    SolutionNameMin: Cijk_Alik_Bljk_B8F8NB8NS_BH_Bias_HAS_SAV_UserArgs_MT256x256x64_MI16x16x1_SN_LDSB1_CLR1_GRVWA16_GRVWB16_GSU0_GSUC0_GSUWGMRR0_K1_LBSPPA512_LBSPPB512_LPA16_LPB16_LRVW8_MIWT8_8_PLR1_SU0_SUM0_SUS64_VWA8_VWB8_WGM8_WGMXCC1_WGMXCCGn1
    SolutionIndex: 7
    SolutionNameMin: Cijk_Alik_Bljk_B8F8NB8NS_BH_Bias_HAS_SAV_UserArgs_MT128x256x64_MI16x16x1_SN_LDSB1_CLR1_GRVWA8_GRVWB8_GSU0_GSUC0_GSUWGMRR0_K1_LBSPPA256_LBSPPB512_LPA8_LPB8_LRVW8_MIWT4_8_PLR1_SU0_SUM0_SUS64_VWA4_VWB8_WGM4_WGMXCC1_WGMXCCGn1
    SolutionIndex: 8
    SolutionNameMin: Cijk_Alik_Bljk_B8F8NB8NS_BH_Bias_HAS_SAV_UserArgs_MT256x128x64_MI16x16x1_SN_LDSB1_CLR1_GRVWA8_GRVWB16_GSU0_GSUC0_GSUWGMRR0_K1_LBSPPA512_LBSPPB256_LPA8_LPB16_LRVW8_MIWT8_4_PLR1_SU0_SUM0_SUS64_VWA8_VWB4_WGM1_WGMXCC1_WGMXCCGn1
    SolutionIndex: 9
    SolutionNameMin: Cijk_Alik_Bljk_B8F8NB8NS_BH_Bias_HAS_SAV_UserArgs_MT256x128x64_MI16x16x1_SN_LDSB1_CLR1_GRVWA8_GRVWB16_GSU0_GSUC0_GSUWGMRR0_K1_LBSPPA512_LBSPPB256_LPA8_LPB16_LRVW8_MIWT8_4_PLR1_SU0_SUM0_SUS64_VWA8_VWB4_WGM4_WGMXCC1_WGMXCCGn1
    SolutionIndex: 10
    SolutionNameMin: Cijk_Alik_Bljk_B8F8NB8NS_BH_Bias_HAS_SAV_UserArgs_MT256x128x64_MI16x16x1_SN_LDSB1_CLR1_GRVWA8_GRVWB16_GSU0_GSUC0_GSUWGMRR0_K1_LBSPPA512_LBSPPB256_LPA8_LPB16_LRVW8_MIWT8_4_PLR1_SU0_SUM0_SUS64_VWA8_VWB4_WGM8_WGMXCC1_WGMXCCGn1
    SolutionIndex: 11
    SolutionNameMin: Cijk_Alik_Bljk_B8F8NB8NS_BH_Bias_HAS_SAV_UserArgs_MT128x128x64_MI16x16x1_SN_LDSB1_CLR1_GRVWA8_GRVWB16_GSU0_GSUC0_GSUWGMRR0_K1_LBSPPA512_LBSPPB128_LPA8_LPB16_LRVW8_MIWT8_2_PLR1_SU0_SUM0_SUS64_VWA8_VWB2_WGM1_WGMXCC1_WGMXCCGn1
    SolutionIndex: 12
    SolutionNameMin: Cijk_Alik_Bljk_B8F8NB8NS_BH_Bias_HAS_SAV_UserArgs_MT128x64x64_MI16x16x1_SN_LDSB0_CLR1_GRVWA8_GRVWB16_GSU0_GSUC0_GSUWGMRR0_K1_LBSPPA512_LBSPPB128_LPA8_LPB16_LRVW8_MIWT8_1_PLR1_SU0_SUM0_SUS64_VWA8_VWB1_WGM1_WGMXCC1_WGMXCCGn1
    SolutionIndex: 13
    SolutionNameMin: Cijk_Alik_Bljk_B8F8NB8NS_BH_Bias_HAS_SAV_UserArgs_MT128x128x64_MI16x16x1_SN_LDSB1_CLR1_GRVWA8_GRVWB16_GSU0_GSUC0_GSUWGMRR0_K1_LBSPPA256_LBSPPB256_LPA8_LPB16_LRVW8_MIWT4_4_PLR1_SU0_SUM0_SUS64_VWA4_VWB4_WGM1_WGMXCC1_WGMXCCGn1
    SolutionIndex: 14
    SolutionNameMin: Cijk_Alik_Bljk_B8F8NB8NS_BH_Bias_HAS_SAV_UserArgs_MT64x128x64_MI16x16x1_SN_LDSB0_CLR1_GRVWA16_GRVWB8_GSU0_GSUC0_GSUWGMRR0_K1_LBSPPA128_LBSPPB256_LPA16_LPB8_LRVW8_MIWT2_4_PLR1_SU0_SUM0_SUS64_VWA2_VWB4_WGM1_WGMXCC1_WGMXCCGn1
    SolutionIndex: 15
    SolutionNameMin: Cijk_Alik_Bljk_B8F8NB8NS_BH_Bias_HAS_SAV_UserArgs_MT64x128x64_MI16x16x1_SN_LDSB0_CLR1_GRVWA16_GRVWB16_GSU0_GSUC0_GSUWGMRR0_K1_LBSPPA128_LBSPPB256_LPA16_LPB16_LRVW8_MIWT2_4_PLR1_SU0_SUM0_SUS64_VWA2_VWB4_WGM1_WGMXCC1_WGMXCCGn1
    SolutionIndex: 16
    SolutionNameMin: Cijk_Alik_Bljk_B8F8NB8NS_BH_Bias_HAS_SAV_UserArgs_MT128x64x64_MI16x16x1_SN_LDSB0_CLR1_GRVWA16_GRVWB8_GSU0_GSUC0_GSUWGMRR0_K1_LBSPPA256_LBSPPB128_LPA16_LPB8_LRVW8_MIWT4_2_PLR1_SU0_SUM0_SUS64_VWA4_VWB2_WGM1_WGMXCC1_WGMXCCGn1
    SolutionIndex: 17
    SolutionNameMin: Cijk_Alik_Bljk_B8F8NB8NS_BH_Bias_HAS_SAV_UserArgs_MT128x64x64_MI16x16x1_SN_LDSB0_CLR1_GRVWA8_GRVWB16_GSU0_GSUC0_GSUWGMRR0_K1_LBSPPA256_LBSPPB128_LPA8_LPB16_LRVW8_MIWT4_2_PLR1_SU0_SUM0_SUS64_VWA4_VWB2_WGM1_WGMXCC1_WGMXCCGn1
    SolutionIndex: 18
    SolutionNameMin: Cijk_Alik_Bljk_B8F8NB8NS_BH_Bias_HAS_SAV_UserArgs_MT128x64x64_MI16x16x1_SN_LDSB0_CLR1_GRVWA16_GRVWB16_GSU0_GSUC0_GSUWGMRR0_K1_LBSPPA256_LBSPPB128_LPA16_LPB16_LRVW8_MIWT4_2_PLR1_SU0_SUM0_SUS64_VWA4_VWB2_WGM1_WGMXCC1_WGMXCCGn1
    SolutionIndex: 19
    SolutionNameMin: Cijk_Alik_Bljk_B8F8NB8NS_BH_Bias_HAS_SAV_UserArgs_MT128x64x64_MI16x16x1_SN_LDSB0_CLR1_GRVWA8_GRVWB16_GSU0_GSUC0_GSUWGMRR0_K1_LBSPPA256_LBSPPB128_LPA8_LPB16_LRVW8_MIWT4_2_PLR1_SU0_SUM0_SUS64_VWA4_VWB2_WGM4_WGMXCC1_WGMXCCGn1
    SolutionIndex: 20
    SolutionNameMin: Cijk_Alik_Bljk_B8F8NB8NS_BH_Bias_HAS_SAV_UserArgs_MT128x64x64_MI16x16x1_SN_LDSB0_CLR1_GRVWA8_GRVWB16_GSU0_GSUC0_GSUWGMRR0_K1_LBSPPA256_LBSPPB128_LPA8_LPB16_LRVW8_MIWT4_2_PLR1_SU0_SUM0_SUS64_VWA4_VWB2_WGM6_WGMXCC1_WGMXCCGn1
    SolutionIndex: 21
    SolutionNameMin: Cijk_Alik_Bljk_B8F8NB8NS_BH_Bias_HAS_SAV_UserArgs_MT128x64x64_MI16x16x1_SN_LDSB0_CLR1_GRVWA8_GRVWB16_GSU0_GSUC0_GSUWGMRR0_K1_LBSPPA256_LBSPPB128_LPA8_LPB16_LRVW8_MIWT4_2_PLR1_SU0_SUM0_SUS64_VWA4_VWB2_WGM8_WGMXCC1_WGMXCCGn1
    SolutionIndex: 22
    SolutionNameMin: Cijk_Alik_Bljk_B8F8NB8NS_BH_Bias_HAS_SAV_UserArgs_MT64x64x64_MI16x16x1_SN_LDSB0_CLR1_GRVWA8_GRVWB8_GSU0_GSUC0_GSUWGMRR0_K1_LBSPPA128_LBSPPB128_LPA8_LPB8_LRVW8_MIWT2_2_PLR1_SU0_SUM0_SUS64_VWA2_VWB2_WGM1_WGMXCC1_WGMXCCGn1
    SolutionIndex: 23
    SolutionNameMin: Cijk_Alik_Bljk_B8F8NB8NS_BH_Bias_HAS_SAV_UserArgs_MT64x64x64_MI16x16x1_SN_LDSB0_CLR1_GRVWA16_GRVWB8_GSU0_GSUC0_GSUWGMRR0_K1_LBSPPA128_LBSPPB128_LPA16_LPB8_LRVW8_MIWT2_2_PLR1_SU0_SUM0_SUS64_VWA2_VWB2_WGM1_WGMXCC1_WGMXCCGn1
    SolutionIndex: 24
    SolutionNameMin: Cijk_Alik_Bljk_B8F8NB8NS_BH_Bias_HAS_SAV_UserArgs_MT64x64x64_MI16x16x1_SN_LDSB0_CLR1_GRVWA8_GRVWB16_GSU0_GSUC0_GSUWGMRR0_K1_LBSPPA128_LBSPPB128_LPA8_LPB16_LRVW8_MIWT2_2_PLR1_SU0_SUM0_SUS64_VWA2_VWB2_WGM1_WGMXCC1_WGMXCCGn1
    SolutionIndex: 25
    SolutionNameMin: Cijk_Alik_Bljk_B8F8NB8NS_BH_Bias_HAS_SAV_UserArgs_MT64x64x64_MI16x16x1_SN_LDSB0_CLR1_GRVWA16_GRVWB16_GSU0_GSUC0_GSUWGMRR0_K1_LBSPPA128_LBSPPB128_LPA16_LPB16_LRVW8_MIWT2_2_PLR1_SU0_SUM0_SUS64_VWA2_VWB2_WGM1_WGMXCC1_WGMXCCGn1
    SolutionIndex: 26
    SolutionNameMin: Cijk_Alik_Bljk_B8F8NB8NS_BH_Bias_HAS_SAV_UserArgs_MT64x32x64_MI16x16x1_SN_LDSB0_CLR1_GRVWA8_GRVWB8_GSU0_GSUC0_GSUWGMRR0_K1_LBSPPA128_LBSPPB128_LPA8_LPB8_LRVW8_MIWT2_1_PLR1_SU0_SUM0_SUS64_VWA2_VWB1_WGM1_WGMXCC1_WGMXCCGn1
    SolutionIndex: 27
    SolutionNameMin: Cijk_Alik_Bljk_B8F8NB8NS_BH_Bias_HAS_SAV_UserArgs_MT64x32x64_MI16x16x1_SN_LDSB0_CLR1_GRVWA16_GRVWB8_GSU0_GSUC0_GSUWGMRR0_K1_LBSPPA128_LBSPPB128_LPA16_LPB8_LRVW8_MIWT2_1_PLR1_SU0_SUM0_SUS64_VWA2_VWB1_WGM1_WGMXCC1_WGMXCCGn1
    SolutionIndex: 28
    SolutionNameMin: Cijk_Alik_Bljk_B8F8NB8NS_BH_Bias_HAS_SAV_UserArgs_MT32x32x64_MI16x16x1_SN_LDSB0_CLR1_GRVWA8_GRVWB8_GSU0_GSUC0_GSUWGMRR0_K1_LBSPPA128_LBSPPB128_LPA8_LPB8_LRVW8_MIWT1_1_PLR1_SU0_SUM0_SUS64_VWA1_VWB1_WGM1_WGMXCC1_WGMXCCGn1
    SolutionIndex: 29
    SolutionNameMin: Cijk_Alik_Bljk_B8F8NB8NS_BH_Bias_HAS_SAV_UserArgs_MT32x32x64_MI16x16x1_SN_LDSB0_CLR1_GRVWA8_GRVWB8_GSU0_GSUC0_GSUWGMRR0_K1_LBSPPA128_LBSPPB128_LPA8_LPB8_LRVW8_MIWT1_1_PLR1_SU0_SUM0_SUS64_VWA1_VWB1_WGM4_WGMXCC1_WGMXCCGn1
    SolutionIndex: 30
    SolutionNameMin: Cijk_Alik_Bljk_B8F8NB8NS_BH_Bias_HAS_SAV_UserArgs_MT32x32x64_MI16x16x1_SN_LDSB0_CLR1_GRVWA8_GRVWB8_GSU0_GSUC0_GSUWGMRR0_K1_LBSPPA128_LBSPPB128_LPA8_LPB8_LRVW8_MIWT1_1_PLR1_SU0_SUM0_SUS64_VWA1_VWB1_WGM8_WGMXCC1_WGMXCCGn1
    SolutionIndex: 31
    SolutionNameMin: Cijk_Alik_Bljk_B8F8NB8NS_BH_Bias_HAS_SAV_UserArgs_MT128x256x128_MI16x16x1_SN_LDSB1_CLR1_GRVWA8_GRVWB16_GSU0_GSUC0_GSUWGMRR0_K1_LBSPPA512_LBSPPB1024_LPA8_LPB16_LRVW8_MIWT4_8_PLR1_SU0_SUM0_SUS128_VWA4_VWB8_WGM1_WGMXCC1_WGMXCCGn1
    SolutionIndex: 32
    SolutionNameMin: Cijk_Alik_Bljk_B8F8NB8NS_BH_Bias_HAS_SAV_UserArgs_MT128x256x128_MI16x16x1_SN_LDSB1_CLR1_GRVWA8_GRVWB8_GSU0_GSUC0_GSUWGMRR0_K1_LBSPPA512_LBSPPB1024_LPA8_LPB8_LRVW8_MIWT4_8_PLR1_SU0_SUM0_SUS128_VWA4_VWB8_WGM4_WGMXCC1_WGMXCCGn1
    SolutionIndex: 33
    SolutionNameMin: Cijk_Alik_Bljk_B8F8NB8NS_BH_Bias_HAS_SAV_UserArgs_MT256x144x128_MI16x16x1_SN_LDSB1_CLR1_GRVWA8_GRVWB8_GSU0_GSUC0_GSUWGMRR0_K1_LBSPPA512_LBSPPB128_LPA8_LPB8_LRVW8_MIWT4_9_PLR1_SU0_SUM0_SUS128_VWA4_VWB1_WGM1_WGMXCC1_WGMXCCGn1
    SolutionIndex: 34
    SolutionNameMin: Cijk_Alik_Bljk_B8F8NB8NS_BH_Bias_HAS_SAV_UserArgs_MT256x144x128_MI16x16x1_SN_LDSB1_CLR1_GRVWA16_GRVWB8_GSU0_GSUC0_GSUWGMRR0_K1_LBSPPA512_LBSPPB128_LPA16_LPB8_LRVW8_MIWT4_9_PLR1_SU0_SUM0_SUS128_VWA4_VWB1_WGM1_WGMXCC1_WGMXCCGn1
    SolutionIndex: 35
    SolutionNameMin: Cijk_Alik_Bljk_B8F8NB8NS_BH_Bias_HAS_SAV_UserArgs_MT256x144x128_MI16x16x1_SN_LDSB1_CLR1_GRVWA8_GRVWB8_GSU0_GSUC0_GSUWGMRR0_K1_LBSPPA512_LBSPPB128_LPA8_LPB8_LRVW8_MIWT4_9_PLR1_SU0_SUM0_SUS128_VWA4_VWB1_WGM4_WGMXCC1_WGMXCCGn1
    SolutionIndex: 36
    SolutionNameMin: Cijk_Alik_Bljk_B8F8NB8NS_BH_Bias_HAS_SAV_UserArgs_MT256x144x128_MI16x16x1_SN_LDSB1_CLR1_GRVWA16_GRVWB8_GSU0_GSUC0_GSUWGMRR0_K1_LBSPPA512_LBSPPB128_LPA16_LPB8_LRVW8_MIWT4_9_PLR1_SU0_SUM0_SUS128_VWA4_VWB1_WGM4_WGMXCC1_WGMXCCGn1
    SolutionIndex: 37
    SolutionNameMin: Cijk_Alik_Bljk_B8F8NB8NS_BH_Bias_HAS_SAV_UserArgs_MT256x144x128_MI16x16x1_SN_LDSB1_CLR1_GRVWA8_GRVWB8_GSU0_GSUC0_GSUWGMRR0_K1_LBSPPA512_LBSPPB128_LPA8_LPB8_LRVW8_MIWT4_9_PLR1_SU0_SUM0_SUS128_VWA4_VWB1_WGM6_WGMXCC1_WGMXCCGn1
    SolutionIndex: 38
    SolutionNameMin: Cijk_Alik_Bljk_B8F8NB8NS_BH_Bias_HAS_SAV_UserArgs_MT256x144x128_MI16x16x1_SN_LDSB1_CLR1_GRVWA16_GRVWB8_GSU0_GSUC0_GSUWGMRR0_K1_LBSPPA512_LBSPPB128_LPA16_LPB8_LRVW8_MIWT4_9_PLR1_SU0_SUM0_SUS128_VWA4_VWB1_WGM6_WGMXCC1_WGMXCCGn1
    SolutionIndex: 39
    SolutionNameMin: Cijk_Alik_Bljk_B8F8NB8NS_BH_Bias_HAS_SAV_UserArgs_MT256x144x128_MI16x16x1_SN_LDSB1_CLR1_GRVWA8_GRVWB8_GSU0_GSUC0_GSUWGMRR0_K1_LBSPPA512_LBSPPB128_LPA8_LPB8_LRVW8_MIWT4_9_PLR1_SU0_SUM0_SUS128_VWA4_VWB1_WGM8_WGMXCC1_WGMXCCGn1
    SolutionIndex: 40
    SolutionNameMin: Cijk_Alik_Bljk_B8F8NB8NS_BH_Bias_HAS_SAV_UserArgs_MT256x144x128_MI16x16x1_SN_LDSB1_CLR1_GRVWA16_GRVWB8_GSU0_GSUC0_GSUWGMRR0_K1_LBSPPA512_LBSPPB128_LPA16_LPB8_LRVW8_MIWT4_9_PLR1_SU0_SUM0_SUS128_VWA4_VWB1_WGM8_WGMXCC1_WGMXCCGn1
    SolutionIndex: 41
    SolutionNameMin: Cijk_Alik_Bljk_B8F8NB8NS_BH_Bias_HAS_SAV_UserArgs_MT256x128x128_MI16x16x1_SN_LDSB1_CLR1_GRVWA8_GRVWB16_GSU0_GSUC0_GSUWGMRR0_K1_LBSPPA1024_LBSPPB512_LPA8_LPB16_LRVW8_MIWT8_4_PLR1_SU0_SUM0_SUS128_VWA8_VWB4_WGM1_WGMXCC1_WGMXCCGn1
    SolutionIndex: 42
    SolutionNameMin: Cijk_Alik_Bljk_B8F8NB8NS_BH_Bias_HAS_SAV_UserArgs_MT256x128x128_MI16x16x1_SN_LDSB1_CLR1_GRVWA8_GRVWB16_GSU0_GSUC0_GSUWGMRR0_K1_LBSPPA1024_LBSPPB512_LPA8_LPB16_LRVW8_MIWT8_4_PLR1_SU0_SUM0_SUS128_VWA8_VWB4_WGM4_WGMXCC1_WGMXCCGn1
    SolutionIndex: 43
    SolutionNameMin: Cijk_Alik_Bljk_B8F8NB8NS_BH_Bias_HAS_SAV_UserArgs_MT256x128x128_MI16x16x1_SN_LDSB1_CLR1_GRVWA8_GRVWB16_GSU0_GSUC0_GSUWGMRR0_K1_LBSPPA1024_LBSPPB512_LPA8_LPB16_LRVW8_MIWT8_4_PLR1_SU0_SUM0_SUS128_VWA8_VWB4_WGM6_WGMXCC1_WGMXCCGn1
    SolutionIndex: 44
    SolutionNameMin: Cijk_Alik_Bljk_B8F8NB8NS_BH_Bias_HAS_SAV_UserArgs_MT256x128x128_MI16x16x1_SN_LDSB1_CLR1_GRVWA8_GRVWB16_GSU0_GSUC0_GSUWGMRR0_K1_LBSPPA1024_LBSPPB512_LPA8_LPB16_LRVW8_MIWT8_4_PLR1_SU0_SUM0_SUS128_VWA8_VWB4_WGM8_WGMXCC1_WGMXCCGn1
    SolutionIndex: 45
    SolutionNameMin: Cijk_Alik_Bljk_B8F8NB8NS_BH_Bias_HAS_SAV_UserArgs_MT144x256x128_MI16x16x1_SN_LDSB1_CLR1_GRVWA8_GRVWB16_GSU0_GSUC0_GSUWGMRR0_K1_LBSPPA128_LBSPPB512_LPA8_LPB16_LRVW8_MIWT9_4_PLR1_SU0_SUM0_SUS128_VWA1_VWB4_WGM1_WGMXCC1_WGMXCCGn1
    SolutionIndex: 46
    SolutionNameMin: Cijk_Alik_Bljk_B8F8NB8NS_BH_Bias_HAS_SAV_UserArgs_MT144x256x128_MI16x16x1_SN_LDSB1_CLR1_GRVWA8_GRVWB16_GSU0_GSUC0_GSUWGMRR0_K1_LBSPPA128_LBSPPB512_LPA8_LPB16_LRVW8_MIWT9_4_PLR1_SU0_SUM0_SUS128_VWA1_VWB4_WGM4_WGMXCC1_WGMXCCGn1
    SolutionIndex: 47
    SolutionNameMin: Cijk_Alik_Bljk_B8F8NB8NS_BH_Bias_HAS_SAV_UserArgs_MT144x256x128_MI16x16x1_SN_LDSB1_CLR1_GRVWA8_GRVWB16_GSU0_GSUC0_GSUWGMRR0_K1_LBSPPA128_LBSPPB512_LPA8_LPB16_LRVW8_MIWT9_4_PLR1_SU0_SUM0_SUS128_VWA1_VWB4_WGM6_WGMXCC1_WGMXCCGn1
    SolutionIndex: 48
    SolutionNameMin: Cijk_Alik_Bljk_B8F8NB8NS_BH_Bias_HAS_SAV_UserArgs_MT144x256x128_MI16x16x1_SN_LDSB1_CLR1_GRVWA8_GRVWB16_GSU0_GSUC0_GSUWGMRR0_K1_LBSPPA128_LBSPPB512_LPA8_LPB16_LRVW8_MIWT9_4_PLR1_SU0_SUM0_SUS128_VWA1_VWB4_WGM8_WGMXCC1_WGMXCCGn1
    SolutionIndex: 49
    SolutionNameMin: Cijk_Alik_Bljk_B8F8NB8NS_BH_Bias_HAS_SAV_UserArgs_MT128x128x128_MI16x16x1_SN_LDSB1_CLR1_GRVWA8_GRVWB16_GSU0_GSUC0_GSUWGMRR0_K1_LBSPPA1024_LBSPPB256_LPA8_LPB16_LRVW8_MIWT8_2_PLR1_SU0_SUM0_SUS128_VWA8_VWB2_WGM1_WGMXCC1_WGMXCCGn1
    SolutionIndex: 50
    SolutionNameMin: Cijk_Alik_Bljk_B8F8NB8NS_BH_Bias_HAS_SAV_UserArgs_MT128x128x128_MI16x16x1_SN_LDSB1_CLR1_GRVWA8_GRVWB16_GSU0_GSUC0_GSUWGMRR0_K1_LBSPPA1024_LBSPPB256_LPA8_LPB16_LRVW8_MIWT8_2_PLR1_SU0_SUM0_SUS128_VWA8_VWB2_WGM4_WGMXCC1_WGMXCCGn1
    SolutionIndex: 51
    SolutionNameMin: Cijk_Alik_Bljk_B8F8NB8NS_BH_Bias_HAS_SAV_UserArgs_MT128x128x128_MI16x16x1_SN_LDSB1_CLR1_GRVWA8_GRVWB16_GSU0_GSUC0_GSUWGMRR0_K1_LBSPPA1024_LBSPPB256_LPA8_LPB16_LRVW8_MIWT8_2_PLR1_SU0_SUM0_SUS128_VWA8_VWB2_WGM6_WGMXCC1_WGMXCCGn1
    SolutionIndex: 52
    SolutionNameMin: Cijk_Alik_Bljk_B8F8NB8NS_BH_Bias_HAS_SAV_UserArgs_MT128x128x128_MI16x16x1_SN_LDSB1_CLR1_GRVWA8_GRVWB16_GSU0_GSUC0_GSUWGMRR0_K1_LBSPPA1024_LBSPPB256_LPA8_LPB16_LRVW8_MIWT8_2_PLR1_SU0_SUM0_SUS128_VWA8_VWB2_WGM8_WGMXCC1_WGMXCCGn1
    SolutionIndex: 53
    SolutionNameMin: Cijk_Alik_Bljk_B8F8NB8NS_BH_Bias_HAS_SAV_UserArgs_MT128x144x128_MI16x16x1_SN_LDSB1_CLR1_GRVWA16_GRVWB8_GSU0_GSUC0_GSUWGMRR0_K1_LBSPPA256_LBSPPB128_LPA16_LPB8_LRVW8_MIWT2_9_PLR1_SU0_SUM0_SUS128_VWA2_VWB1_WGM1_WGMXCC1_WGMXCCGn1
    SolutionIndex: 54
    SolutionNameMin: Cijk_Alik_Bljk_B8F8NB8NS_BH_Bias_HAS_SAV_UserArgs_MT144x128x128_MI16x16x1_SN_LDSB1_CLR1_GRVWA8_GRVWB16_GSU0_GSUC0_GSUWGMRR0_K1_LBSPPA128_LBSPPB256_LPA8_LPB16_LRVW8_MIWT9_2_PLR1_SU0_SUM0_SUS128_VWA1_VWB2_WGM4_WGMXCC1_WGMXCCGn1
    SolutionIndex: 55
    SolutionNameMin: Cijk_Alik_Bljk_B8F8NB8NS_BH_Bias_HAS_SAV_UserArgs_MT144x128x128_MI16x16x1_SN_LDSB1_CLR1_GRVWA8_GRVWB16_GSU0_GSUC0_GSUWGMRR0_K1_LBSPPA128_LBSPPB256_LPA8_LPB16_LRVW8_MIWT9_2_PLR1_SU0_SUM0_SUS128_VWA1_VWB2_WGM6_WGMXCC1_WGMXCCGn1
    SolutionIndex: 56
    SolutionNameMin: Cijk_Alik_Bljk_B8F8NB8NS_BH_Bias_HAS_SAV_UserArgs_MT128x128x128_MI16x16x1_SN_LDSB1_CLR1_GRVWA8_GRVWB16_GSU0_GSUC0_GSUWGMRR0_K1_LBSPPA512_LBSPPB512_LPA8_LPB16_LRVW8_MIWT4_4_PLR1_SU0_SUM0_SUS128_VWA4_VWB4_WGM1_WGMXCC1_WGMXCCGn1
    SolutionIndex: 57
    SolutionNameMin: Cijk_Alik_Bljk_B8F8NB8NS_BH_Bias_HAS_SAV_UserArgs_MT128x128x128_MI16x16x1_SN_LDSB1_CLR1_GRVWA16_GRVWB16_GSU0_GSUC0_GSUWGMRR0_K1_LBSPPA512_LBSPPB512_LPA16_LPB16_LRVW8_MIWT4_4_PLR1_SU0_SUM0_SUS128_VWA4_VWB4_WGM1_WGMXCC1_WGMXCCGn1
    SolutionIndex: 58
    SolutionNameMin: Cijk_Alik_Bljk_B8F8NB8NS_BH_Bias_HAS_SAV_UserArgs_MT128x128x128_MI16x16x1_SN_LDSB1_CLR1_GRVWA16_GRVWB16_GSU0_GSUC0_GSUWGMRR0_K1_LBSPPA512_LBSPPB512_LPA16_LPB16_LRVW8_MIWT4_4_PLR1_SU0_SUM0_SUS128_VWA4_VWB4_WGM4_WGMXCC1_WGMXCCGn1
    SolutionIndex: 59
    SolutionNameMin: Cijk_Alik_Bljk_B8F8NB8NS_BH_Bias_HAS_SAV_UserArgs_MT128x128x128_MI16x16x1_SN_LDSB1_CLR1_GRVWA8_GRVWB16_GSU0_GSUC0_GSUWGMRR0_K1_LBSPPA512_LBSPPB512_LPA8_LPB16_LRVW8_MIWT4_4_PLR1_SU0_SUM0_SUS128_VWA4_VWB4_WGM6_WGMXCC1_WGMXCCGn1
    SolutionIndex: 60
    SolutionNameMin: Cijk_Alik_Bljk_B8F8NB8NS_BH_Bias_HAS_SAV_UserArgs_MT128x128x128_MI16x16x1_SN_LDSB1_CLR1_GRVWA8_GRVWB16_GSU0_GSUC0_GSUWGMRR0_K1_LBSPPA512_LBSPPB512_LPA8_LPB16_LRVW8_MIWT4_4_PLR1_SU0_SUM0_SUS128_VWA4_VWB4_WGM8_WGMXCC1_WGMXCCGn1
    SolutionIndex: 61
    SolutionNameMin: Cijk_Alik_Bljk_B8F8NB8NS_BH_Bias_HAS_SAV_UserArgs_MT128x128x128_MI16x16x1_SN_LDSB1_CLR1_GRVWA16_GRVWB16_GSU0_GSUC0_GSUWGMRR0_K1_LBSPPA512_LBSPPB512_LPA16_LPB16_LRVW8_MIWT4_4_PLR1_SU0_SUM0_SUS128_VWA4_VWB4_WGM8_WGMXCC1_WGMXCCGn1
    SolutionIndex: 62
    SolutionNameMin: Cijk_Alik_Bljk_B8F8NB8NS_BH_Bias_HAS_SAV_UserArgs_MT64x128x128_MI16x16x1_SN_LDSB1_CLR1_GRVWA8_GRVWB16_GSU0_GSUC0_GSUWGMRR0_K1_LBSPPA256_LBSPPB512_LPA8_LPB16_LRVW8_MIWT2_4_PLR1_SU0_SUM0_SUS128_VWA2_VWB4_WGM1_WGMXCC1_WGMXCCGn1
    SolutionIndex: 63
    SolutionNameMin: Cijk_Alik_Bljk_B8F8NB8NS_BH_Bias_HAS_SAV_UserArgs_MT64x128x128_MI16x16x1_SN_LDSB1_CLR1_GRVWA8_GRVWB16_GSU0_GSUC0_GSUWGMRR0_K1_LBSPPA256_LBSPPB512_LPA8_LPB16_LRVW8_MIWT2_4_PLR1_SU0_SUM0_SUS128_VWA2_VWB4_WGM4_WGMXCC1_WGMXCCGn1
    SolutionIndex: 64
    SolutionNameMin: Cijk_Alik_Bljk_B8F8NB8NS_BH_Bias_HAS_SAV_UserArgs_MT64x128x128_MI16x16x1_SN_LDSB1_CLR1_GRVWA8_GRVWB16_GSU0_GSUC0_GSUWGMRR0_K1_LBSPPA256_LBSPPB512_LPA8_LPB16_LRVW8_MIWT2_4_PLR1_SU0_SUM0_SUS128_VWA2_VWB4_WGM8_WGMXCC1_WGMXCCGn1
    SolutionIndex: 65
    SolutionNameMin: Cijk_Alik_Bljk_B8F8NB8NS_BH_Bias_HAS_SAV_UserArgs_MT64x64x128_MI16x16x1_SN_LDSB1_CLR1_GRVWA16_GRVWB8_GSU0_GSUC0_GSUWGMRR0_K1_LBSPPA256_LBSPPB256_LPA16_LPB8_LRVW8_MIWT2_2_PLR1_SU0_SUM0_SUS128_VWA2_VWB2_WGM1_WGMXCC1_WGMXCCGn1
    SolutionIndex: 66
    SolutionNameMin: Cijk_Alik_Bljk_B8F8NB8NS_BH_Bias_HAS_SAV_UserArgs_MT64x64x128_MI16x16x1_SN_LDSB1_CLR1_GRVWA8_GRVWB16_GSU0_GSUC0_GSUWGMRR0_K1_LBSPPA256_LBSPPB256_LPA8_LPB16_LRVW8_MIWT2_2_PLR1_SU0_SUM0_SUS128_VWA2_VWB2_WGM1_WGMXCC1_WGMXCCGn1
    SolutionIndex: 67
    SolutionNameMin: Cijk_Alik_Bljk_B8F8NB8NS_BH_Bias_HAS_SAV_UserArgs_MT64x64x128_MI16x16x1_SN_LDSB1_CLR1_GRVWA8_GRVWB16_GSU0_GSUC0_GSUWGMRR0_K1_LBSPPA256_LBSPPB256_LPA8_LPB16_LRVW8_MIWT2_2_PLR1_SU0_SUM0_SUS128_VWA2_VWB2_WGM8_WGMXCC1_WGMXCCGn1
    SolutionIndex: 68
    SolutionNameMin: Cijk_Alik_Bljk_B8F8NB8NS_BH_Bias_HAS_SAV_UserArgs_MT32x64x128_MI16x16x1_SN_LDSB0_CLR1_GRVWA8_GRVWB8_GSU0_GSUC0_GSUWGMRR0_K1_LBSPPA128_LBSPPB256_LPA8_LPB8_LRVW8_MIWT1_2_PLR1_SU0_SUM0_SUS128_VWA1_VWB2_WGM1_WGMXCC1_WGMXCCGn1
    SolutionIndex: 69
    SolutionNameMin: Cijk_Alik_Bljk_B8F8NB8NS_BH_Bias_HAS_SAV_UserArgs_MT32x64x128_MI16x16x1_SN_LDSB0_CLR1_GRVWA16_GRVWB8_GSU0_GSUC0_GSUWGMRR0_K1_LBSPPA128_LBSPPB256_LPA16_LPB8_LRVW8_MIWT1_2_PLR1_SU0_SUM0_SUS128_VWA1_VWB2_WGM1_WGMXCC1_WGMXCCGn1
    SolutionIndex: 70
    SolutionNameMin: Cijk_Alik_Bljk_B8F8NB8NS_BH_Bias_HAS_SAV_UserArgs_MT32x64x128_MI16x16x1_SN_LDSB0_CLR1_GRVWA8_GRVWB8_GSU0_GSUC0_GSUWGMRR0_K1_LBSPPA128_LBSPPB256_LPA8_LPB8_LRVW8_MIWT1_2_PLR1_SU0_SUM0_SUS128_VWA1_VWB2_WGM4_WGMXCC1_WGMXCCGn1
    SolutionIndex: 71
    SolutionNameMin: Cijk_Alik_Bljk_B8F8NB8NS_BH_Bias_HAS_SAV_UserArgs_MT64x32x128_MI16x16x1_SN_LDSB0_CLR1_GRVWA8_GRVWB8_GSU0_GSUC0_GSUWGMRR0_K1_LBSPPA256_LBSPPB128_LPA8_LPB8_LRVW8_MIWT2_1_PLR1_SU0_SUM0_SUS128_VWA2_VWB1_WGM1_WGMXCC1_WGMXCCGn1
    SolutionIndex: 72
    SolutionNameMin: Cijk_Alik_Bljk_B8F8NB8NS_BH_Bias_HAS_SAV_UserArgs_MT64x32x128_MI16x16x1_SN_LDSB0_CLR1_GRVWA16_GRVWB8_GSU0_GSUC0_GSUWGMRR0_K1_LBSPPA256_LBSPPB128_LPA16_LPB8_LRVW8_MIWT2_1_PLR1_SU0_SUM0_SUS128_VWA2_VWB1_WGM1_WGMXCC1_WGMXCCGn1
    SolutionIndex: 73
    SolutionNameMin: Cijk_Alik_Bljk_B8F8NB8NS_BH_Bias_HAS_SAV_UserArgs_MT64x32x128_MI16x16x1_SN_LDSB0_CLR1_GRVWA8_GRVWB16_GSU0_GSUC0_GSUWGMRR0_K1_LBSPPA256_LBSPPB128_LPA8_LPB16_LRVW8_MIWT2_1_PLR1_SU0_SUM0_SUS128_VWA2_VWB1_WGM1_WGMXCC1_WGMXCCGn1
    SolutionIndex: 74
    SolutionNameMin: Cijk_Alik_Bljk_B8F8NB8NS_BH_Bias_HAS_SAV_UserArgs_MT64x32x128_MI16x16x1_SN_LDSB0_CLR1_GRVWA16_GRVWB16_GSU0_GSUC0_GSUWGMRR0_K1_LBSPPA256_LBSPPB128_LPA16_LPB16_LRVW8_MIWT2_1_PLR1_SU0_SUM0_SUS128_VWA2_VWB1_WGM1_WGMXCC1_WGMXCCGn1
    SolutionIndex: 75
    SolutionNameMin: Cijk_Alik_Bljk_B8F8NB8NS_BH_Bias_HAS_SAV_UserArgs_MT32x32x128_MI16x16x1_SN_LDSB0_CLR1_GRVWA8_GRVWB8_GSU0_GSUC0_GSUWGMRR0_K1_LBSPPA128_LBSPPB128_LPA8_LPB8_LRVW8_MIWT1_1_PLR1_SU0_SUM0_SUS128_VWA1_VWB1_WGM1_WGMXCC1_WGMXCCGn1
    SolutionIndex: 76
    SolutionNameMin: Cijk_Alik_Bljk_B8F8NB8NS_BH_Bias_HAS_SAV_UserArgs_MT32x32x128_MI16x16x1_SN_LDSB0_CLR1_GRVWA16_GRVWB8_GSU0_GSUC0_GSUWGMRR0_K1_LBSPPA128_LBSPPB128_LPA16_LPB8_LRVW8_MIWT1_1_PLR1_SU0_SUM0_SUS128_VWA1_VWB1_WGM1_WGMXCC1_WGMXCCGn1
    SolutionIndex: 77
    SolutionNameMin: Cijk_Alik_Bljk_B8F8NB8NS_BH_Bias_HAS_SAV_UserArgs_MT32x32x128_MI16x16x1_SN_LDSB0_CLR1_GRVWA8_GRVWB16_GSU0_GSUC0_GSUWGMRR0_K1_LBSPPA128_LBSPPB128_LPA8_LPB16_LRVW8_MIWT1_1_PLR1_SU0_SUM0_SUS128_VWA1_VWB1_WGM1_WGMXCC1_WGMXCCGn1
    SolutionIndex: 78
    SolutionNameMin: Cijk_Alik_Bljk_B8F8NB8NS_BH_Bias_HAS_SAV_UserArgs_MT32x32x128_MI16x16x1_SN_LDSB0_CLR1_GRVWA16_GRVWB16_GSU0_GSUC0_GSUWGMRR0_K1_LBSPPA128_LBSPPB128_LPA16_LPB16_LRVW8_MIWT1_1_PLR1_SU0_SUM0_SUS128_VWA1_VWB1_WGM1_WGMXCC1_WGMXCCGn1
    SolutionIndex: 79
    SolutionNameMin: Cijk_Alik_Bljk_B8F8NB8NS_BH_Bias_HAS_SAV_UserArgs_MT32x32x128_MI16x16x1_SN_LDSB0_CLR1_GRVWA8_GRVWB8_GSU0_GSUC0_GSUWGMRR0_K1_LBSPPA128_LBSPPB128_LPA8_LPB8_LRVW8_MIWT1_1_PLR1_SU0_SUM0_SUS128_VWA1_VWB1_WGM4_WGMXCC1_WGMXCCGn1
    SolutionIndex: 80
    SolutionNameMin: Cijk_Alik_Bljk_B8F8NB8NS_BH_Bias_HAS_SAV_UserArgs_MT32x32x128_MI16x16x1_SN_LDSB0_CLR1_GRVWA8_GRVWB8_GSU0_GSUC0_GSUWGMRR0_K1_LBSPPA128_LBSPPB128_LPA8_LPB8_LRVW8_MIWT1_1_PLR1_SU0_SUM0_SUS128_VWA1_VWB1_WGM6_WGMXCC1_WGMXCCGn1
    SolutionIndex: 81
    SolutionNameMin: Cijk_Alik_Bljk_B8F8NB8NS_BH_Bias_HAS_SAV_UserArgs_MT32x32x128_MI16x16x1_SN_LDSB0_CLR1_GRVWA8_GRVWB16_GSU0_GSUC0_GSUWGMRR0_K1_LBSPPA128_LBSPPB128_LPA8_LPB16_LRVW8_MIWT1_1_PLR1_SU0_SUM0_SUS128_VWA1_VWB1_WGM6_WGMXCC1_WGMXCCGn1
    SolutionIndex: 82
    SolutionNameMin: Cijk_Alik_Bljk_B8F8NB8NS_BH_Bias_HAS_SAV_UserArgs_MT128x64x256_MI16x16x1_SN_LDSB1_CLR1_GRVWA8_GRVWB8_GSU0_GSUC0_GSUWGMRR0_K1_LBSPPA1024_LBSPPB512_LPA8_LPB8_LRVW8_MIWT4_2_PLR1_SU0_SUM0_SUS256_VWA4_VWB2_WGM1_WGMXCC1_WGMXCCGn1
    SolutionIndex: 83
    SolutionNameMin: Cijk_Alik_Bljk_B8F8NB8NS_BH_Bias_HAS_SAV_UserArgs_MT128x64x256_MI16x16x1_SN_LDSB1_CLR1_GRVWA8_GRVWB16_GSU0_GSUC0_GSUWGMRR0_K1_LBSPPA1024_LBSPPB512_LPA8_LPB16_LRVW8_MIWT4_2_PLR1_SU0_SUM0_SUS256_VWA4_VWB2_WGM1_WGMXCC1_WGMXCCGn1
    SolutionIndex: 84
    SolutionNameMin: Cijk_Alik_Bljk_B8F8NB8NS_BH_Bias_HAS_SAV_UserArgs_MT128x64x256_MI16x16x1_SN_LDSB1_CLR1_GRVWA8_GRVWB16_GSU0_GSUC0_GSUWGMRR0_K1_LBSPPA1024_LBSPPB512_LPA8_LPB16_LRVW8_MIWT4_2_PLR1_SU0_SUM0_SUS256_VWA4_VWB2_WGM4_WGMXCC1_WGMXCCGn1
    SolutionIndex: 85
    SolutionNameMin: Cijk_Alik_Bljk_B8F8NB8NS_BH_Bias_HAS_SAV_UserArgs_MT128x64x256_MI16x16x1_SN_LDSB1_CLR1_GRVWA8_GRVWB16_GSU0_GSUC0_GSUWGMRR0_K1_LBSPPA1024_LBSPPB512_LPA8_LPB16_LRVW8_MIWT4_2_PLR1_SU0_SUM0_SUS256_VWA4_VWB2_WGM6_WGMXCC1_WGMXCCGn1
    SolutionIndex: 86
    SolutionNameMin: Cijk_Alik_Bljk_B8F8NB8NS_BH_Bias_HAS_SAV_UserArgs_MT128x64x256_MI16x16x1_SN_LDSB1_CLR1_GRVWA8_GRVWB16_GSU0_GSUC0_GSUWGMRR0_K1_LBSPPA1024_LBSPPB512_LPA8_LPB16_LRVW8_MIWT4_2_PLR1_SU0_SUM0_SUS256_VWA4_VWB2_WGM8_WGMXCC1_WGMXCCGn1
    SolutionIndex: 87
    SolutionNameMin: Cijk_Alik_Bljk_B8F8NB8NS_BH_Bias_HAS_SAV_UserArgs_MT64x64x256_MI16x16x1_SN_LDSB1_CLR1_GRVWA8_GRVWB16_GSU0_GSUC0_GSUWGMRR0_K1_LBSPPA512_LBSPPB512_LPA8_LPB16_LRVW8_MIWT2_2_PLR1_SU0_SUM0_SUS256_VWA2_VWB2_WGM1_WGMXCC1_WGMXCCGn1
    SolutionIndex: 88
    SolutionNameMin: Cijk_Alik_Bljk_B8F8NB8NS_BH_Bias_HAS_SAV_UserArgs_MT64x64x256_MI16x16x1_SN_LDSB1_CLR1_GRVWA8_GRVWB16_GSU0_GSUC0_GSUWGMRR0_K1_LBSPPA512_LBSPPB512_LPA8_LPB16_LRVW8_MIWT2_2_PLR1_SU0_SUM0_SUS256_VWA2_VWB2_WGM4_WGMXCC1_WGMXCCGn1
    SolutionIndex: 89
    SolutionNameMin: Cijk_Alik_Bljk_B8F8NB8NS_BH_Bias_HAS_SAV_UserArgs_MT64x64x256_MI16x16x1_SN_LDSB1_CLR1_GRVWA8_GRVWB16_GSU0_GSUC0_GSUWGMRR0_K1_LBSPPA512_LBSPPB512_LPA8_LPB16_LRVW8_MIWT2_2_PLR1_SU0_SUM0_SUS256_VWA2_VWB2_WGM6_WGMXCC1_WGMXCCGn1
    SolutionIndex: 90
    SolutionNameMin: Cijk_Alik_Bljk_B8F8NB8NS_BH_Bias_HAS_SAV_UserArgs_MT32x32x256_MI16x16x1_SN_LDSB1_CLR1_GRVWA8_GRVWB16_GSU0_GSUC0_GSUWGMRR0_K1_LBSPPA256_LBSPPB256_LPA8_LPB16_LRVW8_MIWT1_1_PLR1_SU0_SUM0_SUS256_VWA1_VWB1_WGM1_WGMXCC1_WGMXCCGn1
    SolutionIndex: 91
    SolutionNameMin: Cijk_Alik_Bljk_B8F8NB8NS_BH_Bias_HAS_SAV_UserArgs_MT32x32x256_MI16x16x1_SN_LDSB1_CLR1_GRVWA8_GRVWB16_GSU0_GSUC0_GSUWGMRR0_K1_LBSPPA256_LBSPPB256_LPA8_LPB16_LRVW8_MIWT1_1_PLR1_SU0_SUM0_SUS256_VWA1_VWB1_WGM4_WGMXCC1_WGMXCCGn1
    SolutionIndex: 92
    SolutionNameMin: Cijk_Alik_Bljk_B8F8NB8NS_BH_Bias_HAS_SAV_UserArgs_MT64x32x32_MI16x16x1_SN_LDSB0_CLR0_GRVWA8_GRVWB4_GSU0_GSUC0_GSUWGMRR0_K1_LBSPPA128_LBSPPB128_LPA8_LPB8_LRVW8_MIWT2_1_PLR0_SU32_SUM0_SUS256_VWA2_VWB1_WGM4_WGMXCC1_WGMXCCGn1
- - - [128, 128, 1, 128, 128, 128, 128, 128]
    - [76, 0.61]
  - - [128, 128, 1, 256, 128, 128, 256, 256]
    - [77, 1.13]
  - - [128, 128, 1, 512, 128, 128, 512, 512]
    - [77, 2.03]
  - - [128, 128, 1, 1024, 128, 128, 1024, 1024]
    - [75, 3.41]
  - - [128, 128, 1, 2048, 128, 128, 2048, 2048]
    - [75, 5.21]
  - - [128, 128, 1, 4096, 128, 128, 4096, 4096]
    - [75, 7.09]
  - - [128, 128, 1, 8192, 128, 128, 8192, 8192]
    - [75, 8.62]
  - - [128, 256, 1, 128, 128, 128, 128, 128]
    - [75, 1.24]
  - - [128, 256, 1, 256, 128, 128, 256, 256]
    - [77, 2.33]
  - - [128, 256, 1, 512, 128, 128, 512, 512]
    - [77, 4.2]
  - - [128, 256, 1, 1024, 128, 128, 1024, 1024]
    - [75, 6.97]
  - - [128, 256, 1, 2048, 128, 128, 2048, 2048]
    - [75, 10.47]
  - - [128, 256, 1, 4096, 128, 128, 4096, 4096]
    - [75, 14.27]
  - - [128, 256, 1, 8192, 128, 128, 8192, 8192]
    - [75, 17.31]
  - - [128, 512, 1, 128, 128, 128, 128, 128]
    - [76, 2.47]
  - - [128, 512, 1, 256, 128, 128, 256, 256]
    - [78, 4.59]
  - - [128, 512, 1, 512, 128, 128, 512, 512]
    - [76, 8.23]
  - - [128, 512, 1, 1024, 128, 128, 1024, 1024]
    - [75, 13.87]
  - - [128, 512, 1, 2048, 128, 128, 2048, 2048]
    - [75, 21.29]
  - - [128, 512, 1, 4096, 128, 128, 4096, 4096]
    - [75, 28.47]
  - - [128, 512, 1, 8192, 128, 128, 8192, 8192]
    - [75, 34.43]
  - - [128, 1024, 1, 128, 128, 128, 128, 128]
    - [77, 4.85]
  - - [128, 1024, 1, 256, 128, 128, 256, 256]
    - [78, 9.04]
  - - [128, 1024, 1, 512, 128, 128, 512, 512]
    - [77, 16.38]
  - - [128, 1024, 1, 1024, 128, 128, 1024, 1024]
    - [76, 26.99]
  - - [128, 1024, 1, 2048, 128, 128, 2048, 2048]
    - [75, 41.43]
  - - [128, 1024, 1, 4096, 128, 128, 4096, 4096]
    - [75, 55.81]
  - - [128, 1024, 1, 8192, 128, 128, 8192, 8192]
    - [75, 67.72]
  - - [128, 2048, 1, 128, 128, 128, 128, 128]
    - [27, 9.04]
  - - [128, 2048, 1, 256, 128, 128, 256, 256]
    - [72, 16.75]
  - - [128, 2048, 1, 512, 128, 128, 512, 512]
    - [73, 29.31]
  - - [128, 2048, 1, 1024, 128, 128, 1024, 1024]
    - [73, 47.8]
  - - [128, 2048, 1, 2048, 128, 128, 2048, 2048]
    - [68, 68.65]
  - - [128, 2048, 1, 4096, 128, 128, 4096, 4096]
    - [68, 89.14]
  - - [128, 2048, 1, 8192, 128, 128, 8192, 8192]
    - [71, 102.39]
  - - [128, 4096, 1, 128, 128, 128, 128, 128]
    - [25, 16.74]
  - - [128, 4096, 1, 256, 128, 128, 256, 256]
    - [22, 30.11]
  - - [128, 4096, 1, 512, 128, 128, 512, 512]
    - [22, 50.19]
  - - [128, 4096, 1, 1024, 128, 128, 1024, 1024]
    - [66, 77.34]
  - - [128, 4096, 1, 2048, 128, 128, 2048, 2048]
    - [66, 105.81]
  - - [128, 4096, 1, 4096, 128, 128, 4096, 4096]
    - [66, 130.94]
  - - [128, 4096, 1, 8192, 128, 128, 8192, 8192]
    - [87, 142.46]
  - - [128, 8192, 1, 128, 128, 128, 128, 128]
    - [16, 28.1]
  - - [128, 8192, 1, 256, 128, 128, 256, 256]
    - [17, 50.18]
  - - [128, 8192, 1, 512, 128, 128, 512, 512]
    - [17, 83.94]
  - - [128, 8192, 1, 1024, 128, 128, 1024, 1024]
    - [17, 123.39]
  - - [128, 8192, 1, 2048, 128, 128, 2048, 2048]
    - [17, 162.05]
  - - [128, 8192, 1, 4096, 128, 128, 4096, 4096]
    - [83, 168.02]
  - - [128, 8192, 1, 8192, 128, 128, 8192, 8192]
    - [84, 186.41]
  - - [256, 128, 1, 128, 256, 256, 128, 128]
    - [77, 1.24]
  - - [256, 128, 1, 256, 256, 256, 256, 256]
    - [90, 2.15]
  - - [256, 128, 1, 512, 256, 256, 512, 512]
    - [75, 4.02]
  - - [256, 128, 1, 1024, 256, 256, 1024, 1024]
    - [75, 6.86]
  - - [256, 128, 1, 2048, 256, 256, 2048, 2048]
    - [75, 10.42]
  - - [256, 128, 1, 4096, 256, 256, 4096, 4096]
    - [75, 14.18]
  - - [256, 128, 1, 8192, 256, 256, 8192, 8192]
    - [75, 17.25]
  - - [256, 256, 1, 128, 256, 256, 128, 128]
    - [28, 2.33]
  - - [256, 256, 1, 256, 256, 256, 256, 256]
    - [29, 4.25]
  - - [256, 256, 1, 512, 256, 256, 512, 512]
    - [77, 8.08]
  - - [256, 256, 1, 1024, 256, 256, 1024, 1024]
    - [75, 13.42]
  - - [256, 256, 1, 2048, 256, 256, 2048, 2048]
    - [75, 20.8]
  - - [256, 256, 1, 4096, 256, 256, 4096, 4096]
    - [75, 28.16]
  - - [256, 256, 1, 8192, 256, 256, 8192, 8192]
    - [75, 34.16]
  - - [256, 512, 1, 128, 256, 256, 128, 128]
    - [69, 4.31]
  - - [256, 512, 1, 256, 256, 256, 256, 256]
    - [30, 8.36]
  - - [256, 512, 1, 512, 256, 256, 512, 512]
    - [78, 15.36]
  - - [256, 512, 1, 1024, 256, 256, 1024, 1024]
    - [75, 26.83]
  - - [256, 512, 1, 2048, 256, 256, 2048, 2048]
    - [75, 40.98]
  - - [256, 512, 1, 4096, 256, 256, 4096, 4096]
    - [75, 55.51]
  - - [256, 512, 1, 8192, 256, 256, 8192, 8192]
    - [75, 67.48]
  - - [256, 1024, 1, 128, 256, 256, 128, 128]
    - [26, 8.83]
  - - [256, 1024, 1, 256, 256, 256, 256, 256]
    - [27, 16.55]
  - - [256, 1024, 1, 512, 256, 256, 512, 512]
    - [72, 28.97]
  - - [256, 1024, 1, 1024, 256, 256, 1024, 1024]
    - [73, 46.87]
  - - [256, 1024, 1, 2048, 256, 256, 2048, 2048]
    - [68, 68.22]
  - - [256, 1024, 1, 4096, 256, 256, 4096, 4096]
    - [68, 88.66]
  - - [256, 1024, 1, 8192, 256, 256, 8192, 8192]
    - [71, 102.6]
  - - [256, 2048, 1, 128, 256, 256, 128, 128]
    - [24, 16.31]
  - - [256, 2048, 1, 256, 256, 256, 256, 256]
    - [22, 29.78]
  - - [256, 2048, 1, 512, 256, 256, 512, 512]
    - [66, 50.08]
  - - [256, 2048, 1, 1024, 256, 256, 1024, 1024]
    - [65, 76.35]
  - - [256, 2048, 1, 2048, 256, 256, 2048, 2048]
    - [66, 106.1]
  - - [256, 2048, 1, 4096, 256, 256, 4096, 4096]
    - [66, 130.78]
  - - [256, 2048, 1, 8192, 256, 256, 8192, 8192]
    - [87, 142.74]
  - - [256, 4096, 1, 128, 256, 256, 128, 128]
    - [16, 28.45]
  - - [256, 4096, 1, 256, 256, 256, 256, 256]
    - [17, 50.65]
  - - [256, 4096, 1, 512, 256, 256, 512, 512]
    - [17, 85.08]
  - - [256, 4096, 1, 1024, 256, 256, 1024, 1024]
    - [17, 123.36]
  - - [256, 4096, 1, 2048, 256, 256, 2048, 2048]
    - [17, 162.68]
  - - [256, 4096, 1, 4096, 256, 256, 4096, 4096]
    - [83, 180.17]
  - - [256, 4096, 1, 8192, 256, 256, 8192, 8192]
    - [82, 191.1]
  - - [256, 8192, 1, 128, 256, 256, 128, 128]
    - [49, 43.87]
  - - [256, 8192, 1, 256, 256, 256, 256, 256]
    - [11, 77.38]
  - - [256, 8192, 1, 512, 256, 256, 512, 512]
    - [11, 125.98]
  - - [256, 8192, 1, 1024, 256, 256, 1024, 1024]
    - [49, 181.79]
  - - [256, 8192, 1, 2048, 256, 256, 2048, 2048]
    - [49, 232.11]
  - - [256, 8192, 1, 4096, 256, 256, 4096, 4096]
    - [57, 222.9]
  - - [256, 8192, 1, 8192, 256, 256, 8192, 8192]
    - [56, 244.49]
  - - [512, 128, 1, 128, 512, 512, 128, 128]
    - [81, 2.23]
  - - [512, 128, 1, 256, 512, 512, 256, 256]
    - [77, 4.52]
  - - [512, 128, 1, 512, 512, 512, 512, 512]
    - [78, 8.13]
  - - [512, 128, 1, 1024, 512, 512, 1024, 1024]
    - [75, 13.49]
  - - [512, 128, 1, 2048, 512, 512, 2048, 2048]
    - [75, 20.62]
  - - [512, 128, 1, 4096, 512, 512, 4096, 4096]
    - [75, 28.2]
  - - [512, 128, 1, 8192, 512, 512, 8192, 8192]
    - [75, 34.35]
  - - [512, 256, 1, 128, 512, 512, 128, 128]
    - [75, 4.76]
  - - [512, 256, 1, 256, 512, 512, 256, 256]
    - [28, 8.96]
  - - [512, 256, 1, 512, 512, 512, 512, 512]
    - [78, 16.12]
  - - [512, 256, 1, 1024, 512, 512, 1024, 1024]
    - [77, 27.04]
  - - [512, 256, 1, 2048, 512, 512, 2048, 2048]
    - [75, 40.92]
  - - [512, 256, 1, 4096, 512, 512, 4096, 4096]
    - [79, 54.78]
  - - [512, 256, 1, 8192, 512, 512, 8192, 8192]
    - [79, 67.19]
  - - [512, 512, 1, 128, 512, 512, 128, 128]
    - [71, 9.19]
  - - [512, 512, 1, 256, 512, 512, 256, 256]
    - [74, 16.75]
  - - [512, 512, 1, 512, 512, 512, 512, 512]
    - [73, 29.02]
  - - [512, 512, 1, 1024, 512, 512, 1024, 1024]
    - [71, 46.71]
  - - [512, 512, 1, 2048, 512, 512, 2048, 2048]
    - [68, 68.1]
  - - [512, 512, 1, 4096, 512, 512, 4096, 4096]
    - [68, 88.23]
  - - [512, 512, 1, 8192, 512, 512, 8192, 8192]
    - [91, 97.77]
  - - [512, 1024, 1, 128, 512, 512, 128, 128]
    - [23, 16.27]
  - - [512, 1024, 1, 256, 512, 512, 256, 256]
    - [24, 29.91]
  - - [512, 1024, 1, 512, 512, 512, 512, 512]
    - [23, 49.32]
  - - [512, 1024, 1, 1024, 512, 512, 1024, 1024]
    - [66, 76.88]
  - - [512, 1024, 1, 2048, 512, 512, 2048, 2048]
    - [66, 105.4]
  - - [512, 1024, 1, 4096, 512, 512, 4096, 4096]
    - [66, 130.86]
  - - [512, 1024, 1, 8192, 512, 512, 8192, 8192]
    - [87, 142.17]
  - - [512, 2048, 1, 128, 512, 512, 128, 128]
    - [12, 28.08]
  - - [512, 2048, 1, 256, 512, 512, 256, 256]
    - [17, 50.15]
  - - [512, 2048, 1, 512, 512, 512, 512, 512]
    - [17, 83.33]
  - - [512, 2048, 1, 1024, 512, 512, 1024, 1024]
    - [17, 122.91]
  - - [512, 2048, 1, 2048, 512, 512, 2048, 2048]
    - [17, 161.87]
  - - [512, 2048, 1, 4096, 512, 512, 4096, 4096]
    - [17, 195.36]
  - - [512, 2048, 1, 8192, 512, 512, 8192, 8192]
    - [62, 194.5]
  - - [512, 4096, 1, 128, 512, 512, 128, 128]
    - [11, 44.54]
  - - [512, 4096, 1, 256, 512, 512, 256, 256]
    - [11, 78.51]
  - - [512, 4096, 1, 512, 512, 512, 512, 512]
    - [11, 127.03]
  - - [512, 4096, 1, 1024, 512, 512, 1024, 1024]
    - [13, 182.37]
  - - [512, 4096, 1, 2048, 512, 512, 2048, 2048]
    - [49, 235.91]
  - - [512, 4096, 1, 4096, 512, 512, 4096, 4096]
    - [57, 235.25]
  - - [512, 4096, 1, 8192, 512, 512, 8192, 8192]
    - [49, 253.4]
  - - [512, 8192, 1, 128, 512, 512, 128, 128]
    - [53, 65.07]
  - - [512, 8192, 1, 256, 512, 512, 256, 256]
    - [53, 116.62]
  - - [512, 8192, 1, 512, 512, 512, 512, 512]
    - [53, 189.1]
  - - [512, 8192, 1, 1024, 512, 512, 1024, 1024]
    - [53, 267.23]
  - - [512, 8192, 1, 2048, 512, 512, 2048, 2048]
    - [53, 257.25]
  - - [512, 8192, 1, 4096, 512, 512, 4096, 4096]
    - [53, 292.5]
  - - [512, 8192, 1, 8192, 512, 512, 8192, 8192]
    - [53, 292.64]
  - - [1024, 128, 1, 128, 1024, 1024, 128, 128]
    - [78, 4.9]
  - - [1024, 128, 1, 256, 1024, 1024, 256, 256]
    - [77, 9.08]
  - - [1024, 128, 1, 512, 1024, 1024, 512, 512]
    - [77, 16.04]
  - - [1024, 128, 1, 1024, 1024, 1024, 1024, 1024]
    - [76, 26.87]
  - - [1024, 128, 1, 2048, 1024, 1024, 2048, 2048]
    - [75, 40.67]
  - - [1024, 128, 1, 4096, 1024, 1024, 4096, 4096]
    - [80, 54.69]
  - - [1024, 128, 1, 8192, 1024, 1024, 8192, 8192]
    - [79, 66.87]
  - - [1024, 256, 1, 128, 1024, 1024, 128, 128]
    - [27, 9.01]
  - - [1024, 256, 1, 256, 1024, 1024, 256, 256]
    - [73, 16.54]
  - - [1024, 256, 1, 512, 1024, 1024, 512, 512]
    - [73, 29.35]
  - - [1024, 256, 1, 1024, 1024, 1024, 1024, 1024]
    - [73, 46.84]
  - - [1024, 256, 1, 2048, 1024, 1024, 2048, 2048]
    - [68, 67.53]
  - - [1024, 256, 1, 4096, 1024, 1024, 4096, 4096]
    - [68, 88.61]
  - - [1024, 256, 1, 8192, 1024, 1024, 8192, 8192]
    - [70, 103.13]
  - - [1024, 512, 1, 128, 1024, 1024, 128, 128]
    - [23, 16.04]
  - - [1024, 512, 1, 256, 1024, 1024, 256, 256]
    - [22, 30.05]
  - - [1024, 512, 1, 512, 1024, 1024, 512, 512]
    - [66, 48.79]
  - - [1024, 512, 1, 1024, 1024, 1024, 1024, 1024]
    - [66, 75.72]
  - - [1024, 512, 1, 2048, 1024, 1024, 2048, 2048]
    - [66, 105.22]
  - - [1024, 512, 1, 4096, 1024, 1024, 4096, 4096]
    - [67, 130.01]
  - - [1024, 512, 1, 8192, 1024, 1024, 8192, 8192]
    - [87, 142.23]
  - - [1024, 1024, 1, 128, 1024, 1024, 128, 128]
    - [16, 27.87]
  - - [1024, 1024, 1, 256, 1024, 1024, 256, 256]
    - [17, 50.2]
  - - [1024, 1024, 1, 512, 1024, 1024, 512, 512]
    - [17, 84.09]
  - - [1024, 1024, 1, 1024, 1024, 1024, 1024, 1024]
    - [17, 124.59]
  - - [1024, 1024, 1, 2048, 1024, 1024, 2048, 2048]
    - [17, 161.54]
  - - [1024, 1024, 1, 4096, 1024, 1024, 4096, 4096]
    - [86, 176.63]
  - - [1024, 1024, 1, 8192, 1024, 1024, 8192, 8192]
    - [83, 193.61]
  - - [1024, 2048, 1, 128, 1024, 1024, 128, 128]
    - [49, 43.9]
  - - [1024, 2048, 1, 256, 1024, 1024, 256, 256]
    - [11, 78.8]
  - - [1024, 2048, 1, 512, 1024, 1024, 512, 512]
    - [11, 127.33]
  - - [1024, 2048, 1, 1024, 1024, 1024, 1024, 1024]
    - [11, 183.82]
  - - [1024, 2048, 1, 2048, 1024, 1024, 2048, 2048]
    - [49, 237.37]
  - - [1024, 2048, 1, 4096, 1024, 1024, 4096, 4096]
    - [49, 237.11]
  - - [1024, 2048, 1, 8192, 1024, 1024, 8192, 8192]
    - [59, 254.03]
  - - [1024, 4096, 1, 128, 1024, 1024, 128, 128]
    - [8, 61.6]
  - - [1024, 4096, 1, 256, 1024, 1024, 256, 256]
    - [8, 107.04]
  - - [1024, 4096, 1, 512, 1024, 1024, 512, 512]
    - [8, 170.28]
  - - [1024, 4096, 1, 1024, 1024, 1024, 1024, 1024]
    - [8, 238.91]
  - - [1024, 4096, 1, 2048, 1024, 1024, 2048, 2048]
    - [41, 264.79]
  - - [1024, 4096, 1, 4096, 1024, 1024, 4096, 4096]
    - [41, 273.95]
  - - [1024, 4096, 1, 8192, 1024, 1024, 8192, 8192]
    - [42, 257.57]
  - - [1024, 8192, 1, 128, 1024, 1024, 128, 128]
    - [34, 92.76]
  - - [1024, 8192, 1, 256, 1024, 1024, 256, 256]
    - [34, 158.87]
  - - [1024, 8192, 1, 512, 1024, 1024, 512, 512]
    - [34, 247.43]
  - - [1024, 8192, 1, 1024, 1024, 1024, 1024, 1024]
    - [34, 276.7]
  - - [1024, 8192, 1, 2048, 1024, 1024, 2048, 2048]
    - [33, 319.22]
  - - [1024, 8192, 1, 4096, 1024, 1024, 4096, 4096]
    - [34, 358.58]
  - - [1024, 8192, 1, 8192, 1024, 1024, 8192, 8192]
    - [33, 361.25]
  - - [2048, 128, 1, 128, 2048, 2048, 128, 128]
    - [26, 9.08]
  - - [2048, 128, 1, 256, 2048, 2048, 256, 256]
    - [72, 16.64]
  - - [2048, 128, 1, 512, 2048, 2048, 512, 512]
    - [73, 29.08]
  - - [2048, 128, 1, 1024, 2048, 2048, 1024, 1024]
    - [73, 47.3]
  - - [2048, 128, 1, 2048, 2048, 2048, 2048, 2048]
    - [68, 68.76]
  - - [2048, 128, 1, 4096, 2048, 2048, 4096, 4096]
    - [70, 88.01]
  - - [2048, 128, 1, 8192, 2048, 2048, 8192, 8192]
    - [70, 101.82]
  - - [2048, 256, 1, 128, 2048, 2048, 128, 128]
    - [24, 16.43]
  - - [2048, 256, 1, 256, 2048, 2048, 256, 256]
    - [22, 29.63]
  - - [2048, 256, 1, 512, 2048, 2048, 512, 512]
    - [66, 49.19]
  - - [2048, 256, 1, 1024, 2048, 2048, 1024, 1024]
    - [66, 76.7]
  - - [2048, 256, 1, 2048, 2048, 2048, 2048, 2048]
    - [66, 105.18]
  - - [2048, 256, 1, 4096, 2048, 2048, 4096, 4096]
    - [67, 129.82]
  - - [2048, 256, 1, 8192, 2048, 2048, 8192, 8192]
    - [88, 142.22]
  - - [2048, 512, 1, 128, 2048, 2048, 128, 128]
    - [18, 27.67]
  - - [2048, 512, 1, 256, 2048, 2048, 256, 256]
    - [17, 50.58]
  - - [2048, 512, 1, 512, 2048, 2048, 512, 512]
    - [17, 83.56]
  - - [2048, 512, 1, 1024, 2048, 2048, 1024, 1024]
    - [17, 123.03]
  - - [2048, 512, 1, 2048, 2048, 2048, 2048, 2048]
    - [19, 160.82]
  - - [2048, 512, 1, 4096, 2048, 2048, 4096, 4096]
    - [64, 180.56]
  - - [2048, 512, 1, 8192, 2048, 2048, 8192, 8192]
    - [63, 192.1]
  - - [2048, 1024, 1, 128, 2048, 2048, 128, 128]
    - [13, 44.36]
  - - [2048, 1024, 1, 256, 2048, 2048, 256, 256]
    - [11, 79.15]
  - - [2048, 1024, 1, 512, 2048, 2048, 512, 512]
    - [11, 127.78]
  - - [2048, 1024, 1, 1024, 2048, 2048, 1024, 1024]
    - [11, 184.04]
  - - [2048, 1024, 1, 2048, 2048, 2048, 2048, 2048]
    - [50, 231.54]
  - - [2048, 1024, 1, 4096, 2048, 2048, 4096, 4096]
    - [61, 233.66]
  - - [2048, 1024, 1, 8192, 2048, 2048, 8192, 8192]
    - [51, 252.14]
  - - [2048, 2048, 1, 128, 2048, 2048, 128, 128]
    - [8, 61.58]
  - - [2048, 2048, 1, 256, 2048, 2048, 256, 256]
    - [8, 107.33]
  - - [2048, 2048, 1, 512, 2048, 2048, 512, 512]
    - [8, 170.58]
  - - [2048, 2048, 1, 1024, 2048, 2048, 1024, 1024]
    - [8, 239.13]
  - - [2048, 2048, 1, 2048, 2048, 2048, 2048, 2048]
    - [32, 257.03]
  - - [2048, 2048, 1, 4096, 2048, 2048, 4096, 4096]
    - [44, 271.07]
  - - [2048, 2048, 1, 8192, 2048, 2048, 8192, 8192]
    - [44, 260.08]
  - - [2048, 4096, 1, 128, 2048, 2048, 128, 128]
    - [0, 76.1]
  - - [2048, 4096, 1, 256, 2048, 2048, 256, 256]
    - [0, 130.65]
  - - [2048, 4096, 1, 512, 2048, 2048, 512, 512]
    - [0, 196.24]
  - - [2048, 4096, 1, 1024, 2048, 2048, 1024, 1024]
    - [5, 252.85]
  - - [2048, 4096, 1, 2048, 2048, 2048, 2048, 2048]
    - [3, 277.32]
  - - [2048, 4096, 1, 4096, 2048, 2048, 4096, 4096]
    - [35, 292.52]
  - - [2048, 4096, 1, 8192, 2048, 2048, 8192, 8192]
    - [39, 321.0]
  - - [2048, 8192, 1, 128, 2048, 2048, 128, 128]
    - [40, 100.52]
  - - [2048, 8192, 1, 256, 2048, 2048, 256, 256]
    - [40, 167.23]
  - - [2048, 8192, 1, 512, 2048, 2048, 512, 512]
    - [34, 236.33]
  - - [2048, 8192, 1, 1024, 2048, 2048, 1024, 1024]
    - [36, 292.18]
  - - [2048, 8192, 1, 2048, 2048, 2048, 2048, 2048]
    - [33, 326.85]
  - - [2048, 8192, 1, 4096, 2048, 2048, 4096, 4096]
    - [33, 321.96]
  - - [2048, 8192, 1, 8192, 2048, 2048, 8192, 8192]
    - [33, 368.99]
  - - [4096, 128, 1, 128, 4096, 4096, 128, 128]
    - [25, 16.06]
  - - [4096, 128, 1, 256, 4096, 4096, 256, 256]
    - [24, 29.48]
  - - [4096, 128, 1, 512, 4096, 4096, 512, 512]
    - [66, 49.21]
  - - [4096, 128, 1, 1024, 4096, 4096, 1024, 1024]
    - [66, 75.36]
  - - [4096, 128, 1, 2048, 4096, 4096, 2048, 2048]
    - [66, 105.23]
  - - [4096, 128, 1, 4096, 4096, 4096, 4096, 4096]
    - [67, 129.47]
  - - [4096, 128, 1, 8192, 4096, 4096, 8192, 8192]
    - [89, 142.03]
  - - [4096, 256, 1, 128, 4096, 4096, 128, 128]
    - [15, 27.16]
  - - [4096, 256, 1, 256, 4096, 4096, 256, 256]
    - [14, 48.94]
  - - [4096, 256, 1, 512, 4096, 4096, 512, 512]
    - [20, 81.9]
  - - [4096, 256, 1, 1024, 4096, 4096, 1024, 1024]
    - [19, 123.32]
  - - [4096, 256, 1, 2048, 4096, 4096, 2048, 2048]
    - [20, 160.45]
  - - [4096, 256, 1, 4096, 4096, 4096, 4096, 4096]
    - [63, 177.1]
  - - [4096, 256, 1, 8192, 4096, 4096, 8192, 8192]
    - [85, 194.97]
  - - [4096, 512, 1, 128, 4096, 4096, 128, 128]
    - [11, 44.1]
  - - [4096, 512, 1, 256, 4096, 4096, 256, 256]
    - [11, 77.87]
  - - [4096, 512, 1, 512, 4096, 4096, 512, 512]
    - [11, 125.86]
  - - [4096, 512, 1, 1024, 4096, 4096, 1024, 1024]
    - [11, 182.65]
  - - [4096, 512, 1, 2048, 4096, 4096, 2048, 2048]
    - [59, 229.72]
  - - [4096, 512, 1, 4096, 4096, 4096, 4096, 4096]
    - [52, 235.58]
  - - [4096, 512, 1, 8192, 4096, 4096, 8192, 8192]
    - [59, 254.8]
  - - [4096, 1024, 1, 128, 4096, 4096, 128, 128]
    - [10, 60.59]
  - - [4096, 1024, 1, 256, 4096, 4096, 256, 256]
    - [8, 107.27]
  - - [4096, 1024, 1, 512, 4096, 4096, 512, 512]
    - [8, 169.92]
  - - [4096, 1024, 1, 1024, 4096, 4096, 1024, 1024]
    - [9, 225.47]
  - - [4096, 1024, 1, 2048, 4096, 4096, 2048, 2048]
    - [44, 269.17]
  - - [4096, 1024, 1, 4096, 4096, 4096, 4096, 4096]
    - [43, 274.69]
  - - [4096, 1024, 1, 8192, 4096, 4096, 8192, 8192]
    - [56, 265.78]
  - - [4096, 2048, 1, 128, 4096, 4096, 128, 128]
    - [1, 75.8]
  - - [4096, 2048, 1, 256, 4096, 4096, 256, 256]
    - [0, 127.66]
  - - [4096, 2048, 1, 512, 4096, 4096, 512, 512]
    - [0, 189.54]
  - - [4096, 2048, 1, 1024, 4096, 4096, 1024, 1024]
    - [5, 245.64]
  - - [4096, 2048, 1, 2048, 4096, 4096, 2048, 2048]
    - [1, 278.26]
  - - [4096, 2048, 1, 4096, 4096, 4096, 4096, 4096]
    - [31, 279.24]
  - - [4096, 2048, 1, 8192, 4096, 4096, 8192, 8192]
    - [31, 306.04]
  - - [4096, 4096, 1, 128, 4096, 4096, 128, 128]
    - [2, 82.6]
  - - [4096, 4096, 1, 256, 4096, 4096, 256, 256]
    - [2, 138.71]
  - - [4096, 4096, 1, 512, 4096, 4096, 512, 512]
    - [6, 199.21]
  - - [4096, 4096, 1, 1024, 4096, 4096, 1024, 1024]
    - [5, 245.22]
  - - [4096, 4096, 1, 2048, 4096, 4096, 2048, 2048]
    - [39, 271.81]
  - - [4096, 4096, 1, 4096, 4096, 4096, 4096, 4096]
    - [45, 286.17]
  - - [4096, 4096, 1, 8192, 4096, 4096, 8192, 8192]
    - [41, 326.42]
  - - [4096, 8192, 1, 128, 4096, 4096, 128, 128]
    - [36, 108.51]
  - - [4096, 8192, 1, 256, 4096, 4096, 256, 256]
    - [34, 179.22]
  - - [4096, 8192, 1, 512, 4096, 4096, 512, 512]
    - [38, 235.06]
  - - [4096, 8192, 1, 1024, 4096, 4096, 1024, 1024]
    - [37, 270.97]
  - - [4096, 8192, 1, 2048, 4096, 4096, 2048, 2048]
    - [39, 312.73]
  - - [4096, 8192, 1, 4096, 4096, 4096, 4096, 4096]
    - [39, 337.33]
  - - [4096, 8192, 1, 8192, 4096, 4096, 8192, 8192]
    - [39, 385.93]
  - - [8192, 128, 1, 128, 8192, 8192, 128, 128]
    - [18, 28.49]
  - - [8192, 128, 1, 256, 8192, 8192, 256, 256]
    - [16, 50.75]
  - - [8192, 128, 1, 512, 8192, 8192, 512, 512]
    - [17, 83.93]
  - - [8192, 128, 1, 1024, 8192, 8192, 1024, 1024]
    - [19, 123.55]
  - - [8192, 128, 1, 2048, 8192, 8192, 2048, 2048]
    - [21, 161.19]
  - - [8192, 128, 1, 4096, 8192, 8192, 4096, 4096]
    - [85, 170.22]
  - - [8192, 128, 1, 8192, 8192, 8192, 8192, 8192]
    - [84, 190.69]
  - - [8192, 256, 1, 128, 8192, 8192, 128, 128]
    - [11, 43.9]
  - - [8192, 256, 1, 256, 8192, 8192, 256, 256]
    - [11, 78.17]
  - - [8192, 256, 1, 512, 8192, 8192, 512, 512]
    - [11, 127.34]
  - - [8192, 256, 1, 1024, 8192, 8192, 1024, 1024]
    - [11, 183.44]
  - - [8192, 256, 1, 2048, 8192, 8192, 2048, 2048]
    - [52, 228.14]
  - - [8192, 256, 1, 4096, 8192, 8192, 4096, 4096]
    - [58, 231.73]
  - - [8192, 256, 1, 8192, 8192, 8192, 8192, 8192]
    - [60, 251.08]
  - - [8192, 512, 1, 128, 8192, 8192, 128, 128]
    - [8, 61.09]
  - - [8192, 512, 1, 256, 8192, 8192, 256, 256]
    - [9, 106.15]
  - - [8192, 512, 1, 512, 8192, 8192, 512, 512]
    - [55, 168.35]
  - - [8192, 512, 1, 1024, 8192, 8192, 1024, 1024]
    - [54, 247.35]
  - - [8192, 512, 1, 2048, 8192, 8192, 2048, 2048]
    - [44, 260.8]
  - - [8192, 512, 1, 4096, 8192, 8192, 4096, 4096]
    - [55, 307.31]
  - - [8192, 512, 1, 8192, 8192, 8192, 8192, 8192]
    - [55, 314.62]
  - - [8192, 1024, 1, 128, 8192, 8192, 128, 128]
    - [0, 74.56]
  - - [8192, 1024, 1, 256, 8192, 8192, 256, 256]
    - [2, 126.05]
  - - [8192, 1024, 1, 512, 8192, 8192, 512, 512]
    - [48, 187.84]
  - - [8192, 1024, 1, 1024, 8192, 8192, 1024, 1024]
    - [5, 241.3]
  - - [8192, 1024, 1, 2048, 8192, 8192, 2048, 2048]
    - [46, 300.3]
  - - [8192, 1024, 1, 4096, 8192, 8192, 4096, 4096]
    - [47, 360.64]
  - - [8192, 1024, 1, 8192, 8192, 8192, 8192, 8192]
    - [48, 381.44]
  - - [8192, 2048, 1, 128, 8192, 8192, 128, 128]
    - [48, 81.08]
  - - [8192, 2048, 1, 256, 8192, 8192, 256, 256]
    - [48, 136.55]
  - - [8192, 2048, 1, 512, 8192, 8192, 512, 512]
    - [6, 196.6]
  - - [8192, 2048, 1, 1024, 8192, 8192, 1024, 1024]
    - [48, 257.2]
  - - [8192, 2048, 1, 2048, 8192, 8192, 2048, 2048]
    - [48, 316.98]
  - - [8192, 2048, 1, 4096, 8192, 8192, 4096, 4096]
    - [46, 340.31]
  - - [8192, 2048, 1, 8192, 8192, 8192, 8192, 8192]
    - [46, 401.58]
  - - [8192, 4096, 1, 128, 8192, 8192, 128, 128]
    - [4, 88.24]
  - - [8192, 4096, 1, 256, 8192, 8192, 256, 256]
    - [11, 146.01]
  - - [8192, 4096, 1, 512, 8192, 8192, 512, 512]
    - [7, 203.12]
  - - [8192, 4096, 1, 1024, 8192, 8192, 1024, 1024]
    - [39, 246.97]
  - - [8192, 4096, 1, 2048, 8192, 8192, 2048, 2048]
    - [47, 313.15]
  - - [8192, 4096, 1, 4096, 8192, 8192, 4096, 4096]
    - [48, 357.5]
  - - [8192, 4096, 1, 8192, 8192, 8192, 8192, 8192]
    - [47, 427.84]
  - - [8192, 8192, 1, 128, 8192, 8192, 128, 128]
    - [36, 108.45]
  - - [8192, 8192, 1, 256, 8192, 8192, 256, 256]
    - [40, 159.2]
  - - [8192, 8192, 1, 512, 8192, 8192, 512, 512]
    - [35, 215.7]
  - - [8192, 8192, 1, 1024, 8192, 8192, 1024, 1024]
    - [5, 282.14]
  - - [8192, 8192, 1, 2048, 8192, 8192, 2048, 2048]
    - [47, 326.35]
  - - [8192, 8192, 1, 4096, 8192, 8192, 4096, 4096]
    - [47, 375.33]
  - - [8192, 8192, 1, 8192, 8192, 8192, 8192, 8192]
    - [47, 426.45]
  - - [1, 1, 1, 32, 1, 1, 32, 32]
    - [92, 0.0]
- null
- null
- ExperimentalStreamK
- GridBased
