projects/hipblaslt/library/src/amd_detail/rocblaslt/src/Tensile/Logic/asm_full/aquavanjaram/gfx942_228cu/StreamK/aquavanjaram942_Cijk_Ailk_Bjlk_F8NBS_BH_Bias_HAS_SAV_UserArgs.yaml
- {MinimumRequiredVersion: 4.33.0}
- aquavanjaram942
- {Architecture: gfx942, CUCount: 228}
- [Device 0049, Device 0050]
    SolutionIndex: 0
    SolutionNameMin: Cijk_Ailk_Bjlk_F8NBS_BH_Bias_HAS_SAV_UserArgs_MT256x256x64_MI16x16x1_SN_LDSB0_CLR1_GRVWA4_GRVWB4_GSU0_GSUC0_GSUWGMRR0_K1_LBSPPA2048_LBSPPB2048_LPA0_LPB0_MIWT8_8_PLR1_SU0_SUM0_SUS64_VWA8_VWB8_WGM1_WGMXCC1_WGMXCCGn1
    SolutionIndex: 1
    SolutionNameMin: Cijk_Ailk_Bjlk_F8NBS_BH_Bias_HAS_SAV_UserArgs_MT256x256x64_MI16x16x1_SN_LDSB0_CLR1_GRVWA4_GRVWB8_GSU0_GSUC0_GSUWGMRR0_K1_LBSPPA2048_LBSPPB2048_LPA0_LPB0_MIWT8_8_PLR1_SU0_SUM0_SUS64_VWA8_VWB8_WGM1_WGMXCC1_WGMXCCGn1
    SolutionIndex: 2
    SolutionNameMin: Cijk_Ailk_Bjlk_F8NBS_BH_Bias_HAS_SAV_UserArgs_MT256x256x64_MI16x16x1_SN_LDSB0_CLR1_GRVWA16_GRVWB8_GSU0_GSUC0_GSUWGMRR0_K1_LBSPPA2048_LBSPPB2048_LPA0_LPB0_MIWT8_8_PLR1_SU0_SUM0_SUS64_VWA8_VWB8_WGM1_WGMXCC1_WGMXCCGn1
    SolutionIndex: 3
    SolutionNameMin: Cijk_Ailk_Bjlk_F8NBS_BH_Bias_HAS_SAV_UserArgs_MT256x256x64_MI16x16x1_SN_LDSB0_CLR1_GRVWA4_GRVWB16_GSU0_GSUC0_GSUWGMRR0_K1_LBSPPA2048_LBSPPB2048_LPA0_LPB0_MIWT8_8_PLR1_SU0_SUM0_SUS64_VWA8_VWB8_WGM1_WGMXCC1_WGMXCCGn1
    SolutionIndex: 4
    SolutionNameMin: Cijk_Ailk_Bjlk_F8NBS_BH_Bias_HAS_SAV_UserArgs_MT256x256x64_MI16x16x1_SN_LDSB0_CLR1_GRVWA16_GRVWB16_GSU0_GSUC0_GSUWGMRR0_K1_LBSPPA2048_LBSPPB2048_LPA0_LPB0_MIWT8_8_PLR1_SU0_SUM0_SUS64_VWA8_VWB8_WGM1_WGMXCC1_WGMXCCGn1
    SolutionIndex: 5
    SolutionNameMin: Cijk_Ailk_Bjlk_F8NBS_BH_Bias_HAS_SAV_UserArgs_MT256x256x64_MI16x16x1_SN_LDSB0_CLR1_GRVWA4_GRVWB4_GSU0_GSUC0_GSUWGMRR0_K1_LBSPPA2048_LBSPPB2048_LPA0_LPB0_MIWT8_8_PLR1_SU0_SUM0_SUS64_VWA8_VWB8_WGM4_WGMXCC1_WGMXCCGn1
    SolutionIndex: 6
    SolutionNameMin: Cijk_Ailk_Bjlk_F8NBS_BH_Bias_HAS_SAV_UserArgs_MT256x256x64_MI16x16x1_SN_LDSB0_CLR1_GRVWA16_GRVWB16_GSU0_GSUC0_GSUWGMRR0_K1_LBSPPA2048_LBSPPB2048_LPA0_LPB0_MIWT8_8_PLR1_SU0_SUM0_SUS64_VWA8_VWB8_WGM4_WGMXCC1_WGMXCCGn1
    SolutionIndex: 7
    SolutionNameMin: Cijk_Ailk_Bjlk_F8NBS_BH_Bias_HAS_SAV_UserArgs_MT256x256x64_MI16x16x1_SN_LDSB0_CLR1_GRVWA4_GRVWB4_GSU0_GSUC0_GSUWGMRR0_K1_LBSPPA2048_LBSPPB2048_LPA0_LPB0_MIWT8_8_PLR1_SU0_SUM0_SUS64_VWA8_VWB8_WGM6_WGMXCC1_WGMXCCGn1
    SolutionIndex: 8
    SolutionNameMin: Cijk_Ailk_Bjlk_F8NBS_BH_Bias_HAS_SAV_UserArgs_MT256x256x64_MI16x16x1_SN_LDSB0_CLR1_GRVWA8_GRVWB4_GSU0_GSUC0_GSUWGMRR0_K1_LBSPPA2048_LBSPPB2048_LPA0_LPB0_MIWT8_8_PLR1_SU0_SUM0_SUS64_VWA8_VWB8_WGM6_WGMXCC1_WGMXCCGn1
    SolutionIndex: 9
    SolutionNameMin: Cijk_Ailk_Bjlk_F8NBS_BH_Bias_HAS_SAV_UserArgs_MT256x256x64_MI16x16x1_SN_LDSB0_CLR1_GRVWA16_GRVWB4_GSU0_GSUC0_GSUWGMRR0_K1_LBSPPA2048_LBSPPB2048_LPA0_LPB0_MIWT8_8_PLR1_SU0_SUM0_SUS64_VWA8_VWB8_WGM6_WGMXCC1_WGMXCCGn1
    SolutionIndex: 10
    SolutionNameMin: Cijk_Ailk_Bjlk_F8NBS_BH_Bias_HAS_SAV_UserArgs_MT256x256x64_MI16x16x1_SN_LDSB0_CLR1_GRVWA16_GRVWB16_GSU0_GSUC0_GSUWGMRR0_K1_LBSPPA2048_LBSPPB2048_LPA0_LPB0_MIWT8_8_PLR1_SU0_SUM0_SUS64_VWA8_VWB8_WGM6_WGMXCC1_WGMXCCGn1
    SolutionIndex: 11
    SolutionNameMin: Cijk_Ailk_Bjlk_F8NBS_BH_Bias_HAS_SAV_UserArgs_MT256x256x64_MI16x16x1_SN_LDSB0_CLR1_GRVWA4_GRVWB4_GSU0_GSUC0_GSUWGMRR0_K1_LBSPPA2048_LBSPPB2048_LPA0_LPB0_MIWT8_8_PLR1_SU0_SUM0_SUS64_VWA8_VWB8_WGM8_WGMXCC1_WGMXCCGn1
    SolutionIndex: 12
    SolutionNameMin: Cijk_Ailk_Bjlk_F8NBS_BH_Bias_HAS_SAV_UserArgs_MT256x256x64_MI16x16x1_SN_LDSB0_CLR1_GRVWA4_GRVWB8_GSU0_GSUC0_GSUWGMRR0_K1_LBSPPA2048_LBSPPB2048_LPA0_LPB0_MIWT8_8_PLR1_SU0_SUM0_SUS64_VWA8_VWB8_WGM8_WGMXCC1_WGMXCCGn1
    SolutionIndex: 13
    SolutionNameMin: Cijk_Ailk_Bjlk_F8NBS_BH_Bias_HAS_SAV_UserArgs_MT256x256x64_MI16x16x1_SN_LDSB0_CLR1_GRVWA4_GRVWB16_GSU0_GSUC0_GSUWGMRR0_K1_LBSPPA2048_LBSPPB2048_LPA0_LPB0_MIWT8_8_PLR1_SU0_SUM0_SUS64_VWA8_VWB8_WGM8_WGMXCC1_WGMXCCGn1
    SolutionIndex: 14
    SolutionNameMin: Cijk_Ailk_Bjlk_F8NBS_BH_Bias_HAS_SAV_UserArgs_MT128x256x64_MI16x16x1_SN_LDSB1_CLR1_GRVWA4_GRVWB16_GSU0_GSUC0_GSUWGMRR0_K1_LBSPPA1024_LBSPPB2048_LPA64_LPB0_MIWT4_8_PLR1_SU0_SUM0_SUS64_VWA4_VWB8_WGM1_WGMXCC1_WGMXCCGn1
    SolutionIndex: 15
    SolutionNameMin: Cijk_Ailk_Bjlk_F8NBS_BH_Bias_HAS_SAV_UserArgs_MT128x256x64_MI16x16x1_SN_LDSB1_CLR1_GRVWA8_GRVWB16_GSU0_GSUC0_GSUWGMRR0_K1_LBSPPA1024_LBSPPB2048_LPA64_LPB0_MIWT4_8_PLR1_SU0_SUM0_SUS64_VWA4_VWB8_WGM1_WGMXCC1_WGMXCCGn1
    SolutionIndex: 16
    SolutionNameMin: Cijk_Ailk_Bjlk_F8NBS_BH_Bias_HAS_SAV_UserArgs_MT128x256x64_MI16x16x1_SN_LDSB1_CLR1_GRVWA16_GRVWB16_GSU0_GSUC0_GSUWGMRR0_K1_LBSPPA1024_LBSPPB2048_LPA64_LPB0_MIWT4_8_PLR1_SU0_SUM0_SUS64_VWA4_VWB8_WGM1_WGMXCC1_WGMXCCGn1
    SolutionIndex: 17
    SolutionNameMin: Cijk_Ailk_Bjlk_F8NBS_BH_Bias_HAS_SAV_UserArgs_MT128x256x64_MI16x16x1_SN_LDSB1_CLR1_GRVWA16_GRVWB16_GSU0_GSUC0_GSUWGMRR0_K1_LBSPPA1024_LBSPPB2048_LPA64_LPB0_MIWT4_8_PLR1_SU0_SUM0_SUS64_VWA4_VWB8_WGM6_WGMXCC1_WGMXCCGn1
    SolutionIndex: 18
    SolutionNameMin: Cijk_Ailk_Bjlk_F8NBS_BH_Bias_HAS_SAV_UserArgs_MT128x256x64_MI16x16x1_SN_LDSB1_CLR1_GRVWA4_GRVWB16_GSU0_GSUC0_GSUWGMRR0_K1_LBSPPA1024_LBSPPB2048_LPA64_LPB0_MIWT4_8_PLR1_SU0_SUM0_SUS64_VWA4_VWB8_WGM8_WGMXCC1_WGMXCCGn1
    SolutionIndex: 19
    SolutionNameMin: Cijk_Ailk_Bjlk_F8NBS_BH_Bias_HAS_SAV_UserArgs_MT256x144x64_MI16x16x1_SN_LDSB0_CLR1_GRVWA8_GRVWB4_GSU0_GSUC0_GSUWGMRR0_K1_LBSPPA2048_LBSPPB1152_LPA64_LPB16_MIWT4_9_PLR1_SU0_SUM0_SUS64_VWA4_VWB1_WGM1_WGMXCC1_WGMXCCGn1
    SolutionIndex: 20
    SolutionNameMin: Cijk_Ailk_Bjlk_F8NBS_BH_Bias_HAS_SAV_UserArgs_MT256x144x64_MI16x16x1_SN_LDSB0_CLR1_GRVWA16_GRVWB4_GSU0_GSUC0_GSUWGMRR0_K1_LBSPPA2048_LBSPPB1152_LPA64_LPB16_MIWT4_9_PLR1_SU0_SUM0_SUS64_VWA4_VWB1_WGM1_WGMXCC1_WGMXCCGn1
    SolutionIndex: 21
    SolutionNameMin: Cijk_Ailk_Bjlk_F8NBS_BH_Bias_HAS_SAV_UserArgs_MT256x144x64_MI16x16x1_SN_LDSB0_CLR1_GRVWA16_GRVWB4_GSU0_GSUC0_GSUWGMRR0_K1_LBSPPA2048_LBSPPB1152_LPA64_LPB16_MIWT4_9_PLR1_SU0_SUM0_SUS64_VWA4_VWB1_WGM4_WGMXCC1_WGMXCCGn1
    SolutionIndex: 22
    SolutionNameMin: Cijk_Ailk_Bjlk_F8NBS_BH_Bias_HAS_SAV_UserArgs_MT256x144x64_MI16x16x1_SN_LDSB0_CLR1_GRVWA16_GRVWB4_GSU0_GSUC0_GSUWGMRR0_K1_LBSPPA2048_LBSPPB1152_LPA64_LPB16_MIWT4_9_PLR1_SU0_SUM0_SUS64_VWA4_VWB1_WGM6_WGMXCC1_WGMXCCGn1
    SolutionIndex: 23
    SolutionNameMin: Cijk_Ailk_Bjlk_F8NBS_BH_Bias_HAS_SAV_UserArgs_MT256x144x64_MI16x16x1_SN_LDSB0_CLR1_GRVWA16_GRVWB4_GSU0_GSUC0_GSUWGMRR0_K1_LBSPPA2048_LBSPPB1152_LPA64_LPB16_MIWT4_9_PLR1_SU0_SUM0_SUS64_VWA4_VWB1_WGM8_WGMXCC1_WGMXCCGn1
    SolutionIndex: 24
    SolutionNameMin: Cijk_Ailk_Bjlk_F8NBS_BH_Bias_HAS_SAV_UserArgs_MT256x128x64_MI16x16x1_SN_LDSB1_CLR1_GRVWA4_GRVWB8_GSU0_GSUC0_GSUWGMRR0_K1_LBSPPA2048_LBSPPB1024_LPA0_LPB64_MIWT8_4_PLR1_SU0_SUM0_SUS64_VWA8_VWB4_WGM1_WGMXCC1_WGMXCCGn1
    SolutionIndex: 25
    SolutionNameMin: Cijk_Ailk_Bjlk_F8NBS_BH_Bias_HAS_SAV_UserArgs_MT256x128x64_MI16x16x1_SN_LDSB1_CLR1_GRVWA16_GRVWB8_GSU0_GSUC0_GSUWGMRR0_K1_LBSPPA2048_LBSPPB1024_LPA0_LPB64_MIWT8_4_PLR1_SU0_SUM0_SUS64_VWA8_VWB4_WGM1_WGMXCC1_WGMXCCGn1
    SolutionIndex: 26
    SolutionNameMin: Cijk_Ailk_Bjlk_F8NBS_BH_Bias_HAS_SAV_UserArgs_MT256x128x64_MI16x16x1_SN_LDSB1_CLR1_GRVWA16_GRVWB16_GSU0_GSUC0_GSUWGMRR0_K1_LBSPPA2048_LBSPPB1024_LPA0_LPB64_MIWT8_4_PLR1_SU0_SUM0_SUS64_VWA8_VWB4_WGM1_WGMXCC1_WGMXCCGn1
    SolutionIndex: 27
    SolutionNameMin: Cijk_Ailk_Bjlk_F8NBS_BH_Bias_HAS_SAV_UserArgs_MT256x128x64_MI16x16x1_SN_LDSB1_CLR1_GRVWA16_GRVWB16_GSU0_GSUC0_GSUWGMRR0_K1_LBSPPA2048_LBSPPB1024_LPA0_LPB64_MIWT8_4_PLR1_SU0_SUM0_SUS64_VWA8_VWB4_WGM4_WGMXCC1_WGMXCCGn1
    SolutionIndex: 28
    SolutionNameMin: Cijk_Ailk_Bjlk_F8NBS_BH_Bias_HAS_SAV_UserArgs_MT256x128x64_MI16x16x1_SN_LDSB1_CLR1_GRVWA4_GRVWB4_GSU0_GSUC0_GSUWGMRR0_K1_LBSPPA2048_LBSPPB1024_LPA0_LPB64_MIWT8_4_PLR1_SU0_SUM0_SUS64_VWA8_VWB4_WGM6_WGMXCC1_WGMXCCGn1
    SolutionIndex: 29
    SolutionNameMin: Cijk_Ailk_Bjlk_F8NBS_BH_Bias_HAS_SAV_UserArgs_MT256x128x64_MI16x16x1_SN_LDSB1_CLR1_GRVWA16_GRVWB16_GSU0_GSUC0_GSUWGMRR0_K1_LBSPPA2048_LBSPPB1024_LPA0_LPB64_MIWT8_4_PLR1_SU0_SUM0_SUS64_VWA8_VWB4_WGM6_WGMXCC1_WGMXCCGn1
    SolutionIndex: 30
    SolutionNameMin: Cijk_Ailk_Bjlk_F8NBS_BH_Bias_HAS_SAV_UserArgs_MT256x128x64_MI16x16x1_SN_LDSB1_CLR1_GRVWA4_GRVWB4_GSU0_GSUC0_GSUWGMRR0_K1_LBSPPA2048_LBSPPB1024_LPA0_LPB64_MIWT8_4_PLR1_SU0_SUM0_SUS64_VWA8_VWB4_WGM8_WGMXCC1_WGMXCCGn1
    SolutionIndex: 31
    SolutionNameMin: Cijk_Ailk_Bjlk_F8NBS_BH_Bias_HAS_SAV_UserArgs_MT256x128x64_MI16x16x1_SN_LDSB1_CLR1_GRVWA4_GRVWB8_GSU0_GSUC0_GSUWGMRR0_K1_LBSPPA2048_LBSPPB1024_LPA0_LPB64_MIWT8_4_PLR1_SU0_SUM0_SUS64_VWA8_VWB4_WGM8_WGMXCC1_WGMXCCGn1
    SolutionIndex: 32
    SolutionNameMin: Cijk_Ailk_Bjlk_F8NBS_BH_Bias_HAS_SAV_UserArgs_MT256x128x64_MI16x16x1_SN_LDSB1_CLR1_GRVWA16_GRVWB16_GSU0_GSUC0_GSUWGMRR0_K1_LBSPPA2048_LBSPPB1024_LPA0_LPB64_MIWT8_4_PLR1_SU0_SUM0_SUS64_VWA8_VWB4_WGM8_WGMXCC1_WGMXCCGn1
    SolutionIndex: 33
    SolutionNameMin: Cijk_Ailk_Bjlk_F8NBS_BH_Bias_HAS_SAV_UserArgs_MT144x256x64_MI16x16x1_SN_LDSB0_CLR1_GRVWA4_GRVWB16_GSU0_GSUC0_GSUWGMRR0_K1_LBSPPA1152_LBSPPB2048_LPA16_LPB64_MIWT9_4_PLR1_SU0_SUM0_SUS64_VWA1_VWB4_WGM8_WGMXCC1_WGMXCCGn1
    SolutionIndex: 34
    SolutionNameMin: Cijk_Ailk_Bjlk_F8NBS_BH_Bias_HAS_SAV_UserArgs_MT128x128x64_MI16x16x1_SN_LDSB1_CLR1_GRVWA4_GRVWB4_GSU0_GSUC0_GSUWGMRR0_K1_LBSPPA1024_LBSPPB1024_LPA0_LPB32_MIWT8_2_PLR1_SU0_SUM0_SUS64_VWA8_VWB2_WGM1_WGMXCC1_WGMXCCGn1
    SolutionIndex: 35
    SolutionNameMin: Cijk_Ailk_Bjlk_F8NBS_BH_Bias_HAS_SAV_UserArgs_MT128x128x64_MI16x16x1_SN_LDSB1_CLR1_GRVWA16_GRVWB16_GSU0_GSUC0_GSUWGMRR0_K1_LBSPPA1024_LBSPPB1024_LPA0_LPB32_MIWT8_2_PLR1_SU0_SUM0_SUS64_VWA8_VWB2_WGM1_WGMXCC1_WGMXCCGn1
    SolutionIndex: 36
    SolutionNameMin: Cijk_Ailk_Bjlk_F8NBS_BH_Bias_HAS_SAV_UserArgs_MT128x128x64_MI16x16x1_SN_LDSB1_CLR1_GRVWA8_GRVWB16_GSU0_GSUC0_GSUWGMRR0_K1_LBSPPA1024_LBSPPB1024_LPA0_LPB32_MIWT8_2_PLR1_SU0_SUM0_SUS64_VWA8_VWB2_WGM4_WGMXCC1_WGMXCCGn1
    SolutionIndex: 37
    SolutionNameMin: Cijk_Ailk_Bjlk_F8NBS_BH_Bias_HAS_SAV_UserArgs_MT128x128x64_MI16x16x1_SN_LDSB1_CLR1_GRVWA4_GRVWB4_GSU0_GSUC0_GSUWGMRR0_K1_LBSPPA1024_LBSPPB1024_LPA0_LPB32_MIWT8_2_PLR1_SU0_SUM0_SUS64_VWA8_VWB2_WGM8_WGMXCC1_WGMXCCGn1
    SolutionIndex: 38
    SolutionNameMin: Cijk_Ailk_Bjlk_F8NBS_BH_Bias_HAS_SAV_UserArgs_MT128x128x64_MI16x16x1_SN_LDSB1_CLR1_GRVWA4_GRVWB8_GSU0_GSUC0_GSUWGMRR0_K1_LBSPPA1024_LBSPPB1024_LPA64_LPB64_MIWT4_4_PLR1_SU0_SUM0_SUS64_VWA4_VWB4_WGM1_WGMXCC1_WGMXCCGn1
    SolutionIndex: 39
    SolutionNameMin: Cijk_Ailk_Bjlk_F8NBS_BH_Bias_HAS_SAV_UserArgs_MT128x128x64_MI16x16x1_SN_LDSB1_CLR1_GRVWA4_GRVWB16_GSU0_GSUC0_GSUWGMRR0_K1_LBSPPA1024_LBSPPB1024_LPA64_LPB64_MIWT4_4_PLR1_SU0_SUM0_SUS64_VWA4_VWB4_WGM1_WGMXCC1_WGMXCCGn1
    SolutionIndex: 40
    SolutionNameMin: Cijk_Ailk_Bjlk_F8NBS_BH_Bias_HAS_SAV_UserArgs_MT128x128x64_MI16x16x1_SN_LDSB1_CLR1_GRVWA8_GRVWB16_GSU0_GSUC0_GSUWGMRR0_K1_LBSPPA1024_LBSPPB1024_LPA64_LPB64_MIWT4_4_PLR1_SU0_SUM0_SUS64_VWA4_VWB4_WGM1_WGMXCC1_WGMXCCGn1
    SolutionIndex: 41
    SolutionNameMin: Cijk_Ailk_Bjlk_F8NBS_BH_Bias_HAS_SAV_UserArgs_MT128x128x64_MI16x16x1_SN_LDSB1_CLR1_GRVWA16_GRVWB16_GSU0_GSUC0_GSUWGMRR0_K1_LBSPPA1024_LBSPPB1024_LPA64_LPB64_MIWT4_4_PLR1_SU0_SUM0_SUS64_VWA4_VWB4_WGM1_WGMXCC1_WGMXCCGn1
    SolutionIndex: 42
    SolutionNameMin: Cijk_Ailk_Bjlk_F8NBS_BH_Bias_HAS_SAV_UserArgs_MT128x128x64_MI16x16x1_SN_LDSB1_CLR1_GRVWA16_GRVWB8_GSU0_GSUC0_GSUWGMRR0_K1_LBSPPA1024_LBSPPB1024_LPA64_LPB64_MIWT4_4_PLR1_SU0_SUM0_SUS64_VWA4_VWB4_WGM4_WGMXCC1_WGMXCCGn1
    SolutionIndex: 43
    SolutionNameMin: Cijk_Ailk_Bjlk_F8NBS_BH_Bias_HAS_SAV_UserArgs_MT128x128x64_MI16x16x1_SN_LDSB1_CLR1_GRVWA8_GRVWB16_GSU0_GSUC0_GSUWGMRR0_K1_LBSPPA1024_LBSPPB1024_LPA64_LPB64_MIWT4_4_PLR1_SU0_SUM0_SUS64_VWA4_VWB4_WGM4_WGMXCC1_WGMXCCGn1
    SolutionIndex: 44
    SolutionNameMin: Cijk_Ailk_Bjlk_F8NBS_BH_Bias_HAS_SAV_UserArgs_MT128x128x64_MI16x16x1_SN_LDSB1_CLR1_GRVWA16_GRVWB16_GSU0_GSUC0_GSUWGMRR0_K1_LBSPPA1024_LBSPPB1024_LPA64_LPB64_MIWT4_4_PLR1_SU0_SUM0_SUS64_VWA4_VWB4_WGM4_WGMXCC1_WGMXCCGn1
    SolutionIndex: 45
    SolutionNameMin: Cijk_Ailk_Bjlk_F8NBS_BH_Bias_HAS_SAV_UserArgs_MT128x128x64_MI16x16x1_SN_LDSB1_CLR1_GRVWA16_GRVWB8_GSU0_GSUC0_GSUWGMRR0_K1_LBSPPA1024_LBSPPB1024_LPA64_LPB64_MIWT4_4_PLR1_SU0_SUM0_SUS64_VWA4_VWB4_WGM6_WGMXCC1_WGMXCCGn1
    SolutionIndex: 46
    SolutionNameMin: Cijk_Ailk_Bjlk_F8NBS_BH_Bias_HAS_SAV_UserArgs_MT128x128x64_MI16x16x1_SN_LDSB1_CLR1_GRVWA16_GRVWB16_GSU0_GSUC0_GSUWGMRR0_K1_LBSPPA1024_LBSPPB1024_LPA64_LPB64_MIWT4_4_PLR1_SU0_SUM0_SUS64_VWA4_VWB4_WGM6_WGMXCC1_WGMXCCGn1
    SolutionIndex: 47
    SolutionNameMin: Cijk_Ailk_Bjlk_F8NBS_BH_Bias_HAS_SAV_UserArgs_MT128x128x64_MI16x16x1_SN_LDSB1_CLR1_GRVWA16_GRVWB8_GSU0_GSUC0_GSUWGMRR0_K1_LBSPPA1024_LBSPPB1024_LPA64_LPB64_MIWT4_4_PLR1_SU0_SUM0_SUS64_VWA4_VWB4_WGM8_WGMXCC1_WGMXCCGn1
    SolutionIndex: 48
    SolutionNameMin: Cijk_Ailk_Bjlk_F8NBS_BH_Bias_HAS_SAV_UserArgs_MT128x128x64_MI16x16x1_SN_LDSB1_CLR1_GRVWA16_GRVWB16_GSU0_GSUC0_GSUWGMRR0_K1_LBSPPA1024_LBSPPB1024_LPA64_LPB64_MIWT4_4_PLR1_SU0_SUM0_SUS64_VWA4_VWB4_WGM8_WGMXCC1_WGMXCCGn1
    SolutionIndex: 49
    SolutionNameMin: Cijk_Ailk_Bjlk_F8NBS_BH_Bias_HAS_SAV_UserArgs_MT64x128x64_MI16x16x1_SN_LDSB0_CLR1_GRVWA4_GRVWB4_GSU0_GSUC0_GSUWGMRR0_K1_LBSPPA512_LBSPPB1024_LPA32_LPB64_MIWT2_4_PLR1_SU0_SUM0_SUS64_VWA2_VWB4_WGM1_WGMXCC1_WGMXCCGn1
    SolutionIndex: 50
    SolutionNameMin: Cijk_Ailk_Bjlk_F8NBS_BH_Bias_HAS_SAV_UserArgs_MT64x128x64_MI16x16x1_SN_LDSB0_CLR1_GRVWA4_GRVWB8_GSU0_GSUC0_GSUWGMRR0_K1_LBSPPA512_LBSPPB1024_LPA32_LPB64_MIWT2_4_PLR1_SU0_SUM0_SUS64_VWA2_VWB4_WGM1_WGMXCC1_WGMXCCGn1
    SolutionIndex: 51
    SolutionNameMin: Cijk_Ailk_Bjlk_F8NBS_BH_Bias_HAS_SAV_UserArgs_MT64x128x64_MI16x16x1_SN_LDSB0_CLR1_GRVWA4_GRVWB16_GSU0_GSUC0_GSUWGMRR0_K1_LBSPPA512_LBSPPB1024_LPA32_LPB64_MIWT2_4_PLR1_SU0_SUM0_SUS64_VWA2_VWB4_WGM1_WGMXCC1_WGMXCCGn1
    SolutionIndex: 52
    SolutionNameMin: Cijk_Ailk_Bjlk_F8NBS_BH_Bias_HAS_SAV_UserArgs_MT64x128x64_MI16x16x1_SN_LDSB0_CLR1_GRVWA8_GRVWB16_GSU0_GSUC0_GSUWGMRR0_K1_LBSPPA512_LBSPPB1024_LPA32_LPB64_MIWT2_4_PLR1_SU0_SUM0_SUS64_VWA2_VWB4_WGM1_WGMXCC1_WGMXCCGn1
    SolutionIndex: 53
    SolutionNameMin: Cijk_Ailk_Bjlk_F8NBS_BH_Bias_HAS_SAV_UserArgs_MT64x128x64_MI16x16x1_SN_LDSB0_CLR1_GRVWA16_GRVWB16_GSU0_GSUC0_GSUWGMRR0_K1_LBSPPA512_LBSPPB1024_LPA32_LPB64_MIWT2_4_PLR1_SU0_SUM0_SUS64_VWA2_VWB4_WGM1_WGMXCC1_WGMXCCGn1
    SolutionIndex: 54
    SolutionNameMin: Cijk_Ailk_Bjlk_F8NBS_BH_Bias_HAS_SAV_UserArgs_MT128x64x64_MI16x16x1_SN_LDSB0_CLR1_GRVWA4_GRVWB4_GSU0_GSUC0_GSUWGMRR0_K1_LBSPPA1024_LBSPPB512_LPA64_LPB32_MIWT4_2_PLR1_SU0_SUM0_SUS64_VWA4_VWB2_WGM1_WGMXCC1_WGMXCCGn1
    SolutionIndex: 55
    SolutionNameMin: Cijk_Ailk_Bjlk_F8NBS_BH_Bias_HAS_SAV_UserArgs_MT128x64x64_MI16x16x1_SN_LDSB0_CLR1_GRVWA16_GRVWB4_GSU0_GSUC0_GSUWGMRR0_K1_LBSPPA1024_LBSPPB512_LPA64_LPB32_MIWT4_2_PLR1_SU0_SUM0_SUS64_VWA4_VWB2_WGM1_WGMXCC1_WGMXCCGn1
    SolutionIndex: 56
    SolutionNameMin: Cijk_Ailk_Bjlk_F8NBS_BH_Bias_HAS_SAV_UserArgs_MT128x64x64_MI16x16x1_SN_LDSB0_CLR1_GRVWA4_GRVWB8_GSU0_GSUC0_GSUWGMRR0_K1_LBSPPA1024_LBSPPB512_LPA64_LPB32_MIWT4_2_PLR1_SU0_SUM0_SUS64_VWA4_VWB2_WGM1_WGMXCC1_WGMXCCGn1
    SolutionIndex: 57
    SolutionNameMin: Cijk_Ailk_Bjlk_F8NBS_BH_Bias_HAS_SAV_UserArgs_MT128x64x64_MI16x16x1_SN_LDSB0_CLR1_GRVWA16_GRVWB8_GSU0_GSUC0_GSUWGMRR0_K1_LBSPPA1024_LBSPPB512_LPA64_LPB32_MIWT4_2_PLR1_SU0_SUM0_SUS64_VWA4_VWB2_WGM1_WGMXCC1_WGMXCCGn1
    SolutionIndex: 58
    SolutionNameMin: Cijk_Ailk_Bjlk_F8NBS_BH_Bias_HAS_SAV_UserArgs_MT128x64x64_MI16x16x1_SN_LDSB0_CLR1_GRVWA4_GRVWB8_GSU0_GSUC0_GSUWGMRR0_K1_LBSPPA1024_LBSPPB512_LPA64_LPB32_MIWT4_2_PLR1_SU0_SUM0_SUS64_VWA4_VWB2_WGM8_WGMXCC1_WGMXCCGn1
    SolutionIndex: 59
    SolutionNameMin: Cijk_Ailk_Bjlk_F8NBS_BH_Bias_HAS_SAV_UserArgs_MT128x32x64_MI16x16x1_SN_LDSB0_CLR1_GRVWA4_GRVWB4_GSU0_GSUC0_GSUWGMRR0_K1_LBSPPA1024_LBSPPB256_LPA64_LPB16_MIWT4_1_PLR1_SU0_SUM0_SUS64_VWA4_VWB1_WGM1_WGMXCC1_WGMXCCGn1
    SolutionIndex: 60
    SolutionNameMin: Cijk_Ailk_Bjlk_F8NBS_BH_Bias_HAS_SAV_UserArgs_MT64x64x64_MI16x16x1_SN_LDSB0_CLR1_GRVWA4_GRVWB4_GSU0_GSUC0_GSUWGMRR0_K1_LBSPPA512_LBSPPB512_LPA32_LPB32_MIWT2_2_PLR1_SU0_SUM0_SUS64_VWA2_VWB2_WGM1_WGMXCC1_WGMXCCGn1
    SolutionIndex: 61
    SolutionNameMin: Cijk_Ailk_Bjlk_F8NBS_BH_Bias_HAS_SAV_UserArgs_MT64x64x64_MI16x16x1_SN_LDSB0_CLR1_GRVWA8_GRVWB8_GSU0_GSUC0_GSUWGMRR0_K1_LBSPPA512_LBSPPB512_LPA32_LPB32_MIWT2_2_PLR1_SU0_SUM0_SUS64_VWA2_VWB2_WGM1_WGMXCC1_WGMXCCGn1
    SolutionIndex: 62
    SolutionNameMin: Cijk_Ailk_Bjlk_F8NBS_BH_Bias_HAS_SAV_UserArgs_MT32x64x64_MI16x16x1_SN_LDSB0_CLR1_GRVWA4_GRVWB4_GSU0_GSUC0_GSUWGMRR0_K1_LBSPPA256_LBSPPB512_LPA16_LPB32_MIWT1_2_PLR1_SU0_SUM0_SUS64_VWA1_VWB2_WGM1_WGMXCC1_WGMXCCGn1
    SolutionIndex: 63
    SolutionNameMin: Cijk_Ailk_Bjlk_F8NBS_BH_Bias_HAS_SAV_UserArgs_MT64x32x64_MI16x16x1_SN_LDSB0_CLR1_GRVWA4_GRVWB4_GSU0_GSUC0_GSUWGMRR0_K1_LBSPPA512_LBSPPB256_LPA32_LPB16_MIWT2_1_PLR1_SU0_SUM0_SUS64_VWA2_VWB1_WGM1_WGMXCC1_WGMXCCGn1
    SolutionIndex: 64
    SolutionNameMin: Cijk_Ailk_Bjlk_F8NBS_BH_Bias_HAS_SAV_UserArgs_MT64x32x64_MI16x16x1_SN_LDSB0_CLR1_GRVWA8_GRVWB4_GSU0_GSUC0_GSUWGMRR0_K1_LBSPPA512_LBSPPB256_LPA32_LPB16_MIWT2_1_PLR1_SU0_SUM0_SUS64_VWA2_VWB1_WGM1_WGMXCC1_WGMXCCGn1
    SolutionIndex: 65
    SolutionNameMin: Cijk_Ailk_Bjlk_F8NBS_BH_Bias_HAS_SAV_UserArgs_MT64x32x64_MI16x16x1_SN_LDSB0_CLR1_GRVWA4_GRVWB8_GSU0_GSUC0_GSUWGMRR0_K1_LBSPPA512_LBSPPB256_LPA32_LPB16_MIWT2_1_PLR1_SU0_SUM0_SUS64_VWA2_VWB1_WGM1_WGMXCC1_WGMXCCGn1
    SolutionIndex: 66
    SolutionNameMin: Cijk_Ailk_Bjlk_F8NBS_BH_Bias_HAS_SAV_UserArgs_MT32x32x64_MI16x16x1_SN_LDSB0_CLR1_GRVWA4_GRVWB4_GSU0_GSUC0_GSUWGMRR0_K1_LBSPPA256_LBSPPB256_LPA16_LPB16_MIWT1_1_PLR1_SU0_SUM0_SUS64_VWA1_VWB1_WGM1_WGMXCC1_WGMXCCGn1
    SolutionIndex: 67
    SolutionNameMin: Cijk_Ailk_Bjlk_F8NBS_BH_Bias_HAS_SAV_UserArgs_MT32x32x64_MI16x16x1_SN_LDSB0_CLR1_GRVWA8_GRVWB4_GSU0_GSUC0_GSUWGMRR0_K1_LBSPPA256_LBSPPB256_LPA16_LPB16_MIWT1_1_PLR1_SU0_SUM0_SUS64_VWA1_VWB1_WGM1_WGMXCC1_WGMXCCGn1
    SolutionIndex: 68
    SolutionNameMin: Cijk_Ailk_Bjlk_F8NBS_BH_Bias_HAS_SAV_UserArgs_MT32x32x64_MI16x16x1_SN_LDSB0_CLR1_GRVWA4_GRVWB8_GSU0_GSUC0_GSUWGMRR0_K1_LBSPPA256_LBSPPB256_LPA16_LPB16_MIWT1_1_PLR1_SU0_SUM0_SUS64_VWA1_VWB1_WGM1_WGMXCC1_WGMXCCGn1
    SolutionIndex: 69
    SolutionNameMin: Cijk_Ailk_Bjlk_F8NBS_BH_Bias_HAS_SAV_UserArgs_MT256x256x128_MI16x16x1_SN_LDSB1_CLR1_GRVWA16_GRVWB8_GSU0_GSUC0_GSUWGMRR0_K1_LBSPPA2048_LBSPPB2048_LPA0_LPB0_MIWT8_8_PLR1_SU0_SUM0_SUS128_VWA8_VWB8_WGM1_WGMXCC1_WGMXCCGn1
    SolutionIndex: 70
    SolutionNameMin: Cijk_Ailk_Bjlk_F8NBS_BH_Bias_HAS_SAV_UserArgs_MT256x256x128_MI16x16x1_SN_LDSB1_CLR1_GRVWA16_GRVWB8_GSU0_GSUC0_GSUWGMRR0_K1_LBSPPA2048_LBSPPB2048_LPA0_LPB0_MIWT8_8_PLR1_SU0_SUM0_SUS128_VWA8_VWB8_WGM4_WGMXCC1_WGMXCCGn1
    SolutionIndex: 71
    SolutionNameMin: Cijk_Ailk_Bjlk_F8NBS_BH_Bias_HAS_SAV_UserArgs_MT256x256x128_MI16x16x1_SN_LDSB1_CLR1_GRVWA8_GRVWB16_GSU0_GSUC0_GSUWGMRR0_K1_LBSPPA2048_LBSPPB2048_LPA0_LPB0_MIWT8_8_PLR1_SU0_SUM0_SUS128_VWA8_VWB8_WGM4_WGMXCC1_WGMXCCGn1
    SolutionIndex: 72
    SolutionNameMin: Cijk_Ailk_Bjlk_F8NBS_BH_Bias_HAS_SAV_UserArgs_MT256x256x128_MI16x16x1_SN_LDSB1_CLR1_GRVWA16_GRVWB16_GSU0_GSUC0_GSUWGMRR0_K1_LBSPPA2048_LBSPPB2048_LPA0_LPB0_MIWT8_8_PLR1_SU0_SUM0_SUS128_VWA8_VWB8_WGM4_WGMXCC1_WGMXCCGn1
    SolutionIndex: 73
    SolutionNameMin: Cijk_Ailk_Bjlk_F8NBS_BH_Bias_HAS_SAV_UserArgs_MT256x256x128_MI16x16x1_SN_LDSB1_CLR1_GRVWA16_GRVWB16_GSU0_GSUC0_GSUWGMRR0_K1_LBSPPA2048_LBSPPB2048_LPA0_LPB0_MIWT8_8_PLR1_SU0_SUM0_SUS128_VWA8_VWB8_WGM6_WGMXCC1_WGMXCCGn1
    SolutionIndex: 74
    SolutionNameMin: Cijk_Ailk_Bjlk_F8NBS_BH_Bias_HAS_SAV_UserArgs_MT256x256x128_MI16x16x1_SN_LDSB1_CLR1_GRVWA16_GRVWB16_GSU0_GSUC0_GSUWGMRR0_K1_LBSPPA2048_LBSPPB2048_LPA0_LPB0_MIWT8_8_PLR1_SU0_SUM0_SUS128_VWA8_VWB8_WGM8_WGMXCC1_WGMXCCGn1
    SolutionIndex: 75
    SolutionNameMin: Cijk_Ailk_Bjlk_F8NBS_BH_Bias_HAS_SAV_UserArgs_MT128x256x128_MI16x16x1_SN_LDSB1_CLR1_GRVWA4_GRVWB16_GSU0_GSUC0_GSUWGMRR0_K1_LBSPPA1024_LBSPPB2048_LPA64_LPB0_MIWT4_8_PLR1_SU0_SUM0_SUS128_VWA4_VWB8_WGM1_WGMXCC1_WGMXCCGn1
    SolutionIndex: 76
    SolutionNameMin: Cijk_Ailk_Bjlk_F8NBS_BH_Bias_HAS_SAV_UserArgs_MT128x256x128_MI16x16x1_SN_LDSB1_CLR1_GRVWA16_GRVWB16_GSU0_GSUC0_GSUWGMRR0_K1_LBSPPA1024_LBSPPB2048_LPA64_LPB0_MIWT4_8_PLR1_SU0_SUM0_SUS128_VWA4_VWB8_WGM1_WGMXCC1_WGMXCCGn1
    SolutionIndex: 77
    SolutionNameMin: Cijk_Ailk_Bjlk_F8NBS_BH_Bias_HAS_SAV_UserArgs_MT128x256x128_MI16x16x1_SN_LDSB1_CLR1_GRVWA16_GRVWB16_GSU0_GSUC0_GSUWGMRR0_K1_LBSPPA1024_LBSPPB2048_LPA64_LPB0_MIWT4_8_PLR1_SU0_SUM0_SUS128_VWA4_VWB8_WGM4_WGMXCC1_WGMXCCGn1
    SolutionIndex: 78
    SolutionNameMin: Cijk_Ailk_Bjlk_F8NBS_BH_Bias_HAS_SAV_UserArgs_MT128x256x128_MI16x16x1_SN_LDSB1_CLR1_GRVWA16_GRVWB16_GSU0_GSUC0_GSUWGMRR0_K1_LBSPPA1024_LBSPPB2048_LPA64_LPB0_MIWT4_8_PLR1_SU0_SUM0_SUS128_VWA4_VWB8_WGM6_WGMXCC1_WGMXCCGn1
    SolutionIndex: 79
    SolutionNameMin: Cijk_Ailk_Bjlk_F8NBS_BH_Bias_HAS_SAV_UserArgs_MT256x128x128_MI16x16x1_SN_LDSB1_CLR1_GRVWA16_GRVWB8_GSU0_GSUC0_GSUWGMRR0_K1_LBSPPA2048_LBSPPB1024_LPA0_LPB64_MIWT8_4_PLR1_SU0_SUM0_SUS128_VWA8_VWB4_WGM1_WGMXCC1_WGMXCCGn1
    SolutionIndex: 80
    SolutionNameMin: Cijk_Ailk_Bjlk_F8NBS_BH_Bias_HAS_SAV_UserArgs_MT256x128x128_MI16x16x1_SN_LDSB1_CLR1_GRVWA16_GRVWB8_GSU0_GSUC0_GSUWGMRR0_K1_LBSPPA2048_LBSPPB1024_LPA0_LPB64_MIWT8_4_PLR1_SU0_SUM0_SUS128_VWA8_VWB4_WGM4_WGMXCC1_WGMXCCGn1
    SolutionIndex: 81
    SolutionNameMin: Cijk_Ailk_Bjlk_F8NBS_BH_Bias_HAS_SAV_UserArgs_MT256x128x128_MI16x16x1_SN_LDSB1_CLR1_GRVWA4_GRVWB16_GSU0_GSUC0_GSUWGMRR0_K1_LBSPPA2048_LBSPPB1024_LPA0_LPB64_MIWT8_4_PLR1_SU0_SUM0_SUS128_VWA8_VWB4_WGM4_WGMXCC1_WGMXCCGn1
    SolutionIndex: 82
    SolutionNameMin: Cijk_Ailk_Bjlk_F8NBS_BH_Bias_HAS_SAV_UserArgs_MT128x128x128_MI16x16x1_SN_LDSB1_CLR1_GRVWA4_GRVWB16_GSU0_GSUC0_GSUWGMRR0_K1_LBSPPA1024_LBSPPB1024_LPA0_LPB32_MIWT8_2_PLR1_SU0_SUM0_SUS128_VWA8_VWB2_WGM1_WGMXCC1_WGMXCCGn1
    SolutionIndex: 83
    SolutionNameMin: Cijk_Ailk_Bjlk_F8NBS_BH_Bias_HAS_SAV_UserArgs_MT128x128x128_MI16x16x1_SN_LDSB1_CLR1_GRVWA4_GRVWB16_GSU0_GSUC0_GSUWGMRR0_K1_LBSPPA1024_LBSPPB1024_LPA64_LPB64_MIWT4_4_PLR1_SU0_SUM0_SUS128_VWA4_VWB4_WGM1_WGMXCC1_WGMXCCGn1
    SolutionIndex: 84
    SolutionNameMin: Cijk_Ailk_Bjlk_F8NBS_BH_Bias_HAS_SAV_UserArgs_MT128x128x128_MI16x16x1_SN_LDSB1_CLR1_GRVWA16_GRVWB16_GSU0_GSUC0_GSUWGMRR0_K1_LBSPPA1024_LBSPPB1024_LPA64_LPB64_MIWT4_4_PLR1_SU0_SUM0_SUS128_VWA4_VWB4_WGM1_WGMXCC1_WGMXCCGn1
    SolutionIndex: 85
    SolutionNameMin: Cijk_Ailk_Bjlk_F8NBS_BH_Bias_HAS_SAV_UserArgs_MT128x128x128_MI16x16x1_SN_LDSB1_CLR1_GRVWA4_GRVWB16_GSU0_GSUC0_GSUWGMRR0_K1_LBSPPA1024_LBSPPB1024_LPA64_LPB64_MIWT4_4_PLR1_SU0_SUM0_SUS128_VWA4_VWB4_WGM4_WGMXCC1_WGMXCCGn1
    SolutionIndex: 86
    SolutionNameMin: Cijk_Ailk_Bjlk_F8NBS_BH_Bias_HAS_SAV_UserArgs_MT128x128x128_MI16x16x1_SN_LDSB1_CLR1_GRVWA16_GRVWB16_GSU0_GSUC0_GSUWGMRR0_K1_LBSPPA1024_LBSPPB1024_LPA64_LPB64_MIWT4_4_PLR1_SU0_SUM0_SUS128_VWA4_VWB4_WGM4_WGMXCC1_WGMXCCGn1
    SolutionIndex: 87
    SolutionNameMin: Cijk_Ailk_Bjlk_F8NBS_BH_Bias_HAS_SAV_UserArgs_MT128x128x128_MI16x16x1_SN_LDSB1_CLR1_GRVWA16_GRVWB16_GSU0_GSUC0_GSUWGMRR0_K1_LBSPPA1024_LBSPPB1024_LPA64_LPB64_MIWT4_4_PLR1_SU0_SUM0_SUS128_VWA4_VWB4_WGM8_WGMXCC1_WGMXCCGn1
    SolutionIndex: 88
    SolutionNameMin: Cijk_Ailk_Bjlk_F8NBS_BH_Bias_HAS_SAV_UserArgs_MT128x64x128_MI16x16x1_SN_LDSB1_CLR1_GRVWA16_GRVWB16_GSU0_GSUC0_GSUWGMRR0_K1_LBSPPA1024_LBSPPB512_LPA64_LPB32_MIWT4_2_PLR1_SU0_SUM0_SUS128_VWA4_VWB2_WGM1_WGMXCC1_WGMXCCGn1
    SolutionIndex: 89
    SolutionNameMin: Cijk_Ailk_Bjlk_F8NBS_BH_Bias_HAS_SAV_UserArgs_MT128x64x128_MI16x16x1_SN_LDSB1_CLR1_GRVWA16_GRVWB16_GSU0_GSUC0_GSUWGMRR0_K1_LBSPPA1024_LBSPPB512_LPA64_LPB32_MIWT4_2_PLR1_SU0_SUM0_SUS128_VWA4_VWB2_WGM4_WGMXCC1_WGMXCCGn1
    SolutionIndex: 90
    SolutionNameMin: Cijk_Ailk_Bjlk_F8NBS_BH_Bias_HAS_SAV_UserArgs_MT128x64x128_MI16x16x1_SN_LDSB1_CLR1_GRVWA16_GRVWB16_GSU0_GSUC0_GSUWGMRR0_K1_LBSPPA1024_LBSPPB512_LPA64_LPB32_MIWT4_2_PLR1_SU0_SUM0_SUS128_VWA4_VWB2_WGM6_WGMXCC1_WGMXCCGn1
    SolutionIndex: 91
    SolutionNameMin: Cijk_Ailk_Bjlk_F8NBS_BH_Bias_HAS_SAV_UserArgs_MT128x64x128_MI16x16x1_SN_LDSB1_CLR1_GRVWA16_GRVWB16_GSU0_GSUC0_GSUWGMRR0_K1_LBSPPA1024_LBSPPB512_LPA64_LPB32_MIWT4_2_PLR1_SU0_SUM0_SUS128_VWA4_VWB2_WGM8_WGMXCC1_WGMXCCGn1
    SolutionIndex: 92
    SolutionNameMin: Cijk_Ailk_Bjlk_F8NBS_BH_Bias_HAS_SAV_UserArgs_MT64x64x128_MI16x16x1_SN_LDSB1_CLR1_GRVWA4_GRVWB8_GSU0_GSUC0_GSUWGMRR0_K1_LBSPPA512_LBSPPB512_LPA32_LPB32_MIWT2_2_PLR1_SU0_SUM0_SUS128_VWA2_VWB2_WGM1_WGMXCC1_WGMXCCGn1
    SolutionIndex: 93
    SolutionNameMin: Cijk_Ailk_Bjlk_F8NBS_BH_Bias_HAS_SAV_UserArgs_MT64x64x128_MI16x16x1_SN_LDSB1_CLR1_GRVWA16_GRVWB8_GSU0_GSUC0_GSUWGMRR0_K1_LBSPPA512_LBSPPB512_LPA32_LPB32_MIWT2_2_PLR1_SU0_SUM0_SUS128_VWA2_VWB2_WGM1_WGMXCC1_WGMXCCGn1
    SolutionIndex: 94
    SolutionNameMin: Cijk_Ailk_Bjlk_F8NBS_BH_Bias_HAS_SAV_UserArgs_MT64x64x128_MI16x16x1_SN_LDSB1_CLR1_GRVWA4_GRVWB16_GSU0_GSUC0_GSUWGMRR0_K1_LBSPPA512_LBSPPB512_LPA32_LPB32_MIWT2_2_PLR1_SU0_SUM0_SUS128_VWA2_VWB2_WGM1_WGMXCC1_WGMXCCGn1
    SolutionIndex: 95
    SolutionNameMin: Cijk_Ailk_Bjlk_F8NBS_BH_Bias_HAS_SAV_UserArgs_MT64x64x128_MI16x16x1_SN_LDSB1_CLR1_GRVWA8_GRVWB16_GSU0_GSUC0_GSUWGMRR0_K1_LBSPPA512_LBSPPB512_LPA32_LPB32_MIWT2_2_PLR1_SU0_SUM0_SUS128_VWA2_VWB2_WGM1_WGMXCC1_WGMXCCGn1
    SolutionIndex: 96
    SolutionNameMin: Cijk_Ailk_Bjlk_F8NBS_BH_Bias_HAS_SAV_UserArgs_MT64x64x128_MI16x16x1_SN_LDSB1_CLR1_GRVWA16_GRVWB16_GSU0_GSUC0_GSUWGMRR0_K1_LBSPPA512_LBSPPB512_LPA32_LPB32_MIWT2_2_PLR1_SU0_SUM0_SUS128_VWA2_VWB2_WGM1_WGMXCC1_WGMXCCGn1
    SolutionIndex: 97
    SolutionNameMin: Cijk_Ailk_Bjlk_F8NBS_BH_Bias_HAS_SAV_UserArgs_MT64x64x128_MI16x16x1_SN_LDSB1_CLR1_GRVWA4_GRVWB16_GSU0_GSUC0_GSUWGMRR0_K1_LBSPPA512_LBSPPB512_LPA32_LPB32_MIWT2_2_PLR1_SU0_SUM0_SUS128_VWA2_VWB2_WGM4_WGMXCC1_WGMXCCGn1
    SolutionIndex: 98
    SolutionNameMin: Cijk_Ailk_Bjlk_F8NBS_BH_Bias_HAS_SAV_UserArgs_MT64x64x128_MI16x16x1_SN_LDSB1_CLR1_GRVWA8_GRVWB16_GSU0_GSUC0_GSUWGMRR0_K1_LBSPPA512_LBSPPB512_LPA32_LPB32_MIWT2_2_PLR1_SU0_SUM0_SUS128_VWA2_VWB2_WGM4_WGMXCC1_WGMXCCGn1
    SolutionIndex: 99
    SolutionNameMin: Cijk_Ailk_Bjlk_F8NBS_BH_Bias_HAS_SAV_UserArgs_MT64x64x128_MI16x16x1_SN_LDSB1_CLR1_GRVWA16_GRVWB16_GSU0_GSUC0_GSUWGMRR0_K1_LBSPPA512_LBSPPB512_LPA32_LPB32_MIWT2_2_PLR1_SU0_SUM0_SUS128_VWA2_VWB2_WGM4_WGMXCC1_WGMXCCGn1
    SolutionIndex: 100
    SolutionNameMin: Cijk_Ailk_Bjlk_F8NBS_BH_Bias_HAS_SAV_UserArgs_MT64x64x128_MI16x16x1_SN_LDSB1_CLR1_GRVWA4_GRVWB16_GSU0_GSUC0_GSUWGMRR0_K1_LBSPPA512_LBSPPB512_LPA32_LPB32_MIWT2_2_PLR1_SU0_SUM0_SUS128_VWA2_VWB2_WGM6_WGMXCC1_WGMXCCGn1
    SolutionIndex: 101
    SolutionNameMin: Cijk_Ailk_Bjlk_F8NBS_BH_Bias_HAS_SAV_UserArgs_MT64x64x128_MI16x16x1_SN_LDSB1_CLR1_GRVWA4_GRVWB16_GSU0_GSUC0_GSUWGMRR0_K1_LBSPPA512_LBSPPB512_LPA32_LPB32_MIWT2_2_PLR1_SU0_SUM0_SUS128_VWA2_VWB2_WGM8_WGMXCC1_WGMXCCGn1
    SolutionIndex: 102
    SolutionNameMin: Cijk_Ailk_Bjlk_F8NBS_BH_Bias_HAS_SAV_UserArgs_MT64x64x128_MI16x16x1_SN_LDSB1_CLR1_GRVWA8_GRVWB16_GSU0_GSUC0_GSUWGMRR0_K1_LBSPPA512_LBSPPB512_LPA32_LPB32_MIWT2_2_PLR1_SU0_SUM0_SUS128_VWA2_VWB2_WGM8_WGMXCC1_WGMXCCGn1
    SolutionIndex: 103
    SolutionNameMin: Cijk_Ailk_Bjlk_F8NBS_BH_Bias_HAS_SAV_UserArgs_MT64x64x128_MI16x16x1_SN_LDSB1_CLR1_GRVWA16_GRVWB16_GSU0_GSUC0_GSUWGMRR0_K1_LBSPPA512_LBSPPB512_LPA32_LPB32_MIWT2_2_PLR1_SU0_SUM0_SUS128_VWA2_VWB2_WGM8_WGMXCC1_WGMXCCGn1
    SolutionIndex: 104
    SolutionNameMin: Cijk_Ailk_Bjlk_F8NBS_BH_Bias_HAS_SAV_UserArgs_MT32x64x128_MI16x16x1_SN_LDSB0_CLR1_GRVWA4_GRVWB8_GSU0_GSUC0_GSUWGMRR0_K1_LBSPPA256_LBSPPB512_LPA16_LPB32_MIWT1_2_PLR1_SU0_SUM0_SUS128_VWA1_VWB2_WGM1_WGMXCC1_WGMXCCGn1
    SolutionIndex: 105
    SolutionNameMin: Cijk_Ailk_Bjlk_F8NBS_BH_Bias_HAS_SAV_UserArgs_MT32x64x128_MI16x16x1_SN_LDSB0_CLR1_GRVWA8_GRVWB16_GSU0_GSUC0_GSUWGMRR0_K1_LBSPPA256_LBSPPB512_LPA16_LPB32_MIWT1_2_PLR1_SU0_SUM0_SUS128_VWA1_VWB2_WGM1_WGMXCC1_WGMXCCGn1
    SolutionIndex: 106
    SolutionNameMin: Cijk_Ailk_Bjlk_F8NBS_BH_Bias_HAS_SAV_UserArgs_MT32x64x128_MI16x16x1_SN_LDSB0_CLR1_GRVWA16_GRVWB16_GSU0_GSUC0_GSUWGMRR0_K1_LBSPPA256_LBSPPB512_LPA16_LPB32_MIWT1_2_PLR1_SU0_SUM0_SUS128_VWA1_VWB2_WGM6_WGMXCC1_WGMXCCGn1
    SolutionIndex: 107
    SolutionNameMin: Cijk_Ailk_Bjlk_F8NBS_BH_Bias_HAS_SAV_UserArgs_MT32x64x128_MI16x16x1_SN_LDSB0_CLR1_GRVWA16_GRVWB16_GSU0_GSUC0_GSUWGMRR0_K1_LBSPPA256_LBSPPB512_LPA16_LPB32_MIWT1_2_PLR1_SU0_SUM0_SUS128_VWA1_VWB2_WGM8_WGMXCC1_WGMXCCGn1
    SolutionIndex: 108
    SolutionNameMin: Cijk_Ailk_Bjlk_F8NBS_BH_Bias_HAS_SAV_UserArgs_MT64x32x128_MI16x16x1_SN_LDSB0_CLR1_GRVWA4_GRVWB4_GSU0_GSUC0_GSUWGMRR0_K1_LBSPPA512_LBSPPB256_LPA32_LPB16_MIWT2_1_PLR1_SU0_SUM0_SUS128_VWA2_VWB1_WGM1_WGMXCC1_WGMXCCGn1
    SolutionIndex: 109
    SolutionNameMin: Cijk_Ailk_Bjlk_F8NBS_BH_Bias_HAS_SAV_UserArgs_MT64x32x128_MI16x16x1_SN_LDSB0_CLR1_GRVWA4_GRVWB8_GSU0_GSUC0_GSUWGMRR0_K1_LBSPPA512_LBSPPB256_LPA32_LPB16_MIWT2_1_PLR1_SU0_SUM0_SUS128_VWA2_VWB1_WGM1_WGMXCC1_WGMXCCGn1
    SolutionIndex: 110
    SolutionNameMin: Cijk_Ailk_Bjlk_F8NBS_BH_Bias_HAS_SAV_UserArgs_MT64x32x128_MI16x16x1_SN_LDSB0_CLR1_GRVWA8_GRVWB16_GSU0_GSUC0_GSUWGMRR0_K1_LBSPPA512_LBSPPB256_LPA32_LPB16_MIWT2_1_PLR1_SU0_SUM0_SUS128_VWA2_VWB1_WGM1_WGMXCC1_WGMXCCGn1
    SolutionIndex: 111
    SolutionNameMin: Cijk_Ailk_Bjlk_F8NBS_BH_Bias_HAS_SAV_UserArgs_MT64x32x128_MI16x16x1_SN_LDSB0_CLR1_GRVWA16_GRVWB16_GSU0_GSUC0_GSUWGMRR0_K1_LBSPPA512_LBSPPB256_LPA32_LPB16_MIWT2_1_PLR1_SU0_SUM0_SUS128_VWA2_VWB1_WGM1_WGMXCC1_WGMXCCGn1
    SolutionIndex: 112
    SolutionNameMin: Cijk_Ailk_Bjlk_F8NBS_BH_Bias_HAS_SAV_UserArgs_MT32x32x128_MI16x16x1_SN_LDSB0_CLR1_GRVWA4_GRVWB4_GSU0_GSUC0_GSUWGMRR0_K1_LBSPPA256_LBSPPB256_LPA16_LPB16_MIWT1_1_PLR1_SU0_SUM0_SUS128_VWA1_VWB1_WGM1_WGMXCC1_WGMXCCGn1
    SolutionIndex: 113
    SolutionNameMin: Cijk_Ailk_Bjlk_F8NBS_BH_Bias_HAS_SAV_UserArgs_MT32x32x128_MI16x16x1_SN_LDSB0_CLR1_GRVWA8_GRVWB4_GSU0_GSUC0_GSUWGMRR0_K1_LBSPPA256_LBSPPB256_LPA16_LPB16_MIWT1_1_PLR1_SU0_SUM0_SUS128_VWA1_VWB1_WGM1_WGMXCC1_WGMXCCGn1
    SolutionIndex: 114
    SolutionNameMin: Cijk_Ailk_Bjlk_F8NBS_BH_Bias_HAS_SAV_UserArgs_MT32x32x128_MI16x16x1_SN_LDSB0_CLR1_GRVWA16_GRVWB4_GSU0_GSUC0_GSUWGMRR0_K1_LBSPPA256_LBSPPB256_LPA16_LPB16_MIWT1_1_PLR1_SU0_SUM0_SUS128_VWA1_VWB1_WGM1_WGMXCC1_WGMXCCGn1
    SolutionIndex: 115
    SolutionNameMin: Cijk_Ailk_Bjlk_F8NBS_BH_Bias_HAS_SAV_UserArgs_MT32x32x128_MI16x16x1_SN_LDSB0_CLR1_GRVWA4_GRVWB8_GSU0_GSUC0_GSUWGMRR0_K1_LBSPPA256_LBSPPB256_LPA16_LPB16_MIWT1_1_PLR1_SU0_SUM0_SUS128_VWA1_VWB1_WGM1_WGMXCC1_WGMXCCGn1
    SolutionIndex: 116
    SolutionNameMin: Cijk_Ailk_Bjlk_F8NBS_BH_Bias_HAS_SAV_UserArgs_MT32x32x128_MI16x16x1_SN_LDSB0_CLR1_GRVWA8_GRVWB8_GSU0_GSUC0_GSUWGMRR0_K1_LBSPPA256_LBSPPB256_LPA16_LPB16_MIWT1_1_PLR1_SU0_SUM0_SUS128_VWA1_VWB1_WGM1_WGMXCC1_WGMXCCGn1
    SolutionIndex: 117
    SolutionNameMin: Cijk_Ailk_Bjlk_F8NBS_BH_Bias_HAS_SAV_UserArgs_MT32x32x128_MI16x16x1_SN_LDSB0_CLR1_GRVWA4_GRVWB16_GSU0_GSUC0_GSUWGMRR0_K1_LBSPPA256_LBSPPB256_LPA16_LPB16_MIWT1_1_PLR1_SU0_SUM0_SUS128_VWA1_VWB1_WGM1_WGMXCC1_WGMXCCGn1
    SolutionIndex: 118
    SolutionNameMin: Cijk_Ailk_Bjlk_F8NBS_BH_Bias_HAS_SAV_UserArgs_MT32x32x128_MI16x16x1_SN_LDSB0_CLR1_GRVWA8_GRVWB16_GSU0_GSUC0_GSUWGMRR0_K1_LBSPPA256_LBSPPB256_LPA16_LPB16_MIWT1_1_PLR1_SU0_SUM0_SUS128_VWA1_VWB1_WGM1_WGMXCC1_WGMXCCGn1
    SolutionIndex: 119
    SolutionNameMin: Cijk_Ailk_Bjlk_F8NBS_BH_Bias_HAS_SAV_UserArgs_MT32x32x128_MI16x16x1_SN_LDSB0_CLR1_GRVWA4_GRVWB16_GSU0_GSUC0_GSUWGMRR0_K1_LBSPPA256_LBSPPB256_LPA16_LPB16_MIWT1_1_PLR1_SU0_SUM0_SUS128_VWA1_VWB1_WGM6_WGMXCC1_WGMXCCGn1
    SolutionIndex: 120
    SolutionNameMin: Cijk_Ailk_Bjlk_F8NBS_BH_Bias_HAS_SAV_UserArgs_MT128x64x256_MI16x16x1_SN_LDSB1_CLR1_GRVWA16_GRVWB16_GSU0_GSUC0_GSUWGMRR0_K1_LBSPPA1024_LBSPPB512_LPA64_LPB32_MIWT4_2_PLR1_SU0_SUM0_SUS256_VWA4_VWB2_WGM1_WGMXCC1_WGMXCCGn1
    SolutionIndex: 121
    SolutionNameMin: Cijk_Ailk_Bjlk_F8NBS_BH_Bias_HAS_SAV_UserArgs_MT64x64x256_MI16x16x1_SN_LDSB1_CLR1_GRVWA16_GRVWB16_GSU0_GSUC0_GSUWGMRR0_K1_LBSPPA512_LBSPPB512_LPA32_LPB32_MIWT2_2_PLR1_SU0_SUM0_SUS256_VWA2_VWB2_WGM1_WGMXCC1_WGMXCCGn1
    SolutionIndex: 122
    SolutionNameMin: Cijk_Ailk_Bjlk_F8NBS_BH_Bias_HAS_SAV_UserArgs_MT64x64x256_MI16x16x1_SN_LDSB1_CLR1_GRVWA16_GRVWB16_GSU0_GSUC0_GSUWGMRR0_K1_LBSPPA512_LBSPPB512_LPA32_LPB32_MIWT2_2_PLR1_SU0_SUM0_SUS256_VWA2_VWB2_WGM6_WGMXCC1_WGMXCCGn1
    SolutionIndex: 123
    SolutionNameMin: Cijk_Ailk_Bjlk_F8NBS_BH_Bias_HAS_SAV_UserArgs_MT64x32x256_MI16x16x1_SN_LDSB1_CLR1_GRVWA16_GRVWB16_GSU0_GSUC0_GSUWGMRR0_K1_LBSPPA512_LBSPPB256_LPA32_LPB16_MIWT2_1_PLR1_SU0_SUM0_SUS256_VWA2_VWB1_WGM1_WGMXCC1_WGMXCCGn1
    SolutionIndex: 124
    SolutionNameMin: Cijk_Ailk_Bjlk_F8NBS_BH_Bias_HAS_SAV_UserArgs_MT64x32x256_MI16x16x1_SN_LDSB1_CLR1_GRVWA16_GRVWB16_GSU0_GSUC0_GSUWGMRR0_K1_LBSPPA512_LBSPPB256_LPA32_LPB16_MIWT2_1_PLR1_SU0_SUM0_SUS256_VWA2_VWB1_WGM4_WGMXCC1_WGMXCCGn1
    SolutionIndex: 125
    SolutionNameMin: Cijk_Ailk_Bjlk_F8NBS_BH_Bias_HAS_SAV_UserArgs_MT64x32x256_MI16x16x1_SN_LDSB1_CLR1_GRVWA16_GRVWB16_GSU0_GSUC0_GSUWGMRR0_K1_LBSPPA512_LBSPPB256_LPA32_LPB16_MIWT2_1_PLR1_SU0_SUM0_SUS256_VWA2_VWB1_WGM6_WGMXCC1_WGMXCCGn1
    SolutionIndex: 126
    SolutionNameMin: Cijk_Ailk_Bjlk_F8NBS_BH_Bias_HAS_SAV_UserArgs_MT32x32x256_MI16x16x1_SN_LDSB1_CLR1_GRVWA8_GRVWB16_GSU0_GSUC0_GSUWGMRR0_K1_LBSPPA256_LBSPPB256_LPA16_LPB16_MIWT1_1_PLR1_SU0_SUM0_SUS256_VWA1_VWB1_WGM1_WGMXCC1_WGMXCCGn1
    SolutionIndex: 127
    SolutionNameMin: Cijk_Ailk_Bjlk_F8NBS_BH_Bias_HAS_SAV_UserArgs_MT32x32x256_MI16x16x1_SN_LDSB1_CLR1_GRVWA16_GRVWB16_GSU0_GSUC0_GSUWGMRR0_K1_LBSPPA256_LBSPPB256_LPA16_LPB16_MIWT1_1_PLR1_SU0_SUM0_SUS256_VWA1_VWB1_WGM1_WGMXCC1_WGMXCCGn1
    SolutionIndex: 128
    SolutionNameMin: Cijk_Ailk_Bjlk_F8NBS_BH_Bias_HAS_SAV_UserArgs_MT32x32x256_MI16x16x1_SN_LDSB1_CLR1_GRVWA16_GRVWB16_GSU0_GSUC0_GSUWGMRR0_K1_LBSPPA256_LBSPPB256_LPA16_LPB16_MIWT1_1_PLR1_SU0_SUM0_SUS256_VWA1_VWB1_WGM4_WGMXCC1_WGMXCCGn1
    SolutionIndex: 129
    SolutionNameMin: Cijk_Ailk_Bjlk_F8NBS_BH_Bias_HAS_SAV_UserArgs_MT32x32x256_MI16x16x1_SN_LDSB1_CLR1_GRVWA16_GRVWB16_GSU0_GSUC0_GSUWGMRR0_K1_LBSPPA256_LBSPPB256_LPA16_LPB16_MIWT1_1_PLR1_SU0_SUM0_SUS256_VWA1_VWB1_WGM6_WGMXCC1_WGMXCCGn1
    SolutionIndex: 130
    SolutionNameMin: Cijk_Ailk_Bjlk_F8NBS_BH_Bias_HAS_SAV_UserArgs_MT32x32x256_MI16x16x1_SN_LDSB1_CLR1_GRVWA16_GRVWB16_GSU0_GSUC0_GSUWGMRR0_K1_LBSPPA256_LBSPPB256_LPA16_LPB16_MIWT1_1_PLR1_SU0_SUM0_SUS256_VWA1_VWB1_WGM8_WGMXCC1_WGMXCCGn1
- - - [128, 128, 1, 128, 128, 128, 128, 128]
    - [68, 0.52]
  - - [128, 128, 1, 256, 128, 128, 128, 128]
    - [66, 0.89]
  - - [128, 128, 1, 512, 128, 128, 128, 128]
    - [115, 1.48]
  - - [128, 128, 1, 1024, 128, 128, 128, 128]
    - [117, 2.2]
  - - [128, 128, 1, 2048, 128, 128, 128, 128]
    - [118, 2.91]
  - - [128, 128, 1, 4096, 128, 128, 128, 128]
    - [127, 3.51]
  - - [128, 128, 1, 8192, 128, 128, 128, 128]
    - [127, 3.93]
  - - [128, 256, 1, 128, 128, 128, 128, 256]
    - [66, 1.03]
  - - [128, 256, 1, 256, 128, 128, 128, 256]
    - [113, 1.81]
  - - [128, 256, 1, 512, 128, 128, 128, 256]
    - [116, 2.97]
  - - [128, 256, 1, 1024, 128, 128, 128, 256]
    - [116, 4.46]
  - - [128, 256, 1, 2048, 128, 128, 128, 256]
    - [118, 5.88]
  - - [128, 256, 1, 4096, 128, 128, 128, 256]
    - [118, 7.04]
  - - [128, 256, 1, 8192, 128, 128, 128, 256]
    - [127, 7.9]
  - - [128, 512, 1, 128, 128, 128, 128, 512]
    - [66, 2.07]
  - - [128, 512, 1, 256, 128, 128, 128, 512]
    - [66, 3.6]
  - - [128, 512, 1, 512, 128, 128, 128, 512]
    - [112, 5.93]
  - - [128, 512, 1, 1024, 128, 128, 128, 512]
    - [118, 8.74]
  - - [128, 512, 1, 2048, 128, 128, 128, 512]
    - [118, 11.66]
  - - [128, 512, 1, 4096, 128, 128, 128, 512]
    - [118, 14.02]
  - - [128, 512, 1, 8192, 128, 128, 128, 512]
    - [126, 14.92]
  - - [128, 1024, 1, 128, 128, 128, 128, 1024]
    - [66, 4.08]
  - - [128, 1024, 1, 256, 128, 128, 128, 1024]
    - [66, 7.09]
  - - [128, 1024, 1, 512, 128, 128, 128, 1024]
    - [114, 11.38]
  - - [128, 1024, 1, 1024, 128, 128, 128, 1024]
    - [118, 17.04]
  - - [128, 1024, 1, 2048, 128, 128, 128, 1024]
    - [118, 22.66]
  - - [128, 1024, 1, 4096, 128, 128, 128, 1024]
    - [126, 26.0]
  - - [128, 1024, 1, 8192, 128, 128, 128, 1024]
    - [119, 27.67]
  - - [128, 2048, 1, 128, 128, 128, 128, 2048]
    - [62, 7.55]
  - - [128, 2048, 1, 256, 128, 128, 128, 2048]
    - [62, 12.99]
  - - [128, 2048, 1, 512, 128, 128, 128, 2048]
    - [108, 20.87]
  - - [128, 2048, 1, 1024, 128, 128, 128, 2048]
    - [105, 30.77]
  - - [128, 2048, 1, 2048, 128, 128, 128, 2048]
    - [123, 39.05]
  - - [128, 2048, 1, 4096, 128, 128, 128, 2048]
    - [125, 47.45]
  - - [128, 2048, 1, 8192, 128, 128, 128, 2048]
    - [125, 53.55]
  - - [128, 4096, 1, 128, 128, 128, 128, 4096]
    - [60, 13.71]
  - - [128, 4096, 1, 256, 128, 128, 128, 4096]
    - [60, 23.48]
  - - [128, 4096, 1, 512, 128, 128, 128, 4096]
    - [61, 37.23]
  - - [128, 4096, 1, 1024, 128, 128, 128, 4096]
    - [93, 53.24]
  - - [128, 4096, 1, 2048, 128, 128, 128, 4096]
    - [121, 67.05]
  - - [128, 4096, 1, 4096, 128, 128, 128, 4096]
    - [121, 81.79]
  - - [128, 4096, 1, 8192, 128, 128, 128, 4096]
    - [122, 90.26]
  - - [128, 8192, 1, 128, 128, 128, 128, 8192]
    - [56, 22.75]
  - - [128, 8192, 1, 256, 128, 128, 128, 8192]
    - [58, 38.36]
  - - [128, 8192, 1, 512, 128, 128, 128, 8192]
    - [50, 61.0]
  - - [128, 8192, 1, 1024, 128, 128, 128, 8192]
    - [53, 86.17]
  - - [128, 8192, 1, 2048, 128, 128, 128, 8192]
    - [88, 106.3]
  - - [128, 8192, 1, 4096, 128, 128, 128, 8192]
    - [120, 124.35]
  - - [128, 8192, 1, 8192, 128, 128, 128, 8192]
    - [90, 126.96]
  - - [256, 128, 1, 128, 256, 256, 256, 128]
    - [67, 1.03]
  - - [256, 128, 1, 256, 256, 256, 256, 128]
    - [112, 1.83]
  - - [256, 128, 1, 512, 256, 256, 256, 128]
    - [117, 2.98]
  - - [256, 128, 1, 1024, 256, 256, 256, 128]
    - [118, 4.44]
  - - [256, 128, 1, 2048, 256, 256, 256, 128]
    - [118, 5.92]
  - - [256, 128, 1, 4096, 256, 256, 256, 128]
    - [118, 7.11]
  - - [256, 128, 1, 8192, 256, 256, 256, 128]
    - [127, 7.88]
  - - [256, 256, 1, 128, 256, 256, 256, 256]
    - [66, 2.06]
  - - [256, 256, 1, 256, 256, 256, 256, 256]
    - [66, 3.63]
  - - [256, 256, 1, 512, 256, 256, 256, 256]
    - [113, 5.94]
  - - [256, 256, 1, 1024, 256, 256, 256, 256]
    - [116, 8.85]
  - - [256, 256, 1, 2048, 256, 256, 256, 256]
    - [118, 11.76]
  - - [256, 256, 1, 4096, 256, 256, 256, 256]
    - [118, 14.09]
  - - [256, 256, 1, 8192, 256, 256, 256, 256]
    - [118, 15.55]
  - - [256, 512, 1, 128, 256, 256, 256, 512]
    - [66, 4.02]
  - - [256, 512, 1, 256, 256, 256, 256, 512]
    - [67, 7.03]
  - - [256, 512, 1, 512, 256, 256, 256, 512]
    - [112, 11.44]
  - - [256, 512, 1, 1024, 256, 256, 256, 512]
    - [115, 17.19]
  - - [256, 512, 1, 2048, 256, 256, 256, 512]
    - [118, 22.89]
  - - [256, 512, 1, 4096, 256, 256, 256, 512]
    - [118, 27.49]
  - - [256, 512, 1, 8192, 256, 256, 256, 512]
    - [127, 30.24]
  - - [256, 1024, 1, 128, 256, 256, 256, 1024]
    - [64, 7.42]
  - - [256, 1024, 1, 256, 256, 256, 256, 1024]
    - [63, 12.76]
  - - [256, 1024, 1, 512, 256, 256, 256, 1024]
    - [104, 20.74]
  - - [256, 1024, 1, 1024, 256, 256, 256, 1024]
    - [110, 30.37]
  - - [256, 1024, 1, 2048, 256, 256, 256, 1024]
    - [123, 40.41]
  - - [256, 1024, 1, 4096, 256, 256, 256, 1024]
    - [123, 48.6]
  - - [256, 1024, 1, 8192, 256, 256, 256, 1024]
    - [125, 53.8]
  - - [256, 2048, 1, 128, 256, 256, 256, 2048]
    - [60, 13.44]
  - - [256, 2048, 1, 256, 256, 256, 256, 2048]
    - [60, 23.0]
  - - [256, 2048, 1, 512, 256, 256, 256, 2048]
    - [92, 36.7]
  - - [256, 2048, 1, 1024, 256, 256, 256, 2048]
    - [95, 53.48]
  - - [256, 2048, 1, 2048, 256, 256, 256, 2048]
    - [96, 67.22]
  - - [256, 2048, 1, 4096, 256, 256, 256, 2048]
    - [96, 78.98]
  - - [256, 2048, 1, 8192, 256, 256, 256, 2048]
    - [121, 86.85]
  - - [256, 4096, 1, 128, 256, 256, 256, 4096]
    - [56, 22.96]
  - - [256, 4096, 1, 256, 256, 256, 256, 4096]
    - [56, 38.84]
  - - [256, 4096, 1, 512, 256, 256, 256, 4096]
    - [53, 60.87]
  - - [256, 4096, 1, 1024, 256, 256, 256, 4096]
    - [53, 85.23]
  - - [256, 4096, 1, 2048, 256, 256, 256, 4096]
    - [88, 105.92]
  - - [256, 4096, 1, 4096, 256, 256, 256, 4096]
    - [88, 123.32]
  - - [256, 4096, 1, 8192, 256, 256, 256, 4096]
    - [91, 130.03]
  - - [256, 8192, 1, 128, 256, 256, 256, 8192]
    - [82, 34.69]
  - - [256, 8192, 1, 256, 256, 256, 256, 8192]
    - [34, 59.19]
  - - [256, 8192, 1, 512, 256, 256, 256, 8192]
    - [84, 90.24]
  - - [256, 8192, 1, 1024, 256, 256, 256, 8192]
    - [83, 125.88]
  - - [256, 8192, 1, 2048, 256, 256, 256, 8192]
    - [84, 154.61]
  - - [256, 8192, 1, 4096, 256, 256, 256, 8192]
    - [84, 174.23]
  - - [256, 8192, 1, 8192, 256, 256, 256, 8192]
    - [86, 162.96]
  - - [512, 128, 1, 128, 512, 512, 512, 128]
    - [68, 2.09]
  - - [512, 128, 1, 256, 512, 512, 512, 128]
    - [66, 3.62]
  - - [512, 128, 1, 512, 512, 512, 512, 128]
    - [117, 5.87]
  - - [512, 128, 1, 1024, 512, 512, 512, 128]
    - [118, 8.8]
  - - [512, 128, 1, 2048, 512, 512, 512, 128]
    - [118, 11.72]
  - - [512, 128, 1, 4096, 512, 512, 512, 128]
    - [118, 14.05]
  - - [512, 128, 1, 8192, 512, 512, 512, 128]
    - [129, 14.61]
  - - [512, 256, 1, 128, 512, 512, 512, 256]
    - [66, 4.06]
  - - [512, 256, 1, 256, 512, 512, 512, 256]
    - [68, 7.11]
  - - [512, 256, 1, 512, 512, 512, 512, 256]
    - [115, 11.62]
  - - [512, 256, 1, 1024, 512, 512, 512, 256]
    - [116, 17.24]
  - - [512, 256, 1, 2048, 512, 512, 512, 256]
    - [118, 22.68]
  - - [512, 256, 1, 4096, 512, 512, 512, 256]
    - [118, 27.54]
  - - [512, 256, 1, 8192, 512, 512, 512, 256]
    - [128, 28.1]
  - - [512, 512, 1, 128, 512, 512, 512, 512]
    - [63, 7.37]
  - - [512, 512, 1, 256, 512, 512, 512, 512]
    - [63, 12.76]
  - - [512, 512, 1, 512, 512, 512, 512, 512]
    - [108, 20.64]
  - - [512, 512, 1, 1024, 512, 512, 512, 512]
    - [109, 30.15]
  - - [512, 512, 1, 2048, 512, 512, 512, 512]
    - [123, 40.55]
  - - [512, 512, 1, 4096, 512, 512, 512, 512]
    - [123, 47.07]
  - - [512, 512, 1, 8192, 512, 512, 512, 512]
    - [111, 50.44]
  - - [512, 1024, 1, 128, 512, 512, 512, 1024]
    - [59, 13.57]
  - - [512, 1024, 1, 256, 512, 512, 512, 1024]
    - [61, 23.36]
  - - [512, 1024, 1, 512, 512, 512, 512, 1024]
    - [92, 36.87]
  - - [512, 1024, 1, 1024, 512, 512, 512, 1024]
    - [95, 53.4]
  - - [512, 1024, 1, 2048, 512, 512, 512, 1024]
    - [95, 68.84]
  - - [512, 1024, 1, 4096, 512, 512, 512, 1024]
    - [96, 76.09]
  - - [512, 1024, 1, 8192, 512, 512, 512, 1024]
    - [94, 81.11]
  - - [512, 2048, 1, 128, 512, 512, 512, 2048]
    - [49, 22.81]
  - - [512, 2048, 1, 256, 512, 512, 512, 2048]
    - [50, 39.05]
  - - [512, 2048, 1, 512, 512, 512, 512, 2048]
    - [53, 61.35]
  - - [512, 2048, 1, 1024, 512, 512, 512, 2048]
    - [88, 85.11]
  - - [512, 2048, 1, 2048, 512, 512, 512, 2048]
    - [88, 106.29]
  - - [512, 2048, 1, 4096, 512, 512, 512, 2048]
    - [90, 123.65]
  - - [512, 2048, 1, 8192, 512, 512, 512, 2048]
    - [88, 126.01]
  - - [512, 4096, 1, 128, 512, 512, 512, 4096]
    - [34, 34.61]
  - - [512, 4096, 1, 256, 512, 512, 512, 4096]
    - [34, 58.37]
  - - [512, 4096, 1, 512, 512, 512, 512, 4096]
    - [38, 90.05]
  - - [512, 4096, 1, 1024, 512, 512, 512, 4096]
    - [84, 126.3]
  - - [512, 4096, 1, 2048, 512, 512, 512, 4096]
    - [41, 154.81]
  - - [512, 4096, 1, 4096, 512, 512, 512, 4096]
    - [44, 172.41]
  - - [512, 4096, 1, 8192, 512, 512, 512, 4096]
    - [43, 160.9]
  - - [512, 8192, 1, 128, 512, 512, 512, 8192]
    - [31, 49.43]
  - - [512, 8192, 1, 256, 512, 512, 512, 8192]
    - [31, 84.94]
  - - [512, 8192, 1, 512, 512, 512, 512, 8192]
    - [26, 131.07]
  - - [512, 8192, 1, 1024, 512, 512, 512, 8192]
    - [26, 177.48]
  - - [512, 8192, 1, 2048, 512, 512, 512, 8192]
    - [26, 216.33]
  - - [512, 8192, 1, 4096, 512, 512, 512, 8192]
    - [79, 227.05]
  - - [512, 8192, 1, 8192, 512, 512, 512, 8192]
    - [76, 210.65]
  - - [1024, 128, 1, 128, 1024, 1024, 1024, 128]
    - [68, 3.89]
  - - [1024, 128, 1, 256, 1024, 1024, 1024, 128]
    - [66, 7.03]
  - - [1024, 128, 1, 512, 1024, 1024, 1024, 128]
    - [115, 11.38]
  - - [1024, 128, 1, 1024, 1024, 1024, 1024, 128]
    - [118, 16.99]
  - - [1024, 128, 1, 2048, 1024, 1024, 1024, 128]
    - [118, 22.88]
  - - [1024, 128, 1, 4096, 1024, 1024, 1024, 128]
    - [130, 25.67]
  - - [1024, 128, 1, 8192, 1024, 1024, 1024, 128]
    - [130, 26.61]
  - - [1024, 256, 1, 128, 1024, 1024, 1024, 256]
    - [108, 7.48]
  - - [1024, 256, 1, 256, 1024, 1024, 1024, 256]
    - [65, 12.95]
  - - [1024, 256, 1, 512, 1024, 1024, 1024, 256]
    - [109, 20.96]
  - - [1024, 256, 1, 1024, 1024, 1024, 1024, 256]
    - [110, 30.68]
  - - [1024, 256, 1, 2048, 1024, 1024, 1024, 256]
    - [123, 40.66]
  - - [1024, 256, 1, 4096, 1024, 1024, 1024, 256]
    - [106, 46.22]
  - - [1024, 256, 1, 8192, 1024, 1024, 1024, 256]
    - [124, 49.31]
  - - [1024, 512, 1, 128, 1024, 1024, 1024, 512]
    - [60, 13.38]
  - - [1024, 512, 1, 256, 1024, 1024, 1024, 512]
    - [61, 23.16]
  - - [1024, 512, 1, 512, 1024, 1024, 1024, 512]
    - [61, 36.74]
  - - [1024, 512, 1, 1024, 1024, 1024, 1024, 512]
    - [95, 53.13]
  - - [1024, 512, 1, 2048, 1024, 1024, 1024, 512]
    - [96, 68.74]
  - - [1024, 512, 1, 4096, 1024, 1024, 1024, 512]
    - [101, 75.93]
  - - [1024, 512, 1, 8192, 1024, 1024, 1024, 512]
    - [100, 81.43]
  - - [1024, 1024, 1, 128, 1024, 1024, 1024, 1024]
    - [56, 22.4]
  - - [1024, 1024, 1, 256, 1024, 1024, 1024, 1024]
    - [49, 38.56]
  - - [1024, 1024, 1, 512, 1024, 1024, 1024, 1024]
    - [53, 60.95]
  - - [1024, 1024, 1, 1024, 1024, 1024, 1024, 1024]
    - [52, 85.6]
  - - [1024, 1024, 1, 2048, 1024, 1024, 1024, 1024]
    - [88, 107.18]
  - - [1024, 1024, 1, 4096, 1024, 1024, 1024, 1024]
    - [88, 122.5]
  - - [1024, 1024, 1, 8192, 1024, 1024, 1024, 1024]
    - [88, 125.48]
  - - [1024, 2048, 1, 128, 1024, 1024, 1024, 2048]
    - [34, 34.8]
  - - [1024, 2048, 1, 256, 1024, 1024, 1024, 2048]
    - [35, 58.13]
  - - [1024, 2048, 1, 512, 1024, 1024, 1024, 2048]
    - [39, 90.5]
  - - [1024, 2048, 1, 1024, 1024, 1024, 1024, 2048]
    - [84, 124.25]
  - - [1024, 2048, 1, 2048, 1024, 1024, 1024, 2048]
    - [40, 153.97]
  - - [1024, 2048, 1, 4096, 1024, 1024, 1024, 2048]
    - [46, 171.41]
  - - [1024, 2048, 1, 8192, 1024, 1024, 1024, 2048]
    - [47, 161.59]
  - - [1024, 4096, 1, 128, 1024, 1024, 1024, 4096]
    - [31, 51.52]
  - - [1024, 4096, 1, 256, 1024, 1024, 1024, 4096]
    - [31, 86.96]
  - - [1024, 4096, 1, 512, 1024, 1024, 1024, 4096]
    - [27, 131.65]
  - - [1024, 4096, 1, 1024, 1024, 1024, 1024, 4096]
    - [26, 180.55]
  - - [1024, 4096, 1, 2048, 1024, 1024, 1024, 4096]
    - [27, 218.69]
  - - [1024, 4096, 1, 4096, 1024, 1024, 1024, 4096]
    - [79, 220.94]
  - - [1024, 4096, 1, 8192, 1024, 1024, 1024, 4096]
    - [79, 211.43]
  - - [1024, 8192, 1, 128, 1024, 1024, 1024, 8192]
    - [23, 65.9]
  - - [1024, 8192, 1, 256, 1024, 1024, 1024, 8192]
    - [21, 108.83]
  - - [1024, 8192, 1, 512, 1024, 1024, 1024, 8192]
    - [23, 158.16]
  - - [1024, 8192, 1, 1024, 1024, 1024, 1024, 8192]
    - [13, 213.92]
  - - [1024, 8192, 1, 2048, 1024, 1024, 1024, 8192]
    - [10, 247.19]
  - - [1024, 8192, 1, 4096, 1024, 1024, 1024, 8192]
    - [4, 245.25]
  - - [1024, 8192, 1, 8192, 1024, 1024, 1024, 8192]
    - [6, 259.28]
  - - [2048, 128, 1, 128, 2048, 2048, 2048, 128]
    - [63, 7.56]
  - - [2048, 128, 1, 256, 2048, 2048, 2048, 128]
    - [65, 12.95]
  - - [2048, 128, 1, 512, 2048, 2048, 2048, 128]
    - [109, 20.9]
  - - [2048, 128, 1, 1024, 2048, 2048, 2048, 128]
    - [110, 30.74]
  - - [2048, 128, 1, 2048, 2048, 2048, 2048, 128]
    - [107, 37.44]
  - - [2048, 128, 1, 4096, 2048, 2048, 2048, 128]
    - [106, 45.16]
  - - [2048, 128, 1, 8192, 2048, 2048, 2048, 128]
    - [106, 50.45]
  - - [2048, 256, 1, 128, 2048, 2048, 2048, 256]
    - [59, 13.22]
  - - [2048, 256, 1, 256, 2048, 2048, 2048, 256]
    - [60, 22.78]
  - - [2048, 256, 1, 512, 2048, 2048, 2048, 256]
    - [98, 36.09]
  - - [2048, 256, 1, 1024, 2048, 2048, 2048, 256]
    - [102, 52.79]
  - - [2048, 256, 1, 2048, 2048, 2048, 2048, 256]
    - [103, 66.92]
  - - [2048, 256, 1, 4096, 2048, 2048, 2048, 256]
    - [97, 77.7]
  - - [2048, 256, 1, 8192, 2048, 2048, 2048, 256]
    - [99, 85.22]
  - - [2048, 512, 1, 128, 2048, 2048, 2048, 512]
    - [49, 22.21]
  - - [2048, 512, 1, 256, 2048, 2048, 2048, 512]
    - [51, 38.88]
  - - [2048, 512, 1, 512, 2048, 2048, 2048, 512]
    - [50, 61.23]
  - - [2048, 512, 1, 1024, 2048, 2048, 2048, 512]
    - [53, 85.46]
  - - [2048, 512, 1, 2048, 2048, 2048, 2048, 512]
    - [89, 105.6]
  - - [2048, 512, 1, 4096, 2048, 2048, 2048, 512]
    - [91, 121.87]
  - - [2048, 512, 1, 8192, 2048, 2048, 2048, 512]
    - [89, 129.22]
  - - [2048, 1024, 1, 128, 2048, 2048, 2048, 1024]
    - [34, 34.74]
  - - [2048, 1024, 1, 256, 2048, 2048, 2048, 1024]
    - [34, 58.41]
  - - [2048, 1024, 1, 512, 2048, 2048, 2048, 1024]
    - [40, 89.82]
  - - [2048, 1024, 1, 1024, 2048, 2048, 2048, 1024]
    - [40, 123.07]
  - - [2048, 1024, 1, 2048, 2048, 2048, 2048, 1024]
    - [43, 153.43]
  - - [2048, 1024, 1, 4096, 2048, 2048, 2048, 1024]
    - [43, 172.84]
  - - [2048, 1024, 1, 8192, 2048, 2048, 2048, 1024]
    - [44, 162.33]
  - - [2048, 2048, 1, 128, 2048, 2048, 2048, 2048]
    - [24, 49.92]
  - - [2048, 2048, 1, 256, 2048, 2048, 2048, 2048]
    - [26, 84.66]
  - - [2048, 2048, 1, 512, 2048, 2048, 2048, 2048]
    - [26, 131.37]
  - - [2048, 2048, 1, 1024, 2048, 2048, 2048, 2048]
    - [29, 178.03]
  - - [2048, 2048, 1, 2048, 2048, 2048, 2048, 2048]
    - [26, 213.42]
  - - [2048, 2048, 1, 4096, 2048, 2048, 2048, 2048]
    - [29, 224.02]
  - - [2048, 2048, 1, 8192, 2048, 2048, 2048, 2048]
    - [78, 209.4]
  - - [2048, 4096, 1, 128, 2048, 2048, 2048, 4096]
    - [3, 59.12]
  - - [2048, 4096, 1, 256, 2048, 2048, 2048, 4096]
    - [3, 101.15]
  - - [2048, 4096, 1, 512, 2048, 2048, 2048, 4096]
    - [3, 153.69]
  - - [2048, 4096, 1, 1024, 2048, 2048, 2048, 4096]
    - [4, 210.76]
  - - [2048, 4096, 1, 2048, 2048, 2048, 2048, 4096]
    - [4, 243.98]
  - - [2048, 4096, 1, 4096, 2048, 2048, 2048, 4096]
    - [74, 240.65]
  - - [2048, 4096, 1, 8192, 2048, 2048, 2048, 4096]
    - [71, 259.24]
  - - [2048, 8192, 1, 128, 2048, 2048, 2048, 8192]
    - [22, 67.27]
  - - [2048, 8192, 1, 256, 2048, 2048, 2048, 8192]
    - [0, 112.68]
  - - [2048, 8192, 1, 512, 2048, 2048, 2048, 8192]
    - [0, 169.38]
  - - [2048, 8192, 1, 1024, 2048, 2048, 2048, 8192]
    - [5, 203.38]
  - - [2048, 8192, 1, 2048, 2048, 2048, 2048, 8192]
    - [18, 220.69]
  - - [2048, 8192, 1, 4096, 2048, 2048, 2048, 8192]
    - [8, 266.47]
  - - [2048, 8192, 1, 8192, 2048, 2048, 2048, 8192]
    - [9, 321.14]
  - - [4096, 128, 1, 128, 4096, 4096, 4096, 128]
    - [60, 13.67]
  - - [4096, 128, 1, 256, 4096, 4096, 4096, 128]
    - [61, 23.25]
  - - [4096, 128, 1, 512, 4096, 4096, 4096, 128]
    - [61, 37.07]
  - - [4096, 128, 1, 1024, 4096, 4096, 4096, 128]
    - [95, 53.61]
  - - [4096, 128, 1, 2048, 4096, 4096, 4096, 128]
    - [99, 65.6]
  - - [4096, 128, 1, 4096, 4096, 4096, 4096, 128]
    - [103, 77.39]
  - - [4096, 128, 1, 8192, 4096, 4096, 4096, 128]
    - [103, 83.98]
  - - [4096, 256, 1, 128, 4096, 4096, 4096, 256]
    - [54, 22.83]
  - - [4096, 256, 1, 256, 4096, 4096, 4096, 256]
    - [55, 39.05]
  - - [4096, 256, 1, 512, 4096, 4096, 4096, 256]
    - [57, 60.9]
  - - [4096, 256, 1, 1024, 4096, 4096, 4096, 256]
    - [89, 85.11]
  - - [4096, 256, 1, 2048, 4096, 4096, 4096, 256]
    - [89, 106.66]
  - - [4096, 256, 1, 4096, 4096, 4096, 4096, 256]
    - [89, 124.48]
  - - [4096, 256, 1, 8192, 4096, 4096, 4096, 256]
    - [90, 127.86]
  - - [4096, 512, 1, 128, 4096, 4096, 4096, 512]
    - [34, 34.76]
  - - [4096, 512, 1, 256, 4096, 4096, 4096, 512]
    - [34, 58.92]
  - - [4096, 512, 1, 512, 4096, 4096, 4096, 512]
    - [87, 88.99]
  - - [4096, 512, 1, 1024, 4096, 4096, 4096, 512]
    - [43, 122.7]
  - - [4096, 512, 1, 2048, 4096, 4096, 4096, 512]
    - [48, 152.69]
  - - [4096, 512, 1, 4096, 4096, 4096, 4096, 512]
    - [42, 172.32]
  - - [4096, 512, 1, 8192, 4096, 4096, 4096, 512]
    - [46, 165.51]
  - - [4096, 1024, 1, 128, 4096, 4096, 4096, 1024]
    - [30, 49.8]
  - - [4096, 1024, 1, 256, 4096, 4096, 4096, 1024]
    - [31, 84.99]
  - - [4096, 1024, 1, 512, 4096, 4096, 4096, 1024]
    - [32, 129.5]
  - - [4096, 1024, 1, 1024, 4096, 4096, 4096, 1024]
    - [32, 177.57]
  - - [4096, 1024, 1, 2048, 4096, 4096, 4096, 1024]
    - [32, 218.31]
  - - [4096, 1024, 1, 4096, 4096, 4096, 4096, 1024]
    - [77, 223.62]
  - - [4096, 1024, 1, 8192, 4096, 4096, 4096, 1024]
    - [78, 211.1]
  - - [4096, 2048, 1, 128, 4096, 4096, 4096, 2048]
    - [3, 57.74]
  - - [4096, 2048, 1, 256, 4096, 4096, 4096, 2048]
    - [3, 97.92]
  - - [4096, 2048, 1, 512, 4096, 4096, 4096, 2048]
    - [4, 150.69]
  - - [4096, 2048, 1, 1024, 4096, 4096, 4096, 2048]
    - [5, 208.49]
  - - [4096, 2048, 1, 2048, 4096, 4096, 4096, 2048]
    - [6, 242.68]
  - - [4096, 2048, 1, 4096, 4096, 4096, 4096, 2048]
    - [10, 239.82]
  - - [4096, 2048, 1, 8192, 4096, 4096, 4096, 2048]
    - [15, 258.84]
  - - [4096, 4096, 1, 128, 4096, 4096, 4096, 4096]
    - [1, 65.43]
  - - [4096, 4096, 1, 256, 4096, 4096, 4096, 4096]
    - [3, 110.77]
  - - [4096, 4096, 1, 512, 4096, 4096, 4096, 4096]
    - [1, 163.26]
  - - [4096, 4096, 1, 1024, 4096, 4096, 4096, 4096]
    - [4, 203.04]
  - - [4096, 4096, 1, 2048, 4096, 4096, 4096, 4096]
    - [14, 218.64]
  - - [4096, 4096, 1, 4096, 4096, 4096, 4096, 4096]
    - [10, 272.08]
  - - [4096, 4096, 1, 8192, 4096, 4096, 4096, 4096]
    - [73, 321.24]
  - - [4096, 8192, 1, 128, 4096, 4096, 4096, 8192]
    - [19, 72.82]
  - - [4096, 8192, 1, 256, 4096, 4096, 4096, 8192]
    - [20, 116.19]
  - - [4096, 8192, 1, 512, 4096, 4096, 4096, 8192]
    - [17, 160.28]
  - - [4096, 8192, 1, 1024, 4096, 4096, 4096, 8192]
    - [31, 202.2]
  - - [4096, 8192, 1, 2048, 4096, 4096, 4096, 8192]
    - [12, 254.95]
  - - [4096, 8192, 1, 4096, 4096, 4096, 4096, 8192]
    - [4, 298.69]
  - - [4096, 8192, 1, 8192, 4096, 4096, 4096, 8192]
    - [69, 340.16]
  - - [8192, 128, 1, 128, 8192, 8192, 8192, 128]
    - [54, 22.35]
  - - [8192, 128, 1, 256, 8192, 8192, 8192, 128]
    - [56, 38.92]
  - - [8192, 128, 1, 512, 8192, 8192, 8192, 128]
    - [57, 60.23]
  - - [8192, 128, 1, 1024, 8192, 8192, 8192, 128]
    - [53, 83.51]
  - - [8192, 128, 1, 2048, 8192, 8192, 8192, 128]
    - [89, 104.33]
  - - [8192, 128, 1, 4096, 8192, 8192, 8192, 128]
    - [90, 122.94]
  - - [8192, 128, 1, 8192, 8192, 8192, 8192, 128]
    - [91, 123.75]
  - - [8192, 256, 1, 128, 8192, 8192, 8192, 256]
    - [37, 34.18]
  - - [8192, 256, 1, 256, 8192, 8192, 8192, 256]
    - [36, 57.45]
  - - [8192, 256, 1, 512, 8192, 8192, 8192, 256]
    - [86, 88.71]
  - - [8192, 256, 1, 1024, 8192, 8192, 8192, 256]
    - [87, 122.6]
  - - [8192, 256, 1, 2048, 8192, 8192, 8192, 256]
    - [46, 152.41]
  - - [8192, 256, 1, 4096, 8192, 8192, 8192, 256]
    - [45, 170.46]
  - - [8192, 256, 1, 8192, 8192, 8192, 8192, 256]
    - [85, 159.24]
  - - [8192, 512, 1, 128, 8192, 8192, 8192, 512]
    - [28, 48.08]
  - - [8192, 512, 1, 256, 8192, 8192, 8192, 512]
    - [30, 80.99]
  - - [8192, 512, 1, 512, 8192, 8192, 8192, 512]
    - [29, 126.18]
  - - [8192, 512, 1, 1024, 8192, 8192, 8192, 512]
    - [32, 175.74]
  - - [8192, 512, 1, 2048, 8192, 8192, 8192, 512]
    - [29, 213.52]
  - - [8192, 512, 1, 4096, 8192, 8192, 8192, 512]
    - [32, 224.04]
  - - [8192, 512, 1, 8192, 8192, 8192, 8192, 512]
    - [80, 212.53]
  - - [8192, 1024, 1, 128, 8192, 8192, 8192, 1024]
    - [7, 57.68]
  - - [8192, 1024, 1, 256, 8192, 8192, 8192, 1024]
    - [11, 98.25]
  - - [8192, 1024, 1, 512, 8192, 8192, 8192, 1024]
    - [13, 152.99]
  - - [8192, 1024, 1, 1024, 8192, 8192, 8192, 1024]
    - [10, 209.54]
  - - [8192, 1024, 1, 2048, 8192, 8192, 8192, 1024]
    - [6, 246.22]
  - - [8192, 1024, 1, 4096, 8192, 8192, 8192, 1024]
    - [74, 241.38]
  - - [8192, 1024, 1, 8192, 8192, 8192, 8192, 1024]
    - [75, 275.54]
  - - [8192, 2048, 1, 128, 8192, 8192, 8192, 2048]
    - [33, 62.19]
  - - [8192, 2048, 1, 256, 8192, 8192, 8192, 2048]
    - [0, 106.69]
  - - [8192, 2048, 1, 512, 8192, 8192, 8192, 2048]
    - [1, 160.65]
  - - [8192, 2048, 1, 1024, 8192, 8192, 8192, 2048]
    - [7, 194.15]
  - - [8192, 2048, 1, 2048, 8192, 8192, 8192, 2048]
    - [16, 218.63]
  - - [8192, 2048, 1, 4096, 8192, 8192, 8192, 2048]
    - [9, 272.81]
  - - [8192, 2048, 1, 8192, 8192, 8192, 8192, 2048]
    - [73, 323.99]
  - - [8192, 4096, 1, 128, 8192, 8192, 8192, 4096]
    - [2, 66.77]
  - - [8192, 4096, 1, 256, 8192, 8192, 8192, 4096]
    - [3, 110.09]
  - - [8192, 4096, 1, 512, 8192, 8192, 8192, 4096]
    - [16, 163.61]
  - - [8192, 4096, 1, 1024, 8192, 8192, 8192, 4096]
    - [81, 200.49]
  - - [8192, 4096, 1, 2048, 8192, 8192, 8192, 4096]
    - [2, 257.1]
  - - [8192, 4096, 1, 4096, 8192, 8192, 8192, 4096]
    - [78, 286.59]
  - - [8192, 4096, 1, 8192, 8192, 8192, 8192, 4096]
    - [74, 324.23]
  - - [8192, 8192, 1, 128, 8192, 8192, 8192, 8192]
    - [22, 63.69]
  - - [8192, 8192, 1, 256, 8192, 8192, 8192, 8192]
    - [25, 105.92]
  - - [8192, 8192, 1, 512, 8192, 8192, 8192, 8192]
    - [9, 159.07]
  - - [8192, 8192, 1, 1024, 8192, 8192, 8192, 8192]
    - [70, 232.25]
  - - [8192, 8192, 1, 2048, 8192, 8192, 8192, 8192]
    - [72, 286.19]
  - - [8192, 8192, 1, 4096, 8192, 8192, 8192, 8192]
    - [72, 334.32]
  - - [8192, 8192, 1, 8192, 8192, 8192, 8192, 8192]
    - [4, 336.09]
- null
- null
- ExperimentalStreamK
- GridBased
