projects/hipblaslt/library/src/amd_detail/rocblaslt/src/Tensile/Logic/asm_full/aquavanjaram/gfx942_228cu/StreamK/aquavanjaram942_Cijk_Alik_Bljk_F8NF8NS_BH_Bias_HAS_SAV_UserArgs.yaml
- {MinimumRequiredVersion: 4.33.0}
- aquavanjaram942
- {Architecture: gfx942, CUCount: 228}
- [Device 0049, Device 0050]
    SolutionIndex: 0
    SolutionNameMin: Cijk_Alik_Bljk_F8NF8NS_BH_Bias_HAS_SAV_UserArgs_MT256x256x64_MI16x16x1_SN_LDSB1_CLR1_GRVWA16_GRVWB8_GSU0_GSUC0_GSUWGMRR0_K1_LBSPPA512_LBSPPB512_LPA16_LPB8_LRVW8_MIWT8_8_PLR1_SU0_SUM0_SUS64_VWA8_VWB8_WGM1_WGMXCC1_WGMXCCGn1
    SolutionIndex: 1
    SolutionNameMin: Cijk_Alik_Bljk_F8NF8NS_BH_Bias_HAS_SAV_UserArgs_MT256x256x64_MI16x16x1_SN_LDSB1_CLR1_GRVWA8_GRVWB16_GSU0_GSUC0_GSUWGMRR0_K1_LBSPPA512_LBSPPB512_LPA8_LPB16_LRVW8_MIWT8_8_PLR1_SU0_SUM0_SUS64_VWA8_VWB8_WGM1_WGMXCC1_WGMXCCGn1
    SolutionIndex: 2
    SolutionNameMin: Cijk_Alik_Bljk_F8NF8NS_BH_Bias_HAS_SAV_UserArgs_MT256x256x64_MI16x16x1_SN_LDSB1_CLR1_GRVWA8_GRVWB16_GSU0_GSUC0_GSUWGMRR0_K1_LBSPPA512_LBSPPB512_LPA8_LPB16_LRVW8_MIWT8_8_PLR1_SU0_SUM0_SUS64_VWA8_VWB8_WGM6_WGMXCC1_WGMXCCGn1
    SolutionIndex: 3
    SolutionNameMin: Cijk_Alik_Bljk_F8NF8NS_BH_Bias_HAS_SAV_UserArgs_MT256x256x64_MI16x16x1_SN_LDSB1_CLR1_GRVWA8_GRVWB16_GSU0_GSUC0_GSUWGMRR0_K1_LBSPPA512_LBSPPB512_LPA8_LPB16_LRVW8_MIWT8_8_PLR1_SU0_SUM0_SUS64_VWA8_VWB8_WGM8_WGMXCC1_WGMXCCGn1
    SolutionIndex: 4
    SolutionNameMin: Cijk_Alik_Bljk_F8NF8NS_BH_Bias_HAS_SAV_UserArgs_MT256x256x64_MI16x16x1_SN_LDSB1_CLR1_GRVWA16_GRVWB16_GSU0_GSUC0_GSUWGMRR0_K1_LBSPPA512_LBSPPB512_LPA16_LPB16_LRVW8_MIWT8_8_PLR1_SU0_SUM0_SUS64_VWA8_VWB8_WGM8_WGMXCC1_WGMXCCGn1
    SolutionIndex: 5
    SolutionNameMin: Cijk_Alik_Bljk_F8NF8NS_BH_Bias_HAS_SAV_UserArgs_MT128x256x64_MI16x16x1_SN_LDSB1_CLR1_GRVWA8_GRVWB16_GSU0_GSUC0_GSUWGMRR0_K1_LBSPPA256_LBSPPB512_LPA8_LPB16_LRVW8_MIWT4_8_PLR1_SU0_SUM0_SUS64_VWA4_VWB8_WGM8_WGMXCC1_WGMXCCGn1
    SolutionIndex: 6
    SolutionNameMin: Cijk_Alik_Bljk_F8NF8NS_BH_Bias_HAS_SAV_UserArgs_MT256x128x64_MI16x16x1_SN_LDSB1_CLR1_GRVWA8_GRVWB16_GSU0_GSUC0_GSUWGMRR0_K1_LBSPPA512_LBSPPB256_LPA8_LPB16_LRVW8_MIWT8_4_PLR1_SU0_SUM0_SUS64_VWA8_VWB4_WGM1_WGMXCC1_WGMXCCGn1
    SolutionIndex: 7
    SolutionNameMin: Cijk_Alik_Bljk_F8NF8NS_BH_Bias_HAS_SAV_UserArgs_MT256x128x64_MI16x16x1_SN_LDSB1_CLR1_GRVWA8_GRVWB16_GSU0_GSUC0_GSUWGMRR0_K1_LBSPPA512_LBSPPB256_LPA8_LPB16_LRVW8_MIWT8_4_PLR1_SU0_SUM0_SUS64_VWA8_VWB4_WGM8_WGMXCC1_WGMXCCGn1
    SolutionIndex: 8
    SolutionNameMin: Cijk_Alik_Bljk_F8NF8NS_BH_Bias_HAS_SAV_UserArgs_MT128x128x64_MI16x16x1_SN_LDSB1_CLR1_GRVWA16_GRVWB8_GSU0_GSUC0_GSUWGMRR0_K1_LBSPPA128_LBSPPB512_LPA16_LPB8_LRVW8_MIWT2_8_PLR1_SU0_SUM0_SUS64_VWA2_VWB8_WGM6_WGMXCC1_WGMXCCGn1
    SolutionIndex: 9
    SolutionNameMin: Cijk_Alik_Bljk_F8NF8NS_BH_Bias_HAS_SAV_UserArgs_MT128x128x64_MI16x16x1_SN_LDSB1_CLR1_GRVWA8_GRVWB8_GSU0_GSUC0_GSUWGMRR0_K1_LBSPPA128_LBSPPB512_LPA8_LPB8_LRVW8_MIWT2_8_PLR1_SU0_SUM0_SUS64_VWA2_VWB8_WGM8_WGMXCC1_WGMXCCGn1
    SolutionIndex: 10
    SolutionNameMin: Cijk_Alik_Bljk_F8NF8NS_BH_Bias_HAS_SAV_UserArgs_MT128x128x64_MI16x16x1_SN_LDSB1_CLR1_GRVWA8_GRVWB16_GSU0_GSUC0_GSUWGMRR0_K1_LBSPPA512_LBSPPB128_LPA8_LPB16_LRVW8_MIWT8_2_PLR1_SU0_SUM0_SUS64_VWA8_VWB2_WGM1_WGMXCC1_WGMXCCGn1
    SolutionIndex: 11
    SolutionNameMin: Cijk_Alik_Bljk_F8NF8NS_BH_Bias_HAS_SAV_UserArgs_MT128x128x64_MI16x16x1_SN_LDSB1_CLR1_GRVWA8_GRVWB16_GSU0_GSUC0_GSUWGMRR0_K1_LBSPPA512_LBSPPB128_LPA8_LPB16_LRVW8_MIWT8_2_PLR1_SU0_SUM0_SUS64_VWA8_VWB2_WGM8_WGMXCC1_WGMXCCGn1
    SolutionIndex: 12
    SolutionNameMin: Cijk_Alik_Bljk_F8NF8NS_BH_Bias_HAS_SAV_UserArgs_MT128x64x64_MI16x16x1_SN_LDSB0_CLR1_GRVWA8_GRVWB16_GSU0_GSUC0_GSUWGMRR0_K1_LBSPPA512_LBSPPB128_LPA8_LPB16_LRVW8_MIWT8_1_PLR1_SU0_SUM0_SUS64_VWA8_VWB1_WGM1_WGMXCC1_WGMXCCGn1
    SolutionIndex: 13
    SolutionNameMin: Cijk_Alik_Bljk_F8NF8NS_BH_Bias_HAS_SAV_UserArgs_MT128x128x64_MI16x16x1_SN_LDSB1_CLR1_GRVWA8_GRVWB16_GSU0_GSUC0_GSUWGMRR0_K1_LBSPPA256_LBSPPB256_LPA8_LPB16_LRVW8_MIWT4_4_PLR1_SU0_SUM0_SUS64_VWA4_VWB4_WGM1_WGMXCC1_WGMXCCGn1
    SolutionIndex: 14
    SolutionNameMin: Cijk_Alik_Bljk_F8NF8NS_BH_Bias_HAS_SAV_UserArgs_MT64x128x64_MI16x16x1_SN_LDSB0_CLR1_GRVWA8_GRVWB16_GSU0_GSUC0_GSUWGMRR0_K1_LBSPPA128_LBSPPB256_LPA8_LPB16_LRVW8_MIWT2_4_PLR1_SU0_SUM0_SUS64_VWA2_VWB4_WGM1_WGMXCC1_WGMXCCGn1
    SolutionIndex: 15
    SolutionNameMin: Cijk_Alik_Bljk_F8NF8NS_BH_Bias_HAS_SAV_UserArgs_MT64x128x64_MI16x16x1_SN_LDSB0_CLR1_GRVWA8_GRVWB16_GSU0_GSUC0_GSUWGMRR0_K1_LBSPPA128_LBSPPB256_LPA8_LPB16_LRVW8_MIWT2_4_PLR1_SU0_SUM0_SUS64_VWA2_VWB4_WGM8_WGMXCC1_WGMXCCGn1
    SolutionIndex: 16
    SolutionNameMin: Cijk_Alik_Bljk_F8NF8NS_BH_Bias_HAS_SAV_UserArgs_MT128x64x64_MI16x16x1_SN_LDSB0_CLR1_GRVWA16_GRVWB8_GSU0_GSUC0_GSUWGMRR0_K1_LBSPPA256_LBSPPB128_LPA16_LPB8_LRVW8_MIWT4_2_PLR1_SU0_SUM0_SUS64_VWA4_VWB2_WGM1_WGMXCC1_WGMXCCGn1
    SolutionIndex: 17
    SolutionNameMin: Cijk_Alik_Bljk_F8NF8NS_BH_Bias_HAS_SAV_UserArgs_MT128x64x64_MI16x16x1_SN_LDSB0_CLR1_GRVWA8_GRVWB16_GSU0_GSUC0_GSUWGMRR0_K1_LBSPPA256_LBSPPB128_LPA8_LPB16_LRVW8_MIWT4_2_PLR1_SU0_SUM0_SUS64_VWA4_VWB2_WGM1_WGMXCC1_WGMXCCGn1
    SolutionIndex: 18
    SolutionNameMin: Cijk_Alik_Bljk_F8NF8NS_BH_Bias_HAS_SAV_UserArgs_MT128x64x64_MI16x16x1_SN_LDSB0_CLR1_GRVWA8_GRVWB8_GSU0_GSUC0_GSUWGMRR0_K1_LBSPPA256_LBSPPB128_LPA8_LPB8_LRVW8_MIWT4_2_PLR1_SU0_SUM0_SUS64_VWA4_VWB2_WGM6_WGMXCC1_WGMXCCGn1
    SolutionIndex: 19
    SolutionNameMin: Cijk_Alik_Bljk_F8NF8NS_BH_Bias_HAS_SAV_UserArgs_MT128x64x64_MI16x16x1_SN_LDSB0_CLR1_GRVWA8_GRVWB16_GSU0_GSUC0_GSUWGMRR0_K1_LBSPPA256_LBSPPB128_LPA8_LPB16_LRVW8_MIWT4_2_PLR1_SU0_SUM0_SUS64_VWA4_VWB2_WGM6_WGMXCC1_WGMXCCGn1
    SolutionIndex: 20
    SolutionNameMin: Cijk_Alik_Bljk_F8NF8NS_BH_Bias_HAS_SAV_UserArgs_MT128x64x64_MI16x16x1_SN_LDSB0_CLR1_GRVWA8_GRVWB16_GSU0_GSUC0_GSUWGMRR0_K1_LBSPPA256_LBSPPB128_LPA8_LPB16_LRVW8_MIWT4_2_PLR1_SU0_SUM0_SUS64_VWA4_VWB2_WGM8_WGMXCC1_WGMXCCGn1
    SolutionIndex: 21
    SolutionNameMin: Cijk_Alik_Bljk_F8NF8NS_BH_Bias_HAS_SAV_UserArgs_MT64x64x64_MI16x16x1_SN_LDSB0_CLR1_GRVWA8_GRVWB8_GSU0_GSUC0_GSUWGMRR0_K1_LBSPPA128_LBSPPB128_LPA8_LPB8_LRVW8_MIWT2_2_PLR1_SU0_SUM0_SUS64_VWA2_VWB2_WGM1_WGMXCC1_WGMXCCGn1
    SolutionIndex: 22
    SolutionNameMin: Cijk_Alik_Bljk_F8NF8NS_BH_Bias_HAS_SAV_UserArgs_MT64x64x64_MI16x16x1_SN_LDSB0_CLR1_GRVWA16_GRVWB8_GSU0_GSUC0_GSUWGMRR0_K1_LBSPPA128_LBSPPB128_LPA16_LPB8_LRVW8_MIWT2_2_PLR1_SU0_SUM0_SUS64_VWA2_VWB2_WGM1_WGMXCC1_WGMXCCGn1
    SolutionIndex: 23
    SolutionNameMin: Cijk_Alik_Bljk_F8NF8NS_BH_Bias_HAS_SAV_UserArgs_MT64x64x64_MI16x16x1_SN_LDSB0_CLR1_GRVWA8_GRVWB16_GSU0_GSUC0_GSUWGMRR0_K1_LBSPPA128_LBSPPB128_LPA8_LPB16_LRVW8_MIWT2_2_PLR1_SU0_SUM0_SUS64_VWA2_VWB2_WGM1_WGMXCC1_WGMXCCGn1
    SolutionIndex: 24
    SolutionNameMin: Cijk_Alik_Bljk_F8NF8NS_BH_Bias_HAS_SAV_UserArgs_MT64x64x64_MI16x16x1_SN_LDSB0_CLR1_GRVWA16_GRVWB16_GSU0_GSUC0_GSUWGMRR0_K1_LBSPPA128_LBSPPB128_LPA16_LPB16_LRVW8_MIWT2_2_PLR1_SU0_SUM0_SUS64_VWA2_VWB2_WGM1_WGMXCC1_WGMXCCGn1
    SolutionIndex: 25
    SolutionNameMin: Cijk_Alik_Bljk_F8NF8NS_BH_Bias_HAS_SAV_UserArgs_MT64x64x64_MI16x16x1_SN_LDSB0_CLR1_GRVWA8_GRVWB8_GSU0_GSUC0_GSUWGMRR0_K1_LBSPPA128_LBSPPB128_LPA8_LPB8_LRVW8_MIWT2_2_PLR1_SU0_SUM0_SUS64_VWA2_VWB2_WGM6_WGMXCC1_WGMXCCGn1
    SolutionIndex: 26
    SolutionNameMin: Cijk_Alik_Bljk_F8NF8NS_BH_Bias_HAS_SAV_UserArgs_MT64x64x64_MI16x16x1_SN_LDSB0_CLR1_GRVWA16_GRVWB16_GSU0_GSUC0_GSUWGMRR0_K1_LBSPPA128_LBSPPB128_LPA16_LPB16_LRVW8_MIWT2_2_PLR1_SU0_SUM0_SUS64_VWA2_VWB2_WGM6_WGMXCC1_WGMXCCGn1
    SolutionIndex: 27
    SolutionNameMin: Cijk_Alik_Bljk_F8NF8NS_BH_Bias_HAS_SAV_UserArgs_MT64x64x64_MI16x16x1_SN_LDSB0_CLR1_GRVWA8_GRVWB8_GSU0_GSUC0_GSUWGMRR0_K1_LBSPPA128_LBSPPB128_LPA8_LPB8_LRVW8_MIWT2_2_PLR1_SU0_SUM0_SUS64_VWA2_VWB2_WGM8_WGMXCC1_WGMXCCGn1
    SolutionIndex: 28
    SolutionNameMin: Cijk_Alik_Bljk_F8NF8NS_BH_Bias_HAS_SAV_UserArgs_MT64x64x64_MI16x16x1_SN_LDSB0_CLR1_GRVWA8_GRVWB16_GSU0_GSUC0_GSUWGMRR0_K1_LBSPPA128_LBSPPB128_LPA8_LPB16_LRVW8_MIWT2_2_PLR1_SU0_SUM0_SUS64_VWA2_VWB2_WGM8_WGMXCC1_WGMXCCGn1
    SolutionIndex: 29
    SolutionNameMin: Cijk_Alik_Bljk_F8NF8NS_BH_Bias_HAS_SAV_UserArgs_MT64x32x64_MI16x16x1_SN_LDSB0_CLR1_GRVWA8_GRVWB8_GSU0_GSUC0_GSUWGMRR0_K1_LBSPPA128_LBSPPB128_LPA8_LPB8_LRVW8_MIWT2_1_PLR1_SU0_SUM0_SUS64_VWA2_VWB1_WGM1_WGMXCC1_WGMXCCGn1
    SolutionIndex: 30
    SolutionNameMin: Cijk_Alik_Bljk_F8NF8NS_BH_Bias_HAS_SAV_UserArgs_MT64x32x64_MI16x16x1_SN_LDSB0_CLR1_GRVWA16_GRVWB8_GSU0_GSUC0_GSUWGMRR0_K1_LBSPPA128_LBSPPB128_LPA16_LPB8_LRVW8_MIWT2_1_PLR1_SU0_SUM0_SUS64_VWA2_VWB1_WGM1_WGMXCC1_WGMXCCGn1
    SolutionIndex: 31
    SolutionNameMin: Cijk_Alik_Bljk_F8NF8NS_BH_Bias_HAS_SAV_UserArgs_MT32x32x64_MI16x16x1_SN_LDSB0_CLR1_GRVWA8_GRVWB8_GSU0_GSUC0_GSUWGMRR0_K1_LBSPPA128_LBSPPB128_LPA8_LPB8_LRVW8_MIWT1_1_PLR1_SU0_SUM0_SUS64_VWA1_VWB1_WGM1_WGMXCC1_WGMXCCGn1
    SolutionIndex: 32
    SolutionNameMin: Cijk_Alik_Bljk_F8NF8NS_BH_Bias_HAS_SAV_UserArgs_MT128x256x128_MI16x16x1_SN_LDSB1_CLR1_GRVWA16_GRVWB16_GSU0_GSUC0_GSUWGMRR0_K1_LBSPPA512_LBSPPB1024_LPA16_LPB16_LRVW8_MIWT4_8_PLR1_SU0_SUM0_SUS128_VWA4_VWB8_WGM6_WGMXCC1_WGMXCCGn1
    SolutionIndex: 33
    SolutionNameMin: Cijk_Alik_Bljk_F8NF8NS_BH_Bias_HAS_SAV_UserArgs_MT256x144x128_MI16x16x1_SN_LDSB1_CLR1_GRVWA8_GRVWB8_GSU0_GSUC0_GSUWGMRR0_K1_LBSPPA512_LBSPPB128_LPA8_LPB8_LRVW8_MIWT4_9_PLR1_SU0_SUM0_SUS128_VWA4_VWB1_WGM1_WGMXCC1_WGMXCCGn1
    SolutionIndex: 34
    SolutionNameMin: Cijk_Alik_Bljk_F8NF8NS_BH_Bias_HAS_SAV_UserArgs_MT256x144x128_MI16x16x1_SN_LDSB1_CLR1_GRVWA16_GRVWB8_GSU0_GSUC0_GSUWGMRR0_K1_LBSPPA512_LBSPPB128_LPA16_LPB8_LRVW8_MIWT4_9_PLR1_SU0_SUM0_SUS128_VWA4_VWB1_WGM1_WGMXCC1_WGMXCCGn1
    SolutionIndex: 35
    SolutionNameMin: Cijk_Alik_Bljk_F8NF8NS_BH_Bias_HAS_SAV_UserArgs_MT256x144x128_MI16x16x1_SN_LDSB1_CLR1_GRVWA8_GRVWB8_GSU0_GSUC0_GSUWGMRR0_K1_LBSPPA512_LBSPPB128_LPA8_LPB8_LRVW8_MIWT4_9_PLR1_SU0_SUM0_SUS128_VWA4_VWB1_WGM6_WGMXCC1_WGMXCCGn1
    SolutionIndex: 36
    SolutionNameMin: Cijk_Alik_Bljk_F8NF8NS_BH_Bias_HAS_SAV_UserArgs_MT256x144x128_MI16x16x1_SN_LDSB1_CLR1_GRVWA16_GRVWB8_GSU0_GSUC0_GSUWGMRR0_K1_LBSPPA512_LBSPPB128_LPA16_LPB8_LRVW8_MIWT4_9_PLR1_SU0_SUM0_SUS128_VWA4_VWB1_WGM6_WGMXCC1_WGMXCCGn1
    SolutionIndex: 37
    SolutionNameMin: Cijk_Alik_Bljk_F8NF8NS_BH_Bias_HAS_SAV_UserArgs_MT256x144x128_MI16x16x1_SN_LDSB1_CLR1_GRVWA8_GRVWB8_GSU0_GSUC0_GSUWGMRR0_K1_LBSPPA512_LBSPPB128_LPA8_LPB8_LRVW8_MIWT4_9_PLR1_SU0_SUM0_SUS128_VWA4_VWB1_WGM8_WGMXCC1_WGMXCCGn1
    SolutionIndex: 38
    SolutionNameMin: Cijk_Alik_Bljk_F8NF8NS_BH_Bias_HAS_SAV_UserArgs_MT256x144x128_MI16x16x1_SN_LDSB1_CLR1_GRVWA16_GRVWB8_GSU0_GSUC0_GSUWGMRR0_K1_LBSPPA512_LBSPPB128_LPA16_LPB8_LRVW8_MIWT4_9_PLR1_SU0_SUM0_SUS128_VWA4_VWB1_WGM8_WGMXCC1_WGMXCCGn1
    SolutionIndex: 39
    SolutionNameMin: Cijk_Alik_Bljk_F8NF8NS_BH_Bias_HAS_SAV_UserArgs_MT256x128x128_MI16x16x1_SN_LDSB1_CLR1_GRVWA8_GRVWB16_GSU0_GSUC0_GSUWGMRR0_K1_LBSPPA1024_LBSPPB512_LPA8_LPB16_LRVW8_MIWT8_4_PLR1_SU0_SUM0_SUS128_VWA8_VWB4_WGM1_WGMXCC1_WGMXCCGn1
    SolutionIndex: 40
    SolutionNameMin: Cijk_Alik_Bljk_F8NF8NS_BH_Bias_HAS_SAV_UserArgs_MT256x128x128_MI16x16x1_SN_LDSB1_CLR1_GRVWA8_GRVWB16_GSU0_GSUC0_GSUWGMRR0_K1_LBSPPA1024_LBSPPB512_LPA8_LPB16_LRVW8_MIWT8_4_PLR1_SU0_SUM0_SUS128_VWA8_VWB4_WGM6_WGMXCC1_WGMXCCGn1
    SolutionIndex: 41
    SolutionNameMin: Cijk_Alik_Bljk_F8NF8NS_BH_Bias_HAS_SAV_UserArgs_MT256x128x128_MI16x16x1_SN_LDSB1_CLR1_GRVWA8_GRVWB16_GSU0_GSUC0_GSUWGMRR0_K1_LBSPPA1024_LBSPPB512_LPA8_LPB16_LRVW8_MIWT8_4_PLR1_SU0_SUM0_SUS128_VWA8_VWB4_WGM8_WGMXCC1_WGMXCCGn1
    SolutionIndex: 42
    SolutionNameMin: Cijk_Alik_Bljk_F8NF8NS_BH_Bias_HAS_SAV_UserArgs_MT144x256x128_MI16x16x1_SN_LDSB1_CLR1_GRVWA8_GRVWB16_GSU0_GSUC0_GSUWGMRR0_K1_LBSPPA128_LBSPPB512_LPA8_LPB16_LRVW8_MIWT9_4_PLR1_SU0_SUM0_SUS128_VWA1_VWB4_WGM1_WGMXCC1_WGMXCCGn1
    SolutionIndex: 43
    SolutionNameMin: Cijk_Alik_Bljk_F8NF8NS_BH_Bias_HAS_SAV_UserArgs_MT144x256x128_MI16x16x1_SN_LDSB1_CLR1_GRVWA8_GRVWB16_GSU0_GSUC0_GSUWGMRR0_K1_LBSPPA128_LBSPPB512_LPA8_LPB16_LRVW8_MIWT9_4_PLR1_SU0_SUM0_SUS128_VWA1_VWB4_WGM6_WGMXCC1_WGMXCCGn1
    SolutionIndex: 44
    SolutionNameMin: Cijk_Alik_Bljk_F8NF8NS_BH_Bias_HAS_SAV_UserArgs_MT144x256x128_MI16x16x1_SN_LDSB1_CLR1_GRVWA8_GRVWB8_GSU0_GSUC0_GSUWGMRR0_K1_LBSPPA128_LBSPPB512_LPA8_LPB8_LRVW8_MIWT9_4_PLR1_SU0_SUM0_SUS128_VWA1_VWB4_WGM8_WGMXCC1_WGMXCCGn1
    SolutionIndex: 45
    SolutionNameMin: Cijk_Alik_Bljk_F8NF8NS_BH_Bias_HAS_SAV_UserArgs_MT144x256x128_MI16x16x1_SN_LDSB1_CLR1_GRVWA8_GRVWB16_GSU0_GSUC0_GSUWGMRR0_K1_LBSPPA128_LBSPPB512_LPA8_LPB16_LRVW8_MIWT9_4_PLR1_SU0_SUM0_SUS128_VWA1_VWB4_WGM8_WGMXCC1_WGMXCCGn1
    SolutionIndex: 46
    SolutionNameMin: Cijk_Alik_Bljk_F8NF8NS_BH_Bias_HAS_SAV_UserArgs_MT128x128x128_MI16x16x1_SN_LDSB1_CLR1_GRVWA8_GRVWB16_GSU0_GSUC0_GSUWGMRR0_K1_LBSPPA1024_LBSPPB256_LPA8_LPB16_LRVW8_MIWT8_2_PLR1_SU0_SUM0_SUS128_VWA8_VWB2_WGM1_WGMXCC1_WGMXCCGn1
    SolutionIndex: 47
    SolutionNameMin: Cijk_Alik_Bljk_F8NF8NS_BH_Bias_HAS_SAV_UserArgs_MT128x128x128_MI16x16x1_SN_LDSB1_CLR1_GRVWA8_GRVWB16_GSU0_GSUC0_GSUWGMRR0_K1_LBSPPA1024_LBSPPB256_LPA8_LPB16_LRVW8_MIWT8_2_PLR1_SU0_SUM0_SUS128_VWA8_VWB2_WGM6_WGMXCC1_WGMXCCGn1
    SolutionIndex: 48
    SolutionNameMin: Cijk_Alik_Bljk_F8NF8NS_BH_Bias_HAS_SAV_UserArgs_MT128x128x128_MI16x16x1_SN_LDSB1_CLR1_GRVWA8_GRVWB16_GSU0_GSUC0_GSUWGMRR0_K1_LBSPPA1024_LBSPPB256_LPA8_LPB16_LRVW8_MIWT8_2_PLR1_SU0_SUM0_SUS128_VWA8_VWB2_WGM8_WGMXCC1_WGMXCCGn1
    SolutionIndex: 49
    SolutionNameMin: Cijk_Alik_Bljk_F8NF8NS_BH_Bias_HAS_SAV_UserArgs_MT128x144x128_MI16x16x1_SN_LDSB1_CLR1_GRVWA8_GRVWB8_GSU0_GSUC0_GSUWGMRR0_K1_LBSPPA256_LBSPPB128_LPA8_LPB8_LRVW8_MIWT2_9_PLR1_SU0_SUM0_SUS128_VWA2_VWB1_WGM1_WGMXCC1_WGMXCCGn1
    SolutionIndex: 50
    SolutionNameMin: Cijk_Alik_Bljk_F8NF8NS_BH_Bias_HAS_SAV_UserArgs_MT128x144x128_MI16x16x1_SN_LDSB1_CLR1_GRVWA16_GRVWB8_GSU0_GSUC0_GSUWGMRR0_K1_LBSPPA256_LBSPPB128_LPA16_LPB8_LRVW8_MIWT2_9_PLR1_SU0_SUM0_SUS128_VWA2_VWB1_WGM1_WGMXCC1_WGMXCCGn1
    SolutionIndex: 51
    SolutionNameMin: Cijk_Alik_Bljk_F8NF8NS_BH_Bias_HAS_SAV_UserArgs_MT128x144x128_MI16x16x1_SN_LDSB1_CLR1_GRVWA8_GRVWB8_GSU0_GSUC0_GSUWGMRR0_K1_LBSPPA256_LBSPPB128_LPA8_LPB8_LRVW8_MIWT2_9_PLR1_SU0_SUM0_SUS128_VWA2_VWB1_WGM6_WGMXCC1_WGMXCCGn1
    SolutionIndex: 52
    SolutionNameMin: Cijk_Alik_Bljk_F8NF8NS_BH_Bias_HAS_SAV_UserArgs_MT128x144x128_MI16x16x1_SN_LDSB1_CLR1_GRVWA16_GRVWB8_GSU0_GSUC0_GSUWGMRR0_K1_LBSPPA256_LBSPPB128_LPA16_LPB8_LRVW8_MIWT2_9_PLR1_SU0_SUM0_SUS128_VWA2_VWB1_WGM8_WGMXCC1_WGMXCCGn1
    SolutionIndex: 53
    SolutionNameMin: Cijk_Alik_Bljk_F8NF8NS_BH_Bias_HAS_SAV_UserArgs_MT256x32x128_MI16x16x1_SN_LDSB1_CLR1_GRVWA8_GRVWB8_GSU0_GSUC0_GSUWGMRR0_K1_LBSPPA1024_LBSPPB128_LPA8_LPB8_LRVW8_MIWT8_1_PLR1_SU0_SUM0_SUS128_VWA8_VWB1_WGM6_WGMXCC1_WGMXCCGn1
    SolutionIndex: 54
    SolutionNameMin: Cijk_Alik_Bljk_F8NF8NS_BH_Bias_HAS_SAV_UserArgs_MT144x128x128_MI16x16x1_SN_LDSB1_CLR1_GRVWA8_GRVWB16_GSU0_GSUC0_GSUWGMRR0_K1_LBSPPA128_LBSPPB256_LPA8_LPB16_LRVW8_MIWT9_2_PLR1_SU0_SUM0_SUS128_VWA1_VWB2_WGM6_WGMXCC1_WGMXCCGn1
    SolutionIndex: 55
    SolutionNameMin: Cijk_Alik_Bljk_F8NF8NS_BH_Bias_HAS_SAV_UserArgs_MT144x128x128_MI16x16x1_SN_LDSB1_CLR1_GRVWA8_GRVWB16_GSU0_GSUC0_GSUWGMRR0_K1_LBSPPA128_LBSPPB256_LPA8_LPB16_LRVW8_MIWT9_2_PLR1_SU0_SUM0_SUS128_VWA1_VWB2_WGM8_WGMXCC1_WGMXCCGn1
    SolutionIndex: 56
    SolutionNameMin: Cijk_Alik_Bljk_F8NF8NS_BH_Bias_HAS_SAV_UserArgs_MT128x128x128_MI16x16x1_SN_LDSB1_CLR1_GRVWA8_GRVWB16_GSU0_GSUC0_GSUWGMRR0_K1_LBSPPA512_LBSPPB512_LPA8_LPB16_LRVW8_MIWT4_4_PLR1_SU0_SUM0_SUS128_VWA4_VWB4_WGM1_WGMXCC1_WGMXCCGn1
    SolutionIndex: 57
    SolutionNameMin: Cijk_Alik_Bljk_F8NF8NS_BH_Bias_HAS_SAV_UserArgs_MT128x128x128_MI16x16x1_SN_LDSB1_CLR1_GRVWA16_GRVWB16_GSU0_GSUC0_GSUWGMRR0_K1_LBSPPA512_LBSPPB512_LPA16_LPB16_LRVW8_MIWT4_4_PLR1_SU0_SUM0_SUS128_VWA4_VWB4_WGM1_WGMXCC1_WGMXCCGn1
    SolutionIndex: 58
    SolutionNameMin: Cijk_Alik_Bljk_F8NF8NS_BH_Bias_HAS_SAV_UserArgs_MT128x128x128_MI16x16x1_SN_LDSB1_CLR1_GRVWA8_GRVWB16_GSU0_GSUC0_GSUWGMRR0_K1_LBSPPA512_LBSPPB512_LPA8_LPB16_LRVW8_MIWT4_4_PLR1_SU0_SUM0_SUS128_VWA4_VWB4_WGM6_WGMXCC1_WGMXCCGn1
    SolutionIndex: 59
    SolutionNameMin: Cijk_Alik_Bljk_F8NF8NS_BH_Bias_HAS_SAV_UserArgs_MT128x128x128_MI16x16x1_SN_LDSB1_CLR1_GRVWA16_GRVWB16_GSU0_GSUC0_GSUWGMRR0_K1_LBSPPA512_LBSPPB512_LPA16_LPB16_LRVW8_MIWT4_4_PLR1_SU0_SUM0_SUS128_VWA4_VWB4_WGM6_WGMXCC1_WGMXCCGn1
    SolutionIndex: 60
    SolutionNameMin: Cijk_Alik_Bljk_F8NF8NS_BH_Bias_HAS_SAV_UserArgs_MT128x128x128_MI16x16x1_SN_LDSB1_CLR1_GRVWA8_GRVWB16_GSU0_GSUC0_GSUWGMRR0_K1_LBSPPA512_LBSPPB512_LPA8_LPB16_LRVW8_MIWT4_4_PLR1_SU0_SUM0_SUS128_VWA4_VWB4_WGM8_WGMXCC1_WGMXCCGn1
    SolutionIndex: 61
    SolutionNameMin: Cijk_Alik_Bljk_F8NF8NS_BH_Bias_HAS_SAV_UserArgs_MT64x128x128_MI16x16x1_SN_LDSB1_CLR1_GRVWA16_GRVWB8_GSU0_GSUC0_GSUWGMRR0_K1_LBSPPA256_LBSPPB512_LPA16_LPB8_LRVW8_MIWT2_4_PLR1_SU0_SUM0_SUS128_VWA2_VWB4_WGM1_WGMXCC1_WGMXCCGn1
    SolutionIndex: 62
    SolutionNameMin: Cijk_Alik_Bljk_F8NF8NS_BH_Bias_HAS_SAV_UserArgs_MT64x128x128_MI16x16x1_SN_LDSB1_CLR1_GRVWA8_GRVWB16_GSU0_GSUC0_GSUWGMRR0_K1_LBSPPA256_LBSPPB512_LPA8_LPB16_LRVW8_MIWT2_4_PLR1_SU0_SUM0_SUS128_VWA2_VWB4_WGM1_WGMXCC1_WGMXCCGn1
    SolutionIndex: 63
    SolutionNameMin: Cijk_Alik_Bljk_F8NF8NS_BH_Bias_HAS_SAV_UserArgs_MT64x128x128_MI16x16x1_SN_LDSB1_CLR1_GRVWA8_GRVWB16_GSU0_GSUC0_GSUWGMRR0_K1_LBSPPA256_LBSPPB512_LPA8_LPB16_LRVW8_MIWT2_4_PLR1_SU0_SUM0_SUS128_VWA2_VWB4_WGM6_WGMXCC1_WGMXCCGn1
    SolutionIndex: 64
    SolutionNameMin: Cijk_Alik_Bljk_F8NF8NS_BH_Bias_HAS_SAV_UserArgs_MT64x128x128_MI16x16x1_SN_LDSB1_CLR1_GRVWA8_GRVWB16_GSU0_GSUC0_GSUWGMRR0_K1_LBSPPA256_LBSPPB512_LPA8_LPB16_LRVW8_MIWT2_4_PLR1_SU0_SUM0_SUS128_VWA2_VWB4_WGM8_WGMXCC1_WGMXCCGn1
    SolutionIndex: 65
    SolutionNameMin: Cijk_Alik_Bljk_F8NF8NS_BH_Bias_HAS_SAV_UserArgs_MT128x64x128_MI16x16x1_SN_LDSB1_CLR1_GRVWA8_GRVWB8_GSU0_GSUC0_GSUWGMRR0_K1_LBSPPA512_LBSPPB256_LPA8_LPB8_LRVW8_MIWT4_2_PLR1_SU0_SUM0_SUS128_VWA4_VWB2_WGM1_WGMXCC1_WGMXCCGn1
    SolutionIndex: 66
    SolutionNameMin: Cijk_Alik_Bljk_F8NF8NS_BH_Bias_HAS_SAV_UserArgs_MT128x64x128_MI16x16x1_SN_LDSB1_CLR1_GRVWA8_GRVWB16_GSU0_GSUC0_GSUWGMRR0_K1_LBSPPA512_LBSPPB256_LPA8_LPB16_LRVW8_MIWT4_2_PLR1_SU0_SUM0_SUS128_VWA4_VWB2_WGM1_WGMXCC1_WGMXCCGn1
    SolutionIndex: 67
    SolutionNameMin: Cijk_Alik_Bljk_F8NF8NS_BH_Bias_HAS_SAV_UserArgs_MT128x64x128_MI16x16x1_SN_LDSB1_CLR1_GRVWA16_GRVWB16_GSU0_GSUC0_GSUWGMRR0_K1_LBSPPA512_LBSPPB256_LPA16_LPB16_LRVW8_MIWT4_2_PLR1_SU0_SUM0_SUS128_VWA4_VWB2_WGM1_WGMXCC1_WGMXCCGn1
    SolutionIndex: 68
    SolutionNameMin: Cijk_Alik_Bljk_F8NF8NS_BH_Bias_HAS_SAV_UserArgs_MT64x64x128_MI16x16x1_SN_LDSB1_CLR1_GRVWA16_GRVWB8_GSU0_GSUC0_GSUWGMRR0_K1_LBSPPA256_LBSPPB256_LPA16_LPB8_LRVW8_MIWT2_2_PLR1_SU0_SUM0_SUS128_VWA2_VWB2_WGM1_WGMXCC1_WGMXCCGn1
    SolutionIndex: 69
    SolutionNameMin: Cijk_Alik_Bljk_F8NF8NS_BH_Bias_HAS_SAV_UserArgs_MT64x64x128_MI16x16x1_SN_LDSB1_CLR1_GRVWA8_GRVWB16_GSU0_GSUC0_GSUWGMRR0_K1_LBSPPA256_LBSPPB256_LPA8_LPB16_LRVW8_MIWT2_2_PLR1_SU0_SUM0_SUS128_VWA2_VWB2_WGM1_WGMXCC1_WGMXCCGn1
    SolutionIndex: 70
    SolutionNameMin: Cijk_Alik_Bljk_F8NF8NS_BH_Bias_HAS_SAV_UserArgs_MT64x64x128_MI16x16x1_SN_LDSB1_CLR1_GRVWA8_GRVWB16_GSU0_GSUC0_GSUWGMRR0_K1_LBSPPA256_LBSPPB256_LPA8_LPB16_LRVW8_MIWT2_2_PLR1_SU0_SUM0_SUS128_VWA2_VWB2_WGM6_WGMXCC1_WGMXCCGn1
    SolutionIndex: 71
    SolutionNameMin: Cijk_Alik_Bljk_F8NF8NS_BH_Bias_HAS_SAV_UserArgs_MT64x64x128_MI16x16x1_SN_LDSB1_CLR1_GRVWA8_GRVWB16_GSU0_GSUC0_GSUWGMRR0_K1_LBSPPA256_LBSPPB256_LPA8_LPB16_LRVW8_MIWT2_2_PLR1_SU0_SUM0_SUS128_VWA2_VWB2_WGM8_WGMXCC1_WGMXCCGn1
    SolutionIndex: 72
    SolutionNameMin: Cijk_Alik_Bljk_F8NF8NS_BH_Bias_HAS_SAV_UserArgs_MT32x64x128_MI16x16x1_SN_LDSB0_CLR1_GRVWA8_GRVWB8_GSU0_GSUC0_GSUWGMRR0_K1_LBSPPA128_LBSPPB256_LPA8_LPB8_LRVW8_MIWT1_2_PLR1_SU0_SUM0_SUS128_VWA1_VWB2_WGM1_WGMXCC1_WGMXCCGn1
    SolutionIndex: 73
    SolutionNameMin: Cijk_Alik_Bljk_F8NF8NS_BH_Bias_HAS_SAV_UserArgs_MT32x64x128_MI16x16x1_SN_LDSB0_CLR1_GRVWA8_GRVWB16_GSU0_GSUC0_GSUWGMRR0_K1_LBSPPA128_LBSPPB256_LPA8_LPB16_LRVW8_MIWT1_2_PLR1_SU0_SUM0_SUS128_VWA1_VWB2_WGM1_WGMXCC1_WGMXCCGn1
    SolutionIndex: 74
    SolutionNameMin: Cijk_Alik_Bljk_F8NF8NS_BH_Bias_HAS_SAV_UserArgs_MT32x64x128_MI16x16x1_SN_LDSB0_CLR1_GRVWA8_GRVWB8_GSU0_GSUC0_GSUWGMRR0_K1_LBSPPA128_LBSPPB256_LPA8_LPB8_LRVW8_MIWT1_2_PLR1_SU0_SUM0_SUS128_VWA1_VWB2_WGM8_WGMXCC1_WGMXCCGn1
    SolutionIndex: 75
    SolutionNameMin: Cijk_Alik_Bljk_F8NF8NS_BH_Bias_HAS_SAV_UserArgs_MT32x64x128_MI16x16x1_SN_LDSB0_CLR1_GRVWA16_GRVWB8_GSU0_GSUC0_GSUWGMRR0_K1_LBSPPA128_LBSPPB256_LPA16_LPB8_LRVW8_MIWT1_2_PLR1_SU0_SUM0_SUS128_VWA1_VWB2_WGM8_WGMXCC1_WGMXCCGn1
    SolutionIndex: 76
    SolutionNameMin: Cijk_Alik_Bljk_F8NF8NS_BH_Bias_HAS_SAV_UserArgs_MT64x32x128_MI16x16x1_SN_LDSB0_CLR1_GRVWA8_GRVWB8_GSU0_GSUC0_GSUWGMRR0_K1_LBSPPA256_LBSPPB128_LPA8_LPB8_LRVW8_MIWT2_1_PLR1_SU0_SUM0_SUS128_VWA2_VWB1_WGM1_WGMXCC1_WGMXCCGn1
    SolutionIndex: 77
    SolutionNameMin: Cijk_Alik_Bljk_F8NF8NS_BH_Bias_HAS_SAV_UserArgs_MT64x32x128_MI16x16x1_SN_LDSB0_CLR1_GRVWA16_GRVWB8_GSU0_GSUC0_GSUWGMRR0_K1_LBSPPA256_LBSPPB128_LPA16_LPB8_LRVW8_MIWT2_1_PLR1_SU0_SUM0_SUS128_VWA2_VWB1_WGM1_WGMXCC1_WGMXCCGn1
    SolutionIndex: 78
    SolutionNameMin: Cijk_Alik_Bljk_F8NF8NS_BH_Bias_HAS_SAV_UserArgs_MT64x32x128_MI16x16x1_SN_LDSB0_CLR1_GRVWA8_GRVWB16_GSU0_GSUC0_GSUWGMRR0_K1_LBSPPA256_LBSPPB128_LPA8_LPB16_LRVW8_MIWT2_1_PLR1_SU0_SUM0_SUS128_VWA2_VWB1_WGM1_WGMXCC1_WGMXCCGn1
    SolutionIndex: 79
    SolutionNameMin: Cijk_Alik_Bljk_F8NF8NS_BH_Bias_HAS_SAV_UserArgs_MT64x32x128_MI16x16x1_SN_LDSB0_CLR1_GRVWA16_GRVWB16_GSU0_GSUC0_GSUWGMRR0_K1_LBSPPA256_LBSPPB128_LPA16_LPB16_LRVW8_MIWT2_1_PLR1_SU0_SUM0_SUS128_VWA2_VWB1_WGM1_WGMXCC1_WGMXCCGn1
    SolutionIndex: 80
    SolutionNameMin: Cijk_Alik_Bljk_F8NF8NS_BH_Bias_HAS_SAV_UserArgs_MT32x32x128_MI16x16x1_SN_LDSB0_CLR1_GRVWA8_GRVWB8_GSU0_GSUC0_GSUWGMRR0_K1_LBSPPA128_LBSPPB128_LPA8_LPB8_LRVW8_MIWT1_1_PLR1_SU0_SUM0_SUS128_VWA1_VWB1_WGM1_WGMXCC1_WGMXCCGn1
    SolutionIndex: 81
    SolutionNameMin: Cijk_Alik_Bljk_F8NF8NS_BH_Bias_HAS_SAV_UserArgs_MT32x32x128_MI16x16x1_SN_LDSB0_CLR1_GRVWA16_GRVWB8_GSU0_GSUC0_GSUWGMRR0_K1_LBSPPA128_LBSPPB128_LPA16_LPB8_LRVW8_MIWT1_1_PLR1_SU0_SUM0_SUS128_VWA1_VWB1_WGM1_WGMXCC1_WGMXCCGn1
    SolutionIndex: 82
    SolutionNameMin: Cijk_Alik_Bljk_F8NF8NS_BH_Bias_HAS_SAV_UserArgs_MT32x32x128_MI16x16x1_SN_LDSB0_CLR1_GRVWA8_GRVWB16_GSU0_GSUC0_GSUWGMRR0_K1_LBSPPA128_LBSPPB128_LPA8_LPB16_LRVW8_MIWT1_1_PLR1_SU0_SUM0_SUS128_VWA1_VWB1_WGM1_WGMXCC1_WGMXCCGn1
    SolutionIndex: 83
    SolutionNameMin: Cijk_Alik_Bljk_F8NF8NS_BH_Bias_HAS_SAV_UserArgs_MT32x32x128_MI16x16x1_SN_LDSB0_CLR1_GRVWA16_GRVWB16_GSU0_GSUC0_GSUWGMRR0_K1_LBSPPA128_LBSPPB128_LPA16_LPB16_LRVW8_MIWT1_1_PLR1_SU0_SUM0_SUS128_VWA1_VWB1_WGM1_WGMXCC1_WGMXCCGn1
    SolutionIndex: 84
    SolutionNameMin: Cijk_Alik_Bljk_F8NF8NS_BH_Bias_HAS_SAV_UserArgs_MT32x32x128_MI16x16x1_SN_LDSB0_CLR1_GRVWA8_GRVWB16_GSU0_GSUC0_GSUWGMRR0_K1_LBSPPA128_LBSPPB128_LPA8_LPB16_LRVW8_MIWT1_1_PLR1_SU0_SUM0_SUS128_VWA1_VWB1_WGM6_WGMXCC1_WGMXCCGn1
    SolutionIndex: 85
    SolutionNameMin: Cijk_Alik_Bljk_F8NF8NS_BH_Bias_HAS_SAV_UserArgs_MT32x32x128_MI16x16x1_SN_LDSB0_CLR1_GRVWA16_GRVWB16_GSU0_GSUC0_GSUWGMRR0_K1_LBSPPA128_LBSPPB128_LPA16_LPB16_LRVW8_MIWT1_1_PLR1_SU0_SUM0_SUS128_VWA1_VWB1_WGM6_WGMXCC1_WGMXCCGn1
    SolutionIndex: 86
    SolutionNameMin: Cijk_Alik_Bljk_F8NF8NS_BH_Bias_HAS_SAV_UserArgs_MT32x32x128_MI16x16x1_SN_LDSB0_CLR1_GRVWA8_GRVWB8_GSU0_GSUC0_GSUWGMRR0_K1_LBSPPA128_LBSPPB128_LPA8_LPB8_LRVW8_MIWT1_1_PLR1_SU0_SUM0_SUS128_VWA1_VWB1_WGM8_WGMXCC1_WGMXCCGn1
    SolutionIndex: 87
    SolutionNameMin: Cijk_Alik_Bljk_F8NF8NS_BH_Bias_HAS_SAV_UserArgs_MT32x32x128_MI16x16x1_SN_LDSB0_CLR1_GRVWA16_GRVWB16_GSU0_GSUC0_GSUWGMRR0_K1_LBSPPA128_LBSPPB128_LPA16_LPB16_LRVW8_MIWT1_1_PLR1_SU0_SUM0_SUS128_VWA1_VWB1_WGM8_WGMXCC1_WGMXCCGn1
    SolutionIndex: 88
    SolutionNameMin: Cijk_Alik_Bljk_F8NF8NS_BH_Bias_HAS_SAV_UserArgs_MT64x128x256_MI16x16x1_SN_LDSB1_CLR1_GRVWA8_GRVWB8_GSU0_GSUC0_GSUWGMRR0_K1_LBSPPA512_LBSPPB1024_LPA8_LPB8_LRVW8_MIWT2_4_PLR1_SU0_SUM0_SUS256_VWA2_VWB4_WGM1_WGMXCC1_WGMXCCGn1
    SolutionIndex: 89
    SolutionNameMin: Cijk_Alik_Bljk_F8NF8NS_BH_Bias_HAS_SAV_UserArgs_MT128x64x256_MI16x16x1_SN_LDSB1_CLR1_GRVWA8_GRVWB16_GSU0_GSUC0_GSUWGMRR0_K1_LBSPPA1024_LBSPPB512_LPA8_LPB16_LRVW8_MIWT4_2_PLR1_SU0_SUM0_SUS256_VWA4_VWB2_WGM1_WGMXCC1_WGMXCCGn1
    SolutionIndex: 90
    SolutionNameMin: Cijk_Alik_Bljk_F8NF8NS_BH_Bias_HAS_SAV_UserArgs_MT128x64x256_MI16x16x1_SN_LDSB1_CLR1_GRVWA8_GRVWB16_GSU0_GSUC0_GSUWGMRR0_K1_LBSPPA1024_LBSPPB512_LPA8_LPB16_LRVW8_MIWT4_2_PLR1_SU0_SUM0_SUS256_VWA4_VWB2_WGM6_WGMXCC1_WGMXCCGn1
    SolutionIndex: 91
    SolutionNameMin: Cijk_Alik_Bljk_F8NF8NS_BH_Bias_HAS_SAV_UserArgs_MT128x64x256_MI16x16x1_SN_LDSB1_CLR1_GRVWA8_GRVWB16_GSU0_GSUC0_GSUWGMRR0_K1_LBSPPA1024_LBSPPB512_LPA8_LPB16_LRVW8_MIWT4_2_PLR1_SU0_SUM0_SUS256_VWA4_VWB2_WGM8_WGMXCC1_WGMXCCGn1
    SolutionIndex: 92
    SolutionNameMin: Cijk_Alik_Bljk_F8NF8NS_BH_Bias_HAS_SAV_UserArgs_MT64x64x256_MI16x16x1_SN_LDSB1_CLR1_GRVWA8_GRVWB16_GSU0_GSUC0_GSUWGMRR0_K1_LBSPPA512_LBSPPB512_LPA8_LPB16_LRVW8_MIWT2_2_PLR1_SU0_SUM0_SUS256_VWA2_VWB2_WGM1_WGMXCC1_WGMXCCGn1
    SolutionIndex: 93
    SolutionNameMin: Cijk_Alik_Bljk_F8NF8NS_BH_Bias_HAS_SAV_UserArgs_MT64x64x256_MI16x16x1_SN_LDSB1_CLR1_GRVWA16_GRVWB16_GSU0_GSUC0_GSUWGMRR0_K1_LBSPPA512_LBSPPB512_LPA16_LPB16_LRVW8_MIWT2_2_PLR1_SU0_SUM0_SUS256_VWA2_VWB2_WGM1_WGMXCC1_WGMXCCGn1
    SolutionIndex: 94
    SolutionNameMin: Cijk_Alik_Bljk_F8NF8NS_BH_Bias_HAS_SAV_UserArgs_MT64x64x256_MI16x16x1_SN_LDSB1_CLR1_GRVWA8_GRVWB16_GSU0_GSUC0_GSUWGMRR0_K1_LBSPPA512_LBSPPB512_LPA8_LPB16_LRVW8_MIWT2_2_PLR1_SU0_SUM0_SUS256_VWA2_VWB2_WGM6_WGMXCC1_WGMXCCGn1
    SolutionIndex: 95
    SolutionNameMin: Cijk_Alik_Bljk_F8NF8NS_BH_Bias_HAS_SAV_UserArgs_MT32x32x256_MI16x16x1_SN_LDSB1_CLR1_GRVWA8_GRVWB16_GSU0_GSUC0_GSUWGMRR0_K1_LBSPPA256_LBSPPB256_LPA8_LPB16_LRVW8_MIWT1_1_PLR1_SU0_SUM0_SUS256_VWA1_VWB1_WGM1_WGMXCC1_WGMXCCGn1
    SolutionIndex: 96
    SolutionNameMin: Cijk_Alik_Bljk_F8NF8NS_BH_Bias_HAS_SAV_UserArgs_MT32x32x256_MI16x16x1_SN_LDSB1_CLR1_GRVWA16_GRVWB8_GSU0_GSUC0_GSUWGMRR0_K1_LBSPPA256_LBSPPB256_LPA16_LPB8_LRVW8_MIWT1_1_PLR1_SU0_SUM0_SUS256_VWA1_VWB1_WGM6_WGMXCC1_WGMXCCGn1
    SolutionIndex: 97
    SolutionNameMin: Cijk_Alik_Bljk_F8NF8NS_BH_Bias_HAS_SAV_UserArgs_MT32x32x64_MI16x16x1_SN_LDSB0_CLR1_GRVWA8_GRVWB8_GSU0_GSUC0_GSUWGMRR0_K1_LBSPPA128_LBSPPB128_LPA8_LPB8_LRVW8_MIWT1_1_PLR1_SU32_SUM0_SUS256_VWA1_VWB1_WGM1_WGMXCC1_WGMXCCGn1
- - - [128, 128, 1, 128, 128, 128, 128, 128]
    - [83, 0.61]
  - - [128, 128, 1, 256, 128, 128, 256, 256]
    - [82, 1.13]
  - - [128, 128, 1, 512, 128, 128, 512, 512]
    - [83, 2.02]
  - - [128, 128, 1, 1024, 128, 128, 1024, 1024]
    - [80, 3.39]
  - - [128, 128, 1, 2048, 128, 128, 2048, 2048]
    - [80, 5.19]
  - - [128, 128, 1, 4096, 128, 128, 4096, 4096]
    - [80, 7.1]
  - - [128, 128, 1, 8192, 128, 128, 8192, 8192]
    - [80, 8.63]
  - - [128, 256, 1, 128, 128, 128, 128, 128]
    - [83, 1.22]
  - - [128, 256, 1, 256, 128, 128, 256, 256]
    - [31, 2.3]
  - - [128, 256, 1, 512, 128, 128, 512, 512]
    - [82, 4.16]
  - - [128, 256, 1, 1024, 128, 128, 1024, 1024]
    - [80, 6.9]
  - - [128, 256, 1, 2048, 128, 128, 2048, 2048]
    - [80, 10.54]
  - - [128, 256, 1, 4096, 128, 128, 4096, 4096]
    - [80, 14.26]
  - - [128, 256, 1, 8192, 128, 128, 8192, 8192]
    - [80, 17.32]
  - - [128, 512, 1, 128, 128, 128, 128, 128]
    - [83, 2.47]
  - - [128, 512, 1, 256, 128, 128, 256, 256]
    - [82, 4.51]
  - - [128, 512, 1, 512, 128, 128, 512, 512]
    - [82, 8.2]
  - - [128, 512, 1, 1024, 128, 128, 1024, 1024]
    - [95, 13.63]
  - - [128, 512, 1, 2048, 128, 128, 2048, 2048]
    - [80, 21.17]
  - - [128, 512, 1, 4096, 128, 128, 4096, 4096]
    - [80, 28.3]
  - - [128, 512, 1, 8192, 128, 128, 8192, 8192]
    - [80, 34.28]
  - - [128, 1024, 1, 128, 128, 128, 128, 128]
    - [82, 4.77]
  - - [128, 1024, 1, 256, 128, 128, 256, 256]
    - [83, 9.0]
  - - [128, 1024, 1, 512, 128, 128, 512, 512]
    - [82, 16.23]
  - - [128, 1024, 1, 1024, 128, 128, 1024, 1024]
    - [80, 27.21]
  - - [128, 1024, 1, 2048, 128, 128, 2048, 2048]
    - [80, 41.06]
  - - [128, 1024, 1, 4096, 128, 128, 4096, 4096]
    - [80, 55.71]
  - - [128, 1024, 1, 8192, 128, 128, 8192, 8192]
    - [80, 67.22]
  - - [128, 2048, 1, 128, 128, 128, 128, 128]
    - [78, 9.11]
  - - [128, 2048, 1, 256, 128, 128, 256, 256]
    - [29, 16.76]
  - - [128, 2048, 1, 512, 128, 128, 512, 512]
    - [76, 28.97]
  - - [128, 2048, 1, 1024, 128, 128, 1024, 1024]
    - [78, 47.16]
  - - [128, 2048, 1, 2048, 128, 128, 2048, 2048]
    - [72, 68.32]
  - - [128, 2048, 1, 4096, 128, 128, 4096, 4096]
    - [72, 88.8]
  - - [128, 2048, 1, 8192, 128, 128, 8192, 8192]
    - [95, 98.93]
  - - [128, 4096, 1, 128, 128, 128, 128, 128]
    - [69, 16.33]
  - - [128, 4096, 1, 256, 128, 128, 256, 256]
    - [21, 30.01]
  - - [128, 4096, 1, 512, 128, 128, 512, 512]
    - [23, 49.53]
  - - [128, 4096, 1, 1024, 128, 128, 1024, 1024]
    - [68, 76.46]
  - - [128, 4096, 1, 2048, 128, 128, 2048, 2048]
    - [69, 106.03]
  - - [128, 4096, 1, 4096, 128, 128, 4096, 4096]
    - [69, 130.45]
  - - [128, 4096, 1, 8192, 128, 128, 8192, 8192]
    - [92, 142.26]
  - - [128, 8192, 1, 128, 128, 128, 128, 128]
    - [12, 28.44]
  - - [128, 8192, 1, 256, 128, 128, 256, 256]
    - [16, 50.66]
  - - [128, 8192, 1, 512, 128, 128, 512, 512]
    - [17, 84.57]
  - - [128, 8192, 1, 1024, 128, 128, 1024, 1024]
    - [17, 124.42]
  - - [128, 8192, 1, 2048, 128, 128, 2048, 2048]
    - [17, 162.42]
  - - [128, 8192, 1, 4096, 128, 128, 4096, 4096]
    - [88, 165.23]
  - - [128, 8192, 1, 8192, 128, 128, 8192, 8192]
    - [93, 187.19]
  - - [256, 128, 1, 128, 256, 256, 128, 128]
    - [82, 1.21]
  - - [256, 128, 1, 256, 256, 256, 256, 256]
    - [83, 2.28]
  - - [256, 128, 1, 512, 256, 256, 512, 512]
    - [81, 4.08]
  - - [256, 128, 1, 1024, 256, 256, 1024, 1024]
    - [80, 6.87]
  - - [256, 128, 1, 2048, 256, 256, 2048, 2048]
    - [80, 10.46]
  - - [256, 128, 1, 4096, 256, 256, 4096, 4096]
    - [80, 14.2]
  - - [256, 128, 1, 8192, 256, 256, 8192, 8192]
    - [80, 17.19]
  - - [256, 256, 1, 128, 256, 256, 128, 128]
    - [82, 2.39]
  - - [256, 256, 1, 256, 256, 256, 256, 256]
    - [83, 4.49]
  - - [256, 256, 1, 512, 256, 256, 512, 512]
    - [81, 8.04]
  - - [256, 256, 1, 1024, 256, 256, 1024, 1024]
    - [82, 13.53]
  - - [256, 256, 1, 2048, 256, 256, 2048, 2048]
    - [80, 20.7]
  - - [256, 256, 1, 4096, 256, 256, 4096, 4096]
    - [80, 28.2]
  - - [256, 256, 1, 8192, 256, 256, 8192, 8192]
    - [80, 34.24]
  - - [256, 512, 1, 128, 256, 256, 128, 128]
    - [83, 4.78]
  - - [256, 512, 1, 256, 256, 256, 256, 256]
    - [83, 8.88]
  - - [256, 512, 1, 512, 256, 256, 512, 512]
    - [82, 16.13]
  - - [256, 512, 1, 1024, 256, 256, 1024, 1024]
    - [80, 26.94]
  - - [256, 512, 1, 2048, 256, 256, 2048, 2048]
    - [80, 40.95]
  - - [256, 512, 1, 4096, 256, 256, 4096, 4096]
    - [80, 55.3]
  - - [256, 512, 1, 8192, 256, 256, 8192, 8192]
    - [80, 67.44]
  - - [256, 1024, 1, 128, 256, 256, 128, 128]
    - [29, 8.83]
  - - [256, 1024, 1, 256, 256, 256, 256, 256]
    - [77, 16.56]
  - - [256, 1024, 1, 512, 256, 256, 512, 512]
    - [73, 28.82]
  - - [256, 1024, 1, 1024, 256, 256, 1024, 1024]
    - [73, 46.81]
  - - [256, 1024, 1, 2048, 256, 256, 2048, 2048]
    - [72, 67.82]
  - - [256, 1024, 1, 4096, 256, 256, 4096, 4096]
    - [72, 88.76]
  - - [256, 1024, 1, 8192, 256, 256, 8192, 8192]
    - [76, 101.97]
  - - [256, 2048, 1, 128, 256, 256, 128, 128]
    - [23, 16.31]
  - - [256, 2048, 1, 256, 256, 256, 256, 256]
    - [23, 29.96]
  - - [256, 2048, 1, 512, 256, 256, 512, 512]
    - [69, 49.42]
  - - [256, 2048, 1, 1024, 256, 256, 1024, 1024]
    - [68, 76.12]
  - - [256, 2048, 1, 2048, 256, 256, 2048, 2048]
    - [69, 105.65]
  - - [256, 2048, 1, 4096, 256, 256, 4096, 4096]
    - [69, 130.1]
  - - [256, 2048, 1, 8192, 256, 256, 8192, 8192]
    - [92, 142.08]
  - - [256, 4096, 1, 128, 256, 256, 128, 128]
    - [66, 27.45]
  - - [256, 4096, 1, 256, 256, 256, 256, 256]
    - [17, 49.83]
  - - [256, 4096, 1, 512, 256, 256, 512, 512]
    - [17, 83.62]
  - - [256, 4096, 1, 1024, 256, 256, 1024, 1024]
    - [17, 120.95]
  - - [256, 4096, 1, 2048, 256, 256, 2048, 2048]
    - [17, 161.09]
  - - [256, 4096, 1, 4096, 256, 256, 4096, 4096]
    - [89, 179.22]
  - - [256, 4096, 1, 8192, 256, 256, 8192, 8192]
    - [62, 191.4]
  - - [256, 8192, 1, 128, 256, 256, 128, 128]
    - [10, 43.3]
  - - [256, 8192, 1, 256, 256, 256, 256, 256]
    - [10, 77.29]
  - - [256, 8192, 1, 512, 256, 256, 512, 512]
    - [10, 126.19]
  - - [256, 8192, 1, 1024, 256, 256, 1024, 1024]
    - [10, 182.47]
  - - [256, 8192, 1, 2048, 256, 256, 2048, 2048]
    - [46, 231.53]
  - - [256, 8192, 1, 4096, 256, 256, 4096, 4096]
    - [67, 227.35]
  - - [256, 8192, 1, 8192, 256, 256, 8192, 8192]
    - [47, 248.36]
  - - [512, 128, 1, 128, 512, 512, 128, 128]
    - [84, 2.21]
  - - [512, 128, 1, 256, 512, 512, 256, 256]
    - [87, 4.2]
  - - [512, 128, 1, 512, 512, 512, 512, 512]
    - [83, 7.96]
  - - [512, 128, 1, 1024, 512, 512, 1024, 1024]
    - [80, 13.6]
  - - [512, 128, 1, 2048, 512, 512, 2048, 2048]
    - [80, 20.62]
  - - [512, 128, 1, 4096, 512, 512, 4096, 4096]
    - [80, 28.16]
  - - [512, 128, 1, 8192, 512, 512, 8192, 8192]
    - [80, 34.26]
  - - [512, 256, 1, 128, 512, 512, 128, 128]
    - [78, 4.31]
  - - [512, 256, 1, 256, 512, 512, 256, 256]
    - [96, 8.24]
  - - [512, 256, 1, 512, 512, 512, 512, 512]
    - [83, 15.63]
  - - [512, 256, 1, 1024, 512, 512, 1024, 1024]
    - [82, 26.6]
  - - [512, 256, 1, 2048, 512, 512, 2048, 2048]
    - [80, 40.78]
  - - [512, 256, 1, 4096, 512, 512, 4096, 4096]
    - [80, 54.48]
  - - [512, 256, 1, 8192, 512, 512, 8192, 8192]
    - [86, 66.79]
  - - [512, 512, 1, 128, 512, 512, 128, 128]
    - [29, 8.4]
  - - [512, 512, 1, 256, 512, 512, 256, 256]
    - [79, 16.12]
  - - [512, 512, 1, 512, 512, 512, 512, 512]
    - [79, 28.57]
  - - [512, 512, 1, 1024, 512, 512, 1024, 1024]
    - [78, 46.24]
  - - [512, 512, 1, 2048, 512, 512, 2048, 2048]
    - [76, 67.86]
  - - [512, 512, 1, 4096, 512, 512, 4096, 4096]
    - [72, 87.63]
  - - [512, 512, 1, 8192, 512, 512, 8192, 8192]
    - [95, 96.61]
  - - [512, 1024, 1, 128, 512, 512, 128, 128]
    - [22, 16.44]
  - - [512, 1024, 1, 256, 512, 512, 256, 256]
    - [23, 29.41]
  - - [512, 1024, 1, 512, 512, 512, 512, 512]
    - [21, 49.79]
  - - [512, 1024, 1, 1024, 512, 512, 1024, 1024]
    - [69, 76.34]
  - - [512, 1024, 1, 2048, 512, 512, 2048, 2048]
    - [69, 105.53]
  - - [512, 1024, 1, 4096, 512, 512, 4096, 4096]
    - [69, 130.65]
  - - [512, 1024, 1, 8192, 512, 512, 8192, 8192]
    - [92, 142.17]
  - - [512, 2048, 1, 128, 512, 512, 128, 128]
    - [65, 27.67]
  - - [512, 2048, 1, 256, 512, 512, 256, 256]
    - [17, 49.81]
  - - [512, 2048, 1, 512, 512, 512, 512, 512]
    - [17, 83.39]
  - - [512, 2048, 1, 1024, 512, 512, 1024, 1024]
    - [17, 124.11]
  - - [512, 2048, 1, 2048, 512, 512, 2048, 2048]
    - [17, 161.14]
  - - [512, 2048, 1, 4096, 512, 512, 4096, 4096]
    - [17, 193.56]
  - - [512, 2048, 1, 8192, 512, 512, 8192, 8192]
    - [89, 193.91]
  - - [512, 4096, 1, 128, 512, 512, 128, 128]
    - [46, 44.63]
  - - [512, 4096, 1, 256, 512, 512, 256, 256]
    - [10, 79.02]
  - - [512, 4096, 1, 512, 512, 512, 512, 512]
    - [10, 125.48]
  - - [512, 4096, 1, 1024, 512, 512, 1024, 1024]
    - [10, 183.24]
  - - [512, 4096, 1, 2048, 512, 512, 2048, 2048]
    - [46, 235.67]
  - - [512, 4096, 1, 4096, 512, 512, 4096, 4096]
    - [57, 233.94]
  - - [512, 4096, 1, 8192, 512, 512, 8192, 8192]
    - [56, 252.76]
  - - [512, 8192, 1, 128, 512, 512, 128, 128]
    - [49, 65.85]
  - - [512, 8192, 1, 256, 512, 512, 256, 256]
    - [52, 115.76]
  - - [512, 8192, 1, 512, 512, 512, 512, 512]
    - [50, 189.19]
  - - [512, 8192, 1, 1024, 512, 512, 1024, 1024]
    - [50, 268.48]
  - - [512, 8192, 1, 2048, 512, 512, 2048, 2048]
    - [39, 254.12]
  - - [512, 8192, 1, 4096, 512, 512, 4096, 4096]
    - [51, 275.94]
  - - [512, 8192, 1, 8192, 512, 512, 8192, 8192]
    - [50, 288.95]
  - - [1024, 128, 1, 128, 1024, 1024, 128, 128]
    - [85, 4.23]
  - - [1024, 128, 1, 256, 1024, 1024, 256, 256]
    - [82, 8.4]
  - - [1024, 128, 1, 512, 1024, 1024, 512, 512]
    - [95, 15.41]
  - - [1024, 128, 1, 1024, 1024, 1024, 1024, 1024]
    - [82, 26.89]
  - - [1024, 128, 1, 2048, 1024, 1024, 2048, 2048]
    - [80, 40.22]
  - - [1024, 128, 1, 4096, 1024, 1024, 4096, 4096]
    - [80, 54.46]
  - - [1024, 128, 1, 8192, 1024, 1024, 8192, 8192]
    - [86, 66.64]
  - - [1024, 256, 1, 128, 1024, 1024, 128, 128]
    - [78, 8.73]
  - - [1024, 256, 1, 256, 1024, 1024, 256, 256]
    - [30, 16.44]
  - - [1024, 256, 1, 512, 1024, 1024, 512, 512]
    - [76, 28.74]
  - - [1024, 256, 1, 1024, 1024, 1024, 1024, 1024]
    - [78, 46.62]
  - - [1024, 256, 1, 2048, 1024, 1024, 2048, 2048]
    - [75, 64.94]
  - - [1024, 256, 1, 4096, 1024, 1024, 4096, 4096]
    - [72, 87.93]
  - - [1024, 256, 1, 8192, 1024, 1024, 8192, 8192]
    - [74, 102.4]
  - - [1024, 512, 1, 128, 1024, 1024, 128, 128]
    - [26, 10.29]
  - - [1024, 512, 1, 256, 1024, 1024, 256, 256]
    - [14, 22.84]
  - - [1024, 512, 1, 512, 1024, 1024, 512, 512]
    - [28, 40.66]
  - - [1024, 512, 1, 1024, 1024, 1024, 1024, 1024]
    - [25, 72.21]
  - - [1024, 512, 1, 2048, 1024, 1024, 2048, 2048]
    - [69, 105.25]
  - - [1024, 512, 1, 4096, 1024, 1024, 4096, 4096]
    - [71, 127.93]
  - - [1024, 512, 1, 8192, 1024, 1024, 8192, 8192]
    - [92, 141.72]
  - - [1024, 1024, 1, 128, 1024, 1024, 128, 128]
    - [8, 20.34]
  - - [1024, 1024, 1, 256, 1024, 1024, 256, 256]
    - [15, 38.3]
  - - [1024, 1024, 1, 512, 1024, 1024, 512, 512]
    - [61, 75.9]
  - - [1024, 1024, 1, 1024, 1024, 1024, 1024, 1024]
    - [17, 123.69]
  - - [1024, 1024, 1, 2048, 1024, 1024, 2048, 2048]
    - [17, 160.65]
  - - [1024, 1024, 1, 4096, 1024, 1024, 4096, 4096]
    - [91, 176.05]
  - - [1024, 1024, 1, 8192, 1024, 1024, 8192, 8192]
    - [89, 193.49]
  - - [1024, 2048, 1, 128, 1024, 1024, 128, 128]
    - [9, 38.78]
  - - [1024, 2048, 1, 256, 1024, 1024, 256, 256]
    - [10, 76.18]
  - - [1024, 2048, 1, 512, 1024, 1024, 512, 512]
    - [10, 123.25]
  - - [1024, 2048, 1, 1024, 1024, 1024, 1024, 1024]
    - [10, 180.75]
  - - [1024, 2048, 1, 2048, 1024, 1024, 2048, 2048]
    - [46, 234.33]
  - - [1024, 2048, 1, 4096, 1024, 1024, 4096, 4096]
    - [46, 236.51]
  - - [1024, 2048, 1, 8192, 1024, 1024, 8192, 8192]
    - [60, 254.42]
  - - [1024, 4096, 1, 128, 1024, 1024, 128, 128]
    - [6, 60.01]
  - - [1024, 4096, 1, 256, 1024, 1024, 256, 256]
    - [6, 107.17]
  - - [1024, 4096, 1, 512, 1024, 1024, 512, 512]
    - [6, 169.17]
  - - [1024, 4096, 1, 1024, 1024, 1024, 1024, 1024]
    - [6, 235.99]
  - - [1024, 4096, 1, 2048, 1024, 1024, 2048, 2048]
    - [39, 263.88]
  - - [1024, 4096, 1, 4096, 1024, 1024, 4096, 4096]
    - [39, 274.4]
  - - [1024, 4096, 1, 8192, 1024, 1024, 8192, 8192]
    - [40, 261.31]
  - - [1024, 8192, 1, 128, 1024, 1024, 128, 128]
    - [34, 92.36]
  - - [1024, 8192, 1, 256, 1024, 1024, 256, 256]
    - [34, 159.27]
  - - [1024, 8192, 1, 512, 1024, 1024, 512, 512]
    - [34, 249.15]
  - - [1024, 8192, 1, 1024, 1024, 1024, 1024, 1024]
    - [33, 276.53]
  - - [1024, 8192, 1, 2048, 1024, 1024, 2048, 2048]
    - [36, 326.73]
  - - [1024, 8192, 1, 4096, 1024, 1024, 4096, 4096]
    - [33, 356.39]
  - - [1024, 8192, 1, 8192, 1024, 1024, 8192, 8192]
    - [33, 361.41]
  - - [2048, 128, 1, 128, 2048, 2048, 128, 128]
    - [79, 8.88]
  - - [2048, 128, 1, 256, 2048, 2048, 256, 256]
    - [78, 16.64]
  - - [2048, 128, 1, 512, 2048, 2048, 512, 512]
    - [77, 28.88]
  - - [2048, 128, 1, 1024, 2048, 2048, 1024, 1024]
    - [72, 46.61]
  - - [2048, 128, 1, 2048, 2048, 2048, 2048, 2048]
    - [72, 68.0]
  - - [2048, 128, 1, 4096, 2048, 2048, 4096, 4096]
    - [72, 88.17]
  - - [2048, 128, 1, 8192, 2048, 2048, 8192, 8192]
    - [74, 100.85]
  - - [2048, 256, 1, 128, 2048, 2048, 128, 128]
    - [24, 16.05]
  - - [2048, 256, 1, 256, 2048, 2048, 256, 256]
    - [23, 29.53]
  - - [2048, 256, 1, 512, 2048, 2048, 512, 512]
    - [69, 48.74]
  - - [2048, 256, 1, 1024, 2048, 2048, 1024, 1024]
    - [68, 75.18]
  - - [2048, 256, 1, 2048, 2048, 2048, 2048, 2048]
    - [69, 104.16]
  - - [2048, 256, 1, 4096, 2048, 2048, 4096, 4096]
    - [70, 128.86]
  - - [2048, 256, 1, 8192, 2048, 2048, 8192, 8192]
    - [94, 141.1]
  - - [2048, 512, 1, 128, 2048, 2048, 128, 128]
    - [53, 24.21]
  - - [2048, 512, 1, 256, 2048, 2048, 256, 256]
    - [18, 46.56]
  - - [2048, 512, 1, 512, 2048, 2048, 512, 512]
    - [14, 79.91]
  - - [2048, 512, 1, 1024, 2048, 2048, 1024, 1024]
    - [20, 119.95]
  - - [2048, 512, 1, 2048, 2048, 2048, 2048, 2048]
    - [20, 157.98]
  - - [2048, 512, 1, 4096, 2048, 2048, 4096, 4096]
    - [63, 179.62]
  - - [2048, 512, 1, 8192, 2048, 2048, 8192, 8192]
    - [63, 191.93]
  - - [2048, 1024, 1, 128, 2048, 2048, 128, 128]
    - [10, 43.17]
  - - [2048, 1024, 1, 256, 2048, 2048, 256, 256]
    - [13, 75.72]
  - - [2048, 1024, 1, 512, 2048, 2048, 512, 512]
    - [10, 125.06]
  - - [2048, 1024, 1, 1024, 2048, 2048, 1024, 1024]
    - [10, 181.08]
  - - [2048, 1024, 1, 2048, 2048, 2048, 2048, 2048]
    - [48, 224.58]
  - - [2048, 1024, 1, 4096, 2048, 2048, 4096, 4096]
    - [59, 231.64]
  - - [2048, 1024, 1, 8192, 2048, 2048, 8192, 8192]
    - [48, 251.45]
  - - [2048, 2048, 1, 128, 2048, 2048, 128, 128]
    - [6, 60.3]
  - - [2048, 2048, 1, 256, 2048, 2048, 256, 256]
    - [6, 105.33]
  - - [2048, 2048, 1, 512, 2048, 2048, 512, 512]
    - [6, 167.65]
  - - [2048, 2048, 1, 1024, 2048, 2048, 1024, 1024]
    - [6, 234.59]
  - - [2048, 2048, 1, 2048, 2048, 2048, 2048, 2048]
    - [41, 253.48]
  - - [2048, 2048, 1, 4096, 2048, 2048, 4096, 4096]
    - [41, 273.42]
  - - [2048, 2048, 1, 8192, 2048, 2048, 8192, 8192]
    - [41, 269.3]
  - - [2048, 4096, 1, 128, 2048, 2048, 128, 128]
    - [0, 74.96]
  - - [2048, 4096, 1, 256, 2048, 2048, 256, 256]
    - [1, 129.82]
  - - [2048, 4096, 1, 512, 2048, 2048, 512, 512]
    - [1, 194.77]
  - - [2048, 4096, 1, 1024, 2048, 2048, 1024, 1024]
    - [3, 250.08]
  - - [2048, 4096, 1, 2048, 2048, 2048, 2048, 2048]
    - [4, 275.59]
  - - [2048, 4096, 1, 4096, 2048, 2048, 4096, 4096]
    - [37, 285.26]
  - - [2048, 4096, 1, 8192, 2048, 2048, 8192, 8192]
    - [35, 321.93]
  - - [2048, 8192, 1, 128, 2048, 2048, 128, 128]
    - [34, 99.14]
  - - [2048, 8192, 1, 256, 2048, 2048, 256, 256]
    - [38, 164.5]
  - - [2048, 8192, 1, 512, 2048, 2048, 512, 512]
    - [34, 236.68]
  - - [2048, 8192, 1, 1024, 2048, 2048, 1024, 1024]
    - [34, 287.22]
  - - [2048, 8192, 1, 2048, 2048, 2048, 2048, 2048]
    - [38, 336.79]
  - - [2048, 8192, 1, 4096, 2048, 2048, 4096, 4096]
    - [35, 327.36]
  - - [2048, 8192, 1, 8192, 2048, 2048, 8192, 8192]
    - [35, 371.74]
  - - [4096, 128, 1, 128, 4096, 4096, 128, 128]
    - [27, 12.1]
  - - [4096, 128, 1, 256, 4096, 4096, 256, 256]
    - [22, 29.47]
  - - [4096, 128, 1, 512, 4096, 4096, 512, 512]
    - [69, 49.48]
  - - [4096, 128, 1, 1024, 4096, 4096, 1024, 1024]
    - [69, 75.47]
  - - [4096, 128, 1, 2048, 4096, 4096, 2048, 2048]
    - [69, 104.07]
  - - [4096, 128, 1, 4096, 4096, 4096, 4096, 4096]
    - [70, 128.54]
  - - [4096, 128, 1, 8192, 4096, 4096, 8192, 8192]
    - [94, 141.59]
  - - [4096, 256, 1, 128, 4096, 4096, 128, 128]
    - [66, 26.56]
  - - [4096, 256, 1, 256, 4096, 4096, 256, 256]
    - [17, 47.55]
  - - [4096, 256, 1, 512, 4096, 4096, 512, 512]
    - [17, 80.66]
  - - [4096, 256, 1, 1024, 4096, 4096, 1024, 1024]
    - [20, 122.55]
  - - [4096, 256, 1, 2048, 4096, 4096, 2048, 2048]
    - [19, 160.83]
  - - [4096, 256, 1, 4096, 4096, 4096, 4096, 4096]
    - [64, 178.67]
  - - [4096, 256, 1, 8192, 4096, 4096, 8192, 8192]
    - [90, 192.15]
  - - [4096, 512, 1, 128, 4096, 4096, 128, 128]
    - [46, 43.87]
  - - [4096, 512, 1, 256, 4096, 4096, 256, 256]
    - [10, 78.06]
  - - [4096, 512, 1, 512, 4096, 4096, 512, 512]
    - [10, 126.16]
  - - [4096, 512, 1, 1024, 4096, 4096, 1024, 1024]
    - [10, 182.98]
  - - [4096, 512, 1, 2048, 4096, 4096, 2048, 2048]
    - [58, 229.37]
  - - [4096, 512, 1, 4096, 4096, 4096, 4096, 4096]
    - [47, 235.55]
  - - [4096, 512, 1, 8192, 4096, 4096, 8192, 8192]
    - [58, 256.83]
  - - [4096, 1024, 1, 128, 4096, 4096, 128, 128]
    - [6, 60.27]
  - - [4096, 1024, 1, 256, 4096, 4096, 256, 256]
    - [6, 105.5]
  - - [4096, 1024, 1, 512, 4096, 4096, 512, 512]
    - [6, 169.72]
  - - [4096, 1024, 1, 1024, 4096, 4096, 1024, 1024]
    - [40, 216.29]
  - - [4096, 1024, 1, 2048, 4096, 4096, 2048, 2048]
    - [41, 267.39]
  - - [4096, 1024, 1, 4096, 4096, 4096, 4096, 4096]
    - [40, 268.11]
  - - [4096, 1024, 1, 8192, 4096, 4096, 8192, 8192]
    - [56, 268.0]
  - - [4096, 2048, 1, 128, 4096, 4096, 128, 128]
    - [2, 75.19]
  - - [4096, 2048, 1, 256, 4096, 4096, 256, 256]
    - [2, 127.76]
  - - [4096, 2048, 1, 512, 4096, 4096, 512, 512]
    - [1, 189.36]
  - - [4096, 2048, 1, 1024, 4096, 4096, 1024, 1024]
    - [3, 249.81]
  - - [4096, 2048, 1, 2048, 4096, 4096, 2048, 2048]
    - [2, 272.94]
  - - [4096, 2048, 1, 4096, 4096, 4096, 4096, 4096]
    - [45, 283.02]
  - - [4096, 2048, 1, 8192, 4096, 4096, 8192, 8192]
    - [42, 309.68]
  - - [4096, 4096, 1, 128, 4096, 4096, 128, 128]
    - [2, 81.94]
  - - [4096, 4096, 1, 256, 4096, 4096, 256, 256]
    - [2, 138.78]
  - - [4096, 4096, 1, 512, 4096, 4096, 512, 512]
    - [2, 198.29]
  - - [4096, 4096, 1, 1024, 4096, 4096, 1024, 1024]
    - [4, 244.48]
  - - [4096, 4096, 1, 2048, 4096, 4096, 2048, 2048]
    - [36, 272.81]
  - - [4096, 4096, 1, 4096, 4096, 4096, 4096, 4096]
    - [32, 289.89]
  - - [4096, 4096, 1, 8192, 4096, 4096, 8192, 8192]
    - [38, 329.65]
  - - [4096, 8192, 1, 128, 4096, 4096, 128, 128]
    - [34, 108.81]
  - - [4096, 8192, 1, 256, 4096, 4096, 256, 256]
    - [34, 175.67]
  - - [4096, 8192, 1, 512, 4096, 4096, 512, 512]
    - [38, 238.15]
  - - [4096, 8192, 1, 1024, 4096, 4096, 1024, 1024]
    - [35, 281.69]
  - - [4096, 8192, 1, 2048, 4096, 4096, 2048, 2048]
    - [37, 312.77]
  - - [4096, 8192, 1, 4096, 4096, 4096, 4096, 4096]
    - [35, 341.77]
  - - [4096, 8192, 1, 8192, 4096, 4096, 8192, 8192]
    - [37, 388.15]
  - - [8192, 128, 1, 128, 8192, 8192, 128, 128]
    - [67, 28.04]
  - - [8192, 128, 1, 256, 8192, 8192, 256, 256]
    - [17, 51.17]
  - - [8192, 128, 1, 512, 8192, 8192, 512, 512]
    - [17, 83.56]
  - - [8192, 128, 1, 1024, 8192, 8192, 1024, 1024]
    - [19, 122.15]
  - - [8192, 128, 1, 2048, 8192, 8192, 2048, 2048]
    - [19, 160.97]
  - - [8192, 128, 1, 4096, 8192, 8192, 4096, 4096]
    - [90, 169.92]
  - - [8192, 128, 1, 8192, 8192, 8192, 8192, 8192]
    - [91, 185.6]
  - - [8192, 256, 1, 128, 8192, 8192, 128, 128]
    - [13, 44.15]
  - - [8192, 256, 1, 256, 8192, 8192, 256, 256]
    - [10, 78.98]
  - - [8192, 256, 1, 512, 8192, 8192, 512, 512]
    - [10, 128.05]
  - - [8192, 256, 1, 1024, 8192, 8192, 1024, 1024]
    - [11, 180.49]
  - - [8192, 256, 1, 2048, 8192, 8192, 2048, 2048]
    - [48, 226.86]
  - - [8192, 256, 1, 4096, 8192, 8192, 4096, 4096]
    - [59, 228.81]
  - - [8192, 256, 1, 8192, 8192, 8192, 8192, 8192]
    - [47, 252.31]
  - - [8192, 512, 1, 128, 8192, 8192, 128, 128]
    - [6, 61.3]
  - - [8192, 512, 1, 256, 8192, 8192, 256, 256]
    - [7, 104.94]
  - - [8192, 512, 1, 512, 8192, 8192, 512, 512]
    - [54, 168.51]
  - - [8192, 512, 1, 1024, 8192, 8192, 1024, 1024]
    - [54, 246.89]
  - - [8192, 512, 1, 2048, 8192, 8192, 2048, 2048]
    - [41, 259.64]
  - - [8192, 512, 1, 4096, 8192, 8192, 4096, 4096]
    - [55, 309.21]
  - - [8192, 512, 1, 8192, 8192, 8192, 8192, 8192]
    - [54, 309.05]
  - - [8192, 1024, 1, 128, 8192, 8192, 128, 128]
    - [2, 74.11]
  - - [8192, 1024, 1, 256, 8192, 8192, 256, 256]
    - [1, 125.88]
  - - [8192, 1024, 1, 512, 8192, 8192, 512, 512]
    - [43, 187.59]
  - - [8192, 1024, 1, 1024, 8192, 8192, 1024, 1024]
    - [3, 240.49]
  - - [8192, 1024, 1, 2048, 8192, 8192, 2048, 2048]
    - [44, 301.11]
  - - [8192, 1024, 1, 4096, 8192, 8192, 4096, 4096]
    - [45, 362.17]
  - - [8192, 1024, 1, 8192, 8192, 8192, 8192, 8192]
    - [45, 386.57]
  - - [8192, 2048, 1, 128, 8192, 8192, 128, 128]
    - [34, 79.48]
  - - [8192, 2048, 1, 256, 8192, 8192, 256, 256]
    - [2, 133.7]
  - - [8192, 2048, 1, 512, 8192, 8192, 512, 512]
    - [50, 193.96]
  - - [8192, 2048, 1, 1024, 8192, 8192, 1024, 1024]
    - [44, 252.21]
  - - [8192, 2048, 1, 2048, 8192, 8192, 2048, 2048]
    - [43, 307.52]
  - - [8192, 2048, 1, 4096, 8192, 8192, 4096, 4096]
    - [43, 350.65]
  - - [8192, 2048, 1, 8192, 8192, 8192, 8192, 8192]
    - [43, 404.23]
  - - [8192, 4096, 1, 128, 8192, 8192, 128, 128]
    - [3, 86.09]
  - - [8192, 4096, 1, 256, 8192, 8192, 256, 256]
    - [10, 147.15]
  - - [8192, 4096, 1, 512, 8192, 8192, 512, 512]
    - [5, 207.19]
  - - [8192, 4096, 1, 1024, 8192, 8192, 1024, 1024]
    - [43, 252.4]
  - - [8192, 4096, 1, 2048, 8192, 8192, 2048, 2048]
    - [43, 312.27]
  - - [8192, 4096, 1, 4096, 8192, 8192, 4096, 4096]
    - [43, 363.0]
  - - [8192, 4096, 1, 8192, 8192, 8192, 8192, 8192]
    - [43, 428.67]
  - - [8192, 8192, 1, 128, 8192, 8192, 128, 128]
    - [36, 109.87]
  - - [8192, 8192, 1, 256, 8192, 8192, 256, 256]
    - [6, 161.63]
  - - [8192, 8192, 1, 512, 8192, 8192, 512, 512]
    - [37, 218.91]
  - - [8192, 8192, 1, 1024, 8192, 8192, 1024, 1024]
    - [3, 287.34]
  - - [8192, 8192, 1, 2048, 8192, 8192, 2048, 2048]
    - [36, 334.46]
  - - [8192, 8192, 1, 4096, 8192, 8192, 4096, 4096]
    - [43, 377.58]
  - - [8192, 8192, 1, 8192, 8192, 8192, 8192, 8192]
    - [43, 431.78]
  - - [1, 1, 1, 32, 1, 1, 32, 32]
    - [97, 0.0]
- null
- null
- ExperimentalStreamK
- GridBased
