projects/hipblaslt/library/src/amd_detail/rocblaslt/src/Tensile/Logic/asm_full/aquavanjaram/gfx942_228cu/StreamK/aquavanjaram942_Cijk_Alik_Bljk_F8NB8NS_BH_Bias_HAS_SAV_UserArgs.yaml
- {MinimumRequiredVersion: 4.33.0}
- aquavanjaram942
- {Architecture: gfx942, CUCount: 228}
- [Device 0049, Device 0050]
    SolutionIndex: 0
    SolutionNameMin: Cijk_Alik_Bljk_F8NB8NS_BH_Bias_HAS_SAV_UserArgs_MT256x256x64_MI16x16x1_SN_LDSB1_CLR1_GRVWA8_GRVWB16_GSU0_GSUC0_GSUWGMRR0_K1_LBSPPA512_LBSPPB512_LPA8_LPB16_LRVW8_MIWT8_8_PLR1_SU0_SUM0_SUS64_VWA8_VWB8_WGM1_WGMXCC1_WGMXCCGn1
    SolutionIndex: 1
    SolutionNameMin: Cijk_Alik_Bljk_F8NB8NS_BH_Bias_HAS_SAV_UserArgs_MT256x256x64_MI16x16x1_SN_LDSB1_CLR1_GRVWA16_GRVWB16_GSU0_GSUC0_GSUWGMRR0_K1_LBSPPA512_LBSPPB512_LPA32_LPB32_LRVW16_MIWT8_8_PLR1_SU0_SUM0_SUS64_VWA8_VWB8_WGM1_WGMXCC1_WGMXCCGn1
    SolutionIndex: 2
    SolutionNameMin: Cijk_Alik_Bljk_F8NB8NS_BH_Bias_HAS_SAV_UserArgs_MT256x256x64_MI16x16x1_SN_LDSB1_CLR1_GRVWA16_GRVWB16_GSU0_GSUC0_GSUWGMRR0_K1_LBSPPA512_LBSPPB512_LPA32_LPB32_LRVW16_MIWT8_8_PLR1_SU0_SUM0_SUS64_VWA8_VWB8_WGM4_WGMXCC1_WGMXCCGn1
    SolutionIndex: 3
    SolutionNameMin: Cijk_Alik_Bljk_F8NB8NS_BH_Bias_HAS_SAV_UserArgs_MT256x256x64_MI16x16x1_SN_LDSB1_CLR1_GRVWA8_GRVWB16_GSU0_GSUC0_GSUWGMRR0_K1_LBSPPA512_LBSPPB512_LPA8_LPB16_LRVW8_MIWT8_8_PLR1_SU0_SUM0_SUS64_VWA8_VWB8_WGM6_WGMXCC1_WGMXCCGn1
    SolutionIndex: 4
    SolutionNameMin: Cijk_Alik_Bljk_F8NB8NS_BH_Bias_HAS_SAV_UserArgs_MT256x256x64_MI16x16x1_SN_LDSB1_CLR1_GRVWA16_GRVWB16_GSU0_GSUC0_GSUWGMRR0_K1_LBSPPA512_LBSPPB512_LPA32_LPB32_LRVW16_MIWT8_8_PLR1_SU0_SUM0_SUS64_VWA8_VWB8_WGM6_WGMXCC1_WGMXCCGn1
    SolutionIndex: 5
    SolutionNameMin: Cijk_Alik_Bljk_F8NB8NS_BH_Bias_HAS_SAV_UserArgs_MT256x256x64_MI16x16x1_SN_LDSB1_CLR1_GRVWA4_GRVWB16_GSU0_GSUC0_GSUWGMRR0_K1_LBSPPA512_LBSPPB512_LPA8_LPB16_LRVW8_MIWT8_8_PLR1_SU0_SUM0_SUS64_VWA8_VWB8_WGM8_WGMXCC1_WGMXCCGn1
    SolutionIndex: 6
    SolutionNameMin: Cijk_Alik_Bljk_F8NB8NS_BH_Bias_HAS_SAV_UserArgs_MT256x256x64_MI16x16x1_SN_LDSB1_CLR1_GRVWA16_GRVWB16_GSU0_GSUC0_GSUWGMRR0_K1_LBSPPA512_LBSPPB512_LPA32_LPB32_LRVW16_MIWT8_8_PLR1_SU0_SUM0_SUS64_VWA8_VWB8_WGM8_WGMXCC1_WGMXCCGn1
    SolutionIndex: 7
    SolutionNameMin: Cijk_Alik_Bljk_F8NB8NS_BH_Bias_HAS_SAV_UserArgs_MT256x144x64_MI16x16x1_SN_LDSB0_CLR1_GRVWA16_GRVWB4_GSU0_GSUC0_GSUWGMRR0_K1_LBSPPA256_LBSPPB128_LPA16_LPB8_LRVW8_MIWT4_9_PLR1_SU0_SUM0_SUS64_VWA4_VWB1_WGM1_WGMXCC1_WGMXCCGn1
    SolutionIndex: 8
    SolutionNameMin: Cijk_Alik_Bljk_F8NB8NS_BH_Bias_HAS_SAV_UserArgs_MT256x144x64_MI16x16x1_SN_LDSB0_CLR1_GRVWA16_GRVWB4_GSU0_GSUC0_GSUWGMRR0_K1_LBSPPA256_LBSPPB128_LPA32_LPB32_LRVW16_MIWT4_9_PLR1_SU0_SUM0_SUS64_VWA4_VWB1_WGM1_WGMXCC1_WGMXCCGn1
    SolutionIndex: 9
    SolutionNameMin: Cijk_Alik_Bljk_F8NB8NS_BH_Bias_HAS_SAV_UserArgs_MT256x144x64_MI16x16x1_SN_LDSB0_CLR1_GRVWA4_GRVWB4_GSU0_GSUC0_GSUWGMRR0_K1_LBSPPA256_LBSPPB128_LPA8_LPB8_LRVW8_MIWT4_9_PLR1_SU0_SUM0_SUS64_VWA4_VWB1_WGM8_WGMXCC1_WGMXCCGn1
    SolutionIndex: 10
    SolutionNameMin: Cijk_Alik_Bljk_F8NB8NS_BH_Bias_HAS_SAV_UserArgs_MT256x128x64_MI16x16x1_SN_LDSB1_CLR1_GRVWA8_GRVWB16_GSU0_GSUC0_GSUWGMRR0_K1_LBSPPA512_LBSPPB256_LPA8_LPB16_LRVW8_MIWT8_4_PLR1_SU0_SUM0_SUS64_VWA8_VWB4_WGM1_WGMXCC1_WGMXCCGn1
    SolutionIndex: 11
    SolutionNameMin: Cijk_Alik_Bljk_F8NB8NS_BH_Bias_HAS_SAV_UserArgs_MT256x128x64_MI16x16x1_SN_LDSB1_CLR1_GRVWA16_GRVWB16_GSU0_GSUC0_GSUWGMRR0_K1_LBSPPA512_LBSPPB256_LPA32_LPB32_LRVW16_MIWT8_4_PLR1_SU0_SUM0_SUS64_VWA8_VWB4_WGM1_WGMXCC1_WGMXCCGn1
    SolutionIndex: 12
    SolutionNameMin: Cijk_Alik_Bljk_F8NB8NS_BH_Bias_HAS_SAV_UserArgs_MT256x128x64_MI16x16x1_SN_LDSB1_CLR1_GRVWA8_GRVWB16_GSU0_GSUC0_GSUWGMRR0_K1_LBSPPA512_LBSPPB256_LPA8_LPB16_LRVW8_MIWT8_4_PLR1_SU0_SUM0_SUS64_VWA8_VWB4_WGM4_WGMXCC1_WGMXCCGn1
    SolutionIndex: 13
    SolutionNameMin: Cijk_Alik_Bljk_F8NB8NS_BH_Bias_HAS_SAV_UserArgs_MT128x144x64_MI16x16x1_SN_LDSB1_CLR1_GRVWA16_GRVWB4_GSU0_GSUC0_GSUWGMRR0_K1_LBSPPA128_LBSPPB128_LPA16_LPB8_LRVW8_MIWT2_9_PLR1_SU0_SUM0_SUS64_VWA2_VWB1_WGM1_WGMXCC1_WGMXCCGn1
    SolutionIndex: 14
    SolutionNameMin: Cijk_Alik_Bljk_F8NB8NS_BH_Bias_HAS_SAV_UserArgs_MT128x64x64_MI16x16x1_SN_LDSB0_CLR1_GRVWA4_GRVWB16_GSU0_GSUC0_GSUWGMRR0_K1_LBSPPA512_LBSPPB128_LPA8_LPB16_LRVW8_MIWT8_1_PLR1_SU0_SUM0_SUS64_VWA8_VWB1_WGM1_WGMXCC1_WGMXCCGn1
    SolutionIndex: 15
    SolutionNameMin: Cijk_Alik_Bljk_F8NB8NS_BH_Bias_HAS_SAV_UserArgs_MT128x64x64_MI16x16x1_SN_LDSB0_CLR1_GRVWA4_GRVWB4_GSU0_GSUC0_GSUWGMRR0_K1_LBSPPA512_LBSPPB128_LPA8_LPB8_LRVW8_MIWT8_1_PLR1_SU0_SUM0_SUS64_VWA8_VWB1_WGM6_WGMXCC1_WGMXCCGn1
    SolutionIndex: 16
    SolutionNameMin: Cijk_Alik_Bljk_F8NB8NS_BH_Bias_HAS_SAV_UserArgs_MT128x128x64_MI16x16x1_SN_LDSB1_CLR1_GRVWA16_GRVWB16_GSU0_GSUC0_GSUWGMRR0_K1_LBSPPA256_LBSPPB256_LPA32_LPB32_LRVW16_MIWT4_4_PLR1_SU0_SUM0_SUS64_VWA4_VWB4_WGM1_WGMXCC1_WGMXCCGn1
    SolutionIndex: 17
    SolutionNameMin: Cijk_Alik_Bljk_F8NB8NS_BH_Bias_HAS_SAV_UserArgs_MT128x128x64_MI16x16x1_SN_LDSB1_CLR1_GRVWA16_GRVWB16_GSU0_GSUC0_GSUWGMRR0_K1_LBSPPA256_LBSPPB256_LPA32_LPB32_LRVW16_MIWT4_4_PLR1_SU0_SUM0_SUS64_VWA4_VWB4_WGM4_WGMXCC1_WGMXCCGn1
    SolutionIndex: 18
    SolutionNameMin: Cijk_Alik_Bljk_F8NB8NS_BH_Bias_HAS_SAV_UserArgs_MT64x128x64_MI16x16x1_SN_LDSB0_CLR1_GRVWA16_GRVWB16_GSU0_GSUC0_GSUWGMRR0_K1_LBSPPA128_LBSPPB256_LPA32_LPB32_LRVW16_MIWT2_4_PLR1_SU0_SUM0_SUS64_VWA2_VWB4_WGM1_WGMXCC1_WGMXCCGn1
    SolutionIndex: 19
    SolutionNameMin: Cijk_Alik_Bljk_F8NB8NS_BH_Bias_HAS_SAV_UserArgs_MT128x64x64_MI16x16x1_SN_LDSB0_CLR1_GRVWA16_GRVWB16_GSU0_GSUC0_GSUWGMRR0_K1_LBSPPA256_LBSPPB128_LPA32_LPB32_LRVW16_MIWT4_2_PLR1_SU0_SUM0_SUS64_VWA4_VWB2_WGM1_WGMXCC1_WGMXCCGn1
    SolutionIndex: 20
    SolutionNameMin: Cijk_Alik_Bljk_F8NB8NS_BH_Bias_HAS_SAV_UserArgs_MT128x64x64_MI16x16x1_SN_LDSB0_CLR1_GRVWA8_GRVWB16_GSU0_GSUC0_GSUWGMRR0_K1_LBSPPA256_LBSPPB128_LPA8_LPB16_LRVW8_MIWT4_2_PLR1_SU0_SUM0_SUS64_VWA4_VWB2_WGM6_WGMXCC1_WGMXCCGn1
    SolutionIndex: 21
    SolutionNameMin: Cijk_Alik_Bljk_F8NB8NS_BH_Bias_HAS_SAV_UserArgs_MT32x128x64_MI16x16x1_SN_LDSB0_CLR1_GRVWA8_GRVWB4_GSU0_GSUC0_GSUWGMRR0_K1_LBSPPA128_LBSPPB256_LPA32_LPB32_LRVW16_MIWT1_4_PLR1_SU0_SUM0_SUS64_VWA1_VWB4_WGM8_WGMXCC1_WGMXCCGn1
    SolutionIndex: 22
    SolutionNameMin: Cijk_Alik_Bljk_F8NB8NS_BH_Bias_HAS_SAV_UserArgs_MT128x32x64_MI16x16x1_SN_LDSB0_CLR1_GRVWA8_GRVWB8_GSU0_GSUC0_GSUWGMRR0_K1_LBSPPA256_LBSPPB128_LPA32_LPB32_LRVW16_MIWT4_1_PLR1_SU0_SUM0_SUS64_VWA4_VWB1_WGM8_WGMXCC1_WGMXCCGn1
    SolutionIndex: 23
    SolutionNameMin: Cijk_Alik_Bljk_F8NB8NS_BH_Bias_HAS_SAV_UserArgs_MT64x64x64_MI16x16x1_SN_LDSB0_CLR1_GRVWA16_GRVWB16_GSU0_GSUC0_GSUWGMRR0_K1_LBSPPA128_LBSPPB128_LPA32_LPB32_LRVW16_MIWT2_2_PLR1_SU0_SUM0_SUS64_VWA2_VWB2_WGM1_WGMXCC1_WGMXCCGn1
    SolutionIndex: 24
    SolutionNameMin: Cijk_Alik_Bljk_F8NB8NS_BH_Bias_HAS_SAV_UserArgs_MT32x64x64_MI16x16x1_SN_LDSB0_CLR1_GRVWA8_GRVWB16_GSU0_GSUC0_GSUWGMRR0_K1_LBSPPA128_LBSPPB128_LPA8_LPB16_LRVW8_MIWT1_2_PLR1_SU0_SUM0_SUS64_VWA1_VWB2_WGM6_WGMXCC1_WGMXCCGn1
    SolutionIndex: 25
    SolutionNameMin: Cijk_Alik_Bljk_F8NB8NS_BH_Bias_HAS_SAV_UserArgs_MT32x64x64_MI16x16x1_SN_LDSB0_CLR1_GRVWA4_GRVWB8_GSU0_GSUC0_GSUWGMRR0_K1_LBSPPA128_LBSPPB128_LPA8_LPB8_LRVW8_MIWT1_2_PLR1_SU0_SUM0_SUS64_VWA1_VWB2_WGM8_WGMXCC1_WGMXCCGn1
    SolutionIndex: 26
    SolutionNameMin: Cijk_Alik_Bljk_F8NB8NS_BH_Bias_HAS_SAV_UserArgs_MT64x32x64_MI16x16x1_SN_LDSB0_CLR1_GRVWA16_GRVWB8_GSU0_GSUC0_GSUWGMRR0_K1_LBSPPA128_LBSPPB128_LPA16_LPB8_LRVW8_MIWT2_1_PLR1_SU0_SUM0_SUS64_VWA2_VWB1_WGM1_WGMXCC1_WGMXCCGn1
    SolutionIndex: 27
    SolutionNameMin: Cijk_Alik_Bljk_F8NB8NS_BH_Bias_HAS_SAV_UserArgs_MT64x32x64_MI16x16x1_SN_LDSB0_CLR1_GRVWA8_GRVWB8_GSU0_GSUC0_GSUWGMRR0_K1_LBSPPA128_LBSPPB128_LPA8_LPB8_LRVW8_MIWT2_1_PLR1_SU0_SUM0_SUS64_VWA2_VWB1_WGM6_WGMXCC1_WGMXCCGn1
    SolutionIndex: 28
    SolutionNameMin: Cijk_Alik_Bljk_F8NB8NS_BH_Bias_HAS_SAV_UserArgs_MT32x32x64_MI16x16x1_SN_LDSB0_CLR1_GRVWA8_GRVWB4_GSU0_GSUC0_GSUWGMRR0_K1_LBSPPA128_LBSPPB128_LPA32_LPB32_LRVW16_MIWT1_1_PLR1_SU0_SUM0_SUS64_VWA1_VWB1_WGM4_WGMXCC1_WGMXCCGn1
    SolutionIndex: 29
    SolutionNameMin: Cijk_Alik_Bljk_F8NB8NS_BH_Bias_HAS_SAV_UserArgs_MT128x256x128_MI16x16x1_SN_LDSB1_CLR1_GRVWA4_GRVWB16_GSU0_GSUC0_GSUWGMRR0_K1_LBSPPA512_LBSPPB1024_LPA32_LPB32_LRVW16_MIWT4_8_PLR1_SU0_SUM0_SUS128_VWA4_VWB8_WGM1_WGMXCC1_WGMXCCGn1
    SolutionIndex: 30
    SolutionNameMin: Cijk_Alik_Bljk_F8NB8NS_BH_Bias_HAS_SAV_UserArgs_MT128x256x128_MI16x16x1_SN_LDSB1_CLR1_GRVWA8_GRVWB16_GSU0_GSUC0_GSUWGMRR0_K1_LBSPPA512_LBSPPB1024_LPA32_LPB32_LRVW16_MIWT4_8_PLR1_SU0_SUM0_SUS128_VWA4_VWB8_WGM1_WGMXCC1_WGMXCCGn1
    SolutionIndex: 31
    SolutionNameMin: Cijk_Alik_Bljk_F8NB8NS_BH_Bias_HAS_SAV_UserArgs_MT128x256x128_MI16x16x1_SN_LDSB1_CLR1_GRVWA16_GRVWB16_GSU0_GSUC0_GSUWGMRR0_K1_LBSPPA512_LBSPPB1024_LPA32_LPB32_LRVW16_MIWT4_8_PLR1_SU0_SUM0_SUS128_VWA4_VWB8_WGM1_WGMXCC1_WGMXCCGn1
    SolutionIndex: 32
    SolutionNameMin: Cijk_Alik_Bljk_F8NB8NS_BH_Bias_HAS_SAV_UserArgs_MT128x256x128_MI16x16x1_SN_LDSB1_CLR1_GRVWA4_GRVWB16_GSU0_GSUC0_GSUWGMRR0_K1_LBSPPA512_LBSPPB1024_LPA32_LPB32_LRVW16_MIWT4_8_PLR1_SU0_SUM0_SUS128_VWA4_VWB8_WGM4_WGMXCC1_WGMXCCGn1
    SolutionIndex: 33
    SolutionNameMin: Cijk_Alik_Bljk_F8NB8NS_BH_Bias_HAS_SAV_UserArgs_MT128x256x128_MI16x16x1_SN_LDSB1_CLR1_GRVWA16_GRVWB16_GSU0_GSUC0_GSUWGMRR0_K1_LBSPPA512_LBSPPB1024_LPA32_LPB32_LRVW16_MIWT4_8_PLR1_SU0_SUM0_SUS128_VWA4_VWB8_WGM4_WGMXCC1_WGMXCCGn1
    SolutionIndex: 34
    SolutionNameMin: Cijk_Alik_Bljk_F8NB8NS_BH_Bias_HAS_SAV_UserArgs_MT128x256x128_MI16x16x1_SN_LDSB1_CLR1_GRVWA8_GRVWB16_GSU0_GSUC0_GSUWGMRR0_K1_LBSPPA512_LBSPPB1024_LPA32_LPB32_LRVW16_MIWT4_8_PLR1_SU0_SUM0_SUS128_VWA4_VWB8_WGM6_WGMXCC1_WGMXCCGn1
    SolutionIndex: 35
    SolutionNameMin: Cijk_Alik_Bljk_F8NB8NS_BH_Bias_HAS_SAV_UserArgs_MT128x256x128_MI16x16x1_SN_LDSB1_CLR1_GRVWA16_GRVWB16_GSU0_GSUC0_GSUWGMRR0_K1_LBSPPA512_LBSPPB1024_LPA32_LPB32_LRVW16_MIWT4_8_PLR1_SU0_SUM0_SUS128_VWA4_VWB8_WGM6_WGMXCC1_WGMXCCGn1
    SolutionIndex: 36
    SolutionNameMin: Cijk_Alik_Bljk_F8NB8NS_BH_Bias_HAS_SAV_UserArgs_MT128x256x128_MI16x16x1_SN_LDSB1_CLR1_GRVWA4_GRVWB16_GSU0_GSUC0_GSUWGMRR0_K1_LBSPPA512_LBSPPB1024_LPA32_LPB32_LRVW16_MIWT4_8_PLR1_SU0_SUM0_SUS128_VWA4_VWB8_WGM8_WGMXCC1_WGMXCCGn1
    SolutionIndex: 37
    SolutionNameMin: Cijk_Alik_Bljk_F8NB8NS_BH_Bias_HAS_SAV_UserArgs_MT256x144x128_MI16x16x1_SN_LDSB1_CLR1_GRVWA4_GRVWB4_GSU0_GSUC0_GSUWGMRR0_K1_LBSPPA512_LBSPPB128_LPA8_LPB8_LRVW8_MIWT4_9_PLR1_SU0_SUM0_SUS128_VWA4_VWB1_WGM1_WGMXCC1_WGMXCCGn1
    SolutionIndex: 38
    SolutionNameMin: Cijk_Alik_Bljk_F8NB8NS_BH_Bias_HAS_SAV_UserArgs_MT256x144x128_MI16x16x1_SN_LDSB1_CLR1_GRVWA16_GRVWB4_GSU0_GSUC0_GSUWGMRR0_K1_LBSPPA512_LBSPPB128_LPA16_LPB8_LRVW8_MIWT4_9_PLR1_SU0_SUM0_SUS128_VWA4_VWB1_WGM1_WGMXCC1_WGMXCCGn1
    SolutionIndex: 39
    SolutionNameMin: Cijk_Alik_Bljk_F8NB8NS_BH_Bias_HAS_SAV_UserArgs_MT256x144x128_MI16x16x1_SN_LDSB1_CLR1_GRVWA8_GRVWB8_GSU0_GSUC0_GSUWGMRR0_K1_LBSPPA512_LBSPPB128_LPA8_LPB8_LRVW8_MIWT4_9_PLR1_SU0_SUM0_SUS128_VWA4_VWB1_WGM1_WGMXCC1_WGMXCCGn1
    SolutionIndex: 40
    SolutionNameMin: Cijk_Alik_Bljk_F8NB8NS_BH_Bias_HAS_SAV_UserArgs_MT256x144x128_MI16x16x1_SN_LDSB1_CLR1_GRVWA16_GRVWB4_GSU0_GSUC0_GSUWGMRR0_K1_LBSPPA512_LBSPPB128_LPA32_LPB32_LRVW16_MIWT4_9_PLR1_SU0_SUM0_SUS128_VWA4_VWB1_WGM1_WGMXCC1_WGMXCCGn1
    SolutionIndex: 41
    SolutionNameMin: Cijk_Alik_Bljk_F8NB8NS_BH_Bias_HAS_SAV_UserArgs_MT256x144x128_MI16x16x1_SN_LDSB1_CLR1_GRVWA16_GRVWB8_GSU0_GSUC0_GSUWGMRR0_K1_LBSPPA512_LBSPPB128_LPA32_LPB32_LRVW16_MIWT4_9_PLR1_SU0_SUM0_SUS128_VWA4_VWB1_WGM1_WGMXCC1_WGMXCCGn1
    SolutionIndex: 42
    SolutionNameMin: Cijk_Alik_Bljk_F8NB8NS_BH_Bias_HAS_SAV_UserArgs_MT256x144x128_MI16x16x1_SN_LDSB1_CLR1_GRVWA4_GRVWB4_GSU0_GSUC0_GSUWGMRR0_K1_LBSPPA512_LBSPPB128_LPA8_LPB8_LRVW8_MIWT4_9_PLR1_SU0_SUM0_SUS128_VWA4_VWB1_WGM4_WGMXCC1_WGMXCCGn1
    SolutionIndex: 43
    SolutionNameMin: Cijk_Alik_Bljk_F8NB8NS_BH_Bias_HAS_SAV_UserArgs_MT256x144x128_MI16x16x1_SN_LDSB1_CLR1_GRVWA4_GRVWB8_GSU0_GSUC0_GSUWGMRR0_K1_LBSPPA512_LBSPPB128_LPA32_LPB32_LRVW16_MIWT4_9_PLR1_SU0_SUM0_SUS128_VWA4_VWB1_WGM4_WGMXCC1_WGMXCCGn1
    SolutionIndex: 44
    SolutionNameMin: Cijk_Alik_Bljk_F8NB8NS_BH_Bias_HAS_SAV_UserArgs_MT256x144x128_MI16x16x1_SN_LDSB1_CLR1_GRVWA4_GRVWB4_GSU0_GSUC0_GSUWGMRR0_K1_LBSPPA512_LBSPPB128_LPA8_LPB8_LRVW8_MIWT4_9_PLR1_SU0_SUM0_SUS128_VWA4_VWB1_WGM6_WGMXCC1_WGMXCCGn1
    SolutionIndex: 45
    SolutionNameMin: Cijk_Alik_Bljk_F8NB8NS_BH_Bias_HAS_SAV_UserArgs_MT256x144x128_MI16x16x1_SN_LDSB1_CLR1_GRVWA4_GRVWB4_GSU0_GSUC0_GSUWGMRR0_K1_LBSPPA512_LBSPPB128_LPA32_LPB32_LRVW16_MIWT4_9_PLR1_SU0_SUM0_SUS128_VWA4_VWB1_WGM6_WGMXCC1_WGMXCCGn1
    SolutionIndex: 46
    SolutionNameMin: Cijk_Alik_Bljk_F8NB8NS_BH_Bias_HAS_SAV_UserArgs_MT256x144x128_MI16x16x1_SN_LDSB1_CLR1_GRVWA16_GRVWB4_GSU0_GSUC0_GSUWGMRR0_K1_LBSPPA512_LBSPPB128_LPA32_LPB32_LRVW16_MIWT4_9_PLR1_SU0_SUM0_SUS128_VWA4_VWB1_WGM6_WGMXCC1_WGMXCCGn1
    SolutionIndex: 47
    SolutionNameMin: Cijk_Alik_Bljk_F8NB8NS_BH_Bias_HAS_SAV_UserArgs_MT256x144x128_MI16x16x1_SN_LDSB1_CLR1_GRVWA4_GRVWB8_GSU0_GSUC0_GSUWGMRR0_K1_LBSPPA512_LBSPPB128_LPA32_LPB32_LRVW16_MIWT4_9_PLR1_SU0_SUM0_SUS128_VWA4_VWB1_WGM6_WGMXCC1_WGMXCCGn1
    SolutionIndex: 48
    SolutionNameMin: Cijk_Alik_Bljk_F8NB8NS_BH_Bias_HAS_SAV_UserArgs_MT256x144x128_MI16x16x1_SN_LDSB1_CLR1_GRVWA4_GRVWB4_GSU0_GSUC0_GSUWGMRR0_K1_LBSPPA512_LBSPPB128_LPA8_LPB8_LRVW8_MIWT4_9_PLR1_SU0_SUM0_SUS128_VWA4_VWB1_WGM8_WGMXCC1_WGMXCCGn1
    SolutionIndex: 49
    SolutionNameMin: Cijk_Alik_Bljk_F8NB8NS_BH_Bias_HAS_SAV_UserArgs_MT256x144x128_MI16x16x1_SN_LDSB1_CLR1_GRVWA16_GRVWB4_GSU0_GSUC0_GSUWGMRR0_K1_LBSPPA512_LBSPPB128_LPA32_LPB32_LRVW16_MIWT4_9_PLR1_SU0_SUM0_SUS128_VWA4_VWB1_WGM8_WGMXCC1_WGMXCCGn1
    SolutionIndex: 50
    SolutionNameMin: Cijk_Alik_Bljk_F8NB8NS_BH_Bias_HAS_SAV_UserArgs_MT256x144x128_MI16x16x1_SN_LDSB1_CLR1_GRVWA4_GRVWB8_GSU0_GSUC0_GSUWGMRR0_K1_LBSPPA512_LBSPPB128_LPA32_LPB32_LRVW16_MIWT4_9_PLR1_SU0_SUM0_SUS128_VWA4_VWB1_WGM8_WGMXCC1_WGMXCCGn1
    SolutionIndex: 51
    SolutionNameMin: Cijk_Alik_Bljk_F8NB8NS_BH_Bias_HAS_SAV_UserArgs_MT256x144x128_MI16x16x1_SN_LDSB1_CLR1_GRVWA16_GRVWB8_GSU0_GSUC0_GSUWGMRR0_K1_LBSPPA512_LBSPPB128_LPA32_LPB32_LRVW16_MIWT4_9_PLR1_SU0_SUM0_SUS128_VWA4_VWB1_WGM8_WGMXCC1_WGMXCCGn1
    SolutionIndex: 52
    SolutionNameMin: Cijk_Alik_Bljk_F8NB8NS_BH_Bias_HAS_SAV_UserArgs_MT256x128x128_MI16x16x1_SN_LDSB1_CLR1_GRVWA16_GRVWB16_GSU0_GSUC0_GSUWGMRR0_K1_LBSPPA1024_LBSPPB512_LPA32_LPB32_LRVW16_MIWT8_4_PLR1_SU0_SUM0_SUS128_VWA8_VWB4_WGM1_WGMXCC1_WGMXCCGn1
    SolutionIndex: 53
    SolutionNameMin: Cijk_Alik_Bljk_F8NB8NS_BH_Bias_HAS_SAV_UserArgs_MT256x128x128_MI16x16x1_SN_LDSB1_CLR1_GRVWA4_GRVWB16_GSU0_GSUC0_GSUWGMRR0_K1_LBSPPA1024_LBSPPB512_LPA32_LPB32_LRVW16_MIWT8_4_PLR1_SU0_SUM0_SUS128_VWA8_VWB4_WGM4_WGMXCC1_WGMXCCGn1
    SolutionIndex: 54
    SolutionNameMin: Cijk_Alik_Bljk_F8NB8NS_BH_Bias_HAS_SAV_UserArgs_MT256x128x128_MI16x16x1_SN_LDSB1_CLR1_GRVWA16_GRVWB16_GSU0_GSUC0_GSUWGMRR0_K1_LBSPPA1024_LBSPPB512_LPA32_LPB32_LRVW16_MIWT8_4_PLR1_SU0_SUM0_SUS128_VWA8_VWB4_WGM4_WGMXCC1_WGMXCCGn1
    SolutionIndex: 55
    SolutionNameMin: Cijk_Alik_Bljk_F8NB8NS_BH_Bias_HAS_SAV_UserArgs_MT256x128x128_MI16x16x1_SN_LDSB1_CLR1_GRVWA4_GRVWB16_GSU0_GSUC0_GSUWGMRR0_K1_LBSPPA1024_LBSPPB512_LPA32_LPB32_LRVW16_MIWT8_4_PLR1_SU0_SUM0_SUS128_VWA8_VWB4_WGM6_WGMXCC1_WGMXCCGn1
    SolutionIndex: 56
    SolutionNameMin: Cijk_Alik_Bljk_F8NB8NS_BH_Bias_HAS_SAV_UserArgs_MT256x128x128_MI16x16x1_SN_LDSB1_CLR1_GRVWA4_GRVWB16_GSU0_GSUC0_GSUWGMRR0_K1_LBSPPA1024_LBSPPB512_LPA32_LPB32_LRVW16_MIWT8_4_PLR1_SU0_SUM0_SUS128_VWA8_VWB4_WGM8_WGMXCC1_WGMXCCGn1
    SolutionIndex: 57
    SolutionNameMin: Cijk_Alik_Bljk_F8NB8NS_BH_Bias_HAS_SAV_UserArgs_MT256x128x128_MI16x16x1_SN_LDSB1_CLR1_GRVWA16_GRVWB16_GSU0_GSUC0_GSUWGMRR0_K1_LBSPPA1024_LBSPPB512_LPA32_LPB32_LRVW16_MIWT8_4_PLR1_SU0_SUM0_SUS128_VWA8_VWB4_WGM8_WGMXCC1_WGMXCCGn1
    SolutionIndex: 58
    SolutionNameMin: Cijk_Alik_Bljk_F8NB8NS_BH_Bias_HAS_SAV_UserArgs_MT144x256x128_MI16x16x1_SN_LDSB1_CLR1_GRVWA4_GRVWB16_GSU0_GSUC0_GSUWGMRR0_K1_LBSPPA128_LBSPPB512_LPA32_LPB32_LRVW16_MIWT9_4_PLR1_SU0_SUM0_SUS128_VWA1_VWB4_WGM4_WGMXCC1_WGMXCCGn1
    SolutionIndex: 59
    SolutionNameMin: Cijk_Alik_Bljk_F8NB8NS_BH_Bias_HAS_SAV_UserArgs_MT144x256x128_MI16x16x1_SN_LDSB1_CLR1_GRVWA8_GRVWB16_GSU0_GSUC0_GSUWGMRR0_K1_LBSPPA128_LBSPPB512_LPA32_LPB32_LRVW16_MIWT9_4_PLR1_SU0_SUM0_SUS128_VWA1_VWB4_WGM4_WGMXCC1_WGMXCCGn1
    SolutionIndex: 60
    SolutionNameMin: Cijk_Alik_Bljk_F8NB8NS_BH_Bias_HAS_SAV_UserArgs_MT144x256x128_MI16x16x1_SN_LDSB1_CLR1_GRVWA4_GRVWB16_GSU0_GSUC0_GSUWGMRR0_K1_LBSPPA128_LBSPPB512_LPA8_LPB16_LRVW8_MIWT9_4_PLR1_SU0_SUM0_SUS128_VWA1_VWB4_WGM6_WGMXCC1_WGMXCCGn1
    SolutionIndex: 61
    SolutionNameMin: Cijk_Alik_Bljk_F8NB8NS_BH_Bias_HAS_SAV_UserArgs_MT144x256x128_MI16x16x1_SN_LDSB1_CLR1_GRVWA4_GRVWB16_GSU0_GSUC0_GSUWGMRR0_K1_LBSPPA128_LBSPPB512_LPA32_LPB32_LRVW16_MIWT9_4_PLR1_SU0_SUM0_SUS128_VWA1_VWB4_WGM6_WGMXCC1_WGMXCCGn1
    SolutionIndex: 62
    SolutionNameMin: Cijk_Alik_Bljk_F8NB8NS_BH_Bias_HAS_SAV_UserArgs_MT144x256x128_MI16x16x1_SN_LDSB1_CLR1_GRVWA8_GRVWB4_GSU0_GSUC0_GSUWGMRR0_K1_LBSPPA128_LBSPPB512_LPA8_LPB8_LRVW8_MIWT9_4_PLR1_SU0_SUM0_SUS128_VWA1_VWB4_WGM8_WGMXCC1_WGMXCCGn1
    SolutionIndex: 63
    SolutionNameMin: Cijk_Alik_Bljk_F8NB8NS_BH_Bias_HAS_SAV_UserArgs_MT144x256x128_MI16x16x1_SN_LDSB1_CLR1_GRVWA4_GRVWB16_GSU0_GSUC0_GSUWGMRR0_K1_LBSPPA128_LBSPPB512_LPA8_LPB16_LRVW8_MIWT9_4_PLR1_SU0_SUM0_SUS128_VWA1_VWB4_WGM8_WGMXCC1_WGMXCCGn1
    SolutionIndex: 64
    SolutionNameMin: Cijk_Alik_Bljk_F8NB8NS_BH_Bias_HAS_SAV_UserArgs_MT144x256x128_MI16x16x1_SN_LDSB1_CLR1_GRVWA8_GRVWB16_GSU0_GSUC0_GSUWGMRR0_K1_LBSPPA128_LBSPPB512_LPA8_LPB16_LRVW8_MIWT9_4_PLR1_SU0_SUM0_SUS128_VWA1_VWB4_WGM8_WGMXCC1_WGMXCCGn1
    SolutionIndex: 65
    SolutionNameMin: Cijk_Alik_Bljk_F8NB8NS_BH_Bias_HAS_SAV_UserArgs_MT144x256x128_MI16x16x1_SN_LDSB1_CLR1_GRVWA8_GRVWB16_GSU0_GSUC0_GSUWGMRR0_K1_LBSPPA128_LBSPPB512_LPA32_LPB32_LRVW16_MIWT9_4_PLR1_SU0_SUM0_SUS128_VWA1_VWB4_WGM8_WGMXCC1_WGMXCCGn1
    SolutionIndex: 66
    SolutionNameMin: Cijk_Alik_Bljk_F8NB8NS_BH_Bias_HAS_SAV_UserArgs_MT128x128x128_MI16x16x1_SN_LDSB1_CLR1_GRVWA16_GRVWB16_GSU0_GSUC0_GSUWGMRR0_K1_LBSPPA1024_LBSPPB256_LPA32_LPB32_LRVW16_MIWT8_2_PLR1_SU0_SUM0_SUS128_VWA8_VWB2_WGM1_WGMXCC1_WGMXCCGn1
    SolutionIndex: 67
    SolutionNameMin: Cijk_Alik_Bljk_F8NB8NS_BH_Bias_HAS_SAV_UserArgs_MT128x128x128_MI16x16x1_SN_LDSB1_CLR1_GRVWA16_GRVWB16_GSU0_GSUC0_GSUWGMRR0_K1_LBSPPA1024_LBSPPB256_LPA32_LPB32_LRVW16_MIWT8_2_PLR1_SU0_SUM0_SUS128_VWA8_VWB2_WGM8_WGMXCC1_WGMXCCGn1
    SolutionIndex: 68
    SolutionNameMin: Cijk_Alik_Bljk_F8NB8NS_BH_Bias_HAS_SAV_UserArgs_MT128x144x128_MI16x16x1_SN_LDSB1_CLR1_GRVWA4_GRVWB8_GSU0_GSUC0_GSUWGMRR0_K1_LBSPPA256_LBSPPB128_LPA8_LPB8_LRVW8_MIWT2_9_PLR1_SU0_SUM0_SUS128_VWA2_VWB1_WGM1_WGMXCC1_WGMXCCGn1
    SolutionIndex: 69
    SolutionNameMin: Cijk_Alik_Bljk_F8NB8NS_BH_Bias_HAS_SAV_UserArgs_MT128x144x128_MI16x16x1_SN_LDSB1_CLR1_GRVWA16_GRVWB4_GSU0_GSUC0_GSUWGMRR0_K1_LBSPPA256_LBSPPB128_LPA32_LPB32_LRVW16_MIWT2_9_PLR1_SU0_SUM0_SUS128_VWA2_VWB1_WGM1_WGMXCC1_WGMXCCGn1
    SolutionIndex: 70
    SolutionNameMin: Cijk_Alik_Bljk_F8NB8NS_BH_Bias_HAS_SAV_UserArgs_MT128x144x128_MI16x16x1_SN_LDSB1_CLR1_GRVWA16_GRVWB8_GSU0_GSUC0_GSUWGMRR0_K1_LBSPPA256_LBSPPB128_LPA32_LPB32_LRVW16_MIWT2_9_PLR1_SU0_SUM0_SUS128_VWA2_VWB1_WGM1_WGMXCC1_WGMXCCGn1
    SolutionIndex: 71
    SolutionNameMin: Cijk_Alik_Bljk_F8NB8NS_BH_Bias_HAS_SAV_UserArgs_MT128x144x128_MI16x16x1_SN_LDSB1_CLR1_GRVWA8_GRVWB8_GSU0_GSUC0_GSUWGMRR0_K1_LBSPPA256_LBSPPB128_LPA32_LPB32_LRVW16_MIWT2_9_PLR1_SU0_SUM0_SUS128_VWA2_VWB1_WGM8_WGMXCC1_WGMXCCGn1
    SolutionIndex: 72
    SolutionNameMin: Cijk_Alik_Bljk_F8NB8NS_BH_Bias_HAS_SAV_UserArgs_MT144x128x128_MI16x16x1_SN_LDSB1_CLR1_GRVWA4_GRVWB16_GSU0_GSUC0_GSUWGMRR0_K1_LBSPPA128_LBSPPB256_LPA32_LPB32_LRVW16_MIWT9_2_PLR1_SU0_SUM0_SUS128_VWA1_VWB2_WGM4_WGMXCC1_WGMXCCGn1
    SolutionIndex: 73
    SolutionNameMin: Cijk_Alik_Bljk_F8NB8NS_BH_Bias_HAS_SAV_UserArgs_MT144x128x128_MI16x16x1_SN_LDSB1_CLR1_GRVWA4_GRVWB16_GSU0_GSUC0_GSUWGMRR0_K1_LBSPPA128_LBSPPB256_LPA32_LPB32_LRVW16_MIWT9_2_PLR1_SU0_SUM0_SUS128_VWA1_VWB2_WGM6_WGMXCC1_WGMXCCGn1
    SolutionIndex: 74
    SolutionNameMin: Cijk_Alik_Bljk_F8NB8NS_BH_Bias_HAS_SAV_UserArgs_MT128x128x128_MI16x16x1_SN_LDSB1_CLR1_GRVWA4_GRVWB16_GSU0_GSUC0_GSUWGMRR0_K1_LBSPPA512_LBSPPB512_LPA32_LPB32_LRVW16_MIWT4_4_PLR1_SU0_SUM0_SUS128_VWA4_VWB4_WGM1_WGMXCC1_WGMXCCGn1
    SolutionIndex: 75
    SolutionNameMin: Cijk_Alik_Bljk_F8NB8NS_BH_Bias_HAS_SAV_UserArgs_MT128x128x128_MI16x16x1_SN_LDSB1_CLR1_GRVWA16_GRVWB16_GSU0_GSUC0_GSUWGMRR0_K1_LBSPPA512_LBSPPB512_LPA32_LPB32_LRVW16_MIWT4_4_PLR1_SU0_SUM0_SUS128_VWA4_VWB4_WGM1_WGMXCC1_WGMXCCGn1
    SolutionIndex: 76
    SolutionNameMin: Cijk_Alik_Bljk_F8NB8NS_BH_Bias_HAS_SAV_UserArgs_MT128x128x128_MI16x16x1_SN_LDSB1_CLR1_GRVWA4_GRVWB16_GSU0_GSUC0_GSUWGMRR0_K1_LBSPPA512_LBSPPB512_LPA32_LPB32_LRVW16_MIWT4_4_PLR1_SU0_SUM0_SUS128_VWA4_VWB4_WGM4_WGMXCC1_WGMXCCGn1
    SolutionIndex: 77
    SolutionNameMin: Cijk_Alik_Bljk_F8NB8NS_BH_Bias_HAS_SAV_UserArgs_MT128x128x128_MI16x16x1_SN_LDSB1_CLR1_GRVWA16_GRVWB16_GSU0_GSUC0_GSUWGMRR0_K1_LBSPPA512_LBSPPB512_LPA32_LPB32_LRVW16_MIWT4_4_PLR1_SU0_SUM0_SUS128_VWA4_VWB4_WGM4_WGMXCC1_WGMXCCGn1
    SolutionIndex: 78
    SolutionNameMin: Cijk_Alik_Bljk_F8NB8NS_BH_Bias_HAS_SAV_UserArgs_MT128x128x128_MI16x16x1_SN_LDSB1_CLR1_GRVWA16_GRVWB16_GSU0_GSUC0_GSUWGMRR0_K1_LBSPPA512_LBSPPB512_LPA32_LPB32_LRVW16_MIWT4_4_PLR1_SU0_SUM0_SUS128_VWA4_VWB4_WGM6_WGMXCC1_WGMXCCGn1
    SolutionIndex: 79
    SolutionNameMin: Cijk_Alik_Bljk_F8NB8NS_BH_Bias_HAS_SAV_UserArgs_MT128x128x128_MI16x16x1_SN_LDSB1_CLR1_GRVWA4_GRVWB16_GSU0_GSUC0_GSUWGMRR0_K1_LBSPPA512_LBSPPB512_LPA32_LPB32_LRVW16_MIWT4_4_PLR1_SU0_SUM0_SUS128_VWA4_VWB4_WGM8_WGMXCC1_WGMXCCGn1
    SolutionIndex: 80
    SolutionNameMin: Cijk_Alik_Bljk_F8NB8NS_BH_Bias_HAS_SAV_UserArgs_MT128x128x128_MI16x16x1_SN_LDSB1_CLR1_GRVWA16_GRVWB16_GSU0_GSUC0_GSUWGMRR0_K1_LBSPPA512_LBSPPB512_LPA32_LPB32_LRVW16_MIWT4_4_PLR1_SU0_SUM0_SUS128_VWA4_VWB4_WGM8_WGMXCC1_WGMXCCGn1
    SolutionIndex: 81
    SolutionNameMin: Cijk_Alik_Bljk_F8NB8NS_BH_Bias_HAS_SAV_UserArgs_MT64x128x128_MI16x16x1_SN_LDSB1_CLR1_GRVWA16_GRVWB8_GSU0_GSUC0_GSUWGMRR0_K1_LBSPPA256_LBSPPB512_LPA32_LPB32_LRVW16_MIWT2_4_PLR1_SU0_SUM0_SUS128_VWA2_VWB4_WGM8_WGMXCC1_WGMXCCGn1
    SolutionIndex: 82
    SolutionNameMin: Cijk_Alik_Bljk_F8NB8NS_BH_Bias_HAS_SAV_UserArgs_MT128x64x128_MI16x16x1_SN_LDSB1_CLR1_GRVWA16_GRVWB16_GSU0_GSUC0_GSUWGMRR0_K1_LBSPPA512_LBSPPB256_LPA32_LPB32_LRVW16_MIWT4_2_PLR1_SU0_SUM0_SUS128_VWA4_VWB2_WGM1_WGMXCC1_WGMXCCGn1
    SolutionIndex: 83
    SolutionNameMin: Cijk_Alik_Bljk_F8NB8NS_BH_Bias_HAS_SAV_UserArgs_MT128x64x128_MI16x16x1_SN_LDSB1_CLR1_GRVWA16_GRVWB16_GSU0_GSUC0_GSUWGMRR0_K1_LBSPPA512_LBSPPB256_LPA32_LPB32_LRVW16_MIWT4_2_PLR1_SU0_SUM0_SUS128_VWA4_VWB2_WGM4_WGMXCC1_WGMXCCGn1
    SolutionIndex: 84
    SolutionNameMin: Cijk_Alik_Bljk_F8NB8NS_BH_Bias_HAS_SAV_UserArgs_MT128x64x128_MI16x16x1_SN_LDSB1_CLR1_GRVWA8_GRVWB16_GSU0_GSUC0_GSUWGMRR0_K1_LBSPPA512_LBSPPB256_LPA8_LPB16_LRVW8_MIWT4_2_PLR1_SU0_SUM0_SUS128_VWA4_VWB2_WGM8_WGMXCC1_WGMXCCGn1
    SolutionIndex: 85
    SolutionNameMin: Cijk_Alik_Bljk_F8NB8NS_BH_Bias_HAS_SAV_UserArgs_MT128x64x128_MI16x16x1_SN_LDSB1_CLR1_GRVWA16_GRVWB16_GSU0_GSUC0_GSUWGMRR0_K1_LBSPPA512_LBSPPB256_LPA32_LPB32_LRVW16_MIWT4_2_PLR1_SU0_SUM0_SUS128_VWA4_VWB2_WGM8_WGMXCC1_WGMXCCGn1
    SolutionIndex: 86
    SolutionNameMin: Cijk_Alik_Bljk_F8NB8NS_BH_Bias_HAS_SAV_UserArgs_MT128x32x128_MI16x16x1_SN_LDSB1_CLR1_GRVWA16_GRVWB16_GSU0_GSUC0_GSUWGMRR0_K1_LBSPPA512_LBSPPB128_LPA32_LPB32_LRVW16_MIWT4_1_PLR1_SU0_SUM0_SUS128_VWA4_VWB1_WGM1_WGMXCC1_WGMXCCGn1
    SolutionIndex: 87
    SolutionNameMin: Cijk_Alik_Bljk_F8NB8NS_BH_Bias_HAS_SAV_UserArgs_MT128x32x128_MI16x16x1_SN_LDSB1_CLR1_GRVWA8_GRVWB4_GSU0_GSUC0_GSUWGMRR0_K1_LBSPPA512_LBSPPB128_LPA32_LPB32_LRVW16_MIWT4_1_PLR1_SU0_SUM0_SUS128_VWA4_VWB1_WGM8_WGMXCC1_WGMXCCGn1
    SolutionIndex: 88
    SolutionNameMin: Cijk_Alik_Bljk_F8NB8NS_BH_Bias_HAS_SAV_UserArgs_MT64x64x128_MI16x16x1_SN_LDSB1_CLR1_GRVWA16_GRVWB4_GSU0_GSUC0_GSUWGMRR0_K1_LBSPPA256_LBSPPB256_LPA32_LPB32_LRVW16_MIWT2_2_PLR1_SU0_SUM0_SUS128_VWA2_VWB2_WGM1_WGMXCC1_WGMXCCGn1
    SolutionIndex: 89
    SolutionNameMin: Cijk_Alik_Bljk_F8NB8NS_BH_Bias_HAS_SAV_UserArgs_MT64x64x128_MI16x16x1_SN_LDSB1_CLR1_GRVWA16_GRVWB16_GSU0_GSUC0_GSUWGMRR0_K1_LBSPPA256_LBSPPB256_LPA32_LPB32_LRVW16_MIWT2_2_PLR1_SU0_SUM0_SUS128_VWA2_VWB2_WGM1_WGMXCC1_WGMXCCGn1
    SolutionIndex: 90
    SolutionNameMin: Cijk_Alik_Bljk_F8NB8NS_BH_Bias_HAS_SAV_UserArgs_MT32x64x128_MI16x16x1_SN_LDSB0_CLR1_GRVWA16_GRVWB4_GSU0_GSUC0_GSUWGMRR0_K1_LBSPPA128_LBSPPB256_LPA32_LPB32_LRVW16_MIWT1_2_PLR1_SU0_SUM0_SUS128_VWA1_VWB2_WGM1_WGMXCC1_WGMXCCGn1
    SolutionIndex: 91
    SolutionNameMin: Cijk_Alik_Bljk_F8NB8NS_BH_Bias_HAS_SAV_UserArgs_MT32x64x128_MI16x16x1_SN_LDSB0_CLR1_GRVWA16_GRVWB16_GSU0_GSUC0_GSUWGMRR0_K1_LBSPPA128_LBSPPB256_LPA32_LPB32_LRVW16_MIWT1_2_PLR1_SU0_SUM0_SUS128_VWA1_VWB2_WGM1_WGMXCC1_WGMXCCGn1
    SolutionIndex: 92
    SolutionNameMin: Cijk_Alik_Bljk_F8NB8NS_BH_Bias_HAS_SAV_UserArgs_MT32x64x128_MI16x16x1_SN_LDSB0_CLR1_GRVWA8_GRVWB4_GSU0_GSUC0_GSUWGMRR0_K1_LBSPPA128_LBSPPB256_LPA8_LPB8_LRVW8_MIWT1_2_PLR1_SU0_SUM0_SUS128_VWA1_VWB2_WGM4_WGMXCC1_WGMXCCGn1
    SolutionIndex: 93
    SolutionNameMin: Cijk_Alik_Bljk_F8NB8NS_BH_Bias_HAS_SAV_UserArgs_MT32x64x128_MI16x16x1_SN_LDSB0_CLR1_GRVWA8_GRVWB16_GSU0_GSUC0_GSUWGMRR0_K1_LBSPPA128_LBSPPB256_LPA32_LPB32_LRVW16_MIWT1_2_PLR1_SU0_SUM0_SUS128_VWA1_VWB2_WGM6_WGMXCC1_WGMXCCGn1
    SolutionIndex: 94
    SolutionNameMin: Cijk_Alik_Bljk_F8NB8NS_BH_Bias_HAS_SAV_UserArgs_MT64x32x128_MI16x16x1_SN_LDSB0_CLR1_GRVWA16_GRVWB4_GSU0_GSUC0_GSUWGMRR0_K1_LBSPPA256_LBSPPB128_LPA32_LPB32_LRVW16_MIWT2_1_PLR1_SU0_SUM0_SUS128_VWA2_VWB1_WGM1_WGMXCC1_WGMXCCGn1
    SolutionIndex: 95
    SolutionNameMin: Cijk_Alik_Bljk_F8NB8NS_BH_Bias_HAS_SAV_UserArgs_MT64x32x128_MI16x16x1_SN_LDSB0_CLR1_GRVWA16_GRVWB8_GSU0_GSUC0_GSUWGMRR0_K1_LBSPPA256_LBSPPB128_LPA32_LPB32_LRVW16_MIWT2_1_PLR1_SU0_SUM0_SUS128_VWA2_VWB1_WGM1_WGMXCC1_WGMXCCGn1
    SolutionIndex: 96
    SolutionNameMin: Cijk_Alik_Bljk_F8NB8NS_BH_Bias_HAS_SAV_UserArgs_MT64x32x128_MI16x16x1_SN_LDSB0_CLR1_GRVWA16_GRVWB16_GSU0_GSUC0_GSUWGMRR0_K1_LBSPPA256_LBSPPB128_LPA32_LPB32_LRVW16_MIWT2_1_PLR1_SU0_SUM0_SUS128_VWA2_VWB1_WGM1_WGMXCC1_WGMXCCGn1
    SolutionIndex: 97
    SolutionNameMin: Cijk_Alik_Bljk_F8NB8NS_BH_Bias_HAS_SAV_UserArgs_MT64x32x128_MI16x16x1_SN_LDSB0_CLR1_GRVWA16_GRVWB4_GSU0_GSUC0_GSUWGMRR0_K1_LBSPPA256_LBSPPB128_LPA32_LPB32_LRVW16_MIWT2_1_PLR1_SU0_SUM0_SUS128_VWA2_VWB1_WGM6_WGMXCC1_WGMXCCGn1
    SolutionIndex: 98
    SolutionNameMin: Cijk_Alik_Bljk_F8NB8NS_BH_Bias_HAS_SAV_UserArgs_MT64x32x128_MI16x16x1_SN_LDSB0_CLR1_GRVWA8_GRVWB8_GSU0_GSUC0_GSUWGMRR0_K1_LBSPPA256_LBSPPB128_LPA32_LPB32_LRVW16_MIWT2_1_PLR1_SU0_SUM0_SUS128_VWA2_VWB1_WGM6_WGMXCC1_WGMXCCGn1
    SolutionIndex: 99
    SolutionNameMin: Cijk_Alik_Bljk_F8NB8NS_BH_Bias_HAS_SAV_UserArgs_MT32x32x128_MI16x16x1_SN_LDSB0_CLR1_GRVWA4_GRVWB4_GSU0_GSUC0_GSUWGMRR0_K1_LBSPPA128_LBSPPB128_LPA32_LPB32_LRVW16_MIWT1_1_PLR1_SU0_SUM0_SUS128_VWA1_VWB1_WGM1_WGMXCC1_WGMXCCGn1
    SolutionIndex: 100
    SolutionNameMin: Cijk_Alik_Bljk_F8NB8NS_BH_Bias_HAS_SAV_UserArgs_MT32x32x128_MI16x16x1_SN_LDSB0_CLR1_GRVWA16_GRVWB4_GSU0_GSUC0_GSUWGMRR0_K1_LBSPPA128_LBSPPB128_LPA32_LPB32_LRVW16_MIWT1_1_PLR1_SU0_SUM0_SUS128_VWA1_VWB1_WGM1_WGMXCC1_WGMXCCGn1
    SolutionIndex: 101
    SolutionNameMin: Cijk_Alik_Bljk_F8NB8NS_BH_Bias_HAS_SAV_UserArgs_MT32x32x128_MI16x16x1_SN_LDSB0_CLR1_GRVWA16_GRVWB8_GSU0_GSUC0_GSUWGMRR0_K1_LBSPPA128_LBSPPB128_LPA32_LPB32_LRVW16_MIWT1_1_PLR1_SU0_SUM0_SUS128_VWA1_VWB1_WGM1_WGMXCC1_WGMXCCGn1
    SolutionIndex: 102
    SolutionNameMin: Cijk_Alik_Bljk_F8NB8NS_BH_Bias_HAS_SAV_UserArgs_MT32x32x128_MI16x16x1_SN_LDSB0_CLR1_GRVWA4_GRVWB16_GSU0_GSUC0_GSUWGMRR0_K1_LBSPPA128_LBSPPB128_LPA32_LPB32_LRVW16_MIWT1_1_PLR1_SU0_SUM0_SUS128_VWA1_VWB1_WGM1_WGMXCC1_WGMXCCGn1
    SolutionIndex: 103
    SolutionNameMin: Cijk_Alik_Bljk_F8NB8NS_BH_Bias_HAS_SAV_UserArgs_MT32x32x128_MI16x16x1_SN_LDSB0_CLR1_GRVWA8_GRVWB16_GSU0_GSUC0_GSUWGMRR0_K1_LBSPPA128_LBSPPB128_LPA32_LPB32_LRVW16_MIWT1_1_PLR1_SU0_SUM0_SUS128_VWA1_VWB1_WGM1_WGMXCC1_WGMXCCGn1
    SolutionIndex: 104
    SolutionNameMin: Cijk_Alik_Bljk_F8NB8NS_BH_Bias_HAS_SAV_UserArgs_MT32x32x128_MI16x16x1_SN_LDSB0_CLR1_GRVWA16_GRVWB16_GSU0_GSUC0_GSUWGMRR0_K1_LBSPPA128_LBSPPB128_LPA32_LPB32_LRVW16_MIWT1_1_PLR1_SU0_SUM0_SUS128_VWA1_VWB1_WGM1_WGMXCC1_WGMXCCGn1
    SolutionIndex: 105
    SolutionNameMin: Cijk_Alik_Bljk_F8NB8NS_BH_Bias_HAS_SAV_UserArgs_MT32x32x128_MI16x16x1_SN_LDSB0_CLR1_GRVWA4_GRVWB16_GSU0_GSUC0_GSUWGMRR0_K1_LBSPPA128_LBSPPB128_LPA8_LPB16_LRVW8_MIWT1_1_PLR1_SU0_SUM0_SUS128_VWA1_VWB1_WGM4_WGMXCC1_WGMXCCGn1
    SolutionIndex: 106
    SolutionNameMin: Cijk_Alik_Bljk_F8NB8NS_BH_Bias_HAS_SAV_UserArgs_MT32x32x128_MI16x16x1_SN_LDSB0_CLR1_GRVWA8_GRVWB8_GSU0_GSUC0_GSUWGMRR0_K1_LBSPPA128_LBSPPB128_LPA32_LPB32_LRVW16_MIWT1_1_PLR1_SU0_SUM0_SUS128_VWA1_VWB1_WGM4_WGMXCC1_WGMXCCGn1
    SolutionIndex: 107
    SolutionNameMin: Cijk_Alik_Bljk_F8NB8NS_BH_Bias_HAS_SAV_UserArgs_MT32x32x128_MI16x16x1_SN_LDSB0_CLR1_GRVWA4_GRVWB16_GSU0_GSUC0_GSUWGMRR0_K1_LBSPPA128_LBSPPB128_LPA32_LPB32_LRVW16_MIWT1_1_PLR1_SU0_SUM0_SUS128_VWA1_VWB1_WGM4_WGMXCC1_WGMXCCGn1
    SolutionIndex: 108
    SolutionNameMin: Cijk_Alik_Bljk_F8NB8NS_BH_Bias_HAS_SAV_UserArgs_MT32x32x128_MI16x16x1_SN_LDSB0_CLR1_GRVWA8_GRVWB16_GSU0_GSUC0_GSUWGMRR0_K1_LBSPPA128_LBSPPB128_LPA32_LPB32_LRVW16_MIWT1_1_PLR1_SU0_SUM0_SUS128_VWA1_VWB1_WGM4_WGMXCC1_WGMXCCGn1
    SolutionIndex: 109
    SolutionNameMin: Cijk_Alik_Bljk_F8NB8NS_BH_Bias_HAS_SAV_UserArgs_MT32x32x128_MI16x16x1_SN_LDSB0_CLR1_GRVWA8_GRVWB16_GSU0_GSUC0_GSUWGMRR0_K1_LBSPPA128_LBSPPB128_LPA32_LPB32_LRVW16_MIWT1_1_PLR1_SU0_SUM0_SUS128_VWA1_VWB1_WGM6_WGMXCC1_WGMXCCGn1
    SolutionIndex: 110
    SolutionNameMin: Cijk_Alik_Bljk_F8NB8NS_BH_Bias_HAS_SAV_UserArgs_MT32x32x128_MI16x16x1_SN_LDSB0_CLR1_GRVWA16_GRVWB16_GSU0_GSUC0_GSUWGMRR0_K1_LBSPPA128_LBSPPB128_LPA32_LPB32_LRVW16_MIWT1_1_PLR1_SU0_SUM0_SUS128_VWA1_VWB1_WGM6_WGMXCC1_WGMXCCGn1
    SolutionIndex: 111
    SolutionNameMin: Cijk_Alik_Bljk_F8NB8NS_BH_Bias_HAS_SAV_UserArgs_MT32x32x128_MI16x16x1_SN_LDSB0_CLR1_GRVWA4_GRVWB8_GSU0_GSUC0_GSUWGMRR0_K1_LBSPPA128_LBSPPB128_LPA32_LPB32_LRVW16_MIWT1_1_PLR1_SU0_SUM0_SUS128_VWA1_VWB1_WGM8_WGMXCC1_WGMXCCGn1
    SolutionIndex: 112
    SolutionNameMin: Cijk_Alik_Bljk_F8NB8NS_BH_Bias_HAS_SAV_UserArgs_MT32x32x128_MI16x16x1_SN_LDSB0_CLR1_GRVWA16_GRVWB16_GSU0_GSUC0_GSUWGMRR0_K1_LBSPPA128_LBSPPB128_LPA32_LPB32_LRVW16_MIWT1_1_PLR1_SU0_SUM0_SUS128_VWA1_VWB1_WGM8_WGMXCC1_WGMXCCGn1
    SolutionIndex: 113
    SolutionNameMin: Cijk_Alik_Bljk_F8NB8NS_BH_Bias_HAS_SAV_UserArgs_MT64x128x256_MI16x16x1_SN_LDSB1_CLR1_GRVWA16_GRVWB16_GSU0_GSUC0_GSUWGMRR0_K1_LBSPPA512_LBSPPB1024_LPA32_LPB32_LRVW16_MIWT2_4_PLR1_SU0_SUM0_SUS256_VWA2_VWB4_WGM1_WGMXCC1_WGMXCCGn1
    SolutionIndex: 114
    SolutionNameMin: Cijk_Alik_Bljk_F8NB8NS_BH_Bias_HAS_SAV_UserArgs_MT64x128x256_MI16x16x1_SN_LDSB1_CLR1_GRVWA4_GRVWB16_GSU0_GSUC0_GSUWGMRR0_K1_LBSPPA512_LBSPPB1024_LPA32_LPB32_LRVW16_MIWT2_4_PLR1_SU0_SUM0_SUS256_VWA2_VWB4_WGM4_WGMXCC1_WGMXCCGn1
    SolutionIndex: 115
    SolutionNameMin: Cijk_Alik_Bljk_F8NB8NS_BH_Bias_HAS_SAV_UserArgs_MT64x128x256_MI16x16x1_SN_LDSB1_CLR1_GRVWA16_GRVWB16_GSU0_GSUC0_GSUWGMRR0_K1_LBSPPA512_LBSPPB1024_LPA32_LPB32_LRVW16_MIWT2_4_PLR1_SU0_SUM0_SUS256_VWA2_VWB4_WGM4_WGMXCC1_WGMXCCGn1
    SolutionIndex: 116
    SolutionNameMin: Cijk_Alik_Bljk_F8NB8NS_BH_Bias_HAS_SAV_UserArgs_MT64x128x256_MI16x16x1_SN_LDSB1_CLR1_GRVWA4_GRVWB16_GSU0_GSUC0_GSUWGMRR0_K1_LBSPPA512_LBSPPB1024_LPA32_LPB32_LRVW16_MIWT2_4_PLR1_SU0_SUM0_SUS256_VWA2_VWB4_WGM6_WGMXCC1_WGMXCCGn1
    SolutionIndex: 117
    SolutionNameMin: Cijk_Alik_Bljk_F8NB8NS_BH_Bias_HAS_SAV_UserArgs_MT64x128x256_MI16x16x1_SN_LDSB1_CLR1_GRVWA16_GRVWB16_GSU0_GSUC0_GSUWGMRR0_K1_LBSPPA512_LBSPPB1024_LPA32_LPB32_LRVW16_MIWT2_4_PLR1_SU0_SUM0_SUS256_VWA2_VWB4_WGM6_WGMXCC1_WGMXCCGn1
    SolutionIndex: 118
    SolutionNameMin: Cijk_Alik_Bljk_F8NB8NS_BH_Bias_HAS_SAV_UserArgs_MT64x128x256_MI16x16x1_SN_LDSB1_CLR1_GRVWA16_GRVWB16_GSU0_GSUC0_GSUWGMRR0_K1_LBSPPA512_LBSPPB1024_LPA32_LPB32_LRVW16_MIWT2_4_PLR1_SU0_SUM0_SUS256_VWA2_VWB4_WGM8_WGMXCC1_WGMXCCGn1
    SolutionIndex: 119
    SolutionNameMin: Cijk_Alik_Bljk_F8NB8NS_BH_Bias_HAS_SAV_UserArgs_MT128x64x256_MI16x16x1_SN_LDSB1_CLR1_GRVWA16_GRVWB16_GSU0_GSUC0_GSUWGMRR0_K1_LBSPPA1024_LBSPPB512_LPA32_LPB32_LRVW16_MIWT4_2_PLR1_SU0_SUM0_SUS256_VWA4_VWB2_WGM1_WGMXCC1_WGMXCCGn1
    SolutionIndex: 120
    SolutionNameMin: Cijk_Alik_Bljk_F8NB8NS_BH_Bias_HAS_SAV_UserArgs_MT128x64x256_MI16x16x1_SN_LDSB1_CLR1_GRVWA16_GRVWB16_GSU0_GSUC0_GSUWGMRR0_K1_LBSPPA1024_LBSPPB512_LPA32_LPB32_LRVW16_MIWT4_2_PLR1_SU0_SUM0_SUS256_VWA4_VWB2_WGM4_WGMXCC1_WGMXCCGn1
    SolutionIndex: 121
    SolutionNameMin: Cijk_Alik_Bljk_F8NB8NS_BH_Bias_HAS_SAV_UserArgs_MT64x64x256_MI16x16x1_SN_LDSB1_CLR1_GRVWA16_GRVWB16_GSU0_GSUC0_GSUWGMRR0_K1_LBSPPA512_LBSPPB512_LPA32_LPB32_LRVW16_MIWT2_2_PLR1_SU0_SUM0_SUS256_VWA2_VWB2_WGM1_WGMXCC1_WGMXCCGn1
    SolutionIndex: 122
    SolutionNameMin: Cijk_Alik_Bljk_F8NB8NS_BH_Bias_HAS_SAV_UserArgs_MT64x64x256_MI16x16x1_SN_LDSB1_CLR1_GRVWA16_GRVWB16_GSU0_GSUC0_GSUWGMRR0_K1_LBSPPA512_LBSPPB512_LPA32_LPB32_LRVW16_MIWT2_2_PLR1_SU0_SUM0_SUS256_VWA2_VWB2_WGM4_WGMXCC1_WGMXCCGn1
    SolutionIndex: 123
    SolutionNameMin: Cijk_Alik_Bljk_F8NB8NS_BH_Bias_HAS_SAV_UserArgs_MT64x64x256_MI16x16x1_SN_LDSB1_CLR1_GRVWA16_GRVWB16_GSU0_GSUC0_GSUWGMRR0_K1_LBSPPA512_LBSPPB512_LPA32_LPB32_LRVW16_MIWT2_2_PLR1_SU0_SUM0_SUS256_VWA2_VWB2_WGM6_WGMXCC1_WGMXCCGn1
    SolutionIndex: 124
    SolutionNameMin: Cijk_Alik_Bljk_F8NB8NS_BH_Bias_HAS_SAV_UserArgs_MT32x64x256_MI16x16x1_SN_LDSB1_CLR1_GRVWA16_GRVWB16_GSU0_GSUC0_GSUWGMRR0_K1_LBSPPA256_LBSPPB512_LPA32_LPB32_LRVW16_MIWT1_2_PLR1_SU0_SUM0_SUS256_VWA1_VWB2_WGM1_WGMXCC1_WGMXCCGn1
    SolutionIndex: 125
    SolutionNameMin: Cijk_Alik_Bljk_F8NB8NS_BH_Bias_HAS_SAV_UserArgs_MT32x64x256_MI16x16x1_SN_LDSB1_CLR1_GRVWA16_GRVWB16_GSU0_GSUC0_GSUWGMRR0_K1_LBSPPA256_LBSPPB512_LPA32_LPB32_LRVW16_MIWT1_2_PLR1_SU0_SUM0_SUS256_VWA1_VWB2_WGM4_WGMXCC1_WGMXCCGn1
    SolutionIndex: 126
    SolutionNameMin: Cijk_Alik_Bljk_F8NB8NS_BH_Bias_HAS_SAV_UserArgs_MT32x64x256_MI16x16x1_SN_LDSB1_CLR1_GRVWA16_GRVWB16_GSU0_GSUC0_GSUWGMRR0_K1_LBSPPA256_LBSPPB512_LPA32_LPB32_LRVW16_MIWT1_2_PLR1_SU0_SUM0_SUS256_VWA1_VWB2_WGM6_WGMXCC1_WGMXCCGn1
    SolutionIndex: 127
    SolutionNameMin: Cijk_Alik_Bljk_F8NB8NS_BH_Bias_HAS_SAV_UserArgs_MT32x32x256_MI16x16x1_SN_LDSB1_CLR1_GRVWA16_GRVWB16_GSU0_GSUC0_GSUWGMRR0_K1_LBSPPA256_LBSPPB256_LPA16_LPB16_LRVW8_MIWT1_1_PLR1_SU0_SUM0_SUS256_VWA1_VWB1_WGM1_WGMXCC1_WGMXCCGn1
    SolutionIndex: 128
    SolutionNameMin: Cijk_Alik_Bljk_F8NB8NS_BH_Bias_HAS_SAV_UserArgs_MT32x32x256_MI16x16x1_SN_LDSB1_CLR1_GRVWA16_GRVWB16_GSU0_GSUC0_GSUWGMRR0_K1_LBSPPA256_LBSPPB256_LPA32_LPB32_LRVW16_MIWT1_1_PLR1_SU0_SUM0_SUS256_VWA1_VWB1_WGM1_WGMXCC1_WGMXCCGn1
    SolutionIndex: 129
    SolutionNameMin: Cijk_Alik_Bljk_F8NB8NS_BH_Bias_HAS_SAV_UserArgs_MT32x32x256_MI16x16x1_SN_LDSB1_CLR1_GRVWA16_GRVWB16_GSU0_GSUC0_GSUWGMRR0_K1_LBSPPA256_LBSPPB256_LPA32_LPB32_LRVW16_MIWT1_1_PLR1_SU0_SUM0_SUS256_VWA1_VWB1_WGM4_WGMXCC1_WGMXCCGn1
    SolutionIndex: 130
    SolutionNameMin: Cijk_Alik_Bljk_F8NB8NS_BH_Bias_HAS_SAV_UserArgs_MT32x32x256_MI16x16x1_SN_LDSB1_CLR1_GRVWA8_GRVWB16_GSU0_GSUC0_GSUWGMRR0_K1_LBSPPA256_LBSPPB256_LPA8_LPB16_LRVW8_MIWT1_1_PLR1_SU0_SUM0_SUS256_VWA1_VWB1_WGM6_WGMXCC1_WGMXCCGn1
    SolutionIndex: 131
    SolutionNameMin: Cijk_Alik_Bljk_F8NB8NS_BH_Bias_HAS_SAV_UserArgs_MT32x32x256_MI16x16x1_SN_LDSB1_CLR1_GRVWA16_GRVWB4_GSU0_GSUC0_GSUWGMRR0_K1_LBSPPA256_LBSPPB256_LPA32_LPB32_LRVW16_MIWT1_1_PLR1_SU0_SUM0_SUS256_VWA1_VWB1_WGM6_WGMXCC1_WGMXCCGn1
    SolutionIndex: 132
    SolutionNameMin: Cijk_Alik_Bljk_F8NB8NS_BH_Bias_HAS_SAV_UserArgs_MT32x32x256_MI16x16x1_SN_LDSB1_CLR1_GRVWA4_GRVWB8_GSU0_GSUC0_GSUWGMRR0_K1_LBSPPA256_LBSPPB256_LPA32_LPB32_LRVW16_MIWT1_1_PLR1_SU0_SUM0_SUS256_VWA1_VWB1_WGM6_WGMXCC1_WGMXCCGn1
    SolutionIndex: 133
    SolutionNameMin: Cijk_Alik_Bljk_F8NB8NS_BH_Bias_HAS_SAV_UserArgs_MT32x32x256_MI16x16x1_SN_LDSB1_CLR1_GRVWA16_GRVWB16_GSU0_GSUC0_GSUWGMRR0_K1_LBSPPA256_LBSPPB256_LPA32_LPB32_LRVW16_MIWT1_1_PLR1_SU0_SUM0_SUS256_VWA1_VWB1_WGM8_WGMXCC1_WGMXCCGn1
    SolutionIndex: 134
    SolutionNameMin: Cijk_Alik_Bljk_F8NB8NS_BH_Bias_HAS_SAV_UserArgs_MT32x64x32_MI16x16x1_SN_LDSB0_CLR0_GRVWA4_GRVWB8_GSU0_GSUC0_GSUWGMRR0_K1_LBSPPA128_LBSPPB128_LPA8_LPB8_LRVW8_MIWT1_2_PLR0_SU32_SUM0_SUS256_VWA1_VWB1_WGM4_WGMXCC1_WGMXCCGn1
- - - [128, 128, 1, 128, 128, 128, 128, 128]
    - [127, 0.47]
  - - [128, 128, 1, 256, 128, 128, 256, 256]
    - [132, 1.03]
  - - [128, 128, 1, 512, 128, 128, 512, 512]
    - [131, 1.94]
  - - [128, 128, 1, 1024, 128, 128, 1024, 1024]
    - [26, 2.59]
  - - [128, 128, 1, 2048, 128, 128, 2048, 2048]
    - [106, 4.81]
  - - [128, 128, 1, 4096, 128, 128, 4096, 4096]
    - [104, 8.29]
  - - [128, 128, 1, 8192, 128, 128, 8192, 8192]
    - [128, 10.49]
  - - [128, 256, 1, 128, 128, 128, 128, 128]
    - [15, 0.78]
  - - [128, 256, 1, 256, 128, 128, 256, 256]
    - [27, 1.39]
  - - [128, 256, 1, 512, 128, 128, 512, 512]
    - [28, 2.5]
  - - [128, 256, 1, 1024, 128, 128, 1024, 1024]
    - [98, 4.58]
  - - [128, 256, 1, 2048, 128, 128, 2048, 2048]
    - [112, 8.95]
  - - [128, 256, 1, 4096, 128, 128, 4096, 4096]
    - [104, 15.7]
  - - [128, 256, 1, 8192, 128, 128, 8192, 8192]
    - [128, 20.8]
  - - [128, 512, 1, 128, 128, 128, 128, 128]
    - [84, 1.26]
  - - [128, 512, 1, 256, 128, 128, 256, 256]
    - [21, 2.49]
  - - [128, 512, 1, 512, 128, 128, 512, 512]
    - [97, 4.84]
  - - [128, 512, 1, 1024, 128, 128, 1024, 1024]
    - [111, 9.5]
  - - [128, 512, 1, 2048, 128, 128, 2048, 2048]
    - [109, 18.41]
  - - [128, 512, 1, 4096, 128, 128, 4096, 4096]
    - [104, 32.19]
  - - [128, 512, 1, 8192, 128, 128, 8192, 8192]
    - [128, 41.92]
  - - [128, 1024, 1, 128, 128, 128, 128, 128]
    - [105, 3.77]
  - - [128, 1024, 1, 256, 128, 128, 256, 256]
    - [104, 9.5]
  - - [128, 1024, 1, 512, 128, 128, 512, 512]
    - [128, 17.13]
  - - [128, 1024, 1, 1024, 128, 128, 1024, 1024]
    - [104, 30.06]
  - - [128, 1024, 1, 2048, 128, 128, 2048, 2048]
    - [104, 46.6]
  - - [128, 1024, 1, 4096, 128, 128, 4096, 4096]
    - [128, 65.51]
  - - [128, 1024, 1, 8192, 128, 128, 8192, 8192]
    - [128, 82.14]
  - - [128, 2048, 1, 128, 128, 128, 128, 128]
    - [97, 7.57]
  - - [128, 2048, 1, 256, 128, 128, 256, 256]
    - [24, 15.58]
  - - [128, 2048, 1, 512, 128, 128, 512, 512]
    - [93, 28.87]
  - - [128, 2048, 1, 1024, 128, 128, 1024, 1024]
    - [96, 50.36]
  - - [128, 2048, 1, 2048, 128, 128, 2048, 2048]
    - [91, 76.33]
  - - [128, 2048, 1, 4096, 128, 128, 4096, 4096]
    - [91, 101.35]
  - - [128, 2048, 1, 8192, 128, 128, 8192, 8192]
    - [124, 119.25]
  - - [128, 4096, 1, 128, 128, 128, 128, 128]
    - [14, 11.72]
  - - [128, 4096, 1, 256, 128, 128, 256, 256]
    - [81, 21.72]
  - - [128, 4096, 1, 512, 128, 128, 512, 512]
    - [22, 42.25]
  - - [128, 4096, 1, 1024, 128, 128, 1024, 1024]
    - [88, 80.97]
  - - [128, 4096, 1, 2048, 128, 128, 2048, 2048]
    - [123, 120.21]
  - - [128, 4096, 1, 4096, 128, 128, 4096, 4096]
    - [121, 161.3]
  - - [128, 4096, 1, 8192, 128, 128, 8192, 8192]
    - [121, 169.83]
  - - [128, 8192, 1, 128, 128, 128, 128, 128]
    - [19, 29.19]
  - - [128, 8192, 1, 256, 128, 128, 256, 256]
    - [82, 50.96]
  - - [128, 8192, 1, 512, 128, 128, 512, 512]
    - [82, 88.55]
  - - [128, 8192, 1, 1024, 128, 128, 1024, 1024]
    - [82, 136.6]
  - - [128, 8192, 1, 2048, 128, 128, 2048, 2048]
    - [119, 186.91]
  - - [128, 8192, 1, 4096, 128, 128, 4096, 4096]
    - [113, 191.1]
  - - [128, 8192, 1, 8192, 128, 128, 8192, 8192]
    - [113, 212.15]
  - - [256, 128, 1, 128, 256, 256, 128, 128]
    - [92, 1.05]
  - - [256, 128, 1, 256, 256, 256, 256, 256]
    - [130, 2.1]
  - - [256, 128, 1, 512, 256, 256, 512, 512]
    - [102, 4.36]
  - - [256, 128, 1, 1024, 256, 256, 1024, 1024]
    - [104, 7.7]
  - - [256, 128, 1, 2048, 256, 256, 2048, 2048]
    - [104, 11.91]
  - - [256, 128, 1, 4096, 256, 256, 4096, 4096]
    - [128, 16.76]
  - - [256, 128, 1, 8192, 256, 256, 8192, 8192]
    - [128, 21.18]
  - - [256, 256, 1, 128, 256, 256, 128, 128]
    - [101, 2.51]
  - - [256, 256, 1, 256, 256, 256, 256, 256]
    - [104, 4.74]
  - - [256, 256, 1, 512, 256, 256, 512, 512]
    - [104, 8.92]
  - - [256, 256, 1, 1024, 256, 256, 1024, 1024]
    - [128, 15.14]
  - - [256, 256, 1, 2048, 256, 256, 2048, 2048]
    - [104, 23.9]
  - - [256, 256, 1, 4096, 256, 256, 4096, 4096]
    - [128, 33.3]
  - - [256, 256, 1, 8192, 256, 256, 8192, 8192]
    - [128, 41.92]
  - - [256, 512, 1, 128, 256, 256, 128, 128]
    - [100, 4.94]
  - - [256, 512, 1, 256, 256, 256, 256, 256]
    - [104, 9.41]
  - - [256, 512, 1, 512, 256, 256, 512, 512]
    - [104, 17.48]
  - - [256, 512, 1, 1024, 256, 256, 1024, 1024]
    - [104, 30.41]
  - - [256, 512, 1, 2048, 256, 256, 2048, 2048]
    - [128, 46.41]
  - - [256, 512, 1, 4096, 256, 256, 4096, 4096]
    - [128, 65.12]
  - - [256, 512, 1, 8192, 256, 256, 8192, 8192]
    - [128, 82.49]
  - - [256, 1024, 1, 128, 256, 256, 128, 128]
    - [95, 9.27]
  - - [256, 1024, 1, 256, 256, 256, 256, 256]
    - [25, 14.75]
  - - [256, 1024, 1, 512, 256, 256, 512, 512]
    - [96, 31.23]
  - - [256, 1024, 1, 1024, 256, 256, 1024, 1024]
    - [96, 51.37]
  - - [256, 1024, 1, 2048, 256, 256, 2048, 2048]
    - [91, 76.78]
  - - [256, 1024, 1, 4096, 256, 256, 4096, 4096]
    - [124, 102.01]
  - - [256, 1024, 1, 8192, 256, 256, 8192, 8192]
    - [124, 120.13]
  - - [256, 2048, 1, 128, 256, 256, 128, 128]
    - [87, 15.15]
  - - [256, 2048, 1, 256, 256, 256, 256, 256]
    - [121, 30.49]
  - - [256, 2048, 1, 512, 256, 256, 512, 512]
    - [89, 54.22]
  - - [256, 2048, 1, 1024, 256, 256, 1024, 1024]
    - [89, 86.95]
  - - [256, 2048, 1, 2048, 256, 256, 2048, 2048]
    - [121, 123.72]
  - - [256, 2048, 1, 4096, 256, 256, 4096, 4096]
    - [121, 160.09]
  - - [256, 2048, 1, 8192, 256, 256, 8192, 8192]
    - [121, 177.91]
  - - [256, 4096, 1, 128, 256, 256, 128, 128]
    - [82, 28.79]
  - - [256, 4096, 1, 256, 256, 256, 256, 256]
    - [82, 52.36]
  - - [256, 4096, 1, 512, 256, 256, 512, 512]
    - [82, 88.69]
  - - [256, 4096, 1, 1024, 256, 256, 1024, 1024]
    - [82, 135.46]
  - - [256, 4096, 1, 2048, 256, 256, 2048, 2048]
    - [119, 186.21]
  - - [256, 4096, 1, 4096, 256, 256, 4096, 4096]
    - [119, 221.98]
  - - [256, 4096, 1, 8192, 256, 256, 8192, 8192]
    - [113, 222.99]
  - - [256, 8192, 1, 128, 256, 256, 128, 128]
    - [16, 45.29]
  - - [256, 8192, 1, 256, 256, 256, 256, 256]
    - [16, 80.98]
  - - [256, 8192, 1, 512, 256, 256, 512, 512]
    - [66, 132.58]
  - - [256, 8192, 1, 1024, 256, 256, 1024, 1024]
    - [75, 200.29]
  - - [256, 8192, 1, 2048, 256, 256, 2048, 2048]
    - [75, 258.9]
  - - [256, 8192, 1, 4096, 256, 256, 4096, 4096]
    - [66, 229.13]
  - - [256, 8192, 1, 8192, 256, 256, 8192, 8192]
    - [74, 281.54]
  - - [512, 128, 1, 128, 512, 512, 128, 128]
    - [104, 2.52]
  - - [512, 128, 1, 256, 512, 512, 256, 256]
    - [103, 4.68]
  - - [512, 128, 1, 512, 512, 512, 512, 512]
    - [104, 8.8]
  - - [512, 128, 1, 1024, 512, 512, 1024, 1024]
    - [112, 13.82]
  - - [512, 128, 1, 2048, 512, 512, 2048, 2048]
    - [104, 23.53]
  - - [512, 128, 1, 4096, 512, 512, 4096, 4096]
    - [128, 33.3]
  - - [512, 128, 1, 8192, 512, 512, 8192, 8192]
    - [128, 41.92]
  - - [512, 256, 1, 128, 512, 512, 128, 128]
    - [104, 4.95]
  - - [512, 256, 1, 256, 512, 512, 256, 256]
    - [107, 8.69]
  - - [512, 256, 1, 512, 512, 512, 512, 512]
    - [104, 15.44]
  - - [512, 256, 1, 1024, 512, 512, 1024, 1024]
    - [104, 29.21]
  - - [512, 256, 1, 2048, 512, 512, 2048, 2048]
    - [104, 44.53]
  - - [512, 256, 1, 4096, 512, 512, 4096, 4096]
    - [128, 64.88]
  - - [512, 256, 1, 8192, 512, 512, 8192, 8192]
    - [129, 81.36]
  - - [512, 512, 1, 128, 512, 512, 128, 128]
    - [94, 9.4]
  - - [512, 512, 1, 256, 512, 512, 256, 256]
    - [96, 17.65]
  - - [512, 512, 1, 512, 512, 512, 512, 512]
    - [96, 31.83]
  - - [512, 512, 1, 1024, 512, 512, 1024, 1024]
    - [96, 51.51]
  - - [512, 512, 1, 2048, 512, 512, 2048, 2048]
    - [91, 76.59]
  - - [512, 512, 1, 4096, 512, 512, 4096, 4096]
    - [91, 102.06]
  - - [512, 512, 1, 8192, 512, 512, 8192, 8192]
    - [125, 117.83]
  - - [512, 1024, 1, 128, 512, 512, 128, 128]
    - [89, 16.77]
  - - [512, 1024, 1, 256, 512, 512, 256, 256]
    - [23, 30.28]
  - - [512, 1024, 1, 512, 512, 512, 512, 512]
    - [89, 54.08]
  - - [512, 1024, 1, 1024, 512, 512, 1024, 1024]
    - [89, 85.82]
  - - [512, 1024, 1, 2048, 512, 512, 2048, 2048]
    - [121, 125.09]
  - - [512, 1024, 1, 4096, 512, 512, 4096, 4096]
    - [121, 162.21]
  - - [512, 1024, 1, 8192, 512, 512, 8192, 8192]
    - [121, 174.1]
  - - [512, 2048, 1, 128, 512, 512, 128, 128]
    - [82, 28.95]
  - - [512, 2048, 1, 256, 512, 512, 256, 256]
    - [82, 52.48]
  - - [512, 2048, 1, 512, 512, 512, 512, 512]
    - [82, 87.73]
  - - [512, 2048, 1, 1024, 512, 512, 1024, 1024]
    - [82, 134.58]
  - - [512, 2048, 1, 2048, 512, 512, 2048, 2048]
    - [119, 186.13]
  - - [512, 2048, 1, 4096, 512, 512, 4096, 4096]
    - [119, 228.55]
  - - [512, 2048, 1, 8192, 512, 512, 8192, 8192]
    - [113, 224.39]
  - - [512, 4096, 1, 128, 512, 512, 128, 128]
    - [16, 45.09]
  - - [512, 4096, 1, 256, 512, 512, 256, 256]
    - [16, 80.47]
  - - [512, 4096, 1, 512, 512, 512, 512, 512]
    - [66, 133.08]
  - - [512, 4096, 1, 1024, 512, 512, 1024, 1024]
    - [75, 201.11]
  - - [512, 4096, 1, 2048, 512, 512, 2048, 2048]
    - [75, 265.19]
  - - [512, 4096, 1, 4096, 512, 512, 4096, 4096]
    - [66, 237.84]
  - - [512, 4096, 1, 8192, 512, 512, 8192, 8192]
    - [74, 283.84]
  - - [512, 8192, 1, 128, 512, 512, 128, 128]
    - [68, 66.03]
  - - [512, 8192, 1, 256, 512, 512, 256, 256]
    - [13, 117.16]
  - - [512, 8192, 1, 512, 512, 512, 512, 512]
    - [69, 188.48]
  - - [512, 8192, 1, 1024, 512, 512, 1024, 1024]
    - [71, 242.39]
  - - [512, 8192, 1, 2048, 512, 512, 2048, 2048]
    - [52, 264.04]
  - - [512, 8192, 1, 4096, 512, 512, 4096, 4096]
    - [29, 284.7]
  - - [512, 8192, 1, 8192, 512, 512, 8192, 8192]
    - [70, 313.22]
  - - [1024, 128, 1, 128, 1024, 1024, 128, 128]
    - [99, 4.9]
  - - [1024, 128, 1, 256, 1024, 1024, 256, 256]
    - [112, 8.86]
  - - [1024, 128, 1, 512, 1024, 1024, 512, 512]
    - [108, 15.76]
  - - [1024, 128, 1, 1024, 1024, 1024, 1024, 1024]
    - [104, 29.35]
  - - [1024, 128, 1, 2048, 1024, 1024, 2048, 2048]
    - [110, 45.7]
  - - [1024, 128, 1, 4096, 1024, 1024, 4096, 4096]
    - [128, 64.05]
  - - [1024, 128, 1, 8192, 1024, 1024, 8192, 8192]
    - [133, 81.39]
  - - [1024, 256, 1, 128, 1024, 1024, 128, 128]
    - [96, 9.42]
  - - [1024, 256, 1, 256, 1024, 1024, 256, 256]
    - [95, 17.39]
  - - [1024, 256, 1, 512, 1024, 1024, 512, 512]
    - [95, 30.73]
  - - [1024, 256, 1, 1024, 1024, 1024, 1024, 1024]
    - [96, 51.53]
  - - [1024, 256, 1, 2048, 1024, 1024, 2048, 2048]
    - [91, 75.71]
  - - [1024, 256, 1, 4096, 1024, 1024, 4096, 4096]
    - [91, 101.14]
  - - [1024, 256, 1, 8192, 1024, 1024, 8192, 8192]
    - [126, 121.53]
  - - [1024, 512, 1, 128, 1024, 1024, 128, 128]
    - [89, 16.77]
  - - [1024, 512, 1, 256, 1024, 1024, 256, 256]
    - [89, 30.72]
  - - [1024, 512, 1, 512, 1024, 1024, 512, 512]
    - [89, 53.86]
  - - [1024, 512, 1, 1024, 1024, 1024, 1024, 1024]
    - [89, 86.8]
  - - [1024, 512, 1, 2048, 1024, 1024, 2048, 2048]
    - [121, 123.91]
  - - [1024, 512, 1, 4096, 1024, 1024, 4096, 4096]
    - [122, 159.88]
  - - [1024, 512, 1, 8192, 1024, 1024, 8192, 8192]
    - [122, 175.1]
  - - [1024, 1024, 1, 128, 1024, 1024, 128, 128]
    - [82, 28.78]
  - - [1024, 1024, 1, 256, 1024, 1024, 256, 256]
    - [82, 51.64]
  - - [1024, 1024, 1, 512, 1024, 1024, 512, 512]
    - [82, 87.84]
  - - [1024, 1024, 1, 1024, 1024, 1024, 1024, 1024]
    - [82, 135.03]
  - - [1024, 1024, 1, 2048, 1024, 1024, 2048, 2048]
    - [119, 184.24]
  - - [1024, 1024, 1, 4096, 1024, 1024, 4096, 4096]
    - [114, 207.93]
  - - [1024, 1024, 1, 8192, 1024, 1024, 8192, 8192]
    - [118, 218.28]
  - - [1024, 2048, 1, 128, 1024, 1024, 128, 128]
    - [16, 44.15]
  - - [1024, 2048, 1, 256, 1024, 1024, 256, 256]
    - [16, 77.52]
  - - [1024, 2048, 1, 512, 1024, 1024, 512, 512]
    - [66, 129.0]
  - - [1024, 2048, 1, 1024, 1024, 1024, 1024, 1024]
    - [75, 196.15]
  - - [1024, 2048, 1, 2048, 1024, 1024, 2048, 2048]
    - [75, 261.94]
  - - [1024, 2048, 1, 4096, 1024, 1024, 4096, 4096]
    - [66, 233.4]
  - - [1024, 2048, 1, 8192, 1024, 1024, 8192, 8192]
    - [75, 284.11]
  - - [1024, 4096, 1, 128, 1024, 1024, 128, 128]
    - [11, 60.92]
  - - [1024, 4096, 1, 256, 1024, 1024, 256, 256]
    - [52, 104.74]
  - - [1024, 4096, 1, 512, 1024, 1024, 512, 512]
    - [10, 170.74]
  - - [1024, 4096, 1, 1024, 1024, 1024, 1024, 1024]
    - [31, 239.42]
  - - [1024, 4096, 1, 2048, 1024, 1024, 2048, 2048]
    - [52, 274.12]
  - - [1024, 4096, 1, 4096, 1024, 1024, 4096, 4096]
    - [52, 287.88]
  - - [1024, 4096, 1, 8192, 1024, 1024, 8192, 8192]
    - [56, 284.23]
  - - [1024, 8192, 1, 128, 1024, 1024, 128, 128]
    - [7, 93.73]
  - - [1024, 8192, 1, 256, 1024, 1024, 256, 256]
    - [7, 161.89]
  - - [1024, 8192, 1, 512, 1024, 1024, 512, 512]
    - [40, 246.2]
  - - [1024, 8192, 1, 1024, 1024, 1024, 1024, 1024]
    - [38, 256.98]
  - - [1024, 8192, 1, 2048, 1024, 1024, 2048, 2048]
    - [39, 313.0]
  - - [1024, 8192, 1, 4096, 1024, 1024, 4096, 4096]
    - [37, 355.69]
  - - [1024, 8192, 1, 8192, 1024, 1024, 8192, 8192]
    - [45, 377.89]
  - - [2048, 128, 1, 128, 2048, 2048, 128, 128]
    - [90, 8.86]
  - - [2048, 128, 1, 256, 2048, 2048, 256, 256]
    - [96, 17.26]
  - - [2048, 128, 1, 512, 2048, 2048, 512, 512]
    - [96, 31.0]
  - - [2048, 128, 1, 1024, 2048, 2048, 1024, 1024]
    - [96, 50.88]
  - - [2048, 128, 1, 2048, 2048, 2048, 2048, 2048]
    - [91, 76.01]
  - - [2048, 128, 1, 4096, 2048, 2048, 4096, 4096]
    - [91, 101.68]
  - - [2048, 128, 1, 8192, 2048, 2048, 8192, 8192]
    - [125, 121.08]
  - - [2048, 256, 1, 128, 2048, 2048, 128, 128]
    - [86, 16.68]
  - - [2048, 256, 1, 256, 2048, 2048, 256, 256]
    - [89, 30.37]
  - - [2048, 256, 1, 512, 2048, 2048, 512, 512]
    - [89, 53.67]
  - - [2048, 256, 1, 1024, 2048, 2048, 1024, 1024]
    - [89, 85.72]
  - - [2048, 256, 1, 2048, 2048, 2048, 2048, 2048]
    - [123, 121.6]
  - - [2048, 256, 1, 4096, 2048, 2048, 4096, 4096]
    - [123, 158.6]
  - - [2048, 256, 1, 8192, 2048, 2048, 8192, 8192]
    - [122, 176.77]
  - - [2048, 512, 1, 128, 2048, 2048, 128, 128]
    - [19, 28.33]
  - - [2048, 512, 1, 256, 2048, 2048, 256, 256]
    - [82, 51.32]
  - - [2048, 512, 1, 512, 2048, 2048, 512, 512]
    - [82, 87.33]
  - - [2048, 512, 1, 1024, 2048, 2048, 1024, 1024]
    - [82, 133.77]
  - - [2048, 512, 1, 2048, 2048, 2048, 2048, 2048]
    - [113, 183.61]
  - - [2048, 512, 1, 4096, 2048, 2048, 4096, 4096]
    - [115, 219.74]
  - - [2048, 512, 1, 8192, 2048, 2048, 8192, 8192]
    - [116, 223.62]
  - - [2048, 1024, 1, 128, 2048, 2048, 128, 128]
    - [16, 45.34]
  - - [2048, 1024, 1, 256, 2048, 2048, 256, 256]
    - [16, 80.08]
  - - [2048, 1024, 1, 512, 2048, 2048, 512, 512]
    - [75, 133.9]
  - - [2048, 1024, 1, 1024, 2048, 2048, 1024, 1024]
    - [75, 200.19]
  - - [2048, 1024, 1, 2048, 2048, 2048, 2048, 2048]
    - [77, 254.25]
  - - [2048, 1024, 1, 4096, 2048, 2048, 4096, 4096]
    - [77, 240.49]
  - - [2048, 1024, 1, 8192, 2048, 2048, 8192, 8192]
    - [79, 279.44]
  - - [2048, 2048, 1, 128, 2048, 2048, 128, 128]
    - [11, 62.96]
  - - [2048, 2048, 1, 256, 2048, 2048, 256, 256]
    - [10, 107.84]
  - - [2048, 2048, 1, 512, 2048, 2048, 512, 512]
    - [10, 169.38]
  - - [2048, 2048, 1, 1024, 2048, 2048, 1024, 1024]
    - [52, 236.6]
  - - [2048, 2048, 1, 2048, 2048, 2048, 2048, 2048]
    - [32, 266.65]
  - - [2048, 2048, 1, 4096, 2048, 2048, 4096, 4096]
    - [56, 286.74]
  - - [2048, 2048, 1, 8192, 2048, 2048, 8192, 8192]
    - [55, 285.95]
  - - [2048, 4096, 1, 128, 2048, 2048, 128, 128]
    - [1, 76.32]
  - - [2048, 4096, 1, 256, 2048, 2048, 256, 256]
    - [0, 128.79]
  - - [2048, 4096, 1, 512, 2048, 2048, 512, 512]
    - [0, 195.83]
  - - [2048, 4096, 1, 1024, 2048, 2048, 1024, 1024]
    - [6, 248.14]
  - - [2048, 4096, 1, 2048, 2048, 2048, 2048, 2048]
    - [2, 276.98]
  - - [2048, 4096, 1, 4096, 2048, 2048, 4096, 4096]
    - [42, 291.26]
  - - [2048, 4096, 1, 8192, 2048, 2048, 8192, 8192]
    - [47, 322.52]
  - - [2048, 8192, 1, 128, 2048, 2048, 128, 128]
    - [8, 101.68]
  - - [2048, 8192, 1, 256, 2048, 2048, 256, 256]
    - [49, 165.56]
  - - [2048, 8192, 1, 512, 2048, 2048, 512, 512]
    - [8, 218.25]
  - - [2048, 8192, 1, 1024, 2048, 2048, 1024, 1024]
    - [51, 280.87]
  - - [2048, 8192, 1, 2048, 2048, 2048, 2048, 2048]
    - [50, 332.64]
  - - [2048, 8192, 1, 4096, 2048, 2048, 4096, 4096]
    - [44, 336.49]
  - - [2048, 8192, 1, 8192, 2048, 2048, 8192, 8192]
    - [43, 383.42]
  - - [4096, 128, 1, 128, 4096, 4096, 128, 128]
    - [86, 16.49]
  - - [4096, 128, 1, 256, 4096, 4096, 256, 256]
    - [89, 30.25]
  - - [4096, 128, 1, 512, 4096, 4096, 512, 512]
    - [89, 52.41]
  - - [4096, 128, 1, 1024, 4096, 4096, 1024, 1024]
    - [89, 85.03]
  - - [4096, 128, 1, 2048, 4096, 4096, 2048, 2048]
    - [121, 122.82]
  - - [4096, 128, 1, 4096, 4096, 4096, 4096, 4096]
    - [122, 157.16]
  - - [4096, 128, 1, 8192, 4096, 4096, 8192, 8192]
    - [122, 171.93]
  - - [4096, 256, 1, 128, 4096, 4096, 128, 128]
    - [18, 27.76]
  - - [4096, 256, 1, 256, 4096, 4096, 256, 256]
    - [20, 48.98]
  - - [4096, 256, 1, 512, 4096, 4096, 512, 512]
    - [83, 85.43]
  - - [4096, 256, 1, 1024, 4096, 4096, 1024, 1024]
    - [85, 130.73]
  - - [4096, 256, 1, 2048, 4096, 4096, 2048, 2048]
    - [113, 183.38]
  - - [4096, 256, 1, 4096, 4096, 4096, 4096, 4096]
    - [120, 214.65]
  - - [4096, 256, 1, 8192, 4096, 4096, 8192, 8192]
    - [118, 223.53]
  - - [4096, 512, 1, 128, 4096, 4096, 128, 128]
    - [16, 44.58]
  - - [4096, 512, 1, 256, 4096, 4096, 256, 256]
    - [16, 78.06]
  - - [4096, 512, 1, 512, 4096, 4096, 512, 512]
    - [66, 129.24]
  - - [4096, 512, 1, 1024, 4096, 4096, 1024, 1024]
    - [75, 197.87]
  - - [4096, 512, 1, 2048, 4096, 4096, 2048, 2048]
    - [77, 253.71]
  - - [4096, 512, 1, 4096, 4096, 4096, 4096, 4096]
    - [67, 242.47]
  - - [4096, 512, 1, 8192, 4096, 4096, 8192, 8192]
    - [78, 290.04]
  - - [4096, 1024, 1, 128, 4096, 4096, 128, 128]
    - [11, 62.65]
  - - [4096, 1024, 1, 256, 4096, 4096, 256, 256]
    - [10, 107.07]
  - - [4096, 1024, 1, 512, 4096, 4096, 512, 512]
    - [10, 170.45]
  - - [4096, 1024, 1, 1024, 4096, 4096, 1024, 1024]
    - [54, 235.06]
  - - [4096, 1024, 1, 2048, 4096, 4096, 2048, 2048]
    - [36, 272.85]
  - - [4096, 1024, 1, 4096, 4096, 4096, 4096, 4096]
    - [53, 287.82]
  - - [4096, 1024, 1, 8192, 4096, 4096, 8192, 8192]
    - [33, 285.23]
  - - [4096, 2048, 1, 128, 4096, 4096, 128, 128]
    - [1, 76.94]
  - - [4096, 2048, 1, 256, 4096, 4096, 256, 256]
    - [3, 128.01]
  - - [4096, 2048, 1, 512, 4096, 4096, 512, 512]
    - [0, 189.92]
  - - [4096, 2048, 1, 1024, 4096, 4096, 1024, 1024]
    - [5, 245.12]
  - - [4096, 2048, 1, 2048, 4096, 4096, 2048, 2048]
    - [2, 274.49]
  - - [4096, 2048, 1, 4096, 4096, 4096, 4096, 4096]
    - [29, 296.71]
  - - [4096, 2048, 1, 8192, 4096, 4096, 8192, 8192]
    - [29, 327.03]
  - - [4096, 4096, 1, 128, 4096, 4096, 128, 128]
    - [1, 82.54]
  - - [4096, 4096, 1, 256, 4096, 4096, 256, 256]
    - [1, 138.06]
  - - [4096, 4096, 1, 512, 4096, 4096, 512, 512]
    - [6, 196.81]
  - - [4096, 4096, 1, 1024, 4096, 4096, 1024, 1024]
    - [2, 240.49]
  - - [4096, 4096, 1, 2048, 4096, 4096, 2048, 2048]
    - [48, 280.14]
  - - [4096, 4096, 1, 4096, 4096, 4096, 4096, 4096]
    - [34, 306.62]
  - - [4096, 4096, 1, 8192, 4096, 4096, 8192, 8192]
    - [30, 355.84]
  - - [4096, 8192, 1, 128, 4096, 4096, 128, 128]
    - [41, 107.99]
  - - [4096, 8192, 1, 256, 4096, 4096, 256, 256]
    - [41, 177.72]
  - - [4096, 8192, 1, 512, 4096, 4096, 512, 512]
    - [46, 237.09]
  - - [4096, 8192, 1, 1024, 4096, 4096, 1024, 1024]
    - [51, 286.4]
  - - [4096, 8192, 1, 2048, 4096, 4096, 2048, 2048]
    - [44, 318.02]
  - - [4096, 8192, 1, 4096, 4096, 4096, 4096, 4096]
    - [48, 346.53]
  - - [4096, 8192, 1, 8192, 4096, 4096, 8192, 8192]
    - [48, 402.67]
  - - [8192, 128, 1, 128, 8192, 8192, 128, 128]
    - [82, 29.48]
  - - [8192, 128, 1, 256, 8192, 8192, 256, 256]
    - [82, 52.6]
  - - [8192, 128, 1, 512, 8192, 8192, 512, 512]
    - [85, 85.86]
  - - [8192, 128, 1, 1024, 8192, 8192, 1024, 1024]
    - [82, 133.87]
  - - [8192, 128, 1, 2048, 8192, 8192, 2048, 2048]
    - [113, 182.86]
  - - [8192, 128, 1, 4096, 8192, 8192, 4096, 4096]
    - [120, 190.61]
  - - [8192, 128, 1, 8192, 8192, 8192, 8192, 8192]
    - [117, 214.87]
  - - [8192, 256, 1, 128, 8192, 8192, 128, 128]
    - [66, 44.94]
  - - [8192, 256, 1, 256, 8192, 8192, 256, 256]
    - [16, 79.55]
  - - [8192, 256, 1, 512, 8192, 8192, 512, 512]
    - [75, 133.85]
  - - [8192, 256, 1, 1024, 8192, 8192, 1024, 1024]
    - [75, 200.26]
  - - [8192, 256, 1, 2048, 8192, 8192, 2048, 2048]
    - [80, 256.22]
  - - [8192, 256, 1, 4096, 8192, 8192, 4096, 4096]
    - [77, 232.73]
  - - [8192, 256, 1, 8192, 8192, 8192, 8192, 8192]
    - [76, 276.81]
  - - [8192, 512, 1, 128, 8192, 8192, 128, 128]
    - [11, 60.41]
  - - [8192, 512, 1, 256, 8192, 8192, 256, 256]
    - [10, 107.24]
  - - [8192, 512, 1, 512, 8192, 8192, 512, 512]
    - [12, 167.65]
  - - [8192, 512, 1, 1024, 8192, 8192, 1024, 1024]
    - [35, 234.73]
  - - [8192, 512, 1, 2048, 8192, 8192, 2048, 2048]
    - [55, 265.05]
  - - [8192, 512, 1, 4096, 8192, 8192, 4096, 4096]
    - [73, 292.22]
  - - [8192, 512, 1, 8192, 8192, 8192, 8192, 8192]
    - [72, 337.14]
  - - [8192, 1024, 1, 128, 8192, 8192, 128, 128]
    - [2, 76.13]
  - - [8192, 1024, 1, 256, 8192, 8192, 256, 256]
    - [3, 127.88]
  - - [8192, 1024, 1, 512, 8192, 8192, 512, 512]
    - [4, 188.42]
  - - [8192, 1024, 1, 1024, 8192, 8192, 1024, 1024]
    - [5, 241.09]
  - - [8192, 1024, 1, 2048, 8192, 8192, 2048, 2048]
    - [62, 293.11]
  - - [8192, 1024, 1, 4096, 8192, 8192, 4096, 4096]
    - [63, 354.54]
  - - [8192, 1024, 1, 8192, 8192, 8192, 8192, 8192]
    - [64, 390.03]
  - - [8192, 2048, 1, 128, 8192, 8192, 128, 128]
    - [8, 85.01]
  - - [8192, 2048, 1, 256, 8192, 8192, 256, 256]
    - [8, 140.14]
  - - [8192, 2048, 1, 512, 8192, 8192, 512, 512]
    - [6, 194.2]
  - - [8192, 2048, 1, 1024, 8192, 8192, 1024, 1024]
    - [62, 246.53]
  - - [8192, 2048, 1, 2048, 8192, 8192, 2048, 2048]
    - [65, 316.68]
  - - [8192, 2048, 1, 4096, 8192, 8192, 4096, 4096]
    - [58, 354.73]
  - - [8192, 2048, 1, 8192, 8192, 8192, 8192, 8192]
    - [59, 420.26]
  - - [8192, 4096, 1, 128, 8192, 8192, 128, 128]
    - [0, 89.51]
  - - [8192, 4096, 1, 256, 8192, 8192, 256, 256]
    - [17, 140.88]
  - - [8192, 4096, 1, 512, 8192, 8192, 512, 512]
    - [77, 206.79]
  - - [8192, 4096, 1, 1024, 8192, 8192, 1024, 1024]
    - [57, 256.6]
  - - [8192, 4096, 1, 2048, 8192, 8192, 2048, 2048]
    - [61, 318.13]
  - - [8192, 4096, 1, 4096, 8192, 8192, 4096, 4096]
    - [61, 365.12]
  - - [8192, 4096, 1, 8192, 8192, 8192, 8192, 8192]
    - [61, 442.24]
  - - [8192, 8192, 1, 128, 8192, 8192, 128, 128]
    - [41, 111.72]
  - - [8192, 8192, 1, 256, 8192, 8192, 256, 256]
    - [9, 168.04]
  - - [8192, 8192, 1, 512, 8192, 8192, 512, 512]
    - [51, 223.71]
  - - [8192, 8192, 1, 1024, 8192, 8192, 1024, 1024]
    - [32, 283.15]
  - - [8192, 8192, 1, 2048, 8192, 8192, 2048, 2048]
    - [60, 326.66]
  - - [8192, 8192, 1, 4096, 8192, 8192, 4096, 4096]
    - [61, 381.98]
  - - [8192, 8192, 1, 8192, 8192, 8192, 8192, 8192]
    - [61, 444.23]
  - - [1, 1, 1, 32, 1, 1, 32, 32]
    - [134, 0.0]
- null
- null
- ExperimentalStreamK
- GridBased
