projects/hipblaslt/library/src/amd_detail/rocblaslt/src/Tensile/Logic/asm_full/aquavanjaram/gfx942_228cu/StreamK/aquavanjaram942_Cijk_Alik_Bjlk_F8NBS_BH_Bias_HAS_SAV_UserArgs.yaml
- {MinimumRequiredVersion: 4.33.0}
- aquavanjaram942
- {Architecture: gfx942, CUCount: 228}
- [Device 0049, Device 0050]
    SolutionIndex: 0
    SolutionNameMin: Cijk_Alik_Bjlk_F8NBS_BH_Bias_HAS_SAV_UserArgs_MT256x256x64_MI16x16x1_SN_LDSB1_CLR1_GRVWA8_GRVWB8_GSU0_GSUC0_GSUWGMRR0_K1_LBSPPA512_LBSPPB2048_LPA8_LPB0_LRVW8_MIWT8_8_PLR1_SU0_SUM0_SUS64_VWA8_VWB8_WGM1_WGMXCC1_WGMXCCGn1
    SolutionIndex: 1
    SolutionNameMin: Cijk_Alik_Bjlk_F8NBS_BH_Bias_HAS_SAV_UserArgs_MT256x256x64_MI16x16x1_SN_LDSB1_CLR1_GRVWA16_GRVWB8_GSU0_GSUC0_GSUWGMRR0_K1_LBSPPA512_LBSPPB2048_LPA16_LPB0_LRVW8_MIWT8_8_PLR1_SU0_SUM0_SUS64_VWA8_VWB8_WGM1_WGMXCC1_WGMXCCGn1
    SolutionIndex: 2
    SolutionNameMin: Cijk_Alik_Bjlk_F8NBS_BH_Bias_HAS_SAV_UserArgs_MT256x256x64_MI16x16x1_SN_LDSB1_CLR1_GRVWA8_GRVWB16_GSU0_GSUC0_GSUWGMRR0_K1_LBSPPA512_LBSPPB2048_LPA8_LPB0_LRVW8_MIWT8_8_PLR1_SU0_SUM0_SUS64_VWA8_VWB8_WGM1_WGMXCC1_WGMXCCGn1
    SolutionIndex: 3
    SolutionNameMin: Cijk_Alik_Bjlk_F8NBS_BH_Bias_HAS_SAV_UserArgs_MT256x256x64_MI16x16x1_SN_LDSB1_CLR1_GRVWA16_GRVWB16_GSU0_GSUC0_GSUWGMRR0_K1_LBSPPA512_LBSPPB2048_LPA16_LPB0_LRVW8_MIWT8_8_PLR1_SU0_SUM0_SUS64_VWA8_VWB8_WGM1_WGMXCC1_WGMXCCGn1
    SolutionIndex: 4
    SolutionNameMin: Cijk_Alik_Bjlk_F8NBS_BH_Bias_HAS_SAV_UserArgs_MT256x256x64_MI16x16x1_SN_LDSB1_CLR1_GRVWA8_GRVWB16_GSU0_GSUC0_GSUWGMRR0_K1_LBSPPA512_LBSPPB2048_LPA8_LPB0_LRVW8_MIWT8_8_PLR1_SU0_SUM0_SUS64_VWA8_VWB8_WGM4_WGMXCC1_WGMXCCGn1
    SolutionIndex: 5
    SolutionNameMin: Cijk_Alik_Bjlk_F8NBS_BH_Bias_HAS_SAV_UserArgs_MT256x256x64_MI16x16x1_SN_LDSB1_CLR1_GRVWA16_GRVWB16_GSU0_GSUC0_GSUWGMRR0_K1_LBSPPA512_LBSPPB2048_LPA16_LPB0_LRVW8_MIWT8_8_PLR1_SU0_SUM0_SUS64_VWA8_VWB8_WGM4_WGMXCC1_WGMXCCGn1
    SolutionIndex: 6
    SolutionNameMin: Cijk_Alik_Bjlk_F8NBS_BH_Bias_HAS_SAV_UserArgs_MT256x256x64_MI16x16x1_SN_LDSB1_CLR1_GRVWA8_GRVWB8_GSU0_GSUC0_GSUWGMRR0_K1_LBSPPA512_LBSPPB2048_LPA8_LPB0_LRVW8_MIWT8_8_PLR1_SU0_SUM0_SUS64_VWA8_VWB8_WGM6_WGMXCC1_WGMXCCGn1
    SolutionIndex: 7
    SolutionNameMin: Cijk_Alik_Bjlk_F8NBS_BH_Bias_HAS_SAV_UserArgs_MT256x256x64_MI16x16x1_SN_LDSB1_CLR1_GRVWA16_GRVWB8_GSU0_GSUC0_GSUWGMRR0_K1_LBSPPA512_LBSPPB2048_LPA16_LPB0_LRVW8_MIWT8_8_PLR1_SU0_SUM0_SUS64_VWA8_VWB8_WGM6_WGMXCC1_WGMXCCGn1
    SolutionIndex: 8
    SolutionNameMin: Cijk_Alik_Bjlk_F8NBS_BH_Bias_HAS_SAV_UserArgs_MT256x256x64_MI16x16x1_SN_LDSB1_CLR1_GRVWA8_GRVWB16_GSU0_GSUC0_GSUWGMRR0_K1_LBSPPA512_LBSPPB2048_LPA8_LPB0_LRVW8_MIWT8_8_PLR1_SU0_SUM0_SUS64_VWA8_VWB8_WGM6_WGMXCC1_WGMXCCGn1
    SolutionIndex: 9
    SolutionNameMin: Cijk_Alik_Bjlk_F8NBS_BH_Bias_HAS_SAV_UserArgs_MT256x256x64_MI16x16x1_SN_LDSB1_CLR1_GRVWA16_GRVWB16_GSU0_GSUC0_GSUWGMRR0_K1_LBSPPA512_LBSPPB2048_LPA16_LPB0_LRVW8_MIWT8_8_PLR1_SU0_SUM0_SUS64_VWA8_VWB8_WGM6_WGMXCC1_WGMXCCGn1
    SolutionIndex: 10
    SolutionNameMin: Cijk_Alik_Bjlk_F8NBS_BH_Bias_HAS_SAV_UserArgs_MT256x256x64_MI16x16x1_SN_LDSB1_CLR1_GRVWA8_GRVWB16_GSU0_GSUC0_GSUWGMRR0_K1_LBSPPA512_LBSPPB2048_LPA8_LPB0_LRVW8_MIWT8_8_PLR1_SU0_SUM0_SUS64_VWA8_VWB8_WGM8_WGMXCC1_WGMXCCGn1
    SolutionIndex: 11
    SolutionNameMin: Cijk_Alik_Bjlk_F8NBS_BH_Bias_HAS_SAV_UserArgs_MT256x256x64_MI16x16x1_SN_LDSB1_CLR1_GRVWA16_GRVWB16_GSU0_GSUC0_GSUWGMRR0_K1_LBSPPA512_LBSPPB2048_LPA16_LPB0_LRVW8_MIWT8_8_PLR1_SU0_SUM0_SUS64_VWA8_VWB8_WGM8_WGMXCC1_WGMXCCGn1
    SolutionIndex: 12
    SolutionNameMin: Cijk_Alik_Bjlk_F8NBS_BH_Bias_HAS_SAV_UserArgs_MT128x256x64_MI16x16x1_SN_LDSB1_CLR1_GRVWA8_GRVWB16_GSU0_GSUC0_GSUWGMRR0_K1_LBSPPA256_LBSPPB2048_LPA8_LPB0_LRVW8_MIWT4_8_PLR1_SU0_SUM0_SUS64_VWA4_VWB8_WGM1_WGMXCC1_WGMXCCGn1
    SolutionIndex: 13
    SolutionNameMin: Cijk_Alik_Bjlk_F8NBS_BH_Bias_HAS_SAV_UserArgs_MT128x256x64_MI16x16x1_SN_LDSB1_CLR1_GRVWA16_GRVWB16_GSU0_GSUC0_GSUWGMRR0_K1_LBSPPA256_LBSPPB2048_LPA16_LPB0_LRVW8_MIWT4_8_PLR1_SU0_SUM0_SUS64_VWA4_VWB8_WGM1_WGMXCC1_WGMXCCGn1
    SolutionIndex: 14
    SolutionNameMin: Cijk_Alik_Bjlk_F8NBS_BH_Bias_HAS_SAV_UserArgs_MT128x256x64_MI16x16x1_SN_LDSB1_CLR1_GRVWA8_GRVWB16_GSU0_GSUC0_GSUWGMRR0_K1_LBSPPA256_LBSPPB2048_LPA8_LPB0_LRVW8_MIWT4_8_PLR1_SU0_SUM0_SUS64_VWA4_VWB8_WGM4_WGMXCC1_WGMXCCGn1
    SolutionIndex: 15
    SolutionNameMin: Cijk_Alik_Bjlk_F8NBS_BH_Bias_HAS_SAV_UserArgs_MT128x256x64_MI16x16x1_SN_LDSB1_CLR1_GRVWA8_GRVWB16_GSU0_GSUC0_GSUWGMRR0_K1_LBSPPA256_LBSPPB2048_LPA8_LPB0_LRVW8_MIWT4_8_PLR1_SU0_SUM0_SUS64_VWA4_VWB8_WGM6_WGMXCC1_WGMXCCGn1
    SolutionIndex: 16
    SolutionNameMin: Cijk_Alik_Bjlk_F8NBS_BH_Bias_HAS_SAV_UserArgs_MT256x128x64_MI16x16x1_SN_LDSB1_CLR1_GRVWA8_GRVWB8_GSU0_GSUC0_GSUWGMRR0_K1_LBSPPA512_LBSPPB1024_LPA8_LPB64_LRVW8_MIWT8_4_PLR1_SU0_SUM0_SUS64_VWA8_VWB4_WGM1_WGMXCC1_WGMXCCGn1
    SolutionIndex: 17
    SolutionNameMin: Cijk_Alik_Bjlk_F8NBS_BH_Bias_HAS_SAV_UserArgs_MT256x128x64_MI16x16x1_SN_LDSB1_CLR1_GRVWA16_GRVWB8_GSU0_GSUC0_GSUWGMRR0_K1_LBSPPA512_LBSPPB1024_LPA16_LPB64_LRVW8_MIWT8_4_PLR1_SU0_SUM0_SUS64_VWA8_VWB4_WGM1_WGMXCC1_WGMXCCGn1
    SolutionIndex: 18
    SolutionNameMin: Cijk_Alik_Bjlk_F8NBS_BH_Bias_HAS_SAV_UserArgs_MT256x128x64_MI16x16x1_SN_LDSB1_CLR1_GRVWA8_GRVWB16_GSU0_GSUC0_GSUWGMRR0_K1_LBSPPA512_LBSPPB1024_LPA8_LPB64_LRVW8_MIWT8_4_PLR1_SU0_SUM0_SUS64_VWA8_VWB4_WGM1_WGMXCC1_WGMXCCGn1
    SolutionIndex: 19
    SolutionNameMin: Cijk_Alik_Bjlk_F8NBS_BH_Bias_HAS_SAV_UserArgs_MT256x128x64_MI16x16x1_SN_LDSB1_CLR1_GRVWA16_GRVWB8_GSU0_GSUC0_GSUWGMRR0_K1_LBSPPA512_LBSPPB1024_LPA16_LPB64_LRVW8_MIWT8_4_PLR1_SU0_SUM0_SUS64_VWA8_VWB4_WGM4_WGMXCC1_WGMXCCGn1
    SolutionIndex: 20
    SolutionNameMin: Cijk_Alik_Bjlk_F8NBS_BH_Bias_HAS_SAV_UserArgs_MT256x128x64_MI16x16x1_SN_LDSB1_CLR1_GRVWA16_GRVWB8_GSU0_GSUC0_GSUWGMRR0_K1_LBSPPA512_LBSPPB1024_LPA16_LPB64_LRVW8_MIWT8_4_PLR1_SU0_SUM0_SUS64_VWA8_VWB4_WGM6_WGMXCC1_WGMXCCGn1
    SolutionIndex: 21
    SolutionNameMin: Cijk_Alik_Bjlk_F8NBS_BH_Bias_HAS_SAV_UserArgs_MT256x128x64_MI16x16x1_SN_LDSB1_CLR1_GRVWA8_GRVWB8_GSU0_GSUC0_GSUWGMRR0_K1_LBSPPA512_LBSPPB1024_LPA8_LPB64_LRVW8_MIWT8_4_PLR1_SU0_SUM0_SUS64_VWA8_VWB4_WGM8_WGMXCC1_WGMXCCGn1
    SolutionIndex: 22
    SolutionNameMin: Cijk_Alik_Bjlk_F8NBS_BH_Bias_HAS_SAV_UserArgs_MT256x128x64_MI16x16x1_SN_LDSB1_CLR1_GRVWA16_GRVWB8_GSU0_GSUC0_GSUWGMRR0_K1_LBSPPA512_LBSPPB1024_LPA16_LPB64_LRVW8_MIWT8_4_PLR1_SU0_SUM0_SUS64_VWA8_VWB4_WGM8_WGMXCC1_WGMXCCGn1
    SolutionIndex: 23
    SolutionNameMin: Cijk_Alik_Bjlk_F8NBS_BH_Bias_HAS_SAV_UserArgs_MT256x128x64_MI16x16x1_SN_LDSB1_CLR1_GRVWA8_GRVWB16_GSU0_GSUC0_GSUWGMRR0_K1_LBSPPA512_LBSPPB1024_LPA8_LPB64_LRVW8_MIWT8_4_PLR1_SU0_SUM0_SUS64_VWA8_VWB4_WGM8_WGMXCC1_WGMXCCGn1
    SolutionIndex: 24
    SolutionNameMin: Cijk_Alik_Bjlk_F8NBS_BH_Bias_HAS_SAV_UserArgs_MT128x128x64_MI16x16x1_SN_LDSB1_CLR1_GRVWA8_GRVWB16_GSU0_GSUC0_GSUWGMRR0_K1_LBSPPA512_LBSPPB1024_LPA8_LPB32_LRVW8_MIWT8_2_PLR1_SU0_SUM0_SUS64_VWA8_VWB2_WGM1_WGMXCC1_WGMXCCGn1
    SolutionIndex: 25
    SolutionNameMin: Cijk_Alik_Bjlk_F8NBS_BH_Bias_HAS_SAV_UserArgs_MT128x128x64_MI16x16x1_SN_LDSB1_CLR1_GRVWA8_GRVWB16_GSU0_GSUC0_GSUWGMRR0_K1_LBSPPA512_LBSPPB1024_LPA8_LPB32_LRVW8_MIWT8_2_PLR1_SU0_SUM0_SUS64_VWA8_VWB2_WGM4_WGMXCC1_WGMXCCGn1
    SolutionIndex: 26
    SolutionNameMin: Cijk_Alik_Bjlk_F8NBS_BH_Bias_HAS_SAV_UserArgs_MT128x64x64_MI16x16x1_SN_LDSB0_CLR1_GRVWA8_GRVWB8_GSU0_GSUC0_GSUWGMRR0_K1_LBSPPA512_LBSPPB512_LPA8_LPB16_LRVW8_MIWT8_1_PLR1_SU0_SUM0_SUS64_VWA8_VWB1_WGM1_WGMXCC1_WGMXCCGn1
    SolutionIndex: 27
    SolutionNameMin: Cijk_Alik_Bjlk_F8NBS_BH_Bias_HAS_SAV_UserArgs_MT128x64x64_MI16x16x1_SN_LDSB0_CLR1_GRVWA8_GRVWB8_GSU0_GSUC0_GSUWGMRR0_K1_LBSPPA512_LBSPPB512_LPA8_LPB16_LRVW8_MIWT8_1_PLR1_SU0_SUM0_SUS64_VWA8_VWB1_WGM4_WGMXCC1_WGMXCCGn1
    SolutionIndex: 28
    SolutionNameMin: Cijk_Alik_Bjlk_F8NBS_BH_Bias_HAS_SAV_UserArgs_MT64x128x64_MI16x16x1_SN_LDSB0_CLR1_GRVWA16_GRVWB16_GSU0_GSUC0_GSUWGMRR0_K1_LBSPPA128_LBSPPB1024_LPA16_LPB64_LRVW8_MIWT2_4_PLR1_SU0_SUM0_SUS64_VWA2_VWB4_WGM1_WGMXCC1_WGMXCCGn1
    SolutionIndex: 29
    SolutionNameMin: Cijk_Alik_Bjlk_F8NBS_BH_Bias_HAS_SAV_UserArgs_MT128x64x64_MI16x16x1_SN_LDSB0_CLR1_GRVWA8_GRVWB8_GSU0_GSUC0_GSUWGMRR0_K1_LBSPPA256_LBSPPB512_LPA8_LPB32_LRVW8_MIWT4_2_PLR1_SU0_SUM0_SUS64_VWA4_VWB2_WGM1_WGMXCC1_WGMXCCGn1
    SolutionIndex: 30
    SolutionNameMin: Cijk_Alik_Bjlk_F8NBS_BH_Bias_HAS_SAV_UserArgs_MT128x64x64_MI16x16x1_SN_LDSB0_CLR1_GRVWA16_GRVWB8_GSU0_GSUC0_GSUWGMRR0_K1_LBSPPA256_LBSPPB512_LPA16_LPB32_LRVW8_MIWT4_2_PLR1_SU0_SUM0_SUS64_VWA4_VWB2_WGM1_WGMXCC1_WGMXCCGn1
    SolutionIndex: 31
    SolutionNameMin: Cijk_Alik_Bjlk_F8NBS_BH_Bias_HAS_SAV_UserArgs_MT128x64x64_MI16x16x1_SN_LDSB0_CLR1_GRVWA8_GRVWB16_GSU0_GSUC0_GSUWGMRR0_K1_LBSPPA256_LBSPPB512_LPA8_LPB32_LRVW8_MIWT4_2_PLR1_SU0_SUM0_SUS64_VWA4_VWB2_WGM1_WGMXCC1_WGMXCCGn1
    SolutionIndex: 32
    SolutionNameMin: Cijk_Alik_Bjlk_F8NBS_BH_Bias_HAS_SAV_UserArgs_MT128x64x64_MI16x16x1_SN_LDSB0_CLR1_GRVWA8_GRVWB16_GSU0_GSUC0_GSUWGMRR0_K1_LBSPPA256_LBSPPB512_LPA8_LPB32_LRVW8_MIWT4_2_PLR1_SU0_SUM0_SUS64_VWA4_VWB2_WGM4_WGMXCC1_WGMXCCGn1
    SolutionIndex: 33
    SolutionNameMin: Cijk_Alik_Bjlk_F8NBS_BH_Bias_HAS_SAV_UserArgs_MT128x64x64_MI16x16x1_SN_LDSB0_CLR1_GRVWA8_GRVWB16_GSU0_GSUC0_GSUWGMRR0_K1_LBSPPA256_LBSPPB512_LPA8_LPB32_LRVW8_MIWT4_2_PLR1_SU0_SUM0_SUS64_VWA4_VWB2_WGM6_WGMXCC1_WGMXCCGn1
    SolutionIndex: 34
    SolutionNameMin: Cijk_Alik_Bjlk_F8NBS_BH_Bias_HAS_SAV_UserArgs_MT128x64x64_MI16x16x1_SN_LDSB0_CLR1_GRVWA8_GRVWB16_GSU0_GSUC0_GSUWGMRR0_K1_LBSPPA256_LBSPPB512_LPA8_LPB32_LRVW8_MIWT4_2_PLR1_SU0_SUM0_SUS64_VWA4_VWB2_WGM8_WGMXCC1_WGMXCCGn1
    SolutionIndex: 35
    SolutionNameMin: Cijk_Alik_Bjlk_F8NBS_BH_Bias_HAS_SAV_UserArgs_MT64x64x64_MI16x16x1_SN_LDSB0_CLR1_GRVWA8_GRVWB8_GSU0_GSUC0_GSUWGMRR0_K1_LBSPPA128_LBSPPB512_LPA8_LPB32_LRVW8_MIWT2_2_PLR1_SU0_SUM0_SUS64_VWA2_VWB2_WGM1_WGMXCC1_WGMXCCGn1
    SolutionIndex: 36
    SolutionNameMin: Cijk_Alik_Bjlk_F8NBS_BH_Bias_HAS_SAV_UserArgs_MT64x64x64_MI16x16x1_SN_LDSB0_CLR1_GRVWA16_GRVWB8_GSU0_GSUC0_GSUWGMRR0_K1_LBSPPA128_LBSPPB512_LPA16_LPB32_LRVW8_MIWT2_2_PLR1_SU0_SUM0_SUS64_VWA2_VWB2_WGM1_WGMXCC1_WGMXCCGn1
    SolutionIndex: 37
    SolutionNameMin: Cijk_Alik_Bjlk_F8NBS_BH_Bias_HAS_SAV_UserArgs_MT64x64x64_MI16x16x1_SN_LDSB0_CLR1_GRVWA8_GRVWB8_GSU0_GSUC0_GSUWGMRR0_K1_LBSPPA128_LBSPPB512_LPA8_LPB32_LRVW8_MIWT2_2_PLR1_SU0_SUM0_SUS64_VWA2_VWB2_WGM8_WGMXCC1_WGMXCCGn1
    SolutionIndex: 38
    SolutionNameMin: Cijk_Alik_Bjlk_F8NBS_BH_Bias_HAS_SAV_UserArgs_MT64x64x64_MI16x16x1_SN_LDSB0_CLR1_GRVWA16_GRVWB8_GSU0_GSUC0_GSUWGMRR0_K1_LBSPPA128_LBSPPB512_LPA16_LPB32_LRVW8_MIWT2_2_PLR1_SU0_SUM0_SUS64_VWA2_VWB2_WGM8_WGMXCC1_WGMXCCGn1
    SolutionIndex: 39
    SolutionNameMin: Cijk_Alik_Bjlk_F8NBS_BH_Bias_HAS_SAV_UserArgs_MT64x32x64_MI16x16x1_SN_LDSB0_CLR1_GRVWA8_GRVWB8_GSU0_GSUC0_GSUWGMRR0_K1_LBSPPA128_LBSPPB256_LPA8_LPB16_LRVW8_MIWT2_1_PLR1_SU0_SUM0_SUS64_VWA2_VWB1_WGM1_WGMXCC1_WGMXCCGn1
    SolutionIndex: 40
    SolutionNameMin: Cijk_Alik_Bjlk_F8NBS_BH_Bias_HAS_SAV_UserArgs_MT64x32x64_MI16x16x1_SN_LDSB0_CLR1_GRVWA16_GRVWB8_GSU0_GSUC0_GSUWGMRR0_K1_LBSPPA128_LBSPPB256_LPA16_LPB16_LRVW8_MIWT2_1_PLR1_SU0_SUM0_SUS64_VWA2_VWB1_WGM1_WGMXCC1_WGMXCCGn1
    SolutionIndex: 41
    SolutionNameMin: Cijk_Alik_Bjlk_F8NBS_BH_Bias_HAS_SAV_UserArgs_MT32x32x64_MI16x16x1_SN_LDSB0_CLR1_GRVWA8_GRVWB8_GSU0_GSUC0_GSUWGMRR0_K1_LBSPPA128_LBSPPB256_LPA8_LPB16_LRVW8_MIWT1_1_PLR1_SU0_SUM0_SUS64_VWA1_VWB1_WGM1_WGMXCC1_WGMXCCGn1
    SolutionIndex: 42
    SolutionNameMin: Cijk_Alik_Bjlk_F8NBS_BH_Bias_HAS_SAV_UserArgs_MT32x32x64_MI16x16x1_SN_LDSB0_CLR1_GRVWA8_GRVWB8_GSU0_GSUC0_GSUWGMRR0_K1_LBSPPA128_LBSPPB256_LPA8_LPB16_LRVW8_MIWT1_1_PLR1_SU0_SUM0_SUS64_VWA1_VWB1_WGM4_WGMXCC1_WGMXCCGn1
    SolutionIndex: 43
    SolutionNameMin: Cijk_Alik_Bjlk_F8NBS_BH_Bias_HAS_SAV_UserArgs_MT32x32x64_MI16x16x1_SN_LDSB0_CLR1_GRVWA8_GRVWB8_GSU0_GSUC0_GSUWGMRR0_K1_LBSPPA128_LBSPPB256_LPA8_LPB16_LRVW8_MIWT1_1_PLR1_SU0_SUM0_SUS64_VWA1_VWB1_WGM6_WGMXCC1_WGMXCCGn1
    SolutionIndex: 44
    SolutionNameMin: Cijk_Alik_Bjlk_F8NBS_BH_Bias_HAS_SAV_UserArgs_MT128x256x128_MI16x16x1_SN_LDSB1_CLR1_GRVWA8_GRVWB16_GSU0_GSUC0_GSUWGMRR0_K1_LBSPPA512_LBSPPB2048_LPA8_LPB0_LRVW8_MIWT4_8_PLR1_SU0_SUM0_SUS128_VWA4_VWB8_WGM1_WGMXCC1_WGMXCCGn1
    SolutionIndex: 45
    SolutionNameMin: Cijk_Alik_Bjlk_F8NBS_BH_Bias_HAS_SAV_UserArgs_MT128x256x128_MI16x16x1_SN_LDSB1_CLR1_GRVWA16_GRVWB16_GSU0_GSUC0_GSUWGMRR0_K1_LBSPPA512_LBSPPB2048_LPA16_LPB0_LRVW8_MIWT4_8_PLR1_SU0_SUM0_SUS128_VWA4_VWB8_WGM1_WGMXCC1_WGMXCCGn1
    SolutionIndex: 46
    SolutionNameMin: Cijk_Alik_Bjlk_F8NBS_BH_Bias_HAS_SAV_UserArgs_MT128x256x128_MI16x16x1_SN_LDSB1_CLR1_GRVWA8_GRVWB16_GSU0_GSUC0_GSUWGMRR0_K1_LBSPPA512_LBSPPB2048_LPA8_LPB0_LRVW8_MIWT4_8_PLR1_SU0_SUM0_SUS128_VWA4_VWB8_WGM4_WGMXCC1_WGMXCCGn1
    SolutionIndex: 47
    SolutionNameMin: Cijk_Alik_Bjlk_F8NBS_BH_Bias_HAS_SAV_UserArgs_MT128x256x128_MI16x16x1_SN_LDSB1_CLR1_GRVWA8_GRVWB16_GSU0_GSUC0_GSUWGMRR0_K1_LBSPPA512_LBSPPB2048_LPA8_LPB0_LRVW8_MIWT4_8_PLR1_SU0_SUM0_SUS128_VWA4_VWB8_WGM6_WGMXCC1_WGMXCCGn1
    SolutionIndex: 48
    SolutionNameMin: Cijk_Alik_Bjlk_F8NBS_BH_Bias_HAS_SAV_UserArgs_MT128x256x128_MI16x16x1_SN_LDSB1_CLR1_GRVWA16_GRVWB16_GSU0_GSUC0_GSUWGMRR0_K1_LBSPPA512_LBSPPB2048_LPA16_LPB0_LRVW8_MIWT4_8_PLR1_SU0_SUM0_SUS128_VWA4_VWB8_WGM6_WGMXCC1_WGMXCCGn1
    SolutionIndex: 49
    SolutionNameMin: Cijk_Alik_Bjlk_F8NBS_BH_Bias_HAS_SAV_UserArgs_MT128x256x128_MI16x16x1_SN_LDSB1_CLR1_GRVWA8_GRVWB16_GSU0_GSUC0_GSUWGMRR0_K1_LBSPPA512_LBSPPB2048_LPA8_LPB0_LRVW8_MIWT4_8_PLR1_SU0_SUM0_SUS128_VWA4_VWB8_WGM8_WGMXCC1_WGMXCCGn1
    SolutionIndex: 50
    SolutionNameMin: Cijk_Alik_Bjlk_F8NBS_BH_Bias_HAS_SAV_UserArgs_MT256x128x128_MI16x16x1_SN_LDSB1_CLR1_GRVWA8_GRVWB16_GSU0_GSUC0_GSUWGMRR0_K1_LBSPPA1024_LBSPPB1024_LPA8_LPB64_LRVW8_MIWT8_4_PLR1_SU0_SUM0_SUS128_VWA8_VWB4_WGM1_WGMXCC1_WGMXCCGn1
    SolutionIndex: 51
    SolutionNameMin: Cijk_Alik_Bjlk_F8NBS_BH_Bias_HAS_SAV_UserArgs_MT256x128x128_MI16x16x1_SN_LDSB1_CLR1_GRVWA8_GRVWB16_GSU0_GSUC0_GSUWGMRR0_K1_LBSPPA1024_LBSPPB1024_LPA8_LPB64_LRVW8_MIWT8_4_PLR1_SU0_SUM0_SUS128_VWA8_VWB4_WGM4_WGMXCC1_WGMXCCGn1
    SolutionIndex: 52
    SolutionNameMin: Cijk_Alik_Bjlk_F8NBS_BH_Bias_HAS_SAV_UserArgs_MT256x128x128_MI16x16x1_SN_LDSB1_CLR1_GRVWA8_GRVWB16_GSU0_GSUC0_GSUWGMRR0_K1_LBSPPA1024_LBSPPB1024_LPA8_LPB64_LRVW8_MIWT8_4_PLR1_SU0_SUM0_SUS128_VWA8_VWB4_WGM8_WGMXCC1_WGMXCCGn1
    SolutionIndex: 53
    SolutionNameMin: Cijk_Alik_Bjlk_F8NBS_BH_Bias_HAS_SAV_UserArgs_MT144x256x128_MI16x16x1_SN_LDSB1_CLR1_GRVWA8_GRVWB16_GSU0_GSUC0_GSUWGMRR0_K1_LBSPPA128_LBSPPB2048_LPA8_LPB64_LRVW8_MIWT9_4_PLR1_SU0_SUM0_SUS128_VWA1_VWB4_WGM1_WGMXCC1_WGMXCCGn1
    SolutionIndex: 54
    SolutionNameMin: Cijk_Alik_Bjlk_F8NBS_BH_Bias_HAS_SAV_UserArgs_MT144x256x128_MI16x16x1_SN_LDSB1_CLR1_GRVWA8_GRVWB8_GSU0_GSUC0_GSUWGMRR0_K1_LBSPPA128_LBSPPB2048_LPA8_LPB64_LRVW8_MIWT9_4_PLR1_SU0_SUM0_SUS128_VWA1_VWB4_WGM4_WGMXCC1_WGMXCCGn1
    SolutionIndex: 55
    SolutionNameMin: Cijk_Alik_Bjlk_F8NBS_BH_Bias_HAS_SAV_UserArgs_MT144x256x128_MI16x16x1_SN_LDSB1_CLR1_GRVWA8_GRVWB16_GSU0_GSUC0_GSUWGMRR0_K1_LBSPPA128_LBSPPB2048_LPA8_LPB64_LRVW8_MIWT9_4_PLR1_SU0_SUM0_SUS128_VWA1_VWB4_WGM4_WGMXCC1_WGMXCCGn1
    SolutionIndex: 56
    SolutionNameMin: Cijk_Alik_Bjlk_F8NBS_BH_Bias_HAS_SAV_UserArgs_MT144x256x128_MI16x16x1_SN_LDSB1_CLR1_GRVWA8_GRVWB16_GSU0_GSUC0_GSUWGMRR0_K1_LBSPPA128_LBSPPB2048_LPA8_LPB64_LRVW8_MIWT9_4_PLR1_SU0_SUM0_SUS128_VWA1_VWB4_WGM6_WGMXCC1_WGMXCCGn1
    SolutionIndex: 57
    SolutionNameMin: Cijk_Alik_Bjlk_F8NBS_BH_Bias_HAS_SAV_UserArgs_MT144x256x128_MI16x16x1_SN_LDSB1_CLR1_GRVWA8_GRVWB8_GSU0_GSUC0_GSUWGMRR0_K1_LBSPPA128_LBSPPB2048_LPA8_LPB64_LRVW8_MIWT9_4_PLR1_SU0_SUM0_SUS128_VWA1_VWB4_WGM8_WGMXCC1_WGMXCCGn1
    SolutionIndex: 58
    SolutionNameMin: Cijk_Alik_Bjlk_F8NBS_BH_Bias_HAS_SAV_UserArgs_MT144x256x128_MI16x16x1_SN_LDSB1_CLR1_GRVWA8_GRVWB16_GSU0_GSUC0_GSUWGMRR0_K1_LBSPPA128_LBSPPB2048_LPA8_LPB64_LRVW8_MIWT9_4_PLR1_SU0_SUM0_SUS128_VWA1_VWB4_WGM8_WGMXCC1_WGMXCCGn1
    SolutionIndex: 59
    SolutionNameMin: Cijk_Alik_Bjlk_F8NBS_BH_Bias_HAS_SAV_UserArgs_MT128x128x128_MI16x16x1_SN_LDSB1_CLR1_GRVWA8_GRVWB8_GSU0_GSUC0_GSUWGMRR0_K1_LBSPPA1024_LBSPPB1024_LPA8_LPB32_LRVW8_MIWT8_2_PLR1_SU0_SUM0_SUS128_VWA8_VWB2_WGM1_WGMXCC1_WGMXCCGn1
    SolutionIndex: 60
    SolutionNameMin: Cijk_Alik_Bjlk_F8NBS_BH_Bias_HAS_SAV_UserArgs_MT128x128x128_MI16x16x1_SN_LDSB1_CLR1_GRVWA8_GRVWB16_GSU0_GSUC0_GSUWGMRR0_K1_LBSPPA1024_LBSPPB1024_LPA8_LPB32_LRVW8_MIWT8_2_PLR1_SU0_SUM0_SUS128_VWA8_VWB2_WGM1_WGMXCC1_WGMXCCGn1
    SolutionIndex: 61
    SolutionNameMin: Cijk_Alik_Bjlk_F8NBS_BH_Bias_HAS_SAV_UserArgs_MT128x128x128_MI16x16x1_SN_LDSB1_CLR1_GRVWA8_GRVWB8_GSU0_GSUC0_GSUWGMRR0_K1_LBSPPA1024_LBSPPB1024_LPA8_LPB32_LRVW8_MIWT8_2_PLR1_SU0_SUM0_SUS128_VWA8_VWB2_WGM8_WGMXCC1_WGMXCCGn1
    SolutionIndex: 62
    SolutionNameMin: Cijk_Alik_Bjlk_F8NBS_BH_Bias_HAS_SAV_UserArgs_MT144x64x128_MI16x16x1_SN_LDSB1_CLR1_GRVWA8_GRVWB16_GSU0_GSUC0_GSUWGMRR0_K1_LBSPPA128_LBSPPB512_LPA8_LPB16_LRVW8_MIWT9_1_PLR1_SU0_SUM0_SUS128_VWA1_VWB1_WGM6_WGMXCC1_WGMXCCGn1
    SolutionIndex: 63
    SolutionNameMin: Cijk_Alik_Bjlk_F8NBS_BH_Bias_HAS_SAV_UserArgs_MT144x64x128_MI16x16x1_SN_LDSB1_CLR1_GRVWA8_GRVWB16_GSU0_GSUC0_GSUWGMRR0_K1_LBSPPA128_LBSPPB512_LPA8_LPB16_LRVW8_MIWT9_1_PLR1_SU0_SUM0_SUS128_VWA1_VWB1_WGM8_WGMXCC1_WGMXCCGn1
    SolutionIndex: 64
    SolutionNameMin: Cijk_Alik_Bjlk_F8NBS_BH_Bias_HAS_SAV_UserArgs_MT144x128x128_MI16x16x1_SN_LDSB1_CLR1_GRVWA8_GRVWB16_GSU0_GSUC0_GSUWGMRR0_K1_LBSPPA128_LBSPPB1024_LPA8_LPB32_LRVW8_MIWT9_2_PLR1_SU0_SUM0_SUS128_VWA1_VWB2_WGM4_WGMXCC1_WGMXCCGn1
    SolutionIndex: 65
    SolutionNameMin: Cijk_Alik_Bjlk_F8NBS_BH_Bias_HAS_SAV_UserArgs_MT144x128x128_MI16x16x1_SN_LDSB1_CLR1_GRVWA8_GRVWB16_GSU0_GSUC0_GSUWGMRR0_K1_LBSPPA128_LBSPPB1024_LPA8_LPB32_LRVW8_MIWT9_2_PLR1_SU0_SUM0_SUS128_VWA1_VWB2_WGM6_WGMXCC1_WGMXCCGn1
    SolutionIndex: 66
    SolutionNameMin: Cijk_Alik_Bjlk_F8NBS_BH_Bias_HAS_SAV_UserArgs_MT144x128x128_MI16x16x1_SN_LDSB1_CLR1_GRVWA8_GRVWB16_GSU0_GSUC0_GSUWGMRR0_K1_LBSPPA128_LBSPPB1024_LPA8_LPB32_LRVW8_MIWT9_2_PLR1_SU0_SUM0_SUS128_VWA1_VWB2_WGM8_WGMXCC1_WGMXCCGn1
    SolutionIndex: 67
    SolutionNameMin: Cijk_Alik_Bjlk_F8NBS_BH_Bias_HAS_SAV_UserArgs_MT128x128x128_MI16x16x1_SN_LDSB1_CLR1_GRVWA16_GRVWB16_GSU0_GSUC0_GSUWGMRR0_K1_LBSPPA512_LBSPPB1024_LPA16_LPB64_LRVW8_MIWT4_4_PLR1_SU0_SUM0_SUS128_VWA4_VWB4_WGM1_WGMXCC1_WGMXCCGn1
    SolutionIndex: 68
    SolutionNameMin: Cijk_Alik_Bjlk_F8NBS_BH_Bias_HAS_SAV_UserArgs_MT128x128x128_MI16x16x1_SN_LDSB1_CLR1_GRVWA16_GRVWB16_GSU0_GSUC0_GSUWGMRR0_K1_LBSPPA512_LBSPPB1024_LPA16_LPB64_LRVW8_MIWT4_4_PLR1_SU0_SUM0_SUS128_VWA4_VWB4_WGM4_WGMXCC1_WGMXCCGn1
    SolutionIndex: 69
    SolutionNameMin: Cijk_Alik_Bjlk_F8NBS_BH_Bias_HAS_SAV_UserArgs_MT128x128x128_MI16x16x1_SN_LDSB1_CLR1_GRVWA16_GRVWB16_GSU0_GSUC0_GSUWGMRR0_K1_LBSPPA512_LBSPPB1024_LPA16_LPB64_LRVW8_MIWT4_4_PLR1_SU0_SUM0_SUS128_VWA4_VWB4_WGM6_WGMXCC1_WGMXCCGn1
    SolutionIndex: 70
    SolutionNameMin: Cijk_Alik_Bjlk_F8NBS_BH_Bias_HAS_SAV_UserArgs_MT128x128x128_MI16x16x1_SN_LDSB1_CLR1_GRVWA16_GRVWB16_GSU0_GSUC0_GSUWGMRR0_K1_LBSPPA512_LBSPPB1024_LPA16_LPB64_LRVW8_MIWT4_4_PLR1_SU0_SUM0_SUS128_VWA4_VWB4_WGM8_WGMXCC1_WGMXCCGn1
    SolutionIndex: 71
    SolutionNameMin: Cijk_Alik_Bjlk_F8NBS_BH_Bias_HAS_SAV_UserArgs_MT64x128x128_MI16x16x1_SN_LDSB1_CLR1_GRVWA8_GRVWB16_GSU0_GSUC0_GSUWGMRR0_K1_LBSPPA256_LBSPPB1024_LPA8_LPB64_LRVW8_MIWT2_4_PLR1_SU0_SUM0_SUS128_VWA2_VWB4_WGM1_WGMXCC1_WGMXCCGn1
    SolutionIndex: 72
    SolutionNameMin: Cijk_Alik_Bjlk_F8NBS_BH_Bias_HAS_SAV_UserArgs_MT128x64x128_MI16x16x1_SN_LDSB1_CLR1_GRVWA16_GRVWB16_GSU0_GSUC0_GSUWGMRR0_K1_LBSPPA512_LBSPPB512_LPA16_LPB32_LRVW8_MIWT4_2_PLR1_SU0_SUM0_SUS128_VWA4_VWB2_WGM4_WGMXCC1_WGMXCCGn1
    SolutionIndex: 73
    SolutionNameMin: Cijk_Alik_Bjlk_F8NBS_BH_Bias_HAS_SAV_UserArgs_MT128x64x128_MI16x16x1_SN_LDSB1_CLR1_GRVWA16_GRVWB16_GSU0_GSUC0_GSUWGMRR0_K1_LBSPPA512_LBSPPB512_LPA16_LPB32_LRVW8_MIWT4_2_PLR1_SU0_SUM0_SUS128_VWA4_VWB2_WGM8_WGMXCC1_WGMXCCGn1
    SolutionIndex: 74
    SolutionNameMin: Cijk_Alik_Bjlk_F8NBS_BH_Bias_HAS_SAV_UserArgs_MT64x64x128_MI16x16x1_SN_LDSB1_CLR1_GRVWA16_GRVWB8_GSU0_GSUC0_GSUWGMRR0_K1_LBSPPA256_LBSPPB512_LPA16_LPB32_LRVW8_MIWT2_2_PLR1_SU0_SUM0_SUS128_VWA2_VWB2_WGM1_WGMXCC1_WGMXCCGn1
    SolutionIndex: 75
    SolutionNameMin: Cijk_Alik_Bjlk_F8NBS_BH_Bias_HAS_SAV_UserArgs_MT64x64x128_MI16x16x1_SN_LDSB1_CLR1_GRVWA8_GRVWB16_GSU0_GSUC0_GSUWGMRR0_K1_LBSPPA256_LBSPPB512_LPA8_LPB32_LRVW8_MIWT2_2_PLR1_SU0_SUM0_SUS128_VWA2_VWB2_WGM1_WGMXCC1_WGMXCCGn1
    SolutionIndex: 76
    SolutionNameMin: Cijk_Alik_Bjlk_F8NBS_BH_Bias_HAS_SAV_UserArgs_MT64x64x128_MI16x16x1_SN_LDSB1_CLR1_GRVWA16_GRVWB16_GSU0_GSUC0_GSUWGMRR0_K1_LBSPPA256_LBSPPB512_LPA16_LPB32_LRVW8_MIWT2_2_PLR1_SU0_SUM0_SUS128_VWA2_VWB2_WGM1_WGMXCC1_WGMXCCGn1
    SolutionIndex: 77
    SolutionNameMin: Cijk_Alik_Bjlk_F8NBS_BH_Bias_HAS_SAV_UserArgs_MT64x64x128_MI16x16x1_SN_LDSB1_CLR1_GRVWA8_GRVWB16_GSU0_GSUC0_GSUWGMRR0_K1_LBSPPA256_LBSPPB512_LPA8_LPB32_LRVW8_MIWT2_2_PLR1_SU0_SUM0_SUS128_VWA2_VWB2_WGM6_WGMXCC1_WGMXCCGn1
    SolutionIndex: 78
    SolutionNameMin: Cijk_Alik_Bjlk_F8NBS_BH_Bias_HAS_SAV_UserArgs_MT64x64x128_MI16x16x1_SN_LDSB1_CLR1_GRVWA8_GRVWB16_GSU0_GSUC0_GSUWGMRR0_K1_LBSPPA256_LBSPPB512_LPA8_LPB32_LRVW8_MIWT2_2_PLR1_SU0_SUM0_SUS128_VWA2_VWB2_WGM8_WGMXCC1_WGMXCCGn1
    SolutionIndex: 79
    SolutionNameMin: Cijk_Alik_Bjlk_F8NBS_BH_Bias_HAS_SAV_UserArgs_MT32x64x128_MI16x16x1_SN_LDSB0_CLR1_GRVWA8_GRVWB8_GSU0_GSUC0_GSUWGMRR0_K1_LBSPPA128_LBSPPB512_LPA8_LPB32_LRVW8_MIWT1_2_PLR1_SU0_SUM0_SUS128_VWA1_VWB2_WGM1_WGMXCC1_WGMXCCGn1
    SolutionIndex: 80
    SolutionNameMin: Cijk_Alik_Bjlk_F8NBS_BH_Bias_HAS_SAV_UserArgs_MT32x64x128_MI16x16x1_SN_LDSB0_CLR1_GRVWA8_GRVWB16_GSU0_GSUC0_GSUWGMRR0_K1_LBSPPA128_LBSPPB512_LPA8_LPB32_LRVW8_MIWT1_2_PLR1_SU0_SUM0_SUS128_VWA1_VWB2_WGM4_WGMXCC1_WGMXCCGn1
    SolutionIndex: 81
    SolutionNameMin: Cijk_Alik_Bjlk_F8NBS_BH_Bias_HAS_SAV_UserArgs_MT64x32x128_MI16x16x1_SN_LDSB0_CLR1_GRVWA8_GRVWB8_GSU0_GSUC0_GSUWGMRR0_K1_LBSPPA256_LBSPPB256_LPA8_LPB16_LRVW8_MIWT2_1_PLR1_SU0_SUM0_SUS128_VWA2_VWB1_WGM1_WGMXCC1_WGMXCCGn1
    SolutionIndex: 82
    SolutionNameMin: Cijk_Alik_Bjlk_F8NBS_BH_Bias_HAS_SAV_UserArgs_MT64x32x128_MI16x16x1_SN_LDSB0_CLR1_GRVWA16_GRVWB8_GSU0_GSUC0_GSUWGMRR0_K1_LBSPPA256_LBSPPB256_LPA16_LPB16_LRVW8_MIWT2_1_PLR1_SU0_SUM0_SUS128_VWA2_VWB1_WGM1_WGMXCC1_WGMXCCGn1
    SolutionIndex: 83
    SolutionNameMin: Cijk_Alik_Bjlk_F8NBS_BH_Bias_HAS_SAV_UserArgs_MT64x32x128_MI16x16x1_SN_LDSB0_CLR1_GRVWA8_GRVWB16_GSU0_GSUC0_GSUWGMRR0_K1_LBSPPA256_LBSPPB256_LPA8_LPB16_LRVW8_MIWT2_1_PLR1_SU0_SUM0_SUS128_VWA2_VWB1_WGM1_WGMXCC1_WGMXCCGn1
    SolutionIndex: 84
    SolutionNameMin: Cijk_Alik_Bjlk_F8NBS_BH_Bias_HAS_SAV_UserArgs_MT64x32x128_MI16x16x1_SN_LDSB0_CLR1_GRVWA8_GRVWB16_GSU0_GSUC0_GSUWGMRR0_K1_LBSPPA256_LBSPPB256_LPA8_LPB16_LRVW8_MIWT2_1_PLR1_SU0_SUM0_SUS128_VWA2_VWB1_WGM4_WGMXCC1_WGMXCCGn1
    SolutionIndex: 85
    SolutionNameMin: Cijk_Alik_Bjlk_F8NBS_BH_Bias_HAS_SAV_UserArgs_MT64x32x128_MI16x16x1_SN_LDSB0_CLR1_GRVWA8_GRVWB16_GSU0_GSUC0_GSUWGMRR0_K1_LBSPPA256_LBSPPB256_LPA8_LPB16_LRVW8_MIWT2_1_PLR1_SU0_SUM0_SUS128_VWA2_VWB1_WGM8_WGMXCC1_WGMXCCGn1
    SolutionIndex: 86
    SolutionNameMin: Cijk_Alik_Bjlk_F8NBS_BH_Bias_HAS_SAV_UserArgs_MT32x32x128_MI16x16x1_SN_LDSB0_CLR1_GRVWA8_GRVWB8_GSU0_GSUC0_GSUWGMRR0_K1_LBSPPA128_LBSPPB256_LPA8_LPB16_LRVW8_MIWT1_1_PLR1_SU0_SUM0_SUS128_VWA1_VWB1_WGM1_WGMXCC1_WGMXCCGn1
    SolutionIndex: 87
    SolutionNameMin: Cijk_Alik_Bjlk_F8NBS_BH_Bias_HAS_SAV_UserArgs_MT32x32x128_MI16x16x1_SN_LDSB0_CLR1_GRVWA16_GRVWB8_GSU0_GSUC0_GSUWGMRR0_K1_LBSPPA128_LBSPPB256_LPA16_LPB16_LRVW8_MIWT1_1_PLR1_SU0_SUM0_SUS128_VWA1_VWB1_WGM1_WGMXCC1_WGMXCCGn1
    SolutionIndex: 88
    SolutionNameMin: Cijk_Alik_Bjlk_F8NBS_BH_Bias_HAS_SAV_UserArgs_MT32x32x128_MI16x16x1_SN_LDSB0_CLR1_GRVWA8_GRVWB16_GSU0_GSUC0_GSUWGMRR0_K1_LBSPPA128_LBSPPB256_LPA8_LPB16_LRVW8_MIWT1_1_PLR1_SU0_SUM0_SUS128_VWA1_VWB1_WGM1_WGMXCC1_WGMXCCGn1
    SolutionIndex: 89
    SolutionNameMin: Cijk_Alik_Bjlk_F8NBS_BH_Bias_HAS_SAV_UserArgs_MT32x32x128_MI16x16x1_SN_LDSB0_CLR1_GRVWA16_GRVWB16_GSU0_GSUC0_GSUWGMRR0_K1_LBSPPA128_LBSPPB256_LPA16_LPB16_LRVW8_MIWT1_1_PLR1_SU0_SUM0_SUS128_VWA1_VWB1_WGM1_WGMXCC1_WGMXCCGn1
    SolutionIndex: 90
    SolutionNameMin: Cijk_Alik_Bjlk_F8NBS_BH_Bias_HAS_SAV_UserArgs_MT32x32x128_MI16x16x1_SN_LDSB0_CLR1_GRVWA8_GRVWB16_GSU0_GSUC0_GSUWGMRR0_K1_LBSPPA128_LBSPPB256_LPA8_LPB16_LRVW8_MIWT1_1_PLR1_SU0_SUM0_SUS128_VWA1_VWB1_WGM4_WGMXCC1_WGMXCCGn1
    SolutionIndex: 91
    SolutionNameMin: Cijk_Alik_Bjlk_F8NBS_BH_Bias_HAS_SAV_UserArgs_MT32x32x128_MI16x16x1_SN_LDSB0_CLR1_GRVWA8_GRVWB16_GSU0_GSUC0_GSUWGMRR0_K1_LBSPPA128_LBSPPB256_LPA8_LPB16_LRVW8_MIWT1_1_PLR1_SU0_SUM0_SUS128_VWA1_VWB1_WGM6_WGMXCC1_WGMXCCGn1
    SolutionIndex: 92
    SolutionNameMin: Cijk_Alik_Bjlk_F8NBS_BH_Bias_HAS_SAV_UserArgs_MT32x32x128_MI16x16x1_SN_LDSB0_CLR1_GRVWA8_GRVWB16_GSU0_GSUC0_GSUWGMRR0_K1_LBSPPA128_LBSPPB256_LPA8_LPB16_LRVW8_MIWT1_1_PLR1_SU0_SUM0_SUS128_VWA1_VWB1_WGM8_WGMXCC1_WGMXCCGn1
    SolutionIndex: 93
    SolutionNameMin: Cijk_Alik_Bjlk_F8NBS_BH_Bias_HAS_SAV_UserArgs_MT128x64x256_MI16x16x1_SN_LDSB1_CLR1_GRVWA16_GRVWB16_GSU0_GSUC0_GSUWGMRR0_K1_LBSPPA1024_LBSPPB512_LPA16_LPB32_LRVW8_MIWT4_2_PLR1_SU0_SUM0_SUS256_VWA4_VWB2_WGM1_WGMXCC1_WGMXCCGn1
    SolutionIndex: 94
    SolutionNameMin: Cijk_Alik_Bjlk_F8NBS_BH_Bias_HAS_SAV_UserArgs_MT128x64x256_MI16x16x1_SN_LDSB1_CLR1_GRVWA16_GRVWB16_GSU0_GSUC0_GSUWGMRR0_K1_LBSPPA1024_LBSPPB512_LPA16_LPB32_LRVW8_MIWT4_2_PLR1_SU0_SUM0_SUS256_VWA4_VWB2_WGM4_WGMXCC1_WGMXCCGn1
    SolutionIndex: 95
    SolutionNameMin: Cijk_Alik_Bjlk_F8NBS_BH_Bias_HAS_SAV_UserArgs_MT128x64x256_MI16x16x1_SN_LDSB1_CLR1_GRVWA16_GRVWB16_GSU0_GSUC0_GSUWGMRR0_K1_LBSPPA1024_LBSPPB512_LPA16_LPB32_LRVW8_MIWT4_2_PLR1_SU0_SUM0_SUS256_VWA4_VWB2_WGM6_WGMXCC1_WGMXCCGn1
    SolutionIndex: 96
    SolutionNameMin: Cijk_Alik_Bjlk_F8NBS_BH_Bias_HAS_SAV_UserArgs_MT128x64x256_MI16x16x1_SN_LDSB1_CLR1_GRVWA16_GRVWB16_GSU0_GSUC0_GSUWGMRR0_K1_LBSPPA1024_LBSPPB512_LPA16_LPB32_LRVW8_MIWT4_2_PLR1_SU0_SUM0_SUS256_VWA4_VWB2_WGM8_WGMXCC1_WGMXCCGn1
    SolutionIndex: 97
    SolutionNameMin: Cijk_Alik_Bjlk_F8NBS_BH_Bias_HAS_SAV_UserArgs_MT64x64x256_MI16x16x1_SN_LDSB1_CLR1_GRVWA16_GRVWB16_GSU0_GSUC0_GSUWGMRR0_K1_LBSPPA512_LBSPPB512_LPA16_LPB32_LRVW8_MIWT2_2_PLR1_SU0_SUM0_SUS256_VWA2_VWB2_WGM1_WGMXCC1_WGMXCCGn1
    SolutionIndex: 98
    SolutionNameMin: Cijk_Alik_Bjlk_F8NBS_BH_Bias_HAS_SAV_UserArgs_MT64x64x256_MI16x16x1_SN_LDSB1_CLR1_GRVWA16_GRVWB16_GSU0_GSUC0_GSUWGMRR0_K1_LBSPPA512_LBSPPB512_LPA16_LPB32_LRVW8_MIWT2_2_PLR1_SU0_SUM0_SUS256_VWA2_VWB2_WGM4_WGMXCC1_WGMXCCGn1
    SolutionIndex: 99
    SolutionNameMin: Cijk_Alik_Bjlk_F8NBS_BH_Bias_HAS_SAV_UserArgs_MT64x64x256_MI16x16x1_SN_LDSB1_CLR1_GRVWA16_GRVWB16_GSU0_GSUC0_GSUWGMRR0_K1_LBSPPA512_LBSPPB512_LPA16_LPB32_LRVW8_MIWT2_2_PLR1_SU0_SUM0_SUS256_VWA2_VWB2_WGM6_WGMXCC1_WGMXCCGn1
    SolutionIndex: 100
    SolutionNameMin: Cijk_Alik_Bjlk_F8NBS_BH_Bias_HAS_SAV_UserArgs_MT64x64x256_MI16x16x1_SN_LDSB1_CLR1_GRVWA16_GRVWB16_GSU0_GSUC0_GSUWGMRR0_K1_LBSPPA512_LBSPPB512_LPA16_LPB32_LRVW8_MIWT2_2_PLR1_SU0_SUM0_SUS256_VWA2_VWB2_WGM8_WGMXCC1_WGMXCCGn1
    SolutionIndex: 101
    SolutionNameMin: Cijk_Alik_Bjlk_F8NBS_BH_Bias_HAS_SAV_UserArgs_MT32x64x256_MI16x16x1_SN_LDSB1_CLR1_GRVWA16_GRVWB16_GSU0_GSUC0_GSUWGMRR0_K1_LBSPPA256_LBSPPB512_LPA16_LPB32_LRVW8_MIWT1_2_PLR1_SU0_SUM0_SUS256_VWA1_VWB2_WGM1_WGMXCC1_WGMXCCGn1
    SolutionIndex: 102
    SolutionNameMin: Cijk_Alik_Bjlk_F8NBS_BH_Bias_HAS_SAV_UserArgs_MT32x64x256_MI16x16x1_SN_LDSB1_CLR1_GRVWA8_GRVWB16_GSU0_GSUC0_GSUWGMRR0_K1_LBSPPA256_LBSPPB512_LPA8_LPB32_LRVW8_MIWT1_2_PLR1_SU0_SUM0_SUS256_VWA1_VWB2_WGM6_WGMXCC1_WGMXCCGn1
    SolutionIndex: 103
    SolutionNameMin: Cijk_Alik_Bjlk_F8NBS_BH_Bias_HAS_SAV_UserArgs_MT32x64x256_MI16x16x1_SN_LDSB1_CLR1_GRVWA8_GRVWB16_GSU0_GSUC0_GSUWGMRR0_K1_LBSPPA256_LBSPPB512_LPA8_LPB32_LRVW8_MIWT1_2_PLR1_SU0_SUM0_SUS256_VWA1_VWB2_WGM8_WGMXCC1_WGMXCCGn1
    SolutionIndex: 104
    SolutionNameMin: Cijk_Alik_Bjlk_F8NBS_BH_Bias_HAS_SAV_UserArgs_MT64x32x256_MI16x16x1_SN_LDSB1_CLR1_GRVWA16_GRVWB16_GSU0_GSUC0_GSUWGMRR0_K1_LBSPPA512_LBSPPB256_LPA16_LPB16_LRVW8_MIWT2_1_PLR1_SU0_SUM0_SUS256_VWA2_VWB1_WGM1_WGMXCC1_WGMXCCGn1
    SolutionIndex: 105
    SolutionNameMin: Cijk_Alik_Bjlk_F8NBS_BH_Bias_HAS_SAV_UserArgs_MT64x32x256_MI16x16x1_SN_LDSB1_CLR1_GRVWA16_GRVWB16_GSU0_GSUC0_GSUWGMRR0_K1_LBSPPA512_LBSPPB256_LPA16_LPB16_LRVW8_MIWT2_1_PLR1_SU0_SUM0_SUS256_VWA2_VWB1_WGM6_WGMXCC1_WGMXCCGn1
    SolutionIndex: 106
    SolutionNameMin: Cijk_Alik_Bjlk_F8NBS_BH_Bias_HAS_SAV_UserArgs_MT32x32x256_MI16x16x1_SN_LDSB1_CLR1_GRVWA8_GRVWB16_GSU0_GSUC0_GSUWGMRR0_K1_LBSPPA256_LBSPPB256_LPA8_LPB16_LRVW8_MIWT1_1_PLR1_SU0_SUM0_SUS256_VWA1_VWB1_WGM1_WGMXCC1_WGMXCCGn1
    SolutionIndex: 107
    SolutionNameMin: Cijk_Alik_Bjlk_F8NBS_BH_Bias_HAS_SAV_UserArgs_MT32x32x256_MI16x16x1_SN_LDSB1_CLR1_GRVWA16_GRVWB16_GSU0_GSUC0_GSUWGMRR0_K1_LBSPPA256_LBSPPB256_LPA16_LPB16_LRVW8_MIWT1_1_PLR1_SU0_SUM0_SUS256_VWA1_VWB1_WGM1_WGMXCC1_WGMXCCGn1
    SolutionIndex: 108
    SolutionNameMin: Cijk_Alik_Bjlk_F8NBS_BH_Bias_HAS_SAV_UserArgs_MT32x32x256_MI16x16x1_SN_LDSB1_CLR1_GRVWA8_GRVWB16_GSU0_GSUC0_GSUWGMRR0_K1_LBSPPA256_LBSPPB256_LPA8_LPB16_LRVW8_MIWT1_1_PLR1_SU0_SUM0_SUS256_VWA1_VWB1_WGM6_WGMXCC1_WGMXCCGn1
    SolutionIndex: 109
    SolutionNameMin: Cijk_Alik_Bjlk_F8NBS_BH_Bias_HAS_SAV_UserArgs_MT32x32x256_MI16x16x1_SN_LDSB1_CLR1_GRVWA16_GRVWB16_GSU0_GSUC0_GSUWGMRR0_K1_LBSPPA256_LBSPPB256_LPA16_LPB16_LRVW8_MIWT1_1_PLR1_SU0_SUM0_SUS256_VWA1_VWB1_WGM8_WGMXCC1_WGMXCCGn1
- - - [128, 128, 1, 128, 128, 128, 128, 128]
    - [41, 0.56]
  - - [128, 128, 1, 256, 128, 128, 256, 128]
    - [86, 1.02]
  - - [128, 128, 1, 512, 128, 128, 512, 128]
    - [86, 1.75]
  - - [128, 128, 1, 1024, 128, 128, 1024, 128]
    - [86, 2.7]
  - - [128, 128, 1, 2048, 128, 128, 2048, 128]
    - [88, 3.83]
  - - [128, 128, 1, 4096, 128, 128, 4096, 128]
    - [88, 4.83]
  - - [128, 128, 1, 8192, 128, 128, 8192, 128]
    - [92, 5.51]
  - - [128, 256, 1, 128, 128, 128, 128, 256]
    - [41, 1.12]
  - - [128, 256, 1, 256, 128, 128, 256, 256]
    - [86, 2.04]
  - - [128, 256, 1, 512, 128, 128, 512, 256]
    - [86, 3.56]
  - - [128, 256, 1, 1024, 128, 128, 1024, 256]
    - [86, 5.52]
  - - [128, 256, 1, 2048, 128, 128, 2048, 256]
    - [88, 7.71]
  - - [128, 256, 1, 4096, 128, 128, 4096, 256]
    - [88, 9.7]
  - - [128, 256, 1, 8192, 128, 128, 8192, 256]
    - [88, 11.09]
  - - [128, 512, 1, 128, 128, 128, 128, 512]
    - [41, 2.22]
  - - [128, 512, 1, 256, 128, 128, 256, 512]
    - [41, 4.03]
  - - [128, 512, 1, 512, 128, 128, 512, 512]
    - [86, 6.94]
  - - [128, 512, 1, 1024, 128, 128, 1024, 512]
    - [86, 10.84]
  - - [128, 512, 1, 2048, 128, 128, 2048, 512]
    - [88, 15.26]
  - - [128, 512, 1, 4096, 128, 128, 4096, 512]
    - [88, 19.21]
  - - [128, 512, 1, 8192, 128, 128, 8192, 512]
    - [107, 18.7]
  - - [128, 1024, 1, 128, 128, 128, 128, 1024]
    - [86, 4.35]
  - - [128, 1024, 1, 256, 128, 128, 256, 1024]
    - [87, 7.86]
  - - [128, 1024, 1, 512, 128, 128, 512, 1024]
    - [86, 13.58]
  - - [128, 1024, 1, 1024, 128, 128, 1024, 1024]
    - [86, 21.32]
  - - [128, 1024, 1, 2048, 128, 128, 2048, 1024]
    - [88, 29.9]
  - - [128, 1024, 1, 4096, 128, 128, 4096, 1024]
    - [109, 31.36]
  - - [128, 1024, 1, 8192, 128, 128, 8192, 1024]
    - [108, 32.33]
  - - [128, 2048, 1, 128, 128, 128, 128, 2048]
    - [81, 8.03]
  - - [128, 2048, 1, 256, 128, 128, 256, 2048]
    - [79, 14.29]
  - - [128, 2048, 1, 512, 128, 128, 512, 2048]
    - [81, 24.12]
  - - [128, 2048, 1, 1024, 128, 128, 1024, 2048]
    - [83, 37.5]
  - - [128, 2048, 1, 2048, 128, 128, 2048, 2048]
    - [101, 43.83]
  - - [128, 2048, 1, 4096, 128, 128, 4096, 2048]
    - [101, 52.45]
  - - [128, 2048, 1, 8192, 128, 128, 8192, 2048]
    - [101, 59.4]
  - - [128, 4096, 1, 128, 128, 128, 128, 4096]
    - [36, 14.56]
  - - [128, 4096, 1, 256, 128, 128, 256, 4096]
    - [36, 25.75]
  - - [128, 4096, 1, 512, 128, 128, 512, 4096]
    - [76, 42.11]
  - - [128, 4096, 1, 1024, 128, 128, 1024, 4096]
    - [75, 63.65]
  - - [128, 4096, 1, 2048, 128, 128, 2048, 4096]
    - [97, 78.02]
  - - [128, 4096, 1, 4096, 128, 128, 4096, 4096]
    - [97, 95.53]
  - - [128, 4096, 1, 8192, 128, 128, 8192, 4096]
    - [97, 108.38]
  - - [128, 8192, 1, 128, 128, 128, 128, 8192]
    - [30, 23.95]
  - - [128, 8192, 1, 256, 128, 128, 256, 8192]
    - [29, 42.03]
  - - [128, 8192, 1, 512, 128, 128, 512, 8192]
    - [31, 69.81]
  - - [128, 8192, 1, 1024, 128, 128, 1024, 8192]
    - [31, 102.16]
  - - [128, 8192, 1, 2048, 128, 128, 2048, 8192]
    - [71, 120.02]
  - - [128, 8192, 1, 4096, 128, 128, 4096, 8192]
    - [71, 143.3]
  - - [128, 8192, 1, 8192, 128, 128, 8192, 8192]
    - [94, 154.22]
  - - [256, 128, 1, 128, 256, 256, 128, 128]
    - [89, 1.08]
  - - [256, 128, 1, 256, 256, 256, 256, 128]
    - [89, 1.97]
  - - [256, 128, 1, 512, 256, 256, 512, 128]
    - [87, 3.4]
  - - [256, 128, 1, 1024, 256, 256, 1024, 128]
    - [86, 5.46]
  - - [256, 128, 1, 2048, 256, 256, 2048, 128]
    - [88, 7.63]
  - - [256, 128, 1, 4096, 256, 256, 4096, 128]
    - [88, 9.58]
  - - [256, 128, 1, 8192, 256, 256, 8192, 128]
    - [88, 11.03]
  - - [256, 256, 1, 128, 256, 256, 128, 256]
    - [43, 2.11]
  - - [256, 256, 1, 256, 256, 256, 256, 256]
    - [41, 3.91]
  - - [256, 256, 1, 512, 256, 256, 512, 256]
    - [86, 6.87]
  - - [256, 256, 1, 1024, 256, 256, 1024, 256]
    - [86, 10.72]
  - - [256, 256, 1, 2048, 256, 256, 2048, 256]
    - [88, 15.21]
  - - [256, 256, 1, 4096, 256, 256, 4096, 256]
    - [88, 19.18]
  - - [256, 256, 1, 8192, 256, 256, 8192, 256]
    - [91, 21.86]
  - - [256, 512, 1, 128, 256, 256, 128, 512]
    - [40, 4.11]
  - - [256, 512, 1, 256, 256, 256, 256, 512]
    - [87, 7.69]
  - - [256, 512, 1, 512, 256, 256, 512, 512]
    - [86, 13.43]
  - - [256, 512, 1, 1024, 256, 256, 1024, 512]
    - [86, 21.12]
  - - [256, 512, 1, 2048, 256, 256, 2048, 512]
    - [88, 29.74]
  - - [256, 512, 1, 4096, 256, 256, 4096, 512]
    - [88, 37.74]
  - - [256, 512, 1, 8192, 256, 256, 8192, 512]
    - [106, 38.73]
  - - [256, 1024, 1, 128, 256, 256, 128, 1024]
    - [82, 7.95]
  - - [256, 1024, 1, 256, 256, 256, 256, 1024]
    - [82, 14.22]
  - - [256, 1024, 1, 512, 256, 256, 512, 1024]
    - [82, 24.23]
  - - [256, 1024, 1, 1024, 256, 256, 1024, 1024]
    - [83, 37.03]
  - - [256, 1024, 1, 2048, 256, 256, 2048, 1024]
    - [83, 51.11]
  - - [256, 1024, 1, 4096, 256, 256, 4096, 1024]
    - [104, 56.59]
  - - [256, 1024, 1, 8192, 256, 256, 8192, 1024]
    - [105, 59.87]
  - - [256, 2048, 1, 128, 256, 256, 128, 2048]
    - [36, 14.23]
  - - [256, 2048, 1, 256, 256, 256, 256, 2048]
    - [35, 25.43]
  - - [256, 2048, 1, 512, 256, 256, 512, 2048]
    - [74, 41.29]
  - - [256, 2048, 1, 1024, 256, 256, 1024, 2048]
    - [75, 62.94]
  - - [256, 2048, 1, 2048, 256, 256, 2048, 2048]
    - [97, 79.35]
  - - [256, 2048, 1, 4096, 256, 256, 4096, 2048]
    - [97, 95.89]
  - - [256, 2048, 1, 8192, 256, 256, 8192, 2048]
    - [97, 108.27]
  - - [256, 4096, 1, 128, 256, 256, 128, 4096]
    - [26, 24.35]
  - - [256, 4096, 1, 256, 256, 256, 256, 4096]
    - [30, 42.22]
  - - [256, 4096, 1, 512, 256, 256, 512, 4096]
    - [31, 68.3]
  - - [256, 4096, 1, 1024, 256, 256, 1024, 4096]
    - [31, 102.04]
  - - [256, 4096, 1, 2048, 256, 256, 2048, 4096]
    - [95, 121.83]
  - - [256, 4096, 1, 4096, 256, 256, 4096, 4096]
    - [93, 148.92]
  - - [256, 4096, 1, 8192, 256, 256, 8192, 4096]
    - [93, 165.79]
  - - [256, 8192, 1, 128, 256, 256, 128, 8192]
    - [60, 36.38]
  - - [256, 8192, 1, 256, 256, 256, 256, 8192]
    - [24, 63.24]
  - - [256, 8192, 1, 512, 256, 256, 512, 8192]
    - [67, 101.84]
  - - [256, 8192, 1, 1024, 256, 256, 1024, 8192]
    - [67, 150.17]
  - - [256, 8192, 1, 2048, 256, 256, 2048, 8192]
    - [67, 180.45]
  - - [256, 8192, 1, 4096, 256, 256, 4096, 8192]
    - [67, 204.74]
  - - [256, 8192, 1, 8192, 256, 256, 8192, 8192]
    - [67, 204.89]
  - - [512, 128, 1, 128, 512, 512, 128, 128]
    - [42, 2.07]
  - - [512, 128, 1, 256, 512, 512, 256, 128]
    - [41, 3.95]
  - - [512, 128, 1, 512, 512, 512, 512, 128]
    - [86, 6.74]
  - - [512, 128, 1, 1024, 512, 512, 1024, 128]
    - [86, 10.81]
  - - [512, 128, 1, 2048, 512, 512, 2048, 128]
    - [86, 15.07]
  - - [512, 128, 1, 4096, 512, 512, 4096, 128]
    - [88, 19.1]
  - - [512, 128, 1, 8192, 512, 512, 8192, 128]
    - [88, 21.96]
  - - [512, 256, 1, 128, 512, 512, 128, 256]
    - [41, 4.23]
  - - [512, 256, 1, 256, 512, 512, 256, 256]
    - [41, 7.4]
  - - [512, 256, 1, 512, 512, 512, 512, 256]
    - [86, 13.65]
  - - [512, 256, 1, 1024, 512, 512, 1024, 256]
    - [86, 21.26]
  - - [512, 256, 1, 2048, 512, 512, 2048, 256]
    - [88, 29.76]
  - - [512, 256, 1, 4096, 512, 512, 4096, 256]
    - [88, 37.59]
  - - [512, 256, 1, 8192, 512, 512, 8192, 256]
    - [90, 43.07]
  - - [512, 512, 1, 128, 512, 512, 128, 512]
    - [40, 7.96]
  - - [512, 512, 1, 256, 512, 512, 256, 512]
    - [81, 14.03]
  - - [512, 512, 1, 512, 512, 512, 512, 512]
    - [81, 23.86]
  - - [512, 512, 1, 1024, 512, 512, 1024, 512]
    - [83, 36.81]
  - - [512, 512, 1, 2048, 512, 512, 2048, 512]
    - [83, 51.15]
  - - [512, 512, 1, 4096, 512, 512, 4096, 512]
    - [85, 62.65]
  - - [512, 512, 1, 8192, 512, 512, 8192, 512]
    - [80, 64.2]
  - - [512, 1024, 1, 128, 512, 512, 128, 1024]
    - [35, 14.26]
  - - [512, 1024, 1, 256, 512, 512, 256, 1024]
    - [35, 25.43]
  - - [512, 1024, 1, 512, 512, 512, 512, 1024]
    - [76, 41.78]
  - - [512, 1024, 1, 1024, 512, 512, 1024, 1024]
    - [78, 62.72]
  - - [512, 1024, 1, 2048, 512, 512, 2048, 1024]
    - [97, 85.58]
  - - [512, 1024, 1, 4096, 512, 512, 4096, 1024]
    - [97, 97.05]
  - - [512, 1024, 1, 8192, 512, 512, 8192, 1024]
    - [99, 106.4]
  - - [512, 2048, 1, 128, 512, 512, 128, 2048]
    - [26, 23.82]
  - - [512, 2048, 1, 256, 512, 512, 256, 2048]
    - [30, 41.7]
  - - [512, 2048, 1, 512, 512, 512, 512, 2048]
    - [31, 68.09]
  - - [512, 2048, 1, 1024, 512, 512, 1024, 2048]
    - [31, 100.9]
  - - [512, 2048, 1, 2048, 512, 512, 2048, 2048]
    - [93, 124.86]
  - - [512, 2048, 1, 4096, 512, 512, 4096, 2048]
    - [93, 150.07]
  - - [512, 2048, 1, 8192, 512, 512, 8192, 2048]
    - [95, 159.36]
  - - [512, 4096, 1, 128, 512, 512, 128, 4096]
    - [24, 36.15]
  - - [512, 4096, 1, 256, 512, 512, 256, 4096]
    - [24, 62.79]
  - - [512, 4096, 1, 512, 512, 512, 512, 4096]
    - [67, 102.38]
  - - [512, 4096, 1, 1024, 512, 512, 1024, 4096]
    - [67, 149.25]
  - - [512, 4096, 1, 2048, 512, 512, 2048, 4096]
    - [67, 183.47]
  - - [512, 4096, 1, 4096, 512, 512, 4096, 4096]
    - [67, 218.03]
  - - [512, 4096, 1, 8192, 512, 512, 8192, 4096]
    - [68, 202.11]
  - - [512, 8192, 1, 128, 512, 512, 128, 8192]
    - [17, 51.59]
  - - [512, 8192, 1, 256, 512, 512, 256, 8192]
    - [17, 89.26]
  - - [512, 8192, 1, 512, 512, 512, 512, 8192]
    - [18, 141.26]
  - - [512, 8192, 1, 1024, 512, 512, 1024, 8192]
    - [51, 191.08]
  - - [512, 8192, 1, 2048, 512, 512, 2048, 8192]
    - [13, 231.44]
  - - [512, 8192, 1, 4096, 512, 512, 4096, 8192]
    - [45, 255.46]
  - - [512, 8192, 1, 8192, 512, 512, 8192, 8192]
    - [50, 241.23]
  - - [1024, 128, 1, 128, 1024, 1024, 128, 128]
    - [41, 4.23]
  - - [1024, 128, 1, 256, 1024, 1024, 256, 128]
    - [86, 7.7]
  - - [1024, 128, 1, 512, 1024, 1024, 512, 128]
    - [88, 13.14]
  - - [1024, 128, 1, 1024, 1024, 1024, 1024, 128]
    - [86, 21.09]
  - - [1024, 128, 1, 2048, 1024, 1024, 2048, 128]
    - [88, 29.82]
  - - [1024, 128, 1, 4096, 1024, 1024, 4096, 128]
    - [88, 37.49]
  - - [1024, 128, 1, 8192, 1024, 1024, 8192, 128]
    - [92, 43.03]
  - - [1024, 256, 1, 128, 1024, 1024, 128, 256]
    - [39, 7.88]
  - - [1024, 256, 1, 256, 1024, 1024, 256, 256]
    - [81, 14.11]
  - - [1024, 256, 1, 512, 1024, 1024, 512, 256]
    - [82, 23.93]
  - - [1024, 256, 1, 1024, 1024, 1024, 1024, 256]
    - [83, 36.84]
  - - [1024, 256, 1, 2048, 1024, 1024, 2048, 256]
    - [83, 50.8]
  - - [1024, 256, 1, 4096, 1024, 1024, 4096, 256]
    - [85, 62.76]
  - - [1024, 256, 1, 8192, 1024, 1024, 8192, 256]
    - [103, 70.69]
  - - [1024, 512, 1, 128, 1024, 1024, 128, 512]
    - [36, 14.24]
  - - [1024, 512, 1, 256, 1024, 1024, 256, 512]
    - [35, 25.03]
  - - [1024, 512, 1, 512, 1024, 1024, 512, 512]
    - [74, 41.31]
  - - [1024, 512, 1, 1024, 1024, 1024, 1024, 512]
    - [75, 63.18]
  - - [1024, 512, 1, 2048, 1024, 1024, 2048, 512]
    - [75, 85.48]
  - - [1024, 512, 1, 4096, 1024, 1024, 4096, 512]
    - [98, 102.49]
  - - [1024, 512, 1, 8192, 1024, 1024, 8192, 512]
    - [100, 107.72]
  - - [1024, 1024, 1, 128, 1024, 1024, 128, 1024]
    - [30, 23.57]
  - - [1024, 1024, 1, 256, 1024, 1024, 256, 1024]
    - [31, 41.15]
  - - [1024, 1024, 1, 512, 1024, 1024, 512, 1024]
    - [32, 67.49]
  - - [1024, 1024, 1, 1024, 1024, 1024, 1024, 1024]
    - [31, 100.67]
  - - [1024, 1024, 1, 2048, 1024, 1024, 2048, 1024]
    - [95, 125.64]
  - - [1024, 1024, 1, 4096, 1024, 1024, 4096, 1024]
    - [94, 146.65]
  - - [1024, 1024, 1, 8192, 1024, 1024, 8192, 1024]
    - [95, 160.16]
  - - [1024, 2048, 1, 128, 1024, 1024, 128, 2048]
    - [24, 36.58]
  - - [1024, 2048, 1, 256, 1024, 1024, 256, 2048]
    - [24, 63.56]
  - - [1024, 2048, 1, 512, 1024, 1024, 512, 2048]
    - [24, 102.08]
  - - [1024, 2048, 1, 1024, 1024, 1024, 1024, 2048]
    - [67, 146.68]
  - - [1024, 2048, 1, 2048, 1024, 1024, 2048, 2048]
    - [67, 187.49]
  - - [1024, 2048, 1, 4096, 1024, 1024, 4096, 2048]
    - [68, 211.77]
  - - [1024, 2048, 1, 8192, 1024, 1024, 8192, 2048]
    - [68, 203.16]
  - - [1024, 4096, 1, 128, 1024, 1024, 128, 4096]
    - [22, 52.95]
  - - [1024, 4096, 1, 256, 1024, 1024, 256, 4096]
    - [21, 91.03]
  - - [1024, 4096, 1, 512, 1024, 1024, 512, 4096]
    - [18, 139.36]
  - - [1024, 4096, 1, 1024, 1024, 1024, 1024, 4096]
    - [12, 187.6]
  - - [1024, 4096, 1, 2048, 1024, 1024, 2048, 4096]
    - [50, 233.75]
  - - [1024, 4096, 1, 4096, 1024, 1024, 4096, 4096]
    - [44, 252.85]
  - - [1024, 4096, 1, 8192, 1024, 1024, 8192, 4096]
    - [50, 242.69]
  - - [1024, 8192, 1, 128, 1024, 1024, 128, 8192]
    - [11, 61.2]
  - - [1024, 8192, 1, 256, 1024, 1024, 256, 8192]
    - [11, 104.96]
  - - [1024, 8192, 1, 512, 1024, 1024, 512, 8192]
    - [11, 161.39]
  - - [1024, 8192, 1, 1024, 1024, 1024, 1024, 8192]
    - [10, 223.77]
  - - [1024, 8192, 1, 2048, 1024, 1024, 2048, 8192]
    - [11, 268.07]
  - - [1024, 8192, 1, 4096, 1024, 1024, 4096, 8192]
    - [9, 263.92]
  - - [1024, 8192, 1, 8192, 1024, 1024, 8192, 8192]
    - [2, 284.12]
  - - [2048, 128, 1, 128, 2048, 2048, 128, 128]
    - [39, 7.84]
  - - [2048, 128, 1, 256, 2048, 2048, 256, 128]
    - [39, 14.14]
  - - [2048, 128, 1, 512, 2048, 2048, 512, 128]
    - [82, 23.81]
  - - [2048, 128, 1, 1024, 2048, 2048, 1024, 128]
    - [83, 37.12]
  - - [2048, 128, 1, 2048, 2048, 2048, 2048, 128]
    - [83, 51.25]
  - - [2048, 128, 1, 4096, 2048, 2048, 4096, 128]
    - [84, 62.74]
  - - [2048, 128, 1, 8192, 2048, 2048, 8192, 128]
    - [102, 70.75]
  - - [2048, 256, 1, 128, 2048, 2048, 128, 256]
    - [37, 13.87]
  - - [2048, 256, 1, 256, 2048, 2048, 256, 256]
    - [38, 24.74]
  - - [2048, 256, 1, 512, 2048, 2048, 512, 256]
    - [77, 40.99]
  - - [2048, 256, 1, 1024, 2048, 2048, 1024, 256]
    - [78, 62.36]
  - - [2048, 256, 1, 2048, 2048, 2048, 2048, 256]
    - [97, 85.21]
  - - [2048, 256, 1, 4096, 2048, 2048, 4096, 256]
    - [100, 104.3]
  - - [2048, 256, 1, 8192, 2048, 2048, 8192, 256]
    - [98, 116.6]
  - - [2048, 512, 1, 128, 2048, 2048, 128, 512]
    - [28, 23.53]
  - - [2048, 512, 1, 256, 2048, 2048, 256, 512]
    - [27, 41.42]
  - - [2048, 512, 1, 512, 2048, 2048, 512, 512]
    - [33, 67.79]
  - - [2048, 512, 1, 1024, 2048, 2048, 1024, 512]
    - [33, 100.71]
  - - [2048, 512, 1, 2048, 2048, 2048, 2048, 512]
    - [34, 131.73]
  - - [2048, 512, 1, 4096, 2048, 2048, 4096, 512]
    - [96, 148.19]
  - - [2048, 512, 1, 8192, 2048, 2048, 8192, 512]
    - [94, 158.59]
  - - [2048, 1024, 1, 128, 2048, 2048, 128, 1024]
    - [59, 36.41]
  - - [2048, 1024, 1, 256, 2048, 2048, 256, 1024]
    - [24, 64.13]
  - - [2048, 1024, 1, 512, 2048, 2048, 512, 1024]
    - [24, 102.09]
  - - [2048, 1024, 1, 1024, 2048, 2048, 1024, 1024]
    - [68, 148.79]
  - - [2048, 1024, 1, 2048, 2048, 2048, 2048, 1024]
    - [70, 184.7]
  - - [2048, 1024, 1, 4096, 2048, 2048, 4096, 1024]
    - [68, 208.05]
  - - [2048, 1024, 1, 8192, 2048, 2048, 8192, 1024]
    - [68, 204.81]
  - - [2048, 2048, 1, 128, 2048, 2048, 128, 2048]
    - [17, 52.28]
  - - [2048, 2048, 1, 256, 2048, 2048, 256, 2048]
    - [16, 91.54]
  - - [2048, 2048, 1, 512, 2048, 2048, 512, 2048]
    - [18, 137.85]
  - - [2048, 2048, 1, 1024, 2048, 2048, 1024, 2048]
    - [15, 185.69]
  - - [2048, 2048, 1, 2048, 2048, 2048, 2048, 2048]
    - [46, 232.8]
  - - [2048, 2048, 1, 4096, 2048, 2048, 4096, 2048]
    - [49, 248.9]
  - - [2048, 2048, 1, 8192, 2048, 2048, 8192, 2048]
    - [52, 238.89]
  - - [2048, 4096, 1, 128, 2048, 2048, 128, 4096]
    - [3, 59.01]
  - - [2048, 4096, 1, 256, 2048, 2048, 256, 4096]
    - [3, 102.1]
  - - [2048, 4096, 1, 512, 2048, 2048, 512, 4096]
    - [5, 160.24]
  - - [2048, 4096, 1, 1024, 2048, 2048, 1024, 4096]
    - [11, 221.48]
  - - [2048, 4096, 1, 2048, 2048, 2048, 2048, 4096]
    - [8, 260.87]
  - - [2048, 4096, 1, 4096, 2048, 2048, 4096, 4096]
    - [8, 261.57]
  - - [2048, 4096, 1, 8192, 2048, 2048, 8192, 4096]
    - [48, 282.87]
  - - [2048, 8192, 1, 128, 2048, 2048, 128, 8192]
    - [7, 66.04]
  - - [2048, 8192, 1, 256, 2048, 2048, 256, 8192]
    - [6, 113.55]
  - - [2048, 8192, 1, 512, 2048, 2048, 512, 8192]
    - [11, 170.62]
  - - [2048, 8192, 1, 1024, 2048, 2048, 1024, 8192]
    - [3, 220.58]
  - - [2048, 8192, 1, 2048, 2048, 2048, 2048, 8192]
    - [12, 245.72]
  - - [2048, 8192, 1, 4096, 2048, 2048, 4096, 8192]
    - [9, 275.28]
  - - [2048, 8192, 1, 8192, 2048, 2048, 8192, 8192]
    - [45, 308.44]
  - - [4096, 128, 1, 128, 4096, 4096, 128, 128]
    - [36, 14.34]
  - - [4096, 128, 1, 256, 4096, 4096, 256, 128]
    - [36, 25.67]
  - - [4096, 128, 1, 512, 4096, 4096, 512, 128]
    - [75, 42.61]
  - - [4096, 128, 1, 1024, 4096, 4096, 1024, 128]
    - [75, 63.73]
  - - [4096, 128, 1, 2048, 4096, 4096, 2048, 128]
    - [97, 86.61]
  - - [4096, 128, 1, 4096, 4096, 4096, 4096, 128]
    - [98, 104.12]
  - - [4096, 128, 1, 8192, 4096, 4096, 8192, 128]
    - [98, 116.76]
  - - [4096, 256, 1, 128, 4096, 4096, 128, 256]
    - [26, 24.45]
  - - [4096, 256, 1, 256, 4096, 4096, 256, 256]
    - [29, 43.04]
  - - [4096, 256, 1, 512, 4096, 4096, 512, 256]
    - [31, 70.43]
  - - [4096, 256, 1, 1024, 4096, 4096, 1024, 256]
    - [32, 101.06]
  - - [4096, 256, 1, 2048, 4096, 4096, 2048, 256]
    - [32, 133.12]
  - - [4096, 256, 1, 4096, 4096, 4096, 4096, 256]
    - [95, 146.94]
  - - [4096, 256, 1, 8192, 4096, 4096, 8192, 256]
    - [94, 160.31]
  - - [4096, 512, 1, 128, 4096, 4096, 128, 512]
    - [24, 36.32]
  - - [4096, 512, 1, 256, 4096, 4096, 256, 512]
    - [24, 63.24]
  - - [4096, 512, 1, 512, 4096, 4096, 512, 512]
    - [69, 101.45]
  - - [4096, 512, 1, 1024, 4096, 4096, 1024, 512]
    - [70, 149.33]
  - - [4096, 512, 1, 2048, 4096, 4096, 2048, 512]
    - [68, 189.17]
  - - [4096, 512, 1, 4096, 4096, 4096, 4096, 512]
    - [68, 199.54]
  - - [4096, 512, 1, 8192, 4096, 4096, 8192, 512]
    - [70, 203.5]
  - - [4096, 1024, 1, 128, 4096, 4096, 128, 1024]
    - [22, 53.17]
  - - [4096, 1024, 1, 256, 4096, 4096, 256, 1024]
    - [21, 91.36]
  - - [4096, 1024, 1, 512, 4096, 4096, 512, 1024]
    - [23, 137.54]
  - - [4096, 1024, 1, 1024, 4096, 4096, 1024, 1024]
    - [14, 190.91]
  - - [4096, 1024, 1, 2048, 4096, 4096, 2048, 1024]
    - [14, 234.3]
  - - [4096, 1024, 1, 4096, 4096, 4096, 4096, 1024]
    - [46, 254.28]
  - - [4096, 1024, 1, 8192, 4096, 4096, 8192, 1024]
    - [56, 245.98]
  - - [4096, 2048, 1, 128, 4096, 4096, 128, 2048]
    - [1, 57.34]
  - - [4096, 2048, 1, 256, 4096, 4096, 256, 2048]
    - [0, 98.78]
  - - [4096, 2048, 1, 512, 4096, 4096, 512, 2048]
    - [9, 155.18]
  - - [4096, 2048, 1, 1024, 4096, 4096, 1024, 2048]
    - [5, 221.1]
  - - [4096, 2048, 1, 2048, 4096, 4096, 2048, 2048]
    - [8, 264.09]
  - - [4096, 2048, 1, 4096, 4096, 4096, 4096, 2048]
    - [58, 268.93]
  - - [4096, 2048, 1, 8192, 4096, 4096, 8192, 2048]
    - [58, 290.77]
  - - [4096, 4096, 1, 128, 4096, 4096, 128, 4096]
    - [7, 64.45]
  - - [4096, 4096, 1, 256, 4096, 4096, 256, 4096]
    - [1, 111.72]
  - - [4096, 4096, 1, 512, 4096, 4096, 512, 4096]
    - [11, 173.59]
  - - [4096, 4096, 1, 1024, 4096, 4096, 1024, 4096]
    - [10, 218.0]
  - - [4096, 4096, 1, 2048, 4096, 4096, 2048, 4096]
    - [56, 246.23]
  - - [4096, 4096, 1, 4096, 4096, 4096, 4096, 4096]
    - [53, 292.31]
  - - [4096, 4096, 1, 8192, 4096, 4096, 8192, 4096]
    - [53, 316.13]
  - - [4096, 8192, 1, 128, 4096, 4096, 128, 8192]
    - [3, 69.45]
  - - [4096, 8192, 1, 256, 4096, 4096, 256, 8192]
    - [3, 116.92]
  - - [4096, 8192, 1, 512, 4096, 4096, 512, 8192]
    - [13, 174.95]
  - - [4096, 8192, 1, 1024, 4096, 4096, 1024, 8192]
    - [49, 221.54]
  - - [4096, 8192, 1, 2048, 4096, 4096, 2048, 8192]
    - [47, 269.87]
  - - [4096, 8192, 1, 4096, 4096, 4096, 4096, 8192]
    - [10, 335.7]
  - - [4096, 8192, 1, 8192, 4096, 4096, 8192, 8192]
    - [10, 371.96]
  - - [8192, 128, 1, 128, 8192, 8192, 128, 128]
    - [26, 24.63]
  - - [8192, 128, 1, 256, 8192, 8192, 256, 128]
    - [30, 42.93]
  - - [8192, 128, 1, 512, 8192, 8192, 512, 128]
    - [31, 70.54]
  - - [8192, 128, 1, 1024, 8192, 8192, 1024, 128]
    - [31, 101.54]
  - - [8192, 128, 1, 2048, 8192, 8192, 2048, 128]
    - [33, 131.25]
  - - [8192, 128, 1, 4096, 8192, 8192, 4096, 128]
    - [73, 144.32]
  - - [8192, 128, 1, 8192, 8192, 8192, 8192, 128]
    - [72, 155.45]
  - - [8192, 256, 1, 128, 8192, 8192, 128, 256]
    - [61, 35.79]
  - - [8192, 256, 1, 256, 8192, 8192, 256, 256]
    - [25, 61.78]
  - - [8192, 256, 1, 512, 8192, 8192, 512, 256]
    - [62, 101.15]
  - - [8192, 256, 1, 1024, 8192, 8192, 1024, 256]
    - [63, 148.86]
  - - [8192, 256, 1, 2048, 8192, 8192, 2048, 256]
    - [68, 183.1]
  - - [8192, 256, 1, 4096, 8192, 8192, 4096, 256]
    - [68, 202.61]
  - - [8192, 256, 1, 8192, 8192, 8192, 8192, 256]
    - [69, 198.99]
  - - [8192, 512, 1, 128, 8192, 8192, 128, 512]
    - [19, 51.39]
  - - [8192, 512, 1, 256, 8192, 8192, 256, 512]
    - [20, 88.43]
  - - [8192, 512, 1, 512, 8192, 8192, 512, 512]
    - [66, 140.18]
  - - [8192, 512, 1, 1024, 8192, 8192, 1024, 512]
    - [65, 205.59]
  - - [8192, 512, 1, 2048, 8192, 8192, 2048, 512]
    - [66, 235.79]
  - - [8192, 512, 1, 4096, 8192, 8192, 4096, 512]
    - [66, 269.07]
  - - [8192, 512, 1, 8192, 8192, 8192, 8192, 512]
    - [64, 272.22]
  - - [8192, 1024, 1, 128, 8192, 8192, 128, 1024]
    - [54, 59.69]
  - - [8192, 1024, 1, 256, 8192, 8192, 256, 1024]
    - [58, 105.64]
  - - [8192, 1024, 1, 512, 8192, 8192, 512, 1024]
    - [57, 167.11]
  - - [8192, 1024, 1, 1024, 8192, 8192, 1024, 1024]
    - [4, 215.97]
  - - [8192, 1024, 1, 2048, 8192, 8192, 2048, 1024]
    - [58, 286.72]
  - - [8192, 1024, 1, 4096, 8192, 8192, 4096, 1024]
    - [55, 339.9]
  - - [8192, 1024, 1, 8192, 8192, 8192, 8192, 1024]
    - [56, 372.8]
  - - [8192, 2048, 1, 128, 8192, 8192, 128, 2048]
    - [58, 66.32]
  - - [8192, 2048, 1, 256, 8192, 8192, 256, 2048]
    - [58, 112.83]
  - - [8192, 2048, 1, 512, 8192, 8192, 512, 2048]
    - [58, 168.63]
  - - [8192, 2048, 1, 1024, 8192, 8192, 1024, 2048]
    - [58, 237.99]
  - - [8192, 2048, 1, 2048, 8192, 8192, 2048, 2048]
    - [55, 288.25]
  - - [8192, 2048, 1, 4096, 8192, 8192, 4096, 2048]
    - [56, 340.36]
  - - [8192, 2048, 1, 8192, 8192, 8192, 8192, 2048]
    - [58, 388.82]
  - - [8192, 4096, 1, 128, 8192, 8192, 128, 4096]
    - [57, 68.39]
  - - [8192, 4096, 1, 256, 8192, 8192, 256, 4096]
    - [57, 114.36]
  - - [8192, 4096, 1, 512, 8192, 8192, 512, 4096]
    - [13, 172.38]
  - - [8192, 4096, 1, 1024, 8192, 8192, 1024, 4096]
    - [56, 227.51]
  - - [8192, 4096, 1, 2048, 8192, 8192, 2048, 4096]
    - [56, 297.2]
  - - [8192, 4096, 1, 4096, 8192, 8192, 4096, 4096]
    - [55, 357.25]
  - - [8192, 4096, 1, 8192, 8192, 8192, 8192, 4096]
    - [55, 406.37]
  - - [8192, 8192, 1, 128, 8192, 8192, 128, 8192]
    - [5, 60.92]
  - - [8192, 8192, 1, 256, 8192, 8192, 256, 8192]
    - [21, 113.34]
  - - [8192, 8192, 1, 512, 8192, 8192, 512, 8192]
    - [4, 173.99]
  - - [8192, 8192, 1, 1024, 8192, 8192, 1024, 8192]
    - [10, 236.72]
  - - [8192, 8192, 1, 2048, 8192, 8192, 2048, 8192]
    - [56, 305.81]
  - - [8192, 8192, 1, 4096, 8192, 8192, 4096, 8192]
    - [55, 367.74]
  - - [8192, 8192, 1, 8192, 8192, 8192, 8192, 8192]
    - [56, 405.62]
- null
- null
- ExperimentalStreamK
- GridBased
