projects/hipblaslt/library/src/amd_detail/rocblaslt/src/Tensile/Logic/asm_full/aquavanjaram/gfx942_228cu/StreamK/aquavanjaram942_Cijk_Alik_Bljk_F8NSS_BH_Bias_HAS_SAV_UserArgs.yaml
- {MinimumRequiredVersion: 4.33.0}
- aquavanjaram942
- {Architecture: gfx942, CUCount: 228}
- [Device 0049, Device 0050]
    SolutionIndex: 0
    SolutionNameMin: Cijk_Alik_Bljk_F8NSS_BH_Bias_HAS_SAV_UserArgs_MT256x256x64_MI16x16x1_SN_LDSB1_CLR1_GRVWA8_GRVWB16_GSU0_GSUC0_GSUWGMRR0_K1_LBSPPA512_LBSPPB512_LPA8_LPB16_LRVW8_MIWT8_8_PLR1_SU0_SUM0_SUS64_VWA8_VWB8_WGM1_WGMXCC1_WGMXCCGn1
    SolutionIndex: 1
    SolutionNameMin: Cijk_Alik_Bljk_F8NSS_BH_Bias_HAS_SAV_UserArgs_MT128x256x64_MI16x16x1_SN_LDSB1_CLR1_GRVWA8_GRVWB8_GSU0_GSUC0_GSUWGMRR0_K1_LBSPPA256_LBSPPB512_LPA8_LPB8_LRVW8_MIWT4_8_PLR1_SU0_SUM0_SUS64_VWA4_VWB8_WGM1_WGMXCC1_WGMXCCGn1
    SolutionIndex: 2
    SolutionNameMin: Cijk_Alik_Bljk_F8NSS_BH_Bias_HAS_SAV_UserArgs_MT128x256x64_MI16x16x1_SN_LDSB1_CLR1_GRVWA8_GRVWB16_GSU0_GSUC0_GSUWGMRR0_K1_LBSPPA256_LBSPPB512_LPA8_LPB16_LRVW8_MIWT4_8_PLR1_SU0_SUM0_SUS64_VWA4_VWB8_WGM1_WGMXCC1_WGMXCCGn1
    SolutionIndex: 3
    SolutionNameMin: Cijk_Alik_Bljk_F8NSS_BH_Bias_HAS_SAV_UserArgs_MT128x256x64_MI16x16x1_SN_LDSB1_CLR1_GRVWA8_GRVWB16_GSU0_GSUC0_GSUWGMRR0_K1_LBSPPA256_LBSPPB512_LPA8_LPB16_LRVW8_MIWT4_8_PLR1_SU0_SUM0_SUS64_VWA4_VWB8_WGM6_WGMXCC1_WGMXCCGn1
    SolutionIndex: 4
    SolutionNameMin: Cijk_Alik_Bljk_F8NSS_BH_Bias_HAS_SAV_UserArgs_MT128x128x64_MI16x16x1_SN_LDSB1_CLR1_GRVWA8_GRVWB16_GSU0_GSUC0_GSUWGMRR0_K1_LBSPPA256_LBSPPB256_LPA8_LPB16_LRVW8_MIWT4_4_PLR1_SU0_SUM0_SUS64_VWA4_VWB4_WGM1_WGMXCC1_WGMXCCGn1
    SolutionIndex: 5
    SolutionNameMin: Cijk_Alik_Bljk_F8NSS_BH_Bias_HAS_SAV_UserArgs_MT128x128x64_MI16x16x1_SN_LDSB1_CLR1_GRVWA16_GRVWB16_GSU0_GSUC0_GSUWGMRR0_K1_LBSPPA256_LBSPPB256_LPA16_LPB16_LRVW8_MIWT4_4_PLR1_SU0_SUM0_SUS64_VWA4_VWB4_WGM1_WGMXCC1_WGMXCCGn1
    SolutionIndex: 6
    SolutionNameMin: Cijk_Alik_Bljk_F8NSS_BH_Bias_HAS_SAV_UserArgs_MT128x128x64_MI16x16x1_SN_LDSB1_CLR1_GRVWA16_GRVWB16_GSU0_GSUC0_GSUWGMRR0_K1_LBSPPA256_LBSPPB256_LPA16_LPB16_LRVW8_MIWT4_4_PLR1_SU0_SUM0_SUS64_VWA4_VWB4_WGM4_WGMXCC1_WGMXCCGn1
    SolutionIndex: 7
    SolutionNameMin: Cijk_Alik_Bljk_F8NSS_BH_Bias_HAS_SAV_UserArgs_MT128x128x64_MI16x16x1_SN_LDSB1_CLR1_GRVWA8_GRVWB16_GSU0_GSUC0_GSUWGMRR0_K1_LBSPPA256_LBSPPB256_LPA8_LPB16_LRVW8_MIWT4_4_PLR1_SU0_SUM0_SUS64_VWA4_VWB4_WGM6_WGMXCC1_WGMXCCGn1
    SolutionIndex: 8
    SolutionNameMin: Cijk_Alik_Bljk_F8NSS_BH_Bias_HAS_SAV_UserArgs_MT128x128x64_MI16x16x1_SN_LDSB1_CLR1_GRVWA8_GRVWB16_GSU0_GSUC0_GSUWGMRR0_K1_LBSPPA256_LBSPPB256_LPA8_LPB16_LRVW8_MIWT4_4_PLR1_SU0_SUM0_SUS64_VWA4_VWB4_WGM8_WGMXCC1_WGMXCCGn1
    SolutionIndex: 9
    SolutionNameMin: Cijk_Alik_Bljk_F8NSS_BH_Bias_HAS_SAV_UserArgs_MT64x128x64_MI16x16x1_SN_LDSB0_CLR1_GRVWA8_GRVWB16_GSU0_GSUC0_GSUWGMRR0_K1_LBSPPA128_LBSPPB256_LPA8_LPB16_LRVW8_MIWT2_4_PLR1_SU0_SUM0_SUS64_VWA2_VWB4_WGM1_WGMXCC1_WGMXCCGn1
    SolutionIndex: 10
    SolutionNameMin: Cijk_Alik_Bljk_F8NSS_BH_Bias_HAS_SAV_UserArgs_MT128x64x64_MI16x16x1_SN_LDSB0_CLR1_GRVWA8_GRVWB8_GSU0_GSUC0_GSUWGMRR0_K1_LBSPPA256_LBSPPB128_LPA8_LPB8_LRVW8_MIWT4_2_PLR1_SU0_SUM0_SUS64_VWA4_VWB2_WGM1_WGMXCC1_WGMXCCGn1
    SolutionIndex: 11
    SolutionNameMin: Cijk_Alik_Bljk_F8NSS_BH_Bias_HAS_SAV_UserArgs_MT128x64x64_MI16x16x1_SN_LDSB0_CLR1_GRVWA16_GRVWB8_GSU0_GSUC0_GSUWGMRR0_K1_LBSPPA256_LBSPPB128_LPA16_LPB8_LRVW8_MIWT4_2_PLR1_SU0_SUM0_SUS64_VWA4_VWB2_WGM1_WGMXCC1_WGMXCCGn1
    SolutionIndex: 12
    SolutionNameMin: Cijk_Alik_Bljk_F8NSS_BH_Bias_HAS_SAV_UserArgs_MT128x64x64_MI16x16x1_SN_LDSB0_CLR1_GRVWA8_GRVWB16_GSU0_GSUC0_GSUWGMRR0_K1_LBSPPA256_LBSPPB128_LPA8_LPB16_LRVW8_MIWT4_2_PLR1_SU0_SUM0_SUS64_VWA4_VWB2_WGM1_WGMXCC1_WGMXCCGn1
    SolutionIndex: 13
    SolutionNameMin: Cijk_Alik_Bljk_F8NSS_BH_Bias_HAS_SAV_UserArgs_MT128x64x64_MI16x16x1_SN_LDSB0_CLR1_GRVWA16_GRVWB16_GSU0_GSUC0_GSUWGMRR0_K1_LBSPPA256_LBSPPB128_LPA16_LPB16_LRVW8_MIWT4_2_PLR1_SU0_SUM0_SUS64_VWA4_VWB2_WGM1_WGMXCC1_WGMXCCGn1
    SolutionIndex: 14
    SolutionNameMin: Cijk_Alik_Bljk_F8NSS_BH_Bias_HAS_SAV_UserArgs_MT128x64x64_MI16x16x1_SN_LDSB0_CLR1_GRVWA8_GRVWB16_GSU0_GSUC0_GSUWGMRR0_K1_LBSPPA256_LBSPPB128_LPA8_LPB16_LRVW8_MIWT4_2_PLR1_SU0_SUM0_SUS64_VWA4_VWB2_WGM4_WGMXCC1_WGMXCCGn1
    SolutionIndex: 15
    SolutionNameMin: Cijk_Alik_Bljk_F8NSS_BH_Bias_HAS_SAV_UserArgs_MT128x64x64_MI16x16x1_SN_LDSB0_CLR1_GRVWA16_GRVWB16_GSU0_GSUC0_GSUWGMRR0_K1_LBSPPA256_LBSPPB128_LPA16_LPB16_LRVW8_MIWT4_2_PLR1_SU0_SUM0_SUS64_VWA4_VWB2_WGM4_WGMXCC1_WGMXCCGn1
    SolutionIndex: 16
    SolutionNameMin: Cijk_Alik_Bljk_F8NSS_BH_Bias_HAS_SAV_UserArgs_MT128x64x64_MI16x16x1_SN_LDSB0_CLR1_GRVWA8_GRVWB16_GSU0_GSUC0_GSUWGMRR0_K1_LBSPPA256_LBSPPB128_LPA8_LPB16_LRVW8_MIWT4_2_PLR1_SU0_SUM0_SUS64_VWA4_VWB2_WGM6_WGMXCC1_WGMXCCGn1
    SolutionIndex: 17
    SolutionNameMin: Cijk_Alik_Bljk_F8NSS_BH_Bias_HAS_SAV_UserArgs_MT128x64x64_MI16x16x1_SN_LDSB0_CLR1_GRVWA8_GRVWB16_GSU0_GSUC0_GSUWGMRR0_K1_LBSPPA256_LBSPPB128_LPA8_LPB16_LRVW8_MIWT4_2_PLR1_SU0_SUM0_SUS64_VWA4_VWB2_WGM8_WGMXCC1_WGMXCCGn1
    SolutionIndex: 18
    SolutionNameMin: Cijk_Alik_Bljk_F8NSS_BH_Bias_HAS_SAV_UserArgs_MT128x32x64_MI16x16x1_SN_LDSB0_CLR1_GRVWA16_GRVWB8_GSU0_GSUC0_GSUWGMRR0_K1_LBSPPA256_LBSPPB128_LPA16_LPB8_LRVW8_MIWT4_1_PLR1_SU0_SUM0_SUS64_VWA4_VWB1_WGM1_WGMXCC1_WGMXCCGn1
    SolutionIndex: 19
    SolutionNameMin: Cijk_Alik_Bljk_F8NSS_BH_Bias_HAS_SAV_UserArgs_MT64x64x64_MI16x16x1_SN_LDSB0_CLR1_GRVWA8_GRVWB8_GSU0_GSUC0_GSUWGMRR0_K1_LBSPPA128_LBSPPB128_LPA8_LPB8_LRVW8_MIWT2_2_PLR1_SU0_SUM0_SUS64_VWA2_VWB2_WGM1_WGMXCC1_WGMXCCGn1
    SolutionIndex: 20
    SolutionNameMin: Cijk_Alik_Bljk_F8NSS_BH_Bias_HAS_SAV_UserArgs_MT64x64x64_MI16x16x1_SN_LDSB0_CLR1_GRVWA8_GRVWB16_GSU0_GSUC0_GSUWGMRR0_K1_LBSPPA128_LBSPPB128_LPA8_LPB16_LRVW8_MIWT2_2_PLR1_SU0_SUM0_SUS64_VWA2_VWB2_WGM1_WGMXCC1_WGMXCCGn1
    SolutionIndex: 21
    SolutionNameMin: Cijk_Alik_Bljk_F8NSS_BH_Bias_HAS_SAV_UserArgs_MT64x64x64_MI16x16x1_SN_LDSB0_CLR1_GRVWA8_GRVWB16_GSU0_GSUC0_GSUWGMRR0_K1_LBSPPA128_LBSPPB128_LPA8_LPB16_LRVW8_MIWT2_2_PLR1_SU0_SUM0_SUS64_VWA2_VWB2_WGM4_WGMXCC1_WGMXCCGn1
    SolutionIndex: 22
    SolutionNameMin: Cijk_Alik_Bljk_F8NSS_BH_Bias_HAS_SAV_UserArgs_MT64x64x64_MI16x16x1_SN_LDSB0_CLR1_GRVWA8_GRVWB8_GSU0_GSUC0_GSUWGMRR0_K1_LBSPPA128_LBSPPB128_LPA8_LPB8_LRVW8_MIWT2_2_PLR1_SU0_SUM0_SUS64_VWA2_VWB2_WGM8_WGMXCC1_WGMXCCGn1
    SolutionIndex: 23
    SolutionNameMin: Cijk_Alik_Bljk_F8NSS_BH_Bias_HAS_SAV_UserArgs_MT32x64x64_MI16x16x1_SN_LDSB0_CLR1_GRVWA8_GRVWB16_GSU0_GSUC0_GSUWGMRR0_K1_LBSPPA128_LBSPPB128_LPA8_LPB16_LRVW8_MIWT1_2_PLR1_SU0_SUM0_SUS64_VWA1_VWB2_WGM1_WGMXCC1_WGMXCCGn1
    SolutionIndex: 24
    SolutionNameMin: Cijk_Alik_Bljk_F8NSS_BH_Bias_HAS_SAV_UserArgs_MT64x32x64_MI16x16x1_SN_LDSB0_CLR1_GRVWA8_GRVWB8_GSU0_GSUC0_GSUWGMRR0_K1_LBSPPA128_LBSPPB128_LPA8_LPB8_LRVW8_MIWT2_1_PLR1_SU0_SUM0_SUS64_VWA2_VWB1_WGM1_WGMXCC1_WGMXCCGn1
    SolutionIndex: 25
    SolutionNameMin: Cijk_Alik_Bljk_F8NSS_BH_Bias_HAS_SAV_UserArgs_MT64x32x64_MI16x16x1_SN_LDSB0_CLR1_GRVWA8_GRVWB8_GSU0_GSUC0_GSUWGMRR0_K1_LBSPPA128_LBSPPB128_LPA8_LPB8_LRVW8_MIWT2_1_PLR1_SU0_SUM0_SUS64_VWA2_VWB1_WGM8_WGMXCC1_WGMXCCGn1
    SolutionIndex: 26
    SolutionNameMin: Cijk_Alik_Bljk_F8NSS_BH_Bias_HAS_SAV_UserArgs_MT32x32x64_MI16x16x1_SN_LDSB0_CLR1_GRVWA8_GRVWB8_GSU0_GSUC0_GSUWGMRR0_K1_LBSPPA128_LBSPPB128_LPA8_LPB8_LRVW8_MIWT1_1_PLR1_SU0_SUM0_SUS64_VWA1_VWB1_WGM1_WGMXCC1_WGMXCCGn1
    SolutionIndex: 27
    SolutionNameMin: Cijk_Alik_Bljk_F8NSS_BH_Bias_HAS_SAV_UserArgs_MT32x32x64_MI16x16x1_SN_LDSB0_CLR1_GRVWA8_GRVWB8_GSU0_GSUC0_GSUWGMRR0_K1_LBSPPA128_LBSPPB128_LPA8_LPB8_LRVW8_MIWT1_1_PLR1_SU0_SUM0_SUS64_VWA1_VWB1_WGM8_WGMXCC1_WGMXCCGn1
    SolutionIndex: 28
    SolutionNameMin: Cijk_Alik_Bljk_F8NSS_BH_Bias_HAS_SAV_UserArgs_MT128x256x128_MI16x16x1_SN_LDSB1_CLR1_GRVWA16_GRVWB16_GSU0_GSUC0_GSUWGMRR0_K1_LBSPPA512_LBSPPB1024_LPA16_LPB16_LRVW8_MIWT4_8_PLR1_SU0_SUM0_SUS128_VWA4_VWB8_WGM1_WGMXCC1_WGMXCCGn1
    SolutionIndex: 29
    SolutionNameMin: Cijk_Alik_Bljk_F8NSS_BH_Bias_HAS_SAV_UserArgs_MT128x256x128_MI16x16x1_SN_LDSB1_CLR1_GRVWA8_GRVWB16_GSU0_GSUC0_GSUWGMRR0_K1_LBSPPA512_LBSPPB1024_LPA8_LPB16_LRVW8_MIWT4_8_PLR1_SU0_SUM0_SUS128_VWA4_VWB8_WGM6_WGMXCC1_WGMXCCGn1
    SolutionIndex: 30
    SolutionNameMin: Cijk_Alik_Bljk_F8NSS_BH_Bias_HAS_SAV_UserArgs_MT128x256x128_MI16x16x1_SN_LDSB1_CLR1_GRVWA8_GRVWB16_GSU0_GSUC0_GSUWGMRR0_K1_LBSPPA512_LBSPPB1024_LPA8_LPB16_LRVW8_MIWT4_8_PLR1_SU0_SUM0_SUS128_VWA4_VWB8_WGM8_WGMXCC1_WGMXCCGn1
    SolutionIndex: 31
    SolutionNameMin: Cijk_Alik_Bljk_F8NSS_BH_Bias_HAS_SAV_UserArgs_MT256x144x128_MI16x16x1_SN_LDSB1_CLR1_GRVWA8_GRVWB8_GSU0_GSUC0_GSUWGMRR0_K1_LBSPPA512_LBSPPB128_LPA8_LPB8_LRVW8_MIWT4_9_PLR1_SU0_SUM0_SUS128_VWA4_VWB1_WGM1_WGMXCC1_WGMXCCGn1
    SolutionIndex: 32
    SolutionNameMin: Cijk_Alik_Bljk_F8NSS_BH_Bias_HAS_SAV_UserArgs_MT256x144x128_MI16x16x1_SN_LDSB1_CLR1_GRVWA16_GRVWB8_GSU0_GSUC0_GSUWGMRR0_K1_LBSPPA512_LBSPPB128_LPA16_LPB8_LRVW8_MIWT4_9_PLR1_SU0_SUM0_SUS128_VWA4_VWB1_WGM1_WGMXCC1_WGMXCCGn1
    SolutionIndex: 33
    SolutionNameMin: Cijk_Alik_Bljk_F8NSS_BH_Bias_HAS_SAV_UserArgs_MT256x144x128_MI16x16x1_SN_LDSB1_CLR1_GRVWA8_GRVWB8_GSU0_GSUC0_GSUWGMRR0_K1_LBSPPA512_LBSPPB128_LPA8_LPB8_LRVW8_MIWT4_9_PLR1_SU0_SUM0_SUS128_VWA4_VWB1_WGM4_WGMXCC1_WGMXCCGn1
    SolutionIndex: 34
    SolutionNameMin: Cijk_Alik_Bljk_F8NSS_BH_Bias_HAS_SAV_UserArgs_MT256x144x128_MI16x16x1_SN_LDSB1_CLR1_GRVWA16_GRVWB8_GSU0_GSUC0_GSUWGMRR0_K1_LBSPPA512_LBSPPB128_LPA16_LPB8_LRVW8_MIWT4_9_PLR1_SU0_SUM0_SUS128_VWA4_VWB1_WGM4_WGMXCC1_WGMXCCGn1
    SolutionIndex: 35
    SolutionNameMin: Cijk_Alik_Bljk_F8NSS_BH_Bias_HAS_SAV_UserArgs_MT256x144x128_MI16x16x1_SN_LDSB1_CLR1_GRVWA8_GRVWB8_GSU0_GSUC0_GSUWGMRR0_K1_LBSPPA512_LBSPPB128_LPA8_LPB8_LRVW8_MIWT4_9_PLR1_SU0_SUM0_SUS128_VWA4_VWB1_WGM6_WGMXCC1_WGMXCCGn1
    SolutionIndex: 36
    SolutionNameMin: Cijk_Alik_Bljk_F8NSS_BH_Bias_HAS_SAV_UserArgs_MT256x144x128_MI16x16x1_SN_LDSB1_CLR1_GRVWA8_GRVWB8_GSU0_GSUC0_GSUWGMRR0_K1_LBSPPA512_LBSPPB128_LPA8_LPB8_LRVW8_MIWT4_9_PLR1_SU0_SUM0_SUS128_VWA4_VWB1_WGM8_WGMXCC1_WGMXCCGn1
    SolutionIndex: 37
    SolutionNameMin: Cijk_Alik_Bljk_F8NSS_BH_Bias_HAS_SAV_UserArgs_MT256x144x128_MI16x16x1_SN_LDSB1_CLR1_GRVWA16_GRVWB8_GSU0_GSUC0_GSUWGMRR0_K1_LBSPPA512_LBSPPB128_LPA16_LPB8_LRVW8_MIWT4_9_PLR1_SU0_SUM0_SUS128_VWA4_VWB1_WGM8_WGMXCC1_WGMXCCGn1
    SolutionIndex: 38
    SolutionNameMin: Cijk_Alik_Bljk_F8NSS_BH_Bias_HAS_SAV_UserArgs_MT144x256x128_MI16x16x1_SN_LDSB1_CLR1_GRVWA8_GRVWB16_GSU0_GSUC0_GSUWGMRR0_K1_LBSPPA128_LBSPPB512_LPA8_LPB16_LRVW8_MIWT9_4_PLR1_SU0_SUM0_SUS128_VWA1_VWB4_WGM1_WGMXCC1_WGMXCCGn1
    SolutionIndex: 39
    SolutionNameMin: Cijk_Alik_Bljk_F8NSS_BH_Bias_HAS_SAV_UserArgs_MT144x256x128_MI16x16x1_SN_LDSB1_CLR1_GRVWA8_GRVWB16_GSU0_GSUC0_GSUWGMRR0_K1_LBSPPA128_LBSPPB512_LPA8_LPB16_LRVW8_MIWT9_4_PLR1_SU0_SUM0_SUS128_VWA1_VWB4_WGM4_WGMXCC1_WGMXCCGn1
    SolutionIndex: 40
    SolutionNameMin: Cijk_Alik_Bljk_F8NSS_BH_Bias_HAS_SAV_UserArgs_MT144x256x128_MI16x16x1_SN_LDSB1_CLR1_GRVWA8_GRVWB16_GSU0_GSUC0_GSUWGMRR0_K1_LBSPPA128_LBSPPB512_LPA8_LPB16_LRVW8_MIWT9_4_PLR1_SU0_SUM0_SUS128_VWA1_VWB4_WGM6_WGMXCC1_WGMXCCGn1
    SolutionIndex: 41
    SolutionNameMin: Cijk_Alik_Bljk_F8NSS_BH_Bias_HAS_SAV_UserArgs_MT144x256x128_MI16x16x1_SN_LDSB1_CLR1_GRVWA8_GRVWB16_GSU0_GSUC0_GSUWGMRR0_K1_LBSPPA128_LBSPPB512_LPA8_LPB16_LRVW8_MIWT9_4_PLR1_SU0_SUM0_SUS128_VWA1_VWB4_WGM8_WGMXCC1_WGMXCCGn1
    SolutionIndex: 42
    SolutionNameMin: Cijk_Alik_Bljk_F8NSS_BH_Bias_HAS_SAV_UserArgs_MT64x144x128_MI16x16x1_SN_LDSB1_CLR1_GRVWA16_GRVWB8_GSU0_GSUC0_GSUWGMRR0_K1_LBSPPA128_LBSPPB128_LPA16_LPB8_LRVW8_MIWT1_9_PLR1_SU0_SUM0_SUS128_VWA1_VWB1_WGM1_WGMXCC1_WGMXCCGn1
    SolutionIndex: 43
    SolutionNameMin: Cijk_Alik_Bljk_F8NSS_BH_Bias_HAS_SAV_UserArgs_MT128x144x128_MI16x16x1_SN_LDSB1_CLR1_GRVWA16_GRVWB8_GSU0_GSUC0_GSUWGMRR0_K1_LBSPPA256_LBSPPB128_LPA16_LPB8_LRVW8_MIWT2_9_PLR1_SU0_SUM0_SUS128_VWA2_VWB1_WGM1_WGMXCC1_WGMXCCGn1
    SolutionIndex: 44
    SolutionNameMin: Cijk_Alik_Bljk_F8NSS_BH_Bias_HAS_SAV_UserArgs_MT128x144x128_MI16x16x1_SN_LDSB1_CLR1_GRVWA16_GRVWB8_GSU0_GSUC0_GSUWGMRR0_K1_LBSPPA256_LBSPPB128_LPA16_LPB8_LRVW8_MIWT2_9_PLR1_SU0_SUM0_SUS128_VWA2_VWB1_WGM4_WGMXCC1_WGMXCCGn1
    SolutionIndex: 45
    SolutionNameMin: Cijk_Alik_Bljk_F8NSS_BH_Bias_HAS_SAV_UserArgs_MT128x144x128_MI16x16x1_SN_LDSB1_CLR1_GRVWA8_GRVWB8_GSU0_GSUC0_GSUWGMRR0_K1_LBSPPA256_LBSPPB128_LPA8_LPB8_LRVW8_MIWT2_9_PLR1_SU0_SUM0_SUS128_VWA2_VWB1_WGM6_WGMXCC1_WGMXCCGn1
    SolutionIndex: 46
    SolutionNameMin: Cijk_Alik_Bljk_F8NSS_BH_Bias_HAS_SAV_UserArgs_MT128x144x128_MI16x16x1_SN_LDSB1_CLR1_GRVWA16_GRVWB8_GSU0_GSUC0_GSUWGMRR0_K1_LBSPPA256_LBSPPB128_LPA16_LPB8_LRVW8_MIWT2_9_PLR1_SU0_SUM0_SUS128_VWA2_VWB1_WGM6_WGMXCC1_WGMXCCGn1
    SolutionIndex: 47
    SolutionNameMin: Cijk_Alik_Bljk_F8NSS_BH_Bias_HAS_SAV_UserArgs_MT128x144x128_MI16x16x1_SN_LDSB1_CLR1_GRVWA16_GRVWB8_GSU0_GSUC0_GSUWGMRR0_K1_LBSPPA256_LBSPPB128_LPA16_LPB8_LRVW8_MIWT2_9_PLR1_SU0_SUM0_SUS128_VWA2_VWB1_WGM8_WGMXCC1_WGMXCCGn1
    SolutionIndex: 48
    SolutionNameMin: Cijk_Alik_Bljk_F8NSS_BH_Bias_HAS_SAV_UserArgs_MT144x64x128_MI16x16x1_SN_LDSB1_CLR1_GRVWA8_GRVWB16_GSU0_GSUC0_GSUWGMRR0_K1_LBSPPA128_LBSPPB128_LPA8_LPB16_LRVW8_MIWT9_1_PLR1_SU0_SUM0_SUS128_VWA1_VWB1_WGM4_WGMXCC1_WGMXCCGn1
    SolutionIndex: 49
    SolutionNameMin: Cijk_Alik_Bljk_F8NSS_BH_Bias_HAS_SAV_UserArgs_MT144x64x128_MI16x16x1_SN_LDSB1_CLR1_GRVWA8_GRVWB16_GSU0_GSUC0_GSUWGMRR0_K1_LBSPPA128_LBSPPB128_LPA8_LPB16_LRVW8_MIWT9_1_PLR1_SU0_SUM0_SUS128_VWA1_VWB1_WGM6_WGMXCC1_WGMXCCGn1
    SolutionIndex: 50
    SolutionNameMin: Cijk_Alik_Bljk_F8NSS_BH_Bias_HAS_SAV_UserArgs_MT144x64x128_MI16x16x1_SN_LDSB1_CLR1_GRVWA8_GRVWB16_GSU0_GSUC0_GSUWGMRR0_K1_LBSPPA128_LBSPPB128_LPA8_LPB16_LRVW8_MIWT9_1_PLR1_SU0_SUM0_SUS128_VWA1_VWB1_WGM8_WGMXCC1_WGMXCCGn1
    SolutionIndex: 51
    SolutionNameMin: Cijk_Alik_Bljk_F8NSS_BH_Bias_HAS_SAV_UserArgs_MT144x128x128_MI16x16x1_SN_LDSB1_CLR1_GRVWA8_GRVWB16_GSU0_GSUC0_GSUWGMRR0_K1_LBSPPA128_LBSPPB256_LPA8_LPB16_LRVW8_MIWT9_2_PLR1_SU0_SUM0_SUS128_VWA1_VWB2_WGM1_WGMXCC1_WGMXCCGn1
    SolutionIndex: 52
    SolutionNameMin: Cijk_Alik_Bljk_F8NSS_BH_Bias_HAS_SAV_UserArgs_MT144x128x128_MI16x16x1_SN_LDSB1_CLR1_GRVWA8_GRVWB16_GSU0_GSUC0_GSUWGMRR0_K1_LBSPPA128_LBSPPB256_LPA8_LPB16_LRVW8_MIWT9_2_PLR1_SU0_SUM0_SUS128_VWA1_VWB2_WGM4_WGMXCC1_WGMXCCGn1
    SolutionIndex: 53
    SolutionNameMin: Cijk_Alik_Bljk_F8NSS_BH_Bias_HAS_SAV_UserArgs_MT144x128x128_MI16x16x1_SN_LDSB1_CLR1_GRVWA8_GRVWB16_GSU0_GSUC0_GSUWGMRR0_K1_LBSPPA128_LBSPPB256_LPA8_LPB16_LRVW8_MIWT9_2_PLR1_SU0_SUM0_SUS128_VWA1_VWB2_WGM6_WGMXCC1_WGMXCCGn1
    SolutionIndex: 54
    SolutionNameMin: Cijk_Alik_Bljk_F8NSS_BH_Bias_HAS_SAV_UserArgs_MT144x128x128_MI16x16x1_SN_LDSB1_CLR1_GRVWA8_GRVWB16_GSU0_GSUC0_GSUWGMRR0_K1_LBSPPA128_LBSPPB256_LPA8_LPB16_LRVW8_MIWT9_2_PLR1_SU0_SUM0_SUS128_VWA1_VWB2_WGM8_WGMXCC1_WGMXCCGn1
    SolutionIndex: 55
    SolutionNameMin: Cijk_Alik_Bljk_F8NSS_BH_Bias_HAS_SAV_UserArgs_MT128x128x128_MI16x16x1_SN_LDSB1_CLR1_GRVWA8_GRVWB16_GSU0_GSUC0_GSUWGMRR0_K1_LBSPPA512_LBSPPB512_LPA8_LPB16_LRVW8_MIWT4_4_PLR1_SU0_SUM0_SUS128_VWA4_VWB4_WGM1_WGMXCC1_WGMXCCGn1
    SolutionIndex: 56
    SolutionNameMin: Cijk_Alik_Bljk_F8NSS_BH_Bias_HAS_SAV_UserArgs_MT128x128x128_MI16x16x1_SN_LDSB1_CLR1_GRVWA16_GRVWB16_GSU0_GSUC0_GSUWGMRR0_K1_LBSPPA512_LBSPPB512_LPA16_LPB16_LRVW8_MIWT4_4_PLR1_SU0_SUM0_SUS128_VWA4_VWB4_WGM1_WGMXCC1_WGMXCCGn1
    SolutionIndex: 57
    SolutionNameMin: Cijk_Alik_Bljk_F8NSS_BH_Bias_HAS_SAV_UserArgs_MT128x128x128_MI16x16x1_SN_LDSB1_CLR1_GRVWA8_GRVWB16_GSU0_GSUC0_GSUWGMRR0_K1_LBSPPA512_LBSPPB512_LPA8_LPB16_LRVW8_MIWT4_4_PLR1_SU0_SUM0_SUS128_VWA4_VWB4_WGM4_WGMXCC1_WGMXCCGn1
    SolutionIndex: 58
    SolutionNameMin: Cijk_Alik_Bljk_F8NSS_BH_Bias_HAS_SAV_UserArgs_MT128x128x128_MI16x16x1_SN_LDSB1_CLR1_GRVWA16_GRVWB16_GSU0_GSUC0_GSUWGMRR0_K1_LBSPPA512_LBSPPB512_LPA16_LPB16_LRVW8_MIWT4_4_PLR1_SU0_SUM0_SUS128_VWA4_VWB4_WGM4_WGMXCC1_WGMXCCGn1
    SolutionIndex: 59
    SolutionNameMin: Cijk_Alik_Bljk_F8NSS_BH_Bias_HAS_SAV_UserArgs_MT128x128x128_MI16x16x1_SN_LDSB1_CLR1_GRVWA8_GRVWB16_GSU0_GSUC0_GSUWGMRR0_K1_LBSPPA512_LBSPPB512_LPA8_LPB16_LRVW8_MIWT4_4_PLR1_SU0_SUM0_SUS128_VWA4_VWB4_WGM6_WGMXCC1_WGMXCCGn1
    SolutionIndex: 60
    SolutionNameMin: Cijk_Alik_Bljk_F8NSS_BH_Bias_HAS_SAV_UserArgs_MT128x128x128_MI16x16x1_SN_LDSB1_CLR1_GRVWA16_GRVWB16_GSU0_GSUC0_GSUWGMRR0_K1_LBSPPA512_LBSPPB512_LPA16_LPB16_LRVW8_MIWT4_4_PLR1_SU0_SUM0_SUS128_VWA4_VWB4_WGM6_WGMXCC1_WGMXCCGn1
    SolutionIndex: 61
    SolutionNameMin: Cijk_Alik_Bljk_F8NSS_BH_Bias_HAS_SAV_UserArgs_MT128x128x128_MI16x16x1_SN_LDSB1_CLR1_GRVWA8_GRVWB16_GSU0_GSUC0_GSUWGMRR0_K1_LBSPPA512_LBSPPB512_LPA8_LPB16_LRVW8_MIWT4_4_PLR1_SU0_SUM0_SUS128_VWA4_VWB4_WGM8_WGMXCC1_WGMXCCGn1
    SolutionIndex: 62
    SolutionNameMin: Cijk_Alik_Bljk_F8NSS_BH_Bias_HAS_SAV_UserArgs_MT64x128x128_MI16x16x1_SN_LDSB1_CLR1_GRVWA8_GRVWB16_GSU0_GSUC0_GSUWGMRR0_K1_LBSPPA256_LBSPPB512_LPA8_LPB16_LRVW8_MIWT2_4_PLR1_SU0_SUM0_SUS128_VWA2_VWB4_WGM1_WGMXCC1_WGMXCCGn1
    SolutionIndex: 63
    SolutionNameMin: Cijk_Alik_Bljk_F8NSS_BH_Bias_HAS_SAV_UserArgs_MT128x64x128_MI16x16x1_SN_LDSB1_CLR1_GRVWA16_GRVWB8_GSU0_GSUC0_GSUWGMRR0_K1_LBSPPA512_LBSPPB256_LPA16_LPB8_LRVW8_MIWT4_2_PLR1_SU0_SUM0_SUS128_VWA4_VWB2_WGM1_WGMXCC1_WGMXCCGn1
    SolutionIndex: 64
    SolutionNameMin: Cijk_Alik_Bljk_F8NSS_BH_Bias_HAS_SAV_UserArgs_MT128x64x128_MI16x16x1_SN_LDSB1_CLR1_GRVWA8_GRVWB16_GSU0_GSUC0_GSUWGMRR0_K1_LBSPPA512_LBSPPB256_LPA8_LPB16_LRVW8_MIWT4_2_PLR1_SU0_SUM0_SUS128_VWA4_VWB2_WGM4_WGMXCC1_WGMXCCGn1
    SolutionIndex: 65
    SolutionNameMin: Cijk_Alik_Bljk_F8NSS_BH_Bias_HAS_SAV_UserArgs_MT64x64x128_MI16x16x1_SN_LDSB1_CLR1_GRVWA16_GRVWB8_GSU0_GSUC0_GSUWGMRR0_K1_LBSPPA256_LBSPPB256_LPA16_LPB8_LRVW8_MIWT2_2_PLR1_SU0_SUM0_SUS128_VWA2_VWB2_WGM1_WGMXCC1_WGMXCCGn1
    SolutionIndex: 66
    SolutionNameMin: Cijk_Alik_Bljk_F8NSS_BH_Bias_HAS_SAV_UserArgs_MT64x64x128_MI16x16x1_SN_LDSB1_CLR1_GRVWA8_GRVWB16_GSU0_GSUC0_GSUWGMRR0_K1_LBSPPA256_LBSPPB256_LPA8_LPB16_LRVW8_MIWT2_2_PLR1_SU0_SUM0_SUS128_VWA2_VWB2_WGM1_WGMXCC1_WGMXCCGn1
    SolutionIndex: 67
    SolutionNameMin: Cijk_Alik_Bljk_F8NSS_BH_Bias_HAS_SAV_UserArgs_MT64x64x128_MI16x16x1_SN_LDSB1_CLR1_GRVWA16_GRVWB8_GSU0_GSUC0_GSUWGMRR0_K1_LBSPPA256_LBSPPB256_LPA16_LPB8_LRVW8_MIWT2_2_PLR1_SU0_SUM0_SUS128_VWA2_VWB2_WGM4_WGMXCC1_WGMXCCGn1
    SolutionIndex: 68
    SolutionNameMin: Cijk_Alik_Bljk_F8NSS_BH_Bias_HAS_SAV_UserArgs_MT64x64x128_MI16x16x1_SN_LDSB1_CLR1_GRVWA8_GRVWB16_GSU0_GSUC0_GSUWGMRR0_K1_LBSPPA256_LBSPPB256_LPA8_LPB16_LRVW8_MIWT2_2_PLR1_SU0_SUM0_SUS128_VWA2_VWB2_WGM4_WGMXCC1_WGMXCCGn1
    SolutionIndex: 69
    SolutionNameMin: Cijk_Alik_Bljk_F8NSS_BH_Bias_HAS_SAV_UserArgs_MT64x64x128_MI16x16x1_SN_LDSB1_CLR1_GRVWA8_GRVWB16_GSU0_GSUC0_GSUWGMRR0_K1_LBSPPA256_LBSPPB256_LPA8_LPB16_LRVW8_MIWT2_2_PLR1_SU0_SUM0_SUS128_VWA2_VWB2_WGM6_WGMXCC1_WGMXCCGn1
    SolutionIndex: 70
    SolutionNameMin: Cijk_Alik_Bljk_F8NSS_BH_Bias_HAS_SAV_UserArgs_MT64x64x128_MI16x16x1_SN_LDSB1_CLR1_GRVWA16_GRVWB8_GSU0_GSUC0_GSUWGMRR0_K1_LBSPPA256_LBSPPB256_LPA16_LPB8_LRVW8_MIWT2_2_PLR1_SU0_SUM0_SUS128_VWA2_VWB2_WGM8_WGMXCC1_WGMXCCGn1
    SolutionIndex: 71
    SolutionNameMin: Cijk_Alik_Bljk_F8NSS_BH_Bias_HAS_SAV_UserArgs_MT32x64x128_MI16x16x1_SN_LDSB0_CLR1_GRVWA8_GRVWB8_GSU0_GSUC0_GSUWGMRR0_K1_LBSPPA128_LBSPPB256_LPA8_LPB8_LRVW8_MIWT1_2_PLR1_SU0_SUM0_SUS128_VWA1_VWB2_WGM1_WGMXCC1_WGMXCCGn1
    SolutionIndex: 72
    SolutionNameMin: Cijk_Alik_Bljk_F8NSS_BH_Bias_HAS_SAV_UserArgs_MT32x64x128_MI16x16x1_SN_LDSB0_CLR1_GRVWA16_GRVWB8_GSU0_GSUC0_GSUWGMRR0_K1_LBSPPA128_LBSPPB256_LPA16_LPB8_LRVW8_MIWT1_2_PLR1_SU0_SUM0_SUS128_VWA1_VWB2_WGM1_WGMXCC1_WGMXCCGn1
    SolutionIndex: 73
    SolutionNameMin: Cijk_Alik_Bljk_F8NSS_BH_Bias_HAS_SAV_UserArgs_MT32x64x128_MI16x16x1_SN_LDSB0_CLR1_GRVWA8_GRVWB16_GSU0_GSUC0_GSUWGMRR0_K1_LBSPPA128_LBSPPB256_LPA8_LPB16_LRVW8_MIWT1_2_PLR1_SU0_SUM0_SUS128_VWA1_VWB2_WGM1_WGMXCC1_WGMXCCGn1
    SolutionIndex: 74
    SolutionNameMin: Cijk_Alik_Bljk_F8NSS_BH_Bias_HAS_SAV_UserArgs_MT32x64x128_MI16x16x1_SN_LDSB0_CLR1_GRVWA8_GRVWB8_GSU0_GSUC0_GSUWGMRR0_K1_LBSPPA128_LBSPPB256_LPA8_LPB8_LRVW8_MIWT1_2_PLR1_SU0_SUM0_SUS128_VWA1_VWB2_WGM6_WGMXCC1_WGMXCCGn1
    SolutionIndex: 75
    SolutionNameMin: Cijk_Alik_Bljk_F8NSS_BH_Bias_HAS_SAV_UserArgs_MT32x64x128_MI16x16x1_SN_LDSB0_CLR1_GRVWA8_GRVWB8_GSU0_GSUC0_GSUWGMRR0_K1_LBSPPA128_LBSPPB256_LPA8_LPB8_LRVW8_MIWT1_2_PLR1_SU0_SUM0_SUS128_VWA1_VWB2_WGM8_WGMXCC1_WGMXCCGn1
    SolutionIndex: 76
    SolutionNameMin: Cijk_Alik_Bljk_F8NSS_BH_Bias_HAS_SAV_UserArgs_MT64x32x128_MI16x16x1_SN_LDSB0_CLR1_GRVWA8_GRVWB8_GSU0_GSUC0_GSUWGMRR0_K1_LBSPPA256_LBSPPB128_LPA8_LPB8_LRVW8_MIWT2_1_PLR1_SU0_SUM0_SUS128_VWA2_VWB1_WGM1_WGMXCC1_WGMXCCGn1
    SolutionIndex: 77
    SolutionNameMin: Cijk_Alik_Bljk_F8NSS_BH_Bias_HAS_SAV_UserArgs_MT64x32x128_MI16x16x1_SN_LDSB0_CLR1_GRVWA8_GRVWB16_GSU0_GSUC0_GSUWGMRR0_K1_LBSPPA256_LBSPPB128_LPA8_LPB16_LRVW8_MIWT2_1_PLR1_SU0_SUM0_SUS128_VWA2_VWB1_WGM1_WGMXCC1_WGMXCCGn1
    SolutionIndex: 78
    SolutionNameMin: Cijk_Alik_Bljk_F8NSS_BH_Bias_HAS_SAV_UserArgs_MT64x32x128_MI16x16x1_SN_LDSB0_CLR1_GRVWA16_GRVWB16_GSU0_GSUC0_GSUWGMRR0_K1_LBSPPA256_LBSPPB128_LPA16_LPB16_LRVW8_MIWT2_1_PLR1_SU0_SUM0_SUS128_VWA2_VWB1_WGM1_WGMXCC1_WGMXCCGn1
    SolutionIndex: 79
    SolutionNameMin: Cijk_Alik_Bljk_F8NSS_BH_Bias_HAS_SAV_UserArgs_MT32x32x128_MI16x16x1_SN_LDSB0_CLR1_GRVWA8_GRVWB8_GSU0_GSUC0_GSUWGMRR0_K1_LBSPPA128_LBSPPB128_LPA8_LPB8_LRVW8_MIWT1_1_PLR1_SU0_SUM0_SUS128_VWA1_VWB1_WGM1_WGMXCC1_WGMXCCGn1
    SolutionIndex: 80
    SolutionNameMin: Cijk_Alik_Bljk_F8NSS_BH_Bias_HAS_SAV_UserArgs_MT32x32x128_MI16x16x1_SN_LDSB0_CLR1_GRVWA16_GRVWB8_GSU0_GSUC0_GSUWGMRR0_K1_LBSPPA128_LBSPPB128_LPA16_LPB8_LRVW8_MIWT1_1_PLR1_SU0_SUM0_SUS128_VWA1_VWB1_WGM1_WGMXCC1_WGMXCCGn1
    SolutionIndex: 81
    SolutionNameMin: Cijk_Alik_Bljk_F8NSS_BH_Bias_HAS_SAV_UserArgs_MT32x32x128_MI16x16x1_SN_LDSB0_CLR1_GRVWA8_GRVWB16_GSU0_GSUC0_GSUWGMRR0_K1_LBSPPA128_LBSPPB128_LPA8_LPB16_LRVW8_MIWT1_1_PLR1_SU0_SUM0_SUS128_VWA1_VWB1_WGM1_WGMXCC1_WGMXCCGn1
    SolutionIndex: 82
    SolutionNameMin: Cijk_Alik_Bljk_F8NSS_BH_Bias_HAS_SAV_UserArgs_MT32x32x128_MI16x16x1_SN_LDSB0_CLR1_GRVWA16_GRVWB16_GSU0_GSUC0_GSUWGMRR0_K1_LBSPPA128_LBSPPB128_LPA16_LPB16_LRVW8_MIWT1_1_PLR1_SU0_SUM0_SUS128_VWA1_VWB1_WGM1_WGMXCC1_WGMXCCGn1
    SolutionIndex: 83
    SolutionNameMin: Cijk_Alik_Bljk_F8NSS_BH_Bias_HAS_SAV_UserArgs_MT32x32x128_MI16x16x1_SN_LDSB0_CLR1_GRVWA8_GRVWB8_GSU0_GSUC0_GSUWGMRR0_K1_LBSPPA128_LBSPPB128_LPA8_LPB8_LRVW8_MIWT1_1_PLR1_SU0_SUM0_SUS128_VWA1_VWB1_WGM4_WGMXCC1_WGMXCCGn1
    SolutionIndex: 84
    SolutionNameMin: Cijk_Alik_Bljk_F8NSS_BH_Bias_HAS_SAV_UserArgs_MT32x32x128_MI16x16x1_SN_LDSB0_CLR1_GRVWA8_GRVWB8_GSU0_GSUC0_GSUWGMRR0_K1_LBSPPA128_LBSPPB128_LPA8_LPB8_LRVW8_MIWT1_1_PLR1_SU0_SUM0_SUS128_VWA1_VWB1_WGM8_WGMXCC1_WGMXCCGn1
    SolutionIndex: 85
    SolutionNameMin: Cijk_Alik_Bljk_F8NSS_BH_Bias_HAS_SAV_UserArgs_MT64x128x256_MI16x16x1_SN_LDSB1_CLR1_GRVWA8_GRVWB8_GSU0_GSUC0_GSUWGMRR0_K1_LBSPPA512_LBSPPB1024_LPA8_LPB8_LRVW8_MIWT2_4_PLR1_SU0_SUM0_SUS256_VWA2_VWB4_WGM1_WGMXCC1_WGMXCCGn1
    SolutionIndex: 86
    SolutionNameMin: Cijk_Alik_Bljk_F8NSS_BH_Bias_HAS_SAV_UserArgs_MT128x64x256_MI16x16x1_SN_LDSB1_CLR1_GRVWA8_GRVWB16_GSU0_GSUC0_GSUWGMRR0_K1_LBSPPA1024_LBSPPB512_LPA8_LPB16_LRVW8_MIWT4_2_PLR1_SU0_SUM0_SUS256_VWA4_VWB2_WGM1_WGMXCC1_WGMXCCGn1
    SolutionIndex: 87
    SolutionNameMin: Cijk_Alik_Bljk_F8NSS_BH_Bias_HAS_SAV_UserArgs_MT128x64x256_MI16x16x1_SN_LDSB1_CLR1_GRVWA8_GRVWB16_GSU0_GSUC0_GSUWGMRR0_K1_LBSPPA1024_LBSPPB512_LPA8_LPB16_LRVW8_MIWT4_2_PLR1_SU0_SUM0_SUS256_VWA4_VWB2_WGM4_WGMXCC1_WGMXCCGn1
    SolutionIndex: 88
    SolutionNameMin: Cijk_Alik_Bljk_F8NSS_BH_Bias_HAS_SAV_UserArgs_MT128x64x256_MI16x16x1_SN_LDSB1_CLR1_GRVWA8_GRVWB16_GSU0_GSUC0_GSUWGMRR0_K1_LBSPPA1024_LBSPPB512_LPA8_LPB16_LRVW8_MIWT4_2_PLR1_SU0_SUM0_SUS256_VWA4_VWB2_WGM6_WGMXCC1_WGMXCCGn1
    SolutionIndex: 89
    SolutionNameMin: Cijk_Alik_Bljk_F8NSS_BH_Bias_HAS_SAV_UserArgs_MT128x64x256_MI16x16x1_SN_LDSB1_CLR1_GRVWA8_GRVWB16_GSU0_GSUC0_GSUWGMRR0_K1_LBSPPA1024_LBSPPB512_LPA8_LPB16_LRVW8_MIWT4_2_PLR1_SU0_SUM0_SUS256_VWA4_VWB2_WGM8_WGMXCC1_WGMXCCGn1
    SolutionIndex: 90
    SolutionNameMin: Cijk_Alik_Bljk_F8NSS_BH_Bias_HAS_SAV_UserArgs_MT64x64x256_MI16x16x1_SN_LDSB1_CLR1_GRVWA8_GRVWB16_GSU0_GSUC0_GSUWGMRR0_K1_LBSPPA512_LBSPPB512_LPA8_LPB16_LRVW8_MIWT2_2_PLR1_SU0_SUM0_SUS256_VWA2_VWB2_WGM1_WGMXCC1_WGMXCCGn1
    SolutionIndex: 91
    SolutionNameMin: Cijk_Alik_Bljk_F8NSS_BH_Bias_HAS_SAV_UserArgs_MT64x64x256_MI16x16x1_SN_LDSB1_CLR1_GRVWA16_GRVWB16_GSU0_GSUC0_GSUWGMRR0_K1_LBSPPA512_LBSPPB512_LPA16_LPB16_LRVW8_MIWT2_2_PLR1_SU0_SUM0_SUS256_VWA2_VWB2_WGM6_WGMXCC1_WGMXCCGn1
    SolutionIndex: 92
    SolutionNameMin: Cijk_Alik_Bljk_F8NSS_BH_Bias_HAS_SAV_UserArgs_MT64x64x256_MI16x16x1_SN_LDSB1_CLR1_GRVWA8_GRVWB16_GSU0_GSUC0_GSUWGMRR0_K1_LBSPPA512_LBSPPB512_LPA8_LPB16_LRVW8_MIWT2_2_PLR1_SU0_SUM0_SUS256_VWA2_VWB2_WGM8_WGMXCC1_WGMXCCGn1
    SolutionIndex: 93
    SolutionNameMin: Cijk_Alik_Bljk_F8NSS_BH_Bias_HAS_SAV_UserArgs_MT64x64x256_MI16x16x1_SN_LDSB1_CLR1_GRVWA16_GRVWB16_GSU0_GSUC0_GSUWGMRR0_K1_LBSPPA512_LBSPPB512_LPA16_LPB16_LRVW8_MIWT2_2_PLR1_SU0_SUM0_SUS256_VWA2_VWB2_WGM8_WGMXCC1_WGMXCCGn1
    SolutionIndex: 94
    SolutionNameMin: Cijk_Alik_Bljk_F8NSS_BH_Bias_HAS_SAV_UserArgs_MT32x64x256_MI16x16x1_SN_LDSB1_CLR1_GRVWA8_GRVWB16_GSU0_GSUC0_GSUWGMRR0_K1_LBSPPA256_LBSPPB512_LPA8_LPB16_LRVW8_MIWT1_2_PLR1_SU0_SUM0_SUS256_VWA1_VWB2_WGM4_WGMXCC1_WGMXCCGn1
    SolutionIndex: 95
    SolutionNameMin: Cijk_Alik_Bljk_F8NSS_BH_Bias_HAS_SAV_UserArgs_MT32x32x256_MI16x16x1_SN_LDSB1_CLR1_GRVWA16_GRVWB8_GSU0_GSUC0_GSUWGMRR0_K1_LBSPPA256_LBSPPB256_LPA16_LPB8_LRVW8_MIWT1_1_PLR1_SU0_SUM0_SUS256_VWA1_VWB1_WGM1_WGMXCC1_WGMXCCGn1
    SolutionIndex: 96
    SolutionNameMin: Cijk_Alik_Bljk_F8NSS_BH_Bias_HAS_SAV_UserArgs_MT32x32x256_MI16x16x1_SN_LDSB1_CLR1_GRVWA8_GRVWB16_GSU0_GSUC0_GSUWGMRR0_K1_LBSPPA256_LBSPPB256_LPA8_LPB16_LRVW8_MIWT1_1_PLR1_SU0_SUM0_SUS256_VWA1_VWB1_WGM1_WGMXCC1_WGMXCCGn1
    SolutionIndex: 97
    SolutionNameMin: Cijk_Alik_Bljk_F8NSS_BH_Bias_HAS_SAV_UserArgs_MT32x32x256_MI16x16x1_SN_LDSB1_CLR1_GRVWA16_GRVWB16_GSU0_GSUC0_GSUWGMRR0_K1_LBSPPA256_LBSPPB256_LPA16_LPB16_LRVW8_MIWT1_1_PLR1_SU0_SUM0_SUS256_VWA1_VWB1_WGM1_WGMXCC1_WGMXCCGn1
    SolutionIndex: 98
    SolutionNameMin: Cijk_Alik_Bljk_F8NSS_BH_Bias_HAS_SAV_UserArgs_MT32x32x256_MI16x16x1_SN_LDSB1_CLR1_GRVWA8_GRVWB16_GSU0_GSUC0_GSUWGMRR0_K1_LBSPPA256_LBSPPB256_LPA8_LPB16_LRVW8_MIWT1_1_PLR1_SU0_SUM0_SUS256_VWA1_VWB1_WGM4_WGMXCC1_WGMXCCGn1
    SolutionIndex: 99
    SolutionNameMin: Cijk_Alik_Bljk_F8NSS_BH_Bias_HAS_SAV_UserArgs_MT32x32x256_MI16x16x1_SN_LDSB1_CLR1_GRVWA16_GRVWB8_GSU0_GSUC0_GSUWGMRR0_K1_LBSPPA256_LBSPPB256_LPA16_LPB8_LRVW8_MIWT1_1_PLR1_SU0_SUM0_SUS256_VWA1_VWB1_WGM8_WGMXCC1_WGMXCCGn1
    SolutionIndex: 100
    SolutionNameMin: Cijk_Alik_Bljk_F8NSS_BH_Bias_HAS_SAV_UserArgs_MT32x32x256_MI16x16x1_SN_LDSB1_CLR1_GRVWA8_GRVWB16_GSU0_GSUC0_GSUWGMRR0_K1_LBSPPA256_LBSPPB256_LPA8_LPB16_LRVW8_MIWT1_1_PLR1_SU0_SUM0_SUS256_VWA1_VWB1_WGM8_WGMXCC1_WGMXCCGn1
    SolutionIndex: 101
    SolutionNameMin: Cijk_Alik_Bljk_F8NSS_BH_Bias_HAS_SAV_UserArgs_MT32x64x32_MI16x16x1_SN_LDSB0_CLR0_GRVWA4_GRVWB4_GSU0_GSUC0_GSUWGMRR0_K1_LBSPPA128_LBSPPB128_LPA8_LPB8_LRVW8_MIWT1_2_PLR0_SU32_SUM0_SUS256_VWA1_VWB2_WGM8_WGMXCC1_WGMXCCGn1
- - - [128, 128, 1, 128, 128, 128, 128, 128]
    - [82, 0.6]
  - - [128, 128, 1, 256, 128, 128, 256, 256]
    - [26, 1.13]
  - - [128, 128, 1, 512, 128, 128, 512, 512]
    - [81, 2.03]
  - - [128, 128, 1, 1024, 128, 128, 1024, 1024]
    - [79, 3.43]
  - - [128, 128, 1, 2048, 128, 128, 2048, 2048]
    - [79, 5.25]
  - - [128, 128, 1, 4096, 128, 128, 4096, 4096]
    - [79, 7.18]
  - - [128, 128, 1, 8192, 128, 128, 8192, 8192]
    - [79, 8.65]
  - - [128, 256, 1, 128, 128, 128, 128, 128]
    - [80, 1.22]
  - - [128, 256, 1, 256, 128, 128, 256, 256]
    - [81, 2.28]
  - - [128, 256, 1, 512, 128, 128, 512, 512]
    - [81, 4.09]
  - - [128, 256, 1, 1024, 128, 128, 1024, 1024]
    - [79, 6.87]
  - - [128, 256, 1, 2048, 128, 128, 2048, 2048]
    - [79, 10.61]
  - - [128, 256, 1, 4096, 128, 128, 4096, 4096]
    - [79, 14.3]
  - - [128, 256, 1, 8192, 128, 128, 8192, 8192]
    - [79, 17.23]
  - - [128, 512, 1, 128, 128, 128, 128, 128]
    - [26, 2.42]
  - - [128, 512, 1, 256, 128, 128, 256, 256]
    - [27, 4.28]
  - - [128, 512, 1, 512, 128, 128, 512, 512]
    - [81, 8.24]
  - - [128, 512, 1, 1024, 128, 128, 1024, 1024]
    - [79, 13.81]
  - - [128, 512, 1, 2048, 128, 128, 2048, 2048]
    - [79, 20.55]
  - - [128, 512, 1, 4096, 128, 128, 4096, 4096]
    - [79, 28.37]
  - - [128, 512, 1, 8192, 128, 128, 8192, 8192]
    - [79, 34.43]
  - - [128, 1024, 1, 128, 128, 128, 128, 128]
    - [79, 4.81]
  - - [128, 1024, 1, 256, 128, 128, 256, 256]
    - [81, 8.87]
  - - [128, 1024, 1, 512, 128, 128, 512, 512]
    - [82, 15.65]
  - - [128, 1024, 1, 1024, 128, 128, 1024, 1024]
    - [79, 26.64]
  - - [128, 1024, 1, 2048, 128, 128, 2048, 2048]
    - [79, 41.16]
  - - [128, 1024, 1, 4096, 128, 128, 4096, 4096]
    - [79, 55.93]
  - - [128, 1024, 1, 8192, 128, 128, 8192, 8192]
    - [79, 67.17]
  - - [128, 2048, 1, 128, 128, 128, 128, 128]
    - [23, 8.38]
  - - [128, 2048, 1, 256, 128, 128, 256, 256]
    - [78, 15.56]
  - - [128, 2048, 1, 512, 128, 128, 512, 512]
    - [77, 27.82]
  - - [128, 2048, 1, 1024, 128, 128, 1024, 1024]
    - [73, 45.59]
  - - [128, 2048, 1, 2048, 128, 128, 2048, 2048]
    - [71, 66.63]
  - - [128, 2048, 1, 4096, 128, 128, 4096, 4096]
    - [71, 87.45]
  - - [128, 2048, 1, 8192, 128, 128, 8192, 8192]
    - [96, 98.48]
  - - [128, 4096, 1, 128, 128, 128, 128, 128]
    - [18, 14.2]
  - - [128, 4096, 1, 256, 128, 128, 256, 256]
    - [19, 26.01]
  - - [128, 4096, 1, 512, 128, 128, 512, 512]
    - [19, 45.15]
  - - [128, 4096, 1, 1024, 128, 128, 1024, 1024]
    - [65, 70.62]
  - - [128, 4096, 1, 2048, 128, 128, 2048, 2048]
    - [66, 100.21]
  - - [128, 4096, 1, 4096, 128, 128, 4096, 4096]
    - [66, 126.43]
  - - [128, 4096, 1, 8192, 128, 128, 8192, 8192]
    - [90, 138.59]
  - - [128, 8192, 1, 128, 128, 128, 128, 128]
    - [10, 22.61]
  - - [128, 8192, 1, 256, 128, 128, 256, 256]
    - [12, 41.28]
  - - [128, 8192, 1, 512, 128, 128, 512, 512]
    - [12, 72.13]
  - - [128, 8192, 1, 1024, 128, 128, 1024, 1024]
    - [12, 110.01]
  - - [128, 8192, 1, 2048, 128, 128, 2048, 2048]
    - [62, 139.86]
  - - [128, 8192, 1, 4096, 128, 128, 4096, 4096]
    - [85, 155.49]
  - - [128, 8192, 1, 8192, 128, 128, 8192, 8192]
    - [93, 180.8]
  - - [256, 128, 1, 128, 256, 256, 128, 128]
    - [81, 1.22]
  - - [256, 128, 1, 256, 256, 256, 256, 256]
    - [82, 2.27]
  - - [256, 128, 1, 512, 256, 256, 512, 512]
    - [82, 4.05]
  - - [256, 128, 1, 1024, 256, 256, 1024, 1024]
    - [81, 6.85]
  - - [256, 128, 1, 2048, 256, 256, 2048, 2048]
    - [79, 10.55]
  - - [256, 128, 1, 4096, 256, 256, 4096, 4096]
    - [79, 14.25]
  - - [256, 128, 1, 8192, 256, 256, 8192, 8192]
    - [79, 17.38]
  - - [256, 256, 1, 128, 256, 256, 128, 128]
    - [80, 2.41]
  - - [256, 256, 1, 256, 256, 256, 256, 256]
    - [82, 4.55]
  - - [256, 256, 1, 512, 256, 256, 512, 512]
    - [82, 8.05]
  - - [256, 256, 1, 1024, 256, 256, 1024, 1024]
    - [80, 13.45]
  - - [256, 256, 1, 2048, 256, 256, 2048, 2048]
    - [79, 21.16]
  - - [256, 256, 1, 4096, 256, 256, 4096, 4096]
    - [79, 28.28]
  - - [256, 256, 1, 8192, 256, 256, 8192, 8192]
    - [79, 34.15]
  - - [256, 512, 1, 128, 256, 256, 128, 128]
    - [82, 4.7]
  - - [256, 512, 1, 256, 256, 256, 256, 256]
    - [82, 8.83]
  - - [256, 512, 1, 512, 256, 256, 512, 512]
    - [82, 15.75]
  - - [256, 512, 1, 1024, 256, 256, 1024, 1024]
    - [79, 26.55]
  - - [256, 512, 1, 2048, 256, 256, 2048, 2048]
    - [79, 41.02]
  - - [256, 512, 1, 4096, 256, 256, 4096, 4096]
    - [79, 55.46]
  - - [256, 512, 1, 8192, 256, 256, 8192, 8192]
    - [79, 67.29]
  - - [256, 1024, 1, 128, 256, 256, 128, 128]
    - [73, 8.57]
  - - [256, 1024, 1, 256, 256, 256, 256, 256]
    - [23, 15.68]
  - - [256, 1024, 1, 512, 256, 256, 512, 512]
    - [73, 28.15]
  - - [256, 1024, 1, 1024, 256, 256, 1024, 1024]
    - [73, 45.53]
  - - [256, 1024, 1, 2048, 256, 256, 2048, 2048]
    - [71, 67.19]
  - - [256, 1024, 1, 4096, 256, 256, 4096, 4096]
    - [71, 87.11]
  - - [256, 1024, 1, 8192, 256, 256, 8192, 8192]
    - [76, 101.15]
  - - [256, 2048, 1, 128, 256, 256, 128, 128]
    - [20, 14.2]
  - - [256, 2048, 1, 256, 256, 256, 256, 256]
    - [20, 26.21]
  - - [256, 2048, 1, 512, 256, 256, 512, 512]
    - [66, 44.87]
  - - [256, 2048, 1, 1024, 256, 256, 1024, 1024]
    - [65, 70.75]
  - - [256, 2048, 1, 2048, 256, 256, 2048, 2048]
    - [66, 99.51]
  - - [256, 2048, 1, 4096, 256, 256, 4096, 4096]
    - [66, 125.79]
  - - [256, 2048, 1, 8192, 256, 256, 8192, 8192]
    - [90, 139.24]
  - - [256, 4096, 1, 128, 256, 256, 128, 128]
    - [15, 22.38]
  - - [256, 4096, 1, 256, 256, 256, 256, 256]
    - [12, 41.35]
  - - [256, 4096, 1, 512, 256, 256, 512, 512]
    - [12, 70.81]
  - - [256, 4096, 1, 1024, 256, 256, 1024, 1024]
    - [14, 109.46]
  - - [256, 4096, 1, 2048, 256, 256, 2048, 2048]
    - [12, 150.89]
  - - [256, 4096, 1, 4096, 256, 256, 4096, 4096]
    - [86, 164.35]
  - - [256, 4096, 1, 8192, 256, 256, 8192, 8192]
    - [86, 183.57]
  - - [256, 8192, 1, 128, 256, 256, 128, 128]
    - [42, 33.02]
  - - [256, 8192, 1, 256, 256, 256, 256, 256]
    - [42, 59.17]
  - - [256, 8192, 1, 512, 256, 256, 512, 512]
    - [42, 102.2]
  - - [256, 8192, 1, 1024, 256, 256, 1024, 1024]
    - [42, 152.1]
  - - [256, 8192, 1, 2048, 256, 256, 2048, 2048]
    - [42, 171.1]
  - - [256, 8192, 1, 4096, 256, 256, 4096, 4096]
    - [63, 206.82]
  - - [256, 8192, 1, 8192, 256, 256, 8192, 8192]
    - [55, 238.42]
  - - [512, 128, 1, 128, 512, 512, 128, 128]
    - [26, 2.43]
  - - [512, 128, 1, 256, 512, 512, 256, 256]
    - [95, 4.44]
  - - [512, 128, 1, 512, 512, 512, 512, 512]
    - [82, 8.06]
  - - [512, 128, 1, 1024, 512, 512, 1024, 1024]
    - [79, 13.64]
  - - [512, 128, 1, 2048, 512, 512, 2048, 2048]
    - [79, 20.79]
  - - [512, 128, 1, 4096, 512, 512, 4096, 4096]
    - [79, 28.34]
  - - [512, 128, 1, 8192, 512, 512, 8192, 8192]
    - [79, 34.28]
  - - [512, 256, 1, 128, 512, 512, 128, 128]
    - [81, 4.7]
  - - [512, 256, 1, 256, 512, 512, 256, 256]
    - [80, 8.84]
  - - [512, 256, 1, 512, 512, 512, 512, 512]
    - [81, 15.89]
  - - [512, 256, 1, 1024, 512, 512, 1024, 1024]
    - [79, 26.57]
  - - [512, 256, 1, 2048, 512, 512, 2048, 2048]
    - [79, 40.28]
  - - [512, 256, 1, 4096, 512, 512, 4096, 4096]
    - [83, 54.44]
  - - [512, 256, 1, 8192, 512, 512, 8192, 8192]
    - [83, 66.69]
  - - [512, 512, 1, 128, 512, 512, 128, 128]
    - [24, 8.34]
  - - [512, 512, 1, 256, 512, 512, 256, 256]
    - [24, 15.36]
  - - [512, 512, 1, 512, 512, 512, 512, 512]
    - [77, 27.13]
  - - [512, 512, 1, 1024, 512, 512, 1024, 1024]
    - [71, 44.67]
  - - [512, 512, 1, 2048, 512, 512, 2048, 2048]
    - [74, 65.96]
  - - [512, 512, 1, 4096, 512, 512, 4096, 4096]
    - [71, 86.97]
  - - [512, 512, 1, 8192, 512, 512, 8192, 8192]
    - [98, 96.45]
  - - [512, 1024, 1, 128, 512, 512, 128, 128]
    - [20, 14.22]
  - - [512, 1024, 1, 256, 512, 512, 256, 256]
    - [19, 26.13]
  - - [512, 1024, 1, 512, 512, 512, 512, 512]
    - [66, 44.78]
  - - [512, 1024, 1, 1024, 512, 512, 1024, 1024]
    - [66, 71.12]
  - - [512, 1024, 1, 2048, 512, 512, 2048, 2048]
    - [66, 99.45]
  - - [512, 1024, 1, 4096, 512, 512, 4096, 4096]
    - [66, 125.91]
  - - [512, 1024, 1, 8192, 512, 512, 8192, 8192]
    - [90, 139.08]
  - - [512, 2048, 1, 128, 512, 512, 128, 128]
    - [13, 22.92]
  - - [512, 2048, 1, 256, 512, 512, 256, 256]
    - [12, 41.65]
  - - [512, 2048, 1, 512, 512, 512, 512, 512]
    - [17, 70.69]
  - - [512, 2048, 1, 1024, 512, 512, 1024, 1024]
    - [17, 109.0]
  - - [512, 2048, 1, 2048, 512, 512, 2048, 2048]
    - [12, 149.8]
  - - [512, 2048, 1, 4096, 512, 512, 4096, 4096]
    - [86, 167.84]
  - - [512, 2048, 1, 8192, 512, 512, 8192, 8192]
    - [86, 185.53]
  - - [512, 4096, 1, 128, 512, 512, 128, 128]
    - [8, 33.81]
  - - [512, 4096, 1, 256, 512, 512, 256, 256]
    - [8, 60.08]
  - - [512, 4096, 1, 512, 512, 512, 512, 512]
    - [4, 101.85]
  - - [512, 4096, 1, 1024, 512, 512, 1024, 1024]
    - [4, 146.39]
  - - [512, 4096, 1, 2048, 512, 512, 2048, 2048]
    - [55, 194.43]
  - - [512, 4096, 1, 4096, 512, 512, 4096, 4096]
    - [56, 214.43]
  - - [512, 4096, 1, 8192, 512, 512, 8192, 8192]
    - [55, 246.07]
  - - [512, 8192, 1, 128, 512, 512, 128, 128]
    - [44, 41.43]
  - - [512, 8192, 1, 256, 512, 512, 256, 256]
    - [47, 75.26]
  - - [512, 8192, 1, 512, 512, 512, 512, 512]
    - [43, 124.2]
  - - [512, 8192, 1, 1024, 512, 512, 1024, 1024]
    - [45, 172.44]
  - - [512, 8192, 1, 2048, 512, 512, 2048, 2048]
    - [45, 221.79]
  - - [512, 8192, 1, 4096, 512, 512, 4096, 4096]
    - [46, 260.69]
  - - [512, 8192, 1, 8192, 512, 512, 8192, 8192]
    - [46, 272.77]
  - - [1024, 128, 1, 128, 1024, 1024, 128, 128]
    - [27, 4.46]
  - - [1024, 128, 1, 256, 1024, 1024, 256, 256]
    - [99, 7.61]
  - - [1024, 128, 1, 512, 1024, 1024, 512, 512]
    - [97, 15.19]
  - - [1024, 128, 1, 1024, 1024, 1024, 1024, 1024]
    - [79, 25.71]
  - - [1024, 128, 1, 2048, 1024, 1024, 2048, 2048]
    - [84, 39.49]
  - - [1024, 128, 1, 4096, 1024, 1024, 4096, 4096]
    - [83, 54.59]
  - - [1024, 128, 1, 8192, 1024, 1024, 8192, 8192]
    - [84, 66.34]
  - - [1024, 256, 1, 128, 1024, 1024, 128, 128]
    - [25, 7.57]
  - - [1024, 256, 1, 256, 1024, 1024, 256, 256]
    - [77, 14.94]
  - - [1024, 256, 1, 512, 1024, 1024, 512, 512]
    - [77, 26.65]
  - - [1024, 256, 1, 1024, 1024, 1024, 1024, 1024]
    - [73, 43.88]
  - - [1024, 256, 1, 2048, 1024, 1024, 2048, 2048]
    - [74, 65.55]
  - - [1024, 256, 1, 4096, 1024, 1024, 4096, 4096]
    - [71, 86.71]
  - - [1024, 256, 1, 8192, 1024, 1024, 8192, 8192]
    - [75, 98.79]
  - - [1024, 512, 1, 128, 1024, 1024, 128, 128]
    - [21, 14.04]
  - - [1024, 512, 1, 256, 1024, 1024, 256, 256]
    - [22, 25.9]
  - - [1024, 512, 1, 512, 1024, 1024, 512, 512]
    - [69, 44.01]
  - - [1024, 512, 1, 1024, 1024, 1024, 1024, 1024]
    - [66, 69.55]
  - - [1024, 512, 1, 2048, 1024, 1024, 2048, 2048]
    - [67, 98.82]
  - - [1024, 512, 1, 4096, 1024, 1024, 4096, 4096]
    - [68, 124.66]
  - - [1024, 512, 1, 8192, 1024, 1024, 8192, 8192]
    - [94, 139.79]
  - - [1024, 1024, 1, 128, 1024, 1024, 128, 128]
    - [9, 22.48]
  - - [1024, 1024, 1, 256, 1024, 1024, 256, 256]
    - [14, 41.33]
  - - [1024, 1024, 1, 512, 1024, 1024, 512, 512]
    - [16, 70.67]
  - - [1024, 1024, 1, 1024, 1024, 1024, 1024, 1024]
    - [17, 109.4]
  - - [1024, 1024, 1, 2048, 1024, 1024, 2048, 2048]
    - [12, 148.02]
  - - [1024, 1024, 1, 4096, 1024, 1024, 4096, 4096]
    - [89, 165.53]
  - - [1024, 1024, 1, 8192, 1024, 1024, 8192, 8192]
    - [88, 185.05]
  - - [1024, 2048, 1, 128, 1024, 1024, 128, 128]
    - [4, 33.73]
  - - [1024, 2048, 1, 256, 1024, 1024, 256, 256]
    - [5, 60.39]
  - - [1024, 2048, 1, 512, 1024, 1024, 512, 512]
    - [4, 102.51]
  - - [1024, 2048, 1, 1024, 1024, 1024, 1024, 1024]
    - [4, 147.28]
  - - [1024, 2048, 1, 2048, 1024, 1024, 2048, 2048]
    - [55, 185.24]
  - - [1024, 2048, 1, 4096, 1024, 1024, 4096, 4096]
    - [60, 213.18]
  - - [1024, 2048, 1, 8192, 1024, 1024, 8192, 8192]
    - [55, 243.34]
  - - [1024, 4096, 1, 128, 1024, 1024, 128, 128]
    - [2, 40.27]
  - - [1024, 4096, 1, 256, 1024, 1024, 256, 256]
    - [2, 71.67]
  - - [1024, 4096, 1, 512, 1024, 1024, 512, 512]
    - [28, 108.99]
  - - [1024, 4096, 1, 1024, 1024, 1024, 1024, 1024]
    - [38, 157.91]
  - - [1024, 4096, 1, 2048, 1024, 1024, 2048, 2048]
    - [38, 211.35]
  - - [1024, 4096, 1, 4096, 1024, 1024, 4096, 4096]
    - [38, 242.79]
  - - [1024, 4096, 1, 8192, 1024, 1024, 8192, 8192]
    - [38, 250.82]
  - - [1024, 8192, 1, 128, 1024, 1024, 128, 128]
    - [32, 44.71]
  - - [1024, 8192, 1, 256, 1024, 1024, 256, 256]
    - [32, 81.51]
  - - [1024, 8192, 1, 512, 1024, 1024, 512, 512]
    - [32, 138.94]
  - - [1024, 8192, 1, 1024, 1024, 1024, 1024, 1024]
    - [34, 199.04]
  - - [1024, 8192, 1, 2048, 1024, 1024, 2048, 2048]
    - [33, 274.99]
  - - [1024, 8192, 1, 4096, 1024, 1024, 4096, 4096]
    - [33, 310.69]
  - - [1024, 8192, 1, 8192, 1024, 1024, 8192, 8192]
    - [35, 340.9]
  - - [2048, 128, 1, 128, 2048, 2048, 128, 128]
    - [73, 8.48]
  - - [2048, 128, 1, 256, 2048, 2048, 256, 256]
    - [73, 15.86]
  - - [2048, 128, 1, 512, 2048, 2048, 512, 512]
    - [71, 28.05]
  - - [2048, 128, 1, 1024, 2048, 2048, 1024, 1024]
    - [73, 45.62]
  - - [2048, 128, 1, 2048, 2048, 2048, 2048, 2048]
    - [72, 66.79]
  - - [2048, 128, 1, 4096, 2048, 2048, 4096, 4096]
    - [71, 87.06]
  - - [2048, 128, 1, 8192, 2048, 2048, 8192, 8192]
    - [100, 96.13]
  - - [2048, 256, 1, 128, 2048, 2048, 128, 128]
    - [20, 14.69]
  - - [2048, 256, 1, 256, 2048, 2048, 256, 256]
    - [19, 27.1]
  - - [2048, 256, 1, 512, 2048, 2048, 512, 512]
    - [66, 46.0]
  - - [2048, 256, 1, 1024, 2048, 2048, 1024, 1024]
    - [66, 71.0]
  - - [2048, 256, 1, 2048, 2048, 2048, 2048, 2048]
    - [66, 101.48]
  - - [2048, 256, 1, 4096, 2048, 2048, 4096, 4096]
    - [68, 126.25]
  - - [2048, 256, 1, 8192, 2048, 2048, 8192, 8192]
    - [92, 138.92]
  - - [2048, 512, 1, 128, 2048, 2048, 128, 128]
    - [12, 22.97]
  - - [2048, 512, 1, 256, 2048, 2048, 256, 256]
    - [13, 41.91]
  - - [2048, 512, 1, 512, 2048, 2048, 512, 512]
    - [12, 72.32]
  - - [2048, 512, 1, 1024, 2048, 2048, 1024, 1024]
    - [12, 110.7]
  - - [2048, 512, 1, 2048, 2048, 2048, 2048, 2048]
    - [14, 147.69]
  - - [2048, 512, 1, 4096, 2048, 2048, 4096, 4096]
    - [88, 165.11]
  - - [2048, 512, 1, 8192, 2048, 2048, 8192, 8192]
    - [87, 186.88]
  - - [2048, 1024, 1, 128, 2048, 2048, 128, 128]
    - [5, 33.23]
  - - [2048, 1024, 1, 256, 2048, 2048, 256, 256]
    - [4, 60.44]
  - - [2048, 1024, 1, 512, 2048, 2048, 512, 512]
    - [4, 98.62]
  - - [2048, 1024, 1, 1024, 2048, 2048, 1024, 1024]
    - [57, 143.5]
  - - [2048, 1024, 1, 2048, 2048, 2048, 2048, 2048]
    - [57, 191.56]
  - - [2048, 1024, 1, 4096, 2048, 2048, 4096, 4096]
    - [57, 214.04]
  - - [2048, 1024, 1, 8192, 2048, 2048, 8192, 8192]
    - [57, 238.51]
  - - [2048, 2048, 1, 128, 2048, 2048, 128, 128]
    - [2, 37.16]
  - - [2048, 2048, 1, 256, 2048, 2048, 256, 256]
    - [2, 66.18]
  - - [2048, 2048, 1, 512, 2048, 2048, 512, 512]
    - [39, 105.43]
  - - [2048, 2048, 1, 1024, 2048, 2048, 1024, 1024]
    - [39, 162.18]
  - - [2048, 2048, 1, 2048, 2048, 2048, 2048, 2048]
    - [38, 212.47]
  - - [2048, 2048, 1, 4096, 2048, 2048, 4096, 4096]
    - [51, 245.82]
  - - [2048, 2048, 1, 8192, 2048, 2048, 8192, 8192]
    - [53, 250.78]
  - - [2048, 4096, 1, 128, 2048, 2048, 128, 128]
    - [4, 40.91]
  - - [2048, 4096, 1, 256, 2048, 2048, 256, 256]
    - [1, 73.34]
  - - [2048, 4096, 1, 512, 2048, 2048, 512, 512]
    - [51, 117.11]
  - - [2048, 4096, 1, 1024, 2048, 2048, 1024, 1024]
    - [51, 172.99]
  - - [2048, 4096, 1, 2048, 2048, 2048, 2048, 2048]
    - [0, 211.2]
  - - [2048, 4096, 1, 4096, 2048, 2048, 4096, 4096]
    - [40, 260.83]
  - - [2048, 4096, 1, 8192, 2048, 2048, 8192, 8192]
    - [35, 309.88]
  - - [2048, 8192, 1, 128, 2048, 2048, 128, 128]
    - [31, 49.0]
  - - [2048, 8192, 1, 256, 2048, 2048, 256, 256]
    - [32, 88.22]
  - - [2048, 8192, 1, 512, 2048, 2048, 512, 512]
    - [31, 145.87]
  - - [2048, 8192, 1, 1024, 2048, 2048, 1024, 1024]
    - [34, 216.83]
  - - [2048, 8192, 1, 2048, 2048, 2048, 2048, 2048]
    - [33, 264.72]
  - - [2048, 8192, 1, 4096, 2048, 2048, 4096, 4096]
    - [31, 293.84]
  - - [2048, 8192, 1, 8192, 2048, 2048, 8192, 8192]
    - [31, 345.97]
  - - [4096, 128, 1, 128, 4096, 4096, 128, 128]
    - [20, 14.51]
  - - [4096, 128, 1, 256, 4096, 4096, 256, 256]
    - [19, 26.11]
  - - [4096, 128, 1, 512, 4096, 4096, 512, 512]
    - [19, 42.87]
  - - [4096, 128, 1, 1024, 4096, 4096, 1024, 1024]
    - [66, 68.73]
  - - [4096, 128, 1, 2048, 4096, 4096, 2048, 2048]
    - [67, 97.81]
  - - [4096, 128, 1, 4096, 4096, 4096, 4096, 4096]
    - [70, 121.47]
  - - [4096, 128, 1, 8192, 4096, 4096, 8192, 8192]
    - [92, 137.81]
  - - [4096, 256, 1, 128, 4096, 4096, 128, 128]
    - [12, 23.3]
  - - [4096, 256, 1, 256, 4096, 4096, 256, 256]
    - [12, 41.88]
  - - [4096, 256, 1, 512, 4096, 4096, 512, 512]
    - [12, 71.01]
  - - [4096, 256, 1, 1024, 4096, 4096, 1024, 1024]
    - [14, 107.63]
  - - [4096, 256, 1, 2048, 4096, 4096, 2048, 2048]
    - [14, 147.27]
  - - [4096, 256, 1, 4096, 4096, 4096, 4096, 4096]
    - [88, 164.45]
  - - [4096, 256, 1, 8192, 4096, 4096, 8192, 8192]
    - [88, 185.17]
  - - [4096, 512, 1, 128, 4096, 4096, 128, 128]
    - [7, 31.24]
  - - [4096, 512, 1, 256, 4096, 4096, 256, 256]
    - [6, 56.5]
  - - [4096, 512, 1, 512, 4096, 4096, 512, 512]
    - [57, 88.83]
  - - [4096, 512, 1, 1024, 4096, 4096, 1024, 1024]
    - [57, 139.94]
  - - [4096, 512, 1, 2048, 4096, 4096, 2048, 2048]
    - [59, 191.19]
  - - [4096, 512, 1, 4096, 4096, 4096, 4096, 4096]
    - [57, 211.16]
  - - [4096, 512, 1, 8192, 4096, 4096, 8192, 8192]
    - [61, 242.69]
  - - [4096, 1024, 1, 128, 4096, 4096, 128, 128]
    - [37, 36.05]
  - - [4096, 1024, 1, 256, 4096, 4096, 256, 256]
    - [3, 64.79]
  - - [4096, 1024, 1, 512, 4096, 4096, 512, 512]
    - [30, 105.04]
  - - [4096, 1024, 1, 1024, 4096, 4096, 1024, 1024]
    - [29, 159.17]
  - - [4096, 1024, 1, 2048, 4096, 4096, 2048, 2048]
    - [39, 208.42]
  - - [4096, 1024, 1, 4096, 4096, 4096, 4096, 4096]
    - [52, 246.17]
  - - [4096, 1024, 1, 8192, 4096, 4096, 8192, 8192]
    - [54, 263.16]
  - - [4096, 2048, 1, 128, 4096, 4096, 128, 128]
    - [4, 39.75]
  - - [4096, 2048, 1, 256, 4096, 4096, 256, 256]
    - [4, 71.42]
  - - [4096, 2048, 1, 512, 4096, 4096, 512, 512]
    - [30, 111.04]
  - - [4096, 2048, 1, 1024, 4096, 4096, 1024, 1024]
    - [39, 164.86]
  - - [4096, 2048, 1, 2048, 4096, 4096, 2048, 2048]
    - [53, 218.74]
  - - [4096, 2048, 1, 4096, 4096, 4096, 4096, 4096]
    - [40, 262.34]
  - - [4096, 2048, 1, 8192, 4096, 4096, 8192, 8192]
    - [38, 328.85]
  - - [4096, 4096, 1, 128, 4096, 4096, 128, 128]
    - [4, 44.13]
  - - [4096, 4096, 1, 256, 4096, 4096, 256, 256]
    - [13, 79.15]
  - - [4096, 4096, 1, 512, 4096, 4096, 512, 512]
    - [64, 122.0]
  - - [4096, 4096, 1, 1024, 4096, 4096, 1024, 1024]
    - [57, 182.72]
  - - [4096, 4096, 1, 2048, 4096, 4096, 2048, 2048]
    - [35, 237.56]
  - - [4096, 4096, 1, 4096, 4096, 4096, 4096, 4096]
    - [39, 292.82]
  - - [4096, 4096, 1, 8192, 4096, 4096, 8192, 8192]
    - [39, 327.93]
  - - [4096, 8192, 1, 128, 4096, 4096, 128, 128]
    - [33, 49.04]
  - - [4096, 8192, 1, 256, 4096, 4096, 256, 256]
    - [35, 85.16]
  - - [4096, 8192, 1, 512, 4096, 4096, 512, 512]
    - [33, 140.52]
  - - [4096, 8192, 1, 1024, 4096, 4096, 1024, 1024]
    - [33, 200.31]
  - - [4096, 8192, 1, 2048, 4096, 4096, 2048, 2048]
    - [35, 251.1]
  - - [4096, 8192, 1, 4096, 4096, 4096, 4096, 4096]
    - [36, 294.85]
  - - [4096, 8192, 1, 8192, 4096, 4096, 8192, 8192]
    - [36, 353.5]
  - - [8192, 128, 1, 128, 8192, 8192, 128, 128]
    - [12, 22.67]
  - - [8192, 128, 1, 256, 8192, 8192, 256, 256]
    - [11, 40.52]
  - - [8192, 128, 1, 512, 8192, 8192, 512, 512]
    - [16, 68.23]
  - - [8192, 128, 1, 1024, 8192, 8192, 1024, 1024]
    - [16, 107.45]
  - - [8192, 128, 1, 2048, 8192, 8192, 2048, 2048]
    - [62, 140.45]
  - - [8192, 128, 1, 4096, 8192, 8192, 4096, 4096]
    - [89, 162.19]
  - - [8192, 128, 1, 8192, 8192, 8192, 8192, 8192]
    - [91, 184.45]
  - - [8192, 256, 1, 128, 8192, 8192, 128, 128]
    - [49, 33.56]
  - - [8192, 256, 1, 256, 8192, 8192, 256, 256]
    - [48, 60.13]
  - - [8192, 256, 1, 512, 8192, 8192, 512, 512]
    - [50, 102.6]
  - - [8192, 256, 1, 1024, 8192, 8192, 1024, 1024]
    - [48, 151.12]
  - - [8192, 256, 1, 2048, 8192, 8192, 2048, 2048]
    - [50, 178.42]
  - - [8192, 256, 1, 4096, 8192, 8192, 4096, 4096]
    - [58, 210.93]
  - - [8192, 256, 1, 8192, 8192, 8192, 8192, 8192]
    - [59, 243.15]
  - - [8192, 512, 1, 128, 8192, 8192, 128, 128]
    - [52, 41.54]
  - - [8192, 512, 1, 256, 8192, 8192, 256, 256]
    - [54, 76.8]
  - - [8192, 512, 1, 512, 8192, 8192, 512, 512]
    - [52, 127.54]
  - - [8192, 512, 1, 1024, 8192, 8192, 1024, 1024]
    - [53, 174.61]
  - - [8192, 512, 1, 2048, 8192, 8192, 2048, 2048]
    - [54, 217.93]
  - - [8192, 512, 1, 4096, 8192, 8192, 4096, 4096]
    - [54, 287.69]
  - - [8192, 512, 1, 8192, 8192, 8192, 8192, 8192]
    - [53, 313.93]
  - - [8192, 1024, 1, 128, 8192, 8192, 128, 128]
    - [39, 42.63]
  - - [8192, 1024, 1, 256, 8192, 8192, 256, 256]
    - [39, 78.48]
  - - [8192, 1024, 1, 512, 8192, 8192, 512, 512]
    - [40, 135.33]
  - - [8192, 1024, 1, 1024, 8192, 8192, 1024, 1024]
    - [40, 188.79]
  - - [8192, 1024, 1, 2048, 8192, 8192, 2048, 2048]
    - [41, 273.23]
  - - [8192, 1024, 1, 4096, 8192, 8192, 4096, 4096]
    - [40, 331.93]
  - - [8192, 1024, 1, 8192, 8192, 8192, 8192, 8192]
    - [39, 367.1]
  - - [8192, 2048, 1, 128, 8192, 8192, 128, 128]
    - [41, 47.58]
  - - [8192, 2048, 1, 256, 8192, 8192, 256, 256]
    - [41, 85.67]
  - - [8192, 2048, 1, 512, 8192, 8192, 512, 512]
    - [41, 142.43]
  - - [8192, 2048, 1, 1024, 8192, 8192, 1024, 1024]
    - [39, 212.76]
  - - [8192, 2048, 1, 2048, 8192, 8192, 2048, 2048]
    - [39, 278.28]
  - - [8192, 2048, 1, 4096, 8192, 8192, 4096, 4096]
    - [40, 316.38]
  - - [8192, 2048, 1, 8192, 8192, 8192, 8192, 8192]
    - [39, 376.78]
  - - [8192, 4096, 1, 128, 8192, 8192, 128, 128]
    - [40, 46.68]
  - - [8192, 4096, 1, 256, 8192, 8192, 256, 256]
    - [40, 81.47]
  - - [8192, 4096, 1, 512, 8192, 8192, 512, 512]
    - [38, 130.77]
  - - [8192, 4096, 1, 1024, 8192, 8192, 1024, 1024]
    - [38, 187.95]
  - - [8192, 4096, 1, 2048, 8192, 8192, 2048, 2048]
    - [38, 256.72]
  - - [8192, 4096, 1, 4096, 8192, 8192, 4096, 4096]
    - [40, 309.24]
  - - [8192, 4096, 1, 8192, 8192, 8192, 8192, 8192]
    - [41, 385.74]
  - - [8192, 8192, 1, 128, 8192, 8192, 128, 128]
    - [31, 43.51]
  - - [8192, 8192, 1, 256, 8192, 8192, 256, 256]
    - [35, 75.83]
  - - [8192, 8192, 1, 512, 8192, 8192, 512, 512]
    - [32, 121.98]
  - - [8192, 8192, 1, 1024, 8192, 8192, 1024, 1024]
    - [34, 184.0]
  - - [8192, 8192, 1, 2048, 8192, 8192, 2048, 2048]
    - [39, 255.85]
  - - [8192, 8192, 1, 4096, 8192, 8192, 4096, 4096]
    - [29, 309.93]
  - - [8192, 8192, 1, 8192, 8192, 8192, 8192, 8192]
    - [41, 371.04]
  - - [1, 1, 1, 32, 1, 1, 32, 32]
    - [101, 0.0]
- null
- null
- ExperimentalStreamK
- GridBased
