projects/hipblaslt/library/src/amd_detail/rocblaslt/src/Tensile/Logic/asm_full/aquavanjaram/gfx942_228cu/StreamK/aquavanjaram942_Cijk_Alik_Bjlk_HHS_BH_Bias_HAS_SAV_UserArgs.yaml
- {MinimumRequiredVersion: 4.33.0}
- aquavanjaram942
- {Architecture: gfx942, CUCount: 228}
- [Device 0049, Device 0050]
    SolutionIndex: 0
    SolutionNameMin: Cijk_Alik_Bjlk_HHS_BH_Bias_AS_SAV_UserArgs_MT256x256x32_MI16x16x1_SN_LDSB1_CLR1_GRVWB8_GSU0_GSUC0_GSUWGMRR0_K1_LBSPPA512_LBSPPB2048_LPB0_MIWT8_8_PLR1_SU0_SUM0_SUS64_VWA8_VWB8_WGM1_WGMXCC1_WGMXCCGn1
    SolutionIndex: 1
    SolutionNameMin: Cijk_Alik_Bjlk_HHS_BH_Bias_AS_SAV_UserArgs_MT256x256x32_MI16x16x1_SN_LDSB1_CLR1_GRVWB8_GSU0_GSUC0_GSUWGMRR0_K1_LBSPPA512_LBSPPB2048_LPB0_MIWT8_8_PLR1_SU0_SUM0_SUS64_VWA8_VWB8_WGM1_WGMXCC1_WGMXCCGn1
    SolutionIndex: 2
    SolutionNameMin: Cijk_Alik_Bjlk_HHS_BH_Bias_AS_SAV_UserArgs_MT256x256x32_MI16x16x1_SN_LDSB1_CLR1_GRVWB8_GSU0_GSUC0_GSUWGMRR0_K1_LBSPPA512_LBSPPB2048_LPB0_MIWT8_8_PLR1_SU0_SUM0_SUS64_VWA8_VWB8_WGM1_WGMXCC1_WGMXCCGn1
    SolutionIndex: 3
    SolutionNameMin: Cijk_Alik_Bjlk_HHS_BH_Bias_AS_SAV_UserArgs_MT256x256x32_MI16x16x1_SN_LDSB1_CLR1_GRVWB8_GSU0_GSUC0_GSUWGMRR0_K1_LBSPPA512_LBSPPB4096_LPB0_MIWT8_8_PLR1_SU0_SUM0_SUS64_VWA8_VWB8_WGM1_WGMXCC1_WGMXCCGn1
    SolutionIndex: 4
    SolutionNameMin: Cijk_Alik_Bjlk_HHS_BH_Bias_AS_SAV_UserArgs_MT256x256x32_MI16x16x1_SN_LDSB1_CLR1_GRVWB4_GSU0_GSUC0_GSUWGMRR0_K1_LBSPPA512_LBSPPB2048_LPB0_MIWT8_8_PLR1_SU0_SUM0_SUS64_VWA8_VWB8_WGM4_WGMXCC1_WGMXCCGn1
    SolutionIndex: 5
    SolutionNameMin: Cijk_Alik_Bjlk_HHS_BH_Bias_AS_SAV_UserArgs_MT256x256x32_MI16x16x1_SN_LDSB1_CLR1_GRVWB8_GSU0_GSUC0_GSUWGMRR0_K1_LBSPPA512_LBSPPB2048_LPB0_MIWT8_8_PLR1_SU0_SUM0_SUS64_VWA8_VWB8_WGM4_WGMXCC1_WGMXCCGn1
    SolutionIndex: 6
    SolutionNameMin: Cijk_Alik_Bjlk_HHS_BH_Bias_AS_SAV_UserArgs_MT256x256x32_MI16x16x1_SN_LDSB1_CLR1_GRVWB8_GSU0_GSUC0_GSUWGMRR0_K1_LBSPPA512_LBSPPB2048_LPB0_MIWT8_8_PLR1_SU0_SUM0_SUS64_VWA8_VWB8_WGM4_WGMXCC1_WGMXCCGn1
    SolutionIndex: 7
    SolutionNameMin: Cijk_Alik_Bjlk_HHS_BH_Bias_AS_SAV_UserArgs_MT256x256x32_MI16x16x1_SN_LDSB1_CLR1_GRVWB2_GSU0_GSUC0_GSUWGMRR0_K1_LBSPPA512_LBSPPB2048_LPB0_MIWT8_8_PLR1_SU0_SUM0_SUS64_VWA8_VWB8_WGM6_WGMXCC1_WGMXCCGn1
    SolutionIndex: 8
    SolutionNameMin: Cijk_Alik_Bjlk_HHS_BH_Bias_AS_SAV_UserArgs_MT256x256x32_MI16x16x1_SN_LDSB1_CLR1_GRVWB8_GSU0_GSUC0_GSUWGMRR0_K1_LBSPPA512_LBSPPB2048_LPB0_MIWT8_8_PLR1_SU0_SUM0_SUS64_VWA8_VWB8_WGM6_WGMXCC1_WGMXCCGn1
    SolutionIndex: 9
    SolutionNameMin: Cijk_Alik_Bjlk_HHS_BH_Bias_AS_SAV_UserArgs_MT256x256x32_MI16x16x1_SN_LDSB1_CLR1_GRVWB8_GSU0_GSUC0_GSUWGMRR0_K1_LBSPPA512_LBSPPB2048_LPB0_MIWT8_8_PLR1_SU0_SUM0_SUS64_VWA8_VWB8_WGM6_WGMXCC1_WGMXCCGn1
    SolutionIndex: 10
    SolutionNameMin: Cijk_Alik_Bjlk_HHS_BH_Bias_AS_SAV_UserArgs_MT256x256x32_MI16x16x1_SN_LDSB1_CLR1_GRVWB8_GSU0_GSUC0_GSUWGMRR0_K1_LBSPPA512_LBSPPB4096_LPB0_MIWT8_8_PLR1_SU0_SUM0_SUS64_VWA8_VWB8_WGM6_WGMXCC1_WGMXCCGn1
    SolutionIndex: 11
    SolutionNameMin: Cijk_Alik_Bjlk_HHS_BH_Bias_AS_SAV_UserArgs_MT256x256x32_MI16x16x1_SN_LDSB1_CLR1_GRVWB8_GSU0_GSUC0_GSUWGMRR0_K1_LBSPPA512_LBSPPB2048_LPB0_MIWT8_8_PLR1_SU0_SUM0_SUS64_VWA8_VWB8_WGM8_WGMXCC1_WGMXCCGn1
    SolutionIndex: 12
    SolutionNameMin: Cijk_Alik_Bjlk_HHS_BH_Bias_AS_SAV_UserArgs_MT256x256x32_MI16x16x1_SN_LDSB1_CLR1_GRVWB8_GSU0_GSUC0_GSUWGMRR0_K1_LBSPPA512_LBSPPB2048_LPB0_MIWT8_8_PLR1_SU0_SUM0_SUS64_VWA8_VWB8_WGM8_WGMXCC1_WGMXCCGn1
    SolutionIndex: 13
    SolutionNameMin: Cijk_Alik_Bjlk_HHS_BH_Bias_AS_SAV_UserArgs_MT128x256x32_MI16x16x1_SN_LDSB1_CLR1_GRVWB8_GSU0_GSUC0_GSUWGMRR0_K1_LBSPPA256_LBSPPB2048_LPB0_MIWT4_8_PLR1_SU0_SUM0_SUS64_VWA4_VWB8_WGM1_WGMXCC1_WGMXCCGn1
    SolutionIndex: 14
    SolutionNameMin: Cijk_Alik_Bjlk_HHS_BH_Bias_AS_SAV_UserArgs_MT128x256x32_MI16x16x1_SN_LDSB1_CLR1_GRVWB8_GSU0_GSUC0_GSUWGMRR0_K1_LBSPPA256_LBSPPB2048_LPB0_MIWT4_8_PLR1_SU0_SUM0_SUS64_VWA4_VWB8_WGM1_WGMXCC1_WGMXCCGn1
    SolutionIndex: 15
    SolutionNameMin: Cijk_Alik_Bjlk_HHS_BH_Bias_AS_SAV_UserArgs_MT128x256x32_MI16x16x1_SN_LDSB1_CLR1_GRVWB8_GSU0_GSUC0_GSUWGMRR0_K1_LBSPPA256_LBSPPB2048_LPB0_MIWT4_8_PLR1_SU0_SUM0_SUS64_VWA4_VWB8_WGM1_WGMXCC1_WGMXCCGn1
    SolutionIndex: 16
    SolutionNameMin: Cijk_Alik_Bjlk_HHS_BH_Bias_AS_SAV_UserArgs_MT128x256x32_MI16x16x1_SN_LDSB1_CLR1_GRVWB8_GSU0_GSUC0_GSUWGMRR0_K1_LBSPPA256_LBSPPB2048_LPB0_MIWT4_8_PLR1_SU0_SUM0_SUS64_VWA4_VWB8_WGM4_WGMXCC1_WGMXCCGn1
    SolutionIndex: 17
    SolutionNameMin: Cijk_Alik_Bjlk_HHS_BH_Bias_AS_SAV_UserArgs_MT128x256x32_MI16x16x1_SN_LDSB1_CLR1_GRVWB8_GSU0_GSUC0_GSUWGMRR0_K1_LBSPPA256_LBSPPB2048_LPB0_MIWT4_8_PLR1_SU0_SUM0_SUS64_VWA4_VWB8_WGM4_WGMXCC1_WGMXCCGn1
    SolutionIndex: 18
    SolutionNameMin: Cijk_Alik_Bjlk_HHS_BH_Bias_AS_SAV_UserArgs_MT128x256x32_MI16x16x1_SN_LDSB1_CLR1_GRVWB8_GSU0_GSUC0_GSUWGMRR0_K1_LBSPPA256_LBSPPB2048_LPB0_MIWT4_8_PLR1_SU0_SUM0_SUS64_VWA4_VWB8_WGM6_WGMXCC1_WGMXCCGn1
    SolutionIndex: 19
    SolutionNameMin: Cijk_Alik_Bjlk_HHS_BH_Bias_AS_SAV_UserArgs_MT128x256x32_MI16x16x1_SN_LDSB1_CLR1_GRVWB8_GSU0_GSUC0_GSUWGMRR0_K1_LBSPPA256_LBSPPB2048_LPB0_MIWT4_8_PLR1_SU0_SUM0_SUS64_VWA4_VWB8_WGM6_WGMXCC1_WGMXCCGn1
    SolutionIndex: 20
    SolutionNameMin: Cijk_Alik_Bjlk_HHS_BH_Bias_AS_SAV_UserArgs_MT128x256x32_MI16x16x1_SN_LDSB1_CLR1_GRVWB8_GSU0_GSUC0_GSUWGMRR0_K1_LBSPPA256_LBSPPB2048_LPB0_MIWT4_8_PLR1_SU0_SUM0_SUS64_VWA4_VWB8_WGM6_WGMXCC1_WGMXCCGn1
    SolutionIndex: 21
    SolutionNameMin: Cijk_Alik_Bjlk_HHS_BH_Bias_AS_SAV_UserArgs_MT128x256x32_MI16x16x1_SN_LDSB1_CLR1_GRVWB8_GSU0_GSUC0_GSUWGMRR0_K1_LBSPPA256_LBSPPB2048_LPB0_MIWT4_8_PLR1_SU0_SUM0_SUS64_VWA4_VWB8_WGM8_WGMXCC1_WGMXCCGn1
    SolutionIndex: 22
    SolutionNameMin: Cijk_Alik_Bjlk_HHS_BH_Bias_AS_SAV_UserArgs_MT256x128x32_MI16x16x1_SN_LDSB1_CLR1_GRVWB8_GSU0_GSUC0_GSUWGMRR0_K1_LBSPPA512_LBSPPB1024_LPB0_MIWT8_4_PLR1_SU0_SUM0_SUS64_VWA8_VWB4_WGM1_WGMXCC1_WGMXCCGn1
    SolutionIndex: 23
    SolutionNameMin: Cijk_Alik_Bjlk_HHS_BH_Bias_AS_SAV_UserArgs_MT256x128x32_MI16x16x1_SN_LDSB1_CLR1_GRVWB8_GSU0_GSUC0_GSUWGMRR0_K1_LBSPPA512_LBSPPB2048_LPB0_MIWT8_4_PLR1_SU0_SUM0_SUS64_VWA8_VWB4_WGM1_WGMXCC1_WGMXCCGn1
    SolutionIndex: 24
    SolutionNameMin: Cijk_Alik_Bjlk_HHS_BH_Bias_AS_SAV_UserArgs_MT256x128x32_MI16x16x1_SN_LDSB1_CLR1_GRVWB8_GSU0_GSUC0_GSUWGMRR0_K1_LBSPPA512_LBSPPB1024_LPB0_MIWT8_4_PLR1_SU0_SUM0_SUS64_VWA8_VWB4_WGM6_WGMXCC1_WGMXCCGn1
    SolutionIndex: 25
    SolutionNameMin: Cijk_Alik_Bjlk_HHS_BH_Bias_AS_SAV_UserArgs_MT256x128x32_MI16x16x1_SN_LDSB1_CLR1_GRVWB8_GSU0_GSUC0_GSUWGMRR0_K1_LBSPPA512_LBSPPB1024_LPB0_MIWT8_4_PLR1_SU0_SUM0_SUS64_VWA8_VWB4_WGM8_WGMXCC1_WGMXCCGn1
    SolutionIndex: 26
    SolutionNameMin: Cijk_Alik_Bjlk_HHS_BH_Bias_AS_SAV_UserArgs_MT256x128x32_MI16x16x1_SN_LDSB1_CLR1_GRVWB8_GSU0_GSUC0_GSUWGMRR0_K1_LBSPPA512_LBSPPB1024_LPB0_MIWT8_4_PLR1_SU0_SUM0_SUS64_VWA8_VWB4_WGM8_WGMXCC1_WGMXCCGn1
    SolutionIndex: 27
    SolutionNameMin: Cijk_Alik_Bjlk_HHS_BH_Bias_AS_SAV_UserArgs_MT128x128x32_MI16x16x1_SN_LDSB1_CLR1_GRVWB8_GSU0_GSUC0_GSUWGMRR0_K1_LBSPPA256_LBSPPB1024_LPB0_MIWT4_4_PLR1_SU0_SUM0_SUS64_VWA4_VWB4_WGM4_WGMXCC1_WGMXCCGn1
    SolutionIndex: 28
    SolutionNameMin: Cijk_Alik_Bjlk_HHS_BH_Bias_AS_SAV_UserArgs_MT128x256x64_MI16x16x1_SN_LDSB1_CLR1_GRVWB8_GSU0_GSUC0_GSUWGMRR0_K1_LBSPPA512_LBSPPB4096_LPB0_MIWT4_8_PLR1_SU0_SUM0_SUS128_VWA4_VWB8_WGM1_WGMXCC1_WGMXCCGn1
    SolutionIndex: 29
    SolutionNameMin: Cijk_Alik_Bjlk_HHS_BH_Bias_AS_SAV_UserArgs_MT128x256x64_MI16x16x1_SN_LDSB1_CLR1_GRVWB8_GSU0_GSUC0_GSUWGMRR0_K1_LBSPPA512_LBSPPB4096_LPB0_MIWT4_8_PLR1_SU0_SUM0_SUS128_VWA4_VWB8_WGM1_WGMXCC1_WGMXCCGn1
    SolutionIndex: 30
    SolutionNameMin: Cijk_Alik_Bjlk_HHS_BH_Bias_AS_SAV_UserArgs_MT128x256x64_MI16x16x1_SN_LDSB1_CLR1_GRVWB8_GSU0_GSUC0_GSUWGMRR0_K1_LBSPPA512_LBSPPB4096_LPB0_MIWT4_8_PLR1_SU0_SUM0_SUS128_VWA4_VWB8_WGM1_WGMXCC1_WGMXCCGn1
    SolutionIndex: 31
    SolutionNameMin: Cijk_Alik_Bjlk_HHS_BH_Bias_AS_SAV_UserArgs_MT128x256x64_MI16x16x1_SN_LDSB1_CLR1_GRVWB8_GSU0_GSUC0_GSUWGMRR0_K1_LBSPPA512_LBSPPB2048_LPB0_MIWT4_8_PLR1_SU0_SUM0_SUS128_VWA4_VWB8_WGM4_WGMXCC1_WGMXCCGn1
    SolutionIndex: 32
    SolutionNameMin: Cijk_Alik_Bjlk_HHS_BH_Bias_AS_SAV_UserArgs_MT128x256x64_MI16x16x1_SN_LDSB1_CLR1_GRVWB8_GSU0_GSUC0_GSUWGMRR0_K1_LBSPPA512_LBSPPB4096_LPB0_MIWT4_8_PLR1_SU0_SUM0_SUS128_VWA4_VWB8_WGM4_WGMXCC1_WGMXCCGn1
    SolutionIndex: 33
    SolutionNameMin: Cijk_Alik_Bjlk_HHS_BH_Bias_AS_SAV_UserArgs_MT128x256x64_MI16x16x1_SN_LDSB1_CLR1_GRVWB8_GSU0_GSUC0_GSUWGMRR0_K1_LBSPPA512_LBSPPB4096_LPB0_MIWT4_8_PLR1_SU0_SUM0_SUS128_VWA4_VWB8_WGM4_WGMXCC1_WGMXCCGn1
    SolutionIndex: 34
    SolutionNameMin: Cijk_Alik_Bjlk_HHS_BH_Bias_AS_SAV_UserArgs_MT128x256x64_MI16x16x1_SN_LDSB1_CLR1_GRVWB8_GSU0_GSUC0_GSUWGMRR0_K1_LBSPPA512_LBSPPB4096_LPB0_MIWT4_8_PLR1_SU0_SUM0_SUS128_VWA4_VWB8_WGM4_WGMXCC1_WGMXCCGn1
    SolutionIndex: 35
    SolutionNameMin: Cijk_Alik_Bjlk_HHS_BH_Bias_AS_SAV_UserArgs_MT128x256x64_MI16x16x1_SN_LDSB1_CLR1_GRVWB8_GSU0_GSUC0_GSUWGMRR0_K1_LBSPPA512_LBSPPB4096_LPB0_MIWT4_8_PLR1_SU0_SUM0_SUS128_VWA4_VWB8_WGM6_WGMXCC1_WGMXCCGn1
    SolutionIndex: 36
    SolutionNameMin: Cijk_Alik_Bjlk_HHS_BH_Bias_AS_SAV_UserArgs_MT128x256x64_MI16x16x1_SN_LDSB1_CLR1_GRVWB8_GSU0_GSUC0_GSUWGMRR0_K1_LBSPPA512_LBSPPB4096_LPB0_MIWT4_8_PLR1_SU0_SUM0_SUS128_VWA4_VWB8_WGM8_WGMXCC1_WGMXCCGn1
    SolutionIndex: 37
    SolutionNameMin: Cijk_Alik_Bjlk_HHS_BH_Bias_AS_SAV_UserArgs_MT128x128x64_MI16x16x1_SN_LDSB1_CLR1_GRVWB8_GSU0_GSUC0_GSUWGMRR0_K1_LBSPPA512_LBSPPB1024_LPB0_MIWT4_4_PLR1_SU0_SUM0_SUS128_VWA4_VWB4_WGM1_WGMXCC1_WGMXCCGn1
    SolutionIndex: 38
    SolutionNameMin: Cijk_Alik_Bjlk_HHS_BH_Bias_AS_SAV_UserArgs_MT128x128x64_MI16x16x1_SN_LDSB1_CLR1_GRVWB8_GSU0_GSUC0_GSUWGMRR0_K1_LBSPPA512_LBSPPB2048_LPB0_MIWT4_4_PLR1_SU0_SUM0_SUS128_VWA4_VWB4_WGM1_WGMXCC1_WGMXCCGn1
    SolutionIndex: 39
    SolutionNameMin: Cijk_Alik_Bjlk_HHS_BH_Bias_AS_SAV_UserArgs_MT128x128x64_MI16x16x1_SN_LDSB1_CLR1_GRVWB8_GSU0_GSUC0_GSUWGMRR0_K1_LBSPPA512_LBSPPB2048_LPB0_MIWT4_4_PLR1_SU0_SUM0_SUS128_VWA4_VWB4_WGM1_WGMXCC1_WGMXCCGn1
    SolutionIndex: 40
    SolutionNameMin: Cijk_Alik_Bjlk_HHS_BH_Bias_AS_SAV_UserArgs_MT128x128x64_MI16x16x1_SN_LDSB1_CLR1_GRVWB8_GSU0_GSUC0_GSUWGMRR0_K1_LBSPPA512_LBSPPB2048_LPB0_MIWT4_4_PLR1_SU0_SUM0_SUS128_VWA4_VWB4_WGM4_WGMXCC1_WGMXCCGn1
    SolutionIndex: 41
    SolutionNameMin: Cijk_Alik_Bjlk_HHS_BH_Bias_AS_SAV_UserArgs_MT128x128x64_MI16x16x1_SN_LDSB1_CLR1_GRVWB8_GSU0_GSUC0_GSUWGMRR0_K1_LBSPPA512_LBSPPB2048_LPB0_MIWT4_4_PLR1_SU0_SUM0_SUS128_VWA4_VWB4_WGM4_WGMXCC1_WGMXCCGn1
    SolutionIndex: 42
    SolutionNameMin: Cijk_Alik_Bjlk_HHS_BH_Bias_AS_SAV_UserArgs_MT128x128x64_MI16x16x1_SN_LDSB1_CLR1_GRVWB8_GSU0_GSUC0_GSUWGMRR0_K1_LBSPPA512_LBSPPB1024_LPB0_MIWT4_4_PLR1_SU0_SUM0_SUS128_VWA4_VWB4_WGM6_WGMXCC1_WGMXCCGn1
    SolutionIndex: 43
    SolutionNameMin: Cijk_Alik_Bjlk_HHS_BH_Bias_AS_SAV_UserArgs_MT128x128x64_MI16x16x1_SN_LDSB1_CLR1_GRVWB8_GSU0_GSUC0_GSUWGMRR0_K1_LBSPPA512_LBSPPB2048_LPB0_MIWT4_4_PLR1_SU0_SUM0_SUS128_VWA4_VWB4_WGM6_WGMXCC1_WGMXCCGn1
    SolutionIndex: 44
    SolutionNameMin: Cijk_Alik_Bjlk_HHS_BH_Bias_AS_SAV_UserArgs_MT128x128x64_MI16x16x1_SN_LDSB1_CLR1_GRVWB8_GSU0_GSUC0_GSUWGMRR0_K1_LBSPPA512_LBSPPB2048_LPB0_MIWT4_4_PLR1_SU0_SUM0_SUS128_VWA4_VWB4_WGM6_WGMXCC1_WGMXCCGn1
    SolutionIndex: 45
    SolutionNameMin: Cijk_Alik_Bjlk_HHS_BH_Bias_AS_SAV_UserArgs_MT128x128x64_MI16x16x1_SN_LDSB1_CLR1_GRVWB8_GSU0_GSUC0_GSUWGMRR0_K1_LBSPPA512_LBSPPB1024_LPB0_MIWT4_4_PLR1_SU0_SUM0_SUS128_VWA4_VWB4_WGM8_WGMXCC1_WGMXCCGn1
    SolutionIndex: 46
    SolutionNameMin: Cijk_Alik_Bjlk_HHS_BH_Bias_AS_SAV_UserArgs_MT128x128x64_MI16x16x1_SN_LDSB1_CLR1_GRVWB8_GSU0_GSUC0_GSUWGMRR0_K1_LBSPPA512_LBSPPB1024_LPB0_MIWT4_4_PLR1_SU0_SUM0_SUS128_VWA4_VWB4_WGM8_WGMXCC1_WGMXCCGn1
    SolutionIndex: 47
    SolutionNameMin: Cijk_Alik_Bjlk_HHS_BH_Bias_AS_SAV_UserArgs_MT128x128x64_MI16x16x1_SN_LDSB1_CLR1_GRVWB8_GSU0_GSUC0_GSUWGMRR0_K1_LBSPPA512_LBSPPB2048_LPB0_MIWT4_4_PLR1_SU0_SUM0_SUS128_VWA4_VWB4_WGM8_WGMXCC1_WGMXCCGn1
    SolutionIndex: 48
    SolutionNameMin: Cijk_Alik_Bjlk_HHS_BH_Bias_AS_SAV_UserArgs_MT128x128x64_MI16x16x1_SN_LDSB1_CLR1_GRVWB8_GSU0_GSUC0_GSUWGMRR0_K1_LBSPPA512_LBSPPB2048_LPB0_MIWT4_4_PLR1_SU0_SUM0_SUS128_VWA4_VWB4_WGM8_WGMXCC1_WGMXCCGn1
    SolutionIndex: 49
    SolutionNameMin: Cijk_Alik_Bjlk_HHS_BH_Bias_AS_SAV_UserArgs_MT64x128x64_MI16x16x1_SN_LDSB1_CLR1_GRVWB8_GSU0_GSUC0_GSUWGMRR0_K1_LBSPPA256_LBSPPB1024_LPB0_MIWT2_4_PLR1_SU0_SUM0_SUS128_VWA2_VWB4_WGM1_WGMXCC1_WGMXCCGn1
    SolutionIndex: 50
    SolutionNameMin: Cijk_Alik_Bjlk_HHS_BH_Bias_AS_SAV_UserArgs_MT64x128x64_MI16x16x1_SN_LDSB1_CLR1_GRVWB8_GSU0_GSUC0_GSUWGMRR0_K1_LBSPPA256_LBSPPB1024_LPB0_MIWT2_4_PLR1_SU0_SUM0_SUS128_VWA2_VWB4_WGM1_WGMXCC1_WGMXCCGn1
    SolutionIndex: 51
    SolutionNameMin: Cijk_Alik_Bjlk_HHS_BH_Bias_AS_SAV_UserArgs_MT64x128x64_MI16x16x1_SN_LDSB1_CLR1_GRVWB8_GSU0_GSUC0_GSUWGMRR0_K1_LBSPPA256_LBSPPB2048_LPB0_MIWT2_4_PLR1_SU0_SUM0_SUS128_VWA2_VWB4_WGM1_WGMXCC1_WGMXCCGn1
    SolutionIndex: 52
    SolutionNameMin: Cijk_Alik_Bjlk_HHS_BH_Bias_AS_SAV_UserArgs_MT64x128x64_MI16x16x1_SN_LDSB1_CLR1_GRVWB8_GSU0_GSUC0_GSUWGMRR0_K1_LBSPPA256_LBSPPB2048_LPB0_MIWT2_4_PLR1_SU0_SUM0_SUS128_VWA2_VWB4_WGM1_WGMXCC1_WGMXCCGn1
    SolutionIndex: 53
    SolutionNameMin: Cijk_Alik_Bjlk_HHS_BH_Bias_AS_SAV_UserArgs_MT64x128x64_MI16x16x1_SN_LDSB1_CLR1_GRVWB8_GSU0_GSUC0_GSUWGMRR0_K1_LBSPPA256_LBSPPB2048_LPB0_MIWT2_4_PLR1_SU0_SUM0_SUS128_VWA2_VWB4_WGM6_WGMXCC1_WGMXCCGn1
    SolutionIndex: 54
    SolutionNameMin: Cijk_Alik_Bjlk_HHS_BH_Bias_AS_SAV_UserArgs_MT128x64x64_MI16x16x1_SN_LDSB1_CLR1_GRVWB2_GSU0_GSUC0_GSUWGMRR0_K1_LBSPPA512_LBSPPB1024_LPB32_MIWT4_2_PLR1_SU0_SUM0_SUS128_VWA4_VWB2_WGM1_WGMXCC1_WGMXCCGn1
    SolutionIndex: 55
    SolutionNameMin: Cijk_Alik_Bjlk_HHS_BH_Bias_AS_SAV_UserArgs_MT128x64x64_MI16x16x1_SN_LDSB1_CLR1_GRVWB8_GSU0_GSUC0_GSUWGMRR0_K1_LBSPPA512_LBSPPB1024_LPB32_MIWT4_2_PLR1_SU0_SUM0_SUS128_VWA4_VWB2_WGM1_WGMXCC1_WGMXCCGn1
    SolutionIndex: 56
    SolutionNameMin: Cijk_Alik_Bjlk_HHS_BH_Bias_AS_SAV_UserArgs_MT128x64x64_MI16x16x1_SN_LDSB1_CLR1_GRVWB8_GSU0_GSUC0_GSUWGMRR0_K1_LBSPPA512_LBSPPB1024_LPB32_MIWT4_2_PLR1_SU0_SUM0_SUS128_VWA4_VWB2_WGM4_WGMXCC1_WGMXCCGn1
    SolutionIndex: 57
    SolutionNameMin: Cijk_Alik_Bjlk_HHS_BH_Bias_AS_SAV_UserArgs_MT128x64x64_MI16x16x1_SN_LDSB1_CLR1_GRVWB8_GSU0_GSUC0_GSUWGMRR0_K1_LBSPPA512_LBSPPB1024_LPB32_MIWT4_2_PLR1_SU0_SUM0_SUS128_VWA4_VWB2_WGM6_WGMXCC1_WGMXCCGn1
    SolutionIndex: 58
    SolutionNameMin: Cijk_Alik_Bjlk_HHS_BH_Bias_AS_SAV_UserArgs_MT64x64x64_MI16x16x1_SN_LDSB1_CLR1_GRVWB8_GSU0_GSUC0_GSUWGMRR0_K1_LBSPPA256_LBSPPB512_LPB32_MIWT2_2_PLR1_SU0_SUM0_SUS128_VWA2_VWB2_WGM1_WGMXCC1_WGMXCCGn1
    SolutionIndex: 59
    SolutionNameMin: Cijk_Alik_Bjlk_HHS_BH_Bias_AS_SAV_UserArgs_MT64x64x64_MI16x16x1_SN_LDSB1_CLR1_GRVWB2_GSU0_GSUC0_GSUWGMRR0_K1_LBSPPA256_LBSPPB1024_LPB32_MIWT2_2_PLR1_SU0_SUM0_SUS128_VWA2_VWB2_WGM1_WGMXCC1_WGMXCCGn1
    SolutionIndex: 60
    SolutionNameMin: Cijk_Alik_Bjlk_HHS_BH_Bias_AS_SAV_UserArgs_MT64x64x64_MI16x16x1_SN_LDSB1_CLR1_GRVWB4_GSU0_GSUC0_GSUWGMRR0_K1_LBSPPA256_LBSPPB1024_LPB32_MIWT2_2_PLR1_SU0_SUM0_SUS128_VWA2_VWB2_WGM1_WGMXCC1_WGMXCCGn1
    SolutionIndex: 61
    SolutionNameMin: Cijk_Alik_Bjlk_HHS_BH_Bias_AS_SAV_UserArgs_MT64x64x64_MI16x16x1_SN_LDSB1_CLR1_GRVWB8_GSU0_GSUC0_GSUWGMRR0_K1_LBSPPA256_LBSPPB1024_LPB32_MIWT2_2_PLR1_SU0_SUM0_SUS128_VWA2_VWB2_WGM1_WGMXCC1_WGMXCCGn1
    SolutionIndex: 62
    SolutionNameMin: Cijk_Alik_Bjlk_HHS_BH_Bias_AS_SAV_UserArgs_MT64x64x64_MI16x16x1_SN_LDSB1_CLR1_GRVWB8_GSU0_GSUC0_GSUWGMRR0_K1_LBSPPA256_LBSPPB1024_LPB32_MIWT2_2_PLR1_SU0_SUM0_SUS128_VWA2_VWB2_WGM1_WGMXCC1_WGMXCCGn1
    SolutionIndex: 63
    SolutionNameMin: Cijk_Alik_Bjlk_HHS_BH_Bias_AS_SAV_UserArgs_MT64x64x64_MI16x16x1_SN_LDSB1_CLR1_GRVWB8_GSU0_GSUC0_GSUWGMRR0_K1_LBSPPA256_LBSPPB512_LPB32_MIWT2_2_PLR1_SU0_SUM0_SUS128_VWA2_VWB2_WGM4_WGMXCC1_WGMXCCGn1
    SolutionIndex: 64
    SolutionNameMin: Cijk_Alik_Bjlk_HHS_BH_Bias_AS_SAV_UserArgs_MT64x64x64_MI16x16x1_SN_LDSB1_CLR1_GRVWB8_GSU0_GSUC0_GSUWGMRR0_K1_LBSPPA256_LBSPPB1024_LPB32_MIWT2_2_PLR1_SU0_SUM0_SUS128_VWA2_VWB2_WGM6_WGMXCC1_WGMXCCGn1
    SolutionIndex: 65
    SolutionNameMin: Cijk_Alik_Bjlk_HHS_BH_Bias_AS_SAV_UserArgs_MT64x64x64_MI16x16x1_SN_LDSB1_CLR1_GRVWB8_GSU0_GSUC0_GSUWGMRR0_K1_LBSPPA256_LBSPPB1024_LPB32_MIWT2_2_PLR1_SU0_SUM0_SUS128_VWA2_VWB2_WGM8_WGMXCC1_WGMXCCGn1
    SolutionIndex: 66
    SolutionNameMin: Cijk_Alik_Bjlk_HHS_BH_Bias_AS_SAV_UserArgs_MT32x64x64_MI16x16x1_SN_LDSB0_CLR1_GRVWB2_GSU0_GSUC0_GSUWGMRR0_K1_LBSPPA128_LBSPPB1024_LPB32_MIWT1_2_PLR1_SU0_SUM0_SUS128_VWA1_VWB2_WGM1_WGMXCC1_WGMXCCGn1
    SolutionIndex: 67
    SolutionNameMin: Cijk_Alik_Bjlk_HHS_BH_Bias_AS_SAV_UserArgs_MT64x32x64_MI16x16x1_SN_LDSB0_CLR1_GRVWB2_GSU0_GSUC0_GSUWGMRR0_K1_LBSPPA256_LBSPPB512_LPB16_MIWT2_1_PLR1_SU0_SUM0_SUS128_VWA2_VWB1_WGM1_WGMXCC1_WGMXCCGn1
    SolutionIndex: 68
    SolutionNameMin: Cijk_Alik_Bjlk_HHS_BH_Bias_AS_SAV_UserArgs_MT32x32x64_MI16x16x1_SN_LDSB0_CLR1_GRVWB2_GSU0_GSUC0_GSUWGMRR0_K1_LBSPPA128_LBSPPB512_LPB16_MIWT1_1_PLR1_SU0_SUM0_SUS128_VWA1_VWB1_WGM1_WGMXCC1_WGMXCCGn1
    SolutionIndex: 69
    SolutionNameMin: Cijk_Alik_Bjlk_HHS_BH_Bias_AS_SAV_UserArgs_MT32x32x64_MI16x16x1_SN_LDSB0_CLR1_GRVWB4_GSU0_GSUC0_GSUWGMRR0_K1_LBSPPA128_LBSPPB512_LPB16_MIWT1_1_PLR1_SU0_SUM0_SUS128_VWA1_VWB1_WGM1_WGMXCC1_WGMXCCGn1
    SolutionIndex: 70
    SolutionNameMin: Cijk_Alik_Bjlk_HHS_BH_Bias_AS_SAV_UserArgs_MT32x32x64_MI16x16x1_SN_LDSB0_CLR1_GRVWB8_GSU0_GSUC0_GSUWGMRR0_K1_LBSPPA128_LBSPPB512_LPB16_MIWT1_1_PLR1_SU0_SUM0_SUS128_VWA1_VWB1_WGM1_WGMXCC1_WGMXCCGn1
    SolutionIndex: 71
    SolutionNameMin: Cijk_Alik_Bjlk_HHS_BH_Bias_AS_SAV_UserArgs_MT64x128x128_MI16x16x1_SN_LDSB1_CLR1_GRVWB8_GSU0_GSUC0_GSUWGMRR0_K1_LBSPPA512_LBSPPB1024_LPB0_MIWT2_4_PLR1_SU0_SUM0_SUS256_VWA2_VWB4_WGM1_WGMXCC1_WGMXCCGn1
    SolutionIndex: 72
    SolutionNameMin: Cijk_Alik_Bjlk_HHS_BH_Bias_AS_SAV_UserArgs_MT64x128x128_MI16x16x1_SN_LDSB1_CLR1_GRVWB8_GSU0_GSUC0_GSUWGMRR0_K1_LBSPPA512_LBSPPB1024_LPB0_MIWT2_4_PLR1_SU0_SUM0_SUS256_VWA2_VWB4_WGM1_WGMXCC1_WGMXCCGn1
    SolutionIndex: 73
    SolutionNameMin: Cijk_Alik_Bjlk_HHS_BH_Bias_AS_SAV_UserArgs_MT64x128x128_MI16x16x1_SN_LDSB1_CLR1_GRVWB8_GSU0_GSUC0_GSUWGMRR0_K1_LBSPPA512_LBSPPB2048_LPB0_MIWT2_4_PLR1_SU0_SUM0_SUS256_VWA2_VWB4_WGM1_WGMXCC1_WGMXCCGn1
    SolutionIndex: 74
    SolutionNameMin: Cijk_Alik_Bjlk_HHS_BH_Bias_AS_SAV_UserArgs_MT64x128x128_MI16x16x1_SN_LDSB1_CLR1_GRVWB8_GSU0_GSUC0_GSUWGMRR0_K1_LBSPPA512_LBSPPB1024_LPB0_MIWT2_4_PLR1_SU0_SUM0_SUS256_VWA2_VWB4_WGM4_WGMXCC1_WGMXCCGn1
    SolutionIndex: 75
    SolutionNameMin: Cijk_Alik_Bjlk_HHS_BH_Bias_AS_SAV_UserArgs_MT64x128x128_MI16x16x1_SN_LDSB1_CLR1_GRVWB8_GSU0_GSUC0_GSUWGMRR0_K1_LBSPPA512_LBSPPB2048_LPB0_MIWT2_4_PLR1_SU0_SUM0_SUS256_VWA2_VWB4_WGM4_WGMXCC1_WGMXCCGn1
    SolutionIndex: 76
    SolutionNameMin: Cijk_Alik_Bjlk_HHS_BH_Bias_AS_SAV_UserArgs_MT64x128x128_MI16x16x1_SN_LDSB1_CLR1_GRVWB8_GSU0_GSUC0_GSUWGMRR0_K1_LBSPPA512_LBSPPB2048_LPB0_MIWT2_4_PLR1_SU0_SUM0_SUS256_VWA2_VWB4_WGM4_WGMXCC1_WGMXCCGn1
    SolutionIndex: 77
    SolutionNameMin: Cijk_Alik_Bjlk_HHS_BH_Bias_AS_SAV_UserArgs_MT64x128x128_MI16x16x1_SN_LDSB1_CLR1_GRVWB8_GSU0_GSUC0_GSUWGMRR0_K1_LBSPPA512_LBSPPB1024_LPB0_MIWT2_4_PLR1_SU0_SUM0_SUS256_VWA2_VWB4_WGM6_WGMXCC1_WGMXCCGn1
    SolutionIndex: 78
    SolutionNameMin: Cijk_Alik_Bjlk_HHS_BH_Bias_AS_SAV_UserArgs_MT64x128x128_MI16x16x1_SN_LDSB1_CLR1_GRVWB8_GSU0_GSUC0_GSUWGMRR0_K1_LBSPPA512_LBSPPB2048_LPB0_MIWT2_4_PLR1_SU0_SUM0_SUS256_VWA2_VWB4_WGM6_WGMXCC1_WGMXCCGn1
    SolutionIndex: 79
    SolutionNameMin: Cijk_Alik_Bjlk_HHS_BH_Bias_AS_SAV_UserArgs_MT64x128x128_MI16x16x1_SN_LDSB1_CLR1_GRVWB8_GSU0_GSUC0_GSUWGMRR0_K1_LBSPPA512_LBSPPB2048_LPB0_MIWT2_4_PLR1_SU0_SUM0_SUS256_VWA2_VWB4_WGM8_WGMXCC1_WGMXCCGn1
    SolutionIndex: 80
    SolutionNameMin: Cijk_Alik_Bjlk_HHS_BH_Bias_AS_SAV_UserArgs_MT64x128x128_MI16x16x1_SN_LDSB1_CLR1_GRVWB8_GSU0_GSUC0_GSUWGMRR0_K1_LBSPPA512_LBSPPB2048_LPB0_MIWT2_4_PLR1_SU0_SUM0_SUS256_VWA2_VWB4_WGM8_WGMXCC1_WGMXCCGn1
    SolutionIndex: 81
    SolutionNameMin: Cijk_Alik_Bjlk_HHS_BH_Bias_AS_SAV_UserArgs_MT64x64x128_MI16x16x1_SN_LDSB1_CLR1_GRVWB8_GSU0_GSUC0_GSUWGMRR0_K1_LBSPPA512_LBSPPB1024_LPB32_MIWT2_2_PLR1_SU0_SUM0_SUS256_VWA2_VWB2_WGM1_WGMXCC1_WGMXCCGn1
    SolutionIndex: 82
    SolutionNameMin: Cijk_Alik_Bjlk_HHS_BH_Bias_AS_SAV_UserArgs_MT64x64x128_MI16x16x1_SN_LDSB1_CLR1_GRVWB8_GSU0_GSUC0_GSUWGMRR0_K1_LBSPPA512_LBSPPB1024_LPB32_MIWT2_2_PLR1_SU0_SUM0_SUS256_VWA2_VWB2_WGM4_WGMXCC1_WGMXCCGn1
    SolutionIndex: 83
    SolutionNameMin: Cijk_Alik_Bjlk_HHS_BH_Bias_AS_SAV_UserArgs_MT64x64x128_MI16x16x1_SN_LDSB1_CLR1_GRVWB8_GSU0_GSUC0_GSUWGMRR0_K1_LBSPPA512_LBSPPB1024_LPB32_MIWT2_2_PLR1_SU0_SUM0_SUS256_VWA2_VWB2_WGM6_WGMXCC1_WGMXCCGn1
    SolutionIndex: 84
    SolutionNameMin: Cijk_Alik_Bjlk_HHS_BH_Bias_AS_SAV_UserArgs_MT64x64x128_MI16x16x1_SN_LDSB1_CLR1_GRVWB8_GSU0_GSUC0_GSUWGMRR0_K1_LBSPPA512_LBSPPB1024_LPB32_MIWT2_2_PLR1_SU0_SUM0_SUS256_VWA2_VWB2_WGM8_WGMXCC1_WGMXCCGn1
    SolutionIndex: 85
    SolutionNameMin: Cijk_Alik_Bjlk_HHS_BH_Bias_AS_SAV_UserArgs_MT32x64x128_MI16x16x1_SN_LDSB1_CLR1_GRVWB4_GSU0_GSUC0_GSUWGMRR0_K1_LBSPPA256_LBSPPB512_LPB32_MIWT1_2_PLR1_SU0_SUM0_SUS256_VWA1_VWB2_WGM1_WGMXCC1_WGMXCCGn1
    SolutionIndex: 86
    SolutionNameMin: Cijk_Alik_Bjlk_HHS_BH_Bias_AS_SAV_UserArgs_MT32x64x128_MI16x16x1_SN_LDSB1_CLR1_GRVWB8_GSU0_GSUC0_GSUWGMRR0_K1_LBSPPA256_LBSPPB512_LPB32_MIWT1_2_PLR1_SU0_SUM0_SUS256_VWA1_VWB2_WGM1_WGMXCC1_WGMXCCGn1
    SolutionIndex: 87
    SolutionNameMin: Cijk_Alik_Bjlk_HHS_BH_Bias_AS_SAV_UserArgs_MT32x64x128_MI16x16x1_SN_LDSB1_CLR1_GRVWB4_GSU0_GSUC0_GSUWGMRR0_K1_LBSPPA256_LBSPPB1024_LPB32_MIWT1_2_PLR1_SU0_SUM0_SUS256_VWA1_VWB2_WGM1_WGMXCC1_WGMXCCGn1
    SolutionIndex: 88
    SolutionNameMin: Cijk_Alik_Bjlk_HHS_BH_Bias_AS_SAV_UserArgs_MT32x64x128_MI16x16x1_SN_LDSB1_CLR1_GRVWB8_GSU0_GSUC0_GSUWGMRR0_K1_LBSPPA256_LBSPPB1024_LPB32_MIWT1_2_PLR1_SU0_SUM0_SUS256_VWA1_VWB2_WGM1_WGMXCC1_WGMXCCGn1
    SolutionIndex: 89
    SolutionNameMin: Cijk_Alik_Bjlk_HHS_BH_Bias_AS_SAV_UserArgs_MT32x64x128_MI16x16x1_SN_LDSB1_CLR1_GRVWB8_GSU0_GSUC0_GSUWGMRR0_K1_LBSPPA256_LBSPPB1024_LPB32_MIWT1_2_PLR1_SU0_SUM0_SUS256_VWA1_VWB2_WGM1_WGMXCC1_WGMXCCGn1
    SolutionIndex: 90
    SolutionNameMin: Cijk_Alik_Bjlk_HHS_BH_Bias_AS_SAV_UserArgs_MT32x64x128_MI16x16x1_SN_LDSB1_CLR1_GRVWB2_GSU0_GSUC0_GSUWGMRR0_K1_LBSPPA256_LBSPPB1024_LPB32_MIWT1_2_PLR1_SU0_SUM0_SUS256_VWA1_VWB2_WGM4_WGMXCC1_WGMXCCGn1
    SolutionIndex: 91
    SolutionNameMin: Cijk_Alik_Bjlk_HHS_BH_Bias_AS_SAV_UserArgs_MT32x64x128_MI16x16x1_SN_LDSB1_CLR1_GRVWB8_GSU0_GSUC0_GSUWGMRR0_K1_LBSPPA256_LBSPPB1024_LPB32_MIWT1_2_PLR1_SU0_SUM0_SUS256_VWA1_VWB2_WGM4_WGMXCC1_WGMXCCGn1
    SolutionIndex: 92
    SolutionNameMin: Cijk_Alik_Bjlk_HHS_BH_Bias_AS_SAV_UserArgs_MT32x64x128_MI16x16x1_SN_LDSB1_CLR1_GRVWB8_GSU0_GSUC0_GSUWGMRR0_K1_LBSPPA256_LBSPPB512_LPB32_MIWT1_2_PLR1_SU0_SUM0_SUS256_VWA1_VWB2_WGM6_WGMXCC1_WGMXCCGn1
    SolutionIndex: 93
    SolutionNameMin: Cijk_Alik_Bjlk_HHS_BH_Bias_AS_SAV_UserArgs_MT32x64x128_MI16x16x1_SN_LDSB1_CLR1_GRVWB8_GSU0_GSUC0_GSUWGMRR0_K1_LBSPPA256_LBSPPB1024_LPB32_MIWT1_2_PLR1_SU0_SUM0_SUS256_VWA1_VWB2_WGM6_WGMXCC1_WGMXCCGn1
    SolutionIndex: 94
    SolutionNameMin: Cijk_Alik_Bjlk_HHS_BH_Bias_AS_SAV_UserArgs_MT32x64x128_MI16x16x1_SN_LDSB1_CLR1_GRVWB8_GSU0_GSUC0_GSUWGMRR0_K1_LBSPPA256_LBSPPB1024_LPB32_MIWT1_2_PLR1_SU0_SUM0_SUS256_VWA1_VWB2_WGM6_WGMXCC1_WGMXCCGn1
    SolutionIndex: 95
    SolutionNameMin: Cijk_Alik_Bjlk_HHS_BH_Bias_AS_SAV_UserArgs_MT32x64x128_MI16x16x1_SN_LDSB1_CLR1_GRVWB8_GSU0_GSUC0_GSUWGMRR0_K1_LBSPPA256_LBSPPB512_LPB32_MIWT1_2_PLR1_SU0_SUM0_SUS256_VWA1_VWB2_WGM8_WGMXCC1_WGMXCCGn1
    SolutionIndex: 96
    SolutionNameMin: Cijk_Alik_Bjlk_HHS_BH_Bias_AS_SAV_UserArgs_MT32x64x128_MI16x16x1_SN_LDSB1_CLR1_GRVWB8_GSU0_GSUC0_GSUWGMRR0_K1_LBSPPA256_LBSPPB1024_LPB32_MIWT1_2_PLR1_SU0_SUM0_SUS256_VWA1_VWB2_WGM8_WGMXCC1_WGMXCCGn1
    SolutionIndex: 97
    SolutionNameMin: Cijk_Alik_Bjlk_HHS_BH_Bias_AS_SAV_UserArgs_MT64x32x128_MI16x16x1_SN_LDSB1_CLR1_GRVWB4_GSU0_GSUC0_GSUWGMRR0_K1_LBSPPA512_LBSPPB512_LPB16_MIWT2_1_PLR1_SU0_SUM0_SUS256_VWA2_VWB1_WGM1_WGMXCC1_WGMXCCGn1
    SolutionIndex: 98
    SolutionNameMin: Cijk_Alik_Bjlk_HHS_BH_Bias_AS_SAV_UserArgs_MT64x32x128_MI16x16x1_SN_LDSB1_CLR1_GRVWB8_GSU0_GSUC0_GSUWGMRR0_K1_LBSPPA512_LBSPPB512_LPB16_MIWT2_1_PLR1_SU0_SUM0_SUS256_VWA2_VWB1_WGM1_WGMXCC1_WGMXCCGn1
    SolutionIndex: 99
    SolutionNameMin: Cijk_Alik_Bjlk_HHS_BH_Bias_AS_SAV_UserArgs_MT64x32x128_MI16x16x1_SN_LDSB1_CLR1_GRVWB8_GSU0_GSUC0_GSUWGMRR0_K1_LBSPPA512_LBSPPB512_LPB16_MIWT2_1_PLR1_SU0_SUM0_SUS256_VWA2_VWB1_WGM4_WGMXCC1_WGMXCCGn1
    SolutionIndex: 100
    SolutionNameMin: Cijk_Alik_Bjlk_HHS_BH_Bias_AS_SAV_UserArgs_MT64x32x128_MI16x16x1_SN_LDSB1_CLR1_GRVWB8_GSU0_GSUC0_GSUWGMRR0_K1_LBSPPA512_LBSPPB512_LPB16_MIWT2_1_PLR1_SU0_SUM0_SUS256_VWA2_VWB1_WGM6_WGMXCC1_WGMXCCGn1
    SolutionIndex: 101
    SolutionNameMin: Cijk_Alik_Bjlk_HHS_BH_Bias_AS_SAV_UserArgs_MT32x32x128_MI16x16x1_SN_LDSB1_CLR1_GRVWB2_GSU0_GSUC0_GSUWGMRR0_K1_LBSPPA256_LBSPPB256_LPB16_MIWT1_1_PLR1_SU0_SUM0_SUS256_VWA1_VWB1_WGM1_WGMXCC1_WGMXCCGn1
    SolutionIndex: 102
    SolutionNameMin: Cijk_Alik_Bjlk_HHS_BH_Bias_AS_SAV_UserArgs_MT32x32x128_MI16x16x1_SN_LDSB1_CLR1_GRVWB2_GSU0_GSUC0_GSUWGMRR0_K1_LBSPPA256_LBSPPB512_LPB16_MIWT1_1_PLR1_SU0_SUM0_SUS256_VWA1_VWB1_WGM1_WGMXCC1_WGMXCCGn1
    SolutionIndex: 103
    SolutionNameMin: Cijk_Alik_Bjlk_HHS_BH_Bias_AS_SAV_UserArgs_MT32x32x128_MI16x16x1_SN_LDSB1_CLR1_GRVWB2_GSU0_GSUC0_GSUWGMRR0_K1_LBSPPA256_LBSPPB512_LPB16_MIWT1_1_PLR1_SU0_SUM0_SUS256_VWA1_VWB1_WGM1_WGMXCC1_WGMXCCGn1
    SolutionIndex: 104
    SolutionNameMin: Cijk_Alik_Bjlk_HHS_BH_Bias_AS_SAV_UserArgs_MT32x32x128_MI16x16x1_SN_LDSB1_CLR1_GRVWB4_GSU0_GSUC0_GSUWGMRR0_K1_LBSPPA256_LBSPPB512_LPB16_MIWT1_1_PLR1_SU0_SUM0_SUS256_VWA1_VWB1_WGM1_WGMXCC1_WGMXCCGn1
    SolutionIndex: 105
    SolutionNameMin: Cijk_Alik_Bjlk_HHS_BH_Bias_AS_SAV_UserArgs_MT32x32x128_MI16x16x1_SN_LDSB1_CLR1_GRVWB4_GSU0_GSUC0_GSUWGMRR0_K1_LBSPPA256_LBSPPB512_LPB16_MIWT1_1_PLR1_SU0_SUM0_SUS256_VWA1_VWB1_WGM1_WGMXCC1_WGMXCCGn1
    SolutionIndex: 106
    SolutionNameMin: Cijk_Alik_Bjlk_HHS_BH_Bias_AS_SAV_UserArgs_MT32x32x128_MI16x16x1_SN_LDSB1_CLR1_GRVWB8_GSU0_GSUC0_GSUWGMRR0_K1_LBSPPA256_LBSPPB512_LPB16_MIWT1_1_PLR1_SU0_SUM0_SUS256_VWA1_VWB1_WGM1_WGMXCC1_WGMXCCGn1
    SolutionIndex: 107
    SolutionNameMin: Cijk_Alik_Bjlk_HHS_BH_Bias_AS_SAV_UserArgs_MT32x32x128_MI16x16x1_SN_LDSB1_CLR1_GRVWB8_GSU0_GSUC0_GSUWGMRR0_K1_LBSPPA256_LBSPPB512_LPB16_MIWT1_1_PLR1_SU0_SUM0_SUS256_VWA1_VWB1_WGM1_WGMXCC1_WGMXCCGn1
    SolutionIndex: 108
    SolutionNameMin: Cijk_Alik_Bjlk_HHS_BH_Bias_AS_SAV_UserArgs_MT32x32x128_MI16x16x1_SN_LDSB1_CLR1_GRVWB8_GSU0_GSUC0_GSUWGMRR0_K1_LBSPPA256_LBSPPB512_LPB16_MIWT1_1_PLR1_SU0_SUM0_SUS256_VWA1_VWB1_WGM1_WGMXCC1_WGMXCCGn1
    SolutionIndex: 109
    SolutionNameMin: Cijk_Alik_Bjlk_HHS_BH_Bias_AS_SAV_UserArgs_MT32x32x128_MI16x16x1_SN_LDSB1_CLR1_GRVWB8_GSU0_GSUC0_GSUWGMRR0_K1_LBSPPA256_LBSPPB512_LPB16_MIWT1_1_PLR1_SU0_SUM0_SUS256_VWA1_VWB1_WGM4_WGMXCC1_WGMXCCGn1
    SolutionIndex: 110
    SolutionNameMin: Cijk_Alik_Bjlk_HHS_BH_Bias_AS_SAV_UserArgs_MT32x32x128_MI16x16x1_SN_LDSB1_CLR1_GRVWB8_GSU0_GSUC0_GSUWGMRR0_K1_LBSPPA256_LBSPPB512_LPB16_MIWT1_1_PLR1_SU0_SUM0_SUS256_VWA1_VWB1_WGM6_WGMXCC1_WGMXCCGn1
    SolutionIndex: 111
    SolutionNameMin: Cijk_Alik_Bjlk_HHS_BH_Bias_AS_SAV_UserArgs_MT32x32x128_MI16x16x1_SN_LDSB1_CLR1_GRVWB8_GSU0_GSUC0_GSUWGMRR0_K1_LBSPPA256_LBSPPB512_LPB16_MIWT1_1_PLR1_SU0_SUM0_SUS256_VWA1_VWB1_WGM6_WGMXCC1_WGMXCCGn1
    SolutionIndex: 112
    SolutionNameMin: Cijk_Alik_Bjlk_HHS_BH_Bias_AS_SAV_UserArgs_MT32x32x128_MI16x16x1_SN_LDSB1_CLR1_GRVWB8_GSU0_GSUC0_GSUWGMRR0_K1_LBSPPA256_LBSPPB512_LPB16_MIWT1_1_PLR1_SU0_SUM0_SUS256_VWA1_VWB1_WGM8_WGMXCC1_WGMXCCGn1
    SolutionIndex: 113
    SolutionNameMin: Cijk_Alik_Bjlk_HHS_BH_Bias_AS_SAV_UserArgs_MT32x32x128_MI16x16x1_SN_LDSB1_CLR1_GRVWB8_GSU0_GSUC0_GSUWGMRR0_K1_LBSPPA256_LBSPPB512_LPB16_MIWT1_1_PLR1_SU0_SUM0_SUS256_VWA1_VWB1_WGM8_WGMXCC1_WGMXCCGn1
- - - [128, 128, 1, 128, 128, 128, 128, 128]
    - [69, 0.45]
  - - [128, 128, 1, 256, 128, 128, 256, 128]
    - [108, 0.8]
  - - [128, 128, 1, 512, 128, 128, 512, 128]
    - [108, 1.36]
  - - [128, 128, 1, 1024, 128, 128, 1024, 128]
    - [108, 1.97]
  - - [128, 128, 1, 2048, 128, 128, 2048, 128]
    - [108, 2.6]
  - - [128, 128, 1, 4096, 128, 128, 4096, 128]
    - [106, 3.13]
  - - [128, 128, 1, 8192, 128, 128, 8192, 128]
    - [108, 3.52]
  - - [128, 256, 1, 128, 128, 128, 128, 256]
    - [68, 0.91]
  - - [128, 256, 1, 256, 128, 128, 256, 256]
    - [68, 1.56]
  - - [128, 256, 1, 512, 128, 128, 512, 256]
    - [108, 2.46]
  - - [128, 256, 1, 1024, 128, 128, 1024, 256]
    - [108, 3.54]
  - - [128, 256, 1, 2048, 128, 128, 2048, 256]
    - [108, 4.53]
  - - [128, 256, 1, 4096, 128, 128, 4096, 256]
    - [108, 5.38]
  - - [128, 256, 1, 8192, 128, 128, 8192, 256]
    - [108, 5.84]
  - - [128, 512, 1, 128, 128, 128, 128, 512]
    - [68, 1.74]
  - - [128, 512, 1, 256, 128, 128, 256, 512]
    - [68, 3.06]
  - - [128, 512, 1, 512, 128, 128, 512, 512]
    - [105, 4.82]
  - - [128, 512, 1, 1024, 128, 128, 1024, 512]
    - [108, 7.0]
  - - [128, 512, 1, 2048, 128, 128, 2048, 512]
    - [108, 9.02]
  - - [128, 512, 1, 4096, 128, 128, 4096, 512]
    - [108, 10.55]
  - - [128, 512, 1, 8192, 128, 128, 8192, 512]
    - [105, 11.36]
  - - [128, 1024, 1, 128, 128, 128, 128, 1024]
    - [102, 3.51]
  - - [128, 1024, 1, 256, 128, 128, 256, 1024]
    - [101, 5.82]
  - - [128, 1024, 1, 512, 128, 128, 512, 1024]
    - [108, 9.4]
  - - [128, 1024, 1, 1024, 128, 128, 1024, 1024]
    - [103, 13.55]
  - - [128, 1024, 1, 2048, 128, 128, 2048, 1024]
    - [108, 17.51]
  - - [128, 1024, 1, 4096, 128, 128, 4096, 1024]
    - [109, 20.41]
  - - [128, 1024, 1, 8192, 128, 128, 8192, 1024]
    - [109, 22.53]
  - - [128, 2048, 1, 128, 128, 128, 128, 2048]
    - [86, 6.3]
  - - [128, 2048, 1, 256, 128, 128, 256, 2048]
    - [66, 10.66]
  - - [128, 2048, 1, 512, 128, 128, 512, 2048]
    - [88, 17.01]
  - - [128, 2048, 1, 1024, 128, 128, 1024, 2048]
    - [88, 24.27]
  - - [128, 2048, 1, 2048, 128, 128, 2048, 2048]
    - [88, 30.63]
  - - [128, 2048, 1, 4096, 128, 128, 4096, 2048]
    - [88, 35.93]
  - - [128, 2048, 1, 8192, 128, 128, 8192, 2048]
    - [90, 35.42]
  - - [128, 4096, 1, 128, 128, 128, 128, 4096]
    - [59, 11.47]
  - - [128, 4096, 1, 256, 128, 128, 256, 4096]
    - [61, 19.31]
  - - [128, 4096, 1, 512, 128, 128, 512, 4096]
    - [58, 29.06]
  - - [128, 4096, 1, 1024, 128, 128, 1024, 4096]
    - [81, 40.78]
  - - [128, 4096, 1, 2048, 128, 128, 2048, 4096]
    - [81, 52.77]
  - - [128, 4096, 1, 4096, 128, 128, 4096, 4096]
    - [83, 54.94]
  - - [128, 4096, 1, 8192, 128, 128, 8192, 4096]
    - [81, 62.41]
  - - [128, 8192, 1, 128, 128, 128, 128, 8192]
    - [54, 18.4]
  - - [128, 8192, 1, 256, 128, 128, 256, 8192]
    - [52, 31.2]
  - - [128, 8192, 1, 512, 128, 128, 512, 8192]
    - [72, 47.33]
  - - [128, 8192, 1, 1024, 128, 128, 1024, 8192]
    - [73, 64.56]
  - - [128, 8192, 1, 2048, 128, 128, 2048, 8192]
    - [52, 68.22]
  - - [128, 8192, 1, 4096, 128, 128, 4096, 8192]
    - [73, 78.37]
  - - [128, 8192, 1, 8192, 128, 128, 8192, 8192]
    - [73, 83.86]
  - - [256, 128, 1, 128, 256, 256, 128, 128]
    - [108, 0.94]
  - - [256, 128, 1, 256, 256, 256, 256, 128]
    - [108, 1.6]
  - - [256, 128, 1, 512, 256, 256, 512, 128]
    - [108, 2.67]
  - - [256, 128, 1, 1024, 256, 256, 1024, 128]
    - [108, 3.96]
  - - [256, 128, 1, 2048, 256, 256, 2048, 128]
    - [108, 5.2]
  - - [256, 128, 1, 4096, 256, 256, 4096, 128]
    - [108, 6.23]
  - - [256, 128, 1, 8192, 256, 256, 8192, 128]
    - [108, 7.01]
  - - [256, 256, 1, 128, 256, 256, 128, 256]
    - [68, 1.78]
  - - [256, 256, 1, 256, 256, 256, 256, 256]
    - [102, 3.05]
  - - [256, 256, 1, 512, 256, 256, 512, 256]
    - [105, 4.99]
  - - [256, 256, 1, 1024, 256, 256, 1024, 256]
    - [107, 7.22]
  - - [256, 256, 1, 2048, 256, 256, 2048, 256]
    - [107, 9.28]
  - - [256, 256, 1, 4096, 256, 256, 4096, 256]
    - [108, 11.02]
  - - [256, 256, 1, 8192, 256, 256, 8192, 256]
    - [111, 11.89]
  - - [256, 512, 1, 128, 256, 256, 128, 512]
    - [102, 3.56]
  - - [256, 512, 1, 256, 256, 256, 256, 512]
    - [101, 5.89]
  - - [256, 512, 1, 512, 256, 256, 512, 512]
    - [108, 9.62]
  - - [256, 512, 1, 1024, 256, 256, 1024, 512]
    - [105, 14.0]
  - - [256, 512, 1, 2048, 256, 256, 2048, 512]
    - [108, 18.1]
  - - [256, 512, 1, 4096, 256, 256, 4096, 512]
    - [111, 20.97]
  - - [256, 512, 1, 8192, 256, 256, 8192, 512]
    - [111, 23.14]
  - - [256, 1024, 1, 128, 256, 256, 128, 1024]
    - [97, 6.37]
  - - [256, 1024, 1, 256, 256, 256, 256, 1024]
    - [67, 10.78]
  - - [256, 1024, 1, 512, 256, 256, 512, 1024]
    - [98, 17.52]
  - - [256, 1024, 1, 1024, 256, 256, 1024, 1024]
    - [88, 25.29]
  - - [256, 1024, 1, 2048, 256, 256, 2048, 1024]
    - [89, 31.89]
  - - [256, 1024, 1, 4096, 256, 256, 4096, 1024]
    - [89, 36.94]
  - - [256, 1024, 1, 8192, 256, 256, 8192, 1024]
    - [94, 40.5]
  - - [256, 2048, 1, 128, 256, 256, 128, 2048]
    - [59, 11.41]
  - - [256, 2048, 1, 256, 256, 256, 256, 2048]
    - [58, 19.35]
  - - [256, 2048, 1, 512, 256, 256, 512, 2048]
    - [81, 30.83]
  - - [256, 2048, 1, 1024, 256, 256, 1024, 2048]
    - [81, 42.31]
  - - [256, 2048, 1, 2048, 256, 256, 2048, 2048]
    - [81, 52.37]
  - - [256, 2048, 1, 4096, 256, 256, 4096, 2048]
    - [81, 61.64]
  - - [256, 2048, 1, 8192, 256, 256, 8192, 2048]
    - [83, 62.67]
  - - [256, 4096, 1, 128, 256, 256, 128, 4096]
    - [54, 18.88]
  - - [256, 4096, 1, 256, 256, 256, 256, 4096]
    - [51, 31.27]
  - - [256, 4096, 1, 512, 256, 256, 512, 4096]
    - [73, 49.32]
  - - [256, 4096, 1, 1024, 256, 256, 1024, 4096]
    - [73, 67.82]
  - - [256, 4096, 1, 2048, 256, 256, 2048, 4096]
    - [71, 81.49]
  - - [256, 4096, 1, 4096, 256, 256, 4096, 4096]
    - [73, 87.85]
  - - [256, 4096, 1, 8192, 256, 256, 8192, 4096]
    - [73, 90.04]
  - - [256, 8192, 1, 128, 256, 256, 128, 8192]
    - [37, 28.77]
  - - [256, 8192, 1, 256, 256, 256, 256, 8192]
    - [39, 48.05]
  - - [256, 8192, 1, 512, 256, 256, 512, 8192]
    - [39, 69.9]
  - - [256, 8192, 1, 1024, 256, 256, 1024, 8192]
    - [43, 87.37]
  - - [256, 8192, 1, 2048, 256, 256, 2048, 8192]
    - [38, 95.83]
  - - [256, 8192, 1, 4096, 256, 256, 4096, 8192]
    - [44, 108.2]
  - - [256, 8192, 1, 8192, 256, 256, 8192, 8192]
    - [27, 106.14]
  - - [512, 128, 1, 128, 512, 512, 128, 128]
    - [108, 1.85]
  - - [512, 128, 1, 256, 512, 512, 256, 128]
    - [108, 3.21]
  - - [512, 128, 1, 512, 512, 512, 512, 128]
    - [109, 5.25]
  - - [512, 128, 1, 1024, 512, 512, 1024, 128]
    - [108, 7.57]
  - - [512, 128, 1, 2048, 512, 512, 2048, 128]
    - [111, 10.33]
  - - [512, 128, 1, 4096, 512, 512, 4096, 128]
    - [113, 12.51]
  - - [512, 128, 1, 8192, 512, 512, 8192, 128]
    - [108, 13.98]
  - - [512, 256, 1, 128, 512, 512, 128, 256]
    - [104, 3.54]
  - - [512, 256, 1, 256, 512, 512, 256, 256]
    - [101, 5.98]
  - - [512, 256, 1, 512, 512, 512, 512, 256]
    - [108, 9.79]
  - - [512, 256, 1, 1024, 512, 512, 1024, 256]
    - [108, 14.38]
  - - [512, 256, 1, 2048, 512, 512, 2048, 256]
    - [111, 18.81]
  - - [512, 256, 1, 4096, 512, 512, 4096, 256]
    - [113, 22.05]
  - - [512, 256, 1, 8192, 512, 512, 8192, 256]
    - [113, 24.04]
  - - [512, 512, 1, 128, 512, 512, 128, 512]
    - [85, 6.41]
  - - [512, 512, 1, 256, 512, 512, 256, 512]
    - [98, 10.97]
  - - [512, 512, 1, 512, 512, 512, 512, 512]
    - [100, 17.69]
  - - [512, 512, 1, 1024, 512, 512, 1024, 512]
    - [89, 25.51]
  - - [512, 512, 1, 2048, 512, 512, 2048, 512]
    - [89, 32.81]
  - - [512, 512, 1, 4096, 512, 512, 4096, 512]
    - [94, 38.13]
  - - [512, 512, 1, 8192, 512, 512, 8192, 512]
    - [92, 41.58]
  - - [512, 1024, 1, 128, 512, 512, 128, 1024]
    - [59, 11.58]
  - - [512, 1024, 1, 256, 512, 512, 256, 1024]
    - [62, 19.67]
  - - [512, 1024, 1, 512, 512, 512, 512, 1024]
    - [81, 31.09]
  - - [512, 1024, 1, 1024, 512, 512, 1024, 1024]
    - [81, 43.01]
  - - [512, 1024, 1, 2048, 512, 512, 2048, 1024]
    - [83, 53.66]
  - - [512, 1024, 1, 4096, 512, 512, 4096, 1024]
    - [83, 61.78]
  - - [512, 1024, 1, 8192, 512, 512, 8192, 1024]
    - [83, 65.47]
  - - [512, 2048, 1, 128, 512, 512, 128, 2048]
    - [55, 18.92]
  - - [512, 2048, 1, 256, 512, 512, 256, 2048]
    - [52, 30.99]
  - - [512, 2048, 1, 512, 512, 512, 512, 2048]
    - [73, 48.05]
  - - [512, 2048, 1, 1024, 512, 512, 1024, 2048]
    - [73, 67.74]
  - - [512, 2048, 1, 2048, 512, 512, 2048, 2048]
    - [73, 82.01]
  - - [512, 2048, 1, 4096, 512, 512, 4096, 2048]
    - [73, 92.58]
  - - [512, 2048, 1, 8192, 512, 512, 8192, 2048]
    - [73, 91.43]
  - - [512, 4096, 1, 128, 512, 512, 128, 4096]
    - [39, 28.57]
  - - [512, 4096, 1, 256, 512, 512, 256, 4096]
    - [39, 47.47]
  - - [512, 4096, 1, 512, 512, 512, 512, 4096]
    - [39, 71.3]
  - - [512, 4096, 1, 1024, 512, 512, 1024, 4096]
    - [39, 89.82]
  - - [512, 4096, 1, 2048, 512, 512, 2048, 4096]
    - [38, 106.4]
  - - [512, 4096, 1, 4096, 512, 512, 4096, 4096]
    - [38, 110.6]
  - - [512, 4096, 1, 8192, 512, 512, 8192, 4096]
    - [38, 113.79]
  - - [512, 8192, 1, 128, 512, 512, 128, 8192]
    - [15, 40.65]
  - - [512, 8192, 1, 256, 512, 512, 256, 8192]
    - [13, 63.86]
  - - [512, 8192, 1, 512, 512, 512, 512, 8192]
    - [13, 88.14]
  - - [512, 8192, 1, 1024, 512, 512, 1024, 8192]
    - [15, 106.66]
  - - [512, 8192, 1, 2048, 512, 512, 2048, 8192]
    - [15, 120.72]
  - - [512, 8192, 1, 4096, 512, 512, 4096, 8192]
    - [28, 123.29]
  - - [512, 8192, 1, 8192, 512, 512, 8192, 8192]
    - [29, 132.0]
  - - [1024, 128, 1, 128, 1024, 1024, 128, 128]
    - [68, 3.52]
  - - [1024, 128, 1, 256, 1024, 1024, 256, 128]
    - [70, 5.69]
  - - [1024, 128, 1, 512, 1024, 1024, 512, 128]
    - [111, 10.19]
  - - [1024, 128, 1, 1024, 1024, 1024, 1024, 128]
    - [110, 14.96]
  - - [1024, 128, 1, 2048, 1024, 1024, 2048, 128]
    - [112, 20.35]
  - - [1024, 128, 1, 4096, 1024, 1024, 4096, 128]
    - [113, 25.3]
  - - [1024, 128, 1, 8192, 1024, 1024, 8192, 128]
    - [111, 27.75]
  - - [1024, 256, 1, 128, 1024, 1024, 128, 256]
    - [87, 6.33]
  - - [1024, 256, 1, 256, 1024, 1024, 256, 256]
    - [99, 10.76]
  - - [1024, 256, 1, 512, 1024, 1024, 512, 256]
    - [93, 17.64]
  - - [1024, 256, 1, 1024, 1024, 1024, 1024, 256]
    - [93, 25.12]
  - - [1024, 256, 1, 2048, 1024, 1024, 2048, 256]
    - [96, 32.22]
  - - [1024, 256, 1, 4096, 1024, 1024, 4096, 256]
    - [94, 38.7]
  - - [1024, 256, 1, 8192, 1024, 1024, 8192, 256]
    - [96, 42.48]
  - - [1024, 512, 1, 128, 1024, 1024, 128, 512]
    - [65, 11.31]
  - - [1024, 512, 1, 256, 1024, 1024, 256, 512]
    - [64, 19.37]
  - - [1024, 512, 1, 512, 1024, 1024, 512, 512]
    - [82, 31.09]
  - - [1024, 512, 1, 1024, 1024, 1024, 1024, 512]
    - [83, 43.8]
  - - [1024, 512, 1, 2048, 1024, 1024, 2048, 512]
    - [82, 53.93]
  - - [1024, 512, 1, 4096, 1024, 1024, 4096, 512]
    - [83, 62.31]
  - - [1024, 512, 1, 8192, 1024, 1024, 8192, 512]
    - [84, 66.95]
  - - [1024, 1024, 1, 128, 1024, 1024, 128, 1024]
    - [57, 18.9]
  - - [1024, 1024, 1, 256, 1024, 1024, 256, 1024]
    - [52, 31.76]
  - - [1024, 1024, 1, 512, 1024, 1024, 512, 1024]
    - [76, 49.21]
  - - [1024, 1024, 1, 1024, 1024, 1024, 1024, 1024]
    - [78, 68.37]
  - - [1024, 1024, 1, 2048, 1024, 1024, 2048, 1024]
    - [75, 83.4]
  - - [1024, 1024, 1, 4096, 1024, 1024, 4096, 1024]
    - [76, 95.5]
  - - [1024, 1024, 1, 8192, 1024, 1024, 8192, 1024]
    - [74, 92.32]
  - - [1024, 2048, 1, 128, 1024, 1024, 128, 2048]
    - [37, 29.25]
  - - [1024, 2048, 1, 256, 1024, 1024, 256, 2048]
    - [39, 46.8]
  - - [1024, 2048, 1, 512, 1024, 1024, 512, 2048]
    - [39, 69.96]
  - - [1024, 2048, 1, 1024, 1024, 1024, 1024, 2048]
    - [38, 90.14]
  - - [1024, 2048, 1, 2048, 1024, 1024, 2048, 2048]
    - [38, 106.84]
  - - [1024, 2048, 1, 4096, 1024, 1024, 4096, 2048]
    - [39, 114.79]
  - - [1024, 2048, 1, 8192, 1024, 1024, 8192, 2048]
    - [43, 112.85]
  - - [1024, 4096, 1, 128, 1024, 1024, 128, 4096]
    - [23, 40.97]
  - - [1024, 4096, 1, 256, 1024, 1024, 256, 4096]
    - [15, 64.12]
  - - [1024, 4096, 1, 512, 1024, 1024, 512, 4096]
    - [13, 89.07]
  - - [1024, 4096, 1, 1024, 1024, 1024, 1024, 4096]
    - [32, 110.96]
  - - [1024, 4096, 1, 2048, 1024, 1024, 2048, 4096]
    - [28, 122.93]
  - - [1024, 4096, 1, 4096, 1024, 1024, 4096, 4096]
    - [28, 123.08]
  - - [1024, 4096, 1, 8192, 1024, 1024, 8192, 4096]
    - [28, 133.66]
  - - [1024, 8192, 1, 128, 1024, 1024, 128, 8192]
    - [12, 48.88]
  - - [1024, 8192, 1, 256, 1024, 1024, 256, 8192]
    - [0, 73.91]
  - - [1024, 8192, 1, 512, 1024, 1024, 512, 8192]
    - [0, 102.64]
  - - [1024, 8192, 1, 1024, 1024, 1024, 1024, 8192]
    - [2, 125.02]
  - - [1024, 8192, 1, 2048, 1024, 1024, 2048, 8192]
    - [0, 129.59]
  - - [1024, 8192, 1, 4096, 1024, 1024, 4096, 8192]
    - [0, 141.34]
  - - [1024, 8192, 1, 8192, 1024, 1024, 8192, 8192]
    - [5, 163.92]
  - - [2048, 128, 1, 128, 2048, 2048, 128, 128]
    - [88, 6.36]
  - - [2048, 128, 1, 256, 2048, 2048, 256, 128]
    - [86, 10.94]
  - - [2048, 128, 1, 512, 2048, 2048, 512, 128]
    - [93, 18.31]
  - - [2048, 128, 1, 1024, 2048, 2048, 1024, 128]
    - [91, 27.06]
  - - [2048, 128, 1, 2048, 2048, 2048, 2048, 128]
    - [93, 36.13]
  - - [2048, 128, 1, 4096, 2048, 2048, 4096, 128]
    - [94, 42.77]
  - - [2048, 128, 1, 8192, 2048, 2048, 8192, 128]
    - [95, 46.63]
  - - [2048, 256, 1, 128, 2048, 2048, 128, 256]
    - [63, 11.46]
  - - [2048, 256, 1, 256, 2048, 2048, 256, 256]
    - [64, 19.59]
  - - [2048, 256, 1, 512, 2048, 2048, 512, 256]
    - [84, 30.98]
  - - [2048, 256, 1, 1024, 2048, 2048, 1024, 256]
    - [82, 43.53]
  - - [2048, 256, 1, 2048, 2048, 2048, 2048, 256]
    - [82, 54.29]
  - - [2048, 256, 1, 4096, 2048, 2048, 4096, 256]
    - [83, 62.89]
  - - [2048, 256, 1, 8192, 2048, 2048, 8192, 256]
    - [83, 64.22]
  - - [2048, 512, 1, 128, 2048, 2048, 128, 512]
    - [57, 18.99]
  - - [2048, 512, 1, 256, 2048, 2048, 256, 512]
    - [52, 31.5]
  - - [2048, 512, 1, 512, 2048, 2048, 512, 512]
    - [78, 49.28]
  - - [2048, 512, 1, 1024, 2048, 2048, 1024, 512]
    - [76, 69.0]
  - - [2048, 512, 1, 2048, 2048, 2048, 2048, 512]
    - [80, 84.4]
  - - [2048, 512, 1, 4096, 2048, 2048, 4096, 512]
    - [75, 94.66]
  - - [2048, 512, 1, 8192, 2048, 2048, 8192, 512]
    - [79, 92.57]
  - - [2048, 1024, 1, 128, 2048, 2048, 128, 1024]
    - [39, 29.01]
  - - [2048, 1024, 1, 256, 2048, 2048, 256, 1024]
    - [44, 47.93]
  - - [2048, 1024, 1, 512, 2048, 2048, 512, 1024]
    - [41, 71.25]
  - - [2048, 1024, 1, 1024, 2048, 2048, 1024, 1024]
    - [41, 92.15]
  - - [2048, 1024, 1, 2048, 2048, 2048, 2048, 1024]
    - [41, 108.69]
  - - [2048, 1024, 1, 4096, 2048, 2048, 4096, 1024]
    - [44, 113.33]
  - - [2048, 1024, 1, 8192, 2048, 2048, 8192, 1024]
    - [41, 114.95]
  - - [2048, 2048, 1, 128, 2048, 2048, 128, 2048]
    - [22, 41.24]
  - - [2048, 2048, 1, 256, 2048, 2048, 256, 2048]
    - [17, 62.93]
  - - [2048, 2048, 1, 512, 2048, 2048, 512, 2048]
    - [16, 88.87]
  - - [2048, 2048, 1, 1024, 2048, 2048, 1024, 2048]
    - [17, 111.57]
  - - [2048, 2048, 1, 2048, 2048, 2048, 2048, 2048]
    - [35, 123.56]
  - - [2048, 2048, 1, 4096, 2048, 2048, 4096, 2048]
    - [34, 121.66]
  - - [2048, 2048, 1, 8192, 2048, 2048, 8192, 2048]
    - [20, 133.29]
  - - [2048, 4096, 1, 128, 2048, 2048, 128, 4096]
    - [0, 48.86]
  - - [2048, 4096, 1, 256, 2048, 2048, 256, 4096]
    - [2, 74.63]
  - - [2048, 4096, 1, 512, 2048, 2048, 512, 4096]
    - [0, 103.03]
  - - [2048, 4096, 1, 1024, 2048, 2048, 1024, 4096]
    - [0, 126.67]
  - - [2048, 4096, 1, 2048, 2048, 2048, 2048, 4096]
    - [28, 131.38]
  - - [2048, 4096, 1, 4096, 2048, 2048, 4096, 4096]
    - [30, 143.26]
  - - [2048, 4096, 1, 8192, 2048, 2048, 8192, 4096]
    - [9, 162.73]
  - - [2048, 8192, 1, 128, 2048, 2048, 128, 8192]
    - [1, 53.79]
  - - [2048, 8192, 1, 256, 2048, 2048, 256, 8192]
    - [0, 82.05]
  - - [2048, 8192, 1, 512, 2048, 2048, 512, 8192]
    - [11, 108.36]
  - - [2048, 8192, 1, 1024, 2048, 2048, 1024, 8192]
    - [15, 123.48]
  - - [2048, 8192, 1, 2048, 2048, 2048, 2048, 8192]
    - [15, 142.78]
  - - [2048, 8192, 1, 4096, 2048, 2048, 4096, 8192]
    - [13, 167.01]
  - - [2048, 8192, 1, 8192, 2048, 2048, 8192, 8192]
    - [14, 176.77]
  - - [4096, 128, 1, 128, 4096, 4096, 128, 128]
    - [60, 11.57]
  - - [4096, 128, 1, 256, 4096, 4096, 256, 128]
    - [81, 19.3]
  - - [4096, 128, 1, 512, 4096, 4096, 512, 128]
    - [84, 30.65]
  - - [4096, 128, 1, 1024, 4096, 4096, 1024, 128]
    - [83, 44.09]
  - - [4096, 128, 1, 2048, 4096, 4096, 2048, 128]
    - [84, 56.99]
  - - [4096, 128, 1, 4096, 4096, 4096, 4096, 128]
    - [83, 63.4]
  - - [4096, 128, 1, 8192, 4096, 4096, 8192, 128]
    - [82, 69.42]
  - - [4096, 256, 1, 128, 4096, 4096, 128, 256]
    - [56, 18.94]
  - - [4096, 256, 1, 256, 4096, 4096, 256, 256]
    - [50, 31.42]
  - - [4096, 256, 1, 512, 4096, 4096, 512, 256]
    - [53, 48.52]
  - - [4096, 256, 1, 1024, 4096, 4096, 1024, 256]
    - [80, 67.01]
  - - [4096, 256, 1, 2048, 4096, 4096, 2048, 256]
    - [77, 79.78]
  - - [4096, 256, 1, 4096, 4096, 4096, 4096, 256]
    - [75, 88.98]
  - - [4096, 256, 1, 8192, 4096, 4096, 8192, 256]
    - [80, 88.63]
  - - [4096, 512, 1, 128, 4096, 4096, 128, 512]
    - [42, 28.79]
  - - [4096, 512, 1, 256, 4096, 4096, 256, 512]
    - [41, 47.6]
  - - [4096, 512, 1, 512, 4096, 4096, 512, 512]
    - [44, 71.35]
  - - [4096, 512, 1, 1024, 4096, 4096, 1024, 512]
    - [44, 91.74]
  - - [4096, 512, 1, 2048, 4096, 4096, 2048, 512]
    - [48, 103.47]
  - - [4096, 512, 1, 4096, 4096, 4096, 4096, 512]
    - [44, 112.29]
  - - [4096, 512, 1, 8192, 4096, 4096, 8192, 512]
    - [40, 114.09]
  - - [4096, 1024, 1, 128, 4096, 4096, 128, 1024]
    - [24, 40.25]
  - - [4096, 1024, 1, 256, 4096, 4096, 256, 1024]
    - [17, 61.42]
  - - [4096, 1024, 1, 512, 4096, 4096, 512, 1024]
    - [21, 86.6]
  - - [4096, 1024, 1, 1024, 4096, 4096, 1024, 1024]
    - [21, 108.41]
  - - [4096, 1024, 1, 2048, 4096, 4096, 2048, 1024]
    - [35, 122.79]
  - - [4096, 1024, 1, 4096, 4096, 4096, 4096, 1024]
    - [39, 129.97]
  - - [4096, 1024, 1, 8192, 4096, 4096, 8192, 1024]
    - [36, 131.34]
  - - [4096, 2048, 1, 128, 4096, 4096, 128, 2048]
    - [2, 47.72]
  - - [4096, 2048, 1, 256, 4096, 4096, 256, 2048]
    - [2, 72.47]
  - - [4096, 2048, 1, 512, 4096, 4096, 512, 2048]
    - [0, 101.12]
  - - [4096, 2048, 1, 1024, 4096, 4096, 1024, 2048]
    - [8, 124.49]
  - - [4096, 2048, 1, 2048, 4096, 4096, 2048, 2048]
    - [28, 135.15]
  - - [4096, 2048, 1, 4096, 4096, 4096, 4096, 2048]
    - [29, 145.42]
  - - [4096, 2048, 1, 8192, 4096, 4096, 8192, 2048]
    - [5, 152.68]
  - - [4096, 4096, 1, 128, 4096, 4096, 128, 4096]
    - [1, 53.14]
  - - [4096, 4096, 1, 256, 4096, 4096, 256, 4096]
    - [11, 80.53]
  - - [4096, 4096, 1, 512, 4096, 4096, 512, 4096]
    - [0, 107.3]
  - - [4096, 4096, 1, 1024, 4096, 4096, 1024, 4096]
    - [20, 124.61]
  - - [4096, 4096, 1, 2048, 4096, 4096, 2048, 4096]
    - [35, 145.85]
  - - [4096, 4096, 1, 4096, 4096, 4096, 4096, 4096]
    - [8, 159.84]
  - - [4096, 4096, 1, 8192, 4096, 4096, 8192, 4096]
    - [10, 168.16]
  - - [4096, 8192, 1, 128, 4096, 4096, 128, 8192]
    - [7, 54.7]
  - - [4096, 8192, 1, 256, 4096, 4096, 256, 8192]
    - [13, 83.95]
  - - [4096, 8192, 1, 512, 4096, 4096, 512, 8192]
    - [33, 110.03]
  - - [4096, 8192, 1, 1024, 4096, 4096, 1024, 8192]
    - [33, 138.15]
  - - [4096, 8192, 1, 2048, 4096, 4096, 2048, 8192]
    - [32, 162.39]
  - - [4096, 8192, 1, 4096, 4096, 4096, 4096, 8192]
    - [0, 182.78]
  - - [4096, 8192, 1, 8192, 4096, 4096, 8192, 8192]
    - [2, 200.72]
  - - [8192, 128, 1, 128, 8192, 8192, 128, 128]
    - [57, 18.66]
  - - [8192, 128, 1, 256, 8192, 8192, 256, 128]
    - [49, 29.45]
  - - [8192, 128, 1, 512, 8192, 8192, 512, 128]
    - [76, 45.83]
  - - [8192, 128, 1, 1024, 8192, 8192, 1024, 128]
    - [73, 64.67]
  - - [8192, 128, 1, 2048, 8192, 8192, 2048, 128]
    - [73, 71.72]
  - - [8192, 128, 1, 4096, 8192, 8192, 4096, 128]
    - [76, 81.93]
  - - [8192, 128, 1, 8192, 8192, 8192, 8192, 128]
    - [76, 80.73]
  - - [8192, 256, 1, 128, 8192, 8192, 128, 256]
    - [46, 28.08]
  - - [8192, 256, 1, 256, 8192, 8192, 256, 256]
    - [44, 45.62]
  - - [8192, 256, 1, 512, 8192, 8192, 512, 256]
    - [48, 68.83]
  - - [8192, 256, 1, 1024, 8192, 8192, 1024, 256]
    - [45, 83.77]
  - - [8192, 256, 1, 2048, 8192, 8192, 2048, 256]
    - [47, 97.09]
  - - [8192, 256, 1, 4096, 8192, 8192, 4096, 256]
    - [44, 105.87]
  - - [8192, 256, 1, 8192, 8192, 8192, 8192, 256]
    - [48, 104.15]
  - - [8192, 512, 1, 128, 8192, 8192, 128, 512]
    - [26, 38.78]
  - - [8192, 512, 1, 256, 8192, 8192, 256, 512]
    - [20, 60.96]
  - - [8192, 512, 1, 512, 8192, 8192, 512, 512]
    - [34, 84.81]
  - - [8192, 512, 1, 1024, 8192, 8192, 1024, 512]
    - [32, 104.05]
  - - [8192, 512, 1, 2048, 8192, 8192, 2048, 512]
    - [31, 118.92]
  - - [8192, 512, 1, 4096, 8192, 8192, 4096, 512]
    - [39, 125.68]
  - - [8192, 512, 1, 8192, 8192, 8192, 8192, 512]
    - [32, 128.17]
  - - [8192, 1024, 1, 128, 8192, 8192, 128, 1024]
    - [1, 46.88]
  - - [8192, 1024, 1, 256, 8192, 8192, 256, 1024]
    - [0, 71.0]
  - - [8192, 1024, 1, 512, 8192, 8192, 512, 1024]
    - [8, 99.39]
  - - [8192, 1024, 1, 1024, 8192, 8192, 1024, 1024]
    - [5, 122.6]
  - - [8192, 1024, 1, 2048, 8192, 8192, 2048, 1024]
    - [29, 129.98]
  - - [8192, 1024, 1, 4096, 8192, 8192, 4096, 1024]
    - [28, 146.54]
  - - [8192, 1024, 1, 8192, 8192, 8192, 8192, 1024]
    - [6, 154.29]
  - - [8192, 2048, 1, 128, 8192, 8192, 128, 2048]
    - [0, 52.59]
  - - [8192, 2048, 1, 256, 8192, 8192, 256, 2048]
    - [0, 79.02]
  - - [8192, 2048, 1, 512, 8192, 8192, 512, 2048]
    - [5, 107.37]
  - - [8192, 2048, 1, 1024, 8192, 8192, 1024, 2048]
    - [18, 120.16]
  - - [8192, 2048, 1, 2048, 8192, 8192, 2048, 2048]
    - [28, 144.85]
  - - [8192, 2048, 1, 4096, 8192, 8192, 4096, 2048]
    - [2, 158.87]
  - - [8192, 2048, 1, 8192, 8192, 8192, 8192, 2048]
    - [3, 167.98]
  - - [8192, 4096, 1, 128, 8192, 8192, 128, 4096]
    - [2, 55.62]
  - - [8192, 4096, 1, 256, 8192, 8192, 256, 4096]
    - [19, 82.31]
  - - [8192, 4096, 1, 512, 8192, 8192, 512, 4096]
    - [33, 108.23]
  - - [8192, 4096, 1, 1024, 8192, 8192, 1024, 4096]
    - [34, 137.34]
  - - [8192, 4096, 1, 2048, 8192, 8192, 2048, 4096]
    - [32, 163.17]
  - - [8192, 4096, 1, 4096, 8192, 8192, 4096, 4096]
    - [0, 176.18]
  - - [8192, 4096, 1, 8192, 8192, 8192, 8192, 4096]
    - [5, 198.17]
  - - [8192, 8192, 1, 128, 8192, 8192, 128, 8192]
    - [25, 55.69]
  - - [8192, 8192, 1, 256, 8192, 8192, 256, 8192]
    - [0, 87.25]
  - - [8192, 8192, 1, 512, 8192, 8192, 512, 8192]
    - [4, 118.19]
  - - [8192, 8192, 1, 1024, 8192, 8192, 1024, 8192]
    - [32, 153.46]
  - - [8192, 8192, 1, 2048, 8192, 8192, 2048, 8192]
    - [32, 181.99]
  - - [8192, 8192, 1, 4096, 8192, 8192, 4096, 8192]
    - [32, 192.26]
  - - [8192, 8192, 1, 8192, 8192, 8192, 8192, 8192]
    - [8, 204.48]
- null
- null
- ExperimentalStreamK
- GridBased
