projects/hipblaslt/library/src/amd_detail/rocblaslt/src/Tensile/Logic/asm_full/aquavanjaram/gfx942_228cu/StreamK/aquavanjaram942_Cijk_Ailk_Bjlk_F8NSS_BH_Bias_HAS_SAV_UserArgs.yaml
- {MinimumRequiredVersion: 4.33.0}
- aquavanjaram942
- {Architecture: gfx942, CUCount: 228}
- [Device 0049, Device 0050]
    SolutionIndex: 0
    SolutionNameMin: Cijk_Ailk_Bjlk_F8NSS_BH_Bias_HAS_SAV_UserArgs_MT256x256x64_MI16x16x1_SN_LDSB0_CLR1_GRVWA8_GRVWB4_GSU0_GSUC0_GSUWGMRR0_K1_LBSPPA2048_LBSPPB2048_LPA0_LPB0_MIWT8_8_PLR1_SU0_SUM0_SUS64_VWA8_VWB8_WGM1_WGMXCC1_WGMXCCGn1
    SolutionIndex: 1
    SolutionNameMin: Cijk_Ailk_Bjlk_F8NSS_BH_Bias_HAS_SAV_UserArgs_MT256x256x64_MI16x16x1_SN_LDSB0_CLR1_GRVWA4_GRVWB16_GSU0_GSUC0_GSUWGMRR0_K1_LBSPPA2048_LBSPPB2048_LPA0_LPB0_MIWT8_8_PLR1_SU0_SUM0_SUS64_VWA8_VWB8_WGM1_WGMXCC1_WGMXCCGn1
    SolutionIndex: 2
    SolutionNameMin: Cijk_Ailk_Bjlk_F8NSS_BH_Bias_HAS_SAV_UserArgs_MT256x256x64_MI16x16x1_SN_LDSB0_CLR1_GRVWA16_GRVWB16_GSU0_GSUC0_GSUWGMRR0_K1_LBSPPA2048_LBSPPB2048_LPA0_LPB0_MIWT8_8_PLR1_SU0_SUM0_SUS64_VWA8_VWB8_WGM1_WGMXCC1_WGMXCCGn1
    SolutionIndex: 3
    SolutionNameMin: Cijk_Ailk_Bjlk_F8NSS_BH_Bias_HAS_SAV_UserArgs_MT256x256x64_MI16x16x1_SN_LDSB0_CLR1_GRVWA4_GRVWB16_GSU0_GSUC0_GSUWGMRR0_K1_LBSPPA2048_LBSPPB2048_LPA0_LPB0_MIWT8_8_PLR1_SU0_SUM0_SUS64_VWA8_VWB8_WGM4_WGMXCC1_WGMXCCGn1
    SolutionIndex: 4
    SolutionNameMin: Cijk_Ailk_Bjlk_F8NSS_BH_Bias_HAS_SAV_UserArgs_MT256x256x64_MI16x16x1_SN_LDSB0_CLR1_GRVWA16_GRVWB16_GSU0_GSUC0_GSUWGMRR0_K1_LBSPPA2048_LBSPPB2048_LPA0_LPB0_MIWT8_8_PLR1_SU0_SUM0_SUS64_VWA8_VWB8_WGM4_WGMXCC1_WGMXCCGn1
    SolutionIndex: 5
    SolutionNameMin: Cijk_Ailk_Bjlk_F8NSS_BH_Bias_HAS_SAV_UserArgs_MT256x256x64_MI16x16x1_SN_LDSB0_CLR1_GRVWA16_GRVWB4_GSU0_GSUC0_GSUWGMRR0_K1_LBSPPA2048_LBSPPB2048_LPA0_LPB0_MIWT8_8_PLR1_SU0_SUM0_SUS64_VWA8_VWB8_WGM6_WGMXCC1_WGMXCCGn1
    SolutionIndex: 6
    SolutionNameMin: Cijk_Ailk_Bjlk_F8NSS_BH_Bias_HAS_SAV_UserArgs_MT256x256x64_MI16x16x1_SN_LDSB0_CLR1_GRVWA4_GRVWB16_GSU0_GSUC0_GSUWGMRR0_K1_LBSPPA2048_LBSPPB2048_LPA0_LPB0_MIWT8_8_PLR1_SU0_SUM0_SUS64_VWA8_VWB8_WGM6_WGMXCC1_WGMXCCGn1
    SolutionIndex: 7
    SolutionNameMin: Cijk_Ailk_Bjlk_F8NSS_BH_Bias_HAS_SAV_UserArgs_MT256x256x64_MI16x16x1_SN_LDSB0_CLR1_GRVWA16_GRVWB16_GSU0_GSUC0_GSUWGMRR0_K1_LBSPPA2048_LBSPPB2048_LPA0_LPB0_MIWT8_8_PLR1_SU0_SUM0_SUS64_VWA8_VWB8_WGM6_WGMXCC1_WGMXCCGn1
    SolutionIndex: 8
    SolutionNameMin: Cijk_Ailk_Bjlk_F8NSS_BH_Bias_HAS_SAV_UserArgs_MT256x256x64_MI16x16x1_SN_LDSB0_CLR1_GRVWA4_GRVWB16_GSU0_GSUC0_GSUWGMRR0_K1_LBSPPA2048_LBSPPB2048_LPA0_LPB0_MIWT8_8_PLR1_SU0_SUM0_SUS64_VWA8_VWB8_WGM8_WGMXCC1_WGMXCCGn1
    SolutionIndex: 9
    SolutionNameMin: Cijk_Ailk_Bjlk_F8NSS_BH_Bias_HAS_SAV_UserArgs_MT256x256x64_MI16x16x1_SN_LDSB0_CLR1_GRVWA16_GRVWB16_GSU0_GSUC0_GSUWGMRR0_K1_LBSPPA2048_LBSPPB2048_LPA0_LPB0_MIWT8_8_PLR1_SU0_SUM0_SUS64_VWA8_VWB8_WGM8_WGMXCC1_WGMXCCGn1
    SolutionIndex: 10
    SolutionNameMin: Cijk_Ailk_Bjlk_F8NSS_BH_Bias_HAS_SAV_UserArgs_MT128x256x64_MI16x16x1_SN_LDSB1_CLR1_GRVWA4_GRVWB8_GSU0_GSUC0_GSUWGMRR0_K1_LBSPPA1024_LBSPPB2048_LPA64_LPB0_MIWT4_8_PLR1_SU0_SUM0_SUS64_VWA4_VWB8_WGM1_WGMXCC1_WGMXCCGn1
    SolutionIndex: 11
    SolutionNameMin: Cijk_Ailk_Bjlk_F8NSS_BH_Bias_HAS_SAV_UserArgs_MT128x256x64_MI16x16x1_SN_LDSB1_CLR1_GRVWA8_GRVWB8_GSU0_GSUC0_GSUWGMRR0_K1_LBSPPA1024_LBSPPB2048_LPA64_LPB0_MIWT4_8_PLR1_SU0_SUM0_SUS64_VWA4_VWB8_WGM1_WGMXCC1_WGMXCCGn1
    SolutionIndex: 12
    SolutionNameMin: Cijk_Ailk_Bjlk_F8NSS_BH_Bias_HAS_SAV_UserArgs_MT128x256x64_MI16x16x1_SN_LDSB1_CLR1_GRVWA16_GRVWB8_GSU0_GSUC0_GSUWGMRR0_K1_LBSPPA1024_LBSPPB2048_LPA64_LPB0_MIWT4_8_PLR1_SU0_SUM0_SUS64_VWA4_VWB8_WGM1_WGMXCC1_WGMXCCGn1
    SolutionIndex: 13
    SolutionNameMin: Cijk_Ailk_Bjlk_F8NSS_BH_Bias_HAS_SAV_UserArgs_MT128x256x64_MI16x16x1_SN_LDSB1_CLR1_GRVWA4_GRVWB16_GSU0_GSUC0_GSUWGMRR0_K1_LBSPPA1024_LBSPPB2048_LPA64_LPB0_MIWT4_8_PLR1_SU0_SUM0_SUS64_VWA4_VWB8_WGM1_WGMXCC1_WGMXCCGn1
    SolutionIndex: 14
    SolutionNameMin: Cijk_Ailk_Bjlk_F8NSS_BH_Bias_HAS_SAV_UserArgs_MT128x256x64_MI16x16x1_SN_LDSB1_CLR1_GRVWA8_GRVWB16_GSU0_GSUC0_GSUWGMRR0_K1_LBSPPA1024_LBSPPB2048_LPA64_LPB0_MIWT4_8_PLR1_SU0_SUM0_SUS64_VWA4_VWB8_WGM1_WGMXCC1_WGMXCCGn1
    SolutionIndex: 15
    SolutionNameMin: Cijk_Ailk_Bjlk_F8NSS_BH_Bias_HAS_SAV_UserArgs_MT128x256x64_MI16x16x1_SN_LDSB1_CLR1_GRVWA16_GRVWB16_GSU0_GSUC0_GSUWGMRR0_K1_LBSPPA1024_LBSPPB2048_LPA64_LPB0_MIWT4_8_PLR1_SU0_SUM0_SUS64_VWA4_VWB8_WGM1_WGMXCC1_WGMXCCGn1
    SolutionIndex: 16
    SolutionNameMin: Cijk_Ailk_Bjlk_F8NSS_BH_Bias_HAS_SAV_UserArgs_MT128x256x64_MI16x16x1_SN_LDSB1_CLR1_GRVWA4_GRVWB8_GSU0_GSUC0_GSUWGMRR0_K1_LBSPPA1024_LBSPPB2048_LPA64_LPB0_MIWT4_8_PLR1_SU0_SUM0_SUS64_VWA4_VWB8_WGM4_WGMXCC1_WGMXCCGn1
    SolutionIndex: 17
    SolutionNameMin: Cijk_Ailk_Bjlk_F8NSS_BH_Bias_HAS_SAV_UserArgs_MT128x256x64_MI16x16x1_SN_LDSB1_CLR1_GRVWA4_GRVWB16_GSU0_GSUC0_GSUWGMRR0_K1_LBSPPA1024_LBSPPB2048_LPA64_LPB0_MIWT4_8_PLR1_SU0_SUM0_SUS64_VWA4_VWB8_WGM4_WGMXCC1_WGMXCCGn1
    SolutionIndex: 18
    SolutionNameMin: Cijk_Ailk_Bjlk_F8NSS_BH_Bias_HAS_SAV_UserArgs_MT128x256x64_MI16x16x1_SN_LDSB1_CLR1_GRVWA8_GRVWB16_GSU0_GSUC0_GSUWGMRR0_K1_LBSPPA1024_LBSPPB2048_LPA64_LPB0_MIWT4_8_PLR1_SU0_SUM0_SUS64_VWA4_VWB8_WGM4_WGMXCC1_WGMXCCGn1
    SolutionIndex: 19
    SolutionNameMin: Cijk_Ailk_Bjlk_F8NSS_BH_Bias_HAS_SAV_UserArgs_MT128x256x64_MI16x16x1_SN_LDSB1_CLR1_GRVWA16_GRVWB16_GSU0_GSUC0_GSUWGMRR0_K1_LBSPPA1024_LBSPPB2048_LPA64_LPB0_MIWT4_8_PLR1_SU0_SUM0_SUS64_VWA4_VWB8_WGM4_WGMXCC1_WGMXCCGn1
    SolutionIndex: 20
    SolutionNameMin: Cijk_Ailk_Bjlk_F8NSS_BH_Bias_HAS_SAV_UserArgs_MT128x256x64_MI16x16x1_SN_LDSB1_CLR1_GRVWA4_GRVWB8_GSU0_GSUC0_GSUWGMRR0_K1_LBSPPA1024_LBSPPB2048_LPA64_LPB0_MIWT4_8_PLR1_SU0_SUM0_SUS64_VWA4_VWB8_WGM6_WGMXCC1_WGMXCCGn1
    SolutionIndex: 21
    SolutionNameMin: Cijk_Ailk_Bjlk_F8NSS_BH_Bias_HAS_SAV_UserArgs_MT128x256x64_MI16x16x1_SN_LDSB1_CLR1_GRVWA4_GRVWB16_GSU0_GSUC0_GSUWGMRR0_K1_LBSPPA1024_LBSPPB2048_LPA64_LPB0_MIWT4_8_PLR1_SU0_SUM0_SUS64_VWA4_VWB8_WGM6_WGMXCC1_WGMXCCGn1
    SolutionIndex: 22
    SolutionNameMin: Cijk_Ailk_Bjlk_F8NSS_BH_Bias_HAS_SAV_UserArgs_MT128x256x64_MI16x16x1_SN_LDSB1_CLR1_GRVWA8_GRVWB16_GSU0_GSUC0_GSUWGMRR0_K1_LBSPPA1024_LBSPPB2048_LPA64_LPB0_MIWT4_8_PLR1_SU0_SUM0_SUS64_VWA4_VWB8_WGM6_WGMXCC1_WGMXCCGn1
    SolutionIndex: 23
    SolutionNameMin: Cijk_Ailk_Bjlk_F8NSS_BH_Bias_HAS_SAV_UserArgs_MT128x256x64_MI16x16x1_SN_LDSB1_CLR1_GRVWA16_GRVWB16_GSU0_GSUC0_GSUWGMRR0_K1_LBSPPA1024_LBSPPB2048_LPA64_LPB0_MIWT4_8_PLR1_SU0_SUM0_SUS64_VWA4_VWB8_WGM6_WGMXCC1_WGMXCCGn1
    SolutionIndex: 24
    SolutionNameMin: Cijk_Ailk_Bjlk_F8NSS_BH_Bias_HAS_SAV_UserArgs_MT128x256x64_MI16x16x1_SN_LDSB1_CLR1_GRVWA16_GRVWB16_GSU0_GSUC0_GSUWGMRR0_K1_LBSPPA1024_LBSPPB2048_LPA64_LPB0_MIWT4_8_PLR1_SU0_SUM0_SUS64_VWA4_VWB8_WGM8_WGMXCC1_WGMXCCGn1
    SolutionIndex: 25
    SolutionNameMin: Cijk_Ailk_Bjlk_F8NSS_BH_Bias_HAS_SAV_UserArgs_MT256x144x64_MI16x16x1_SN_LDSB0_CLR1_GRVWA4_GRVWB4_GSU0_GSUC0_GSUWGMRR0_K1_LBSPPA2048_LBSPPB1152_LPA64_LPB16_MIWT4_9_PLR1_SU0_SUM0_SUS64_VWA4_VWB1_WGM1_WGMXCC1_WGMXCCGn1
    SolutionIndex: 26
    SolutionNameMin: Cijk_Ailk_Bjlk_F8NSS_BH_Bias_HAS_SAV_UserArgs_MT256x144x64_MI16x16x1_SN_LDSB0_CLR1_GRVWA8_GRVWB4_GSU0_GSUC0_GSUWGMRR0_K1_LBSPPA2048_LBSPPB1152_LPA64_LPB16_MIWT4_9_PLR1_SU0_SUM0_SUS64_VWA4_VWB1_WGM1_WGMXCC1_WGMXCCGn1
    SolutionIndex: 27
    SolutionNameMin: Cijk_Ailk_Bjlk_F8NSS_BH_Bias_HAS_SAV_UserArgs_MT256x144x64_MI16x16x1_SN_LDSB0_CLR1_GRVWA16_GRVWB4_GSU0_GSUC0_GSUWGMRR0_K1_LBSPPA2048_LBSPPB1152_LPA64_LPB16_MIWT4_9_PLR1_SU0_SUM0_SUS64_VWA4_VWB1_WGM1_WGMXCC1_WGMXCCGn1
    SolutionIndex: 28
    SolutionNameMin: Cijk_Ailk_Bjlk_F8NSS_BH_Bias_HAS_SAV_UserArgs_MT256x144x64_MI16x16x1_SN_LDSB0_CLR1_GRVWA4_GRVWB4_GSU0_GSUC0_GSUWGMRR0_K1_LBSPPA2048_LBSPPB1152_LPA64_LPB16_MIWT4_9_PLR1_SU0_SUM0_SUS64_VWA4_VWB1_WGM4_WGMXCC1_WGMXCCGn1
    SolutionIndex: 29
    SolutionNameMin: Cijk_Ailk_Bjlk_F8NSS_BH_Bias_HAS_SAV_UserArgs_MT256x144x64_MI16x16x1_SN_LDSB0_CLR1_GRVWA16_GRVWB4_GSU0_GSUC0_GSUWGMRR0_K1_LBSPPA2048_LBSPPB1152_LPA64_LPB16_MIWT4_9_PLR1_SU0_SUM0_SUS64_VWA4_VWB1_WGM4_WGMXCC1_WGMXCCGn1
    SolutionIndex: 30
    SolutionNameMin: Cijk_Ailk_Bjlk_F8NSS_BH_Bias_HAS_SAV_UserArgs_MT256x144x64_MI16x16x1_SN_LDSB0_CLR1_GRVWA4_GRVWB4_GSU0_GSUC0_GSUWGMRR0_K1_LBSPPA2048_LBSPPB1152_LPA64_LPB16_MIWT4_9_PLR1_SU0_SUM0_SUS64_VWA4_VWB1_WGM6_WGMXCC1_WGMXCCGn1
    SolutionIndex: 31
    SolutionNameMin: Cijk_Ailk_Bjlk_F8NSS_BH_Bias_HAS_SAV_UserArgs_MT256x144x64_MI16x16x1_SN_LDSB0_CLR1_GRVWA8_GRVWB4_GSU0_GSUC0_GSUWGMRR0_K1_LBSPPA2048_LBSPPB1152_LPA64_LPB16_MIWT4_9_PLR1_SU0_SUM0_SUS64_VWA4_VWB1_WGM6_WGMXCC1_WGMXCCGn1
    SolutionIndex: 32
    SolutionNameMin: Cijk_Ailk_Bjlk_F8NSS_BH_Bias_HAS_SAV_UserArgs_MT256x144x64_MI16x16x1_SN_LDSB0_CLR1_GRVWA16_GRVWB4_GSU0_GSUC0_GSUWGMRR0_K1_LBSPPA2048_LBSPPB1152_LPA64_LPB16_MIWT4_9_PLR1_SU0_SUM0_SUS64_VWA4_VWB1_WGM6_WGMXCC1_WGMXCCGn1
    SolutionIndex: 33
    SolutionNameMin: Cijk_Ailk_Bjlk_F8NSS_BH_Bias_HAS_SAV_UserArgs_MT256x144x64_MI16x16x1_SN_LDSB0_CLR1_GRVWA4_GRVWB4_GSU0_GSUC0_GSUWGMRR0_K1_LBSPPA2048_LBSPPB1152_LPA64_LPB16_MIWT4_9_PLR1_SU0_SUM0_SUS64_VWA4_VWB1_WGM8_WGMXCC1_WGMXCCGn1
    SolutionIndex: 34
    SolutionNameMin: Cijk_Ailk_Bjlk_F8NSS_BH_Bias_HAS_SAV_UserArgs_MT256x144x64_MI16x16x1_SN_LDSB0_CLR1_GRVWA16_GRVWB4_GSU0_GSUC0_GSUWGMRR0_K1_LBSPPA2048_LBSPPB1152_LPA64_LPB16_MIWT4_9_PLR1_SU0_SUM0_SUS64_VWA4_VWB1_WGM8_WGMXCC1_WGMXCCGn1
    SolutionIndex: 35
    SolutionNameMin: Cijk_Ailk_Bjlk_F8NSS_BH_Bias_HAS_SAV_UserArgs_MT144x256x64_MI16x16x1_SN_LDSB0_CLR1_GRVWA4_GRVWB16_GSU0_GSUC0_GSUWGMRR0_K1_LBSPPA1152_LBSPPB2048_LPA16_LPB64_MIWT9_4_PLR1_SU0_SUM0_SUS64_VWA1_VWB4_WGM1_WGMXCC1_WGMXCCGn1
    SolutionIndex: 36
    SolutionNameMin: Cijk_Ailk_Bjlk_F8NSS_BH_Bias_HAS_SAV_UserArgs_MT144x256x64_MI16x16x1_SN_LDSB0_CLR1_GRVWA4_GRVWB8_GSU0_GSUC0_GSUWGMRR0_K1_LBSPPA1152_LBSPPB2048_LPA16_LPB64_MIWT9_4_PLR1_SU0_SUM0_SUS64_VWA1_VWB4_WGM4_WGMXCC1_WGMXCCGn1
    SolutionIndex: 37
    SolutionNameMin: Cijk_Ailk_Bjlk_F8NSS_BH_Bias_HAS_SAV_UserArgs_MT144x256x64_MI16x16x1_SN_LDSB0_CLR1_GRVWA4_GRVWB16_GSU0_GSUC0_GSUWGMRR0_K1_LBSPPA1152_LBSPPB2048_LPA16_LPB64_MIWT9_4_PLR1_SU0_SUM0_SUS64_VWA1_VWB4_WGM4_WGMXCC1_WGMXCCGn1
    SolutionIndex: 38
    SolutionNameMin: Cijk_Ailk_Bjlk_F8NSS_BH_Bias_HAS_SAV_UserArgs_MT144x256x64_MI16x16x1_SN_LDSB0_CLR1_GRVWA4_GRVWB16_GSU0_GSUC0_GSUWGMRR0_K1_LBSPPA1152_LBSPPB2048_LPA16_LPB64_MIWT9_4_PLR1_SU0_SUM0_SUS64_VWA1_VWB4_WGM6_WGMXCC1_WGMXCCGn1
    SolutionIndex: 39
    SolutionNameMin: Cijk_Ailk_Bjlk_F8NSS_BH_Bias_HAS_SAV_UserArgs_MT144x256x64_MI16x16x1_SN_LDSB0_CLR1_GRVWA4_GRVWB16_GSU0_GSUC0_GSUWGMRR0_K1_LBSPPA1152_LBSPPB2048_LPA16_LPB64_MIWT9_4_PLR1_SU0_SUM0_SUS64_VWA1_VWB4_WGM8_WGMXCC1_WGMXCCGn1
    SolutionIndex: 40
    SolutionNameMin: Cijk_Ailk_Bjlk_F8NSS_BH_Bias_HAS_SAV_UserArgs_MT144x128x64_MI16x16x1_SN_LDSB1_CLR1_GRVWA4_GRVWB16_GSU0_GSUC0_GSUWGMRR0_K1_LBSPPA1152_LBSPPB1024_LPA16_LPB32_MIWT9_2_PLR1_SU0_SUM0_SUS64_VWA1_VWB2_WGM1_WGMXCC1_WGMXCCGn1
    SolutionIndex: 41
    SolutionNameMin: Cijk_Ailk_Bjlk_F8NSS_BH_Bias_HAS_SAV_UserArgs_MT128x128x64_MI16x16x1_SN_LDSB1_CLR1_GRVWA4_GRVWB4_GSU0_GSUC0_GSUWGMRR0_K1_LBSPPA1024_LBSPPB1024_LPA64_LPB64_MIWT4_4_PLR1_SU0_SUM0_SUS64_VWA4_VWB4_WGM1_WGMXCC1_WGMXCCGn1
    SolutionIndex: 42
    SolutionNameMin: Cijk_Ailk_Bjlk_F8NSS_BH_Bias_HAS_SAV_UserArgs_MT128x128x64_MI16x16x1_SN_LDSB1_CLR1_GRVWA16_GRVWB4_GSU0_GSUC0_GSUWGMRR0_K1_LBSPPA1024_LBSPPB1024_LPA64_LPB64_MIWT4_4_PLR1_SU0_SUM0_SUS64_VWA4_VWB4_WGM1_WGMXCC1_WGMXCCGn1
    SolutionIndex: 43
    SolutionNameMin: Cijk_Ailk_Bjlk_F8NSS_BH_Bias_HAS_SAV_UserArgs_MT128x128x64_MI16x16x1_SN_LDSB1_CLR1_GRVWA4_GRVWB8_GSU0_GSUC0_GSUWGMRR0_K1_LBSPPA1024_LBSPPB1024_LPA64_LPB64_MIWT4_4_PLR1_SU0_SUM0_SUS64_VWA4_VWB4_WGM1_WGMXCC1_WGMXCCGn1
    SolutionIndex: 44
    SolutionNameMin: Cijk_Ailk_Bjlk_F8NSS_BH_Bias_HAS_SAV_UserArgs_MT128x128x64_MI16x16x1_SN_LDSB1_CLR1_GRVWA4_GRVWB16_GSU0_GSUC0_GSUWGMRR0_K1_LBSPPA1024_LBSPPB1024_LPA64_LPB64_MIWT4_4_PLR1_SU0_SUM0_SUS64_VWA4_VWB4_WGM1_WGMXCC1_WGMXCCGn1
    SolutionIndex: 45
    SolutionNameMin: Cijk_Ailk_Bjlk_F8NSS_BH_Bias_HAS_SAV_UserArgs_MT128x128x64_MI16x16x1_SN_LDSB1_CLR1_GRVWA8_GRVWB16_GSU0_GSUC0_GSUWGMRR0_K1_LBSPPA1024_LBSPPB1024_LPA64_LPB64_MIWT4_4_PLR1_SU0_SUM0_SUS64_VWA4_VWB4_WGM1_WGMXCC1_WGMXCCGn1
    SolutionIndex: 46
    SolutionNameMin: Cijk_Ailk_Bjlk_F8NSS_BH_Bias_HAS_SAV_UserArgs_MT128x128x64_MI16x16x1_SN_LDSB1_CLR1_GRVWA16_GRVWB16_GSU0_GSUC0_GSUWGMRR0_K1_LBSPPA1024_LBSPPB1024_LPA64_LPB64_MIWT4_4_PLR1_SU0_SUM0_SUS64_VWA4_VWB4_WGM1_WGMXCC1_WGMXCCGn1
    SolutionIndex: 47
    SolutionNameMin: Cijk_Ailk_Bjlk_F8NSS_BH_Bias_HAS_SAV_UserArgs_MT128x128x64_MI16x16x1_SN_LDSB1_CLR1_GRVWA16_GRVWB8_GSU0_GSUC0_GSUWGMRR0_K1_LBSPPA1024_LBSPPB1024_LPA64_LPB64_MIWT4_4_PLR1_SU0_SUM0_SUS64_VWA4_VWB4_WGM4_WGMXCC1_WGMXCCGn1
    SolutionIndex: 48
    SolutionNameMin: Cijk_Ailk_Bjlk_F8NSS_BH_Bias_HAS_SAV_UserArgs_MT128x128x64_MI16x16x1_SN_LDSB1_CLR1_GRVWA16_GRVWB8_GSU0_GSUC0_GSUWGMRR0_K1_LBSPPA1024_LBSPPB1024_LPA64_LPB64_MIWT4_4_PLR1_SU0_SUM0_SUS64_VWA4_VWB4_WGM6_WGMXCC1_WGMXCCGn1
    SolutionIndex: 49
    SolutionNameMin: Cijk_Ailk_Bjlk_F8NSS_BH_Bias_HAS_SAV_UserArgs_MT128x128x64_MI16x16x1_SN_LDSB1_CLR1_GRVWA4_GRVWB16_GSU0_GSUC0_GSUWGMRR0_K1_LBSPPA1024_LBSPPB1024_LPA64_LPB64_MIWT4_4_PLR1_SU0_SUM0_SUS64_VWA4_VWB4_WGM6_WGMXCC1_WGMXCCGn1
    SolutionIndex: 50
    SolutionNameMin: Cijk_Ailk_Bjlk_F8NSS_BH_Bias_HAS_SAV_UserArgs_MT128x128x64_MI16x16x1_SN_LDSB1_CLR1_GRVWA16_GRVWB16_GSU0_GSUC0_GSUWGMRR0_K1_LBSPPA1024_LBSPPB1024_LPA64_LPB64_MIWT4_4_PLR1_SU0_SUM0_SUS64_VWA4_VWB4_WGM6_WGMXCC1_WGMXCCGn1
    SolutionIndex: 51
    SolutionNameMin: Cijk_Ailk_Bjlk_F8NSS_BH_Bias_HAS_SAV_UserArgs_MT128x128x64_MI16x16x1_SN_LDSB1_CLR1_GRVWA4_GRVWB4_GSU0_GSUC0_GSUWGMRR0_K1_LBSPPA1024_LBSPPB1024_LPA64_LPB64_MIWT4_4_PLR1_SU0_SUM0_SUS64_VWA4_VWB4_WGM8_WGMXCC1_WGMXCCGn1
    SolutionIndex: 52
    SolutionNameMin: Cijk_Ailk_Bjlk_F8NSS_BH_Bias_HAS_SAV_UserArgs_MT128x128x64_MI16x16x1_SN_LDSB1_CLR1_GRVWA4_GRVWB8_GSU0_GSUC0_GSUWGMRR0_K1_LBSPPA1024_LBSPPB1024_LPA64_LPB64_MIWT4_4_PLR1_SU0_SUM0_SUS64_VWA4_VWB4_WGM8_WGMXCC1_WGMXCCGn1
    SolutionIndex: 53
    SolutionNameMin: Cijk_Ailk_Bjlk_F8NSS_BH_Bias_HAS_SAV_UserArgs_MT128x128x64_MI16x16x1_SN_LDSB1_CLR1_GRVWA4_GRVWB16_GSU0_GSUC0_GSUWGMRR0_K1_LBSPPA1024_LBSPPB1024_LPA64_LPB64_MIWT4_4_PLR1_SU0_SUM0_SUS64_VWA4_VWB4_WGM8_WGMXCC1_WGMXCCGn1
    SolutionIndex: 54
    SolutionNameMin: Cijk_Ailk_Bjlk_F8NSS_BH_Bias_HAS_SAV_UserArgs_MT128x128x64_MI16x16x1_SN_LDSB1_CLR1_GRVWA8_GRVWB16_GSU0_GSUC0_GSUWGMRR0_K1_LBSPPA1024_LBSPPB1024_LPA64_LPB64_MIWT4_4_PLR1_SU0_SUM0_SUS64_VWA4_VWB4_WGM8_WGMXCC1_WGMXCCGn1
    SolutionIndex: 55
    SolutionNameMin: Cijk_Ailk_Bjlk_F8NSS_BH_Bias_HAS_SAV_UserArgs_MT128x128x64_MI16x16x1_SN_LDSB1_CLR1_GRVWA16_GRVWB16_GSU0_GSUC0_GSUWGMRR0_K1_LBSPPA1024_LBSPPB1024_LPA64_LPB64_MIWT4_4_PLR1_SU0_SUM0_SUS64_VWA4_VWB4_WGM8_WGMXCC1_WGMXCCGn1
    SolutionIndex: 56
    SolutionNameMin: Cijk_Ailk_Bjlk_F8NSS_BH_Bias_HAS_SAV_UserArgs_MT64x128x64_MI16x16x1_SN_LDSB0_CLR1_GRVWA4_GRVWB4_GSU0_GSUC0_GSUWGMRR0_K1_LBSPPA512_LBSPPB1024_LPA32_LPB64_MIWT2_4_PLR1_SU0_SUM0_SUS64_VWA2_VWB4_WGM1_WGMXCC1_WGMXCCGn1
    SolutionIndex: 57
    SolutionNameMin: Cijk_Ailk_Bjlk_F8NSS_BH_Bias_HAS_SAV_UserArgs_MT64x128x64_MI16x16x1_SN_LDSB0_CLR1_GRVWA4_GRVWB8_GSU0_GSUC0_GSUWGMRR0_K1_LBSPPA512_LBSPPB1024_LPA32_LPB64_MIWT2_4_PLR1_SU0_SUM0_SUS64_VWA2_VWB4_WGM1_WGMXCC1_WGMXCCGn1
    SolutionIndex: 58
    SolutionNameMin: Cijk_Ailk_Bjlk_F8NSS_BH_Bias_HAS_SAV_UserArgs_MT64x128x64_MI16x16x1_SN_LDSB0_CLR1_GRVWA8_GRVWB16_GSU0_GSUC0_GSUWGMRR0_K1_LBSPPA512_LBSPPB1024_LPA32_LPB64_MIWT2_4_PLR1_SU0_SUM0_SUS64_VWA2_VWB4_WGM1_WGMXCC1_WGMXCCGn1
    SolutionIndex: 59
    SolutionNameMin: Cijk_Ailk_Bjlk_F8NSS_BH_Bias_HAS_SAV_UserArgs_MT64x128x64_MI16x16x1_SN_LDSB0_CLR1_GRVWA16_GRVWB16_GSU0_GSUC0_GSUWGMRR0_K1_LBSPPA512_LBSPPB1024_LPA32_LPB64_MIWT2_4_PLR1_SU0_SUM0_SUS64_VWA2_VWB4_WGM1_WGMXCC1_WGMXCCGn1
    SolutionIndex: 60
    SolutionNameMin: Cijk_Ailk_Bjlk_F8NSS_BH_Bias_HAS_SAV_UserArgs_MT128x64x64_MI16x16x1_SN_LDSB0_CLR1_GRVWA16_GRVWB4_GSU0_GSUC0_GSUWGMRR0_K1_LBSPPA1024_LBSPPB512_LPA64_LPB32_MIWT4_2_PLR1_SU0_SUM0_SUS64_VWA4_VWB2_WGM1_WGMXCC1_WGMXCCGn1
    SolutionIndex: 61
    SolutionNameMin: Cijk_Ailk_Bjlk_F8NSS_BH_Bias_HAS_SAV_UserArgs_MT128x64x64_MI16x16x1_SN_LDSB0_CLR1_GRVWA4_GRVWB8_GSU0_GSUC0_GSUWGMRR0_K1_LBSPPA1024_LBSPPB512_LPA64_LPB32_MIWT4_2_PLR1_SU0_SUM0_SUS64_VWA4_VWB2_WGM1_WGMXCC1_WGMXCCGn1
    SolutionIndex: 62
    SolutionNameMin: Cijk_Ailk_Bjlk_F8NSS_BH_Bias_HAS_SAV_UserArgs_MT128x64x64_MI16x16x1_SN_LDSB0_CLR1_GRVWA16_GRVWB8_GSU0_GSUC0_GSUWGMRR0_K1_LBSPPA1024_LBSPPB512_LPA64_LPB32_MIWT4_2_PLR1_SU0_SUM0_SUS64_VWA4_VWB2_WGM1_WGMXCC1_WGMXCCGn1
    SolutionIndex: 63
    SolutionNameMin: Cijk_Ailk_Bjlk_F8NSS_BH_Bias_HAS_SAV_UserArgs_MT128x64x64_MI16x16x1_SN_LDSB0_CLR1_GRVWA8_GRVWB16_GSU0_GSUC0_GSUWGMRR0_K1_LBSPPA1024_LBSPPB512_LPA64_LPB32_MIWT4_2_PLR1_SU0_SUM0_SUS64_VWA4_VWB2_WGM1_WGMXCC1_WGMXCCGn1
    SolutionIndex: 64
    SolutionNameMin: Cijk_Ailk_Bjlk_F8NSS_BH_Bias_HAS_SAV_UserArgs_MT128x64x64_MI16x16x1_SN_LDSB0_CLR1_GRVWA4_GRVWB8_GSU0_GSUC0_GSUWGMRR0_K1_LBSPPA1024_LBSPPB512_LPA64_LPB32_MIWT4_2_PLR1_SU0_SUM0_SUS64_VWA4_VWB2_WGM4_WGMXCC1_WGMXCCGn1
    SolutionIndex: 65
    SolutionNameMin: Cijk_Ailk_Bjlk_F8NSS_BH_Bias_HAS_SAV_UserArgs_MT128x64x64_MI16x16x1_SN_LDSB0_CLR1_GRVWA16_GRVWB8_GSU0_GSUC0_GSUWGMRR0_K1_LBSPPA1024_LBSPPB512_LPA64_LPB32_MIWT4_2_PLR1_SU0_SUM0_SUS64_VWA4_VWB2_WGM4_WGMXCC1_WGMXCCGn1
    SolutionIndex: 66
    SolutionNameMin: Cijk_Ailk_Bjlk_F8NSS_BH_Bias_HAS_SAV_UserArgs_MT128x64x64_MI16x16x1_SN_LDSB0_CLR1_GRVWA4_GRVWB8_GSU0_GSUC0_GSUWGMRR0_K1_LBSPPA1024_LBSPPB512_LPA64_LPB32_MIWT4_2_PLR1_SU0_SUM0_SUS64_VWA4_VWB2_WGM6_WGMXCC1_WGMXCCGn1
    SolutionIndex: 67
    SolutionNameMin: Cijk_Ailk_Bjlk_F8NSS_BH_Bias_HAS_SAV_UserArgs_MT128x64x64_MI16x16x1_SN_LDSB0_CLR1_GRVWA4_GRVWB8_GSU0_GSUC0_GSUWGMRR0_K1_LBSPPA1024_LBSPPB512_LPA64_LPB32_MIWT4_2_PLR1_SU0_SUM0_SUS64_VWA4_VWB2_WGM8_WGMXCC1_WGMXCCGn1
    SolutionIndex: 68
    SolutionNameMin: Cijk_Ailk_Bjlk_F8NSS_BH_Bias_HAS_SAV_UserArgs_MT128x32x64_MI16x16x1_SN_LDSB0_CLR1_GRVWA4_GRVWB4_GSU0_GSUC0_GSUWGMRR0_K1_LBSPPA1024_LBSPPB256_LPA64_LPB16_MIWT4_1_PLR1_SU0_SUM0_SUS64_VWA4_VWB1_WGM1_WGMXCC1_WGMXCCGn1
    SolutionIndex: 69
    SolutionNameMin: Cijk_Ailk_Bjlk_F8NSS_BH_Bias_HAS_SAV_UserArgs_MT128x32x64_MI16x16x1_SN_LDSB0_CLR1_GRVWA8_GRVWB4_GSU0_GSUC0_GSUWGMRR0_K1_LBSPPA1024_LBSPPB256_LPA64_LPB16_MIWT4_1_PLR1_SU0_SUM0_SUS64_VWA4_VWB1_WGM1_WGMXCC1_WGMXCCGn1
    SolutionIndex: 70
    SolutionNameMin: Cijk_Ailk_Bjlk_F8NSS_BH_Bias_HAS_SAV_UserArgs_MT128x32x64_MI16x16x1_SN_LDSB0_CLR1_GRVWA4_GRVWB8_GSU0_GSUC0_GSUWGMRR0_K1_LBSPPA1024_LBSPPB256_LPA64_LPB16_MIWT4_1_PLR1_SU0_SUM0_SUS64_VWA4_VWB1_WGM1_WGMXCC1_WGMXCCGn1
    SolutionIndex: 71
    SolutionNameMin: Cijk_Ailk_Bjlk_F8NSS_BH_Bias_HAS_SAV_UserArgs_MT64x64x64_MI16x16x1_SN_LDSB0_CLR1_GRVWA4_GRVWB4_GSU0_GSUC0_GSUWGMRR0_K1_LBSPPA512_LBSPPB512_LPA32_LPB32_MIWT2_2_PLR1_SU0_SUM0_SUS64_VWA2_VWB2_WGM1_WGMXCC1_WGMXCCGn1
    SolutionIndex: 72
    SolutionNameMin: Cijk_Ailk_Bjlk_F8NSS_BH_Bias_HAS_SAV_UserArgs_MT64x64x64_MI16x16x1_SN_LDSB0_CLR1_GRVWA8_GRVWB8_GSU0_GSUC0_GSUWGMRR0_K1_LBSPPA512_LBSPPB512_LPA32_LPB32_MIWT2_2_PLR1_SU0_SUM0_SUS64_VWA2_VWB2_WGM1_WGMXCC1_WGMXCCGn1
    SolutionIndex: 73
    SolutionNameMin: Cijk_Ailk_Bjlk_F8NSS_BH_Bias_HAS_SAV_UserArgs_MT64x64x64_MI16x16x1_SN_LDSB0_CLR1_GRVWA4_GRVWB4_GSU0_GSUC0_GSUWGMRR0_K1_LBSPPA512_LBSPPB512_LPA32_LPB32_MIWT2_2_PLR1_SU0_SUM0_SUS64_VWA2_VWB2_WGM6_WGMXCC1_WGMXCCGn1
    SolutionIndex: 74
    SolutionNameMin: Cijk_Ailk_Bjlk_F8NSS_BH_Bias_HAS_SAV_UserArgs_MT32x64x64_MI16x16x1_SN_LDSB0_CLR1_GRVWA4_GRVWB4_GSU0_GSUC0_GSUWGMRR0_K1_LBSPPA256_LBSPPB512_LPA16_LPB32_MIWT1_2_PLR1_SU0_SUM0_SUS64_VWA1_VWB2_WGM1_WGMXCC1_WGMXCCGn1
    SolutionIndex: 75
    SolutionNameMin: Cijk_Ailk_Bjlk_F8NSS_BH_Bias_HAS_SAV_UserArgs_MT32x64x64_MI16x16x1_SN_LDSB0_CLR1_GRVWA4_GRVWB8_GSU0_GSUC0_GSUWGMRR0_K1_LBSPPA256_LBSPPB512_LPA16_LPB32_MIWT1_2_PLR1_SU0_SUM0_SUS64_VWA1_VWB2_WGM1_WGMXCC1_WGMXCCGn1
    SolutionIndex: 76
    SolutionNameMin: Cijk_Ailk_Bjlk_F8NSS_BH_Bias_HAS_SAV_UserArgs_MT32x64x64_MI16x16x1_SN_LDSB0_CLR1_GRVWA8_GRVWB8_GSU0_GSUC0_GSUWGMRR0_K1_LBSPPA256_LBSPPB512_LPA16_LPB32_MIWT1_2_PLR1_SU0_SUM0_SUS64_VWA1_VWB2_WGM4_WGMXCC1_WGMXCCGn1
    SolutionIndex: 77
    SolutionNameMin: Cijk_Ailk_Bjlk_F8NSS_BH_Bias_HAS_SAV_UserArgs_MT32x64x64_MI16x16x1_SN_LDSB0_CLR1_GRVWA8_GRVWB8_GSU0_GSUC0_GSUWGMRR0_K1_LBSPPA256_LBSPPB512_LPA16_LPB32_MIWT1_2_PLR1_SU0_SUM0_SUS64_VWA1_VWB2_WGM8_WGMXCC1_WGMXCCGn1
    SolutionIndex: 78
    SolutionNameMin: Cijk_Ailk_Bjlk_F8NSS_BH_Bias_HAS_SAV_UserArgs_MT64x32x64_MI16x16x1_SN_LDSB0_CLR1_GRVWA4_GRVWB4_GSU0_GSUC0_GSUWGMRR0_K1_LBSPPA512_LBSPPB256_LPA32_LPB16_MIWT2_1_PLR1_SU0_SUM0_SUS64_VWA2_VWB1_WGM1_WGMXCC1_WGMXCCGn1
    SolutionIndex: 79
    SolutionNameMin: Cijk_Ailk_Bjlk_F8NSS_BH_Bias_HAS_SAV_UserArgs_MT64x32x64_MI16x16x1_SN_LDSB0_CLR1_GRVWA16_GRVWB4_GSU0_GSUC0_GSUWGMRR0_K1_LBSPPA512_LBSPPB256_LPA32_LPB16_MIWT2_1_PLR1_SU0_SUM0_SUS64_VWA2_VWB1_WGM1_WGMXCC1_WGMXCCGn1
    SolutionIndex: 80
    SolutionNameMin: Cijk_Ailk_Bjlk_F8NSS_BH_Bias_HAS_SAV_UserArgs_MT64x32x64_MI16x16x1_SN_LDSB0_CLR1_GRVWA4_GRVWB4_GSU0_GSUC0_GSUWGMRR0_K1_LBSPPA512_LBSPPB256_LPA32_LPB16_MIWT2_1_PLR1_SU0_SUM0_SUS64_VWA2_VWB1_WGM4_WGMXCC1_WGMXCCGn1
    SolutionIndex: 81
    SolutionNameMin: Cijk_Ailk_Bjlk_F8NSS_BH_Bias_HAS_SAV_UserArgs_MT64x32x64_MI16x16x1_SN_LDSB0_CLR1_GRVWA16_GRVWB4_GSU0_GSUC0_GSUWGMRR0_K1_LBSPPA512_LBSPPB256_LPA32_LPB16_MIWT2_1_PLR1_SU0_SUM0_SUS64_VWA2_VWB1_WGM6_WGMXCC1_WGMXCCGn1
    SolutionIndex: 82
    SolutionNameMin: Cijk_Ailk_Bjlk_F8NSS_BH_Bias_HAS_SAV_UserArgs_MT64x32x64_MI16x16x1_SN_LDSB0_CLR1_GRVWA16_GRVWB8_GSU0_GSUC0_GSUWGMRR0_K1_LBSPPA512_LBSPPB256_LPA32_LPB16_MIWT2_1_PLR1_SU0_SUM0_SUS64_VWA2_VWB1_WGM6_WGMXCC1_WGMXCCGn1
    SolutionIndex: 83
    SolutionNameMin: Cijk_Ailk_Bjlk_F8NSS_BH_Bias_HAS_SAV_UserArgs_MT32x32x64_MI16x16x1_SN_LDSB0_CLR1_GRVWA4_GRVWB4_GSU0_GSUC0_GSUWGMRR0_K1_LBSPPA256_LBSPPB256_LPA16_LPB16_MIWT1_1_PLR1_SU0_SUM0_SUS64_VWA1_VWB1_WGM1_WGMXCC1_WGMXCCGn1
    SolutionIndex: 84
    SolutionNameMin: Cijk_Ailk_Bjlk_F8NSS_BH_Bias_HAS_SAV_UserArgs_MT32x32x64_MI16x16x1_SN_LDSB0_CLR1_GRVWA8_GRVWB4_GSU0_GSUC0_GSUWGMRR0_K1_LBSPPA256_LBSPPB256_LPA16_LPB16_MIWT1_1_PLR1_SU0_SUM0_SUS64_VWA1_VWB1_WGM1_WGMXCC1_WGMXCCGn1
    SolutionIndex: 85
    SolutionNameMin: Cijk_Ailk_Bjlk_F8NSS_BH_Bias_HAS_SAV_UserArgs_MT32x32x64_MI16x16x1_SN_LDSB0_CLR1_GRVWA4_GRVWB8_GSU0_GSUC0_GSUWGMRR0_K1_LBSPPA256_LBSPPB256_LPA16_LPB16_MIWT1_1_PLR1_SU0_SUM0_SUS64_VWA1_VWB1_WGM1_WGMXCC1_WGMXCCGn1
    SolutionIndex: 86
    SolutionNameMin: Cijk_Ailk_Bjlk_F8NSS_BH_Bias_HAS_SAV_UserArgs_MT32x32x64_MI16x16x1_SN_LDSB0_CLR1_GRVWA8_GRVWB8_GSU0_GSUC0_GSUWGMRR0_K1_LBSPPA256_LBSPPB256_LPA16_LPB16_MIWT1_1_PLR1_SU0_SUM0_SUS64_VWA1_VWB1_WGM1_WGMXCC1_WGMXCCGn1
    SolutionIndex: 87
    SolutionNameMin: Cijk_Ailk_Bjlk_F8NSS_BH_Bias_HAS_SAV_UserArgs_MT32x32x64_MI16x16x1_SN_LDSB0_CLR1_GRVWA4_GRVWB4_GSU0_GSUC0_GSUWGMRR0_K1_LBSPPA256_LBSPPB256_LPA16_LPB16_MIWT1_1_PLR1_SU0_SUM0_SUS64_VWA1_VWB1_WGM6_WGMXCC1_WGMXCCGn1
    SolutionIndex: 88
    SolutionNameMin: Cijk_Ailk_Bjlk_F8NSS_BH_Bias_HAS_SAV_UserArgs_MT32x32x64_MI16x16x1_SN_LDSB0_CLR1_GRVWA4_GRVWB8_GSU0_GSUC0_GSUWGMRR0_K1_LBSPPA256_LBSPPB256_LPA16_LPB16_MIWT1_1_PLR1_SU0_SUM0_SUS64_VWA1_VWB1_WGM6_WGMXCC1_WGMXCCGn1
    SolutionIndex: 89
    SolutionNameMin: Cijk_Ailk_Bjlk_F8NSS_BH_Bias_HAS_SAV_UserArgs_MT256x256x128_MI16x16x1_SN_LDSB1_CLR1_GRVWA16_GRVWB16_GSU0_GSUC0_GSUWGMRR0_K1_LBSPPA2048_LBSPPB2048_LPA0_LPB0_MIWT8_8_PLR1_SU0_SUM0_SUS128_VWA8_VWB8_WGM1_WGMXCC1_WGMXCCGn1
    SolutionIndex: 90
    SolutionNameMin: Cijk_Ailk_Bjlk_F8NSS_BH_Bias_HAS_SAV_UserArgs_MT256x256x128_MI16x16x1_SN_LDSB1_CLR1_GRVWA8_GRVWB16_GSU0_GSUC0_GSUWGMRR0_K1_LBSPPA2048_LBSPPB2048_LPA0_LPB0_MIWT8_8_PLR1_SU0_SUM0_SUS128_VWA8_VWB8_WGM4_WGMXCC1_WGMXCCGn1
    SolutionIndex: 91
    SolutionNameMin: Cijk_Ailk_Bjlk_F8NSS_BH_Bias_HAS_SAV_UserArgs_MT256x256x128_MI16x16x1_SN_LDSB1_CLR1_GRVWA16_GRVWB16_GSU0_GSUC0_GSUWGMRR0_K1_LBSPPA2048_LBSPPB2048_LPA0_LPB0_MIWT8_8_PLR1_SU0_SUM0_SUS128_VWA8_VWB8_WGM6_WGMXCC1_WGMXCCGn1
    SolutionIndex: 92
    SolutionNameMin: Cijk_Ailk_Bjlk_F8NSS_BH_Bias_HAS_SAV_UserArgs_MT128x256x128_MI16x16x1_SN_LDSB1_CLR1_GRVWA4_GRVWB16_GSU0_GSUC0_GSUWGMRR0_K1_LBSPPA1024_LBSPPB2048_LPA64_LPB0_MIWT4_8_PLR1_SU0_SUM0_SUS128_VWA4_VWB8_WGM1_WGMXCC1_WGMXCCGn1
    SolutionIndex: 93
    SolutionNameMin: Cijk_Ailk_Bjlk_F8NSS_BH_Bias_HAS_SAV_UserArgs_MT128x256x128_MI16x16x1_SN_LDSB1_CLR1_GRVWA16_GRVWB16_GSU0_GSUC0_GSUWGMRR0_K1_LBSPPA1024_LBSPPB2048_LPA64_LPB0_MIWT4_8_PLR1_SU0_SUM0_SUS128_VWA4_VWB8_WGM1_WGMXCC1_WGMXCCGn1
    SolutionIndex: 94
    SolutionNameMin: Cijk_Ailk_Bjlk_F8NSS_BH_Bias_HAS_SAV_UserArgs_MT128x256x128_MI16x16x1_SN_LDSB1_CLR1_GRVWA4_GRVWB16_GSU0_GSUC0_GSUWGMRR0_K1_LBSPPA1024_LBSPPB2048_LPA64_LPB0_MIWT4_8_PLR1_SU0_SUM0_SUS128_VWA4_VWB8_WGM4_WGMXCC1_WGMXCCGn1
    SolutionIndex: 95
    SolutionNameMin: Cijk_Ailk_Bjlk_F8NSS_BH_Bias_HAS_SAV_UserArgs_MT128x256x128_MI16x16x1_SN_LDSB1_CLR1_GRVWA8_GRVWB16_GSU0_GSUC0_GSUWGMRR0_K1_LBSPPA1024_LBSPPB2048_LPA64_LPB0_MIWT4_8_PLR1_SU0_SUM0_SUS128_VWA4_VWB8_WGM4_WGMXCC1_WGMXCCGn1
    SolutionIndex: 96
    SolutionNameMin: Cijk_Ailk_Bjlk_F8NSS_BH_Bias_HAS_SAV_UserArgs_MT128x256x128_MI16x16x1_SN_LDSB1_CLR1_GRVWA4_GRVWB16_GSU0_GSUC0_GSUWGMRR0_K1_LBSPPA1024_LBSPPB2048_LPA64_LPB0_MIWT4_8_PLR1_SU0_SUM0_SUS128_VWA4_VWB8_WGM6_WGMXCC1_WGMXCCGn1
    SolutionIndex: 97
    SolutionNameMin: Cijk_Ailk_Bjlk_F8NSS_BH_Bias_HAS_SAV_UserArgs_MT128x256x128_MI16x16x1_SN_LDSB1_CLR1_GRVWA8_GRVWB16_GSU0_GSUC0_GSUWGMRR0_K1_LBSPPA1024_LBSPPB2048_LPA64_LPB0_MIWT4_8_PLR1_SU0_SUM0_SUS128_VWA4_VWB8_WGM6_WGMXCC1_WGMXCCGn1
    SolutionIndex: 98
    SolutionNameMin: Cijk_Ailk_Bjlk_F8NSS_BH_Bias_HAS_SAV_UserArgs_MT128x256x128_MI16x16x1_SN_LDSB1_CLR1_GRVWA16_GRVWB16_GSU0_GSUC0_GSUWGMRR0_K1_LBSPPA1024_LBSPPB2048_LPA64_LPB0_MIWT4_8_PLR1_SU0_SUM0_SUS128_VWA4_VWB8_WGM8_WGMXCC1_WGMXCCGn1
    SolutionIndex: 99
    SolutionNameMin: Cijk_Ailk_Bjlk_F8NSS_BH_Bias_HAS_SAV_UserArgs_MT128x128x128_MI16x16x1_SN_LDSB1_CLR1_GRVWA16_GRVWB16_GSU0_GSUC0_GSUWGMRR0_K1_LBSPPA1024_LBSPPB1024_LPA64_LPB64_MIWT4_4_PLR1_SU0_SUM0_SUS128_VWA4_VWB4_WGM1_WGMXCC1_WGMXCCGn1
    SolutionIndex: 100
    SolutionNameMin: Cijk_Ailk_Bjlk_F8NSS_BH_Bias_HAS_SAV_UserArgs_MT128x128x128_MI16x16x1_SN_LDSB1_CLR1_GRVWA16_GRVWB16_GSU0_GSUC0_GSUWGMRR0_K1_LBSPPA1024_LBSPPB1024_LPA64_LPB64_MIWT4_4_PLR1_SU0_SUM0_SUS128_VWA4_VWB4_WGM4_WGMXCC1_WGMXCCGn1
    SolutionIndex: 101
    SolutionNameMin: Cijk_Ailk_Bjlk_F8NSS_BH_Bias_HAS_SAV_UserArgs_MT128x64x128_MI16x16x1_SN_LDSB1_CLR1_GRVWA16_GRVWB16_GSU0_GSUC0_GSUWGMRR0_K1_LBSPPA1024_LBSPPB512_LPA64_LPB32_MIWT4_2_PLR1_SU0_SUM0_SUS128_VWA4_VWB2_WGM1_WGMXCC1_WGMXCCGn1
    SolutionIndex: 102
    SolutionNameMin: Cijk_Ailk_Bjlk_F8NSS_BH_Bias_HAS_SAV_UserArgs_MT128x64x128_MI16x16x1_SN_LDSB1_CLR1_GRVWA16_GRVWB16_GSU0_GSUC0_GSUWGMRR0_K1_LBSPPA1024_LBSPPB512_LPA64_LPB32_MIWT4_2_PLR1_SU0_SUM0_SUS128_VWA4_VWB2_WGM4_WGMXCC1_WGMXCCGn1
    SolutionIndex: 103
    SolutionNameMin: Cijk_Ailk_Bjlk_F8NSS_BH_Bias_HAS_SAV_UserArgs_MT128x64x128_MI16x16x1_SN_LDSB1_CLR1_GRVWA16_GRVWB16_GSU0_GSUC0_GSUWGMRR0_K1_LBSPPA1024_LBSPPB512_LPA64_LPB32_MIWT4_2_PLR1_SU0_SUM0_SUS128_VWA4_VWB2_WGM6_WGMXCC1_WGMXCCGn1
    SolutionIndex: 104
    SolutionNameMin: Cijk_Ailk_Bjlk_F8NSS_BH_Bias_HAS_SAV_UserArgs_MT128x64x128_MI16x16x1_SN_LDSB1_CLR1_GRVWA4_GRVWB8_GSU0_GSUC0_GSUWGMRR0_K1_LBSPPA1024_LBSPPB512_LPA64_LPB32_MIWT4_2_PLR1_SU0_SUM0_SUS128_VWA4_VWB2_WGM8_WGMXCC1_WGMXCCGn1
    SolutionIndex: 105
    SolutionNameMin: Cijk_Ailk_Bjlk_F8NSS_BH_Bias_HAS_SAV_UserArgs_MT128x64x128_MI16x16x1_SN_LDSB1_CLR1_GRVWA16_GRVWB16_GSU0_GSUC0_GSUWGMRR0_K1_LBSPPA1024_LBSPPB512_LPA64_LPB32_MIWT4_2_PLR1_SU0_SUM0_SUS128_VWA4_VWB2_WGM8_WGMXCC1_WGMXCCGn1
    SolutionIndex: 106
    SolutionNameMin: Cijk_Ailk_Bjlk_F8NSS_BH_Bias_HAS_SAV_UserArgs_MT64x64x128_MI16x16x1_SN_LDSB1_CLR1_GRVWA4_GRVWB8_GSU0_GSUC0_GSUWGMRR0_K1_LBSPPA512_LBSPPB512_LPA32_LPB32_MIWT2_2_PLR1_SU0_SUM0_SUS128_VWA2_VWB2_WGM1_WGMXCC1_WGMXCCGn1
    SolutionIndex: 107
    SolutionNameMin: Cijk_Ailk_Bjlk_F8NSS_BH_Bias_HAS_SAV_UserArgs_MT64x64x128_MI16x16x1_SN_LDSB1_CLR1_GRVWA8_GRVWB16_GSU0_GSUC0_GSUWGMRR0_K1_LBSPPA512_LBSPPB512_LPA32_LPB32_MIWT2_2_PLR1_SU0_SUM0_SUS128_VWA2_VWB2_WGM1_WGMXCC1_WGMXCCGn1
    SolutionIndex: 108
    SolutionNameMin: Cijk_Ailk_Bjlk_F8NSS_BH_Bias_HAS_SAV_UserArgs_MT64x64x128_MI16x16x1_SN_LDSB1_CLR1_GRVWA16_GRVWB16_GSU0_GSUC0_GSUWGMRR0_K1_LBSPPA512_LBSPPB512_LPA32_LPB32_MIWT2_2_PLR1_SU0_SUM0_SUS128_VWA2_VWB2_WGM1_WGMXCC1_WGMXCCGn1
    SolutionIndex: 109
    SolutionNameMin: Cijk_Ailk_Bjlk_F8NSS_BH_Bias_HAS_SAV_UserArgs_MT64x64x128_MI16x16x1_SN_LDSB1_CLR1_GRVWA8_GRVWB16_GSU0_GSUC0_GSUWGMRR0_K1_LBSPPA512_LBSPPB512_LPA32_LPB32_MIWT2_2_PLR1_SU0_SUM0_SUS128_VWA2_VWB2_WGM4_WGMXCC1_WGMXCCGn1
    SolutionIndex: 110
    SolutionNameMin: Cijk_Ailk_Bjlk_F8NSS_BH_Bias_HAS_SAV_UserArgs_MT64x64x128_MI16x16x1_SN_LDSB1_CLR1_GRVWA16_GRVWB16_GSU0_GSUC0_GSUWGMRR0_K1_LBSPPA512_LBSPPB512_LPA32_LPB32_MIWT2_2_PLR1_SU0_SUM0_SUS128_VWA2_VWB2_WGM4_WGMXCC1_WGMXCCGn1
    SolutionIndex: 111
    SolutionNameMin: Cijk_Ailk_Bjlk_F8NSS_BH_Bias_HAS_SAV_UserArgs_MT64x64x128_MI16x16x1_SN_LDSB1_CLR1_GRVWA4_GRVWB16_GSU0_GSUC0_GSUWGMRR0_K1_LBSPPA512_LBSPPB512_LPA32_LPB32_MIWT2_2_PLR1_SU0_SUM0_SUS128_VWA2_VWB2_WGM6_WGMXCC1_WGMXCCGn1
    SolutionIndex: 112
    SolutionNameMin: Cijk_Ailk_Bjlk_F8NSS_BH_Bias_HAS_SAV_UserArgs_MT64x64x128_MI16x16x1_SN_LDSB1_CLR1_GRVWA8_GRVWB16_GSU0_GSUC0_GSUWGMRR0_K1_LBSPPA512_LBSPPB512_LPA32_LPB32_MIWT2_2_PLR1_SU0_SUM0_SUS128_VWA2_VWB2_WGM6_WGMXCC1_WGMXCCGn1
    SolutionIndex: 113
    SolutionNameMin: Cijk_Ailk_Bjlk_F8NSS_BH_Bias_HAS_SAV_UserArgs_MT64x64x128_MI16x16x1_SN_LDSB1_CLR1_GRVWA16_GRVWB16_GSU0_GSUC0_GSUWGMRR0_K1_LBSPPA512_LBSPPB512_LPA32_LPB32_MIWT2_2_PLR1_SU0_SUM0_SUS128_VWA2_VWB2_WGM6_WGMXCC1_WGMXCCGn1
    SolutionIndex: 114
    SolutionNameMin: Cijk_Ailk_Bjlk_F8NSS_BH_Bias_HAS_SAV_UserArgs_MT64x64x128_MI16x16x1_SN_LDSB1_CLR1_GRVWA4_GRVWB16_GSU0_GSUC0_GSUWGMRR0_K1_LBSPPA512_LBSPPB512_LPA32_LPB32_MIWT2_2_PLR1_SU0_SUM0_SUS128_VWA2_VWB2_WGM8_WGMXCC1_WGMXCCGn1
    SolutionIndex: 115
    SolutionNameMin: Cijk_Ailk_Bjlk_F8NSS_BH_Bias_HAS_SAV_UserArgs_MT64x64x128_MI16x16x1_SN_LDSB1_CLR1_GRVWA8_GRVWB16_GSU0_GSUC0_GSUWGMRR0_K1_LBSPPA512_LBSPPB512_LPA32_LPB32_MIWT2_2_PLR1_SU0_SUM0_SUS128_VWA2_VWB2_WGM8_WGMXCC1_WGMXCCGn1
    SolutionIndex: 116
    SolutionNameMin: Cijk_Ailk_Bjlk_F8NSS_BH_Bias_HAS_SAV_UserArgs_MT64x64x128_MI16x16x1_SN_LDSB1_CLR1_GRVWA16_GRVWB16_GSU0_GSUC0_GSUWGMRR0_K1_LBSPPA512_LBSPPB512_LPA32_LPB32_MIWT2_2_PLR1_SU0_SUM0_SUS128_VWA2_VWB2_WGM8_WGMXCC1_WGMXCCGn1
    SolutionIndex: 117
    SolutionNameMin: Cijk_Ailk_Bjlk_F8NSS_BH_Bias_HAS_SAV_UserArgs_MT32x64x128_MI16x16x1_SN_LDSB0_CLR1_GRVWA4_GRVWB16_GSU0_GSUC0_GSUWGMRR0_K1_LBSPPA256_LBSPPB512_LPA16_LPB32_MIWT1_2_PLR1_SU0_SUM0_SUS128_VWA1_VWB2_WGM1_WGMXCC1_WGMXCCGn1
    SolutionIndex: 118
    SolutionNameMin: Cijk_Ailk_Bjlk_F8NSS_BH_Bias_HAS_SAV_UserArgs_MT32x64x128_MI16x16x1_SN_LDSB0_CLR1_GRVWA16_GRVWB16_GSU0_GSUC0_GSUWGMRR0_K1_LBSPPA256_LBSPPB512_LPA16_LPB32_MIWT1_2_PLR1_SU0_SUM0_SUS128_VWA1_VWB2_WGM1_WGMXCC1_WGMXCCGn1
    SolutionIndex: 119
    SolutionNameMin: Cijk_Ailk_Bjlk_F8NSS_BH_Bias_HAS_SAV_UserArgs_MT32x64x128_MI16x16x1_SN_LDSB0_CLR1_GRVWA16_GRVWB16_GSU0_GSUC0_GSUWGMRR0_K1_LBSPPA256_LBSPPB512_LPA16_LPB32_MIWT1_2_PLR1_SU0_SUM0_SUS128_VWA1_VWB2_WGM4_WGMXCC1_WGMXCCGn1
    SolutionIndex: 120
    SolutionNameMin: Cijk_Ailk_Bjlk_F8NSS_BH_Bias_HAS_SAV_UserArgs_MT32x64x128_MI16x16x1_SN_LDSB0_CLR1_GRVWA16_GRVWB16_GSU0_GSUC0_GSUWGMRR0_K1_LBSPPA256_LBSPPB512_LPA16_LPB32_MIWT1_2_PLR1_SU0_SUM0_SUS128_VWA1_VWB2_WGM6_WGMXCC1_WGMXCCGn1
    SolutionIndex: 121
    SolutionNameMin: Cijk_Ailk_Bjlk_F8NSS_BH_Bias_HAS_SAV_UserArgs_MT32x64x128_MI16x16x1_SN_LDSB0_CLR1_GRVWA16_GRVWB16_GSU0_GSUC0_GSUWGMRR0_K1_LBSPPA256_LBSPPB512_LPA16_LPB32_MIWT1_2_PLR1_SU0_SUM0_SUS128_VWA1_VWB2_WGM8_WGMXCC1_WGMXCCGn1
    SolutionIndex: 122
    SolutionNameMin: Cijk_Ailk_Bjlk_F8NSS_BH_Bias_HAS_SAV_UserArgs_MT64x32x128_MI16x16x1_SN_LDSB0_CLR1_GRVWA4_GRVWB4_GSU0_GSUC0_GSUWGMRR0_K1_LBSPPA512_LBSPPB256_LPA32_LPB16_MIWT2_1_PLR1_SU0_SUM0_SUS128_VWA2_VWB1_WGM1_WGMXCC1_WGMXCCGn1
    SolutionIndex: 123
    SolutionNameMin: Cijk_Ailk_Bjlk_F8NSS_BH_Bias_HAS_SAV_UserArgs_MT64x32x128_MI16x16x1_SN_LDSB0_CLR1_GRVWA4_GRVWB8_GSU0_GSUC0_GSUWGMRR0_K1_LBSPPA512_LBSPPB256_LPA32_LPB16_MIWT2_1_PLR1_SU0_SUM0_SUS128_VWA2_VWB1_WGM1_WGMXCC1_WGMXCCGn1
    SolutionIndex: 124
    SolutionNameMin: Cijk_Ailk_Bjlk_F8NSS_BH_Bias_HAS_SAV_UserArgs_MT64x32x128_MI16x16x1_SN_LDSB0_CLR1_GRVWA8_GRVWB8_GSU0_GSUC0_GSUWGMRR0_K1_LBSPPA512_LBSPPB256_LPA32_LPB16_MIWT2_1_PLR1_SU0_SUM0_SUS128_VWA2_VWB1_WGM1_WGMXCC1_WGMXCCGn1
    SolutionIndex: 125
    SolutionNameMin: Cijk_Ailk_Bjlk_F8NSS_BH_Bias_HAS_SAV_UserArgs_MT64x32x128_MI16x16x1_SN_LDSB0_CLR1_GRVWA8_GRVWB16_GSU0_GSUC0_GSUWGMRR0_K1_LBSPPA512_LBSPPB256_LPA32_LPB16_MIWT2_1_PLR1_SU0_SUM0_SUS128_VWA2_VWB1_WGM1_WGMXCC1_WGMXCCGn1
    SolutionIndex: 126
    SolutionNameMin: Cijk_Ailk_Bjlk_F8NSS_BH_Bias_HAS_SAV_UserArgs_MT64x32x128_MI16x16x1_SN_LDSB0_CLR1_GRVWA16_GRVWB16_GSU0_GSUC0_GSUWGMRR0_K1_LBSPPA512_LBSPPB256_LPA32_LPB16_MIWT2_1_PLR1_SU0_SUM0_SUS128_VWA2_VWB1_WGM1_WGMXCC1_WGMXCCGn1
    SolutionIndex: 127
    SolutionNameMin: Cijk_Ailk_Bjlk_F8NSS_BH_Bias_HAS_SAV_UserArgs_MT32x32x128_MI16x16x1_SN_LDSB0_CLR1_GRVWA4_GRVWB4_GSU0_GSUC0_GSUWGMRR0_K1_LBSPPA256_LBSPPB256_LPA16_LPB16_MIWT1_1_PLR1_SU0_SUM0_SUS128_VWA1_VWB1_WGM1_WGMXCC1_WGMXCCGn1
    SolutionIndex: 128
    SolutionNameMin: Cijk_Ailk_Bjlk_F8NSS_BH_Bias_HAS_SAV_UserArgs_MT32x32x128_MI16x16x1_SN_LDSB0_CLR1_GRVWA8_GRVWB4_GSU0_GSUC0_GSUWGMRR0_K1_LBSPPA256_LBSPPB256_LPA16_LPB16_MIWT1_1_PLR1_SU0_SUM0_SUS128_VWA1_VWB1_WGM1_WGMXCC1_WGMXCCGn1
    SolutionIndex: 129
    SolutionNameMin: Cijk_Ailk_Bjlk_F8NSS_BH_Bias_HAS_SAV_UserArgs_MT32x32x128_MI16x16x1_SN_LDSB0_CLR1_GRVWA4_GRVWB8_GSU0_GSUC0_GSUWGMRR0_K1_LBSPPA256_LBSPPB256_LPA16_LPB16_MIWT1_1_PLR1_SU0_SUM0_SUS128_VWA1_VWB1_WGM1_WGMXCC1_WGMXCCGn1
    SolutionIndex: 130
    SolutionNameMin: Cijk_Ailk_Bjlk_F8NSS_BH_Bias_HAS_SAV_UserArgs_MT32x32x128_MI16x16x1_SN_LDSB0_CLR1_GRVWA8_GRVWB8_GSU0_GSUC0_GSUWGMRR0_K1_LBSPPA256_LBSPPB256_LPA16_LPB16_MIWT1_1_PLR1_SU0_SUM0_SUS128_VWA1_VWB1_WGM1_WGMXCC1_WGMXCCGn1
    SolutionIndex: 131
    SolutionNameMin: Cijk_Ailk_Bjlk_F8NSS_BH_Bias_HAS_SAV_UserArgs_MT32x32x128_MI16x16x1_SN_LDSB0_CLR1_GRVWA8_GRVWB16_GSU0_GSUC0_GSUWGMRR0_K1_LBSPPA256_LBSPPB256_LPA16_LPB16_MIWT1_1_PLR1_SU0_SUM0_SUS128_VWA1_VWB1_WGM1_WGMXCC1_WGMXCCGn1
    SolutionIndex: 132
    SolutionNameMin: Cijk_Ailk_Bjlk_F8NSS_BH_Bias_HAS_SAV_UserArgs_MT32x32x128_MI16x16x1_SN_LDSB0_CLR1_GRVWA4_GRVWB4_GSU0_GSUC0_GSUWGMRR0_K1_LBSPPA256_LBSPPB256_LPA16_LPB16_MIWT1_1_PLR1_SU0_SUM0_SUS128_VWA1_VWB1_WGM8_WGMXCC1_WGMXCCGn1
    SolutionIndex: 133
    SolutionNameMin: Cijk_Ailk_Bjlk_F8NSS_BH_Bias_HAS_SAV_UserArgs_MT128x64x256_MI16x16x1_SN_LDSB1_CLR1_GRVWA16_GRVWB16_GSU0_GSUC0_GSUWGMRR0_K1_LBSPPA1024_LBSPPB512_LPA64_LPB32_MIWT4_2_PLR1_SU0_SUM0_SUS256_VWA4_VWB2_WGM1_WGMXCC1_WGMXCCGn1
    SolutionIndex: 134
    SolutionNameMin: Cijk_Ailk_Bjlk_F8NSS_BH_Bias_HAS_SAV_UserArgs_MT128x64x256_MI16x16x1_SN_LDSB1_CLR1_GRVWA16_GRVWB16_GSU0_GSUC0_GSUWGMRR0_K1_LBSPPA1024_LBSPPB512_LPA64_LPB32_MIWT4_2_PLR1_SU0_SUM0_SUS256_VWA4_VWB2_WGM4_WGMXCC1_WGMXCCGn1
    SolutionIndex: 135
    SolutionNameMin: Cijk_Ailk_Bjlk_F8NSS_BH_Bias_HAS_SAV_UserArgs_MT128x64x256_MI16x16x1_SN_LDSB1_CLR1_GRVWA16_GRVWB16_GSU0_GSUC0_GSUWGMRR0_K1_LBSPPA1024_LBSPPB512_LPA64_LPB32_MIWT4_2_PLR1_SU0_SUM0_SUS256_VWA4_VWB2_WGM8_WGMXCC1_WGMXCCGn1
    SolutionIndex: 136
    SolutionNameMin: Cijk_Ailk_Bjlk_F8NSS_BH_Bias_HAS_SAV_UserArgs_MT64x64x256_MI16x16x1_SN_LDSB1_CLR1_GRVWA16_GRVWB16_GSU0_GSUC0_GSUWGMRR0_K1_LBSPPA512_LBSPPB512_LPA32_LPB32_MIWT2_2_PLR1_SU0_SUM0_SUS256_VWA2_VWB2_WGM1_WGMXCC1_WGMXCCGn1
    SolutionIndex: 137
    SolutionNameMin: Cijk_Ailk_Bjlk_F8NSS_BH_Bias_HAS_SAV_UserArgs_MT64x64x256_MI16x16x1_SN_LDSB1_CLR1_GRVWA16_GRVWB16_GSU0_GSUC0_GSUWGMRR0_K1_LBSPPA512_LBSPPB512_LPA32_LPB32_MIWT2_2_PLR1_SU0_SUM0_SUS256_VWA2_VWB2_WGM4_WGMXCC1_WGMXCCGn1
    SolutionIndex: 138
    SolutionNameMin: Cijk_Ailk_Bjlk_F8NSS_BH_Bias_HAS_SAV_UserArgs_MT64x64x256_MI16x16x1_SN_LDSB1_CLR1_GRVWA16_GRVWB16_GSU0_GSUC0_GSUWGMRR0_K1_LBSPPA512_LBSPPB512_LPA32_LPB32_MIWT2_2_PLR1_SU0_SUM0_SUS256_VWA2_VWB2_WGM6_WGMXCC1_WGMXCCGn1
    SolutionIndex: 139
    SolutionNameMin: Cijk_Ailk_Bjlk_F8NSS_BH_Bias_HAS_SAV_UserArgs_MT64x32x256_MI16x16x1_SN_LDSB1_CLR1_GRVWA16_GRVWB16_GSU0_GSUC0_GSUWGMRR0_K1_LBSPPA512_LBSPPB256_LPA32_LPB16_MIWT2_1_PLR1_SU0_SUM0_SUS256_VWA2_VWB1_WGM1_WGMXCC1_WGMXCCGn1
    SolutionIndex: 140
    SolutionNameMin: Cijk_Ailk_Bjlk_F8NSS_BH_Bias_HAS_SAV_UserArgs_MT64x32x256_MI16x16x1_SN_LDSB1_CLR1_GRVWA16_GRVWB16_GSU0_GSUC0_GSUWGMRR0_K1_LBSPPA512_LBSPPB256_LPA32_LPB16_MIWT2_1_PLR1_SU0_SUM0_SUS256_VWA2_VWB1_WGM6_WGMXCC1_WGMXCCGn1
    SolutionIndex: 141
    SolutionNameMin: Cijk_Ailk_Bjlk_F8NSS_BH_Bias_HAS_SAV_UserArgs_MT32x32x256_MI16x16x1_SN_LDSB1_CLR1_GRVWA8_GRVWB16_GSU0_GSUC0_GSUWGMRR0_K1_LBSPPA256_LBSPPB256_LPA16_LPB16_MIWT1_1_PLR1_SU0_SUM0_SUS256_VWA1_VWB1_WGM1_WGMXCC1_WGMXCCGn1
    SolutionIndex: 142
    SolutionNameMin: Cijk_Ailk_Bjlk_F8NSS_BH_Bias_HAS_SAV_UserArgs_MT32x32x256_MI16x16x1_SN_LDSB1_CLR1_GRVWA16_GRVWB16_GSU0_GSUC0_GSUWGMRR0_K1_LBSPPA256_LBSPPB256_LPA16_LPB16_MIWT1_1_PLR1_SU0_SUM0_SUS256_VWA1_VWB1_WGM1_WGMXCC1_WGMXCCGn1
    SolutionIndex: 143
    SolutionNameMin: Cijk_Ailk_Bjlk_F8NSS_BH_Bias_HAS_SAV_UserArgs_MT32x32x256_MI16x16x1_SN_LDSB1_CLR1_GRVWA16_GRVWB16_GSU0_GSUC0_GSUWGMRR0_K1_LBSPPA256_LBSPPB256_LPA16_LPB16_MIWT1_1_PLR1_SU0_SUM0_SUS256_VWA1_VWB1_WGM6_WGMXCC1_WGMXCCGn1
    SolutionIndex: 144
    SolutionNameMin: Cijk_Ailk_Bjlk_F8NSS_BH_Bias_HAS_SAV_UserArgs_MT32x32x256_MI16x16x1_SN_LDSB1_CLR1_GRVWA16_GRVWB16_GSU0_GSUC0_GSUWGMRR0_K1_LBSPPA256_LBSPPB256_LPA16_LPB16_MIWT1_1_PLR1_SU0_SUM0_SUS256_VWA1_VWB1_WGM8_WGMXCC1_WGMXCCGn1
- - - [128, 128, 1, 128, 128, 128, 128, 128]
    - [127, 0.51]
  - - [128, 128, 1, 256, 128, 128, 128, 128]
    - [83, 0.89]
  - - [128, 128, 1, 512, 128, 128, 128, 128]
    - [130, 1.45]
  - - [128, 128, 1, 1024, 128, 128, 128, 128]
    - [130, 2.18]
  - - [128, 128, 1, 2048, 128, 128, 128, 128]
    - [131, 2.91]
  - - [128, 128, 1, 4096, 128, 128, 128, 128]
    - [142, 3.52]
  - - [128, 128, 1, 8192, 128, 128, 128, 128]
    - [142, 3.94]
  - - [128, 256, 1, 128, 128, 128, 128, 256]
    - [88, 1.0]
  - - [128, 256, 1, 256, 128, 128, 128, 256]
    - [84, 1.77]
  - - [128, 256, 1, 512, 128, 128, 128, 256]
    - [130, 2.95]
  - - [128, 256, 1, 1024, 128, 128, 128, 256]
    - [131, 4.45]
  - - [128, 256, 1, 2048, 128, 128, 128, 256]
    - [131, 5.88]
  - - [128, 256, 1, 4096, 128, 128, 128, 256]
    - [131, 7.07]
  - - [128, 256, 1, 8192, 128, 128, 128, 256]
    - [142, 7.88]
  - - [128, 512, 1, 128, 128, 128, 128, 512]
    - [85, 2.01]
  - - [128, 512, 1, 256, 128, 128, 128, 512]
    - [83, 3.59]
  - - [128, 512, 1, 512, 128, 128, 128, 512]
    - [127, 5.94]
  - - [128, 512, 1, 1024, 128, 128, 128, 512]
    - [131, 8.77]
  - - [128, 512, 1, 2048, 128, 128, 128, 512]
    - [131, 11.53]
  - - [128, 512, 1, 4096, 128, 128, 128, 512]
    - [131, 13.92]
  - - [128, 512, 1, 8192, 128, 128, 128, 512]
    - [142, 15.01]
  - - [128, 1024, 1, 128, 128, 128, 128, 1024]
    - [83, 3.89]
  - - [128, 1024, 1, 256, 128, 128, 128, 1024]
    - [83, 6.93]
  - - [128, 1024, 1, 512, 128, 128, 128, 1024]
    - [127, 11.19]
  - - [128, 1024, 1, 1024, 128, 128, 128, 1024]
    - [130, 16.83]
  - - [128, 1024, 1, 2048, 128, 128, 128, 1024]
    - [130, 22.46]
  - - [128, 1024, 1, 4096, 128, 128, 128, 1024]
    - [141, 25.64]
  - - [128, 1024, 1, 8192, 128, 128, 128, 1024]
    - [143, 27.6]
  - - [128, 2048, 1, 128, 128, 128, 128, 2048]
    - [122, 7.16]
  - - [128, 2048, 1, 256, 128, 128, 128, 2048]
    - [78, 12.53]
  - - [128, 2048, 1, 512, 128, 128, 128, 2048]
    - [122, 20.25]
  - - [128, 2048, 1, 1024, 128, 128, 128, 2048]
    - [122, 29.58]
  - - [128, 2048, 1, 2048, 128, 128, 128, 2048]
    - [139, 38.27]
  - - [128, 2048, 1, 4096, 128, 128, 128, 2048]
    - [140, 46.53]
  - - [128, 2048, 1, 8192, 128, 128, 128, 2048]
    - [140, 52.92]
  - - [128, 4096, 1, 128, 128, 128, 128, 4096]
    - [68, 12.35]
  - - [128, 4096, 1, 256, 128, 128, 128, 4096]
    - [68, 21.54]
  - - [128, 4096, 1, 512, 128, 128, 128, 4096]
    - [106, 34.43]
  - - [128, 4096, 1, 1024, 128, 128, 128, 4096]
    - [108, 50.81]
  - - [128, 4096, 1, 2048, 128, 128, 128, 4096]
    - [136, 64.89]
  - - [128, 4096, 1, 4096, 128, 128, 128, 4096]
    - [136, 79.85]
  - - [128, 4096, 1, 8192, 128, 128, 128, 4096]
    - [137, 89.69]
  - - [128, 8192, 1, 128, 128, 128, 128, 8192]
    - [61, 20.14]
  - - [128, 8192, 1, 256, 128, 128, 128, 8192]
    - [61, 35.16]
  - - [128, 8192, 1, 512, 128, 128, 128, 8192]
    - [61, 56.04]
  - - [128, 8192, 1, 1024, 128, 128, 128, 8192]
    - [101, 80.9]
  - - [128, 8192, 1, 2048, 128, 128, 128, 8192]
    - [101, 100.76]
  - - [128, 8192, 1, 4096, 128, 128, 128, 8192]
    - [134, 120.94]
  - - [128, 8192, 1, 8192, 128, 128, 128, 8192]
    - [133, 126.87]
  - - [256, 128, 1, 128, 256, 256, 256, 128]
    - [86, 1.01]
  - - [256, 128, 1, 256, 256, 256, 256, 128]
    - [84, 1.82]
  - - [256, 128, 1, 512, 256, 256, 256, 128]
    - [87, 2.57]
  - - [256, 128, 1, 1024, 256, 256, 256, 128]
    - [132, 4.22]
  - - [256, 128, 1, 2048, 256, 256, 256, 128]
    - [131, 5.9]
  - - [256, 128, 1, 4096, 256, 256, 256, 128]
    - [131, 7.03]
  - - [256, 128, 1, 8192, 256, 256, 256, 128]
    - [142, 7.88]
  - - [256, 256, 1, 128, 256, 256, 256, 256]
    - [80, 1.3]
  - - [256, 256, 1, 256, 256, 256, 256, 256]
    - [76, 3.07]
  - - [256, 256, 1, 512, 256, 256, 256, 256]
    - [84, 5.62]
  - - [256, 256, 1, 1024, 256, 256, 256, 256]
    - [127, 8.44]
  - - [256, 256, 1, 2048, 256, 256, 256, 256]
    - [131, 11.52]
  - - [256, 256, 1, 4096, 256, 256, 256, 256]
    - [131, 13.92]
  - - [256, 256, 1, 8192, 256, 256, 256, 256]
    - [131, 15.46]
  - - [256, 512, 1, 128, 256, 256, 256, 512]
    - [82, 3.01]
  - - [256, 512, 1, 256, 256, 256, 256, 512]
    - [79, 6.19]
  - - [256, 512, 1, 512, 256, 256, 256, 512]
    - [85, 11.05]
  - - [256, 512, 1, 1024, 256, 256, 256, 512]
    - [127, 16.63]
  - - [256, 512, 1, 2048, 256, 256, 256, 512]
    - [131, 22.34]
  - - [256, 512, 1, 4096, 256, 256, 256, 512]
    - [131, 27.21]
  - - [256, 512, 1, 8192, 256, 256, 256, 512]
    - [141, 29.66]
  - - [256, 1024, 1, 128, 256, 256, 256, 1024]
    - [75, 5.21]
  - - [256, 1024, 1, 256, 256, 256, 256, 1024]
    - [81, 10.27]
  - - [256, 1024, 1, 512, 256, 256, 256, 1024]
    - [77, 18.69]
  - - [256, 1024, 1, 1024, 256, 256, 256, 1024]
    - [126, 29.34]
  - - [256, 1024, 1, 2048, 256, 256, 256, 1024]
    - [139, 39.63]
  - - [256, 1024, 1, 4096, 256, 256, 256, 1024]
    - [139, 47.53]
  - - [256, 1024, 1, 8192, 256, 256, 256, 1024]
    - [140, 53.1]
  - - [256, 2048, 1, 128, 256, 256, 256, 2048]
    - [73, 10.64]
  - - [256, 2048, 1, 256, 256, 256, 256, 2048]
    - [69, 20.22]
  - - [256, 2048, 1, 512, 256, 256, 256, 2048]
    - [109, 33.77]
  - - [256, 2048, 1, 1024, 256, 256, 256, 2048]
    - [107, 50.15]
  - - [256, 2048, 1, 2048, 256, 256, 256, 2048]
    - [108, 64.93]
  - - [256, 2048, 1, 4096, 256, 256, 256, 2048]
    - [108, 77.38]
  - - [256, 2048, 1, 8192, 256, 256, 256, 2048]
    - [138, 86.02]
  - - [256, 4096, 1, 128, 256, 256, 256, 4096]
    - [104, 19.77]
  - - [256, 4096, 1, 256, 256, 256, 256, 4096]
    - [67, 35.09]
  - - [256, 4096, 1, 512, 256, 256, 256, 4096]
    - [58, 55.85]
  - - [256, 4096, 1, 1024, 256, 256, 256, 4096]
    - [59, 81.1]
  - - [256, 4096, 1, 2048, 256, 256, 256, 4096]
    - [101, 102.51]
  - - [256, 4096, 1, 4096, 256, 256, 256, 4096]
    - [101, 121.78]
  - - [256, 4096, 1, 8192, 256, 256, 256, 4096]
    - [135, 129.36]
  - - [256, 8192, 1, 128, 256, 256, 256, 8192]
    - [43, 29.5]
  - - [256, 8192, 1, 256, 256, 256, 256, 8192]
    - [43, 51.68]
  - - [256, 8192, 1, 512, 256, 256, 256, 8192]
    - [46, 81.33]
  - - [256, 8192, 1, 1024, 256, 256, 256, 8192]
    - [46, 116.27]
  - - [256, 8192, 1, 2048, 256, 256, 256, 8192]
    - [45, 145.69]
  - - [256, 8192, 1, 4096, 256, 256, 256, 8192]
    - [99, 167.87]
  - - [256, 8192, 1, 8192, 256, 256, 256, 8192]
    - [100, 163.03]
  - - [512, 128, 1, 128, 512, 512, 512, 128]
    - [83, 2.06]
  - - [512, 128, 1, 256, 512, 512, 512, 128]
    - [128, 3.61]
  - - [512, 128, 1, 512, 512, 512, 512, 128]
    - [127, 5.92]
  - - [512, 128, 1, 1024, 512, 512, 512, 128]
    - [131, 8.78]
  - - [512, 128, 1, 2048, 512, 512, 512, 128]
    - [131, 11.7]
  - - [512, 128, 1, 4096, 512, 512, 512, 128]
    - [131, 13.98]
  - - [512, 128, 1, 8192, 512, 512, 512, 128]
    - [143, 15.1]
  - - [512, 256, 1, 128, 512, 512, 512, 256]
    - [85, 3.94]
  - - [512, 256, 1, 256, 512, 512, 512, 256]
    - [83, 7.07]
  - - [512, 256, 1, 512, 512, 512, 512, 256]
    - [129, 11.4]
  - - [512, 256, 1, 1024, 512, 512, 512, 256]
    - [130, 17.05]
  - - [512, 256, 1, 2048, 512, 512, 512, 256]
    - [131, 22.77]
  - - [512, 256, 1, 4096, 512, 512, 512, 256]
    - [131, 27.29]
  - - [512, 256, 1, 8192, 512, 512, 512, 256]
    - [143, 27.82]
  - - [512, 512, 1, 128, 512, 512, 512, 512]
    - [78, 7.04]
  - - [512, 512, 1, 256, 512, 512, 512, 512]
    - [78, 12.23]
  - - [512, 512, 1, 512, 512, 512, 512, 512]
    - [123, 20.04]
  - - [512, 512, 1, 1024, 512, 512, 512, 512]
    - [125, 29.7]
  - - [512, 512, 1, 2048, 512, 512, 512, 512]
    - [139, 39.8]
  - - [512, 512, 1, 4096, 512, 512, 512, 512]
    - [118, 45.99]
  - - [512, 512, 1, 8192, 512, 512, 512, 512]
    - [126, 50.11]
  - - [512, 1024, 1, 128, 512, 512, 512, 1024]
    - [71, 12.22]
  - - [512, 1024, 1, 256, 512, 512, 512, 1024]
    - [70, 21.12]
  - - [512, 1024, 1, 512, 512, 512, 512, 1024]
    - [106, 34.36]
  - - [512, 1024, 1, 1024, 512, 512, 512, 1024]
    - [108, 50.47]
  - - [512, 1024, 1, 2048, 512, 512, 512, 1024]
    - [107, 66.81]
  - - [512, 1024, 1, 4096, 512, 512, 512, 1024]
    - [113, 74.47]
  - - [512, 1024, 1, 8192, 512, 512, 512, 1024]
    - [111, 80.23]
  - - [512, 2048, 1, 128, 512, 512, 512, 2048]
    - [56, 19.79]
  - - [512, 2048, 1, 256, 512, 512, 512, 2048]
    - [66, 34.78]
  - - [512, 2048, 1, 512, 512, 512, 512, 2048]
    - [59, 55.03]
  - - [512, 2048, 1, 1024, 512, 512, 512, 2048]
    - [101, 80.61]
  - - [512, 2048, 1, 2048, 512, 512, 512, 2048]
    - [101, 102.07]
  - - [512, 2048, 1, 4096, 512, 512, 512, 2048]
    - [101, 121.48]
  - - [512, 2048, 1, 8192, 512, 512, 512, 2048]
    - [103, 125.43]
  - - [512, 4096, 1, 128, 512, 512, 512, 4096]
    - [52, 30.03]
  - - [512, 4096, 1, 256, 512, 512, 512, 4096]
    - [52, 52.68]
  - - [512, 4096, 1, 512, 512, 512, 512, 4096]
    - [53, 81.89]
  - - [512, 4096, 1, 1024, 512, 512, 512, 4096]
    - [46, 116.83]
  - - [512, 4096, 1, 2048, 512, 512, 512, 4096]
    - [45, 148.78]
  - - [512, 4096, 1, 4096, 512, 512, 512, 4096]
    - [45, 167.5]
  - - [512, 4096, 1, 8192, 512, 512, 512, 4096]
    - [45, 162.97]
  - - [512, 8192, 1, 128, 512, 512, 512, 8192]
    - [17, 38.34]
  - - [512, 8192, 1, 256, 512, 512, 512, 8192]
    - [17, 66.07]
  - - [512, 8192, 1, 512, 512, 512, 512, 8192]
    - [13, 105.77]
  - - [512, 8192, 1, 1024, 512, 512, 512, 8192]
    - [13, 151.67]
  - - [512, 8192, 1, 2048, 512, 512, 512, 8192]
    - [13, 195.61]
  - - [512, 8192, 1, 4096, 512, 512, 512, 8192]
    - [95, 211.52]
  - - [512, 8192, 1, 8192, 512, 512, 512, 8192]
    - [14, 208.8]
  - - [1024, 128, 1, 128, 1024, 1024, 1024, 128]
    - [83, 3.94]
  - - [1024, 128, 1, 256, 1024, 1024, 1024, 128]
    - [85, 6.91]
  - - [1024, 128, 1, 512, 1024, 1024, 1024, 128]
    - [130, 11.29]
  - - [1024, 128, 1, 1024, 1024, 1024, 1024, 128]
    - [131, 16.91]
  - - [1024, 128, 1, 2048, 1024, 1024, 1024, 128]
    - [131, 22.79]
  - - [1024, 128, 1, 4096, 1024, 1024, 1024, 128]
    - [143, 25.34]
  - - [1024, 128, 1, 8192, 1024, 1024, 1024, 128]
    - [144, 26.63]
  - - [1024, 256, 1, 128, 1024, 1024, 1024, 256]
    - [78, 7.14]
  - - [1024, 256, 1, 256, 1024, 1024, 1024, 256]
    - [78, 12.47]
  - - [1024, 256, 1, 512, 1024, 1024, 1024, 256]
    - [124, 20.14]
  - - [1024, 256, 1, 1024, 1024, 1024, 1024, 256]
    - [126, 29.79]
  - - [1024, 256, 1, 2048, 1024, 1024, 1024, 256]
    - [139, 39.95]
  - - [1024, 256, 1, 4096, 1024, 1024, 1024, 256]
    - [119, 45.79]
  - - [1024, 256, 1, 8192, 1024, 1024, 1024, 256]
    - [140, 49.05]
  - - [1024, 512, 1, 128, 1024, 1024, 1024, 512]
    - [73, 12.16]
  - - [1024, 512, 1, 256, 1024, 1024, 1024, 512]
    - [73, 21.2]
  - - [1024, 512, 1, 512, 1024, 1024, 1024, 512]
    - [112, 34.11]
  - - [1024, 512, 1, 1024, 1024, 1024, 1024, 512]
    - [109, 50.58]
  - - [1024, 512, 1, 2048, 1024, 1024, 1024, 512]
    - [109, 66.78]
  - - [1024, 512, 1, 4096, 1024, 1024, 1024, 512]
    - [114, 74.27]
  - - [1024, 512, 1, 8192, 1024, 1024, 1024, 512]
    - [113, 81.4]
  - - [1024, 1024, 1, 128, 1024, 1024, 1024, 1024]
    - [64, 19.85]
  - - [1024, 1024, 1, 256, 1024, 1024, 1024, 1024]
    - [64, 34.81]
  - - [1024, 1024, 1, 512, 1024, 1024, 1024, 1024]
    - [57, 56.06]
  - - [1024, 1024, 1, 1024, 1024, 1024, 1024, 1024]
    - [59, 80.4]
  - - [1024, 1024, 1, 2048, 1024, 1024, 1024, 1024]
    - [103, 101.98]
  - - [1024, 1024, 1, 4096, 1024, 1024, 1024, 1024]
    - [103, 118.67]
  - - [1024, 1024, 1, 8192, 1024, 1024, 1024, 1024]
    - [101, 125.58]
  - - [1024, 2048, 1, 128, 1024, 1024, 1024, 2048]
    - [43, 29.87]
  - - [1024, 2048, 1, 256, 1024, 1024, 1024, 2048]
    - [44, 52.35]
  - - [1024, 2048, 1, 512, 1024, 1024, 1024, 2048]
    - [46, 82.57]
  - - [1024, 2048, 1, 1024, 1024, 1024, 1024, 2048]
    - [46, 117.09]
  - - [1024, 2048, 1, 2048, 1024, 1024, 1024, 2048]
    - [46, 148.59]
  - - [1024, 2048, 1, 4096, 1024, 1024, 1024, 2048]
    - [45, 167.2]
  - - [1024, 2048, 1, 8192, 1024, 1024, 1024, 2048]
    - [55, 163.09]
  - - [1024, 4096, 1, 128, 1024, 1024, 1024, 4096]
    - [13, 37.43]
  - - [1024, 4096, 1, 256, 1024, 1024, 1024, 4096]
    - [17, 66.67]
  - - [1024, 4096, 1, 512, 1024, 1024, 1024, 4096]
    - [17, 106.11]
  - - [1024, 4096, 1, 1024, 1024, 1024, 1024, 4096]
    - [12, 151.24]
  - - [1024, 4096, 1, 2048, 1024, 1024, 1024, 4096]
    - [14, 195.03]
  - - [1024, 4096, 1, 4096, 1024, 1024, 1024, 4096]
    - [14, 211.74]
  - - [1024, 4096, 1, 8192, 1024, 1024, 1024, 4096]
    - [92, 211.17]
  - - [1024, 8192, 1, 128, 1024, 1024, 1024, 8192]
    - [26, 41.63]
  - - [1024, 8192, 1, 256, 1024, 1024, 1024, 8192]
    - [25, 74.56]
  - - [1024, 8192, 1, 512, 1024, 1024, 1024, 8192]
    - [29, 118.79]
  - - [1024, 8192, 1, 1024, 1024, 1024, 1024, 8192]
    - [28, 166.19]
  - - [1024, 8192, 1, 2048, 1024, 1024, 1024, 8192]
    - [6, 203.87]
  - - [1024, 8192, 1, 4096, 1024, 1024, 1024, 8192]
    - [97, 231.07]
  - - [1024, 8192, 1, 8192, 1024, 1024, 1024, 8192]
    - [96, 249.84]
  - - [2048, 128, 1, 128, 2048, 2048, 2048, 128]
    - [78, 7.27]
  - - [2048, 128, 1, 256, 2048, 2048, 2048, 128]
    - [74, 12.66]
  - - [2048, 128, 1, 512, 2048, 2048, 2048, 128]
    - [123, 20.49]
  - - [2048, 128, 1, 1024, 2048, 2048, 2048, 128]
    - [117, 30.28]
  - - [2048, 128, 1, 2048, 2048, 2048, 2048, 128]
    - [118, 37.48]
  - - [2048, 128, 1, 4096, 2048, 2048, 2048, 128]
    - [121, 45.07]
  - - [2048, 128, 1, 8192, 2048, 2048, 2048, 128]
    - [120, 50.29]
  - - [2048, 256, 1, 128, 2048, 2048, 2048, 256]
    - [71, 12.9]
  - - [2048, 256, 1, 256, 2048, 2048, 2048, 256]
    - [71, 22.24]
  - - [2048, 256, 1, 512, 2048, 2048, 2048, 256]
    - [72, 35.4]
  - - [2048, 256, 1, 1024, 2048, 2048, 2048, 256]
    - [107, 52.0]
  - - [2048, 256, 1, 2048, 2048, 2048, 2048, 256]
    - [115, 65.56]
  - - [2048, 256, 1, 4096, 2048, 2048, 2048, 256]
    - [111, 76.92]
  - - [2048, 256, 1, 8192, 2048, 2048, 2048, 256]
    - [114, 84.87]
  - - [2048, 512, 1, 128, 2048, 2048, 2048, 512]
    - [61, 20.66]
  - - [2048, 512, 1, 256, 2048, 2048, 2048, 512]
    - [61, 36.01]
  - - [2048, 512, 1, 512, 2048, 2048, 2048, 512]
    - [61, 57.12]
  - - [2048, 512, 1, 1024, 2048, 2048, 2048, 512]
    - [101, 80.39]
  - - [2048, 512, 1, 2048, 2048, 2048, 2048, 512]
    - [105, 101.91]
  - - [2048, 512, 1, 4096, 2048, 2048, 2048, 512]
    - [103, 120.65]
  - - [2048, 512, 1, 8192, 2048, 2048, 2048, 512]
    - [102, 125.68]
  - - [2048, 1024, 1, 128, 2048, 2048, 2048, 1024]
    - [55, 29.97]
  - - [2048, 1024, 1, 256, 2048, 2048, 2048, 1024]
    - [52, 52.87]
  - - [2048, 1024, 1, 512, 2048, 2048, 2048, 1024]
    - [52, 82.73]
  - - [2048, 1024, 1, 1024, 2048, 2048, 2048, 1024]
    - [55, 117.91]
  - - [2048, 1024, 1, 2048, 2048, 2048, 2048, 1024]
    - [54, 148.0]
  - - [2048, 1024, 1, 4096, 2048, 2048, 2048, 1024]
    - [47, 165.58]
  - - [2048, 1024, 1, 8192, 2048, 2048, 2048, 1024]
    - [48, 161.62]
  - - [2048, 2048, 1, 128, 2048, 2048, 2048, 2048]
    - [10, 35.78]
  - - [2048, 2048, 1, 256, 2048, 2048, 2048, 2048]
    - [10, 63.46]
  - - [2048, 2048, 1, 512, 2048, 2048, 2048, 2048]
    - [14, 102.06]
  - - [2048, 2048, 1, 1024, 2048, 2048, 2048, 2048]
    - [15, 148.35]
  - - [2048, 2048, 1, 2048, 2048, 2048, 2048, 2048]
    - [22, 192.49]
  - - [2048, 2048, 1, 4096, 2048, 2048, 2048, 2048]
    - [95, 210.16]
  - - [2048, 2048, 1, 8192, 2048, 2048, 2048, 2048]
    - [98, 207.94]
  - - [2048, 4096, 1, 128, 2048, 2048, 2048, 4096]
    - [21, 37.89]
  - - [2048, 4096, 1, 256, 2048, 2048, 2048, 4096]
    - [20, 67.41]
  - - [2048, 4096, 1, 512, 2048, 2048, 2048, 4096]
    - [22, 109.89]
  - - [2048, 4096, 1, 1024, 2048, 2048, 2048, 4096]
    - [2, 163.15]
  - - [2048, 4096, 1, 2048, 2048, 2048, 2048, 4096]
    - [2, 202.48]
  - - [2048, 4096, 1, 4096, 2048, 2048, 2048, 4096]
    - [2, 225.23]
  - - [2048, 4096, 1, 8192, 2048, 2048, 2048, 4096]
    - [23, 250.96]
  - - [2048, 8192, 1, 128, 2048, 2048, 2048, 8192]
    - [30, 46.06]
  - - [2048, 8192, 1, 256, 2048, 2048, 2048, 8192]
    - [32, 79.6]
  - - [2048, 8192, 1, 512, 2048, 2048, 2048, 8192]
    - [27, 124.56]
  - - [2048, 8192, 1, 1024, 2048, 2048, 2048, 8192]
    - [33, 167.08]
  - - [2048, 8192, 1, 2048, 2048, 2048, 2048, 8192]
    - [14, 206.81]
  - - [2048, 8192, 1, 4096, 2048, 2048, 2048, 8192]
    - [93, 258.53]
  - - [2048, 8192, 1, 8192, 2048, 2048, 2048, 8192]
    - [7, 310.75]
  - - [4096, 128, 1, 128, 4096, 4096, 4096, 128]
    - [68, 12.74]
  - - [4096, 128, 1, 256, 4096, 4096, 4096, 128]
    - [68, 21.79]
  - - [4096, 128, 1, 512, 4096, 4096, 4096, 128]
    - [109, 34.33]
  - - [4096, 128, 1, 1024, 4096, 4096, 4096, 128]
    - [107, 50.73]
  - - [4096, 128, 1, 2048, 4096, 4096, 4096, 128]
    - [113, 63.89]
  - - [4096, 128, 1, 4096, 4096, 4096, 4096, 128]
    - [110, 76.63]
  - - [4096, 128, 1, 8192, 4096, 4096, 4096, 128]
    - [116, 84.04]
  - - [4096, 256, 1, 128, 4096, 4096, 4096, 256]
    - [61, 20.52]
  - - [4096, 256, 1, 256, 4096, 4096, 4096, 256]
    - [60, 35.01]
  - - [4096, 256, 1, 512, 4096, 4096, 4096, 256]
    - [61, 56.13]
  - - [4096, 256, 1, 1024, 4096, 4096, 4096, 256]
    - [59, 79.34]
  - - [4096, 256, 1, 2048, 4096, 4096, 4096, 256]
    - [103, 102.62]
  - - [4096, 256, 1, 4096, 4096, 4096, 4096, 256]
    - [103, 121.38]
  - - [4096, 256, 1, 8192, 4096, 4096, 4096, 256]
    - [105, 129.01]
  - - [4096, 512, 1, 128, 4096, 4096, 4096, 512]
    - [41, 28.85]
  - - [4096, 512, 1, 256, 4096, 4096, 4096, 512]
    - [41, 50.1]
  - - [4096, 512, 1, 512, 4096, 4096, 4096, 512]
    - [49, 79.3]
  - - [4096, 512, 1, 1024, 4096, 4096, 4096, 512]
    - [55, 112.43]
  - - [4096, 512, 1, 2048, 4096, 4096, 4096, 512]
    - [50, 143.35]
  - - [4096, 512, 1, 4096, 4096, 4096, 4096, 512]
    - [54, 165.19]
  - - [4096, 512, 1, 8192, 4096, 4096, 4096, 512]
    - [50, 161.19]
  - - [4096, 1024, 1, 128, 4096, 4096, 4096, 1024]
    - [16, 35.0]
  - - [4096, 1024, 1, 256, 4096, 4096, 4096, 1024]
    - [20, 61.88]
  - - [4096, 1024, 1, 512, 4096, 4096, 4096, 1024]
    - [24, 100.95]
  - - [4096, 1024, 1, 1024, 4096, 4096, 4096, 1024]
    - [96, 148.13]
  - - [4096, 1024, 1, 2048, 4096, 4096, 4096, 1024]
    - [22, 193.85]
  - - [4096, 1024, 1, 4096, 4096, 4096, 4096, 1024]
    - [97, 210.24]
  - - [4096, 1024, 1, 8192, 4096, 4096, 4096, 1024]
    - [95, 210.28]
  - - [4096, 2048, 1, 128, 4096, 4096, 4096, 2048]
    - [13, 35.63]
  - - [4096, 2048, 1, 256, 4096, 4096, 4096, 2048]
    - [13, 63.83]
  - - [4096, 2048, 1, 512, 4096, 4096, 4096, 2048]
    - [14, 104.96]
  - - [4096, 2048, 1, 1024, 4096, 4096, 4096, 2048]
    - [3, 152.47]
  - - [4096, 2048, 1, 2048, 4096, 4096, 4096, 2048]
    - [9, 197.14]
  - - [4096, 2048, 1, 4096, 4096, 4096, 4096, 2048]
    - [13, 224.73]
  - - [4096, 2048, 1, 8192, 4096, 4096, 4096, 2048]
    - [15, 252.52]
  - - [4096, 4096, 1, 128, 4096, 4096, 4096, 4096]
    - [12, 39.23]
  - - [4096, 4096, 1, 256, 4096, 4096, 4096, 4096]
    - [13, 69.05]
  - - [4096, 4096, 1, 512, 4096, 4096, 4096, 4096]
    - [42, 114.87]
  - - [4096, 4096, 1, 1024, 4096, 4096, 4096, 4096]
    - [5, 150.93]
  - - [4096, 4096, 1, 2048, 4096, 4096, 4096, 4096]
    - [15, 208.0]
  - - [4096, 4096, 1, 4096, 4096, 4096, 4096, 4096]
    - [92, 252.55]
  - - [4096, 4096, 1, 8192, 4096, 4096, 4096, 4096]
    - [89, 308.85]
  - - [4096, 8192, 1, 128, 4096, 4096, 4096, 8192]
    - [29, 45.85]
  - - [4096, 8192, 1, 256, 4096, 4096, 4096, 8192]
    - [34, 75.42]
  - - [4096, 8192, 1, 512, 4096, 4096, 4096, 8192]
    - [21, 115.54]
  - - [4096, 8192, 1, 1024, 4096, 4096, 4096, 8192]
    - [13, 166.63]
  - - [4096, 8192, 1, 2048, 4096, 4096, 4096, 8192]
    - [96, 220.91]
  - - [4096, 8192, 1, 4096, 4096, 4096, 4096, 8192]
    - [90, 273.15]
  - - [4096, 8192, 1, 8192, 4096, 4096, 4096, 8192]
    - [4, 331.19]
  - - [8192, 128, 1, 128, 8192, 8192, 8192, 128]
    - [63, 19.51]
  - - [8192, 128, 1, 256, 8192, 8192, 8192, 128]
    - [65, 34.23]
  - - [8192, 128, 1, 512, 8192, 8192, 8192, 128]
    - [62, 54.64]
  - - [8192, 128, 1, 1024, 8192, 8192, 8192, 128]
    - [59, 79.01]
  - - [8192, 128, 1, 2048, 8192, 8192, 8192, 128]
    - [103, 99.91]
  - - [8192, 128, 1, 4096, 8192, 8192, 8192, 128]
    - [103, 120.08]
  - - [8192, 128, 1, 8192, 8192, 8192, 8192, 128]
    - [103, 121.93]
  - - [8192, 256, 1, 128, 8192, 8192, 8192, 256]
    - [41, 28.72]
  - - [8192, 256, 1, 256, 8192, 8192, 8192, 256]
    - [41, 50.68]
  - - [8192, 256, 1, 512, 8192, 8192, 8192, 256]
    - [43, 79.83]
  - - [8192, 256, 1, 1024, 8192, 8192, 8192, 256]
    - [55, 113.07]
  - - [8192, 256, 1, 2048, 8192, 8192, 8192, 256]
    - [50, 143.89]
  - - [8192, 256, 1, 4096, 8192, 8192, 8192, 256]
    - [47, 164.66]
  - - [8192, 256, 1, 8192, 8192, 8192, 8192, 256]
    - [50, 160.54]
  - - [8192, 512, 1, 128, 8192, 8192, 8192, 512]
    - [40, 36.68]
  - - [8192, 512, 1, 256, 8192, 8192, 8192, 512]
    - [17, 63.25]
  - - [8192, 512, 1, 512, 8192, 8192, 8192, 512]
    - [21, 102.98]
  - - [8192, 512, 1, 1024, 8192, 8192, 8192, 512]
    - [23, 150.19]
  - - [8192, 512, 1, 2048, 8192, 8192, 8192, 512]
    - [19, 195.02]
  - - [8192, 512, 1, 4096, 8192, 8192, 8192, 512]
    - [18, 209.9]
  - - [8192, 512, 1, 8192, 8192, 8192, 8192, 512]
    - [98, 211.59]
  - - [8192, 1024, 1, 128, 8192, 8192, 8192, 1024]
    - [35, 40.0]
  - - [8192, 1024, 1, 256, 8192, 8192, 8192, 1024]
    - [35, 71.71]
  - - [8192, 1024, 1, 512, 8192, 8192, 8192, 1024]
    - [35, 115.13]
  - - [8192, 1024, 1, 1024, 8192, 8192, 8192, 1024]
    - [39, 165.87]
  - - [8192, 1024, 1, 2048, 8192, 8192, 8192, 1024]
    - [12, 202.34]
  - - [8192, 1024, 1, 4096, 8192, 8192, 8192, 1024]
    - [14, 230.41]
  - - [8192, 1024, 1, 8192, 8192, 8192, 8192, 1024]
    - [92, 271.29]
  - - [8192, 2048, 1, 128, 8192, 8192, 8192, 2048]
    - [37, 44.86]
  - - [8192, 2048, 1, 256, 8192, 8192, 8192, 2048]
    - [39, 77.74]
  - - [8192, 2048, 1, 512, 8192, 8192, 8192, 2048]
    - [37, 123.2]
  - - [8192, 2048, 1, 1024, 8192, 8192, 8192, 2048]
    - [38, 166.19]
  - - [8192, 2048, 1, 2048, 8192, 8192, 8192, 2048]
    - [22, 208.02]
  - - [8192, 2048, 1, 4096, 8192, 8192, 8192, 2048]
    - [7, 258.86]
  - - [8192, 2048, 1, 8192, 8192, 8192, 8192, 2048]
    - [2, 314.09]
  - - [8192, 4096, 1, 128, 8192, 8192, 8192, 4096]
    - [36, 42.98]
  - - [8192, 4096, 1, 256, 8192, 8192, 8192, 4096]
    - [51, 72.73]
  - - [8192, 4096, 1, 512, 8192, 8192, 8192, 4096]
    - [11, 118.68]
  - - [8192, 4096, 1, 1024, 8192, 8192, 8192, 4096]
    - [14, 169.3]
  - - [8192, 4096, 1, 2048, 8192, 8192, 8192, 4096]
    - [94, 218.86]
  - - [8192, 4096, 1, 4096, 8192, 8192, 8192, 4096]
    - [0, 286.97]
  - - [8192, 4096, 1, 8192, 8192, 8192, 8192, 4096]
    - [1, 333.82]
  - - [8192, 8192, 1, 128, 8192, 8192, 8192, 8192]
    - [31, 40.43]
  - - [8192, 8192, 1, 256, 8192, 8192, 8192, 8192]
    - [13, 74.04]
  - - [8192, 8192, 1, 512, 8192, 8192, 8192, 8192]
    - [13, 118.14]
  - - [8192, 8192, 1, 1024, 8192, 8192, 8192, 8192]
    - [8, 174.73]
  - - [8192, 8192, 1, 2048, 8192, 8192, 8192, 8192]
    - [91, 249.61]
  - - [8192, 8192, 1, 4096, 8192, 8192, 8192, 8192]
    - [91, 302.28]
  - - [8192, 8192, 1, 8192, 8192, 8192, 8192, 8192]
    - [2, 318.85]
- null
- null
- ExperimentalStreamK
- GridBased
