projects/hipblaslt/library/src/amd_detail/rocblaslt/src/Tensile/Logic/asm_full/aquavanjaram/gfx942_228cu/StreamK/aquavanjaram942_Cijk_Ailk_Bjlk_B8F8NBS_BH_Bias_HAS_SAV_UserArgs.yaml
- {MinimumRequiredVersion: 4.33.0}
- aquavanjaram942
- {Architecture: gfx942, CUCount: 228}
- [Device 0049, Device 0050]
    SolutionIndex: 0
    SolutionNameMin: Cijk_Ailk_Bjlk_B8F8NBS_BH_Bias_HAS_SAV_UserArgs_MT256x256x64_MI16x16x1_SN_LDSB0_CLR1_GRVWA4_GRVWB4_GSU0_GSUC0_GSUWGMRR0_K1_LBSPPA2048_LBSPPB2048_LPA0_LPB0_MIWT8_8_PLR1_SU0_SUM0_SUS64_VWA8_VWB8_WGM1_WGMXCC1_WGMXCCGn1
    SolutionIndex: 1
    SolutionNameMin: Cijk_Ailk_Bjlk_B8F8NBS_BH_Bias_HAS_SAV_UserArgs_MT256x256x64_MI16x16x1_SN_LDSB0_CLR1_GRVWA16_GRVWB8_GSU0_GSUC0_GSUWGMRR0_K1_LBSPPA2048_LBSPPB2048_LPA0_LPB0_MIWT8_8_PLR1_SU0_SUM0_SUS64_VWA8_VWB8_WGM1_WGMXCC1_WGMXCCGn1
    SolutionIndex: 2
    SolutionNameMin: Cijk_Ailk_Bjlk_B8F8NBS_BH_Bias_HAS_SAV_UserArgs_MT256x256x64_MI16x16x1_SN_LDSB0_CLR1_GRVWA4_GRVWB16_GSU0_GSUC0_GSUWGMRR0_K1_LBSPPA2048_LBSPPB2048_LPA0_LPB0_MIWT8_8_PLR1_SU0_SUM0_SUS64_VWA8_VWB8_WGM1_WGMXCC1_WGMXCCGn1
    SolutionIndex: 3
    SolutionNameMin: Cijk_Ailk_Bjlk_B8F8NBS_BH_Bias_HAS_SAV_UserArgs_MT256x256x64_MI16x16x1_SN_LDSB0_CLR1_GRVWA8_GRVWB16_GSU0_GSUC0_GSUWGMRR0_K1_LBSPPA2048_LBSPPB2048_LPA0_LPB0_MIWT8_8_PLR1_SU0_SUM0_SUS64_VWA8_VWB8_WGM1_WGMXCC1_WGMXCCGn1
    SolutionIndex: 4
    SolutionNameMin: Cijk_Ailk_Bjlk_B8F8NBS_BH_Bias_HAS_SAV_UserArgs_MT256x256x64_MI16x16x1_SN_LDSB0_CLR1_GRVWA16_GRVWB16_GSU0_GSUC0_GSUWGMRR0_K1_LBSPPA2048_LBSPPB2048_LPA0_LPB0_MIWT8_8_PLR1_SU0_SUM0_SUS64_VWA8_VWB8_WGM1_WGMXCC1_WGMXCCGn1
    SolutionIndex: 5
    SolutionNameMin: Cijk_Ailk_Bjlk_B8F8NBS_BH_Bias_HAS_SAV_UserArgs_MT256x256x64_MI16x16x1_SN_LDSB0_CLR1_GRVWA16_GRVWB8_GSU0_GSUC0_GSUWGMRR0_K1_LBSPPA2048_LBSPPB2048_LPA0_LPB0_MIWT8_8_PLR1_SU0_SUM0_SUS64_VWA8_VWB8_WGM4_WGMXCC1_WGMXCCGn1
    SolutionIndex: 6
    SolutionNameMin: Cijk_Ailk_Bjlk_B8F8NBS_BH_Bias_HAS_SAV_UserArgs_MT256x256x64_MI16x16x1_SN_LDSB0_CLR1_GRVWA4_GRVWB16_GSU0_GSUC0_GSUWGMRR0_K1_LBSPPA2048_LBSPPB2048_LPA0_LPB0_MIWT8_8_PLR1_SU0_SUM0_SUS64_VWA8_VWB8_WGM4_WGMXCC1_WGMXCCGn1
    SolutionIndex: 7
    SolutionNameMin: Cijk_Ailk_Bjlk_B8F8NBS_BH_Bias_HAS_SAV_UserArgs_MT256x256x64_MI16x16x1_SN_LDSB0_CLR1_GRVWA8_GRVWB16_GSU0_GSUC0_GSUWGMRR0_K1_LBSPPA2048_LBSPPB2048_LPA0_LPB0_MIWT8_8_PLR1_SU0_SUM0_SUS64_VWA8_VWB8_WGM4_WGMXCC1_WGMXCCGn1
    SolutionIndex: 8
    SolutionNameMin: Cijk_Ailk_Bjlk_B8F8NBS_BH_Bias_HAS_SAV_UserArgs_MT256x256x64_MI16x16x1_SN_LDSB0_CLR1_GRVWA16_GRVWB16_GSU0_GSUC0_GSUWGMRR0_K1_LBSPPA2048_LBSPPB2048_LPA0_LPB0_MIWT8_8_PLR1_SU0_SUM0_SUS64_VWA8_VWB8_WGM4_WGMXCC1_WGMXCCGn1
    SolutionIndex: 9
    SolutionNameMin: Cijk_Ailk_Bjlk_B8F8NBS_BH_Bias_HAS_SAV_UserArgs_MT256x256x64_MI16x16x1_SN_LDSB0_CLR1_GRVWA4_GRVWB4_GSU0_GSUC0_GSUWGMRR0_K1_LBSPPA2048_LBSPPB2048_LPA0_LPB0_MIWT8_8_PLR1_SU0_SUM0_SUS64_VWA8_VWB8_WGM6_WGMXCC1_WGMXCCGn1
    SolutionIndex: 10
    SolutionNameMin: Cijk_Ailk_Bjlk_B8F8NBS_BH_Bias_HAS_SAV_UserArgs_MT256x256x64_MI16x16x1_SN_LDSB0_CLR1_GRVWA8_GRVWB4_GSU0_GSUC0_GSUWGMRR0_K1_LBSPPA2048_LBSPPB2048_LPA0_LPB0_MIWT8_8_PLR1_SU0_SUM0_SUS64_VWA8_VWB8_WGM6_WGMXCC1_WGMXCCGn1
    SolutionIndex: 11
    SolutionNameMin: Cijk_Ailk_Bjlk_B8F8NBS_BH_Bias_HAS_SAV_UserArgs_MT256x256x64_MI16x16x1_SN_LDSB0_CLR1_GRVWA4_GRVWB16_GSU0_GSUC0_GSUWGMRR0_K1_LBSPPA2048_LBSPPB2048_LPA0_LPB0_MIWT8_8_PLR1_SU0_SUM0_SUS64_VWA8_VWB8_WGM6_WGMXCC1_WGMXCCGn1
    SolutionIndex: 12
    SolutionNameMin: Cijk_Ailk_Bjlk_B8F8NBS_BH_Bias_HAS_SAV_UserArgs_MT256x256x64_MI16x16x1_SN_LDSB0_CLR1_GRVWA16_GRVWB16_GSU0_GSUC0_GSUWGMRR0_K1_LBSPPA2048_LBSPPB2048_LPA0_LPB0_MIWT8_8_PLR1_SU0_SUM0_SUS64_VWA8_VWB8_WGM6_WGMXCC1_WGMXCCGn1
    SolutionIndex: 13
    SolutionNameMin: Cijk_Ailk_Bjlk_B8F8NBS_BH_Bias_HAS_SAV_UserArgs_MT256x256x64_MI16x16x1_SN_LDSB0_CLR1_GRVWA4_GRVWB4_GSU0_GSUC0_GSUWGMRR0_K1_LBSPPA2048_LBSPPB2048_LPA0_LPB0_MIWT8_8_PLR1_SU0_SUM0_SUS64_VWA8_VWB8_WGM8_WGMXCC1_WGMXCCGn1
    SolutionIndex: 14
    SolutionNameMin: Cijk_Ailk_Bjlk_B8F8NBS_BH_Bias_HAS_SAV_UserArgs_MT256x256x64_MI16x16x1_SN_LDSB0_CLR1_GRVWA16_GRVWB16_GSU0_GSUC0_GSUWGMRR0_K1_LBSPPA2048_LBSPPB2048_LPA0_LPB0_MIWT8_8_PLR1_SU0_SUM0_SUS64_VWA8_VWB8_WGM8_WGMXCC1_WGMXCCGn1
    SolutionIndex: 15
    SolutionNameMin: Cijk_Ailk_Bjlk_B8F8NBS_BH_Bias_HAS_SAV_UserArgs_MT128x256x64_MI16x16x1_SN_LDSB1_CLR1_GRVWA16_GRVWB8_GSU0_GSUC0_GSUWGMRR0_K1_LBSPPA1024_LBSPPB2048_LPA64_LPB0_MIWT4_8_PLR1_SU0_SUM0_SUS64_VWA4_VWB8_WGM1_WGMXCC1_WGMXCCGn1
    SolutionIndex: 16
    SolutionNameMin: Cijk_Ailk_Bjlk_B8F8NBS_BH_Bias_HAS_SAV_UserArgs_MT128x256x64_MI16x16x1_SN_LDSB1_CLR1_GRVWA4_GRVWB16_GSU0_GSUC0_GSUWGMRR0_K1_LBSPPA1024_LBSPPB2048_LPA64_LPB0_MIWT4_8_PLR1_SU0_SUM0_SUS64_VWA4_VWB8_WGM1_WGMXCC1_WGMXCCGn1
    SolutionIndex: 17
    SolutionNameMin: Cijk_Ailk_Bjlk_B8F8NBS_BH_Bias_HAS_SAV_UserArgs_MT128x256x64_MI16x16x1_SN_LDSB1_CLR1_GRVWA16_GRVWB16_GSU0_GSUC0_GSUWGMRR0_K1_LBSPPA1024_LBSPPB2048_LPA64_LPB0_MIWT4_8_PLR1_SU0_SUM0_SUS64_VWA4_VWB8_WGM1_WGMXCC1_WGMXCCGn1
    SolutionIndex: 18
    SolutionNameMin: Cijk_Ailk_Bjlk_B8F8NBS_BH_Bias_HAS_SAV_UserArgs_MT128x256x64_MI16x16x1_SN_LDSB1_CLR1_GRVWA16_GRVWB16_GSU0_GSUC0_GSUWGMRR0_K1_LBSPPA1024_LBSPPB2048_LPA64_LPB0_MIWT4_8_PLR1_SU0_SUM0_SUS64_VWA4_VWB8_WGM6_WGMXCC1_WGMXCCGn1
    SolutionIndex: 19
    SolutionNameMin: Cijk_Ailk_Bjlk_B8F8NBS_BH_Bias_HAS_SAV_UserArgs_MT128x256x64_MI16x16x1_SN_LDSB1_CLR1_GRVWA8_GRVWB16_GSU0_GSUC0_GSUWGMRR0_K1_LBSPPA1024_LBSPPB2048_LPA64_LPB0_MIWT4_8_PLR1_SU0_SUM0_SUS64_VWA4_VWB8_WGM8_WGMXCC1_WGMXCCGn1
    SolutionIndex: 20
    SolutionNameMin: Cijk_Ailk_Bjlk_B8F8NBS_BH_Bias_HAS_SAV_UserArgs_MT256x144x64_MI16x16x1_SN_LDSB0_CLR1_GRVWA4_GRVWB4_GSU0_GSUC0_GSUWGMRR0_K1_LBSPPA2048_LBSPPB1152_LPA64_LPB16_MIWT4_9_PLR1_SU0_SUM0_SUS64_VWA4_VWB1_WGM1_WGMXCC1_WGMXCCGn1
    SolutionIndex: 21
    SolutionNameMin: Cijk_Ailk_Bjlk_B8F8NBS_BH_Bias_HAS_SAV_UserArgs_MT256x144x64_MI16x16x1_SN_LDSB0_CLR1_GRVWA16_GRVWB4_GSU0_GSUC0_GSUWGMRR0_K1_LBSPPA2048_LBSPPB1152_LPA64_LPB16_MIWT4_9_PLR1_SU0_SUM0_SUS64_VWA4_VWB1_WGM1_WGMXCC1_WGMXCCGn1
    SolutionIndex: 22
    SolutionNameMin: Cijk_Ailk_Bjlk_B8F8NBS_BH_Bias_HAS_SAV_UserArgs_MT256x144x64_MI16x16x1_SN_LDSB0_CLR1_GRVWA16_GRVWB4_GSU0_GSUC0_GSUWGMRR0_K1_LBSPPA2048_LBSPPB1152_LPA64_LPB16_MIWT4_9_PLR1_SU0_SUM0_SUS64_VWA4_VWB1_WGM4_WGMXCC1_WGMXCCGn1
    SolutionIndex: 23
    SolutionNameMin: Cijk_Ailk_Bjlk_B8F8NBS_BH_Bias_HAS_SAV_UserArgs_MT256x144x64_MI16x16x1_SN_LDSB0_CLR1_GRVWA16_GRVWB4_GSU0_GSUC0_GSUWGMRR0_K1_LBSPPA2048_LBSPPB1152_LPA64_LPB16_MIWT4_9_PLR1_SU0_SUM0_SUS64_VWA4_VWB1_WGM8_WGMXCC1_WGMXCCGn1
    SolutionIndex: 24
    SolutionNameMin: Cijk_Ailk_Bjlk_B8F8NBS_BH_Bias_HAS_SAV_UserArgs_MT256x128x64_MI16x16x1_SN_LDSB1_CLR1_GRVWA4_GRVWB4_GSU0_GSUC0_GSUWGMRR0_K1_LBSPPA2048_LBSPPB1024_LPA0_LPB64_MIWT8_4_PLR1_SU0_SUM0_SUS64_VWA8_VWB4_WGM1_WGMXCC1_WGMXCCGn1
    SolutionIndex: 25
    SolutionNameMin: Cijk_Ailk_Bjlk_B8F8NBS_BH_Bias_HAS_SAV_UserArgs_MT256x128x64_MI16x16x1_SN_LDSB1_CLR1_GRVWA4_GRVWB8_GSU0_GSUC0_GSUWGMRR0_K1_LBSPPA2048_LBSPPB1024_LPA0_LPB64_MIWT8_4_PLR1_SU0_SUM0_SUS64_VWA8_VWB4_WGM1_WGMXCC1_WGMXCCGn1
    SolutionIndex: 26
    SolutionNameMin: Cijk_Ailk_Bjlk_B8F8NBS_BH_Bias_HAS_SAV_UserArgs_MT256x128x64_MI16x16x1_SN_LDSB1_CLR1_GRVWA8_GRVWB16_GSU0_GSUC0_GSUWGMRR0_K1_LBSPPA2048_LBSPPB1024_LPA0_LPB64_MIWT8_4_PLR1_SU0_SUM0_SUS64_VWA8_VWB4_WGM1_WGMXCC1_WGMXCCGn1
    SolutionIndex: 27
    SolutionNameMin: Cijk_Ailk_Bjlk_B8F8NBS_BH_Bias_HAS_SAV_UserArgs_MT256x128x64_MI16x16x1_SN_LDSB1_CLR1_GRVWA16_GRVWB16_GSU0_GSUC0_GSUWGMRR0_K1_LBSPPA2048_LBSPPB1024_LPA0_LPB64_MIWT8_4_PLR1_SU0_SUM0_SUS64_VWA8_VWB4_WGM1_WGMXCC1_WGMXCCGn1
    SolutionIndex: 28
    SolutionNameMin: Cijk_Ailk_Bjlk_B8F8NBS_BH_Bias_HAS_SAV_UserArgs_MT256x128x64_MI16x16x1_SN_LDSB1_CLR1_GRVWA16_GRVWB16_GSU0_GSUC0_GSUWGMRR0_K1_LBSPPA2048_LBSPPB1024_LPA0_LPB64_MIWT8_4_PLR1_SU0_SUM0_SUS64_VWA8_VWB4_WGM4_WGMXCC1_WGMXCCGn1
    SolutionIndex: 29
    SolutionNameMin: Cijk_Ailk_Bjlk_B8F8NBS_BH_Bias_HAS_SAV_UserArgs_MT256x128x64_MI16x16x1_SN_LDSB1_CLR1_GRVWA16_GRVWB16_GSU0_GSUC0_GSUWGMRR0_K1_LBSPPA2048_LBSPPB1024_LPA0_LPB64_MIWT8_4_PLR1_SU0_SUM0_SUS64_VWA8_VWB4_WGM6_WGMXCC1_WGMXCCGn1
    SolutionIndex: 30
    SolutionNameMin: Cijk_Ailk_Bjlk_B8F8NBS_BH_Bias_HAS_SAV_UserArgs_MT256x128x64_MI16x16x1_SN_LDSB1_CLR1_GRVWA4_GRVWB4_GSU0_GSUC0_GSUWGMRR0_K1_LBSPPA2048_LBSPPB1024_LPA0_LPB64_MIWT8_4_PLR1_SU0_SUM0_SUS64_VWA8_VWB4_WGM8_WGMXCC1_WGMXCCGn1
    SolutionIndex: 31
    SolutionNameMin: Cijk_Ailk_Bjlk_B8F8NBS_BH_Bias_HAS_SAV_UserArgs_MT256x128x64_MI16x16x1_SN_LDSB1_CLR1_GRVWA4_GRVWB8_GSU0_GSUC0_GSUWGMRR0_K1_LBSPPA2048_LBSPPB1024_LPA0_LPB64_MIWT8_4_PLR1_SU0_SUM0_SUS64_VWA8_VWB4_WGM8_WGMXCC1_WGMXCCGn1
    SolutionIndex: 32
    SolutionNameMin: Cijk_Ailk_Bjlk_B8F8NBS_BH_Bias_HAS_SAV_UserArgs_MT256x128x64_MI16x16x1_SN_LDSB1_CLR1_GRVWA8_GRVWB8_GSU0_GSUC0_GSUWGMRR0_K1_LBSPPA2048_LBSPPB1024_LPA0_LPB64_MIWT8_4_PLR1_SU0_SUM0_SUS64_VWA8_VWB4_WGM8_WGMXCC1_WGMXCCGn1
    SolutionIndex: 33
    SolutionNameMin: Cijk_Ailk_Bjlk_B8F8NBS_BH_Bias_HAS_SAV_UserArgs_MT256x128x64_MI16x16x1_SN_LDSB1_CLR1_GRVWA16_GRVWB16_GSU0_GSUC0_GSUWGMRR0_K1_LBSPPA2048_LBSPPB1024_LPA0_LPB64_MIWT8_4_PLR1_SU0_SUM0_SUS64_VWA8_VWB4_WGM8_WGMXCC1_WGMXCCGn1
    SolutionIndex: 34
    SolutionNameMin: Cijk_Ailk_Bjlk_B8F8NBS_BH_Bias_HAS_SAV_UserArgs_MT128x128x64_MI16x16x1_SN_LDSB1_CLR1_GRVWA4_GRVWB4_GSU0_GSUC0_GSUWGMRR0_K1_LBSPPA1024_LBSPPB1024_LPA0_LPB32_MIWT8_2_PLR1_SU0_SUM0_SUS64_VWA8_VWB2_WGM1_WGMXCC1_WGMXCCGn1
    SolutionIndex: 35
    SolutionNameMin: Cijk_Ailk_Bjlk_B8F8NBS_BH_Bias_HAS_SAV_UserArgs_MT128x128x64_MI16x16x1_SN_LDSB1_CLR1_GRVWA8_GRVWB16_GSU0_GSUC0_GSUWGMRR0_K1_LBSPPA1024_LBSPPB1024_LPA0_LPB32_MIWT8_2_PLR1_SU0_SUM0_SUS64_VWA8_VWB2_WGM1_WGMXCC1_WGMXCCGn1
    SolutionIndex: 36
    SolutionNameMin: Cijk_Ailk_Bjlk_B8F8NBS_BH_Bias_HAS_SAV_UserArgs_MT128x128x64_MI16x16x1_SN_LDSB1_CLR1_GRVWA4_GRVWB4_GSU0_GSUC0_GSUWGMRR0_K1_LBSPPA1024_LBSPPB1024_LPA0_LPB32_MIWT8_2_PLR1_SU0_SUM0_SUS64_VWA8_VWB2_WGM8_WGMXCC1_WGMXCCGn1
    SolutionIndex: 37
    SolutionNameMin: Cijk_Ailk_Bjlk_B8F8NBS_BH_Bias_HAS_SAV_UserArgs_MT128x128x64_MI16x16x1_SN_LDSB1_CLR1_GRVWA8_GRVWB16_GSU0_GSUC0_GSUWGMRR0_K1_LBSPPA1024_LBSPPB1024_LPA0_LPB32_MIWT8_2_PLR1_SU0_SUM0_SUS64_VWA8_VWB2_WGM8_WGMXCC1_WGMXCCGn1
    SolutionIndex: 38
    SolutionNameMin: Cijk_Ailk_Bjlk_B8F8NBS_BH_Bias_HAS_SAV_UserArgs_MT128x128x64_MI16x16x1_SN_LDSB1_CLR1_GRVWA8_GRVWB16_GSU0_GSUC0_GSUWGMRR0_K1_LBSPPA1024_LBSPPB1024_LPA64_LPB64_MIWT4_4_PLR1_SU0_SUM0_SUS64_VWA4_VWB4_WGM1_WGMXCC1_WGMXCCGn1
    SolutionIndex: 39
    SolutionNameMin: Cijk_Ailk_Bjlk_B8F8NBS_BH_Bias_HAS_SAV_UserArgs_MT128x128x64_MI16x16x1_SN_LDSB1_CLR1_GRVWA16_GRVWB16_GSU0_GSUC0_GSUWGMRR0_K1_LBSPPA1024_LBSPPB1024_LPA64_LPB64_MIWT4_4_PLR1_SU0_SUM0_SUS64_VWA4_VWB4_WGM1_WGMXCC1_WGMXCCGn1
    SolutionIndex: 40
    SolutionNameMin: Cijk_Ailk_Bjlk_B8F8NBS_BH_Bias_HAS_SAV_UserArgs_MT128x128x64_MI16x16x1_SN_LDSB1_CLR1_GRVWA16_GRVWB8_GSU0_GSUC0_GSUWGMRR0_K1_LBSPPA1024_LBSPPB1024_LPA64_LPB64_MIWT4_4_PLR1_SU0_SUM0_SUS64_VWA4_VWB4_WGM4_WGMXCC1_WGMXCCGn1
    SolutionIndex: 41
    SolutionNameMin: Cijk_Ailk_Bjlk_B8F8NBS_BH_Bias_HAS_SAV_UserArgs_MT128x128x64_MI16x16x1_SN_LDSB1_CLR1_GRVWA8_GRVWB16_GSU0_GSUC0_GSUWGMRR0_K1_LBSPPA1024_LBSPPB1024_LPA64_LPB64_MIWT4_4_PLR1_SU0_SUM0_SUS64_VWA4_VWB4_WGM4_WGMXCC1_WGMXCCGn1
    SolutionIndex: 42
    SolutionNameMin: Cijk_Ailk_Bjlk_B8F8NBS_BH_Bias_HAS_SAV_UserArgs_MT128x128x64_MI16x16x1_SN_LDSB1_CLR1_GRVWA16_GRVWB16_GSU0_GSUC0_GSUWGMRR0_K1_LBSPPA1024_LBSPPB1024_LPA64_LPB64_MIWT4_4_PLR1_SU0_SUM0_SUS64_VWA4_VWB4_WGM4_WGMXCC1_WGMXCCGn1
    SolutionIndex: 43
    SolutionNameMin: Cijk_Ailk_Bjlk_B8F8NBS_BH_Bias_HAS_SAV_UserArgs_MT128x128x64_MI16x16x1_SN_LDSB1_CLR1_GRVWA16_GRVWB16_GSU0_GSUC0_GSUWGMRR0_K1_LBSPPA1024_LBSPPB1024_LPA64_LPB64_MIWT4_4_PLR1_SU0_SUM0_SUS64_VWA4_VWB4_WGM6_WGMXCC1_WGMXCCGn1
    SolutionIndex: 44
    SolutionNameMin: Cijk_Ailk_Bjlk_B8F8NBS_BH_Bias_HAS_SAV_UserArgs_MT128x128x64_MI16x16x1_SN_LDSB1_CLR1_GRVWA8_GRVWB16_GSU0_GSUC0_GSUWGMRR0_K1_LBSPPA1024_LBSPPB1024_LPA64_LPB64_MIWT4_4_PLR1_SU0_SUM0_SUS64_VWA4_VWB4_WGM8_WGMXCC1_WGMXCCGn1
    SolutionIndex: 45
    SolutionNameMin: Cijk_Ailk_Bjlk_B8F8NBS_BH_Bias_HAS_SAV_UserArgs_MT128x128x64_MI16x16x1_SN_LDSB1_CLR1_GRVWA16_GRVWB16_GSU0_GSUC0_GSUWGMRR0_K1_LBSPPA1024_LBSPPB1024_LPA64_LPB64_MIWT4_4_PLR1_SU0_SUM0_SUS64_VWA4_VWB4_WGM8_WGMXCC1_WGMXCCGn1
    SolutionIndex: 46
    SolutionNameMin: Cijk_Ailk_Bjlk_B8F8NBS_BH_Bias_HAS_SAV_UserArgs_MT64x128x64_MI16x16x1_SN_LDSB0_CLR1_GRVWA4_GRVWB4_GSU0_GSUC0_GSUWGMRR0_K1_LBSPPA512_LBSPPB1024_LPA32_LPB64_MIWT2_4_PLR1_SU0_SUM0_SUS64_VWA2_VWB4_WGM1_WGMXCC1_WGMXCCGn1
    SolutionIndex: 47
    SolutionNameMin: Cijk_Ailk_Bjlk_B8F8NBS_BH_Bias_HAS_SAV_UserArgs_MT64x128x64_MI16x16x1_SN_LDSB0_CLR1_GRVWA4_GRVWB16_GSU0_GSUC0_GSUWGMRR0_K1_LBSPPA512_LBSPPB1024_LPA32_LPB64_MIWT2_4_PLR1_SU0_SUM0_SUS64_VWA2_VWB4_WGM1_WGMXCC1_WGMXCCGn1
    SolutionIndex: 48
    SolutionNameMin: Cijk_Ailk_Bjlk_B8F8NBS_BH_Bias_HAS_SAV_UserArgs_MT64x128x64_MI16x16x1_SN_LDSB0_CLR1_GRVWA16_GRVWB16_GSU0_GSUC0_GSUWGMRR0_K1_LBSPPA512_LBSPPB1024_LPA32_LPB64_MIWT2_4_PLR1_SU0_SUM0_SUS64_VWA2_VWB4_WGM1_WGMXCC1_WGMXCCGn1
    SolutionIndex: 49
    SolutionNameMin: Cijk_Ailk_Bjlk_B8F8NBS_BH_Bias_HAS_SAV_UserArgs_MT64x128x64_MI16x16x1_SN_LDSB0_CLR1_GRVWA16_GRVWB16_GSU0_GSUC0_GSUWGMRR0_K1_LBSPPA512_LBSPPB1024_LPA32_LPB64_MIWT2_4_PLR1_SU0_SUM0_SUS64_VWA2_VWB4_WGM8_WGMXCC1_WGMXCCGn1
    SolutionIndex: 50
    SolutionNameMin: Cijk_Ailk_Bjlk_B8F8NBS_BH_Bias_HAS_SAV_UserArgs_MT128x64x64_MI16x16x1_SN_LDSB0_CLR1_GRVWA4_GRVWB4_GSU0_GSUC0_GSUWGMRR0_K1_LBSPPA1024_LBSPPB512_LPA64_LPB32_MIWT4_2_PLR1_SU0_SUM0_SUS64_VWA4_VWB2_WGM1_WGMXCC1_WGMXCCGn1
    SolutionIndex: 51
    SolutionNameMin: Cijk_Ailk_Bjlk_B8F8NBS_BH_Bias_HAS_SAV_UserArgs_MT128x64x64_MI16x16x1_SN_LDSB0_CLR1_GRVWA4_GRVWB8_GSU0_GSUC0_GSUWGMRR0_K1_LBSPPA1024_LBSPPB512_LPA64_LPB32_MIWT4_2_PLR1_SU0_SUM0_SUS64_VWA4_VWB2_WGM1_WGMXCC1_WGMXCCGn1
    SolutionIndex: 52
    SolutionNameMin: Cijk_Ailk_Bjlk_B8F8NBS_BH_Bias_HAS_SAV_UserArgs_MT128x32x64_MI16x16x1_SN_LDSB0_CLR1_GRVWA4_GRVWB4_GSU0_GSUC0_GSUWGMRR0_K1_LBSPPA1024_LBSPPB256_LPA64_LPB16_MIWT4_1_PLR1_SU0_SUM0_SUS64_VWA4_VWB1_WGM1_WGMXCC1_WGMXCCGn1
    SolutionIndex: 53
    SolutionNameMin: Cijk_Ailk_Bjlk_B8F8NBS_BH_Bias_HAS_SAV_UserArgs_MT64x64x64_MI16x16x1_SN_LDSB0_CLR1_GRVWA4_GRVWB4_GSU0_GSUC0_GSUWGMRR0_K1_LBSPPA512_LBSPPB512_LPA32_LPB32_MIWT2_2_PLR1_SU0_SUM0_SUS64_VWA2_VWB2_WGM1_WGMXCC1_WGMXCCGn1
    SolutionIndex: 54
    SolutionNameMin: Cijk_Ailk_Bjlk_B8F8NBS_BH_Bias_HAS_SAV_UserArgs_MT64x64x64_MI16x16x1_SN_LDSB0_CLR1_GRVWA8_GRVWB4_GSU0_GSUC0_GSUWGMRR0_K1_LBSPPA512_LBSPPB512_LPA32_LPB32_MIWT2_2_PLR1_SU0_SUM0_SUS64_VWA2_VWB2_WGM1_WGMXCC1_WGMXCCGn1
    SolutionIndex: 55
    SolutionNameMin: Cijk_Ailk_Bjlk_B8F8NBS_BH_Bias_HAS_SAV_UserArgs_MT64x64x64_MI16x16x1_SN_LDSB0_CLR1_GRVWA8_GRVWB8_GSU0_GSUC0_GSUWGMRR0_K1_LBSPPA512_LBSPPB512_LPA32_LPB32_MIWT2_2_PLR1_SU0_SUM0_SUS64_VWA2_VWB2_WGM1_WGMXCC1_WGMXCCGn1
    SolutionIndex: 56
    SolutionNameMin: Cijk_Ailk_Bjlk_B8F8NBS_BH_Bias_HAS_SAV_UserArgs_MT64x64x64_MI16x16x1_SN_LDSB0_CLR1_GRVWA4_GRVWB4_GSU0_GSUC0_GSUWGMRR0_K1_LBSPPA512_LBSPPB512_LPA32_LPB32_MIWT2_2_PLR1_SU0_SUM0_SUS64_VWA2_VWB2_WGM4_WGMXCC1_WGMXCCGn1
    SolutionIndex: 57
    SolutionNameMin: Cijk_Ailk_Bjlk_B8F8NBS_BH_Bias_HAS_SAV_UserArgs_MT64x32x64_MI16x16x1_SN_LDSB0_CLR1_GRVWA4_GRVWB4_GSU0_GSUC0_GSUWGMRR0_K1_LBSPPA512_LBSPPB256_LPA32_LPB16_MIWT2_1_PLR1_SU0_SUM0_SUS64_VWA2_VWB1_WGM1_WGMXCC1_WGMXCCGn1
    SolutionIndex: 58
    SolutionNameMin: Cijk_Ailk_Bjlk_B8F8NBS_BH_Bias_HAS_SAV_UserArgs_MT64x32x64_MI16x16x1_SN_LDSB0_CLR1_GRVWA8_GRVWB4_GSU0_GSUC0_GSUWGMRR0_K1_LBSPPA512_LBSPPB256_LPA32_LPB16_MIWT2_1_PLR1_SU0_SUM0_SUS64_VWA2_VWB1_WGM1_WGMXCC1_WGMXCCGn1
    SolutionIndex: 59
    SolutionNameMin: Cijk_Ailk_Bjlk_B8F8NBS_BH_Bias_HAS_SAV_UserArgs_MT64x32x64_MI16x16x1_SN_LDSB0_CLR1_GRVWA4_GRVWB8_GSU0_GSUC0_GSUWGMRR0_K1_LBSPPA512_LBSPPB256_LPA32_LPB16_MIWT2_1_PLR1_SU0_SUM0_SUS64_VWA2_VWB1_WGM1_WGMXCC1_WGMXCCGn1
    SolutionIndex: 60
    SolutionNameMin: Cijk_Ailk_Bjlk_B8F8NBS_BH_Bias_HAS_SAV_UserArgs_MT32x32x64_MI16x16x1_SN_LDSB0_CLR1_GRVWA4_GRVWB4_GSU0_GSUC0_GSUWGMRR0_K1_LBSPPA256_LBSPPB256_LPA16_LPB16_MIWT1_1_PLR1_SU0_SUM0_SUS64_VWA1_VWB1_WGM1_WGMXCC1_WGMXCCGn1
    SolutionIndex: 61
    SolutionNameMin: Cijk_Ailk_Bjlk_B8F8NBS_BH_Bias_HAS_SAV_UserArgs_MT32x32x64_MI16x16x1_SN_LDSB0_CLR1_GRVWA8_GRVWB4_GSU0_GSUC0_GSUWGMRR0_K1_LBSPPA256_LBSPPB256_LPA16_LPB16_MIWT1_1_PLR1_SU0_SUM0_SUS64_VWA1_VWB1_WGM1_WGMXCC1_WGMXCCGn1
    SolutionIndex: 62
    SolutionNameMin: Cijk_Ailk_Bjlk_B8F8NBS_BH_Bias_HAS_SAV_UserArgs_MT32x32x64_MI16x16x1_SN_LDSB0_CLR1_GRVWA4_GRVWB8_GSU0_GSUC0_GSUWGMRR0_K1_LBSPPA256_LBSPPB256_LPA16_LPB16_MIWT1_1_PLR1_SU0_SUM0_SUS64_VWA1_VWB1_WGM1_WGMXCC1_WGMXCCGn1
    SolutionIndex: 63
    SolutionNameMin: Cijk_Ailk_Bjlk_B8F8NBS_BH_Bias_HAS_SAV_UserArgs_MT32x32x64_MI16x16x1_SN_LDSB0_CLR1_GRVWA8_GRVWB8_GSU0_GSUC0_GSUWGMRR0_K1_LBSPPA256_LBSPPB256_LPA16_LPB16_MIWT1_1_PLR1_SU0_SUM0_SUS64_VWA1_VWB1_WGM1_WGMXCC1_WGMXCCGn1
    SolutionIndex: 64
    SolutionNameMin: Cijk_Ailk_Bjlk_B8F8NBS_BH_Bias_HAS_SAV_UserArgs_MT256x256x128_MI16x16x1_SN_LDSB1_CLR1_GRVWA16_GRVWB8_GSU0_GSUC0_GSUWGMRR0_K1_LBSPPA2048_LBSPPB2048_LPA0_LPB0_MIWT8_8_PLR1_SU0_SUM0_SUS128_VWA8_VWB8_WGM1_WGMXCC1_WGMXCCGn1
    SolutionIndex: 65
    SolutionNameMin: Cijk_Ailk_Bjlk_B8F8NBS_BH_Bias_HAS_SAV_UserArgs_MT256x256x128_MI16x16x1_SN_LDSB1_CLR1_GRVWA16_GRVWB16_GSU0_GSUC0_GSUWGMRR0_K1_LBSPPA2048_LBSPPB2048_LPA0_LPB0_MIWT8_8_PLR1_SU0_SUM0_SUS128_VWA8_VWB8_WGM1_WGMXCC1_WGMXCCGn1
    SolutionIndex: 66
    SolutionNameMin: Cijk_Ailk_Bjlk_B8F8NBS_BH_Bias_HAS_SAV_UserArgs_MT256x256x128_MI16x16x1_SN_LDSB1_CLR1_GRVWA16_GRVWB16_GSU0_GSUC0_GSUWGMRR0_K1_LBSPPA2048_LBSPPB2048_LPA0_LPB0_MIWT8_8_PLR1_SU0_SUM0_SUS128_VWA8_VWB8_WGM4_WGMXCC1_WGMXCCGn1
    SolutionIndex: 67
    SolutionNameMin: Cijk_Ailk_Bjlk_B8F8NBS_BH_Bias_HAS_SAV_UserArgs_MT256x256x128_MI16x16x1_SN_LDSB1_CLR1_GRVWA16_GRVWB8_GSU0_GSUC0_GSUWGMRR0_K1_LBSPPA2048_LBSPPB2048_LPA0_LPB0_MIWT8_8_PLR1_SU0_SUM0_SUS128_VWA8_VWB8_WGM6_WGMXCC1_WGMXCCGn1
    SolutionIndex: 68
    SolutionNameMin: Cijk_Ailk_Bjlk_B8F8NBS_BH_Bias_HAS_SAV_UserArgs_MT256x256x128_MI16x16x1_SN_LDSB1_CLR1_GRVWA16_GRVWB16_GSU0_GSUC0_GSUWGMRR0_K1_LBSPPA2048_LBSPPB2048_LPA0_LPB0_MIWT8_8_PLR1_SU0_SUM0_SUS128_VWA8_VWB8_WGM6_WGMXCC1_WGMXCCGn1
    SolutionIndex: 69
    SolutionNameMin: Cijk_Ailk_Bjlk_B8F8NBS_BH_Bias_HAS_SAV_UserArgs_MT128x256x128_MI16x16x1_SN_LDSB1_CLR1_GRVWA4_GRVWB16_GSU0_GSUC0_GSUWGMRR0_K1_LBSPPA1024_LBSPPB2048_LPA64_LPB0_MIWT4_8_PLR1_SU0_SUM0_SUS128_VWA4_VWB8_WGM1_WGMXCC1_WGMXCCGn1
    SolutionIndex: 70
    SolutionNameMin: Cijk_Ailk_Bjlk_B8F8NBS_BH_Bias_HAS_SAV_UserArgs_MT128x256x128_MI16x16x1_SN_LDSB1_CLR1_GRVWA4_GRVWB16_GSU0_GSUC0_GSUWGMRR0_K1_LBSPPA1024_LBSPPB2048_LPA64_LPB0_MIWT4_8_PLR1_SU0_SUM0_SUS128_VWA4_VWB8_WGM4_WGMXCC1_WGMXCCGn1
    SolutionIndex: 71
    SolutionNameMin: Cijk_Ailk_Bjlk_B8F8NBS_BH_Bias_HAS_SAV_UserArgs_MT128x256x128_MI16x16x1_SN_LDSB1_CLR1_GRVWA16_GRVWB16_GSU0_GSUC0_GSUWGMRR0_K1_LBSPPA1024_LBSPPB2048_LPA64_LPB0_MIWT4_8_PLR1_SU0_SUM0_SUS128_VWA4_VWB8_WGM4_WGMXCC1_WGMXCCGn1
    SolutionIndex: 72
    SolutionNameMin: Cijk_Ailk_Bjlk_B8F8NBS_BH_Bias_HAS_SAV_UserArgs_MT128x256x128_MI16x16x1_SN_LDSB1_CLR1_GRVWA4_GRVWB16_GSU0_GSUC0_GSUWGMRR0_K1_LBSPPA1024_LBSPPB2048_LPA64_LPB0_MIWT4_8_PLR1_SU0_SUM0_SUS128_VWA4_VWB8_WGM6_WGMXCC1_WGMXCCGn1
    SolutionIndex: 73
    SolutionNameMin: Cijk_Ailk_Bjlk_B8F8NBS_BH_Bias_HAS_SAV_UserArgs_MT128x256x128_MI16x16x1_SN_LDSB1_CLR1_GRVWA8_GRVWB16_GSU0_GSUC0_GSUWGMRR0_K1_LBSPPA1024_LBSPPB2048_LPA64_LPB0_MIWT4_8_PLR1_SU0_SUM0_SUS128_VWA4_VWB8_WGM6_WGMXCC1_WGMXCCGn1
    SolutionIndex: 74
    SolutionNameMin: Cijk_Ailk_Bjlk_B8F8NBS_BH_Bias_HAS_SAV_UserArgs_MT256x128x128_MI16x16x1_SN_LDSB1_CLR1_GRVWA16_GRVWB8_GSU0_GSUC0_GSUWGMRR0_K1_LBSPPA2048_LBSPPB1024_LPA0_LPB64_MIWT8_4_PLR1_SU0_SUM0_SUS128_VWA8_VWB4_WGM1_WGMXCC1_WGMXCCGn1
    SolutionIndex: 75
    SolutionNameMin: Cijk_Ailk_Bjlk_B8F8NBS_BH_Bias_HAS_SAV_UserArgs_MT256x128x128_MI16x16x1_SN_LDSB1_CLR1_GRVWA16_GRVWB16_GSU0_GSUC0_GSUWGMRR0_K1_LBSPPA2048_LBSPPB1024_LPA0_LPB64_MIWT8_4_PLR1_SU0_SUM0_SUS128_VWA8_VWB4_WGM1_WGMXCC1_WGMXCCGn1
    SolutionIndex: 76
    SolutionNameMin: Cijk_Ailk_Bjlk_B8F8NBS_BH_Bias_HAS_SAV_UserArgs_MT256x128x128_MI16x16x1_SN_LDSB1_CLR1_GRVWA16_GRVWB8_GSU0_GSUC0_GSUWGMRR0_K1_LBSPPA2048_LBSPPB1024_LPA0_LPB64_MIWT8_4_PLR1_SU0_SUM0_SUS128_VWA8_VWB4_WGM4_WGMXCC1_WGMXCCGn1
    SolutionIndex: 77
    SolutionNameMin: Cijk_Ailk_Bjlk_B8F8NBS_BH_Bias_HAS_SAV_UserArgs_MT256x128x128_MI16x16x1_SN_LDSB1_CLR1_GRVWA16_GRVWB8_GSU0_GSUC0_GSUWGMRR0_K1_LBSPPA2048_LBSPPB1024_LPA0_LPB64_MIWT8_4_PLR1_SU0_SUM0_SUS128_VWA8_VWB4_WGM8_WGMXCC1_WGMXCCGn1
    SolutionIndex: 78
    SolutionNameMin: Cijk_Ailk_Bjlk_B8F8NBS_BH_Bias_HAS_SAV_UserArgs_MT128x128x128_MI16x16x1_SN_LDSB1_CLR1_GRVWA4_GRVWB16_GSU0_GSUC0_GSUWGMRR0_K1_LBSPPA1024_LBSPPB1024_LPA64_LPB64_MIWT4_4_PLR1_SU0_SUM0_SUS128_VWA4_VWB4_WGM1_WGMXCC1_WGMXCCGn1
    SolutionIndex: 79
    SolutionNameMin: Cijk_Ailk_Bjlk_B8F8NBS_BH_Bias_HAS_SAV_UserArgs_MT128x128x128_MI16x16x1_SN_LDSB1_CLR1_GRVWA16_GRVWB16_GSU0_GSUC0_GSUWGMRR0_K1_LBSPPA1024_LBSPPB1024_LPA64_LPB64_MIWT4_4_PLR1_SU0_SUM0_SUS128_VWA4_VWB4_WGM1_WGMXCC1_WGMXCCGn1
    SolutionIndex: 80
    SolutionNameMin: Cijk_Ailk_Bjlk_B8F8NBS_BH_Bias_HAS_SAV_UserArgs_MT128x128x128_MI16x16x1_SN_LDSB1_CLR1_GRVWA16_GRVWB16_GSU0_GSUC0_GSUWGMRR0_K1_LBSPPA1024_LBSPPB1024_LPA64_LPB64_MIWT4_4_PLR1_SU0_SUM0_SUS128_VWA4_VWB4_WGM4_WGMXCC1_WGMXCCGn1
    SolutionIndex: 81
    SolutionNameMin: Cijk_Ailk_Bjlk_B8F8NBS_BH_Bias_HAS_SAV_UserArgs_MT128x128x128_MI16x16x1_SN_LDSB1_CLR1_GRVWA16_GRVWB16_GSU0_GSUC0_GSUWGMRR0_K1_LBSPPA1024_LBSPPB1024_LPA64_LPB64_MIWT4_4_PLR1_SU0_SUM0_SUS128_VWA4_VWB4_WGM6_WGMXCC1_WGMXCCGn1
    SolutionIndex: 82
    SolutionNameMin: Cijk_Ailk_Bjlk_B8F8NBS_BH_Bias_HAS_SAV_UserArgs_MT128x64x128_MI16x16x1_SN_LDSB1_CLR1_GRVWA16_GRVWB16_GSU0_GSUC0_GSUWGMRR0_K1_LBSPPA1024_LBSPPB512_LPA64_LPB32_MIWT4_2_PLR1_SU0_SUM0_SUS128_VWA4_VWB2_WGM1_WGMXCC1_WGMXCCGn1
    SolutionIndex: 83
    SolutionNameMin: Cijk_Ailk_Bjlk_B8F8NBS_BH_Bias_HAS_SAV_UserArgs_MT128x64x128_MI16x16x1_SN_LDSB1_CLR1_GRVWA16_GRVWB16_GSU0_GSUC0_GSUWGMRR0_K1_LBSPPA1024_LBSPPB512_LPA64_LPB32_MIWT4_2_PLR1_SU0_SUM0_SUS128_VWA4_VWB2_WGM4_WGMXCC1_WGMXCCGn1
    SolutionIndex: 84
    SolutionNameMin: Cijk_Ailk_Bjlk_B8F8NBS_BH_Bias_HAS_SAV_UserArgs_MT128x64x128_MI16x16x1_SN_LDSB1_CLR1_GRVWA16_GRVWB16_GSU0_GSUC0_GSUWGMRR0_K1_LBSPPA1024_LBSPPB512_LPA64_LPB32_MIWT4_2_PLR1_SU0_SUM0_SUS128_VWA4_VWB2_WGM6_WGMXCC1_WGMXCCGn1
    SolutionIndex: 85
    SolutionNameMin: Cijk_Ailk_Bjlk_B8F8NBS_BH_Bias_HAS_SAV_UserArgs_MT128x64x128_MI16x16x1_SN_LDSB1_CLR1_GRVWA16_GRVWB16_GSU0_GSUC0_GSUWGMRR0_K1_LBSPPA1024_LBSPPB512_LPA64_LPB32_MIWT4_2_PLR1_SU0_SUM0_SUS128_VWA4_VWB2_WGM8_WGMXCC1_WGMXCCGn1
    SolutionIndex: 86
    SolutionNameMin: Cijk_Ailk_Bjlk_B8F8NBS_BH_Bias_HAS_SAV_UserArgs_MT64x64x128_MI16x16x1_SN_LDSB1_CLR1_GRVWA16_GRVWB4_GSU0_GSUC0_GSUWGMRR0_K1_LBSPPA512_LBSPPB512_LPA32_LPB32_MIWT2_2_PLR1_SU0_SUM0_SUS128_VWA2_VWB2_WGM1_WGMXCC1_WGMXCCGn1
    SolutionIndex: 87
    SolutionNameMin: Cijk_Ailk_Bjlk_B8F8NBS_BH_Bias_HAS_SAV_UserArgs_MT64x64x128_MI16x16x1_SN_LDSB1_CLR1_GRVWA8_GRVWB16_GSU0_GSUC0_GSUWGMRR0_K1_LBSPPA512_LBSPPB512_LPA32_LPB32_MIWT2_2_PLR1_SU0_SUM0_SUS128_VWA2_VWB2_WGM1_WGMXCC1_WGMXCCGn1
    SolutionIndex: 88
    SolutionNameMin: Cijk_Ailk_Bjlk_B8F8NBS_BH_Bias_HAS_SAV_UserArgs_MT64x64x128_MI16x16x1_SN_LDSB1_CLR1_GRVWA16_GRVWB16_GSU0_GSUC0_GSUWGMRR0_K1_LBSPPA512_LBSPPB512_LPA32_LPB32_MIWT2_2_PLR1_SU0_SUM0_SUS128_VWA2_VWB2_WGM1_WGMXCC1_WGMXCCGn1
    SolutionIndex: 89
    SolutionNameMin: Cijk_Ailk_Bjlk_B8F8NBS_BH_Bias_HAS_SAV_UserArgs_MT64x64x128_MI16x16x1_SN_LDSB1_CLR1_GRVWA4_GRVWB16_GSU0_GSUC0_GSUWGMRR0_K1_LBSPPA512_LBSPPB512_LPA32_LPB32_MIWT2_2_PLR1_SU0_SUM0_SUS128_VWA2_VWB2_WGM4_WGMXCC1_WGMXCCGn1
    SolutionIndex: 90
    SolutionNameMin: Cijk_Ailk_Bjlk_B8F8NBS_BH_Bias_HAS_SAV_UserArgs_MT64x64x128_MI16x16x1_SN_LDSB1_CLR1_GRVWA4_GRVWB16_GSU0_GSUC0_GSUWGMRR0_K1_LBSPPA512_LBSPPB512_LPA32_LPB32_MIWT2_2_PLR1_SU0_SUM0_SUS128_VWA2_VWB2_WGM6_WGMXCC1_WGMXCCGn1
    SolutionIndex: 91
    SolutionNameMin: Cijk_Ailk_Bjlk_B8F8NBS_BH_Bias_HAS_SAV_UserArgs_MT64x64x128_MI16x16x1_SN_LDSB1_CLR1_GRVWA16_GRVWB16_GSU0_GSUC0_GSUWGMRR0_K1_LBSPPA512_LBSPPB512_LPA32_LPB32_MIWT2_2_PLR1_SU0_SUM0_SUS128_VWA2_VWB2_WGM6_WGMXCC1_WGMXCCGn1
    SolutionIndex: 92
    SolutionNameMin: Cijk_Ailk_Bjlk_B8F8NBS_BH_Bias_HAS_SAV_UserArgs_MT64x64x128_MI16x16x1_SN_LDSB1_CLR1_GRVWA8_GRVWB16_GSU0_GSUC0_GSUWGMRR0_K1_LBSPPA512_LBSPPB512_LPA32_LPB32_MIWT2_2_PLR1_SU0_SUM0_SUS128_VWA2_VWB2_WGM8_WGMXCC1_WGMXCCGn1
    SolutionIndex: 93
    SolutionNameMin: Cijk_Ailk_Bjlk_B8F8NBS_BH_Bias_HAS_SAV_UserArgs_MT64x64x128_MI16x16x1_SN_LDSB1_CLR1_GRVWA16_GRVWB16_GSU0_GSUC0_GSUWGMRR0_K1_LBSPPA512_LBSPPB512_LPA32_LPB32_MIWT2_2_PLR1_SU0_SUM0_SUS128_VWA2_VWB2_WGM8_WGMXCC1_WGMXCCGn1
    SolutionIndex: 94
    SolutionNameMin: Cijk_Ailk_Bjlk_B8F8NBS_BH_Bias_HAS_SAV_UserArgs_MT32x64x128_MI16x16x1_SN_LDSB0_CLR1_GRVWA4_GRVWB8_GSU0_GSUC0_GSUWGMRR0_K1_LBSPPA256_LBSPPB512_LPA16_LPB32_MIWT1_2_PLR1_SU0_SUM0_SUS128_VWA1_VWB2_WGM1_WGMXCC1_WGMXCCGn1
    SolutionIndex: 95
    SolutionNameMin: Cijk_Ailk_Bjlk_B8F8NBS_BH_Bias_HAS_SAV_UserArgs_MT32x64x128_MI16x16x1_SN_LDSB0_CLR1_GRVWA16_GRVWB16_GSU0_GSUC0_GSUWGMRR0_K1_LBSPPA256_LBSPPB512_LPA16_LPB32_MIWT1_2_PLR1_SU0_SUM0_SUS128_VWA1_VWB2_WGM1_WGMXCC1_WGMXCCGn1
    SolutionIndex: 96
    SolutionNameMin: Cijk_Ailk_Bjlk_B8F8NBS_BH_Bias_HAS_SAV_UserArgs_MT32x64x128_MI16x16x1_SN_LDSB0_CLR1_GRVWA16_GRVWB16_GSU0_GSUC0_GSUWGMRR0_K1_LBSPPA256_LBSPPB512_LPA16_LPB32_MIWT1_2_PLR1_SU0_SUM0_SUS128_VWA1_VWB2_WGM4_WGMXCC1_WGMXCCGn1
    SolutionIndex: 97
    SolutionNameMin: Cijk_Ailk_Bjlk_B8F8NBS_BH_Bias_HAS_SAV_UserArgs_MT32x64x128_MI16x16x1_SN_LDSB0_CLR1_GRVWA16_GRVWB16_GSU0_GSUC0_GSUWGMRR0_K1_LBSPPA256_LBSPPB512_LPA16_LPB32_MIWT1_2_PLR1_SU0_SUM0_SUS128_VWA1_VWB2_WGM8_WGMXCC1_WGMXCCGn1
    SolutionIndex: 98
    SolutionNameMin: Cijk_Ailk_Bjlk_B8F8NBS_BH_Bias_HAS_SAV_UserArgs_MT64x32x128_MI16x16x1_SN_LDSB0_CLR1_GRVWA4_GRVWB4_GSU0_GSUC0_GSUWGMRR0_K1_LBSPPA512_LBSPPB256_LPA32_LPB16_MIWT2_1_PLR1_SU0_SUM0_SUS128_VWA2_VWB1_WGM1_WGMXCC1_WGMXCCGn1
    SolutionIndex: 99
    SolutionNameMin: Cijk_Ailk_Bjlk_B8F8NBS_BH_Bias_HAS_SAV_UserArgs_MT64x32x128_MI16x16x1_SN_LDSB0_CLR1_GRVWA4_GRVWB8_GSU0_GSUC0_GSUWGMRR0_K1_LBSPPA512_LBSPPB256_LPA32_LPB16_MIWT2_1_PLR1_SU0_SUM0_SUS128_VWA2_VWB1_WGM1_WGMXCC1_WGMXCCGn1
    SolutionIndex: 100
    SolutionNameMin: Cijk_Ailk_Bjlk_B8F8NBS_BH_Bias_HAS_SAV_UserArgs_MT64x32x128_MI16x16x1_SN_LDSB0_CLR1_GRVWA8_GRVWB8_GSU0_GSUC0_GSUWGMRR0_K1_LBSPPA512_LBSPPB256_LPA32_LPB16_MIWT2_1_PLR1_SU0_SUM0_SUS128_VWA2_VWB1_WGM1_WGMXCC1_WGMXCCGn1
    SolutionIndex: 101
    SolutionNameMin: Cijk_Ailk_Bjlk_B8F8NBS_BH_Bias_HAS_SAV_UserArgs_MT64x32x128_MI16x16x1_SN_LDSB0_CLR1_GRVWA8_GRVWB16_GSU0_GSUC0_GSUWGMRR0_K1_LBSPPA512_LBSPPB256_LPA32_LPB16_MIWT2_1_PLR1_SU0_SUM0_SUS128_VWA2_VWB1_WGM1_WGMXCC1_WGMXCCGn1
    SolutionIndex: 102
    SolutionNameMin: Cijk_Ailk_Bjlk_B8F8NBS_BH_Bias_HAS_SAV_UserArgs_MT64x32x128_MI16x16x1_SN_LDSB0_CLR1_GRVWA16_GRVWB16_GSU0_GSUC0_GSUWGMRR0_K1_LBSPPA512_LBSPPB256_LPA32_LPB16_MIWT2_1_PLR1_SU0_SUM0_SUS128_VWA2_VWB1_WGM1_WGMXCC1_WGMXCCGn1
    SolutionIndex: 103
    SolutionNameMin: Cijk_Ailk_Bjlk_B8F8NBS_BH_Bias_HAS_SAV_UserArgs_MT32x32x128_MI16x16x1_SN_LDSB0_CLR1_GRVWA4_GRVWB4_GSU0_GSUC0_GSUWGMRR0_K1_LBSPPA256_LBSPPB256_LPA16_LPB16_MIWT1_1_PLR1_SU0_SUM0_SUS128_VWA1_VWB1_WGM1_WGMXCC1_WGMXCCGn1
    SolutionIndex: 104
    SolutionNameMin: Cijk_Ailk_Bjlk_B8F8NBS_BH_Bias_HAS_SAV_UserArgs_MT32x32x128_MI16x16x1_SN_LDSB0_CLR1_GRVWA8_GRVWB4_GSU0_GSUC0_GSUWGMRR0_K1_LBSPPA256_LBSPPB256_LPA16_LPB16_MIWT1_1_PLR1_SU0_SUM0_SUS128_VWA1_VWB1_WGM1_WGMXCC1_WGMXCCGn1
    SolutionIndex: 105
    SolutionNameMin: Cijk_Ailk_Bjlk_B8F8NBS_BH_Bias_HAS_SAV_UserArgs_MT32x32x128_MI16x16x1_SN_LDSB0_CLR1_GRVWA4_GRVWB8_GSU0_GSUC0_GSUWGMRR0_K1_LBSPPA256_LBSPPB256_LPA16_LPB16_MIWT1_1_PLR1_SU0_SUM0_SUS128_VWA1_VWB1_WGM1_WGMXCC1_WGMXCCGn1
    SolutionIndex: 106
    SolutionNameMin: Cijk_Ailk_Bjlk_B8F8NBS_BH_Bias_HAS_SAV_UserArgs_MT32x32x128_MI16x16x1_SN_LDSB0_CLR1_GRVWA8_GRVWB8_GSU0_GSUC0_GSUWGMRR0_K1_LBSPPA256_LBSPPB256_LPA16_LPB16_MIWT1_1_PLR1_SU0_SUM0_SUS128_VWA1_VWB1_WGM1_WGMXCC1_WGMXCCGn1
    SolutionIndex: 107
    SolutionNameMin: Cijk_Ailk_Bjlk_B8F8NBS_BH_Bias_HAS_SAV_UserArgs_MT32x32x128_MI16x16x1_SN_LDSB0_CLR1_GRVWA4_GRVWB16_GSU0_GSUC0_GSUWGMRR0_K1_LBSPPA256_LBSPPB256_LPA16_LPB16_MIWT1_1_PLR1_SU0_SUM0_SUS128_VWA1_VWB1_WGM1_WGMXCC1_WGMXCCGn1
    SolutionIndex: 108
    SolutionNameMin: Cijk_Ailk_Bjlk_B8F8NBS_BH_Bias_HAS_SAV_UserArgs_MT32x32x128_MI16x16x1_SN_LDSB0_CLR1_GRVWA8_GRVWB16_GSU0_GSUC0_GSUWGMRR0_K1_LBSPPA256_LBSPPB256_LPA16_LPB16_MIWT1_1_PLR1_SU0_SUM0_SUS128_VWA1_VWB1_WGM1_WGMXCC1_WGMXCCGn1
    SolutionIndex: 109
    SolutionNameMin: Cijk_Ailk_Bjlk_B8F8NBS_BH_Bias_HAS_SAV_UserArgs_MT32x32x128_MI16x16x1_SN_LDSB0_CLR1_GRVWA4_GRVWB16_GSU0_GSUC0_GSUWGMRR0_K1_LBSPPA256_LBSPPB256_LPA16_LPB16_MIWT1_1_PLR1_SU0_SUM0_SUS128_VWA1_VWB1_WGM6_WGMXCC1_WGMXCCGn1
    SolutionIndex: 110
    SolutionNameMin: Cijk_Ailk_Bjlk_B8F8NBS_BH_Bias_HAS_SAV_UserArgs_MT128x64x256_MI16x16x1_SN_LDSB1_CLR1_GRVWA16_GRVWB16_GSU0_GSUC0_GSUWGMRR0_K1_LBSPPA1024_LBSPPB512_LPA64_LPB32_MIWT4_2_PLR1_SU0_SUM0_SUS256_VWA4_VWB2_WGM8_WGMXCC1_WGMXCCGn1
    SolutionIndex: 111
    SolutionNameMin: Cijk_Ailk_Bjlk_B8F8NBS_BH_Bias_HAS_SAV_UserArgs_MT64x64x256_MI16x16x1_SN_LDSB1_CLR1_GRVWA16_GRVWB16_GSU0_GSUC0_GSUWGMRR0_K1_LBSPPA512_LBSPPB512_LPA32_LPB32_MIWT2_2_PLR1_SU0_SUM0_SUS256_VWA2_VWB2_WGM1_WGMXCC1_WGMXCCGn1
    SolutionIndex: 112
    SolutionNameMin: Cijk_Ailk_Bjlk_B8F8NBS_BH_Bias_HAS_SAV_UserArgs_MT64x32x256_MI16x16x1_SN_LDSB1_CLR1_GRVWA16_GRVWB16_GSU0_GSUC0_GSUWGMRR0_K1_LBSPPA512_LBSPPB256_LPA32_LPB16_MIWT2_1_PLR1_SU0_SUM0_SUS256_VWA2_VWB1_WGM1_WGMXCC1_WGMXCCGn1
    SolutionIndex: 113
    SolutionNameMin: Cijk_Ailk_Bjlk_B8F8NBS_BH_Bias_HAS_SAV_UserArgs_MT64x32x256_MI16x16x1_SN_LDSB1_CLR1_GRVWA16_GRVWB16_GSU0_GSUC0_GSUWGMRR0_K1_LBSPPA512_LBSPPB256_LPA32_LPB16_MIWT2_1_PLR1_SU0_SUM0_SUS256_VWA2_VWB1_WGM4_WGMXCC1_WGMXCCGn1
    SolutionIndex: 114
    SolutionNameMin: Cijk_Ailk_Bjlk_B8F8NBS_BH_Bias_HAS_SAV_UserArgs_MT64x32x256_MI16x16x1_SN_LDSB1_CLR1_GRVWA16_GRVWB16_GSU0_GSUC0_GSUWGMRR0_K1_LBSPPA512_LBSPPB256_LPA32_LPB16_MIWT2_1_PLR1_SU0_SUM0_SUS256_VWA2_VWB1_WGM6_WGMXCC1_WGMXCCGn1
    SolutionIndex: 115
    SolutionNameMin: Cijk_Ailk_Bjlk_B8F8NBS_BH_Bias_HAS_SAV_UserArgs_MT32x32x256_MI16x16x1_SN_LDSB1_CLR1_GRVWA16_GRVWB16_GSU0_GSUC0_GSUWGMRR0_K1_LBSPPA256_LBSPPB256_LPA16_LPB16_MIWT1_1_PLR1_SU0_SUM0_SUS256_VWA1_VWB1_WGM1_WGMXCC1_WGMXCCGn1
    SolutionIndex: 116
    SolutionNameMin: Cijk_Ailk_Bjlk_B8F8NBS_BH_Bias_HAS_SAV_UserArgs_MT32x32x256_MI16x16x1_SN_LDSB1_CLR1_GRVWA16_GRVWB16_GSU0_GSUC0_GSUWGMRR0_K1_LBSPPA256_LBSPPB256_LPA16_LPB16_MIWT1_1_PLR1_SU0_SUM0_SUS256_VWA1_VWB1_WGM4_WGMXCC1_WGMXCCGn1
    SolutionIndex: 117
    SolutionNameMin: Cijk_Ailk_Bjlk_B8F8NBS_BH_Bias_HAS_SAV_UserArgs_MT32x32x256_MI16x16x1_SN_LDSB1_CLR1_GRVWA16_GRVWB16_GSU0_GSUC0_GSUWGMRR0_K1_LBSPPA256_LBSPPB256_LPA16_LPB16_MIWT1_1_PLR1_SU0_SUM0_SUS256_VWA1_VWB1_WGM6_WGMXCC1_WGMXCCGn1
- - - [128, 128, 1, 128, 128, 128, 128, 128]
    - [60, 0.51]
  - - [128, 128, 1, 256, 128, 128, 128, 128]
    - [60, 0.89]
  - - [128, 128, 1, 512, 128, 128, 128, 128]
    - [105, 1.48]
  - - [128, 128, 1, 1024, 128, 128, 128, 128]
    - [105, 2.19]
  - - [128, 128, 1, 2048, 128, 128, 128, 128]
    - [108, 2.94]
  - - [128, 128, 1, 4096, 128, 128, 128, 128]
    - [115, 3.51]
  - - [128, 128, 1, 8192, 128, 128, 128, 128]
    - [115, 3.95]
  - - [128, 256, 1, 128, 128, 128, 128, 256]
    - [103, 1.03]
  - - [128, 256, 1, 256, 128, 128, 128, 256]
    - [62, 1.8]
  - - [128, 256, 1, 512, 128, 128, 128, 256]
    - [105, 2.98]
  - - [128, 256, 1, 1024, 128, 128, 128, 256]
    - [106, 4.43]
  - - [128, 256, 1, 2048, 128, 128, 128, 256]
    - [108, 5.87]
  - - [128, 256, 1, 4096, 128, 128, 128, 256]
    - [108, 7.05]
  - - [128, 256, 1, 8192, 128, 128, 128, 256]
    - [115, 7.9]
  - - [128, 512, 1, 128, 128, 128, 128, 512]
    - [60, 2.05]
  - - [128, 512, 1, 256, 128, 128, 128, 512]
    - [103, 3.6]
  - - [128, 512, 1, 512, 128, 128, 128, 512]
    - [105, 5.85]
  - - [128, 512, 1, 1024, 128, 128, 128, 512]
    - [106, 8.73]
  - - [128, 512, 1, 2048, 128, 128, 128, 512]
    - [108, 11.52]
  - - [128, 512, 1, 4096, 128, 128, 128, 512]
    - [108, 13.96]
  - - [128, 512, 1, 8192, 128, 128, 128, 512]
    - [115, 14.87]
  - - [128, 1024, 1, 128, 128, 128, 128, 1024]
    - [62, 4.0]
  - - [128, 1024, 1, 256, 128, 128, 128, 1024]
    - [60, 6.99]
  - - [128, 1024, 1, 512, 128, 128, 128, 1024]
    - [104, 11.32]
  - - [128, 1024, 1, 1024, 128, 128, 128, 1024]
    - [106, 16.88]
  - - [128, 1024, 1, 2048, 128, 128, 128, 1024]
    - [106, 22.69]
  - - [128, 1024, 1, 4096, 128, 128, 128, 1024]
    - [115, 26.15]
  - - [128, 1024, 1, 8192, 128, 128, 128, 1024]
    - [109, 27.68]
  - - [128, 2048, 1, 128, 128, 128, 128, 2048]
    - [57, 7.48]
  - - [128, 2048, 1, 256, 128, 128, 128, 2048]
    - [57, 12.98]
  - - [128, 2048, 1, 512, 128, 128, 128, 2048]
    - [98, 20.88]
  - - [128, 2048, 1, 1024, 128, 128, 128, 2048]
    - [102, 30.35]
  - - [128, 2048, 1, 2048, 128, 128, 128, 2048]
    - [112, 38.63]
  - - [128, 2048, 1, 4096, 128, 128, 128, 2048]
    - [114, 47.03]
  - - [128, 2048, 1, 8192, 128, 128, 128, 2048]
    - [114, 53.39]
  - - [128, 4096, 1, 128, 128, 128, 128, 4096]
    - [54, 13.47]
  - - [128, 4096, 1, 256, 128, 128, 128, 4096]
    - [53, 23.24]
  - - [128, 4096, 1, 512, 128, 128, 128, 4096]
    - [86, 36.73]
  - - [128, 4096, 1, 1024, 128, 128, 128, 4096]
    - [87, 53.6]
  - - [128, 4096, 1, 2048, 128, 128, 128, 4096]
    - [111, 67.1]
  - - [128, 4096, 1, 4096, 128, 128, 128, 4096]
    - [111, 82.01]
  - - [128, 4096, 1, 8192, 128, 128, 128, 4096]
    - [111, 90.83]
  - - [128, 8192, 1, 128, 128, 128, 128, 8192]
    - [51, 23.05]
  - - [128, 8192, 1, 256, 128, 128, 128, 8192]
    - [50, 39.18]
  - - [128, 8192, 1, 512, 128, 128, 128, 8192]
    - [51, 61.38]
  - - [128, 8192, 1, 1024, 128, 128, 128, 8192]
    - [48, 86.04]
  - - [128, 8192, 1, 2048, 128, 128, 128, 8192]
    - [82, 106.09]
  - - [128, 8192, 1, 4096, 128, 128, 128, 8192]
    - [110, 124.31]
  - - [128, 8192, 1, 8192, 128, 128, 128, 8192]
    - [85, 128.47]
  - - [256, 128, 1, 128, 256, 256, 256, 128]
    - [60, 1.04]
  - - [256, 128, 1, 256, 256, 256, 256, 128]
    - [60, 1.82]
  - - [256, 128, 1, 512, 256, 256, 256, 128]
    - [106, 2.96]
  - - [256, 128, 1, 1024, 256, 256, 256, 128]
    - [108, 4.44]
  - - [256, 128, 1, 2048, 256, 256, 256, 128]
    - [108, 5.88]
  - - [256, 128, 1, 4096, 256, 256, 256, 128]
    - [108, 7.08]
  - - [256, 128, 1, 8192, 256, 256, 256, 128]
    - [115, 7.91]
  - - [256, 256, 1, 128, 256, 256, 256, 256]
    - [103, 2.05]
  - - [256, 256, 1, 256, 256, 256, 256, 256]
    - [61, 3.6]
  - - [256, 256, 1, 512, 256, 256, 256, 256]
    - [106, 5.9]
  - - [256, 256, 1, 1024, 256, 256, 256, 256]
    - [106, 8.86]
  - - [256, 256, 1, 2048, 256, 256, 256, 256]
    - [108, 11.71]
  - - [256, 256, 1, 4096, 256, 256, 256, 256]
    - [108, 14.06]
  - - [256, 256, 1, 8192, 256, 256, 256, 256]
    - [115, 15.65]
  - - [256, 512, 1, 128, 256, 256, 256, 512]
    - [62, 4.03]
  - - [256, 512, 1, 256, 256, 256, 256, 512]
    - [60, 7.11]
  - - [256, 512, 1, 512, 256, 256, 256, 512]
    - [106, 11.45]
  - - [256, 512, 1, 1024, 256, 256, 256, 512]
    - [106, 17.13]
  - - [256, 512, 1, 2048, 256, 256, 256, 512]
    - [108, 22.88]
  - - [256, 512, 1, 4096, 256, 256, 256, 512]
    - [108, 27.44]
  - - [256, 512, 1, 8192, 256, 256, 256, 512]
    - [115, 30.56]
  - - [256, 1024, 1, 128, 256, 256, 256, 1024]
    - [58, 7.44]
  - - [256, 1024, 1, 256, 256, 256, 256, 1024]
    - [57, 12.97]
  - - [256, 1024, 1, 512, 256, 256, 256, 1024]
    - [99, 21.12]
  - - [256, 1024, 1, 1024, 256, 256, 256, 1024]
    - [94, 30.69]
  - - [256, 1024, 1, 2048, 256, 256, 256, 1024]
    - [112, 40.66]
  - - [256, 1024, 1, 4096, 256, 256, 256, 1024]
    - [112, 48.56]
  - - [256, 1024, 1, 8192, 256, 256, 256, 1024]
    - [114, 53.83]
  - - [256, 2048, 1, 128, 256, 256, 256, 2048]
    - [52, 13.49]
  - - [256, 2048, 1, 256, 256, 256, 256, 2048]
    - [53, 23.18]
  - - [256, 2048, 1, 512, 256, 256, 256, 2048]
    - [55, 36.86]
  - - [256, 2048, 1, 1024, 256, 256, 256, 2048]
    - [87, 53.34]
  - - [256, 2048, 1, 2048, 256, 256, 256, 2048]
    - [87, 67.33]
  - - [256, 2048, 1, 4096, 256, 256, 256, 2048]
    - [88, 79.0]
  - - [256, 2048, 1, 8192, 256, 256, 256, 2048]
    - [111, 86.4]
  - - [256, 4096, 1, 128, 256, 256, 256, 4096]
    - [46, 22.57]
  - - [256, 4096, 1, 256, 256, 256, 256, 4096]
    - [51, 39.29]
  - - [256, 4096, 1, 512, 256, 256, 256, 4096]
    - [48, 61.1]
  - - [256, 4096, 1, 1024, 256, 256, 256, 4096]
    - [48, 86.31]
  - - [256, 4096, 1, 2048, 256, 256, 256, 4096]
    - [82, 106.6]
  - - [256, 4096, 1, 4096, 256, 256, 256, 4096]
    - [82, 124.82]
  - - [256, 4096, 1, 8192, 256, 256, 256, 4096]
    - [110, 129.97]
  - - [256, 8192, 1, 128, 256, 256, 256, 8192]
    - [34, 34.99]
  - - [256, 8192, 1, 256, 256, 256, 256, 8192]
    - [34, 58.56]
  - - [256, 8192, 1, 512, 256, 256, 256, 8192]
    - [38, 90.19]
  - - [256, 8192, 1, 1024, 256, 256, 256, 8192]
    - [79, 126.46]
  - - [256, 8192, 1, 2048, 256, 256, 256, 8192]
    - [79, 155.27]
  - - [256, 8192, 1, 4096, 256, 256, 256, 8192]
    - [79, 174.71]
  - - [256, 8192, 1, 8192, 256, 256, 256, 8192]
    - [81, 163.22]
  - - [512, 128, 1, 128, 512, 512, 512, 128]
    - [60, 1.99]
  - - [512, 128, 1, 256, 512, 512, 512, 128]
    - [60, 3.6]
  - - [512, 128, 1, 512, 512, 512, 512, 128]
    - [103, 5.82]
  - - [512, 128, 1, 1024, 512, 512, 512, 128]
    - [107, 8.72]
  - - [512, 128, 1, 2048, 512, 512, 512, 128]
    - [108, 11.61]
  - - [512, 128, 1, 4096, 512, 512, 512, 128]
    - [108, 13.94]
  - - [512, 128, 1, 8192, 512, 512, 512, 128]
    - [117, 14.73]
  - - [512, 256, 1, 128, 512, 512, 512, 256]
    - [60, 3.97]
  - - [512, 256, 1, 256, 512, 512, 512, 256]
    - [63, 6.97]
  - - [512, 256, 1, 512, 512, 512, 512, 256]
    - [103, 11.34]
  - - [512, 256, 1, 1024, 512, 512, 512, 256]
    - [106, 17.07]
  - - [512, 256, 1, 2048, 512, 512, 512, 256]
    - [108, 22.75]
  - - [512, 256, 1, 4096, 512, 512, 512, 256]
    - [108, 27.6]
  - - [512, 256, 1, 8192, 512, 512, 512, 256]
    - [116, 28.08]
  - - [512, 512, 1, 128, 512, 512, 512, 512]
    - [59, 7.36]
  - - [512, 512, 1, 256, 512, 512, 512, 512]
    - [98, 12.72]
  - - [512, 512, 1, 512, 512, 512, 512, 512]
    - [98, 20.68]
  - - [512, 512, 1, 1024, 512, 512, 512, 512]
    - [100, 30.26]
  - - [512, 512, 1, 2048, 512, 512, 512, 512]
    - [112, 40.2]
  - - [512, 512, 1, 4096, 512, 512, 512, 512]
    - [112, 47.12]
  - - [512, 512, 1, 8192, 512, 512, 512, 512]
    - [95, 50.19]
  - - [512, 1024, 1, 128, 512, 512, 512, 1024]
    - [53, 13.49]
  - - [512, 1024, 1, 256, 512, 512, 512, 1024]
    - [53, 23.34]
  - - [512, 1024, 1, 512, 512, 512, 512, 1024]
    - [87, 36.78]
  - - [512, 1024, 1, 1024, 512, 512, 512, 1024]
    - [87, 53.14]
  - - [512, 1024, 1, 2048, 512, 512, 512, 1024]
    - [88, 68.83]
  - - [512, 1024, 1, 4096, 512, 512, 512, 1024]
    - [88, 76.18]
  - - [512, 1024, 1, 8192, 512, 512, 512, 1024]
    - [91, 80.63]
  - - [512, 2048, 1, 128, 512, 512, 512, 2048]
    - [50, 22.66]
  - - [512, 2048, 1, 256, 512, 512, 512, 2048]
    - [51, 38.93]
  - - [512, 2048, 1, 512, 512, 512, 512, 2048]
    - [48, 61.11]
  - - [512, 2048, 1, 1024, 512, 512, 512, 2048]
    - [48, 85.8]
  - - [512, 2048, 1, 2048, 512, 512, 512, 2048]
    - [48, 106.64]
  - - [512, 2048, 1, 4096, 512, 512, 512, 2048]
    - [84, 123.72]
  - - [512, 2048, 1, 8192, 512, 512, 512, 2048]
    - [84, 128.26]
  - - [512, 4096, 1, 128, 512, 512, 512, 4096]
    - [34, 34.93]
  - - [512, 4096, 1, 256, 512, 512, 512, 4096]
    - [34, 58.49]
  - - [512, 4096, 1, 512, 512, 512, 512, 4096]
    - [78, 90.44]
  - - [512, 4096, 1, 1024, 512, 512, 512, 4096]
    - [79, 127.26]
  - - [512, 4096, 1, 2048, 512, 512, 512, 4096]
    - [39, 154.55]
  - - [512, 4096, 1, 4096, 512, 512, 512, 4096]
    - [39, 173.17]
  - - [512, 4096, 1, 8192, 512, 512, 512, 4096]
    - [39, 162.92]
  - - [512, 8192, 1, 128, 512, 512, 512, 8192]
    - [25, 49.37]
  - - [512, 8192, 1, 256, 512, 512, 512, 8192]
    - [27, 84.43]
  - - [512, 8192, 1, 512, 512, 512, 512, 8192]
    - [27, 131.51]
  - - [512, 8192, 1, 1024, 512, 512, 512, 8192]
    - [27, 179.11]
  - - [512, 8192, 1, 2048, 512, 512, 512, 8192]
    - [28, 216.3]
  - - [512, 8192, 1, 4096, 512, 512, 512, 8192]
    - [76, 223.66]
  - - [512, 8192, 1, 8192, 512, 512, 512, 8192]
    - [77, 212.24]
  - - [1024, 128, 1, 128, 1024, 1024, 1024, 128]
    - [60, 3.98]
  - - [1024, 128, 1, 256, 1024, 1024, 1024, 128]
    - [103, 6.94]
  - - [1024, 128, 1, 512, 1024, 1024, 1024, 128]
    - [108, 11.42]
  - - [1024, 128, 1, 1024, 1024, 1024, 1024, 128]
    - [107, 17.18]
  - - [1024, 128, 1, 2048, 1024, 1024, 1024, 128]
    - [108, 22.79]
  - - [1024, 128, 1, 4096, 1024, 1024, 1024, 128]
    - [117, 25.48]
  - - [1024, 128, 1, 8192, 1024, 1024, 1024, 128]
    - [117, 26.61]
  - - [1024, 256, 1, 128, 1024, 1024, 1024, 256]
    - [57, 7.53]
  - - [1024, 256, 1, 256, 1024, 1024, 1024, 256]
    - [58, 12.79]
  - - [1024, 256, 1, 512, 1024, 1024, 1024, 256]
    - [98, 21.0]
  - - [1024, 256, 1, 1024, 1024, 1024, 1024, 256]
    - [101, 30.79]
  - - [1024, 256, 1, 2048, 1024, 1024, 1024, 256]
    - [112, 40.84]
  - - [1024, 256, 1, 4096, 1024, 1024, 1024, 256]
    - [97, 46.36]
  - - [1024, 256, 1, 8192, 1024, 1024, 1024, 256]
    - [113, 49.16]
  - - [1024, 512, 1, 128, 1024, 1024, 1024, 512]
    - [53, 13.33]
  - - [1024, 512, 1, 256, 1024, 1024, 1024, 512]
    - [53, 23.11]
  - - [1024, 512, 1, 512, 1024, 1024, 1024, 512]
    - [55, 36.84]
  - - [1024, 512, 1, 1024, 1024, 1024, 1024, 512]
    - [87, 52.84]
  - - [1024, 512, 1, 2048, 1024, 1024, 1024, 512]
    - [88, 68.59]
  - - [1024, 512, 1, 4096, 1024, 1024, 1024, 512]
    - [91, 75.65]
  - - [1024, 512, 1, 8192, 1024, 1024, 1024, 512]
    - [91, 81.39]
  - - [1024, 1024, 1, 128, 1024, 1024, 1024, 1024]
    - [46, 22.83]
  - - [1024, 1024, 1, 256, 1024, 1024, 1024, 1024]
    - [47, 39.03]
  - - [1024, 1024, 1, 512, 1024, 1024, 1024, 1024]
    - [48, 61.2]
  - - [1024, 1024, 1, 1024, 1024, 1024, 1024, 1024]
    - [82, 85.98]
  - - [1024, 1024, 1, 2048, 1024, 1024, 1024, 1024]
    - [82, 106.77]
  - - [1024, 1024, 1, 4096, 1024, 1024, 1024, 1024]
    - [83, 123.06]
  - - [1024, 1024, 1, 8192, 1024, 1024, 1024, 1024]
    - [84, 127.93]
  - - [1024, 2048, 1, 128, 1024, 1024, 1024, 2048]
    - [34, 34.41]
  - - [1024, 2048, 1, 256, 1024, 1024, 1024, 2048]
    - [34, 58.71]
  - - [1024, 2048, 1, 512, 1024, 1024, 1024, 2048]
    - [38, 89.76]
  - - [1024, 2048, 1, 1024, 1024, 1024, 1024, 2048]
    - [39, 123.89]
  - - [1024, 2048, 1, 2048, 1024, 1024, 1024, 2048]
    - [39, 154.56]
  - - [1024, 2048, 1, 4096, 1024, 1024, 1024, 2048]
    - [42, 170.85]
  - - [1024, 2048, 1, 8192, 1024, 1024, 1024, 2048]
    - [41, 162.74]
  - - [1024, 4096, 1, 128, 1024, 1024, 1024, 4096]
    - [31, 51.53]
  - - [1024, 4096, 1, 256, 1024, 1024, 1024, 4096]
    - [31, 87.28]
  - - [1024, 4096, 1, 512, 1024, 1024, 1024, 4096]
    - [32, 131.78]
  - - [1024, 4096, 1, 1024, 1024, 1024, 1024, 4096]
    - [27, 180.14]
  - - [1024, 4096, 1, 2048, 1024, 1024, 1024, 4096]
    - [26, 219.5]
  - - [1024, 4096, 1, 4096, 1024, 1024, 1024, 4096]
    - [74, 222.13]
  - - [1024, 4096, 1, 8192, 1024, 1024, 1024, 4096]
    - [75, 210.38]
  - - [1024, 8192, 1, 128, 1024, 1024, 1024, 8192]
    - [23, 65.79]
  - - [1024, 8192, 1, 256, 1024, 1024, 1024, 8192]
    - [23, 109.97]
  - - [1024, 8192, 1, 512, 1024, 1024, 1024, 8192]
    - [23, 158.52]
  - - [1024, 8192, 1, 1024, 1024, 1024, 1024, 8192]
    - [14, 216.29]
  - - [1024, 8192, 1, 2048, 1024, 1024, 1024, 8192]
    - [4, 248.06]
  - - [1024, 8192, 1, 4096, 1024, 1024, 1024, 8192]
    - [4, 241.6]
  - - [1024, 8192, 1, 8192, 1024, 1024, 1024, 8192]
    - [8, 259.11]
  - - [2048, 128, 1, 128, 2048, 2048, 2048, 128]
    - [57, 7.38]
  - - [2048, 128, 1, 256, 2048, 2048, 2048, 128]
    - [98, 12.76]
  - - [2048, 128, 1, 512, 2048, 2048, 2048, 128]
    - [99, 20.9]
  - - [2048, 128, 1, 1024, 2048, 2048, 2048, 128]
    - [101, 30.48]
  - - [2048, 128, 1, 2048, 2048, 2048, 2048, 128]
    - [96, 37.69]
  - - [2048, 128, 1, 4096, 2048, 2048, 2048, 128]
    - [97, 45.32]
  - - [2048, 128, 1, 8192, 2048, 2048, 2048, 128]
    - [96, 50.67]
  - - [2048, 256, 1, 128, 2048, 2048, 2048, 256]
    - [56, 13.26]
  - - [2048, 256, 1, 256, 2048, 2048, 2048, 256]
    - [53, 22.91]
  - - [2048, 256, 1, 512, 2048, 2048, 2048, 256]
    - [89, 36.32]
  - - [2048, 256, 1, 1024, 2048, 2048, 2048, 256]
    - [92, 53.01]
  - - [2048, 256, 1, 2048, 2048, 2048, 2048, 256]
    - [92, 67.12]
  - - [2048, 256, 1, 4096, 2048, 2048, 2048, 256]
    - [90, 77.83]
  - - [2048, 256, 1, 8192, 2048, 2048, 2048, 256]
    - [91, 85.28]
  - - [2048, 512, 1, 128, 2048, 2048, 2048, 512]
    - [47, 22.41]
  - - [2048, 512, 1, 256, 2048, 2048, 2048, 512]
    - [46, 39.13]
  - - [2048, 512, 1, 512, 2048, 2048, 2048, 512]
    - [48, 61.21]
  - - [2048, 512, 1, 1024, 2048, 2048, 2048, 512]
    - [84, 85.2]
  - - [2048, 512, 1, 2048, 2048, 2048, 2048, 512]
    - [49, 106.12]
  - - [2048, 512, 1, 4096, 2048, 2048, 2048, 512]
    - [83, 122.55]
  - - [2048, 512, 1, 8192, 2048, 2048, 2048, 512]
    - [85, 128.13]
  - - [2048, 1024, 1, 128, 2048, 2048, 2048, 1024]
    - [34, 34.85]
  - - [2048, 1024, 1, 256, 2048, 2048, 2048, 1024]
    - [35, 58.83]
  - - [2048, 1024, 1, 512, 2048, 2048, 2048, 1024]
    - [79, 90.3]
  - - [2048, 1024, 1, 1024, 2048, 2048, 2048, 1024]
    - [79, 123.5]
  - - [2048, 1024, 1, 2048, 2048, 2048, 2048, 1024]
    - [45, 154.19]
  - - [2048, 1024, 1, 4096, 2048, 2048, 2048, 1024]
    - [41, 172.31]
  - - [2048, 1024, 1, 8192, 2048, 2048, 2048, 1024]
    - [40, 163.48]
  - - [2048, 2048, 1, 128, 2048, 2048, 2048, 2048]
    - [24, 49.4]
  - - [2048, 2048, 1, 256, 2048, 2048, 2048, 2048]
    - [27, 83.68]
  - - [2048, 2048, 1, 512, 2048, 2048, 2048, 2048]
    - [27, 130.51]
  - - [2048, 2048, 1, 1024, 2048, 2048, 2048, 2048]
    - [29, 177.72]
  - - [2048, 2048, 1, 2048, 2048, 2048, 2048, 2048]
    - [29, 214.23]
  - - [2048, 2048, 1, 4096, 2048, 2048, 2048, 2048]
    - [69, 220.06]
  - - [2048, 2048, 1, 8192, 2048, 2048, 2048, 2048]
    - [71, 211.61]
  - - [2048, 4096, 1, 128, 2048, 2048, 2048, 4096]
    - [2, 58.45]
  - - [2048, 4096, 1, 256, 2048, 2048, 2048, 4096]
    - [0, 98.86]
  - - [2048, 4096, 1, 512, 2048, 2048, 2048, 4096]
    - [4, 155.26]
  - - [2048, 4096, 1, 1024, 2048, 2048, 2048, 4096]
    - [4, 210.56]
  - - [2048, 4096, 1, 2048, 2048, 2048, 2048, 4096]
    - [4, 247.21]
  - - [2048, 4096, 1, 4096, 2048, 2048, 2048, 4096]
    - [67, 239.97]
  - - [2048, 4096, 1, 8192, 2048, 2048, 2048, 4096]
    - [2, 256.67]
  - - [2048, 8192, 1, 128, 2048, 2048, 2048, 8192]
    - [21, 66.96]
  - - [2048, 8192, 1, 256, 2048, 2048, 2048, 8192]
    - [2, 112.31]
  - - [2048, 8192, 1, 512, 2048, 2048, 2048, 8192]
    - [0, 169.16]
  - - [2048, 8192, 1, 1024, 2048, 2048, 2048, 8192]
    - [3, 201.19]
  - - [2048, 8192, 1, 2048, 2048, 2048, 2048, 8192]
    - [16, 222.19]
  - - [2048, 8192, 1, 4096, 2048, 2048, 2048, 8192]
    - [12, 268.78]
  - - [2048, 8192, 1, 8192, 2048, 2048, 2048, 8192]
    - [67, 321.99]
  - - [4096, 128, 1, 128, 4096, 4096, 4096, 128]
    - [53, 13.59]
  - - [4096, 128, 1, 256, 4096, 4096, 4096, 128]
    - [53, 23.16]
  - - [4096, 128, 1, 512, 4096, 4096, 4096, 128]
    - [53, 37.25]
  - - [4096, 128, 1, 1024, 4096, 4096, 4096, 128]
    - [87, 53.41]
  - - [4096, 128, 1, 2048, 4096, 4096, 4096, 128]
    - [93, 65.71]
  - - [4096, 128, 1, 4096, 4096, 4096, 4096, 128]
    - [91, 77.87]
  - - [4096, 128, 1, 8192, 4096, 4096, 4096, 128]
    - [91, 84.29]
  - - [4096, 256, 1, 128, 4096, 4096, 4096, 256]
    - [51, 22.72]
  - - [4096, 256, 1, 256, 4096, 4096, 4096, 256]
    - [46, 39.27]
  - - [4096, 256, 1, 512, 4096, 4096, 4096, 256]
    - [51, 61.02]
  - - [4096, 256, 1, 1024, 4096, 4096, 4096, 256]
    - [84, 85.16]
  - - [4096, 256, 1, 2048, 4096, 4096, 4096, 256]
    - [85, 106.01]
  - - [4096, 256, 1, 4096, 4096, 4096, 4096, 256]
    - [85, 124.39]
  - - [4096, 256, 1, 8192, 4096, 4096, 4096, 256]
    - [83, 130.76]
  - - [4096, 512, 1, 128, 4096, 4096, 4096, 512]
    - [34, 34.75]
  - - [4096, 512, 1, 256, 4096, 4096, 4096, 512]
    - [34, 58.21]
  - - [4096, 512, 1, 512, 4096, 4096, 4096, 512]
    - [44, 88.65]
  - - [4096, 512, 1, 1024, 4096, 4096, 4096, 512]
    - [45, 122.66]
  - - [4096, 512, 1, 2048, 4096, 4096, 4096, 512]
    - [43, 153.3]
  - - [4096, 512, 1, 4096, 4096, 4096, 4096, 512]
    - [45, 173.56]
  - - [4096, 512, 1, 8192, 4096, 4096, 4096, 512]
    - [44, 163.06]
  - - [4096, 1024, 1, 128, 4096, 4096, 4096, 1024]
    - [30, 49.86]
  - - [4096, 1024, 1, 256, 4096, 4096, 4096, 1024]
    - [33, 84.33]
  - - [4096, 1024, 1, 512, 4096, 4096, 4096, 1024]
    - [33, 129.88]
  - - [4096, 1024, 1, 1024, 4096, 4096, 4096, 1024]
    - [32, 176.59]
  - - [4096, 1024, 1, 2048, 4096, 4096, 4096, 1024]
    - [33, 215.21]
  - - [4096, 1024, 1, 4096, 4096, 4096, 4096, 1024]
    - [19, 223.13]
  - - [4096, 1024, 1, 8192, 4096, 4096, 4096, 1024]
    - [72, 211.99]
  - - [4096, 2048, 1, 128, 4096, 4096, 4096, 2048]
    - [2, 57.05]
  - - [4096, 2048, 1, 256, 4096, 4096, 4096, 2048]
    - [4, 97.74]
  - - [4096, 2048, 1, 512, 4096, 4096, 4096, 2048]
    - [4, 151.53]
  - - [4096, 2048, 1, 1024, 4096, 4096, 4096, 2048]
    - [12, 207.82]
  - - [4096, 2048, 1, 2048, 4096, 4096, 4096, 2048]
    - [9, 243.33]
  - - [4096, 2048, 1, 4096, 4096, 4096, 4096, 2048]
    - [8, 239.55]
  - - [4096, 2048, 1, 8192, 4096, 4096, 4096, 2048]
    - [73, 259.49]
  - - [4096, 4096, 1, 128, 4096, 4096, 4096, 4096]
    - [2, 64.35]
  - - [4096, 4096, 1, 256, 4096, 4096, 4096, 4096]
    - [0, 109.84]
  - - [4096, 4096, 1, 512, 4096, 4096, 4096, 4096]
    - [0, 164.52]
  - - [4096, 4096, 1, 1024, 4096, 4096, 4096, 4096]
    - [9, 201.17]
  - - [4096, 4096, 1, 2048, 4096, 4096, 4096, 4096]
    - [15, 223.24]
  - - [4096, 4096, 1, 4096, 4096, 4096, 4096, 4096]
    - [10, 271.01]
  - - [4096, 4096, 1, 8192, 4096, 4096, 4096, 4096]
    - [68, 322.11]
  - - [4096, 8192, 1, 128, 4096, 4096, 4096, 8192]
    - [20, 72.6]
  - - [4096, 8192, 1, 256, 4096, 4096, 4096, 8192]
    - [22, 113.91]
  - - [4096, 8192, 1, 512, 4096, 4096, 4096, 8192]
    - [27, 165.51]
  - - [4096, 8192, 1, 1024, 4096, 4096, 4096, 8192]
    - [32, 203.57]
  - - [4096, 8192, 1, 2048, 4096, 4096, 4096, 8192]
    - [1, 260.54]
  - - [4096, 8192, 1, 4096, 4096, 4096, 4096, 8192]
    - [4, 300.81]
  - - [4096, 8192, 1, 8192, 4096, 4096, 4096, 8192]
    - [65, 339.59]
  - - [8192, 128, 1, 128, 8192, 8192, 8192, 128]
    - [51, 22.65]
  - - [8192, 128, 1, 256, 8192, 8192, 8192, 128]
    - [50, 39.15]
  - - [8192, 128, 1, 512, 8192, 8192, 8192, 128]
    - [51, 60.74]
  - - [8192, 128, 1, 1024, 8192, 8192, 8192, 128]
    - [82, 84.08]
  - - [8192, 128, 1, 2048, 8192, 8192, 8192, 128]
    - [82, 104.68]
  - - [8192, 128, 1, 4096, 8192, 8192, 8192, 128]
    - [85, 123.14]
  - - [8192, 128, 1, 8192, 8192, 8192, 8192, 128]
    - [85, 125.52]
  - - [8192, 256, 1, 128, 8192, 8192, 8192, 256]
    - [36, 34.27]
  - - [8192, 256, 1, 256, 8192, 8192, 8192, 256]
    - [37, 57.36]
  - - [8192, 256, 1, 512, 8192, 8192, 8192, 256]
    - [80, 88.86]
  - - [8192, 256, 1, 1024, 8192, 8192, 8192, 256]
    - [42, 123.5]
  - - [8192, 256, 1, 2048, 8192, 8192, 8192, 256]
    - [43, 153.16]
  - - [8192, 256, 1, 4096, 8192, 8192, 8192, 256]
    - [42, 170.02]
  - - [8192, 256, 1, 8192, 8192, 8192, 8192, 256]
    - [42, 164.36]
  - - [8192, 512, 1, 128, 8192, 8192, 8192, 512]
    - [24, 48.86]
  - - [8192, 512, 1, 256, 8192, 8192, 8192, 512]
    - [24, 82.87]
  - - [8192, 512, 1, 512, 8192, 8192, 8192, 512]
    - [33, 128.87]
  - - [8192, 512, 1, 1024, 8192, 8192, 8192, 512]
    - [28, 176.08]
  - - [8192, 512, 1, 2048, 8192, 8192, 8192, 512]
    - [28, 216.0]
  - - [8192, 512, 1, 4096, 8192, 8192, 8192, 512]
    - [18, 225.75]
  - - [8192, 512, 1, 8192, 8192, 8192, 8192, 512]
    - [70, 210.53]
  - - [8192, 1024, 1, 128, 8192, 8192, 8192, 1024]
    - [11, 55.89]
  - - [8192, 1024, 1, 256, 8192, 8192, 8192, 1024]
    - [13, 96.28]
  - - [8192, 1024, 1, 512, 8192, 8192, 8192, 1024]
    - [6, 150.33]
  - - [8192, 1024, 1, 1024, 8192, 8192, 8192, 1024]
    - [8, 207.16]
  - - [8192, 1024, 1, 2048, 8192, 8192, 8192, 1024]
    - [5, 242.88]
  - - [8192, 1024, 1, 4096, 8192, 8192, 8192, 1024]
    - [14, 241.42]
  - - [8192, 1024, 1, 8192, 8192, 8192, 8192, 1024]
    - [17, 269.8]
  - - [8192, 2048, 1, 128, 8192, 8192, 8192, 2048]
    - [4, 61.19]
  - - [8192, 2048, 1, 256, 8192, 8192, 8192, 2048]
    - [0, 105.34]
  - - [8192, 2048, 1, 512, 8192, 8192, 8192, 2048]
    - [0, 159.26]
  - - [8192, 2048, 1, 1024, 8192, 8192, 8192, 2048]
    - [7, 202.0]
  - - [8192, 2048, 1, 2048, 8192, 8192, 8192, 2048]
    - [16, 219.59]
  - - [8192, 2048, 1, 4096, 8192, 8192, 8192, 2048]
    - [4, 275.79]
  - - [8192, 2048, 1, 8192, 8192, 8192, 8192, 2048]
    - [64, 325.18]
  - - [8192, 4096, 1, 128, 8192, 8192, 8192, 4096]
    - [2, 66.78]
  - - [8192, 4096, 1, 256, 8192, 8192, 8192, 4096]
    - [1, 107.93]
  - - [8192, 4096, 1, 512, 8192, 8192, 8192, 4096]
    - [29, 162.31]
  - - [8192, 4096, 1, 1024, 8192, 8192, 8192, 4096]
    - [33, 203.29]
  - - [8192, 4096, 1, 2048, 8192, 8192, 8192, 4096]
    - [12, 259.26]
  - - [8192, 4096, 1, 4096, 8192, 8192, 8192, 4096]
    - [4, 288.05]
  - - [8192, 4096, 1, 8192, 8192, 8192, 8192, 4096]
    - [68, 330.85]
  - - [8192, 8192, 1, 128, 8192, 8192, 8192, 8192]
    - [20, 64.84]
  - - [8192, 8192, 1, 256, 8192, 8192, 8192, 8192]
    - [24, 107.37]
  - - [8192, 8192, 1, 512, 8192, 8192, 8192, 8192]
    - [4, 168.65]
  - - [8192, 8192, 1, 1024, 8192, 8192, 8192, 8192]
    - [10, 228.55]
  - - [8192, 8192, 1, 2048, 8192, 8192, 8192, 8192]
    - [67, 288.94]
  - - [8192, 8192, 1, 4096, 8192, 8192, 8192, 8192]
    - [66, 333.56]
  - - [8192, 8192, 1, 8192, 8192, 8192, 8192, 8192]
    - [4, 336.22]
- null
- null
- ExperimentalStreamK
- GridBased
