projects/hipblaslt/library/src/amd_detail/rocblaslt/src/Tensile/Logic/asm_full/aquavanjaram/gfx942_228cu/StreamK/aquavanjaram942_Cijk_Alik_Bjlk_F8NF8NS_BH_Bias_HAS_SAV_UserArgs.yaml
- {MinimumRequiredVersion: 4.33.0}
- aquavanjaram942
- {Architecture: gfx942, CUCount: 228}
- [Device 0049, Device 0050]
    SolutionIndex: 0
    SolutionNameMin: Cijk_Alik_Bjlk_F8NF8NS_BH_Bias_HAS_SAV_UserArgs_MT256x256x64_MI16x16x1_SN_LDSB1_CLR1_GRVWA16_GRVWB8_GSU0_GSUC0_GSUWGMRR0_K1_LBSPPA512_LBSPPB2048_LPA16_LPB0_LRVW8_MIWT8_8_PLR1_SU0_SUM0_SUS64_VWA8_VWB8_WGM1_WGMXCC1_WGMXCCGn1
    SolutionIndex: 1
    SolutionNameMin: Cijk_Alik_Bjlk_F8NF8NS_BH_Bias_HAS_SAV_UserArgs_MT256x256x64_MI16x16x1_SN_LDSB1_CLR1_GRVWA8_GRVWB16_GSU0_GSUC0_GSUWGMRR0_K1_LBSPPA512_LBSPPB2048_LPA8_LPB0_LRVW8_MIWT8_8_PLR1_SU0_SUM0_SUS64_VWA8_VWB8_WGM1_WGMXCC1_WGMXCCGn1
    SolutionIndex: 2
    SolutionNameMin: Cijk_Alik_Bjlk_F8NF8NS_BH_Bias_HAS_SAV_UserArgs_MT256x256x64_MI16x16x1_SN_LDSB1_CLR1_GRVWA16_GRVWB16_GSU0_GSUC0_GSUWGMRR0_K1_LBSPPA512_LBSPPB2048_LPA16_LPB0_LRVW8_MIWT8_8_PLR1_SU0_SUM0_SUS64_VWA8_VWB8_WGM1_WGMXCC1_WGMXCCGn1
    SolutionIndex: 3
    SolutionNameMin: Cijk_Alik_Bjlk_F8NF8NS_BH_Bias_HAS_SAV_UserArgs_MT256x256x64_MI16x16x1_SN_LDSB1_CLR1_GRVWA8_GRVWB16_GSU0_GSUC0_GSUWGMRR0_K1_LBSPPA512_LBSPPB2048_LPA8_LPB0_LRVW8_MIWT8_8_PLR1_SU0_SUM0_SUS64_VWA8_VWB8_WGM4_WGMXCC1_WGMXCCGn1
    SolutionIndex: 4
    SolutionNameMin: Cijk_Alik_Bjlk_F8NF8NS_BH_Bias_HAS_SAV_UserArgs_MT256x256x64_MI16x16x1_SN_LDSB1_CLR1_GRVWA8_GRVWB16_GSU0_GSUC0_GSUWGMRR0_K1_LBSPPA512_LBSPPB2048_LPA8_LPB0_LRVW8_MIWT8_8_PLR1_SU0_SUM0_SUS64_VWA8_VWB8_WGM6_WGMXCC1_WGMXCCGn1
    SolutionIndex: 5
    SolutionNameMin: Cijk_Alik_Bjlk_F8NF8NS_BH_Bias_HAS_SAV_UserArgs_MT256x256x64_MI16x16x1_SN_LDSB1_CLR1_GRVWA16_GRVWB16_GSU0_GSUC0_GSUWGMRR0_K1_LBSPPA512_LBSPPB2048_LPA16_LPB0_LRVW8_MIWT8_8_PLR1_SU0_SUM0_SUS64_VWA8_VWB8_WGM6_WGMXCC1_WGMXCCGn1
    SolutionIndex: 6
    SolutionNameMin: Cijk_Alik_Bjlk_F8NF8NS_BH_Bias_HAS_SAV_UserArgs_MT256x256x64_MI16x16x1_SN_LDSB1_CLR1_GRVWA8_GRVWB16_GSU0_GSUC0_GSUWGMRR0_K1_LBSPPA512_LBSPPB2048_LPA8_LPB0_LRVW8_MIWT8_8_PLR1_SU0_SUM0_SUS64_VWA8_VWB8_WGM8_WGMXCC1_WGMXCCGn1
    SolutionIndex: 7
    SolutionNameMin: Cijk_Alik_Bjlk_F8NF8NS_BH_Bias_HAS_SAV_UserArgs_MT256x256x64_MI16x16x1_SN_LDSB1_CLR1_GRVWA16_GRVWB16_GSU0_GSUC0_GSUWGMRR0_K1_LBSPPA512_LBSPPB2048_LPA16_LPB0_LRVW8_MIWT8_8_PLR1_SU0_SUM0_SUS64_VWA8_VWB8_WGM8_WGMXCC1_WGMXCCGn1
    SolutionIndex: 8
    SolutionNameMin: Cijk_Alik_Bjlk_F8NF8NS_BH_Bias_HAS_SAV_UserArgs_MT128x256x64_MI16x16x1_SN_LDSB1_CLR1_GRVWA16_GRVWB16_GSU0_GSUC0_GSUWGMRR0_K1_LBSPPA256_LBSPPB2048_LPA16_LPB0_LRVW8_MIWT4_8_PLR1_SU0_SUM0_SUS64_VWA4_VWB8_WGM1_WGMXCC1_WGMXCCGn1
    SolutionIndex: 9
    SolutionNameMin: Cijk_Alik_Bjlk_F8NF8NS_BH_Bias_HAS_SAV_UserArgs_MT128x256x64_MI16x16x1_SN_LDSB1_CLR1_GRVWA8_GRVWB8_GSU0_GSUC0_GSUWGMRR0_K1_LBSPPA256_LBSPPB2048_LPA8_LPB0_LRVW8_MIWT4_8_PLR1_SU0_SUM0_SUS64_VWA4_VWB8_WGM4_WGMXCC1_WGMXCCGn1
    SolutionIndex: 10
    SolutionNameMin: Cijk_Alik_Bjlk_F8NF8NS_BH_Bias_HAS_SAV_UserArgs_MT128x256x64_MI16x16x1_SN_LDSB1_CLR1_GRVWA16_GRVWB16_GSU0_GSUC0_GSUWGMRR0_K1_LBSPPA256_LBSPPB2048_LPA16_LPB0_LRVW8_MIWT4_8_PLR1_SU0_SUM0_SUS64_VWA4_VWB8_WGM4_WGMXCC1_WGMXCCGn1
    SolutionIndex: 11
    SolutionNameMin: Cijk_Alik_Bjlk_F8NF8NS_BH_Bias_HAS_SAV_UserArgs_MT128x256x64_MI16x16x1_SN_LDSB1_CLR1_GRVWA8_GRVWB16_GSU0_GSUC0_GSUWGMRR0_K1_LBSPPA256_LBSPPB2048_LPA8_LPB0_LRVW8_MIWT4_8_PLR1_SU0_SUM0_SUS64_VWA4_VWB8_WGM6_WGMXCC1_WGMXCCGn1
    SolutionIndex: 12
    SolutionNameMin: Cijk_Alik_Bjlk_F8NF8NS_BH_Bias_HAS_SAV_UserArgs_MT128x256x64_MI16x16x1_SN_LDSB1_CLR1_GRVWA16_GRVWB16_GSU0_GSUC0_GSUWGMRR0_K1_LBSPPA256_LBSPPB2048_LPA16_LPB0_LRVW8_MIWT4_8_PLR1_SU0_SUM0_SUS64_VWA4_VWB8_WGM8_WGMXCC1_WGMXCCGn1
    SolutionIndex: 13
    SolutionNameMin: Cijk_Alik_Bjlk_F8NF8NS_BH_Bias_HAS_SAV_UserArgs_MT256x128x64_MI16x16x1_SN_LDSB1_CLR1_GRVWA8_GRVWB8_GSU0_GSUC0_GSUWGMRR0_K1_LBSPPA512_LBSPPB1024_LPA8_LPB64_LRVW8_MIWT8_4_PLR1_SU0_SUM0_SUS64_VWA8_VWB4_WGM1_WGMXCC1_WGMXCCGn1
    SolutionIndex: 14
    SolutionNameMin: Cijk_Alik_Bjlk_F8NF8NS_BH_Bias_HAS_SAV_UserArgs_MT256x128x64_MI16x16x1_SN_LDSB1_CLR1_GRVWA16_GRVWB8_GSU0_GSUC0_GSUWGMRR0_K1_LBSPPA512_LBSPPB1024_LPA16_LPB64_LRVW8_MIWT8_4_PLR1_SU0_SUM0_SUS64_VWA8_VWB4_WGM1_WGMXCC1_WGMXCCGn1
    SolutionIndex: 15
    SolutionNameMin: Cijk_Alik_Bjlk_F8NF8NS_BH_Bias_HAS_SAV_UserArgs_MT256x128x64_MI16x16x1_SN_LDSB1_CLR1_GRVWA8_GRVWB16_GSU0_GSUC0_GSUWGMRR0_K1_LBSPPA512_LBSPPB1024_LPA8_LPB64_LRVW8_MIWT8_4_PLR1_SU0_SUM0_SUS64_VWA8_VWB4_WGM1_WGMXCC1_WGMXCCGn1
    SolutionIndex: 16
    SolutionNameMin: Cijk_Alik_Bjlk_F8NF8NS_BH_Bias_HAS_SAV_UserArgs_MT256x128x64_MI16x16x1_SN_LDSB1_CLR1_GRVWA16_GRVWB16_GSU0_GSUC0_GSUWGMRR0_K1_LBSPPA512_LBSPPB1024_LPA16_LPB64_LRVW8_MIWT8_4_PLR1_SU0_SUM0_SUS64_VWA8_VWB4_WGM1_WGMXCC1_WGMXCCGn1
    SolutionIndex: 17
    SolutionNameMin: Cijk_Alik_Bjlk_F8NF8NS_BH_Bias_HAS_SAV_UserArgs_MT256x128x64_MI16x16x1_SN_LDSB1_CLR1_GRVWA8_GRVWB16_GSU0_GSUC0_GSUWGMRR0_K1_LBSPPA512_LBSPPB1024_LPA8_LPB64_LRVW8_MIWT8_4_PLR1_SU0_SUM0_SUS64_VWA8_VWB4_WGM4_WGMXCC1_WGMXCCGn1
    SolutionIndex: 18
    SolutionNameMin: Cijk_Alik_Bjlk_F8NF8NS_BH_Bias_HAS_SAV_UserArgs_MT256x128x64_MI16x16x1_SN_LDSB1_CLR1_GRVWA8_GRVWB16_GSU0_GSUC0_GSUWGMRR0_K1_LBSPPA512_LBSPPB1024_LPA8_LPB64_LRVW8_MIWT8_4_PLR1_SU0_SUM0_SUS64_VWA8_VWB4_WGM8_WGMXCC1_WGMXCCGn1
    SolutionIndex: 19
    SolutionNameMin: Cijk_Alik_Bjlk_F8NF8NS_BH_Bias_HAS_SAV_UserArgs_MT128x128x64_MI16x16x1_SN_LDSB1_CLR1_GRVWA8_GRVWB16_GSU0_GSUC0_GSUWGMRR0_K1_LBSPPA512_LBSPPB1024_LPA8_LPB32_LRVW8_MIWT8_2_PLR1_SU0_SUM0_SUS64_VWA8_VWB2_WGM1_WGMXCC1_WGMXCCGn1
    SolutionIndex: 20
    SolutionNameMin: Cijk_Alik_Bjlk_F8NF8NS_BH_Bias_HAS_SAV_UserArgs_MT128x64x64_MI16x16x1_SN_LDSB0_CLR1_GRVWA8_GRVWB8_GSU0_GSUC0_GSUWGMRR0_K1_LBSPPA512_LBSPPB512_LPA8_LPB16_LRVW8_MIWT8_1_PLR1_SU0_SUM0_SUS64_VWA8_VWB1_WGM1_WGMXCC1_WGMXCCGn1
    SolutionIndex: 21
    SolutionNameMin: Cijk_Alik_Bjlk_F8NF8NS_BH_Bias_HAS_SAV_UserArgs_MT128x128x64_MI16x16x1_SN_LDSB1_CLR1_GRVWA8_GRVWB8_GSU0_GSUC0_GSUWGMRR0_K1_LBSPPA256_LBSPPB1024_LPA8_LPB64_LRVW8_MIWT4_4_PLR1_SU0_SUM0_SUS64_VWA4_VWB4_WGM1_WGMXCC1_WGMXCCGn1
    SolutionIndex: 22
    SolutionNameMin: Cijk_Alik_Bjlk_F8NF8NS_BH_Bias_HAS_SAV_UserArgs_MT128x128x64_MI16x16x1_SN_LDSB1_CLR1_GRVWA16_GRVWB8_GSU0_GSUC0_GSUWGMRR0_K1_LBSPPA256_LBSPPB1024_LPA16_LPB64_LRVW8_MIWT4_4_PLR1_SU0_SUM0_SUS64_VWA4_VWB4_WGM1_WGMXCC1_WGMXCCGn1
    SolutionIndex: 23
    SolutionNameMin: Cijk_Alik_Bjlk_F8NF8NS_BH_Bias_HAS_SAV_UserArgs_MT128x64x64_MI16x16x1_SN_LDSB0_CLR1_GRVWA8_GRVWB8_GSU0_GSUC0_GSUWGMRR0_K1_LBSPPA256_LBSPPB512_LPA8_LPB32_LRVW8_MIWT4_2_PLR1_SU0_SUM0_SUS64_VWA4_VWB2_WGM1_WGMXCC1_WGMXCCGn1
    SolutionIndex: 24
    SolutionNameMin: Cijk_Alik_Bjlk_F8NF8NS_BH_Bias_HAS_SAV_UserArgs_MT128x64x64_MI16x16x1_SN_LDSB0_CLR1_GRVWA16_GRVWB8_GSU0_GSUC0_GSUWGMRR0_K1_LBSPPA256_LBSPPB512_LPA16_LPB32_LRVW8_MIWT4_2_PLR1_SU0_SUM0_SUS64_VWA4_VWB2_WGM1_WGMXCC1_WGMXCCGn1
    SolutionIndex: 25
    SolutionNameMin: Cijk_Alik_Bjlk_F8NF8NS_BH_Bias_HAS_SAV_UserArgs_MT128x64x64_MI16x16x1_SN_LDSB0_CLR1_GRVWA8_GRVWB16_GSU0_GSUC0_GSUWGMRR0_K1_LBSPPA256_LBSPPB512_LPA8_LPB32_LRVW8_MIWT4_2_PLR1_SU0_SUM0_SUS64_VWA4_VWB2_WGM1_WGMXCC1_WGMXCCGn1
    SolutionIndex: 26
    SolutionNameMin: Cijk_Alik_Bjlk_F8NF8NS_BH_Bias_HAS_SAV_UserArgs_MT128x64x64_MI16x16x1_SN_LDSB0_CLR1_GRVWA16_GRVWB16_GSU0_GSUC0_GSUWGMRR0_K1_LBSPPA256_LBSPPB512_LPA16_LPB32_LRVW8_MIWT4_2_PLR1_SU0_SUM0_SUS64_VWA4_VWB2_WGM1_WGMXCC1_WGMXCCGn1
    SolutionIndex: 27
    SolutionNameMin: Cijk_Alik_Bjlk_F8NF8NS_BH_Bias_HAS_SAV_UserArgs_MT128x64x64_MI16x16x1_SN_LDSB0_CLR1_GRVWA8_GRVWB16_GSU0_GSUC0_GSUWGMRR0_K1_LBSPPA256_LBSPPB512_LPA8_LPB32_LRVW8_MIWT4_2_PLR1_SU0_SUM0_SUS64_VWA4_VWB2_WGM4_WGMXCC1_WGMXCCGn1
    SolutionIndex: 28
    SolutionNameMin: Cijk_Alik_Bjlk_F8NF8NS_BH_Bias_HAS_SAV_UserArgs_MT128x64x64_MI16x16x1_SN_LDSB0_CLR1_GRVWA16_GRVWB16_GSU0_GSUC0_GSUWGMRR0_K1_LBSPPA256_LBSPPB512_LPA16_LPB32_LRVW8_MIWT4_2_PLR1_SU0_SUM0_SUS64_VWA4_VWB2_WGM6_WGMXCC1_WGMXCCGn1
    SolutionIndex: 29
    SolutionNameMin: Cijk_Alik_Bjlk_F8NF8NS_BH_Bias_HAS_SAV_UserArgs_MT128x64x64_MI16x16x1_SN_LDSB0_CLR1_GRVWA8_GRVWB16_GSU0_GSUC0_GSUWGMRR0_K1_LBSPPA256_LBSPPB512_LPA8_LPB32_LRVW8_MIWT4_2_PLR1_SU0_SUM0_SUS64_VWA4_VWB2_WGM8_WGMXCC1_WGMXCCGn1
    SolutionIndex: 30
    SolutionNameMin: Cijk_Alik_Bjlk_F8NF8NS_BH_Bias_HAS_SAV_UserArgs_MT128x32x64_MI16x16x1_SN_LDSB0_CLR1_GRVWA8_GRVWB8_GSU0_GSUC0_GSUWGMRR0_K1_LBSPPA256_LBSPPB256_LPA8_LPB16_LRVW8_MIWT4_1_PLR1_SU0_SUM0_SUS64_VWA4_VWB1_WGM1_WGMXCC1_WGMXCCGn1
    SolutionIndex: 31
    SolutionNameMin: Cijk_Alik_Bjlk_F8NF8NS_BH_Bias_HAS_SAV_UserArgs_MT64x64x64_MI16x16x1_SN_LDSB0_CLR1_GRVWA8_GRVWB8_GSU0_GSUC0_GSUWGMRR0_K1_LBSPPA128_LBSPPB512_LPA8_LPB32_LRVW8_MIWT2_2_PLR1_SU0_SUM0_SUS64_VWA2_VWB2_WGM1_WGMXCC1_WGMXCCGn1
    SolutionIndex: 32
    SolutionNameMin: Cijk_Alik_Bjlk_F8NF8NS_BH_Bias_HAS_SAV_UserArgs_MT64x64x64_MI16x16x1_SN_LDSB0_CLR1_GRVWA16_GRVWB8_GSU0_GSUC0_GSUWGMRR0_K1_LBSPPA128_LBSPPB512_LPA16_LPB32_LRVW8_MIWT2_2_PLR1_SU0_SUM0_SUS64_VWA2_VWB2_WGM1_WGMXCC1_WGMXCCGn1
    SolutionIndex: 33
    SolutionNameMin: Cijk_Alik_Bjlk_F8NF8NS_BH_Bias_HAS_SAV_UserArgs_MT64x32x64_MI16x16x1_SN_LDSB0_CLR1_GRVWA8_GRVWB8_GSU0_GSUC0_GSUWGMRR0_K1_LBSPPA128_LBSPPB256_LPA8_LPB16_LRVW8_MIWT2_1_PLR1_SU0_SUM0_SUS64_VWA2_VWB1_WGM1_WGMXCC1_WGMXCCGn1
    SolutionIndex: 34
    SolutionNameMin: Cijk_Alik_Bjlk_F8NF8NS_BH_Bias_HAS_SAV_UserArgs_MT64x32x64_MI16x16x1_SN_LDSB0_CLR1_GRVWA16_GRVWB8_GSU0_GSUC0_GSUWGMRR0_K1_LBSPPA128_LBSPPB256_LPA16_LPB16_LRVW8_MIWT2_1_PLR1_SU0_SUM0_SUS64_VWA2_VWB1_WGM1_WGMXCC1_WGMXCCGn1
    SolutionIndex: 35
    SolutionNameMin: Cijk_Alik_Bjlk_F8NF8NS_BH_Bias_HAS_SAV_UserArgs_MT32x32x64_MI16x16x1_SN_LDSB0_CLR1_GRVWA8_GRVWB8_GSU0_GSUC0_GSUWGMRR0_K1_LBSPPA128_LBSPPB256_LPA8_LPB16_LRVW8_MIWT1_1_PLR1_SU0_SUM0_SUS64_VWA1_VWB1_WGM1_WGMXCC1_WGMXCCGn1
    SolutionIndex: 36
    SolutionNameMin: Cijk_Alik_Bjlk_F8NF8NS_BH_Bias_HAS_SAV_UserArgs_MT128x256x128_MI16x16x1_SN_LDSB1_CLR1_GRVWA8_GRVWB16_GSU0_GSUC0_GSUWGMRR0_K1_LBSPPA512_LBSPPB2048_LPA8_LPB0_LRVW8_MIWT4_8_PLR1_SU0_SUM0_SUS128_VWA4_VWB8_WGM1_WGMXCC1_WGMXCCGn1
    SolutionIndex: 37
    SolutionNameMin: Cijk_Alik_Bjlk_F8NF8NS_BH_Bias_HAS_SAV_UserArgs_MT128x256x128_MI16x16x1_SN_LDSB1_CLR1_GRVWA8_GRVWB16_GSU0_GSUC0_GSUWGMRR0_K1_LBSPPA512_LBSPPB2048_LPA8_LPB0_LRVW8_MIWT4_8_PLR1_SU0_SUM0_SUS128_VWA4_VWB8_WGM4_WGMXCC1_WGMXCCGn1
    SolutionIndex: 38
    SolutionNameMin: Cijk_Alik_Bjlk_F8NF8NS_BH_Bias_HAS_SAV_UserArgs_MT128x256x128_MI16x16x1_SN_LDSB1_CLR1_GRVWA16_GRVWB16_GSU0_GSUC0_GSUWGMRR0_K1_LBSPPA512_LBSPPB2048_LPA16_LPB0_LRVW8_MIWT4_8_PLR1_SU0_SUM0_SUS128_VWA4_VWB8_WGM4_WGMXCC1_WGMXCCGn1
    SolutionIndex: 39
    SolutionNameMin: Cijk_Alik_Bjlk_F8NF8NS_BH_Bias_HAS_SAV_UserArgs_MT128x256x128_MI16x16x1_SN_LDSB1_CLR1_GRVWA8_GRVWB16_GSU0_GSUC0_GSUWGMRR0_K1_LBSPPA512_LBSPPB2048_LPA8_LPB0_LRVW8_MIWT4_8_PLR1_SU0_SUM0_SUS128_VWA4_VWB8_WGM6_WGMXCC1_WGMXCCGn1
    SolutionIndex: 40
    SolutionNameMin: Cijk_Alik_Bjlk_F8NF8NS_BH_Bias_HAS_SAV_UserArgs_MT256x128x128_MI16x16x1_SN_LDSB1_CLR1_GRVWA8_GRVWB16_GSU0_GSUC0_GSUWGMRR0_K1_LBSPPA1024_LBSPPB1024_LPA8_LPB64_LRVW8_MIWT8_4_PLR1_SU0_SUM0_SUS128_VWA8_VWB4_WGM1_WGMXCC1_WGMXCCGn1
    SolutionIndex: 41
    SolutionNameMin: Cijk_Alik_Bjlk_F8NF8NS_BH_Bias_HAS_SAV_UserArgs_MT256x128x128_MI16x16x1_SN_LDSB1_CLR1_GRVWA16_GRVWB16_GSU0_GSUC0_GSUWGMRR0_K1_LBSPPA1024_LBSPPB1024_LPA16_LPB64_LRVW8_MIWT8_4_PLR1_SU0_SUM0_SUS128_VWA8_VWB4_WGM1_WGMXCC1_WGMXCCGn1
    SolutionIndex: 42
    SolutionNameMin: Cijk_Alik_Bjlk_F8NF8NS_BH_Bias_HAS_SAV_UserArgs_MT256x128x128_MI16x16x1_SN_LDSB1_CLR1_GRVWA8_GRVWB16_GSU0_GSUC0_GSUWGMRR0_K1_LBSPPA1024_LBSPPB1024_LPA8_LPB64_LRVW8_MIWT8_4_PLR1_SU0_SUM0_SUS128_VWA8_VWB4_WGM4_WGMXCC1_WGMXCCGn1
    SolutionIndex: 43
    SolutionNameMin: Cijk_Alik_Bjlk_F8NF8NS_BH_Bias_HAS_SAV_UserArgs_MT256x128x128_MI16x16x1_SN_LDSB1_CLR1_GRVWA8_GRVWB16_GSU0_GSUC0_GSUWGMRR0_K1_LBSPPA1024_LBSPPB1024_LPA8_LPB64_LRVW8_MIWT8_4_PLR1_SU0_SUM0_SUS128_VWA8_VWB4_WGM6_WGMXCC1_WGMXCCGn1
    SolutionIndex: 44
    SolutionNameMin: Cijk_Alik_Bjlk_F8NF8NS_BH_Bias_HAS_SAV_UserArgs_MT256x128x128_MI16x16x1_SN_LDSB1_CLR1_GRVWA8_GRVWB16_GSU0_GSUC0_GSUWGMRR0_K1_LBSPPA1024_LBSPPB1024_LPA8_LPB64_LRVW8_MIWT8_4_PLR1_SU0_SUM0_SUS128_VWA8_VWB4_WGM8_WGMXCC1_WGMXCCGn1
    SolutionIndex: 45
    SolutionNameMin: Cijk_Alik_Bjlk_F8NF8NS_BH_Bias_HAS_SAV_UserArgs_MT144x256x128_MI16x16x1_SN_LDSB1_CLR1_GRVWA8_GRVWB16_GSU0_GSUC0_GSUWGMRR0_K1_LBSPPA128_LBSPPB2048_LPA8_LPB64_LRVW8_MIWT9_4_PLR1_SU0_SUM0_SUS128_VWA1_VWB4_WGM4_WGMXCC1_WGMXCCGn1
    SolutionIndex: 46
    SolutionNameMin: Cijk_Alik_Bjlk_F8NF8NS_BH_Bias_HAS_SAV_UserArgs_MT144x256x128_MI16x16x1_SN_LDSB1_CLR1_GRVWA8_GRVWB16_GSU0_GSUC0_GSUWGMRR0_K1_LBSPPA128_LBSPPB2048_LPA8_LPB64_LRVW8_MIWT9_4_PLR1_SU0_SUM0_SUS128_VWA1_VWB4_WGM6_WGMXCC1_WGMXCCGn1
    SolutionIndex: 47
    SolutionNameMin: Cijk_Alik_Bjlk_F8NF8NS_BH_Bias_HAS_SAV_UserArgs_MT144x256x128_MI16x16x1_SN_LDSB1_CLR1_GRVWA8_GRVWB8_GSU0_GSUC0_GSUWGMRR0_K1_LBSPPA128_LBSPPB2048_LPA8_LPB64_LRVW8_MIWT9_4_PLR1_SU0_SUM0_SUS128_VWA1_VWB4_WGM8_WGMXCC1_WGMXCCGn1
    SolutionIndex: 48
    SolutionNameMin: Cijk_Alik_Bjlk_F8NF8NS_BH_Bias_HAS_SAV_UserArgs_MT144x256x128_MI16x16x1_SN_LDSB1_CLR1_GRVWA8_GRVWB16_GSU0_GSUC0_GSUWGMRR0_K1_LBSPPA128_LBSPPB2048_LPA8_LPB64_LRVW8_MIWT9_4_PLR1_SU0_SUM0_SUS128_VWA1_VWB4_WGM8_WGMXCC1_WGMXCCGn1
    SolutionIndex: 49
    SolutionNameMin: Cijk_Alik_Bjlk_F8NF8NS_BH_Bias_HAS_SAV_UserArgs_MT144x128x128_MI16x16x1_SN_LDSB1_CLR1_GRVWA8_GRVWB16_GSU0_GSUC0_GSUWGMRR0_K1_LBSPPA128_LBSPPB1024_LPA8_LPB32_LRVW8_MIWT9_2_PLR1_SU0_SUM0_SUS128_VWA1_VWB2_WGM4_WGMXCC1_WGMXCCGn1
    SolutionIndex: 50
    SolutionNameMin: Cijk_Alik_Bjlk_F8NF8NS_BH_Bias_HAS_SAV_UserArgs_MT144x128x128_MI16x16x1_SN_LDSB1_CLR1_GRVWA8_GRVWB16_GSU0_GSUC0_GSUWGMRR0_K1_LBSPPA128_LBSPPB1024_LPA8_LPB32_LRVW8_MIWT9_2_PLR1_SU0_SUM0_SUS128_VWA1_VWB2_WGM8_WGMXCC1_WGMXCCGn1
    SolutionIndex: 51
    SolutionNameMin: Cijk_Alik_Bjlk_F8NF8NS_BH_Bias_HAS_SAV_UserArgs_MT128x128x128_MI16x16x1_SN_LDSB1_CLR1_GRVWA16_GRVWB8_GSU0_GSUC0_GSUWGMRR0_K1_LBSPPA512_LBSPPB1024_LPA16_LPB64_LRVW8_MIWT4_4_PLR1_SU0_SUM0_SUS128_VWA4_VWB4_WGM1_WGMXCC1_WGMXCCGn1
    SolutionIndex: 52
    SolutionNameMin: Cijk_Alik_Bjlk_F8NF8NS_BH_Bias_HAS_SAV_UserArgs_MT128x128x128_MI16x16x1_SN_LDSB1_CLR1_GRVWA16_GRVWB16_GSU0_GSUC0_GSUWGMRR0_K1_LBSPPA512_LBSPPB1024_LPA16_LPB64_LRVW8_MIWT4_4_PLR1_SU0_SUM0_SUS128_VWA4_VWB4_WGM1_WGMXCC1_WGMXCCGn1
    SolutionIndex: 53
    SolutionNameMin: Cijk_Alik_Bjlk_F8NF8NS_BH_Bias_HAS_SAV_UserArgs_MT128x128x128_MI16x16x1_SN_LDSB1_CLR1_GRVWA16_GRVWB16_GSU0_GSUC0_GSUWGMRR0_K1_LBSPPA512_LBSPPB1024_LPA16_LPB64_LRVW8_MIWT4_4_PLR1_SU0_SUM0_SUS128_VWA4_VWB4_WGM4_WGMXCC1_WGMXCCGn1
    SolutionIndex: 54
    SolutionNameMin: Cijk_Alik_Bjlk_F8NF8NS_BH_Bias_HAS_SAV_UserArgs_MT128x128x128_MI16x16x1_SN_LDSB1_CLR1_GRVWA16_GRVWB16_GSU0_GSUC0_GSUWGMRR0_K1_LBSPPA512_LBSPPB1024_LPA16_LPB64_LRVW8_MIWT4_4_PLR1_SU0_SUM0_SUS128_VWA4_VWB4_WGM6_WGMXCC1_WGMXCCGn1
    SolutionIndex: 55
    SolutionNameMin: Cijk_Alik_Bjlk_F8NF8NS_BH_Bias_HAS_SAV_UserArgs_MT128x128x128_MI16x16x1_SN_LDSB1_CLR1_GRVWA16_GRVWB16_GSU0_GSUC0_GSUWGMRR0_K1_LBSPPA512_LBSPPB1024_LPA16_LPB64_LRVW8_MIWT4_4_PLR1_SU0_SUM0_SUS128_VWA4_VWB4_WGM8_WGMXCC1_WGMXCCGn1
    SolutionIndex: 56
    SolutionNameMin: Cijk_Alik_Bjlk_F8NF8NS_BH_Bias_HAS_SAV_UserArgs_MT64x128x128_MI16x16x1_SN_LDSB1_CLR1_GRVWA8_GRVWB16_GSU0_GSUC0_GSUWGMRR0_K1_LBSPPA256_LBSPPB1024_LPA8_LPB64_LRVW8_MIWT2_4_PLR1_SU0_SUM0_SUS128_VWA2_VWB4_WGM1_WGMXCC1_WGMXCCGn1
    SolutionIndex: 57
    SolutionNameMin: Cijk_Alik_Bjlk_F8NF8NS_BH_Bias_HAS_SAV_UserArgs_MT128x64x128_MI16x16x1_SN_LDSB1_CLR1_GRVWA16_GRVWB16_GSU0_GSUC0_GSUWGMRR0_K1_LBSPPA512_LBSPPB512_LPA16_LPB32_LRVW8_MIWT4_2_PLR1_SU0_SUM0_SUS128_VWA4_VWB2_WGM4_WGMXCC1_WGMXCCGn1
    SolutionIndex: 58
    SolutionNameMin: Cijk_Alik_Bjlk_F8NF8NS_BH_Bias_HAS_SAV_UserArgs_MT64x64x128_MI16x16x1_SN_LDSB1_CLR1_GRVWA16_GRVWB8_GSU0_GSUC0_GSUWGMRR0_K1_LBSPPA256_LBSPPB512_LPA16_LPB32_LRVW8_MIWT2_2_PLR1_SU0_SUM0_SUS128_VWA2_VWB2_WGM1_WGMXCC1_WGMXCCGn1
    SolutionIndex: 59
    SolutionNameMin: Cijk_Alik_Bjlk_F8NF8NS_BH_Bias_HAS_SAV_UserArgs_MT64x64x128_MI16x16x1_SN_LDSB1_CLR1_GRVWA8_GRVWB16_GSU0_GSUC0_GSUWGMRR0_K1_LBSPPA256_LBSPPB512_LPA8_LPB32_LRVW8_MIWT2_2_PLR1_SU0_SUM0_SUS128_VWA2_VWB2_WGM1_WGMXCC1_WGMXCCGn1
    SolutionIndex: 60
    SolutionNameMin: Cijk_Alik_Bjlk_F8NF8NS_BH_Bias_HAS_SAV_UserArgs_MT64x64x128_MI16x16x1_SN_LDSB1_CLR1_GRVWA8_GRVWB16_GSU0_GSUC0_GSUWGMRR0_K1_LBSPPA256_LBSPPB512_LPA8_LPB32_LRVW8_MIWT2_2_PLR1_SU0_SUM0_SUS128_VWA2_VWB2_WGM4_WGMXCC1_WGMXCCGn1
    SolutionIndex: 61
    SolutionNameMin: Cijk_Alik_Bjlk_F8NF8NS_BH_Bias_HAS_SAV_UserArgs_MT32x64x128_MI16x16x1_SN_LDSB0_CLR1_GRVWA8_GRVWB16_GSU0_GSUC0_GSUWGMRR0_K1_LBSPPA128_LBSPPB512_LPA8_LPB32_LRVW8_MIWT1_2_PLR1_SU0_SUM0_SUS128_VWA1_VWB2_WGM4_WGMXCC1_WGMXCCGn1
    SolutionIndex: 62
    SolutionNameMin: Cijk_Alik_Bjlk_F8NF8NS_BH_Bias_HAS_SAV_UserArgs_MT64x32x128_MI16x16x1_SN_LDSB0_CLR1_GRVWA8_GRVWB8_GSU0_GSUC0_GSUWGMRR0_K1_LBSPPA256_LBSPPB256_LPA8_LPB16_LRVW8_MIWT2_1_PLR1_SU0_SUM0_SUS128_VWA2_VWB1_WGM1_WGMXCC1_WGMXCCGn1
    SolutionIndex: 63
    SolutionNameMin: Cijk_Alik_Bjlk_F8NF8NS_BH_Bias_HAS_SAV_UserArgs_MT64x32x128_MI16x16x1_SN_LDSB0_CLR1_GRVWA16_GRVWB8_GSU0_GSUC0_GSUWGMRR0_K1_LBSPPA256_LBSPPB256_LPA16_LPB16_LRVW8_MIWT2_1_PLR1_SU0_SUM0_SUS128_VWA2_VWB1_WGM1_WGMXCC1_WGMXCCGn1
    SolutionIndex: 64
    SolutionNameMin: Cijk_Alik_Bjlk_F8NF8NS_BH_Bias_HAS_SAV_UserArgs_MT64x32x128_MI16x16x1_SN_LDSB0_CLR1_GRVWA8_GRVWB16_GSU0_GSUC0_GSUWGMRR0_K1_LBSPPA256_LBSPPB256_LPA8_LPB16_LRVW8_MIWT2_1_PLR1_SU0_SUM0_SUS128_VWA2_VWB1_WGM1_WGMXCC1_WGMXCCGn1
    SolutionIndex: 65
    SolutionNameMin: Cijk_Alik_Bjlk_F8NF8NS_BH_Bias_HAS_SAV_UserArgs_MT64x32x128_MI16x16x1_SN_LDSB0_CLR1_GRVWA8_GRVWB16_GSU0_GSUC0_GSUWGMRR0_K1_LBSPPA256_LBSPPB256_LPA8_LPB16_LRVW8_MIWT2_1_PLR1_SU0_SUM0_SUS128_VWA2_VWB1_WGM6_WGMXCC1_WGMXCCGn1
    SolutionIndex: 66
    SolutionNameMin: Cijk_Alik_Bjlk_F8NF8NS_BH_Bias_HAS_SAV_UserArgs_MT64x32x128_MI16x16x1_SN_LDSB0_CLR1_GRVWA8_GRVWB16_GSU0_GSUC0_GSUWGMRR0_K1_LBSPPA256_LBSPPB256_LPA8_LPB16_LRVW8_MIWT2_1_PLR1_SU0_SUM0_SUS128_VWA2_VWB1_WGM8_WGMXCC1_WGMXCCGn1
    SolutionIndex: 67
    SolutionNameMin: Cijk_Alik_Bjlk_F8NF8NS_BH_Bias_HAS_SAV_UserArgs_MT32x32x128_MI16x16x1_SN_LDSB0_CLR1_GRVWA8_GRVWB8_GSU0_GSUC0_GSUWGMRR0_K1_LBSPPA128_LBSPPB256_LPA8_LPB16_LRVW8_MIWT1_1_PLR1_SU0_SUM0_SUS128_VWA1_VWB1_WGM1_WGMXCC1_WGMXCCGn1
    SolutionIndex: 68
    SolutionNameMin: Cijk_Alik_Bjlk_F8NF8NS_BH_Bias_HAS_SAV_UserArgs_MT32x32x128_MI16x16x1_SN_LDSB0_CLR1_GRVWA16_GRVWB8_GSU0_GSUC0_GSUWGMRR0_K1_LBSPPA128_LBSPPB256_LPA16_LPB16_LRVW8_MIWT1_1_PLR1_SU0_SUM0_SUS128_VWA1_VWB1_WGM1_WGMXCC1_WGMXCCGn1
    SolutionIndex: 69
    SolutionNameMin: Cijk_Alik_Bjlk_F8NF8NS_BH_Bias_HAS_SAV_UserArgs_MT32x32x128_MI16x16x1_SN_LDSB0_CLR1_GRVWA8_GRVWB16_GSU0_GSUC0_GSUWGMRR0_K1_LBSPPA128_LBSPPB256_LPA8_LPB16_LRVW8_MIWT1_1_PLR1_SU0_SUM0_SUS128_VWA1_VWB1_WGM1_WGMXCC1_WGMXCCGn1
    SolutionIndex: 70
    SolutionNameMin: Cijk_Alik_Bjlk_F8NF8NS_BH_Bias_HAS_SAV_UserArgs_MT32x32x128_MI16x16x1_SN_LDSB0_CLR1_GRVWA8_GRVWB16_GSU0_GSUC0_GSUWGMRR0_K1_LBSPPA128_LBSPPB256_LPA8_LPB16_LRVW8_MIWT1_1_PLR1_SU0_SUM0_SUS128_VWA1_VWB1_WGM4_WGMXCC1_WGMXCCGn1
    SolutionIndex: 71
    SolutionNameMin: Cijk_Alik_Bjlk_F8NF8NS_BH_Bias_HAS_SAV_UserArgs_MT32x32x128_MI16x16x1_SN_LDSB0_CLR1_GRVWA8_GRVWB16_GSU0_GSUC0_GSUWGMRR0_K1_LBSPPA128_LBSPPB256_LPA8_LPB16_LRVW8_MIWT1_1_PLR1_SU0_SUM0_SUS128_VWA1_VWB1_WGM6_WGMXCC1_WGMXCCGn1
    SolutionIndex: 72
    SolutionNameMin: Cijk_Alik_Bjlk_F8NF8NS_BH_Bias_HAS_SAV_UserArgs_MT32x32x128_MI16x16x1_SN_LDSB0_CLR1_GRVWA8_GRVWB16_GSU0_GSUC0_GSUWGMRR0_K1_LBSPPA128_LBSPPB256_LPA8_LPB16_LRVW8_MIWT1_1_PLR1_SU0_SUM0_SUS128_VWA1_VWB1_WGM8_WGMXCC1_WGMXCCGn1
    SolutionIndex: 73
    SolutionNameMin: Cijk_Alik_Bjlk_F8NF8NS_BH_Bias_HAS_SAV_UserArgs_MT128x64x256_MI16x16x1_SN_LDSB1_CLR1_GRVWA16_GRVWB16_GSU0_GSUC0_GSUWGMRR0_K1_LBSPPA1024_LBSPPB512_LPA16_LPB32_LRVW8_MIWT4_2_PLR1_SU0_SUM0_SUS256_VWA4_VWB2_WGM1_WGMXCC1_WGMXCCGn1
    SolutionIndex: 74
    SolutionNameMin: Cijk_Alik_Bjlk_F8NF8NS_BH_Bias_HAS_SAV_UserArgs_MT128x64x256_MI16x16x1_SN_LDSB1_CLR1_GRVWA16_GRVWB16_GSU0_GSUC0_GSUWGMRR0_K1_LBSPPA1024_LBSPPB512_LPA16_LPB32_LRVW8_MIWT4_2_PLR1_SU0_SUM0_SUS256_VWA4_VWB2_WGM4_WGMXCC1_WGMXCCGn1
    SolutionIndex: 75
    SolutionNameMin: Cijk_Alik_Bjlk_F8NF8NS_BH_Bias_HAS_SAV_UserArgs_MT128x64x256_MI16x16x1_SN_LDSB1_CLR1_GRVWA16_GRVWB16_GSU0_GSUC0_GSUWGMRR0_K1_LBSPPA1024_LBSPPB512_LPA16_LPB32_LRVW8_MIWT4_2_PLR1_SU0_SUM0_SUS256_VWA4_VWB2_WGM6_WGMXCC1_WGMXCCGn1
    SolutionIndex: 76
    SolutionNameMin: Cijk_Alik_Bjlk_F8NF8NS_BH_Bias_HAS_SAV_UserArgs_MT128x64x256_MI16x16x1_SN_LDSB1_CLR1_GRVWA16_GRVWB16_GSU0_GSUC0_GSUWGMRR0_K1_LBSPPA1024_LBSPPB512_LPA16_LPB32_LRVW8_MIWT4_2_PLR1_SU0_SUM0_SUS256_VWA4_VWB2_WGM8_WGMXCC1_WGMXCCGn1
    SolutionIndex: 77
    SolutionNameMin: Cijk_Alik_Bjlk_F8NF8NS_BH_Bias_HAS_SAV_UserArgs_MT64x64x256_MI16x16x1_SN_LDSB1_CLR1_GRVWA16_GRVWB16_GSU0_GSUC0_GSUWGMRR0_K1_LBSPPA512_LBSPPB512_LPA16_LPB32_LRVW8_MIWT2_2_PLR1_SU0_SUM0_SUS256_VWA2_VWB2_WGM1_WGMXCC1_WGMXCCGn1
    SolutionIndex: 78
    SolutionNameMin: Cijk_Alik_Bjlk_F8NF8NS_BH_Bias_HAS_SAV_UserArgs_MT64x64x256_MI16x16x1_SN_LDSB1_CLR1_GRVWA16_GRVWB16_GSU0_GSUC0_GSUWGMRR0_K1_LBSPPA512_LBSPPB512_LPA16_LPB32_LRVW8_MIWT2_2_PLR1_SU0_SUM0_SUS256_VWA2_VWB2_WGM4_WGMXCC1_WGMXCCGn1
    SolutionIndex: 79
    SolutionNameMin: Cijk_Alik_Bjlk_F8NF8NS_BH_Bias_HAS_SAV_UserArgs_MT64x64x256_MI16x16x1_SN_LDSB1_CLR1_GRVWA16_GRVWB16_GSU0_GSUC0_GSUWGMRR0_K1_LBSPPA512_LBSPPB512_LPA16_LPB32_LRVW8_MIWT2_2_PLR1_SU0_SUM0_SUS256_VWA2_VWB2_WGM6_WGMXCC1_WGMXCCGn1
    SolutionIndex: 80
    SolutionNameMin: Cijk_Alik_Bjlk_F8NF8NS_BH_Bias_HAS_SAV_UserArgs_MT64x64x256_MI16x16x1_SN_LDSB1_CLR1_GRVWA16_GRVWB16_GSU0_GSUC0_GSUWGMRR0_K1_LBSPPA512_LBSPPB512_LPA16_LPB32_LRVW8_MIWT2_2_PLR1_SU0_SUM0_SUS256_VWA2_VWB2_WGM8_WGMXCC1_WGMXCCGn1
    SolutionIndex: 81
    SolutionNameMin: Cijk_Alik_Bjlk_F8NF8NS_BH_Bias_HAS_SAV_UserArgs_MT32x64x256_MI16x16x1_SN_LDSB1_CLR1_GRVWA8_GRVWB16_GSU0_GSUC0_GSUWGMRR0_K1_LBSPPA256_LBSPPB512_LPA8_LPB32_LRVW8_MIWT1_2_PLR1_SU0_SUM0_SUS256_VWA1_VWB2_WGM1_WGMXCC1_WGMXCCGn1
    SolutionIndex: 82
    SolutionNameMin: Cijk_Alik_Bjlk_F8NF8NS_BH_Bias_HAS_SAV_UserArgs_MT32x64x256_MI16x16x1_SN_LDSB1_CLR1_GRVWA16_GRVWB16_GSU0_GSUC0_GSUWGMRR0_K1_LBSPPA256_LBSPPB512_LPA16_LPB32_LRVW8_MIWT1_2_PLR1_SU0_SUM0_SUS256_VWA1_VWB2_WGM1_WGMXCC1_WGMXCCGn1
    SolutionIndex: 83
    SolutionNameMin: Cijk_Alik_Bjlk_F8NF8NS_BH_Bias_HAS_SAV_UserArgs_MT32x64x256_MI16x16x1_SN_LDSB1_CLR1_GRVWA8_GRVWB16_GSU0_GSUC0_GSUWGMRR0_K1_LBSPPA256_LBSPPB512_LPA8_LPB32_LRVW8_MIWT1_2_PLR1_SU0_SUM0_SUS256_VWA1_VWB2_WGM6_WGMXCC1_WGMXCCGn1
    SolutionIndex: 84
    SolutionNameMin: Cijk_Alik_Bjlk_F8NF8NS_BH_Bias_HAS_SAV_UserArgs_MT32x64x256_MI16x16x1_SN_LDSB1_CLR1_GRVWA16_GRVWB16_GSU0_GSUC0_GSUWGMRR0_K1_LBSPPA256_LBSPPB512_LPA16_LPB32_LRVW8_MIWT1_2_PLR1_SU0_SUM0_SUS256_VWA1_VWB2_WGM6_WGMXCC1_WGMXCCGn1
    SolutionIndex: 85
    SolutionNameMin: Cijk_Alik_Bjlk_F8NF8NS_BH_Bias_HAS_SAV_UserArgs_MT64x32x256_MI16x16x1_SN_LDSB1_CLR1_GRVWA16_GRVWB16_GSU0_GSUC0_GSUWGMRR0_K1_LBSPPA512_LBSPPB256_LPA16_LPB16_LRVW8_MIWT2_1_PLR1_SU0_SUM0_SUS256_VWA2_VWB1_WGM1_WGMXCC1_WGMXCCGn1
    SolutionIndex: 86
    SolutionNameMin: Cijk_Alik_Bjlk_F8NF8NS_BH_Bias_HAS_SAV_UserArgs_MT32x32x256_MI16x16x1_SN_LDSB1_CLR1_GRVWA16_GRVWB16_GSU0_GSUC0_GSUWGMRR0_K1_LBSPPA256_LBSPPB256_LPA16_LPB16_LRVW8_MIWT1_1_PLR1_SU0_SUM0_SUS256_VWA1_VWB1_WGM1_WGMXCC1_WGMXCCGn1
    SolutionIndex: 87
    SolutionNameMin: Cijk_Alik_Bjlk_F8NF8NS_BH_Bias_HAS_SAV_UserArgs_MT32x32x256_MI16x16x1_SN_LDSB1_CLR1_GRVWA8_GRVWB16_GSU0_GSUC0_GSUWGMRR0_K1_LBSPPA256_LBSPPB256_LPA8_LPB16_LRVW8_MIWT1_1_PLR1_SU0_SUM0_SUS256_VWA1_VWB1_WGM6_WGMXCC1_WGMXCCGn1
- - - [128, 128, 1, 128, 128, 128, 128, 128]
    - [68, 0.54]
  - - [128, 128, 1, 256, 128, 128, 256, 128]
    - [35, 1.01]
  - - [128, 128, 1, 512, 128, 128, 512, 128]
    - [68, 1.72]
  - - [128, 128, 1, 1024, 128, 128, 1024, 128]
    - [67, 2.76]
  - - [128, 128, 1, 2048, 128, 128, 2048, 128]
    - [69, 3.86]
  - - [128, 128, 1, 4096, 128, 128, 4096, 128]
    - [69, 4.76]
  - - [128, 128, 1, 8192, 128, 128, 8192, 128]
    - [69, 5.53]
  - - [128, 256, 1, 128, 128, 128, 128, 256]
    - [68, 1.12]
  - - [128, 256, 1, 256, 128, 128, 256, 256]
    - [67, 2.05]
  - - [128, 256, 1, 512, 128, 128, 512, 256]
    - [68, 3.5]
  - - [128, 256, 1, 1024, 128, 128, 1024, 256]
    - [67, 5.54]
  - - [128, 256, 1, 2048, 128, 128, 2048, 256]
    - [67, 7.69]
  - - [128, 256, 1, 4096, 128, 128, 4096, 256]
    - [69, 9.65]
  - - [128, 256, 1, 8192, 128, 128, 8192, 256]
    - [69, 11.11]
  - - [128, 512, 1, 128, 128, 128, 128, 512]
    - [35, 2.21]
  - - [128, 512, 1, 256, 128, 128, 256, 512]
    - [67, 4.03]
  - - [128, 512, 1, 512, 128, 128, 512, 512]
    - [67, 6.91]
  - - [128, 512, 1, 1024, 128, 128, 1024, 512]
    - [67, 10.84]
  - - [128, 512, 1, 2048, 128, 128, 2048, 512]
    - [69, 15.24]
  - - [128, 512, 1, 4096, 128, 128, 4096, 512]
    - [69, 19.05]
  - - [128, 512, 1, 8192, 128, 128, 8192, 512]
    - [86, 18.44]
  - - [128, 1024, 1, 128, 128, 128, 128, 1024]
    - [67, 4.28]
  - - [128, 1024, 1, 256, 128, 128, 256, 1024]
    - [67, 7.77]
  - - [128, 1024, 1, 512, 128, 128, 512, 1024]
    - [67, 13.52]
  - - [128, 1024, 1, 1024, 128, 128, 1024, 1024]
    - [67, 21.21]
  - - [128, 1024, 1, 2048, 128, 128, 2048, 1024]
    - [69, 29.74]
  - - [128, 1024, 1, 4096, 128, 128, 4096, 1024]
    - [86, 32.19]
  - - [128, 1024, 1, 8192, 128, 128, 8192, 1024]
    - [87, 32.14]
  - - [128, 2048, 1, 128, 128, 128, 128, 2048]
    - [34, 8.13]
  - - [128, 2048, 1, 256, 128, 128, 256, 2048]
    - [62, 14.56]
  - - [128, 2048, 1, 512, 128, 128, 512, 2048]
    - [64, 24.43]
  - - [128, 2048, 1, 1024, 128, 128, 1024, 2048]
    - [64, 37.56]
  - - [128, 2048, 1, 2048, 128, 128, 2048, 2048]
    - [82, 44.1]
  - - [128, 2048, 1, 4096, 128, 128, 4096, 2048]
    - [82, 52.92]
  - - [128, 2048, 1, 8192, 128, 128, 8192, 2048]
    - [82, 59.64]
  - - [128, 4096, 1, 128, 128, 128, 128, 4096]
    - [32, 14.95]
  - - [128, 4096, 1, 256, 128, 128, 256, 4096]
    - [32, 26.55]
  - - [128, 4096, 1, 512, 128, 128, 512, 4096]
    - [59, 43.39]
  - - [128, 4096, 1, 1024, 128, 128, 1024, 4096]
    - [59, 65.32]
  - - [128, 4096, 1, 2048, 128, 128, 2048, 4096]
    - [77, 78.72]
  - - [128, 4096, 1, 4096, 128, 128, 4096, 4096]
    - [77, 96.38]
  - - [128, 4096, 1, 8192, 128, 128, 8192, 4096]
    - [77, 109.33]
  - - [128, 8192, 1, 128, 128, 128, 128, 8192]
    - [20, 25.88]
  - - [128, 8192, 1, 256, 128, 128, 256, 8192]
    - [26, 45.33]
  - - [128, 8192, 1, 512, 128, 128, 512, 8192]
    - [25, 73.08]
  - - [128, 8192, 1, 1024, 128, 128, 1024, 8192]
    - [25, 106.77]
  - - [128, 8192, 1, 2048, 128, 128, 2048, 8192]
    - [56, 123.15]
  - - [128, 8192, 1, 4096, 128, 128, 4096, 8192]
    - [56, 145.43]
  - - [128, 8192, 1, 8192, 128, 128, 8192, 8192]
    - [73, 154.94]
  - - [256, 128, 1, 128, 256, 256, 128, 128]
    - [35, 1.11]
  - - [256, 128, 1, 256, 256, 256, 256, 128]
    - [35, 1.99]
  - - [256, 128, 1, 512, 256, 256, 512, 128]
    - [67, 3.44]
  - - [256, 128, 1, 1024, 256, 256, 1024, 128]
    - [69, 5.43]
  - - [256, 128, 1, 2048, 256, 256, 2048, 128]
    - [69, 7.6]
  - - [256, 128, 1, 4096, 256, 256, 4096, 128]
    - [69, 9.66]
  - - [256, 128, 1, 8192, 256, 256, 8192, 128]
    - [69, 11.09]
  - - [256, 256, 1, 128, 256, 256, 128, 256]
    - [35, 2.2]
  - - [256, 256, 1, 256, 256, 256, 256, 256]
    - [69, 3.9]
  - - [256, 256, 1, 512, 256, 256, 512, 256]
    - [67, 6.86]
  - - [256, 256, 1, 1024, 256, 256, 1024, 256]
    - [67, 10.85]
  - - [256, 256, 1, 2048, 256, 256, 2048, 256]
    - [69, 15.07]
  - - [256, 256, 1, 4096, 256, 256, 4096, 256]
    - [69, 19.18]
  - - [256, 256, 1, 8192, 256, 256, 8192, 256]
    - [71, 21.8]
  - - [256, 512, 1, 128, 256, 256, 128, 512]
    - [68, 4.12]
  - - [256, 512, 1, 256, 256, 256, 256, 512]
    - [68, 7.78]
  - - [256, 512, 1, 512, 256, 256, 512, 512]
    - [67, 13.5]
  - - [256, 512, 1, 1024, 256, 256, 1024, 512]
    - [67, 20.95]
  - - [256, 512, 1, 2048, 256, 256, 2048, 512]
    - [67, 29.76]
  - - [256, 512, 1, 4096, 256, 256, 4096, 512]
    - [69, 37.7]
  - - [256, 512, 1, 8192, 256, 256, 8192, 512]
    - [86, 38.95]
  - - [256, 1024, 1, 128, 256, 256, 128, 1024]
    - [33, 7.93]
  - - [256, 1024, 1, 256, 256, 256, 256, 1024]
    - [63, 14.5]
  - - [256, 1024, 1, 512, 256, 256, 512, 1024]
    - [62, 24.4]
  - - [256, 1024, 1, 1024, 256, 256, 1024, 1024]
    - [64, 37.39]
  - - [256, 1024, 1, 2048, 256, 256, 2048, 1024]
    - [64, 51.76]
  - - [256, 1024, 1, 4096, 256, 256, 4096, 1024]
    - [85, 57.8]
  - - [256, 1024, 1, 8192, 256, 256, 8192, 1024]
    - [84, 60.02]
  - - [256, 2048, 1, 128, 256, 256, 128, 2048]
    - [32, 15.09]
  - - [256, 2048, 1, 256, 256, 256, 256, 2048]
    - [31, 26.69]
  - - [256, 2048, 1, 512, 256, 256, 512, 2048]
    - [58, 43.5]
  - - [256, 2048, 1, 1024, 256, 256, 1024, 2048]
    - [59, 65.18]
  - - [256, 2048, 1, 2048, 256, 256, 2048, 2048]
    - [77, 80.94]
  - - [256, 2048, 1, 4096, 256, 256, 4096, 2048]
    - [77, 96.69]
  - - [256, 2048, 1, 8192, 256, 256, 8192, 2048]
    - [77, 108.55]
  - - [256, 4096, 1, 128, 256, 256, 128, 4096]
    - [26, 26.22]
  - - [256, 4096, 1, 256, 256, 256, 256, 4096]
    - [24, 45.3]
  - - [256, 4096, 1, 512, 256, 256, 512, 4096]
    - [25, 73.03]
  - - [256, 4096, 1, 1024, 256, 256, 1024, 4096]
    - [25, 106.19]
  - - [256, 4096, 1, 2048, 256, 256, 2048, 4096]
    - [73, 125.67]
  - - [256, 4096, 1, 4096, 256, 256, 4096, 4096]
    - [73, 150.36]
  - - [256, 4096, 1, 8192, 256, 256, 8192, 4096]
    - [73, 167.02]
  - - [256, 8192, 1, 128, 256, 256, 128, 8192]
    - [51, 40.58]
  - - [256, 8192, 1, 256, 256, 256, 256, 8192]
    - [22, 69.46]
  - - [256, 8192, 1, 512, 256, 256, 512, 8192]
    - [52, 111.08]
  - - [256, 8192, 1, 1024, 256, 256, 1024, 8192]
    - [52, 159.16]
  - - [256, 8192, 1, 2048, 256, 256, 2048, 8192]
    - [52, 186.26]
  - - [256, 8192, 1, 4096, 256, 256, 4096, 8192]
    - [52, 212.24]
  - - [256, 8192, 1, 8192, 256, 256, 8192, 8192]
    - [52, 211.46]
  - - [512, 128, 1, 128, 512, 512, 128, 128]
    - [35, 2.23]
  - - [512, 128, 1, 256, 512, 512, 256, 128]
    - [67, 4.03]
  - - [512, 128, 1, 512, 512, 512, 512, 128]
    - [67, 6.94]
  - - [512, 128, 1, 1024, 512, 512, 1024, 128]
    - [69, 10.97]
  - - [512, 128, 1, 2048, 512, 512, 2048, 128]
    - [67, 15.05]
  - - [512, 128, 1, 4096, 512, 512, 4096, 128]
    - [69, 19.18]
  - - [512, 128, 1, 8192, 512, 512, 8192, 128]
    - [69, 22.02]
  - - [512, 256, 1, 128, 512, 512, 128, 256]
    - [67, 4.33]
  - - [512, 256, 1, 256, 512, 512, 256, 256]
    - [35, 7.78]
  - - [512, 256, 1, 512, 512, 512, 512, 256]
    - [68, 13.43]
  - - [512, 256, 1, 1024, 512, 512, 1024, 256]
    - [67, 21.26]
  - - [512, 256, 1, 2048, 512, 512, 2048, 256]
    - [69, 30.12]
  - - [512, 256, 1, 4096, 512, 512, 4096, 256]
    - [69, 37.63]
  - - [512, 256, 1, 8192, 512, 512, 8192, 256]
    - [70, 43.11]
  - - [512, 512, 1, 128, 512, 512, 128, 512]
    - [34, 8.11]
  - - [512, 512, 1, 256, 512, 512, 256, 512]
    - [33, 14.38]
  - - [512, 512, 1, 512, 512, 512, 512, 512]
    - [62, 24.57]
  - - [512, 512, 1, 1024, 512, 512, 1024, 512]
    - [64, 37.89]
  - - [512, 512, 1, 2048, 512, 512, 2048, 512]
    - [64, 51.86]
  - - [512, 512, 1, 4096, 512, 512, 4096, 512]
    - [66, 63.25]
  - - [512, 512, 1, 8192, 512, 512, 8192, 512]
    - [61, 64.35]
  - - [512, 1024, 1, 128, 512, 512, 128, 1024]
    - [32, 15.06]
  - - [512, 1024, 1, 256, 512, 512, 256, 1024]
    - [32, 26.87]
  - - [512, 1024, 1, 512, 512, 512, 512, 1024]
    - [59, 43.34]
  - - [512, 1024, 1, 1024, 512, 512, 1024, 1024]
    - [60, 64.28]
  - - [512, 1024, 1, 2048, 512, 512, 2048, 1024]
    - [77, 87.7]
  - - [512, 1024, 1, 4096, 512, 512, 4096, 1024]
    - [77, 97.75]
  - - [512, 1024, 1, 8192, 512, 512, 8192, 1024]
    - [79, 107.58]
  - - [512, 2048, 1, 128, 512, 512, 128, 2048]
    - [20, 26.18]
  - - [512, 2048, 1, 256, 512, 512, 256, 2048]
    - [24, 45.37]
  - - [512, 2048, 1, 512, 512, 512, 512, 2048]
    - [25, 73.21]
  - - [512, 2048, 1, 1024, 512, 512, 1024, 2048]
    - [25, 106.24]
  - - [512, 2048, 1, 2048, 512, 512, 2048, 2048]
    - [73, 128.58]
  - - [512, 2048, 1, 4096, 512, 512, 4096, 2048]
    - [73, 152.71]
  - - [512, 2048, 1, 8192, 512, 512, 8192, 2048]
    - [75, 162.16]
  - - [512, 4096, 1, 128, 512, 512, 128, 4096]
    - [21, 40.78]
  - - [512, 4096, 1, 256, 512, 512, 256, 4096]
    - [22, 69.48]
  - - [512, 4096, 1, 512, 512, 512, 512, 4096]
    - [52, 111.03]
  - - [512, 4096, 1, 1024, 512, 512, 1024, 4096]
    - [52, 160.74]
  - - [512, 4096, 1, 2048, 512, 512, 2048, 4096]
    - [52, 192.54]
  - - [512, 4096, 1, 4096, 512, 512, 4096, 4096]
    - [52, 219.77]
  - - [512, 4096, 1, 8192, 512, 512, 8192, 4096]
    - [52, 211.39]
  - - [512, 8192, 1, 128, 512, 512, 128, 8192]
    - [16, 57.78]
  - - [512, 8192, 1, 256, 512, 512, 256, 8192]
    - [15, 98.0]
  - - [512, 8192, 1, 512, 512, 512, 512, 8192]
    - [13, 156.47]
  - - [512, 8192, 1, 1024, 512, 512, 1024, 8192]
    - [15, 218.35]
  - - [512, 8192, 1, 2048, 512, 512, 2048, 8192]
    - [36, 245.46]
  - - [512, 8192, 1, 4096, 512, 512, 4096, 8192]
    - [36, 268.07]
  - - [512, 8192, 1, 8192, 512, 512, 8192, 8192]
    - [36, 245.64]
  - - [1024, 128, 1, 128, 1024, 1024, 128, 128]
    - [68, 4.28]
  - - [1024, 128, 1, 256, 1024, 1024, 256, 128]
    - [68, 7.76]
  - - [1024, 128, 1, 512, 1024, 1024, 512, 128]
    - [67, 13.68]
  - - [1024, 128, 1, 1024, 1024, 1024, 1024, 128]
    - [69, 21.3]
  - - [1024, 128, 1, 2048, 1024, 1024, 2048, 128]
    - [67, 29.93]
  - - [1024, 128, 1, 4096, 1024, 1024, 4096, 128]
    - [69, 37.98]
  - - [1024, 128, 1, 8192, 1024, 1024, 8192, 128]
    - [72, 42.96]
  - - [1024, 256, 1, 128, 1024, 1024, 128, 256]
    - [62, 8.21]
  - - [1024, 256, 1, 256, 1024, 1024, 256, 256]
    - [63, 14.56]
  - - [1024, 256, 1, 512, 1024, 1024, 512, 256]
    - [63, 24.36]
  - - [1024, 256, 1, 1024, 1024, 1024, 1024, 256]
    - [62, 37.36]
  - - [1024, 256, 1, 2048, 1024, 1024, 2048, 256]
    - [64, 51.18]
  - - [1024, 256, 1, 4096, 1024, 1024, 4096, 256]
    - [65, 62.86]
  - - [1024, 256, 1, 8192, 1024, 1024, 8192, 256]
    - [83, 71.06]
  - - [1024, 512, 1, 128, 1024, 1024, 128, 512]
    - [32, 14.78]
  - - [1024, 512, 1, 256, 1024, 1024, 256, 512]
    - [31, 26.04]
  - - [1024, 512, 1, 512, 1024, 1024, 512, 512]
    - [59, 42.87]
  - - [1024, 512, 1, 1024, 1024, 1024, 1024, 512]
    - [59, 64.2]
  - - [1024, 512, 1, 2048, 1024, 1024, 2048, 512]
    - [77, 87.01]
  - - [1024, 512, 1, 4096, 1024, 1024, 4096, 512]
    - [78, 104.84]
  - - [1024, 512, 1, 8192, 1024, 1024, 8192, 512]
    - [80, 108.22]
  - - [1024, 1024, 1, 128, 1024, 1024, 128, 1024]
    - [24, 25.22]
  - - [1024, 1024, 1, 256, 1024, 1024, 256, 1024]
    - [25, 45.01]
  - - [1024, 1024, 1, 512, 1024, 1024, 512, 1024]
    - [25, 72.39]
  - - [1024, 1024, 1, 1024, 1024, 1024, 1024, 1024]
    - [25, 105.83]
  - - [1024, 1024, 1, 2048, 1024, 1024, 2048, 1024]
    - [29, 134.95]
  - - [1024, 1024, 1, 4096, 1024, 1024, 4096, 1024]
    - [74, 147.88]
  - - [1024, 1024, 1, 8192, 1024, 1024, 8192, 1024]
    - [75, 159.55]
  - - [1024, 2048, 1, 128, 1024, 1024, 128, 2048]
    - [51, 40.78]
  - - [1024, 2048, 1, 256, 1024, 1024, 256, 2048]
    - [22, 70.15]
  - - [1024, 2048, 1, 512, 1024, 1024, 512, 2048]
    - [52, 111.5]
  - - [1024, 2048, 1, 1024, 1024, 1024, 1024, 2048]
    - [52, 159.72]
  - - [1024, 2048, 1, 2048, 1024, 1024, 2048, 2048]
    - [52, 195.0]
  - - [1024, 2048, 1, 4096, 1024, 1024, 4096, 2048]
    - [53, 218.23]
  - - [1024, 2048, 1, 8192, 1024, 1024, 8192, 2048]
    - [55, 210.36]
  - - [1024, 4096, 1, 128, 1024, 1024, 128, 4096]
    - [14, 57.96]
  - - [1024, 4096, 1, 256, 1024, 1024, 256, 4096]
    - [13, 99.61]
  - - [1024, 4096, 1, 512, 1024, 1024, 512, 4096]
    - [13, 155.51]
  - - [1024, 4096, 1, 1024, 1024, 1024, 1024, 4096]
    - [15, 213.52]
  - - [1024, 4096, 1, 2048, 1024, 1024, 2048, 4096]
    - [40, 246.06]
  - - [1024, 4096, 1, 4096, 1024, 1024, 4096, 4096]
    - [36, 264.78]
  - - [1024, 4096, 1, 8192, 1024, 1024, 8192, 4096]
    - [40, 245.56]
  - - [1024, 8192, 1, 128, 1024, 1024, 128, 8192]
    - [6, 73.54]
  - - [1024, 8192, 1, 256, 1024, 1024, 256, 8192]
    - [6, 123.58]
  - - [1024, 8192, 1, 512, 1024, 1024, 512, 8192]
    - [6, 184.78]
  - - [1024, 8192, 1, 1024, 1024, 1024, 1024, 8192]
    - [3, 246.68]
  - - [1024, 8192, 1, 2048, 1024, 1024, 2048, 8192]
    - [6, 280.19]
  - - [1024, 8192, 1, 4096, 1024, 1024, 4096, 8192]
    - [2, 275.2]
  - - [1024, 8192, 1, 8192, 1024, 1024, 8192, 8192]
    - [1, 288.8]
  - - [2048, 128, 1, 128, 2048, 2048, 128, 128]
    - [34, 8.09]
  - - [2048, 128, 1, 256, 2048, 2048, 256, 128]
    - [33, 14.58]
  - - [2048, 128, 1, 512, 2048, 2048, 512, 128]
    - [63, 24.52]
  - - [2048, 128, 1, 1024, 2048, 2048, 1024, 128]
    - [64, 37.24]
  - - [2048, 128, 1, 2048, 2048, 2048, 2048, 128]
    - [64, 51.55]
  - - [2048, 128, 1, 4096, 2048, 2048, 4096, 128]
    - [66, 62.84]
  - - [2048, 128, 1, 8192, 2048, 2048, 8192, 128]
    - [81, 70.86]
  - - [2048, 256, 1, 128, 2048, 2048, 128, 256]
    - [32, 14.61]
  - - [2048, 256, 1, 256, 2048, 2048, 256, 256]
    - [32, 26.47]
  - - [2048, 256, 1, 512, 2048, 2048, 512, 256]
    - [31, 43.04]
  - - [2048, 256, 1, 1024, 2048, 2048, 1024, 256]
    - [59, 65.52]
  - - [2048, 256, 1, 2048, 2048, 2048, 2048, 256]
    - [77, 87.17]
  - - [2048, 256, 1, 4096, 2048, 2048, 4096, 256]
    - [80, 105.3]
  - - [2048, 256, 1, 8192, 2048, 2048, 8192, 256]
    - [79, 117.8]
  - - [2048, 512, 1, 128, 2048, 2048, 128, 512]
    - [23, 25.89]
  - - [2048, 512, 1, 256, 2048, 2048, 256, 512]
    - [25, 45.07]
  - - [2048, 512, 1, 512, 2048, 2048, 512, 512]
    - [25, 72.23]
  - - [2048, 512, 1, 1024, 2048, 2048, 1024, 512]
    - [25, 105.72]
  - - [2048, 512, 1, 2048, 2048, 2048, 2048, 512]
    - [27, 135.77]
  - - [2048, 512, 1, 4096, 2048, 2048, 4096, 512]
    - [76, 152.86]
  - - [2048, 512, 1, 8192, 2048, 2048, 8192, 512]
    - [75, 160.74]
  - - [2048, 1024, 1, 128, 2048, 2048, 128, 1024]
    - [21, 41.31]
  - - [2048, 1024, 1, 256, 2048, 2048, 256, 1024]
    - [22, 70.48]
  - - [2048, 1024, 1, 512, 2048, 2048, 512, 1024]
    - [52, 112.21]
  - - [2048, 1024, 1, 1024, 2048, 2048, 1024, 1024]
    - [52, 160.49]
  - - [2048, 1024, 1, 2048, 2048, 2048, 2048, 1024]
    - [55, 198.09]
  - - [2048, 1024, 1, 4096, 2048, 2048, 4096, 1024]
    - [53, 214.37]
  - - [2048, 1024, 1, 8192, 2048, 2048, 8192, 1024]
    - [54, 210.12]
  - - [2048, 2048, 1, 128, 2048, 2048, 128, 2048]
    - [14, 58.31]
  - - [2048, 2048, 1, 256, 2048, 2048, 256, 2048]
    - [13, 99.57]
  - - [2048, 2048, 1, 512, 2048, 2048, 512, 2048]
    - [13, 155.89]
  - - [2048, 2048, 1, 1024, 2048, 2048, 1024, 2048]
    - [15, 205.64]
  - - [2048, 2048, 1, 2048, 2048, 2048, 2048, 2048]
    - [42, 244.73]
  - - [2048, 2048, 1, 4096, 2048, 2048, 4096, 2048]
    - [37, 262.72]
  - - [2048, 2048, 1, 8192, 2048, 2048, 8192, 2048]
    - [43, 245.13]
  - - [2048, 4096, 1, 128, 2048, 2048, 128, 4096]
    - [0, 72.44]
  - - [2048, 4096, 1, 256, 2048, 2048, 256, 4096]
    - [1, 122.54]
  - - [2048, 4096, 1, 512, 2048, 2048, 512, 4096]
    - [1, 183.46]
  - - [2048, 4096, 1, 1024, 2048, 2048, 1024, 4096]
    - [7, 246.0]
  - - [2048, 4096, 1, 2048, 2048, 2048, 2048, 4096]
    - [6, 280.36]
  - - [2048, 4096, 1, 4096, 2048, 2048, 4096, 4096]
    - [3, 268.32]
  - - [2048, 4096, 1, 8192, 2048, 2048, 8192, 4096]
    - [3, 286.63]
  - - [2048, 8192, 1, 128, 2048, 2048, 128, 8192]
    - [4, 79.0]
  - - [2048, 8192, 1, 256, 2048, 2048, 256, 8192]
    - [4, 131.8]
  - - [2048, 8192, 1, 512, 2048, 2048, 512, 8192]
    - [6, 197.47]
  - - [2048, 8192, 1, 1024, 2048, 2048, 1024, 8192]
    - [3, 241.35]
  - - [2048, 8192, 1, 2048, 2048, 2048, 2048, 8192]
    - [12, 251.9]
  - - [2048, 8192, 1, 4096, 2048, 2048, 4096, 8192]
    - [38, 286.51]
  - - [2048, 8192, 1, 8192, 2048, 2048, 8192, 8192]
    - [41, 321.46]
  - - [4096, 128, 1, 128, 4096, 4096, 128, 128]
    - [30, 14.89]
  - - [4096, 128, 1, 256, 4096, 4096, 256, 128]
    - [32, 26.45]
  - - [4096, 128, 1, 512, 4096, 4096, 512, 128]
    - [59, 42.96]
  - - [4096, 128, 1, 1024, 4096, 4096, 1024, 128]
    - [59, 64.4]
  - - [4096, 128, 1, 2048, 4096, 4096, 2048, 128]
    - [77, 86.74]
  - - [4096, 128, 1, 4096, 4096, 4096, 4096, 128]
    - [80, 105.51]
  - - [4096, 128, 1, 8192, 4096, 4096, 8192, 128]
    - [80, 117.83]
  - - [4096, 256, 1, 128, 4096, 4096, 128, 256]
    - [28, 25.13]
  - - [4096, 256, 1, 256, 4096, 4096, 256, 256]
    - [24, 44.45]
  - - [4096, 256, 1, 512, 4096, 4096, 512, 256]
    - [29, 71.91]
  - - [4096, 256, 1, 1024, 4096, 4096, 1024, 256]
    - [27, 105.23]
  - - [4096, 256, 1, 2048, 4096, 4096, 2048, 256]
    - [27, 136.96]
  - - [4096, 256, 1, 4096, 4096, 4096, 4096, 256]
    - [75, 152.04]
  - - [4096, 256, 1, 8192, 4096, 4096, 8192, 256]
    - [74, 161.56]
  - - [4096, 512, 1, 128, 4096, 4096, 128, 512]
    - [22, 41.7]
  - - [4096, 512, 1, 256, 4096, 4096, 256, 512]
    - [22, 70.12]
  - - [4096, 512, 1, 512, 4096, 4096, 512, 512]
    - [52, 112.78]
  - - [4096, 512, 1, 1024, 4096, 4096, 1024, 512]
    - [52, 159.32]
  - - [4096, 512, 1, 2048, 4096, 4096, 2048, 512]
    - [55, 198.14]
  - - [4096, 512, 1, 4096, 4096, 4096, 4096, 512]
    - [53, 209.73]
  - - [4096, 512, 1, 8192, 4096, 4096, 8192, 512]
    - [53, 209.44]
  - - [4096, 1024, 1, 128, 4096, 4096, 128, 1024]
    - [14, 58.57]
  - - [4096, 1024, 1, 256, 4096, 4096, 256, 1024]
    - [13, 100.29]
  - - [4096, 1024, 1, 512, 4096, 4096, 512, 1024]
    - [13, 156.17]
  - - [4096, 1024, 1, 1024, 4096, 4096, 1024, 1024]
    - [17, 209.21]
  - - [4096, 1024, 1, 2048, 4096, 4096, 2048, 1024]
    - [44, 249.25]
  - - [4096, 1024, 1, 4096, 4096, 4096, 4096, 1024]
    - [37, 267.17]
  - - [4096, 1024, 1, 8192, 4096, 4096, 8192, 1024]
    - [37, 248.9]
  - - [4096, 2048, 1, 128, 4096, 4096, 128, 2048]
    - [0, 72.36]
  - - [4096, 2048, 1, 256, 4096, 4096, 256, 2048]
    - [1, 121.8]
  - - [4096, 2048, 1, 512, 4096, 4096, 512, 2048]
    - [4, 181.23]
  - - [4096, 2048, 1, 1024, 4096, 4096, 1024, 2048]
    - [6, 248.16]
  - - [4096, 2048, 1, 2048, 4096, 4096, 2048, 2048]
    - [3, 280.14]
  - - [4096, 2048, 1, 4096, 4096, 4096, 4096, 2048]
    - [46, 271.91]
  - - [4096, 2048, 1, 8192, 4096, 4096, 8192, 2048]
    - [48, 292.93]
  - - [4096, 4096, 1, 128, 4096, 4096, 128, 4096]
    - [1, 78.82]
  - - [4096, 4096, 1, 256, 4096, 4096, 256, 4096]
    - [4, 130.82]
  - - [4096, 4096, 1, 512, 4096, 4096, 512, 4096]
    - [6, 196.45]
  - - [4096, 4096, 1, 1024, 4096, 4096, 1024, 4096]
    - [4, 246.97]
  - - [4096, 4096, 1, 2048, 4096, 4096, 2048, 4096]
    - [11, 251.16]
  - - [4096, 4096, 1, 4096, 4096, 4096, 4096, 4096]
    - [5, 286.87]
  - - [4096, 4096, 1, 8192, 4096, 4096, 8192, 4096]
    - [41, 320.33]
  - - [4096, 8192, 1, 128, 4096, 4096, 128, 8192]
    - [6, 84.6]
  - - [4096, 8192, 1, 256, 4096, 4096, 256, 8192]
    - [21, 139.06]
  - - [4096, 8192, 1, 512, 4096, 4096, 512, 8192]
    - [8, 202.0]
  - - [4096, 8192, 1, 1024, 4096, 4096, 1024, 8192]
    - [39, 241.2]
  - - [4096, 8192, 1, 2048, 4096, 4096, 2048, 8192]
    - [37, 288.55]
  - - [4096, 8192, 1, 4096, 4096, 4096, 4096, 8192]
    - [2, 333.51]
  - - [4096, 8192, 1, 8192, 4096, 4096, 8192, 8192]
    - [4, 370.11]
  - - [8192, 128, 1, 128, 8192, 8192, 128, 128]
    - [26, 26.36]
  - - [8192, 128, 1, 256, 8192, 8192, 256, 128]
    - [25, 45.48]
  - - [8192, 128, 1, 512, 8192, 8192, 512, 128]
    - [25, 74.44]
  - - [8192, 128, 1, 1024, 8192, 8192, 1024, 128]
    - [25, 106.39]
  - - [8192, 128, 1, 2048, 8192, 8192, 2048, 128]
    - [27, 136.81]
  - - [8192, 128, 1, 4096, 8192, 8192, 4096, 128]
    - [56, 146.47]
  - - [8192, 128, 1, 8192, 8192, 8192, 8192, 128]
    - [57, 157.74]
  - - [8192, 256, 1, 128, 8192, 8192, 128, 256]
    - [22, 41.3]
  - - [8192, 256, 1, 256, 8192, 8192, 256, 256]
    - [22, 70.16]
  - - [8192, 256, 1, 512, 8192, 8192, 512, 256]
    - [52, 111.52]
  - - [8192, 256, 1, 1024, 8192, 8192, 1024, 256]
    - [55, 159.67]
  - - [8192, 256, 1, 2048, 8192, 8192, 2048, 256]
    - [54, 200.11]
  - - [8192, 256, 1, 4096, 8192, 8192, 4096, 256]
    - [54, 207.19]
  - - [8192, 256, 1, 8192, 8192, 8192, 8192, 256]
    - [55, 205.83]
  - - [8192, 512, 1, 128, 8192, 8192, 128, 512]
    - [14, 58.49]
  - - [8192, 512, 1, 256, 8192, 8192, 256, 512]
    - [15, 98.03]
  - - [8192, 512, 1, 512, 8192, 8192, 512, 512]
    - [18, 155.16]
  - - [8192, 512, 1, 1024, 8192, 8192, 1024, 512]
    - [49, 225.22]
  - - [8192, 512, 1, 2048, 8192, 8192, 2048, 512]
    - [50, 255.87]
  - - [8192, 512, 1, 4096, 8192, 8192, 4096, 512]
    - [50, 271.98]
  - - [8192, 512, 1, 8192, 8192, 8192, 8192, 512]
    - [49, 270.97]
  - - [8192, 1024, 1, 128, 8192, 8192, 128, 1024]
    - [6, 72.48]
  - - [8192, 1024, 1, 256, 8192, 8192, 256, 1024]
    - [4, 122.11]
  - - [8192, 1024, 1, 512, 8192, 8192, 512, 1024]
    - [45, 184.64]
  - - [8192, 1024, 1, 1024, 8192, 8192, 1024, 1024]
    - [4, 245.3]
  - - [8192, 1024, 1, 2048, 8192, 8192, 2048, 1024]
    - [45, 305.36]
  - - [8192, 1024, 1, 4096, 8192, 8192, 4096, 1024]
    - [45, 349.9]
  - - [8192, 1024, 1, 8192, 8192, 8192, 8192, 1024]
    - [45, 365.58]
  - - [8192, 2048, 1, 128, 8192, 8192, 128, 2048]
    - [48, 77.55]
  - - [8192, 2048, 1, 256, 8192, 8192, 256, 2048]
    - [48, 131.4]
  - - [8192, 2048, 1, 512, 8192, 8192, 512, 2048]
    - [3, 193.49]
  - - [8192, 2048, 1, 1024, 8192, 8192, 1024, 2048]
    - [47, 259.23]
  - - [8192, 2048, 1, 2048, 8192, 8192, 2048, 2048]
    - [48, 305.64]
  - - [8192, 2048, 1, 4096, 8192, 8192, 4096, 2048]
    - [48, 348.81]
  - - [8192, 2048, 1, 8192, 8192, 8192, 8192, 2048]
    - [45, 394.45]
  - - [8192, 4096, 1, 128, 8192, 8192, 128, 4096]
    - [1, 84.58]
  - - [8192, 4096, 1, 256, 8192, 8192, 256, 4096]
    - [6, 135.22]
  - - [8192, 4096, 1, 512, 8192, 8192, 512, 4096]
    - [10, 199.52]
  - - [8192, 4096, 1, 1024, 8192, 8192, 1024, 4096]
    - [46, 246.16]
  - - [8192, 4096, 1, 2048, 8192, 8192, 2048, 4096]
    - [46, 311.33]
  - - [8192, 4096, 1, 4096, 8192, 8192, 4096, 4096]
    - [45, 367.23]
  - - [8192, 4096, 1, 8192, 8192, 8192, 8192, 4096]
    - [45, 410.77]
  - - [8192, 8192, 1, 128, 8192, 8192, 128, 8192]
    - [19, 88.17]
  - - [8192, 8192, 1, 256, 8192, 8192, 256, 8192]
    - [9, 147.86]
  - - [8192, 8192, 1, 512, 8192, 8192, 512, 8192]
    - [3, 216.72]
  - - [8192, 8192, 1, 1024, 8192, 8192, 1024, 8192]
    - [6, 285.99]
  - - [8192, 8192, 1, 2048, 8192, 8192, 2048, 8192]
    - [6, 341.21]
  - - [8192, 8192, 1, 4096, 8192, 8192, 4096, 8192]
    - [45, 382.12]
  - - [8192, 8192, 1, 8192, 8192, 8192, 8192, 8192]
    - [45, 412.66]
- null
- null
- ExperimentalStreamK
- GridBased
