projects/hipblaslt/library/src/amd_detail/rocblaslt/src/Tensile/Logic/asm_full/aquavanjaram/gfx942_228cu/StreamK/aquavanjaram942_Cijk_Alik_Bljk_B8NHS_BH_Bias_HAS_SAV_UserArgs.yaml
- {MinimumRequiredVersion: 4.33.0}
- aquavanjaram942
- {Architecture: gfx942, CUCount: 228}
- [Device 0049, Device 0050]
    SolutionIndex: 0
    SolutionNameMin: Cijk_Alik_Bljk_B8NHS_BH_Bias_HAS_SAV_UserArgs_MT256x256x64_MI16x16x1_SN_LDSB1_CLR1_GRVWA8_GRVWB16_GSU0_GSUC0_GSUWGMRR0_K1_LBSPPA512_LBSPPB512_LPA8_LPB16_LRVW8_MIWT8_8_PLR1_SU0_SUM0_SUS64_VWA8_VWB8_WGM1_WGMXCC1_WGMXCCGn1
    SolutionIndex: 1
    SolutionNameMin: Cijk_Alik_Bljk_B8NHS_BH_Bias_HAS_SAV_UserArgs_MT256x256x64_MI16x16x1_SN_LDSB1_CLR1_GRVWA16_GRVWB16_GSU0_GSUC0_GSUWGMRR0_K1_LBSPPA512_LBSPPB512_LPA16_LPB16_LRVW8_MIWT8_8_PLR1_SU0_SUM0_SUS64_VWA8_VWB8_WGM1_WGMXCC1_WGMXCCGn1
    SolutionIndex: 2
    SolutionNameMin: Cijk_Alik_Bljk_B8NHS_BH_Bias_HAS_SAV_UserArgs_MT256x256x64_MI16x16x1_SN_LDSB1_CLR1_GRVWA16_GRVWB16_GSU0_GSUC0_GSUWGMRR0_K1_LBSPPA512_LBSPPB512_LPA16_LPB16_LRVW8_MIWT8_8_PLR1_SU0_SUM0_SUS64_VWA8_VWB8_WGM4_WGMXCC1_WGMXCCGn1
    SolutionIndex: 3
    SolutionNameMin: Cijk_Alik_Bljk_B8NHS_BH_Bias_HAS_SAV_UserArgs_MT256x256x64_MI16x16x1_SN_LDSB1_CLR1_GRVWA16_GRVWB16_GSU0_GSUC0_GSUWGMRR0_K1_LBSPPA512_LBSPPB512_LPA16_LPB16_LRVW8_MIWT8_8_PLR1_SU0_SUM0_SUS64_VWA8_VWB8_WGM6_WGMXCC1_WGMXCCGn1
    SolutionIndex: 4
    SolutionNameMin: Cijk_Alik_Bljk_B8NHS_BH_Bias_HAS_SAV_UserArgs_MT128x256x64_MI16x16x1_SN_LDSB1_CLR1_GRVWA8_GRVWB16_GSU0_GSUC0_GSUWGMRR0_K1_LBSPPA256_LBSPPB512_LPA8_LPB16_LRVW8_MIWT4_8_PLR1_SU0_SUM0_SUS64_VWA4_VWB8_WGM8_WGMXCC1_WGMXCCGn1
    SolutionIndex: 5
    SolutionNameMin: Cijk_Alik_Bljk_B8NHS_BH_Bias_HAS_SAV_UserArgs_MT256x128x64_MI16x16x1_SN_LDSB1_CLR1_GRVWA16_GRVWB8_GSU0_GSUC0_GSUWGMRR0_K1_LBSPPA512_LBSPPB256_LPA16_LPB8_LRVW8_MIWT8_4_PLR1_SU0_SUM0_SUS64_VWA8_VWB4_WGM1_WGMXCC1_WGMXCCGn1
    SolutionIndex: 6
    SolutionNameMin: Cijk_Alik_Bljk_B8NHS_BH_Bias_HAS_SAV_UserArgs_MT256x128x64_MI16x16x1_SN_LDSB1_CLR1_GRVWA8_GRVWB16_GSU0_GSUC0_GSUWGMRR0_K1_LBSPPA512_LBSPPB256_LPA8_LPB16_LRVW8_MIWT8_4_PLR1_SU0_SUM0_SUS64_VWA8_VWB4_WGM1_WGMXCC1_WGMXCCGn1
    SolutionIndex: 7
    SolutionNameMin: Cijk_Alik_Bljk_B8NHS_BH_Bias_HAS_SAV_UserArgs_MT256x128x64_MI16x16x1_SN_LDSB1_CLR1_GRVWA8_GRVWB16_GSU0_GSUC0_GSUWGMRR0_K1_LBSPPA512_LBSPPB256_LPA8_LPB16_LRVW8_MIWT8_4_PLR1_SU0_SUM0_SUS64_VWA8_VWB4_WGM8_WGMXCC1_WGMXCCGn1
    SolutionIndex: 8
    SolutionNameMin: Cijk_Alik_Bljk_B8NHS_BH_Bias_HAS_SAV_UserArgs_MT128x128x64_MI16x16x1_SN_LDSB1_CLR1_GRVWA8_GRVWB16_GSU0_GSUC0_GSUWGMRR0_K1_LBSPPA512_LBSPPB128_LPA8_LPB16_LRVW8_MIWT8_2_PLR1_SU0_SUM0_SUS64_VWA8_VWB2_WGM1_WGMXCC1_WGMXCCGn1
    SolutionIndex: 9
    SolutionNameMin: Cijk_Alik_Bljk_B8NHS_BH_Bias_HAS_SAV_UserArgs_MT128x128x64_MI16x16x1_SN_LDSB1_CLR1_GRVWA8_GRVWB16_GSU0_GSUC0_GSUWGMRR0_K1_LBSPPA512_LBSPPB128_LPA8_LPB16_LRVW8_MIWT8_2_PLR1_SU0_SUM0_SUS64_VWA8_VWB2_WGM6_WGMXCC1_WGMXCCGn1
    SolutionIndex: 10
    SolutionNameMin: Cijk_Alik_Bljk_B8NHS_BH_Bias_HAS_SAV_UserArgs_MT256x32x64_MI16x16x1_SN_LDSB1_CLR1_GRVWA8_GRVWB8_GSU0_GSUC0_GSUWGMRR0_K1_LBSPPA512_LBSPPB128_LPA8_LPB8_LRVW8_MIWT8_1_PLR1_SU0_SUM0_SUS64_VWA8_VWB1_WGM6_WGMXCC1_WGMXCCGn1
    SolutionIndex: 11
    SolutionNameMin: Cijk_Alik_Bljk_B8NHS_BH_Bias_HAS_SAV_UserArgs_MT128x64x64_MI16x16x1_SN_LDSB0_CLR1_GRVWA8_GRVWB16_GSU0_GSUC0_GSUWGMRR0_K1_LBSPPA512_LBSPPB128_LPA8_LPB16_LRVW8_MIWT8_1_PLR1_SU0_SUM0_SUS64_VWA8_VWB1_WGM1_WGMXCC1_WGMXCCGn1
    SolutionIndex: 12
    SolutionNameMin: Cijk_Alik_Bljk_B8NHS_BH_Bias_HAS_SAV_UserArgs_MT64x128x64_MI16x16x1_SN_LDSB0_CLR1_GRVWA8_GRVWB8_GSU0_GSUC0_GSUWGMRR0_K1_LBSPPA128_LBSPPB256_LPA8_LPB8_LRVW8_MIWT2_4_PLR1_SU0_SUM0_SUS64_VWA2_VWB4_WGM1_WGMXCC1_WGMXCCGn1
    SolutionIndex: 13
    SolutionNameMin: Cijk_Alik_Bljk_B8NHS_BH_Bias_HAS_SAV_UserArgs_MT64x128x64_MI16x16x1_SN_LDSB0_CLR1_GRVWA16_GRVWB8_GSU0_GSUC0_GSUWGMRR0_K1_LBSPPA128_LBSPPB256_LPA16_LPB8_LRVW8_MIWT2_4_PLR1_SU0_SUM0_SUS64_VWA2_VWB4_WGM1_WGMXCC1_WGMXCCGn1
    SolutionIndex: 14
    SolutionNameMin: Cijk_Alik_Bljk_B8NHS_BH_Bias_HAS_SAV_UserArgs_MT64x128x64_MI16x16x1_SN_LDSB0_CLR1_GRVWA8_GRVWB16_GSU0_GSUC0_GSUWGMRR0_K1_LBSPPA128_LBSPPB256_LPA8_LPB16_LRVW8_MIWT2_4_PLR1_SU0_SUM0_SUS64_VWA2_VWB4_WGM1_WGMXCC1_WGMXCCGn1
    SolutionIndex: 15
    SolutionNameMin: Cijk_Alik_Bljk_B8NHS_BH_Bias_HAS_SAV_UserArgs_MT128x64x64_MI16x16x1_SN_LDSB0_CLR1_GRVWA16_GRVWB8_GSU0_GSUC0_GSUWGMRR0_K1_LBSPPA256_LBSPPB128_LPA16_LPB8_LRVW8_MIWT4_2_PLR1_SU0_SUM0_SUS64_VWA4_VWB2_WGM1_WGMXCC1_WGMXCCGn1
    SolutionIndex: 16
    SolutionNameMin: Cijk_Alik_Bljk_B8NHS_BH_Bias_HAS_SAV_UserArgs_MT128x64x64_MI16x16x1_SN_LDSB0_CLR1_GRVWA8_GRVWB16_GSU0_GSUC0_GSUWGMRR0_K1_LBSPPA256_LBSPPB128_LPA8_LPB16_LRVW8_MIWT4_2_PLR1_SU0_SUM0_SUS64_VWA4_VWB2_WGM1_WGMXCC1_WGMXCCGn1
    SolutionIndex: 17
    SolutionNameMin: Cijk_Alik_Bljk_B8NHS_BH_Bias_HAS_SAV_UserArgs_MT128x64x64_MI16x16x1_SN_LDSB0_CLR1_GRVWA16_GRVWB16_GSU0_GSUC0_GSUWGMRR0_K1_LBSPPA256_LBSPPB128_LPA16_LPB16_LRVW8_MIWT4_2_PLR1_SU0_SUM0_SUS64_VWA4_VWB2_WGM1_WGMXCC1_WGMXCCGn1
    SolutionIndex: 18
    SolutionNameMin: Cijk_Alik_Bljk_B8NHS_BH_Bias_HAS_SAV_UserArgs_MT128x64x64_MI16x16x1_SN_LDSB0_CLR1_GRVWA8_GRVWB16_GSU0_GSUC0_GSUWGMRR0_K1_LBSPPA256_LBSPPB128_LPA8_LPB16_LRVW8_MIWT4_2_PLR1_SU0_SUM0_SUS64_VWA4_VWB2_WGM4_WGMXCC1_WGMXCCGn1
    SolutionIndex: 19
    SolutionNameMin: Cijk_Alik_Bljk_B8NHS_BH_Bias_HAS_SAV_UserArgs_MT128x64x64_MI16x16x1_SN_LDSB0_CLR1_GRVWA8_GRVWB16_GSU0_GSUC0_GSUWGMRR0_K1_LBSPPA256_LBSPPB128_LPA8_LPB16_LRVW8_MIWT4_2_PLR1_SU0_SUM0_SUS64_VWA4_VWB2_WGM6_WGMXCC1_WGMXCCGn1
    SolutionIndex: 20
    SolutionNameMin: Cijk_Alik_Bljk_B8NHS_BH_Bias_HAS_SAV_UserArgs_MT128x64x64_MI16x16x1_SN_LDSB0_CLR1_GRVWA8_GRVWB16_GSU0_GSUC0_GSUWGMRR0_K1_LBSPPA256_LBSPPB128_LPA8_LPB16_LRVW8_MIWT4_2_PLR1_SU0_SUM0_SUS64_VWA4_VWB2_WGM8_WGMXCC1_WGMXCCGn1
    SolutionIndex: 21
    SolutionNameMin: Cijk_Alik_Bljk_B8NHS_BH_Bias_HAS_SAV_UserArgs_MT64x64x64_MI16x16x1_SN_LDSB0_CLR1_GRVWA8_GRVWB8_GSU0_GSUC0_GSUWGMRR0_K1_LBSPPA128_LBSPPB128_LPA8_LPB8_LRVW8_MIWT2_2_PLR1_SU0_SUM0_SUS64_VWA2_VWB2_WGM1_WGMXCC1_WGMXCCGn1
    SolutionIndex: 22
    SolutionNameMin: Cijk_Alik_Bljk_B8NHS_BH_Bias_HAS_SAV_UserArgs_MT64x64x64_MI16x16x1_SN_LDSB0_CLR1_GRVWA8_GRVWB16_GSU0_GSUC0_GSUWGMRR0_K1_LBSPPA128_LBSPPB128_LPA8_LPB16_LRVW8_MIWT2_2_PLR1_SU0_SUM0_SUS64_VWA2_VWB2_WGM1_WGMXCC1_WGMXCCGn1
    SolutionIndex: 23
    SolutionNameMin: Cijk_Alik_Bljk_B8NHS_BH_Bias_HAS_SAV_UserArgs_MT64x64x64_MI16x16x1_SN_LDSB0_CLR1_GRVWA16_GRVWB16_GSU0_GSUC0_GSUWGMRR0_K1_LBSPPA128_LBSPPB128_LPA16_LPB16_LRVW8_MIWT2_2_PLR1_SU0_SUM0_SUS64_VWA2_VWB2_WGM1_WGMXCC1_WGMXCCGn1
    SolutionIndex: 24
    SolutionNameMin: Cijk_Alik_Bljk_B8NHS_BH_Bias_HAS_SAV_UserArgs_MT64x64x64_MI16x16x1_SN_LDSB0_CLR1_GRVWA8_GRVWB8_GSU0_GSUC0_GSUWGMRR0_K1_LBSPPA128_LBSPPB128_LPA8_LPB8_LRVW8_MIWT2_2_PLR1_SU0_SUM0_SUS64_VWA2_VWB2_WGM4_WGMXCC1_WGMXCCGn1
    SolutionIndex: 25
    SolutionNameMin: Cijk_Alik_Bljk_B8NHS_BH_Bias_HAS_SAV_UserArgs_MT64x64x64_MI16x16x1_SN_LDSB0_CLR1_GRVWA16_GRVWB8_GSU0_GSUC0_GSUWGMRR0_K1_LBSPPA128_LBSPPB128_LPA16_LPB8_LRVW8_MIWT2_2_PLR1_SU0_SUM0_SUS64_VWA2_VWB2_WGM4_WGMXCC1_WGMXCCGn1
    SolutionIndex: 26
    SolutionNameMin: Cijk_Alik_Bljk_B8NHS_BH_Bias_HAS_SAV_UserArgs_MT64x64x64_MI16x16x1_SN_LDSB0_CLR1_GRVWA16_GRVWB8_GSU0_GSUC0_GSUWGMRR0_K1_LBSPPA128_LBSPPB128_LPA16_LPB8_LRVW8_MIWT2_2_PLR1_SU0_SUM0_SUS64_VWA2_VWB2_WGM8_WGMXCC1_WGMXCCGn1
    SolutionIndex: 27
    SolutionNameMin: Cijk_Alik_Bljk_B8NHS_BH_Bias_HAS_SAV_UserArgs_MT32x64x64_MI16x16x1_SN_LDSB0_CLR1_GRVWA8_GRVWB8_GSU0_GSUC0_GSUWGMRR0_K1_LBSPPA128_LBSPPB128_LPA8_LPB8_LRVW8_MIWT1_2_PLR1_SU0_SUM0_SUS64_VWA1_VWB2_WGM1_WGMXCC1_WGMXCCGn1
    SolutionIndex: 28
    SolutionNameMin: Cijk_Alik_Bljk_B8NHS_BH_Bias_HAS_SAV_UserArgs_MT64x32x64_MI16x16x1_SN_LDSB0_CLR1_GRVWA8_GRVWB8_GSU0_GSUC0_GSUWGMRR0_K1_LBSPPA128_LBSPPB128_LPA8_LPB8_LRVW8_MIWT2_1_PLR1_SU0_SUM0_SUS64_VWA2_VWB1_WGM1_WGMXCC1_WGMXCCGn1
    SolutionIndex: 29
    SolutionNameMin: Cijk_Alik_Bljk_B8NHS_BH_Bias_HAS_SAV_UserArgs_MT64x32x64_MI16x16x1_SN_LDSB0_CLR1_GRVWA16_GRVWB8_GSU0_GSUC0_GSUWGMRR0_K1_LBSPPA128_LBSPPB128_LPA16_LPB8_LRVW8_MIWT2_1_PLR1_SU0_SUM0_SUS64_VWA2_VWB1_WGM1_WGMXCC1_WGMXCCGn1
    SolutionIndex: 30
    SolutionNameMin: Cijk_Alik_Bljk_B8NHS_BH_Bias_HAS_SAV_UserArgs_MT64x32x64_MI16x16x1_SN_LDSB0_CLR1_GRVWA8_GRVWB8_GSU0_GSUC0_GSUWGMRR0_K1_LBSPPA128_LBSPPB128_LPA8_LPB8_LRVW8_MIWT2_1_PLR1_SU0_SUM0_SUS64_VWA2_VWB1_WGM8_WGMXCC1_WGMXCCGn1
    SolutionIndex: 31
    SolutionNameMin: Cijk_Alik_Bljk_B8NHS_BH_Bias_HAS_SAV_UserArgs_MT32x32x64_MI16x16x1_SN_LDSB0_CLR1_GRVWA8_GRVWB8_GSU0_GSUC0_GSUWGMRR0_K1_LBSPPA128_LBSPPB128_LPA8_LPB8_LRVW8_MIWT1_1_PLR1_SU0_SUM0_SUS64_VWA1_VWB1_WGM1_WGMXCC1_WGMXCCGn1
    SolutionIndex: 32
    SolutionNameMin: Cijk_Alik_Bljk_B8NHS_BH_Bias_HAS_SAV_UserArgs_MT32x32x64_MI16x16x1_SN_LDSB0_CLR1_GRVWA8_GRVWB8_GSU0_GSUC0_GSUWGMRR0_K1_LBSPPA128_LBSPPB128_LPA8_LPB8_LRVW8_MIWT1_1_PLR1_SU0_SUM0_SUS64_VWA1_VWB1_WGM4_WGMXCC1_WGMXCCGn1
    SolutionIndex: 33
    SolutionNameMin: Cijk_Alik_Bljk_B8NHS_BH_Bias_HAS_SAV_UserArgs_MT128x256x128_MI16x16x1_SN_LDSB1_CLR1_GRVWA8_GRVWB16_GSU0_GSUC0_GSUWGMRR0_K1_LBSPPA512_LBSPPB1024_LPA8_LPB16_LRVW8_MIWT4_8_PLR1_SU0_SUM0_SUS128_VWA4_VWB8_WGM1_WGMXCC1_WGMXCCGn1
    SolutionIndex: 34
    SolutionNameMin: Cijk_Alik_Bljk_B8NHS_BH_Bias_HAS_SAV_UserArgs_MT128x256x128_MI16x16x1_SN_LDSB1_CLR1_GRVWA8_GRVWB16_GSU0_GSUC0_GSUWGMRR0_K1_LBSPPA512_LBSPPB1024_LPA8_LPB16_LRVW8_MIWT4_8_PLR1_SU0_SUM0_SUS128_VWA4_VWB8_WGM6_WGMXCC1_WGMXCCGn1
    SolutionIndex: 35
    SolutionNameMin: Cijk_Alik_Bljk_B8NHS_BH_Bias_HAS_SAV_UserArgs_MT256x144x128_MI16x16x1_SN_LDSB1_CLR1_GRVWA8_GRVWB8_GSU0_GSUC0_GSUWGMRR0_K1_LBSPPA512_LBSPPB128_LPA8_LPB8_LRVW8_MIWT4_9_PLR1_SU0_SUM0_SUS128_VWA4_VWB1_WGM1_WGMXCC1_WGMXCCGn1
    SolutionIndex: 36
    SolutionNameMin: Cijk_Alik_Bljk_B8NHS_BH_Bias_HAS_SAV_UserArgs_MT256x144x128_MI16x16x1_SN_LDSB1_CLR1_GRVWA16_GRVWB8_GSU0_GSUC0_GSUWGMRR0_K1_LBSPPA512_LBSPPB128_LPA16_LPB8_LRVW8_MIWT4_9_PLR1_SU0_SUM0_SUS128_VWA4_VWB1_WGM1_WGMXCC1_WGMXCCGn1
    SolutionIndex: 37
    SolutionNameMin: Cijk_Alik_Bljk_B8NHS_BH_Bias_HAS_SAV_UserArgs_MT256x144x128_MI16x16x1_SN_LDSB1_CLR1_GRVWA8_GRVWB8_GSU0_GSUC0_GSUWGMRR0_K1_LBSPPA512_LBSPPB128_LPA8_LPB8_LRVW8_MIWT4_9_PLR1_SU0_SUM0_SUS128_VWA4_VWB1_WGM4_WGMXCC1_WGMXCCGn1
    SolutionIndex: 38
    SolutionNameMin: Cijk_Alik_Bljk_B8NHS_BH_Bias_HAS_SAV_UserArgs_MT256x144x128_MI16x16x1_SN_LDSB1_CLR1_GRVWA16_GRVWB8_GSU0_GSUC0_GSUWGMRR0_K1_LBSPPA512_LBSPPB128_LPA16_LPB8_LRVW8_MIWT4_9_PLR1_SU0_SUM0_SUS128_VWA4_VWB1_WGM4_WGMXCC1_WGMXCCGn1
    SolutionIndex: 39
    SolutionNameMin: Cijk_Alik_Bljk_B8NHS_BH_Bias_HAS_SAV_UserArgs_MT256x144x128_MI16x16x1_SN_LDSB1_CLR1_GRVWA8_GRVWB8_GSU0_GSUC0_GSUWGMRR0_K1_LBSPPA512_LBSPPB128_LPA8_LPB8_LRVW8_MIWT4_9_PLR1_SU0_SUM0_SUS128_VWA4_VWB1_WGM6_WGMXCC1_WGMXCCGn1
    SolutionIndex: 40
    SolutionNameMin: Cijk_Alik_Bljk_B8NHS_BH_Bias_HAS_SAV_UserArgs_MT256x144x128_MI16x16x1_SN_LDSB1_CLR1_GRVWA16_GRVWB8_GSU0_GSUC0_GSUWGMRR0_K1_LBSPPA512_LBSPPB128_LPA16_LPB8_LRVW8_MIWT4_9_PLR1_SU0_SUM0_SUS128_VWA4_VWB1_WGM6_WGMXCC1_WGMXCCGn1
    SolutionIndex: 41
    SolutionNameMin: Cijk_Alik_Bljk_B8NHS_BH_Bias_HAS_SAV_UserArgs_MT256x144x128_MI16x16x1_SN_LDSB1_CLR1_GRVWA8_GRVWB8_GSU0_GSUC0_GSUWGMRR0_K1_LBSPPA512_LBSPPB128_LPA8_LPB8_LRVW8_MIWT4_9_PLR1_SU0_SUM0_SUS128_VWA4_VWB1_WGM8_WGMXCC1_WGMXCCGn1
    SolutionIndex: 42
    SolutionNameMin: Cijk_Alik_Bljk_B8NHS_BH_Bias_HAS_SAV_UserArgs_MT256x144x128_MI16x16x1_SN_LDSB1_CLR1_GRVWA16_GRVWB8_GSU0_GSUC0_GSUWGMRR0_K1_LBSPPA512_LBSPPB128_LPA16_LPB8_LRVW8_MIWT4_9_PLR1_SU0_SUM0_SUS128_VWA4_VWB1_WGM8_WGMXCC1_WGMXCCGn1
    SolutionIndex: 43
    SolutionNameMin: Cijk_Alik_Bljk_B8NHS_BH_Bias_HAS_SAV_UserArgs_MT256x128x128_MI16x16x1_SN_LDSB1_CLR1_GRVWA8_GRVWB16_GSU0_GSUC0_GSUWGMRR0_K1_LBSPPA1024_LBSPPB512_LPA8_LPB16_LRVW8_MIWT8_4_PLR1_SU0_SUM0_SUS128_VWA8_VWB4_WGM1_WGMXCC1_WGMXCCGn1
    SolutionIndex: 44
    SolutionNameMin: Cijk_Alik_Bljk_B8NHS_BH_Bias_HAS_SAV_UserArgs_MT256x128x128_MI16x16x1_SN_LDSB1_CLR1_GRVWA8_GRVWB16_GSU0_GSUC0_GSUWGMRR0_K1_LBSPPA1024_LBSPPB512_LPA8_LPB16_LRVW8_MIWT8_4_PLR1_SU0_SUM0_SUS128_VWA8_VWB4_WGM4_WGMXCC1_WGMXCCGn1
    SolutionIndex: 45
    SolutionNameMin: Cijk_Alik_Bljk_B8NHS_BH_Bias_HAS_SAV_UserArgs_MT256x128x128_MI16x16x1_SN_LDSB1_CLR1_GRVWA8_GRVWB16_GSU0_GSUC0_GSUWGMRR0_K1_LBSPPA1024_LBSPPB512_LPA8_LPB16_LRVW8_MIWT8_4_PLR1_SU0_SUM0_SUS128_VWA8_VWB4_WGM6_WGMXCC1_WGMXCCGn1
    SolutionIndex: 46
    SolutionNameMin: Cijk_Alik_Bljk_B8NHS_BH_Bias_HAS_SAV_UserArgs_MT256x128x128_MI16x16x1_SN_LDSB1_CLR1_GRVWA8_GRVWB16_GSU0_GSUC0_GSUWGMRR0_K1_LBSPPA1024_LBSPPB512_LPA8_LPB16_LRVW8_MIWT8_4_PLR1_SU0_SUM0_SUS128_VWA8_VWB4_WGM8_WGMXCC1_WGMXCCGn1
    SolutionIndex: 47
    SolutionNameMin: Cijk_Alik_Bljk_B8NHS_BH_Bias_HAS_SAV_UserArgs_MT144x256x128_MI16x16x1_SN_LDSB1_CLR1_GRVWA8_GRVWB8_GSU0_GSUC0_GSUWGMRR0_K1_LBSPPA128_LBSPPB512_LPA8_LPB8_LRVW8_MIWT9_4_PLR1_SU0_SUM0_SUS128_VWA1_VWB4_WGM1_WGMXCC1_WGMXCCGn1
    SolutionIndex: 48
    SolutionNameMin: Cijk_Alik_Bljk_B8NHS_BH_Bias_HAS_SAV_UserArgs_MT144x256x128_MI16x16x1_SN_LDSB1_CLR1_GRVWA8_GRVWB16_GSU0_GSUC0_GSUWGMRR0_K1_LBSPPA128_LBSPPB512_LPA8_LPB16_LRVW8_MIWT9_4_PLR1_SU0_SUM0_SUS128_VWA1_VWB4_WGM1_WGMXCC1_WGMXCCGn1
    SolutionIndex: 49
    SolutionNameMin: Cijk_Alik_Bljk_B8NHS_BH_Bias_HAS_SAV_UserArgs_MT144x256x128_MI16x16x1_SN_LDSB1_CLR1_GRVWA8_GRVWB8_GSU0_GSUC0_GSUWGMRR0_K1_LBSPPA128_LBSPPB512_LPA8_LPB8_LRVW8_MIWT9_4_PLR1_SU0_SUM0_SUS128_VWA1_VWB4_WGM4_WGMXCC1_WGMXCCGn1
    SolutionIndex: 50
    SolutionNameMin: Cijk_Alik_Bljk_B8NHS_BH_Bias_HAS_SAV_UserArgs_MT144x256x128_MI16x16x1_SN_LDSB1_CLR1_GRVWA8_GRVWB16_GSU0_GSUC0_GSUWGMRR0_K1_LBSPPA128_LBSPPB512_LPA8_LPB16_LRVW8_MIWT9_4_PLR1_SU0_SUM0_SUS128_VWA1_VWB4_WGM4_WGMXCC1_WGMXCCGn1
    SolutionIndex: 51
    SolutionNameMin: Cijk_Alik_Bljk_B8NHS_BH_Bias_HAS_SAV_UserArgs_MT144x256x128_MI16x16x1_SN_LDSB1_CLR1_GRVWA8_GRVWB16_GSU0_GSUC0_GSUWGMRR0_K1_LBSPPA128_LBSPPB512_LPA8_LPB16_LRVW8_MIWT9_4_PLR1_SU0_SUM0_SUS128_VWA1_VWB4_WGM6_WGMXCC1_WGMXCCGn1
    SolutionIndex: 52
    SolutionNameMin: Cijk_Alik_Bljk_B8NHS_BH_Bias_HAS_SAV_UserArgs_MT144x256x128_MI16x16x1_SN_LDSB1_CLR1_GRVWA8_GRVWB8_GSU0_GSUC0_GSUWGMRR0_K1_LBSPPA128_LBSPPB512_LPA8_LPB8_LRVW8_MIWT9_4_PLR1_SU0_SUM0_SUS128_VWA1_VWB4_WGM8_WGMXCC1_WGMXCCGn1
    SolutionIndex: 53
    SolutionNameMin: Cijk_Alik_Bljk_B8NHS_BH_Bias_HAS_SAV_UserArgs_MT144x256x128_MI16x16x1_SN_LDSB1_CLR1_GRVWA8_GRVWB16_GSU0_GSUC0_GSUWGMRR0_K1_LBSPPA128_LBSPPB512_LPA8_LPB16_LRVW8_MIWT9_4_PLR1_SU0_SUM0_SUS128_VWA1_VWB4_WGM8_WGMXCC1_WGMXCCGn1
    SolutionIndex: 54
    SolutionNameMin: Cijk_Alik_Bljk_B8NHS_BH_Bias_HAS_SAV_UserArgs_MT128x128x128_MI16x16x1_SN_LDSB1_CLR1_GRVWA8_GRVWB16_GSU0_GSUC0_GSUWGMRR0_K1_LBSPPA1024_LBSPPB256_LPA8_LPB16_LRVW8_MIWT8_2_PLR1_SU0_SUM0_SUS128_VWA8_VWB2_WGM1_WGMXCC1_WGMXCCGn1
    SolutionIndex: 55
    SolutionNameMin: Cijk_Alik_Bljk_B8NHS_BH_Bias_HAS_SAV_UserArgs_MT128x128x128_MI16x16x1_SN_LDSB1_CLR1_GRVWA8_GRVWB16_GSU0_GSUC0_GSUWGMRR0_K1_LBSPPA1024_LBSPPB256_LPA8_LPB16_LRVW8_MIWT8_2_PLR1_SU0_SUM0_SUS128_VWA8_VWB2_WGM4_WGMXCC1_WGMXCCGn1
    SolutionIndex: 56
    SolutionNameMin: Cijk_Alik_Bljk_B8NHS_BH_Bias_HAS_SAV_UserArgs_MT128x128x128_MI16x16x1_SN_LDSB1_CLR1_GRVWA8_GRVWB16_GSU0_GSUC0_GSUWGMRR0_K1_LBSPPA1024_LBSPPB256_LPA8_LPB16_LRVW8_MIWT8_2_PLR1_SU0_SUM0_SUS128_VWA8_VWB2_WGM6_WGMXCC1_WGMXCCGn1
    SolutionIndex: 57
    SolutionNameMin: Cijk_Alik_Bljk_B8NHS_BH_Bias_HAS_SAV_UserArgs_MT128x128x128_MI16x16x1_SN_LDSB1_CLR1_GRVWA8_GRVWB16_GSU0_GSUC0_GSUWGMRR0_K1_LBSPPA1024_LBSPPB256_LPA8_LPB16_LRVW8_MIWT8_2_PLR1_SU0_SUM0_SUS128_VWA8_VWB2_WGM8_WGMXCC1_WGMXCCGn1
    SolutionIndex: 58
    SolutionNameMin: Cijk_Alik_Bljk_B8NHS_BH_Bias_HAS_SAV_UserArgs_MT128x144x128_MI16x16x1_SN_LDSB1_CLR1_GRVWA8_GRVWB8_GSU0_GSUC0_GSUWGMRR0_K1_LBSPPA256_LBSPPB128_LPA8_LPB8_LRVW8_MIWT2_9_PLR1_SU0_SUM0_SUS128_VWA2_VWB1_WGM1_WGMXCC1_WGMXCCGn1
    SolutionIndex: 59
    SolutionNameMin: Cijk_Alik_Bljk_B8NHS_BH_Bias_HAS_SAV_UserArgs_MT128x144x128_MI16x16x1_SN_LDSB1_CLR1_GRVWA16_GRVWB8_GSU0_GSUC0_GSUWGMRR0_K1_LBSPPA256_LBSPPB128_LPA16_LPB8_LRVW8_MIWT2_9_PLR1_SU0_SUM0_SUS128_VWA2_VWB1_WGM1_WGMXCC1_WGMXCCGn1
    SolutionIndex: 60
    SolutionNameMin: Cijk_Alik_Bljk_B8NHS_BH_Bias_HAS_SAV_UserArgs_MT128x64x128_MI16x16x1_SN_LDSB1_CLR1_GRVWA8_GRVWB8_GSU0_GSUC0_GSUWGMRR0_K1_LBSPPA1024_LBSPPB128_LPA8_LPB8_LRVW8_MIWT8_1_PLR1_SU0_SUM0_SUS128_VWA8_VWB1_WGM8_WGMXCC1_WGMXCCGn1
    SolutionIndex: 61
    SolutionNameMin: Cijk_Alik_Bljk_B8NHS_BH_Bias_HAS_SAV_UserArgs_MT144x128x128_MI16x16x1_SN_LDSB1_CLR1_GRVWA8_GRVWB16_GSU0_GSUC0_GSUWGMRR0_K1_LBSPPA128_LBSPPB256_LPA8_LPB16_LRVW8_MIWT9_2_PLR1_SU0_SUM0_SUS128_VWA1_VWB2_WGM4_WGMXCC1_WGMXCCGn1
    SolutionIndex: 62
    SolutionNameMin: Cijk_Alik_Bljk_B8NHS_BH_Bias_HAS_SAV_UserArgs_MT144x128x128_MI16x16x1_SN_LDSB1_CLR1_GRVWA8_GRVWB16_GSU0_GSUC0_GSUWGMRR0_K1_LBSPPA128_LBSPPB256_LPA8_LPB16_LRVW8_MIWT9_2_PLR1_SU0_SUM0_SUS128_VWA1_VWB2_WGM6_WGMXCC1_WGMXCCGn1
    SolutionIndex: 63
    SolutionNameMin: Cijk_Alik_Bljk_B8NHS_BH_Bias_HAS_SAV_UserArgs_MT144x128x128_MI16x16x1_SN_LDSB1_CLR1_GRVWA8_GRVWB8_GSU0_GSUC0_GSUWGMRR0_K1_LBSPPA128_LBSPPB256_LPA8_LPB8_LRVW8_MIWT9_2_PLR1_SU0_SUM0_SUS128_VWA1_VWB2_WGM8_WGMXCC1_WGMXCCGn1
    SolutionIndex: 64
    SolutionNameMin: Cijk_Alik_Bljk_B8NHS_BH_Bias_HAS_SAV_UserArgs_MT144x128x128_MI16x16x1_SN_LDSB1_CLR1_GRVWA8_GRVWB16_GSU0_GSUC0_GSUWGMRR0_K1_LBSPPA128_LBSPPB256_LPA8_LPB16_LRVW8_MIWT9_2_PLR1_SU0_SUM0_SUS128_VWA1_VWB2_WGM8_WGMXCC1_WGMXCCGn1
    SolutionIndex: 65
    SolutionNameMin: Cijk_Alik_Bljk_B8NHS_BH_Bias_HAS_SAV_UserArgs_MT128x128x128_MI16x16x1_SN_LDSB1_CLR1_GRVWA8_GRVWB16_GSU0_GSUC0_GSUWGMRR0_K1_LBSPPA512_LBSPPB512_LPA8_LPB16_LRVW8_MIWT4_4_PLR1_SU0_SUM0_SUS128_VWA4_VWB4_WGM1_WGMXCC1_WGMXCCGn1
    SolutionIndex: 66
    SolutionNameMin: Cijk_Alik_Bljk_B8NHS_BH_Bias_HAS_SAV_UserArgs_MT128x128x128_MI16x16x1_SN_LDSB1_CLR1_GRVWA8_GRVWB16_GSU0_GSUC0_GSUWGMRR0_K1_LBSPPA512_LBSPPB512_LPA8_LPB16_LRVW8_MIWT4_4_PLR1_SU0_SUM0_SUS128_VWA4_VWB4_WGM6_WGMXCC1_WGMXCCGn1
    SolutionIndex: 67
    SolutionNameMin: Cijk_Alik_Bljk_B8NHS_BH_Bias_HAS_SAV_UserArgs_MT128x128x128_MI16x16x1_SN_LDSB1_CLR1_GRVWA16_GRVWB16_GSU0_GSUC0_GSUWGMRR0_K1_LBSPPA512_LBSPPB512_LPA16_LPB16_LRVW8_MIWT4_4_PLR1_SU0_SUM0_SUS128_VWA4_VWB4_WGM6_WGMXCC1_WGMXCCGn1
    SolutionIndex: 68
    SolutionNameMin: Cijk_Alik_Bljk_B8NHS_BH_Bias_HAS_SAV_UserArgs_MT128x128x128_MI16x16x1_SN_LDSB1_CLR1_GRVWA16_GRVWB16_GSU0_GSUC0_GSUWGMRR0_K1_LBSPPA512_LBSPPB512_LPA16_LPB16_LRVW8_MIWT4_4_PLR1_SU0_SUM0_SUS128_VWA4_VWB4_WGM8_WGMXCC1_WGMXCCGn1
    SolutionIndex: 69
    SolutionNameMin: Cijk_Alik_Bljk_B8NHS_BH_Bias_HAS_SAV_UserArgs_MT64x128x128_MI16x16x1_SN_LDSB1_CLR1_GRVWA8_GRVWB16_GSU0_GSUC0_GSUWGMRR0_K1_LBSPPA256_LBSPPB512_LPA8_LPB16_LRVW8_MIWT2_4_PLR1_SU0_SUM0_SUS128_VWA2_VWB4_WGM1_WGMXCC1_WGMXCCGn1
    SolutionIndex: 70
    SolutionNameMin: Cijk_Alik_Bljk_B8NHS_BH_Bias_HAS_SAV_UserArgs_MT64x128x128_MI16x16x1_SN_LDSB1_CLR1_GRVWA16_GRVWB16_GSU0_GSUC0_GSUWGMRR0_K1_LBSPPA256_LBSPPB512_LPA16_LPB16_LRVW8_MIWT2_4_PLR1_SU0_SUM0_SUS128_VWA2_VWB4_WGM1_WGMXCC1_WGMXCCGn1
    SolutionIndex: 71
    SolutionNameMin: Cijk_Alik_Bljk_B8NHS_BH_Bias_HAS_SAV_UserArgs_MT128x64x128_MI16x16x1_SN_LDSB1_CLR1_GRVWA16_GRVWB8_GSU0_GSUC0_GSUWGMRR0_K1_LBSPPA512_LBSPPB256_LPA16_LPB8_LRVW8_MIWT4_2_PLR1_SU0_SUM0_SUS128_VWA4_VWB2_WGM1_WGMXCC1_WGMXCCGn1
    SolutionIndex: 72
    SolutionNameMin: Cijk_Alik_Bljk_B8NHS_BH_Bias_HAS_SAV_UserArgs_MT64x64x128_MI16x16x1_SN_LDSB1_CLR1_GRVWA16_GRVWB8_GSU0_GSUC0_GSUWGMRR0_K1_LBSPPA256_LBSPPB256_LPA16_LPB8_LRVW8_MIWT2_2_PLR1_SU0_SUM0_SUS128_VWA2_VWB2_WGM1_WGMXCC1_WGMXCCGn1
    SolutionIndex: 73
    SolutionNameMin: Cijk_Alik_Bljk_B8NHS_BH_Bias_HAS_SAV_UserArgs_MT64x64x128_MI16x16x1_SN_LDSB1_CLR1_GRVWA8_GRVWB16_GSU0_GSUC0_GSUWGMRR0_K1_LBSPPA256_LBSPPB256_LPA8_LPB16_LRVW8_MIWT2_2_PLR1_SU0_SUM0_SUS128_VWA2_VWB2_WGM1_WGMXCC1_WGMXCCGn1
    SolutionIndex: 74
    SolutionNameMin: Cijk_Alik_Bljk_B8NHS_BH_Bias_HAS_SAV_UserArgs_MT64x64x128_MI16x16x1_SN_LDSB1_CLR1_GRVWA16_GRVWB8_GSU0_GSUC0_GSUWGMRR0_K1_LBSPPA256_LBSPPB256_LPA16_LPB8_LRVW8_MIWT2_2_PLR1_SU0_SUM0_SUS128_VWA2_VWB2_WGM4_WGMXCC1_WGMXCCGn1
    SolutionIndex: 75
    SolutionNameMin: Cijk_Alik_Bljk_B8NHS_BH_Bias_HAS_SAV_UserArgs_MT64x64x128_MI16x16x1_SN_LDSB1_CLR1_GRVWA8_GRVWB16_GSU0_GSUC0_GSUWGMRR0_K1_LBSPPA256_LBSPPB256_LPA8_LPB16_LRVW8_MIWT2_2_PLR1_SU0_SUM0_SUS128_VWA2_VWB2_WGM6_WGMXCC1_WGMXCCGn1
    SolutionIndex: 76
    SolutionNameMin: Cijk_Alik_Bljk_B8NHS_BH_Bias_HAS_SAV_UserArgs_MT64x64x128_MI16x16x1_SN_LDSB1_CLR1_GRVWA16_GRVWB16_GSU0_GSUC0_GSUWGMRR0_K1_LBSPPA256_LBSPPB256_LPA16_LPB16_LRVW8_MIWT2_2_PLR1_SU0_SUM0_SUS128_VWA2_VWB2_WGM6_WGMXCC1_WGMXCCGn1
    SolutionIndex: 77
    SolutionNameMin: Cijk_Alik_Bljk_B8NHS_BH_Bias_HAS_SAV_UserArgs_MT64x64x128_MI16x16x1_SN_LDSB1_CLR1_GRVWA8_GRVWB16_GSU0_GSUC0_GSUWGMRR0_K1_LBSPPA256_LBSPPB256_LPA8_LPB16_LRVW8_MIWT2_2_PLR1_SU0_SUM0_SUS128_VWA2_VWB2_WGM8_WGMXCC1_WGMXCCGn1
    SolutionIndex: 78
    SolutionNameMin: Cijk_Alik_Bljk_B8NHS_BH_Bias_HAS_SAV_UserArgs_MT32x64x128_MI16x16x1_SN_LDSB0_CLR1_GRVWA8_GRVWB8_GSU0_GSUC0_GSUWGMRR0_K1_LBSPPA128_LBSPPB256_LPA8_LPB8_LRVW8_MIWT1_2_PLR1_SU0_SUM0_SUS128_VWA1_VWB2_WGM1_WGMXCC1_WGMXCCGn1
    SolutionIndex: 79
    SolutionNameMin: Cijk_Alik_Bljk_B8NHS_BH_Bias_HAS_SAV_UserArgs_MT32x64x128_MI16x16x1_SN_LDSB0_CLR1_GRVWA16_GRVWB8_GSU0_GSUC0_GSUWGMRR0_K1_LBSPPA128_LBSPPB256_LPA16_LPB8_LRVW8_MIWT1_2_PLR1_SU0_SUM0_SUS128_VWA1_VWB2_WGM1_WGMXCC1_WGMXCCGn1
    SolutionIndex: 80
    SolutionNameMin: Cijk_Alik_Bljk_B8NHS_BH_Bias_HAS_SAV_UserArgs_MT32x64x128_MI16x16x1_SN_LDSB0_CLR1_GRVWA16_GRVWB16_GSU0_GSUC0_GSUWGMRR0_K1_LBSPPA128_LBSPPB256_LPA16_LPB16_LRVW8_MIWT1_2_PLR1_SU0_SUM0_SUS128_VWA1_VWB2_WGM1_WGMXCC1_WGMXCCGn1
    SolutionIndex: 81
    SolutionNameMin: Cijk_Alik_Bljk_B8NHS_BH_Bias_HAS_SAV_UserArgs_MT32x64x128_MI16x16x1_SN_LDSB0_CLR1_GRVWA16_GRVWB8_GSU0_GSUC0_GSUWGMRR0_K1_LBSPPA128_LBSPPB256_LPA16_LPB8_LRVW8_MIWT1_2_PLR1_SU0_SUM0_SUS128_VWA1_VWB2_WGM4_WGMXCC1_WGMXCCGn1
    SolutionIndex: 82
    SolutionNameMin: Cijk_Alik_Bljk_B8NHS_BH_Bias_HAS_SAV_UserArgs_MT32x64x128_MI16x16x1_SN_LDSB0_CLR1_GRVWA8_GRVWB8_GSU0_GSUC0_GSUWGMRR0_K1_LBSPPA128_LBSPPB256_LPA8_LPB8_LRVW8_MIWT1_2_PLR1_SU0_SUM0_SUS128_VWA1_VWB2_WGM6_WGMXCC1_WGMXCCGn1
    SolutionIndex: 83
    SolutionNameMin: Cijk_Alik_Bljk_B8NHS_BH_Bias_HAS_SAV_UserArgs_MT32x64x128_MI16x16x1_SN_LDSB0_CLR1_GRVWA8_GRVWB8_GSU0_GSUC0_GSUWGMRR0_K1_LBSPPA128_LBSPPB256_LPA8_LPB8_LRVW8_MIWT1_2_PLR1_SU0_SUM0_SUS128_VWA1_VWB2_WGM8_WGMXCC1_WGMXCCGn1
    SolutionIndex: 84
    SolutionNameMin: Cijk_Alik_Bljk_B8NHS_BH_Bias_HAS_SAV_UserArgs_MT64x32x128_MI16x16x1_SN_LDSB0_CLR1_GRVWA8_GRVWB8_GSU0_GSUC0_GSUWGMRR0_K1_LBSPPA256_LBSPPB128_LPA8_LPB8_LRVW8_MIWT2_1_PLR1_SU0_SUM0_SUS128_VWA2_VWB1_WGM1_WGMXCC1_WGMXCCGn1
    SolutionIndex: 85
    SolutionNameMin: Cijk_Alik_Bljk_B8NHS_BH_Bias_HAS_SAV_UserArgs_MT64x32x128_MI16x16x1_SN_LDSB0_CLR1_GRVWA16_GRVWB8_GSU0_GSUC0_GSUWGMRR0_K1_LBSPPA256_LBSPPB128_LPA16_LPB8_LRVW8_MIWT2_1_PLR1_SU0_SUM0_SUS128_VWA2_VWB1_WGM1_WGMXCC1_WGMXCCGn1
    SolutionIndex: 86
    SolutionNameMin: Cijk_Alik_Bljk_B8NHS_BH_Bias_HAS_SAV_UserArgs_MT64x32x128_MI16x16x1_SN_LDSB0_CLR1_GRVWA8_GRVWB16_GSU0_GSUC0_GSUWGMRR0_K1_LBSPPA256_LBSPPB128_LPA8_LPB16_LRVW8_MIWT2_1_PLR1_SU0_SUM0_SUS128_VWA2_VWB1_WGM1_WGMXCC1_WGMXCCGn1
    SolutionIndex: 87
    SolutionNameMin: Cijk_Alik_Bljk_B8NHS_BH_Bias_HAS_SAV_UserArgs_MT64x32x128_MI16x16x1_SN_LDSB0_CLR1_GRVWA16_GRVWB16_GSU0_GSUC0_GSUWGMRR0_K1_LBSPPA256_LBSPPB128_LPA16_LPB16_LRVW8_MIWT2_1_PLR1_SU0_SUM0_SUS128_VWA2_VWB1_WGM1_WGMXCC1_WGMXCCGn1
    SolutionIndex: 88
    SolutionNameMin: Cijk_Alik_Bljk_B8NHS_BH_Bias_HAS_SAV_UserArgs_MT32x32x128_MI16x16x1_SN_LDSB0_CLR1_GRVWA8_GRVWB8_GSU0_GSUC0_GSUWGMRR0_K1_LBSPPA128_LBSPPB128_LPA8_LPB8_LRVW8_MIWT1_1_PLR1_SU0_SUM0_SUS128_VWA1_VWB1_WGM1_WGMXCC1_WGMXCCGn1
    SolutionIndex: 89
    SolutionNameMin: Cijk_Alik_Bljk_B8NHS_BH_Bias_HAS_SAV_UserArgs_MT32x32x128_MI16x16x1_SN_LDSB0_CLR1_GRVWA16_GRVWB8_GSU0_GSUC0_GSUWGMRR0_K1_LBSPPA128_LBSPPB128_LPA16_LPB8_LRVW8_MIWT1_1_PLR1_SU0_SUM0_SUS128_VWA1_VWB1_WGM1_WGMXCC1_WGMXCCGn1
    SolutionIndex: 90
    SolutionNameMin: Cijk_Alik_Bljk_B8NHS_BH_Bias_HAS_SAV_UserArgs_MT32x32x128_MI16x16x1_SN_LDSB0_CLR1_GRVWA8_GRVWB16_GSU0_GSUC0_GSUWGMRR0_K1_LBSPPA128_LBSPPB128_LPA8_LPB16_LRVW8_MIWT1_1_PLR1_SU0_SUM0_SUS128_VWA1_VWB1_WGM1_WGMXCC1_WGMXCCGn1
    SolutionIndex: 91
    SolutionNameMin: Cijk_Alik_Bljk_B8NHS_BH_Bias_HAS_SAV_UserArgs_MT32x32x128_MI16x16x1_SN_LDSB0_CLR1_GRVWA16_GRVWB16_GSU0_GSUC0_GSUWGMRR0_K1_LBSPPA128_LBSPPB128_LPA16_LPB16_LRVW8_MIWT1_1_PLR1_SU0_SUM0_SUS128_VWA1_VWB1_WGM1_WGMXCC1_WGMXCCGn1
    SolutionIndex: 92
    SolutionNameMin: Cijk_Alik_Bljk_B8NHS_BH_Bias_HAS_SAV_UserArgs_MT32x32x128_MI16x16x1_SN_LDSB0_CLR1_GRVWA8_GRVWB8_GSU0_GSUC0_GSUWGMRR0_K1_LBSPPA128_LBSPPB128_LPA8_LPB8_LRVW8_MIWT1_1_PLR1_SU0_SUM0_SUS128_VWA1_VWB1_WGM4_WGMXCC1_WGMXCCGn1
    SolutionIndex: 93
    SolutionNameMin: Cijk_Alik_Bljk_B8NHS_BH_Bias_HAS_SAV_UserArgs_MT32x32x128_MI16x16x1_SN_LDSB0_CLR1_GRVWA8_GRVWB16_GSU0_GSUC0_GSUWGMRR0_K1_LBSPPA128_LBSPPB128_LPA8_LPB16_LRVW8_MIWT1_1_PLR1_SU0_SUM0_SUS128_VWA1_VWB1_WGM4_WGMXCC1_WGMXCCGn1
    SolutionIndex: 94
    SolutionNameMin: Cijk_Alik_Bljk_B8NHS_BH_Bias_HAS_SAV_UserArgs_MT32x32x128_MI16x16x1_SN_LDSB0_CLR1_GRVWA8_GRVWB8_GSU0_GSUC0_GSUWGMRR0_K1_LBSPPA128_LBSPPB128_LPA8_LPB8_LRVW8_MIWT1_1_PLR1_SU0_SUM0_SUS128_VWA1_VWB1_WGM8_WGMXCC1_WGMXCCGn1
    SolutionIndex: 95
    SolutionNameMin: Cijk_Alik_Bljk_B8NHS_BH_Bias_HAS_SAV_UserArgs_MT128x64x256_MI16x16x1_SN_LDSB1_CLR1_GRVWA8_GRVWB16_GSU0_GSUC0_GSUWGMRR0_K1_LBSPPA1024_LBSPPB512_LPA8_LPB16_LRVW8_MIWT4_2_PLR1_SU0_SUM0_SUS256_VWA4_VWB2_WGM1_WGMXCC1_WGMXCCGn1
    SolutionIndex: 96
    SolutionNameMin: Cijk_Alik_Bljk_B8NHS_BH_Bias_HAS_SAV_UserArgs_MT128x64x256_MI16x16x1_SN_LDSB1_CLR1_GRVWA8_GRVWB16_GSU0_GSUC0_GSUWGMRR0_K1_LBSPPA1024_LBSPPB512_LPA8_LPB16_LRVW8_MIWT4_2_PLR1_SU0_SUM0_SUS256_VWA4_VWB2_WGM4_WGMXCC1_WGMXCCGn1
    SolutionIndex: 97
    SolutionNameMin: Cijk_Alik_Bljk_B8NHS_BH_Bias_HAS_SAV_UserArgs_MT128x64x256_MI16x16x1_SN_LDSB1_CLR1_GRVWA8_GRVWB16_GSU0_GSUC0_GSUWGMRR0_K1_LBSPPA1024_LBSPPB512_LPA8_LPB16_LRVW8_MIWT4_2_PLR1_SU0_SUM0_SUS256_VWA4_VWB2_WGM6_WGMXCC1_WGMXCCGn1
    SolutionIndex: 98
    SolutionNameMin: Cijk_Alik_Bljk_B8NHS_BH_Bias_HAS_SAV_UserArgs_MT128x64x256_MI16x16x1_SN_LDSB1_CLR1_GRVWA8_GRVWB16_GSU0_GSUC0_GSUWGMRR0_K1_LBSPPA1024_LBSPPB512_LPA8_LPB16_LRVW8_MIWT4_2_PLR1_SU0_SUM0_SUS256_VWA4_VWB2_WGM8_WGMXCC1_WGMXCCGn1
    SolutionIndex: 99
    SolutionNameMin: Cijk_Alik_Bljk_B8NHS_BH_Bias_HAS_SAV_UserArgs_MT64x64x256_MI16x16x1_SN_LDSB1_CLR1_GRVWA8_GRVWB16_GSU0_GSUC0_GSUWGMRR0_K1_LBSPPA512_LBSPPB512_LPA8_LPB16_LRVW8_MIWT2_2_PLR1_SU0_SUM0_SUS256_VWA2_VWB2_WGM1_WGMXCC1_WGMXCCGn1
    SolutionIndex: 100
    SolutionNameMin: Cijk_Alik_Bljk_B8NHS_BH_Bias_HAS_SAV_UserArgs_MT64x64x256_MI16x16x1_SN_LDSB1_CLR1_GRVWA8_GRVWB16_GSU0_GSUC0_GSUWGMRR0_K1_LBSPPA512_LBSPPB512_LPA8_LPB16_LRVW8_MIWT2_2_PLR1_SU0_SUM0_SUS256_VWA2_VWB2_WGM6_WGMXCC1_WGMXCCGn1
    SolutionIndex: 101
    SolutionNameMin: Cijk_Alik_Bljk_B8NHS_BH_Bias_HAS_SAV_UserArgs_MT64x64x256_MI16x16x1_SN_LDSB1_CLR1_GRVWA16_GRVWB16_GSU0_GSUC0_GSUWGMRR0_K1_LBSPPA512_LBSPPB512_LPA16_LPB16_LRVW8_MIWT2_2_PLR1_SU0_SUM0_SUS256_VWA2_VWB2_WGM6_WGMXCC1_WGMXCCGn1
    SolutionIndex: 102
    SolutionNameMin: Cijk_Alik_Bljk_B8NHS_BH_Bias_HAS_SAV_UserArgs_MT64x64x256_MI16x16x1_SN_LDSB1_CLR1_GRVWA8_GRVWB16_GSU0_GSUC0_GSUWGMRR0_K1_LBSPPA512_LBSPPB512_LPA8_LPB16_LRVW8_MIWT2_2_PLR1_SU0_SUM0_SUS256_VWA2_VWB2_WGM8_WGMXCC1_WGMXCCGn1
    SolutionIndex: 103
    SolutionNameMin: Cijk_Alik_Bljk_B8NHS_BH_Bias_HAS_SAV_UserArgs_MT64x64x256_MI16x16x1_SN_LDSB1_CLR1_GRVWA16_GRVWB16_GSU0_GSUC0_GSUWGMRR0_K1_LBSPPA512_LBSPPB512_LPA16_LPB16_LRVW8_MIWT2_2_PLR1_SU0_SUM0_SUS256_VWA2_VWB2_WGM8_WGMXCC1_WGMXCCGn1
    SolutionIndex: 104
    SolutionNameMin: Cijk_Alik_Bljk_B8NHS_BH_Bias_HAS_SAV_UserArgs_MT32x64x256_MI16x16x1_SN_LDSB1_CLR1_GRVWA8_GRVWB16_GSU0_GSUC0_GSUWGMRR0_K1_LBSPPA256_LBSPPB512_LPA8_LPB16_LRVW8_MIWT1_2_PLR1_SU0_SUM0_SUS256_VWA1_VWB2_WGM4_WGMXCC1_WGMXCCGn1
    SolutionIndex: 105
    SolutionNameMin: Cijk_Alik_Bljk_B8NHS_BH_Bias_HAS_SAV_UserArgs_MT32x32x256_MI16x16x1_SN_LDSB1_CLR1_GRVWA8_GRVWB8_GSU0_GSUC0_GSUWGMRR0_K1_LBSPPA256_LBSPPB256_LPA8_LPB8_LRVW8_MIWT1_1_PLR1_SU0_SUM0_SUS256_VWA1_VWB1_WGM1_WGMXCC1_WGMXCCGn1
    SolutionIndex: 106
    SolutionNameMin: Cijk_Alik_Bljk_B8NHS_BH_Bias_HAS_SAV_UserArgs_MT32x32x256_MI16x16x1_SN_LDSB1_CLR1_GRVWA8_GRVWB16_GSU0_GSUC0_GSUWGMRR0_K1_LBSPPA256_LBSPPB256_LPA8_LPB16_LRVW8_MIWT1_1_PLR1_SU0_SUM0_SUS256_VWA1_VWB1_WGM1_WGMXCC1_WGMXCCGn1
    SolutionIndex: 107
    SolutionNameMin: Cijk_Alik_Bljk_B8NHS_BH_Bias_HAS_SAV_UserArgs_MT32x32x256_MI16x16x1_SN_LDSB1_CLR1_GRVWA8_GRVWB16_GSU0_GSUC0_GSUWGMRR0_K1_LBSPPA256_LBSPPB256_LPA8_LPB16_LRVW8_MIWT1_1_PLR1_SU0_SUM0_SUS256_VWA1_VWB1_WGM4_WGMXCC1_WGMXCCGn1
    SolutionIndex: 108
    SolutionNameMin: Cijk_Alik_Bljk_B8NHS_BH_Bias_HAS_SAV_UserArgs_MT32x64x32_MI16x16x1_SN_LDSB0_CLR0_GRVWA4_GRVWB4_GSU0_GSUC0_GSUWGMRR0_K1_LBSPPA128_LBSPPB128_LPA8_LPB8_LRVW8_MIWT1_2_PLR0_SU32_SUM0_SUS256_VWA1_VWB2_WGM8_WGMXCC1_WGMXCCGn1
- - - [128, 128, 1, 128, 128, 128, 128, 128]
    - [91, 0.62]
  - - [128, 128, 1, 256, 128, 128, 256, 256]
    - [91, 1.16]
  - - [128, 128, 1, 512, 128, 128, 512, 512]
    - [89, 2.08]
  - - [128, 128, 1, 1024, 128, 128, 1024, 1024]
    - [90, 3.4]
  - - [128, 128, 1, 2048, 128, 128, 2048, 2048]
    - [88, 5.26]
  - - [128, 128, 1, 4096, 128, 128, 4096, 4096]
    - [88, 7.14]
  - - [128, 128, 1, 8192, 128, 128, 8192, 8192]
    - [88, 8.7]
  - - [128, 256, 1, 128, 128, 128, 128, 128]
    - [90, 1.26]
  - - [128, 256, 1, 256, 128, 128, 256, 256]
    - [91, 2.38]
  - - [128, 256, 1, 512, 128, 128, 512, 512]
    - [91, 4.17]
  - - [128, 256, 1, 1024, 128, 128, 1024, 1024]
    - [90, 6.85]
  - - [128, 256, 1, 2048, 128, 128, 2048, 2048]
    - [88, 10.56]
  - - [128, 256, 1, 4096, 128, 128, 4096, 4096]
    - [88, 14.31]
  - - [128, 256, 1, 8192, 128, 128, 8192, 8192]
    - [88, 17.32]
  - - [128, 512, 1, 128, 128, 128, 128, 128]
    - [90, 2.49]
  - - [128, 512, 1, 256, 128, 128, 256, 256]
    - [31, 4.65]
  - - [128, 512, 1, 512, 128, 128, 512, 512]
    - [91, 8.3]
  - - [128, 512, 1, 1024, 128, 128, 1024, 1024]
    - [88, 13.74]
  - - [128, 512, 1, 2048, 128, 128, 2048, 2048]
    - [88, 21.14]
  - - [128, 512, 1, 4096, 128, 128, 4096, 4096]
    - [88, 28.46]
  - - [128, 512, 1, 8192, 128, 128, 8192, 8192]
    - [88, 34.31]
  - - [128, 1024, 1, 128, 128, 128, 128, 128]
    - [89, 4.86]
  - - [128, 1024, 1, 256, 128, 128, 256, 256]
    - [91, 9.22]
  - - [128, 1024, 1, 512, 128, 128, 512, 512]
    - [89, 16.02]
  - - [128, 1024, 1, 1024, 128, 128, 1024, 1024]
    - [91, 27.15]
  - - [128, 1024, 1, 2048, 128, 128, 2048, 2048]
    - [88, 41.5]
  - - [128, 1024, 1, 4096, 128, 128, 4096, 4096]
    - [88, 55.57]
  - - [128, 1024, 1, 8192, 128, 128, 8192, 8192]
    - [88, 67.47]
  - - [128, 2048, 1, 128, 128, 128, 128, 128]
    - [87, 9.28]
  - - [128, 2048, 1, 256, 128, 128, 256, 256]
    - [87, 16.94]
  - - [128, 2048, 1, 512, 128, 128, 512, 512]
    - [86, 28.92]
  - - [128, 2048, 1, 1024, 128, 128, 1024, 1024]
    - [86, 46.36]
  - - [128, 2048, 1, 2048, 128, 128, 2048, 2048]
    - [79, 67.98]
  - - [128, 2048, 1, 4096, 128, 128, 4096, 4096]
    - [78, 88.29]
  - - [128, 2048, 1, 8192, 128, 128, 8192, 8192]
    - [84, 102.03]
  - - [128, 4096, 1, 128, 128, 128, 128, 128]
    - [23, 16.46]
  - - [128, 4096, 1, 256, 128, 128, 256, 256]
    - [21, 29.94]
  - - [128, 4096, 1, 512, 128, 128, 512, 512]
    - [73, 49.64]
  - - [128, 4096, 1, 1024, 128, 128, 1024, 1024]
    - [73, 76.88]
  - - [128, 4096, 1, 2048, 128, 128, 2048, 2048]
    - [73, 105.67]
  - - [128, 4096, 1, 4096, 128, 128, 4096, 4096]
    - [73, 130.19]
  - - [128, 4096, 1, 8192, 128, 128, 8192, 8192]
    - [99, 142.0]
  - - [128, 8192, 1, 128, 128, 128, 128, 128]
    - [71, 27.15]
  - - [128, 8192, 1, 256, 128, 128, 256, 256]
    - [16, 49.07]
  - - [128, 8192, 1, 512, 128, 128, 512, 512]
    - [16, 81.81]
  - - [128, 8192, 1, 1024, 128, 128, 1024, 1024]
    - [16, 122.41]
  - - [128, 8192, 1, 2048, 128, 128, 2048, 2048]
    - [16, 159.34]
  - - [128, 8192, 1, 4096, 128, 128, 4096, 4096]
    - [95, 166.3]
  - - [128, 8192, 1, 8192, 128, 128, 8192, 8192]
    - [103, 186.56]
  - - [256, 128, 1, 128, 256, 256, 128, 128]
    - [30, 1.07]
  - - [256, 128, 1, 256, 256, 256, 256, 256]
    - [32, 2.1]
  - - [256, 128, 1, 512, 256, 256, 512, 512]
    - [89, 4.05]
  - - [256, 128, 1, 1024, 256, 256, 1024, 1024]
    - [88, 6.83]
  - - [256, 128, 1, 2048, 256, 256, 2048, 2048]
    - [88, 10.34]
  - - [256, 128, 1, 4096, 256, 256, 4096, 4096]
    - [88, 14.13]
  - - [256, 128, 1, 8192, 256, 256, 8192, 8192]
    - [88, 17.25]
  - - [256, 256, 1, 128, 256, 256, 128, 128]
    - [31, 2.41]
  - - [256, 256, 1, 256, 256, 256, 256, 256]
    - [32, 4.35]
  - - [256, 256, 1, 512, 256, 256, 512, 512]
    - [89, 7.97]
  - - [256, 256, 1, 1024, 256, 256, 1024, 1024]
    - [88, 13.61]
  - - [256, 256, 1, 2048, 256, 256, 2048, 2048]
    - [88, 20.85]
  - - [256, 256, 1, 4096, 256, 256, 4096, 4096]
    - [88, 28.02]
  - - [256, 256, 1, 8192, 256, 256, 8192, 8192]
    - [88, 34.31]
  - - [256, 512, 1, 128, 256, 256, 128, 128]
    - [93, 4.33]
  - - [256, 512, 1, 256, 256, 256, 256, 256]
    - [105, 8.37]
  - - [256, 512, 1, 512, 256, 256, 512, 512]
    - [88, 16.26]
  - - [256, 512, 1, 1024, 256, 256, 1024, 1024]
    - [88, 26.81]
  - - [256, 512, 1, 2048, 256, 256, 2048, 2048]
    - [88, 41.2]
  - - [256, 512, 1, 4096, 256, 256, 4096, 4096]
    - [88, 55.74]
  - - [256, 512, 1, 8192, 256, 256, 8192, 8192]
    - [88, 67.48]
  - - [256, 1024, 1, 128, 256, 256, 128, 128]
    - [85, 8.72]
  - - [256, 1024, 1, 256, 256, 256, 256, 256]
    - [87, 16.52]
  - - [256, 1024, 1, 512, 256, 256, 512, 512]
    - [85, 29.18]
  - - [256, 1024, 1, 1024, 256, 256, 1024, 1024]
    - [86, 46.96]
  - - [256, 1024, 1, 2048, 256, 256, 2048, 2048]
    - [78, 67.81]
  - - [256, 1024, 1, 4096, 256, 256, 4096, 4096]
    - [78, 87.94]
  - - [256, 1024, 1, 8192, 256, 256, 8192, 8192]
    - [84, 102.26]
  - - [256, 2048, 1, 128, 256, 256, 128, 128]
    - [23, 16.06]
  - - [256, 2048, 1, 256, 256, 256, 256, 256]
    - [23, 29.19]
  - - [256, 2048, 1, 512, 256, 256, 512, 512]
    - [21, 48.33]
  - - [256, 2048, 1, 1024, 256, 256, 1024, 1024]
    - [72, 75.4]
  - - [256, 2048, 1, 2048, 256, 256, 2048, 2048]
    - [72, 104.4]
  - - [256, 2048, 1, 4096, 256, 256, 4096, 4096]
    - [72, 129.33]
  - - [256, 2048, 1, 8192, 256, 256, 8192, 8192]
    - [99, 141.93]
  - - [256, 4096, 1, 128, 256, 256, 128, 128]
    - [12, 26.81]
  - - [256, 4096, 1, 256, 256, 256, 256, 256]
    - [13, 48.5]
  - - [256, 4096, 1, 512, 256, 256, 512, 512]
    - [16, 79.97]
  - - [256, 4096, 1, 1024, 256, 256, 1024, 1024]
    - [18, 120.23]
  - - [256, 4096, 1, 2048, 256, 256, 2048, 2048]
    - [16, 160.74]
  - - [256, 4096, 1, 4096, 256, 256, 4096, 4096]
    - [95, 175.56]
  - - [256, 4096, 1, 8192, 256, 256, 8192, 8192]
    - [69, 190.1]
  - - [256, 8192, 1, 128, 256, 256, 128, 128]
    - [8, 41.47]
  - - [256, 8192, 1, 256, 256, 256, 256, 256]
    - [8, 74.42]
  - - [256, 8192, 1, 512, 256, 256, 512, 512]
    - [8, 120.85]
  - - [256, 8192, 1, 1024, 256, 256, 1024, 1024]
    - [8, 177.62]
  - - [256, 8192, 1, 2048, 256, 256, 2048, 2048]
    - [54, 220.89]
  - - [256, 8192, 1, 4096, 256, 256, 4096, 4096]
    - [67, 223.72]
  - - [256, 8192, 1, 8192, 256, 256, 8192, 8192]
    - [65, 245.26]
  - - [512, 128, 1, 128, 512, 512, 128, 128]
    - [27, 2.25]
  - - [512, 128, 1, 256, 512, 512, 256, 256]
    - [32, 4.24]
  - - [512, 128, 1, 512, 512, 512, 512, 512]
    - [88, 7.78]
  - - [512, 128, 1, 1024, 512, 512, 1024, 1024]
    - [91, 13.38]
  - - [512, 128, 1, 2048, 512, 512, 2048, 2048]
    - [88, 20.67]
  - - [512, 128, 1, 4096, 512, 512, 4096, 4096]
    - [88, 28.09]
  - - [512, 128, 1, 8192, 512, 512, 8192, 8192]
    - [88, 34.33]
  - - [512, 256, 1, 128, 512, 512, 128, 128]
    - [28, 4.32]
  - - [512, 256, 1, 256, 512, 512, 256, 256]
    - [106, 8.43]
  - - [512, 256, 1, 512, 512, 512, 512, 512]
    - [90, 15.71]
  - - [512, 256, 1, 1024, 512, 512, 1024, 1024]
    - [90, 26.41]
  - - [512, 256, 1, 2048, 512, 512, 2048, 2048]
    - [106, 40.33]
  - - [512, 256, 1, 4096, 512, 512, 4096, 4096]
    - [92, 54.82]
  - - [512, 256, 1, 8192, 512, 512, 8192, 8192]
    - [94, 66.71]
  - - [512, 512, 1, 128, 512, 512, 128, 128]
    - [80, 8.37]
  - - [512, 512, 1, 256, 512, 512, 256, 256]
    - [29, 16.24]
  - - [512, 512, 1, 512, 512, 512, 512, 512]
    - [85, 28.62]
  - - [512, 512, 1, 1024, 512, 512, 1024, 1024]
    - [84, 46.22]
  - - [512, 512, 1, 2048, 512, 512, 2048, 2048]
    - [84, 67.64]
  - - [512, 512, 1, 4096, 512, 512, 4096, 4096]
    - [78, 87.62]
  - - [512, 512, 1, 8192, 512, 512, 8192, 8192]
    - [107, 96.59]
  - - [512, 1024, 1, 128, 512, 512, 128, 128]
    - [22, 16.0]
  - - [512, 1024, 1, 256, 512, 512, 256, 256]
    - [21, 28.66]
  - - [512, 1024, 1, 512, 512, 512, 512, 512]
    - [72, 48.56]
  - - [512, 1024, 1, 1024, 512, 512, 1024, 1024]
    - [73, 75.44]
  - - [512, 1024, 1, 2048, 512, 512, 2048, 2048]
    - [73, 104.22]
  - - [512, 1024, 1, 4096, 512, 512, 4096, 4096]
    - [73, 129.73]
  - - [512, 1024, 1, 8192, 512, 512, 8192, 8192]
    - [100, 141.02]
  - - [512, 2048, 1, 128, 512, 512, 128, 128]
    - [17, 27.22]
  - - [512, 2048, 1, 256, 512, 512, 256, 256]
    - [15, 48.76]
  - - [512, 2048, 1, 512, 512, 512, 512, 512]
    - [16, 80.86]
  - - [512, 2048, 1, 1024, 512, 512, 1024, 1024]
    - [18, 120.34]
  - - [512, 2048, 1, 2048, 512, 512, 2048, 2048]
    - [16, 159.62]
  - - [512, 2048, 1, 4096, 512, 512, 4096, 4096]
    - [95, 177.22]
  - - [512, 2048, 1, 8192, 512, 512, 8192, 8192]
    - [97, 191.27]
  - - [512, 4096, 1, 128, 512, 512, 128, 128]
    - [8, 41.18]
  - - [512, 4096, 1, 256, 512, 512, 256, 256]
    - [8, 73.69]
  - - [512, 4096, 1, 512, 512, 512, 512, 512]
    - [8, 120.59]
  - - [512, 4096, 1, 1024, 512, 512, 1024, 1024]
    - [8, 176.64]
  - - [512, 4096, 1, 2048, 512, 512, 2048, 2048]
    - [54, 230.86]
  - - [512, 4096, 1, 4096, 512, 512, 4096, 4096]
    - [54, 229.14]
  - - [512, 4096, 1, 8192, 512, 512, 8192, 8192]
    - [55, 250.07]
  - - [512, 8192, 1, 128, 512, 512, 128, 128]
    - [59, 60.87]
  - - [512, 8192, 1, 256, 512, 512, 256, 256]
    - [59, 109.61]
  - - [512, 8192, 1, 512, 512, 512, 512, 512]
    - [59, 181.59]
  - - [512, 8192, 1, 1024, 512, 512, 1024, 1024]
    - [59, 239.46]
  - - [512, 8192, 1, 2048, 512, 512, 2048, 2048]
    - [58, 248.88]
  - - [512, 8192, 1, 4096, 512, 512, 4096, 4096]
    - [59, 277.01]
  - - [512, 8192, 1, 8192, 512, 512, 8192, 8192]
    - [59, 283.01]
  - - [1024, 128, 1, 128, 1024, 1024, 128, 128]
    - [91, 4.82]
  - - [1024, 128, 1, 256, 1024, 1024, 256, 256]
    - [89, 8.96]
  - - [1024, 128, 1, 512, 1024, 1024, 512, 512]
    - [90, 16.13]
  - - [1024, 128, 1, 1024, 1024, 1024, 1024, 1024]
    - [90, 26.56]
  - - [1024, 128, 1, 2048, 1024, 1024, 2048, 2048]
    - [92, 40.1]
  - - [1024, 128, 1, 4096, 1024, 1024, 4096, 4096]
    - [94, 54.19]
  - - [1024, 128, 1, 8192, 1024, 1024, 8192, 8192]
    - [92, 66.59]
  - - [1024, 256, 1, 128, 1024, 1024, 128, 128]
    - [10, 5.86]
  - - [1024, 256, 1, 256, 1024, 1024, 256, 256]
    - [25, 11.44]
  - - [1024, 256, 1, 512, 1024, 1024, 512, 512]
    - [81, 22.55]
  - - [1024, 256, 1, 1024, 1024, 1024, 1024, 1024]
    - [87, 43.36]
  - - [1024, 256, 1, 2048, 1024, 1024, 2048, 2048]
    - [84, 67.33]
  - - [1024, 256, 1, 4096, 1024, 1024, 4096, 4096]
    - [78, 87.49]
  - - [1024, 256, 1, 8192, 1024, 1024, 8192, 8192]
    - [83, 100.37]
  - - [1024, 512, 1, 128, 1024, 1024, 128, 128]
    - [26, 12.24]
  - - [1024, 512, 1, 256, 1024, 1024, 256, 256]
    - [60, 23.26]
  - - [1024, 512, 1, 512, 1024, 1024, 512, 512]
    - [76, 44.53]
  - - [1024, 512, 1, 1024, 1024, 1024, 1024, 1024]
    - [72, 74.93]
  - - [1024, 512, 1, 2048, 1024, 1024, 2048, 2048]
    - [73, 104.29]
  - - [1024, 512, 1, 4096, 1024, 1024, 4096, 4096]
    - [74, 127.11]
  - - [1024, 512, 1, 8192, 1024, 1024, 8192, 8192]
    - [104, 141.5]
  - - [1024, 1024, 1, 128, 1024, 1024, 128, 128]
    - [70, 25.99]
  - - [1024, 1024, 1, 256, 1024, 1024, 256, 256]
    - [14, 47.43]
  - - [1024, 1024, 1, 512, 1024, 1024, 512, 512]
    - [16, 80.01]
  - - [1024, 1024, 1, 1024, 1024, 1024, 1024, 1024]
    - [16, 119.79]
  - - [1024, 1024, 1, 2048, 1024, 1024, 2048, 2048]
    - [18, 158.65]
  - - [1024, 1024, 1, 4096, 1024, 1024, 4096, 4096]
    - [98, 173.9]
  - - [1024, 1024, 1, 8192, 1024, 1024, 8192, 8192]
    - [98, 192.81]
  - - [1024, 2048, 1, 128, 1024, 1024, 128, 128]
    - [8, 41.47]
  - - [1024, 2048, 1, 256, 1024, 1024, 256, 256]
    - [8, 73.35]
  - - [1024, 2048, 1, 512, 1024, 1024, 512, 512]
    - [8, 120.65]
  - - [1024, 2048, 1, 1024, 1024, 1024, 1024, 1024]
    - [8, 178.2]
  - - [1024, 2048, 1, 2048, 1024, 1024, 2048, 2048]
    - [54, 224.4]
  - - [1024, 2048, 1, 4096, 1024, 1024, 4096, 4096]
    - [65, 229.84]
  - - [1024, 2048, 1, 8192, 1024, 1024, 8192, 8192]
    - [65, 247.44]
  - - [1024, 4096, 1, 128, 1024, 1024, 128, 128]
    - [7, 60.44]
  - - [1024, 4096, 1, 256, 1024, 1024, 256, 256]
    - [7, 105.03]
  - - [1024, 4096, 1, 512, 1024, 1024, 512, 512]
    - [6, 164.19]
  - - [1024, 4096, 1, 1024, 1024, 1024, 1024, 1024]
    - [6, 212.99]
  - - [1024, 4096, 1, 2048, 1024, 1024, 2048, 2048]
    - [43, 245.63]
  - - [1024, 4096, 1, 4096, 1024, 1024, 4096, 4096]
    - [46, 264.55]
  - - [1024, 4096, 1, 8192, 1024, 1024, 8192, 8192]
    - [34, 258.69]
  - - [1024, 8192, 1, 128, 1024, 1024, 128, 128]
    - [42, 74.91]
  - - [1024, 8192, 1, 256, 1024, 1024, 256, 256]
    - [42, 129.32]
  - - [1024, 8192, 1, 512, 1024, 1024, 512, 512]
    - [36, 201.6]
  - - [1024, 8192, 1, 1024, 1024, 1024, 1024, 1024]
    - [42, 252.51]
  - - [1024, 8192, 1, 2048, 1024, 1024, 2048, 2048]
    - [35, 320.72]
  - - [1024, 8192, 1, 4096, 1024, 1024, 4096, 4096]
    - [37, 344.01]
  - - [1024, 8192, 1, 8192, 1024, 1024, 8192, 8192]
    - [35, 354.9]
  - - [2048, 128, 1, 128, 2048, 2048, 128, 128]
    - [29, 8.96]
  - - [2048, 128, 1, 256, 2048, 2048, 256, 256]
    - [86, 16.6]
  - - [2048, 128, 1, 512, 2048, 2048, 512, 512]
    - [86, 29.29]
  - - [2048, 128, 1, 1024, 2048, 2048, 1024, 1024]
    - [86, 46.78]
  - - [2048, 128, 1, 2048, 2048, 2048, 2048, 2048]
    - [84, 67.97]
  - - [2048, 128, 1, 4096, 2048, 2048, 4096, 4096]
    - [79, 87.39]
  - - [2048, 128, 1, 8192, 2048, 2048, 8192, 8192]
    - [82, 100.39]
  - - [2048, 256, 1, 128, 2048, 2048, 128, 128]
    - [24, 15.74]
  - - [2048, 256, 1, 256, 2048, 2048, 256, 256]
    - [26, 28.72]
  - - [2048, 256, 1, 512, 2048, 2048, 512, 512]
    - [21, 48.12]
  - - [2048, 256, 1, 1024, 2048, 2048, 1024, 1024]
    - [73, 75.12]
  - - [2048, 256, 1, 2048, 2048, 2048, 2048, 2048]
    - [75, 104.47]
  - - [2048, 256, 1, 4096, 2048, 2048, 4096, 4096]
    - [77, 129.53]
  - - [2048, 256, 1, 8192, 2048, 2048, 8192, 8192]
    - [102, 141.43]
  - - [2048, 512, 1, 128, 2048, 2048, 128, 128]
    - [14, 27.14]
  - - [2048, 512, 1, 256, 2048, 2048, 256, 256]
    - [14, 48.6]
  - - [2048, 512, 1, 512, 2048, 2048, 512, 512]
    - [14, 80.42]
  - - [2048, 512, 1, 1024, 2048, 2048, 1024, 1024]
    - [18, 120.78]
  - - [2048, 512, 1, 2048, 2048, 2048, 2048, 2048]
    - [19, 159.19]
  - - [2048, 512, 1, 4096, 2048, 2048, 4096, 4096]
    - [98, 174.52]
  - - [2048, 512, 1, 8192, 2048, 2048, 8192, 8192]
    - [98, 190.0]
  - - [2048, 1024, 1, 128, 2048, 2048, 128, 128]
    - [54, 42.0]
  - - [2048, 1024, 1, 256, 2048, 2048, 256, 256]
    - [8, 74.57]
  - - [2048, 1024, 1, 512, 2048, 2048, 512, 512]
    - [8, 122.2]
  - - [2048, 1024, 1, 1024, 2048, 2048, 1024, 1024]
    - [8, 179.45]
  - - [2048, 1024, 1, 2048, 2048, 2048, 2048, 2048]
    - [55, 222.83]
  - - [2048, 1024, 1, 4096, 2048, 2048, 4096, 4096]
    - [68, 230.13]
  - - [2048, 1024, 1, 8192, 2048, 2048, 8192, 8192]
    - [66, 245.01]
  - - [2048, 2048, 1, 128, 2048, 2048, 128, 128]
    - [5, 58.01]
  - - [2048, 2048, 1, 256, 2048, 2048, 256, 256]
    - [6, 102.11]
  - - [2048, 2048, 1, 512, 2048, 2048, 512, 512]
    - [6, 157.47]
  - - [2048, 2048, 1, 1024, 2048, 2048, 1024, 1024]
    - [43, 206.66]
  - - [2048, 2048, 1, 2048, 2048, 2048, 2048, 2048]
    - [46, 246.27]
  - - [2048, 2048, 1, 4096, 2048, 2048, 4096, 4096]
    - [43, 264.94]
  - - [2048, 2048, 1, 8192, 2048, 2048, 8192, 8192]
    - [45, 255.24]
  - - [2048, 4096, 1, 128, 2048, 2048, 128, 128]
    - [1, 68.88]
  - - [2048, 4096, 1, 256, 2048, 2048, 256, 256]
    - [1, 116.27]
  - - [2048, 4096, 1, 512, 2048, 2048, 512, 512]
    - [2, 175.26]
  - - [2048, 4096, 1, 1024, 2048, 2048, 1024, 1024]
    - [3, 227.24]
  - - [2048, 4096, 1, 2048, 2048, 2048, 2048, 2048]
    - [1, 267.55]
  - - [2048, 4096, 1, 4096, 2048, 2048, 4096, 4096]
    - [37, 281.75]
  - - [2048, 4096, 1, 8192, 2048, 2048, 8192, 8192]
    - [41, 314.52]
  - - [2048, 8192, 1, 128, 2048, 2048, 128, 128]
    - [39, 76.72]
  - - [2048, 8192, 1, 256, 2048, 2048, 256, 256]
    - [42, 136.1]
  - - [2048, 8192, 1, 512, 2048, 2048, 512, 512]
    - [40, 206.12]
  - - [2048, 8192, 1, 1024, 2048, 2048, 1024, 1024]
    - [35, 272.56]
  - - [2048, 8192, 1, 2048, 2048, 2048, 2048, 2048]
    - [39, 312.88]
  - - [2048, 8192, 1, 4096, 2048, 2048, 4096, 4096]
    - [35, 318.18]
  - - [2048, 8192, 1, 8192, 2048, 2048, 8192, 8192]
    - [35, 361.91]
  - - [4096, 128, 1, 128, 4096, 4096, 128, 128]
    - [23, 16.51]
  - - [4096, 128, 1, 256, 4096, 4096, 256, 256]
    - [22, 29.9]
  - - [4096, 128, 1, 512, 4096, 4096, 512, 512]
    - [22, 48.65]
  - - [4096, 128, 1, 1024, 4096, 4096, 1024, 1024]
    - [73, 75.99]
  - - [4096, 128, 1, 2048, 4096, 4096, 2048, 2048]
    - [73, 105.35]
  - - [4096, 128, 1, 4096, 4096, 4096, 4096, 4096]
    - [77, 129.57]
  - - [4096, 128, 1, 8192, 4096, 4096, 8192, 8192]
    - [102, 140.83]
  - - [4096, 256, 1, 128, 4096, 4096, 128, 128]
    - [16, 27.41]
  - - [4096, 256, 1, 256, 4096, 4096, 256, 256]
    - [14, 48.55]
  - - [4096, 256, 1, 512, 4096, 4096, 512, 512]
    - [16, 82.22]
  - - [4096, 256, 1, 1024, 4096, 4096, 1024, 1024]
    - [20, 120.06]
  - - [4096, 256, 1, 2048, 4096, 4096, 2048, 2048]
    - [18, 159.17]
  - - [4096, 256, 1, 4096, 4096, 4096, 4096, 4096]
    - [97, 174.74]
  - - [4096, 256, 1, 8192, 4096, 4096, 8192, 8192]
    - [98, 190.45]
  - - [4096, 512, 1, 128, 4096, 4096, 128, 128]
    - [54, 41.62]
  - - [4096, 512, 1, 256, 4096, 4096, 256, 256]
    - [8, 73.93]
  - - [4096, 512, 1, 512, 4096, 4096, 512, 512]
    - [8, 121.08]
  - - [4096, 512, 1, 1024, 4096, 4096, 1024, 1024]
    - [9, 175.06]
  - - [4096, 512, 1, 2048, 4096, 4096, 2048, 2048]
    - [56, 223.46]
  - - [4096, 512, 1, 4096, 4096, 4096, 4096, 4096]
    - [55, 230.98]
  - - [4096, 512, 1, 8192, 4096, 4096, 8192, 8192]
    - [66, 247.76]
  - - [4096, 1024, 1, 128, 4096, 4096, 128, 128]
    - [6, 57.33]
  - - [4096, 1024, 1, 256, 4096, 4096, 256, 256]
    - [6, 100.89]
  - - [4096, 1024, 1, 512, 4096, 4096, 512, 512]
    - [6, 145.08]
  - - [4096, 1024, 1, 1024, 4096, 4096, 1024, 1024]
    - [44, 203.23]
  - - [4096, 1024, 1, 2048, 4096, 4096, 2048, 2048]
    - [44, 243.27]
  - - [4096, 1024, 1, 4096, 4096, 4096, 4096, 4096]
    - [44, 269.67]
  - - [4096, 1024, 1, 8192, 4096, 4096, 8192, 8192]
    - [62, 266.7]
  - - [4096, 2048, 1, 128, 4096, 4096, 128, 128]
    - [5, 63.57]
  - - [4096, 2048, 1, 256, 4096, 4096, 256, 256]
    - [6, 109.75]
  - - [4096, 2048, 1, 512, 4096, 4096, 512, 512]
    - [0, 165.42]
  - - [4096, 2048, 1, 1024, 4096, 4096, 1024, 1024]
    - [2, 222.74]
  - - [4096, 2048, 1, 2048, 4096, 4096, 2048, 2048]
    - [2, 261.75]
  - - [4096, 2048, 1, 4096, 4096, 4096, 4096, 4096]
    - [33, 279.8]
  - - [4096, 2048, 1, 8192, 4096, 4096, 8192, 8192]
    - [48, 306.53]
  - - [4096, 4096, 1, 128, 4096, 4096, 128, 128]
    - [6, 71.41]
  - - [4096, 4096, 1, 256, 4096, 4096, 256, 256]
    - [1, 122.93]
  - - [4096, 4096, 1, 512, 4096, 4096, 512, 512]
    - [3, 179.32]
  - - [4096, 4096, 1, 1024, 4096, 4096, 1024, 1024]
    - [3, 226.82]
  - - [4096, 4096, 1, 2048, 4096, 4096, 2048, 2048]
    - [37, 259.09]
  - - [4096, 4096, 1, 4096, 4096, 4096, 4096, 4096]
    - [61, 278.34]
  - - [4096, 4096, 1, 8192, 4096, 4096, 8192, 8192]
    - [34, 331.18]
  - - [4096, 8192, 1, 128, 4096, 4096, 128, 128]
    - [35, 83.66]
  - - [4096, 8192, 1, 256, 4096, 4096, 256, 256]
    - [36, 142.33]
  - - [4096, 8192, 1, 512, 4096, 4096, 512, 512]
    - [38, 209.57]
  - - [4096, 8192, 1, 1024, 4096, 4096, 1024, 1024]
    - [41, 249.72]
  - - [4096, 8192, 1, 2048, 4096, 4096, 2048, 2048]
    - [41, 292.76]
  - - [4096, 8192, 1, 4096, 4096, 4096, 4096, 4096]
    - [39, 326.55]
  - - [4096, 8192, 1, 8192, 4096, 4096, 8192, 8192]
    - [39, 377.5]
  - - [8192, 128, 1, 128, 8192, 8192, 128, 128]
    - [11, 27.21]
  - - [8192, 128, 1, 256, 8192, 8192, 256, 256]
    - [17, 48.5]
  - - [8192, 128, 1, 512, 8192, 8192, 512, 512]
    - [16, 80.92]
  - - [8192, 128, 1, 1024, 8192, 8192, 1024, 1024]
    - [19, 116.17]
  - - [8192, 128, 1, 2048, 8192, 8192, 2048, 2048]
    - [20, 157.78]
  - - [8192, 128, 1, 4096, 8192, 8192, 4096, 4096]
    - [96, 168.23]
  - - [8192, 128, 1, 8192, 8192, 8192, 8192, 8192]
    - [101, 191.02]
  - - [8192, 256, 1, 128, 8192, 8192, 128, 128]
    - [57, 40.49]
  - - [8192, 256, 1, 256, 8192, 8192, 256, 256]
    - [9, 72.77]
  - - [8192, 256, 1, 512, 8192, 8192, 512, 512]
    - [9, 118.5]
  - - [8192, 256, 1, 1024, 8192, 8192, 1024, 1024]
    - [56, 173.9]
  - - [8192, 256, 1, 2048, 8192, 8192, 2048, 2048]
    - [55, 216.11]
  - - [8192, 256, 1, 4096, 8192, 8192, 4096, 4096]
    - [67, 227.2]
  - - [8192, 256, 1, 8192, 8192, 8192, 8192, 8192]
    - [66, 250.0]
  - - [8192, 512, 1, 128, 8192, 8192, 128, 128]
    - [6, 56.2]
  - - [8192, 512, 1, 256, 8192, 8192, 256, 256]
    - [4, 94.22]
  - - [8192, 512, 1, 512, 8192, 8192, 512, 512]
    - [62, 155.94]
  - - [8192, 512, 1, 1024, 8192, 8192, 1024, 1024]
    - [64, 223.61]
  - - [8192, 512, 1, 2048, 8192, 8192, 2048, 2048]
    - [63, 248.73]
  - - [8192, 512, 1, 4096, 8192, 8192, 4096, 4096]
    - [62, 304.05]
  - - [8192, 512, 1, 8192, 8192, 8192, 8192, 8192]
    - [62, 309.37]
  - - [8192, 1024, 1, 128, 8192, 8192, 128, 128]
    - [47, 60.85]
  - - [8192, 1024, 1, 256, 8192, 8192, 256, 256]
    - [6, 110.8]
  - - [8192, 1024, 1, 512, 8192, 8192, 512, 512]
    - [53, 181.38]
  - - [8192, 1024, 1, 1024, 8192, 8192, 1024, 1024]
    - [49, 227.53]
  - - [8192, 1024, 1, 2048, 8192, 8192, 2048, 2048]
    - [53, 313.16]
  - - [8192, 1024, 1, 4096, 8192, 8192, 4096, 4096]
    - [51, 345.08]
  - - [8192, 1024, 1, 8192, 8192, 8192, 8192, 8192]
    - [51, 380.66]
  - - [8192, 2048, 1, 128, 8192, 8192, 128, 128]
    - [6, 70.92]
  - - [8192, 2048, 1, 256, 8192, 8192, 256, 256]
    - [6, 124.31]
  - - [8192, 2048, 1, 512, 8192, 8192, 512, 512]
    - [53, 179.96]
  - - [8192, 2048, 1, 1024, 8192, 8192, 1024, 1024]
    - [52, 252.96]
  - - [8192, 2048, 1, 2048, 8192, 8192, 2048, 2048]
    - [53, 306.12]
  - - [8192, 2048, 1, 4096, 8192, 8192, 4096, 4096]
    - [50, 337.42]
  - - [8192, 2048, 1, 8192, 8192, 8192, 8192, 8192]
    - [50, 394.37]
  - - [8192, 4096, 1, 128, 8192, 8192, 128, 128]
    - [5, 75.82]
  - - [8192, 4096, 1, 256, 8192, 8192, 256, 256]
    - [8, 126.23]
  - - [8192, 4096, 1, 512, 8192, 8192, 512, 512]
    - [53, 183.92]
  - - [8192, 4096, 1, 1024, 8192, 8192, 1024, 1024]
    - [53, 236.44]
  - - [8192, 4096, 1, 2048, 8192, 8192, 2048, 2048]
    - [51, 294.52]
  - - [8192, 4096, 1, 4096, 8192, 8192, 4096, 4096]
    - [51, 347.57]
  - - [8192, 4096, 1, 8192, 8192, 8192, 8192, 8192]
    - [51, 413.87]
  - - [8192, 8192, 1, 128, 8192, 8192, 128, 128]
    - [36, 79.42]
  - - [8192, 8192, 1, 256, 8192, 8192, 256, 256]
    - [35, 126.86]
  - - [8192, 8192, 1, 512, 8192, 8192, 512, 512]
    - [36, 174.84]
  - - [8192, 8192, 1, 1024, 8192, 8192, 1024, 1024]
    - [39, 244.37]
  - - [8192, 8192, 1, 2048, 8192, 8192, 2048, 2048]
    - [51, 300.13]
  - - [8192, 8192, 1, 4096, 8192, 8192, 4096, 4096]
    - [51, 350.91]
  - - [8192, 8192, 1, 8192, 8192, 8192, 8192, 8192]
    - [53, 404.05]
  - - [1, 1, 1, 32, 1, 1, 32, 32]
    - [108, 0.0]
- null
- null
- ExperimentalStreamK
- GridBased
