projects/hipblaslt/library/src/amd_detail/rocblaslt/src/Tensile/Logic/asm_full/aquavanjaram/gfx942_228cu/StreamK/aquavanjaram942_Cijk_Ailk_Bljk_B8NF8NS_BH_Bias_HAS_SAV_UserArgs.yaml
- {MinimumRequiredVersion: 4.33.0}
- aquavanjaram942
- {Architecture: gfx942, CUCount: 228}
- [Device 0049, Device 0050]
    SolutionIndex: 0
    SolutionNameMin: Cijk_Ailk_Bljk_B8NF8NS_BH_Bias_HAS_SAV_UserArgs_MT256x256x64_MI16x16x1_SN_LDSB1_CLR1_GRVWA8_GRVWB8_GSU0_GSUC0_GSUWGMRR0_K1_LBSPPA2048_LBSPPB512_LPA0_LPB8_LRVW8_MIWT8_8_PLR1_SU0_SUM0_SUS64_VWA8_VWB8_WGM1_WGMXCC1_WGMXCCGn1
    SolutionIndex: 1
    SolutionNameMin: Cijk_Ailk_Bljk_B8NF8NS_BH_Bias_HAS_SAV_UserArgs_MT256x256x64_MI16x16x1_SN_LDSB1_CLR1_GRVWA8_GRVWB16_GSU0_GSUC0_GSUWGMRR0_K1_LBSPPA2048_LBSPPB512_LPA0_LPB16_LRVW8_MIWT8_8_PLR1_SU0_SUM0_SUS64_VWA8_VWB8_WGM1_WGMXCC1_WGMXCCGn1
    SolutionIndex: 2
    SolutionNameMin: Cijk_Ailk_Bljk_B8NF8NS_BH_Bias_HAS_SAV_UserArgs_MT256x256x64_MI16x16x1_SN_LDSB1_CLR1_GRVWA16_GRVWB16_GSU0_GSUC0_GSUWGMRR0_K1_LBSPPA2048_LBSPPB512_LPA0_LPB16_LRVW8_MIWT8_8_PLR1_SU0_SUM0_SUS64_VWA8_VWB8_WGM1_WGMXCC1_WGMXCCGn1
    SolutionIndex: 3
    SolutionNameMin: Cijk_Ailk_Bljk_B8NF8NS_BH_Bias_HAS_SAV_UserArgs_MT256x256x64_MI16x16x1_SN_LDSB1_CLR1_GRVWA16_GRVWB8_GSU0_GSUC0_GSUWGMRR0_K1_LBSPPA2048_LBSPPB512_LPA0_LPB8_LRVW8_MIWT8_8_PLR1_SU0_SUM0_SUS64_VWA8_VWB8_WGM4_WGMXCC1_WGMXCCGn1
    SolutionIndex: 4
    SolutionNameMin: Cijk_Ailk_Bljk_B8NF8NS_BH_Bias_HAS_SAV_UserArgs_MT256x256x64_MI16x16x1_SN_LDSB1_CLR1_GRVWA8_GRVWB16_GSU0_GSUC0_GSUWGMRR0_K1_LBSPPA2048_LBSPPB512_LPA0_LPB16_LRVW8_MIWT8_8_PLR1_SU0_SUM0_SUS64_VWA8_VWB8_WGM4_WGMXCC1_WGMXCCGn1
    SolutionIndex: 5
    SolutionNameMin: Cijk_Ailk_Bljk_B8NF8NS_BH_Bias_HAS_SAV_UserArgs_MT256x256x64_MI16x16x1_SN_LDSB1_CLR1_GRVWA16_GRVWB8_GSU0_GSUC0_GSUWGMRR0_K1_LBSPPA2048_LBSPPB512_LPA0_LPB8_LRVW8_MIWT8_8_PLR1_SU0_SUM0_SUS64_VWA8_VWB8_WGM6_WGMXCC1_WGMXCCGn1
    SolutionIndex: 6
    SolutionNameMin: Cijk_Ailk_Bljk_B8NF8NS_BH_Bias_HAS_SAV_UserArgs_MT256x256x64_MI16x16x1_SN_LDSB1_CLR1_GRVWA8_GRVWB16_GSU0_GSUC0_GSUWGMRR0_K1_LBSPPA2048_LBSPPB512_LPA0_LPB16_LRVW8_MIWT8_8_PLR1_SU0_SUM0_SUS64_VWA8_VWB8_WGM6_WGMXCC1_WGMXCCGn1
    SolutionIndex: 7
    SolutionNameMin: Cijk_Ailk_Bljk_B8NF8NS_BH_Bias_HAS_SAV_UserArgs_MT256x256x64_MI16x16x1_SN_LDSB1_CLR1_GRVWA16_GRVWB16_GSU0_GSUC0_GSUWGMRR0_K1_LBSPPA2048_LBSPPB512_LPA0_LPB16_LRVW8_MIWT8_8_PLR1_SU0_SUM0_SUS64_VWA8_VWB8_WGM6_WGMXCC1_WGMXCCGn1
    SolutionIndex: 8
    SolutionNameMin: Cijk_Ailk_Bljk_B8NF8NS_BH_Bias_HAS_SAV_UserArgs_MT256x256x64_MI16x16x1_SN_LDSB1_CLR1_GRVWA16_GRVWB8_GSU0_GSUC0_GSUWGMRR0_K1_LBSPPA2048_LBSPPB512_LPA0_LPB8_LRVW8_MIWT8_8_PLR1_SU0_SUM0_SUS64_VWA8_VWB8_WGM8_WGMXCC1_WGMXCCGn1
    SolutionIndex: 9
    SolutionNameMin: Cijk_Ailk_Bljk_B8NF8NS_BH_Bias_HAS_SAV_UserArgs_MT256x256x64_MI16x16x1_SN_LDSB1_CLR1_GRVWA8_GRVWB16_GSU0_GSUC0_GSUWGMRR0_K1_LBSPPA2048_LBSPPB512_LPA0_LPB16_LRVW8_MIWT8_8_PLR1_SU0_SUM0_SUS64_VWA8_VWB8_WGM8_WGMXCC1_WGMXCCGn1
    SolutionIndex: 10
    SolutionNameMin: Cijk_Ailk_Bljk_B8NF8NS_BH_Bias_HAS_SAV_UserArgs_MT128x256x64_MI16x16x1_SN_LDSB1_CLR1_GRVWA16_GRVWB8_GSU0_GSUC0_GSUWGMRR0_K1_LBSPPA1024_LBSPPB512_LPA64_LPB8_LRVW8_MIWT4_8_PLR1_SU0_SUM0_SUS64_VWA4_VWB8_WGM1_WGMXCC1_WGMXCCGn1
    SolutionIndex: 11
    SolutionNameMin: Cijk_Ailk_Bljk_B8NF8NS_BH_Bias_HAS_SAV_UserArgs_MT128x256x64_MI16x16x1_SN_LDSB1_CLR1_GRVWA8_GRVWB16_GSU0_GSUC0_GSUWGMRR0_K1_LBSPPA1024_LBSPPB512_LPA64_LPB16_LRVW8_MIWT4_8_PLR1_SU0_SUM0_SUS64_VWA4_VWB8_WGM1_WGMXCC1_WGMXCCGn1
    SolutionIndex: 12
    SolutionNameMin: Cijk_Ailk_Bljk_B8NF8NS_BH_Bias_HAS_SAV_UserArgs_MT128x256x64_MI16x16x1_SN_LDSB1_CLR1_GRVWA16_GRVWB16_GSU0_GSUC0_GSUWGMRR0_K1_LBSPPA1024_LBSPPB512_LPA64_LPB16_LRVW8_MIWT4_8_PLR1_SU0_SUM0_SUS64_VWA4_VWB8_WGM4_WGMXCC1_WGMXCCGn1
    SolutionIndex: 13
    SolutionNameMin: Cijk_Ailk_Bljk_B8NF8NS_BH_Bias_HAS_SAV_UserArgs_MT128x256x64_MI16x16x1_SN_LDSB1_CLR1_GRVWA16_GRVWB8_GSU0_GSUC0_GSUWGMRR0_K1_LBSPPA1024_LBSPPB512_LPA64_LPB8_LRVW8_MIWT4_8_PLR1_SU0_SUM0_SUS64_VWA4_VWB8_WGM8_WGMXCC1_WGMXCCGn1
    SolutionIndex: 14
    SolutionNameMin: Cijk_Ailk_Bljk_B8NF8NS_BH_Bias_HAS_SAV_UserArgs_MT128x256x64_MI16x16x1_SN_LDSB1_CLR1_GRVWA8_GRVWB16_GSU0_GSUC0_GSUWGMRR0_K1_LBSPPA1024_LBSPPB512_LPA64_LPB16_LRVW8_MIWT4_8_PLR1_SU0_SUM0_SUS64_VWA4_VWB8_WGM8_WGMXCC1_WGMXCCGn1
    SolutionIndex: 15
    SolutionNameMin: Cijk_Ailk_Bljk_B8NF8NS_BH_Bias_HAS_SAV_UserArgs_MT256x128x64_MI16x16x1_SN_LDSB1_CLR1_GRVWA16_GRVWB16_GSU0_GSUC0_GSUWGMRR0_K1_LBSPPA2048_LBSPPB256_LPA0_LPB16_LRVW8_MIWT8_4_PLR1_SU0_SUM0_SUS64_VWA8_VWB4_WGM1_WGMXCC1_WGMXCCGn1
    SolutionIndex: 16
    SolutionNameMin: Cijk_Ailk_Bljk_B8NF8NS_BH_Bias_HAS_SAV_UserArgs_MT256x128x64_MI16x16x1_SN_LDSB1_CLR1_GRVWA16_GRVWB16_GSU0_GSUC0_GSUWGMRR0_K1_LBSPPA2048_LBSPPB256_LPA0_LPB16_LRVW8_MIWT8_4_PLR1_SU0_SUM0_SUS64_VWA8_VWB4_WGM4_WGMXCC1_WGMXCCGn1
    SolutionIndex: 17
    SolutionNameMin: Cijk_Ailk_Bljk_B8NF8NS_BH_Bias_HAS_SAV_UserArgs_MT256x128x64_MI16x16x1_SN_LDSB1_CLR1_GRVWA16_GRVWB8_GSU0_GSUC0_GSUWGMRR0_K1_LBSPPA2048_LBSPPB256_LPA0_LPB8_LRVW8_MIWT8_4_PLR1_SU0_SUM0_SUS64_VWA8_VWB4_WGM8_WGMXCC1_WGMXCCGn1
    SolutionIndex: 18
    SolutionNameMin: Cijk_Ailk_Bljk_B8NF8NS_BH_Bias_HAS_SAV_UserArgs_MT256x128x64_MI16x16x1_SN_LDSB1_CLR1_GRVWA16_GRVWB16_GSU0_GSUC0_GSUWGMRR0_K1_LBSPPA2048_LBSPPB256_LPA0_LPB16_LRVW8_MIWT8_4_PLR1_SU0_SUM0_SUS64_VWA8_VWB4_WGM8_WGMXCC1_WGMXCCGn1
    SolutionIndex: 19
    SolutionNameMin: Cijk_Ailk_Bljk_B8NF8NS_BH_Bias_HAS_SAV_UserArgs_MT128x128x64_MI16x16x1_SN_LDSB1_CLR1_GRVWA8_GRVWB16_GSU0_GSUC0_GSUWGMRR0_K1_LBSPPA1024_LBSPPB128_LPA0_LPB16_LRVW8_MIWT8_2_PLR1_SU0_SUM0_SUS64_VWA8_VWB2_WGM1_WGMXCC1_WGMXCCGn1
    SolutionIndex: 20
    SolutionNameMin: Cijk_Ailk_Bljk_B8NF8NS_BH_Bias_HAS_SAV_UserArgs_MT128x64x64_MI16x16x1_SN_LDSB0_CLR1_GRVWA16_GRVWB16_GSU0_GSUC0_GSUWGMRR0_K1_LBSPPA1024_LBSPPB128_LPA0_LPB16_LRVW8_MIWT8_1_PLR1_SU0_SUM0_SUS64_VWA8_VWB1_WGM4_WGMXCC1_WGMXCCGn1
    SolutionIndex: 21
    SolutionNameMin: Cijk_Ailk_Bljk_B8NF8NS_BH_Bias_HAS_SAV_UserArgs_MT128x128x64_MI16x16x1_SN_LDSB1_CLR1_GRVWA8_GRVWB16_GSU0_GSUC0_GSUWGMRR0_K1_LBSPPA1024_LBSPPB256_LPA64_LPB16_LRVW8_MIWT4_4_PLR1_SU0_SUM0_SUS64_VWA4_VWB4_WGM1_WGMXCC1_WGMXCCGn1
    SolutionIndex: 22
    SolutionNameMin: Cijk_Ailk_Bljk_B8NF8NS_BH_Bias_HAS_SAV_UserArgs_MT128x128x64_MI16x16x1_SN_LDSB1_CLR1_GRVWA16_GRVWB16_GSU0_GSUC0_GSUWGMRR0_K1_LBSPPA1024_LBSPPB256_LPA64_LPB16_LRVW8_MIWT4_4_PLR1_SU0_SUM0_SUS64_VWA4_VWB4_WGM1_WGMXCC1_WGMXCCGn1
    SolutionIndex: 23
    SolutionNameMin: Cijk_Ailk_Bljk_B8NF8NS_BH_Bias_HAS_SAV_UserArgs_MT128x128x64_MI16x16x1_SN_LDSB1_CLR1_GRVWA8_GRVWB16_GSU0_GSUC0_GSUWGMRR0_K1_LBSPPA1024_LBSPPB256_LPA64_LPB16_LRVW8_MIWT4_4_PLR1_SU0_SUM0_SUS64_VWA4_VWB4_WGM4_WGMXCC1_WGMXCCGn1
    SolutionIndex: 24
    SolutionNameMin: Cijk_Ailk_Bljk_B8NF8NS_BH_Bias_HAS_SAV_UserArgs_MT64x128x64_MI16x16x1_SN_LDSB0_CLR1_GRVWA16_GRVWB8_GSU0_GSUC0_GSUWGMRR0_K1_LBSPPA512_LBSPPB256_LPA32_LPB8_LRVW8_MIWT2_4_PLR1_SU0_SUM0_SUS64_VWA2_VWB4_WGM1_WGMXCC1_WGMXCCGn1
    SolutionIndex: 25
    SolutionNameMin: Cijk_Ailk_Bljk_B8NF8NS_BH_Bias_HAS_SAV_UserArgs_MT64x128x64_MI16x16x1_SN_LDSB0_CLR1_GRVWA8_GRVWB16_GSU0_GSUC0_GSUWGMRR0_K1_LBSPPA512_LBSPPB256_LPA32_LPB16_LRVW8_MIWT2_4_PLR1_SU0_SUM0_SUS64_VWA2_VWB4_WGM1_WGMXCC1_WGMXCCGn1
    SolutionIndex: 26
    SolutionNameMin: Cijk_Ailk_Bljk_B8NF8NS_BH_Bias_HAS_SAV_UserArgs_MT64x128x64_MI16x16x1_SN_LDSB0_CLR1_GRVWA16_GRVWB8_GSU0_GSUC0_GSUWGMRR0_K1_LBSPPA512_LBSPPB256_LPA32_LPB8_LRVW8_MIWT2_4_PLR1_SU0_SUM0_SUS64_VWA2_VWB4_WGM8_WGMXCC1_WGMXCCGn1
    SolutionIndex: 27
    SolutionNameMin: Cijk_Ailk_Bljk_B8NF8NS_BH_Bias_HAS_SAV_UserArgs_MT128x64x64_MI16x16x1_SN_LDSB0_CLR1_GRVWA8_GRVWB16_GSU0_GSUC0_GSUWGMRR0_K1_LBSPPA1024_LBSPPB128_LPA64_LPB16_LRVW8_MIWT4_2_PLR1_SU0_SUM0_SUS64_VWA4_VWB2_WGM1_WGMXCC1_WGMXCCGn1
    SolutionIndex: 28
    SolutionNameMin: Cijk_Ailk_Bljk_B8NF8NS_BH_Bias_HAS_SAV_UserArgs_MT128x64x64_MI16x16x1_SN_LDSB0_CLR1_GRVWA16_GRVWB16_GSU0_GSUC0_GSUWGMRR0_K1_LBSPPA1024_LBSPPB128_LPA64_LPB16_LRVW8_MIWT4_2_PLR1_SU0_SUM0_SUS64_VWA4_VWB2_WGM1_WGMXCC1_WGMXCCGn1
    SolutionIndex: 29
    SolutionNameMin: Cijk_Ailk_Bljk_B8NF8NS_BH_Bias_HAS_SAV_UserArgs_MT32x128x64_MI16x16x1_SN_LDSB0_CLR1_GRVWA8_GRVWB16_GSU0_GSUC0_GSUWGMRR0_K1_LBSPPA256_LBSPPB256_LPA16_LPB16_LRVW8_MIWT1_4_PLR1_SU0_SUM0_SUS64_VWA1_VWB4_WGM6_WGMXCC1_WGMXCCGn1
    SolutionIndex: 30
    SolutionNameMin: Cijk_Ailk_Bljk_B8NF8NS_BH_Bias_HAS_SAV_UserArgs_MT128x32x64_MI16x16x1_SN_LDSB0_CLR1_GRVWA8_GRVWB8_GSU0_GSUC0_GSUWGMRR0_K1_LBSPPA1024_LBSPPB128_LPA64_LPB8_LRVW8_MIWT4_1_PLR1_SU0_SUM0_SUS64_VWA4_VWB1_WGM1_WGMXCC1_WGMXCCGn1
    SolutionIndex: 31
    SolutionNameMin: Cijk_Ailk_Bljk_B8NF8NS_BH_Bias_HAS_SAV_UserArgs_MT128x32x64_MI16x16x1_SN_LDSB0_CLR1_GRVWA16_GRVWB8_GSU0_GSUC0_GSUWGMRR0_K1_LBSPPA1024_LBSPPB128_LPA64_LPB8_LRVW8_MIWT4_1_PLR1_SU0_SUM0_SUS64_VWA4_VWB1_WGM1_WGMXCC1_WGMXCCGn1
    SolutionIndex: 32
    SolutionNameMin: Cijk_Ailk_Bljk_B8NF8NS_BH_Bias_HAS_SAV_UserArgs_MT128x32x64_MI16x16x1_SN_LDSB0_CLR1_GRVWA16_GRVWB8_GSU0_GSUC0_GSUWGMRR0_K1_LBSPPA1024_LBSPPB128_LPA64_LPB8_LRVW8_MIWT4_1_PLR1_SU0_SUM0_SUS64_VWA4_VWB1_WGM8_WGMXCC1_WGMXCCGn1
    SolutionIndex: 33
    SolutionNameMin: Cijk_Ailk_Bljk_B8NF8NS_BH_Bias_HAS_SAV_UserArgs_MT64x64x64_MI16x16x1_SN_LDSB0_CLR1_GRVWA8_GRVWB8_GSU0_GSUC0_GSUWGMRR0_K1_LBSPPA512_LBSPPB128_LPA32_LPB8_LRVW8_MIWT2_2_PLR1_SU0_SUM0_SUS64_VWA2_VWB2_WGM1_WGMXCC1_WGMXCCGn1
    SolutionIndex: 34
    SolutionNameMin: Cijk_Ailk_Bljk_B8NF8NS_BH_Bias_HAS_SAV_UserArgs_MT64x64x64_MI16x16x1_SN_LDSB0_CLR1_GRVWA8_GRVWB16_GSU0_GSUC0_GSUWGMRR0_K1_LBSPPA512_LBSPPB128_LPA32_LPB16_LRVW8_MIWT2_2_PLR1_SU0_SUM0_SUS64_VWA2_VWB2_WGM1_WGMXCC1_WGMXCCGn1
    SolutionIndex: 35
    SolutionNameMin: Cijk_Ailk_Bljk_B8NF8NS_BH_Bias_HAS_SAV_UserArgs_MT64x64x64_MI16x16x1_SN_LDSB0_CLR1_GRVWA8_GRVWB8_GSU0_GSUC0_GSUWGMRR0_K1_LBSPPA512_LBSPPB128_LPA32_LPB8_LRVW8_MIWT2_2_PLR1_SU0_SUM0_SUS64_VWA2_VWB2_WGM4_WGMXCC1_WGMXCCGn1
    SolutionIndex: 36
    SolutionNameMin: Cijk_Ailk_Bljk_B8NF8NS_BH_Bias_HAS_SAV_UserArgs_MT64x64x64_MI16x16x1_SN_LDSB0_CLR1_GRVWA16_GRVWB8_GSU0_GSUC0_GSUWGMRR0_K1_LBSPPA512_LBSPPB128_LPA32_LPB8_LRVW8_MIWT2_2_PLR1_SU0_SUM0_SUS64_VWA2_VWB2_WGM4_WGMXCC1_WGMXCCGn1
    SolutionIndex: 37
    SolutionNameMin: Cijk_Ailk_Bljk_B8NF8NS_BH_Bias_HAS_SAV_UserArgs_MT64x64x64_MI16x16x1_SN_LDSB0_CLR1_GRVWA16_GRVWB16_GSU0_GSUC0_GSUWGMRR0_K1_LBSPPA512_LBSPPB128_LPA32_LPB16_LRVW8_MIWT2_2_PLR1_SU0_SUM0_SUS64_VWA2_VWB2_WGM4_WGMXCC1_WGMXCCGn1
    SolutionIndex: 38
    SolutionNameMin: Cijk_Ailk_Bljk_B8NF8NS_BH_Bias_HAS_SAV_UserArgs_MT64x64x64_MI16x16x1_SN_LDSB0_CLR1_GRVWA8_GRVWB8_GSU0_GSUC0_GSUWGMRR0_K1_LBSPPA512_LBSPPB128_LPA32_LPB8_LRVW8_MIWT2_2_PLR1_SU0_SUM0_SUS64_VWA2_VWB2_WGM8_WGMXCC1_WGMXCCGn1
    SolutionIndex: 39
    SolutionNameMin: Cijk_Ailk_Bljk_B8NF8NS_BH_Bias_HAS_SAV_UserArgs_MT64x64x64_MI16x16x1_SN_LDSB0_CLR1_GRVWA16_GRVWB8_GSU0_GSUC0_GSUWGMRR0_K1_LBSPPA512_LBSPPB128_LPA32_LPB8_LRVW8_MIWT2_2_PLR1_SU0_SUM0_SUS64_VWA2_VWB2_WGM8_WGMXCC1_WGMXCCGn1
    SolutionIndex: 40
    SolutionNameMin: Cijk_Ailk_Bljk_B8NF8NS_BH_Bias_HAS_SAV_UserArgs_MT64x64x64_MI16x16x1_SN_LDSB0_CLR1_GRVWA8_GRVWB16_GSU0_GSUC0_GSUWGMRR0_K1_LBSPPA512_LBSPPB128_LPA32_LPB16_LRVW8_MIWT2_2_PLR1_SU0_SUM0_SUS64_VWA2_VWB2_WGM8_WGMXCC1_WGMXCCGn1
    SolutionIndex: 41
    SolutionNameMin: Cijk_Ailk_Bljk_B8NF8NS_BH_Bias_HAS_SAV_UserArgs_MT64x64x64_MI16x16x1_SN_LDSB0_CLR1_GRVWA16_GRVWB16_GSU0_GSUC0_GSUWGMRR0_K1_LBSPPA512_LBSPPB128_LPA32_LPB16_LRVW8_MIWT2_2_PLR1_SU0_SUM0_SUS64_VWA2_VWB2_WGM8_WGMXCC1_WGMXCCGn1
    SolutionIndex: 42
    SolutionNameMin: Cijk_Ailk_Bljk_B8NF8NS_BH_Bias_HAS_SAV_UserArgs_MT32x64x64_MI16x16x1_SN_LDSB0_CLR1_GRVWA8_GRVWB8_GSU0_GSUC0_GSUWGMRR0_K1_LBSPPA256_LBSPPB128_LPA16_LPB8_LRVW8_MIWT1_2_PLR1_SU0_SUM0_SUS64_VWA1_VWB2_WGM1_WGMXCC1_WGMXCCGn1
    SolutionIndex: 43
    SolutionNameMin: Cijk_Ailk_Bljk_B8NF8NS_BH_Bias_HAS_SAV_UserArgs_MT32x64x64_MI16x16x1_SN_LDSB0_CLR1_GRVWA8_GRVWB16_GSU0_GSUC0_GSUWGMRR0_K1_LBSPPA256_LBSPPB128_LPA16_LPB16_LRVW8_MIWT1_2_PLR1_SU0_SUM0_SUS64_VWA1_VWB2_WGM4_WGMXCC1_WGMXCCGn1
    SolutionIndex: 44
    SolutionNameMin: Cijk_Ailk_Bljk_B8NF8NS_BH_Bias_HAS_SAV_UserArgs_MT64x32x64_MI16x16x1_SN_LDSB0_CLR1_GRVWA8_GRVWB8_GSU0_GSUC0_GSUWGMRR0_K1_LBSPPA512_LBSPPB128_LPA32_LPB8_LRVW8_MIWT2_1_PLR1_SU0_SUM0_SUS64_VWA2_VWB1_WGM1_WGMXCC1_WGMXCCGn1
    SolutionIndex: 45
    SolutionNameMin: Cijk_Ailk_Bljk_B8NF8NS_BH_Bias_HAS_SAV_UserArgs_MT64x32x64_MI16x16x1_SN_LDSB0_CLR1_GRVWA16_GRVWB8_GSU0_GSUC0_GSUWGMRR0_K1_LBSPPA512_LBSPPB128_LPA32_LPB8_LRVW8_MIWT2_1_PLR1_SU0_SUM0_SUS64_VWA2_VWB1_WGM1_WGMXCC1_WGMXCCGn1
    SolutionIndex: 46
    SolutionNameMin: Cijk_Ailk_Bljk_B8NF8NS_BH_Bias_HAS_SAV_UserArgs_MT64x32x64_MI16x16x1_SN_LDSB0_CLR1_GRVWA8_GRVWB8_GSU0_GSUC0_GSUWGMRR0_K1_LBSPPA512_LBSPPB128_LPA32_LPB8_LRVW8_MIWT2_1_PLR1_SU0_SUM0_SUS64_VWA2_VWB1_WGM4_WGMXCC1_WGMXCCGn1
    SolutionIndex: 47
    SolutionNameMin: Cijk_Ailk_Bljk_B8NF8NS_BH_Bias_HAS_SAV_UserArgs_MT32x32x64_MI16x16x1_SN_LDSB0_CLR1_GRVWA8_GRVWB8_GSU0_GSUC0_GSUWGMRR0_K1_LBSPPA256_LBSPPB128_LPA16_LPB8_LRVW8_MIWT1_1_PLR1_SU0_SUM0_SUS64_VWA1_VWB1_WGM1_WGMXCC1_WGMXCCGn1
    SolutionIndex: 48
    SolutionNameMin: Cijk_Ailk_Bljk_B8NF8NS_BH_Bias_HAS_SAV_UserArgs_MT32x32x64_MI16x16x1_SN_LDSB0_CLR1_GRVWA8_GRVWB8_GSU0_GSUC0_GSUWGMRR0_K1_LBSPPA256_LBSPPB128_LPA16_LPB8_LRVW8_MIWT1_1_PLR1_SU0_SUM0_SUS64_VWA1_VWB1_WGM6_WGMXCC1_WGMXCCGn1
    SolutionIndex: 49
    SolutionNameMin: Cijk_Ailk_Bljk_B8NF8NS_BH_Bias_HAS_SAV_UserArgs_MT128x256x128_MI16x16x1_SN_LDSB1_CLR1_GRVWA16_GRVWB16_GSU0_GSUC0_GSUWGMRR0_K1_LBSPPA1024_LBSPPB1024_LPA64_LPB16_LRVW8_MIWT4_8_PLR1_SU0_SUM0_SUS128_VWA4_VWB8_WGM1_WGMXCC1_WGMXCCGn1
    SolutionIndex: 50
    SolutionNameMin: Cijk_Ailk_Bljk_B8NF8NS_BH_Bias_HAS_SAV_UserArgs_MT128x256x128_MI16x16x1_SN_LDSB1_CLR1_GRVWA8_GRVWB16_GSU0_GSUC0_GSUWGMRR0_K1_LBSPPA1024_LBSPPB1024_LPA64_LPB16_LRVW8_MIWT4_8_PLR1_SU0_SUM0_SUS128_VWA4_VWB8_WGM4_WGMXCC1_WGMXCCGn1
    SolutionIndex: 51
    SolutionNameMin: Cijk_Ailk_Bljk_B8NF8NS_BH_Bias_HAS_SAV_UserArgs_MT128x256x128_MI16x16x1_SN_LDSB1_CLR1_GRVWA16_GRVWB16_GSU0_GSUC0_GSUWGMRR0_K1_LBSPPA1024_LBSPPB1024_LPA64_LPB16_LRVW8_MIWT4_8_PLR1_SU0_SUM0_SUS128_VWA4_VWB8_WGM4_WGMXCC1_WGMXCCGn1
    SolutionIndex: 52
    SolutionNameMin: Cijk_Ailk_Bljk_B8NF8NS_BH_Bias_HAS_SAV_UserArgs_MT128x256x128_MI16x16x1_SN_LDSB1_CLR1_GRVWA16_GRVWB16_GSU0_GSUC0_GSUWGMRR0_K1_LBSPPA1024_LBSPPB1024_LPA64_LPB16_LRVW8_MIWT4_8_PLR1_SU0_SUM0_SUS128_VWA4_VWB8_WGM6_WGMXCC1_WGMXCCGn1
    SolutionIndex: 53
    SolutionNameMin: Cijk_Ailk_Bljk_B8NF8NS_BH_Bias_HAS_SAV_UserArgs_MT128x256x128_MI16x16x1_SN_LDSB1_CLR1_GRVWA16_GRVWB16_GSU0_GSUC0_GSUWGMRR0_K1_LBSPPA1024_LBSPPB1024_LPA64_LPB16_LRVW8_MIWT4_8_PLR1_SU0_SUM0_SUS128_VWA4_VWB8_WGM8_WGMXCC1_WGMXCCGn1
    SolutionIndex: 54
    SolutionNameMin: Cijk_Ailk_Bljk_B8NF8NS_BH_Bias_HAS_SAV_UserArgs_MT256x144x128_MI16x16x1_SN_LDSB1_CLR1_GRVWA8_GRVWB8_GSU0_GSUC0_GSUWGMRR0_K1_LBSPPA2048_LBSPPB128_LPA64_LPB8_LRVW8_MIWT4_9_PLR1_SU0_SUM0_SUS128_VWA4_VWB1_WGM1_WGMXCC1_WGMXCCGn1
    SolutionIndex: 55
    SolutionNameMin: Cijk_Ailk_Bljk_B8NF8NS_BH_Bias_HAS_SAV_UserArgs_MT256x144x128_MI16x16x1_SN_LDSB1_CLR1_GRVWA16_GRVWB8_GSU0_GSUC0_GSUWGMRR0_K1_LBSPPA2048_LBSPPB128_LPA64_LPB8_LRVW8_MIWT4_9_PLR1_SU0_SUM0_SUS128_VWA4_VWB1_WGM1_WGMXCC1_WGMXCCGn1
    SolutionIndex: 56
    SolutionNameMin: Cijk_Ailk_Bljk_B8NF8NS_BH_Bias_HAS_SAV_UserArgs_MT256x144x128_MI16x16x1_SN_LDSB1_CLR1_GRVWA16_GRVWB8_GSU0_GSUC0_GSUWGMRR0_K1_LBSPPA2048_LBSPPB128_LPA64_LPB8_LRVW8_MIWT4_9_PLR1_SU0_SUM0_SUS128_VWA4_VWB1_WGM4_WGMXCC1_WGMXCCGn1
    SolutionIndex: 57
    SolutionNameMin: Cijk_Ailk_Bljk_B8NF8NS_BH_Bias_HAS_SAV_UserArgs_MT256x144x128_MI16x16x1_SN_LDSB1_CLR1_GRVWA16_GRVWB8_GSU0_GSUC0_GSUWGMRR0_K1_LBSPPA2048_LBSPPB128_LPA64_LPB8_LRVW8_MIWT4_9_PLR1_SU0_SUM0_SUS128_VWA4_VWB1_WGM6_WGMXCC1_WGMXCCGn1
    SolutionIndex: 58
    SolutionNameMin: Cijk_Ailk_Bljk_B8NF8NS_BH_Bias_HAS_SAV_UserArgs_MT256x144x128_MI16x16x1_SN_LDSB1_CLR1_GRVWA16_GRVWB8_GSU0_GSUC0_GSUWGMRR0_K1_LBSPPA2048_LBSPPB128_LPA64_LPB8_LRVW8_MIWT4_9_PLR1_SU0_SUM0_SUS128_VWA4_VWB1_WGM8_WGMXCC1_WGMXCCGn1
    SolutionIndex: 59
    SolutionNameMin: Cijk_Ailk_Bljk_B8NF8NS_BH_Bias_HAS_SAV_UserArgs_MT256x128x128_MI16x16x1_SN_LDSB1_CLR1_GRVWA16_GRVWB8_GSU0_GSUC0_GSUWGMRR0_K1_LBSPPA2048_LBSPPB512_LPA0_LPB8_LRVW8_MIWT8_4_PLR1_SU0_SUM0_SUS128_VWA8_VWB4_WGM1_WGMXCC1_WGMXCCGn1
    SolutionIndex: 60
    SolutionNameMin: Cijk_Ailk_Bljk_B8NF8NS_BH_Bias_HAS_SAV_UserArgs_MT256x128x128_MI16x16x1_SN_LDSB1_CLR1_GRVWA16_GRVWB8_GSU0_GSUC0_GSUWGMRR0_K1_LBSPPA2048_LBSPPB512_LPA0_LPB8_LRVW8_MIWT8_4_PLR1_SU0_SUM0_SUS128_VWA8_VWB4_WGM4_WGMXCC1_WGMXCCGn1
    SolutionIndex: 61
    SolutionNameMin: Cijk_Ailk_Bljk_B8NF8NS_BH_Bias_HAS_SAV_UserArgs_MT256x128x128_MI16x16x1_SN_LDSB1_CLR1_GRVWA16_GRVWB8_GSU0_GSUC0_GSUWGMRR0_K1_LBSPPA2048_LBSPPB512_LPA0_LPB8_LRVW8_MIWT8_4_PLR1_SU0_SUM0_SUS128_VWA8_VWB4_WGM6_WGMXCC1_WGMXCCGn1
    SolutionIndex: 62
    SolutionNameMin: Cijk_Ailk_Bljk_B8NF8NS_BH_Bias_HAS_SAV_UserArgs_MT256x128x128_MI16x16x1_SN_LDSB1_CLR1_GRVWA16_GRVWB8_GSU0_GSUC0_GSUWGMRR0_K1_LBSPPA2048_LBSPPB512_LPA0_LPB8_LRVW8_MIWT8_4_PLR1_SU0_SUM0_SUS128_VWA8_VWB4_WGM8_WGMXCC1_WGMXCCGn1
    SolutionIndex: 63
    SolutionNameMin: Cijk_Ailk_Bljk_B8NF8NS_BH_Bias_HAS_SAV_UserArgs_MT128x144x128_MI16x16x1_SN_LDSB1_CLR1_GRVWA8_GRVWB8_GSU0_GSUC0_GSUWGMRR0_K1_LBSPPA1024_LBSPPB128_LPA32_LPB8_LRVW8_MIWT2_9_PLR1_SU0_SUM0_SUS128_VWA2_VWB1_WGM1_WGMXCC1_WGMXCCGn1
    SolutionIndex: 64
    SolutionNameMin: Cijk_Ailk_Bljk_B8NF8NS_BH_Bias_HAS_SAV_UserArgs_MT128x144x128_MI16x16x1_SN_LDSB1_CLR1_GRVWA16_GRVWB8_GSU0_GSUC0_GSUWGMRR0_K1_LBSPPA1024_LBSPPB128_LPA32_LPB8_LRVW8_MIWT2_9_PLR1_SU0_SUM0_SUS128_VWA2_VWB1_WGM1_WGMXCC1_WGMXCCGn1
    SolutionIndex: 65
    SolutionNameMin: Cijk_Ailk_Bljk_B8NF8NS_BH_Bias_HAS_SAV_UserArgs_MT128x144x128_MI16x16x1_SN_LDSB1_CLR1_GRVWA16_GRVWB8_GSU0_GSUC0_GSUWGMRR0_K1_LBSPPA1024_LBSPPB128_LPA32_LPB8_LRVW8_MIWT2_9_PLR1_SU0_SUM0_SUS128_VWA2_VWB1_WGM4_WGMXCC1_WGMXCCGn1
    SolutionIndex: 66
    SolutionNameMin: Cijk_Ailk_Bljk_B8NF8NS_BH_Bias_HAS_SAV_UserArgs_MT128x64x128_MI16x16x1_SN_LDSB1_CLR1_GRVWA8_GRVWB16_GSU0_GSUC0_GSUWGMRR0_K1_LBSPPA1024_LBSPPB128_LPA0_LPB16_LRVW8_MIWT8_1_PLR1_SU0_SUM0_SUS128_VWA8_VWB1_WGM1_WGMXCC1_WGMXCCGn1
    SolutionIndex: 67
    SolutionNameMin: Cijk_Ailk_Bljk_B8NF8NS_BH_Bias_HAS_SAV_UserArgs_MT128x128x128_MI16x16x1_SN_LDSB1_CLR1_GRVWA16_GRVWB16_GSU0_GSUC0_GSUWGMRR0_K1_LBSPPA1024_LBSPPB512_LPA64_LPB16_LRVW8_MIWT4_4_PLR1_SU0_SUM0_SUS128_VWA4_VWB4_WGM1_WGMXCC1_WGMXCCGn1
    SolutionIndex: 68
    SolutionNameMin: Cijk_Ailk_Bljk_B8NF8NS_BH_Bias_HAS_SAV_UserArgs_MT128x128x128_MI16x16x1_SN_LDSB1_CLR1_GRVWA16_GRVWB16_GSU0_GSUC0_GSUWGMRR0_K1_LBSPPA1024_LBSPPB512_LPA64_LPB16_LRVW8_MIWT4_4_PLR1_SU0_SUM0_SUS128_VWA4_VWB4_WGM4_WGMXCC1_WGMXCCGn1
    SolutionIndex: 69
    SolutionNameMin: Cijk_Ailk_Bljk_B8NF8NS_BH_Bias_HAS_SAV_UserArgs_MT128x128x128_MI16x16x1_SN_LDSB1_CLR1_GRVWA16_GRVWB16_GSU0_GSUC0_GSUWGMRR0_K1_LBSPPA1024_LBSPPB512_LPA64_LPB16_LRVW8_MIWT4_4_PLR1_SU0_SUM0_SUS128_VWA4_VWB4_WGM6_WGMXCC1_WGMXCCGn1
    SolutionIndex: 70
    SolutionNameMin: Cijk_Ailk_Bljk_B8NF8NS_BH_Bias_HAS_SAV_UserArgs_MT128x128x128_MI16x16x1_SN_LDSB1_CLR1_GRVWA16_GRVWB16_GSU0_GSUC0_GSUWGMRR0_K1_LBSPPA1024_LBSPPB512_LPA64_LPB16_LRVW8_MIWT4_4_PLR1_SU0_SUM0_SUS128_VWA4_VWB4_WGM8_WGMXCC1_WGMXCCGn1
    SolutionIndex: 71
    SolutionNameMin: Cijk_Ailk_Bljk_B8NF8NS_BH_Bias_HAS_SAV_UserArgs_MT64x128x128_MI16x16x1_SN_LDSB1_CLR1_GRVWA16_GRVWB16_GSU0_GSUC0_GSUWGMRR0_K1_LBSPPA512_LBSPPB512_LPA32_LPB16_LRVW8_MIWT2_4_PLR1_SU0_SUM0_SUS128_VWA2_VWB4_WGM1_WGMXCC1_WGMXCCGn1
    SolutionIndex: 72
    SolutionNameMin: Cijk_Ailk_Bljk_B8NF8NS_BH_Bias_HAS_SAV_UserArgs_MT64x128x128_MI16x16x1_SN_LDSB1_CLR1_GRVWA16_GRVWB16_GSU0_GSUC0_GSUWGMRR0_K1_LBSPPA512_LBSPPB512_LPA32_LPB16_LRVW8_MIWT2_4_PLR1_SU0_SUM0_SUS128_VWA2_VWB4_WGM6_WGMXCC1_WGMXCCGn1
    SolutionIndex: 73
    SolutionNameMin: Cijk_Ailk_Bljk_B8NF8NS_BH_Bias_HAS_SAV_UserArgs_MT64x128x128_MI16x16x1_SN_LDSB1_CLR1_GRVWA16_GRVWB16_GSU0_GSUC0_GSUWGMRR0_K1_LBSPPA512_LBSPPB512_LPA32_LPB16_LRVW8_MIWT2_4_PLR1_SU0_SUM0_SUS128_VWA2_VWB4_WGM8_WGMXCC1_WGMXCCGn1
    SolutionIndex: 74
    SolutionNameMin: Cijk_Ailk_Bljk_B8NF8NS_BH_Bias_HAS_SAV_UserArgs_MT128x64x128_MI16x16x1_SN_LDSB1_CLR1_GRVWA16_GRVWB16_GSU0_GSUC0_GSUWGMRR0_K1_LBSPPA1024_LBSPPB256_LPA64_LPB16_LRVW8_MIWT4_2_PLR1_SU0_SUM0_SUS128_VWA4_VWB2_WGM4_WGMXCC1_WGMXCCGn1
    SolutionIndex: 75
    SolutionNameMin: Cijk_Ailk_Bljk_B8NF8NS_BH_Bias_HAS_SAV_UserArgs_MT128x64x128_MI16x16x1_SN_LDSB1_CLR1_GRVWA16_GRVWB16_GSU0_GSUC0_GSUWGMRR0_K1_LBSPPA1024_LBSPPB256_LPA64_LPB16_LRVW8_MIWT4_2_PLR1_SU0_SUM0_SUS128_VWA4_VWB2_WGM6_WGMXCC1_WGMXCCGn1
    SolutionIndex: 76
    SolutionNameMin: Cijk_Ailk_Bljk_B8NF8NS_BH_Bias_HAS_SAV_UserArgs_MT128x64x128_MI16x16x1_SN_LDSB1_CLR1_GRVWA16_GRVWB16_GSU0_GSUC0_GSUWGMRR0_K1_LBSPPA1024_LBSPPB256_LPA64_LPB16_LRVW8_MIWT4_2_PLR1_SU0_SUM0_SUS128_VWA4_VWB2_WGM8_WGMXCC1_WGMXCCGn1
    SolutionIndex: 77
    SolutionNameMin: Cijk_Ailk_Bljk_B8NF8NS_BH_Bias_HAS_SAV_UserArgs_MT32x128x128_MI16x16x1_SN_LDSB1_CLR1_GRVWA8_GRVWB8_GSU0_GSUC0_GSUWGMRR0_K1_LBSPPA256_LBSPPB512_LPA16_LPB8_LRVW8_MIWT1_4_PLR1_SU0_SUM0_SUS128_VWA1_VWB4_WGM6_WGMXCC1_WGMXCCGn1
    SolutionIndex: 78
    SolutionNameMin: Cijk_Ailk_Bljk_B8NF8NS_BH_Bias_HAS_SAV_UserArgs_MT128x32x128_MI16x16x1_SN_LDSB1_CLR1_GRVWA16_GRVWB8_GSU0_GSUC0_GSUWGMRR0_K1_LBSPPA1024_LBSPPB128_LPA64_LPB8_LRVW8_MIWT4_1_PLR1_SU0_SUM0_SUS128_VWA4_VWB1_WGM1_WGMXCC1_WGMXCCGn1
    SolutionIndex: 79
    SolutionNameMin: Cijk_Ailk_Bljk_B8NF8NS_BH_Bias_HAS_SAV_UserArgs_MT128x32x128_MI16x16x1_SN_LDSB1_CLR1_GRVWA16_GRVWB16_GSU0_GSUC0_GSUWGMRR0_K1_LBSPPA1024_LBSPPB128_LPA64_LPB16_LRVW8_MIWT4_1_PLR1_SU0_SUM0_SUS128_VWA4_VWB1_WGM4_WGMXCC1_WGMXCCGn1
    SolutionIndex: 80
    SolutionNameMin: Cijk_Ailk_Bljk_B8NF8NS_BH_Bias_HAS_SAV_UserArgs_MT64x64x128_MI16x16x1_SN_LDSB1_CLR1_GRVWA16_GRVWB8_GSU0_GSUC0_GSUWGMRR0_K1_LBSPPA512_LBSPPB256_LPA32_LPB8_LRVW8_MIWT2_2_PLR1_SU0_SUM0_SUS128_VWA2_VWB2_WGM1_WGMXCC1_WGMXCCGn1
    SolutionIndex: 81
    SolutionNameMin: Cijk_Ailk_Bljk_B8NF8NS_BH_Bias_HAS_SAV_UserArgs_MT64x64x128_MI16x16x1_SN_LDSB1_CLR1_GRVWA8_GRVWB16_GSU0_GSUC0_GSUWGMRR0_K1_LBSPPA512_LBSPPB256_LPA32_LPB16_LRVW8_MIWT2_2_PLR1_SU0_SUM0_SUS128_VWA2_VWB2_WGM1_WGMXCC1_WGMXCCGn1
    SolutionIndex: 82
    SolutionNameMin: Cijk_Ailk_Bljk_B8NF8NS_BH_Bias_HAS_SAV_UserArgs_MT64x64x128_MI16x16x1_SN_LDSB1_CLR1_GRVWA16_GRVWB16_GSU0_GSUC0_GSUWGMRR0_K1_LBSPPA512_LBSPPB256_LPA32_LPB16_LRVW8_MIWT2_2_PLR1_SU0_SUM0_SUS128_VWA2_VWB2_WGM1_WGMXCC1_WGMXCCGn1
    SolutionIndex: 83
    SolutionNameMin: Cijk_Ailk_Bljk_B8NF8NS_BH_Bias_HAS_SAV_UserArgs_MT64x64x128_MI16x16x1_SN_LDSB1_CLR1_GRVWA16_GRVWB16_GSU0_GSUC0_GSUWGMRR0_K1_LBSPPA512_LBSPPB256_LPA32_LPB16_LRVW8_MIWT2_2_PLR1_SU0_SUM0_SUS128_VWA2_VWB2_WGM4_WGMXCC1_WGMXCCGn1
    SolutionIndex: 84
    SolutionNameMin: Cijk_Ailk_Bljk_B8NF8NS_BH_Bias_HAS_SAV_UserArgs_MT64x64x128_MI16x16x1_SN_LDSB1_CLR1_GRVWA16_GRVWB16_GSU0_GSUC0_GSUWGMRR0_K1_LBSPPA512_LBSPPB256_LPA32_LPB16_LRVW8_MIWT2_2_PLR1_SU0_SUM0_SUS128_VWA2_VWB2_WGM6_WGMXCC1_WGMXCCGn1
    SolutionIndex: 85
    SolutionNameMin: Cijk_Ailk_Bljk_B8NF8NS_BH_Bias_HAS_SAV_UserArgs_MT64x64x128_MI16x16x1_SN_LDSB1_CLR1_GRVWA16_GRVWB16_GSU0_GSUC0_GSUWGMRR0_K1_LBSPPA512_LBSPPB256_LPA32_LPB16_LRVW8_MIWT2_2_PLR1_SU0_SUM0_SUS128_VWA2_VWB2_WGM8_WGMXCC1_WGMXCCGn1
    SolutionIndex: 86
    SolutionNameMin: Cijk_Ailk_Bljk_B8NF8NS_BH_Bias_HAS_SAV_UserArgs_MT32x64x128_MI16x16x1_SN_LDSB0_CLR1_GRVWA8_GRVWB16_GSU0_GSUC0_GSUWGMRR0_K1_LBSPPA256_LBSPPB256_LPA16_LPB16_LRVW8_MIWT1_2_PLR1_SU0_SUM0_SUS128_VWA1_VWB2_WGM1_WGMXCC1_WGMXCCGn1
    SolutionIndex: 87
    SolutionNameMin: Cijk_Ailk_Bljk_B8NF8NS_BH_Bias_HAS_SAV_UserArgs_MT32x64x128_MI16x16x1_SN_LDSB0_CLR1_GRVWA8_GRVWB16_GSU0_GSUC0_GSUWGMRR0_K1_LBSPPA256_LBSPPB256_LPA16_LPB16_LRVW8_MIWT1_2_PLR1_SU0_SUM0_SUS128_VWA1_VWB2_WGM4_WGMXCC1_WGMXCCGn1
    SolutionIndex: 88
    SolutionNameMin: Cijk_Ailk_Bljk_B8NF8NS_BH_Bias_HAS_SAV_UserArgs_MT64x32x128_MI16x16x1_SN_LDSB0_CLR1_GRVWA8_GRVWB8_GSU0_GSUC0_GSUWGMRR0_K1_LBSPPA512_LBSPPB128_LPA32_LPB8_LRVW8_MIWT2_1_PLR1_SU0_SUM0_SUS128_VWA2_VWB1_WGM1_WGMXCC1_WGMXCCGn1
    SolutionIndex: 89
    SolutionNameMin: Cijk_Ailk_Bljk_B8NF8NS_BH_Bias_HAS_SAV_UserArgs_MT64x32x128_MI16x16x1_SN_LDSB0_CLR1_GRVWA8_GRVWB16_GSU0_GSUC0_GSUWGMRR0_K1_LBSPPA512_LBSPPB128_LPA32_LPB16_LRVW8_MIWT2_1_PLR1_SU0_SUM0_SUS128_VWA2_VWB1_WGM1_WGMXCC1_WGMXCCGn1
    SolutionIndex: 90
    SolutionNameMin: Cijk_Ailk_Bljk_B8NF8NS_BH_Bias_HAS_SAV_UserArgs_MT64x32x128_MI16x16x1_SN_LDSB0_CLR1_GRVWA16_GRVWB16_GSU0_GSUC0_GSUWGMRR0_K1_LBSPPA512_LBSPPB128_LPA32_LPB16_LRVW8_MIWT2_1_PLR1_SU0_SUM0_SUS128_VWA2_VWB1_WGM1_WGMXCC1_WGMXCCGn1
    SolutionIndex: 91
    SolutionNameMin: Cijk_Ailk_Bljk_B8NF8NS_BH_Bias_HAS_SAV_UserArgs_MT64x32x128_MI16x16x1_SN_LDSB0_CLR1_GRVWA8_GRVWB8_GSU0_GSUC0_GSUWGMRR0_K1_LBSPPA512_LBSPPB128_LPA32_LPB8_LRVW8_MIWT2_1_PLR1_SU0_SUM0_SUS128_VWA2_VWB1_WGM6_WGMXCC1_WGMXCCGn1
    SolutionIndex: 92
    SolutionNameMin: Cijk_Ailk_Bljk_B8NF8NS_BH_Bias_HAS_SAV_UserArgs_MT64x32x128_MI16x16x1_SN_LDSB0_CLR1_GRVWA8_GRVWB16_GSU0_GSUC0_GSUWGMRR0_K1_LBSPPA512_LBSPPB128_LPA32_LPB16_LRVW8_MIWT2_1_PLR1_SU0_SUM0_SUS128_VWA2_VWB1_WGM8_WGMXCC1_WGMXCCGn1
    SolutionIndex: 93
    SolutionNameMin: Cijk_Ailk_Bljk_B8NF8NS_BH_Bias_HAS_SAV_UserArgs_MT32x32x128_MI16x16x1_SN_LDSB0_CLR1_GRVWA8_GRVWB8_GSU0_GSUC0_GSUWGMRR0_K1_LBSPPA256_LBSPPB128_LPA16_LPB8_LRVW8_MIWT1_1_PLR1_SU0_SUM0_SUS128_VWA1_VWB1_WGM1_WGMXCC1_WGMXCCGn1
    SolutionIndex: 94
    SolutionNameMin: Cijk_Ailk_Bljk_B8NF8NS_BH_Bias_HAS_SAV_UserArgs_MT32x32x128_MI16x16x1_SN_LDSB0_CLR1_GRVWA16_GRVWB8_GSU0_GSUC0_GSUWGMRR0_K1_LBSPPA256_LBSPPB128_LPA16_LPB8_LRVW8_MIWT1_1_PLR1_SU0_SUM0_SUS128_VWA1_VWB1_WGM1_WGMXCC1_WGMXCCGn1
    SolutionIndex: 95
    SolutionNameMin: Cijk_Ailk_Bljk_B8NF8NS_BH_Bias_HAS_SAV_UserArgs_MT32x32x128_MI16x16x1_SN_LDSB0_CLR1_GRVWA8_GRVWB16_GSU0_GSUC0_GSUWGMRR0_K1_LBSPPA256_LBSPPB128_LPA16_LPB16_LRVW8_MIWT1_1_PLR1_SU0_SUM0_SUS128_VWA1_VWB1_WGM1_WGMXCC1_WGMXCCGn1
    SolutionIndex: 96
    SolutionNameMin: Cijk_Ailk_Bljk_B8NF8NS_BH_Bias_HAS_SAV_UserArgs_MT32x32x128_MI16x16x1_SN_LDSB0_CLR1_GRVWA16_GRVWB16_GSU0_GSUC0_GSUWGMRR0_K1_LBSPPA256_LBSPPB128_LPA16_LPB16_LRVW8_MIWT1_1_PLR1_SU0_SUM0_SUS128_VWA1_VWB1_WGM1_WGMXCC1_WGMXCCGn1
    SolutionIndex: 97
    SolutionNameMin: Cijk_Ailk_Bljk_B8NF8NS_BH_Bias_HAS_SAV_UserArgs_MT32x32x128_MI16x16x1_SN_LDSB0_CLR1_GRVWA8_GRVWB8_GSU0_GSUC0_GSUWGMRR0_K1_LBSPPA256_LBSPPB128_LPA16_LPB8_LRVW8_MIWT1_1_PLR1_SU0_SUM0_SUS128_VWA1_VWB1_WGM6_WGMXCC1_WGMXCCGn1
    SolutionIndex: 98
    SolutionNameMin: Cijk_Ailk_Bljk_B8NF8NS_BH_Bias_HAS_SAV_UserArgs_MT32x32x128_MI16x16x1_SN_LDSB0_CLR1_GRVWA16_GRVWB8_GSU0_GSUC0_GSUWGMRR0_K1_LBSPPA256_LBSPPB128_LPA16_LPB8_LRVW8_MIWT1_1_PLR1_SU0_SUM0_SUS128_VWA1_VWB1_WGM6_WGMXCC1_WGMXCCGn1
    SolutionIndex: 99
    SolutionNameMin: Cijk_Ailk_Bljk_B8NF8NS_BH_Bias_HAS_SAV_UserArgs_MT32x32x128_MI16x16x1_SN_LDSB0_CLR1_GRVWA16_GRVWB16_GSU0_GSUC0_GSUWGMRR0_K1_LBSPPA256_LBSPPB128_LPA16_LPB16_LRVW8_MIWT1_1_PLR1_SU0_SUM0_SUS128_VWA1_VWB1_WGM6_WGMXCC1_WGMXCCGn1
    SolutionIndex: 100
    SolutionNameMin: Cijk_Ailk_Bljk_B8NF8NS_BH_Bias_HAS_SAV_UserArgs_MT128x64x256_MI16x16x1_SN_LDSB1_CLR1_GRVWA16_GRVWB16_GSU0_GSUC0_GSUWGMRR0_K1_LBSPPA1024_LBSPPB512_LPA64_LPB16_LRVW8_MIWT4_2_PLR1_SU0_SUM0_SUS256_VWA4_VWB2_WGM1_WGMXCC1_WGMXCCGn1
    SolutionIndex: 101
    SolutionNameMin: Cijk_Ailk_Bljk_B8NF8NS_BH_Bias_HAS_SAV_UserArgs_MT64x64x256_MI16x16x1_SN_LDSB1_CLR1_GRVWA16_GRVWB16_GSU0_GSUC0_GSUWGMRR0_K1_LBSPPA512_LBSPPB512_LPA32_LPB16_LRVW8_MIWT2_2_PLR1_SU0_SUM0_SUS256_VWA2_VWB2_WGM1_WGMXCC1_WGMXCCGn1
    SolutionIndex: 102
    SolutionNameMin: Cijk_Ailk_Bljk_B8NF8NS_BH_Bias_HAS_SAV_UserArgs_MT64x64x256_MI16x16x1_SN_LDSB1_CLR1_GRVWA16_GRVWB16_GSU0_GSUC0_GSUWGMRR0_K1_LBSPPA512_LBSPPB512_LPA32_LPB16_LRVW8_MIWT2_2_PLR1_SU0_SUM0_SUS256_VWA2_VWB2_WGM8_WGMXCC1_WGMXCCGn1
    SolutionIndex: 103
    SolutionNameMin: Cijk_Ailk_Bljk_B8NF8NS_BH_Bias_HAS_SAV_UserArgs_MT64x32x256_MI16x16x1_SN_LDSB1_CLR1_GRVWA16_GRVWB16_GSU0_GSUC0_GSUWGMRR0_K1_LBSPPA512_LBSPPB256_LPA32_LPB16_LRVW8_MIWT2_1_PLR1_SU0_SUM0_SUS256_VWA2_VWB1_WGM1_WGMXCC1_WGMXCCGn1
    SolutionIndex: 104
    SolutionNameMin: Cijk_Ailk_Bljk_B8NF8NS_BH_Bias_HAS_SAV_UserArgs_MT64x32x256_MI16x16x1_SN_LDSB1_CLR1_GRVWA16_GRVWB16_GSU0_GSUC0_GSUWGMRR0_K1_LBSPPA512_LBSPPB256_LPA32_LPB16_LRVW8_MIWT2_1_PLR1_SU0_SUM0_SUS256_VWA2_VWB1_WGM4_WGMXCC1_WGMXCCGn1
    SolutionIndex: 105
    SolutionNameMin: Cijk_Ailk_Bljk_B8NF8NS_BH_Bias_HAS_SAV_UserArgs_MT64x32x256_MI16x16x1_SN_LDSB1_CLR1_GRVWA16_GRVWB16_GSU0_GSUC0_GSUWGMRR0_K1_LBSPPA512_LBSPPB256_LPA32_LPB16_LRVW8_MIWT2_1_PLR1_SU0_SUM0_SUS256_VWA2_VWB1_WGM8_WGMXCC1_WGMXCCGn1
    SolutionIndex: 106
    SolutionNameMin: Cijk_Ailk_Bljk_B8NF8NS_BH_Bias_HAS_SAV_UserArgs_MT32x32x256_MI16x16x1_SN_LDSB1_CLR1_GRVWA8_GRVWB16_GSU0_GSUC0_GSUWGMRR0_K1_LBSPPA256_LBSPPB256_LPA16_LPB16_LRVW8_MIWT1_1_PLR1_SU0_SUM0_SUS256_VWA1_VWB1_WGM6_WGMXCC1_WGMXCCGn1
    SolutionIndex: 107
    SolutionNameMin: Cijk_Ailk_Bljk_B8NF8NS_BH_Bias_HAS_SAV_UserArgs_MT32x32x256_MI16x16x1_SN_LDSB1_CLR1_GRVWA16_GRVWB16_GSU0_GSUC0_GSUWGMRR0_K1_LBSPPA256_LBSPPB256_LPA16_LPB16_LRVW8_MIWT1_1_PLR1_SU0_SUM0_SUS256_VWA1_VWB1_WGM6_WGMXCC1_WGMXCCGn1
    SolutionIndex: 108
    SolutionNameMin: Cijk_Ailk_Bljk_B8NF8NS_BH_Bias_HAS_SAV_UserArgs_MT32x32x256_MI16x16x1_SN_LDSB1_CLR1_GRVWA16_GRVWB16_GSU0_GSUC0_GSUWGMRR0_K1_LBSPPA256_LBSPPB256_LPA16_LPB16_LRVW8_MIWT1_1_PLR1_SU0_SUM0_SUS256_VWA1_VWB1_WGM8_WGMXCC1_WGMXCCGn1
- - - [128, 128, 1, 128, 128, 128, 128, 128]
    - [94, 0.49]
  - - [128, 128, 1, 256, 128, 128, 128, 256]
    - [95, 0.99]
  - - [128, 128, 1, 512, 128, 128, 128, 512]
    - [95, 1.73]
  - - [128, 128, 1, 1024, 128, 128, 128, 1024]
    - [96, 2.74]
  - - [128, 128, 1, 2048, 128, 128, 128, 2048]
    - [93, 3.84]
  - - [128, 128, 1, 4096, 128, 128, 128, 4096]
    - [93, 4.79]
  - - [128, 128, 1, 8192, 128, 128, 128, 8192]
    - [93, 5.47]
  - - [128, 256, 1, 128, 128, 128, 128, 128]
    - [47, 1.12]
  - - [128, 256, 1, 256, 128, 128, 128, 256]
    - [93, 2.04]
  - - [128, 256, 1, 512, 128, 128, 128, 512]
    - [93, 3.53]
  - - [128, 256, 1, 1024, 128, 128, 128, 1024]
    - [93, 5.52]
  - - [128, 256, 1, 2048, 128, 128, 128, 2048]
    - [93, 7.69]
  - - [128, 256, 1, 4096, 128, 128, 128, 4096]
    - [93, 9.63]
  - - [128, 256, 1, 8192, 128, 128, 128, 8192]
    - [93, 10.97]
  - - [128, 512, 1, 128, 128, 128, 128, 128]
    - [93, 2.16]
  - - [128, 512, 1, 256, 128, 128, 128, 256]
    - [93, 3.97]
  - - [128, 512, 1, 512, 128, 128, 128, 512]
    - [95, 6.86]
  - - [128, 512, 1, 1024, 128, 128, 128, 1024]
    - [93, 10.83]
  - - [128, 512, 1, 2048, 128, 128, 128, 2048]
    - [93, 15.25]
  - - [128, 512, 1, 4096, 128, 128, 128, 4096]
    - [93, 19.07]
  - - [128, 512, 1, 8192, 128, 128, 128, 8192]
    - [93, 21.77]
  - - [128, 1024, 1, 128, 128, 128, 128, 128]
    - [93, 4.36]
  - - [128, 1024, 1, 256, 128, 128, 128, 256]
    - [94, 7.65]
  - - [128, 1024, 1, 512, 128, 128, 128, 512]
    - [93, 13.72]
  - - [128, 1024, 1, 1024, 128, 128, 128, 1024]
    - [93, 21.61]
  - - [128, 1024, 1, 2048, 128, 128, 128, 2048]
    - [93, 29.88]
  - - [128, 1024, 1, 4096, 128, 128, 128, 4096]
    - [93, 37.63]
  - - [128, 1024, 1, 8192, 128, 128, 128, 8192]
    - [93, 42.86]
  - - [128, 2048, 1, 128, 128, 128, 128, 128]
    - [44, 8.26]
  - - [128, 2048, 1, 256, 128, 128, 128, 256]
    - [88, 14.69]
  - - [128, 2048, 1, 512, 128, 128, 128, 512]
    - [89, 24.53]
  - - [128, 2048, 1, 1024, 128, 128, 128, 1024]
    - [86, 37.48]
  - - [128, 2048, 1, 2048, 128, 128, 128, 2048]
    - [103, 51.58]
  - - [128, 2048, 1, 4096, 128, 128, 128, 4096]
    - [103, 63.79]
  - - [128, 2048, 1, 8192, 128, 128, 128, 8192]
    - [103, 72.44]
  - - [128, 4096, 1, 128, 128, 128, 128, 128]
    - [33, 14.99]
  - - [128, 4096, 1, 256, 128, 128, 128, 256]
    - [33, 26.13]
  - - [128, 4096, 1, 512, 128, 128, 128, 512]
    - [33, 42.97]
  - - [128, 4096, 1, 1024, 128, 128, 128, 1024]
    - [80, 63.69]
  - - [128, 4096, 1, 2048, 128, 128, 128, 2048]
    - [80, 84.89]
  - - [128, 4096, 1, 4096, 128, 128, 128, 4096]
    - [101, 102.49]
  - - [128, 4096, 1, 8192, 128, 128, 128, 8192]
    - [102, 112.49]
  - - [128, 8192, 1, 128, 128, 128, 128, 128]
    - [27, 26.07]
  - - [128, 8192, 1, 256, 128, 128, 128, 256]
    - [28, 44.83]
  - - [128, 8192, 1, 512, 128, 128, 128, 512]
    - [25, 71.55]
  - - [128, 8192, 1, 1024, 128, 128, 128, 1024]
    - [24, 103.78]
  - - [128, 8192, 1, 2048, 128, 128, 128, 2048]
    - [24, 133.38]
  - - [128, 8192, 1, 4096, 128, 128, 128, 4096]
    - [71, 144.57]
  - - [128, 8192, 1, 8192, 128, 128, 128, 8192]
    - [72, 154.94]
  - - [256, 128, 1, 128, 256, 256, 256, 128]
    - [46, 0.69]
  - - [256, 128, 1, 256, 256, 256, 256, 256]
    - [38, 1.54]
  - - [256, 128, 1, 512, 256, 256, 256, 512]
    - [91, 2.69]
  - - [256, 128, 1, 1024, 256, 256, 256, 1024]
    - [98, 4.89]
  - - [256, 128, 1, 2048, 256, 256, 256, 2048]
    - [95, 7.57]
  - - [256, 128, 1, 4096, 256, 256, 256, 4096]
    - [93, 9.53]
  - - [256, 128, 1, 8192, 256, 256, 256, 8192]
    - [93, 10.87]
  - - [256, 256, 1, 128, 256, 256, 256, 128]
    - [45, 1.31]
  - - [256, 256, 1, 256, 256, 256, 256, 256]
    - [77, 2.87]
  - - [256, 256, 1, 512, 256, 256, 256, 512]
    - [36, 5.14]
  - - [256, 256, 1, 1024, 256, 256, 256, 1024]
    - [99, 10.05]
  - - [256, 256, 1, 2048, 256, 256, 256, 2048]
    - [95, 15.03]
  - - [256, 256, 1, 4096, 256, 256, 256, 4096]
    - [93, 18.97]
  - - [256, 256, 1, 8192, 256, 256, 256, 8192]
    - [93, 21.74]
  - - [256, 512, 1, 128, 256, 256, 256, 128]
    - [26, 2.87]
  - - [256, 512, 1, 256, 256, 256, 256, 256]
    - [79, 5.62]
  - - [256, 512, 1, 512, 256, 256, 256, 512]
    - [47, 12.06]
  - - [256, 512, 1, 1024, 256, 256, 256, 1024]
    - [96, 20.74]
  - - [256, 512, 1, 2048, 256, 256, 256, 2048]
    - [93, 29.83]
  - - [256, 512, 1, 4096, 256, 256, 256, 4096]
    - [93, 37.32]
  - - [256, 512, 1, 8192, 256, 256, 256, 8192]
    - [96, 42.68]
  - - [256, 1024, 1, 128, 256, 256, 256, 128]
    - [20, 6.39]
  - - [256, 1024, 1, 256, 256, 256, 256, 256]
    - [42, 11.75]
  - - [256, 1024, 1, 512, 256, 256, 256, 512]
    - [43, 22.49]
  - - [256, 1024, 1, 1024, 256, 256, 256, 1024]
    - [92, 36.56]
  - - [256, 1024, 1, 2048, 256, 256, 256, 2048]
    - [103, 50.92]
  - - [256, 1024, 1, 4096, 256, 256, 256, 4096]
    - [103, 63.2]
  - - [256, 1024, 1, 8192, 256, 256, 256, 8192]
    - [103, 72.35]
  - - [256, 2048, 1, 128, 256, 256, 256, 128]
    - [41, 11.11]
  - - [256, 2048, 1, 256, 256, 256, 256, 256]
    - [36, 24.7]
  - - [256, 2048, 1, 512, 256, 256, 256, 512]
    - [37, 41.12]
  - - [256, 2048, 1, 1024, 256, 256, 256, 1024]
    - [80, 63.47]
  - - [256, 2048, 1, 2048, 256, 256, 256, 2048]
    - [80, 84.4]
  - - [256, 2048, 1, 4096, 256, 256, 256, 4096]
    - [101, 101.77]
  - - [256, 2048, 1, 8192, 256, 256, 256, 8192]
    - [103, 110.7]
  - - [256, 4096, 1, 128, 256, 256, 256, 128]
    - [66, 22.69]
  - - [256, 4096, 1, 256, 256, 256, 256, 256]
    - [26, 43.06]
  - - [256, 4096, 1, 512, 256, 256, 256, 512]
    - [27, 70.85]
  - - [256, 4096, 1, 1024, 256, 256, 256, 1024]
    - [24, 103.28]
  - - [256, 4096, 1, 2048, 256, 256, 256, 2048]
    - [24, 133.14]
  - - [256, 4096, 1, 4096, 256, 256, 256, 4096]
    - [71, 145.81]
  - - [256, 4096, 1, 8192, 256, 256, 256, 8192]
    - [71, 156.74]
  - - [256, 8192, 1, 128, 256, 256, 256, 128]
    - [23, 40.2]
  - - [256, 8192, 1, 256, 256, 256, 256, 256]
    - [22, 69.92]
  - - [256, 8192, 1, 512, 256, 256, 256, 512]
    - [67, 111.71]
  - - [256, 8192, 1, 1024, 256, 256, 256, 1024]
    - [67, 160.04]
  - - [256, 8192, 1, 2048, 256, 256, 256, 2048]
    - [67, 200.87]
  - - [256, 8192, 1, 4096, 256, 256, 256, 4096]
    - [67, 222.88]
  - - [256, 8192, 1, 8192, 256, 256, 256, 8192]
    - [67, 226.55]
  - - [512, 128, 1, 128, 512, 512, 512, 128]
    - [73, 1.4]
  - - [512, 128, 1, 256, 512, 512, 512, 256]
    - [39, 2.8]
  - - [512, 128, 1, 512, 512, 512, 512, 512]
    - [40, 5.17]
  - - [512, 128, 1, 1024, 512, 512, 512, 1024]
    - [48, 9.74]
  - - [512, 128, 1, 2048, 512, 512, 512, 2048]
    - [97, 14.81]
  - - [512, 128, 1, 4096, 512, 512, 512, 4096]
    - [95, 18.71]
  - - [512, 128, 1, 8192, 512, 512, 512, 8192]
    - [108, 17.07]
  - - [512, 256, 1, 128, 512, 512, 512, 128]
    - [29, 2.54]
  - - [512, 256, 1, 256, 512, 512, 512, 256]
    - [43, 5.22]
  - - [512, 256, 1, 512, 512, 512, 512, 512]
    - [35, 10.46]
  - - [512, 256, 1, 1024, 512, 512, 512, 1024]
    - [87, 17.06]
  - - [512, 256, 1, 2048, 512, 512, 512, 2048]
    - [96, 29.46]
  - - [512, 256, 1, 4096, 512, 512, 512, 4096]
    - [93, 37.17]
  - - [512, 256, 1, 8192, 512, 512, 512, 8192]
    - [108, 37.15]
  - - [512, 512, 1, 128, 512, 512, 512, 128]
    - [19, 5.28]
  - - [512, 512, 1, 256, 512, 512, 512, 256]
    - [96, 9.92]
  - - [512, 512, 1, 512, 512, 512, 512, 512]
    - [32, 19.94]
  - - [512, 512, 1, 1024, 512, 512, 512, 1024]
    - [86, 36.37]
  - - [512, 512, 1, 2048, 512, 512, 512, 2048]
    - [103, 50.67]
  - - [512, 512, 1, 4096, 512, 512, 512, 4096]
    - [103, 63.21]
  - - [512, 512, 1, 8192, 512, 512, 512, 8192]
    - [90, 62.25]
  - - [512, 1024, 1, 128, 512, 512, 512, 128]
    - [78, 14.94]
  - - [512, 1024, 1, 256, 512, 512, 512, 256]
    - [34, 26.21]
  - - [512, 1024, 1, 512, 512, 512, 512, 512]
    - [81, 42.56]
  - - [512, 1024, 1, 1024, 512, 512, 512, 1024]
    - [80, 63.47]
  - - [512, 1024, 1, 2048, 512, 512, 512, 2048]
    - [80, 83.79]
  - - [512, 1024, 1, 4096, 512, 512, 512, 4096]
    - [80, 100.55]
  - - [512, 1024, 1, 8192, 512, 512, 512, 8192]
    - [82, 104.23]
  - - [512, 2048, 1, 128, 512, 512, 512, 128]
    - [27, 26.34]
  - - [512, 2048, 1, 256, 512, 512, 512, 256]
    - [28, 44.9]
  - - [512, 2048, 1, 512, 512, 512, 512, 512]
    - [25, 72.04]
  - - [512, 2048, 1, 1024, 512, 512, 512, 1024]
    - [24, 103.99]
  - - [512, 2048, 1, 2048, 512, 512, 512, 2048]
    - [24, 133.59]
  - - [512, 2048, 1, 4096, 512, 512, 512, 4096]
    - [100, 146.24]
  - - [512, 2048, 1, 8192, 512, 512, 512, 8192]
    - [76, 148.33]
  - - [512, 4096, 1, 128, 512, 512, 512, 128]
    - [21, 42.27]
  - - [512, 4096, 1, 256, 512, 512, 512, 256]
    - [21, 71.56]
  - - [512, 4096, 1, 512, 512, 512, 512, 512]
    - [67, 114.06]
  - - [512, 4096, 1, 1024, 512, 512, 512, 1024]
    - [67, 162.07]
  - - [512, 4096, 1, 2048, 512, 512, 512, 2048]
    - [67, 203.92]
  - - [512, 4096, 1, 4096, 512, 512, 512, 4096]
    - [67, 211.85]
  - - [512, 4096, 1, 8192, 512, 512, 512, 8192]
    - [69, 203.36]
  - - [512, 8192, 1, 128, 512, 512, 512, 128]
    - [63, 63.37]
  - - [512, 8192, 1, 256, 512, 512, 512, 256]
    - [64, 109.3]
  - - [512, 8192, 1, 512, 512, 512, 512, 512]
    - [64, 173.96]
  - - [512, 8192, 1, 1024, 512, 512, 512, 1024]
    - [65, 239.57]
  - - [512, 8192, 1, 2048, 512, 512, 512, 2048]
    - [59, 248.69]
  - - [512, 8192, 1, 4096, 512, 512, 512, 4096]
    - [59, 265.07]
  - - [512, 8192, 1, 8192, 512, 512, 512, 8192]
    - [64, 252.72]
  - - [1024, 128, 1, 128, 1024, 1024, 1024, 128]
    - [47, 4.3]
  - - [1024, 128, 1, 256, 1024, 1024, 1024, 256]
    - [95, 7.82]
  - - [1024, 128, 1, 512, 1024, 1024, 1024, 512]
    - [95, 13.29]
  - - [1024, 128, 1, 1024, 1024, 1024, 1024, 1024]
    - [93, 20.86]
  - - [1024, 128, 1, 2048, 1024, 1024, 1024, 2048]
    - [93, 29.62]
  - - [1024, 128, 1, 4096, 1024, 1024, 1024, 4096]
    - [107, 30.48]
  - - [1024, 128, 1, 8192, 1024, 1024, 1024, 8192]
    - [106, 30.29]
  - - [1024, 256, 1, 128, 1024, 1024, 1024, 128]
    - [89, 8.1]
  - - [1024, 256, 1, 256, 1024, 1024, 1024, 256]
    - [89, 14.44]
  - - [1024, 256, 1, 512, 1024, 1024, 1024, 512]
    - [89, 24.41]
  - - [1024, 256, 1, 1024, 1024, 1024, 1024, 1024]
    - [89, 37.36]
  - - [1024, 256, 1, 2048, 1024, 1024, 1024, 2048]
    - [103, 51.18]
  - - [1024, 256, 1, 4096, 1024, 1024, 1024, 4096]
    - [87, 54.86]
  - - [1024, 256, 1, 8192, 1024, 1024, 1024, 8192]
    - [92, 58.81]
  - - [1024, 512, 1, 128, 1024, 1024, 1024, 128]
    - [30, 14.65]
  - - [1024, 512, 1, 256, 1024, 1024, 1024, 256]
    - [33, 26.08]
  - - [1024, 512, 1, 512, 1024, 1024, 1024, 512]
    - [33, 42.1]
  - - [1024, 512, 1, 1024, 1024, 1024, 1024, 1024]
    - [80, 63.51]
  - - [1024, 512, 1, 2048, 1024, 1024, 1024, 2048]
    - [80, 84.18]
  - - [1024, 512, 1, 4096, 1024, 1024, 1024, 4096]
    - [83, 94.06]
  - - [1024, 512, 1, 8192, 1024, 1024, 1024, 8192]
    - [85, 101.86]
  - - [1024, 1024, 1, 128, 1024, 1024, 1024, 128]
    - [28, 25.98]
  - - [1024, 1024, 1, 256, 1024, 1024, 1024, 256]
    - [27, 45.38]
  - - [1024, 1024, 1, 512, 1024, 1024, 1024, 512]
    - [25, 71.69]
  - - [1024, 1024, 1, 1024, 1024, 1024, 1024, 1024]
    - [25, 103.54]
  - - [1024, 1024, 1, 2048, 1024, 1024, 1024, 2048]
    - [24, 133.62]
  - - [1024, 1024, 1, 4096, 1024, 1024, 1024, 4096]
    - [76, 140.52]
  - - [1024, 1024, 1, 8192, 1024, 1024, 1024, 8192]
    - [75, 148.85]
  - - [1024, 2048, 1, 128, 1024, 1024, 1024, 128]
    - [21, 41.74]
  - - [1024, 2048, 1, 256, 1024, 1024, 1024, 256]
    - [67, 71.17]
  - - [1024, 2048, 1, 512, 1024, 1024, 1024, 512]
    - [67, 113.04]
  - - [1024, 2048, 1, 1024, 1024, 1024, 1024, 1024]
    - [67, 160.81]
  - - [1024, 2048, 1, 2048, 1024, 1024, 1024, 2048]
    - [67, 203.22]
  - - [1024, 2048, 1, 4096, 1024, 1024, 1024, 4096]
    - [68, 208.5]
  - - [1024, 2048, 1, 8192, 1024, 1024, 1024, 8192]
    - [68, 199.02]
  - - [1024, 4096, 1, 128, 1024, 1024, 1024, 128]
    - [15, 58.13]
  - - [1024, 4096, 1, 256, 1024, 1024, 1024, 256]
    - [15, 99.87]
  - - [1024, 4096, 1, 512, 1024, 1024, 1024, 512]
    - [10, 153.3]
  - - [1024, 4096, 1, 1024, 1024, 1024, 1024, 1024]
    - [10, 215.48]
  - - [1024, 4096, 1, 2048, 1024, 1024, 1024, 2048]
    - [59, 252.17]
  - - [1024, 4096, 1, 4096, 1024, 1024, 1024, 4096]
    - [62, 262.24]
  - - [1024, 4096, 1, 8192, 1024, 1024, 1024, 8192]
    - [51, 243.0]
  - - [1024, 8192, 1, 128, 1024, 1024, 1024, 128]
    - [55, 89.8]
  - - [1024, 8192, 1, 256, 1024, 1024, 1024, 256]
    - [55, 152.68]
  - - [1024, 8192, 1, 512, 1024, 1024, 1024, 512]
    - [55, 244.09]
  - - [1024, 8192, 1, 1024, 1024, 1024, 1024, 1024]
    - [55, 266.84]
  - - [1024, 8192, 1, 2048, 1024, 1024, 1024, 2048]
    - [57, 311.47]
  - - [1024, 8192, 1, 4096, 1024, 1024, 1024, 4096]
    - [55, 354.58]
  - - [1024, 8192, 1, 8192, 1024, 1024, 1024, 8192]
    - [57, 368.61]
  - - [2048, 128, 1, 128, 2048, 2048, 2048, 128]
    - [88, 8.14]
  - - [2048, 128, 1, 256, 2048, 2048, 2048, 256]
    - [88, 14.57]
  - - [2048, 128, 1, 512, 2048, 2048, 2048, 512]
    - [89, 24.38]
  - - [2048, 128, 1, 1024, 2048, 2048, 2048, 1024]
    - [89, 36.93]
  - - [2048, 128, 1, 2048, 2048, 2048, 2048, 2048]
    - [92, 42.94]
  - - [2048, 128, 1, 4096, 2048, 2048, 2048, 4096]
    - [104, 51.89]
  - - [2048, 128, 1, 8192, 2048, 2048, 2048, 8192]
    - [105, 58.83]
  - - [2048, 256, 1, 128, 2048, 2048, 2048, 128]
    - [31, 14.57]
  - - [2048, 256, 1, 256, 2048, 2048, 2048, 256]
    - [34, 25.88]
  - - [2048, 256, 1, 512, 2048, 2048, 2048, 512]
    - [33, 41.99]
  - - [2048, 256, 1, 1024, 2048, 2048, 2048, 1024]
    - [82, 62.07]
  - - [2048, 256, 1, 2048, 2048, 2048, 2048, 2048]
    - [84, 77.41]
  - - [2048, 256, 1, 4096, 2048, 2048, 2048, 4096]
    - [83, 92.36]
  - - [2048, 256, 1, 8192, 2048, 2048, 2048, 8192]
    - [85, 103.64]
  - - [2048, 512, 1, 128, 2048, 2048, 2048, 128]
    - [27, 25.51]
  - - [2048, 512, 1, 256, 2048, 2048, 2048, 256]
    - [27, 44.49]
  - - [2048, 512, 1, 512, 2048, 2048, 2048, 512]
    - [25, 71.06]
  - - [2048, 512, 1, 1024, 2048, 2048, 2048, 1024]
    - [24, 102.71]
  - - [2048, 512, 1, 2048, 2048, 2048, 2048, 2048]
    - [75, 119.97]
  - - [2048, 512, 1, 4096, 2048, 2048, 2048, 4096]
    - [75, 140.27]
  - - [2048, 512, 1, 8192, 2048, 2048, 2048, 8192]
    - [75, 146.49]
  - - [2048, 1024, 1, 128, 2048, 2048, 2048, 128]
    - [21, 41.84]
  - - [2048, 1024, 1, 256, 2048, 2048, 2048, 256]
    - [21, 70.9]
  - - [2048, 1024, 1, 512, 2048, 2048, 2048, 512]
    - [67, 111.93]
  - - [2048, 1024, 1, 1024, 2048, 2048, 2048, 1024]
    - [67, 160.42]
  - - [2048, 1024, 1, 2048, 2048, 2048, 2048, 2048]
    - [70, 183.69]
  - - [2048, 1024, 1, 4096, 2048, 2048, 2048, 4096]
    - [69, 207.37]
  - - [2048, 1024, 1, 8192, 2048, 2048, 2048, 8192]
    - [68, 198.86]
  - - [2048, 2048, 1, 128, 2048, 2048, 2048, 128]
    - [18, 58.51]
  - - [2048, 2048, 1, 256, 2048, 2048, 2048, 256]
    - [15, 99.81]
  - - [2048, 2048, 1, 512, 2048, 2048, 2048, 512]
    - [11, 153.26]
  - - [2048, 2048, 1, 1024, 2048, 2048, 2048, 1024]
    - [11, 207.36]
  - - [2048, 2048, 1, 2048, 2048, 2048, 2048, 2048]
    - [62, 247.52]
  - - [2048, 2048, 1, 4096, 2048, 2048, 2048, 4096]
    - [62, 260.83]
  - - [2048, 2048, 1, 8192, 2048, 2048, 2048, 8192]
    - [50, 241.63]
  - - [2048, 4096, 1, 128, 2048, 2048, 2048, 128]
    - [4, 73.12]
  - - [2048, 4096, 1, 256, 2048, 2048, 2048, 256]
    - [1, 122.96]
  - - [2048, 4096, 1, 512, 2048, 2048, 2048, 512]
    - [1, 182.88]
  - - [2048, 4096, 1, 1024, 2048, 2048, 2048, 1024]
    - [8, 247.74]
  - - [2048, 4096, 1, 2048, 2048, 2048, 2048, 2048]
    - [8, 283.33]
  - - [2048, 4096, 1, 4096, 2048, 2048, 2048, 4096]
    - [55, 284.13]
  - - [2048, 4096, 1, 8192, 2048, 2048, 2048, 8192]
    - [55, 298.74]
  - - [2048, 8192, 1, 128, 2048, 2048, 2048, 128]
    - [58, 97.22]
  - - [2048, 8192, 1, 256, 2048, 2048, 2048, 256]
    - [58, 161.59]
  - - [2048, 8192, 1, 512, 2048, 2048, 2048, 512]
    - [56, 228.42]
  - - [2048, 8192, 1, 1024, 2048, 2048, 2048, 1024]
    - [56, 285.77]
  - - [2048, 8192, 1, 2048, 2048, 2048, 2048, 2048]
    - [58, 329.93]
  - - [2048, 8192, 1, 4096, 2048, 2048, 2048, 4096]
    - [58, 340.7]
  - - [2048, 8192, 1, 8192, 2048, 2048, 2048, 8192]
    - [56, 386.65]
  - - [4096, 128, 1, 128, 4096, 4096, 4096, 128]
    - [30, 14.82]
  - - [4096, 128, 1, 256, 4096, 4096, 4096, 256]
    - [33, 25.92]
  - - [4096, 128, 1, 512, 4096, 4096, 4096, 512]
    - [81, 42.14]
  - - [4096, 128, 1, 1024, 4096, 4096, 4096, 1024]
    - [81, 62.16]
  - - [4096, 128, 1, 2048, 4096, 4096, 4096, 2048]
    - [83, 76.71]
  - - [4096, 128, 1, 4096, 4096, 4096, 4096, 4096]
    - [83, 92.82]
  - - [4096, 128, 1, 8192, 4096, 4096, 4096, 8192]
    - [83, 104.02]
  - - [4096, 256, 1, 128, 4096, 4096, 4096, 128]
    - [27, 25.27]
  - - [4096, 256, 1, 256, 4096, 4096, 4096, 256]
    - [25, 44.67]
  - - [4096, 256, 1, 512, 4096, 4096, 4096, 512]
    - [25, 71.84]
  - - [4096, 256, 1, 1024, 4096, 4096, 4096, 1024]
    - [24, 103.21]
  - - [4096, 256, 1, 2048, 4096, 4096, 4096, 2048]
    - [74, 119.72]
  - - [4096, 256, 1, 4096, 4096, 4096, 4096, 4096]
    - [76, 140.64]
  - - [4096, 256, 1, 8192, 4096, 4096, 4096, 8192]
    - [76, 149.12]
  - - [4096, 512, 1, 128, 4096, 4096, 4096, 128]
    - [21, 41.62]
  - - [4096, 512, 1, 256, 4096, 4096, 4096, 256]
    - [67, 71.13]
  - - [4096, 512, 1, 512, 4096, 4096, 4096, 512]
    - [67, 112.89]
  - - [4096, 512, 1, 1024, 4096, 4096, 4096, 1024]
    - [69, 152.15]
  - - [4096, 512, 1, 2048, 4096, 4096, 4096, 2048]
    - [70, 180.99]
  - - [4096, 512, 1, 4096, 4096, 4096, 4096, 4096]
    - [70, 208.35]
  - - [4096, 512, 1, 8192, 4096, 4096, 4096, 8192]
    - [68, 202.06]
  - - [4096, 1024, 1, 128, 4096, 4096, 4096, 128]
    - [15, 58.61]
  - - [4096, 1024, 1, 256, 4096, 4096, 4096, 256]
    - [15, 100.08]
  - - [4096, 1024, 1, 512, 4096, 4096, 4096, 512]
    - [15, 152.71]
  - - [4096, 1024, 1, 1024, 4096, 4096, 4096, 1024]
    - [16, 202.86]
  - - [4096, 1024, 1, 2048, 4096, 4096, 4096, 2048]
    - [17, 245.18]
  - - [4096, 1024, 1, 4096, 4096, 4096, 4096, 4096]
    - [51, 265.5]
  - - [4096, 1024, 1, 8192, 4096, 4096, 4096, 8192]
    - [52, 244.45]
  - - [4096, 2048, 1, 128, 4096, 4096, 4096, 128]
    - [1, 73.37]
  - - [4096, 2048, 1, 256, 4096, 4096, 4096, 256]
    - [1, 122.28]
  - - [4096, 2048, 1, 512, 4096, 4096, 4096, 512]
    - [6, 180.76]
  - - [4096, 2048, 1, 1024, 4096, 4096, 4096, 1024]
    - [9, 243.62]
  - - [4096, 2048, 1, 2048, 4096, 4096, 4096, 2048]
    - [3, 275.95]
  - - [4096, 2048, 1, 4096, 4096, 4096, 4096, 4096]
    - [55, 269.31]
  - - [4096, 2048, 1, 8192, 4096, 4096, 4096, 8192]
    - [49, 296.52]
  - - [4096, 4096, 1, 128, 4096, 4096, 4096, 128]
    - [6, 78.85]
  - - [4096, 4096, 1, 256, 4096, 4096, 4096, 256]
    - [6, 130.4]
  - - [4096, 4096, 1, 512, 4096, 4096, 4096, 512]
    - [8, 193.11]
  - - [4096, 4096, 1, 1024, 4096, 4096, 4096, 1024]
    - [9, 239.36]
  - - [4096, 4096, 1, 2048, 4096, 4096, 4096, 2048]
    - [57, 266.03]
  - - [4096, 4096, 1, 4096, 4096, 4096, 4096, 4096]
    - [57, 294.43]
  - - [4096, 4096, 1, 8192, 4096, 4096, 4096, 8192]
    - [7, 327.73]
  - - [4096, 8192, 1, 128, 4096, 4096, 4096, 128]
    - [55, 106.35]
  - - [4096, 8192, 1, 256, 4096, 4096, 4096, 256]
    - [55, 173.42]
  - - [4096, 8192, 1, 512, 4096, 4096, 4096, 512]
    - [54, 233.69]
  - - [4096, 8192, 1, 1024, 4096, 4096, 4096, 1024]
    - [58, 271.76]
  - - [4096, 8192, 1, 2048, 4096, 4096, 4096, 2048]
    - [58, 313.84]
  - - [4096, 8192, 1, 4096, 4096, 4096, 4096, 4096]
    - [56, 363.11]
  - - [4096, 8192, 1, 8192, 4096, 4096, 4096, 8192]
    - [58, 402.67]
  - - [8192, 128, 1, 128, 8192, 8192, 8192, 128]
    - [27, 26.43]
  - - [8192, 128, 1, 256, 8192, 8192, 8192, 256]
    - [27, 44.77]
  - - [8192, 128, 1, 512, 8192, 8192, 8192, 512]
    - [24, 71.0]
  - - [8192, 128, 1, 1024, 8192, 8192, 8192, 1024]
    - [24, 102.94]
  - - [8192, 128, 1, 2048, 8192, 8192, 8192, 2048]
    - [75, 119.26]
  - - [8192, 128, 1, 4096, 8192, 8192, 8192, 4096]
    - [74, 140.07]
  - - [8192, 128, 1, 8192, 8192, 8192, 8192, 8192]
    - [75, 142.38]
  - - [8192, 256, 1, 128, 8192, 8192, 8192, 128]
    - [22, 41.1]
  - - [8192, 256, 1, 256, 8192, 8192, 8192, 256]
    - [67, 70.48]
  - - [8192, 256, 1, 512, 8192, 8192, 8192, 512]
    - [67, 112.25]
  - - [8192, 256, 1, 1024, 8192, 8192, 8192, 1024]
    - [68, 157.68]
  - - [8192, 256, 1, 2048, 8192, 8192, 8192, 2048]
    - [68, 183.2]
  - - [8192, 256, 1, 4096, 8192, 8192, 8192, 4096]
    - [68, 205.28]
  - - [8192, 256, 1, 8192, 8192, 8192, 8192, 8192]
    - [69, 198.82]
  - - [8192, 512, 1, 128, 8192, 8192, 8192, 128]
    - [15, 58.54]
  - - [8192, 512, 1, 256, 8192, 8192, 8192, 256]
    - [15, 99.36]
  - - [8192, 512, 1, 512, 8192, 8192, 8192, 512]
    - [13, 152.42]
  - - [8192, 512, 1, 1024, 8192, 8192, 8192, 1024]
    - [14, 205.88]
  - - [8192, 512, 1, 2048, 8192, 8192, 8192, 2048]
    - [61, 245.78]
  - - [8192, 512, 1, 4096, 8192, 8192, 8192, 4096]
    - [60, 259.82]
  - - [8192, 512, 1, 8192, 8192, 8192, 8192, 8192]
    - [53, 242.95]
  - - [8192, 1024, 1, 128, 8192, 8192, 8192, 128]
    - [2, 71.27]
  - - [8192, 1024, 1, 256, 8192, 8192, 8192, 256]
    - [0, 118.43]
  - - [8192, 1024, 1, 512, 8192, 8192, 8192, 512]
    - [5, 177.68]
  - - [8192, 1024, 1, 1024, 8192, 8192, 8192, 1024]
    - [3, 238.81]
  - - [8192, 1024, 1, 2048, 8192, 8192, 8192, 2048]
    - [4, 272.6]
  - - [8192, 1024, 1, 4096, 8192, 8192, 8192, 4096]
    - [49, 263.47]
  - - [8192, 1024, 1, 8192, 8192, 8192, 8192, 8192]
    - [8, 283.95]
  - - [8192, 2048, 1, 128, 8192, 8192, 8192, 128]
    - [55, 78.13]
  - - [8192, 2048, 1, 256, 8192, 8192, 8192, 256]
    - [0, 127.62]
  - - [8192, 2048, 1, 512, 8192, 8192, 8192, 512]
    - [6, 190.18]
  - - [8192, 2048, 1, 1024, 8192, 8192, 8192, 1024]
    - [8, 239.05]
  - - [8192, 2048, 1, 2048, 8192, 8192, 8192, 2048]
    - [58, 250.06]
  - - [8192, 2048, 1, 4096, 8192, 8192, 8192, 4096]
    - [1, 290.98]
  - - [8192, 2048, 1, 8192, 8192, 8192, 8192, 8192]
    - [2, 344.33]
  - - [8192, 4096, 1, 128, 8192, 8192, 8192, 128]
    - [1, 83.88]
  - - [8192, 4096, 1, 256, 8192, 8192, 8192, 256]
    - [22, 138.27]
  - - [8192, 4096, 1, 512, 8192, 8192, 8192, 512]
    - [12, 195.88]
  - - [8192, 4096, 1, 1024, 8192, 8192, 8192, 1024]
    - [53, 239.79]
  - - [8192, 4096, 1, 2048, 8192, 8192, 8192, 2048]
    - [57, 290.75]
  - - [8192, 4096, 1, 4096, 8192, 8192, 8192, 4096]
    - [57, 326.87]
  - - [8192, 4096, 1, 8192, 8192, 8192, 8192, 8192]
    - [2, 367.7]
  - - [8192, 8192, 1, 128, 8192, 8192, 8192, 128]
    - [58, 106.37]
  - - [8192, 8192, 1, 256, 8192, 8192, 8192, 256]
    - [58, 155.43]
  - - [8192, 8192, 1, 512, 8192, 8192, 8192, 512]
    - [56, 214.48]
  - - [8192, 8192, 1, 1024, 8192, 8192, 8192, 1024]
    - [57, 287.05]
  - - [8192, 8192, 1, 2048, 8192, 8192, 8192, 2048]
    - [57, 342.89]
  - - [8192, 8192, 1, 4096, 8192, 8192, 8192, 4096]
    - [57, 384.08]
  - - [8192, 8192, 1, 8192, 8192, 8192, 8192, 8192]
    - [58, 411.78]
- null
- null
- ExperimentalStreamK
- GridBased
