projects/hipblaslt/library/src/amd_detail/rocblaslt/src/Tensile/Logic/asm_full/aquavanjaram/gfx942_228cu/StreamK/aquavanjaram942_Cijk_Alik_Bljk_F8B8NB8NS_BH_Bias_HAS_SAV_UserArgs.yaml
- {MinimumRequiredVersion: 4.33.0}
- aquavanjaram942
- {Architecture: gfx942, CUCount: 228}
- [Device 0049, Device 0050]
    SolutionIndex: 0
    SolutionNameMin: Cijk_Alik_Bljk_F8B8NB8NS_BH_Bias_HAS_SAV_UserArgs_MT256x256x64_MI16x16x1_SN_LDSB1_CLR1_GRVWA8_GRVWB8_GSU0_GSUC0_GSUWGMRR0_K1_LBSPPA512_LBSPPB512_LPA8_LPB8_LRVW8_MIWT8_8_PLR1_SU0_SUM0_SUS64_VWA8_VWB8_WGM1_WGMXCC1_WGMXCCGn1
    SolutionIndex: 1
    SolutionNameMin: Cijk_Alik_Bljk_F8B8NB8NS_BH_Bias_HAS_SAV_UserArgs_MT256x256x64_MI16x16x1_SN_LDSB1_CLR1_GRVWA16_GRVWB8_GSU0_GSUC0_GSUWGMRR0_K1_LBSPPA512_LBSPPB512_LPA16_LPB8_LRVW8_MIWT8_8_PLR1_SU0_SUM0_SUS64_VWA8_VWB8_WGM1_WGMXCC1_WGMXCCGn1
    SolutionIndex: 2
    SolutionNameMin: Cijk_Alik_Bljk_F8B8NB8NS_BH_Bias_HAS_SAV_UserArgs_MT256x256x64_MI16x16x1_SN_LDSB1_CLR1_GRVWA8_GRVWB16_GSU0_GSUC0_GSUWGMRR0_K1_LBSPPA512_LBSPPB512_LPA8_LPB16_LRVW8_MIWT8_8_PLR1_SU0_SUM0_SUS64_VWA8_VWB8_WGM1_WGMXCC1_WGMXCCGn1
    SolutionIndex: 3
    SolutionNameMin: Cijk_Alik_Bljk_F8B8NB8NS_BH_Bias_HAS_SAV_UserArgs_MT256x256x64_MI16x16x1_SN_LDSB1_CLR1_GRVWA8_GRVWB16_GSU0_GSUC0_GSUWGMRR0_K1_LBSPPA512_LBSPPB512_LPA8_LPB16_LRVW8_MIWT8_8_PLR1_SU0_SUM0_SUS64_VWA8_VWB8_WGM4_WGMXCC1_WGMXCCGn1
    SolutionIndex: 4
    SolutionNameMin: Cijk_Alik_Bljk_F8B8NB8NS_BH_Bias_HAS_SAV_UserArgs_MT256x256x64_MI16x16x1_SN_LDSB1_CLR1_GRVWA8_GRVWB16_GSU0_GSUC0_GSUWGMRR0_K1_LBSPPA512_LBSPPB512_LPA8_LPB16_LRVW8_MIWT8_8_PLR1_SU0_SUM0_SUS64_VWA8_VWB8_WGM6_WGMXCC1_WGMXCCGn1
    SolutionIndex: 5
    SolutionNameMin: Cijk_Alik_Bljk_F8B8NB8NS_BH_Bias_HAS_SAV_UserArgs_MT256x256x64_MI16x16x1_SN_LDSB1_CLR1_GRVWA16_GRVWB16_GSU0_GSUC0_GSUWGMRR0_K1_LBSPPA512_LBSPPB512_LPA16_LPB16_LRVW8_MIWT8_8_PLR1_SU0_SUM0_SUS64_VWA8_VWB8_WGM6_WGMXCC1_WGMXCCGn1
    SolutionIndex: 6
    SolutionNameMin: Cijk_Alik_Bljk_F8B8NB8NS_BH_Bias_HAS_SAV_UserArgs_MT256x256x64_MI16x16x1_SN_LDSB1_CLR1_GRVWA8_GRVWB16_GSU0_GSUC0_GSUWGMRR0_K1_LBSPPA512_LBSPPB512_LPA8_LPB16_LRVW8_MIWT8_8_PLR1_SU0_SUM0_SUS64_VWA8_VWB8_WGM8_WGMXCC1_WGMXCCGn1
    SolutionIndex: 7
    SolutionNameMin: Cijk_Alik_Bljk_F8B8NB8NS_BH_Bias_HAS_SAV_UserArgs_MT256x256x64_MI16x16x1_SN_LDSB1_CLR1_GRVWA16_GRVWB16_GSU0_GSUC0_GSUWGMRR0_K1_LBSPPA512_LBSPPB512_LPA16_LPB16_LRVW8_MIWT8_8_PLR1_SU0_SUM0_SUS64_VWA8_VWB8_WGM8_WGMXCC1_WGMXCCGn1
    SolutionIndex: 8
    SolutionNameMin: Cijk_Alik_Bljk_F8B8NB8NS_BH_Bias_HAS_SAV_UserArgs_MT256x128x64_MI16x16x1_SN_LDSB1_CLR1_GRVWA8_GRVWB16_GSU0_GSUC0_GSUWGMRR0_K1_LBSPPA512_LBSPPB256_LPA8_LPB16_LRVW8_MIWT8_4_PLR1_SU0_SUM0_SUS64_VWA8_VWB4_WGM1_WGMXCC1_WGMXCCGn1
    SolutionIndex: 9
    SolutionNameMin: Cijk_Alik_Bljk_F8B8NB8NS_BH_Bias_HAS_SAV_UserArgs_MT256x128x64_MI16x16x1_SN_LDSB1_CLR1_GRVWA8_GRVWB16_GSU0_GSUC0_GSUWGMRR0_K1_LBSPPA512_LBSPPB256_LPA8_LPB16_LRVW8_MIWT8_4_PLR1_SU0_SUM0_SUS64_VWA8_VWB4_WGM4_WGMXCC1_WGMXCCGn1
    SolutionIndex: 10
    SolutionNameMin: Cijk_Alik_Bljk_F8B8NB8NS_BH_Bias_HAS_SAV_UserArgs_MT256x128x64_MI16x16x1_SN_LDSB1_CLR1_GRVWA8_GRVWB16_GSU0_GSUC0_GSUWGMRR0_K1_LBSPPA512_LBSPPB256_LPA8_LPB16_LRVW8_MIWT8_4_PLR1_SU0_SUM0_SUS64_VWA8_VWB4_WGM6_WGMXCC1_WGMXCCGn1
    SolutionIndex: 11
    SolutionNameMin: Cijk_Alik_Bljk_F8B8NB8NS_BH_Bias_HAS_SAV_UserArgs_MT128x128x64_MI16x16x1_SN_LDSB1_CLR1_GRVWA8_GRVWB16_GSU0_GSUC0_GSUWGMRR0_K1_LBSPPA512_LBSPPB128_LPA8_LPB16_LRVW8_MIWT8_2_PLR1_SU0_SUM0_SUS64_VWA8_VWB2_WGM1_WGMXCC1_WGMXCCGn1
    SolutionIndex: 12
    SolutionNameMin: Cijk_Alik_Bljk_F8B8NB8NS_BH_Bias_HAS_SAV_UserArgs_MT128x128x64_MI16x16x1_SN_LDSB1_CLR1_GRVWA8_GRVWB16_GSU0_GSUC0_GSUWGMRR0_K1_LBSPPA512_LBSPPB128_LPA8_LPB16_LRVW8_MIWT8_2_PLR1_SU0_SUM0_SUS64_VWA8_VWB2_WGM8_WGMXCC1_WGMXCCGn1
    SolutionIndex: 13
    SolutionNameMin: Cijk_Alik_Bljk_F8B8NB8NS_BH_Bias_HAS_SAV_UserArgs_MT128x64x64_MI16x16x1_SN_LDSB0_CLR1_GRVWA8_GRVWB16_GSU0_GSUC0_GSUWGMRR0_K1_LBSPPA512_LBSPPB128_LPA8_LPB16_LRVW8_MIWT8_1_PLR1_SU0_SUM0_SUS64_VWA8_VWB1_WGM1_WGMXCC1_WGMXCCGn1
    SolutionIndex: 14
    SolutionNameMin: Cijk_Alik_Bljk_F8B8NB8NS_BH_Bias_HAS_SAV_UserArgs_MT128x128x64_MI16x16x1_SN_LDSB1_CLR1_GRVWA8_GRVWB16_GSU0_GSUC0_GSUWGMRR0_K1_LBSPPA256_LBSPPB256_LPA8_LPB16_LRVW8_MIWT4_4_PLR1_SU0_SUM0_SUS64_VWA4_VWB4_WGM1_WGMXCC1_WGMXCCGn1
    SolutionIndex: 15
    SolutionNameMin: Cijk_Alik_Bljk_F8B8NB8NS_BH_Bias_HAS_SAV_UserArgs_MT128x128x64_MI16x16x1_SN_LDSB1_CLR1_GRVWA16_GRVWB16_GSU0_GSUC0_GSUWGMRR0_K1_LBSPPA256_LBSPPB256_LPA16_LPB16_LRVW8_MIWT4_4_PLR1_SU0_SUM0_SUS64_VWA4_VWB4_WGM1_WGMXCC1_WGMXCCGn1
    SolutionIndex: 16
    SolutionNameMin: Cijk_Alik_Bljk_F8B8NB8NS_BH_Bias_HAS_SAV_UserArgs_MT128x128x64_MI16x16x1_SN_LDSB1_CLR1_GRVWA16_GRVWB16_GSU0_GSUC0_GSUWGMRR0_K1_LBSPPA256_LBSPPB256_LPA16_LPB16_LRVW8_MIWT4_4_PLR1_SU0_SUM0_SUS64_VWA4_VWB4_WGM4_WGMXCC1_WGMXCCGn1
    SolutionIndex: 17
    SolutionNameMin: Cijk_Alik_Bljk_F8B8NB8NS_BH_Bias_HAS_SAV_UserArgs_MT64x128x64_MI16x16x1_SN_LDSB0_CLR1_GRVWA8_GRVWB16_GSU0_GSUC0_GSUWGMRR0_K1_LBSPPA128_LBSPPB256_LPA8_LPB16_LRVW8_MIWT2_4_PLR1_SU0_SUM0_SUS64_VWA2_VWB4_WGM1_WGMXCC1_WGMXCCGn1
    SolutionIndex: 18
    SolutionNameMin: Cijk_Alik_Bljk_F8B8NB8NS_BH_Bias_HAS_SAV_UserArgs_MT128x64x64_MI16x16x1_SN_LDSB0_CLR1_GRVWA8_GRVWB8_GSU0_GSUC0_GSUWGMRR0_K1_LBSPPA256_LBSPPB128_LPA8_LPB8_LRVW8_MIWT4_2_PLR1_SU0_SUM0_SUS64_VWA4_VWB2_WGM1_WGMXCC1_WGMXCCGn1
    SolutionIndex: 19
    SolutionNameMin: Cijk_Alik_Bljk_F8B8NB8NS_BH_Bias_HAS_SAV_UserArgs_MT128x64x64_MI16x16x1_SN_LDSB0_CLR1_GRVWA16_GRVWB8_GSU0_GSUC0_GSUWGMRR0_K1_LBSPPA256_LBSPPB128_LPA16_LPB8_LRVW8_MIWT4_2_PLR1_SU0_SUM0_SUS64_VWA4_VWB2_WGM1_WGMXCC1_WGMXCCGn1
    SolutionIndex: 20
    SolutionNameMin: Cijk_Alik_Bljk_F8B8NB8NS_BH_Bias_HAS_SAV_UserArgs_MT128x64x64_MI16x16x1_SN_LDSB0_CLR1_GRVWA8_GRVWB16_GSU0_GSUC0_GSUWGMRR0_K1_LBSPPA256_LBSPPB128_LPA8_LPB16_LRVW8_MIWT4_2_PLR1_SU0_SUM0_SUS64_VWA4_VWB2_WGM1_WGMXCC1_WGMXCCGn1
    SolutionIndex: 21
    SolutionNameMin: Cijk_Alik_Bljk_F8B8NB8NS_BH_Bias_HAS_SAV_UserArgs_MT128x64x64_MI16x16x1_SN_LDSB0_CLR1_GRVWA8_GRVWB16_GSU0_GSUC0_GSUWGMRR0_K1_LBSPPA256_LBSPPB128_LPA8_LPB16_LRVW8_MIWT4_2_PLR1_SU0_SUM0_SUS64_VWA4_VWB2_WGM4_WGMXCC1_WGMXCCGn1
    SolutionIndex: 22
    SolutionNameMin: Cijk_Alik_Bljk_F8B8NB8NS_BH_Bias_HAS_SAV_UserArgs_MT128x64x64_MI16x16x1_SN_LDSB0_CLR1_GRVWA8_GRVWB16_GSU0_GSUC0_GSUWGMRR0_K1_LBSPPA256_LBSPPB128_LPA8_LPB16_LRVW8_MIWT4_2_PLR1_SU0_SUM0_SUS64_VWA4_VWB2_WGM6_WGMXCC1_WGMXCCGn1
    SolutionIndex: 23
    SolutionNameMin: Cijk_Alik_Bljk_F8B8NB8NS_BH_Bias_HAS_SAV_UserArgs_MT128x64x64_MI16x16x1_SN_LDSB0_CLR1_GRVWA8_GRVWB16_GSU0_GSUC0_GSUWGMRR0_K1_LBSPPA256_LBSPPB128_LPA8_LPB16_LRVW8_MIWT4_2_PLR1_SU0_SUM0_SUS64_VWA4_VWB2_WGM8_WGMXCC1_WGMXCCGn1
    SolutionIndex: 24
    SolutionNameMin: Cijk_Alik_Bljk_F8B8NB8NS_BH_Bias_HAS_SAV_UserArgs_MT64x64x64_MI16x16x1_SN_LDSB0_CLR1_GRVWA8_GRVWB8_GSU0_GSUC0_GSUWGMRR0_K1_LBSPPA128_LBSPPB128_LPA8_LPB8_LRVW8_MIWT2_2_PLR1_SU0_SUM0_SUS64_VWA2_VWB2_WGM1_WGMXCC1_WGMXCCGn1
    SolutionIndex: 25
    SolutionNameMin: Cijk_Alik_Bljk_F8B8NB8NS_BH_Bias_HAS_SAV_UserArgs_MT64x64x64_MI16x16x1_SN_LDSB0_CLR1_GRVWA16_GRVWB8_GSU0_GSUC0_GSUWGMRR0_K1_LBSPPA128_LBSPPB128_LPA16_LPB8_LRVW8_MIWT2_2_PLR1_SU0_SUM0_SUS64_VWA2_VWB2_WGM1_WGMXCC1_WGMXCCGn1
    SolutionIndex: 26
    SolutionNameMin: Cijk_Alik_Bljk_F8B8NB8NS_BH_Bias_HAS_SAV_UserArgs_MT64x64x64_MI16x16x1_SN_LDSB0_CLR1_GRVWA8_GRVWB16_GSU0_GSUC0_GSUWGMRR0_K1_LBSPPA128_LBSPPB128_LPA8_LPB16_LRVW8_MIWT2_2_PLR1_SU0_SUM0_SUS64_VWA2_VWB2_WGM1_WGMXCC1_WGMXCCGn1
    SolutionIndex: 27
    SolutionNameMin: Cijk_Alik_Bljk_F8B8NB8NS_BH_Bias_HAS_SAV_UserArgs_MT64x64x64_MI16x16x1_SN_LDSB0_CLR1_GRVWA16_GRVWB16_GSU0_GSUC0_GSUWGMRR0_K1_LBSPPA128_LBSPPB128_LPA16_LPB16_LRVW8_MIWT2_2_PLR1_SU0_SUM0_SUS64_VWA2_VWB2_WGM1_WGMXCC1_WGMXCCGn1
    SolutionIndex: 28
    SolutionNameMin: Cijk_Alik_Bljk_F8B8NB8NS_BH_Bias_HAS_SAV_UserArgs_MT64x64x64_MI16x16x1_SN_LDSB0_CLR1_GRVWA8_GRVWB16_GSU0_GSUC0_GSUWGMRR0_K1_LBSPPA128_LBSPPB128_LPA8_LPB16_LRVW8_MIWT2_2_PLR1_SU0_SUM0_SUS64_VWA2_VWB2_WGM6_WGMXCC1_WGMXCCGn1
    SolutionIndex: 29
    SolutionNameMin: Cijk_Alik_Bljk_F8B8NB8NS_BH_Bias_HAS_SAV_UserArgs_MT64x64x64_MI16x16x1_SN_LDSB0_CLR1_GRVWA8_GRVWB8_GSU0_GSUC0_GSUWGMRR0_K1_LBSPPA128_LBSPPB128_LPA8_LPB8_LRVW8_MIWT2_2_PLR1_SU0_SUM0_SUS64_VWA2_VWB2_WGM8_WGMXCC1_WGMXCCGn1
    SolutionIndex: 30
    SolutionNameMin: Cijk_Alik_Bljk_F8B8NB8NS_BH_Bias_HAS_SAV_UserArgs_MT32x64x64_MI16x16x1_SN_LDSB0_CLR1_GRVWA8_GRVWB8_GSU0_GSUC0_GSUWGMRR0_K1_LBSPPA128_LBSPPB128_LPA8_LPB8_LRVW8_MIWT1_2_PLR1_SU0_SUM0_SUS64_VWA1_VWB2_WGM1_WGMXCC1_WGMXCCGn1
    SolutionIndex: 31
    SolutionNameMin: Cijk_Alik_Bljk_F8B8NB8NS_BH_Bias_HAS_SAV_UserArgs_MT64x32x64_MI16x16x1_SN_LDSB0_CLR1_GRVWA8_GRVWB8_GSU0_GSUC0_GSUWGMRR0_K1_LBSPPA128_LBSPPB128_LPA8_LPB8_LRVW8_MIWT2_1_PLR1_SU0_SUM0_SUS64_VWA2_VWB1_WGM1_WGMXCC1_WGMXCCGn1
    SolutionIndex: 32
    SolutionNameMin: Cijk_Alik_Bljk_F8B8NB8NS_BH_Bias_HAS_SAV_UserArgs_MT64x32x64_MI16x16x1_SN_LDSB0_CLR1_GRVWA16_GRVWB8_GSU0_GSUC0_GSUWGMRR0_K1_LBSPPA128_LBSPPB128_LPA16_LPB8_LRVW8_MIWT2_1_PLR1_SU0_SUM0_SUS64_VWA2_VWB1_WGM1_WGMXCC1_WGMXCCGn1
    SolutionIndex: 33
    SolutionNameMin: Cijk_Alik_Bljk_F8B8NB8NS_BH_Bias_HAS_SAV_UserArgs_MT32x32x64_MI16x16x1_SN_LDSB0_CLR1_GRVWA8_GRVWB8_GSU0_GSUC0_GSUWGMRR0_K1_LBSPPA128_LBSPPB128_LPA8_LPB8_LRVW8_MIWT1_1_PLR1_SU0_SUM0_SUS64_VWA1_VWB1_WGM1_WGMXCC1_WGMXCCGn1
    SolutionIndex: 34
    SolutionNameMin: Cijk_Alik_Bljk_F8B8NB8NS_BH_Bias_HAS_SAV_UserArgs_MT32x32x64_MI16x16x1_SN_LDSB0_CLR1_GRVWA8_GRVWB8_GSU0_GSUC0_GSUWGMRR0_K1_LBSPPA128_LBSPPB128_LPA8_LPB8_LRVW8_MIWT1_1_PLR1_SU0_SUM0_SUS64_VWA1_VWB1_WGM4_WGMXCC1_WGMXCCGn1
    SolutionIndex: 35
    SolutionNameMin: Cijk_Alik_Bljk_F8B8NB8NS_BH_Bias_HAS_SAV_UserArgs_MT128x256x128_MI16x16x1_SN_LDSB1_CLR1_GRVWA8_GRVWB16_GSU0_GSUC0_GSUWGMRR0_K1_LBSPPA512_LBSPPB1024_LPA8_LPB16_LRVW8_MIWT4_8_PLR1_SU0_SUM0_SUS128_VWA4_VWB8_WGM1_WGMXCC1_WGMXCCGn1
    SolutionIndex: 36
    SolutionNameMin: Cijk_Alik_Bljk_F8B8NB8NS_BH_Bias_HAS_SAV_UserArgs_MT128x256x128_MI16x16x1_SN_LDSB1_CLR1_GRVWA8_GRVWB16_GSU0_GSUC0_GSUWGMRR0_K1_LBSPPA512_LBSPPB1024_LPA8_LPB16_LRVW8_MIWT4_8_PLR1_SU0_SUM0_SUS128_VWA4_VWB8_WGM4_WGMXCC1_WGMXCCGn1
    SolutionIndex: 37
    SolutionNameMin: Cijk_Alik_Bljk_F8B8NB8NS_BH_Bias_HAS_SAV_UserArgs_MT128x256x128_MI16x16x1_SN_LDSB1_CLR1_GRVWA8_GRVWB16_GSU0_GSUC0_GSUWGMRR0_K1_LBSPPA512_LBSPPB1024_LPA8_LPB16_LRVW8_MIWT4_8_PLR1_SU0_SUM0_SUS128_VWA4_VWB8_WGM6_WGMXCC1_WGMXCCGn1
    SolutionIndex: 38
    SolutionNameMin: Cijk_Alik_Bljk_F8B8NB8NS_BH_Bias_HAS_SAV_UserArgs_MT256x144x128_MI16x16x1_SN_LDSB1_CLR1_GRVWA8_GRVWB8_GSU0_GSUC0_GSUWGMRR0_K1_LBSPPA512_LBSPPB128_LPA8_LPB8_LRVW8_MIWT4_9_PLR1_SU0_SUM0_SUS128_VWA4_VWB1_WGM1_WGMXCC1_WGMXCCGn1
    SolutionIndex: 39
    SolutionNameMin: Cijk_Alik_Bljk_F8B8NB8NS_BH_Bias_HAS_SAV_UserArgs_MT256x144x128_MI16x16x1_SN_LDSB1_CLR1_GRVWA16_GRVWB8_GSU0_GSUC0_GSUWGMRR0_K1_LBSPPA512_LBSPPB128_LPA16_LPB8_LRVW8_MIWT4_9_PLR1_SU0_SUM0_SUS128_VWA4_VWB1_WGM1_WGMXCC1_WGMXCCGn1
    SolutionIndex: 40
    SolutionNameMin: Cijk_Alik_Bljk_F8B8NB8NS_BH_Bias_HAS_SAV_UserArgs_MT256x144x128_MI16x16x1_SN_LDSB1_CLR1_GRVWA8_GRVWB8_GSU0_GSUC0_GSUWGMRR0_K1_LBSPPA512_LBSPPB128_LPA8_LPB8_LRVW8_MIWT4_9_PLR1_SU0_SUM0_SUS128_VWA4_VWB1_WGM4_WGMXCC1_WGMXCCGn1
    SolutionIndex: 41
    SolutionNameMin: Cijk_Alik_Bljk_F8B8NB8NS_BH_Bias_HAS_SAV_UserArgs_MT256x144x128_MI16x16x1_SN_LDSB1_CLR1_GRVWA16_GRVWB8_GSU0_GSUC0_GSUWGMRR0_K1_LBSPPA512_LBSPPB128_LPA16_LPB8_LRVW8_MIWT4_9_PLR1_SU0_SUM0_SUS128_VWA4_VWB1_WGM4_WGMXCC1_WGMXCCGn1
    SolutionIndex: 42
    SolutionNameMin: Cijk_Alik_Bljk_F8B8NB8NS_BH_Bias_HAS_SAV_UserArgs_MT256x144x128_MI16x16x1_SN_LDSB1_CLR1_GRVWA8_GRVWB8_GSU0_GSUC0_GSUWGMRR0_K1_LBSPPA512_LBSPPB128_LPA8_LPB8_LRVW8_MIWT4_9_PLR1_SU0_SUM0_SUS128_VWA4_VWB1_WGM6_WGMXCC1_WGMXCCGn1
    SolutionIndex: 43
    SolutionNameMin: Cijk_Alik_Bljk_F8B8NB8NS_BH_Bias_HAS_SAV_UserArgs_MT256x144x128_MI16x16x1_SN_LDSB1_CLR1_GRVWA16_GRVWB8_GSU0_GSUC0_GSUWGMRR0_K1_LBSPPA512_LBSPPB128_LPA16_LPB8_LRVW8_MIWT4_9_PLR1_SU0_SUM0_SUS128_VWA4_VWB1_WGM6_WGMXCC1_WGMXCCGn1
    SolutionIndex: 44
    SolutionNameMin: Cijk_Alik_Bljk_F8B8NB8NS_BH_Bias_HAS_SAV_UserArgs_MT256x144x128_MI16x16x1_SN_LDSB1_CLR1_GRVWA8_GRVWB8_GSU0_GSUC0_GSUWGMRR0_K1_LBSPPA512_LBSPPB128_LPA8_LPB8_LRVW8_MIWT4_9_PLR1_SU0_SUM0_SUS128_VWA4_VWB1_WGM8_WGMXCC1_WGMXCCGn1
    SolutionIndex: 45
    SolutionNameMin: Cijk_Alik_Bljk_F8B8NB8NS_BH_Bias_HAS_SAV_UserArgs_MT256x144x128_MI16x16x1_SN_LDSB1_CLR1_GRVWA16_GRVWB8_GSU0_GSUC0_GSUWGMRR0_K1_LBSPPA512_LBSPPB128_LPA16_LPB8_LRVW8_MIWT4_9_PLR1_SU0_SUM0_SUS128_VWA4_VWB1_WGM8_WGMXCC1_WGMXCCGn1
    SolutionIndex: 46
    SolutionNameMin: Cijk_Alik_Bljk_F8B8NB8NS_BH_Bias_HAS_SAV_UserArgs_MT256x128x128_MI16x16x1_SN_LDSB1_CLR1_GRVWA8_GRVWB16_GSU0_GSUC0_GSUWGMRR0_K1_LBSPPA1024_LBSPPB512_LPA8_LPB16_LRVW8_MIWT8_4_PLR1_SU0_SUM0_SUS128_VWA8_VWB4_WGM1_WGMXCC1_WGMXCCGn1
    SolutionIndex: 47
    SolutionNameMin: Cijk_Alik_Bljk_F8B8NB8NS_BH_Bias_HAS_SAV_UserArgs_MT256x128x128_MI16x16x1_SN_LDSB1_CLR1_GRVWA8_GRVWB16_GSU0_GSUC0_GSUWGMRR0_K1_LBSPPA1024_LBSPPB512_LPA8_LPB16_LRVW8_MIWT8_4_PLR1_SU0_SUM0_SUS128_VWA8_VWB4_WGM4_WGMXCC1_WGMXCCGn1
    SolutionIndex: 48
    SolutionNameMin: Cijk_Alik_Bljk_F8B8NB8NS_BH_Bias_HAS_SAV_UserArgs_MT256x128x128_MI16x16x1_SN_LDSB1_CLR1_GRVWA8_GRVWB16_GSU0_GSUC0_GSUWGMRR0_K1_LBSPPA1024_LBSPPB512_LPA8_LPB16_LRVW8_MIWT8_4_PLR1_SU0_SUM0_SUS128_VWA8_VWB4_WGM6_WGMXCC1_WGMXCCGn1
    SolutionIndex: 49
    SolutionNameMin: Cijk_Alik_Bljk_F8B8NB8NS_BH_Bias_HAS_SAV_UserArgs_MT256x128x128_MI16x16x1_SN_LDSB1_CLR1_GRVWA8_GRVWB16_GSU0_GSUC0_GSUWGMRR0_K1_LBSPPA1024_LBSPPB512_LPA8_LPB16_LRVW8_MIWT8_4_PLR1_SU0_SUM0_SUS128_VWA8_VWB4_WGM8_WGMXCC1_WGMXCCGn1
    SolutionIndex: 50
    SolutionNameMin: Cijk_Alik_Bljk_F8B8NB8NS_BH_Bias_HAS_SAV_UserArgs_MT144x256x128_MI16x16x1_SN_LDSB1_CLR1_GRVWA8_GRVWB16_GSU0_GSUC0_GSUWGMRR0_K1_LBSPPA128_LBSPPB512_LPA8_LPB16_LRVW8_MIWT9_4_PLR1_SU0_SUM0_SUS128_VWA1_VWB4_WGM1_WGMXCC1_WGMXCCGn1
    SolutionIndex: 51
    SolutionNameMin: Cijk_Alik_Bljk_F8B8NB8NS_BH_Bias_HAS_SAV_UserArgs_MT144x256x128_MI16x16x1_SN_LDSB1_CLR1_GRVWA8_GRVWB16_GSU0_GSUC0_GSUWGMRR0_K1_LBSPPA128_LBSPPB512_LPA8_LPB16_LRVW8_MIWT9_4_PLR1_SU0_SUM0_SUS128_VWA1_VWB4_WGM4_WGMXCC1_WGMXCCGn1
    SolutionIndex: 52
    SolutionNameMin: Cijk_Alik_Bljk_F8B8NB8NS_BH_Bias_HAS_SAV_UserArgs_MT144x256x128_MI16x16x1_SN_LDSB1_CLR1_GRVWA8_GRVWB16_GSU0_GSUC0_GSUWGMRR0_K1_LBSPPA128_LBSPPB512_LPA8_LPB16_LRVW8_MIWT9_4_PLR1_SU0_SUM0_SUS128_VWA1_VWB4_WGM6_WGMXCC1_WGMXCCGn1
    SolutionIndex: 53
    SolutionNameMin: Cijk_Alik_Bljk_F8B8NB8NS_BH_Bias_HAS_SAV_UserArgs_MT144x256x128_MI16x16x1_SN_LDSB1_CLR1_GRVWA8_GRVWB16_GSU0_GSUC0_GSUWGMRR0_K1_LBSPPA128_LBSPPB512_LPA8_LPB16_LRVW8_MIWT9_4_PLR1_SU0_SUM0_SUS128_VWA1_VWB4_WGM8_WGMXCC1_WGMXCCGn1
    SolutionIndex: 54
    SolutionNameMin: Cijk_Alik_Bljk_F8B8NB8NS_BH_Bias_HAS_SAV_UserArgs_MT128x128x128_MI16x16x1_SN_LDSB1_CLR1_GRVWA8_GRVWB16_GSU0_GSUC0_GSUWGMRR0_K1_LBSPPA1024_LBSPPB256_LPA8_LPB16_LRVW8_MIWT8_2_PLR1_SU0_SUM0_SUS128_VWA8_VWB2_WGM1_WGMXCC1_WGMXCCGn1
    SolutionIndex: 55
    SolutionNameMin: Cijk_Alik_Bljk_F8B8NB8NS_BH_Bias_HAS_SAV_UserArgs_MT128x128x128_MI16x16x1_SN_LDSB1_CLR1_GRVWA8_GRVWB16_GSU0_GSUC0_GSUWGMRR0_K1_LBSPPA1024_LBSPPB256_LPA8_LPB16_LRVW8_MIWT8_2_PLR1_SU0_SUM0_SUS128_VWA8_VWB2_WGM4_WGMXCC1_WGMXCCGn1
    SolutionIndex: 56
    SolutionNameMin: Cijk_Alik_Bljk_F8B8NB8NS_BH_Bias_HAS_SAV_UserArgs_MT128x128x128_MI16x16x1_SN_LDSB1_CLR1_GRVWA8_GRVWB16_GSU0_GSUC0_GSUWGMRR0_K1_LBSPPA1024_LBSPPB256_LPA8_LPB16_LRVW8_MIWT8_2_PLR1_SU0_SUM0_SUS128_VWA8_VWB2_WGM6_WGMXCC1_WGMXCCGn1
    SolutionIndex: 57
    SolutionNameMin: Cijk_Alik_Bljk_F8B8NB8NS_BH_Bias_HAS_SAV_UserArgs_MT128x128x128_MI16x16x1_SN_LDSB1_CLR1_GRVWA8_GRVWB16_GSU0_GSUC0_GSUWGMRR0_K1_LBSPPA1024_LBSPPB256_LPA8_LPB16_LRVW8_MIWT8_2_PLR1_SU0_SUM0_SUS128_VWA8_VWB2_WGM8_WGMXCC1_WGMXCCGn1
    SolutionIndex: 58
    SolutionNameMin: Cijk_Alik_Bljk_F8B8NB8NS_BH_Bias_HAS_SAV_UserArgs_MT128x144x128_MI16x16x1_SN_LDSB1_CLR1_GRVWA16_GRVWB8_GSU0_GSUC0_GSUWGMRR0_K1_LBSPPA256_LBSPPB128_LPA16_LPB8_LRVW8_MIWT2_9_PLR1_SU0_SUM0_SUS128_VWA2_VWB1_WGM1_WGMXCC1_WGMXCCGn1
    SolutionIndex: 59
    SolutionNameMin: Cijk_Alik_Bljk_F8B8NB8NS_BH_Bias_HAS_SAV_UserArgs_MT128x144x128_MI16x16x1_SN_LDSB1_CLR1_GRVWA16_GRVWB8_GSU0_GSUC0_GSUWGMRR0_K1_LBSPPA256_LBSPPB128_LPA16_LPB8_LRVW8_MIWT2_9_PLR1_SU0_SUM0_SUS128_VWA2_VWB1_WGM4_WGMXCC1_WGMXCCGn1
    SolutionIndex: 60
    SolutionNameMin: Cijk_Alik_Bljk_F8B8NB8NS_BH_Bias_HAS_SAV_UserArgs_MT144x128x128_MI16x16x1_SN_LDSB1_CLR1_GRVWA8_GRVWB16_GSU0_GSUC0_GSUWGMRR0_K1_LBSPPA128_LBSPPB256_LPA8_LPB16_LRVW8_MIWT9_2_PLR1_SU0_SUM0_SUS128_VWA1_VWB2_WGM4_WGMXCC1_WGMXCCGn1
    SolutionIndex: 61
    SolutionNameMin: Cijk_Alik_Bljk_F8B8NB8NS_BH_Bias_HAS_SAV_UserArgs_MT144x128x128_MI16x16x1_SN_LDSB1_CLR1_GRVWA8_GRVWB16_GSU0_GSUC0_GSUWGMRR0_K1_LBSPPA128_LBSPPB256_LPA8_LPB16_LRVW8_MIWT9_2_PLR1_SU0_SUM0_SUS128_VWA1_VWB2_WGM6_WGMXCC1_WGMXCCGn1
    SolutionIndex: 62
    SolutionNameMin: Cijk_Alik_Bljk_F8B8NB8NS_BH_Bias_HAS_SAV_UserArgs_MT128x128x128_MI16x16x1_SN_LDSB1_CLR1_GRVWA8_GRVWB16_GSU0_GSUC0_GSUWGMRR0_K1_LBSPPA512_LBSPPB512_LPA8_LPB16_LRVW8_MIWT4_4_PLR1_SU0_SUM0_SUS128_VWA4_VWB4_WGM1_WGMXCC1_WGMXCCGn1
    SolutionIndex: 63
    SolutionNameMin: Cijk_Alik_Bljk_F8B8NB8NS_BH_Bias_HAS_SAV_UserArgs_MT128x128x128_MI16x16x1_SN_LDSB1_CLR1_GRVWA16_GRVWB16_GSU0_GSUC0_GSUWGMRR0_K1_LBSPPA512_LBSPPB512_LPA16_LPB16_LRVW8_MIWT4_4_PLR1_SU0_SUM0_SUS128_VWA4_VWB4_WGM1_WGMXCC1_WGMXCCGn1
    SolutionIndex: 64
    SolutionNameMin: Cijk_Alik_Bljk_F8B8NB8NS_BH_Bias_HAS_SAV_UserArgs_MT128x128x128_MI16x16x1_SN_LDSB1_CLR1_GRVWA8_GRVWB16_GSU0_GSUC0_GSUWGMRR0_K1_LBSPPA512_LBSPPB512_LPA8_LPB16_LRVW8_MIWT4_4_PLR1_SU0_SUM0_SUS128_VWA4_VWB4_WGM4_WGMXCC1_WGMXCCGn1
    SolutionIndex: 65
    SolutionNameMin: Cijk_Alik_Bljk_F8B8NB8NS_BH_Bias_HAS_SAV_UserArgs_MT128x128x128_MI16x16x1_SN_LDSB1_CLR1_GRVWA8_GRVWB16_GSU0_GSUC0_GSUWGMRR0_K1_LBSPPA512_LBSPPB512_LPA8_LPB16_LRVW8_MIWT4_4_PLR1_SU0_SUM0_SUS128_VWA4_VWB4_WGM6_WGMXCC1_WGMXCCGn1
    SolutionIndex: 66
    SolutionNameMin: Cijk_Alik_Bljk_F8B8NB8NS_BH_Bias_HAS_SAV_UserArgs_MT128x128x128_MI16x16x1_SN_LDSB1_CLR1_GRVWA16_GRVWB16_GSU0_GSUC0_GSUWGMRR0_K1_LBSPPA512_LBSPPB512_LPA16_LPB16_LRVW8_MIWT4_4_PLR1_SU0_SUM0_SUS128_VWA4_VWB4_WGM6_WGMXCC1_WGMXCCGn1
    SolutionIndex: 67
    SolutionNameMin: Cijk_Alik_Bljk_F8B8NB8NS_BH_Bias_HAS_SAV_UserArgs_MT128x128x128_MI16x16x1_SN_LDSB1_CLR1_GRVWA8_GRVWB16_GSU0_GSUC0_GSUWGMRR0_K1_LBSPPA512_LBSPPB512_LPA8_LPB16_LRVW8_MIWT4_4_PLR1_SU0_SUM0_SUS128_VWA4_VWB4_WGM8_WGMXCC1_WGMXCCGn1
    SolutionIndex: 68
    SolutionNameMin: Cijk_Alik_Bljk_F8B8NB8NS_BH_Bias_HAS_SAV_UserArgs_MT64x128x128_MI16x16x1_SN_LDSB1_CLR1_GRVWA8_GRVWB16_GSU0_GSUC0_GSUWGMRR0_K1_LBSPPA256_LBSPPB512_LPA8_LPB16_LRVW8_MIWT2_4_PLR1_SU0_SUM0_SUS128_VWA2_VWB4_WGM1_WGMXCC1_WGMXCCGn1
    SolutionIndex: 69
    SolutionNameMin: Cijk_Alik_Bljk_F8B8NB8NS_BH_Bias_HAS_SAV_UserArgs_MT64x128x128_MI16x16x1_SN_LDSB1_CLR1_GRVWA8_GRVWB16_GSU0_GSUC0_GSUWGMRR0_K1_LBSPPA256_LBSPPB512_LPA8_LPB16_LRVW8_MIWT2_4_PLR1_SU0_SUM0_SUS128_VWA2_VWB4_WGM4_WGMXCC1_WGMXCCGn1
    SolutionIndex: 70
    SolutionNameMin: Cijk_Alik_Bljk_F8B8NB8NS_BH_Bias_HAS_SAV_UserArgs_MT64x128x128_MI16x16x1_SN_LDSB1_CLR1_GRVWA8_GRVWB16_GSU0_GSUC0_GSUWGMRR0_K1_LBSPPA256_LBSPPB512_LPA8_LPB16_LRVW8_MIWT2_4_PLR1_SU0_SUM0_SUS128_VWA2_VWB4_WGM8_WGMXCC1_WGMXCCGn1
    SolutionIndex: 71
    SolutionNameMin: Cijk_Alik_Bljk_F8B8NB8NS_BH_Bias_HAS_SAV_UserArgs_MT128x64x128_MI16x16x1_SN_LDSB1_CLR1_GRVWA8_GRVWB8_GSU0_GSUC0_GSUWGMRR0_K1_LBSPPA512_LBSPPB256_LPA8_LPB8_LRVW8_MIWT4_2_PLR1_SU0_SUM0_SUS128_VWA4_VWB2_WGM1_WGMXCC1_WGMXCCGn1
    SolutionIndex: 72
    SolutionNameMin: Cijk_Alik_Bljk_F8B8NB8NS_BH_Bias_HAS_SAV_UserArgs_MT128x64x128_MI16x16x1_SN_LDSB1_CLR1_GRVWA8_GRVWB16_GSU0_GSUC0_GSUWGMRR0_K1_LBSPPA512_LBSPPB256_LPA8_LPB16_LRVW8_MIWT4_2_PLR1_SU0_SUM0_SUS128_VWA4_VWB2_WGM1_WGMXCC1_WGMXCCGn1
    SolutionIndex: 73
    SolutionNameMin: Cijk_Alik_Bljk_F8B8NB8NS_BH_Bias_HAS_SAV_UserArgs_MT128x64x128_MI16x16x1_SN_LDSB1_CLR1_GRVWA16_GRVWB16_GSU0_GSUC0_GSUWGMRR0_K1_LBSPPA512_LBSPPB256_LPA16_LPB16_LRVW8_MIWT4_2_PLR1_SU0_SUM0_SUS128_VWA4_VWB2_WGM1_WGMXCC1_WGMXCCGn1
    SolutionIndex: 74
    SolutionNameMin: Cijk_Alik_Bljk_F8B8NB8NS_BH_Bias_HAS_SAV_UserArgs_MT64x64x128_MI16x16x1_SN_LDSB1_CLR1_GRVWA8_GRVWB8_GSU0_GSUC0_GSUWGMRR0_K1_LBSPPA256_LBSPPB256_LPA8_LPB8_LRVW8_MIWT2_2_PLR1_SU0_SUM0_SUS128_VWA2_VWB2_WGM1_WGMXCC1_WGMXCCGn1
    SolutionIndex: 75
    SolutionNameMin: Cijk_Alik_Bljk_F8B8NB8NS_BH_Bias_HAS_SAV_UserArgs_MT64x64x128_MI16x16x1_SN_LDSB1_CLR1_GRVWA16_GRVWB8_GSU0_GSUC0_GSUWGMRR0_K1_LBSPPA256_LBSPPB256_LPA16_LPB8_LRVW8_MIWT2_2_PLR1_SU0_SUM0_SUS128_VWA2_VWB2_WGM1_WGMXCC1_WGMXCCGn1
    SolutionIndex: 76
    SolutionNameMin: Cijk_Alik_Bljk_F8B8NB8NS_BH_Bias_HAS_SAV_UserArgs_MT64x64x128_MI16x16x1_SN_LDSB1_CLR1_GRVWA8_GRVWB16_GSU0_GSUC0_GSUWGMRR0_K1_LBSPPA256_LBSPPB256_LPA8_LPB16_LRVW8_MIWT2_2_PLR1_SU0_SUM0_SUS128_VWA2_VWB2_WGM1_WGMXCC1_WGMXCCGn1
    SolutionIndex: 77
    SolutionNameMin: Cijk_Alik_Bljk_F8B8NB8NS_BH_Bias_HAS_SAV_UserArgs_MT64x64x128_MI16x16x1_SN_LDSB1_CLR1_GRVWA8_GRVWB16_GSU0_GSUC0_GSUWGMRR0_K1_LBSPPA256_LBSPPB256_LPA8_LPB16_LRVW8_MIWT2_2_PLR1_SU0_SUM0_SUS128_VWA2_VWB2_WGM6_WGMXCC1_WGMXCCGn1
    SolutionIndex: 78
    SolutionNameMin: Cijk_Alik_Bljk_F8B8NB8NS_BH_Bias_HAS_SAV_UserArgs_MT64x64x128_MI16x16x1_SN_LDSB1_CLR1_GRVWA8_GRVWB16_GSU0_GSUC0_GSUWGMRR0_K1_LBSPPA256_LBSPPB256_LPA8_LPB16_LRVW8_MIWT2_2_PLR1_SU0_SUM0_SUS128_VWA2_VWB2_WGM8_WGMXCC1_WGMXCCGn1
    SolutionIndex: 79
    SolutionNameMin: Cijk_Alik_Bljk_F8B8NB8NS_BH_Bias_HAS_SAV_UserArgs_MT32x64x128_MI16x16x1_SN_LDSB0_CLR1_GRVWA8_GRVWB8_GSU0_GSUC0_GSUWGMRR0_K1_LBSPPA128_LBSPPB256_LPA8_LPB8_LRVW8_MIWT1_2_PLR1_SU0_SUM0_SUS128_VWA1_VWB2_WGM1_WGMXCC1_WGMXCCGn1
    SolutionIndex: 80
    SolutionNameMin: Cijk_Alik_Bljk_F8B8NB8NS_BH_Bias_HAS_SAV_UserArgs_MT32x64x128_MI16x16x1_SN_LDSB0_CLR1_GRVWA8_GRVWB16_GSU0_GSUC0_GSUWGMRR0_K1_LBSPPA128_LBSPPB256_LPA8_LPB16_LRVW8_MIWT1_2_PLR1_SU0_SUM0_SUS128_VWA1_VWB2_WGM1_WGMXCC1_WGMXCCGn1
    SolutionIndex: 81
    SolutionNameMin: Cijk_Alik_Bljk_F8B8NB8NS_BH_Bias_HAS_SAV_UserArgs_MT32x64x128_MI16x16x1_SN_LDSB0_CLR1_GRVWA8_GRVWB8_GSU0_GSUC0_GSUWGMRR0_K1_LBSPPA128_LBSPPB256_LPA8_LPB8_LRVW8_MIWT1_2_PLR1_SU0_SUM0_SUS128_VWA1_VWB2_WGM6_WGMXCC1_WGMXCCGn1
    SolutionIndex: 82
    SolutionNameMin: Cijk_Alik_Bljk_F8B8NB8NS_BH_Bias_HAS_SAV_UserArgs_MT64x32x128_MI16x16x1_SN_LDSB0_CLR1_GRVWA8_GRVWB8_GSU0_GSUC0_GSUWGMRR0_K1_LBSPPA256_LBSPPB128_LPA8_LPB8_LRVW8_MIWT2_1_PLR1_SU0_SUM0_SUS128_VWA2_VWB1_WGM1_WGMXCC1_WGMXCCGn1
    SolutionIndex: 83
    SolutionNameMin: Cijk_Alik_Bljk_F8B8NB8NS_BH_Bias_HAS_SAV_UserArgs_MT64x32x128_MI16x16x1_SN_LDSB0_CLR1_GRVWA16_GRVWB8_GSU0_GSUC0_GSUWGMRR0_K1_LBSPPA256_LBSPPB128_LPA16_LPB8_LRVW8_MIWT2_1_PLR1_SU0_SUM0_SUS128_VWA2_VWB1_WGM1_WGMXCC1_WGMXCCGn1
    SolutionIndex: 84
    SolutionNameMin: Cijk_Alik_Bljk_F8B8NB8NS_BH_Bias_HAS_SAV_UserArgs_MT64x32x128_MI16x16x1_SN_LDSB0_CLR1_GRVWA8_GRVWB16_GSU0_GSUC0_GSUWGMRR0_K1_LBSPPA256_LBSPPB128_LPA8_LPB16_LRVW8_MIWT2_1_PLR1_SU0_SUM0_SUS128_VWA2_VWB1_WGM1_WGMXCC1_WGMXCCGn1
    SolutionIndex: 85
    SolutionNameMin: Cijk_Alik_Bljk_F8B8NB8NS_BH_Bias_HAS_SAV_UserArgs_MT64x32x128_MI16x16x1_SN_LDSB0_CLR1_GRVWA16_GRVWB16_GSU0_GSUC0_GSUWGMRR0_K1_LBSPPA256_LBSPPB128_LPA16_LPB16_LRVW8_MIWT2_1_PLR1_SU0_SUM0_SUS128_VWA2_VWB1_WGM1_WGMXCC1_WGMXCCGn1
    SolutionIndex: 86
    SolutionNameMin: Cijk_Alik_Bljk_F8B8NB8NS_BH_Bias_HAS_SAV_UserArgs_MT32x32x128_MI16x16x1_SN_LDSB0_CLR1_GRVWA8_GRVWB8_GSU0_GSUC0_GSUWGMRR0_K1_LBSPPA128_LBSPPB128_LPA8_LPB8_LRVW8_MIWT1_1_PLR1_SU0_SUM0_SUS128_VWA1_VWB1_WGM1_WGMXCC1_WGMXCCGn1
    SolutionIndex: 87
    SolutionNameMin: Cijk_Alik_Bljk_F8B8NB8NS_BH_Bias_HAS_SAV_UserArgs_MT32x32x128_MI16x16x1_SN_LDSB0_CLR1_GRVWA16_GRVWB8_GSU0_GSUC0_GSUWGMRR0_K1_LBSPPA128_LBSPPB128_LPA16_LPB8_LRVW8_MIWT1_1_PLR1_SU0_SUM0_SUS128_VWA1_VWB1_WGM1_WGMXCC1_WGMXCCGn1
    SolutionIndex: 88
    SolutionNameMin: Cijk_Alik_Bljk_F8B8NB8NS_BH_Bias_HAS_SAV_UserArgs_MT32x32x128_MI16x16x1_SN_LDSB0_CLR1_GRVWA8_GRVWB16_GSU0_GSUC0_GSUWGMRR0_K1_LBSPPA128_LBSPPB128_LPA8_LPB16_LRVW8_MIWT1_1_PLR1_SU0_SUM0_SUS128_VWA1_VWB1_WGM1_WGMXCC1_WGMXCCGn1
    SolutionIndex: 89
    SolutionNameMin: Cijk_Alik_Bljk_F8B8NB8NS_BH_Bias_HAS_SAV_UserArgs_MT32x32x128_MI16x16x1_SN_LDSB0_CLR1_GRVWA16_GRVWB16_GSU0_GSUC0_GSUWGMRR0_K1_LBSPPA128_LBSPPB128_LPA16_LPB16_LRVW8_MIWT1_1_PLR1_SU0_SUM0_SUS128_VWA1_VWB1_WGM1_WGMXCC1_WGMXCCGn1
    SolutionIndex: 90
    SolutionNameMin: Cijk_Alik_Bljk_F8B8NB8NS_BH_Bias_HAS_SAV_UserArgs_MT32x32x128_MI16x16x1_SN_LDSB0_CLR1_GRVWA8_GRVWB16_GSU0_GSUC0_GSUWGMRR0_K1_LBSPPA128_LBSPPB128_LPA8_LPB16_LRVW8_MIWT1_1_PLR1_SU0_SUM0_SUS128_VWA1_VWB1_WGM4_WGMXCC1_WGMXCCGn1
    SolutionIndex: 91
    SolutionNameMin: Cijk_Alik_Bljk_F8B8NB8NS_BH_Bias_HAS_SAV_UserArgs_MT32x32x128_MI16x16x1_SN_LDSB0_CLR1_GRVWA16_GRVWB16_GSU0_GSUC0_GSUWGMRR0_K1_LBSPPA128_LBSPPB128_LPA16_LPB16_LRVW8_MIWT1_1_PLR1_SU0_SUM0_SUS128_VWA1_VWB1_WGM4_WGMXCC1_WGMXCCGn1
    SolutionIndex: 92
    SolutionNameMin: Cijk_Alik_Bljk_F8B8NB8NS_BH_Bias_HAS_SAV_UserArgs_MT32x32x128_MI16x16x1_SN_LDSB0_CLR1_GRVWA8_GRVWB16_GSU0_GSUC0_GSUWGMRR0_K1_LBSPPA128_LBSPPB128_LPA8_LPB16_LRVW8_MIWT1_1_PLR1_SU0_SUM0_SUS128_VWA1_VWB1_WGM6_WGMXCC1_WGMXCCGn1
    SolutionIndex: 93
    SolutionNameMin: Cijk_Alik_Bljk_F8B8NB8NS_BH_Bias_HAS_SAV_UserArgs_MT32x32x128_MI16x16x1_SN_LDSB0_CLR1_GRVWA8_GRVWB8_GSU0_GSUC0_GSUWGMRR0_K1_LBSPPA128_LBSPPB128_LPA8_LPB8_LRVW8_MIWT1_1_PLR1_SU0_SUM0_SUS128_VWA1_VWB1_WGM8_WGMXCC1_WGMXCCGn1
    SolutionIndex: 94
    SolutionNameMin: Cijk_Alik_Bljk_F8B8NB8NS_BH_Bias_HAS_SAV_UserArgs_MT32x32x128_MI16x16x1_SN_LDSB0_CLR1_GRVWA16_GRVWB16_GSU0_GSUC0_GSUWGMRR0_K1_LBSPPA128_LBSPPB128_LPA16_LPB16_LRVW8_MIWT1_1_PLR1_SU0_SUM0_SUS128_VWA1_VWB1_WGM8_WGMXCC1_WGMXCCGn1
    SolutionIndex: 95
    SolutionNameMin: Cijk_Alik_Bljk_F8B8NB8NS_BH_Bias_HAS_SAV_UserArgs_MT128x64x256_MI16x16x1_SN_LDSB1_CLR1_GRVWA8_GRVWB8_GSU0_GSUC0_GSUWGMRR0_K1_LBSPPA1024_LBSPPB512_LPA8_LPB8_LRVW8_MIWT4_2_PLR1_SU0_SUM0_SUS256_VWA4_VWB2_WGM1_WGMXCC1_WGMXCCGn1
    SolutionIndex: 96
    SolutionNameMin: Cijk_Alik_Bljk_F8B8NB8NS_BH_Bias_HAS_SAV_UserArgs_MT128x64x256_MI16x16x1_SN_LDSB1_CLR1_GRVWA8_GRVWB16_GSU0_GSUC0_GSUWGMRR0_K1_LBSPPA1024_LBSPPB512_LPA8_LPB16_LRVW8_MIWT4_2_PLR1_SU0_SUM0_SUS256_VWA4_VWB2_WGM1_WGMXCC1_WGMXCCGn1
    SolutionIndex: 97
    SolutionNameMin: Cijk_Alik_Bljk_F8B8NB8NS_BH_Bias_HAS_SAV_UserArgs_MT128x64x256_MI16x16x1_SN_LDSB1_CLR1_GRVWA8_GRVWB16_GSU0_GSUC0_GSUWGMRR0_K1_LBSPPA1024_LBSPPB512_LPA8_LPB16_LRVW8_MIWT4_2_PLR1_SU0_SUM0_SUS256_VWA4_VWB2_WGM4_WGMXCC1_WGMXCCGn1
    SolutionIndex: 98
    SolutionNameMin: Cijk_Alik_Bljk_F8B8NB8NS_BH_Bias_HAS_SAV_UserArgs_MT128x64x256_MI16x16x1_SN_LDSB1_CLR1_GRVWA8_GRVWB16_GSU0_GSUC0_GSUWGMRR0_K1_LBSPPA1024_LBSPPB512_LPA8_LPB16_LRVW8_MIWT4_2_PLR1_SU0_SUM0_SUS256_VWA4_VWB2_WGM6_WGMXCC1_WGMXCCGn1
    SolutionIndex: 99
    SolutionNameMin: Cijk_Alik_Bljk_F8B8NB8NS_BH_Bias_HAS_SAV_UserArgs_MT128x64x256_MI16x16x1_SN_LDSB1_CLR1_GRVWA8_GRVWB16_GSU0_GSUC0_GSUWGMRR0_K1_LBSPPA1024_LBSPPB512_LPA8_LPB16_LRVW8_MIWT4_2_PLR1_SU0_SUM0_SUS256_VWA4_VWB2_WGM8_WGMXCC1_WGMXCCGn1
    SolutionIndex: 100
    SolutionNameMin: Cijk_Alik_Bljk_F8B8NB8NS_BH_Bias_HAS_SAV_UserArgs_MT64x64x256_MI16x16x1_SN_LDSB1_CLR1_GRVWA8_GRVWB16_GSU0_GSUC0_GSUWGMRR0_K1_LBSPPA512_LBSPPB512_LPA8_LPB16_LRVW8_MIWT2_2_PLR1_SU0_SUM0_SUS256_VWA2_VWB2_WGM1_WGMXCC1_WGMXCCGn1
    SolutionIndex: 101
    SolutionNameMin: Cijk_Alik_Bljk_F8B8NB8NS_BH_Bias_HAS_SAV_UserArgs_MT64x64x256_MI16x16x1_SN_LDSB1_CLR1_GRVWA8_GRVWB16_GSU0_GSUC0_GSUWGMRR0_K1_LBSPPA512_LBSPPB512_LPA8_LPB16_LRVW8_MIWT2_2_PLR1_SU0_SUM0_SUS256_VWA2_VWB2_WGM6_WGMXCC1_WGMXCCGn1
    SolutionIndex: 102
    SolutionNameMin: Cijk_Alik_Bljk_F8B8NB8NS_BH_Bias_HAS_SAV_UserArgs_MT32x32x256_MI16x16x1_SN_LDSB1_CLR1_GRVWA8_GRVWB16_GSU0_GSUC0_GSUWGMRR0_K1_LBSPPA256_LBSPPB256_LPA8_LPB16_LRVW8_MIWT1_1_PLR1_SU0_SUM0_SUS256_VWA1_VWB1_WGM1_WGMXCC1_WGMXCCGn1
    SolutionIndex: 103
    SolutionNameMin: Cijk_Alik_Bljk_F8B8NB8NS_BH_Bias_HAS_SAV_UserArgs_MT32x32x256_MI16x16x1_SN_LDSB1_CLR1_GRVWA8_GRVWB8_GSU0_GSUC0_GSUWGMRR0_K1_LBSPPA256_LBSPPB256_LPA8_LPB8_LRVW8_MIWT1_1_PLR1_SU0_SUM0_SUS256_VWA1_VWB1_WGM4_WGMXCC1_WGMXCCGn1
    SolutionIndex: 104
    SolutionNameMin: Cijk_Alik_Bljk_F8B8NB8NS_BH_Bias_HAS_SAV_UserArgs_MT32x32x256_MI16x16x1_SN_LDSB1_CLR1_GRVWA8_GRVWB16_GSU0_GSUC0_GSUWGMRR0_K1_LBSPPA256_LBSPPB256_LPA8_LPB16_LRVW8_MIWT1_1_PLR1_SU0_SUM0_SUS256_VWA1_VWB1_WGM8_WGMXCC1_WGMXCCGn1
    SolutionIndex: 105
    SolutionNameMin: Cijk_Alik_Bljk_F8B8NB8NS_BH_Bias_HAS_SAV_UserArgs_MT64x32x32_MI16x16x1_SN_LDSB0_CLR0_GRVWA4_GRVWB4_GSU0_GSUC0_GSUWGMRR0_K1_LBSPPA128_LBSPPB128_LPA8_LPB8_LRVW8_MIWT2_1_PLR0_SU32_SUM0_SUS256_VWA2_VWB1_WGM4_WGMXCC1_WGMXCCGn1
- - - [128, 128, 1, 128, 128, 128, 128, 128]
    - [90, 0.57]
  - - [128, 128, 1, 256, 128, 128, 256, 256]
    - [33, 1.13]
  - - [128, 128, 1, 512, 128, 128, 512, 512]
    - [87, 2.0]
  - - [128, 128, 1, 1024, 128, 128, 1024, 1024]
    - [88, 3.42]
  - - [128, 128, 1, 2048, 128, 128, 2048, 2048]
    - [86, 5.2]
  - - [128, 128, 1, 4096, 128, 128, 4096, 4096]
    - [86, 7.13]
  - - [128, 128, 1, 8192, 128, 128, 8192, 8192]
    - [86, 8.65]
  - - [128, 256, 1, 128, 128, 128, 128, 128]
    - [34, 1.13]
  - - [128, 256, 1, 256, 128, 128, 256, 256]
    - [88, 2.19]
  - - [128, 256, 1, 512, 128, 128, 512, 512]
    - [87, 3.99]
  - - [128, 256, 1, 1024, 128, 128, 1024, 1024]
    - [86, 6.94]
  - - [128, 256, 1, 2048, 128, 128, 2048, 2048]
    - [86, 10.59]
  - - [128, 256, 1, 4096, 128, 128, 4096, 4096]
    - [86, 14.3]
  - - [128, 256, 1, 8192, 128, 128, 8192, 8192]
    - [86, 17.25]
  - - [128, 512, 1, 128, 128, 128, 128, 128]
    - [91, 2.33]
  - - [128, 512, 1, 256, 128, 128, 256, 256]
    - [87, 4.54]
  - - [128, 512, 1, 512, 128, 128, 512, 512]
    - [86, 8.19]
  - - [128, 512, 1, 1024, 128, 128, 1024, 1024]
    - [86, 13.75]
  - - [128, 512, 1, 2048, 128, 128, 2048, 2048]
    - [86, 21.0]
  - - [128, 512, 1, 4096, 128, 128, 4096, 4096]
    - [86, 28.33]
  - - [128, 512, 1, 8192, 128, 128, 8192, 8192]
    - [86, 34.23]
  - - [128, 1024, 1, 128, 128, 128, 128, 128]
    - [33, 4.68]
  - - [128, 1024, 1, 256, 128, 128, 256, 256]
    - [33, 8.75]
  - - [128, 1024, 1, 512, 128, 128, 512, 512]
    - [88, 16.08]
  - - [128, 1024, 1, 1024, 128, 128, 1024, 1024]
    - [86, 27.1]
  - - [128, 1024, 1, 2048, 128, 128, 2048, 2048]
    - [86, 41.25]
  - - [128, 1024, 1, 4096, 128, 128, 4096, 4096]
    - [86, 55.79]
  - - [128, 1024, 1, 8192, 128, 128, 8192, 8192]
    - [86, 67.55]
  - - [128, 2048, 1, 128, 128, 128, 128, 128]
    - [31, 9.22]
  - - [128, 2048, 1, 256, 128, 128, 256, 256]
    - [31, 16.63]
  - - [128, 2048, 1, 512, 128, 128, 512, 512]
    - [83, 29.12]
  - - [128, 2048, 1, 1024, 128, 128, 1024, 1024]
    - [80, 47.0]
  - - [128, 2048, 1, 2048, 128, 128, 2048, 2048]
    - [79, 69.07]
  - - [128, 2048, 1, 4096, 128, 128, 4096, 4096]
    - [79, 89.03]
  - - [128, 2048, 1, 8192, 128, 128, 8192, 8192]
    - [82, 99.5]
  - - [128, 4096, 1, 128, 128, 128, 128, 128]
    - [25, 16.24]
  - - [128, 4096, 1, 256, 128, 128, 256, 256]
    - [24, 29.96]
  - - [128, 4096, 1, 512, 128, 128, 512, 512]
    - [76, 49.94]
  - - [128, 4096, 1, 1024, 128, 128, 1024, 1024]
    - [75, 76.96]
  - - [128, 4096, 1, 2048, 128, 128, 2048, 2048]
    - [76, 106.07]
  - - [128, 4096, 1, 4096, 128, 128, 4096, 4096]
    - [76, 131.06]
  - - [128, 4096, 1, 8192, 128, 128, 8192, 8192]
    - [100, 142.41]
  - - [128, 8192, 1, 128, 128, 128, 128, 128]
    - [72, 27.85]
  - - [128, 8192, 1, 256, 128, 128, 256, 256]
    - [20, 50.65]
  - - [128, 8192, 1, 512, 128, 128, 512, 512]
    - [20, 82.77]
  - - [128, 8192, 1, 1024, 128, 128, 1024, 1024]
    - [20, 124.27]
  - - [128, 8192, 1, 2048, 128, 128, 2048, 2048]
    - [20, 162.8]
  - - [128, 8192, 1, 4096, 128, 128, 4096, 4096]
    - [75, 166.93]
  - - [128, 8192, 1, 8192, 128, 128, 8192, 8192]
    - [97, 187.0]
  - - [256, 128, 1, 128, 256, 256, 128, 128]
    - [89, 1.06]
  - - [256, 128, 1, 256, 256, 256, 256, 256]
    - [94, 2.14]
  - - [256, 128, 1, 512, 256, 256, 512, 512]
    - [102, 3.95]
  - - [256, 128, 1, 1024, 256, 256, 1024, 1024]
    - [88, 6.78]
  - - [256, 128, 1, 2048, 256, 256, 2048, 2048]
    - [86, 10.49]
  - - [256, 128, 1, 4096, 256, 256, 4096, 4096]
    - [86, 14.3]
  - - [256, 128, 1, 8192, 256, 256, 8192, 8192]
    - [86, 17.18]
  - - [256, 256, 1, 128, 256, 256, 128, 128]
    - [30, 2.22]
  - - [256, 256, 1, 256, 256, 256, 256, 256]
    - [103, 4.19]
  - - [256, 256, 1, 512, 256, 256, 512, 512]
    - [92, 7.78]
  - - [256, 256, 1, 1024, 256, 256, 1024, 1024]
    - [86, 12.94]
  - - [256, 256, 1, 2048, 256, 256, 2048, 2048]
    - [86, 19.77]
  - - [256, 256, 1, 4096, 256, 256, 4096, 4096]
    - [86, 27.38]
  - - [256, 256, 1, 8192, 256, 256, 8192, 8192]
    - [86, 33.54]
  - - [256, 512, 1, 128, 256, 256, 128, 128]
    - [31, 4.11]
  - - [256, 512, 1, 256, 256, 256, 256, 256]
    - [102, 7.98]
  - - [256, 512, 1, 512, 256, 256, 512, 512]
    - [88, 15.83]
  - - [256, 512, 1, 1024, 256, 256, 1024, 1024]
    - [86, 26.76]
  - - [256, 512, 1, 2048, 256, 256, 2048, 2048]
    - [86, 40.66]
  - - [256, 512, 1, 4096, 256, 256, 4096, 4096]
    - [86, 55.54]
  - - [256, 512, 1, 8192, 256, 256, 8192, 8192]
    - [86, 67.13]
  - - [256, 1024, 1, 128, 256, 256, 128, 128]
    - [31, 8.62]
  - - [256, 1024, 1, 256, 256, 256, 256, 256]
    - [31, 16.43]
  - - [256, 1024, 1, 512, 256, 256, 512, 512]
    - [82, 28.79]
  - - [256, 1024, 1, 1024, 256, 256, 1024, 1024]
    - [80, 46.87]
  - - [256, 1024, 1, 2048, 256, 256, 2048, 2048]
    - [79, 68.1]
  - - [256, 1024, 1, 4096, 256, 256, 4096, 4096]
    - [79, 88.56]
  - - [256, 1024, 1, 8192, 256, 256, 8192, 8192]
    - [82, 102.2]
  - - [256, 2048, 1, 128, 256, 256, 128, 128]
    - [76, 16.47]
  - - [256, 2048, 1, 256, 256, 256, 256, 256]
    - [25, 29.26]
  - - [256, 2048, 1, 512, 256, 256, 512, 512]
    - [24, 50.53]
  - - [256, 2048, 1, 1024, 256, 256, 1024, 1024]
    - [74, 74.95]
  - - [256, 2048, 1, 2048, 256, 256, 2048, 2048]
    - [76, 104.53]
  - - [256, 2048, 1, 4096, 256, 256, 4096, 4096]
    - [76, 129.6]
  - - [256, 2048, 1, 8192, 256, 256, 8192, 8192]
    - [100, 142.59]
  - - [256, 4096, 1, 128, 256, 256, 128, 128]
    - [71, 27.44]
  - - [256, 4096, 1, 256, 256, 256, 256, 256]
    - [19, 49.72]
  - - [256, 4096, 1, 512, 256, 256, 512, 512]
    - [20, 83.21]
  - - [256, 4096, 1, 1024, 256, 256, 1024, 1024]
    - [22, 121.49]
  - - [256, 4096, 1, 2048, 256, 256, 2048, 2048]
    - [20, 162.09]
  - - [256, 4096, 1, 4096, 256, 256, 4096, 4096]
    - [96, 179.33]
  - - [256, 4096, 1, 8192, 256, 256, 8192, 8192]
    - [68, 192.82]
  - - [256, 8192, 1, 128, 256, 256, 128, 128]
    - [11, 44.55]
  - - [256, 8192, 1, 256, 256, 256, 256, 256]
    - [11, 78.24]
  - - [256, 8192, 1, 512, 256, 256, 512, 512]
    - [11, 127.52]
  - - [256, 8192, 1, 1024, 256, 256, 1024, 1024]
    - [11, 183.54]
  - - [256, 8192, 1, 2048, 256, 256, 2048, 2048]
    - [54, 229.11]
  - - [256, 8192, 1, 4096, 256, 256, 4096, 4096]
    - [73, 225.07]
  - - [256, 8192, 1, 8192, 256, 256, 8192, 8192]
    - [64, 251.98]
  - - [512, 128, 1, 128, 512, 512, 128, 128]
    - [89, 2.48]
  - - [512, 128, 1, 256, 512, 512, 256, 256]
    - [89, 4.62]
  - - [512, 128, 1, 512, 512, 512, 512, 512]
    - [86, 8.15]
  - - [512, 128, 1, 1024, 512, 512, 1024, 1024]
    - [88, 13.75]
  - - [512, 128, 1, 2048, 512, 512, 2048, 2048]
    - [86, 20.97]
  - - [512, 128, 1, 4096, 512, 512, 4096, 4096]
    - [86, 28.31]
  - - [512, 128, 1, 8192, 512, 512, 8192, 8192]
    - [86, 34.4]
  - - [512, 256, 1, 128, 512, 512, 128, 128]
    - [33, 4.79]
  - - [512, 256, 1, 256, 512, 512, 256, 256]
    - [88, 9.05]
  - - [512, 256, 1, 512, 512, 512, 512, 512]
    - [89, 16.15]
  - - [512, 256, 1, 1024, 512, 512, 1024, 1024]
    - [86, 27.35]
  - - [512, 256, 1, 2048, 512, 512, 2048, 2048]
    - [86, 40.9]
  - - [512, 256, 1, 4096, 512, 512, 4096, 4096]
    - [86, 55.26]
  - - [512, 256, 1, 8192, 512, 512, 8192, 8192]
    - [93, 67.01]
  - - [512, 512, 1, 128, 512, 512, 128, 128]
    - [32, 9.2]
  - - [512, 512, 1, 256, 512, 512, 256, 256]
    - [84, 16.79]
  - - [512, 512, 1, 512, 512, 512, 512, 512]
    - [83, 29.23]
  - - [512, 512, 1, 1024, 512, 512, 1024, 1024]
    - [82, 47.6]
  - - [512, 512, 1, 2048, 512, 512, 2048, 2048]
    - [82, 68.91]
  - - [512, 512, 1, 4096, 512, 512, 4096, 4096]
    - [79, 89.01]
  - - [512, 512, 1, 8192, 512, 512, 8192, 8192]
    - [104, 97.58]
  - - [512, 1024, 1, 128, 512, 512, 128, 128]
    - [24, 16.28]
  - - [512, 1024, 1, 256, 512, 512, 256, 256]
    - [25, 29.08]
  - - [512, 1024, 1, 512, 512, 512, 512, 512]
    - [24, 48.68]
  - - [512, 1024, 1, 1024, 512, 512, 1024, 1024]
    - [76, 75.65]
  - - [512, 1024, 1, 2048, 512, 512, 2048, 2048]
    - [76, 104.64]
  - - [512, 1024, 1, 4096, 512, 512, 4096, 4096]
    - [76, 129.76]
  - - [512, 1024, 1, 8192, 512, 512, 8192, 8192]
    - [100, 142.09]
  - - [512, 2048, 1, 128, 512, 512, 128, 128]
    - [72, 27.76]
  - - [512, 2048, 1, 256, 512, 512, 256, 256]
    - [20, 49.83]
  - - [512, 2048, 1, 512, 512, 512, 512, 512]
    - [20, 82.99]
  - - [512, 2048, 1, 1024, 512, 512, 1024, 1024]
    - [20, 121.43]
  - - [512, 2048, 1, 2048, 512, 512, 2048, 2048]
    - [20, 160.77]
  - - [512, 2048, 1, 4096, 512, 512, 4096, 4096]
    - [20, 193.62]
  - - [512, 2048, 1, 8192, 512, 512, 8192, 8192]
    - [95, 191.99]
  - - [512, 4096, 1, 128, 512, 512, 128, 128]
    - [54, 43.85]
  - - [512, 4096, 1, 256, 512, 512, 256, 256]
    - [14, 76.53]
  - - [512, 4096, 1, 512, 512, 512, 512, 512]
    - [11, 127.62]
  - - [512, 4096, 1, 1024, 512, 512, 1024, 1024]
    - [14, 182.91]
  - - [512, 4096, 1, 2048, 512, 512, 2048, 2048]
    - [54, 237.8]
  - - [512, 4096, 1, 4096, 512, 512, 4096, 4096]
    - [63, 232.42]
  - - [512, 4096, 1, 8192, 512, 512, 8192, 8192]
    - [62, 260.07]
  - - [512, 8192, 1, 128, 512, 512, 128, 128]
    - [58, 66.01]
  - - [512, 8192, 1, 256, 512, 512, 256, 256]
    - [58, 117.17]
  - - [512, 8192, 1, 512, 512, 512, 512, 512]
    - [58, 189.76]
  - - [512, 8192, 1, 1024, 512, 512, 1024, 1024]
    - [59, 267.75]
  - - [512, 8192, 1, 2048, 512, 512, 2048, 2048]
    - [46, 256.38]
  - - [512, 8192, 1, 4096, 512, 512, 4096, 4096]
    - [59, 285.8]
  - - [512, 8192, 1, 8192, 512, 512, 8192, 8192]
    - [58, 290.71]
  - - [1024, 128, 1, 128, 1024, 1024, 128, 128]
    - [88, 4.84]
  - - [1024, 128, 1, 256, 1024, 1024, 256, 256]
    - [89, 8.98]
  - - [1024, 128, 1, 512, 1024, 1024, 512, 512]
    - [88, 16.25]
  - - [1024, 128, 1, 1024, 1024, 1024, 1024, 1024]
    - [86, 26.87]
  - - [1024, 128, 1, 2048, 1024, 1024, 2048, 2048]
    - [86, 40.66]
  - - [1024, 128, 1, 4096, 1024, 1024, 4096, 4096]
    - [93, 54.73]
  - - [1024, 128, 1, 8192, 1024, 1024, 8192, 8192]
    - [93, 67.2]
  - - [1024, 256, 1, 128, 1024, 1024, 128, 128]
    - [31, 9.02]
  - - [1024, 256, 1, 256, 1024, 1024, 256, 256]
    - [31, 16.76]
  - - [1024, 256, 1, 512, 1024, 1024, 512, 512]
    - [85, 29.31]
  - - [1024, 256, 1, 1024, 1024, 1024, 1024, 1024]
    - [84, 46.9]
  - - [1024, 256, 1, 2048, 1024, 1024, 2048, 2048]
    - [79, 68.29]
  - - [1024, 256, 1, 4096, 1024, 1024, 4096, 4096]
    - [79, 87.98]
  - - [1024, 256, 1, 8192, 1024, 1024, 8192, 8192]
    - [81, 102.54]
  - - [1024, 512, 1, 128, 1024, 1024, 128, 128]
    - [26, 16.5]
  - - [1024, 512, 1, 256, 1024, 1024, 256, 256]
    - [24, 29.73]
  - - [1024, 512, 1, 512, 1024, 1024, 512, 512]
    - [26, 49.51]
  - - [1024, 512, 1, 1024, 1024, 1024, 1024, 1024]
    - [76, 76.4]
  - - [1024, 512, 1, 2048, 1024, 1024, 2048, 2048]
    - [76, 105.77]
  - - [1024, 512, 1, 4096, 1024, 1024, 4096, 4096]
    - [78, 129.7]
  - - [1024, 512, 1, 8192, 1024, 1024, 8192, 8192]
    - [100, 142.16]
  - - [1024, 1024, 1, 128, 1024, 1024, 128, 128]
    - [13, 28.27]
  - - [1024, 1024, 1, 256, 1024, 1024, 256, 256]
    - [18, 50.34]
  - - [1024, 1024, 1, 512, 1024, 1024, 512, 512]
    - [20, 84.17]
  - - [1024, 1024, 1, 1024, 1024, 1024, 1024, 1024]
    - [20, 124.6]
  - - [1024, 1024, 1, 2048, 1024, 1024, 2048, 2048]
    - [20, 161.8]
  - - [1024, 1024, 1, 4096, 1024, 1024, 4096, 4096]
    - [99, 176.18]
  - - [1024, 1024, 1, 8192, 1024, 1024, 8192, 8192]
    - [96, 192.33]
  - - [1024, 2048, 1, 128, 1024, 1024, 128, 128]
    - [11, 43.67]
  - - [1024, 2048, 1, 256, 1024, 1024, 256, 256]
    - [11, 78.43]
  - - [1024, 2048, 1, 512, 1024, 1024, 512, 512]
    - [11, 128.4]
  - - [1024, 2048, 1, 1024, 1024, 1024, 1024, 1024]
    - [11, 183.28]
  - - [1024, 2048, 1, 2048, 1024, 1024, 2048, 2048]
    - [54, 236.34]
  - - [1024, 2048, 1, 4096, 1024, 1024, 4096, 4096]
    - [62, 231.19]
  - - [1024, 2048, 1, 8192, 1024, 1024, 8192, 8192]
    - [64, 252.62]
  - - [1024, 4096, 1, 128, 1024, 1024, 128, 128]
    - [8, 61.42]
  - - [1024, 4096, 1, 256, 1024, 1024, 256, 256]
    - [8, 107.15]
  - - [1024, 4096, 1, 512, 1024, 1024, 512, 512]
    - [8, 170.17]
  - - [1024, 4096, 1, 1024, 1024, 1024, 1024, 1024]
    - [8, 238.65]
  - - [1024, 4096, 1, 2048, 1024, 1024, 2048, 2048]
    - [46, 264.96]
  - - [1024, 4096, 1, 4096, 1024, 1024, 4096, 4096]
    - [46, 270.22]
  - - [1024, 4096, 1, 8192, 1024, 1024, 8192, 8192]
    - [46, 259.49]
  - - [1024, 8192, 1, 128, 1024, 1024, 128, 128]
    - [39, 91.03]
  - - [1024, 8192, 1, 256, 1024, 1024, 256, 256]
    - [39, 159.48]
  - - [1024, 8192, 1, 512, 1024, 1024, 512, 512]
    - [39, 245.97]
  - - [1024, 8192, 1, 1024, 1024, 1024, 1024, 1024]
    - [39, 280.42]
  - - [1024, 8192, 1, 2048, 1024, 1024, 2048, 2048]
    - [41, 323.79]
  - - [1024, 8192, 1, 4096, 1024, 1024, 4096, 4096]
    - [44, 345.94]
  - - [1024, 8192, 1, 8192, 1024, 1024, 8192, 8192]
    - [38, 362.45]
  - - [2048, 128, 1, 128, 2048, 2048, 128, 128]
    - [30, 8.55]
  - - [2048, 128, 1, 256, 2048, 2048, 256, 256]
    - [84, 16.35]
  - - [2048, 128, 1, 512, 2048, 2048, 512, 512]
    - [85, 29.33]
  - - [2048, 128, 1, 1024, 2048, 2048, 1024, 1024]
    - [84, 47.17]
  - - [2048, 128, 1, 2048, 2048, 2048, 2048, 2048]
    - [82, 68.32]
  - - [2048, 128, 1, 4096, 2048, 2048, 4096, 4096]
    - [79, 88.1]
  - - [2048, 128, 1, 8192, 2048, 2048, 8192, 8192]
    - [81, 101.37]
  - - [2048, 256, 1, 128, 2048, 2048, 128, 128]
    - [27, 16.35]
  - - [2048, 256, 1, 256, 2048, 2048, 256, 256]
    - [24, 29.55]
  - - [2048, 256, 1, 512, 2048, 2048, 512, 512]
    - [24, 49.56]
  - - [2048, 256, 1, 1024, 2048, 2048, 1024, 1024]
    - [76, 75.9]
  - - [2048, 256, 1, 2048, 2048, 2048, 2048, 2048]
    - [76, 105.0]
  - - [2048, 256, 1, 4096, 2048, 2048, 4096, 4096]
    - [77, 129.34]
  - - [2048, 256, 1, 8192, 2048, 2048, 8192, 8192]
    - [101, 142.14]
  - - [2048, 512, 1, 128, 2048, 2048, 128, 128]
    - [72, 27.6]
  - - [2048, 512, 1, 256, 2048, 2048, 256, 256]
    - [19, 50.41]
  - - [2048, 512, 1, 512, 2048, 2048, 512, 512]
    - [20, 83.87]
  - - [2048, 512, 1, 1024, 2048, 2048, 1024, 1024]
    - [20, 122.4]
  - - [2048, 512, 1, 2048, 2048, 2048, 2048, 2048]
    - [22, 159.75]
  - - [2048, 512, 1, 4096, 2048, 2048, 4096, 4096]
    - [69, 180.6]
  - - [2048, 512, 1, 8192, 2048, 2048, 8192, 8192]
    - [97, 194.96]
  - - [2048, 1024, 1, 128, 2048, 2048, 128, 128]
    - [54, 43.46]
  - - [2048, 1024, 1, 256, 2048, 2048, 256, 256]
    - [11, 78.84]
  - - [2048, 1024, 1, 512, 2048, 2048, 512, 512]
    - [11, 127.43]
  - - [2048, 1024, 1, 1024, 2048, 2048, 1024, 1024]
    - [11, 183.71]
  - - [2048, 1024, 1, 2048, 2048, 2048, 2048, 2048]
    - [55, 231.89]
  - - [2048, 1024, 1, 4096, 2048, 2048, 4096, 4096]
    - [55, 236.15]
  - - [2048, 1024, 1, 8192, 2048, 2048, 8192, 8192]
    - [65, 254.94]
  - - [2048, 2048, 1, 128, 2048, 2048, 128, 128]
    - [8, 60.93]
  - - [2048, 2048, 1, 256, 2048, 2048, 256, 256]
    - [8, 106.82]
  - - [2048, 2048, 1, 512, 2048, 2048, 512, 512]
    - [8, 170.57]
  - - [2048, 2048, 1, 1024, 2048, 2048, 1024, 1024]
    - [8, 237.95]
  - - [2048, 2048, 1, 2048, 2048, 2048, 2048, 2048]
    - [36, 256.56]
  - - [2048, 2048, 1, 4096, 2048, 2048, 4096, 4096]
    - [48, 268.75]
  - - [2048, 2048, 1, 8192, 2048, 2048, 8192, 8192]
    - [48, 262.75]
  - - [2048, 4096, 1, 128, 2048, 2048, 128, 128]
    - [2, 75.68]
  - - [2048, 4096, 1, 256, 2048, 2048, 256, 256]
    - [2, 129.28]
  - - [2048, 4096, 1, 512, 2048, 2048, 512, 512]
    - [0, 187.26]
  - - [2048, 4096, 1, 1024, 2048, 2048, 1024, 1024]
    - [6, 249.62]
  - - [2048, 4096, 1, 2048, 2048, 2048, 2048, 2048]
    - [4, 276.02]
  - - [2048, 4096, 1, 4096, 2048, 2048, 4096, 4096]
    - [45, 282.64]
  - - [2048, 4096, 1, 8192, 2048, 2048, 8192, 8192]
    - [45, 315.9]
  - - [2048, 8192, 1, 128, 2048, 2048, 128, 128]
    - [39, 99.44]
  - - [2048, 8192, 1, 256, 2048, 2048, 256, 256]
    - [45, 165.7]
  - - [2048, 8192, 1, 512, 2048, 2048, 512, 512]
    - [39, 241.99]
  - - [2048, 8192, 1, 1024, 2048, 2048, 1024, 1024]
    - [39, 291.05]
  - - [2048, 8192, 1, 2048, 2048, 2048, 2048, 2048]
    - [38, 330.31]
  - - [2048, 8192, 1, 4096, 2048, 2048, 4096, 4096]
    - [42, 326.25]
  - - [2048, 8192, 1, 8192, 2048, 2048, 8192, 8192]
    - [44, 370.3]
  - - [4096, 128, 1, 128, 4096, 4096, 128, 128]
    - [28, 15.67]
  - - [4096, 128, 1, 256, 4096, 4096, 256, 256]
    - [24, 28.86]
  - - [4096, 128, 1, 512, 4096, 4096, 512, 512]
    - [29, 47.85]
  - - [4096, 128, 1, 1024, 4096, 4096, 1024, 1024]
    - [76, 75.71]
  - - [4096, 128, 1, 2048, 4096, 4096, 2048, 2048]
    - [76, 104.39]
  - - [4096, 128, 1, 4096, 4096, 4096, 4096, 4096]
    - [77, 129.19]
  - - [4096, 128, 1, 8192, 4096, 4096, 8192, 8192]
    - [101, 141.87]
  - - [4096, 256, 1, 128, 4096, 4096, 128, 128]
    - [17, 27.42]
  - - [4096, 256, 1, 256, 4096, 4096, 256, 256]
    - [21, 48.55]
  - - [4096, 256, 1, 512, 4096, 4096, 512, 512]
    - [21, 81.76]
  - - [4096, 256, 1, 1024, 4096, 4096, 1024, 1024]
    - [21, 122.73]
  - - [4096, 256, 1, 2048, 4096, 4096, 2048, 2048]
    - [22, 159.91]
  - - [4096, 256, 1, 4096, 4096, 4096, 4096, 4096]
    - [70, 177.82]
  - - [4096, 256, 1, 8192, 4096, 4096, 8192, 8192]
    - [98, 194.8]
  - - [4096, 512, 1, 128, 4096, 4096, 128, 128]
    - [15, 43.66]
  - - [4096, 512, 1, 256, 4096, 4096, 256, 256]
    - [11, 77.69]
  - - [4096, 512, 1, 512, 4096, 4096, 512, 512]
    - [11, 126.66]
  - - [4096, 512, 1, 1024, 4096, 4096, 1024, 1024]
    - [11, 182.77]
  - - [4096, 512, 1, 2048, 4096, 4096, 2048, 2048]
    - [57, 229.66]
  - - [4096, 512, 1, 4096, 4096, 4096, 4096, 4096]
    - [55, 236.99]
  - - [4096, 512, 1, 8192, 4096, 4096, 8192, 8192]
    - [65, 254.69]
  - - [4096, 1024, 1, 128, 4096, 4096, 128, 128]
    - [8, 61.08]
  - - [4096, 1024, 1, 256, 4096, 4096, 256, 256]
    - [8, 106.99]
  - - [4096, 1024, 1, 512, 4096, 4096, 512, 512]
    - [8, 169.78]
  - - [4096, 1024, 1, 1024, 4096, 4096, 1024, 1024]
    - [9, 231.44]
  - - [4096, 1024, 1, 2048, 4096, 4096, 2048, 2048]
    - [49, 268.53]
  - - [4096, 1024, 1, 4096, 4096, 4096, 4096, 4096]
    - [47, 272.21]
  - - [4096, 1024, 1, 8192, 4096, 4096, 8192, 8192]
    - [60, 263.88]
  - - [4096, 2048, 1, 128, 4096, 4096, 128, 128]
    - [1, 75.65]
  - - [4096, 2048, 1, 256, 4096, 4096, 256, 256]
    - [4, 127.73]
  - - [4096, 2048, 1, 512, 4096, 4096, 512, 512]
    - [2, 189.41]
  - - [4096, 2048, 1, 1024, 4096, 4096, 1024, 1024]
    - [6, 251.52]
  - - [4096, 2048, 1, 2048, 4096, 4096, 2048, 2048]
    - [7, 277.66]
  - - [4096, 2048, 1, 4096, 4096, 4096, 4096, 4096]
    - [35, 282.89]
  - - [4096, 2048, 1, 8192, 4096, 4096, 8192, 8192]
    - [50, 309.25]
  - - [4096, 4096, 1, 128, 4096, 4096, 128, 128]
    - [6, 82.67]
  - - [4096, 4096, 1, 256, 4096, 4096, 256, 256]
    - [6, 139.12]
  - - [4096, 4096, 1, 512, 4096, 4096, 512, 512]
    - [6, 198.21]
  - - [4096, 4096, 1, 1024, 4096, 4096, 1024, 1024]
    - [7, 241.11]
  - - [4096, 4096, 1, 2048, 4096, 4096, 2048, 2048]
    - [44, 277.25]
  - - [4096, 4096, 1, 4096, 4096, 4096, 4096, 4096]
    - [44, 284.17]
  - - [4096, 4096, 1, 8192, 4096, 4096, 8192, 8192]
    - [37, 329.41]
  - - [4096, 8192, 1, 128, 4096, 4096, 128, 128]
    - [45, 108.77]
  - - [4096, 8192, 1, 256, 4096, 4096, 256, 256]
    - [39, 181.93]
  - - [4096, 8192, 1, 512, 4096, 4096, 512, 512]
    - [38, 239.62]
  - - [4096, 8192, 1, 1024, 4096, 4096, 1024, 1024]
    - [44, 273.32]
  - - [4096, 8192, 1, 2048, 4096, 4096, 2048, 2048]
    - [40, 307.61]
  - - [4096, 8192, 1, 4096, 4096, 4096, 4096, 4096]
    - [42, 338.69]
  - - [4096, 8192, 1, 8192, 4096, 4096, 8192, 8192]
    - [44, 387.92]
  - - [8192, 128, 1, 128, 8192, 8192, 128, 128]
    - [13, 28.08]
  - - [8192, 128, 1, 256, 8192, 8192, 256, 256]
    - [20, 51.15]
  - - [8192, 128, 1, 512, 8192, 8192, 512, 512]
    - [20, 82.34]
  - - [8192, 128, 1, 1024, 8192, 8192, 1024, 1024]
    - [23, 122.68]
  - - [8192, 128, 1, 2048, 8192, 8192, 2048, 2048]
    - [21, 160.64]
  - - [8192, 128, 1, 4096, 8192, 8192, 4096, 4096]
    - [99, 169.39]
  - - [8192, 128, 1, 8192, 8192, 8192, 8192, 8192]
    - [98, 188.87]
  - - [8192, 256, 1, 128, 8192, 8192, 128, 128]
    - [11, 44.35]
  - - [8192, 256, 1, 256, 8192, 8192, 256, 256]
    - [14, 77.16]
  - - [8192, 256, 1, 512, 8192, 8192, 512, 512]
    - [11, 126.75]
  - - [8192, 256, 1, 1024, 8192, 8192, 1024, 1024]
    - [12, 179.67]
  - - [8192, 256, 1, 2048, 8192, 8192, 2048, 2048]
    - [56, 227.35]
  - - [8192, 256, 1, 4096, 8192, 8192, 4096, 4096]
    - [66, 232.38]
  - - [8192, 256, 1, 8192, 8192, 8192, 8192, 8192]
    - [67, 252.31]
  - - [8192, 512, 1, 128, 8192, 8192, 128, 128]
    - [8, 60.64]
  - - [8192, 512, 1, 256, 8192, 8192, 256, 256]
    - [8, 106.27]
  - - [8192, 512, 1, 512, 8192, 8192, 512, 512]
    - [10, 169.01]
  - - [8192, 512, 1, 1024, 8192, 8192, 1024, 1024]
    - [61, 247.03]
  - - [8192, 512, 1, 2048, 8192, 8192, 2048, 2048]
    - [49, 261.44]
  - - [8192, 512, 1, 4096, 8192, 8192, 4096, 4096]
    - [60, 307.26]
  - - [8192, 512, 1, 8192, 8192, 8192, 8192, 8192]
    - [61, 321.37]
  - - [8192, 1024, 1, 128, 8192, 8192, 128, 128]
    - [3, 75.51]
  - - [8192, 1024, 1, 256, 8192, 8192, 256, 256]
    - [3, 127.85]
  - - [8192, 1024, 1, 512, 8192, 8192, 512, 512]
    - [53, 188.02]
  - - [8192, 1024, 1, 1024, 8192, 8192, 1024, 1024]
    - [4, 243.56]
  - - [8192, 1024, 1, 2048, 8192, 8192, 2048, 2048]
    - [52, 313.46]
  - - [8192, 1024, 1, 4096, 8192, 8192, 4096, 4096]
    - [51, 360.86]
  - - [8192, 1024, 1, 8192, 8192, 8192, 8192, 8192]
    - [51, 386.17]
  - - [8192, 2048, 1, 128, 8192, 8192, 128, 128]
    - [4, 80.78]
  - - [8192, 2048, 1, 256, 8192, 8192, 256, 256]
    - [4, 136.07]
  - - [8192, 2048, 1, 512, 8192, 8192, 512, 512]
    - [4, 194.73]
  - - [8192, 2048, 1, 1024, 8192, 8192, 1024, 1024]
    - [53, 257.62]
  - - [8192, 2048, 1, 2048, 8192, 8192, 2048, 2048]
    - [51, 316.74]
  - - [8192, 2048, 1, 4096, 8192, 8192, 4096, 4096]
    - [51, 336.83]
  - - [8192, 2048, 1, 8192, 8192, 8192, 8192, 8192]
    - [51, 402.01]
  - - [8192, 4096, 1, 128, 8192, 8192, 128, 128]
    - [2, 89.42]
  - - [8192, 4096, 1, 256, 8192, 8192, 256, 256]
    - [16, 143.1]
  - - [8192, 4096, 1, 512, 8192, 8192, 512, 512]
    - [55, 201.61]
  - - [8192, 4096, 1, 1024, 8192, 8192, 1024, 1024]
    - [53, 248.56]
  - - [8192, 4096, 1, 2048, 8192, 8192, 2048, 2048]
    - [51, 308.54]
  - - [8192, 4096, 1, 4096, 8192, 8192, 4096, 4096]
    - [51, 357.75]
  - - [8192, 4096, 1, 8192, 8192, 8192, 8192, 8192]
    - [52, 429.35]
  - - [8192, 8192, 1, 128, 8192, 8192, 128, 128]
    - [43, 111.22]
  - - [8192, 8192, 1, 256, 8192, 8192, 256, 256]
    - [43, 162.66]
  - - [8192, 8192, 1, 512, 8192, 8192, 512, 512]
    - [43, 217.16]
  - - [8192, 8192, 1, 1024, 8192, 8192, 1024, 1024]
    - [5, 275.63]
  - - [8192, 8192, 1, 2048, 8192, 8192, 2048, 2048]
    - [41, 325.84]
  - - [8192, 8192, 1, 4096, 8192, 8192, 4096, 4096]
    - [51, 371.14]
  - - [8192, 8192, 1, 8192, 8192, 8192, 8192, 8192]
    - [51, 428.74]
  - - [1, 1, 1, 32, 1, 1, 32, 32]
    - [105, 0.0]
- null
- null
- ExperimentalStreamK
- GridBased
