projects/hipblaslt/library/src/amd_detail/rocblaslt/src/Tensile/Logic/asm_full/aquavanjaram/gfx942_228cu/StreamK/aquavanjaram942_Cijk_Alik_Bljk_B8F8NF8NS_BH_Bias_HAS_SAV_UserArgs.yaml
- {MinimumRequiredVersion: 4.33.0}
- aquavanjaram942
- {Architecture: gfx942, CUCount: 228}
- [Device 0049, Device 0050]
    SolutionIndex: 0
    SolutionNameMin: Cijk_Alik_Bljk_B8F8NF8NS_BH_Bias_HAS_SAV_UserArgs_MT256x256x64_MI16x16x1_SN_LDSB1_CLR1_GRVWA8_GRVWB8_GSU0_GSUC0_GSUWGMRR0_K1_LBSPPA512_LBSPPB512_LPA8_LPB8_LRVW8_MIWT8_8_PLR1_SU0_SUM0_SUS64_VWA8_VWB8_WGM1_WGMXCC1_WGMXCCGn1
    SolutionIndex: 1
    SolutionNameMin: Cijk_Alik_Bljk_B8F8NF8NS_BH_Bias_HAS_SAV_UserArgs_MT256x256x64_MI16x16x1_SN_LDSB1_CLR1_GRVWA8_GRVWB16_GSU0_GSUC0_GSUWGMRR0_K1_LBSPPA512_LBSPPB512_LPA8_LPB16_LRVW8_MIWT8_8_PLR1_SU0_SUM0_SUS64_VWA8_VWB8_WGM1_WGMXCC1_WGMXCCGn1
    SolutionIndex: 2
    SolutionNameMin: Cijk_Alik_Bljk_B8F8NF8NS_BH_Bias_HAS_SAV_UserArgs_MT256x256x64_MI16x16x1_SN_LDSB1_CLR1_GRVWA8_GRVWB16_GSU0_GSUC0_GSUWGMRR0_K1_LBSPPA512_LBSPPB512_LPA8_LPB16_LRVW8_MIWT8_8_PLR1_SU0_SUM0_SUS64_VWA8_VWB8_WGM4_WGMXCC1_WGMXCCGn1
    SolutionIndex: 3
    SolutionNameMin: Cijk_Alik_Bljk_B8F8NF8NS_BH_Bias_HAS_SAV_UserArgs_MT256x256x64_MI16x16x1_SN_LDSB1_CLR1_GRVWA16_GRVWB16_GSU0_GSUC0_GSUWGMRR0_K1_LBSPPA512_LBSPPB512_LPA16_LPB16_LRVW8_MIWT8_8_PLR1_SU0_SUM0_SUS64_VWA8_VWB8_WGM4_WGMXCC1_WGMXCCGn1
    SolutionIndex: 4
    SolutionNameMin: Cijk_Alik_Bljk_B8F8NF8NS_BH_Bias_HAS_SAV_UserArgs_MT256x256x64_MI16x16x1_SN_LDSB1_CLR1_GRVWA8_GRVWB16_GSU0_GSUC0_GSUWGMRR0_K1_LBSPPA512_LBSPPB512_LPA8_LPB16_LRVW8_MIWT8_8_PLR1_SU0_SUM0_SUS64_VWA8_VWB8_WGM6_WGMXCC1_WGMXCCGn1
    SolutionIndex: 5
    SolutionNameMin: Cijk_Alik_Bljk_B8F8NF8NS_BH_Bias_HAS_SAV_UserArgs_MT256x256x64_MI16x16x1_SN_LDSB1_CLR1_GRVWA16_GRVWB16_GSU0_GSUC0_GSUWGMRR0_K1_LBSPPA512_LBSPPB512_LPA16_LPB16_LRVW8_MIWT8_8_PLR1_SU0_SUM0_SUS64_VWA8_VWB8_WGM6_WGMXCC1_WGMXCCGn1
    SolutionIndex: 6
    SolutionNameMin: Cijk_Alik_Bljk_B8F8NF8NS_BH_Bias_HAS_SAV_UserArgs_MT256x256x64_MI16x16x1_SN_LDSB1_CLR1_GRVWA8_GRVWB16_GSU0_GSUC0_GSUWGMRR0_K1_LBSPPA512_LBSPPB512_LPA8_LPB16_LRVW8_MIWT8_8_PLR1_SU0_SUM0_SUS64_VWA8_VWB8_WGM8_WGMXCC1_WGMXCCGn1
    SolutionIndex: 7
    SolutionNameMin: Cijk_Alik_Bljk_B8F8NF8NS_BH_Bias_HAS_SAV_UserArgs_MT128x256x64_MI16x16x1_SN_LDSB1_CLR1_GRVWA16_GRVWB16_GSU0_GSUC0_GSUWGMRR0_K1_LBSPPA256_LBSPPB512_LPA16_LPB16_LRVW8_MIWT4_8_PLR1_SU0_SUM0_SUS64_VWA4_VWB8_WGM4_WGMXCC1_WGMXCCGn1
    SolutionIndex: 8
    SolutionNameMin: Cijk_Alik_Bljk_B8F8NF8NS_BH_Bias_HAS_SAV_UserArgs_MT256x128x64_MI16x16x1_SN_LDSB1_CLR1_GRVWA8_GRVWB16_GSU0_GSUC0_GSUWGMRR0_K1_LBSPPA512_LBSPPB256_LPA8_LPB16_LRVW8_MIWT8_4_PLR1_SU0_SUM0_SUS64_VWA8_VWB4_WGM1_WGMXCC1_WGMXCCGn1
    SolutionIndex: 9
    SolutionNameMin: Cijk_Alik_Bljk_B8F8NF8NS_BH_Bias_HAS_SAV_UserArgs_MT256x128x64_MI16x16x1_SN_LDSB1_CLR1_GRVWA8_GRVWB16_GSU0_GSUC0_GSUWGMRR0_K1_LBSPPA512_LBSPPB256_LPA8_LPB16_LRVW8_MIWT8_4_PLR1_SU0_SUM0_SUS64_VWA8_VWB4_WGM4_WGMXCC1_WGMXCCGn1
    SolutionIndex: 10
    SolutionNameMin: Cijk_Alik_Bljk_B8F8NF8NS_BH_Bias_HAS_SAV_UserArgs_MT128x128x64_MI16x16x1_SN_LDSB1_CLR1_GRVWA8_GRVWB8_GSU0_GSUC0_GSUWGMRR0_K1_LBSPPA512_LBSPPB128_LPA8_LPB8_LRVW8_MIWT8_2_PLR1_SU0_SUM0_SUS64_VWA8_VWB2_WGM1_WGMXCC1_WGMXCCGn1
    SolutionIndex: 11
    SolutionNameMin: Cijk_Alik_Bljk_B8F8NF8NS_BH_Bias_HAS_SAV_UserArgs_MT128x128x64_MI16x16x1_SN_LDSB1_CLR1_GRVWA8_GRVWB16_GSU0_GSUC0_GSUWGMRR0_K1_LBSPPA512_LBSPPB128_LPA8_LPB16_LRVW8_MIWT8_2_PLR1_SU0_SUM0_SUS64_VWA8_VWB2_WGM1_WGMXCC1_WGMXCCGn1
    SolutionIndex: 12
    SolutionNameMin: Cijk_Alik_Bljk_B8F8NF8NS_BH_Bias_HAS_SAV_UserArgs_MT128x128x64_MI16x16x1_SN_LDSB1_CLR1_GRVWA8_GRVWB16_GSU0_GSUC0_GSUWGMRR0_K1_LBSPPA256_LBSPPB256_LPA8_LPB16_LRVW8_MIWT4_4_PLR1_SU0_SUM0_SUS64_VWA4_VWB4_WGM1_WGMXCC1_WGMXCCGn1
    SolutionIndex: 13
    SolutionNameMin: Cijk_Alik_Bljk_B8F8NF8NS_BH_Bias_HAS_SAV_UserArgs_MT128x128x64_MI16x16x1_SN_LDSB1_CLR1_GRVWA16_GRVWB16_GSU0_GSUC0_GSUWGMRR0_K1_LBSPPA256_LBSPPB256_LPA16_LPB16_LRVW8_MIWT4_4_PLR1_SU0_SUM0_SUS64_VWA4_VWB4_WGM1_WGMXCC1_WGMXCCGn1
    SolutionIndex: 14
    SolutionNameMin: Cijk_Alik_Bljk_B8F8NF8NS_BH_Bias_HAS_SAV_UserArgs_MT64x128x64_MI16x16x1_SN_LDSB0_CLR1_GRVWA8_GRVWB16_GSU0_GSUC0_GSUWGMRR0_K1_LBSPPA128_LBSPPB256_LPA8_LPB16_LRVW8_MIWT2_4_PLR1_SU0_SUM0_SUS64_VWA2_VWB4_WGM1_WGMXCC1_WGMXCCGn1
    SolutionIndex: 15
    SolutionNameMin: Cijk_Alik_Bljk_B8F8NF8NS_BH_Bias_HAS_SAV_UserArgs_MT128x64x64_MI16x16x1_SN_LDSB0_CLR1_GRVWA8_GRVWB16_GSU0_GSUC0_GSUWGMRR0_K1_LBSPPA256_LBSPPB128_LPA8_LPB16_LRVW8_MIWT4_2_PLR1_SU0_SUM0_SUS64_VWA4_VWB2_WGM1_WGMXCC1_WGMXCCGn1
    SolutionIndex: 16
    SolutionNameMin: Cijk_Alik_Bljk_B8F8NF8NS_BH_Bias_HAS_SAV_UserArgs_MT128x64x64_MI16x16x1_SN_LDSB0_CLR1_GRVWA16_GRVWB16_GSU0_GSUC0_GSUWGMRR0_K1_LBSPPA256_LBSPPB128_LPA16_LPB16_LRVW8_MIWT4_2_PLR1_SU0_SUM0_SUS64_VWA4_VWB2_WGM1_WGMXCC1_WGMXCCGn1
    SolutionIndex: 17
    SolutionNameMin: Cijk_Alik_Bljk_B8F8NF8NS_BH_Bias_HAS_SAV_UserArgs_MT128x64x64_MI16x16x1_SN_LDSB0_CLR1_GRVWA8_GRVWB16_GSU0_GSUC0_GSUWGMRR0_K1_LBSPPA256_LBSPPB128_LPA8_LPB16_LRVW8_MIWT4_2_PLR1_SU0_SUM0_SUS64_VWA4_VWB2_WGM4_WGMXCC1_WGMXCCGn1
    SolutionIndex: 18
    SolutionNameMin: Cijk_Alik_Bljk_B8F8NF8NS_BH_Bias_HAS_SAV_UserArgs_MT128x64x64_MI16x16x1_SN_LDSB0_CLR1_GRVWA8_GRVWB16_GSU0_GSUC0_GSUWGMRR0_K1_LBSPPA256_LBSPPB128_LPA8_LPB16_LRVW8_MIWT4_2_PLR1_SU0_SUM0_SUS64_VWA4_VWB2_WGM6_WGMXCC1_WGMXCCGn1
    SolutionIndex: 19
    SolutionNameMin: Cijk_Alik_Bljk_B8F8NF8NS_BH_Bias_HAS_SAV_UserArgs_MT128x64x64_MI16x16x1_SN_LDSB0_CLR1_GRVWA8_GRVWB16_GSU0_GSUC0_GSUWGMRR0_K1_LBSPPA256_LBSPPB128_LPA8_LPB16_LRVW8_MIWT4_2_PLR1_SU0_SUM0_SUS64_VWA4_VWB2_WGM8_WGMXCC1_WGMXCCGn1
    SolutionIndex: 20
    SolutionNameMin: Cijk_Alik_Bljk_B8F8NF8NS_BH_Bias_HAS_SAV_UserArgs_MT64x64x64_MI16x16x1_SN_LDSB0_CLR1_GRVWA8_GRVWB8_GSU0_GSUC0_GSUWGMRR0_K1_LBSPPA128_LBSPPB128_LPA8_LPB8_LRVW8_MIWT2_2_PLR1_SU0_SUM0_SUS64_VWA2_VWB2_WGM1_WGMXCC1_WGMXCCGn1
    SolutionIndex: 21
    SolutionNameMin: Cijk_Alik_Bljk_B8F8NF8NS_BH_Bias_HAS_SAV_UserArgs_MT64x64x64_MI16x16x1_SN_LDSB0_CLR1_GRVWA16_GRVWB8_GSU0_GSUC0_GSUWGMRR0_K1_LBSPPA128_LBSPPB128_LPA16_LPB8_LRVW8_MIWT2_2_PLR1_SU0_SUM0_SUS64_VWA2_VWB2_WGM1_WGMXCC1_WGMXCCGn1
    SolutionIndex: 22
    SolutionNameMin: Cijk_Alik_Bljk_B8F8NF8NS_BH_Bias_HAS_SAV_UserArgs_MT64x64x64_MI16x16x1_SN_LDSB0_CLR1_GRVWA8_GRVWB16_GSU0_GSUC0_GSUWGMRR0_K1_LBSPPA128_LBSPPB128_LPA8_LPB16_LRVW8_MIWT2_2_PLR1_SU0_SUM0_SUS64_VWA2_VWB2_WGM1_WGMXCC1_WGMXCCGn1
    SolutionIndex: 23
    SolutionNameMin: Cijk_Alik_Bljk_B8F8NF8NS_BH_Bias_HAS_SAV_UserArgs_MT64x64x64_MI16x16x1_SN_LDSB0_CLR1_GRVWA16_GRVWB16_GSU0_GSUC0_GSUWGMRR0_K1_LBSPPA128_LBSPPB128_LPA16_LPB16_LRVW8_MIWT2_2_PLR1_SU0_SUM0_SUS64_VWA2_VWB2_WGM1_WGMXCC1_WGMXCCGn1
    SolutionIndex: 24
    SolutionNameMin: Cijk_Alik_Bljk_B8F8NF8NS_BH_Bias_HAS_SAV_UserArgs_MT64x64x64_MI16x16x1_SN_LDSB0_CLR1_GRVWA8_GRVWB8_GSU0_GSUC0_GSUWGMRR0_K1_LBSPPA128_LBSPPB128_LPA8_LPB8_LRVW8_MIWT2_2_PLR1_SU0_SUM0_SUS64_VWA2_VWB2_WGM6_WGMXCC1_WGMXCCGn1
    SolutionIndex: 25
    SolutionNameMin: Cijk_Alik_Bljk_B8F8NF8NS_BH_Bias_HAS_SAV_UserArgs_MT32x64x64_MI16x16x1_SN_LDSB0_CLR1_GRVWA8_GRVWB16_GSU0_GSUC0_GSUWGMRR0_K1_LBSPPA128_LBSPPB128_LPA8_LPB16_LRVW8_MIWT1_2_PLR1_SU0_SUM0_SUS64_VWA1_VWB2_WGM1_WGMXCC1_WGMXCCGn1
    SolutionIndex: 26
    SolutionNameMin: Cijk_Alik_Bljk_B8F8NF8NS_BH_Bias_HAS_SAV_UserArgs_MT64x32x64_MI16x16x1_SN_LDSB0_CLR1_GRVWA8_GRVWB8_GSU0_GSUC0_GSUWGMRR0_K1_LBSPPA128_LBSPPB128_LPA8_LPB8_LRVW8_MIWT2_1_PLR1_SU0_SUM0_SUS64_VWA2_VWB1_WGM1_WGMXCC1_WGMXCCGn1
    SolutionIndex: 27
    SolutionNameMin: Cijk_Alik_Bljk_B8F8NF8NS_BH_Bias_HAS_SAV_UserArgs_MT64x32x64_MI16x16x1_SN_LDSB0_CLR1_GRVWA16_GRVWB8_GSU0_GSUC0_GSUWGMRR0_K1_LBSPPA128_LBSPPB128_LPA16_LPB8_LRVW8_MIWT2_1_PLR1_SU0_SUM0_SUS64_VWA2_VWB1_WGM1_WGMXCC1_WGMXCCGn1
    SolutionIndex: 28
    SolutionNameMin: Cijk_Alik_Bljk_B8F8NF8NS_BH_Bias_HAS_SAV_UserArgs_MT64x32x64_MI16x16x1_SN_LDSB0_CLR1_GRVWA16_GRVWB8_GSU0_GSUC0_GSUWGMRR0_K1_LBSPPA128_LBSPPB128_LPA16_LPB8_LRVW8_MIWT2_1_PLR1_SU0_SUM0_SUS64_VWA2_VWB1_WGM4_WGMXCC1_WGMXCCGn1
    SolutionIndex: 29
    SolutionNameMin: Cijk_Alik_Bljk_B8F8NF8NS_BH_Bias_HAS_SAV_UserArgs_MT64x32x64_MI16x16x1_SN_LDSB0_CLR1_GRVWA16_GRVWB8_GSU0_GSUC0_GSUWGMRR0_K1_LBSPPA128_LBSPPB128_LPA16_LPB8_LRVW8_MIWT2_1_PLR1_SU0_SUM0_SUS64_VWA2_VWB1_WGM6_WGMXCC1_WGMXCCGn1
    SolutionIndex: 30
    SolutionNameMin: Cijk_Alik_Bljk_B8F8NF8NS_BH_Bias_HAS_SAV_UserArgs_MT32x32x64_MI16x16x1_SN_LDSB0_CLR1_GRVWA8_GRVWB8_GSU0_GSUC0_GSUWGMRR0_K1_LBSPPA128_LBSPPB128_LPA8_LPB8_LRVW8_MIWT1_1_PLR1_SU0_SUM0_SUS64_VWA1_VWB1_WGM1_WGMXCC1_WGMXCCGn1
    SolutionIndex: 31
    SolutionNameMin: Cijk_Alik_Bljk_B8F8NF8NS_BH_Bias_HAS_SAV_UserArgs_MT32x32x64_MI16x16x1_SN_LDSB0_CLR1_GRVWA8_GRVWB8_GSU0_GSUC0_GSUWGMRR0_K1_LBSPPA128_LBSPPB128_LPA8_LPB8_LRVW8_MIWT1_1_PLR1_SU0_SUM0_SUS64_VWA1_VWB1_WGM4_WGMXCC1_WGMXCCGn1
    SolutionIndex: 32
    SolutionNameMin: Cijk_Alik_Bljk_B8F8NF8NS_BH_Bias_HAS_SAV_UserArgs_MT128x256x128_MI16x16x1_SN_LDSB1_CLR1_GRVWA8_GRVWB16_GSU0_GSUC0_GSUWGMRR0_K1_LBSPPA512_LBSPPB1024_LPA8_LPB16_LRVW8_MIWT4_8_PLR1_SU0_SUM0_SUS128_VWA4_VWB8_WGM1_WGMXCC1_WGMXCCGn1
    SolutionIndex: 33
    SolutionNameMin: Cijk_Alik_Bljk_B8F8NF8NS_BH_Bias_HAS_SAV_UserArgs_MT128x256x128_MI16x16x1_SN_LDSB1_CLR1_GRVWA8_GRVWB16_GSU0_GSUC0_GSUWGMRR0_K1_LBSPPA512_LBSPPB1024_LPA8_LPB16_LRVW8_MIWT4_8_PLR1_SU0_SUM0_SUS128_VWA4_VWB8_WGM4_WGMXCC1_WGMXCCGn1
    SolutionIndex: 34
    SolutionNameMin: Cijk_Alik_Bljk_B8F8NF8NS_BH_Bias_HAS_SAV_UserArgs_MT256x144x128_MI16x16x1_SN_LDSB1_CLR1_GRVWA8_GRVWB8_GSU0_GSUC0_GSUWGMRR0_K1_LBSPPA512_LBSPPB128_LPA8_LPB8_LRVW8_MIWT4_9_PLR1_SU0_SUM0_SUS128_VWA4_VWB1_WGM1_WGMXCC1_WGMXCCGn1
    SolutionIndex: 35
    SolutionNameMin: Cijk_Alik_Bljk_B8F8NF8NS_BH_Bias_HAS_SAV_UserArgs_MT256x144x128_MI16x16x1_SN_LDSB1_CLR1_GRVWA16_GRVWB8_GSU0_GSUC0_GSUWGMRR0_K1_LBSPPA512_LBSPPB128_LPA16_LPB8_LRVW8_MIWT4_9_PLR1_SU0_SUM0_SUS128_VWA4_VWB1_WGM1_WGMXCC1_WGMXCCGn1
    SolutionIndex: 36
    SolutionNameMin: Cijk_Alik_Bljk_B8F8NF8NS_BH_Bias_HAS_SAV_UserArgs_MT256x144x128_MI16x16x1_SN_LDSB1_CLR1_GRVWA8_GRVWB8_GSU0_GSUC0_GSUWGMRR0_K1_LBSPPA512_LBSPPB128_LPA8_LPB8_LRVW8_MIWT4_9_PLR1_SU0_SUM0_SUS128_VWA4_VWB1_WGM4_WGMXCC1_WGMXCCGn1
    SolutionIndex: 37
    SolutionNameMin: Cijk_Alik_Bljk_B8F8NF8NS_BH_Bias_HAS_SAV_UserArgs_MT256x144x128_MI16x16x1_SN_LDSB1_CLR1_GRVWA16_GRVWB8_GSU0_GSUC0_GSUWGMRR0_K1_LBSPPA512_LBSPPB128_LPA16_LPB8_LRVW8_MIWT4_9_PLR1_SU0_SUM0_SUS128_VWA4_VWB1_WGM4_WGMXCC1_WGMXCCGn1
    SolutionIndex: 38
    SolutionNameMin: Cijk_Alik_Bljk_B8F8NF8NS_BH_Bias_HAS_SAV_UserArgs_MT256x144x128_MI16x16x1_SN_LDSB1_CLR1_GRVWA8_GRVWB8_GSU0_GSUC0_GSUWGMRR0_K1_LBSPPA512_LBSPPB128_LPA8_LPB8_LRVW8_MIWT4_9_PLR1_SU0_SUM0_SUS128_VWA4_VWB1_WGM6_WGMXCC1_WGMXCCGn1
    SolutionIndex: 39
    SolutionNameMin: Cijk_Alik_Bljk_B8F8NF8NS_BH_Bias_HAS_SAV_UserArgs_MT256x144x128_MI16x16x1_SN_LDSB1_CLR1_GRVWA16_GRVWB8_GSU0_GSUC0_GSUWGMRR0_K1_LBSPPA512_LBSPPB128_LPA16_LPB8_LRVW8_MIWT4_9_PLR1_SU0_SUM0_SUS128_VWA4_VWB1_WGM6_WGMXCC1_WGMXCCGn1
    SolutionIndex: 40
    SolutionNameMin: Cijk_Alik_Bljk_B8F8NF8NS_BH_Bias_HAS_SAV_UserArgs_MT256x144x128_MI16x16x1_SN_LDSB1_CLR1_GRVWA8_GRVWB8_GSU0_GSUC0_GSUWGMRR0_K1_LBSPPA512_LBSPPB128_LPA8_LPB8_LRVW8_MIWT4_9_PLR1_SU0_SUM0_SUS128_VWA4_VWB1_WGM8_WGMXCC1_WGMXCCGn1
    SolutionIndex: 41
    SolutionNameMin: Cijk_Alik_Bljk_B8F8NF8NS_BH_Bias_HAS_SAV_UserArgs_MT256x144x128_MI16x16x1_SN_LDSB1_CLR1_GRVWA16_GRVWB8_GSU0_GSUC0_GSUWGMRR0_K1_LBSPPA512_LBSPPB128_LPA16_LPB8_LRVW8_MIWT4_9_PLR1_SU0_SUM0_SUS128_VWA4_VWB1_WGM8_WGMXCC1_WGMXCCGn1
    SolutionIndex: 42
    SolutionNameMin: Cijk_Alik_Bljk_B8F8NF8NS_BH_Bias_HAS_SAV_UserArgs_MT256x128x128_MI16x16x1_SN_LDSB1_CLR1_GRVWA8_GRVWB16_GSU0_GSUC0_GSUWGMRR0_K1_LBSPPA1024_LBSPPB512_LPA8_LPB16_LRVW8_MIWT8_4_PLR1_SU0_SUM0_SUS128_VWA8_VWB4_WGM1_WGMXCC1_WGMXCCGn1
    SolutionIndex: 43
    SolutionNameMin: Cijk_Alik_Bljk_B8F8NF8NS_BH_Bias_HAS_SAV_UserArgs_MT256x128x128_MI16x16x1_SN_LDSB1_CLR1_GRVWA8_GRVWB16_GSU0_GSUC0_GSUWGMRR0_K1_LBSPPA1024_LBSPPB512_LPA8_LPB16_LRVW8_MIWT8_4_PLR1_SU0_SUM0_SUS128_VWA8_VWB4_WGM4_WGMXCC1_WGMXCCGn1
    SolutionIndex: 44
    SolutionNameMin: Cijk_Alik_Bljk_B8F8NF8NS_BH_Bias_HAS_SAV_UserArgs_MT256x128x128_MI16x16x1_SN_LDSB1_CLR1_GRVWA8_GRVWB16_GSU0_GSUC0_GSUWGMRR0_K1_LBSPPA1024_LBSPPB512_LPA8_LPB16_LRVW8_MIWT8_4_PLR1_SU0_SUM0_SUS128_VWA8_VWB4_WGM6_WGMXCC1_WGMXCCGn1
    SolutionIndex: 45
    SolutionNameMin: Cijk_Alik_Bljk_B8F8NF8NS_BH_Bias_HAS_SAV_UserArgs_MT256x128x128_MI16x16x1_SN_LDSB1_CLR1_GRVWA8_GRVWB16_GSU0_GSUC0_GSUWGMRR0_K1_LBSPPA1024_LBSPPB512_LPA8_LPB16_LRVW8_MIWT8_4_PLR1_SU0_SUM0_SUS128_VWA8_VWB4_WGM8_WGMXCC1_WGMXCCGn1
    SolutionIndex: 46
    SolutionNameMin: Cijk_Alik_Bljk_B8F8NF8NS_BH_Bias_HAS_SAV_UserArgs_MT144x256x128_MI16x16x1_SN_LDSB1_CLR1_GRVWA8_GRVWB16_GSU0_GSUC0_GSUWGMRR0_K1_LBSPPA128_LBSPPB512_LPA8_LPB16_LRVW8_MIWT9_4_PLR1_SU0_SUM0_SUS128_VWA1_VWB4_WGM1_WGMXCC1_WGMXCCGn1
    SolutionIndex: 47
    SolutionNameMin: Cijk_Alik_Bljk_B8F8NF8NS_BH_Bias_HAS_SAV_UserArgs_MT144x256x128_MI16x16x1_SN_LDSB1_CLR1_GRVWA8_GRVWB16_GSU0_GSUC0_GSUWGMRR0_K1_LBSPPA128_LBSPPB512_LPA8_LPB16_LRVW8_MIWT9_4_PLR1_SU0_SUM0_SUS128_VWA1_VWB4_WGM4_WGMXCC1_WGMXCCGn1
    SolutionIndex: 48
    SolutionNameMin: Cijk_Alik_Bljk_B8F8NF8NS_BH_Bias_HAS_SAV_UserArgs_MT144x256x128_MI16x16x1_SN_LDSB1_CLR1_GRVWA8_GRVWB16_GSU0_GSUC0_GSUWGMRR0_K1_LBSPPA128_LBSPPB512_LPA8_LPB16_LRVW8_MIWT9_4_PLR1_SU0_SUM0_SUS128_VWA1_VWB4_WGM6_WGMXCC1_WGMXCCGn1
    SolutionIndex: 49
    SolutionNameMin: Cijk_Alik_Bljk_B8F8NF8NS_BH_Bias_HAS_SAV_UserArgs_MT144x256x128_MI16x16x1_SN_LDSB1_CLR1_GRVWA8_GRVWB16_GSU0_GSUC0_GSUWGMRR0_K1_LBSPPA128_LBSPPB512_LPA8_LPB16_LRVW8_MIWT9_4_PLR1_SU0_SUM0_SUS128_VWA1_VWB4_WGM8_WGMXCC1_WGMXCCGn1
    SolutionIndex: 50
    SolutionNameMin: Cijk_Alik_Bljk_B8F8NF8NS_BH_Bias_HAS_SAV_UserArgs_MT128x128x128_MI16x16x1_SN_LDSB1_CLR1_GRVWA8_GRVWB16_GSU0_GSUC0_GSUWGMRR0_K1_LBSPPA1024_LBSPPB256_LPA8_LPB16_LRVW8_MIWT8_2_PLR1_SU0_SUM0_SUS128_VWA8_VWB2_WGM1_WGMXCC1_WGMXCCGn1
    SolutionIndex: 51
    SolutionNameMin: Cijk_Alik_Bljk_B8F8NF8NS_BH_Bias_HAS_SAV_UserArgs_MT128x128x128_MI16x16x1_SN_LDSB1_CLR1_GRVWA8_GRVWB16_GSU0_GSUC0_GSUWGMRR0_K1_LBSPPA1024_LBSPPB256_LPA8_LPB16_LRVW8_MIWT8_2_PLR1_SU0_SUM0_SUS128_VWA8_VWB2_WGM4_WGMXCC1_WGMXCCGn1
    SolutionIndex: 52
    SolutionNameMin: Cijk_Alik_Bljk_B8F8NF8NS_BH_Bias_HAS_SAV_UserArgs_MT128x128x128_MI16x16x1_SN_LDSB1_CLR1_GRVWA8_GRVWB16_GSU0_GSUC0_GSUWGMRR0_K1_LBSPPA1024_LBSPPB256_LPA8_LPB16_LRVW8_MIWT8_2_PLR1_SU0_SUM0_SUS128_VWA8_VWB2_WGM6_WGMXCC1_WGMXCCGn1
    SolutionIndex: 53
    SolutionNameMin: Cijk_Alik_Bljk_B8F8NF8NS_BH_Bias_HAS_SAV_UserArgs_MT128x128x128_MI16x16x1_SN_LDSB1_CLR1_GRVWA8_GRVWB16_GSU0_GSUC0_GSUWGMRR0_K1_LBSPPA1024_LBSPPB256_LPA8_LPB16_LRVW8_MIWT8_2_PLR1_SU0_SUM0_SUS128_VWA8_VWB2_WGM8_WGMXCC1_WGMXCCGn1
    SolutionIndex: 54
    SolutionNameMin: Cijk_Alik_Bljk_B8F8NF8NS_BH_Bias_HAS_SAV_UserArgs_MT128x144x128_MI16x16x1_SN_LDSB1_CLR1_GRVWA8_GRVWB8_GSU0_GSUC0_GSUWGMRR0_K1_LBSPPA256_LBSPPB128_LPA8_LPB8_LRVW8_MIWT2_9_PLR1_SU0_SUM0_SUS128_VWA2_VWB1_WGM1_WGMXCC1_WGMXCCGn1
    SolutionIndex: 55
    SolutionNameMin: Cijk_Alik_Bljk_B8F8NF8NS_BH_Bias_HAS_SAV_UserArgs_MT128x144x128_MI16x16x1_SN_LDSB1_CLR1_GRVWA16_GRVWB8_GSU0_GSUC0_GSUWGMRR0_K1_LBSPPA256_LBSPPB128_LPA16_LPB8_LRVW8_MIWT2_9_PLR1_SU0_SUM0_SUS128_VWA2_VWB1_WGM1_WGMXCC1_WGMXCCGn1
    SolutionIndex: 56
    SolutionNameMin: Cijk_Alik_Bljk_B8F8NF8NS_BH_Bias_HAS_SAV_UserArgs_MT128x144x128_MI16x16x1_SN_LDSB1_CLR1_GRVWA16_GRVWB8_GSU0_GSUC0_GSUWGMRR0_K1_LBSPPA256_LBSPPB128_LPA16_LPB8_LRVW8_MIWT2_9_PLR1_SU0_SUM0_SUS128_VWA2_VWB1_WGM4_WGMXCC1_WGMXCCGn1
    SolutionIndex: 57
    SolutionNameMin: Cijk_Alik_Bljk_B8F8NF8NS_BH_Bias_HAS_SAV_UserArgs_MT144x128x128_MI16x16x1_SN_LDSB1_CLR1_GRVWA8_GRVWB16_GSU0_GSUC0_GSUWGMRR0_K1_LBSPPA128_LBSPPB256_LPA8_LPB16_LRVW8_MIWT9_2_PLR1_SU0_SUM0_SUS128_VWA1_VWB2_WGM4_WGMXCC1_WGMXCCGn1
    SolutionIndex: 58
    SolutionNameMin: Cijk_Alik_Bljk_B8F8NF8NS_BH_Bias_HAS_SAV_UserArgs_MT144x128x128_MI16x16x1_SN_LDSB1_CLR1_GRVWA8_GRVWB16_GSU0_GSUC0_GSUWGMRR0_K1_LBSPPA128_LBSPPB256_LPA8_LPB16_LRVW8_MIWT9_2_PLR1_SU0_SUM0_SUS128_VWA1_VWB2_WGM6_WGMXCC1_WGMXCCGn1
    SolutionIndex: 59
    SolutionNameMin: Cijk_Alik_Bljk_B8F8NF8NS_BH_Bias_HAS_SAV_UserArgs_MT144x128x128_MI16x16x1_SN_LDSB1_CLR1_GRVWA8_GRVWB16_GSU0_GSUC0_GSUWGMRR0_K1_LBSPPA128_LBSPPB256_LPA8_LPB16_LRVW8_MIWT9_2_PLR1_SU0_SUM0_SUS128_VWA1_VWB2_WGM8_WGMXCC1_WGMXCCGn1
    SolutionIndex: 60
    SolutionNameMin: Cijk_Alik_Bljk_B8F8NF8NS_BH_Bias_HAS_SAV_UserArgs_MT128x128x128_MI16x16x1_SN_LDSB1_CLR1_GRVWA8_GRVWB16_GSU0_GSUC0_GSUWGMRR0_K1_LBSPPA512_LBSPPB512_LPA8_LPB16_LRVW8_MIWT4_4_PLR1_SU0_SUM0_SUS128_VWA4_VWB4_WGM1_WGMXCC1_WGMXCCGn1
    SolutionIndex: 61
    SolutionNameMin: Cijk_Alik_Bljk_B8F8NF8NS_BH_Bias_HAS_SAV_UserArgs_MT128x128x128_MI16x16x1_SN_LDSB1_CLR1_GRVWA16_GRVWB16_GSU0_GSUC0_GSUWGMRR0_K1_LBSPPA512_LBSPPB512_LPA16_LPB16_LRVW8_MIWT4_4_PLR1_SU0_SUM0_SUS128_VWA4_VWB4_WGM1_WGMXCC1_WGMXCCGn1
    SolutionIndex: 62
    SolutionNameMin: Cijk_Alik_Bljk_B8F8NF8NS_BH_Bias_HAS_SAV_UserArgs_MT128x128x128_MI16x16x1_SN_LDSB1_CLR1_GRVWA8_GRVWB16_GSU0_GSUC0_GSUWGMRR0_K1_LBSPPA512_LBSPPB512_LPA8_LPB16_LRVW8_MIWT4_4_PLR1_SU0_SUM0_SUS128_VWA4_VWB4_WGM4_WGMXCC1_WGMXCCGn1
    SolutionIndex: 63
    SolutionNameMin: Cijk_Alik_Bljk_B8F8NF8NS_BH_Bias_HAS_SAV_UserArgs_MT128x128x128_MI16x16x1_SN_LDSB1_CLR1_GRVWA8_GRVWB16_GSU0_GSUC0_GSUWGMRR0_K1_LBSPPA512_LBSPPB512_LPA8_LPB16_LRVW8_MIWT4_4_PLR1_SU0_SUM0_SUS128_VWA4_VWB4_WGM6_WGMXCC1_WGMXCCGn1
    SolutionIndex: 64
    SolutionNameMin: Cijk_Alik_Bljk_B8F8NF8NS_BH_Bias_HAS_SAV_UserArgs_MT128x128x128_MI16x16x1_SN_LDSB1_CLR1_GRVWA8_GRVWB16_GSU0_GSUC0_GSUWGMRR0_K1_LBSPPA512_LBSPPB512_LPA8_LPB16_LRVW8_MIWT4_4_PLR1_SU0_SUM0_SUS128_VWA4_VWB4_WGM8_WGMXCC1_WGMXCCGn1
    SolutionIndex: 65
    SolutionNameMin: Cijk_Alik_Bljk_B8F8NF8NS_BH_Bias_HAS_SAV_UserArgs_MT128x128x128_MI16x16x1_SN_LDSB1_CLR1_GRVWA16_GRVWB16_GSU0_GSUC0_GSUWGMRR0_K1_LBSPPA512_LBSPPB512_LPA16_LPB16_LRVW8_MIWT4_4_PLR1_SU0_SUM0_SUS128_VWA4_VWB4_WGM8_WGMXCC1_WGMXCCGn1
    SolutionIndex: 66
    SolutionNameMin: Cijk_Alik_Bljk_B8F8NF8NS_BH_Bias_HAS_SAV_UserArgs_MT64x128x128_MI16x16x1_SN_LDSB1_CLR1_GRVWA8_GRVWB16_GSU0_GSUC0_GSUWGMRR0_K1_LBSPPA256_LBSPPB512_LPA8_LPB16_LRVW8_MIWT2_4_PLR1_SU0_SUM0_SUS128_VWA2_VWB4_WGM1_WGMXCC1_WGMXCCGn1
    SolutionIndex: 67
    SolutionNameMin: Cijk_Alik_Bljk_B8F8NF8NS_BH_Bias_HAS_SAV_UserArgs_MT64x128x128_MI16x16x1_SN_LDSB1_CLR1_GRVWA8_GRVWB16_GSU0_GSUC0_GSUWGMRR0_K1_LBSPPA256_LBSPPB512_LPA8_LPB16_LRVW8_MIWT2_4_PLR1_SU0_SUM0_SUS128_VWA2_VWB4_WGM4_WGMXCC1_WGMXCCGn1
    SolutionIndex: 68
    SolutionNameMin: Cijk_Alik_Bljk_B8F8NF8NS_BH_Bias_HAS_SAV_UserArgs_MT64x128x128_MI16x16x1_SN_LDSB1_CLR1_GRVWA8_GRVWB16_GSU0_GSUC0_GSUWGMRR0_K1_LBSPPA256_LBSPPB512_LPA8_LPB16_LRVW8_MIWT2_4_PLR1_SU0_SUM0_SUS128_VWA2_VWB4_WGM8_WGMXCC1_WGMXCCGn1
    SolutionIndex: 69
    SolutionNameMin: Cijk_Alik_Bljk_B8F8NF8NS_BH_Bias_HAS_SAV_UserArgs_MT128x64x128_MI16x16x1_SN_LDSB1_CLR1_GRVWA16_GRVWB16_GSU0_GSUC0_GSUWGMRR0_K1_LBSPPA512_LBSPPB256_LPA16_LPB16_LRVW8_MIWT4_2_PLR1_SU0_SUM0_SUS128_VWA4_VWB2_WGM1_WGMXCC1_WGMXCCGn1
    SolutionIndex: 70
    SolutionNameMin: Cijk_Alik_Bljk_B8F8NF8NS_BH_Bias_HAS_SAV_UserArgs_MT128x32x128_MI16x16x1_SN_LDSB1_CLR1_GRVWA16_GRVWB8_GSU0_GSUC0_GSUWGMRR0_K1_LBSPPA512_LBSPPB128_LPA16_LPB8_LRVW8_MIWT4_1_PLR1_SU0_SUM0_SUS128_VWA4_VWB1_WGM8_WGMXCC1_WGMXCCGn1
    SolutionIndex: 71
    SolutionNameMin: Cijk_Alik_Bljk_B8F8NF8NS_BH_Bias_HAS_SAV_UserArgs_MT64x64x128_MI16x16x1_SN_LDSB1_CLR1_GRVWA16_GRVWB8_GSU0_GSUC0_GSUWGMRR0_K1_LBSPPA256_LBSPPB256_LPA16_LPB8_LRVW8_MIWT2_2_PLR1_SU0_SUM0_SUS128_VWA2_VWB2_WGM1_WGMXCC1_WGMXCCGn1
    SolutionIndex: 72
    SolutionNameMin: Cijk_Alik_Bljk_B8F8NF8NS_BH_Bias_HAS_SAV_UserArgs_MT64x64x128_MI16x16x1_SN_LDSB1_CLR1_GRVWA8_GRVWB16_GSU0_GSUC0_GSUWGMRR0_K1_LBSPPA256_LBSPPB256_LPA8_LPB16_LRVW8_MIWT2_2_PLR1_SU0_SUM0_SUS128_VWA2_VWB2_WGM1_WGMXCC1_WGMXCCGn1
    SolutionIndex: 73
    SolutionNameMin: Cijk_Alik_Bljk_B8F8NF8NS_BH_Bias_HAS_SAV_UserArgs_MT64x64x128_MI16x16x1_SN_LDSB1_CLR1_GRVWA8_GRVWB16_GSU0_GSUC0_GSUWGMRR0_K1_LBSPPA256_LBSPPB256_LPA8_LPB16_LRVW8_MIWT2_2_PLR1_SU0_SUM0_SUS128_VWA2_VWB2_WGM4_WGMXCC1_WGMXCCGn1
    SolutionIndex: 74
    SolutionNameMin: Cijk_Alik_Bljk_B8F8NF8NS_BH_Bias_HAS_SAV_UserArgs_MT32x64x128_MI16x16x1_SN_LDSB0_CLR1_GRVWA8_GRVWB8_GSU0_GSUC0_GSUWGMRR0_K1_LBSPPA128_LBSPPB256_LPA8_LPB8_LRVW8_MIWT1_2_PLR1_SU0_SUM0_SUS128_VWA1_VWB2_WGM1_WGMXCC1_WGMXCCGn1
    SolutionIndex: 75
    SolutionNameMin: Cijk_Alik_Bljk_B8F8NF8NS_BH_Bias_HAS_SAV_UserArgs_MT32x64x128_MI16x16x1_SN_LDSB0_CLR1_GRVWA16_GRVWB8_GSU0_GSUC0_GSUWGMRR0_K1_LBSPPA128_LBSPPB256_LPA16_LPB8_LRVW8_MIWT1_2_PLR1_SU0_SUM0_SUS128_VWA1_VWB2_WGM1_WGMXCC1_WGMXCCGn1
    SolutionIndex: 76
    SolutionNameMin: Cijk_Alik_Bljk_B8F8NF8NS_BH_Bias_HAS_SAV_UserArgs_MT32x64x128_MI16x16x1_SN_LDSB0_CLR1_GRVWA8_GRVWB16_GSU0_GSUC0_GSUWGMRR0_K1_LBSPPA128_LBSPPB256_LPA8_LPB16_LRVW8_MIWT1_2_PLR1_SU0_SUM0_SUS128_VWA1_VWB2_WGM1_WGMXCC1_WGMXCCGn1
    SolutionIndex: 77
    SolutionNameMin: Cijk_Alik_Bljk_B8F8NF8NS_BH_Bias_HAS_SAV_UserArgs_MT32x64x128_MI16x16x1_SN_LDSB0_CLR1_GRVWA16_GRVWB16_GSU0_GSUC0_GSUWGMRR0_K1_LBSPPA128_LBSPPB256_LPA16_LPB16_LRVW8_MIWT1_2_PLR1_SU0_SUM0_SUS128_VWA1_VWB2_WGM1_WGMXCC1_WGMXCCGn1
    SolutionIndex: 78
    SolutionNameMin: Cijk_Alik_Bljk_B8F8NF8NS_BH_Bias_HAS_SAV_UserArgs_MT32x64x128_MI16x16x1_SN_LDSB0_CLR1_GRVWA8_GRVWB8_GSU0_GSUC0_GSUWGMRR0_K1_LBSPPA128_LBSPPB256_LPA8_LPB8_LRVW8_MIWT1_2_PLR1_SU0_SUM0_SUS128_VWA1_VWB2_WGM4_WGMXCC1_WGMXCCGn1
    SolutionIndex: 79
    SolutionNameMin: Cijk_Alik_Bljk_B8F8NF8NS_BH_Bias_HAS_SAV_UserArgs_MT32x64x128_MI16x16x1_SN_LDSB0_CLR1_GRVWA8_GRVWB8_GSU0_GSUC0_GSUWGMRR0_K1_LBSPPA128_LBSPPB256_LPA8_LPB8_LRVW8_MIWT1_2_PLR1_SU0_SUM0_SUS128_VWA1_VWB2_WGM6_WGMXCC1_WGMXCCGn1
    SolutionIndex: 80
    SolutionNameMin: Cijk_Alik_Bljk_B8F8NF8NS_BH_Bias_HAS_SAV_UserArgs_MT64x32x128_MI16x16x1_SN_LDSB0_CLR1_GRVWA8_GRVWB8_GSU0_GSUC0_GSUWGMRR0_K1_LBSPPA256_LBSPPB128_LPA8_LPB8_LRVW8_MIWT2_1_PLR1_SU0_SUM0_SUS128_VWA2_VWB1_WGM1_WGMXCC1_WGMXCCGn1
    SolutionIndex: 81
    SolutionNameMin: Cijk_Alik_Bljk_B8F8NF8NS_BH_Bias_HAS_SAV_UserArgs_MT64x32x128_MI16x16x1_SN_LDSB0_CLR1_GRVWA16_GRVWB8_GSU0_GSUC0_GSUWGMRR0_K1_LBSPPA256_LBSPPB128_LPA16_LPB8_LRVW8_MIWT2_1_PLR1_SU0_SUM0_SUS128_VWA2_VWB1_WGM1_WGMXCC1_WGMXCCGn1
    SolutionIndex: 82
    SolutionNameMin: Cijk_Alik_Bljk_B8F8NF8NS_BH_Bias_HAS_SAV_UserArgs_MT64x32x128_MI16x16x1_SN_LDSB0_CLR1_GRVWA8_GRVWB16_GSU0_GSUC0_GSUWGMRR0_K1_LBSPPA256_LBSPPB128_LPA8_LPB16_LRVW8_MIWT2_1_PLR1_SU0_SUM0_SUS128_VWA2_VWB1_WGM1_WGMXCC1_WGMXCCGn1
    SolutionIndex: 83
    SolutionNameMin: Cijk_Alik_Bljk_B8F8NF8NS_BH_Bias_HAS_SAV_UserArgs_MT64x32x128_MI16x16x1_SN_LDSB0_CLR1_GRVWA16_GRVWB16_GSU0_GSUC0_GSUWGMRR0_K1_LBSPPA256_LBSPPB128_LPA16_LPB16_LRVW8_MIWT2_1_PLR1_SU0_SUM0_SUS128_VWA2_VWB1_WGM1_WGMXCC1_WGMXCCGn1
    SolutionIndex: 84
    SolutionNameMin: Cijk_Alik_Bljk_B8F8NF8NS_BH_Bias_HAS_SAV_UserArgs_MT32x32x128_MI16x16x1_SN_LDSB0_CLR1_GRVWA8_GRVWB8_GSU0_GSUC0_GSUWGMRR0_K1_LBSPPA128_LBSPPB128_LPA8_LPB8_LRVW8_MIWT1_1_PLR1_SU0_SUM0_SUS128_VWA1_VWB1_WGM1_WGMXCC1_WGMXCCGn1
    SolutionIndex: 85
    SolutionNameMin: Cijk_Alik_Bljk_B8F8NF8NS_BH_Bias_HAS_SAV_UserArgs_MT32x32x128_MI16x16x1_SN_LDSB0_CLR1_GRVWA16_GRVWB8_GSU0_GSUC0_GSUWGMRR0_K1_LBSPPA128_LBSPPB128_LPA16_LPB8_LRVW8_MIWT1_1_PLR1_SU0_SUM0_SUS128_VWA1_VWB1_WGM1_WGMXCC1_WGMXCCGn1
    SolutionIndex: 86
    SolutionNameMin: Cijk_Alik_Bljk_B8F8NF8NS_BH_Bias_HAS_SAV_UserArgs_MT32x32x128_MI16x16x1_SN_LDSB0_CLR1_GRVWA8_GRVWB16_GSU0_GSUC0_GSUWGMRR0_K1_LBSPPA128_LBSPPB128_LPA8_LPB16_LRVW8_MIWT1_1_PLR1_SU0_SUM0_SUS128_VWA1_VWB1_WGM1_WGMXCC1_WGMXCCGn1
    SolutionIndex: 87
    SolutionNameMin: Cijk_Alik_Bljk_B8F8NF8NS_BH_Bias_HAS_SAV_UserArgs_MT32x32x128_MI16x16x1_SN_LDSB0_CLR1_GRVWA16_GRVWB16_GSU0_GSUC0_GSUWGMRR0_K1_LBSPPA128_LBSPPB128_LPA16_LPB16_LRVW8_MIWT1_1_PLR1_SU0_SUM0_SUS128_VWA1_VWB1_WGM1_WGMXCC1_WGMXCCGn1
    SolutionIndex: 88
    SolutionNameMin: Cijk_Alik_Bljk_B8F8NF8NS_BH_Bias_HAS_SAV_UserArgs_MT32x32x128_MI16x16x1_SN_LDSB0_CLR1_GRVWA8_GRVWB8_GSU0_GSUC0_GSUWGMRR0_K1_LBSPPA128_LBSPPB128_LPA8_LPB8_LRVW8_MIWT1_1_PLR1_SU0_SUM0_SUS128_VWA1_VWB1_WGM4_WGMXCC1_WGMXCCGn1
    SolutionIndex: 89
    SolutionNameMin: Cijk_Alik_Bljk_B8F8NF8NS_BH_Bias_HAS_SAV_UserArgs_MT32x32x128_MI16x16x1_SN_LDSB0_CLR1_GRVWA16_GRVWB16_GSU0_GSUC0_GSUWGMRR0_K1_LBSPPA128_LBSPPB128_LPA16_LPB16_LRVW8_MIWT1_1_PLR1_SU0_SUM0_SUS128_VWA1_VWB1_WGM4_WGMXCC1_WGMXCCGn1
    SolutionIndex: 90
    SolutionNameMin: Cijk_Alik_Bljk_B8F8NF8NS_BH_Bias_HAS_SAV_UserArgs_MT32x32x128_MI16x16x1_SN_LDSB0_CLR1_GRVWA8_GRVWB8_GSU0_GSUC0_GSUWGMRR0_K1_LBSPPA128_LBSPPB128_LPA8_LPB8_LRVW8_MIWT1_1_PLR1_SU0_SUM0_SUS128_VWA1_VWB1_WGM6_WGMXCC1_WGMXCCGn1
    SolutionIndex: 91
    SolutionNameMin: Cijk_Alik_Bljk_B8F8NF8NS_BH_Bias_HAS_SAV_UserArgs_MT32x32x128_MI16x16x1_SN_LDSB0_CLR1_GRVWA16_GRVWB8_GSU0_GSUC0_GSUWGMRR0_K1_LBSPPA128_LBSPPB128_LPA16_LPB8_LRVW8_MIWT1_1_PLR1_SU0_SUM0_SUS128_VWA1_VWB1_WGM6_WGMXCC1_WGMXCCGn1
    SolutionIndex: 92
    SolutionNameMin: Cijk_Alik_Bljk_B8F8NF8NS_BH_Bias_HAS_SAV_UserArgs_MT32x32x128_MI16x16x1_SN_LDSB0_CLR1_GRVWA8_GRVWB16_GSU0_GSUC0_GSUWGMRR0_K1_LBSPPA128_LBSPPB128_LPA8_LPB16_LRVW8_MIWT1_1_PLR1_SU0_SUM0_SUS128_VWA1_VWB1_WGM6_WGMXCC1_WGMXCCGn1
    SolutionIndex: 93
    SolutionNameMin: Cijk_Alik_Bljk_B8F8NF8NS_BH_Bias_HAS_SAV_UserArgs_MT32x32x128_MI16x16x1_SN_LDSB0_CLR1_GRVWA16_GRVWB16_GSU0_GSUC0_GSUWGMRR0_K1_LBSPPA128_LBSPPB128_LPA16_LPB16_LRVW8_MIWT1_1_PLR1_SU0_SUM0_SUS128_VWA1_VWB1_WGM6_WGMXCC1_WGMXCCGn1
    SolutionIndex: 94
    SolutionNameMin: Cijk_Alik_Bljk_B8F8NF8NS_BH_Bias_HAS_SAV_UserArgs_MT128x64x256_MI16x16x1_SN_LDSB1_CLR1_GRVWA8_GRVWB16_GSU0_GSUC0_GSUWGMRR0_K1_LBSPPA1024_LBSPPB512_LPA8_LPB16_LRVW8_MIWT4_2_PLR1_SU0_SUM0_SUS256_VWA4_VWB2_WGM1_WGMXCC1_WGMXCCGn1
    SolutionIndex: 95
    SolutionNameMin: Cijk_Alik_Bljk_B8F8NF8NS_BH_Bias_HAS_SAV_UserArgs_MT128x64x256_MI16x16x1_SN_LDSB1_CLR1_GRVWA8_GRVWB16_GSU0_GSUC0_GSUWGMRR0_K1_LBSPPA1024_LBSPPB512_LPA8_LPB16_LRVW8_MIWT4_2_PLR1_SU0_SUM0_SUS256_VWA4_VWB2_WGM6_WGMXCC1_WGMXCCGn1
    SolutionIndex: 96
    SolutionNameMin: Cijk_Alik_Bljk_B8F8NF8NS_BH_Bias_HAS_SAV_UserArgs_MT128x64x256_MI16x16x1_SN_LDSB1_CLR1_GRVWA8_GRVWB16_GSU0_GSUC0_GSUWGMRR0_K1_LBSPPA1024_LBSPPB512_LPA8_LPB16_LRVW8_MIWT4_2_PLR1_SU0_SUM0_SUS256_VWA4_VWB2_WGM8_WGMXCC1_WGMXCCGn1
    SolutionIndex: 97
    SolutionNameMin: Cijk_Alik_Bljk_B8F8NF8NS_BH_Bias_HAS_SAV_UserArgs_MT64x64x256_MI16x16x1_SN_LDSB1_CLR1_GRVWA8_GRVWB16_GSU0_GSUC0_GSUWGMRR0_K1_LBSPPA512_LBSPPB512_LPA8_LPB16_LRVW8_MIWT2_2_PLR1_SU0_SUM0_SUS256_VWA2_VWB2_WGM1_WGMXCC1_WGMXCCGn1
    SolutionIndex: 98
    SolutionNameMin: Cijk_Alik_Bljk_B8F8NF8NS_BH_Bias_HAS_SAV_UserArgs_MT64x64x256_MI16x16x1_SN_LDSB1_CLR1_GRVWA8_GRVWB16_GSU0_GSUC0_GSUWGMRR0_K1_LBSPPA512_LBSPPB512_LPA8_LPB16_LRVW8_MIWT2_2_PLR1_SU0_SUM0_SUS256_VWA2_VWB2_WGM4_WGMXCC1_WGMXCCGn1
    SolutionIndex: 99
    SolutionNameMin: Cijk_Alik_Bljk_B8F8NF8NS_BH_Bias_HAS_SAV_UserArgs_MT64x64x256_MI16x16x1_SN_LDSB1_CLR1_GRVWA8_GRVWB16_GSU0_GSUC0_GSUWGMRR0_K1_LBSPPA512_LBSPPB512_LPA8_LPB16_LRVW8_MIWT2_2_PLR1_SU0_SUM0_SUS256_VWA2_VWB2_WGM8_WGMXCC1_WGMXCCGn1
    SolutionIndex: 100
    SolutionNameMin: Cijk_Alik_Bljk_B8F8NF8NS_BH_Bias_HAS_SAV_UserArgs_MT32x32x256_MI16x16x1_SN_LDSB1_CLR1_GRVWA8_GRVWB16_GSU0_GSUC0_GSUWGMRR0_K1_LBSPPA256_LBSPPB256_LPA8_LPB16_LRVW8_MIWT1_1_PLR1_SU0_SUM0_SUS256_VWA1_VWB1_WGM1_WGMXCC1_WGMXCCGn1
    SolutionIndex: 101
    SolutionNameMin: Cijk_Alik_Bljk_B8F8NF8NS_BH_Bias_HAS_SAV_UserArgs_MT32x32x256_MI16x16x1_SN_LDSB1_CLR1_GRVWA16_GRVWB16_GSU0_GSUC0_GSUWGMRR0_K1_LBSPPA256_LBSPPB256_LPA16_LPB16_LRVW8_MIWT1_1_PLR1_SU0_SUM0_SUS256_VWA1_VWB1_WGM1_WGMXCC1_WGMXCCGn1
    SolutionIndex: 102
    SolutionNameMin: Cijk_Alik_Bljk_B8F8NF8NS_BH_Bias_HAS_SAV_UserArgs_MT32x32x256_MI16x16x1_SN_LDSB1_CLR1_GRVWA8_GRVWB16_GSU0_GSUC0_GSUWGMRR0_K1_LBSPPA256_LBSPPB256_LPA8_LPB16_LRVW8_MIWT1_1_PLR1_SU0_SUM0_SUS256_VWA1_VWB1_WGM4_WGMXCC1_WGMXCCGn1
    SolutionIndex: 103
    SolutionNameMin: Cijk_Alik_Bljk_B8F8NF8NS_BH_Bias_HAS_SAV_UserArgs_MT64x32x32_MI16x16x1_SN_LDSB0_CLR0_GRVWA8_GRVWB4_GSU0_GSUC0_GSUWGMRR0_K1_LBSPPA128_LBSPPB128_LPA8_LPB8_LRVW8_MIWT2_1_PLR0_SU32_SUM0_SUS256_VWA2_VWB1_WGM6_WGMXCC1_WGMXCCGn1
- - - [128, 128, 1, 128, 128, 128, 128, 128]
    - [28, 0.51]
  - - [128, 128, 1, 256, 128, 128, 256, 256]
    - [87, 1.13]
  - - [128, 128, 1, 512, 128, 128, 512, 512]
    - [87, 2.02]
  - - [128, 128, 1, 1024, 128, 128, 1024, 1024]
    - [84, 3.38]
  - - [128, 128, 1, 2048, 128, 128, 2048, 2048]
    - [84, 5.23]
  - - [128, 128, 1, 4096, 128, 128, 4096, 4096]
    - [84, 7.1]
  - - [128, 128, 1, 8192, 128, 128, 8192, 8192]
    - [84, 8.67]
  - - [128, 256, 1, 128, 128, 128, 128, 128]
    - [89, 1.18]
  - - [128, 256, 1, 256, 128, 128, 256, 256]
    - [87, 2.32]
  - - [128, 256, 1, 512, 128, 128, 512, 512]
    - [87, 4.11]
  - - [128, 256, 1, 1024, 128, 128, 1024, 1024]
    - [100, 6.88]
  - - [128, 256, 1, 2048, 128, 128, 2048, 2048]
    - [84, 10.57]
  - - [128, 256, 1, 4096, 128, 128, 4096, 4096]
    - [84, 14.33]
  - - [128, 256, 1, 8192, 128, 128, 8192, 8192]
    - [84, 17.31]
  - - [128, 512, 1, 128, 128, 128, 128, 128]
    - [31, 2.26]
  - - [128, 512, 1, 256, 128, 128, 256, 256]
    - [87, 4.37]
  - - [128, 512, 1, 512, 128, 128, 512, 512]
    - [86, 8.22]
  - - [128, 512, 1, 1024, 128, 128, 1024, 1024]
    - [85, 13.71]
  - - [128, 512, 1, 2048, 128, 128, 2048, 2048]
    - [84, 21.09]
  - - [128, 512, 1, 4096, 128, 128, 4096, 4096]
    - [84, 28.41]
  - - [128, 512, 1, 8192, 128, 128, 8192, 8192]
    - [84, 34.31]
  - - [128, 1024, 1, 128, 128, 128, 128, 128]
    - [30, 4.73]
  - - [128, 1024, 1, 256, 128, 128, 256, 256]
    - [86, 8.99]
  - - [128, 1024, 1, 512, 128, 128, 512, 512]
    - [86, 16.19]
  - - [128, 1024, 1, 1024, 128, 128, 1024, 1024]
    - [86, 27.18]
  - - [128, 1024, 1, 2048, 128, 128, 2048, 2048]
    - [84, 41.24]
  - - [128, 1024, 1, 4096, 128, 128, 4096, 4096]
    - [84, 55.51]
  - - [128, 1024, 1, 8192, 128, 128, 8192, 8192]
    - [84, 67.3]
  - - [128, 2048, 1, 128, 128, 128, 128, 128]
    - [25, 8.94]
  - - [128, 2048, 1, 256, 128, 128, 256, 256]
    - [26, 16.73]
  - - [128, 2048, 1, 512, 128, 128, 512, 512]
    - [76, 29.16]
  - - [128, 2048, 1, 1024, 128, 128, 1024, 1024]
    - [74, 47.31]
  - - [128, 2048, 1, 2048, 128, 128, 2048, 2048]
    - [74, 69.18]
  - - [128, 2048, 1, 4096, 128, 128, 4096, 4096]
    - [75, 87.96]
  - - [128, 2048, 1, 8192, 128, 128, 8192, 8192]
    - [80, 101.85]
  - - [128, 4096, 1, 128, 128, 128, 128, 128]
    - [23, 16.33]
  - - [128, 4096, 1, 256, 128, 128, 256, 256]
    - [22, 29.45]
  - - [128, 4096, 1, 512, 128, 128, 512, 512]
    - [22, 49.34]
  - - [128, 4096, 1, 1024, 128, 128, 1024, 1024]
    - [71, 76.17]
  - - [128, 4096, 1, 2048, 128, 128, 2048, 2048]
    - [72, 105.4]
  - - [128, 4096, 1, 4096, 128, 128, 4096, 4096]
    - [72, 130.06]
  - - [128, 4096, 1, 8192, 128, 128, 8192, 8192]
    - [97, 142.38]
  - - [128, 8192, 1, 128, 128, 128, 128, 128]
    - [16, 28.45]
  - - [128, 8192, 1, 256, 128, 128, 256, 256]
    - [15, 49.51]
  - - [128, 8192, 1, 512, 128, 128, 512, 512]
    - [15, 82.87]
  - - [128, 8192, 1, 1024, 128, 128, 1024, 1024]
    - [15, 123.41]
  - - [128, 8192, 1, 2048, 128, 128, 2048, 2048]
    - [15, 159.96]
  - - [128, 8192, 1, 4096, 128, 128, 4096, 4096]
    - [96, 165.46]
  - - [128, 8192, 1, 8192, 128, 128, 8192, 8192]
    - [95, 189.53]
  - - [256, 128, 1, 128, 256, 256, 128, 128]
    - [28, 1.07]
  - - [256, 128, 1, 256, 256, 256, 256, 256]
    - [30, 2.13]
  - - [256, 128, 1, 512, 256, 256, 512, 512]
    - [86, 3.93]
  - - [256, 128, 1, 1024, 256, 256, 1024, 1024]
    - [84, 6.78]
  - - [256, 128, 1, 2048, 256, 256, 2048, 2048]
    - [84, 10.42]
  - - [256, 128, 1, 4096, 256, 256, 4096, 4096]
    - [84, 14.21]
  - - [256, 128, 1, 8192, 256, 256, 8192, 8192]
    - [84, 17.22]
  - - [256, 256, 1, 128, 256, 256, 128, 128]
    - [93, 2.18]
  - - [256, 256, 1, 256, 256, 256, 256, 256]
    - [89, 4.27]
  - - [256, 256, 1, 512, 256, 256, 512, 512]
    - [92, 7.56]
  - - [256, 256, 1, 1024, 256, 256, 1024, 1024]
    - [85, 13.51]
  - - [256, 256, 1, 2048, 256, 256, 2048, 2048]
    - [84, 20.96]
  - - [256, 256, 1, 4096, 256, 256, 4096, 4096]
    - [84, 27.87]
  - - [256, 256, 1, 8192, 256, 256, 8192, 8192]
    - [84, 34.12]
  - - [256, 512, 1, 128, 256, 256, 128, 128]
    - [85, 4.77]
  - - [256, 512, 1, 256, 256, 256, 256, 256]
    - [87, 8.91]
  - - [256, 512, 1, 512, 256, 256, 512, 512]
    - [86, 15.58]
  - - [256, 512, 1, 1024, 256, 256, 1024, 1024]
    - [84, 26.96]
  - - [256, 512, 1, 2048, 256, 256, 2048, 2048]
    - [84, 41.22]
  - - [256, 512, 1, 4096, 256, 256, 4096, 4096]
    - [84, 55.81]
  - - [256, 512, 1, 8192, 256, 256, 8192, 8192]
    - [84, 67.17]
  - - [256, 1024, 1, 128, 256, 256, 128, 128]
    - [77, 8.5]
  - - [256, 1024, 1, 256, 256, 256, 256, 256]
    - [83, 16.31]
  - - [256, 1024, 1, 512, 256, 256, 512, 512]
    - [83, 28.48]
  - - [256, 1024, 1, 1024, 256, 256, 1024, 1024]
    - [82, 46.7]
  - - [256, 1024, 1, 2048, 256, 256, 2048, 2048]
    - [74, 68.23]
  - - [256, 1024, 1, 4096, 256, 256, 4096, 4096]
    - [74, 87.93]
  - - [256, 1024, 1, 8192, 256, 256, 8192, 8192]
    - [80, 102.1]
  - - [256, 2048, 1, 128, 256, 256, 128, 128]
    - [23, 16.24]
  - - [256, 2048, 1, 256, 256, 256, 256, 256]
    - [23, 29.23]
  - - [256, 2048, 1, 512, 256, 256, 512, 512]
    - [21, 48.98]
  - - [256, 2048, 1, 1024, 256, 256, 1024, 1024]
    - [72, 75.87]
  - - [256, 2048, 1, 2048, 256, 256, 2048, 2048]
    - [72, 104.91]
  - - [256, 2048, 1, 4096, 256, 256, 4096, 4096]
    - [72, 130.62]
  - - [256, 2048, 1, 8192, 256, 256, 8192, 8192]
    - [97, 142.19]
  - - [256, 4096, 1, 128, 256, 256, 128, 128]
    - [16, 28.37]
  - - [256, 4096, 1, 256, 256, 256, 256, 256]
    - [15, 50.78]
  - - [256, 4096, 1, 512, 256, 256, 512, 512]
    - [15, 84.63]
  - - [256, 4096, 1, 1024, 256, 256, 1024, 1024]
    - [15, 122.55]
  - - [256, 4096, 1, 2048, 256, 256, 2048, 2048]
    - [15, 163.04]
  - - [256, 4096, 1, 4096, 256, 256, 4096, 4096]
    - [94, 179.53]
  - - [256, 4096, 1, 8192, 256, 256, 8192, 8192]
    - [66, 193.98]
  - - [256, 8192, 1, 128, 256, 256, 128, 128]
    - [11, 43.99]
  - - [256, 8192, 1, 256, 256, 256, 256, 256]
    - [11, 77.97]
  - - [256, 8192, 1, 512, 256, 256, 512, 512]
    - [11, 126.16]
  - - [256, 8192, 1, 1024, 256, 256, 1024, 1024]
    - [11, 183.21]
  - - [256, 8192, 1, 2048, 256, 256, 2048, 2048]
    - [11, 228.32]
  - - [256, 8192, 1, 4096, 256, 256, 4096, 4096]
    - [61, 227.74]
  - - [256, 8192, 1, 8192, 256, 256, 8192, 8192]
    - [60, 251.4]
  - - [512, 128, 1, 128, 512, 512, 128, 128]
    - [87, 2.41]
  - - [512, 128, 1, 256, 512, 512, 256, 256]
    - [30, 4.52]
  - - [512, 128, 1, 512, 512, 512, 512, 512]
    - [87, 8.1]
  - - [512, 128, 1, 1024, 512, 512, 1024, 1024]
    - [84, 13.69]
  - - [512, 128, 1, 2048, 512, 512, 2048, 2048]
    - [84, 20.74]
  - - [512, 128, 1, 4096, 512, 512, 4096, 4096]
    - [84, 28.15]
  - - [512, 128, 1, 8192, 512, 512, 8192, 8192]
    - [84, 34.23]
  - - [512, 256, 1, 128, 512, 512, 128, 128]
    - [29, 3.17]
  - - [512, 256, 1, 256, 512, 512, 256, 256]
    - [70, 5.75]
  - - [512, 256, 1, 512, 512, 512, 512, 512]
    - [30, 12.12]
  - - [512, 256, 1, 1024, 512, 512, 1024, 1024]
    - [86, 20.91]
  - - [512, 256, 1, 2048, 512, 512, 2048, 2048]
    - [100, 40.86]
  - - [512, 256, 1, 4096, 512, 512, 4096, 4096]
    - [90, 54.8]
  - - [512, 256, 1, 8192, 512, 512, 8192, 8192]
    - [88, 66.9]
  - - [512, 512, 1, 128, 512, 512, 128, 128]
    - [83, 9.04]
  - - [512, 512, 1, 256, 512, 512, 256, 256]
    - [83, 16.8]
  - - [512, 512, 1, 512, 512, 512, 512, 512]
    - [82, 29.53]
  - - [512, 512, 1, 1024, 512, 512, 1024, 1024]
    - [80, 47.48]
  - - [512, 512, 1, 2048, 512, 512, 2048, 2048]
    - [80, 68.61]
  - - [512, 512, 1, 4096, 512, 512, 4096, 4096]
    - [74, 88.42]
  - - [512, 512, 1, 8192, 512, 512, 8192, 8192]
    - [102, 97.23]
  - - [512, 1024, 1, 128, 512, 512, 128, 128]
    - [23, 16.45]
  - - [512, 1024, 1, 256, 512, 512, 256, 256]
    - [22, 29.63]
  - - [512, 1024, 1, 512, 512, 512, 512, 512]
    - [20, 49.24]
  - - [512, 1024, 1, 1024, 512, 512, 1024, 1024]
    - [72, 76.61]
  - - [512, 1024, 1, 2048, 512, 512, 2048, 2048]
    - [72, 106.09]
  - - [512, 1024, 1, 4096, 512, 512, 4096, 4096]
    - [72, 130.81]
  - - [512, 1024, 1, 8192, 512, 512, 8192, 8192]
    - [97, 142.24]
  - - [512, 2048, 1, 128, 512, 512, 128, 128]
    - [16, 27.81]
  - - [512, 2048, 1, 256, 512, 512, 256, 256]
    - [15, 50.14]
  - - [512, 2048, 1, 512, 512, 512, 512, 512]
    - [15, 81.92]
  - - [512, 2048, 1, 1024, 512, 512, 1024, 1024]
    - [17, 121.29]
  - - [512, 2048, 1, 2048, 512, 512, 2048, 2048]
    - [15, 159.14]
  - - [512, 2048, 1, 4096, 512, 512, 4096, 4096]
    - [15, 193.08]
  - - [512, 2048, 1, 8192, 512, 512, 8192, 8192]
    - [66, 192.52]
  - - [512, 4096, 1, 128, 512, 512, 128, 128]
    - [11, 43.94]
  - - [512, 4096, 1, 256, 512, 512, 256, 256]
    - [11, 77.76]
  - - [512, 4096, 1, 512, 512, 512, 512, 512]
    - [11, 125.68]
  - - [512, 4096, 1, 1024, 512, 512, 1024, 1024]
    - [11, 183.12]
  - - [512, 4096, 1, 2048, 512, 512, 2048, 2048]
    - [50, 235.39]
  - - [512, 4096, 1, 4096, 512, 512, 4096, 4096]
    - [50, 233.69]
  - - [512, 4096, 1, 8192, 512, 512, 8192, 8192]
    - [60, 256.77]
  - - [512, 8192, 1, 128, 512, 512, 128, 128]
    - [54, 64.37]
  - - [512, 8192, 1, 256, 512, 512, 256, 256]
    - [55, 116.86]
  - - [512, 8192, 1, 512, 512, 512, 512, 512]
    - [56, 188.14]
  - - [512, 8192, 1, 1024, 512, 512, 1024, 1024]
    - [55, 268.06]
  - - [512, 8192, 1, 2048, 512, 512, 2048, 2048]
    - [54, 259.99]
  - - [512, 8192, 1, 4096, 512, 512, 4096, 4096]
    - [55, 286.81]
  - - [512, 8192, 1, 8192, 512, 512, 8192, 8192]
    - [55, 293.44]
  - - [1024, 128, 1, 128, 1024, 1024, 128, 128]
    - [27, 4.49]
  - - [1024, 128, 1, 256, 1024, 1024, 256, 256]
    - [101, 8.46]
  - - [1024, 128, 1, 512, 1024, 1024, 512, 512]
    - [91, 15.14]
  - - [1024, 128, 1, 1024, 1024, 1024, 1024, 1024]
    - [84, 26.62]
  - - [1024, 128, 1, 2048, 1024, 1024, 2048, 2048]
    - [86, 40.01]
  - - [1024, 128, 1, 4096, 1024, 1024, 4096, 4096]
    - [84, 54.57]
  - - [1024, 128, 1, 8192, 1024, 1024, 8192, 8192]
    - [88, 66.56]
  - - [1024, 256, 1, 128, 1024, 1024, 128, 128]
    - [26, 8.67]
  - - [1024, 256, 1, 256, 1024, 1024, 256, 256]
    - [82, 16.31]
  - - [1024, 256, 1, 512, 1024, 1024, 512, 512]
    - [80, 29.17]
  - - [1024, 256, 1, 1024, 1024, 1024, 1024, 1024]
    - [80, 46.41]
  - - [1024, 256, 1, 2048, 1024, 1024, 2048, 2048]
    - [82, 67.46]
  - - [1024, 256, 1, 4096, 1024, 1024, 4096, 4096]
    - [74, 87.73]
  - - [1024, 256, 1, 8192, 1024, 1024, 8192, 8192]
    - [78, 102.73]
  - - [1024, 512, 1, 128, 1024, 1024, 128, 128]
    - [23, 15.94]
  - - [1024, 512, 1, 256, 1024, 1024, 256, 256]
    - [23, 28.95]
  - - [1024, 512, 1, 512, 1024, 1024, 512, 512]
    - [22, 48.93]
  - - [1024, 512, 1, 1024, 1024, 1024, 1024, 1024]
    - [71, 76.19]
  - - [1024, 512, 1, 2048, 1024, 1024, 2048, 2048]
    - [72, 105.31]
  - - [1024, 512, 1, 4096, 1024, 1024, 4096, 4096]
    - [73, 128.57]
  - - [1024, 512, 1, 8192, 1024, 1024, 8192, 8192]
    - [97, 142.48]
  - - [1024, 1024, 1, 128, 1024, 1024, 128, 128]
    - [16, 27.98]
  - - [1024, 1024, 1, 256, 1024, 1024, 256, 256]
    - [15, 49.81]
  - - [1024, 1024, 1, 512, 1024, 1024, 512, 512]
    - [15, 82.91]
  - - [1024, 1024, 1, 1024, 1024, 1024, 1024, 1024]
    - [15, 123.41]
  - - [1024, 1024, 1, 2048, 1024, 1024, 2048, 2048]
    - [15, 161.06]
  - - [1024, 1024, 1, 4096, 1024, 1024, 4096, 4096]
    - [96, 176.94]
  - - [1024, 1024, 1, 8192, 1024, 1024, 8192, 8192]
    - [95, 193.07]
  - - [1024, 2048, 1, 128, 1024, 1024, 128, 128]
    - [11, 43.8]
  - - [1024, 2048, 1, 256, 1024, 1024, 256, 256]
    - [11, 77.58]
  - - [1024, 2048, 1, 512, 1024, 1024, 512, 512]
    - [11, 126.6]
  - - [1024, 2048, 1, 1024, 1024, 1024, 1024, 1024]
    - [12, 182.38]
  - - [1024, 2048, 1, 2048, 1024, 1024, 2048, 2048]
    - [50, 235.94]
  - - [1024, 2048, 1, 4096, 1024, 1024, 4096, 4096]
    - [50, 235.99]
  - - [1024, 2048, 1, 8192, 1024, 1024, 8192, 8192]
    - [63, 253.95]
  - - [1024, 4096, 1, 128, 1024, 1024, 128, 128]
    - [8, 60.81]
  - - [1024, 4096, 1, 256, 1024, 1024, 256, 256]
    - [8, 106.13]
  - - [1024, 4096, 1, 512, 1024, 1024, 512, 512]
    - [8, 169.49]
  - - [1024, 4096, 1, 1024, 1024, 1024, 1024, 1024]
    - [8, 236.19]
  - - [1024, 4096, 1, 2048, 1024, 1024, 2048, 2048]
    - [42, 263.18]
  - - [1024, 4096, 1, 4096, 1024, 1024, 4096, 4096]
    - [42, 275.37]
  - - [1024, 4096, 1, 8192, 1024, 1024, 8192, 8192]
    - [42, 271.05]
  - - [1024, 8192, 1, 128, 1024, 1024, 128, 128]
    - [35, 92.22]
  - - [1024, 8192, 1, 256, 1024, 1024, 256, 256]
    - [35, 159.54]
  - - [1024, 8192, 1, 512, 1024, 1024, 512, 512]
    - [35, 246.62]
  - - [1024, 8192, 1, 1024, 1024, 1024, 1024, 1024]
    - [35, 280.25]
  - - [1024, 8192, 1, 2048, 1024, 1024, 2048, 2048]
    - [34, 323.73]
  - - [1024, 8192, 1, 4096, 1024, 1024, 4096, 4096]
    - [39, 351.5]
  - - [1024, 8192, 1, 8192, 1024, 1024, 8192, 8192]
    - [34, 368.33]
  - - [2048, 128, 1, 128, 2048, 2048, 128, 128]
    - [81, 8.74]
  - - [2048, 128, 1, 256, 2048, 2048, 256, 256]
    - [81, 16.19]
  - - [2048, 128, 1, 512, 2048, 2048, 512, 512]
    - [82, 28.93]
  - - [2048, 128, 1, 1024, 2048, 2048, 1024, 1024]
    - [82, 46.61]
  - - [2048, 128, 1, 2048, 2048, 2048, 2048, 2048]
    - [74, 67.9]
  - - [2048, 128, 1, 4096, 2048, 2048, 4096, 4096]
    - [74, 87.98]
  - - [2048, 128, 1, 8192, 2048, 2048, 8192, 8192]
    - [79, 100.54]
  - - [2048, 256, 1, 128, 2048, 2048, 128, 128]
    - [20, 15.92]
  - - [2048, 256, 1, 256, 2048, 2048, 256, 256]
    - [22, 29.06]
  - - [2048, 256, 1, 512, 2048, 2048, 512, 512]
    - [24, 48.47]
  - - [2048, 256, 1, 1024, 2048, 2048, 1024, 1024]
    - [72, 75.71]
  - - [2048, 256, 1, 2048, 2048, 2048, 2048, 2048]
    - [71, 104.47]
  - - [2048, 256, 1, 4096, 2048, 2048, 4096, 4096]
    - [73, 128.9]
  - - [2048, 256, 1, 8192, 2048, 2048, 8192, 8192]
    - [98, 141.82]
  - - [2048, 512, 1, 128, 2048, 2048, 128, 128]
    - [16, 27.34]
  - - [2048, 512, 1, 256, 2048, 2048, 256, 256]
    - [15, 49.21]
  - - [2048, 512, 1, 512, 2048, 2048, 512, 512]
    - [15, 81.6]
  - - [2048, 512, 1, 1024, 2048, 2048, 1024, 1024]
    - [15, 122.06]
  - - [2048, 512, 1, 2048, 2048, 2048, 2048, 2048]
    - [18, 159.49]
  - - [2048, 512, 1, 4096, 2048, 2048, 4096, 4096]
    - [68, 180.06]
  - - [2048, 512, 1, 8192, 2048, 2048, 8192, 8192]
    - [67, 192.28]
  - - [2048, 1024, 1, 128, 2048, 2048, 128, 128]
    - [10, 43.61]
  - - [2048, 1024, 1, 256, 2048, 2048, 256, 256]
    - [11, 77.08]
  - - [2048, 1024, 1, 512, 2048, 2048, 512, 512]
    - [11, 125.74]
  - - [2048, 1024, 1, 1024, 2048, 2048, 1024, 1024]
    - [11, 182.36]
  - - [2048, 1024, 1, 2048, 2048, 2048, 2048, 2048]
    - [51, 228.2]
  - - [2048, 1024, 1, 4096, 2048, 2048, 4096, 4096]
    - [65, 231.03]
  - - [2048, 1024, 1, 8192, 2048, 2048, 8192, 8192]
    - [62, 253.53]
  - - [2048, 2048, 1, 128, 2048, 2048, 128, 128]
    - [8, 60.68]
  - - [2048, 2048, 1, 256, 2048, 2048, 256, 256]
    - [8, 106.26]
  - - [2048, 2048, 1, 512, 2048, 2048, 512, 512]
    - [8, 169.62]
  - - [2048, 2048, 1, 1024, 2048, 2048, 1024, 1024]
    - [8, 237.3]
  - - [2048, 2048, 1, 2048, 2048, 2048, 2048, 2048]
    - [45, 257.66]
  - - [2048, 2048, 1, 4096, 2048, 2048, 4096, 4096]
    - [45, 274.66]
  - - [2048, 2048, 1, 8192, 2048, 2048, 8192, 8192]
    - [44, 270.21]
  - - [2048, 4096, 1, 128, 2048, 2048, 128, 128]
    - [4, 75.2]
  - - [2048, 4096, 1, 256, 2048, 2048, 256, 256]
    - [1, 129.13]
  - - [2048, 4096, 1, 512, 2048, 2048, 512, 512]
    - [0, 188.35]
  - - [2048, 4096, 1, 1024, 2048, 2048, 1024, 1024]
    - [6, 250.22]
  - - [2048, 4096, 1, 2048, 2048, 2048, 2048, 2048]
    - [5, 278.03]
  - - [2048, 4096, 1, 4096, 2048, 2048, 4096, 4096]
    - [40, 292.51]
  - - [2048, 4096, 1, 8192, 2048, 2048, 8192, 8192]
    - [38, 324.78]
  - - [2048, 8192, 1, 128, 2048, 2048, 128, 128]
    - [41, 100.06]
  - - [2048, 8192, 1, 256, 2048, 2048, 256, 256]
    - [41, 166.09]
  - - [2048, 8192, 1, 512, 2048, 2048, 512, 512]
    - [35, 242.68]
  - - [2048, 8192, 1, 1024, 2048, 2048, 1024, 1024]
    - [34, 294.84]
  - - [2048, 8192, 1, 2048, 2048, 2048, 2048, 2048]
    - [34, 324.11]
  - - [2048, 8192, 1, 4096, 2048, 2048, 4096, 4096]
    - [40, 335.34]
  - - [2048, 8192, 1, 8192, 2048, 2048, 8192, 8192]
    - [38, 375.04]
  - - [4096, 128, 1, 128, 4096, 4096, 128, 128]
    - [23, 16.24]
  - - [4096, 128, 1, 256, 4096, 4096, 256, 256]
    - [22, 29.26]
  - - [4096, 128, 1, 512, 4096, 4096, 512, 512]
    - [72, 49.17]
  - - [4096, 128, 1, 1024, 4096, 4096, 1024, 1024]
    - [72, 76.43]
  - - [4096, 128, 1, 2048, 4096, 4096, 2048, 2048]
    - [72, 104.93]
  - - [4096, 128, 1, 4096, 4096, 4096, 4096, 4096]
    - [73, 129.85]
  - - [4096, 128, 1, 8192, 4096, 4096, 8192, 8192]
    - [99, 141.96]
  - - [4096, 256, 1, 128, 4096, 4096, 128, 128]
    - [14, 27.66]
  - - [4096, 256, 1, 256, 4096, 4096, 256, 256]
    - [15, 49.23]
  - - [4096, 256, 1, 512, 4096, 4096, 512, 512]
    - [19, 82.41]
  - - [4096, 256, 1, 1024, 4096, 4096, 1024, 1024]
    - [19, 123.02]
  - - [4096, 256, 1, 2048, 4096, 4096, 2048, 2048]
    - [18, 161.12]
  - - [4096, 256, 1, 4096, 4096, 4096, 4096, 4096]
    - [67, 178.15]
  - - [4096, 256, 1, 8192, 4096, 4096, 8192, 8192]
    - [96, 195.19]
  - - [4096, 512, 1, 128, 4096, 4096, 128, 128]
    - [50, 44.65]
  - - [4096, 512, 1, 256, 4096, 4096, 256, 256]
    - [11, 78.65]
  - - [4096, 512, 1, 512, 4096, 4096, 512, 512]
    - [11, 127.11]
  - - [4096, 512, 1, 1024, 4096, 4096, 1024, 1024]
    - [11, 184.2]
  - - [4096, 512, 1, 2048, 4096, 4096, 2048, 2048]
    - [52, 229.18]
  - - [4096, 512, 1, 4096, 4096, 4096, 4096, 4096]
    - [52, 237.22]
  - - [4096, 512, 1, 8192, 4096, 4096, 8192, 8192]
    - [64, 257.08]
  - - [4096, 1024, 1, 128, 4096, 4096, 128, 128]
    - [8, 61.49]
  - - [4096, 1024, 1, 256, 4096, 4096, 256, 256]
    - [8, 107.58]
  - - [4096, 1024, 1, 512, 4096, 4096, 512, 512]
    - [8, 169.6]
  - - [4096, 1024, 1, 1024, 4096, 4096, 1024, 1024]
    - [9, 225.84]
  - - [4096, 1024, 1, 2048, 4096, 4096, 2048, 2048]
    - [45, 269.3]
  - - [4096, 1024, 1, 4096, 4096, 4096, 4096, 4096]
    - [43, 271.15]
  - - [4096, 1024, 1, 8192, 4096, 4096, 8192, 8192]
    - [33, 267.92]
  - - [4096, 2048, 1, 128, 4096, 4096, 128, 128]
    - [2, 74.84]
  - - [4096, 2048, 1, 256, 4096, 4096, 256, 256]
    - [1, 127.15]
  - - [4096, 2048, 1, 512, 4096, 4096, 512, 512]
    - [1, 188.54]
  - - [4096, 2048, 1, 1024, 4096, 4096, 1024, 1024]
    - [6, 251.16]
  - - [4096, 2048, 1, 2048, 4096, 4096, 2048, 2048]
    - [3, 277.09]
  - - [4096, 2048, 1, 4096, 4096, 4096, 4096, 4096]
    - [46, 285.74]
  - - [4096, 2048, 1, 8192, 4096, 4096, 8192, 8192]
    - [46, 316.23]
  - - [4096, 4096, 1, 128, 4096, 4096, 128, 128]
    - [4, 82.72]
  - - [4096, 4096, 1, 256, 4096, 4096, 256, 256]
    - [4, 138.78]
  - - [4096, 4096, 1, 512, 4096, 4096, 512, 512]
    - [4, 199.04]
  - - [4096, 4096, 1, 1024, 4096, 4096, 1024, 1024]
    - [6, 247.35]
  - - [4096, 4096, 1, 2048, 4096, 4096, 2048, 2048]
    - [37, 271.44]
  - - [4096, 4096, 1, 4096, 4096, 4096, 4096, 4096]
    - [46, 293.85]
  - - [4096, 4096, 1, 8192, 4096, 4096, 8192, 8192]
    - [32, 344.72]
  - - [4096, 8192, 1, 128, 4096, 4096, 128, 128]
    - [35, 108.5]
  - - [4096, 8192, 1, 256, 4096, 4096, 256, 256]
    - [35, 176.25]
  - - [4096, 8192, 1, 512, 4096, 4096, 512, 512]
    - [34, 238.75]
  - - [4096, 8192, 1, 1024, 4096, 4096, 1024, 1024]
    - [36, 281.36]
  - - [4096, 8192, 1, 2048, 4096, 4096, 2048, 2048]
    - [38, 313.52]
  - - [4096, 8192, 1, 4096, 4096, 4096, 4096, 4096]
    - [39, 348.28]
  - - [4096, 8192, 1, 8192, 4096, 4096, 8192, 8192]
    - [38, 392.85]
  - - [8192, 128, 1, 128, 8192, 8192, 128, 128]
    - [69, 28.54]
  - - [8192, 128, 1, 256, 8192, 8192, 256, 256]
    - [15, 50.17]
  - - [8192, 128, 1, 512, 8192, 8192, 512, 512]
    - [15, 83.37]
  - - [8192, 128, 1, 1024, 8192, 8192, 1024, 1024]
    - [15, 121.89]
  - - [8192, 128, 1, 2048, 8192, 8192, 2048, 2048]
    - [18, 160.53]
  - - [8192, 128, 1, 4096, 8192, 8192, 4096, 4096]
    - [95, 170.36]
  - - [8192, 128, 1, 8192, 8192, 8192, 8192, 8192]
    - [96, 190.38]
  - - [8192, 256, 1, 128, 8192, 8192, 128, 128]
    - [11, 43.92]
  - - [8192, 256, 1, 256, 8192, 8192, 256, 256]
    - [11, 77.63]
  - - [8192, 256, 1, 512, 8192, 8192, 512, 512]
    - [12, 126.17]
  - - [8192, 256, 1, 1024, 8192, 8192, 1024, 1024]
    - [11, 183.66]
  - - [8192, 256, 1, 2048, 8192, 8192, 2048, 2048]
    - [52, 227.32]
  - - [8192, 256, 1, 4096, 8192, 8192, 4096, 4096]
    - [65, 229.28]
  - - [8192, 256, 1, 8192, 8192, 8192, 8192, 8192]
    - [53, 249.66]
  - - [8192, 512, 1, 128, 8192, 8192, 128, 128]
    - [8, 61.15]
  - - [8192, 512, 1, 256, 8192, 8192, 256, 256]
    - [8, 106.21]
  - - [8192, 512, 1, 512, 8192, 8192, 512, 512]
    - [57, 167.92]
  - - [8192, 512, 1, 1024, 8192, 8192, 1024, 1024]
    - [58, 251.83]
  - - [8192, 512, 1, 2048, 8192, 8192, 2048, 2048]
    - [45, 259.81]
  - - [8192, 512, 1, 4096, 8192, 8192, 4096, 4096]
    - [59, 298.12]
  - - [8192, 512, 1, 8192, 8192, 8192, 8192, 8192]
    - [57, 327.43]
  - - [8192, 1024, 1, 128, 8192, 8192, 128, 128]
    - [4, 74.72]
  - - [8192, 1024, 1, 256, 8192, 8192, 256, 256]
    - [4, 125.99]
  - - [8192, 1024, 1, 512, 8192, 8192, 512, 512]
    - [49, 189.33]
  - - [8192, 1024, 1, 1024, 8192, 8192, 1024, 1024]
    - [6, 242.04]
  - - [8192, 1024, 1, 2048, 8192, 8192, 2048, 2048]
    - [48, 306.27]
  - - [8192, 1024, 1, 4096, 8192, 8192, 4096, 4096]
    - [49, 370.01]
  - - [8192, 1024, 1, 8192, 8192, 8192, 8192, 8192]
    - [47, 384.35]
  - - [8192, 2048, 1, 128, 8192, 8192, 128, 128]
    - [35, 80.13]
  - - [8192, 2048, 1, 256, 8192, 8192, 256, 256]
    - [1, 136.66]
  - - [8192, 2048, 1, 512, 8192, 8192, 512, 512]
    - [6, 193.91]
  - - [8192, 2048, 1, 1024, 8192, 8192, 1024, 1024]
    - [49, 262.45]
  - - [8192, 2048, 1, 2048, 8192, 8192, 2048, 2048]
    - [49, 316.93]
  - - [8192, 2048, 1, 4096, 8192, 8192, 4096, 4096]
    - [47, 349.45]
  - - [8192, 2048, 1, 8192, 8192, 8192, 8192, 8192]
    - [48, 409.13]
  - - [8192, 4096, 1, 128, 8192, 8192, 128, 128]
    - [4, 86.44]
  - - [8192, 4096, 1, 256, 8192, 8192, 256, 256]
    - [13, 147.82]
  - - [8192, 4096, 1, 512, 8192, 8192, 512, 512]
    - [7, 206.55]
  - - [8192, 4096, 1, 1024, 8192, 8192, 1024, 1024]
    - [45, 255.62]
  - - [8192, 4096, 1, 2048, 8192, 8192, 2048, 2048]
    - [48, 325.16]
  - - [8192, 4096, 1, 4096, 8192, 8192, 4096, 4096]
    - [48, 362.56]
  - - [8192, 4096, 1, 8192, 8192, 8192, 8192, 8192]
    - [48, 432.23]
  - - [8192, 8192, 1, 128, 8192, 8192, 128, 128]
    - [39, 111.36]
  - - [8192, 8192, 1, 256, 8192, 8192, 256, 256]
    - [41, 167.17]
  - - [8192, 8192, 1, 512, 8192, 8192, 512, 512]
    - [6, 219.91]
  - - [8192, 8192, 1, 1024, 8192, 8192, 1024, 1024]
    - [6, 288.78]
  - - [8192, 8192, 1, 2048, 8192, 8192, 2048, 2048]
    - [47, 342.54]
  - - [8192, 8192, 1, 4096, 8192, 8192, 4096, 4096]
    - [48, 374.87]
  - - [8192, 8192, 1, 8192, 8192, 8192, 8192, 8192]
    - [48, 432.82]
  - - [1, 1, 1, 32, 1, 1, 32, 32]
    - [103, 0.0]
- null
- null
- ExperimentalStreamK
- GridBased
