projects/hipblaslt/library/src/amd_detail/rocblaslt/src/Tensile/Logic/asm_full/aquavanjaram/gfx942_228cu/StreamK/aquavanjaram942_Cijk_Alik_Bjlk_BBS_BH_Bias_HAS_SAV_UserArgs.yaml
- {MinimumRequiredVersion: 4.33.0}
- aquavanjaram942
- {Architecture: gfx942, CUCount: 228}
- [Device 0049, Device 0050]
    SolutionIndex: 0
    SolutionNameMin: Cijk_Alik_Bjlk_BBS_BH_Bias_AS_SAV_UserArgs_MT256x256x32_MI16x16x1_SN_LDSB1_CLR1_GRVWB8_GSU0_GSUC0_GSUWGMRR0_K1_LBSPPA512_LBSPPB2048_LPB0_MIWT8_8_PLR1_SU0_SUM0_SUS64_VWA8_VWB8_WGM1_WGMXCC1_WGMXCCGn1
    SolutionIndex: 1
    SolutionNameMin: Cijk_Alik_Bjlk_BBS_BH_Bias_AS_SAV_UserArgs_MT256x256x32_MI16x16x1_SN_LDSB1_CLR1_GRVWB8_GSU0_GSUC0_GSUWGMRR0_K1_LBSPPA512_LBSPPB2048_LPB0_MIWT8_8_PLR1_SU0_SUM0_SUS64_VWA8_VWB8_WGM1_WGMXCC1_WGMXCCGn1
    SolutionIndex: 2
    SolutionNameMin: Cijk_Alik_Bjlk_BBS_BH_Bias_AS_SAV_UserArgs_MT256x256x32_MI16x16x1_SN_LDSB1_CLR1_GRVWB8_GSU0_GSUC0_GSUWGMRR0_K1_LBSPPA512_LBSPPB2048_LPB0_MIWT8_8_PLR1_SU0_SUM0_SUS64_VWA8_VWB8_WGM1_WGMXCC1_WGMXCCGn1
    SolutionIndex: 3
    SolutionNameMin: Cijk_Alik_Bjlk_BBS_BH_Bias_AS_SAV_UserArgs_MT256x256x32_MI16x16x1_SN_LDSB1_CLR1_GRVWB8_GSU0_GSUC0_GSUWGMRR0_K1_LBSPPA512_LBSPPB2048_LPB0_MIWT8_8_PLR1_SU0_SUM0_SUS64_VWA8_VWB8_WGM4_WGMXCC1_WGMXCCGn1
    SolutionIndex: 4
    SolutionNameMin: Cijk_Alik_Bjlk_BBS_BH_Bias_AS_SAV_UserArgs_MT256x256x32_MI16x16x1_SN_LDSB1_CLR1_GRVWB8_GSU0_GSUC0_GSUWGMRR0_K1_LBSPPA512_LBSPPB2048_LPB0_MIWT8_8_PLR1_SU0_SUM0_SUS64_VWA8_VWB8_WGM4_WGMXCC1_WGMXCCGn1
    SolutionIndex: 5
    SolutionNameMin: Cijk_Alik_Bjlk_BBS_BH_Bias_AS_SAV_UserArgs_MT256x256x32_MI16x16x1_SN_LDSB1_CLR1_GRVWB8_GSU0_GSUC0_GSUWGMRR0_K1_LBSPPA512_LBSPPB2048_LPB0_MIWT8_8_PLR1_SU0_SUM0_SUS64_VWA8_VWB8_WGM4_WGMXCC1_WGMXCCGn1
    SolutionIndex: 6
    SolutionNameMin: Cijk_Alik_Bjlk_BBS_BH_Bias_AS_SAV_UserArgs_MT256x256x32_MI16x16x1_SN_LDSB1_CLR1_GRVWB8_GSU0_GSUC0_GSUWGMRR0_K1_LBSPPA512_LBSPPB4096_LPB0_MIWT8_8_PLR1_SU0_SUM0_SUS64_VWA8_VWB8_WGM4_WGMXCC1_WGMXCCGn1
    SolutionIndex: 7
    SolutionNameMin: Cijk_Alik_Bjlk_BBS_BH_Bias_AS_SAV_UserArgs_MT256x256x32_MI16x16x1_SN_LDSB1_CLR1_GRVWB8_GSU0_GSUC0_GSUWGMRR0_K1_LBSPPA512_LBSPPB2048_LPB0_MIWT8_8_PLR1_SU0_SUM0_SUS64_VWA8_VWB8_WGM6_WGMXCC1_WGMXCCGn1
    SolutionIndex: 8
    SolutionNameMin: Cijk_Alik_Bjlk_BBS_BH_Bias_AS_SAV_UserArgs_MT256x256x32_MI16x16x1_SN_LDSB1_CLR1_GRVWB8_GSU0_GSUC0_GSUWGMRR0_K1_LBSPPA512_LBSPPB2048_LPB0_MIWT8_8_PLR1_SU0_SUM0_SUS64_VWA8_VWB8_WGM6_WGMXCC1_WGMXCCGn1
    SolutionIndex: 9
    SolutionNameMin: Cijk_Alik_Bjlk_BBS_BH_Bias_AS_SAV_UserArgs_MT256x256x32_MI16x16x1_SN_LDSB1_CLR1_GRVWB8_GSU0_GSUC0_GSUWGMRR0_K1_LBSPPA512_LBSPPB2048_LPB0_MIWT8_8_PLR1_SU0_SUM0_SUS64_VWA8_VWB8_WGM8_WGMXCC1_WGMXCCGn1
    SolutionIndex: 10
    SolutionNameMin: Cijk_Alik_Bjlk_BBS_BH_Bias_AS_SAV_UserArgs_MT256x256x32_MI16x16x1_SN_LDSB1_CLR1_GRVWB8_GSU0_GSUC0_GSUWGMRR0_K1_LBSPPA512_LBSPPB2048_LPB0_MIWT8_8_PLR1_SU0_SUM0_SUS64_VWA8_VWB8_WGM8_WGMXCC1_WGMXCCGn1
    SolutionIndex: 11
    SolutionNameMin: Cijk_Alik_Bjlk_BBS_BH_Bias_AS_SAV_UserArgs_MT256x256x32_MI16x16x1_SN_LDSB1_CLR1_GRVWB8_GSU0_GSUC0_GSUWGMRR0_K1_LBSPPA512_LBSPPB2048_LPB0_MIWT8_8_PLR1_SU0_SUM0_SUS64_VWA8_VWB8_WGM8_WGMXCC1_WGMXCCGn1
    SolutionIndex: 12
    SolutionNameMin: Cijk_Alik_Bjlk_BBS_BH_Bias_AS_SAV_UserArgs_MT128x256x32_MI16x16x1_SN_LDSB1_CLR1_GRVWB8_GSU0_GSUC0_GSUWGMRR0_K1_LBSPPA256_LBSPPB2048_LPB0_MIWT4_8_PLR1_SU0_SUM0_SUS64_VWA4_VWB8_WGM1_WGMXCC1_WGMXCCGn1
    SolutionIndex: 13
    SolutionNameMin: Cijk_Alik_Bjlk_BBS_BH_Bias_AS_SAV_UserArgs_MT128x256x32_MI16x16x1_SN_LDSB1_CLR1_GRVWB8_GSU0_GSUC0_GSUWGMRR0_K1_LBSPPA256_LBSPPB2048_LPB0_MIWT4_8_PLR1_SU0_SUM0_SUS64_VWA4_VWB8_WGM1_WGMXCC1_WGMXCCGn1
    SolutionIndex: 14
    SolutionNameMin: Cijk_Alik_Bjlk_BBS_BH_Bias_AS_SAV_UserArgs_MT128x256x32_MI16x16x1_SN_LDSB1_CLR1_GRVWB8_GSU0_GSUC0_GSUWGMRR0_K1_LBSPPA256_LBSPPB2048_LPB0_MIWT4_8_PLR1_SU0_SUM0_SUS64_VWA4_VWB8_WGM1_WGMXCC1_WGMXCCGn1
    SolutionIndex: 15
    SolutionNameMin: Cijk_Alik_Bjlk_BBS_BH_Bias_AS_SAV_UserArgs_MT128x256x32_MI16x16x1_SN_LDSB1_CLR1_GRVWB8_GSU0_GSUC0_GSUWGMRR0_K1_LBSPPA256_LBSPPB2048_LPB0_MIWT4_8_PLR1_SU0_SUM0_SUS64_VWA4_VWB8_WGM4_WGMXCC1_WGMXCCGn1
    SolutionIndex: 16
    SolutionNameMin: Cijk_Alik_Bjlk_BBS_BH_Bias_AS_SAV_UserArgs_MT128x256x32_MI16x16x1_SN_LDSB1_CLR1_GRVWB8_GSU0_GSUC0_GSUWGMRR0_K1_LBSPPA256_LBSPPB2048_LPB0_MIWT4_8_PLR1_SU0_SUM0_SUS64_VWA4_VWB8_WGM4_WGMXCC1_WGMXCCGn1
    SolutionIndex: 17
    SolutionNameMin: Cijk_Alik_Bjlk_BBS_BH_Bias_AS_SAV_UserArgs_MT128x256x32_MI16x16x1_SN_LDSB1_CLR1_GRVWB8_GSU0_GSUC0_GSUWGMRR0_K1_LBSPPA256_LBSPPB2048_LPB0_MIWT4_8_PLR1_SU0_SUM0_SUS64_VWA4_VWB8_WGM4_WGMXCC1_WGMXCCGn1
    SolutionIndex: 18
    SolutionNameMin: Cijk_Alik_Bjlk_BBS_BH_Bias_AS_SAV_UserArgs_MT128x256x32_MI16x16x1_SN_LDSB1_CLR1_GRVWB8_GSU0_GSUC0_GSUWGMRR0_K1_LBSPPA256_LBSPPB2048_LPB0_MIWT4_8_PLR1_SU0_SUM0_SUS64_VWA4_VWB8_WGM6_WGMXCC1_WGMXCCGn1
    SolutionIndex: 19
    SolutionNameMin: Cijk_Alik_Bjlk_BBS_BH_Bias_AS_SAV_UserArgs_MT128x256x32_MI16x16x1_SN_LDSB1_CLR1_GRVWB8_GSU0_GSUC0_GSUWGMRR0_K1_LBSPPA256_LBSPPB2048_LPB0_MIWT4_8_PLR1_SU0_SUM0_SUS64_VWA4_VWB8_WGM6_WGMXCC1_WGMXCCGn1
    SolutionIndex: 20
    SolutionNameMin: Cijk_Alik_Bjlk_BBS_BH_Bias_AS_SAV_UserArgs_MT128x256x32_MI16x16x1_SN_LDSB1_CLR1_GRVWB8_GSU0_GSUC0_GSUWGMRR0_K1_LBSPPA256_LBSPPB2048_LPB0_MIWT4_8_PLR1_SU0_SUM0_SUS64_VWA4_VWB8_WGM6_WGMXCC1_WGMXCCGn1
    SolutionIndex: 21
    SolutionNameMin: Cijk_Alik_Bjlk_BBS_BH_Bias_AS_SAV_UserArgs_MT128x256x32_MI16x16x1_SN_LDSB1_CLR1_GRVWB8_GSU0_GSUC0_GSUWGMRR0_K1_LBSPPA256_LBSPPB2048_LPB0_MIWT4_8_PLR1_SU0_SUM0_SUS64_VWA4_VWB8_WGM8_WGMXCC1_WGMXCCGn1
    SolutionIndex: 22
    SolutionNameMin: Cijk_Alik_Bjlk_BBS_BH_Bias_AS_SAV_UserArgs_MT128x256x32_MI16x16x1_SN_LDSB1_CLR1_GRVWB8_GSU0_GSUC0_GSUWGMRR0_K1_LBSPPA256_LBSPPB2048_LPB0_MIWT4_8_PLR1_SU0_SUM0_SUS64_VWA4_VWB8_WGM8_WGMXCC1_WGMXCCGn1
    SolutionIndex: 23
    SolutionNameMin: Cijk_Alik_Bjlk_BBS_BH_Bias_AS_SAV_UserArgs_MT128x256x32_MI16x16x1_SN_LDSB1_CLR1_GRVWB8_GSU0_GSUC0_GSUWGMRR0_K1_LBSPPA256_LBSPPB2048_LPB0_MIWT4_8_PLR1_SU0_SUM0_SUS64_VWA4_VWB8_WGM8_WGMXCC1_WGMXCCGn1
    SolutionIndex: 24
    SolutionNameMin: Cijk_Alik_Bjlk_BBS_BH_Bias_AS_SAV_UserArgs_MT256x128x32_MI16x16x1_SN_LDSB1_CLR1_GRVWB2_GSU0_GSUC0_GSUWGMRR0_K1_LBSPPA512_LBSPPB1024_LPB0_MIWT8_4_PLR1_SU0_SUM0_SUS64_VWA8_VWB4_WGM4_WGMXCC1_WGMXCCGn1
    SolutionIndex: 25
    SolutionNameMin: Cijk_Alik_Bjlk_BBS_BH_Bias_AS_SAV_UserArgs_MT256x128x32_MI16x16x1_SN_LDSB1_CLR1_GRVWB8_GSU0_GSUC0_GSUWGMRR0_K1_LBSPPA512_LBSPPB1024_LPB0_MIWT8_4_PLR1_SU0_SUM0_SUS64_VWA8_VWB4_WGM4_WGMXCC1_WGMXCCGn1
    SolutionIndex: 26
    SolutionNameMin: Cijk_Alik_Bjlk_BBS_BH_Bias_AS_SAV_UserArgs_MT256x128x32_MI16x16x1_SN_LDSB1_CLR1_GRVWB8_GSU0_GSUC0_GSUWGMRR0_K1_LBSPPA512_LBSPPB1024_LPB0_MIWT8_4_PLR1_SU0_SUM0_SUS64_VWA8_VWB4_WGM8_WGMXCC1_WGMXCCGn1
    SolutionIndex: 27
    SolutionNameMin: Cijk_Alik_Bjlk_BBS_BH_Bias_AS_SAV_UserArgs_MT64x64x32_MI16x16x1_SN_LDSB0_CLR1_GRVWB2_GSU0_GSUC0_GSUWGMRR0_K1_LBSPPA128_LBSPPB512_LPB32_MIWT2_2_PLR1_SU0_SUM0_SUS64_VWA2_VWB2_WGM8_WGMXCC1_WGMXCCGn1
    SolutionIndex: 28
    SolutionNameMin: Cijk_Alik_Bjlk_BBS_BH_Bias_AS_SAV_UserArgs_MT128x256x64_MI16x16x1_SN_LDSB1_CLR1_GRVWB4_GSU0_GSUC0_GSUWGMRR0_K1_LBSPPA512_LBSPPB2048_LPB0_MIWT4_8_PLR1_SU0_SUM0_SUS128_VWA4_VWB8_WGM1_WGMXCC1_WGMXCCGn1
    SolutionIndex: 29
    SolutionNameMin: Cijk_Alik_Bjlk_BBS_BH_Bias_AS_SAV_UserArgs_MT128x256x64_MI16x16x1_SN_LDSB1_CLR1_GRVWB8_GSU0_GSUC0_GSUWGMRR0_K1_LBSPPA512_LBSPPB4096_LPB0_MIWT4_8_PLR1_SU0_SUM0_SUS128_VWA4_VWB8_WGM1_WGMXCC1_WGMXCCGn1
    SolutionIndex: 30
    SolutionNameMin: Cijk_Alik_Bjlk_BBS_BH_Bias_AS_SAV_UserArgs_MT128x256x64_MI16x16x1_SN_LDSB1_CLR1_GRVWB8_GSU0_GSUC0_GSUWGMRR0_K1_LBSPPA512_LBSPPB4096_LPB0_MIWT4_8_PLR1_SU0_SUM0_SUS128_VWA4_VWB8_WGM1_WGMXCC1_WGMXCCGn1
    SolutionIndex: 31
    SolutionNameMin: Cijk_Alik_Bjlk_BBS_BH_Bias_AS_SAV_UserArgs_MT128x256x64_MI16x16x1_SN_LDSB1_CLR1_GRVWB8_GSU0_GSUC0_GSUWGMRR0_K1_LBSPPA512_LBSPPB4096_LPB0_MIWT4_8_PLR1_SU0_SUM0_SUS128_VWA4_VWB8_WGM1_WGMXCC1_WGMXCCGn1
    SolutionIndex: 32
    SolutionNameMin: Cijk_Alik_Bjlk_BBS_BH_Bias_AS_SAV_UserArgs_MT128x256x64_MI16x16x1_SN_LDSB1_CLR1_GRVWB8_GSU0_GSUC0_GSUWGMRR0_K1_LBSPPA512_LBSPPB4096_LPB0_MIWT4_8_PLR1_SU0_SUM0_SUS128_VWA4_VWB8_WGM4_WGMXCC1_WGMXCCGn1
    SolutionIndex: 33
    SolutionNameMin: Cijk_Alik_Bjlk_BBS_BH_Bias_AS_SAV_UserArgs_MT128x256x64_MI16x16x1_SN_LDSB1_CLR1_GRVWB8_GSU0_GSUC0_GSUWGMRR0_K1_LBSPPA512_LBSPPB4096_LPB0_MIWT4_8_PLR1_SU0_SUM0_SUS128_VWA4_VWB8_WGM6_WGMXCC1_WGMXCCGn1
    SolutionIndex: 34
    SolutionNameMin: Cijk_Alik_Bjlk_BBS_BH_Bias_AS_SAV_UserArgs_MT128x256x64_MI16x16x1_SN_LDSB1_CLR1_GRVWB8_GSU0_GSUC0_GSUWGMRR0_K1_LBSPPA512_LBSPPB4096_LPB0_MIWT4_8_PLR1_SU0_SUM0_SUS128_VWA4_VWB8_WGM6_WGMXCC1_WGMXCCGn1
    SolutionIndex: 35
    SolutionNameMin: Cijk_Alik_Bjlk_BBS_BH_Bias_AS_SAV_UserArgs_MT128x256x64_MI16x16x1_SN_LDSB1_CLR1_GRVWB8_GSU0_GSUC0_GSUWGMRR0_K1_LBSPPA512_LBSPPB4096_LPB0_MIWT4_8_PLR1_SU0_SUM0_SUS128_VWA4_VWB8_WGM6_WGMXCC1_WGMXCCGn1
    SolutionIndex: 36
    SolutionNameMin: Cijk_Alik_Bjlk_BBS_BH_Bias_AS_SAV_UserArgs_MT256x128x64_MI16x16x1_SN_LDSB1_CLR1_GRVWB8_GSU0_GSUC0_GSUWGMRR0_K1_LBSPPA1024_LBSPPB2048_LPB0_MIWT8_4_PLR1_SU0_SUM0_SUS128_VWA8_VWB4_WGM1_WGMXCC1_WGMXCCGn1
    SolutionIndex: 37
    SolutionNameMin: Cijk_Alik_Bjlk_BBS_BH_Bias_AS_SAV_UserArgs_MT256x128x64_MI16x16x1_SN_LDSB1_CLR1_GRVWB8_GSU0_GSUC0_GSUWGMRR0_K1_LBSPPA1024_LBSPPB2048_LPB0_MIWT8_4_PLR1_SU0_SUM0_SUS128_VWA8_VWB4_WGM6_WGMXCC1_WGMXCCGn1
    SolutionIndex: 38
    SolutionNameMin: Cijk_Alik_Bjlk_BBS_BH_Bias_AS_SAV_UserArgs_MT256x128x64_MI16x16x1_SN_LDSB1_CLR1_GRVWB8_GSU0_GSUC0_GSUWGMRR0_K1_LBSPPA1024_LBSPPB1024_LPB0_MIWT8_4_PLR1_SU0_SUM0_SUS128_VWA8_VWB4_WGM8_WGMXCC1_WGMXCCGn1
    SolutionIndex: 39
    SolutionNameMin: Cijk_Alik_Bjlk_BBS_BH_Bias_AS_SAV_UserArgs_MT256x128x64_MI16x16x1_SN_LDSB1_CLR1_GRVWB8_GSU0_GSUC0_GSUWGMRR0_K1_LBSPPA1024_LBSPPB2048_LPB0_MIWT8_4_PLR1_SU0_SUM0_SUS128_VWA8_VWB4_WGM8_WGMXCC1_WGMXCCGn1
    SolutionIndex: 40
    SolutionNameMin: Cijk_Alik_Bjlk_BBS_BH_Bias_AS_SAV_UserArgs_MT128x128x64_MI16x16x1_SN_LDSB1_CLR1_GRVWB8_GSU0_GSUC0_GSUWGMRR0_K1_LBSPPA512_LBSPPB1024_LPB0_MIWT4_4_PLR1_SU0_SUM0_SUS128_VWA4_VWB4_WGM1_WGMXCC1_WGMXCCGn1
    SolutionIndex: 41
    SolutionNameMin: Cijk_Alik_Bjlk_BBS_BH_Bias_AS_SAV_UserArgs_MT128x128x64_MI16x16x1_SN_LDSB1_CLR1_GRVWB8_GSU0_GSUC0_GSUWGMRR0_K1_LBSPPA512_LBSPPB2048_LPB0_MIWT4_4_PLR1_SU0_SUM0_SUS128_VWA4_VWB4_WGM1_WGMXCC1_WGMXCCGn1
    SolutionIndex: 42
    SolutionNameMin: Cijk_Alik_Bjlk_BBS_BH_Bias_AS_SAV_UserArgs_MT128x128x64_MI16x16x1_SN_LDSB1_CLR1_GRVWB8_GSU0_GSUC0_GSUWGMRR0_K1_LBSPPA512_LBSPPB2048_LPB0_MIWT4_4_PLR1_SU0_SUM0_SUS128_VWA4_VWB4_WGM1_WGMXCC1_WGMXCCGn1
    SolutionIndex: 43
    SolutionNameMin: Cijk_Alik_Bjlk_BBS_BH_Bias_AS_SAV_UserArgs_MT128x128x64_MI16x16x1_SN_LDSB1_CLR1_GRVWB8_GSU0_GSUC0_GSUWGMRR0_K1_LBSPPA512_LBSPPB1024_LPB0_MIWT4_4_PLR1_SU0_SUM0_SUS128_VWA4_VWB4_WGM4_WGMXCC1_WGMXCCGn1
    SolutionIndex: 44
    SolutionNameMin: Cijk_Alik_Bjlk_BBS_BH_Bias_AS_SAV_UserArgs_MT128x128x64_MI16x16x1_SN_LDSB1_CLR1_GRVWB8_GSU0_GSUC0_GSUWGMRR0_K1_LBSPPA512_LBSPPB2048_LPB0_MIWT4_4_PLR1_SU0_SUM0_SUS128_VWA4_VWB4_WGM4_WGMXCC1_WGMXCCGn1
    SolutionIndex: 45
    SolutionNameMin: Cijk_Alik_Bjlk_BBS_BH_Bias_AS_SAV_UserArgs_MT128x128x64_MI16x16x1_SN_LDSB1_CLR1_GRVWB8_GSU0_GSUC0_GSUWGMRR0_K1_LBSPPA512_LBSPPB2048_LPB0_MIWT4_4_PLR1_SU0_SUM0_SUS128_VWA4_VWB4_WGM4_WGMXCC1_WGMXCCGn1
    SolutionIndex: 46
    SolutionNameMin: Cijk_Alik_Bjlk_BBS_BH_Bias_AS_SAV_UserArgs_MT128x128x64_MI16x16x1_SN_LDSB1_CLR1_GRVWB8_GSU0_GSUC0_GSUWGMRR0_K1_LBSPPA512_LBSPPB1024_LPB0_MIWT4_4_PLR1_SU0_SUM0_SUS128_VWA4_VWB4_WGM6_WGMXCC1_WGMXCCGn1
    SolutionIndex: 47
    SolutionNameMin: Cijk_Alik_Bjlk_BBS_BH_Bias_AS_SAV_UserArgs_MT128x128x64_MI16x16x1_SN_LDSB1_CLR1_GRVWB8_GSU0_GSUC0_GSUWGMRR0_K1_LBSPPA512_LBSPPB2048_LPB0_MIWT4_4_PLR1_SU0_SUM0_SUS128_VWA4_VWB4_WGM6_WGMXCC1_WGMXCCGn1
    SolutionIndex: 48
    SolutionNameMin: Cijk_Alik_Bjlk_BBS_BH_Bias_AS_SAV_UserArgs_MT128x128x64_MI16x16x1_SN_LDSB1_CLR1_GRVWB8_GSU0_GSUC0_GSUWGMRR0_K1_LBSPPA512_LBSPPB2048_LPB0_MIWT4_4_PLR1_SU0_SUM0_SUS128_VWA4_VWB4_WGM6_WGMXCC1_WGMXCCGn1
    SolutionIndex: 49
    SolutionNameMin: Cijk_Alik_Bjlk_BBS_BH_Bias_AS_SAV_UserArgs_MT128x128x64_MI16x16x1_SN_LDSB1_CLR1_GRVWB8_GSU0_GSUC0_GSUWGMRR0_K1_LBSPPA512_LBSPPB1024_LPB0_MIWT4_4_PLR1_SU0_SUM0_SUS128_VWA4_VWB4_WGM8_WGMXCC1_WGMXCCGn1
    SolutionIndex: 50
    SolutionNameMin: Cijk_Alik_Bjlk_BBS_BH_Bias_AS_SAV_UserArgs_MT128x128x64_MI16x16x1_SN_LDSB1_CLR1_GRVWB8_GSU0_GSUC0_GSUWGMRR0_K1_LBSPPA512_LBSPPB1024_LPB0_MIWT4_4_PLR1_SU0_SUM0_SUS128_VWA4_VWB4_WGM8_WGMXCC1_WGMXCCGn1
    SolutionIndex: 51
    SolutionNameMin: Cijk_Alik_Bjlk_BBS_BH_Bias_AS_SAV_UserArgs_MT128x128x64_MI16x16x1_SN_LDSB1_CLR1_GRVWB8_GSU0_GSUC0_GSUWGMRR0_K1_LBSPPA512_LBSPPB2048_LPB0_MIWT4_4_PLR1_SU0_SUM0_SUS128_VWA4_VWB4_WGM8_WGMXCC1_WGMXCCGn1
    SolutionIndex: 52
    SolutionNameMin: Cijk_Alik_Bjlk_BBS_BH_Bias_AS_SAV_UserArgs_MT64x128x64_MI16x16x1_SN_LDSB1_CLR1_GRVWB8_GSU0_GSUC0_GSUWGMRR0_K1_LBSPPA256_LBSPPB1024_LPB0_MIWT2_4_PLR1_SU0_SUM0_SUS128_VWA2_VWB4_WGM1_WGMXCC1_WGMXCCGn1
    SolutionIndex: 53
    SolutionNameMin: Cijk_Alik_Bjlk_BBS_BH_Bias_AS_SAV_UserArgs_MT64x128x64_MI16x16x1_SN_LDSB1_CLR1_GRVWB8_GSU0_GSUC0_GSUWGMRR0_K1_LBSPPA256_LBSPPB1024_LPB0_MIWT2_4_PLR1_SU0_SUM0_SUS128_VWA2_VWB4_WGM1_WGMXCC1_WGMXCCGn1
    SolutionIndex: 54
    SolutionNameMin: Cijk_Alik_Bjlk_BBS_BH_Bias_AS_SAV_UserArgs_MT64x128x64_MI16x16x1_SN_LDSB1_CLR1_GRVWB8_GSU0_GSUC0_GSUWGMRR0_K1_LBSPPA256_LBSPPB1024_LPB0_MIWT2_4_PLR1_SU0_SUM0_SUS128_VWA2_VWB4_WGM1_WGMXCC1_WGMXCCGn1
    SolutionIndex: 55
    SolutionNameMin: Cijk_Alik_Bjlk_BBS_BH_Bias_AS_SAV_UserArgs_MT64x128x64_MI16x16x1_SN_LDSB1_CLR1_GRVWB8_GSU0_GSUC0_GSUWGMRR0_K1_LBSPPA256_LBSPPB2048_LPB0_MIWT2_4_PLR1_SU0_SUM0_SUS128_VWA2_VWB4_WGM1_WGMXCC1_WGMXCCGn1
    SolutionIndex: 56
    SolutionNameMin: Cijk_Alik_Bjlk_BBS_BH_Bias_AS_SAV_UserArgs_MT64x128x64_MI16x16x1_SN_LDSB1_CLR1_GRVWB8_GSU0_GSUC0_GSUWGMRR0_K1_LBSPPA256_LBSPPB2048_LPB0_MIWT2_4_PLR1_SU0_SUM0_SUS128_VWA2_VWB4_WGM1_WGMXCC1_WGMXCCGn1
    SolutionIndex: 57
    SolutionNameMin: Cijk_Alik_Bjlk_BBS_BH_Bias_AS_SAV_UserArgs_MT64x128x64_MI16x16x1_SN_LDSB1_CLR1_GRVWB8_GSU0_GSUC0_GSUWGMRR0_K1_LBSPPA256_LBSPPB2048_LPB0_MIWT2_4_PLR1_SU0_SUM0_SUS128_VWA2_VWB4_WGM8_WGMXCC1_WGMXCCGn1
    SolutionIndex: 58
    SolutionNameMin: Cijk_Alik_Bjlk_BBS_BH_Bias_AS_SAV_UserArgs_MT128x64x64_MI16x16x1_SN_LDSB1_CLR1_GRVWB8_GSU0_GSUC0_GSUWGMRR0_K1_LBSPPA512_LBSPPB1024_LPB32_MIWT4_2_PLR1_SU0_SUM0_SUS128_VWA4_VWB2_WGM1_WGMXCC1_WGMXCCGn1
    SolutionIndex: 59
    SolutionNameMin: Cijk_Alik_Bjlk_BBS_BH_Bias_AS_SAV_UserArgs_MT128x64x64_MI16x16x1_SN_LDSB1_CLR1_GRVWB8_GSU0_GSUC0_GSUWGMRR0_K1_LBSPPA512_LBSPPB1024_LPB32_MIWT4_2_PLR1_SU0_SUM0_SUS128_VWA4_VWB2_WGM4_WGMXCC1_WGMXCCGn1
    SolutionIndex: 60
    SolutionNameMin: Cijk_Alik_Bjlk_BBS_BH_Bias_AS_SAV_UserArgs_MT128x64x64_MI16x16x1_SN_LDSB1_CLR1_GRVWB8_GSU0_GSUC0_GSUWGMRR0_K1_LBSPPA512_LBSPPB1024_LPB32_MIWT4_2_PLR1_SU0_SUM0_SUS128_VWA4_VWB2_WGM6_WGMXCC1_WGMXCCGn1
    SolutionIndex: 61
    SolutionNameMin: Cijk_Alik_Bjlk_BBS_BH_Bias_AS_SAV_UserArgs_MT64x64x64_MI16x16x1_SN_LDSB1_CLR1_GRVWB8_GSU0_GSUC0_GSUWGMRR0_K1_LBSPPA256_LBSPPB512_LPB32_MIWT2_2_PLR1_SU0_SUM0_SUS128_VWA2_VWB2_WGM1_WGMXCC1_WGMXCCGn1
    SolutionIndex: 62
    SolutionNameMin: Cijk_Alik_Bjlk_BBS_BH_Bias_AS_SAV_UserArgs_MT64x64x64_MI16x16x1_SN_LDSB1_CLR1_GRVWB8_GSU0_GSUC0_GSUWGMRR0_K1_LBSPPA256_LBSPPB512_LPB32_MIWT2_2_PLR1_SU0_SUM0_SUS128_VWA2_VWB2_WGM1_WGMXCC1_WGMXCCGn1
    SolutionIndex: 63
    SolutionNameMin: Cijk_Alik_Bjlk_BBS_BH_Bias_AS_SAV_UserArgs_MT64x64x64_MI16x16x1_SN_LDSB1_CLR1_GRVWB8_GSU0_GSUC0_GSUWGMRR0_K1_LBSPPA256_LBSPPB512_LPB32_MIWT2_2_PLR1_SU0_SUM0_SUS128_VWA2_VWB2_WGM1_WGMXCC1_WGMXCCGn1
    SolutionIndex: 64
    SolutionNameMin: Cijk_Alik_Bjlk_BBS_BH_Bias_AS_SAV_UserArgs_MT64x64x64_MI16x16x1_SN_LDSB1_CLR1_GRVWB2_GSU0_GSUC0_GSUWGMRR0_K1_LBSPPA256_LBSPPB1024_LPB32_MIWT2_2_PLR1_SU0_SUM0_SUS128_VWA2_VWB2_WGM1_WGMXCC1_WGMXCCGn1
    SolutionIndex: 65
    SolutionNameMin: Cijk_Alik_Bjlk_BBS_BH_Bias_AS_SAV_UserArgs_MT64x64x64_MI16x16x1_SN_LDSB1_CLR1_GRVWB2_GSU0_GSUC0_GSUWGMRR0_K1_LBSPPA256_LBSPPB1024_LPB32_MIWT2_2_PLR1_SU0_SUM0_SUS128_VWA2_VWB2_WGM4_WGMXCC1_WGMXCCGn1
    SolutionIndex: 66
    SolutionNameMin: Cijk_Alik_Bjlk_BBS_BH_Bias_AS_SAV_UserArgs_MT64x64x64_MI16x16x1_SN_LDSB1_CLR1_GRVWB8_GSU0_GSUC0_GSUWGMRR0_K1_LBSPPA256_LBSPPB1024_LPB32_MIWT2_2_PLR1_SU0_SUM0_SUS128_VWA2_VWB2_WGM4_WGMXCC1_WGMXCCGn1
    SolutionIndex: 67
    SolutionNameMin: Cijk_Alik_Bjlk_BBS_BH_Bias_AS_SAV_UserArgs_MT64x64x64_MI16x16x1_SN_LDSB1_CLR1_GRVWB8_GSU0_GSUC0_GSUWGMRR0_K1_LBSPPA256_LBSPPB1024_LPB32_MIWT2_2_PLR1_SU0_SUM0_SUS128_VWA2_VWB2_WGM4_WGMXCC1_WGMXCCGn1
    SolutionIndex: 68
    SolutionNameMin: Cijk_Alik_Bjlk_BBS_BH_Bias_AS_SAV_UserArgs_MT64x64x64_MI16x16x1_SN_LDSB1_CLR1_GRVWB8_GSU0_GSUC0_GSUWGMRR0_K1_LBSPPA256_LBSPPB1024_LPB32_MIWT2_2_PLR1_SU0_SUM0_SUS128_VWA2_VWB2_WGM6_WGMXCC1_WGMXCCGn1
    SolutionIndex: 69
    SolutionNameMin: Cijk_Alik_Bjlk_BBS_BH_Bias_AS_SAV_UserArgs_MT64x64x64_MI16x16x1_SN_LDSB1_CLR1_GRVWB2_GSU0_GSUC0_GSUWGMRR0_K1_LBSPPA256_LBSPPB512_LPB32_MIWT2_2_PLR1_SU0_SUM0_SUS128_VWA2_VWB2_WGM8_WGMXCC1_WGMXCCGn1
    SolutionIndex: 70
    SolutionNameMin: Cijk_Alik_Bjlk_BBS_BH_Bias_AS_SAV_UserArgs_MT64x64x64_MI16x16x1_SN_LDSB1_CLR1_GRVWB2_GSU0_GSUC0_GSUWGMRR0_K1_LBSPPA256_LBSPPB1024_LPB32_MIWT2_2_PLR1_SU0_SUM0_SUS128_VWA2_VWB2_WGM8_WGMXCC1_WGMXCCGn1
    SolutionIndex: 71
    SolutionNameMin: Cijk_Alik_Bjlk_BBS_BH_Bias_AS_SAV_UserArgs_MT32x64x64_MI16x16x1_SN_LDSB0_CLR1_GRVWB2_GSU0_GSUC0_GSUWGMRR0_K1_LBSPPA128_LBSPPB1024_LPB32_MIWT1_2_PLR1_SU0_SUM0_SUS128_VWA1_VWB2_WGM1_WGMXCC1_WGMXCCGn1
    SolutionIndex: 72
    SolutionNameMin: Cijk_Alik_Bjlk_BBS_BH_Bias_AS_SAV_UserArgs_MT32x64x64_MI16x16x1_SN_LDSB0_CLR1_GRVWB8_GSU0_GSUC0_GSUWGMRR0_K1_LBSPPA128_LBSPPB1024_LPB32_MIWT1_2_PLR1_SU0_SUM0_SUS128_VWA1_VWB2_WGM1_WGMXCC1_WGMXCCGn1
    SolutionIndex: 73
    SolutionNameMin: Cijk_Alik_Bjlk_BBS_BH_Bias_AS_SAV_UserArgs_MT32x32x64_MI16x16x1_SN_LDSB0_CLR1_GRVWB2_GSU0_GSUC0_GSUWGMRR0_K1_LBSPPA128_LBSPPB256_LPB16_MIWT1_1_PLR1_SU0_SUM0_SUS128_VWA1_VWB1_WGM1_WGMXCC1_WGMXCCGn1
    SolutionIndex: 74
    SolutionNameMin: Cijk_Alik_Bjlk_BBS_BH_Bias_AS_SAV_UserArgs_MT32x32x64_MI16x16x1_SN_LDSB0_CLR1_GRVWB2_GSU0_GSUC0_GSUWGMRR0_K1_LBSPPA128_LBSPPB512_LPB16_MIWT1_1_PLR1_SU0_SUM0_SUS128_VWA1_VWB1_WGM1_WGMXCC1_WGMXCCGn1
    SolutionIndex: 75
    SolutionNameMin: Cijk_Alik_Bjlk_BBS_BH_Bias_AS_SAV_UserArgs_MT64x128x128_MI16x16x1_SN_LDSB1_CLR1_GRVWB8_GSU0_GSUC0_GSUWGMRR0_K1_LBSPPA512_LBSPPB1024_LPB0_MIWT2_4_PLR1_SU0_SUM0_SUS256_VWA2_VWB4_WGM1_WGMXCC1_WGMXCCGn1
    SolutionIndex: 76
    SolutionNameMin: Cijk_Alik_Bjlk_BBS_BH_Bias_AS_SAV_UserArgs_MT64x128x128_MI16x16x1_SN_LDSB1_CLR1_GRVWB8_GSU0_GSUC0_GSUWGMRR0_K1_LBSPPA512_LBSPPB2048_LPB0_MIWT2_4_PLR1_SU0_SUM0_SUS256_VWA2_VWB4_WGM1_WGMXCC1_WGMXCCGn1
    SolutionIndex: 77
    SolutionNameMin: Cijk_Alik_Bjlk_BBS_BH_Bias_AS_SAV_UserArgs_MT64x128x128_MI16x16x1_SN_LDSB1_CLR1_GRVWB8_GSU0_GSUC0_GSUWGMRR0_K1_LBSPPA512_LBSPPB1024_LPB0_MIWT2_4_PLR1_SU0_SUM0_SUS256_VWA2_VWB4_WGM4_WGMXCC1_WGMXCCGn1
    SolutionIndex: 78
    SolutionNameMin: Cijk_Alik_Bjlk_BBS_BH_Bias_AS_SAV_UserArgs_MT64x128x128_MI16x16x1_SN_LDSB1_CLR1_GRVWB8_GSU0_GSUC0_GSUWGMRR0_K1_LBSPPA512_LBSPPB2048_LPB0_MIWT2_4_PLR1_SU0_SUM0_SUS256_VWA2_VWB4_WGM4_WGMXCC1_WGMXCCGn1
    SolutionIndex: 79
    SolutionNameMin: Cijk_Alik_Bjlk_BBS_BH_Bias_AS_SAV_UserArgs_MT64x128x128_MI16x16x1_SN_LDSB1_CLR1_GRVWB8_GSU0_GSUC0_GSUWGMRR0_K1_LBSPPA512_LBSPPB1024_LPB0_MIWT2_4_PLR1_SU0_SUM0_SUS256_VWA2_VWB4_WGM6_WGMXCC1_WGMXCCGn1
    SolutionIndex: 80
    SolutionNameMin: Cijk_Alik_Bjlk_BBS_BH_Bias_AS_SAV_UserArgs_MT64x128x128_MI16x16x1_SN_LDSB1_CLR1_GRVWB8_GSU0_GSUC0_GSUWGMRR0_K1_LBSPPA512_LBSPPB2048_LPB0_MIWT2_4_PLR1_SU0_SUM0_SUS256_VWA2_VWB4_WGM6_WGMXCC1_WGMXCCGn1
    SolutionIndex: 81
    SolutionNameMin: Cijk_Alik_Bjlk_BBS_BH_Bias_AS_SAV_UserArgs_MT64x128x128_MI16x16x1_SN_LDSB1_CLR1_GRVWB8_GSU0_GSUC0_GSUWGMRR0_K1_LBSPPA512_LBSPPB2048_LPB0_MIWT2_4_PLR1_SU0_SUM0_SUS256_VWA2_VWB4_WGM6_WGMXCC1_WGMXCCGn1
    SolutionIndex: 82
    SolutionNameMin: Cijk_Alik_Bjlk_BBS_BH_Bias_AS_SAV_UserArgs_MT64x128x128_MI16x16x1_SN_LDSB1_CLR1_GRVWB8_GSU0_GSUC0_GSUWGMRR0_K1_LBSPPA512_LBSPPB1024_LPB0_MIWT2_4_PLR1_SU0_SUM0_SUS256_VWA2_VWB4_WGM8_WGMXCC1_WGMXCCGn1
    SolutionIndex: 83
    SolutionNameMin: Cijk_Alik_Bjlk_BBS_BH_Bias_AS_SAV_UserArgs_MT64x128x128_MI16x16x1_SN_LDSB1_CLR1_GRVWB8_GSU0_GSUC0_GSUWGMRR0_K1_LBSPPA512_LBSPPB2048_LPB0_MIWT2_4_PLR1_SU0_SUM0_SUS256_VWA2_VWB4_WGM8_WGMXCC1_WGMXCCGn1
    SolutionIndex: 84
    SolutionNameMin: Cijk_Alik_Bjlk_BBS_BH_Bias_AS_SAV_UserArgs_MT32x128x128_MI16x16x1_SN_LDSB1_CLR1_GRVWB8_GSU0_GSUC0_GSUWGMRR0_K1_LBSPPA256_LBSPPB1024_LPB0_MIWT1_4_PLR1_SU0_SUM0_SUS256_VWA1_VWB4_WGM1_WGMXCC1_WGMXCCGn1
    SolutionIndex: 85
    SolutionNameMin: Cijk_Alik_Bjlk_BBS_BH_Bias_AS_SAV_UserArgs_MT64x64x128_MI16x16x1_SN_LDSB1_CLR1_GRVWB8_GSU0_GSUC0_GSUWGMRR0_K1_LBSPPA512_LBSPPB512_LPB32_MIWT2_2_PLR1_SU0_SUM0_SUS256_VWA2_VWB2_WGM1_WGMXCC1_WGMXCCGn1
    SolutionIndex: 86
    SolutionNameMin: Cijk_Alik_Bjlk_BBS_BH_Bias_AS_SAV_UserArgs_MT64x64x128_MI16x16x1_SN_LDSB1_CLR1_GRVWB2_GSU0_GSUC0_GSUWGMRR0_K1_LBSPPA512_LBSPPB1024_LPB32_MIWT2_2_PLR1_SU0_SUM0_SUS256_VWA2_VWB2_WGM1_WGMXCC1_WGMXCCGn1
    SolutionIndex: 87
    SolutionNameMin: Cijk_Alik_Bjlk_BBS_BH_Bias_AS_SAV_UserArgs_MT64x64x128_MI16x16x1_SN_LDSB1_CLR1_GRVWB8_GSU0_GSUC0_GSUWGMRR0_K1_LBSPPA512_LBSPPB1024_LPB32_MIWT2_2_PLR1_SU0_SUM0_SUS256_VWA2_VWB2_WGM1_WGMXCC1_WGMXCCGn1
    SolutionIndex: 88
    SolutionNameMin: Cijk_Alik_Bjlk_BBS_BH_Bias_AS_SAV_UserArgs_MT64x64x128_MI16x16x1_SN_LDSB1_CLR1_GRVWB8_GSU0_GSUC0_GSUWGMRR0_K1_LBSPPA512_LBSPPB1024_LPB32_MIWT2_2_PLR1_SU0_SUM0_SUS256_VWA2_VWB2_WGM4_WGMXCC1_WGMXCCGn1
    SolutionIndex: 89
    SolutionNameMin: Cijk_Alik_Bjlk_BBS_BH_Bias_AS_SAV_UserArgs_MT64x64x128_MI16x16x1_SN_LDSB1_CLR1_GRVWB8_GSU0_GSUC0_GSUWGMRR0_K1_LBSPPA512_LBSPPB512_LPB32_MIWT2_2_PLR1_SU0_SUM0_SUS256_VWA2_VWB2_WGM6_WGMXCC1_WGMXCCGn1
    SolutionIndex: 90
    SolutionNameMin: Cijk_Alik_Bjlk_BBS_BH_Bias_AS_SAV_UserArgs_MT64x64x128_MI16x16x1_SN_LDSB1_CLR1_GRVWB8_GSU0_GSUC0_GSUWGMRR0_K1_LBSPPA512_LBSPPB1024_LPB32_MIWT2_2_PLR1_SU0_SUM0_SUS256_VWA2_VWB2_WGM6_WGMXCC1_WGMXCCGn1
    SolutionIndex: 91
    SolutionNameMin: Cijk_Alik_Bjlk_BBS_BH_Bias_AS_SAV_UserArgs_MT64x64x128_MI16x16x1_SN_LDSB1_CLR1_GRVWB8_GSU0_GSUC0_GSUWGMRR0_K1_LBSPPA512_LBSPPB512_LPB32_MIWT2_2_PLR1_SU0_SUM0_SUS256_VWA2_VWB2_WGM8_WGMXCC1_WGMXCCGn1
    SolutionIndex: 92
    SolutionNameMin: Cijk_Alik_Bjlk_BBS_BH_Bias_AS_SAV_UserArgs_MT64x64x128_MI16x16x1_SN_LDSB1_CLR1_GRVWB8_GSU0_GSUC0_GSUWGMRR0_K1_LBSPPA512_LBSPPB1024_LPB32_MIWT2_2_PLR1_SU0_SUM0_SUS256_VWA2_VWB2_WGM8_WGMXCC1_WGMXCCGn1
    SolutionIndex: 93
    SolutionNameMin: Cijk_Alik_Bjlk_BBS_BH_Bias_AS_SAV_UserArgs_MT32x64x128_MI16x16x1_SN_LDSB1_CLR1_GRVWB8_GSU0_GSUC0_GSUWGMRR0_K1_LBSPPA256_LBSPPB512_LPB32_MIWT1_2_PLR1_SU0_SUM0_SUS256_VWA1_VWB2_WGM1_WGMXCC1_WGMXCCGn1
    SolutionIndex: 94
    SolutionNameMin: Cijk_Alik_Bjlk_BBS_BH_Bias_AS_SAV_UserArgs_MT32x64x128_MI16x16x1_SN_LDSB1_CLR1_GRVWB8_GSU0_GSUC0_GSUWGMRR0_K1_LBSPPA256_LBSPPB512_LPB32_MIWT1_2_PLR1_SU0_SUM0_SUS256_VWA1_VWB2_WGM1_WGMXCC1_WGMXCCGn1
    SolutionIndex: 95
    SolutionNameMin: Cijk_Alik_Bjlk_BBS_BH_Bias_AS_SAV_UserArgs_MT32x64x128_MI16x16x1_SN_LDSB1_CLR1_GRVWB8_GSU0_GSUC0_GSUWGMRR0_K1_LBSPPA256_LBSPPB512_LPB32_MIWT1_2_PLR1_SU0_SUM0_SUS256_VWA1_VWB2_WGM1_WGMXCC1_WGMXCCGn1
    SolutionIndex: 96
    SolutionNameMin: Cijk_Alik_Bjlk_BBS_BH_Bias_AS_SAV_UserArgs_MT32x64x128_MI16x16x1_SN_LDSB1_CLR1_GRVWB2_GSU0_GSUC0_GSUWGMRR0_K1_LBSPPA256_LBSPPB1024_LPB32_MIWT1_2_PLR1_SU0_SUM0_SUS256_VWA1_VWB2_WGM1_WGMXCC1_WGMXCCGn1
    SolutionIndex: 97
    SolutionNameMin: Cijk_Alik_Bjlk_BBS_BH_Bias_AS_SAV_UserArgs_MT32x64x128_MI16x16x1_SN_LDSB1_CLR1_GRVWB8_GSU0_GSUC0_GSUWGMRR0_K1_LBSPPA256_LBSPPB1024_LPB32_MIWT1_2_PLR1_SU0_SUM0_SUS256_VWA1_VWB2_WGM1_WGMXCC1_WGMXCCGn1
    SolutionIndex: 98
    SolutionNameMin: Cijk_Alik_Bjlk_BBS_BH_Bias_AS_SAV_UserArgs_MT32x64x128_MI16x16x1_SN_LDSB1_CLR1_GRVWB8_GSU0_GSUC0_GSUWGMRR0_K1_LBSPPA256_LBSPPB1024_LPB32_MIWT1_2_PLR1_SU0_SUM0_SUS256_VWA1_VWB2_WGM1_WGMXCC1_WGMXCCGn1
    SolutionIndex: 99
    SolutionNameMin: Cijk_Alik_Bjlk_BBS_BH_Bias_AS_SAV_UserArgs_MT32x64x128_MI16x16x1_SN_LDSB1_CLR1_GRVWB8_GSU0_GSUC0_GSUWGMRR0_K1_LBSPPA256_LBSPPB1024_LPB32_MIWT1_2_PLR1_SU0_SUM0_SUS256_VWA1_VWB2_WGM4_WGMXCC1_WGMXCCGn1
    SolutionIndex: 100
    SolutionNameMin: Cijk_Alik_Bjlk_BBS_BH_Bias_AS_SAV_UserArgs_MT32x64x128_MI16x16x1_SN_LDSB1_CLR1_GRVWB8_GSU0_GSUC0_GSUWGMRR0_K1_LBSPPA256_LBSPPB1024_LPB32_MIWT1_2_PLR1_SU0_SUM0_SUS256_VWA1_VWB2_WGM4_WGMXCC1_WGMXCCGn1
    SolutionIndex: 101
    SolutionNameMin: Cijk_Alik_Bjlk_BBS_BH_Bias_AS_SAV_UserArgs_MT32x64x128_MI16x16x1_SN_LDSB1_CLR1_GRVWB8_GSU0_GSUC0_GSUWGMRR0_K1_LBSPPA256_LBSPPB512_LPB32_MIWT1_2_PLR1_SU0_SUM0_SUS256_VWA1_VWB2_WGM6_WGMXCC1_WGMXCCGn1
    SolutionIndex: 102
    SolutionNameMin: Cijk_Alik_Bjlk_BBS_BH_Bias_AS_SAV_UserArgs_MT32x64x128_MI16x16x1_SN_LDSB1_CLR1_GRVWB8_GSU0_GSUC0_GSUWGMRR0_K1_LBSPPA256_LBSPPB1024_LPB32_MIWT1_2_PLR1_SU0_SUM0_SUS256_VWA1_VWB2_WGM6_WGMXCC1_WGMXCCGn1
    SolutionIndex: 103
    SolutionNameMin: Cijk_Alik_Bjlk_BBS_BH_Bias_AS_SAV_UserArgs_MT32x64x128_MI16x16x1_SN_LDSB1_CLR1_GRVWB8_GSU0_GSUC0_GSUWGMRR0_K1_LBSPPA256_LBSPPB1024_LPB32_MIWT1_2_PLR1_SU0_SUM0_SUS256_VWA1_VWB2_WGM6_WGMXCC1_WGMXCCGn1
    SolutionIndex: 104
    SolutionNameMin: Cijk_Alik_Bjlk_BBS_BH_Bias_AS_SAV_UserArgs_MT32x64x128_MI16x16x1_SN_LDSB1_CLR1_GRVWB8_GSU0_GSUC0_GSUWGMRR0_K1_LBSPPA256_LBSPPB512_LPB32_MIWT1_2_PLR1_SU0_SUM0_SUS256_VWA1_VWB2_WGM8_WGMXCC1_WGMXCCGn1
    SolutionIndex: 105
    SolutionNameMin: Cijk_Alik_Bjlk_BBS_BH_Bias_AS_SAV_UserArgs_MT32x64x128_MI16x16x1_SN_LDSB1_CLR1_GRVWB8_GSU0_GSUC0_GSUWGMRR0_K1_LBSPPA256_LBSPPB1024_LPB32_MIWT1_2_PLR1_SU0_SUM0_SUS256_VWA1_VWB2_WGM8_WGMXCC1_WGMXCCGn1
    SolutionIndex: 106
    SolutionNameMin: Cijk_Alik_Bjlk_BBS_BH_Bias_AS_SAV_UserArgs_MT64x32x128_MI16x16x1_SN_LDSB1_CLR1_GRVWB4_GSU0_GSUC0_GSUWGMRR0_K1_LBSPPA512_LBSPPB512_LPB16_MIWT2_1_PLR1_SU0_SUM0_SUS256_VWA2_VWB1_WGM1_WGMXCC1_WGMXCCGn1
    SolutionIndex: 107
    SolutionNameMin: Cijk_Alik_Bjlk_BBS_BH_Bias_AS_SAV_UserArgs_MT64x32x128_MI16x16x1_SN_LDSB1_CLR1_GRVWB8_GSU0_GSUC0_GSUWGMRR0_K1_LBSPPA512_LBSPPB512_LPB16_MIWT2_1_PLR1_SU0_SUM0_SUS256_VWA2_VWB1_WGM1_WGMXCC1_WGMXCCGn1
    SolutionIndex: 108
    SolutionNameMin: Cijk_Alik_Bjlk_BBS_BH_Bias_AS_SAV_UserArgs_MT64x32x128_MI16x16x1_SN_LDSB1_CLR1_GRVWB8_GSU0_GSUC0_GSUWGMRR0_K1_LBSPPA512_LBSPPB512_LPB16_MIWT2_1_PLR1_SU0_SUM0_SUS256_VWA2_VWB1_WGM4_WGMXCC1_WGMXCCGn1
    SolutionIndex: 109
    SolutionNameMin: Cijk_Alik_Bjlk_BBS_BH_Bias_AS_SAV_UserArgs_MT32x32x128_MI16x16x1_SN_LDSB1_CLR1_GRVWB8_GSU0_GSUC0_GSUWGMRR0_K1_LBSPPA256_LBSPPB256_LPB16_MIWT1_1_PLR1_SU0_SUM0_SUS256_VWA1_VWB1_WGM1_WGMXCC1_WGMXCCGn1
    SolutionIndex: 110
    SolutionNameMin: Cijk_Alik_Bjlk_BBS_BH_Bias_AS_SAV_UserArgs_MT32x32x128_MI16x16x1_SN_LDSB1_CLR1_GRVWB2_GSU0_GSUC0_GSUWGMRR0_K1_LBSPPA256_LBSPPB512_LPB16_MIWT1_1_PLR1_SU0_SUM0_SUS256_VWA1_VWB1_WGM1_WGMXCC1_WGMXCCGn1
    SolutionIndex: 111
    SolutionNameMin: Cijk_Alik_Bjlk_BBS_BH_Bias_AS_SAV_UserArgs_MT32x32x128_MI16x16x1_SN_LDSB1_CLR1_GRVWB2_GSU0_GSUC0_GSUWGMRR0_K1_LBSPPA256_LBSPPB512_LPB16_MIWT1_1_PLR1_SU0_SUM0_SUS256_VWA1_VWB1_WGM1_WGMXCC1_WGMXCCGn1
    SolutionIndex: 112
    SolutionNameMin: Cijk_Alik_Bjlk_BBS_BH_Bias_AS_SAV_UserArgs_MT32x32x128_MI16x16x1_SN_LDSB1_CLR1_GRVWB4_GSU0_GSUC0_GSUWGMRR0_K1_LBSPPA256_LBSPPB512_LPB16_MIWT1_1_PLR1_SU0_SUM0_SUS256_VWA1_VWB1_WGM1_WGMXCC1_WGMXCCGn1
    SolutionIndex: 113
    SolutionNameMin: Cijk_Alik_Bjlk_BBS_BH_Bias_AS_SAV_UserArgs_MT32x32x128_MI16x16x1_SN_LDSB1_CLR1_GRVWB4_GSU0_GSUC0_GSUWGMRR0_K1_LBSPPA256_LBSPPB512_LPB16_MIWT1_1_PLR1_SU0_SUM0_SUS256_VWA1_VWB1_WGM1_WGMXCC1_WGMXCCGn1
    SolutionIndex: 114
    SolutionNameMin: Cijk_Alik_Bjlk_BBS_BH_Bias_AS_SAV_UserArgs_MT32x32x128_MI16x16x1_SN_LDSB1_CLR1_GRVWB8_GSU0_GSUC0_GSUWGMRR0_K1_LBSPPA256_LBSPPB512_LPB16_MIWT1_1_PLR1_SU0_SUM0_SUS256_VWA1_VWB1_WGM1_WGMXCC1_WGMXCCGn1
    SolutionIndex: 115
    SolutionNameMin: Cijk_Alik_Bjlk_BBS_BH_Bias_AS_SAV_UserArgs_MT32x32x128_MI16x16x1_SN_LDSB1_CLR1_GRVWB8_GSU0_GSUC0_GSUWGMRR0_K1_LBSPPA256_LBSPPB512_LPB16_MIWT1_1_PLR1_SU0_SUM0_SUS256_VWA1_VWB1_WGM1_WGMXCC1_WGMXCCGn1
    SolutionIndex: 116
    SolutionNameMin: Cijk_Alik_Bjlk_BBS_BH_Bias_AS_SAV_UserArgs_MT32x32x128_MI16x16x1_SN_LDSB1_CLR1_GRVWB8_GSU0_GSUC0_GSUWGMRR0_K1_LBSPPA256_LBSPPB512_LPB16_MIWT1_1_PLR1_SU0_SUM0_SUS256_VWA1_VWB1_WGM4_WGMXCC1_WGMXCCGn1
    SolutionIndex: 117
    SolutionNameMin: Cijk_Alik_Bjlk_BBS_BH_Bias_AS_SAV_UserArgs_MT32x32x128_MI16x16x1_SN_LDSB1_CLR1_GRVWB8_GSU0_GSUC0_GSUWGMRR0_K1_LBSPPA256_LBSPPB512_LPB16_MIWT1_1_PLR1_SU0_SUM0_SUS256_VWA1_VWB1_WGM6_WGMXCC1_WGMXCCGn1
    SolutionIndex: 118
    SolutionNameMin: Cijk_Alik_Bjlk_BBS_BH_Bias_AS_SAV_UserArgs_MT32x32x128_MI16x16x1_SN_LDSB1_CLR1_GRVWB8_GSU0_GSUC0_GSUWGMRR0_K1_LBSPPA256_LBSPPB512_LPB16_MIWT1_1_PLR1_SU0_SUM0_SUS256_VWA1_VWB1_WGM6_WGMXCC1_WGMXCCGn1
    SolutionIndex: 119
    SolutionNameMin: Cijk_Alik_Bjlk_BBS_BH_Bias_AS_SAV_UserArgs_MT32x32x128_MI16x16x1_SN_LDSB1_CLR1_GRVWB8_GSU0_GSUC0_GSUWGMRR0_K1_LBSPPA256_LBSPPB512_LPB16_MIWT1_1_PLR1_SU0_SUM0_SUS256_VWA1_VWB1_WGM8_WGMXCC1_WGMXCCGn1
    SolutionIndex: 120
    SolutionNameMin: Cijk_Alik_Bjlk_BBS_BH_Bias_AS_SAV_UserArgs_MT32x32x128_MI16x16x1_SN_LDSB1_CLR1_GRVWB8_GSU0_GSUC0_GSUWGMRR0_K1_LBSPPA256_LBSPPB512_LPB16_MIWT1_1_PLR1_SU0_SUM0_SUS256_VWA1_VWB1_WGM8_WGMXCC1_WGMXCCGn1
    SolutionIndex: 121
    SolutionNameMin: Cijk_Alik_Bjlk_BBS_BH_Bias_AS_SAV_UserArgs_MT32x32x128_MI16x16x1_SN_LDSB1_CLR1_GRVWB8_GSU0_GSUC0_GSUWGMRR0_K1_LBSPPA256_LBSPPB512_LPB16_MIWT1_1_PLR1_SU0_SUM0_SUS256_VWA1_VWB1_WGM8_WGMXCC1_WGMXCCGn1
- - - [128, 128, 1, 128, 128, 128, 128, 128]
    - [73, 0.44]
  - - [128, 128, 1, 256, 128, 128, 256, 128]
    - [115, 0.77]
  - - [128, 128, 1, 512, 128, 128, 512, 128]
    - [115, 1.33]
  - - [128, 128, 1, 1024, 128, 128, 1024, 128]
    - [115, 1.96]
  - - [128, 128, 1, 2048, 128, 128, 2048, 128]
    - [115, 2.58]
  - - [128, 128, 1, 4096, 128, 128, 4096, 128]
    - [115, 3.11]
  - - [128, 128, 1, 8192, 128, 128, 8192, 128]
    - [115, 3.51]
  - - [128, 256, 1, 128, 128, 128, 128, 256]
    - [73, 0.9]
  - - [128, 256, 1, 256, 128, 128, 256, 256]
    - [115, 1.55]
  - - [128, 256, 1, 512, 128, 128, 512, 256]
    - [115, 2.46]
  - - [128, 256, 1, 1024, 128, 128, 1024, 256]
    - [115, 3.5]
  - - [128, 256, 1, 2048, 128, 128, 2048, 256]
    - [115, 4.57]
  - - [128, 256, 1, 4096, 128, 128, 4096, 256]
    - [115, 5.32]
  - - [128, 256, 1, 8192, 128, 128, 8192, 256]
    - [115, 5.82]
  - - [128, 512, 1, 128, 128, 128, 128, 512]
    - [110, 1.77]
  - - [128, 512, 1, 256, 128, 128, 256, 512]
    - [74, 3.01]
  - - [128, 512, 1, 512, 128, 128, 512, 512]
    - [113, 4.78]
  - - [128, 512, 1, 1024, 128, 128, 1024, 512]
    - [113, 6.92]
  - - [128, 512, 1, 2048, 128, 128, 2048, 512]
    - [115, 8.84]
  - - [128, 512, 1, 4096, 128, 128, 4096, 512]
    - [115, 10.38]
  - - [128, 512, 1, 8192, 128, 128, 8192, 512]
    - [115, 11.4]
  - - [128, 1024, 1, 128, 128, 128, 128, 1024]
    - [110, 3.4]
  - - [128, 1024, 1, 256, 128, 128, 256, 1024]
    - [73, 5.71]
  - - [128, 1024, 1, 512, 128, 128, 512, 1024]
    - [111, 9.28]
  - - [128, 1024, 1, 1024, 128, 128, 1024, 1024]
    - [115, 13.4]
  - - [128, 1024, 1, 2048, 128, 128, 2048, 1024]
    - [115, 17.36]
  - - [128, 1024, 1, 4096, 128, 128, 4096, 1024]
    - [116, 20.41]
  - - [128, 1024, 1, 8192, 128, 128, 8192, 1024]
    - [116, 22.52]
  - - [128, 2048, 1, 128, 128, 128, 128, 2048]
    - [94, 6.11]
  - - [128, 2048, 1, 256, 128, 128, 256, 2048]
    - [71, 10.35]
  - - [128, 2048, 1, 512, 128, 128, 512, 2048]
    - [93, 16.74]
  - - [128, 2048, 1, 1024, 128, 128, 1024, 2048]
    - [93, 23.95]
  - - [128, 2048, 1, 2048, 128, 128, 2048, 2048]
    - [97, 30.54]
  - - [128, 2048, 1, 4096, 128, 128, 4096, 2048]
    - [97, 35.72]
  - - [128, 2048, 1, 8192, 128, 128, 8192, 2048]
    - [93, 35.57]
  - - [128, 4096, 1, 128, 128, 128, 128, 4096]
    - [63, 10.93]
  - - [128, 4096, 1, 256, 128, 128, 256, 4096]
    - [61, 18.7]
  - - [128, 4096, 1, 512, 128, 128, 512, 4096]
    - [87, 28.88]
  - - [128, 4096, 1, 1024, 128, 128, 1024, 4096]
    - [87, 41.17]
  - - [128, 4096, 1, 2048, 128, 128, 2048, 4096]
    - [87, 52.57]
  - - [128, 4096, 1, 4096, 128, 128, 4096, 4096]
    - [84, 56.08]
  - - [128, 4096, 1, 8192, 128, 128, 8192, 4096]
    - [89, 64.72]
  - - [128, 8192, 1, 128, 128, 128, 128, 8192]
    - [58, 18.23]
  - - [128, 8192, 1, 256, 128, 128, 256, 8192]
    - [52, 30.66]
  - - [128, 8192, 1, 512, 128, 128, 512, 8192]
    - [55, 47.05]
  - - [128, 8192, 1, 1024, 128, 128, 1024, 8192]
    - [76, 66.6]
  - - [128, 8192, 1, 2048, 128, 128, 2048, 8192]
    - [76, 77.57]
  - - [128, 8192, 1, 4096, 128, 128, 4096, 8192]
    - [75, 86.26]
  - - [128, 8192, 1, 8192, 128, 128, 8192, 8192]
    - [76, 86.71]
  - - [256, 128, 1, 128, 256, 256, 128, 128]
    - [109, 0.91]
  - - [256, 128, 1, 256, 256, 256, 256, 128]
    - [115, 1.57]
  - - [256, 128, 1, 512, 256, 256, 512, 128]
    - [115, 2.6]
  - - [256, 128, 1, 1024, 256, 256, 1024, 128]
    - [121, 3.84]
  - - [256, 128, 1, 2048, 256, 256, 2048, 128]
    - [115, 5.12]
  - - [256, 128, 1, 4096, 256, 256, 4096, 128]
    - [115, 6.19]
  - - [256, 128, 1, 8192, 256, 256, 8192, 128]
    - [115, 7.0]
  - - [256, 256, 1, 128, 256, 256, 128, 256]
    - [73, 1.75]
  - - [256, 256, 1, 256, 256, 256, 256, 256]
    - [112, 2.96]
  - - [256, 256, 1, 512, 256, 256, 512, 256]
    - [113, 4.86]
  - - [256, 256, 1, 1024, 256, 256, 1024, 256]
    - [114, 7.11]
  - - [256, 256, 1, 2048, 256, 256, 2048, 256]
    - [114, 9.19]
  - - [256, 256, 1, 4096, 256, 256, 4096, 256]
    - [115, 10.86]
  - - [256, 256, 1, 8192, 256, 256, 8192, 256]
    - [113, 11.89]
  - - [256, 512, 1, 128, 256, 256, 128, 512]
    - [110, 3.54]
  - - [256, 512, 1, 256, 256, 256, 256, 512]
    - [110, 5.89]
  - - [256, 512, 1, 512, 256, 256, 512, 512]
    - [113, 9.76]
  - - [256, 512, 1, 1024, 256, 256, 1024, 512]
    - [113, 13.95]
  - - [256, 512, 1, 2048, 256, 256, 2048, 512]
    - [115, 18.01]
  - - [256, 512, 1, 4096, 256, 256, 4096, 512]
    - [118, 21.28]
  - - [256, 512, 1, 8192, 256, 256, 8192, 512]
    - [117, 23.29]
  - - [256, 1024, 1, 128, 256, 256, 128, 1024]
    - [107, 6.29]
  - - [256, 1024, 1, 256, 256, 256, 256, 1024]
    - [107, 10.78]
  - - [256, 1024, 1, 512, 256, 256, 512, 1024]
    - [106, 17.21]
  - - [256, 1024, 1, 1024, 256, 256, 1024, 1024]
    - [93, 24.8]
  - - [256, 1024, 1, 2048, 256, 256, 2048, 1024]
    - [97, 31.98]
  - - [256, 1024, 1, 4096, 256, 256, 4096, 1024]
    - [103, 37.03]
  - - [256, 1024, 1, 8192, 256, 256, 8192, 1024]
    - [101, 40.29]
  - - [256, 2048, 1, 128, 256, 256, 128, 2048]
    - [64, 11.23]
  - - [256, 2048, 1, 256, 256, 256, 256, 2048]
    - [64, 19.04]
  - - [256, 2048, 1, 512, 256, 256, 512, 2048]
    - [85, 29.73]
  - - [256, 2048, 1, 1024, 256, 256, 1024, 2048]
    - [87, 41.98]
  - - [256, 2048, 1, 2048, 256, 256, 2048, 2048]
    - [85, 52.49]
  - - [256, 2048, 1, 4096, 256, 256, 4096, 2048]
    - [87, 61.59]
  - - [256, 2048, 1, 8192, 256, 256, 8192, 2048]
    - [90, 60.62]
  - - [256, 4096, 1, 128, 256, 256, 128, 4096]
    - [58, 18.41]
  - - [256, 4096, 1, 256, 256, 256, 256, 4096]
    - [56, 30.83]
  - - [256, 4096, 1, 512, 256, 256, 512, 4096]
    - [76, 48.85]
  - - [256, 4096, 1, 1024, 256, 256, 1024, 4096]
    - [76, 68.74]
  - - [256, 4096, 1, 2048, 256, 256, 2048, 4096]
    - [76, 86.16]
  - - [256, 4096, 1, 4096, 256, 256, 4096, 4096]
    - [75, 92.04]
  - - [256, 4096, 1, 8192, 256, 256, 8192, 4096]
    - [76, 94.43]
  - - [256, 8192, 1, 128, 256, 256, 128, 8192]
    - [40, 28.18]
  - - [256, 8192, 1, 256, 256, 256, 256, 8192]
    - [42, 47.38]
  - - [256, 8192, 1, 512, 256, 256, 512, 8192]
    - [42, 71.17]
  - - [256, 8192, 1, 1024, 256, 256, 1024, 8192]
    - [41, 92.85]
  - - [256, 8192, 1, 2048, 256, 256, 2048, 8192]
    - [41, 104.65]
  - - [256, 8192, 1, 4096, 256, 256, 4096, 8192]
    - [48, 114.95]
  - - [256, 8192, 1, 8192, 256, 256, 8192, 8192]
    - [42, 111.39]
  - - [512, 128, 1, 128, 512, 512, 128, 128]
    - [111, 1.83]
  - - [512, 128, 1, 256, 512, 512, 256, 128]
    - [110, 3.15]
  - - [512, 128, 1, 512, 512, 512, 512, 128]
    - [115, 5.19]
  - - [512, 128, 1, 1024, 512, 512, 1024, 128]
    - [113, 7.71]
  - - [512, 128, 1, 2048, 512, 512, 2048, 128]
    - [121, 10.3]
  - - [512, 128, 1, 4096, 512, 512, 4096, 128]
    - [121, 12.46]
  - - [512, 128, 1, 8192, 512, 512, 8192, 128]
    - [120, 13.91]
  - - [512, 256, 1, 128, 512, 512, 128, 256]
    - [113, 3.51]
  - - [512, 256, 1, 256, 512, 512, 256, 256]
    - [110, 5.96]
  - - [512, 256, 1, 512, 512, 512, 512, 256]
    - [115, 9.68]
  - - [512, 256, 1, 1024, 512, 512, 1024, 256]
    - [121, 14.16]
  - - [512, 256, 1, 2048, 512, 512, 2048, 256]
    - [117, 18.5]
  - - [512, 256, 1, 4096, 512, 512, 4096, 256]
    - [117, 22.0]
  - - [512, 256, 1, 8192, 512, 512, 8192, 256]
    - [120, 24.05]
  - - [512, 512, 1, 128, 512, 512, 128, 512]
    - [72, 6.32]
  - - [512, 512, 1, 256, 512, 512, 256, 512]
    - [97, 10.8]
  - - [512, 512, 1, 512, 512, 512, 512, 512]
    - [93, 17.36]
  - - [512, 512, 1, 1024, 512, 512, 1024, 512]
    - [98, 25.2]
  - - [512, 512, 1, 2048, 512, 512, 2048, 512]
    - [103, 32.23]
  - - [512, 512, 1, 4096, 512, 512, 4096, 512]
    - [102, 37.73]
  - - [512, 512, 1, 8192, 512, 512, 8192, 512]
    - [102, 41.63]
  - - [512, 1024, 1, 128, 512, 512, 128, 1024]
    - [86, 11.11]
  - - [512, 1024, 1, 256, 512, 512, 256, 1024]
    - [62, 19.01]
  - - [512, 1024, 1, 512, 512, 512, 512, 1024]
    - [87, 30.33]
  - - [512, 1024, 1, 1024, 512, 512, 1024, 1024]
    - [90, 42.67]
  - - [512, 1024, 1, 2048, 512, 512, 2048, 1024]
    - [90, 53.27]
  - - [512, 1024, 1, 4096, 512, 512, 4096, 1024]
    - [90, 61.64]
  - - [512, 1024, 1, 8192, 512, 512, 8192, 1024]
    - [27, 64.49]
  - - [512, 2048, 1, 128, 512, 512, 128, 2048]
    - [58, 18.66]
  - - [512, 2048, 1, 256, 512, 512, 256, 2048]
    - [56, 30.84]
  - - [512, 2048, 1, 512, 512, 512, 512, 2048]
    - [76, 48.6]
  - - [512, 2048, 1, 1024, 512, 512, 1024, 2048]
    - [81, 68.46]
  - - [512, 2048, 1, 2048, 512, 512, 2048, 2048]
    - [81, 85.54]
  - - [512, 2048, 1, 4096, 512, 512, 4096, 2048]
    - [76, 98.34]
  - - [512, 2048, 1, 8192, 512, 512, 8192, 2048]
    - [76, 96.18]
  - - [512, 4096, 1, 128, 512, 512, 128, 4096]
    - [42, 27.99]
  - - [512, 4096, 1, 256, 512, 512, 256, 4096]
    - [42, 46.64]
  - - [512, 4096, 1, 512, 512, 512, 512, 4096]
    - [42, 69.91]
  - - [512, 4096, 1, 1024, 512, 512, 1024, 4096]
    - [41, 93.65]
  - - [512, 4096, 1, 2048, 512, 512, 2048, 4096]
    - [41, 110.87]
  - - [512, 4096, 1, 4096, 512, 512, 4096, 4096]
    - [45, 116.73]
  - - [512, 4096, 1, 8192, 512, 512, 8192, 4096]
    - [42, 117.3]
  - - [512, 8192, 1, 128, 512, 512, 128, 8192]
    - [22, 38.54]
  - - [512, 8192, 1, 256, 512, 512, 256, 8192]
    - [14, 62.46]
  - - [512, 8192, 1, 512, 512, 512, 512, 8192]
    - [12, 90.49]
  - - [512, 8192, 1, 1024, 512, 512, 1024, 8192]
    - [12, 113.76]
  - - [512, 8192, 1, 2048, 512, 512, 2048, 8192]
    - [32, 125.92]
  - - [512, 8192, 1, 4096, 512, 512, 4096, 8192]
    - [29, 127.3]
  - - [512, 8192, 1, 8192, 512, 512, 8192, 8192]
    - [16, 137.14]
  - - [1024, 128, 1, 128, 1024, 1024, 128, 128]
    - [115, 3.55]
  - - [1024, 128, 1, 256, 1024, 1024, 256, 128]
    - [115, 5.99]
  - - [1024, 128, 1, 512, 1024, 1024, 512, 128]
    - [115, 10.23]
  - - [1024, 128, 1, 1024, 1024, 1024, 1024, 128]
    - [118, 15.38]
  - - [1024, 128, 1, 2048, 1024, 1024, 2048, 128]
    - [119, 20.44]
  - - [1024, 128, 1, 4096, 1024, 1024, 4096, 128]
    - [116, 25.05]
  - - [1024, 128, 1, 8192, 1024, 1024, 8192, 128]
    - [116, 27.79]
  - - [1024, 256, 1, 128, 1024, 1024, 128, 256]
    - [96, 6.28]
  - - [1024, 256, 1, 256, 1024, 1024, 256, 256]
    - [108, 10.64]
  - - [1024, 256, 1, 512, 1024, 1024, 512, 256]
    - [99, 17.59]
  - - [1024, 256, 1, 1024, 1024, 1024, 1024, 256]
    - [104, 25.66]
  - - [1024, 256, 1, 2048, 1024, 1024, 2048, 256]
    - [105, 32.92]
  - - [1024, 256, 1, 4096, 1024, 1024, 4096, 256]
    - [121, 38.45]
  - - [1024, 256, 1, 8192, 1024, 1024, 8192, 256]
    - [105, 42.66]
  - - [1024, 512, 1, 128, 1024, 1024, 128, 512]
    - [65, 10.9]
  - - [1024, 512, 1, 256, 1024, 1024, 256, 512]
    - [68, 18.75]
  - - [1024, 512, 1, 512, 1024, 1024, 512, 512]
    - [90, 30.61]
  - - [1024, 512, 1, 1024, 1024, 1024, 1024, 512]
    - [90, 43.05]
  - - [1024, 512, 1, 2048, 1024, 1024, 2048, 512]
    - [90, 53.64]
  - - [1024, 512, 1, 4096, 1024, 1024, 4096, 512]
    - [90, 62.29]
  - - [1024, 512, 1, 8192, 1024, 1024, 8192, 512]
    - [92, 66.92]
  - - [1024, 1024, 1, 128, 1024, 1024, 128, 1024]
    - [60, 18.34]
  - - [1024, 1024, 1, 256, 1024, 1024, 256, 1024]
    - [54, 31.26]
  - - [1024, 1024, 1, 512, 1024, 1024, 512, 1024]
    - [81, 48.93]
  - - [1024, 1024, 1, 1024, 1024, 1024, 1024, 1024]
    - [78, 68.67]
  - - [1024, 1024, 1, 2048, 1024, 1024, 2048, 1024]
    - [80, 86.4]
  - - [1024, 1024, 1, 4096, 1024, 1024, 4096, 1024]
    - [78, 100.4]
  - - [1024, 1024, 1, 8192, 1024, 1024, 8192, 1024]
    - [77, 96.26]
  - - [1024, 2048, 1, 128, 1024, 1024, 128, 2048]
    - [42, 28.63]
  - - [1024, 2048, 1, 256, 1024, 1024, 256, 2048]
    - [42, 47.12]
  - - [1024, 2048, 1, 512, 1024, 1024, 512, 2048]
    - [42, 71.16]
  - - [1024, 2048, 1, 1024, 1024, 1024, 1024, 2048]
    - [41, 93.31]
  - - [1024, 2048, 1, 2048, 1024, 1024, 2048, 2048]
    - [47, 112.87]
  - - [1024, 2048, 1, 4096, 1024, 1024, 4096, 2048]
    - [41, 119.62]
  - - [1024, 2048, 1, 8192, 1024, 1024, 8192, 2048]
    - [47, 116.08]
  - - [1024, 4096, 1, 128, 1024, 1024, 128, 4096]
    - [25, 38.83]
  - - [1024, 4096, 1, 256, 1024, 1024, 256, 4096]
    - [23, 62.2]
  - - [1024, 4096, 1, 512, 1024, 1024, 512, 4096]
    - [18, 90.5]
  - - [1024, 4096, 1, 1024, 1024, 1024, 1024, 4096]
    - [21, 115.02]
  - - [1024, 4096, 1, 2048, 1024, 1024, 2048, 4096]
    - [33, 128.0]
  - - [1024, 4096, 1, 4096, 1024, 1024, 4096, 4096]
    - [31, 127.75]
  - - [1024, 4096, 1, 8192, 1024, 1024, 8192, 4096]
    - [16, 137.81]
  - - [1024, 8192, 1, 128, 1024, 1024, 128, 8192]
    - [11, 47.87]
  - - [1024, 8192, 1, 256, 1024, 1024, 256, 8192]
    - [0, 74.42]
  - - [1024, 8192, 1, 512, 1024, 1024, 512, 8192]
    - [0, 106.07]
  - - [1024, 8192, 1, 1024, 1024, 1024, 1024, 8192]
    - [0, 132.18]
  - - [1024, 8192, 1, 2048, 1024, 1024, 2048, 8192]
    - [2, 134.57]
  - - [1024, 8192, 1, 4096, 1024, 1024, 4096, 8192]
    - [33, 144.43]
  - - [1024, 8192, 1, 8192, 1024, 1024, 8192, 8192]
    - [6, 163.11]
  - - [2048, 128, 1, 128, 2048, 2048, 128, 128]
    - [95, 6.43]
  - - [2048, 128, 1, 256, 2048, 2048, 256, 128]
    - [101, 11.05]
  - - [2048, 128, 1, 512, 2048, 2048, 512, 128]
    - [94, 18.31]
  - - [2048, 128, 1, 1024, 2048, 2048, 1024, 128]
    - [99, 27.55]
  - - [2048, 128, 1, 2048, 2048, 2048, 2048, 128]
    - [99, 36.04]
  - - [2048, 128, 1, 4096, 2048, 2048, 4096, 128]
    - [100, 42.88]
  - - [2048, 128, 1, 8192, 2048, 2048, 8192, 128]
    - [104, 47.26]
  - - [2048, 256, 1, 128, 2048, 2048, 128, 256]
    - [66, 11.09]
  - - [2048, 256, 1, 256, 2048, 2048, 256, 256]
    - [67, 18.99]
  - - [2048, 256, 1, 512, 2048, 2048, 512, 256]
    - [88, 30.6]
  - - [2048, 256, 1, 1024, 2048, 2048, 1024, 256]
    - [90, 43.05]
  - - [2048, 256, 1, 2048, 2048, 2048, 2048, 256]
    - [88, 53.9]
  - - [2048, 256, 1, 4096, 2048, 2048, 4096, 256]
    - [90, 63.01]
  - - [2048, 256, 1, 8192, 2048, 2048, 8192, 256]
    - [88, 64.4]
  - - [2048, 512, 1, 128, 2048, 2048, 128, 512]
    - [60, 18.5]
  - - [2048, 512, 1, 256, 2048, 2048, 256, 512]
    - [56, 31.59]
  - - [2048, 512, 1, 512, 2048, 2048, 512, 512]
    - [83, 48.8]
  - - [2048, 512, 1, 1024, 2048, 2048, 1024, 512]
    - [78, 69.34]
  - - [2048, 512, 1, 2048, 2048, 2048, 2048, 512]
    - [83, 86.38]
  - - [2048, 512, 1, 4096, 2048, 2048, 4096, 512]
    - [80, 99.6]
  - - [2048, 512, 1, 8192, 2048, 2048, 8192, 512]
    - [83, 99.74]
  - - [2048, 1024, 1, 128, 2048, 2048, 128, 1024]
    - [43, 27.78]
  - - [2048, 1024, 1, 256, 2048, 2048, 256, 1024]
    - [48, 46.62]
  - - [2048, 1024, 1, 512, 2048, 2048, 512, 1024]
    - [45, 70.38]
  - - [2048, 1024, 1, 1024, 2048, 2048, 1024, 1024]
    - [44, 93.71]
  - - [2048, 1024, 1, 2048, 2048, 2048, 2048, 1024]
    - [48, 113.31]
  - - [2048, 1024, 1, 4096, 2048, 2048, 4096, 1024]
    - [45, 120.05]
  - - [2048, 1024, 1, 8192, 2048, 2048, 8192, 1024]
    - [48, 117.34]
  - - [2048, 2048, 1, 128, 2048, 2048, 128, 2048]
    - [26, 38.38]
  - - [2048, 2048, 1, 256, 2048, 2048, 256, 2048]
    - [17, 60.48]
  - - [2048, 2048, 1, 512, 2048, 2048, 512, 2048]
    - [15, 88.35]
  - - [2048, 2048, 1, 1024, 2048, 2048, 1024, 2048]
    - [32, 114.69]
  - - [2048, 2048, 1, 2048, 2048, 2048, 2048, 2048]
    - [33, 129.13]
  - - [2048, 2048, 1, 4096, 2048, 2048, 4096, 2048]
    - [15, 127.03]
  - - [2048, 2048, 1, 8192, 2048, 2048, 8192, 2048]
    - [15, 137.67]
  - - [2048, 4096, 1, 128, 2048, 2048, 128, 4096]
    - [1, 47.35]
  - - [2048, 4096, 1, 256, 2048, 2048, 256, 4096]
    - [0, 74.14]
  - - [2048, 4096, 1, 512, 2048, 2048, 512, 4096]
    - [0, 105.97]
  - - [2048, 4096, 1, 1024, 2048, 2048, 1024, 4096]
    - [9, 131.55]
  - - [2048, 4096, 1, 2048, 2048, 2048, 2048, 4096]
    - [30, 137.0]
  - - [2048, 4096, 1, 4096, 2048, 2048, 4096, 4096]
    - [31, 149.17]
  - - [2048, 4096, 1, 8192, 2048, 2048, 8192, 4096]
    - [8, 160.08]
  - - [2048, 8192, 1, 128, 2048, 2048, 128, 8192]
    - [0, 54.49]
  - - [2048, 8192, 1, 256, 2048, 2048, 256, 8192]
    - [2, 82.93]
  - - [2048, 8192, 1, 512, 2048, 2048, 512, 8192]
    - [11, 111.05]
  - - [2048, 8192, 1, 1024, 2048, 2048, 1024, 8192]
    - [42, 127.08]
  - - [2048, 8192, 1, 2048, 2048, 2048, 2048, 8192]
    - [28, 144.0]
  - - [2048, 8192, 1, 4096, 2048, 2048, 4096, 8192]
    - [14, 171.63]
  - - [2048, 8192, 1, 8192, 2048, 2048, 8192, 8192]
    - [13, 182.14]
  - - [4096, 128, 1, 128, 4096, 4096, 128, 128]
    - [70, 9.44]
  - - [4096, 128, 1, 256, 4096, 4096, 256, 128]
    - [69, 17.5]
  - - [4096, 128, 1, 512, 4096, 4096, 512, 128]
    - [88, 29.66]
  - - [4096, 128, 1, 1024, 4096, 4096, 1024, 128]
    - [90, 43.65]
  - - [4096, 128, 1, 2048, 4096, 4096, 2048, 128]
    - [90, 57.19]
  - - [4096, 128, 1, 4096, 4096, 4096, 4096, 128]
    - [89, 66.47]
  - - [4096, 128, 1, 8192, 4096, 4096, 8192, 128]
    - [91, 73.37]
  - - [4096, 256, 1, 128, 4096, 4096, 128, 256]
    - [59, 18.09]
  - - [4096, 256, 1, 256, 4096, 4096, 256, 256]
    - [53, 30.61]
  - - [4096, 256, 1, 512, 4096, 4096, 512, 256]
    - [57, 47.52]
  - - [4096, 256, 1, 1024, 4096, 4096, 1024, 256]
    - [83, 67.32]
  - - [4096, 256, 1, 2048, 4096, 4096, 2048, 256]
    - [80, 85.56]
  - - [4096, 256, 1, 4096, 4096, 4096, 4096, 256]
    - [79, 94.85]
  - - [4096, 256, 1, 8192, 4096, 4096, 8192, 256]
    - [81, 94.2]
  - - [4096, 512, 1, 128, 4096, 4096, 128, 512]
    - [50, 27.76]
  - - [4096, 512, 1, 256, 4096, 4096, 256, 512]
    - [51, 45.92]
  - - [4096, 512, 1, 512, 4096, 4096, 512, 512]
    - [45, 69.95]
  - - [4096, 512, 1, 1024, 4096, 4096, 1024, 512]
    - [45, 93.28]
  - - [4096, 512, 1, 2048, 4096, 4096, 2048, 512]
    - [45, 106.15]
  - - [4096, 512, 1, 4096, 4096, 4096, 4096, 512]
    - [48, 117.38]
  - - [4096, 512, 1, 8192, 4096, 4096, 8192, 512]
    - [48, 115.77]
  - - [4096, 1024, 1, 128, 4096, 4096, 128, 1024]
    - [26, 38.07]
  - - [4096, 1024, 1, 256, 4096, 4096, 256, 1024]
    - [37, 58.98]
  - - [4096, 1024, 1, 512, 4096, 4096, 512, 1024]
    - [15, 88.02]
  - - [4096, 1024, 1, 1024, 4096, 4096, 1024, 1024]
    - [18, 110.91]
  - - [4096, 1024, 1, 2048, 4096, 4096, 2048, 1024]
    - [46, 125.97]
  - - [4096, 1024, 1, 4096, 4096, 4096, 4096, 1024]
    - [42, 129.91]
  - - [4096, 1024, 1, 8192, 4096, 4096, 8192, 1024]
    - [23, 137.66]
  - - [4096, 2048, 1, 128, 4096, 4096, 128, 2048]
    - [0, 47.07]
  - - [4096, 2048, 1, 256, 4096, 4096, 256, 2048]
    - [3, 72.25]
  - - [4096, 2048, 1, 512, 4096, 4096, 512, 2048]
    - [3, 104.27]
  - - [4096, 2048, 1, 1024, 4096, 4096, 1024, 2048]
    - [3, 128.81]
  - - [4096, 2048, 1, 2048, 4096, 4096, 2048, 2048]
    - [30, 140.13]
  - - [4096, 2048, 1, 4096, 4096, 4096, 4096, 2048]
    - [29, 149.84]
  - - [4096, 2048, 1, 8192, 4096, 4096, 8192, 2048]
    - [3, 160.69]
  - - [4096, 4096, 1, 128, 4096, 4096, 128, 4096]
    - [0, 53.97]
  - - [4096, 4096, 1, 256, 4096, 4096, 256, 4096]
    - [0, 81.97]
  - - [4096, 4096, 1, 512, 4096, 4096, 512, 4096]
    - [3, 109.55]
  - - [4096, 4096, 1, 1024, 4096, 4096, 1024, 4096]
    - [20, 126.9]
  - - [4096, 4096, 1, 2048, 4096, 4096, 2048, 4096]
    - [33, 146.67]
  - - [4096, 4096, 1, 4096, 4096, 4096, 4096, 4096]
    - [30, 163.75]
  - - [4096, 4096, 1, 8192, 4096, 4096, 8192, 4096]
    - [7, 175.46]
  - - [4096, 8192, 1, 128, 4096, 4096, 128, 8192]
    - [4, 54.79]
  - - [4096, 8192, 1, 256, 4096, 4096, 256, 8192]
    - [12, 81.47]
  - - [4096, 8192, 1, 512, 4096, 4096, 512, 8192]
    - [36, 109.08]
  - - [4096, 8192, 1, 1024, 4096, 4096, 1024, 8192]
    - [38, 139.43]
  - - [4096, 8192, 1, 2048, 4096, 4096, 2048, 8192]
    - [35, 168.21]
  - - [4096, 8192, 1, 4096, 4096, 4096, 4096, 8192]
    - [9, 188.57]
  - - [4096, 8192, 1, 8192, 4096, 4096, 8192, 8192]
    - [10, 210.89]
  - - [8192, 128, 1, 128, 8192, 8192, 128, 128]
    - [56, 18.06]
  - - [8192, 128, 1, 256, 8192, 8192, 256, 128]
    - [56, 29.93]
  - - [8192, 128, 1, 512, 8192, 8192, 512, 128]
    - [56, 46.39]
  - - [8192, 128, 1, 1024, 8192, 8192, 1024, 128]
    - [76, 65.84]
  - - [8192, 128, 1, 2048, 8192, 8192, 2048, 128]
    - [76, 76.55]
  - - [8192, 128, 1, 4096, 8192, 8192, 4096, 128]
    - [83, 87.68]
  - - [8192, 128, 1, 8192, 8192, 8192, 8192, 128]
    - [81, 84.78]
  - - [8192, 256, 1, 128, 8192, 8192, 128, 256]
    - [46, 27.27]
  - - [8192, 256, 1, 256, 8192, 8192, 256, 256]
    - [45, 44.5]
  - - [8192, 256, 1, 512, 8192, 8192, 512, 256]
    - [48, 67.58]
  - - [8192, 256, 1, 1024, 8192, 8192, 1024, 256]
    - [42, 86.87]
  - - [8192, 256, 1, 2048, 8192, 8192, 2048, 256]
    - [48, 101.43]
  - - [8192, 256, 1, 4096, 8192, 8192, 4096, 256]
    - [82, 111.25]
  - - [8192, 256, 1, 8192, 8192, 8192, 8192, 256]
    - [45, 107.27]
  - - [8192, 512, 1, 128, 8192, 8192, 128, 512]
    - [20, 37.03]
  - - [8192, 512, 1, 256, 8192, 8192, 256, 512]
    - [23, 59.17]
  - - [8192, 512, 1, 512, 8192, 8192, 512, 512]
    - [12, 85.45]
  - - [8192, 512, 1, 1024, 8192, 8192, 1024, 512]
    - [18, 107.64]
  - - [8192, 512, 1, 2048, 8192, 8192, 2048, 512]
    - [49, 122.7]
  - - [8192, 512, 1, 4096, 8192, 8192, 4096, 512]
    - [41, 129.99]
  - - [8192, 512, 1, 8192, 8192, 8192, 8192, 512]
    - [14, 137.19]
  - - [8192, 1024, 1, 128, 8192, 8192, 128, 1024]
    - [0, 44.54]
  - - [8192, 1024, 1, 256, 8192, 8192, 256, 1024]
    - [0, 70.61]
  - - [8192, 1024, 1, 512, 8192, 8192, 512, 1024]
    - [9, 101.15]
  - - [8192, 1024, 1, 1024, 8192, 8192, 1024, 1024]
    - [3, 125.68]
  - - [8192, 1024, 1, 2048, 8192, 8192, 2048, 1024]
    - [31, 134.04]
  - - [8192, 1024, 1, 4096, 8192, 8192, 4096, 1024]
    - [31, 147.67]
  - - [8192, 1024, 1, 8192, 8192, 8192, 8192, 1024]
    - [7, 156.96]
  - - [8192, 2048, 1, 128, 8192, 8192, 128, 2048]
    - [0, 52.31]
  - - [8192, 2048, 1, 256, 8192, 8192, 256, 2048]
    - [5, 79.26]
  - - [8192, 2048, 1, 512, 8192, 8192, 512, 2048]
    - [2, 107.29]
  - - [8192, 2048, 1, 1024, 8192, 8192, 1024, 2048]
    - [14, 122.58]
  - - [8192, 2048, 1, 2048, 8192, 8192, 2048, 2048]
    - [19, 144.71]
  - - [8192, 2048, 1, 4096, 8192, 8192, 4096, 2048]
    - [29, 163.51]
  - - [8192, 2048, 1, 8192, 8192, 8192, 8192, 2048]
    - [7, 174.01]
  - - [8192, 4096, 1, 128, 8192, 8192, 128, 4096]
    - [3, 53.18]
  - - [8192, 4096, 1, 256, 8192, 8192, 256, 4096]
    - [16, 82.18]
  - - [8192, 4096, 1, 512, 8192, 8192, 512, 4096]
    - [34, 109.51]
  - - [8192, 4096, 1, 1024, 8192, 8192, 1024, 4096]
    - [39, 139.1]
  - - [8192, 4096, 1, 2048, 8192, 8192, 2048, 4096]
    - [32, 165.76]
  - - [8192, 4096, 1, 4096, 8192, 8192, 4096, 4096]
    - [9, 190.87]
  - - [8192, 4096, 1, 8192, 8192, 8192, 8192, 4096]
    - [9, 214.08]
  - - [8192, 8192, 1, 128, 8192, 8192, 128, 8192]
    - [24, 54.18]
  - - [8192, 8192, 1, 256, 8192, 8192, 256, 8192]
    - [14, 84.49]
  - - [8192, 8192, 1, 512, 8192, 8192, 512, 8192]
    - [3, 121.18]
  - - [8192, 8192, 1, 1024, 8192, 8192, 1024, 8192]
    - [10, 157.11]
  - - [8192, 8192, 1, 2048, 8192, 8192, 2048, 8192]
    - [32, 186.66]
  - - [8192, 8192, 1, 4096, 8192, 8192, 4096, 8192]
    - [7, 203.08]
  - - [8192, 8192, 1, 8192, 8192, 8192, 8192, 8192]
    - [39, 214.79]
- null
- null
- ExperimentalStreamK
- GridBased
