projects/hipblaslt/library/src/amd_detail/rocblaslt/src/Tensile/Logic/asm_full/aquavanjaram/gfx942_228cu/StreamK/aquavanjaram942_Cijk_Ailk_Bljk_F8NHS_BH_Bias_HAS_SAV_UserArgs.yaml
- {MinimumRequiredVersion: 4.33.0}
- aquavanjaram942
- {Architecture: gfx942, CUCount: 228}
- [Device 0049, Device 0050]
    SolutionIndex: 0
    SolutionNameMin: Cijk_Ailk_Bljk_F8NHS_BH_Bias_HAS_SAV_UserArgs_MT256x256x64_MI16x16x1_SN_LDSB1_CLR1_GRVWA8_GRVWB8_GSU0_GSUC0_GSUWGMRR0_K1_LBSPPA2048_LBSPPB512_LPA0_LPB8_LRVW8_MIWT8_8_PLR1_SU0_SUM0_SUS64_VWA8_VWB8_WGM1_WGMXCC1_WGMXCCGn1
    SolutionIndex: 1
    SolutionNameMin: Cijk_Ailk_Bljk_F8NHS_BH_Bias_HAS_SAV_UserArgs_MT256x256x64_MI16x16x1_SN_LDSB1_CLR1_GRVWA16_GRVWB8_GSU0_GSUC0_GSUWGMRR0_K1_LBSPPA2048_LBSPPB512_LPA0_LPB8_LRVW8_MIWT8_8_PLR1_SU0_SUM0_SUS64_VWA8_VWB8_WGM1_WGMXCC1_WGMXCCGn1
    SolutionIndex: 2
    SolutionNameMin: Cijk_Ailk_Bljk_F8NHS_BH_Bias_HAS_SAV_UserArgs_MT256x256x64_MI16x16x1_SN_LDSB1_CLR1_GRVWA8_GRVWB16_GSU0_GSUC0_GSUWGMRR0_K1_LBSPPA2048_LBSPPB512_LPA0_LPB16_LRVW8_MIWT8_8_PLR1_SU0_SUM0_SUS64_VWA8_VWB8_WGM1_WGMXCC1_WGMXCCGn1
    SolutionIndex: 3
    SolutionNameMin: Cijk_Ailk_Bljk_F8NHS_BH_Bias_HAS_SAV_UserArgs_MT256x256x64_MI16x16x1_SN_LDSB1_CLR1_GRVWA16_GRVWB16_GSU0_GSUC0_GSUWGMRR0_K1_LBSPPA2048_LBSPPB512_LPA0_LPB16_LRVW8_MIWT8_8_PLR1_SU0_SUM0_SUS64_VWA8_VWB8_WGM1_WGMXCC1_WGMXCCGn1
    SolutionIndex: 4
    SolutionNameMin: Cijk_Ailk_Bljk_F8NHS_BH_Bias_HAS_SAV_UserArgs_MT256x256x64_MI16x16x1_SN_LDSB1_CLR1_GRVWA8_GRVWB8_GSU0_GSUC0_GSUWGMRR0_K1_LBSPPA2048_LBSPPB512_LPA0_LPB8_LRVW8_MIWT8_8_PLR1_SU0_SUM0_SUS64_VWA8_VWB8_WGM4_WGMXCC1_WGMXCCGn1
    SolutionIndex: 5
    SolutionNameMin: Cijk_Ailk_Bljk_F8NHS_BH_Bias_HAS_SAV_UserArgs_MT256x256x64_MI16x16x1_SN_LDSB1_CLR1_GRVWA8_GRVWB16_GSU0_GSUC0_GSUWGMRR0_K1_LBSPPA2048_LBSPPB512_LPA0_LPB16_LRVW8_MIWT8_8_PLR1_SU0_SUM0_SUS64_VWA8_VWB8_WGM4_WGMXCC1_WGMXCCGn1
    SolutionIndex: 6
    SolutionNameMin: Cijk_Ailk_Bljk_F8NHS_BH_Bias_HAS_SAV_UserArgs_MT256x256x64_MI16x16x1_SN_LDSB1_CLR1_GRVWA16_GRVWB16_GSU0_GSUC0_GSUWGMRR0_K1_LBSPPA2048_LBSPPB512_LPA0_LPB16_LRVW8_MIWT8_8_PLR1_SU0_SUM0_SUS64_VWA8_VWB8_WGM4_WGMXCC1_WGMXCCGn1
    SolutionIndex: 7
    SolutionNameMin: Cijk_Ailk_Bljk_F8NHS_BH_Bias_HAS_SAV_UserArgs_MT256x256x64_MI16x16x1_SN_LDSB1_CLR1_GRVWA16_GRVWB8_GSU0_GSUC0_GSUWGMRR0_K1_LBSPPA2048_LBSPPB512_LPA0_LPB8_LRVW8_MIWT8_8_PLR1_SU0_SUM0_SUS64_VWA8_VWB8_WGM6_WGMXCC1_WGMXCCGn1
    SolutionIndex: 8
    SolutionNameMin: Cijk_Ailk_Bljk_F8NHS_BH_Bias_HAS_SAV_UserArgs_MT256x256x64_MI16x16x1_SN_LDSB1_CLR1_GRVWA16_GRVWB16_GSU0_GSUC0_GSUWGMRR0_K1_LBSPPA2048_LBSPPB512_LPA0_LPB16_LRVW8_MIWT8_8_PLR1_SU0_SUM0_SUS64_VWA8_VWB8_WGM6_WGMXCC1_WGMXCCGn1
    SolutionIndex: 9
    SolutionNameMin: Cijk_Ailk_Bljk_F8NHS_BH_Bias_HAS_SAV_UserArgs_MT256x256x64_MI16x16x1_SN_LDSB1_CLR1_GRVWA8_GRVWB8_GSU0_GSUC0_GSUWGMRR0_K1_LBSPPA2048_LBSPPB512_LPA0_LPB8_LRVW8_MIWT8_8_PLR1_SU0_SUM0_SUS64_VWA8_VWB8_WGM8_WGMXCC1_WGMXCCGn1
    SolutionIndex: 10
    SolutionNameMin: Cijk_Ailk_Bljk_F8NHS_BH_Bias_HAS_SAV_UserArgs_MT256x256x64_MI16x16x1_SN_LDSB1_CLR1_GRVWA16_GRVWB8_GSU0_GSUC0_GSUWGMRR0_K1_LBSPPA2048_LBSPPB512_LPA0_LPB8_LRVW8_MIWT8_8_PLR1_SU0_SUM0_SUS64_VWA8_VWB8_WGM8_WGMXCC1_WGMXCCGn1
    SolutionIndex: 11
    SolutionNameMin: Cijk_Ailk_Bljk_F8NHS_BH_Bias_HAS_SAV_UserArgs_MT256x256x64_MI16x16x1_SN_LDSB1_CLR1_GRVWA16_GRVWB16_GSU0_GSUC0_GSUWGMRR0_K1_LBSPPA2048_LBSPPB512_LPA0_LPB16_LRVW8_MIWT8_8_PLR1_SU0_SUM0_SUS64_VWA8_VWB8_WGM8_WGMXCC1_WGMXCCGn1
    SolutionIndex: 12
    SolutionNameMin: Cijk_Ailk_Bljk_F8NHS_BH_Bias_HAS_SAV_UserArgs_MT128x256x64_MI16x16x1_SN_LDSB1_CLR1_GRVWA16_GRVWB8_GSU0_GSUC0_GSUWGMRR0_K1_LBSPPA1024_LBSPPB512_LPA64_LPB8_LRVW8_MIWT4_8_PLR1_SU0_SUM0_SUS64_VWA4_VWB8_WGM1_WGMXCC1_WGMXCCGn1
    SolutionIndex: 13
    SolutionNameMin: Cijk_Ailk_Bljk_F8NHS_BH_Bias_HAS_SAV_UserArgs_MT128x256x64_MI16x16x1_SN_LDSB1_CLR1_GRVWA8_GRVWB16_GSU0_GSUC0_GSUWGMRR0_K1_LBSPPA1024_LBSPPB512_LPA64_LPB16_LRVW8_MIWT4_8_PLR1_SU0_SUM0_SUS64_VWA4_VWB8_WGM4_WGMXCC1_WGMXCCGn1
    SolutionIndex: 14
    SolutionNameMin: Cijk_Ailk_Bljk_F8NHS_BH_Bias_HAS_SAV_UserArgs_MT128x256x64_MI16x16x1_SN_LDSB1_CLR1_GRVWA8_GRVWB16_GSU0_GSUC0_GSUWGMRR0_K1_LBSPPA1024_LBSPPB512_LPA64_LPB16_LRVW8_MIWT4_8_PLR1_SU0_SUM0_SUS64_VWA4_VWB8_WGM6_WGMXCC1_WGMXCCGn1
    SolutionIndex: 15
    SolutionNameMin: Cijk_Ailk_Bljk_F8NHS_BH_Bias_HAS_SAV_UserArgs_MT256x128x64_MI16x16x1_SN_LDSB1_CLR1_GRVWA8_GRVWB8_GSU0_GSUC0_GSUWGMRR0_K1_LBSPPA2048_LBSPPB256_LPA0_LPB8_LRVW8_MIWT8_4_PLR1_SU0_SUM0_SUS64_VWA8_VWB4_WGM1_WGMXCC1_WGMXCCGn1
    SolutionIndex: 16
    SolutionNameMin: Cijk_Ailk_Bljk_F8NHS_BH_Bias_HAS_SAV_UserArgs_MT256x128x64_MI16x16x1_SN_LDSB1_CLR1_GRVWA16_GRVWB8_GSU0_GSUC0_GSUWGMRR0_K1_LBSPPA2048_LBSPPB256_LPA0_LPB8_LRVW8_MIWT8_4_PLR1_SU0_SUM0_SUS64_VWA8_VWB4_WGM1_WGMXCC1_WGMXCCGn1
    SolutionIndex: 17
    SolutionNameMin: Cijk_Ailk_Bljk_F8NHS_BH_Bias_HAS_SAV_UserArgs_MT256x128x64_MI16x16x1_SN_LDSB1_CLR1_GRVWA8_GRVWB16_GSU0_GSUC0_GSUWGMRR0_K1_LBSPPA2048_LBSPPB256_LPA0_LPB16_LRVW8_MIWT8_4_PLR1_SU0_SUM0_SUS64_VWA8_VWB4_WGM1_WGMXCC1_WGMXCCGn1
    SolutionIndex: 18
    SolutionNameMin: Cijk_Ailk_Bljk_F8NHS_BH_Bias_HAS_SAV_UserArgs_MT256x128x64_MI16x16x1_SN_LDSB1_CLR1_GRVWA16_GRVWB16_GSU0_GSUC0_GSUWGMRR0_K1_LBSPPA2048_LBSPPB256_LPA0_LPB16_LRVW8_MIWT8_4_PLR1_SU0_SUM0_SUS64_VWA8_VWB4_WGM1_WGMXCC1_WGMXCCGn1
    SolutionIndex: 19
    SolutionNameMin: Cijk_Ailk_Bljk_F8NHS_BH_Bias_HAS_SAV_UserArgs_MT256x128x64_MI16x16x1_SN_LDSB1_CLR1_GRVWA8_GRVWB8_GSU0_GSUC0_GSUWGMRR0_K1_LBSPPA2048_LBSPPB256_LPA0_LPB8_LRVW8_MIWT8_4_PLR1_SU0_SUM0_SUS64_VWA8_VWB4_WGM4_WGMXCC1_WGMXCCGn1
    SolutionIndex: 20
    SolutionNameMin: Cijk_Ailk_Bljk_F8NHS_BH_Bias_HAS_SAV_UserArgs_MT256x128x64_MI16x16x1_SN_LDSB1_CLR1_GRVWA16_GRVWB16_GSU0_GSUC0_GSUWGMRR0_K1_LBSPPA2048_LBSPPB256_LPA0_LPB16_LRVW8_MIWT8_4_PLR1_SU0_SUM0_SUS64_VWA8_VWB4_WGM4_WGMXCC1_WGMXCCGn1
    SolutionIndex: 21
    SolutionNameMin: Cijk_Ailk_Bljk_F8NHS_BH_Bias_HAS_SAV_UserArgs_MT256x128x64_MI16x16x1_SN_LDSB1_CLR1_GRVWA8_GRVWB8_GSU0_GSUC0_GSUWGMRR0_K1_LBSPPA2048_LBSPPB256_LPA0_LPB8_LRVW8_MIWT8_4_PLR1_SU0_SUM0_SUS64_VWA8_VWB4_WGM6_WGMXCC1_WGMXCCGn1
    SolutionIndex: 22
    SolutionNameMin: Cijk_Ailk_Bljk_F8NHS_BH_Bias_HAS_SAV_UserArgs_MT256x128x64_MI16x16x1_SN_LDSB1_CLR1_GRVWA16_GRVWB16_GSU0_GSUC0_GSUWGMRR0_K1_LBSPPA2048_LBSPPB256_LPA0_LPB16_LRVW8_MIWT8_4_PLR1_SU0_SUM0_SUS64_VWA8_VWB4_WGM6_WGMXCC1_WGMXCCGn1
    SolutionIndex: 23
    SolutionNameMin: Cijk_Ailk_Bljk_F8NHS_BH_Bias_HAS_SAV_UserArgs_MT256x128x64_MI16x16x1_SN_LDSB1_CLR1_GRVWA8_GRVWB8_GSU0_GSUC0_GSUWGMRR0_K1_LBSPPA2048_LBSPPB256_LPA0_LPB8_LRVW8_MIWT8_4_PLR1_SU0_SUM0_SUS64_VWA8_VWB4_WGM8_WGMXCC1_WGMXCCGn1
    SolutionIndex: 24
    SolutionNameMin: Cijk_Ailk_Bljk_F8NHS_BH_Bias_HAS_SAV_UserArgs_MT256x128x64_MI16x16x1_SN_LDSB1_CLR1_GRVWA8_GRVWB16_GSU0_GSUC0_GSUWGMRR0_K1_LBSPPA2048_LBSPPB256_LPA0_LPB16_LRVW8_MIWT8_4_PLR1_SU0_SUM0_SUS64_VWA8_VWB4_WGM8_WGMXCC1_WGMXCCGn1
    SolutionIndex: 25
    SolutionNameMin: Cijk_Ailk_Bljk_F8NHS_BH_Bias_HAS_SAV_UserArgs_MT256x128x64_MI16x16x1_SN_LDSB1_CLR1_GRVWA16_GRVWB16_GSU0_GSUC0_GSUWGMRR0_K1_LBSPPA2048_LBSPPB256_LPA0_LPB16_LRVW8_MIWT8_4_PLR1_SU0_SUM0_SUS64_VWA8_VWB4_WGM8_WGMXCC1_WGMXCCGn1
    SolutionIndex: 26
    SolutionNameMin: Cijk_Ailk_Bljk_F8NHS_BH_Bias_HAS_SAV_UserArgs_MT256x64x64_MI16x16x1_SN_LDSB1_CLR1_GRVWA16_GRVWB8_GSU0_GSUC0_GSUWGMRR0_K1_LBSPPA2048_LBSPPB128_LPA0_LPB8_LRVW8_MIWT8_2_PLR1_SU0_SUM0_SUS64_VWA8_VWB2_WGM1_WGMXCC1_WGMXCCGn1
    SolutionIndex: 27
    SolutionNameMin: Cijk_Ailk_Bljk_F8NHS_BH_Bias_HAS_SAV_UserArgs_MT128x128x64_MI16x16x1_SN_LDSB1_CLR1_GRVWA16_GRVWB16_GSU0_GSUC0_GSUWGMRR0_K1_LBSPPA1024_LBSPPB128_LPA0_LPB16_LRVW8_MIWT8_2_PLR1_SU0_SUM0_SUS64_VWA8_VWB2_WGM1_WGMXCC1_WGMXCCGn1
    SolutionIndex: 28
    SolutionNameMin: Cijk_Ailk_Bljk_F8NHS_BH_Bias_HAS_SAV_UserArgs_MT64x128x64_MI16x16x1_SN_LDSB0_CLR1_GRVWA8_GRVWB8_GSU0_GSUC0_GSUWGMRR0_K1_LBSPPA512_LBSPPB512_LPA16_LPB8_LRVW8_MIWT1_8_PLR1_SU0_SUM0_SUS64_VWA1_VWB8_WGM1_WGMXCC1_WGMXCCGn1
    SolutionIndex: 29
    SolutionNameMin: Cijk_Ailk_Bljk_F8NHS_BH_Bias_HAS_SAV_UserArgs_MT128x64x64_MI16x16x1_SN_LDSB0_CLR1_GRVWA8_GRVWB16_GSU0_GSUC0_GSUWGMRR0_K1_LBSPPA1024_LBSPPB128_LPA0_LPB16_LRVW8_MIWT8_1_PLR1_SU0_SUM0_SUS64_VWA8_VWB1_WGM1_WGMXCC1_WGMXCCGn1
    SolutionIndex: 30
    SolutionNameMin: Cijk_Ailk_Bljk_F8NHS_BH_Bias_HAS_SAV_UserArgs_MT128x64x64_MI16x16x1_SN_LDSB0_CLR1_GRVWA16_GRVWB16_GSU0_GSUC0_GSUWGMRR0_K1_LBSPPA1024_LBSPPB128_LPA0_LPB16_LRVW8_MIWT8_1_PLR1_SU0_SUM0_SUS64_VWA8_VWB1_WGM1_WGMXCC1_WGMXCCGn1
    SolutionIndex: 31
    SolutionNameMin: Cijk_Ailk_Bljk_F8NHS_BH_Bias_HAS_SAV_UserArgs_MT128x64x64_MI16x16x1_SN_LDSB0_CLR1_GRVWA16_GRVWB8_GSU0_GSUC0_GSUWGMRR0_K1_LBSPPA1024_LBSPPB128_LPA0_LPB8_LRVW8_MIWT8_1_PLR1_SU0_SUM0_SUS64_VWA8_VWB1_WGM6_WGMXCC1_WGMXCCGn1
    SolutionIndex: 32
    SolutionNameMin: Cijk_Ailk_Bljk_F8NHS_BH_Bias_HAS_SAV_UserArgs_MT128x128x64_MI16x16x1_SN_LDSB1_CLR1_GRVWA16_GRVWB8_GSU0_GSUC0_GSUWGMRR0_K1_LBSPPA1024_LBSPPB256_LPA64_LPB8_LRVW8_MIWT4_4_PLR1_SU0_SUM0_SUS64_VWA4_VWB4_WGM1_WGMXCC1_WGMXCCGn1
    SolutionIndex: 33
    SolutionNameMin: Cijk_Ailk_Bljk_F8NHS_BH_Bias_HAS_SAV_UserArgs_MT128x128x64_MI16x16x1_SN_LDSB1_CLR1_GRVWA8_GRVWB16_GSU0_GSUC0_GSUWGMRR0_K1_LBSPPA1024_LBSPPB256_LPA64_LPB16_LRVW8_MIWT4_4_PLR1_SU0_SUM0_SUS64_VWA4_VWB4_WGM4_WGMXCC1_WGMXCCGn1
    SolutionIndex: 34
    SolutionNameMin: Cijk_Ailk_Bljk_F8NHS_BH_Bias_HAS_SAV_UserArgs_MT64x128x64_MI16x16x1_SN_LDSB0_CLR1_GRVWA16_GRVWB8_GSU0_GSUC0_GSUWGMRR0_K1_LBSPPA512_LBSPPB256_LPA32_LPB8_LRVW8_MIWT2_4_PLR1_SU0_SUM0_SUS64_VWA2_VWB4_WGM1_WGMXCC1_WGMXCCGn1
    SolutionIndex: 35
    SolutionNameMin: Cijk_Ailk_Bljk_F8NHS_BH_Bias_HAS_SAV_UserArgs_MT64x128x64_MI16x16x1_SN_LDSB0_CLR1_GRVWA8_GRVWB16_GSU0_GSUC0_GSUWGMRR0_K1_LBSPPA512_LBSPPB256_LPA32_LPB16_LRVW8_MIWT2_4_PLR1_SU0_SUM0_SUS64_VWA2_VWB4_WGM1_WGMXCC1_WGMXCCGn1
    SolutionIndex: 36
    SolutionNameMin: Cijk_Ailk_Bljk_F8NHS_BH_Bias_HAS_SAV_UserArgs_MT64x128x64_MI16x16x1_SN_LDSB0_CLR1_GRVWA16_GRVWB16_GSU0_GSUC0_GSUWGMRR0_K1_LBSPPA512_LBSPPB256_LPA32_LPB16_LRVW8_MIWT2_4_PLR1_SU0_SUM0_SUS64_VWA2_VWB4_WGM1_WGMXCC1_WGMXCCGn1
    SolutionIndex: 37
    SolutionNameMin: Cijk_Ailk_Bljk_F8NHS_BH_Bias_HAS_SAV_UserArgs_MT64x128x64_MI16x16x1_SN_LDSB0_CLR1_GRVWA16_GRVWB8_GSU0_GSUC0_GSUWGMRR0_K1_LBSPPA512_LBSPPB256_LPA32_LPB8_LRVW8_MIWT2_4_PLR1_SU0_SUM0_SUS64_VWA2_VWB4_WGM8_WGMXCC1_WGMXCCGn1
    SolutionIndex: 38
    SolutionNameMin: Cijk_Ailk_Bljk_F8NHS_BH_Bias_HAS_SAV_UserArgs_MT128x64x64_MI16x16x1_SN_LDSB0_CLR1_GRVWA8_GRVWB8_GSU0_GSUC0_GSUWGMRR0_K1_LBSPPA1024_LBSPPB128_LPA64_LPB8_LRVW8_MIWT4_2_PLR1_SU0_SUM0_SUS64_VWA4_VWB2_WGM1_WGMXCC1_WGMXCCGn1
    SolutionIndex: 39
    SolutionNameMin: Cijk_Ailk_Bljk_F8NHS_BH_Bias_HAS_SAV_UserArgs_MT128x64x64_MI16x16x1_SN_LDSB0_CLR1_GRVWA16_GRVWB8_GSU0_GSUC0_GSUWGMRR0_K1_LBSPPA1024_LBSPPB128_LPA64_LPB8_LRVW8_MIWT4_2_PLR1_SU0_SUM0_SUS64_VWA4_VWB2_WGM1_WGMXCC1_WGMXCCGn1
    SolutionIndex: 40
    SolutionNameMin: Cijk_Ailk_Bljk_F8NHS_BH_Bias_HAS_SAV_UserArgs_MT128x64x64_MI16x16x1_SN_LDSB0_CLR1_GRVWA8_GRVWB16_GSU0_GSUC0_GSUWGMRR0_K1_LBSPPA1024_LBSPPB128_LPA64_LPB16_LRVW8_MIWT4_2_PLR1_SU0_SUM0_SUS64_VWA4_VWB2_WGM1_WGMXCC1_WGMXCCGn1
    SolutionIndex: 41
    SolutionNameMin: Cijk_Ailk_Bljk_F8NHS_BH_Bias_HAS_SAV_UserArgs_MT64x64x64_MI16x16x1_SN_LDSB0_CLR1_GRVWA8_GRVWB16_GSU0_GSUC0_GSUWGMRR0_K1_LBSPPA512_LBSPPB128_LPA32_LPB16_LRVW8_MIWT2_2_PLR1_SU0_SUM0_SUS64_VWA2_VWB2_WGM1_WGMXCC1_WGMXCCGn1
    SolutionIndex: 42
    SolutionNameMin: Cijk_Ailk_Bljk_F8NHS_BH_Bias_HAS_SAV_UserArgs_MT64x64x64_MI16x16x1_SN_LDSB0_CLR1_GRVWA8_GRVWB8_GSU0_GSUC0_GSUWGMRR0_K1_LBSPPA512_LBSPPB128_LPA32_LPB8_LRVW8_MIWT2_2_PLR1_SU0_SUM0_SUS64_VWA2_VWB2_WGM4_WGMXCC1_WGMXCCGn1
    SolutionIndex: 43
    SolutionNameMin: Cijk_Ailk_Bljk_F8NHS_BH_Bias_HAS_SAV_UserArgs_MT64x64x64_MI16x16x1_SN_LDSB0_CLR1_GRVWA16_GRVWB16_GSU0_GSUC0_GSUWGMRR0_K1_LBSPPA512_LBSPPB128_LPA32_LPB16_LRVW8_MIWT2_2_PLR1_SU0_SUM0_SUS64_VWA2_VWB2_WGM4_WGMXCC1_WGMXCCGn1
    SolutionIndex: 44
    SolutionNameMin: Cijk_Ailk_Bljk_F8NHS_BH_Bias_HAS_SAV_UserArgs_MT64x64x64_MI16x16x1_SN_LDSB0_CLR1_GRVWA16_GRVWB16_GSU0_GSUC0_GSUWGMRR0_K1_LBSPPA512_LBSPPB128_LPA32_LPB16_LRVW8_MIWT2_2_PLR1_SU0_SUM0_SUS64_VWA2_VWB2_WGM8_WGMXCC1_WGMXCCGn1
    SolutionIndex: 45
    SolutionNameMin: Cijk_Ailk_Bljk_F8NHS_BH_Bias_HAS_SAV_UserArgs_MT32x64x64_MI16x16x1_SN_LDSB0_CLR1_GRVWA8_GRVWB16_GSU0_GSUC0_GSUWGMRR0_K1_LBSPPA256_LBSPPB128_LPA16_LPB16_LRVW8_MIWT1_2_PLR1_SU0_SUM0_SUS64_VWA1_VWB2_WGM1_WGMXCC1_WGMXCCGn1
    SolutionIndex: 46
    SolutionNameMin: Cijk_Ailk_Bljk_F8NHS_BH_Bias_HAS_SAV_UserArgs_MT32x64x64_MI16x16x1_SN_LDSB0_CLR1_GRVWA8_GRVWB8_GSU0_GSUC0_GSUWGMRR0_K1_LBSPPA256_LBSPPB128_LPA16_LPB8_LRVW8_MIWT1_2_PLR1_SU0_SUM0_SUS64_VWA1_VWB2_WGM6_WGMXCC1_WGMXCCGn1
    SolutionIndex: 47
    SolutionNameMin: Cijk_Ailk_Bljk_F8NHS_BH_Bias_HAS_SAV_UserArgs_MT32x64x64_MI16x16x1_SN_LDSB0_CLR1_GRVWA8_GRVWB16_GSU0_GSUC0_GSUWGMRR0_K1_LBSPPA256_LBSPPB128_LPA16_LPB16_LRVW8_MIWT1_2_PLR1_SU0_SUM0_SUS64_VWA1_VWB2_WGM6_WGMXCC1_WGMXCCGn1
    SolutionIndex: 48
    SolutionNameMin: Cijk_Ailk_Bljk_F8NHS_BH_Bias_HAS_SAV_UserArgs_MT64x32x64_MI16x16x1_SN_LDSB0_CLR1_GRVWA8_GRVWB8_GSU0_GSUC0_GSUWGMRR0_K1_LBSPPA512_LBSPPB128_LPA32_LPB8_LRVW8_MIWT2_1_PLR1_SU0_SUM0_SUS64_VWA2_VWB1_WGM1_WGMXCC1_WGMXCCGn1
    SolutionIndex: 49
    SolutionNameMin: Cijk_Ailk_Bljk_F8NHS_BH_Bias_HAS_SAV_UserArgs_MT32x32x64_MI16x16x1_SN_LDSB0_CLR1_GRVWA8_GRVWB8_GSU0_GSUC0_GSUWGMRR0_K1_LBSPPA256_LBSPPB128_LPA16_LPB8_LRVW8_MIWT1_1_PLR1_SU0_SUM0_SUS64_VWA1_VWB1_WGM1_WGMXCC1_WGMXCCGn1
    SolutionIndex: 50
    SolutionNameMin: Cijk_Ailk_Bljk_F8NHS_BH_Bias_HAS_SAV_UserArgs_MT32x32x64_MI16x16x1_SN_LDSB0_CLR1_GRVWA8_GRVWB8_GSU0_GSUC0_GSUWGMRR0_K1_LBSPPA256_LBSPPB128_LPA16_LPB8_LRVW8_MIWT1_1_PLR1_SU0_SUM0_SUS64_VWA1_VWB1_WGM6_WGMXCC1_WGMXCCGn1
    SolutionIndex: 51
    SolutionNameMin: Cijk_Ailk_Bljk_F8NHS_BH_Bias_HAS_SAV_UserArgs_MT32x32x64_MI16x16x1_SN_LDSB0_CLR1_GRVWA8_GRVWB8_GSU0_GSUC0_GSUWGMRR0_K1_LBSPPA256_LBSPPB128_LPA16_LPB8_LRVW8_MIWT1_1_PLR1_SU0_SUM0_SUS64_VWA1_VWB1_WGM8_WGMXCC1_WGMXCCGn1
    SolutionIndex: 52
    SolutionNameMin: Cijk_Ailk_Bljk_F8NHS_BH_Bias_HAS_SAV_UserArgs_MT128x256x128_MI16x16x1_SN_LDSB1_CLR1_GRVWA8_GRVWB16_GSU0_GSUC0_GSUWGMRR0_K1_LBSPPA1024_LBSPPB1024_LPA64_LPB16_LRVW8_MIWT4_8_PLR1_SU0_SUM0_SUS128_VWA4_VWB8_WGM1_WGMXCC1_WGMXCCGn1
    SolutionIndex: 53
    SolutionNameMin: Cijk_Ailk_Bljk_F8NHS_BH_Bias_HAS_SAV_UserArgs_MT128x256x128_MI16x16x1_SN_LDSB1_CLR1_GRVWA16_GRVWB16_GSU0_GSUC0_GSUWGMRR0_K1_LBSPPA1024_LBSPPB1024_LPA64_LPB16_LRVW8_MIWT4_8_PLR1_SU0_SUM0_SUS128_VWA4_VWB8_WGM1_WGMXCC1_WGMXCCGn1
    SolutionIndex: 54
    SolutionNameMin: Cijk_Ailk_Bljk_F8NHS_BH_Bias_HAS_SAV_UserArgs_MT128x256x128_MI16x16x1_SN_LDSB1_CLR1_GRVWA16_GRVWB16_GSU0_GSUC0_GSUWGMRR0_K1_LBSPPA1024_LBSPPB1024_LPA64_LPB16_LRVW8_MIWT4_8_PLR1_SU0_SUM0_SUS128_VWA4_VWB8_WGM4_WGMXCC1_WGMXCCGn1
    SolutionIndex: 55
    SolutionNameMin: Cijk_Ailk_Bljk_F8NHS_BH_Bias_HAS_SAV_UserArgs_MT128x256x128_MI16x16x1_SN_LDSB1_CLR1_GRVWA16_GRVWB16_GSU0_GSUC0_GSUWGMRR0_K1_LBSPPA1024_LBSPPB1024_LPA64_LPB16_LRVW8_MIWT4_8_PLR1_SU0_SUM0_SUS128_VWA4_VWB8_WGM6_WGMXCC1_WGMXCCGn1
    SolutionIndex: 56
    SolutionNameMin: Cijk_Ailk_Bljk_F8NHS_BH_Bias_HAS_SAV_UserArgs_MT128x256x128_MI16x16x1_SN_LDSB1_CLR1_GRVWA16_GRVWB16_GSU0_GSUC0_GSUWGMRR0_K1_LBSPPA1024_LBSPPB1024_LPA64_LPB16_LRVW8_MIWT4_8_PLR1_SU0_SUM0_SUS128_VWA4_VWB8_WGM8_WGMXCC1_WGMXCCGn1
    SolutionIndex: 57
    SolutionNameMin: Cijk_Ailk_Bljk_F8NHS_BH_Bias_HAS_SAV_UserArgs_MT256x144x128_MI16x16x1_SN_LDSB1_CLR1_GRVWA8_GRVWB8_GSU0_GSUC0_GSUWGMRR0_K1_LBSPPA2048_LBSPPB128_LPA64_LPB8_LRVW8_MIWT4_9_PLR1_SU0_SUM0_SUS128_VWA4_VWB1_WGM1_WGMXCC1_WGMXCCGn1
    SolutionIndex: 58
    SolutionNameMin: Cijk_Ailk_Bljk_F8NHS_BH_Bias_HAS_SAV_UserArgs_MT256x144x128_MI16x16x1_SN_LDSB1_CLR1_GRVWA16_GRVWB8_GSU0_GSUC0_GSUWGMRR0_K1_LBSPPA2048_LBSPPB128_LPA64_LPB8_LRVW8_MIWT4_9_PLR1_SU0_SUM0_SUS128_VWA4_VWB1_WGM1_WGMXCC1_WGMXCCGn1
    SolutionIndex: 59
    SolutionNameMin: Cijk_Ailk_Bljk_F8NHS_BH_Bias_HAS_SAV_UserArgs_MT256x144x128_MI16x16x1_SN_LDSB1_CLR1_GRVWA8_GRVWB8_GSU0_GSUC0_GSUWGMRR0_K1_LBSPPA2048_LBSPPB128_LPA64_LPB8_LRVW8_MIWT4_9_PLR1_SU0_SUM0_SUS128_VWA4_VWB1_WGM4_WGMXCC1_WGMXCCGn1
    SolutionIndex: 60
    SolutionNameMin: Cijk_Ailk_Bljk_F8NHS_BH_Bias_HAS_SAV_UserArgs_MT256x144x128_MI16x16x1_SN_LDSB1_CLR1_GRVWA16_GRVWB8_GSU0_GSUC0_GSUWGMRR0_K1_LBSPPA2048_LBSPPB128_LPA64_LPB8_LRVW8_MIWT4_9_PLR1_SU0_SUM0_SUS128_VWA4_VWB1_WGM4_WGMXCC1_WGMXCCGn1
    SolutionIndex: 61
    SolutionNameMin: Cijk_Ailk_Bljk_F8NHS_BH_Bias_HAS_SAV_UserArgs_MT256x144x128_MI16x16x1_SN_LDSB1_CLR1_GRVWA8_GRVWB8_GSU0_GSUC0_GSUWGMRR0_K1_LBSPPA2048_LBSPPB128_LPA64_LPB8_LRVW8_MIWT4_9_PLR1_SU0_SUM0_SUS128_VWA4_VWB1_WGM6_WGMXCC1_WGMXCCGn1
    SolutionIndex: 62
    SolutionNameMin: Cijk_Ailk_Bljk_F8NHS_BH_Bias_HAS_SAV_UserArgs_MT256x144x128_MI16x16x1_SN_LDSB1_CLR1_GRVWA16_GRVWB8_GSU0_GSUC0_GSUWGMRR0_K1_LBSPPA2048_LBSPPB128_LPA64_LPB8_LRVW8_MIWT4_9_PLR1_SU0_SUM0_SUS128_VWA4_VWB1_WGM6_WGMXCC1_WGMXCCGn1
    SolutionIndex: 63
    SolutionNameMin: Cijk_Ailk_Bljk_F8NHS_BH_Bias_HAS_SAV_UserArgs_MT256x144x128_MI16x16x1_SN_LDSB1_CLR1_GRVWA16_GRVWB8_GSU0_GSUC0_GSUWGMRR0_K1_LBSPPA2048_LBSPPB128_LPA64_LPB8_LRVW8_MIWT4_9_PLR1_SU0_SUM0_SUS128_VWA4_VWB1_WGM8_WGMXCC1_WGMXCCGn1
    SolutionIndex: 64
    SolutionNameMin: Cijk_Ailk_Bljk_F8NHS_BH_Bias_HAS_SAV_UserArgs_MT256x128x128_MI16x16x1_SN_LDSB1_CLR1_GRVWA16_GRVWB8_GSU0_GSUC0_GSUWGMRR0_K1_LBSPPA2048_LBSPPB512_LPA0_LPB8_LRVW8_MIWT8_4_PLR1_SU0_SUM0_SUS128_VWA8_VWB4_WGM1_WGMXCC1_WGMXCCGn1
    SolutionIndex: 65
    SolutionNameMin: Cijk_Ailk_Bljk_F8NHS_BH_Bias_HAS_SAV_UserArgs_MT256x128x128_MI16x16x1_SN_LDSB1_CLR1_GRVWA16_GRVWB8_GSU0_GSUC0_GSUWGMRR0_K1_LBSPPA2048_LBSPPB512_LPA0_LPB8_LRVW8_MIWT8_4_PLR1_SU0_SUM0_SUS128_VWA8_VWB4_WGM8_WGMXCC1_WGMXCCGn1
    SolutionIndex: 66
    SolutionNameMin: Cijk_Ailk_Bljk_F8NHS_BH_Bias_HAS_SAV_UserArgs_MT256x128x128_MI16x16x1_SN_LDSB1_CLR1_GRVWA16_GRVWB16_GSU0_GSUC0_GSUWGMRR0_K1_LBSPPA2048_LBSPPB512_LPA0_LPB16_LRVW8_MIWT8_4_PLR1_SU0_SUM0_SUS128_VWA8_VWB4_WGM8_WGMXCC1_WGMXCCGn1
    SolutionIndex: 67
    SolutionNameMin: Cijk_Ailk_Bljk_F8NHS_BH_Bias_HAS_SAV_UserArgs_MT128x128x128_MI16x16x1_SN_LDSB1_CLR1_GRVWA16_GRVWB16_GSU0_GSUC0_GSUWGMRR0_K1_LBSPPA1024_LBSPPB256_LPA0_LPB16_LRVW8_MIWT8_2_PLR1_SU0_SUM0_SUS128_VWA8_VWB2_WGM1_WGMXCC1_WGMXCCGn1
    SolutionIndex: 68
    SolutionNameMin: Cijk_Ailk_Bljk_F8NHS_BH_Bias_HAS_SAV_UserArgs_MT32x256x128_MI16x16x1_SN_LDSB1_CLR1_GRVWA8_GRVWB8_GSU0_GSUC0_GSUWGMRR0_K1_LBSPPA256_LBSPPB1024_LPA16_LPB8_LRVW8_MIWT1_8_PLR1_SU0_SUM0_SUS128_VWA1_VWB8_WGM1_WGMXCC1_WGMXCCGn1
    SolutionIndex: 69
    SolutionNameMin: Cijk_Ailk_Bljk_F8NHS_BH_Bias_HAS_SAV_UserArgs_MT32x256x128_MI16x16x1_SN_LDSB1_CLR1_GRVWA16_GRVWB16_GSU0_GSUC0_GSUWGMRR0_K1_LBSPPA256_LBSPPB1024_LPA16_LPB16_LRVW8_MIWT1_8_PLR1_SU0_SUM0_SUS128_VWA1_VWB8_WGM6_WGMXCC1_WGMXCCGn1
    SolutionIndex: 70
    SolutionNameMin: Cijk_Ailk_Bljk_F8NHS_BH_Bias_HAS_SAV_UserArgs_MT64x128x128_MI16x16x1_SN_LDSB1_CLR1_GRVWA16_GRVWB8_GSU0_GSUC0_GSUWGMRR0_K1_LBSPPA512_LBSPPB1024_LPA16_LPB8_LRVW8_MIWT1_8_PLR1_SU0_SUM0_SUS128_VWA1_VWB8_WGM6_WGMXCC1_WGMXCCGn1
    SolutionIndex: 71
    SolutionNameMin: Cijk_Ailk_Bljk_F8NHS_BH_Bias_HAS_SAV_UserArgs_MT128x144x128_MI16x16x1_SN_LDSB1_CLR1_GRVWA16_GRVWB8_GSU0_GSUC0_GSUWGMRR0_K1_LBSPPA1024_LBSPPB128_LPA32_LPB8_LRVW8_MIWT2_9_PLR1_SU0_SUM0_SUS128_VWA2_VWB1_WGM1_WGMXCC1_WGMXCCGn1
    SolutionIndex: 72
    SolutionNameMin: Cijk_Ailk_Bljk_F8NHS_BH_Bias_HAS_SAV_UserArgs_MT128x64x128_MI16x16x1_SN_LDSB1_CLR1_GRVWA8_GRVWB8_GSU0_GSUC0_GSUWGMRR0_K1_LBSPPA1024_LBSPPB128_LPA0_LPB8_LRVW8_MIWT8_1_PLR1_SU0_SUM0_SUS128_VWA8_VWB1_WGM1_WGMXCC1_WGMXCCGn1
    SolutionIndex: 73
    SolutionNameMin: Cijk_Ailk_Bljk_F8NHS_BH_Bias_HAS_SAV_UserArgs_MT128x64x128_MI16x16x1_SN_LDSB1_CLR1_GRVWA8_GRVWB16_GSU0_GSUC0_GSUWGMRR0_K1_LBSPPA1024_LBSPPB128_LPA0_LPB16_LRVW8_MIWT8_1_PLR1_SU0_SUM0_SUS128_VWA8_VWB1_WGM1_WGMXCC1_WGMXCCGn1
    SolutionIndex: 74
    SolutionNameMin: Cijk_Ailk_Bljk_F8NHS_BH_Bias_HAS_SAV_UserArgs_MT128x64x128_MI16x16x1_SN_LDSB1_CLR1_GRVWA8_GRVWB16_GSU0_GSUC0_GSUWGMRR0_K1_LBSPPA1024_LBSPPB128_LPA0_LPB16_LRVW8_MIWT8_1_PLR1_SU0_SUM0_SUS128_VWA8_VWB1_WGM6_WGMXCC1_WGMXCCGn1
    SolutionIndex: 75
    SolutionNameMin: Cijk_Ailk_Bljk_F8NHS_BH_Bias_HAS_SAV_UserArgs_MT128x128x128_MI16x16x1_SN_LDSB1_CLR1_GRVWA16_GRVWB16_GSU0_GSUC0_GSUWGMRR0_K1_LBSPPA1024_LBSPPB512_LPA64_LPB16_LRVW8_MIWT4_4_PLR1_SU0_SUM0_SUS128_VWA4_VWB4_WGM1_WGMXCC1_WGMXCCGn1
    SolutionIndex: 76
    SolutionNameMin: Cijk_Ailk_Bljk_F8NHS_BH_Bias_HAS_SAV_UserArgs_MT128x128x128_MI16x16x1_SN_LDSB1_CLR1_GRVWA16_GRVWB16_GSU0_GSUC0_GSUWGMRR0_K1_LBSPPA1024_LBSPPB512_LPA64_LPB16_LRVW8_MIWT4_4_PLR1_SU0_SUM0_SUS128_VWA4_VWB4_WGM4_WGMXCC1_WGMXCCGn1
    SolutionIndex: 77
    SolutionNameMin: Cijk_Ailk_Bljk_F8NHS_BH_Bias_HAS_SAV_UserArgs_MT128x128x128_MI16x16x1_SN_LDSB1_CLR1_GRVWA16_GRVWB16_GSU0_GSUC0_GSUWGMRR0_K1_LBSPPA1024_LBSPPB512_LPA64_LPB16_LRVW8_MIWT4_4_PLR1_SU0_SUM0_SUS128_VWA4_VWB4_WGM6_WGMXCC1_WGMXCCGn1
    SolutionIndex: 78
    SolutionNameMin: Cijk_Ailk_Bljk_F8NHS_BH_Bias_HAS_SAV_UserArgs_MT128x128x128_MI16x16x1_SN_LDSB1_CLR1_GRVWA16_GRVWB16_GSU0_GSUC0_GSUWGMRR0_K1_LBSPPA1024_LBSPPB512_LPA64_LPB16_LRVW8_MIWT4_4_PLR1_SU0_SUM0_SUS128_VWA4_VWB4_WGM8_WGMXCC1_WGMXCCGn1
    SolutionIndex: 79
    SolutionNameMin: Cijk_Ailk_Bljk_F8NHS_BH_Bias_HAS_SAV_UserArgs_MT64x128x128_MI16x16x1_SN_LDSB1_CLR1_GRVWA16_GRVWB16_GSU0_GSUC0_GSUWGMRR0_K1_LBSPPA512_LBSPPB512_LPA32_LPB16_LRVW8_MIWT2_4_PLR1_SU0_SUM0_SUS128_VWA2_VWB4_WGM1_WGMXCC1_WGMXCCGn1
    SolutionIndex: 80
    SolutionNameMin: Cijk_Ailk_Bljk_F8NHS_BH_Bias_HAS_SAV_UserArgs_MT128x64x128_MI16x16x1_SN_LDSB1_CLR1_GRVWA16_GRVWB8_GSU0_GSUC0_GSUWGMRR0_K1_LBSPPA1024_LBSPPB256_LPA64_LPB8_LRVW8_MIWT4_2_PLR1_SU0_SUM0_SUS128_VWA4_VWB2_WGM1_WGMXCC1_WGMXCCGn1
    SolutionIndex: 81
    SolutionNameMin: Cijk_Ailk_Bljk_F8NHS_BH_Bias_HAS_SAV_UserArgs_MT128x64x128_MI16x16x1_SN_LDSB1_CLR1_GRVWA16_GRVWB16_GSU0_GSUC0_GSUWGMRR0_K1_LBSPPA1024_LBSPPB256_LPA64_LPB16_LRVW8_MIWT4_2_PLR1_SU0_SUM0_SUS128_VWA4_VWB2_WGM1_WGMXCC1_WGMXCCGn1
    SolutionIndex: 82
    SolutionNameMin: Cijk_Ailk_Bljk_F8NHS_BH_Bias_HAS_SAV_UserArgs_MT128x64x128_MI16x16x1_SN_LDSB1_CLR1_GRVWA16_GRVWB16_GSU0_GSUC0_GSUWGMRR0_K1_LBSPPA1024_LBSPPB256_LPA64_LPB16_LRVW8_MIWT4_2_PLR1_SU0_SUM0_SUS128_VWA4_VWB2_WGM4_WGMXCC1_WGMXCCGn1
    SolutionIndex: 83
    SolutionNameMin: Cijk_Ailk_Bljk_F8NHS_BH_Bias_HAS_SAV_UserArgs_MT128x64x128_MI16x16x1_SN_LDSB1_CLR1_GRVWA16_GRVWB16_GSU0_GSUC0_GSUWGMRR0_K1_LBSPPA1024_LBSPPB256_LPA64_LPB16_LRVW8_MIWT4_2_PLR1_SU0_SUM0_SUS128_VWA4_VWB2_WGM6_WGMXCC1_WGMXCCGn1
    SolutionIndex: 84
    SolutionNameMin: Cijk_Ailk_Bljk_F8NHS_BH_Bias_HAS_SAV_UserArgs_MT128x64x128_MI16x16x1_SN_LDSB1_CLR1_GRVWA16_GRVWB16_GSU0_GSUC0_GSUWGMRR0_K1_LBSPPA1024_LBSPPB256_LPA64_LPB16_LRVW8_MIWT4_2_PLR1_SU0_SUM0_SUS128_VWA4_VWB2_WGM8_WGMXCC1_WGMXCCGn1
    SolutionIndex: 85
    SolutionNameMin: Cijk_Ailk_Bljk_F8NHS_BH_Bias_HAS_SAV_UserArgs_MT32x128x128_MI16x16x1_SN_LDSB1_CLR1_GRVWA8_GRVWB16_GSU0_GSUC0_GSUWGMRR0_K1_LBSPPA256_LBSPPB512_LPA16_LPB16_LRVW8_MIWT1_4_PLR1_SU0_SUM0_SUS128_VWA1_VWB4_WGM4_WGMXCC1_WGMXCCGn1
    SolutionIndex: 86
    SolutionNameMin: Cijk_Ailk_Bljk_F8NHS_BH_Bias_HAS_SAV_UserArgs_MT32x128x128_MI16x16x1_SN_LDSB1_CLR1_GRVWA16_GRVWB8_GSU0_GSUC0_GSUWGMRR0_K1_LBSPPA256_LBSPPB512_LPA16_LPB8_LRVW8_MIWT1_4_PLR1_SU0_SUM0_SUS128_VWA1_VWB4_WGM8_WGMXCC1_WGMXCCGn1
    SolutionIndex: 87
    SolutionNameMin: Cijk_Ailk_Bljk_F8NHS_BH_Bias_HAS_SAV_UserArgs_MT64x64x128_MI16x16x1_SN_LDSB1_CLR1_GRVWA8_GRVWB8_GSU0_GSUC0_GSUWGMRR0_K1_LBSPPA512_LBSPPB256_LPA32_LPB8_LRVW8_MIWT2_2_PLR1_SU0_SUM0_SUS128_VWA2_VWB2_WGM1_WGMXCC1_WGMXCCGn1
    SolutionIndex: 88
    SolutionNameMin: Cijk_Ailk_Bljk_F8NHS_BH_Bias_HAS_SAV_UserArgs_MT64x64x128_MI16x16x1_SN_LDSB1_CLR1_GRVWA16_GRVWB8_GSU0_GSUC0_GSUWGMRR0_K1_LBSPPA512_LBSPPB256_LPA32_LPB8_LRVW8_MIWT2_2_PLR1_SU0_SUM0_SUS128_VWA2_VWB2_WGM1_WGMXCC1_WGMXCCGn1
    SolutionIndex: 89
    SolutionNameMin: Cijk_Ailk_Bljk_F8NHS_BH_Bias_HAS_SAV_UserArgs_MT64x64x128_MI16x16x1_SN_LDSB1_CLR1_GRVWA8_GRVWB16_GSU0_GSUC0_GSUWGMRR0_K1_LBSPPA512_LBSPPB256_LPA32_LPB16_LRVW8_MIWT2_2_PLR1_SU0_SUM0_SUS128_VWA2_VWB2_WGM1_WGMXCC1_WGMXCCGn1
    SolutionIndex: 90
    SolutionNameMin: Cijk_Ailk_Bljk_F8NHS_BH_Bias_HAS_SAV_UserArgs_MT64x64x128_MI16x16x1_SN_LDSB1_CLR1_GRVWA16_GRVWB16_GSU0_GSUC0_GSUWGMRR0_K1_LBSPPA512_LBSPPB256_LPA32_LPB16_LRVW8_MIWT2_2_PLR1_SU0_SUM0_SUS128_VWA2_VWB2_WGM1_WGMXCC1_WGMXCCGn1
    SolutionIndex: 91
    SolutionNameMin: Cijk_Ailk_Bljk_F8NHS_BH_Bias_HAS_SAV_UserArgs_MT64x64x128_MI16x16x1_SN_LDSB1_CLR1_GRVWA16_GRVWB8_GSU0_GSUC0_GSUWGMRR0_K1_LBSPPA512_LBSPPB256_LPA32_LPB8_LRVW8_MIWT2_2_PLR1_SU0_SUM0_SUS128_VWA2_VWB2_WGM4_WGMXCC1_WGMXCCGn1
    SolutionIndex: 92
    SolutionNameMin: Cijk_Ailk_Bljk_F8NHS_BH_Bias_HAS_SAV_UserArgs_MT64x64x128_MI16x16x1_SN_LDSB1_CLR1_GRVWA16_GRVWB16_GSU0_GSUC0_GSUWGMRR0_K1_LBSPPA512_LBSPPB256_LPA32_LPB16_LRVW8_MIWT2_2_PLR1_SU0_SUM0_SUS128_VWA2_VWB2_WGM4_WGMXCC1_WGMXCCGn1
    SolutionIndex: 93
    SolutionNameMin: Cijk_Ailk_Bljk_F8NHS_BH_Bias_HAS_SAV_UserArgs_MT64x64x128_MI16x16x1_SN_LDSB1_CLR1_GRVWA8_GRVWB16_GSU0_GSUC0_GSUWGMRR0_K1_LBSPPA512_LBSPPB256_LPA32_LPB16_LRVW8_MIWT2_2_PLR1_SU0_SUM0_SUS128_VWA2_VWB2_WGM6_WGMXCC1_WGMXCCGn1
    SolutionIndex: 94
    SolutionNameMin: Cijk_Ailk_Bljk_F8NHS_BH_Bias_HAS_SAV_UserArgs_MT64x64x128_MI16x16x1_SN_LDSB1_CLR1_GRVWA16_GRVWB16_GSU0_GSUC0_GSUWGMRR0_K1_LBSPPA512_LBSPPB256_LPA32_LPB16_LRVW8_MIWT2_2_PLR1_SU0_SUM0_SUS128_VWA2_VWB2_WGM6_WGMXCC1_WGMXCCGn1
    SolutionIndex: 95
    SolutionNameMin: Cijk_Ailk_Bljk_F8NHS_BH_Bias_HAS_SAV_UserArgs_MT64x64x128_MI16x16x1_SN_LDSB1_CLR1_GRVWA8_GRVWB8_GSU0_GSUC0_GSUWGMRR0_K1_LBSPPA512_LBSPPB256_LPA32_LPB8_LRVW8_MIWT2_2_PLR1_SU0_SUM0_SUS128_VWA2_VWB2_WGM8_WGMXCC1_WGMXCCGn1
    SolutionIndex: 96
    SolutionNameMin: Cijk_Ailk_Bljk_F8NHS_BH_Bias_HAS_SAV_UserArgs_MT64x64x128_MI16x16x1_SN_LDSB1_CLR1_GRVWA16_GRVWB16_GSU0_GSUC0_GSUWGMRR0_K1_LBSPPA512_LBSPPB256_LPA32_LPB16_LRVW8_MIWT2_2_PLR1_SU0_SUM0_SUS128_VWA2_VWB2_WGM8_WGMXCC1_WGMXCCGn1
    SolutionIndex: 97
    SolutionNameMin: Cijk_Ailk_Bljk_F8NHS_BH_Bias_HAS_SAV_UserArgs_MT32x64x128_MI16x16x1_SN_LDSB0_CLR1_GRVWA16_GRVWB16_GSU0_GSUC0_GSUWGMRR0_K1_LBSPPA256_LBSPPB256_LPA16_LPB16_LRVW8_MIWT1_2_PLR1_SU0_SUM0_SUS128_VWA1_VWB2_WGM1_WGMXCC1_WGMXCCGn1
    SolutionIndex: 98
    SolutionNameMin: Cijk_Ailk_Bljk_F8NHS_BH_Bias_HAS_SAV_UserArgs_MT32x64x128_MI16x16x1_SN_LDSB0_CLR1_GRVWA8_GRVWB16_GSU0_GSUC0_GSUWGMRR0_K1_LBSPPA256_LBSPPB256_LPA16_LPB16_LRVW8_MIWT1_2_PLR1_SU0_SUM0_SUS128_VWA1_VWB2_WGM6_WGMXCC1_WGMXCCGn1
    SolutionIndex: 99
    SolutionNameMin: Cijk_Ailk_Bljk_F8NHS_BH_Bias_HAS_SAV_UserArgs_MT32x64x128_MI16x16x1_SN_LDSB0_CLR1_GRVWA16_GRVWB16_GSU0_GSUC0_GSUWGMRR0_K1_LBSPPA256_LBSPPB256_LPA16_LPB16_LRVW8_MIWT1_2_PLR1_SU0_SUM0_SUS128_VWA1_VWB2_WGM6_WGMXCC1_WGMXCCGn1
    SolutionIndex: 100
    SolutionNameMin: Cijk_Ailk_Bljk_F8NHS_BH_Bias_HAS_SAV_UserArgs_MT32x64x128_MI16x16x1_SN_LDSB0_CLR1_GRVWA16_GRVWB8_GSU0_GSUC0_GSUWGMRR0_K1_LBSPPA256_LBSPPB256_LPA16_LPB8_LRVW8_MIWT1_2_PLR1_SU0_SUM0_SUS128_VWA1_VWB2_WGM8_WGMXCC1_WGMXCCGn1
    SolutionIndex: 101
    SolutionNameMin: Cijk_Ailk_Bljk_F8NHS_BH_Bias_HAS_SAV_UserArgs_MT64x32x128_MI16x16x1_SN_LDSB0_CLR1_GRVWA8_GRVWB8_GSU0_GSUC0_GSUWGMRR0_K1_LBSPPA512_LBSPPB128_LPA32_LPB8_LRVW8_MIWT2_1_PLR1_SU0_SUM0_SUS128_VWA2_VWB1_WGM1_WGMXCC1_WGMXCCGn1
    SolutionIndex: 102
    SolutionNameMin: Cijk_Ailk_Bljk_F8NHS_BH_Bias_HAS_SAV_UserArgs_MT64x32x128_MI16x16x1_SN_LDSB0_CLR1_GRVWA8_GRVWB16_GSU0_GSUC0_GSUWGMRR0_K1_LBSPPA512_LBSPPB128_LPA32_LPB16_LRVW8_MIWT2_1_PLR1_SU0_SUM0_SUS128_VWA2_VWB1_WGM1_WGMXCC1_WGMXCCGn1
    SolutionIndex: 103
    SolutionNameMin: Cijk_Ailk_Bljk_F8NHS_BH_Bias_HAS_SAV_UserArgs_MT64x32x128_MI16x16x1_SN_LDSB0_CLR1_GRVWA16_GRVWB16_GSU0_GSUC0_GSUWGMRR0_K1_LBSPPA512_LBSPPB128_LPA32_LPB16_LRVW8_MIWT2_1_PLR1_SU0_SUM0_SUS128_VWA2_VWB1_WGM1_WGMXCC1_WGMXCCGn1
    SolutionIndex: 104
    SolutionNameMin: Cijk_Ailk_Bljk_F8NHS_BH_Bias_HAS_SAV_UserArgs_MT32x32x128_MI16x16x1_SN_LDSB0_CLR1_GRVWA8_GRVWB8_GSU0_GSUC0_GSUWGMRR0_K1_LBSPPA256_LBSPPB128_LPA16_LPB8_LRVW8_MIWT1_1_PLR1_SU0_SUM0_SUS128_VWA1_VWB1_WGM1_WGMXCC1_WGMXCCGn1
    SolutionIndex: 105
    SolutionNameMin: Cijk_Ailk_Bljk_F8NHS_BH_Bias_HAS_SAV_UserArgs_MT32x32x128_MI16x16x1_SN_LDSB0_CLR1_GRVWA8_GRVWB16_GSU0_GSUC0_GSUWGMRR0_K1_LBSPPA256_LBSPPB128_LPA16_LPB16_LRVW8_MIWT1_1_PLR1_SU0_SUM0_SUS128_VWA1_VWB1_WGM1_WGMXCC1_WGMXCCGn1
    SolutionIndex: 106
    SolutionNameMin: Cijk_Ailk_Bljk_F8NHS_BH_Bias_HAS_SAV_UserArgs_MT32x32x128_MI16x16x1_SN_LDSB0_CLR1_GRVWA16_GRVWB16_GSU0_GSUC0_GSUWGMRR0_K1_LBSPPA256_LBSPPB128_LPA16_LPB16_LRVW8_MIWT1_1_PLR1_SU0_SUM0_SUS128_VWA1_VWB1_WGM1_WGMXCC1_WGMXCCGn1
    SolutionIndex: 107
    SolutionNameMin: Cijk_Ailk_Bljk_F8NHS_BH_Bias_HAS_SAV_UserArgs_MT64x64x256_MI16x16x1_SN_LDSB1_CLR1_GRVWA16_GRVWB16_GSU0_GSUC0_GSUWGMRR0_K1_LBSPPA512_LBSPPB512_LPA32_LPB16_LRVW8_MIWT2_2_PLR1_SU0_SUM0_SUS256_VWA2_VWB2_WGM1_WGMXCC1_WGMXCCGn1
    SolutionIndex: 108
    SolutionNameMin: Cijk_Ailk_Bljk_F8NHS_BH_Bias_HAS_SAV_UserArgs_MT64x64x256_MI16x16x1_SN_LDSB1_CLR1_GRVWA16_GRVWB16_GSU0_GSUC0_GSUWGMRR0_K1_LBSPPA512_LBSPPB512_LPA32_LPB16_LRVW8_MIWT2_2_PLR1_SU0_SUM0_SUS256_VWA2_VWB2_WGM8_WGMXCC1_WGMXCCGn1
    SolutionIndex: 109
    SolutionNameMin: Cijk_Ailk_Bljk_F8NHS_BH_Bias_HAS_SAV_UserArgs_MT32x64x256_MI16x16x1_SN_LDSB1_CLR1_GRVWA8_GRVWB16_GSU0_GSUC0_GSUWGMRR0_K1_LBSPPA256_LBSPPB512_LPA16_LPB16_LRVW8_MIWT1_2_PLR1_SU0_SUM0_SUS256_VWA1_VWB2_WGM6_WGMXCC1_WGMXCCGn1
    SolutionIndex: 110
    SolutionNameMin: Cijk_Ailk_Bljk_F8NHS_BH_Bias_HAS_SAV_UserArgs_MT64x32x256_MI16x16x1_SN_LDSB1_CLR1_GRVWA16_GRVWB16_GSU0_GSUC0_GSUWGMRR0_K1_LBSPPA512_LBSPPB256_LPA32_LPB16_LRVW8_MIWT2_1_PLR1_SU0_SUM0_SUS256_VWA2_VWB1_WGM1_WGMXCC1_WGMXCCGn1
    SolutionIndex: 111
    SolutionNameMin: Cijk_Ailk_Bljk_F8NHS_BH_Bias_HAS_SAV_UserArgs_MT64x32x256_MI16x16x1_SN_LDSB1_CLR1_GRVWA16_GRVWB16_GSU0_GSUC0_GSUWGMRR0_K1_LBSPPA512_LBSPPB256_LPA32_LPB16_LRVW8_MIWT2_1_PLR1_SU0_SUM0_SUS256_VWA2_VWB1_WGM4_WGMXCC1_WGMXCCGn1
    SolutionIndex: 112
    SolutionNameMin: Cijk_Ailk_Bljk_F8NHS_BH_Bias_HAS_SAV_UserArgs_MT64x32x256_MI16x16x1_SN_LDSB1_CLR1_GRVWA16_GRVWB16_GSU0_GSUC0_GSUWGMRR0_K1_LBSPPA512_LBSPPB256_LPA32_LPB16_LRVW8_MIWT2_1_PLR1_SU0_SUM0_SUS256_VWA2_VWB1_WGM6_WGMXCC1_WGMXCCGn1
    SolutionIndex: 113
    SolutionNameMin: Cijk_Ailk_Bljk_F8NHS_BH_Bias_HAS_SAV_UserArgs_MT64x32x256_MI16x16x1_SN_LDSB1_CLR1_GRVWA16_GRVWB16_GSU0_GSUC0_GSUWGMRR0_K1_LBSPPA512_LBSPPB256_LPA32_LPB16_LRVW8_MIWT2_1_PLR1_SU0_SUM0_SUS256_VWA2_VWB1_WGM8_WGMXCC1_WGMXCCGn1
    SolutionIndex: 114
    SolutionNameMin: Cijk_Ailk_Bljk_F8NHS_BH_Bias_HAS_SAV_UserArgs_MT32x32x256_MI16x16x1_SN_LDSB1_CLR1_GRVWA8_GRVWB16_GSU0_GSUC0_GSUWGMRR0_K1_LBSPPA256_LBSPPB256_LPA16_LPB16_LRVW8_MIWT1_1_PLR1_SU0_SUM0_SUS256_VWA1_VWB1_WGM4_WGMXCC1_WGMXCCGn1
    SolutionIndex: 115
    SolutionNameMin: Cijk_Ailk_Bljk_F8NHS_BH_Bias_HAS_SAV_UserArgs_MT32x32x256_MI16x16x1_SN_LDSB1_CLR1_GRVWA16_GRVWB16_GSU0_GSUC0_GSUWGMRR0_K1_LBSPPA256_LBSPPB256_LPA16_LPB16_LRVW8_MIWT1_1_PLR1_SU0_SUM0_SUS256_VWA1_VWB1_WGM4_WGMXCC1_WGMXCCGn1
    SolutionIndex: 116
    SolutionNameMin: Cijk_Ailk_Bljk_F8NHS_BH_Bias_HAS_SAV_UserArgs_MT32x32x256_MI16x16x1_SN_LDSB1_CLR1_GRVWA16_GRVWB16_GSU0_GSUC0_GSUWGMRR0_K1_LBSPPA256_LBSPPB256_LPA16_LPB16_LRVW8_MIWT1_1_PLR1_SU0_SUM0_SUS256_VWA1_VWB1_WGM6_WGMXCC1_WGMXCCGn1
    SolutionIndex: 117
    SolutionNameMin: Cijk_Ailk_Bljk_F8NHS_BH_Bias_HAS_SAV_UserArgs_MT32x32x256_MI16x16x1_SN_LDSB1_CLR1_GRVWA16_GRVWB16_GSU0_GSUC0_GSUWGMRR0_K1_LBSPPA256_LBSPPB256_LPA16_LPB16_LRVW8_MIWT1_1_PLR1_SU0_SUM0_SUS256_VWA1_VWB1_WGM8_WGMXCC1_WGMXCCGn1
- - - [128, 128, 1, 128, 128, 128, 128, 128]
    - [80, 0.36]
  - - [128, 128, 1, 256, 128, 128, 128, 256]
    - [42, 0.68]
  - - [128, 128, 1, 512, 128, 128, 128, 512]
    - [86, 1.22]
  - - [128, 128, 1, 1024, 128, 128, 128, 1024]
    - [97, 2.29]
  - - [128, 128, 1, 2048, 128, 128, 128, 2048]
    - [106, 3.79]
  - - [128, 128, 1, 4096, 128, 128, 128, 4096]
    - [104, 4.76]
  - - [128, 128, 1, 8192, 128, 128, 128, 8192]
    - [106, 5.45]
  - - [128, 256, 1, 128, 128, 128, 128, 128]
    - [37, 0.65]
  - - [128, 256, 1, 256, 128, 128, 128, 256]
    - [31, 1.37]
  - - [128, 256, 1, 512, 128, 128, 128, 512]
    - [109, 2.87]
  - - [128, 256, 1, 1024, 128, 128, 128, 1024]
    - [51, 4.83]
  - - [128, 256, 1, 2048, 128, 128, 128, 2048]
    - [104, 7.63]
  - - [128, 256, 1, 4096, 128, 128, 128, 4096]
    - [106, 9.58]
  - - [128, 256, 1, 8192, 128, 128, 128, 8192]
    - [104, 10.91]
  - - [128, 512, 1, 128, 128, 128, 128, 128]
    - [47, 1.77]
  - - [128, 512, 1, 256, 128, 128, 128, 256]
    - [105, 4.07]
  - - [128, 512, 1, 512, 128, 128, 128, 512]
    - [104, 7.12]
  - - [128, 512, 1, 1024, 128, 128, 128, 1024]
    - [51, 9.85]
  - - [128, 512, 1, 2048, 128, 128, 128, 2048]
    - [106, 15.23]
  - - [128, 512, 1, 4096, 128, 128, 128, 4096]
    - [106, 18.97]
  - - [128, 512, 1, 8192, 128, 128, 128, 8192]
    - [106, 21.73]
  - - [128, 1024, 1, 128, 128, 128, 128, 128]
    - [69, 2.68]
  - - [128, 1024, 1, 256, 128, 128, 128, 256]
    - [28, 5.49]
  - - [128, 1024, 1, 512, 128, 128, 128, 512]
    - [85, 9.81]
  - - [128, 1024, 1, 1024, 128, 128, 128, 1024]
    - [50, 19.23]
  - - [128, 1024, 1, 2048, 128, 128, 128, 2048]
    - [104, 30.02]
  - - [128, 1024, 1, 4096, 128, 128, 128, 4096]
    - [104, 37.37]
  - - [128, 1024, 1, 8192, 128, 128, 128, 8192]
    - [104, 42.65]
  - - [128, 2048, 1, 128, 128, 128, 128, 128]
    - [68, 5.76]
  - - [128, 2048, 1, 256, 128, 128, 128, 256]
    - [30, 11.02]
  - - [128, 2048, 1, 512, 128, 128, 128, 512]
    - [94, 20.45]
  - - [128, 2048, 1, 1024, 128, 128, 128, 1024]
    - [102, 37.0]
  - - [128, 2048, 1, 2048, 128, 128, 128, 2048]
    - [110, 51.58]
  - - [128, 2048, 1, 4096, 128, 128, 128, 4096]
    - [110, 63.57]
  - - [128, 2048, 1, 8192, 128, 128, 128, 8192]
    - [110, 71.82]
  - - [128, 4096, 1, 128, 128, 128, 128, 128]
    - [70, 10.77]
  - - [128, 4096, 1, 256, 128, 128, 128, 256]
    - [87, 25.9]
  - - [128, 4096, 1, 512, 128, 128, 128, 512]
    - [88, 42.82]
  - - [128, 4096, 1, 1024, 128, 128, 128, 1024]
    - [88, 63.62]
  - - [128, 4096, 1, 2048, 128, 128, 128, 2048]
    - [107, 84.94]
  - - [128, 4096, 1, 4096, 128, 128, 128, 4096]
    - [107, 102.19]
  - - [128, 4096, 1, 8192, 128, 128, 128, 8192]
    - [108, 112.47]
  - - [128, 8192, 1, 128, 128, 128, 128, 128]
    - [30, 25.45]
  - - [128, 8192, 1, 256, 128, 128, 128, 256]
    - [35, 44.81]
  - - [128, 8192, 1, 512, 128, 128, 128, 512]
    - [35, 71.62]
  - - [128, 8192, 1, 1024, 128, 128, 128, 1024]
    - [34, 103.39]
  - - [128, 8192, 1, 2048, 128, 128, 128, 2048]
    - [34, 133.24]
  - - [128, 8192, 1, 4096, 128, 128, 128, 4096]
    - [79, 142.64]
  - - [128, 8192, 1, 8192, 128, 128, 128, 8192]
    - [108, 154.56]
  - - [256, 128, 1, 128, 256, 256, 256, 128]
    - [49, 1.08]
  - - [256, 128, 1, 256, 256, 256, 256, 256]
    - [106, 2.01]
  - - [256, 128, 1, 512, 256, 256, 256, 512]
    - [104, 3.48]
  - - [256, 128, 1, 1024, 256, 256, 256, 1024]
    - [105, 5.6]
  - - [256, 128, 1, 2048, 256, 256, 256, 2048]
    - [104, 7.7]
  - - [256, 128, 1, 4096, 256, 256, 256, 4096]
    - [104, 9.58]
  - - [256, 128, 1, 8192, 256, 256, 256, 8192]
    - [104, 10.97]
  - - [256, 256, 1, 128, 256, 256, 256, 128]
    - [51, 2.12]
  - - [256, 256, 1, 256, 256, 256, 256, 256]
    - [49, 4.0]
  - - [256, 256, 1, 512, 256, 256, 256, 512]
    - [105, 6.97]
  - - [256, 256, 1, 1024, 256, 256, 256, 1024]
    - [105, 10.89]
  - - [256, 256, 1, 2048, 256, 256, 256, 2048]
    - [105, 15.18]
  - - [256, 256, 1, 4096, 256, 256, 256, 4096]
    - [104, 19.08]
  - - [256, 256, 1, 8192, 256, 256, 256, 8192]
    - [104, 21.74]
  - - [256, 512, 1, 128, 256, 256, 256, 128]
    - [49, 4.2]
  - - [256, 512, 1, 256, 256, 256, 256, 256]
    - [105, 7.76]
  - - [256, 512, 1, 512, 256, 256, 256, 512]
    - [105, 13.58]
  - - [256, 512, 1, 1024, 256, 256, 256, 1024]
    - [104, 21.52]
  - - [256, 512, 1, 2048, 256, 256, 256, 2048]
    - [104, 30.13]
  - - [256, 512, 1, 4096, 256, 256, 256, 4096]
    - [104, 37.65]
  - - [256, 512, 1, 8192, 256, 256, 256, 8192]
    - [104, 42.97]
  - - [256, 1024, 1, 128, 256, 256, 256, 128]
    - [48, 8.21]
  - - [256, 1024, 1, 256, 256, 256, 256, 256]
    - [102, 14.58]
  - - [256, 1024, 1, 512, 256, 256, 256, 512]
    - [102, 24.45]
  - - [256, 1024, 1, 1024, 256, 256, 256, 1024]
    - [102, 37.79]
  - - [256, 1024, 1, 2048, 256, 256, 256, 2048]
    - [110, 51.75]
  - - [256, 1024, 1, 4096, 256, 256, 256, 4096]
    - [110, 63.89]
  - - [256, 1024, 1, 8192, 256, 256, 256, 8192]
    - [110, 72.4]
  - - [256, 2048, 1, 128, 256, 256, 256, 128]
    - [41, 14.7]
  - - [256, 2048, 1, 256, 256, 256, 256, 256]
    - [41, 26.06]
  - - [256, 2048, 1, 512, 256, 256, 256, 512]
    - [89, 41.88]
  - - [256, 2048, 1, 1024, 256, 256, 256, 1024]
    - [88, 63.35]
  - - [256, 2048, 1, 2048, 256, 256, 256, 2048]
    - [88, 84.49]
  - - [256, 2048, 1, 4096, 256, 256, 256, 4096]
    - [107, 102.21]
  - - [256, 2048, 1, 8192, 256, 256, 256, 8192]
    - [110, 110.47]
  - - [256, 4096, 1, 128, 256, 256, 256, 128]
    - [35, 25.04]
  - - [256, 4096, 1, 256, 256, 256, 256, 256]
    - [36, 44.17]
  - - [256, 4096, 1, 512, 256, 256, 256, 512]
    - [35, 71.23]
  - - [256, 4096, 1, 1024, 256, 256, 256, 1024]
    - [34, 103.59]
  - - [256, 4096, 1, 2048, 256, 256, 256, 2048]
    - [34, 133.37]
  - - [256, 4096, 1, 4096, 256, 256, 256, 4096]
    - [79, 145.01]
  - - [256, 4096, 1, 8192, 256, 256, 256, 8192]
    - [79, 151.79]
  - - [256, 8192, 1, 128, 256, 256, 256, 128]
    - [27, 38.64]
  - - [256, 8192, 1, 256, 256, 256, 256, 256]
    - [75, 66.74]
  - - [256, 8192, 1, 512, 256, 256, 256, 512]
    - [75, 106.87]
  - - [256, 8192, 1, 1024, 256, 256, 256, 1024]
    - [75, 154.76]
  - - [256, 8192, 1, 2048, 256, 256, 256, 2048]
    - [75, 195.4]
  - - [256, 8192, 1, 4096, 256, 256, 256, 4096]
    - [75, 223.0]
  - - [256, 8192, 1, 8192, 256, 256, 256, 8192]
    - [77, 212.91]
  - - [512, 128, 1, 128, 512, 512, 512, 128]
    - [49, 2.23]
  - - [512, 128, 1, 256, 512, 512, 512, 256]
    - [104, 4.0]
  - - [512, 128, 1, 512, 512, 512, 512, 512]
    - [104, 6.93]
  - - [512, 128, 1, 1024, 512, 512, 512, 1024]
    - [105, 10.82]
  - - [512, 128, 1, 2048, 512, 512, 512, 2048]
    - [104, 15.2]
  - - [512, 128, 1, 4096, 512, 512, 512, 4096]
    - [104, 18.97]
  - - [512, 128, 1, 8192, 512, 512, 512, 8192]
    - [117, 18.57]
  - - [512, 256, 1, 128, 512, 512, 512, 128]
    - [48, 4.06]
  - - [512, 256, 1, 256, 512, 512, 512, 256]
    - [105, 7.89]
  - - [512, 256, 1, 512, 512, 512, 512, 512]
    - [105, 12.85]
  - - [512, 256, 1, 1024, 512, 512, 512, 1024]
    - [104, 21.01]
  - - [512, 256, 1, 2048, 512, 512, 512, 2048]
    - [104, 29.82]
  - - [512, 256, 1, 4096, 512, 512, 512, 4096]
    - [104, 37.28]
  - - [512, 256, 1, 8192, 512, 512, 512, 8192]
    - [115, 34.03]
  - - [512, 512, 1, 128, 512, 512, 512, 128]
    - [95, 5.31]
  - - [512, 512, 1, 256, 512, 512, 512, 256]
    - [72, 9.71]
  - - [512, 512, 1, 512, 512, 512, 512, 512]
    - [45, 19.31]
  - - [512, 512, 1, 1024, 512, 512, 512, 1024]
    - [46, 33.68]
  - - [512, 512, 1, 2048, 512, 512, 512, 2048]
    - [110, 51.23]
  - - [512, 512, 1, 4096, 512, 512, 512, 4096]
    - [110, 63.01]
  - - [512, 512, 1, 8192, 512, 512, 512, 8192]
    - [103, 62.17]
  - - [512, 1024, 1, 128, 512, 512, 512, 128]
    - [33, 10.74]
  - - [512, 1024, 1, 256, 512, 512, 512, 256]
    - [40, 21.6]
  - - [512, 1024, 1, 512, 512, 512, 512, 512]
    - [44, 39.06]
  - - [512, 1024, 1, 1024, 512, 512, 512, 1024]
    - [90, 62.33]
  - - [512, 1024, 1, 2048, 512, 512, 512, 2048]
    - [88, 82.89]
  - - [512, 1024, 1, 4096, 512, 512, 512, 4096]
    - [88, 99.32]
  - - [512, 1024, 1, 8192, 512, 512, 512, 8192]
    - [90, 104.03]
  - - [512, 2048, 1, 128, 512, 512, 512, 128]
    - [35, 24.88]
  - - [512, 2048, 1, 256, 512, 512, 512, 256]
    - [35, 44.49]
  - - [512, 2048, 1, 512, 512, 512, 512, 512]
    - [35, 71.46]
  - - [512, 2048, 1, 1024, 512, 512, 512, 1024]
    - [34, 102.89]
  - - [512, 2048, 1, 2048, 512, 512, 512, 2048]
    - [34, 133.07]
  - - [512, 2048, 1, 4096, 512, 512, 512, 4096]
    - [90, 142.29]
  - - [512, 2048, 1, 8192, 512, 512, 512, 8192]
    - [81, 146.69]
  - - [512, 4096, 1, 128, 512, 512, 512, 128]
    - [27, 39.3]
  - - [512, 4096, 1, 256, 512, 512, 512, 256]
    - [75, 66.73]
  - - [512, 4096, 1, 512, 512, 512, 512, 512]
    - [75, 107.55]
  - - [512, 4096, 1, 1024, 512, 512, 512, 1024]
    - [75, 154.88]
  - - [512, 4096, 1, 2048, 512, 512, 512, 2048]
    - [75, 198.33]
  - - [512, 4096, 1, 4096, 512, 512, 512, 4096]
    - [77, 203.39]
  - - [512, 4096, 1, 8192, 512, 512, 512, 8192]
    - [75, 198.45]
  - - [512, 8192, 1, 128, 512, 512, 512, 128]
    - [71, 59.61]
  - - [512, 8192, 1, 256, 512, 512, 512, 256]
    - [71, 102.94]
  - - [512, 8192, 1, 512, 512, 512, 512, 512]
    - [71, 167.27]
  - - [512, 8192, 1, 1024, 512, 512, 512, 1024]
    - [71, 216.74]
  - - [512, 8192, 1, 2048, 512, 512, 512, 2048]
    - [58, 239.68]
  - - [512, 8192, 1, 4096, 512, 512, 512, 4096]
    - [58, 261.51]
  - - [512, 8192, 1, 8192, 512, 512, 512, 8192]
    - [58, 242.43]
  - - [1024, 128, 1, 128, 1024, 1024, 1024, 128]
    - [49, 4.34]
  - - [1024, 128, 1, 256, 1024, 1024, 1024, 256]
    - [105, 7.92]
  - - [1024, 128, 1, 512, 1024, 1024, 1024, 512]
    - [105, 13.69]
  - - [1024, 128, 1, 1024, 1024, 1024, 1024, 1024]
    - [105, 21.45]
  - - [1024, 128, 1, 2048, 1024, 1024, 1024, 2048]
    - [104, 29.82]
  - - [1024, 128, 1, 4096, 1024, 1024, 1024, 4096]
    - [116, 30.41]
  - - [1024, 128, 1, 8192, 1024, 1024, 1024, 8192]
    - [114, 30.37]
  - - [1024, 256, 1, 128, 1024, 1024, 1024, 128]
    - [102, 8.22]
  - - [1024, 256, 1, 256, 1024, 1024, 1024, 256]
    - [102, 14.65]
  - - [1024, 256, 1, 512, 1024, 1024, 1024, 512]
    - [102, 24.38]
  - - [1024, 256, 1, 1024, 1024, 1024, 1024, 1024]
    - [102, 37.46]
  - - [1024, 256, 1, 2048, 1024, 1024, 1024, 2048]
    - [110, 51.39]
  - - [1024, 256, 1, 4096, 1024, 1024, 1024, 4096]
    - [98, 54.41]
  - - [1024, 256, 1, 8192, 1024, 1024, 1024, 8192]
    - [112, 58.76]
  - - [1024, 512, 1, 128, 1024, 1024, 1024, 128]
    - [41, 14.78]
  - - [1024, 512, 1, 256, 1024, 1024, 1024, 256]
    - [89, 25.82]
  - - [1024, 512, 1, 512, 1024, 1024, 1024, 512]
    - [89, 42.33]
  - - [1024, 512, 1, 1024, 1024, 1024, 1024, 1024]
    - [89, 62.59]
  - - [1024, 512, 1, 2048, 1024, 1024, 1024, 2048]
    - [91, 82.64]
  - - [1024, 512, 1, 4096, 1024, 1024, 1024, 4096]
    - [92, 93.9]
  - - [1024, 512, 1, 8192, 1024, 1024, 1024, 8192]
    - [90, 101.29]
  - - [1024, 1024, 1, 128, 1024, 1024, 1024, 128]
    - [35, 24.8]
  - - [1024, 1024, 1, 256, 1024, 1024, 1024, 256]
    - [35, 44.22]
  - - [1024, 1024, 1, 512, 1024, 1024, 1024, 512]
    - [35, 70.71]
  - - [1024, 1024, 1, 1024, 1024, 1024, 1024, 1024]
    - [34, 101.72]
  - - [1024, 1024, 1, 2048, 1024, 1024, 1024, 2048]
    - [34, 132.31]
  - - [1024, 1024, 1, 4096, 1024, 1024, 1024, 4096]
    - [82, 139.04]
  - - [1024, 1024, 1, 8192, 1024, 1024, 1024, 8192]
    - [82, 147.16]
  - - [1024, 2048, 1, 128, 1024, 1024, 1024, 128]
    - [27, 38.63]
  - - [1024, 2048, 1, 256, 1024, 1024, 1024, 256]
    - [75, 65.88]
  - - [1024, 2048, 1, 512, 1024, 1024, 1024, 512]
    - [75, 107.0]
  - - [1024, 2048, 1, 1024, 1024, 1024, 1024, 1024]
    - [75, 154.18]
  - - [1024, 2048, 1, 2048, 1024, 1024, 1024, 2048]
    - [75, 192.13]
  - - [1024, 2048, 1, 4096, 1024, 1024, 1024, 4096]
    - [77, 205.96]
  - - [1024, 2048, 1, 8192, 1024, 1024, 1024, 8192]
    - [75, 199.86]
  - - [1024, 4096, 1, 128, 1024, 1024, 1024, 128]
    - [24, 57.93]
  - - [1024, 4096, 1, 256, 1024, 1024, 1024, 256]
    - [24, 98.77]
  - - [1024, 4096, 1, 512, 1024, 1024, 1024, 512]
    - [12, 147.64]
  - - [1024, 4096, 1, 1024, 1024, 1024, 1024, 1024]
    - [15, 203.01]
  - - [1024, 4096, 1, 2048, 1024, 1024, 1024, 2048]
    - [25, 242.73]
  - - [1024, 4096, 1, 4096, 1024, 1024, 1024, 4096]
    - [64, 259.22]
  - - [1024, 4096, 1, 8192, 1024, 1024, 1024, 8192]
    - [58, 243.06]
  - - [1024, 8192, 1, 128, 1024, 1024, 1024, 128]
    - [62, 73.38]
  - - [1024, 8192, 1, 256, 1024, 1024, 1024, 256]
    - [62, 127.23]
  - - [1024, 8192, 1, 512, 1024, 1024, 1024, 512]
    - [63, 205.25]
  - - [1024, 8192, 1, 1024, 1024, 1024, 1024, 1024]
    - [10, 236.14]
  - - [1024, 8192, 1, 2048, 1024, 1024, 1024, 2048]
    - [60, 311.39]
  - - [1024, 8192, 1, 4096, 1024, 1024, 1024, 4096]
    - [63, 344.32]
  - - [1024, 8192, 1, 8192, 1024, 1024, 1024, 8192]
    - [62, 357.32]
  - - [2048, 128, 1, 128, 2048, 2048, 2048, 128]
    - [101, 8.09]
  - - [2048, 128, 1, 256, 2048, 2048, 2048, 256]
    - [103, 14.47]
  - - [2048, 128, 1, 512, 2048, 2048, 2048, 512]
    - [102, 24.32]
  - - [2048, 128, 1, 1024, 2048, 2048, 2048, 1024]
    - [100, 34.58]
  - - [2048, 128, 1, 2048, 2048, 2048, 2048, 2048]
    - [99, 43.01]
  - - [2048, 128, 1, 4096, 2048, 2048, 2048, 4096]
    - [113, 52.17]
  - - [2048, 128, 1, 8192, 2048, 2048, 2048, 8192]
    - [111, 58.76]
  - - [2048, 256, 1, 128, 2048, 2048, 2048, 128]
    - [43, 11.56]
  - - [2048, 256, 1, 256, 2048, 2048, 2048, 256]
    - [73, 20.71]
  - - [2048, 256, 1, 512, 2048, 2048, 2048, 512]
    - [35, 36.31]
  - - [2048, 256, 1, 1024, 2048, 2048, 2048, 1024]
    - [93, 59.83]
  - - [2048, 256, 1, 2048, 2048, 2048, 2048, 2048]
    - [94, 76.83]
  - - [2048, 256, 1, 4096, 2048, 2048, 2048, 4096]
    - [94, 92.75]
  - - [2048, 256, 1, 8192, 2048, 2048, 2048, 8192]
    - [92, 103.57]
  - - [2048, 512, 1, 128, 2048, 2048, 2048, 128]
    - [38, 19.62]
  - - [2048, 512, 1, 256, 2048, 2048, 2048, 256]
    - [74, 38.68]
  - - [2048, 512, 1, 512, 2048, 2048, 2048, 512]
    - [34, 69.27]
  - - [2048, 512, 1, 1024, 2048, 2048, 2048, 1024]
    - [34, 102.0]
  - - [2048, 512, 1, 2048, 2048, 2048, 2048, 2048]
    - [84, 118.85]
  - - [2048, 512, 1, 4096, 2048, 2048, 2048, 4096]
    - [84, 139.43]
  - - [2048, 512, 1, 8192, 2048, 2048, 2048, 8192]
    - [83, 145.68]
  - - [2048, 1024, 1, 128, 2048, 2048, 2048, 128]
    - [32, 37.61]
  - - [2048, 1024, 1, 256, 2048, 2048, 2048, 256]
    - [75, 65.59]
  - - [2048, 1024, 1, 512, 2048, 2048, 2048, 512]
    - [76, 104.75]
  - - [2048, 1024, 1, 1024, 2048, 2048, 2048, 1024]
    - [75, 154.43]
  - - [2048, 1024, 1, 2048, 2048, 2048, 2048, 2048]
    - [78, 178.85]
  - - [2048, 1024, 1, 4096, 2048, 2048, 2048, 4096]
    - [77, 203.47]
  - - [2048, 1024, 1, 8192, 2048, 2048, 2048, 8192]
    - [76, 197.62]
  - - [2048, 2048, 1, 128, 2048, 2048, 2048, 128]
    - [18, 55.17]
  - - [2048, 2048, 1, 256, 2048, 2048, 2048, 256]
    - [16, 95.23]
  - - [2048, 2048, 1, 512, 2048, 2048, 2048, 512]
    - [18, 147.14]
  - - [2048, 2048, 1, 1024, 2048, 2048, 2048, 1024]
    - [21, 198.24]
  - - [2048, 2048, 1, 2048, 2048, 2048, 2048, 2048]
    - [65, 243.41]
  - - [2048, 2048, 1, 4096, 2048, 2048, 2048, 4096]
    - [66, 255.3]
  - - [2048, 2048, 1, 8192, 2048, 2048, 2048, 8192]
    - [60, 237.45]
  - - [2048, 4096, 1, 128, 2048, 2048, 2048, 128]
    - [6, 64.39]
  - - [2048, 4096, 1, 256, 2048, 2048, 2048, 256]
    - [3, 112.67]
  - - [2048, 4096, 1, 512, 2048, 2048, 2048, 512]
    - [1, 171.0]
  - - [2048, 4096, 1, 1024, 2048, 2048, 2048, 1024]
    - [5, 233.92]
  - - [2048, 4096, 1, 2048, 2048, 2048, 2048, 2048]
    - [4, 262.96]
  - - [2048, 4096, 1, 4096, 2048, 2048, 2048, 4096]
    - [60, 284.65]
  - - [2048, 4096, 1, 8192, 2048, 2048, 2048, 8192]
    - [59, 309.24]
  - - [2048, 8192, 1, 128, 2048, 2048, 2048, 128]
    - [62, 74.81]
  - - [2048, 8192, 1, 256, 2048, 2048, 2048, 256]
    - [62, 130.0]
  - - [2048, 8192, 1, 512, 2048, 2048, 2048, 512]
    - [59, 193.42]
  - - [2048, 8192, 1, 1024, 2048, 2048, 2048, 1024]
    - [63, 265.94]
  - - [2048, 8192, 1, 2048, 2048, 2048, 2048, 2048]
    - [58, 308.93]
  - - [2048, 8192, 1, 4096, 2048, 2048, 2048, 4096]
    - [60, 338.08]
  - - [2048, 8192, 1, 8192, 2048, 2048, 2048, 8192]
    - [60, 376.4]
  - - [4096, 128, 1, 128, 4096, 4096, 4096, 128]
    - [41, 14.29]
  - - [4096, 128, 1, 256, 4096, 4096, 4096, 256]
    - [41, 25.31]
  - - [4096, 128, 1, 512, 4096, 4096, 4096, 512]
    - [89, 42.2]
  - - [4096, 128, 1, 1024, 4096, 4096, 4096, 1024]
    - [90, 62.61]
  - - [4096, 128, 1, 2048, 4096, 4096, 4096, 2048]
    - [96, 76.62]
  - - [4096, 128, 1, 4096, 4096, 4096, 4096, 4096]
    - [94, 92.9]
  - - [4096, 128, 1, 8192, 4096, 4096, 4096, 8192]
    - [96, 103.19]
  - - [4096, 256, 1, 128, 4096, 4096, 4096, 128]
    - [40, 24.95]
  - - [4096, 256, 1, 256, 4096, 4096, 4096, 256]
    - [36, 43.48]
  - - [4096, 256, 1, 512, 4096, 4096, 4096, 512]
    - [35, 70.45]
  - - [4096, 256, 1, 1024, 4096, 4096, 4096, 1024]
    - [35, 101.82]
  - - [4096, 256, 1, 2048, 4096, 4096, 4096, 2048]
    - [84, 118.55]
  - - [4096, 256, 1, 4096, 4096, 4096, 4096, 4096]
    - [82, 139.11]
  - - [4096, 256, 1, 8192, 4096, 4096, 4096, 8192]
    - [82, 146.33]
  - - [4096, 512, 1, 128, 4096, 4096, 4096, 128]
    - [27, 38.98]
  - - [4096, 512, 1, 256, 4096, 4096, 4096, 256]
    - [67, 66.24]
  - - [4096, 512, 1, 512, 4096, 4096, 4096, 512]
    - [78, 105.1]
  - - [4096, 512, 1, 1024, 4096, 4096, 4096, 1024]
    - [77, 147.58]
  - - [4096, 512, 1, 2048, 4096, 4096, 4096, 2048]
    - [76, 177.27]
  - - [4096, 512, 1, 4096, 4096, 4096, 4096, 4096]
    - [77, 205.85]
  - - [4096, 512, 1, 8192, 4096, 4096, 4096, 8192]
    - [77, 198.41]
  - - [4096, 1024, 1, 128, 4096, 4096, 4096, 128]
    - [17, 56.32]
  - - [4096, 1024, 1, 256, 4096, 4096, 4096, 256]
    - [17, 95.75]
  - - [4096, 1024, 1, 512, 4096, 4096, 4096, 512]
    - [22, 141.21]
  - - [4096, 1024, 1, 1024, 4096, 4096, 4096, 1024]
    - [25, 196.1]
  - - [4096, 1024, 1, 2048, 4096, 4096, 4096, 2048]
    - [23, 241.19]
  - - [4096, 1024, 1, 4096, 4096, 4096, 4096, 4096]
    - [56, 255.96]
  - - [4096, 1024, 1, 8192, 4096, 4096, 4096, 8192]
    - [55, 239.28]
  - - [4096, 2048, 1, 128, 4096, 4096, 4096, 128]
    - [5, 62.77]
  - - [4096, 2048, 1, 256, 4096, 4096, 4096, 256]
    - [3, 107.66]
  - - [4096, 2048, 1, 512, 4096, 4096, 4096, 512]
    - [8, 168.63]
  - - [4096, 2048, 1, 1024, 4096, 4096, 4096, 1024]
    - [4, 232.27]
  - - [4096, 2048, 1, 2048, 4096, 4096, 4096, 2048]
    - [4, 266.65]
  - - [4096, 2048, 1, 4096, 4096, 4096, 4096, 4096]
    - [58, 261.78]
  - - [4096, 2048, 1, 8192, 4096, 4096, 4096, 8192]
    - [53, 285.47]
  - - [4096, 4096, 1, 128, 4096, 4096, 4096, 128]
    - [3, 69.06]
  - - [4096, 4096, 1, 256, 4096, 4096, 4096, 256]
    - [0, 117.11]
  - - [4096, 4096, 1, 512, 4096, 4096, 4096, 512]
    - [8, 178.76]
  - - [4096, 4096, 1, 1024, 4096, 4096, 4096, 1024]
    - [4, 222.81]
  - - [4096, 4096, 1, 2048, 4096, 4096, 4096, 2048]
    - [59, 251.45]
  - - [4096, 4096, 1, 4096, 4096, 4096, 4096, 4096]
    - [62, 290.74]
  - - [4096, 4096, 1, 8192, 4096, 4096, 4096, 8192]
    - [3, 320.88]
  - - [4096, 8192, 1, 128, 4096, 4096, 4096, 128]
    - [57, 81.69]
  - - [4096, 8192, 1, 256, 4096, 4096, 4096, 256]
    - [59, 136.52]
  - - [4096, 8192, 1, 512, 4096, 4096, 4096, 512]
    - [62, 203.71]
  - - [4096, 8192, 1, 1024, 4096, 4096, 4096, 1024]
    - [63, 255.76]
  - - [4096, 8192, 1, 2048, 4096, 4096, 4096, 2048]
    - [62, 304.24]
  - - [4096, 8192, 1, 4096, 4096, 4096, 4096, 4096]
    - [62, 349.36]
  - - [4096, 8192, 1, 8192, 4096, 4096, 4096, 8192]
    - [63, 395.65]
  - - [8192, 128, 1, 128, 8192, 8192, 8192, 128]
    - [29, 24.86]
  - - [8192, 128, 1, 256, 8192, 8192, 8192, 256]
    - [39, 42.27]
  - - [8192, 128, 1, 512, 8192, 8192, 8192, 512]
    - [35, 68.64]
  - - [8192, 128, 1, 1024, 8192, 8192, 8192, 1024]
    - [35, 98.8]
  - - [8192, 128, 1, 2048, 8192, 8192, 8192, 2048]
    - [81, 116.31]
  - - [8192, 128, 1, 4096, 8192, 8192, 8192, 4096]
    - [82, 138.01]
  - - [8192, 128, 1, 8192, 8192, 8192, 8192, 8192]
    - [84, 140.33]
  - - [8192, 256, 1, 128, 8192, 8192, 8192, 128]
    - [26, 37.57]
  - - [8192, 256, 1, 256, 8192, 8192, 8192, 256]
    - [78, 64.24]
  - - [8192, 256, 1, 512, 8192, 8192, 8192, 512]
    - [78, 105.86]
  - - [8192, 256, 1, 1024, 8192, 8192, 8192, 1024]
    - [77, 148.72]
  - - [8192, 256, 1, 2048, 8192, 8192, 8192, 2048]
    - [76, 177.93]
  - - [8192, 256, 1, 4096, 8192, 8192, 8192, 4096]
    - [78, 206.7]
  - - [8192, 256, 1, 8192, 8192, 8192, 8192, 8192]
    - [76, 194.0]
  - - [8192, 512, 1, 128, 8192, 8192, 8192, 128]
    - [13, 53.24]
  - - [8192, 512, 1, 256, 8192, 8192, 8192, 256]
    - [14, 91.56]
  - - [8192, 512, 1, 512, 8192, 8192, 8192, 512]
    - [25, 140.2]
  - - [8192, 512, 1, 1024, 8192, 8192, 8192, 1024]
    - [22, 193.88]
  - - [8192, 512, 1, 2048, 8192, 8192, 8192, 2048]
    - [20, 241.51]
  - - [8192, 512, 1, 4096, 8192, 8192, 8192, 4096]
    - [54, 258.93]
  - - [8192, 512, 1, 8192, 8192, 8192, 8192, 8192]
    - [54, 240.48]
  - - [8192, 1024, 1, 128, 8192, 8192, 8192, 128]
    - [11, 61.9]
  - - [8192, 1024, 1, 256, 8192, 8192, 8192, 256]
    - [11, 104.71]
  - - [8192, 1024, 1, 512, 8192, 8192, 8192, 512]
    - [11, 165.28]
  - - [8192, 1024, 1, 1024, 8192, 8192, 8192, 1024]
    - [11, 228.28]
  - - [8192, 1024, 1, 2048, 8192, 8192, 8192, 2048]
    - [9, 267.02]
  - - [8192, 1024, 1, 4096, 8192, 8192, 8192, 4096]
    - [52, 269.22]
  - - [8192, 1024, 1, 8192, 8192, 8192, 8192, 8192]
    - [53, 296.41]
  - - [8192, 2048, 1, 128, 8192, 8192, 8192, 128]
    - [3, 66.16]
  - - [8192, 2048, 1, 256, 8192, 8192, 8192, 256]
    - [3, 116.32]
  - - [8192, 2048, 1, 512, 8192, 8192, 8192, 512]
    - [60, 176.44]
  - - [8192, 2048, 1, 1024, 8192, 8192, 8192, 1024]
    - [7, 223.03]
  - - [8192, 2048, 1, 2048, 8192, 8192, 8192, 2048]
    - [63, 242.17]
  - - [8192, 2048, 1, 4096, 8192, 8192, 8192, 4096]
    - [8, 279.26]
  - - [8192, 2048, 1, 8192, 8192, 8192, 8192, 8192]
    - [2, 340.34]
  - - [8192, 4096, 1, 128, 8192, 8192, 8192, 128]
    - [3, 71.79]
  - - [8192, 4096, 1, 256, 8192, 8192, 8192, 256]
    - [3, 120.46]
  - - [8192, 4096, 1, 512, 8192, 8192, 8192, 512]
    - [19, 179.0]
  - - [8192, 4096, 1, 1024, 8192, 8192, 8192, 1024]
    - [56, 222.65]
  - - [8192, 4096, 1, 2048, 8192, 8192, 8192, 2048]
    - [62, 269.8]
  - - [8192, 4096, 1, 4096, 8192, 8192, 8192, 4096]
    - [62, 317.84]
  - - [8192, 4096, 1, 8192, 8192, 8192, 8192, 8192]
    - [3, 348.45]
  - - [8192, 8192, 1, 128, 8192, 8192, 8192, 128]
    - [57, 76.96]
  - - [8192, 8192, 1, 256, 8192, 8192, 8192, 256]
    - [57, 123.51]
  - - [8192, 8192, 1, 512, 8192, 8192, 8192, 512]
    - [61, 176.85]
  - - [8192, 8192, 1, 1024, 8192, 8192, 8192, 1024]
    - [62, 249.96]
  - - [8192, 8192, 1, 2048, 8192, 8192, 8192, 2048]
    - [62, 316.38]
  - - [8192, 8192, 1, 4096, 8192, 8192, 8192, 4096]
    - [62, 366.01]
  - - [8192, 8192, 1, 8192, 8192, 8192, 8192, 8192]
    - [62, 399.82]
- null
- null
- ExperimentalStreamK
- GridBased
