projects/hipblaslt/library/src/amd_detail/rocblaslt/src/Tensile/Logic/asm_full/aquavanjaram/gfx942_228cu/StreamK/aquavanjaram942_Cijk_Ailk_Bjlk_HSS_BH_Bias_HAS_SAV_UserArgs.yaml
- {MinimumRequiredVersion: 4.33.0}
- aquavanjaram942
- {Architecture: gfx942, CUCount: 228}
- [Device 0049, Device 0050]
    SolutionIndex: 0
    SolutionNameMin: Cijk_Ailk_Bjlk_HSS_BH_Bias_HAS_SAV_UserArgs_MT256x256x32_MI16x16x1_SN_LDSB0_CLR1_GRVWA8_GRVWB2_GSU0_GSUC0_GSUWGMRR0_K1_LBSPPA2048_LBSPPB2048_LPA0_LPB0_MIWT8_8_PLR1_SU0_SUM0_SUS64_VWA8_VWB8_WGM1_WGMXCC1_WGMXCCGn1
    SolutionIndex: 1
    SolutionNameMin: Cijk_Ailk_Bjlk_HSS_BH_Bias_HAS_SAV_UserArgs_MT256x256x32_MI16x16x1_SN_LDSB0_CLR1_GRVWA2_GRVWB8_GSU0_GSUC0_GSUWGMRR0_K1_LBSPPA2048_LBSPPB2048_LPA0_LPB0_MIWT8_8_PLR1_SU0_SUM0_SUS64_VWA8_VWB8_WGM1_WGMXCC1_WGMXCCGn1
    SolutionIndex: 2
    SolutionNameMin: Cijk_Ailk_Bjlk_HSS_BH_Bias_HAS_SAV_UserArgs_MT256x256x32_MI16x16x1_SN_LDSB0_CLR1_GRVWA8_GRVWB8_GSU0_GSUC0_GSUWGMRR0_K1_LBSPPA2048_LBSPPB2048_LPA0_LPB0_MIWT8_8_PLR1_SU0_SUM0_SUS64_VWA8_VWB8_WGM1_WGMXCC1_WGMXCCGn1
    SolutionIndex: 3
    SolutionNameMin: Cijk_Ailk_Bjlk_HSS_BH_Bias_HAS_SAV_UserArgs_MT256x256x32_MI16x16x1_SN_LDSB0_CLR1_GRVWA2_GRVWB2_GSU0_GSUC0_GSUWGMRR0_K1_LBSPPA2048_LBSPPB2048_LPA0_LPB0_MIWT8_8_PLR1_SU0_SUM0_SUS64_VWA8_VWB8_WGM4_WGMXCC1_WGMXCCGn1
    SolutionIndex: 4
    SolutionNameMin: Cijk_Ailk_Bjlk_HSS_BH_Bias_HAS_SAV_UserArgs_MT256x256x32_MI16x16x1_SN_LDSB0_CLR1_GRVWA4_GRVWB2_GSU0_GSUC0_GSUWGMRR0_K1_LBSPPA2048_LBSPPB2048_LPA0_LPB0_MIWT8_8_PLR1_SU0_SUM0_SUS64_VWA8_VWB8_WGM4_WGMXCC1_WGMXCCGn1
    SolutionIndex: 5
    SolutionNameMin: Cijk_Ailk_Bjlk_HSS_BH_Bias_HAS_SAV_UserArgs_MT256x256x32_MI16x16x1_SN_LDSB0_CLR1_GRVWA8_GRVWB4_GSU0_GSUC0_GSUWGMRR0_K1_LBSPPA2048_LBSPPB2048_LPA0_LPB0_MIWT8_8_PLR1_SU0_SUM0_SUS64_VWA8_VWB8_WGM4_WGMXCC1_WGMXCCGn1
    SolutionIndex: 6
    SolutionNameMin: Cijk_Ailk_Bjlk_HSS_BH_Bias_HAS_SAV_UserArgs_MT256x256x32_MI16x16x1_SN_LDSB0_CLR1_GRVWA2_GRVWB8_GSU0_GSUC0_GSUWGMRR0_K1_LBSPPA2048_LBSPPB2048_LPA0_LPB0_MIWT8_8_PLR1_SU0_SUM0_SUS64_VWA8_VWB8_WGM4_WGMXCC1_WGMXCCGn1
    SolutionIndex: 7
    SolutionNameMin: Cijk_Ailk_Bjlk_HSS_BH_Bias_HAS_SAV_UserArgs_MT256x256x32_MI16x16x1_SN_LDSB0_CLR1_GRVWA8_GRVWB8_GSU0_GSUC0_GSUWGMRR0_K1_LBSPPA2048_LBSPPB2048_LPA0_LPB0_MIWT8_8_PLR1_SU0_SUM0_SUS64_VWA8_VWB8_WGM4_WGMXCC1_WGMXCCGn1
    SolutionIndex: 8
    SolutionNameMin: Cijk_Ailk_Bjlk_HSS_BH_Bias_HAS_SAV_UserArgs_MT256x256x32_MI16x16x1_SN_LDSB0_CLR1_GRVWA4_GRVWB2_GSU0_GSUC0_GSUWGMRR0_K1_LBSPPA2048_LBSPPB2048_LPA0_LPB0_MIWT8_8_PLR1_SU0_SUM0_SUS64_VWA8_VWB8_WGM6_WGMXCC1_WGMXCCGn1
    SolutionIndex: 9
    SolutionNameMin: Cijk_Ailk_Bjlk_HSS_BH_Bias_HAS_SAV_UserArgs_MT256x256x32_MI16x16x1_SN_LDSB0_CLR1_GRVWA2_GRVWB2_GSU0_GSUC0_GSUWGMRR0_K1_LBSPPA2048_LBSPPB2048_LPA0_LPB0_MIWT8_8_PLR1_SU0_SUM0_SUS64_VWA8_VWB8_WGM8_WGMXCC1_WGMXCCGn1
    SolutionIndex: 10
    SolutionNameMin: Cijk_Ailk_Bjlk_HSS_BH_Bias_HAS_SAV_UserArgs_MT256x256x32_MI16x16x1_SN_LDSB0_CLR1_GRVWA2_GRVWB8_GSU0_GSUC0_GSUWGMRR0_K1_LBSPPA2048_LBSPPB2048_LPA0_LPB0_MIWT8_8_PLR1_SU0_SUM0_SUS64_VWA8_VWB8_WGM8_WGMXCC1_WGMXCCGn1
    SolutionIndex: 11
    SolutionNameMin: Cijk_Ailk_Bjlk_HSS_BH_Bias_HAS_SAV_UserArgs_MT128x256x32_MI16x16x1_SN_LDSB1_CLR1_GRVWA2_GRVWB2_GSU0_GSUC0_GSUWGMRR0_K1_LBSPPA1024_LBSPPB2048_LPA0_LPB0_MIWT4_8_PLR1_SU0_SUM0_SUS64_VWA4_VWB8_WGM1_WGMXCC1_WGMXCCGn1
    SolutionIndex: 12
    SolutionNameMin: Cijk_Ailk_Bjlk_HSS_BH_Bias_HAS_SAV_UserArgs_MT128x256x32_MI16x16x1_SN_LDSB1_CLR1_GRVWA2_GRVWB4_GSU0_GSUC0_GSUWGMRR0_K1_LBSPPA1024_LBSPPB2048_LPA0_LPB0_MIWT4_8_PLR1_SU0_SUM0_SUS64_VWA4_VWB8_WGM1_WGMXCC1_WGMXCCGn1
    SolutionIndex: 13
    SolutionNameMin: Cijk_Ailk_Bjlk_HSS_BH_Bias_HAS_SAV_UserArgs_MT128x256x32_MI16x16x1_SN_LDSB1_CLR1_GRVWA8_GRVWB4_GSU0_GSUC0_GSUWGMRR0_K1_LBSPPA1024_LBSPPB2048_LPA0_LPB0_MIWT4_8_PLR1_SU0_SUM0_SUS64_VWA4_VWB8_WGM1_WGMXCC1_WGMXCCGn1
    SolutionIndex: 14
    SolutionNameMin: Cijk_Ailk_Bjlk_HSS_BH_Bias_HAS_SAV_UserArgs_MT128x256x32_MI16x16x1_SN_LDSB1_CLR1_GRVWA2_GRVWB8_GSU0_GSUC0_GSUWGMRR0_K1_LBSPPA1024_LBSPPB2048_LPA0_LPB0_MIWT4_8_PLR1_SU0_SUM0_SUS64_VWA4_VWB8_WGM1_WGMXCC1_WGMXCCGn1
    SolutionIndex: 15
    SolutionNameMin: Cijk_Ailk_Bjlk_HSS_BH_Bias_HAS_SAV_UserArgs_MT128x256x32_MI16x16x1_SN_LDSB1_CLR1_GRVWA4_GRVWB8_GSU0_GSUC0_GSUWGMRR0_K1_LBSPPA1024_LBSPPB2048_LPA0_LPB0_MIWT4_8_PLR1_SU0_SUM0_SUS64_VWA4_VWB8_WGM1_WGMXCC1_WGMXCCGn1
    SolutionIndex: 16
    SolutionNameMin: Cijk_Ailk_Bjlk_HSS_BH_Bias_HAS_SAV_UserArgs_MT128x256x32_MI16x16x1_SN_LDSB1_CLR1_GRVWA8_GRVWB8_GSU0_GSUC0_GSUWGMRR0_K1_LBSPPA1024_LBSPPB2048_LPA0_LPB0_MIWT4_8_PLR1_SU0_SUM0_SUS64_VWA4_VWB8_WGM1_WGMXCC1_WGMXCCGn1
    SolutionIndex: 17
    SolutionNameMin: Cijk_Ailk_Bjlk_HSS_BH_Bias_HAS_SAV_UserArgs_MT128x256x32_MI16x16x1_SN_LDSB1_CLR1_GRVWA2_GRVWB8_GSU0_GSUC0_GSUWGMRR0_K1_LBSPPA1024_LBSPPB2048_LPA0_LPB0_MIWT4_8_PLR1_SU0_SUM0_SUS64_VWA4_VWB8_WGM4_WGMXCC1_WGMXCCGn1
    SolutionIndex: 18
    SolutionNameMin: Cijk_Ailk_Bjlk_HSS_BH_Bias_HAS_SAV_UserArgs_MT128x256x32_MI16x16x1_SN_LDSB1_CLR1_GRVWA8_GRVWB8_GSU0_GSUC0_GSUWGMRR0_K1_LBSPPA1024_LBSPPB2048_LPA0_LPB0_MIWT4_8_PLR1_SU0_SUM0_SUS64_VWA4_VWB8_WGM4_WGMXCC1_WGMXCCGn1
    SolutionIndex: 19
    SolutionNameMin: Cijk_Ailk_Bjlk_HSS_BH_Bias_HAS_SAV_UserArgs_MT128x256x32_MI16x16x1_SN_LDSB1_CLR1_GRVWA2_GRVWB8_GSU0_GSUC0_GSUWGMRR0_K1_LBSPPA1024_LBSPPB2048_LPA0_LPB0_MIWT4_8_PLR1_SU0_SUM0_SUS64_VWA4_VWB8_WGM6_WGMXCC1_WGMXCCGn1
    SolutionIndex: 20
    SolutionNameMin: Cijk_Ailk_Bjlk_HSS_BH_Bias_HAS_SAV_UserArgs_MT128x256x32_MI16x16x1_SN_LDSB1_CLR1_GRVWA8_GRVWB8_GSU0_GSUC0_GSUWGMRR0_K1_LBSPPA1024_LBSPPB2048_LPA0_LPB0_MIWT4_8_PLR1_SU0_SUM0_SUS64_VWA4_VWB8_WGM6_WGMXCC1_WGMXCCGn1
    SolutionIndex: 21
    SolutionNameMin: Cijk_Ailk_Bjlk_HSS_BH_Bias_HAS_SAV_UserArgs_MT128x256x32_MI16x16x1_SN_LDSB1_CLR1_GRVWA2_GRVWB8_GSU0_GSUC0_GSUWGMRR0_K1_LBSPPA1024_LBSPPB2048_LPA0_LPB0_MIWT4_8_PLR1_SU0_SUM0_SUS64_VWA4_VWB8_WGM8_WGMXCC1_WGMXCCGn1
    SolutionIndex: 22
    SolutionNameMin: Cijk_Ailk_Bjlk_HSS_BH_Bias_HAS_SAV_UserArgs_MT128x256x32_MI16x16x1_SN_LDSB1_CLR1_GRVWA8_GRVWB8_GSU0_GSUC0_GSUWGMRR0_K1_LBSPPA1024_LBSPPB2048_LPA0_LPB0_MIWT4_8_PLR1_SU0_SUM0_SUS64_VWA4_VWB8_WGM8_WGMXCC1_WGMXCCGn1
    SolutionIndex: 23
    SolutionNameMin: Cijk_Ailk_Bjlk_HSS_BH_Bias_HAS_SAV_UserArgs_MT128x128x32_MI16x16x1_SN_LDSB0_CLR1_GRVWA8_GRVWB2_GSU0_GSUC0_GSUWGMRR0_K1_LBSPPA1024_LBSPPB1024_LPA0_LPB0_MIWT4_4_PLR1_SU0_SUM0_SUS64_VWA4_VWB4_WGM1_WGMXCC1_WGMXCCGn1
    SolutionIndex: 24
    SolutionNameMin: Cijk_Ailk_Bjlk_HSS_BH_Bias_HAS_SAV_UserArgs_MT128x128x32_MI16x16x1_SN_LDSB0_CLR1_GRVWA2_GRVWB8_GSU0_GSUC0_GSUWGMRR0_K1_LBSPPA1024_LBSPPB1024_LPA0_LPB0_MIWT4_4_PLR1_SU0_SUM0_SUS64_VWA4_VWB4_WGM1_WGMXCC1_WGMXCCGn1
    SolutionIndex: 25
    SolutionNameMin: Cijk_Ailk_Bjlk_HSS_BH_Bias_HAS_SAV_UserArgs_MT128x128x32_MI16x16x1_SN_LDSB0_CLR1_GRVWA4_GRVWB8_GSU0_GSUC0_GSUWGMRR0_K1_LBSPPA1024_LBSPPB1024_LPA0_LPB0_MIWT4_4_PLR1_SU0_SUM0_SUS64_VWA4_VWB4_WGM1_WGMXCC1_WGMXCCGn1
    SolutionIndex: 26
    SolutionNameMin: Cijk_Ailk_Bjlk_HSS_BH_Bias_HAS_SAV_UserArgs_MT128x128x32_MI16x16x1_SN_LDSB0_CLR1_GRVWA8_GRVWB8_GSU0_GSUC0_GSUWGMRR0_K1_LBSPPA1024_LBSPPB1024_LPA0_LPB0_MIWT4_4_PLR1_SU0_SUM0_SUS64_VWA4_VWB4_WGM1_WGMXCC1_WGMXCCGn1
    SolutionIndex: 27
    SolutionNameMin: Cijk_Ailk_Bjlk_HSS_BH_Bias_HAS_SAV_UserArgs_MT128x128x32_MI16x16x1_SN_LDSB0_CLR1_GRVWA2_GRVWB8_GSU0_GSUC0_GSUWGMRR0_K1_LBSPPA1024_LBSPPB1024_LPA0_LPB0_MIWT4_4_PLR1_SU0_SUM0_SUS64_VWA4_VWB4_WGM4_WGMXCC1_WGMXCCGn1
    SolutionIndex: 28
    SolutionNameMin: Cijk_Ailk_Bjlk_HSS_BH_Bias_HAS_SAV_UserArgs_MT128x128x32_MI16x16x1_SN_LDSB0_CLR1_GRVWA8_GRVWB8_GSU0_GSUC0_GSUWGMRR0_K1_LBSPPA1024_LBSPPB1024_LPA0_LPB0_MIWT4_4_PLR1_SU0_SUM0_SUS64_VWA4_VWB4_WGM4_WGMXCC1_WGMXCCGn1
    SolutionIndex: 29
    SolutionNameMin: Cijk_Ailk_Bjlk_HSS_BH_Bias_HAS_SAV_UserArgs_MT128x128x32_MI16x16x1_SN_LDSB0_CLR1_GRVWA2_GRVWB2_GSU0_GSUC0_GSUWGMRR0_K1_LBSPPA1024_LBSPPB1024_LPA0_LPB0_MIWT4_4_PLR1_SU0_SUM0_SUS64_VWA4_VWB4_WGM6_WGMXCC1_WGMXCCGn1
    SolutionIndex: 30
    SolutionNameMin: Cijk_Ailk_Bjlk_HSS_BH_Bias_HAS_SAV_UserArgs_MT128x128x32_MI16x16x1_SN_LDSB0_CLR1_GRVWA8_GRVWB8_GSU0_GSUC0_GSUWGMRR0_K1_LBSPPA1024_LBSPPB1024_LPA0_LPB0_MIWT4_4_PLR1_SU0_SUM0_SUS64_VWA4_VWB4_WGM6_WGMXCC1_WGMXCCGn1
    SolutionIndex: 31
    SolutionNameMin: Cijk_Ailk_Bjlk_HSS_BH_Bias_HAS_SAV_UserArgs_MT128x128x32_MI16x16x1_SN_LDSB0_CLR1_GRVWA2_GRVWB8_GSU0_GSUC0_GSUWGMRR0_K1_LBSPPA1024_LBSPPB1024_LPA0_LPB0_MIWT4_4_PLR1_SU0_SUM0_SUS64_VWA4_VWB4_WGM8_WGMXCC1_WGMXCCGn1
    SolutionIndex: 32
    SolutionNameMin: Cijk_Ailk_Bjlk_HSS_BH_Bias_HAS_SAV_UserArgs_MT64x128x32_MI16x16x1_SN_LDSB0_CLR1_GRVWA8_GRVWB8_GSU0_GSUC0_GSUWGMRR0_K1_LBSPPA512_LBSPPB1024_LPA32_LPB0_MIWT2_4_PLR1_SU0_SUM0_SUS64_VWA2_VWB4_WGM6_WGMXCC1_WGMXCCGn1
    SolutionIndex: 33
    SolutionNameMin: Cijk_Ailk_Bjlk_HSS_BH_Bias_HAS_SAV_UserArgs_MT64x128x32_MI16x16x1_SN_LDSB0_CLR1_GRVWA2_GRVWB8_GSU0_GSUC0_GSUWGMRR0_K1_LBSPPA512_LBSPPB1024_LPA32_LPB0_MIWT2_4_PLR1_SU0_SUM0_SUS64_VWA2_VWB4_WGM8_WGMXCC1_WGMXCCGn1
    SolutionIndex: 34
    SolutionNameMin: Cijk_Ailk_Bjlk_HSS_BH_Bias_HAS_SAV_UserArgs_MT128x64x32_MI16x16x1_SN_LDSB0_CLR1_GRVWA2_GRVWB2_GSU0_GSUC0_GSUWGMRR0_K1_LBSPPA1024_LBSPPB512_LPA0_LPB32_MIWT4_2_PLR1_SU0_SUM0_SUS64_VWA4_VWB2_WGM1_WGMXCC1_WGMXCCGn1
    SolutionIndex: 35
    SolutionNameMin: Cijk_Ailk_Bjlk_HSS_BH_Bias_HAS_SAV_UserArgs_MT128x64x32_MI16x16x1_SN_LDSB0_CLR1_GRVWA8_GRVWB2_GSU0_GSUC0_GSUWGMRR0_K1_LBSPPA1024_LBSPPB512_LPA0_LPB32_MIWT4_2_PLR1_SU0_SUM0_SUS64_VWA4_VWB2_WGM1_WGMXCC1_WGMXCCGn1
    SolutionIndex: 36
    SolutionNameMin: Cijk_Ailk_Bjlk_HSS_BH_Bias_HAS_SAV_UserArgs_MT128x64x32_MI16x16x1_SN_LDSB0_CLR1_GRVWA2_GRVWB8_GSU0_GSUC0_GSUWGMRR0_K1_LBSPPA1024_LBSPPB512_LPA0_LPB32_MIWT4_2_PLR1_SU0_SUM0_SUS64_VWA4_VWB2_WGM1_WGMXCC1_WGMXCCGn1
    SolutionIndex: 37
    SolutionNameMin: Cijk_Ailk_Bjlk_HSS_BH_Bias_HAS_SAV_UserArgs_MT128x64x32_MI16x16x1_SN_LDSB0_CLR1_GRVWA8_GRVWB8_GSU0_GSUC0_GSUWGMRR0_K1_LBSPPA1024_LBSPPB512_LPA0_LPB32_MIWT4_2_PLR1_SU0_SUM0_SUS64_VWA4_VWB2_WGM1_WGMXCC1_WGMXCCGn1
    SolutionIndex: 38
    SolutionNameMin: Cijk_Ailk_Bjlk_HSS_BH_Bias_HAS_SAV_UserArgs_MT128x64x32_MI16x16x1_SN_LDSB0_CLR1_GRVWA8_GRVWB8_GSU0_GSUC0_GSUWGMRR0_K1_LBSPPA1024_LBSPPB512_LPA0_LPB32_MIWT4_2_PLR1_SU0_SUM0_SUS64_VWA4_VWB2_WGM4_WGMXCC1_WGMXCCGn1
    SolutionIndex: 39
    SolutionNameMin: Cijk_Ailk_Bjlk_HSS_BH_Bias_HAS_SAV_UserArgs_MT128x64x32_MI16x16x1_SN_LDSB0_CLR1_GRVWA8_GRVWB2_GSU0_GSUC0_GSUWGMRR0_K1_LBSPPA1024_LBSPPB512_LPA0_LPB32_MIWT4_2_PLR1_SU0_SUM0_SUS64_VWA4_VWB2_WGM6_WGMXCC1_WGMXCCGn1
    SolutionIndex: 40
    SolutionNameMin: Cijk_Ailk_Bjlk_HSS_BH_Bias_HAS_SAV_UserArgs_MT64x64x32_MI16x16x1_SN_LDSB0_CLR1_GRVWA2_GRVWB2_GSU0_GSUC0_GSUWGMRR0_K1_LBSPPA512_LBSPPB512_LPA32_LPB32_MIWT2_2_PLR1_SU0_SUM0_SUS64_VWA2_VWB2_WGM1_WGMXCC1_WGMXCCGn1
    SolutionIndex: 41
    SolutionNameMin: Cijk_Ailk_Bjlk_HSS_BH_Bias_HAS_SAV_UserArgs_MT64x64x32_MI16x16x1_SN_LDSB0_CLR1_GRVWA8_GRVWB2_GSU0_GSUC0_GSUWGMRR0_K1_LBSPPA512_LBSPPB512_LPA32_LPB32_MIWT2_2_PLR1_SU0_SUM0_SUS64_VWA2_VWB2_WGM1_WGMXCC1_WGMXCCGn1
    SolutionIndex: 42
    SolutionNameMin: Cijk_Ailk_Bjlk_HSS_BH_Bias_HAS_SAV_UserArgs_MT64x64x32_MI16x16x1_SN_LDSB0_CLR1_GRVWA2_GRVWB8_GSU0_GSUC0_GSUWGMRR0_K1_LBSPPA512_LBSPPB512_LPA32_LPB32_MIWT2_2_PLR1_SU0_SUM0_SUS64_VWA2_VWB2_WGM8_WGMXCC1_WGMXCCGn1
    SolutionIndex: 43
    SolutionNameMin: Cijk_Ailk_Bjlk_HSS_BH_Bias_HAS_SAV_UserArgs_MT64x64x32_MI16x16x1_SN_LDSB0_CLR1_GRVWA8_GRVWB8_GSU0_GSUC0_GSUWGMRR0_K1_LBSPPA512_LBSPPB512_LPA32_LPB32_MIWT2_2_PLR1_SU0_SUM0_SUS64_VWA2_VWB2_WGM8_WGMXCC1_WGMXCCGn1
    SolutionIndex: 44
    SolutionNameMin: Cijk_Ailk_Bjlk_HSS_BH_Bias_HAS_SAV_UserArgs_MT32x64x32_MI16x16x1_SN_LDSB0_CLR1_GRVWA2_GRVWB2_GSU0_GSUC0_GSUWGMRR0_K1_LBSPPA256_LBSPPB512_LPA16_LPB32_MIWT1_2_PLR1_SU0_SUM0_SUS64_VWA1_VWB2_WGM8_WGMXCC1_WGMXCCGn1
    SolutionIndex: 45
    SolutionNameMin: Cijk_Ailk_Bjlk_HSS_BH_Bias_HAS_SAV_UserArgs_MT64x32x32_MI16x16x1_SN_LDSB0_CLR1_GRVWA2_GRVWB2_GSU0_GSUC0_GSUWGMRR0_K1_LBSPPA512_LBSPPB256_LPA32_LPB16_MIWT2_1_PLR1_SU0_SUM0_SUS64_VWA2_VWB1_WGM1_WGMXCC1_WGMXCCGn1
    SolutionIndex: 46
    SolutionNameMin: Cijk_Ailk_Bjlk_HSS_BH_Bias_HAS_SAV_UserArgs_MT32x32x32_MI16x16x1_SN_LDSB0_CLR1_GRVWA2_GRVWB2_GSU0_GSUC0_GSUWGMRR0_K1_LBSPPA256_LBSPPB256_LPA16_LPB16_MIWT1_1_PLR1_SU0_SUM0_SUS64_VWA1_VWB1_WGM1_WGMXCC1_WGMXCCGn1
    SolutionIndex: 47
    SolutionNameMin: Cijk_Ailk_Bjlk_HSS_BH_Bias_HAS_SAV_UserArgs_MT32x32x32_MI16x16x1_SN_LDSB0_CLR1_GRVWA4_GRVWB2_GSU0_GSUC0_GSUWGMRR0_K1_LBSPPA256_LBSPPB256_LPA16_LPB16_MIWT1_1_PLR1_SU0_SUM0_SUS64_VWA1_VWB1_WGM1_WGMXCC1_WGMXCCGn1
    SolutionIndex: 48
    SolutionNameMin: Cijk_Ailk_Bjlk_HSS_BH_Bias_HAS_SAV_UserArgs_MT32x32x32_MI16x16x1_SN_LDSB0_CLR1_GRVWA2_GRVWB2_GSU0_GSUC0_GSUWGMRR0_K1_LBSPPA256_LBSPPB256_LPA16_LPB16_MIWT1_1_PLR1_SU0_SUM0_SUS64_VWA1_VWB1_WGM8_WGMXCC1_WGMXCCGn1
    SolutionIndex: 49
    SolutionNameMin: Cijk_Ailk_Bjlk_HSS_BH_Bias_HAS_SAV_UserArgs_MT256x256x64_MI16x16x1_SN_LDSB1_CLR1_GRVWA8_GRVWB4_GSU0_GSUC0_GSUWGMRR0_K1_LBSPPA2048_LBSPPB2048_LPA0_LPB0_MIWT8_8_PLR1_SU0_SUM0_SUS128_VWA8_VWB8_WGM1_WGMXCC1_WGMXCCGn1
    SolutionIndex: 50
    SolutionNameMin: Cijk_Ailk_Bjlk_HSS_BH_Bias_HAS_SAV_UserArgs_MT256x256x64_MI16x16x1_SN_LDSB1_CLR1_GRVWA8_GRVWB8_GSU0_GSUC0_GSUWGMRR0_K1_LBSPPA2048_LBSPPB2048_LPA0_LPB0_MIWT8_8_PLR1_SU0_SUM0_SUS128_VWA8_VWB8_WGM1_WGMXCC1_WGMXCCGn1
    SolutionIndex: 51
    SolutionNameMin: Cijk_Ailk_Bjlk_HSS_BH_Bias_HAS_SAV_UserArgs_MT256x256x64_MI16x16x1_SN_LDSB1_CLR1_GRVWA8_GRVWB8_GSU0_GSUC0_GSUWGMRR0_K1_LBSPPA2048_LBSPPB2048_LPA0_LPB0_MIWT8_8_PLR1_SU0_SUM0_SUS128_VWA8_VWB8_WGM6_WGMXCC1_WGMXCCGn1
    SolutionIndex: 52
    SolutionNameMin: Cijk_Ailk_Bjlk_HSS_BH_Bias_HAS_SAV_UserArgs_MT128x256x64_MI16x16x1_SN_LDSB1_CLR1_GRVWA8_GRVWB4_GSU0_GSUC0_GSUWGMRR0_K1_LBSPPA1024_LBSPPB2048_LPA0_LPB0_MIWT4_8_PLR1_SU0_SUM0_SUS128_VWA4_VWB8_WGM1_WGMXCC1_WGMXCCGn1
    SolutionIndex: 53
    SolutionNameMin: Cijk_Ailk_Bjlk_HSS_BH_Bias_HAS_SAV_UserArgs_MT128x256x64_MI16x16x1_SN_LDSB1_CLR1_GRVWA2_GRVWB8_GSU0_GSUC0_GSUWGMRR0_K1_LBSPPA1024_LBSPPB2048_LPA0_LPB0_MIWT4_8_PLR1_SU0_SUM0_SUS128_VWA4_VWB8_WGM1_WGMXCC1_WGMXCCGn1
    SolutionIndex: 54
    SolutionNameMin: Cijk_Ailk_Bjlk_HSS_BH_Bias_HAS_SAV_UserArgs_MT128x256x64_MI16x16x1_SN_LDSB1_CLR1_GRVWA8_GRVWB8_GSU0_GSUC0_GSUWGMRR0_K1_LBSPPA1024_LBSPPB2048_LPA0_LPB0_MIWT4_8_PLR1_SU0_SUM0_SUS128_VWA4_VWB8_WGM1_WGMXCC1_WGMXCCGn1
    SolutionIndex: 55
    SolutionNameMin: Cijk_Ailk_Bjlk_HSS_BH_Bias_HAS_SAV_UserArgs_MT128x128x64_MI16x16x1_SN_LDSB1_CLR1_GRVWA2_GRVWB8_GSU0_GSUC0_GSUWGMRR0_K1_LBSPPA1024_LBSPPB1024_LPA0_LPB0_MIWT4_4_PLR1_SU0_SUM0_SUS128_VWA4_VWB4_WGM1_WGMXCC1_WGMXCCGn1
    SolutionIndex: 56
    SolutionNameMin: Cijk_Ailk_Bjlk_HSS_BH_Bias_HAS_SAV_UserArgs_MT128x128x64_MI16x16x1_SN_LDSB1_CLR1_GRVWA8_GRVWB8_GSU0_GSUC0_GSUWGMRR0_K1_LBSPPA1024_LBSPPB1024_LPA0_LPB0_MIWT4_4_PLR1_SU0_SUM0_SUS128_VWA4_VWB4_WGM1_WGMXCC1_WGMXCCGn1
    SolutionIndex: 57
    SolutionNameMin: Cijk_Ailk_Bjlk_HSS_BH_Bias_HAS_SAV_UserArgs_MT128x128x64_MI16x16x1_SN_LDSB1_CLR1_GRVWA8_GRVWB8_GSU0_GSUC0_GSUWGMRR0_K1_LBSPPA1024_LBSPPB1024_LPA0_LPB0_MIWT4_4_PLR1_SU0_SUM0_SUS128_VWA4_VWB4_WGM4_WGMXCC1_WGMXCCGn1
    SolutionIndex: 58
    SolutionNameMin: Cijk_Ailk_Bjlk_HSS_BH_Bias_HAS_SAV_UserArgs_MT128x128x64_MI16x16x1_SN_LDSB1_CLR1_GRVWA8_GRVWB8_GSU0_GSUC0_GSUWGMRR0_K1_LBSPPA1024_LBSPPB1024_LPA0_LPB0_MIWT4_4_PLR1_SU0_SUM0_SUS128_VWA4_VWB4_WGM6_WGMXCC1_WGMXCCGn1
    SolutionIndex: 59
    SolutionNameMin: Cijk_Ailk_Bjlk_HSS_BH_Bias_HAS_SAV_UserArgs_MT128x128x64_MI16x16x1_SN_LDSB1_CLR1_GRVWA8_GRVWB4_GSU0_GSUC0_GSUWGMRR0_K1_LBSPPA1024_LBSPPB1024_LPA0_LPB0_MIWT4_4_PLR1_SU0_SUM0_SUS128_VWA4_VWB4_WGM8_WGMXCC1_WGMXCCGn1
    SolutionIndex: 60
    SolutionNameMin: Cijk_Ailk_Bjlk_HSS_BH_Bias_HAS_SAV_UserArgs_MT128x128x64_MI16x16x1_SN_LDSB1_CLR1_GRVWA8_GRVWB8_GSU0_GSUC0_GSUWGMRR0_K1_LBSPPA1024_LBSPPB1024_LPA0_LPB0_MIWT4_4_PLR1_SU0_SUM0_SUS128_VWA4_VWB4_WGM8_WGMXCC1_WGMXCCGn1
    SolutionIndex: 61
    SolutionNameMin: Cijk_Ailk_Bjlk_HSS_BH_Bias_HAS_SAV_UserArgs_MT64x128x64_MI16x16x1_SN_LDSB1_CLR1_GRVWA8_GRVWB8_GSU0_GSUC0_GSUWGMRR0_K1_LBSPPA512_LBSPPB1024_LPA32_LPB0_MIWT2_4_PLR1_SU0_SUM0_SUS128_VWA2_VWB4_WGM1_WGMXCC1_WGMXCCGn1
    SolutionIndex: 62
    SolutionNameMin: Cijk_Ailk_Bjlk_HSS_BH_Bias_HAS_SAV_UserArgs_MT128x64x64_MI16x16x1_SN_LDSB1_CLR1_GRVWA8_GRVWB2_GSU0_GSUC0_GSUWGMRR0_K1_LBSPPA1024_LBSPPB512_LPA0_LPB32_MIWT4_2_PLR1_SU0_SUM0_SUS128_VWA4_VWB2_WGM1_WGMXCC1_WGMXCCGn1
    SolutionIndex: 63
    SolutionNameMin: Cijk_Ailk_Bjlk_HSS_BH_Bias_HAS_SAV_UserArgs_MT128x64x64_MI16x16x1_SN_LDSB1_CLR1_GRVWA2_GRVWB8_GSU0_GSUC0_GSUWGMRR0_K1_LBSPPA1024_LBSPPB512_LPA0_LPB32_MIWT4_2_PLR1_SU0_SUM0_SUS128_VWA4_VWB2_WGM1_WGMXCC1_WGMXCCGn1
    SolutionIndex: 64
    SolutionNameMin: Cijk_Ailk_Bjlk_HSS_BH_Bias_HAS_SAV_UserArgs_MT128x64x64_MI16x16x1_SN_LDSB1_CLR1_GRVWA8_GRVWB8_GSU0_GSUC0_GSUWGMRR0_K1_LBSPPA1024_LBSPPB512_LPA0_LPB32_MIWT4_2_PLR1_SU0_SUM0_SUS128_VWA4_VWB2_WGM1_WGMXCC1_WGMXCCGn1
    SolutionIndex: 65
    SolutionNameMin: Cijk_Ailk_Bjlk_HSS_BH_Bias_HAS_SAV_UserArgs_MT128x64x64_MI16x16x1_SN_LDSB1_CLR1_GRVWA8_GRVWB4_GSU0_GSUC0_GSUWGMRR0_K1_LBSPPA1024_LBSPPB512_LPA0_LPB32_MIWT4_2_PLR1_SU0_SUM0_SUS128_VWA4_VWB2_WGM4_WGMXCC1_WGMXCCGn1
    SolutionIndex: 66
    SolutionNameMin: Cijk_Ailk_Bjlk_HSS_BH_Bias_HAS_SAV_UserArgs_MT128x64x64_MI16x16x1_SN_LDSB1_CLR1_GRVWA2_GRVWB8_GSU0_GSUC0_GSUWGMRR0_K1_LBSPPA1024_LBSPPB512_LPA0_LPB32_MIWT4_2_PLR1_SU0_SUM0_SUS128_VWA4_VWB2_WGM4_WGMXCC1_WGMXCCGn1
    SolutionIndex: 67
    SolutionNameMin: Cijk_Ailk_Bjlk_HSS_BH_Bias_HAS_SAV_UserArgs_MT128x64x64_MI16x16x1_SN_LDSB1_CLR1_GRVWA8_GRVWB8_GSU0_GSUC0_GSUWGMRR0_K1_LBSPPA1024_LBSPPB512_LPA0_LPB32_MIWT4_2_PLR1_SU0_SUM0_SUS128_VWA4_VWB2_WGM4_WGMXCC1_WGMXCCGn1
    SolutionIndex: 68
    SolutionNameMin: Cijk_Ailk_Bjlk_HSS_BH_Bias_HAS_SAV_UserArgs_MT128x64x64_MI16x16x1_SN_LDSB1_CLR1_GRVWA2_GRVWB2_GSU0_GSUC0_GSUWGMRR0_K1_LBSPPA1024_LBSPPB512_LPA0_LPB32_MIWT4_2_PLR1_SU0_SUM0_SUS128_VWA4_VWB2_WGM6_WGMXCC1_WGMXCCGn1
    SolutionIndex: 69
    SolutionNameMin: Cijk_Ailk_Bjlk_HSS_BH_Bias_HAS_SAV_UserArgs_MT128x64x64_MI16x16x1_SN_LDSB1_CLR1_GRVWA8_GRVWB2_GSU0_GSUC0_GSUWGMRR0_K1_LBSPPA1024_LBSPPB512_LPA0_LPB32_MIWT4_2_PLR1_SU0_SUM0_SUS128_VWA4_VWB2_WGM6_WGMXCC1_WGMXCCGn1
    SolutionIndex: 70
    SolutionNameMin: Cijk_Ailk_Bjlk_HSS_BH_Bias_HAS_SAV_UserArgs_MT128x64x64_MI16x16x1_SN_LDSB1_CLR1_GRVWA8_GRVWB4_GSU0_GSUC0_GSUWGMRR0_K1_LBSPPA1024_LBSPPB512_LPA0_LPB32_MIWT4_2_PLR1_SU0_SUM0_SUS128_VWA4_VWB2_WGM6_WGMXCC1_WGMXCCGn1
    SolutionIndex: 71
    SolutionNameMin: Cijk_Ailk_Bjlk_HSS_BH_Bias_HAS_SAV_UserArgs_MT128x64x64_MI16x16x1_SN_LDSB1_CLR1_GRVWA8_GRVWB8_GSU0_GSUC0_GSUWGMRR0_K1_LBSPPA1024_LBSPPB512_LPA0_LPB32_MIWT4_2_PLR1_SU0_SUM0_SUS128_VWA4_VWB2_WGM6_WGMXCC1_WGMXCCGn1
    SolutionIndex: 72
    SolutionNameMin: Cijk_Ailk_Bjlk_HSS_BH_Bias_HAS_SAV_UserArgs_MT128x64x64_MI16x16x1_SN_LDSB1_CLR1_GRVWA2_GRVWB2_GSU0_GSUC0_GSUWGMRR0_K1_LBSPPA1024_LBSPPB512_LPA0_LPB32_MIWT4_2_PLR1_SU0_SUM0_SUS128_VWA4_VWB2_WGM8_WGMXCC1_WGMXCCGn1
    SolutionIndex: 73
    SolutionNameMin: Cijk_Ailk_Bjlk_HSS_BH_Bias_HAS_SAV_UserArgs_MT128x64x64_MI16x16x1_SN_LDSB1_CLR1_GRVWA8_GRVWB4_GSU0_GSUC0_GSUWGMRR0_K1_LBSPPA1024_LBSPPB512_LPA0_LPB32_MIWT4_2_PLR1_SU0_SUM0_SUS128_VWA4_VWB2_WGM8_WGMXCC1_WGMXCCGn1
    SolutionIndex: 74
    SolutionNameMin: Cijk_Ailk_Bjlk_HSS_BH_Bias_HAS_SAV_UserArgs_MT128x64x64_MI16x16x1_SN_LDSB1_CLR1_GRVWA8_GRVWB8_GSU0_GSUC0_GSUWGMRR0_K1_LBSPPA1024_LBSPPB512_LPA0_LPB32_MIWT4_2_PLR1_SU0_SUM0_SUS128_VWA4_VWB2_WGM8_WGMXCC1_WGMXCCGn1
    SolutionIndex: 75
    SolutionNameMin: Cijk_Ailk_Bjlk_HSS_BH_Bias_HAS_SAV_UserArgs_MT128x32x64_MI16x16x1_SN_LDSB1_CLR1_GRVWA8_GRVWB2_GSU0_GSUC0_GSUWGMRR0_K1_LBSPPA1024_LBSPPB256_LPA0_LPB16_MIWT4_1_PLR1_SU0_SUM0_SUS128_VWA4_VWB1_WGM1_WGMXCC1_WGMXCCGn1
    SolutionIndex: 76
    SolutionNameMin: Cijk_Ailk_Bjlk_HSS_BH_Bias_HAS_SAV_UserArgs_MT64x64x64_MI16x16x1_SN_LDSB1_CLR1_GRVWA8_GRVWB2_GSU0_GSUC0_GSUWGMRR0_K1_LBSPPA512_LBSPPB512_LPA32_LPB32_MIWT2_2_PLR1_SU0_SUM0_SUS128_VWA2_VWB2_WGM1_WGMXCC1_WGMXCCGn1
    SolutionIndex: 77
    SolutionNameMin: Cijk_Ailk_Bjlk_HSS_BH_Bias_HAS_SAV_UserArgs_MT64x64x64_MI16x16x1_SN_LDSB1_CLR1_GRVWA2_GRVWB8_GSU0_GSUC0_GSUWGMRR0_K1_LBSPPA512_LBSPPB512_LPA32_LPB32_MIWT2_2_PLR1_SU0_SUM0_SUS128_VWA2_VWB2_WGM1_WGMXCC1_WGMXCCGn1
    SolutionIndex: 78
    SolutionNameMin: Cijk_Ailk_Bjlk_HSS_BH_Bias_HAS_SAV_UserArgs_MT64x64x64_MI16x16x1_SN_LDSB1_CLR1_GRVWA8_GRVWB8_GSU0_GSUC0_GSUWGMRR0_K1_LBSPPA512_LBSPPB512_LPA32_LPB32_MIWT2_2_PLR1_SU0_SUM0_SUS128_VWA2_VWB2_WGM1_WGMXCC1_WGMXCCGn1
    SolutionIndex: 79
    SolutionNameMin: Cijk_Ailk_Bjlk_HSS_BH_Bias_HAS_SAV_UserArgs_MT64x64x64_MI16x16x1_SN_LDSB1_CLR1_GRVWA2_GRVWB8_GSU0_GSUC0_GSUWGMRR0_K1_LBSPPA512_LBSPPB512_LPA32_LPB32_MIWT2_2_PLR1_SU0_SUM0_SUS128_VWA2_VWB2_WGM4_WGMXCC1_WGMXCCGn1
    SolutionIndex: 80
    SolutionNameMin: Cijk_Ailk_Bjlk_HSS_BH_Bias_HAS_SAV_UserArgs_MT64x64x64_MI16x16x1_SN_LDSB1_CLR1_GRVWA2_GRVWB8_GSU0_GSUC0_GSUWGMRR0_K1_LBSPPA512_LBSPPB512_LPA32_LPB32_MIWT2_2_PLR1_SU0_SUM0_SUS128_VWA2_VWB2_WGM6_WGMXCC1_WGMXCCGn1
    SolutionIndex: 81
    SolutionNameMin: Cijk_Ailk_Bjlk_HSS_BH_Bias_HAS_SAV_UserArgs_MT64x64x64_MI16x16x1_SN_LDSB1_CLR1_GRVWA4_GRVWB8_GSU0_GSUC0_GSUWGMRR0_K1_LBSPPA512_LBSPPB512_LPA32_LPB32_MIWT2_2_PLR1_SU0_SUM0_SUS128_VWA2_VWB2_WGM6_WGMXCC1_WGMXCCGn1
    SolutionIndex: 82
    SolutionNameMin: Cijk_Ailk_Bjlk_HSS_BH_Bias_HAS_SAV_UserArgs_MT64x64x64_MI16x16x1_SN_LDSB1_CLR1_GRVWA2_GRVWB8_GSU0_GSUC0_GSUWGMRR0_K1_LBSPPA512_LBSPPB512_LPA32_LPB32_MIWT2_2_PLR1_SU0_SUM0_SUS128_VWA2_VWB2_WGM8_WGMXCC1_WGMXCCGn1
    SolutionIndex: 83
    SolutionNameMin: Cijk_Ailk_Bjlk_HSS_BH_Bias_HAS_SAV_UserArgs_MT32x64x64_MI16x16x1_SN_LDSB0_CLR1_GRVWA2_GRVWB2_GSU0_GSUC0_GSUWGMRR0_K1_LBSPPA256_LBSPPB512_LPA16_LPB32_MIWT1_2_PLR1_SU0_SUM0_SUS128_VWA1_VWB2_WGM1_WGMXCC1_WGMXCCGn1
    SolutionIndex: 84
    SolutionNameMin: Cijk_Ailk_Bjlk_HSS_BH_Bias_HAS_SAV_UserArgs_MT32x64x64_MI16x16x1_SN_LDSB0_CLR1_GRVWA2_GRVWB8_GSU0_GSUC0_GSUWGMRR0_K1_LBSPPA256_LBSPPB512_LPA16_LPB32_MIWT1_2_PLR1_SU0_SUM0_SUS128_VWA1_VWB2_WGM1_WGMXCC1_WGMXCCGn1
    SolutionIndex: 85
    SolutionNameMin: Cijk_Ailk_Bjlk_HSS_BH_Bias_HAS_SAV_UserArgs_MT32x64x64_MI16x16x1_SN_LDSB0_CLR1_GRVWA2_GRVWB2_GSU0_GSUC0_GSUWGMRR0_K1_LBSPPA256_LBSPPB512_LPA16_LPB32_MIWT1_2_PLR1_SU0_SUM0_SUS128_VWA1_VWB2_WGM6_WGMXCC1_WGMXCCGn1
    SolutionIndex: 86
    SolutionNameMin: Cijk_Ailk_Bjlk_HSS_BH_Bias_HAS_SAV_UserArgs_MT32x64x64_MI16x16x1_SN_LDSB0_CLR1_GRVWA2_GRVWB2_GSU0_GSUC0_GSUWGMRR0_K1_LBSPPA256_LBSPPB512_LPA16_LPB32_MIWT1_2_PLR1_SU0_SUM0_SUS128_VWA1_VWB2_WGM8_WGMXCC1_WGMXCCGn1
    SolutionIndex: 87
    SolutionNameMin: Cijk_Ailk_Bjlk_HSS_BH_Bias_HAS_SAV_UserArgs_MT64x32x64_MI16x16x1_SN_LDSB0_CLR1_GRVWA2_GRVWB2_GSU0_GSUC0_GSUWGMRR0_K1_LBSPPA512_LBSPPB256_LPA32_LPB16_MIWT2_1_PLR1_SU0_SUM0_SUS128_VWA2_VWB1_WGM1_WGMXCC1_WGMXCCGn1
    SolutionIndex: 88
    SolutionNameMin: Cijk_Ailk_Bjlk_HSS_BH_Bias_HAS_SAV_UserArgs_MT64x32x64_MI16x16x1_SN_LDSB0_CLR1_GRVWA8_GRVWB2_GSU0_GSUC0_GSUWGMRR0_K1_LBSPPA512_LBSPPB256_LPA32_LPB16_MIWT2_1_PLR1_SU0_SUM0_SUS128_VWA2_VWB1_WGM1_WGMXCC1_WGMXCCGn1
    SolutionIndex: 89
    SolutionNameMin: Cijk_Ailk_Bjlk_HSS_BH_Bias_HAS_SAV_UserArgs_MT64x32x64_MI16x16x1_SN_LDSB0_CLR1_GRVWA2_GRVWB4_GSU0_GSUC0_GSUWGMRR0_K1_LBSPPA512_LBSPPB256_LPA32_LPB16_MIWT2_1_PLR1_SU0_SUM0_SUS128_VWA2_VWB1_WGM4_WGMXCC1_WGMXCCGn1
    SolutionIndex: 90
    SolutionNameMin: Cijk_Ailk_Bjlk_HSS_BH_Bias_HAS_SAV_UserArgs_MT32x32x64_MI16x16x1_SN_LDSB0_CLR1_GRVWA2_GRVWB2_GSU0_GSUC0_GSUWGMRR0_K1_LBSPPA256_LBSPPB256_LPA16_LPB16_MIWT1_1_PLR1_SU0_SUM0_SUS128_VWA1_VWB1_WGM1_WGMXCC1_WGMXCCGn1
    SolutionIndex: 91
    SolutionNameMin: Cijk_Ailk_Bjlk_HSS_BH_Bias_HAS_SAV_UserArgs_MT32x32x64_MI16x16x1_SN_LDSB0_CLR1_GRVWA4_GRVWB2_GSU0_GSUC0_GSUWGMRR0_K1_LBSPPA256_LBSPPB256_LPA16_LPB16_MIWT1_1_PLR1_SU0_SUM0_SUS128_VWA1_VWB1_WGM1_WGMXCC1_WGMXCCGn1
    SolutionIndex: 92
    SolutionNameMin: Cijk_Ailk_Bjlk_HSS_BH_Bias_HAS_SAV_UserArgs_MT32x32x64_MI16x16x1_SN_LDSB0_CLR1_GRVWA8_GRVWB2_GSU0_GSUC0_GSUWGMRR0_K1_LBSPPA256_LBSPPB256_LPA16_LPB16_MIWT1_1_PLR1_SU0_SUM0_SUS128_VWA1_VWB1_WGM1_WGMXCC1_WGMXCCGn1
    SolutionIndex: 93
    SolutionNameMin: Cijk_Ailk_Bjlk_HSS_BH_Bias_HAS_SAV_UserArgs_MT32x32x64_MI16x16x1_SN_LDSB0_CLR1_GRVWA2_GRVWB4_GSU0_GSUC0_GSUWGMRR0_K1_LBSPPA256_LBSPPB256_LPA16_LPB16_MIWT1_1_PLR1_SU0_SUM0_SUS128_VWA1_VWB1_WGM1_WGMXCC1_WGMXCCGn1
    SolutionIndex: 94
    SolutionNameMin: Cijk_Ailk_Bjlk_HSS_BH_Bias_HAS_SAV_UserArgs_MT32x32x64_MI16x16x1_SN_LDSB0_CLR1_GRVWA2_GRVWB8_GSU0_GSUC0_GSUWGMRR0_K1_LBSPPA256_LBSPPB256_LPA16_LPB16_MIWT1_1_PLR1_SU0_SUM0_SUS128_VWA1_VWB1_WGM6_WGMXCC1_WGMXCCGn1
    SolutionIndex: 95
    SolutionNameMin: Cijk_Ailk_Bjlk_HSS_BH_Bias_HAS_SAV_UserArgs_MT32x32x64_MI16x16x1_SN_LDSB0_CLR1_GRVWA2_GRVWB8_GSU0_GSUC0_GSUWGMRR0_K1_LBSPPA256_LBSPPB256_LPA16_LPB16_MIWT1_1_PLR1_SU0_SUM0_SUS128_VWA1_VWB1_WGM8_WGMXCC1_WGMXCCGn1
    SolutionIndex: 96
    SolutionNameMin: Cijk_Ailk_Bjlk_HSS_BH_Bias_HAS_SAV_UserArgs_MT64x64x128_MI16x16x1_SN_LDSB1_CLR1_GRVWA2_GRVWB8_GSU0_GSUC0_GSUWGMRR0_K1_LBSPPA512_LBSPPB512_LPA32_LPB32_MIWT2_2_PLR1_SU0_SUM0_SUS256_VWA2_VWB2_WGM1_WGMXCC1_WGMXCCGn1
    SolutionIndex: 97
    SolutionNameMin: Cijk_Ailk_Bjlk_HSS_BH_Bias_HAS_SAV_UserArgs_MT64x64x128_MI16x16x1_SN_LDSB1_CLR1_GRVWA8_GRVWB8_GSU0_GSUC0_GSUWGMRR0_K1_LBSPPA512_LBSPPB512_LPA32_LPB32_MIWT2_2_PLR1_SU0_SUM0_SUS256_VWA2_VWB2_WGM1_WGMXCC1_WGMXCCGn1
    SolutionIndex: 98
    SolutionNameMin: Cijk_Ailk_Bjlk_HSS_BH_Bias_HAS_SAV_UserArgs_MT64x64x128_MI16x16x1_SN_LDSB1_CLR1_GRVWA8_GRVWB8_GSU0_GSUC0_GSUWGMRR0_K1_LBSPPA512_LBSPPB512_LPA32_LPB32_MIWT2_2_PLR1_SU0_SUM0_SUS256_VWA2_VWB2_WGM4_WGMXCC1_WGMXCCGn1
    SolutionIndex: 99
    SolutionNameMin: Cijk_Ailk_Bjlk_HSS_BH_Bias_HAS_SAV_UserArgs_MT32x64x128_MI16x16x1_SN_LDSB1_CLR1_GRVWA8_GRVWB8_GSU0_GSUC0_GSUWGMRR0_K1_LBSPPA256_LBSPPB512_LPA16_LPB32_MIWT1_2_PLR1_SU0_SUM0_SUS256_VWA1_VWB2_WGM1_WGMXCC1_WGMXCCGn1
    SolutionIndex: 100
    SolutionNameMin: Cijk_Ailk_Bjlk_HSS_BH_Bias_HAS_SAV_UserArgs_MT32x64x128_MI16x16x1_SN_LDSB1_CLR1_GRVWA8_GRVWB2_GSU0_GSUC0_GSUWGMRR0_K1_LBSPPA256_LBSPPB512_LPA16_LPB32_MIWT1_2_PLR1_SU0_SUM0_SUS256_VWA1_VWB2_WGM6_WGMXCC1_WGMXCCGn1
    SolutionIndex: 101
    SolutionNameMin: Cijk_Ailk_Bjlk_HSS_BH_Bias_HAS_SAV_UserArgs_MT64x32x128_MI16x16x1_SN_LDSB1_CLR1_GRVWA4_GRVWB2_GSU0_GSUC0_GSUWGMRR0_K1_LBSPPA512_LBSPPB256_LPA32_LPB16_MIWT2_1_PLR1_SU0_SUM0_SUS256_VWA2_VWB1_WGM1_WGMXCC1_WGMXCCGn1
    SolutionIndex: 102
    SolutionNameMin: Cijk_Ailk_Bjlk_HSS_BH_Bias_HAS_SAV_UserArgs_MT64x32x128_MI16x16x1_SN_LDSB1_CLR1_GRVWA8_GRVWB8_GSU0_GSUC0_GSUWGMRR0_K1_LBSPPA512_LBSPPB256_LPA32_LPB16_MIWT2_1_PLR1_SU0_SUM0_SUS256_VWA2_VWB1_WGM1_WGMXCC1_WGMXCCGn1
    SolutionIndex: 103
    SolutionNameMin: Cijk_Ailk_Bjlk_HSS_BH_Bias_HAS_SAV_UserArgs_MT64x32x128_MI16x16x1_SN_LDSB1_CLR1_GRVWA8_GRVWB8_GSU0_GSUC0_GSUWGMRR0_K1_LBSPPA512_LBSPPB256_LPA32_LPB16_MIWT2_1_PLR1_SU0_SUM0_SUS256_VWA2_VWB1_WGM4_WGMXCC1_WGMXCCGn1
    SolutionIndex: 104
    SolutionNameMin: Cijk_Ailk_Bjlk_HSS_BH_Bias_HAS_SAV_UserArgs_MT64x32x128_MI16x16x1_SN_LDSB1_CLR1_GRVWA8_GRVWB8_GSU0_GSUC0_GSUWGMRR0_K1_LBSPPA512_LBSPPB256_LPA32_LPB16_MIWT2_1_PLR1_SU0_SUM0_SUS256_VWA2_VWB1_WGM6_WGMXCC1_WGMXCCGn1
    SolutionIndex: 105
    SolutionNameMin: Cijk_Ailk_Bjlk_HSS_BH_Bias_HAS_SAV_UserArgs_MT64x32x128_MI16x16x1_SN_LDSB1_CLR1_GRVWA8_GRVWB8_GSU0_GSUC0_GSUWGMRR0_K1_LBSPPA512_LBSPPB256_LPA32_LPB16_MIWT2_1_PLR1_SU0_SUM0_SUS256_VWA2_VWB1_WGM8_WGMXCC1_WGMXCCGn1
    SolutionIndex: 106
    SolutionNameMin: Cijk_Ailk_Bjlk_HSS_BH_Bias_HAS_SAV_UserArgs_MT32x32x128_MI16x16x1_SN_LDSB1_CLR1_GRVWA4_GRVWB2_GSU0_GSUC0_GSUWGMRR0_K1_LBSPPA256_LBSPPB256_LPA16_LPB16_MIWT1_1_PLR1_SU0_SUM0_SUS256_VWA1_VWB1_WGM1_WGMXCC1_WGMXCCGn1
    SolutionIndex: 107
    SolutionNameMin: Cijk_Ailk_Bjlk_HSS_BH_Bias_HAS_SAV_UserArgs_MT32x32x128_MI16x16x1_SN_LDSB1_CLR1_GRVWA8_GRVWB4_GSU0_GSUC0_GSUWGMRR0_K1_LBSPPA256_LBSPPB256_LPA16_LPB16_MIWT1_1_PLR1_SU0_SUM0_SUS256_VWA1_VWB1_WGM1_WGMXCC1_WGMXCCGn1
    SolutionIndex: 108
    SolutionNameMin: Cijk_Ailk_Bjlk_HSS_BH_Bias_HAS_SAV_UserArgs_MT32x32x128_MI16x16x1_SN_LDSB1_CLR1_GRVWA2_GRVWB8_GSU0_GSUC0_GSUWGMRR0_K1_LBSPPA256_LBSPPB256_LPA16_LPB16_MIWT1_1_PLR1_SU0_SUM0_SUS256_VWA1_VWB1_WGM1_WGMXCC1_WGMXCCGn1
    SolutionIndex: 109
    SolutionNameMin: Cijk_Ailk_Bjlk_HSS_BH_Bias_HAS_SAV_UserArgs_MT32x32x128_MI16x16x1_SN_LDSB1_CLR1_GRVWA4_GRVWB8_GSU0_GSUC0_GSUWGMRR0_K1_LBSPPA256_LBSPPB256_LPA16_LPB16_MIWT1_1_PLR1_SU0_SUM0_SUS256_VWA1_VWB1_WGM1_WGMXCC1_WGMXCCGn1
    SolutionIndex: 110
    SolutionNameMin: Cijk_Ailk_Bjlk_HSS_BH_Bias_HAS_SAV_UserArgs_MT32x32x128_MI16x16x1_SN_LDSB1_CLR1_GRVWA8_GRVWB8_GSU0_GSUC0_GSUWGMRR0_K1_LBSPPA256_LBSPPB256_LPA16_LPB16_MIWT1_1_PLR1_SU0_SUM0_SUS256_VWA1_VWB1_WGM1_WGMXCC1_WGMXCCGn1
    SolutionIndex: 111
    SolutionNameMin: Cijk_Ailk_Bjlk_HSS_BH_Bias_HAS_SAV_UserArgs_MT32x32x128_MI16x16x1_SN_LDSB1_CLR1_GRVWA2_GRVWB8_GSU0_GSUC0_GSUWGMRR0_K1_LBSPPA256_LBSPPB256_LPA16_LPB16_MIWT1_1_PLR1_SU0_SUM0_SUS256_VWA1_VWB1_WGM4_WGMXCC1_WGMXCCGn1
    SolutionIndex: 112
    SolutionNameMin: Cijk_Ailk_Bjlk_HSS_BH_Bias_HAS_SAV_UserArgs_MT32x32x128_MI16x16x1_SN_LDSB1_CLR1_GRVWA4_GRVWB8_GSU0_GSUC0_GSUWGMRR0_K1_LBSPPA256_LBSPPB256_LPA16_LPB16_MIWT1_1_PLR1_SU0_SUM0_SUS256_VWA1_VWB1_WGM4_WGMXCC1_WGMXCCGn1
    SolutionIndex: 113
    SolutionNameMin: Cijk_Ailk_Bjlk_HSS_BH_Bias_HAS_SAV_UserArgs_MT32x32x128_MI16x16x1_SN_LDSB1_CLR1_GRVWA8_GRVWB8_GSU0_GSUC0_GSUWGMRR0_K1_LBSPPA256_LBSPPB256_LPA16_LPB16_MIWT1_1_PLR1_SU0_SUM0_SUS256_VWA1_VWB1_WGM4_WGMXCC1_WGMXCCGn1
    SolutionIndex: 114
    SolutionNameMin: Cijk_Ailk_Bjlk_HSS_BH_Bias_HAS_SAV_UserArgs_MT32x32x128_MI16x16x1_SN_LDSB1_CLR1_GRVWA4_GRVWB8_GSU0_GSUC0_GSUWGMRR0_K1_LBSPPA256_LBSPPB256_LPA16_LPB16_MIWT1_1_PLR1_SU0_SUM0_SUS256_VWA1_VWB1_WGM6_WGMXCC1_WGMXCCGn1
    SolutionIndex: 115
    SolutionNameMin: Cijk_Ailk_Bjlk_HSS_BH_Bias_HAS_SAV_UserArgs_MT32x32x128_MI16x16x1_SN_LDSB1_CLR1_GRVWA8_GRVWB8_GSU0_GSUC0_GSUWGMRR0_K1_LBSPPA256_LBSPPB256_LPA16_LPB16_MIWT1_1_PLR1_SU0_SUM0_SUS256_VWA1_VWB1_WGM6_WGMXCC1_WGMXCCGn1
    SolutionIndex: 116
    SolutionNameMin: Cijk_Ailk_Bjlk_HSS_BH_Bias_HAS_SAV_UserArgs_MT32x32x128_MI16x16x1_SN_LDSB1_CLR1_GRVWA2_GRVWB8_GSU0_GSUC0_GSUWGMRR0_K1_LBSPPA256_LBSPPB256_LPA16_LPB16_MIWT1_1_PLR1_SU0_SUM0_SUS256_VWA1_VWB1_WGM8_WGMXCC1_WGMXCCGn1
    SolutionIndex: 117
    SolutionNameMin: Cijk_Ailk_Bjlk_HSS_BH_Bias_HAS_SAV_UserArgs_MT32x32x128_MI16x16x1_SN_LDSB1_CLR1_GRVWA8_GRVWB8_GSU0_GSUC0_GSUWGMRR0_K1_LBSPPA256_LBSPPB256_LPA16_LPB16_MIWT1_1_PLR1_SU0_SUM0_SUS256_VWA1_VWB1_WGM8_WGMXCC1_WGMXCCGn1
- - - [128, 128, 1, 128, 128, 128, 128, 128]
    - [90, 0.43]
  - - [128, 128, 1, 256, 128, 128, 128, 128]
    - [110, 0.74]
  - - [128, 128, 1, 512, 128, 128, 128, 128]
    - [110, 1.26]
  - - [128, 128, 1, 1024, 128, 128, 128, 128]
    - [110, 1.86]
  - - [128, 128, 1, 2048, 128, 128, 128, 128]
    - [110, 2.42]
  - - [128, 128, 1, 4096, 128, 128, 128, 128]
    - [110, 2.94]
  - - [128, 128, 1, 8192, 128, 128, 128, 128]
    - [110, 3.19]
  - - [128, 256, 1, 128, 128, 128, 128, 256]
    - [90, 0.84]
  - - [128, 256, 1, 256, 128, 128, 128, 256]
    - [90, 1.44]
  - - [128, 256, 1, 512, 128, 128, 128, 256]
    - [110, 2.33]
  - - [128, 256, 1, 1024, 128, 128, 128, 256]
    - [110, 3.32]
  - - [128, 256, 1, 2048, 128, 128, 128, 256]
    - [110, 4.28]
  - - [128, 256, 1, 4096, 128, 128, 128, 256]
    - [110, 5.0]
  - - [128, 256, 1, 8192, 128, 128, 128, 256]
    - [47, 5.45]
  - - [128, 512, 1, 128, 128, 128, 128, 512]
    - [91, 1.63]
  - - [128, 512, 1, 256, 128, 128, 128, 512]
    - [90, 2.81]
  - - [128, 512, 1, 512, 128, 128, 128, 512]
    - [110, 4.45]
  - - [128, 512, 1, 1024, 128, 128, 128, 512]
    - [110, 6.5]
  - - [128, 512, 1, 2048, 128, 128, 128, 512]
    - [110, 8.43]
  - - [128, 512, 1, 4096, 128, 128, 128, 512]
    - [115, 9.82]
  - - [128, 512, 1, 8192, 128, 128, 128, 512]
    - [110, 10.72]
  - - [128, 1024, 1, 128, 128, 128, 128, 1024]
    - [90, 3.25]
  - - [128, 1024, 1, 256, 128, 128, 128, 1024]
    - [90, 5.47]
  - - [128, 1024, 1, 512, 128, 128, 128, 1024]
    - [110, 8.73]
  - - [128, 1024, 1, 1024, 128, 128, 128, 1024]
    - [110, 12.7]
  - - [128, 1024, 1, 2048, 128, 128, 128, 1024]
    - [110, 16.27]
  - - [128, 1024, 1, 4096, 128, 128, 128, 1024]
    - [117, 19.09]
  - - [128, 1024, 1, 8192, 128, 128, 128, 1024]
    - [110, 21.03]
  - - [128, 2048, 1, 128, 128, 128, 128, 2048]
    - [87, 5.97]
  - - [128, 2048, 1, 256, 128, 128, 128, 2048]
    - [87, 9.87]
  - - [128, 2048, 1, 512, 128, 128, 128, 2048]
    - [102, 15.7]
  - - [128, 2048, 1, 1024, 128, 128, 128, 2048]
    - [99, 22.88]
  - - [128, 2048, 1, 2048, 128, 128, 128, 2048]
    - [99, 29.21]
  - - [128, 2048, 1, 4096, 128, 128, 128, 2048]
    - [99, 34.68]
  - - [128, 2048, 1, 8192, 128, 128, 128, 2048]
    - [100, 35.24]
  - - [128, 4096, 1, 128, 128, 128, 128, 4096]
    - [78, 9.95]
  - - [128, 4096, 1, 256, 128, 128, 128, 4096]
    - [76, 17.33]
  - - [128, 4096, 1, 512, 128, 128, 128, 4096]
    - [77, 27.19]
  - - [128, 4096, 1, 1024, 128, 128, 128, 4096]
    - [97, 39.01]
  - - [128, 4096, 1, 2048, 128, 128, 128, 4096]
    - [97, 50.56]
  - - [128, 4096, 1, 4096, 128, 128, 128, 4096]
    - [96, 53.95]
  - - [128, 4096, 1, 8192, 128, 128, 128, 4096]
    - [97, 60.58]
  - - [128, 8192, 1, 128, 128, 128, 128, 8192]
    - [34, 15.71]
  - - [128, 8192, 1, 256, 128, 128, 128, 8192]
    - [62, 26.65]
  - - [128, 8192, 1, 512, 128, 128, 128, 8192]
    - [71, 41.6]
  - - [128, 8192, 1, 1024, 128, 128, 128, 8192]
    - [61, 56.34]
  - - [128, 8192, 1, 2048, 128, 128, 128, 8192]
    - [71, 65.33]
  - - [128, 8192, 1, 4096, 128, 128, 128, 8192]
    - [71, 75.17]
  - - [128, 8192, 1, 8192, 128, 128, 128, 8192]
    - [35, 80.78]
  - - [256, 128, 1, 128, 256, 256, 256, 128]
    - [92, 0.85]
  - - [256, 128, 1, 256, 256, 256, 256, 128]
    - [90, 1.45]
  - - [256, 128, 1, 512, 256, 256, 256, 128]
    - [110, 2.29]
  - - [256, 128, 1, 1024, 256, 256, 256, 128]
    - [109, 3.22]
  - - [256, 128, 1, 2048, 256, 256, 256, 128]
    - [110, 4.17]
  - - [256, 128, 1, 4096, 256, 256, 256, 128]
    - [115, 4.8]
  - - [256, 128, 1, 8192, 256, 256, 256, 128]
    - [48, 5.4]
  - - [256, 256, 1, 128, 256, 256, 256, 256]
    - [90, 1.62]
  - - [256, 256, 1, 256, 256, 256, 256, 256]
    - [93, 2.85]
  - - [256, 256, 1, 512, 256, 256, 256, 256]
    - [107, 4.42]
  - - [256, 256, 1, 1024, 256, 256, 256, 256]
    - [110, 6.31]
  - - [256, 256, 1, 2048, 256, 256, 256, 256]
    - [110, 7.95]
  - - [256, 256, 1, 4096, 256, 256, 256, 256]
    - [110, 9.13]
  - - [256, 256, 1, 8192, 256, 256, 256, 256]
    - [46, 10.56]
  - - [256, 512, 1, 128, 256, 256, 256, 512]
    - [90, 3.22]
  - - [256, 512, 1, 256, 256, 256, 256, 512]
    - [92, 5.4]
  - - [256, 512, 1, 512, 256, 256, 256, 512]
    - [107, 8.53]
  - - [256, 512, 1, 1024, 256, 256, 256, 512]
    - [110, 12.12]
  - - [256, 512, 1, 2048, 256, 256, 256, 512]
    - [115, 15.38]
  - - [256, 512, 1, 4096, 256, 256, 256, 512]
    - [115, 17.78]
  - - [256, 512, 1, 8192, 256, 256, 256, 512]
    - [44, 19.9]
  - - [256, 1024, 1, 128, 256, 256, 256, 1024]
    - [84, 5.76]
  - - [256, 1024, 1, 256, 256, 256, 256, 1024]
    - [83, 9.84]
  - - [256, 1024, 1, 512, 256, 256, 256, 1024]
    - [83, 15.37]
  - - [256, 1024, 1, 1024, 256, 256, 256, 1024]
    - [102, 21.87]
  - - [256, 1024, 1, 2048, 256, 256, 256, 1024]
    - [102, 27.46]
  - - [256, 1024, 1, 4096, 256, 256, 256, 1024]
    - [103, 31.67]
  - - [256, 1024, 1, 8192, 256, 256, 256, 1024]
    - [40, 36.9]
  - - [256, 2048, 1, 128, 256, 256, 256, 2048]
    - [77, 9.61]
  - - [256, 2048, 1, 256, 256, 256, 256, 2048]
    - [77, 16.85]
  - - [256, 2048, 1, 512, 256, 256, 256, 2048]
    - [78, 26.51]
  - - [256, 2048, 1, 1024, 256, 256, 256, 2048]
    - [78, 37.38]
  - - [256, 2048, 1, 2048, 256, 256, 256, 2048]
    - [78, 46.74]
  - - [256, 2048, 1, 4096, 256, 256, 256, 2048]
    - [78, 53.03]
  - - [256, 2048, 1, 8192, 256, 256, 256, 2048]
    - [41, 57.37]
  - - [256, 4096, 1, 128, 256, 256, 256, 4096]
    - [62, 15.84]
  - - [256, 4096, 1, 256, 256, 256, 256, 4096]
    - [64, 27.35]
  - - [256, 4096, 1, 512, 256, 256, 256, 4096]
    - [64, 43.26]
  - - [256, 4096, 1, 1024, 256, 256, 256, 4096]
    - [64, 60.78]
  - - [256, 4096, 1, 2048, 256, 256, 256, 4096]
    - [71, 73.79]
  - - [256, 4096, 1, 4096, 256, 256, 256, 4096]
    - [63, 80.91]
  - - [256, 4096, 1, 8192, 256, 256, 256, 4096]
    - [38, 84.23]
  - - [256, 8192, 1, 128, 256, 256, 256, 8192]
    - [24, 21.93]
  - - [256, 8192, 1, 256, 256, 256, 256, 8192]
    - [57, 37.85]
  - - [256, 8192, 1, 512, 256, 256, 256, 8192]
    - [56, 59.56]
  - - [256, 8192, 1, 1024, 256, 256, 256, 8192]
    - [56, 78.74]
  - - [256, 8192, 1, 2048, 256, 256, 256, 8192]
    - [56, 98.74]
  - - [256, 8192, 1, 4096, 256, 256, 256, 8192]
    - [56, 113.55]
  - - [256, 8192, 1, 8192, 256, 256, 256, 8192]
    - [28, 109.22]
  - - [512, 128, 1, 128, 512, 512, 512, 128]
    - [106, 1.67]
  - - [512, 128, 1, 256, 512, 512, 512, 128]
    - [93, 2.81]
  - - [512, 128, 1, 512, 512, 512, 512, 128]
    - [109, 4.43]
  - - [512, 128, 1, 1024, 512, 512, 512, 128]
    - [108, 6.4]
  - - [512, 128, 1, 2048, 512, 512, 512, 128]
    - [108, 8.25]
  - - [512, 128, 1, 4096, 512, 512, 512, 128]
    - [108, 9.64]
  - - [512, 128, 1, 8192, 512, 512, 512, 128]
    - [108, 10.49]
  - - [512, 256, 1, 128, 512, 512, 512, 256]
    - [93, 3.25]
  - - [512, 256, 1, 256, 512, 512, 512, 256]
    - [90, 5.43]
  - - [512, 256, 1, 512, 512, 512, 512, 256]
    - [114, 8.58]
  - - [512, 256, 1, 1024, 512, 512, 512, 256]
    - [112, 12.32]
  - - [512, 256, 1, 2048, 512, 512, 512, 256]
    - [114, 15.58]
  - - [512, 256, 1, 4096, 512, 512, 512, 256]
    - [113, 17.78]
  - - [512, 256, 1, 8192, 512, 512, 512, 256]
    - [45, 19.98]
  - - [512, 512, 1, 128, 512, 512, 512, 512]
    - [101, 5.74]
  - - [512, 512, 1, 256, 512, 512, 512, 512]
    - [88, 9.9]
  - - [512, 512, 1, 512, 512, 512, 512, 512]
    - [102, 15.59]
  - - [512, 512, 1, 1024, 512, 512, 512, 512]
    - [104, 22.12]
  - - [512, 512, 1, 2048, 512, 512, 512, 512]
    - [102, 28.14]
  - - [512, 512, 1, 4096, 512, 512, 512, 512]
    - [104, 31.9]
  - - [512, 512, 1, 8192, 512, 512, 512, 512]
    - [40, 37.44]
  - - [512, 1024, 1, 128, 512, 512, 512, 1024]
    - [75, 9.94]
  - - [512, 1024, 1, 256, 512, 512, 512, 1024]
    - [78, 17.25]
  - - [512, 1024, 1, 512, 512, 512, 512, 1024]
    - [80, 27.0]
  - - [512, 1024, 1, 1024, 512, 512, 512, 1024]
    - [78, 37.95]
  - - [512, 1024, 1, 2048, 512, 512, 512, 1024]
    - [81, 46.86]
  - - [512, 1024, 1, 4096, 512, 512, 512, 1024]
    - [76, 53.01]
  - - [512, 1024, 1, 8192, 512, 512, 512, 1024]
    - [37, 60.76]
  - - [512, 2048, 1, 128, 512, 512, 512, 2048]
    - [69, 15.07]
  - - [512, 2048, 1, 256, 512, 512, 512, 2048]
    - [62, 27.03]
  - - [512, 2048, 1, 512, 512, 512, 512, 2048]
    - [64, 42.92]
  - - [512, 2048, 1, 1024, 512, 512, 512, 2048]
    - [64, 59.85]
  - - [512, 2048, 1, 2048, 512, 512, 512, 2048]
    - [71, 74.54]
  - - [512, 2048, 1, 4096, 512, 512, 512, 2048]
    - [71, 83.12]
  - - [512, 2048, 1, 8192, 512, 512, 512, 2048]
    - [36, 85.22]
  - - [512, 4096, 1, 128, 512, 512, 512, 4096]
    - [26, 22.58]
  - - [512, 4096, 1, 256, 512, 512, 512, 4096]
    - [56, 40.37]
  - - [512, 4096, 1, 512, 512, 512, 512, 4096]
    - [57, 63.61]
  - - [512, 4096, 1, 1024, 512, 512, 512, 4096]
    - [56, 87.8]
  - - [512, 4096, 1, 2048, 512, 512, 512, 4096]
    - [56, 106.5]
  - - [512, 4096, 1, 4096, 512, 512, 512, 4096]
    - [57, 115.1]
  - - [512, 4096, 1, 8192, 512, 512, 512, 4096]
    - [26, 110.48]
  - - [512, 8192, 1, 128, 512, 512, 512, 8192]
    - [14, 29.08]
  - - [512, 8192, 1, 256, 512, 512, 512, 8192]
    - [14, 49.15]
  - - [512, 8192, 1, 512, 512, 512, 512, 8192]
    - [14, 73.61]
  - - [512, 8192, 1, 1024, 512, 512, 512, 8192]
    - [16, 102.77]
  - - [512, 8192, 1, 2048, 512, 512, 512, 8192]
    - [15, 120.16]
  - - [512, 8192, 1, 4096, 512, 512, 512, 8192]
    - [15, 116.44]
  - - [512, 8192, 1, 8192, 512, 512, 512, 8192]
    - [17, 126.42]
  - - [1024, 128, 1, 128, 1024, 1024, 1024, 128]
    - [95, 3.12]
  - - [1024, 128, 1, 256, 1024, 1024, 1024, 128]
    - [94, 5.33]
  - - [1024, 128, 1, 512, 1024, 1024, 1024, 128]
    - [116, 8.51]
  - - [1024, 128, 1, 1024, 1024, 1024, 1024, 128]
    - [115, 12.36]
  - - [1024, 128, 1, 2048, 1024, 1024, 1024, 128]
    - [113, 15.76]
  - - [1024, 128, 1, 4096, 1024, 1024, 1024, 128]
    - [116, 18.6]
  - - [1024, 128, 1, 8192, 1024, 1024, 1024, 128]
    - [111, 20.34]
  - - [1024, 256, 1, 128, 1024, 1024, 1024, 256]
    - [86, 5.42]
  - - [1024, 256, 1, 256, 1024, 1024, 1024, 256]
    - [89, 9.44]
  - - [1024, 256, 1, 512, 1024, 1024, 1024, 256]
    - [85, 14.99]
  - - [1024, 256, 1, 1024, 1024, 1024, 1024, 256]
    - [103, 21.53]
  - - [1024, 256, 1, 2048, 1024, 1024, 1024, 256]
    - [103, 27.66]
  - - [1024, 256, 1, 4096, 1024, 1024, 1024, 256]
    - [103, 31.98]
  - - [1024, 256, 1, 8192, 1024, 1024, 1024, 256]
    - [40, 37.21]
  - - [1024, 512, 1, 128, 1024, 1024, 1024, 512]
    - [81, 9.92]
  - - [1024, 512, 1, 256, 1024, 1024, 1024, 512]
    - [79, 17.34]
  - - [1024, 512, 1, 512, 1024, 1024, 1024, 512]
    - [80, 27.18]
  - - [1024, 512, 1, 1024, 1024, 1024, 1024, 512]
    - [80, 38.27]
  - - [1024, 512, 1, 2048, 1024, 1024, 1024, 512]
    - [82, 46.51]
  - - [1024, 512, 1, 4096, 1024, 1024, 1024, 512]
    - [82, 53.1]
  - - [1024, 512, 1, 8192, 1024, 1024, 1024, 512]
    - [43, 58.94]
  - - [1024, 1024, 1, 128, 1024, 1024, 1024, 1024]
    - [65, 15.32]
  - - [1024, 1024, 1, 256, 1024, 1024, 1024, 1024]
    - [73, 26.58]
  - - [1024, 1024, 1, 512, 1024, 1024, 1024, 1024]
    - [67, 42.9]
  - - [1024, 1024, 1, 1024, 1024, 1024, 1024, 1024]
    - [71, 59.81]
  - - [1024, 1024, 1, 2048, 1024, 1024, 1024, 1024]
    - [71, 73.96]
  - - [1024, 1024, 1, 4096, 1024, 1024, 1024, 1024]
    - [71, 82.86]
  - - [1024, 1024, 1, 8192, 1024, 1024, 1024, 1024]
    - [30, 81.76]
  - - [1024, 2048, 1, 128, 1024, 1024, 1024, 2048]
    - [55, 22.22]
  - - [1024, 2048, 1, 256, 1024, 1024, 1024, 2048]
    - [56, 39.1]
  - - [1024, 2048, 1, 512, 1024, 1024, 1024, 2048]
    - [56, 63.03]
  - - [1024, 2048, 1, 1024, 1024, 1024, 1024, 2048]
    - [56, 86.77]
  - - [1024, 2048, 1, 2048, 1024, 1024, 1024, 2048]
    - [60, 107.73]
  - - [1024, 2048, 1, 4096, 1024, 1024, 1024, 2048]
    - [60, 118.31]
  - - [1024, 2048, 1, 8192, 1024, 1024, 1024, 2048]
    - [56, 112.12]
  - - [1024, 4096, 1, 128, 1024, 1024, 1024, 4096]
    - [14, 28.87]
  - - [1024, 4096, 1, 256, 1024, 1024, 1024, 4096]
    - [16, 49.26]
  - - [1024, 4096, 1, 512, 1024, 1024, 1024, 4096]
    - [17, 74.75]
  - - [1024, 4096, 1, 1024, 1024, 1024, 1024, 4096]
    - [16, 101.95]
  - - [1024, 4096, 1, 2048, 1024, 1024, 1024, 4096]
    - [18, 119.39]
  - - [1024, 4096, 1, 4096, 1024, 1024, 1024, 4096]
    - [17, 120.48]
  - - [1024, 4096, 1, 8192, 1024, 1024, 1024, 4096]
    - [20, 131.79]
  - - [1024, 8192, 1, 128, 1024, 1024, 1024, 8192]
    - [14, 32.73]
  - - [1024, 8192, 1, 256, 1024, 1024, 1024, 8192]
    - [16, 54.68]
  - - [1024, 8192, 1, 512, 1024, 1024, 1024, 8192]
    - [16, 81.63]
  - - [1024, 8192, 1, 1024, 1024, 1024, 1024, 8192]
    - [1, 108.58]
  - - [1024, 8192, 1, 2048, 1024, 1024, 1024, 8192]
    - [1, 120.45]
  - - [1024, 8192, 1, 4096, 1024, 1024, 1024, 8192]
    - [7, 138.69]
  - - [1024, 8192, 1, 8192, 1024, 1024, 1024, 8192]
    - [7, 159.31]
  - - [2048, 128, 1, 128, 2048, 2048, 2048, 128]
    - [83, 5.77]
  - - [2048, 128, 1, 256, 2048, 2048, 2048, 128]
    - [84, 9.91]
  - - [2048, 128, 1, 512, 2048, 2048, 2048, 128]
    - [99, 15.55]
  - - [2048, 128, 1, 1024, 2048, 2048, 2048, 128]
    - [104, 22.54]
  - - [2048, 128, 1, 2048, 2048, 2048, 2048, 128]
    - [105, 29.19]
  - - [2048, 128, 1, 4096, 2048, 2048, 2048, 128]
    - [103, 34.65]
  - - [2048, 128, 1, 8192, 2048, 2048, 2048, 128]
    - [103, 34.41]
  - - [2048, 256, 1, 128, 2048, 2048, 2048, 256]
    - [82, 9.94]
  - - [2048, 256, 1, 256, 2048, 2048, 2048, 256]
    - [80, 17.26]
  - - [2048, 256, 1, 512, 2048, 2048, 2048, 256]
    - [79, 27.3]
  - - [2048, 256, 1, 1024, 2048, 2048, 2048, 256]
    - [80, 38.23]
  - - [2048, 256, 1, 2048, 2048, 2048, 2048, 256]
    - [79, 46.96]
  - - [2048, 256, 1, 4096, 2048, 2048, 2048, 256]
    - [80, 53.1]
  - - [2048, 256, 1, 8192, 2048, 2048, 2048, 256]
    - [42, 58.14]
  - - [2048, 512, 1, 128, 2048, 2048, 2048, 512]
    - [35, 15.86]
  - - [2048, 512, 1, 256, 2048, 2048, 2048, 512]
    - [70, 26.72]
  - - [2048, 512, 1, 512, 2048, 2048, 2048, 512]
    - [72, 42.17]
  - - [2048, 512, 1, 1024, 2048, 2048, 2048, 512]
    - [67, 59.07]
  - - [2048, 512, 1, 2048, 2048, 2048, 2048, 512]
    - [74, 72.71]
  - - [2048, 512, 1, 4096, 2048, 2048, 2048, 512]
    - [66, 81.02]
  - - [2048, 512, 1, 8192, 2048, 2048, 2048, 512]
    - [30, 83.83]
  - - [2048, 1024, 1, 128, 2048, 2048, 2048, 1024]
    - [31, 22.04]
  - - [2048, 1024, 1, 256, 2048, 2048, 2048, 1024]
    - [57, 38.99]
  - - [2048, 1024, 1, 512, 2048, 2048, 2048, 1024]
    - [57, 62.8]
  - - [2048, 1024, 1, 1024, 2048, 2048, 2048, 1024]
    - [58, 85.72]
  - - [2048, 1024, 1, 2048, 2048, 2048, 2048, 1024]
    - [60, 105.17]
  - - [2048, 1024, 1, 4096, 2048, 2048, 2048, 1024]
    - [57, 118.02]
  - - [2048, 1024, 1, 8192, 2048, 2048, 2048, 1024]
    - [60, 110.41]
  - - [2048, 2048, 1, 128, 2048, 2048, 2048, 2048]
    - [14, 27.91]
  - - [2048, 2048, 1, 256, 2048, 2048, 2048, 2048]
    - [17, 47.66]
  - - [2048, 2048, 1, 512, 2048, 2048, 2048, 2048]
    - [14, 73.08]
  - - [2048, 2048, 1, 1024, 2048, 2048, 2048, 2048]
    - [18, 99.96]
  - - [2048, 2048, 1, 2048, 2048, 2048, 2048, 2048]
    - [20, 117.94]
  - - [2048, 2048, 1, 4096, 2048, 2048, 2048, 2048]
    - [18, 122.85]
  - - [2048, 2048, 1, 8192, 2048, 2048, 2048, 2048]
    - [18, 134.76]
  - - [2048, 4096, 1, 128, 2048, 2048, 2048, 4096]
    - [14, 31.67]
  - - [2048, 4096, 1, 256, 2048, 2048, 2048, 4096]
    - [16, 52.63]
  - - [2048, 4096, 1, 512, 2048, 2048, 2048, 4096]
    - [16, 80.38]
  - - [2048, 4096, 1, 1024, 2048, 2048, 2048, 4096]
    - [2, 106.6]
  - - [2048, 4096, 1, 2048, 2048, 2048, 2048, 4096]
    - [16, 120.19]
  - - [2048, 4096, 1, 4096, 2048, 2048, 2048, 4096]
    - [2, 138.0]
  - - [2048, 4096, 1, 8192, 2048, 2048, 2048, 4096]
    - [4, 154.04]
  - - [2048, 8192, 1, 128, 2048, 2048, 2048, 8192]
    - [14, 34.07]
  - - [2048, 8192, 1, 256, 2048, 2048, 2048, 8192]
    - [28, 55.75]
  - - [2048, 8192, 1, 512, 2048, 2048, 2048, 8192]
    - [60, 85.3]
  - - [2048, 8192, 1, 1024, 2048, 2048, 2048, 8192]
    - [16, 108.74]
  - - [2048, 8192, 1, 2048, 2048, 2048, 2048, 8192]
    - [11, 136.22]
  - - [2048, 8192, 1, 4096, 2048, 2048, 2048, 8192]
    - [14, 161.41]
  - - [2048, 8192, 1, 8192, 2048, 2048, 2048, 8192]
    - [51, 177.41]
  - - [4096, 128, 1, 128, 4096, 4096, 4096, 128]
    - [78, 9.82]
  - - [4096, 128, 1, 256, 4096, 4096, 4096, 128]
    - [80, 17.01]
  - - [4096, 128, 1, 512, 4096, 4096, 4096, 128]
    - [77, 26.85]
  - - [4096, 128, 1, 1024, 4096, 4096, 4096, 128]
    - [78, 37.98]
  - - [4096, 128, 1, 2048, 4096, 4096, 4096, 128]
    - [81, 46.37]
  - - [4096, 128, 1, 4096, 4096, 4096, 4096, 128]
    - [98, 49.47]
  - - [4096, 128, 1, 8192, 4096, 4096, 4096, 128]
    - [37, 54.62]
  - - [4096, 256, 1, 128, 4096, 4096, 4096, 256]
    - [67, 15.23]
  - - [4096, 256, 1, 256, 4096, 4096, 4096, 256]
    - [65, 26.9]
  - - [4096, 256, 1, 512, 4096, 4096, 4096, 256]
    - [71, 42.01]
  - - [4096, 256, 1, 1024, 4096, 4096, 4096, 256]
    - [71, 58.71]
  - - [4096, 256, 1, 2048, 4096, 4096, 4096, 256]
    - [68, 71.05]
  - - [4096, 256, 1, 4096, 4096, 4096, 4096, 256]
    - [66, 78.88]
  - - [4096, 256, 1, 8192, 4096, 4096, 4096, 256]
    - [32, 81.33]
  - - [4096, 512, 1, 128, 4096, 4096, 4096, 512]
    - [27, 21.61]
  - - [4096, 512, 1, 256, 4096, 4096, 4096, 512]
    - [60, 38.69]
  - - [4096, 512, 1, 512, 4096, 4096, 4096, 512]
    - [60, 61.98]
  - - [4096, 512, 1, 1024, 4096, 4096, 4096, 512]
    - [57, 85.97]
  - - [4096, 512, 1, 2048, 4096, 4096, 4096, 512]
    - [60, 102.97]
  - - [4096, 512, 1, 4096, 4096, 4096, 4096, 512]
    - [57, 113.57]
  - - [4096, 512, 1, 8192, 4096, 4096, 4096, 512]
    - [58, 110.69]
  - - [4096, 1024, 1, 128, 4096, 4096, 4096, 1024]
    - [14, 27.38]
  - - [4096, 1024, 1, 256, 4096, 4096, 4096, 1024]
    - [14, 46.75]
  - - [4096, 1024, 1, 512, 4096, 4096, 4096, 1024]
    - [19, 72.56]
  - - [4096, 1024, 1, 1024, 4096, 4096, 4096, 1024]
    - [18, 99.69]
  - - [4096, 1024, 1, 2048, 4096, 4096, 4096, 1024]
    - [18, 120.68]
  - - [4096, 1024, 1, 4096, 4096, 4096, 4096, 1024]
    - [56, 121.9]
  - - [4096, 1024, 1, 8192, 4096, 4096, 4096, 1024]
    - [22, 131.83]
  - - [4096, 2048, 1, 128, 4096, 4096, 4096, 2048]
    - [14, 30.83]
  - - [4096, 2048, 1, 256, 4096, 4096, 4096, 2048]
    - [14, 52.06]
  - - [4096, 2048, 1, 512, 4096, 4096, 4096, 2048]
    - [18, 79.86]
  - - [4096, 2048, 1, 1024, 4096, 4096, 4096, 2048]
    - [8, 104.52]
  - - [4096, 2048, 1, 2048, 4096, 4096, 4096, 2048]
    - [16, 120.74]
  - - [4096, 2048, 1, 4096, 4096, 4096, 4096, 2048]
    - [52, 140.98]
  - - [4096, 2048, 1, 8192, 4096, 4096, 4096, 2048]
    - [6, 155.77]
  - - [4096, 4096, 1, 128, 4096, 4096, 4096, 4096]
    - [14, 33.53]
  - - [4096, 4096, 1, 256, 4096, 4096, 4096, 4096]
    - [23, 55.66]
  - - [4096, 4096, 1, 512, 4096, 4096, 4096, 4096]
    - [57, 83.37]
  - - [4096, 4096, 1, 1024, 4096, 4096, 4096, 4096]
    - [16, 107.27]
  - - [4096, 4096, 1, 2048, 4096, 4096, 4096, 4096]
    - [14, 138.95]
  - - [4096, 4096, 1, 4096, 4096, 4096, 4096, 4096]
    - [51, 157.49]
  - - [4096, 4096, 1, 8192, 4096, 4096, 4096, 4096]
    - [49, 177.92]
  - - [4096, 8192, 1, 128, 4096, 4096, 4096, 8192]
    - [29, 34.83]
  - - [4096, 8192, 1, 256, 4096, 4096, 4096, 8192]
    - [21, 58.64]
  - - [4096, 8192, 1, 512, 4096, 4096, 4096, 8192]
    - [14, 87.69]
  - - [4096, 8192, 1, 1024, 4096, 4096, 4096, 8192]
    - [58, 114.15]
  - - [4096, 8192, 1, 2048, 4096, 4096, 4096, 8192]
    - [9, 148.84]
  - - [4096, 8192, 1, 4096, 4096, 4096, 4096, 8192]
    - [60, 167.54]
  - - [4096, 8192, 1, 8192, 4096, 4096, 4096, 8192]
    - [51, 189.07]
  - - [8192, 128, 1, 128, 8192, 8192, 8192, 128]
    - [39, 15.08]
  - - [8192, 128, 1, 256, 8192, 8192, 8192, 128]
    - [73, 25.75]
  - - [8192, 128, 1, 512, 8192, 8192, 8192, 128]
    - [74, 41.21]
  - - [8192, 128, 1, 1024, 8192, 8192, 8192, 128]
    - [74, 56.06]
  - - [8192, 128, 1, 2048, 8192, 8192, 8192, 128]
    - [74, 65.99]
  - - [8192, 128, 1, 4096, 8192, 8192, 8192, 128]
    - [71, 73.88]
  - - [8192, 128, 1, 8192, 8192, 8192, 8192, 128]
    - [33, 77.87]
  - - [8192, 256, 1, 128, 8192, 8192, 8192, 256]
    - [25, 21.81]
  - - [8192, 256, 1, 256, 8192, 8192, 8192, 256]
    - [60, 37.97]
  - - [8192, 256, 1, 512, 8192, 8192, 8192, 256]
    - [60, 60.77]
  - - [8192, 256, 1, 1024, 8192, 8192, 8192, 256]
    - [60, 80.29]
  - - [8192, 256, 1, 2048, 8192, 8192, 8192, 256]
    - [57, 100.97]
  - - [8192, 256, 1, 4096, 8192, 8192, 8192, 256]
    - [58, 110.22]
  - - [8192, 256, 1, 8192, 8192, 8192, 8192, 256]
    - [60, 106.08]
  - - [8192, 512, 1, 128, 8192, 8192, 8192, 512]
    - [21, 27.84]
  - - [8192, 512, 1, 256, 8192, 8192, 8192, 512]
    - [18, 47.98]
  - - [8192, 512, 1, 512, 8192, 8192, 8192, 512]
    - [22, 73.74]
  - - [8192, 512, 1, 1024, 8192, 8192, 8192, 512]
    - [20, 101.04]
  - - [8192, 512, 1, 2048, 8192, 8192, 8192, 512]
    - [18, 119.69]
  - - [8192, 512, 1, 4096, 8192, 8192, 8192, 512]
    - [22, 119.23]
  - - [8192, 512, 1, 8192, 8192, 8192, 8192, 512]
    - [15, 126.22]
  - - [8192, 1024, 1, 128, 8192, 8192, 8192, 1024]
    - [14, 31.34]
  - - [8192, 1024, 1, 256, 8192, 8192, 8192, 1024]
    - [16, 52.33]
  - - [8192, 1024, 1, 512, 8192, 8192, 8192, 1024]
    - [16, 78.92]
  - - [8192, 1024, 1, 1024, 8192, 8192, 8192, 1024]
    - [5, 105.24]
  - - [8192, 1024, 1, 2048, 8192, 8192, 8192, 1024]
    - [16, 121.99]
  - - [8192, 1024, 1, 4096, 8192, 8192, 8192, 1024]
    - [54, 140.44]
  - - [8192, 1024, 1, 8192, 8192, 8192, 8192, 1024]
    - [8, 156.07]
  - - [8192, 2048, 1, 128, 8192, 8192, 8192, 2048]
    - [14, 33.13]
  - - [8192, 2048, 1, 256, 8192, 8192, 8192, 2048]
    - [16, 54.96]
  - - [8192, 2048, 1, 512, 8192, 8192, 8192, 2048]
    - [59, 82.76]
  - - [8192, 2048, 1, 1024, 8192, 8192, 8192, 2048]
    - [13, 108.77]
  - - [8192, 2048, 1, 2048, 8192, 8192, 8192, 2048]
    - [53, 137.7]
  - - [8192, 2048, 1, 4096, 8192, 8192, 8192, 2048]
    - [2, 163.32]
  - - [8192, 2048, 1, 8192, 8192, 8192, 8192, 2048]
    - [50, 181.84]
  - - [8192, 4096, 1, 128, 8192, 8192, 8192, 4096]
    - [29, 34.83]
  - - [8192, 4096, 1, 256, 8192, 8192, 8192, 4096]
    - [16, 60.23]
  - - [8192, 4096, 1, 512, 8192, 8192, 8192, 4096]
    - [16, 89.05]
  - - [8192, 4096, 1, 1024, 8192, 8192, 8192, 4096]
    - [14, 121.97]
  - - [8192, 4096, 1, 2048, 8192, 8192, 8192, 4096]
    - [10, 151.4]
  - - [8192, 4096, 1, 4096, 8192, 8192, 8192, 4096]
    - [2, 180.21]
  - - [8192, 4096, 1, 8192, 8192, 8192, 8192, 4096]
    - [2, 196.03]
  - - [8192, 8192, 1, 128, 8192, 8192, 8192, 8192]
    - [22, 37.9]
  - - [8192, 8192, 1, 256, 8192, 8192, 8192, 8192]
    - [12, 62.36]
  - - [8192, 8192, 1, 512, 8192, 8192, 8192, 8192]
    - [16, 94.93]
  - - [8192, 8192, 1, 1024, 8192, 8192, 8192, 8192]
    - [16, 130.47]
  - - [8192, 8192, 1, 2048, 8192, 8192, 8192, 8192]
    - [18, 163.46]
  - - [8192, 8192, 1, 4096, 8192, 8192, 8192, 8192]
    - [0, 186.64]
  - - [8192, 8192, 1, 8192, 8192, 8192, 8192, 8192]
    - [3, 201.6]
- null
- null
- ExperimentalStreamK
- GridBased
