projects/hipblaslt/library/src/amd_detail/rocblaslt/src/Tensile/Logic/asm_full/aquavanjaram/gfx942_228cu/StreamK/aquavanjaram942_Cijk_Ailk_Bjlk_B8F8NB8NS_BH_Bias_HAS_SAV_UserArgs.yaml
- {MinimumRequiredVersion: 4.33.0}
- aquavanjaram942
- {Architecture: gfx942, CUCount: 228}
- [Device 0049, Device 0050]
    SolutionIndex: 0
    SolutionNameMin: Cijk_Ailk_Bjlk_B8F8NB8NS_BH_Bias_HAS_SAV_UserArgs_MT256x256x64_MI16x16x1_SN_LDSB0_CLR1_GRVWA16_GRVWB4_GSU0_GSUC0_GSUWGMRR0_K1_LBSPPA2048_LBSPPB2048_LPA0_LPB0_MIWT8_8_PLR1_SU0_SUM0_SUS64_VWA8_VWB8_WGM1_WGMXCC1_WGMXCCGn1
    SolutionIndex: 1
    SolutionNameMin: Cijk_Ailk_Bjlk_B8F8NB8NS_BH_Bias_HAS_SAV_UserArgs_MT256x256x64_MI16x16x1_SN_LDSB0_CLR1_GRVWA4_GRVWB8_GSU0_GSUC0_GSUWGMRR0_K1_LBSPPA2048_LBSPPB2048_LPA0_LPB0_MIWT8_8_PLR1_SU0_SUM0_SUS64_VWA8_VWB8_WGM1_WGMXCC1_WGMXCCGn1
    SolutionIndex: 2
    SolutionNameMin: Cijk_Ailk_Bjlk_B8F8NB8NS_BH_Bias_HAS_SAV_UserArgs_MT256x256x64_MI16x16x1_SN_LDSB0_CLR1_GRVWA4_GRVWB16_GSU0_GSUC0_GSUWGMRR0_K1_LBSPPA2048_LBSPPB2048_LPA0_LPB0_MIWT8_8_PLR1_SU0_SUM0_SUS64_VWA8_VWB8_WGM1_WGMXCC1_WGMXCCGn1
    SolutionIndex: 3
    SolutionNameMin: Cijk_Ailk_Bjlk_B8F8NB8NS_BH_Bias_HAS_SAV_UserArgs_MT256x256x64_MI16x16x1_SN_LDSB0_CLR1_GRVWA16_GRVWB16_GSU0_GSUC0_GSUWGMRR0_K1_LBSPPA2048_LBSPPB2048_LPA0_LPB0_MIWT8_8_PLR1_SU0_SUM0_SUS64_VWA8_VWB8_WGM1_WGMXCC1_WGMXCCGn1
    SolutionIndex: 4
    SolutionNameMin: Cijk_Ailk_Bjlk_B8F8NB8NS_BH_Bias_HAS_SAV_UserArgs_MT256x256x64_MI16x16x1_SN_LDSB0_CLR1_GRVWA16_GRVWB4_GSU0_GSUC0_GSUWGMRR0_K1_LBSPPA2048_LBSPPB2048_LPA0_LPB0_MIWT8_8_PLR1_SU0_SUM0_SUS64_VWA8_VWB8_WGM4_WGMXCC1_WGMXCCGn1
    SolutionIndex: 5
    SolutionNameMin: Cijk_Ailk_Bjlk_B8F8NB8NS_BH_Bias_HAS_SAV_UserArgs_MT256x256x64_MI16x16x1_SN_LDSB0_CLR1_GRVWA4_GRVWB8_GSU0_GSUC0_GSUWGMRR0_K1_LBSPPA2048_LBSPPB2048_LPA0_LPB0_MIWT8_8_PLR1_SU0_SUM0_SUS64_VWA8_VWB8_WGM4_WGMXCC1_WGMXCCGn1
    SolutionIndex: 6
    SolutionNameMin: Cijk_Ailk_Bjlk_B8F8NB8NS_BH_Bias_HAS_SAV_UserArgs_MT256x256x64_MI16x16x1_SN_LDSB0_CLR1_GRVWA16_GRVWB16_GSU0_GSUC0_GSUWGMRR0_K1_LBSPPA2048_LBSPPB2048_LPA0_LPB0_MIWT8_8_PLR1_SU0_SUM0_SUS64_VWA8_VWB8_WGM4_WGMXCC1_WGMXCCGn1
    SolutionIndex: 7
    SolutionNameMin: Cijk_Ailk_Bjlk_B8F8NB8NS_BH_Bias_HAS_SAV_UserArgs_MT256x256x64_MI16x16x1_SN_LDSB0_CLR1_GRVWA16_GRVWB4_GSU0_GSUC0_GSUWGMRR0_K1_LBSPPA2048_LBSPPB2048_LPA0_LPB0_MIWT8_8_PLR1_SU0_SUM0_SUS64_VWA8_VWB8_WGM6_WGMXCC1_WGMXCCGn1
    SolutionIndex: 8
    SolutionNameMin: Cijk_Ailk_Bjlk_B8F8NB8NS_BH_Bias_HAS_SAV_UserArgs_MT256x256x64_MI16x16x1_SN_LDSB0_CLR1_GRVWA4_GRVWB16_GSU0_GSUC0_GSUWGMRR0_K1_LBSPPA2048_LBSPPB2048_LPA0_LPB0_MIWT8_8_PLR1_SU0_SUM0_SUS64_VWA8_VWB8_WGM6_WGMXCC1_WGMXCCGn1
    SolutionIndex: 9
    SolutionNameMin: Cijk_Ailk_Bjlk_B8F8NB8NS_BH_Bias_HAS_SAV_UserArgs_MT256x256x64_MI16x16x1_SN_LDSB0_CLR1_GRVWA8_GRVWB16_GSU0_GSUC0_GSUWGMRR0_K1_LBSPPA2048_LBSPPB2048_LPA0_LPB0_MIWT8_8_PLR1_SU0_SUM0_SUS64_VWA8_VWB8_WGM6_WGMXCC1_WGMXCCGn1
    SolutionIndex: 10
    SolutionNameMin: Cijk_Ailk_Bjlk_B8F8NB8NS_BH_Bias_HAS_SAV_UserArgs_MT256x256x64_MI16x16x1_SN_LDSB0_CLR1_GRVWA16_GRVWB16_GSU0_GSUC0_GSUWGMRR0_K1_LBSPPA2048_LBSPPB2048_LPA0_LPB0_MIWT8_8_PLR1_SU0_SUM0_SUS64_VWA8_VWB8_WGM6_WGMXCC1_WGMXCCGn1
    SolutionIndex: 11
    SolutionNameMin: Cijk_Ailk_Bjlk_B8F8NB8NS_BH_Bias_HAS_SAV_UserArgs_MT256x256x64_MI16x16x1_SN_LDSB0_CLR1_GRVWA4_GRVWB4_GSU0_GSUC0_GSUWGMRR0_K1_LBSPPA2048_LBSPPB2048_LPA0_LPB0_MIWT8_8_PLR1_SU0_SUM0_SUS64_VWA8_VWB8_WGM8_WGMXCC1_WGMXCCGn1
    SolutionIndex: 12
    SolutionNameMin: Cijk_Ailk_Bjlk_B8F8NB8NS_BH_Bias_HAS_SAV_UserArgs_MT256x256x64_MI16x16x1_SN_LDSB0_CLR1_GRVWA16_GRVWB4_GSU0_GSUC0_GSUWGMRR0_K1_LBSPPA2048_LBSPPB2048_LPA0_LPB0_MIWT8_8_PLR1_SU0_SUM0_SUS64_VWA8_VWB8_WGM8_WGMXCC1_WGMXCCGn1
    SolutionIndex: 13
    SolutionNameMin: Cijk_Ailk_Bjlk_B8F8NB8NS_BH_Bias_HAS_SAV_UserArgs_MT256x256x64_MI16x16x1_SN_LDSB0_CLR1_GRVWA4_GRVWB8_GSU0_GSUC0_GSUWGMRR0_K1_LBSPPA2048_LBSPPB2048_LPA0_LPB0_MIWT8_8_PLR1_SU0_SUM0_SUS64_VWA8_VWB8_WGM8_WGMXCC1_WGMXCCGn1
    SolutionIndex: 14
    SolutionNameMin: Cijk_Ailk_Bjlk_B8F8NB8NS_BH_Bias_HAS_SAV_UserArgs_MT256x256x64_MI16x16x1_SN_LDSB0_CLR1_GRVWA16_GRVWB16_GSU0_GSUC0_GSUWGMRR0_K1_LBSPPA2048_LBSPPB2048_LPA0_LPB0_MIWT8_8_PLR1_SU0_SUM0_SUS64_VWA8_VWB8_WGM8_WGMXCC1_WGMXCCGn1
    SolutionIndex: 15
    SolutionNameMin: Cijk_Ailk_Bjlk_B8F8NB8NS_BH_Bias_HAS_SAV_UserArgs_MT128x256x64_MI16x16x1_SN_LDSB1_CLR1_GRVWA4_GRVWB16_GSU0_GSUC0_GSUWGMRR0_K1_LBSPPA1024_LBSPPB2048_LPA64_LPB0_MIWT4_8_PLR1_SU0_SUM0_SUS64_VWA4_VWB8_WGM1_WGMXCC1_WGMXCCGn1
    SolutionIndex: 16
    SolutionNameMin: Cijk_Ailk_Bjlk_B8F8NB8NS_BH_Bias_HAS_SAV_UserArgs_MT128x256x64_MI16x16x1_SN_LDSB1_CLR1_GRVWA16_GRVWB16_GSU0_GSUC0_GSUWGMRR0_K1_LBSPPA1024_LBSPPB2048_LPA64_LPB0_MIWT4_8_PLR1_SU0_SUM0_SUS64_VWA4_VWB8_WGM1_WGMXCC1_WGMXCCGn1
    SolutionIndex: 17
    SolutionNameMin: Cijk_Ailk_Bjlk_B8F8NB8NS_BH_Bias_HAS_SAV_UserArgs_MT128x256x64_MI16x16x1_SN_LDSB1_CLR1_GRVWA4_GRVWB16_GSU0_GSUC0_GSUWGMRR0_K1_LBSPPA1024_LBSPPB2048_LPA64_LPB0_MIWT4_8_PLR1_SU0_SUM0_SUS64_VWA4_VWB8_WGM4_WGMXCC1_WGMXCCGn1
    SolutionIndex: 18
    SolutionNameMin: Cijk_Ailk_Bjlk_B8F8NB8NS_BH_Bias_HAS_SAV_UserArgs_MT128x256x64_MI16x16x1_SN_LDSB1_CLR1_GRVWA16_GRVWB16_GSU0_GSUC0_GSUWGMRR0_K1_LBSPPA1024_LBSPPB2048_LPA64_LPB0_MIWT4_8_PLR1_SU0_SUM0_SUS64_VWA4_VWB8_WGM4_WGMXCC1_WGMXCCGn1
    SolutionIndex: 19
    SolutionNameMin: Cijk_Ailk_Bjlk_B8F8NB8NS_BH_Bias_HAS_SAV_UserArgs_MT128x256x64_MI16x16x1_SN_LDSB1_CLR1_GRVWA8_GRVWB8_GSU0_GSUC0_GSUWGMRR0_K1_LBSPPA1024_LBSPPB2048_LPA64_LPB0_MIWT4_8_PLR1_SU0_SUM0_SUS64_VWA4_VWB8_WGM6_WGMXCC1_WGMXCCGn1
    SolutionIndex: 20
    SolutionNameMin: Cijk_Ailk_Bjlk_B8F8NB8NS_BH_Bias_HAS_SAV_UserArgs_MT128x256x64_MI16x16x1_SN_LDSB1_CLR1_GRVWA16_GRVWB16_GSU0_GSUC0_GSUWGMRR0_K1_LBSPPA1024_LBSPPB2048_LPA64_LPB0_MIWT4_8_PLR1_SU0_SUM0_SUS64_VWA4_VWB8_WGM6_WGMXCC1_WGMXCCGn1
    SolutionIndex: 21
    SolutionNameMin: Cijk_Ailk_Bjlk_B8F8NB8NS_BH_Bias_HAS_SAV_UserArgs_MT128x256x64_MI16x16x1_SN_LDSB1_CLR1_GRVWA16_GRVWB16_GSU0_GSUC0_GSUWGMRR0_K1_LBSPPA1024_LBSPPB2048_LPA64_LPB0_MIWT4_8_PLR1_SU0_SUM0_SUS64_VWA4_VWB8_WGM8_WGMXCC1_WGMXCCGn1
    SolutionIndex: 22
    SolutionNameMin: Cijk_Ailk_Bjlk_B8F8NB8NS_BH_Bias_HAS_SAV_UserArgs_MT256x144x64_MI16x16x1_SN_LDSB0_CLR1_GRVWA4_GRVWB4_GSU0_GSUC0_GSUWGMRR0_K1_LBSPPA2048_LBSPPB1152_LPA64_LPB16_MIWT4_9_PLR1_SU0_SUM0_SUS64_VWA4_VWB1_WGM1_WGMXCC1_WGMXCCGn1
    SolutionIndex: 23
    SolutionNameMin: Cijk_Ailk_Bjlk_B8F8NB8NS_BH_Bias_HAS_SAV_UserArgs_MT256x144x64_MI16x16x1_SN_LDSB0_CLR1_GRVWA16_GRVWB4_GSU0_GSUC0_GSUWGMRR0_K1_LBSPPA2048_LBSPPB1152_LPA64_LPB16_MIWT4_9_PLR1_SU0_SUM0_SUS64_VWA4_VWB1_WGM1_WGMXCC1_WGMXCCGn1
    SolutionIndex: 24
    SolutionNameMin: Cijk_Ailk_Bjlk_B8F8NB8NS_BH_Bias_HAS_SAV_UserArgs_MT256x144x64_MI16x16x1_SN_LDSB0_CLR1_GRVWA16_GRVWB4_GSU0_GSUC0_GSUWGMRR0_K1_LBSPPA2048_LBSPPB1152_LPA64_LPB16_MIWT4_9_PLR1_SU0_SUM0_SUS64_VWA4_VWB1_WGM4_WGMXCC1_WGMXCCGn1
    SolutionIndex: 25
    SolutionNameMin: Cijk_Ailk_Bjlk_B8F8NB8NS_BH_Bias_HAS_SAV_UserArgs_MT256x144x64_MI16x16x1_SN_LDSB0_CLR1_GRVWA4_GRVWB4_GSU0_GSUC0_GSUWGMRR0_K1_LBSPPA2048_LBSPPB1152_LPA64_LPB16_MIWT4_9_PLR1_SU0_SUM0_SUS64_VWA4_VWB1_WGM8_WGMXCC1_WGMXCCGn1
    SolutionIndex: 26
    SolutionNameMin: Cijk_Ailk_Bjlk_B8F8NB8NS_BH_Bias_HAS_SAV_UserArgs_MT256x128x64_MI16x16x1_SN_LDSB1_CLR1_GRVWA16_GRVWB4_GSU0_GSUC0_GSUWGMRR0_K1_LBSPPA2048_LBSPPB1024_LPA0_LPB64_MIWT8_4_PLR1_SU0_SUM0_SUS64_VWA8_VWB4_WGM1_WGMXCC1_WGMXCCGn1
    SolutionIndex: 27
    SolutionNameMin: Cijk_Ailk_Bjlk_B8F8NB8NS_BH_Bias_HAS_SAV_UserArgs_MT256x128x64_MI16x16x1_SN_LDSB1_CLR1_GRVWA4_GRVWB8_GSU0_GSUC0_GSUWGMRR0_K1_LBSPPA2048_LBSPPB1024_LPA0_LPB64_MIWT8_4_PLR1_SU0_SUM0_SUS64_VWA8_VWB4_WGM1_WGMXCC1_WGMXCCGn1
    SolutionIndex: 28
    SolutionNameMin: Cijk_Ailk_Bjlk_B8F8NB8NS_BH_Bias_HAS_SAV_UserArgs_MT256x128x64_MI16x16x1_SN_LDSB1_CLR1_GRVWA8_GRVWB8_GSU0_GSUC0_GSUWGMRR0_K1_LBSPPA2048_LBSPPB1024_LPA0_LPB64_MIWT8_4_PLR1_SU0_SUM0_SUS64_VWA8_VWB4_WGM1_WGMXCC1_WGMXCCGn1
    SolutionIndex: 29
    SolutionNameMin: Cijk_Ailk_Bjlk_B8F8NB8NS_BH_Bias_HAS_SAV_UserArgs_MT256x128x64_MI16x16x1_SN_LDSB1_CLR1_GRVWA16_GRVWB16_GSU0_GSUC0_GSUWGMRR0_K1_LBSPPA2048_LBSPPB1024_LPA0_LPB64_MIWT8_4_PLR1_SU0_SUM0_SUS64_VWA8_VWB4_WGM1_WGMXCC1_WGMXCCGn1
    SolutionIndex: 30
    SolutionNameMin: Cijk_Ailk_Bjlk_B8F8NB8NS_BH_Bias_HAS_SAV_UserArgs_MT256x128x64_MI16x16x1_SN_LDSB1_CLR1_GRVWA16_GRVWB16_GSU0_GSUC0_GSUWGMRR0_K1_LBSPPA2048_LBSPPB1024_LPA0_LPB64_MIWT8_4_PLR1_SU0_SUM0_SUS64_VWA8_VWB4_WGM4_WGMXCC1_WGMXCCGn1
    SolutionIndex: 31
    SolutionNameMin: Cijk_Ailk_Bjlk_B8F8NB8NS_BH_Bias_HAS_SAV_UserArgs_MT256x128x64_MI16x16x1_SN_LDSB1_CLR1_GRVWA16_GRVWB8_GSU0_GSUC0_GSUWGMRR0_K1_LBSPPA2048_LBSPPB1024_LPA0_LPB64_MIWT8_4_PLR1_SU0_SUM0_SUS64_VWA8_VWB4_WGM6_WGMXCC1_WGMXCCGn1
    SolutionIndex: 32
    SolutionNameMin: Cijk_Ailk_Bjlk_B8F8NB8NS_BH_Bias_HAS_SAV_UserArgs_MT256x128x64_MI16x16x1_SN_LDSB1_CLR1_GRVWA16_GRVWB16_GSU0_GSUC0_GSUWGMRR0_K1_LBSPPA2048_LBSPPB1024_LPA0_LPB64_MIWT8_4_PLR1_SU0_SUM0_SUS64_VWA8_VWB4_WGM6_WGMXCC1_WGMXCCGn1
    SolutionIndex: 33
    SolutionNameMin: Cijk_Ailk_Bjlk_B8F8NB8NS_BH_Bias_HAS_SAV_UserArgs_MT256x128x64_MI16x16x1_SN_LDSB1_CLR1_GRVWA8_GRVWB8_GSU0_GSUC0_GSUWGMRR0_K1_LBSPPA2048_LBSPPB1024_LPA0_LPB64_MIWT8_4_PLR1_SU0_SUM0_SUS64_VWA8_VWB4_WGM8_WGMXCC1_WGMXCCGn1
    SolutionIndex: 34
    SolutionNameMin: Cijk_Ailk_Bjlk_B8F8NB8NS_BH_Bias_HAS_SAV_UserArgs_MT256x128x64_MI16x16x1_SN_LDSB1_CLR1_GRVWA16_GRVWB16_GSU0_GSUC0_GSUWGMRR0_K1_LBSPPA2048_LBSPPB1024_LPA0_LPB64_MIWT8_4_PLR1_SU0_SUM0_SUS64_VWA8_VWB4_WGM8_WGMXCC1_WGMXCCGn1
    SolutionIndex: 35
    SolutionNameMin: Cijk_Ailk_Bjlk_B8F8NB8NS_BH_Bias_HAS_SAV_UserArgs_MT128x128x64_MI16x16x1_SN_LDSB1_CLR1_GRVWA4_GRVWB8_GSU0_GSUC0_GSUWGMRR0_K1_LBSPPA1024_LBSPPB1024_LPA64_LPB64_MIWT4_4_PLR1_SU0_SUM0_SUS64_VWA4_VWB4_WGM1_WGMXCC1_WGMXCCGn1
    SolutionIndex: 36
    SolutionNameMin: Cijk_Ailk_Bjlk_B8F8NB8NS_BH_Bias_HAS_SAV_UserArgs_MT128x128x64_MI16x16x1_SN_LDSB1_CLR1_GRVWA4_GRVWB16_GSU0_GSUC0_GSUWGMRR0_K1_LBSPPA1024_LBSPPB1024_LPA64_LPB64_MIWT4_4_PLR1_SU0_SUM0_SUS64_VWA4_VWB4_WGM1_WGMXCC1_WGMXCCGn1
    SolutionIndex: 37
    SolutionNameMin: Cijk_Ailk_Bjlk_B8F8NB8NS_BH_Bias_HAS_SAV_UserArgs_MT128x128x64_MI16x16x1_SN_LDSB1_CLR1_GRVWA8_GRVWB16_GSU0_GSUC0_GSUWGMRR0_K1_LBSPPA1024_LBSPPB1024_LPA64_LPB64_MIWT4_4_PLR1_SU0_SUM0_SUS64_VWA4_VWB4_WGM1_WGMXCC1_WGMXCCGn1
    SolutionIndex: 38
    SolutionNameMin: Cijk_Ailk_Bjlk_B8F8NB8NS_BH_Bias_HAS_SAV_UserArgs_MT128x128x64_MI16x16x1_SN_LDSB1_CLR1_GRVWA16_GRVWB16_GSU0_GSUC0_GSUWGMRR0_K1_LBSPPA1024_LBSPPB1024_LPA64_LPB64_MIWT4_4_PLR1_SU0_SUM0_SUS64_VWA4_VWB4_WGM1_WGMXCC1_WGMXCCGn1
    SolutionIndex: 39
    SolutionNameMin: Cijk_Ailk_Bjlk_B8F8NB8NS_BH_Bias_HAS_SAV_UserArgs_MT128x128x64_MI16x16x1_SN_LDSB1_CLR1_GRVWA8_GRVWB16_GSU0_GSUC0_GSUWGMRR0_K1_LBSPPA1024_LBSPPB1024_LPA64_LPB64_MIWT4_4_PLR1_SU0_SUM0_SUS64_VWA4_VWB4_WGM4_WGMXCC1_WGMXCCGn1
    SolutionIndex: 40
    SolutionNameMin: Cijk_Ailk_Bjlk_B8F8NB8NS_BH_Bias_HAS_SAV_UserArgs_MT128x128x64_MI16x16x1_SN_LDSB1_CLR1_GRVWA16_GRVWB16_GSU0_GSUC0_GSUWGMRR0_K1_LBSPPA1024_LBSPPB1024_LPA64_LPB64_MIWT4_4_PLR1_SU0_SUM0_SUS64_VWA4_VWB4_WGM4_WGMXCC1_WGMXCCGn1
    SolutionIndex: 41
    SolutionNameMin: Cijk_Ailk_Bjlk_B8F8NB8NS_BH_Bias_HAS_SAV_UserArgs_MT128x128x64_MI16x16x1_SN_LDSB1_CLR1_GRVWA8_GRVWB16_GSU0_GSUC0_GSUWGMRR0_K1_LBSPPA1024_LBSPPB1024_LPA64_LPB64_MIWT4_4_PLR1_SU0_SUM0_SUS64_VWA4_VWB4_WGM6_WGMXCC1_WGMXCCGn1
    SolutionIndex: 42
    SolutionNameMin: Cijk_Ailk_Bjlk_B8F8NB8NS_BH_Bias_HAS_SAV_UserArgs_MT128x128x64_MI16x16x1_SN_LDSB1_CLR1_GRVWA16_GRVWB16_GSU0_GSUC0_GSUWGMRR0_K1_LBSPPA1024_LBSPPB1024_LPA64_LPB64_MIWT4_4_PLR1_SU0_SUM0_SUS64_VWA4_VWB4_WGM6_WGMXCC1_WGMXCCGn1
    SolutionIndex: 43
    SolutionNameMin: Cijk_Ailk_Bjlk_B8F8NB8NS_BH_Bias_HAS_SAV_UserArgs_MT128x128x64_MI16x16x1_SN_LDSB1_CLR1_GRVWA16_GRVWB16_GSU0_GSUC0_GSUWGMRR0_K1_LBSPPA1024_LBSPPB1024_LPA64_LPB64_MIWT4_4_PLR1_SU0_SUM0_SUS64_VWA4_VWB4_WGM8_WGMXCC1_WGMXCCGn1
    SolutionIndex: 44
    SolutionNameMin: Cijk_Ailk_Bjlk_B8F8NB8NS_BH_Bias_HAS_SAV_UserArgs_MT64x128x64_MI16x16x1_SN_LDSB0_CLR1_GRVWA16_GRVWB16_GSU0_GSUC0_GSUWGMRR0_K1_LBSPPA512_LBSPPB1024_LPA32_LPB64_MIWT2_4_PLR1_SU0_SUM0_SUS64_VWA2_VWB4_WGM1_WGMXCC1_WGMXCCGn1
    SolutionIndex: 45
    SolutionNameMin: Cijk_Ailk_Bjlk_B8F8NB8NS_BH_Bias_HAS_SAV_UserArgs_MT128x64x64_MI16x16x1_SN_LDSB0_CLR1_GRVWA4_GRVWB8_GSU0_GSUC0_GSUWGMRR0_K1_LBSPPA1024_LBSPPB512_LPA64_LPB32_MIWT4_2_PLR1_SU0_SUM0_SUS64_VWA4_VWB2_WGM1_WGMXCC1_WGMXCCGn1
    SolutionIndex: 46
    SolutionNameMin: Cijk_Ailk_Bjlk_B8F8NB8NS_BH_Bias_HAS_SAV_UserArgs_MT128x64x64_MI16x16x1_SN_LDSB0_CLR1_GRVWA8_GRVWB8_GSU0_GSUC0_GSUWGMRR0_K1_LBSPPA1024_LBSPPB512_LPA64_LPB32_MIWT4_2_PLR1_SU0_SUM0_SUS64_VWA4_VWB2_WGM1_WGMXCC1_WGMXCCGn1
    SolutionIndex: 47
    SolutionNameMin: Cijk_Ailk_Bjlk_B8F8NB8NS_BH_Bias_HAS_SAV_UserArgs_MT128x64x64_MI16x16x1_SN_LDSB0_CLR1_GRVWA16_GRVWB8_GSU0_GSUC0_GSUWGMRR0_K1_LBSPPA1024_LBSPPB512_LPA64_LPB32_MIWT4_2_PLR1_SU0_SUM0_SUS64_VWA4_VWB2_WGM1_WGMXCC1_WGMXCCGn1
    SolutionIndex: 48
    SolutionNameMin: Cijk_Ailk_Bjlk_B8F8NB8NS_BH_Bias_HAS_SAV_UserArgs_MT128x64x64_MI16x16x1_SN_LDSB0_CLR1_GRVWA4_GRVWB8_GSU0_GSUC0_GSUWGMRR0_K1_LBSPPA1024_LBSPPB512_LPA64_LPB32_MIWT4_2_PLR1_SU0_SUM0_SUS64_VWA4_VWB2_WGM4_WGMXCC1_WGMXCCGn1
    SolutionIndex: 49
    SolutionNameMin: Cijk_Ailk_Bjlk_B8F8NB8NS_BH_Bias_HAS_SAV_UserArgs_MT128x64x64_MI16x16x1_SN_LDSB0_CLR1_GRVWA4_GRVWB8_GSU0_GSUC0_GSUWGMRR0_K1_LBSPPA1024_LBSPPB512_LPA64_LPB32_MIWT4_2_PLR1_SU0_SUM0_SUS64_VWA4_VWB2_WGM8_WGMXCC1_WGMXCCGn1
    SolutionIndex: 50
    SolutionNameMin: Cijk_Ailk_Bjlk_B8F8NB8NS_BH_Bias_HAS_SAV_UserArgs_MT128x32x64_MI16x16x1_SN_LDSB0_CLR1_GRVWA8_GRVWB4_GSU0_GSUC0_GSUWGMRR0_K1_LBSPPA1024_LBSPPB256_LPA64_LPB16_MIWT4_1_PLR1_SU0_SUM0_SUS64_VWA4_VWB1_WGM1_WGMXCC1_WGMXCCGn1
    SolutionIndex: 51
    SolutionNameMin: Cijk_Ailk_Bjlk_B8F8NB8NS_BH_Bias_HAS_SAV_UserArgs_MT128x32x64_MI16x16x1_SN_LDSB0_CLR1_GRVWA4_GRVWB8_GSU0_GSUC0_GSUWGMRR0_K1_LBSPPA1024_LBSPPB256_LPA64_LPB16_MIWT4_1_PLR1_SU0_SUM0_SUS64_VWA4_VWB1_WGM1_WGMXCC1_WGMXCCGn1
    SolutionIndex: 52
    SolutionNameMin: Cijk_Ailk_Bjlk_B8F8NB8NS_BH_Bias_HAS_SAV_UserArgs_MT64x64x64_MI16x16x1_SN_LDSB0_CLR1_GRVWA4_GRVWB4_GSU0_GSUC0_GSUWGMRR0_K1_LBSPPA512_LBSPPB512_LPA32_LPB32_MIWT2_2_PLR1_SU0_SUM0_SUS64_VWA2_VWB2_WGM1_WGMXCC1_WGMXCCGn1
    SolutionIndex: 53
    SolutionNameMin: Cijk_Ailk_Bjlk_B8F8NB8NS_BH_Bias_HAS_SAV_UserArgs_MT64x64x64_MI16x16x1_SN_LDSB0_CLR1_GRVWA8_GRVWB4_GSU0_GSUC0_GSUWGMRR0_K1_LBSPPA512_LBSPPB512_LPA32_LPB32_MIWT2_2_PLR1_SU0_SUM0_SUS64_VWA2_VWB2_WGM1_WGMXCC1_WGMXCCGn1
    SolutionIndex: 54
    SolutionNameMin: Cijk_Ailk_Bjlk_B8F8NB8NS_BH_Bias_HAS_SAV_UserArgs_MT64x64x64_MI16x16x1_SN_LDSB0_CLR1_GRVWA4_GRVWB8_GSU0_GSUC0_GSUWGMRR0_K1_LBSPPA512_LBSPPB512_LPA32_LPB32_MIWT2_2_PLR1_SU0_SUM0_SUS64_VWA2_VWB2_WGM1_WGMXCC1_WGMXCCGn1
    SolutionIndex: 55
    SolutionNameMin: Cijk_Ailk_Bjlk_B8F8NB8NS_BH_Bias_HAS_SAV_UserArgs_MT64x64x64_MI16x16x1_SN_LDSB0_CLR1_GRVWA8_GRVWB8_GSU0_GSUC0_GSUWGMRR0_K1_LBSPPA512_LBSPPB512_LPA32_LPB32_MIWT2_2_PLR1_SU0_SUM0_SUS64_VWA2_VWB2_WGM1_WGMXCC1_WGMXCCGn1
    SolutionIndex: 56
    SolutionNameMin: Cijk_Ailk_Bjlk_B8F8NB8NS_BH_Bias_HAS_SAV_UserArgs_MT64x32x64_MI16x16x1_SN_LDSB0_CLR1_GRVWA4_GRVWB4_GSU0_GSUC0_GSUWGMRR0_K1_LBSPPA512_LBSPPB256_LPA32_LPB16_MIWT2_1_PLR1_SU0_SUM0_SUS64_VWA2_VWB1_WGM1_WGMXCC1_WGMXCCGn1
    SolutionIndex: 57
    SolutionNameMin: Cijk_Ailk_Bjlk_B8F8NB8NS_BH_Bias_HAS_SAV_UserArgs_MT64x32x64_MI16x16x1_SN_LDSB0_CLR1_GRVWA8_GRVWB4_GSU0_GSUC0_GSUWGMRR0_K1_LBSPPA512_LBSPPB256_LPA32_LPB16_MIWT2_1_PLR1_SU0_SUM0_SUS64_VWA2_VWB1_WGM1_WGMXCC1_WGMXCCGn1
    SolutionIndex: 58
    SolutionNameMin: Cijk_Ailk_Bjlk_B8F8NB8NS_BH_Bias_HAS_SAV_UserArgs_MT64x32x64_MI16x16x1_SN_LDSB0_CLR1_GRVWA4_GRVWB8_GSU0_GSUC0_GSUWGMRR0_K1_LBSPPA512_LBSPPB256_LPA32_LPB16_MIWT2_1_PLR1_SU0_SUM0_SUS64_VWA2_VWB1_WGM1_WGMXCC1_WGMXCCGn1
    SolutionIndex: 59
    SolutionNameMin: Cijk_Ailk_Bjlk_B8F8NB8NS_BH_Bias_HAS_SAV_UserArgs_MT64x32x64_MI16x16x1_SN_LDSB0_CLR1_GRVWA8_GRVWB8_GSU0_GSUC0_GSUWGMRR0_K1_LBSPPA512_LBSPPB256_LPA32_LPB16_MIWT2_1_PLR1_SU0_SUM0_SUS64_VWA2_VWB1_WGM1_WGMXCC1_WGMXCCGn1
    SolutionIndex: 60
    SolutionNameMin: Cijk_Ailk_Bjlk_B8F8NB8NS_BH_Bias_HAS_SAV_UserArgs_MT32x32x64_MI16x16x1_SN_LDSB0_CLR1_GRVWA4_GRVWB4_GSU0_GSUC0_GSUWGMRR0_K1_LBSPPA256_LBSPPB256_LPA16_LPB16_MIWT1_1_PLR1_SU0_SUM0_SUS64_VWA1_VWB1_WGM1_WGMXCC1_WGMXCCGn1
    SolutionIndex: 61
    SolutionNameMin: Cijk_Ailk_Bjlk_B8F8NB8NS_BH_Bias_HAS_SAV_UserArgs_MT32x32x64_MI16x16x1_SN_LDSB0_CLR1_GRVWA8_GRVWB4_GSU0_GSUC0_GSUWGMRR0_K1_LBSPPA256_LBSPPB256_LPA16_LPB16_MIWT1_1_PLR1_SU0_SUM0_SUS64_VWA1_VWB1_WGM1_WGMXCC1_WGMXCCGn1
    SolutionIndex: 62
    SolutionNameMin: Cijk_Ailk_Bjlk_B8F8NB8NS_BH_Bias_HAS_SAV_UserArgs_MT32x32x64_MI16x16x1_SN_LDSB0_CLR1_GRVWA4_GRVWB8_GSU0_GSUC0_GSUWGMRR0_K1_LBSPPA256_LBSPPB256_LPA16_LPB16_MIWT1_1_PLR1_SU0_SUM0_SUS64_VWA1_VWB1_WGM1_WGMXCC1_WGMXCCGn1
    SolutionIndex: 63
    SolutionNameMin: Cijk_Ailk_Bjlk_B8F8NB8NS_BH_Bias_HAS_SAV_UserArgs_MT32x32x64_MI16x16x1_SN_LDSB0_CLR1_GRVWA8_GRVWB8_GSU0_GSUC0_GSUWGMRR0_K1_LBSPPA256_LBSPPB256_LPA16_LPB16_MIWT1_1_PLR1_SU0_SUM0_SUS64_VWA1_VWB1_WGM1_WGMXCC1_WGMXCCGn1
    SolutionIndex: 64
    SolutionNameMin: Cijk_Ailk_Bjlk_B8F8NB8NS_BH_Bias_HAS_SAV_UserArgs_MT256x256x128_MI16x16x1_SN_LDSB1_CLR1_GRVWA8_GRVWB16_GSU0_GSUC0_GSUWGMRR0_K1_LBSPPA2048_LBSPPB2048_LPA0_LPB0_MIWT8_8_PLR1_SU0_SUM0_SUS128_VWA8_VWB8_WGM1_WGMXCC1_WGMXCCGn1
    SolutionIndex: 65
    SolutionNameMin: Cijk_Ailk_Bjlk_B8F8NB8NS_BH_Bias_HAS_SAV_UserArgs_MT256x256x128_MI16x16x1_SN_LDSB1_CLR1_GRVWA16_GRVWB16_GSU0_GSUC0_GSUWGMRR0_K1_LBSPPA2048_LBSPPB2048_LPA0_LPB0_MIWT8_8_PLR1_SU0_SUM0_SUS128_VWA8_VWB8_WGM1_WGMXCC1_WGMXCCGn1
    SolutionIndex: 66
    SolutionNameMin: Cijk_Ailk_Bjlk_B8F8NB8NS_BH_Bias_HAS_SAV_UserArgs_MT256x256x128_MI16x16x1_SN_LDSB1_CLR1_GRVWA16_GRVWB16_GSU0_GSUC0_GSUWGMRR0_K1_LBSPPA2048_LBSPPB2048_LPA0_LPB0_MIWT8_8_PLR1_SU0_SUM0_SUS128_VWA8_VWB8_WGM4_WGMXCC1_WGMXCCGn1
    SolutionIndex: 67
    SolutionNameMin: Cijk_Ailk_Bjlk_B8F8NB8NS_BH_Bias_HAS_SAV_UserArgs_MT256x256x128_MI16x16x1_SN_LDSB1_CLR1_GRVWA16_GRVWB8_GSU0_GSUC0_GSUWGMRR0_K1_LBSPPA2048_LBSPPB2048_LPA0_LPB0_MIWT8_8_PLR1_SU0_SUM0_SUS128_VWA8_VWB8_WGM6_WGMXCC1_WGMXCCGn1
    SolutionIndex: 68
    SolutionNameMin: Cijk_Ailk_Bjlk_B8F8NB8NS_BH_Bias_HAS_SAV_UserArgs_MT256x256x128_MI16x16x1_SN_LDSB1_CLR1_GRVWA16_GRVWB8_GSU0_GSUC0_GSUWGMRR0_K1_LBSPPA2048_LBSPPB2048_LPA0_LPB0_MIWT8_8_PLR1_SU0_SUM0_SUS128_VWA8_VWB8_WGM8_WGMXCC1_WGMXCCGn1
    SolutionIndex: 69
    SolutionNameMin: Cijk_Ailk_Bjlk_B8F8NB8NS_BH_Bias_HAS_SAV_UserArgs_MT256x256x128_MI16x16x1_SN_LDSB1_CLR1_GRVWA8_GRVWB16_GSU0_GSUC0_GSUWGMRR0_K1_LBSPPA2048_LBSPPB2048_LPA0_LPB0_MIWT8_8_PLR1_SU0_SUM0_SUS128_VWA8_VWB8_WGM8_WGMXCC1_WGMXCCGn1
    SolutionIndex: 70
    SolutionNameMin: Cijk_Ailk_Bjlk_B8F8NB8NS_BH_Bias_HAS_SAV_UserArgs_MT256x256x128_MI16x16x1_SN_LDSB1_CLR1_GRVWA16_GRVWB16_GSU0_GSUC0_GSUWGMRR0_K1_LBSPPA2048_LBSPPB2048_LPA0_LPB0_MIWT8_8_PLR1_SU0_SUM0_SUS128_VWA8_VWB8_WGM8_WGMXCC1_WGMXCCGn1
    SolutionIndex: 71
    SolutionNameMin: Cijk_Ailk_Bjlk_B8F8NB8NS_BH_Bias_HAS_SAV_UserArgs_MT128x256x128_MI16x16x1_SN_LDSB1_CLR1_GRVWA4_GRVWB16_GSU0_GSUC0_GSUWGMRR0_K1_LBSPPA1024_LBSPPB2048_LPA64_LPB0_MIWT4_8_PLR1_SU0_SUM0_SUS128_VWA4_VWB8_WGM1_WGMXCC1_WGMXCCGn1
    SolutionIndex: 72
    SolutionNameMin: Cijk_Ailk_Bjlk_B8F8NB8NS_BH_Bias_HAS_SAV_UserArgs_MT128x256x128_MI16x16x1_SN_LDSB1_CLR1_GRVWA16_GRVWB16_GSU0_GSUC0_GSUWGMRR0_K1_LBSPPA1024_LBSPPB2048_LPA64_LPB0_MIWT4_8_PLR1_SU0_SUM0_SUS128_VWA4_VWB8_WGM1_WGMXCC1_WGMXCCGn1
    SolutionIndex: 73
    SolutionNameMin: Cijk_Ailk_Bjlk_B8F8NB8NS_BH_Bias_HAS_SAV_UserArgs_MT128x256x128_MI16x16x1_SN_LDSB1_CLR1_GRVWA4_GRVWB16_GSU0_GSUC0_GSUWGMRR0_K1_LBSPPA1024_LBSPPB2048_LPA64_LPB0_MIWT4_8_PLR1_SU0_SUM0_SUS128_VWA4_VWB8_WGM6_WGMXCC1_WGMXCCGn1
    SolutionIndex: 74
    SolutionNameMin: Cijk_Ailk_Bjlk_B8F8NB8NS_BH_Bias_HAS_SAV_UserArgs_MT128x256x128_MI16x16x1_SN_LDSB1_CLR1_GRVWA8_GRVWB16_GSU0_GSUC0_GSUWGMRR0_K1_LBSPPA1024_LBSPPB2048_LPA64_LPB0_MIWT4_8_PLR1_SU0_SUM0_SUS128_VWA4_VWB8_WGM6_WGMXCC1_WGMXCCGn1
    SolutionIndex: 75
    SolutionNameMin: Cijk_Ailk_Bjlk_B8F8NB8NS_BH_Bias_HAS_SAV_UserArgs_MT128x256x128_MI16x16x1_SN_LDSB1_CLR1_GRVWA16_GRVWB16_GSU0_GSUC0_GSUWGMRR0_K1_LBSPPA1024_LBSPPB2048_LPA64_LPB0_MIWT4_8_PLR1_SU0_SUM0_SUS128_VWA4_VWB8_WGM6_WGMXCC1_WGMXCCGn1
    SolutionIndex: 76
    SolutionNameMin: Cijk_Ailk_Bjlk_B8F8NB8NS_BH_Bias_HAS_SAV_UserArgs_MT256x128x128_MI16x16x1_SN_LDSB1_CLR1_GRVWA16_GRVWB8_GSU0_GSUC0_GSUWGMRR0_K1_LBSPPA2048_LBSPPB1024_LPA0_LPB64_MIWT8_4_PLR1_SU0_SUM0_SUS128_VWA8_VWB4_WGM1_WGMXCC1_WGMXCCGn1
    SolutionIndex: 77
    SolutionNameMin: Cijk_Ailk_Bjlk_B8F8NB8NS_BH_Bias_HAS_SAV_UserArgs_MT128x128x128_MI16x16x1_SN_LDSB1_CLR1_GRVWA16_GRVWB16_GSU0_GSUC0_GSUWGMRR0_K1_LBSPPA1024_LBSPPB1024_LPA64_LPB64_MIWT4_4_PLR1_SU0_SUM0_SUS128_VWA4_VWB4_WGM1_WGMXCC1_WGMXCCGn1
    SolutionIndex: 78
    SolutionNameMin: Cijk_Ailk_Bjlk_B8F8NB8NS_BH_Bias_HAS_SAV_UserArgs_MT128x128x128_MI16x16x1_SN_LDSB1_CLR1_GRVWA16_GRVWB16_GSU0_GSUC0_GSUWGMRR0_K1_LBSPPA1024_LBSPPB1024_LPA64_LPB64_MIWT4_4_PLR1_SU0_SUM0_SUS128_VWA4_VWB4_WGM4_WGMXCC1_WGMXCCGn1
    SolutionIndex: 79
    SolutionNameMin: Cijk_Ailk_Bjlk_B8F8NB8NS_BH_Bias_HAS_SAV_UserArgs_MT128x128x128_MI16x16x1_SN_LDSB1_CLR1_GRVWA16_GRVWB16_GSU0_GSUC0_GSUWGMRR0_K1_LBSPPA1024_LBSPPB1024_LPA64_LPB64_MIWT4_4_PLR1_SU0_SUM0_SUS128_VWA4_VWB4_WGM8_WGMXCC1_WGMXCCGn1
    SolutionIndex: 80
    SolutionNameMin: Cijk_Ailk_Bjlk_B8F8NB8NS_BH_Bias_HAS_SAV_UserArgs_MT128x64x128_MI16x16x1_SN_LDSB1_CLR1_GRVWA4_GRVWB8_GSU0_GSUC0_GSUWGMRR0_K1_LBSPPA1024_LBSPPB512_LPA64_LPB32_MIWT4_2_PLR1_SU0_SUM0_SUS128_VWA4_VWB2_WGM1_WGMXCC1_WGMXCCGn1
    SolutionIndex: 81
    SolutionNameMin: Cijk_Ailk_Bjlk_B8F8NB8NS_BH_Bias_HAS_SAV_UserArgs_MT128x64x128_MI16x16x1_SN_LDSB1_CLR1_GRVWA4_GRVWB16_GSU0_GSUC0_GSUWGMRR0_K1_LBSPPA1024_LBSPPB512_LPA64_LPB32_MIWT4_2_PLR1_SU0_SUM0_SUS128_VWA4_VWB2_WGM1_WGMXCC1_WGMXCCGn1
    SolutionIndex: 82
    SolutionNameMin: Cijk_Ailk_Bjlk_B8F8NB8NS_BH_Bias_HAS_SAV_UserArgs_MT128x64x128_MI16x16x1_SN_LDSB1_CLR1_GRVWA16_GRVWB16_GSU0_GSUC0_GSUWGMRR0_K1_LBSPPA1024_LBSPPB512_LPA64_LPB32_MIWT4_2_PLR1_SU0_SUM0_SUS128_VWA4_VWB2_WGM1_WGMXCC1_WGMXCCGn1
    SolutionIndex: 83
    SolutionNameMin: Cijk_Ailk_Bjlk_B8F8NB8NS_BH_Bias_HAS_SAV_UserArgs_MT128x64x128_MI16x16x1_SN_LDSB1_CLR1_GRVWA16_GRVWB16_GSU0_GSUC0_GSUWGMRR0_K1_LBSPPA1024_LBSPPB512_LPA64_LPB32_MIWT4_2_PLR1_SU0_SUM0_SUS128_VWA4_VWB2_WGM4_WGMXCC1_WGMXCCGn1
    SolutionIndex: 84
    SolutionNameMin: Cijk_Ailk_Bjlk_B8F8NB8NS_BH_Bias_HAS_SAV_UserArgs_MT128x64x128_MI16x16x1_SN_LDSB1_CLR1_GRVWA16_GRVWB16_GSU0_GSUC0_GSUWGMRR0_K1_LBSPPA1024_LBSPPB512_LPA64_LPB32_MIWT4_2_PLR1_SU0_SUM0_SUS128_VWA4_VWB2_WGM6_WGMXCC1_WGMXCCGn1
    SolutionIndex: 85
    SolutionNameMin: Cijk_Ailk_Bjlk_B8F8NB8NS_BH_Bias_HAS_SAV_UserArgs_MT128x64x128_MI16x16x1_SN_LDSB1_CLR1_GRVWA16_GRVWB16_GSU0_GSUC0_GSUWGMRR0_K1_LBSPPA1024_LBSPPB512_LPA64_LPB32_MIWT4_2_PLR1_SU0_SUM0_SUS128_VWA4_VWB2_WGM8_WGMXCC1_WGMXCCGn1
    SolutionIndex: 86
    SolutionNameMin: Cijk_Ailk_Bjlk_B8F8NB8NS_BH_Bias_HAS_SAV_UserArgs_MT64x64x128_MI16x16x1_SN_LDSB1_CLR1_GRVWA4_GRVWB4_GSU0_GSUC0_GSUWGMRR0_K1_LBSPPA512_LBSPPB512_LPA32_LPB32_MIWT2_2_PLR1_SU0_SUM0_SUS128_VWA2_VWB2_WGM1_WGMXCC1_WGMXCCGn1
    SolutionIndex: 87
    SolutionNameMin: Cijk_Ailk_Bjlk_B8F8NB8NS_BH_Bias_HAS_SAV_UserArgs_MT64x64x128_MI16x16x1_SN_LDSB1_CLR1_GRVWA4_GRVWB8_GSU0_GSUC0_GSUWGMRR0_K1_LBSPPA512_LBSPPB512_LPA32_LPB32_MIWT2_2_PLR1_SU0_SUM0_SUS128_VWA2_VWB2_WGM1_WGMXCC1_WGMXCCGn1
    SolutionIndex: 88
    SolutionNameMin: Cijk_Ailk_Bjlk_B8F8NB8NS_BH_Bias_HAS_SAV_UserArgs_MT64x64x128_MI16x16x1_SN_LDSB1_CLR1_GRVWA16_GRVWB8_GSU0_GSUC0_GSUWGMRR0_K1_LBSPPA512_LBSPPB512_LPA32_LPB32_MIWT2_2_PLR1_SU0_SUM0_SUS128_VWA2_VWB2_WGM1_WGMXCC1_WGMXCCGn1
    SolutionIndex: 89
    SolutionNameMin: Cijk_Ailk_Bjlk_B8F8NB8NS_BH_Bias_HAS_SAV_UserArgs_MT64x64x128_MI16x16x1_SN_LDSB1_CLR1_GRVWA8_GRVWB16_GSU0_GSUC0_GSUWGMRR0_K1_LBSPPA512_LBSPPB512_LPA32_LPB32_MIWT2_2_PLR1_SU0_SUM0_SUS128_VWA2_VWB2_WGM1_WGMXCC1_WGMXCCGn1
    SolutionIndex: 90
    SolutionNameMin: Cijk_Ailk_Bjlk_B8F8NB8NS_BH_Bias_HAS_SAV_UserArgs_MT64x64x128_MI16x16x1_SN_LDSB1_CLR1_GRVWA16_GRVWB16_GSU0_GSUC0_GSUWGMRR0_K1_LBSPPA512_LBSPPB512_LPA32_LPB32_MIWT2_2_PLR1_SU0_SUM0_SUS128_VWA2_VWB2_WGM1_WGMXCC1_WGMXCCGn1
    SolutionIndex: 91
    SolutionNameMin: Cijk_Ailk_Bjlk_B8F8NB8NS_BH_Bias_HAS_SAV_UserArgs_MT64x64x128_MI16x16x1_SN_LDSB1_CLR1_GRVWA4_GRVWB16_GSU0_GSUC0_GSUWGMRR0_K1_LBSPPA512_LBSPPB512_LPA32_LPB32_MIWT2_2_PLR1_SU0_SUM0_SUS128_VWA2_VWB2_WGM4_WGMXCC1_WGMXCCGn1
    SolutionIndex: 92
    SolutionNameMin: Cijk_Ailk_Bjlk_B8F8NB8NS_BH_Bias_HAS_SAV_UserArgs_MT64x64x128_MI16x16x1_SN_LDSB1_CLR1_GRVWA16_GRVWB16_GSU0_GSUC0_GSUWGMRR0_K1_LBSPPA512_LBSPPB512_LPA32_LPB32_MIWT2_2_PLR1_SU0_SUM0_SUS128_VWA2_VWB2_WGM4_WGMXCC1_WGMXCCGn1
    SolutionIndex: 93
    SolutionNameMin: Cijk_Ailk_Bjlk_B8F8NB8NS_BH_Bias_HAS_SAV_UserArgs_MT64x64x128_MI16x16x1_SN_LDSB1_CLR1_GRVWA16_GRVWB16_GSU0_GSUC0_GSUWGMRR0_K1_LBSPPA512_LBSPPB512_LPA32_LPB32_MIWT2_2_PLR1_SU0_SUM0_SUS128_VWA2_VWB2_WGM6_WGMXCC1_WGMXCCGn1
    SolutionIndex: 94
    SolutionNameMin: Cijk_Ailk_Bjlk_B8F8NB8NS_BH_Bias_HAS_SAV_UserArgs_MT64x64x128_MI16x16x1_SN_LDSB1_CLR1_GRVWA4_GRVWB16_GSU0_GSUC0_GSUWGMRR0_K1_LBSPPA512_LBSPPB512_LPA32_LPB32_MIWT2_2_PLR1_SU0_SUM0_SUS128_VWA2_VWB2_WGM8_WGMXCC1_WGMXCCGn1
    SolutionIndex: 95
    SolutionNameMin: Cijk_Ailk_Bjlk_B8F8NB8NS_BH_Bias_HAS_SAV_UserArgs_MT64x64x128_MI16x16x1_SN_LDSB1_CLR1_GRVWA8_GRVWB16_GSU0_GSUC0_GSUWGMRR0_K1_LBSPPA512_LBSPPB512_LPA32_LPB32_MIWT2_2_PLR1_SU0_SUM0_SUS128_VWA2_VWB2_WGM8_WGMXCC1_WGMXCCGn1
    SolutionIndex: 96
    SolutionNameMin: Cijk_Ailk_Bjlk_B8F8NB8NS_BH_Bias_HAS_SAV_UserArgs_MT64x64x128_MI16x16x1_SN_LDSB1_CLR1_GRVWA16_GRVWB16_GSU0_GSUC0_GSUWGMRR0_K1_LBSPPA512_LBSPPB512_LPA32_LPB32_MIWT2_2_PLR1_SU0_SUM0_SUS128_VWA2_VWB2_WGM8_WGMXCC1_WGMXCCGn1
    SolutionIndex: 97
    SolutionNameMin: Cijk_Ailk_Bjlk_B8F8NB8NS_BH_Bias_HAS_SAV_UserArgs_MT32x64x128_MI16x16x1_SN_LDSB0_CLR1_GRVWA16_GRVWB16_GSU0_GSUC0_GSUWGMRR0_K1_LBSPPA256_LBSPPB512_LPA16_LPB32_MIWT1_2_PLR1_SU0_SUM0_SUS128_VWA1_VWB2_WGM1_WGMXCC1_WGMXCCGn1
    SolutionIndex: 98
    SolutionNameMin: Cijk_Ailk_Bjlk_B8F8NB8NS_BH_Bias_HAS_SAV_UserArgs_MT32x64x128_MI16x16x1_SN_LDSB0_CLR1_GRVWA16_GRVWB16_GSU0_GSUC0_GSUWGMRR0_K1_LBSPPA256_LBSPPB512_LPA16_LPB32_MIWT1_2_PLR1_SU0_SUM0_SUS128_VWA1_VWB2_WGM6_WGMXCC1_WGMXCCGn1
    SolutionIndex: 99
    SolutionNameMin: Cijk_Ailk_Bjlk_B8F8NB8NS_BH_Bias_HAS_SAV_UserArgs_MT32x64x128_MI16x16x1_SN_LDSB0_CLR1_GRVWA16_GRVWB16_GSU0_GSUC0_GSUWGMRR0_K1_LBSPPA256_LBSPPB512_LPA16_LPB32_MIWT1_2_PLR1_SU0_SUM0_SUS128_VWA1_VWB2_WGM8_WGMXCC1_WGMXCCGn1
    SolutionIndex: 100
    SolutionNameMin: Cijk_Ailk_Bjlk_B8F8NB8NS_BH_Bias_HAS_SAV_UserArgs_MT64x32x128_MI16x16x1_SN_LDSB0_CLR1_GRVWA4_GRVWB4_GSU0_GSUC0_GSUWGMRR0_K1_LBSPPA512_LBSPPB256_LPA32_LPB16_MIWT2_1_PLR1_SU0_SUM0_SUS128_VWA2_VWB1_WGM1_WGMXCC1_WGMXCCGn1
    SolutionIndex: 101
    SolutionNameMin: Cijk_Ailk_Bjlk_B8F8NB8NS_BH_Bias_HAS_SAV_UserArgs_MT64x32x128_MI16x16x1_SN_LDSB0_CLR1_GRVWA4_GRVWB8_GSU0_GSUC0_GSUWGMRR0_K1_LBSPPA512_LBSPPB256_LPA32_LPB16_MIWT2_1_PLR1_SU0_SUM0_SUS128_VWA2_VWB1_WGM1_WGMXCC1_WGMXCCGn1
    SolutionIndex: 102
    SolutionNameMin: Cijk_Ailk_Bjlk_B8F8NB8NS_BH_Bias_HAS_SAV_UserArgs_MT64x32x128_MI16x16x1_SN_LDSB0_CLR1_GRVWA8_GRVWB8_GSU0_GSUC0_GSUWGMRR0_K1_LBSPPA512_LBSPPB256_LPA32_LPB16_MIWT2_1_PLR1_SU0_SUM0_SUS128_VWA2_VWB1_WGM1_WGMXCC1_WGMXCCGn1
    SolutionIndex: 103
    SolutionNameMin: Cijk_Ailk_Bjlk_B8F8NB8NS_BH_Bias_HAS_SAV_UserArgs_MT64x32x128_MI16x16x1_SN_LDSB0_CLR1_GRVWA8_GRVWB16_GSU0_GSUC0_GSUWGMRR0_K1_LBSPPA512_LBSPPB256_LPA32_LPB16_MIWT2_1_PLR1_SU0_SUM0_SUS128_VWA2_VWB1_WGM1_WGMXCC1_WGMXCCGn1
    SolutionIndex: 104
    SolutionNameMin: Cijk_Ailk_Bjlk_B8F8NB8NS_BH_Bias_HAS_SAV_UserArgs_MT64x32x128_MI16x16x1_SN_LDSB0_CLR1_GRVWA16_GRVWB16_GSU0_GSUC0_GSUWGMRR0_K1_LBSPPA512_LBSPPB256_LPA32_LPB16_MIWT2_1_PLR1_SU0_SUM0_SUS128_VWA2_VWB1_WGM1_WGMXCC1_WGMXCCGn1
    SolutionIndex: 105
    SolutionNameMin: Cijk_Ailk_Bjlk_B8F8NB8NS_BH_Bias_HAS_SAV_UserArgs_MT64x32x128_MI16x16x1_SN_LDSB0_CLR1_GRVWA4_GRVWB8_GSU0_GSUC0_GSUWGMRR0_K1_LBSPPA512_LBSPPB256_LPA32_LPB16_MIWT2_1_PLR1_SU0_SUM0_SUS128_VWA2_VWB1_WGM6_WGMXCC1_WGMXCCGn1
    SolutionIndex: 106
    SolutionNameMin: Cijk_Ailk_Bjlk_B8F8NB8NS_BH_Bias_HAS_SAV_UserArgs_MT64x32x128_MI16x16x1_SN_LDSB0_CLR1_GRVWA8_GRVWB16_GSU0_GSUC0_GSUWGMRR0_K1_LBSPPA512_LBSPPB256_LPA32_LPB16_MIWT2_1_PLR1_SU0_SUM0_SUS128_VWA2_VWB1_WGM8_WGMXCC1_WGMXCCGn1
    SolutionIndex: 107
    SolutionNameMin: Cijk_Ailk_Bjlk_B8F8NB8NS_BH_Bias_HAS_SAV_UserArgs_MT32x32x128_MI16x16x1_SN_LDSB0_CLR1_GRVWA4_GRVWB4_GSU0_GSUC0_GSUWGMRR0_K1_LBSPPA256_LBSPPB256_LPA16_LPB16_MIWT1_1_PLR1_SU0_SUM0_SUS128_VWA1_VWB1_WGM1_WGMXCC1_WGMXCCGn1
    SolutionIndex: 108
    SolutionNameMin: Cijk_Ailk_Bjlk_B8F8NB8NS_BH_Bias_HAS_SAV_UserArgs_MT32x32x128_MI16x16x1_SN_LDSB0_CLR1_GRVWA4_GRVWB8_GSU0_GSUC0_GSUWGMRR0_K1_LBSPPA256_LBSPPB256_LPA16_LPB16_MIWT1_1_PLR1_SU0_SUM0_SUS128_VWA1_VWB1_WGM1_WGMXCC1_WGMXCCGn1
    SolutionIndex: 109
    SolutionNameMin: Cijk_Ailk_Bjlk_B8F8NB8NS_BH_Bias_HAS_SAV_UserArgs_MT32x32x128_MI16x16x1_SN_LDSB0_CLR1_GRVWA8_GRVWB8_GSU0_GSUC0_GSUWGMRR0_K1_LBSPPA256_LBSPPB256_LPA16_LPB16_MIWT1_1_PLR1_SU0_SUM0_SUS128_VWA1_VWB1_WGM1_WGMXCC1_WGMXCCGn1
    SolutionIndex: 110
    SolutionNameMin: Cijk_Ailk_Bjlk_B8F8NB8NS_BH_Bias_HAS_SAV_UserArgs_MT32x32x128_MI16x16x1_SN_LDSB0_CLR1_GRVWA4_GRVWB16_GSU0_GSUC0_GSUWGMRR0_K1_LBSPPA256_LBSPPB256_LPA16_LPB16_MIWT1_1_PLR1_SU0_SUM0_SUS128_VWA1_VWB1_WGM1_WGMXCC1_WGMXCCGn1
    SolutionIndex: 111
    SolutionNameMin: Cijk_Ailk_Bjlk_B8F8NB8NS_BH_Bias_HAS_SAV_UserArgs_MT32x32x128_MI16x16x1_SN_LDSB0_CLR1_GRVWA8_GRVWB16_GSU0_GSUC0_GSUWGMRR0_K1_LBSPPA256_LBSPPB256_LPA16_LPB16_MIWT1_1_PLR1_SU0_SUM0_SUS128_VWA1_VWB1_WGM1_WGMXCC1_WGMXCCGn1
    SolutionIndex: 112
    SolutionNameMin: Cijk_Ailk_Bjlk_B8F8NB8NS_BH_Bias_HAS_SAV_UserArgs_MT128x64x256_MI16x16x1_SN_LDSB1_CLR1_GRVWA16_GRVWB16_GSU0_GSUC0_GSUWGMRR0_K1_LBSPPA1024_LBSPPB512_LPA64_LPB32_MIWT4_2_PLR1_SU0_SUM0_SUS256_VWA4_VWB2_WGM1_WGMXCC1_WGMXCCGn1
    SolutionIndex: 113
    SolutionNameMin: Cijk_Ailk_Bjlk_B8F8NB8NS_BH_Bias_HAS_SAV_UserArgs_MT128x64x256_MI16x16x1_SN_LDSB1_CLR1_GRVWA4_GRVWB16_GSU0_GSUC0_GSUWGMRR0_K1_LBSPPA1024_LBSPPB512_LPA64_LPB32_MIWT4_2_PLR1_SU0_SUM0_SUS256_VWA4_VWB2_WGM8_WGMXCC1_WGMXCCGn1
    SolutionIndex: 114
    SolutionNameMin: Cijk_Ailk_Bjlk_B8F8NB8NS_BH_Bias_HAS_SAV_UserArgs_MT64x64x256_MI16x16x1_SN_LDSB1_CLR1_GRVWA16_GRVWB16_GSU0_GSUC0_GSUWGMRR0_K1_LBSPPA512_LBSPPB512_LPA32_LPB32_MIWT2_2_PLR1_SU0_SUM0_SUS256_VWA2_VWB2_WGM1_WGMXCC1_WGMXCCGn1
    SolutionIndex: 115
    SolutionNameMin: Cijk_Ailk_Bjlk_B8F8NB8NS_BH_Bias_HAS_SAV_UserArgs_MT64x64x256_MI16x16x1_SN_LDSB1_CLR1_GRVWA16_GRVWB16_GSU0_GSUC0_GSUWGMRR0_K1_LBSPPA512_LBSPPB512_LPA32_LPB32_MIWT2_2_PLR1_SU0_SUM0_SUS256_VWA2_VWB2_WGM4_WGMXCC1_WGMXCCGn1
    SolutionIndex: 116
    SolutionNameMin: Cijk_Ailk_Bjlk_B8F8NB8NS_BH_Bias_HAS_SAV_UserArgs_MT64x32x256_MI16x16x1_SN_LDSB1_CLR1_GRVWA16_GRVWB16_GSU0_GSUC0_GSUWGMRR0_K1_LBSPPA512_LBSPPB256_LPA32_LPB16_MIWT2_1_PLR1_SU0_SUM0_SUS256_VWA2_VWB1_WGM1_WGMXCC1_WGMXCCGn1
    SolutionIndex: 117
    SolutionNameMin: Cijk_Ailk_Bjlk_B8F8NB8NS_BH_Bias_HAS_SAV_UserArgs_MT64x32x256_MI16x16x1_SN_LDSB1_CLR1_GRVWA16_GRVWB16_GSU0_GSUC0_GSUWGMRR0_K1_LBSPPA512_LBSPPB256_LPA32_LPB16_MIWT2_1_PLR1_SU0_SUM0_SUS256_VWA2_VWB1_WGM6_WGMXCC1_WGMXCCGn1
    SolutionIndex: 118
    SolutionNameMin: Cijk_Ailk_Bjlk_B8F8NB8NS_BH_Bias_HAS_SAV_UserArgs_MT32x32x256_MI16x16x1_SN_LDSB1_CLR1_GRVWA8_GRVWB16_GSU0_GSUC0_GSUWGMRR0_K1_LBSPPA256_LBSPPB256_LPA16_LPB16_MIWT1_1_PLR1_SU0_SUM0_SUS256_VWA1_VWB1_WGM1_WGMXCC1_WGMXCCGn1
    SolutionIndex: 119
    SolutionNameMin: Cijk_Ailk_Bjlk_B8F8NB8NS_BH_Bias_HAS_SAV_UserArgs_MT32x32x256_MI16x16x1_SN_LDSB1_CLR1_GRVWA16_GRVWB16_GSU0_GSUC0_GSUWGMRR0_K1_LBSPPA256_LBSPPB256_LPA16_LPB16_MIWT1_1_PLR1_SU0_SUM0_SUS256_VWA1_VWB1_WGM1_WGMXCC1_WGMXCCGn1
    SolutionIndex: 120
    SolutionNameMin: Cijk_Ailk_Bjlk_B8F8NB8NS_BH_Bias_HAS_SAV_UserArgs_MT32x32x256_MI16x16x1_SN_LDSB1_CLR1_GRVWA16_GRVWB16_GSU0_GSUC0_GSUWGMRR0_K1_LBSPPA256_LBSPPB256_LPA16_LPB16_MIWT1_1_PLR1_SU0_SUM0_SUS256_VWA1_VWB1_WGM4_WGMXCC1_WGMXCCGn1
    SolutionIndex: 121
    SolutionNameMin: Cijk_Ailk_Bjlk_B8F8NB8NS_BH_Bias_HAS_SAV_UserArgs_MT32x32x256_MI16x16x1_SN_LDSB1_CLR1_GRVWA8_GRVWB16_GSU0_GSUC0_GSUWGMRR0_K1_LBSPPA256_LBSPPB256_LPA16_LPB16_MIWT1_1_PLR1_SU0_SUM0_SUS256_VWA1_VWB1_WGM6_WGMXCC1_WGMXCCGn1
    SolutionIndex: 122
    SolutionNameMin: Cijk_Ailk_Bjlk_B8F8NB8NS_BH_Bias_HAS_SAV_UserArgs_MT32x32x256_MI16x16x1_SN_LDSB1_CLR1_GRVWA16_GRVWB16_GSU0_GSUC0_GSUWGMRR0_K1_LBSPPA256_LBSPPB256_LPA16_LPB16_MIWT1_1_PLR1_SU0_SUM0_SUS256_VWA1_VWB1_WGM6_WGMXCC1_WGMXCCGn1
    SolutionIndex: 123
    SolutionNameMin: Cijk_Ailk_Bjlk_B8F8NB8NS_BH_Bias_HAS_SAV_UserArgs_MT32x32x256_MI16x16x1_SN_LDSB1_CLR1_GRVWA16_GRVWB16_GSU0_GSUC0_GSUWGMRR0_K1_LBSPPA256_LBSPPB256_LPA16_LPB16_MIWT1_1_PLR1_SU0_SUM0_SUS256_VWA1_VWB1_WGM8_WGMXCC1_WGMXCCGn1
- - - [128, 128, 1, 128, 128, 128, 128, 128]
    - [107, 0.5]
  - - [128, 128, 1, 256, 128, 128, 128, 128]
    - [60, 0.89]
  - - [128, 128, 1, 512, 128, 128, 128, 128]
    - [109, 1.47]
  - - [128, 128, 1, 1024, 128, 128, 128, 128]
    - [111, 2.12]
  - - [128, 128, 1, 2048, 128, 128, 128, 128]
    - [111, 2.95]
  - - [128, 128, 1, 4096, 128, 128, 128, 128]
    - [119, 3.51]
  - - [128, 128, 1, 8192, 128, 128, 128, 128]
    - [119, 3.93]
  - - [128, 256, 1, 128, 128, 128, 128, 256]
    - [63, 1.02]
  - - [128, 256, 1, 256, 128, 128, 128, 256]
    - [61, 1.84]
  - - [128, 256, 1, 512, 128, 128, 128, 256]
    - [109, 3.03]
  - - [128, 256, 1, 1024, 128, 128, 128, 256]
    - [109, 4.47]
  - - [128, 256, 1, 2048, 128, 128, 128, 256]
    - [111, 5.96]
  - - [128, 256, 1, 4096, 128, 128, 128, 256]
    - [111, 7.08]
  - - [128, 256, 1, 8192, 128, 128, 128, 256]
    - [119, 7.9]
  - - [128, 512, 1, 128, 128, 128, 128, 512]
    - [61, 2.07]
  - - [128, 512, 1, 256, 128, 128, 128, 512]
    - [60, 3.62]
  - - [128, 512, 1, 512, 128, 128, 128, 512]
    - [107, 6.01]
  - - [128, 512, 1, 1024, 128, 128, 128, 512]
    - [109, 8.78]
  - - [128, 512, 1, 2048, 128, 128, 128, 512]
    - [111, 11.65]
  - - [128, 512, 1, 4096, 128, 128, 128, 512]
    - [111, 13.99]
  - - [128, 512, 1, 8192, 128, 128, 128, 512]
    - [119, 14.97]
  - - [128, 1024, 1, 128, 128, 128, 128, 1024]
    - [61, 3.89]
  - - [128, 1024, 1, 256, 128, 128, 128, 1024]
    - [61, 6.93]
  - - [128, 1024, 1, 512, 128, 128, 128, 1024]
    - [63, 11.25]
  - - [128, 1024, 1, 1024, 128, 128, 128, 1024]
    - [109, 16.93]
  - - [128, 1024, 1, 2048, 128, 128, 128, 1024]
    - [111, 22.71]
  - - [128, 1024, 1, 4096, 128, 128, 128, 1024]
    - [118, 25.76]
  - - [128, 1024, 1, 8192, 128, 128, 128, 1024]
    - [121, 27.75]
  - - [128, 2048, 1, 128, 128, 128, 128, 2048]
    - [56, 7.55]
  - - [128, 2048, 1, 256, 128, 128, 128, 2048]
    - [56, 13.26]
  - - [128, 2048, 1, 512, 128, 128, 128, 2048]
    - [100, 21.37]
  - - [128, 2048, 1, 1024, 128, 128, 128, 2048]
    - [103, 31.2]
  - - [128, 2048, 1, 2048, 128, 128, 128, 2048]
    - [116, 39.22]
  - - [128, 2048, 1, 4096, 128, 128, 128, 2048]
    - [117, 47.46]
  - - [128, 2048, 1, 8192, 128, 128, 128, 2048]
    - [117, 53.46]
  - - [128, 4096, 1, 128, 128, 128, 128, 4096]
    - [52, 14.13]
  - - [128, 4096, 1, 256, 128, 128, 128, 4096]
    - [52, 24.22]
  - - [128, 4096, 1, 512, 128, 128, 128, 4096]
    - [87, 38.21]
  - - [128, 4096, 1, 1024, 128, 128, 128, 4096]
    - [90, 54.65]
  - - [128, 4096, 1, 2048, 128, 128, 128, 4096]
    - [114, 67.52]
  - - [128, 4096, 1, 4096, 128, 128, 128, 4096]
    - [114, 82.38]
  - - [128, 4096, 1, 8192, 128, 128, 128, 4096]
    - [115, 91.18]
  - - [128, 8192, 1, 128, 128, 128, 128, 8192]
    - [45, 24.56]
  - - [128, 8192, 1, 256, 128, 128, 128, 8192]
    - [45, 41.09]
  - - [128, 8192, 1, 512, 128, 128, 128, 8192]
    - [45, 63.5]
  - - [128, 8192, 1, 1024, 128, 128, 128, 8192]
    - [80, 87.9]
  - - [128, 8192, 1, 2048, 128, 128, 128, 8192]
    - [82, 108.45]
  - - [128, 8192, 1, 4096, 128, 128, 128, 8192]
    - [112, 125.6]
  - - [128, 8192, 1, 8192, 128, 128, 128, 8192]
    - [113, 129.26]
  - - [256, 128, 1, 128, 256, 256, 256, 128]
    - [107, 1.04]
  - - [256, 128, 1, 256, 256, 256, 256, 128]
    - [107, 1.83]
  - - [256, 128, 1, 512, 256, 256, 256, 128]
    - [108, 3.0]
  - - [256, 128, 1, 1024, 256, 256, 256, 128]
    - [109, 4.47]
  - - [256, 128, 1, 2048, 256, 256, 256, 128]
    - [111, 5.93]
  - - [256, 128, 1, 4096, 256, 256, 256, 128]
    - [119, 7.08]
  - - [256, 128, 1, 8192, 256, 256, 256, 128]
    - [119, 7.9]
  - - [256, 256, 1, 128, 256, 256, 256, 256]
    - [107, 2.05]
  - - [256, 256, 1, 256, 256, 256, 256, 256]
    - [107, 3.62]
  - - [256, 256, 1, 512, 256, 256, 256, 256]
    - [107, 5.98]
  - - [256, 256, 1, 1024, 256, 256, 256, 256]
    - [111, 8.84]
  - - [256, 256, 1, 2048, 256, 256, 256, 256]
    - [111, 11.77]
  - - [256, 256, 1, 4096, 256, 256, 256, 256]
    - [111, 14.05]
  - - [256, 256, 1, 8192, 256, 256, 256, 256]
    - [119, 15.56]
  - - [256, 512, 1, 128, 256, 256, 256, 512]
    - [57, 3.83]
  - - [256, 512, 1, 256, 256, 256, 256, 512]
    - [62, 6.97]
  - - [256, 512, 1, 512, 256, 256, 256, 512]
    - [108, 11.32]
  - - [256, 512, 1, 1024, 256, 256, 256, 512]
    - [109, 17.03]
  - - [256, 512, 1, 2048, 256, 256, 256, 512]
    - [111, 22.76]
  - - [256, 512, 1, 4096, 256, 256, 256, 512]
    - [111, 27.49]
  - - [256, 512, 1, 8192, 256, 256, 256, 512]
    - [119, 30.23]
  - - [256, 1024, 1, 128, 256, 256, 256, 1024]
    - [59, 7.35]
  - - [256, 1024, 1, 256, 256, 256, 256, 1024]
    - [56, 13.1]
  - - [256, 1024, 1, 512, 256, 256, 256, 1024]
    - [102, 21.18]
  - - [256, 1024, 1, 1024, 256, 256, 256, 1024]
    - [104, 31.01]
  - - [256, 1024, 1, 2048, 256, 256, 256, 1024]
    - [116, 41.22]
  - - [256, 1024, 1, 4096, 256, 256, 256, 1024]
    - [116, 48.89]
  - - [256, 1024, 1, 8192, 256, 256, 256, 1024]
    - [117, 53.67]
  - - [256, 2048, 1, 128, 256, 256, 256, 2048]
    - [53, 14.18]
  - - [256, 2048, 1, 256, 256, 256, 256, 2048]
    - [54, 24.02]
  - - [256, 2048, 1, 512, 256, 256, 256, 2048]
    - [86, 37.42]
  - - [256, 2048, 1, 1024, 256, 256, 256, 2048]
    - [88, 54.06]
  - - [256, 2048, 1, 2048, 256, 256, 256, 2048]
    - [89, 67.96]
  - - [256, 2048, 1, 4096, 256, 256, 256, 2048]
    - [89, 79.28]
  - - [256, 2048, 1, 8192, 256, 256, 256, 2048]
    - [114, 87.61]
  - - [256, 4096, 1, 128, 256, 256, 256, 4096]
    - [45, 24.28]
  - - [256, 4096, 1, 256, 256, 256, 256, 4096]
    - [45, 41.65]
  - - [256, 4096, 1, 512, 256, 256, 256, 4096]
    - [47, 63.62]
  - - [256, 4096, 1, 1024, 256, 256, 256, 4096]
    - [82, 88.27]
  - - [256, 4096, 1, 2048, 256, 256, 256, 4096]
    - [82, 108.61]
  - - [256, 4096, 1, 4096, 256, 256, 256, 4096]
    - [85, 124.93]
  - - [256, 4096, 1, 8192, 256, 256, 256, 4096]
    - [85, 130.31]
  - - [256, 8192, 1, 128, 256, 256, 256, 8192]
    - [35, 38.55]
  - - [256, 8192, 1, 256, 256, 256, 256, 8192]
    - [36, 65.14]
  - - [256, 8192, 1, 512, 256, 256, 256, 8192]
    - [38, 98.85]
  - - [256, 8192, 1, 1024, 256, 256, 256, 8192]
    - [77, 134.7]
  - - [256, 8192, 1, 2048, 256, 256, 256, 8192]
    - [77, 161.49]
  - - [256, 8192, 1, 4096, 256, 256, 256, 8192]
    - [37, 179.27]
  - - [256, 8192, 1, 8192, 256, 256, 256, 8192]
    - [79, 163.75]
  - - [512, 128, 1, 128, 512, 512, 512, 128]
    - [60, 2.03]
  - - [512, 128, 1, 256, 512, 512, 512, 128]
    - [60, 3.62]
  - - [512, 128, 1, 512, 512, 512, 512, 128]
    - [108, 5.86]
  - - [512, 128, 1, 1024, 512, 512, 512, 128]
    - [111, 8.78]
  - - [512, 128, 1, 2048, 512, 512, 512, 128]
    - [111, 11.7]
  - - [512, 128, 1, 4096, 512, 512, 512, 128]
    - [111, 14.02]
  - - [512, 128, 1, 8192, 512, 512, 512, 128]
    - [122, 15.06]
  - - [512, 256, 1, 128, 512, 512, 512, 256]
    - [60, 3.93]
  - - [512, 256, 1, 256, 512, 512, 512, 256]
    - [62, 6.78]
  - - [512, 256, 1, 512, 512, 512, 512, 256]
    - [109, 11.42]
  - - [512, 256, 1, 1024, 512, 512, 512, 256]
    - [109, 17.09]
  - - [512, 256, 1, 2048, 512, 512, 512, 256]
    - [111, 22.92]
  - - [512, 256, 1, 4096, 512, 512, 512, 256]
    - [111, 27.65]
  - - [512, 256, 1, 8192, 512, 512, 512, 256]
    - [123, 28.69]
  - - [512, 512, 1, 128, 512, 512, 512, 512]
    - [59, 7.53]
  - - [512, 512, 1, 256, 512, 512, 512, 512]
    - [56, 13.23]
  - - [512, 512, 1, 512, 512, 512, 512, 512]
    - [102, 20.98]
  - - [512, 512, 1, 1024, 512, 512, 512, 512]
    - [101, 30.8]
  - - [512, 512, 1, 2048, 512, 512, 512, 512]
    - [116, 40.55]
  - - [512, 512, 1, 4096, 512, 512, 512, 512]
    - [116, 48.82]
  - - [512, 512, 1, 8192, 512, 512, 512, 512]
    - [104, 50.57]
  - - [512, 1024, 1, 128, 512, 512, 512, 1024]
    - [50, 13.64]
  - - [512, 1024, 1, 256, 512, 512, 512, 1024]
    - [52, 23.64]
  - - [512, 1024, 1, 512, 512, 512, 512, 1024]
    - [55, 37.61]
  - - [512, 1024, 1, 1024, 512, 512, 512, 1024]
    - [89, 54.18]
  - - [512, 1024, 1, 2048, 512, 512, 512, 1024]
    - [90, 69.5]
  - - [512, 1024, 1, 4096, 512, 512, 512, 1024]
    - [90, 78.23]
  - - [512, 1024, 1, 8192, 512, 512, 512, 1024]
    - [90, 82.2]
  - - [512, 2048, 1, 128, 512, 512, 512, 2048]
    - [46, 24.2]
  - - [512, 2048, 1, 256, 512, 512, 512, 2048]
    - [45, 41.01]
  - - [512, 2048, 1, 512, 512, 512, 512, 2048]
    - [47, 63.01]
  - - [512, 2048, 1, 1024, 512, 512, 512, 2048]
    - [81, 88.44]
  - - [512, 2048, 1, 2048, 512, 512, 512, 2048]
    - [82, 108.72]
  - - [512, 2048, 1, 4096, 512, 512, 512, 2048]
    - [84, 125.25]
  - - [512, 2048, 1, 8192, 512, 512, 512, 2048]
    - [82, 129.03]
  - - [512, 4096, 1, 128, 512, 512, 512, 4096]
    - [38, 38.77]
  - - [512, 4096, 1, 256, 512, 512, 512, 4096]
    - [38, 65.44]
  - - [512, 4096, 1, 512, 512, 512, 512, 4096]
    - [38, 99.81]
  - - [512, 4096, 1, 1024, 512, 512, 512, 4096]
    - [77, 134.27]
  - - [512, 4096, 1, 2048, 512, 512, 512, 4096]
    - [37, 160.13]
  - - [512, 4096, 1, 4096, 512, 512, 512, 4096]
    - [37, 177.72]
  - - [512, 4096, 1, 8192, 512, 512, 512, 4096]
    - [38, 167.8]
  - - [512, 8192, 1, 128, 512, 512, 512, 8192]
    - [27, 55.96]
  - - [512, 8192, 1, 256, 512, 512, 512, 8192]
    - [29, 93.42]
  - - [512, 8192, 1, 512, 512, 512, 512, 8192]
    - [29, 141.3]
  - - [512, 8192, 1, 1024, 512, 512, 512, 8192]
    - [29, 190.23]
  - - [512, 8192, 1, 2048, 512, 512, 512, 8192]
    - [28, 226.65]
  - - [512, 8192, 1, 4096, 512, 512, 512, 8192]
    - [76, 232.6]
  - - [512, 8192, 1, 8192, 512, 512, 512, 8192]
    - [71, 212.37]
  - - [1024, 128, 1, 128, 1024, 1024, 1024, 128]
    - [60, 4.03]
  - - [1024, 128, 1, 256, 1024, 1024, 1024, 128]
    - [60, 7.05]
  - - [1024, 128, 1, 512, 1024, 1024, 1024, 128]
    - [107, 11.4]
  - - [1024, 128, 1, 1024, 1024, 1024, 1024, 128]
    - [110, 17.09]
  - - [1024, 128, 1, 2048, 1024, 1024, 1024, 128]
    - [110, 22.95]
  - - [1024, 128, 1, 4096, 1024, 1024, 1024, 128]
    - [120, 25.21]
  - - [1024, 128, 1, 8192, 1024, 1024, 1024, 128]
    - [123, 26.44]
  - - [1024, 256, 1, 128, 1024, 1024, 1024, 256]
    - [57, 7.55]
  - - [1024, 256, 1, 256, 1024, 1024, 1024, 256]
    - [58, 13.12]
  - - [1024, 256, 1, 512, 1024, 1024, 1024, 256]
    - [103, 20.93]
  - - [1024, 256, 1, 1024, 1024, 1024, 1024, 256]
    - [103, 31.02]
  - - [1024, 256, 1, 2048, 1024, 1024, 1024, 256]
    - [116, 40.9]
  - - [1024, 256, 1, 4096, 1024, 1024, 1024, 256]
    - [106, 46.19]
  - - [1024, 256, 1, 8192, 1024, 1024, 1024, 256]
    - [105, 49.37]
  - - [1024, 512, 1, 128, 1024, 1024, 1024, 512]
    - [52, 13.92]
  - - [1024, 512, 1, 256, 1024, 1024, 1024, 512]
    - [52, 23.94]
  - - [1024, 512, 1, 512, 1024, 1024, 1024, 512]
    - [87, 37.73]
  - - [1024, 512, 1, 1024, 1024, 1024, 1024, 512]
    - [89, 54.2]
  - - [1024, 512, 1, 2048, 1024, 1024, 1024, 512]
    - [89, 69.88]
  - - [1024, 512, 1, 4096, 1024, 1024, 1024, 512]
    - [91, 76.54]
  - - [1024, 512, 1, 8192, 1024, 1024, 1024, 512]
    - [94, 82.28]
  - - [1024, 1024, 1, 128, 1024, 1024, 1024, 1024]
    - [45, 24.43]
  - - [1024, 1024, 1, 256, 1024, 1024, 1024, 1024]
    - [45, 41.38]
  - - [1024, 1024, 1, 512, 1024, 1024, 1024, 1024]
    - [47, 63.16]
  - - [1024, 1024, 1, 1024, 1024, 1024, 1024, 1024]
    - [82, 88.06]
  - - [1024, 1024, 1, 2048, 1024, 1024, 1024, 1024]
    - [82, 109.98]
  - - [1024, 1024, 1, 4096, 1024, 1024, 1024, 1024]
    - [83, 124.82]
  - - [1024, 1024, 1, 8192, 1024, 1024, 1024, 1024]
    - [84, 128.33]
  - - [1024, 2048, 1, 128, 1024, 1024, 1024, 2048]
    - [36, 38.35]
  - - [1024, 2048, 1, 256, 1024, 1024, 1024, 2048]
    - [36, 65.27]
  - - [1024, 2048, 1, 512, 1024, 1024, 1024, 2048]
    - [38, 98.56]
  - - [1024, 2048, 1, 1024, 1024, 1024, 1024, 2048]
    - [77, 134.05]
  - - [1024, 2048, 1, 2048, 1024, 1024, 1024, 2048]
    - [37, 160.03]
  - - [1024, 2048, 1, 4096, 1024, 1024, 1024, 2048]
    - [40, 179.0]
  - - [1024, 2048, 1, 8192, 1024, 1024, 1024, 2048]
    - [38, 163.7]
  - - [1024, 4096, 1, 128, 1024, 1024, 1024, 4096]
    - [27, 56.23]
  - - [1024, 4096, 1, 256, 1024, 1024, 1024, 4096]
    - [29, 93.92]
  - - [1024, 4096, 1, 512, 1024, 1024, 1024, 4096]
    - [29, 142.56]
  - - [1024, 4096, 1, 1024, 1024, 1024, 1024, 4096]
    - [29, 189.51]
  - - [1024, 4096, 1, 2048, 1024, 1024, 1024, 4096]
    - [30, 227.38]
  - - [1024, 4096, 1, 4096, 1024, 1024, 1024, 4096]
    - [73, 231.08]
  - - [1024, 4096, 1, 8192, 1024, 1024, 1024, 4096]
    - [72, 215.2]
  - - [1024, 8192, 1, 128, 1024, 1024, 1024, 8192]
    - [23, 82.44]
  - - [1024, 8192, 1, 256, 1024, 1024, 1024, 8192]
    - [23, 132.66]
  - - [1024, 8192, 1, 512, 1024, 1024, 1024, 8192]
    - [24, 192.25]
  - - [1024, 8192, 1, 1024, 1024, 1024, 1024, 8192]
    - [3, 232.47]
  - - [1024, 8192, 1, 2048, 1024, 1024, 1024, 8192]
    - [3, 267.92]
  - - [1024, 8192, 1, 4096, 1024, 1024, 1024, 8192]
    - [3, 248.74]
  - - [1024, 8192, 1, 8192, 1024, 1024, 1024, 8192]
    - [10, 263.8]
  - - [2048, 128, 1, 128, 2048, 2048, 2048, 128]
    - [56, 7.6]
  - - [2048, 128, 1, 256, 2048, 2048, 2048, 128]
    - [56, 13.14]
  - - [2048, 128, 1, 512, 2048, 2048, 2048, 128]
    - [101, 21.19]
  - - [2048, 128, 1, 1024, 2048, 2048, 2048, 128]
    - [103, 30.91]
  - - [2048, 128, 1, 2048, 2048, 2048, 2048, 128]
    - [97, 37.55]
  - - [2048, 128, 1, 4096, 2048, 2048, 2048, 128]
    - [99, 44.95]
  - - [2048, 128, 1, 8192, 2048, 2048, 2048, 128]
    - [98, 50.58]
  - - [2048, 256, 1, 128, 2048, 2048, 2048, 256]
    - [52, 13.7]
  - - [2048, 256, 1, 256, 2048, 2048, 2048, 256]
    - [52, 23.54]
  - - [2048, 256, 1, 512, 2048, 2048, 2048, 256]
    - [89, 37.46]
  - - [2048, 256, 1, 1024, 2048, 2048, 2048, 256]
    - [89, 53.92]
  - - [2048, 256, 1, 2048, 2048, 2048, 2048, 256]
    - [95, 67.34]
  - - [2048, 256, 1, 4096, 2048, 2048, 2048, 256]
    - [91, 78.07]
  - - [2048, 256, 1, 8192, 2048, 2048, 2048, 256]
    - [93, 85.61]
  - - [2048, 512, 1, 128, 2048, 2048, 2048, 512]
    - [45, 23.99]
  - - [2048, 512, 1, 256, 2048, 2048, 2048, 512]
    - [45, 41.01]
  - - [2048, 512, 1, 512, 2048, 2048, 2048, 512]
    - [45, 63.61]
  - - [2048, 512, 1, 1024, 2048, 2048, 2048, 512]
    - [82, 88.63]
  - - [2048, 512, 1, 2048, 2048, 2048, 2048, 512]
    - [85, 107.94]
  - - [2048, 512, 1, 4096, 2048, 2048, 2048, 512]
    - [84, 124.77]
  - - [2048, 512, 1, 8192, 2048, 2048, 2048, 512]
    - [85, 129.95]
  - - [2048, 1024, 1, 128, 2048, 2048, 2048, 1024]
    - [36, 39.0]
  - - [2048, 1024, 1, 256, 2048, 2048, 2048, 1024]
    - [36, 65.1]
  - - [2048, 1024, 1, 512, 2048, 2048, 2048, 1024]
    - [38, 99.33]
  - - [2048, 1024, 1, 1024, 2048, 2048, 2048, 1024]
    - [77, 134.89]
  - - [2048, 1024, 1, 2048, 2048, 2048, 2048, 1024]
    - [42, 160.07]
  - - [2048, 1024, 1, 4096, 2048, 2048, 2048, 1024]
    - [39, 178.95]
  - - [2048, 1024, 1, 8192, 2048, 2048, 2048, 1024]
    - [43, 162.37]
  - - [2048, 2048, 1, 128, 2048, 2048, 2048, 2048]
    - [27, 55.86]
  - - [2048, 2048, 1, 256, 2048, 2048, 2048, 2048]
    - [29, 94.43]
  - - [2048, 2048, 1, 512, 2048, 2048, 2048, 2048]
    - [33, 141.69]
  - - [2048, 2048, 1, 1024, 2048, 2048, 2048, 2048]
    - [29, 190.05]
  - - [2048, 2048, 1, 2048, 2048, 2048, 2048, 2048]
    - [34, 227.85]
  - - [2048, 2048, 1, 4096, 2048, 2048, 2048, 2048]
    - [31, 228.89]
  - - [2048, 2048, 1, 8192, 2048, 2048, 2048, 2048]
    - [73, 213.45]
  - - [2048, 4096, 1, 128, 2048, 2048, 2048, 4096]
    - [2, 70.69]
  - - [2048, 4096, 1, 256, 2048, 2048, 2048, 4096]
    - [1, 117.83]
  - - [2048, 4096, 1, 512, 2048, 2048, 2048, 4096]
    - [3, 176.5]
  - - [2048, 4096, 1, 1024, 2048, 2048, 2048, 4096]
    - [3, 234.28]
  - - [2048, 4096, 1, 2048, 2048, 2048, 2048, 4096]
    - [12, 262.66]
  - - [2048, 4096, 1, 4096, 2048, 2048, 2048, 4096]
    - [12, 248.03]
  - - [2048, 4096, 1, 8192, 2048, 2048, 2048, 4096]
    - [68, 261.33]
  - - [2048, 8192, 1, 128, 2048, 2048, 2048, 8192]
    - [22, 90.53]
  - - [2048, 8192, 1, 256, 2048, 2048, 2048, 8192]
    - [25, 139.97]
  - - [2048, 8192, 1, 512, 2048, 2048, 2048, 8192]
    - [23, 189.49]
  - - [2048, 8192, 1, 1024, 2048, 2048, 2048, 8192]
    - [3, 228.72]
  - - [2048, 8192, 1, 2048, 2048, 2048, 2048, 8192]
    - [15, 232.99]
  - - [2048, 8192, 1, 4096, 2048, 2048, 2048, 8192]
    - [9, 277.42]
  - - [2048, 8192, 1, 8192, 2048, 2048, 2048, 8192]
    - [8, 326.13]
  - - [4096, 128, 1, 128, 4096, 4096, 4096, 128]
    - [51, 13.79]
  - - [4096, 128, 1, 256, 4096, 4096, 4096, 128]
    - [52, 23.67]
  - - [4096, 128, 1, 512, 4096, 4096, 4096, 128]
    - [89, 37.19]
  - - [4096, 128, 1, 1024, 4096, 4096, 4096, 128]
    - [89, 53.49]
  - - [4096, 128, 1, 2048, 4096, 4096, 4096, 128]
    - [92, 66.01]
  - - [4096, 128, 1, 4096, 4096, 4096, 4096, 128]
    - [96, 78.04]
  - - [4096, 128, 1, 8192, 4096, 4096, 4096, 128]
    - [92, 84.85]
  - - [4096, 256, 1, 128, 4096, 4096, 4096, 256]
    - [49, 23.44]
  - - [4096, 256, 1, 256, 4096, 4096, 4096, 256]
    - [45, 40.36]
  - - [4096, 256, 1, 512, 4096, 4096, 4096, 256]
    - [48, 62.45]
  - - [4096, 256, 1, 1024, 4096, 4096, 4096, 256]
    - [44, 88.19]
  - - [4096, 256, 1, 2048, 4096, 4096, 4096, 256]
    - [83, 107.53]
  - - [4096, 256, 1, 4096, 4096, 4096, 4096, 256]
    - [85, 125.09]
  - - [4096, 256, 1, 8192, 4096, 4096, 4096, 256]
    - [85, 129.39]
  - - [4096, 512, 1, 128, 4096, 4096, 4096, 512]
    - [38, 38.44]
  - - [4096, 512, 1, 256, 4096, 4096, 4096, 512]
    - [36, 64.87]
  - - [4096, 512, 1, 512, 4096, 4096, 4096, 512]
    - [38, 99.02]
  - - [4096, 512, 1, 1024, 4096, 4096, 4096, 512]
    - [41, 131.05]
  - - [4096, 512, 1, 2048, 4096, 4096, 4096, 512]
    - [43, 159.14]
  - - [4096, 512, 1, 4096, 4096, 4096, 4096, 512]
    - [39, 177.5]
  - - [4096, 512, 1, 8192, 4096, 4096, 4096, 512]
    - [42, 166.15]
  - - [4096, 1024, 1, 128, 4096, 4096, 4096, 1024]
    - [27, 55.97]
  - - [4096, 1024, 1, 256, 4096, 4096, 4096, 1024]
    - [29, 94.48]
  - - [4096, 1024, 1, 512, 4096, 4096, 4096, 1024]
    - [26, 141.78]
  - - [4096, 1024, 1, 1024, 4096, 4096, 4096, 1024]
    - [34, 188.37]
  - - [4096, 1024, 1, 2048, 4096, 4096, 4096, 1024]
    - [34, 227.06]
  - - [4096, 1024, 1, 4096, 4096, 4096, 4096, 1024]
    - [18, 231.84]
  - - [4096, 1024, 1, 8192, 4096, 4096, 4096, 1024]
    - [74, 217.02]
  - - [4096, 2048, 1, 128, 4096, 4096, 4096, 2048]
    - [2, 70.33]
  - - [4096, 2048, 1, 256, 4096, 4096, 4096, 2048]
    - [1, 117.73]
  - - [4096, 2048, 1, 512, 4096, 4096, 4096, 2048]
    - [3, 176.1]
  - - [4096, 2048, 1, 1024, 4096, 4096, 4096, 2048]
    - [6, 231.56]
  - - [4096, 2048, 1, 2048, 4096, 4096, 4096, 2048]
    - [14, 260.41]
  - - [4096, 2048, 1, 4096, 4096, 4096, 4096, 2048]
    - [6, 246.51]
  - - [4096, 2048, 1, 8192, 4096, 4096, 4096, 2048]
    - [6, 262.95]
  - - [4096, 4096, 1, 128, 4096, 4096, 4096, 4096]
    - [12, 77.48]
  - - [4096, 4096, 1, 256, 4096, 4096, 4096, 4096]
    - [12, 127.1]
  - - [4096, 4096, 1, 512, 4096, 4096, 4096, 4096]
    - [14, 186.77]
  - - [4096, 4096, 1, 1024, 4096, 4096, 4096, 4096]
    - [5, 226.18]
  - - [4096, 4096, 1, 2048, 4096, 4096, 4096, 4096]
    - [20, 230.64]
  - - [4096, 4096, 1, 4096, 4096, 4096, 4096, 4096]
    - [10, 283.11]
  - - [4096, 4096, 1, 8192, 4096, 4096, 4096, 4096]
    - [2, 325.32]
  - - [4096, 8192, 1, 128, 4096, 4096, 4096, 8192]
    - [22, 97.75]
  - - [4096, 8192, 1, 256, 4096, 4096, 4096, 8192]
    - [23, 145.19]
  - - [4096, 8192, 1, 512, 4096, 4096, 4096, 8192]
    - [18, 191.34]
  - - [4096, 8192, 1, 1024, 4096, 4096, 4096, 8192]
    - [21, 220.56]
  - - [4096, 8192, 1, 2048, 4096, 4096, 4096, 8192]
    - [1, 260.09]
  - - [4096, 8192, 1, 4096, 4096, 4096, 4096, 8192]
    - [0, 316.27]
  - - [4096, 8192, 1, 8192, 4096, 4096, 4096, 8192]
    - [64, 355.33]
  - - [8192, 128, 1, 128, 8192, 8192, 8192, 128]
    - [45, 24.58]
  - - [8192, 128, 1, 256, 8192, 8192, 8192, 128]
    - [45, 41.39]
  - - [8192, 128, 1, 512, 8192, 8192, 8192, 128]
    - [45, 63.71]
  - - [8192, 128, 1, 1024, 8192, 8192, 8192, 128]
    - [85, 87.63]
  - - [8192, 128, 1, 2048, 8192, 8192, 8192, 128]
    - [85, 108.07]
  - - [8192, 128, 1, 4096, 8192, 8192, 8192, 128]
    - [83, 125.49]
  - - [8192, 128, 1, 8192, 8192, 8192, 8192, 128]
    - [84, 127.55]
  - - [8192, 256, 1, 128, 8192, 8192, 8192, 256]
    - [38, 38.78]
  - - [8192, 256, 1, 256, 8192, 8192, 8192, 256]
    - [37, 64.81]
  - - [8192, 256, 1, 512, 8192, 8192, 8192, 256]
    - [38, 98.54]
  - - [8192, 256, 1, 1024, 8192, 8192, 8192, 256]
    - [78, 132.83]
  - - [8192, 256, 1, 2048, 8192, 8192, 8192, 256]
    - [42, 159.95]
  - - [8192, 256, 1, 4096, 8192, 8192, 8192, 256]
    - [41, 178.15]
  - - [8192, 256, 1, 8192, 8192, 8192, 8192, 256]
    - [40, 162.82]
  - - [8192, 512, 1, 128, 8192, 8192, 8192, 512]
    - [15, 55.71]
  - - [8192, 512, 1, 256, 8192, 8192, 8192, 512]
    - [27, 93.41]
  - - [8192, 512, 1, 512, 8192, 8192, 8192, 512]
    - [32, 140.43]
  - - [8192, 512, 1, 1024, 8192, 8192, 8192, 512]
    - [30, 187.51]
  - - [8192, 512, 1, 2048, 8192, 8192, 8192, 512]
    - [32, 226.46]
  - - [8192, 512, 1, 4096, 8192, 8192, 8192, 512]
    - [34, 231.0]
  - - [8192, 512, 1, 8192, 8192, 8192, 8192, 512]
    - [21, 215.72]
  - - [8192, 1024, 1, 128, 8192, 8192, 8192, 1024]
    - [5, 70.99]
  - - [8192, 1024, 1, 256, 8192, 8192, 8192, 1024]
    - [14, 117.5]
  - - [8192, 1024, 1, 512, 8192, 8192, 8192, 1024]
    - [10, 176.25]
  - - [8192, 1024, 1, 1024, 8192, 8192, 8192, 1024]
    - [14, 231.08]
  - - [8192, 1024, 1, 2048, 8192, 8192, 8192, 1024]
    - [7, 259.99]
  - - [8192, 1024, 1, 4096, 8192, 8192, 8192, 1024]
    - [14, 252.63]
  - - [8192, 1024, 1, 8192, 8192, 8192, 8192, 1024]
    - [16, 275.82]
  - - [8192, 2048, 1, 128, 8192, 8192, 8192, 2048]
    - [12, 76.47]
  - - [8192, 2048, 1, 256, 8192, 8192, 8192, 2048]
    - [13, 125.23]
  - - [8192, 2048, 1, 512, 8192, 8192, 8192, 2048]
    - [12, 184.27]
  - - [8192, 2048, 1, 1024, 8192, 8192, 8192, 2048]
    - [13, 223.45]
  - - [8192, 2048, 1, 2048, 8192, 8192, 8192, 2048]
    - [21, 234.14]
  - - [8192, 2048, 1, 4096, 8192, 8192, 8192, 2048]
    - [10, 282.21]
  - - [8192, 2048, 1, 8192, 8192, 8192, 8192, 2048]
    - [65, 331.44]
  - - [8192, 4096, 1, 128, 8192, 8192, 8192, 4096]
    - [4, 81.1]
  - - [8192, 4096, 1, 256, 8192, 8192, 8192, 4096]
    - [0, 129.01]
  - - [8192, 4096, 1, 512, 8192, 8192, 8192, 4096]
    - [19, 187.27]
  - - [8192, 4096, 1, 1024, 8192, 8192, 8192, 4096]
    - [17, 218.52]
  - - [8192, 4096, 1, 2048, 8192, 8192, 8192, 4096]
    - [75, 260.07]
  - - [8192, 4096, 1, 4096, 8192, 8192, 8192, 4096]
    - [11, 305.86]
  - - [8192, 4096, 1, 8192, 8192, 8192, 8192, 4096]
    - [67, 336.95]
  - - [8192, 8192, 1, 128, 8192, 8192, 8192, 8192]
    - [22, 92.47]
  - - [8192, 8192, 1, 256, 8192, 8192, 8192, 8192]
    - [15, 140.36]
  - - [8192, 8192, 1, 512, 8192, 8192, 8192, 8192]
    - [4, 204.55]
  - - [8192, 8192, 1, 1024, 8192, 8192, 8192, 8192]
    - [69, 266.74]
  - - [8192, 8192, 1, 2048, 8192, 8192, 8192, 8192]
    - [66, 322.14]
  - - [8192, 8192, 1, 4096, 8192, 8192, 8192, 8192]
    - [70, 357.8]
  - - [8192, 8192, 1, 8192, 8192, 8192, 8192, 8192]
    - [3, 345.83]
- null
- null
- ExperimentalStreamK
- GridBased
