projects/hipblaslt/library/src/amd_detail/rocblaslt/src/Tensile/Logic/asm_full/aquavanjaram/gfx942_228cu/StreamK/aquavanjaram942_Cijk_Alik_Bljk_B8F8NBS_BH_Bias_HAS_SAV_UserArgs.yaml
- {MinimumRequiredVersion: 4.33.0}
- aquavanjaram942
- {Architecture: gfx942, CUCount: 228}
- [Device 0049, Device 0050]
    SolutionIndex: 0
    SolutionNameMin: Cijk_Alik_Bljk_B8F8NBS_BH_Bias_HAS_SAV_UserArgs_MT256x256x64_MI16x16x1_SN_LDSB1_CLR1_GRVWA8_GRVWB16_GSU0_GSUC0_GSUWGMRR0_K1_LBSPPA512_LBSPPB512_LPA8_LPB16_LRVW8_MIWT8_8_PLR1_SU0_SUM0_SUS64_VWA8_VWB8_WGM1_WGMXCC1_WGMXCCGn1
    SolutionIndex: 1
    SolutionNameMin: Cijk_Alik_Bljk_B8F8NBS_BH_Bias_HAS_SAV_UserArgs_MT256x256x64_MI16x16x1_SN_LDSB1_CLR1_GRVWA16_GRVWB16_GSU0_GSUC0_GSUWGMRR0_K1_LBSPPA512_LBSPPB512_LPA16_LPB16_LRVW8_MIWT8_8_PLR1_SU0_SUM0_SUS64_VWA8_VWB8_WGM1_WGMXCC1_WGMXCCGn1
    SolutionIndex: 2
    SolutionNameMin: Cijk_Alik_Bljk_B8F8NBS_BH_Bias_HAS_SAV_UserArgs_MT256x256x64_MI16x16x1_SN_LDSB1_CLR1_GRVWA8_GRVWB16_GSU0_GSUC0_GSUWGMRR0_K1_LBSPPA512_LBSPPB512_LPA8_LPB16_LRVW8_MIWT8_8_PLR1_SU0_SUM0_SUS64_VWA8_VWB8_WGM4_WGMXCC1_WGMXCCGn1
    SolutionIndex: 3
    SolutionNameMin: Cijk_Alik_Bljk_B8F8NBS_BH_Bias_HAS_SAV_UserArgs_MT256x256x64_MI16x16x1_SN_LDSB1_CLR1_GRVWA16_GRVWB16_GSU0_GSUC0_GSUWGMRR0_K1_LBSPPA512_LBSPPB512_LPA16_LPB16_LRVW8_MIWT8_8_PLR1_SU0_SUM0_SUS64_VWA8_VWB8_WGM4_WGMXCC1_WGMXCCGn1
    SolutionIndex: 4
    SolutionNameMin: Cijk_Alik_Bljk_B8F8NBS_BH_Bias_HAS_SAV_UserArgs_MT256x256x64_MI16x16x1_SN_LDSB1_CLR1_GRVWA16_GRVWB16_GSU0_GSUC0_GSUWGMRR0_K1_LBSPPA512_LBSPPB512_LPA16_LPB16_LRVW8_MIWT8_8_PLR1_SU0_SUM0_SUS64_VWA8_VWB8_WGM6_WGMXCC1_WGMXCCGn1
    SolutionIndex: 5
    SolutionNameMin: Cijk_Alik_Bljk_B8F8NBS_BH_Bias_HAS_SAV_UserArgs_MT256x256x64_MI16x16x1_SN_LDSB1_CLR1_GRVWA8_GRVWB16_GSU0_GSUC0_GSUWGMRR0_K1_LBSPPA512_LBSPPB512_LPA8_LPB16_LRVW8_MIWT8_8_PLR1_SU0_SUM0_SUS64_VWA8_VWB8_WGM8_WGMXCC1_WGMXCCGn1
    SolutionIndex: 6
    SolutionNameMin: Cijk_Alik_Bljk_B8F8NBS_BH_Bias_HAS_SAV_UserArgs_MT256x256x64_MI16x16x1_SN_LDSB1_CLR1_GRVWA16_GRVWB16_GSU0_GSUC0_GSUWGMRR0_K1_LBSPPA512_LBSPPB512_LPA16_LPB16_LRVW8_MIWT8_8_PLR1_SU0_SUM0_SUS64_VWA8_VWB8_WGM8_WGMXCC1_WGMXCCGn1
    SolutionIndex: 7
    SolutionNameMin: Cijk_Alik_Bljk_B8F8NBS_BH_Bias_HAS_SAV_UserArgs_MT128x256x64_MI16x16x1_SN_LDSB1_CLR1_GRVWA8_GRVWB16_GSU0_GSUC0_GSUWGMRR0_K1_LBSPPA256_LBSPPB512_LPA8_LPB16_LRVW8_MIWT4_8_PLR1_SU0_SUM0_SUS64_VWA4_VWB8_WGM1_WGMXCC1_WGMXCCGn1
    SolutionIndex: 8
    SolutionNameMin: Cijk_Alik_Bljk_B8F8NBS_BH_Bias_HAS_SAV_UserArgs_MT256x128x64_MI16x16x1_SN_LDSB1_CLR1_GRVWA8_GRVWB16_GSU0_GSUC0_GSUWGMRR0_K1_LBSPPA512_LBSPPB256_LPA8_LPB16_LRVW8_MIWT8_4_PLR1_SU0_SUM0_SUS64_VWA8_VWB4_WGM1_WGMXCC1_WGMXCCGn1
    SolutionIndex: 9
    SolutionNameMin: Cijk_Alik_Bljk_B8F8NBS_BH_Bias_HAS_SAV_UserArgs_MT256x128x64_MI16x16x1_SN_LDSB1_CLR1_GRVWA16_GRVWB16_GSU0_GSUC0_GSUWGMRR0_K1_LBSPPA512_LBSPPB256_LPA16_LPB16_LRVW8_MIWT8_4_PLR1_SU0_SUM0_SUS64_VWA8_VWB4_WGM1_WGMXCC1_WGMXCCGn1
    SolutionIndex: 10
    SolutionNameMin: Cijk_Alik_Bljk_B8F8NBS_BH_Bias_HAS_SAV_UserArgs_MT256x128x64_MI16x16x1_SN_LDSB1_CLR1_GRVWA16_GRVWB16_GSU0_GSUC0_GSUWGMRR0_K1_LBSPPA512_LBSPPB256_LPA16_LPB16_LRVW8_MIWT8_4_PLR1_SU0_SUM0_SUS64_VWA8_VWB4_WGM4_WGMXCC1_WGMXCCGn1
    SolutionIndex: 11
    SolutionNameMin: Cijk_Alik_Bljk_B8F8NBS_BH_Bias_HAS_SAV_UserArgs_MT256x128x64_MI16x16x1_SN_LDSB1_CLR1_GRVWA8_GRVWB16_GSU0_GSUC0_GSUWGMRR0_K1_LBSPPA512_LBSPPB256_LPA8_LPB16_LRVW8_MIWT8_4_PLR1_SU0_SUM0_SUS64_VWA8_VWB4_WGM8_WGMXCC1_WGMXCCGn1
    SolutionIndex: 12
    SolutionNameMin: Cijk_Alik_Bljk_B8F8NBS_BH_Bias_HAS_SAV_UserArgs_MT256x128x64_MI16x16x1_SN_LDSB1_CLR1_GRVWA16_GRVWB16_GSU0_GSUC0_GSUWGMRR0_K1_LBSPPA512_LBSPPB256_LPA16_LPB16_LRVW8_MIWT8_4_PLR1_SU0_SUM0_SUS64_VWA8_VWB4_WGM8_WGMXCC1_WGMXCCGn1
    SolutionIndex: 13
    SolutionNameMin: Cijk_Alik_Bljk_B8F8NBS_BH_Bias_HAS_SAV_UserArgs_MT128x128x64_MI16x16x1_SN_LDSB1_CLR1_GRVWA8_GRVWB16_GSU0_GSUC0_GSUWGMRR0_K1_LBSPPA512_LBSPPB128_LPA8_LPB16_LRVW8_MIWT8_2_PLR1_SU0_SUM0_SUS64_VWA8_VWB2_WGM1_WGMXCC1_WGMXCCGn1
    SolutionIndex: 14
    SolutionNameMin: Cijk_Alik_Bljk_B8F8NBS_BH_Bias_HAS_SAV_UserArgs_MT128x128x64_MI16x16x1_SN_LDSB1_CLR1_GRVWA8_GRVWB16_GSU0_GSUC0_GSUWGMRR0_K1_LBSPPA512_LBSPPB128_LPA8_LPB16_LRVW8_MIWT8_2_PLR1_SU0_SUM0_SUS64_VWA8_VWB2_WGM4_WGMXCC1_WGMXCCGn1
    SolutionIndex: 15
    SolutionNameMin: Cijk_Alik_Bljk_B8F8NBS_BH_Bias_HAS_SAV_UserArgs_MT128x128x64_MI16x16x1_SN_LDSB1_CLR1_GRVWA8_GRVWB16_GSU0_GSUC0_GSUWGMRR0_K1_LBSPPA512_LBSPPB128_LPA8_LPB16_LRVW8_MIWT8_2_PLR1_SU0_SUM0_SUS64_VWA8_VWB2_WGM6_WGMXCC1_WGMXCCGn1
    SolutionIndex: 16
    SolutionNameMin: Cijk_Alik_Bljk_B8F8NBS_BH_Bias_HAS_SAV_UserArgs_MT128x64x64_MI16x16x1_SN_LDSB0_CLR1_GRVWA8_GRVWB16_GSU0_GSUC0_GSUWGMRR0_K1_LBSPPA512_LBSPPB128_LPA8_LPB16_LRVW8_MIWT8_1_PLR1_SU0_SUM0_SUS64_VWA8_VWB1_WGM1_WGMXCC1_WGMXCCGn1
    SolutionIndex: 17
    SolutionNameMin: Cijk_Alik_Bljk_B8F8NBS_BH_Bias_HAS_SAV_UserArgs_MT64x128x64_MI16x16x1_SN_LDSB0_CLR1_GRVWA8_GRVWB16_GSU0_GSUC0_GSUWGMRR0_K1_LBSPPA128_LBSPPB256_LPA8_LPB16_LRVW8_MIWT2_4_PLR1_SU0_SUM0_SUS64_VWA2_VWB4_WGM1_WGMXCC1_WGMXCCGn1
    SolutionIndex: 18
    SolutionNameMin: Cijk_Alik_Bljk_B8F8NBS_BH_Bias_HAS_SAV_UserArgs_MT64x128x64_MI16x16x1_SN_LDSB0_CLR1_GRVWA16_GRVWB16_GSU0_GSUC0_GSUWGMRR0_K1_LBSPPA128_LBSPPB256_LPA16_LPB16_LRVW8_MIWT2_4_PLR1_SU0_SUM0_SUS64_VWA2_VWB4_WGM1_WGMXCC1_WGMXCCGn1
    SolutionIndex: 19
    SolutionNameMin: Cijk_Alik_Bljk_B8F8NBS_BH_Bias_HAS_SAV_UserArgs_MT128x64x64_MI16x16x1_SN_LDSB0_CLR1_GRVWA16_GRVWB8_GSU0_GSUC0_GSUWGMRR0_K1_LBSPPA256_LBSPPB128_LPA16_LPB8_LRVW8_MIWT4_2_PLR1_SU0_SUM0_SUS64_VWA4_VWB2_WGM1_WGMXCC1_WGMXCCGn1
    SolutionIndex: 20
    SolutionNameMin: Cijk_Alik_Bljk_B8F8NBS_BH_Bias_HAS_SAV_UserArgs_MT128x64x64_MI16x16x1_SN_LDSB0_CLR1_GRVWA8_GRVWB16_GSU0_GSUC0_GSUWGMRR0_K1_LBSPPA256_LBSPPB128_LPA8_LPB16_LRVW8_MIWT4_2_PLR1_SU0_SUM0_SUS64_VWA4_VWB2_WGM1_WGMXCC1_WGMXCCGn1
    SolutionIndex: 21
    SolutionNameMin: Cijk_Alik_Bljk_B8F8NBS_BH_Bias_HAS_SAV_UserArgs_MT128x64x64_MI16x16x1_SN_LDSB0_CLR1_GRVWA16_GRVWB16_GSU0_GSUC0_GSUWGMRR0_K1_LBSPPA256_LBSPPB128_LPA16_LPB16_LRVW8_MIWT4_2_PLR1_SU0_SUM0_SUS64_VWA4_VWB2_WGM1_WGMXCC1_WGMXCCGn1
    SolutionIndex: 22
    SolutionNameMin: Cijk_Alik_Bljk_B8F8NBS_BH_Bias_HAS_SAV_UserArgs_MT128x64x64_MI16x16x1_SN_LDSB0_CLR1_GRVWA8_GRVWB16_GSU0_GSUC0_GSUWGMRR0_K1_LBSPPA256_LBSPPB128_LPA8_LPB16_LRVW8_MIWT4_2_PLR1_SU0_SUM0_SUS64_VWA4_VWB2_WGM4_WGMXCC1_WGMXCCGn1
    SolutionIndex: 23
    SolutionNameMin: Cijk_Alik_Bljk_B8F8NBS_BH_Bias_HAS_SAV_UserArgs_MT128x64x64_MI16x16x1_SN_LDSB0_CLR1_GRVWA8_GRVWB16_GSU0_GSUC0_GSUWGMRR0_K1_LBSPPA256_LBSPPB128_LPA8_LPB16_LRVW8_MIWT4_2_PLR1_SU0_SUM0_SUS64_VWA4_VWB2_WGM6_WGMXCC1_WGMXCCGn1
    SolutionIndex: 24
    SolutionNameMin: Cijk_Alik_Bljk_B8F8NBS_BH_Bias_HAS_SAV_UserArgs_MT128x64x64_MI16x16x1_SN_LDSB0_CLR1_GRVWA8_GRVWB16_GSU0_GSUC0_GSUWGMRR0_K1_LBSPPA256_LBSPPB128_LPA8_LPB16_LRVW8_MIWT4_2_PLR1_SU0_SUM0_SUS64_VWA4_VWB2_WGM8_WGMXCC1_WGMXCCGn1
    SolutionIndex: 25
    SolutionNameMin: Cijk_Alik_Bljk_B8F8NBS_BH_Bias_HAS_SAV_UserArgs_MT64x64x64_MI16x16x1_SN_LDSB0_CLR1_GRVWA8_GRVWB8_GSU0_GSUC0_GSUWGMRR0_K1_LBSPPA128_LBSPPB128_LPA8_LPB8_LRVW8_MIWT2_2_PLR1_SU0_SUM0_SUS64_VWA2_VWB2_WGM1_WGMXCC1_WGMXCCGn1
    SolutionIndex: 26
    SolutionNameMin: Cijk_Alik_Bljk_B8F8NBS_BH_Bias_HAS_SAV_UserArgs_MT64x64x64_MI16x16x1_SN_LDSB0_CLR1_GRVWA8_GRVWB16_GSU0_GSUC0_GSUWGMRR0_K1_LBSPPA128_LBSPPB128_LPA8_LPB16_LRVW8_MIWT2_2_PLR1_SU0_SUM0_SUS64_VWA2_VWB2_WGM1_WGMXCC1_WGMXCCGn1
    SolutionIndex: 27
    SolutionNameMin: Cijk_Alik_Bljk_B8F8NBS_BH_Bias_HAS_SAV_UserArgs_MT64x64x64_MI16x16x1_SN_LDSB0_CLR1_GRVWA16_GRVWB16_GSU0_GSUC0_GSUWGMRR0_K1_LBSPPA128_LBSPPB128_LPA16_LPB16_LRVW8_MIWT2_2_PLR1_SU0_SUM0_SUS64_VWA2_VWB2_WGM1_WGMXCC1_WGMXCCGn1
    SolutionIndex: 28
    SolutionNameMin: Cijk_Alik_Bljk_B8F8NBS_BH_Bias_HAS_SAV_UserArgs_MT64x64x64_MI16x16x1_SN_LDSB0_CLR1_GRVWA8_GRVWB8_GSU0_GSUC0_GSUWGMRR0_K1_LBSPPA128_LBSPPB128_LPA8_LPB8_LRVW8_MIWT2_2_PLR1_SU0_SUM0_SUS64_VWA2_VWB2_WGM6_WGMXCC1_WGMXCCGn1
    SolutionIndex: 29
    SolutionNameMin: Cijk_Alik_Bljk_B8F8NBS_BH_Bias_HAS_SAV_UserArgs_MT64x64x64_MI16x16x1_SN_LDSB0_CLR1_GRVWA8_GRVWB16_GSU0_GSUC0_GSUWGMRR0_K1_LBSPPA128_LBSPPB128_LPA8_LPB16_LRVW8_MIWT2_2_PLR1_SU0_SUM0_SUS64_VWA2_VWB2_WGM6_WGMXCC1_WGMXCCGn1
    SolutionIndex: 30
    SolutionNameMin: Cijk_Alik_Bljk_B8F8NBS_BH_Bias_HAS_SAV_UserArgs_MT64x64x64_MI16x16x1_SN_LDSB0_CLR1_GRVWA8_GRVWB16_GSU0_GSUC0_GSUWGMRR0_K1_LBSPPA128_LBSPPB128_LPA8_LPB16_LRVW8_MIWT2_2_PLR1_SU0_SUM0_SUS64_VWA2_VWB2_WGM8_WGMXCC1_WGMXCCGn1
    SolutionIndex: 31
    SolutionNameMin: Cijk_Alik_Bljk_B8F8NBS_BH_Bias_HAS_SAV_UserArgs_MT64x32x64_MI16x16x1_SN_LDSB0_CLR1_GRVWA8_GRVWB8_GSU0_GSUC0_GSUWGMRR0_K1_LBSPPA128_LBSPPB128_LPA8_LPB8_LRVW8_MIWT2_1_PLR1_SU0_SUM0_SUS64_VWA2_VWB1_WGM1_WGMXCC1_WGMXCCGn1
    SolutionIndex: 32
    SolutionNameMin: Cijk_Alik_Bljk_B8F8NBS_BH_Bias_HAS_SAV_UserArgs_MT64x32x64_MI16x16x1_SN_LDSB0_CLR1_GRVWA16_GRVWB8_GSU0_GSUC0_GSUWGMRR0_K1_LBSPPA128_LBSPPB128_LPA16_LPB8_LRVW8_MIWT2_1_PLR1_SU0_SUM0_SUS64_VWA2_VWB1_WGM1_WGMXCC1_WGMXCCGn1
    SolutionIndex: 33
    SolutionNameMin: Cijk_Alik_Bljk_B8F8NBS_BH_Bias_HAS_SAV_UserArgs_MT64x32x64_MI16x16x1_SN_LDSB0_CLR1_GRVWA16_GRVWB8_GSU0_GSUC0_GSUWGMRR0_K1_LBSPPA128_LBSPPB128_LPA16_LPB8_LRVW8_MIWT2_1_PLR1_SU0_SUM0_SUS64_VWA2_VWB1_WGM6_WGMXCC1_WGMXCCGn1
    SolutionIndex: 34
    SolutionNameMin: Cijk_Alik_Bljk_B8F8NBS_BH_Bias_HAS_SAV_UserArgs_MT64x32x64_MI16x16x1_SN_LDSB0_CLR1_GRVWA16_GRVWB8_GSU0_GSUC0_GSUWGMRR0_K1_LBSPPA128_LBSPPB128_LPA16_LPB8_LRVW8_MIWT2_1_PLR1_SU0_SUM0_SUS64_VWA2_VWB1_WGM8_WGMXCC1_WGMXCCGn1
    SolutionIndex: 35
    SolutionNameMin: Cijk_Alik_Bljk_B8F8NBS_BH_Bias_HAS_SAV_UserArgs_MT32x32x64_MI16x16x1_SN_LDSB0_CLR1_GRVWA8_GRVWB8_GSU0_GSUC0_GSUWGMRR0_K1_LBSPPA128_LBSPPB128_LPA8_LPB8_LRVW8_MIWT1_1_PLR1_SU0_SUM0_SUS64_VWA1_VWB1_WGM1_WGMXCC1_WGMXCCGn1
    SolutionIndex: 36
    SolutionNameMin: Cijk_Alik_Bljk_B8F8NBS_BH_Bias_HAS_SAV_UserArgs_MT128x256x128_MI16x16x1_SN_LDSB1_CLR1_GRVWA8_GRVWB16_GSU0_GSUC0_GSUWGMRR0_K1_LBSPPA512_LBSPPB1024_LPA8_LPB16_LRVW8_MIWT4_8_PLR1_SU0_SUM0_SUS128_VWA4_VWB8_WGM1_WGMXCC1_WGMXCCGn1
    SolutionIndex: 37
    SolutionNameMin: Cijk_Alik_Bljk_B8F8NBS_BH_Bias_HAS_SAV_UserArgs_MT128x256x128_MI16x16x1_SN_LDSB1_CLR1_GRVWA8_GRVWB16_GSU0_GSUC0_GSUWGMRR0_K1_LBSPPA512_LBSPPB1024_LPA8_LPB16_LRVW8_MIWT4_8_PLR1_SU0_SUM0_SUS128_VWA4_VWB8_WGM6_WGMXCC1_WGMXCCGn1
    SolutionIndex: 38
    SolutionNameMin: Cijk_Alik_Bljk_B8F8NBS_BH_Bias_HAS_SAV_UserArgs_MT256x144x128_MI16x16x1_SN_LDSB1_CLR1_GRVWA8_GRVWB8_GSU0_GSUC0_GSUWGMRR0_K1_LBSPPA512_LBSPPB128_LPA8_LPB8_LRVW8_MIWT4_9_PLR1_SU0_SUM0_SUS128_VWA4_VWB1_WGM1_WGMXCC1_WGMXCCGn1
    SolutionIndex: 39
    SolutionNameMin: Cijk_Alik_Bljk_B8F8NBS_BH_Bias_HAS_SAV_UserArgs_MT256x144x128_MI16x16x1_SN_LDSB1_CLR1_GRVWA16_GRVWB8_GSU0_GSUC0_GSUWGMRR0_K1_LBSPPA512_LBSPPB128_LPA16_LPB8_LRVW8_MIWT4_9_PLR1_SU0_SUM0_SUS128_VWA4_VWB1_WGM1_WGMXCC1_WGMXCCGn1
    SolutionIndex: 40
    SolutionNameMin: Cijk_Alik_Bljk_B8F8NBS_BH_Bias_HAS_SAV_UserArgs_MT256x144x128_MI16x16x1_SN_LDSB1_CLR1_GRVWA8_GRVWB8_GSU0_GSUC0_GSUWGMRR0_K1_LBSPPA512_LBSPPB128_LPA8_LPB8_LRVW8_MIWT4_9_PLR1_SU0_SUM0_SUS128_VWA4_VWB1_WGM4_WGMXCC1_WGMXCCGn1
    SolutionIndex: 41
    SolutionNameMin: Cijk_Alik_Bljk_B8F8NBS_BH_Bias_HAS_SAV_UserArgs_MT256x144x128_MI16x16x1_SN_LDSB1_CLR1_GRVWA16_GRVWB8_GSU0_GSUC0_GSUWGMRR0_K1_LBSPPA512_LBSPPB128_LPA16_LPB8_LRVW8_MIWT4_9_PLR1_SU0_SUM0_SUS128_VWA4_VWB1_WGM4_WGMXCC1_WGMXCCGn1
    SolutionIndex: 42
    SolutionNameMin: Cijk_Alik_Bljk_B8F8NBS_BH_Bias_HAS_SAV_UserArgs_MT256x144x128_MI16x16x1_SN_LDSB1_CLR1_GRVWA8_GRVWB8_GSU0_GSUC0_GSUWGMRR0_K1_LBSPPA512_LBSPPB128_LPA8_LPB8_LRVW8_MIWT4_9_PLR1_SU0_SUM0_SUS128_VWA4_VWB1_WGM6_WGMXCC1_WGMXCCGn1
    SolutionIndex: 43
    SolutionNameMin: Cijk_Alik_Bljk_B8F8NBS_BH_Bias_HAS_SAV_UserArgs_MT256x144x128_MI16x16x1_SN_LDSB1_CLR1_GRVWA16_GRVWB8_GSU0_GSUC0_GSUWGMRR0_K1_LBSPPA512_LBSPPB128_LPA16_LPB8_LRVW8_MIWT4_9_PLR1_SU0_SUM0_SUS128_VWA4_VWB1_WGM6_WGMXCC1_WGMXCCGn1
    SolutionIndex: 44
    SolutionNameMin: Cijk_Alik_Bljk_B8F8NBS_BH_Bias_HAS_SAV_UserArgs_MT256x144x128_MI16x16x1_SN_LDSB1_CLR1_GRVWA8_GRVWB8_GSU0_GSUC0_GSUWGMRR0_K1_LBSPPA512_LBSPPB128_LPA8_LPB8_LRVW8_MIWT4_9_PLR1_SU0_SUM0_SUS128_VWA4_VWB1_WGM8_WGMXCC1_WGMXCCGn1
    SolutionIndex: 45
    SolutionNameMin: Cijk_Alik_Bljk_B8F8NBS_BH_Bias_HAS_SAV_UserArgs_MT256x144x128_MI16x16x1_SN_LDSB1_CLR1_GRVWA16_GRVWB8_GSU0_GSUC0_GSUWGMRR0_K1_LBSPPA512_LBSPPB128_LPA16_LPB8_LRVW8_MIWT4_9_PLR1_SU0_SUM0_SUS128_VWA4_VWB1_WGM8_WGMXCC1_WGMXCCGn1
    SolutionIndex: 46
    SolutionNameMin: Cijk_Alik_Bljk_B8F8NBS_BH_Bias_HAS_SAV_UserArgs_MT256x128x128_MI16x16x1_SN_LDSB1_CLR1_GRVWA8_GRVWB16_GSU0_GSUC0_GSUWGMRR0_K1_LBSPPA1024_LBSPPB512_LPA8_LPB16_LRVW8_MIWT8_4_PLR1_SU0_SUM0_SUS128_VWA8_VWB4_WGM1_WGMXCC1_WGMXCCGn1
    SolutionIndex: 47
    SolutionNameMin: Cijk_Alik_Bljk_B8F8NBS_BH_Bias_HAS_SAV_UserArgs_MT256x128x128_MI16x16x1_SN_LDSB1_CLR1_GRVWA8_GRVWB16_GSU0_GSUC0_GSUWGMRR0_K1_LBSPPA1024_LBSPPB512_LPA8_LPB16_LRVW8_MIWT8_4_PLR1_SU0_SUM0_SUS128_VWA8_VWB4_WGM4_WGMXCC1_WGMXCCGn1
    SolutionIndex: 48
    SolutionNameMin: Cijk_Alik_Bljk_B8F8NBS_BH_Bias_HAS_SAV_UserArgs_MT256x128x128_MI16x16x1_SN_LDSB1_CLR1_GRVWA8_GRVWB16_GSU0_GSUC0_GSUWGMRR0_K1_LBSPPA1024_LBSPPB512_LPA8_LPB16_LRVW8_MIWT8_4_PLR1_SU0_SUM0_SUS128_VWA8_VWB4_WGM6_WGMXCC1_WGMXCCGn1
    SolutionIndex: 49
    SolutionNameMin: Cijk_Alik_Bljk_B8F8NBS_BH_Bias_HAS_SAV_UserArgs_MT256x128x128_MI16x16x1_SN_LDSB1_CLR1_GRVWA8_GRVWB16_GSU0_GSUC0_GSUWGMRR0_K1_LBSPPA1024_LBSPPB512_LPA8_LPB16_LRVW8_MIWT8_4_PLR1_SU0_SUM0_SUS128_VWA8_VWB4_WGM8_WGMXCC1_WGMXCCGn1
    SolutionIndex: 50
    SolutionNameMin: Cijk_Alik_Bljk_B8F8NBS_BH_Bias_HAS_SAV_UserArgs_MT144x256x128_MI16x16x1_SN_LDSB1_CLR1_GRVWA8_GRVWB16_GSU0_GSUC0_GSUWGMRR0_K1_LBSPPA128_LBSPPB512_LPA8_LPB16_LRVW8_MIWT9_4_PLR1_SU0_SUM0_SUS128_VWA1_VWB4_WGM1_WGMXCC1_WGMXCCGn1
    SolutionIndex: 51
    SolutionNameMin: Cijk_Alik_Bljk_B8F8NBS_BH_Bias_HAS_SAV_UserArgs_MT144x256x128_MI16x16x1_SN_LDSB1_CLR1_GRVWA8_GRVWB8_GSU0_GSUC0_GSUWGMRR0_K1_LBSPPA128_LBSPPB512_LPA8_LPB8_LRVW8_MIWT9_4_PLR1_SU0_SUM0_SUS128_VWA1_VWB4_WGM4_WGMXCC1_WGMXCCGn1
    SolutionIndex: 52
    SolutionNameMin: Cijk_Alik_Bljk_B8F8NBS_BH_Bias_HAS_SAV_UserArgs_MT144x256x128_MI16x16x1_SN_LDSB1_CLR1_GRVWA8_GRVWB16_GSU0_GSUC0_GSUWGMRR0_K1_LBSPPA128_LBSPPB512_LPA8_LPB16_LRVW8_MIWT9_4_PLR1_SU0_SUM0_SUS128_VWA1_VWB4_WGM4_WGMXCC1_WGMXCCGn1
    SolutionIndex: 53
    SolutionNameMin: Cijk_Alik_Bljk_B8F8NBS_BH_Bias_HAS_SAV_UserArgs_MT144x256x128_MI16x16x1_SN_LDSB1_CLR1_GRVWA8_GRVWB8_GSU0_GSUC0_GSUWGMRR0_K1_LBSPPA128_LBSPPB512_LPA8_LPB8_LRVW8_MIWT9_4_PLR1_SU0_SUM0_SUS128_VWA1_VWB4_WGM6_WGMXCC1_WGMXCCGn1
    SolutionIndex: 54
    SolutionNameMin: Cijk_Alik_Bljk_B8F8NBS_BH_Bias_HAS_SAV_UserArgs_MT144x256x128_MI16x16x1_SN_LDSB1_CLR1_GRVWA8_GRVWB16_GSU0_GSUC0_GSUWGMRR0_K1_LBSPPA128_LBSPPB512_LPA8_LPB16_LRVW8_MIWT9_4_PLR1_SU0_SUM0_SUS128_VWA1_VWB4_WGM6_WGMXCC1_WGMXCCGn1
    SolutionIndex: 55
    SolutionNameMin: Cijk_Alik_Bljk_B8F8NBS_BH_Bias_HAS_SAV_UserArgs_MT144x256x128_MI16x16x1_SN_LDSB1_CLR1_GRVWA8_GRVWB8_GSU0_GSUC0_GSUWGMRR0_K1_LBSPPA128_LBSPPB512_LPA8_LPB8_LRVW8_MIWT9_4_PLR1_SU0_SUM0_SUS128_VWA1_VWB4_WGM8_WGMXCC1_WGMXCCGn1
    SolutionIndex: 56
    SolutionNameMin: Cijk_Alik_Bljk_B8F8NBS_BH_Bias_HAS_SAV_UserArgs_MT144x256x128_MI16x16x1_SN_LDSB1_CLR1_GRVWA8_GRVWB16_GSU0_GSUC0_GSUWGMRR0_K1_LBSPPA128_LBSPPB512_LPA8_LPB16_LRVW8_MIWT9_4_PLR1_SU0_SUM0_SUS128_VWA1_VWB4_WGM8_WGMXCC1_WGMXCCGn1
    SolutionIndex: 57
    SolutionNameMin: Cijk_Alik_Bljk_B8F8NBS_BH_Bias_HAS_SAV_UserArgs_MT128x128x128_MI16x16x1_SN_LDSB1_CLR1_GRVWA8_GRVWB16_GSU0_GSUC0_GSUWGMRR0_K1_LBSPPA1024_LBSPPB256_LPA8_LPB16_LRVW8_MIWT8_2_PLR1_SU0_SUM0_SUS128_VWA8_VWB2_WGM1_WGMXCC1_WGMXCCGn1
    SolutionIndex: 58
    SolutionNameMin: Cijk_Alik_Bljk_B8F8NBS_BH_Bias_HAS_SAV_UserArgs_MT128x128x128_MI16x16x1_SN_LDSB1_CLR1_GRVWA8_GRVWB16_GSU0_GSUC0_GSUWGMRR0_K1_LBSPPA1024_LBSPPB256_LPA8_LPB16_LRVW8_MIWT8_2_PLR1_SU0_SUM0_SUS128_VWA8_VWB2_WGM4_WGMXCC1_WGMXCCGn1
    SolutionIndex: 59
    SolutionNameMin: Cijk_Alik_Bljk_B8F8NBS_BH_Bias_HAS_SAV_UserArgs_MT128x128x128_MI16x16x1_SN_LDSB1_CLR1_GRVWA8_GRVWB16_GSU0_GSUC0_GSUWGMRR0_K1_LBSPPA1024_LBSPPB256_LPA8_LPB16_LRVW8_MIWT8_2_PLR1_SU0_SUM0_SUS128_VWA8_VWB2_WGM6_WGMXCC1_WGMXCCGn1
    SolutionIndex: 60
    SolutionNameMin: Cijk_Alik_Bljk_B8F8NBS_BH_Bias_HAS_SAV_UserArgs_MT128x128x128_MI16x16x1_SN_LDSB1_CLR1_GRVWA8_GRVWB16_GSU0_GSUC0_GSUWGMRR0_K1_LBSPPA1024_LBSPPB256_LPA8_LPB16_LRVW8_MIWT8_2_PLR1_SU0_SUM0_SUS128_VWA8_VWB2_WGM8_WGMXCC1_WGMXCCGn1
    SolutionIndex: 61
    SolutionNameMin: Cijk_Alik_Bljk_B8F8NBS_BH_Bias_HAS_SAV_UserArgs_MT128x144x128_MI16x16x1_SN_LDSB1_CLR1_GRVWA8_GRVWB8_GSU0_GSUC0_GSUWGMRR0_K1_LBSPPA256_LBSPPB128_LPA8_LPB8_LRVW8_MIWT2_9_PLR1_SU0_SUM0_SUS128_VWA2_VWB1_WGM1_WGMXCC1_WGMXCCGn1
    SolutionIndex: 62
    SolutionNameMin: Cijk_Alik_Bljk_B8F8NBS_BH_Bias_HAS_SAV_UserArgs_MT128x144x128_MI16x16x1_SN_LDSB1_CLR1_GRVWA16_GRVWB8_GSU0_GSUC0_GSUWGMRR0_K1_LBSPPA256_LBSPPB128_LPA16_LPB8_LRVW8_MIWT2_9_PLR1_SU0_SUM0_SUS128_VWA2_VWB1_WGM1_WGMXCC1_WGMXCCGn1
    SolutionIndex: 63
    SolutionNameMin: Cijk_Alik_Bljk_B8F8NBS_BH_Bias_HAS_SAV_UserArgs_MT128x144x128_MI16x16x1_SN_LDSB1_CLR1_GRVWA16_GRVWB8_GSU0_GSUC0_GSUWGMRR0_K1_LBSPPA256_LBSPPB128_LPA16_LPB8_LRVW8_MIWT2_9_PLR1_SU0_SUM0_SUS128_VWA2_VWB1_WGM4_WGMXCC1_WGMXCCGn1
    SolutionIndex: 64
    SolutionNameMin: Cijk_Alik_Bljk_B8F8NBS_BH_Bias_HAS_SAV_UserArgs_MT144x128x128_MI16x16x1_SN_LDSB1_CLR1_GRVWA8_GRVWB16_GSU0_GSUC0_GSUWGMRR0_K1_LBSPPA128_LBSPPB256_LPA8_LPB16_LRVW8_MIWT9_2_PLR1_SU0_SUM0_SUS128_VWA1_VWB2_WGM1_WGMXCC1_WGMXCCGn1
    SolutionIndex: 65
    SolutionNameMin: Cijk_Alik_Bljk_B8F8NBS_BH_Bias_HAS_SAV_UserArgs_MT144x128x128_MI16x16x1_SN_LDSB1_CLR1_GRVWA8_GRVWB16_GSU0_GSUC0_GSUWGMRR0_K1_LBSPPA128_LBSPPB256_LPA8_LPB16_LRVW8_MIWT9_2_PLR1_SU0_SUM0_SUS128_VWA1_VWB2_WGM4_WGMXCC1_WGMXCCGn1
    SolutionIndex: 66
    SolutionNameMin: Cijk_Alik_Bljk_B8F8NBS_BH_Bias_HAS_SAV_UserArgs_MT144x128x128_MI16x16x1_SN_LDSB1_CLR1_GRVWA8_GRVWB16_GSU0_GSUC0_GSUWGMRR0_K1_LBSPPA128_LBSPPB256_LPA8_LPB16_LRVW8_MIWT9_2_PLR1_SU0_SUM0_SUS128_VWA1_VWB2_WGM8_WGMXCC1_WGMXCCGn1
    SolutionIndex: 67
    SolutionNameMin: Cijk_Alik_Bljk_B8F8NBS_BH_Bias_HAS_SAV_UserArgs_MT128x128x128_MI16x16x1_SN_LDSB1_CLR1_GRVWA8_GRVWB16_GSU0_GSUC0_GSUWGMRR0_K1_LBSPPA512_LBSPPB512_LPA8_LPB16_LRVW8_MIWT4_4_PLR1_SU0_SUM0_SUS128_VWA4_VWB4_WGM1_WGMXCC1_WGMXCCGn1
    SolutionIndex: 68
    SolutionNameMin: Cijk_Alik_Bljk_B8F8NBS_BH_Bias_HAS_SAV_UserArgs_MT128x128x128_MI16x16x1_SN_LDSB1_CLR1_GRVWA16_GRVWB16_GSU0_GSUC0_GSUWGMRR0_K1_LBSPPA512_LBSPPB512_LPA16_LPB16_LRVW8_MIWT4_4_PLR1_SU0_SUM0_SUS128_VWA4_VWB4_WGM1_WGMXCC1_WGMXCCGn1
    SolutionIndex: 69
    SolutionNameMin: Cijk_Alik_Bljk_B8F8NBS_BH_Bias_HAS_SAV_UserArgs_MT128x128x128_MI16x16x1_SN_LDSB1_CLR1_GRVWA8_GRVWB16_GSU0_GSUC0_GSUWGMRR0_K1_LBSPPA512_LBSPPB512_LPA8_LPB16_LRVW8_MIWT4_4_PLR1_SU0_SUM0_SUS128_VWA4_VWB4_WGM4_WGMXCC1_WGMXCCGn1
    SolutionIndex: 70
    SolutionNameMin: Cijk_Alik_Bljk_B8F8NBS_BH_Bias_HAS_SAV_UserArgs_MT128x128x128_MI16x16x1_SN_LDSB1_CLR1_GRVWA16_GRVWB16_GSU0_GSUC0_GSUWGMRR0_K1_LBSPPA512_LBSPPB512_LPA16_LPB16_LRVW8_MIWT4_4_PLR1_SU0_SUM0_SUS128_VWA4_VWB4_WGM4_WGMXCC1_WGMXCCGn1
    SolutionIndex: 71
    SolutionNameMin: Cijk_Alik_Bljk_B8F8NBS_BH_Bias_HAS_SAV_UserArgs_MT128x128x128_MI16x16x1_SN_LDSB1_CLR1_GRVWA8_GRVWB16_GSU0_GSUC0_GSUWGMRR0_K1_LBSPPA512_LBSPPB512_LPA8_LPB16_LRVW8_MIWT4_4_PLR1_SU0_SUM0_SUS128_VWA4_VWB4_WGM6_WGMXCC1_WGMXCCGn1
    SolutionIndex: 72
    SolutionNameMin: Cijk_Alik_Bljk_B8F8NBS_BH_Bias_HAS_SAV_UserArgs_MT128x128x128_MI16x16x1_SN_LDSB1_CLR1_GRVWA16_GRVWB16_GSU0_GSUC0_GSUWGMRR0_K1_LBSPPA512_LBSPPB512_LPA16_LPB16_LRVW8_MIWT4_4_PLR1_SU0_SUM0_SUS128_VWA4_VWB4_WGM6_WGMXCC1_WGMXCCGn1
    SolutionIndex: 73
    SolutionNameMin: Cijk_Alik_Bljk_B8F8NBS_BH_Bias_HAS_SAV_UserArgs_MT128x128x128_MI16x16x1_SN_LDSB1_CLR1_GRVWA8_GRVWB16_GSU0_GSUC0_GSUWGMRR0_K1_LBSPPA512_LBSPPB512_LPA8_LPB16_LRVW8_MIWT4_4_PLR1_SU0_SUM0_SUS128_VWA4_VWB4_WGM8_WGMXCC1_WGMXCCGn1
    SolutionIndex: 74
    SolutionNameMin: Cijk_Alik_Bljk_B8F8NBS_BH_Bias_HAS_SAV_UserArgs_MT128x128x128_MI16x16x1_SN_LDSB1_CLR1_GRVWA16_GRVWB16_GSU0_GSUC0_GSUWGMRR0_K1_LBSPPA512_LBSPPB512_LPA16_LPB16_LRVW8_MIWT4_4_PLR1_SU0_SUM0_SUS128_VWA4_VWB4_WGM8_WGMXCC1_WGMXCCGn1
    SolutionIndex: 75
    SolutionNameMin: Cijk_Alik_Bljk_B8F8NBS_BH_Bias_HAS_SAV_UserArgs_MT64x128x128_MI16x16x1_SN_LDSB1_CLR1_GRVWA8_GRVWB16_GSU0_GSUC0_GSUWGMRR0_K1_LBSPPA256_LBSPPB512_LPA8_LPB16_LRVW8_MIWT2_4_PLR1_SU0_SUM0_SUS128_VWA2_VWB4_WGM1_WGMXCC1_WGMXCCGn1
    SolutionIndex: 76
    SolutionNameMin: Cijk_Alik_Bljk_B8F8NBS_BH_Bias_HAS_SAV_UserArgs_MT64x128x128_MI16x16x1_SN_LDSB1_CLR1_GRVWA8_GRVWB16_GSU0_GSUC0_GSUWGMRR0_K1_LBSPPA256_LBSPPB512_LPA8_LPB16_LRVW8_MIWT2_4_PLR1_SU0_SUM0_SUS128_VWA2_VWB4_WGM4_WGMXCC1_WGMXCCGn1
    SolutionIndex: 77
    SolutionNameMin: Cijk_Alik_Bljk_B8F8NBS_BH_Bias_HAS_SAV_UserArgs_MT64x128x128_MI16x16x1_SN_LDSB1_CLR1_GRVWA16_GRVWB16_GSU0_GSUC0_GSUWGMRR0_K1_LBSPPA256_LBSPPB512_LPA16_LPB16_LRVW8_MIWT2_4_PLR1_SU0_SUM0_SUS128_VWA2_VWB4_WGM6_WGMXCC1_WGMXCCGn1
    SolutionIndex: 78
    SolutionNameMin: Cijk_Alik_Bljk_B8F8NBS_BH_Bias_HAS_SAV_UserArgs_MT64x128x128_MI16x16x1_SN_LDSB1_CLR1_GRVWA8_GRVWB16_GSU0_GSUC0_GSUWGMRR0_K1_LBSPPA256_LBSPPB512_LPA8_LPB16_LRVW8_MIWT2_4_PLR1_SU0_SUM0_SUS128_VWA2_VWB4_WGM8_WGMXCC1_WGMXCCGn1
    SolutionIndex: 79
    SolutionNameMin: Cijk_Alik_Bljk_B8F8NBS_BH_Bias_HAS_SAV_UserArgs_MT64x64x128_MI16x16x1_SN_LDSB1_CLR1_GRVWA16_GRVWB8_GSU0_GSUC0_GSUWGMRR0_K1_LBSPPA256_LBSPPB256_LPA16_LPB8_LRVW8_MIWT2_2_PLR1_SU0_SUM0_SUS128_VWA2_VWB2_WGM1_WGMXCC1_WGMXCCGn1
    SolutionIndex: 80
    SolutionNameMin: Cijk_Alik_Bljk_B8F8NBS_BH_Bias_HAS_SAV_UserArgs_MT64x64x128_MI16x16x1_SN_LDSB1_CLR1_GRVWA8_GRVWB16_GSU0_GSUC0_GSUWGMRR0_K1_LBSPPA256_LBSPPB256_LPA8_LPB16_LRVW8_MIWT2_2_PLR1_SU0_SUM0_SUS128_VWA2_VWB2_WGM1_WGMXCC1_WGMXCCGn1
    SolutionIndex: 81
    SolutionNameMin: Cijk_Alik_Bljk_B8F8NBS_BH_Bias_HAS_SAV_UserArgs_MT64x64x128_MI16x16x1_SN_LDSB1_CLR1_GRVWA8_GRVWB16_GSU0_GSUC0_GSUWGMRR0_K1_LBSPPA256_LBSPPB256_LPA8_LPB16_LRVW8_MIWT2_2_PLR1_SU0_SUM0_SUS128_VWA2_VWB2_WGM4_WGMXCC1_WGMXCCGn1
    SolutionIndex: 82
    SolutionNameMin: Cijk_Alik_Bljk_B8F8NBS_BH_Bias_HAS_SAV_UserArgs_MT64x64x128_MI16x16x1_SN_LDSB1_CLR1_GRVWA8_GRVWB16_GSU0_GSUC0_GSUWGMRR0_K1_LBSPPA256_LBSPPB256_LPA8_LPB16_LRVW8_MIWT2_2_PLR1_SU0_SUM0_SUS128_VWA2_VWB2_WGM6_WGMXCC1_WGMXCCGn1
    SolutionIndex: 83
    SolutionNameMin: Cijk_Alik_Bljk_B8F8NBS_BH_Bias_HAS_SAV_UserArgs_MT64x64x128_MI16x16x1_SN_LDSB1_CLR1_GRVWA8_GRVWB16_GSU0_GSUC0_GSUWGMRR0_K1_LBSPPA256_LBSPPB256_LPA8_LPB16_LRVW8_MIWT2_2_PLR1_SU0_SUM0_SUS128_VWA2_VWB2_WGM8_WGMXCC1_WGMXCCGn1
    SolutionIndex: 84
    SolutionNameMin: Cijk_Alik_Bljk_B8F8NBS_BH_Bias_HAS_SAV_UserArgs_MT32x64x128_MI16x16x1_SN_LDSB0_CLR1_GRVWA8_GRVWB8_GSU0_GSUC0_GSUWGMRR0_K1_LBSPPA128_LBSPPB256_LPA8_LPB8_LRVW8_MIWT1_2_PLR1_SU0_SUM0_SUS128_VWA1_VWB2_WGM1_WGMXCC1_WGMXCCGn1
    SolutionIndex: 85
    SolutionNameMin: Cijk_Alik_Bljk_B8F8NBS_BH_Bias_HAS_SAV_UserArgs_MT32x64x128_MI16x16x1_SN_LDSB0_CLR1_GRVWA8_GRVWB16_GSU0_GSUC0_GSUWGMRR0_K1_LBSPPA128_LBSPPB256_LPA8_LPB16_LRVW8_MIWT1_2_PLR1_SU0_SUM0_SUS128_VWA1_VWB2_WGM1_WGMXCC1_WGMXCCGn1
    SolutionIndex: 86
    SolutionNameMin: Cijk_Alik_Bljk_B8F8NBS_BH_Bias_HAS_SAV_UserArgs_MT32x64x128_MI16x16x1_SN_LDSB0_CLR1_GRVWA8_GRVWB8_GSU0_GSUC0_GSUWGMRR0_K1_LBSPPA128_LBSPPB256_LPA8_LPB8_LRVW8_MIWT1_2_PLR1_SU0_SUM0_SUS128_VWA1_VWB2_WGM6_WGMXCC1_WGMXCCGn1
    SolutionIndex: 87
    SolutionNameMin: Cijk_Alik_Bljk_B8F8NBS_BH_Bias_HAS_SAV_UserArgs_MT64x32x128_MI16x16x1_SN_LDSB0_CLR1_GRVWA8_GRVWB8_GSU0_GSUC0_GSUWGMRR0_K1_LBSPPA256_LBSPPB128_LPA8_LPB8_LRVW8_MIWT2_1_PLR1_SU0_SUM0_SUS128_VWA2_VWB1_WGM1_WGMXCC1_WGMXCCGn1
    SolutionIndex: 88
    SolutionNameMin: Cijk_Alik_Bljk_B8F8NBS_BH_Bias_HAS_SAV_UserArgs_MT64x32x128_MI16x16x1_SN_LDSB0_CLR1_GRVWA16_GRVWB8_GSU0_GSUC0_GSUWGMRR0_K1_LBSPPA256_LBSPPB128_LPA16_LPB8_LRVW8_MIWT2_1_PLR1_SU0_SUM0_SUS128_VWA2_VWB1_WGM1_WGMXCC1_WGMXCCGn1
    SolutionIndex: 89
    SolutionNameMin: Cijk_Alik_Bljk_B8F8NBS_BH_Bias_HAS_SAV_UserArgs_MT64x32x128_MI16x16x1_SN_LDSB0_CLR1_GRVWA8_GRVWB16_GSU0_GSUC0_GSUWGMRR0_K1_LBSPPA256_LBSPPB128_LPA8_LPB16_LRVW8_MIWT2_1_PLR1_SU0_SUM0_SUS128_VWA2_VWB1_WGM1_WGMXCC1_WGMXCCGn1
    SolutionIndex: 90
    SolutionNameMin: Cijk_Alik_Bljk_B8F8NBS_BH_Bias_HAS_SAV_UserArgs_MT64x32x128_MI16x16x1_SN_LDSB0_CLR1_GRVWA16_GRVWB16_GSU0_GSUC0_GSUWGMRR0_K1_LBSPPA256_LBSPPB128_LPA16_LPB16_LRVW8_MIWT2_1_PLR1_SU0_SUM0_SUS128_VWA2_VWB1_WGM1_WGMXCC1_WGMXCCGn1
    SolutionIndex: 91
    SolutionNameMin: Cijk_Alik_Bljk_B8F8NBS_BH_Bias_HAS_SAV_UserArgs_MT32x32x128_MI16x16x1_SN_LDSB0_CLR1_GRVWA8_GRVWB8_GSU0_GSUC0_GSUWGMRR0_K1_LBSPPA128_LBSPPB128_LPA8_LPB8_LRVW8_MIWT1_1_PLR1_SU0_SUM0_SUS128_VWA1_VWB1_WGM1_WGMXCC1_WGMXCCGn1
    SolutionIndex: 92
    SolutionNameMin: Cijk_Alik_Bljk_B8F8NBS_BH_Bias_HAS_SAV_UserArgs_MT32x32x128_MI16x16x1_SN_LDSB0_CLR1_GRVWA16_GRVWB8_GSU0_GSUC0_GSUWGMRR0_K1_LBSPPA128_LBSPPB128_LPA16_LPB8_LRVW8_MIWT1_1_PLR1_SU0_SUM0_SUS128_VWA1_VWB1_WGM1_WGMXCC1_WGMXCCGn1
    SolutionIndex: 93
    SolutionNameMin: Cijk_Alik_Bljk_B8F8NBS_BH_Bias_HAS_SAV_UserArgs_MT32x32x128_MI16x16x1_SN_LDSB0_CLR1_GRVWA8_GRVWB16_GSU0_GSUC0_GSUWGMRR0_K1_LBSPPA128_LBSPPB128_LPA8_LPB16_LRVW8_MIWT1_1_PLR1_SU0_SUM0_SUS128_VWA1_VWB1_WGM1_WGMXCC1_WGMXCCGn1
    SolutionIndex: 94
    SolutionNameMin: Cijk_Alik_Bljk_B8F8NBS_BH_Bias_HAS_SAV_UserArgs_MT32x32x128_MI16x16x1_SN_LDSB0_CLR1_GRVWA16_GRVWB16_GSU0_GSUC0_GSUWGMRR0_K1_LBSPPA128_LBSPPB128_LPA16_LPB16_LRVW8_MIWT1_1_PLR1_SU0_SUM0_SUS128_VWA1_VWB1_WGM1_WGMXCC1_WGMXCCGn1
    SolutionIndex: 95
    SolutionNameMin: Cijk_Alik_Bljk_B8F8NBS_BH_Bias_HAS_SAV_UserArgs_MT32x32x128_MI16x16x1_SN_LDSB0_CLR1_GRVWA8_GRVWB8_GSU0_GSUC0_GSUWGMRR0_K1_LBSPPA128_LBSPPB128_LPA8_LPB8_LRVW8_MIWT1_1_PLR1_SU0_SUM0_SUS128_VWA1_VWB1_WGM8_WGMXCC1_WGMXCCGn1
    SolutionIndex: 96
    SolutionNameMin: Cijk_Alik_Bljk_B8F8NBS_BH_Bias_HAS_SAV_UserArgs_MT32x32x128_MI16x16x1_SN_LDSB0_CLR1_GRVWA16_GRVWB8_GSU0_GSUC0_GSUWGMRR0_K1_LBSPPA128_LBSPPB128_LPA16_LPB8_LRVW8_MIWT1_1_PLR1_SU0_SUM0_SUS128_VWA1_VWB1_WGM8_WGMXCC1_WGMXCCGn1
    SolutionIndex: 97
    SolutionNameMin: Cijk_Alik_Bljk_B8F8NBS_BH_Bias_HAS_SAV_UserArgs_MT128x64x256_MI16x16x1_SN_LDSB1_CLR1_GRVWA8_GRVWB16_GSU0_GSUC0_GSUWGMRR0_K1_LBSPPA1024_LBSPPB512_LPA8_LPB16_LRVW8_MIWT4_2_PLR1_SU0_SUM0_SUS256_VWA4_VWB2_WGM1_WGMXCC1_WGMXCCGn1
    SolutionIndex: 98
    SolutionNameMin: Cijk_Alik_Bljk_B8F8NBS_BH_Bias_HAS_SAV_UserArgs_MT128x64x256_MI16x16x1_SN_LDSB1_CLR1_GRVWA8_GRVWB16_GSU0_GSUC0_GSUWGMRR0_K1_LBSPPA1024_LBSPPB512_LPA8_LPB16_LRVW8_MIWT4_2_PLR1_SU0_SUM0_SUS256_VWA4_VWB2_WGM4_WGMXCC1_WGMXCCGn1
    SolutionIndex: 99
    SolutionNameMin: Cijk_Alik_Bljk_B8F8NBS_BH_Bias_HAS_SAV_UserArgs_MT128x64x256_MI16x16x1_SN_LDSB1_CLR1_GRVWA8_GRVWB16_GSU0_GSUC0_GSUWGMRR0_K1_LBSPPA1024_LBSPPB512_LPA8_LPB16_LRVW8_MIWT4_2_PLR1_SU0_SUM0_SUS256_VWA4_VWB2_WGM6_WGMXCC1_WGMXCCGn1
    SolutionIndex: 100
    SolutionNameMin: Cijk_Alik_Bljk_B8F8NBS_BH_Bias_HAS_SAV_UserArgs_MT128x64x256_MI16x16x1_SN_LDSB1_CLR1_GRVWA8_GRVWB16_GSU0_GSUC0_GSUWGMRR0_K1_LBSPPA1024_LBSPPB512_LPA8_LPB16_LRVW8_MIWT4_2_PLR1_SU0_SUM0_SUS256_VWA4_VWB2_WGM8_WGMXCC1_WGMXCCGn1
    SolutionIndex: 101
    SolutionNameMin: Cijk_Alik_Bljk_B8F8NBS_BH_Bias_HAS_SAV_UserArgs_MT64x64x256_MI16x16x1_SN_LDSB1_CLR1_GRVWA8_GRVWB16_GSU0_GSUC0_GSUWGMRR0_K1_LBSPPA512_LBSPPB512_LPA8_LPB16_LRVW8_MIWT2_2_PLR1_SU0_SUM0_SUS256_VWA2_VWB2_WGM1_WGMXCC1_WGMXCCGn1
    SolutionIndex: 102
    SolutionNameMin: Cijk_Alik_Bljk_B8F8NBS_BH_Bias_HAS_SAV_UserArgs_MT64x64x256_MI16x16x1_SN_LDSB1_CLR1_GRVWA8_GRVWB16_GSU0_GSUC0_GSUWGMRR0_K1_LBSPPA512_LBSPPB512_LPA8_LPB16_LRVW8_MIWT2_2_PLR1_SU0_SUM0_SUS256_VWA2_VWB2_WGM4_WGMXCC1_WGMXCCGn1
    SolutionIndex: 103
    SolutionNameMin: Cijk_Alik_Bljk_B8F8NBS_BH_Bias_HAS_SAV_UserArgs_MT64x64x256_MI16x16x1_SN_LDSB1_CLR1_GRVWA8_GRVWB16_GSU0_GSUC0_GSUWGMRR0_K1_LBSPPA512_LBSPPB512_LPA8_LPB16_LRVW8_MIWT2_2_PLR1_SU0_SUM0_SUS256_VWA2_VWB2_WGM6_WGMXCC1_WGMXCCGn1
    SolutionIndex: 104
    SolutionNameMin: Cijk_Alik_Bljk_B8F8NBS_BH_Bias_HAS_SAV_UserArgs_MT64x64x256_MI16x16x1_SN_LDSB1_CLR1_GRVWA8_GRVWB16_GSU0_GSUC0_GSUWGMRR0_K1_LBSPPA512_LBSPPB512_LPA8_LPB16_LRVW8_MIWT2_2_PLR1_SU0_SUM0_SUS256_VWA2_VWB2_WGM8_WGMXCC1_WGMXCCGn1
    SolutionIndex: 105
    SolutionNameMin: Cijk_Alik_Bljk_B8F8NBS_BH_Bias_HAS_SAV_UserArgs_MT32x32x256_MI16x16x1_SN_LDSB1_CLR1_GRVWA8_GRVWB16_GSU0_GSUC0_GSUWGMRR0_K1_LBSPPA256_LBSPPB256_LPA8_LPB16_LRVW8_MIWT1_1_PLR1_SU0_SUM0_SUS256_VWA1_VWB1_WGM1_WGMXCC1_WGMXCCGn1
    SolutionIndex: 106
    SolutionNameMin: Cijk_Alik_Bljk_B8F8NBS_BH_Bias_HAS_SAV_UserArgs_MT32x32x256_MI16x16x1_SN_LDSB1_CLR1_GRVWA16_GRVWB16_GSU0_GSUC0_GSUWGMRR0_K1_LBSPPA256_LBSPPB256_LPA16_LPB16_LRVW8_MIWT1_1_PLR1_SU0_SUM0_SUS256_VWA1_VWB1_WGM1_WGMXCC1_WGMXCCGn1
    SolutionIndex: 107
    SolutionNameMin: Cijk_Alik_Bljk_B8F8NBS_BH_Bias_HAS_SAV_UserArgs_MT32x32x256_MI16x16x1_SN_LDSB1_CLR1_GRVWA8_GRVWB16_GSU0_GSUC0_GSUWGMRR0_K1_LBSPPA256_LBSPPB256_LPA8_LPB16_LRVW8_MIWT1_1_PLR1_SU0_SUM0_SUS256_VWA1_VWB1_WGM8_WGMXCC1_WGMXCCGn1
    SolutionIndex: 108
    SolutionNameMin: Cijk_Alik_Bljk_B8F8NBS_BH_Bias_HAS_SAV_UserArgs_MT32x32x32_MI16x16x1_SN_LDSB0_CLR0_GRVWA4_GRVWB4_GSU0_GSUC0_GSUWGMRR0_K1_LBSPPA128_LBSPPB128_LPA8_LPB8_LRVW8_MIWT1_1_PLR0_SU32_SUM0_SUS256_VWA1_VWB1_WGM1_WGMXCC1_WGMXCCGn1
- - - [128, 128, 1, 128, 128, 128, 128, 128]
    - [93, 0.61]
  - - [128, 128, 1, 256, 128, 128, 256, 256]
    - [35, 1.14]
  - - [128, 128, 1, 512, 128, 128, 512, 512]
    - [91, 2.08]
  - - [128, 128, 1, 1024, 128, 128, 1024, 1024]
    - [91, 3.48]
  - - [128, 128, 1, 2048, 128, 128, 2048, 2048]
    - [91, 5.33]
  - - [128, 128, 1, 4096, 128, 128, 4096, 4096]
    - [91, 7.17]
  - - [128, 128, 1, 8192, 128, 128, 8192, 8192]
    - [91, 8.7]
  - - [128, 256, 1, 128, 128, 128, 128, 128]
    - [92, 1.17]
  - - [128, 256, 1, 256, 128, 128, 256, 256]
    - [94, 2.23]
  - - [128, 256, 1, 512, 128, 128, 512, 512]
    - [94, 4.01]
  - - [128, 256, 1, 1024, 128, 128, 1024, 1024]
    - [91, 6.76]
  - - [128, 256, 1, 2048, 128, 128, 2048, 2048]
    - [91, 10.35]
  - - [128, 256, 1, 4096, 128, 128, 4096, 4096]
    - [91, 14.1]
  - - [128, 256, 1, 8192, 128, 128, 8192, 8192]
    - [91, 17.19]
  - - [128, 512, 1, 128, 128, 128, 128, 128]
    - [35, 2.33]
  - - [128, 512, 1, 256, 128, 128, 256, 256]
    - [35, 4.34]
  - - [128, 512, 1, 512, 128, 128, 512, 512]
    - [91, 7.92]
  - - [128, 512, 1, 1024, 128, 128, 1024, 1024]
    - [91, 13.34]
  - - [128, 512, 1, 2048, 128, 128, 2048, 2048]
    - [91, 20.67]
  - - [128, 512, 1, 4096, 128, 128, 4096, 4096]
    - [91, 28.38]
  - - [128, 512, 1, 8192, 128, 128, 8192, 8192]
    - [91, 34.55]
  - - [128, 1024, 1, 128, 128, 128, 128, 128]
    - [31, 4.44]
  - - [128, 1024, 1, 256, 128, 128, 256, 256]
    - [94, 9.16]
  - - [128, 1024, 1, 512, 128, 128, 512, 512]
    - [106, 15.95]
  - - [128, 1024, 1, 1024, 128, 128, 1024, 1024]
    - [91, 27.67]
  - - [128, 1024, 1, 2048, 128, 128, 2048, 2048]
    - [91, 41.39]
  - - [128, 1024, 1, 4096, 128, 128, 4096, 4096]
    - [91, 55.93]
  - - [128, 1024, 1, 8192, 128, 128, 8192, 8192]
    - [91, 67.98]
  - - [128, 2048, 1, 128, 128, 128, 128, 128]
    - [32, 9.03]
  - - [128, 2048, 1, 256, 128, 128, 256, 256]
    - [90, 16.76]
  - - [128, 2048, 1, 512, 128, 128, 512, 512]
    - [89, 29.11]
  - - [128, 2048, 1, 1024, 128, 128, 1024, 1024]
    - [85, 47.04]
  - - [128, 2048, 1, 2048, 128, 128, 2048, 2048]
    - [84, 68.67]
  - - [128, 2048, 1, 4096, 128, 128, 4096, 4096]
    - [84, 88.84]
  - - [128, 2048, 1, 8192, 128, 128, 8192, 8192]
    - [105, 99.44]
  - - [128, 4096, 1, 128, 128, 128, 128, 128]
    - [27, 16.14]
  - - [128, 4096, 1, 256, 128, 128, 256, 256]
    - [26, 29.83]
  - - [128, 4096, 1, 512, 128, 128, 512, 512]
    - [79, 49.47]
  - - [128, 4096, 1, 1024, 128, 128, 1024, 1024]
    - [80, 76.51]
  - - [128, 4096, 1, 2048, 128, 128, 2048, 2048]
    - [79, 105.47]
  - - [128, 4096, 1, 4096, 128, 128, 4096, 4096]
    - [80, 128.55]
  - - [128, 4096, 1, 8192, 128, 128, 8192, 8192]
    - [101, 140.75]
  - - [128, 8192, 1, 128, 128, 128, 128, 128]
    - [16, 25.41]
  - - [128, 8192, 1, 256, 128, 128, 256, 256]
    - [20, 46.01]
  - - [128, 8192, 1, 512, 128, 128, 512, 512]
    - [20, 78.27]
  - - [128, 8192, 1, 1024, 128, 128, 1024, 1024]
    - [20, 117.44]
  - - [128, 8192, 1, 2048, 128, 128, 2048, 2048]
    - [20, 156.97]
  - - [128, 8192, 1, 4096, 128, 128, 4096, 4096]
    - [99, 160.21]
  - - [128, 8192, 1, 8192, 128, 128, 8192, 8192]
    - [75, 180.75]
  - - [256, 128, 1, 128, 256, 256, 128, 128]
    - [92, 1.17]
  - - [256, 128, 1, 256, 256, 256, 256, 256]
    - [94, 2.23]
  - - [256, 128, 1, 512, 256, 256, 512, 512]
    - [92, 3.97]
  - - [256, 128, 1, 1024, 256, 256, 1024, 1024]
    - [91, 6.74]
  - - [256, 128, 1, 2048, 256, 256, 2048, 2048]
    - [91, 10.38]
  - - [256, 128, 1, 4096, 256, 256, 4096, 4096]
    - [91, 14.04]
  - - [256, 128, 1, 8192, 256, 256, 8192, 8192]
    - [91, 17.12]
  - - [256, 256, 1, 128, 256, 256, 128, 128]
    - [94, 2.34]
  - - [256, 256, 1, 256, 256, 256, 256, 256]
    - [92, 4.36]
  - - [256, 256, 1, 512, 256, 256, 512, 512]
    - [91, 7.86]
  - - [256, 256, 1, 1024, 256, 256, 1024, 1024]
    - [91, 13.95]
  - - [256, 256, 1, 2048, 256, 256, 2048, 2048]
    - [91, 21.24]
  - - [256, 256, 1, 4096, 256, 256, 4096, 4096]
    - [91, 28.49]
  - - [256, 256, 1, 8192, 256, 256, 8192, 8192]
    - [91, 34.53]
  - - [256, 512, 1, 128, 256, 256, 128, 128]
    - [94, 4.51]
  - - [256, 512, 1, 256, 256, 256, 256, 256]
    - [91, 8.73]
  - - [256, 512, 1, 512, 256, 256, 512, 512]
    - [94, 15.98]
  - - [256, 512, 1, 1024, 256, 256, 1024, 1024]
    - [91, 27.67]
  - - [256, 512, 1, 2048, 256, 256, 2048, 2048]
    - [91, 41.41]
  - - [256, 512, 1, 4096, 256, 256, 4096, 4096]
    - [91, 55.13]
  - - [256, 512, 1, 8192, 256, 256, 8192, 8192]
    - [91, 66.5]
  - - [256, 1024, 1, 128, 256, 256, 128, 128]
    - [87, 8.96]
  - - [256, 1024, 1, 256, 256, 256, 256, 256]
    - [89, 16.58]
  - - [256, 1024, 1, 512, 256, 256, 512, 512]
    - [87, 29.11]
  - - [256, 1024, 1, 1024, 256, 256, 1024, 1024]
    - [87, 46.91]
  - - [256, 1024, 1, 2048, 256, 256, 2048, 2048]
    - [84, 68.42]
  - - [256, 1024, 1, 4096, 256, 256, 4096, 4096]
    - [84, 88.58]
  - - [256, 1024, 1, 8192, 256, 256, 8192, 8192]
    - [87, 102.45]
  - - [256, 2048, 1, 128, 256, 256, 128, 128]
    - [26, 16.09]
  - - [256, 2048, 1, 256, 256, 256, 256, 256]
    - [26, 29.06]
  - - [256, 2048, 1, 512, 256, 256, 512, 512]
    - [25, 48.93]
  - - [256, 2048, 1, 1024, 256, 256, 1024, 1024]
    - [79, 74.65]
  - - [256, 2048, 1, 2048, 256, 256, 2048, 2048]
    - [80, 104.34]
  - - [256, 2048, 1, 4096, 256, 256, 4096, 4096]
    - [80, 129.74]
  - - [256, 2048, 1, 8192, 256, 256, 8192, 8192]
    - [102, 140.68]
  - - [256, 4096, 1, 128, 256, 256, 128, 128]
    - [21, 26.38]
  - - [256, 4096, 1, 256, 256, 256, 256, 256]
    - [20, 47.59]
  - - [256, 4096, 1, 512, 256, 256, 512, 512]
    - [20, 79.19]
  - - [256, 4096, 1, 1024, 256, 256, 1024, 1024]
    - [20, 118.31]
  - - [256, 4096, 1, 2048, 256, 256, 2048, 2048]
    - [20, 158.08]
  - - [256, 4096, 1, 4096, 256, 256, 4096, 4096]
    - [97, 170.05]
  - - [256, 4096, 1, 8192, 256, 256, 8192, 8192]
    - [75, 186.32]
  - - [256, 8192, 1, 128, 256, 256, 128, 128]
    - [13, 39.26]
  - - [256, 8192, 1, 256, 256, 256, 256, 256]
    - [13, 69.92]
  - - [256, 8192, 1, 512, 256, 256, 512, 512]
    - [13, 114.68]
  - - [256, 8192, 1, 1024, 256, 256, 1024, 1024]
    - [57, 171.26]
  - - [256, 8192, 1, 2048, 256, 256, 2048, 2048]
    - [57, 211.54]
  - - [256, 8192, 1, 4096, 256, 256, 4096, 4096]
    - [72, 215.1]
  - - [256, 8192, 1, 8192, 256, 256, 8192, 8192]
    - [67, 240.53]
  - - [512, 128, 1, 128, 512, 512, 128, 128]
    - [32, 2.31]
  - - [512, 128, 1, 256, 512, 512, 256, 256]
    - [35, 4.48]
  - - [512, 128, 1, 512, 512, 512, 512, 512]
    - [92, 8.12]
  - - [512, 128, 1, 1024, 512, 512, 1024, 1024]
    - [91, 13.71]
  - - [512, 128, 1, 2048, 512, 512, 2048, 2048]
    - [91, 20.89]
  - - [512, 128, 1, 4096, 512, 512, 4096, 4096]
    - [91, 28.19]
  - - [512, 128, 1, 8192, 512, 512, 8192, 8192]
    - [91, 34.32]
  - - [512, 256, 1, 128, 512, 512, 128, 128]
    - [35, 4.58]
  - - [512, 256, 1, 256, 512, 512, 256, 256]
    - [93, 8.53]
  - - [512, 256, 1, 512, 512, 512, 512, 512]
    - [93, 15.34]
  - - [512, 256, 1, 1024, 512, 512, 1024, 1024]
    - [91, 26.16]
  - - [512, 256, 1, 2048, 512, 512, 2048, 2048]
    - [91, 40.04]
  - - [512, 256, 1, 4096, 512, 512, 4096, 4096]
    - [91, 54.0]
  - - [512, 256, 1, 8192, 512, 512, 8192, 8192]
    - [95, 66.17]
  - - [512, 512, 1, 128, 512, 512, 128, 128]
    - [31, 8.54]
  - - [512, 512, 1, 256, 512, 512, 256, 256]
    - [88, 15.7]
  - - [512, 512, 1, 512, 512, 512, 512, 512]
    - [85, 27.75]
  - - [512, 512, 1, 1024, 512, 512, 1024, 1024]
    - [87, 45.24]
  - - [512, 512, 1, 2048, 512, 512, 2048, 2048]
    - [84, 66.2]
  - - [512, 512, 1, 4096, 512, 512, 4096, 4096]
    - [84, 86.78]
  - - [512, 512, 1, 8192, 512, 512, 8192, 8192]
    - [107, 97.16]
  - - [512, 1024, 1, 128, 512, 512, 128, 128]
    - [26, 15.22]
  - - [512, 1024, 1, 256, 512, 512, 256, 256]
    - [25, 27.72]
  - - [512, 1024, 1, 512, 512, 512, 512, 512]
    - [25, 46.98]
  - - [512, 1024, 1, 1024, 512, 512, 1024, 1024]
    - [80, 73.23]
  - - [512, 1024, 1, 2048, 512, 512, 2048, 2048]
    - [80, 104.7]
  - - [512, 1024, 1, 4096, 512, 512, 4096, 4096]
    - [80, 129.88]
  - - [512, 1024, 1, 8192, 512, 512, 8192, 8192]
    - [103, 141.04]
  - - [512, 2048, 1, 128, 512, 512, 128, 128]
    - [21, 25.94]
  - - [512, 2048, 1, 256, 512, 512, 256, 256]
    - [16, 46.85]
  - - [512, 2048, 1, 512, 512, 512, 512, 512]
    - [20, 79.65]
  - - [512, 2048, 1, 1024, 512, 512, 1024, 1024]
    - [24, 118.01]
  - - [512, 2048, 1, 2048, 512, 512, 2048, 2048]
    - [20, 157.05]
  - - [512, 2048, 1, 4096, 512, 512, 4096, 4096]
    - [97, 174.33]
  - - [512, 2048, 1, 8192, 512, 512, 8192, 8192]
    - [75, 187.72]
  - - [512, 4096, 1, 128, 512, 512, 128, 128]
    - [57, 39.36]
  - - [512, 4096, 1, 256, 512, 512, 256, 256]
    - [13, 71.05]
  - - [512, 4096, 1, 512, 512, 512, 512, 512]
    - [13, 113.07]
  - - [512, 4096, 1, 1024, 512, 512, 1024, 1024]
    - [57, 169.35]
  - - [512, 4096, 1, 2048, 512, 512, 2048, 2048]
    - [57, 221.65]
  - - [512, 4096, 1, 4096, 512, 512, 4096, 4096]
    - [68, 221.75]
  - - [512, 4096, 1, 8192, 512, 512, 8192, 8192]
    - [67, 242.75]
  - - [512, 8192, 1, 128, 512, 512, 128, 128]
    - [61, 56.61]
  - - [512, 8192, 1, 256, 512, 512, 256, 256]
    - [62, 101.01]
  - - [512, 8192, 1, 512, 512, 512, 512, 512]
    - [62, 166.71]
  - - [512, 8192, 1, 1024, 512, 512, 1024, 1024]
    - [63, 212.87]
  - - [512, 8192, 1, 2048, 512, 512, 2048, 2048]
    - [46, 228.92]
  - - [512, 8192, 1, 4096, 512, 512, 4096, 4096]
    - [62, 266.2]
  - - [512, 8192, 1, 8192, 512, 512, 8192, 8192]
    - [62, 283.85]
  - - [1024, 128, 1, 128, 1024, 1024, 128, 128]
    - [33, 4.35]
  - - [1024, 128, 1, 256, 1024, 1024, 256, 256]
    - [96, 8.59]
  - - [1024, 128, 1, 512, 1024, 1024, 512, 512]
    - [106, 15.75]
  - - [1024, 128, 1, 1024, 1024, 1024, 1024, 1024]
    - [91, 27.05]
  - - [1024, 128, 1, 2048, 1024, 1024, 2048, 2048]
    - [91, 39.77]
  - - [1024, 128, 1, 4096, 1024, 1024, 4096, 4096]
    - [91, 53.93]
  - - [1024, 128, 1, 8192, 1024, 1024, 8192, 8192]
    - [95, 67.11]
  - - [1024, 256, 1, 128, 1024, 1024, 128, 128]
    - [32, 8.95]
  - - [1024, 256, 1, 256, 1024, 1024, 256, 256]
    - [89, 16.4]
  - - [1024, 256, 1, 512, 1024, 1024, 512, 512]
    - [87, 29.06]
  - - [1024, 256, 1, 1024, 1024, 1024, 1024, 1024]
    - [89, 46.85]
  - - [1024, 256, 1, 2048, 1024, 1024, 2048, 2048]
    - [87, 68.08]
  - - [1024, 256, 1, 4096, 1024, 1024, 4096, 4096]
    - [84, 87.65]
  - - [1024, 256, 1, 8192, 1024, 1024, 8192, 8192]
    - [86, 100.56]
  - - [1024, 512, 1, 128, 1024, 1024, 128, 128]
    - [26, 15.78]
  - - [1024, 512, 1, 256, 1024, 1024, 256, 256]
    - [25, 28.57]
  - - [1024, 512, 1, 512, 1024, 1024, 512, 512]
    - [80, 48.11]
  - - [1024, 512, 1, 1024, 1024, 1024, 1024, 1024]
    - [80, 75.11]
  - - [1024, 512, 1, 2048, 1024, 1024, 2048, 2048]
    - [80, 103.8]
  - - [1024, 512, 1, 4096, 1024, 1024, 4096, 4096]
    - [81, 129.08]
  - - [1024, 512, 1, 8192, 1024, 1024, 8192, 8192]
    - [104, 141.09]
  - - [1024, 1024, 1, 128, 1024, 1024, 128, 128]
    - [18, 25.88]
  - - [1024, 1024, 1, 256, 1024, 1024, 256, 256]
    - [19, 46.83]
  - - [1024, 1024, 1, 512, 1024, 1024, 512, 512]
    - [20, 78.69]
  - - [1024, 1024, 1, 1024, 1024, 1024, 1024, 1024]
    - [20, 118.66]
  - - [1024, 1024, 1, 2048, 1024, 1024, 2048, 2048]
    - [20, 157.08]
  - - [1024, 1024, 1, 4096, 1024, 1024, 4096, 4096]
    - [100, 172.18]
  - - [1024, 1024, 1, 8192, 1024, 1024, 8192, 8192]
    - [77, 185.0]
  - - [1024, 2048, 1, 128, 1024, 1024, 128, 128]
    - [13, 39.61]
  - - [1024, 2048, 1, 256, 1024, 1024, 256, 256]
    - [13, 70.49]
  - - [1024, 2048, 1, 512, 1024, 1024, 512, 512]
    - [13, 116.51]
  - - [1024, 2048, 1, 1024, 1024, 1024, 1024, 1024]
    - [57, 172.07]
  - - [1024, 2048, 1, 2048, 1024, 1024, 2048, 2048]
    - [57, 217.73]
  - - [1024, 2048, 1, 4096, 1024, 1024, 4096, 4096]
    - [57, 220.32]
  - - [1024, 2048, 1, 8192, 1024, 1024, 8192, 8192]
    - [73, 244.61]
  - - [1024, 4096, 1, 128, 1024, 1024, 128, 128]
    - [11, 55.86]
  - - [1024, 4096, 1, 256, 1024, 1024, 256, 256]
    - [11, 97.38]
  - - [1024, 4096, 1, 512, 1024, 1024, 512, 512]
    - [8, 154.63]
  - - [1024, 4096, 1, 1024, 1024, 1024, 1024, 1024]
    - [46, 204.06]
  - - [1024, 4096, 1, 2048, 1024, 1024, 2048, 2048]
    - [46, 233.62]
  - - [1024, 4096, 1, 4096, 1024, 1024, 4096, 4096]
    - [46, 261.09]
  - - [1024, 4096, 1, 8192, 1024, 1024, 8192, 8192]
    - [46, 255.15]
  - - [1024, 8192, 1, 128, 1024, 1024, 128, 128]
    - [45, 71.71]
  - - [1024, 8192, 1, 256, 1024, 1024, 256, 256]
    - [41, 122.41]
  - - [1024, 8192, 1, 512, 1024, 1024, 512, 512]
    - [39, 187.05]
  - - [1024, 8192, 1, 1024, 1024, 1024, 1024, 1024]
    - [39, 220.91]
  - - [1024, 8192, 1, 2048, 1024, 1024, 2048, 2048]
    - [39, 292.23]
  - - [1024, 8192, 1, 4096, 1024, 1024, 4096, 4096]
    - [38, 336.13]
  - - [1024, 8192, 1, 8192, 1024, 1024, 8192, 8192]
    - [38, 352.94]
  - - [2048, 128, 1, 128, 2048, 2048, 128, 128]
    - [34, 8.19]
  - - [2048, 128, 1, 256, 2048, 2048, 256, 256]
    - [89, 15.38]
  - - [2048, 128, 1, 512, 2048, 2048, 512, 512]
    - [85, 28.56]
  - - [2048, 128, 1, 1024, 2048, 2048, 1024, 1024]
    - [85, 45.9]
  - - [2048, 128, 1, 2048, 2048, 2048, 2048, 2048]
    - [87, 67.34]
  - - [2048, 128, 1, 4096, 2048, 2048, 4096, 4096]
    - [84, 88.15]
  - - [2048, 128, 1, 8192, 2048, 2048, 8192, 8192]
    - [86, 99.92]
  - - [2048, 256, 1, 128, 2048, 2048, 128, 128]
    - [29, 15.35]
  - - [2048, 256, 1, 256, 2048, 2048, 256, 256]
    - [30, 28.0]
  - - [2048, 256, 1, 512, 2048, 2048, 512, 512]
    - [28, 47.15]
  - - [2048, 256, 1, 1024, 2048, 2048, 1024, 1024]
    - [82, 73.87]
  - - [2048, 256, 1, 2048, 2048, 2048, 2048, 2048]
    - [83, 102.89]
  - - [2048, 256, 1, 4096, 2048, 2048, 4096, 4096]
    - [81, 128.45]
  - - [2048, 256, 1, 8192, 2048, 2048, 8192, 8192]
    - [103, 141.35]
  - - [2048, 512, 1, 128, 2048, 2048, 128, 128]
    - [18, 25.95]
  - - [2048, 512, 1, 256, 2048, 2048, 256, 256]
    - [17, 46.67]
  - - [2048, 512, 1, 512, 2048, 2048, 512, 512]
    - [22, 78.03]
  - - [2048, 512, 1, 1024, 2048, 2048, 1024, 1024]
    - [22, 117.15]
  - - [2048, 512, 1, 2048, 2048, 2048, 2048, 2048]
    - [23, 155.12]
  - - [2048, 512, 1, 4096, 2048, 2048, 4096, 4096]
    - [76, 173.63]
  - - [2048, 512, 1, 8192, 2048, 2048, 8192, 8192]
    - [78, 188.99]
  - - [2048, 1024, 1, 128, 2048, 2048, 128, 128]
    - [57, 39.32]
  - - [2048, 1024, 1, 256, 2048, 2048, 256, 256]
    - [13, 70.87]
  - - [2048, 1024, 1, 512, 2048, 2048, 512, 512]
    - [13, 116.43]
  - - [2048, 1024, 1, 1024, 2048, 2048, 1024, 1024]
    - [57, 171.99]
  - - [2048, 1024, 1, 2048, 2048, 2048, 2048, 2048]
    - [69, 215.46]
  - - [2048, 1024, 1, 4096, 2048, 2048, 4096, 4096]
    - [70, 221.81]
  - - [2048, 1024, 1, 8192, 2048, 2048, 8192, 8192]
    - [69, 242.8]
  - - [2048, 2048, 1, 128, 2048, 2048, 128, 128]
    - [8, 52.85]
  - - [2048, 2048, 1, 256, 2048, 2048, 256, 256]
    - [8, 93.33]
  - - [2048, 2048, 1, 512, 2048, 2048, 512, 512]
    - [8, 145.52]
  - - [2048, 2048, 1, 1024, 2048, 2048, 1024, 1024]
    - [46, 195.41]
  - - [2048, 2048, 1, 2048, 2048, 2048, 2048, 2048]
    - [49, 232.57]
  - - [2048, 2048, 1, 4096, 2048, 2048, 4096, 4096]
    - [48, 258.04]
  - - [2048, 2048, 1, 8192, 2048, 2048, 8192, 8192]
    - [49, 254.68]
  - - [2048, 4096, 1, 128, 2048, 2048, 128, 128]
    - [1, 63.77]
  - - [2048, 4096, 1, 256, 2048, 2048, 256, 256]
    - [2, 106.74]
  - - [2048, 4096, 1, 512, 2048, 2048, 512, 512]
    - [2, 162.02]
  - - [2048, 4096, 1, 1024, 2048, 2048, 1024, 1024]
    - [6, 216.04]
  - - [2048, 4096, 1, 2048, 2048, 2048, 2048, 2048]
    - [6, 252.42]
  - - [2048, 4096, 1, 4096, 2048, 2048, 4096, 4096]
    - [40, 271.51]
  - - [2048, 4096, 1, 8192, 2048, 2048, 8192, 8192]
    - [42, 307.79]
  - - [2048, 8192, 1, 128, 2048, 2048, 128, 128]
    - [42, 71.02]
  - - [2048, 8192, 1, 256, 2048, 2048, 256, 256]
    - [43, 124.41]
  - - [2048, 8192, 1, 512, 2048, 2048, 512, 512]
    - [39, 180.92]
  - - [2048, 8192, 1, 1024, 2048, 2048, 1024, 1024]
    - [41, 255.17]
  - - [2048, 8192, 1, 2048, 2048, 2048, 2048, 2048]
    - [44, 297.9]
  - - [2048, 8192, 1, 4096, 2048, 2048, 4096, 4096]
    - [40, 314.63]
  - - [2048, 8192, 1, 8192, 2048, 2048, 8192, 8192]
    - [38, 362.69]
  - - [4096, 128, 1, 128, 4096, 4096, 128, 128]
    - [25, 16.05]
  - - [4096, 128, 1, 256, 4096, 4096, 256, 256]
    - [25, 29.4]
  - - [4096, 128, 1, 512, 4096, 4096, 512, 512]
    - [80, 48.93]
  - - [4096, 128, 1, 1024, 4096, 4096, 1024, 1024]
    - [80, 76.06]
  - - [4096, 128, 1, 2048, 4096, 4096, 2048, 2048]
    - [80, 104.56]
  - - [4096, 128, 1, 4096, 4096, 4096, 4096, 4096]
    - [83, 129.25]
  - - [4096, 128, 1, 8192, 4096, 4096, 8192, 8192]
    - [103, 140.95]
  - - [4096, 256, 1, 128, 4096, 4096, 128, 128]
    - [16, 26.57]
  - - [4096, 256, 1, 256, 4096, 4096, 256, 256]
    - [20, 47.97]
  - - [4096, 256, 1, 512, 4096, 4096, 512, 512]
    - [20, 80.73]
  - - [4096, 256, 1, 1024, 4096, 4096, 1024, 1024]
    - [20, 118.96]
  - - [4096, 256, 1, 2048, 4096, 4096, 2048, 2048]
    - [22, 157.11]
  - - [4096, 256, 1, 4096, 4096, 4096, 4096, 4096]
    - [99, 171.46]
  - - [4096, 256, 1, 8192, 4096, 4096, 8192, 8192]
    - [78, 188.55]
  - - [4096, 512, 1, 128, 4096, 4096, 128, 128]
    - [13, 39.52]
  - - [4096, 512, 1, 256, 4096, 4096, 256, 256]
    - [13, 71.14]
  - - [4096, 512, 1, 512, 4096, 4096, 512, 512]
    - [13, 117.43]
  - - [4096, 512, 1, 1024, 4096, 4096, 1024, 1024]
    - [15, 170.39]
  - - [4096, 512, 1, 2048, 4096, 4096, 2048, 2048]
    - [59, 218.45]
  - - [4096, 512, 1, 4096, 4096, 4096, 4096, 4096]
    - [60, 225.22]
  - - [4096, 512, 1, 8192, 4096, 4096, 8192, 8192]
    - [71, 243.65]
  - - [4096, 1024, 1, 128, 4096, 4096, 128, 128]
    - [12, 55.76]
  - - [4096, 1024, 1, 256, 4096, 4096, 256, 256]
    - [11, 97.02]
  - - [4096, 1024, 1, 512, 4096, 4096, 512, 512]
    - [7, 137.82]
  - - [4096, 1024, 1, 1024, 4096, 4096, 1024, 1024]
    - [47, 196.58]
  - - [4096, 1024, 1, 2048, 4096, 4096, 2048, 2048]
    - [49, 233.7]
  - - [4096, 1024, 1, 4096, 4096, 4096, 4096, 4096]
    - [49, 256.42]
  - - [4096, 1024, 1, 8192, 4096, 4096, 8192, 8192]
    - [64, 260.16]
  - - [4096, 2048, 1, 128, 4096, 4096, 128, 128]
    - [1, 60.92]
  - - [4096, 2048, 1, 256, 4096, 4096, 256, 256]
    - [0, 103.4]
  - - [4096, 2048, 1, 512, 4096, 4096, 512, 512]
    - [4, 157.6]
  - - [4096, 2048, 1, 1024, 4096, 4096, 1024, 1024]
    - [5, 212.39]
  - - [4096, 2048, 1, 2048, 4096, 4096, 2048, 2048]
    - [3, 256.23]
  - - [4096, 2048, 1, 4096, 4096, 4096, 4096, 4096]
    - [56, 270.11]
  - - [4096, 2048, 1, 8192, 4096, 4096, 8192, 8192]
    - [36, 305.26]
  - - [4096, 4096, 1, 128, 4096, 4096, 128, 128]
    - [9, 66.97]
  - - [4096, 4096, 1, 256, 4096, 4096, 256, 256]
    - [8, 114.71]
  - - [4096, 4096, 1, 512, 4096, 4096, 512, 512]
    - [6, 169.49]
  - - [4096, 4096, 1, 1024, 4096, 4096, 1024, 1024]
    - [4, 219.64]
  - - [4096, 4096, 1, 2048, 4096, 4096, 2048, 2048]
    - [42, 262.14]
  - - [4096, 4096, 1, 4096, 4096, 4096, 4096, 4096]
    - [50, 280.57]
  - - [4096, 4096, 1, 8192, 4096, 4096, 8192, 8192]
    - [37, 321.62]
  - - [4096, 8192, 1, 128, 4096, 4096, 128, 128]
    - [39, 78.2]
  - - [4096, 8192, 1, 256, 4096, 4096, 256, 256]
    - [39, 133.92]
  - - [4096, 8192, 1, 512, 4096, 4096, 512, 512]
    - [40, 193.56]
  - - [4096, 8192, 1, 1024, 4096, 4096, 1024, 1024]
    - [40, 242.75]
  - - [4096, 8192, 1, 2048, 4096, 4096, 2048, 2048]
    - [44, 298.42]
  - - [4096, 8192, 1, 4096, 4096, 4096, 4096, 4096]
    - [42, 327.06]
  - - [4096, 8192, 1, 8192, 4096, 4096, 8192, 8192]
    - [44, 379.47]
  - - [8192, 128, 1, 128, 8192, 8192, 128, 128]
    - [16, 25.96]
  - - [8192, 128, 1, 256, 8192, 8192, 256, 256]
    - [20, 46.92]
  - - [8192, 128, 1, 512, 8192, 8192, 512, 512]
    - [20, 78.12]
  - - [8192, 128, 1, 1024, 8192, 8192, 1024, 1024]
    - [24, 117.69]
  - - [8192, 128, 1, 2048, 8192, 8192, 2048, 2048]
    - [75, 151.13]
  - - [8192, 128, 1, 4096, 8192, 8192, 4096, 4096]
    - [100, 165.85]
  - - [8192, 128, 1, 8192, 8192, 8192, 8192, 8192]
    - [98, 181.88]
  - - [8192, 256, 1, 128, 8192, 8192, 128, 128]
    - [57, 38.89]
  - - [8192, 256, 1, 256, 8192, 8192, 256, 256]
    - [13, 69.48]
  - - [8192, 256, 1, 512, 8192, 8192, 512, 512]
    - [14, 114.45]
  - - [8192, 256, 1, 1024, 8192, 8192, 1024, 1024]
    - [58, 170.23]
  - - [8192, 256, 1, 2048, 8192, 8192, 2048, 2048]
    - [60, 208.54]
  - - [8192, 256, 1, 4096, 8192, 8192, 4096, 4096]
    - [74, 219.19]
  - - [8192, 256, 1, 8192, 8192, 8192, 8192, 8192]
    - [69, 243.19]
  - - [8192, 512, 1, 128, 8192, 8192, 128, 128]
    - [10, 52.02]
  - - [8192, 512, 1, 256, 8192, 8192, 256, 256]
    - [11, 90.91]
  - - [8192, 512, 1, 512, 8192, 8192, 512, 512]
    - [66, 148.35]
  - - [8192, 512, 1, 1024, 8192, 8192, 1024, 1024]
    - [48, 195.66]
  - - [8192, 512, 1, 2048, 8192, 8192, 2048, 2048]
    - [47, 228.92]
  - - [8192, 512, 1, 4096, 8192, 8192, 4096, 4096]
    - [65, 276.52]
  - - [8192, 512, 1, 8192, 8192, 8192, 8192, 8192]
    - [65, 311.5]
  - - [8192, 1024, 1, 128, 8192, 8192, 128, 128]
    - [53, 60.83]
  - - [8192, 1024, 1, 256, 8192, 8192, 256, 256]
    - [52, 108.12]
  - - [8192, 1024, 1, 512, 8192, 8192, 512, 512]
    - [4, 160.62]
  - - [8192, 1024, 1, 1024, 8192, 8192, 1024, 1024]
    - [6, 214.77]
  - - [8192, 1024, 1, 2048, 8192, 8192, 2048, 2048]
    - [53, 278.05]
  - - [8192, 1024, 1, 4096, 8192, 8192, 4096, 4096]
    - [52, 346.65]
  - - [8192, 1024, 1, 8192, 8192, 8192, 8192, 8192]
    - [56, 379.05]
  - - [8192, 2048, 1, 128, 8192, 8192, 128, 128]
    - [56, 67.15]
  - - [8192, 2048, 1, 256, 8192, 8192, 256, 256]
    - [56, 112.8]
  - - [8192, 2048, 1, 512, 8192, 8192, 512, 512]
    - [3, 165.45]
  - - [8192, 2048, 1, 1024, 8192, 8192, 1024, 1024]
    - [51, 231.39]
  - - [8192, 2048, 1, 2048, 8192, 8192, 2048, 2048]
    - [54, 297.63]
  - - [8192, 2048, 1, 4096, 8192, 8192, 4096, 4096]
    - [52, 333.53]
  - - [8192, 2048, 1, 8192, 8192, 8192, 8192, 8192]
    - [54, 398.49]
  - - [8192, 4096, 1, 128, 8192, 8192, 128, 128]
    - [1, 69.75]
  - - [8192, 4096, 1, 256, 8192, 8192, 256, 256]
    - [55, 117.05]
  - - [8192, 4096, 1, 512, 8192, 8192, 512, 512]
    - [56, 174.05]
  - - [8192, 4096, 1, 1024, 8192, 8192, 1024, 1024]
    - [54, 234.95]
  - - [8192, 4096, 1, 2048, 8192, 8192, 2048, 2048]
    - [54, 293.0]
  - - [8192, 4096, 1, 4096, 8192, 8192, 4096, 4096]
    - [54, 344.18]
  - - [8192, 4096, 1, 8192, 8192, 8192, 8192, 8192]
    - [54, 419.58]
  - - [8192, 8192, 1, 128, 8192, 8192, 128, 128]
    - [38, 71.43]
  - - [8192, 8192, 1, 256, 8192, 8192, 256, 256]
    - [41, 117.42]
  - - [8192, 8192, 1, 512, 8192, 8192, 512, 512]
    - [45, 169.11]
  - - [8192, 8192, 1, 1024, 8192, 8192, 1024, 1024]
    - [42, 237.66]
  - - [8192, 8192, 1, 2048, 8192, 8192, 2048, 2048]
    - [52, 298.55]
  - - [8192, 8192, 1, 4096, 8192, 8192, 4096, 4096]
    - [54, 354.72]
  - - [8192, 8192, 1, 8192, 8192, 8192, 8192, 8192]
    - [56, 402.15]
  - - [1, 1, 1, 32, 1, 1, 32, 32]
    - [108, 0.0]
- null
- null
- ExperimentalStreamK
- GridBased
