projects/hipblaslt/library/src/amd_detail/rocblaslt/src/Tensile/Logic/asm_full/aquavanjaram/gfx942_228cu/StreamK/aquavanjaram942_Cijk_Ailk_Bljk_F8NF8NS_BH_Bias_HAS_SAV_UserArgs.yaml
- {MinimumRequiredVersion: 4.33.0}
- aquavanjaram942
- {Architecture: gfx942, CUCount: 228}
- [Device 0049, Device 0050]
    SolutionIndex: 0
    SolutionNameMin: Cijk_Ailk_Bljk_F8NF8NS_BH_Bias_HAS_SAV_UserArgs_MT256x256x64_MI16x16x1_SN_LDSB1_CLR1_GRVWA8_GRVWB8_GSU0_GSUC0_GSUWGMRR0_K1_LBSPPA2048_LBSPPB512_LPA0_LPB8_LRVW8_MIWT8_8_PLR1_SU0_SUM0_SUS64_VWA8_VWB8_WGM1_WGMXCC1_WGMXCCGn1
    SolutionIndex: 1
    SolutionNameMin: Cijk_Ailk_Bljk_F8NF8NS_BH_Bias_HAS_SAV_UserArgs_MT256x256x64_MI16x16x1_SN_LDSB1_CLR1_GRVWA16_GRVWB16_GSU0_GSUC0_GSUWGMRR0_K1_LBSPPA2048_LBSPPB512_LPA0_LPB16_LRVW8_MIWT8_8_PLR1_SU0_SUM0_SUS64_VWA8_VWB8_WGM1_WGMXCC1_WGMXCCGn1
    SolutionIndex: 2
    SolutionNameMin: Cijk_Ailk_Bljk_F8NF8NS_BH_Bias_HAS_SAV_UserArgs_MT256x256x64_MI16x16x1_SN_LDSB1_CLR1_GRVWA16_GRVWB8_GSU0_GSUC0_GSUWGMRR0_K1_LBSPPA2048_LBSPPB512_LPA0_LPB8_LRVW8_MIWT8_8_PLR1_SU0_SUM0_SUS64_VWA8_VWB8_WGM4_WGMXCC1_WGMXCCGn1
    SolutionIndex: 3
    SolutionNameMin: Cijk_Ailk_Bljk_F8NF8NS_BH_Bias_HAS_SAV_UserArgs_MT256x256x64_MI16x16x1_SN_LDSB1_CLR1_GRVWA8_GRVWB16_GSU0_GSUC0_GSUWGMRR0_K1_LBSPPA2048_LBSPPB512_LPA0_LPB16_LRVW8_MIWT8_8_PLR1_SU0_SUM0_SUS64_VWA8_VWB8_WGM4_WGMXCC1_WGMXCCGn1
    SolutionIndex: 4
    SolutionNameMin: Cijk_Ailk_Bljk_F8NF8NS_BH_Bias_HAS_SAV_UserArgs_MT256x256x64_MI16x16x1_SN_LDSB1_CLR1_GRVWA8_GRVWB8_GSU0_GSUC0_GSUWGMRR0_K1_LBSPPA2048_LBSPPB512_LPA0_LPB8_LRVW8_MIWT8_8_PLR1_SU0_SUM0_SUS64_VWA8_VWB8_WGM6_WGMXCC1_WGMXCCGn1
    SolutionIndex: 5
    SolutionNameMin: Cijk_Ailk_Bljk_F8NF8NS_BH_Bias_HAS_SAV_UserArgs_MT256x256x64_MI16x16x1_SN_LDSB1_CLR1_GRVWA16_GRVWB8_GSU0_GSUC0_GSUWGMRR0_K1_LBSPPA2048_LBSPPB512_LPA0_LPB8_LRVW8_MIWT8_8_PLR1_SU0_SUM0_SUS64_VWA8_VWB8_WGM6_WGMXCC1_WGMXCCGn1
    SolutionIndex: 6
    SolutionNameMin: Cijk_Ailk_Bljk_F8NF8NS_BH_Bias_HAS_SAV_UserArgs_MT256x256x64_MI16x16x1_SN_LDSB1_CLR1_GRVWA8_GRVWB16_GSU0_GSUC0_GSUWGMRR0_K1_LBSPPA2048_LBSPPB512_LPA0_LPB16_LRVW8_MIWT8_8_PLR1_SU0_SUM0_SUS64_VWA8_VWB8_WGM6_WGMXCC1_WGMXCCGn1
    SolutionIndex: 7
    SolutionNameMin: Cijk_Ailk_Bljk_F8NF8NS_BH_Bias_HAS_SAV_UserArgs_MT256x256x64_MI16x16x1_SN_LDSB1_CLR1_GRVWA8_GRVWB8_GSU0_GSUC0_GSUWGMRR0_K1_LBSPPA2048_LBSPPB512_LPA0_LPB8_LRVW8_MIWT8_8_PLR1_SU0_SUM0_SUS64_VWA8_VWB8_WGM8_WGMXCC1_WGMXCCGn1
    SolutionIndex: 8
    SolutionNameMin: Cijk_Ailk_Bljk_F8NF8NS_BH_Bias_HAS_SAV_UserArgs_MT256x256x64_MI16x16x1_SN_LDSB1_CLR1_GRVWA16_GRVWB8_GSU0_GSUC0_GSUWGMRR0_K1_LBSPPA2048_LBSPPB512_LPA0_LPB8_LRVW8_MIWT8_8_PLR1_SU0_SUM0_SUS64_VWA8_VWB8_WGM8_WGMXCC1_WGMXCCGn1
    SolutionIndex: 9
    SolutionNameMin: Cijk_Ailk_Bljk_F8NF8NS_BH_Bias_HAS_SAV_UserArgs_MT256x256x64_MI16x16x1_SN_LDSB1_CLR1_GRVWA8_GRVWB16_GSU0_GSUC0_GSUWGMRR0_K1_LBSPPA2048_LBSPPB512_LPA0_LPB16_LRVW8_MIWT8_8_PLR1_SU0_SUM0_SUS64_VWA8_VWB8_WGM8_WGMXCC1_WGMXCCGn1
    SolutionIndex: 10
    SolutionNameMin: Cijk_Ailk_Bljk_F8NF8NS_BH_Bias_HAS_SAV_UserArgs_MT128x256x64_MI16x16x1_SN_LDSB1_CLR1_GRVWA16_GRVWB8_GSU0_GSUC0_GSUWGMRR0_K1_LBSPPA1024_LBSPPB512_LPA64_LPB8_LRVW8_MIWT4_8_PLR1_SU0_SUM0_SUS64_VWA4_VWB8_WGM1_WGMXCC1_WGMXCCGn1
    SolutionIndex: 11
    SolutionNameMin: Cijk_Ailk_Bljk_F8NF8NS_BH_Bias_HAS_SAV_UserArgs_MT128x256x64_MI16x16x1_SN_LDSB1_CLR1_GRVWA8_GRVWB16_GSU0_GSUC0_GSUWGMRR0_K1_LBSPPA1024_LBSPPB512_LPA64_LPB16_LRVW8_MIWT4_8_PLR1_SU0_SUM0_SUS64_VWA4_VWB8_WGM1_WGMXCC1_WGMXCCGn1
    SolutionIndex: 12
    SolutionNameMin: Cijk_Ailk_Bljk_F8NF8NS_BH_Bias_HAS_SAV_UserArgs_MT128x256x64_MI16x16x1_SN_LDSB1_CLR1_GRVWA16_GRVWB8_GSU0_GSUC0_GSUWGMRR0_K1_LBSPPA1024_LBSPPB512_LPA64_LPB8_LRVW8_MIWT4_8_PLR1_SU0_SUM0_SUS64_VWA4_VWB8_WGM4_WGMXCC1_WGMXCCGn1
    SolutionIndex: 13
    SolutionNameMin: Cijk_Ailk_Bljk_F8NF8NS_BH_Bias_HAS_SAV_UserArgs_MT128x256x64_MI16x16x1_SN_LDSB1_CLR1_GRVWA16_GRVWB8_GSU0_GSUC0_GSUWGMRR0_K1_LBSPPA1024_LBSPPB512_LPA64_LPB8_LRVW8_MIWT4_8_PLR1_SU0_SUM0_SUS64_VWA4_VWB8_WGM8_WGMXCC1_WGMXCCGn1
    SolutionIndex: 14
    SolutionNameMin: Cijk_Ailk_Bljk_F8NF8NS_BH_Bias_HAS_SAV_UserArgs_MT128x256x64_MI16x16x1_SN_LDSB1_CLR1_GRVWA8_GRVWB16_GSU0_GSUC0_GSUWGMRR0_K1_LBSPPA1024_LBSPPB512_LPA64_LPB16_LRVW8_MIWT4_8_PLR1_SU0_SUM0_SUS64_VWA4_VWB8_WGM8_WGMXCC1_WGMXCCGn1
    SolutionIndex: 15
    SolutionNameMin: Cijk_Ailk_Bljk_F8NF8NS_BH_Bias_HAS_SAV_UserArgs_MT256x128x64_MI16x16x1_SN_LDSB1_CLR1_GRVWA16_GRVWB16_GSU0_GSUC0_GSUWGMRR0_K1_LBSPPA2048_LBSPPB256_LPA0_LPB16_LRVW8_MIWT8_4_PLR1_SU0_SUM0_SUS64_VWA8_VWB4_WGM1_WGMXCC1_WGMXCCGn1
    SolutionIndex: 16
    SolutionNameMin: Cijk_Ailk_Bljk_F8NF8NS_BH_Bias_HAS_SAV_UserArgs_MT256x128x64_MI16x16x1_SN_LDSB1_CLR1_GRVWA16_GRVWB16_GSU0_GSUC0_GSUWGMRR0_K1_LBSPPA2048_LBSPPB256_LPA0_LPB16_LRVW8_MIWT8_4_PLR1_SU0_SUM0_SUS64_VWA8_VWB4_WGM4_WGMXCC1_WGMXCCGn1
    SolutionIndex: 17
    SolutionNameMin: Cijk_Ailk_Bljk_F8NF8NS_BH_Bias_HAS_SAV_UserArgs_MT256x128x64_MI16x16x1_SN_LDSB1_CLR1_GRVWA16_GRVWB16_GSU0_GSUC0_GSUWGMRR0_K1_LBSPPA2048_LBSPPB256_LPA0_LPB16_LRVW8_MIWT8_4_PLR1_SU0_SUM0_SUS64_VWA8_VWB4_WGM8_WGMXCC1_WGMXCCGn1
    SolutionIndex: 18
    SolutionNameMin: Cijk_Ailk_Bljk_F8NF8NS_BH_Bias_HAS_SAV_UserArgs_MT128x128x64_MI16x16x1_SN_LDSB1_CLR1_GRVWA8_GRVWB16_GSU0_GSUC0_GSUWGMRR0_K1_LBSPPA1024_LBSPPB256_LPA64_LPB16_LRVW8_MIWT4_4_PLR1_SU0_SUM0_SUS64_VWA4_VWB4_WGM1_WGMXCC1_WGMXCCGn1
    SolutionIndex: 19
    SolutionNameMin: Cijk_Ailk_Bljk_F8NF8NS_BH_Bias_HAS_SAV_UserArgs_MT128x128x64_MI16x16x1_SN_LDSB1_CLR1_GRVWA16_GRVWB16_GSU0_GSUC0_GSUWGMRR0_K1_LBSPPA1024_LBSPPB256_LPA64_LPB16_LRVW8_MIWT4_4_PLR1_SU0_SUM0_SUS64_VWA4_VWB4_WGM1_WGMXCC1_WGMXCCGn1
    SolutionIndex: 20
    SolutionNameMin: Cijk_Ailk_Bljk_F8NF8NS_BH_Bias_HAS_SAV_UserArgs_MT64x128x64_MI16x16x1_SN_LDSB0_CLR1_GRVWA16_GRVWB8_GSU0_GSUC0_GSUWGMRR0_K1_LBSPPA512_LBSPPB256_LPA32_LPB8_LRVW8_MIWT2_4_PLR1_SU0_SUM0_SUS64_VWA2_VWB4_WGM1_WGMXCC1_WGMXCCGn1
    SolutionIndex: 21
    SolutionNameMin: Cijk_Ailk_Bljk_F8NF8NS_BH_Bias_HAS_SAV_UserArgs_MT64x128x64_MI16x16x1_SN_LDSB0_CLR1_GRVWA8_GRVWB16_GSU0_GSUC0_GSUWGMRR0_K1_LBSPPA512_LBSPPB256_LPA32_LPB16_LRVW8_MIWT2_4_PLR1_SU0_SUM0_SUS64_VWA2_VWB4_WGM1_WGMXCC1_WGMXCCGn1
    SolutionIndex: 22
    SolutionNameMin: Cijk_Ailk_Bljk_F8NF8NS_BH_Bias_HAS_SAV_UserArgs_MT128x64x64_MI16x16x1_SN_LDSB0_CLR1_GRVWA8_GRVWB16_GSU0_GSUC0_GSUWGMRR0_K1_LBSPPA1024_LBSPPB128_LPA64_LPB16_LRVW8_MIWT4_2_PLR1_SU0_SUM0_SUS64_VWA4_VWB2_WGM1_WGMXCC1_WGMXCCGn1
    SolutionIndex: 23
    SolutionNameMin: Cijk_Ailk_Bljk_F8NF8NS_BH_Bias_HAS_SAV_UserArgs_MT128x64x64_MI16x16x1_SN_LDSB0_CLR1_GRVWA16_GRVWB16_GSU0_GSUC0_GSUWGMRR0_K1_LBSPPA1024_LBSPPB128_LPA64_LPB16_LRVW8_MIWT4_2_PLR1_SU0_SUM0_SUS64_VWA4_VWB2_WGM1_WGMXCC1_WGMXCCGn1
    SolutionIndex: 24
    SolutionNameMin: Cijk_Ailk_Bljk_F8NF8NS_BH_Bias_HAS_SAV_UserArgs_MT128x32x64_MI16x16x1_SN_LDSB0_CLR1_GRVWA8_GRVWB8_GSU0_GSUC0_GSUWGMRR0_K1_LBSPPA1024_LBSPPB128_LPA64_LPB8_LRVW8_MIWT4_1_PLR1_SU0_SUM0_SUS64_VWA4_VWB1_WGM1_WGMXCC1_WGMXCCGn1
    SolutionIndex: 25
    SolutionNameMin: Cijk_Ailk_Bljk_F8NF8NS_BH_Bias_HAS_SAV_UserArgs_MT64x64x64_MI16x16x1_SN_LDSB0_CLR1_GRVWA8_GRVWB8_GSU0_GSUC0_GSUWGMRR0_K1_LBSPPA512_LBSPPB128_LPA32_LPB8_LRVW8_MIWT2_2_PLR1_SU0_SUM0_SUS64_VWA2_VWB2_WGM1_WGMXCC1_WGMXCCGn1
    SolutionIndex: 26
    SolutionNameMin: Cijk_Ailk_Bljk_F8NF8NS_BH_Bias_HAS_SAV_UserArgs_MT64x64x64_MI16x16x1_SN_LDSB0_CLR1_GRVWA8_GRVWB16_GSU0_GSUC0_GSUWGMRR0_K1_LBSPPA512_LBSPPB128_LPA32_LPB16_LRVW8_MIWT2_2_PLR1_SU0_SUM0_SUS64_VWA2_VWB2_WGM1_WGMXCC1_WGMXCCGn1
    SolutionIndex: 27
    SolutionNameMin: Cijk_Ailk_Bljk_F8NF8NS_BH_Bias_HAS_SAV_UserArgs_MT32x32x64_MI16x16x1_SN_LDSB0_CLR1_GRVWA8_GRVWB8_GSU0_GSUC0_GSUWGMRR0_K1_LBSPPA256_LBSPPB128_LPA16_LPB8_LRVW8_MIWT1_1_PLR1_SU0_SUM0_SUS64_VWA1_VWB1_WGM1_WGMXCC1_WGMXCCGn1
    SolutionIndex: 28
    SolutionNameMin: Cijk_Ailk_Bljk_F8NF8NS_BH_Bias_HAS_SAV_UserArgs_MT32x32x64_MI16x16x1_SN_LDSB0_CLR1_GRVWA8_GRVWB8_GSU0_GSUC0_GSUWGMRR0_K1_LBSPPA256_LBSPPB128_LPA16_LPB8_LRVW8_MIWT1_1_PLR1_SU0_SUM0_SUS64_VWA1_VWB1_WGM4_WGMXCC1_WGMXCCGn1
    SolutionIndex: 29
    SolutionNameMin: Cijk_Ailk_Bljk_F8NF8NS_BH_Bias_HAS_SAV_UserArgs_MT128x256x128_MI16x16x1_SN_LDSB1_CLR1_GRVWA8_GRVWB16_GSU0_GSUC0_GSUWGMRR0_K1_LBSPPA1024_LBSPPB1024_LPA64_LPB16_LRVW8_MIWT4_8_PLR1_SU0_SUM0_SUS128_VWA4_VWB8_WGM1_WGMXCC1_WGMXCCGn1
    SolutionIndex: 30
    SolutionNameMin: Cijk_Ailk_Bljk_F8NF8NS_BH_Bias_HAS_SAV_UserArgs_MT128x256x128_MI16x16x1_SN_LDSB1_CLR1_GRVWA16_GRVWB16_GSU0_GSUC0_GSUWGMRR0_K1_LBSPPA1024_LBSPPB1024_LPA64_LPB16_LRVW8_MIWT4_8_PLR1_SU0_SUM0_SUS128_VWA4_VWB8_WGM1_WGMXCC1_WGMXCCGn1
    SolutionIndex: 31
    SolutionNameMin: Cijk_Ailk_Bljk_F8NF8NS_BH_Bias_HAS_SAV_UserArgs_MT128x256x128_MI16x16x1_SN_LDSB1_CLR1_GRVWA16_GRVWB16_GSU0_GSUC0_GSUWGMRR0_K1_LBSPPA1024_LBSPPB1024_LPA64_LPB16_LRVW8_MIWT4_8_PLR1_SU0_SUM0_SUS128_VWA4_VWB8_WGM8_WGMXCC1_WGMXCCGn1
    SolutionIndex: 32
    SolutionNameMin: Cijk_Ailk_Bljk_F8NF8NS_BH_Bias_HAS_SAV_UserArgs_MT256x144x128_MI16x16x1_SN_LDSB1_CLR1_GRVWA16_GRVWB8_GSU0_GSUC0_GSUWGMRR0_K1_LBSPPA2048_LBSPPB128_LPA64_LPB8_LRVW8_MIWT4_9_PLR1_SU0_SUM0_SUS128_VWA4_VWB1_WGM1_WGMXCC1_WGMXCCGn1
    SolutionIndex: 33
    SolutionNameMin: Cijk_Ailk_Bljk_F8NF8NS_BH_Bias_HAS_SAV_UserArgs_MT256x144x128_MI16x16x1_SN_LDSB1_CLR1_GRVWA16_GRVWB8_GSU0_GSUC0_GSUWGMRR0_K1_LBSPPA2048_LBSPPB128_LPA64_LPB8_LRVW8_MIWT4_9_PLR1_SU0_SUM0_SUS128_VWA4_VWB1_WGM4_WGMXCC1_WGMXCCGn1
    SolutionIndex: 34
    SolutionNameMin: Cijk_Ailk_Bljk_F8NF8NS_BH_Bias_HAS_SAV_UserArgs_MT256x144x128_MI16x16x1_SN_LDSB1_CLR1_GRVWA16_GRVWB8_GSU0_GSUC0_GSUWGMRR0_K1_LBSPPA2048_LBSPPB128_LPA64_LPB8_LRVW8_MIWT4_9_PLR1_SU0_SUM0_SUS128_VWA4_VWB1_WGM6_WGMXCC1_WGMXCCGn1
    SolutionIndex: 35
    SolutionNameMin: Cijk_Ailk_Bljk_F8NF8NS_BH_Bias_HAS_SAV_UserArgs_MT256x144x128_MI16x16x1_SN_LDSB1_CLR1_GRVWA16_GRVWB8_GSU0_GSUC0_GSUWGMRR0_K1_LBSPPA2048_LBSPPB128_LPA64_LPB8_LRVW8_MIWT4_9_PLR1_SU0_SUM0_SUS128_VWA4_VWB1_WGM8_WGMXCC1_WGMXCCGn1
    SolutionIndex: 36
    SolutionNameMin: Cijk_Ailk_Bljk_F8NF8NS_BH_Bias_HAS_SAV_UserArgs_MT256x128x128_MI16x16x1_SN_LDSB1_CLR1_GRVWA8_GRVWB8_GSU0_GSUC0_GSUWGMRR0_K1_LBSPPA2048_LBSPPB512_LPA0_LPB8_LRVW8_MIWT8_4_PLR1_SU0_SUM0_SUS128_VWA8_VWB4_WGM8_WGMXCC1_WGMXCCGn1
    SolutionIndex: 37
    SolutionNameMin: Cijk_Ailk_Bljk_F8NF8NS_BH_Bias_HAS_SAV_UserArgs_MT256x128x128_MI16x16x1_SN_LDSB1_CLR1_GRVWA16_GRVWB8_GSU0_GSUC0_GSUWGMRR0_K1_LBSPPA2048_LBSPPB512_LPA0_LPB8_LRVW8_MIWT8_4_PLR1_SU0_SUM0_SUS128_VWA8_VWB4_WGM8_WGMXCC1_WGMXCCGn1
    SolutionIndex: 38
    SolutionNameMin: Cijk_Ailk_Bljk_F8NF8NS_BH_Bias_HAS_SAV_UserArgs_MT128x144x128_MI16x16x1_SN_LDSB1_CLR1_GRVWA16_GRVWB8_GSU0_GSUC0_GSUWGMRR0_K1_LBSPPA1024_LBSPPB128_LPA32_LPB8_LRVW8_MIWT2_9_PLR1_SU0_SUM0_SUS128_VWA2_VWB1_WGM1_WGMXCC1_WGMXCCGn1
    SolutionIndex: 39
    SolutionNameMin: Cijk_Ailk_Bljk_F8NF8NS_BH_Bias_HAS_SAV_UserArgs_MT128x128x128_MI16x16x1_SN_LDSB1_CLR1_GRVWA16_GRVWB16_GSU0_GSUC0_GSUWGMRR0_K1_LBSPPA1024_LBSPPB512_LPA64_LPB16_LRVW8_MIWT4_4_PLR1_SU0_SUM0_SUS128_VWA4_VWB4_WGM1_WGMXCC1_WGMXCCGn1
    SolutionIndex: 40
    SolutionNameMin: Cijk_Ailk_Bljk_F8NF8NS_BH_Bias_HAS_SAV_UserArgs_MT128x128x128_MI16x16x1_SN_LDSB1_CLR1_GRVWA16_GRVWB16_GSU0_GSUC0_GSUWGMRR0_K1_LBSPPA1024_LBSPPB512_LPA64_LPB16_LRVW8_MIWT4_4_PLR1_SU0_SUM0_SUS128_VWA4_VWB4_WGM4_WGMXCC1_WGMXCCGn1
    SolutionIndex: 41
    SolutionNameMin: Cijk_Ailk_Bljk_F8NF8NS_BH_Bias_HAS_SAV_UserArgs_MT128x128x128_MI16x16x1_SN_LDSB1_CLR1_GRVWA16_GRVWB16_GSU0_GSUC0_GSUWGMRR0_K1_LBSPPA1024_LBSPPB512_LPA64_LPB16_LRVW8_MIWT4_4_PLR1_SU0_SUM0_SUS128_VWA4_VWB4_WGM6_WGMXCC1_WGMXCCGn1
    SolutionIndex: 42
    SolutionNameMin: Cijk_Ailk_Bljk_F8NF8NS_BH_Bias_HAS_SAV_UserArgs_MT128x128x128_MI16x16x1_SN_LDSB1_CLR1_GRVWA16_GRVWB16_GSU0_GSUC0_GSUWGMRR0_K1_LBSPPA1024_LBSPPB512_LPA64_LPB16_LRVW8_MIWT4_4_PLR1_SU0_SUM0_SUS128_VWA4_VWB4_WGM8_WGMXCC1_WGMXCCGn1
    SolutionIndex: 43
    SolutionNameMin: Cijk_Ailk_Bljk_F8NF8NS_BH_Bias_HAS_SAV_UserArgs_MT64x128x128_MI16x16x1_SN_LDSB1_CLR1_GRVWA16_GRVWB16_GSU0_GSUC0_GSUWGMRR0_K1_LBSPPA512_LBSPPB512_LPA32_LPB16_LRVW8_MIWT2_4_PLR1_SU0_SUM0_SUS128_VWA2_VWB4_WGM1_WGMXCC1_WGMXCCGn1
    SolutionIndex: 44
    SolutionNameMin: Cijk_Ailk_Bljk_F8NF8NS_BH_Bias_HAS_SAV_UserArgs_MT128x64x128_MI16x16x1_SN_LDSB1_CLR1_GRVWA16_GRVWB8_GSU0_GSUC0_GSUWGMRR0_K1_LBSPPA1024_LBSPPB256_LPA64_LPB8_LRVW8_MIWT4_2_PLR1_SU0_SUM0_SUS128_VWA4_VWB2_WGM1_WGMXCC1_WGMXCCGn1
    SolutionIndex: 45
    SolutionNameMin: Cijk_Ailk_Bljk_F8NF8NS_BH_Bias_HAS_SAV_UserArgs_MT128x64x128_MI16x16x1_SN_LDSB1_CLR1_GRVWA16_GRVWB16_GSU0_GSUC0_GSUWGMRR0_K1_LBSPPA1024_LBSPPB256_LPA64_LPB16_LRVW8_MIWT4_2_PLR1_SU0_SUM0_SUS128_VWA4_VWB2_WGM1_WGMXCC1_WGMXCCGn1
    SolutionIndex: 46
    SolutionNameMin: Cijk_Ailk_Bljk_F8NF8NS_BH_Bias_HAS_SAV_UserArgs_MT128x64x128_MI16x16x1_SN_LDSB1_CLR1_GRVWA16_GRVWB16_GSU0_GSUC0_GSUWGMRR0_K1_LBSPPA1024_LBSPPB256_LPA64_LPB16_LRVW8_MIWT4_2_PLR1_SU0_SUM0_SUS128_VWA4_VWB2_WGM4_WGMXCC1_WGMXCCGn1
    SolutionIndex: 47
    SolutionNameMin: Cijk_Ailk_Bljk_F8NF8NS_BH_Bias_HAS_SAV_UserArgs_MT128x64x128_MI16x16x1_SN_LDSB1_CLR1_GRVWA16_GRVWB16_GSU0_GSUC0_GSUWGMRR0_K1_LBSPPA1024_LBSPPB256_LPA64_LPB16_LRVW8_MIWT4_2_PLR1_SU0_SUM0_SUS128_VWA4_VWB2_WGM6_WGMXCC1_WGMXCCGn1
    SolutionIndex: 48
    SolutionNameMin: Cijk_Ailk_Bljk_F8NF8NS_BH_Bias_HAS_SAV_UserArgs_MT128x64x128_MI16x16x1_SN_LDSB1_CLR1_GRVWA16_GRVWB16_GSU0_GSUC0_GSUWGMRR0_K1_LBSPPA1024_LBSPPB256_LPA64_LPB16_LRVW8_MIWT4_2_PLR1_SU0_SUM0_SUS128_VWA4_VWB2_WGM8_WGMXCC1_WGMXCCGn1
    SolutionIndex: 49
    SolutionNameMin: Cijk_Ailk_Bljk_F8NF8NS_BH_Bias_HAS_SAV_UserArgs_MT64x64x128_MI16x16x1_SN_LDSB1_CLR1_GRVWA16_GRVWB8_GSU0_GSUC0_GSUWGMRR0_K1_LBSPPA512_LBSPPB256_LPA32_LPB8_LRVW8_MIWT2_2_PLR1_SU0_SUM0_SUS128_VWA2_VWB2_WGM1_WGMXCC1_WGMXCCGn1
    SolutionIndex: 50
    SolutionNameMin: Cijk_Ailk_Bljk_F8NF8NS_BH_Bias_HAS_SAV_UserArgs_MT64x64x128_MI16x16x1_SN_LDSB1_CLR1_GRVWA8_GRVWB16_GSU0_GSUC0_GSUWGMRR0_K1_LBSPPA512_LBSPPB256_LPA32_LPB16_LRVW8_MIWT2_2_PLR1_SU0_SUM0_SUS128_VWA2_VWB2_WGM1_WGMXCC1_WGMXCCGn1
    SolutionIndex: 51
    SolutionNameMin: Cijk_Ailk_Bljk_F8NF8NS_BH_Bias_HAS_SAV_UserArgs_MT64x64x128_MI16x16x1_SN_LDSB1_CLR1_GRVWA16_GRVWB16_GSU0_GSUC0_GSUWGMRR0_K1_LBSPPA512_LBSPPB256_LPA32_LPB16_LRVW8_MIWT2_2_PLR1_SU0_SUM0_SUS128_VWA2_VWB2_WGM1_WGMXCC1_WGMXCCGn1
    SolutionIndex: 52
    SolutionNameMin: Cijk_Ailk_Bljk_F8NF8NS_BH_Bias_HAS_SAV_UserArgs_MT64x64x128_MI16x16x1_SN_LDSB1_CLR1_GRVWA16_GRVWB16_GSU0_GSUC0_GSUWGMRR0_K1_LBSPPA512_LBSPPB256_LPA32_LPB16_LRVW8_MIWT2_2_PLR1_SU0_SUM0_SUS128_VWA2_VWB2_WGM4_WGMXCC1_WGMXCCGn1
    SolutionIndex: 53
    SolutionNameMin: Cijk_Ailk_Bljk_F8NF8NS_BH_Bias_HAS_SAV_UserArgs_MT64x64x128_MI16x16x1_SN_LDSB1_CLR1_GRVWA16_GRVWB16_GSU0_GSUC0_GSUWGMRR0_K1_LBSPPA512_LBSPPB256_LPA32_LPB16_LRVW8_MIWT2_2_PLR1_SU0_SUM0_SUS128_VWA2_VWB2_WGM6_WGMXCC1_WGMXCCGn1
    SolutionIndex: 54
    SolutionNameMin: Cijk_Ailk_Bljk_F8NF8NS_BH_Bias_HAS_SAV_UserArgs_MT64x64x128_MI16x16x1_SN_LDSB1_CLR1_GRVWA16_GRVWB16_GSU0_GSUC0_GSUWGMRR0_K1_LBSPPA512_LBSPPB256_LPA32_LPB16_LRVW8_MIWT2_2_PLR1_SU0_SUM0_SUS128_VWA2_VWB2_WGM8_WGMXCC1_WGMXCCGn1
    SolutionIndex: 55
    SolutionNameMin: Cijk_Ailk_Bljk_F8NF8NS_BH_Bias_HAS_SAV_UserArgs_MT32x64x128_MI16x16x1_SN_LDSB0_CLR1_GRVWA8_GRVWB16_GSU0_GSUC0_GSUWGMRR0_K1_LBSPPA256_LBSPPB256_LPA16_LPB16_LRVW8_MIWT1_2_PLR1_SU0_SUM0_SUS128_VWA1_VWB2_WGM4_WGMXCC1_WGMXCCGn1
    SolutionIndex: 56
    SolutionNameMin: Cijk_Ailk_Bljk_F8NF8NS_BH_Bias_HAS_SAV_UserArgs_MT64x32x128_MI16x16x1_SN_LDSB0_CLR1_GRVWA8_GRVWB8_GSU0_GSUC0_GSUWGMRR0_K1_LBSPPA512_LBSPPB128_LPA32_LPB8_LRVW8_MIWT2_1_PLR1_SU0_SUM0_SUS128_VWA2_VWB1_WGM1_WGMXCC1_WGMXCCGn1
    SolutionIndex: 57
    SolutionNameMin: Cijk_Ailk_Bljk_F8NF8NS_BH_Bias_HAS_SAV_UserArgs_MT64x32x128_MI16x16x1_SN_LDSB0_CLR1_GRVWA8_GRVWB16_GSU0_GSUC0_GSUWGMRR0_K1_LBSPPA512_LBSPPB128_LPA32_LPB16_LRVW8_MIWT2_1_PLR1_SU0_SUM0_SUS128_VWA2_VWB1_WGM1_WGMXCC1_WGMXCCGn1
    SolutionIndex: 58
    SolutionNameMin: Cijk_Ailk_Bljk_F8NF8NS_BH_Bias_HAS_SAV_UserArgs_MT64x32x128_MI16x16x1_SN_LDSB0_CLR1_GRVWA16_GRVWB16_GSU0_GSUC0_GSUWGMRR0_K1_LBSPPA512_LBSPPB128_LPA32_LPB16_LRVW8_MIWT2_1_PLR1_SU0_SUM0_SUS128_VWA2_VWB1_WGM1_WGMXCC1_WGMXCCGn1
    SolutionIndex: 59
    SolutionNameMin: Cijk_Ailk_Bljk_F8NF8NS_BH_Bias_HAS_SAV_UserArgs_MT64x32x128_MI16x16x1_SN_LDSB0_CLR1_GRVWA8_GRVWB16_GSU0_GSUC0_GSUWGMRR0_K1_LBSPPA512_LBSPPB128_LPA32_LPB16_LRVW8_MIWT2_1_PLR1_SU0_SUM0_SUS128_VWA2_VWB1_WGM8_WGMXCC1_WGMXCCGn1
    SolutionIndex: 60
    SolutionNameMin: Cijk_Ailk_Bljk_F8NF8NS_BH_Bias_HAS_SAV_UserArgs_MT32x32x128_MI16x16x1_SN_LDSB0_CLR1_GRVWA8_GRVWB8_GSU0_GSUC0_GSUWGMRR0_K1_LBSPPA256_LBSPPB128_LPA16_LPB8_LRVW8_MIWT1_1_PLR1_SU0_SUM0_SUS128_VWA1_VWB1_WGM1_WGMXCC1_WGMXCCGn1
    SolutionIndex: 61
    SolutionNameMin: Cijk_Ailk_Bljk_F8NF8NS_BH_Bias_HAS_SAV_UserArgs_MT32x32x128_MI16x16x1_SN_LDSB0_CLR1_GRVWA8_GRVWB16_GSU0_GSUC0_GSUWGMRR0_K1_LBSPPA256_LBSPPB128_LPA16_LPB16_LRVW8_MIWT1_1_PLR1_SU0_SUM0_SUS128_VWA1_VWB1_WGM1_WGMXCC1_WGMXCCGn1
    SolutionIndex: 62
    SolutionNameMin: Cijk_Ailk_Bljk_F8NF8NS_BH_Bias_HAS_SAV_UserArgs_MT32x32x128_MI16x16x1_SN_LDSB0_CLR1_GRVWA16_GRVWB16_GSU0_GSUC0_GSUWGMRR0_K1_LBSPPA256_LBSPPB128_LPA16_LPB16_LRVW8_MIWT1_1_PLR1_SU0_SUM0_SUS128_VWA1_VWB1_WGM1_WGMXCC1_WGMXCCGn1
    SolutionIndex: 63
    SolutionNameMin: Cijk_Ailk_Bljk_F8NF8NS_BH_Bias_HAS_SAV_UserArgs_MT128x64x256_MI16x16x1_SN_LDSB1_CLR1_GRVWA16_GRVWB16_GSU0_GSUC0_GSUWGMRR0_K1_LBSPPA1024_LBSPPB512_LPA64_LPB16_LRVW8_MIWT4_2_PLR1_SU0_SUM0_SUS256_VWA4_VWB2_WGM1_WGMXCC1_WGMXCCGn1
    SolutionIndex: 64
    SolutionNameMin: Cijk_Ailk_Bljk_F8NF8NS_BH_Bias_HAS_SAV_UserArgs_MT64x64x256_MI16x16x1_SN_LDSB1_CLR1_GRVWA16_GRVWB16_GSU0_GSUC0_GSUWGMRR0_K1_LBSPPA512_LBSPPB512_LPA32_LPB16_LRVW8_MIWT2_2_PLR1_SU0_SUM0_SUS256_VWA2_VWB2_WGM1_WGMXCC1_WGMXCCGn1
    SolutionIndex: 65
    SolutionNameMin: Cijk_Ailk_Bljk_F8NF8NS_BH_Bias_HAS_SAV_UserArgs_MT64x32x256_MI16x16x1_SN_LDSB1_CLR1_GRVWA16_GRVWB16_GSU0_GSUC0_GSUWGMRR0_K1_LBSPPA512_LBSPPB256_LPA32_LPB16_LRVW8_MIWT2_1_PLR1_SU0_SUM0_SUS256_VWA2_VWB1_WGM1_WGMXCC1_WGMXCCGn1
    SolutionIndex: 66
    SolutionNameMin: Cijk_Ailk_Bljk_F8NF8NS_BH_Bias_HAS_SAV_UserArgs_MT64x32x256_MI16x16x1_SN_LDSB1_CLR1_GRVWA16_GRVWB16_GSU0_GSUC0_GSUWGMRR0_K1_LBSPPA512_LBSPPB256_LPA32_LPB16_LRVW8_MIWT2_1_PLR1_SU0_SUM0_SUS256_VWA2_VWB1_WGM4_WGMXCC1_WGMXCCGn1
    SolutionIndex: 67
    SolutionNameMin: Cijk_Ailk_Bljk_F8NF8NS_BH_Bias_HAS_SAV_UserArgs_MT64x32x256_MI16x16x1_SN_LDSB1_CLR1_GRVWA16_GRVWB16_GSU0_GSUC0_GSUWGMRR0_K1_LBSPPA512_LBSPPB256_LPA32_LPB16_LRVW8_MIWT2_1_PLR1_SU0_SUM0_SUS256_VWA2_VWB1_WGM8_WGMXCC1_WGMXCCGn1
    SolutionIndex: 68
    SolutionNameMin: Cijk_Ailk_Bljk_F8NF8NS_BH_Bias_HAS_SAV_UserArgs_MT32x32x256_MI16x16x1_SN_LDSB1_CLR1_GRVWA8_GRVWB16_GSU0_GSUC0_GSUWGMRR0_K1_LBSPPA256_LBSPPB256_LPA16_LPB16_LRVW8_MIWT1_1_PLR1_SU0_SUM0_SUS256_VWA1_VWB1_WGM6_WGMXCC1_WGMXCCGn1
    SolutionIndex: 69
    SolutionNameMin: Cijk_Ailk_Bljk_F8NF8NS_BH_Bias_HAS_SAV_UserArgs_MT32x32x256_MI16x16x1_SN_LDSB1_CLR1_GRVWA16_GRVWB16_GSU0_GSUC0_GSUWGMRR0_K1_LBSPPA256_LBSPPB256_LPA16_LPB16_LRVW8_MIWT1_1_PLR1_SU0_SUM0_SUS256_VWA1_VWB1_WGM6_WGMXCC1_WGMXCCGn1
    SolutionIndex: 70
    SolutionNameMin: Cijk_Ailk_Bljk_F8NF8NS_BH_Bias_HAS_SAV_UserArgs_MT32x32x256_MI16x16x1_SN_LDSB1_CLR1_GRVWA16_GRVWB16_GSU0_GSUC0_GSUWGMRR0_K1_LBSPPA256_LBSPPB256_LPA16_LPB16_LRVW8_MIWT1_1_PLR1_SU0_SUM0_SUS256_VWA1_VWB1_WGM8_WGMXCC1_WGMXCCGn1
- - - [128, 128, 1, 128, 128, 128, 128, 128]
    - [60, 0.57]
  - - [128, 128, 1, 256, 128, 128, 128, 256]
    - [61, 1.04]
  - - [128, 128, 1, 512, 128, 128, 128, 512]
    - [61, 1.8]
  - - [128, 128, 1, 1024, 128, 128, 128, 1024]
    - [61, 2.77]
  - - [128, 128, 1, 2048, 128, 128, 128, 2048]
    - [60, 3.88]
  - - [128, 128, 1, 4096, 128, 128, 128, 4096]
    - [60, 4.81]
  - - [128, 128, 1, 8192, 128, 128, 128, 8192]
    - [60, 5.49]
  - - [128, 256, 1, 128, 128, 128, 128, 128]
    - [27, 1.16]
  - - [128, 256, 1, 256, 128, 128, 128, 256]
    - [61, 2.1]
  - - [128, 256, 1, 512, 128, 128, 128, 512]
    - [61, 3.6]
  - - [128, 256, 1, 1024, 128, 128, 128, 1024]
    - [62, 5.59]
  - - [128, 256, 1, 2048, 128, 128, 128, 2048]
    - [60, 7.79]
  - - [128, 256, 1, 4096, 128, 128, 128, 4096]
    - [60, 9.67]
  - - [128, 256, 1, 8192, 128, 128, 128, 8192]
    - [60, 10.98]
  - - [128, 512, 1, 128, 128, 128, 128, 128]
    - [61, 2.28]
  - - [128, 512, 1, 256, 128, 128, 128, 256]
    - [61, 4.11]
  - - [128, 512, 1, 512, 128, 128, 128, 512]
    - [61, 7.1]
  - - [128, 512, 1, 1024, 128, 128, 128, 1024]
    - [61, 11.03]
  - - [128, 512, 1, 2048, 128, 128, 128, 2048]
    - [61, 15.31]
  - - [128, 512, 1, 4096, 128, 128, 128, 4096]
    - [60, 19.19]
  - - [128, 512, 1, 8192, 128, 128, 128, 8192]
    - [60, 21.81]
  - - [128, 1024, 1, 128, 128, 128, 128, 128]
    - [27, 4.46]
  - - [128, 1024, 1, 256, 128, 128, 128, 256]
    - [27, 8.04]
  - - [128, 1024, 1, 512, 128, 128, 128, 512]
    - [61, 13.75]
  - - [128, 1024, 1, 1024, 128, 128, 128, 1024]
    - [60, 21.75]
  - - [128, 1024, 1, 2048, 128, 128, 128, 2048]
    - [60, 30.25]
  - - [128, 1024, 1, 4096, 128, 128, 128, 4096]
    - [60, 37.88]
  - - [128, 1024, 1, 8192, 128, 128, 128, 8192]
    - [60, 43.15]
  - - [128, 2048, 1, 128, 128, 128, 128, 128]
    - [56, 8.35]
  - - [128, 2048, 1, 256, 128, 128, 128, 256]
    - [56, 15.02]
  - - [128, 2048, 1, 512, 128, 128, 128, 512]
    - [58, 25.1]
  - - [128, 2048, 1, 1024, 128, 128, 128, 1024]
    - [58, 38.1]
  - - [128, 2048, 1, 2048, 128, 128, 128, 2048]
    - [65, 52.13]
  - - [128, 2048, 1, 4096, 128, 128, 128, 4096]
    - [65, 64.38]
  - - [128, 2048, 1, 8192, 128, 128, 128, 8192]
    - [65, 72.08]
  - - [128, 4096, 1, 128, 128, 128, 128, 128]
    - [26, 15.32]
  - - [128, 4096, 1, 256, 128, 128, 128, 256]
    - [26, 26.92]
  - - [128, 4096, 1, 512, 128, 128, 128, 512]
    - [49, 42.3]
  - - [128, 4096, 1, 1024, 128, 128, 128, 1024]
    - [49, 62.07]
  - - [128, 4096, 1, 2048, 128, 128, 128, 2048]
    - [49, 84.22]
  - - [128, 4096, 1, 4096, 128, 128, 128, 4096]
    - [64, 101.41]
  - - [128, 4096, 1, 8192, 128, 128, 128, 8192]
    - [64, 113.14]
  - - [128, 8192, 1, 128, 128, 128, 128, 128]
    - [23, 26.25]
  - - [128, 8192, 1, 256, 128, 128, 128, 256]
    - [22, 45.65]
  - - [128, 8192, 1, 512, 128, 128, 128, 512]
    - [20, 72.27]
  - - [128, 8192, 1, 1024, 128, 128, 128, 1024]
    - [20, 103.96]
  - - [128, 8192, 1, 2048, 128, 128, 128, 2048]
    - [20, 134.1]
  - - [128, 8192, 1, 4096, 128, 128, 128, 4096]
    - [44, 143.66]
  - - [128, 8192, 1, 8192, 128, 128, 128, 8192]
    - [43, 155.41]
  - - [256, 128, 1, 128, 256, 256, 256, 128]
    - [61, 1.14]
  - - [256, 128, 1, 256, 256, 256, 256, 256]
    - [61, 2.09]
  - - [256, 128, 1, 512, 256, 256, 256, 512]
    - [61, 3.61]
  - - [256, 128, 1, 1024, 256, 256, 256, 1024]
    - [61, 5.63]
  - - [256, 128, 1, 2048, 256, 256, 256, 2048]
    - [60, 7.77]
  - - [256, 128, 1, 4096, 256, 256, 256, 4096]
    - [60, 9.65]
  - - [256, 128, 1, 8192, 256, 256, 256, 8192]
    - [60, 10.98]
  - - [256, 256, 1, 128, 256, 256, 256, 128]
    - [61, 2.28]
  - - [256, 256, 1, 256, 256, 256, 256, 256]
    - [61, 4.17]
  - - [256, 256, 1, 512, 256, 256, 256, 512]
    - [61, 6.75]
  - - [256, 256, 1, 1024, 256, 256, 256, 1024]
    - [60, 11.04]
  - - [256, 256, 1, 2048, 256, 256, 256, 2048]
    - [61, 15.29]
  - - [256, 256, 1, 4096, 256, 256, 256, 4096]
    - [60, 19.12]
  - - [256, 256, 1, 8192, 256, 256, 256, 8192]
    - [60, 21.81]
  - - [256, 512, 1, 128, 256, 256, 256, 128]
    - [27, 4.35]
  - - [256, 512, 1, 256, 256, 256, 256, 256]
    - [27, 7.9]
  - - [256, 512, 1, 512, 256, 256, 256, 512]
    - [61, 13.77]
  - - [256, 512, 1, 1024, 256, 256, 256, 1024]
    - [61, 21.6]
  - - [256, 512, 1, 2048, 256, 256, 256, 2048]
    - [60, 30.16]
  - - [256, 512, 1, 4096, 256, 256, 256, 4096]
    - [60, 37.61]
  - - [256, 512, 1, 8192, 256, 256, 256, 8192]
    - [60, 43.04]
  - - [256, 1024, 1, 128, 256, 256, 256, 128]
    - [56, 8.39]
  - - [256, 1024, 1, 256, 256, 256, 256, 256]
    - [58, 14.67]
  - - [256, 1024, 1, 512, 256, 256, 256, 512]
    - [58, 24.64]
  - - [256, 1024, 1, 1024, 256, 256, 256, 1024]
    - [58, 37.91]
  - - [256, 1024, 1, 2048, 256, 256, 256, 2048]
    - [65, 52.22]
  - - [256, 1024, 1, 4096, 256, 256, 256, 4096]
    - [65, 64.13]
  - - [256, 1024, 1, 8192, 256, 256, 256, 8192]
    - [65, 72.33]
  - - [256, 2048, 1, 128, 256, 256, 256, 128]
    - [26, 15.14]
  - - [256, 2048, 1, 256, 256, 256, 256, 256]
    - [25, 26.48]
  - - [256, 2048, 1, 512, 256, 256, 256, 512]
    - [51, 42.89]
  - - [256, 2048, 1, 1024, 256, 256, 256, 1024]
    - [49, 64.8]
  - - [256, 2048, 1, 2048, 256, 256, 256, 2048]
    - [49, 85.09]
  - - [256, 2048, 1, 4096, 256, 256, 256, 4096]
    - [64, 102.3]
  - - [256, 2048, 1, 8192, 256, 256, 256, 8192]
    - [49, 111.39]
  - - [256, 4096, 1, 128, 256, 256, 256, 128]
    - [23, 26.41]
  - - [256, 4096, 1, 256, 256, 256, 256, 256]
    - [23, 45.44]
  - - [256, 4096, 1, 512, 256, 256, 256, 512]
    - [21, 72.25]
  - - [256, 4096, 1, 1024, 256, 256, 256, 1024]
    - [20, 104.94]
  - - [256, 4096, 1, 2048, 256, 256, 256, 2048]
    - [20, 132.54]
  - - [256, 4096, 1, 4096, 256, 256, 256, 4096]
    - [43, 146.3]
  - - [256, 4096, 1, 8192, 256, 256, 256, 8192]
    - [43, 155.43]
  - - [256, 8192, 1, 128, 256, 256, 256, 128]
    - [18, 40.59]
  - - [256, 8192, 1, 256, 256, 256, 256, 256]
    - [39, 69.18]
  - - [256, 8192, 1, 512, 256, 256, 256, 512]
    - [39, 111.17]
  - - [256, 8192, 1, 1024, 256, 256, 256, 1024]
    - [39, 158.35]
  - - [256, 8192, 1, 2048, 256, 256, 256, 2048]
    - [39, 202.79]
  - - [256, 8192, 1, 4096, 256, 256, 256, 4096]
    - [39, 217.55]
  - - [256, 8192, 1, 8192, 256, 256, 256, 8192]
    - [41, 215.23]
  - - [512, 128, 1, 128, 512, 512, 512, 128]
    - [28, 2.08]
  - - [512, 128, 1, 256, 512, 512, 512, 256]
    - [61, 4.07]
  - - [512, 128, 1, 512, 512, 512, 512, 512]
    - [61, 7.11]
  - - [512, 128, 1, 1024, 512, 512, 512, 1024]
    - [62, 10.95]
  - - [512, 128, 1, 2048, 512, 512, 512, 2048]
    - [60, 15.44]
  - - [512, 128, 1, 4096, 512, 512, 512, 4096]
    - [60, 19.06]
  - - [512, 128, 1, 8192, 512, 512, 512, 8192]
    - [69, 18.66]
  - - [512, 256, 1, 128, 512, 512, 512, 128]
    - [27, 4.42]
  - - [512, 256, 1, 256, 512, 512, 512, 256]
    - [60, 8.11]
  - - [512, 256, 1, 512, 512, 512, 512, 512]
    - [61, 13.96]
  - - [512, 256, 1, 1024, 512, 512, 512, 1024]
    - [60, 21.85]
  - - [512, 256, 1, 2048, 512, 512, 512, 2048]
    - [61, 30.14]
  - - [512, 256, 1, 4096, 512, 512, 512, 4096]
    - [60, 37.74]
  - - [512, 256, 1, 8192, 512, 512, 512, 8192]
    - [70, 37.46]
  - - [512, 512, 1, 128, 512, 512, 512, 128]
    - [56, 8.49]
  - - [512, 512, 1, 256, 512, 512, 512, 256]
    - [58, 15.04]
  - - [512, 512, 1, 512, 512, 512, 512, 512]
    - [57, 25.44]
  - - [512, 512, 1, 1024, 512, 512, 512, 1024]
    - [57, 38.33]
  - - [512, 512, 1, 2048, 512, 512, 512, 2048]
    - [65, 52.34]
  - - [512, 512, 1, 4096, 512, 512, 512, 4096]
    - [65, 64.31]
  - - [512, 512, 1, 8192, 512, 512, 512, 8192]
    - [58, 62.76]
  - - [512, 1024, 1, 128, 512, 512, 512, 128]
    - [26, 15.35]
  - - [512, 1024, 1, 256, 512, 512, 512, 256]
    - [25, 27.02]
  - - [512, 1024, 1, 512, 512, 512, 512, 512]
    - [49, 43.43]
  - - [512, 1024, 1, 1024, 512, 512, 512, 1024]
    - [49, 64.08]
  - - [512, 1024, 1, 2048, 512, 512, 512, 2048]
    - [49, 85.06]
  - - [512, 1024, 1, 4096, 512, 512, 512, 4096]
    - [49, 100.62]
  - - [512, 1024, 1, 8192, 512, 512, 512, 8192]
    - [51, 103.92]
  - - [512, 2048, 1, 128, 512, 512, 512, 128]
    - [23, 26.66]
  - - [512, 2048, 1, 256, 512, 512, 512, 256]
    - [21, 46.06]
  - - [512, 2048, 1, 512, 512, 512, 512, 512]
    - [21, 73.01]
  - - [512, 2048, 1, 1024, 512, 512, 512, 1024]
    - [20, 105.03]
  - - [512, 2048, 1, 2048, 512, 512, 512, 2048]
    - [20, 134.8]
  - - [512, 2048, 1, 4096, 512, 512, 512, 4096]
    - [63, 146.7]
  - - [512, 2048, 1, 8192, 512, 512, 512, 8192]
    - [45, 149.43]
  - - [512, 4096, 1, 128, 512, 512, 512, 128]
    - [18, 42.39]
  - - [512, 4096, 1, 256, 512, 512, 512, 256]
    - [39, 72.27]
  - - [512, 4096, 1, 512, 512, 512, 512, 512]
    - [39, 113.02]
  - - [512, 4096, 1, 1024, 512, 512, 512, 1024]
    - [39, 162.27]
  - - [512, 4096, 1, 2048, 512, 512, 512, 2048]
    - [39, 204.09]
  - - [512, 4096, 1, 4096, 512, 512, 512, 4096]
    - [39, 206.82]
  - - [512, 4096, 1, 8192, 512, 512, 512, 8192]
    - [40, 201.61]
  - - [512, 8192, 1, 128, 512, 512, 512, 128]
    - [38, 62.98]
  - - [512, 8192, 1, 256, 512, 512, 512, 256]
    - [38, 109.77]
  - - [512, 8192, 1, 512, 512, 512, 512, 512]
    - [38, 170.48]
  - - [512, 8192, 1, 1024, 512, 512, 512, 1024]
    - [38, 229.25]
  - - [512, 8192, 1, 2048, 512, 512, 512, 2048]
    - [15, 240.83]
  - - [512, 8192, 1, 4096, 512, 512, 512, 4096]
    - [32, 255.89]
  - - [512, 8192, 1, 8192, 512, 512, 512, 8192]
    - [38, 251.82]
  - - [1024, 128, 1, 128, 1024, 1024, 1024, 128]
    - [27, 4.43]
  - - [1024, 128, 1, 256, 1024, 1024, 1024, 256]
    - [61, 8.01]
  - - [1024, 128, 1, 512, 1024, 1024, 1024, 512]
    - [61, 13.93]
  - - [1024, 128, 1, 1024, 1024, 1024, 1024, 1024]
    - [61, 21.54]
  - - [1024, 128, 1, 2048, 1024, 1024, 1024, 2048]
    - [60, 30.1]
  - - [1024, 128, 1, 4096, 1024, 1024, 1024, 4096]
    - [70, 30.83]
  - - [1024, 128, 1, 8192, 1024, 1024, 1024, 8192]
    - [68, 30.51]
  - - [1024, 256, 1, 128, 1024, 1024, 1024, 128]
    - [56, 8.49]
  - - [1024, 256, 1, 256, 1024, 1024, 1024, 256]
    - [56, 15.06]
  - - [1024, 256, 1, 512, 1024, 1024, 1024, 512]
    - [57, 25.37]
  - - [1024, 256, 1, 1024, 1024, 1024, 1024, 1024]
    - [58, 36.41]
  - - [1024, 256, 1, 2048, 1024, 1024, 1024, 2048]
    - [65, 51.78]
  - - [1024, 256, 1, 4096, 1024, 1024, 1024, 4096]
    - [55, 54.21]
  - - [1024, 256, 1, 8192, 1024, 1024, 1024, 8192]
    - [59, 58.62]
  - - [1024, 512, 1, 128, 1024, 1024, 1024, 128]
    - [24, 14.21]
  - - [1024, 512, 1, 256, 1024, 1024, 1024, 256]
    - [26, 25.85]
  - - [1024, 512, 1, 512, 1024, 1024, 1024, 512]
    - [50, 42.79]
  - - [1024, 512, 1, 1024, 1024, 1024, 1024, 1024]
    - [49, 63.39]
  - - [1024, 512, 1, 2048, 1024, 1024, 1024, 2048]
    - [49, 83.95]
  - - [1024, 512, 1, 4096, 1024, 1024, 1024, 4096]
    - [52, 94.3]
  - - [1024, 512, 1, 8192, 1024, 1024, 1024, 8192]
    - [51, 102.48]
  - - [1024, 1024, 1, 128, 1024, 1024, 1024, 128]
    - [22, 26.16]
  - - [1024, 1024, 1, 256, 1024, 1024, 1024, 256]
    - [21, 45.58]
  - - [1024, 1024, 1, 512, 1024, 1024, 1024, 512]
    - [21, 72.1]
  - - [1024, 1024, 1, 1024, 1024, 1024, 1024, 1024]
    - [20, 104.11]
  - - [1024, 1024, 1, 2048, 1024, 1024, 1024, 2048]
    - [20, 134.12]
  - - [1024, 1024, 1, 4096, 1024, 1024, 1024, 4096]
    - [45, 141.22]
  - - [1024, 1024, 1, 8192, 1024, 1024, 1024, 8192]
    - [48, 146.49]
  - - [1024, 2048, 1, 128, 1024, 1024, 1024, 128]
    - [19, 42.07]
  - - [1024, 2048, 1, 256, 1024, 1024, 1024, 256]
    - [19, 71.8]
  - - [1024, 2048, 1, 512, 1024, 1024, 1024, 512]
    - [39, 114.45]
  - - [1024, 2048, 1, 1024, 1024, 1024, 1024, 1024]
    - [39, 162.32]
  - - [1024, 2048, 1, 2048, 1024, 1024, 1024, 2048]
    - [39, 204.04]
  - - [1024, 2048, 1, 4096, 1024, 1024, 1024, 4096]
    - [42, 205.33]
  - - [1024, 2048, 1, 8192, 1024, 1024, 1024, 8192]
    - [40, 199.99]
  - - [1024, 4096, 1, 128, 1024, 1024, 1024, 128]
    - [15, 58.89]
  - - [1024, 4096, 1, 256, 1024, 1024, 1024, 256]
    - [15, 100.02]
  - - [1024, 4096, 1, 512, 1024, 1024, 1024, 512]
    - [10, 154.25]
  - - [1024, 4096, 1, 1024, 1024, 1024, 1024, 1024]
    - [30, 214.45]
  - - [1024, 4096, 1, 2048, 1024, 1024, 1024, 2048]
    - [15, 244.19]
  - - [1024, 4096, 1, 4096, 1024, 1024, 1024, 4096]
    - [32, 258.23]
  - - [1024, 4096, 1, 8192, 1024, 1024, 1024, 8192]
    - [30, 241.94]
  - - [1024, 8192, 1, 128, 1024, 1024, 1024, 128]
    - [32, 88.27]
  - - [1024, 8192, 1, 256, 1024, 1024, 1024, 256]
    - [32, 153.17]
  - - [1024, 8192, 1, 512, 1024, 1024, 1024, 512]
    - [32, 233.3]
  - - [1024, 8192, 1, 1024, 1024, 1024, 1024, 1024]
    - [2, 241.72]
  - - [1024, 8192, 1, 2048, 1024, 1024, 1024, 2048]
    - [32, 292.15]
  - - [1024, 8192, 1, 4096, 1024, 1024, 1024, 4096]
    - [32, 347.15]
  - - [1024, 8192, 1, 8192, 1024, 1024, 1024, 8192]
    - [34, 376.24]
  - - [2048, 128, 1, 128, 2048, 2048, 2048, 128]
    - [57, 8.31]
  - - [2048, 128, 1, 256, 2048, 2048, 2048, 256]
    - [57, 14.84]
  - - [2048, 128, 1, 512, 2048, 2048, 2048, 512]
    - [57, 23.99]
  - - [2048, 128, 1, 1024, 2048, 2048, 2048, 1024]
    - [58, 37.48]
  - - [2048, 128, 1, 2048, 2048, 2048, 2048, 2048]
    - [59, 43.48]
  - - [2048, 128, 1, 4096, 2048, 2048, 2048, 4096]
    - [67, 52.37]
  - - [2048, 128, 1, 8192, 2048, 2048, 2048, 8192]
    - [66, 59.36]
  - - [2048, 256, 1, 128, 2048, 2048, 2048, 128]
    - [26, 15.03]
  - - [2048, 256, 1, 256, 2048, 2048, 2048, 256]
    - [25, 26.37]
  - - [2048, 256, 1, 512, 2048, 2048, 2048, 512]
    - [26, 42.55]
  - - [2048, 256, 1, 1024, 2048, 2048, 2048, 1024]
    - [49, 62.89]
  - - [2048, 256, 1, 2048, 2048, 2048, 2048, 2048]
    - [52, 78.21]
  - - [2048, 256, 1, 4096, 2048, 2048, 2048, 4096]
    - [52, 93.58]
  - - [2048, 256, 1, 8192, 2048, 2048, 2048, 8192]
    - [54, 104.47]
  - - [2048, 512, 1, 128, 2048, 2048, 2048, 128]
    - [22, 26.22]
  - - [2048, 512, 1, 256, 2048, 2048, 2048, 256]
    - [21, 45.79]
  - - [2048, 512, 1, 512, 2048, 2048, 2048, 512]
    - [21, 72.31]
  - - [2048, 512, 1, 1024, 2048, 2048, 2048, 1024]
    - [20, 104.27]
  - - [2048, 512, 1, 2048, 2048, 2048, 2048, 2048]
    - [48, 121.15]
  - - [2048, 512, 1, 4096, 2048, 2048, 2048, 4096]
    - [48, 141.21]
  - - [2048, 512, 1, 8192, 2048, 2048, 2048, 8192]
    - [48, 148.04]
  - - [2048, 1024, 1, 128, 2048, 2048, 2048, 128]
    - [18, 42.22]
  - - [2048, 1024, 1, 256, 2048, 2048, 2048, 256]
    - [19, 72.1]
  - - [2048, 1024, 1, 512, 2048, 2048, 2048, 512]
    - [39, 110.84]
  - - [2048, 1024, 1, 1024, 2048, 2048, 2048, 1024]
    - [39, 161.83]
  - - [2048, 1024, 1, 2048, 2048, 2048, 2048, 2048]
    - [42, 183.24]
  - - [2048, 1024, 1, 4096, 2048, 2048, 2048, 4096]
    - [40, 204.41]
  - - [2048, 1024, 1, 8192, 2048, 2048, 2048, 8192]
    - [42, 196.38]
  - - [2048, 2048, 1, 128, 2048, 2048, 2048, 128]
    - [17, 59.34]
  - - [2048, 2048, 1, 256, 2048, 2048, 2048, 256]
    - [17, 100.64]
  - - [2048, 2048, 1, 512, 2048, 2048, 2048, 512]
    - [15, 154.38]
  - - [2048, 2048, 1, 1024, 2048, 2048, 2048, 1024]
    - [11, 208.13]
  - - [2048, 2048, 1, 2048, 2048, 2048, 2048, 2048]
    - [17, 239.73]
  - - [2048, 2048, 1, 4096, 2048, 2048, 2048, 4096]
    - [36, 254.79]
  - - [2048, 2048, 1, 8192, 2048, 2048, 2048, 8192]
    - [34, 238.7]
  - - [2048, 4096, 1, 128, 2048, 2048, 2048, 128]
    - [3, 73.21]
  - - [2048, 4096, 1, 256, 2048, 2048, 2048, 256]
    - [0, 121.89]
  - - [2048, 4096, 1, 512, 2048, 2048, 2048, 512]
    - [3, 182.54]
  - - [2048, 4096, 1, 1024, 2048, 2048, 2048, 1024]
    - [8, 240.19]
  - - [2048, 4096, 1, 2048, 2048, 2048, 2048, 2048]
    - [8, 272.84]
  - - [2048, 4096, 1, 4096, 2048, 2048, 2048, 4096]
    - [32, 279.82]
  - - [2048, 4096, 1, 8192, 2048, 2048, 2048, 8192]
    - [33, 314.49]
  - - [2048, 8192, 1, 128, 2048, 2048, 2048, 128]
    - [33, 96.7]
  - - [2048, 8192, 1, 256, 2048, 2048, 2048, 256]
    - [35, 159.7]
  - - [2048, 8192, 1, 512, 2048, 2048, 2048, 512]
    - [32, 211.95]
  - - [2048, 8192, 1, 1024, 2048, 2048, 2048, 1024]
    - [32, 259.19]
  - - [2048, 8192, 1, 2048, 2048, 2048, 2048, 2048]
    - [33, 326.47]
  - - [2048, 8192, 1, 4096, 2048, 2048, 2048, 4096]
    - [34, 341.17]
  - - [2048, 8192, 1, 8192, 2048, 2048, 2048, 8192]
    - [34, 387.78]
  - - [4096, 128, 1, 128, 4096, 4096, 4096, 128]
    - [24, 14.85]
  - - [4096, 128, 1, 256, 4096, 4096, 4096, 256]
    - [24, 25.14]
  - - [4096, 128, 1, 512, 4096, 4096, 4096, 512]
    - [50, 42.34]
  - - [4096, 128, 1, 1024, 4096, 4096, 4096, 1024]
    - [50, 62.84]
  - - [4096, 128, 1, 2048, 4096, 4096, 4096, 2048]
    - [53, 77.62]
  - - [4096, 128, 1, 4096, 4096, 4096, 4096, 4096]
    - [54, 93.74]
  - - [4096, 128, 1, 8192, 4096, 4096, 4096, 8192]
    - [52, 104.64]
  - - [4096, 256, 1, 128, 4096, 4096, 4096, 128]
    - [21, 25.63]
  - - [4096, 256, 1, 256, 4096, 4096, 4096, 256]
    - [21, 45.0]
  - - [4096, 256, 1, 512, 4096, 4096, 4096, 512]
    - [21, 72.21]
  - - [4096, 256, 1, 1024, 4096, 4096, 4096, 1024]
    - [20, 101.79]
  - - [4096, 256, 1, 2048, 4096, 4096, 4096, 2048]
    - [48, 119.04]
  - - [4096, 256, 1, 4096, 4096, 4096, 4096, 4096]
    - [48, 139.74]
  - - [4096, 256, 1, 8192, 4096, 4096, 4096, 8192]
    - [46, 148.45]
  - - [4096, 512, 1, 128, 4096, 4096, 4096, 128]
    - [19, 40.83]
  - - [4096, 512, 1, 256, 4096, 4096, 4096, 256]
    - [39, 69.39]
  - - [4096, 512, 1, 512, 4096, 4096, 4096, 512]
    - [39, 111.44]
  - - [4096, 512, 1, 1024, 4096, 4096, 4096, 1024]
    - [40, 151.64]
  - - [4096, 512, 1, 2048, 4096, 4096, 4096, 2048]
    - [40, 179.21]
  - - [4096, 512, 1, 4096, 4096, 4096, 4096, 4096]
    - [42, 205.92]
  - - [4096, 512, 1, 8192, 4096, 4096, 4096, 8192]
    - [40, 199.57]
  - - [4096, 1024, 1, 128, 4096, 4096, 4096, 128]
    - [15, 57.7]
  - - [4096, 1024, 1, 256, 4096, 4096, 4096, 256]
    - [15, 99.13]
  - - [4096, 1024, 1, 512, 4096, 4096, 4096, 512]
    - [15, 153.57]
  - - [4096, 1024, 1, 1024, 4096, 4096, 4096, 1024]
    - [16, 201.7]
  - - [4096, 1024, 1, 2048, 4096, 4096, 4096, 2048]
    - [17, 238.95]
  - - [4096, 1024, 1, 4096, 4096, 4096, 4096, 4096]
    - [31, 257.89]
  - - [4096, 1024, 1, 8192, 4096, 4096, 4096, 8192]
    - [31, 242.55]
  - - [4096, 2048, 1, 128, 4096, 4096, 4096, 128]
    - [3, 72.63]
  - - [4096, 2048, 1, 256, 4096, 4096, 4096, 256]
    - [0, 121.48]
  - - [4096, 2048, 1, 512, 4096, 4096, 4096, 512]
    - [6, 181.34]
  - - [4096, 2048, 1, 1024, 4096, 4096, 4096, 1024]
    - [9, 239.03]
  - - [4096, 2048, 1, 2048, 4096, 4096, 4096, 2048]
    - [8, 271.0]
  - - [4096, 2048, 1, 4096, 4096, 4096, 4096, 4096]
    - [2, 264.7]
  - - [4096, 2048, 1, 8192, 4096, 4096, 4096, 8192]
    - [30, 296.22]
  - - [4096, 4096, 1, 128, 4096, 4096, 4096, 128]
    - [6, 78.14]
  - - [4096, 4096, 1, 256, 4096, 4096, 4096, 256]
    - [4, 129.68]
  - - [4096, 4096, 1, 512, 4096, 4096, 4096, 512]
    - [9, 191.04]
  - - [4096, 4096, 1, 1024, 4096, 4096, 4096, 1024]
    - [7, 234.59]
  - - [4096, 4096, 1, 2048, 4096, 4096, 4096, 2048]
    - [35, 262.42]
  - - [4096, 4096, 1, 4096, 4096, 4096, 4096, 4096]
    - [34, 299.13]
  - - [4096, 4096, 1, 8192, 4096, 4096, 4096, 8192]
    - [1, 327.0]
  - - [4096, 8192, 1, 128, 4096, 4096, 4096, 128]
    - [32, 102.6]
  - - [4096, 8192, 1, 256, 4096, 4096, 4096, 256]
    - [32, 165.07]
  - - [4096, 8192, 1, 512, 4096, 4096, 4096, 512]
    - [35, 225.24]
  - - [4096, 8192, 1, 1024, 4096, 4096, 4096, 1024]
    - [34, 276.17]
  - - [4096, 8192, 1, 2048, 4096, 4096, 4096, 2048]
    - [34, 323.76]
  - - [4096, 8192, 1, 4096, 4096, 4096, 4096, 4096]
    - [34, 365.19]
  - - [4096, 8192, 1, 8192, 4096, 4096, 4096, 8192]
    - [35, 404.29]
  - - [8192, 128, 1, 128, 8192, 8192, 8192, 128]
    - [22, 26.8]
  - - [8192, 128, 1, 256, 8192, 8192, 8192, 256]
    - [22, 46.41]
  - - [8192, 128, 1, 512, 8192, 8192, 8192, 512]
    - [21, 72.47]
  - - [8192, 128, 1, 1024, 8192, 8192, 8192, 1024]
    - [20, 104.18]
  - - [8192, 128, 1, 2048, 8192, 8192, 8192, 2048]
    - [48, 119.83]
  - - [8192, 128, 1, 4096, 8192, 8192, 8192, 4096]
    - [48, 140.28]
  - - [8192, 128, 1, 8192, 8192, 8192, 8192, 8192]
    - [47, 142.47]
  - - [8192, 256, 1, 128, 8192, 8192, 8192, 128]
    - [18, 42.3]
  - - [8192, 256, 1, 256, 8192, 8192, 8192, 256]
    - [19, 71.29]
  - - [8192, 256, 1, 512, 8192, 8192, 8192, 512]
    - [42, 111.51]
  - - [8192, 256, 1, 1024, 8192, 8192, 8192, 1024]
    - [42, 156.56]
  - - [8192, 256, 1, 2048, 8192, 8192, 8192, 2048]
    - [40, 181.86]
  - - [8192, 256, 1, 4096, 8192, 8192, 8192, 4096]
    - [41, 204.26]
  - - [8192, 256, 1, 8192, 8192, 8192, 8192, 8192]
    - [41, 193.85]
  - - [8192, 512, 1, 128, 8192, 8192, 8192, 128]
    - [15, 59.54]
  - - [8192, 512, 1, 256, 8192, 8192, 8192, 256]
    - [11, 96.96]
  - - [8192, 512, 1, 512, 8192, 8192, 8192, 512]
    - [13, 152.64]
  - - [8192, 512, 1, 1024, 8192, 8192, 8192, 1024]
    - [12, 206.07]
  - - [8192, 512, 1, 2048, 8192, 8192, 8192, 2048]
    - [37, 239.33]
  - - [8192, 512, 1, 4096, 8192, 8192, 8192, 4096]
    - [31, 257.73]
  - - [8192, 512, 1, 8192, 8192, 8192, 8192, 8192]
    - [31, 245.79]
  - - [8192, 1024, 1, 128, 8192, 8192, 8192, 128]
    - [9, 73.87]
  - - [8192, 1024, 1, 256, 8192, 8192, 8192, 256]
    - [3, 122.9]
  - - [8192, 1024, 1, 512, 8192, 8192, 8192, 512]
    - [6, 183.35]
  - - [8192, 1024, 1, 1024, 8192, 8192, 8192, 1024]
    - [7, 239.1]
  - - [8192, 1024, 1, 2048, 8192, 8192, 8192, 2048]
    - [5, 271.48]
  - - [8192, 1024, 1, 4096, 8192, 8192, 8192, 4096]
    - [5, 265.9]
  - - [8192, 1024, 1, 8192, 8192, 8192, 8192, 8192]
    - [29, 295.74]
  - - [8192, 2048, 1, 128, 8192, 8192, 8192, 128]
    - [6, 78.64]
  - - [8192, 2048, 1, 256, 8192, 8192, 8192, 256]
    - [6, 130.46]
  - - [8192, 2048, 1, 512, 8192, 8192, 8192, 512]
    - [9, 191.87]
  - - [8192, 2048, 1, 1024, 8192, 8192, 8192, 1024]
    - [8, 239.48]
  - - [8192, 2048, 1, 2048, 8192, 8192, 8192, 2048]
    - [14, 244.05]
  - - [8192, 2048, 1, 4096, 8192, 8192, 8192, 4096]
    - [5, 286.69]
  - - [8192, 2048, 1, 8192, 8192, 8192, 8192, 8192]
    - [1, 337.19]
  - - [8192, 4096, 1, 128, 8192, 8192, 8192, 128]
    - [9, 84.87]
  - - [8192, 4096, 1, 256, 8192, 8192, 8192, 256]
    - [9, 135.06]
  - - [8192, 4096, 1, 512, 8192, 8192, 8192, 512]
    - [17, 193.17]
  - - [8192, 4096, 1, 1024, 8192, 8192, 8192, 1024]
    - [34, 242.11]
  - - [8192, 4096, 1, 2048, 8192, 8192, 8192, 2048]
    - [34, 291.07]
  - - [8192, 4096, 1, 4096, 8192, 8192, 8192, 4096]
    - [33, 327.38]
  - - [8192, 4096, 1, 8192, 8192, 8192, 8192, 8192]
    - [1, 366.11]
  - - [8192, 8192, 1, 128, 8192, 8192, 8192, 128]
    - [32, 101.53]
  - - [8192, 8192, 1, 256, 8192, 8192, 8192, 256]
    - [32, 151.24]
  - - [8192, 8192, 1, 512, 8192, 8192, 8192, 512]
    - [35, 218.08]
  - - [8192, 8192, 1, 1024, 8192, 8192, 8192, 1024]
    - [34, 282.09]
  - - [8192, 8192, 1, 2048, 8192, 8192, 8192, 2048]
    - [34, 342.48]
  - - [8192, 8192, 1, 4096, 8192, 8192, 8192, 4096]
    - [34, 384.24]
  - - [8192, 8192, 1, 8192, 8192, 8192, 8192, 8192]
    - [34, 413.91]
- null
- null
- ExperimentalStreamK
- GridBased
