projects/hipblaslt/library/src/amd_detail/rocblaslt/src/Tensile/Logic/asm_full/aquavanjaram/gfx942_228cu/StreamK/aquavanjaram942_Cijk_Ailk_Bjlk_BBS_BH_Bias_HAS_SAV_UserArgs.yaml
- {MinimumRequiredVersion: 4.33.0}
- aquavanjaram942
- {Architecture: gfx942, CUCount: 228}
- [Device 0049, Device 0050]
    SolutionIndex: 0
    SolutionNameMin: Cijk_Ailk_Bjlk_BBS_BH_Bias_AS_SAV_UserArgs_MT256x256x32_MI16x16x1_SN_LDSB0_CLR1_GRVWA4_GRVWB2_GSU0_GSUC0_GSUWGMRR0_K1_LBSPPA2048_LBSPPB2048_LPA0_LPB0_MIWT8_8_PLR1_SU0_SUM0_SUS64_VWA8_VWB8_WGM1_WGMXCC1_WGMXCCGn1
    SolutionIndex: 1
    SolutionNameMin: Cijk_Ailk_Bjlk_BBS_BH_Bias_AS_SAV_UserArgs_MT256x256x32_MI16x16x1_SN_LDSB0_CLR1_GRVWA2_GRVWB4_GSU0_GSUC0_GSUWGMRR0_K1_LBSPPA2048_LBSPPB2048_LPA0_LPB0_MIWT8_8_PLR1_SU0_SUM0_SUS64_VWA8_VWB8_WGM1_WGMXCC1_WGMXCCGn1
    SolutionIndex: 2
    SolutionNameMin: Cijk_Ailk_Bjlk_BBS_BH_Bias_AS_SAV_UserArgs_MT256x256x32_MI16x16x1_SN_LDSB0_CLR1_GRVWA4_GRVWB4_GSU0_GSUC0_GSUWGMRR0_K1_LBSPPA2048_LBSPPB2048_LPA0_LPB0_MIWT8_8_PLR1_SU0_SUM0_SUS64_VWA8_VWB8_WGM1_WGMXCC1_WGMXCCGn1
    SolutionIndex: 3
    SolutionNameMin: Cijk_Ailk_Bjlk_BBS_BH_Bias_AS_SAV_UserArgs_MT256x256x32_MI16x16x1_SN_LDSB0_CLR1_GRVWA8_GRVWB4_GSU0_GSUC0_GSUWGMRR0_K1_LBSPPA2048_LBSPPB2048_LPA0_LPB0_MIWT8_8_PLR1_SU0_SUM0_SUS64_VWA8_VWB8_WGM1_WGMXCC1_WGMXCCGn1
    SolutionIndex: 4
    SolutionNameMin: Cijk_Ailk_Bjlk_BBS_BH_Bias_AS_SAV_UserArgs_MT256x256x32_MI16x16x1_SN_LDSB0_CLR1_GRVWA2_GRVWB8_GSU0_GSUC0_GSUWGMRR0_K1_LBSPPA2048_LBSPPB2048_LPA0_LPB0_MIWT8_8_PLR1_SU0_SUM0_SUS64_VWA8_VWB8_WGM1_WGMXCC1_WGMXCCGn1
    SolutionIndex: 5
    SolutionNameMin: Cijk_Ailk_Bjlk_BBS_BH_Bias_AS_SAV_UserArgs_MT256x256x32_MI16x16x1_SN_LDSB0_CLR1_GRVWA4_GRVWB8_GSU0_GSUC0_GSUWGMRR0_K1_LBSPPA2048_LBSPPB2048_LPA0_LPB0_MIWT8_8_PLR1_SU0_SUM0_SUS64_VWA8_VWB8_WGM1_WGMXCC1_WGMXCCGn1
    SolutionIndex: 6
    SolutionNameMin: Cijk_Ailk_Bjlk_BBS_BH_Bias_AS_SAV_UserArgs_MT256x256x32_MI16x16x1_SN_LDSB0_CLR1_GRVWA8_GRVWB8_GSU0_GSUC0_GSUWGMRR0_K1_LBSPPA2048_LBSPPB2048_LPA0_LPB0_MIWT8_8_PLR1_SU0_SUM0_SUS64_VWA8_VWB8_WGM1_WGMXCC1_WGMXCCGn1
    SolutionIndex: 7
    SolutionNameMin: Cijk_Ailk_Bjlk_BBS_BH_Bias_AS_SAV_UserArgs_MT256x256x32_MI16x16x1_SN_LDSB0_CLR1_GRVWA2_GRVWB2_GSU0_GSUC0_GSUWGMRR0_K1_LBSPPA2048_LBSPPB2048_LPA0_LPB0_MIWT8_8_PLR1_SU0_SUM0_SUS64_VWA8_VWB8_WGM4_WGMXCC1_WGMXCCGn1
    SolutionIndex: 8
    SolutionNameMin: Cijk_Ailk_Bjlk_BBS_BH_Bias_AS_SAV_UserArgs_MT256x256x32_MI16x16x1_SN_LDSB0_CLR1_GRVWA4_GRVWB2_GSU0_GSUC0_GSUWGMRR0_K1_LBSPPA2048_LBSPPB2048_LPA0_LPB0_MIWT8_8_PLR1_SU0_SUM0_SUS64_VWA8_VWB8_WGM4_WGMXCC1_WGMXCCGn1
    SolutionIndex: 9
    SolutionNameMin: Cijk_Ailk_Bjlk_BBS_BH_Bias_AS_SAV_UserArgs_MT256x256x32_MI16x16x1_SN_LDSB0_CLR1_GRVWA8_GRVWB8_GSU0_GSUC0_GSUWGMRR0_K1_LBSPPA2048_LBSPPB2048_LPA0_LPB0_MIWT8_8_PLR1_SU0_SUM0_SUS64_VWA8_VWB8_WGM4_WGMXCC1_WGMXCCGn1
    SolutionIndex: 10
    SolutionNameMin: Cijk_Ailk_Bjlk_BBS_BH_Bias_AS_SAV_UserArgs_MT256x256x32_MI16x16x1_SN_LDSB0_CLR1_GRVWA8_GRVWB2_GSU0_GSUC0_GSUWGMRR0_K1_LBSPPA2048_LBSPPB2048_LPA0_LPB0_MIWT8_8_PLR1_SU0_SUM0_SUS64_VWA8_VWB8_WGM6_WGMXCC1_WGMXCCGn1
    SolutionIndex: 11
    SolutionNameMin: Cijk_Ailk_Bjlk_BBS_BH_Bias_AS_SAV_UserArgs_MT256x256x32_MI16x16x1_SN_LDSB0_CLR1_GRVWA2_GRVWB4_GSU0_GSUC0_GSUWGMRR0_K1_LBSPPA2048_LBSPPB2048_LPA0_LPB0_MIWT8_8_PLR1_SU0_SUM0_SUS64_VWA8_VWB8_WGM6_WGMXCC1_WGMXCCGn1
    SolutionIndex: 12
    SolutionNameMin: Cijk_Ailk_Bjlk_BBS_BH_Bias_AS_SAV_UserArgs_MT256x256x32_MI16x16x1_SN_LDSB0_CLR1_GRVWA8_GRVWB8_GSU0_GSUC0_GSUWGMRR0_K1_LBSPPA2048_LBSPPB2048_LPA0_LPB0_MIWT8_8_PLR1_SU0_SUM0_SUS64_VWA8_VWB8_WGM6_WGMXCC1_WGMXCCGn1
    SolutionIndex: 13
    SolutionNameMin: Cijk_Ailk_Bjlk_BBS_BH_Bias_AS_SAV_UserArgs_MT256x256x32_MI16x16x1_SN_LDSB0_CLR1_GRVWA8_GRVWB8_GSU0_GSUC0_GSUWGMRR0_K1_LBSPPA2048_LBSPPB2048_LPA0_LPB0_MIWT8_8_PLR1_SU0_SUM0_SUS64_VWA8_VWB8_WGM8_WGMXCC1_WGMXCCGn1
    SolutionIndex: 14
    SolutionNameMin: Cijk_Ailk_Bjlk_BBS_BH_Bias_AS_SAV_UserArgs_MT128x256x32_MI16x16x1_SN_LDSB1_CLR1_GRVWA2_GRVWB4_GSU0_GSUC0_GSUWGMRR0_K1_LBSPPA1024_LBSPPB2048_LPA0_LPB0_MIWT4_8_PLR1_SU0_SUM0_SUS64_VWA4_VWB8_WGM1_WGMXCC1_WGMXCCGn1
    SolutionIndex: 15
    SolutionNameMin: Cijk_Ailk_Bjlk_BBS_BH_Bias_AS_SAV_UserArgs_MT128x256x32_MI16x16x1_SN_LDSB1_CLR1_GRVWA8_GRVWB4_GSU0_GSUC0_GSUWGMRR0_K1_LBSPPA1024_LBSPPB2048_LPA0_LPB0_MIWT4_8_PLR1_SU0_SUM0_SUS64_VWA4_VWB8_WGM1_WGMXCC1_WGMXCCGn1
    SolutionIndex: 16
    SolutionNameMin: Cijk_Ailk_Bjlk_BBS_BH_Bias_AS_SAV_UserArgs_MT128x256x32_MI16x16x1_SN_LDSB1_CLR1_GRVWA2_GRVWB8_GSU0_GSUC0_GSUWGMRR0_K1_LBSPPA1024_LBSPPB2048_LPA0_LPB0_MIWT4_8_PLR1_SU0_SUM0_SUS64_VWA4_VWB8_WGM1_WGMXCC1_WGMXCCGn1
    SolutionIndex: 17
    SolutionNameMin: Cijk_Ailk_Bjlk_BBS_BH_Bias_AS_SAV_UserArgs_MT128x256x32_MI16x16x1_SN_LDSB1_CLR1_GRVWA4_GRVWB8_GSU0_GSUC0_GSUWGMRR0_K1_LBSPPA1024_LBSPPB2048_LPA0_LPB0_MIWT4_8_PLR1_SU0_SUM0_SUS64_VWA4_VWB8_WGM1_WGMXCC1_WGMXCCGn1
    SolutionIndex: 18
    SolutionNameMin: Cijk_Ailk_Bjlk_BBS_BH_Bias_AS_SAV_UserArgs_MT128x256x32_MI16x16x1_SN_LDSB1_CLR1_GRVWA8_GRVWB8_GSU0_GSUC0_GSUWGMRR0_K1_LBSPPA1024_LBSPPB2048_LPA0_LPB0_MIWT4_8_PLR1_SU0_SUM0_SUS64_VWA4_VWB8_WGM1_WGMXCC1_WGMXCCGn1
    SolutionIndex: 19
    SolutionNameMin: Cijk_Ailk_Bjlk_BBS_BH_Bias_AS_SAV_UserArgs_MT128x256x32_MI16x16x1_SN_LDSB1_CLR1_GRVWA2_GRVWB8_GSU0_GSUC0_GSUWGMRR0_K1_LBSPPA1024_LBSPPB2048_LPA0_LPB0_MIWT4_8_PLR1_SU0_SUM0_SUS64_VWA4_VWB8_WGM4_WGMXCC1_WGMXCCGn1
    SolutionIndex: 20
    SolutionNameMin: Cijk_Ailk_Bjlk_BBS_BH_Bias_AS_SAV_UserArgs_MT128x256x32_MI16x16x1_SN_LDSB1_CLR1_GRVWA4_GRVWB8_GSU0_GSUC0_GSUWGMRR0_K1_LBSPPA1024_LBSPPB2048_LPA0_LPB0_MIWT4_8_PLR1_SU0_SUM0_SUS64_VWA4_VWB8_WGM4_WGMXCC1_WGMXCCGn1
    SolutionIndex: 21
    SolutionNameMin: Cijk_Ailk_Bjlk_BBS_BH_Bias_AS_SAV_UserArgs_MT128x256x32_MI16x16x1_SN_LDSB1_CLR1_GRVWA8_GRVWB8_GSU0_GSUC0_GSUWGMRR0_K1_LBSPPA1024_LBSPPB2048_LPA0_LPB0_MIWT4_8_PLR1_SU0_SUM0_SUS64_VWA4_VWB8_WGM4_WGMXCC1_WGMXCCGn1
    SolutionIndex: 22
    SolutionNameMin: Cijk_Ailk_Bjlk_BBS_BH_Bias_AS_SAV_UserArgs_MT128x256x32_MI16x16x1_SN_LDSB1_CLR1_GRVWA2_GRVWB8_GSU0_GSUC0_GSUWGMRR0_K1_LBSPPA1024_LBSPPB2048_LPA0_LPB0_MIWT4_8_PLR1_SU0_SUM0_SUS64_VWA4_VWB8_WGM6_WGMXCC1_WGMXCCGn1
    SolutionIndex: 23
    SolutionNameMin: Cijk_Ailk_Bjlk_BBS_BH_Bias_AS_SAV_UserArgs_MT128x256x32_MI16x16x1_SN_LDSB1_CLR1_GRVWA8_GRVWB8_GSU0_GSUC0_GSUWGMRR0_K1_LBSPPA1024_LBSPPB2048_LPA0_LPB0_MIWT4_8_PLR1_SU0_SUM0_SUS64_VWA4_VWB8_WGM6_WGMXCC1_WGMXCCGn1
    SolutionIndex: 24
    SolutionNameMin: Cijk_Ailk_Bjlk_BBS_BH_Bias_AS_SAV_UserArgs_MT128x256x32_MI16x16x1_SN_LDSB1_CLR1_GRVWA8_GRVWB8_GSU0_GSUC0_GSUWGMRR0_K1_LBSPPA1024_LBSPPB2048_LPA0_LPB0_MIWT4_8_PLR1_SU0_SUM0_SUS64_VWA4_VWB8_WGM8_WGMXCC1_WGMXCCGn1
    SolutionIndex: 25
    SolutionNameMin: Cijk_Ailk_Bjlk_BBS_BH_Bias_AS_SAV_UserArgs_MT256x128x32_MI16x16x1_SN_LDSB1_CLR1_GRVWA8_GRVWB2_GSU0_GSUC0_GSUWGMRR0_K1_LBSPPA2048_LBSPPB1024_LPA0_LPB0_MIWT8_4_PLR1_SU0_SUM0_SUS64_VWA8_VWB4_WGM1_WGMXCC1_WGMXCCGn1
    SolutionIndex: 26
    SolutionNameMin: Cijk_Ailk_Bjlk_BBS_BH_Bias_AS_SAV_UserArgs_MT256x128x32_MI16x16x1_SN_LDSB1_CLR1_GRVWA2_GRVWB4_GSU0_GSUC0_GSUWGMRR0_K1_LBSPPA2048_LBSPPB1024_LPA0_LPB0_MIWT8_4_PLR1_SU0_SUM0_SUS64_VWA8_VWB4_WGM1_WGMXCC1_WGMXCCGn1
    SolutionIndex: 27
    SolutionNameMin: Cijk_Ailk_Bjlk_BBS_BH_Bias_AS_SAV_UserArgs_MT256x128x32_MI16x16x1_SN_LDSB1_CLR1_GRVWA4_GRVWB4_GSU0_GSUC0_GSUWGMRR0_K1_LBSPPA2048_LBSPPB1024_LPA0_LPB0_MIWT8_4_PLR1_SU0_SUM0_SUS64_VWA8_VWB4_WGM1_WGMXCC1_WGMXCCGn1
    SolutionIndex: 28
    SolutionNameMin: Cijk_Ailk_Bjlk_BBS_BH_Bias_AS_SAV_UserArgs_MT256x128x32_MI16x16x1_SN_LDSB1_CLR1_GRVWA8_GRVWB4_GSU0_GSUC0_GSUWGMRR0_K1_LBSPPA2048_LBSPPB1024_LPA0_LPB0_MIWT8_4_PLR1_SU0_SUM0_SUS64_VWA8_VWB4_WGM1_WGMXCC1_WGMXCCGn1
    SolutionIndex: 29
    SolutionNameMin: Cijk_Ailk_Bjlk_BBS_BH_Bias_AS_SAV_UserArgs_MT256x128x32_MI16x16x1_SN_LDSB1_CLR1_GRVWA8_GRVWB8_GSU0_GSUC0_GSUWGMRR0_K1_LBSPPA2048_LBSPPB1024_LPA0_LPB0_MIWT8_4_PLR1_SU0_SUM0_SUS64_VWA8_VWB4_WGM1_WGMXCC1_WGMXCCGn1
    SolutionIndex: 30
    SolutionNameMin: Cijk_Ailk_Bjlk_BBS_BH_Bias_AS_SAV_UserArgs_MT256x128x32_MI16x16x1_SN_LDSB1_CLR1_GRVWA2_GRVWB2_GSU0_GSUC0_GSUWGMRR0_K1_LBSPPA2048_LBSPPB1024_LPA0_LPB0_MIWT8_4_PLR1_SU0_SUM0_SUS64_VWA8_VWB4_WGM4_WGMXCC1_WGMXCCGn1
    SolutionIndex: 31
    SolutionNameMin: Cijk_Ailk_Bjlk_BBS_BH_Bias_AS_SAV_UserArgs_MT256x128x32_MI16x16x1_SN_LDSB1_CLR1_GRVWA8_GRVWB2_GSU0_GSUC0_GSUWGMRR0_K1_LBSPPA2048_LBSPPB1024_LPA0_LPB0_MIWT8_4_PLR1_SU0_SUM0_SUS64_VWA8_VWB4_WGM4_WGMXCC1_WGMXCCGn1
    SolutionIndex: 32
    SolutionNameMin: Cijk_Ailk_Bjlk_BBS_BH_Bias_AS_SAV_UserArgs_MT256x128x32_MI16x16x1_SN_LDSB1_CLR1_GRVWA8_GRVWB4_GSU0_GSUC0_GSUWGMRR0_K1_LBSPPA2048_LBSPPB1024_LPA0_LPB0_MIWT8_4_PLR1_SU0_SUM0_SUS64_VWA8_VWB4_WGM4_WGMXCC1_WGMXCCGn1
    SolutionIndex: 33
    SolutionNameMin: Cijk_Ailk_Bjlk_BBS_BH_Bias_AS_SAV_UserArgs_MT256x128x32_MI16x16x1_SN_LDSB1_CLR1_GRVWA8_GRVWB2_GSU0_GSUC0_GSUWGMRR0_K1_LBSPPA2048_LBSPPB1024_LPA0_LPB0_MIWT8_4_PLR1_SU0_SUM0_SUS64_VWA8_VWB4_WGM6_WGMXCC1_WGMXCCGn1
    SolutionIndex: 34
    SolutionNameMin: Cijk_Ailk_Bjlk_BBS_BH_Bias_AS_SAV_UserArgs_MT256x128x32_MI16x16x1_SN_LDSB1_CLR1_GRVWA8_GRVWB4_GSU0_GSUC0_GSUWGMRR0_K1_LBSPPA2048_LBSPPB1024_LPA0_LPB0_MIWT8_4_PLR1_SU0_SUM0_SUS64_VWA8_VWB4_WGM6_WGMXCC1_WGMXCCGn1
    SolutionIndex: 35
    SolutionNameMin: Cijk_Ailk_Bjlk_BBS_BH_Bias_AS_SAV_UserArgs_MT256x128x32_MI16x16x1_SN_LDSB1_CLR1_GRVWA8_GRVWB8_GSU0_GSUC0_GSUWGMRR0_K1_LBSPPA2048_LBSPPB1024_LPA0_LPB0_MIWT8_4_PLR1_SU0_SUM0_SUS64_VWA8_VWB4_WGM6_WGMXCC1_WGMXCCGn1
    SolutionIndex: 36
    SolutionNameMin: Cijk_Ailk_Bjlk_BBS_BH_Bias_AS_SAV_UserArgs_MT256x128x32_MI16x16x1_SN_LDSB1_CLR1_GRVWA8_GRVWB4_GSU0_GSUC0_GSUWGMRR0_K1_LBSPPA2048_LBSPPB1024_LPA0_LPB0_MIWT8_4_PLR1_SU0_SUM0_SUS64_VWA8_VWB4_WGM8_WGMXCC1_WGMXCCGn1
    SolutionIndex: 37
    SolutionNameMin: Cijk_Ailk_Bjlk_BBS_BH_Bias_AS_SAV_UserArgs_MT256x128x32_MI16x16x1_SN_LDSB1_CLR1_GRVWA4_GRVWB8_GSU0_GSUC0_GSUWGMRR0_K1_LBSPPA2048_LBSPPB1024_LPA0_LPB0_MIWT8_4_PLR1_SU0_SUM0_SUS64_VWA8_VWB4_WGM8_WGMXCC1_WGMXCCGn1
    SolutionIndex: 38
    SolutionNameMin: Cijk_Ailk_Bjlk_BBS_BH_Bias_AS_SAV_UserArgs_MT256x64x32_MI16x16x1_SN_LDSB1_CLR1_GRVWA2_GRVWB2_GSU0_GSUC0_GSUWGMRR0_K1_LBSPPA2048_LBSPPB512_LPA0_LPB32_MIWT8_2_PLR1_SU0_SUM0_SUS64_VWA8_VWB2_WGM1_WGMXCC1_WGMXCCGn1
    SolutionIndex: 39
    SolutionNameMin: Cijk_Ailk_Bjlk_BBS_BH_Bias_AS_SAV_UserArgs_MT256x64x32_MI16x16x1_SN_LDSB1_CLR1_GRVWA2_GRVWB2_GSU0_GSUC0_GSUWGMRR0_K1_LBSPPA2048_LBSPPB512_LPA0_LPB32_MIWT8_2_PLR1_SU0_SUM0_SUS64_VWA8_VWB2_WGM4_WGMXCC1_WGMXCCGn1
    SolutionIndex: 40
    SolutionNameMin: Cijk_Ailk_Bjlk_BBS_BH_Bias_AS_SAV_UserArgs_MT128x128x32_MI16x16x1_SN_LDSB0_CLR1_GRVWA2_GRVWB2_GSU0_GSUC0_GSUWGMRR0_K1_LBSPPA1024_LBSPPB1024_LPA0_LPB0_MIWT4_4_PLR1_SU0_SUM0_SUS64_VWA4_VWB4_WGM1_WGMXCC1_WGMXCCGn1
    SolutionIndex: 41
    SolutionNameMin: Cijk_Ailk_Bjlk_BBS_BH_Bias_AS_SAV_UserArgs_MT128x128x32_MI16x16x1_SN_LDSB0_CLR1_GRVWA2_GRVWB8_GSU0_GSUC0_GSUWGMRR0_K1_LBSPPA1024_LBSPPB1024_LPA0_LPB0_MIWT4_4_PLR1_SU0_SUM0_SUS64_VWA4_VWB4_WGM1_WGMXCC1_WGMXCCGn1
    SolutionIndex: 42
    SolutionNameMin: Cijk_Ailk_Bjlk_BBS_BH_Bias_AS_SAV_UserArgs_MT128x128x32_MI16x16x1_SN_LDSB0_CLR1_GRVWA2_GRVWB8_GSU0_GSUC0_GSUWGMRR0_K1_LBSPPA1024_LBSPPB1024_LPA0_LPB0_MIWT4_4_PLR1_SU0_SUM0_SUS64_VWA4_VWB4_WGM4_WGMXCC1_WGMXCCGn1
    SolutionIndex: 43
    SolutionNameMin: Cijk_Ailk_Bjlk_BBS_BH_Bias_AS_SAV_UserArgs_MT128x128x32_MI16x16x1_SN_LDSB0_CLR1_GRVWA8_GRVWB8_GSU0_GSUC0_GSUWGMRR0_K1_LBSPPA1024_LBSPPB1024_LPA0_LPB0_MIWT4_4_PLR1_SU0_SUM0_SUS64_VWA4_VWB4_WGM8_WGMXCC1_WGMXCCGn1
    SolutionIndex: 44
    SolutionNameMin: Cijk_Ailk_Bjlk_BBS_BH_Bias_AS_SAV_UserArgs_MT64x128x32_MI16x16x1_SN_LDSB0_CLR1_GRVWA2_GRVWB8_GSU0_GSUC0_GSUWGMRR0_K1_LBSPPA512_LBSPPB1024_LPA32_LPB0_MIWT2_4_PLR1_SU0_SUM0_SUS64_VWA2_VWB4_WGM8_WGMXCC1_WGMXCCGn1
    SolutionIndex: 45
    SolutionNameMin: Cijk_Ailk_Bjlk_BBS_BH_Bias_AS_SAV_UserArgs_MT64x128x32_MI16x16x1_SN_LDSB0_CLR1_GRVWA4_GRVWB8_GSU0_GSUC0_GSUWGMRR0_K1_LBSPPA512_LBSPPB1024_LPA32_LPB0_MIWT2_4_PLR1_SU0_SUM0_SUS64_VWA2_VWB4_WGM8_WGMXCC1_WGMXCCGn1
    SolutionIndex: 46
    SolutionNameMin: Cijk_Ailk_Bjlk_BBS_BH_Bias_AS_SAV_UserArgs_MT128x64x32_MI16x16x1_SN_LDSB0_CLR1_GRVWA2_GRVWB2_GSU0_GSUC0_GSUWGMRR0_K1_LBSPPA1024_LBSPPB512_LPA0_LPB32_MIWT4_2_PLR1_SU0_SUM0_SUS64_VWA4_VWB2_WGM1_WGMXCC1_WGMXCCGn1
    SolutionIndex: 47
    SolutionNameMin: Cijk_Ailk_Bjlk_BBS_BH_Bias_AS_SAV_UserArgs_MT128x64x32_MI16x16x1_SN_LDSB0_CLR1_GRVWA8_GRVWB8_GSU0_GSUC0_GSUWGMRR0_K1_LBSPPA1024_LBSPPB512_LPA0_LPB32_MIWT4_2_PLR1_SU0_SUM0_SUS64_VWA4_VWB2_WGM1_WGMXCC1_WGMXCCGn1
    SolutionIndex: 48
    SolutionNameMin: Cijk_Ailk_Bjlk_BBS_BH_Bias_AS_SAV_UserArgs_MT128x64x32_MI16x16x1_SN_LDSB0_CLR1_GRVWA2_GRVWB2_GSU0_GSUC0_GSUWGMRR0_K1_LBSPPA1024_LBSPPB512_LPA0_LPB32_MIWT4_2_PLR1_SU0_SUM0_SUS64_VWA4_VWB2_WGM4_WGMXCC1_WGMXCCGn1
    SolutionIndex: 49
    SolutionNameMin: Cijk_Ailk_Bjlk_BBS_BH_Bias_AS_SAV_UserArgs_MT128x64x32_MI16x16x1_SN_LDSB0_CLR1_GRVWA2_GRVWB2_GSU0_GSUC0_GSUWGMRR0_K1_LBSPPA1024_LBSPPB512_LPA0_LPB32_MIWT4_2_PLR1_SU0_SUM0_SUS64_VWA4_VWB2_WGM6_WGMXCC1_WGMXCCGn1
    SolutionIndex: 50
    SolutionNameMin: Cijk_Ailk_Bjlk_BBS_BH_Bias_AS_SAV_UserArgs_MT128x64x32_MI16x16x1_SN_LDSB0_CLR1_GRVWA8_GRVWB8_GSU0_GSUC0_GSUWGMRR0_K1_LBSPPA1024_LBSPPB512_LPA0_LPB32_MIWT4_2_PLR1_SU0_SUM0_SUS64_VWA4_VWB2_WGM8_WGMXCC1_WGMXCCGn1
    SolutionIndex: 51
    SolutionNameMin: Cijk_Ailk_Bjlk_BBS_BH_Bias_AS_SAV_UserArgs_MT64x64x32_MI16x16x1_SN_LDSB0_CLR1_GRVWA2_GRVWB2_GSU0_GSUC0_GSUWGMRR0_K1_LBSPPA512_LBSPPB512_LPA32_LPB32_MIWT2_2_PLR1_SU0_SUM0_SUS64_VWA2_VWB2_WGM1_WGMXCC1_WGMXCCGn1
    SolutionIndex: 52
    SolutionNameMin: Cijk_Ailk_Bjlk_BBS_BH_Bias_AS_SAV_UserArgs_MT64x64x32_MI16x16x1_SN_LDSB0_CLR1_GRVWA8_GRVWB2_GSU0_GSUC0_GSUWGMRR0_K1_LBSPPA512_LBSPPB512_LPA32_LPB32_MIWT2_2_PLR1_SU0_SUM0_SUS64_VWA2_VWB2_WGM1_WGMXCC1_WGMXCCGn1
    SolutionIndex: 53
    SolutionNameMin: Cijk_Ailk_Bjlk_BBS_BH_Bias_AS_SAV_UserArgs_MT64x64x32_MI16x16x1_SN_LDSB0_CLR1_GRVWA2_GRVWB2_GSU0_GSUC0_GSUWGMRR0_K1_LBSPPA512_LBSPPB512_LPA32_LPB32_MIWT2_2_PLR1_SU0_SUM0_SUS64_VWA2_VWB2_WGM8_WGMXCC1_WGMXCCGn1
    SolutionIndex: 54
    SolutionNameMin: Cijk_Ailk_Bjlk_BBS_BH_Bias_AS_SAV_UserArgs_MT64x64x32_MI16x16x1_SN_LDSB0_CLR1_GRVWA4_GRVWB8_GSU0_GSUC0_GSUWGMRR0_K1_LBSPPA512_LBSPPB512_LPA32_LPB32_MIWT2_2_PLR1_SU0_SUM0_SUS64_VWA2_VWB2_WGM8_WGMXCC1_WGMXCCGn1
    SolutionIndex: 55
    SolutionNameMin: Cijk_Ailk_Bjlk_BBS_BH_Bias_AS_SAV_UserArgs_MT32x64x32_MI16x16x1_SN_LDSB0_CLR1_GRVWA2_GRVWB2_GSU0_GSUC0_GSUWGMRR0_K1_LBSPPA256_LBSPPB512_LPA16_LPB32_MIWT1_2_PLR1_SU0_SUM0_SUS64_VWA1_VWB2_WGM8_WGMXCC1_WGMXCCGn1
    SolutionIndex: 56
    SolutionNameMin: Cijk_Ailk_Bjlk_BBS_BH_Bias_AS_SAV_UserArgs_MT64x32x32_MI16x16x1_SN_LDSB0_CLR1_GRVWA2_GRVWB2_GSU0_GSUC0_GSUWGMRR0_K1_LBSPPA512_LBSPPB256_LPA32_LPB16_MIWT2_1_PLR1_SU0_SUM0_SUS64_VWA2_VWB1_WGM1_WGMXCC1_WGMXCCGn1
    SolutionIndex: 57
    SolutionNameMin: Cijk_Ailk_Bjlk_BBS_BH_Bias_AS_SAV_UserArgs_MT32x32x32_MI16x16x1_SN_LDSB0_CLR1_GRVWA2_GRVWB2_GSU0_GSUC0_GSUWGMRR0_K1_LBSPPA256_LBSPPB256_LPA16_LPB16_MIWT1_1_PLR1_SU0_SUM0_SUS64_VWA1_VWB1_WGM1_WGMXCC1_WGMXCCGn1
    SolutionIndex: 58
    SolutionNameMin: Cijk_Ailk_Bjlk_BBS_BH_Bias_AS_SAV_UserArgs_MT32x32x32_MI16x16x1_SN_LDSB0_CLR1_GRVWA2_GRVWB2_GSU0_GSUC0_GSUWGMRR0_K1_LBSPPA256_LBSPPB256_LPA16_LPB16_MIWT1_1_PLR1_SU0_SUM0_SUS64_VWA1_VWB1_WGM4_WGMXCC1_WGMXCCGn1
    SolutionIndex: 59
    SolutionNameMin: Cijk_Ailk_Bjlk_BBS_BH_Bias_AS_SAV_UserArgs_MT256x256x64_MI16x16x1_SN_LDSB1_CLR1_GRVWA8_GRVWB4_GSU0_GSUC0_GSUWGMRR0_K1_LBSPPA2048_LBSPPB2048_LPA0_LPB0_MIWT8_8_PLR1_SU0_SUM0_SUS128_VWA8_VWB8_WGM1_WGMXCC1_WGMXCCGn1
    SolutionIndex: 60
    SolutionNameMin: Cijk_Ailk_Bjlk_BBS_BH_Bias_AS_SAV_UserArgs_MT256x256x64_MI16x16x1_SN_LDSB1_CLR1_GRVWA8_GRVWB8_GSU0_GSUC0_GSUWGMRR0_K1_LBSPPA2048_LBSPPB2048_LPA0_LPB0_MIWT8_8_PLR1_SU0_SUM0_SUS128_VWA8_VWB8_WGM1_WGMXCC1_WGMXCCGn1
    SolutionIndex: 61
    SolutionNameMin: Cijk_Ailk_Bjlk_BBS_BH_Bias_AS_SAV_UserArgs_MT256x256x64_MI16x16x1_SN_LDSB1_CLR1_GRVWA8_GRVWB8_GSU0_GSUC0_GSUWGMRR0_K1_LBSPPA2048_LBSPPB2048_LPA0_LPB0_MIWT8_8_PLR1_SU0_SUM0_SUS128_VWA8_VWB8_WGM6_WGMXCC1_WGMXCCGn1
    SolutionIndex: 62
    SolutionNameMin: Cijk_Ailk_Bjlk_BBS_BH_Bias_AS_SAV_UserArgs_MT128x256x64_MI16x16x1_SN_LDSB1_CLR1_GRVWA8_GRVWB8_GSU0_GSUC0_GSUWGMRR0_K1_LBSPPA1024_LBSPPB2048_LPA0_LPB0_MIWT4_8_PLR1_SU0_SUM0_SUS128_VWA4_VWB8_WGM1_WGMXCC1_WGMXCCGn1
    SolutionIndex: 63
    SolutionNameMin: Cijk_Ailk_Bjlk_BBS_BH_Bias_AS_SAV_UserArgs_MT128x128x64_MI16x16x1_SN_LDSB1_CLR1_GRVWA8_GRVWB8_GSU0_GSUC0_GSUWGMRR0_K1_LBSPPA1024_LBSPPB1024_LPA0_LPB0_MIWT4_4_PLR1_SU0_SUM0_SUS128_VWA4_VWB4_WGM1_WGMXCC1_WGMXCCGn1
    SolutionIndex: 64
    SolutionNameMin: Cijk_Ailk_Bjlk_BBS_BH_Bias_AS_SAV_UserArgs_MT128x128x64_MI16x16x1_SN_LDSB1_CLR1_GRVWA8_GRVWB8_GSU0_GSUC0_GSUWGMRR0_K1_LBSPPA1024_LBSPPB1024_LPA0_LPB0_MIWT4_4_PLR1_SU0_SUM0_SUS128_VWA4_VWB4_WGM4_WGMXCC1_WGMXCCGn1
    SolutionIndex: 65
    SolutionNameMin: Cijk_Ailk_Bjlk_BBS_BH_Bias_AS_SAV_UserArgs_MT128x128x64_MI16x16x1_SN_LDSB1_CLR1_GRVWA8_GRVWB8_GSU0_GSUC0_GSUWGMRR0_K1_LBSPPA1024_LBSPPB1024_LPA0_LPB0_MIWT4_4_PLR1_SU0_SUM0_SUS128_VWA4_VWB4_WGM6_WGMXCC1_WGMXCCGn1
    SolutionIndex: 66
    SolutionNameMin: Cijk_Ailk_Bjlk_BBS_BH_Bias_AS_SAV_UserArgs_MT128x128x64_MI16x16x1_SN_LDSB1_CLR1_GRVWA8_GRVWB8_GSU0_GSUC0_GSUWGMRR0_K1_LBSPPA1024_LBSPPB1024_LPA0_LPB0_MIWT4_4_PLR1_SU0_SUM0_SUS128_VWA4_VWB4_WGM8_WGMXCC1_WGMXCCGn1
    SolutionIndex: 67
    SolutionNameMin: Cijk_Ailk_Bjlk_BBS_BH_Bias_AS_SAV_UserArgs_MT128x64x64_MI16x16x1_SN_LDSB1_CLR1_GRVWA8_GRVWB4_GSU0_GSUC0_GSUWGMRR0_K1_LBSPPA1024_LBSPPB512_LPA0_LPB32_MIWT4_2_PLR1_SU0_SUM0_SUS128_VWA4_VWB2_WGM1_WGMXCC1_WGMXCCGn1
    SolutionIndex: 68
    SolutionNameMin: Cijk_Ailk_Bjlk_BBS_BH_Bias_AS_SAV_UserArgs_MT128x64x64_MI16x16x1_SN_LDSB1_CLR1_GRVWA8_GRVWB8_GSU0_GSUC0_GSUWGMRR0_K1_LBSPPA1024_LBSPPB512_LPA0_LPB32_MIWT4_2_PLR1_SU0_SUM0_SUS128_VWA4_VWB2_WGM1_WGMXCC1_WGMXCCGn1
    SolutionIndex: 69
    SolutionNameMin: Cijk_Ailk_Bjlk_BBS_BH_Bias_AS_SAV_UserArgs_MT128x64x64_MI16x16x1_SN_LDSB1_CLR1_GRVWA8_GRVWB4_GSU0_GSUC0_GSUWGMRR0_K1_LBSPPA1024_LBSPPB512_LPA0_LPB32_MIWT4_2_PLR1_SU0_SUM0_SUS128_VWA4_VWB2_WGM4_WGMXCC1_WGMXCCGn1
    SolutionIndex: 70
    SolutionNameMin: Cijk_Ailk_Bjlk_BBS_BH_Bias_AS_SAV_UserArgs_MT128x64x64_MI16x16x1_SN_LDSB1_CLR1_GRVWA2_GRVWB8_GSU0_GSUC0_GSUWGMRR0_K1_LBSPPA1024_LBSPPB512_LPA0_LPB32_MIWT4_2_PLR1_SU0_SUM0_SUS128_VWA4_VWB2_WGM4_WGMXCC1_WGMXCCGn1
    SolutionIndex: 71
    SolutionNameMin: Cijk_Ailk_Bjlk_BBS_BH_Bias_AS_SAV_UserArgs_MT128x64x64_MI16x16x1_SN_LDSB1_CLR1_GRVWA8_GRVWB8_GSU0_GSUC0_GSUWGMRR0_K1_LBSPPA1024_LBSPPB512_LPA0_LPB32_MIWT4_2_PLR1_SU0_SUM0_SUS128_VWA4_VWB2_WGM4_WGMXCC1_WGMXCCGn1
    SolutionIndex: 72
    SolutionNameMin: Cijk_Ailk_Bjlk_BBS_BH_Bias_AS_SAV_UserArgs_MT128x64x64_MI16x16x1_SN_LDSB1_CLR1_GRVWA2_GRVWB8_GSU0_GSUC0_GSUWGMRR0_K1_LBSPPA1024_LBSPPB512_LPA0_LPB32_MIWT4_2_PLR1_SU0_SUM0_SUS128_VWA4_VWB2_WGM6_WGMXCC1_WGMXCCGn1
    SolutionIndex: 73
    SolutionNameMin: Cijk_Ailk_Bjlk_BBS_BH_Bias_AS_SAV_UserArgs_MT128x64x64_MI16x16x1_SN_LDSB1_CLR1_GRVWA8_GRVWB8_GSU0_GSUC0_GSUWGMRR0_K1_LBSPPA1024_LBSPPB512_LPA0_LPB32_MIWT4_2_PLR1_SU0_SUM0_SUS128_VWA4_VWB2_WGM6_WGMXCC1_WGMXCCGn1
    SolutionIndex: 74
    SolutionNameMin: Cijk_Ailk_Bjlk_BBS_BH_Bias_AS_SAV_UserArgs_MT128x64x64_MI16x16x1_SN_LDSB1_CLR1_GRVWA2_GRVWB8_GSU0_GSUC0_GSUWGMRR0_K1_LBSPPA1024_LBSPPB512_LPA0_LPB32_MIWT4_2_PLR1_SU0_SUM0_SUS128_VWA4_VWB2_WGM8_WGMXCC1_WGMXCCGn1
    SolutionIndex: 75
    SolutionNameMin: Cijk_Ailk_Bjlk_BBS_BH_Bias_AS_SAV_UserArgs_MT128x64x64_MI16x16x1_SN_LDSB1_CLR1_GRVWA8_GRVWB8_GSU0_GSUC0_GSUWGMRR0_K1_LBSPPA1024_LBSPPB512_LPA0_LPB32_MIWT4_2_PLR1_SU0_SUM0_SUS128_VWA4_VWB2_WGM8_WGMXCC1_WGMXCCGn1
    SolutionIndex: 76
    SolutionNameMin: Cijk_Ailk_Bjlk_BBS_BH_Bias_AS_SAV_UserArgs_MT64x64x64_MI16x16x1_SN_LDSB1_CLR1_GRVWA8_GRVWB4_GSU0_GSUC0_GSUWGMRR0_K1_LBSPPA512_LBSPPB512_LPA32_LPB32_MIWT2_2_PLR1_SU0_SUM0_SUS128_VWA2_VWB2_WGM1_WGMXCC1_WGMXCCGn1
    SolutionIndex: 77
    SolutionNameMin: Cijk_Ailk_Bjlk_BBS_BH_Bias_AS_SAV_UserArgs_MT64x64x64_MI16x16x1_SN_LDSB1_CLR1_GRVWA2_GRVWB8_GSU0_GSUC0_GSUWGMRR0_K1_LBSPPA512_LBSPPB512_LPA32_LPB32_MIWT2_2_PLR1_SU0_SUM0_SUS128_VWA2_VWB2_WGM1_WGMXCC1_WGMXCCGn1
    SolutionIndex: 78
    SolutionNameMin: Cijk_Ailk_Bjlk_BBS_BH_Bias_AS_SAV_UserArgs_MT64x64x64_MI16x16x1_SN_LDSB1_CLR1_GRVWA4_GRVWB8_GSU0_GSUC0_GSUWGMRR0_K1_LBSPPA512_LBSPPB512_LPA32_LPB32_MIWT2_2_PLR1_SU0_SUM0_SUS128_VWA2_VWB2_WGM1_WGMXCC1_WGMXCCGn1
    SolutionIndex: 79
    SolutionNameMin: Cijk_Ailk_Bjlk_BBS_BH_Bias_AS_SAV_UserArgs_MT64x64x64_MI16x16x1_SN_LDSB1_CLR1_GRVWA8_GRVWB8_GSU0_GSUC0_GSUWGMRR0_K1_LBSPPA512_LBSPPB512_LPA32_LPB32_MIWT2_2_PLR1_SU0_SUM0_SUS128_VWA2_VWB2_WGM1_WGMXCC1_WGMXCCGn1
    SolutionIndex: 80
    SolutionNameMin: Cijk_Ailk_Bjlk_BBS_BH_Bias_AS_SAV_UserArgs_MT64x64x64_MI16x16x1_SN_LDSB1_CLR1_GRVWA2_GRVWB8_GSU0_GSUC0_GSUWGMRR0_K1_LBSPPA512_LBSPPB512_LPA32_LPB32_MIWT2_2_PLR1_SU0_SUM0_SUS128_VWA2_VWB2_WGM4_WGMXCC1_WGMXCCGn1
    SolutionIndex: 81
    SolutionNameMin: Cijk_Ailk_Bjlk_BBS_BH_Bias_AS_SAV_UserArgs_MT64x64x64_MI16x16x1_SN_LDSB1_CLR1_GRVWA8_GRVWB8_GSU0_GSUC0_GSUWGMRR0_K1_LBSPPA512_LBSPPB512_LPA32_LPB32_MIWT2_2_PLR1_SU0_SUM0_SUS128_VWA2_VWB2_WGM4_WGMXCC1_WGMXCCGn1
    SolutionIndex: 82
    SolutionNameMin: Cijk_Ailk_Bjlk_BBS_BH_Bias_AS_SAV_UserArgs_MT64x64x64_MI16x16x1_SN_LDSB1_CLR1_GRVWA2_GRVWB8_GSU0_GSUC0_GSUWGMRR0_K1_LBSPPA512_LBSPPB512_LPA32_LPB32_MIWT2_2_PLR1_SU0_SUM0_SUS128_VWA2_VWB2_WGM6_WGMXCC1_WGMXCCGn1
    SolutionIndex: 83
    SolutionNameMin: Cijk_Ailk_Bjlk_BBS_BH_Bias_AS_SAV_UserArgs_MT64x64x64_MI16x16x1_SN_LDSB1_CLR1_GRVWA2_GRVWB8_GSU0_GSUC0_GSUWGMRR0_K1_LBSPPA512_LBSPPB512_LPA32_LPB32_MIWT2_2_PLR1_SU0_SUM0_SUS128_VWA2_VWB2_WGM8_WGMXCC1_WGMXCCGn1
    SolutionIndex: 84
    SolutionNameMin: Cijk_Ailk_Bjlk_BBS_BH_Bias_AS_SAV_UserArgs_MT64x64x64_MI16x16x1_SN_LDSB1_CLR1_GRVWA4_GRVWB8_GSU0_GSUC0_GSUWGMRR0_K1_LBSPPA512_LBSPPB512_LPA32_LPB32_MIWT2_2_PLR1_SU0_SUM0_SUS128_VWA2_VWB2_WGM8_WGMXCC1_WGMXCCGn1
    SolutionIndex: 85
    SolutionNameMin: Cijk_Ailk_Bjlk_BBS_BH_Bias_AS_SAV_UserArgs_MT64x64x64_MI16x16x1_SN_LDSB1_CLR1_GRVWA8_GRVWB8_GSU0_GSUC0_GSUWGMRR0_K1_LBSPPA512_LBSPPB512_LPA32_LPB32_MIWT2_2_PLR1_SU0_SUM0_SUS128_VWA2_VWB2_WGM8_WGMXCC1_WGMXCCGn1
    SolutionIndex: 86
    SolutionNameMin: Cijk_Ailk_Bjlk_BBS_BH_Bias_AS_SAV_UserArgs_MT32x64x64_MI16x16x1_SN_LDSB0_CLR1_GRVWA2_GRVWB2_GSU0_GSUC0_GSUWGMRR0_K1_LBSPPA256_LBSPPB512_LPA16_LPB32_MIWT1_2_PLR1_SU0_SUM0_SUS128_VWA1_VWB2_WGM1_WGMXCC1_WGMXCCGn1
    SolutionIndex: 87
    SolutionNameMin: Cijk_Ailk_Bjlk_BBS_BH_Bias_AS_SAV_UserArgs_MT32x64x64_MI16x16x1_SN_LDSB0_CLR1_GRVWA2_GRVWB4_GSU0_GSUC0_GSUWGMRR0_K1_LBSPPA256_LBSPPB512_LPA16_LPB32_MIWT1_2_PLR1_SU0_SUM0_SUS128_VWA1_VWB2_WGM1_WGMXCC1_WGMXCCGn1
    SolutionIndex: 88
    SolutionNameMin: Cijk_Ailk_Bjlk_BBS_BH_Bias_AS_SAV_UserArgs_MT32x64x64_MI16x16x1_SN_LDSB0_CLR1_GRVWA2_GRVWB8_GSU0_GSUC0_GSUWGMRR0_K1_LBSPPA256_LBSPPB512_LPA16_LPB32_MIWT1_2_PLR1_SU0_SUM0_SUS128_VWA1_VWB2_WGM1_WGMXCC1_WGMXCCGn1
    SolutionIndex: 89
    SolutionNameMin: Cijk_Ailk_Bjlk_BBS_BH_Bias_AS_SAV_UserArgs_MT64x32x64_MI16x16x1_SN_LDSB0_CLR1_GRVWA2_GRVWB2_GSU0_GSUC0_GSUWGMRR0_K1_LBSPPA512_LBSPPB256_LPA32_LPB16_MIWT2_1_PLR1_SU0_SUM0_SUS128_VWA2_VWB1_WGM1_WGMXCC1_WGMXCCGn1
    SolutionIndex: 90
    SolutionNameMin: Cijk_Ailk_Bjlk_BBS_BH_Bias_AS_SAV_UserArgs_MT64x32x64_MI16x16x1_SN_LDSB0_CLR1_GRVWA8_GRVWB2_GSU0_GSUC0_GSUWGMRR0_K1_LBSPPA512_LBSPPB256_LPA32_LPB16_MIWT2_1_PLR1_SU0_SUM0_SUS128_VWA2_VWB1_WGM1_WGMXCC1_WGMXCCGn1
    SolutionIndex: 91
    SolutionNameMin: Cijk_Ailk_Bjlk_BBS_BH_Bias_AS_SAV_UserArgs_MT64x32x64_MI16x16x1_SN_LDSB0_CLR1_GRVWA2_GRVWB4_GSU0_GSUC0_GSUWGMRR0_K1_LBSPPA512_LBSPPB256_LPA32_LPB16_MIWT2_1_PLR1_SU0_SUM0_SUS128_VWA2_VWB1_WGM1_WGMXCC1_WGMXCCGn1
    SolutionIndex: 92
    SolutionNameMin: Cijk_Ailk_Bjlk_BBS_BH_Bias_AS_SAV_UserArgs_MT64x32x64_MI16x16x1_SN_LDSB0_CLR1_GRVWA2_GRVWB8_GSU0_GSUC0_GSUWGMRR0_K1_LBSPPA512_LBSPPB256_LPA32_LPB16_MIWT2_1_PLR1_SU0_SUM0_SUS128_VWA2_VWB1_WGM4_WGMXCC1_WGMXCCGn1
    SolutionIndex: 93
    SolutionNameMin: Cijk_Ailk_Bjlk_BBS_BH_Bias_AS_SAV_UserArgs_MT64x32x64_MI16x16x1_SN_LDSB0_CLR1_GRVWA2_GRVWB8_GSU0_GSUC0_GSUWGMRR0_K1_LBSPPA512_LBSPPB256_LPA32_LPB16_MIWT2_1_PLR1_SU0_SUM0_SUS128_VWA2_VWB1_WGM6_WGMXCC1_WGMXCCGn1
    SolutionIndex: 94
    SolutionNameMin: Cijk_Ailk_Bjlk_BBS_BH_Bias_AS_SAV_UserArgs_MT64x32x64_MI16x16x1_SN_LDSB0_CLR1_GRVWA2_GRVWB8_GSU0_GSUC0_GSUWGMRR0_K1_LBSPPA512_LBSPPB256_LPA32_LPB16_MIWT2_1_PLR1_SU0_SUM0_SUS128_VWA2_VWB1_WGM8_WGMXCC1_WGMXCCGn1
    SolutionIndex: 95
    SolutionNameMin: Cijk_Ailk_Bjlk_BBS_BH_Bias_AS_SAV_UserArgs_MT32x32x64_MI16x16x1_SN_LDSB0_CLR1_GRVWA2_GRVWB2_GSU0_GSUC0_GSUWGMRR0_K1_LBSPPA256_LBSPPB256_LPA16_LPB16_MIWT1_1_PLR1_SU0_SUM0_SUS128_VWA1_VWB1_WGM1_WGMXCC1_WGMXCCGn1
    SolutionIndex: 96
    SolutionNameMin: Cijk_Ailk_Bjlk_BBS_BH_Bias_AS_SAV_UserArgs_MT32x32x64_MI16x16x1_SN_LDSB0_CLR1_GRVWA8_GRVWB2_GSU0_GSUC0_GSUWGMRR0_K1_LBSPPA256_LBSPPB256_LPA16_LPB16_MIWT1_1_PLR1_SU0_SUM0_SUS128_VWA1_VWB1_WGM1_WGMXCC1_WGMXCCGn1
    SolutionIndex: 97
    SolutionNameMin: Cijk_Ailk_Bjlk_BBS_BH_Bias_AS_SAV_UserArgs_MT32x32x64_MI16x16x1_SN_LDSB0_CLR1_GRVWA2_GRVWB4_GSU0_GSUC0_GSUWGMRR0_K1_LBSPPA256_LBSPPB256_LPA16_LPB16_MIWT1_1_PLR1_SU0_SUM0_SUS128_VWA1_VWB1_WGM1_WGMXCC1_WGMXCCGn1
    SolutionIndex: 98
    SolutionNameMin: Cijk_Ailk_Bjlk_BBS_BH_Bias_AS_SAV_UserArgs_MT32x32x64_MI16x16x1_SN_LDSB0_CLR1_GRVWA4_GRVWB4_GSU0_GSUC0_GSUWGMRR0_K1_LBSPPA256_LBSPPB256_LPA16_LPB16_MIWT1_1_PLR1_SU0_SUM0_SUS128_VWA1_VWB1_WGM1_WGMXCC1_WGMXCCGn1
    SolutionIndex: 99
    SolutionNameMin: Cijk_Ailk_Bjlk_BBS_BH_Bias_AS_SAV_UserArgs_MT32x32x64_MI16x16x1_SN_LDSB0_CLR1_GRVWA2_GRVWB8_GSU0_GSUC0_GSUWGMRR0_K1_LBSPPA256_LBSPPB256_LPA16_LPB16_MIWT1_1_PLR1_SU0_SUM0_SUS128_VWA1_VWB1_WGM1_WGMXCC1_WGMXCCGn1
    SolutionIndex: 100
    SolutionNameMin: Cijk_Ailk_Bjlk_BBS_BH_Bias_AS_SAV_UserArgs_MT128x64x128_MI16x16x1_SN_LDSB1_CLR1_GRVWA8_GRVWB8_GSU0_GSUC0_GSUWGMRR0_K1_LBSPPA1024_LBSPPB512_LPA0_LPB32_MIWT4_2_PLR1_SU0_SUM0_SUS256_VWA4_VWB2_WGM1_WGMXCC1_WGMXCCGn1
    SolutionIndex: 101
    SolutionNameMin: Cijk_Ailk_Bjlk_BBS_BH_Bias_AS_SAV_UserArgs_MT128x64x128_MI16x16x1_SN_LDSB1_CLR1_GRVWA8_GRVWB8_GSU0_GSUC0_GSUWGMRR0_K1_LBSPPA1024_LBSPPB512_LPA0_LPB32_MIWT4_2_PLR1_SU0_SUM0_SUS256_VWA4_VWB2_WGM6_WGMXCC1_WGMXCCGn1
    SolutionIndex: 102
    SolutionNameMin: Cijk_Ailk_Bjlk_BBS_BH_Bias_AS_SAV_UserArgs_MT64x64x128_MI16x16x1_SN_LDSB1_CLR1_GRVWA2_GRVWB8_GSU0_GSUC0_GSUWGMRR0_K1_LBSPPA512_LBSPPB512_LPA32_LPB32_MIWT2_2_PLR1_SU0_SUM0_SUS256_VWA2_VWB2_WGM1_WGMXCC1_WGMXCCGn1
    SolutionIndex: 103
    SolutionNameMin: Cijk_Ailk_Bjlk_BBS_BH_Bias_AS_SAV_UserArgs_MT64x64x128_MI16x16x1_SN_LDSB1_CLR1_GRVWA8_GRVWB8_GSU0_GSUC0_GSUWGMRR0_K1_LBSPPA512_LBSPPB512_LPA32_LPB32_MIWT2_2_PLR1_SU0_SUM0_SUS256_VWA2_VWB2_WGM1_WGMXCC1_WGMXCCGn1
    SolutionIndex: 104
    SolutionNameMin: Cijk_Ailk_Bjlk_BBS_BH_Bias_AS_SAV_UserArgs_MT32x64x128_MI16x16x1_SN_LDSB1_CLR1_GRVWA8_GRVWB2_GSU0_GSUC0_GSUWGMRR0_K1_LBSPPA256_LBSPPB512_LPA16_LPB32_MIWT1_2_PLR1_SU0_SUM0_SUS256_VWA1_VWB2_WGM1_WGMXCC1_WGMXCCGn1
    SolutionIndex: 105
    SolutionNameMin: Cijk_Ailk_Bjlk_BBS_BH_Bias_AS_SAV_UserArgs_MT32x64x128_MI16x16x1_SN_LDSB1_CLR1_GRVWA8_GRVWB8_GSU0_GSUC0_GSUWGMRR0_K1_LBSPPA256_LBSPPB512_LPA16_LPB32_MIWT1_2_PLR1_SU0_SUM0_SUS256_VWA1_VWB2_WGM1_WGMXCC1_WGMXCCGn1
    SolutionIndex: 106
    SolutionNameMin: Cijk_Ailk_Bjlk_BBS_BH_Bias_AS_SAV_UserArgs_MT64x32x128_MI16x16x1_SN_LDSB1_CLR1_GRVWA8_GRVWB8_GSU0_GSUC0_GSUWGMRR0_K1_LBSPPA512_LBSPPB256_LPA32_LPB16_MIWT2_1_PLR1_SU0_SUM0_SUS256_VWA2_VWB1_WGM1_WGMXCC1_WGMXCCGn1
    SolutionIndex: 107
    SolutionNameMin: Cijk_Ailk_Bjlk_BBS_BH_Bias_AS_SAV_UserArgs_MT64x32x128_MI16x16x1_SN_LDSB1_CLR1_GRVWA8_GRVWB8_GSU0_GSUC0_GSUWGMRR0_K1_LBSPPA512_LBSPPB256_LPA32_LPB16_MIWT2_1_PLR1_SU0_SUM0_SUS256_VWA2_VWB1_WGM4_WGMXCC1_WGMXCCGn1
    SolutionIndex: 108
    SolutionNameMin: Cijk_Ailk_Bjlk_BBS_BH_Bias_AS_SAV_UserArgs_MT64x32x128_MI16x16x1_SN_LDSB1_CLR1_GRVWA8_GRVWB8_GSU0_GSUC0_GSUWGMRR0_K1_LBSPPA512_LBSPPB256_LPA32_LPB16_MIWT2_1_PLR1_SU0_SUM0_SUS256_VWA2_VWB1_WGM6_WGMXCC1_WGMXCCGn1
    SolutionIndex: 109
    SolutionNameMin: Cijk_Ailk_Bjlk_BBS_BH_Bias_AS_SAV_UserArgs_MT64x32x128_MI16x16x1_SN_LDSB1_CLR1_GRVWA8_GRVWB8_GSU0_GSUC0_GSUWGMRR0_K1_LBSPPA512_LBSPPB256_LPA32_LPB16_MIWT2_1_PLR1_SU0_SUM0_SUS256_VWA2_VWB1_WGM8_WGMXCC1_WGMXCCGn1
    SolutionIndex: 110
    SolutionNameMin: Cijk_Ailk_Bjlk_BBS_BH_Bias_AS_SAV_UserArgs_MT32x32x128_MI16x16x1_SN_LDSB1_CLR1_GRVWA2_GRVWB2_GSU0_GSUC0_GSUWGMRR0_K1_LBSPPA256_LBSPPB256_LPA16_LPB16_MIWT1_1_PLR1_SU0_SUM0_SUS256_VWA1_VWB1_WGM1_WGMXCC1_WGMXCCGn1
    SolutionIndex: 111
    SolutionNameMin: Cijk_Ailk_Bjlk_BBS_BH_Bias_AS_SAV_UserArgs_MT32x32x128_MI16x16x1_SN_LDSB1_CLR1_GRVWA8_GRVWB2_GSU0_GSUC0_GSUWGMRR0_K1_LBSPPA256_LBSPPB256_LPA16_LPB16_MIWT1_1_PLR1_SU0_SUM0_SUS256_VWA1_VWB1_WGM1_WGMXCC1_WGMXCCGn1
    SolutionIndex: 112
    SolutionNameMin: Cijk_Ailk_Bjlk_BBS_BH_Bias_AS_SAV_UserArgs_MT32x32x128_MI16x16x1_SN_LDSB1_CLR1_GRVWA8_GRVWB4_GSU0_GSUC0_GSUWGMRR0_K1_LBSPPA256_LBSPPB256_LPA16_LPB16_MIWT1_1_PLR1_SU0_SUM0_SUS256_VWA1_VWB1_WGM1_WGMXCC1_WGMXCCGn1
    SolutionIndex: 113
    SolutionNameMin: Cijk_Ailk_Bjlk_BBS_BH_Bias_AS_SAV_UserArgs_MT32x32x128_MI16x16x1_SN_LDSB1_CLR1_GRVWA2_GRVWB8_GSU0_GSUC0_GSUWGMRR0_K1_LBSPPA256_LBSPPB256_LPA16_LPB16_MIWT1_1_PLR1_SU0_SUM0_SUS256_VWA1_VWB1_WGM1_WGMXCC1_WGMXCCGn1
    SolutionIndex: 114
    SolutionNameMin: Cijk_Ailk_Bjlk_BBS_BH_Bias_AS_SAV_UserArgs_MT32x32x128_MI16x16x1_SN_LDSB1_CLR1_GRVWA8_GRVWB8_GSU0_GSUC0_GSUWGMRR0_K1_LBSPPA256_LBSPPB256_LPA16_LPB16_MIWT1_1_PLR1_SU0_SUM0_SUS256_VWA1_VWB1_WGM1_WGMXCC1_WGMXCCGn1
    SolutionIndex: 115
    SolutionNameMin: Cijk_Ailk_Bjlk_BBS_BH_Bias_AS_SAV_UserArgs_MT32x32x128_MI16x16x1_SN_LDSB1_CLR1_GRVWA2_GRVWB8_GSU0_GSUC0_GSUWGMRR0_K1_LBSPPA256_LBSPPB256_LPA16_LPB16_MIWT1_1_PLR1_SU0_SUM0_SUS256_VWA1_VWB1_WGM4_WGMXCC1_WGMXCCGn1
    SolutionIndex: 116
    SolutionNameMin: Cijk_Ailk_Bjlk_BBS_BH_Bias_AS_SAV_UserArgs_MT32x32x128_MI16x16x1_SN_LDSB1_CLR1_GRVWA4_GRVWB8_GSU0_GSUC0_GSUWGMRR0_K1_LBSPPA256_LBSPPB256_LPA16_LPB16_MIWT1_1_PLR1_SU0_SUM0_SUS256_VWA1_VWB1_WGM4_WGMXCC1_WGMXCCGn1
    SolutionIndex: 117
    SolutionNameMin: Cijk_Ailk_Bjlk_BBS_BH_Bias_AS_SAV_UserArgs_MT32x32x128_MI16x16x1_SN_LDSB1_CLR1_GRVWA8_GRVWB8_GSU0_GSUC0_GSUWGMRR0_K1_LBSPPA256_LBSPPB256_LPA16_LPB16_MIWT1_1_PLR1_SU0_SUM0_SUS256_VWA1_VWB1_WGM4_WGMXCC1_WGMXCCGn1
    SolutionIndex: 118
    SolutionNameMin: Cijk_Ailk_Bjlk_BBS_BH_Bias_AS_SAV_UserArgs_MT32x32x128_MI16x16x1_SN_LDSB1_CLR1_GRVWA2_GRVWB8_GSU0_GSUC0_GSUWGMRR0_K1_LBSPPA256_LBSPPB256_LPA16_LPB16_MIWT1_1_PLR1_SU0_SUM0_SUS256_VWA1_VWB1_WGM6_WGMXCC1_WGMXCCGn1
    SolutionIndex: 119
    SolutionNameMin: Cijk_Ailk_Bjlk_BBS_BH_Bias_AS_SAV_UserArgs_MT32x32x128_MI16x16x1_SN_LDSB1_CLR1_GRVWA4_GRVWB8_GSU0_GSUC0_GSUWGMRR0_K1_LBSPPA256_LBSPPB256_LPA16_LPB16_MIWT1_1_PLR1_SU0_SUM0_SUS256_VWA1_VWB1_WGM6_WGMXCC1_WGMXCCGn1
    SolutionIndex: 120
    SolutionNameMin: Cijk_Ailk_Bjlk_BBS_BH_Bias_AS_SAV_UserArgs_MT32x32x128_MI16x16x1_SN_LDSB1_CLR1_GRVWA8_GRVWB8_GSU0_GSUC0_GSUWGMRR0_K1_LBSPPA256_LBSPPB256_LPA16_LPB16_MIWT1_1_PLR1_SU0_SUM0_SUS256_VWA1_VWB1_WGM6_WGMXCC1_WGMXCCGn1
    SolutionIndex: 121
    SolutionNameMin: Cijk_Ailk_Bjlk_BBS_BH_Bias_AS_SAV_UserArgs_MT32x32x128_MI16x16x1_SN_LDSB1_CLR1_GRVWA8_GRVWB8_GSU0_GSUC0_GSUWGMRR0_K1_LBSPPA256_LBSPPB256_LPA16_LPB16_MIWT1_1_PLR1_SU0_SUM0_SUS256_VWA1_VWB1_WGM8_WGMXCC1_WGMXCCGn1
- - - [128, 128, 1, 128, 128, 128, 128, 128]
    - [111, 0.44]
  - - [128, 128, 1, 256, 128, 128, 128, 128]
    - [111, 0.74]
  - - [128, 128, 1, 512, 128, 128, 128, 128]
    - [114, 1.19]
  - - [128, 128, 1, 1024, 128, 128, 128, 128]
    - [114, 1.77]
  - - [128, 128, 1, 2048, 128, 128, 128, 128]
    - [114, 2.35]
  - - [128, 128, 1, 4096, 128, 128, 128, 128]
    - [114, 2.89]
  - - [128, 128, 1, 8192, 128, 128, 128, 128]
    - [114, 3.16]
  - - [128, 256, 1, 128, 128, 128, 128, 256]
    - [96, 0.8]
  - - [128, 256, 1, 256, 128, 128, 128, 256]
    - [96, 1.38]
  - - [128, 256, 1, 512, 128, 128, 128, 256]
    - [114, 2.21]
  - - [128, 256, 1, 1024, 128, 128, 128, 256]
    - [114, 3.32]
  - - [128, 256, 1, 2048, 128, 128, 128, 256]
    - [114, 4.27]
  - - [128, 256, 1, 4096, 128, 128, 128, 256]
    - [114, 5.0]
  - - [128, 256, 1, 8192, 128, 128, 128, 256]
    - [57, 5.51]
  - - [128, 512, 1, 128, 128, 128, 128, 512]
    - [99, 1.69]
  - - [128, 512, 1, 256, 128, 128, 128, 512]
    - [97, 2.84]
  - - [128, 512, 1, 512, 128, 128, 128, 512]
    - [114, 4.49]
  - - [128, 512, 1, 1024, 128, 128, 128, 512]
    - [114, 6.49]
  - - [128, 512, 1, 2048, 128, 128, 128, 512]
    - [114, 8.35]
  - - [128, 512, 1, 4096, 128, 128, 128, 512]
    - [114, 9.76]
  - - [128, 512, 1, 8192, 128, 128, 128, 512]
    - [114, 10.71]
  - - [128, 1024, 1, 128, 128, 128, 128, 1024]
    - [97, 3.28]
  - - [128, 1024, 1, 256, 128, 128, 128, 1024]
    - [95, 5.35]
  - - [128, 1024, 1, 512, 128, 128, 128, 1024]
    - [111, 8.66]
  - - [128, 1024, 1, 1024, 128, 128, 128, 1024]
    - [114, 12.64]
  - - [128, 1024, 1, 2048, 128, 128, 128, 1024]
    - [120, 16.26]
  - - [128, 1024, 1, 4096, 128, 128, 128, 1024]
    - [114, 19.34]
  - - [128, 1024, 1, 8192, 128, 128, 128, 1024]
    - [121, 21.06]
  - - [128, 2048, 1, 128, 128, 128, 128, 2048]
    - [86, 6.01]
  - - [128, 2048, 1, 256, 128, 128, 128, 2048]
    - [90, 10.16]
  - - [128, 2048, 1, 512, 128, 128, 128, 2048]
    - [89, 16.03]
  - - [128, 2048, 1, 1024, 128, 128, 128, 2048]
    - [105, 23.0]
  - - [128, 2048, 1, 2048, 128, 128, 128, 2048]
    - [105, 29.6]
  - - [128, 2048, 1, 4096, 128, 128, 128, 2048]
    - [105, 35.02]
  - - [128, 2048, 1, 8192, 128, 128, 128, 2048]
    - [104, 35.85]
  - - [128, 4096, 1, 128, 128, 128, 128, 4096]
    - [79, 10.89]
  - - [128, 4096, 1, 256, 128, 128, 128, 4096]
    - [76, 18.37]
  - - [128, 4096, 1, 512, 128, 128, 128, 4096]
    - [77, 28.98]
  - - [128, 4096, 1, 1024, 128, 128, 128, 4096]
    - [103, 40.15]
  - - [128, 4096, 1, 2048, 128, 128, 128, 4096]
    - [103, 51.72]
  - - [128, 4096, 1, 4096, 128, 128, 128, 4096]
    - [103, 57.22]
  - - [128, 4096, 1, 8192, 128, 128, 128, 4096]
    - [103, 63.3]
  - - [128, 8192, 1, 128, 128, 128, 128, 8192]
    - [46, 17.54]
  - - [128, 8192, 1, 256, 128, 128, 128, 8192]
    - [68, 29.31]
  - - [128, 8192, 1, 512, 128, 128, 128, 8192]
    - [68, 45.44]
  - - [128, 8192, 1, 1024, 128, 128, 128, 8192]
    - [100, 61.25]
  - - [128, 8192, 1, 2048, 128, 128, 128, 8192]
    - [100, 72.62]
  - - [128, 8192, 1, 4096, 128, 128, 128, 8192]
    - [101, 81.92]
  - - [128, 8192, 1, 8192, 128, 128, 128, 8192]
    - [50, 85.72]
  - - [256, 128, 1, 128, 256, 256, 256, 128]
    - [110, 0.82]
  - - [256, 128, 1, 256, 256, 256, 256, 128]
    - [95, 1.42]
  - - [256, 128, 1, 512, 256, 256, 256, 128]
    - [112, 2.24]
  - - [256, 128, 1, 1024, 256, 256, 256, 128]
    - [113, 3.2]
  - - [256, 128, 1, 2048, 256, 256, 256, 128]
    - [114, 4.11]
  - - [256, 128, 1, 4096, 256, 256, 256, 128]
    - [113, 4.81]
  - - [256, 128, 1, 8192, 256, 256, 256, 128]
    - [58, 5.44]
  - - [256, 256, 1, 128, 256, 256, 256, 256]
    - [96, 1.63]
  - - [256, 256, 1, 256, 256, 256, 256, 256]
    - [95, 2.78]
  - - [256, 256, 1, 512, 256, 256, 256, 256]
    - [112, 4.39]
  - - [256, 256, 1, 1024, 256, 256, 256, 256]
    - [114, 6.22]
  - - [256, 256, 1, 2048, 256, 256, 256, 256]
    - [114, 7.98]
  - - [256, 256, 1, 4096, 256, 256, 256, 256]
    - [114, 9.13]
  - - [256, 256, 1, 8192, 256, 256, 256, 256]
    - [57, 10.58]
  - - [256, 512, 1, 128, 256, 256, 256, 512]
    - [97, 3.22]
  - - [256, 512, 1, 256, 256, 256, 256, 512]
    - [95, 5.45]
  - - [256, 512, 1, 512, 256, 256, 256, 512]
    - [112, 8.58]
  - - [256, 512, 1, 1024, 256, 256, 256, 512]
    - [112, 12.07]
  - - [256, 512, 1, 2048, 256, 256, 256, 512]
    - [120, 15.31]
  - - [256, 512, 1, 4096, 256, 256, 256, 512]
    - [120, 17.65]
  - - [256, 512, 1, 8192, 256, 256, 256, 512]
    - [55, 19.9]
  - - [256, 1024, 1, 128, 256, 256, 256, 1024]
    - [86, 6.03]
  - - [256, 1024, 1, 256, 256, 256, 256, 1024]
    - [90, 10.09]
  - - [256, 1024, 1, 512, 256, 256, 256, 1024]
    - [106, 15.65]
  - - [256, 1024, 1, 1024, 256, 256, 256, 1024]
    - [106, 22.07]
  - - [256, 1024, 1, 2048, 256, 256, 256, 1024]
    - [107, 27.77]
  - - [256, 1024, 1, 4096, 256, 256, 256, 1024]
    - [107, 31.81]
  - - [256, 1024, 1, 8192, 256, 256, 256, 1024]
    - [56, 36.45]
  - - [256, 2048, 1, 128, 256, 256, 256, 2048]
    - [77, 10.62]
  - - [256, 2048, 1, 256, 256, 256, 256, 2048]
    - [77, 18.02]
  - - [256, 2048, 1, 512, 256, 256, 256, 2048]
    - [79, 28.12]
  - - [256, 2048, 1, 1024, 256, 256, 256, 2048]
    - [79, 39.21]
  - - [256, 2048, 1, 2048, 256, 256, 256, 2048]
    - [79, 48.1]
  - - [256, 2048, 1, 4096, 256, 256, 256, 2048]
    - [79, 53.32]
  - - [256, 2048, 1, 8192, 256, 256, 256, 2048]
    - [52, 61.51]
  - - [256, 4096, 1, 128, 256, 256, 256, 4096]
    - [68, 17.96]
  - - [256, 4096, 1, 256, 256, 256, 256, 4096]
    - [68, 30.38]
  - - [256, 4096, 1, 512, 256, 256, 256, 4096]
    - [68, 46.71]
  - - [256, 4096, 1, 1024, 256, 256, 256, 4096]
    - [68, 64.05]
  - - [256, 4096, 1, 2048, 256, 256, 256, 4096]
    - [68, 79.35]
  - - [256, 4096, 1, 4096, 256, 256, 256, 4096]
    - [68, 87.32]
  - - [256, 4096, 1, 8192, 256, 256, 256, 4096]
    - [50, 89.33]
  - - [256, 8192, 1, 128, 256, 256, 256, 8192]
    - [40, 27.83]
  - - [256, 8192, 1, 256, 256, 256, 256, 8192]
    - [63, 47.59]
  - - [256, 8192, 1, 512, 256, 256, 256, 8192]
    - [63, 73.97]
  - - [256, 8192, 1, 1024, 256, 256, 256, 8192]
    - [63, 100.07]
  - - [256, 8192, 1, 2048, 256, 256, 256, 8192]
    - [63, 113.79]
  - - [256, 8192, 1, 4096, 256, 256, 256, 8192]
    - [63, 125.8]
  - - [256, 8192, 1, 8192, 256, 256, 256, 8192]
    - [43, 116.35]
  - - [512, 128, 1, 128, 512, 512, 512, 128]
    - [95, 1.65]
  - - [512, 128, 1, 256, 512, 512, 512, 128]
    - [97, 2.8]
  - - [512, 128, 1, 512, 512, 512, 512, 128]
    - [113, 4.39]
  - - [512, 128, 1, 1024, 512, 512, 512, 128]
    - [113, 6.31]
  - - [512, 128, 1, 2048, 512, 512, 512, 128]
    - [113, 8.09]
  - - [512, 128, 1, 4096, 512, 512, 512, 128]
    - [113, 9.59]
  - - [512, 128, 1, 8192, 512, 512, 512, 128]
    - [113, 10.55]
  - - [512, 256, 1, 128, 512, 512, 512, 256]
    - [95, 3.22]
  - - [512, 256, 1, 256, 512, 512, 512, 256]
    - [99, 5.36]
  - - [512, 256, 1, 512, 512, 512, 512, 256]
    - [116, 8.58]
  - - [512, 256, 1, 1024, 512, 512, 512, 256]
    - [119, 12.24]
  - - [512, 256, 1, 2048, 512, 512, 512, 256]
    - [119, 15.37]
  - - [512, 256, 1, 4096, 512, 512, 512, 256]
    - [117, 17.82]
  - - [512, 256, 1, 8192, 512, 512, 512, 256]
    - [56, 20.05]
  - - [512, 512, 1, 128, 512, 512, 512, 512]
    - [90, 5.92]
  - - [512, 512, 1, 256, 512, 512, 512, 512]
    - [87, 9.87]
  - - [512, 512, 1, 512, 512, 512, 512, 512]
    - [88, 15.63]
  - - [512, 512, 1, 1024, 512, 512, 512, 512]
    - [106, 22.16]
  - - [512, 512, 1, 2048, 512, 512, 512, 512]
    - [108, 28.06]
  - - [512, 512, 1, 4096, 512, 512, 512, 512]
    - [108, 32.09]
  - - [512, 512, 1, 8192, 512, 512, 512, 512]
    - [51, 37.67]
  - - [512, 1024, 1, 128, 512, 512, 512, 1024]
    - [79, 10.45]
  - - [512, 1024, 1, 256, 512, 512, 512, 1024]
    - [77, 18.18]
  - - [512, 1024, 1, 512, 512, 512, 512, 1024]
    - [77, 28.22]
  - - [512, 1024, 1, 1024, 512, 512, 512, 1024]
    - [77, 39.27]
  - - [512, 1024, 1, 2048, 512, 512, 512, 1024]
    - [78, 47.99]
  - - [512, 1024, 1, 4096, 512, 512, 512, 1024]
    - [78, 53.86]
  - - [512, 1024, 1, 8192, 512, 512, 512, 1024]
    - [51, 63.13]
  - - [512, 2048, 1, 128, 512, 512, 512, 2048]
    - [68, 17.92]
  - - [512, 2048, 1, 256, 512, 512, 512, 2048]
    - [68, 30.83]
  - - [512, 2048, 1, 512, 512, 512, 512, 2048]
    - [68, 47.06]
  - - [512, 2048, 1, 1024, 512, 512, 512, 2048]
    - [68, 64.51]
  - - [512, 2048, 1, 2048, 512, 512, 512, 2048]
    - [68, 79.78]
  - - [512, 2048, 1, 4096, 512, 512, 512, 2048]
    - [68, 88.96]
  - - [512, 2048, 1, 8192, 512, 512, 512, 2048]
    - [47, 91.71]
  - - [512, 4096, 1, 128, 512, 512, 512, 4096]
    - [38, 27.89]
  - - [512, 4096, 1, 256, 512, 512, 512, 4096]
    - [63, 48.08]
  - - [512, 4096, 1, 512, 512, 512, 512, 4096]
    - [63, 74.98]
  - - [512, 4096, 1, 1024, 512, 512, 512, 4096]
    - [63, 102.26]
  - - [512, 4096, 1, 2048, 512, 512, 512, 4096]
    - [63, 122.24]
  - - [512, 4096, 1, 4096, 512, 512, 512, 4096]
    - [63, 129.11]
  - - [512, 4096, 1, 8192, 512, 512, 512, 4096]
    - [64, 119.09]
  - - [512, 8192, 1, 128, 512, 512, 512, 8192]
    - [28, 39.15]
  - - [512, 8192, 1, 256, 512, 512, 512, 8192]
    - [25, 63.96]
  - - [512, 8192, 1, 512, 512, 512, 512, 8192]
    - [18, 94.75]
  - - [512, 8192, 1, 1024, 512, 512, 512, 8192]
    - [18, 122.35]
  - - [512, 8192, 1, 2048, 512, 512, 512, 8192]
    - [18, 139.62]
  - - [512, 8192, 1, 4096, 512, 512, 512, 8192]
    - [18, 128.8]
  - - [512, 8192, 1, 8192, 512, 512, 512, 8192]
    - [19, 139.38]
  - - [1024, 128, 1, 128, 1024, 1024, 1024, 128]
    - [98, 3.23]
  - - [1024, 128, 1, 256, 1024, 1024, 1024, 128]
    - [95, 5.34]
  - - [1024, 128, 1, 512, 1024, 1024, 1024, 128]
    - [113, 8.49]
  - - [1024, 128, 1, 1024, 1024, 1024, 1024, 128]
    - [118, 12.23]
  - - [1024, 128, 1, 2048, 1024, 1024, 1024, 128]
    - [114, 15.73]
  - - [1024, 128, 1, 4096, 1024, 1024, 1024, 128]
    - [118, 18.58]
  - - [1024, 128, 1, 8192, 1024, 1024, 1024, 128]
    - [115, 20.58]
  - - [1024, 256, 1, 128, 1024, 1024, 1024, 256]
    - [91, 5.82]
  - - [1024, 256, 1, 256, 1024, 1024, 1024, 256]
    - [94, 9.9]
  - - [1024, 256, 1, 512, 1024, 1024, 1024, 256]
    - [92, 15.47]
  - - [1024, 256, 1, 1024, 1024, 1024, 1024, 256]
    - [107, 21.88]
  - - [1024, 256, 1, 2048, 1024, 1024, 1024, 256]
    - [107, 28.01]
  - - [1024, 256, 1, 4096, 1024, 1024, 1024, 256]
    - [107, 32.03]
  - - [1024, 256, 1, 8192, 1024, 1024, 1024, 256]
    - [51, 36.37]
  - - [1024, 512, 1, 128, 1024, 1024, 1024, 512]
    - [83, 10.78]
  - - [1024, 512, 1, 256, 1024, 1024, 1024, 512]
    - [84, 18.26]
  - - [1024, 512, 1, 512, 1024, 1024, 1024, 512]
    - [82, 28.78]
  - - [1024, 512, 1, 1024, 1024, 1024, 1024, 512]
    - [82, 39.8]
  - - [1024, 512, 1, 2048, 1024, 1024, 1024, 512]
    - [82, 48.3]
  - - [1024, 512, 1, 4096, 1024, 1024, 1024, 512]
    - [83, 54.29]
  - - [1024, 512, 1, 8192, 1024, 1024, 1024, 512]
    - [54, 62.59]
  - - [1024, 1024, 1, 128, 1024, 1024, 1024, 1024]
    - [67, 17.47]
  - - [1024, 1024, 1, 256, 1024, 1024, 1024, 1024]
    - [68, 29.92]
  - - [1024, 1024, 1, 512, 1024, 1024, 1024, 1024]
    - [68, 46.73]
  - - [1024, 1024, 1, 1024, 1024, 1024, 1024, 1024]
    - [68, 63.34]
  - - [1024, 1024, 1, 2048, 1024, 1024, 1024, 1024]
    - [73, 77.69]
  - - [1024, 1024, 1, 4096, 1024, 1024, 1024, 1024]
    - [68, 87.22]
  - - [1024, 1024, 1, 8192, 1024, 1024, 1024, 1024]
    - [43, 86.45]
  - - [1024, 2048, 1, 128, 1024, 1024, 1024, 2048]
    - [63, 27.93]
  - - [1024, 2048, 1, 256, 1024, 1024, 1024, 2048]
    - [63, 47.69]
  - - [1024, 2048, 1, 512, 1024, 1024, 1024, 2048]
    - [63, 74.73]
  - - [1024, 2048, 1, 1024, 1024, 1024, 1024, 2048]
    - [65, 102.22]
  - - [1024, 2048, 1, 2048, 1024, 1024, 1024, 2048]
    - [63, 123.43]
  - - [1024, 2048, 1, 4096, 1024, 1024, 1024, 2048]
    - [64, 131.66]
  - - [1024, 2048, 1, 8192, 1024, 1024, 1024, 2048]
    - [64, 118.04]
  - - [1024, 4096, 1, 128, 1024, 1024, 1024, 4096]
    - [28, 39.43]
  - - [1024, 4096, 1, 256, 1024, 1024, 1024, 4096]
    - [28, 65.09]
  - - [1024, 4096, 1, 512, 1024, 1024, 1024, 4096]
    - [29, 94.97]
  - - [1024, 4096, 1, 1024, 1024, 1024, 1024, 4096]
    - [28, 122.99]
  - - [1024, 4096, 1, 2048, 1024, 1024, 1024, 4096]
    - [22, 139.08]
  - - [1024, 4096, 1, 4096, 1024, 1024, 1024, 4096]
    - [21, 130.17]
  - - [1024, 4096, 1, 8192, 1024, 1024, 1024, 4096]
    - [23, 140.77]
  - - [1024, 8192, 1, 128, 1024, 1024, 1024, 8192]
    - [13, 48.2]
  - - [1024, 8192, 1, 256, 1024, 1024, 1024, 8192]
    - [12, 77.69]
  - - [1024, 8192, 1, 512, 1024, 1024, 1024, 8192]
    - [9, 112.54]
  - - [1024, 8192, 1, 1024, 1024, 1024, 1024, 8192]
    - [6, 142.53]
  - - [1024, 8192, 1, 2048, 1024, 1024, 1024, 8192]
    - [6, 145.86]
  - - [1024, 8192, 1, 4096, 1024, 1024, 1024, 8192]
    - [6, 154.89]
  - - [1024, 8192, 1, 8192, 1024, 1024, 1024, 8192]
    - [12, 164.25]
  - - [2048, 128, 1, 128, 2048, 2048, 2048, 128]
    - [88, 5.79]
  - - [2048, 128, 1, 256, 2048, 2048, 2048, 128]
    - [93, 9.83]
  - - [2048, 128, 1, 512, 2048, 2048, 2048, 128]
    - [109, 15.49]
  - - [2048, 128, 1, 1024, 2048, 2048, 2048, 128]
    - [107, 22.44]
  - - [2048, 128, 1, 2048, 2048, 2048, 2048, 128]
    - [107, 29.31]
  - - [2048, 128, 1, 4096, 2048, 2048, 2048, 128]
    - [109, 34.55]
  - - [2048, 128, 1, 8192, 2048, 2048, 2048, 128]
    - [109, 35.07]
  - - [2048, 256, 1, 128, 2048, 2048, 2048, 256]
    - [80, 10.6]
  - - [2048, 256, 1, 256, 2048, 2048, 2048, 256]
    - [82, 18.19]
  - - [2048, 256, 1, 512, 2048, 2048, 2048, 256]
    - [82, 28.12]
  - - [2048, 256, 1, 1024, 2048, 2048, 2048, 256]
    - [83, 39.22]
  - - [2048, 256, 1, 2048, 2048, 2048, 2048, 256]
    - [82, 47.94]
  - - [2048, 256, 1, 4096, 2048, 2048, 2048, 256]
    - [83, 52.72]
  - - [2048, 256, 1, 8192, 2048, 2048, 2048, 256]
    - [53, 61.65]
  - - [2048, 512, 1, 128, 2048, 2048, 2048, 512]
    - [48, 17.53]
  - - [2048, 512, 1, 256, 2048, 2048, 2048, 512]
    - [69, 29.87]
  - - [2048, 512, 1, 512, 2048, 2048, 2048, 512]
    - [73, 46.21]
  - - [2048, 512, 1, 1024, 2048, 2048, 2048, 512]
    - [70, 62.8]
  - - [2048, 512, 1, 2048, 2048, 2048, 2048, 512]
    - [70, 77.18]
  - - [2048, 512, 1, 4096, 2048, 2048, 2048, 512]
    - [74, 85.05]
  - - [2048, 512, 1, 8192, 2048, 2048, 2048, 512]
    - [45, 89.23]
  - - [2048, 1024, 1, 128, 2048, 2048, 2048, 1024]
    - [42, 27.61]
  - - [2048, 1024, 1, 256, 2048, 2048, 2048, 1024]
    - [64, 47.18]
  - - [2048, 1024, 1, 512, 2048, 2048, 2048, 1024]
    - [65, 74.39]
  - - [2048, 1024, 1, 1024, 2048, 2048, 2048, 1024]
    - [65, 101.28]
  - - [2048, 1024, 1, 2048, 2048, 2048, 2048, 1024]
    - [64, 121.67]
  - - [2048, 1024, 1, 4096, 2048, 2048, 2048, 1024]
    - [64, 134.32]
  - - [2048, 1024, 1, 8192, 2048, 2048, 2048, 1024]
    - [66, 120.05]
  - - [2048, 2048, 1, 128, 2048, 2048, 2048, 2048]
    - [26, 39.1]
  - - [2048, 2048, 1, 256, 2048, 2048, 2048, 2048]
    - [25, 64.02]
  - - [2048, 2048, 1, 512, 2048, 2048, 2048, 2048]
    - [34, 93.84]
  - - [2048, 2048, 1, 1024, 2048, 2048, 2048, 2048]
    - [21, 123.56]
  - - [2048, 2048, 1, 2048, 2048, 2048, 2048, 2048]
    - [23, 141.98]
  - - [2048, 2048, 1, 4096, 2048, 2048, 2048, 2048]
    - [23, 130.73]
  - - [2048, 2048, 1, 8192, 2048, 2048, 2048, 2048]
    - [20, 142.76]
  - - [2048, 4096, 1, 128, 2048, 2048, 2048, 4096]
    - [4, 47.71]
  - - [2048, 4096, 1, 256, 2048, 2048, 2048, 4096]
    - [6, 78.12]
  - - [2048, 4096, 1, 512, 2048, 2048, 2048, 4096]
    - [6, 112.72]
  - - [2048, 4096, 1, 1024, 2048, 2048, 2048, 4096]
    - [11, 141.93]
  - - [2048, 4096, 1, 2048, 2048, 2048, 2048, 4096]
    - [6, 143.75]
  - - [2048, 4096, 1, 4096, 2048, 2048, 2048, 4096]
    - [6, 153.7]
  - - [2048, 4096, 1, 8192, 2048, 2048, 2048, 4096]
    - [4, 166.34]
  - - [2048, 8192, 1, 128, 2048, 2048, 2048, 8192]
    - [4, 54.08]
  - - [2048, 8192, 1, 256, 2048, 2048, 2048, 8192]
    - [13, 86.16]
  - - [2048, 8192, 1, 512, 2048, 2048, 2048, 8192]
    - [7, 117.72]
  - - [2048, 8192, 1, 1024, 2048, 2048, 2048, 8192]
    - [18, 131.69]
  - - [2048, 8192, 1, 2048, 2048, 2048, 2048, 8192]
    - [62, 153.97]
  - - [2048, 8192, 1, 4096, 2048, 2048, 2048, 8192]
    - [15, 177.19]
  - - [2048, 8192, 1, 8192, 2048, 2048, 2048, 8192]
    - [61, 188.79]
  - - [4096, 128, 1, 128, 4096, 4096, 4096, 128]
    - [76, 10.61]
  - - [4096, 128, 1, 256, 4096, 4096, 4096, 128]
    - [79, 18.15]
  - - [4096, 128, 1, 512, 4096, 4096, 4096, 128]
    - [77, 28.28]
  - - [4096, 128, 1, 1024, 4096, 4096, 4096, 128]
    - [81, 39.66]
  - - [4096, 128, 1, 2048, 4096, 4096, 4096, 128]
    - [85, 47.82]
  - - [4096, 128, 1, 4096, 4096, 4096, 4096, 128]
    - [102, 51.0]
  - - [4096, 128, 1, 8192, 4096, 4096, 4096, 128]
    - [53, 56.62]
  - - [4096, 256, 1, 128, 4096, 4096, 4096, 256]
    - [49, 17.76]
  - - [4096, 256, 1, 256, 4096, 4096, 4096, 256]
    - [70, 30.03]
  - - [4096, 256, 1, 512, 4096, 4096, 4096, 256]
    - [73, 46.43]
  - - [4096, 256, 1, 1024, 4096, 4096, 4096, 256]
    - [72, 63.57]
  - - [4096, 256, 1, 2048, 4096, 4096, 4096, 256]
    - [74, 77.04]
  - - [4096, 256, 1, 4096, 4096, 4096, 4096, 256]
    - [72, 84.4]
  - - [4096, 256, 1, 8192, 4096, 4096, 4096, 256]
    - [44, 85.81]
  - - [4096, 512, 1, 128, 4096, 4096, 4096, 512]
    - [41, 27.64]
  - - [4096, 512, 1, 256, 4096, 4096, 4096, 512]
    - [65, 47.45]
  - - [4096, 512, 1, 512, 4096, 4096, 4096, 512]
    - [66, 75.05]
  - - [4096, 512, 1, 1024, 4096, 4096, 4096, 512]
    - [65, 102.14]
  - - [4096, 512, 1, 2048, 4096, 4096, 4096, 512]
    - [66, 123.26]
  - - [4096, 512, 1, 4096, 4096, 4096, 4096, 512]
    - [66, 128.67]
  - - [4096, 512, 1, 8192, 4096, 4096, 4096, 512]
    - [66, 121.16]
  - - [4096, 1024, 1, 128, 4096, 4096, 4096, 1024]
    - [36, 38.57]
  - - [4096, 1024, 1, 256, 4096, 4096, 4096, 1024]
    - [27, 63.49]
  - - [4096, 1024, 1, 512, 4096, 4096, 4096, 1024]
    - [36, 93.79]
  - - [4096, 1024, 1, 1024, 4096, 4096, 4096, 1024]
    - [24, 121.01]
  - - [4096, 1024, 1, 2048, 4096, 4096, 4096, 1024]
    - [24, 139.81]
  - - [4096, 1024, 1, 4096, 4096, 4096, 4096, 1024]
    - [23, 130.6]
  - - [4096, 1024, 1, 8192, 4096, 4096, 4096, 1024]
    - [21, 143.61]
  - - [4096, 2048, 1, 128, 4096, 4096, 4096, 2048]
    - [5, 46.21]
  - - [4096, 2048, 1, 256, 4096, 4096, 4096, 2048]
    - [6, 76.04]
  - - [4096, 2048, 1, 512, 4096, 4096, 4096, 2048]
    - [9, 110.92]
  - - [4096, 2048, 1, 1024, 4096, 4096, 4096, 2048]
    - [12, 139.65]
  - - [4096, 2048, 1, 2048, 4096, 4096, 4096, 2048]
    - [7, 142.47]
  - - [4096, 2048, 1, 4096, 4096, 4096, 4096, 2048]
    - [14, 154.18]
  - - [4096, 2048, 1, 8192, 4096, 4096, 4096, 2048]
    - [10, 165.71]
  - - [4096, 4096, 1, 128, 4096, 4096, 4096, 4096]
    - [6, 53.12]
  - - [4096, 4096, 1, 256, 4096, 4096, 4096, 4096]
    - [9, 85.14]
  - - [4096, 4096, 1, 512, 4096, 4096, 4096, 4096]
    - [13, 114.59]
  - - [4096, 4096, 1, 1024, 4096, 4096, 4096, 4096]
    - [16, 130.44]
  - - [4096, 4096, 1, 2048, 4096, 4096, 4096, 4096]
    - [18, 156.52]
  - - [4096, 4096, 1, 4096, 4096, 4096, 4096, 4096]
    - [60, 174.52]
  - - [4096, 4096, 1, 8192, 4096, 4096, 4096, 4096]
    - [12, 189.82]
  - - [4096, 8192, 1, 128, 4096, 4096, 4096, 8192]
    - [1, 55.03]
  - - [4096, 8192, 1, 256, 4096, 4096, 4096, 8192]
    - [31, 87.37]
  - - [4096, 8192, 1, 512, 4096, 4096, 4096, 8192]
    - [37, 112.27]
  - - [4096, 8192, 1, 1024, 4096, 4096, 4096, 8192]
    - [19, 145.76]
  - - [4096, 8192, 1, 2048, 4096, 4096, 4096, 8192]
    - [3, 183.85]
  - - [4096, 8192, 1, 4096, 4096, 4096, 4096, 8192]
    - [0, 206.06]
  - - [4096, 8192, 1, 8192, 4096, 4096, 4096, 8192]
    - [1, 221.84]
  - - [8192, 128, 1, 128, 8192, 8192, 8192, 128]
    - [46, 17.34]
  - - [8192, 128, 1, 256, 8192, 8192, 8192, 128]
    - [73, 28.79]
  - - [8192, 128, 1, 512, 8192, 8192, 8192, 128]
    - [75, 44.96]
  - - [8192, 128, 1, 1024, 8192, 8192, 8192, 128]
    - [73, 61.02]
  - - [8192, 128, 1, 2048, 8192, 8192, 8192, 128]
    - [70, 72.67]
  - - [8192, 128, 1, 4096, 8192, 8192, 8192, 128]
    - [71, 79.88]
  - - [8192, 128, 1, 8192, 8192, 8192, 8192, 128]
    - [44, 82.28]
  - - [8192, 256, 1, 128, 8192, 8192, 8192, 256]
    - [39, 27.3]
  - - [8192, 256, 1, 256, 8192, 8192, 8192, 256]
    - [64, 45.19]
  - - [8192, 256, 1, 512, 8192, 8192, 8192, 256]
    - [64, 72.53]
  - - [8192, 256, 1, 1024, 8192, 8192, 8192, 256]
    - [65, 98.18]
  - - [8192, 256, 1, 2048, 8192, 8192, 8192, 256]
    - [65, 114.9]
  - - [8192, 256, 1, 4096, 8192, 8192, 8192, 256]
    - [65, 124.71]
  - - [8192, 256, 1, 8192, 8192, 8192, 8192, 256]
    - [65, 112.88]
  - - [8192, 512, 1, 128, 8192, 8192, 8192, 512]
    - [35, 37.53]
  - - [8192, 512, 1, 256, 8192, 8192, 8192, 512]
    - [34, 61.95]
  - - [8192, 512, 1, 512, 8192, 8192, 8192, 512]
    - [32, 92.18]
  - - [8192, 512, 1, 1024, 8192, 8192, 8192, 512]
    - [24, 119.98]
  - - [8192, 512, 1, 2048, 8192, 8192, 8192, 512]
    - [23, 138.07]
  - - [8192, 512, 1, 4096, 8192, 8192, 8192, 512]
    - [63, 132.59]
  - - [8192, 512, 1, 8192, 8192, 8192, 8192, 512]
    - [16, 140.55]
  - - [8192, 1024, 1, 128, 8192, 8192, 8192, 1024]
    - [6, 44.68]
  - - [8192, 1024, 1, 256, 8192, 8192, 8192, 1024]
    - [6, 74.4]
  - - [8192, 1024, 1, 512, 8192, 8192, 8192, 1024]
    - [13, 109.26]
  - - [8192, 1024, 1, 1024, 8192, 8192, 8192, 1024]
    - [9, 140.72]
  - - [8192, 1024, 1, 2048, 8192, 8192, 8192, 1024]
    - [10, 144.95]
  - - [8192, 1024, 1, 4096, 8192, 8192, 8192, 1024]
    - [62, 158.59]
  - - [8192, 1024, 1, 8192, 8192, 8192, 8192, 1024]
    - [12, 163.98]
  - - [8192, 2048, 1, 128, 8192, 8192, 8192, 2048]
    - [6, 52.4]
  - - [8192, 2048, 1, 256, 8192, 8192, 8192, 2048]
    - [6, 82.82]
  - - [8192, 2048, 1, 512, 8192, 8192, 8192, 2048]
    - [9, 113.31]
  - - [8192, 2048, 1, 1024, 8192, 8192, 8192, 2048]
    - [17, 129.43]
  - - [8192, 2048, 1, 2048, 8192, 8192, 8192, 2048]
    - [15, 156.34]
  - - [8192, 2048, 1, 4096, 8192, 8192, 8192, 2048]
    - [60, 181.67]
  - - [8192, 2048, 1, 8192, 8192, 8192, 8192, 2048]
    - [59, 195.59]
  - - [8192, 4096, 1, 128, 8192, 8192, 8192, 4096]
    - [6, 54.76]
  - - [8192, 4096, 1, 256, 8192, 8192, 8192, 4096]
    - [33, 85.63]
  - - [8192, 4096, 1, 512, 8192, 8192, 8192, 4096]
    - [18, 112.96]
  - - [8192, 4096, 1, 1024, 8192, 8192, 8192, 4096]
    - [21, 145.8]
  - - [8192, 4096, 1, 2048, 8192, 8192, 8192, 4096]
    - [6, 180.55]
  - - [8192, 4096, 1, 4096, 8192, 8192, 8192, 4096]
    - [6, 204.35]
  - - [8192, 4096, 1, 8192, 8192, 8192, 8192, 4096]
    - [6, 216.59]
  - - [8192, 8192, 1, 128, 8192, 8192, 8192, 8192]
    - [30, 56.08]
  - - [8192, 8192, 1, 256, 8192, 8192, 8192, 8192]
    - [2, 88.88]
  - - [8192, 8192, 1, 512, 8192, 8192, 8192, 8192]
    - [9, 132.06]
  - - [8192, 8192, 1, 1024, 8192, 8192, 8192, 8192]
    - [8, 167.15]
  - - [8192, 8192, 1, 2048, 8192, 8192, 8192, 8192]
    - [61, 196.47]
  - - [8192, 8192, 1, 4096, 8192, 8192, 8192, 8192]
    - [5, 209.39]
  - - [8192, 8192, 1, 8192, 8192, 8192, 8192, 8192]
    - [9, 221.1]
- null
- null
- ExperimentalStreamK
- GridBased
