projects/hipblaslt/library/src/amd_detail/rocblaslt/src/Tensile/Logic/asm_full/aquavanjaram/gfx942_228cu/StreamK/aquavanjaram942_Cijk_Alik_Bljk_F8NBS_BH_Bias_HAS_SAV_UserArgs.yaml
- {MinimumRequiredVersion: 4.33.0}
- aquavanjaram942
- {Architecture: gfx942, CUCount: 228}
- [Device 0049, Device 0050]
    SolutionIndex: 0
    SolutionNameMin: Cijk_Alik_Bljk_F8NBS_BH_Bias_HAS_SAV_UserArgs_MT256x256x64_MI16x16x1_SN_LDSB1_CLR1_GRVWA16_GRVWB8_GSU0_GSUC0_GSUWGMRR0_K1_LBSPPA512_LBSPPB512_LPA16_LPB8_LRVW8_MIWT8_8_PLR1_SU0_SUM0_SUS64_VWA8_VWB8_WGM1_WGMXCC1_WGMXCCGn1
    SolutionIndex: 1
    SolutionNameMin: Cijk_Alik_Bljk_F8NBS_BH_Bias_HAS_SAV_UserArgs_MT256x256x64_MI16x16x1_SN_LDSB1_CLR1_GRVWA8_GRVWB16_GSU0_GSUC0_GSUWGMRR0_K1_LBSPPA512_LBSPPB512_LPA8_LPB16_LRVW8_MIWT8_8_PLR1_SU0_SUM0_SUS64_VWA8_VWB8_WGM1_WGMXCC1_WGMXCCGn1
    SolutionIndex: 2
    SolutionNameMin: Cijk_Alik_Bljk_F8NBS_BH_Bias_HAS_SAV_UserArgs_MT256x256x64_MI16x16x1_SN_LDSB1_CLR1_GRVWA16_GRVWB16_GSU0_GSUC0_GSUWGMRR0_K1_LBSPPA512_LBSPPB512_LPA16_LPB16_LRVW8_MIWT8_8_PLR1_SU0_SUM0_SUS64_VWA8_VWB8_WGM4_WGMXCC1_WGMXCCGn1
    SolutionIndex: 3
    SolutionNameMin: Cijk_Alik_Bljk_F8NBS_BH_Bias_HAS_SAV_UserArgs_MT256x256x64_MI16x16x1_SN_LDSB1_CLR1_GRVWA8_GRVWB16_GSU0_GSUC0_GSUWGMRR0_K1_LBSPPA512_LBSPPB512_LPA8_LPB16_LRVW8_MIWT8_8_PLR1_SU0_SUM0_SUS64_VWA8_VWB8_WGM6_WGMXCC1_WGMXCCGn1
    SolutionIndex: 4
    SolutionNameMin: Cijk_Alik_Bljk_F8NBS_BH_Bias_HAS_SAV_UserArgs_MT256x256x64_MI16x16x1_SN_LDSB1_CLR1_GRVWA16_GRVWB16_GSU0_GSUC0_GSUWGMRR0_K1_LBSPPA512_LBSPPB512_LPA16_LPB16_LRVW8_MIWT8_8_PLR1_SU0_SUM0_SUS64_VWA8_VWB8_WGM6_WGMXCC1_WGMXCCGn1
    SolutionIndex: 5
    SolutionNameMin: Cijk_Alik_Bljk_F8NBS_BH_Bias_HAS_SAV_UserArgs_MT256x256x64_MI16x16x1_SN_LDSB1_CLR1_GRVWA16_GRVWB16_GSU0_GSUC0_GSUWGMRR0_K1_LBSPPA512_LBSPPB512_LPA16_LPB16_LRVW8_MIWT8_8_PLR1_SU0_SUM0_SUS64_VWA8_VWB8_WGM8_WGMXCC1_WGMXCCGn1
    SolutionIndex: 6
    SolutionNameMin: Cijk_Alik_Bljk_F8NBS_BH_Bias_HAS_SAV_UserArgs_MT256x128x64_MI16x16x1_SN_LDSB1_CLR1_GRVWA8_GRVWB16_GSU0_GSUC0_GSUWGMRR0_K1_LBSPPA512_LBSPPB256_LPA8_LPB16_LRVW8_MIWT8_4_PLR1_SU0_SUM0_SUS64_VWA8_VWB4_WGM1_WGMXCC1_WGMXCCGn1
    SolutionIndex: 7
    SolutionNameMin: Cijk_Alik_Bljk_F8NBS_BH_Bias_HAS_SAV_UserArgs_MT256x128x64_MI16x16x1_SN_LDSB1_CLR1_GRVWA16_GRVWB16_GSU0_GSUC0_GSUWGMRR0_K1_LBSPPA512_LBSPPB256_LPA16_LPB16_LRVW8_MIWT8_4_PLR1_SU0_SUM0_SUS64_VWA8_VWB4_WGM1_WGMXCC1_WGMXCCGn1
    SolutionIndex: 8
    SolutionNameMin: Cijk_Alik_Bljk_F8NBS_BH_Bias_HAS_SAV_UserArgs_MT256x128x64_MI16x16x1_SN_LDSB1_CLR1_GRVWA8_GRVWB16_GSU0_GSUC0_GSUWGMRR0_K1_LBSPPA512_LBSPPB256_LPA8_LPB16_LRVW8_MIWT8_4_PLR1_SU0_SUM0_SUS64_VWA8_VWB4_WGM6_WGMXCC1_WGMXCCGn1
    SolutionIndex: 9
    SolutionNameMin: Cijk_Alik_Bljk_F8NBS_BH_Bias_HAS_SAV_UserArgs_MT256x128x64_MI16x16x1_SN_LDSB1_CLR1_GRVWA16_GRVWB16_GSU0_GSUC0_GSUWGMRR0_K1_LBSPPA512_LBSPPB256_LPA16_LPB16_LRVW8_MIWT8_4_PLR1_SU0_SUM0_SUS64_VWA8_VWB4_WGM6_WGMXCC1_WGMXCCGn1
    SolutionIndex: 10
    SolutionNameMin: Cijk_Alik_Bljk_F8NBS_BH_Bias_HAS_SAV_UserArgs_MT256x128x64_MI16x16x1_SN_LDSB1_CLR1_GRVWA8_GRVWB16_GSU0_GSUC0_GSUWGMRR0_K1_LBSPPA512_LBSPPB256_LPA8_LPB16_LRVW8_MIWT8_4_PLR1_SU0_SUM0_SUS64_VWA8_VWB4_WGM8_WGMXCC1_WGMXCCGn1
    SolutionIndex: 11
    SolutionNameMin: Cijk_Alik_Bljk_F8NBS_BH_Bias_HAS_SAV_UserArgs_MT128x128x64_MI16x16x1_SN_LDSB1_CLR1_GRVWA8_GRVWB16_GSU0_GSUC0_GSUWGMRR0_K1_LBSPPA512_LBSPPB128_LPA8_LPB16_LRVW8_MIWT8_2_PLR1_SU0_SUM0_SUS64_VWA8_VWB2_WGM1_WGMXCC1_WGMXCCGn1
    SolutionIndex: 12
    SolutionNameMin: Cijk_Alik_Bljk_F8NBS_BH_Bias_HAS_SAV_UserArgs_MT128x128x64_MI16x16x1_SN_LDSB1_CLR1_GRVWA8_GRVWB16_GSU0_GSUC0_GSUWGMRR0_K1_LBSPPA512_LBSPPB128_LPA8_LPB16_LRVW8_MIWT8_2_PLR1_SU0_SUM0_SUS64_VWA8_VWB2_WGM4_WGMXCC1_WGMXCCGn1
    SolutionIndex: 13
    SolutionNameMin: Cijk_Alik_Bljk_F8NBS_BH_Bias_HAS_SAV_UserArgs_MT128x128x64_MI16x16x1_SN_LDSB1_CLR1_GRVWA8_GRVWB16_GSU0_GSUC0_GSUWGMRR0_K1_LBSPPA512_LBSPPB128_LPA8_LPB16_LRVW8_MIWT8_2_PLR1_SU0_SUM0_SUS64_VWA8_VWB2_WGM6_WGMXCC1_WGMXCCGn1
    SolutionIndex: 14
    SolutionNameMin: Cijk_Alik_Bljk_F8NBS_BH_Bias_HAS_SAV_UserArgs_MT128x128x64_MI16x16x1_SN_LDSB1_CLR1_GRVWA8_GRVWB16_GSU0_GSUC0_GSUWGMRR0_K1_LBSPPA512_LBSPPB128_LPA8_LPB16_LRVW8_MIWT8_2_PLR1_SU0_SUM0_SUS64_VWA8_VWB2_WGM8_WGMXCC1_WGMXCCGn1
    SolutionIndex: 15
    SolutionNameMin: Cijk_Alik_Bljk_F8NBS_BH_Bias_HAS_SAV_UserArgs_MT128x64x64_MI16x16x1_SN_LDSB0_CLR1_GRVWA8_GRVWB16_GSU0_GSUC0_GSUWGMRR0_K1_LBSPPA512_LBSPPB128_LPA8_LPB16_LRVW8_MIWT8_1_PLR1_SU0_SUM0_SUS64_VWA8_VWB1_WGM1_WGMXCC1_WGMXCCGn1
    SolutionIndex: 16
    SolutionNameMin: Cijk_Alik_Bljk_F8NBS_BH_Bias_HAS_SAV_UserArgs_MT64x128x64_MI16x16x1_SN_LDSB0_CLR1_GRVWA8_GRVWB16_GSU0_GSUC0_GSUWGMRR0_K1_LBSPPA128_LBSPPB256_LPA8_LPB16_LRVW8_MIWT2_4_PLR1_SU0_SUM0_SUS64_VWA2_VWB4_WGM1_WGMXCC1_WGMXCCGn1
    SolutionIndex: 17
    SolutionNameMin: Cijk_Alik_Bljk_F8NBS_BH_Bias_HAS_SAV_UserArgs_MT64x128x64_MI16x16x1_SN_LDSB0_CLR1_GRVWA16_GRVWB16_GSU0_GSUC0_GSUWGMRR0_K1_LBSPPA128_LBSPPB256_LPA16_LPB16_LRVW8_MIWT2_4_PLR1_SU0_SUM0_SUS64_VWA2_VWB4_WGM1_WGMXCC1_WGMXCCGn1
    SolutionIndex: 18
    SolutionNameMin: Cijk_Alik_Bljk_F8NBS_BH_Bias_HAS_SAV_UserArgs_MT128x64x64_MI16x16x1_SN_LDSB0_CLR1_GRVWA16_GRVWB8_GSU0_GSUC0_GSUWGMRR0_K1_LBSPPA256_LBSPPB128_LPA16_LPB8_LRVW8_MIWT4_2_PLR1_SU0_SUM0_SUS64_VWA4_VWB2_WGM1_WGMXCC1_WGMXCCGn1
    SolutionIndex: 19
    SolutionNameMin: Cijk_Alik_Bljk_F8NBS_BH_Bias_HAS_SAV_UserArgs_MT128x64x64_MI16x16x1_SN_LDSB0_CLR1_GRVWA8_GRVWB16_GSU0_GSUC0_GSUWGMRR0_K1_LBSPPA256_LBSPPB128_LPA8_LPB16_LRVW8_MIWT4_2_PLR1_SU0_SUM0_SUS64_VWA4_VWB2_WGM1_WGMXCC1_WGMXCCGn1
    SolutionIndex: 20
    SolutionNameMin: Cijk_Alik_Bljk_F8NBS_BH_Bias_HAS_SAV_UserArgs_MT128x64x64_MI16x16x1_SN_LDSB0_CLR1_GRVWA16_GRVWB16_GSU0_GSUC0_GSUWGMRR0_K1_LBSPPA256_LBSPPB128_LPA16_LPB16_LRVW8_MIWT4_2_PLR1_SU0_SUM0_SUS64_VWA4_VWB2_WGM1_WGMXCC1_WGMXCCGn1
    SolutionIndex: 21
    SolutionNameMin: Cijk_Alik_Bljk_F8NBS_BH_Bias_HAS_SAV_UserArgs_MT128x64x64_MI16x16x1_SN_LDSB0_CLR1_GRVWA8_GRVWB16_GSU0_GSUC0_GSUWGMRR0_K1_LBSPPA256_LBSPPB128_LPA8_LPB16_LRVW8_MIWT4_2_PLR1_SU0_SUM0_SUS64_VWA4_VWB2_WGM4_WGMXCC1_WGMXCCGn1
    SolutionIndex: 22
    SolutionNameMin: Cijk_Alik_Bljk_F8NBS_BH_Bias_HAS_SAV_UserArgs_MT128x64x64_MI16x16x1_SN_LDSB0_CLR1_GRVWA8_GRVWB16_GSU0_GSUC0_GSUWGMRR0_K1_LBSPPA256_LBSPPB128_LPA8_LPB16_LRVW8_MIWT4_2_PLR1_SU0_SUM0_SUS64_VWA4_VWB2_WGM6_WGMXCC1_WGMXCCGn1
    SolutionIndex: 23
    SolutionNameMin: Cijk_Alik_Bljk_F8NBS_BH_Bias_HAS_SAV_UserArgs_MT128x64x64_MI16x16x1_SN_LDSB0_CLR1_GRVWA8_GRVWB16_GSU0_GSUC0_GSUWGMRR0_K1_LBSPPA256_LBSPPB128_LPA8_LPB16_LRVW8_MIWT4_2_PLR1_SU0_SUM0_SUS64_VWA4_VWB2_WGM8_WGMXCC1_WGMXCCGn1
    SolutionIndex: 24
    SolutionNameMin: Cijk_Alik_Bljk_F8NBS_BH_Bias_HAS_SAV_UserArgs_MT64x64x64_MI16x16x1_SN_LDSB0_CLR1_GRVWA16_GRVWB8_GSU0_GSUC0_GSUWGMRR0_K1_LBSPPA128_LBSPPB128_LPA16_LPB8_LRVW8_MIWT2_2_PLR1_SU0_SUM0_SUS64_VWA2_VWB2_WGM1_WGMXCC1_WGMXCCGn1
    SolutionIndex: 25
    SolutionNameMin: Cijk_Alik_Bljk_F8NBS_BH_Bias_HAS_SAV_UserArgs_MT64x64x64_MI16x16x1_SN_LDSB0_CLR1_GRVWA8_GRVWB16_GSU0_GSUC0_GSUWGMRR0_K1_LBSPPA128_LBSPPB128_LPA8_LPB16_LRVW8_MIWT2_2_PLR1_SU0_SUM0_SUS64_VWA2_VWB2_WGM1_WGMXCC1_WGMXCCGn1
    SolutionIndex: 26
    SolutionNameMin: Cijk_Alik_Bljk_F8NBS_BH_Bias_HAS_SAV_UserArgs_MT64x64x64_MI16x16x1_SN_LDSB0_CLR1_GRVWA16_GRVWB16_GSU0_GSUC0_GSUWGMRR0_K1_LBSPPA128_LBSPPB128_LPA16_LPB16_LRVW8_MIWT2_2_PLR1_SU0_SUM0_SUS64_VWA2_VWB2_WGM1_WGMXCC1_WGMXCCGn1
    SolutionIndex: 27
    SolutionNameMin: Cijk_Alik_Bljk_F8NBS_BH_Bias_HAS_SAV_UserArgs_MT64x64x64_MI16x16x1_SN_LDSB0_CLR1_GRVWA8_GRVWB8_GSU0_GSUC0_GSUWGMRR0_K1_LBSPPA128_LBSPPB128_LPA8_LPB8_LRVW8_MIWT2_2_PLR1_SU0_SUM0_SUS64_VWA2_VWB2_WGM8_WGMXCC1_WGMXCCGn1
    SolutionIndex: 28
    SolutionNameMin: Cijk_Alik_Bljk_F8NBS_BH_Bias_HAS_SAV_UserArgs_MT64x64x64_MI16x16x1_SN_LDSB0_CLR1_GRVWA8_GRVWB16_GSU0_GSUC0_GSUWGMRR0_K1_LBSPPA128_LBSPPB128_LPA8_LPB16_LRVW8_MIWT2_2_PLR1_SU0_SUM0_SUS64_VWA2_VWB2_WGM8_WGMXCC1_WGMXCCGn1
    SolutionIndex: 29
    SolutionNameMin: Cijk_Alik_Bljk_F8NBS_BH_Bias_HAS_SAV_UserArgs_MT32x64x64_MI16x16x1_SN_LDSB0_CLR1_GRVWA8_GRVWB16_GSU0_GSUC0_GSUWGMRR0_K1_LBSPPA128_LBSPPB128_LPA8_LPB16_LRVW8_MIWT1_2_PLR1_SU0_SUM0_SUS64_VWA1_VWB2_WGM1_WGMXCC1_WGMXCCGn1
    SolutionIndex: 30
    SolutionNameMin: Cijk_Alik_Bljk_F8NBS_BH_Bias_HAS_SAV_UserArgs_MT64x32x64_MI16x16x1_SN_LDSB0_CLR1_GRVWA8_GRVWB8_GSU0_GSUC0_GSUWGMRR0_K1_LBSPPA128_LBSPPB128_LPA8_LPB8_LRVW8_MIWT2_1_PLR1_SU0_SUM0_SUS64_VWA2_VWB1_WGM1_WGMXCC1_WGMXCCGn1
    SolutionIndex: 31
    SolutionNameMin: Cijk_Alik_Bljk_F8NBS_BH_Bias_HAS_SAV_UserArgs_MT32x32x64_MI16x16x1_SN_LDSB0_CLR1_GRVWA8_GRVWB8_GSU0_GSUC0_GSUWGMRR0_K1_LBSPPA128_LBSPPB128_LPA8_LPB8_LRVW8_MIWT1_1_PLR1_SU0_SUM0_SUS64_VWA1_VWB1_WGM1_WGMXCC1_WGMXCCGn1
    SolutionIndex: 32
    SolutionNameMin: Cijk_Alik_Bljk_F8NBS_BH_Bias_HAS_SAV_UserArgs_MT32x32x64_MI16x16x1_SN_LDSB0_CLR1_GRVWA8_GRVWB8_GSU0_GSUC0_GSUWGMRR0_K1_LBSPPA128_LBSPPB128_LPA8_LPB8_LRVW8_MIWT1_1_PLR1_SU0_SUM0_SUS64_VWA1_VWB1_WGM4_WGMXCC1_WGMXCCGn1
    SolutionIndex: 33
    SolutionNameMin: Cijk_Alik_Bljk_F8NBS_BH_Bias_HAS_SAV_UserArgs_MT128x256x128_MI16x16x1_SN_LDSB1_CLR1_GRVWA8_GRVWB16_GSU0_GSUC0_GSUWGMRR0_K1_LBSPPA512_LBSPPB1024_LPA8_LPB16_LRVW8_MIWT4_8_PLR1_SU0_SUM0_SUS128_VWA4_VWB8_WGM1_WGMXCC1_WGMXCCGn1
    SolutionIndex: 34
    SolutionNameMin: Cijk_Alik_Bljk_F8NBS_BH_Bias_HAS_SAV_UserArgs_MT256x144x128_MI16x16x1_SN_LDSB1_CLR1_GRVWA8_GRVWB8_GSU0_GSUC0_GSUWGMRR0_K1_LBSPPA512_LBSPPB128_LPA8_LPB8_LRVW8_MIWT4_9_PLR1_SU0_SUM0_SUS128_VWA4_VWB1_WGM1_WGMXCC1_WGMXCCGn1
    SolutionIndex: 35
    SolutionNameMin: Cijk_Alik_Bljk_F8NBS_BH_Bias_HAS_SAV_UserArgs_MT256x144x128_MI16x16x1_SN_LDSB1_CLR1_GRVWA16_GRVWB8_GSU0_GSUC0_GSUWGMRR0_K1_LBSPPA512_LBSPPB128_LPA16_LPB8_LRVW8_MIWT4_9_PLR1_SU0_SUM0_SUS128_VWA4_VWB1_WGM1_WGMXCC1_WGMXCCGn1
    SolutionIndex: 36
    SolutionNameMin: Cijk_Alik_Bljk_F8NBS_BH_Bias_HAS_SAV_UserArgs_MT256x144x128_MI16x16x1_SN_LDSB1_CLR1_GRVWA8_GRVWB8_GSU0_GSUC0_GSUWGMRR0_K1_LBSPPA512_LBSPPB128_LPA8_LPB8_LRVW8_MIWT4_9_PLR1_SU0_SUM0_SUS128_VWA4_VWB1_WGM4_WGMXCC1_WGMXCCGn1
    SolutionIndex: 37
    SolutionNameMin: Cijk_Alik_Bljk_F8NBS_BH_Bias_HAS_SAV_UserArgs_MT256x144x128_MI16x16x1_SN_LDSB1_CLR1_GRVWA16_GRVWB8_GSU0_GSUC0_GSUWGMRR0_K1_LBSPPA512_LBSPPB128_LPA16_LPB8_LRVW8_MIWT4_9_PLR1_SU0_SUM0_SUS128_VWA4_VWB1_WGM4_WGMXCC1_WGMXCCGn1
    SolutionIndex: 38
    SolutionNameMin: Cijk_Alik_Bljk_F8NBS_BH_Bias_HAS_SAV_UserArgs_MT256x144x128_MI16x16x1_SN_LDSB1_CLR1_GRVWA8_GRVWB8_GSU0_GSUC0_GSUWGMRR0_K1_LBSPPA512_LBSPPB128_LPA8_LPB8_LRVW8_MIWT4_9_PLR1_SU0_SUM0_SUS128_VWA4_VWB1_WGM6_WGMXCC1_WGMXCCGn1
    SolutionIndex: 39
    SolutionNameMin: Cijk_Alik_Bljk_F8NBS_BH_Bias_HAS_SAV_UserArgs_MT256x144x128_MI16x16x1_SN_LDSB1_CLR1_GRVWA16_GRVWB8_GSU0_GSUC0_GSUWGMRR0_K1_LBSPPA512_LBSPPB128_LPA16_LPB8_LRVW8_MIWT4_9_PLR1_SU0_SUM0_SUS128_VWA4_VWB1_WGM6_WGMXCC1_WGMXCCGn1
    SolutionIndex: 40
    SolutionNameMin: Cijk_Alik_Bljk_F8NBS_BH_Bias_HAS_SAV_UserArgs_MT256x144x128_MI16x16x1_SN_LDSB1_CLR1_GRVWA8_GRVWB8_GSU0_GSUC0_GSUWGMRR0_K1_LBSPPA512_LBSPPB128_LPA8_LPB8_LRVW8_MIWT4_9_PLR1_SU0_SUM0_SUS128_VWA4_VWB1_WGM8_WGMXCC1_WGMXCCGn1
    SolutionIndex: 41
    SolutionNameMin: Cijk_Alik_Bljk_F8NBS_BH_Bias_HAS_SAV_UserArgs_MT256x144x128_MI16x16x1_SN_LDSB1_CLR1_GRVWA16_GRVWB8_GSU0_GSUC0_GSUWGMRR0_K1_LBSPPA512_LBSPPB128_LPA16_LPB8_LRVW8_MIWT4_9_PLR1_SU0_SUM0_SUS128_VWA4_VWB1_WGM8_WGMXCC1_WGMXCCGn1
    SolutionIndex: 42
    SolutionNameMin: Cijk_Alik_Bljk_F8NBS_BH_Bias_HAS_SAV_UserArgs_MT256x128x128_MI16x16x1_SN_LDSB1_CLR1_GRVWA8_GRVWB16_GSU0_GSUC0_GSUWGMRR0_K1_LBSPPA1024_LBSPPB512_LPA8_LPB16_LRVW8_MIWT8_4_PLR1_SU0_SUM0_SUS128_VWA8_VWB4_WGM1_WGMXCC1_WGMXCCGn1
    SolutionIndex: 43
    SolutionNameMin: Cijk_Alik_Bljk_F8NBS_BH_Bias_HAS_SAV_UserArgs_MT256x128x128_MI16x16x1_SN_LDSB1_CLR1_GRVWA8_GRVWB16_GSU0_GSUC0_GSUWGMRR0_K1_LBSPPA1024_LBSPPB512_LPA8_LPB16_LRVW8_MIWT8_4_PLR1_SU0_SUM0_SUS128_VWA8_VWB4_WGM4_WGMXCC1_WGMXCCGn1
    SolutionIndex: 44
    SolutionNameMin: Cijk_Alik_Bljk_F8NBS_BH_Bias_HAS_SAV_UserArgs_MT256x128x128_MI16x16x1_SN_LDSB1_CLR1_GRVWA8_GRVWB16_GSU0_GSUC0_GSUWGMRR0_K1_LBSPPA1024_LBSPPB512_LPA8_LPB16_LRVW8_MIWT8_4_PLR1_SU0_SUM0_SUS128_VWA8_VWB4_WGM6_WGMXCC1_WGMXCCGn1
    SolutionIndex: 45
    SolutionNameMin: Cijk_Alik_Bljk_F8NBS_BH_Bias_HAS_SAV_UserArgs_MT256x128x128_MI16x16x1_SN_LDSB1_CLR1_GRVWA8_GRVWB16_GSU0_GSUC0_GSUWGMRR0_K1_LBSPPA1024_LBSPPB512_LPA8_LPB16_LRVW8_MIWT8_4_PLR1_SU0_SUM0_SUS128_VWA8_VWB4_WGM8_WGMXCC1_WGMXCCGn1
    SolutionIndex: 46
    SolutionNameMin: Cijk_Alik_Bljk_F8NBS_BH_Bias_HAS_SAV_UserArgs_MT144x256x128_MI16x16x1_SN_LDSB1_CLR1_GRVWA8_GRVWB8_GSU0_GSUC0_GSUWGMRR0_K1_LBSPPA128_LBSPPB512_LPA8_LPB8_LRVW8_MIWT9_4_PLR1_SU0_SUM0_SUS128_VWA1_VWB4_WGM4_WGMXCC1_WGMXCCGn1
    SolutionIndex: 47
    SolutionNameMin: Cijk_Alik_Bljk_F8NBS_BH_Bias_HAS_SAV_UserArgs_MT144x256x128_MI16x16x1_SN_LDSB1_CLR1_GRVWA8_GRVWB16_GSU0_GSUC0_GSUWGMRR0_K1_LBSPPA128_LBSPPB512_LPA8_LPB16_LRVW8_MIWT9_4_PLR1_SU0_SUM0_SUS128_VWA1_VWB4_WGM4_WGMXCC1_WGMXCCGn1
    SolutionIndex: 48
    SolutionNameMin: Cijk_Alik_Bljk_F8NBS_BH_Bias_HAS_SAV_UserArgs_MT144x256x128_MI16x16x1_SN_LDSB1_CLR1_GRVWA8_GRVWB8_GSU0_GSUC0_GSUWGMRR0_K1_LBSPPA128_LBSPPB512_LPA8_LPB8_LRVW8_MIWT9_4_PLR1_SU0_SUM0_SUS128_VWA1_VWB4_WGM6_WGMXCC1_WGMXCCGn1
    SolutionIndex: 49
    SolutionNameMin: Cijk_Alik_Bljk_F8NBS_BH_Bias_HAS_SAV_UserArgs_MT144x256x128_MI16x16x1_SN_LDSB1_CLR1_GRVWA8_GRVWB16_GSU0_GSUC0_GSUWGMRR0_K1_LBSPPA128_LBSPPB512_LPA8_LPB16_LRVW8_MIWT9_4_PLR1_SU0_SUM0_SUS128_VWA1_VWB4_WGM6_WGMXCC1_WGMXCCGn1
    SolutionIndex: 50
    SolutionNameMin: Cijk_Alik_Bljk_F8NBS_BH_Bias_HAS_SAV_UserArgs_MT144x256x128_MI16x16x1_SN_LDSB1_CLR1_GRVWA8_GRVWB16_GSU0_GSUC0_GSUWGMRR0_K1_LBSPPA128_LBSPPB512_LPA8_LPB16_LRVW8_MIWT9_4_PLR1_SU0_SUM0_SUS128_VWA1_VWB4_WGM8_WGMXCC1_WGMXCCGn1
    SolutionIndex: 51
    SolutionNameMin: Cijk_Alik_Bljk_F8NBS_BH_Bias_HAS_SAV_UserArgs_MT128x128x128_MI16x16x1_SN_LDSB1_CLR1_GRVWA8_GRVWB16_GSU0_GSUC0_GSUWGMRR0_K1_LBSPPA1024_LBSPPB256_LPA8_LPB16_LRVW8_MIWT8_2_PLR1_SU0_SUM0_SUS128_VWA8_VWB2_WGM1_WGMXCC1_WGMXCCGn1
    SolutionIndex: 52
    SolutionNameMin: Cijk_Alik_Bljk_F8NBS_BH_Bias_HAS_SAV_UserArgs_MT128x128x128_MI16x16x1_SN_LDSB1_CLR1_GRVWA8_GRVWB16_GSU0_GSUC0_GSUWGMRR0_K1_LBSPPA1024_LBSPPB256_LPA8_LPB16_LRVW8_MIWT8_2_PLR1_SU0_SUM0_SUS128_VWA8_VWB2_WGM4_WGMXCC1_WGMXCCGn1
    SolutionIndex: 53
    SolutionNameMin: Cijk_Alik_Bljk_F8NBS_BH_Bias_HAS_SAV_UserArgs_MT128x128x128_MI16x16x1_SN_LDSB1_CLR1_GRVWA8_GRVWB16_GSU0_GSUC0_GSUWGMRR0_K1_LBSPPA1024_LBSPPB256_LPA8_LPB16_LRVW8_MIWT8_2_PLR1_SU0_SUM0_SUS128_VWA8_VWB2_WGM6_WGMXCC1_WGMXCCGn1
    SolutionIndex: 54
    SolutionNameMin: Cijk_Alik_Bljk_F8NBS_BH_Bias_HAS_SAV_UserArgs_MT128x128x128_MI16x16x1_SN_LDSB1_CLR1_GRVWA8_GRVWB16_GSU0_GSUC0_GSUWGMRR0_K1_LBSPPA1024_LBSPPB256_LPA8_LPB16_LRVW8_MIWT8_2_PLR1_SU0_SUM0_SUS128_VWA8_VWB2_WGM8_WGMXCC1_WGMXCCGn1
    SolutionIndex: 55
    SolutionNameMin: Cijk_Alik_Bljk_F8NBS_BH_Bias_HAS_SAV_UserArgs_MT128x144x128_MI16x16x1_SN_LDSB1_CLR1_GRVWA16_GRVWB8_GSU0_GSUC0_GSUWGMRR0_K1_LBSPPA256_LBSPPB128_LPA16_LPB8_LRVW8_MIWT2_9_PLR1_SU0_SUM0_SUS128_VWA2_VWB1_WGM1_WGMXCC1_WGMXCCGn1
    SolutionIndex: 56
    SolutionNameMin: Cijk_Alik_Bljk_F8NBS_BH_Bias_HAS_SAV_UserArgs_MT128x144x128_MI16x16x1_SN_LDSB1_CLR1_GRVWA16_GRVWB8_GSU0_GSUC0_GSUWGMRR0_K1_LBSPPA256_LBSPPB128_LPA16_LPB8_LRVW8_MIWT2_9_PLR1_SU0_SUM0_SUS128_VWA2_VWB1_WGM4_WGMXCC1_WGMXCCGn1
    SolutionIndex: 57
    SolutionNameMin: Cijk_Alik_Bljk_F8NBS_BH_Bias_HAS_SAV_UserArgs_MT128x64x128_MI16x16x1_SN_LDSB1_CLR1_GRVWA8_GRVWB16_GSU0_GSUC0_GSUWGMRR0_K1_LBSPPA1024_LBSPPB128_LPA8_LPB16_LRVW8_MIWT8_1_PLR1_SU0_SUM0_SUS128_VWA8_VWB1_WGM1_WGMXCC1_WGMXCCGn1
    SolutionIndex: 58
    SolutionNameMin: Cijk_Alik_Bljk_F8NBS_BH_Bias_HAS_SAV_UserArgs_MT144x128x128_MI16x16x1_SN_LDSB1_CLR1_GRVWA8_GRVWB16_GSU0_GSUC0_GSUWGMRR0_K1_LBSPPA128_LBSPPB256_LPA8_LPB16_LRVW8_MIWT9_2_PLR1_SU0_SUM0_SUS128_VWA1_VWB2_WGM4_WGMXCC1_WGMXCCGn1
    SolutionIndex: 59
    SolutionNameMin: Cijk_Alik_Bljk_F8NBS_BH_Bias_HAS_SAV_UserArgs_MT144x128x128_MI16x16x1_SN_LDSB1_CLR1_GRVWA8_GRVWB16_GSU0_GSUC0_GSUWGMRR0_K1_LBSPPA128_LBSPPB256_LPA8_LPB16_LRVW8_MIWT9_2_PLR1_SU0_SUM0_SUS128_VWA1_VWB2_WGM8_WGMXCC1_WGMXCCGn1
    SolutionIndex: 60
    SolutionNameMin: Cijk_Alik_Bljk_F8NBS_BH_Bias_HAS_SAV_UserArgs_MT128x128x128_MI16x16x1_SN_LDSB1_CLR1_GRVWA8_GRVWB16_GSU0_GSUC0_GSUWGMRR0_K1_LBSPPA512_LBSPPB512_LPA8_LPB16_LRVW8_MIWT4_4_PLR1_SU0_SUM0_SUS128_VWA4_VWB4_WGM1_WGMXCC1_WGMXCCGn1
    SolutionIndex: 61
    SolutionNameMin: Cijk_Alik_Bljk_F8NBS_BH_Bias_HAS_SAV_UserArgs_MT128x128x128_MI16x16x1_SN_LDSB1_CLR1_GRVWA16_GRVWB16_GSU0_GSUC0_GSUWGMRR0_K1_LBSPPA512_LBSPPB512_LPA16_LPB16_LRVW8_MIWT4_4_PLR1_SU0_SUM0_SUS128_VWA4_VWB4_WGM1_WGMXCC1_WGMXCCGn1
    SolutionIndex: 62
    SolutionNameMin: Cijk_Alik_Bljk_F8NBS_BH_Bias_HAS_SAV_UserArgs_MT128x128x128_MI16x16x1_SN_LDSB1_CLR1_GRVWA8_GRVWB16_GSU0_GSUC0_GSUWGMRR0_K1_LBSPPA512_LBSPPB512_LPA8_LPB16_LRVW8_MIWT4_4_PLR1_SU0_SUM0_SUS128_VWA4_VWB4_WGM4_WGMXCC1_WGMXCCGn1
    SolutionIndex: 63
    SolutionNameMin: Cijk_Alik_Bljk_F8NBS_BH_Bias_HAS_SAV_UserArgs_MT128x128x128_MI16x16x1_SN_LDSB1_CLR1_GRVWA16_GRVWB16_GSU0_GSUC0_GSUWGMRR0_K1_LBSPPA512_LBSPPB512_LPA16_LPB16_LRVW8_MIWT4_4_PLR1_SU0_SUM0_SUS128_VWA4_VWB4_WGM6_WGMXCC1_WGMXCCGn1
    SolutionIndex: 64
    SolutionNameMin: Cijk_Alik_Bljk_F8NBS_BH_Bias_HAS_SAV_UserArgs_MT128x128x128_MI16x16x1_SN_LDSB1_CLR1_GRVWA8_GRVWB16_GSU0_GSUC0_GSUWGMRR0_K1_LBSPPA512_LBSPPB512_LPA8_LPB16_LRVW8_MIWT4_4_PLR1_SU0_SUM0_SUS128_VWA4_VWB4_WGM8_WGMXCC1_WGMXCCGn1
    SolutionIndex: 65
    SolutionNameMin: Cijk_Alik_Bljk_F8NBS_BH_Bias_HAS_SAV_UserArgs_MT64x128x128_MI16x16x1_SN_LDSB1_CLR1_GRVWA8_GRVWB16_GSU0_GSUC0_GSUWGMRR0_K1_LBSPPA256_LBSPPB512_LPA8_LPB16_LRVW8_MIWT2_4_PLR1_SU0_SUM0_SUS128_VWA2_VWB4_WGM1_WGMXCC1_WGMXCCGn1
    SolutionIndex: 66
    SolutionNameMin: Cijk_Alik_Bljk_F8NBS_BH_Bias_HAS_SAV_UserArgs_MT64x64x128_MI16x16x1_SN_LDSB1_CLR1_GRVWA16_GRVWB8_GSU0_GSUC0_GSUWGMRR0_K1_LBSPPA256_LBSPPB256_LPA16_LPB8_LRVW8_MIWT2_2_PLR1_SU0_SUM0_SUS128_VWA2_VWB2_WGM1_WGMXCC1_WGMXCCGn1
    SolutionIndex: 67
    SolutionNameMin: Cijk_Alik_Bljk_F8NBS_BH_Bias_HAS_SAV_UserArgs_MT64x64x128_MI16x16x1_SN_LDSB1_CLR1_GRVWA8_GRVWB16_GSU0_GSUC0_GSUWGMRR0_K1_LBSPPA256_LBSPPB256_LPA8_LPB16_LRVW8_MIWT2_2_PLR1_SU0_SUM0_SUS128_VWA2_VWB2_WGM1_WGMXCC1_WGMXCCGn1
    SolutionIndex: 68
    SolutionNameMin: Cijk_Alik_Bljk_F8NBS_BH_Bias_HAS_SAV_UserArgs_MT64x64x128_MI16x16x1_SN_LDSB1_CLR1_GRVWA8_GRVWB16_GSU0_GSUC0_GSUWGMRR0_K1_LBSPPA256_LBSPPB256_LPA8_LPB16_LRVW8_MIWT2_2_PLR1_SU0_SUM0_SUS128_VWA2_VWB2_WGM4_WGMXCC1_WGMXCCGn1
    SolutionIndex: 69
    SolutionNameMin: Cijk_Alik_Bljk_F8NBS_BH_Bias_HAS_SAV_UserArgs_MT64x64x128_MI16x16x1_SN_LDSB1_CLR1_GRVWA8_GRVWB16_GSU0_GSUC0_GSUWGMRR0_K1_LBSPPA256_LBSPPB256_LPA8_LPB16_LRVW8_MIWT2_2_PLR1_SU0_SUM0_SUS128_VWA2_VWB2_WGM8_WGMXCC1_WGMXCCGn1
    SolutionIndex: 70
    SolutionNameMin: Cijk_Alik_Bljk_F8NBS_BH_Bias_HAS_SAV_UserArgs_MT32x64x128_MI16x16x1_SN_LDSB0_CLR1_GRVWA8_GRVWB8_GSU0_GSUC0_GSUWGMRR0_K1_LBSPPA128_LBSPPB256_LPA8_LPB8_LRVW8_MIWT1_2_PLR1_SU0_SUM0_SUS128_VWA1_VWB2_WGM1_WGMXCC1_WGMXCCGn1
    SolutionIndex: 71
    SolutionNameMin: Cijk_Alik_Bljk_F8NBS_BH_Bias_HAS_SAV_UserArgs_MT32x64x128_MI16x16x1_SN_LDSB0_CLR1_GRVWA8_GRVWB8_GSU0_GSUC0_GSUWGMRR0_K1_LBSPPA128_LBSPPB256_LPA8_LPB8_LRVW8_MIWT1_2_PLR1_SU0_SUM0_SUS128_VWA1_VWB2_WGM8_WGMXCC1_WGMXCCGn1
    SolutionIndex: 72
    SolutionNameMin: Cijk_Alik_Bljk_F8NBS_BH_Bias_HAS_SAV_UserArgs_MT64x32x128_MI16x16x1_SN_LDSB0_CLR1_GRVWA8_GRVWB8_GSU0_GSUC0_GSUWGMRR0_K1_LBSPPA256_LBSPPB128_LPA8_LPB8_LRVW8_MIWT2_1_PLR1_SU0_SUM0_SUS128_VWA2_VWB1_WGM1_WGMXCC1_WGMXCCGn1
    SolutionIndex: 73
    SolutionNameMin: Cijk_Alik_Bljk_F8NBS_BH_Bias_HAS_SAV_UserArgs_MT64x32x128_MI16x16x1_SN_LDSB0_CLR1_GRVWA16_GRVWB8_GSU0_GSUC0_GSUWGMRR0_K1_LBSPPA256_LBSPPB128_LPA16_LPB8_LRVW8_MIWT2_1_PLR1_SU0_SUM0_SUS128_VWA2_VWB1_WGM1_WGMXCC1_WGMXCCGn1
    SolutionIndex: 74
    SolutionNameMin: Cijk_Alik_Bljk_F8NBS_BH_Bias_HAS_SAV_UserArgs_MT64x32x128_MI16x16x1_SN_LDSB0_CLR1_GRVWA8_GRVWB16_GSU0_GSUC0_GSUWGMRR0_K1_LBSPPA256_LBSPPB128_LPA8_LPB16_LRVW8_MIWT2_1_PLR1_SU0_SUM0_SUS128_VWA2_VWB1_WGM1_WGMXCC1_WGMXCCGn1
    SolutionIndex: 75
    SolutionNameMin: Cijk_Alik_Bljk_F8NBS_BH_Bias_HAS_SAV_UserArgs_MT64x32x128_MI16x16x1_SN_LDSB0_CLR1_GRVWA16_GRVWB16_GSU0_GSUC0_GSUWGMRR0_K1_LBSPPA256_LBSPPB128_LPA16_LPB16_LRVW8_MIWT2_1_PLR1_SU0_SUM0_SUS128_VWA2_VWB1_WGM1_WGMXCC1_WGMXCCGn1
    SolutionIndex: 76
    SolutionNameMin: Cijk_Alik_Bljk_F8NBS_BH_Bias_HAS_SAV_UserArgs_MT32x32x128_MI16x16x1_SN_LDSB0_CLR1_GRVWA8_GRVWB8_GSU0_GSUC0_GSUWGMRR0_K1_LBSPPA128_LBSPPB128_LPA8_LPB8_LRVW8_MIWT1_1_PLR1_SU0_SUM0_SUS128_VWA1_VWB1_WGM1_WGMXCC1_WGMXCCGn1
    SolutionIndex: 77
    SolutionNameMin: Cijk_Alik_Bljk_F8NBS_BH_Bias_HAS_SAV_UserArgs_MT32x32x128_MI16x16x1_SN_LDSB0_CLR1_GRVWA16_GRVWB8_GSU0_GSUC0_GSUWGMRR0_K1_LBSPPA128_LBSPPB128_LPA16_LPB8_LRVW8_MIWT1_1_PLR1_SU0_SUM0_SUS128_VWA1_VWB1_WGM1_WGMXCC1_WGMXCCGn1
    SolutionIndex: 78
    SolutionNameMin: Cijk_Alik_Bljk_F8NBS_BH_Bias_HAS_SAV_UserArgs_MT32x32x128_MI16x16x1_SN_LDSB0_CLR1_GRVWA8_GRVWB16_GSU0_GSUC0_GSUWGMRR0_K1_LBSPPA128_LBSPPB128_LPA8_LPB16_LRVW8_MIWT1_1_PLR1_SU0_SUM0_SUS128_VWA1_VWB1_WGM1_WGMXCC1_WGMXCCGn1
    SolutionIndex: 79
    SolutionNameMin: Cijk_Alik_Bljk_F8NBS_BH_Bias_HAS_SAV_UserArgs_MT32x32x128_MI16x16x1_SN_LDSB0_CLR1_GRVWA16_GRVWB16_GSU0_GSUC0_GSUWGMRR0_K1_LBSPPA128_LBSPPB128_LPA16_LPB16_LRVW8_MIWT1_1_PLR1_SU0_SUM0_SUS128_VWA1_VWB1_WGM1_WGMXCC1_WGMXCCGn1
    SolutionIndex: 80
    SolutionNameMin: Cijk_Alik_Bljk_F8NBS_BH_Bias_HAS_SAV_UserArgs_MT32x32x128_MI16x16x1_SN_LDSB0_CLR1_GRVWA8_GRVWB8_GSU0_GSUC0_GSUWGMRR0_K1_LBSPPA128_LBSPPB128_LPA8_LPB8_LRVW8_MIWT1_1_PLR1_SU0_SUM0_SUS128_VWA1_VWB1_WGM4_WGMXCC1_WGMXCCGn1
    SolutionIndex: 81
    SolutionNameMin: Cijk_Alik_Bljk_F8NBS_BH_Bias_HAS_SAV_UserArgs_MT32x32x128_MI16x16x1_SN_LDSB0_CLR1_GRVWA8_GRVWB16_GSU0_GSUC0_GSUWGMRR0_K1_LBSPPA128_LBSPPB128_LPA8_LPB16_LRVW8_MIWT1_1_PLR1_SU0_SUM0_SUS128_VWA1_VWB1_WGM4_WGMXCC1_WGMXCCGn1
    SolutionIndex: 82
    SolutionNameMin: Cijk_Alik_Bljk_F8NBS_BH_Bias_HAS_SAV_UserArgs_MT32x32x128_MI16x16x1_SN_LDSB0_CLR1_GRVWA8_GRVWB8_GSU0_GSUC0_GSUWGMRR0_K1_LBSPPA128_LBSPPB128_LPA8_LPB8_LRVW8_MIWT1_1_PLR1_SU0_SUM0_SUS128_VWA1_VWB1_WGM6_WGMXCC1_WGMXCCGn1
    SolutionIndex: 83
    SolutionNameMin: Cijk_Alik_Bljk_F8NBS_BH_Bias_HAS_SAV_UserArgs_MT32x32x128_MI16x16x1_SN_LDSB0_CLR1_GRVWA16_GRVWB8_GSU0_GSUC0_GSUWGMRR0_K1_LBSPPA128_LBSPPB128_LPA16_LPB8_LRVW8_MIWT1_1_PLR1_SU0_SUM0_SUS128_VWA1_VWB1_WGM6_WGMXCC1_WGMXCCGn1
    SolutionIndex: 84
    SolutionNameMin: Cijk_Alik_Bljk_F8NBS_BH_Bias_HAS_SAV_UserArgs_MT32x32x128_MI16x16x1_SN_LDSB0_CLR1_GRVWA8_GRVWB16_GSU0_GSUC0_GSUWGMRR0_K1_LBSPPA128_LBSPPB128_LPA8_LPB16_LRVW8_MIWT1_1_PLR1_SU0_SUM0_SUS128_VWA1_VWB1_WGM6_WGMXCC1_WGMXCCGn1
    SolutionIndex: 85
    SolutionNameMin: Cijk_Alik_Bljk_F8NBS_BH_Bias_HAS_SAV_UserArgs_MT32x32x128_MI16x16x1_SN_LDSB0_CLR1_GRVWA8_GRVWB8_GSU0_GSUC0_GSUWGMRR0_K1_LBSPPA128_LBSPPB128_LPA8_LPB8_LRVW8_MIWT1_1_PLR1_SU0_SUM0_SUS128_VWA1_VWB1_WGM8_WGMXCC1_WGMXCCGn1
    SolutionIndex: 86
    SolutionNameMin: Cijk_Alik_Bljk_F8NBS_BH_Bias_HAS_SAV_UserArgs_MT128x64x256_MI16x16x1_SN_LDSB1_CLR1_GRVWA8_GRVWB16_GSU0_GSUC0_GSUWGMRR0_K1_LBSPPA1024_LBSPPB512_LPA8_LPB16_LRVW8_MIWT4_2_PLR1_SU0_SUM0_SUS256_VWA4_VWB2_WGM1_WGMXCC1_WGMXCCGn1
    SolutionIndex: 87
    SolutionNameMin: Cijk_Alik_Bljk_F8NBS_BH_Bias_HAS_SAV_UserArgs_MT128x64x256_MI16x16x1_SN_LDSB1_CLR1_GRVWA8_GRVWB16_GSU0_GSUC0_GSUWGMRR0_K1_LBSPPA1024_LBSPPB512_LPA8_LPB16_LRVW8_MIWT4_2_PLR1_SU0_SUM0_SUS256_VWA4_VWB2_WGM4_WGMXCC1_WGMXCCGn1
    SolutionIndex: 88
    SolutionNameMin: Cijk_Alik_Bljk_F8NBS_BH_Bias_HAS_SAV_UserArgs_MT128x64x256_MI16x16x1_SN_LDSB1_CLR1_GRVWA8_GRVWB8_GSU0_GSUC0_GSUWGMRR0_K1_LBSPPA1024_LBSPPB512_LPA8_LPB8_LRVW8_MIWT4_2_PLR1_SU0_SUM0_SUS256_VWA4_VWB2_WGM6_WGMXCC1_WGMXCCGn1
    SolutionIndex: 89
    SolutionNameMin: Cijk_Alik_Bljk_F8NBS_BH_Bias_HAS_SAV_UserArgs_MT128x64x256_MI16x16x1_SN_LDSB1_CLR1_GRVWA8_GRVWB16_GSU0_GSUC0_GSUWGMRR0_K1_LBSPPA1024_LBSPPB512_LPA8_LPB16_LRVW8_MIWT4_2_PLR1_SU0_SUM0_SUS256_VWA4_VWB2_WGM6_WGMXCC1_WGMXCCGn1
    SolutionIndex: 90
    SolutionNameMin: Cijk_Alik_Bljk_F8NBS_BH_Bias_HAS_SAV_UserArgs_MT128x64x256_MI16x16x1_SN_LDSB1_CLR1_GRVWA8_GRVWB16_GSU0_GSUC0_GSUWGMRR0_K1_LBSPPA1024_LBSPPB512_LPA8_LPB16_LRVW8_MIWT4_2_PLR1_SU0_SUM0_SUS256_VWA4_VWB2_WGM8_WGMXCC1_WGMXCCGn1
    SolutionIndex: 91
    SolutionNameMin: Cijk_Alik_Bljk_F8NBS_BH_Bias_HAS_SAV_UserArgs_MT64x64x256_MI16x16x1_SN_LDSB1_CLR1_GRVWA8_GRVWB16_GSU0_GSUC0_GSUWGMRR0_K1_LBSPPA512_LBSPPB512_LPA8_LPB16_LRVW8_MIWT2_2_PLR1_SU0_SUM0_SUS256_VWA2_VWB2_WGM1_WGMXCC1_WGMXCCGn1
    SolutionIndex: 92
    SolutionNameMin: Cijk_Alik_Bljk_F8NBS_BH_Bias_HAS_SAV_UserArgs_MT64x64x256_MI16x16x1_SN_LDSB1_CLR1_GRVWA8_GRVWB16_GSU0_GSUC0_GSUWGMRR0_K1_LBSPPA512_LBSPPB512_LPA8_LPB16_LRVW8_MIWT2_2_PLR1_SU0_SUM0_SUS256_VWA2_VWB2_WGM4_WGMXCC1_WGMXCCGn1
    SolutionIndex: 93
    SolutionNameMin: Cijk_Alik_Bljk_F8NBS_BH_Bias_HAS_SAV_UserArgs_MT64x64x256_MI16x16x1_SN_LDSB1_CLR1_GRVWA8_GRVWB16_GSU0_GSUC0_GSUWGMRR0_K1_LBSPPA512_LBSPPB512_LPA8_LPB16_LRVW8_MIWT2_2_PLR1_SU0_SUM0_SUS256_VWA2_VWB2_WGM6_WGMXCC1_WGMXCCGn1
    SolutionIndex: 94
    SolutionNameMin: Cijk_Alik_Bljk_F8NBS_BH_Bias_HAS_SAV_UserArgs_MT32x32x256_MI16x16x1_SN_LDSB1_CLR1_GRVWA8_GRVWB8_GSU0_GSUC0_GSUWGMRR0_K1_LBSPPA256_LBSPPB256_LPA8_LPB8_LRVW8_MIWT1_1_PLR1_SU0_SUM0_SUS256_VWA1_VWB1_WGM1_WGMXCC1_WGMXCCGn1
    SolutionIndex: 95
    SolutionNameMin: Cijk_Alik_Bljk_F8NBS_BH_Bias_HAS_SAV_UserArgs_MT32x32x256_MI16x16x1_SN_LDSB1_CLR1_GRVWA8_GRVWB16_GSU0_GSUC0_GSUWGMRR0_K1_LBSPPA256_LBSPPB256_LPA8_LPB16_LRVW8_MIWT1_1_PLR1_SU0_SUM0_SUS256_VWA1_VWB1_WGM1_WGMXCC1_WGMXCCGn1
    SolutionIndex: 96
    SolutionNameMin: Cijk_Alik_Bljk_F8NBS_BH_Bias_HAS_SAV_UserArgs_MT32x32x256_MI16x16x1_SN_LDSB1_CLR1_GRVWA8_GRVWB16_GSU0_GSUC0_GSUWGMRR0_K1_LBSPPA256_LBSPPB256_LPA8_LPB16_LRVW8_MIWT1_1_PLR1_SU0_SUM0_SUS256_VWA1_VWB1_WGM4_WGMXCC1_WGMXCCGn1
    SolutionIndex: 97
    SolutionNameMin: Cijk_Alik_Bljk_F8NBS_BH_Bias_HAS_SAV_UserArgs_MT32x64x32_MI16x16x1_SN_LDSB0_CLR0_GRVWA4_GRVWB8_GSU0_GSUC0_GSUWGMRR0_K1_LBSPPA128_LBSPPB128_LPA8_LPB8_LRVW8_MIWT1_2_PLR0_SU32_SUM0_SUS256_VWA1_VWB2_WGM6_WGMXCC1_WGMXCCGn1
- - - [128, 128, 1, 128, 128, 128, 128, 128]
    - [79, 0.62]
  - - [128, 128, 1, 256, 128, 128, 256, 256]
    - [79, 1.15]
  - - [128, 128, 1, 512, 128, 128, 512, 512]
    - [77, 2.07]
  - - [128, 128, 1, 1024, 128, 128, 1024, 1024]
    - [76, 3.41]
  - - [128, 128, 1, 2048, 128, 128, 2048, 2048]
    - [76, 5.25]
  - - [128, 128, 1, 4096, 128, 128, 4096, 4096]
    - [76, 7.12]
  - - [128, 128, 1, 8192, 128, 128, 8192, 8192]
    - [76, 8.64]
  - - [128, 256, 1, 128, 128, 128, 128, 128]
    - [76, 1.24]
  - - [128, 256, 1, 256, 128, 128, 256, 256]
    - [79, 2.3]
  - - [128, 256, 1, 512, 128, 128, 512, 512]
    - [78, 4.2]
  - - [128, 256, 1, 1024, 128, 128, 1024, 1024]
    - [76, 6.95]
  - - [128, 256, 1, 2048, 128, 128, 2048, 2048]
    - [76, 10.59]
  - - [128, 256, 1, 4096, 128, 128, 4096, 4096]
    - [76, 14.38]
  - - [128, 256, 1, 8192, 128, 128, 8192, 8192]
    - [76, 17.26]
  - - [128, 512, 1, 128, 128, 128, 128, 128]
    - [73, 2.28]
  - - [128, 512, 1, 256, 128, 128, 256, 256]
    - [31, 4.41]
  - - [128, 512, 1, 512, 128, 128, 512, 512]
    - [76, 8.19]
  - - [128, 512, 1, 1024, 128, 128, 1024, 1024]
    - [76, 13.74]
  - - [128, 512, 1, 2048, 128, 128, 2048, 2048]
    - [76, 21.07]
  - - [128, 512, 1, 4096, 128, 128, 4096, 4096]
    - [76, 28.26]
  - - [128, 512, 1, 8192, 128, 128, 8192, 8192]
    - [76, 34.33]
  - - [128, 1024, 1, 128, 128, 128, 128, 128]
    - [79, 4.78]
  - - [128, 1024, 1, 256, 128, 128, 256, 256]
    - [77, 8.84]
  - - [128, 1024, 1, 512, 128, 128, 512, 512]
    - [76, 16.06]
  - - [128, 1024, 1, 1024, 128, 128, 1024, 1024]
    - [77, 26.43]
  - - [128, 1024, 1, 2048, 128, 128, 2048, 2048]
    - [76, 41.53]
  - - [128, 1024, 1, 4096, 128, 128, 4096, 4096]
    - [76, 55.79]
  - - [128, 1024, 1, 8192, 128, 128, 8192, 8192]
    - [76, 67.55]
  - - [128, 2048, 1, 128, 128, 128, 128, 128]
    - [75, 8.98]
  - - [128, 2048, 1, 256, 128, 128, 256, 256]
    - [75, 16.52]
  - - [128, 2048, 1, 512, 128, 128, 512, 512]
    - [75, 28.67]
  - - [128, 2048, 1, 1024, 128, 128, 1024, 1024]
    - [74, 46.94]
  - - [128, 2048, 1, 2048, 128, 128, 2048, 2048]
    - [70, 68.56]
  - - [128, 2048, 1, 4096, 128, 128, 4096, 4096]
    - [70, 88.57]
  - - [128, 2048, 1, 8192, 128, 128, 8192, 8192]
    - [95, 97.68]
  - - [128, 4096, 1, 128, 128, 128, 128, 128]
    - [25, 14.9]
  - - [128, 4096, 1, 256, 128, 128, 256, 256]
    - [25, 29.18]
  - - [128, 4096, 1, 512, 128, 128, 512, 512]
    - [66, 47.17]
  - - [128, 4096, 1, 1024, 128, 128, 1024, 1024]
    - [67, 72.76]
  - - [128, 4096, 1, 2048, 128, 128, 2048, 2048]
    - [67, 102.08]
  - - [128, 4096, 1, 4096, 128, 128, 4096, 4096]
    - [67, 128.07]
  - - [128, 4096, 1, 8192, 128, 128, 8192, 8192]
    - [92, 139.8]
  - - [128, 8192, 1, 128, 128, 128, 128, 128]
    - [57, 25.76]
  - - [128, 8192, 1, 256, 128, 128, 256, 256]
    - [18, 46.65]
  - - [128, 8192, 1, 512, 128, 128, 512, 512]
    - [19, 77.72]
  - - [128, 8192, 1, 1024, 128, 128, 1024, 1024]
    - [19, 119.55]
  - - [128, 8192, 1, 2048, 128, 128, 2048, 2048]
    - [19, 157.82]
  - - [128, 8192, 1, 4096, 128, 128, 4096, 4096]
    - [86, 165.0]
  - - [128, 8192, 1, 8192, 128, 128, 8192, 8192]
    - [90, 183.72]
  - - [256, 128, 1, 128, 256, 256, 128, 128]
    - [83, 1.08]
  - - [256, 128, 1, 256, 256, 256, 256, 256]
    - [81, 2.16]
  - - [256, 128, 1, 512, 256, 256, 512, 512]
    - [76, 4.04]
  - - [256, 128, 1, 1024, 256, 256, 1024, 1024]
    - [76, 6.77]
  - - [256, 128, 1, 2048, 256, 256, 2048, 2048]
    - [76, 10.31]
  - - [256, 128, 1, 4096, 256, 256, 4096, 4096]
    - [76, 14.23]
  - - [256, 128, 1, 8192, 256, 256, 8192, 8192]
    - [76, 17.31]
  - - [256, 256, 1, 128, 256, 256, 128, 128]
    - [84, 2.25]
  - - [256, 256, 1, 256, 256, 256, 256, 256]
    - [32, 4.28]
  - - [256, 256, 1, 512, 256, 256, 512, 512]
    - [79, 8.06]
  - - [256, 256, 1, 1024, 256, 256, 1024, 1024]
    - [76, 14.01]
  - - [256, 256, 1, 2048, 256, 256, 2048, 2048]
    - [76, 21.03]
  - - [256, 256, 1, 4096, 256, 256, 4096, 4096]
    - [76, 28.49]
  - - [256, 256, 1, 8192, 256, 256, 8192, 8192]
    - [76, 34.49]
  - - [256, 512, 1, 128, 256, 256, 128, 128]
    - [79, 4.79]
  - - [256, 512, 1, 256, 256, 256, 256, 256]
    - [79, 8.88]
  - - [256, 512, 1, 512, 256, 256, 512, 512]
    - [79, 16.09]
  - - [256, 512, 1, 1024, 256, 256, 1024, 1024]
    - [78, 26.97]
  - - [256, 512, 1, 2048, 256, 256, 2048, 2048]
    - [76, 41.53]
  - - [256, 512, 1, 4096, 256, 256, 4096, 4096]
    - [76, 55.34]
  - - [256, 512, 1, 8192, 256, 256, 8192, 8192]
    - [76, 67.46]
  - - [256, 1024, 1, 128, 256, 256, 128, 128]
    - [75, 8.75]
  - - [256, 1024, 1, 256, 256, 256, 256, 256]
    - [72, 16.1]
  - - [256, 1024, 1, 512, 256, 256, 512, 512]
    - [72, 28.41]
  - - [256, 1024, 1, 1024, 256, 256, 1024, 1024]
    - [72, 46.54]
  - - [256, 1024, 1, 2048, 256, 256, 2048, 2048]
    - [70, 67.46]
  - - [256, 1024, 1, 4096, 256, 256, 4096, 4096]
    - [70, 87.91]
  - - [256, 1024, 1, 8192, 256, 256, 8192, 8192]
    - [72, 101.93]
  - - [256, 2048, 1, 128, 256, 256, 128, 128]
    - [26, 15.35]
  - - [256, 2048, 1, 256, 256, 256, 256, 256]
    - [25, 28.66]
  - - [256, 2048, 1, 512, 256, 256, 512, 512]
    - [25, 48.17]
  - - [256, 2048, 1, 1024, 256, 256, 1024, 1024]
    - [66, 75.06]
  - - [256, 2048, 1, 2048, 256, 256, 2048, 2048]
    - [67, 104.19]
  - - [256, 2048, 1, 4096, 256, 256, 4096, 4096]
    - [67, 129.02]
  - - [256, 2048, 1, 8192, 256, 256, 8192, 8192]
    - [91, 141.5]
  - - [256, 4096, 1, 128, 256, 256, 128, 128]
    - [15, 25.92]
  - - [256, 4096, 1, 256, 256, 256, 256, 256]
    - [19, 46.21]
  - - [256, 4096, 1, 512, 256, 256, 512, 512]
    - [19, 78.36]
  - - [256, 4096, 1, 1024, 256, 256, 1024, 1024]
    - [19, 116.98]
  - - [256, 4096, 1, 2048, 256, 256, 2048, 2048]
    - [19, 157.49]
  - - [256, 4096, 1, 4096, 256, 256, 4096, 4096]
    - [86, 174.74]
  - - [256, 4096, 1, 8192, 256, 256, 8192, 8192]
    - [65, 188.91]
  - - [256, 8192, 1, 128, 256, 256, 128, 128]
    - [51, 39.02]
  - - [256, 8192, 1, 256, 256, 256, 256, 256]
    - [11, 69.14]
  - - [256, 8192, 1, 512, 256, 256, 512, 512]
    - [11, 114.56]
  - - [256, 8192, 1, 1024, 256, 256, 1024, 1024]
    - [51, 171.2]
  - - [256, 8192, 1, 2048, 256, 256, 2048, 2048]
    - [51, 215.28]
  - - [256, 8192, 1, 4096, 256, 256, 4096, 4096]
    - [61, 216.55]
  - - [256, 8192, 1, 8192, 256, 256, 8192, 8192]
    - [60, 246.26]
  - - [512, 128, 1, 128, 512, 512, 128, 128]
    - [75, 2.26]
  - - [512, 128, 1, 256, 512, 512, 256, 256]
    - [95, 4.41]
  - - [512, 128, 1, 512, 512, 512, 512, 512]
    - [77, 8.01]
  - - [512, 128, 1, 1024, 512, 512, 1024, 1024]
    - [78, 13.44]
  - - [512, 128, 1, 2048, 512, 512, 2048, 2048]
    - [76, 20.87]
  - - [512, 128, 1, 4096, 512, 512, 4096, 4096]
    - [76, 28.42]
  - - [512, 128, 1, 8192, 512, 512, 8192, 8192]
    - [76, 34.48]
  - - [512, 256, 1, 128, 512, 512, 128, 128]
    - [80, 4.22]
  - - [512, 256, 1, 256, 512, 512, 256, 256]
    - [94, 8.47]
  - - [512, 256, 1, 512, 512, 512, 512, 512]
    - [76, 15.7]
  - - [512, 256, 1, 1024, 512, 512, 1024, 1024]
    - [76, 26.5]
  - - [512, 256, 1, 2048, 512, 512, 2048, 2048]
    - [76, 40.64]
  - - [512, 256, 1, 4096, 512, 512, 4096, 4096]
    - [85, 55.03]
  - - [512, 256, 1, 8192, 512, 512, 8192, 8192]
    - [80, 66.46]
  - - [512, 512, 1, 128, 512, 512, 128, 128]
    - [75, 8.53]
  - - [512, 512, 1, 256, 512, 512, 256, 256]
    - [75, 16.09]
  - - [512, 512, 1, 512, 512, 512, 512, 512]
    - [75, 28.3]
  - - [512, 512, 1, 1024, 512, 512, 1024, 1024]
    - [72, 46.56]
  - - [512, 512, 1, 2048, 512, 512, 2048, 2048]
    - [72, 67.41]
  - - [512, 512, 1, 4096, 512, 512, 4096, 4096]
    - [70, 88.02]
  - - [512, 512, 1, 8192, 512, 512, 8192, 8192]
    - [96, 96.78]
  - - [512, 1024, 1, 128, 512, 512, 128, 128]
    - [26, 15.75]
  - - [512, 1024, 1, 256, 512, 512, 256, 256]
    - [25, 28.55]
  - - [512, 1024, 1, 512, 512, 512, 512, 512]
    - [24, 48.0]
  - - [512, 1024, 1, 1024, 512, 512, 1024, 1024]
    - [67, 74.44]
  - - [512, 1024, 1, 2048, 512, 512, 2048, 2048]
    - [67, 103.64]
  - - [512, 1024, 1, 4096, 512, 512, 4096, 4096]
    - [67, 129.39]
  - - [512, 1024, 1, 8192, 512, 512, 8192, 8192]
    - [91, 141.2]
  - - [512, 2048, 1, 128, 512, 512, 128, 128]
    - [15, 25.68]
  - - [512, 2048, 1, 256, 512, 512, 256, 256]
    - [19, 46.26]
  - - [512, 2048, 1, 512, 512, 512, 512, 512]
    - [19, 77.93]
  - - [512, 2048, 1, 1024, 512, 512, 1024, 1024]
    - [22, 116.16]
  - - [512, 2048, 1, 2048, 512, 512, 2048, 2048]
    - [22, 155.89]
  - - [512, 2048, 1, 4096, 512, 512, 4096, 4096]
    - [86, 175.73]
  - - [512, 2048, 1, 8192, 512, 512, 8192, 8192]
    - [86, 192.66]
  - - [512, 4096, 1, 128, 512, 512, 128, 128]
    - [51, 38.77]
  - - [512, 4096, 1, 256, 512, 512, 256, 256]
    - [11, 69.46]
  - - [512, 4096, 1, 512, 512, 512, 512, 512]
    - [11, 115.83]
  - - [512, 4096, 1, 1024, 512, 512, 1024, 1024]
    - [11, 171.3]
  - - [512, 4096, 1, 2048, 512, 512, 2048, 2048]
    - [51, 226.28]
  - - [512, 4096, 1, 4096, 512, 512, 4096, 4096]
    - [61, 227.52]
  - - [512, 4096, 1, 8192, 512, 512, 8192, 8192]
    - [51, 243.59]
  - - [512, 8192, 1, 128, 512, 512, 128, 128]
    - [55, 56.75]
  - - [512, 8192, 1, 256, 512, 512, 256, 256]
    - [55, 102.86]
  - - [512, 8192, 1, 512, 512, 512, 512, 512]
    - [55, 170.99]
  - - [512, 8192, 1, 1024, 512, 512, 1024, 1024]
    - [56, 224.55]
  - - [512, 8192, 1, 2048, 512, 512, 2048, 2048]
    - [55, 243.47]
  - - [512, 8192, 1, 4096, 512, 512, 4096, 4096]
    - [55, 276.91]
  - - [512, 8192, 1, 8192, 512, 512, 8192, 8192]
    - [55, 286.04]
  - - [1024, 128, 1, 128, 1024, 1024, 128, 128]
    - [29, 4.4]
  - - [1024, 128, 1, 256, 1024, 1024, 256, 256]
    - [79, 8.84]
  - - [1024, 128, 1, 512, 1024, 1024, 512, 512]
    - [76, 15.78]
  - - [1024, 128, 1, 1024, 1024, 1024, 1024, 1024]
    - [77, 26.54]
  - - [1024, 128, 1, 2048, 1024, 1024, 2048, 2048]
    - [76, 40.55]
  - - [1024, 128, 1, 4096, 1024, 1024, 4096, 4096]
    - [80, 54.64]
  - - [1024, 128, 1, 8192, 1024, 1024, 8192, 8192]
    - [82, 66.74]
  - - [1024, 256, 1, 128, 1024, 1024, 128, 128]
    - [30, 8.62]
  - - [1024, 256, 1, 256, 1024, 1024, 256, 256]
    - [75, 16.11]
  - - [1024, 256, 1, 512, 1024, 1024, 512, 512]
    - [73, 28.06]
  - - [1024, 256, 1, 1024, 1024, 1024, 1024, 1024]
    - [72, 46.12]
  - - [1024, 256, 1, 2048, 1024, 1024, 2048, 2048]
    - [70, 67.53]
  - - [1024, 256, 1, 4096, 1024, 1024, 4096, 4096]
    - [70, 88.18]
  - - [1024, 256, 1, 8192, 1024, 1024, 8192, 8192]
    - [71, 101.49]
  - - [1024, 512, 1, 128, 1024, 1024, 128, 128]
    - [26, 15.7]
  - - [1024, 512, 1, 256, 1024, 1024, 256, 256]
    - [25, 28.6]
  - - [1024, 512, 1, 512, 1024, 1024, 512, 512]
    - [67, 47.52]
  - - [1024, 512, 1, 1024, 1024, 1024, 1024, 1024]
    - [67, 74.93]
  - - [1024, 512, 1, 2048, 1024, 1024, 2048, 2048]
    - [67, 103.9]
  - - [1024, 512, 1, 4096, 1024, 1024, 4096, 4096]
    - [68, 127.99]
  - - [1024, 512, 1, 8192, 1024, 1024, 8192, 8192]
    - [93, 141.51]
  - - [1024, 1024, 1, 128, 1024, 1024, 128, 128]
    - [17, 26.04]
  - - [1024, 1024, 1, 256, 1024, 1024, 256, 256]
    - [16, 46.82]
  - - [1024, 1024, 1, 512, 1024, 1024, 512, 512]
    - [19, 78.5]
  - - [1024, 1024, 1, 1024, 1024, 1024, 1024, 1024]
    - [19, 119.37]
  - - [1024, 1024, 1, 2048, 1024, 1024, 2048, 2048]
    - [21, 156.1]
  - - [1024, 1024, 1, 4096, 1024, 1024, 4096, 4096]
    - [90, 173.77]
  - - [1024, 1024, 1, 8192, 1024, 1024, 8192, 8192]
    - [88, 189.85]
  - - [1024, 2048, 1, 128, 1024, 1024, 128, 128]
    - [51, 39.51]
  - - [1024, 2048, 1, 256, 1024, 1024, 256, 256]
    - [11, 69.67]
  - - [1024, 2048, 1, 512, 1024, 1024, 512, 512]
    - [11, 115.94]
  - - [1024, 2048, 1, 1024, 1024, 1024, 1024, 1024]
    - [11, 172.39]
  - - [1024, 2048, 1, 2048, 1024, 1024, 2048, 2048]
    - [51, 220.01]
  - - [1024, 2048, 1, 4096, 1024, 1024, 4096, 4096]
    - [51, 228.42]
  - - [1024, 2048, 1, 8192, 1024, 1024, 8192, 8192]
    - [64, 249.55]
  - - [1024, 4096, 1, 128, 1024, 1024, 128, 128]
    - [10, 55.46]
  - - [1024, 4096, 1, 256, 1024, 1024, 256, 256]
    - [10, 96.61]
  - - [1024, 4096, 1, 512, 1024, 1024, 512, 512]
    - [6, 153.57]
  - - [1024, 4096, 1, 1024, 1024, 1024, 1024, 1024]
    - [6, 205.07]
  - - [1024, 4096, 1, 2048, 1024, 1024, 2048, 2048]
    - [42, 236.85]
  - - [1024, 4096, 1, 4096, 1024, 1024, 4096, 4096]
    - [42, 266.86]
  - - [1024, 4096, 1, 8192, 1024, 1024, 8192, 8192]
    - [44, 254.15]
  - - [1024, 8192, 1, 128, 1024, 1024, 128, 128]
    - [37, 72.38]
  - - [1024, 8192, 1, 256, 1024, 1024, 256, 256]
    - [41, 126.3]
  - - [1024, 8192, 1, 512, 1024, 1024, 512, 512]
    - [36, 191.27]
  - - [1024, 8192, 1, 1024, 1024, 1024, 1024, 1024]
    - [39, 244.77]
  - - [1024, 8192, 1, 2048, 1024, 1024, 2048, 2048]
    - [35, 308.95]
  - - [1024, 8192, 1, 4096, 1024, 1024, 4096, 4096]
    - [38, 335.68]
  - - [1024, 8192, 1, 8192, 1024, 1024, 8192, 8192]
    - [41, 346.05]
  - - [2048, 128, 1, 128, 2048, 2048, 128, 128]
    - [30, 8.83]
  - - [2048, 128, 1, 256, 2048, 2048, 256, 256]
    - [75, 16.4]
  - - [2048, 128, 1, 512, 2048, 2048, 512, 512]
    - [74, 28.31]
  - - [2048, 128, 1, 1024, 2048, 2048, 1024, 1024]
    - [72, 46.09]
  - - [2048, 128, 1, 2048, 2048, 2048, 2048, 2048]
    - [72, 67.23]
  - - [2048, 128, 1, 4096, 2048, 2048, 4096, 4096]
    - [70, 87.22]
  - - [2048, 128, 1, 8192, 2048, 2048, 8192, 8192]
    - [71, 100.13]
  - - [2048, 256, 1, 128, 2048, 2048, 128, 128]
    - [25, 15.04]
  - - [2048, 256, 1, 256, 2048, 2048, 256, 256]
    - [28, 27.6]
  - - [2048, 256, 1, 512, 2048, 2048, 512, 512]
    - [27, 46.47]
  - - [2048, 256, 1, 1024, 2048, 2048, 1024, 1024]
    - [69, 73.13]
  - - [2048, 256, 1, 2048, 2048, 2048, 2048, 2048]
    - [69, 102.02]
  - - [2048, 256, 1, 4096, 2048, 2048, 4096, 4096]
    - [69, 128.01]
  - - [2048, 256, 1, 8192, 2048, 2048, 8192, 8192]
    - [92, 140.93]
  - - [2048, 512, 1, 128, 2048, 2048, 128, 128]
    - [16, 25.49]
  - - [2048, 512, 1, 256, 2048, 2048, 256, 256]
    - [17, 45.79]
  - - [2048, 512, 1, 512, 2048, 2048, 512, 512]
    - [16, 77.99]
  - - [2048, 512, 1, 1024, 2048, 2048, 1024, 1024]
    - [23, 117.84]
  - - [2048, 512, 1, 2048, 2048, 2048, 2048, 2048]
    - [21, 155.78]
  - - [2048, 512, 1, 4096, 2048, 2048, 4096, 4096]
    - [90, 174.66]
  - - [2048, 512, 1, 8192, 2048, 2048, 8192, 8192]
    - [87, 193.79]
  - - [2048, 1024, 1, 128, 2048, 2048, 128, 128]
    - [11, 39.01]
  - - [2048, 1024, 1, 256, 2048, 2048, 256, 256]
    - [11, 69.82]
  - - [2048, 1024, 1, 512, 2048, 2048, 512, 512]
    - [11, 117.07]
  - - [2048, 1024, 1, 1024, 2048, 2048, 1024, 1024]
    - [11, 173.74]
  - - [2048, 1024, 1, 2048, 2048, 2048, 2048, 2048]
    - [52, 219.69]
  - - [2048, 1024, 1, 4096, 2048, 2048, 4096, 4096]
    - [52, 232.06]
  - - [2048, 1024, 1, 8192, 2048, 2048, 8192, 8192]
    - [54, 246.91]
  - - [2048, 2048, 1, 128, 2048, 2048, 128, 128]
    - [7, 52.83]
  - - [2048, 2048, 1, 256, 2048, 2048, 256, 256]
    - [6, 93.65]
  - - [2048, 2048, 1, 512, 2048, 2048, 512, 512]
    - [6, 145.47]
  - - [2048, 2048, 1, 1024, 2048, 2048, 1024, 1024]
    - [44, 196.68]
  - - [2048, 2048, 1, 2048, 2048, 2048, 2048, 2048]
    - [45, 238.96]
  - - [2048, 2048, 1, 4096, 2048, 2048, 4096, 4096]
    - [45, 264.56]
  - - [2048, 2048, 1, 8192, 2048, 2048, 8192, 8192]
    - [45, 255.39]
  - - [2048, 4096, 1, 128, 2048, 2048, 128, 128]
    - [0, 60.04]
  - - [2048, 4096, 1, 256, 2048, 2048, 256, 256]
    - [1, 104.82]
  - - [2048, 4096, 1, 512, 2048, 2048, 512, 512]
    - [1, 160.57]
  - - [2048, 4096, 1, 1024, 2048, 2048, 1024, 1024]
    - [4, 217.11]
  - - [2048, 4096, 1, 2048, 2048, 2048, 2048, 2048]
    - [2, 257.86]
  - - [2048, 4096, 1, 4096, 2048, 2048, 4096, 4096]
    - [36, 270.66]
  - - [2048, 4096, 1, 8192, 2048, 2048, 8192, 8192]
    - [40, 309.82]
  - - [2048, 8192, 1, 128, 2048, 2048, 128, 128]
    - [39, 73.07]
  - - [2048, 8192, 1, 256, 2048, 2048, 256, 256]
    - [39, 126.36]
  - - [2048, 8192, 1, 512, 2048, 2048, 512, 512]
    - [35, 186.98]
  - - [2048, 8192, 1, 1024, 2048, 2048, 1024, 1024]
    - [36, 257.75]
  - - [2048, 8192, 1, 2048, 2048, 2048, 2048, 2048]
    - [34, 300.31]
  - - [2048, 8192, 1, 4096, 2048, 2048, 4096, 4096]
    - [36, 318.43]
  - - [2048, 8192, 1, 8192, 2048, 2048, 8192, 8192]
    - [34, 361.42]
  - - [4096, 128, 1, 128, 4096, 4096, 128, 128]
    - [25, 16.0]
  - - [4096, 128, 1, 256, 4096, 4096, 256, 256]
    - [26, 28.62]
  - - [4096, 128, 1, 512, 4096, 4096, 512, 512]
    - [24, 47.78]
  - - [4096, 128, 1, 1024, 4096, 4096, 1024, 1024]
    - [66, 75.22]
  - - [4096, 128, 1, 2048, 4096, 4096, 2048, 2048]
    - [66, 104.15]
  - - [4096, 128, 1, 4096, 4096, 4096, 4096, 4096]
    - [69, 128.54]
  - - [4096, 128, 1, 8192, 4096, 4096, 8192, 8192]
    - [92, 140.74]
  - - [4096, 256, 1, 128, 4096, 4096, 128, 128]
    - [15, 25.88]
  - - [4096, 256, 1, 256, 4096, 4096, 256, 256]
    - [19, 46.72]
  - - [4096, 256, 1, 512, 4096, 4096, 512, 512]
    - [19, 78.18]
  - - [4096, 256, 1, 1024, 4096, 4096, 1024, 1024]
    - [19, 117.86]
  - - [4096, 256, 1, 2048, 4096, 4096, 2048, 2048]
    - [23, 156.13]
  - - [4096, 256, 1, 4096, 4096, 4096, 4096, 4096]
    - [89, 172.34]
  - - [4096, 256, 1, 8192, 4096, 4096, 8192, 8192]
    - [87, 193.14]
  - - [4096, 512, 1, 128, 4096, 4096, 128, 128]
    - [11, 38.95]
  - - [4096, 512, 1, 256, 4096, 4096, 256, 256]
    - [11, 69.47]
  - - [4096, 512, 1, 512, 4096, 4096, 512, 512]
    - [11, 116.71]
  - - [4096, 512, 1, 1024, 4096, 4096, 1024, 1024]
    - [13, 170.37]
  - - [4096, 512, 1, 2048, 4096, 4096, 2048, 2048]
    - [54, 218.96]
  - - [4096, 512, 1, 4096, 4096, 4096, 4096, 4096]
    - [54, 230.25]
  - - [4096, 512, 1, 8192, 4096, 4096, 8192, 8192]
    - [62, 248.73]
  - - [4096, 1024, 1, 128, 4096, 4096, 128, 128]
    - [10, 55.21]
  - - [4096, 1024, 1, 256, 4096, 4096, 256, 256]
    - [10, 96.16]
  - - [4096, 1024, 1, 512, 4096, 4096, 512, 512]
    - [10, 136.75]
  - - [4096, 1024, 1, 1024, 4096, 4096, 1024, 1024]
    - [43, 197.01]
  - - [4096, 1024, 1, 2048, 4096, 4096, 2048, 2048]
    - [43, 235.7]
  - - [4096, 1024, 1, 4096, 4096, 4096, 4096, 4096]
    - [44, 263.61]
  - - [4096, 1024, 1, 8192, 4096, 4096, 8192, 8192]
    - [61, 257.39]
  - - [4096, 2048, 1, 128, 4096, 4096, 128, 128]
    - [6, 60.41]
  - - [4096, 2048, 1, 256, 4096, 4096, 256, 256]
    - [6, 104.17]
  - - [4096, 2048, 1, 512, 4096, 4096, 512, 512]
    - [4, 158.48]
  - - [4096, 2048, 1, 1024, 4096, 4096, 1024, 1024]
    - [5, 216.69]
  - - [4096, 2048, 1, 2048, 4096, 4096, 2048, 2048]
    - [2, 259.61]
  - - [4096, 2048, 1, 4096, 4096, 4096, 4096, 4096]
    - [47, 275.61]
  - - [4096, 2048, 1, 8192, 4096, 4096, 8192, 8192]
    - [33, 301.4]
  - - [4096, 4096, 1, 128, 4096, 4096, 128, 128]
    - [6, 67.9]
  - - [4096, 4096, 1, 256, 4096, 4096, 256, 256]
    - [6, 117.31]
  - - [4096, 4096, 1, 512, 4096, 4096, 512, 512]
    - [2, 171.46]
  - - [4096, 4096, 1, 1024, 4096, 4096, 1024, 1024]
    - [4, 218.79]
  - - [4096, 4096, 1, 2048, 4096, 4096, 2048, 2048]
    - [40, 244.92]
  - - [4096, 4096, 1, 4096, 4096, 4096, 4096, 4096]
    - [49, 281.3]
  - - [4096, 4096, 1, 8192, 4096, 4096, 8192, 8192]
    - [49, 325.46]
  - - [4096, 8192, 1, 128, 4096, 4096, 128, 128]
    - [39, 79.55]
  - - [4096, 8192, 1, 256, 4096, 4096, 256, 256]
    - [37, 135.6]
  - - [4096, 8192, 1, 512, 4096, 4096, 512, 512]
    - [35, 197.43]
  - - [4096, 8192, 1, 1024, 4096, 4096, 1024, 1024]
    - [40, 248.62]
  - - [4096, 8192, 1, 2048, 4096, 4096, 2048, 2048]
    - [40, 291.06]
  - - [4096, 8192, 1, 4096, 4096, 4096, 4096, 4096]
    - [40, 325.01]
  - - [4096, 8192, 1, 8192, 4096, 4096, 8192, 8192]
    - [40, 377.42]
  - - [8192, 128, 1, 128, 8192, 8192, 128, 128]
    - [20, 26.06]
  - - [8192, 128, 1, 256, 8192, 8192, 256, 256]
    - [18, 46.72]
  - - [8192, 128, 1, 512, 8192, 8192, 512, 512]
    - [19, 78.07]
  - - [8192, 128, 1, 1024, 8192, 8192, 1024, 1024]
    - [21, 113.56]
  - - [8192, 128, 1, 2048, 8192, 8192, 2048, 2048]
    - [21, 154.68]
  - - [8192, 128, 1, 4096, 8192, 8192, 4096, 4096]
    - [87, 167.06]
  - - [8192, 128, 1, 8192, 8192, 8192, 8192, 8192]
    - [87, 185.45]
  - - [8192, 256, 1, 128, 8192, 8192, 128, 128]
    - [13, 37.99]
  - - [8192, 256, 1, 256, 8192, 8192, 256, 256]
    - [12, 68.69]
  - - [8192, 256, 1, 512, 8192, 8192, 512, 512]
    - [14, 113.79]
  - - [8192, 256, 1, 1024, 8192, 8192, 1024, 1024]
    - [14, 169.85]
  - - [8192, 256, 1, 2048, 8192, 8192, 2048, 2048]
    - [53, 210.65]
  - - [8192, 256, 1, 4096, 8192, 8192, 4096, 4096]
    - [63, 225.02]
  - - [8192, 256, 1, 8192, 8192, 8192, 8192, 8192]
    - [54, 243.6]
  - - [8192, 512, 1, 128, 8192, 8192, 128, 128]
    - [9, 52.97]
  - - [8192, 512, 1, 256, 8192, 8192, 256, 256]
    - [8, 92.79]
  - - [8192, 512, 1, 512, 8192, 8192, 512, 512]
    - [59, 150.82]
  - - [8192, 512, 1, 1024, 8192, 8192, 1024, 1024]
    - [58, 214.05]
  - - [8192, 512, 1, 2048, 8192, 8192, 2048, 2048]
    - [45, 235.95]
  - - [8192, 512, 1, 4096, 8192, 8192, 4096, 4096]
    - [59, 307.29]
  - - [8192, 512, 1, 8192, 8192, 8192, 8192, 8192]
    - [58, 313.54]
  - - [8192, 1024, 1, 128, 8192, 8192, 128, 128]
    - [49, 60.91]
  - - [8192, 1024, 1, 256, 8192, 8192, 256, 256]
    - [50, 109.01]
  - - [8192, 1024, 1, 512, 8192, 8192, 512, 512]
    - [50, 174.97]
  - - [8192, 1024, 1, 1024, 8192, 8192, 1024, 1024]
    - [50, 218.76]
  - - [8192, 1024, 1, 2048, 8192, 8192, 2048, 2048]
    - [50, 313.25]
  - - [8192, 1024, 1, 4096, 8192, 8192, 4096, 4096]
    - [50, 358.62]
  - - [8192, 1024, 1, 8192, 8192, 8192, 8192, 8192]
    - [49, 378.98]
  - - [8192, 2048, 1, 128, 8192, 8192, 128, 128]
    - [49, 66.92]
  - - [8192, 2048, 1, 256, 8192, 8192, 256, 256]
    - [50, 117.24]
  - - [8192, 2048, 1, 512, 8192, 8192, 512, 512]
    - [46, 168.29]
  - - [8192, 2048, 1, 1024, 8192, 8192, 1024, 1024]
    - [50, 242.09]
  - - [8192, 2048, 1, 2048, 8192, 8192, 2048, 2048]
    - [49, 304.15]
  - - [8192, 2048, 1, 4096, 8192, 8192, 4096, 4096]
    - [47, 336.23]
  - - [8192, 2048, 1, 8192, 8192, 8192, 8192, 8192]
    - [49, 397.7]
  - - [8192, 4096, 1, 128, 8192, 8192, 128, 128]
    - [49, 70.77]
  - - [8192, 4096, 1, 256, 8192, 8192, 256, 256]
    - [48, 119.22]
  - - [8192, 4096, 1, 512, 8192, 8192, 512, 512]
    - [50, 173.69]
  - - [8192, 4096, 1, 1024, 8192, 8192, 1024, 1024]
    - [49, 232.4]
  - - [8192, 4096, 1, 2048, 8192, 8192, 2048, 2048]
    - [49, 293.02]
  - - [8192, 4096, 1, 4096, 8192, 8192, 4096, 4096]
    - [49, 342.85]
  - - [8192, 4096, 1, 8192, 8192, 8192, 8192, 8192]
    - [49, 416.49]
  - - [8192, 8192, 1, 128, 8192, 8192, 128, 128]
    - [35, 74.52]
  - - [8192, 8192, 1, 256, 8192, 8192, 256, 256]
    - [6, 117.73]
  - - [8192, 8192, 1, 512, 8192, 8192, 512, 512]
    - [3, 173.1]
  - - [8192, 8192, 1, 1024, 8192, 8192, 1024, 1024]
    - [40, 235.45]
  - - [8192, 8192, 1, 2048, 8192, 8192, 2048, 2048]
    - [40, 293.95]
  - - [8192, 8192, 1, 4096, 8192, 8192, 4096, 4096]
    - [49, 354.64]
  - - [8192, 8192, 1, 8192, 8192, 8192, 8192, 8192]
    - [50, 405.59]
  - - [1, 1, 1, 32, 1, 1, 32, 32]
    - [97, 0.0]
- null
- null
- ExperimentalStreamK
- GridBased
