projects/hipblaslt/library/src/amd_detail/rocblaslt/src/Tensile/Logic/asm_full/aquavanjaram/gfx942_228cu/StreamK/aquavanjaram942_Cijk_Alik_Bjlk_B8NB8NS_BH_Bias_HAS_SAV_UserArgs.yaml
- {MinimumRequiredVersion: 4.33.0}
- aquavanjaram942
- {Architecture: gfx942, CUCount: 228}
- [Device 0049, Device 0050]
    SolutionIndex: 0
    SolutionNameMin: Cijk_Alik_Bjlk_B8NB8NS_BH_Bias_HAS_SAV_UserArgs_MT256x256x64_MI16x16x1_SN_LDSB1_CLR1_GRVWA8_GRVWB16_GSU0_GSUC0_GSUWGMRR0_K1_LBSPPA512_LBSPPB2048_LPA8_LPB0_LRVW8_MIWT8_8_PLR1_SU0_SUM0_SUS64_VWA8_VWB8_WGM1_WGMXCC1_WGMXCCGn1
    SolutionIndex: 1
    SolutionNameMin: Cijk_Alik_Bjlk_B8NB8NS_BH_Bias_HAS_SAV_UserArgs_MT256x256x64_MI16x16x1_SN_LDSB1_CLR1_GRVWA16_GRVWB16_GSU0_GSUC0_GSUWGMRR0_K1_LBSPPA512_LBSPPB2048_LPA16_LPB0_LRVW8_MIWT8_8_PLR1_SU0_SUM0_SUS64_VWA8_VWB8_WGM1_WGMXCC1_WGMXCCGn1
    SolutionIndex: 2
    SolutionNameMin: Cijk_Alik_Bjlk_B8NB8NS_BH_Bias_HAS_SAV_UserArgs_MT256x256x64_MI16x16x1_SN_LDSB1_CLR1_GRVWA8_GRVWB16_GSU0_GSUC0_GSUWGMRR0_K1_LBSPPA512_LBSPPB2048_LPA8_LPB0_LRVW8_MIWT8_8_PLR1_SU0_SUM0_SUS64_VWA8_VWB8_WGM4_WGMXCC1_WGMXCCGn1
    SolutionIndex: 3
    SolutionNameMin: Cijk_Alik_Bjlk_B8NB8NS_BH_Bias_HAS_SAV_UserArgs_MT256x256x64_MI16x16x1_SN_LDSB1_CLR1_GRVWA8_GRVWB16_GSU0_GSUC0_GSUWGMRR0_K1_LBSPPA512_LBSPPB2048_LPA8_LPB0_LRVW8_MIWT8_8_PLR1_SU0_SUM0_SUS64_VWA8_VWB8_WGM6_WGMXCC1_WGMXCCGn1
    SolutionIndex: 4
    SolutionNameMin: Cijk_Alik_Bjlk_B8NB8NS_BH_Bias_HAS_SAV_UserArgs_MT256x256x64_MI16x16x1_SN_LDSB1_CLR1_GRVWA16_GRVWB16_GSU0_GSUC0_GSUWGMRR0_K1_LBSPPA512_LBSPPB2048_LPA16_LPB0_LRVW8_MIWT8_8_PLR1_SU0_SUM0_SUS64_VWA8_VWB8_WGM6_WGMXCC1_WGMXCCGn1
    SolutionIndex: 5
    SolutionNameMin: Cijk_Alik_Bjlk_B8NB8NS_BH_Bias_HAS_SAV_UserArgs_MT256x256x64_MI16x16x1_SN_LDSB1_CLR1_GRVWA8_GRVWB16_GSU0_GSUC0_GSUWGMRR0_K1_LBSPPA512_LBSPPB2048_LPA8_LPB0_LRVW8_MIWT8_8_PLR1_SU0_SUM0_SUS64_VWA8_VWB8_WGM8_WGMXCC1_WGMXCCGn1
    SolutionIndex: 6
    SolutionNameMin: Cijk_Alik_Bjlk_B8NB8NS_BH_Bias_HAS_SAV_UserArgs_MT256x256x64_MI16x16x1_SN_LDSB1_CLR1_GRVWA16_GRVWB16_GSU0_GSUC0_GSUWGMRR0_K1_LBSPPA512_LBSPPB2048_LPA16_LPB0_LRVW8_MIWT8_8_PLR1_SU0_SUM0_SUS64_VWA8_VWB8_WGM8_WGMXCC1_WGMXCCGn1
    SolutionIndex: 7
    SolutionNameMin: Cijk_Alik_Bjlk_B8NB8NS_BH_Bias_HAS_SAV_UserArgs_MT128x256x64_MI16x16x1_SN_LDSB1_CLR1_GRVWA16_GRVWB16_GSU0_GSUC0_GSUWGMRR0_K1_LBSPPA256_LBSPPB2048_LPA16_LPB0_LRVW8_MIWT4_8_PLR1_SU0_SUM0_SUS64_VWA4_VWB8_WGM4_WGMXCC1_WGMXCCGn1
    SolutionIndex: 8
    SolutionNameMin: Cijk_Alik_Bjlk_B8NB8NS_BH_Bias_HAS_SAV_UserArgs_MT128x256x64_MI16x16x1_SN_LDSB1_CLR1_GRVWA16_GRVWB16_GSU0_GSUC0_GSUWGMRR0_K1_LBSPPA256_LBSPPB2048_LPA16_LPB0_LRVW8_MIWT4_8_PLR1_SU0_SUM0_SUS64_VWA4_VWB8_WGM6_WGMXCC1_WGMXCCGn1
    SolutionIndex: 9
    SolutionNameMin: Cijk_Alik_Bjlk_B8NB8NS_BH_Bias_HAS_SAV_UserArgs_MT128x256x64_MI16x16x1_SN_LDSB1_CLR1_GRVWA16_GRVWB16_GSU0_GSUC0_GSUWGMRR0_K1_LBSPPA256_LBSPPB2048_LPA16_LPB0_LRVW8_MIWT4_8_PLR1_SU0_SUM0_SUS64_VWA4_VWB8_WGM8_WGMXCC1_WGMXCCGn1
    SolutionIndex: 10
    SolutionNameMin: Cijk_Alik_Bjlk_B8NB8NS_BH_Bias_HAS_SAV_UserArgs_MT256x128x64_MI16x16x1_SN_LDSB1_CLR1_GRVWA8_GRVWB8_GSU0_GSUC0_GSUWGMRR0_K1_LBSPPA512_LBSPPB1024_LPA8_LPB64_LRVW8_MIWT8_4_PLR1_SU0_SUM0_SUS64_VWA8_VWB4_WGM1_WGMXCC1_WGMXCCGn1
    SolutionIndex: 11
    SolutionNameMin: Cijk_Alik_Bjlk_B8NB8NS_BH_Bias_HAS_SAV_UserArgs_MT256x128x64_MI16x16x1_SN_LDSB1_CLR1_GRVWA16_GRVWB8_GSU0_GSUC0_GSUWGMRR0_K1_LBSPPA512_LBSPPB1024_LPA16_LPB64_LRVW8_MIWT8_4_PLR1_SU0_SUM0_SUS64_VWA8_VWB4_WGM1_WGMXCC1_WGMXCCGn1
    SolutionIndex: 12
    SolutionNameMin: Cijk_Alik_Bjlk_B8NB8NS_BH_Bias_HAS_SAV_UserArgs_MT256x128x64_MI16x16x1_SN_LDSB1_CLR1_GRVWA8_GRVWB16_GSU0_GSUC0_GSUWGMRR0_K1_LBSPPA512_LBSPPB1024_LPA8_LPB64_LRVW8_MIWT8_4_PLR1_SU0_SUM0_SUS64_VWA8_VWB4_WGM1_WGMXCC1_WGMXCCGn1
    SolutionIndex: 13
    SolutionNameMin: Cijk_Alik_Bjlk_B8NB8NS_BH_Bias_HAS_SAV_UserArgs_MT256x128x64_MI16x16x1_SN_LDSB1_CLR1_GRVWA8_GRVWB16_GSU0_GSUC0_GSUWGMRR0_K1_LBSPPA512_LBSPPB1024_LPA8_LPB64_LRVW8_MIWT8_4_PLR1_SU0_SUM0_SUS64_VWA8_VWB4_WGM4_WGMXCC1_WGMXCCGn1
    SolutionIndex: 14
    SolutionNameMin: Cijk_Alik_Bjlk_B8NB8NS_BH_Bias_HAS_SAV_UserArgs_MT256x128x64_MI16x16x1_SN_LDSB1_CLR1_GRVWA8_GRVWB16_GSU0_GSUC0_GSUWGMRR0_K1_LBSPPA512_LBSPPB1024_LPA8_LPB64_LRVW8_MIWT8_4_PLR1_SU0_SUM0_SUS64_VWA8_VWB4_WGM6_WGMXCC1_WGMXCCGn1
    SolutionIndex: 15
    SolutionNameMin: Cijk_Alik_Bjlk_B8NB8NS_BH_Bias_HAS_SAV_UserArgs_MT256x128x64_MI16x16x1_SN_LDSB1_CLR1_GRVWA8_GRVWB16_GSU0_GSUC0_GSUWGMRR0_K1_LBSPPA512_LBSPPB1024_LPA8_LPB64_LRVW8_MIWT8_4_PLR1_SU0_SUM0_SUS64_VWA8_VWB4_WGM8_WGMXCC1_WGMXCCGn1
    SolutionIndex: 16
    SolutionNameMin: Cijk_Alik_Bjlk_B8NB8NS_BH_Bias_HAS_SAV_UserArgs_MT128x128x64_MI16x16x1_SN_LDSB1_CLR1_GRVWA8_GRVWB16_GSU0_GSUC0_GSUWGMRR0_K1_LBSPPA512_LBSPPB1024_LPA8_LPB32_LRVW8_MIWT8_2_PLR1_SU0_SUM0_SUS64_VWA8_VWB2_WGM1_WGMXCC1_WGMXCCGn1
    SolutionIndex: 17
    SolutionNameMin: Cijk_Alik_Bjlk_B8NB8NS_BH_Bias_HAS_SAV_UserArgs_MT128x64x64_MI16x16x1_SN_LDSB0_CLR1_GRVWA8_GRVWB8_GSU0_GSUC0_GSUWGMRR0_K1_LBSPPA512_LBSPPB512_LPA8_LPB16_LRVW8_MIWT8_1_PLR1_SU0_SUM0_SUS64_VWA8_VWB1_WGM1_WGMXCC1_WGMXCCGn1
    SolutionIndex: 18
    SolutionNameMin: Cijk_Alik_Bjlk_B8NB8NS_BH_Bias_HAS_SAV_UserArgs_MT128x128x64_MI16x16x1_SN_LDSB1_CLR1_GRVWA16_GRVWB8_GSU0_GSUC0_GSUWGMRR0_K1_LBSPPA256_LBSPPB1024_LPA16_LPB64_LRVW8_MIWT4_4_PLR1_SU0_SUM0_SUS64_VWA4_VWB4_WGM1_WGMXCC1_WGMXCCGn1
    SolutionIndex: 19
    SolutionNameMin: Cijk_Alik_Bjlk_B8NB8NS_BH_Bias_HAS_SAV_UserArgs_MT128x128x64_MI16x16x1_SN_LDSB1_CLR1_GRVWA16_GRVWB16_GSU0_GSUC0_GSUWGMRR0_K1_LBSPPA256_LBSPPB1024_LPA16_LPB64_LRVW8_MIWT4_4_PLR1_SU0_SUM0_SUS64_VWA4_VWB4_WGM1_WGMXCC1_WGMXCCGn1
    SolutionIndex: 20
    SolutionNameMin: Cijk_Alik_Bjlk_B8NB8NS_BH_Bias_HAS_SAV_UserArgs_MT64x128x64_MI16x16x1_SN_LDSB0_CLR1_GRVWA8_GRVWB16_GSU0_GSUC0_GSUWGMRR0_K1_LBSPPA128_LBSPPB1024_LPA8_LPB64_LRVW8_MIWT2_4_PLR1_SU0_SUM0_SUS64_VWA2_VWB4_WGM1_WGMXCC1_WGMXCCGn1
    SolutionIndex: 21
    SolutionNameMin: Cijk_Alik_Bjlk_B8NB8NS_BH_Bias_HAS_SAV_UserArgs_MT128x64x64_MI16x16x1_SN_LDSB0_CLR1_GRVWA16_GRVWB8_GSU0_GSUC0_GSUWGMRR0_K1_LBSPPA256_LBSPPB512_LPA16_LPB32_LRVW8_MIWT4_2_PLR1_SU0_SUM0_SUS64_VWA4_VWB2_WGM1_WGMXCC1_WGMXCCGn1
    SolutionIndex: 22
    SolutionNameMin: Cijk_Alik_Bjlk_B8NB8NS_BH_Bias_HAS_SAV_UserArgs_MT128x64x64_MI16x16x1_SN_LDSB0_CLR1_GRVWA8_GRVWB16_GSU0_GSUC0_GSUWGMRR0_K1_LBSPPA256_LBSPPB512_LPA8_LPB32_LRVW8_MIWT4_2_PLR1_SU0_SUM0_SUS64_VWA4_VWB2_WGM1_WGMXCC1_WGMXCCGn1
    SolutionIndex: 23
    SolutionNameMin: Cijk_Alik_Bjlk_B8NB8NS_BH_Bias_HAS_SAV_UserArgs_MT128x64x64_MI16x16x1_SN_LDSB0_CLR1_GRVWA16_GRVWB16_GSU0_GSUC0_GSUWGMRR0_K1_LBSPPA256_LBSPPB512_LPA16_LPB32_LRVW8_MIWT4_2_PLR1_SU0_SUM0_SUS64_VWA4_VWB2_WGM1_WGMXCC1_WGMXCCGn1
    SolutionIndex: 24
    SolutionNameMin: Cijk_Alik_Bjlk_B8NB8NS_BH_Bias_HAS_SAV_UserArgs_MT128x64x64_MI16x16x1_SN_LDSB0_CLR1_GRVWA8_GRVWB16_GSU0_GSUC0_GSUWGMRR0_K1_LBSPPA256_LBSPPB512_LPA8_LPB32_LRVW8_MIWT4_2_PLR1_SU0_SUM0_SUS64_VWA4_VWB2_WGM4_WGMXCC1_WGMXCCGn1
    SolutionIndex: 25
    SolutionNameMin: Cijk_Alik_Bjlk_B8NB8NS_BH_Bias_HAS_SAV_UserArgs_MT128x64x64_MI16x16x1_SN_LDSB0_CLR1_GRVWA8_GRVWB16_GSU0_GSUC0_GSUWGMRR0_K1_LBSPPA256_LBSPPB512_LPA8_LPB32_LRVW8_MIWT4_2_PLR1_SU0_SUM0_SUS64_VWA4_VWB2_WGM6_WGMXCC1_WGMXCCGn1
    SolutionIndex: 26
    SolutionNameMin: Cijk_Alik_Bjlk_B8NB8NS_BH_Bias_HAS_SAV_UserArgs_MT64x64x64_MI16x16x1_SN_LDSB0_CLR1_GRVWA8_GRVWB8_GSU0_GSUC0_GSUWGMRR0_K1_LBSPPA128_LBSPPB512_LPA8_LPB32_LRVW8_MIWT2_2_PLR1_SU0_SUM0_SUS64_VWA2_VWB2_WGM1_WGMXCC1_WGMXCCGn1
    SolutionIndex: 27
    SolutionNameMin: Cijk_Alik_Bjlk_B8NB8NS_BH_Bias_HAS_SAV_UserArgs_MT64x64x64_MI16x16x1_SN_LDSB0_CLR1_GRVWA16_GRVWB8_GSU0_GSUC0_GSUWGMRR0_K1_LBSPPA128_LBSPPB512_LPA16_LPB32_LRVW8_MIWT2_2_PLR1_SU0_SUM0_SUS64_VWA2_VWB2_WGM1_WGMXCC1_WGMXCCGn1
    SolutionIndex: 28
    SolutionNameMin: Cijk_Alik_Bjlk_B8NB8NS_BH_Bias_HAS_SAV_UserArgs_MT64x64x64_MI16x16x1_SN_LDSB0_CLR1_GRVWA16_GRVWB8_GSU0_GSUC0_GSUWGMRR0_K1_LBSPPA128_LBSPPB512_LPA16_LPB32_LRVW8_MIWT2_2_PLR1_SU0_SUM0_SUS64_VWA2_VWB2_WGM4_WGMXCC1_WGMXCCGn1
    SolutionIndex: 29
    SolutionNameMin: Cijk_Alik_Bjlk_B8NB8NS_BH_Bias_HAS_SAV_UserArgs_MT64x32x64_MI16x16x1_SN_LDSB0_CLR1_GRVWA8_GRVWB8_GSU0_GSUC0_GSUWGMRR0_K1_LBSPPA128_LBSPPB256_LPA8_LPB16_LRVW8_MIWT2_1_PLR1_SU0_SUM0_SUS64_VWA2_VWB1_WGM1_WGMXCC1_WGMXCCGn1
    SolutionIndex: 30
    SolutionNameMin: Cijk_Alik_Bjlk_B8NB8NS_BH_Bias_HAS_SAV_UserArgs_MT64x32x64_MI16x16x1_SN_LDSB0_CLR1_GRVWA16_GRVWB8_GSU0_GSUC0_GSUWGMRR0_K1_LBSPPA128_LBSPPB256_LPA16_LPB16_LRVW8_MIWT2_1_PLR1_SU0_SUM0_SUS64_VWA2_VWB1_WGM1_WGMXCC1_WGMXCCGn1
    SolutionIndex: 31
    SolutionNameMin: Cijk_Alik_Bjlk_B8NB8NS_BH_Bias_HAS_SAV_UserArgs_MT32x32x64_MI16x16x1_SN_LDSB0_CLR1_GRVWA8_GRVWB8_GSU0_GSUC0_GSUWGMRR0_K1_LBSPPA128_LBSPPB256_LPA8_LPB16_LRVW8_MIWT1_1_PLR1_SU0_SUM0_SUS64_VWA1_VWB1_WGM1_WGMXCC1_WGMXCCGn1
    SolutionIndex: 32
    SolutionNameMin: Cijk_Alik_Bjlk_B8NB8NS_BH_Bias_HAS_SAV_UserArgs_MT32x32x64_MI16x16x1_SN_LDSB0_CLR1_GRVWA8_GRVWB8_GSU0_GSUC0_GSUWGMRR0_K1_LBSPPA128_LBSPPB256_LPA8_LPB16_LRVW8_MIWT1_1_PLR1_SU0_SUM0_SUS64_VWA1_VWB1_WGM4_WGMXCC1_WGMXCCGn1
    SolutionIndex: 33
    SolutionNameMin: Cijk_Alik_Bjlk_B8NB8NS_BH_Bias_HAS_SAV_UserArgs_MT128x256x128_MI16x16x1_SN_LDSB1_CLR1_GRVWA8_GRVWB16_GSU0_GSUC0_GSUWGMRR0_K1_LBSPPA512_LBSPPB2048_LPA8_LPB0_LRVW8_MIWT4_8_PLR1_SU0_SUM0_SUS128_VWA4_VWB8_WGM1_WGMXCC1_WGMXCCGn1
    SolutionIndex: 34
    SolutionNameMin: Cijk_Alik_Bjlk_B8NB8NS_BH_Bias_HAS_SAV_UserArgs_MT128x256x128_MI16x16x1_SN_LDSB1_CLR1_GRVWA16_GRVWB16_GSU0_GSUC0_GSUWGMRR0_K1_LBSPPA512_LBSPPB2048_LPA16_LPB0_LRVW8_MIWT4_8_PLR1_SU0_SUM0_SUS128_VWA4_VWB8_WGM1_WGMXCC1_WGMXCCGn1
    SolutionIndex: 35
    SolutionNameMin: Cijk_Alik_Bjlk_B8NB8NS_BH_Bias_HAS_SAV_UserArgs_MT128x256x128_MI16x16x1_SN_LDSB1_CLR1_GRVWA8_GRVWB16_GSU0_GSUC0_GSUWGMRR0_K1_LBSPPA512_LBSPPB2048_LPA8_LPB0_LRVW8_MIWT4_8_PLR1_SU0_SUM0_SUS128_VWA4_VWB8_WGM6_WGMXCC1_WGMXCCGn1
    SolutionIndex: 36
    SolutionNameMin: Cijk_Alik_Bjlk_B8NB8NS_BH_Bias_HAS_SAV_UserArgs_MT128x256x128_MI16x16x1_SN_LDSB1_CLR1_GRVWA16_GRVWB16_GSU0_GSUC0_GSUWGMRR0_K1_LBSPPA512_LBSPPB2048_LPA16_LPB0_LRVW8_MIWT4_8_PLR1_SU0_SUM0_SUS128_VWA4_VWB8_WGM6_WGMXCC1_WGMXCCGn1
    SolutionIndex: 37
    SolutionNameMin: Cijk_Alik_Bjlk_B8NB8NS_BH_Bias_HAS_SAV_UserArgs_MT128x256x128_MI16x16x1_SN_LDSB1_CLR1_GRVWA8_GRVWB16_GSU0_GSUC0_GSUWGMRR0_K1_LBSPPA512_LBSPPB2048_LPA8_LPB0_LRVW8_MIWT4_8_PLR1_SU0_SUM0_SUS128_VWA4_VWB8_WGM8_WGMXCC1_WGMXCCGn1
    SolutionIndex: 38
    SolutionNameMin: Cijk_Alik_Bjlk_B8NB8NS_BH_Bias_HAS_SAV_UserArgs_MT256x128x128_MI16x16x1_SN_LDSB1_CLR1_GRVWA8_GRVWB16_GSU0_GSUC0_GSUWGMRR0_K1_LBSPPA1024_LBSPPB1024_LPA8_LPB64_LRVW8_MIWT8_4_PLR1_SU0_SUM0_SUS128_VWA8_VWB4_WGM1_WGMXCC1_WGMXCCGn1
    SolutionIndex: 39
    SolutionNameMin: Cijk_Alik_Bjlk_B8NB8NS_BH_Bias_HAS_SAV_UserArgs_MT256x128x128_MI16x16x1_SN_LDSB1_CLR1_GRVWA8_GRVWB16_GSU0_GSUC0_GSUWGMRR0_K1_LBSPPA1024_LBSPPB1024_LPA8_LPB64_LRVW8_MIWT8_4_PLR1_SU0_SUM0_SUS128_VWA8_VWB4_WGM4_WGMXCC1_WGMXCCGn1
    SolutionIndex: 40
    SolutionNameMin: Cijk_Alik_Bjlk_B8NB8NS_BH_Bias_HAS_SAV_UserArgs_MT256x128x128_MI16x16x1_SN_LDSB1_CLR1_GRVWA8_GRVWB16_GSU0_GSUC0_GSUWGMRR0_K1_LBSPPA1024_LBSPPB1024_LPA8_LPB64_LRVW8_MIWT8_4_PLR1_SU0_SUM0_SUS128_VWA8_VWB4_WGM8_WGMXCC1_WGMXCCGn1
    SolutionIndex: 41
    SolutionNameMin: Cijk_Alik_Bjlk_B8NB8NS_BH_Bias_HAS_SAV_UserArgs_MT144x256x128_MI16x16x1_SN_LDSB1_CLR1_GRVWA8_GRVWB16_GSU0_GSUC0_GSUWGMRR0_K1_LBSPPA128_LBSPPB2048_LPA8_LPB64_LRVW8_MIWT9_4_PLR1_SU0_SUM0_SUS128_VWA1_VWB4_WGM4_WGMXCC1_WGMXCCGn1
    SolutionIndex: 42
    SolutionNameMin: Cijk_Alik_Bjlk_B8NB8NS_BH_Bias_HAS_SAV_UserArgs_MT144x256x128_MI16x16x1_SN_LDSB1_CLR1_GRVWA8_GRVWB16_GSU0_GSUC0_GSUWGMRR0_K1_LBSPPA128_LBSPPB2048_LPA8_LPB64_LRVW8_MIWT9_4_PLR1_SU0_SUM0_SUS128_VWA1_VWB4_WGM6_WGMXCC1_WGMXCCGn1
    SolutionIndex: 43
    SolutionNameMin: Cijk_Alik_Bjlk_B8NB8NS_BH_Bias_HAS_SAV_UserArgs_MT144x256x128_MI16x16x1_SN_LDSB1_CLR1_GRVWA8_GRVWB8_GSU0_GSUC0_GSUWGMRR0_K1_LBSPPA128_LBSPPB2048_LPA8_LPB64_LRVW8_MIWT9_4_PLR1_SU0_SUM0_SUS128_VWA1_VWB4_WGM8_WGMXCC1_WGMXCCGn1
    SolutionIndex: 44
    SolutionNameMin: Cijk_Alik_Bjlk_B8NB8NS_BH_Bias_HAS_SAV_UserArgs_MT144x256x128_MI16x16x1_SN_LDSB1_CLR1_GRVWA8_GRVWB16_GSU0_GSUC0_GSUWGMRR0_K1_LBSPPA128_LBSPPB2048_LPA8_LPB64_LRVW8_MIWT9_4_PLR1_SU0_SUM0_SUS128_VWA1_VWB4_WGM8_WGMXCC1_WGMXCCGn1
    SolutionIndex: 45
    SolutionNameMin: Cijk_Alik_Bjlk_B8NB8NS_BH_Bias_HAS_SAV_UserArgs_MT144x128x128_MI16x16x1_SN_LDSB1_CLR1_GRVWA8_GRVWB16_GSU0_GSUC0_GSUWGMRR0_K1_LBSPPA128_LBSPPB1024_LPA8_LPB32_LRVW8_MIWT9_2_PLR1_SU0_SUM0_SUS128_VWA1_VWB2_WGM4_WGMXCC1_WGMXCCGn1
    SolutionIndex: 46
    SolutionNameMin: Cijk_Alik_Bjlk_B8NB8NS_BH_Bias_HAS_SAV_UserArgs_MT144x128x128_MI16x16x1_SN_LDSB1_CLR1_GRVWA8_GRVWB16_GSU0_GSUC0_GSUWGMRR0_K1_LBSPPA128_LBSPPB1024_LPA8_LPB32_LRVW8_MIWT9_2_PLR1_SU0_SUM0_SUS128_VWA1_VWB2_WGM6_WGMXCC1_WGMXCCGn1
    SolutionIndex: 47
    SolutionNameMin: Cijk_Alik_Bjlk_B8NB8NS_BH_Bias_HAS_SAV_UserArgs_MT144x128x128_MI16x16x1_SN_LDSB1_CLR1_GRVWA8_GRVWB16_GSU0_GSUC0_GSUWGMRR0_K1_LBSPPA128_LBSPPB1024_LPA8_LPB32_LRVW8_MIWT9_2_PLR1_SU0_SUM0_SUS128_VWA1_VWB2_WGM8_WGMXCC1_WGMXCCGn1
    SolutionIndex: 48
    SolutionNameMin: Cijk_Alik_Bjlk_B8NB8NS_BH_Bias_HAS_SAV_UserArgs_MT128x128x128_MI16x16x1_SN_LDSB1_CLR1_GRVWA16_GRVWB8_GSU0_GSUC0_GSUWGMRR0_K1_LBSPPA512_LBSPPB1024_LPA16_LPB64_LRVW8_MIWT4_4_PLR1_SU0_SUM0_SUS128_VWA4_VWB4_WGM1_WGMXCC1_WGMXCCGn1
    SolutionIndex: 49
    SolutionNameMin: Cijk_Alik_Bjlk_B8NB8NS_BH_Bias_HAS_SAV_UserArgs_MT128x128x128_MI16x16x1_SN_LDSB1_CLR1_GRVWA16_GRVWB16_GSU0_GSUC0_GSUWGMRR0_K1_LBSPPA512_LBSPPB1024_LPA16_LPB64_LRVW8_MIWT4_4_PLR1_SU0_SUM0_SUS128_VWA4_VWB4_WGM1_WGMXCC1_WGMXCCGn1
    SolutionIndex: 50
    SolutionNameMin: Cijk_Alik_Bjlk_B8NB8NS_BH_Bias_HAS_SAV_UserArgs_MT128x128x128_MI16x16x1_SN_LDSB1_CLR1_GRVWA16_GRVWB16_GSU0_GSUC0_GSUWGMRR0_K1_LBSPPA512_LBSPPB1024_LPA16_LPB64_LRVW8_MIWT4_4_PLR1_SU0_SUM0_SUS128_VWA4_VWB4_WGM4_WGMXCC1_WGMXCCGn1
    SolutionIndex: 51
    SolutionNameMin: Cijk_Alik_Bjlk_B8NB8NS_BH_Bias_HAS_SAV_UserArgs_MT128x128x128_MI16x16x1_SN_LDSB1_CLR1_GRVWA16_GRVWB16_GSU0_GSUC0_GSUWGMRR0_K1_LBSPPA512_LBSPPB1024_LPA16_LPB64_LRVW8_MIWT4_4_PLR1_SU0_SUM0_SUS128_VWA4_VWB4_WGM6_WGMXCC1_WGMXCCGn1
    SolutionIndex: 52
    SolutionNameMin: Cijk_Alik_Bjlk_B8NB8NS_BH_Bias_HAS_SAV_UserArgs_MT128x128x128_MI16x16x1_SN_LDSB1_CLR1_GRVWA16_GRVWB16_GSU0_GSUC0_GSUWGMRR0_K1_LBSPPA512_LBSPPB1024_LPA16_LPB64_LRVW8_MIWT4_4_PLR1_SU0_SUM0_SUS128_VWA4_VWB4_WGM8_WGMXCC1_WGMXCCGn1
    SolutionIndex: 53
    SolutionNameMin: Cijk_Alik_Bjlk_B8NB8NS_BH_Bias_HAS_SAV_UserArgs_MT64x128x128_MI16x16x1_SN_LDSB1_CLR1_GRVWA8_GRVWB16_GSU0_GSUC0_GSUWGMRR0_K1_LBSPPA256_LBSPPB1024_LPA8_LPB64_LRVW8_MIWT2_4_PLR1_SU0_SUM0_SUS128_VWA2_VWB4_WGM1_WGMXCC1_WGMXCCGn1
    SolutionIndex: 54
    SolutionNameMin: Cijk_Alik_Bjlk_B8NB8NS_BH_Bias_HAS_SAV_UserArgs_MT128x64x128_MI16x16x1_SN_LDSB1_CLR1_GRVWA16_GRVWB16_GSU0_GSUC0_GSUWGMRR0_K1_LBSPPA512_LBSPPB512_LPA16_LPB32_LRVW8_MIWT4_2_PLR1_SU0_SUM0_SUS128_VWA4_VWB2_WGM8_WGMXCC1_WGMXCCGn1
    SolutionIndex: 55
    SolutionNameMin: Cijk_Alik_Bjlk_B8NB8NS_BH_Bias_HAS_SAV_UserArgs_MT64x64x128_MI16x16x1_SN_LDSB1_CLR1_GRVWA16_GRVWB8_GSU0_GSUC0_GSUWGMRR0_K1_LBSPPA256_LBSPPB512_LPA16_LPB32_LRVW8_MIWT2_2_PLR1_SU0_SUM0_SUS128_VWA2_VWB2_WGM1_WGMXCC1_WGMXCCGn1
    SolutionIndex: 56
    SolutionNameMin: Cijk_Alik_Bjlk_B8NB8NS_BH_Bias_HAS_SAV_UserArgs_MT64x64x128_MI16x16x1_SN_LDSB1_CLR1_GRVWA8_GRVWB16_GSU0_GSUC0_GSUWGMRR0_K1_LBSPPA256_LBSPPB512_LPA8_LPB32_LRVW8_MIWT2_2_PLR1_SU0_SUM0_SUS128_VWA2_VWB2_WGM1_WGMXCC1_WGMXCCGn1
    SolutionIndex: 57
    SolutionNameMin: Cijk_Alik_Bjlk_B8NB8NS_BH_Bias_HAS_SAV_UserArgs_MT64x64x128_MI16x16x1_SN_LDSB1_CLR1_GRVWA16_GRVWB16_GSU0_GSUC0_GSUWGMRR0_K1_LBSPPA256_LBSPPB512_LPA16_LPB32_LRVW8_MIWT2_2_PLR1_SU0_SUM0_SUS128_VWA2_VWB2_WGM1_WGMXCC1_WGMXCCGn1
    SolutionIndex: 58
    SolutionNameMin: Cijk_Alik_Bjlk_B8NB8NS_BH_Bias_HAS_SAV_UserArgs_MT32x64x128_MI16x16x1_SN_LDSB0_CLR1_GRVWA8_GRVWB8_GSU0_GSUC0_GSUWGMRR0_K1_LBSPPA128_LBSPPB512_LPA8_LPB32_LRVW8_MIWT1_2_PLR1_SU0_SUM0_SUS128_VWA1_VWB2_WGM1_WGMXCC1_WGMXCCGn1
    SolutionIndex: 59
    SolutionNameMin: Cijk_Alik_Bjlk_B8NB8NS_BH_Bias_HAS_SAV_UserArgs_MT32x64x128_MI16x16x1_SN_LDSB0_CLR1_GRVWA8_GRVWB16_GSU0_GSUC0_GSUWGMRR0_K1_LBSPPA128_LBSPPB512_LPA8_LPB32_LRVW8_MIWT1_2_PLR1_SU0_SUM0_SUS128_VWA1_VWB2_WGM4_WGMXCC1_WGMXCCGn1
    SolutionIndex: 60
    SolutionNameMin: Cijk_Alik_Bjlk_B8NB8NS_BH_Bias_HAS_SAV_UserArgs_MT64x32x128_MI16x16x1_SN_LDSB0_CLR1_GRVWA8_GRVWB8_GSU0_GSUC0_GSUWGMRR0_K1_LBSPPA256_LBSPPB256_LPA8_LPB16_LRVW8_MIWT2_1_PLR1_SU0_SUM0_SUS128_VWA2_VWB1_WGM1_WGMXCC1_WGMXCCGn1
    SolutionIndex: 61
    SolutionNameMin: Cijk_Alik_Bjlk_B8NB8NS_BH_Bias_HAS_SAV_UserArgs_MT64x32x128_MI16x16x1_SN_LDSB0_CLR1_GRVWA16_GRVWB8_GSU0_GSUC0_GSUWGMRR0_K1_LBSPPA256_LBSPPB256_LPA16_LPB16_LRVW8_MIWT2_1_PLR1_SU0_SUM0_SUS128_VWA2_VWB1_WGM1_WGMXCC1_WGMXCCGn1
    SolutionIndex: 62
    SolutionNameMin: Cijk_Alik_Bjlk_B8NB8NS_BH_Bias_HAS_SAV_UserArgs_MT64x32x128_MI16x16x1_SN_LDSB0_CLR1_GRVWA8_GRVWB16_GSU0_GSUC0_GSUWGMRR0_K1_LBSPPA256_LBSPPB256_LPA8_LPB16_LRVW8_MIWT2_1_PLR1_SU0_SUM0_SUS128_VWA2_VWB1_WGM1_WGMXCC1_WGMXCCGn1
    SolutionIndex: 63
    SolutionNameMin: Cijk_Alik_Bjlk_B8NB8NS_BH_Bias_HAS_SAV_UserArgs_MT64x32x128_MI16x16x1_SN_LDSB0_CLR1_GRVWA16_GRVWB16_GSU0_GSUC0_GSUWGMRR0_K1_LBSPPA256_LBSPPB256_LPA16_LPB16_LRVW8_MIWT2_1_PLR1_SU0_SUM0_SUS128_VWA2_VWB1_WGM1_WGMXCC1_WGMXCCGn1
    SolutionIndex: 64
    SolutionNameMin: Cijk_Alik_Bjlk_B8NB8NS_BH_Bias_HAS_SAV_UserArgs_MT64x32x128_MI16x16x1_SN_LDSB0_CLR1_GRVWA8_GRVWB16_GSU0_GSUC0_GSUWGMRR0_K1_LBSPPA256_LBSPPB256_LPA8_LPB16_LRVW8_MIWT2_1_PLR1_SU0_SUM0_SUS128_VWA2_VWB1_WGM8_WGMXCC1_WGMXCCGn1
    SolutionIndex: 65
    SolutionNameMin: Cijk_Alik_Bjlk_B8NB8NS_BH_Bias_HAS_SAV_UserArgs_MT32x32x128_MI16x16x1_SN_LDSB0_CLR1_GRVWA8_GRVWB8_GSU0_GSUC0_GSUWGMRR0_K1_LBSPPA128_LBSPPB256_LPA8_LPB16_LRVW8_MIWT1_1_PLR1_SU0_SUM0_SUS128_VWA1_VWB1_WGM1_WGMXCC1_WGMXCCGn1
    SolutionIndex: 66
    SolutionNameMin: Cijk_Alik_Bjlk_B8NB8NS_BH_Bias_HAS_SAV_UserArgs_MT32x32x128_MI16x16x1_SN_LDSB0_CLR1_GRVWA16_GRVWB8_GSU0_GSUC0_GSUWGMRR0_K1_LBSPPA128_LBSPPB256_LPA16_LPB16_LRVW8_MIWT1_1_PLR1_SU0_SUM0_SUS128_VWA1_VWB1_WGM1_WGMXCC1_WGMXCCGn1
    SolutionIndex: 67
    SolutionNameMin: Cijk_Alik_Bjlk_B8NB8NS_BH_Bias_HAS_SAV_UserArgs_MT32x32x128_MI16x16x1_SN_LDSB0_CLR1_GRVWA8_GRVWB16_GSU0_GSUC0_GSUWGMRR0_K1_LBSPPA128_LBSPPB256_LPA8_LPB16_LRVW8_MIWT1_1_PLR1_SU0_SUM0_SUS128_VWA1_VWB1_WGM1_WGMXCC1_WGMXCCGn1
    SolutionIndex: 68
    SolutionNameMin: Cijk_Alik_Bjlk_B8NB8NS_BH_Bias_HAS_SAV_UserArgs_MT32x32x128_MI16x16x1_SN_LDSB0_CLR1_GRVWA8_GRVWB16_GSU0_GSUC0_GSUWGMRR0_K1_LBSPPA128_LBSPPB256_LPA8_LPB16_LRVW8_MIWT1_1_PLR1_SU0_SUM0_SUS128_VWA1_VWB1_WGM4_WGMXCC1_WGMXCCGn1
    SolutionIndex: 69
    SolutionNameMin: Cijk_Alik_Bjlk_B8NB8NS_BH_Bias_HAS_SAV_UserArgs_MT32x32x128_MI16x16x1_SN_LDSB0_CLR1_GRVWA8_GRVWB16_GSU0_GSUC0_GSUWGMRR0_K1_LBSPPA128_LBSPPB256_LPA8_LPB16_LRVW8_MIWT1_1_PLR1_SU0_SUM0_SUS128_VWA1_VWB1_WGM8_WGMXCC1_WGMXCCGn1
    SolutionIndex: 70
    SolutionNameMin: Cijk_Alik_Bjlk_B8NB8NS_BH_Bias_HAS_SAV_UserArgs_MT128x64x256_MI16x16x1_SN_LDSB1_CLR1_GRVWA16_GRVWB16_GSU0_GSUC0_GSUWGMRR0_K1_LBSPPA1024_LBSPPB512_LPA16_LPB32_LRVW8_MIWT4_2_PLR1_SU0_SUM0_SUS256_VWA4_VWB2_WGM1_WGMXCC1_WGMXCCGn1
    SolutionIndex: 71
    SolutionNameMin: Cijk_Alik_Bjlk_B8NB8NS_BH_Bias_HAS_SAV_UserArgs_MT128x64x256_MI16x16x1_SN_LDSB1_CLR1_GRVWA16_GRVWB16_GSU0_GSUC0_GSUWGMRR0_K1_LBSPPA1024_LBSPPB512_LPA16_LPB32_LRVW8_MIWT4_2_PLR1_SU0_SUM0_SUS256_VWA4_VWB2_WGM4_WGMXCC1_WGMXCCGn1
    SolutionIndex: 72
    SolutionNameMin: Cijk_Alik_Bjlk_B8NB8NS_BH_Bias_HAS_SAV_UserArgs_MT128x64x256_MI16x16x1_SN_LDSB1_CLR1_GRVWA16_GRVWB16_GSU0_GSUC0_GSUWGMRR0_K1_LBSPPA1024_LBSPPB512_LPA16_LPB32_LRVW8_MIWT4_2_PLR1_SU0_SUM0_SUS256_VWA4_VWB2_WGM6_WGMXCC1_WGMXCCGn1
    SolutionIndex: 73
    SolutionNameMin: Cijk_Alik_Bjlk_B8NB8NS_BH_Bias_HAS_SAV_UserArgs_MT128x64x256_MI16x16x1_SN_LDSB1_CLR1_GRVWA16_GRVWB16_GSU0_GSUC0_GSUWGMRR0_K1_LBSPPA1024_LBSPPB512_LPA16_LPB32_LRVW8_MIWT4_2_PLR1_SU0_SUM0_SUS256_VWA4_VWB2_WGM8_WGMXCC1_WGMXCCGn1
    SolutionIndex: 74
    SolutionNameMin: Cijk_Alik_Bjlk_B8NB8NS_BH_Bias_HAS_SAV_UserArgs_MT64x64x256_MI16x16x1_SN_LDSB1_CLR1_GRVWA16_GRVWB16_GSU0_GSUC0_GSUWGMRR0_K1_LBSPPA512_LBSPPB512_LPA16_LPB32_LRVW8_MIWT2_2_PLR1_SU0_SUM0_SUS256_VWA2_VWB2_WGM1_WGMXCC1_WGMXCCGn1
    SolutionIndex: 75
    SolutionNameMin: Cijk_Alik_Bjlk_B8NB8NS_BH_Bias_HAS_SAV_UserArgs_MT64x64x256_MI16x16x1_SN_LDSB1_CLR1_GRVWA16_GRVWB16_GSU0_GSUC0_GSUWGMRR0_K1_LBSPPA512_LBSPPB512_LPA16_LPB32_LRVW8_MIWT2_2_PLR1_SU0_SUM0_SUS256_VWA2_VWB2_WGM4_WGMXCC1_WGMXCCGn1
    SolutionIndex: 76
    SolutionNameMin: Cijk_Alik_Bjlk_B8NB8NS_BH_Bias_HAS_SAV_UserArgs_MT64x64x256_MI16x16x1_SN_LDSB1_CLR1_GRVWA16_GRVWB16_GSU0_GSUC0_GSUWGMRR0_K1_LBSPPA512_LBSPPB512_LPA16_LPB32_LRVW8_MIWT2_2_PLR1_SU0_SUM0_SUS256_VWA2_VWB2_WGM6_WGMXCC1_WGMXCCGn1
    SolutionIndex: 77
    SolutionNameMin: Cijk_Alik_Bjlk_B8NB8NS_BH_Bias_HAS_SAV_UserArgs_MT64x64x256_MI16x16x1_SN_LDSB1_CLR1_GRVWA16_GRVWB16_GSU0_GSUC0_GSUWGMRR0_K1_LBSPPA512_LBSPPB512_LPA16_LPB32_LRVW8_MIWT2_2_PLR1_SU0_SUM0_SUS256_VWA2_VWB2_WGM8_WGMXCC1_WGMXCCGn1
    SolutionIndex: 78
    SolutionNameMin: Cijk_Alik_Bjlk_B8NB8NS_BH_Bias_HAS_SAV_UserArgs_MT32x64x256_MI16x16x1_SN_LDSB1_CLR1_GRVWA8_GRVWB16_GSU0_GSUC0_GSUWGMRR0_K1_LBSPPA256_LBSPPB512_LPA8_LPB32_LRVW8_MIWT1_2_PLR1_SU0_SUM0_SUS256_VWA1_VWB2_WGM1_WGMXCC1_WGMXCCGn1
    SolutionIndex: 79
    SolutionNameMin: Cijk_Alik_Bjlk_B8NB8NS_BH_Bias_HAS_SAV_UserArgs_MT32x64x256_MI16x16x1_SN_LDSB1_CLR1_GRVWA16_GRVWB16_GSU0_GSUC0_GSUWGMRR0_K1_LBSPPA256_LBSPPB512_LPA16_LPB32_LRVW8_MIWT1_2_PLR1_SU0_SUM0_SUS256_VWA1_VWB2_WGM1_WGMXCC1_WGMXCCGn1
    SolutionIndex: 80
    SolutionNameMin: Cijk_Alik_Bjlk_B8NB8NS_BH_Bias_HAS_SAV_UserArgs_MT32x64x256_MI16x16x1_SN_LDSB1_CLR1_GRVWA8_GRVWB16_GSU0_GSUC0_GSUWGMRR0_K1_LBSPPA256_LBSPPB512_LPA8_LPB32_LRVW8_MIWT1_2_PLR1_SU0_SUM0_SUS256_VWA1_VWB2_WGM4_WGMXCC1_WGMXCCGn1
    SolutionIndex: 81
    SolutionNameMin: Cijk_Alik_Bjlk_B8NB8NS_BH_Bias_HAS_SAV_UserArgs_MT32x64x256_MI16x16x1_SN_LDSB1_CLR1_GRVWA8_GRVWB16_GSU0_GSUC0_GSUWGMRR0_K1_LBSPPA256_LBSPPB512_LPA8_LPB32_LRVW8_MIWT1_2_PLR1_SU0_SUM0_SUS256_VWA1_VWB2_WGM6_WGMXCC1_WGMXCCGn1
    SolutionIndex: 82
    SolutionNameMin: Cijk_Alik_Bjlk_B8NB8NS_BH_Bias_HAS_SAV_UserArgs_MT32x64x256_MI16x16x1_SN_LDSB1_CLR1_GRVWA16_GRVWB16_GSU0_GSUC0_GSUWGMRR0_K1_LBSPPA256_LBSPPB512_LPA16_LPB32_LRVW8_MIWT1_2_PLR1_SU0_SUM0_SUS256_VWA1_VWB2_WGM6_WGMXCC1_WGMXCCGn1
    SolutionIndex: 83
    SolutionNameMin: Cijk_Alik_Bjlk_B8NB8NS_BH_Bias_HAS_SAV_UserArgs_MT64x32x256_MI16x16x1_SN_LDSB1_CLR1_GRVWA16_GRVWB16_GSU0_GSUC0_GSUWGMRR0_K1_LBSPPA512_LBSPPB256_LPA16_LPB16_LRVW8_MIWT2_1_PLR1_SU0_SUM0_SUS256_VWA2_VWB1_WGM1_WGMXCC1_WGMXCCGn1
    SolutionIndex: 84
    SolutionNameMin: Cijk_Alik_Bjlk_B8NB8NS_BH_Bias_HAS_SAV_UserArgs_MT32x32x256_MI16x16x1_SN_LDSB1_CLR1_GRVWA8_GRVWB16_GSU0_GSUC0_GSUWGMRR0_K1_LBSPPA256_LBSPPB256_LPA8_LPB16_LRVW8_MIWT1_1_PLR1_SU0_SUM0_SUS256_VWA1_VWB1_WGM1_WGMXCC1_WGMXCCGn1
    SolutionIndex: 85
    SolutionNameMin: Cijk_Alik_Bjlk_B8NB8NS_BH_Bias_HAS_SAV_UserArgs_MT32x32x256_MI16x16x1_SN_LDSB1_CLR1_GRVWA16_GRVWB16_GSU0_GSUC0_GSUWGMRR0_K1_LBSPPA256_LBSPPB256_LPA16_LPB16_LRVW8_MIWT1_1_PLR1_SU0_SUM0_SUS256_VWA1_VWB1_WGM1_WGMXCC1_WGMXCCGn1
    SolutionIndex: 86
    SolutionNameMin: Cijk_Alik_Bjlk_B8NB8NS_BH_Bias_HAS_SAV_UserArgs_MT32x32x256_MI16x16x1_SN_LDSB1_CLR1_GRVWA16_GRVWB16_GSU0_GSUC0_GSUWGMRR0_K1_LBSPPA256_LBSPPB256_LPA16_LPB16_LRVW8_MIWT1_1_PLR1_SU0_SUM0_SUS256_VWA1_VWB1_WGM6_WGMXCC1_WGMXCCGn1
- - - [128, 128, 1, 128, 128, 128, 128, 128]
    - [66, 0.54]
  - - [128, 128, 1, 256, 128, 128, 256, 128]
    - [31, 0.98]
  - - [128, 128, 1, 512, 128, 128, 512, 128]
    - [66, 1.7]
  - - [128, 128, 1, 1024, 128, 128, 1024, 128]
    - [65, 2.68]
  - - [128, 128, 1, 2048, 128, 128, 2048, 128]
    - [67, 3.78]
  - - [128, 128, 1, 4096, 128, 128, 4096, 128]
    - [67, 4.8]
  - - [128, 128, 1, 8192, 128, 128, 8192, 128]
    - [69, 5.49]
  - - [128, 256, 1, 128, 128, 128, 128, 256]
    - [66, 1.13]
  - - [128, 256, 1, 256, 128, 128, 256, 256]
    - [66, 2.06]
  - - [128, 256, 1, 512, 128, 128, 512, 256]
    - [65, 3.49]
  - - [128, 256, 1, 1024, 128, 128, 1024, 256]
    - [65, 5.5]
  - - [128, 256, 1, 2048, 128, 128, 2048, 256]
    - [67, 7.69]
  - - [128, 256, 1, 4096, 128, 128, 4096, 256]
    - [67, 9.64]
  - - [128, 256, 1, 8192, 128, 128, 8192, 256]
    - [67, 11.08]
  - - [128, 512, 1, 128, 128, 128, 128, 512]
    - [31, 2.18]
  - - [128, 512, 1, 256, 128, 128, 256, 512]
    - [65, 3.98]
  - - [128, 512, 1, 512, 128, 128, 512, 512]
    - [65, 6.9]
  - - [128, 512, 1, 1024, 128, 128, 1024, 512]
    - [65, 10.86]
  - - [128, 512, 1, 2048, 128, 128, 2048, 512]
    - [67, 15.14]
  - - [128, 512, 1, 4096, 128, 128, 4096, 512]
    - [67, 19.18]
  - - [128, 512, 1, 8192, 128, 128, 8192, 512]
    - [85, 17.88]
  - - [128, 1024, 1, 128, 128, 128, 128, 1024]
    - [66, 4.27]
  - - [128, 1024, 1, 256, 128, 128, 256, 1024]
    - [65, 7.77]
  - - [128, 1024, 1, 512, 128, 128, 512, 1024]
    - [65, 13.46]
  - - [128, 1024, 1, 1024, 128, 128, 1024, 1024]
    - [65, 21.0]
  - - [128, 1024, 1, 2048, 128, 128, 2048, 1024]
    - [65, 29.75]
  - - [128, 1024, 1, 4096, 128, 128, 4096, 1024]
    - [85, 30.49]
  - - [128, 1024, 1, 8192, 128, 128, 8192, 1024]
    - [86, 31.99]
  - - [128, 2048, 1, 128, 128, 128, 128, 2048]
    - [29, 8.07]
  - - [128, 2048, 1, 256, 128, 128, 256, 2048]
    - [58, 14.47]
  - - [128, 2048, 1, 512, 128, 128, 512, 2048]
    - [60, 24.52]
  - - [128, 2048, 1, 1024, 128, 128, 1024, 2048]
    - [62, 37.5]
  - - [128, 2048, 1, 2048, 128, 128, 2048, 2048]
    - [63, 44.09]
  - - [128, 2048, 1, 4096, 128, 128, 4096, 2048]
    - [79, 52.33]
  - - [128, 2048, 1, 8192, 128, 128, 8192, 2048]
    - [82, 59.39]
  - - [128, 4096, 1, 128, 128, 128, 128, 4096]
    - [27, 14.87]
  - - [128, 4096, 1, 256, 128, 128, 256, 4096]
    - [26, 26.23]
  - - [128, 4096, 1, 512, 128, 128, 512, 4096]
    - [55, 42.88]
  - - [128, 4096, 1, 1024, 128, 128, 1024, 4096]
    - [56, 64.95]
  - - [128, 4096, 1, 2048, 128, 128, 2048, 4096]
    - [74, 79.01]
  - - [128, 4096, 1, 4096, 128, 128, 4096, 4096]
    - [74, 96.57]
  - - [128, 4096, 1, 8192, 128, 128, 8192, 4096]
    - [74, 108.25]
  - - [128, 8192, 1, 128, 128, 128, 128, 8192]
    - [21, 26.01]
  - - [128, 8192, 1, 256, 128, 128, 256, 8192]
    - [22, 45.22]
  - - [128, 8192, 1, 512, 128, 128, 512, 8192]
    - [22, 73.48]
  - - [128, 8192, 1, 1024, 128, 128, 1024, 8192]
    - [22, 105.38]
  - - [128, 8192, 1, 2048, 128, 128, 2048, 8192]
    - [53, 123.33]
  - - [128, 8192, 1, 4096, 128, 128, 4096, 8192]
    - [53, 145.59]
  - - [128, 8192, 1, 8192, 128, 128, 8192, 8192]
    - [70, 155.27]
  - - [256, 128, 1, 128, 256, 256, 128, 128]
    - [31, 1.06]
  - - [256, 128, 1, 256, 256, 256, 256, 128]
    - [31, 2.01]
  - - [256, 128, 1, 512, 256, 256, 512, 128]
    - [66, 3.42]
  - - [256, 128, 1, 1024, 256, 256, 1024, 128]
    - [67, 5.39]
  - - [256, 128, 1, 2048, 256, 256, 2048, 128]
    - [67, 7.62]
  - - [256, 128, 1, 4096, 256, 256, 4096, 128]
    - [67, 9.59]
  - - [256, 128, 1, 8192, 256, 256, 8192, 128]
    - [67, 11.03]
  - - [256, 256, 1, 128, 256, 256, 128, 256]
    - [31, 2.16]
  - - [256, 256, 1, 256, 256, 256, 256, 256]
    - [66, 3.96]
  - - [256, 256, 1, 512, 256, 256, 512, 256]
    - [66, 6.81]
  - - [256, 256, 1, 1024, 256, 256, 1024, 256]
    - [65, 10.76]
  - - [256, 256, 1, 2048, 256, 256, 2048, 256]
    - [67, 15.17]
  - - [256, 256, 1, 4096, 256, 256, 4096, 256]
    - [67, 19.1]
  - - [256, 256, 1, 8192, 256, 256, 8192, 256]
    - [69, 21.82]
  - - [256, 512, 1, 128, 256, 256, 128, 512]
    - [30, 4.1]
  - - [256, 512, 1, 256, 256, 256, 256, 512]
    - [65, 7.71]
  - - [256, 512, 1, 512, 256, 256, 512, 512]
    - [65, 13.16]
  - - [256, 512, 1, 1024, 256, 256, 1024, 512]
    - [65, 20.98]
  - - [256, 512, 1, 2048, 256, 256, 2048, 512]
    - [67, 29.8]
  - - [256, 512, 1, 4096, 256, 256, 4096, 512]
    - [67, 37.44]
  - - [256, 512, 1, 8192, 256, 256, 8192, 512]
    - [84, 38.52]
  - - [256, 1024, 1, 128, 256, 256, 128, 1024]
    - [61, 8.06]
  - - [256, 1024, 1, 256, 256, 256, 256, 1024]
    - [60, 14.62]
  - - [256, 1024, 1, 512, 256, 256, 512, 1024]
    - [61, 24.84]
  - - [256, 1024, 1, 1024, 256, 256, 1024, 1024]
    - [62, 37.8]
  - - [256, 1024, 1, 2048, 256, 256, 2048, 1024]
    - [62, 52.12]
  - - [256, 1024, 1, 4096, 256, 256, 4096, 1024]
    - [83, 58.68]
  - - [256, 1024, 1, 8192, 256, 256, 8192, 1024]
    - [82, 59.98]
  - - [256, 2048, 1, 128, 256, 256, 128, 2048]
    - [27, 15.12]
  - - [256, 2048, 1, 256, 256, 256, 256, 2048]
    - [27, 26.85]
  - - [256, 2048, 1, 512, 256, 256, 512, 2048]
    - [56, 43.7]
  - - [256, 2048, 1, 1024, 256, 256, 1024, 2048]
    - [56, 65.11]
  - - [256, 2048, 1, 2048, 256, 256, 2048, 2048]
    - [74, 80.7]
  - - [256, 2048, 1, 4096, 256, 256, 4096, 2048]
    - [74, 96.7]
  - - [256, 2048, 1, 8192, 256, 256, 8192, 2048]
    - [74, 108.32]
  - - [256, 4096, 1, 128, 256, 256, 128, 4096]
    - [22, 24.5]
  - - [256, 4096, 1, 256, 256, 256, 256, 4096]
    - [17, 43.35]
  - - [256, 4096, 1, 512, 256, 256, 512, 4096]
    - [22, 70.24]
  - - [256, 4096, 1, 1024, 256, 256, 1024, 4096]
    - [22, 103.46]
  - - [256, 4096, 1, 2048, 256, 256, 2048, 4096]
    - [70, 124.51]
  - - [256, 4096, 1, 4096, 256, 256, 4096, 4096]
    - [73, 148.9]
  - - [256, 4096, 1, 8192, 256, 256, 8192, 4096]
    - [70, 164.82]
  - - [256, 8192, 1, 128, 256, 256, 128, 8192]
    - [19, 39.36]
  - - [256, 8192, 1, 256, 256, 256, 256, 8192]
    - [18, 67.14]
  - - [256, 8192, 1, 512, 256, 256, 512, 8192]
    - [49, 110.35]
  - - [256, 8192, 1, 1024, 256, 256, 1024, 8192]
    - [49, 159.57]
  - - [256, 8192, 1, 2048, 256, 256, 2048, 8192]
    - [49, 186.35]
  - - [256, 8192, 1, 4096, 256, 256, 4096, 8192]
    - [50, 210.37]
  - - [256, 8192, 1, 8192, 256, 256, 8192, 8192]
    - [49, 203.87]
  - - [512, 128, 1, 128, 512, 512, 128, 128]
    - [31, 2.11]
  - - [512, 128, 1, 256, 512, 512, 256, 128]
    - [67, 3.83]
  - - [512, 128, 1, 512, 512, 512, 512, 128]
    - [65, 6.5]
  - - [512, 128, 1, 1024, 512, 512, 1024, 128]
    - [65, 10.75]
  - - [512, 128, 1, 2048, 512, 512, 2048, 128]
    - [65, 14.81]
  - - [512, 128, 1, 4096, 512, 512, 4096, 128]
    - [67, 19.04]
  - - [512, 128, 1, 8192, 512, 512, 8192, 128]
    - [67, 21.96]
  - - [512, 256, 1, 128, 512, 512, 128, 256]
    - [32, 4.08]
  - - [512, 256, 1, 256, 512, 512, 256, 256]
    - [66, 7.67]
  - - [512, 256, 1, 512, 512, 512, 512, 256]
    - [65, 13.21]
  - - [512, 256, 1, 1024, 512, 512, 1024, 256]
    - [65, 20.18]
  - - [512, 256, 1, 2048, 512, 512, 2048, 256]
    - [67, 29.04]
  - - [512, 256, 1, 4096, 512, 512, 4096, 256]
    - [67, 37.04]
  - - [512, 256, 1, 8192, 512, 512, 8192, 256]
    - [68, 42.48]
  - - [512, 512, 1, 128, 512, 512, 128, 512]
    - [60, 7.66]
  - - [512, 512, 1, 256, 512, 512, 256, 512]
    - [61, 13.45]
  - - [512, 512, 1, 512, 512, 512, 512, 512]
    - [61, 24.34]
  - - [512, 512, 1, 1024, 512, 512, 1024, 512]
    - [62, 36.24]
  - - [512, 512, 1, 2048, 512, 512, 2048, 512]
    - [62, 49.99]
  - - [512, 512, 1, 4096, 512, 512, 4096, 512]
    - [64, 61.88]
  - - [512, 512, 1, 8192, 512, 512, 8192, 512]
    - [59, 62.46]
  - - [512, 1024, 1, 128, 512, 512, 128, 1024]
    - [27, 14.89]
  - - [512, 1024, 1, 256, 512, 512, 256, 1024]
    - [27, 26.41]
  - - [512, 1024, 1, 512, 512, 512, 512, 1024]
    - [55, 43.23]
  - - [512, 1024, 1, 1024, 512, 512, 1024, 1024]
    - [57, 65.01]
  - - [512, 1024, 1, 2048, 512, 512, 2048, 1024]
    - [56, 86.98]
  - - [512, 1024, 1, 4096, 512, 512, 4096, 1024]
    - [74, 97.93]
  - - [512, 1024, 1, 8192, 512, 512, 8192, 1024]
    - [76, 107.35]
  - - [512, 2048, 1, 128, 512, 512, 128, 2048]
    - [17, 25.94]
  - - [512, 2048, 1, 256, 512, 512, 256, 2048]
    - [21, 45.52]
  - - [512, 2048, 1, 512, 512, 512, 512, 2048]
    - [22, 73.64]
  - - [512, 2048, 1, 1024, 512, 512, 1024, 2048]
    - [22, 106.44]
  - - [512, 2048, 1, 2048, 512, 512, 2048, 2048]
    - [70, 128.54]
  - - [512, 2048, 1, 4096, 512, 512, 4096, 2048]
    - [70, 150.81]
  - - [512, 2048, 1, 8192, 512, 512, 8192, 2048]
    - [70, 161.42]
  - - [512, 4096, 1, 128, 512, 512, 128, 4096]
    - [18, 39.57]
  - - [512, 4096, 1, 256, 512, 512, 256, 4096]
    - [18, 67.82]
  - - [512, 4096, 1, 512, 512, 512, 512, 4096]
    - [49, 109.27]
  - - [512, 4096, 1, 1024, 512, 512, 1024, 4096]
    - [49, 157.52]
  - - [512, 4096, 1, 2048, 512, 512, 2048, 4096]
    - [49, 191.2]
  - - [512, 4096, 1, 4096, 512, 512, 4096, 4096]
    - [49, 222.42]
  - - [512, 4096, 1, 8192, 512, 512, 8192, 4096]
    - [49, 210.95]
  - - [512, 8192, 1, 128, 512, 512, 128, 8192]
    - [11, 57.19]
  - - [512, 8192, 1, 256, 512, 512, 256, 8192]
    - [11, 97.98]
  - - [512, 8192, 1, 512, 512, 512, 512, 8192]
    - [12, 153.72]
  - - [512, 8192, 1, 1024, 512, 512, 1024, 8192]
    - [12, 214.99]
  - - [512, 8192, 1, 2048, 512, 512, 2048, 8192]
    - [33, 243.2]
  - - [512, 8192, 1, 4096, 512, 512, 4096, 8192]
    - [33, 268.04]
  - - [512, 8192, 1, 8192, 512, 512, 8192, 8192]
    - [40, 242.87]
  - - [1024, 128, 1, 128, 1024, 1024, 128, 128]
    - [30, 3.9]
  - - [1024, 128, 1, 256, 1024, 1024, 256, 128]
    - [65, 7.31]
  - - [1024, 128, 1, 512, 1024, 1024, 512, 128]
    - [66, 12.51]
  - - [1024, 128, 1, 1024, 1024, 1024, 1024, 128]
    - [67, 20.1]
  - - [1024, 128, 1, 2048, 1024, 1024, 2048, 128]
    - [67, 29.02]
  - - [1024, 128, 1, 4096, 1024, 1024, 4096, 128]
    - [67, 36.96]
  - - [1024, 128, 1, 8192, 1024, 1024, 8192, 128]
    - [68, 42.51]
  - - [1024, 256, 1, 128, 1024, 1024, 128, 256]
    - [58, 7.37]
  - - [1024, 256, 1, 256, 1024, 1024, 256, 256]
    - [30, 13.66]
  - - [1024, 256, 1, 512, 1024, 1024, 512, 256]
    - [61, 23.45]
  - - [1024, 256, 1, 1024, 1024, 1024, 1024, 256]
    - [62, 36.15]
  - - [1024, 256, 1, 2048, 1024, 1024, 2048, 256]
    - [62, 49.83]
  - - [1024, 256, 1, 4096, 1024, 1024, 4096, 256]
    - [64, 62.13]
  - - [1024, 256, 1, 8192, 1024, 1024, 8192, 256]
    - [81, 70.56]
  - - [1024, 512, 1, 128, 1024, 1024, 128, 512]
    - [27, 14.1]
  - - [1024, 512, 1, 256, 1024, 1024, 256, 512]
    - [26, 25.13]
  - - [1024, 512, 1, 512, 1024, 1024, 512, 512]
    - [56, 41.3]
  - - [1024, 512, 1, 1024, 1024, 1024, 1024, 512]
    - [56, 62.55]
  - - [1024, 512, 1, 2048, 1024, 1024, 2048, 512]
    - [74, 85.02]
  - - [1024, 512, 1, 4096, 1024, 1024, 4096, 512]
    - [77, 103.65]
  - - [1024, 512, 1, 8192, 1024, 1024, 8192, 512]
    - [77, 107.95]
  - - [1024, 1024, 1, 128, 1024, 1024, 128, 1024]
    - [21, 24.94]
  - - [1024, 1024, 1, 256, 1024, 1024, 256, 1024]
    - [21, 43.34]
  - - [1024, 1024, 1, 512, 1024, 1024, 512, 1024]
    - [24, 71.15]
  - - [1024, 1024, 1, 1024, 1024, 1024, 1024, 1024]
    - [22, 103.11]
  - - [1024, 1024, 1, 2048, 1024, 1024, 2048, 1024]
    - [25, 135.6]
  - - [1024, 1024, 1, 4096, 1024, 1024, 4096, 1024]
    - [71, 148.52]
  - - [1024, 1024, 1, 8192, 1024, 1024, 8192, 1024]
    - [72, 160.86]
  - - [1024, 2048, 1, 128, 1024, 1024, 128, 2048]
    - [18, 39.9]
  - - [1024, 2048, 1, 256, 1024, 1024, 256, 2048]
    - [16, 68.31]
  - - [1024, 2048, 1, 512, 1024, 1024, 512, 2048]
    - [49, 109.85]
  - - [1024, 2048, 1, 1024, 1024, 1024, 1024, 2048]
    - [49, 157.74]
  - - [1024, 2048, 1, 2048, 1024, 1024, 2048, 2048]
    - [49, 192.68]
  - - [1024, 2048, 1, 4096, 1024, 1024, 4096, 2048]
    - [50, 217.56]
  - - [1024, 2048, 1, 8192, 1024, 1024, 8192, 2048]
    - [51, 212.87]
  - - [1024, 4096, 1, 128, 1024, 1024, 128, 4096]
    - [11, 57.21]
  - - [1024, 4096, 1, 256, 1024, 1024, 256, 4096]
    - [10, 97.97]
  - - [1024, 4096, 1, 512, 1024, 1024, 512, 4096]
    - [12, 153.67]
  - - [1024, 4096, 1, 1024, 1024, 1024, 1024, 4096]
    - [12, 211.46]
  - - [1024, 4096, 1, 2048, 1024, 1024, 2048, 4096]
    - [38, 249.8]
  - - [1024, 4096, 1, 4096, 1024, 1024, 4096, 4096]
    - [34, 260.66]
  - - [1024, 4096, 1, 8192, 1024, 1024, 8192, 4096]
    - [38, 249.1]
  - - [1024, 8192, 1, 128, 1024, 1024, 128, 8192]
    - [5, 73.25]
  - - [1024, 8192, 1, 256, 1024, 1024, 256, 8192]
    - [5, 122.44]
  - - [1024, 8192, 1, 512, 1024, 1024, 512, 8192]
    - [5, 183.4]
  - - [1024, 8192, 1, 1024, 1024, 1024, 1024, 8192]
    - [5, 243.31]
  - - [1024, 8192, 1, 2048, 1024, 1024, 2048, 8192]
    - [3, 279.85]
  - - [1024, 8192, 1, 4096, 1024, 1024, 4096, 8192]
    - [4, 271.99]
  - - [1024, 8192, 1, 8192, 1024, 1024, 8192, 8192]
    - [2, 286.12]
  - - [2048, 128, 1, 128, 2048, 2048, 128, 128]
    - [60, 7.69]
  - - [2048, 128, 1, 256, 2048, 2048, 256, 128]
    - [29, 13.74]
  - - [2048, 128, 1, 512, 2048, 2048, 512, 128]
    - [61, 23.37]
  - - [2048, 128, 1, 1024, 2048, 2048, 1024, 128]
    - [60, 35.88]
  - - [2048, 128, 1, 2048, 2048, 2048, 2048, 128]
    - [62, 50.25]
  - - [2048, 128, 1, 4096, 2048, 2048, 4096, 128]
    - [78, 61.93]
  - - [2048, 128, 1, 8192, 2048, 2048, 8192, 128]
    - [80, 70.37]
  - - [2048, 256, 1, 128, 2048, 2048, 128, 256]
    - [27, 14.31]
  - - [2048, 256, 1, 256, 2048, 2048, 256, 256]
    - [28, 25.69]
  - - [2048, 256, 1, 512, 2048, 2048, 512, 256]
    - [56, 41.44]
  - - [2048, 256, 1, 1024, 2048, 2048, 1024, 256]
    - [56, 62.7]
  - - [2048, 256, 1, 2048, 2048, 2048, 2048, 256]
    - [74, 85.17]
  - - [2048, 256, 1, 4096, 2048, 2048, 4096, 256]
    - [76, 104.03]
  - - [2048, 256, 1, 8192, 2048, 2048, 8192, 256]
    - [76, 116.67]
  - - [2048, 512, 1, 128, 2048, 2048, 128, 512]
    - [21, 24.42]
  - - [2048, 512, 1, 256, 2048, 2048, 256, 512]
    - [21, 43.29]
  - - [2048, 512, 1, 512, 2048, 2048, 512, 512]
    - [22, 70.42]
  - - [2048, 512, 1, 1024, 2048, 2048, 1024, 512]
    - [24, 105.27]
  - - [2048, 512, 1, 2048, 2048, 2048, 2048, 512]
    - [24, 135.76]
  - - [2048, 512, 1, 4096, 2048, 2048, 4096, 512]
    - [73, 152.85]
  - - [2048, 512, 1, 8192, 2048, 2048, 8192, 512]
    - [72, 162.16]
  - - [2048, 1024, 1, 128, 2048, 2048, 128, 1024]
    - [48, 41.2]
  - - [2048, 1024, 1, 256, 2048, 2048, 256, 1024]
    - [18, 70.22]
  - - [2048, 1024, 1, 512, 2048, 2048, 512, 1024]
    - [49, 111.49]
  - - [2048, 1024, 1, 1024, 2048, 2048, 1024, 1024]
    - [49, 161.2]
  - - [2048, 1024, 1, 2048, 2048, 2048, 2048, 1024]
    - [52, 198.31]
  - - [2048, 1024, 1, 4096, 2048, 2048, 4096, 1024]
    - [50, 213.67]
  - - [2048, 1024, 1, 8192, 2048, 2048, 8192, 1024]
    - [50, 209.67]
  - - [2048, 2048, 1, 128, 2048, 2048, 128, 2048]
    - [11, 58.56]
  - - [2048, 2048, 1, 256, 2048, 2048, 256, 2048]
    - [10, 99.64]
  - - [2048, 2048, 1, 512, 2048, 2048, 512, 2048]
    - [10, 155.95]
  - - [2048, 2048, 1, 1024, 2048, 2048, 1024, 2048]
    - [12, 204.87]
  - - [2048, 2048, 1, 2048, 2048, 2048, 2048, 2048]
    - [39, 246.73]
  - - [2048, 2048, 1, 4096, 2048, 2048, 4096, 2048]
    - [35, 262.95]
  - - [2048, 2048, 1, 8192, 2048, 2048, 8192, 2048]
    - [39, 244.56]
  - - [2048, 4096, 1, 128, 2048, 2048, 128, 4096]
    - [2, 72.68]
  - - [2048, 4096, 1, 256, 2048, 2048, 256, 4096]
    - [3, 122.28]
  - - [2048, 4096, 1, 512, 2048, 2048, 512, 4096]
    - [0, 183.66]
  - - [2048, 4096, 1, 1024, 2048, 2048, 1024, 4096]
    - [5, 247.28]
  - - [2048, 4096, 1, 2048, 2048, 2048, 2048, 4096]
    - [3, 282.89]
  - - [2048, 4096, 1, 4096, 2048, 2048, 4096, 4096]
    - [3, 273.72]
  - - [2048, 4096, 1, 8192, 2048, 2048, 8192, 4096]
    - [35, 286.9]
  - - [2048, 8192, 1, 128, 2048, 2048, 128, 8192]
    - [3, 78.79]
  - - [2048, 8192, 1, 256, 2048, 2048, 256, 8192]
    - [0, 131.78]
  - - [2048, 8192, 1, 512, 2048, 2048, 512, 8192]
    - [2, 194.2]
  - - [2048, 8192, 1, 1024, 2048, 2048, 1024, 8192]
    - [6, 242.75]
  - - [2048, 8192, 1, 2048, 2048, 2048, 2048, 8192]
    - [7, 253.56]
  - - [2048, 8192, 1, 4096, 2048, 2048, 4096, 8192]
    - [9, 285.85]
  - - [2048, 8192, 1, 8192, 2048, 2048, 8192, 8192]
    - [4, 323.04]
  - - [4096, 128, 1, 128, 4096, 4096, 128, 128]
    - [26, 14.51]
  - - [4096, 128, 1, 256, 4096, 4096, 256, 128]
    - [27, 26.02]
  - - [4096, 128, 1, 512, 4096, 4096, 512, 128]
    - [56, 42.71]
  - - [4096, 128, 1, 1024, 4096, 4096, 1024, 128]
    - [56, 64.2]
  - - [4096, 128, 1, 2048, 4096, 4096, 2048, 128]
    - [77, 86.52]
  - - [4096, 128, 1, 4096, 4096, 4096, 4096, 128]
    - [77, 105.0]
  - - [4096, 128, 1, 8192, 4096, 4096, 8192, 128]
    - [75, 117.71]
  - - [4096, 256, 1, 128, 4096, 4096, 128, 256]
    - [20, 25.04]
  - - [4096, 256, 1, 256, 4096, 4096, 256, 256]
    - [23, 44.4]
  - - [4096, 256, 1, 512, 4096, 4096, 512, 256]
    - [24, 72.16]
  - - [4096, 256, 1, 1024, 4096, 4096, 1024, 256]
    - [25, 105.46]
  - - [4096, 256, 1, 2048, 4096, 4096, 2048, 256]
    - [25, 136.1]
  - - [4096, 256, 1, 4096, 4096, 4096, 4096, 256]
    - [71, 152.38]
  - - [4096, 256, 1, 8192, 4096, 4096, 8192, 256]
    - [72, 160.63]
  - - [4096, 512, 1, 128, 4096, 4096, 128, 512]
    - [48, 41.23]
  - - [4096, 512, 1, 256, 4096, 4096, 256, 512]
    - [18, 70.23]
  - - [4096, 512, 1, 512, 4096, 4096, 512, 512]
    - [49, 111.95]
  - - [4096, 512, 1, 1024, 4096, 4096, 1024, 512]
    - [51, 158.91]
  - - [4096, 512, 1, 2048, 4096, 4096, 2048, 512]
    - [51, 198.85]
  - - [4096, 512, 1, 4096, 4096, 4096, 4096, 512]
    - [51, 210.06]
  - - [4096, 512, 1, 8192, 4096, 4096, 8192, 512]
    - [51, 210.93]
  - - [4096, 1024, 1, 128, 4096, 4096, 128, 1024]
    - [11, 58.62]
  - - [4096, 1024, 1, 256, 4096, 4096, 256, 1024]
    - [11, 99.86]
  - - [4096, 1024, 1, 512, 4096, 4096, 512, 1024]
    - [12, 156.68]
  - - [4096, 1024, 1, 1024, 4096, 4096, 1024, 1024]
    - [13, 208.78]
  - - [4096, 1024, 1, 2048, 4096, 4096, 2048, 1024]
    - [40, 250.69]
  - - [4096, 1024, 1, 4096, 4096, 4096, 4096, 1024]
    - [35, 271.5]
  - - [4096, 1024, 1, 8192, 4096, 4096, 8192, 1024]
    - [44, 249.18]
  - - [4096, 2048, 1, 128, 4096, 4096, 128, 2048]
    - [2, 71.99]
  - - [4096, 2048, 1, 256, 4096, 4096, 256, 2048]
    - [2, 120.22]
  - - [4096, 2048, 1, 512, 4096, 4096, 512, 2048]
    - [2, 180.4]
  - - [4096, 2048, 1, 1024, 4096, 4096, 1024, 2048]
    - [2, 246.87]
  - - [4096, 2048, 1, 2048, 4096, 4096, 2048, 2048]
    - [5, 280.97]
  - - [4096, 2048, 1, 4096, 4096, 4096, 4096, 2048]
    - [42, 271.12]
  - - [4096, 2048, 1, 8192, 4096, 4096, 8192, 2048]
    - [42, 295.95]
  - - [4096, 4096, 1, 128, 4096, 4096, 128, 4096]
    - [3, 78.63]
  - - [4096, 4096, 1, 256, 4096, 4096, 256, 4096]
    - [3, 130.46]
  - - [4096, 4096, 1, 512, 4096, 4096, 512, 4096]
    - [3, 196.25]
  - - [4096, 4096, 1, 1024, 4096, 4096, 1024, 4096]
    - [6, 242.19]
  - - [4096, 4096, 1, 2048, 4096, 4096, 2048, 4096]
    - [41, 252.43]
  - - [4096, 4096, 1, 4096, 4096, 4096, 4096, 4096]
    - [3, 285.16]
  - - [4096, 4096, 1, 8192, 4096, 4096, 8192, 4096]
    - [41, 320.33]
  - - [4096, 8192, 1, 128, 4096, 4096, 128, 8192]
    - [0, 84.44]
  - - [4096, 8192, 1, 256, 4096, 4096, 256, 8192]
    - [18, 142.23]
  - - [4096, 8192, 1, 512, 4096, 4096, 512, 8192]
    - [7, 199.77]
  - - [4096, 8192, 1, 1024, 4096, 4096, 1024, 8192]
    - [36, 241.37]
  - - [4096, 8192, 1, 2048, 4096, 4096, 2048, 8192]
    - [37, 293.44]
  - - [4096, 8192, 1, 4096, 4096, 4096, 4096, 8192]
    - [3, 336.51]
  - - [4096, 8192, 1, 8192, 4096, 4096, 8192, 8192]
    - [1, 367.96]
  - - [8192, 128, 1, 128, 8192, 8192, 128, 128]
    - [21, 26.08]
  - - [8192, 128, 1, 256, 8192, 8192, 256, 128]
    - [17, 45.64]
  - - [8192, 128, 1, 512, 8192, 8192, 512, 128]
    - [22, 74.3]
  - - [8192, 128, 1, 1024, 8192, 8192, 1024, 128]
    - [22, 107.69]
  - - [8192, 128, 1, 2048, 8192, 8192, 2048, 128]
    - [25, 135.9]
  - - [8192, 128, 1, 4096, 8192, 8192, 4096, 128]
    - [54, 147.3]
  - - [8192, 128, 1, 8192, 8192, 8192, 8192, 128]
    - [73, 159.61]
  - - [8192, 256, 1, 128, 8192, 8192, 128, 256]
    - [48, 41.29]
  - - [8192, 256, 1, 256, 8192, 8192, 256, 256]
    - [16, 70.79]
  - - [8192, 256, 1, 512, 8192, 8192, 512, 256]
    - [49, 112.53]
  - - [8192, 256, 1, 1024, 8192, 8192, 1024, 256]
    - [52, 158.88]
  - - [8192, 256, 1, 2048, 8192, 8192, 2048, 256]
    - [52, 198.65]
  - - [8192, 256, 1, 4096, 8192, 8192, 4096, 256]
    - [50, 208.37]
  - - [8192, 256, 1, 8192, 8192, 8192, 8192, 256]
    - [52, 207.53]
  - - [8192, 512, 1, 128, 8192, 8192, 128, 512]
    - [11, 58.27]
  - - [8192, 512, 1, 256, 8192, 8192, 256, 512]
    - [12, 98.93]
  - - [8192, 512, 1, 512, 8192, 8192, 512, 512]
    - [15, 154.69]
  - - [8192, 512, 1, 1024, 8192, 8192, 1024, 512]
    - [45, 226.0]
  - - [8192, 512, 1, 2048, 8192, 8192, 2048, 512]
    - [46, 253.13]
  - - [8192, 512, 1, 4096, 8192, 8192, 4096, 512]
    - [46, 274.32]
  - - [8192, 512, 1, 8192, 8192, 8192, 8192, 512]
    - [47, 267.04]
  - - [8192, 1024, 1, 128, 8192, 8192, 128, 1024]
    - [3, 73.62]
  - - [8192, 1024, 1, 256, 8192, 8192, 256, 1024]
    - [3, 123.58]
  - - [8192, 1024, 1, 512, 8192, 8192, 512, 1024]
    - [3, 184.91]
  - - [8192, 1024, 1, 1024, 8192, 8192, 1024, 1024]
    - [5, 246.56]
  - - [8192, 1024, 1, 2048, 8192, 8192, 2048, 1024]
    - [44, 288.43]
  - - [8192, 1024, 1, 4096, 8192, 8192, 4096, 1024]
    - [41, 352.92]
  - - [8192, 1024, 1, 8192, 8192, 8192, 8192, 1024]
    - [44, 371.32]
  - - [8192, 2048, 1, 128, 8192, 8192, 128, 2048]
    - [3, 78.07]
  - - [8192, 2048, 1, 256, 8192, 8192, 256, 2048]
    - [3, 130.25]
  - - [8192, 2048, 1, 512, 8192, 8192, 512, 2048]
    - [4, 194.15]
  - - [8192, 2048, 1, 1024, 8192, 8192, 1024, 2048]
    - [43, 254.16]
  - - [8192, 2048, 1, 2048, 8192, 8192, 2048, 2048]
    - [42, 301.73]
  - - [8192, 2048, 1, 4096, 8192, 8192, 4096, 2048]
    - [42, 350.86]
  - - [8192, 2048, 1, 8192, 8192, 8192, 8192, 2048]
    - [41, 398.73]
  - - [8192, 4096, 1, 128, 8192, 8192, 128, 4096]
    - [2, 83.5]
  - - [8192, 4096, 1, 256, 8192, 8192, 256, 4096]
    - [18, 134.48]
  - - [8192, 4096, 1, 512, 8192, 8192, 512, 4096]
    - [8, 203.8]
  - - [8192, 4096, 1, 1024, 8192, 8192, 1024, 4096]
    - [44, 250.84]
  - - [8192, 4096, 1, 2048, 8192, 8192, 2048, 4096]
    - [44, 308.13]
  - - [8192, 4096, 1, 4096, 8192, 8192, 4096, 4096]
    - [41, 368.45]
  - - [8192, 4096, 1, 8192, 8192, 8192, 8192, 4096]
    - [41, 419.82]
  - - [8192, 8192, 1, 128, 8192, 8192, 128, 8192]
    - [18, 89.95]
  - - [8192, 8192, 1, 256, 8192, 8192, 256, 8192]
    - [14, 152.03]
  - - [8192, 8192, 1, 512, 8192, 8192, 512, 8192]
    - [2, 215.66]
  - - [8192, 8192, 1, 1024, 8192, 8192, 1024, 8192]
    - [5, 284.8]
  - - [8192, 8192, 1, 2048, 8192, 8192, 2048, 8192]
    - [5, 342.83]
  - - [8192, 8192, 1, 4096, 8192, 8192, 4096, 8192]
    - [42, 385.28]
  - - [8192, 8192, 1, 8192, 8192, 8192, 8192, 8192]
    - [44, 416.1]
- null
- null
- ExperimentalStreamK
- GridBased
