projects/hipblaslt/library/src/amd_detail/rocblaslt/src/Tensile/Logic/asm_full/aquavanjaram/gfx942_228cu/StreamK/aquavanjaram942_Cijk_Alik_Bjlk_B8F8NB8NS_BH_Bias_HAS_SAV_UserArgs.yaml
- {MinimumRequiredVersion: 4.33.0}
- aquavanjaram942
- {Architecture: gfx942, CUCount: 228}
- [Device 0049, Device 0050]
    SolutionIndex: 0
    SolutionNameMin: Cijk_Alik_Bjlk_B8F8NB8NS_BH_Bias_HAS_SAV_UserArgs_MT256x256x64_MI16x16x1_SN_LDSB1_CLR1_GRVWA8_GRVWB16_GSU0_GSUC0_GSUWGMRR0_K1_LBSPPA512_LBSPPB2048_LPA8_LPB0_LRVW8_MIWT8_8_PLR1_SU0_SUM0_SUS64_VWA8_VWB8_WGM1_WGMXCC1_WGMXCCGn1
    SolutionIndex: 1
    SolutionNameMin: Cijk_Alik_Bjlk_B8F8NB8NS_BH_Bias_HAS_SAV_UserArgs_MT256x256x64_MI16x16x1_SN_LDSB1_CLR1_GRVWA16_GRVWB16_GSU0_GSUC0_GSUWGMRR0_K1_LBSPPA512_LBSPPB2048_LPA16_LPB0_LRVW8_MIWT8_8_PLR1_SU0_SUM0_SUS64_VWA8_VWB8_WGM1_WGMXCC1_WGMXCCGn1
    SolutionIndex: 2
    SolutionNameMin: Cijk_Alik_Bjlk_B8F8NB8NS_BH_Bias_HAS_SAV_UserArgs_MT256x256x64_MI16x16x1_SN_LDSB1_CLR1_GRVWA8_GRVWB16_GSU0_GSUC0_GSUWGMRR0_K1_LBSPPA512_LBSPPB2048_LPA8_LPB0_LRVW8_MIWT8_8_PLR1_SU0_SUM0_SUS64_VWA8_VWB8_WGM4_WGMXCC1_WGMXCCGn1
    SolutionIndex: 3
    SolutionNameMin: Cijk_Alik_Bjlk_B8F8NB8NS_BH_Bias_HAS_SAV_UserArgs_MT256x256x64_MI16x16x1_SN_LDSB1_CLR1_GRVWA16_GRVWB16_GSU0_GSUC0_GSUWGMRR0_K1_LBSPPA512_LBSPPB2048_LPA16_LPB0_LRVW8_MIWT8_8_PLR1_SU0_SUM0_SUS64_VWA8_VWB8_WGM4_WGMXCC1_WGMXCCGn1
    SolutionIndex: 4
    SolutionNameMin: Cijk_Alik_Bjlk_B8F8NB8NS_BH_Bias_HAS_SAV_UserArgs_MT256x256x64_MI16x16x1_SN_LDSB1_CLR1_GRVWA8_GRVWB16_GSU0_GSUC0_GSUWGMRR0_K1_LBSPPA512_LBSPPB2048_LPA8_LPB0_LRVW8_MIWT8_8_PLR1_SU0_SUM0_SUS64_VWA8_VWB8_WGM6_WGMXCC1_WGMXCCGn1
    SolutionIndex: 5
    SolutionNameMin: Cijk_Alik_Bjlk_B8F8NB8NS_BH_Bias_HAS_SAV_UserArgs_MT256x256x64_MI16x16x1_SN_LDSB1_CLR1_GRVWA16_GRVWB16_GSU0_GSUC0_GSUWGMRR0_K1_LBSPPA512_LBSPPB2048_LPA16_LPB0_LRVW8_MIWT8_8_PLR1_SU0_SUM0_SUS64_VWA8_VWB8_WGM6_WGMXCC1_WGMXCCGn1
    SolutionIndex: 6
    SolutionNameMin: Cijk_Alik_Bjlk_B8F8NB8NS_BH_Bias_HAS_SAV_UserArgs_MT256x256x64_MI16x16x1_SN_LDSB1_CLR1_GRVWA8_GRVWB8_GSU0_GSUC0_GSUWGMRR0_K1_LBSPPA512_LBSPPB2048_LPA8_LPB0_LRVW8_MIWT8_8_PLR1_SU0_SUM0_SUS64_VWA8_VWB8_WGM8_WGMXCC1_WGMXCCGn1
    SolutionIndex: 7
    SolutionNameMin: Cijk_Alik_Bjlk_B8F8NB8NS_BH_Bias_HAS_SAV_UserArgs_MT256x256x64_MI16x16x1_SN_LDSB1_CLR1_GRVWA8_GRVWB16_GSU0_GSUC0_GSUWGMRR0_K1_LBSPPA512_LBSPPB2048_LPA8_LPB0_LRVW8_MIWT8_8_PLR1_SU0_SUM0_SUS64_VWA8_VWB8_WGM8_WGMXCC1_WGMXCCGn1
    SolutionIndex: 8
    SolutionNameMin: Cijk_Alik_Bjlk_B8F8NB8NS_BH_Bias_HAS_SAV_UserArgs_MT256x256x64_MI16x16x1_SN_LDSB1_CLR1_GRVWA16_GRVWB16_GSU0_GSUC0_GSUWGMRR0_K1_LBSPPA512_LBSPPB2048_LPA16_LPB0_LRVW8_MIWT8_8_PLR1_SU0_SUM0_SUS64_VWA8_VWB8_WGM8_WGMXCC1_WGMXCCGn1
    SolutionIndex: 9
    SolutionNameMin: Cijk_Alik_Bjlk_B8F8NB8NS_BH_Bias_HAS_SAV_UserArgs_MT128x256x64_MI16x16x1_SN_LDSB1_CLR1_GRVWA8_GRVWB16_GSU0_GSUC0_GSUWGMRR0_K1_LBSPPA256_LBSPPB2048_LPA8_LPB0_LRVW8_MIWT4_8_PLR1_SU0_SUM0_SUS64_VWA4_VWB8_WGM1_WGMXCC1_WGMXCCGn1
    SolutionIndex: 10
    SolutionNameMin: Cijk_Alik_Bjlk_B8F8NB8NS_BH_Bias_HAS_SAV_UserArgs_MT128x256x64_MI16x16x1_SN_LDSB1_CLR1_GRVWA8_GRVWB16_GSU0_GSUC0_GSUWGMRR0_K1_LBSPPA256_LBSPPB2048_LPA8_LPB0_LRVW8_MIWT4_8_PLR1_SU0_SUM0_SUS64_VWA4_VWB8_WGM4_WGMXCC1_WGMXCCGn1
    SolutionIndex: 11
    SolutionNameMin: Cijk_Alik_Bjlk_B8F8NB8NS_BH_Bias_HAS_SAV_UserArgs_MT128x256x64_MI16x16x1_SN_LDSB1_CLR1_GRVWA8_GRVWB8_GSU0_GSUC0_GSUWGMRR0_K1_LBSPPA256_LBSPPB2048_LPA8_LPB0_LRVW8_MIWT4_8_PLR1_SU0_SUM0_SUS64_VWA4_VWB8_WGM8_WGMXCC1_WGMXCCGn1
    SolutionIndex: 12
    SolutionNameMin: Cijk_Alik_Bjlk_B8F8NB8NS_BH_Bias_HAS_SAV_UserArgs_MT256x128x64_MI16x16x1_SN_LDSB1_CLR1_GRVWA8_GRVWB8_GSU0_GSUC0_GSUWGMRR0_K1_LBSPPA512_LBSPPB1024_LPA8_LPB64_LRVW8_MIWT8_4_PLR1_SU0_SUM0_SUS64_VWA8_VWB4_WGM1_WGMXCC1_WGMXCCGn1
    SolutionIndex: 13
    SolutionNameMin: Cijk_Alik_Bjlk_B8F8NB8NS_BH_Bias_HAS_SAV_UserArgs_MT256x128x64_MI16x16x1_SN_LDSB1_CLR1_GRVWA16_GRVWB8_GSU0_GSUC0_GSUWGMRR0_K1_LBSPPA512_LBSPPB1024_LPA16_LPB64_LRVW8_MIWT8_4_PLR1_SU0_SUM0_SUS64_VWA8_VWB4_WGM1_WGMXCC1_WGMXCCGn1
    SolutionIndex: 14
    SolutionNameMin: Cijk_Alik_Bjlk_B8F8NB8NS_BH_Bias_HAS_SAV_UserArgs_MT256x128x64_MI16x16x1_SN_LDSB1_CLR1_GRVWA8_GRVWB16_GSU0_GSUC0_GSUWGMRR0_K1_LBSPPA512_LBSPPB1024_LPA8_LPB64_LRVW8_MIWT8_4_PLR1_SU0_SUM0_SUS64_VWA8_VWB4_WGM1_WGMXCC1_WGMXCCGn1
    SolutionIndex: 15
    SolutionNameMin: Cijk_Alik_Bjlk_B8F8NB8NS_BH_Bias_HAS_SAV_UserArgs_MT256x128x64_MI16x16x1_SN_LDSB1_CLR1_GRVWA16_GRVWB16_GSU0_GSUC0_GSUWGMRR0_K1_LBSPPA512_LBSPPB1024_LPA16_LPB64_LRVW8_MIWT8_4_PLR1_SU0_SUM0_SUS64_VWA8_VWB4_WGM1_WGMXCC1_WGMXCCGn1
    SolutionIndex: 16
    SolutionNameMin: Cijk_Alik_Bjlk_B8F8NB8NS_BH_Bias_HAS_SAV_UserArgs_MT256x128x64_MI16x16x1_SN_LDSB1_CLR1_GRVWA8_GRVWB16_GSU0_GSUC0_GSUWGMRR0_K1_LBSPPA512_LBSPPB1024_LPA8_LPB64_LRVW8_MIWT8_4_PLR1_SU0_SUM0_SUS64_VWA8_VWB4_WGM4_WGMXCC1_WGMXCCGn1
    SolutionIndex: 17
    SolutionNameMin: Cijk_Alik_Bjlk_B8F8NB8NS_BH_Bias_HAS_SAV_UserArgs_MT256x128x64_MI16x16x1_SN_LDSB1_CLR1_GRVWA16_GRVWB8_GSU0_GSUC0_GSUWGMRR0_K1_LBSPPA512_LBSPPB1024_LPA16_LPB64_LRVW8_MIWT8_4_PLR1_SU0_SUM0_SUS64_VWA8_VWB4_WGM8_WGMXCC1_WGMXCCGn1
    SolutionIndex: 18
    SolutionNameMin: Cijk_Alik_Bjlk_B8F8NB8NS_BH_Bias_HAS_SAV_UserArgs_MT128x128x64_MI16x16x1_SN_LDSB1_CLR1_GRVWA8_GRVWB16_GSU0_GSUC0_GSUWGMRR0_K1_LBSPPA512_LBSPPB1024_LPA8_LPB32_LRVW8_MIWT8_2_PLR1_SU0_SUM0_SUS64_VWA8_VWB2_WGM1_WGMXCC1_WGMXCCGn1
    SolutionIndex: 19
    SolutionNameMin: Cijk_Alik_Bjlk_B8F8NB8NS_BH_Bias_HAS_SAV_UserArgs_MT128x64x64_MI16x16x1_SN_LDSB0_CLR1_GRVWA8_GRVWB8_GSU0_GSUC0_GSUWGMRR0_K1_LBSPPA512_LBSPPB512_LPA8_LPB16_LRVW8_MIWT8_1_PLR1_SU0_SUM0_SUS64_VWA8_VWB1_WGM1_WGMXCC1_WGMXCCGn1
    SolutionIndex: 20
    SolutionNameMin: Cijk_Alik_Bjlk_B8F8NB8NS_BH_Bias_HAS_SAV_UserArgs_MT128x64x64_MI16x16x1_SN_LDSB0_CLR1_GRVWA8_GRVWB16_GSU0_GSUC0_GSUWGMRR0_K1_LBSPPA512_LBSPPB512_LPA8_LPB16_LRVW8_MIWT8_1_PLR1_SU0_SUM0_SUS64_VWA8_VWB1_WGM1_WGMXCC1_WGMXCCGn1
    SolutionIndex: 21
    SolutionNameMin: Cijk_Alik_Bjlk_B8F8NB8NS_BH_Bias_HAS_SAV_UserArgs_MT128x128x64_MI16x16x1_SN_LDSB1_CLR1_GRVWA8_GRVWB8_GSU0_GSUC0_GSUWGMRR0_K1_LBSPPA256_LBSPPB1024_LPA8_LPB64_LRVW8_MIWT4_4_PLR1_SU0_SUM0_SUS64_VWA4_VWB4_WGM1_WGMXCC1_WGMXCCGn1
    SolutionIndex: 22
    SolutionNameMin: Cijk_Alik_Bjlk_B8F8NB8NS_BH_Bias_HAS_SAV_UserArgs_MT128x128x64_MI16x16x1_SN_LDSB1_CLR1_GRVWA16_GRVWB8_GSU0_GSUC0_GSUWGMRR0_K1_LBSPPA256_LBSPPB1024_LPA16_LPB64_LRVW8_MIWT4_4_PLR1_SU0_SUM0_SUS64_VWA4_VWB4_WGM1_WGMXCC1_WGMXCCGn1
    SolutionIndex: 23
    SolutionNameMin: Cijk_Alik_Bjlk_B8F8NB8NS_BH_Bias_HAS_SAV_UserArgs_MT128x64x64_MI16x16x1_SN_LDSB0_CLR1_GRVWA8_GRVWB8_GSU0_GSUC0_GSUWGMRR0_K1_LBSPPA256_LBSPPB512_LPA8_LPB32_LRVW8_MIWT4_2_PLR1_SU0_SUM0_SUS64_VWA4_VWB2_WGM1_WGMXCC1_WGMXCCGn1
    SolutionIndex: 24
    SolutionNameMin: Cijk_Alik_Bjlk_B8F8NB8NS_BH_Bias_HAS_SAV_UserArgs_MT128x64x64_MI16x16x1_SN_LDSB0_CLR1_GRVWA16_GRVWB8_GSU0_GSUC0_GSUWGMRR0_K1_LBSPPA256_LBSPPB512_LPA16_LPB32_LRVW8_MIWT4_2_PLR1_SU0_SUM0_SUS64_VWA4_VWB2_WGM1_WGMXCC1_WGMXCCGn1
    SolutionIndex: 25
    SolutionNameMin: Cijk_Alik_Bjlk_B8F8NB8NS_BH_Bias_HAS_SAV_UserArgs_MT128x64x64_MI16x16x1_SN_LDSB0_CLR1_GRVWA8_GRVWB16_GSU0_GSUC0_GSUWGMRR0_K1_LBSPPA256_LBSPPB512_LPA8_LPB32_LRVW8_MIWT4_2_PLR1_SU0_SUM0_SUS64_VWA4_VWB2_WGM1_WGMXCC1_WGMXCCGn1
    SolutionIndex: 26
    SolutionNameMin: Cijk_Alik_Bjlk_B8F8NB8NS_BH_Bias_HAS_SAV_UserArgs_MT128x64x64_MI16x16x1_SN_LDSB0_CLR1_GRVWA8_GRVWB16_GSU0_GSUC0_GSUWGMRR0_K1_LBSPPA256_LBSPPB512_LPA8_LPB32_LRVW8_MIWT4_2_PLR1_SU0_SUM0_SUS64_VWA4_VWB2_WGM4_WGMXCC1_WGMXCCGn1
    SolutionIndex: 27
    SolutionNameMin: Cijk_Alik_Bjlk_B8F8NB8NS_BH_Bias_HAS_SAV_UserArgs_MT128x64x64_MI16x16x1_SN_LDSB0_CLR1_GRVWA8_GRVWB16_GSU0_GSUC0_GSUWGMRR0_K1_LBSPPA256_LBSPPB512_LPA8_LPB32_LRVW8_MIWT4_2_PLR1_SU0_SUM0_SUS64_VWA4_VWB2_WGM8_WGMXCC1_WGMXCCGn1
    SolutionIndex: 28
    SolutionNameMin: Cijk_Alik_Bjlk_B8F8NB8NS_BH_Bias_HAS_SAV_UserArgs_MT128x32x64_MI16x16x1_SN_LDSB0_CLR1_GRVWA8_GRVWB8_GSU0_GSUC0_GSUWGMRR0_K1_LBSPPA256_LBSPPB256_LPA8_LPB16_LRVW8_MIWT4_1_PLR1_SU0_SUM0_SUS64_VWA4_VWB1_WGM1_WGMXCC1_WGMXCCGn1
    SolutionIndex: 29
    SolutionNameMin: Cijk_Alik_Bjlk_B8F8NB8NS_BH_Bias_HAS_SAV_UserArgs_MT128x32x64_MI16x16x1_SN_LDSB0_CLR1_GRVWA16_GRVWB8_GSU0_GSUC0_GSUWGMRR0_K1_LBSPPA256_LBSPPB256_LPA16_LPB16_LRVW8_MIWT4_1_PLR1_SU0_SUM0_SUS64_VWA4_VWB1_WGM1_WGMXCC1_WGMXCCGn1
    SolutionIndex: 30
    SolutionNameMin: Cijk_Alik_Bjlk_B8F8NB8NS_BH_Bias_HAS_SAV_UserArgs_MT64x64x64_MI16x16x1_SN_LDSB0_CLR1_GRVWA8_GRVWB8_GSU0_GSUC0_GSUWGMRR0_K1_LBSPPA128_LBSPPB512_LPA8_LPB32_LRVW8_MIWT2_2_PLR1_SU0_SUM0_SUS64_VWA2_VWB2_WGM1_WGMXCC1_WGMXCCGn1
    SolutionIndex: 31
    SolutionNameMin: Cijk_Alik_Bjlk_B8F8NB8NS_BH_Bias_HAS_SAV_UserArgs_MT64x64x64_MI16x16x1_SN_LDSB0_CLR1_GRVWA16_GRVWB8_GSU0_GSUC0_GSUWGMRR0_K1_LBSPPA128_LBSPPB512_LPA16_LPB32_LRVW8_MIWT2_2_PLR1_SU0_SUM0_SUS64_VWA2_VWB2_WGM1_WGMXCC1_WGMXCCGn1
    SolutionIndex: 32
    SolutionNameMin: Cijk_Alik_Bjlk_B8F8NB8NS_BH_Bias_HAS_SAV_UserArgs_MT64x32x64_MI16x16x1_SN_LDSB0_CLR1_GRVWA8_GRVWB8_GSU0_GSUC0_GSUWGMRR0_K1_LBSPPA128_LBSPPB256_LPA8_LPB16_LRVW8_MIWT2_1_PLR1_SU0_SUM0_SUS64_VWA2_VWB1_WGM1_WGMXCC1_WGMXCCGn1
    SolutionIndex: 33
    SolutionNameMin: Cijk_Alik_Bjlk_B8F8NB8NS_BH_Bias_HAS_SAV_UserArgs_MT64x32x64_MI16x16x1_SN_LDSB0_CLR1_GRVWA16_GRVWB8_GSU0_GSUC0_GSUWGMRR0_K1_LBSPPA128_LBSPPB256_LPA16_LPB16_LRVW8_MIWT2_1_PLR1_SU0_SUM0_SUS64_VWA2_VWB1_WGM1_WGMXCC1_WGMXCCGn1
    SolutionIndex: 34
    SolutionNameMin: Cijk_Alik_Bjlk_B8F8NB8NS_BH_Bias_HAS_SAV_UserArgs_MT32x32x64_MI16x16x1_SN_LDSB0_CLR1_GRVWA8_GRVWB8_GSU0_GSUC0_GSUWGMRR0_K1_LBSPPA128_LBSPPB256_LPA8_LPB16_LRVW8_MIWT1_1_PLR1_SU0_SUM0_SUS64_VWA1_VWB1_WGM1_WGMXCC1_WGMXCCGn1
    SolutionIndex: 35
    SolutionNameMin: Cijk_Alik_Bjlk_B8F8NB8NS_BH_Bias_HAS_SAV_UserArgs_MT128x256x128_MI16x16x1_SN_LDSB1_CLR1_GRVWA8_GRVWB16_GSU0_GSUC0_GSUWGMRR0_K1_LBSPPA512_LBSPPB2048_LPA8_LPB0_LRVW8_MIWT4_8_PLR1_SU0_SUM0_SUS128_VWA4_VWB8_WGM1_WGMXCC1_WGMXCCGn1
    SolutionIndex: 36
    SolutionNameMin: Cijk_Alik_Bjlk_B8F8NB8NS_BH_Bias_HAS_SAV_UserArgs_MT128x256x128_MI16x16x1_SN_LDSB1_CLR1_GRVWA16_GRVWB16_GSU0_GSUC0_GSUWGMRR0_K1_LBSPPA512_LBSPPB2048_LPA16_LPB0_LRVW8_MIWT4_8_PLR1_SU0_SUM0_SUS128_VWA4_VWB8_WGM1_WGMXCC1_WGMXCCGn1
    SolutionIndex: 37
    SolutionNameMin: Cijk_Alik_Bjlk_B8F8NB8NS_BH_Bias_HAS_SAV_UserArgs_MT128x256x128_MI16x16x1_SN_LDSB1_CLR1_GRVWA8_GRVWB16_GSU0_GSUC0_GSUWGMRR0_K1_LBSPPA512_LBSPPB2048_LPA8_LPB0_LRVW8_MIWT4_8_PLR1_SU0_SUM0_SUS128_VWA4_VWB8_WGM4_WGMXCC1_WGMXCCGn1
    SolutionIndex: 38
    SolutionNameMin: Cijk_Alik_Bjlk_B8F8NB8NS_BH_Bias_HAS_SAV_UserArgs_MT128x256x128_MI16x16x1_SN_LDSB1_CLR1_GRVWA8_GRVWB16_GSU0_GSUC0_GSUWGMRR0_K1_LBSPPA512_LBSPPB2048_LPA8_LPB0_LRVW8_MIWT4_8_PLR1_SU0_SUM0_SUS128_VWA4_VWB8_WGM6_WGMXCC1_WGMXCCGn1
    SolutionIndex: 39
    SolutionNameMin: Cijk_Alik_Bjlk_B8F8NB8NS_BH_Bias_HAS_SAV_UserArgs_MT128x256x128_MI16x16x1_SN_LDSB1_CLR1_GRVWA8_GRVWB16_GSU0_GSUC0_GSUWGMRR0_K1_LBSPPA512_LBSPPB2048_LPA8_LPB0_LRVW8_MIWT4_8_PLR1_SU0_SUM0_SUS128_VWA4_VWB8_WGM8_WGMXCC1_WGMXCCGn1
    SolutionIndex: 40
    SolutionNameMin: Cijk_Alik_Bjlk_B8F8NB8NS_BH_Bias_HAS_SAV_UserArgs_MT256x128x128_MI16x16x1_SN_LDSB1_CLR1_GRVWA8_GRVWB16_GSU0_GSUC0_GSUWGMRR0_K1_LBSPPA1024_LBSPPB1024_LPA8_LPB64_LRVW8_MIWT8_4_PLR1_SU0_SUM0_SUS128_VWA8_VWB4_WGM1_WGMXCC1_WGMXCCGn1
    SolutionIndex: 41
    SolutionNameMin: Cijk_Alik_Bjlk_B8F8NB8NS_BH_Bias_HAS_SAV_UserArgs_MT256x128x128_MI16x16x1_SN_LDSB1_CLR1_GRVWA8_GRVWB16_GSU0_GSUC0_GSUWGMRR0_K1_LBSPPA1024_LBSPPB1024_LPA8_LPB64_LRVW8_MIWT8_4_PLR1_SU0_SUM0_SUS128_VWA8_VWB4_WGM4_WGMXCC1_WGMXCCGn1
    SolutionIndex: 42
    SolutionNameMin: Cijk_Alik_Bjlk_B8F8NB8NS_BH_Bias_HAS_SAV_UserArgs_MT256x128x128_MI16x16x1_SN_LDSB1_CLR1_GRVWA16_GRVWB16_GSU0_GSUC0_GSUWGMRR0_K1_LBSPPA1024_LBSPPB1024_LPA16_LPB64_LRVW8_MIWT8_4_PLR1_SU0_SUM0_SUS128_VWA8_VWB4_WGM4_WGMXCC1_WGMXCCGn1
    SolutionIndex: 43
    SolutionNameMin: Cijk_Alik_Bjlk_B8F8NB8NS_BH_Bias_HAS_SAV_UserArgs_MT144x256x128_MI16x16x1_SN_LDSB1_CLR1_GRVWA8_GRVWB16_GSU0_GSUC0_GSUWGMRR0_K1_LBSPPA128_LBSPPB2048_LPA8_LPB64_LRVW8_MIWT9_4_PLR1_SU0_SUM0_SUS128_VWA1_VWB4_WGM4_WGMXCC1_WGMXCCGn1
    SolutionIndex: 44
    SolutionNameMin: Cijk_Alik_Bjlk_B8F8NB8NS_BH_Bias_HAS_SAV_UserArgs_MT144x256x128_MI16x16x1_SN_LDSB1_CLR1_GRVWA8_GRVWB16_GSU0_GSUC0_GSUWGMRR0_K1_LBSPPA128_LBSPPB2048_LPA8_LPB64_LRVW8_MIWT9_4_PLR1_SU0_SUM0_SUS128_VWA1_VWB4_WGM6_WGMXCC1_WGMXCCGn1
    SolutionIndex: 45
    SolutionNameMin: Cijk_Alik_Bjlk_B8F8NB8NS_BH_Bias_HAS_SAV_UserArgs_MT144x256x128_MI16x16x1_SN_LDSB1_CLR1_GRVWA8_GRVWB16_GSU0_GSUC0_GSUWGMRR0_K1_LBSPPA128_LBSPPB2048_LPA8_LPB64_LRVW8_MIWT9_4_PLR1_SU0_SUM0_SUS128_VWA1_VWB4_WGM8_WGMXCC1_WGMXCCGn1
    SolutionIndex: 46
    SolutionNameMin: Cijk_Alik_Bjlk_B8F8NB8NS_BH_Bias_HAS_SAV_UserArgs_MT144x128x128_MI16x16x1_SN_LDSB1_CLR1_GRVWA8_GRVWB16_GSU0_GSUC0_GSUWGMRR0_K1_LBSPPA128_LBSPPB1024_LPA8_LPB32_LRVW8_MIWT9_2_PLR1_SU0_SUM0_SUS128_VWA1_VWB2_WGM4_WGMXCC1_WGMXCCGn1
    SolutionIndex: 47
    SolutionNameMin: Cijk_Alik_Bjlk_B8F8NB8NS_BH_Bias_HAS_SAV_UserArgs_MT144x128x128_MI16x16x1_SN_LDSB1_CLR1_GRVWA8_GRVWB16_GSU0_GSUC0_GSUWGMRR0_K1_LBSPPA128_LBSPPB1024_LPA8_LPB32_LRVW8_MIWT9_2_PLR1_SU0_SUM0_SUS128_VWA1_VWB2_WGM6_WGMXCC1_WGMXCCGn1
    SolutionIndex: 48
    SolutionNameMin: Cijk_Alik_Bjlk_B8F8NB8NS_BH_Bias_HAS_SAV_UserArgs_MT144x128x128_MI16x16x1_SN_LDSB1_CLR1_GRVWA8_GRVWB16_GSU0_GSUC0_GSUWGMRR0_K1_LBSPPA128_LBSPPB1024_LPA8_LPB32_LRVW8_MIWT9_2_PLR1_SU0_SUM0_SUS128_VWA1_VWB2_WGM8_WGMXCC1_WGMXCCGn1
    SolutionIndex: 49
    SolutionNameMin: Cijk_Alik_Bjlk_B8F8NB8NS_BH_Bias_HAS_SAV_UserArgs_MT128x128x128_MI16x16x1_SN_LDSB1_CLR1_GRVWA16_GRVWB8_GSU0_GSUC0_GSUWGMRR0_K1_LBSPPA512_LBSPPB1024_LPA16_LPB64_LRVW8_MIWT4_4_PLR1_SU0_SUM0_SUS128_VWA4_VWB4_WGM1_WGMXCC1_WGMXCCGn1
    SolutionIndex: 50
    SolutionNameMin: Cijk_Alik_Bjlk_B8F8NB8NS_BH_Bias_HAS_SAV_UserArgs_MT128x128x128_MI16x16x1_SN_LDSB1_CLR1_GRVWA16_GRVWB16_GSU0_GSUC0_GSUWGMRR0_K1_LBSPPA512_LBSPPB1024_LPA16_LPB64_LRVW8_MIWT4_4_PLR1_SU0_SUM0_SUS128_VWA4_VWB4_WGM1_WGMXCC1_WGMXCCGn1
    SolutionIndex: 51
    SolutionNameMin: Cijk_Alik_Bjlk_B8F8NB8NS_BH_Bias_HAS_SAV_UserArgs_MT128x128x128_MI16x16x1_SN_LDSB1_CLR1_GRVWA16_GRVWB16_GSU0_GSUC0_GSUWGMRR0_K1_LBSPPA512_LBSPPB1024_LPA16_LPB64_LRVW8_MIWT4_4_PLR1_SU0_SUM0_SUS128_VWA4_VWB4_WGM4_WGMXCC1_WGMXCCGn1
    SolutionIndex: 52
    SolutionNameMin: Cijk_Alik_Bjlk_B8F8NB8NS_BH_Bias_HAS_SAV_UserArgs_MT128x128x128_MI16x16x1_SN_LDSB1_CLR1_GRVWA16_GRVWB16_GSU0_GSUC0_GSUWGMRR0_K1_LBSPPA512_LBSPPB1024_LPA16_LPB64_LRVW8_MIWT4_4_PLR1_SU0_SUM0_SUS128_VWA4_VWB4_WGM6_WGMXCC1_WGMXCCGn1
    SolutionIndex: 53
    SolutionNameMin: Cijk_Alik_Bjlk_B8F8NB8NS_BH_Bias_HAS_SAV_UserArgs_MT128x128x128_MI16x16x1_SN_LDSB1_CLR1_GRVWA16_GRVWB16_GSU0_GSUC0_GSUWGMRR0_K1_LBSPPA512_LBSPPB1024_LPA16_LPB64_LRVW8_MIWT4_4_PLR1_SU0_SUM0_SUS128_VWA4_VWB4_WGM8_WGMXCC1_WGMXCCGn1
    SolutionIndex: 54
    SolutionNameMin: Cijk_Alik_Bjlk_B8F8NB8NS_BH_Bias_HAS_SAV_UserArgs_MT64x128x128_MI16x16x1_SN_LDSB1_CLR1_GRVWA8_GRVWB16_GSU0_GSUC0_GSUWGMRR0_K1_LBSPPA256_LBSPPB1024_LPA8_LPB64_LRVW8_MIWT2_4_PLR1_SU0_SUM0_SUS128_VWA2_VWB4_WGM1_WGMXCC1_WGMXCCGn1
    SolutionIndex: 55
    SolutionNameMin: Cijk_Alik_Bjlk_B8F8NB8NS_BH_Bias_HAS_SAV_UserArgs_MT128x64x128_MI16x16x1_SN_LDSB1_CLR1_GRVWA16_GRVWB16_GSU0_GSUC0_GSUWGMRR0_K1_LBSPPA512_LBSPPB512_LPA16_LPB32_LRVW8_MIWT4_2_PLR1_SU0_SUM0_SUS128_VWA4_VWB2_WGM4_WGMXCC1_WGMXCCGn1
    SolutionIndex: 56
    SolutionNameMin: Cijk_Alik_Bjlk_B8F8NB8NS_BH_Bias_HAS_SAV_UserArgs_MT64x64x128_MI16x16x1_SN_LDSB1_CLR1_GRVWA8_GRVWB8_GSU0_GSUC0_GSUWGMRR0_K1_LBSPPA256_LBSPPB512_LPA8_LPB32_LRVW8_MIWT2_2_PLR1_SU0_SUM0_SUS128_VWA2_VWB2_WGM1_WGMXCC1_WGMXCCGn1
    SolutionIndex: 57
    SolutionNameMin: Cijk_Alik_Bjlk_B8F8NB8NS_BH_Bias_HAS_SAV_UserArgs_MT64x64x128_MI16x16x1_SN_LDSB1_CLR1_GRVWA8_GRVWB16_GSU0_GSUC0_GSUWGMRR0_K1_LBSPPA256_LBSPPB512_LPA8_LPB32_LRVW8_MIWT2_2_PLR1_SU0_SUM0_SUS128_VWA2_VWB2_WGM1_WGMXCC1_WGMXCCGn1
    SolutionIndex: 58
    SolutionNameMin: Cijk_Alik_Bjlk_B8F8NB8NS_BH_Bias_HAS_SAV_UserArgs_MT64x64x128_MI16x16x1_SN_LDSB1_CLR1_GRVWA16_GRVWB16_GSU0_GSUC0_GSUWGMRR0_K1_LBSPPA256_LBSPPB512_LPA16_LPB32_LRVW8_MIWT2_2_PLR1_SU0_SUM0_SUS128_VWA2_VWB2_WGM1_WGMXCC1_WGMXCCGn1
    SolutionIndex: 59
    SolutionNameMin: Cijk_Alik_Bjlk_B8F8NB8NS_BH_Bias_HAS_SAV_UserArgs_MT32x64x128_MI16x16x1_SN_LDSB0_CLR1_GRVWA8_GRVWB16_GSU0_GSUC0_GSUWGMRR0_K1_LBSPPA128_LBSPPB512_LPA8_LPB32_LRVW8_MIWT1_2_PLR1_SU0_SUM0_SUS128_VWA1_VWB2_WGM4_WGMXCC1_WGMXCCGn1
    SolutionIndex: 60
    SolutionNameMin: Cijk_Alik_Bjlk_B8F8NB8NS_BH_Bias_HAS_SAV_UserArgs_MT64x32x128_MI16x16x1_SN_LDSB0_CLR1_GRVWA8_GRVWB8_GSU0_GSUC0_GSUWGMRR0_K1_LBSPPA256_LBSPPB256_LPA8_LPB16_LRVW8_MIWT2_1_PLR1_SU0_SUM0_SUS128_VWA2_VWB1_WGM1_WGMXCC1_WGMXCCGn1
    SolutionIndex: 61
    SolutionNameMin: Cijk_Alik_Bjlk_B8F8NB8NS_BH_Bias_HAS_SAV_UserArgs_MT64x32x128_MI16x16x1_SN_LDSB0_CLR1_GRVWA16_GRVWB8_GSU0_GSUC0_GSUWGMRR0_K1_LBSPPA256_LBSPPB256_LPA16_LPB16_LRVW8_MIWT2_1_PLR1_SU0_SUM0_SUS128_VWA2_VWB1_WGM1_WGMXCC1_WGMXCCGn1
    SolutionIndex: 62
    SolutionNameMin: Cijk_Alik_Bjlk_B8F8NB8NS_BH_Bias_HAS_SAV_UserArgs_MT64x32x128_MI16x16x1_SN_LDSB0_CLR1_GRVWA8_GRVWB16_GSU0_GSUC0_GSUWGMRR0_K1_LBSPPA256_LBSPPB256_LPA8_LPB16_LRVW8_MIWT2_1_PLR1_SU0_SUM0_SUS128_VWA2_VWB1_WGM1_WGMXCC1_WGMXCCGn1
    SolutionIndex: 63
    SolutionNameMin: Cijk_Alik_Bjlk_B8F8NB8NS_BH_Bias_HAS_SAV_UserArgs_MT64x32x128_MI16x16x1_SN_LDSB0_CLR1_GRVWA8_GRVWB16_GSU0_GSUC0_GSUWGMRR0_K1_LBSPPA256_LBSPPB256_LPA8_LPB16_LRVW8_MIWT2_1_PLR1_SU0_SUM0_SUS128_VWA2_VWB1_WGM4_WGMXCC1_WGMXCCGn1
    SolutionIndex: 64
    SolutionNameMin: Cijk_Alik_Bjlk_B8F8NB8NS_BH_Bias_HAS_SAV_UserArgs_MT64x32x128_MI16x16x1_SN_LDSB0_CLR1_GRVWA8_GRVWB16_GSU0_GSUC0_GSUWGMRR0_K1_LBSPPA256_LBSPPB256_LPA8_LPB16_LRVW8_MIWT2_1_PLR1_SU0_SUM0_SUS128_VWA2_VWB1_WGM6_WGMXCC1_WGMXCCGn1
    SolutionIndex: 65
    SolutionNameMin: Cijk_Alik_Bjlk_B8F8NB8NS_BH_Bias_HAS_SAV_UserArgs_MT64x32x128_MI16x16x1_SN_LDSB0_CLR1_GRVWA8_GRVWB16_GSU0_GSUC0_GSUWGMRR0_K1_LBSPPA256_LBSPPB256_LPA8_LPB16_LRVW8_MIWT2_1_PLR1_SU0_SUM0_SUS128_VWA2_VWB1_WGM8_WGMXCC1_WGMXCCGn1
    SolutionIndex: 66
    SolutionNameMin: Cijk_Alik_Bjlk_B8F8NB8NS_BH_Bias_HAS_SAV_UserArgs_MT32x32x128_MI16x16x1_SN_LDSB0_CLR1_GRVWA8_GRVWB8_GSU0_GSUC0_GSUWGMRR0_K1_LBSPPA128_LBSPPB256_LPA8_LPB16_LRVW8_MIWT1_1_PLR1_SU0_SUM0_SUS128_VWA1_VWB1_WGM1_WGMXCC1_WGMXCCGn1
    SolutionIndex: 67
    SolutionNameMin: Cijk_Alik_Bjlk_B8F8NB8NS_BH_Bias_HAS_SAV_UserArgs_MT32x32x128_MI16x16x1_SN_LDSB0_CLR1_GRVWA16_GRVWB8_GSU0_GSUC0_GSUWGMRR0_K1_LBSPPA128_LBSPPB256_LPA16_LPB16_LRVW8_MIWT1_1_PLR1_SU0_SUM0_SUS128_VWA1_VWB1_WGM1_WGMXCC1_WGMXCCGn1
    SolutionIndex: 68
    SolutionNameMin: Cijk_Alik_Bjlk_B8F8NB8NS_BH_Bias_HAS_SAV_UserArgs_MT32x32x128_MI16x16x1_SN_LDSB0_CLR1_GRVWA8_GRVWB16_GSU0_GSUC0_GSUWGMRR0_K1_LBSPPA128_LBSPPB256_LPA8_LPB16_LRVW8_MIWT1_1_PLR1_SU0_SUM0_SUS128_VWA1_VWB1_WGM1_WGMXCC1_WGMXCCGn1
    SolutionIndex: 69
    SolutionNameMin: Cijk_Alik_Bjlk_B8F8NB8NS_BH_Bias_HAS_SAV_UserArgs_MT32x32x128_MI16x16x1_SN_LDSB0_CLR1_GRVWA16_GRVWB16_GSU0_GSUC0_GSUWGMRR0_K1_LBSPPA128_LBSPPB256_LPA16_LPB16_LRVW8_MIWT1_1_PLR1_SU0_SUM0_SUS128_VWA1_VWB1_WGM1_WGMXCC1_WGMXCCGn1
    SolutionIndex: 70
    SolutionNameMin: Cijk_Alik_Bjlk_B8F8NB8NS_BH_Bias_HAS_SAV_UserArgs_MT32x32x128_MI16x16x1_SN_LDSB0_CLR1_GRVWA8_GRVWB16_GSU0_GSUC0_GSUWGMRR0_K1_LBSPPA128_LBSPPB256_LPA8_LPB16_LRVW8_MIWT1_1_PLR1_SU0_SUM0_SUS128_VWA1_VWB1_WGM4_WGMXCC1_WGMXCCGn1
    SolutionIndex: 71
    SolutionNameMin: Cijk_Alik_Bjlk_B8F8NB8NS_BH_Bias_HAS_SAV_UserArgs_MT32x32x128_MI16x16x1_SN_LDSB0_CLR1_GRVWA8_GRVWB8_GSU0_GSUC0_GSUWGMRR0_K1_LBSPPA128_LBSPPB256_LPA8_LPB16_LRVW8_MIWT1_1_PLR1_SU0_SUM0_SUS128_VWA1_VWB1_WGM8_WGMXCC1_WGMXCCGn1
    SolutionIndex: 72
    SolutionNameMin: Cijk_Alik_Bjlk_B8F8NB8NS_BH_Bias_HAS_SAV_UserArgs_MT32x32x128_MI16x16x1_SN_LDSB0_CLR1_GRVWA8_GRVWB16_GSU0_GSUC0_GSUWGMRR0_K1_LBSPPA128_LBSPPB256_LPA8_LPB16_LRVW8_MIWT1_1_PLR1_SU0_SUM0_SUS128_VWA1_VWB1_WGM8_WGMXCC1_WGMXCCGn1
    SolutionIndex: 73
    SolutionNameMin: Cijk_Alik_Bjlk_B8F8NB8NS_BH_Bias_HAS_SAV_UserArgs_MT128x64x256_MI16x16x1_SN_LDSB1_CLR1_GRVWA16_GRVWB16_GSU0_GSUC0_GSUWGMRR0_K1_LBSPPA1024_LBSPPB512_LPA16_LPB32_LRVW8_MIWT4_2_PLR1_SU0_SUM0_SUS256_VWA4_VWB2_WGM1_WGMXCC1_WGMXCCGn1
    SolutionIndex: 74
    SolutionNameMin: Cijk_Alik_Bjlk_B8F8NB8NS_BH_Bias_HAS_SAV_UserArgs_MT128x64x256_MI16x16x1_SN_LDSB1_CLR1_GRVWA16_GRVWB16_GSU0_GSUC0_GSUWGMRR0_K1_LBSPPA1024_LBSPPB512_LPA16_LPB32_LRVW8_MIWT4_2_PLR1_SU0_SUM0_SUS256_VWA4_VWB2_WGM4_WGMXCC1_WGMXCCGn1
    SolutionIndex: 75
    SolutionNameMin: Cijk_Alik_Bjlk_B8F8NB8NS_BH_Bias_HAS_SAV_UserArgs_MT128x64x256_MI16x16x1_SN_LDSB1_CLR1_GRVWA16_GRVWB16_GSU0_GSUC0_GSUWGMRR0_K1_LBSPPA1024_LBSPPB512_LPA16_LPB32_LRVW8_MIWT4_2_PLR1_SU0_SUM0_SUS256_VWA4_VWB2_WGM6_WGMXCC1_WGMXCCGn1
    SolutionIndex: 76
    SolutionNameMin: Cijk_Alik_Bjlk_B8F8NB8NS_BH_Bias_HAS_SAV_UserArgs_MT128x64x256_MI16x16x1_SN_LDSB1_CLR1_GRVWA16_GRVWB16_GSU0_GSUC0_GSUWGMRR0_K1_LBSPPA1024_LBSPPB512_LPA16_LPB32_LRVW8_MIWT4_2_PLR1_SU0_SUM0_SUS256_VWA4_VWB2_WGM8_WGMXCC1_WGMXCCGn1
    SolutionIndex: 77
    SolutionNameMin: Cijk_Alik_Bjlk_B8F8NB8NS_BH_Bias_HAS_SAV_UserArgs_MT64x64x256_MI16x16x1_SN_LDSB1_CLR1_GRVWA16_GRVWB16_GSU0_GSUC0_GSUWGMRR0_K1_LBSPPA512_LBSPPB512_LPA16_LPB32_LRVW8_MIWT2_2_PLR1_SU0_SUM0_SUS256_VWA2_VWB2_WGM1_WGMXCC1_WGMXCCGn1
    SolutionIndex: 78
    SolutionNameMin: Cijk_Alik_Bjlk_B8F8NB8NS_BH_Bias_HAS_SAV_UserArgs_MT64x64x256_MI16x16x1_SN_LDSB1_CLR1_GRVWA16_GRVWB16_GSU0_GSUC0_GSUWGMRR0_K1_LBSPPA512_LBSPPB512_LPA16_LPB32_LRVW8_MIWT2_2_PLR1_SU0_SUM0_SUS256_VWA2_VWB2_WGM4_WGMXCC1_WGMXCCGn1
    SolutionIndex: 79
    SolutionNameMin: Cijk_Alik_Bjlk_B8F8NB8NS_BH_Bias_HAS_SAV_UserArgs_MT64x64x256_MI16x16x1_SN_LDSB1_CLR1_GRVWA16_GRVWB16_GSU0_GSUC0_GSUWGMRR0_K1_LBSPPA512_LBSPPB512_LPA16_LPB32_LRVW8_MIWT2_2_PLR1_SU0_SUM0_SUS256_VWA2_VWB2_WGM6_WGMXCC1_WGMXCCGn1
    SolutionIndex: 80
    SolutionNameMin: Cijk_Alik_Bjlk_B8F8NB8NS_BH_Bias_HAS_SAV_UserArgs_MT64x64x256_MI16x16x1_SN_LDSB1_CLR1_GRVWA16_GRVWB16_GSU0_GSUC0_GSUWGMRR0_K1_LBSPPA512_LBSPPB512_LPA16_LPB32_LRVW8_MIWT2_2_PLR1_SU0_SUM0_SUS256_VWA2_VWB2_WGM8_WGMXCC1_WGMXCCGn1
    SolutionIndex: 81
    SolutionNameMin: Cijk_Alik_Bjlk_B8F8NB8NS_BH_Bias_HAS_SAV_UserArgs_MT32x64x256_MI16x16x1_SN_LDSB1_CLR1_GRVWA8_GRVWB16_GSU0_GSUC0_GSUWGMRR0_K1_LBSPPA256_LBSPPB512_LPA8_LPB32_LRVW8_MIWT1_2_PLR1_SU0_SUM0_SUS256_VWA1_VWB2_WGM1_WGMXCC1_WGMXCCGn1
    SolutionIndex: 82
    SolutionNameMin: Cijk_Alik_Bjlk_B8F8NB8NS_BH_Bias_HAS_SAV_UserArgs_MT32x64x256_MI16x16x1_SN_LDSB1_CLR1_GRVWA16_GRVWB16_GSU0_GSUC0_GSUWGMRR0_K1_LBSPPA256_LBSPPB512_LPA16_LPB32_LRVW8_MIWT1_2_PLR1_SU0_SUM0_SUS256_VWA1_VWB2_WGM1_WGMXCC1_WGMXCCGn1
    SolutionIndex: 83
    SolutionNameMin: Cijk_Alik_Bjlk_B8F8NB8NS_BH_Bias_HAS_SAV_UserArgs_MT32x64x256_MI16x16x1_SN_LDSB1_CLR1_GRVWA8_GRVWB16_GSU0_GSUC0_GSUWGMRR0_K1_LBSPPA256_LBSPPB512_LPA8_LPB32_LRVW8_MIWT1_2_PLR1_SU0_SUM0_SUS256_VWA1_VWB2_WGM6_WGMXCC1_WGMXCCGn1
    SolutionIndex: 84
    SolutionNameMin: Cijk_Alik_Bjlk_B8F8NB8NS_BH_Bias_HAS_SAV_UserArgs_MT32x64x256_MI16x16x1_SN_LDSB1_CLR1_GRVWA16_GRVWB16_GSU0_GSUC0_GSUWGMRR0_K1_LBSPPA256_LBSPPB512_LPA16_LPB32_LRVW8_MIWT1_2_PLR1_SU0_SUM0_SUS256_VWA1_VWB2_WGM6_WGMXCC1_WGMXCCGn1
    SolutionIndex: 85
    SolutionNameMin: Cijk_Alik_Bjlk_B8F8NB8NS_BH_Bias_HAS_SAV_UserArgs_MT64x32x256_MI16x16x1_SN_LDSB1_CLR1_GRVWA16_GRVWB16_GSU0_GSUC0_GSUWGMRR0_K1_LBSPPA512_LBSPPB256_LPA16_LPB16_LRVW8_MIWT2_1_PLR1_SU0_SUM0_SUS256_VWA2_VWB1_WGM4_WGMXCC1_WGMXCCGn1
    SolutionIndex: 86
    SolutionNameMin: Cijk_Alik_Bjlk_B8F8NB8NS_BH_Bias_HAS_SAV_UserArgs_MT32x32x256_MI16x16x1_SN_LDSB1_CLR1_GRVWA8_GRVWB16_GSU0_GSUC0_GSUWGMRR0_K1_LBSPPA256_LBSPPB256_LPA8_LPB16_LRVW8_MIWT1_1_PLR1_SU0_SUM0_SUS256_VWA1_VWB1_WGM1_WGMXCC1_WGMXCCGn1
    SolutionIndex: 87
    SolutionNameMin: Cijk_Alik_Bjlk_B8F8NB8NS_BH_Bias_HAS_SAV_UserArgs_MT32x32x256_MI16x16x1_SN_LDSB1_CLR1_GRVWA16_GRVWB16_GSU0_GSUC0_GSUWGMRR0_K1_LBSPPA256_LBSPPB256_LPA16_LPB16_LRVW8_MIWT1_1_PLR1_SU0_SUM0_SUS256_VWA1_VWB1_WGM1_WGMXCC1_WGMXCCGn1
    SolutionIndex: 88
    SolutionNameMin: Cijk_Alik_Bjlk_B8F8NB8NS_BH_Bias_HAS_SAV_UserArgs_MT32x32x256_MI16x16x1_SN_LDSB1_CLR1_GRVWA16_GRVWB16_GSU0_GSUC0_GSUWGMRR0_K1_LBSPPA256_LBSPPB256_LPA16_LPB16_LRVW8_MIWT1_1_PLR1_SU0_SUM0_SUS256_VWA1_VWB1_WGM6_WGMXCC1_WGMXCCGn1
- - - [128, 128, 1, 128, 128, 128, 128, 128]
    - [69, 0.54]
  - - [128, 128, 1, 256, 128, 128, 256, 128]
    - [34, 1.01]
  - - [128, 128, 1, 512, 128, 128, 512, 128]
    - [66, 1.73]
  - - [128, 128, 1, 1024, 128, 128, 1024, 128]
    - [66, 2.73]
  - - [128, 128, 1, 2048, 128, 128, 2048, 128]
    - [68, 3.82]
  - - [128, 128, 1, 4096, 128, 128, 4096, 128]
    - [68, 4.81]
  - - [128, 128, 1, 8192, 128, 128, 8192, 128]
    - [72, 5.5]
  - - [128, 256, 1, 128, 128, 128, 128, 256]
    - [34, 1.11]
  - - [128, 256, 1, 256, 128, 128, 256, 256]
    - [34, 2.01]
  - - [128, 256, 1, 512, 128, 128, 512, 256]
    - [67, 3.44]
  - - [128, 256, 1, 1024, 128, 128, 1024, 256]
    - [68, 5.43]
  - - [128, 256, 1, 2048, 128, 128, 2048, 256]
    - [68, 7.7]
  - - [128, 256, 1, 4096, 128, 128, 4096, 256]
    - [68, 9.69]
  - - [128, 256, 1, 8192, 128, 128, 8192, 256]
    - [68, 11.1]
  - - [128, 512, 1, 128, 128, 128, 128, 512]
    - [34, 2.21]
  - - [128, 512, 1, 256, 128, 128, 256, 512]
    - [66, 4.04]
  - - [128, 512, 1, 512, 128, 128, 512, 512]
    - [67, 6.87]
  - - [128, 512, 1, 1024, 128, 128, 1024, 512]
    - [66, 10.9]
  - - [128, 512, 1, 2048, 128, 128, 2048, 512]
    - [68, 15.25]
  - - [128, 512, 1, 4096, 128, 128, 4096, 512]
    - [68, 19.14]
  - - [128, 512, 1, 8192, 128, 128, 8192, 512]
    - [86, 17.31]
  - - [128, 1024, 1, 128, 128, 128, 128, 1024]
    - [66, 4.33]
  - - [128, 1024, 1, 256, 128, 128, 256, 1024]
    - [66, 7.88]
  - - [128, 1024, 1, 512, 128, 128, 512, 1024]
    - [66, 13.56]
  - - [128, 1024, 1, 1024, 128, 128, 1024, 1024]
    - [66, 21.26]
  - - [128, 1024, 1, 2048, 128, 128, 2048, 1024]
    - [68, 29.87]
  - - [128, 1024, 1, 4096, 128, 128, 4096, 1024]
    - [87, 31.69]
  - - [128, 1024, 1, 8192, 128, 128, 8192, 1024]
    - [88, 31.96]
  - - [128, 2048, 1, 128, 128, 128, 128, 2048]
    - [60, 8.18]
  - - [128, 2048, 1, 256, 128, 128, 256, 2048]
    - [60, 14.45]
  - - [128, 2048, 1, 512, 128, 128, 512, 2048]
    - [61, 24.48]
  - - [128, 2048, 1, 1024, 128, 128, 1024, 2048]
    - [62, 37.52]
  - - [128, 2048, 1, 2048, 128, 128, 2048, 2048]
    - [82, 43.95]
  - - [128, 2048, 1, 4096, 128, 128, 4096, 2048]
    - [82, 53.06]
  - - [128, 2048, 1, 8192, 128, 128, 8192, 2048]
    - [82, 59.76]
  - - [128, 4096, 1, 128, 128, 128, 128, 4096]
    - [56, 15.06]
  - - [128, 4096, 1, 256, 128, 128, 256, 4096]
    - [30, 26.89]
  - - [128, 4096, 1, 512, 128, 128, 512, 4096]
    - [30, 43.81]
  - - [128, 4096, 1, 1024, 128, 128, 1024, 4096]
    - [57, 65.54]
  - - [128, 4096, 1, 2048, 128, 128, 2048, 4096]
    - [77, 79.35]
  - - [128, 4096, 1, 4096, 128, 128, 4096, 4096]
    - [77, 96.89]
  - - [128, 4096, 1, 8192, 128, 128, 8192, 4096]
    - [77, 109.0]
  - - [128, 8192, 1, 128, 128, 128, 128, 8192]
    - [19, 26.12]
  - - [128, 8192, 1, 256, 128, 128, 256, 8192]
    - [25, 45.11]
  - - [128, 8192, 1, 512, 128, 128, 512, 8192]
    - [25, 72.86]
  - - [128, 8192, 1, 1024, 128, 128, 1024, 8192]
    - [25, 106.42]
  - - [128, 8192, 1, 2048, 128, 128, 2048, 8192]
    - [54, 123.49]
  - - [128, 8192, 1, 4096, 128, 128, 4096, 8192]
    - [54, 145.69]
  - - [128, 8192, 1, 8192, 128, 128, 8192, 8192]
    - [74, 155.9]
  - - [256, 128, 1, 128, 256, 256, 128, 128]
    - [33, 1.03]
  - - [256, 128, 1, 256, 256, 256, 256, 128]
    - [34, 1.91]
  - - [256, 128, 1, 512, 256, 256, 512, 128]
    - [66, 3.32]
  - - [256, 128, 1, 1024, 256, 256, 1024, 128]
    - [66, 5.39]
  - - [256, 128, 1, 2048, 256, 256, 2048, 128]
    - [68, 7.58]
  - - [256, 128, 1, 4096, 256, 256, 4096, 128]
    - [68, 9.59]
  - - [256, 128, 1, 8192, 256, 256, 8192, 128]
    - [68, 11.01]
  - - [256, 256, 1, 128, 256, 256, 128, 256]
    - [34, 2.04]
  - - [256, 256, 1, 256, 256, 256, 256, 256]
    - [34, 3.92]
  - - [256, 256, 1, 512, 256, 256, 512, 256]
    - [67, 6.82]
  - - [256, 256, 1, 1024, 256, 256, 1024, 256]
    - [68, 10.69]
  - - [256, 256, 1, 2048, 256, 256, 2048, 256]
    - [68, 15.23]
  - - [256, 256, 1, 4096, 256, 256, 4096, 256]
    - [68, 18.65]
  - - [256, 256, 1, 8192, 256, 256, 8192, 256]
    - [70, 21.67]
  - - [256, 512, 1, 128, 256, 256, 128, 512]
    - [34, 4.03]
  - - [256, 512, 1, 256, 256, 256, 256, 512]
    - [34, 7.68]
  - - [256, 512, 1, 512, 256, 256, 512, 512]
    - [66, 13.19]
  - - [256, 512, 1, 1024, 256, 256, 1024, 512]
    - [68, 20.96]
  - - [256, 512, 1, 2048, 256, 256, 2048, 512]
    - [66, 29.77]
  - - [256, 512, 1, 4096, 256, 256, 4096, 512]
    - [68, 37.5]
  - - [256, 512, 1, 8192, 256, 256, 8192, 512]
    - [87, 38.24]
  - - [256, 1024, 1, 128, 256, 256, 128, 1024]
    - [32, 8.17]
  - - [256, 1024, 1, 256, 256, 256, 256, 1024]
    - [32, 14.49]
  - - [256, 1024, 1, 512, 256, 256, 512, 1024]
    - [61, 23.9]
  - - [256, 1024, 1, 1024, 256, 256, 1024, 1024]
    - [62, 36.99]
  - - [256, 1024, 1, 2048, 256, 256, 2048, 1024]
    - [62, 51.29]
  - - [256, 1024, 1, 4096, 256, 256, 4096, 1024]
    - [85, 54.74]
  - - [256, 1024, 1, 8192, 256, 256, 8192, 1024]
    - [84, 59.55]
  - - [256, 2048, 1, 128, 256, 256, 128, 2048]
    - [29, 14.44]
  - - [256, 2048, 1, 256, 256, 256, 256, 2048]
    - [30, 26.66]
  - - [256, 2048, 1, 512, 256, 256, 512, 2048]
    - [30, 43.24]
  - - [256, 2048, 1, 1024, 256, 256, 1024, 2048]
    - [57, 64.7]
  - - [256, 2048, 1, 2048, 256, 256, 2048, 2048]
    - [77, 80.64]
  - - [256, 2048, 1, 4096, 256, 256, 4096, 2048]
    - [77, 96.93]
  - - [256, 2048, 1, 8192, 256, 256, 8192, 2048]
    - [77, 109.31]
  - - [256, 4096, 1, 128, 256, 256, 128, 4096]
    - [20, 26.0]
  - - [256, 4096, 1, 256, 256, 256, 256, 4096]
    - [25, 45.43]
  - - [256, 4096, 1, 512, 256, 256, 512, 4096]
    - [25, 73.27]
  - - [256, 4096, 1, 1024, 256, 256, 1024, 4096]
    - [25, 106.58]
  - - [256, 4096, 1, 2048, 256, 256, 2048, 4096]
    - [73, 125.83]
  - - [256, 4096, 1, 4096, 256, 256, 4096, 4096]
    - [73, 151.08]
  - - [256, 4096, 1, 8192, 256, 256, 8192, 4096]
    - [73, 164.66]
  - - [256, 8192, 1, 128, 256, 256, 128, 8192]
    - [49, 40.74]
  - - [256, 8192, 1, 256, 256, 256, 256, 8192]
    - [18, 69.62]
  - - [256, 8192, 1, 512, 256, 256, 512, 8192]
    - [50, 111.09]
  - - [256, 8192, 1, 1024, 256, 256, 1024, 8192]
    - [50, 159.85]
  - - [256, 8192, 1, 2048, 256, 256, 2048, 8192]
    - [50, 187.24]
  - - [256, 8192, 1, 4096, 256, 256, 4096, 8192]
    - [50, 213.43]
  - - [256, 8192, 1, 8192, 256, 256, 8192, 8192]
    - [50, 210.54]
  - - [512, 128, 1, 128, 512, 512, 128, 128]
    - [34, 2.15]
  - - [512, 128, 1, 256, 512, 512, 256, 128]
    - [71, 3.84]
  - - [512, 128, 1, 512, 512, 512, 512, 128]
    - [66, 6.78]
  - - [512, 128, 1, 1024, 512, 512, 1024, 128]
    - [68, 10.64]
  - - [512, 128, 1, 2048, 512, 512, 2048, 128]
    - [66, 15.02]
  - - [512, 128, 1, 4096, 512, 512, 4096, 128]
    - [68, 19.1]
  - - [512, 128, 1, 8192, 512, 512, 8192, 128]
    - [68, 21.97]
  - - [512, 256, 1, 128, 512, 512, 128, 256]
    - [34, 4.21]
  - - [512, 256, 1, 256, 512, 512, 256, 256]
    - [34, 7.84]
  - - [512, 256, 1, 512, 512, 512, 512, 256]
    - [66, 13.49]
  - - [512, 256, 1, 1024, 512, 512, 1024, 256]
    - [66, 21.27]
  - - [512, 256, 1, 2048, 512, 512, 2048, 256]
    - [68, 29.85]
  - - [512, 256, 1, 4096, 512, 512, 4096, 256]
    - [68, 37.69]
  - - [512, 256, 1, 8192, 512, 512, 8192, 256]
    - [70, 43.11]
  - - [512, 512, 1, 128, 512, 512, 128, 512]
    - [61, 8.1]
  - - [512, 512, 1, 256, 512, 512, 256, 512]
    - [32, 14.65]
  - - [512, 512, 1, 512, 512, 512, 512, 512]
    - [61, 24.51]
  - - [512, 512, 1, 1024, 512, 512, 1024, 512]
    - [62, 37.48]
  - - [512, 512, 1, 2048, 512, 512, 2048, 512]
    - [62, 51.64]
  - - [512, 512, 1, 4096, 512, 512, 4096, 512]
    - [63, 63.14]
  - - [512, 512, 1, 8192, 512, 512, 8192, 512]
    - [59, 64.26]
  - - [512, 1024, 1, 128, 512, 512, 128, 1024]
    - [31, 15.01]
  - - [512, 1024, 1, 256, 512, 512, 256, 1024]
    - [30, 26.59]
  - - [512, 1024, 1, 512, 512, 512, 512, 1024]
    - [57, 43.14]
  - - [512, 1024, 1, 1024, 512, 512, 1024, 1024]
    - [77, 63.47]
  - - [512, 1024, 1, 2048, 512, 512, 2048, 1024]
    - [77, 86.92]
  - - [512, 1024, 1, 4096, 512, 512, 4096, 1024]
    - [77, 97.27]
  - - [512, 1024, 1, 8192, 512, 512, 8192, 1024]
    - [79, 107.07]
  - - [512, 2048, 1, 128, 512, 512, 128, 2048]
    - [23, 25.52]
  - - [512, 2048, 1, 256, 512, 512, 256, 2048]
    - [24, 44.82]
  - - [512, 2048, 1, 512, 512, 512, 512, 2048]
    - [25, 72.6]
  - - [512, 2048, 1, 1024, 512, 512, 1024, 2048]
    - [25, 105.55]
  - - [512, 2048, 1, 2048, 512, 512, 2048, 2048]
    - [73, 127.58]
  - - [512, 2048, 1, 4096, 512, 512, 4096, 2048]
    - [73, 152.46]
  - - [512, 2048, 1, 8192, 512, 512, 8192, 2048]
    - [73, 163.13]
  - - [512, 4096, 1, 128, 512, 512, 128, 4096]
    - [22, 41.0]
  - - [512, 4096, 1, 256, 512, 512, 256, 4096]
    - [18, 69.19]
  - - [512, 4096, 1, 512, 512, 512, 512, 4096]
    - [50, 111.63]
  - - [512, 4096, 1, 1024, 512, 512, 1024, 4096]
    - [50, 159.77]
  - - [512, 4096, 1, 2048, 512, 512, 2048, 4096]
    - [50, 192.69]
  - - [512, 4096, 1, 4096, 512, 512, 4096, 4096]
    - [50, 220.66]
  - - [512, 4096, 1, 8192, 512, 512, 8192, 4096]
    - [50, 208.72]
  - - [512, 8192, 1, 128, 512, 512, 128, 8192]
    - [15, 58.06]
  - - [512, 8192, 1, 256, 512, 512, 256, 8192]
    - [12, 98.62]
  - - [512, 8192, 1, 512, 512, 512, 512, 8192]
    - [14, 155.82]
  - - [512, 8192, 1, 1024, 512, 512, 1024, 8192]
    - [14, 217.32]
  - - [512, 8192, 1, 2048, 512, 512, 2048, 8192]
    - [35, 246.0]
  - - [512, 8192, 1, 4096, 512, 512, 4096, 8192]
    - [37, 262.77]
  - - [512, 8192, 1, 8192, 512, 512, 8192, 8192]
    - [37, 240.17]
  - - [1024, 128, 1, 128, 1024, 1024, 128, 128]
    - [34, 4.13]
  - - [1024, 128, 1, 256, 1024, 1024, 256, 128]
    - [34, 7.75]
  - - [1024, 128, 1, 512, 1024, 1024, 512, 128]
    - [68, 13.05]
  - - [1024, 128, 1, 1024, 1024, 1024, 1024, 128]
    - [68, 20.82]
  - - [1024, 128, 1, 2048, 1024, 1024, 2048, 128]
    - [68, 29.65]
  - - [1024, 128, 1, 4096, 1024, 1024, 4096, 128]
    - [68, 37.63]
  - - [1024, 128, 1, 8192, 1024, 1024, 8192, 128]
    - [72, 43.0]
  - - [1024, 256, 1, 128, 1024, 1024, 128, 256]
    - [32, 8.23]
  - - [1024, 256, 1, 256, 1024, 1024, 256, 256]
    - [60, 14.68]
  - - [1024, 256, 1, 512, 1024, 1024, 512, 256]
    - [62, 24.38]
  - - [1024, 256, 1, 1024, 1024, 1024, 1024, 256]
    - [62, 37.61]
  - - [1024, 256, 1, 2048, 1024, 1024, 2048, 256]
    - [62, 51.61]
  - - [1024, 256, 1, 4096, 1024, 1024, 4096, 256]
    - [65, 63.21]
  - - [1024, 256, 1, 8192, 1024, 1024, 8192, 256]
    - [83, 71.23]
  - - [1024, 512, 1, 128, 1024, 1024, 128, 512]
    - [31, 14.84]
  - - [1024, 512, 1, 256, 1024, 1024, 256, 512]
    - [28, 26.29]
  - - [1024, 512, 1, 512, 1024, 1024, 512, 512]
    - [57, 43.05]
  - - [1024, 512, 1, 1024, 1024, 1024, 1024, 512]
    - [57, 63.44]
  - - [1024, 512, 1, 2048, 1024, 1024, 2048, 512]
    - [77, 85.2]
  - - [1024, 512, 1, 4096, 1024, 1024, 4096, 512]
    - [80, 104.91]
  - - [1024, 512, 1, 8192, 1024, 1024, 8192, 512]
    - [80, 107.0]
  - - [1024, 1024, 1, 128, 1024, 1024, 128, 1024]
    - [24, 24.78]
  - - [1024, 1024, 1, 256, 1024, 1024, 256, 1024]
    - [25, 43.28]
  - - [1024, 1024, 1, 512, 1024, 1024, 512, 1024]
    - [25, 73.42]
  - - [1024, 1024, 1, 1024, 1024, 1024, 1024, 1024]
    - [25, 106.17]
  - - [1024, 1024, 1, 2048, 1024, 1024, 2048, 1024]
    - [26, 136.02]
  - - [1024, 1024, 1, 4096, 1024, 1024, 4096, 1024]
    - [74, 148.09]
  - - [1024, 1024, 1, 8192, 1024, 1024, 8192, 1024]
    - [75, 159.33]
  - - [1024, 2048, 1, 128, 1024, 1024, 128, 2048]
    - [22, 41.27]
  - - [1024, 2048, 1, 256, 1024, 1024, 256, 2048]
    - [18, 69.22]
  - - [1024, 2048, 1, 512, 1024, 1024, 512, 2048]
    - [50, 112.38]
  - - [1024, 2048, 1, 1024, 1024, 1024, 1024, 2048]
    - [50, 160.05]
  - - [1024, 2048, 1, 2048, 1024, 1024, 2048, 2048]
    - [50, 195.07]
  - - [1024, 2048, 1, 4096, 1024, 1024, 4096, 2048]
    - [51, 217.75]
  - - [1024, 2048, 1, 8192, 1024, 1024, 8192, 2048]
    - [53, 210.48]
  - - [1024, 4096, 1, 128, 1024, 1024, 128, 4096]
    - [13, 58.14]
  - - [1024, 4096, 1, 256, 1024, 1024, 256, 4096]
    - [12, 99.6]
  - - [1024, 4096, 1, 512, 1024, 1024, 512, 4096]
    - [14, 155.72]
  - - [1024, 4096, 1, 1024, 1024, 1024, 1024, 4096]
    - [14, 213.18]
  - - [1024, 4096, 1, 2048, 1024, 1024, 2048, 4096]
    - [40, 251.71]
  - - [1024, 4096, 1, 4096, 1024, 1024, 4096, 4096]
    - [38, 262.63]
  - - [1024, 4096, 1, 8192, 1024, 1024, 8192, 4096]
    - [35, 239.57]
  - - [1024, 8192, 1, 128, 1024, 1024, 128, 8192]
    - [7, 73.53]
  - - [1024, 8192, 1, 256, 1024, 1024, 256, 8192]
    - [7, 123.01]
  - - [1024, 8192, 1, 512, 1024, 1024, 512, 8192]
    - [7, 185.57]
  - - [1024, 8192, 1, 1024, 1024, 1024, 1024, 8192]
    - [7, 245.81]
  - - [1024, 8192, 1, 2048, 1024, 1024, 2048, 8192]
    - [8, 278.28]
  - - [1024, 8192, 1, 4096, 1024, 1024, 4096, 8192]
    - [1, 271.43]
  - - [1024, 8192, 1, 8192, 1024, 1024, 8192, 8192]
    - [4, 284.13]
  - - [2048, 128, 1, 128, 2048, 2048, 128, 128]
    - [33, 8.11]
  - - [2048, 128, 1, 256, 2048, 2048, 256, 128]
    - [32, 14.28]
  - - [2048, 128, 1, 512, 2048, 2048, 512, 128]
    - [61, 24.12]
  - - [2048, 128, 1, 1024, 2048, 2048, 1024, 128]
    - [62, 37.28]
  - - [2048, 128, 1, 2048, 2048, 2048, 2048, 128]
    - [62, 51.31]
  - - [2048, 128, 1, 4096, 2048, 2048, 4096, 128]
    - [64, 62.86]
  - - [2048, 128, 1, 8192, 2048, 2048, 8192, 128]
    - [81, 71.15]
  - - [2048, 256, 1, 128, 2048, 2048, 128, 256]
    - [31, 14.66]
  - - [2048, 256, 1, 256, 2048, 2048, 256, 256]
    - [28, 25.75]
  - - [2048, 256, 1, 512, 2048, 2048, 512, 256]
    - [58, 42.46]
  - - [2048, 256, 1, 1024, 2048, 2048, 1024, 256]
    - [57, 64.41]
  - - [2048, 256, 1, 2048, 2048, 2048, 2048, 256]
    - [77, 86.54]
  - - [2048, 256, 1, 4096, 2048, 2048, 4096, 256]
    - [78, 104.79]
  - - [2048, 256, 1, 8192, 2048, 2048, 8192, 256]
    - [80, 117.55]
  - - [2048, 512, 1, 128, 2048, 2048, 128, 512]
    - [19, 25.53]
  - - [2048, 512, 1, 256, 2048, 2048, 256, 512]
    - [25, 44.97]
  - - [2048, 512, 1, 512, 2048, 2048, 512, 512]
    - [25, 73.7]
  - - [2048, 512, 1, 1024, 2048, 2048, 1024, 512]
    - [25, 106.62]
  - - [2048, 512, 1, 2048, 2048, 2048, 2048, 512]
    - [26, 136.72]
  - - [2048, 512, 1, 4096, 2048, 2048, 4096, 512]
    - [76, 152.93]
  - - [2048, 512, 1, 8192, 2048, 2048, 8192, 512]
    - [75, 161.23]
  - - [2048, 1024, 1, 128, 2048, 2048, 128, 1024]
    - [22, 41.21]
  - - [2048, 1024, 1, 256, 2048, 2048, 256, 1024]
    - [18, 70.82]
  - - [2048, 1024, 1, 512, 2048, 2048, 512, 1024]
    - [50, 112.04]
  - - [2048, 1024, 1, 1024, 2048, 2048, 1024, 1024]
    - [50, 160.53]
  - - [2048, 1024, 1, 2048, 2048, 2048, 2048, 1024]
    - [53, 198.36]
  - - [2048, 1024, 1, 4096, 2048, 2048, 4096, 1024]
    - [51, 214.35]
  - - [2048, 1024, 1, 8192, 2048, 2048, 8192, 1024]
    - [51, 209.3]
  - - [2048, 2048, 1, 128, 2048, 2048, 128, 2048]
    - [17, 58.52]
  - - [2048, 2048, 1, 256, 2048, 2048, 256, 2048]
    - [12, 99.73]
  - - [2048, 2048, 1, 512, 2048, 2048, 512, 2048]
    - [14, 156.11]
  - - [2048, 2048, 1, 1024, 2048, 2048, 1024, 2048]
    - [14, 204.81]
  - - [2048, 2048, 1, 2048, 2048, 2048, 2048, 2048]
    - [37, 247.94]
  - - [2048, 2048, 1, 4096, 2048, 2048, 4096, 2048]
    - [38, 257.77]
  - - [2048, 2048, 1, 8192, 2048, 2048, 8192, 2048]
    - [42, 239.13]
  - - [2048, 4096, 1, 128, 2048, 2048, 128, 4096]
    - [0, 72.43]
  - - [2048, 4096, 1, 256, 2048, 2048, 256, 4096]
    - [0, 123.67]
  - - [2048, 4096, 1, 512, 2048, 2048, 512, 4096]
    - [7, 182.63]
  - - [2048, 4096, 1, 1024, 2048, 2048, 1024, 4096]
    - [7, 248.87]
  - - [2048, 4096, 1, 2048, 2048, 2048, 2048, 4096]
    - [5, 281.46]
  - - [2048, 4096, 1, 4096, 2048, 2048, 4096, 4096]
    - [4, 265.7]
  - - [2048, 4096, 1, 8192, 2048, 2048, 8192, 4096]
    - [7, 283.95]
  - - [2048, 8192, 1, 128, 2048, 2048, 128, 8192]
    - [1, 79.32]
  - - [2048, 8192, 1, 256, 2048, 2048, 256, 8192]
    - [7, 132.91]
  - - [2048, 8192, 1, 512, 2048, 2048, 512, 8192]
    - [7, 198.15]
  - - [2048, 8192, 1, 1024, 2048, 2048, 1024, 8192]
    - [3, 241.48]
  - - [2048, 8192, 1, 2048, 2048, 2048, 2048, 8192]
    - [9, 248.4]
  - - [2048, 8192, 1, 4096, 2048, 2048, 4096, 8192]
    - [5, 282.28]
  - - [2048, 8192, 1, 8192, 2048, 2048, 8192, 8192]
    - [39, 313.15]
  - - [4096, 128, 1, 128, 4096, 4096, 128, 128]
    - [30, 14.62]
  - - [4096, 128, 1, 256, 4096, 4096, 256, 128]
    - [30, 25.99]
  - - [4096, 128, 1, 512, 4096, 4096, 512, 128]
    - [57, 42.96]
  - - [4096, 128, 1, 1024, 4096, 4096, 1024, 128]
    - [57, 64.03]
  - - [4096, 128, 1, 2048, 4096, 4096, 2048, 128]
    - [77, 86.76]
  - - [4096, 128, 1, 4096, 4096, 4096, 4096, 128]
    - [80, 105.37]
  - - [4096, 128, 1, 8192, 4096, 4096, 8192, 128]
    - [80, 117.82]
  - - [4096, 256, 1, 128, 4096, 4096, 128, 256]
    - [19, 25.37]
  - - [4096, 256, 1, 256, 4096, 4096, 256, 256]
    - [27, 44.6]
  - - [4096, 256, 1, 512, 4096, 4096, 512, 256]
    - [26, 72.07]
  - - [4096, 256, 1, 1024, 4096, 4096, 1024, 256]
    - [27, 105.24]
  - - [4096, 256, 1, 2048, 4096, 4096, 2048, 256]
    - [27, 136.67]
  - - [4096, 256, 1, 4096, 4096, 4096, 4096, 256]
    - [75, 152.3]
  - - [4096, 256, 1, 8192, 4096, 4096, 8192, 256]
    - [75, 161.67]
  - - [4096, 512, 1, 128, 4096, 4096, 128, 512]
    - [22, 41.21]
  - - [4096, 512, 1, 256, 4096, 4096, 256, 512]
    - [22, 69.91]
  - - [4096, 512, 1, 512, 4096, 4096, 512, 512]
    - [50, 111.7]
  - - [4096, 512, 1, 1024, 4096, 4096, 1024, 512]
    - [50, 159.42]
  - - [4096, 512, 1, 2048, 4096, 4096, 2048, 512]
    - [52, 199.33]
  - - [4096, 512, 1, 4096, 4096, 4096, 4096, 512]
    - [52, 209.16]
  - - [4096, 512, 1, 8192, 4096, 4096, 8192, 512]
    - [52, 209.61]
  - - [4096, 1024, 1, 128, 4096, 4096, 128, 1024]
    - [13, 58.21]
  - - [4096, 1024, 1, 256, 4096, 4096, 256, 1024]
    - [13, 99.49]
  - - [4096, 1024, 1, 512, 4096, 4096, 512, 1024]
    - [14, 156.61]
  - - [4096, 1024, 1, 1024, 4096, 4096, 1024, 1024]
    - [41, 210.18]
  - - [4096, 1024, 1, 2048, 4096, 4096, 2048, 1024]
    - [39, 251.17]
  - - [4096, 1024, 1, 4096, 4096, 4096, 4096, 1024]
    - [39, 265.12]
  - - [4096, 1024, 1, 8192, 4096, 4096, 8192, 1024]
    - [44, 242.44]
  - - [4096, 2048, 1, 128, 4096, 4096, 128, 2048]
    - [2, 72.34]
  - - [4096, 2048, 1, 256, 4096, 4096, 256, 2048]
    - [0, 122.13]
  - - [4096, 2048, 1, 512, 4096, 4096, 512, 2048]
    - [4, 183.25]
  - - [4096, 2048, 1, 1024, 4096, 4096, 1024, 2048]
    - [7, 249.39]
  - - [4096, 2048, 1, 2048, 4096, 4096, 2048, 2048]
    - [2, 280.42]
  - - [4096, 2048, 1, 4096, 4096, 4096, 4096, 2048]
    - [45, 276.39]
  - - [4096, 2048, 1, 8192, 4096, 4096, 8192, 2048]
    - [7, 285.8]
  - - [4096, 4096, 1, 128, 4096, 4096, 128, 4096]
    - [7, 78.52]
  - - [4096, 4096, 1, 256, 4096, 4096, 256, 4096]
    - [0, 130.98]
  - - [4096, 4096, 1, 512, 4096, 4096, 512, 4096]
    - [7, 195.13]
  - - [4096, 4096, 1, 1024, 4096, 4096, 1024, 4096]
    - [7, 240.2]
  - - [4096, 4096, 1, 2048, 4096, 4096, 2048, 4096]
    - [43, 249.26]
  - - [4096, 4096, 1, 4096, 4096, 4096, 4096, 4096]
    - [1, 281.3]
  - - [4096, 4096, 1, 8192, 4096, 4096, 8192, 4096]
    - [40, 316.14]
  - - [4096, 8192, 1, 128, 4096, 4096, 128, 8192]
    - [4, 84.09]
  - - [4096, 8192, 1, 256, 4096, 4096, 256, 8192]
    - [21, 140.96]
  - - [4096, 8192, 1, 512, 4096, 4096, 512, 8192]
    - [15, 197.71]
  - - [4096, 8192, 1, 1024, 4096, 4096, 1024, 8192]
    - [36, 235.65]
  - - [4096, 8192, 1, 2048, 4096, 4096, 2048, 8192]
    - [39, 283.13]
  - - [4096, 8192, 1, 4096, 4096, 4096, 4096, 8192]
    - [1, 334.16]
  - - [4096, 8192, 1, 8192, 4096, 4096, 8192, 8192]
    - [1, 364.07]
  - - [8192, 128, 1, 128, 8192, 8192, 128, 128]
    - [19, 26.21]
  - - [8192, 128, 1, 256, 8192, 8192, 256, 128]
    - [25, 45.6]
  - - [8192, 128, 1, 512, 8192, 8192, 512, 128]
    - [25, 73.75]
  - - [8192, 128, 1, 1024, 8192, 8192, 1024, 128]
    - [25, 107.24]
  - - [8192, 128, 1, 2048, 8192, 8192, 2048, 128]
    - [26, 136.83]
  - - [8192, 128, 1, 4096, 8192, 8192, 4096, 128]
    - [55, 147.66]
  - - [8192, 128, 1, 8192, 8192, 8192, 8192, 128]
    - [79, 158.19]
  - - [8192, 256, 1, 128, 8192, 8192, 128, 256]
    - [49, 41.32]
  - - [8192, 256, 1, 256, 8192, 8192, 256, 256]
    - [18, 70.17]
  - - [8192, 256, 1, 512, 8192, 8192, 512, 256]
    - [50, 112.41]
  - - [8192, 256, 1, 1024, 8192, 8192, 1024, 256]
    - [53, 159.28]
  - - [8192, 256, 1, 2048, 8192, 8192, 2048, 256]
    - [52, 200.04]
  - - [8192, 256, 1, 4096, 8192, 8192, 4096, 256]
    - [53, 209.25]
  - - [8192, 256, 1, 8192, 8192, 8192, 8192, 256]
    - [52, 207.23]
  - - [8192, 512, 1, 128, 8192, 8192, 128, 512]
    - [13, 58.57]
  - - [8192, 512, 1, 256, 8192, 8192, 256, 512]
    - [12, 99.23]
  - - [8192, 512, 1, 512, 8192, 8192, 512, 512]
    - [16, 154.63]
  - - [8192, 512, 1, 1024, 8192, 8192, 1024, 512]
    - [46, 225.56]
  - - [8192, 512, 1, 2048, 8192, 8192, 2048, 512]
    - [47, 255.74]
  - - [8192, 512, 1, 4096, 8192, 8192, 4096, 512]
    - [48, 273.36]
  - - [8192, 512, 1, 8192, 8192, 8192, 8192, 512]
    - [47, 266.82]
  - - [8192, 1024, 1, 128, 8192, 8192, 128, 1024]
    - [4, 72.84]
  - - [8192, 1024, 1, 256, 8192, 8192, 256, 1024]
    - [7, 122.62]
  - - [8192, 1024, 1, 512, 8192, 8192, 512, 1024]
    - [45, 184.56]
  - - [8192, 1024, 1, 1024, 8192, 8192, 1024, 1024]
    - [7, 246.37]
  - - [8192, 1024, 1, 2048, 8192, 8192, 2048, 1024]
    - [45, 295.06]
  - - [8192, 1024, 1, 4096, 8192, 8192, 4096, 1024]
    - [44, 349.23]
  - - [8192, 1024, 1, 8192, 8192, 8192, 8192, 1024]
    - [45, 360.89]
  - - [8192, 2048, 1, 128, 8192, 8192, 128, 2048]
    - [4, 78.28]
  - - [8192, 2048, 1, 256, 8192, 8192, 256, 2048]
    - [45, 131.68]
  - - [8192, 2048, 1, 512, 8192, 8192, 512, 2048]
    - [7, 196.01]
  - - [8192, 2048, 1, 1024, 8192, 8192, 1024, 2048]
    - [45, 246.45]
  - - [8192, 2048, 1, 2048, 8192, 8192, 2048, 2048]
    - [45, 299.75]
  - - [8192, 2048, 1, 4096, 8192, 8192, 4096, 2048]
    - [44, 341.02]
  - - [8192, 2048, 1, 8192, 8192, 8192, 8192, 2048]
    - [45, 394.16]
  - - [8192, 4096, 1, 128, 8192, 8192, 128, 4096]
    - [7, 84.66]
  - - [8192, 4096, 1, 256, 8192, 8192, 256, 4096]
    - [6, 135.42]
  - - [8192, 4096, 1, 512, 8192, 8192, 512, 4096]
    - [10, 200.69]
  - - [8192, 4096, 1, 1024, 8192, 8192, 1024, 4096]
    - [45, 240.28]
  - - [8192, 4096, 1, 2048, 8192, 8192, 2048, 4096]
    - [45, 311.82]
  - - [8192, 4096, 1, 4096, 8192, 8192, 4096, 4096]
    - [45, 362.07]
  - - [8192, 4096, 1, 8192, 8192, 8192, 8192, 4096]
    - [44, 409.22]
  - - [8192, 8192, 1, 128, 8192, 8192, 128, 8192]
    - [22, 88.47]
  - - [8192, 8192, 1, 256, 8192, 8192, 256, 8192]
    - [11, 145.32]
  - - [8192, 8192, 1, 512, 8192, 8192, 512, 8192]
    - [2, 212.69]
  - - [8192, 8192, 1, 1024, 8192, 8192, 1024, 8192]
    - [7, 283.34]
  - - [8192, 8192, 1, 2048, 8192, 8192, 2048, 8192]
    - [5, 330.04]
  - - [8192, 8192, 1, 4096, 8192, 8192, 4096, 8192]
    - [43, 379.82]
  - - [8192, 8192, 1, 8192, 8192, 8192, 8192, 8192]
    - [45, 412.07]
- null
- null
- ExperimentalStreamK
- GridBased
