projects/hipblaslt/library/src/amd_detail/rocblaslt/src/Tensile/Logic/asm_full/aquavanjaram/gfx942_228cu/StreamK/aquavanjaram942_Cijk_Ailk_Bljk_BSS_BH_Bias_HAS_SAV_UserArgs.yaml
- {MinimumRequiredVersion: 4.33.0}
- aquavanjaram942
- {Architecture: gfx942, CUCount: 228}
- [Device 0049, Device 0050]
    SolutionIndex: 0
    SolutionNameMin: Cijk_Ailk_Bljk_BSS_BH_Bias_HAS_SAV_UserArgs_MT256x256x32_MI16x16x1_SN_LDSB1_CLR1_GRVWA8_GSU0_GSUC0_GSUWGMRR0_K1_LBSPPA2048_LBSPPB512_LPA0_MIWT8_8_PLR1_SU0_SUM0_SUS64_VWA8_VWB8_WGM1_WGMXCC1_WGMXCCGn1
    SolutionIndex: 1
    SolutionNameMin: Cijk_Ailk_Bljk_BSS_BH_Bias_HAS_SAV_UserArgs_MT256x256x32_MI16x16x1_SN_LDSB1_CLR1_GRVWA8_GSU0_GSUC0_GSUWGMRR0_K1_LBSPPA2048_LBSPPB512_LPA0_MIWT8_8_PLR1_SU0_SUM0_SUS64_VWA8_VWB8_WGM1_WGMXCC1_WGMXCCGn1
    SolutionIndex: 2
    SolutionNameMin: Cijk_Ailk_Bljk_BSS_BH_Bias_HAS_SAV_UserArgs_MT256x256x32_MI16x16x1_SN_LDSB1_CLR1_GRVWA8_GSU0_GSUC0_GSUWGMRR0_K1_LBSPPA2048_LBSPPB512_LPA0_MIWT8_8_PLR1_SU0_SUM0_SUS64_VWA8_VWB8_WGM1_WGMXCC1_WGMXCCGn1
    SolutionIndex: 3
    SolutionNameMin: Cijk_Ailk_Bljk_BSS_BH_Bias_HAS_SAV_UserArgs_MT256x256x32_MI16x16x1_SN_LDSB1_CLR1_GRVWA8_GSU0_GSUC0_GSUWGMRR0_K1_LBSPPA4096_LBSPPB512_LPA0_MIWT8_8_PLR1_SU0_SUM0_SUS64_VWA8_VWB8_WGM1_WGMXCC1_WGMXCCGn1
    SolutionIndex: 4
    SolutionNameMin: Cijk_Ailk_Bljk_BSS_BH_Bias_HAS_SAV_UserArgs_MT256x256x32_MI16x16x1_SN_LDSB1_CLR1_GRVWA2_GSU0_GSUC0_GSUWGMRR0_K1_LBSPPA4096_LBSPPB512_LPA0_MIWT8_8_PLR1_SU0_SUM0_SUS64_VWA8_VWB8_WGM1_WGMXCC1_WGMXCCGn1
    SolutionIndex: 5
    SolutionNameMin: Cijk_Ailk_Bljk_BSS_BH_Bias_HAS_SAV_UserArgs_MT256x256x32_MI16x16x1_SN_LDSB1_CLR1_GRVWA8_GSU0_GSUC0_GSUWGMRR0_K1_LBSPPA4096_LBSPPB512_LPA0_MIWT8_8_PLR1_SU0_SUM0_SUS64_VWA8_VWB8_WGM1_WGMXCC1_WGMXCCGn1
    SolutionIndex: 6
    SolutionNameMin: Cijk_Ailk_Bljk_BSS_BH_Bias_HAS_SAV_UserArgs_MT256x256x32_MI16x16x1_SN_LDSB1_CLR1_GRVWA8_GSU0_GSUC0_GSUWGMRR0_K1_LBSPPA2048_LBSPPB512_LPA0_MIWT8_8_PLR1_SU0_SUM0_SUS64_VWA8_VWB8_WGM4_WGMXCC1_WGMXCCGn1
    SolutionIndex: 7
    SolutionNameMin: Cijk_Ailk_Bljk_BSS_BH_Bias_HAS_SAV_UserArgs_MT256x256x32_MI16x16x1_SN_LDSB1_CLR1_GRVWA8_GSU0_GSUC0_GSUWGMRR0_K1_LBSPPA4096_LBSPPB512_LPA0_MIWT8_8_PLR1_SU0_SUM0_SUS64_VWA8_VWB8_WGM4_WGMXCC1_WGMXCCGn1
    SolutionIndex: 8
    SolutionNameMin: Cijk_Ailk_Bljk_BSS_BH_Bias_HAS_SAV_UserArgs_MT256x256x32_MI16x16x1_SN_LDSB1_CLR1_GRVWA8_GSU0_GSUC0_GSUWGMRR0_K1_LBSPPA2048_LBSPPB512_LPA0_MIWT8_8_PLR1_SU0_SUM0_SUS64_VWA8_VWB8_WGM6_WGMXCC1_WGMXCCGn1
    SolutionIndex: 9
    SolutionNameMin: Cijk_Ailk_Bljk_BSS_BH_Bias_HAS_SAV_UserArgs_MT256x256x32_MI16x16x1_SN_LDSB1_CLR1_GRVWA8_GSU0_GSUC0_GSUWGMRR0_K1_LBSPPA2048_LBSPPB512_LPA0_MIWT8_8_PLR1_SU0_SUM0_SUS64_VWA8_VWB8_WGM6_WGMXCC1_WGMXCCGn1
    SolutionIndex: 10
    SolutionNameMin: Cijk_Ailk_Bljk_BSS_BH_Bias_HAS_SAV_UserArgs_MT256x256x32_MI16x16x1_SN_LDSB1_CLR1_GRVWA8_GSU0_GSUC0_GSUWGMRR0_K1_LBSPPA2048_LBSPPB512_LPA0_MIWT8_8_PLR1_SU0_SUM0_SUS64_VWA8_VWB8_WGM8_WGMXCC1_WGMXCCGn1
    SolutionIndex: 11
    SolutionNameMin: Cijk_Ailk_Bljk_BSS_BH_Bias_HAS_SAV_UserArgs_MT128x256x32_MI16x16x1_SN_LDSB1_CLR1_GRVWA2_GSU0_GSUC0_GSUWGMRR0_K1_LBSPPA1024_LBSPPB512_LPA0_MIWT4_8_PLR1_SU0_SUM0_SUS64_VWA4_VWB8_WGM1_WGMXCC1_WGMXCCGn1
    SolutionIndex: 12
    SolutionNameMin: Cijk_Ailk_Bljk_BSS_BH_Bias_HAS_SAV_UserArgs_MT128x256x32_MI16x16x1_SN_LDSB1_CLR1_GRVWA8_GSU0_GSUC0_GSUWGMRR0_K1_LBSPPA1024_LBSPPB512_LPA0_MIWT4_8_PLR1_SU0_SUM0_SUS64_VWA4_VWB8_WGM1_WGMXCC1_WGMXCCGn1
    SolutionIndex: 13
    SolutionNameMin: Cijk_Ailk_Bljk_BSS_BH_Bias_HAS_SAV_UserArgs_MT128x256x32_MI16x16x1_SN_LDSB1_CLR1_GRVWA2_GSU0_GSUC0_GSUWGMRR0_K1_LBSPPA2048_LBSPPB512_LPA0_MIWT4_8_PLR1_SU0_SUM0_SUS64_VWA4_VWB8_WGM1_WGMXCC1_WGMXCCGn1
    SolutionIndex: 14
    SolutionNameMin: Cijk_Ailk_Bljk_BSS_BH_Bias_HAS_SAV_UserArgs_MT128x256x32_MI16x16x1_SN_LDSB1_CLR1_GRVWA8_GSU0_GSUC0_GSUWGMRR0_K1_LBSPPA2048_LBSPPB512_LPA0_MIWT4_8_PLR1_SU0_SUM0_SUS64_VWA4_VWB8_WGM1_WGMXCC1_WGMXCCGn1
    SolutionIndex: 15
    SolutionNameMin: Cijk_Ailk_Bljk_BSS_BH_Bias_HAS_SAV_UserArgs_MT128x256x32_MI16x16x1_SN_LDSB1_CLR1_GRVWA2_GSU0_GSUC0_GSUWGMRR0_K1_LBSPPA1024_LBSPPB512_LPA0_MIWT4_8_PLR1_SU0_SUM0_SUS64_VWA4_VWB8_WGM4_WGMXCC1_WGMXCCGn1
    SolutionIndex: 16
    SolutionNameMin: Cijk_Ailk_Bljk_BSS_BH_Bias_HAS_SAV_UserArgs_MT128x256x32_MI16x16x1_SN_LDSB1_CLR1_GRVWA2_GSU0_GSUC0_GSUWGMRR0_K1_LBSPPA1024_LBSPPB512_LPA0_MIWT4_8_PLR1_SU0_SUM0_SUS64_VWA4_VWB8_WGM8_WGMXCC1_WGMXCCGn1
    SolutionIndex: 17
    SolutionNameMin: Cijk_Ailk_Bljk_BSS_BH_Bias_HAS_SAV_UserArgs_MT256x128x32_MI16x16x1_SN_LDSB1_CLR1_GRVWA8_GSU0_GSUC0_GSUWGMRR0_K1_LBSPPA2048_LBSPPB256_LPA0_MIWT8_4_PLR1_SU0_SUM0_SUS64_VWA8_VWB4_WGM4_WGMXCC1_WGMXCCGn1
    SolutionIndex: 18
    SolutionNameMin: Cijk_Ailk_Bljk_BSS_BH_Bias_HAS_SAV_UserArgs_MT256x128x32_MI16x16x1_SN_LDSB1_CLR1_GRVWA8_GSU0_GSUC0_GSUWGMRR0_K1_LBSPPA2048_LBSPPB256_LPA0_MIWT8_4_PLR1_SU0_SUM0_SUS64_VWA8_VWB4_WGM4_WGMXCC1_WGMXCCGn1
    SolutionIndex: 19
    SolutionNameMin: Cijk_Ailk_Bljk_BSS_BH_Bias_HAS_SAV_UserArgs_MT256x128x32_MI16x16x1_SN_LDSB1_CLR1_GRVWA8_GSU0_GSUC0_GSUWGMRR0_K1_LBSPPA2048_LBSPPB256_LPA0_MIWT8_4_PLR1_SU0_SUM0_SUS64_VWA8_VWB4_WGM8_WGMXCC1_WGMXCCGn1
    SolutionIndex: 20
    SolutionNameMin: Cijk_Ailk_Bljk_BSS_BH_Bias_HAS_SAV_UserArgs_MT128x128x32_MI16x16x1_SN_LDSB1_CLR1_GRVWA2_GSU0_GSUC0_GSUWGMRR0_K1_LBSPPA1024_LBSPPB256_LPA0_MIWT4_4_PLR1_SU0_SUM0_SUS64_VWA4_VWB4_WGM1_WGMXCC1_WGMXCCGn1
    SolutionIndex: 21
    SolutionNameMin: Cijk_Ailk_Bljk_BSS_BH_Bias_HAS_SAV_UserArgs_MT128x128x32_MI16x16x1_SN_LDSB1_CLR1_GRVWA8_GSU0_GSUC0_GSUWGMRR0_K1_LBSPPA1024_LBSPPB256_LPA0_MIWT4_4_PLR1_SU0_SUM0_SUS64_VWA4_VWB4_WGM1_WGMXCC1_WGMXCCGn1
    SolutionIndex: 22
    SolutionNameMin: Cijk_Ailk_Bljk_BSS_BH_Bias_HAS_SAV_UserArgs_MT128x128x32_MI16x16x1_SN_LDSB1_CLR1_GRVWA2_GSU0_GSUC0_GSUWGMRR0_K1_LBSPPA2048_LBSPPB256_LPA0_MIWT4_4_PLR1_SU0_SUM0_SUS64_VWA4_VWB4_WGM1_WGMXCC1_WGMXCCGn1
    SolutionIndex: 23
    SolutionNameMin: Cijk_Ailk_Bljk_BSS_BH_Bias_HAS_SAV_UserArgs_MT128x128x32_MI16x16x1_SN_LDSB1_CLR1_GRVWA8_GSU0_GSUC0_GSUWGMRR0_K1_LBSPPA1024_LBSPPB256_LPA0_MIWT4_4_PLR1_SU0_SUM0_SUS64_VWA4_VWB4_WGM4_WGMXCC1_WGMXCCGn1
    SolutionIndex: 24
    SolutionNameMin: Cijk_Ailk_Bljk_BSS_BH_Bias_HAS_SAV_UserArgs_MT128x128x32_MI16x16x1_SN_LDSB1_CLR1_GRVWA2_GSU0_GSUC0_GSUWGMRR0_K1_LBSPPA1024_LBSPPB256_LPA0_MIWT4_4_PLR1_SU0_SUM0_SUS64_VWA4_VWB4_WGM6_WGMXCC1_WGMXCCGn1
    SolutionIndex: 25
    SolutionNameMin: Cijk_Ailk_Bljk_BSS_BH_Bias_HAS_SAV_UserArgs_MT128x128x32_MI16x16x1_SN_LDSB1_CLR1_GRVWA2_GSU0_GSUC0_GSUWGMRR0_K1_LBSPPA1024_LBSPPB256_LPA0_MIWT4_4_PLR1_SU0_SUM0_SUS64_VWA4_VWB4_WGM6_WGMXCC1_WGMXCCGn1
    SolutionIndex: 26
    SolutionNameMin: Cijk_Ailk_Bljk_BSS_BH_Bias_HAS_SAV_UserArgs_MT128x128x32_MI16x16x1_SN_LDSB1_CLR1_GRVWA4_GSU0_GSUC0_GSUWGMRR0_K1_LBSPPA1024_LBSPPB256_LPA0_MIWT4_4_PLR1_SU0_SUM0_SUS64_VWA4_VWB4_WGM6_WGMXCC1_WGMXCCGn1
    SolutionIndex: 27
    SolutionNameMin: Cijk_Ailk_Bljk_BSS_BH_Bias_HAS_SAV_UserArgs_MT128x64x32_MI16x16x1_SN_LDSB0_CLR1_GRVWA2_GSU0_GSUC0_GSUWGMRR0_K1_LBSPPA1024_LBSPPB128_LPA0_MIWT4_2_PLR1_SU0_SUM0_SUS64_VWA4_VWB2_WGM1_WGMXCC1_WGMXCCGn1
    SolutionIndex: 28
    SolutionNameMin: Cijk_Ailk_Bljk_BSS_BH_Bias_HAS_SAV_UserArgs_MT128x64x32_MI16x16x1_SN_LDSB0_CLR1_GRVWA2_GSU0_GSUC0_GSUWGMRR0_K1_LBSPPA1024_LBSPPB128_LPA0_MIWT4_2_PLR1_SU0_SUM0_SUS64_VWA4_VWB2_WGM1_WGMXCC1_WGMXCCGn1
    SolutionIndex: 29
    SolutionNameMin: Cijk_Ailk_Bljk_BSS_BH_Bias_HAS_SAV_UserArgs_MT128x64x32_MI16x16x1_SN_LDSB0_CLR1_GRVWA8_GSU0_GSUC0_GSUWGMRR0_K1_LBSPPA1024_LBSPPB128_LPA0_MIWT4_2_PLR1_SU0_SUM0_SUS64_VWA4_VWB2_WGM1_WGMXCC1_WGMXCCGn1
    SolutionIndex: 30
    SolutionNameMin: Cijk_Ailk_Bljk_BSS_BH_Bias_HAS_SAV_UserArgs_MT128x64x32_MI16x16x1_SN_LDSB0_CLR1_GRVWA2_GSU0_GSUC0_GSUWGMRR0_K1_LBSPPA1024_LBSPPB128_LPA0_MIWT4_2_PLR1_SU0_SUM0_SUS64_VWA4_VWB2_WGM8_WGMXCC1_WGMXCCGn1
    SolutionIndex: 31
    SolutionNameMin: Cijk_Ailk_Bljk_BSS_BH_Bias_HAS_SAV_UserArgs_MT128x64x32_MI16x16x1_SN_LDSB0_CLR1_GRVWA8_GSU0_GSUC0_GSUWGMRR0_K1_LBSPPA1024_LBSPPB128_LPA0_MIWT4_2_PLR1_SU0_SUM0_SUS64_VWA4_VWB2_WGM8_WGMXCC1_WGMXCCGn1
    SolutionIndex: 32
    SolutionNameMin: Cijk_Ailk_Bljk_BSS_BH_Bias_HAS_SAV_UserArgs_MT64x64x32_MI16x16x1_SN_LDSB0_CLR1_GRVWA2_GSU0_GSUC0_GSUWGMRR0_K1_LBSPPA512_LBSPPB128_LPA32_MIWT2_2_PLR1_SU0_SUM0_SUS64_VWA2_VWB2_WGM1_WGMXCC1_WGMXCCGn1
    SolutionIndex: 33
    SolutionNameMin: Cijk_Ailk_Bljk_BSS_BH_Bias_HAS_SAV_UserArgs_MT64x64x32_MI16x16x1_SN_LDSB0_CLR1_GRVWA8_GSU0_GSUC0_GSUWGMRR0_K1_LBSPPA512_LBSPPB128_LPA32_MIWT2_2_PLR1_SU0_SUM0_SUS64_VWA2_VWB2_WGM1_WGMXCC1_WGMXCCGn1
    SolutionIndex: 34
    SolutionNameMin: Cijk_Ailk_Bljk_BSS_BH_Bias_HAS_SAV_UserArgs_MT64x64x32_MI16x16x1_SN_LDSB0_CLR1_GRVWA2_GSU0_GSUC0_GSUWGMRR0_K1_LBSPPA512_LBSPPB128_LPA32_MIWT2_2_PLR1_SU0_SUM0_SUS64_VWA2_VWB2_WGM8_WGMXCC1_WGMXCCGn1
    SolutionIndex: 35
    SolutionNameMin: Cijk_Ailk_Bljk_BSS_BH_Bias_HAS_SAV_UserArgs_MT64x64x32_MI16x16x1_SN_LDSB0_CLR1_GRVWA2_GSU0_GSUC0_GSUWGMRR0_K1_LBSPPA512_LBSPPB128_LPA32_MIWT2_2_PLR1_SU0_SUM0_SUS64_VWA2_VWB2_WGM8_WGMXCC1_WGMXCCGn1
    SolutionIndex: 36
    SolutionNameMin: Cijk_Ailk_Bljk_BSS_BH_Bias_HAS_SAV_UserArgs_MT128x256x64_MI16x16x1_SN_LDSB1_CLR1_GRVWA2_GSU0_GSUC0_GSUWGMRR0_K1_LBSPPA2048_LBSPPB1024_LPA0_MIWT4_8_PLR1_SU0_SUM0_SUS128_VWA4_VWB8_WGM1_WGMXCC1_WGMXCCGn1
    SolutionIndex: 37
    SolutionNameMin: Cijk_Ailk_Bljk_BSS_BH_Bias_HAS_SAV_UserArgs_MT128x256x64_MI16x16x1_SN_LDSB1_CLR1_GRVWA4_GSU0_GSUC0_GSUWGMRR0_K1_LBSPPA2048_LBSPPB1024_LPA0_MIWT4_8_PLR1_SU0_SUM0_SUS128_VWA4_VWB8_WGM1_WGMXCC1_WGMXCCGn1
    SolutionIndex: 38
    SolutionNameMin: Cijk_Ailk_Bljk_BSS_BH_Bias_HAS_SAV_UserArgs_MT128x256x64_MI16x16x1_SN_LDSB1_CLR1_GRVWA8_GSU0_GSUC0_GSUWGMRR0_K1_LBSPPA2048_LBSPPB1024_LPA0_MIWT4_8_PLR1_SU0_SUM0_SUS128_VWA4_VWB8_WGM1_WGMXCC1_WGMXCCGn1
    SolutionIndex: 39
    SolutionNameMin: Cijk_Ailk_Bljk_BSS_BH_Bias_HAS_SAV_UserArgs_MT128x256x64_MI16x16x1_SN_LDSB1_CLR1_GRVWA2_GSU0_GSUC0_GSUWGMRR0_K1_LBSPPA2048_LBSPPB1024_LPA0_MIWT4_8_PLR1_SU0_SUM0_SUS128_VWA4_VWB8_WGM4_WGMXCC1_WGMXCCGn1
    SolutionIndex: 40
    SolutionNameMin: Cijk_Ailk_Bljk_BSS_BH_Bias_HAS_SAV_UserArgs_MT128x256x64_MI16x16x1_SN_LDSB1_CLR1_GRVWA8_GSU0_GSUC0_GSUWGMRR0_K1_LBSPPA2048_LBSPPB1024_LPA0_MIWT4_8_PLR1_SU0_SUM0_SUS128_VWA4_VWB8_WGM4_WGMXCC1_WGMXCCGn1
    SolutionIndex: 41
    SolutionNameMin: Cijk_Ailk_Bljk_BSS_BH_Bias_HAS_SAV_UserArgs_MT128x256x64_MI16x16x1_SN_LDSB1_CLR1_GRVWA8_GSU0_GSUC0_GSUWGMRR0_K1_LBSPPA2048_LBSPPB1024_LPA0_MIWT4_8_PLR1_SU0_SUM0_SUS128_VWA4_VWB8_WGM6_WGMXCC1_WGMXCCGn1
    SolutionIndex: 42
    SolutionNameMin: Cijk_Ailk_Bljk_BSS_BH_Bias_HAS_SAV_UserArgs_MT128x256x64_MI16x16x1_SN_LDSB1_CLR1_GRVWA2_GSU0_GSUC0_GSUWGMRR0_K1_LBSPPA2048_LBSPPB1024_LPA0_MIWT4_8_PLR1_SU0_SUM0_SUS128_VWA4_VWB8_WGM6_WGMXCC1_WGMXCCGn1
    SolutionIndex: 43
    SolutionNameMin: Cijk_Ailk_Bljk_BSS_BH_Bias_HAS_SAV_UserArgs_MT128x256x64_MI16x16x1_SN_LDSB1_CLR1_GRVWA4_GSU0_GSUC0_GSUWGMRR0_K1_LBSPPA2048_LBSPPB1024_LPA0_MIWT4_8_PLR1_SU0_SUM0_SUS128_VWA4_VWB8_WGM6_WGMXCC1_WGMXCCGn1
    SolutionIndex: 44
    SolutionNameMin: Cijk_Ailk_Bljk_BSS_BH_Bias_HAS_SAV_UserArgs_MT128x256x64_MI16x16x1_SN_LDSB1_CLR1_GRVWA8_GSU0_GSUC0_GSUWGMRR0_K1_LBSPPA2048_LBSPPB1024_LPA0_MIWT4_8_PLR1_SU0_SUM0_SUS128_VWA4_VWB8_WGM6_WGMXCC1_WGMXCCGn1
    SolutionIndex: 45
    SolutionNameMin: Cijk_Ailk_Bljk_BSS_BH_Bias_HAS_SAV_UserArgs_MT128x256x64_MI16x16x1_SN_LDSB1_CLR1_GRVWA8_GSU0_GSUC0_GSUWGMRR0_K1_LBSPPA2048_LBSPPB1024_LPA0_MIWT4_8_PLR1_SU0_SUM0_SUS128_VWA4_VWB8_WGM8_WGMXCC1_WGMXCCGn1
    SolutionIndex: 46
    SolutionNameMin: Cijk_Ailk_Bljk_BSS_BH_Bias_HAS_SAV_UserArgs_MT256x128x64_MI16x16x1_SN_LDSB1_CLR1_GRVWA8_GSU0_GSUC0_GSUWGMRR0_K1_LBSPPA4096_LBSPPB512_LPA0_MIWT8_4_PLR1_SU0_SUM0_SUS128_VWA8_VWB4_WGM1_WGMXCC1_WGMXCCGn1
    SolutionIndex: 47
    SolutionNameMin: Cijk_Ailk_Bljk_BSS_BH_Bias_HAS_SAV_UserArgs_MT256x128x64_MI16x16x1_SN_LDSB1_CLR1_GRVWA2_GSU0_GSUC0_GSUWGMRR0_K1_LBSPPA4096_LBSPPB512_LPA0_MIWT8_4_PLR1_SU0_SUM0_SUS128_VWA8_VWB4_WGM4_WGMXCC1_WGMXCCGn1
    SolutionIndex: 48
    SolutionNameMin: Cijk_Ailk_Bljk_BSS_BH_Bias_HAS_SAV_UserArgs_MT256x128x64_MI16x16x1_SN_LDSB1_CLR1_GRVWA8_GSU0_GSUC0_GSUWGMRR0_K1_LBSPPA4096_LBSPPB512_LPA0_MIWT8_4_PLR1_SU0_SUM0_SUS128_VWA8_VWB4_WGM4_WGMXCC1_WGMXCCGn1
    SolutionIndex: 49
    SolutionNameMin: Cijk_Ailk_Bljk_BSS_BH_Bias_HAS_SAV_UserArgs_MT256x128x64_MI16x16x1_SN_LDSB1_CLR1_GRVWA2_GSU0_GSUC0_GSUWGMRR0_K1_LBSPPA4096_LBSPPB512_LPA0_MIWT8_4_PLR1_SU0_SUM0_SUS128_VWA8_VWB4_WGM6_WGMXCC1_WGMXCCGn1
    SolutionIndex: 50
    SolutionNameMin: Cijk_Ailk_Bljk_BSS_BH_Bias_HAS_SAV_UserArgs_MT256x128x64_MI16x16x1_SN_LDSB1_CLR1_GRVWA8_GSU0_GSUC0_GSUWGMRR0_K1_LBSPPA4096_LBSPPB512_LPA0_MIWT8_4_PLR1_SU0_SUM0_SUS128_VWA8_VWB4_WGM6_WGMXCC1_WGMXCCGn1
    SolutionIndex: 51
    SolutionNameMin: Cijk_Ailk_Bljk_BSS_BH_Bias_HAS_SAV_UserArgs_MT128x128x64_MI16x16x1_SN_LDSB1_CLR1_GRVWA8_GSU0_GSUC0_GSUWGMRR0_K1_LBSPPA1024_LBSPPB512_LPA0_MIWT4_4_PLR1_SU0_SUM0_SUS128_VWA4_VWB4_WGM1_WGMXCC1_WGMXCCGn1
    SolutionIndex: 52
    SolutionNameMin: Cijk_Ailk_Bljk_BSS_BH_Bias_HAS_SAV_UserArgs_MT128x128x64_MI16x16x1_SN_LDSB1_CLR1_GRVWA2_GSU0_GSUC0_GSUWGMRR0_K1_LBSPPA2048_LBSPPB512_LPA0_MIWT4_4_PLR1_SU0_SUM0_SUS128_VWA4_VWB4_WGM1_WGMXCC1_WGMXCCGn1
    SolutionIndex: 53
    SolutionNameMin: Cijk_Ailk_Bljk_BSS_BH_Bias_HAS_SAV_UserArgs_MT128x128x64_MI16x16x1_SN_LDSB1_CLR1_GRVWA8_GSU0_GSUC0_GSUWGMRR0_K1_LBSPPA2048_LBSPPB512_LPA0_MIWT4_4_PLR1_SU0_SUM0_SUS128_VWA4_VWB4_WGM1_WGMXCC1_WGMXCCGn1
    SolutionIndex: 54
    SolutionNameMin: Cijk_Ailk_Bljk_BSS_BH_Bias_HAS_SAV_UserArgs_MT128x128x64_MI16x16x1_SN_LDSB1_CLR1_GRVWA2_GSU0_GSUC0_GSUWGMRR0_K1_LBSPPA2048_LBSPPB512_LPA0_MIWT4_4_PLR1_SU0_SUM0_SUS128_VWA4_VWB4_WGM4_WGMXCC1_WGMXCCGn1
    SolutionIndex: 55
    SolutionNameMin: Cijk_Ailk_Bljk_BSS_BH_Bias_HAS_SAV_UserArgs_MT128x128x64_MI16x16x1_SN_LDSB1_CLR1_GRVWA8_GSU0_GSUC0_GSUWGMRR0_K1_LBSPPA2048_LBSPPB512_LPA0_MIWT4_4_PLR1_SU0_SUM0_SUS128_VWA4_VWB4_WGM4_WGMXCC1_WGMXCCGn1
    SolutionIndex: 56
    SolutionNameMin: Cijk_Ailk_Bljk_BSS_BH_Bias_HAS_SAV_UserArgs_MT128x128x64_MI16x16x1_SN_LDSB1_CLR1_GRVWA2_GSU0_GSUC0_GSUWGMRR0_K1_LBSPPA2048_LBSPPB512_LPA0_MIWT4_4_PLR1_SU0_SUM0_SUS128_VWA4_VWB4_WGM6_WGMXCC1_WGMXCCGn1
    SolutionIndex: 57
    SolutionNameMin: Cijk_Ailk_Bljk_BSS_BH_Bias_HAS_SAV_UserArgs_MT128x128x64_MI16x16x1_SN_LDSB1_CLR1_GRVWA8_GSU0_GSUC0_GSUWGMRR0_K1_LBSPPA2048_LBSPPB512_LPA0_MIWT4_4_PLR1_SU0_SUM0_SUS128_VWA4_VWB4_WGM6_WGMXCC1_WGMXCCGn1
    SolutionIndex: 58
    SolutionNameMin: Cijk_Ailk_Bljk_BSS_BH_Bias_HAS_SAV_UserArgs_MT128x128x64_MI16x16x1_SN_LDSB1_CLR1_GRVWA2_GSU0_GSUC0_GSUWGMRR0_K1_LBSPPA2048_LBSPPB512_LPA0_MIWT4_4_PLR1_SU0_SUM0_SUS128_VWA4_VWB4_WGM8_WGMXCC1_WGMXCCGn1
    SolutionIndex: 59
    SolutionNameMin: Cijk_Ailk_Bljk_BSS_BH_Bias_HAS_SAV_UserArgs_MT128x128x64_MI16x16x1_SN_LDSB1_CLR1_GRVWA8_GSU0_GSUC0_GSUWGMRR0_K1_LBSPPA2048_LBSPPB512_LPA0_MIWT4_4_PLR1_SU0_SUM0_SUS128_VWA4_VWB4_WGM8_WGMXCC1_WGMXCCGn1
    SolutionIndex: 60
    SolutionNameMin: Cijk_Ailk_Bljk_BSS_BH_Bias_HAS_SAV_UserArgs_MT128x64x64_MI16x16x1_SN_LDSB1_CLR1_GRVWA8_GSU0_GSUC0_GSUWGMRR0_K1_LBSPPA1024_LBSPPB256_LPA0_MIWT4_2_PLR1_SU0_SUM0_SUS128_VWA4_VWB2_WGM1_WGMXCC1_WGMXCCGn1
    SolutionIndex: 61
    SolutionNameMin: Cijk_Ailk_Bljk_BSS_BH_Bias_HAS_SAV_UserArgs_MT128x64x64_MI16x16x1_SN_LDSB1_CLR1_GRVWA2_GSU0_GSUC0_GSUWGMRR0_K1_LBSPPA2048_LBSPPB256_LPA0_MIWT4_2_PLR1_SU0_SUM0_SUS128_VWA4_VWB2_WGM1_WGMXCC1_WGMXCCGn1
    SolutionIndex: 62
    SolutionNameMin: Cijk_Ailk_Bljk_BSS_BH_Bias_HAS_SAV_UserArgs_MT128x64x64_MI16x16x1_SN_LDSB1_CLR1_GRVWA8_GSU0_GSUC0_GSUWGMRR0_K1_LBSPPA2048_LBSPPB256_LPA0_MIWT4_2_PLR1_SU0_SUM0_SUS128_VWA4_VWB2_WGM1_WGMXCC1_WGMXCCGn1
    SolutionIndex: 63
    SolutionNameMin: Cijk_Ailk_Bljk_BSS_BH_Bias_HAS_SAV_UserArgs_MT128x64x64_MI16x16x1_SN_LDSB1_CLR1_GRVWA8_GSU0_GSUC0_GSUWGMRR0_K1_LBSPPA2048_LBSPPB256_LPA0_MIWT4_2_PLR1_SU0_SUM0_SUS128_VWA4_VWB2_WGM4_WGMXCC1_WGMXCCGn1
    SolutionIndex: 64
    SolutionNameMin: Cijk_Ailk_Bljk_BSS_BH_Bias_HAS_SAV_UserArgs_MT128x64x64_MI16x16x1_SN_LDSB1_CLR1_GRVWA8_GSU0_GSUC0_GSUWGMRR0_K1_LBSPPA2048_LBSPPB256_LPA0_MIWT4_2_PLR1_SU0_SUM0_SUS128_VWA4_VWB2_WGM6_WGMXCC1_WGMXCCGn1
    SolutionIndex: 65
    SolutionNameMin: Cijk_Ailk_Bljk_BSS_BH_Bias_HAS_SAV_UserArgs_MT128x64x64_MI16x16x1_SN_LDSB1_CLR1_GRVWA8_GSU0_GSUC0_GSUWGMRR0_K1_LBSPPA1024_LBSPPB256_LPA0_MIWT4_2_PLR1_SU0_SUM0_SUS128_VWA4_VWB2_WGM8_WGMXCC1_WGMXCCGn1
    SolutionIndex: 66
    SolutionNameMin: Cijk_Ailk_Bljk_BSS_BH_Bias_HAS_SAV_UserArgs_MT128x64x64_MI16x16x1_SN_LDSB1_CLR1_GRVWA8_GSU0_GSUC0_GSUWGMRR0_K1_LBSPPA2048_LBSPPB256_LPA0_MIWT4_2_PLR1_SU0_SUM0_SUS128_VWA4_VWB2_WGM8_WGMXCC1_WGMXCCGn1
    SolutionIndex: 67
    SolutionNameMin: Cijk_Ailk_Bljk_BSS_BH_Bias_HAS_SAV_UserArgs_MT128x32x64_MI16x16x1_SN_LDSB1_CLR1_GRVWA8_GSU0_GSUC0_GSUWGMRR0_K1_LBSPPA1024_LBSPPB128_LPA0_MIWT4_1_PLR1_SU0_SUM0_SUS128_VWA4_VWB1_WGM1_WGMXCC1_WGMXCCGn1
    SolutionIndex: 68
    SolutionNameMin: Cijk_Ailk_Bljk_BSS_BH_Bias_HAS_SAV_UserArgs_MT128x32x64_MI16x16x1_SN_LDSB1_CLR1_GRVWA8_GSU0_GSUC0_GSUWGMRR0_K1_LBSPPA2048_LBSPPB128_LPA0_MIWT4_1_PLR1_SU0_SUM0_SUS128_VWA4_VWB1_WGM1_WGMXCC1_WGMXCCGn1
    SolutionIndex: 69
    SolutionNameMin: Cijk_Ailk_Bljk_BSS_BH_Bias_HAS_SAV_UserArgs_MT64x64x64_MI16x16x1_SN_LDSB1_CLR1_GRVWA8_GSU0_GSUC0_GSUWGMRR0_K1_LBSPPA512_LBSPPB256_LPA32_MIWT2_2_PLR1_SU0_SUM0_SUS128_VWA2_VWB2_WGM1_WGMXCC1_WGMXCCGn1
    SolutionIndex: 70
    SolutionNameMin: Cijk_Ailk_Bljk_BSS_BH_Bias_HAS_SAV_UserArgs_MT64x64x64_MI16x16x1_SN_LDSB1_CLR1_GRVWA2_GSU0_GSUC0_GSUWGMRR0_K1_LBSPPA512_LBSPPB256_LPA32_MIWT2_2_PLR1_SU0_SUM0_SUS128_VWA2_VWB2_WGM1_WGMXCC1_WGMXCCGn1
    SolutionIndex: 71
    SolutionNameMin: Cijk_Ailk_Bljk_BSS_BH_Bias_HAS_SAV_UserArgs_MT64x64x64_MI16x16x1_SN_LDSB1_CLR1_GRVWA8_GSU0_GSUC0_GSUWGMRR0_K1_LBSPPA512_LBSPPB256_LPA32_MIWT2_2_PLR1_SU0_SUM0_SUS128_VWA2_VWB2_WGM1_WGMXCC1_WGMXCCGn1
    SolutionIndex: 72
    SolutionNameMin: Cijk_Ailk_Bljk_BSS_BH_Bias_HAS_SAV_UserArgs_MT64x64x64_MI16x16x1_SN_LDSB1_CLR1_GRVWA2_GSU0_GSUC0_GSUWGMRR0_K1_LBSPPA1024_LBSPPB256_LPA32_MIWT2_2_PLR1_SU0_SUM0_SUS128_VWA2_VWB2_WGM1_WGMXCC1_WGMXCCGn1
    SolutionIndex: 73
    SolutionNameMin: Cijk_Ailk_Bljk_BSS_BH_Bias_HAS_SAV_UserArgs_MT64x64x64_MI16x16x1_SN_LDSB1_CLR1_GRVWA8_GSU0_GSUC0_GSUWGMRR0_K1_LBSPPA1024_LBSPPB256_LPA32_MIWT2_2_PLR1_SU0_SUM0_SUS128_VWA2_VWB2_WGM1_WGMXCC1_WGMXCCGn1
    SolutionIndex: 74
    SolutionNameMin: Cijk_Ailk_Bljk_BSS_BH_Bias_HAS_SAV_UserArgs_MT64x64x64_MI16x16x1_SN_LDSB1_CLR1_GRVWA2_GSU0_GSUC0_GSUWGMRR0_K1_LBSPPA1024_LBSPPB256_LPA32_MIWT2_2_PLR1_SU0_SUM0_SUS128_VWA2_VWB2_WGM4_WGMXCC1_WGMXCCGn1
    SolutionIndex: 75
    SolutionNameMin: Cijk_Ailk_Bljk_BSS_BH_Bias_HAS_SAV_UserArgs_MT64x64x64_MI16x16x1_SN_LDSB1_CLR1_GRVWA2_GSU0_GSUC0_GSUWGMRR0_K1_LBSPPA1024_LBSPPB256_LPA32_MIWT2_2_PLR1_SU0_SUM0_SUS128_VWA2_VWB2_WGM6_WGMXCC1_WGMXCCGn1
    SolutionIndex: 76
    SolutionNameMin: Cijk_Ailk_Bljk_BSS_BH_Bias_HAS_SAV_UserArgs_MT64x64x64_MI16x16x1_SN_LDSB1_CLR1_GRVWA2_GSU0_GSUC0_GSUWGMRR0_K1_LBSPPA1024_LBSPPB256_LPA32_MIWT2_2_PLR1_SU0_SUM0_SUS128_VWA2_VWB2_WGM8_WGMXCC1_WGMXCCGn1
    SolutionIndex: 77
    SolutionNameMin: Cijk_Ailk_Bljk_BSS_BH_Bias_HAS_SAV_UserArgs_MT32x64x64_MI16x16x1_SN_LDSB0_CLR1_GRVWA2_GSU0_GSUC0_GSUWGMRR0_K1_LBSPPA512_LBSPPB256_LPA16_MIWT1_2_PLR1_SU0_SUM0_SUS128_VWA1_VWB2_WGM1_WGMXCC1_WGMXCCGn1
    SolutionIndex: 78
    SolutionNameMin: Cijk_Ailk_Bljk_BSS_BH_Bias_HAS_SAV_UserArgs_MT32x64x64_MI16x16x1_SN_LDSB0_CLR1_GRVWA2_GSU0_GSUC0_GSUWGMRR0_K1_LBSPPA512_LBSPPB256_LPA16_MIWT1_2_PLR1_SU0_SUM0_SUS128_VWA1_VWB2_WGM1_WGMXCC1_WGMXCCGn1
    SolutionIndex: 79
    SolutionNameMin: Cijk_Ailk_Bljk_BSS_BH_Bias_HAS_SAV_UserArgs_MT64x32x64_MI16x16x1_SN_LDSB0_CLR1_GRVWA8_GSU0_GSUC0_GSUWGMRR0_K1_LBSPPA1024_LBSPPB128_LPA32_MIWT2_1_PLR1_SU0_SUM0_SUS128_VWA2_VWB1_WGM1_WGMXCC1_WGMXCCGn1
    SolutionIndex: 80
    SolutionNameMin: Cijk_Ailk_Bljk_BSS_BH_Bias_HAS_SAV_UserArgs_MT64x32x64_MI16x16x1_SN_LDSB0_CLR1_GRVWA8_GSU0_GSUC0_GSUWGMRR0_K1_LBSPPA1024_LBSPPB128_LPA32_MIWT2_1_PLR1_SU0_SUM0_SUS128_VWA2_VWB1_WGM4_WGMXCC1_WGMXCCGn1
    SolutionIndex: 81
    SolutionNameMin: Cijk_Ailk_Bljk_BSS_BH_Bias_HAS_SAV_UserArgs_MT32x32x64_MI16x16x1_SN_LDSB0_CLR1_GRVWA2_GSU0_GSUC0_GSUWGMRR0_K1_LBSPPA256_LBSPPB128_LPA16_MIWT1_1_PLR1_SU0_SUM0_SUS128_VWA1_VWB1_WGM1_WGMXCC1_WGMXCCGn1
    SolutionIndex: 82
    SolutionNameMin: Cijk_Ailk_Bljk_BSS_BH_Bias_HAS_SAV_UserArgs_MT32x32x64_MI16x16x1_SN_LDSB0_CLR1_GRVWA2_GSU0_GSUC0_GSUWGMRR0_K1_LBSPPA256_LBSPPB128_LPA16_MIWT1_1_PLR1_SU0_SUM0_SUS128_VWA1_VWB1_WGM1_WGMXCC1_WGMXCCGn1
    SolutionIndex: 83
    SolutionNameMin: Cijk_Ailk_Bljk_BSS_BH_Bias_HAS_SAV_UserArgs_MT32x32x64_MI16x16x1_SN_LDSB0_CLR1_GRVWA2_GSU0_GSUC0_GSUWGMRR0_K1_LBSPPA512_LBSPPB128_LPA16_MIWT1_1_PLR1_SU0_SUM0_SUS128_VWA1_VWB1_WGM1_WGMXCC1_WGMXCCGn1
    SolutionIndex: 84
    SolutionNameMin: Cijk_Ailk_Bljk_BSS_BH_Bias_HAS_SAV_UserArgs_MT32x32x64_MI16x16x1_SN_LDSB0_CLR1_GRVWA2_GSU0_GSUC0_GSUWGMRR0_K1_LBSPPA512_LBSPPB128_LPA16_MIWT1_1_PLR1_SU0_SUM0_SUS128_VWA1_VWB1_WGM1_WGMXCC1_WGMXCCGn1
    SolutionIndex: 85
    SolutionNameMin: Cijk_Ailk_Bljk_BSS_BH_Bias_HAS_SAV_UserArgs_MT32x32x64_MI16x16x1_SN_LDSB0_CLR1_GRVWA2_GSU0_GSUC0_GSUWGMRR0_K1_LBSPPA512_LBSPPB128_LPA16_MIWT1_1_PLR1_SU0_SUM0_SUS128_VWA1_VWB1_WGM4_WGMXCC1_WGMXCCGn1
    SolutionIndex: 86
    SolutionNameMin: Cijk_Ailk_Bljk_BSS_BH_Bias_HAS_SAV_UserArgs_MT32x32x64_MI16x16x1_SN_LDSB0_CLR1_GRVWA2_GSU0_GSUC0_GSUWGMRR0_K1_LBSPPA512_LBSPPB128_LPA16_MIWT1_1_PLR1_SU0_SUM0_SUS128_VWA1_VWB1_WGM6_WGMXCC1_WGMXCCGn1
    SolutionIndex: 87
    SolutionNameMin: Cijk_Ailk_Bljk_BSS_BH_Bias_HAS_SAV_UserArgs_MT128x64x128_MI16x16x1_SN_LDSB1_CLR1_GRVWA8_GSU0_GSUC0_GSUWGMRR0_K1_LBSPPA2048_LBSPPB512_LPA0_MIWT4_2_PLR1_SU0_SUM0_SUS256_VWA4_VWB2_WGM1_WGMXCC1_WGMXCCGn1
    SolutionIndex: 88
    SolutionNameMin: Cijk_Ailk_Bljk_BSS_BH_Bias_HAS_SAV_UserArgs_MT128x64x128_MI16x16x1_SN_LDSB1_CLR1_GRVWA8_GSU0_GSUC0_GSUWGMRR0_K1_LBSPPA2048_LBSPPB512_LPA0_MIWT4_2_PLR1_SU0_SUM0_SUS256_VWA4_VWB2_WGM4_WGMXCC1_WGMXCCGn1
    SolutionIndex: 89
    SolutionNameMin: Cijk_Ailk_Bljk_BSS_BH_Bias_HAS_SAV_UserArgs_MT128x64x128_MI16x16x1_SN_LDSB1_CLR1_GRVWA8_GSU0_GSUC0_GSUWGMRR0_K1_LBSPPA2048_LBSPPB512_LPA0_MIWT4_2_PLR1_SU0_SUM0_SUS256_VWA4_VWB2_WGM6_WGMXCC1_WGMXCCGn1
    SolutionIndex: 90
    SolutionNameMin: Cijk_Ailk_Bljk_BSS_BH_Bias_HAS_SAV_UserArgs_MT128x64x128_MI16x16x1_SN_LDSB1_CLR1_GRVWA8_GSU0_GSUC0_GSUWGMRR0_K1_LBSPPA2048_LBSPPB512_LPA0_MIWT4_2_PLR1_SU0_SUM0_SUS256_VWA4_VWB2_WGM8_WGMXCC1_WGMXCCGn1
    SolutionIndex: 91
    SolutionNameMin: Cijk_Ailk_Bljk_BSS_BH_Bias_HAS_SAV_UserArgs_MT64x64x128_MI16x16x1_SN_LDSB1_CLR1_GRVWA8_GSU0_GSUC0_GSUWGMRR0_K1_LBSPPA1024_LBSPPB512_LPA32_MIWT2_2_PLR1_SU0_SUM0_SUS256_VWA2_VWB2_WGM1_WGMXCC1_WGMXCCGn1
    SolutionIndex: 92
    SolutionNameMin: Cijk_Ailk_Bljk_BSS_BH_Bias_HAS_SAV_UserArgs_MT64x64x128_MI16x16x1_SN_LDSB1_CLR1_GRVWA8_GSU0_GSUC0_GSUWGMRR0_K1_LBSPPA1024_LBSPPB512_LPA32_MIWT2_2_PLR1_SU0_SUM0_SUS256_VWA2_VWB2_WGM4_WGMXCC1_WGMXCCGn1
    SolutionIndex: 93
    SolutionNameMin: Cijk_Ailk_Bljk_BSS_BH_Bias_HAS_SAV_UserArgs_MT64x64x128_MI16x16x1_SN_LDSB1_CLR1_GRVWA8_GSU0_GSUC0_GSUWGMRR0_K1_LBSPPA1024_LBSPPB512_LPA32_MIWT2_2_PLR1_SU0_SUM0_SUS256_VWA2_VWB2_WGM6_WGMXCC1_WGMXCCGn1
    SolutionIndex: 94
    SolutionNameMin: Cijk_Ailk_Bljk_BSS_BH_Bias_HAS_SAV_UserArgs_MT32x64x128_MI16x16x1_SN_LDSB1_CLR1_GRVWA8_GSU0_GSUC0_GSUWGMRR0_K1_LBSPPA512_LBSPPB512_LPA16_MIWT1_2_PLR1_SU0_SUM0_SUS256_VWA1_VWB2_WGM1_WGMXCC1_WGMXCCGn1
    SolutionIndex: 95
    SolutionNameMin: Cijk_Ailk_Bljk_BSS_BH_Bias_HAS_SAV_UserArgs_MT64x32x128_MI16x16x1_SN_LDSB1_CLR1_GRVWA8_GSU0_GSUC0_GSUWGMRR0_K1_LBSPPA512_LBSPPB256_LPA32_MIWT2_1_PLR1_SU0_SUM0_SUS256_VWA2_VWB1_WGM1_WGMXCC1_WGMXCCGn1
    SolutionIndex: 96
    SolutionNameMin: Cijk_Ailk_Bljk_BSS_BH_Bias_HAS_SAV_UserArgs_MT64x32x128_MI16x16x1_SN_LDSB1_CLR1_GRVWA2_GSU0_GSUC0_GSUWGMRR0_K1_LBSPPA1024_LBSPPB256_LPA32_MIWT2_1_PLR1_SU0_SUM0_SUS256_VWA2_VWB1_WGM1_WGMXCC1_WGMXCCGn1
    SolutionIndex: 97
    SolutionNameMin: Cijk_Ailk_Bljk_BSS_BH_Bias_HAS_SAV_UserArgs_MT64x32x128_MI16x16x1_SN_LDSB1_CLR1_GRVWA8_GSU0_GSUC0_GSUWGMRR0_K1_LBSPPA1024_LBSPPB256_LPA32_MIWT2_1_PLR1_SU0_SUM0_SUS256_VWA2_VWB1_WGM1_WGMXCC1_WGMXCCGn1
    SolutionIndex: 98
    SolutionNameMin: Cijk_Ailk_Bljk_BSS_BH_Bias_HAS_SAV_UserArgs_MT64x32x128_MI16x16x1_SN_LDSB1_CLR1_GRVWA8_GSU0_GSUC0_GSUWGMRR0_K1_LBSPPA1024_LBSPPB256_LPA32_MIWT2_1_PLR1_SU0_SUM0_SUS256_VWA2_VWB1_WGM4_WGMXCC1_WGMXCCGn1
    SolutionIndex: 99
    SolutionNameMin: Cijk_Ailk_Bljk_BSS_BH_Bias_HAS_SAV_UserArgs_MT64x32x128_MI16x16x1_SN_LDSB1_CLR1_GRVWA8_GSU0_GSUC0_GSUWGMRR0_K1_LBSPPA512_LBSPPB256_LPA32_MIWT2_1_PLR1_SU0_SUM0_SUS256_VWA2_VWB1_WGM6_WGMXCC1_WGMXCCGn1
    SolutionIndex: 100
    SolutionNameMin: Cijk_Ailk_Bljk_BSS_BH_Bias_HAS_SAV_UserArgs_MT64x32x128_MI16x16x1_SN_LDSB1_CLR1_GRVWA8_GSU0_GSUC0_GSUWGMRR0_K1_LBSPPA1024_LBSPPB256_LPA32_MIWT2_1_PLR1_SU0_SUM0_SUS256_VWA2_VWB1_WGM6_WGMXCC1_WGMXCCGn1
    SolutionIndex: 101
    SolutionNameMin: Cijk_Ailk_Bljk_BSS_BH_Bias_HAS_SAV_UserArgs_MT64x32x128_MI16x16x1_SN_LDSB1_CLR1_GRVWA8_GSU0_GSUC0_GSUWGMRR0_K1_LBSPPA1024_LBSPPB256_LPA32_MIWT2_1_PLR1_SU0_SUM0_SUS256_VWA2_VWB1_WGM8_WGMXCC1_WGMXCCGn1
    SolutionIndex: 102
    SolutionNameMin: Cijk_Ailk_Bljk_BSS_BH_Bias_HAS_SAV_UserArgs_MT32x32x128_MI16x16x1_SN_LDSB1_CLR1_GRVWA8_GSU0_GSUC0_GSUWGMRR0_K1_LBSPPA256_LBSPPB256_LPA16_MIWT1_1_PLR1_SU0_SUM0_SUS256_VWA1_VWB1_WGM1_WGMXCC1_WGMXCCGn1
    SolutionIndex: 103
    SolutionNameMin: Cijk_Ailk_Bljk_BSS_BH_Bias_HAS_SAV_UserArgs_MT32x32x128_MI16x16x1_SN_LDSB1_CLR1_GRVWA2_GSU0_GSUC0_GSUWGMRR0_K1_LBSPPA512_LBSPPB256_LPA16_MIWT1_1_PLR1_SU0_SUM0_SUS256_VWA1_VWB1_WGM1_WGMXCC1_WGMXCCGn1
    SolutionIndex: 104
    SolutionNameMin: Cijk_Ailk_Bljk_BSS_BH_Bias_HAS_SAV_UserArgs_MT32x32x128_MI16x16x1_SN_LDSB1_CLR1_GRVWA4_GSU0_GSUC0_GSUWGMRR0_K1_LBSPPA512_LBSPPB256_LPA16_MIWT1_1_PLR1_SU0_SUM0_SUS256_VWA1_VWB1_WGM1_WGMXCC1_WGMXCCGn1
    SolutionIndex: 105
    SolutionNameMin: Cijk_Ailk_Bljk_BSS_BH_Bias_HAS_SAV_UserArgs_MT32x32x128_MI16x16x1_SN_LDSB1_CLR1_GRVWA8_GSU0_GSUC0_GSUWGMRR0_K1_LBSPPA512_LBSPPB256_LPA16_MIWT1_1_PLR1_SU0_SUM0_SUS256_VWA1_VWB1_WGM1_WGMXCC1_WGMXCCGn1
    SolutionIndex: 106
    SolutionNameMin: Cijk_Ailk_Bljk_BSS_BH_Bias_HAS_SAV_UserArgs_MT32x32x128_MI16x16x1_SN_LDSB1_CLR1_GRVWA4_GSU0_GSUC0_GSUWGMRR0_K1_LBSPPA512_LBSPPB256_LPA16_MIWT1_1_PLR1_SU0_SUM0_SUS256_VWA1_VWB1_WGM4_WGMXCC1_WGMXCCGn1
    SolutionIndex: 107
    SolutionNameMin: Cijk_Ailk_Bljk_BSS_BH_Bias_HAS_SAV_UserArgs_MT32x32x128_MI16x16x1_SN_LDSB1_CLR1_GRVWA8_GSU0_GSUC0_GSUWGMRR0_K1_LBSPPA512_LBSPPB256_LPA16_MIWT1_1_PLR1_SU0_SUM0_SUS256_VWA1_VWB1_WGM4_WGMXCC1_WGMXCCGn1
    SolutionIndex: 108
    SolutionNameMin: Cijk_Ailk_Bljk_BSS_BH_Bias_HAS_SAV_UserArgs_MT32x32x128_MI16x16x1_SN_LDSB1_CLR1_GRVWA4_GSU0_GSUC0_GSUWGMRR0_K1_LBSPPA512_LBSPPB256_LPA16_MIWT1_1_PLR1_SU0_SUM0_SUS256_VWA1_VWB1_WGM6_WGMXCC1_WGMXCCGn1
    SolutionIndex: 109
    SolutionNameMin: Cijk_Ailk_Bljk_BSS_BH_Bias_HAS_SAV_UserArgs_MT32x32x128_MI16x16x1_SN_LDSB1_CLR1_GRVWA8_GSU0_GSUC0_GSUWGMRR0_K1_LBSPPA512_LBSPPB256_LPA16_MIWT1_1_PLR1_SU0_SUM0_SUS256_VWA1_VWB1_WGM6_WGMXCC1_WGMXCCGn1
    SolutionIndex: 110
    SolutionNameMin: Cijk_Ailk_Bljk_BSS_BH_Bias_HAS_SAV_UserArgs_MT32x32x128_MI16x16x1_SN_LDSB1_CLR1_GRVWA4_GSU0_GSUC0_GSUWGMRR0_K1_LBSPPA512_LBSPPB256_LPA16_MIWT1_1_PLR1_SU0_SUM0_SUS256_VWA1_VWB1_WGM8_WGMXCC1_WGMXCCGn1
    SolutionIndex: 111
    SolutionNameMin: Cijk_Ailk_Bljk_BSS_BH_Bias_HAS_SAV_UserArgs_MT32x32x128_MI16x16x1_SN_LDSB1_CLR1_GRVWA8_GSU0_GSUC0_GSUWGMRR0_K1_LBSPPA512_LBSPPB256_LPA16_MIWT1_1_PLR1_SU0_SUM0_SUS256_VWA1_VWB1_WGM8_WGMXCC1_WGMXCCGn1
- - - [128, 128, 1, 128, 128, 128, 128, 128]
    - [83, 0.45]
  - - [128, 128, 1, 256, 128, 128, 128, 256]
    - [105, 0.78]
  - - [128, 128, 1, 512, 128, 128, 128, 512]
    - [105, 1.31]
  - - [128, 128, 1, 1024, 128, 128, 128, 1024]
    - [105, 1.94]
  - - [128, 128, 1, 2048, 128, 128, 128, 2048]
    - [105, 2.51]
  - - [128, 128, 1, 4096, 128, 128, 128, 4096]
    - [105, 3.03]
  - - [128, 128, 1, 8192, 128, 128, 128, 8192]
    - [105, 3.42]
  - - [128, 256, 1, 128, 128, 128, 128, 128]
    - [105, 0.9]
  - - [128, 256, 1, 256, 128, 128, 128, 256]
    - [102, 1.53]
  - - [128, 256, 1, 512, 128, 128, 128, 512]
    - [105, 2.57]
  - - [128, 256, 1, 1024, 128, 128, 128, 1024]
    - [105, 3.78]
  - - [128, 256, 1, 2048, 128, 128, 128, 2048]
    - [104, 5.03]
  - - [128, 256, 1, 4096, 128, 128, 128, 4096]
    - [105, 6.07]
  - - [128, 256, 1, 8192, 128, 128, 128, 8192]
    - [105, 6.82]
  - - [128, 512, 1, 128, 128, 128, 128, 128]
    - [103, 1.77]
  - - [128, 512, 1, 256, 128, 128, 128, 256]
    - [103, 3.03]
  - - [128, 512, 1, 512, 128, 128, 128, 512]
    - [105, 5.15]
  - - [128, 512, 1, 1024, 128, 128, 128, 1024]
    - [105, 7.53]
  - - [128, 512, 1, 2048, 128, 128, 128, 2048]
    - [104, 10.01]
  - - [128, 512, 1, 4096, 128, 128, 128, 4096]
    - [105, 12.14]
  - - [128, 512, 1, 8192, 128, 128, 128, 8192]
    - [105, 13.62]
  - - [128, 1024, 1, 128, 128, 128, 128, 128]
    - [105, 3.53]
  - - [128, 1024, 1, 256, 128, 128, 128, 256]
    - [105, 6.07]
  - - [128, 1024, 1, 512, 128, 128, 128, 512]
    - [104, 9.97]
  - - [128, 1024, 1, 1024, 128, 128, 128, 1024]
    - [104, 14.93]
  - - [128, 1024, 1, 2048, 128, 128, 128, 2048]
    - [105, 19.73]
  - - [128, 1024, 1, 4096, 128, 128, 128, 4096]
    - [105, 23.87]
  - - [128, 1024, 1, 8192, 128, 128, 128, 8192]
    - [105, 27.51]
  - - [128, 2048, 1, 128, 128, 128, 128, 128]
    - [79, 6.32]
  - - [128, 2048, 1, 256, 128, 128, 128, 256]
    - [97, 10.7]
  - - [128, 2048, 1, 512, 128, 128, 128, 512]
    - [97, 17.89]
  - - [128, 2048, 1, 1024, 128, 128, 128, 1024]
    - [97, 26.58]
  - - [128, 2048, 1, 2048, 128, 128, 128, 2048]
    - [97, 35.16]
  - - [128, 2048, 1, 4096, 128, 128, 128, 4096]
    - [97, 42.34]
  - - [128, 2048, 1, 8192, 128, 128, 128, 8192]
    - [96, 46.41]
  - - [128, 4096, 1, 128, 128, 128, 128, 128]
    - [72, 10.53]
  - - [128, 4096, 1, 256, 128, 128, 128, 256]
    - [73, 18.08]
  - - [128, 4096, 1, 512, 128, 128, 128, 512]
    - [91, 28.96]
  - - [128, 4096, 1, 1024, 128, 128, 128, 1024]
    - [91, 42.51]
  - - [128, 4096, 1, 2048, 128, 128, 128, 2048]
    - [91, 56.06]
  - - [128, 4096, 1, 4096, 128, 128, 128, 4096]
    - [91, 64.19]
  - - [128, 4096, 1, 8192, 128, 128, 128, 8192]
    - [91, 72.12]
  - - [128, 8192, 1, 128, 128, 128, 128, 128]
    - [60, 16.58]
  - - [128, 8192, 1, 256, 128, 128, 128, 256]
    - [87, 27.95]
  - - [128, 8192, 1, 512, 128, 128, 128, 512]
    - [87, 46.06]
  - - [128, 8192, 1, 1024, 128, 128, 128, 1024]
    - [87, 64.4]
  - - [128, 8192, 1, 2048, 128, 128, 128, 2048]
    - [89, 77.06]
  - - [128, 8192, 1, 4096, 128, 128, 128, 4096]
    - [90, 92.49]
  - - [128, 8192, 1, 8192, 128, 128, 128, 8192]
    - [87, 94.51]
  - - [256, 128, 1, 128, 256, 256, 256, 128]
    - [83, 0.85]
  - - [256, 128, 1, 256, 256, 256, 256, 256]
    - [84, 1.46]
  - - [256, 128, 1, 512, 256, 256, 256, 512]
    - [105, 2.37]
  - - [256, 128, 1, 1024, 256, 256, 256, 1024]
    - [104, 3.44]
  - - [256, 128, 1, 2048, 256, 256, 256, 2048]
    - [104, 4.41]
  - - [256, 128, 1, 4096, 256, 256, 256, 4096]
    - [104, 5.19]
  - - [256, 128, 1, 8192, 256, 256, 256, 8192]
    - [104, 5.72]
  - - [256, 256, 1, 128, 256, 256, 256, 128]
    - [82, 1.74]
  - - [256, 256, 1, 256, 256, 256, 256, 256]
    - [84, 2.97]
  - - [256, 256, 1, 512, 256, 256, 256, 512]
    - [105, 4.79]
  - - [256, 256, 1, 1024, 256, 256, 256, 1024]
    - [104, 6.99]
  - - [256, 256, 1, 2048, 256, 256, 256, 2048]
    - [104, 8.98]
  - - [256, 256, 1, 4096, 256, 256, 256, 4096]
    - [104, 10.69]
  - - [256, 256, 1, 8192, 256, 256, 256, 8192]
    - [104, 11.81]
  - - [256, 512, 1, 128, 256, 256, 256, 128]
    - [104, 3.34]
  - - [256, 512, 1, 256, 256, 256, 256, 256]
    - [84, 5.75]
  - - [256, 512, 1, 512, 256, 256, 256, 512]
    - [105, 9.37]
  - - [256, 512, 1, 1024, 256, 256, 256, 1024]
    - [104, 13.85]
  - - [256, 512, 1, 2048, 256, 256, 256, 2048]
    - [104, 18.24]
  - - [256, 512, 1, 4096, 256, 256, 256, 4096]
    - [104, 21.54]
  - - [256, 512, 1, 8192, 256, 256, 256, 8192]
    - [104, 23.91]
  - - [256, 1024, 1, 128, 256, 256, 256, 128]
    - [95, 6.1]
  - - [256, 1024, 1, 256, 256, 256, 256, 256]
    - [78, 10.38]
  - - [256, 1024, 1, 512, 256, 256, 256, 512]
    - [97, 17.25]
  - - [256, 1024, 1, 1024, 256, 256, 256, 1024]
    - [97, 25.17]
  - - [256, 1024, 1, 2048, 256, 256, 256, 2048]
    - [97, 32.54]
  - - [256, 1024, 1, 4096, 256, 256, 256, 4096]
    - [97, 38.81]
  - - [256, 1024, 1, 8192, 256, 256, 256, 8192]
    - [97, 42.8]
  - - [256, 2048, 1, 128, 256, 256, 256, 128]
    - [68, 10.32]
  - - [256, 2048, 1, 256, 256, 256, 256, 256]
    - [70, 17.97]
  - - [256, 2048, 1, 512, 256, 256, 256, 512]
    - [72, 28.23]
  - - [256, 2048, 1, 1024, 256, 256, 256, 1024]
    - [91, 39.22]
  - - [256, 2048, 1, 2048, 256, 256, 256, 2048]
    - [91, 49.76]
  - - [256, 2048, 1, 4096, 256, 256, 256, 4096]
    - [97, 62.96]
  - - [256, 2048, 1, 8192, 256, 256, 256, 8192]
    - [33, 63.22]
  - - [256, 4096, 1, 128, 256, 256, 256, 128]
    - [62, 16.36]
  - - [256, 4096, 1, 256, 256, 256, 256, 256]
    - [62, 29.11]
  - - [256, 4096, 1, 512, 256, 256, 256, 512]
    - [62, 45.8]
  - - [256, 4096, 1, 1024, 256, 256, 256, 1024]
    - [62, 64.74]
  - - [256, 4096, 1, 2048, 256, 256, 256, 2048]
    - [62, 79.08]
  - - [256, 4096, 1, 4096, 256, 256, 256, 4096]
    - [61, 88.08]
  - - [256, 4096, 1, 8192, 256, 256, 256, 8192]
    - [62, 91.82]
  - - [256, 8192, 1, 128, 256, 256, 256, 128]
    - [22, 22.93]
  - - [256, 8192, 1, 256, 256, 256, 256, 256]
    - [51, 38.49]
  - - [256, 8192, 1, 512, 256, 256, 256, 512]
    - [53, 59.14]
  - - [256, 8192, 1, 1024, 256, 256, 256, 1024]
    - [52, 79.24]
  - - [256, 8192, 1, 2048, 256, 256, 256, 2048]
    - [52, 97.67]
  - - [256, 8192, 1, 4096, 256, 256, 256, 4096]
    - [55, 111.35]
  - - [256, 8192, 1, 8192, 256, 256, 256, 8192]
    - [53, 111.3]
  - - [512, 128, 1, 128, 512, 512, 512, 128]
    - [84, 1.68]
  - - [512, 128, 1, 256, 512, 512, 512, 256]
    - [81, 2.95]
  - - [512, 128, 1, 512, 512, 512, 512, 512]
    - [104, 4.55]
  - - [512, 128, 1, 1024, 512, 512, 512, 1024]
    - [104, 6.64]
  - - [512, 128, 1, 2048, 512, 512, 512, 2048]
    - [104, 8.6]
  - - [512, 128, 1, 4096, 512, 512, 512, 4096]
    - [108, 10.14]
  - - [512, 128, 1, 8192, 512, 512, 512, 8192]
    - [106, 11.13]
  - - [512, 256, 1, 128, 512, 512, 512, 128]
    - [84, 3.36]
  - - [512, 256, 1, 256, 512, 512, 512, 256]
    - [84, 5.58]
  - - [512, 256, 1, 512, 512, 512, 512, 512]
    - [110, 9.04]
  - - [512, 256, 1, 1024, 512, 512, 512, 1024]
    - [110, 13.38]
  - - [512, 256, 1, 2048, 512, 512, 512, 2048]
    - [106, 17.6]
  - - [512, 256, 1, 4096, 512, 512, 512, 4096]
    - [108, 20.94]
  - - [512, 256, 1, 8192, 512, 512, 512, 8192]
    - [110, 23.0]
  - - [512, 512, 1, 128, 512, 512, 512, 128]
    - [77, 5.87]
  - - [512, 512, 1, 256, 512, 512, 512, 256]
    - [79, 10.25]
  - - [512, 512, 1, 512, 512, 512, 512, 512]
    - [101, 16.82]
  - - [512, 512, 1, 1024, 512, 512, 512, 1024]
    - [98, 24.85]
  - - [512, 512, 1, 2048, 512, 512, 512, 2048]
    - [97, 32.08]
  - - [512, 512, 1, 4096, 512, 512, 512, 4096]
    - [97, 38.18]
  - - [512, 512, 1, 8192, 512, 512, 512, 8192]
    - [100, 41.78]
  - - [512, 1024, 1, 128, 512, 512, 512, 128]
    - [67, 10.16]
  - - [512, 1024, 1, 256, 512, 512, 512, 256]
    - [75, 17.72]
  - - [512, 1024, 1, 512, 512, 512, 512, 512]
    - [72, 27.91]
  - - [512, 1024, 1, 1024, 512, 512, 512, 1024]
    - [93, 39.38]
  - - [512, 1024, 1, 2048, 512, 512, 512, 2048]
    - [93, 49.82]
  - - [512, 1024, 1, 4096, 512, 512, 512, 4096]
    - [97, 58.38]
  - - [512, 1024, 1, 8192, 512, 512, 512, 8192]
    - [32, 64.58]
  - - [512, 2048, 1, 128, 512, 512, 512, 128]
    - [29, 16.16]
  - - [512, 2048, 1, 256, 512, 512, 512, 256]
    - [62, 28.35]
  - - [512, 2048, 1, 512, 512, 512, 512, 512]
    - [62, 44.26]
  - - [512, 2048, 1, 1024, 512, 512, 512, 1024]
    - [62, 63.64]
  - - [512, 2048, 1, 2048, 512, 512, 512, 2048]
    - [87, 81.66]
  - - [512, 2048, 1, 4096, 512, 512, 512, 4096]
    - [87, 95.52]
  - - [512, 2048, 1, 8192, 512, 512, 512, 8192]
    - [87, 94.25]
  - - [512, 4096, 1, 128, 512, 512, 512, 128]
    - [21, 23.81]
  - - [512, 4096, 1, 256, 512, 512, 512, 256]
    - [53, 39.98]
  - - [512, 4096, 1, 512, 512, 512, 512, 512]
    - [53, 63.46]
  - - [512, 4096, 1, 1024, 512, 512, 512, 1024]
    - [59, 86.67]
  - - [512, 4096, 1, 2048, 512, 512, 512, 2048]
    - [53, 103.11]
  - - [512, 4096, 1, 4096, 512, 512, 512, 4096]
    - [53, 119.6]
  - - [512, 4096, 1, 8192, 512, 512, 512, 8192]
    - [53, 122.51]
  - - [512, 8192, 1, 128, 512, 512, 512, 128]
    - [14, 29.28]
  - - [512, 8192, 1, 256, 512, 512, 512, 256]
    - [45, 46.97]
  - - [512, 8192, 1, 512, 512, 512, 512, 512]
    - [45, 71.0]
  - - [512, 8192, 1, 1024, 512, 512, 512, 1024]
    - [50, 97.56]
  - - [512, 8192, 1, 2048, 512, 512, 512, 2048]
    - [50, 121.35]
  - - [512, 8192, 1, 4096, 512, 512, 512, 4096]
    - [57, 124.5]
  - - [512, 8192, 1, 8192, 512, 512, 512, 8192]
    - [38, 138.42]
  - - [1024, 128, 1, 128, 1024, 1024, 1024, 128]
    - [85, 3.24]
  - - [1024, 128, 1, 256, 1024, 1024, 1024, 256]
    - [86, 5.51]
  - - [1024, 128, 1, 512, 1024, 1024, 1024, 512]
    - [109, 8.97]
  - - [1024, 128, 1, 1024, 1024, 1024, 1024, 1024]
    - [107, 13.0]
  - - [1024, 128, 1, 2048, 1024, 1024, 1024, 2048]
    - [111, 16.75]
  - - [1024, 128, 1, 4096, 1024, 1024, 1024, 4096]
    - [111, 19.58]
  - - [1024, 128, 1, 8192, 1024, 1024, 1024, 8192]
    - [106, 21.27]
  - - [1024, 256, 1, 128, 1024, 1024, 1024, 128]
    - [78, 5.8]
  - - [1024, 256, 1, 256, 1024, 1024, 1024, 256]
    - [80, 10.06]
  - - [1024, 256, 1, 512, 1024, 1024, 1024, 512]
    - [101, 16.35]
  - - [1024, 256, 1, 1024, 1024, 1024, 1024, 1024]
    - [101, 24.09]
  - - [1024, 256, 1, 2048, 1024, 1024, 1024, 2048]
    - [101, 31.31]
  - - [1024, 256, 1, 4096, 1024, 1024, 1024, 4096]
    - [98, 36.76]
  - - [1024, 256, 1, 8192, 1024, 1024, 1024, 8192]
    - [101, 40.76]
  - - [1024, 512, 1, 128, 1024, 1024, 1024, 128]
    - [76, 10.09]
  - - [1024, 512, 1, 256, 1024, 1024, 1024, 256]
    - [74, 17.55]
  - - [1024, 512, 1, 512, 1024, 1024, 1024, 512]
    - [75, 27.94]
  - - [1024, 512, 1, 1024, 1024, 1024, 1024, 1024]
    - [75, 39.26]
  - - [1024, 512, 1, 2048, 1024, 1024, 1024, 2048]
    - [92, 49.31]
  - - [1024, 512, 1, 4096, 1024, 1024, 1024, 4096]
    - [92, 57.43]
  - - [1024, 512, 1, 8192, 1024, 1024, 1024, 8192]
    - [35, 63.5]
  - - [1024, 1024, 1, 128, 1024, 1024, 1024, 128]
    - [31, 16.13]
  - - [1024, 1024, 1, 256, 1024, 1024, 1024, 256]
    - [64, 28.19]
  - - [1024, 1024, 1, 512, 1024, 1024, 1024, 512]
    - [64, 45.49]
  - - [1024, 1024, 1, 1024, 1024, 1024, 1024, 1024]
    - [64, 65.0]
  - - [1024, 1024, 1, 2048, 1024, 1024, 1024, 2048]
    - [90, 82.65]
  - - [1024, 1024, 1, 4096, 1024, 1024, 1024, 4096]
    - [90, 95.52]
  - - [1024, 1024, 1, 8192, 1024, 1024, 1024, 8192]
    - [66, 90.76]
  - - [1024, 2048, 1, 128, 1024, 1024, 1024, 128]
    - [21, 23.74]
  - - [1024, 2048, 1, 256, 1024, 1024, 1024, 256]
    - [51, 39.71]
  - - [1024, 2048, 1, 512, 1024, 1024, 1024, 512]
    - [53, 63.44]
  - - [1024, 2048, 1, 1024, 1024, 1024, 1024, 1024]
    - [53, 88.92]
  - - [1024, 2048, 1, 2048, 1024, 1024, 1024, 2048]
    - [56, 108.82]
  - - [1024, 2048, 1, 4096, 1024, 1024, 1024, 4096]
    - [54, 118.74]
  - - [1024, 2048, 1, 8192, 1024, 1024, 1024, 8192]
    - [55, 121.02]
  - - [1024, 4096, 1, 128, 1024, 1024, 1024, 128]
    - [13, 29.31]
  - - [1024, 4096, 1, 256, 1024, 1024, 1024, 256]
    - [38, 47.1]
  - - [1024, 4096, 1, 512, 1024, 1024, 1024, 512]
    - [18, 72.8]
  - - [1024, 4096, 1, 1024, 1024, 1024, 1024, 1024]
    - [46, 100.98]
  - - [1024, 4096, 1, 2048, 1024, 1024, 1024, 2048]
    - [47, 121.63]
  - - [1024, 4096, 1, 4096, 1024, 1024, 1024, 4096]
    - [38, 129.72]
  - - [1024, 4096, 1, 8192, 1024, 1024, 1024, 8192]
    - [38, 137.67]
  - - [1024, 8192, 1, 128, 1024, 1024, 1024, 128]
    - [12, 33.55]
  - - [1024, 8192, 1, 256, 1024, 1024, 1024, 256]
    - [6, 52.86]
  - - [1024, 8192, 1, 512, 1024, 1024, 1024, 512]
    - [6, 82.82]
  - - [1024, 8192, 1, 1024, 1024, 1024, 1024, 1024]
    - [9, 109.65]
  - - [1024, 8192, 1, 2048, 1024, 1024, 1024, 2048]
    - [44, 125.72]
  - - [1024, 8192, 1, 4096, 1024, 1024, 1024, 4096]
    - [44, 145.7]
  - - [1024, 8192, 1, 8192, 1024, 1024, 1024, 8192]
    - [7, 159.52]
  - - [2048, 128, 1, 128, 2048, 2048, 2048, 128]
    - [78, 5.92]
  - - [2048, 128, 1, 256, 2048, 2048, 2048, 256]
    - [77, 10.06]
  - - [2048, 128, 1, 512, 2048, 2048, 2048, 512]
    - [94, 16.14]
  - - [2048, 128, 1, 1024, 2048, 2048, 2048, 1024]
    - [101, 23.3]
  - - [2048, 128, 1, 2048, 2048, 2048, 2048, 2048]
    - [98, 29.96]
  - - [2048, 128, 1, 4096, 2048, 2048, 2048, 4096]
    - [98, 35.38]
  - - [2048, 128, 1, 8192, 2048, 2048, 2048, 8192]
    - [99, 34.92]
  - - [2048, 256, 1, 128, 2048, 2048, 2048, 128]
    - [75, 9.99]
  - - [2048, 256, 1, 256, 2048, 2048, 2048, 256]
    - [71, 17.35]
  - - [2048, 256, 1, 512, 2048, 2048, 2048, 512]
    - [75, 27.54]
  - - [2048, 256, 1, 1024, 2048, 2048, 2048, 1024]
    - [76, 38.57]
  - - [2048, 256, 1, 2048, 2048, 2048, 2048, 2048]
    - [92, 49.06]
  - - [2048, 256, 1, 4096, 2048, 2048, 2048, 4096]
    - [93, 56.99]
  - - [2048, 256, 1, 8192, 2048, 2048, 2048, 8192]
    - [34, 60.3]
  - - [2048, 512, 1, 128, 2048, 2048, 2048, 128]
    - [28, 16.35]
  - - [2048, 512, 1, 256, 2048, 2048, 2048, 256]
    - [66, 28.33]
  - - [2048, 512, 1, 512, 2048, 2048, 2048, 512]
    - [66, 45.41]
  - - [2048, 512, 1, 1024, 2048, 2048, 2048, 1024]
    - [63, 64.68]
  - - [2048, 512, 1, 2048, 2048, 2048, 2048, 2048]
    - [88, 81.56]
  - - [2048, 512, 1, 4096, 2048, 2048, 2048, 4096]
    - [88, 92.06]
  - - [2048, 512, 1, 8192, 2048, 2048, 2048, 8192]
    - [88, 90.04]
  - - [2048, 1024, 1, 128, 2048, 2048, 2048, 128]
    - [20, 23.43]
  - - [2048, 1024, 1, 256, 2048, 2048, 2048, 256]
    - [53, 39.59]
  - - [2048, 1024, 1, 512, 2048, 2048, 2048, 512]
    - [55, 62.71]
  - - [2048, 1024, 1, 1024, 2048, 2048, 2048, 1024]
    - [57, 87.46]
  - - [2048, 1024, 1, 2048, 2048, 2048, 2048, 2048]
    - [54, 108.69]
  - - [2048, 1024, 1, 4096, 2048, 2048, 2048, 4096]
    - [55, 117.87]
  - - [2048, 1024, 1, 8192, 2048, 2048, 2048, 8192]
    - [54, 119.9]
  - - [2048, 2048, 1, 128, 2048, 2048, 2048, 128]
    - [12, 28.19]
  - - [2048, 2048, 1, 256, 2048, 2048, 2048, 256]
    - [18, 45.93]
  - - [2048, 2048, 1, 512, 2048, 2048, 2048, 512]
    - [18, 71.3]
  - - [2048, 2048, 1, 1024, 2048, 2048, 2048, 1024]
    - [46, 99.56]
  - - [2048, 2048, 1, 2048, 2048, 2048, 2048, 2048]
    - [49, 122.17]
  - - [2048, 2048, 1, 4096, 2048, 2048, 2048, 4096]
    - [40, 129.24]
  - - [2048, 2048, 1, 8192, 2048, 2048, 2048, 8192]
    - [40, 141.58]
  - - [2048, 4096, 1, 128, 2048, 2048, 2048, 128]
    - [12, 32.17]
  - - [2048, 4096, 1, 256, 2048, 2048, 2048, 256]
    - [2, 52.24]
  - - [2048, 4096, 1, 512, 2048, 2048, 2048, 512]
    - [2, 83.17]
  - - [2048, 4096, 1, 1024, 2048, 2048, 2048, 1024]
    - [6, 109.85]
  - - [2048, 4096, 1, 2048, 2048, 2048, 2048, 2048]
    - [38, 131.59]
  - - [2048, 4096, 1, 4096, 2048, 2048, 2048, 4096]
    - [36, 149.14]
  - - [2048, 4096, 1, 8192, 2048, 2048, 2048, 8192]
    - [0, 162.8]
  - - [2048, 8192, 1, 128, 2048, 2048, 2048, 128]
    - [11, 34.66]
  - - [2048, 8192, 1, 256, 2048, 2048, 2048, 256]
    - [23, 58.3]
  - - [2048, 8192, 1, 512, 2048, 2048, 2048, 512]
    - [59, 87.93]
  - - [2048, 8192, 1, 1024, 2048, 2048, 2048, 1024]
    - [57, 110.31]
  - - [2048, 8192, 1, 2048, 2048, 2048, 2048, 2048]
    - [38, 144.49]
  - - [2048, 8192, 1, 4096, 2048, 2048, 2048, 4096]
    - [38, 167.02]
  - - [2048, 8192, 1, 8192, 2048, 2048, 2048, 8192]
    - [38, 178.21]
  - - [4096, 128, 1, 128, 4096, 4096, 4096, 128]
    - [72, 9.94]
  - - [4096, 128, 1, 256, 4096, 4096, 4096, 256]
    - [69, 16.95]
  - - [4096, 128, 1, 512, 4096, 4096, 4096, 512]
    - [73, 26.91]
  - - [4096, 128, 1, 1024, 4096, 4096, 4096, 1024]
    - [93, 37.69]
  - - [4096, 128, 1, 2048, 4096, 4096, 4096, 2048]
    - [93, 48.46]
  - - [4096, 128, 1, 4096, 4096, 4096, 4096, 4096]
    - [91, 52.63]
  - - [4096, 128, 1, 8192, 4096, 4096, 4096, 8192]
    - [27, 55.84]
  - - [4096, 256, 1, 128, 4096, 4096, 4096, 128]
    - [30, 15.78]
  - - [4096, 256, 1, 256, 4096, 4096, 4096, 256]
    - [64, 27.95]
  - - [4096, 256, 1, 512, 4096, 4096, 4096, 512]
    - [63, 44.68]
  - - [4096, 256, 1, 1024, 4096, 4096, 4096, 1024]
    - [88, 64.07]
  - - [4096, 256, 1, 2048, 4096, 4096, 4096, 2048]
    - [89, 79.64]
  - - [4096, 256, 1, 4096, 4096, 4096, 4096, 4096]
    - [89, 88.51]
  - - [4096, 256, 1, 8192, 4096, 4096, 4096, 8192]
    - [88, 89.22]
  - - [4096, 512, 1, 128, 4096, 4096, 4096, 128]
    - [20, 22.72]
  - - [4096, 512, 1, 256, 4096, 4096, 4096, 256]
    - [55, 38.41]
  - - [4096, 512, 1, 512, 4096, 4096, 4096, 512]
    - [55, 61.7]
  - - [4096, 512, 1, 1024, 4096, 4096, 4096, 1024]
    - [57, 85.92]
  - - [4096, 512, 1, 2048, 4096, 4096, 4096, 2048]
    - [56, 104.98]
  - - [4096, 512, 1, 4096, 4096, 4096, 4096, 4096]
    - [54, 119.02]
  - - [4096, 512, 1, 8192, 4096, 4096, 4096, 8192]
    - [56, 120.77]
  - - [4096, 1024, 1, 128, 4096, 4096, 4096, 128]
    - [11, 27.31]
  - - [4096, 1024, 1, 256, 4096, 4096, 4096, 256]
    - [19, 45.27]
  - - [4096, 1024, 1, 512, 4096, 4096, 4096, 512]
    - [18, 71.64]
  - - [4096, 1024, 1, 1024, 4096, 4096, 4096, 1024]
    - [48, 99.18]
  - - [4096, 1024, 1, 2048, 4096, 4096, 4096, 2048]
    - [57, 123.47]
  - - [4096, 1024, 1, 4096, 4096, 4096, 4096, 4096]
    - [53, 135.29]
  - - [4096, 1024, 1, 8192, 4096, 4096, 4096, 8192]
    - [44, 140.31]
  - - [4096, 2048, 1, 128, 4096, 4096, 4096, 128]
    - [11, 31.67]
  - - [4096, 2048, 1, 256, 4096, 4096, 4096, 256]
    - [17, 51.86]
  - - [4096, 2048, 1, 512, 4096, 4096, 4096, 512]
    - [19, 78.3]
  - - [4096, 2048, 1, 1024, 4096, 4096, 4096, 1024]
    - [15, 106.45]
  - - [4096, 2048, 1, 2048, 4096, 4096, 4096, 2048]
    - [38, 139.7]
  - - [4096, 2048, 1, 4096, 4096, 4096, 4096, 4096]
    - [38, 155.02]
  - - [4096, 2048, 1, 8192, 4096, 4096, 4096, 8192]
    - [38, 170.65]
  - - [4096, 4096, 1, 128, 4096, 4096, 4096, 128]
    - [29, 33.57]
  - - [4096, 4096, 1, 256, 4096, 4096, 4096, 256]
    - [26, 56.5]
  - - [4096, 4096, 1, 512, 4096, 4096, 4096, 512]
    - [56, 86.14]
  - - [4096, 4096, 1, 1024, 4096, 4096, 4096, 1024]
    - [57, 112.69]
  - - [4096, 4096, 1, 2048, 4096, 4096, 4096, 2048]
    - [36, 141.08]
  - - [4096, 4096, 1, 4096, 4096, 4096, 4096, 4096]
    - [38, 167.27]
  - - [4096, 4096, 1, 8192, 4096, 4096, 4096, 8192]
    - [8, 178.78]
  - - [4096, 8192, 1, 128, 4096, 4096, 4096, 128]
    - [24, 36.58]
  - - [4096, 8192, 1, 256, 4096, 4096, 4096, 256]
    - [53, 60.5]
  - - [4096, 8192, 1, 512, 4096, 4096, 4096, 512]
    - [56, 91.14]
  - - [4096, 8192, 1, 1024, 4096, 4096, 4096, 1024]
    - [36, 122.56]
  - - [4096, 8192, 1, 2048, 4096, 4096, 4096, 2048]
    - [39, 155.19]
  - - [4096, 8192, 1, 4096, 4096, 4096, 4096, 4096]
    - [4, 183.17]
  - - [4096, 8192, 1, 8192, 4096, 4096, 4096, 8192]
    - [3, 204.91]
  - - [8192, 128, 1, 128, 8192, 8192, 8192, 128]
    - [65, 15.55]
  - - [8192, 128, 1, 256, 8192, 8192, 8192, 256]
    - [63, 27.57]
  - - [8192, 128, 1, 512, 8192, 8192, 8192, 512]
    - [63, 42.8]
  - - [8192, 128, 1, 1024, 8192, 8192, 8192, 1024]
    - [90, 60.02]
  - - [8192, 128, 1, 2048, 8192, 8192, 8192, 2048]
    - [89, 72.0]
  - - [8192, 128, 1, 4096, 8192, 8192, 8192, 4096]
    - [88, 84.32]
  - - [8192, 128, 1, 8192, 8192, 8192, 8192, 8192]
    - [90, 82.83]
  - - [8192, 256, 1, 128, 8192, 8192, 8192, 128]
    - [21, 22.64]
  - - [8192, 256, 1, 256, 8192, 8192, 8192, 256]
    - [55, 38.32]
  - - [8192, 256, 1, 512, 8192, 8192, 8192, 512]
    - [59, 60.5]
  - - [8192, 256, 1, 1024, 8192, 8192, 8192, 1024]
    - [55, 81.67]
  - - [8192, 256, 1, 2048, 8192, 8192, 8192, 2048]
    - [59, 100.24]
  - - [8192, 256, 1, 4096, 8192, 8192, 8192, 4096]
    - [58, 117.5]
  - - [8192, 256, 1, 8192, 8192, 8192, 8192, 8192]
    - [59, 116.46]
  - - [8192, 512, 1, 128, 8192, 8192, 8192, 128]
    - [16, 27.66]
  - - [8192, 512, 1, 256, 8192, 8192, 8192, 256]
    - [44, 44.66]
  - - [8192, 512, 1, 512, 8192, 8192, 8192, 512]
    - [45, 69.25]
  - - [8192, 512, 1, 1024, 8192, 8192, 8192, 1024]
    - [50, 96.7]
  - - [8192, 512, 1, 2048, 8192, 8192, 8192, 2048]
    - [50, 121.78]
  - - [8192, 512, 1, 4096, 8192, 8192, 8192, 4096]
    - [53, 132.85]
  - - [8192, 512, 1, 8192, 8192, 8192, 8192, 8192]
    - [45, 140.41]
  - - [8192, 1024, 1, 128, 8192, 8192, 8192, 128]
    - [12, 32.51]
  - - [8192, 1024, 1, 256, 8192, 8192, 8192, 256]
    - [14, 50.58]
  - - [8192, 1024, 1, 512, 8192, 8192, 8192, 512]
    - [9, 79.5]
  - - [8192, 1024, 1, 1024, 8192, 8192, 8192, 1024]
    - [9, 108.8]
  - - [8192, 1024, 1, 2048, 8192, 8192, 8192, 2048]
    - [38, 132.82]
  - - [8192, 1024, 1, 4096, 8192, 8192, 8192, 4096]
    - [37, 159.24]
  - - [8192, 1024, 1, 8192, 8192, 8192, 8192, 8192]
    - [1, 158.83]
  - - [8192, 2048, 1, 128, 8192, 8192, 8192, 128]
    - [13, 34.91]
  - - [8192, 2048, 1, 256, 8192, 8192, 8192, 256]
    - [25, 57.13]
  - - [8192, 2048, 1, 512, 8192, 8192, 8192, 512]
    - [59, 88.49]
  - - [8192, 2048, 1, 1024, 8192, 8192, 8192, 1024]
    - [59, 114.81]
  - - [8192, 2048, 1, 2048, 8192, 8192, 8192, 2048]
    - [44, 143.83]
  - - [8192, 2048, 1, 4096, 8192, 8192, 8192, 4096]
    - [42, 170.19]
  - - [8192, 2048, 1, 8192, 8192, 8192, 8192, 8192]
    - [5, 181.15]
  - - [8192, 4096, 1, 128, 8192, 8192, 8192, 128]
    - [25, 37.96]
  - - [8192, 4096, 1, 256, 8192, 8192, 8192, 256]
    - [59, 59.41]
  - - [8192, 4096, 1, 512, 8192, 8192, 8192, 512]
    - [43, 89.71]
  - - [8192, 4096, 1, 1024, 8192, 8192, 8192, 1024]
    - [40, 126.54]
  - - [8192, 4096, 1, 2048, 8192, 8192, 8192, 2048]
    - [44, 157.42]
  - - [8192, 4096, 1, 4096, 8192, 8192, 8192, 4096]
    - [2, 191.49]
  - - [8192, 4096, 1, 8192, 8192, 8192, 8192, 8192]
    - [2, 212.3]
  - - [8192, 8192, 1, 128, 8192, 8192, 8192, 128]
    - [13, 40.24]
  - - [8192, 8192, 1, 256, 8192, 8192, 8192, 256]
    - [44, 61.23]
  - - [8192, 8192, 1, 512, 8192, 8192, 8192, 512]
    - [43, 97.48]
  - - [8192, 8192, 1, 1024, 8192, 8192, 8192, 1024]
    - [10, 137.03]
  - - [8192, 8192, 1, 2048, 8192, 8192, 8192, 2048]
    - [41, 171.11]
  - - [8192, 8192, 1, 4096, 8192, 8192, 8192, 4096]
    - [40, 202.69]
  - - [8192, 8192, 1, 8192, 8192, 8192, 8192, 8192]
    - [40, 215.64]
- null
- null
- ExperimentalStreamK
- GridBased
