projects/hipblaslt/library/src/amd_detail/rocblaslt/src/Tensile/Logic/asm_full/aquavanjaram/gfx942_228cu/StreamK/aquavanjaram942_Cijk_Ailk_Bljk_B8F8NBS_BH_Bias_HAS_SAV_UserArgs.yaml
- {MinimumRequiredVersion: 4.33.0}
- aquavanjaram942
- {Architecture: gfx942, CUCount: 228}
- [Device 0049, Device 0050]
    SolutionIndex: 0
    SolutionNameMin: Cijk_Ailk_Bljk_B8F8NBS_BH_Bias_HAS_SAV_UserArgs_MT256x256x64_MI16x16x1_SN_LDSB1_CLR1_GRVWA16_GRVWB8_GSU0_GSUC0_GSUWGMRR0_K1_LBSPPA2048_LBSPPB512_LPA0_LPB8_LRVW8_MIWT8_8_PLR1_SU0_SUM0_SUS64_VWA8_VWB8_WGM1_WGMXCC1_WGMXCCGn1
    SolutionIndex: 1
    SolutionNameMin: Cijk_Ailk_Bljk_B8F8NBS_BH_Bias_HAS_SAV_UserArgs_MT256x256x64_MI16x16x1_SN_LDSB1_CLR1_GRVWA8_GRVWB16_GSU0_GSUC0_GSUWGMRR0_K1_LBSPPA2048_LBSPPB512_LPA0_LPB16_LRVW8_MIWT8_8_PLR1_SU0_SUM0_SUS64_VWA8_VWB8_WGM1_WGMXCC1_WGMXCCGn1
    SolutionIndex: 2
    SolutionNameMin: Cijk_Ailk_Bljk_B8F8NBS_BH_Bias_HAS_SAV_UserArgs_MT256x256x64_MI16x16x1_SN_LDSB1_CLR1_GRVWA16_GRVWB16_GSU0_GSUC0_GSUWGMRR0_K1_LBSPPA2048_LBSPPB512_LPA0_LPB16_LRVW8_MIWT8_8_PLR1_SU0_SUM0_SUS64_VWA8_VWB8_WGM1_WGMXCC1_WGMXCCGn1
    SolutionIndex: 3
    SolutionNameMin: Cijk_Ailk_Bljk_B8F8NBS_BH_Bias_HAS_SAV_UserArgs_MT256x256x64_MI16x16x1_SN_LDSB1_CLR1_GRVWA16_GRVWB8_GSU0_GSUC0_GSUWGMRR0_K1_LBSPPA2048_LBSPPB512_LPA0_LPB8_LRVW8_MIWT8_8_PLR1_SU0_SUM0_SUS64_VWA8_VWB8_WGM4_WGMXCC1_WGMXCCGn1
    SolutionIndex: 4
    SolutionNameMin: Cijk_Ailk_Bljk_B8F8NBS_BH_Bias_HAS_SAV_UserArgs_MT256x256x64_MI16x16x1_SN_LDSB1_CLR1_GRVWA8_GRVWB16_GSU0_GSUC0_GSUWGMRR0_K1_LBSPPA2048_LBSPPB512_LPA0_LPB16_LRVW8_MIWT8_8_PLR1_SU0_SUM0_SUS64_VWA8_VWB8_WGM4_WGMXCC1_WGMXCCGn1
    SolutionIndex: 5
    SolutionNameMin: Cijk_Ailk_Bljk_B8F8NBS_BH_Bias_HAS_SAV_UserArgs_MT256x256x64_MI16x16x1_SN_LDSB1_CLR1_GRVWA16_GRVWB16_GSU0_GSUC0_GSUWGMRR0_K1_LBSPPA2048_LBSPPB512_LPA0_LPB16_LRVW8_MIWT8_8_PLR1_SU0_SUM0_SUS64_VWA8_VWB8_WGM4_WGMXCC1_WGMXCCGn1
    SolutionIndex: 6
    SolutionNameMin: Cijk_Ailk_Bljk_B8F8NBS_BH_Bias_HAS_SAV_UserArgs_MT256x256x64_MI16x16x1_SN_LDSB1_CLR1_GRVWA16_GRVWB8_GSU0_GSUC0_GSUWGMRR0_K1_LBSPPA2048_LBSPPB512_LPA0_LPB8_LRVW8_MIWT8_8_PLR1_SU0_SUM0_SUS64_VWA8_VWB8_WGM6_WGMXCC1_WGMXCCGn1
    SolutionIndex: 7
    SolutionNameMin: Cijk_Ailk_Bljk_B8F8NBS_BH_Bias_HAS_SAV_UserArgs_MT256x256x64_MI16x16x1_SN_LDSB1_CLR1_GRVWA8_GRVWB16_GSU0_GSUC0_GSUWGMRR0_K1_LBSPPA2048_LBSPPB512_LPA0_LPB16_LRVW8_MIWT8_8_PLR1_SU0_SUM0_SUS64_VWA8_VWB8_WGM6_WGMXCC1_WGMXCCGn1
    SolutionIndex: 8
    SolutionNameMin: Cijk_Ailk_Bljk_B8F8NBS_BH_Bias_HAS_SAV_UserArgs_MT256x256x64_MI16x16x1_SN_LDSB1_CLR1_GRVWA8_GRVWB16_GSU0_GSUC0_GSUWGMRR0_K1_LBSPPA2048_LBSPPB512_LPA0_LPB16_LRVW8_MIWT8_8_PLR1_SU0_SUM0_SUS64_VWA8_VWB8_WGM8_WGMXCC1_WGMXCCGn1
    SolutionIndex: 9
    SolutionNameMin: Cijk_Ailk_Bljk_B8F8NBS_BH_Bias_HAS_SAV_UserArgs_MT256x256x64_MI16x16x1_SN_LDSB1_CLR1_GRVWA16_GRVWB16_GSU0_GSUC0_GSUWGMRR0_K1_LBSPPA2048_LBSPPB512_LPA0_LPB16_LRVW8_MIWT8_8_PLR1_SU0_SUM0_SUS64_VWA8_VWB8_WGM8_WGMXCC1_WGMXCCGn1
    SolutionIndex: 10
    SolutionNameMin: Cijk_Ailk_Bljk_B8F8NBS_BH_Bias_HAS_SAV_UserArgs_MT128x256x64_MI16x16x1_SN_LDSB1_CLR1_GRVWA8_GRVWB16_GSU0_GSUC0_GSUWGMRR0_K1_LBSPPA1024_LBSPPB512_LPA64_LPB16_LRVW8_MIWT4_8_PLR1_SU0_SUM0_SUS64_VWA4_VWB8_WGM6_WGMXCC1_WGMXCCGn1
    SolutionIndex: 11
    SolutionNameMin: Cijk_Ailk_Bljk_B8F8NBS_BH_Bias_HAS_SAV_UserArgs_MT128x256x64_MI16x16x1_SN_LDSB1_CLR1_GRVWA16_GRVWB16_GSU0_GSUC0_GSUWGMRR0_K1_LBSPPA1024_LBSPPB512_LPA64_LPB16_LRVW8_MIWT4_8_PLR1_SU0_SUM0_SUS64_VWA4_VWB8_WGM8_WGMXCC1_WGMXCCGn1
    SolutionIndex: 12
    SolutionNameMin: Cijk_Ailk_Bljk_B8F8NBS_BH_Bias_HAS_SAV_UserArgs_MT256x128x64_MI16x16x1_SN_LDSB1_CLR1_GRVWA8_GRVWB8_GSU0_GSUC0_GSUWGMRR0_K1_LBSPPA2048_LBSPPB256_LPA0_LPB8_LRVW8_MIWT8_4_PLR1_SU0_SUM0_SUS64_VWA8_VWB4_WGM1_WGMXCC1_WGMXCCGn1
    SolutionIndex: 13
    SolutionNameMin: Cijk_Ailk_Bljk_B8F8NBS_BH_Bias_HAS_SAV_UserArgs_MT256x128x64_MI16x16x1_SN_LDSB1_CLR1_GRVWA16_GRVWB16_GSU0_GSUC0_GSUWGMRR0_K1_LBSPPA2048_LBSPPB256_LPA0_LPB16_LRVW8_MIWT8_4_PLR1_SU0_SUM0_SUS64_VWA8_VWB4_WGM1_WGMXCC1_WGMXCCGn1
    SolutionIndex: 14
    SolutionNameMin: Cijk_Ailk_Bljk_B8F8NBS_BH_Bias_HAS_SAV_UserArgs_MT256x128x64_MI16x16x1_SN_LDSB1_CLR1_GRVWA8_GRVWB8_GSU0_GSUC0_GSUWGMRR0_K1_LBSPPA2048_LBSPPB256_LPA0_LPB8_LRVW8_MIWT8_4_PLR1_SU0_SUM0_SUS64_VWA8_VWB4_WGM4_WGMXCC1_WGMXCCGn1
    SolutionIndex: 15
    SolutionNameMin: Cijk_Ailk_Bljk_B8F8NBS_BH_Bias_HAS_SAV_UserArgs_MT256x128x64_MI16x16x1_SN_LDSB1_CLR1_GRVWA16_GRVWB16_GSU0_GSUC0_GSUWGMRR0_K1_LBSPPA2048_LBSPPB256_LPA0_LPB16_LRVW8_MIWT8_4_PLR1_SU0_SUM0_SUS64_VWA8_VWB4_WGM4_WGMXCC1_WGMXCCGn1
    SolutionIndex: 16
    SolutionNameMin: Cijk_Ailk_Bljk_B8F8NBS_BH_Bias_HAS_SAV_UserArgs_MT256x128x64_MI16x16x1_SN_LDSB1_CLR1_GRVWA8_GRVWB8_GSU0_GSUC0_GSUWGMRR0_K1_LBSPPA2048_LBSPPB256_LPA0_LPB8_LRVW8_MIWT8_4_PLR1_SU0_SUM0_SUS64_VWA8_VWB4_WGM8_WGMXCC1_WGMXCCGn1
    SolutionIndex: 17
    SolutionNameMin: Cijk_Ailk_Bljk_B8F8NBS_BH_Bias_HAS_SAV_UserArgs_MT256x128x64_MI16x16x1_SN_LDSB1_CLR1_GRVWA8_GRVWB16_GSU0_GSUC0_GSUWGMRR0_K1_LBSPPA2048_LBSPPB256_LPA0_LPB16_LRVW8_MIWT8_4_PLR1_SU0_SUM0_SUS64_VWA8_VWB4_WGM8_WGMXCC1_WGMXCCGn1
    SolutionIndex: 18
    SolutionNameMin: Cijk_Ailk_Bljk_B8F8NBS_BH_Bias_HAS_SAV_UserArgs_MT256x128x64_MI16x16x1_SN_LDSB1_CLR1_GRVWA16_GRVWB16_GSU0_GSUC0_GSUWGMRR0_K1_LBSPPA2048_LBSPPB256_LPA0_LPB16_LRVW8_MIWT8_4_PLR1_SU0_SUM0_SUS64_VWA8_VWB4_WGM8_WGMXCC1_WGMXCCGn1
    SolutionIndex: 19
    SolutionNameMin: Cijk_Ailk_Bljk_B8F8NBS_BH_Bias_HAS_SAV_UserArgs_MT128x128x64_MI16x16x1_SN_LDSB1_CLR1_GRVWA8_GRVWB16_GSU0_GSUC0_GSUWGMRR0_K1_LBSPPA1024_LBSPPB128_LPA0_LPB16_LRVW8_MIWT8_2_PLR1_SU0_SUM0_SUS64_VWA8_VWB2_WGM1_WGMXCC1_WGMXCCGn1
    SolutionIndex: 20
    SolutionNameMin: Cijk_Ailk_Bljk_B8F8NBS_BH_Bias_HAS_SAV_UserArgs_MT128x128x64_MI16x16x1_SN_LDSB1_CLR1_GRVWA16_GRVWB16_GSU0_GSUC0_GSUWGMRR0_K1_LBSPPA1024_LBSPPB128_LPA0_LPB16_LRVW8_MIWT8_2_PLR1_SU0_SUM0_SUS64_VWA8_VWB2_WGM1_WGMXCC1_WGMXCCGn1
    SolutionIndex: 21
    SolutionNameMin: Cijk_Ailk_Bljk_B8F8NBS_BH_Bias_HAS_SAV_UserArgs_MT128x128x64_MI16x16x1_SN_LDSB1_CLR1_GRVWA16_GRVWB8_GSU0_GSUC0_GSUWGMRR0_K1_LBSPPA1024_LBSPPB128_LPA0_LPB8_LRVW8_MIWT8_2_PLR1_SU0_SUM0_SUS64_VWA8_VWB2_WGM8_WGMXCC1_WGMXCCGn1
    SolutionIndex: 22
    SolutionNameMin: Cijk_Ailk_Bljk_B8F8NBS_BH_Bias_HAS_SAV_UserArgs_MT128x64x64_MI16x16x1_SN_LDSB0_CLR1_GRVWA8_GRVWB16_GSU0_GSUC0_GSUWGMRR0_K1_LBSPPA1024_LBSPPB128_LPA0_LPB16_LRVW8_MIWT8_1_PLR1_SU0_SUM0_SUS64_VWA8_VWB1_WGM1_WGMXCC1_WGMXCCGn1
    SolutionIndex: 23
    SolutionNameMin: Cijk_Ailk_Bljk_B8F8NBS_BH_Bias_HAS_SAV_UserArgs_MT64x128x64_MI16x16x1_SN_LDSB0_CLR1_GRVWA16_GRVWB8_GSU0_GSUC0_GSUWGMRR0_K1_LBSPPA512_LBSPPB256_LPA32_LPB8_LRVW8_MIWT2_4_PLR1_SU0_SUM0_SUS64_VWA2_VWB4_WGM1_WGMXCC1_WGMXCCGn1
    SolutionIndex: 24
    SolutionNameMin: Cijk_Ailk_Bljk_B8F8NBS_BH_Bias_HAS_SAV_UserArgs_MT64x128x64_MI16x16x1_SN_LDSB0_CLR1_GRVWA8_GRVWB16_GSU0_GSUC0_GSUWGMRR0_K1_LBSPPA512_LBSPPB256_LPA32_LPB16_LRVW8_MIWT2_4_PLR1_SU0_SUM0_SUS64_VWA2_VWB4_WGM1_WGMXCC1_WGMXCCGn1
    SolutionIndex: 25
    SolutionNameMin: Cijk_Ailk_Bljk_B8F8NBS_BH_Bias_HAS_SAV_UserArgs_MT64x128x64_MI16x16x1_SN_LDSB0_CLR1_GRVWA16_GRVWB8_GSU0_GSUC0_GSUWGMRR0_K1_LBSPPA512_LBSPPB256_LPA32_LPB8_LRVW8_MIWT2_4_PLR1_SU0_SUM0_SUS64_VWA2_VWB4_WGM4_WGMXCC1_WGMXCCGn1
    SolutionIndex: 26
    SolutionNameMin: Cijk_Ailk_Bljk_B8F8NBS_BH_Bias_HAS_SAV_UserArgs_MT64x128x64_MI16x16x1_SN_LDSB0_CLR1_GRVWA16_GRVWB16_GSU0_GSUC0_GSUWGMRR0_K1_LBSPPA512_LBSPPB256_LPA32_LPB16_LRVW8_MIWT2_4_PLR1_SU0_SUM0_SUS64_VWA2_VWB4_WGM6_WGMXCC1_WGMXCCGn1
    SolutionIndex: 27
    SolutionNameMin: Cijk_Ailk_Bljk_B8F8NBS_BH_Bias_HAS_SAV_UserArgs_MT128x64x64_MI16x16x1_SN_LDSB0_CLR1_GRVWA8_GRVWB16_GSU0_GSUC0_GSUWGMRR0_K1_LBSPPA1024_LBSPPB128_LPA64_LPB16_LRVW8_MIWT4_2_PLR1_SU0_SUM0_SUS64_VWA4_VWB2_WGM1_WGMXCC1_WGMXCCGn1
    SolutionIndex: 28
    SolutionNameMin: Cijk_Ailk_Bljk_B8F8NBS_BH_Bias_HAS_SAV_UserArgs_MT64x64x64_MI16x16x1_SN_LDSB0_CLR1_GRVWA8_GRVWB8_GSU0_GSUC0_GSUWGMRR0_K1_LBSPPA512_LBSPPB128_LPA32_LPB8_LRVW8_MIWT2_2_PLR1_SU0_SUM0_SUS64_VWA2_VWB2_WGM1_WGMXCC1_WGMXCCGn1
    SolutionIndex: 29
    SolutionNameMin: Cijk_Ailk_Bljk_B8F8NBS_BH_Bias_HAS_SAV_UserArgs_MT64x64x64_MI16x16x1_SN_LDSB0_CLR1_GRVWA8_GRVWB16_GSU0_GSUC0_GSUWGMRR0_K1_LBSPPA512_LBSPPB128_LPA32_LPB16_LRVW8_MIWT2_2_PLR1_SU0_SUM0_SUS64_VWA2_VWB2_WGM1_WGMXCC1_WGMXCCGn1
    SolutionIndex: 30
    SolutionNameMin: Cijk_Ailk_Bljk_B8F8NBS_BH_Bias_HAS_SAV_UserArgs_MT64x64x64_MI16x16x1_SN_LDSB0_CLR1_GRVWA16_GRVWB16_GSU0_GSUC0_GSUWGMRR0_K1_LBSPPA512_LBSPPB128_LPA32_LPB16_LRVW8_MIWT2_2_PLR1_SU0_SUM0_SUS64_VWA2_VWB2_WGM1_WGMXCC1_WGMXCCGn1
    SolutionIndex: 31
    SolutionNameMin: Cijk_Ailk_Bljk_B8F8NBS_BH_Bias_HAS_SAV_UserArgs_MT64x32x64_MI16x16x1_SN_LDSB0_CLR1_GRVWA8_GRVWB8_GSU0_GSUC0_GSUWGMRR0_K1_LBSPPA512_LBSPPB128_LPA32_LPB8_LRVW8_MIWT2_1_PLR1_SU0_SUM0_SUS64_VWA2_VWB1_WGM1_WGMXCC1_WGMXCCGn1
    SolutionIndex: 32
    SolutionNameMin: Cijk_Ailk_Bljk_B8F8NBS_BH_Bias_HAS_SAV_UserArgs_MT32x32x64_MI16x16x1_SN_LDSB0_CLR1_GRVWA8_GRVWB8_GSU0_GSUC0_GSUWGMRR0_K1_LBSPPA256_LBSPPB128_LPA16_LPB8_LRVW8_MIWT1_1_PLR1_SU0_SUM0_SUS64_VWA1_VWB1_WGM1_WGMXCC1_WGMXCCGn1
    SolutionIndex: 33
    SolutionNameMin: Cijk_Ailk_Bljk_B8F8NBS_BH_Bias_HAS_SAV_UserArgs_MT32x32x64_MI16x16x1_SN_LDSB0_CLR1_GRVWA8_GRVWB8_GSU0_GSUC0_GSUWGMRR0_K1_LBSPPA256_LBSPPB128_LPA16_LPB8_LRVW8_MIWT1_1_PLR1_SU0_SUM0_SUS64_VWA1_VWB1_WGM6_WGMXCC1_WGMXCCGn1
    SolutionIndex: 34
    SolutionNameMin: Cijk_Ailk_Bljk_B8F8NBS_BH_Bias_HAS_SAV_UserArgs_MT128x256x128_MI16x16x1_SN_LDSB1_CLR1_GRVWA8_GRVWB16_GSU0_GSUC0_GSUWGMRR0_K1_LBSPPA1024_LBSPPB1024_LPA64_LPB16_LRVW8_MIWT4_8_PLR1_SU0_SUM0_SUS128_VWA4_VWB8_WGM1_WGMXCC1_WGMXCCGn1
    SolutionIndex: 35
    SolutionNameMin: Cijk_Ailk_Bljk_B8F8NBS_BH_Bias_HAS_SAV_UserArgs_MT128x256x128_MI16x16x1_SN_LDSB1_CLR1_GRVWA16_GRVWB16_GSU0_GSUC0_GSUWGMRR0_K1_LBSPPA1024_LBSPPB1024_LPA64_LPB16_LRVW8_MIWT4_8_PLR1_SU0_SUM0_SUS128_VWA4_VWB8_WGM1_WGMXCC1_WGMXCCGn1
    SolutionIndex: 36
    SolutionNameMin: Cijk_Ailk_Bljk_B8F8NBS_BH_Bias_HAS_SAV_UserArgs_MT128x256x128_MI16x16x1_SN_LDSB1_CLR1_GRVWA8_GRVWB16_GSU0_GSUC0_GSUWGMRR0_K1_LBSPPA1024_LBSPPB1024_LPA64_LPB16_LRVW8_MIWT4_8_PLR1_SU0_SUM0_SUS128_VWA4_VWB8_WGM4_WGMXCC1_WGMXCCGn1
    SolutionIndex: 37
    SolutionNameMin: Cijk_Ailk_Bljk_B8F8NBS_BH_Bias_HAS_SAV_UserArgs_MT128x256x128_MI16x16x1_SN_LDSB1_CLR1_GRVWA16_GRVWB16_GSU0_GSUC0_GSUWGMRR0_K1_LBSPPA1024_LBSPPB1024_LPA64_LPB16_LRVW8_MIWT4_8_PLR1_SU0_SUM0_SUS128_VWA4_VWB8_WGM6_WGMXCC1_WGMXCCGn1
    SolutionIndex: 38
    SolutionNameMin: Cijk_Ailk_Bljk_B8F8NBS_BH_Bias_HAS_SAV_UserArgs_MT128x256x128_MI16x16x1_SN_LDSB1_CLR1_GRVWA16_GRVWB16_GSU0_GSUC0_GSUWGMRR0_K1_LBSPPA1024_LBSPPB1024_LPA64_LPB16_LRVW8_MIWT4_8_PLR1_SU0_SUM0_SUS128_VWA4_VWB8_WGM8_WGMXCC1_WGMXCCGn1
    SolutionIndex: 39
    SolutionNameMin: Cijk_Ailk_Bljk_B8F8NBS_BH_Bias_HAS_SAV_UserArgs_MT256x144x128_MI16x16x1_SN_LDSB1_CLR1_GRVWA8_GRVWB8_GSU0_GSUC0_GSUWGMRR0_K1_LBSPPA2048_LBSPPB128_LPA64_LPB8_LRVW8_MIWT4_9_PLR1_SU0_SUM0_SUS128_VWA4_VWB1_WGM1_WGMXCC1_WGMXCCGn1
    SolutionIndex: 40
    SolutionNameMin: Cijk_Ailk_Bljk_B8F8NBS_BH_Bias_HAS_SAV_UserArgs_MT256x144x128_MI16x16x1_SN_LDSB1_CLR1_GRVWA16_GRVWB8_GSU0_GSUC0_GSUWGMRR0_K1_LBSPPA2048_LBSPPB128_LPA64_LPB8_LRVW8_MIWT4_9_PLR1_SU0_SUM0_SUS128_VWA4_VWB1_WGM1_WGMXCC1_WGMXCCGn1
    SolutionIndex: 41
    SolutionNameMin: Cijk_Ailk_Bljk_B8F8NBS_BH_Bias_HAS_SAV_UserArgs_MT256x144x128_MI16x16x1_SN_LDSB1_CLR1_GRVWA16_GRVWB8_GSU0_GSUC0_GSUWGMRR0_K1_LBSPPA2048_LBSPPB128_LPA64_LPB8_LRVW8_MIWT4_9_PLR1_SU0_SUM0_SUS128_VWA4_VWB1_WGM4_WGMXCC1_WGMXCCGn1
    SolutionIndex: 42
    SolutionNameMin: Cijk_Ailk_Bljk_B8F8NBS_BH_Bias_HAS_SAV_UserArgs_MT256x144x128_MI16x16x1_SN_LDSB1_CLR1_GRVWA16_GRVWB8_GSU0_GSUC0_GSUWGMRR0_K1_LBSPPA2048_LBSPPB128_LPA64_LPB8_LRVW8_MIWT4_9_PLR1_SU0_SUM0_SUS128_VWA4_VWB1_WGM6_WGMXCC1_WGMXCCGn1
    SolutionIndex: 43
    SolutionNameMin: Cijk_Ailk_Bljk_B8F8NBS_BH_Bias_HAS_SAV_UserArgs_MT256x144x128_MI16x16x1_SN_LDSB1_CLR1_GRVWA16_GRVWB8_GSU0_GSUC0_GSUWGMRR0_K1_LBSPPA2048_LBSPPB128_LPA64_LPB8_LRVW8_MIWT4_9_PLR1_SU0_SUM0_SUS128_VWA4_VWB1_WGM8_WGMXCC1_WGMXCCGn1
    SolutionIndex: 44
    SolutionNameMin: Cijk_Ailk_Bljk_B8F8NBS_BH_Bias_HAS_SAV_UserArgs_MT256x128x128_MI16x16x1_SN_LDSB1_CLR1_GRVWA8_GRVWB8_GSU0_GSUC0_GSUWGMRR0_K1_LBSPPA2048_LBSPPB512_LPA0_LPB8_LRVW8_MIWT8_4_PLR1_SU0_SUM0_SUS128_VWA8_VWB4_WGM1_WGMXCC1_WGMXCCGn1
    SolutionIndex: 45
    SolutionNameMin: Cijk_Ailk_Bljk_B8F8NBS_BH_Bias_HAS_SAV_UserArgs_MT256x128x128_MI16x16x1_SN_LDSB1_CLR1_GRVWA16_GRVWB8_GSU0_GSUC0_GSUWGMRR0_K1_LBSPPA2048_LBSPPB512_LPA0_LPB8_LRVW8_MIWT8_4_PLR1_SU0_SUM0_SUS128_VWA8_VWB4_WGM6_WGMXCC1_WGMXCCGn1
    SolutionIndex: 46
    SolutionNameMin: Cijk_Ailk_Bljk_B8F8NBS_BH_Bias_HAS_SAV_UserArgs_MT256x128x128_MI16x16x1_SN_LDSB1_CLR1_GRVWA16_GRVWB8_GSU0_GSUC0_GSUWGMRR0_K1_LBSPPA2048_LBSPPB512_LPA0_LPB8_LRVW8_MIWT8_4_PLR1_SU0_SUM0_SUS128_VWA8_VWB4_WGM8_WGMXCC1_WGMXCCGn1
    SolutionIndex: 47
    SolutionNameMin: Cijk_Ailk_Bljk_B8F8NBS_BH_Bias_HAS_SAV_UserArgs_MT256x128x128_MI16x16x1_SN_LDSB1_CLR1_GRVWA16_GRVWB16_GSU0_GSUC0_GSUWGMRR0_K1_LBSPPA2048_LBSPPB512_LPA0_LPB16_LRVW8_MIWT8_4_PLR1_SU0_SUM0_SUS128_VWA8_VWB4_WGM8_WGMXCC1_WGMXCCGn1
    SolutionIndex: 48
    SolutionNameMin: Cijk_Ailk_Bljk_B8F8NBS_BH_Bias_HAS_SAV_UserArgs_MT128x128x128_MI16x16x1_SN_LDSB1_CLR1_GRVWA16_GRVWB16_GSU0_GSUC0_GSUWGMRR0_K1_LBSPPA1024_LBSPPB256_LPA0_LPB16_LRVW8_MIWT8_2_PLR1_SU0_SUM0_SUS128_VWA8_VWB2_WGM1_WGMXCC1_WGMXCCGn1
    SolutionIndex: 49
    SolutionNameMin: Cijk_Ailk_Bljk_B8F8NBS_BH_Bias_HAS_SAV_UserArgs_MT128x128x128_MI16x16x1_SN_LDSB1_CLR1_GRVWA16_GRVWB16_GSU0_GSUC0_GSUWGMRR0_K1_LBSPPA1024_LBSPPB256_LPA0_LPB16_LRVW8_MIWT8_2_PLR1_SU0_SUM0_SUS128_VWA8_VWB2_WGM4_WGMXCC1_WGMXCCGn1
    SolutionIndex: 50
    SolutionNameMin: Cijk_Ailk_Bljk_B8F8NBS_BH_Bias_HAS_SAV_UserArgs_MT128x128x128_MI16x16x1_SN_LDSB1_CLR1_GRVWA16_GRVWB16_GSU0_GSUC0_GSUWGMRR0_K1_LBSPPA1024_LBSPPB256_LPA0_LPB16_LRVW8_MIWT8_2_PLR1_SU0_SUM0_SUS128_VWA8_VWB2_WGM6_WGMXCC1_WGMXCCGn1
    SolutionIndex: 51
    SolutionNameMin: Cijk_Ailk_Bljk_B8F8NBS_BH_Bias_HAS_SAV_UserArgs_MT128x144x128_MI16x16x1_SN_LDSB1_CLR1_GRVWA8_GRVWB8_GSU0_GSUC0_GSUWGMRR0_K1_LBSPPA1024_LBSPPB128_LPA32_LPB8_LRVW8_MIWT2_9_PLR1_SU0_SUM0_SUS128_VWA2_VWB1_WGM1_WGMXCC1_WGMXCCGn1
    SolutionIndex: 52
    SolutionNameMin: Cijk_Ailk_Bljk_B8F8NBS_BH_Bias_HAS_SAV_UserArgs_MT128x144x128_MI16x16x1_SN_LDSB1_CLR1_GRVWA16_GRVWB8_GSU0_GSUC0_GSUWGMRR0_K1_LBSPPA1024_LBSPPB128_LPA32_LPB8_LRVW8_MIWT2_9_PLR1_SU0_SUM0_SUS128_VWA2_VWB1_WGM1_WGMXCC1_WGMXCCGn1
    SolutionIndex: 53
    SolutionNameMin: Cijk_Ailk_Bljk_B8F8NBS_BH_Bias_HAS_SAV_UserArgs_MT128x128x128_MI16x16x1_SN_LDSB1_CLR1_GRVWA16_GRVWB16_GSU0_GSUC0_GSUWGMRR0_K1_LBSPPA1024_LBSPPB512_LPA64_LPB16_LRVW8_MIWT4_4_PLR1_SU0_SUM0_SUS128_VWA4_VWB4_WGM1_WGMXCC1_WGMXCCGn1
    SolutionIndex: 54
    SolutionNameMin: Cijk_Ailk_Bljk_B8F8NBS_BH_Bias_HAS_SAV_UserArgs_MT128x128x128_MI16x16x1_SN_LDSB1_CLR1_GRVWA16_GRVWB16_GSU0_GSUC0_GSUWGMRR0_K1_LBSPPA1024_LBSPPB512_LPA64_LPB16_LRVW8_MIWT4_4_PLR1_SU0_SUM0_SUS128_VWA4_VWB4_WGM4_WGMXCC1_WGMXCCGn1
    SolutionIndex: 55
    SolutionNameMin: Cijk_Ailk_Bljk_B8F8NBS_BH_Bias_HAS_SAV_UserArgs_MT128x128x128_MI16x16x1_SN_LDSB1_CLR1_GRVWA16_GRVWB16_GSU0_GSUC0_GSUWGMRR0_K1_LBSPPA1024_LBSPPB512_LPA64_LPB16_LRVW8_MIWT4_4_PLR1_SU0_SUM0_SUS128_VWA4_VWB4_WGM6_WGMXCC1_WGMXCCGn1
    SolutionIndex: 56
    SolutionNameMin: Cijk_Ailk_Bljk_B8F8NBS_BH_Bias_HAS_SAV_UserArgs_MT128x128x128_MI16x16x1_SN_LDSB1_CLR1_GRVWA16_GRVWB16_GSU0_GSUC0_GSUWGMRR0_K1_LBSPPA1024_LBSPPB512_LPA64_LPB16_LRVW8_MIWT4_4_PLR1_SU0_SUM0_SUS128_VWA4_VWB4_WGM8_WGMXCC1_WGMXCCGn1
    SolutionIndex: 57
    SolutionNameMin: Cijk_Ailk_Bljk_B8F8NBS_BH_Bias_HAS_SAV_UserArgs_MT64x128x128_MI16x16x1_SN_LDSB1_CLR1_GRVWA16_GRVWB16_GSU0_GSUC0_GSUWGMRR0_K1_LBSPPA512_LBSPPB512_LPA32_LPB16_LRVW8_MIWT2_4_PLR1_SU0_SUM0_SUS128_VWA2_VWB4_WGM1_WGMXCC1_WGMXCCGn1
    SolutionIndex: 58
    SolutionNameMin: Cijk_Ailk_Bljk_B8F8NBS_BH_Bias_HAS_SAV_UserArgs_MT128x64x128_MI16x16x1_SN_LDSB1_CLR1_GRVWA16_GRVWB16_GSU0_GSUC0_GSUWGMRR0_K1_LBSPPA1024_LBSPPB256_LPA64_LPB16_LRVW8_MIWT4_2_PLR1_SU0_SUM0_SUS128_VWA4_VWB2_WGM1_WGMXCC1_WGMXCCGn1
    SolutionIndex: 59
    SolutionNameMin: Cijk_Ailk_Bljk_B8F8NBS_BH_Bias_HAS_SAV_UserArgs_MT128x64x128_MI16x16x1_SN_LDSB1_CLR1_GRVWA16_GRVWB16_GSU0_GSUC0_GSUWGMRR0_K1_LBSPPA1024_LBSPPB256_LPA64_LPB16_LRVW8_MIWT4_2_PLR1_SU0_SUM0_SUS128_VWA4_VWB2_WGM4_WGMXCC1_WGMXCCGn1
    SolutionIndex: 60
    SolutionNameMin: Cijk_Ailk_Bljk_B8F8NBS_BH_Bias_HAS_SAV_UserArgs_MT128x64x128_MI16x16x1_SN_LDSB1_CLR1_GRVWA16_GRVWB16_GSU0_GSUC0_GSUWGMRR0_K1_LBSPPA1024_LBSPPB256_LPA64_LPB16_LRVW8_MIWT4_2_PLR1_SU0_SUM0_SUS128_VWA4_VWB2_WGM6_WGMXCC1_WGMXCCGn1
    SolutionIndex: 61
    SolutionNameMin: Cijk_Ailk_Bljk_B8F8NBS_BH_Bias_HAS_SAV_UserArgs_MT128x64x128_MI16x16x1_SN_LDSB1_CLR1_GRVWA16_GRVWB16_GSU0_GSUC0_GSUWGMRR0_K1_LBSPPA1024_LBSPPB256_LPA64_LPB16_LRVW8_MIWT4_2_PLR1_SU0_SUM0_SUS128_VWA4_VWB2_WGM8_WGMXCC1_WGMXCCGn1
    SolutionIndex: 62
    SolutionNameMin: Cijk_Ailk_Bljk_B8F8NBS_BH_Bias_HAS_SAV_UserArgs_MT64x64x128_MI16x16x1_SN_LDSB1_CLR1_GRVWA16_GRVWB8_GSU0_GSUC0_GSUWGMRR0_K1_LBSPPA512_LBSPPB256_LPA32_LPB8_LRVW8_MIWT2_2_PLR1_SU0_SUM0_SUS128_VWA2_VWB2_WGM1_WGMXCC1_WGMXCCGn1
    SolutionIndex: 63
    SolutionNameMin: Cijk_Ailk_Bljk_B8F8NBS_BH_Bias_HAS_SAV_UserArgs_MT64x64x128_MI16x16x1_SN_LDSB1_CLR1_GRVWA8_GRVWB16_GSU0_GSUC0_GSUWGMRR0_K1_LBSPPA512_LBSPPB256_LPA32_LPB16_LRVW8_MIWT2_2_PLR1_SU0_SUM0_SUS128_VWA2_VWB2_WGM1_WGMXCC1_WGMXCCGn1
    SolutionIndex: 64
    SolutionNameMin: Cijk_Ailk_Bljk_B8F8NBS_BH_Bias_HAS_SAV_UserArgs_MT64x64x128_MI16x16x1_SN_LDSB1_CLR1_GRVWA16_GRVWB16_GSU0_GSUC0_GSUWGMRR0_K1_LBSPPA512_LBSPPB256_LPA32_LPB16_LRVW8_MIWT2_2_PLR1_SU0_SUM0_SUS128_VWA2_VWB2_WGM1_WGMXCC1_WGMXCCGn1
    SolutionIndex: 65
    SolutionNameMin: Cijk_Ailk_Bljk_B8F8NBS_BH_Bias_HAS_SAV_UserArgs_MT64x64x128_MI16x16x1_SN_LDSB1_CLR1_GRVWA16_GRVWB8_GSU0_GSUC0_GSUWGMRR0_K1_LBSPPA512_LBSPPB256_LPA32_LPB8_LRVW8_MIWT2_2_PLR1_SU0_SUM0_SUS128_VWA2_VWB2_WGM4_WGMXCC1_WGMXCCGn1
    SolutionIndex: 66
    SolutionNameMin: Cijk_Ailk_Bljk_B8F8NBS_BH_Bias_HAS_SAV_UserArgs_MT64x64x128_MI16x16x1_SN_LDSB1_CLR1_GRVWA8_GRVWB16_GSU0_GSUC0_GSUWGMRR0_K1_LBSPPA512_LBSPPB256_LPA32_LPB16_LRVW8_MIWT2_2_PLR1_SU0_SUM0_SUS128_VWA2_VWB2_WGM4_WGMXCC1_WGMXCCGn1
    SolutionIndex: 67
    SolutionNameMin: Cijk_Ailk_Bljk_B8F8NBS_BH_Bias_HAS_SAV_UserArgs_MT64x64x128_MI16x16x1_SN_LDSB1_CLR1_GRVWA16_GRVWB16_GSU0_GSUC0_GSUWGMRR0_K1_LBSPPA512_LBSPPB256_LPA32_LPB16_LRVW8_MIWT2_2_PLR1_SU0_SUM0_SUS128_VWA2_VWB2_WGM4_WGMXCC1_WGMXCCGn1
    SolutionIndex: 68
    SolutionNameMin: Cijk_Ailk_Bljk_B8F8NBS_BH_Bias_HAS_SAV_UserArgs_MT64x64x128_MI16x16x1_SN_LDSB1_CLR1_GRVWA16_GRVWB16_GSU0_GSUC0_GSUWGMRR0_K1_LBSPPA512_LBSPPB256_LPA32_LPB16_LRVW8_MIWT2_2_PLR1_SU0_SUM0_SUS128_VWA2_VWB2_WGM6_WGMXCC1_WGMXCCGn1
    SolutionIndex: 69
    SolutionNameMin: Cijk_Ailk_Bljk_B8F8NBS_BH_Bias_HAS_SAV_UserArgs_MT64x64x128_MI16x16x1_SN_LDSB1_CLR1_GRVWA16_GRVWB16_GSU0_GSUC0_GSUWGMRR0_K1_LBSPPA512_LBSPPB256_LPA32_LPB16_LRVW8_MIWT2_2_PLR1_SU0_SUM0_SUS128_VWA2_VWB2_WGM8_WGMXCC1_WGMXCCGn1
    SolutionIndex: 70
    SolutionNameMin: Cijk_Ailk_Bljk_B8F8NBS_BH_Bias_HAS_SAV_UserArgs_MT32x64x128_MI16x16x1_SN_LDSB0_CLR1_GRVWA8_GRVWB16_GSU0_GSUC0_GSUWGMRR0_K1_LBSPPA256_LBSPPB256_LPA16_LPB16_LRVW8_MIWT1_2_PLR1_SU0_SUM0_SUS128_VWA1_VWB2_WGM1_WGMXCC1_WGMXCCGn1
    SolutionIndex: 71
    SolutionNameMin: Cijk_Ailk_Bljk_B8F8NBS_BH_Bias_HAS_SAV_UserArgs_MT32x64x128_MI16x16x1_SN_LDSB0_CLR1_GRVWA8_GRVWB16_GSU0_GSUC0_GSUWGMRR0_K1_LBSPPA256_LBSPPB256_LPA16_LPB16_LRVW8_MIWT1_2_PLR1_SU0_SUM0_SUS128_VWA1_VWB2_WGM4_WGMXCC1_WGMXCCGn1
    SolutionIndex: 72
    SolutionNameMin: Cijk_Ailk_Bljk_B8F8NBS_BH_Bias_HAS_SAV_UserArgs_MT32x64x128_MI16x16x1_SN_LDSB0_CLR1_GRVWA16_GRVWB16_GSU0_GSUC0_GSUWGMRR0_K1_LBSPPA256_LBSPPB256_LPA16_LPB16_LRVW8_MIWT1_2_PLR1_SU0_SUM0_SUS128_VWA1_VWB2_WGM8_WGMXCC1_WGMXCCGn1
    SolutionIndex: 73
    SolutionNameMin: Cijk_Ailk_Bljk_B8F8NBS_BH_Bias_HAS_SAV_UserArgs_MT64x32x128_MI16x16x1_SN_LDSB0_CLR1_GRVWA8_GRVWB8_GSU0_GSUC0_GSUWGMRR0_K1_LBSPPA512_LBSPPB128_LPA32_LPB8_LRVW8_MIWT2_1_PLR1_SU0_SUM0_SUS128_VWA2_VWB1_WGM1_WGMXCC1_WGMXCCGn1
    SolutionIndex: 74
    SolutionNameMin: Cijk_Ailk_Bljk_B8F8NBS_BH_Bias_HAS_SAV_UserArgs_MT64x32x128_MI16x16x1_SN_LDSB0_CLR1_GRVWA8_GRVWB16_GSU0_GSUC0_GSUWGMRR0_K1_LBSPPA512_LBSPPB128_LPA32_LPB16_LRVW8_MIWT2_1_PLR1_SU0_SUM0_SUS128_VWA2_VWB1_WGM1_WGMXCC1_WGMXCCGn1
    SolutionIndex: 75
    SolutionNameMin: Cijk_Ailk_Bljk_B8F8NBS_BH_Bias_HAS_SAV_UserArgs_MT64x32x128_MI16x16x1_SN_LDSB0_CLR1_GRVWA16_GRVWB16_GSU0_GSUC0_GSUWGMRR0_K1_LBSPPA512_LBSPPB128_LPA32_LPB16_LRVW8_MIWT2_1_PLR1_SU0_SUM0_SUS128_VWA2_VWB1_WGM1_WGMXCC1_WGMXCCGn1
    SolutionIndex: 76
    SolutionNameMin: Cijk_Ailk_Bljk_B8F8NBS_BH_Bias_HAS_SAV_UserArgs_MT32x32x128_MI16x16x1_SN_LDSB0_CLR1_GRVWA8_GRVWB8_GSU0_GSUC0_GSUWGMRR0_K1_LBSPPA256_LBSPPB128_LPA16_LPB8_LRVW8_MIWT1_1_PLR1_SU0_SUM0_SUS128_VWA1_VWB1_WGM1_WGMXCC1_WGMXCCGn1
    SolutionIndex: 77
    SolutionNameMin: Cijk_Ailk_Bljk_B8F8NBS_BH_Bias_HAS_SAV_UserArgs_MT32x32x128_MI16x16x1_SN_LDSB0_CLR1_GRVWA16_GRVWB8_GSU0_GSUC0_GSUWGMRR0_K1_LBSPPA256_LBSPPB128_LPA16_LPB8_LRVW8_MIWT1_1_PLR1_SU0_SUM0_SUS128_VWA1_VWB1_WGM1_WGMXCC1_WGMXCCGn1
    SolutionIndex: 78
    SolutionNameMin: Cijk_Ailk_Bljk_B8F8NBS_BH_Bias_HAS_SAV_UserArgs_MT32x32x128_MI16x16x1_SN_LDSB0_CLR1_GRVWA8_GRVWB16_GSU0_GSUC0_GSUWGMRR0_K1_LBSPPA256_LBSPPB128_LPA16_LPB16_LRVW8_MIWT1_1_PLR1_SU0_SUM0_SUS128_VWA1_VWB1_WGM1_WGMXCC1_WGMXCCGn1
    SolutionIndex: 79
    SolutionNameMin: Cijk_Ailk_Bljk_B8F8NBS_BH_Bias_HAS_SAV_UserArgs_MT32x32x128_MI16x16x1_SN_LDSB0_CLR1_GRVWA16_GRVWB16_GSU0_GSUC0_GSUWGMRR0_K1_LBSPPA256_LBSPPB128_LPA16_LPB16_LRVW8_MIWT1_1_PLR1_SU0_SUM0_SUS128_VWA1_VWB1_WGM1_WGMXCC1_WGMXCCGn1
    SolutionIndex: 80
    SolutionNameMin: Cijk_Ailk_Bljk_B8F8NBS_BH_Bias_HAS_SAV_UserArgs_MT64x128x256_MI16x16x1_SN_LDSB1_CLR1_GRVWA16_GRVWB16_GSU0_GSUC0_GSUWGMRR0_K1_LBSPPA512_LBSPPB1024_LPA32_LPB16_LRVW8_MIWT2_4_PLR1_SU0_SUM0_SUS256_VWA2_VWB4_WGM1_WGMXCC1_WGMXCCGn1
    SolutionIndex: 81
    SolutionNameMin: Cijk_Ailk_Bljk_B8F8NBS_BH_Bias_HAS_SAV_UserArgs_MT64x64x256_MI16x16x1_SN_LDSB1_CLR1_GRVWA16_GRVWB16_GSU0_GSUC0_GSUWGMRR0_K1_LBSPPA512_LBSPPB512_LPA32_LPB16_LRVW8_MIWT2_2_PLR1_SU0_SUM0_SUS256_VWA2_VWB2_WGM1_WGMXCC1_WGMXCCGn1
    SolutionIndex: 82
    SolutionNameMin: Cijk_Ailk_Bljk_B8F8NBS_BH_Bias_HAS_SAV_UserArgs_MT64x32x256_MI16x16x1_SN_LDSB1_CLR1_GRVWA8_GRVWB16_GSU0_GSUC0_GSUWGMRR0_K1_LBSPPA512_LBSPPB256_LPA32_LPB16_LRVW8_MIWT2_1_PLR1_SU0_SUM0_SUS256_VWA2_VWB1_WGM1_WGMXCC1_WGMXCCGn1
    SolutionIndex: 83
    SolutionNameMin: Cijk_Ailk_Bljk_B8F8NBS_BH_Bias_HAS_SAV_UserArgs_MT64x32x256_MI16x16x1_SN_LDSB1_CLR1_GRVWA16_GRVWB16_GSU0_GSUC0_GSUWGMRR0_K1_LBSPPA512_LBSPPB256_LPA32_LPB16_LRVW8_MIWT2_1_PLR1_SU0_SUM0_SUS256_VWA2_VWB1_WGM1_WGMXCC1_WGMXCCGn1
    SolutionIndex: 84
    SolutionNameMin: Cijk_Ailk_Bljk_B8F8NBS_BH_Bias_HAS_SAV_UserArgs_MT64x32x256_MI16x16x1_SN_LDSB1_CLR1_GRVWA16_GRVWB16_GSU0_GSUC0_GSUWGMRR0_K1_LBSPPA512_LBSPPB256_LPA32_LPB16_LRVW8_MIWT2_1_PLR1_SU0_SUM0_SUS256_VWA2_VWB1_WGM6_WGMXCC1_WGMXCCGn1
    SolutionIndex: 85
    SolutionNameMin: Cijk_Ailk_Bljk_B8F8NBS_BH_Bias_HAS_SAV_UserArgs_MT64x32x256_MI16x16x1_SN_LDSB1_CLR1_GRVWA16_GRVWB16_GSU0_GSUC0_GSUWGMRR0_K1_LBSPPA512_LBSPPB256_LPA32_LPB16_LRVW8_MIWT2_1_PLR1_SU0_SUM0_SUS256_VWA2_VWB1_WGM8_WGMXCC1_WGMXCCGn1
    SolutionIndex: 86
    SolutionNameMin: Cijk_Ailk_Bljk_B8F8NBS_BH_Bias_HAS_SAV_UserArgs_MT32x32x256_MI16x16x1_SN_LDSB1_CLR1_GRVWA8_GRVWB8_GSU0_GSUC0_GSUWGMRR0_K1_LBSPPA256_LBSPPB256_LPA16_LPB8_LRVW8_MIWT1_1_PLR1_SU0_SUM0_SUS256_VWA1_VWB1_WGM1_WGMXCC1_WGMXCCGn1
    SolutionIndex: 87
    SolutionNameMin: Cijk_Ailk_Bljk_B8F8NBS_BH_Bias_HAS_SAV_UserArgs_MT32x32x256_MI16x16x1_SN_LDSB1_CLR1_GRVWA16_GRVWB16_GSU0_GSUC0_GSUWGMRR0_K1_LBSPPA256_LBSPPB256_LPA16_LPB16_LRVW8_MIWT1_1_PLR1_SU0_SUM0_SUS256_VWA1_VWB1_WGM4_WGMXCC1_WGMXCCGn1
    SolutionIndex: 88
    SolutionNameMin: Cijk_Ailk_Bljk_B8F8NBS_BH_Bias_HAS_SAV_UserArgs_MT32x32x256_MI16x16x1_SN_LDSB1_CLR1_GRVWA16_GRVWB16_GSU0_GSUC0_GSUWGMRR0_K1_LBSPPA256_LBSPPB256_LPA16_LPB16_LRVW8_MIWT1_1_PLR1_SU0_SUM0_SUS256_VWA1_VWB1_WGM6_WGMXCC1_WGMXCCGn1
    SolutionIndex: 89
    SolutionNameMin: Cijk_Ailk_Bljk_B8F8NBS_BH_Bias_HAS_SAV_UserArgs_MT32x32x256_MI16x16x1_SN_LDSB1_CLR1_GRVWA16_GRVWB16_GSU0_GSUC0_GSUWGMRR0_K1_LBSPPA256_LBSPPB256_LPA16_LPB16_LRVW8_MIWT1_1_PLR1_SU0_SUM0_SUS256_VWA1_VWB1_WGM8_WGMXCC1_WGMXCCGn1
- - - [128, 128, 1, 128, 128, 128, 128, 128]
    - [32, 0.54]
  - - [128, 128, 1, 256, 128, 128, 128, 256]
    - [76, 1.01]
  - - [128, 128, 1, 512, 128, 128, 128, 512]
    - [78, 1.74]
  - - [128, 128, 1, 1024, 128, 128, 128, 1024]
    - [76, 2.76]
  - - [128, 128, 1, 2048, 128, 128, 128, 2048]
    - [76, 3.84]
  - - [128, 128, 1, 4096, 128, 128, 128, 4096]
    - [76, 4.8]
  - - [128, 128, 1, 8192, 128, 128, 128, 8192]
    - [76, 5.49]
  - - [128, 256, 1, 128, 128, 128, 128, 128]
    - [32, 1.14]
  - - [128, 256, 1, 256, 128, 128, 128, 256]
    - [76, 2.07]
  - - [128, 256, 1, 512, 128, 128, 128, 512]
    - [78, 3.52]
  - - [128, 256, 1, 1024, 128, 128, 128, 1024]
    - [79, 5.55]
  - - [128, 256, 1, 2048, 128, 128, 128, 2048]
    - [76, 7.73]
  - - [128, 256, 1, 4096, 128, 128, 128, 4096]
    - [76, 9.68]
  - - [128, 256, 1, 8192, 128, 128, 128, 8192]
    - [76, 11.0]
  - - [128, 512, 1, 128, 128, 128, 128, 128]
    - [78, 2.23]
  - - [128, 512, 1, 256, 128, 128, 128, 256]
    - [76, 4.04]
  - - [128, 512, 1, 512, 128, 128, 128, 512]
    - [76, 6.97]
  - - [128, 512, 1, 1024, 128, 128, 128, 1024]
    - [76, 10.98]
  - - [128, 512, 1, 2048, 128, 128, 128, 2048]
    - [76, 15.45]
  - - [128, 512, 1, 4096, 128, 128, 128, 4096]
    - [76, 19.18]
  - - [128, 512, 1, 8192, 128, 128, 128, 8192]
    - [76, 21.8]
  - - [128, 1024, 1, 128, 128, 128, 128, 128]
    - [32, 4.43]
  - - [128, 1024, 1, 256, 128, 128, 128, 256]
    - [76, 7.97]
  - - [128, 1024, 1, 512, 128, 128, 128, 512]
    - [76, 13.56]
  - - [128, 1024, 1, 1024, 128, 128, 128, 1024]
    - [76, 21.44]
  - - [128, 1024, 1, 2048, 128, 128, 128, 2048]
    - [76, 30.1]
  - - [128, 1024, 1, 4096, 128, 128, 128, 4096]
    - [76, 37.65]
  - - [128, 1024, 1, 8192, 128, 128, 128, 8192]
    - [76, 42.95]
  - - [128, 2048, 1, 128, 128, 128, 128, 128]
    - [31, 8.09]
  - - [128, 2048, 1, 256, 128, 128, 128, 256]
    - [75, 14.56]
  - - [128, 2048, 1, 512, 128, 128, 128, 512]
    - [74, 24.37]
  - - [128, 2048, 1, 1024, 128, 128, 128, 1024]
    - [70, 37.18]
  - - [128, 2048, 1, 2048, 128, 128, 128, 2048]
    - [83, 51.16]
  - - [128, 2048, 1, 4096, 128, 128, 128, 4096]
    - [83, 63.43]
  - - [128, 2048, 1, 8192, 128, 128, 128, 8192]
    - [83, 72.0]
  - - [128, 4096, 1, 128, 128, 128, 128, 128]
    - [29, 14.51]
  - - [128, 4096, 1, 256, 128, 128, 128, 256]
    - [28, 25.48]
  - - [128, 4096, 1, 512, 128, 128, 128, 512]
    - [28, 41.78]
  - - [128, 4096, 1, 1024, 128, 128, 128, 1024]
    - [62, 62.85]
  - - [128, 4096, 1, 2048, 128, 128, 128, 2048]
    - [81, 83.51]
  - - [128, 4096, 1, 4096, 128, 128, 128, 4096]
    - [81, 101.61]
  - - [128, 4096, 1, 8192, 128, 128, 128, 8192]
    - [81, 112.35]
  - - [128, 8192, 1, 128, 128, 128, 128, 128]
    - [27, 23.82]
  - - [128, 8192, 1, 256, 128, 128, 128, 256]
    - [27, 41.98]
  - - [128, 8192, 1, 512, 128, 128, 128, 512]
    - [24, 68.37]
  - - [128, 8192, 1, 1024, 128, 128, 128, 1024]
    - [23, 99.77]
  - - [128, 8192, 1, 2048, 128, 128, 128, 2048]
    - [23, 130.36]
  - - [128, 8192, 1, 4096, 128, 128, 128, 4096]
    - [57, 141.9]
  - - [128, 8192, 1, 8192, 128, 128, 128, 8192]
    - [80, 151.46]
  - - [256, 128, 1, 128, 256, 256, 256, 128]
    - [79, 1.04]
  - - [256, 128, 1, 256, 256, 256, 256, 256]
    - [86, 1.99]
  - - [256, 128, 1, 512, 256, 256, 256, 512]
    - [79, 3.38]
  - - [256, 128, 1, 1024, 256, 256, 256, 1024]
    - [78, 5.47]
  - - [256, 128, 1, 2048, 256, 256, 256, 2048]
    - [76, 7.67]
  - - [256, 128, 1, 4096, 256, 256, 256, 4096]
    - [76, 9.62]
  - - [256, 128, 1, 8192, 256, 256, 256, 8192]
    - [76, 10.9]
  - - [256, 256, 1, 128, 256, 256, 256, 128]
    - [77, 2.09]
  - - [256, 256, 1, 256, 256, 256, 256, 256]
    - [77, 3.94]
  - - [256, 256, 1, 512, 256, 256, 256, 512]
    - [78, 6.88]
  - - [256, 256, 1, 1024, 256, 256, 256, 1024]
    - [76, 10.86]
  - - [256, 256, 1, 2048, 256, 256, 256, 2048]
    - [76, 15.14]
  - - [256, 256, 1, 4096, 256, 256, 256, 4096]
    - [76, 19.08]
  - - [256, 256, 1, 8192, 256, 256, 256, 8192]
    - [79, 21.63]
  - - [256, 512, 1, 128, 256, 256, 256, 128]
    - [73, 4.05]
  - - [256, 512, 1, 256, 256, 256, 256, 256]
    - [33, 7.51]
  - - [256, 512, 1, 512, 256, 256, 256, 512]
    - [78, 13.43]
  - - [256, 512, 1, 1024, 256, 256, 256, 1024]
    - [76, 21.01]
  - - [256, 512, 1, 2048, 256, 256, 256, 2048]
    - [76, 30.02]
  - - [256, 512, 1, 4096, 256, 256, 256, 4096]
    - [76, 37.77]
  - - [256, 512, 1, 8192, 256, 256, 256, 8192]
    - [76, 43.07]
  - - [256, 1024, 1, 128, 256, 256, 256, 128]
    - [73, 8.11]
  - - [256, 1024, 1, 256, 256, 256, 256, 256]
    - [75, 14.52]
  - - [256, 1024, 1, 512, 256, 256, 256, 512]
    - [70, 24.6]
  - - [256, 1024, 1, 1024, 256, 256, 256, 1024]
    - [70, 37.23]
  - - [256, 1024, 1, 2048, 256, 256, 256, 2048]
    - [83, 51.66]
  - - [256, 1024, 1, 4096, 256, 256, 256, 4096]
    - [83, 63.74]
  - - [256, 1024, 1, 8192, 256, 256, 256, 8192]
    - [83, 72.32]
  - - [256, 2048, 1, 128, 256, 256, 256, 128]
    - [29, 14.45]
  - - [256, 2048, 1, 256, 256, 256, 256, 256]
    - [28, 25.84]
  - - [256, 2048, 1, 512, 256, 256, 256, 512]
    - [28, 42.1]
  - - [256, 2048, 1, 1024, 256, 256, 256, 1024]
    - [62, 62.55]
  - - [256, 2048, 1, 2048, 256, 256, 256, 2048]
    - [81, 84.29]
  - - [256, 2048, 1, 4096, 256, 256, 256, 4096]
    - [81, 101.96]
  - - [256, 2048, 1, 8192, 256, 256, 256, 8192]
    - [65, 109.63]
  - - [256, 4096, 1, 128, 256, 256, 256, 128]
    - [22, 24.19]
  - - [256, 4096, 1, 256, 256, 256, 256, 256]
    - [24, 42.95]
  - - [256, 4096, 1, 512, 256, 256, 256, 512]
    - [24, 68.8]
  - - [256, 4096, 1, 1024, 256, 256, 256, 1024]
    - [23, 101.14]
  - - [256, 4096, 1, 2048, 256, 256, 256, 2048]
    - [23, 131.8]
  - - [256, 4096, 1, 4096, 256, 256, 256, 4096]
    - [57, 144.98]
  - - [256, 4096, 1, 8192, 256, 256, 256, 8192]
    - [57, 154.23]
  - - [256, 8192, 1, 128, 256, 256, 256, 128]
    - [48, 36.71]
  - - [256, 8192, 1, 256, 256, 256, 256, 256]
    - [48, 63.14]
  - - [256, 8192, 1, 512, 256, 256, 256, 512]
    - [53, 101.9]
  - - [256, 8192, 1, 1024, 256, 256, 256, 1024]
    - [53, 150.05]
  - - [256, 8192, 1, 2048, 256, 256, 256, 2048]
    - [53, 190.68]
  - - [256, 8192, 1, 4096, 256, 256, 256, 4096]
    - [53, 220.47]
  - - [256, 8192, 1, 8192, 256, 256, 256, 8192]
    - [53, 207.74]
  - - [512, 128, 1, 128, 512, 512, 512, 128]
    - [78, 2.21]
  - - [512, 128, 1, 256, 512, 512, 512, 256]
    - [76, 4.01]
  - - [512, 128, 1, 512, 512, 512, 512, 512]
    - [78, 6.99]
  - - [512, 128, 1, 1024, 512, 512, 512, 1024]
    - [76, 11.09]
  - - [512, 128, 1, 2048, 512, 512, 512, 2048]
    - [76, 15.23]
  - - [512, 128, 1, 4096, 512, 512, 512, 4096]
    - [76, 19.18]
  - - [512, 128, 1, 8192, 512, 512, 512, 8192]
    - [87, 17.27]
  - - [512, 256, 1, 128, 512, 512, 512, 128]
    - [32, 4.38]
  - - [512, 256, 1, 256, 512, 512, 512, 256]
    - [76, 7.95]
  - - [512, 256, 1, 512, 512, 512, 512, 512]
    - [76, 13.51]
  - - [512, 256, 1, 1024, 512, 512, 512, 1024]
    - [76, 21.41]
  - - [512, 256, 1, 2048, 512, 512, 512, 2048]
    - [76, 29.97]
  - - [512, 256, 1, 4096, 512, 512, 512, 4096]
    - [76, 37.41]
  - - [512, 256, 1, 8192, 512, 512, 512, 8192]
    - [87, 36.69]
  - - [512, 512, 1, 128, 512, 512, 512, 128]
    - [74, 8.1]
  - - [512, 512, 1, 256, 512, 512, 512, 256]
    - [74, 14.45]
  - - [512, 512, 1, 512, 512, 512, 512, 512]
    - [74, 24.42]
  - - [512, 512, 1, 1024, 512, 512, 512, 1024]
    - [74, 37.7]
  - - [512, 512, 1, 2048, 512, 512, 512, 2048]
    - [83, 51.4]
  - - [512, 512, 1, 4096, 512, 512, 512, 4096]
    - [83, 63.52]
  - - [512, 512, 1, 8192, 512, 512, 512, 8192]
    - [75, 62.32]
  - - [512, 1024, 1, 128, 512, 512, 512, 128]
    - [29, 14.45]
  - - [512, 1024, 1, 256, 512, 512, 512, 256]
    - [28, 25.77]
  - - [512, 1024, 1, 512, 512, 512, 512, 512]
    - [62, 41.68]
  - - [512, 1024, 1, 1024, 512, 512, 512, 1024]
    - [62, 62.35]
  - - [512, 1024, 1, 2048, 512, 512, 512, 2048]
    - [62, 83.29]
  - - [512, 1024, 1, 4096, 512, 512, 512, 4096]
    - [62, 99.38]
  - - [512, 1024, 1, 8192, 512, 512, 512, 8192]
    - [64, 103.32]
  - - [512, 2048, 1, 128, 512, 512, 512, 128]
    - [24, 23.99]
  - - [512, 2048, 1, 256, 512, 512, 512, 256]
    - [24, 42.87]
  - - [512, 2048, 1, 512, 512, 512, 512, 512]
    - [24, 68.21]
  - - [512, 2048, 1, 1024, 512, 512, 512, 1024]
    - [23, 99.66]
  - - [512, 2048, 1, 2048, 512, 512, 512, 2048]
    - [23, 130.68]
  - - [512, 2048, 1, 4096, 512, 512, 512, 4096]
    - [58, 139.51]
  - - [512, 2048, 1, 8192, 512, 512, 512, 8192]
    - [58, 146.05]
  - - [512, 4096, 1, 128, 512, 512, 512, 128]
    - [20, 36.63]
  - - [512, 4096, 1, 256, 512, 512, 512, 256]
    - [48, 62.98]
  - - [512, 4096, 1, 512, 512, 512, 512, 512]
    - [53, 103.17]
  - - [512, 4096, 1, 1024, 512, 512, 512, 1024]
    - [53, 148.79]
  - - [512, 4096, 1, 2048, 512, 512, 512, 2048]
    - [53, 193.5]
  - - [512, 4096, 1, 4096, 512, 512, 512, 4096]
    - [53, 204.43]
  - - [512, 4096, 1, 8192, 512, 512, 512, 8192]
    - [56, 198.86]
  - - [512, 8192, 1, 128, 512, 512, 512, 128]
    - [51, 55.05]
  - - [512, 8192, 1, 256, 512, 512, 512, 256]
    - [52, 96.61]
  - - [512, 8192, 1, 512, 512, 512, 512, 512]
    - [52, 157.84]
  - - [512, 8192, 1, 1024, 512, 512, 512, 1024]
    - [52, 210.15]
  - - [512, 8192, 1, 2048, 512, 512, 512, 2048]
    - [52, 234.02]
  - - [512, 8192, 1, 4096, 512, 512, 512, 4096]
    - [43, 257.14]
  - - [512, 8192, 1, 8192, 512, 512, 512, 8192]
    - [52, 248.57]
  - - [1024, 128, 1, 128, 1024, 1024, 1024, 128]
    - [32, 4.29]
  - - [1024, 128, 1, 256, 1024, 1024, 1024, 256]
    - [76, 7.81]
  - - [1024, 128, 1, 512, 1024, 1024, 1024, 512]
    - [78, 13.37]
  - - [1024, 128, 1, 1024, 1024, 1024, 1024, 1024]
    - [76, 20.98]
  - - [1024, 128, 1, 2048, 1024, 1024, 1024, 2048]
    - [76, 29.66]
  - - [1024, 128, 1, 4096, 1024, 1024, 1024, 4096]
    - [88, 31.93]
  - - [1024, 128, 1, 8192, 1024, 1024, 1024, 8192]
    - [89, 30.32]
  - - [1024, 256, 1, 128, 1024, 1024, 1024, 128]
    - [73, 7.95]
  - - [1024, 256, 1, 256, 1024, 1024, 1024, 256]
    - [82, 13.95]
  - - [1024, 256, 1, 512, 1024, 1024, 1024, 512]
    - [73, 23.94]
  - - [1024, 256, 1, 1024, 1024, 1024, 1024, 1024]
    - [74, 36.8]
  - - [1024, 256, 1, 2048, 1024, 1024, 1024, 2048]
    - [83, 51.02]
  - - [1024, 256, 1, 4096, 1024, 1024, 1024, 4096]
    - [71, 55.46]
  - - [1024, 256, 1, 8192, 1024, 1024, 1024, 8192]
    - [85, 58.59]
  - - [1024, 512, 1, 128, 1024, 1024, 1024, 128]
    - [28, 14.13]
  - - [1024, 512, 1, 256, 1024, 1024, 1024, 256]
    - [29, 24.95]
  - - [1024, 512, 1, 512, 1024, 1024, 1024, 512]
    - [28, 41.21]
  - - [1024, 512, 1, 1024, 1024, 1024, 1024, 1024]
    - [62, 61.79]
  - - [1024, 512, 1, 2048, 1024, 1024, 1024, 2048]
    - [62, 82.41]
  - - [1024, 512, 1, 4096, 1024, 1024, 1024, 4096]
    - [67, 93.21]
  - - [1024, 512, 1, 8192, 1024, 1024, 1024, 8192]
    - [69, 102.17]
  - - [1024, 1024, 1, 128, 1024, 1024, 1024, 128]
    - [24, 23.69]
  - - [1024, 1024, 1, 256, 1024, 1024, 1024, 256]
    - [24, 42.44]
  - - [1024, 1024, 1, 512, 1024, 1024, 1024, 512]
    - [24, 68.17]
  - - [1024, 1024, 1, 1024, 1024, 1024, 1024, 1024]
    - [23, 100.02]
  - - [1024, 1024, 1, 2048, 1024, 1024, 1024, 2048]
    - [23, 130.37]
  - - [1024, 1024, 1, 4096, 1024, 1024, 1024, 4096]
    - [59, 138.49]
  - - [1024, 1024, 1, 8192, 1024, 1024, 1024, 8192]
    - [59, 144.79]
  - - [1024, 2048, 1, 128, 1024, 1024, 1024, 128]
    - [19, 36.56]
  - - [1024, 2048, 1, 256, 1024, 1024, 1024, 256]
    - [19, 63.18]
  - - [1024, 2048, 1, 512, 1024, 1024, 1024, 512]
    - [53, 102.34]
  - - [1024, 2048, 1, 1024, 1024, 1024, 1024, 1024]
    - [53, 149.13]
  - - [1024, 2048, 1, 2048, 1024, 1024, 1024, 2048]
    - [53, 186.47]
  - - [1024, 2048, 1, 4096, 1024, 1024, 1024, 4096]
    - [55, 204.06]
  - - [1024, 2048, 1, 8192, 1024, 1024, 1024, 8192]
    - [56, 199.12]
  - - [1024, 4096, 1, 128, 1024, 1024, 1024, 128]
    - [17, 52.98]
  - - [1024, 4096, 1, 256, 1024, 1024, 1024, 256]
    - [17, 91.38]
  - - [1024, 4096, 1, 512, 1024, 1024, 1024, 512]
    - [16, 139.26]
  - - [1024, 4096, 1, 1024, 1024, 1024, 1024, 1024]
    - [14, 193.4]
  - - [1024, 4096, 1, 2048, 1024, 1024, 1024, 2048]
    - [13, 236.59]
  - - [1024, 4096, 1, 4096, 1024, 1024, 1024, 4096]
    - [44, 253.9]
  - - [1024, 4096, 1, 8192, 1024, 1024, 1024, 8192]
    - [40, 241.37]
  - - [1024, 8192, 1, 128, 1024, 1024, 1024, 128]
    - [43, 71.34]
  - - [1024, 8192, 1, 256, 1024, 1024, 1024, 256]
    - [43, 124.42]
  - - [1024, 8192, 1, 512, 1024, 1024, 1024, 512]
    - [40, 192.82]
  - - [1024, 8192, 1, 1024, 1024, 1024, 1024, 1024]
    - [40, 232.98]
  - - [1024, 8192, 1, 2048, 1024, 1024, 1024, 2048]
    - [39, 302.96]
  - - [1024, 8192, 1, 4096, 1024, 1024, 1024, 4096]
    - [42, 341.67]
  - - [1024, 8192, 1, 8192, 1024, 1024, 1024, 8192]
    - [40, 364.47]
  - - [2048, 128, 1, 128, 2048, 2048, 2048, 128]
    - [70, 7.63]
  - - [2048, 128, 1, 256, 2048, 2048, 2048, 256]
    - [74, 14.05]
  - - [2048, 128, 1, 512, 2048, 2048, 2048, 512]
    - [74, 23.77]
  - - [2048, 128, 1, 1024, 2048, 2048, 2048, 1024]
    - [74, 36.75]
  - - [2048, 128, 1, 2048, 2048, 2048, 2048, 2048]
    - [72, 42.8]
  - - [2048, 128, 1, 4096, 2048, 2048, 2048, 4096]
    - [85, 52.02]
  - - [2048, 128, 1, 8192, 2048, 2048, 2048, 8192]
    - [84, 58.82]
  - - [2048, 256, 1, 128, 2048, 2048, 2048, 128]
    - [29, 13.84]
  - - [2048, 256, 1, 256, 2048, 2048, 2048, 256]
    - [29, 24.38]
  - - [2048, 256, 1, 512, 2048, 2048, 2048, 512]
    - [66, 40.59]
  - - [2048, 256, 1, 1024, 2048, 2048, 2048, 1024]
    - [66, 60.54]
  - - [2048, 256, 1, 2048, 2048, 2048, 2048, 2048]
    - [69, 76.94]
  - - [2048, 256, 1, 4096, 2048, 2048, 2048, 4096]
    - [68, 92.66]
  - - [2048, 256, 1, 8192, 2048, 2048, 2048, 8192]
    - [67, 103.29]
  - - [2048, 512, 1, 128, 2048, 2048, 2048, 128]
    - [24, 24.26]
  - - [2048, 512, 1, 256, 2048, 2048, 2048, 256]
    - [24, 42.53]
  - - [2048, 512, 1, 512, 2048, 2048, 2048, 512]
    - [23, 68.71]
  - - [2048, 512, 1, 1024, 2048, 2048, 2048, 1024]
    - [23, 100.93]
  - - [2048, 512, 1, 2048, 2048, 2048, 2048, 2048]
    - [61, 118.54]
  - - [2048, 512, 1, 4096, 2048, 2048, 2048, 4096]
    - [60, 139.05]
  - - [2048, 512, 1, 8192, 2048, 2048, 2048, 8192]
    - [59, 146.34]
  - - [2048, 1024, 1, 128, 2048, 2048, 2048, 128]
    - [20, 37.13]
  - - [2048, 1024, 1, 256, 2048, 2048, 2048, 256]
    - [19, 63.57]
  - - [2048, 1024, 1, 512, 2048, 2048, 2048, 512]
    - [53, 101.98]
  - - [2048, 1024, 1, 1024, 2048, 2048, 2048, 1024]
    - [53, 149.82]
  - - [2048, 1024, 1, 2048, 2048, 2048, 2048, 2048]
    - [56, 175.82]
  - - [2048, 1024, 1, 4096, 2048, 2048, 2048, 4096]
    - [49, 200.48]
  - - [2048, 1024, 1, 8192, 2048, 2048, 2048, 8192]
    - [55, 196.75]
  - - [2048, 2048, 1, 128, 2048, 2048, 2048, 128]
    - [13, 52.07]
  - - [2048, 2048, 1, 256, 2048, 2048, 2048, 256]
    - [13, 89.2]
  - - [2048, 2048, 1, 512, 2048, 2048, 2048, 512]
    - [13, 139.7]
  - - [2048, 2048, 1, 1024, 2048, 2048, 2048, 1024]
    - [12, 190.38]
  - - [2048, 2048, 1, 2048, 2048, 2048, 2048, 2048]
    - [47, 236.64]
  - - [2048, 2048, 1, 4096, 2048, 2048, 2048, 4096]
    - [43, 252.32]
  - - [2048, 2048, 1, 8192, 2048, 2048, 2048, 8192]
    - [36, 236.69]
  - - [2048, 4096, 1, 128, 2048, 2048, 2048, 128]
    - [2, 61.34]
  - - [2048, 4096, 1, 256, 2048, 2048, 2048, 256]
    - [1, 104.4]
  - - [2048, 4096, 1, 512, 2048, 2048, 2048, 512]
    - [2, 161.77]
  - - [2048, 4096, 1, 1024, 2048, 2048, 2048, 1024]
    - [3, 223.55]
  - - [2048, 4096, 1, 2048, 2048, 2048, 2048, 2048]
    - [6, 261.93]
  - - [2048, 4096, 1, 4096, 2048, 2048, 2048, 4096]
    - [42, 273.87]
  - - [2048, 4096, 1, 8192, 2048, 2048, 2048, 8192]
    - [42, 308.68]
  - - [2048, 8192, 1, 128, 2048, 2048, 2048, 128]
    - [39, 71.38]
  - - [2048, 8192, 1, 256, 2048, 2048, 2048, 256]
    - [40, 124.18]
  - - [2048, 8192, 1, 512, 2048, 2048, 2048, 512]
    - [39, 189.41]
  - - [2048, 8192, 1, 1024, 2048, 2048, 2048, 1024]
    - [40, 262.24]
  - - [2048, 8192, 1, 2048, 2048, 2048, 2048, 2048]
    - [42, 304.86]
  - - [2048, 8192, 1, 4096, 2048, 2048, 2048, 4096]
    - [40, 331.95]
  - - [2048, 8192, 1, 8192, 2048, 2048, 2048, 8192]
    - [41, 381.34]
  - - [4096, 128, 1, 128, 4096, 4096, 4096, 128]
    - [28, 14.26]
  - - [4096, 128, 1, 256, 4096, 4096, 4096, 256]
    - [30, 24.97]
  - - [4096, 128, 1, 512, 4096, 4096, 4096, 512]
    - [63, 41.08]
  - - [4096, 128, 1, 1024, 4096, 4096, 4096, 1024]
    - [63, 62.38]
  - - [4096, 128, 1, 2048, 4096, 4096, 4096, 2048]
    - [69, 76.14]
  - - [4096, 128, 1, 4096, 4096, 4096, 4096, 4096]
    - [69, 92.56]
  - - [4096, 128, 1, 8192, 4096, 4096, 4096, 8192]
    - [68, 103.62]
  - - [4096, 256, 1, 128, 4096, 4096, 4096, 128]
    - [24, 23.79]
  - - [4096, 256, 1, 256, 4096, 4096, 4096, 256]
    - [27, 42.23]
  - - [4096, 256, 1, 512, 4096, 4096, 4096, 512]
    - [24, 68.51]
  - - [4096, 256, 1, 1024, 4096, 4096, 4096, 1024]
    - [25, 98.92]
  - - [4096, 256, 1, 2048, 4096, 4096, 4096, 2048]
    - [60, 117.7]
  - - [4096, 256, 1, 4096, 4096, 4096, 4096, 4096]
    - [59, 138.99]
  - - [4096, 256, 1, 8192, 4096, 4096, 4096, 8192]
    - [26, 145.41]
  - - [4096, 512, 1, 128, 4096, 4096, 4096, 128]
    - [20, 37.01]
  - - [4096, 512, 1, 256, 4096, 4096, 4096, 256]
    - [48, 62.97]
  - - [4096, 512, 1, 512, 4096, 4096, 4096, 512]
    - [56, 100.68]
  - - [4096, 512, 1, 1024, 4096, 4096, 4096, 1024]
    - [55, 142.98]
  - - [4096, 512, 1, 2048, 4096, 4096, 4096, 2048]
    - [56, 174.19]
  - - [4096, 512, 1, 4096, 4096, 4096, 4096, 4096]
    - [50, 201.76]
  - - [4096, 512, 1, 8192, 4096, 4096, 4096, 8192]
    - [55, 198.87]
  - - [4096, 1024, 1, 128, 4096, 4096, 4096, 128]
    - [18, 52.0]
  - - [4096, 1024, 1, 256, 4096, 4096, 4096, 256]
    - [18, 88.46]
  - - [4096, 1024, 1, 512, 4096, 4096, 4096, 512]
    - [18, 136.02]
  - - [4096, 1024, 1, 1024, 4096, 4096, 4096, 1024]
    - [18, 190.8]
  - - [4096, 1024, 1, 2048, 4096, 4096, 4096, 2048]
    - [47, 234.28]
  - - [4096, 1024, 1, 4096, 4096, 4096, 4096, 4096]
    - [46, 252.11]
  - - [4096, 1024, 1, 8192, 4096, 4096, 4096, 8192]
    - [38, 239.39]
  - - [4096, 2048, 1, 128, 4096, 4096, 4096, 128]
    - [2, 58.12]
  - - [4096, 2048, 1, 256, 4096, 4096, 4096, 256]
    - [0, 98.32]
  - - [4096, 2048, 1, 512, 4096, 4096, 4096, 512]
    - [2, 156.35]
  - - [4096, 2048, 1, 1024, 4096, 4096, 4096, 1024]
    - [5, 218.22]
  - - [4096, 2048, 1, 2048, 4096, 4096, 4096, 2048]
    - [8, 257.35]
  - - [4096, 2048, 1, 4096, 4096, 4096, 4096, 4096]
    - [35, 259.41]
  - - [4096, 2048, 1, 8192, 4096, 4096, 4096, 8192]
    - [34, 284.05]
  - - [4096, 4096, 1, 128, 4096, 4096, 4096, 128]
    - [1, 65.44]
  - - [4096, 4096, 1, 256, 4096, 4096, 4096, 256]
    - [8, 111.22]
  - - [4096, 4096, 1, 512, 4096, 4096, 4096, 512]
    - [9, 171.18]
  - - [4096, 4096, 1, 1024, 4096, 4096, 4096, 1024]
    - [4, 215.2]
  - - [4096, 4096, 1, 2048, 4096, 4096, 4096, 2048]
    - [42, 249.86]
  - - [4096, 4096, 1, 4096, 4096, 4096, 4096, 4096]
    - [40, 282.24]
  - - [4096, 4096, 1, 8192, 4096, 4096, 4096, 8192]
    - [2, 316.81]
  - - [4096, 8192, 1, 128, 4096, 4096, 4096, 128]
    - [39, 76.99]
  - - [4096, 8192, 1, 256, 4096, 4096, 4096, 256]
    - [40, 132.48]
  - - [4096, 8192, 1, 512, 4096, 4096, 4096, 512]
    - [42, 194.47]
  - - [4096, 8192, 1, 1024, 4096, 4096, 4096, 1024]
    - [43, 248.58]
  - - [4096, 8192, 1, 2048, 4096, 4096, 4096, 2048]
    - [43, 303.56]
  - - [4096, 8192, 1, 4096, 4096, 4096, 4096, 4096]
    - [41, 352.36]
  - - [4096, 8192, 1, 8192, 4096, 4096, 4096, 8192]
    - [43, 397.46]
  - - [8192, 128, 1, 128, 8192, 8192, 8192, 128]
    - [22, 23.44]
  - - [8192, 128, 1, 256, 8192, 8192, 8192, 256]
    - [27, 41.26]
  - - [8192, 128, 1, 512, 8192, 8192, 8192, 512]
    - [27, 65.65]
  - - [8192, 128, 1, 1024, 8192, 8192, 8192, 1024]
    - [24, 95.39]
  - - [8192, 128, 1, 2048, 8192, 8192, 8192, 2048]
    - [58, 115.02]
  - - [8192, 128, 1, 4096, 8192, 8192, 8192, 4096]
    - [61, 136.35]
  - - [8192, 128, 1, 8192, 8192, 8192, 8192, 8192]
    - [59, 140.89]
  - - [8192, 256, 1, 128, 8192, 8192, 8192, 128]
    - [49, 35.74]
  - - [8192, 256, 1, 256, 8192, 8192, 8192, 256]
    - [21, 61.2]
  - - [8192, 256, 1, 512, 8192, 8192, 8192, 512]
    - [54, 99.53]
  - - [8192, 256, 1, 1024, 8192, 8192, 8192, 1024]
    - [55, 142.36]
  - - [8192, 256, 1, 2048, 8192, 8192, 8192, 2048]
    - [54, 173.88]
  - - [8192, 256, 1, 4096, 8192, 8192, 8192, 4096]
    - [55, 200.95]
  - - [8192, 256, 1, 8192, 8192, 8192, 8192, 8192]
    - [54, 192.6]
  - - [8192, 512, 1, 128, 8192, 8192, 8192, 128]
    - [11, 48.15]
  - - [8192, 512, 1, 256, 8192, 8192, 8192, 256]
    - [10, 84.29]
  - - [8192, 512, 1, 512, 8192, 8192, 8192, 512]
    - [10, 132.34]
  - - [8192, 512, 1, 1024, 8192, 8192, 8192, 1024]
    - [45, 185.19]
  - - [8192, 512, 1, 2048, 8192, 8192, 8192, 2048]
    - [46, 231.87]
  - - [8192, 512, 1, 4096, 8192, 8192, 8192, 4096]
    - [46, 250.44]
  - - [8192, 512, 1, 8192, 8192, 8192, 8192, 8192]
    - [37, 240.21]
  - - [8192, 1024, 1, 128, 8192, 8192, 8192, 128]
    - [2, 56.98]
  - - [8192, 1024, 1, 256, 8192, 8192, 8192, 256]
    - [2, 97.31]
  - - [8192, 1024, 1, 512, 8192, 8192, 8192, 512]
    - [4, 154.21]
  - - [8192, 1024, 1, 1024, 8192, 8192, 8192, 1024]
    - [7, 218.73]
  - - [8192, 1024, 1, 2048, 8192, 8192, 8192, 2048]
    - [3, 257.88]
  - - [8192, 1024, 1, 4096, 8192, 8192, 8192, 4096]
    - [35, 262.35]
  - - [8192, 1024, 1, 8192, 8192, 8192, 8192, 8192]
    - [35, 293.59]
  - - [8192, 2048, 1, 128, 8192, 8192, 8192, 128]
    - [1, 63.48]
  - - [8192, 2048, 1, 256, 8192, 8192, 8192, 256]
    - [0, 109.6]
  - - [8192, 2048, 1, 512, 8192, 8192, 8192, 512]
    - [5, 164.77]
  - - [8192, 2048, 1, 1024, 8192, 8192, 8192, 1024]
    - [43, 214.07]
  - - [8192, 2048, 1, 2048, 8192, 8192, 8192, 2048]
    - [41, 238.15]
  - - [8192, 2048, 1, 4096, 8192, 8192, 8192, 4096]
    - [2, 285.28]
  - - [8192, 2048, 1, 8192, 8192, 8192, 8192, 8192]
    - [1, 333.57]
  - - [8192, 4096, 1, 128, 8192, 8192, 8192, 128]
    - [2, 68.85]
  - - [8192, 4096, 1, 256, 8192, 8192, 8192, 256]
    - [0, 110.02]
  - - [8192, 4096, 1, 512, 8192, 8192, 8192, 512]
    - [15, 167.91]
  - - [8192, 4096, 1, 1024, 8192, 8192, 8192, 1024]
    - [37, 214.52]
  - - [8192, 4096, 1, 2048, 8192, 8192, 8192, 2048]
    - [42, 273.98]
  - - [8192, 4096, 1, 4096, 8192, 8192, 8192, 4096]
    - [42, 315.81]
  - - [8192, 4096, 1, 8192, 8192, 8192, 8192, 8192]
    - [40, 345.49]
  - - [8192, 8192, 1, 128, 8192, 8192, 8192, 128]
    - [39, 70.82]
  - - [8192, 8192, 1, 256, 8192, 8192, 8192, 256]
    - [41, 114.13]
  - - [8192, 8192, 1, 512, 8192, 8192, 8192, 512]
    - [42, 170.61]
  - - [8192, 8192, 1, 1024, 8192, 8192, 8192, 1024]
    - [41, 242.57]
  - - [8192, 8192, 1, 2048, 8192, 8192, 8192, 2048]
    - [42, 322.17]
  - - [8192, 8192, 1, 4096, 8192, 8192, 8192, 4096]
    - [42, 368.03]
  - - [8192, 8192, 1, 8192, 8192, 8192, 8192, 8192]
    - [42, 400.86]
- null
- null
- ExperimentalStreamK
- GridBased
