projects/hipblaslt/library/src/amd_detail/rocblaslt/src/Tensile/Logic/asm_full/aquavanjaram/gfx942_228cu/StreamK/aquavanjaram942_Cijk_Alik_Bljk_B8F8NSS_BH_Bias_HAS_SAV_UserArgs.yaml
- {MinimumRequiredVersion: 4.33.0}
- aquavanjaram942
- {Architecture: gfx942, CUCount: 228}
- [Device 0049, Device 0050]
    SolutionIndex: 0
    SolutionNameMin: Cijk_Alik_Bljk_B8F8NSS_BH_Bias_HAS_SAV_UserArgs_MT128x256x64_MI16x16x1_SN_LDSB1_CLR1_GRVWA8_GRVWB16_GSU0_GSUC0_GSUWGMRR0_K1_LBSPPA256_LBSPPB512_LPA32_LPB32_LRVW16_MIWT4_8_PLR1_SU0_SUM0_SUS64_VWA4_VWB8_WGM1_WGMXCC1_WGMXCCGn1
    SolutionIndex: 1
    SolutionNameMin: Cijk_Alik_Bljk_B8F8NSS_BH_Bias_HAS_SAV_UserArgs_MT128x256x64_MI16x16x1_SN_LDSB1_CLR1_GRVWA16_GRVWB16_GSU0_GSUC0_GSUWGMRR0_K1_LBSPPA256_LBSPPB512_LPA32_LPB32_LRVW16_MIWT4_8_PLR1_SU0_SUM0_SUS64_VWA4_VWB8_WGM1_WGMXCC1_WGMXCCGn1
    SolutionIndex: 2
    SolutionNameMin: Cijk_Alik_Bljk_B8F8NSS_BH_Bias_HAS_SAV_UserArgs_MT128x256x64_MI16x16x1_SN_LDSB1_CLR1_GRVWA16_GRVWB16_GSU0_GSUC0_GSUWGMRR0_K1_LBSPPA256_LBSPPB512_LPA32_LPB32_LRVW16_MIWT4_8_PLR1_SU0_SUM0_SUS64_VWA4_VWB8_WGM4_WGMXCC1_WGMXCCGn1
    SolutionIndex: 3
    SolutionNameMin: Cijk_Alik_Bljk_B8F8NSS_BH_Bias_HAS_SAV_UserArgs_MT256x144x64_MI16x16x1_SN_LDSB0_CLR1_GRVWA16_GRVWB4_GSU0_GSUC0_GSUWGMRR0_K1_LBSPPA256_LBSPPB128_LPA16_LPB8_LRVW8_MIWT4_9_PLR1_SU0_SUM0_SUS64_VWA4_VWB1_WGM1_WGMXCC1_WGMXCCGn1
    SolutionIndex: 4
    SolutionNameMin: Cijk_Alik_Bljk_B8F8NSS_BH_Bias_HAS_SAV_UserArgs_MT256x144x64_MI16x16x1_SN_LDSB0_CLR1_GRVWA16_GRVWB4_GSU0_GSUC0_GSUWGMRR0_K1_LBSPPA256_LBSPPB128_LPA16_LPB8_LRVW8_MIWT4_9_PLR1_SU0_SUM0_SUS64_VWA4_VWB1_WGM4_WGMXCC1_WGMXCCGn1
    SolutionIndex: 5
    SolutionNameMin: Cijk_Alik_Bljk_B8F8NSS_BH_Bias_HAS_SAV_UserArgs_MT256x144x64_MI16x16x1_SN_LDSB0_CLR1_GRVWA4_GRVWB4_GSU0_GSUC0_GSUWGMRR0_K1_LBSPPA256_LBSPPB128_LPA32_LPB32_LRVW16_MIWT4_9_PLR1_SU0_SUM0_SUS64_VWA4_VWB1_WGM6_WGMXCC1_WGMXCCGn1
    SolutionIndex: 6
    SolutionNameMin: Cijk_Alik_Bljk_B8F8NSS_BH_Bias_HAS_SAV_UserArgs_MT256x144x64_MI16x16x1_SN_LDSB0_CLR1_GRVWA4_GRVWB4_GSU0_GSUC0_GSUWGMRR0_K1_LBSPPA256_LBSPPB128_LPA8_LPB8_LRVW8_MIWT4_9_PLR1_SU0_SUM0_SUS64_VWA4_VWB1_WGM8_WGMXCC1_WGMXCCGn1
    SolutionIndex: 7
    SolutionNameMin: Cijk_Alik_Bljk_B8F8NSS_BH_Bias_HAS_SAV_UserArgs_MT256x144x64_MI16x16x1_SN_LDSB0_CLR1_GRVWA16_GRVWB4_GSU0_GSUC0_GSUWGMRR0_K1_LBSPPA256_LBSPPB128_LPA32_LPB32_LRVW16_MIWT4_9_PLR1_SU0_SUM0_SUS64_VWA4_VWB1_WGM8_WGMXCC1_WGMXCCGn1
    SolutionIndex: 8
    SolutionNameMin: Cijk_Alik_Bljk_B8F8NSS_BH_Bias_HAS_SAV_UserArgs_MT144x256x64_MI16x16x1_SN_LDSB0_CLR1_GRVWA4_GRVWB16_GSU0_GSUC0_GSUWGMRR0_K1_LBSPPA128_LBSPPB256_LPA8_LPB16_LRVW8_MIWT9_4_PLR1_SU0_SUM0_SUS64_VWA1_VWB4_WGM4_WGMXCC1_WGMXCCGn1
    SolutionIndex: 9
    SolutionNameMin: Cijk_Alik_Bljk_B8F8NSS_BH_Bias_HAS_SAV_UserArgs_MT144x256x64_MI16x16x1_SN_LDSB0_CLR1_GRVWA4_GRVWB16_GSU0_GSUC0_GSUWGMRR0_K1_LBSPPA128_LBSPPB256_LPA8_LPB16_LRVW8_MIWT9_4_PLR1_SU0_SUM0_SUS64_VWA1_VWB4_WGM6_WGMXCC1_WGMXCCGn1
    SolutionIndex: 10
    SolutionNameMin: Cijk_Alik_Bljk_B8F8NSS_BH_Bias_HAS_SAV_UserArgs_MT64x144x64_MI16x16x1_SN_LDSB0_CLR1_GRVWA4_GRVWB4_GSU0_GSUC0_GSUWGMRR0_K1_LBSPPA128_LBSPPB128_LPA8_LPB8_LRVW8_MIWT1_9_PLR1_SU0_SUM0_SUS64_VWA1_VWB1_WGM1_WGMXCC1_WGMXCCGn1
    SolutionIndex: 11
    SolutionNameMin: Cijk_Alik_Bljk_B8F8NSS_BH_Bias_HAS_SAV_UserArgs_MT64x144x64_MI16x16x1_SN_LDSB0_CLR1_GRVWA16_GRVWB4_GSU0_GSUC0_GSUWGMRR0_K1_LBSPPA128_LBSPPB128_LPA16_LPB8_LRVW8_MIWT1_9_PLR1_SU0_SUM0_SUS64_VWA1_VWB1_WGM1_WGMXCC1_WGMXCCGn1
    SolutionIndex: 12
    SolutionNameMin: Cijk_Alik_Bljk_B8F8NSS_BH_Bias_HAS_SAV_UserArgs_MT128x144x64_MI16x16x1_SN_LDSB1_CLR1_GRVWA16_GRVWB4_GSU0_GSUC0_GSUWGMRR0_K1_LBSPPA128_LBSPPB128_LPA16_LPB8_LRVW8_MIWT2_9_PLR1_SU0_SUM0_SUS64_VWA2_VWB1_WGM8_WGMXCC1_WGMXCCGn1
    SolutionIndex: 13
    SolutionNameMin: Cijk_Alik_Bljk_B8F8NSS_BH_Bias_HAS_SAV_UserArgs_MT128x144x64_MI16x16x1_SN_LDSB1_CLR1_GRVWA16_GRVWB4_GSU0_GSUC0_GSUWGMRR0_K1_LBSPPA128_LBSPPB128_LPA32_LPB32_LRVW16_MIWT2_9_PLR1_SU0_SUM0_SUS64_VWA2_VWB1_WGM8_WGMXCC1_WGMXCCGn1
    SolutionIndex: 14
    SolutionNameMin: Cijk_Alik_Bljk_B8F8NSS_BH_Bias_HAS_SAV_UserArgs_MT144x64x64_MI16x16x1_SN_LDSB0_CLR1_GRVWA4_GRVWB4_GSU0_GSUC0_GSUWGMRR0_K1_LBSPPA128_LBSPPB128_LPA8_LPB8_LRVW8_MIWT9_1_PLR1_SU0_SUM0_SUS64_VWA1_VWB1_WGM4_WGMXCC1_WGMXCCGn1
    SolutionIndex: 15
    SolutionNameMin: Cijk_Alik_Bljk_B8F8NSS_BH_Bias_HAS_SAV_UserArgs_MT144x64x64_MI16x16x1_SN_LDSB0_CLR1_GRVWA4_GRVWB8_GSU0_GSUC0_GSUWGMRR0_K1_LBSPPA128_LBSPPB128_LPA8_LPB8_LRVW8_MIWT9_1_PLR1_SU0_SUM0_SUS64_VWA1_VWB1_WGM8_WGMXCC1_WGMXCCGn1
    SolutionIndex: 16
    SolutionNameMin: Cijk_Alik_Bljk_B8F8NSS_BH_Bias_HAS_SAV_UserArgs_MT144x128x64_MI16x16x1_SN_LDSB1_CLR1_GRVWA4_GRVWB16_GSU0_GSUC0_GSUWGMRR0_K1_LBSPPA128_LBSPPB128_LPA8_LPB16_LRVW8_MIWT9_2_PLR1_SU0_SUM0_SUS64_VWA1_VWB2_WGM1_WGMXCC1_WGMXCCGn1
    SolutionIndex: 17
    SolutionNameMin: Cijk_Alik_Bljk_B8F8NSS_BH_Bias_HAS_SAV_UserArgs_MT144x128x64_MI16x16x1_SN_LDSB1_CLR1_GRVWA4_GRVWB8_GSU0_GSUC0_GSUWGMRR0_K1_LBSPPA128_LBSPPB128_LPA8_LPB8_LRVW8_MIWT9_2_PLR1_SU0_SUM0_SUS64_VWA1_VWB2_WGM6_WGMXCC1_WGMXCCGn1
    SolutionIndex: 18
    SolutionNameMin: Cijk_Alik_Bljk_B8F8NSS_BH_Bias_HAS_SAV_UserArgs_MT144x128x64_MI16x16x1_SN_LDSB1_CLR1_GRVWA4_GRVWB16_GSU0_GSUC0_GSUWGMRR0_K1_LBSPPA128_LBSPPB128_LPA8_LPB16_LRVW8_MIWT9_2_PLR1_SU0_SUM0_SUS64_VWA1_VWB2_WGM6_WGMXCC1_WGMXCCGn1
    SolutionIndex: 19
    SolutionNameMin: Cijk_Alik_Bljk_B8F8NSS_BH_Bias_HAS_SAV_UserArgs_MT144x128x64_MI16x16x1_SN_LDSB1_CLR1_GRVWA4_GRVWB16_GSU0_GSUC0_GSUWGMRR0_K1_LBSPPA128_LBSPPB128_LPA32_LPB32_LRVW16_MIWT9_2_PLR1_SU0_SUM0_SUS64_VWA1_VWB2_WGM6_WGMXCC1_WGMXCCGn1
    SolutionIndex: 20
    SolutionNameMin: Cijk_Alik_Bljk_B8F8NSS_BH_Bias_HAS_SAV_UserArgs_MT128x128x64_MI16x16x1_SN_LDSB1_CLR1_GRVWA8_GRVWB16_GSU0_GSUC0_GSUWGMRR0_K1_LBSPPA256_LBSPPB256_LPA8_LPB16_LRVW8_MIWT4_4_PLR1_SU0_SUM0_SUS64_VWA4_VWB4_WGM1_WGMXCC1_WGMXCCGn1
    SolutionIndex: 21
    SolutionNameMin: Cijk_Alik_Bljk_B8F8NSS_BH_Bias_HAS_SAV_UserArgs_MT128x128x64_MI16x16x1_SN_LDSB1_CLR1_GRVWA16_GRVWB16_GSU0_GSUC0_GSUWGMRR0_K1_LBSPPA256_LBSPPB256_LPA32_LPB32_LRVW16_MIWT4_4_PLR1_SU0_SUM0_SUS64_VWA4_VWB4_WGM1_WGMXCC1_WGMXCCGn1
    SolutionIndex: 22
    SolutionNameMin: Cijk_Alik_Bljk_B8F8NSS_BH_Bias_HAS_SAV_UserArgs_MT128x128x64_MI16x16x1_SN_LDSB1_CLR1_GRVWA16_GRVWB16_GSU0_GSUC0_GSUWGMRR0_K1_LBSPPA256_LBSPPB256_LPA32_LPB32_LRVW16_MIWT4_4_PLR1_SU0_SUM0_SUS64_VWA4_VWB4_WGM4_WGMXCC1_WGMXCCGn1
    SolutionIndex: 23
    SolutionNameMin: Cijk_Alik_Bljk_B8F8NSS_BH_Bias_HAS_SAV_UserArgs_MT128x128x64_MI16x16x1_SN_LDSB1_CLR1_GRVWA16_GRVWB16_GSU0_GSUC0_GSUWGMRR0_K1_LBSPPA256_LBSPPB256_LPA32_LPB32_LRVW16_MIWT4_4_PLR1_SU0_SUM0_SUS64_VWA4_VWB4_WGM8_WGMXCC1_WGMXCCGn1
    SolutionIndex: 24
    SolutionNameMin: Cijk_Alik_Bljk_B8F8NSS_BH_Bias_HAS_SAV_UserArgs_MT128x64x64_MI16x16x1_SN_LDSB0_CLR1_GRVWA16_GRVWB16_GSU0_GSUC0_GSUWGMRR0_K1_LBSPPA256_LBSPPB128_LPA16_LPB16_LRVW8_MIWT4_2_PLR1_SU0_SUM0_SUS64_VWA4_VWB2_WGM1_WGMXCC1_WGMXCCGn1
    SolutionIndex: 25
    SolutionNameMin: Cijk_Alik_Bljk_B8F8NSS_BH_Bias_HAS_SAV_UserArgs_MT128x64x64_MI16x16x1_SN_LDSB0_CLR1_GRVWA16_GRVWB16_GSU0_GSUC0_GSUWGMRR0_K1_LBSPPA256_LBSPPB128_LPA32_LPB32_LRVW16_MIWT4_2_PLR1_SU0_SUM0_SUS64_VWA4_VWB2_WGM1_WGMXCC1_WGMXCCGn1
    SolutionIndex: 26
    SolutionNameMin: Cijk_Alik_Bljk_B8F8NSS_BH_Bias_HAS_SAV_UserArgs_MT128x64x64_MI16x16x1_SN_LDSB0_CLR1_GRVWA16_GRVWB16_GSU0_GSUC0_GSUWGMRR0_K1_LBSPPA256_LBSPPB128_LPA32_LPB32_LRVW16_MIWT4_2_PLR1_SU0_SUM0_SUS64_VWA4_VWB2_WGM8_WGMXCC1_WGMXCCGn1
    SolutionIndex: 27
    SolutionNameMin: Cijk_Alik_Bljk_B8F8NSS_BH_Bias_HAS_SAV_UserArgs_MT128x32x64_MI16x16x1_SN_LDSB0_CLR1_GRVWA16_GRVWB8_GSU0_GSUC0_GSUWGMRR0_K1_LBSPPA256_LBSPPB128_LPA16_LPB8_LRVW8_MIWT4_1_PLR1_SU0_SUM0_SUS64_VWA4_VWB1_WGM1_WGMXCC1_WGMXCCGn1
    SolutionIndex: 28
    SolutionNameMin: Cijk_Alik_Bljk_B8F8NSS_BH_Bias_HAS_SAV_UserArgs_MT128x32x64_MI16x16x1_SN_LDSB0_CLR1_GRVWA16_GRVWB4_GSU0_GSUC0_GSUWGMRR0_K1_LBSPPA256_LBSPPB128_LPA32_LPB32_LRVW16_MIWT4_1_PLR1_SU0_SUM0_SUS64_VWA4_VWB1_WGM1_WGMXCC1_WGMXCCGn1
    SolutionIndex: 29
    SolutionNameMin: Cijk_Alik_Bljk_B8F8NSS_BH_Bias_HAS_SAV_UserArgs_MT128x32x64_MI16x16x1_SN_LDSB0_CLR1_GRVWA16_GRVWB8_GSU0_GSUC0_GSUWGMRR0_K1_LBSPPA256_LBSPPB128_LPA32_LPB32_LRVW16_MIWT4_1_PLR1_SU0_SUM0_SUS64_VWA4_VWB1_WGM1_WGMXCC1_WGMXCCGn1
    SolutionIndex: 30
    SolutionNameMin: Cijk_Alik_Bljk_B8F8NSS_BH_Bias_HAS_SAV_UserArgs_MT64x64x64_MI16x16x1_SN_LDSB0_CLR1_GRVWA8_GRVWB16_GSU0_GSUC0_GSUWGMRR0_K1_LBSPPA128_LBSPPB128_LPA8_LPB16_LRVW8_MIWT2_2_PLR1_SU0_SUM0_SUS64_VWA2_VWB2_WGM1_WGMXCC1_WGMXCCGn1
    SolutionIndex: 31
    SolutionNameMin: Cijk_Alik_Bljk_B8F8NSS_BH_Bias_HAS_SAV_UserArgs_MT64x64x64_MI16x16x1_SN_LDSB0_CLR1_GRVWA8_GRVWB4_GSU0_GSUC0_GSUWGMRR0_K1_LBSPPA128_LBSPPB128_LPA32_LPB32_LRVW16_MIWT2_2_PLR1_SU0_SUM0_SUS64_VWA2_VWB2_WGM1_WGMXCC1_WGMXCCGn1
    SolutionIndex: 32
    SolutionNameMin: Cijk_Alik_Bljk_B8F8NSS_BH_Bias_HAS_SAV_UserArgs_MT32x64x64_MI16x16x1_SN_LDSB0_CLR1_GRVWA4_GRVWB16_GSU0_GSUC0_GSUWGMRR0_K1_LBSPPA128_LBSPPB128_LPA32_LPB32_LRVW16_MIWT1_2_PLR1_SU0_SUM0_SUS64_VWA1_VWB2_WGM1_WGMXCC1_WGMXCCGn1
    SolutionIndex: 33
    SolutionNameMin: Cijk_Alik_Bljk_B8F8NSS_BH_Bias_HAS_SAV_UserArgs_MT32x64x64_MI16x16x1_SN_LDSB0_CLR1_GRVWA4_GRVWB16_GSU0_GSUC0_GSUWGMRR0_K1_LBSPPA128_LBSPPB128_LPA8_LPB16_LRVW8_MIWT1_2_PLR1_SU0_SUM0_SUS64_VWA1_VWB2_WGM8_WGMXCC1_WGMXCCGn1
    SolutionIndex: 34
    SolutionNameMin: Cijk_Alik_Bljk_B8F8NSS_BH_Bias_HAS_SAV_UserArgs_MT64x32x64_MI16x16x1_SN_LDSB0_CLR1_GRVWA4_GRVWB8_GSU0_GSUC0_GSUWGMRR0_K1_LBSPPA128_LBSPPB128_LPA32_LPB32_LRVW16_MIWT2_1_PLR1_SU0_SUM0_SUS64_VWA2_VWB1_WGM1_WGMXCC1_WGMXCCGn1
    SolutionIndex: 35
    SolutionNameMin: Cijk_Alik_Bljk_B8F8NSS_BH_Bias_HAS_SAV_UserArgs_MT32x32x64_MI16x16x1_SN_LDSB0_CLR1_GRVWA4_GRVWB4_GSU0_GSUC0_GSUWGMRR0_K1_LBSPPA128_LBSPPB128_LPA8_LPB8_LRVW8_MIWT1_1_PLR1_SU0_SUM0_SUS64_VWA1_VWB1_WGM1_WGMXCC1_WGMXCCGn1
    SolutionIndex: 36
    SolutionNameMin: Cijk_Alik_Bljk_B8F8NSS_BH_Bias_HAS_SAV_UserArgs_MT32x32x64_MI16x16x1_SN_LDSB0_CLR1_GRVWA8_GRVWB4_GSU0_GSUC0_GSUWGMRR0_K1_LBSPPA128_LBSPPB128_LPA8_LPB8_LRVW8_MIWT1_1_PLR1_SU0_SUM0_SUS64_VWA1_VWB1_WGM1_WGMXCC1_WGMXCCGn1
    SolutionIndex: 37
    SolutionNameMin: Cijk_Alik_Bljk_B8F8NSS_BH_Bias_HAS_SAV_UserArgs_MT32x32x64_MI16x16x1_SN_LDSB0_CLR1_GRVWA8_GRVWB8_GSU0_GSUC0_GSUWGMRR0_K1_LBSPPA128_LBSPPB128_LPA32_LPB32_LRVW16_MIWT1_1_PLR1_SU0_SUM0_SUS64_VWA1_VWB1_WGM4_WGMXCC1_WGMXCCGn1
    SolutionIndex: 38
    SolutionNameMin: Cijk_Alik_Bljk_B8F8NSS_BH_Bias_HAS_SAV_UserArgs_MT128x256x128_MI16x16x1_SN_LDSB1_CLR1_GRVWA16_GRVWB16_GSU0_GSUC0_GSUWGMRR0_K1_LBSPPA512_LBSPPB1024_LPA32_LPB32_LRVW16_MIWT4_8_PLR1_SU0_SUM0_SUS128_VWA4_VWB8_WGM1_WGMXCC1_WGMXCCGn1
    SolutionIndex: 39
    SolutionNameMin: Cijk_Alik_Bljk_B8F8NSS_BH_Bias_HAS_SAV_UserArgs_MT128x256x128_MI16x16x1_SN_LDSB1_CLR1_GRVWA4_GRVWB16_GSU0_GSUC0_GSUWGMRR0_K1_LBSPPA512_LBSPPB1024_LPA32_LPB32_LRVW16_MIWT4_8_PLR1_SU0_SUM0_SUS128_VWA4_VWB8_WGM4_WGMXCC1_WGMXCCGn1
    SolutionIndex: 40
    SolutionNameMin: Cijk_Alik_Bljk_B8F8NSS_BH_Bias_HAS_SAV_UserArgs_MT128x256x128_MI16x16x1_SN_LDSB1_CLR1_GRVWA8_GRVWB16_GSU0_GSUC0_GSUWGMRR0_K1_LBSPPA512_LBSPPB1024_LPA32_LPB32_LRVW16_MIWT4_8_PLR1_SU0_SUM0_SUS128_VWA4_VWB8_WGM4_WGMXCC1_WGMXCCGn1
    SolutionIndex: 41
    SolutionNameMin: Cijk_Alik_Bljk_B8F8NSS_BH_Bias_HAS_SAV_UserArgs_MT128x256x128_MI16x16x1_SN_LDSB1_CLR1_GRVWA16_GRVWB16_GSU0_GSUC0_GSUWGMRR0_K1_LBSPPA512_LBSPPB1024_LPA32_LPB32_LRVW16_MIWT4_8_PLR1_SU0_SUM0_SUS128_VWA4_VWB8_WGM4_WGMXCC1_WGMXCCGn1
    SolutionIndex: 42
    SolutionNameMin: Cijk_Alik_Bljk_B8F8NSS_BH_Bias_HAS_SAV_UserArgs_MT128x256x128_MI16x16x1_SN_LDSB1_CLR1_GRVWA4_GRVWB16_GSU0_GSUC0_GSUWGMRR0_K1_LBSPPA512_LBSPPB1024_LPA32_LPB32_LRVW16_MIWT4_8_PLR1_SU0_SUM0_SUS128_VWA4_VWB8_WGM6_WGMXCC1_WGMXCCGn1
    SolutionIndex: 43
    SolutionNameMin: Cijk_Alik_Bljk_B8F8NSS_BH_Bias_HAS_SAV_UserArgs_MT128x256x128_MI16x16x1_SN_LDSB1_CLR1_GRVWA16_GRVWB16_GSU0_GSUC0_GSUWGMRR0_K1_LBSPPA512_LBSPPB1024_LPA32_LPB32_LRVW16_MIWT4_8_PLR1_SU0_SUM0_SUS128_VWA4_VWB8_WGM6_WGMXCC1_WGMXCCGn1
    SolutionIndex: 44
    SolutionNameMin: Cijk_Alik_Bljk_B8F8NSS_BH_Bias_HAS_SAV_UserArgs_MT128x256x128_MI16x16x1_SN_LDSB1_CLR1_GRVWA16_GRVWB16_GSU0_GSUC0_GSUWGMRR0_K1_LBSPPA512_LBSPPB1024_LPA32_LPB32_LRVW16_MIWT4_8_PLR1_SU0_SUM0_SUS128_VWA4_VWB8_WGM8_WGMXCC1_WGMXCCGn1
    SolutionIndex: 45
    SolutionNameMin: Cijk_Alik_Bljk_B8F8NSS_BH_Bias_HAS_SAV_UserArgs_MT256x144x128_MI16x16x1_SN_LDSB1_CLR1_GRVWA4_GRVWB4_GSU0_GSUC0_GSUWGMRR0_K1_LBSPPA512_LBSPPB128_LPA8_LPB8_LRVW8_MIWT4_9_PLR1_SU0_SUM0_SUS128_VWA4_VWB1_WGM1_WGMXCC1_WGMXCCGn1
    SolutionIndex: 46
    SolutionNameMin: Cijk_Alik_Bljk_B8F8NSS_BH_Bias_HAS_SAV_UserArgs_MT256x144x128_MI16x16x1_SN_LDSB1_CLR1_GRVWA4_GRVWB8_GSU0_GSUC0_GSUWGMRR0_K1_LBSPPA512_LBSPPB128_LPA8_LPB8_LRVW8_MIWT4_9_PLR1_SU0_SUM0_SUS128_VWA4_VWB1_WGM1_WGMXCC1_WGMXCCGn1
    SolutionIndex: 47
    SolutionNameMin: Cijk_Alik_Bljk_B8F8NSS_BH_Bias_HAS_SAV_UserArgs_MT256x144x128_MI16x16x1_SN_LDSB1_CLR1_GRVWA8_GRVWB8_GSU0_GSUC0_GSUWGMRR0_K1_LBSPPA512_LBSPPB128_LPA8_LPB8_LRVW8_MIWT4_9_PLR1_SU0_SUM0_SUS128_VWA4_VWB1_WGM1_WGMXCC1_WGMXCCGn1
    SolutionIndex: 48
    SolutionNameMin: Cijk_Alik_Bljk_B8F8NSS_BH_Bias_HAS_SAV_UserArgs_MT256x144x128_MI16x16x1_SN_LDSB1_CLR1_GRVWA16_GRVWB8_GSU0_GSUC0_GSUWGMRR0_K1_LBSPPA512_LBSPPB128_LPA16_LPB8_LRVW8_MIWT4_9_PLR1_SU0_SUM0_SUS128_VWA4_VWB1_WGM1_WGMXCC1_WGMXCCGn1
    SolutionIndex: 49
    SolutionNameMin: Cijk_Alik_Bljk_B8F8NSS_BH_Bias_HAS_SAV_UserArgs_MT256x144x128_MI16x16x1_SN_LDSB1_CLR1_GRVWA4_GRVWB4_GSU0_GSUC0_GSUWGMRR0_K1_LBSPPA512_LBSPPB128_LPA32_LPB32_LRVW16_MIWT4_9_PLR1_SU0_SUM0_SUS128_VWA4_VWB1_WGM1_WGMXCC1_WGMXCCGn1
    SolutionIndex: 50
    SolutionNameMin: Cijk_Alik_Bljk_B8F8NSS_BH_Bias_HAS_SAV_UserArgs_MT256x144x128_MI16x16x1_SN_LDSB1_CLR1_GRVWA4_GRVWB8_GSU0_GSUC0_GSUWGMRR0_K1_LBSPPA512_LBSPPB128_LPA32_LPB32_LRVW16_MIWT4_9_PLR1_SU0_SUM0_SUS128_VWA4_VWB1_WGM1_WGMXCC1_WGMXCCGn1
    SolutionIndex: 51
    SolutionNameMin: Cijk_Alik_Bljk_B8F8NSS_BH_Bias_HAS_SAV_UserArgs_MT256x144x128_MI16x16x1_SN_LDSB1_CLR1_GRVWA16_GRVWB8_GSU0_GSUC0_GSUWGMRR0_K1_LBSPPA512_LBSPPB128_LPA32_LPB32_LRVW16_MIWT4_9_PLR1_SU0_SUM0_SUS128_VWA4_VWB1_WGM1_WGMXCC1_WGMXCCGn1
    SolutionIndex: 52
    SolutionNameMin: Cijk_Alik_Bljk_B8F8NSS_BH_Bias_HAS_SAV_UserArgs_MT256x144x128_MI16x16x1_SN_LDSB1_CLR1_GRVWA4_GRVWB4_GSU0_GSUC0_GSUWGMRR0_K1_LBSPPA512_LBSPPB128_LPA8_LPB8_LRVW8_MIWT4_9_PLR1_SU0_SUM0_SUS128_VWA4_VWB1_WGM4_WGMXCC1_WGMXCCGn1
    SolutionIndex: 53
    SolutionNameMin: Cijk_Alik_Bljk_B8F8NSS_BH_Bias_HAS_SAV_UserArgs_MT256x144x128_MI16x16x1_SN_LDSB1_CLR1_GRVWA4_GRVWB8_GSU0_GSUC0_GSUWGMRR0_K1_LBSPPA512_LBSPPB128_LPA8_LPB8_LRVW8_MIWT4_9_PLR1_SU0_SUM0_SUS128_VWA4_VWB1_WGM4_WGMXCC1_WGMXCCGn1
    SolutionIndex: 54
    SolutionNameMin: Cijk_Alik_Bljk_B8F8NSS_BH_Bias_HAS_SAV_UserArgs_MT256x144x128_MI16x16x1_SN_LDSB1_CLR1_GRVWA4_GRVWB4_GSU0_GSUC0_GSUWGMRR0_K1_LBSPPA512_LBSPPB128_LPA32_LPB32_LRVW16_MIWT4_9_PLR1_SU0_SUM0_SUS128_VWA4_VWB1_WGM4_WGMXCC1_WGMXCCGn1
    SolutionIndex: 55
    SolutionNameMin: Cijk_Alik_Bljk_B8F8NSS_BH_Bias_HAS_SAV_UserArgs_MT256x144x128_MI16x16x1_SN_LDSB1_CLR1_GRVWA8_GRVWB8_GSU0_GSUC0_GSUWGMRR0_K1_LBSPPA512_LBSPPB128_LPA8_LPB8_LRVW8_MIWT4_9_PLR1_SU0_SUM0_SUS128_VWA4_VWB1_WGM6_WGMXCC1_WGMXCCGn1
    SolutionIndex: 56
    SolutionNameMin: Cijk_Alik_Bljk_B8F8NSS_BH_Bias_HAS_SAV_UserArgs_MT256x144x128_MI16x16x1_SN_LDSB1_CLR1_GRVWA8_GRVWB4_GSU0_GSUC0_GSUWGMRR0_K1_LBSPPA512_LBSPPB128_LPA32_LPB32_LRVW16_MIWT4_9_PLR1_SU0_SUM0_SUS128_VWA4_VWB1_WGM6_WGMXCC1_WGMXCCGn1
    SolutionIndex: 57
    SolutionNameMin: Cijk_Alik_Bljk_B8F8NSS_BH_Bias_HAS_SAV_UserArgs_MT256x144x128_MI16x16x1_SN_LDSB1_CLR1_GRVWA16_GRVWB8_GSU0_GSUC0_GSUWGMRR0_K1_LBSPPA512_LBSPPB128_LPA32_LPB32_LRVW16_MIWT4_9_PLR1_SU0_SUM0_SUS128_VWA4_VWB1_WGM6_WGMXCC1_WGMXCCGn1
    SolutionIndex: 58
    SolutionNameMin: Cijk_Alik_Bljk_B8F8NSS_BH_Bias_HAS_SAV_UserArgs_MT256x144x128_MI16x16x1_SN_LDSB1_CLR1_GRVWA4_GRVWB4_GSU0_GSUC0_GSUWGMRR0_K1_LBSPPA512_LBSPPB128_LPA8_LPB8_LRVW8_MIWT4_9_PLR1_SU0_SUM0_SUS128_VWA4_VWB1_WGM8_WGMXCC1_WGMXCCGn1
    SolutionIndex: 59
    SolutionNameMin: Cijk_Alik_Bljk_B8F8NSS_BH_Bias_HAS_SAV_UserArgs_MT256x144x128_MI16x16x1_SN_LDSB1_CLR1_GRVWA4_GRVWB8_GSU0_GSUC0_GSUWGMRR0_K1_LBSPPA512_LBSPPB128_LPA8_LPB8_LRVW8_MIWT4_9_PLR1_SU0_SUM0_SUS128_VWA4_VWB1_WGM8_WGMXCC1_WGMXCCGn1
    SolutionIndex: 60
    SolutionNameMin: Cijk_Alik_Bljk_B8F8NSS_BH_Bias_HAS_SAV_UserArgs_MT144x256x128_MI16x16x1_SN_LDSB1_CLR1_GRVWA8_GRVWB16_GSU0_GSUC0_GSUWGMRR0_K1_LBSPPA128_LBSPPB512_LPA8_LPB16_LRVW8_MIWT9_4_PLR1_SU0_SUM0_SUS128_VWA1_VWB4_WGM1_WGMXCC1_WGMXCCGn1
    SolutionIndex: 61
    SolutionNameMin: Cijk_Alik_Bljk_B8F8NSS_BH_Bias_HAS_SAV_UserArgs_MT144x256x128_MI16x16x1_SN_LDSB1_CLR1_GRVWA8_GRVWB16_GSU0_GSUC0_GSUWGMRR0_K1_LBSPPA128_LBSPPB512_LPA32_LPB32_LRVW16_MIWT9_4_PLR1_SU0_SUM0_SUS128_VWA1_VWB4_WGM1_WGMXCC1_WGMXCCGn1
    SolutionIndex: 62
    SolutionNameMin: Cijk_Alik_Bljk_B8F8NSS_BH_Bias_HAS_SAV_UserArgs_MT144x256x128_MI16x16x1_SN_LDSB1_CLR1_GRVWA4_GRVWB8_GSU0_GSUC0_GSUWGMRR0_K1_LBSPPA128_LBSPPB512_LPA8_LPB8_LRVW8_MIWT9_4_PLR1_SU0_SUM0_SUS128_VWA1_VWB4_WGM4_WGMXCC1_WGMXCCGn1
    SolutionIndex: 63
    SolutionNameMin: Cijk_Alik_Bljk_B8F8NSS_BH_Bias_HAS_SAV_UserArgs_MT144x256x128_MI16x16x1_SN_LDSB1_CLR1_GRVWA4_GRVWB16_GSU0_GSUC0_GSUWGMRR0_K1_LBSPPA128_LBSPPB512_LPA8_LPB16_LRVW8_MIWT9_4_PLR1_SU0_SUM0_SUS128_VWA1_VWB4_WGM4_WGMXCC1_WGMXCCGn1
    SolutionIndex: 64
    SolutionNameMin: Cijk_Alik_Bljk_B8F8NSS_BH_Bias_HAS_SAV_UserArgs_MT144x256x128_MI16x16x1_SN_LDSB1_CLR1_GRVWA8_GRVWB8_GSU0_GSUC0_GSUWGMRR0_K1_LBSPPA128_LBSPPB512_LPA32_LPB32_LRVW16_MIWT9_4_PLR1_SU0_SUM0_SUS128_VWA1_VWB4_WGM4_WGMXCC1_WGMXCCGn1
    SolutionIndex: 65
    SolutionNameMin: Cijk_Alik_Bljk_B8F8NSS_BH_Bias_HAS_SAV_UserArgs_MT144x256x128_MI16x16x1_SN_LDSB1_CLR1_GRVWA4_GRVWB16_GSU0_GSUC0_GSUWGMRR0_K1_LBSPPA128_LBSPPB512_LPA32_LPB32_LRVW16_MIWT9_4_PLR1_SU0_SUM0_SUS128_VWA1_VWB4_WGM4_WGMXCC1_WGMXCCGn1
    SolutionIndex: 66
    SolutionNameMin: Cijk_Alik_Bljk_B8F8NSS_BH_Bias_HAS_SAV_UserArgs_MT144x256x128_MI16x16x1_SN_LDSB1_CLR1_GRVWA8_GRVWB16_GSU0_GSUC0_GSUWGMRR0_K1_LBSPPA128_LBSPPB512_LPA32_LPB32_LRVW16_MIWT9_4_PLR1_SU0_SUM0_SUS128_VWA1_VWB4_WGM4_WGMXCC1_WGMXCCGn1
    SolutionIndex: 67
    SolutionNameMin: Cijk_Alik_Bljk_B8F8NSS_BH_Bias_HAS_SAV_UserArgs_MT144x256x128_MI16x16x1_SN_LDSB1_CLR1_GRVWA4_GRVWB16_GSU0_GSUC0_GSUWGMRR0_K1_LBSPPA128_LBSPPB512_LPA8_LPB16_LRVW8_MIWT9_4_PLR1_SU0_SUM0_SUS128_VWA1_VWB4_WGM6_WGMXCC1_WGMXCCGn1
    SolutionIndex: 68
    SolutionNameMin: Cijk_Alik_Bljk_B8F8NSS_BH_Bias_HAS_SAV_UserArgs_MT144x256x128_MI16x16x1_SN_LDSB1_CLR1_GRVWA4_GRVWB16_GSU0_GSUC0_GSUWGMRR0_K1_LBSPPA128_LBSPPB512_LPA32_LPB32_LRVW16_MIWT9_4_PLR1_SU0_SUM0_SUS128_VWA1_VWB4_WGM6_WGMXCC1_WGMXCCGn1
    SolutionIndex: 69
    SolutionNameMin: Cijk_Alik_Bljk_B8F8NSS_BH_Bias_HAS_SAV_UserArgs_MT144x256x128_MI16x16x1_SN_LDSB1_CLR1_GRVWA8_GRVWB16_GSU0_GSUC0_GSUWGMRR0_K1_LBSPPA128_LBSPPB512_LPA32_LPB32_LRVW16_MIWT9_4_PLR1_SU0_SUM0_SUS128_VWA1_VWB4_WGM6_WGMXCC1_WGMXCCGn1
    SolutionIndex: 70
    SolutionNameMin: Cijk_Alik_Bljk_B8F8NSS_BH_Bias_HAS_SAV_UserArgs_MT144x256x128_MI16x16x1_SN_LDSB1_CLR1_GRVWA8_GRVWB16_GSU0_GSUC0_GSUWGMRR0_K1_LBSPPA128_LBSPPB512_LPA8_LPB16_LRVW8_MIWT9_4_PLR1_SU0_SUM0_SUS128_VWA1_VWB4_WGM8_WGMXCC1_WGMXCCGn1
    SolutionIndex: 71
    SolutionNameMin: Cijk_Alik_Bljk_B8F8NSS_BH_Bias_HAS_SAV_UserArgs_MT144x256x128_MI16x16x1_SN_LDSB1_CLR1_GRVWA4_GRVWB16_GSU0_GSUC0_GSUWGMRR0_K1_LBSPPA128_LBSPPB512_LPA32_LPB32_LRVW16_MIWT9_4_PLR1_SU0_SUM0_SUS128_VWA1_VWB4_WGM8_WGMXCC1_WGMXCCGn1
    SolutionIndex: 72
    SolutionNameMin: Cijk_Alik_Bljk_B8F8NSS_BH_Bias_HAS_SAV_UserArgs_MT144x256x128_MI16x16x1_SN_LDSB1_CLR1_GRVWA8_GRVWB16_GSU0_GSUC0_GSUWGMRR0_K1_LBSPPA128_LBSPPB512_LPA32_LPB32_LRVW16_MIWT9_4_PLR1_SU0_SUM0_SUS128_VWA1_VWB4_WGM8_WGMXCC1_WGMXCCGn1
    SolutionIndex: 73
    SolutionNameMin: Cijk_Alik_Bljk_B8F8NSS_BH_Bias_HAS_SAV_UserArgs_MT128x128x128_MI16x16x1_SN_LDSB1_CLR1_GRVWA16_GRVWB16_GSU0_GSUC0_GSUWGMRR0_K1_LBSPPA256_LBSPPB1024_LPA32_LPB32_LRVW16_MIWT2_8_PLR1_SU0_SUM0_SUS128_VWA2_VWB8_WGM4_WGMXCC1_WGMXCCGn1
    SolutionIndex: 74
    SolutionNameMin: Cijk_Alik_Bljk_B8F8NSS_BH_Bias_HAS_SAV_UserArgs_MT64x144x128_MI16x16x1_SN_LDSB1_CLR1_GRVWA16_GRVWB8_GSU0_GSUC0_GSUWGMRR0_K1_LBSPPA128_LBSPPB128_LPA32_LPB32_LRVW16_MIWT1_9_PLR1_SU0_SUM0_SUS128_VWA1_VWB1_WGM1_WGMXCC1_WGMXCCGn1
    SolutionIndex: 75
    SolutionNameMin: Cijk_Alik_Bljk_B8F8NSS_BH_Bias_HAS_SAV_UserArgs_MT128x144x128_MI16x16x1_SN_LDSB1_CLR1_GRVWA4_GRVWB4_GSU0_GSUC0_GSUWGMRR0_K1_LBSPPA256_LBSPPB128_LPA32_LPB32_LRVW16_MIWT2_9_PLR1_SU0_SUM0_SUS128_VWA2_VWB1_WGM1_WGMXCC1_WGMXCCGn1
    SolutionIndex: 76
    SolutionNameMin: Cijk_Alik_Bljk_B8F8NSS_BH_Bias_HAS_SAV_UserArgs_MT128x144x128_MI16x16x1_SN_LDSB1_CLR1_GRVWA16_GRVWB4_GSU0_GSUC0_GSUWGMRR0_K1_LBSPPA256_LBSPPB128_LPA32_LPB32_LRVW16_MIWT2_9_PLR1_SU0_SUM0_SUS128_VWA2_VWB1_WGM1_WGMXCC1_WGMXCCGn1
    SolutionIndex: 77
    SolutionNameMin: Cijk_Alik_Bljk_B8F8NSS_BH_Bias_HAS_SAV_UserArgs_MT128x144x128_MI16x16x1_SN_LDSB1_CLR1_GRVWA4_GRVWB8_GSU0_GSUC0_GSUWGMRR0_K1_LBSPPA256_LBSPPB128_LPA32_LPB32_LRVW16_MIWT2_9_PLR1_SU0_SUM0_SUS128_VWA2_VWB1_WGM1_WGMXCC1_WGMXCCGn1
    SolutionIndex: 78
    SolutionNameMin: Cijk_Alik_Bljk_B8F8NSS_BH_Bias_HAS_SAV_UserArgs_MT128x144x128_MI16x16x1_SN_LDSB1_CLR1_GRVWA16_GRVWB8_GSU0_GSUC0_GSUWGMRR0_K1_LBSPPA256_LBSPPB128_LPA32_LPB32_LRVW16_MIWT2_9_PLR1_SU0_SUM0_SUS128_VWA2_VWB1_WGM1_WGMXCC1_WGMXCCGn1
    SolutionIndex: 79
    SolutionNameMin: Cijk_Alik_Bljk_B8F8NSS_BH_Bias_HAS_SAV_UserArgs_MT128x144x128_MI16x16x1_SN_LDSB1_CLR1_GRVWA4_GRVWB8_GSU0_GSUC0_GSUWGMRR0_K1_LBSPPA256_LBSPPB128_LPA8_LPB8_LRVW8_MIWT2_9_PLR1_SU0_SUM0_SUS128_VWA2_VWB1_WGM6_WGMXCC1_WGMXCCGn1
    SolutionIndex: 80
    SolutionNameMin: Cijk_Alik_Bljk_B8F8NSS_BH_Bias_HAS_SAV_UserArgs_MT128x144x128_MI16x16x1_SN_LDSB1_CLR1_GRVWA4_GRVWB4_GSU0_GSUC0_GSUWGMRR0_K1_LBSPPA256_LBSPPB128_LPA32_LPB32_LRVW16_MIWT2_9_PLR1_SU0_SUM0_SUS128_VWA2_VWB1_WGM6_WGMXCC1_WGMXCCGn1
    SolutionIndex: 81
    SolutionNameMin: Cijk_Alik_Bljk_B8F8NSS_BH_Bias_HAS_SAV_UserArgs_MT144x64x128_MI16x16x1_SN_LDSB1_CLR1_GRVWA4_GRVWB16_GSU0_GSUC0_GSUWGMRR0_K1_LBSPPA128_LBSPPB128_LPA8_LPB16_LRVW8_MIWT9_1_PLR1_SU0_SUM0_SUS128_VWA1_VWB1_WGM8_WGMXCC1_WGMXCCGn1
    SolutionIndex: 82
    SolutionNameMin: Cijk_Alik_Bljk_B8F8NSS_BH_Bias_HAS_SAV_UserArgs_MT144x128x128_MI16x16x1_SN_LDSB1_CLR1_GRVWA4_GRVWB16_GSU0_GSUC0_GSUWGMRR0_K1_LBSPPA128_LBSPPB256_LPA32_LPB32_LRVW16_MIWT9_2_PLR1_SU0_SUM0_SUS128_VWA1_VWB2_WGM1_WGMXCC1_WGMXCCGn1
    SolutionIndex: 83
    SolutionNameMin: Cijk_Alik_Bljk_B8F8NSS_BH_Bias_HAS_SAV_UserArgs_MT144x128x128_MI16x16x1_SN_LDSB1_CLR1_GRVWA4_GRVWB16_GSU0_GSUC0_GSUWGMRR0_K1_LBSPPA128_LBSPPB256_LPA8_LPB16_LRVW8_MIWT9_2_PLR1_SU0_SUM0_SUS128_VWA1_VWB2_WGM4_WGMXCC1_WGMXCCGn1
    SolutionIndex: 84
    SolutionNameMin: Cijk_Alik_Bljk_B8F8NSS_BH_Bias_HAS_SAV_UserArgs_MT144x128x128_MI16x16x1_SN_LDSB1_CLR1_GRVWA4_GRVWB16_GSU0_GSUC0_GSUWGMRR0_K1_LBSPPA128_LBSPPB256_LPA32_LPB32_LRVW16_MIWT9_2_PLR1_SU0_SUM0_SUS128_VWA1_VWB2_WGM4_WGMXCC1_WGMXCCGn1
    SolutionIndex: 85
    SolutionNameMin: Cijk_Alik_Bljk_B8F8NSS_BH_Bias_HAS_SAV_UserArgs_MT144x128x128_MI16x16x1_SN_LDSB1_CLR1_GRVWA4_GRVWB4_GSU0_GSUC0_GSUWGMRR0_K1_LBSPPA128_LBSPPB256_LPA32_LPB32_LRVW16_MIWT9_2_PLR1_SU0_SUM0_SUS128_VWA1_VWB2_WGM6_WGMXCC1_WGMXCCGn1
    SolutionIndex: 86
    SolutionNameMin: Cijk_Alik_Bljk_B8F8NSS_BH_Bias_HAS_SAV_UserArgs_MT144x128x128_MI16x16x1_SN_LDSB1_CLR1_GRVWA4_GRVWB16_GSU0_GSUC0_GSUWGMRR0_K1_LBSPPA128_LBSPPB256_LPA32_LPB32_LRVW16_MIWT9_2_PLR1_SU0_SUM0_SUS128_VWA1_VWB2_WGM6_WGMXCC1_WGMXCCGn1
    SolutionIndex: 87
    SolutionNameMin: Cijk_Alik_Bljk_B8F8NSS_BH_Bias_HAS_SAV_UserArgs_MT144x128x128_MI16x16x1_SN_LDSB1_CLR1_GRVWA8_GRVWB16_GSU0_GSUC0_GSUWGMRR0_K1_LBSPPA128_LBSPPB256_LPA32_LPB32_LRVW16_MIWT9_2_PLR1_SU0_SUM0_SUS128_VWA1_VWB2_WGM6_WGMXCC1_WGMXCCGn1
    SolutionIndex: 88
    SolutionNameMin: Cijk_Alik_Bljk_B8F8NSS_BH_Bias_HAS_SAV_UserArgs_MT144x128x128_MI16x16x1_SN_LDSB1_CLR1_GRVWA8_GRVWB16_GSU0_GSUC0_GSUWGMRR0_K1_LBSPPA128_LBSPPB256_LPA8_LPB16_LRVW8_MIWT9_2_PLR1_SU0_SUM0_SUS128_VWA1_VWB2_WGM8_WGMXCC1_WGMXCCGn1
    SolutionIndex: 89
    SolutionNameMin: Cijk_Alik_Bljk_B8F8NSS_BH_Bias_HAS_SAV_UserArgs_MT144x128x128_MI16x16x1_SN_LDSB1_CLR1_GRVWA4_GRVWB16_GSU0_GSUC0_GSUWGMRR0_K1_LBSPPA128_LBSPPB256_LPA32_LPB32_LRVW16_MIWT9_2_PLR1_SU0_SUM0_SUS128_VWA1_VWB2_WGM8_WGMXCC1_WGMXCCGn1
    SolutionIndex: 90
    SolutionNameMin: Cijk_Alik_Bljk_B8F8NSS_BH_Bias_HAS_SAV_UserArgs_MT128x128x128_MI16x16x1_SN_LDSB1_CLR1_GRVWA4_GRVWB16_GSU0_GSUC0_GSUWGMRR0_K1_LBSPPA512_LBSPPB512_LPA32_LPB32_LRVW16_MIWT4_4_PLR1_SU0_SUM0_SUS128_VWA4_VWB4_WGM1_WGMXCC1_WGMXCCGn1
    SolutionIndex: 91
    SolutionNameMin: Cijk_Alik_Bljk_B8F8NSS_BH_Bias_HAS_SAV_UserArgs_MT128x128x128_MI16x16x1_SN_LDSB1_CLR1_GRVWA16_GRVWB16_GSU0_GSUC0_GSUWGMRR0_K1_LBSPPA512_LBSPPB512_LPA32_LPB32_LRVW16_MIWT4_4_PLR1_SU0_SUM0_SUS128_VWA4_VWB4_WGM1_WGMXCC1_WGMXCCGn1
    SolutionIndex: 92
    SolutionNameMin: Cijk_Alik_Bljk_B8F8NSS_BH_Bias_HAS_SAV_UserArgs_MT128x128x128_MI16x16x1_SN_LDSB1_CLR1_GRVWA4_GRVWB16_GSU0_GSUC0_GSUWGMRR0_K1_LBSPPA512_LBSPPB512_LPA32_LPB32_LRVW16_MIWT4_4_PLR1_SU0_SUM0_SUS128_VWA4_VWB4_WGM4_WGMXCC1_WGMXCCGn1
    SolutionIndex: 93
    SolutionNameMin: Cijk_Alik_Bljk_B8F8NSS_BH_Bias_HAS_SAV_UserArgs_MT128x128x128_MI16x16x1_SN_LDSB1_CLR1_GRVWA16_GRVWB16_GSU0_GSUC0_GSUWGMRR0_K1_LBSPPA512_LBSPPB512_LPA32_LPB32_LRVW16_MIWT4_4_PLR1_SU0_SUM0_SUS128_VWA4_VWB4_WGM4_WGMXCC1_WGMXCCGn1
    SolutionIndex: 94
    SolutionNameMin: Cijk_Alik_Bljk_B8F8NSS_BH_Bias_HAS_SAV_UserArgs_MT128x128x128_MI16x16x1_SN_LDSB1_CLR1_GRVWA16_GRVWB16_GSU0_GSUC0_GSUWGMRR0_K1_LBSPPA512_LBSPPB512_LPA32_LPB32_LRVW16_MIWT4_4_PLR1_SU0_SUM0_SUS128_VWA4_VWB4_WGM6_WGMXCC1_WGMXCCGn1
    SolutionIndex: 95
    SolutionNameMin: Cijk_Alik_Bljk_B8F8NSS_BH_Bias_HAS_SAV_UserArgs_MT128x128x128_MI16x16x1_SN_LDSB1_CLR1_GRVWA4_GRVWB16_GSU0_GSUC0_GSUWGMRR0_K1_LBSPPA512_LBSPPB512_LPA32_LPB32_LRVW16_MIWT4_4_PLR1_SU0_SUM0_SUS128_VWA4_VWB4_WGM8_WGMXCC1_WGMXCCGn1
    SolutionIndex: 96
    SolutionNameMin: Cijk_Alik_Bljk_B8F8NSS_BH_Bias_HAS_SAV_UserArgs_MT128x128x128_MI16x16x1_SN_LDSB1_CLR1_GRVWA16_GRVWB16_GSU0_GSUC0_GSUWGMRR0_K1_LBSPPA512_LBSPPB512_LPA32_LPB32_LRVW16_MIWT4_4_PLR1_SU0_SUM0_SUS128_VWA4_VWB4_WGM8_WGMXCC1_WGMXCCGn1
    SolutionIndex: 97
    SolutionNameMin: Cijk_Alik_Bljk_B8F8NSS_BH_Bias_HAS_SAV_UserArgs_MT64x128x128_MI16x16x1_SN_LDSB1_CLR1_GRVWA16_GRVWB16_GSU0_GSUC0_GSUWGMRR0_K1_LBSPPA256_LBSPPB512_LPA32_LPB32_LRVW16_MIWT2_4_PLR1_SU0_SUM0_SUS128_VWA2_VWB4_WGM1_WGMXCC1_WGMXCCGn1
    SolutionIndex: 98
    SolutionNameMin: Cijk_Alik_Bljk_B8F8NSS_BH_Bias_HAS_SAV_UserArgs_MT128x64x128_MI16x16x1_SN_LDSB1_CLR1_GRVWA16_GRVWB8_GSU0_GSUC0_GSUWGMRR0_K1_LBSPPA512_LBSPPB256_LPA32_LPB32_LRVW16_MIWT4_2_PLR1_SU0_SUM0_SUS128_VWA4_VWB2_WGM1_WGMXCC1_WGMXCCGn1
    SolutionIndex: 99
    SolutionNameMin: Cijk_Alik_Bljk_B8F8NSS_BH_Bias_HAS_SAV_UserArgs_MT128x64x128_MI16x16x1_SN_LDSB1_CLR1_GRVWA16_GRVWB16_GSU0_GSUC0_GSUWGMRR0_K1_LBSPPA512_LBSPPB256_LPA32_LPB32_LRVW16_MIWT4_2_PLR1_SU0_SUM0_SUS128_VWA4_VWB2_WGM1_WGMXCC1_WGMXCCGn1
    SolutionIndex: 100
    SolutionNameMin: Cijk_Alik_Bljk_B8F8NSS_BH_Bias_HAS_SAV_UserArgs_MT128x64x128_MI16x16x1_SN_LDSB1_CLR1_GRVWA4_GRVWB16_GSU0_GSUC0_GSUWGMRR0_K1_LBSPPA512_LBSPPB256_LPA32_LPB32_LRVW16_MIWT4_2_PLR1_SU0_SUM0_SUS128_VWA4_VWB2_WGM4_WGMXCC1_WGMXCCGn1
    SolutionIndex: 101
    SolutionNameMin: Cijk_Alik_Bljk_B8F8NSS_BH_Bias_HAS_SAV_UserArgs_MT128x64x128_MI16x16x1_SN_LDSB1_CLR1_GRVWA16_GRVWB16_GSU0_GSUC0_GSUWGMRR0_K1_LBSPPA512_LBSPPB256_LPA32_LPB32_LRVW16_MIWT4_2_PLR1_SU0_SUM0_SUS128_VWA4_VWB2_WGM4_WGMXCC1_WGMXCCGn1
    SolutionIndex: 102
    SolutionNameMin: Cijk_Alik_Bljk_B8F8NSS_BH_Bias_HAS_SAV_UserArgs_MT128x64x128_MI16x16x1_SN_LDSB1_CLR1_GRVWA16_GRVWB16_GSU0_GSUC0_GSUWGMRR0_K1_LBSPPA512_LBSPPB256_LPA32_LPB32_LRVW16_MIWT4_2_PLR1_SU0_SUM0_SUS128_VWA4_VWB2_WGM6_WGMXCC1_WGMXCCGn1
    SolutionIndex: 103
    SolutionNameMin: Cijk_Alik_Bljk_B8F8NSS_BH_Bias_HAS_SAV_UserArgs_MT128x64x128_MI16x16x1_SN_LDSB1_CLR1_GRVWA16_GRVWB16_GSU0_GSUC0_GSUWGMRR0_K1_LBSPPA512_LBSPPB256_LPA32_LPB32_LRVW16_MIWT4_2_PLR1_SU0_SUM0_SUS128_VWA4_VWB2_WGM8_WGMXCC1_WGMXCCGn1
    SolutionIndex: 104
    SolutionNameMin: Cijk_Alik_Bljk_B8F8NSS_BH_Bias_HAS_SAV_UserArgs_MT64x64x128_MI16x16x1_SN_LDSB1_CLR1_GRVWA8_GRVWB16_GSU0_GSUC0_GSUWGMRR0_K1_LBSPPA256_LBSPPB256_LPA32_LPB32_LRVW16_MIWT2_2_PLR1_SU0_SUM0_SUS128_VWA2_VWB2_WGM1_WGMXCC1_WGMXCCGn1
    SolutionIndex: 105
    SolutionNameMin: Cijk_Alik_Bljk_B8F8NSS_BH_Bias_HAS_SAV_UserArgs_MT64x64x128_MI16x16x1_SN_LDSB1_CLR1_GRVWA16_GRVWB16_GSU0_GSUC0_GSUWGMRR0_K1_LBSPPA256_LBSPPB256_LPA32_LPB32_LRVW16_MIWT2_2_PLR1_SU0_SUM0_SUS128_VWA2_VWB2_WGM1_WGMXCC1_WGMXCCGn1
    SolutionIndex: 106
    SolutionNameMin: Cijk_Alik_Bljk_B8F8NSS_BH_Bias_HAS_SAV_UserArgs_MT64x64x128_MI16x16x1_SN_LDSB1_CLR1_GRVWA16_GRVWB16_GSU0_GSUC0_GSUWGMRR0_K1_LBSPPA256_LBSPPB256_LPA32_LPB32_LRVW16_MIWT2_2_PLR1_SU0_SUM0_SUS128_VWA2_VWB2_WGM4_WGMXCC1_WGMXCCGn1
    SolutionIndex: 107
    SolutionNameMin: Cijk_Alik_Bljk_B8F8NSS_BH_Bias_HAS_SAV_UserArgs_MT64x64x128_MI16x16x1_SN_LDSB1_CLR1_GRVWA16_GRVWB16_GSU0_GSUC0_GSUWGMRR0_K1_LBSPPA256_LBSPPB256_LPA32_LPB32_LRVW16_MIWT2_2_PLR1_SU0_SUM0_SUS128_VWA2_VWB2_WGM6_WGMXCC1_WGMXCCGn1
    SolutionIndex: 108
    SolutionNameMin: Cijk_Alik_Bljk_B8F8NSS_BH_Bias_HAS_SAV_UserArgs_MT32x64x128_MI16x16x1_SN_LDSB0_CLR1_GRVWA16_GRVWB4_GSU0_GSUC0_GSUWGMRR0_K1_LBSPPA128_LBSPPB256_LPA32_LPB32_LRVW16_MIWT1_2_PLR1_SU0_SUM0_SUS128_VWA1_VWB2_WGM1_WGMXCC1_WGMXCCGn1
    SolutionIndex: 109
    SolutionNameMin: Cijk_Alik_Bljk_B8F8NSS_BH_Bias_HAS_SAV_UserArgs_MT32x64x128_MI16x16x1_SN_LDSB0_CLR1_GRVWA4_GRVWB8_GSU0_GSUC0_GSUWGMRR0_K1_LBSPPA128_LBSPPB256_LPA32_LPB32_LRVW16_MIWT1_2_PLR1_SU0_SUM0_SUS128_VWA1_VWB2_WGM1_WGMXCC1_WGMXCCGn1
    SolutionIndex: 110
    SolutionNameMin: Cijk_Alik_Bljk_B8F8NSS_BH_Bias_HAS_SAV_UserArgs_MT32x64x128_MI16x16x1_SN_LDSB0_CLR1_GRVWA8_GRVWB16_GSU0_GSUC0_GSUWGMRR0_K1_LBSPPA128_LBSPPB256_LPA32_LPB32_LRVW16_MIWT1_2_PLR1_SU0_SUM0_SUS128_VWA1_VWB2_WGM1_WGMXCC1_WGMXCCGn1
    SolutionIndex: 111
    SolutionNameMin: Cijk_Alik_Bljk_B8F8NSS_BH_Bias_HAS_SAV_UserArgs_MT32x64x128_MI16x16x1_SN_LDSB0_CLR1_GRVWA16_GRVWB16_GSU0_GSUC0_GSUWGMRR0_K1_LBSPPA128_LBSPPB256_LPA32_LPB32_LRVW16_MIWT1_2_PLR1_SU0_SUM0_SUS128_VWA1_VWB2_WGM1_WGMXCC1_WGMXCCGn1
    SolutionIndex: 112
    SolutionNameMin: Cijk_Alik_Bljk_B8F8NSS_BH_Bias_HAS_SAV_UserArgs_MT32x64x128_MI16x16x1_SN_LDSB0_CLR1_GRVWA8_GRVWB16_GSU0_GSUC0_GSUWGMRR0_K1_LBSPPA128_LBSPPB256_LPA32_LPB32_LRVW16_MIWT1_2_PLR1_SU0_SUM0_SUS128_VWA1_VWB2_WGM4_WGMXCC1_WGMXCCGn1
    SolutionIndex: 113
    SolutionNameMin: Cijk_Alik_Bljk_B8F8NSS_BH_Bias_HAS_SAV_UserArgs_MT32x64x128_MI16x16x1_SN_LDSB0_CLR1_GRVWA16_GRVWB16_GSU0_GSUC0_GSUWGMRR0_K1_LBSPPA128_LBSPPB256_LPA32_LPB32_LRVW16_MIWT1_2_PLR1_SU0_SUM0_SUS128_VWA1_VWB2_WGM6_WGMXCC1_WGMXCCGn1
    SolutionIndex: 114
    SolutionNameMin: Cijk_Alik_Bljk_B8F8NSS_BH_Bias_HAS_SAV_UserArgs_MT32x64x128_MI16x16x1_SN_LDSB0_CLR1_GRVWA16_GRVWB16_GSU0_GSUC0_GSUWGMRR0_K1_LBSPPA128_LBSPPB256_LPA32_LPB32_LRVW16_MIWT1_2_PLR1_SU0_SUM0_SUS128_VWA1_VWB2_WGM8_WGMXCC1_WGMXCCGn1
    SolutionIndex: 115
    SolutionNameMin: Cijk_Alik_Bljk_B8F8NSS_BH_Bias_HAS_SAV_UserArgs_MT64x32x128_MI16x16x1_SN_LDSB0_CLR1_GRVWA16_GRVWB4_GSU0_GSUC0_GSUWGMRR0_K1_LBSPPA256_LBSPPB128_LPA32_LPB32_LRVW16_MIWT2_1_PLR1_SU0_SUM0_SUS128_VWA2_VWB1_WGM1_WGMXCC1_WGMXCCGn1
    SolutionIndex: 116
    SolutionNameMin: Cijk_Alik_Bljk_B8F8NSS_BH_Bias_HAS_SAV_UserArgs_MT64x32x128_MI16x16x1_SN_LDSB0_CLR1_GRVWA16_GRVWB8_GSU0_GSUC0_GSUWGMRR0_K1_LBSPPA256_LBSPPB128_LPA32_LPB32_LRVW16_MIWT2_1_PLR1_SU0_SUM0_SUS128_VWA2_VWB1_WGM1_WGMXCC1_WGMXCCGn1
    SolutionIndex: 117
    SolutionNameMin: Cijk_Alik_Bljk_B8F8NSS_BH_Bias_HAS_SAV_UserArgs_MT64x32x128_MI16x16x1_SN_LDSB0_CLR1_GRVWA8_GRVWB16_GSU0_GSUC0_GSUWGMRR0_K1_LBSPPA256_LBSPPB128_LPA32_LPB32_LRVW16_MIWT2_1_PLR1_SU0_SUM0_SUS128_VWA2_VWB1_WGM1_WGMXCC1_WGMXCCGn1
    SolutionIndex: 118
    SolutionNameMin: Cijk_Alik_Bljk_B8F8NSS_BH_Bias_HAS_SAV_UserArgs_MT64x32x128_MI16x16x1_SN_LDSB0_CLR1_GRVWA16_GRVWB16_GSU0_GSUC0_GSUWGMRR0_K1_LBSPPA256_LBSPPB128_LPA32_LPB32_LRVW16_MIWT2_1_PLR1_SU0_SUM0_SUS128_VWA2_VWB1_WGM1_WGMXCC1_WGMXCCGn1
    SolutionIndex: 119
    SolutionNameMin: Cijk_Alik_Bljk_B8F8NSS_BH_Bias_HAS_SAV_UserArgs_MT32x32x128_MI16x16x1_SN_LDSB0_CLR1_GRVWA16_GRVWB8_GSU0_GSUC0_GSUWGMRR0_K1_LBSPPA128_LBSPPB128_LPA16_LPB8_LRVW8_MIWT1_1_PLR1_SU0_SUM0_SUS128_VWA1_VWB1_WGM1_WGMXCC1_WGMXCCGn1
    SolutionIndex: 120
    SolutionNameMin: Cijk_Alik_Bljk_B8F8NSS_BH_Bias_HAS_SAV_UserArgs_MT32x32x128_MI16x16x1_SN_LDSB0_CLR1_GRVWA16_GRVWB4_GSU0_GSUC0_GSUWGMRR0_K1_LBSPPA128_LBSPPB128_LPA32_LPB32_LRVW16_MIWT1_1_PLR1_SU0_SUM0_SUS128_VWA1_VWB1_WGM1_WGMXCC1_WGMXCCGn1
    SolutionIndex: 121
    SolutionNameMin: Cijk_Alik_Bljk_B8F8NSS_BH_Bias_HAS_SAV_UserArgs_MT32x32x128_MI16x16x1_SN_LDSB0_CLR1_GRVWA8_GRVWB8_GSU0_GSUC0_GSUWGMRR0_K1_LBSPPA128_LBSPPB128_LPA32_LPB32_LRVW16_MIWT1_1_PLR1_SU0_SUM0_SUS128_VWA1_VWB1_WGM1_WGMXCC1_WGMXCCGn1
    SolutionIndex: 122
    SolutionNameMin: Cijk_Alik_Bljk_B8F8NSS_BH_Bias_HAS_SAV_UserArgs_MT32x32x128_MI16x16x1_SN_LDSB0_CLR1_GRVWA16_GRVWB8_GSU0_GSUC0_GSUWGMRR0_K1_LBSPPA128_LBSPPB128_LPA32_LPB32_LRVW16_MIWT1_1_PLR1_SU0_SUM0_SUS128_VWA1_VWB1_WGM1_WGMXCC1_WGMXCCGn1
    SolutionIndex: 123
    SolutionNameMin: Cijk_Alik_Bljk_B8F8NSS_BH_Bias_HAS_SAV_UserArgs_MT32x32x128_MI16x16x1_SN_LDSB0_CLR1_GRVWA4_GRVWB16_GSU0_GSUC0_GSUWGMRR0_K1_LBSPPA128_LBSPPB128_LPA32_LPB32_LRVW16_MIWT1_1_PLR1_SU0_SUM0_SUS128_VWA1_VWB1_WGM1_WGMXCC1_WGMXCCGn1
    SolutionIndex: 124
    SolutionNameMin: Cijk_Alik_Bljk_B8F8NSS_BH_Bias_HAS_SAV_UserArgs_MT32x32x128_MI16x16x1_SN_LDSB0_CLR1_GRVWA8_GRVWB16_GSU0_GSUC0_GSUWGMRR0_K1_LBSPPA128_LBSPPB128_LPA32_LPB32_LRVW16_MIWT1_1_PLR1_SU0_SUM0_SUS128_VWA1_VWB1_WGM1_WGMXCC1_WGMXCCGn1
    SolutionIndex: 125
    SolutionNameMin: Cijk_Alik_Bljk_B8F8NSS_BH_Bias_HAS_SAV_UserArgs_MT32x32x128_MI16x16x1_SN_LDSB0_CLR1_GRVWA16_GRVWB16_GSU0_GSUC0_GSUWGMRR0_K1_LBSPPA128_LBSPPB128_LPA32_LPB32_LRVW16_MIWT1_1_PLR1_SU0_SUM0_SUS128_VWA1_VWB1_WGM1_WGMXCC1_WGMXCCGn1
    SolutionIndex: 126
    SolutionNameMin: Cijk_Alik_Bljk_B8F8NSS_BH_Bias_HAS_SAV_UserArgs_MT32x32x128_MI16x16x1_SN_LDSB0_CLR1_GRVWA16_GRVWB16_GSU0_GSUC0_GSUWGMRR0_K1_LBSPPA128_LBSPPB128_LPA32_LPB32_LRVW16_MIWT1_1_PLR1_SU0_SUM0_SUS128_VWA1_VWB1_WGM4_WGMXCC1_WGMXCCGn1
    SolutionIndex: 127
    SolutionNameMin: Cijk_Alik_Bljk_B8F8NSS_BH_Bias_HAS_SAV_UserArgs_MT32x32x128_MI16x16x1_SN_LDSB0_CLR1_GRVWA16_GRVWB4_GSU0_GSUC0_GSUWGMRR0_K1_LBSPPA128_LBSPPB128_LPA16_LPB8_LRVW8_MIWT1_1_PLR1_SU0_SUM0_SUS128_VWA1_VWB1_WGM6_WGMXCC1_WGMXCCGn1
    SolutionIndex: 128
    SolutionNameMin: Cijk_Alik_Bljk_B8F8NSS_BH_Bias_HAS_SAV_UserArgs_MT32x32x128_MI16x16x1_SN_LDSB0_CLR1_GRVWA16_GRVWB16_GSU0_GSUC0_GSUWGMRR0_K1_LBSPPA128_LBSPPB128_LPA32_LPB32_LRVW16_MIWT1_1_PLR1_SU0_SUM0_SUS128_VWA1_VWB1_WGM6_WGMXCC1_WGMXCCGn1
    SolutionIndex: 129
    SolutionNameMin: Cijk_Alik_Bljk_B8F8NSS_BH_Bias_HAS_SAV_UserArgs_MT32x32x128_MI16x16x1_SN_LDSB0_CLR1_GRVWA4_GRVWB16_GSU0_GSUC0_GSUWGMRR0_K1_LBSPPA128_LBSPPB128_LPA8_LPB16_LRVW8_MIWT1_1_PLR1_SU0_SUM0_SUS128_VWA1_VWB1_WGM8_WGMXCC1_WGMXCCGn1
    SolutionIndex: 130
    SolutionNameMin: Cijk_Alik_Bljk_B8F8NSS_BH_Bias_HAS_SAV_UserArgs_MT32x32x128_MI16x16x1_SN_LDSB0_CLR1_GRVWA4_GRVWB4_GSU0_GSUC0_GSUWGMRR0_K1_LBSPPA128_LBSPPB128_LPA32_LPB32_LRVW16_MIWT1_1_PLR1_SU0_SUM0_SUS128_VWA1_VWB1_WGM8_WGMXCC1_WGMXCCGn1
    SolutionIndex: 131
    SolutionNameMin: Cijk_Alik_Bljk_B8F8NSS_BH_Bias_HAS_SAV_UserArgs_MT32x32x128_MI16x16x1_SN_LDSB0_CLR1_GRVWA8_GRVWB4_GSU0_GSUC0_GSUWGMRR0_K1_LBSPPA128_LBSPPB128_LPA32_LPB32_LRVW16_MIWT1_1_PLR1_SU0_SUM0_SUS128_VWA1_VWB1_WGM8_WGMXCC1_WGMXCCGn1
    SolutionIndex: 132
    SolutionNameMin: Cijk_Alik_Bljk_B8F8NSS_BH_Bias_HAS_SAV_UserArgs_MT32x32x128_MI16x16x1_SN_LDSB0_CLR1_GRVWA16_GRVWB16_GSU0_GSUC0_GSUWGMRR0_K1_LBSPPA128_LBSPPB128_LPA32_LPB32_LRVW16_MIWT1_1_PLR1_SU0_SUM0_SUS128_VWA1_VWB1_WGM8_WGMXCC1_WGMXCCGn1
    SolutionIndex: 133
    SolutionNameMin: Cijk_Alik_Bljk_B8F8NSS_BH_Bias_HAS_SAV_UserArgs_MT64x144x256_MI16x16x1_SN_LDSB1_CLR1_GRVWA4_GRVWB16_GSU0_GSUC0_GSUWGMRR0_K1_LBSPPA256_LBSPPB256_LPA32_LPB32_LRVW16_MIWT1_9_PLR1_SU0_SUM0_SUS256_VWA1_VWB1_WGM1_WGMXCC1_WGMXCCGn1
    SolutionIndex: 134
    SolutionNameMin: Cijk_Alik_Bljk_B8F8NSS_BH_Bias_HAS_SAV_UserArgs_MT64x144x256_MI16x16x1_SN_LDSB1_CLR1_GRVWA16_GRVWB16_GSU0_GSUC0_GSUWGMRR0_K1_LBSPPA256_LBSPPB256_LPA32_LPB32_LRVW16_MIWT1_9_PLR1_SU0_SUM0_SUS256_VWA1_VWB1_WGM1_WGMXCC1_WGMXCCGn1
    SolutionIndex: 135
    SolutionNameMin: Cijk_Alik_Bljk_B8F8NSS_BH_Bias_HAS_SAV_UserArgs_MT144x64x256_MI16x16x1_SN_LDSB1_CLR1_GRVWA16_GRVWB16_GSU0_GSUC0_GSUWGMRR0_K1_LBSPPA256_LBSPPB256_LPA32_LPB32_LRVW16_MIWT9_1_PLR1_SU0_SUM0_SUS256_VWA1_VWB1_WGM6_WGMXCC1_WGMXCCGn1
    SolutionIndex: 136
    SolutionNameMin: Cijk_Alik_Bljk_B8F8NSS_BH_Bias_HAS_SAV_UserArgs_MT144x64x256_MI16x16x1_SN_LDSB1_CLR1_GRVWA16_GRVWB16_GSU0_GSUC0_GSUWGMRR0_K1_LBSPPA256_LBSPPB256_LPA32_LPB32_LRVW16_MIWT9_1_PLR1_SU0_SUM0_SUS256_VWA1_VWB1_WGM8_WGMXCC1_WGMXCCGn1
    SolutionIndex: 137
    SolutionNameMin: Cijk_Alik_Bljk_B8F8NSS_BH_Bias_HAS_SAV_UserArgs_MT64x128x256_MI16x16x1_SN_LDSB1_CLR1_GRVWA4_GRVWB16_GSU0_GSUC0_GSUWGMRR0_K1_LBSPPA512_LBSPPB1024_LPA32_LPB32_LRVW16_MIWT2_4_PLR1_SU0_SUM0_SUS256_VWA2_VWB4_WGM1_WGMXCC1_WGMXCCGn1
    SolutionIndex: 138
    SolutionNameMin: Cijk_Alik_Bljk_B8F8NSS_BH_Bias_HAS_SAV_UserArgs_MT64x128x256_MI16x16x1_SN_LDSB1_CLR1_GRVWA16_GRVWB16_GSU0_GSUC0_GSUWGMRR0_K1_LBSPPA512_LBSPPB1024_LPA32_LPB32_LRVW16_MIWT2_4_PLR1_SU0_SUM0_SUS256_VWA2_VWB4_WGM1_WGMXCC1_WGMXCCGn1
    SolutionIndex: 139
    SolutionNameMin: Cijk_Alik_Bljk_B8F8NSS_BH_Bias_HAS_SAV_UserArgs_MT64x128x256_MI16x16x1_SN_LDSB1_CLR1_GRVWA16_GRVWB16_GSU0_GSUC0_GSUWGMRR0_K1_LBSPPA512_LBSPPB1024_LPA32_LPB32_LRVW16_MIWT2_4_PLR1_SU0_SUM0_SUS256_VWA2_VWB4_WGM4_WGMXCC1_WGMXCCGn1
    SolutionIndex: 140
    SolutionNameMin: Cijk_Alik_Bljk_B8F8NSS_BH_Bias_HAS_SAV_UserArgs_MT64x128x256_MI16x16x1_SN_LDSB1_CLR1_GRVWA16_GRVWB16_GSU0_GSUC0_GSUWGMRR0_K1_LBSPPA512_LBSPPB1024_LPA32_LPB32_LRVW16_MIWT2_4_PLR1_SU0_SUM0_SUS256_VWA2_VWB4_WGM6_WGMXCC1_WGMXCCGn1
    SolutionIndex: 141
    SolutionNameMin: Cijk_Alik_Bljk_B8F8NSS_BH_Bias_HAS_SAV_UserArgs_MT64x128x256_MI16x16x1_SN_LDSB1_CLR1_GRVWA16_GRVWB16_GSU0_GSUC0_GSUWGMRR0_K1_LBSPPA512_LBSPPB1024_LPA32_LPB32_LRVW16_MIWT2_4_PLR1_SU0_SUM0_SUS256_VWA2_VWB4_WGM8_WGMXCC1_WGMXCCGn1
    SolutionIndex: 142
    SolutionNameMin: Cijk_Alik_Bljk_B8F8NSS_BH_Bias_HAS_SAV_UserArgs_MT128x64x256_MI16x16x1_SN_LDSB1_CLR1_GRVWA16_GRVWB16_GSU0_GSUC0_GSUWGMRR0_K1_LBSPPA1024_LBSPPB512_LPA32_LPB32_LRVW16_MIWT4_2_PLR1_SU0_SUM0_SUS256_VWA4_VWB2_WGM1_WGMXCC1_WGMXCCGn1
    SolutionIndex: 143
    SolutionNameMin: Cijk_Alik_Bljk_B8F8NSS_BH_Bias_HAS_SAV_UserArgs_MT128x64x256_MI16x16x1_SN_LDSB1_CLR1_GRVWA16_GRVWB16_GSU0_GSUC0_GSUWGMRR0_K1_LBSPPA1024_LBSPPB512_LPA32_LPB32_LRVW16_MIWT4_2_PLR1_SU0_SUM0_SUS256_VWA4_VWB2_WGM4_WGMXCC1_WGMXCCGn1
    SolutionIndex: 144
    SolutionNameMin: Cijk_Alik_Bljk_B8F8NSS_BH_Bias_HAS_SAV_UserArgs_MT128x64x256_MI16x16x1_SN_LDSB1_CLR1_GRVWA16_GRVWB16_GSU0_GSUC0_GSUWGMRR0_K1_LBSPPA1024_LBSPPB512_LPA32_LPB32_LRVW16_MIWT4_2_PLR1_SU0_SUM0_SUS256_VWA4_VWB2_WGM6_WGMXCC1_WGMXCCGn1
    SolutionIndex: 145
    SolutionNameMin: Cijk_Alik_Bljk_B8F8NSS_BH_Bias_HAS_SAV_UserArgs_MT128x64x256_MI16x16x1_SN_LDSB1_CLR1_GRVWA16_GRVWB16_GSU0_GSUC0_GSUWGMRR0_K1_LBSPPA1024_LBSPPB512_LPA32_LPB32_LRVW16_MIWT4_2_PLR1_SU0_SUM0_SUS256_VWA4_VWB2_WGM8_WGMXCC1_WGMXCCGn1
    SolutionIndex: 146
    SolutionNameMin: Cijk_Alik_Bljk_B8F8NSS_BH_Bias_HAS_SAV_UserArgs_MT64x64x256_MI16x16x1_SN_LDSB1_CLR1_GRVWA16_GRVWB16_GSU0_GSUC0_GSUWGMRR0_K1_LBSPPA512_LBSPPB512_LPA32_LPB32_LRVW16_MIWT2_2_PLR1_SU0_SUM0_SUS256_VWA2_VWB2_WGM1_WGMXCC1_WGMXCCGn1
    SolutionIndex: 147
    SolutionNameMin: Cijk_Alik_Bljk_B8F8NSS_BH_Bias_HAS_SAV_UserArgs_MT64x64x256_MI16x16x1_SN_LDSB1_CLR1_GRVWA16_GRVWB16_GSU0_GSUC0_GSUWGMRR0_K1_LBSPPA512_LBSPPB512_LPA32_LPB32_LRVW16_MIWT2_2_PLR1_SU0_SUM0_SUS256_VWA2_VWB2_WGM4_WGMXCC1_WGMXCCGn1
    SolutionIndex: 148
    SolutionNameMin: Cijk_Alik_Bljk_B8F8NSS_BH_Bias_HAS_SAV_UserArgs_MT64x64x256_MI16x16x1_SN_LDSB1_CLR1_GRVWA16_GRVWB16_GSU0_GSUC0_GSUWGMRR0_K1_LBSPPA512_LBSPPB512_LPA32_LPB32_LRVW16_MIWT2_2_PLR1_SU0_SUM0_SUS256_VWA2_VWB2_WGM6_WGMXCC1_WGMXCCGn1
    SolutionIndex: 149
    SolutionNameMin: Cijk_Alik_Bljk_B8F8NSS_BH_Bias_HAS_SAV_UserArgs_MT64x64x256_MI16x16x1_SN_LDSB1_CLR1_GRVWA16_GRVWB16_GSU0_GSUC0_GSUWGMRR0_K1_LBSPPA512_LBSPPB512_LPA32_LPB32_LRVW16_MIWT2_2_PLR1_SU0_SUM0_SUS256_VWA2_VWB2_WGM8_WGMXCC1_WGMXCCGn1
    SolutionIndex: 150
    SolutionNameMin: Cijk_Alik_Bljk_B8F8NSS_BH_Bias_HAS_SAV_UserArgs_MT32x64x256_MI16x16x1_SN_LDSB1_CLR1_GRVWA16_GRVWB16_GSU0_GSUC0_GSUWGMRR0_K1_LBSPPA256_LBSPPB512_LPA32_LPB32_LRVW16_MIWT1_2_PLR1_SU0_SUM0_SUS256_VWA1_VWB2_WGM1_WGMXCC1_WGMXCCGn1
    SolutionIndex: 151
    SolutionNameMin: Cijk_Alik_Bljk_B8F8NSS_BH_Bias_HAS_SAV_UserArgs_MT32x64x256_MI16x16x1_SN_LDSB1_CLR1_GRVWA16_GRVWB16_GSU0_GSUC0_GSUWGMRR0_K1_LBSPPA256_LBSPPB512_LPA32_LPB32_LRVW16_MIWT1_2_PLR1_SU0_SUM0_SUS256_VWA1_VWB2_WGM4_WGMXCC1_WGMXCCGn1
    SolutionIndex: 152
    SolutionNameMin: Cijk_Alik_Bljk_B8F8NSS_BH_Bias_HAS_SAV_UserArgs_MT32x64x256_MI16x16x1_SN_LDSB1_CLR1_GRVWA16_GRVWB16_GSU0_GSUC0_GSUWGMRR0_K1_LBSPPA256_LBSPPB512_LPA32_LPB32_LRVW16_MIWT1_2_PLR1_SU0_SUM0_SUS256_VWA1_VWB2_WGM6_WGMXCC1_WGMXCCGn1
    SolutionIndex: 153
    SolutionNameMin: Cijk_Alik_Bljk_B8F8NSS_BH_Bias_HAS_SAV_UserArgs_MT64x32x256_MI16x16x1_SN_LDSB1_CLR1_GRVWA16_GRVWB16_GSU0_GSUC0_GSUWGMRR0_K1_LBSPPA512_LBSPPB256_LPA32_LPB32_LRVW16_MIWT2_1_PLR1_SU0_SUM0_SUS256_VWA2_VWB1_WGM1_WGMXCC1_WGMXCCGn1
    SolutionIndex: 154
    SolutionNameMin: Cijk_Alik_Bljk_B8F8NSS_BH_Bias_HAS_SAV_UserArgs_MT32x32x256_MI16x16x1_SN_LDSB1_CLR1_GRVWA16_GRVWB16_GSU0_GSUC0_GSUWGMRR0_K1_LBSPPA256_LBSPPB256_LPA32_LPB32_LRVW16_MIWT1_1_PLR1_SU0_SUM0_SUS256_VWA1_VWB1_WGM1_WGMXCC1_WGMXCCGn1
    SolutionIndex: 155
    SolutionNameMin: Cijk_Alik_Bljk_B8F8NSS_BH_Bias_HAS_SAV_UserArgs_MT32x32x256_MI16x16x1_SN_LDSB1_CLR1_GRVWA16_GRVWB16_GSU0_GSUC0_GSUWGMRR0_K1_LBSPPA256_LBSPPB256_LPA32_LPB32_LRVW16_MIWT1_1_PLR1_SU0_SUM0_SUS256_VWA1_VWB1_WGM4_WGMXCC1_WGMXCCGn1
    SolutionIndex: 156
    SolutionNameMin: Cijk_Alik_Bljk_B8F8NSS_BH_Bias_HAS_SAV_UserArgs_MT32x32x256_MI16x16x1_SN_LDSB1_CLR1_GRVWA16_GRVWB16_GSU0_GSUC0_GSUWGMRR0_K1_LBSPPA256_LBSPPB256_LPA32_LPB32_LRVW16_MIWT1_1_PLR1_SU0_SUM0_SUS256_VWA1_VWB1_WGM8_WGMXCC1_WGMXCCGn1
    SolutionIndex: 157
    SolutionNameMin: Cijk_Alik_Bljk_B8F8NSS_BH_Bias_HAS_SAV_UserArgs_MT64x32x32_MI16x16x1_SN_LDSB0_CLR0_GRVWA4_GRVWB4_GSU0_GSUC0_GSUWGMRR0_K1_LBSPPA128_LBSPPB128_LPA8_LPB8_LRVW8_MIWT2_1_PLR0_SU32_SUM0_SUS256_VWA2_VWB1_WGM4_WGMXCC1_WGMXCCGn1
- - - [128, 128, 1, 128, 128, 128, 128, 128]
    - [123, 0.63]
  - - [128, 128, 1, 256, 128, 128, 256, 256]
    - [37, 1.08]
  - - [128, 128, 1, 512, 128, 128, 512, 512]
    - [125, 2.13]
  - - [128, 128, 1, 1024, 128, 128, 1024, 1024]
    - [123, 3.71]
  - - [128, 128, 1, 2048, 128, 128, 2048, 2048]
    - [154, 5.89]
  - - [128, 128, 1, 4096, 128, 128, 4096, 4096]
    - [154, 8.29]
  - - [128, 128, 1, 8192, 128, 128, 8192, 8192]
    - [154, 10.53]
  - - [128, 256, 1, 128, 128, 128, 128, 128]
    - [121, 1.22]
  - - [128, 256, 1, 256, 128, 128, 256, 256]
    - [123, 2.38]
  - - [128, 256, 1, 512, 128, 128, 512, 512]
    - [125, 4.35]
  - - [128, 256, 1, 1024, 128, 128, 1024, 1024]
    - [125, 7.63]
  - - [128, 256, 1, 2048, 128, 128, 2048, 2048]
    - [125, 11.67]
  - - [128, 256, 1, 4096, 128, 128, 4096, 4096]
    - [154, 16.73]
  - - [128, 256, 1, 8192, 128, 128, 8192, 8192]
    - [125, 21.0]
  - - [128, 512, 1, 128, 128, 128, 128, 128]
    - [120, 2.47]
  - - [128, 512, 1, 256, 128, 128, 256, 256]
    - [122, 4.63]
  - - [128, 512, 1, 512, 128, 128, 512, 512]
    - [125, 8.53]
  - - [128, 512, 1, 1024, 128, 128, 1024, 1024]
    - [125, 14.91]
  - - [128, 512, 1, 2048, 128, 128, 2048, 2048]
    - [125, 23.46]
  - - [128, 512, 1, 4096, 128, 128, 4096, 4096]
    - [154, 33.57]
  - - [128, 512, 1, 8192, 128, 128, 8192, 8192]
    - [154, 41.58]
  - - [128, 1024, 1, 128, 128, 128, 128, 128]
    - [129, 3.95]
  - - [128, 1024, 1, 256, 128, 128, 256, 256]
    - [130, 7.52]
  - - [128, 1024, 1, 512, 128, 128, 512, 512]
    - [131, 14.48]
  - - [128, 1024, 1, 1024, 128, 128, 1024, 1024]
    - [132, 26.91]
  - - [128, 1024, 1, 2048, 128, 128, 2048, 2048]
    - [125, 44.43]
  - - [128, 1024, 1, 4096, 128, 128, 4096, 4096]
    - [154, 63.97]
  - - [128, 1024, 1, 8192, 128, 128, 8192, 8192]
    - [154, 80.96]
  - - [128, 2048, 1, 128, 128, 128, 128, 128]
    - [118, 8.81]
  - - [128, 2048, 1, 256, 128, 128, 256, 256]
    - [118, 16.39]
  - - [128, 2048, 1, 512, 128, 128, 512, 512]
    - [118, 29.93]
  - - [128, 2048, 1, 1024, 128, 128, 1024, 1024]
    - [111, 49.19]
  - - [128, 2048, 1, 2048, 128, 128, 2048, 2048]
    - [110, 74.56]
  - - [128, 2048, 1, 4096, 128, 128, 4096, 4096]
    - [110, 99.29]
  - - [128, 2048, 1, 8192, 128, 128, 8192, 8192]
    - [150, 116.14]
  - - [128, 4096, 1, 128, 128, 128, 128, 128]
    - [28, 14.78]
  - - [128, 4096, 1, 256, 128, 128, 256, 256]
    - [27, 25.88]
  - - [128, 4096, 1, 512, 128, 128, 512, 512]
    - [106, 46.45]
  - - [128, 4096, 1, 1024, 128, 128, 1024, 1024]
    - [105, 78.43]
  - - [128, 4096, 1, 2048, 128, 128, 2048, 2048]
    - [146, 115.88]
  - - [128, 4096, 1, 4096, 128, 128, 4096, 4096]
    - [146, 152.69]
  - - [128, 4096, 1, 8192, 128, 128, 8192, 8192]
    - [146, 172.83]
  - - [128, 8192, 1, 128, 128, 128, 128, 128]
    - [99, 23.11]
  - - [128, 8192, 1, 256, 128, 128, 256, 256]
    - [99, 42.38]
  - - [128, 8192, 1, 512, 128, 128, 512, 512]
    - [99, 73.34]
  - - [128, 8192, 1, 1024, 128, 128, 1024, 1024]
    - [99, 116.93]
  - - [128, 8192, 1, 2048, 128, 128, 2048, 2048]
    - [142, 157.05]
  - - [128, 8192, 1, 4096, 128, 128, 4096, 4096]
    - [138, 186.02]
  - - [128, 8192, 1, 8192, 128, 128, 8192, 8192]
    - [137, 216.18]
  - - [256, 128, 1, 128, 256, 256, 128, 128]
    - [36, 0.98]
  - - [256, 128, 1, 256, 256, 256, 256, 256]
    - [127, 1.86]
  - - [256, 128, 1, 512, 256, 256, 512, 512]
    - [35, 3.55]
  - - [256, 128, 1, 1024, 256, 256, 1024, 1024]
    - [123, 6.95]
  - - [256, 128, 1, 2048, 256, 256, 2048, 2048]
    - [125, 11.89]
  - - [256, 128, 1, 4096, 256, 256, 4096, 4096]
    - [154, 16.8]
  - - [256, 128, 1, 8192, 256, 256, 8192, 8192]
    - [154, 21.02]
  - - [256, 256, 1, 128, 256, 256, 128, 128]
    - [119, 2.47]
  - - [256, 256, 1, 256, 256, 256, 256, 256]
    - [125, 4.67]
  - - [256, 256, 1, 512, 256, 256, 512, 512]
    - [125, 8.57]
  - - [256, 256, 1, 1024, 256, 256, 1024, 1024]
    - [154, 14.84]
  - - [256, 256, 1, 2048, 256, 256, 2048, 2048]
    - [154, 23.12]
  - - [256, 256, 1, 4096, 256, 256, 4096, 4096]
    - [154, 32.76]
  - - [256, 256, 1, 8192, 256, 256, 8192, 8192]
    - [154, 41.52]
  - - [256, 512, 1, 128, 256, 256, 128, 128]
    - [124, 4.79]
  - - [256, 512, 1, 256, 256, 256, 256, 256]
    - [125, 9.08]
  - - [256, 512, 1, 512, 256, 256, 512, 512]
    - [125, 16.65]
  - - [256, 512, 1, 1024, 256, 256, 1024, 1024]
    - [154, 28.26]
  - - [256, 512, 1, 2048, 256, 256, 2048, 2048]
    - [126, 44.3]
  - - [256, 512, 1, 4096, 256, 256, 4096, 4096]
    - [154, 63.64]
  - - [256, 512, 1, 8192, 256, 256, 8192, 8192]
    - [154, 80.93]
  - - [256, 1024, 1, 128, 256, 256, 128, 128]
    - [34, 7.19]
  - - [256, 1024, 1, 256, 256, 256, 256, 256]
    - [33, 14.34]
  - - [256, 1024, 1, 512, 256, 256, 512, 512]
    - [111, 29.52]
  - - [256, 1024, 1, 1024, 256, 256, 1024, 1024]
    - [111, 49.26]
  - - [256, 1024, 1, 2048, 256, 256, 2048, 2048]
    - [111, 74.7]
  - - [256, 1024, 1, 4096, 256, 256, 4096, 4096]
    - [150, 99.53]
  - - [256, 1024, 1, 8192, 256, 256, 8192, 8192]
    - [153, 117.71]
  - - [256, 2048, 1, 128, 256, 256, 128, 128]
    - [29, 14.64]
  - - [256, 2048, 1, 256, 256, 256, 256, 256]
    - [105, 26.8]
  - - [256, 2048, 1, 512, 256, 256, 512, 512]
    - [105, 48.05]
  - - [256, 2048, 1, 1024, 256, 256, 1024, 1024]
    - [105, 78.98]
  - - [256, 2048, 1, 2048, 256, 256, 2048, 2048]
    - [146, 116.27]
  - - [256, 2048, 1, 4096, 256, 256, 4096, 4096]
    - [146, 155.0]
  - - [256, 2048, 1, 8192, 256, 256, 8192, 8192]
    - [146, 175.75]
  - - [256, 4096, 1, 128, 256, 256, 128, 128]
    - [26, 22.55]
  - - [256, 4096, 1, 256, 256, 256, 256, 256]
    - [101, 41.68]
  - - [256, 4096, 1, 512, 256, 256, 512, 512]
    - [101, 72.96]
  - - [256, 4096, 1, 1024, 256, 256, 1024, 1024]
    - [102, 116.35]
  - - [256, 4096, 1, 2048, 256, 256, 2048, 2048]
    - [138, 168.6]
  - - [256, 4096, 1, 4096, 256, 256, 4096, 4096]
    - [142, 191.71]
  - - [256, 4096, 1, 8192, 256, 256, 8192, 8192]
    - [142, 225.37]
  - - [256, 8192, 1, 128, 256, 256, 128, 128]
    - [74, 33.54]
  - - [256, 8192, 1, 256, 256, 256, 256, 256]
    - [10, 61.05]
  - - [256, 8192, 1, 512, 256, 256, 512, 512]
    - [11, 104.51]
  - - [256, 8192, 1, 1024, 256, 256, 1024, 1024]
    - [91, 157.84]
  - - [256, 8192, 1, 2048, 256, 256, 2048, 2048]
    - [134, 187.96]
  - - [256, 8192, 1, 4096, 256, 256, 4096, 4096]
    - [133, 220.65]
  - - [256, 8192, 1, 8192, 256, 256, 8192, 8192]
    - [90, 269.88]
  - - [512, 128, 1, 128, 512, 512, 128, 128]
    - [125, 2.46]
  - - [512, 128, 1, 256, 512, 512, 256, 256]
    - [123, 4.6]
  - - [512, 128, 1, 512, 512, 512, 512, 512]
    - [125, 8.54]
  - - [512, 128, 1, 1024, 512, 512, 1024, 1024]
    - [125, 14.61]
  - - [512, 128, 1, 2048, 512, 512, 2048, 2048]
    - [125, 23.43]
  - - [512, 128, 1, 4096, 512, 512, 4096, 4096]
    - [154, 32.59]
  - - [512, 128, 1, 8192, 512, 512, 8192, 8192]
    - [154, 41.41]
  - - [512, 256, 1, 128, 512, 512, 128, 128]
    - [125, 4.63]
  - - [512, 256, 1, 256, 512, 512, 256, 256]
    - [125, 8.99]
  - - [512, 256, 1, 512, 512, 512, 512, 512]
    - [123, 16.55]
  - - [512, 256, 1, 1024, 512, 512, 1024, 1024]
    - [125, 28.8]
  - - [512, 256, 1, 2048, 512, 512, 2048, 2048]
    - [154, 45.19]
  - - [512, 256, 1, 4096, 512, 512, 4096, 4096]
    - [154, 64.01]
  - - [512, 256, 1, 8192, 512, 512, 8192, 8192]
    - [156, 80.88]
  - - [512, 512, 1, 128, 512, 512, 128, 128]
    - [116, 8.3]
  - - [512, 512, 1, 256, 512, 512, 256, 256]
    - [115, 15.86]
  - - [512, 512, 1, 512, 512, 512, 512, 512]
    - [111, 29.2]
  - - [512, 512, 1, 1024, 512, 512, 1024, 1024]
    - [111, 49.03]
  - - [512, 512, 1, 2048, 512, 512, 2048, 2048]
    - [111, 74.12]
  - - [512, 512, 1, 4096, 512, 512, 4096, 4096]
    - [150, 99.78]
  - - [512, 512, 1, 8192, 512, 512, 8192, 8192]
    - [151, 116.39]
  - - [512, 1024, 1, 128, 512, 512, 128, 128]
    - [31, 13.98]
  - - [512, 1024, 1, 256, 512, 512, 256, 256]
    - [30, 24.08]
  - - [512, 1024, 1, 512, 512, 512, 512, 512]
    - [146, 43.66]
  - - [512, 1024, 1, 1024, 512, 512, 1024, 1024]
    - [105, 78.03]
  - - [512, 1024, 1, 2048, 512, 512, 2048, 2048]
    - [146, 115.24]
  - - [512, 1024, 1, 4096, 512, 512, 4096, 4096]
    - [146, 151.84]
  - - [512, 1024, 1, 8192, 512, 512, 8192, 8192]
    - [146, 175.19]
  - - [512, 2048, 1, 128, 512, 512, 128, 128]
    - [101, 22.36]
  - - [512, 2048, 1, 256, 512, 512, 256, 256]
    - [103, 41.4]
  - - [512, 2048, 1, 512, 512, 512, 512, 512]
    - [99, 73.32]
  - - [512, 2048, 1, 1024, 512, 512, 1024, 1024]
    - [99, 116.59]
  - - [512, 2048, 1, 2048, 512, 512, 2048, 2048]
    - [138, 167.73]
  - - [512, 2048, 1, 4096, 512, 512, 4096, 4096]
    - [142, 198.46]
  - - [512, 2048, 1, 8192, 512, 512, 8192, 8192]
    - [138, 225.59]
  - - [512, 4096, 1, 128, 512, 512, 128, 128]
    - [23, 33.76]
  - - [512, 4096, 1, 256, 512, 512, 256, 256]
    - [23, 60.46]
  - - [512, 4096, 1, 512, 512, 512, 512, 512]
    - [91, 102.91]
  - - [512, 4096, 1, 1024, 512, 512, 1024, 1024]
    - [91, 161.18]
  - - [512, 4096, 1, 2048, 512, 512, 2048, 2048]
    - [91, 209.55]
  - - [512, 4096, 1, 4096, 512, 512, 4096, 4096]
    - [91, 223.91]
  - - [512, 4096, 1, 8192, 512, 512, 8192, 8192]
    - [90, 283.11]
  - - [512, 8192, 1, 128, 512, 512, 128, 128]
    - [76, 41.58]
  - - [512, 8192, 1, 256, 512, 512, 256, 256]
    - [76, 76.77]
  - - [512, 8192, 1, 512, 512, 512, 512, 512]
    - [78, 128.11]
  - - [512, 8192, 1, 1024, 512, 512, 1024, 1024]
    - [79, 176.71]
  - - [512, 8192, 1, 2048, 512, 512, 2048, 2048]
    - [75, 233.23]
  - - [512, 8192, 1, 4096, 512, 512, 4096, 4096]
    - [77, 276.38]
  - - [512, 8192, 1, 8192, 512, 512, 8192, 8192]
    - [80, 301.76]
  - - [1024, 128, 1, 128, 1024, 1024, 128, 128]
    - [123, 4.67]
  - - [1024, 128, 1, 256, 1024, 1024, 256, 256]
    - [125, 8.8]
  - - [1024, 128, 1, 512, 1024, 1024, 512, 512]
    - [125, 16.52]
  - - [1024, 128, 1, 1024, 1024, 1024, 1024, 1024]
    - [154, 28.12]
  - - [1024, 128, 1, 2048, 1024, 1024, 2048, 2048]
    - [128, 44.56]
  - - [1024, 128, 1, 4096, 1024, 1024, 4096, 4096]
    - [155, 63.68]
  - - [1024, 128, 1, 8192, 1024, 1024, 8192, 8192]
    - [155, 80.59]
  - - [1024, 256, 1, 128, 1024, 1024, 128, 128]
    - [116, 8.49]
  - - [1024, 256, 1, 256, 1024, 1024, 256, 256]
    - [117, 15.88]
  - - [1024, 256, 1, 512, 1024, 1024, 512, 512]
    - [113, 29.16]
  - - [1024, 256, 1, 1024, 1024, 1024, 1024, 1024]
    - [114, 48.38]
  - - [1024, 256, 1, 2048, 1024, 1024, 2048, 2048]
    - [111, 72.98]
  - - [1024, 256, 1, 4096, 1024, 1024, 4096, 4096]
    - [112, 98.87]
  - - [1024, 256, 1, 8192, 1024, 1024, 8192, 8192]
    - [152, 118.69]
  - - [1024, 512, 1, 128, 1024, 1024, 128, 128]
    - [107, 14.42]
  - - [1024, 512, 1, 256, 1024, 1024, 256, 256]
    - [105, 26.3]
  - - [1024, 512, 1, 512, 1024, 1024, 512, 512]
    - [105, 47.31]
  - - [1024, 512, 1, 1024, 1024, 1024, 1024, 1024]
    - [107, 77.47]
  - - [1024, 512, 1, 2048, 1024, 1024, 2048, 2048]
    - [149, 112.67]
  - - [1024, 512, 1, 4096, 1024, 1024, 4096, 4096]
    - [147, 150.89]
  - - [1024, 512, 1, 8192, 1024, 1024, 8192, 8192]
    - [147, 176.16]
  - - [1024, 1024, 1, 128, 1024, 1024, 128, 128]
    - [102, 22.53]
  - - [1024, 1024, 1, 256, 1024, 1024, 256, 256]
    - [103, 41.98]
  - - [1024, 1024, 1, 512, 1024, 1024, 512, 512]
    - [102, 73.23]
  - - [1024, 1024, 1, 1024, 1024, 1024, 1024, 1024]
    - [102, 117.67]
  - - [1024, 1024, 1, 2048, 1024, 1024, 2048, 2048]
    - [144, 166.85]
  - - [1024, 1024, 1, 4096, 1024, 1024, 4096, 4096]
    - [139, 198.52]
  - - [1024, 1024, 1, 8192, 1024, 1024, 8192, 8192]
    - [139, 226.01]
  - - [1024, 2048, 1, 128, 1024, 1024, 128, 128]
    - [21, 33.85]
  - - [1024, 2048, 1, 256, 1024, 1024, 256, 256]
    - [21, 61.81]
  - - [1024, 2048, 1, 512, 1024, 1024, 512, 512]
    - [20, 101.25]
  - - [1024, 2048, 1, 1024, 1024, 1024, 1024, 1024]
    - [91, 160.05]
  - - [1024, 2048, 1, 2048, 1024, 1024, 2048, 2048]
    - [91, 201.85]
  - - [1024, 2048, 1, 4096, 1024, 1024, 4096, 4096]
    - [73, 223.62]
  - - [1024, 2048, 1, 8192, 1024, 1024, 8192, 8192]
    - [90, 281.63]
  - - [1024, 4096, 1, 128, 1024, 1024, 128, 128]
    - [2, 40.22]
  - - [1024, 4096, 1, 256, 1024, 1024, 256, 256]
    - [1, 72.89]
  - - [1024, 4096, 1, 512, 1024, 1024, 512, 512]
    - [38, 114.49]
  - - [1024, 4096, 1, 1024, 1024, 1024, 1024, 1024]
    - [44, 167.14]
  - - [1024, 4096, 1, 2048, 1024, 1024, 2048, 2048]
    - [38, 221.88]
  - - [1024, 4096, 1, 4096, 1024, 1024, 4096, 4096]
    - [38, 269.19]
  - - [1024, 4096, 1, 8192, 1024, 1024, 8192, 8192]
    - [38, 270.85]
  - - [1024, 8192, 1, 128, 1024, 1024, 128, 128]
    - [3, 44.78]
  - - [1024, 8192, 1, 256, 1024, 1024, 256, 256]
    - [3, 84.32]
  - - [1024, 8192, 1, 512, 1024, 1024, 512, 512]
    - [48, 140.44]
  - - [1024, 8192, 1, 1024, 1024, 1024, 1024, 1024]
    - [46, 206.13]
  - - [1024, 8192, 1, 2048, 1024, 1024, 2048, 2048]
    - [58, 280.01]
  - - [1024, 8192, 1, 4096, 1024, 1024, 4096, 4096]
    - [54, 322.93]
  - - [1024, 8192, 1, 8192, 1024, 1024, 8192, 8192]
    - [45, 353.57]
  - - [2048, 128, 1, 128, 2048, 2048, 128, 128]
    - [32, 8.7]
  - - [2048, 128, 1, 256, 2048, 2048, 256, 256]
    - [108, 16.22]
  - - [2048, 128, 1, 512, 2048, 2048, 512, 512]
    - [109, 27.01]
  - - [2048, 128, 1, 1024, 2048, 2048, 1024, 1024]
    - [113, 47.33]
  - - [2048, 128, 1, 2048, 2048, 2048, 2048, 2048]
    - [110, 74.62]
  - - [2048, 128, 1, 4096, 2048, 2048, 4096, 4096]
    - [111, 99.84]
  - - [2048, 128, 1, 8192, 2048, 2048, 8192, 8192]
    - [151, 117.61]
  - - [2048, 256, 1, 128, 2048, 2048, 128, 128]
    - [105, 14.81]
  - - [2048, 256, 1, 256, 2048, 2048, 256, 256]
    - [105, 27.64]
  - - [2048, 256, 1, 512, 2048, 2048, 512, 512]
    - [105, 49.19]
  - - [2048, 256, 1, 1024, 2048, 2048, 1024, 1024]
    - [104, 78.37]
  - - [2048, 256, 1, 2048, 2048, 2048, 2048, 2048]
    - [146, 117.41]
  - - [2048, 256, 1, 4096, 2048, 2048, 4096, 4096]
    - [148, 153.48]
  - - [2048, 256, 1, 8192, 2048, 2048, 8192, 8192]
    - [149, 177.41]
  - - [2048, 512, 1, 128, 2048, 2048, 128, 128]
    - [98, 23.39]
  - - [2048, 512, 1, 256, 2048, 2048, 256, 256]
    - [99, 42.38]
  - - [2048, 512, 1, 512, 2048, 2048, 512, 512]
    - [99, 74.62]
  - - [2048, 512, 1, 1024, 2048, 2048, 1024, 1024]
    - [103, 117.54]
  - - [2048, 512, 1, 2048, 2048, 2048, 2048, 2048]
    - [145, 167.57]
  - - [2048, 512, 1, 4096, 2048, 2048, 4096, 4096]
    - [140, 197.61]
  - - [2048, 512, 1, 8192, 2048, 2048, 8192, 8192]
    - [141, 224.72]
  - - [2048, 1024, 1, 128, 2048, 2048, 128, 128]
    - [21, 33.05]
  - - [2048, 1024, 1, 256, 2048, 2048, 256, 256]
    - [21, 59.19]
  - - [2048, 1024, 1, 512, 2048, 2048, 512, 512]
    - [91, 98.21]
  - - [2048, 1024, 1, 1024, 2048, 2048, 1024, 1024]
    - [93, 153.91]
  - - [2048, 1024, 1, 2048, 2048, 2048, 2048, 2048]
    - [92, 205.9]
  - - [2048, 1024, 1, 4096, 2048, 2048, 4096, 4096]
    - [94, 219.99]
  - - [2048, 1024, 1, 8192, 2048, 2048, 8192, 8192]
    - [96, 278.8]
  - - [2048, 2048, 1, 128, 2048, 2048, 128, 128]
    - [1, 38.21]
  - - [2048, 2048, 1, 256, 2048, 2048, 256, 256]
    - [0, 68.85]
  - - [2048, 2048, 1, 512, 2048, 2048, 512, 512]
    - [43, 110.29]
  - - [2048, 2048, 1, 1024, 2048, 2048, 1024, 1024]
    - [41, 165.73]
  - - [2048, 2048, 1, 2048, 2048, 2048, 2048, 2048]
    - [38, 220.05]
  - - [2048, 2048, 1, 4096, 2048, 2048, 4096, 4096]
    - [43, 268.78]
  - - [2048, 2048, 1, 8192, 2048, 2048, 8192, 8192]
    - [43, 276.06]
  - - [2048, 4096, 1, 128, 2048, 2048, 128, 128]
    - [16, 41.87]
  - - [2048, 4096, 1, 256, 2048, 2048, 256, 256]
    - [16, 76.31]
  - - [2048, 4096, 1, 512, 2048, 2048, 512, 512]
    - [16, 119.84]
  - - [2048, 4096, 1, 1024, 2048, 2048, 1024, 1024]
    - [38, 175.19]
  - - [2048, 4096, 1, 2048, 2048, 2048, 2048, 2048]
    - [82, 220.22]
  - - [2048, 4096, 1, 4096, 2048, 2048, 4096, 4096]
    - [71, 273.39]
  - - [2048, 4096, 1, 8192, 2048, 2048, 8192, 8192]
    - [59, 313.41]
  - - [2048, 8192, 1, 128, 2048, 2048, 128, 128]
    - [55, 49.05]
  - - [2048, 8192, 1, 256, 2048, 2048, 256, 256]
    - [4, 89.45]
  - - [2048, 8192, 1, 512, 2048, 2048, 512, 512]
    - [49, 147.81]
  - - [2048, 8192, 1, 1024, 2048, 2048, 1024, 1024]
    - [57, 224.79]
  - - [2048, 8192, 1, 2048, 2048, 2048, 2048, 2048]
    - [51, 280.82]
  - - [2048, 8192, 1, 4096, 2048, 2048, 4096, 4096]
    - [50, 303.37]
  - - [2048, 8192, 1, 8192, 2048, 2048, 8192, 8192]
    - [53, 354.44]
  - - [4096, 128, 1, 128, 4096, 4096, 128, 128]
    - [29, 14.8]
  - - [4096, 128, 1, 256, 4096, 4096, 256, 256]
    - [105, 27.23]
  - - [4096, 128, 1, 512, 4096, 4096, 512, 512]
    - [105, 47.97]
  - - [4096, 128, 1, 1024, 4096, 4096, 1024, 1024]
    - [104, 78.27]
  - - [4096, 128, 1, 2048, 4096, 4096, 2048, 2048]
    - [146, 115.84]
  - - [4096, 128, 1, 4096, 4096, 4096, 4096, 4096]
    - [148, 147.39]
  - - [4096, 128, 1, 8192, 4096, 4096, 8192, 8192]
    - [149, 170.48]
  - - [4096, 256, 1, 128, 4096, 4096, 128, 128]
    - [24, 22.64]
  - - [4096, 256, 1, 256, 4096, 4096, 256, 256]
    - [101, 41.82]
  - - [4096, 256, 1, 512, 4096, 4096, 512, 512]
    - [102, 71.95]
  - - [4096, 256, 1, 1024, 4096, 4096, 1024, 1024]
    - [102, 115.49]
  - - [4096, 256, 1, 2048, 4096, 4096, 2048, 2048]
    - [145, 167.12]
  - - [4096, 256, 1, 4096, 4096, 4096, 4096, 4096]
    - [144, 195.04]
  - - [4096, 256, 1, 8192, 4096, 4096, 8192, 8192]
    - [143, 225.17]
  - - [4096, 512, 1, 128, 4096, 4096, 128, 128]
    - [22, 31.36]
  - - [4096, 512, 1, 256, 4096, 4096, 256, 256]
    - [23, 57.02]
  - - [4096, 512, 1, 512, 4096, 4096, 512, 512]
    - [93, 94.01]
  - - [4096, 512, 1, 1024, 4096, 4096, 1024, 1024]
    - [96, 150.92]
  - - [4096, 512, 1, 2048, 4096, 4096, 2048, 2048]
    - [96, 208.71]
  - - [4096, 512, 1, 4096, 4096, 4096, 4096, 4096]
    - [95, 224.54]
  - - [4096, 512, 1, 8192, 4096, 4096, 8192, 8192]
    - [94, 280.92]
  - - [4096, 1024, 1, 128, 4096, 4096, 128, 128]
    - [7, 36.78]
  - - [4096, 1024, 1, 256, 4096, 4096, 256, 256]
    - [6, 66.44]
  - - [4096, 1024, 1, 512, 4096, 4096, 512, 512]
    - [41, 109.54]
  - - [4096, 1024, 1, 1024, 4096, 4096, 1024, 1024]
    - [43, 168.63]
  - - [4096, 1024, 1, 2048, 4096, 4096, 2048, 2048]
    - [39, 217.02]
  - - [4096, 1024, 1, 4096, 4096, 4096, 4096, 4096]
    - [44, 262.15]
  - - [4096, 1024, 1, 8192, 4096, 4096, 8192, 8192]
    - [42, 286.15]
  - - [4096, 2048, 1, 128, 4096, 4096, 128, 128]
    - [13, 40.71]
  - - [4096, 2048, 1, 256, 4096, 4096, 256, 256]
    - [12, 72.58]
  - - [4096, 2048, 1, 512, 4096, 4096, 512, 512]
    - [38, 115.12]
  - - [4096, 2048, 1, 1024, 4096, 4096, 1024, 1024]
    - [40, 172.16]
  - - [4096, 2048, 1, 2048, 4096, 4096, 2048, 2048]
    - [83, 221.8]
  - - [4096, 2048, 1, 4096, 4096, 4096, 4096, 4096]
    - [60, 270.42]
  - - [4096, 2048, 1, 8192, 4096, 4096, 8192, 8192]
    - [61, 327.16]
  - - [4096, 4096, 1, 128, 4096, 4096, 128, 128]
    - [22, 43.61]
  - - [4096, 4096, 1, 256, 4096, 4096, 256, 256]
    - [25, 80.42]
  - - [4096, 4096, 1, 512, 4096, 4096, 512, 512]
    - [101, 127.85]
  - - [4096, 4096, 1, 1024, 4096, 4096, 1024, 1024]
    - [95, 192.4]
  - - [4096, 4096, 1, 2048, 4096, 4096, 2048, 2048]
    - [65, 244.84]
  - - [4096, 4096, 1, 4096, 4096, 4096, 4096, 4096]
    - [72, 294.63]
  - - [4096, 4096, 1, 8192, 4096, 4096, 8192, 8192]
    - [61, 352.66]
  - - [4096, 8192, 1, 128, 4096, 4096, 128, 128]
    - [47, 50.04]
  - - [4096, 8192, 1, 256, 4096, 4096, 256, 256]
    - [5, 87.65]
  - - [4096, 8192, 1, 512, 4096, 4096, 512, 512]
    - [51, 138.92]
  - - [4096, 8192, 1, 1024, 4096, 4096, 1024, 1024]
    - [52, 201.63]
  - - [4096, 8192, 1, 2048, 4096, 4096, 2048, 2048]
    - [56, 251.54]
  - - [4096, 8192, 1, 4096, 4096, 4096, 4096, 4096]
    - [41, 306.21]
  - - [4096, 8192, 1, 8192, 4096, 4096, 8192, 8192]
    - [58, 363.41]
  - - [8192, 128, 1, 128, 8192, 8192, 128, 128]
    - [103, 22.47]
  - - [8192, 128, 1, 256, 8192, 8192, 256, 256]
    - [100, 39.85]
  - - [8192, 128, 1, 512, 8192, 8192, 512, 512]
    - [101, 71.05]
  - - [8192, 128, 1, 1024, 8192, 8192, 1024, 1024]
    - [97, 114.68]
  - - [8192, 128, 1, 2048, 8192, 8192, 2048, 2048]
    - [138, 161.01]
  - - [8192, 128, 1, 4096, 8192, 8192, 4096, 4096]
    - [144, 185.44]
  - - [8192, 128, 1, 8192, 8192, 8192, 8192, 8192]
    - [138, 216.89]
  - - [8192, 256, 1, 128, 8192, 8192, 128, 128]
    - [14, 33.13]
  - - [8192, 256, 1, 256, 8192, 8192, 256, 256]
    - [15, 60.39]
  - - [8192, 256, 1, 512, 8192, 8192, 512, 512]
    - [81, 104.6]
  - - [8192, 256, 1, 1024, 8192, 8192, 1024, 1024]
    - [135, 153.25]
  - - [8192, 256, 1, 2048, 8192, 8192, 2048, 2048]
    - [136, 188.47]
  - - [8192, 256, 1, 4096, 8192, 8192, 4096, 4096]
    - [136, 219.93]
  - - [8192, 256, 1, 8192, 8192, 8192, 8192, 8192]
    - [96, 272.1]
  - - [8192, 512, 1, 128, 8192, 8192, 128, 128]
    - [88, 41.31]
  - - [8192, 512, 1, 256, 8192, 8192, 256, 256]
    - [89, 77.26]
  - - [8192, 512, 1, 512, 8192, 8192, 512, 512]
    - [86, 130.83]
  - - [8192, 512, 1, 1024, 8192, 8192, 1024, 1024]
    - [87, 181.49]
  - - [8192, 512, 1, 2048, 8192, 8192, 2048, 2048]
    - [85, 226.34]
  - - [8192, 512, 1, 4096, 8192, 8192, 4096, 4096]
    - [89, 298.15]
  - - [8192, 512, 1, 8192, 8192, 8192, 8192, 8192]
    - [84, 343.09]
  - - [8192, 1024, 1, 128, 8192, 8192, 128, 128]
    - [18, 44.17]
  - - [8192, 1024, 1, 256, 8192, 8192, 256, 256]
    - [19, 80.76]
  - - [8192, 1024, 1, 512, 8192, 8192, 512, 512]
    - [72, 132.38]
  - - [8192, 1024, 1, 1024, 8192, 8192, 1024, 1024]
    - [64, 191.15]
  - - [8192, 1024, 1, 2048, 8192, 8192, 2048, 2048]
    - [70, 273.02]
  - - [8192, 1024, 1, 4096, 8192, 8192, 4096, 4096]
    - [66, 338.11]
  - - [8192, 1024, 1, 8192, 8192, 8192, 8192, 8192]
    - [71, 377.41]
  - - [8192, 2048, 1, 128, 8192, 8192, 128, 128]
    - [17, 49.02]
  - - [8192, 2048, 1, 256, 8192, 8192, 256, 256]
    - [9, 87.1]
  - - [8192, 2048, 1, 512, 8192, 8192, 512, 512]
    - [68, 146.62]
  - - [8192, 2048, 1, 1024, 8192, 8192, 1024, 1024]
    - [68, 219.52]
  - - [8192, 2048, 1, 2048, 8192, 8192, 2048, 2048]
    - [69, 284.46]
  - - [8192, 2048, 1, 4096, 8192, 8192, 4096, 4096]
    - [65, 318.17]
  - - [8192, 2048, 1, 8192, 8192, 8192, 8192, 8192]
    - [65, 387.79]
  - - [8192, 4096, 1, 128, 8192, 8192, 128, 128]
    - [67, 46.93]
  - - [8192, 4096, 1, 256, 8192, 8192, 256, 256]
    - [8, 83.11]
  - - [8192, 4096, 1, 512, 8192, 8192, 512, 512]
    - [62, 133.95]
  - - [8192, 4096, 1, 1024, 8192, 8192, 1024, 1024]
    - [68, 195.37]
  - - [8192, 4096, 1, 2048, 8192, 8192, 2048, 2048]
    - [61, 260.16]
  - - [8192, 4096, 1, 4096, 8192, 8192, 4096, 4096]
    - [71, 312.02]
  - - [8192, 4096, 1, 8192, 8192, 8192, 8192, 8192]
    - [68, 401.35]
  - - [8192, 8192, 1, 128, 8192, 8192, 128, 128]
    - [23, 43.22]
  - - [8192, 8192, 1, 256, 8192, 8192, 256, 256]
    - [3, 76.7]
  - - [8192, 8192, 1, 512, 8192, 8192, 512, 512]
    - [47, 121.95]
  - - [8192, 8192, 1, 1024, 8192, 8192, 1024, 1024]
    - [46, 184.8]
  - - [8192, 8192, 1, 2048, 8192, 8192, 2048, 2048]
    - [63, 256.48]
  - - [8192, 8192, 1, 4096, 8192, 8192, 4096, 4096]
    - [68, 309.27]
  - - [8192, 8192, 1, 8192, 8192, 8192, 8192, 8192]
    - [68, 383.25]
  - - [1, 1, 1, 32, 1, 1, 32, 32]
    - [157, 0.0]
- null
- null
- ExperimentalStreamK
- GridBased
