projects/hipblaslt/library/src/amd_detail/rocblaslt/src/Tensile/Logic/asm_full/aquavanjaram/gfx942_228cu/StreamK/aquavanjaram942_Cijk_Ailk_Bljk_F8NB8NS_BH_Bias_HAS_SAV_UserArgs.yaml
- {MinimumRequiredVersion: 4.33.0}
- aquavanjaram942
- {Architecture: gfx942, CUCount: 228}
- [Device 0049, Device 0050]
    SolutionIndex: 0
    SolutionNameMin: Cijk_Ailk_Bljk_F8NB8NS_BH_Bias_HAS_SAV_UserArgs_MT256x256x64_MI16x16x1_SN_LDSB1_CLR1_GRVWA8_GRVWB16_GSU0_GSUC0_GSUWGMRR0_K1_LBSPPA2048_LBSPPB512_LPA0_LPB16_LRVW8_MIWT8_8_PLR1_SU0_SUM0_SUS64_VWA8_VWB8_WGM1_WGMXCC1_WGMXCCGn1
    SolutionIndex: 1
    SolutionNameMin: Cijk_Ailk_Bljk_F8NB8NS_BH_Bias_HAS_SAV_UserArgs_MT256x256x64_MI16x16x1_SN_LDSB1_CLR1_GRVWA16_GRVWB16_GSU0_GSUC0_GSUWGMRR0_K1_LBSPPA2048_LBSPPB512_LPA0_LPB16_LRVW8_MIWT8_8_PLR1_SU0_SUM0_SUS64_VWA8_VWB8_WGM1_WGMXCC1_WGMXCCGn1
    SolutionIndex: 2
    SolutionNameMin: Cijk_Ailk_Bljk_F8NB8NS_BH_Bias_HAS_SAV_UserArgs_MT256x256x64_MI16x16x1_SN_LDSB1_CLR1_GRVWA8_GRVWB8_GSU0_GSUC0_GSUWGMRR0_K1_LBSPPA2048_LBSPPB512_LPA0_LPB8_LRVW8_MIWT8_8_PLR1_SU0_SUM0_SUS64_VWA8_VWB8_WGM4_WGMXCC1_WGMXCCGn1
    SolutionIndex: 3
    SolutionNameMin: Cijk_Ailk_Bljk_F8NB8NS_BH_Bias_HAS_SAV_UserArgs_MT256x256x64_MI16x16x1_SN_LDSB1_CLR1_GRVWA16_GRVWB8_GSU0_GSUC0_GSUWGMRR0_K1_LBSPPA2048_LBSPPB512_LPA0_LPB8_LRVW8_MIWT8_8_PLR1_SU0_SUM0_SUS64_VWA8_VWB8_WGM4_WGMXCC1_WGMXCCGn1
    SolutionIndex: 4
    SolutionNameMin: Cijk_Ailk_Bljk_F8NB8NS_BH_Bias_HAS_SAV_UserArgs_MT256x256x64_MI16x16x1_SN_LDSB1_CLR1_GRVWA8_GRVWB16_GSU0_GSUC0_GSUWGMRR0_K1_LBSPPA2048_LBSPPB512_LPA0_LPB16_LRVW8_MIWT8_8_PLR1_SU0_SUM0_SUS64_VWA8_VWB8_WGM4_WGMXCC1_WGMXCCGn1
    SolutionIndex: 5
    SolutionNameMin: Cijk_Ailk_Bljk_F8NB8NS_BH_Bias_HAS_SAV_UserArgs_MT256x256x64_MI16x16x1_SN_LDSB1_CLR1_GRVWA16_GRVWB16_GSU0_GSUC0_GSUWGMRR0_K1_LBSPPA2048_LBSPPB512_LPA0_LPB16_LRVW8_MIWT8_8_PLR1_SU0_SUM0_SUS64_VWA8_VWB8_WGM4_WGMXCC1_WGMXCCGn1
    SolutionIndex: 6
    SolutionNameMin: Cijk_Ailk_Bljk_F8NB8NS_BH_Bias_HAS_SAV_UserArgs_MT256x256x64_MI16x16x1_SN_LDSB1_CLR1_GRVWA8_GRVWB8_GSU0_GSUC0_GSUWGMRR0_K1_LBSPPA2048_LBSPPB512_LPA0_LPB8_LRVW8_MIWT8_8_PLR1_SU0_SUM0_SUS64_VWA8_VWB8_WGM6_WGMXCC1_WGMXCCGn1
    SolutionIndex: 7
    SolutionNameMin: Cijk_Ailk_Bljk_F8NB8NS_BH_Bias_HAS_SAV_UserArgs_MT256x256x64_MI16x16x1_SN_LDSB1_CLR1_GRVWA16_GRVWB8_GSU0_GSUC0_GSUWGMRR0_K1_LBSPPA2048_LBSPPB512_LPA0_LPB8_LRVW8_MIWT8_8_PLR1_SU0_SUM0_SUS64_VWA8_VWB8_WGM6_WGMXCC1_WGMXCCGn1
    SolutionIndex: 8
    SolutionNameMin: Cijk_Ailk_Bljk_F8NB8NS_BH_Bias_HAS_SAV_UserArgs_MT256x256x64_MI16x16x1_SN_LDSB1_CLR1_GRVWA8_GRVWB16_GSU0_GSUC0_GSUWGMRR0_K1_LBSPPA2048_LBSPPB512_LPA0_LPB16_LRVW8_MIWT8_8_PLR1_SU0_SUM0_SUS64_VWA8_VWB8_WGM6_WGMXCC1_WGMXCCGn1
    SolutionIndex: 9
    SolutionNameMin: Cijk_Ailk_Bljk_F8NB8NS_BH_Bias_HAS_SAV_UserArgs_MT256x256x64_MI16x16x1_SN_LDSB1_CLR1_GRVWA8_GRVWB8_GSU0_GSUC0_GSUWGMRR0_K1_LBSPPA2048_LBSPPB512_LPA0_LPB8_LRVW8_MIWT8_8_PLR1_SU0_SUM0_SUS64_VWA8_VWB8_WGM8_WGMXCC1_WGMXCCGn1
    SolutionIndex: 10
    SolutionNameMin: Cijk_Ailk_Bljk_F8NB8NS_BH_Bias_HAS_SAV_UserArgs_MT256x256x64_MI16x16x1_SN_LDSB1_CLR1_GRVWA16_GRVWB8_GSU0_GSUC0_GSUWGMRR0_K1_LBSPPA2048_LBSPPB512_LPA0_LPB8_LRVW8_MIWT8_8_PLR1_SU0_SUM0_SUS64_VWA8_VWB8_WGM8_WGMXCC1_WGMXCCGn1
    SolutionIndex: 11
    SolutionNameMin: Cijk_Ailk_Bljk_F8NB8NS_BH_Bias_HAS_SAV_UserArgs_MT256x256x64_MI16x16x1_SN_LDSB1_CLR1_GRVWA8_GRVWB16_GSU0_GSUC0_GSUWGMRR0_K1_LBSPPA2048_LBSPPB512_LPA0_LPB16_LRVW8_MIWT8_8_PLR1_SU0_SUM0_SUS64_VWA8_VWB8_WGM8_WGMXCC1_WGMXCCGn1
    SolutionIndex: 12
    SolutionNameMin: Cijk_Ailk_Bljk_F8NB8NS_BH_Bias_HAS_SAV_UserArgs_MT128x256x64_MI16x16x1_SN_LDSB1_CLR1_GRVWA16_GRVWB8_GSU0_GSUC0_GSUWGMRR0_K1_LBSPPA1024_LBSPPB512_LPA64_LPB8_LRVW8_MIWT4_8_PLR1_SU0_SUM0_SUS64_VWA4_VWB8_WGM1_WGMXCC1_WGMXCCGn1
    SolutionIndex: 13
    SolutionNameMin: Cijk_Ailk_Bljk_F8NB8NS_BH_Bias_HAS_SAV_UserArgs_MT128x256x64_MI16x16x1_SN_LDSB1_CLR1_GRVWA16_GRVWB8_GSU0_GSUC0_GSUWGMRR0_K1_LBSPPA1024_LBSPPB512_LPA64_LPB8_LRVW8_MIWT4_8_PLR1_SU0_SUM0_SUS64_VWA4_VWB8_WGM4_WGMXCC1_WGMXCCGn1
    SolutionIndex: 14
    SolutionNameMin: Cijk_Ailk_Bljk_F8NB8NS_BH_Bias_HAS_SAV_UserArgs_MT128x256x64_MI16x16x1_SN_LDSB1_CLR1_GRVWA16_GRVWB8_GSU0_GSUC0_GSUWGMRR0_K1_LBSPPA1024_LBSPPB512_LPA64_LPB8_LRVW8_MIWT4_8_PLR1_SU0_SUM0_SUS64_VWA4_VWB8_WGM6_WGMXCC1_WGMXCCGn1
    SolutionIndex: 15
    SolutionNameMin: Cijk_Ailk_Bljk_F8NB8NS_BH_Bias_HAS_SAV_UserArgs_MT128x256x64_MI16x16x1_SN_LDSB1_CLR1_GRVWA8_GRVWB16_GSU0_GSUC0_GSUWGMRR0_K1_LBSPPA1024_LBSPPB512_LPA64_LPB16_LRVW8_MIWT4_8_PLR1_SU0_SUM0_SUS64_VWA4_VWB8_WGM6_WGMXCC1_WGMXCCGn1
    SolutionIndex: 16
    SolutionNameMin: Cijk_Ailk_Bljk_F8NB8NS_BH_Bias_HAS_SAV_UserArgs_MT256x128x64_MI16x16x1_SN_LDSB1_CLR1_GRVWA16_GRVWB16_GSU0_GSUC0_GSUWGMRR0_K1_LBSPPA2048_LBSPPB256_LPA0_LPB16_LRVW8_MIWT8_4_PLR1_SU0_SUM0_SUS64_VWA8_VWB4_WGM1_WGMXCC1_WGMXCCGn1
    SolutionIndex: 17
    SolutionNameMin: Cijk_Ailk_Bljk_F8NB8NS_BH_Bias_HAS_SAV_UserArgs_MT256x128x64_MI16x16x1_SN_LDSB1_CLR1_GRVWA16_GRVWB16_GSU0_GSUC0_GSUWGMRR0_K1_LBSPPA2048_LBSPPB256_LPA0_LPB16_LRVW8_MIWT8_4_PLR1_SU0_SUM0_SUS64_VWA8_VWB4_WGM4_WGMXCC1_WGMXCCGn1
    SolutionIndex: 18
    SolutionNameMin: Cijk_Ailk_Bljk_F8NB8NS_BH_Bias_HAS_SAV_UserArgs_MT256x128x64_MI16x16x1_SN_LDSB1_CLR1_GRVWA16_GRVWB16_GSU0_GSUC0_GSUWGMRR0_K1_LBSPPA2048_LBSPPB256_LPA0_LPB16_LRVW8_MIWT8_4_PLR1_SU0_SUM0_SUS64_VWA8_VWB4_WGM8_WGMXCC1_WGMXCCGn1
    SolutionIndex: 19
    SolutionNameMin: Cijk_Ailk_Bljk_F8NB8NS_BH_Bias_HAS_SAV_UserArgs_MT128x128x64_MI16x16x1_SN_LDSB1_CLR1_GRVWA8_GRVWB16_GSU0_GSUC0_GSUWGMRR0_K1_LBSPPA1024_LBSPPB256_LPA64_LPB16_LRVW8_MIWT4_4_PLR1_SU0_SUM0_SUS64_VWA4_VWB4_WGM1_WGMXCC1_WGMXCCGn1
    SolutionIndex: 20
    SolutionNameMin: Cijk_Ailk_Bljk_F8NB8NS_BH_Bias_HAS_SAV_UserArgs_MT128x128x64_MI16x16x1_SN_LDSB1_CLR1_GRVWA16_GRVWB16_GSU0_GSUC0_GSUWGMRR0_K1_LBSPPA1024_LBSPPB256_LPA64_LPB16_LRVW8_MIWT4_4_PLR1_SU0_SUM0_SUS64_VWA4_VWB4_WGM1_WGMXCC1_WGMXCCGn1
    SolutionIndex: 21
    SolutionNameMin: Cijk_Ailk_Bljk_F8NB8NS_BH_Bias_HAS_SAV_UserArgs_MT128x128x64_MI16x16x1_SN_LDSB1_CLR1_GRVWA8_GRVWB16_GSU0_GSUC0_GSUWGMRR0_K1_LBSPPA1024_LBSPPB256_LPA64_LPB16_LRVW8_MIWT4_4_PLR1_SU0_SUM0_SUS64_VWA4_VWB4_WGM4_WGMXCC1_WGMXCCGn1
    SolutionIndex: 22
    SolutionNameMin: Cijk_Ailk_Bljk_F8NB8NS_BH_Bias_HAS_SAV_UserArgs_MT64x128x64_MI16x16x1_SN_LDSB0_CLR1_GRVWA16_GRVWB8_GSU0_GSUC0_GSUWGMRR0_K1_LBSPPA512_LBSPPB256_LPA32_LPB8_LRVW8_MIWT2_4_PLR1_SU0_SUM0_SUS64_VWA2_VWB4_WGM1_WGMXCC1_WGMXCCGn1
    SolutionIndex: 23
    SolutionNameMin: Cijk_Ailk_Bljk_F8NB8NS_BH_Bias_HAS_SAV_UserArgs_MT64x128x64_MI16x16x1_SN_LDSB0_CLR1_GRVWA8_GRVWB16_GSU0_GSUC0_GSUWGMRR0_K1_LBSPPA512_LBSPPB256_LPA32_LPB16_LRVW8_MIWT2_4_PLR1_SU0_SUM0_SUS64_VWA2_VWB4_WGM1_WGMXCC1_WGMXCCGn1
    SolutionIndex: 24
    SolutionNameMin: Cijk_Ailk_Bljk_F8NB8NS_BH_Bias_HAS_SAV_UserArgs_MT64x128x64_MI16x16x1_SN_LDSB0_CLR1_GRVWA16_GRVWB16_GSU0_GSUC0_GSUWGMRR0_K1_LBSPPA512_LBSPPB256_LPA32_LPB16_LRVW8_MIWT2_4_PLR1_SU0_SUM0_SUS64_VWA2_VWB4_WGM1_WGMXCC1_WGMXCCGn1
    SolutionIndex: 25
    SolutionNameMin: Cijk_Ailk_Bljk_F8NB8NS_BH_Bias_HAS_SAV_UserArgs_MT64x128x64_MI16x16x1_SN_LDSB0_CLR1_GRVWA16_GRVWB16_GSU0_GSUC0_GSUWGMRR0_K1_LBSPPA512_LBSPPB256_LPA32_LPB16_LRVW8_MIWT2_4_PLR1_SU0_SUM0_SUS64_VWA2_VWB4_WGM6_WGMXCC1_WGMXCCGn1
    SolutionIndex: 26
    SolutionNameMin: Cijk_Ailk_Bljk_F8NB8NS_BH_Bias_HAS_SAV_UserArgs_MT128x64x64_MI16x16x1_SN_LDSB0_CLR1_GRVWA8_GRVWB8_GSU0_GSUC0_GSUWGMRR0_K1_LBSPPA1024_LBSPPB128_LPA64_LPB8_LRVW8_MIWT4_2_PLR1_SU0_SUM0_SUS64_VWA4_VWB2_WGM1_WGMXCC1_WGMXCCGn1
    SolutionIndex: 27
    SolutionNameMin: Cijk_Ailk_Bljk_F8NB8NS_BH_Bias_HAS_SAV_UserArgs_MT128x64x64_MI16x16x1_SN_LDSB0_CLR1_GRVWA16_GRVWB8_GSU0_GSUC0_GSUWGMRR0_K1_LBSPPA1024_LBSPPB128_LPA64_LPB8_LRVW8_MIWT4_2_PLR1_SU0_SUM0_SUS64_VWA4_VWB2_WGM1_WGMXCC1_WGMXCCGn1
    SolutionIndex: 28
    SolutionNameMin: Cijk_Ailk_Bljk_F8NB8NS_BH_Bias_HAS_SAV_UserArgs_MT128x64x64_MI16x16x1_SN_LDSB0_CLR1_GRVWA8_GRVWB16_GSU0_GSUC0_GSUWGMRR0_K1_LBSPPA1024_LBSPPB128_LPA64_LPB16_LRVW8_MIWT4_2_PLR1_SU0_SUM0_SUS64_VWA4_VWB2_WGM1_WGMXCC1_WGMXCCGn1
    SolutionIndex: 29
    SolutionNameMin: Cijk_Ailk_Bljk_F8NB8NS_BH_Bias_HAS_SAV_UserArgs_MT128x64x64_MI16x16x1_SN_LDSB0_CLR1_GRVWA16_GRVWB16_GSU0_GSUC0_GSUWGMRR0_K1_LBSPPA1024_LBSPPB128_LPA64_LPB16_LRVW8_MIWT4_2_PLR1_SU0_SUM0_SUS64_VWA4_VWB2_WGM1_WGMXCC1_WGMXCCGn1
    SolutionIndex: 30
    SolutionNameMin: Cijk_Ailk_Bljk_F8NB8NS_BH_Bias_HAS_SAV_UserArgs_MT128x32x64_MI16x16x1_SN_LDSB0_CLR1_GRVWA8_GRVWB8_GSU0_GSUC0_GSUWGMRR0_K1_LBSPPA1024_LBSPPB128_LPA64_LPB8_LRVW8_MIWT4_1_PLR1_SU0_SUM0_SUS64_VWA4_VWB1_WGM1_WGMXCC1_WGMXCCGn1
    SolutionIndex: 31
    SolutionNameMin: Cijk_Ailk_Bljk_F8NB8NS_BH_Bias_HAS_SAV_UserArgs_MT128x32x64_MI16x16x1_SN_LDSB0_CLR1_GRVWA16_GRVWB8_GSU0_GSUC0_GSUWGMRR0_K1_LBSPPA1024_LBSPPB128_LPA64_LPB8_LRVW8_MIWT4_1_PLR1_SU0_SUM0_SUS64_VWA4_VWB1_WGM1_WGMXCC1_WGMXCCGn1
    SolutionIndex: 32
    SolutionNameMin: Cijk_Ailk_Bljk_F8NB8NS_BH_Bias_HAS_SAV_UserArgs_MT64x64x64_MI16x16x1_SN_LDSB0_CLR1_GRVWA8_GRVWB8_GSU0_GSUC0_GSUWGMRR0_K1_LBSPPA512_LBSPPB128_LPA32_LPB8_LRVW8_MIWT2_2_PLR1_SU0_SUM0_SUS64_VWA2_VWB2_WGM1_WGMXCC1_WGMXCCGn1
    SolutionIndex: 33
    SolutionNameMin: Cijk_Ailk_Bljk_F8NB8NS_BH_Bias_HAS_SAV_UserArgs_MT64x64x64_MI16x16x1_SN_LDSB0_CLR1_GRVWA8_GRVWB16_GSU0_GSUC0_GSUWGMRR0_K1_LBSPPA512_LBSPPB128_LPA32_LPB16_LRVW8_MIWT2_2_PLR1_SU0_SUM0_SUS64_VWA2_VWB2_WGM1_WGMXCC1_WGMXCCGn1
    SolutionIndex: 34
    SolutionNameMin: Cijk_Ailk_Bljk_F8NB8NS_BH_Bias_HAS_SAV_UserArgs_MT64x32x64_MI16x16x1_SN_LDSB0_CLR1_GRVWA8_GRVWB8_GSU0_GSUC0_GSUWGMRR0_K1_LBSPPA512_LBSPPB128_LPA32_LPB8_LRVW8_MIWT2_1_PLR1_SU0_SUM0_SUS64_VWA2_VWB1_WGM1_WGMXCC1_WGMXCCGn1
    SolutionIndex: 35
    SolutionNameMin: Cijk_Ailk_Bljk_F8NB8NS_BH_Bias_HAS_SAV_UserArgs_MT32x32x64_MI16x16x1_SN_LDSB0_CLR1_GRVWA8_GRVWB8_GSU0_GSUC0_GSUWGMRR0_K1_LBSPPA256_LBSPPB128_LPA16_LPB8_LRVW8_MIWT1_1_PLR1_SU0_SUM0_SUS64_VWA1_VWB1_WGM1_WGMXCC1_WGMXCCGn1
    SolutionIndex: 36
    SolutionNameMin: Cijk_Ailk_Bljk_F8NB8NS_BH_Bias_HAS_SAV_UserArgs_MT32x32x64_MI16x16x1_SN_LDSB0_CLR1_GRVWA8_GRVWB8_GSU0_GSUC0_GSUWGMRR0_K1_LBSPPA256_LBSPPB128_LPA16_LPB8_LRVW8_MIWT1_1_PLR1_SU0_SUM0_SUS64_VWA1_VWB1_WGM4_WGMXCC1_WGMXCCGn1
    SolutionIndex: 37
    SolutionNameMin: Cijk_Ailk_Bljk_F8NB8NS_BH_Bias_HAS_SAV_UserArgs_MT128x256x128_MI16x16x1_SN_LDSB1_CLR1_GRVWA16_GRVWB16_GSU0_GSUC0_GSUWGMRR0_K1_LBSPPA1024_LBSPPB1024_LPA64_LPB16_LRVW8_MIWT4_8_PLR1_SU0_SUM0_SUS128_VWA4_VWB8_WGM1_WGMXCC1_WGMXCCGn1
    SolutionIndex: 38
    SolutionNameMin: Cijk_Ailk_Bljk_F8NB8NS_BH_Bias_HAS_SAV_UserArgs_MT128x256x128_MI16x16x1_SN_LDSB1_CLR1_GRVWA16_GRVWB16_GSU0_GSUC0_GSUWGMRR0_K1_LBSPPA1024_LBSPPB1024_LPA64_LPB16_LRVW8_MIWT4_8_PLR1_SU0_SUM0_SUS128_VWA4_VWB8_WGM4_WGMXCC1_WGMXCCGn1
    SolutionIndex: 39
    SolutionNameMin: Cijk_Ailk_Bljk_F8NB8NS_BH_Bias_HAS_SAV_UserArgs_MT128x256x128_MI16x16x1_SN_LDSB1_CLR1_GRVWA16_GRVWB16_GSU0_GSUC0_GSUWGMRR0_K1_LBSPPA1024_LBSPPB1024_LPA64_LPB16_LRVW8_MIWT4_8_PLR1_SU0_SUM0_SUS128_VWA4_VWB8_WGM6_WGMXCC1_WGMXCCGn1
    SolutionIndex: 40
    SolutionNameMin: Cijk_Ailk_Bljk_F8NB8NS_BH_Bias_HAS_SAV_UserArgs_MT256x144x128_MI16x16x1_SN_LDSB1_CLR1_GRVWA8_GRVWB8_GSU0_GSUC0_GSUWGMRR0_K1_LBSPPA2048_LBSPPB128_LPA64_LPB8_LRVW8_MIWT4_9_PLR1_SU0_SUM0_SUS128_VWA4_VWB1_WGM1_WGMXCC1_WGMXCCGn1
    SolutionIndex: 41
    SolutionNameMin: Cijk_Ailk_Bljk_F8NB8NS_BH_Bias_HAS_SAV_UserArgs_MT256x144x128_MI16x16x1_SN_LDSB1_CLR1_GRVWA16_GRVWB8_GSU0_GSUC0_GSUWGMRR0_K1_LBSPPA2048_LBSPPB128_LPA64_LPB8_LRVW8_MIWT4_9_PLR1_SU0_SUM0_SUS128_VWA4_VWB1_WGM1_WGMXCC1_WGMXCCGn1
    SolutionIndex: 42
    SolutionNameMin: Cijk_Ailk_Bljk_F8NB8NS_BH_Bias_HAS_SAV_UserArgs_MT256x144x128_MI16x16x1_SN_LDSB1_CLR1_GRVWA8_GRVWB8_GSU0_GSUC0_GSUWGMRR0_K1_LBSPPA2048_LBSPPB128_LPA64_LPB8_LRVW8_MIWT4_9_PLR1_SU0_SUM0_SUS128_VWA4_VWB1_WGM4_WGMXCC1_WGMXCCGn1
    SolutionIndex: 43
    SolutionNameMin: Cijk_Ailk_Bljk_F8NB8NS_BH_Bias_HAS_SAV_UserArgs_MT256x144x128_MI16x16x1_SN_LDSB1_CLR1_GRVWA16_GRVWB8_GSU0_GSUC0_GSUWGMRR0_K1_LBSPPA2048_LBSPPB128_LPA64_LPB8_LRVW8_MIWT4_9_PLR1_SU0_SUM0_SUS128_VWA4_VWB1_WGM4_WGMXCC1_WGMXCCGn1
    SolutionIndex: 44
    SolutionNameMin: Cijk_Ailk_Bljk_F8NB8NS_BH_Bias_HAS_SAV_UserArgs_MT256x144x128_MI16x16x1_SN_LDSB1_CLR1_GRVWA16_GRVWB8_GSU0_GSUC0_GSUWGMRR0_K1_LBSPPA2048_LBSPPB128_LPA64_LPB8_LRVW8_MIWT4_9_PLR1_SU0_SUM0_SUS128_VWA4_VWB1_WGM6_WGMXCC1_WGMXCCGn1
    SolutionIndex: 45
    SolutionNameMin: Cijk_Ailk_Bljk_F8NB8NS_BH_Bias_HAS_SAV_UserArgs_MT256x144x128_MI16x16x1_SN_LDSB1_CLR1_GRVWA16_GRVWB8_GSU0_GSUC0_GSUWGMRR0_K1_LBSPPA2048_LBSPPB128_LPA64_LPB8_LRVW8_MIWT4_9_PLR1_SU0_SUM0_SUS128_VWA4_VWB1_WGM8_WGMXCC1_WGMXCCGn1
    SolutionIndex: 46
    SolutionNameMin: Cijk_Ailk_Bljk_F8NB8NS_BH_Bias_HAS_SAV_UserArgs_MT256x128x128_MI16x16x1_SN_LDSB1_CLR1_GRVWA16_GRVWB8_GSU0_GSUC0_GSUWGMRR0_K1_LBSPPA2048_LBSPPB512_LPA0_LPB8_LRVW8_MIWT8_4_PLR1_SU0_SUM0_SUS128_VWA8_VWB4_WGM1_WGMXCC1_WGMXCCGn1
    SolutionIndex: 47
    SolutionNameMin: Cijk_Ailk_Bljk_F8NB8NS_BH_Bias_HAS_SAV_UserArgs_MT256x128x128_MI16x16x1_SN_LDSB1_CLR1_GRVWA16_GRVWB16_GSU0_GSUC0_GSUWGMRR0_K1_LBSPPA2048_LBSPPB512_LPA0_LPB16_LRVW8_MIWT8_4_PLR1_SU0_SUM0_SUS128_VWA8_VWB4_WGM4_WGMXCC1_WGMXCCGn1
    SolutionIndex: 48
    SolutionNameMin: Cijk_Ailk_Bljk_F8NB8NS_BH_Bias_HAS_SAV_UserArgs_MT256x128x128_MI16x16x1_SN_LDSB1_CLR1_GRVWA16_GRVWB8_GSU0_GSUC0_GSUWGMRR0_K1_LBSPPA2048_LBSPPB512_LPA0_LPB8_LRVW8_MIWT8_4_PLR1_SU0_SUM0_SUS128_VWA8_VWB4_WGM8_WGMXCC1_WGMXCCGn1
    SolutionIndex: 49
    SolutionNameMin: Cijk_Ailk_Bljk_F8NB8NS_BH_Bias_HAS_SAV_UserArgs_MT128x144x128_MI16x16x1_SN_LDSB1_CLR1_GRVWA16_GRVWB8_GSU0_GSUC0_GSUWGMRR0_K1_LBSPPA1024_LBSPPB128_LPA32_LPB8_LRVW8_MIWT2_9_PLR1_SU0_SUM0_SUS128_VWA2_VWB1_WGM1_WGMXCC1_WGMXCCGn1
    SolutionIndex: 50
    SolutionNameMin: Cijk_Ailk_Bljk_F8NB8NS_BH_Bias_HAS_SAV_UserArgs_MT128x144x128_MI16x16x1_SN_LDSB1_CLR1_GRVWA16_GRVWB8_GSU0_GSUC0_GSUWGMRR0_K1_LBSPPA1024_LBSPPB128_LPA32_LPB8_LRVW8_MIWT2_9_PLR1_SU0_SUM0_SUS128_VWA2_VWB1_WGM4_WGMXCC1_WGMXCCGn1
    SolutionIndex: 51
    SolutionNameMin: Cijk_Ailk_Bljk_F8NB8NS_BH_Bias_HAS_SAV_UserArgs_MT128x128x128_MI16x16x1_SN_LDSB1_CLR1_GRVWA16_GRVWB16_GSU0_GSUC0_GSUWGMRR0_K1_LBSPPA1024_LBSPPB512_LPA64_LPB16_LRVW8_MIWT4_4_PLR1_SU0_SUM0_SUS128_VWA4_VWB4_WGM1_WGMXCC1_WGMXCCGn1
    SolutionIndex: 52
    SolutionNameMin: Cijk_Ailk_Bljk_F8NB8NS_BH_Bias_HAS_SAV_UserArgs_MT128x128x128_MI16x16x1_SN_LDSB1_CLR1_GRVWA16_GRVWB16_GSU0_GSUC0_GSUWGMRR0_K1_LBSPPA1024_LBSPPB512_LPA64_LPB16_LRVW8_MIWT4_4_PLR1_SU0_SUM0_SUS128_VWA4_VWB4_WGM4_WGMXCC1_WGMXCCGn1
    SolutionIndex: 53
    SolutionNameMin: Cijk_Ailk_Bljk_F8NB8NS_BH_Bias_HAS_SAV_UserArgs_MT128x128x128_MI16x16x1_SN_LDSB1_CLR1_GRVWA16_GRVWB16_GSU0_GSUC0_GSUWGMRR0_K1_LBSPPA1024_LBSPPB512_LPA64_LPB16_LRVW8_MIWT4_4_PLR1_SU0_SUM0_SUS128_VWA4_VWB4_WGM6_WGMXCC1_WGMXCCGn1
    SolutionIndex: 54
    SolutionNameMin: Cijk_Ailk_Bljk_F8NB8NS_BH_Bias_HAS_SAV_UserArgs_MT128x128x128_MI16x16x1_SN_LDSB1_CLR1_GRVWA16_GRVWB16_GSU0_GSUC0_GSUWGMRR0_K1_LBSPPA1024_LBSPPB512_LPA64_LPB16_LRVW8_MIWT4_4_PLR1_SU0_SUM0_SUS128_VWA4_VWB4_WGM8_WGMXCC1_WGMXCCGn1
    SolutionIndex: 55
    SolutionNameMin: Cijk_Ailk_Bljk_F8NB8NS_BH_Bias_HAS_SAV_UserArgs_MT64x128x128_MI16x16x1_SN_LDSB1_CLR1_GRVWA16_GRVWB16_GSU0_GSUC0_GSUWGMRR0_K1_LBSPPA512_LBSPPB512_LPA32_LPB16_LRVW8_MIWT2_4_PLR1_SU0_SUM0_SUS128_VWA2_VWB4_WGM1_WGMXCC1_WGMXCCGn1
    SolutionIndex: 56
    SolutionNameMin: Cijk_Ailk_Bljk_F8NB8NS_BH_Bias_HAS_SAV_UserArgs_MT64x128x128_MI16x16x1_SN_LDSB1_CLR1_GRVWA8_GRVWB16_GSU0_GSUC0_GSUWGMRR0_K1_LBSPPA512_LBSPPB512_LPA32_LPB16_LRVW8_MIWT2_4_PLR1_SU0_SUM0_SUS128_VWA2_VWB4_WGM4_WGMXCC1_WGMXCCGn1
    SolutionIndex: 57
    SolutionNameMin: Cijk_Ailk_Bljk_F8NB8NS_BH_Bias_HAS_SAV_UserArgs_MT128x64x128_MI16x16x1_SN_LDSB1_CLR1_GRVWA16_GRVWB16_GSU0_GSUC0_GSUWGMRR0_K1_LBSPPA1024_LBSPPB256_LPA64_LPB16_LRVW8_MIWT4_2_PLR1_SU0_SUM0_SUS128_VWA4_VWB2_WGM1_WGMXCC1_WGMXCCGn1
    SolutionIndex: 58
    SolutionNameMin: Cijk_Ailk_Bljk_F8NB8NS_BH_Bias_HAS_SAV_UserArgs_MT128x64x128_MI16x16x1_SN_LDSB1_CLR1_GRVWA16_GRVWB16_GSU0_GSUC0_GSUWGMRR0_K1_LBSPPA1024_LBSPPB256_LPA64_LPB16_LRVW8_MIWT4_2_PLR1_SU0_SUM0_SUS128_VWA4_VWB2_WGM4_WGMXCC1_WGMXCCGn1
    SolutionIndex: 59
    SolutionNameMin: Cijk_Ailk_Bljk_F8NB8NS_BH_Bias_HAS_SAV_UserArgs_MT128x64x128_MI16x16x1_SN_LDSB1_CLR1_GRVWA16_GRVWB16_GSU0_GSUC0_GSUWGMRR0_K1_LBSPPA1024_LBSPPB256_LPA64_LPB16_LRVW8_MIWT4_2_PLR1_SU0_SUM0_SUS128_VWA4_VWB2_WGM6_WGMXCC1_WGMXCCGn1
    SolutionIndex: 60
    SolutionNameMin: Cijk_Ailk_Bljk_F8NB8NS_BH_Bias_HAS_SAV_UserArgs_MT128x64x128_MI16x16x1_SN_LDSB1_CLR1_GRVWA16_GRVWB16_GSU0_GSUC0_GSUWGMRR0_K1_LBSPPA1024_LBSPPB256_LPA64_LPB16_LRVW8_MIWT4_2_PLR1_SU0_SUM0_SUS128_VWA4_VWB2_WGM8_WGMXCC1_WGMXCCGn1
    SolutionIndex: 61
    SolutionNameMin: Cijk_Ailk_Bljk_F8NB8NS_BH_Bias_HAS_SAV_UserArgs_MT64x64x128_MI16x16x1_SN_LDSB1_CLR1_GRVWA16_GRVWB8_GSU0_GSUC0_GSUWGMRR0_K1_LBSPPA512_LBSPPB256_LPA32_LPB8_LRVW8_MIWT2_2_PLR1_SU0_SUM0_SUS128_VWA2_VWB2_WGM1_WGMXCC1_WGMXCCGn1
    SolutionIndex: 62
    SolutionNameMin: Cijk_Ailk_Bljk_F8NB8NS_BH_Bias_HAS_SAV_UserArgs_MT64x64x128_MI16x16x1_SN_LDSB1_CLR1_GRVWA8_GRVWB16_GSU0_GSUC0_GSUWGMRR0_K1_LBSPPA512_LBSPPB256_LPA32_LPB16_LRVW8_MIWT2_2_PLR1_SU0_SUM0_SUS128_VWA2_VWB2_WGM1_WGMXCC1_WGMXCCGn1
    SolutionIndex: 63
    SolutionNameMin: Cijk_Ailk_Bljk_F8NB8NS_BH_Bias_HAS_SAV_UserArgs_MT64x64x128_MI16x16x1_SN_LDSB1_CLR1_GRVWA16_GRVWB16_GSU0_GSUC0_GSUWGMRR0_K1_LBSPPA512_LBSPPB256_LPA32_LPB16_LRVW8_MIWT2_2_PLR1_SU0_SUM0_SUS128_VWA2_VWB2_WGM1_WGMXCC1_WGMXCCGn1
    SolutionIndex: 64
    SolutionNameMin: Cijk_Ailk_Bljk_F8NB8NS_BH_Bias_HAS_SAV_UserArgs_MT64x64x128_MI16x16x1_SN_LDSB1_CLR1_GRVWA16_GRVWB16_GSU0_GSUC0_GSUWGMRR0_K1_LBSPPA512_LBSPPB256_LPA32_LPB16_LRVW8_MIWT2_2_PLR1_SU0_SUM0_SUS128_VWA2_VWB2_WGM4_WGMXCC1_WGMXCCGn1
    SolutionIndex: 65
    SolutionNameMin: Cijk_Ailk_Bljk_F8NB8NS_BH_Bias_HAS_SAV_UserArgs_MT64x64x128_MI16x16x1_SN_LDSB1_CLR1_GRVWA16_GRVWB16_GSU0_GSUC0_GSUWGMRR0_K1_LBSPPA512_LBSPPB256_LPA32_LPB16_LRVW8_MIWT2_2_PLR1_SU0_SUM0_SUS128_VWA2_VWB2_WGM6_WGMXCC1_WGMXCCGn1
    SolutionIndex: 66
    SolutionNameMin: Cijk_Ailk_Bljk_F8NB8NS_BH_Bias_HAS_SAV_UserArgs_MT64x64x128_MI16x16x1_SN_LDSB1_CLR1_GRVWA16_GRVWB16_GSU0_GSUC0_GSUWGMRR0_K1_LBSPPA512_LBSPPB256_LPA32_LPB16_LRVW8_MIWT2_2_PLR1_SU0_SUM0_SUS128_VWA2_VWB2_WGM8_WGMXCC1_WGMXCCGn1
    SolutionIndex: 67
    SolutionNameMin: Cijk_Ailk_Bljk_F8NB8NS_BH_Bias_HAS_SAV_UserArgs_MT32x64x128_MI16x16x1_SN_LDSB0_CLR1_GRVWA8_GRVWB8_GSU0_GSUC0_GSUWGMRR0_K1_LBSPPA256_LBSPPB256_LPA16_LPB8_LRVW8_MIWT1_2_PLR1_SU0_SUM0_SUS128_VWA1_VWB2_WGM1_WGMXCC1_WGMXCCGn1
    SolutionIndex: 68
    SolutionNameMin: Cijk_Ailk_Bljk_F8NB8NS_BH_Bias_HAS_SAV_UserArgs_MT32x64x128_MI16x16x1_SN_LDSB0_CLR1_GRVWA8_GRVWB16_GSU0_GSUC0_GSUWGMRR0_K1_LBSPPA256_LBSPPB256_LPA16_LPB16_LRVW8_MIWT1_2_PLR1_SU0_SUM0_SUS128_VWA1_VWB2_WGM1_WGMXCC1_WGMXCCGn1
    SolutionIndex: 69
    SolutionNameMin: Cijk_Ailk_Bljk_F8NB8NS_BH_Bias_HAS_SAV_UserArgs_MT32x64x128_MI16x16x1_SN_LDSB0_CLR1_GRVWA16_GRVWB16_GSU0_GSUC0_GSUWGMRR0_K1_LBSPPA256_LBSPPB256_LPA16_LPB16_LRVW8_MIWT1_2_PLR1_SU0_SUM0_SUS128_VWA1_VWB2_WGM1_WGMXCC1_WGMXCCGn1
    SolutionIndex: 70
    SolutionNameMin: Cijk_Ailk_Bljk_F8NB8NS_BH_Bias_HAS_SAV_UserArgs_MT32x64x128_MI16x16x1_SN_LDSB0_CLR1_GRVWA8_GRVWB16_GSU0_GSUC0_GSUWGMRR0_K1_LBSPPA256_LBSPPB256_LPA16_LPB16_LRVW8_MIWT1_2_PLR1_SU0_SUM0_SUS128_VWA1_VWB2_WGM6_WGMXCC1_WGMXCCGn1
    SolutionIndex: 71
    SolutionNameMin: Cijk_Ailk_Bljk_F8NB8NS_BH_Bias_HAS_SAV_UserArgs_MT64x32x128_MI16x16x1_SN_LDSB0_CLR1_GRVWA8_GRVWB8_GSU0_GSUC0_GSUWGMRR0_K1_LBSPPA512_LBSPPB128_LPA32_LPB8_LRVW8_MIWT2_1_PLR1_SU0_SUM0_SUS128_VWA2_VWB1_WGM1_WGMXCC1_WGMXCCGn1
    SolutionIndex: 72
    SolutionNameMin: Cijk_Ailk_Bljk_F8NB8NS_BH_Bias_HAS_SAV_UserArgs_MT64x32x128_MI16x16x1_SN_LDSB0_CLR1_GRVWA8_GRVWB16_GSU0_GSUC0_GSUWGMRR0_K1_LBSPPA512_LBSPPB128_LPA32_LPB16_LRVW8_MIWT2_1_PLR1_SU0_SUM0_SUS128_VWA2_VWB1_WGM1_WGMXCC1_WGMXCCGn1
    SolutionIndex: 73
    SolutionNameMin: Cijk_Ailk_Bljk_F8NB8NS_BH_Bias_HAS_SAV_UserArgs_MT64x32x128_MI16x16x1_SN_LDSB0_CLR1_GRVWA16_GRVWB16_GSU0_GSUC0_GSUWGMRR0_K1_LBSPPA512_LBSPPB128_LPA32_LPB16_LRVW8_MIWT2_1_PLR1_SU0_SUM0_SUS128_VWA2_VWB1_WGM1_WGMXCC1_WGMXCCGn1
    SolutionIndex: 74
    SolutionNameMin: Cijk_Ailk_Bljk_F8NB8NS_BH_Bias_HAS_SAV_UserArgs_MT32x32x128_MI16x16x1_SN_LDSB0_CLR1_GRVWA8_GRVWB8_GSU0_GSUC0_GSUWGMRR0_K1_LBSPPA256_LBSPPB128_LPA16_LPB8_LRVW8_MIWT1_1_PLR1_SU0_SUM0_SUS128_VWA1_VWB1_WGM1_WGMXCC1_WGMXCCGn1
    SolutionIndex: 75
    SolutionNameMin: Cijk_Ailk_Bljk_F8NB8NS_BH_Bias_HAS_SAV_UserArgs_MT32x32x128_MI16x16x1_SN_LDSB0_CLR1_GRVWA8_GRVWB16_GSU0_GSUC0_GSUWGMRR0_K1_LBSPPA256_LBSPPB128_LPA16_LPB16_LRVW8_MIWT1_1_PLR1_SU0_SUM0_SUS128_VWA1_VWB1_WGM1_WGMXCC1_WGMXCCGn1
    SolutionIndex: 76
    SolutionNameMin: Cijk_Ailk_Bljk_F8NB8NS_BH_Bias_HAS_SAV_UserArgs_MT32x32x128_MI16x16x1_SN_LDSB0_CLR1_GRVWA16_GRVWB16_GSU0_GSUC0_GSUWGMRR0_K1_LBSPPA256_LBSPPB128_LPA16_LPB16_LRVW8_MIWT1_1_PLR1_SU0_SUM0_SUS128_VWA1_VWB1_WGM1_WGMXCC1_WGMXCCGn1
    SolutionIndex: 77
    SolutionNameMin: Cijk_Ailk_Bljk_F8NB8NS_BH_Bias_HAS_SAV_UserArgs_MT32x32x128_MI16x16x1_SN_LDSB0_CLR1_GRVWA16_GRVWB8_GSU0_GSUC0_GSUWGMRR0_K1_LBSPPA256_LBSPPB128_LPA16_LPB8_LRVW8_MIWT1_1_PLR1_SU0_SUM0_SUS128_VWA1_VWB1_WGM6_WGMXCC1_WGMXCCGn1
    SolutionIndex: 78
    SolutionNameMin: Cijk_Ailk_Bljk_F8NB8NS_BH_Bias_HAS_SAV_UserArgs_MT128x64x256_MI16x16x1_SN_LDSB1_CLR1_GRVWA16_GRVWB16_GSU0_GSUC0_GSUWGMRR0_K1_LBSPPA1024_LBSPPB512_LPA64_LPB16_LRVW8_MIWT4_2_PLR1_SU0_SUM0_SUS256_VWA4_VWB2_WGM1_WGMXCC1_WGMXCCGn1
    SolutionIndex: 79
    SolutionNameMin: Cijk_Ailk_Bljk_F8NB8NS_BH_Bias_HAS_SAV_UserArgs_MT64x64x256_MI16x16x1_SN_LDSB1_CLR1_GRVWA16_GRVWB16_GSU0_GSUC0_GSUWGMRR0_K1_LBSPPA512_LBSPPB512_LPA32_LPB16_LRVW8_MIWT2_2_PLR1_SU0_SUM0_SUS256_VWA2_VWB2_WGM1_WGMXCC1_WGMXCCGn1
    SolutionIndex: 80
    SolutionNameMin: Cijk_Ailk_Bljk_F8NB8NS_BH_Bias_HAS_SAV_UserArgs_MT64x32x256_MI16x16x1_SN_LDSB1_CLR1_GRVWA16_GRVWB16_GSU0_GSUC0_GSUWGMRR0_K1_LBSPPA512_LBSPPB256_LPA32_LPB16_LRVW8_MIWT2_1_PLR1_SU0_SUM0_SUS256_VWA2_VWB1_WGM1_WGMXCC1_WGMXCCGn1
    SolutionIndex: 81
    SolutionNameMin: Cijk_Ailk_Bljk_F8NB8NS_BH_Bias_HAS_SAV_UserArgs_MT64x32x256_MI16x16x1_SN_LDSB1_CLR1_GRVWA16_GRVWB16_GSU0_GSUC0_GSUWGMRR0_K1_LBSPPA512_LBSPPB256_LPA32_LPB16_LRVW8_MIWT2_1_PLR1_SU0_SUM0_SUS256_VWA2_VWB1_WGM4_WGMXCC1_WGMXCCGn1
    SolutionIndex: 82
    SolutionNameMin: Cijk_Ailk_Bljk_F8NB8NS_BH_Bias_HAS_SAV_UserArgs_MT64x32x256_MI16x16x1_SN_LDSB1_CLR1_GRVWA16_GRVWB16_GSU0_GSUC0_GSUWGMRR0_K1_LBSPPA512_LBSPPB256_LPA32_LPB16_LRVW8_MIWT2_1_PLR1_SU0_SUM0_SUS256_VWA2_VWB1_WGM6_WGMXCC1_WGMXCCGn1
    SolutionIndex: 83
    SolutionNameMin: Cijk_Ailk_Bljk_F8NB8NS_BH_Bias_HAS_SAV_UserArgs_MT64x32x256_MI16x16x1_SN_LDSB1_CLR1_GRVWA16_GRVWB16_GSU0_GSUC0_GSUWGMRR0_K1_LBSPPA512_LBSPPB256_LPA32_LPB16_LRVW8_MIWT2_1_PLR1_SU0_SUM0_SUS256_VWA2_VWB1_WGM8_WGMXCC1_WGMXCCGn1
    SolutionIndex: 84
    SolutionNameMin: Cijk_Ailk_Bljk_F8NB8NS_BH_Bias_HAS_SAV_UserArgs_MT32x32x256_MI16x16x1_SN_LDSB1_CLR1_GRVWA16_GRVWB8_GSU0_GSUC0_GSUWGMRR0_K1_LBSPPA256_LBSPPB256_LPA16_LPB8_LRVW8_MIWT1_1_PLR1_SU0_SUM0_SUS256_VWA1_VWB1_WGM1_WGMXCC1_WGMXCCGn1
    SolutionIndex: 85
    SolutionNameMin: Cijk_Ailk_Bljk_F8NB8NS_BH_Bias_HAS_SAV_UserArgs_MT32x32x256_MI16x16x1_SN_LDSB1_CLR1_GRVWA8_GRVWB16_GSU0_GSUC0_GSUWGMRR0_K1_LBSPPA256_LBSPPB256_LPA16_LPB16_LRVW8_MIWT1_1_PLR1_SU0_SUM0_SUS256_VWA1_VWB1_WGM4_WGMXCC1_WGMXCCGn1
    SolutionIndex: 86
    SolutionNameMin: Cijk_Ailk_Bljk_F8NB8NS_BH_Bias_HAS_SAV_UserArgs_MT32x32x256_MI16x16x1_SN_LDSB1_CLR1_GRVWA16_GRVWB16_GSU0_GSUC0_GSUWGMRR0_K1_LBSPPA256_LBSPPB256_LPA16_LPB16_LRVW8_MIWT1_1_PLR1_SU0_SUM0_SUS256_VWA1_VWB1_WGM4_WGMXCC1_WGMXCCGn1
    SolutionIndex: 87
    SolutionNameMin: Cijk_Ailk_Bljk_F8NB8NS_BH_Bias_HAS_SAV_UserArgs_MT32x32x256_MI16x16x1_SN_LDSB1_CLR1_GRVWA16_GRVWB16_GSU0_GSUC0_GSUWGMRR0_K1_LBSPPA256_LBSPPB256_LPA16_LPB16_LRVW8_MIWT1_1_PLR1_SU0_SUM0_SUS256_VWA1_VWB1_WGM8_WGMXCC1_WGMXCCGn1
- - - [128, 128, 1, 128, 128, 128, 128, 128]
    - [77, 0.51]
  - - [128, 128, 1, 256, 128, 128, 128, 256]
    - [74, 0.97]
  - - [128, 128, 1, 512, 128, 128, 128, 512]
    - [75, 1.71]
  - - [128, 128, 1, 1024, 128, 128, 128, 1024]
    - [75, 2.69]
  - - [128, 128, 1, 2048, 128, 128, 128, 2048]
    - [76, 3.8]
  - - [128, 128, 1, 4096, 128, 128, 128, 4096]
    - [74, 4.76]
  - - [128, 128, 1, 8192, 128, 128, 128, 8192]
    - [84, 5.44]
  - - [128, 256, 1, 128, 128, 128, 128, 128]
    - [74, 1.11]
  - - [128, 256, 1, 256, 128, 128, 128, 256]
    - [75, 2.02]
  - - [128, 256, 1, 512, 128, 128, 128, 512]
    - [75, 3.52]
  - - [128, 256, 1, 1024, 128, 128, 128, 1024]
    - [75, 5.53]
  - - [128, 256, 1, 2048, 128, 128, 128, 2048]
    - [76, 7.7]
  - - [128, 256, 1, 4096, 128, 128, 128, 4096]
    - [76, 9.57]
  - - [128, 256, 1, 8192, 128, 128, 128, 8192]
    - [74, 10.98]
  - - [128, 512, 1, 128, 128, 128, 128, 128]
    - [35, 2.18]
  - - [128, 512, 1, 256, 128, 128, 128, 256]
    - [75, 4.01]
  - - [128, 512, 1, 512, 128, 128, 128, 512]
    - [75, 6.91]
  - - [128, 512, 1, 1024, 128, 128, 128, 1024]
    - [74, 10.86]
  - - [128, 512, 1, 2048, 128, 128, 128, 2048]
    - [74, 15.29]
  - - [128, 512, 1, 4096, 128, 128, 128, 4096]
    - [74, 18.99]
  - - [128, 512, 1, 8192, 128, 128, 128, 8192]
    - [74, 21.71]
  - - [128, 1024, 1, 128, 128, 128, 128, 128]
    - [74, 4.24]
  - - [128, 1024, 1, 256, 128, 128, 128, 256]
    - [35, 7.74]
  - - [128, 1024, 1, 512, 128, 128, 128, 512]
    - [74, 13.46]
  - - [128, 1024, 1, 1024, 128, 128, 128, 1024]
    - [74, 21.01]
  - - [128, 1024, 1, 2048, 128, 128, 128, 2048]
    - [74, 29.95]
  - - [128, 1024, 1, 4096, 128, 128, 128, 4096]
    - [74, 37.43]
  - - [128, 1024, 1, 8192, 128, 128, 128, 8192]
    - [74, 42.68]
  - - [128, 2048, 1, 128, 128, 128, 128, 128]
    - [34, 8.08]
  - - [128, 2048, 1, 256, 128, 128, 128, 256]
    - [68, 14.59]
  - - [128, 2048, 1, 512, 128, 128, 128, 512]
    - [72, 24.46]
  - - [128, 2048, 1, 1024, 128, 128, 128, 1024]
    - [68, 37.15]
  - - [128, 2048, 1, 2048, 128, 128, 128, 2048]
    - [80, 52.19]
  - - [128, 2048, 1, 4096, 128, 128, 128, 4096]
    - [80, 64.16]
  - - [128, 2048, 1, 8192, 128, 128, 128, 8192]
    - [80, 72.24]
  - - [128, 4096, 1, 128, 128, 128, 128, 128]
    - [33, 14.87]
  - - [128, 4096, 1, 256, 128, 128, 128, 256]
    - [33, 26.22]
  - - [128, 4096, 1, 512, 128, 128, 128, 512]
    - [32, 42.44]
  - - [128, 4096, 1, 1024, 128, 128, 128, 1024]
    - [61, 64.22]
  - - [128, 4096, 1, 2048, 128, 128, 128, 2048]
    - [61, 85.32]
  - - [128, 4096, 1, 4096, 128, 128, 128, 4096]
    - [79, 102.61]
  - - [128, 4096, 1, 8192, 128, 128, 128, 8192]
    - [79, 112.77]
  - - [128, 8192, 1, 128, 128, 128, 128, 128]
    - [26, 26.38]
  - - [128, 8192, 1, 256, 128, 128, 128, 256]
    - [24, 45.26]
  - - [128, 8192, 1, 512, 128, 128, 128, 512]
    - [23, 72.39]
  - - [128, 8192, 1, 1024, 128, 128, 128, 1024]
    - [22, 104.65]
  - - [128, 8192, 1, 2048, 128, 128, 128, 2048]
    - [22, 134.43]
  - - [128, 8192, 1, 4096, 128, 128, 128, 4096]
    - [55, 143.98]
  - - [128, 8192, 1, 8192, 128, 128, 128, 8192]
    - [56, 153.9]
  - - [256, 128, 1, 128, 256, 256, 256, 128]
    - [75, 1.12]
  - - [256, 128, 1, 256, 256, 256, 256, 256]
    - [75, 2.05]
  - - [256, 128, 1, 512, 256, 256, 256, 512]
    - [75, 3.55]
  - - [256, 128, 1, 1024, 256, 256, 256, 1024]
    - [75, 5.53]
  - - [256, 128, 1, 2048, 256, 256, 256, 2048]
    - [75, 7.79]
  - - [256, 128, 1, 4096, 256, 256, 256, 4096]
    - [76, 9.57]
  - - [256, 128, 1, 8192, 256, 256, 256, 8192]
    - [74, 10.93]
  - - [256, 256, 1, 128, 256, 256, 256, 128]
    - [74, 2.22]
  - - [256, 256, 1, 256, 256, 256, 256, 256]
    - [75, 4.03]
  - - [256, 256, 1, 512, 256, 256, 256, 512]
    - [75, 7.11]
  - - [256, 256, 1, 1024, 256, 256, 256, 1024]
    - [75, 10.9]
  - - [256, 256, 1, 2048, 256, 256, 256, 2048]
    - [75, 15.34]
  - - [256, 256, 1, 4096, 256, 256, 256, 4096]
    - [74, 19.15]
  - - [256, 256, 1, 8192, 256, 256, 256, 8192]
    - [74, 21.86]
  - - [256, 512, 1, 128, 256, 256, 256, 128]
    - [35, 4.41]
  - - [256, 512, 1, 256, 256, 256, 256, 256]
    - [35, 7.9]
  - - [256, 512, 1, 512, 256, 256, 256, 512]
    - [74, 13.71]
  - - [256, 512, 1, 1024, 256, 256, 256, 1024]
    - [74, 21.78]
  - - [256, 512, 1, 2048, 256, 256, 256, 2048]
    - [74, 30.12]
  - - [256, 512, 1, 4096, 256, 256, 256, 4096]
    - [74, 37.68]
  - - [256, 512, 1, 8192, 256, 256, 256, 8192]
    - [76, 42.8]
  - - [256, 1024, 1, 128, 256, 256, 256, 128]
    - [72, 8.34]
  - - [256, 1024, 1, 256, 256, 256, 256, 256]
    - [73, 14.78]
  - - [256, 1024, 1, 512, 256, 256, 256, 512]
    - [72, 24.79]
  - - [256, 1024, 1, 1024, 256, 256, 256, 1024]
    - [72, 38.17]
  - - [256, 1024, 1, 2048, 256, 256, 256, 2048]
    - [80, 51.97]
  - - [256, 1024, 1, 4096, 256, 256, 256, 4096]
    - [80, 64.26]
  - - [256, 1024, 1, 8192, 256, 256, 256, 8192]
    - [80, 72.58]
  - - [256, 2048, 1, 128, 256, 256, 256, 128]
    - [33, 14.99]
  - - [256, 2048, 1, 256, 256, 256, 256, 256]
    - [32, 26.83]
  - - [256, 2048, 1, 512, 256, 256, 256, 512]
    - [61, 42.85]
  - - [256, 2048, 1, 1024, 256, 256, 256, 1024]
    - [61, 64.21]
  - - [256, 2048, 1, 2048, 256, 256, 256, 2048]
    - [61, 84.88]
  - - [256, 2048, 1, 4096, 256, 256, 256, 4096]
    - [79, 102.48]
  - - [256, 2048, 1, 8192, 256, 256, 256, 8192]
    - [61, 110.96]
  - - [256, 4096, 1, 128, 256, 256, 256, 128]
    - [26, 26.23]
  - - [256, 4096, 1, 256, 256, 256, 256, 256]
    - [23, 45.3]
  - - [256, 4096, 1, 512, 256, 256, 256, 512]
    - [24, 72.23]
  - - [256, 4096, 1, 1024, 256, 256, 256, 1024]
    - [22, 105.03]
  - - [256, 4096, 1, 2048, 256, 256, 256, 2048]
    - [22, 133.87]
  - - [256, 4096, 1, 4096, 256, 256, 256, 4096]
    - [55, 145.72]
  - - [256, 4096, 1, 8192, 256, 256, 256, 8192]
    - [55, 155.94]
  - - [256, 8192, 1, 128, 256, 256, 256, 128]
    - [19, 41.99]
  - - [256, 8192, 1, 256, 256, 256, 256, 256]
    - [19, 70.93]
  - - [256, 8192, 1, 512, 256, 256, 256, 512]
    - [51, 112.95]
  - - [256, 8192, 1, 1024, 256, 256, 256, 1024]
    - [51, 159.47]
  - - [256, 8192, 1, 2048, 256, 256, 256, 2048]
    - [51, 202.3]
  - - [256, 8192, 1, 4096, 256, 256, 256, 4096]
    - [51, 222.46]
  - - [256, 8192, 1, 8192, 256, 256, 256, 8192]
    - [51, 226.48]
  - - [512, 128, 1, 128, 512, 512, 512, 128]
    - [35, 2.18]
  - - [512, 128, 1, 256, 512, 512, 512, 256]
    - [75, 3.98]
  - - [512, 128, 1, 512, 512, 512, 512, 512]
    - [75, 6.65]
  - - [512, 128, 1, 1024, 512, 512, 512, 1024]
    - [75, 10.53]
  - - [512, 128, 1, 2048, 512, 512, 512, 2048]
    - [76, 15.08]
  - - [512, 128, 1, 4096, 512, 512, 512, 4096]
    - [74, 18.67]
  - - [512, 128, 1, 8192, 512, 512, 512, 8192]
    - [86, 17.47]
  - - [512, 256, 1, 128, 512, 512, 512, 128]
    - [35, 4.13]
  - - [512, 256, 1, 256, 512, 512, 512, 256]
    - [74, 7.83]
  - - [512, 256, 1, 512, 512, 512, 512, 512]
    - [74, 13.43]
  - - [512, 256, 1, 1024, 512, 512, 512, 1024]
    - [75, 21.39]
  - - [512, 256, 1, 2048, 512, 512, 512, 2048]
    - [74, 30.18]
  - - [512, 256, 1, 4096, 512, 512, 512, 4096]
    - [74, 37.41]
  - - [512, 256, 1, 8192, 512, 512, 512, 8192]
    - [87, 37.28]
  - - [512, 512, 1, 128, 512, 512, 512, 128]
    - [72, 8.28]
  - - [512, 512, 1, 256, 512, 512, 512, 256]
    - [71, 14.83]
  - - [512, 512, 1, 512, 512, 512, 512, 512]
    - [72, 24.72]
  - - [512, 512, 1, 1024, 512, 512, 512, 1024]
    - [72, 38.06]
  - - [512, 512, 1, 2048, 512, 512, 512, 2048]
    - [80, 51.48]
  - - [512, 512, 1, 4096, 512, 512, 512, 4096]
    - [80, 63.5]
  - - [512, 512, 1, 8192, 512, 512, 512, 8192]
    - [73, 62.68]
  - - [512, 1024, 1, 128, 512, 512, 512, 128]
    - [33, 15.07]
  - - [512, 1024, 1, 256, 512, 512, 512, 256]
    - [33, 26.14]
  - - [512, 1024, 1, 512, 512, 512, 512, 512]
    - [33, 42.54]
  - - [512, 1024, 1, 1024, 512, 512, 512, 1024]
    - [61, 63.87]
  - - [512, 1024, 1, 2048, 512, 512, 512, 2048]
    - [61, 83.69]
  - - [512, 1024, 1, 4096, 512, 512, 512, 4096]
    - [61, 100.51]
  - - [512, 1024, 1, 8192, 512, 512, 512, 8192]
    - [63, 103.96]
  - - [512, 2048, 1, 128, 512, 512, 512, 128]
    - [28, 25.87]
  - - [512, 2048, 1, 256, 512, 512, 512, 256]
    - [29, 44.94]
  - - [512, 2048, 1, 512, 512, 512, 512, 512]
    - [23, 72.46]
  - - [512, 2048, 1, 1024, 512, 512, 512, 1024]
    - [23, 103.15]
  - - [512, 2048, 1, 2048, 512, 512, 512, 2048]
    - [22, 133.43]
  - - [512, 2048, 1, 4096, 512, 512, 512, 4096]
    - [78, 145.42]
  - - [512, 2048, 1, 8192, 512, 512, 512, 8192]
    - [59, 147.59]
  - - [512, 4096, 1, 128, 512, 512, 512, 128]
    - [19, 41.67]
  - - [512, 4096, 1, 256, 512, 512, 512, 256]
    - [51, 71.46]
  - - [512, 4096, 1, 512, 512, 512, 512, 512]
    - [51, 112.44]
  - - [512, 4096, 1, 1024, 512, 512, 512, 1024]
    - [51, 160.11]
  - - [512, 4096, 1, 2048, 512, 512, 512, 2048]
    - [51, 202.65]
  - - [512, 4096, 1, 4096, 512, 512, 512, 4096]
    - [51, 209.11]
  - - [512, 4096, 1, 8192, 512, 512, 512, 8192]
    - [51, 205.38]
  - - [512, 8192, 1, 128, 512, 512, 512, 128]
    - [49, 63.56]
  - - [512, 8192, 1, 256, 512, 512, 512, 256]
    - [49, 107.95]
  - - [512, 8192, 1, 512, 512, 512, 512, 512]
    - [49, 173.83]
  - - [512, 8192, 1, 1024, 512, 512, 512, 1024]
    - [49, 241.94]
  - - [512, 8192, 1, 2048, 512, 512, 512, 2048]
    - [46, 247.77]
  - - [512, 8192, 1, 4096, 512, 512, 512, 4096]
    - [46, 263.81]
  - - [512, 8192, 1, 8192, 512, 512, 512, 8192]
    - [50, 255.9]
  - - [1024, 128, 1, 128, 1024, 1024, 1024, 128]
    - [36, 4.0]
  - - [1024, 128, 1, 256, 1024, 1024, 1024, 256]
    - [74, 7.77]
  - - [1024, 128, 1, 512, 1024, 1024, 1024, 512]
    - [75, 13.46]
  - - [1024, 128, 1, 1024, 1024, 1024, 1024, 1024]
    - [75, 20.87]
  - - [1024, 128, 1, 2048, 1024, 1024, 1024, 2048]
    - [74, 29.74]
  - - [1024, 128, 1, 4096, 1024, 1024, 1024, 4096]
    - [87, 30.9]
  - - [1024, 128, 1, 8192, 1024, 1024, 1024, 8192]
    - [85, 30.34]
  - - [1024, 256, 1, 128, 1024, 1024, 1024, 128]
    - [67, 7.84]
  - - [1024, 256, 1, 256, 1024, 1024, 1024, 256]
    - [73, 14.42]
  - - [1024, 256, 1, 512, 1024, 1024, 1024, 512]
    - [72, 24.88]
  - - [1024, 256, 1, 1024, 1024, 1024, 1024, 1024]
    - [72, 37.81]
  - - [1024, 256, 1, 2048, 1024, 1024, 1024, 2048]
    - [80, 51.21]
  - - [1024, 256, 1, 4096, 1024, 1024, 1024, 4096]
    - [70, 54.66]
  - - [1024, 256, 1, 8192, 1024, 1024, 1024, 8192]
    - [82, 58.74]
  - - [1024, 512, 1, 128, 1024, 1024, 1024, 128]
    - [33, 14.81]
  - - [1024, 512, 1, 256, 1024, 1024, 1024, 256]
    - [32, 25.79]
  - - [1024, 512, 1, 512, 1024, 1024, 1024, 512]
    - [63, 42.39]
  - - [1024, 512, 1, 1024, 1024, 1024, 1024, 1024]
    - [61, 63.04]
  - - [1024, 512, 1, 2048, 1024, 1024, 1024, 2048]
    - [61, 83.55]
  - - [1024, 512, 1, 4096, 1024, 1024, 1024, 4096]
    - [64, 93.66]
  - - [1024, 512, 1, 8192, 1024, 1024, 1024, 8192]
    - [66, 101.92]
  - - [1024, 1024, 1, 128, 1024, 1024, 1024, 128]
    - [28, 26.31]
  - - [1024, 1024, 1, 256, 1024, 1024, 1024, 256]
    - [23, 44.75]
  - - [1024, 1024, 1, 512, 1024, 1024, 1024, 512]
    - [23, 71.67]
  - - [1024, 1024, 1, 1024, 1024, 1024, 1024, 1024]
    - [22, 103.54]
  - - [1024, 1024, 1, 2048, 1024, 1024, 1024, 2048]
    - [22, 132.93]
  - - [1024, 1024, 1, 4096, 1024, 1024, 1024, 4096]
    - [57, 140.42]
  - - [1024, 1024, 1, 8192, 1024, 1024, 1024, 8192]
    - [60, 146.51]
  - - [1024, 2048, 1, 128, 1024, 1024, 1024, 128]
    - [20, 41.45]
  - - [1024, 2048, 1, 256, 1024, 1024, 1024, 256]
    - [51, 70.55]
  - - [1024, 2048, 1, 512, 1024, 1024, 1024, 512]
    - [51, 112.78]
  - - [1024, 2048, 1, 1024, 1024, 1024, 1024, 1024]
    - [51, 160.92]
  - - [1024, 2048, 1, 2048, 1024, 1024, 1024, 2048]
    - [51, 202.34]
  - - [1024, 2048, 1, 4096, 1024, 1024, 1024, 4096]
    - [54, 207.78]
  - - [1024, 2048, 1, 8192, 1024, 1024, 1024, 8192]
    - [53, 203.3]
  - - [1024, 4096, 1, 128, 1024, 1024, 1024, 128]
    - [16, 58.71]
  - - [1024, 4096, 1, 256, 1024, 1024, 1024, 256]
    - [16, 99.51]
  - - [1024, 4096, 1, 512, 1024, 1024, 1024, 512]
    - [12, 152.71]
  - - [1024, 4096, 1, 1024, 1024, 1024, 1024, 1024]
    - [12, 214.72]
  - - [1024, 4096, 1, 2048, 1024, 1024, 1024, 2048]
    - [46, 248.21]
  - - [1024, 4096, 1, 4096, 1024, 1024, 1024, 4096]
    - [46, 262.07]
  - - [1024, 4096, 1, 8192, 1024, 1024, 1024, 8192]
    - [43, 249.2]
  - - [1024, 8192, 1, 128, 1024, 1024, 1024, 128]
    - [41, 89.94]
  - - [1024, 8192, 1, 256, 1024, 1024, 1024, 256]
    - [41, 154.7]
  - - [1024, 8192, 1, 512, 1024, 1024, 1024, 512]
    - [41, 239.59]
  - - [1024, 8192, 1, 1024, 1024, 1024, 1024, 1024]
    - [40, 264.05]
  - - [1024, 8192, 1, 2048, 1024, 1024, 1024, 2048]
    - [42, 313.64]
  - - [1024, 8192, 1, 4096, 1024, 1024, 1024, 4096]
    - [44, 354.91]
  - - [1024, 8192, 1, 8192, 1024, 1024, 1024, 8192]
    - [43, 383.23]
  - - [2048, 128, 1, 128, 2048, 2048, 2048, 128]
    - [34, 7.94]
  - - [2048, 128, 1, 256, 2048, 2048, 2048, 256]
    - [71, 14.53]
  - - [2048, 128, 1, 512, 2048, 2048, 2048, 512]
    - [71, 24.3]
  - - [2048, 128, 1, 1024, 2048, 2048, 2048, 1024]
    - [73, 36.91]
  - - [2048, 128, 1, 2048, 2048, 2048, 2048, 2048]
    - [69, 43.99]
  - - [2048, 128, 1, 4096, 2048, 2048, 2048, 4096]
    - [81, 52.0]
  - - [2048, 128, 1, 8192, 2048, 2048, 2048, 8192]
    - [83, 58.76]
  - - [2048, 256, 1, 128, 2048, 2048, 2048, 128]
    - [31, 14.44]
  - - [2048, 256, 1, 256, 2048, 2048, 2048, 256]
    - [33, 25.65]
  - - [2048, 256, 1, 512, 2048, 2048, 2048, 512]
    - [62, 41.62]
  - - [2048, 256, 1, 1024, 2048, 2048, 2048, 1024]
    - [62, 62.21]
  - - [2048, 256, 1, 2048, 2048, 2048, 2048, 2048]
    - [65, 77.24]
  - - [2048, 256, 1, 4096, 2048, 2048, 2048, 4096]
    - [65, 92.74]
  - - [2048, 256, 1, 8192, 2048, 2048, 2048, 8192]
    - [66, 103.84]
  - - [2048, 512, 1, 128, 2048, 2048, 2048, 128]
    - [27, 25.36]
  - - [2048, 512, 1, 256, 2048, 2048, 2048, 256]
    - [23, 44.8]
  - - [2048, 512, 1, 512, 2048, 2048, 2048, 512]
    - [22, 71.18]
  - - [2048, 512, 1, 1024, 2048, 2048, 2048, 1024]
    - [22, 104.38]
  - - [2048, 512, 1, 2048, 2048, 2048, 2048, 2048]
    - [60, 120.84]
  - - [2048, 512, 1, 4096, 2048, 2048, 2048, 4096]
    - [60, 140.87]
  - - [2048, 512, 1, 8192, 2048, 2048, 2048, 8192]
    - [25, 147.59]
  - - [2048, 1024, 1, 128, 2048, 2048, 2048, 128]
    - [19, 41.99]
  - - [2048, 1024, 1, 256, 2048, 2048, 2048, 256]
    - [20, 71.2]
  - - [2048, 1024, 1, 512, 2048, 2048, 2048, 512]
    - [51, 113.58]
  - - [2048, 1024, 1, 1024, 2048, 2048, 2048, 1024]
    - [51, 161.47]
  - - [2048, 1024, 1, 2048, 2048, 2048, 2048, 2048]
    - [54, 183.09]
  - - [2048, 1024, 1, 4096, 2048, 2048, 2048, 4096]
    - [54, 208.35]
  - - [2048, 1024, 1, 8192, 2048, 2048, 2048, 8192]
    - [53, 201.94]
  - - [2048, 2048, 1, 128, 2048, 2048, 2048, 128]
    - [18, 58.96]
  - - [2048, 2048, 1, 256, 2048, 2048, 2048, 256]
    - [18, 99.44]
  - - [2048, 2048, 1, 512, 2048, 2048, 2048, 512]
    - [37, 153.15]
  - - [2048, 2048, 1, 1024, 2048, 2048, 2048, 1024]
    - [16, 208.09]
  - - [2048, 2048, 1, 2048, 2048, 2048, 2048, 2048]
    - [18, 246.74]
  - - [2048, 2048, 1, 4096, 2048, 2048, 2048, 4096]
    - [47, 264.98]
  - - [2048, 2048, 1, 8192, 2048, 2048, 2048, 8192]
    - [43, 247.2]
  - - [2048, 4096, 1, 128, 2048, 2048, 2048, 128]
    - [4, 72.62]
  - - [2048, 4096, 1, 256, 2048, 2048, 2048, 256]
    - [0, 123.35]
  - - [2048, 4096, 1, 512, 2048, 2048, 2048, 512]
    - [0, 183.37]
  - - [2048, 4096, 1, 1024, 2048, 2048, 2048, 1024]
    - [10, 247.3]
  - - [2048, 4096, 1, 2048, 2048, 2048, 2048, 2048]
    - [10, 284.3]
  - - [2048, 4096, 1, 4096, 2048, 2048, 2048, 4096]
    - [45, 289.3]
  - - [2048, 4096, 1, 8192, 2048, 2048, 2048, 8192]
    - [43, 320.35]
  - - [2048, 8192, 1, 128, 2048, 2048, 2048, 128]
    - [45, 97.46]
  - - [2048, 8192, 1, 256, 2048, 2048, 2048, 256]
    - [45, 162.04]
  - - [2048, 8192, 1, 512, 2048, 2048, 2048, 512]
    - [41, 226.14]
  - - [2048, 8192, 1, 1024, 2048, 2048, 2048, 1024]
    - [41, 287.69]
  - - [2048, 8192, 1, 2048, 2048, 2048, 2048, 2048]
    - [41, 332.62]
  - - [2048, 8192, 1, 4096, 2048, 2048, 2048, 4096]
    - [44, 348.87]
  - - [2048, 8192, 1, 8192, 2048, 2048, 2048, 8192]
    - [44, 393.28]
  - - [4096, 128, 1, 128, 4096, 4096, 4096, 128]
    - [30, 14.74]
  - - [4096, 128, 1, 256, 4096, 4096, 4096, 256]
    - [32, 25.71]
  - - [4096, 128, 1, 512, 4096, 4096, 4096, 512]
    - [62, 42.01]
  - - [4096, 128, 1, 1024, 4096, 4096, 4096, 1024]
    - [63, 62.56]
  - - [4096, 128, 1, 2048, 4096, 4096, 4096, 2048]
    - [66, 76.82]
  - - [4096, 128, 1, 4096, 4096, 4096, 4096, 4096]
    - [65, 93.14]
  - - [4096, 128, 1, 8192, 4096, 4096, 4096, 8192]
    - [66, 104.06]
  - - [4096, 256, 1, 128, 4096, 4096, 4096, 128]
    - [23, 25.53]
  - - [4096, 256, 1, 256, 4096, 4096, 4096, 256]
    - [23, 44.95]
  - - [4096, 256, 1, 512, 4096, 4096, 4096, 512]
    - [23, 71.75]
  - - [4096, 256, 1, 1024, 4096, 4096, 4096, 1024]
    - [22, 103.1]
  - - [4096, 256, 1, 2048, 4096, 4096, 4096, 2048]
    - [60, 119.6]
  - - [4096, 256, 1, 4096, 4096, 4096, 4096, 4096]
    - [58, 140.17]
  - - [4096, 256, 1, 8192, 4096, 4096, 4096, 8192]
    - [58, 149.28]
  - - [4096, 512, 1, 128, 4096, 4096, 4096, 128]
    - [19, 41.83]
  - - [4096, 512, 1, 256, 4096, 4096, 4096, 256]
    - [19, 71.74]
  - - [4096, 512, 1, 512, 4096, 4096, 4096, 512]
    - [51, 112.06]
  - - [4096, 512, 1, 1024, 4096, 4096, 4096, 1024]
    - [53, 152.35]
  - - [4096, 512, 1, 2048, 4096, 4096, 4096, 2048]
    - [54, 180.38]
  - - [4096, 512, 1, 4096, 4096, 4096, 4096, 4096]
    - [54, 205.52]
  - - [4096, 512, 1, 8192, 4096, 4096, 4096, 8192]
    - [54, 202.59]
  - - [4096, 1024, 1, 128, 4096, 4096, 4096, 128]
    - [16, 58.52]
  - - [4096, 1024, 1, 256, 4096, 4096, 4096, 256]
    - [16, 99.33]
  - - [4096, 1024, 1, 512, 4096, 4096, 4096, 512]
    - [16, 153.33]
  - - [4096, 1024, 1, 1024, 4096, 4096, 4096, 1024]
    - [17, 201.64]
  - - [4096, 1024, 1, 2048, 4096, 4096, 4096, 2048]
    - [18, 246.46]
  - - [4096, 1024, 1, 4096, 4096, 4096, 4096, 4096]
    - [48, 262.97]
  - - [4096, 1024, 1, 8192, 4096, 4096, 4096, 8192]
    - [38, 247.88]
  - - [4096, 2048, 1, 128, 4096, 4096, 4096, 128]
    - [4, 72.8]
  - - [4096, 2048, 1, 256, 4096, 4096, 4096, 256]
    - [0, 122.16]
  - - [4096, 2048, 1, 512, 4096, 4096, 4096, 512]
    - [4, 182.1]
  - - [4096, 2048, 1, 1024, 4096, 4096, 4096, 1024]
    - [9, 244.75]
  - - [4096, 2048, 1, 2048, 4096, 4096, 4096, 2048]
    - [6, 280.03]
  - - [4096, 2048, 1, 4096, 4096, 4096, 4096, 4096]
    - [2, 273.7]
  - - [4096, 2048, 1, 8192, 4096, 4096, 4096, 8192]
    - [37, 291.73]
  - - [4096, 4096, 1, 128, 4096, 4096, 4096, 128]
    - [8, 78.38]
  - - [4096, 4096, 1, 256, 4096, 4096, 4096, 256]
    - [6, 129.78]
  - - [4096, 4096, 1, 512, 4096, 4096, 4096, 512]
    - [7, 191.99]
  - - [4096, 4096, 1, 1024, 4096, 4096, 4096, 1024]
    - [11, 244.5]
  - - [4096, 4096, 1, 2048, 4096, 4096, 4096, 2048]
    - [45, 275.57]
  - - [4096, 4096, 1, 4096, 4096, 4096, 4096, 4096]
    - [44, 298.31]
  - - [4096, 4096, 1, 8192, 4096, 4096, 4096, 8192]
    - [7, 327.42]
  - - [4096, 8192, 1, 128, 4096, 4096, 4096, 128]
    - [41, 105.97]
  - - [4096, 8192, 1, 256, 4096, 4096, 4096, 256]
    - [41, 172.6]
  - - [4096, 8192, 1, 512, 4096, 4096, 4096, 512]
    - [40, 230.93]
  - - [4096, 8192, 1, 1024, 4096, 4096, 4096, 1024]
    - [44, 281.72]
  - - [4096, 8192, 1, 2048, 4096, 4096, 4096, 2048]
    - [41, 330.73]
  - - [4096, 8192, 1, 4096, 4096, 4096, 4096, 4096]
    - [45, 367.68]
  - - [4096, 8192, 1, 8192, 4096, 4096, 4096, 8192]
    - [45, 408.03]
  - - [8192, 128, 1, 128, 8192, 8192, 8192, 128]
    - [29, 26.25]
  - - [8192, 128, 1, 256, 8192, 8192, 8192, 256]
    - [29, 44.66]
  - - [8192, 128, 1, 512, 8192, 8192, 8192, 512]
    - [28, 71.71]
  - - [8192, 128, 1, 1024, 8192, 8192, 8192, 1024]
    - [22, 103.15]
  - - [8192, 128, 1, 2048, 8192, 8192, 8192, 2048]
    - [57, 119.82]
  - - [8192, 128, 1, 4096, 8192, 8192, 8192, 4096]
    - [58, 139.89]
  - - [8192, 128, 1, 8192, 8192, 8192, 8192, 8192]
    - [59, 145.32]
  - - [8192, 256, 1, 128, 8192, 8192, 8192, 128]
    - [19, 41.9]
  - - [8192, 256, 1, 256, 8192, 8192, 8192, 256]
    - [51, 70.78]
  - - [8192, 256, 1, 512, 8192, 8192, 8192, 512]
    - [52, 111.57]
  - - [8192, 256, 1, 1024, 8192, 8192, 8192, 1024]
    - [54, 158.36]
  - - [8192, 256, 1, 2048, 8192, 8192, 8192, 2048]
    - [54, 183.38]
  - - [8192, 256, 1, 4096, 8192, 8192, 8192, 4096]
    - [54, 209.61]
  - - [8192, 256, 1, 8192, 8192, 8192, 8192, 8192]
    - [54, 199.86]
  - - [8192, 512, 1, 128, 8192, 8192, 8192, 128]
    - [16, 58.74]
  - - [8192, 512, 1, 256, 8192, 8192, 8192, 256]
    - [16, 98.47]
  - - [8192, 512, 1, 512, 8192, 8192, 8192, 512]
    - [13, 150.56]
  - - [8192, 512, 1, 1024, 8192, 8192, 8192, 1024]
    - [14, 204.36]
  - - [8192, 512, 1, 2048, 8192, 8192, 8192, 2048]
    - [17, 243.19]
  - - [8192, 512, 1, 4096, 8192, 8192, 8192, 4096]
    - [38, 262.9]
  - - [8192, 512, 1, 8192, 8192, 8192, 8192, 8192]
    - [39, 250.27]
  - - [8192, 1024, 1, 128, 8192, 8192, 8192, 128]
    - [4, 73.07]
  - - [8192, 1024, 1, 256, 8192, 8192, 8192, 256]
    - [8, 121.77]
  - - [8192, 1024, 1, 512, 8192, 8192, 8192, 512]
    - [3, 182.44]
  - - [8192, 1024, 1, 1024, 8192, 8192, 8192, 1024]
    - [6, 244.13]
  - - [8192, 1024, 1, 2048, 8192, 8192, 8192, 2048]
    - [2, 278.95]
  - - [8192, 1024, 1, 4096, 8192, 8192, 8192, 4096]
    - [38, 269.45]
  - - [8192, 1024, 1, 8192, 8192, 8192, 8192, 8192]
    - [37, 312.26]
  - - [8192, 2048, 1, 128, 8192, 8192, 8192, 128]
    - [4, 78.86]
  - - [8192, 2048, 1, 256, 8192, 8192, 8192, 256]
    - [4, 130.25]
  - - [8192, 2048, 1, 512, 8192, 8192, 8192, 512]
    - [5, 191.04]
  - - [8192, 2048, 1, 1024, 8192, 8192, 8192, 1024]
    - [44, 241.54]
  - - [8192, 2048, 1, 2048, 8192, 8192, 8192, 2048]
    - [45, 254.71]
  - - [8192, 2048, 1, 4096, 8192, 8192, 8192, 4096]
    - [1, 292.99]
  - - [8192, 2048, 1, 8192, 8192, 8192, 8192, 8192]
    - [1, 345.23]
  - - [8192, 4096, 1, 128, 8192, 8192, 8192, 128]
    - [0, 85.2]
  - - [8192, 4096, 1, 256, 8192, 8192, 8192, 256]
    - [21, 137.33]
  - - [8192, 4096, 1, 512, 8192, 8192, 8192, 512]
    - [15, 200.2]
  - - [8192, 4096, 1, 1024, 8192, 8192, 8192, 1024]
    - [38, 242.3]
  - - [8192, 4096, 1, 2048, 8192, 8192, 8192, 2048]
    - [44, 292.26]
  - - [8192, 4096, 1, 4096, 8192, 8192, 8192, 4096]
    - [44, 331.69]
  - - [8192, 4096, 1, 8192, 8192, 8192, 8192, 8192]
    - [1, 369.88]
  - - [8192, 8192, 1, 128, 8192, 8192, 8192, 128]
    - [41, 104.93]
  - - [8192, 8192, 1, 256, 8192, 8192, 8192, 256]
    - [43, 154.54]
  - - [8192, 8192, 1, 512, 8192, 8192, 8192, 512]
    - [45, 219.27]
  - - [8192, 8192, 1, 1024, 8192, 8192, 8192, 1024]
    - [44, 286.19]
  - - [8192, 8192, 1, 2048, 8192, 8192, 8192, 2048]
    - [44, 348.65]
  - - [8192, 8192, 1, 4096, 8192, 8192, 8192, 4096]
    - [44, 388.86]
  - - [8192, 8192, 1, 8192, 8192, 8192, 8192, 8192]
    - [44, 415.77]
- null
- null
- ExperimentalStreamK
- GridBased
