projects/hipblaslt/library/src/amd_detail/rocblaslt/src/Tensile/Logic/asm_full/aquavanjaram/gfx942_228cu/StreamK/aquavanjaram942_Cijk_Alik_Bjlk_F8NB8NS_BH_Bias_HAS_SAV_UserArgs.yaml
- {MinimumRequiredVersion: 4.33.0}
- aquavanjaram942
- {Architecture: gfx942, CUCount: 228}
- [Device 0049, Device 0050]
    SolutionIndex: 0
    SolutionNameMin: Cijk_Alik_Bjlk_F8NB8NS_BH_Bias_HAS_SAV_UserArgs_MT256x256x64_MI16x16x1_SN_LDSB1_CLR1_GRVWA8_GRVWB8_GSU0_GSUC0_GSUWGMRR0_K1_LBSPPA512_LBSPPB2048_LPA8_LPB0_LRVW8_MIWT8_8_PLR1_SU0_SUM0_SUS64_VWA8_VWB8_WGM1_WGMXCC1_WGMXCCGn1
    SolutionIndex: 1
    SolutionNameMin: Cijk_Alik_Bjlk_F8NB8NS_BH_Bias_HAS_SAV_UserArgs_MT256x256x64_MI16x16x1_SN_LDSB1_CLR1_GRVWA8_GRVWB16_GSU0_GSUC0_GSUWGMRR0_K1_LBSPPA512_LBSPPB2048_LPA8_LPB0_LRVW8_MIWT8_8_PLR1_SU0_SUM0_SUS64_VWA8_VWB8_WGM1_WGMXCC1_WGMXCCGn1
    SolutionIndex: 2
    SolutionNameMin: Cijk_Alik_Bjlk_F8NB8NS_BH_Bias_HAS_SAV_UserArgs_MT256x256x64_MI16x16x1_SN_LDSB1_CLR1_GRVWA16_GRVWB16_GSU0_GSUC0_GSUWGMRR0_K1_LBSPPA512_LBSPPB2048_LPA16_LPB0_LRVW8_MIWT8_8_PLR1_SU0_SUM0_SUS64_VWA8_VWB8_WGM1_WGMXCC1_WGMXCCGn1
    SolutionIndex: 3
    SolutionNameMin: Cijk_Alik_Bjlk_F8NB8NS_BH_Bias_HAS_SAV_UserArgs_MT256x256x64_MI16x16x1_SN_LDSB1_CLR1_GRVWA8_GRVWB16_GSU0_GSUC0_GSUWGMRR0_K1_LBSPPA512_LBSPPB2048_LPA8_LPB0_LRVW8_MIWT8_8_PLR1_SU0_SUM0_SUS64_VWA8_VWB8_WGM4_WGMXCC1_WGMXCCGn1
    SolutionIndex: 4
    SolutionNameMin: Cijk_Alik_Bjlk_F8NB8NS_BH_Bias_HAS_SAV_UserArgs_MT256x256x64_MI16x16x1_SN_LDSB1_CLR1_GRVWA16_GRVWB16_GSU0_GSUC0_GSUWGMRR0_K1_LBSPPA512_LBSPPB2048_LPA16_LPB0_LRVW8_MIWT8_8_PLR1_SU0_SUM0_SUS64_VWA8_VWB8_WGM4_WGMXCC1_WGMXCCGn1
    SolutionIndex: 5
    SolutionNameMin: Cijk_Alik_Bjlk_F8NB8NS_BH_Bias_HAS_SAV_UserArgs_MT256x256x64_MI16x16x1_SN_LDSB1_CLR1_GRVWA16_GRVWB8_GSU0_GSUC0_GSUWGMRR0_K1_LBSPPA512_LBSPPB2048_LPA16_LPB0_LRVW8_MIWT8_8_PLR1_SU0_SUM0_SUS64_VWA8_VWB8_WGM6_WGMXCC1_WGMXCCGn1
    SolutionIndex: 6
    SolutionNameMin: Cijk_Alik_Bjlk_F8NB8NS_BH_Bias_HAS_SAV_UserArgs_MT256x256x64_MI16x16x1_SN_LDSB1_CLR1_GRVWA8_GRVWB16_GSU0_GSUC0_GSUWGMRR0_K1_LBSPPA512_LBSPPB2048_LPA8_LPB0_LRVW8_MIWT8_8_PLR1_SU0_SUM0_SUS64_VWA8_VWB8_WGM6_WGMXCC1_WGMXCCGn1
    SolutionIndex: 7
    SolutionNameMin: Cijk_Alik_Bjlk_F8NB8NS_BH_Bias_HAS_SAV_UserArgs_MT256x256x64_MI16x16x1_SN_LDSB1_CLR1_GRVWA16_GRVWB16_GSU0_GSUC0_GSUWGMRR0_K1_LBSPPA512_LBSPPB2048_LPA16_LPB0_LRVW8_MIWT8_8_PLR1_SU0_SUM0_SUS64_VWA8_VWB8_WGM6_WGMXCC1_WGMXCCGn1
    SolutionIndex: 8
    SolutionNameMin: Cijk_Alik_Bjlk_F8NB8NS_BH_Bias_HAS_SAV_UserArgs_MT256x256x64_MI16x16x1_SN_LDSB1_CLR1_GRVWA8_GRVWB8_GSU0_GSUC0_GSUWGMRR0_K1_LBSPPA512_LBSPPB2048_LPA8_LPB0_LRVW8_MIWT8_8_PLR1_SU0_SUM0_SUS64_VWA8_VWB8_WGM8_WGMXCC1_WGMXCCGn1
    SolutionIndex: 9
    SolutionNameMin: Cijk_Alik_Bjlk_F8NB8NS_BH_Bias_HAS_SAV_UserArgs_MT256x256x64_MI16x16x1_SN_LDSB1_CLR1_GRVWA16_GRVWB8_GSU0_GSUC0_GSUWGMRR0_K1_LBSPPA512_LBSPPB2048_LPA16_LPB0_LRVW8_MIWT8_8_PLR1_SU0_SUM0_SUS64_VWA8_VWB8_WGM8_WGMXCC1_WGMXCCGn1
    SolutionIndex: 10
    SolutionNameMin: Cijk_Alik_Bjlk_F8NB8NS_BH_Bias_HAS_SAV_UserArgs_MT256x256x64_MI16x16x1_SN_LDSB1_CLR1_GRVWA8_GRVWB16_GSU0_GSUC0_GSUWGMRR0_K1_LBSPPA512_LBSPPB2048_LPA8_LPB0_LRVW8_MIWT8_8_PLR1_SU0_SUM0_SUS64_VWA8_VWB8_WGM8_WGMXCC1_WGMXCCGn1
    SolutionIndex: 11
    SolutionNameMin: Cijk_Alik_Bjlk_F8NB8NS_BH_Bias_HAS_SAV_UserArgs_MT256x256x64_MI16x16x1_SN_LDSB1_CLR1_GRVWA16_GRVWB16_GSU0_GSUC0_GSUWGMRR0_K1_LBSPPA512_LBSPPB2048_LPA16_LPB0_LRVW8_MIWT8_8_PLR1_SU0_SUM0_SUS64_VWA8_VWB8_WGM8_WGMXCC1_WGMXCCGn1
    SolutionIndex: 12
    SolutionNameMin: Cijk_Alik_Bjlk_F8NB8NS_BH_Bias_HAS_SAV_UserArgs_MT128x256x64_MI16x16x1_SN_LDSB1_CLR1_GRVWA16_GRVWB16_GSU0_GSUC0_GSUWGMRR0_K1_LBSPPA256_LBSPPB2048_LPA16_LPB0_LRVW8_MIWT4_8_PLR1_SU0_SUM0_SUS64_VWA4_VWB8_WGM1_WGMXCC1_WGMXCCGn1
    SolutionIndex: 13
    SolutionNameMin: Cijk_Alik_Bjlk_F8NB8NS_BH_Bias_HAS_SAV_UserArgs_MT128x256x64_MI16x16x1_SN_LDSB1_CLR1_GRVWA8_GRVWB16_GSU0_GSUC0_GSUWGMRR0_K1_LBSPPA256_LBSPPB2048_LPA8_LPB0_LRVW8_MIWT4_8_PLR1_SU0_SUM0_SUS64_VWA4_VWB8_WGM4_WGMXCC1_WGMXCCGn1
    SolutionIndex: 14
    SolutionNameMin: Cijk_Alik_Bjlk_F8NB8NS_BH_Bias_HAS_SAV_UserArgs_MT128x256x64_MI16x16x1_SN_LDSB1_CLR1_GRVWA16_GRVWB16_GSU0_GSUC0_GSUWGMRR0_K1_LBSPPA256_LBSPPB2048_LPA16_LPB0_LRVW8_MIWT4_8_PLR1_SU0_SUM0_SUS64_VWA4_VWB8_WGM4_WGMXCC1_WGMXCCGn1
    SolutionIndex: 15
    SolutionNameMin: Cijk_Alik_Bjlk_F8NB8NS_BH_Bias_HAS_SAV_UserArgs_MT128x256x64_MI16x16x1_SN_LDSB1_CLR1_GRVWA8_GRVWB16_GSU0_GSUC0_GSUWGMRR0_K1_LBSPPA256_LBSPPB2048_LPA8_LPB0_LRVW8_MIWT4_8_PLR1_SU0_SUM0_SUS64_VWA4_VWB8_WGM6_WGMXCC1_WGMXCCGn1
    SolutionIndex: 16
    SolutionNameMin: Cijk_Alik_Bjlk_F8NB8NS_BH_Bias_HAS_SAV_UserArgs_MT256x128x64_MI16x16x1_SN_LDSB1_CLR1_GRVWA8_GRVWB8_GSU0_GSUC0_GSUWGMRR0_K1_LBSPPA512_LBSPPB1024_LPA8_LPB64_LRVW8_MIWT8_4_PLR1_SU0_SUM0_SUS64_VWA8_VWB4_WGM1_WGMXCC1_WGMXCCGn1
    SolutionIndex: 17
    SolutionNameMin: Cijk_Alik_Bjlk_F8NB8NS_BH_Bias_HAS_SAV_UserArgs_MT256x128x64_MI16x16x1_SN_LDSB1_CLR1_GRVWA16_GRVWB8_GSU0_GSUC0_GSUWGMRR0_K1_LBSPPA512_LBSPPB1024_LPA16_LPB64_LRVW8_MIWT8_4_PLR1_SU0_SUM0_SUS64_VWA8_VWB4_WGM1_WGMXCC1_WGMXCCGn1
    SolutionIndex: 18
    SolutionNameMin: Cijk_Alik_Bjlk_F8NB8NS_BH_Bias_HAS_SAV_UserArgs_MT256x128x64_MI16x16x1_SN_LDSB1_CLR1_GRVWA8_GRVWB16_GSU0_GSUC0_GSUWGMRR0_K1_LBSPPA512_LBSPPB1024_LPA8_LPB64_LRVW8_MIWT8_4_PLR1_SU0_SUM0_SUS64_VWA8_VWB4_WGM1_WGMXCC1_WGMXCCGn1
    SolutionIndex: 19
    SolutionNameMin: Cijk_Alik_Bjlk_F8NB8NS_BH_Bias_HAS_SAV_UserArgs_MT256x128x64_MI16x16x1_SN_LDSB1_CLR1_GRVWA8_GRVWB16_GSU0_GSUC0_GSUWGMRR0_K1_LBSPPA512_LBSPPB1024_LPA8_LPB64_LRVW8_MIWT8_4_PLR1_SU0_SUM0_SUS64_VWA8_VWB4_WGM4_WGMXCC1_WGMXCCGn1
    SolutionIndex: 20
    SolutionNameMin: Cijk_Alik_Bjlk_F8NB8NS_BH_Bias_HAS_SAV_UserArgs_MT256x128x64_MI16x16x1_SN_LDSB1_CLR1_GRVWA8_GRVWB16_GSU0_GSUC0_GSUWGMRR0_K1_LBSPPA512_LBSPPB1024_LPA8_LPB64_LRVW8_MIWT8_4_PLR1_SU0_SUM0_SUS64_VWA8_VWB4_WGM8_WGMXCC1_WGMXCCGn1
    SolutionIndex: 21
    SolutionNameMin: Cijk_Alik_Bjlk_F8NB8NS_BH_Bias_HAS_SAV_UserArgs_MT256x128x64_MI16x16x1_SN_LDSB1_CLR1_GRVWA16_GRVWB16_GSU0_GSUC0_GSUWGMRR0_K1_LBSPPA512_LBSPPB1024_LPA16_LPB64_LRVW8_MIWT8_4_PLR1_SU0_SUM0_SUS64_VWA8_VWB4_WGM8_WGMXCC1_WGMXCCGn1
    SolutionIndex: 22
    SolutionNameMin: Cijk_Alik_Bjlk_F8NB8NS_BH_Bias_HAS_SAV_UserArgs_MT128x128x64_MI16x16x1_SN_LDSB1_CLR1_GRVWA8_GRVWB16_GSU0_GSUC0_GSUWGMRR0_K1_LBSPPA512_LBSPPB1024_LPA8_LPB32_LRVW8_MIWT8_2_PLR1_SU0_SUM0_SUS64_VWA8_VWB2_WGM1_WGMXCC1_WGMXCCGn1
    SolutionIndex: 23
    SolutionNameMin: Cijk_Alik_Bjlk_F8NB8NS_BH_Bias_HAS_SAV_UserArgs_MT128x64x64_MI16x16x1_SN_LDSB0_CLR1_GRVWA8_GRVWB8_GSU0_GSUC0_GSUWGMRR0_K1_LBSPPA512_LBSPPB512_LPA8_LPB16_LRVW8_MIWT8_1_PLR1_SU0_SUM0_SUS64_VWA8_VWB1_WGM1_WGMXCC1_WGMXCCGn1
    SolutionIndex: 24
    SolutionNameMin: Cijk_Alik_Bjlk_F8NB8NS_BH_Bias_HAS_SAV_UserArgs_MT128x64x64_MI16x16x1_SN_LDSB0_CLR1_GRVWA8_GRVWB8_GSU0_GSUC0_GSUWGMRR0_K1_LBSPPA512_LBSPPB512_LPA8_LPB16_LRVW8_MIWT8_1_PLR1_SU0_SUM0_SUS64_VWA8_VWB1_WGM8_WGMXCC1_WGMXCCGn1
    SolutionIndex: 25
    SolutionNameMin: Cijk_Alik_Bjlk_F8NB8NS_BH_Bias_HAS_SAV_UserArgs_MT128x128x64_MI16x16x1_SN_LDSB1_CLR1_GRVWA16_GRVWB8_GSU0_GSUC0_GSUWGMRR0_K1_LBSPPA256_LBSPPB1024_LPA16_LPB64_LRVW8_MIWT4_4_PLR1_SU0_SUM0_SUS64_VWA4_VWB4_WGM1_WGMXCC1_WGMXCCGn1
    SolutionIndex: 26
    SolutionNameMin: Cijk_Alik_Bjlk_F8NB8NS_BH_Bias_HAS_SAV_UserArgs_MT128x128x64_MI16x16x1_SN_LDSB1_CLR1_GRVWA16_GRVWB16_GSU0_GSUC0_GSUWGMRR0_K1_LBSPPA256_LBSPPB1024_LPA16_LPB64_LRVW8_MIWT4_4_PLR1_SU0_SUM0_SUS64_VWA4_VWB4_WGM1_WGMXCC1_WGMXCCGn1
    SolutionIndex: 27
    SolutionNameMin: Cijk_Alik_Bjlk_F8NB8NS_BH_Bias_HAS_SAV_UserArgs_MT128x64x64_MI16x16x1_SN_LDSB0_CLR1_GRVWA8_GRVWB8_GSU0_GSUC0_GSUWGMRR0_K1_LBSPPA256_LBSPPB512_LPA8_LPB32_LRVW8_MIWT4_2_PLR1_SU0_SUM0_SUS64_VWA4_VWB2_WGM1_WGMXCC1_WGMXCCGn1
    SolutionIndex: 28
    SolutionNameMin: Cijk_Alik_Bjlk_F8NB8NS_BH_Bias_HAS_SAV_UserArgs_MT128x64x64_MI16x16x1_SN_LDSB0_CLR1_GRVWA16_GRVWB8_GSU0_GSUC0_GSUWGMRR0_K1_LBSPPA256_LBSPPB512_LPA16_LPB32_LRVW8_MIWT4_2_PLR1_SU0_SUM0_SUS64_VWA4_VWB2_WGM1_WGMXCC1_WGMXCCGn1
    SolutionIndex: 29
    SolutionNameMin: Cijk_Alik_Bjlk_F8NB8NS_BH_Bias_HAS_SAV_UserArgs_MT128x64x64_MI16x16x1_SN_LDSB0_CLR1_GRVWA8_GRVWB16_GSU0_GSUC0_GSUWGMRR0_K1_LBSPPA256_LBSPPB512_LPA8_LPB32_LRVW8_MIWT4_2_PLR1_SU0_SUM0_SUS64_VWA4_VWB2_WGM1_WGMXCC1_WGMXCCGn1
    SolutionIndex: 30
    SolutionNameMin: Cijk_Alik_Bjlk_F8NB8NS_BH_Bias_HAS_SAV_UserArgs_MT128x64x64_MI16x16x1_SN_LDSB0_CLR1_GRVWA8_GRVWB16_GSU0_GSUC0_GSUWGMRR0_K1_LBSPPA256_LBSPPB512_LPA8_LPB32_LRVW8_MIWT4_2_PLR1_SU0_SUM0_SUS64_VWA4_VWB2_WGM4_WGMXCC1_WGMXCCGn1
    SolutionIndex: 31
    SolutionNameMin: Cijk_Alik_Bjlk_F8NB8NS_BH_Bias_HAS_SAV_UserArgs_MT128x64x64_MI16x16x1_SN_LDSB0_CLR1_GRVWA8_GRVWB16_GSU0_GSUC0_GSUWGMRR0_K1_LBSPPA256_LBSPPB512_LPA8_LPB32_LRVW8_MIWT4_2_PLR1_SU0_SUM0_SUS64_VWA4_VWB2_WGM6_WGMXCC1_WGMXCCGn1
    SolutionIndex: 32
    SolutionNameMin: Cijk_Alik_Bjlk_F8NB8NS_BH_Bias_HAS_SAV_UserArgs_MT128x64x64_MI16x16x1_SN_LDSB0_CLR1_GRVWA8_GRVWB16_GSU0_GSUC0_GSUWGMRR0_K1_LBSPPA256_LBSPPB512_LPA8_LPB32_LRVW8_MIWT4_2_PLR1_SU0_SUM0_SUS64_VWA4_VWB2_WGM8_WGMXCC1_WGMXCCGn1
    SolutionIndex: 33
    SolutionNameMin: Cijk_Alik_Bjlk_F8NB8NS_BH_Bias_HAS_SAV_UserArgs_MT64x64x64_MI16x16x1_SN_LDSB0_CLR1_GRVWA8_GRVWB8_GSU0_GSUC0_GSUWGMRR0_K1_LBSPPA128_LBSPPB512_LPA8_LPB32_LRVW8_MIWT2_2_PLR1_SU0_SUM0_SUS64_VWA2_VWB2_WGM1_WGMXCC1_WGMXCCGn1
    SolutionIndex: 34
    SolutionNameMin: Cijk_Alik_Bjlk_F8NB8NS_BH_Bias_HAS_SAV_UserArgs_MT64x64x64_MI16x16x1_SN_LDSB0_CLR1_GRVWA16_GRVWB8_GSU0_GSUC0_GSUWGMRR0_K1_LBSPPA128_LBSPPB512_LPA16_LPB32_LRVW8_MIWT2_2_PLR1_SU0_SUM0_SUS64_VWA2_VWB2_WGM1_WGMXCC1_WGMXCCGn1
    SolutionIndex: 35
    SolutionNameMin: Cijk_Alik_Bjlk_F8NB8NS_BH_Bias_HAS_SAV_UserArgs_MT64x32x64_MI16x16x1_SN_LDSB0_CLR1_GRVWA8_GRVWB8_GSU0_GSUC0_GSUWGMRR0_K1_LBSPPA128_LBSPPB256_LPA8_LPB16_LRVW8_MIWT2_1_PLR1_SU0_SUM0_SUS64_VWA2_VWB1_WGM1_WGMXCC1_WGMXCCGn1
    SolutionIndex: 36
    SolutionNameMin: Cijk_Alik_Bjlk_F8NB8NS_BH_Bias_HAS_SAV_UserArgs_MT64x32x64_MI16x16x1_SN_LDSB0_CLR1_GRVWA16_GRVWB8_GSU0_GSUC0_GSUWGMRR0_K1_LBSPPA128_LBSPPB256_LPA16_LPB16_LRVW8_MIWT2_1_PLR1_SU0_SUM0_SUS64_VWA2_VWB1_WGM1_WGMXCC1_WGMXCCGn1
    SolutionIndex: 37
    SolutionNameMin: Cijk_Alik_Bjlk_F8NB8NS_BH_Bias_HAS_SAV_UserArgs_MT32x32x64_MI16x16x1_SN_LDSB0_CLR1_GRVWA8_GRVWB8_GSU0_GSUC0_GSUWGMRR0_K1_LBSPPA128_LBSPPB256_LPA8_LPB16_LRVW8_MIWT1_1_PLR1_SU0_SUM0_SUS64_VWA1_VWB1_WGM1_WGMXCC1_WGMXCCGn1
    SolutionIndex: 38
    SolutionNameMin: Cijk_Alik_Bjlk_F8NB8NS_BH_Bias_HAS_SAV_UserArgs_MT128x256x128_MI16x16x1_SN_LDSB1_CLR1_GRVWA8_GRVWB16_GSU0_GSUC0_GSUWGMRR0_K1_LBSPPA512_LBSPPB2048_LPA8_LPB0_LRVW8_MIWT4_8_PLR1_SU0_SUM0_SUS128_VWA4_VWB8_WGM1_WGMXCC1_WGMXCCGn1
    SolutionIndex: 39
    SolutionNameMin: Cijk_Alik_Bjlk_F8NB8NS_BH_Bias_HAS_SAV_UserArgs_MT128x256x128_MI16x16x1_SN_LDSB1_CLR1_GRVWA16_GRVWB16_GSU0_GSUC0_GSUWGMRR0_K1_LBSPPA512_LBSPPB2048_LPA16_LPB0_LRVW8_MIWT4_8_PLR1_SU0_SUM0_SUS128_VWA4_VWB8_WGM1_WGMXCC1_WGMXCCGn1
    SolutionIndex: 40
    SolutionNameMin: Cijk_Alik_Bjlk_F8NB8NS_BH_Bias_HAS_SAV_UserArgs_MT128x256x128_MI16x16x1_SN_LDSB1_CLR1_GRVWA8_GRVWB16_GSU0_GSUC0_GSUWGMRR0_K1_LBSPPA512_LBSPPB2048_LPA8_LPB0_LRVW8_MIWT4_8_PLR1_SU0_SUM0_SUS128_VWA4_VWB8_WGM4_WGMXCC1_WGMXCCGn1
    SolutionIndex: 41
    SolutionNameMin: Cijk_Alik_Bjlk_F8NB8NS_BH_Bias_HAS_SAV_UserArgs_MT128x256x128_MI16x16x1_SN_LDSB1_CLR1_GRVWA8_GRVWB16_GSU0_GSUC0_GSUWGMRR0_K1_LBSPPA512_LBSPPB2048_LPA8_LPB0_LRVW8_MIWT4_8_PLR1_SU0_SUM0_SUS128_VWA4_VWB8_WGM6_WGMXCC1_WGMXCCGn1
    SolutionIndex: 42
    SolutionNameMin: Cijk_Alik_Bjlk_F8NB8NS_BH_Bias_HAS_SAV_UserArgs_MT128x256x128_MI16x16x1_SN_LDSB1_CLR1_GRVWA8_GRVWB16_GSU0_GSUC0_GSUWGMRR0_K1_LBSPPA512_LBSPPB2048_LPA8_LPB0_LRVW8_MIWT4_8_PLR1_SU0_SUM0_SUS128_VWA4_VWB8_WGM8_WGMXCC1_WGMXCCGn1
    SolutionIndex: 43
    SolutionNameMin: Cijk_Alik_Bjlk_F8NB8NS_BH_Bias_HAS_SAV_UserArgs_MT256x128x128_MI16x16x1_SN_LDSB1_CLR1_GRVWA8_GRVWB16_GSU0_GSUC0_GSUWGMRR0_K1_LBSPPA1024_LBSPPB1024_LPA8_LPB64_LRVW8_MIWT8_4_PLR1_SU0_SUM0_SUS128_VWA8_VWB4_WGM1_WGMXCC1_WGMXCCGn1
    SolutionIndex: 44
    SolutionNameMin: Cijk_Alik_Bjlk_F8NB8NS_BH_Bias_HAS_SAV_UserArgs_MT256x128x128_MI16x16x1_SN_LDSB1_CLR1_GRVWA8_GRVWB16_GSU0_GSUC0_GSUWGMRR0_K1_LBSPPA1024_LBSPPB1024_LPA8_LPB64_LRVW8_MIWT8_4_PLR1_SU0_SUM0_SUS128_VWA8_VWB4_WGM4_WGMXCC1_WGMXCCGn1
    SolutionIndex: 45
    SolutionNameMin: Cijk_Alik_Bjlk_F8NB8NS_BH_Bias_HAS_SAV_UserArgs_MT256x128x128_MI16x16x1_SN_LDSB1_CLR1_GRVWA16_GRVWB16_GSU0_GSUC0_GSUWGMRR0_K1_LBSPPA1024_LBSPPB1024_LPA16_LPB64_LRVW8_MIWT8_4_PLR1_SU0_SUM0_SUS128_VWA8_VWB4_WGM4_WGMXCC1_WGMXCCGn1
    SolutionIndex: 46
    SolutionNameMin: Cijk_Alik_Bjlk_F8NB8NS_BH_Bias_HAS_SAV_UserArgs_MT144x256x128_MI16x16x1_SN_LDSB1_CLR1_GRVWA8_GRVWB16_GSU0_GSUC0_GSUWGMRR0_K1_LBSPPA128_LBSPPB2048_LPA8_LPB64_LRVW8_MIWT9_4_PLR1_SU0_SUM0_SUS128_VWA1_VWB4_WGM1_WGMXCC1_WGMXCCGn1
    SolutionIndex: 47
    SolutionNameMin: Cijk_Alik_Bjlk_F8NB8NS_BH_Bias_HAS_SAV_UserArgs_MT144x256x128_MI16x16x1_SN_LDSB1_CLR1_GRVWA8_GRVWB16_GSU0_GSUC0_GSUWGMRR0_K1_LBSPPA128_LBSPPB2048_LPA8_LPB64_LRVW8_MIWT9_4_PLR1_SU0_SUM0_SUS128_VWA1_VWB4_WGM4_WGMXCC1_WGMXCCGn1
    SolutionIndex: 48
    SolutionNameMin: Cijk_Alik_Bjlk_F8NB8NS_BH_Bias_HAS_SAV_UserArgs_MT144x256x128_MI16x16x1_SN_LDSB1_CLR1_GRVWA8_GRVWB16_GSU0_GSUC0_GSUWGMRR0_K1_LBSPPA128_LBSPPB2048_LPA8_LPB64_LRVW8_MIWT9_4_PLR1_SU0_SUM0_SUS128_VWA1_VWB4_WGM6_WGMXCC1_WGMXCCGn1
    SolutionIndex: 49
    SolutionNameMin: Cijk_Alik_Bjlk_F8NB8NS_BH_Bias_HAS_SAV_UserArgs_MT144x256x128_MI16x16x1_SN_LDSB1_CLR1_GRVWA8_GRVWB16_GSU0_GSUC0_GSUWGMRR0_K1_LBSPPA128_LBSPPB2048_LPA8_LPB64_LRVW8_MIWT9_4_PLR1_SU0_SUM0_SUS128_VWA1_VWB4_WGM8_WGMXCC1_WGMXCCGn1
    SolutionIndex: 50
    SolutionNameMin: Cijk_Alik_Bjlk_F8NB8NS_BH_Bias_HAS_SAV_UserArgs_MT144x128x128_MI16x16x1_SN_LDSB1_CLR1_GRVWA8_GRVWB16_GSU0_GSUC0_GSUWGMRR0_K1_LBSPPA128_LBSPPB1024_LPA8_LPB32_LRVW8_MIWT9_2_PLR1_SU0_SUM0_SUS128_VWA1_VWB2_WGM4_WGMXCC1_WGMXCCGn1
    SolutionIndex: 51
    SolutionNameMin: Cijk_Alik_Bjlk_F8NB8NS_BH_Bias_HAS_SAV_UserArgs_MT128x128x128_MI16x16x1_SN_LDSB1_CLR1_GRVWA16_GRVWB8_GSU0_GSUC0_GSUWGMRR0_K1_LBSPPA512_LBSPPB1024_LPA16_LPB64_LRVW8_MIWT4_4_PLR1_SU0_SUM0_SUS128_VWA4_VWB4_WGM1_WGMXCC1_WGMXCCGn1
    SolutionIndex: 52
    SolutionNameMin: Cijk_Alik_Bjlk_F8NB8NS_BH_Bias_HAS_SAV_UserArgs_MT128x128x128_MI16x16x1_SN_LDSB1_CLR1_GRVWA16_GRVWB16_GSU0_GSUC0_GSUWGMRR0_K1_LBSPPA512_LBSPPB1024_LPA16_LPB64_LRVW8_MIWT4_4_PLR1_SU0_SUM0_SUS128_VWA4_VWB4_WGM1_WGMXCC1_WGMXCCGn1
    SolutionIndex: 53
    SolutionNameMin: Cijk_Alik_Bjlk_F8NB8NS_BH_Bias_HAS_SAV_UserArgs_MT128x128x128_MI16x16x1_SN_LDSB1_CLR1_GRVWA16_GRVWB16_GSU0_GSUC0_GSUWGMRR0_K1_LBSPPA512_LBSPPB1024_LPA16_LPB64_LRVW8_MIWT4_4_PLR1_SU0_SUM0_SUS128_VWA4_VWB4_WGM4_WGMXCC1_WGMXCCGn1
    SolutionIndex: 54
    SolutionNameMin: Cijk_Alik_Bjlk_F8NB8NS_BH_Bias_HAS_SAV_UserArgs_MT128x128x128_MI16x16x1_SN_LDSB1_CLR1_GRVWA16_GRVWB16_GSU0_GSUC0_GSUWGMRR0_K1_LBSPPA512_LBSPPB1024_LPA16_LPB64_LRVW8_MIWT4_4_PLR1_SU0_SUM0_SUS128_VWA4_VWB4_WGM6_WGMXCC1_WGMXCCGn1
    SolutionIndex: 55
    SolutionNameMin: Cijk_Alik_Bjlk_F8NB8NS_BH_Bias_HAS_SAV_UserArgs_MT128x128x128_MI16x16x1_SN_LDSB1_CLR1_GRVWA16_GRVWB16_GSU0_GSUC0_GSUWGMRR0_K1_LBSPPA512_LBSPPB1024_LPA16_LPB64_LRVW8_MIWT4_4_PLR1_SU0_SUM0_SUS128_VWA4_VWB4_WGM8_WGMXCC1_WGMXCCGn1
    SolutionIndex: 56
    SolutionNameMin: Cijk_Alik_Bjlk_F8NB8NS_BH_Bias_HAS_SAV_UserArgs_MT64x128x128_MI16x16x1_SN_LDSB1_CLR1_GRVWA8_GRVWB16_GSU0_GSUC0_GSUWGMRR0_K1_LBSPPA256_LBSPPB1024_LPA8_LPB64_LRVW8_MIWT2_4_PLR1_SU0_SUM0_SUS128_VWA2_VWB4_WGM1_WGMXCC1_WGMXCCGn1
    SolutionIndex: 57
    SolutionNameMin: Cijk_Alik_Bjlk_F8NB8NS_BH_Bias_HAS_SAV_UserArgs_MT128x64x128_MI16x16x1_SN_LDSB1_CLR1_GRVWA16_GRVWB16_GSU0_GSUC0_GSUWGMRR0_K1_LBSPPA512_LBSPPB512_LPA16_LPB32_LRVW8_MIWT4_2_PLR1_SU0_SUM0_SUS128_VWA4_VWB2_WGM4_WGMXCC1_WGMXCCGn1
    SolutionIndex: 58
    SolutionNameMin: Cijk_Alik_Bjlk_F8NB8NS_BH_Bias_HAS_SAV_UserArgs_MT128x64x128_MI16x16x1_SN_LDSB1_CLR1_GRVWA16_GRVWB16_GSU0_GSUC0_GSUWGMRR0_K1_LBSPPA512_LBSPPB512_LPA16_LPB32_LRVW8_MIWT4_2_PLR1_SU0_SUM0_SUS128_VWA4_VWB2_WGM8_WGMXCC1_WGMXCCGn1
    SolutionIndex: 59
    SolutionNameMin: Cijk_Alik_Bjlk_F8NB8NS_BH_Bias_HAS_SAV_UserArgs_MT64x64x128_MI16x16x1_SN_LDSB1_CLR1_GRVWA16_GRVWB8_GSU0_GSUC0_GSUWGMRR0_K1_LBSPPA256_LBSPPB512_LPA16_LPB32_LRVW8_MIWT2_2_PLR1_SU0_SUM0_SUS128_VWA2_VWB2_WGM1_WGMXCC1_WGMXCCGn1
    SolutionIndex: 60
    SolutionNameMin: Cijk_Alik_Bjlk_F8NB8NS_BH_Bias_HAS_SAV_UserArgs_MT64x64x128_MI16x16x1_SN_LDSB1_CLR1_GRVWA8_GRVWB16_GSU0_GSUC0_GSUWGMRR0_K1_LBSPPA256_LBSPPB512_LPA8_LPB32_LRVW8_MIWT2_2_PLR1_SU0_SUM0_SUS128_VWA2_VWB2_WGM1_WGMXCC1_WGMXCCGn1
    SolutionIndex: 61
    SolutionNameMin: Cijk_Alik_Bjlk_F8NB8NS_BH_Bias_HAS_SAV_UserArgs_MT64x64x128_MI16x16x1_SN_LDSB1_CLR1_GRVWA16_GRVWB16_GSU0_GSUC0_GSUWGMRR0_K1_LBSPPA256_LBSPPB512_LPA16_LPB32_LRVW8_MIWT2_2_PLR1_SU0_SUM0_SUS128_VWA2_VWB2_WGM1_WGMXCC1_WGMXCCGn1
    SolutionIndex: 62
    SolutionNameMin: Cijk_Alik_Bjlk_F8NB8NS_BH_Bias_HAS_SAV_UserArgs_MT32x64x128_MI16x16x1_SN_LDSB0_CLR1_GRVWA16_GRVWB8_GSU0_GSUC0_GSUWGMRR0_K1_LBSPPA128_LBSPPB512_LPA16_LPB32_LRVW8_MIWT1_2_PLR1_SU0_SUM0_SUS128_VWA1_VWB2_WGM1_WGMXCC1_WGMXCCGn1
    SolutionIndex: 63
    SolutionNameMin: Cijk_Alik_Bjlk_F8NB8NS_BH_Bias_HAS_SAV_UserArgs_MT32x64x128_MI16x16x1_SN_LDSB0_CLR1_GRVWA8_GRVWB16_GSU0_GSUC0_GSUWGMRR0_K1_LBSPPA128_LBSPPB512_LPA8_LPB32_LRVW8_MIWT1_2_PLR1_SU0_SUM0_SUS128_VWA1_VWB2_WGM4_WGMXCC1_WGMXCCGn1
    SolutionIndex: 64
    SolutionNameMin: Cijk_Alik_Bjlk_F8NB8NS_BH_Bias_HAS_SAV_UserArgs_MT64x32x128_MI16x16x1_SN_LDSB0_CLR1_GRVWA8_GRVWB8_GSU0_GSUC0_GSUWGMRR0_K1_LBSPPA256_LBSPPB256_LPA8_LPB16_LRVW8_MIWT2_1_PLR1_SU0_SUM0_SUS128_VWA2_VWB1_WGM1_WGMXCC1_WGMXCCGn1
    SolutionIndex: 65
    SolutionNameMin: Cijk_Alik_Bjlk_F8NB8NS_BH_Bias_HAS_SAV_UserArgs_MT64x32x128_MI16x16x1_SN_LDSB0_CLR1_GRVWA16_GRVWB8_GSU0_GSUC0_GSUWGMRR0_K1_LBSPPA256_LBSPPB256_LPA16_LPB16_LRVW8_MIWT2_1_PLR1_SU0_SUM0_SUS128_VWA2_VWB1_WGM1_WGMXCC1_WGMXCCGn1
    SolutionIndex: 66
    SolutionNameMin: Cijk_Alik_Bjlk_F8NB8NS_BH_Bias_HAS_SAV_UserArgs_MT64x32x128_MI16x16x1_SN_LDSB0_CLR1_GRVWA8_GRVWB16_GSU0_GSUC0_GSUWGMRR0_K1_LBSPPA256_LBSPPB256_LPA8_LPB16_LRVW8_MIWT2_1_PLR1_SU0_SUM0_SUS128_VWA2_VWB1_WGM1_WGMXCC1_WGMXCCGn1
    SolutionIndex: 67
    SolutionNameMin: Cijk_Alik_Bjlk_F8NB8NS_BH_Bias_HAS_SAV_UserArgs_MT64x32x128_MI16x16x1_SN_LDSB0_CLR1_GRVWA16_GRVWB16_GSU0_GSUC0_GSUWGMRR0_K1_LBSPPA256_LBSPPB256_LPA16_LPB16_LRVW8_MIWT2_1_PLR1_SU0_SUM0_SUS128_VWA2_VWB1_WGM1_WGMXCC1_WGMXCCGn1
    SolutionIndex: 68
    SolutionNameMin: Cijk_Alik_Bjlk_F8NB8NS_BH_Bias_HAS_SAV_UserArgs_MT64x32x128_MI16x16x1_SN_LDSB0_CLR1_GRVWA8_GRVWB16_GSU0_GSUC0_GSUWGMRR0_K1_LBSPPA256_LBSPPB256_LPA8_LPB16_LRVW8_MIWT2_1_PLR1_SU0_SUM0_SUS128_VWA2_VWB1_WGM4_WGMXCC1_WGMXCCGn1
    SolutionIndex: 69
    SolutionNameMin: Cijk_Alik_Bjlk_F8NB8NS_BH_Bias_HAS_SAV_UserArgs_MT64x32x128_MI16x16x1_SN_LDSB0_CLR1_GRVWA8_GRVWB16_GSU0_GSUC0_GSUWGMRR0_K1_LBSPPA256_LBSPPB256_LPA8_LPB16_LRVW8_MIWT2_1_PLR1_SU0_SUM0_SUS128_VWA2_VWB1_WGM8_WGMXCC1_WGMXCCGn1
    SolutionIndex: 70
    SolutionNameMin: Cijk_Alik_Bjlk_F8NB8NS_BH_Bias_HAS_SAV_UserArgs_MT32x32x128_MI16x16x1_SN_LDSB0_CLR1_GRVWA8_GRVWB8_GSU0_GSUC0_GSUWGMRR0_K1_LBSPPA128_LBSPPB256_LPA8_LPB16_LRVW8_MIWT1_1_PLR1_SU0_SUM0_SUS128_VWA1_VWB1_WGM1_WGMXCC1_WGMXCCGn1
    SolutionIndex: 71
    SolutionNameMin: Cijk_Alik_Bjlk_F8NB8NS_BH_Bias_HAS_SAV_UserArgs_MT32x32x128_MI16x16x1_SN_LDSB0_CLR1_GRVWA16_GRVWB8_GSU0_GSUC0_GSUWGMRR0_K1_LBSPPA128_LBSPPB256_LPA16_LPB16_LRVW8_MIWT1_1_PLR1_SU0_SUM0_SUS128_VWA1_VWB1_WGM1_WGMXCC1_WGMXCCGn1
    SolutionIndex: 72
    SolutionNameMin: Cijk_Alik_Bjlk_F8NB8NS_BH_Bias_HAS_SAV_UserArgs_MT32x32x128_MI16x16x1_SN_LDSB0_CLR1_GRVWA8_GRVWB16_GSU0_GSUC0_GSUWGMRR0_K1_LBSPPA128_LBSPPB256_LPA8_LPB16_LRVW8_MIWT1_1_PLR1_SU0_SUM0_SUS128_VWA1_VWB1_WGM1_WGMXCC1_WGMXCCGn1
    SolutionIndex: 73
    SolutionNameMin: Cijk_Alik_Bjlk_F8NB8NS_BH_Bias_HAS_SAV_UserArgs_MT32x32x128_MI16x16x1_SN_LDSB0_CLR1_GRVWA16_GRVWB16_GSU0_GSUC0_GSUWGMRR0_K1_LBSPPA128_LBSPPB256_LPA16_LPB16_LRVW8_MIWT1_1_PLR1_SU0_SUM0_SUS128_VWA1_VWB1_WGM1_WGMXCC1_WGMXCCGn1
    SolutionIndex: 74
    SolutionNameMin: Cijk_Alik_Bjlk_F8NB8NS_BH_Bias_HAS_SAV_UserArgs_MT32x32x128_MI16x16x1_SN_LDSB0_CLR1_GRVWA8_GRVWB16_GSU0_GSUC0_GSUWGMRR0_K1_LBSPPA128_LBSPPB256_LPA8_LPB16_LRVW8_MIWT1_1_PLR1_SU0_SUM0_SUS128_VWA1_VWB1_WGM4_WGMXCC1_WGMXCCGn1
    SolutionIndex: 75
    SolutionNameMin: Cijk_Alik_Bjlk_F8NB8NS_BH_Bias_HAS_SAV_UserArgs_MT32x32x128_MI16x16x1_SN_LDSB0_CLR1_GRVWA8_GRVWB16_GSU0_GSUC0_GSUWGMRR0_K1_LBSPPA128_LBSPPB256_LPA8_LPB16_LRVW8_MIWT1_1_PLR1_SU0_SUM0_SUS128_VWA1_VWB1_WGM6_WGMXCC1_WGMXCCGn1
    SolutionIndex: 76
    SolutionNameMin: Cijk_Alik_Bjlk_F8NB8NS_BH_Bias_HAS_SAV_UserArgs_MT32x32x128_MI16x16x1_SN_LDSB0_CLR1_GRVWA8_GRVWB8_GSU0_GSUC0_GSUWGMRR0_K1_LBSPPA128_LBSPPB256_LPA8_LPB16_LRVW8_MIWT1_1_PLR1_SU0_SUM0_SUS128_VWA1_VWB1_WGM8_WGMXCC1_WGMXCCGn1
    SolutionIndex: 77
    SolutionNameMin: Cijk_Alik_Bjlk_F8NB8NS_BH_Bias_HAS_SAV_UserArgs_MT128x64x256_MI16x16x1_SN_LDSB1_CLR1_GRVWA16_GRVWB16_GSU0_GSUC0_GSUWGMRR0_K1_LBSPPA1024_LBSPPB512_LPA16_LPB32_LRVW8_MIWT4_2_PLR1_SU0_SUM0_SUS256_VWA4_VWB2_WGM1_WGMXCC1_WGMXCCGn1
    SolutionIndex: 78
    SolutionNameMin: Cijk_Alik_Bjlk_F8NB8NS_BH_Bias_HAS_SAV_UserArgs_MT128x64x256_MI16x16x1_SN_LDSB1_CLR1_GRVWA16_GRVWB16_GSU0_GSUC0_GSUWGMRR0_K1_LBSPPA1024_LBSPPB512_LPA16_LPB32_LRVW8_MIWT4_2_PLR1_SU0_SUM0_SUS256_VWA4_VWB2_WGM4_WGMXCC1_WGMXCCGn1
    SolutionIndex: 79
    SolutionNameMin: Cijk_Alik_Bjlk_F8NB8NS_BH_Bias_HAS_SAV_UserArgs_MT128x64x256_MI16x16x1_SN_LDSB1_CLR1_GRVWA16_GRVWB16_GSU0_GSUC0_GSUWGMRR0_K1_LBSPPA1024_LBSPPB512_LPA16_LPB32_LRVW8_MIWT4_2_PLR1_SU0_SUM0_SUS256_VWA4_VWB2_WGM6_WGMXCC1_WGMXCCGn1
    SolutionIndex: 80
    SolutionNameMin: Cijk_Alik_Bjlk_F8NB8NS_BH_Bias_HAS_SAV_UserArgs_MT128x64x256_MI16x16x1_SN_LDSB1_CLR1_GRVWA16_GRVWB16_GSU0_GSUC0_GSUWGMRR0_K1_LBSPPA1024_LBSPPB512_LPA16_LPB32_LRVW8_MIWT4_2_PLR1_SU0_SUM0_SUS256_VWA4_VWB2_WGM8_WGMXCC1_WGMXCCGn1
    SolutionIndex: 81
    SolutionNameMin: Cijk_Alik_Bjlk_F8NB8NS_BH_Bias_HAS_SAV_UserArgs_MT64x64x256_MI16x16x1_SN_LDSB1_CLR1_GRVWA16_GRVWB16_GSU0_GSUC0_GSUWGMRR0_K1_LBSPPA512_LBSPPB512_LPA16_LPB32_LRVW8_MIWT2_2_PLR1_SU0_SUM0_SUS256_VWA2_VWB2_WGM1_WGMXCC1_WGMXCCGn1
    SolutionIndex: 82
    SolutionNameMin: Cijk_Alik_Bjlk_F8NB8NS_BH_Bias_HAS_SAV_UserArgs_MT64x64x256_MI16x16x1_SN_LDSB1_CLR1_GRVWA16_GRVWB16_GSU0_GSUC0_GSUWGMRR0_K1_LBSPPA512_LBSPPB512_LPA16_LPB32_LRVW8_MIWT2_2_PLR1_SU0_SUM0_SUS256_VWA2_VWB2_WGM6_WGMXCC1_WGMXCCGn1
    SolutionIndex: 83
    SolutionNameMin: Cijk_Alik_Bjlk_F8NB8NS_BH_Bias_HAS_SAV_UserArgs_MT64x64x256_MI16x16x1_SN_LDSB1_CLR1_GRVWA16_GRVWB16_GSU0_GSUC0_GSUWGMRR0_K1_LBSPPA512_LBSPPB512_LPA16_LPB32_LRVW8_MIWT2_2_PLR1_SU0_SUM0_SUS256_VWA2_VWB2_WGM8_WGMXCC1_WGMXCCGn1
    SolutionIndex: 84
    SolutionNameMin: Cijk_Alik_Bjlk_F8NB8NS_BH_Bias_HAS_SAV_UserArgs_MT32x64x256_MI16x16x1_SN_LDSB1_CLR1_GRVWA8_GRVWB16_GSU0_GSUC0_GSUWGMRR0_K1_LBSPPA256_LBSPPB512_LPA8_LPB32_LRVW8_MIWT1_2_PLR1_SU0_SUM0_SUS256_VWA1_VWB2_WGM1_WGMXCC1_WGMXCCGn1
    SolutionIndex: 85
    SolutionNameMin: Cijk_Alik_Bjlk_F8NB8NS_BH_Bias_HAS_SAV_UserArgs_MT32x64x256_MI16x16x1_SN_LDSB1_CLR1_GRVWA16_GRVWB16_GSU0_GSUC0_GSUWGMRR0_K1_LBSPPA256_LBSPPB512_LPA16_LPB32_LRVW8_MIWT1_2_PLR1_SU0_SUM0_SUS256_VWA1_VWB2_WGM1_WGMXCC1_WGMXCCGn1
    SolutionIndex: 86
    SolutionNameMin: Cijk_Alik_Bjlk_F8NB8NS_BH_Bias_HAS_SAV_UserArgs_MT32x64x256_MI16x16x1_SN_LDSB1_CLR1_GRVWA8_GRVWB16_GSU0_GSUC0_GSUWGMRR0_K1_LBSPPA256_LBSPPB512_LPA8_LPB32_LRVW8_MIWT1_2_PLR1_SU0_SUM0_SUS256_VWA1_VWB2_WGM4_WGMXCC1_WGMXCCGn1
    SolutionIndex: 87
    SolutionNameMin: Cijk_Alik_Bjlk_F8NB8NS_BH_Bias_HAS_SAV_UserArgs_MT32x64x256_MI16x16x1_SN_LDSB1_CLR1_GRVWA16_GRVWB16_GSU0_GSUC0_GSUWGMRR0_K1_LBSPPA256_LBSPPB512_LPA16_LPB32_LRVW8_MIWT1_2_PLR1_SU0_SUM0_SUS256_VWA1_VWB2_WGM6_WGMXCC1_WGMXCCGn1
    SolutionIndex: 88
    SolutionNameMin: Cijk_Alik_Bjlk_F8NB8NS_BH_Bias_HAS_SAV_UserArgs_MT64x32x256_MI16x16x1_SN_LDSB1_CLR1_GRVWA16_GRVWB16_GSU0_GSUC0_GSUWGMRR0_K1_LBSPPA512_LBSPPB256_LPA16_LPB16_LRVW8_MIWT2_1_PLR1_SU0_SUM0_SUS256_VWA2_VWB1_WGM8_WGMXCC1_WGMXCCGn1
    SolutionIndex: 89
    SolutionNameMin: Cijk_Alik_Bjlk_F8NB8NS_BH_Bias_HAS_SAV_UserArgs_MT32x32x256_MI16x16x1_SN_LDSB1_CLR1_GRVWA8_GRVWB16_GSU0_GSUC0_GSUWGMRR0_K1_LBSPPA256_LBSPPB256_LPA8_LPB16_LRVW8_MIWT1_1_PLR1_SU0_SUM0_SUS256_VWA1_VWB1_WGM1_WGMXCC1_WGMXCCGn1
    SolutionIndex: 90
    SolutionNameMin: Cijk_Alik_Bjlk_F8NB8NS_BH_Bias_HAS_SAV_UserArgs_MT32x32x256_MI16x16x1_SN_LDSB1_CLR1_GRVWA16_GRVWB16_GSU0_GSUC0_GSUWGMRR0_K1_LBSPPA256_LBSPPB256_LPA16_LPB16_LRVW8_MIWT1_1_PLR1_SU0_SUM0_SUS256_VWA1_VWB1_WGM1_WGMXCC1_WGMXCCGn1
    SolutionIndex: 91
    SolutionNameMin: Cijk_Alik_Bjlk_F8NB8NS_BH_Bias_HAS_SAV_UserArgs_MT32x32x256_MI16x16x1_SN_LDSB1_CLR1_GRVWA8_GRVWB16_GSU0_GSUC0_GSUWGMRR0_K1_LBSPPA256_LBSPPB256_LPA8_LPB16_LRVW8_MIWT1_1_PLR1_SU0_SUM0_SUS256_VWA1_VWB1_WGM6_WGMXCC1_WGMXCCGn1
- - - [128, 128, 1, 128, 128, 128, 128, 128]
    - [37, 0.56]
  - - [128, 128, 1, 256, 128, 128, 256, 128]
    - [37, 1.01]
  - - [128, 128, 1, 512, 128, 128, 512, 128]
    - [70, 1.75]
  - - [128, 128, 1, 1024, 128, 128, 1024, 128]
    - [70, 2.74]
  - - [128, 128, 1, 2048, 128, 128, 2048, 128]
    - [72, 3.84]
  - - [128, 128, 1, 4096, 128, 128, 4096, 128]
    - [72, 4.83]
  - - [128, 128, 1, 8192, 128, 128, 8192, 128]
    - [72, 5.52]
  - - [128, 256, 1, 128, 128, 128, 128, 256]
    - [70, 1.16]
  - - [128, 256, 1, 256, 128, 128, 256, 256]
    - [70, 2.0]
  - - [128, 256, 1, 512, 128, 128, 512, 256]
    - [70, 3.42]
  - - [128, 256, 1, 1024, 128, 128, 1024, 256]
    - [70, 5.38]
  - - [128, 256, 1, 2048, 128, 128, 2048, 256]
    - [70, 7.76]
  - - [128, 256, 1, 4096, 128, 128, 4096, 256]
    - [72, 9.73]
  - - [128, 256, 1, 8192, 128, 128, 8192, 256]
    - [72, 11.09]
  - - [128, 512, 1, 128, 128, 128, 128, 512]
    - [70, 2.2]
  - - [128, 512, 1, 256, 128, 128, 256, 512]
    - [71, 4.01]
  - - [128, 512, 1, 512, 128, 128, 512, 512]
    - [70, 6.95]
  - - [128, 512, 1, 1024, 128, 128, 1024, 512]
    - [70, 10.94]
  - - [128, 512, 1, 2048, 128, 128, 2048, 512]
    - [70, 15.26]
  - - [128, 512, 1, 4096, 128, 128, 4096, 512]
    - [72, 19.02]
  - - [128, 512, 1, 8192, 128, 128, 8192, 512]
    - [90, 17.69]
  - - [128, 1024, 1, 128, 128, 128, 128, 1024]
    - [37, 4.34]
  - - [128, 1024, 1, 256, 128, 128, 256, 1024]
    - [70, 7.96]
  - - [128, 1024, 1, 512, 128, 128, 512, 1024]
    - [70, 13.72]
  - - [128, 1024, 1, 1024, 128, 128, 1024, 1024]
    - [70, 21.66]
  - - [128, 1024, 1, 2048, 128, 128, 2048, 1024]
    - [70, 30.09]
  - - [128, 1024, 1, 4096, 128, 128, 4096, 1024]
    - [89, 30.51]
  - - [128, 1024, 1, 8192, 128, 128, 8192, 1024]
    - [91, 32.14]
  - - [128, 2048, 1, 128, 128, 128, 128, 2048]
    - [64, 8.19]
  - - [128, 2048, 1, 256, 128, 128, 256, 2048]
    - [62, 14.64]
  - - [128, 2048, 1, 512, 128, 128, 512, 2048]
    - [64, 24.8]
  - - [128, 2048, 1, 1024, 128, 128, 1024, 2048]
    - [66, 37.88]
  - - [128, 2048, 1, 2048, 128, 128, 2048, 2048]
    - [85, 44.42]
  - - [128, 2048, 1, 4096, 128, 128, 4096, 2048]
    - [67, 52.67]
  - - [128, 2048, 1, 8192, 128, 128, 8192, 2048]
    - [87, 59.34]
  - - [128, 4096, 1, 128, 128, 128, 128, 4096]
    - [33, 14.62]
  - - [128, 4096, 1, 256, 128, 128, 256, 4096]
    - [61, 25.85]
  - - [128, 4096, 1, 512, 128, 128, 512, 4096]
    - [60, 43.2]
  - - [128, 4096, 1, 1024, 128, 128, 1024, 4096]
    - [61, 63.98]
  - - [128, 4096, 1, 2048, 128, 128, 2048, 4096]
    - [81, 78.03]
  - - [128, 4096, 1, 4096, 128, 128, 4096, 4096]
    - [81, 96.23]
  - - [128, 4096, 1, 8192, 128, 128, 8192, 4096]
    - [81, 108.81]
  - - [128, 8192, 1, 128, 128, 128, 128, 8192]
    - [23, 25.34]
  - - [128, 8192, 1, 256, 128, 128, 256, 8192]
    - [29, 44.9]
  - - [128, 8192, 1, 512, 128, 128, 512, 8192]
    - [29, 72.63]
  - - [128, 8192, 1, 1024, 128, 128, 1024, 8192]
    - [29, 105.6]
  - - [128, 8192, 1, 2048, 128, 128, 2048, 8192]
    - [56, 122.22]
  - - [128, 8192, 1, 4096, 128, 128, 4096, 8192]
    - [56, 144.03]
  - - [128, 8192, 1, 8192, 128, 128, 8192, 8192]
    - [77, 150.75]
  - - [256, 128, 1, 128, 256, 256, 128, 128]
    - [37, 1.07]
  - - [256, 128, 1, 256, 256, 256, 256, 128]
    - [70, 2.01]
  - - [256, 128, 1, 512, 256, 256, 512, 128]
    - [73, 3.38]
  - - [256, 128, 1, 1024, 256, 256, 1024, 128]
    - [70, 5.35]
  - - [256, 128, 1, 2048, 256, 256, 2048, 128]
    - [72, 7.62]
  - - [256, 128, 1, 4096, 256, 256, 4096, 128]
    - [72, 9.61]
  - - [256, 128, 1, 8192, 256, 256, 8192, 128]
    - [72, 11.02]
  - - [256, 256, 1, 128, 256, 256, 128, 256]
    - [70, 2.24]
  - - [256, 256, 1, 256, 256, 256, 256, 256]
    - [76, 3.93]
  - - [256, 256, 1, 512, 256, 256, 512, 256]
    - [70, 7.06]
  - - [256, 256, 1, 1024, 256, 256, 1024, 256]
    - [70, 10.99]
  - - [256, 256, 1, 2048, 256, 256, 2048, 256]
    - [72, 15.37]
  - - [256, 256, 1, 4096, 256, 256, 4096, 256]
    - [72, 19.35]
  - - [256, 256, 1, 8192, 256, 256, 8192, 256]
    - [74, 21.94]
  - - [256, 512, 1, 128, 256, 256, 128, 512]
    - [70, 4.46]
  - - [256, 512, 1, 256, 256, 256, 256, 512]
    - [70, 8.05]
  - - [256, 512, 1, 512, 256, 256, 512, 512]
    - [70, 13.65]
  - - [256, 512, 1, 1024, 256, 256, 1024, 512]
    - [70, 21.55]
  - - [256, 512, 1, 2048, 256, 256, 2048, 512]
    - [70, 30.17]
  - - [256, 512, 1, 4096, 256, 256, 4096, 512]
    - [72, 37.93]
  - - [256, 512, 1, 8192, 256, 256, 8192, 512]
    - [90, 38.85]
  - - [256, 1024, 1, 128, 256, 256, 128, 1024]
    - [64, 8.31]
  - - [256, 1024, 1, 256, 256, 256, 256, 1024]
    - [65, 14.72]
  - - [256, 1024, 1, 512, 256, 256, 512, 1024]
    - [64, 24.72]
  - - [256, 1024, 1, 1024, 256, 256, 1024, 1024]
    - [66, 37.67]
  - - [256, 1024, 1, 2048, 256, 256, 2048, 1024]
    - [66, 52.11]
  - - [256, 1024, 1, 4096, 256, 256, 4096, 1024]
    - [88, 57.29]
  - - [256, 1024, 1, 8192, 256, 256, 8192, 1024]
    - [87, 60.08]
  - - [256, 2048, 1, 128, 256, 256, 128, 2048]
    - [34, 15.1]
  - - [256, 2048, 1, 256, 256, 256, 256, 2048]
    - [33, 27.09]
  - - [256, 2048, 1, 512, 256, 256, 512, 2048]
    - [59, 43.58]
  - - [256, 2048, 1, 1024, 256, 256, 1024, 2048]
    - [60, 65.67]
  - - [256, 2048, 1, 2048, 256, 256, 2048, 2048]
    - [81, 81.41]
  - - [256, 2048, 1, 4096, 256, 256, 4096, 2048]
    - [81, 97.15]
  - - [256, 2048, 1, 8192, 256, 256, 8192, 2048]
    - [81, 109.57]
  - - [256, 4096, 1, 128, 256, 256, 128, 4096]
    - [28, 26.37]
  - - [256, 4096, 1, 256, 256, 256, 256, 4096]
    - [29, 45.93]
  - - [256, 4096, 1, 512, 256, 256, 512, 4096]
    - [29, 72.54]
  - - [256, 4096, 1, 1024, 256, 256, 1024, 4096]
    - [29, 104.8]
  - - [256, 4096, 1, 2048, 256, 256, 2048, 4096]
    - [77, 124.42]
  - - [256, 4096, 1, 4096, 256, 256, 4096, 4096]
    - [77, 148.57]
  - - [256, 4096, 1, 8192, 256, 256, 8192, 4096]
    - [78, 163.03]
  - - [256, 8192, 1, 128, 256, 256, 128, 8192]
    - [25, 41.66]
  - - [256, 8192, 1, 256, 256, 256, 256, 8192]
    - [25, 70.88]
  - - [256, 8192, 1, 512, 256, 256, 512, 8192]
    - [52, 112.1]
  - - [256, 8192, 1, 1024, 256, 256, 1024, 8192]
    - [52, 160.86]
  - - [256, 8192, 1, 2048, 256, 256, 2048, 8192]
    - [52, 184.24]
  - - [256, 8192, 1, 4096, 256, 256, 4096, 8192]
    - [52, 207.18]
  - - [256, 8192, 1, 8192, 256, 256, 8192, 8192]
    - [52, 202.89]
  - - [512, 128, 1, 128, 512, 512, 128, 128]
    - [36, 2.08]
  - - [512, 128, 1, 256, 512, 512, 256, 128]
    - [37, 3.98]
  - - [512, 128, 1, 512, 512, 512, 512, 128]
    - [70, 6.99]
  - - [512, 128, 1, 1024, 512, 512, 1024, 128]
    - [72, 10.83]
  - - [512, 128, 1, 2048, 512, 512, 2048, 128]
    - [70, 15.16]
  - - [512, 128, 1, 4096, 512, 512, 4096, 128]
    - [72, 19.07]
  - - [512, 128, 1, 8192, 512, 512, 8192, 128]
    - [72, 22.01]
  - - [512, 256, 1, 128, 512, 512, 128, 256]
    - [37, 4.16]
  - - [512, 256, 1, 256, 512, 512, 256, 256]
    - [70, 7.58]
  - - [512, 256, 1, 512, 512, 512, 512, 256]
    - [70, 13.93]
  - - [512, 256, 1, 1024, 512, 512, 1024, 256]
    - [72, 21.61]
  - - [512, 256, 1, 2048, 512, 512, 2048, 256]
    - [72, 30.19]
  - - [512, 256, 1, 4096, 512, 512, 4096, 256]
    - [72, 37.91]
  - - [512, 256, 1, 8192, 512, 512, 8192, 256]
    - [74, 43.23]
  - - [512, 512, 1, 128, 512, 512, 128, 512]
    - [64, 8.27]
  - - [512, 512, 1, 256, 512, 512, 256, 512]
    - [64, 14.79]
  - - [512, 512, 1, 512, 512, 512, 512, 512]
    - [65, 23.94]
  - - [512, 512, 1, 1024, 512, 512, 1024, 512]
    - [66, 37.08]
  - - [512, 512, 1, 2048, 512, 512, 2048, 512]
    - [66, 50.85]
  - - [512, 512, 1, 4096, 512, 512, 4096, 512]
    - [68, 62.92]
  - - [512, 512, 1, 8192, 512, 512, 8192, 512]
    - [63, 64.14]
  - - [512, 1024, 1, 128, 512, 512, 128, 1024]
    - [33, 14.91]
  - - [512, 1024, 1, 256, 512, 512, 256, 1024]
    - [34, 26.81]
  - - [512, 1024, 1, 512, 512, 512, 512, 1024]
    - [33, 43.65]
  - - [512, 1024, 1, 1024, 512, 512, 1024, 1024]
    - [60, 64.85]
  - - [512, 1024, 1, 2048, 512, 512, 2048, 1024]
    - [81, 88.02]
  - - [512, 1024, 1, 4096, 512, 512, 4096, 1024]
    - [81, 97.94]
  - - [512, 1024, 1, 8192, 512, 512, 8192, 1024]
    - [82, 107.24]
  - - [512, 2048, 1, 128, 512, 512, 128, 2048]
    - [23, 26.07]
  - - [512, 2048, 1, 256, 512, 512, 256, 2048]
    - [27, 45.54]
  - - [512, 2048, 1, 512, 512, 512, 512, 2048]
    - [29, 74.06]
  - - [512, 2048, 1, 1024, 512, 512, 1024, 2048]
    - [29, 107.25]
  - - [512, 2048, 1, 2048, 512, 512, 2048, 2048]
    - [77, 127.65]
  - - [512, 2048, 1, 4096, 512, 512, 4096, 2048]
    - [77, 151.43]
  - - [512, 2048, 1, 8192, 512, 512, 8192, 2048]
    - [77, 160.84]
  - - [512, 4096, 1, 128, 512, 512, 128, 4096]
    - [51, 41.19]
  - - [512, 4096, 1, 256, 512, 512, 256, 4096]
    - [22, 70.46]
  - - [512, 4096, 1, 512, 512, 512, 512, 4096]
    - [52, 111.31]
  - - [512, 4096, 1, 1024, 512, 512, 1024, 4096]
    - [52, 160.19]
  - - [512, 4096, 1, 2048, 512, 512, 2048, 4096]
    - [52, 189.31]
  - - [512, 4096, 1, 4096, 512, 512, 4096, 4096]
    - [52, 218.7]
  - - [512, 4096, 1, 8192, 512, 512, 8192, 4096]
    - [52, 198.77]
  - - [512, 8192, 1, 128, 512, 512, 128, 8192]
    - [17, 58.75]
  - - [512, 8192, 1, 256, 512, 512, 256, 8192]
    - [17, 98.41]
  - - [512, 8192, 1, 512, 512, 512, 512, 8192]
    - [18, 155.26]
  - - [512, 8192, 1, 1024, 512, 512, 1024, 8192]
    - [16, 212.96]
  - - [512, 8192, 1, 2048, 512, 512, 2048, 8192]
    - [38, 237.12]
  - - [512, 8192, 1, 4096, 512, 512, 4096, 8192]
    - [38, 260.66]
  - - [512, 8192, 1, 8192, 512, 512, 8192, 8192]
    - [39, 239.38]
  - - [1024, 128, 1, 128, 1024, 1024, 128, 128]
    - [37, 4.29]
  - - [1024, 128, 1, 256, 1024, 1024, 256, 128]
    - [70, 8.02]
  - - [1024, 128, 1, 512, 1024, 1024, 512, 128]
    - [70, 13.61]
  - - [1024, 128, 1, 1024, 1024, 1024, 1024, 128]
    - [70, 21.34]
  - - [1024, 128, 1, 2048, 1024, 1024, 2048, 128]
    - [72, 30.07]
  - - [1024, 128, 1, 4096, 1024, 1024, 4096, 128]
    - [72, 37.91]
  - - [1024, 128, 1, 8192, 1024, 1024, 8192, 128]
    - [75, 43.19]
  - - [1024, 256, 1, 128, 1024, 1024, 128, 256]
    - [36, 8.24]
  - - [1024, 256, 1, 256, 1024, 1024, 256, 256]
    - [65, 14.8]
  - - [1024, 256, 1, 512, 1024, 1024, 512, 256]
    - [65, 24.8]
  - - [1024, 256, 1, 1024, 1024, 1024, 1024, 256]
    - [66, 37.92]
  - - [1024, 256, 1, 2048, 1024, 1024, 2048, 256]
    - [66, 51.64]
  - - [1024, 256, 1, 4096, 1024, 1024, 4096, 256]
    - [69, 63.37]
  - - [1024, 256, 1, 8192, 1024, 1024, 8192, 256]
    - [86, 71.52]
  - - [1024, 512, 1, 128, 1024, 1024, 128, 512]
    - [34, 15.14]
  - - [1024, 512, 1, 256, 1024, 1024, 256, 512]
    - [33, 26.52]
  - - [1024, 512, 1, 512, 1024, 1024, 512, 512]
    - [60, 43.38]
  - - [1024, 512, 1, 1024, 1024, 1024, 1024, 512]
    - [60, 65.4]
  - - [1024, 512, 1, 2048, 1024, 1024, 2048, 512]
    - [81, 87.48]
  - - [1024, 512, 1, 4096, 1024, 1024, 4096, 512]
    - [83, 105.22]
  - - [1024, 512, 1, 8192, 1024, 1024, 8192, 512]
    - [83, 107.91]
  - - [1024, 1024, 1, 128, 1024, 1024, 128, 1024]
    - [28, 25.94]
  - - [1024, 1024, 1, 256, 1024, 1024, 256, 1024]
    - [29, 45.46]
  - - [1024, 1024, 1, 512, 1024, 1024, 512, 1024]
    - [29, 73.42]
  - - [1024, 1024, 1, 1024, 1024, 1024, 1024, 1024]
    - [29, 106.75]
  - - [1024, 1024, 1, 2048, 1024, 1024, 2048, 1024]
    - [32, 136.28]
  - - [1024, 1024, 1, 4096, 1024, 1024, 4096, 1024]
    - [78, 148.34]
  - - [1024, 1024, 1, 8192, 1024, 1024, 8192, 1024]
    - [80, 160.43]
  - - [1024, 2048, 1, 128, 1024, 1024, 128, 2048]
    - [25, 41.24]
  - - [1024, 2048, 1, 256, 1024, 1024, 256, 2048]
    - [22, 70.48]
  - - [1024, 2048, 1, 512, 1024, 1024, 512, 2048]
    - [52, 112.46]
  - - [1024, 2048, 1, 1024, 1024, 1024, 1024, 2048]
    - [52, 161.2]
  - - [1024, 2048, 1, 2048, 1024, 1024, 2048, 2048]
    - [52, 192.94]
  - - [1024, 2048, 1, 4096, 1024, 1024, 4096, 2048]
    - [53, 214.7]
  - - [1024, 2048, 1, 8192, 1024, 1024, 8192, 2048]
    - [55, 205.56]
  - - [1024, 4096, 1, 128, 1024, 1024, 128, 4096]
    - [17, 58.56]
  - - [1024, 4096, 1, 256, 1024, 1024, 256, 4096]
    - [16, 99.86]
  - - [1024, 4096, 1, 512, 1024, 1024, 512, 4096]
    - [16, 154.77]
  - - [1024, 4096, 1, 1024, 1024, 1024, 1024, 4096]
    - [18, 209.66]
  - - [1024, 4096, 1, 2048, 1024, 1024, 2048, 4096]
    - [43, 240.48]
  - - [1024, 4096, 1, 4096, 1024, 1024, 4096, 4096]
    - [40, 256.99]
  - - [1024, 4096, 1, 8192, 1024, 1024, 8192, 4096]
    - [43, 237.41]
  - - [1024, 8192, 1, 128, 1024, 1024, 128, 8192]
    - [10, 74.08]
  - - [1024, 8192, 1, 256, 1024, 1024, 256, 8192]
    - [10, 125.23]
  - - [1024, 8192, 1, 512, 1024, 1024, 512, 8192]
    - [10, 184.76]
  - - [1024, 8192, 1, 1024, 1024, 1024, 1024, 8192]
    - [3, 242.07]
  - - [1024, 8192, 1, 2048, 1024, 1024, 2048, 8192]
    - [7, 273.64]
  - - [1024, 8192, 1, 4096, 1024, 1024, 4096, 8192]
    - [10, 267.75]
  - - [1024, 8192, 1, 8192, 1024, 1024, 8192, 8192]
    - [1, 284.5]
  - - [2048, 128, 1, 128, 2048, 2048, 128, 128]
    - [35, 8.27]
  - - [2048, 128, 1, 256, 2048, 2048, 256, 128]
    - [65, 14.75]
  - - [2048, 128, 1, 512, 2048, 2048, 512, 128]
    - [66, 24.81]
  - - [2048, 128, 1, 1024, 2048, 2048, 1024, 128]
    - [66, 36.68]
  - - [2048, 128, 1, 2048, 2048, 2048, 2048, 128]
    - [66, 51.34]
  - - [2048, 128, 1, 4096, 2048, 2048, 4096, 128]
    - [69, 62.58]
  - - [2048, 128, 1, 8192, 2048, 2048, 8192, 128]
    - [84, 70.78]
  - - [2048, 256, 1, 128, 2048, 2048, 128, 256]
    - [34, 15.08]
  - - [2048, 256, 1, 256, 2048, 2048, 256, 256]
    - [34, 26.75]
  - - [2048, 256, 1, 512, 2048, 2048, 512, 256]
    - [33, 43.43]
  - - [2048, 256, 1, 1024, 2048, 2048, 1024, 256]
    - [60, 65.36]
  - - [2048, 256, 1, 2048, 2048, 2048, 2048, 256]
    - [81, 87.37]
  - - [2048, 256, 1, 4096, 2048, 2048, 4096, 256]
    - [82, 105.84]
  - - [2048, 256, 1, 8192, 2048, 2048, 8192, 256]
    - [83, 117.83]
  - - [2048, 512, 1, 128, 2048, 2048, 128, 512]
    - [27, 25.75]
  - - [2048, 512, 1, 256, 2048, 2048, 256, 512]
    - [29, 45.45]
  - - [2048, 512, 1, 512, 2048, 2048, 512, 512]
    - [29, 73.3]
  - - [2048, 512, 1, 1024, 2048, 2048, 1024, 512]
    - [29, 106.51]
  - - [2048, 512, 1, 2048, 2048, 2048, 2048, 512]
    - [32, 135.98]
  - - [2048, 512, 1, 4096, 2048, 2048, 4096, 512]
    - [80, 152.53]
  - - [2048, 512, 1, 8192, 2048, 2048, 8192, 512]
    - [78, 159.66]
  - - [2048, 1024, 1, 128, 2048, 2048, 128, 1024]
    - [51, 41.4]
  - - [2048, 1024, 1, 256, 2048, 2048, 256, 1024]
    - [22, 70.5]
  - - [2048, 1024, 1, 512, 2048, 2048, 512, 1024]
    - [52, 111.8]
  - - [2048, 1024, 1, 1024, 2048, 2048, 1024, 1024]
    - [52, 160.77]
  - - [2048, 1024, 1, 2048, 2048, 2048, 2048, 1024]
    - [55, 196.64]
  - - [2048, 1024, 1, 4096, 2048, 2048, 4096, 1024]
    - [53, 208.34]
  - - [2048, 1024, 1, 8192, 2048, 2048, 8192, 1024]
    - [55, 201.99]
  - - [2048, 2048, 1, 128, 2048, 2048, 128, 2048]
    - [17, 58.78]
  - - [2048, 2048, 1, 256, 2048, 2048, 256, 2048]
    - [16, 100.64]
  - - [2048, 2048, 1, 512, 2048, 2048, 512, 2048]
    - [18, 156.69]
  - - [2048, 2048, 1, 1024, 2048, 2048, 1024, 2048]
    - [18, 203.39]
  - - [2048, 2048, 1, 2048, 2048, 2048, 2048, 2048]
    - [45, 238.85]
  - - [2048, 2048, 1, 4096, 2048, 2048, 4096, 2048]
    - [40, 255.7]
  - - [2048, 2048, 1, 8192, 2048, 2048, 8192, 2048]
    - [40, 239.35]
  - - [2048, 4096, 1, 128, 2048, 2048, 128, 4096]
    - [3, 72.86]
  - - [2048, 4096, 1, 256, 2048, 2048, 256, 4096]
    - [1, 123.05]
  - - [2048, 4096, 1, 512, 2048, 2048, 512, 4096]
    - [6, 183.6]
  - - [2048, 4096, 1, 1024, 2048, 2048, 1024, 4096]
    - [11, 243.46]
  - - [2048, 4096, 1, 2048, 2048, 2048, 2048, 4096]
    - [4, 273.92]
  - - [2048, 4096, 1, 4096, 2048, 2048, 4096, 4096]
    - [10, 263.99]
  - - [2048, 4096, 1, 8192, 2048, 2048, 8192, 4096]
    - [3, 283.21]
  - - [2048, 8192, 1, 128, 2048, 2048, 128, 8192]
    - [2, 78.8]
  - - [2048, 8192, 1, 256, 2048, 2048, 256, 8192]
    - [6, 131.29]
  - - [2048, 8192, 1, 512, 2048, 2048, 512, 8192]
    - [10, 193.14]
  - - [2048, 8192, 1, 1024, 2048, 2048, 1024, 8192]
    - [6, 235.94]
  - - [2048, 8192, 1, 2048, 2048, 2048, 2048, 8192]
    - [12, 243.83]
  - - [2048, 8192, 1, 4096, 2048, 2048, 4096, 8192]
    - [7, 281.89]
  - - [2048, 8192, 1, 8192, 2048, 2048, 8192, 8192]
    - [42, 308.36]
  - - [4096, 128, 1, 128, 4096, 4096, 128, 128]
    - [34, 15.04]
  - - [4096, 128, 1, 256, 4096, 4096, 256, 128]
    - [34, 26.47]
  - - [4096, 128, 1, 512, 4096, 4096, 512, 128]
    - [61, 43.34]
  - - [4096, 128, 1, 1024, 4096, 4096, 1024, 128]
    - [60, 65.31]
  - - [4096, 128, 1, 2048, 4096, 4096, 2048, 128]
    - [81, 87.57]
  - - [4096, 128, 1, 4096, 4096, 4096, 4096, 128]
    - [83, 105.43]
  - - [4096, 128, 1, 8192, 4096, 4096, 8192, 128]
    - [82, 117.38]
  - - [4096, 256, 1, 128, 4096, 4096, 128, 256]
    - [24, 25.51]
  - - [4096, 256, 1, 256, 4096, 4096, 256, 256]
    - [31, 44.76]
  - - [4096, 256, 1, 512, 4096, 4096, 512, 256]
    - [32, 72.92]
  - - [4096, 256, 1, 1024, 4096, 4096, 1024, 256]
    - [30, 106.67]
  - - [4096, 256, 1, 2048, 4096, 4096, 2048, 256]
    - [32, 137.32]
  - - [4096, 256, 1, 4096, 4096, 4096, 4096, 256]
    - [79, 152.7]
  - - [4096, 256, 1, 8192, 4096, 4096, 8192, 256]
    - [57, 160.24]
  - - [4096, 512, 1, 128, 4096, 4096, 128, 512]
    - [25, 41.62]
  - - [4096, 512, 1, 256, 4096, 4096, 256, 512]
    - [25, 71.02]
  - - [4096, 512, 1, 512, 4096, 4096, 512, 512]
    - [52, 112.55]
  - - [4096, 512, 1, 1024, 4096, 4096, 1024, 512]
    - [55, 159.7]
  - - [4096, 512, 1, 2048, 4096, 4096, 2048, 512]
    - [53, 199.35]
  - - [4096, 512, 1, 4096, 4096, 4096, 4096, 512]
    - [54, 204.74]
  - - [4096, 512, 1, 8192, 4096, 4096, 8192, 512]
    - [53, 205.01]
  - - [4096, 1024, 1, 128, 4096, 4096, 128, 1024]
    - [17, 58.85]
  - - [4096, 1024, 1, 256, 4096, 4096, 256, 1024]
    - [16, 100.78]
  - - [4096, 1024, 1, 512, 4096, 4096, 512, 1024]
    - [18, 156.89]
  - - [4096, 1024, 1, 1024, 4096, 4096, 1024, 1024]
    - [44, 209.04]
  - - [4096, 1024, 1, 2048, 4096, 4096, 2048, 1024]
    - [41, 248.3]
  - - [4096, 1024, 1, 4096, 4096, 4096, 4096, 1024]
    - [42, 260.1]
  - - [4096, 1024, 1, 8192, 4096, 4096, 8192, 1024]
    - [49, 242.59]
  - - [4096, 2048, 1, 128, 4096, 4096, 128, 2048]
    - [3, 72.35]
  - - [4096, 2048, 1, 256, 4096, 4096, 256, 2048]
    - [0, 121.67]
  - - [4096, 2048, 1, 512, 4096, 4096, 512, 2048]
    - [6, 183.58]
  - - [4096, 2048, 1, 1024, 4096, 4096, 1024, 2048]
    - [10, 241.65]
  - - [4096, 2048, 1, 2048, 4096, 4096, 2048, 2048]
    - [7, 273.02]
  - - [4096, 2048, 1, 4096, 4096, 4096, 4096, 2048]
    - [48, 266.95]
  - - [4096, 2048, 1, 8192, 4096, 4096, 8192, 2048]
    - [49, 287.26]
  - - [4096, 4096, 1, 128, 4096, 4096, 128, 4096]
    - [10, 79.04]
  - - [4096, 4096, 1, 256, 4096, 4096, 256, 4096]
    - [10, 131.86]
  - - [4096, 4096, 1, 512, 4096, 4096, 512, 4096]
    - [10, 197.08]
  - - [4096, 4096, 1, 1024, 4096, 4096, 1024, 4096]
    - [8, 234.11]
  - - [4096, 4096, 1, 2048, 4096, 4096, 2048, 4096]
    - [46, 244.6]
  - - [4096, 4096, 1, 4096, 4096, 4096, 4096, 4096]
    - [46, 289.64]
  - - [4096, 4096, 1, 8192, 4096, 4096, 8192, 4096]
    - [6, 317.64]
  - - [4096, 8192, 1, 128, 4096, 4096, 128, 8192]
    - [9, 84.79]
  - - [4096, 8192, 1, 256, 4096, 4096, 256, 8192]
    - [9, 136.14]
  - - [4096, 8192, 1, 512, 4096, 4096, 512, 8192]
    - [14, 196.4]
  - - [4096, 8192, 1, 1024, 4096, 4096, 1024, 8192]
    - [13, 237.13]
  - - [4096, 8192, 1, 2048, 4096, 4096, 2048, 8192]
    - [42, 282.78]
  - - [4096, 8192, 1, 4096, 4096, 4096, 4096, 8192]
    - [1, 331.82]
  - - [4096, 8192, 1, 8192, 4096, 4096, 8192, 8192]
    - [1, 363.13]
  - - [8192, 128, 1, 128, 8192, 8192, 128, 128]
    - [23, 26.7]
  - - [8192, 128, 1, 256, 8192, 8192, 256, 128]
    - [29, 46.52]
  - - [8192, 128, 1, 512, 8192, 8192, 512, 128]
    - [29, 74.96]
  - - [8192, 128, 1, 1024, 8192, 8192, 1024, 128]
    - [29, 108.56]
  - - [8192, 128, 1, 2048, 8192, 8192, 2048, 128]
    - [30, 135.07]
  - - [8192, 128, 1, 4096, 8192, 8192, 4096, 128]
    - [58, 145.91]
  - - [8192, 128, 1, 8192, 8192, 8192, 8192, 128]
    - [80, 157.47]
  - - [8192, 256, 1, 128, 8192, 8192, 128, 256]
    - [26, 39.9]
  - - [8192, 256, 1, 256, 8192, 8192, 256, 256]
    - [22, 68.91]
  - - [8192, 256, 1, 512, 8192, 8192, 512, 256]
    - [52, 109.65]
  - - [8192, 256, 1, 1024, 8192, 8192, 1024, 256]
    - [52, 158.39]
  - - [8192, 256, 1, 2048, 8192, 8192, 2048, 256]
    - [53, 197.59]
  - - [8192, 256, 1, 4096, 8192, 8192, 4096, 256]
    - [55, 200.74]
  - - [8192, 256, 1, 8192, 8192, 8192, 8192, 256]
    - [55, 199.52]
  - - [8192, 512, 1, 128, 8192, 8192, 128, 512]
    - [17, 58.57]
  - - [8192, 512, 1, 256, 8192, 8192, 256, 512]
    - [16, 99.97]
  - - [8192, 512, 1, 512, 8192, 8192, 512, 512]
    - [20, 154.81]
  - - [8192, 512, 1, 1024, 8192, 8192, 1024, 512]
    - [19, 213.64]
  - - [8192, 512, 1, 2048, 8192, 8192, 2048, 512]
    - [42, 242.81]
  - - [8192, 512, 1, 4096, 8192, 8192, 4096, 512]
    - [40, 264.06]
  - - [8192, 512, 1, 8192, 8192, 8192, 8192, 512]
    - [50, 260.03]
  - - [8192, 1024, 1, 128, 8192, 8192, 128, 1024]
    - [2, 71.03]
  - - [8192, 1024, 1, 256, 8192, 8192, 256, 1024]
    - [1, 120.14]
  - - [8192, 1024, 1, 512, 8192, 8192, 512, 1024]
    - [10, 179.11]
  - - [8192, 1024, 1, 1024, 8192, 8192, 1024, 1024]
    - [7, 239.44]
  - - [8192, 1024, 1, 2048, 8192, 8192, 2048, 1024]
    - [10, 272.66]
  - - [8192, 1024, 1, 4096, 8192, 8192, 4096, 1024]
    - [47, 340.97]
  - - [8192, 1024, 1, 8192, 8192, 8192, 8192, 1024]
    - [48, 365.85]
  - - [8192, 2048, 1, 128, 8192, 8192, 128, 2048]
    - [5, 76.4]
  - - [8192, 2048, 1, 256, 8192, 8192, 256, 2048]
    - [6, 128.02]
  - - [8192, 2048, 1, 512, 8192, 8192, 512, 2048]
    - [11, 189.52]
  - - [8192, 2048, 1, 1024, 8192, 8192, 1024, 2048]
    - [49, 252.41]
  - - [8192, 2048, 1, 2048, 8192, 8192, 2048, 2048]
    - [48, 292.62]
  - - [8192, 2048, 1, 4096, 8192, 8192, 4096, 2048]
    - [48, 340.56]
  - - [8192, 2048, 1, 8192, 8192, 8192, 8192, 2048]
    - [47, 390.16]
  - - [8192, 4096, 1, 128, 8192, 8192, 128, 4096]
    - [10, 82.51]
  - - [8192, 4096, 1, 256, 8192, 8192, 256, 4096]
    - [9, 133.66]
  - - [8192, 4096, 1, 512, 8192, 8192, 512, 4096]
    - [15, 197.76]
  - - [8192, 4096, 1, 1024, 8192, 8192, 1024, 4096]
    - [49, 240.6]
  - - [8192, 4096, 1, 2048, 8192, 8192, 2048, 4096]
    - [48, 309.19]
  - - [8192, 4096, 1, 4096, 8192, 8192, 4096, 4096]
    - [49, 362.58]
  - - [8192, 4096, 1, 8192, 8192, 8192, 8192, 4096]
    - [47, 409.09]
  - - [8192, 8192, 1, 128, 8192, 8192, 128, 8192]
    - [25, 86.38]
  - - [8192, 8192, 1, 256, 8192, 8192, 256, 8192]
    - [21, 145.55]
  - - [8192, 8192, 1, 512, 8192, 8192, 512, 8192]
    - [10, 214.84]
  - - [8192, 8192, 1, 1024, 8192, 8192, 1024, 8192]
    - [6, 275.95]
  - - [8192, 8192, 1, 2048, 8192, 8192, 2048, 8192]
    - [49, 326.88]
  - - [8192, 8192, 1, 4096, 8192, 8192, 4096, 8192]
    - [49, 377.62]
  - - [8192, 8192, 1, 8192, 8192, 8192, 8192, 8192]
    - [47, 409.13]
- null
- null
- ExperimentalStreamK
- GridBased
