projects/hipblaslt/library/src/amd_detail/rocblaslt/src/Tensile/Logic/asm_full/aquavanjaram/gfx942_228cu/StreamK/aquavanjaram942_Cijk_Ailk_Bljk_B8F8NB8NS_BH_Bias_HAS_SAV_UserArgs.yaml
- {MinimumRequiredVersion: 4.33.0}
- aquavanjaram942
- {Architecture: gfx942, CUCount: 228}
- [Device 0049, Device 0050]
    SolutionIndex: 0
    SolutionNameMin: Cijk_Ailk_Bljk_B8F8NB8NS_BH_Bias_HAS_SAV_UserArgs_MT256x256x64_MI16x16x1_SN_LDSB1_CLR1_GRVWA8_GRVWB8_GSU0_GSUC0_GSUWGMRR0_K1_LBSPPA2048_LBSPPB512_LPA0_LPB8_LRVW8_MIWT8_8_PLR1_SU0_SUM0_SUS64_VWA8_VWB8_WGM1_WGMXCC1_WGMXCCGn1
    SolutionIndex: 1
    SolutionNameMin: Cijk_Ailk_Bljk_B8F8NB8NS_BH_Bias_HAS_SAV_UserArgs_MT256x256x64_MI16x16x1_SN_LDSB1_CLR1_GRVWA8_GRVWB16_GSU0_GSUC0_GSUWGMRR0_K1_LBSPPA2048_LBSPPB512_LPA0_LPB16_LRVW8_MIWT8_8_PLR1_SU0_SUM0_SUS64_VWA8_VWB8_WGM1_WGMXCC1_WGMXCCGn1
    SolutionIndex: 2
    SolutionNameMin: Cijk_Ailk_Bljk_B8F8NB8NS_BH_Bias_HAS_SAV_UserArgs_MT256x256x64_MI16x16x1_SN_LDSB1_CLR1_GRVWA16_GRVWB16_GSU0_GSUC0_GSUWGMRR0_K1_LBSPPA2048_LBSPPB512_LPA0_LPB16_LRVW8_MIWT8_8_PLR1_SU0_SUM0_SUS64_VWA8_VWB8_WGM1_WGMXCC1_WGMXCCGn1
    SolutionIndex: 3
    SolutionNameMin: Cijk_Ailk_Bljk_B8F8NB8NS_BH_Bias_HAS_SAV_UserArgs_MT256x256x64_MI16x16x1_SN_LDSB1_CLR1_GRVWA8_GRVWB8_GSU0_GSUC0_GSUWGMRR0_K1_LBSPPA2048_LBSPPB512_LPA0_LPB8_LRVW8_MIWT8_8_PLR1_SU0_SUM0_SUS64_VWA8_VWB8_WGM4_WGMXCC1_WGMXCCGn1
    SolutionIndex: 4
    SolutionNameMin: Cijk_Ailk_Bljk_B8F8NB8NS_BH_Bias_HAS_SAV_UserArgs_MT256x256x64_MI16x16x1_SN_LDSB1_CLR1_GRVWA8_GRVWB16_GSU0_GSUC0_GSUWGMRR0_K1_LBSPPA2048_LBSPPB512_LPA0_LPB16_LRVW8_MIWT8_8_PLR1_SU0_SUM0_SUS64_VWA8_VWB8_WGM4_WGMXCC1_WGMXCCGn1
    SolutionIndex: 5
    SolutionNameMin: Cijk_Ailk_Bljk_B8F8NB8NS_BH_Bias_HAS_SAV_UserArgs_MT256x256x64_MI16x16x1_SN_LDSB1_CLR1_GRVWA16_GRVWB16_GSU0_GSUC0_GSUWGMRR0_K1_LBSPPA2048_LBSPPB512_LPA0_LPB16_LRVW8_MIWT8_8_PLR1_SU0_SUM0_SUS64_VWA8_VWB8_WGM4_WGMXCC1_WGMXCCGn1
    SolutionIndex: 6
    SolutionNameMin: Cijk_Ailk_Bljk_B8F8NB8NS_BH_Bias_HAS_SAV_UserArgs_MT256x256x64_MI16x16x1_SN_LDSB1_CLR1_GRVWA8_GRVWB8_GSU0_GSUC0_GSUWGMRR0_K1_LBSPPA2048_LBSPPB512_LPA0_LPB8_LRVW8_MIWT8_8_PLR1_SU0_SUM0_SUS64_VWA8_VWB8_WGM6_WGMXCC1_WGMXCCGn1
    SolutionIndex: 7
    SolutionNameMin: Cijk_Ailk_Bljk_B8F8NB8NS_BH_Bias_HAS_SAV_UserArgs_MT256x256x64_MI16x16x1_SN_LDSB1_CLR1_GRVWA16_GRVWB8_GSU0_GSUC0_GSUWGMRR0_K1_LBSPPA2048_LBSPPB512_LPA0_LPB8_LRVW8_MIWT8_8_PLR1_SU0_SUM0_SUS64_VWA8_VWB8_WGM6_WGMXCC1_WGMXCCGn1
    SolutionIndex: 8
    SolutionNameMin: Cijk_Ailk_Bljk_B8F8NB8NS_BH_Bias_HAS_SAV_UserArgs_MT256x256x64_MI16x16x1_SN_LDSB1_CLR1_GRVWA8_GRVWB16_GSU0_GSUC0_GSUWGMRR0_K1_LBSPPA2048_LBSPPB512_LPA0_LPB16_LRVW8_MIWT8_8_PLR1_SU0_SUM0_SUS64_VWA8_VWB8_WGM6_WGMXCC1_WGMXCCGn1
    SolutionIndex: 9
    SolutionNameMin: Cijk_Ailk_Bljk_B8F8NB8NS_BH_Bias_HAS_SAV_UserArgs_MT256x256x64_MI16x16x1_SN_LDSB1_CLR1_GRVWA16_GRVWB16_GSU0_GSUC0_GSUWGMRR0_K1_LBSPPA2048_LBSPPB512_LPA0_LPB16_LRVW8_MIWT8_8_PLR1_SU0_SUM0_SUS64_VWA8_VWB8_WGM6_WGMXCC1_WGMXCCGn1
    SolutionIndex: 10
    SolutionNameMin: Cijk_Ailk_Bljk_B8F8NB8NS_BH_Bias_HAS_SAV_UserArgs_MT256x256x64_MI16x16x1_SN_LDSB1_CLR1_GRVWA8_GRVWB8_GSU0_GSUC0_GSUWGMRR0_K1_LBSPPA2048_LBSPPB512_LPA0_LPB8_LRVW8_MIWT8_8_PLR1_SU0_SUM0_SUS64_VWA8_VWB8_WGM8_WGMXCC1_WGMXCCGn1
    SolutionIndex: 11
    SolutionNameMin: Cijk_Ailk_Bljk_B8F8NB8NS_BH_Bias_HAS_SAV_UserArgs_MT256x256x64_MI16x16x1_SN_LDSB1_CLR1_GRVWA16_GRVWB8_GSU0_GSUC0_GSUWGMRR0_K1_LBSPPA2048_LBSPPB512_LPA0_LPB8_LRVW8_MIWT8_8_PLR1_SU0_SUM0_SUS64_VWA8_VWB8_WGM8_WGMXCC1_WGMXCCGn1
    SolutionIndex: 12
    SolutionNameMin: Cijk_Ailk_Bljk_B8F8NB8NS_BH_Bias_HAS_SAV_UserArgs_MT128x256x64_MI16x16x1_SN_LDSB1_CLR1_GRVWA16_GRVWB8_GSU0_GSUC0_GSUWGMRR0_K1_LBSPPA1024_LBSPPB512_LPA64_LPB8_LRVW8_MIWT4_8_PLR1_SU0_SUM0_SUS64_VWA4_VWB8_WGM1_WGMXCC1_WGMXCCGn1
    SolutionIndex: 13
    SolutionNameMin: Cijk_Ailk_Bljk_B8F8NB8NS_BH_Bias_HAS_SAV_UserArgs_MT128x256x64_MI16x16x1_SN_LDSB1_CLR1_GRVWA8_GRVWB16_GSU0_GSUC0_GSUWGMRR0_K1_LBSPPA1024_LBSPPB512_LPA64_LPB16_LRVW8_MIWT4_8_PLR1_SU0_SUM0_SUS64_VWA4_VWB8_WGM1_WGMXCC1_WGMXCCGn1
    SolutionIndex: 14
    SolutionNameMin: Cijk_Ailk_Bljk_B8F8NB8NS_BH_Bias_HAS_SAV_UserArgs_MT128x256x64_MI16x16x1_SN_LDSB1_CLR1_GRVWA16_GRVWB8_GSU0_GSUC0_GSUWGMRR0_K1_LBSPPA1024_LBSPPB512_LPA64_LPB8_LRVW8_MIWT4_8_PLR1_SU0_SUM0_SUS64_VWA4_VWB8_WGM4_WGMXCC1_WGMXCCGn1
    SolutionIndex: 15
    SolutionNameMin: Cijk_Ailk_Bljk_B8F8NB8NS_BH_Bias_HAS_SAV_UserArgs_MT128x256x64_MI16x16x1_SN_LDSB1_CLR1_GRVWA16_GRVWB8_GSU0_GSUC0_GSUWGMRR0_K1_LBSPPA1024_LBSPPB512_LPA64_LPB8_LRVW8_MIWT4_8_PLR1_SU0_SUM0_SUS64_VWA4_VWB8_WGM8_WGMXCC1_WGMXCCGn1
    SolutionIndex: 16
    SolutionNameMin: Cijk_Ailk_Bljk_B8F8NB8NS_BH_Bias_HAS_SAV_UserArgs_MT256x128x64_MI16x16x1_SN_LDSB1_CLR1_GRVWA16_GRVWB16_GSU0_GSUC0_GSUWGMRR0_K1_LBSPPA2048_LBSPPB256_LPA0_LPB16_LRVW8_MIWT8_4_PLR1_SU0_SUM0_SUS64_VWA8_VWB4_WGM1_WGMXCC1_WGMXCCGn1
    SolutionIndex: 17
    SolutionNameMin: Cijk_Ailk_Bljk_B8F8NB8NS_BH_Bias_HAS_SAV_UserArgs_MT256x128x64_MI16x16x1_SN_LDSB1_CLR1_GRVWA16_GRVWB16_GSU0_GSUC0_GSUWGMRR0_K1_LBSPPA2048_LBSPPB256_LPA0_LPB16_LRVW8_MIWT8_4_PLR1_SU0_SUM0_SUS64_VWA8_VWB4_WGM6_WGMXCC1_WGMXCCGn1
    SolutionIndex: 18
    SolutionNameMin: Cijk_Ailk_Bljk_B8F8NB8NS_BH_Bias_HAS_SAV_UserArgs_MT256x128x64_MI16x16x1_SN_LDSB1_CLR1_GRVWA16_GRVWB8_GSU0_GSUC0_GSUWGMRR0_K1_LBSPPA2048_LBSPPB256_LPA0_LPB8_LRVW8_MIWT8_4_PLR1_SU0_SUM0_SUS64_VWA8_VWB4_WGM8_WGMXCC1_WGMXCCGn1
    SolutionIndex: 19
    SolutionNameMin: Cijk_Ailk_Bljk_B8F8NB8NS_BH_Bias_HAS_SAV_UserArgs_MT256x128x64_MI16x16x1_SN_LDSB1_CLR1_GRVWA16_GRVWB16_GSU0_GSUC0_GSUWGMRR0_K1_LBSPPA2048_LBSPPB256_LPA0_LPB16_LRVW8_MIWT8_4_PLR1_SU0_SUM0_SUS64_VWA8_VWB4_WGM8_WGMXCC1_WGMXCCGn1
    SolutionIndex: 20
    SolutionNameMin: Cijk_Ailk_Bljk_B8F8NB8NS_BH_Bias_HAS_SAV_UserArgs_MT128x64x64_MI16x16x1_SN_LDSB0_CLR1_GRVWA8_GRVWB16_GSU0_GSUC0_GSUWGMRR0_K1_LBSPPA1024_LBSPPB128_LPA0_LPB16_LRVW8_MIWT8_1_PLR1_SU0_SUM0_SUS64_VWA8_VWB1_WGM1_WGMXCC1_WGMXCCGn1
    SolutionIndex: 21
    SolutionNameMin: Cijk_Ailk_Bljk_B8F8NB8NS_BH_Bias_HAS_SAV_UserArgs_MT128x128x64_MI16x16x1_SN_LDSB1_CLR1_GRVWA8_GRVWB16_GSU0_GSUC0_GSUWGMRR0_K1_LBSPPA1024_LBSPPB256_LPA64_LPB16_LRVW8_MIWT4_4_PLR1_SU0_SUM0_SUS64_VWA4_VWB4_WGM1_WGMXCC1_WGMXCCGn1
    SolutionIndex: 22
    SolutionNameMin: Cijk_Ailk_Bljk_B8F8NB8NS_BH_Bias_HAS_SAV_UserArgs_MT128x128x64_MI16x16x1_SN_LDSB1_CLR1_GRVWA16_GRVWB16_GSU0_GSUC0_GSUWGMRR0_K1_LBSPPA1024_LBSPPB256_LPA64_LPB16_LRVW8_MIWT4_4_PLR1_SU0_SUM0_SUS64_VWA4_VWB4_WGM1_WGMXCC1_WGMXCCGn1
    SolutionIndex: 23
    SolutionNameMin: Cijk_Ailk_Bljk_B8F8NB8NS_BH_Bias_HAS_SAV_UserArgs_MT64x128x64_MI16x16x1_SN_LDSB0_CLR1_GRVWA16_GRVWB8_GSU0_GSUC0_GSUWGMRR0_K1_LBSPPA512_LBSPPB256_LPA32_LPB8_LRVW8_MIWT2_4_PLR1_SU0_SUM0_SUS64_VWA2_VWB4_WGM1_WGMXCC1_WGMXCCGn1
    SolutionIndex: 24
    SolutionNameMin: Cijk_Ailk_Bljk_B8F8NB8NS_BH_Bias_HAS_SAV_UserArgs_MT64x128x64_MI16x16x1_SN_LDSB0_CLR1_GRVWA8_GRVWB16_GSU0_GSUC0_GSUWGMRR0_K1_LBSPPA512_LBSPPB256_LPA32_LPB16_LRVW8_MIWT2_4_PLR1_SU0_SUM0_SUS64_VWA2_VWB4_WGM1_WGMXCC1_WGMXCCGn1
    SolutionIndex: 25
    SolutionNameMin: Cijk_Ailk_Bljk_B8F8NB8NS_BH_Bias_HAS_SAV_UserArgs_MT128x64x64_MI16x16x1_SN_LDSB0_CLR1_GRVWA8_GRVWB8_GSU0_GSUC0_GSUWGMRR0_K1_LBSPPA1024_LBSPPB128_LPA64_LPB8_LRVW8_MIWT4_2_PLR1_SU0_SUM0_SUS64_VWA4_VWB2_WGM1_WGMXCC1_WGMXCCGn1
    SolutionIndex: 26
    SolutionNameMin: Cijk_Ailk_Bljk_B8F8NB8NS_BH_Bias_HAS_SAV_UserArgs_MT128x64x64_MI16x16x1_SN_LDSB0_CLR1_GRVWA16_GRVWB8_GSU0_GSUC0_GSUWGMRR0_K1_LBSPPA1024_LBSPPB128_LPA64_LPB8_LRVW8_MIWT4_2_PLR1_SU0_SUM0_SUS64_VWA4_VWB2_WGM1_WGMXCC1_WGMXCCGn1
    SolutionIndex: 27
    SolutionNameMin: Cijk_Ailk_Bljk_B8F8NB8NS_BH_Bias_HAS_SAV_UserArgs_MT128x64x64_MI16x16x1_SN_LDSB0_CLR1_GRVWA16_GRVWB16_GSU0_GSUC0_GSUWGMRR0_K1_LBSPPA1024_LBSPPB128_LPA64_LPB16_LRVW8_MIWT4_2_PLR1_SU0_SUM0_SUS64_VWA4_VWB2_WGM1_WGMXCC1_WGMXCCGn1
    SolutionIndex: 28
    SolutionNameMin: Cijk_Ailk_Bljk_B8F8NB8NS_BH_Bias_HAS_SAV_UserArgs_MT128x32x64_MI16x16x1_SN_LDSB0_CLR1_GRVWA8_GRVWB8_GSU0_GSUC0_GSUWGMRR0_K1_LBSPPA1024_LBSPPB128_LPA64_LPB8_LRVW8_MIWT4_1_PLR1_SU0_SUM0_SUS64_VWA4_VWB1_WGM1_WGMXCC1_WGMXCCGn1
    SolutionIndex: 29
    SolutionNameMin: Cijk_Ailk_Bljk_B8F8NB8NS_BH_Bias_HAS_SAV_UserArgs_MT128x32x64_MI16x16x1_SN_LDSB0_CLR1_GRVWA16_GRVWB8_GSU0_GSUC0_GSUWGMRR0_K1_LBSPPA1024_LBSPPB128_LPA64_LPB8_LRVW8_MIWT4_1_PLR1_SU0_SUM0_SUS64_VWA4_VWB1_WGM1_WGMXCC1_WGMXCCGn1
    SolutionIndex: 30
    SolutionNameMin: Cijk_Ailk_Bljk_B8F8NB8NS_BH_Bias_HAS_SAV_UserArgs_MT64x64x64_MI16x16x1_SN_LDSB0_CLR1_GRVWA8_GRVWB8_GSU0_GSUC0_GSUWGMRR0_K1_LBSPPA512_LBSPPB128_LPA32_LPB8_LRVW8_MIWT2_2_PLR1_SU0_SUM0_SUS64_VWA2_VWB2_WGM1_WGMXCC1_WGMXCCGn1
    SolutionIndex: 31
    SolutionNameMin: Cijk_Ailk_Bljk_B8F8NB8NS_BH_Bias_HAS_SAV_UserArgs_MT64x64x64_MI16x16x1_SN_LDSB0_CLR1_GRVWA8_GRVWB16_GSU0_GSUC0_GSUWGMRR0_K1_LBSPPA512_LBSPPB128_LPA32_LPB16_LRVW8_MIWT2_2_PLR1_SU0_SUM0_SUS64_VWA2_VWB2_WGM1_WGMXCC1_WGMXCCGn1
    SolutionIndex: 32
    SolutionNameMin: Cijk_Ailk_Bljk_B8F8NB8NS_BH_Bias_HAS_SAV_UserArgs_MT32x64x64_MI16x16x1_SN_LDSB0_CLR1_GRVWA8_GRVWB8_GSU0_GSUC0_GSUWGMRR0_K1_LBSPPA256_LBSPPB128_LPA16_LPB8_LRVW8_MIWT1_2_PLR1_SU0_SUM0_SUS64_VWA1_VWB2_WGM8_WGMXCC1_WGMXCCGn1
    SolutionIndex: 33
    SolutionNameMin: Cijk_Ailk_Bljk_B8F8NB8NS_BH_Bias_HAS_SAV_UserArgs_MT32x32x64_MI16x16x1_SN_LDSB0_CLR1_GRVWA8_GRVWB8_GSU0_GSUC0_GSUWGMRR0_K1_LBSPPA256_LBSPPB128_LPA16_LPB8_LRVW8_MIWT1_1_PLR1_SU0_SUM0_SUS64_VWA1_VWB1_WGM1_WGMXCC1_WGMXCCGn1
    SolutionIndex: 34
    SolutionNameMin: Cijk_Ailk_Bljk_B8F8NB8NS_BH_Bias_HAS_SAV_UserArgs_MT32x32x64_MI16x16x1_SN_LDSB0_CLR1_GRVWA8_GRVWB8_GSU0_GSUC0_GSUWGMRR0_K1_LBSPPA256_LBSPPB128_LPA16_LPB8_LRVW8_MIWT1_1_PLR1_SU0_SUM0_SUS64_VWA1_VWB1_WGM6_WGMXCC1_WGMXCCGn1
    SolutionIndex: 35
    SolutionNameMin: Cijk_Ailk_Bljk_B8F8NB8NS_BH_Bias_HAS_SAV_UserArgs_MT32x32x64_MI16x16x1_SN_LDSB0_CLR1_GRVWA8_GRVWB8_GSU0_GSUC0_GSUWGMRR0_K1_LBSPPA256_LBSPPB128_LPA16_LPB8_LRVW8_MIWT1_1_PLR1_SU0_SUM0_SUS64_VWA1_VWB1_WGM8_WGMXCC1_WGMXCCGn1
    SolutionIndex: 36
    SolutionNameMin: Cijk_Ailk_Bljk_B8F8NB8NS_BH_Bias_HAS_SAV_UserArgs_MT128x256x128_MI16x16x1_SN_LDSB1_CLR1_GRVWA16_GRVWB16_GSU0_GSUC0_GSUWGMRR0_K1_LBSPPA1024_LBSPPB1024_LPA64_LPB16_LRVW8_MIWT4_8_PLR1_SU0_SUM0_SUS128_VWA4_VWB8_WGM1_WGMXCC1_WGMXCCGn1
    SolutionIndex: 37
    SolutionNameMin: Cijk_Ailk_Bljk_B8F8NB8NS_BH_Bias_HAS_SAV_UserArgs_MT128x256x128_MI16x16x1_SN_LDSB1_CLR1_GRVWA8_GRVWB16_GSU0_GSUC0_GSUWGMRR0_K1_LBSPPA1024_LBSPPB1024_LPA64_LPB16_LRVW8_MIWT4_8_PLR1_SU0_SUM0_SUS128_VWA4_VWB8_WGM4_WGMXCC1_WGMXCCGn1
    SolutionIndex: 38
    SolutionNameMin: Cijk_Ailk_Bljk_B8F8NB8NS_BH_Bias_HAS_SAV_UserArgs_MT128x256x128_MI16x16x1_SN_LDSB1_CLR1_GRVWA16_GRVWB16_GSU0_GSUC0_GSUWGMRR0_K1_LBSPPA1024_LBSPPB1024_LPA64_LPB16_LRVW8_MIWT4_8_PLR1_SU0_SUM0_SUS128_VWA4_VWB8_WGM4_WGMXCC1_WGMXCCGn1
    SolutionIndex: 39
    SolutionNameMin: Cijk_Ailk_Bljk_B8F8NB8NS_BH_Bias_HAS_SAV_UserArgs_MT128x256x128_MI16x16x1_SN_LDSB1_CLR1_GRVWA16_GRVWB16_GSU0_GSUC0_GSUWGMRR0_K1_LBSPPA1024_LBSPPB1024_LPA64_LPB16_LRVW8_MIWT4_8_PLR1_SU0_SUM0_SUS128_VWA4_VWB8_WGM6_WGMXCC1_WGMXCCGn1
    SolutionIndex: 40
    SolutionNameMin: Cijk_Ailk_Bljk_B8F8NB8NS_BH_Bias_HAS_SAV_UserArgs_MT256x144x128_MI16x16x1_SN_LDSB1_CLR1_GRVWA16_GRVWB8_GSU0_GSUC0_GSUWGMRR0_K1_LBSPPA2048_LBSPPB128_LPA64_LPB8_LRVW8_MIWT4_9_PLR1_SU0_SUM0_SUS128_VWA4_VWB1_WGM1_WGMXCC1_WGMXCCGn1
    SolutionIndex: 41
    SolutionNameMin: Cijk_Ailk_Bljk_B8F8NB8NS_BH_Bias_HAS_SAV_UserArgs_MT256x144x128_MI16x16x1_SN_LDSB1_CLR1_GRVWA16_GRVWB8_GSU0_GSUC0_GSUWGMRR0_K1_LBSPPA2048_LBSPPB128_LPA64_LPB8_LRVW8_MIWT4_9_PLR1_SU0_SUM0_SUS128_VWA4_VWB1_WGM4_WGMXCC1_WGMXCCGn1
    SolutionIndex: 42
    SolutionNameMin: Cijk_Ailk_Bljk_B8F8NB8NS_BH_Bias_HAS_SAV_UserArgs_MT256x144x128_MI16x16x1_SN_LDSB1_CLR1_GRVWA16_GRVWB8_GSU0_GSUC0_GSUWGMRR0_K1_LBSPPA2048_LBSPPB128_LPA64_LPB8_LRVW8_MIWT4_9_PLR1_SU0_SUM0_SUS128_VWA4_VWB1_WGM6_WGMXCC1_WGMXCCGn1
    SolutionIndex: 43
    SolutionNameMin: Cijk_Ailk_Bljk_B8F8NB8NS_BH_Bias_HAS_SAV_UserArgs_MT256x144x128_MI16x16x1_SN_LDSB1_CLR1_GRVWA16_GRVWB8_GSU0_GSUC0_GSUWGMRR0_K1_LBSPPA2048_LBSPPB128_LPA64_LPB8_LRVW8_MIWT4_9_PLR1_SU0_SUM0_SUS128_VWA4_VWB1_WGM8_WGMXCC1_WGMXCCGn1
    SolutionIndex: 44
    SolutionNameMin: Cijk_Ailk_Bljk_B8F8NB8NS_BH_Bias_HAS_SAV_UserArgs_MT256x128x128_MI16x16x1_SN_LDSB1_CLR1_GRVWA16_GRVWB8_GSU0_GSUC0_GSUWGMRR0_K1_LBSPPA2048_LBSPPB512_LPA0_LPB8_LRVW8_MIWT8_4_PLR1_SU0_SUM0_SUS128_VWA8_VWB4_WGM1_WGMXCC1_WGMXCCGn1
    SolutionIndex: 45
    SolutionNameMin: Cijk_Ailk_Bljk_B8F8NB8NS_BH_Bias_HAS_SAV_UserArgs_MT256x128x128_MI16x16x1_SN_LDSB1_CLR1_GRVWA8_GRVWB8_GSU0_GSUC0_GSUWGMRR0_K1_LBSPPA2048_LBSPPB512_LPA0_LPB8_LRVW8_MIWT8_4_PLR1_SU0_SUM0_SUS128_VWA8_VWB4_WGM8_WGMXCC1_WGMXCCGn1
    SolutionIndex: 46
    SolutionNameMin: Cijk_Ailk_Bljk_B8F8NB8NS_BH_Bias_HAS_SAV_UserArgs_MT256x128x128_MI16x16x1_SN_LDSB1_CLR1_GRVWA16_GRVWB8_GSU0_GSUC0_GSUWGMRR0_K1_LBSPPA2048_LBSPPB512_LPA0_LPB8_LRVW8_MIWT8_4_PLR1_SU0_SUM0_SUS128_VWA8_VWB4_WGM8_WGMXCC1_WGMXCCGn1
    SolutionIndex: 47
    SolutionNameMin: Cijk_Ailk_Bljk_B8F8NB8NS_BH_Bias_HAS_SAV_UserArgs_MT128x144x128_MI16x16x1_SN_LDSB1_CLR1_GRVWA16_GRVWB8_GSU0_GSUC0_GSUWGMRR0_K1_LBSPPA1024_LBSPPB128_LPA32_LPB8_LRVW8_MIWT2_9_PLR1_SU0_SUM0_SUS128_VWA2_VWB1_WGM1_WGMXCC1_WGMXCCGn1
    SolutionIndex: 48
    SolutionNameMin: Cijk_Ailk_Bljk_B8F8NB8NS_BH_Bias_HAS_SAV_UserArgs_MT128x144x128_MI16x16x1_SN_LDSB1_CLR1_GRVWA16_GRVWB8_GSU0_GSUC0_GSUWGMRR0_K1_LBSPPA1024_LBSPPB128_LPA32_LPB8_LRVW8_MIWT2_9_PLR1_SU0_SUM0_SUS128_VWA2_VWB1_WGM4_WGMXCC1_WGMXCCGn1
    SolutionIndex: 49
    SolutionNameMin: Cijk_Ailk_Bljk_B8F8NB8NS_BH_Bias_HAS_SAV_UserArgs_MT128x128x128_MI16x16x1_SN_LDSB1_CLR1_GRVWA16_GRVWB16_GSU0_GSUC0_GSUWGMRR0_K1_LBSPPA1024_LBSPPB512_LPA64_LPB16_LRVW8_MIWT4_4_PLR1_SU0_SUM0_SUS128_VWA4_VWB4_WGM1_WGMXCC1_WGMXCCGn1
    SolutionIndex: 50
    SolutionNameMin: Cijk_Ailk_Bljk_B8F8NB8NS_BH_Bias_HAS_SAV_UserArgs_MT128x128x128_MI16x16x1_SN_LDSB1_CLR1_GRVWA16_GRVWB16_GSU0_GSUC0_GSUWGMRR0_K1_LBSPPA1024_LBSPPB512_LPA64_LPB16_LRVW8_MIWT4_4_PLR1_SU0_SUM0_SUS128_VWA4_VWB4_WGM4_WGMXCC1_WGMXCCGn1
    SolutionIndex: 51
    SolutionNameMin: Cijk_Ailk_Bljk_B8F8NB8NS_BH_Bias_HAS_SAV_UserArgs_MT128x128x128_MI16x16x1_SN_LDSB1_CLR1_GRVWA16_GRVWB16_GSU0_GSUC0_GSUWGMRR0_K1_LBSPPA1024_LBSPPB512_LPA64_LPB16_LRVW8_MIWT4_4_PLR1_SU0_SUM0_SUS128_VWA4_VWB4_WGM6_WGMXCC1_WGMXCCGn1
    SolutionIndex: 52
    SolutionNameMin: Cijk_Ailk_Bljk_B8F8NB8NS_BH_Bias_HAS_SAV_UserArgs_MT128x128x128_MI16x16x1_SN_LDSB1_CLR1_GRVWA16_GRVWB16_GSU0_GSUC0_GSUWGMRR0_K1_LBSPPA1024_LBSPPB512_LPA64_LPB16_LRVW8_MIWT4_4_PLR1_SU0_SUM0_SUS128_VWA4_VWB4_WGM8_WGMXCC1_WGMXCCGn1
    SolutionIndex: 53
    SolutionNameMin: Cijk_Ailk_Bljk_B8F8NB8NS_BH_Bias_HAS_SAV_UserArgs_MT64x128x128_MI16x16x1_SN_LDSB1_CLR1_GRVWA16_GRVWB16_GSU0_GSUC0_GSUWGMRR0_K1_LBSPPA512_LBSPPB512_LPA32_LPB16_LRVW8_MIWT2_4_PLR1_SU0_SUM0_SUS128_VWA2_VWB4_WGM1_WGMXCC1_WGMXCCGn1
    SolutionIndex: 54
    SolutionNameMin: Cijk_Ailk_Bljk_B8F8NB8NS_BH_Bias_HAS_SAV_UserArgs_MT64x128x128_MI16x16x1_SN_LDSB1_CLR1_GRVWA16_GRVWB16_GSU0_GSUC0_GSUWGMRR0_K1_LBSPPA512_LBSPPB512_LPA32_LPB16_LRVW8_MIWT2_4_PLR1_SU0_SUM0_SUS128_VWA2_VWB4_WGM4_WGMXCC1_WGMXCCGn1
    SolutionIndex: 55
    SolutionNameMin: Cijk_Ailk_Bljk_B8F8NB8NS_BH_Bias_HAS_SAV_UserArgs_MT128x64x128_MI16x16x1_SN_LDSB1_CLR1_GRVWA16_GRVWB16_GSU0_GSUC0_GSUWGMRR0_K1_LBSPPA1024_LBSPPB256_LPA64_LPB16_LRVW8_MIWT4_2_PLR1_SU0_SUM0_SUS128_VWA4_VWB2_WGM1_WGMXCC1_WGMXCCGn1
    SolutionIndex: 56
    SolutionNameMin: Cijk_Ailk_Bljk_B8F8NB8NS_BH_Bias_HAS_SAV_UserArgs_MT128x64x128_MI16x16x1_SN_LDSB1_CLR1_GRVWA16_GRVWB16_GSU0_GSUC0_GSUWGMRR0_K1_LBSPPA1024_LBSPPB256_LPA64_LPB16_LRVW8_MIWT4_2_PLR1_SU0_SUM0_SUS128_VWA4_VWB2_WGM4_WGMXCC1_WGMXCCGn1
    SolutionIndex: 57
    SolutionNameMin: Cijk_Ailk_Bljk_B8F8NB8NS_BH_Bias_HAS_SAV_UserArgs_MT128x64x128_MI16x16x1_SN_LDSB1_CLR1_GRVWA16_GRVWB16_GSU0_GSUC0_GSUWGMRR0_K1_LBSPPA1024_LBSPPB256_LPA64_LPB16_LRVW8_MIWT4_2_PLR1_SU0_SUM0_SUS128_VWA4_VWB2_WGM6_WGMXCC1_WGMXCCGn1
    SolutionIndex: 58
    SolutionNameMin: Cijk_Ailk_Bljk_B8F8NB8NS_BH_Bias_HAS_SAV_UserArgs_MT128x32x128_MI16x16x1_SN_LDSB1_CLR1_GRVWA16_GRVWB8_GSU0_GSUC0_GSUWGMRR0_K1_LBSPPA1024_LBSPPB128_LPA64_LPB8_LRVW8_MIWT4_1_PLR1_SU0_SUM0_SUS128_VWA4_VWB1_WGM1_WGMXCC1_WGMXCCGn1
    SolutionIndex: 59
    SolutionNameMin: Cijk_Ailk_Bljk_B8F8NB8NS_BH_Bias_HAS_SAV_UserArgs_MT64x64x128_MI16x16x1_SN_LDSB1_CLR1_GRVWA16_GRVWB8_GSU0_GSUC0_GSUWGMRR0_K1_LBSPPA512_LBSPPB256_LPA32_LPB8_LRVW8_MIWT2_2_PLR1_SU0_SUM0_SUS128_VWA2_VWB2_WGM1_WGMXCC1_WGMXCCGn1
    SolutionIndex: 60
    SolutionNameMin: Cijk_Ailk_Bljk_B8F8NB8NS_BH_Bias_HAS_SAV_UserArgs_MT64x64x128_MI16x16x1_SN_LDSB1_CLR1_GRVWA8_GRVWB16_GSU0_GSUC0_GSUWGMRR0_K1_LBSPPA512_LBSPPB256_LPA32_LPB16_LRVW8_MIWT2_2_PLR1_SU0_SUM0_SUS128_VWA2_VWB2_WGM1_WGMXCC1_WGMXCCGn1
    SolutionIndex: 61
    SolutionNameMin: Cijk_Ailk_Bljk_B8F8NB8NS_BH_Bias_HAS_SAV_UserArgs_MT64x64x128_MI16x16x1_SN_LDSB1_CLR1_GRVWA16_GRVWB16_GSU0_GSUC0_GSUWGMRR0_K1_LBSPPA512_LBSPPB256_LPA32_LPB16_LRVW8_MIWT2_2_PLR1_SU0_SUM0_SUS128_VWA2_VWB2_WGM1_WGMXCC1_WGMXCCGn1
    SolutionIndex: 62
    SolutionNameMin: Cijk_Ailk_Bljk_B8F8NB8NS_BH_Bias_HAS_SAV_UserArgs_MT64x64x128_MI16x16x1_SN_LDSB1_CLR1_GRVWA16_GRVWB16_GSU0_GSUC0_GSUWGMRR0_K1_LBSPPA512_LBSPPB256_LPA32_LPB16_LRVW8_MIWT2_2_PLR1_SU0_SUM0_SUS128_VWA2_VWB2_WGM4_WGMXCC1_WGMXCCGn1
    SolutionIndex: 63
    SolutionNameMin: Cijk_Ailk_Bljk_B8F8NB8NS_BH_Bias_HAS_SAV_UserArgs_MT64x64x128_MI16x16x1_SN_LDSB1_CLR1_GRVWA16_GRVWB16_GSU0_GSUC0_GSUWGMRR0_K1_LBSPPA512_LBSPPB256_LPA32_LPB16_LRVW8_MIWT2_2_PLR1_SU0_SUM0_SUS128_VWA2_VWB2_WGM6_WGMXCC1_WGMXCCGn1
    SolutionIndex: 64
    SolutionNameMin: Cijk_Ailk_Bljk_B8F8NB8NS_BH_Bias_HAS_SAV_UserArgs_MT64x64x128_MI16x16x1_SN_LDSB1_CLR1_GRVWA16_GRVWB16_GSU0_GSUC0_GSUWGMRR0_K1_LBSPPA512_LBSPPB256_LPA32_LPB16_LRVW8_MIWT2_2_PLR1_SU0_SUM0_SUS128_VWA2_VWB2_WGM8_WGMXCC1_WGMXCCGn1
    SolutionIndex: 65
    SolutionNameMin: Cijk_Ailk_Bljk_B8F8NB8NS_BH_Bias_HAS_SAV_UserArgs_MT32x64x128_MI16x16x1_SN_LDSB0_CLR1_GRVWA8_GRVWB16_GSU0_GSUC0_GSUWGMRR0_K1_LBSPPA256_LBSPPB256_LPA16_LPB16_LRVW8_MIWT1_2_PLR1_SU0_SUM0_SUS128_VWA1_VWB2_WGM1_WGMXCC1_WGMXCCGn1
    SolutionIndex: 66
    SolutionNameMin: Cijk_Ailk_Bljk_B8F8NB8NS_BH_Bias_HAS_SAV_UserArgs_MT32x64x128_MI16x16x1_SN_LDSB0_CLR1_GRVWA16_GRVWB16_GSU0_GSUC0_GSUWGMRR0_K1_LBSPPA256_LBSPPB256_LPA16_LPB16_LRVW8_MIWT1_2_PLR1_SU0_SUM0_SUS128_VWA1_VWB2_WGM1_WGMXCC1_WGMXCCGn1
    SolutionIndex: 67
    SolutionNameMin: Cijk_Ailk_Bljk_B8F8NB8NS_BH_Bias_HAS_SAV_UserArgs_MT32x64x128_MI16x16x1_SN_LDSB0_CLR1_GRVWA8_GRVWB16_GSU0_GSUC0_GSUWGMRR0_K1_LBSPPA256_LBSPPB256_LPA16_LPB16_LRVW8_MIWT1_2_PLR1_SU0_SUM0_SUS128_VWA1_VWB2_WGM6_WGMXCC1_WGMXCCGn1
    SolutionIndex: 68
    SolutionNameMin: Cijk_Ailk_Bljk_B8F8NB8NS_BH_Bias_HAS_SAV_UserArgs_MT64x32x128_MI16x16x1_SN_LDSB0_CLR1_GRVWA8_GRVWB8_GSU0_GSUC0_GSUWGMRR0_K1_LBSPPA512_LBSPPB128_LPA32_LPB8_LRVW8_MIWT2_1_PLR1_SU0_SUM0_SUS128_VWA2_VWB1_WGM1_WGMXCC1_WGMXCCGn1
    SolutionIndex: 69
    SolutionNameMin: Cijk_Ailk_Bljk_B8F8NB8NS_BH_Bias_HAS_SAV_UserArgs_MT64x32x128_MI16x16x1_SN_LDSB0_CLR1_GRVWA16_GRVWB8_GSU0_GSUC0_GSUWGMRR0_K1_LBSPPA512_LBSPPB128_LPA32_LPB8_LRVW8_MIWT2_1_PLR1_SU0_SUM0_SUS128_VWA2_VWB1_WGM1_WGMXCC1_WGMXCCGn1
    SolutionIndex: 70
    SolutionNameMin: Cijk_Ailk_Bljk_B8F8NB8NS_BH_Bias_HAS_SAV_UserArgs_MT64x32x128_MI16x16x1_SN_LDSB0_CLR1_GRVWA8_GRVWB16_GSU0_GSUC0_GSUWGMRR0_K1_LBSPPA512_LBSPPB128_LPA32_LPB16_LRVW8_MIWT2_1_PLR1_SU0_SUM0_SUS128_VWA2_VWB1_WGM1_WGMXCC1_WGMXCCGn1
    SolutionIndex: 71
    SolutionNameMin: Cijk_Ailk_Bljk_B8F8NB8NS_BH_Bias_HAS_SAV_UserArgs_MT64x32x128_MI16x16x1_SN_LDSB0_CLR1_GRVWA16_GRVWB16_GSU0_GSUC0_GSUWGMRR0_K1_LBSPPA512_LBSPPB128_LPA32_LPB16_LRVW8_MIWT2_1_PLR1_SU0_SUM0_SUS128_VWA2_VWB1_WGM1_WGMXCC1_WGMXCCGn1
    SolutionIndex: 72
    SolutionNameMin: Cijk_Ailk_Bljk_B8F8NB8NS_BH_Bias_HAS_SAV_UserArgs_MT64x32x128_MI16x16x1_SN_LDSB0_CLR1_GRVWA8_GRVWB16_GSU0_GSUC0_GSUWGMRR0_K1_LBSPPA512_LBSPPB128_LPA32_LPB16_LRVW8_MIWT2_1_PLR1_SU0_SUM0_SUS128_VWA2_VWB1_WGM4_WGMXCC1_WGMXCCGn1
    SolutionIndex: 73
    SolutionNameMin: Cijk_Ailk_Bljk_B8F8NB8NS_BH_Bias_HAS_SAV_UserArgs_MT32x32x128_MI16x16x1_SN_LDSB0_CLR1_GRVWA8_GRVWB8_GSU0_GSUC0_GSUWGMRR0_K1_LBSPPA256_LBSPPB128_LPA16_LPB8_LRVW8_MIWT1_1_PLR1_SU0_SUM0_SUS128_VWA1_VWB1_WGM1_WGMXCC1_WGMXCCGn1
    SolutionIndex: 74
    SolutionNameMin: Cijk_Ailk_Bljk_B8F8NB8NS_BH_Bias_HAS_SAV_UserArgs_MT32x32x128_MI16x16x1_SN_LDSB0_CLR1_GRVWA8_GRVWB16_GSU0_GSUC0_GSUWGMRR0_K1_LBSPPA256_LBSPPB128_LPA16_LPB16_LRVW8_MIWT1_1_PLR1_SU0_SUM0_SUS128_VWA1_VWB1_WGM1_WGMXCC1_WGMXCCGn1
    SolutionIndex: 75
    SolutionNameMin: Cijk_Ailk_Bljk_B8F8NB8NS_BH_Bias_HAS_SAV_UserArgs_MT32x32x128_MI16x16x1_SN_LDSB0_CLR1_GRVWA16_GRVWB16_GSU0_GSUC0_GSUWGMRR0_K1_LBSPPA256_LBSPPB128_LPA16_LPB16_LRVW8_MIWT1_1_PLR1_SU0_SUM0_SUS128_VWA1_VWB1_WGM1_WGMXCC1_WGMXCCGn1
    SolutionIndex: 76
    SolutionNameMin: Cijk_Ailk_Bljk_B8F8NB8NS_BH_Bias_HAS_SAV_UserArgs_MT128x64x256_MI16x16x1_SN_LDSB1_CLR1_GRVWA16_GRVWB16_GSU0_GSUC0_GSUWGMRR0_K1_LBSPPA1024_LBSPPB512_LPA64_LPB16_LRVW8_MIWT4_2_PLR1_SU0_SUM0_SUS256_VWA4_VWB2_WGM1_WGMXCC1_WGMXCCGn1
    SolutionIndex: 77
    SolutionNameMin: Cijk_Ailk_Bljk_B8F8NB8NS_BH_Bias_HAS_SAV_UserArgs_MT64x64x256_MI16x16x1_SN_LDSB1_CLR1_GRVWA16_GRVWB16_GSU0_GSUC0_GSUWGMRR0_K1_LBSPPA512_LBSPPB512_LPA32_LPB16_LRVW8_MIWT2_2_PLR1_SU0_SUM0_SUS256_VWA2_VWB2_WGM1_WGMXCC1_WGMXCCGn1
    SolutionIndex: 78
    SolutionNameMin: Cijk_Ailk_Bljk_B8F8NB8NS_BH_Bias_HAS_SAV_UserArgs_MT64x64x256_MI16x16x1_SN_LDSB1_CLR1_GRVWA16_GRVWB16_GSU0_GSUC0_GSUWGMRR0_K1_LBSPPA512_LBSPPB512_LPA32_LPB16_LRVW8_MIWT2_2_PLR1_SU0_SUM0_SUS256_VWA2_VWB2_WGM6_WGMXCC1_WGMXCCGn1
    SolutionIndex: 79
    SolutionNameMin: Cijk_Ailk_Bljk_B8F8NB8NS_BH_Bias_HAS_SAV_UserArgs_MT64x32x256_MI16x16x1_SN_LDSB1_CLR1_GRVWA8_GRVWB8_GSU0_GSUC0_GSUWGMRR0_K1_LBSPPA512_LBSPPB256_LPA32_LPB8_LRVW8_MIWT2_1_PLR1_SU0_SUM0_SUS256_VWA2_VWB1_WGM1_WGMXCC1_WGMXCCGn1
    SolutionIndex: 80
    SolutionNameMin: Cijk_Ailk_Bljk_B8F8NB8NS_BH_Bias_HAS_SAV_UserArgs_MT64x32x256_MI16x16x1_SN_LDSB1_CLR1_GRVWA16_GRVWB16_GSU0_GSUC0_GSUWGMRR0_K1_LBSPPA512_LBSPPB256_LPA32_LPB16_LRVW8_MIWT2_1_PLR1_SU0_SUM0_SUS256_VWA2_VWB1_WGM1_WGMXCC1_WGMXCCGn1
    SolutionIndex: 81
    SolutionNameMin: Cijk_Ailk_Bljk_B8F8NB8NS_BH_Bias_HAS_SAV_UserArgs_MT64x32x256_MI16x16x1_SN_LDSB1_CLR1_GRVWA16_GRVWB16_GSU0_GSUC0_GSUWGMRR0_K1_LBSPPA512_LBSPPB256_LPA32_LPB16_LRVW8_MIWT2_1_PLR1_SU0_SUM0_SUS256_VWA2_VWB1_WGM4_WGMXCC1_WGMXCCGn1
    SolutionIndex: 82
    SolutionNameMin: Cijk_Ailk_Bljk_B8F8NB8NS_BH_Bias_HAS_SAV_UserArgs_MT64x32x256_MI16x16x1_SN_LDSB1_CLR1_GRVWA16_GRVWB16_GSU0_GSUC0_GSUWGMRR0_K1_LBSPPA512_LBSPPB256_LPA32_LPB16_LRVW8_MIWT2_1_PLR1_SU0_SUM0_SUS256_VWA2_VWB1_WGM6_WGMXCC1_WGMXCCGn1
    SolutionIndex: 83
    SolutionNameMin: Cijk_Ailk_Bljk_B8F8NB8NS_BH_Bias_HAS_SAV_UserArgs_MT32x32x256_MI16x16x1_SN_LDSB1_CLR1_GRVWA16_GRVWB8_GSU0_GSUC0_GSUWGMRR0_K1_LBSPPA256_LBSPPB256_LPA16_LPB8_LRVW8_MIWT1_1_PLR1_SU0_SUM0_SUS256_VWA1_VWB1_WGM1_WGMXCC1_WGMXCCGn1
    SolutionIndex: 84
    SolutionNameMin: Cijk_Ailk_Bljk_B8F8NB8NS_BH_Bias_HAS_SAV_UserArgs_MT32x32x256_MI16x16x1_SN_LDSB1_CLR1_GRVWA16_GRVWB16_GSU0_GSUC0_GSUWGMRR0_K1_LBSPPA256_LBSPPB256_LPA16_LPB16_LRVW8_MIWT1_1_PLR1_SU0_SUM0_SUS256_VWA1_VWB1_WGM4_WGMXCC1_WGMXCCGn1
    SolutionIndex: 85
    SolutionNameMin: Cijk_Ailk_Bljk_B8F8NB8NS_BH_Bias_HAS_SAV_UserArgs_MT32x32x256_MI16x16x1_SN_LDSB1_CLR1_GRVWA8_GRVWB16_GSU0_GSUC0_GSUWGMRR0_K1_LBSPPA256_LBSPPB256_LPA16_LPB16_LRVW8_MIWT1_1_PLR1_SU0_SUM0_SUS256_VWA1_VWB1_WGM6_WGMXCC1_WGMXCCGn1
    SolutionIndex: 86
    SolutionNameMin: Cijk_Ailk_Bljk_B8F8NB8NS_BH_Bias_HAS_SAV_UserArgs_MT32x32x256_MI16x16x1_SN_LDSB1_CLR1_GRVWA16_GRVWB16_GSU0_GSUC0_GSUWGMRR0_K1_LBSPPA256_LBSPPB256_LPA16_LPB16_LRVW8_MIWT1_1_PLR1_SU0_SUM0_SUS256_VWA1_VWB1_WGM6_WGMXCC1_WGMXCCGn1
    SolutionIndex: 87
    SolutionNameMin: Cijk_Ailk_Bljk_B8F8NB8NS_BH_Bias_HAS_SAV_UserArgs_MT32x32x256_MI16x16x1_SN_LDSB1_CLR1_GRVWA16_GRVWB16_GSU0_GSUC0_GSUWGMRR0_K1_LBSPPA256_LBSPPB256_LPA16_LPB16_LRVW8_MIWT1_1_PLR1_SU0_SUM0_SUS256_VWA1_VWB1_WGM8_WGMXCC1_WGMXCCGn1
- - - [128, 128, 1, 128, 128, 128, 128, 128]
    - [33, 0.55]
  - - [128, 128, 1, 256, 128, 128, 128, 256]
    - [33, 1.01]
  - - [128, 128, 1, 512, 128, 128, 128, 512]
    - [74, 1.72]
  - - [128, 128, 1, 1024, 128, 128, 128, 1024]
    - [74, 2.75]
  - - [128, 128, 1, 2048, 128, 128, 128, 2048]
    - [73, 3.85]
  - - [128, 128, 1, 4096, 128, 128, 128, 4096]
    - [75, 4.8]
  - - [128, 128, 1, 8192, 128, 128, 128, 8192]
    - [73, 5.47]
  - - [128, 256, 1, 128, 128, 128, 128, 128]
    - [33, 1.1]
  - - [128, 256, 1, 256, 128, 128, 128, 256]
    - [33, 2.01]
  - - [128, 256, 1, 512, 128, 128, 128, 512]
    - [74, 3.47]
  - - [128, 256, 1, 1024, 128, 128, 128, 1024]
    - [74, 5.46]
  - - [128, 256, 1, 2048, 128, 128, 128, 2048]
    - [74, 7.68]
  - - [128, 256, 1, 4096, 128, 128, 128, 4096]
    - [75, 9.56]
  - - [128, 256, 1, 8192, 128, 128, 128, 8192]
    - [73, 10.93]
  - - [128, 512, 1, 128, 128, 128, 128, 128]
    - [73, 2.19]
  - - [128, 512, 1, 256, 128, 128, 128, 256]
    - [73, 3.99]
  - - [128, 512, 1, 512, 128, 128, 128, 512]
    - [74, 6.9]
  - - [128, 512, 1, 1024, 128, 128, 128, 1024]
    - [74, 10.94]
  - - [128, 512, 1, 2048, 128, 128, 128, 2048]
    - [73, 15.26]
  - - [128, 512, 1, 4096, 128, 128, 128, 4096]
    - [73, 18.99]
  - - [128, 512, 1, 8192, 128, 128, 128, 8192]
    - [83, 21.78]
  - - [128, 1024, 1, 128, 128, 128, 128, 128]
    - [74, 4.41]
  - - [128, 1024, 1, 256, 128, 128, 128, 256]
    - [74, 7.92]
  - - [128, 1024, 1, 512, 128, 128, 128, 512]
    - [73, 13.6]
  - - [128, 1024, 1, 1024, 128, 128, 128, 1024]
    - [74, 21.48]
  - - [128, 1024, 1, 2048, 128, 128, 128, 2048]
    - [73, 29.98]
  - - [128, 1024, 1, 4096, 128, 128, 128, 4096]
    - [73, 37.51]
  - - [128, 1024, 1, 8192, 128, 128, 128, 8192]
    - [73, 42.77]
  - - [128, 2048, 1, 128, 128, 128, 128, 128]
    - [70, 8.18]
  - - [128, 2048, 1, 256, 128, 128, 128, 256]
    - [65, 14.56]
  - - [128, 2048, 1, 512, 128, 128, 128, 512]
    - [69, 24.51]
  - - [128, 2048, 1, 1024, 128, 128, 128, 1024]
    - [66, 37.34]
  - - [128, 2048, 1, 2048, 128, 128, 128, 2048]
    - [80, 51.31]
  - - [128, 2048, 1, 4096, 128, 128, 128, 4096]
    - [80, 64.05]
  - - [128, 2048, 1, 8192, 128, 128, 128, 8192]
    - [80, 72.23]
  - - [128, 4096, 1, 128, 128, 128, 128, 128]
    - [28, 14.96]
  - - [128, 4096, 1, 256, 128, 128, 128, 256]
    - [30, 26.31]
  - - [128, 4096, 1, 512, 128, 128, 128, 512]
    - [59, 42.89]
  - - [128, 4096, 1, 1024, 128, 128, 128, 1024]
    - [59, 63.84]
  - - [128, 4096, 1, 2048, 128, 128, 128, 2048]
    - [77, 84.91]
  - - [128, 4096, 1, 4096, 128, 128, 128, 4096]
    - [77, 102.73]
  - - [128, 4096, 1, 8192, 128, 128, 128, 8192]
    - [78, 111.91]
  - - [128, 8192, 1, 128, 128, 128, 128, 128]
    - [25, 26.18]
  - - [128, 8192, 1, 256, 128, 128, 128, 256]
    - [26, 45.09]
  - - [128, 8192, 1, 512, 128, 128, 128, 512]
    - [24, 71.71]
  - - [128, 8192, 1, 1024, 128, 128, 128, 1024]
    - [23, 103.84]
  - - [128, 8192, 1, 2048, 128, 128, 128, 2048]
    - [23, 133.13]
  - - [128, 8192, 1, 4096, 128, 128, 128, 4096]
    - [53, 144.22]
  - - [128, 8192, 1, 8192, 128, 128, 128, 8192]
    - [53, 155.06]
  - - [256, 128, 1, 128, 256, 256, 256, 128]
    - [33, 1.08]
  - - [256, 128, 1, 256, 256, 256, 256, 256]
    - [33, 1.99]
  - - [256, 128, 1, 512, 256, 256, 256, 512]
    - [74, 3.53]
  - - [256, 128, 1, 1024, 256, 256, 256, 1024]
    - [74, 5.45]
  - - [256, 128, 1, 2048, 256, 256, 256, 2048]
    - [73, 7.65]
  - - [256, 128, 1, 4096, 256, 256, 256, 4096]
    - [73, 9.57]
  - - [256, 128, 1, 8192, 256, 256, 256, 8192]
    - [73, 10.94]
  - - [256, 256, 1, 128, 256, 256, 256, 128]
    - [34, 2.09]
  - - [256, 256, 1, 256, 256, 256, 256, 256]
    - [33, 3.99]
  - - [256, 256, 1, 512, 256, 256, 256, 512]
    - [73, 6.86]
  - - [256, 256, 1, 1024, 256, 256, 256, 1024]
    - [74, 10.96]
  - - [256, 256, 1, 2048, 256, 256, 256, 2048]
    - [74, 15.11]
  - - [256, 256, 1, 4096, 256, 256, 256, 4096]
    - [73, 19.02]
  - - [256, 256, 1, 8192, 256, 256, 256, 8192]
    - [73, 21.81]
  - - [256, 512, 1, 128, 256, 256, 256, 128]
    - [33, 4.27]
  - - [256, 512, 1, 256, 256, 256, 256, 256]
    - [74, 7.75]
  - - [256, 512, 1, 512, 256, 256, 256, 512]
    - [74, 13.48]
  - - [256, 512, 1, 1024, 256, 256, 256, 1024]
    - [74, 21.33]
  - - [256, 512, 1, 2048, 256, 256, 256, 2048]
    - [73, 30.34]
  - - [256, 512, 1, 4096, 256, 256, 256, 4096]
    - [73, 37.73]
  - - [256, 512, 1, 8192, 256, 256, 256, 8192]
    - [73, 42.94]
  - - [256, 1024, 1, 128, 256, 256, 256, 128]
    - [68, 8.23]
  - - [256, 1024, 1, 256, 256, 256, 256, 256]
    - [71, 14.85]
  - - [256, 1024, 1, 512, 256, 256, 256, 512]
    - [70, 25.07]
  - - [256, 1024, 1, 1024, 256, 256, 256, 1024]
    - [80, 38.0]
  - - [256, 1024, 1, 2048, 256, 256, 256, 2048]
    - [80, 51.85]
  - - [256, 1024, 1, 4096, 256, 256, 256, 4096]
    - [80, 63.89]
  - - [256, 1024, 1, 8192, 256, 256, 256, 8192]
    - [80, 72.12]
  - - [256, 2048, 1, 128, 256, 256, 256, 128]
    - [28, 14.79]
  - - [256, 2048, 1, 256, 256, 256, 256, 256]
    - [31, 25.96]
  - - [256, 2048, 1, 512, 256, 256, 256, 512]
    - [60, 42.36]
  - - [256, 2048, 1, 1024, 256, 256, 256, 1024]
    - [59, 63.25]
  - - [256, 2048, 1, 2048, 256, 256, 256, 2048]
    - [77, 84.46]
  - - [256, 2048, 1, 4096, 256, 256, 256, 4096]
    - [77, 102.26]
  - - [256, 2048, 1, 8192, 256, 256, 256, 8192]
    - [80, 110.55]
  - - [256, 4096, 1, 128, 256, 256, 256, 128]
    - [25, 26.13]
  - - [256, 4096, 1, 256, 256, 256, 256, 256]
    - [27, 45.35]
  - - [256, 4096, 1, 512, 256, 256, 256, 512]
    - [24, 72.48]
  - - [256, 4096, 1, 1024, 256, 256, 256, 1024]
    - [23, 104.05]
  - - [256, 4096, 1, 2048, 256, 256, 256, 2048]
    - [23, 133.43]
  - - [256, 4096, 1, 4096, 256, 256, 256, 4096]
    - [53, 146.3]
  - - [256, 4096, 1, 8192, 256, 256, 256, 8192]
    - [54, 156.07]
  - - [256, 8192, 1, 128, 256, 256, 256, 128]
    - [22, 40.67]
  - - [256, 8192, 1, 256, 256, 256, 256, 256]
    - [21, 70.04]
  - - [256, 8192, 1, 512, 256, 256, 256, 512]
    - [49, 112.18]
  - - [256, 8192, 1, 1024, 256, 256, 256, 1024]
    - [49, 158.76]
  - - [256, 8192, 1, 2048, 256, 256, 256, 2048]
    - [49, 201.76]
  - - [256, 8192, 1, 4096, 256, 256, 256, 4096]
    - [49, 224.18]
  - - [256, 8192, 1, 8192, 256, 256, 256, 8192]
    - [52, 218.22]
  - - [512, 128, 1, 128, 512, 512, 512, 128]
    - [34, 2.07]
  - - [512, 128, 1, 256, 512, 512, 512, 256]
    - [74, 4.1]
  - - [512, 128, 1, 512, 512, 512, 512, 512]
    - [74, 7.09]
  - - [512, 128, 1, 1024, 512, 512, 512, 1024]
    - [73, 11.01]
  - - [512, 128, 1, 2048, 512, 512, 512, 2048]
    - [73, 15.22]
  - - [512, 128, 1, 4096, 512, 512, 512, 4096]
    - [73, 18.95]
  - - [512, 128, 1, 8192, 512, 512, 512, 8192]
    - [86, 17.25]
  - - [512, 256, 1, 128, 512, 512, 512, 128]
    - [35, 4.06]
  - - [512, 256, 1, 256, 512, 512, 512, 256]
    - [33, 7.82]
  - - [512, 256, 1, 512, 512, 512, 512, 512]
    - [73, 13.35]
  - - [512, 256, 1, 1024, 512, 512, 512, 1024]
    - [73, 21.15]
  - - [512, 256, 1, 2048, 512, 512, 512, 2048]
    - [74, 29.86]
  - - [512, 256, 1, 4096, 512, 512, 512, 4096]
    - [73, 37.46]
  - - [512, 256, 1, 8192, 512, 512, 512, 8192]
    - [87, 37.07]
  - - [512, 512, 1, 128, 512, 512, 512, 128]
    - [32, 7.5]
  - - [512, 512, 1, 256, 512, 512, 512, 256]
    - [68, 14.34]
  - - [512, 512, 1, 512, 512, 512, 512, 512]
    - [70, 24.53]
  - - [512, 512, 1, 1024, 512, 512, 512, 1024]
    - [70, 37.36]
  - - [512, 512, 1, 2048, 512, 512, 512, 2048]
    - [80, 51.38]
  - - [512, 512, 1, 4096, 512, 512, 512, 4096]
    - [80, 63.43]
  - - [512, 512, 1, 8192, 512, 512, 512, 8192]
    - [71, 61.99]
  - - [512, 1024, 1, 128, 512, 512, 512, 128]
    - [58, 14.58]
  - - [512, 1024, 1, 256, 512, 512, 512, 256]
    - [28, 25.94]
  - - [512, 1024, 1, 512, 512, 512, 512, 512]
    - [59, 42.13]
  - - [512, 1024, 1, 1024, 512, 512, 512, 1024]
    - [59, 62.79]
  - - [512, 1024, 1, 2048, 512, 512, 512, 2048]
    - [59, 83.43]
  - - [512, 1024, 1, 4096, 512, 512, 512, 4096]
    - [59, 99.86]
  - - [512, 1024, 1, 8192, 512, 512, 512, 8192]
    - [61, 104.43]
  - - [512, 2048, 1, 128, 512, 512, 512, 128]
    - [27, 25.77]
  - - [512, 2048, 1, 256, 512, 512, 512, 256]
    - [24, 44.88]
  - - [512, 2048, 1, 512, 512, 512, 512, 512]
    - [24, 71.7]
  - - [512, 2048, 1, 1024, 512, 512, 512, 1024]
    - [23, 102.53]
  - - [512, 2048, 1, 2048, 512, 512, 512, 2048]
    - [23, 133.64]
  - - [512, 2048, 1, 4096, 512, 512, 512, 4096]
    - [76, 145.42]
  - - [512, 2048, 1, 8192, 512, 512, 512, 8192]
    - [55, 146.93]
  - - [512, 4096, 1, 128, 512, 512, 512, 128]
    - [22, 40.99]
  - - [512, 4096, 1, 256, 512, 512, 512, 256]
    - [22, 70.92]
  - - [512, 4096, 1, 512, 512, 512, 512, 512]
    - [49, 113.03]
  - - [512, 4096, 1, 1024, 512, 512, 512, 1024]
    - [49, 159.11]
  - - [512, 4096, 1, 2048, 512, 512, 512, 2048]
    - [49, 203.19]
  - - [512, 4096, 1, 4096, 512, 512, 512, 4096]
    - [49, 211.22]
  - - [512, 4096, 1, 8192, 512, 512, 512, 8192]
    - [49, 203.65]
  - - [512, 8192, 1, 128, 512, 512, 512, 128]
    - [47, 62.29]
  - - [512, 8192, 1, 256, 512, 512, 512, 256]
    - [47, 107.22]
  - - [512, 8192, 1, 512, 512, 512, 512, 512]
    - [47, 174.36]
  - - [512, 8192, 1, 1024, 512, 512, 512, 1024]
    - [47, 241.0]
  - - [512, 8192, 1, 2048, 512, 512, 512, 2048]
    - [47, 253.31]
  - - [512, 8192, 1, 4096, 512, 512, 512, 4096]
    - [40, 269.13]
  - - [512, 8192, 1, 8192, 512, 512, 512, 8192]
    - [48, 249.97]
  - - [1024, 128, 1, 128, 1024, 1024, 1024, 128]
    - [74, 4.37]
  - - [1024, 128, 1, 256, 1024, 1024, 1024, 256]
    - [74, 7.9]
  - - [1024, 128, 1, 512, 1024, 1024, 1024, 512]
    - [74, 13.61]
  - - [1024, 128, 1, 1024, 1024, 1024, 1024, 1024]
    - [74, 20.91]
  - - [1024, 128, 1, 2048, 1024, 1024, 1024, 2048]
    - [73, 29.6]
  - - [1024, 128, 1, 4096, 1024, 1024, 1024, 4096]
    - [84, 30.75]
  - - [1024, 128, 1, 8192, 1024, 1024, 1024, 8192]
    - [85, 30.2]
  - - [1024, 256, 1, 128, 1024, 1024, 1024, 128]
    - [68, 7.86]
  - - [1024, 256, 1, 256, 1024, 1024, 1024, 256]
    - [79, 14.24]
  - - [1024, 256, 1, 512, 1024, 1024, 1024, 512]
    - [70, 24.17]
  - - [1024, 256, 1, 1024, 1024, 1024, 1024, 1024]
    - [70, 37.1]
  - - [1024, 256, 1, 2048, 1024, 1024, 1024, 2048]
    - [80, 51.41]
  - - [1024, 256, 1, 4096, 1024, 1024, 1024, 4096]
    - [67, 54.79]
  - - [1024, 256, 1, 8192, 1024, 1024, 1024, 8192]
    - [82, 58.71]
  - - [1024, 512, 1, 128, 1024, 1024, 1024, 128]
    - [60, 14.58]
  - - [1024, 512, 1, 256, 1024, 1024, 1024, 256]
    - [30, 25.95]
  - - [1024, 512, 1, 512, 1024, 1024, 1024, 512]
    - [60, 42.11]
  - - [1024, 512, 1, 1024, 1024, 1024, 1024, 1024]
    - [59, 62.6]
  - - [1024, 512, 1, 2048, 1024, 1024, 1024, 2048]
    - [59, 83.23]
  - - [1024, 512, 1, 4096, 1024, 1024, 1024, 4096]
    - [62, 94.48]
  - - [1024, 512, 1, 8192, 1024, 1024, 1024, 8192]
    - [64, 102.52]
  - - [1024, 1024, 1, 128, 1024, 1024, 1024, 128]
    - [20, 25.87]
  - - [1024, 1024, 1, 256, 1024, 1024, 1024, 256]
    - [24, 44.67]
  - - [1024, 1024, 1, 512, 1024, 1024, 1024, 512]
    - [24, 71.94]
  - - [1024, 1024, 1, 1024, 1024, 1024, 1024, 1024]
    - [23, 103.7]
  - - [1024, 1024, 1, 2048, 1024, 1024, 1024, 2048]
    - [23, 134.19]
  - - [1024, 1024, 1, 4096, 1024, 1024, 1024, 4096]
    - [55, 140.52]
  - - [1024, 1024, 1, 8192, 1024, 1024, 1024, 8192]
    - [57, 148.8]
  - - [1024, 2048, 1, 128, 1024, 1024, 1024, 128]
    - [22, 41.64]
  - - [1024, 2048, 1, 256, 1024, 1024, 1024, 256]
    - [22, 71.75]
  - - [1024, 2048, 1, 512, 1024, 1024, 1024, 512]
    - [49, 113.89]
  - - [1024, 2048, 1, 1024, 1024, 1024, 1024, 1024]
    - [49, 160.86]
  - - [1024, 2048, 1, 2048, 1024, 1024, 1024, 2048]
    - [49, 203.94]
  - - [1024, 2048, 1, 4096, 1024, 1024, 1024, 4096]
    - [51, 207.48]
  - - [1024, 2048, 1, 8192, 1024, 1024, 1024, 8192]
    - [52, 199.95]
  - - [1024, 4096, 1, 128, 1024, 1024, 1024, 128]
    - [16, 58.57]
  - - [1024, 4096, 1, 256, 1024, 1024, 1024, 256]
    - [16, 99.13]
  - - [1024, 4096, 1, 512, 1024, 1024, 1024, 512]
    - [36, 152.58]
  - - [1024, 4096, 1, 1024, 1024, 1024, 1024, 1024]
    - [12, 214.87]
  - - [1024, 4096, 1, 2048, 1024, 1024, 1024, 2048]
    - [44, 252.8]
  - - [1024, 4096, 1, 4096, 1024, 1024, 1024, 4096]
    - [40, 267.35]
  - - [1024, 4096, 1, 8192, 1024, 1024, 1024, 8192]
    - [40, 245.89]
  - - [1024, 8192, 1, 128, 1024, 1024, 1024, 128]
    - [40, 89.3]
  - - [1024, 8192, 1, 256, 1024, 1024, 1024, 256]
    - [40, 152.52]
  - - [1024, 8192, 1, 512, 1024, 1024, 1024, 512]
    - [40, 244.23]
  - - [1024, 8192, 1, 1024, 1024, 1024, 1024, 1024]
    - [40, 274.24]
  - - [1024, 8192, 1, 2048, 1024, 1024, 1024, 2048]
    - [41, 338.71]
  - - [1024, 8192, 1, 4096, 1024, 1024, 1024, 4096]
    - [41, 357.56]
  - - [1024, 8192, 1, 8192, 1024, 1024, 1024, 8192]
    - [41, 368.93]
  - - [2048, 128, 1, 128, 2048, 2048, 2048, 128]
    - [70, 8.24]
  - - [2048, 128, 1, 256, 2048, 2048, 2048, 256]
    - [70, 14.53]
  - - [2048, 128, 1, 512, 2048, 2048, 2048, 512]
    - [70, 24.31]
  - - [2048, 128, 1, 1024, 2048, 2048, 2048, 1024]
    - [70, 37.49]
  - - [2048, 128, 1, 2048, 2048, 2048, 2048, 2048]
    - [72, 42.97]
  - - [2048, 128, 1, 4096, 2048, 2048, 2048, 4096]
    - [82, 51.78]
  - - [2048, 128, 1, 8192, 2048, 2048, 2048, 8192]
    - [81, 58.88]
  - - [2048, 256, 1, 128, 2048, 2048, 2048, 128]
    - [29, 14.46]
  - - [2048, 256, 1, 256, 2048, 2048, 2048, 256]
    - [31, 25.54]
  - - [2048, 256, 1, 512, 2048, 2048, 2048, 512]
    - [60, 41.71]
  - - [2048, 256, 1, 1024, 2048, 2048, 2048, 1024]
    - [61, 61.92]
  - - [2048, 256, 1, 2048, 2048, 2048, 2048, 2048]
    - [63, 76.87]
  - - [2048, 256, 1, 4096, 2048, 2048, 2048, 4096]
    - [62, 92.37]
  - - [2048, 256, 1, 8192, 2048, 2048, 2048, 8192]
    - [63, 103.27]
  - - [2048, 512, 1, 128, 2048, 2048, 2048, 128]
    - [27, 25.59]
  - - [2048, 512, 1, 256, 2048, 2048, 2048, 256]
    - [26, 44.63]
  - - [2048, 512, 1, 512, 2048, 2048, 2048, 512]
    - [24, 72.4]
  - - [2048, 512, 1, 1024, 2048, 2048, 2048, 1024]
    - [23, 103.45]
  - - [2048, 512, 1, 2048, 2048, 2048, 2048, 2048]
    - [56, 121.01]
  - - [2048, 512, 1, 4096, 2048, 2048, 2048, 4096]
    - [57, 140.79]
  - - [2048, 512, 1, 8192, 2048, 2048, 2048, 8192]
    - [57, 146.79]
  - - [2048, 1024, 1, 128, 2048, 2048, 2048, 128]
    - [21, 41.16]
  - - [2048, 1024, 1, 256, 2048, 2048, 2048, 256]
    - [22, 70.64]
  - - [2048, 1024, 1, 512, 2048, 2048, 2048, 512]
    - [49, 111.96]
  - - [2048, 1024, 1, 1024, 2048, 2048, 2048, 1024]
    - [49, 159.91]
  - - [2048, 1024, 1, 2048, 2048, 2048, 2048, 2048]
    - [52, 182.67]
  - - [2048, 1024, 1, 4096, 2048, 2048, 2048, 4096]
    - [50, 206.63]
  - - [2048, 1024, 1, 8192, 2048, 2048, 2048, 8192]
    - [50, 200.22]
  - - [2048, 2048, 1, 128, 2048, 2048, 2048, 128]
    - [18, 58.29]
  - - [2048, 2048, 1, 256, 2048, 2048, 2048, 256]
    - [19, 99.38]
  - - [2048, 2048, 1, 512, 2048, 2048, 2048, 512]
    - [12, 152.71]
  - - [2048, 2048, 1, 1024, 2048, 2048, 2048, 1024]
    - [16, 207.79]
  - - [2048, 2048, 1, 2048, 2048, 2048, 2048, 2048]
    - [19, 248.1]
  - - [2048, 2048, 1, 4096, 2048, 2048, 2048, 4096]
    - [46, 264.33]
  - - [2048, 2048, 1, 8192, 2048, 2048, 2048, 8192]
    - [37, 240.48]
  - - [2048, 4096, 1, 128, 2048, 2048, 2048, 128]
    - [8, 72.74]
  - - [2048, 4096, 1, 256, 2048, 2048, 2048, 256]
    - [1, 122.53]
  - - [2048, 4096, 1, 512, 2048, 2048, 2048, 512]
    - [5, 182.9]
  - - [2048, 4096, 1, 1024, 2048, 2048, 2048, 1024]
    - [7, 247.33]
  - - [2048, 4096, 1, 2048, 2048, 2048, 2048, 2048]
    - [11, 283.0]
  - - [2048, 4096, 1, 4096, 2048, 2048, 2048, 4096]
    - [43, 280.35]
  - - [2048, 4096, 1, 8192, 2048, 2048, 2048, 8192]
    - [43, 310.21]
  - - [2048, 8192, 1, 128, 2048, 2048, 2048, 128]
    - [40, 97.89]
  - - [2048, 8192, 1, 256, 2048, 2048, 2048, 256]
    - [43, 162.5]
  - - [2048, 8192, 1, 512, 2048, 2048, 2048, 512]
    - [41, 233.91]
  - - [2048, 8192, 1, 1024, 2048, 2048, 2048, 1024]
    - [43, 290.75]
  - - [2048, 8192, 1, 2048, 2048, 2048, 2048, 2048]
    - [41, 326.56]
  - - [2048, 8192, 1, 4096, 2048, 2048, 2048, 4096]
    - [42, 343.08]
  - - [2048, 8192, 1, 8192, 2048, 2048, 2048, 8192]
    - [42, 386.81]
  - - [4096, 128, 1, 128, 4096, 4096, 4096, 128]
    - [29, 14.82]
  - - [4096, 128, 1, 256, 4096, 4096, 4096, 256]
    - [28, 25.79]
  - - [4096, 128, 1, 512, 4096, 4096, 4096, 512]
    - [30, 41.73]
  - - [4096, 128, 1, 1024, 4096, 4096, 4096, 1024]
    - [59, 62.93]
  - - [4096, 128, 1, 2048, 4096, 4096, 4096, 2048]
    - [63, 76.9]
  - - [4096, 128, 1, 4096, 4096, 4096, 4096, 4096]
    - [64, 93.04]
  - - [4096, 128, 1, 8192, 4096, 4096, 4096, 8192]
    - [63, 103.46]
  - - [4096, 256, 1, 128, 4096, 4096, 4096, 128]
    - [24, 25.48]
  - - [4096, 256, 1, 256, 4096, 4096, 4096, 256]
    - [24, 44.92]
  - - [4096, 256, 1, 512, 4096, 4096, 4096, 512]
    - [24, 71.81]
  - - [4096, 256, 1, 1024, 4096, 4096, 4096, 1024]
    - [23, 103.57]
  - - [4096, 256, 1, 2048, 4096, 4096, 4096, 2048]
    - [56, 120.33]
  - - [4096, 256, 1, 4096, 4096, 4096, 4096, 4096]
    - [57, 140.73]
  - - [4096, 256, 1, 8192, 4096, 4096, 4096, 8192]
    - [57, 145.09]
  - - [4096, 512, 1, 128, 4096, 4096, 4096, 128]
    - [21, 41.77]
  - - [4096, 512, 1, 256, 4096, 4096, 4096, 256]
    - [49, 71.35]
  - - [4096, 512, 1, 512, 4096, 4096, 4096, 512]
    - [49, 113.29]
  - - [4096, 512, 1, 1024, 4096, 4096, 4096, 1024]
    - [50, 152.98]
  - - [4096, 512, 1, 2048, 4096, 4096, 4096, 2048]
    - [51, 181.09]
  - - [4096, 512, 1, 4096, 4096, 4096, 4096, 4096]
    - [50, 208.41]
  - - [4096, 512, 1, 8192, 4096, 4096, 4096, 8192]
    - [52, 201.26]
  - - [4096, 1024, 1, 128, 4096, 4096, 4096, 128]
    - [16, 59.14]
  - - [4096, 1024, 1, 256, 4096, 4096, 4096, 256]
    - [17, 98.85]
  - - [4096, 1024, 1, 512, 4096, 4096, 4096, 512]
    - [16, 153.38]
  - - [4096, 1024, 1, 1024, 4096, 4096, 4096, 1024]
    - [19, 203.47]
  - - [4096, 1024, 1, 2048, 4096, 4096, 4096, 2048]
    - [18, 248.55]
  - - [4096, 1024, 1, 4096, 4096, 4096, 4096, 4096]
    - [45, 264.17]
  - - [4096, 1024, 1, 8192, 4096, 4096, 4096, 8192]
    - [39, 239.9]
  - - [4096, 2048, 1, 128, 4096, 4096, 4096, 128]
    - [4, 71.88]
  - - [4096, 2048, 1, 256, 4096, 4096, 4096, 256]
    - [0, 120.49]
  - - [4096, 2048, 1, 512, 4096, 4096, 4096, 512]
    - [1, 180.4]
  - - [4096, 2048, 1, 1024, 4096, 4096, 4096, 1024]
    - [6, 244.97]
  - - [4096, 2048, 1, 2048, 4096, 4096, 4096, 2048]
    - [10, 278.61]
  - - [4096, 2048, 1, 4096, 4096, 4096, 4096, 4096]
    - [39, 266.18]
  - - [4096, 2048, 1, 8192, 4096, 4096, 4096, 8192]
    - [36, 292.55]
  - - [4096, 4096, 1, 128, 4096, 4096, 4096, 128]
    - [8, 77.95]
  - - [4096, 4096, 1, 256, 4096, 4096, 4096, 256]
    - [8, 129.91]
  - - [4096, 4096, 1, 512, 4096, 4096, 4096, 512]
    - [8, 193.95]
  - - [4096, 4096, 1, 1024, 4096, 4096, 4096, 1024]
    - [8, 238.77]
  - - [4096, 4096, 1, 2048, 4096, 4096, 4096, 2048]
    - [43, 262.42]
  - - [4096, 4096, 1, 4096, 4096, 4096, 4096, 4096]
    - [42, 294.32]
  - - [4096, 4096, 1, 8192, 4096, 4096, 4096, 8192]
    - [9, 326.25]
  - - [4096, 8192, 1, 128, 4096, 4096, 4096, 128]
    - [40, 105.72]
  - - [4096, 8192, 1, 256, 4096, 4096, 4096, 256]
    - [40, 174.34]
  - - [4096, 8192, 1, 512, 4096, 4096, 4096, 512]
    - [41, 229.26]
  - - [4096, 8192, 1, 1024, 4096, 4096, 4096, 1024]
    - [41, 280.77]
  - - [4096, 8192, 1, 2048, 4096, 4096, 4096, 2048]
    - [41, 316.73]
  - - [4096, 8192, 1, 4096, 4096, 4096, 4096, 4096]
    - [43, 359.19]
  - - [4096, 8192, 1, 8192, 4096, 4096, 4096, 8192]
    - [43, 401.31]
  - - [8192, 128, 1, 128, 8192, 8192, 8192, 128]
    - [25, 25.96]
  - - [8192, 128, 1, 256, 8192, 8192, 8192, 256]
    - [26, 45.54]
  - - [8192, 128, 1, 512, 8192, 8192, 8192, 512]
    - [24, 72.24]
  - - [8192, 128, 1, 1024, 8192, 8192, 8192, 1024]
    - [24, 103.62]
  - - [8192, 128, 1, 2048, 8192, 8192, 8192, 2048]
    - [56, 119.89]
  - - [8192, 128, 1, 4096, 8192, 8192, 8192, 4096]
    - [57, 140.09]
  - - [8192, 128, 1, 8192, 8192, 8192, 8192, 8192]
    - [57, 142.19]
  - - [8192, 256, 1, 128, 8192, 8192, 8192, 128]
    - [21, 41.75]
  - - [8192, 256, 1, 256, 8192, 8192, 8192, 256]
    - [21, 71.5]
  - - [8192, 256, 1, 512, 8192, 8192, 8192, 512]
    - [49, 114.16]
  - - [8192, 256, 1, 1024, 8192, 8192, 8192, 1024]
    - [52, 159.84]
  - - [8192, 256, 1, 2048, 8192, 8192, 8192, 2048]
    - [50, 183.84]
  - - [8192, 256, 1, 4096, 8192, 8192, 8192, 4096]
    - [52, 211.78]
  - - [8192, 256, 1, 8192, 8192, 8192, 8192, 8192]
    - [51, 193.12]
  - - [8192, 512, 1, 128, 8192, 8192, 8192, 128]
    - [16, 58.22]
  - - [8192, 512, 1, 256, 8192, 8192, 8192, 256]
    - [16, 99.7]
  - - [8192, 512, 1, 512, 8192, 8192, 8192, 512]
    - [15, 151.66]
  - - [8192, 512, 1, 1024, 8192, 8192, 8192, 1024]
    - [14, 205.4]
  - - [8192, 512, 1, 2048, 8192, 8192, 8192, 2048]
    - [19, 246.2]
  - - [8192, 512, 1, 4096, 8192, 8192, 8192, 4096]
    - [38, 259.74]
  - - [8192, 512, 1, 8192, 8192, 8192, 8192, 8192]
    - [39, 243.12]
  - - [8192, 1024, 1, 128, 8192, 8192, 8192, 128]
    - [4, 71.58]
  - - [8192, 1024, 1, 256, 8192, 8192, 8192, 256]
    - [10, 119.86]
  - - [8192, 1024, 1, 512, 8192, 8192, 8192, 512]
    - [8, 180.01]
  - - [8192, 1024, 1, 1024, 8192, 8192, 8192, 1024]
    - [8, 240.76]
  - - [8192, 1024, 1, 2048, 8192, 8192, 8192, 2048]
    - [3, 275.15]
  - - [8192, 1024, 1, 4096, 8192, 8192, 8192, 4096]
    - [38, 264.63]
  - - [8192, 1024, 1, 8192, 8192, 8192, 8192, 8192]
    - [36, 303.31]
  - - [8192, 2048, 1, 128, 8192, 8192, 8192, 128]
    - [40, 77.39]
  - - [8192, 2048, 1, 256, 8192, 8192, 8192, 256]
    - [4, 128.4]
  - - [8192, 2048, 1, 512, 8192, 8192, 8192, 512]
    - [42, 191.47]
  - - [8192, 2048, 1, 1024, 8192, 8192, 8192, 1024]
    - [43, 241.77]
  - - [8192, 2048, 1, 2048, 8192, 8192, 8192, 2048]
    - [43, 250.4]
  - - [8192, 2048, 1, 4096, 8192, 8192, 8192, 4096]
    - [7, 288.72]
  - - [8192, 2048, 1, 8192, 8192, 8192, 8192, 8192]
    - [2, 346.88]
  - - [8192, 4096, 1, 128, 8192, 8192, 8192, 128]
    - [11, 82.4]
  - - [8192, 4096, 1, 256, 8192, 8192, 8192, 256]
    - [21, 139.87]
  - - [8192, 4096, 1, 512, 8192, 8192, 8192, 512]
    - [13, 195.18]
  - - [8192, 4096, 1, 1024, 8192, 8192, 8192, 1024]
    - [42, 239.74]
  - - [8192, 4096, 1, 2048, 8192, 8192, 8192, 2048]
    - [42, 288.58]
  - - [8192, 4096, 1, 4096, 8192, 8192, 8192, 4096]
    - [42, 328.48]
  - - [8192, 4096, 1, 8192, 8192, 8192, 8192, 8192]
    - [2, 369.55]
  - - [8192, 8192, 1, 128, 8192, 8192, 8192, 128]
    - [40, 108.43]
  - - [8192, 8192, 1, 256, 8192, 8192, 8192, 256]
    - [43, 154.74]
  - - [8192, 8192, 1, 512, 8192, 8192, 8192, 512]
    - [9, 210.23]
  - - [8192, 8192, 1, 1024, 8192, 8192, 8192, 1024]
    - [42, 281.15]
  - - [8192, 8192, 1, 2048, 8192, 8192, 8192, 2048]
    - [42, 340.98]
  - - [8192, 8192, 1, 4096, 8192, 8192, 8192, 4096]
    - [42, 381.39]
  - - [8192, 8192, 1, 8192, 8192, 8192, 8192, 8192]
    - [42, 407.24]
- null
- null
- ExperimentalStreamK
- GridBased
