projects/hipblaslt/library/src/amd_detail/rocblaslt/src/Tensile/Logic/asm_full/aquavanjaram/gfx942_228cu/StreamK/aquavanjaram942_Cijk_Ailk_Bljk_B8F8NSS_BH_Bias_HAS_SAV_UserArgs.yaml
- {MinimumRequiredVersion: 4.33.0}
- aquavanjaram942
- {Architecture: gfx942, CUCount: 228}
- [Device 0049, Device 0050]
    SolutionIndex: 0
    SolutionNameMin: Cijk_Ailk_Bljk_B8F8NSS_BH_Bias_HAS_SAV_UserArgs_MT256x256x64_MI16x16x1_SN_LDSB1_CLR1_GRVWA16_GRVWB16_GSU0_GSUC0_GSUWGMRR0_K1_LBSPPA2048_LBSPPB512_LPA0_LPB16_LRVW8_MIWT8_8_PLR1_SU0_SUM0_SUS64_VWA8_VWB8_WGM1_WGMXCC1_WGMXCCGn1
    SolutionIndex: 1
    SolutionNameMin: Cijk_Ailk_Bljk_B8F8NSS_BH_Bias_HAS_SAV_UserArgs_MT256x256x64_MI16x16x1_SN_LDSB1_CLR1_GRVWA8_GRVWB8_GSU0_GSUC0_GSUWGMRR0_K1_LBSPPA2048_LBSPPB512_LPA0_LPB8_LRVW8_MIWT8_8_PLR1_SU0_SUM0_SUS64_VWA8_VWB8_WGM4_WGMXCC1_WGMXCCGn1
    SolutionIndex: 2
    SolutionNameMin: Cijk_Ailk_Bljk_B8F8NSS_BH_Bias_HAS_SAV_UserArgs_MT256x256x64_MI16x16x1_SN_LDSB1_CLR1_GRVWA16_GRVWB16_GSU0_GSUC0_GSUWGMRR0_K1_LBSPPA2048_LBSPPB512_LPA0_LPB16_LRVW8_MIWT8_8_PLR1_SU0_SUM0_SUS64_VWA8_VWB8_WGM4_WGMXCC1_WGMXCCGn1
    SolutionIndex: 3
    SolutionNameMin: Cijk_Ailk_Bljk_B8F8NSS_BH_Bias_HAS_SAV_UserArgs_MT256x256x64_MI16x16x1_SN_LDSB1_CLR1_GRVWA16_GRVWB16_GSU0_GSUC0_GSUWGMRR0_K1_LBSPPA2048_LBSPPB512_LPA0_LPB16_LRVW8_MIWT8_8_PLR1_SU0_SUM0_SUS64_VWA8_VWB8_WGM8_WGMXCC1_WGMXCCGn1
    SolutionIndex: 4
    SolutionNameMin: Cijk_Ailk_Bljk_B8F8NSS_BH_Bias_HAS_SAV_UserArgs_MT128x256x64_MI16x16x1_SN_LDSB1_CLR1_GRVWA8_GRVWB16_GSU0_GSUC0_GSUWGMRR0_K1_LBSPPA1024_LBSPPB512_LPA64_LPB16_LRVW8_MIWT4_8_PLR1_SU0_SUM0_SUS64_VWA4_VWB8_WGM1_WGMXCC1_WGMXCCGn1
    SolutionIndex: 5
    SolutionNameMin: Cijk_Ailk_Bljk_B8F8NSS_BH_Bias_HAS_SAV_UserArgs_MT128x256x64_MI16x16x1_SN_LDSB1_CLR1_GRVWA16_GRVWB16_GSU0_GSUC0_GSUWGMRR0_K1_LBSPPA1024_LBSPPB512_LPA64_LPB16_LRVW8_MIWT4_8_PLR1_SU0_SUM0_SUS64_VWA4_VWB8_WGM1_WGMXCC1_WGMXCCGn1
    SolutionIndex: 6
    SolutionNameMin: Cijk_Ailk_Bljk_B8F8NSS_BH_Bias_HAS_SAV_UserArgs_MT128x256x64_MI16x16x1_SN_LDSB1_CLR1_GRVWA8_GRVWB8_GSU0_GSUC0_GSUWGMRR0_K1_LBSPPA1024_LBSPPB512_LPA64_LPB8_LRVW8_MIWT4_8_PLR1_SU0_SUM0_SUS64_VWA4_VWB8_WGM4_WGMXCC1_WGMXCCGn1
    SolutionIndex: 7
    SolutionNameMin: Cijk_Ailk_Bljk_B8F8NSS_BH_Bias_HAS_SAV_UserArgs_MT128x256x64_MI16x16x1_SN_LDSB1_CLR1_GRVWA16_GRVWB16_GSU0_GSUC0_GSUWGMRR0_K1_LBSPPA1024_LBSPPB512_LPA64_LPB16_LRVW8_MIWT4_8_PLR1_SU0_SUM0_SUS64_VWA4_VWB8_WGM6_WGMXCC1_WGMXCCGn1
    SolutionIndex: 8
    SolutionNameMin: Cijk_Ailk_Bljk_B8F8NSS_BH_Bias_HAS_SAV_UserArgs_MT128x256x64_MI16x16x1_SN_LDSB1_CLR1_GRVWA16_GRVWB16_GSU0_GSUC0_GSUWGMRR0_K1_LBSPPA1024_LBSPPB512_LPA64_LPB16_LRVW8_MIWT4_8_PLR1_SU0_SUM0_SUS64_VWA4_VWB8_WGM8_WGMXCC1_WGMXCCGn1
    SolutionIndex: 9
    SolutionNameMin: Cijk_Ailk_Bljk_B8F8NSS_BH_Bias_HAS_SAV_UserArgs_MT64x128x64_MI16x16x1_SN_LDSB0_CLR1_GRVWA8_GRVWB8_GSU0_GSUC0_GSUWGMRR0_K1_LBSPPA512_LBSPPB512_LPA16_LPB8_LRVW8_MIWT1_8_PLR1_SU0_SUM0_SUS64_VWA1_VWB8_WGM1_WGMXCC1_WGMXCCGn1
    SolutionIndex: 10
    SolutionNameMin: Cijk_Ailk_Bljk_B8F8NSS_BH_Bias_HAS_SAV_UserArgs_MT128x128x64_MI16x16x1_SN_LDSB1_CLR1_GRVWA16_GRVWB8_GSU0_GSUC0_GSUWGMRR0_K1_LBSPPA1024_LBSPPB256_LPA64_LPB8_LRVW8_MIWT4_4_PLR1_SU0_SUM0_SUS64_VWA4_VWB4_WGM1_WGMXCC1_WGMXCCGn1
    SolutionIndex: 11
    SolutionNameMin: Cijk_Ailk_Bljk_B8F8NSS_BH_Bias_HAS_SAV_UserArgs_MT128x128x64_MI16x16x1_SN_LDSB1_CLR1_GRVWA8_GRVWB16_GSU0_GSUC0_GSUWGMRR0_K1_LBSPPA1024_LBSPPB256_LPA64_LPB16_LRVW8_MIWT4_4_PLR1_SU0_SUM0_SUS64_VWA4_VWB4_WGM1_WGMXCC1_WGMXCCGn1
    SolutionIndex: 12
    SolutionNameMin: Cijk_Ailk_Bljk_B8F8NSS_BH_Bias_HAS_SAV_UserArgs_MT128x128x64_MI16x16x1_SN_LDSB1_CLR1_GRVWA16_GRVWB16_GSU0_GSUC0_GSUWGMRR0_K1_LBSPPA1024_LBSPPB256_LPA64_LPB16_LRVW8_MIWT4_4_PLR1_SU0_SUM0_SUS64_VWA4_VWB4_WGM1_WGMXCC1_WGMXCCGn1
    SolutionIndex: 13
    SolutionNameMin: Cijk_Ailk_Bljk_B8F8NSS_BH_Bias_HAS_SAV_UserArgs_MT128x128x64_MI16x16x1_SN_LDSB1_CLR1_GRVWA16_GRVWB8_GSU0_GSUC0_GSUWGMRR0_K1_LBSPPA1024_LBSPPB256_LPA64_LPB8_LRVW8_MIWT4_4_PLR1_SU0_SUM0_SUS64_VWA4_VWB4_WGM6_WGMXCC1_WGMXCCGn1
    SolutionIndex: 14
    SolutionNameMin: Cijk_Ailk_Bljk_B8F8NSS_BH_Bias_HAS_SAV_UserArgs_MT128x128x64_MI16x16x1_SN_LDSB1_CLR1_GRVWA16_GRVWB16_GSU0_GSUC0_GSUWGMRR0_K1_LBSPPA1024_LBSPPB256_LPA64_LPB16_LRVW8_MIWT4_4_PLR1_SU0_SUM0_SUS64_VWA4_VWB4_WGM8_WGMXCC1_WGMXCCGn1
    SolutionIndex: 15
    SolutionNameMin: Cijk_Ailk_Bljk_B8F8NSS_BH_Bias_HAS_SAV_UserArgs_MT64x128x64_MI16x16x1_SN_LDSB0_CLR1_GRVWA16_GRVWB8_GSU0_GSUC0_GSUWGMRR0_K1_LBSPPA512_LBSPPB256_LPA32_LPB8_LRVW8_MIWT2_4_PLR1_SU0_SUM0_SUS64_VWA2_VWB4_WGM1_WGMXCC1_WGMXCCGn1
    SolutionIndex: 16
    SolutionNameMin: Cijk_Ailk_Bljk_B8F8NSS_BH_Bias_HAS_SAV_UserArgs_MT64x128x64_MI16x16x1_SN_LDSB0_CLR1_GRVWA8_GRVWB16_GSU0_GSUC0_GSUWGMRR0_K1_LBSPPA512_LBSPPB256_LPA32_LPB16_LRVW8_MIWT2_4_PLR1_SU0_SUM0_SUS64_VWA2_VWB4_WGM1_WGMXCC1_WGMXCCGn1
    SolutionIndex: 17
    SolutionNameMin: Cijk_Ailk_Bljk_B8F8NSS_BH_Bias_HAS_SAV_UserArgs_MT64x128x64_MI16x16x1_SN_LDSB0_CLR1_GRVWA8_GRVWB16_GSU0_GSUC0_GSUWGMRR0_K1_LBSPPA512_LBSPPB256_LPA32_LPB16_LRVW8_MIWT2_4_PLR1_SU0_SUM0_SUS64_VWA2_VWB4_WGM4_WGMXCC1_WGMXCCGn1
    SolutionIndex: 18
    SolutionNameMin: Cijk_Ailk_Bljk_B8F8NSS_BH_Bias_HAS_SAV_UserArgs_MT64x128x64_MI16x16x1_SN_LDSB0_CLR1_GRVWA8_GRVWB16_GSU0_GSUC0_GSUWGMRR0_K1_LBSPPA512_LBSPPB256_LPA32_LPB16_LRVW8_MIWT2_4_PLR1_SU0_SUM0_SUS64_VWA2_VWB4_WGM6_WGMXCC1_WGMXCCGn1
    SolutionIndex: 19
    SolutionNameMin: Cijk_Ailk_Bljk_B8F8NSS_BH_Bias_HAS_SAV_UserArgs_MT128x64x64_MI16x16x1_SN_LDSB0_CLR1_GRVWA16_GRVWB8_GSU0_GSUC0_GSUWGMRR0_K1_LBSPPA1024_LBSPPB128_LPA64_LPB8_LRVW8_MIWT4_2_PLR1_SU0_SUM0_SUS64_VWA4_VWB2_WGM1_WGMXCC1_WGMXCCGn1
    SolutionIndex: 20
    SolutionNameMin: Cijk_Ailk_Bljk_B8F8NSS_BH_Bias_HAS_SAV_UserArgs_MT128x64x64_MI16x16x1_SN_LDSB0_CLR1_GRVWA8_GRVWB16_GSU0_GSUC0_GSUWGMRR0_K1_LBSPPA1024_LBSPPB128_LPA64_LPB16_LRVW8_MIWT4_2_PLR1_SU0_SUM0_SUS64_VWA4_VWB2_WGM1_WGMXCC1_WGMXCCGn1
    SolutionIndex: 21
    SolutionNameMin: Cijk_Ailk_Bljk_B8F8NSS_BH_Bias_HAS_SAV_UserArgs_MT128x64x64_MI16x16x1_SN_LDSB0_CLR1_GRVWA16_GRVWB16_GSU0_GSUC0_GSUWGMRR0_K1_LBSPPA1024_LBSPPB128_LPA64_LPB16_LRVW8_MIWT4_2_PLR1_SU0_SUM0_SUS64_VWA4_VWB2_WGM1_WGMXCC1_WGMXCCGn1
    SolutionIndex: 22
    SolutionNameMin: Cijk_Ailk_Bljk_B8F8NSS_BH_Bias_HAS_SAV_UserArgs_MT128x64x64_MI16x16x1_SN_LDSB0_CLR1_GRVWA16_GRVWB16_GSU0_GSUC0_GSUWGMRR0_K1_LBSPPA1024_LBSPPB128_LPA64_LPB16_LRVW8_MIWT4_2_PLR1_SU0_SUM0_SUS64_VWA4_VWB2_WGM6_WGMXCC1_WGMXCCGn1
    SolutionIndex: 23
    SolutionNameMin: Cijk_Ailk_Bljk_B8F8NSS_BH_Bias_HAS_SAV_UserArgs_MT32x128x64_MI16x16x1_SN_LDSB0_CLR1_GRVWA8_GRVWB16_GSU0_GSUC0_GSUWGMRR0_K1_LBSPPA256_LBSPPB256_LPA16_LPB16_LRVW8_MIWT1_4_PLR1_SU0_SUM0_SUS64_VWA1_VWB4_WGM1_WGMXCC1_WGMXCCGn1
    SolutionIndex: 24
    SolutionNameMin: Cijk_Ailk_Bljk_B8F8NSS_BH_Bias_HAS_SAV_UserArgs_MT128x32x64_MI16x16x1_SN_LDSB0_CLR1_GRVWA8_GRVWB8_GSU0_GSUC0_GSUWGMRR0_K1_LBSPPA1024_LBSPPB128_LPA64_LPB8_LRVW8_MIWT4_1_PLR1_SU0_SUM0_SUS64_VWA4_VWB1_WGM1_WGMXCC1_WGMXCCGn1
    SolutionIndex: 25
    SolutionNameMin: Cijk_Ailk_Bljk_B8F8NSS_BH_Bias_HAS_SAV_UserArgs_MT128x32x64_MI16x16x1_SN_LDSB0_CLR1_GRVWA16_GRVWB8_GSU0_GSUC0_GSUWGMRR0_K1_LBSPPA1024_LBSPPB128_LPA64_LPB8_LRVW8_MIWT4_1_PLR1_SU0_SUM0_SUS64_VWA4_VWB1_WGM1_WGMXCC1_WGMXCCGn1
    SolutionIndex: 26
    SolutionNameMin: Cijk_Ailk_Bljk_B8F8NSS_BH_Bias_HAS_SAV_UserArgs_MT64x64x64_MI16x16x1_SN_LDSB0_CLR1_GRVWA8_GRVWB8_GSU0_GSUC0_GSUWGMRR0_K1_LBSPPA512_LBSPPB128_LPA32_LPB8_LRVW8_MIWT2_2_PLR1_SU0_SUM0_SUS64_VWA2_VWB2_WGM1_WGMXCC1_WGMXCCGn1
    SolutionIndex: 27
    SolutionNameMin: Cijk_Ailk_Bljk_B8F8NSS_BH_Bias_HAS_SAV_UserArgs_MT64x64x64_MI16x16x1_SN_LDSB0_CLR1_GRVWA8_GRVWB16_GSU0_GSUC0_GSUWGMRR0_K1_LBSPPA512_LBSPPB128_LPA32_LPB16_LRVW8_MIWT2_2_PLR1_SU0_SUM0_SUS64_VWA2_VWB2_WGM1_WGMXCC1_WGMXCCGn1
    SolutionIndex: 28
    SolutionNameMin: Cijk_Ailk_Bljk_B8F8NSS_BH_Bias_HAS_SAV_UserArgs_MT64x64x64_MI16x16x1_SN_LDSB0_CLR1_GRVWA8_GRVWB16_GSU0_GSUC0_GSUWGMRR0_K1_LBSPPA512_LBSPPB128_LPA32_LPB16_LRVW8_MIWT2_2_PLR1_SU0_SUM0_SUS64_VWA2_VWB2_WGM4_WGMXCC1_WGMXCCGn1
    SolutionIndex: 29
    SolutionNameMin: Cijk_Ailk_Bljk_B8F8NSS_BH_Bias_HAS_SAV_UserArgs_MT32x32x64_MI16x16x1_SN_LDSB0_CLR1_GRVWA8_GRVWB8_GSU0_GSUC0_GSUWGMRR0_K1_LBSPPA256_LBSPPB128_LPA16_LPB8_LRVW8_MIWT1_1_PLR1_SU0_SUM0_SUS64_VWA1_VWB1_WGM1_WGMXCC1_WGMXCCGn1
    SolutionIndex: 30
    SolutionNameMin: Cijk_Ailk_Bljk_B8F8NSS_BH_Bias_HAS_SAV_UserArgs_MT128x256x128_MI16x16x1_SN_LDSB1_CLR1_GRVWA8_GRVWB16_GSU0_GSUC0_GSUWGMRR0_K1_LBSPPA1024_LBSPPB1024_LPA64_LPB16_LRVW8_MIWT4_8_PLR1_SU0_SUM0_SUS128_VWA4_VWB8_WGM1_WGMXCC1_WGMXCCGn1
    SolutionIndex: 31
    SolutionNameMin: Cijk_Ailk_Bljk_B8F8NSS_BH_Bias_HAS_SAV_UserArgs_MT128x256x128_MI16x16x1_SN_LDSB1_CLR1_GRVWA16_GRVWB16_GSU0_GSUC0_GSUWGMRR0_K1_LBSPPA1024_LBSPPB1024_LPA64_LPB16_LRVW8_MIWT4_8_PLR1_SU0_SUM0_SUS128_VWA4_VWB8_WGM1_WGMXCC1_WGMXCCGn1
    SolutionIndex: 32
    SolutionNameMin: Cijk_Ailk_Bljk_B8F8NSS_BH_Bias_HAS_SAV_UserArgs_MT128x256x128_MI16x16x1_SN_LDSB1_CLR1_GRVWA16_GRVWB16_GSU0_GSUC0_GSUWGMRR0_K1_LBSPPA1024_LBSPPB1024_LPA64_LPB16_LRVW8_MIWT4_8_PLR1_SU0_SUM0_SUS128_VWA4_VWB8_WGM4_WGMXCC1_WGMXCCGn1
    SolutionIndex: 33
    SolutionNameMin: Cijk_Ailk_Bljk_B8F8NSS_BH_Bias_HAS_SAV_UserArgs_MT128x256x128_MI16x16x1_SN_LDSB1_CLR1_GRVWA16_GRVWB16_GSU0_GSUC0_GSUWGMRR0_K1_LBSPPA1024_LBSPPB1024_LPA64_LPB16_LRVW8_MIWT4_8_PLR1_SU0_SUM0_SUS128_VWA4_VWB8_WGM6_WGMXCC1_WGMXCCGn1
    SolutionIndex: 34
    SolutionNameMin: Cijk_Ailk_Bljk_B8F8NSS_BH_Bias_HAS_SAV_UserArgs_MT128x256x128_MI16x16x1_SN_LDSB1_CLR1_GRVWA8_GRVWB16_GSU0_GSUC0_GSUWGMRR0_K1_LBSPPA1024_LBSPPB1024_LPA64_LPB16_LRVW8_MIWT4_8_PLR1_SU0_SUM0_SUS128_VWA4_VWB8_WGM8_WGMXCC1_WGMXCCGn1
    SolutionIndex: 35
    SolutionNameMin: Cijk_Ailk_Bljk_B8F8NSS_BH_Bias_HAS_SAV_UserArgs_MT128x256x128_MI16x16x1_SN_LDSB1_CLR1_GRVWA16_GRVWB16_GSU0_GSUC0_GSUWGMRR0_K1_LBSPPA1024_LBSPPB1024_LPA64_LPB16_LRVW8_MIWT4_8_PLR1_SU0_SUM0_SUS128_VWA4_VWB8_WGM8_WGMXCC1_WGMXCCGn1
    SolutionIndex: 36
    SolutionNameMin: Cijk_Ailk_Bljk_B8F8NSS_BH_Bias_HAS_SAV_UserArgs_MT256x144x128_MI16x16x1_SN_LDSB1_CLR1_GRVWA8_GRVWB8_GSU0_GSUC0_GSUWGMRR0_K1_LBSPPA2048_LBSPPB128_LPA64_LPB8_LRVW8_MIWT4_9_PLR1_SU0_SUM0_SUS128_VWA4_VWB1_WGM1_WGMXCC1_WGMXCCGn1
    SolutionIndex: 37
    SolutionNameMin: Cijk_Ailk_Bljk_B8F8NSS_BH_Bias_HAS_SAV_UserArgs_MT256x144x128_MI16x16x1_SN_LDSB1_CLR1_GRVWA16_GRVWB8_GSU0_GSUC0_GSUWGMRR0_K1_LBSPPA2048_LBSPPB128_LPA64_LPB8_LRVW8_MIWT4_9_PLR1_SU0_SUM0_SUS128_VWA4_VWB1_WGM1_WGMXCC1_WGMXCCGn1
    SolutionIndex: 38
    SolutionNameMin: Cijk_Ailk_Bljk_B8F8NSS_BH_Bias_HAS_SAV_UserArgs_MT256x144x128_MI16x16x1_SN_LDSB1_CLR1_GRVWA8_GRVWB8_GSU0_GSUC0_GSUWGMRR0_K1_LBSPPA2048_LBSPPB128_LPA64_LPB8_LRVW8_MIWT4_9_PLR1_SU0_SUM0_SUS128_VWA4_VWB1_WGM4_WGMXCC1_WGMXCCGn1
    SolutionIndex: 39
    SolutionNameMin: Cijk_Ailk_Bljk_B8F8NSS_BH_Bias_HAS_SAV_UserArgs_MT256x144x128_MI16x16x1_SN_LDSB1_CLR1_GRVWA16_GRVWB8_GSU0_GSUC0_GSUWGMRR0_K1_LBSPPA2048_LBSPPB128_LPA64_LPB8_LRVW8_MIWT4_9_PLR1_SU0_SUM0_SUS128_VWA4_VWB1_WGM4_WGMXCC1_WGMXCCGn1
    SolutionIndex: 40
    SolutionNameMin: Cijk_Ailk_Bljk_B8F8NSS_BH_Bias_HAS_SAV_UserArgs_MT256x144x128_MI16x16x1_SN_LDSB1_CLR1_GRVWA16_GRVWB8_GSU0_GSUC0_GSUWGMRR0_K1_LBSPPA2048_LBSPPB128_LPA64_LPB8_LRVW8_MIWT4_9_PLR1_SU0_SUM0_SUS128_VWA4_VWB1_WGM6_WGMXCC1_WGMXCCGn1
    SolutionIndex: 41
    SolutionNameMin: Cijk_Ailk_Bljk_B8F8NSS_BH_Bias_HAS_SAV_UserArgs_MT256x144x128_MI16x16x1_SN_LDSB1_CLR1_GRVWA8_GRVWB8_GSU0_GSUC0_GSUWGMRR0_K1_LBSPPA2048_LBSPPB128_LPA64_LPB8_LRVW8_MIWT4_9_PLR1_SU0_SUM0_SUS128_VWA4_VWB1_WGM8_WGMXCC1_WGMXCCGn1
    SolutionIndex: 42
    SolutionNameMin: Cijk_Ailk_Bljk_B8F8NSS_BH_Bias_HAS_SAV_UserArgs_MT256x144x128_MI16x16x1_SN_LDSB1_CLR1_GRVWA16_GRVWB8_GSU0_GSUC0_GSUWGMRR0_K1_LBSPPA2048_LBSPPB128_LPA64_LPB8_LRVW8_MIWT4_9_PLR1_SU0_SUM0_SUS128_VWA4_VWB1_WGM8_WGMXCC1_WGMXCCGn1
    SolutionIndex: 43
    SolutionNameMin: Cijk_Ailk_Bljk_B8F8NSS_BH_Bias_HAS_SAV_UserArgs_MT64x144x128_MI16x16x1_SN_LDSB1_CLR1_GRVWA8_GRVWB8_GSU0_GSUC0_GSUWGMRR0_K1_LBSPPA512_LBSPPB128_LPA16_LPB8_LRVW8_MIWT1_9_PLR1_SU0_SUM0_SUS128_VWA1_VWB1_WGM1_WGMXCC1_WGMXCCGn1
    SolutionIndex: 44
    SolutionNameMin: Cijk_Ailk_Bljk_B8F8NSS_BH_Bias_HAS_SAV_UserArgs_MT64x144x128_MI16x16x1_SN_LDSB1_CLR1_GRVWA16_GRVWB8_GSU0_GSUC0_GSUWGMRR0_K1_LBSPPA512_LBSPPB128_LPA16_LPB8_LRVW8_MIWT1_9_PLR1_SU0_SUM0_SUS128_VWA1_VWB1_WGM1_WGMXCC1_WGMXCCGn1
    SolutionIndex: 45
    SolutionNameMin: Cijk_Ailk_Bljk_B8F8NSS_BH_Bias_HAS_SAV_UserArgs_MT128x144x128_MI16x16x1_SN_LDSB1_CLR1_GRVWA16_GRVWB8_GSU0_GSUC0_GSUWGMRR0_K1_LBSPPA1024_LBSPPB128_LPA32_LPB8_LRVW8_MIWT2_9_PLR1_SU0_SUM0_SUS128_VWA2_VWB1_WGM1_WGMXCC1_WGMXCCGn1
    SolutionIndex: 46
    SolutionNameMin: Cijk_Ailk_Bljk_B8F8NSS_BH_Bias_HAS_SAV_UserArgs_MT128x144x128_MI16x16x1_SN_LDSB1_CLR1_GRVWA16_GRVWB8_GSU0_GSUC0_GSUWGMRR0_K1_LBSPPA1024_LBSPPB128_LPA32_LPB8_LRVW8_MIWT2_9_PLR1_SU0_SUM0_SUS128_VWA2_VWB1_WGM6_WGMXCC1_WGMXCCGn1
    SolutionIndex: 47
    SolutionNameMin: Cijk_Ailk_Bljk_B8F8NSS_BH_Bias_HAS_SAV_UserArgs_MT128x144x128_MI16x16x1_SN_LDSB1_CLR1_GRVWA8_GRVWB8_GSU0_GSUC0_GSUWGMRR0_K1_LBSPPA1024_LBSPPB128_LPA32_LPB8_LRVW8_MIWT2_9_PLR1_SU0_SUM0_SUS128_VWA2_VWB1_WGM8_WGMXCC1_WGMXCCGn1
    SolutionIndex: 48
    SolutionNameMin: Cijk_Ailk_Bljk_B8F8NSS_BH_Bias_HAS_SAV_UserArgs_MT128x144x128_MI16x16x1_SN_LDSB1_CLR1_GRVWA16_GRVWB8_GSU0_GSUC0_GSUWGMRR0_K1_LBSPPA1024_LBSPPB128_LPA32_LPB8_LRVW8_MIWT2_9_PLR1_SU0_SUM0_SUS128_VWA2_VWB1_WGM8_WGMXCC1_WGMXCCGn1
    SolutionIndex: 49
    SolutionNameMin: Cijk_Ailk_Bljk_B8F8NSS_BH_Bias_HAS_SAV_UserArgs_MT128x128x128_MI16x16x1_SN_LDSB1_CLR1_GRVWA16_GRVWB16_GSU0_GSUC0_GSUWGMRR0_K1_LBSPPA1024_LBSPPB512_LPA64_LPB16_LRVW8_MIWT4_4_PLR1_SU0_SUM0_SUS128_VWA4_VWB4_WGM1_WGMXCC1_WGMXCCGn1
    SolutionIndex: 50
    SolutionNameMin: Cijk_Ailk_Bljk_B8F8NSS_BH_Bias_HAS_SAV_UserArgs_MT128x128x128_MI16x16x1_SN_LDSB1_CLR1_GRVWA16_GRVWB16_GSU0_GSUC0_GSUWGMRR0_K1_LBSPPA1024_LBSPPB512_LPA64_LPB16_LRVW8_MIWT4_4_PLR1_SU0_SUM0_SUS128_VWA4_VWB4_WGM4_WGMXCC1_WGMXCCGn1
    SolutionIndex: 51
    SolutionNameMin: Cijk_Ailk_Bljk_B8F8NSS_BH_Bias_HAS_SAV_UserArgs_MT128x128x128_MI16x16x1_SN_LDSB1_CLR1_GRVWA16_GRVWB16_GSU0_GSUC0_GSUWGMRR0_K1_LBSPPA1024_LBSPPB512_LPA64_LPB16_LRVW8_MIWT4_4_PLR1_SU0_SUM0_SUS128_VWA4_VWB4_WGM6_WGMXCC1_WGMXCCGn1
    SolutionIndex: 52
    SolutionNameMin: Cijk_Ailk_Bljk_B8F8NSS_BH_Bias_HAS_SAV_UserArgs_MT128x128x128_MI16x16x1_SN_LDSB1_CLR1_GRVWA16_GRVWB16_GSU0_GSUC0_GSUWGMRR0_K1_LBSPPA1024_LBSPPB512_LPA64_LPB16_LRVW8_MIWT4_4_PLR1_SU0_SUM0_SUS128_VWA4_VWB4_WGM8_WGMXCC1_WGMXCCGn1
    SolutionIndex: 53
    SolutionNameMin: Cijk_Ailk_Bljk_B8F8NSS_BH_Bias_HAS_SAV_UserArgs_MT64x128x128_MI16x16x1_SN_LDSB1_CLR1_GRVWA16_GRVWB16_GSU0_GSUC0_GSUWGMRR0_K1_LBSPPA512_LBSPPB512_LPA32_LPB16_LRVW8_MIWT2_4_PLR1_SU0_SUM0_SUS128_VWA2_VWB4_WGM1_WGMXCC1_WGMXCCGn1
    SolutionIndex: 54
    SolutionNameMin: Cijk_Ailk_Bljk_B8F8NSS_BH_Bias_HAS_SAV_UserArgs_MT64x128x128_MI16x16x1_SN_LDSB1_CLR1_GRVWA16_GRVWB16_GSU0_GSUC0_GSUWGMRR0_K1_LBSPPA512_LBSPPB512_LPA32_LPB16_LRVW8_MIWT2_4_PLR1_SU0_SUM0_SUS128_VWA2_VWB4_WGM4_WGMXCC1_WGMXCCGn1
    SolutionIndex: 55
    SolutionNameMin: Cijk_Ailk_Bljk_B8F8NSS_BH_Bias_HAS_SAV_UserArgs_MT64x128x128_MI16x16x1_SN_LDSB1_CLR1_GRVWA16_GRVWB16_GSU0_GSUC0_GSUWGMRR0_K1_LBSPPA512_LBSPPB512_LPA32_LPB16_LRVW8_MIWT2_4_PLR1_SU0_SUM0_SUS128_VWA2_VWB4_WGM6_WGMXCC1_WGMXCCGn1
    SolutionIndex: 56
    SolutionNameMin: Cijk_Ailk_Bljk_B8F8NSS_BH_Bias_HAS_SAV_UserArgs_MT128x64x128_MI16x16x1_SN_LDSB1_CLR1_GRVWA16_GRVWB16_GSU0_GSUC0_GSUWGMRR0_K1_LBSPPA1024_LBSPPB256_LPA64_LPB16_LRVW8_MIWT4_2_PLR1_SU0_SUM0_SUS128_VWA4_VWB2_WGM1_WGMXCC1_WGMXCCGn1
    SolutionIndex: 57
    SolutionNameMin: Cijk_Ailk_Bljk_B8F8NSS_BH_Bias_HAS_SAV_UserArgs_MT128x64x128_MI16x16x1_SN_LDSB1_CLR1_GRVWA16_GRVWB16_GSU0_GSUC0_GSUWGMRR0_K1_LBSPPA1024_LBSPPB256_LPA64_LPB16_LRVW8_MIWT4_2_PLR1_SU0_SUM0_SUS128_VWA4_VWB2_WGM4_WGMXCC1_WGMXCCGn1
    SolutionIndex: 58
    SolutionNameMin: Cijk_Ailk_Bljk_B8F8NSS_BH_Bias_HAS_SAV_UserArgs_MT128x64x128_MI16x16x1_SN_LDSB1_CLR1_GRVWA16_GRVWB16_GSU0_GSUC0_GSUWGMRR0_K1_LBSPPA1024_LBSPPB256_LPA64_LPB16_LRVW8_MIWT4_2_PLR1_SU0_SUM0_SUS128_VWA4_VWB2_WGM6_WGMXCC1_WGMXCCGn1
    SolutionIndex: 59
    SolutionNameMin: Cijk_Ailk_Bljk_B8F8NSS_BH_Bias_HAS_SAV_UserArgs_MT128x64x128_MI16x16x1_SN_LDSB1_CLR1_GRVWA16_GRVWB16_GSU0_GSUC0_GSUWGMRR0_K1_LBSPPA1024_LBSPPB256_LPA64_LPB16_LRVW8_MIWT4_2_PLR1_SU0_SUM0_SUS128_VWA4_VWB2_WGM8_WGMXCC1_WGMXCCGn1
    SolutionIndex: 60
    SolutionNameMin: Cijk_Ailk_Bljk_B8F8NSS_BH_Bias_HAS_SAV_UserArgs_MT64x64x128_MI16x16x1_SN_LDSB1_CLR1_GRVWA16_GRVWB8_GSU0_GSUC0_GSUWGMRR0_K1_LBSPPA512_LBSPPB256_LPA32_LPB8_LRVW8_MIWT2_2_PLR1_SU0_SUM0_SUS128_VWA2_VWB2_WGM1_WGMXCC1_WGMXCCGn1
    SolutionIndex: 61
    SolutionNameMin: Cijk_Ailk_Bljk_B8F8NSS_BH_Bias_HAS_SAV_UserArgs_MT64x64x128_MI16x16x1_SN_LDSB1_CLR1_GRVWA8_GRVWB16_GSU0_GSUC0_GSUWGMRR0_K1_LBSPPA512_LBSPPB256_LPA32_LPB16_LRVW8_MIWT2_2_PLR1_SU0_SUM0_SUS128_VWA2_VWB2_WGM1_WGMXCC1_WGMXCCGn1
    SolutionIndex: 62
    SolutionNameMin: Cijk_Ailk_Bljk_B8F8NSS_BH_Bias_HAS_SAV_UserArgs_MT64x64x128_MI16x16x1_SN_LDSB1_CLR1_GRVWA16_GRVWB16_GSU0_GSUC0_GSUWGMRR0_K1_LBSPPA512_LBSPPB256_LPA32_LPB16_LRVW8_MIWT2_2_PLR1_SU0_SUM0_SUS128_VWA2_VWB2_WGM1_WGMXCC1_WGMXCCGn1
    SolutionIndex: 63
    SolutionNameMin: Cijk_Ailk_Bljk_B8F8NSS_BH_Bias_HAS_SAV_UserArgs_MT64x64x128_MI16x16x1_SN_LDSB1_CLR1_GRVWA16_GRVWB8_GSU0_GSUC0_GSUWGMRR0_K1_LBSPPA512_LBSPPB256_LPA32_LPB8_LRVW8_MIWT2_2_PLR1_SU0_SUM0_SUS128_VWA2_VWB2_WGM4_WGMXCC1_WGMXCCGn1
    SolutionIndex: 64
    SolutionNameMin: Cijk_Ailk_Bljk_B8F8NSS_BH_Bias_HAS_SAV_UserArgs_MT64x64x128_MI16x16x1_SN_LDSB1_CLR1_GRVWA16_GRVWB16_GSU0_GSUC0_GSUWGMRR0_K1_LBSPPA512_LBSPPB256_LPA32_LPB16_LRVW8_MIWT2_2_PLR1_SU0_SUM0_SUS128_VWA2_VWB2_WGM4_WGMXCC1_WGMXCCGn1
    SolutionIndex: 65
    SolutionNameMin: Cijk_Ailk_Bljk_B8F8NSS_BH_Bias_HAS_SAV_UserArgs_MT64x64x128_MI16x16x1_SN_LDSB1_CLR1_GRVWA16_GRVWB8_GSU0_GSUC0_GSUWGMRR0_K1_LBSPPA512_LBSPPB256_LPA32_LPB8_LRVW8_MIWT2_2_PLR1_SU0_SUM0_SUS128_VWA2_VWB2_WGM6_WGMXCC1_WGMXCCGn1
    SolutionIndex: 66
    SolutionNameMin: Cijk_Ailk_Bljk_B8F8NSS_BH_Bias_HAS_SAV_UserArgs_MT64x64x128_MI16x16x1_SN_LDSB1_CLR1_GRVWA16_GRVWB16_GSU0_GSUC0_GSUWGMRR0_K1_LBSPPA512_LBSPPB256_LPA32_LPB16_LRVW8_MIWT2_2_PLR1_SU0_SUM0_SUS128_VWA2_VWB2_WGM6_WGMXCC1_WGMXCCGn1
    SolutionIndex: 67
    SolutionNameMin: Cijk_Ailk_Bljk_B8F8NSS_BH_Bias_HAS_SAV_UserArgs_MT64x64x128_MI16x16x1_SN_LDSB1_CLR1_GRVWA16_GRVWB16_GSU0_GSUC0_GSUWGMRR0_K1_LBSPPA512_LBSPPB256_LPA32_LPB16_LRVW8_MIWT2_2_PLR1_SU0_SUM0_SUS128_VWA2_VWB2_WGM8_WGMXCC1_WGMXCCGn1
    SolutionIndex: 68
    SolutionNameMin: Cijk_Ailk_Bljk_B8F8NSS_BH_Bias_HAS_SAV_UserArgs_MT32x64x128_MI16x16x1_SN_LDSB0_CLR1_GRVWA8_GRVWB16_GSU0_GSUC0_GSUWGMRR0_K1_LBSPPA256_LBSPPB256_LPA16_LPB16_LRVW8_MIWT1_2_PLR1_SU0_SUM0_SUS128_VWA1_VWB2_WGM1_WGMXCC1_WGMXCCGn1
    SolutionIndex: 69
    SolutionNameMin: Cijk_Ailk_Bljk_B8F8NSS_BH_Bias_HAS_SAV_UserArgs_MT32x64x128_MI16x16x1_SN_LDSB0_CLR1_GRVWA8_GRVWB16_GSU0_GSUC0_GSUWGMRR0_K1_LBSPPA256_LBSPPB256_LPA16_LPB16_LRVW8_MIWT1_2_PLR1_SU0_SUM0_SUS128_VWA1_VWB2_WGM6_WGMXCC1_WGMXCCGn1
    SolutionIndex: 70
    SolutionNameMin: Cijk_Ailk_Bljk_B8F8NSS_BH_Bias_HAS_SAV_UserArgs_MT32x64x128_MI16x16x1_SN_LDSB0_CLR1_GRVWA16_GRVWB16_GSU0_GSUC0_GSUWGMRR0_K1_LBSPPA256_LBSPPB256_LPA16_LPB16_LRVW8_MIWT1_2_PLR1_SU0_SUM0_SUS128_VWA1_VWB2_WGM6_WGMXCC1_WGMXCCGn1
    SolutionIndex: 71
    SolutionNameMin: Cijk_Ailk_Bljk_B8F8NSS_BH_Bias_HAS_SAV_UserArgs_MT64x32x128_MI16x16x1_SN_LDSB0_CLR1_GRVWA8_GRVWB8_GSU0_GSUC0_GSUWGMRR0_K1_LBSPPA512_LBSPPB128_LPA32_LPB8_LRVW8_MIWT2_1_PLR1_SU0_SUM0_SUS128_VWA2_VWB1_WGM1_WGMXCC1_WGMXCCGn1
    SolutionIndex: 72
    SolutionNameMin: Cijk_Ailk_Bljk_B8F8NSS_BH_Bias_HAS_SAV_UserArgs_MT64x32x128_MI16x16x1_SN_LDSB0_CLR1_GRVWA16_GRVWB8_GSU0_GSUC0_GSUWGMRR0_K1_LBSPPA512_LBSPPB128_LPA32_LPB8_LRVW8_MIWT2_1_PLR1_SU0_SUM0_SUS128_VWA2_VWB1_WGM1_WGMXCC1_WGMXCCGn1
    SolutionIndex: 73
    SolutionNameMin: Cijk_Ailk_Bljk_B8F8NSS_BH_Bias_HAS_SAV_UserArgs_MT64x32x128_MI16x16x1_SN_LDSB0_CLR1_GRVWA8_GRVWB16_GSU0_GSUC0_GSUWGMRR0_K1_LBSPPA512_LBSPPB128_LPA32_LPB16_LRVW8_MIWT2_1_PLR1_SU0_SUM0_SUS128_VWA2_VWB1_WGM1_WGMXCC1_WGMXCCGn1
    SolutionIndex: 74
    SolutionNameMin: Cijk_Ailk_Bljk_B8F8NSS_BH_Bias_HAS_SAV_UserArgs_MT64x32x128_MI16x16x1_SN_LDSB0_CLR1_GRVWA16_GRVWB16_GSU0_GSUC0_GSUWGMRR0_K1_LBSPPA512_LBSPPB128_LPA32_LPB16_LRVW8_MIWT2_1_PLR1_SU0_SUM0_SUS128_VWA2_VWB1_WGM1_WGMXCC1_WGMXCCGn1
    SolutionIndex: 75
    SolutionNameMin: Cijk_Ailk_Bljk_B8F8NSS_BH_Bias_HAS_SAV_UserArgs_MT32x32x128_MI16x16x1_SN_LDSB0_CLR1_GRVWA8_GRVWB8_GSU0_GSUC0_GSUWGMRR0_K1_LBSPPA256_LBSPPB128_LPA16_LPB8_LRVW8_MIWT1_1_PLR1_SU0_SUM0_SUS128_VWA1_VWB1_WGM1_WGMXCC1_WGMXCCGn1
    SolutionIndex: 76
    SolutionNameMin: Cijk_Ailk_Bljk_B8F8NSS_BH_Bias_HAS_SAV_UserArgs_MT32x32x128_MI16x16x1_SN_LDSB0_CLR1_GRVWA16_GRVWB8_GSU0_GSUC0_GSUWGMRR0_K1_LBSPPA256_LBSPPB128_LPA16_LPB8_LRVW8_MIWT1_1_PLR1_SU0_SUM0_SUS128_VWA1_VWB1_WGM1_WGMXCC1_WGMXCCGn1
    SolutionIndex: 77
    SolutionNameMin: Cijk_Ailk_Bljk_B8F8NSS_BH_Bias_HAS_SAV_UserArgs_MT32x32x128_MI16x16x1_SN_LDSB0_CLR1_GRVWA8_GRVWB16_GSU0_GSUC0_GSUWGMRR0_K1_LBSPPA256_LBSPPB128_LPA16_LPB16_LRVW8_MIWT1_1_PLR1_SU0_SUM0_SUS128_VWA1_VWB1_WGM1_WGMXCC1_WGMXCCGn1
    SolutionIndex: 78
    SolutionNameMin: Cijk_Ailk_Bljk_B8F8NSS_BH_Bias_HAS_SAV_UserArgs_MT32x32x128_MI16x16x1_SN_LDSB0_CLR1_GRVWA16_GRVWB16_GSU0_GSUC0_GSUWGMRR0_K1_LBSPPA256_LBSPPB128_LPA16_LPB16_LRVW8_MIWT1_1_PLR1_SU0_SUM0_SUS128_VWA1_VWB1_WGM1_WGMXCC1_WGMXCCGn1
    SolutionIndex: 79
    SolutionNameMin: Cijk_Ailk_Bljk_B8F8NSS_BH_Bias_HAS_SAV_UserArgs_MT64x64x256_MI16x16x1_SN_LDSB1_CLR1_GRVWA16_GRVWB16_GSU0_GSUC0_GSUWGMRR0_K1_LBSPPA512_LBSPPB512_LPA32_LPB16_LRVW8_MIWT2_2_PLR1_SU0_SUM0_SUS256_VWA2_VWB2_WGM1_WGMXCC1_WGMXCCGn1
    SolutionIndex: 80
    SolutionNameMin: Cijk_Ailk_Bljk_B8F8NSS_BH_Bias_HAS_SAV_UserArgs_MT64x32x256_MI16x16x1_SN_LDSB1_CLR1_GRVWA16_GRVWB16_GSU0_GSUC0_GSUWGMRR0_K1_LBSPPA512_LBSPPB256_LPA32_LPB16_LRVW8_MIWT2_1_PLR1_SU0_SUM0_SUS256_VWA2_VWB1_WGM1_WGMXCC1_WGMXCCGn1
    SolutionIndex: 81
    SolutionNameMin: Cijk_Ailk_Bljk_B8F8NSS_BH_Bias_HAS_SAV_UserArgs_MT64x32x256_MI16x16x1_SN_LDSB1_CLR1_GRVWA16_GRVWB16_GSU0_GSUC0_GSUWGMRR0_K1_LBSPPA512_LBSPPB256_LPA32_LPB16_LRVW8_MIWT2_1_PLR1_SU0_SUM0_SUS256_VWA2_VWB1_WGM4_WGMXCC1_WGMXCCGn1
    SolutionIndex: 82
    SolutionNameMin: Cijk_Ailk_Bljk_B8F8NSS_BH_Bias_HAS_SAV_UserArgs_MT64x32x256_MI16x16x1_SN_LDSB1_CLR1_GRVWA16_GRVWB16_GSU0_GSUC0_GSUWGMRR0_K1_LBSPPA512_LBSPPB256_LPA32_LPB16_LRVW8_MIWT2_1_PLR1_SU0_SUM0_SUS256_VWA2_VWB1_WGM8_WGMXCC1_WGMXCCGn1
    SolutionIndex: 83
    SolutionNameMin: Cijk_Ailk_Bljk_B8F8NSS_BH_Bias_HAS_SAV_UserArgs_MT32x32x256_MI16x16x1_SN_LDSB1_CLR1_GRVWA8_GRVWB16_GSU0_GSUC0_GSUWGMRR0_K1_LBSPPA256_LBSPPB256_LPA16_LPB16_LRVW8_MIWT1_1_PLR1_SU0_SUM0_SUS256_VWA1_VWB1_WGM1_WGMXCC1_WGMXCCGn1
    SolutionIndex: 84
    SolutionNameMin: Cijk_Ailk_Bljk_B8F8NSS_BH_Bias_HAS_SAV_UserArgs_MT32x32x256_MI16x16x1_SN_LDSB1_CLR1_GRVWA16_GRVWB16_GSU0_GSUC0_GSUWGMRR0_K1_LBSPPA256_LBSPPB256_LPA16_LPB16_LRVW8_MIWT1_1_PLR1_SU0_SUM0_SUS256_VWA1_VWB1_WGM4_WGMXCC1_WGMXCCGn1
    SolutionIndex: 85
    SolutionNameMin: Cijk_Ailk_Bljk_B8F8NSS_BH_Bias_HAS_SAV_UserArgs_MT32x32x256_MI16x16x1_SN_LDSB1_CLR1_GRVWA8_GRVWB16_GSU0_GSUC0_GSUWGMRR0_K1_LBSPPA256_LBSPPB256_LPA16_LPB16_LRVW8_MIWT1_1_PLR1_SU0_SUM0_SUS256_VWA1_VWB1_WGM6_WGMXCC1_WGMXCCGn1
    SolutionIndex: 86
    SolutionNameMin: Cijk_Ailk_Bljk_B8F8NSS_BH_Bias_HAS_SAV_UserArgs_MT32x32x256_MI16x16x1_SN_LDSB1_CLR1_GRVWA16_GRVWB16_GSU0_GSUC0_GSUWGMRR0_K1_LBSPPA256_LBSPPB256_LPA16_LPB16_LRVW8_MIWT1_1_PLR1_SU0_SUM0_SUS256_VWA1_VWB1_WGM8_WGMXCC1_WGMXCCGn1
- - - [128, 128, 1, 128, 128, 128, 128, 128]
    - [77, 0.57]
  - - [128, 128, 1, 256, 128, 128, 128, 256]
    - [78, 1.02]
  - - [128, 128, 1, 512, 128, 128, 128, 512]
    - [77, 1.76]
  - - [128, 128, 1, 1024, 128, 128, 128, 1024]
    - [75, 2.77]
  - - [128, 128, 1, 2048, 128, 128, 128, 2048]
    - [75, 3.83]
  - - [128, 128, 1, 4096, 128, 128, 128, 4096]
    - [75, 4.8]
  - - [128, 128, 1, 8192, 128, 128, 128, 8192]
    - [78, 5.47]
  - - [128, 256, 1, 128, 128, 128, 128, 128]
    - [29, 1.14]
  - - [128, 256, 1, 256, 128, 128, 128, 256]
    - [77, 2.07]
  - - [128, 256, 1, 512, 128, 128, 128, 512]
    - [75, 3.56]
  - - [128, 256, 1, 1024, 128, 128, 128, 1024]
    - [75, 5.63]
  - - [128, 256, 1, 2048, 128, 128, 128, 2048]
    - [75, 7.66]
  - - [128, 256, 1, 4096, 128, 128, 128, 4096]
    - [75, 9.71]
  - - [128, 256, 1, 8192, 128, 128, 128, 8192]
    - [75, 11.03]
  - - [128, 512, 1, 128, 128, 128, 128, 128]
    - [75, 2.14]
  - - [128, 512, 1, 256, 128, 128, 128, 256]
    - [75, 4.1]
  - - [128, 512, 1, 512, 128, 128, 128, 512]
    - [75, 6.79]
  - - [128, 512, 1, 1024, 128, 128, 128, 1024]
    - [75, 11.08]
  - - [128, 512, 1, 2048, 128, 128, 128, 2048]
    - [77, 15.2]
  - - [128, 512, 1, 4096, 128, 128, 128, 4096]
    - [75, 19.23]
  - - [128, 512, 1, 8192, 128, 128, 128, 8192]
    - [75, 21.87]
  - - [128, 1024, 1, 128, 128, 128, 128, 128]
    - [29, 4.39]
  - - [128, 1024, 1, 256, 128, 128, 128, 256]
    - [77, 7.95]
  - - [128, 1024, 1, 512, 128, 128, 128, 512]
    - [75, 13.63]
  - - [128, 1024, 1, 1024, 128, 128, 128, 1024]
    - [75, 21.68]
  - - [128, 1024, 1, 2048, 128, 128, 128, 2048]
    - [75, 30.08]
  - - [128, 1024, 1, 4096, 128, 128, 128, 4096]
    - [75, 37.75]
  - - [128, 1024, 1, 8192, 128, 128, 128, 8192]
    - [75, 42.98]
  - - [128, 2048, 1, 128, 128, 128, 128, 128]
    - [73, 7.88]
  - - [128, 2048, 1, 256, 128, 128, 128, 256]
    - [68, 14.23]
  - - [128, 2048, 1, 512, 128, 128, 128, 512]
    - [72, 23.82]
  - - [128, 2048, 1, 1024, 128, 128, 128, 1024]
    - [74, 37.29]
  - - [128, 2048, 1, 2048, 128, 128, 128, 2048]
    - [80, 50.74]
  - - [128, 2048, 1, 4096, 128, 128, 128, 4096]
    - [80, 62.76]
  - - [128, 2048, 1, 8192, 128, 128, 128, 8192]
    - [80, 71.15]
  - - [128, 4096, 1, 128, 128, 128, 128, 128]
    - [24, 13.14]
  - - [128, 4096, 1, 256, 128, 128, 128, 256]
    - [27, 23.33]
  - - [128, 4096, 1, 512, 128, 128, 128, 512]
    - [26, 38.59]
  - - [128, 4096, 1, 1024, 128, 128, 128, 1024]
    - [60, 59.16]
  - - [128, 4096, 1, 2048, 128, 128, 128, 2048]
    - [79, 80.66]
  - - [128, 4096, 1, 4096, 128, 128, 128, 4096]
    - [79, 99.32]
  - - [128, 4096, 1, 8192, 128, 128, 128, 8192]
    - [79, 111.68]
  - - [128, 8192, 1, 128, 128, 128, 128, 128]
    - [21, 21.35]
  - - [128, 8192, 1, 256, 128, 128, 128, 256]
    - [16, 38.4]
  - - [128, 8192, 1, 512, 128, 128, 128, 512]
    - [15, 62.78]
  - - [128, 8192, 1, 1024, 128, 128, 128, 1024]
    - [15, 93.95]
  - - [128, 8192, 1, 2048, 128, 128, 128, 2048]
    - [53, 118.28]
  - - [128, 8192, 1, 4096, 128, 128, 128, 4096]
    - [53, 137.78]
  - - [128, 8192, 1, 8192, 128, 128, 128, 8192]
    - [54, 147.22]
  - - [256, 128, 1, 128, 256, 256, 256, 128]
    - [75, 1.13]
  - - [256, 128, 1, 256, 256, 256, 256, 256]
    - [77, 2.09]
  - - [256, 128, 1, 512, 256, 256, 256, 512]
    - [77, 3.55]
  - - [256, 128, 1, 1024, 256, 256, 256, 1024]
    - [77, 5.63]
  - - [256, 128, 1, 2048, 256, 256, 256, 2048]
    - [75, 7.75]
  - - [256, 128, 1, 4096, 256, 256, 256, 4096]
    - [75, 9.52]
  - - [256, 128, 1, 8192, 256, 256, 256, 8192]
    - [75, 10.9]
  - - [256, 256, 1, 128, 256, 256, 256, 128]
    - [75, 2.14]
  - - [256, 256, 1, 256, 256, 256, 256, 256]
    - [75, 3.9]
  - - [256, 256, 1, 512, 256, 256, 256, 512]
    - [77, 7.01]
  - - [256, 256, 1, 1024, 256, 256, 256, 1024]
    - [75, 10.98]
  - - [256, 256, 1, 2048, 256, 256, 256, 2048]
    - [77, 15.15]
  - - [256, 256, 1, 4096, 256, 256, 256, 4096]
    - [75, 19.13]
  - - [256, 256, 1, 8192, 256, 256, 256, 8192]
    - [75, 21.74]
  - - [256, 512, 1, 128, 256, 256, 256, 128]
    - [77, 4.26]
  - - [256, 512, 1, 256, 256, 256, 256, 256]
    - [77, 7.85]
  - - [256, 512, 1, 512, 256, 256, 256, 512]
    - [77, 13.57]
  - - [256, 512, 1, 1024, 256, 256, 256, 1024]
    - [75, 21.48]
  - - [256, 512, 1, 2048, 256, 256, 256, 2048]
    - [75, 29.82]
  - - [256, 512, 1, 4096, 256, 256, 256, 4096]
    - [75, 37.47]
  - - [256, 512, 1, 8192, 256, 256, 256, 8192]
    - [75, 42.98]
  - - [256, 1024, 1, 128, 256, 256, 256, 128]
    - [68, 8.06]
  - - [256, 1024, 1, 256, 256, 256, 256, 256]
    - [68, 14.18]
  - - [256, 1024, 1, 512, 256, 256, 256, 512]
    - [68, 24.0]
  - - [256, 1024, 1, 1024, 256, 256, 256, 1024]
    - [68, 36.99]
  - - [256, 1024, 1, 2048, 256, 256, 256, 2048]
    - [80, 51.08]
  - - [256, 1024, 1, 4096, 256, 256, 256, 4096]
    - [80, 63.67]
  - - [256, 1024, 1, 8192, 256, 256, 256, 8192]
    - [80, 71.5]
  - - [256, 2048, 1, 128, 256, 256, 256, 128]
    - [27, 13.42]
  - - [256, 2048, 1, 256, 256, 256, 256, 256]
    - [26, 23.89]
  - - [256, 2048, 1, 512, 256, 256, 256, 512]
    - [61, 39.47]
  - - [256, 2048, 1, 1024, 256, 256, 256, 1024]
    - [60, 60.34]
  - - [256, 2048, 1, 2048, 256, 256, 256, 2048]
    - [79, 81.55]
  - - [256, 2048, 1, 4096, 256, 256, 256, 4096]
    - [79, 99.57]
  - - [256, 2048, 1, 8192, 256, 256, 256, 8192]
    - [65, 108.27]
  - - [256, 4096, 1, 128, 256, 256, 256, 128]
    - [9, 21.03]
  - - [256, 4096, 1, 256, 256, 256, 256, 256]
    - [16, 38.03]
  - - [256, 4096, 1, 512, 256, 256, 256, 512]
    - [16, 63.22]
  - - [256, 4096, 1, 1024, 256, 256, 256, 1024]
    - [15, 93.6]
  - - [256, 4096, 1, 2048, 256, 256, 256, 2048]
    - [15, 125.55]
  - - [256, 4096, 1, 4096, 256, 256, 256, 4096]
    - [54, 137.94]
  - - [256, 4096, 1, 8192, 256, 256, 256, 8192]
    - [55, 149.43]
  - - [256, 8192, 1, 128, 256, 256, 256, 128]
    - [43, 31.67]
  - - [256, 8192, 1, 256, 256, 256, 256, 256]
    - [43, 56.35]
  - - [256, 8192, 1, 512, 256, 256, 256, 512]
    - [44, 93.56]
  - - [256, 8192, 1, 1024, 256, 256, 256, 1024]
    - [49, 132.94]
  - - [256, 8192, 1, 2048, 256, 256, 256, 2048]
    - [49, 164.44]
  - - [256, 8192, 1, 4096, 256, 256, 256, 4096]
    - [51, 195.53]
  - - [256, 8192, 1, 8192, 256, 256, 256, 8192]
    - [49, 200.13]
  - - [512, 128, 1, 128, 512, 512, 512, 128]
    - [76, 2.12]
  - - [512, 128, 1, 256, 512, 512, 512, 256]
    - [77, 4.03]
  - - [512, 128, 1, 512, 512, 512, 512, 512]
    - [77, 6.95]
  - - [512, 128, 1, 1024, 512, 512, 512, 1024]
    - [83, 10.58]
  - - [512, 128, 1, 2048, 512, 512, 512, 2048]
    - [75, 15.16]
  - - [512, 128, 1, 4096, 512, 512, 512, 4096]
    - [75, 19.12]
  - - [512, 128, 1, 8192, 512, 512, 512, 8192]
    - [86, 18.03]
  - - [512, 256, 1, 128, 512, 512, 512, 128]
    - [29, 4.22]
  - - [512, 256, 1, 256, 512, 512, 512, 256]
    - [77, 7.86]
  - - [512, 256, 1, 512, 512, 512, 512, 512]
    - [77, 13.45]
  - - [512, 256, 1, 1024, 512, 512, 512, 1024]
    - [75, 21.6]
  - - [512, 256, 1, 2048, 512, 512, 512, 2048]
    - [75, 30.22]
  - - [512, 256, 1, 4096, 512, 512, 512, 4096]
    - [75, 37.57]
  - - [512, 256, 1, 8192, 512, 512, 512, 8192]
    - [84, 34.24]
  - - [512, 512, 1, 128, 512, 512, 512, 128]
    - [71, 7.88]
  - - [512, 512, 1, 256, 512, 512, 512, 256]
    - [68, 13.49]
  - - [512, 512, 1, 512, 512, 512, 512, 512]
    - [68, 24.18]
  - - [512, 512, 1, 1024, 512, 512, 512, 1024]
    - [68, 37.0]
  - - [512, 512, 1, 2048, 512, 512, 512, 2048]
    - [80, 50.69]
  - - [512, 512, 1, 4096, 512, 512, 512, 4096]
    - [80, 62.11]
  - - [512, 512, 1, 8192, 512, 512, 512, 8192]
    - [74, 61.46]
  - - [512, 1024, 1, 128, 512, 512, 512, 128]
    - [24, 12.87]
  - - [512, 1024, 1, 256, 512, 512, 512, 256]
    - [25, 22.87]
  - - [512, 1024, 1, 512, 512, 512, 512, 512]
    - [61, 38.68]
  - - [512, 1024, 1, 1024, 512, 512, 512, 1024]
    - [60, 60.33]
  - - [512, 1024, 1, 2048, 512, 512, 512, 2048]
    - [60, 81.35]
  - - [512, 1024, 1, 4096, 512, 512, 512, 4096]
    - [60, 98.14]
  - - [512, 1024, 1, 8192, 512, 512, 512, 8192]
    - [62, 102.03]
  - - [512, 2048, 1, 128, 512, 512, 512, 128]
    - [21, 21.28]
  - - [512, 2048, 1, 256, 512, 512, 512, 256]
    - [16, 38.34]
  - - [512, 2048, 1, 512, 512, 512, 512, 512]
    - [16, 63.25]
  - - [512, 2048, 1, 1024, 512, 512, 512, 1024]
    - [16, 93.01]
  - - [512, 2048, 1, 2048, 512, 512, 512, 2048]
    - [15, 124.01]
  - - [512, 2048, 1, 4096, 512, 512, 512, 4096]
    - [56, 133.71]
  - - [512, 2048, 1, 8192, 512, 512, 512, 8192]
    - [56, 143.02]
  - - [512, 4096, 1, 128, 512, 512, 512, 128]
    - [14, 31.1]
  - - [512, 4096, 1, 256, 512, 512, 512, 256]
    - [14, 55.19]
  - - [512, 4096, 1, 512, 512, 512, 512, 512]
    - [49, 90.38]
  - - [512, 4096, 1, 1024, 512, 512, 512, 1024]
    - [49, 133.15]
  - - [512, 4096, 1, 2048, 512, 512, 512, 2048]
    - [49, 169.62]
  - - [512, 4096, 1, 4096, 512, 512, 512, 4096]
    - [49, 188.29]
  - - [512, 4096, 1, 8192, 512, 512, 512, 8192]
    - [50, 194.8]
  - - [512, 8192, 1, 128, 512, 512, 512, 128]
    - [48, 39.73]
  - - [512, 8192, 1, 256, 512, 512, 512, 256]
    - [47, 71.01]
  - - [512, 8192, 1, 512, 512, 512, 512, 512]
    - [47, 117.39]
  - - [512, 8192, 1, 1024, 512, 512, 512, 1024]
    - [46, 161.99]
  - - [512, 8192, 1, 2048, 512, 512, 512, 2048]
    - [31, 207.26]
  - - [512, 8192, 1, 4096, 512, 512, 512, 4096]
    - [31, 235.07]
  - - [512, 8192, 1, 8192, 512, 512, 512, 8192]
    - [45, 240.18]
  - - [1024, 128, 1, 128, 1024, 1024, 1024, 128]
    - [77, 4.35]
  - - [1024, 128, 1, 256, 1024, 1024, 1024, 256]
    - [75, 7.95]
  - - [1024, 128, 1, 512, 1024, 1024, 1024, 512]
    - [77, 13.59]
  - - [1024, 128, 1, 1024, 1024, 1024, 1024, 1024]
    - [77, 21.27]
  - - [1024, 128, 1, 2048, 1024, 1024, 1024, 2048]
    - [75, 30.13]
  - - [1024, 128, 1, 4096, 1024, 1024, 1024, 4096]
    - [86, 30.89]
  - - [1024, 128, 1, 8192, 1024, 1024, 1024, 8192]
    - [85, 30.56]
  - - [1024, 256, 1, 128, 1024, 1024, 1024, 128]
    - [73, 7.87]
  - - [1024, 256, 1, 256, 1024, 1024, 1024, 256]
    - [71, 13.93]
  - - [1024, 256, 1, 512, 1024, 1024, 1024, 512]
    - [73, 23.58]
  - - [1024, 256, 1, 1024, 1024, 1024, 1024, 1024]
    - [74, 36.44]
  - - [1024, 256, 1, 2048, 1024, 1024, 1024, 2048]
    - [80, 50.52]
  - - [1024, 256, 1, 4096, 1024, 1024, 1024, 4096]
    - [69, 53.47]
  - - [1024, 256, 1, 8192, 1024, 1024, 1024, 8192]
    - [82, 58.35]
  - - [1024, 512, 1, 128, 1024, 1024, 1024, 128]
    - [23, 13.17]
  - - [1024, 512, 1, 256, 1024, 1024, 1024, 256]
    - [28, 23.38]
  - - [1024, 512, 1, 512, 1024, 1024, 1024, 512]
    - [63, 38.82]
  - - [1024, 512, 1, 1024, 1024, 1024, 1024, 1024]
    - [63, 57.47]
  - - [1024, 512, 1, 2048, 1024, 1024, 1024, 2048]
    - [63, 78.92]
  - - [1024, 512, 1, 4096, 1024, 1024, 1024, 4096]
    - [64, 91.09]
  - - [1024, 512, 1, 8192, 1024, 1024, 1024, 8192]
    - [62, 99.44]
  - - [1024, 1024, 1, 128, 1024, 1024, 1024, 128]
    - [22, 20.47]
  - - [1024, 1024, 1, 256, 1024, 1024, 1024, 256]
    - [16, 36.89]
  - - [1024, 1024, 1, 512, 1024, 1024, 1024, 512]
    - [15, 62.88]
  - - [1024, 1024, 1, 1024, 1024, 1024, 1024, 1024]
    - [15, 94.11]
  - - [1024, 1024, 1, 2048, 1024, 1024, 1024, 2048]
    - [16, 119.67]
  - - [1024, 1024, 1, 4096, 1024, 1024, 1024, 4096]
    - [59, 133.62]
  - - [1024, 1024, 1, 8192, 1024, 1024, 1024, 8192]
    - [57, 141.36]
  - - [1024, 2048, 1, 128, 1024, 1024, 1024, 128]
    - [12, 31.76]
  - - [1024, 2048, 1, 256, 1024, 1024, 1024, 256]
    - [12, 56.02]
  - - [1024, 2048, 1, 512, 1024, 1024, 1024, 512]
    - [49, 91.41]
  - - [1024, 2048, 1, 1024, 1024, 1024, 1024, 1024]
    - [49, 133.13]
  - - [1024, 2048, 1, 2048, 1024, 1024, 1024, 2048]
    - [49, 165.69]
  - - [1024, 2048, 1, 4096, 1024, 1024, 1024, 4096]
    - [50, 192.37]
  - - [1024, 2048, 1, 8192, 1024, 1024, 1024, 8192]
    - [52, 192.42]
  - - [1024, 4096, 1, 128, 1024, 1024, 1024, 128]
    - [5, 37.81]
  - - [1024, 4096, 1, 256, 1024, 1024, 1024, 256]
    - [4, 69.37]
  - - [1024, 4096, 1, 512, 1024, 1024, 1024, 512]
    - [4, 111.53]
  - - [1024, 4096, 1, 1024, 1024, 1024, 1024, 1024]
    - [31, 158.53]
  - - [1024, 4096, 1, 2048, 1024, 1024, 1024, 2048]
    - [37, 204.7]
  - - [1024, 4096, 1, 4096, 1024, 1024, 1024, 4096]
    - [42, 233.92]
  - - [1024, 4096, 1, 8192, 1024, 1024, 1024, 8192]
    - [37, 235.53]
  - - [1024, 8192, 1, 128, 1024, 1024, 1024, 128]
    - [37, 43.83]
  - - [1024, 8192, 1, 256, 1024, 1024, 1024, 256]
    - [40, 79.78]
  - - [1024, 8192, 1, 512, 1024, 1024, 1024, 512]
    - [39, 135.57]
  - - [1024, 8192, 1, 1024, 1024, 1024, 1024, 1024]
    - [40, 190.73]
  - - [1024, 8192, 1, 2048, 1024, 1024, 1024, 2048]
    - [42, 260.28]
  - - [1024, 8192, 1, 4096, 1024, 1024, 1024, 4096]
    - [40, 310.02]
  - - [1024, 8192, 1, 8192, 1024, 1024, 1024, 8192]
    - [42, 346.43]
  - - [2048, 128, 1, 128, 2048, 2048, 2048, 128]
    - [68, 8.06]
  - - [2048, 128, 1, 256, 2048, 2048, 2048, 256]
    - [68, 14.39]
  - - [2048, 128, 1, 512, 2048, 2048, 2048, 512]
    - [68, 24.56]
  - - [2048, 128, 1, 1024, 2048, 2048, 2048, 1024]
    - [68, 37.32]
  - - [2048, 128, 1, 2048, 2048, 2048, 2048, 2048]
    - [70, 43.41]
  - - [2048, 128, 1, 4096, 2048, 2048, 2048, 4096]
    - [81, 52.33]
  - - [2048, 128, 1, 8192, 2048, 2048, 2048, 8192]
    - [82, 59.12]
  - - [2048, 256, 1, 128, 2048, 2048, 2048, 128]
    - [27, 13.76]
  - - [2048, 256, 1, 256, 2048, 2048, 2048, 256]
    - [27, 24.19]
  - - [2048, 256, 1, 512, 2048, 2048, 2048, 512]
    - [26, 40.04]
  - - [2048, 256, 1, 1024, 2048, 2048, 2048, 1024]
    - [60, 59.83]
  - - [2048, 256, 1, 2048, 2048, 2048, 2048, 2048]
    - [66, 75.83]
  - - [2048, 256, 1, 4096, 2048, 2048, 2048, 4096]
    - [64, 91.38]
  - - [2048, 256, 1, 8192, 2048, 2048, 2048, 8192]
    - [66, 102.9]
  - - [2048, 512, 1, 128, 2048, 2048, 2048, 128]
    - [20, 21.83]
  - - [2048, 512, 1, 256, 2048, 2048, 2048, 256]
    - [20, 38.69]
  - - [2048, 512, 1, 512, 2048, 2048, 2048, 512]
    - [19, 62.45]
  - - [2048, 512, 1, 1024, 2048, 2048, 2048, 1024]
    - [18, 89.2]
  - - [2048, 512, 1, 2048, 2048, 2048, 2048, 2048]
    - [59, 113.32]
  - - [2048, 512, 1, 4096, 2048, 2048, 2048, 4096]
    - [59, 135.69]
  - - [2048, 512, 1, 8192, 2048, 2048, 2048, 8192]
    - [58, 144.31]
  - - [2048, 1024, 1, 128, 2048, 2048, 2048, 128]
    - [11, 30.7]
  - - [2048, 1024, 1, 256, 2048, 2048, 2048, 256]
    - [12, 55.51]
  - - [2048, 1024, 1, 512, 2048, 2048, 2048, 512]
    - [10, 88.11]
  - - [2048, 1024, 1, 1024, 2048, 2048, 2048, 1024]
    - [49, 127.69]
  - - [2048, 1024, 1, 2048, 2048, 2048, 2048, 2048]
    - [52, 164.82]
  - - [2048, 1024, 1, 4096, 2048, 2048, 2048, 4096]
    - [50, 191.43]
  - - [2048, 1024, 1, 8192, 2048, 2048, 2048, 8192]
    - [50, 185.46]
  - - [2048, 2048, 1, 128, 2048, 2048, 2048, 128]
    - [4, 37.58]
  - - [2048, 2048, 1, 256, 2048, 2048, 2048, 256]
    - [4, 68.16]
  - - [2048, 2048, 1, 512, 2048, 2048, 2048, 512]
    - [4, 109.32]
  - - [2048, 2048, 1, 1024, 2048, 2048, 2048, 1024]
    - [42, 157.96]
  - - [2048, 2048, 1, 2048, 2048, 2048, 2048, 2048]
    - [39, 204.72]
  - - [2048, 2048, 1, 4096, 2048, 2048, 2048, 4096]
    - [42, 228.61]
  - - [2048, 2048, 1, 8192, 2048, 2048, 2048, 8192]
    - [40, 230.6]
  - - [2048, 4096, 1, 128, 2048, 2048, 2048, 128]
    - [12, 38.68]
  - - [2048, 4096, 1, 256, 2048, 2048, 2048, 256]
    - [4, 70.82]
  - - [2048, 4096, 1, 512, 2048, 2048, 2048, 512]
    - [5, 112.93]
  - - [2048, 4096, 1, 1024, 2048, 2048, 2048, 1024]
    - [3, 164.83]
  - - [2048, 4096, 1, 2048, 2048, 2048, 2048, 2048]
    - [1, 209.14]
  - - [2048, 4096, 1, 4096, 2048, 2048, 2048, 4096]
    - [37, 250.54]
  - - [2048, 4096, 1, 8192, 2048, 2048, 2048, 8192]
    - [40, 301.43]
  - - [2048, 8192, 1, 128, 2048, 2048, 2048, 128]
    - [41, 47.04]
  - - [2048, 8192, 1, 256, 2048, 2048, 2048, 256]
    - [40, 84.42]
  - - [2048, 8192, 1, 512, 2048, 2048, 2048, 512]
    - [37, 140.65]
  - - [2048, 8192, 1, 1024, 2048, 2048, 2048, 1024]
    - [37, 206.08]
  - - [2048, 8192, 1, 2048, 2048, 2048, 2048, 2048]
    - [42, 262.81]
  - - [2048, 8192, 1, 4096, 2048, 2048, 2048, 4096]
    - [42, 304.86]
  - - [2048, 8192, 1, 8192, 2048, 2048, 2048, 8192]
    - [40, 362.33]
  - - [4096, 128, 1, 128, 4096, 4096, 4096, 128]
    - [24, 13.61]
  - - [4096, 128, 1, 256, 4096, 4096, 4096, 256]
    - [26, 23.72]
  - - [4096, 128, 1, 512, 4096, 4096, 4096, 512]
    - [61, 39.59]
  - - [4096, 128, 1, 1024, 4096, 4096, 4096, 1024]
    - [61, 59.26]
  - - [4096, 128, 1, 2048, 4096, 4096, 4096, 2048]
    - [67, 74.64]
  - - [4096, 128, 1, 4096, 4096, 4096, 4096, 4096]
    - [67, 91.48]
  - - [4096, 128, 1, 8192, 4096, 4096, 4096, 8192]
    - [67, 102.05]
  - - [4096, 256, 1, 128, 4096, 4096, 4096, 128]
    - [20, 22.08]
  - - [4096, 256, 1, 256, 4096, 4096, 4096, 256]
    - [20, 38.96]
  - - [4096, 256, 1, 512, 4096, 4096, 4096, 512]
    - [17, 62.0]
  - - [4096, 256, 1, 1024, 4096, 4096, 4096, 1024]
    - [15, 92.68]
  - - [4096, 256, 1, 2048, 4096, 4096, 4096, 2048]
    - [58, 113.65]
  - - [4096, 256, 1, 4096, 4096, 4096, 4096, 4096]
    - [57, 136.25]
  - - [4096, 256, 1, 8192, 4096, 4096, 4096, 8192]
    - [57, 142.36]
  - - [4096, 512, 1, 128, 4096, 4096, 4096, 128]
    - [11, 30.61]
  - - [4096, 512, 1, 256, 4096, 4096, 4096, 256]
    - [12, 53.92]
  - - [4096, 512, 1, 512, 4096, 4096, 4096, 512]
    - [12, 85.1]
  - - [4096, 512, 1, 1024, 4096, 4096, 4096, 1024]
    - [50, 125.25]
  - - [4096, 512, 1, 2048, 4096, 4096, 4096, 2048]
    - [50, 163.68]
  - - [4096, 512, 1, 4096, 4096, 4096, 4096, 4096]
    - [52, 189.76]
  - - [4096, 512, 1, 8192, 4096, 4096, 4096, 8192]
    - [50, 192.11]
  - - [4096, 1024, 1, 128, 4096, 4096, 4096, 128]
    - [42, 36.03]
  - - [4096, 1024, 1, 256, 4096, 4096, 4096, 256]
    - [34, 63.35]
  - - [4096, 1024, 1, 512, 4096, 4096, 4096, 512]
    - [42, 105.62]
  - - [4096, 1024, 1, 1024, 4096, 4096, 4096, 1024]
    - [42, 159.29]
  - - [4096, 1024, 1, 2048, 4096, 4096, 4096, 2048]
    - [42, 206.0]
  - - [4096, 1024, 1, 4096, 4096, 4096, 4096, 4096]
    - [42, 228.37]
  - - [4096, 1024, 1, 8192, 4096, 4096, 4096, 8192]
    - [35, 232.66]
  - - [4096, 2048, 1, 128, 4096, 4096, 4096, 128]
    - [41, 37.27]
  - - [4096, 2048, 1, 256, 4096, 4096, 4096, 256]
    - [4, 67.39]
  - - [4096, 2048, 1, 512, 4096, 4096, 4096, 512]
    - [39, 111.32]
  - - [4096, 2048, 1, 1024, 4096, 4096, 4096, 1024]
    - [42, 164.99]
  - - [4096, 2048, 1, 2048, 4096, 4096, 4096, 2048]
    - [0, 207.26]
  - - [4096, 2048, 1, 4096, 4096, 4096, 4096, 4096]
    - [31, 248.67]
  - - [4096, 2048, 1, 8192, 4096, 4096, 4096, 8192]
    - [30, 280.77]
  - - [4096, 4096, 1, 128, 4096, 4096, 4096, 128]
    - [36, 40.65]
  - - [4096, 4096, 1, 256, 4096, 4096, 4096, 256]
    - [5, 72.02]
  - - [4096, 4096, 1, 512, 4096, 4096, 4096, 512]
    - [12, 118.46]
  - - [4096, 4096, 1, 1024, 4096, 4096, 4096, 1024]
    - [51, 163.03]
  - - [4096, 4096, 1, 2048, 4096, 4096, 4096, 2048]
    - [39, 215.51]
  - - [4096, 4096, 1, 4096, 4096, 4096, 4096, 4096]
    - [39, 265.41]
  - - [4096, 4096, 1, 8192, 4096, 4096, 4096, 8192]
    - [37, 308.11]
  - - [4096, 8192, 1, 128, 4096, 4096, 4096, 128]
    - [36, 48.59]
  - - [4096, 8192, 1, 256, 4096, 4096, 4096, 256]
    - [42, 83.0]
  - - [4096, 8192, 1, 512, 4096, 4096, 4096, 512]
    - [40, 139.92]
  - - [4096, 8192, 1, 1024, 4096, 4096, 4096, 1024]
    - [42, 199.59]
  - - [4096, 8192, 1, 2048, 4096, 4096, 4096, 2048]
    - [39, 244.64]
  - - [4096, 8192, 1, 4096, 4096, 4096, 4096, 4096]
    - [40, 308.49]
  - - [4096, 8192, 1, 8192, 4096, 4096, 4096, 8192]
    - [42, 364.52]
  - - [8192, 128, 1, 128, 8192, 8192, 8192, 128]
    - [20, 21.55]
  - - [8192, 128, 1, 256, 8192, 8192, 8192, 256]
    - [16, 38.46]
  - - [8192, 128, 1, 512, 8192, 8192, 8192, 512]
    - [15, 62.71]
  - - [8192, 128, 1, 1024, 8192, 8192, 8192, 1024]
    - [16, 94.04]
  - - [8192, 128, 1, 2048, 8192, 8192, 8192, 2048]
    - [57, 111.47]
  - - [8192, 128, 1, 4096, 8192, 8192, 8192, 4096]
    - [59, 134.13]
  - - [8192, 128, 1, 8192, 8192, 8192, 8192, 8192]
    - [58, 139.21]
  - - [8192, 256, 1, 128, 8192, 8192, 8192, 128]
    - [12, 29.67]
  - - [8192, 256, 1, 256, 8192, 8192, 8192, 256]
    - [12, 54.07]
  - - [8192, 256, 1, 512, 8192, 8192, 8192, 512]
    - [51, 86.09]
  - - [8192, 256, 1, 1024, 8192, 8192, 8192, 1024]
    - [50, 125.18]
  - - [8192, 256, 1, 2048, 8192, 8192, 8192, 2048]
    - [50, 160.63]
  - - [8192, 256, 1, 4096, 8192, 8192, 8192, 4096]
    - [50, 189.48]
  - - [8192, 256, 1, 8192, 8192, 8192, 8192, 8192]
    - [52, 190.5]
  - - [8192, 512, 1, 128, 8192, 8192, 8192, 128]
    - [7, 36.95]
  - - [8192, 512, 1, 256, 8192, 8192, 8192, 256]
    - [8, 65.89]
  - - [8192, 512, 1, 512, 8192, 8192, 8192, 512]
    - [8, 105.88]
  - - [8192, 512, 1, 1024, 8192, 8192, 8192, 1024]
    - [33, 154.88]
  - - [8192, 512, 1, 2048, 8192, 8192, 8192, 2048]
    - [33, 201.89]
  - - [8192, 512, 1, 4096, 8192, 8192, 8192, 4096]
    - [32, 232.36]
  - - [8192, 512, 1, 8192, 8192, 8192, 8192, 8192]
    - [32, 234.28]
  - - [8192, 1024, 1, 128, 8192, 8192, 8192, 128]
    - [5, 40.02]
  - - [8192, 1024, 1, 256, 8192, 8192, 8192, 256]
    - [4, 73.16]
  - - [8192, 1024, 1, 512, 8192, 8192, 8192, 512]
    - [5, 112.59]
  - - [8192, 1024, 1, 1024, 8192, 8192, 8192, 1024]
    - [42, 162.84]
  - - [8192, 1024, 1, 2048, 8192, 8192, 8192, 2048]
    - [2, 209.8]
  - - [8192, 1024, 1, 4096, 8192, 8192, 8192, 4096]
    - [30, 248.83]
  - - [8192, 1024, 1, 8192, 8192, 8192, 8192, 8192]
    - [30, 295.09]
  - - [8192, 2048, 1, 128, 8192, 8192, 8192, 128]
    - [41, 44.49]
  - - [8192, 2048, 1, 256, 8192, 8192, 8192, 256]
    - [5, 77.9]
  - - [8192, 2048, 1, 512, 8192, 8192, 8192, 512]
    - [39, 128.06]
  - - [8192, 2048, 1, 1024, 8192, 8192, 8192, 1024]
    - [40, 177.02]
  - - [8192, 2048, 1, 2048, 8192, 8192, 8192, 2048]
    - [40, 216.7]
  - - [8192, 2048, 1, 4096, 8192, 8192, 8192, 4096]
    - [40, 260.48]
  - - [8192, 2048, 1, 8192, 8192, 8192, 8192, 8192]
    - [0, 316.64]
  - - [8192, 4096, 1, 128, 8192, 8192, 8192, 128]
    - [6, 42.34]
  - - [8192, 4096, 1, 256, 8192, 8192, 8192, 256]
    - [13, 75.22]
  - - [8192, 4096, 1, 512, 8192, 8192, 8192, 512]
    - [4, 126.6]
  - - [8192, 4096, 1, 1024, 8192, 8192, 8192, 1024]
    - [31, 174.86]
  - - [8192, 4096, 1, 2048, 8192, 8192, 8192, 2048]
    - [33, 227.02]
  - - [8192, 4096, 1, 4096, 8192, 8192, 8192, 4096]
    - [37, 280.74]
  - - [8192, 4096, 1, 8192, 8192, 8192, 8192, 8192]
    - [0, 323.48]
  - - [8192, 8192, 1, 128, 8192, 8192, 8192, 128]
    - [38, 41.73]
  - - [8192, 8192, 1, 256, 8192, 8192, 8192, 256]
    - [4, 73.7]
  - - [8192, 8192, 1, 512, 8192, 8192, 8192, 512]
    - [37, 121.46]
  - - [8192, 8192, 1, 1024, 8192, 8192, 8192, 1024]
    - [36, 181.95]
  - - [8192, 8192, 1, 2048, 8192, 8192, 8192, 2048]
    - [37, 250.35]
  - - [8192, 8192, 1, 4096, 8192, 8192, 8192, 4096]
    - [40, 314.83]
  - - [8192, 8192, 1, 8192, 8192, 8192, 8192, 8192]
    - [40, 369.04]
- null
- null
- ExperimentalStreamK
- GridBased
