projects/hipblaslt/library/src/amd_detail/rocblaslt/src/Tensile/Logic/asm_full/aquavanjaram/gfx942_228cu/StreamK/aquavanjaram942_Cijk_Alik_Bjlk_F8NHS_BH_Bias_HAS_SAV_UserArgs.yaml
- {MinimumRequiredVersion: 4.33.0}
- aquavanjaram942
- {Architecture: gfx942, CUCount: 228}
- [Device 0049, Device 0050]
    SolutionIndex: 0
    SolutionNameMin: Cijk_Alik_Bjlk_F8NHS_BH_Bias_HAS_SAV_UserArgs_MT256x256x64_MI16x16x1_SN_LDSB1_CLR1_GRVWA8_GRVWB8_GSU0_GSUC0_GSUWGMRR0_K1_LBSPPA512_LBSPPB2048_LPA8_LPB0_LRVW8_MIWT8_8_PLR1_SU0_SUM0_SUS64_VWA8_VWB8_WGM1_WGMXCC1_WGMXCCGn1
    SolutionIndex: 1
    SolutionNameMin: Cijk_Alik_Bjlk_F8NHS_BH_Bias_HAS_SAV_UserArgs_MT256x256x64_MI16x16x1_SN_LDSB1_CLR1_GRVWA8_GRVWB16_GSU0_GSUC0_GSUWGMRR0_K1_LBSPPA512_LBSPPB2048_LPA8_LPB0_LRVW8_MIWT8_8_PLR1_SU0_SUM0_SUS64_VWA8_VWB8_WGM1_WGMXCC1_WGMXCCGn1
    SolutionIndex: 2
    SolutionNameMin: Cijk_Alik_Bjlk_F8NHS_BH_Bias_HAS_SAV_UserArgs_MT256x256x64_MI16x16x1_SN_LDSB1_CLR1_GRVWA16_GRVWB16_GSU0_GSUC0_GSUWGMRR0_K1_LBSPPA512_LBSPPB2048_LPA16_LPB0_LRVW8_MIWT8_8_PLR1_SU0_SUM0_SUS64_VWA8_VWB8_WGM1_WGMXCC1_WGMXCCGn1
    SolutionIndex: 3
    SolutionNameMin: Cijk_Alik_Bjlk_F8NHS_BH_Bias_HAS_SAV_UserArgs_MT256x256x64_MI16x16x1_SN_LDSB1_CLR1_GRVWA8_GRVWB16_GSU0_GSUC0_GSUWGMRR0_K1_LBSPPA512_LBSPPB2048_LPA8_LPB0_LRVW8_MIWT8_8_PLR1_SU0_SUM0_SUS64_VWA8_VWB8_WGM4_WGMXCC1_WGMXCCGn1
    SolutionIndex: 4
    SolutionNameMin: Cijk_Alik_Bjlk_F8NHS_BH_Bias_HAS_SAV_UserArgs_MT256x256x64_MI16x16x1_SN_LDSB1_CLR1_GRVWA16_GRVWB16_GSU0_GSUC0_GSUWGMRR0_K1_LBSPPA512_LBSPPB2048_LPA16_LPB0_LRVW8_MIWT8_8_PLR1_SU0_SUM0_SUS64_VWA8_VWB8_WGM4_WGMXCC1_WGMXCCGn1
    SolutionIndex: 5
    SolutionNameMin: Cijk_Alik_Bjlk_F8NHS_BH_Bias_HAS_SAV_UserArgs_MT256x256x64_MI16x16x1_SN_LDSB1_CLR1_GRVWA8_GRVWB8_GSU0_GSUC0_GSUWGMRR0_K1_LBSPPA512_LBSPPB2048_LPA8_LPB0_LRVW8_MIWT8_8_PLR1_SU0_SUM0_SUS64_VWA8_VWB8_WGM6_WGMXCC1_WGMXCCGn1
    SolutionIndex: 6
    SolutionNameMin: Cijk_Alik_Bjlk_F8NHS_BH_Bias_HAS_SAV_UserArgs_MT256x256x64_MI16x16x1_SN_LDSB1_CLR1_GRVWA16_GRVWB8_GSU0_GSUC0_GSUWGMRR0_K1_LBSPPA512_LBSPPB2048_LPA16_LPB0_LRVW8_MIWT8_8_PLR1_SU0_SUM0_SUS64_VWA8_VWB8_WGM6_WGMXCC1_WGMXCCGn1
    SolutionIndex: 7
    SolutionNameMin: Cijk_Alik_Bjlk_F8NHS_BH_Bias_HAS_SAV_UserArgs_MT256x256x64_MI16x16x1_SN_LDSB1_CLR1_GRVWA8_GRVWB16_GSU0_GSUC0_GSUWGMRR0_K1_LBSPPA512_LBSPPB2048_LPA8_LPB0_LRVW8_MIWT8_8_PLR1_SU0_SUM0_SUS64_VWA8_VWB8_WGM6_WGMXCC1_WGMXCCGn1
    SolutionIndex: 8
    SolutionNameMin: Cijk_Alik_Bjlk_F8NHS_BH_Bias_HAS_SAV_UserArgs_MT256x256x64_MI16x16x1_SN_LDSB1_CLR1_GRVWA16_GRVWB16_GSU0_GSUC0_GSUWGMRR0_K1_LBSPPA512_LBSPPB2048_LPA16_LPB0_LRVW8_MIWT8_8_PLR1_SU0_SUM0_SUS64_VWA8_VWB8_WGM6_WGMXCC1_WGMXCCGn1
    SolutionIndex: 9
    SolutionNameMin: Cijk_Alik_Bjlk_F8NHS_BH_Bias_HAS_SAV_UserArgs_MT256x256x64_MI16x16x1_SN_LDSB1_CLR1_GRVWA8_GRVWB16_GSU0_GSUC0_GSUWGMRR0_K1_LBSPPA512_LBSPPB2048_LPA8_LPB0_LRVW8_MIWT8_8_PLR1_SU0_SUM0_SUS64_VWA8_VWB8_WGM8_WGMXCC1_WGMXCCGn1
    SolutionIndex: 10
    SolutionNameMin: Cijk_Alik_Bjlk_F8NHS_BH_Bias_HAS_SAV_UserArgs_MT256x256x64_MI16x16x1_SN_LDSB1_CLR1_GRVWA16_GRVWB16_GSU0_GSUC0_GSUWGMRR0_K1_LBSPPA512_LBSPPB2048_LPA16_LPB0_LRVW8_MIWT8_8_PLR1_SU0_SUM0_SUS64_VWA8_VWB8_WGM8_WGMXCC1_WGMXCCGn1
    SolutionIndex: 11
    SolutionNameMin: Cijk_Alik_Bjlk_F8NHS_BH_Bias_HAS_SAV_UserArgs_MT128x256x64_MI16x16x1_SN_LDSB1_CLR1_GRVWA8_GRVWB16_GSU0_GSUC0_GSUWGMRR0_K1_LBSPPA256_LBSPPB2048_LPA8_LPB0_LRVW8_MIWT4_8_PLR1_SU0_SUM0_SUS64_VWA4_VWB8_WGM1_WGMXCC1_WGMXCCGn1
    SolutionIndex: 12
    SolutionNameMin: Cijk_Alik_Bjlk_F8NHS_BH_Bias_HAS_SAV_UserArgs_MT128x256x64_MI16x16x1_SN_LDSB1_CLR1_GRVWA16_GRVWB8_GSU0_GSUC0_GSUWGMRR0_K1_LBSPPA256_LBSPPB2048_LPA16_LPB0_LRVW8_MIWT4_8_PLR1_SU0_SUM0_SUS64_VWA4_VWB8_WGM4_WGMXCC1_WGMXCCGn1
    SolutionIndex: 13
    SolutionNameMin: Cijk_Alik_Bjlk_F8NHS_BH_Bias_HAS_SAV_UserArgs_MT128x256x64_MI16x16x1_SN_LDSB1_CLR1_GRVWA8_GRVWB16_GSU0_GSUC0_GSUWGMRR0_K1_LBSPPA256_LBSPPB2048_LPA8_LPB0_LRVW8_MIWT4_8_PLR1_SU0_SUM0_SUS64_VWA4_VWB8_WGM4_WGMXCC1_WGMXCCGn1
    SolutionIndex: 14
    SolutionNameMin: Cijk_Alik_Bjlk_F8NHS_BH_Bias_HAS_SAV_UserArgs_MT256x128x64_MI16x16x1_SN_LDSB1_CLR1_GRVWA8_GRVWB8_GSU0_GSUC0_GSUWGMRR0_K1_LBSPPA512_LBSPPB1024_LPA8_LPB64_LRVW8_MIWT8_4_PLR1_SU0_SUM0_SUS64_VWA8_VWB4_WGM1_WGMXCC1_WGMXCCGn1
    SolutionIndex: 15
    SolutionNameMin: Cijk_Alik_Bjlk_F8NHS_BH_Bias_HAS_SAV_UserArgs_MT256x128x64_MI16x16x1_SN_LDSB1_CLR1_GRVWA16_GRVWB8_GSU0_GSUC0_GSUWGMRR0_K1_LBSPPA512_LBSPPB1024_LPA16_LPB64_LRVW8_MIWT8_4_PLR1_SU0_SUM0_SUS64_VWA8_VWB4_WGM1_WGMXCC1_WGMXCCGn1
    SolutionIndex: 16
    SolutionNameMin: Cijk_Alik_Bjlk_F8NHS_BH_Bias_HAS_SAV_UserArgs_MT256x128x64_MI16x16x1_SN_LDSB1_CLR1_GRVWA8_GRVWB16_GSU0_GSUC0_GSUWGMRR0_K1_LBSPPA512_LBSPPB1024_LPA8_LPB64_LRVW8_MIWT8_4_PLR1_SU0_SUM0_SUS64_VWA8_VWB4_WGM1_WGMXCC1_WGMXCCGn1
    SolutionIndex: 17
    SolutionNameMin: Cijk_Alik_Bjlk_F8NHS_BH_Bias_HAS_SAV_UserArgs_MT256x128x64_MI16x16x1_SN_LDSB1_CLR1_GRVWA16_GRVWB16_GSU0_GSUC0_GSUWGMRR0_K1_LBSPPA512_LBSPPB1024_LPA16_LPB64_LRVW8_MIWT8_4_PLR1_SU0_SUM0_SUS64_VWA8_VWB4_WGM1_WGMXCC1_WGMXCCGn1
    SolutionIndex: 18
    SolutionNameMin: Cijk_Alik_Bjlk_F8NHS_BH_Bias_HAS_SAV_UserArgs_MT256x128x64_MI16x16x1_SN_LDSB1_CLR1_GRVWA8_GRVWB16_GSU0_GSUC0_GSUWGMRR0_K1_LBSPPA512_LBSPPB1024_LPA8_LPB64_LRVW8_MIWT8_4_PLR1_SU0_SUM0_SUS64_VWA8_VWB4_WGM4_WGMXCC1_WGMXCCGn1
    SolutionIndex: 19
    SolutionNameMin: Cijk_Alik_Bjlk_F8NHS_BH_Bias_HAS_SAV_UserArgs_MT256x128x64_MI16x16x1_SN_LDSB1_CLR1_GRVWA16_GRVWB8_GSU0_GSUC0_GSUWGMRR0_K1_LBSPPA512_LBSPPB1024_LPA16_LPB64_LRVW8_MIWT8_4_PLR1_SU0_SUM0_SUS64_VWA8_VWB4_WGM8_WGMXCC1_WGMXCCGn1
    SolutionIndex: 20
    SolutionNameMin: Cijk_Alik_Bjlk_F8NHS_BH_Bias_HAS_SAV_UserArgs_MT256x128x64_MI16x16x1_SN_LDSB1_CLR1_GRVWA8_GRVWB16_GSU0_GSUC0_GSUWGMRR0_K1_LBSPPA512_LBSPPB1024_LPA8_LPB64_LRVW8_MIWT8_4_PLR1_SU0_SUM0_SUS64_VWA8_VWB4_WGM8_WGMXCC1_WGMXCCGn1
    SolutionIndex: 21
    SolutionNameMin: Cijk_Alik_Bjlk_F8NHS_BH_Bias_HAS_SAV_UserArgs_MT256x128x64_MI16x16x1_SN_LDSB1_CLR1_GRVWA16_GRVWB16_GSU0_GSUC0_GSUWGMRR0_K1_LBSPPA512_LBSPPB1024_LPA16_LPB64_LRVW8_MIWT8_4_PLR1_SU0_SUM0_SUS64_VWA8_VWB4_WGM8_WGMXCC1_WGMXCCGn1
    SolutionIndex: 22
    SolutionNameMin: Cijk_Alik_Bjlk_F8NHS_BH_Bias_HAS_SAV_UserArgs_MT128x128x64_MI16x16x1_SN_LDSB1_CLR1_GRVWA8_GRVWB8_GSU0_GSUC0_GSUWGMRR0_K1_LBSPPA512_LBSPPB1024_LPA8_LPB32_LRVW8_MIWT8_2_PLR1_SU0_SUM0_SUS64_VWA8_VWB2_WGM1_WGMXCC1_WGMXCCGn1
    SolutionIndex: 23
    SolutionNameMin: Cijk_Alik_Bjlk_F8NHS_BH_Bias_HAS_SAV_UserArgs_MT128x128x64_MI16x16x1_SN_LDSB1_CLR1_GRVWA8_GRVWB16_GSU0_GSUC0_GSUWGMRR0_K1_LBSPPA512_LBSPPB1024_LPA8_LPB32_LRVW8_MIWT8_2_PLR1_SU0_SUM0_SUS64_VWA8_VWB2_WGM1_WGMXCC1_WGMXCCGn1
    SolutionIndex: 24
    SolutionNameMin: Cijk_Alik_Bjlk_F8NHS_BH_Bias_HAS_SAV_UserArgs_MT128x128x64_MI16x16x1_SN_LDSB1_CLR1_GRVWA8_GRVWB16_GSU0_GSUC0_GSUWGMRR0_K1_LBSPPA512_LBSPPB1024_LPA8_LPB32_LRVW8_MIWT8_2_PLR1_SU0_SUM0_SUS64_VWA8_VWB2_WGM8_WGMXCC1_WGMXCCGn1
    SolutionIndex: 25
    SolutionNameMin: Cijk_Alik_Bjlk_F8NHS_BH_Bias_HAS_SAV_UserArgs_MT128x64x64_MI16x16x1_SN_LDSB0_CLR1_GRVWA8_GRVWB8_GSU0_GSUC0_GSUWGMRR0_K1_LBSPPA512_LBSPPB512_LPA8_LPB16_LRVW8_MIWT8_1_PLR1_SU0_SUM0_SUS64_VWA8_VWB1_WGM1_WGMXCC1_WGMXCCGn1
    SolutionIndex: 26
    SolutionNameMin: Cijk_Alik_Bjlk_F8NHS_BH_Bias_HAS_SAV_UserArgs_MT128x64x64_MI16x16x1_SN_LDSB0_CLR1_GRVWA8_GRVWB16_GSU0_GSUC0_GSUWGMRR0_K1_LBSPPA512_LBSPPB512_LPA8_LPB16_LRVW8_MIWT8_1_PLR1_SU0_SUM0_SUS64_VWA8_VWB1_WGM1_WGMXCC1_WGMXCCGn1
    SolutionIndex: 27
    SolutionNameMin: Cijk_Alik_Bjlk_F8NHS_BH_Bias_HAS_SAV_UserArgs_MT64x128x64_MI16x16x1_SN_LDSB0_CLR1_GRVWA16_GRVWB8_GSU0_GSUC0_GSUWGMRR0_K1_LBSPPA128_LBSPPB1024_LPA16_LPB64_LRVW8_MIWT2_4_PLR1_SU0_SUM0_SUS64_VWA2_VWB4_WGM1_WGMXCC1_WGMXCCGn1
    SolutionIndex: 28
    SolutionNameMin: Cijk_Alik_Bjlk_F8NHS_BH_Bias_HAS_SAV_UserArgs_MT128x64x64_MI16x16x1_SN_LDSB0_CLR1_GRVWA8_GRVWB8_GSU0_GSUC0_GSUWGMRR0_K1_LBSPPA256_LBSPPB512_LPA8_LPB32_LRVW8_MIWT4_2_PLR1_SU0_SUM0_SUS64_VWA4_VWB2_WGM1_WGMXCC1_WGMXCCGn1
    SolutionIndex: 29
    SolutionNameMin: Cijk_Alik_Bjlk_F8NHS_BH_Bias_HAS_SAV_UserArgs_MT128x64x64_MI16x16x1_SN_LDSB0_CLR1_GRVWA16_GRVWB8_GSU0_GSUC0_GSUWGMRR0_K1_LBSPPA256_LBSPPB512_LPA16_LPB32_LRVW8_MIWT4_2_PLR1_SU0_SUM0_SUS64_VWA4_VWB2_WGM1_WGMXCC1_WGMXCCGn1
    SolutionIndex: 30
    SolutionNameMin: Cijk_Alik_Bjlk_F8NHS_BH_Bias_HAS_SAV_UserArgs_MT128x64x64_MI16x16x1_SN_LDSB0_CLR1_GRVWA8_GRVWB16_GSU0_GSUC0_GSUWGMRR0_K1_LBSPPA256_LBSPPB512_LPA8_LPB32_LRVW8_MIWT4_2_PLR1_SU0_SUM0_SUS64_VWA4_VWB2_WGM1_WGMXCC1_WGMXCCGn1
    SolutionIndex: 31
    SolutionNameMin: Cijk_Alik_Bjlk_F8NHS_BH_Bias_HAS_SAV_UserArgs_MT128x64x64_MI16x16x1_SN_LDSB0_CLR1_GRVWA16_GRVWB16_GSU0_GSUC0_GSUWGMRR0_K1_LBSPPA256_LBSPPB512_LPA16_LPB32_LRVW8_MIWT4_2_PLR1_SU0_SUM0_SUS64_VWA4_VWB2_WGM1_WGMXCC1_WGMXCCGn1
    SolutionIndex: 32
    SolutionNameMin: Cijk_Alik_Bjlk_F8NHS_BH_Bias_HAS_SAV_UserArgs_MT128x64x64_MI16x16x1_SN_LDSB0_CLR1_GRVWA8_GRVWB16_GSU0_GSUC0_GSUWGMRR0_K1_LBSPPA256_LBSPPB512_LPA8_LPB32_LRVW8_MIWT4_2_PLR1_SU0_SUM0_SUS64_VWA4_VWB2_WGM4_WGMXCC1_WGMXCCGn1
    SolutionIndex: 33
    SolutionNameMin: Cijk_Alik_Bjlk_F8NHS_BH_Bias_HAS_SAV_UserArgs_MT128x64x64_MI16x16x1_SN_LDSB0_CLR1_GRVWA8_GRVWB8_GSU0_GSUC0_GSUWGMRR0_K1_LBSPPA256_LBSPPB512_LPA8_LPB32_LRVW8_MIWT4_2_PLR1_SU0_SUM0_SUS64_VWA4_VWB2_WGM6_WGMXCC1_WGMXCCGn1
    SolutionIndex: 34
    SolutionNameMin: Cijk_Alik_Bjlk_F8NHS_BH_Bias_HAS_SAV_UserArgs_MT128x64x64_MI16x16x1_SN_LDSB0_CLR1_GRVWA8_GRVWB16_GSU0_GSUC0_GSUWGMRR0_K1_LBSPPA256_LBSPPB512_LPA8_LPB32_LRVW8_MIWT4_2_PLR1_SU0_SUM0_SUS64_VWA4_VWB2_WGM6_WGMXCC1_WGMXCCGn1
    SolutionIndex: 35
    SolutionNameMin: Cijk_Alik_Bjlk_F8NHS_BH_Bias_HAS_SAV_UserArgs_MT64x64x64_MI16x16x1_SN_LDSB0_CLR1_GRVWA8_GRVWB8_GSU0_GSUC0_GSUWGMRR0_K1_LBSPPA128_LBSPPB512_LPA8_LPB32_LRVW8_MIWT2_2_PLR1_SU0_SUM0_SUS64_VWA2_VWB2_WGM1_WGMXCC1_WGMXCCGn1
    SolutionIndex: 36
    SolutionNameMin: Cijk_Alik_Bjlk_F8NHS_BH_Bias_HAS_SAV_UserArgs_MT64x64x64_MI16x16x1_SN_LDSB0_CLR1_GRVWA16_GRVWB8_GSU0_GSUC0_GSUWGMRR0_K1_LBSPPA128_LBSPPB512_LPA16_LPB32_LRVW8_MIWT2_2_PLR1_SU0_SUM0_SUS64_VWA2_VWB2_WGM1_WGMXCC1_WGMXCCGn1
    SolutionIndex: 37
    SolutionNameMin: Cijk_Alik_Bjlk_F8NHS_BH_Bias_HAS_SAV_UserArgs_MT64x64x64_MI16x16x1_SN_LDSB0_CLR1_GRVWA8_GRVWB8_GSU0_GSUC0_GSUWGMRR0_K1_LBSPPA128_LBSPPB512_LPA8_LPB32_LRVW8_MIWT2_2_PLR1_SU0_SUM0_SUS64_VWA2_VWB2_WGM4_WGMXCC1_WGMXCCGn1
    SolutionIndex: 38
    SolutionNameMin: Cijk_Alik_Bjlk_F8NHS_BH_Bias_HAS_SAV_UserArgs_MT64x64x64_MI16x16x1_SN_LDSB0_CLR1_GRVWA16_GRVWB8_GSU0_GSUC0_GSUWGMRR0_K1_LBSPPA128_LBSPPB512_LPA16_LPB32_LRVW8_MIWT2_2_PLR1_SU0_SUM0_SUS64_VWA2_VWB2_WGM4_WGMXCC1_WGMXCCGn1
    SolutionIndex: 39
    SolutionNameMin: Cijk_Alik_Bjlk_F8NHS_BH_Bias_HAS_SAV_UserArgs_MT64x32x64_MI16x16x1_SN_LDSB0_CLR1_GRVWA8_GRVWB8_GSU0_GSUC0_GSUWGMRR0_K1_LBSPPA128_LBSPPB256_LPA8_LPB16_LRVW8_MIWT2_1_PLR1_SU0_SUM0_SUS64_VWA2_VWB1_WGM1_WGMXCC1_WGMXCCGn1
    SolutionIndex: 40
    SolutionNameMin: Cijk_Alik_Bjlk_F8NHS_BH_Bias_HAS_SAV_UserArgs_MT64x32x64_MI16x16x1_SN_LDSB0_CLR1_GRVWA16_GRVWB8_GSU0_GSUC0_GSUWGMRR0_K1_LBSPPA128_LBSPPB256_LPA16_LPB16_LRVW8_MIWT2_1_PLR1_SU0_SUM0_SUS64_VWA2_VWB1_WGM1_WGMXCC1_WGMXCCGn1
    SolutionIndex: 41
    SolutionNameMin: Cijk_Alik_Bjlk_F8NHS_BH_Bias_HAS_SAV_UserArgs_MT32x32x64_MI16x16x1_SN_LDSB0_CLR1_GRVWA8_GRVWB8_GSU0_GSUC0_GSUWGMRR0_K1_LBSPPA128_LBSPPB256_LPA8_LPB16_LRVW8_MIWT1_1_PLR1_SU0_SUM0_SUS64_VWA1_VWB1_WGM1_WGMXCC1_WGMXCCGn1
    SolutionIndex: 42
    SolutionNameMin: Cijk_Alik_Bjlk_F8NHS_BH_Bias_HAS_SAV_UserArgs_MT128x256x128_MI16x16x1_SN_LDSB1_CLR1_GRVWA8_GRVWB16_GSU0_GSUC0_GSUWGMRR0_K1_LBSPPA512_LBSPPB2048_LPA8_LPB0_LRVW8_MIWT4_8_PLR1_SU0_SUM0_SUS128_VWA4_VWB8_WGM1_WGMXCC1_WGMXCCGn1
    SolutionIndex: 43
    SolutionNameMin: Cijk_Alik_Bjlk_F8NHS_BH_Bias_HAS_SAV_UserArgs_MT128x256x128_MI16x16x1_SN_LDSB1_CLR1_GRVWA8_GRVWB16_GSU0_GSUC0_GSUWGMRR0_K1_LBSPPA512_LBSPPB2048_LPA8_LPB0_LRVW8_MIWT4_8_PLR1_SU0_SUM0_SUS128_VWA4_VWB8_WGM4_WGMXCC1_WGMXCCGn1
    SolutionIndex: 44
    SolutionNameMin: Cijk_Alik_Bjlk_F8NHS_BH_Bias_HAS_SAV_UserArgs_MT128x256x128_MI16x16x1_SN_LDSB1_CLR1_GRVWA16_GRVWB16_GSU0_GSUC0_GSUWGMRR0_K1_LBSPPA512_LBSPPB2048_LPA16_LPB0_LRVW8_MIWT4_8_PLR1_SU0_SUM0_SUS128_VWA4_VWB8_WGM4_WGMXCC1_WGMXCCGn1
    SolutionIndex: 45
    SolutionNameMin: Cijk_Alik_Bjlk_F8NHS_BH_Bias_HAS_SAV_UserArgs_MT128x256x128_MI16x16x1_SN_LDSB1_CLR1_GRVWA8_GRVWB16_GSU0_GSUC0_GSUWGMRR0_K1_LBSPPA512_LBSPPB2048_LPA8_LPB0_LRVW8_MIWT4_8_PLR1_SU0_SUM0_SUS128_VWA4_VWB8_WGM6_WGMXCC1_WGMXCCGn1
    SolutionIndex: 46
    SolutionNameMin: Cijk_Alik_Bjlk_F8NHS_BH_Bias_HAS_SAV_UserArgs_MT128x256x128_MI16x16x1_SN_LDSB1_CLR1_GRVWA16_GRVWB16_GSU0_GSUC0_GSUWGMRR0_K1_LBSPPA512_LBSPPB2048_LPA16_LPB0_LRVW8_MIWT4_8_PLR1_SU0_SUM0_SUS128_VWA4_VWB8_WGM6_WGMXCC1_WGMXCCGn1
    SolutionIndex: 47
    SolutionNameMin: Cijk_Alik_Bjlk_F8NHS_BH_Bias_HAS_SAV_UserArgs_MT128x256x128_MI16x16x1_SN_LDSB1_CLR1_GRVWA8_GRVWB16_GSU0_GSUC0_GSUWGMRR0_K1_LBSPPA512_LBSPPB2048_LPA8_LPB0_LRVW8_MIWT4_8_PLR1_SU0_SUM0_SUS128_VWA4_VWB8_WGM8_WGMXCC1_WGMXCCGn1
    SolutionIndex: 48
    SolutionNameMin: Cijk_Alik_Bjlk_F8NHS_BH_Bias_HAS_SAV_UserArgs_MT128x256x128_MI16x16x1_SN_LDSB1_CLR1_GRVWA16_GRVWB16_GSU0_GSUC0_GSUWGMRR0_K1_LBSPPA512_LBSPPB2048_LPA16_LPB0_LRVW8_MIWT4_8_PLR1_SU0_SUM0_SUS128_VWA4_VWB8_WGM8_WGMXCC1_WGMXCCGn1
    SolutionIndex: 49
    SolutionNameMin: Cijk_Alik_Bjlk_F8NHS_BH_Bias_HAS_SAV_UserArgs_MT256x128x128_MI16x16x1_SN_LDSB1_CLR1_GRVWA8_GRVWB16_GSU0_GSUC0_GSUWGMRR0_K1_LBSPPA1024_LBSPPB1024_LPA8_LPB64_LRVW8_MIWT8_4_PLR1_SU0_SUM0_SUS128_VWA8_VWB4_WGM1_WGMXCC1_WGMXCCGn1
    SolutionIndex: 50
    SolutionNameMin: Cijk_Alik_Bjlk_F8NHS_BH_Bias_HAS_SAV_UserArgs_MT144x256x128_MI16x16x1_SN_LDSB1_CLR1_GRVWA8_GRVWB16_GSU0_GSUC0_GSUWGMRR0_K1_LBSPPA128_LBSPPB2048_LPA8_LPB64_LRVW8_MIWT9_4_PLR1_SU0_SUM0_SUS128_VWA1_VWB4_WGM1_WGMXCC1_WGMXCCGn1
    SolutionIndex: 51
    SolutionNameMin: Cijk_Alik_Bjlk_F8NHS_BH_Bias_HAS_SAV_UserArgs_MT144x256x128_MI16x16x1_SN_LDSB1_CLR1_GRVWA8_GRVWB16_GSU0_GSUC0_GSUWGMRR0_K1_LBSPPA128_LBSPPB2048_LPA8_LPB64_LRVW8_MIWT9_4_PLR1_SU0_SUM0_SUS128_VWA1_VWB4_WGM4_WGMXCC1_WGMXCCGn1
    SolutionIndex: 52
    SolutionNameMin: Cijk_Alik_Bjlk_F8NHS_BH_Bias_HAS_SAV_UserArgs_MT144x256x128_MI16x16x1_SN_LDSB1_CLR1_GRVWA8_GRVWB16_GSU0_GSUC0_GSUWGMRR0_K1_LBSPPA128_LBSPPB2048_LPA8_LPB64_LRVW8_MIWT9_4_PLR1_SU0_SUM0_SUS128_VWA1_VWB4_WGM6_WGMXCC1_WGMXCCGn1
    SolutionIndex: 53
    SolutionNameMin: Cijk_Alik_Bjlk_F8NHS_BH_Bias_HAS_SAV_UserArgs_MT144x256x128_MI16x16x1_SN_LDSB1_CLR1_GRVWA8_GRVWB8_GSU0_GSUC0_GSUWGMRR0_K1_LBSPPA128_LBSPPB2048_LPA8_LPB64_LRVW8_MIWT9_4_PLR1_SU0_SUM0_SUS128_VWA1_VWB4_WGM8_WGMXCC1_WGMXCCGn1
    SolutionIndex: 54
    SolutionNameMin: Cijk_Alik_Bjlk_F8NHS_BH_Bias_HAS_SAV_UserArgs_MT144x256x128_MI16x16x1_SN_LDSB1_CLR1_GRVWA8_GRVWB16_GSU0_GSUC0_GSUWGMRR0_K1_LBSPPA128_LBSPPB2048_LPA8_LPB64_LRVW8_MIWT9_4_PLR1_SU0_SUM0_SUS128_VWA1_VWB4_WGM8_WGMXCC1_WGMXCCGn1
    SolutionIndex: 55
    SolutionNameMin: Cijk_Alik_Bjlk_F8NHS_BH_Bias_HAS_SAV_UserArgs_MT256x64x128_MI16x16x1_SN_LDSB1_CLR1_GRVWA16_GRVWB8_GSU0_GSUC0_GSUWGMRR0_K1_LBSPPA1024_LBSPPB512_LPA16_LPB32_LRVW8_MIWT8_2_PLR1_SU0_SUM0_SUS128_VWA8_VWB2_WGM1_WGMXCC1_WGMXCCGn1
    SolutionIndex: 56
    SolutionNameMin: Cijk_Alik_Bjlk_F8NHS_BH_Bias_HAS_SAV_UserArgs_MT128x128x128_MI16x16x1_SN_LDSB1_CLR1_GRVWA8_GRVWB8_GSU0_GSUC0_GSUWGMRR0_K1_LBSPPA1024_LBSPPB1024_LPA8_LPB32_LRVW8_MIWT8_2_PLR1_SU0_SUM0_SUS128_VWA8_VWB2_WGM1_WGMXCC1_WGMXCCGn1
    SolutionIndex: 57
    SolutionNameMin: Cijk_Alik_Bjlk_F8NHS_BH_Bias_HAS_SAV_UserArgs_MT128x128x128_MI16x16x1_SN_LDSB1_CLR1_GRVWA8_GRVWB16_GSU0_GSUC0_GSUWGMRR0_K1_LBSPPA1024_LBSPPB1024_LPA8_LPB32_LRVW8_MIWT8_2_PLR1_SU0_SUM0_SUS128_VWA8_VWB2_WGM1_WGMXCC1_WGMXCCGn1
    SolutionIndex: 58
    SolutionNameMin: Cijk_Alik_Bjlk_F8NHS_BH_Bias_HAS_SAV_UserArgs_MT144x128x128_MI16x16x1_SN_LDSB1_CLR1_GRVWA8_GRVWB16_GSU0_GSUC0_GSUWGMRR0_K1_LBSPPA128_LBSPPB1024_LPA8_LPB32_LRVW8_MIWT9_2_PLR1_SU0_SUM0_SUS128_VWA1_VWB2_WGM4_WGMXCC1_WGMXCCGn1
    SolutionIndex: 59
    SolutionNameMin: Cijk_Alik_Bjlk_F8NHS_BH_Bias_HAS_SAV_UserArgs_MT144x128x128_MI16x16x1_SN_LDSB1_CLR1_GRVWA8_GRVWB16_GSU0_GSUC0_GSUWGMRR0_K1_LBSPPA128_LBSPPB1024_LPA8_LPB32_LRVW8_MIWT9_2_PLR1_SU0_SUM0_SUS128_VWA1_VWB2_WGM6_WGMXCC1_WGMXCCGn1
    SolutionIndex: 60
    SolutionNameMin: Cijk_Alik_Bjlk_F8NHS_BH_Bias_HAS_SAV_UserArgs_MT144x128x128_MI16x16x1_SN_LDSB1_CLR1_GRVWA8_GRVWB16_GSU0_GSUC0_GSUWGMRR0_K1_LBSPPA128_LBSPPB1024_LPA8_LPB32_LRVW8_MIWT9_2_PLR1_SU0_SUM0_SUS128_VWA1_VWB2_WGM8_WGMXCC1_WGMXCCGn1
    SolutionIndex: 61
    SolutionNameMin: Cijk_Alik_Bjlk_F8NHS_BH_Bias_HAS_SAV_UserArgs_MT128x128x128_MI16x16x1_SN_LDSB1_CLR1_GRVWA16_GRVWB16_GSU0_GSUC0_GSUWGMRR0_K1_LBSPPA512_LBSPPB1024_LPA16_LPB64_LRVW8_MIWT4_4_PLR1_SU0_SUM0_SUS128_VWA4_VWB4_WGM1_WGMXCC1_WGMXCCGn1
    SolutionIndex: 62
    SolutionNameMin: Cijk_Alik_Bjlk_F8NHS_BH_Bias_HAS_SAV_UserArgs_MT128x128x128_MI16x16x1_SN_LDSB1_CLR1_GRVWA16_GRVWB16_GSU0_GSUC0_GSUWGMRR0_K1_LBSPPA512_LBSPPB1024_LPA16_LPB64_LRVW8_MIWT4_4_PLR1_SU0_SUM0_SUS128_VWA4_VWB4_WGM4_WGMXCC1_WGMXCCGn1
    SolutionIndex: 63
    SolutionNameMin: Cijk_Alik_Bjlk_F8NHS_BH_Bias_HAS_SAV_UserArgs_MT128x128x128_MI16x16x1_SN_LDSB1_CLR1_GRVWA16_GRVWB16_GSU0_GSUC0_GSUWGMRR0_K1_LBSPPA512_LBSPPB1024_LPA16_LPB64_LRVW8_MIWT4_4_PLR1_SU0_SUM0_SUS128_VWA4_VWB4_WGM6_WGMXCC1_WGMXCCGn1
    SolutionIndex: 64
    SolutionNameMin: Cijk_Alik_Bjlk_F8NHS_BH_Bias_HAS_SAV_UserArgs_MT128x128x128_MI16x16x1_SN_LDSB1_CLR1_GRVWA16_GRVWB16_GSU0_GSUC0_GSUWGMRR0_K1_LBSPPA512_LBSPPB1024_LPA16_LPB64_LRVW8_MIWT4_4_PLR1_SU0_SUM0_SUS128_VWA4_VWB4_WGM8_WGMXCC1_WGMXCCGn1
    SolutionIndex: 65
    SolutionNameMin: Cijk_Alik_Bjlk_F8NHS_BH_Bias_HAS_SAV_UserArgs_MT64x128x128_MI16x16x1_SN_LDSB1_CLR1_GRVWA8_GRVWB16_GSU0_GSUC0_GSUWGMRR0_K1_LBSPPA256_LBSPPB1024_LPA8_LPB64_LRVW8_MIWT2_4_PLR1_SU0_SUM0_SUS128_VWA2_VWB4_WGM1_WGMXCC1_WGMXCCGn1
    SolutionIndex: 66
    SolutionNameMin: Cijk_Alik_Bjlk_F8NHS_BH_Bias_HAS_SAV_UserArgs_MT128x64x128_MI16x16x1_SN_LDSB1_CLR1_GRVWA16_GRVWB16_GSU0_GSUC0_GSUWGMRR0_K1_LBSPPA512_LBSPPB512_LPA16_LPB32_LRVW8_MIWT4_2_PLR1_SU0_SUM0_SUS128_VWA4_VWB2_WGM6_WGMXCC1_WGMXCCGn1
    SolutionIndex: 67
    SolutionNameMin: Cijk_Alik_Bjlk_F8NHS_BH_Bias_HAS_SAV_UserArgs_MT64x64x128_MI16x16x1_SN_LDSB1_CLR1_GRVWA8_GRVWB16_GSU0_GSUC0_GSUWGMRR0_K1_LBSPPA256_LBSPPB512_LPA8_LPB32_LRVW8_MIWT2_2_PLR1_SU0_SUM0_SUS128_VWA2_VWB2_WGM1_WGMXCC1_WGMXCCGn1
    SolutionIndex: 68
    SolutionNameMin: Cijk_Alik_Bjlk_F8NHS_BH_Bias_HAS_SAV_UserArgs_MT64x64x128_MI16x16x1_SN_LDSB1_CLR1_GRVWA16_GRVWB16_GSU0_GSUC0_GSUWGMRR0_K1_LBSPPA256_LBSPPB512_LPA16_LPB32_LRVW8_MIWT2_2_PLR1_SU0_SUM0_SUS128_VWA2_VWB2_WGM1_WGMXCC1_WGMXCCGn1
    SolutionIndex: 69
    SolutionNameMin: Cijk_Alik_Bjlk_F8NHS_BH_Bias_HAS_SAV_UserArgs_MT64x64x128_MI16x16x1_SN_LDSB1_CLR1_GRVWA8_GRVWB16_GSU0_GSUC0_GSUWGMRR0_K1_LBSPPA256_LBSPPB512_LPA8_LPB32_LRVW8_MIWT2_2_PLR1_SU0_SUM0_SUS128_VWA2_VWB2_WGM6_WGMXCC1_WGMXCCGn1
    SolutionIndex: 70
    SolutionNameMin: Cijk_Alik_Bjlk_F8NHS_BH_Bias_HAS_SAV_UserArgs_MT64x64x128_MI16x16x1_SN_LDSB1_CLR1_GRVWA16_GRVWB8_GSU0_GSUC0_GSUWGMRR0_K1_LBSPPA256_LBSPPB512_LPA16_LPB32_LRVW8_MIWT2_2_PLR1_SU0_SUM0_SUS128_VWA2_VWB2_WGM8_WGMXCC1_WGMXCCGn1
    SolutionIndex: 71
    SolutionNameMin: Cijk_Alik_Bjlk_F8NHS_BH_Bias_HAS_SAV_UserArgs_MT32x64x128_MI16x16x1_SN_LDSB0_CLR1_GRVWA8_GRVWB8_GSU0_GSUC0_GSUWGMRR0_K1_LBSPPA128_LBSPPB512_LPA8_LPB32_LRVW8_MIWT1_2_PLR1_SU0_SUM0_SUS128_VWA1_VWB2_WGM1_WGMXCC1_WGMXCCGn1
    SolutionIndex: 72
    SolutionNameMin: Cijk_Alik_Bjlk_F8NHS_BH_Bias_HAS_SAV_UserArgs_MT32x64x128_MI16x16x1_SN_LDSB0_CLR1_GRVWA8_GRVWB16_GSU0_GSUC0_GSUWGMRR0_K1_LBSPPA128_LBSPPB512_LPA8_LPB32_LRVW8_MIWT1_2_PLR1_SU0_SUM0_SUS128_VWA1_VWB2_WGM4_WGMXCC1_WGMXCCGn1
    SolutionIndex: 73
    SolutionNameMin: Cijk_Alik_Bjlk_F8NHS_BH_Bias_HAS_SAV_UserArgs_MT64x32x128_MI16x16x1_SN_LDSB0_CLR1_GRVWA8_GRVWB8_GSU0_GSUC0_GSUWGMRR0_K1_LBSPPA256_LBSPPB256_LPA8_LPB16_LRVW8_MIWT2_1_PLR1_SU0_SUM0_SUS128_VWA2_VWB1_WGM1_WGMXCC1_WGMXCCGn1
    SolutionIndex: 74
    SolutionNameMin: Cijk_Alik_Bjlk_F8NHS_BH_Bias_HAS_SAV_UserArgs_MT64x32x128_MI16x16x1_SN_LDSB0_CLR1_GRVWA16_GRVWB8_GSU0_GSUC0_GSUWGMRR0_K1_LBSPPA256_LBSPPB256_LPA16_LPB16_LRVW8_MIWT2_1_PLR1_SU0_SUM0_SUS128_VWA2_VWB1_WGM1_WGMXCC1_WGMXCCGn1
    SolutionIndex: 75
    SolutionNameMin: Cijk_Alik_Bjlk_F8NHS_BH_Bias_HAS_SAV_UserArgs_MT64x32x128_MI16x16x1_SN_LDSB0_CLR1_GRVWA8_GRVWB16_GSU0_GSUC0_GSUWGMRR0_K1_LBSPPA256_LBSPPB256_LPA8_LPB16_LRVW8_MIWT2_1_PLR1_SU0_SUM0_SUS128_VWA2_VWB1_WGM1_WGMXCC1_WGMXCCGn1
    SolutionIndex: 76
    SolutionNameMin: Cijk_Alik_Bjlk_F8NHS_BH_Bias_HAS_SAV_UserArgs_MT64x32x128_MI16x16x1_SN_LDSB0_CLR1_GRVWA8_GRVWB16_GSU0_GSUC0_GSUWGMRR0_K1_LBSPPA256_LBSPPB256_LPA8_LPB16_LRVW8_MIWT2_1_PLR1_SU0_SUM0_SUS128_VWA2_VWB1_WGM4_WGMXCC1_WGMXCCGn1
    SolutionIndex: 77
    SolutionNameMin: Cijk_Alik_Bjlk_F8NHS_BH_Bias_HAS_SAV_UserArgs_MT64x32x128_MI16x16x1_SN_LDSB0_CLR1_GRVWA8_GRVWB16_GSU0_GSUC0_GSUWGMRR0_K1_LBSPPA256_LBSPPB256_LPA8_LPB16_LRVW8_MIWT2_1_PLR1_SU0_SUM0_SUS128_VWA2_VWB1_WGM6_WGMXCC1_WGMXCCGn1
    SolutionIndex: 78
    SolutionNameMin: Cijk_Alik_Bjlk_F8NHS_BH_Bias_HAS_SAV_UserArgs_MT64x32x128_MI16x16x1_SN_LDSB0_CLR1_GRVWA8_GRVWB16_GSU0_GSUC0_GSUWGMRR0_K1_LBSPPA256_LBSPPB256_LPA8_LPB16_LRVW8_MIWT2_1_PLR1_SU0_SUM0_SUS128_VWA2_VWB1_WGM8_WGMXCC1_WGMXCCGn1
    SolutionIndex: 79
    SolutionNameMin: Cijk_Alik_Bjlk_F8NHS_BH_Bias_HAS_SAV_UserArgs_MT32x32x128_MI16x16x1_SN_LDSB0_CLR1_GRVWA8_GRVWB8_GSU0_GSUC0_GSUWGMRR0_K1_LBSPPA128_LBSPPB256_LPA8_LPB16_LRVW8_MIWT1_1_PLR1_SU0_SUM0_SUS128_VWA1_VWB1_WGM1_WGMXCC1_WGMXCCGn1
    SolutionIndex: 80
    SolutionNameMin: Cijk_Alik_Bjlk_F8NHS_BH_Bias_HAS_SAV_UserArgs_MT32x32x128_MI16x16x1_SN_LDSB0_CLR1_GRVWA16_GRVWB8_GSU0_GSUC0_GSUWGMRR0_K1_LBSPPA128_LBSPPB256_LPA16_LPB16_LRVW8_MIWT1_1_PLR1_SU0_SUM0_SUS128_VWA1_VWB1_WGM1_WGMXCC1_WGMXCCGn1
    SolutionIndex: 81
    SolutionNameMin: Cijk_Alik_Bjlk_F8NHS_BH_Bias_HAS_SAV_UserArgs_MT32x32x128_MI16x16x1_SN_LDSB0_CLR1_GRVWA8_GRVWB16_GSU0_GSUC0_GSUWGMRR0_K1_LBSPPA128_LBSPPB256_LPA8_LPB16_LRVW8_MIWT1_1_PLR1_SU0_SUM0_SUS128_VWA1_VWB1_WGM1_WGMXCC1_WGMXCCGn1
    SolutionIndex: 82
    SolutionNameMin: Cijk_Alik_Bjlk_F8NHS_BH_Bias_HAS_SAV_UserArgs_MT32x32x128_MI16x16x1_SN_LDSB0_CLR1_GRVWA8_GRVWB16_GSU0_GSUC0_GSUWGMRR0_K1_LBSPPA128_LBSPPB256_LPA8_LPB16_LRVW8_MIWT1_1_PLR1_SU0_SUM0_SUS128_VWA1_VWB1_WGM4_WGMXCC1_WGMXCCGn1
    SolutionIndex: 83
    SolutionNameMin: Cijk_Alik_Bjlk_F8NHS_BH_Bias_HAS_SAV_UserArgs_MT32x32x128_MI16x16x1_SN_LDSB0_CLR1_GRVWA8_GRVWB16_GSU0_GSUC0_GSUWGMRR0_K1_LBSPPA128_LBSPPB256_LPA8_LPB16_LRVW8_MIWT1_1_PLR1_SU0_SUM0_SUS128_VWA1_VWB1_WGM6_WGMXCC1_WGMXCCGn1
    SolutionIndex: 84
    SolutionNameMin: Cijk_Alik_Bjlk_F8NHS_BH_Bias_HAS_SAV_UserArgs_MT32x32x128_MI16x16x1_SN_LDSB0_CLR1_GRVWA8_GRVWB16_GSU0_GSUC0_GSUWGMRR0_K1_LBSPPA128_LBSPPB256_LPA8_LPB16_LRVW8_MIWT1_1_PLR1_SU0_SUM0_SUS128_VWA1_VWB1_WGM8_WGMXCC1_WGMXCCGn1
    SolutionIndex: 85
    SolutionNameMin: Cijk_Alik_Bjlk_F8NHS_BH_Bias_HAS_SAV_UserArgs_MT128x64x256_MI16x16x1_SN_LDSB1_CLR1_GRVWA16_GRVWB16_GSU0_GSUC0_GSUWGMRR0_K1_LBSPPA1024_LBSPPB512_LPA16_LPB32_LRVW8_MIWT4_2_PLR1_SU0_SUM0_SUS256_VWA4_VWB2_WGM1_WGMXCC1_WGMXCCGn1
    SolutionIndex: 86
    SolutionNameMin: Cijk_Alik_Bjlk_F8NHS_BH_Bias_HAS_SAV_UserArgs_MT128x64x256_MI16x16x1_SN_LDSB1_CLR1_GRVWA16_GRVWB16_GSU0_GSUC0_GSUWGMRR0_K1_LBSPPA1024_LBSPPB512_LPA16_LPB32_LRVW8_MIWT4_2_PLR1_SU0_SUM0_SUS256_VWA4_VWB2_WGM4_WGMXCC1_WGMXCCGn1
    SolutionIndex: 87
    SolutionNameMin: Cijk_Alik_Bjlk_F8NHS_BH_Bias_HAS_SAV_UserArgs_MT128x64x256_MI16x16x1_SN_LDSB1_CLR1_GRVWA16_GRVWB16_GSU0_GSUC0_GSUWGMRR0_K1_LBSPPA1024_LBSPPB512_LPA16_LPB32_LRVW8_MIWT4_2_PLR1_SU0_SUM0_SUS256_VWA4_VWB2_WGM6_WGMXCC1_WGMXCCGn1
    SolutionIndex: 88
    SolutionNameMin: Cijk_Alik_Bjlk_F8NHS_BH_Bias_HAS_SAV_UserArgs_MT128x64x256_MI16x16x1_SN_LDSB1_CLR1_GRVWA16_GRVWB16_GSU0_GSUC0_GSUWGMRR0_K1_LBSPPA1024_LBSPPB512_LPA16_LPB32_LRVW8_MIWT4_2_PLR1_SU0_SUM0_SUS256_VWA4_VWB2_WGM8_WGMXCC1_WGMXCCGn1
    SolutionIndex: 89
    SolutionNameMin: Cijk_Alik_Bjlk_F8NHS_BH_Bias_HAS_SAV_UserArgs_MT64x64x256_MI16x16x1_SN_LDSB1_CLR1_GRVWA16_GRVWB16_GSU0_GSUC0_GSUWGMRR0_K1_LBSPPA512_LBSPPB512_LPA16_LPB32_LRVW8_MIWT2_2_PLR1_SU0_SUM0_SUS256_VWA2_VWB2_WGM1_WGMXCC1_WGMXCCGn1
    SolutionIndex: 90
    SolutionNameMin: Cijk_Alik_Bjlk_F8NHS_BH_Bias_HAS_SAV_UserArgs_MT64x64x256_MI16x16x1_SN_LDSB1_CLR1_GRVWA16_GRVWB16_GSU0_GSUC0_GSUWGMRR0_K1_LBSPPA512_LBSPPB512_LPA16_LPB32_LRVW8_MIWT2_2_PLR1_SU0_SUM0_SUS256_VWA2_VWB2_WGM4_WGMXCC1_WGMXCCGn1
    SolutionIndex: 91
    SolutionNameMin: Cijk_Alik_Bjlk_F8NHS_BH_Bias_HAS_SAV_UserArgs_MT64x64x256_MI16x16x1_SN_LDSB1_CLR1_GRVWA16_GRVWB16_GSU0_GSUC0_GSUWGMRR0_K1_LBSPPA512_LBSPPB512_LPA16_LPB32_LRVW8_MIWT2_2_PLR1_SU0_SUM0_SUS256_VWA2_VWB2_WGM6_WGMXCC1_WGMXCCGn1
    SolutionIndex: 92
    SolutionNameMin: Cijk_Alik_Bjlk_F8NHS_BH_Bias_HAS_SAV_UserArgs_MT64x64x256_MI16x16x1_SN_LDSB1_CLR1_GRVWA16_GRVWB16_GSU0_GSUC0_GSUWGMRR0_K1_LBSPPA512_LBSPPB512_LPA16_LPB32_LRVW8_MIWT2_2_PLR1_SU0_SUM0_SUS256_VWA2_VWB2_WGM8_WGMXCC1_WGMXCCGn1
    SolutionIndex: 93
    SolutionNameMin: Cijk_Alik_Bjlk_F8NHS_BH_Bias_HAS_SAV_UserArgs_MT32x64x256_MI16x16x1_SN_LDSB1_CLR1_GRVWA16_GRVWB16_GSU0_GSUC0_GSUWGMRR0_K1_LBSPPA256_LBSPPB512_LPA16_LPB32_LRVW8_MIWT1_2_PLR1_SU0_SUM0_SUS256_VWA1_VWB2_WGM1_WGMXCC1_WGMXCCGn1
    SolutionIndex: 94
    SolutionNameMin: Cijk_Alik_Bjlk_F8NHS_BH_Bias_HAS_SAV_UserArgs_MT32x64x256_MI16x16x1_SN_LDSB1_CLR1_GRVWA8_GRVWB16_GSU0_GSUC0_GSUWGMRR0_K1_LBSPPA256_LBSPPB512_LPA8_LPB32_LRVW8_MIWT1_2_PLR1_SU0_SUM0_SUS256_VWA1_VWB2_WGM4_WGMXCC1_WGMXCCGn1
    SolutionIndex: 95
    SolutionNameMin: Cijk_Alik_Bjlk_F8NHS_BH_Bias_HAS_SAV_UserArgs_MT32x64x256_MI16x16x1_SN_LDSB1_CLR1_GRVWA16_GRVWB16_GSU0_GSUC0_GSUWGMRR0_K1_LBSPPA256_LBSPPB512_LPA16_LPB32_LRVW8_MIWT1_2_PLR1_SU0_SUM0_SUS256_VWA1_VWB2_WGM6_WGMXCC1_WGMXCCGn1
    SolutionIndex: 96
    SolutionNameMin: Cijk_Alik_Bjlk_F8NHS_BH_Bias_HAS_SAV_UserArgs_MT32x64x256_MI16x16x1_SN_LDSB1_CLR1_GRVWA8_GRVWB16_GSU0_GSUC0_GSUWGMRR0_K1_LBSPPA256_LBSPPB512_LPA8_LPB32_LRVW8_MIWT1_2_PLR1_SU0_SUM0_SUS256_VWA1_VWB2_WGM8_WGMXCC1_WGMXCCGn1
    SolutionIndex: 97
    SolutionNameMin: Cijk_Alik_Bjlk_F8NHS_BH_Bias_HAS_SAV_UserArgs_MT64x32x256_MI16x16x1_SN_LDSB1_CLR1_GRVWA16_GRVWB16_GSU0_GSUC0_GSUWGMRR0_K1_LBSPPA512_LBSPPB256_LPA16_LPB16_LRVW8_MIWT2_1_PLR1_SU0_SUM0_SUS256_VWA2_VWB1_WGM1_WGMXCC1_WGMXCCGn1
    SolutionIndex: 98
    SolutionNameMin: Cijk_Alik_Bjlk_F8NHS_BH_Bias_HAS_SAV_UserArgs_MT32x32x256_MI16x16x1_SN_LDSB1_CLR1_GRVWA8_GRVWB16_GSU0_GSUC0_GSUWGMRR0_K1_LBSPPA256_LBSPPB256_LPA8_LPB16_LRVW8_MIWT1_1_PLR1_SU0_SUM0_SUS256_VWA1_VWB1_WGM1_WGMXCC1_WGMXCCGn1
    SolutionIndex: 99
    SolutionNameMin: Cijk_Alik_Bjlk_F8NHS_BH_Bias_HAS_SAV_UserArgs_MT32x32x256_MI16x16x1_SN_LDSB1_CLR1_GRVWA16_GRVWB16_GSU0_GSUC0_GSUWGMRR0_K1_LBSPPA256_LBSPPB256_LPA16_LPB16_LRVW8_MIWT1_1_PLR1_SU0_SUM0_SUS256_VWA1_VWB1_WGM6_WGMXCC1_WGMXCCGn1
- - - [128, 128, 1, 128, 128, 128, 128, 128]
    - [41, 0.56]
  - - [128, 128, 1, 256, 128, 128, 256, 128]
    - [41, 1.02]
  - - [128, 128, 1, 512, 128, 128, 512, 128]
    - [79, 1.68]
  - - [128, 128, 1, 1024, 128, 128, 1024, 128]
    - [81, 2.63]
  - - [128, 128, 1, 2048, 128, 128, 2048, 128]
    - [81, 3.73]
  - - [128, 128, 1, 4096, 128, 128, 4096, 128]
    - [81, 4.74]
  - - [128, 128, 1, 8192, 128, 128, 8192, 128]
    - [83, 5.46]
  - - [128, 256, 1, 128, 128, 128, 128, 256]
    - [41, 1.07]
  - - [128, 256, 1, 256, 128, 128, 256, 256]
    - [79, 2.07]
  - - [128, 256, 1, 512, 128, 128, 512, 256]
    - [79, 3.52]
  - - [128, 256, 1, 1024, 128, 128, 1024, 256]
    - [81, 5.48]
  - - [128, 256, 1, 2048, 128, 128, 2048, 256]
    - [81, 7.74]
  - - [128, 256, 1, 4096, 128, 128, 4096, 256]
    - [81, 9.71]
  - - [128, 256, 1, 8192, 128, 128, 8192, 256]
    - [81, 11.09]
  - - [128, 512, 1, 128, 128, 128, 128, 512]
    - [41, 2.22]
  - - [128, 512, 1, 256, 128, 128, 256, 512]
    - [79, 4.02]
  - - [128, 512, 1, 512, 128, 128, 512, 512]
    - [79, 6.96]
  - - [128, 512, 1, 1024, 128, 128, 1024, 512]
    - [79, 10.83]
  - - [128, 512, 1, 2048, 128, 128, 2048, 512]
    - [81, 15.3]
  - - [128, 512, 1, 4096, 128, 128, 4096, 512]
    - [81, 19.22]
  - - [128, 512, 1, 8192, 128, 128, 8192, 512]
    - [98, 17.13]
  - - [128, 1024, 1, 128, 128, 128, 128, 1024]
    - [80, 4.31]
  - - [128, 1024, 1, 256, 128, 128, 256, 1024]
    - [41, 7.84]
  - - [128, 1024, 1, 512, 128, 128, 512, 1024]
    - [79, 13.53]
  - - [128, 1024, 1, 1024, 128, 128, 1024, 1024]
    - [79, 21.43]
  - - [128, 1024, 1, 2048, 128, 128, 2048, 1024]
    - [81, 29.71]
  - - [128, 1024, 1, 4096, 128, 128, 4096, 1024]
    - [98, 30.63]
  - - [128, 1024, 1, 8192, 128, 128, 8192, 1024]
    - [99, 32.61]
  - - [128, 2048, 1, 128, 128, 128, 128, 2048]
    - [73, 8.13]
  - - [128, 2048, 1, 256, 128, 128, 256, 2048]
    - [71, 14.39]
  - - [128, 2048, 1, 512, 128, 128, 512, 2048]
    - [73, 24.46]
  - - [128, 2048, 1, 1024, 128, 128, 1024, 2048]
    - [75, 38.06]
  - - [128, 2048, 1, 2048, 128, 128, 2048, 2048]
    - [93, 44.15]
  - - [128, 2048, 1, 4096, 128, 128, 4096, 2048]
    - [93, 52.69]
  - - [128, 2048, 1, 8192, 128, 128, 8192, 2048]
    - [93, 59.73]
  - - [128, 4096, 1, 128, 128, 128, 128, 4096]
    - [36, 15.22]
  - - [128, 4096, 1, 256, 128, 128, 256, 4096]
    - [35, 26.43]
  - - [128, 4096, 1, 512, 128, 128, 512, 4096]
    - [68, 43.51]
  - - [128, 4096, 1, 1024, 128, 128, 1024, 4096]
    - [67, 65.17]
  - - [128, 4096, 1, 2048, 128, 128, 2048, 4096]
    - [89, 78.17]
  - - [128, 4096, 1, 4096, 128, 128, 4096, 4096]
    - [89, 96.54]
  - - [128, 4096, 1, 8192, 128, 128, 8192, 4096]
    - [89, 108.46]
  - - [128, 8192, 1, 128, 128, 128, 128, 8192]
    - [25, 25.38]
  - - [128, 8192, 1, 256, 128, 128, 256, 8192]
    - [29, 44.67]
  - - [128, 8192, 1, 512, 128, 128, 512, 8192]
    - [30, 72.29]
  - - [128, 8192, 1, 1024, 128, 128, 1024, 8192]
    - [30, 105.25]
  - - [128, 8192, 1, 2048, 128, 128, 2048, 8192]
    - [65, 122.49]
  - - [128, 8192, 1, 4096, 128, 128, 4096, 8192]
    - [65, 145.22]
  - - [128, 8192, 1, 8192, 128, 128, 8192, 8192]
    - [86, 153.67]
  - - [256, 128, 1, 128, 256, 256, 128, 128]
    - [41, 1.12]
  - - [256, 128, 1, 256, 256, 256, 256, 128]
    - [81, 2.0]
  - - [256, 128, 1, 512, 256, 256, 512, 128]
    - [79, 3.51]
  - - [256, 128, 1, 1024, 256, 256, 1024, 128]
    - [79, 5.46]
  - - [256, 128, 1, 2048, 256, 256, 2048, 128]
    - [81, 7.76]
  - - [256, 128, 1, 4096, 256, 256, 4096, 128]
    - [81, 9.65]
  - - [256, 128, 1, 8192, 256, 256, 8192, 128]
    - [81, 11.07]
  - - [256, 256, 1, 128, 256, 256, 128, 256]
    - [80, 2.24]
  - - [256, 256, 1, 256, 256, 256, 256, 256]
    - [41, 4.08]
  - - [256, 256, 1, 512, 256, 256, 512, 256]
    - [79, 6.99]
  - - [256, 256, 1, 1024, 256, 256, 1024, 256]
    - [79, 10.87]
  - - [256, 256, 1, 2048, 256, 256, 2048, 256]
    - [81, 15.46]
  - - [256, 256, 1, 4096, 256, 256, 4096, 256]
    - [81, 19.27]
  - - [256, 256, 1, 8192, 256, 256, 8192, 256]
    - [84, 21.94]
  - - [256, 512, 1, 128, 256, 256, 128, 512]
    - [79, 4.34]
  - - [256, 512, 1, 256, 256, 256, 256, 512]
    - [79, 7.93]
  - - [256, 512, 1, 512, 256, 256, 512, 512]
    - [79, 13.57]
  - - [256, 512, 1, 1024, 256, 256, 1024, 512]
    - [79, 21.55]
  - - [256, 512, 1, 2048, 256, 256, 2048, 512]
    - [79, 29.99]
  - - [256, 512, 1, 4096, 256, 256, 4096, 512]
    - [81, 37.75]
  - - [256, 512, 1, 8192, 256, 256, 8192, 512]
    - [98, 38.46]
  - - [256, 1024, 1, 128, 256, 256, 128, 1024]
    - [73, 8.13]
  - - [256, 1024, 1, 256, 256, 256, 256, 1024]
    - [74, 14.6]
  - - [256, 1024, 1, 512, 256, 256, 512, 1024]
    - [73, 24.68]
  - - [256, 1024, 1, 1024, 256, 256, 1024, 1024]
    - [75, 37.51]
  - - [256, 1024, 1, 2048, 256, 256, 2048, 1024]
    - [75, 51.89]
  - - [256, 1024, 1, 4096, 256, 256, 4096, 1024]
    - [97, 55.02]
  - - [256, 1024, 1, 8192, 256, 256, 8192, 1024]
    - [95, 60.0]
  - - [256, 2048, 1, 128, 256, 256, 128, 2048]
    - [36, 14.87]
  - - [256, 2048, 1, 256, 256, 256, 256, 2048]
    - [36, 26.69]
  - - [256, 2048, 1, 512, 256, 256, 512, 2048]
    - [35, 42.88]
  - - [256, 2048, 1, 1024, 256, 256, 1024, 2048]
    - [67, 64.72]
  - - [256, 2048, 1, 2048, 256, 256, 2048, 2048]
    - [89, 80.0]
  - - [256, 2048, 1, 4096, 256, 256, 4096, 2048]
    - [89, 96.31]
  - - [256, 2048, 1, 8192, 256, 256, 8192, 2048]
    - [89, 108.2]
  - - [256, 4096, 1, 128, 256, 256, 128, 4096]
    - [27, 24.98]
  - - [256, 4096, 1, 256, 256, 256, 256, 4096]
    - [29, 43.5]
  - - [256, 4096, 1, 512, 256, 256, 512, 4096]
    - [30, 70.2]
  - - [256, 4096, 1, 1024, 256, 256, 1024, 4096]
    - [30, 102.52]
  - - [256, 4096, 1, 2048, 256, 256, 2048, 4096]
    - [85, 124.54]
  - - [256, 4096, 1, 4096, 256, 256, 4096, 4096]
    - [85, 149.62]
  - - [256, 4096, 1, 8192, 256, 256, 8192, 4096]
    - [87, 163.75]
  - - [256, 8192, 1, 128, 256, 256, 128, 8192]
    - [23, 38.43]
  - - [256, 8192, 1, 256, 256, 256, 256, 8192]
    - [23, 66.64]
  - - [256, 8192, 1, 512, 256, 256, 512, 8192]
    - [61, 107.01]
  - - [256, 8192, 1, 1024, 256, 256, 1024, 8192]
    - [61, 156.52]
  - - [256, 8192, 1, 2048, 256, 256, 2048, 8192]
    - [61, 184.82]
  - - [256, 8192, 1, 4096, 256, 256, 4096, 8192]
    - [61, 208.18]
  - - [256, 8192, 1, 8192, 256, 256, 8192, 8192]
    - [61, 203.11]
  - - [512, 128, 1, 128, 512, 512, 128, 128]
    - [41, 2.25]
  - - [512, 128, 1, 256, 512, 512, 256, 128]
    - [80, 4.06]
  - - [512, 128, 1, 512, 512, 512, 512, 128]
    - [79, 6.99]
  - - [512, 128, 1, 1024, 512, 512, 1024, 128]
    - [81, 10.86]
  - - [512, 128, 1, 2048, 512, 512, 2048, 128]
    - [79, 15.26]
  - - [512, 128, 1, 4096, 512, 512, 4096, 128]
    - [81, 19.23]
  - - [512, 128, 1, 8192, 512, 512, 8192, 128]
    - [81, 22.07]
  - - [512, 256, 1, 128, 512, 512, 128, 256]
    - [40, 4.07]
  - - [512, 256, 1, 256, 512, 512, 256, 256]
    - [41, 7.59]
  - - [512, 256, 1, 512, 512, 512, 512, 256]
    - [79, 13.58]
  - - [512, 256, 1, 1024, 512, 512, 1024, 256]
    - [79, 21.48]
  - - [512, 256, 1, 2048, 512, 512, 2048, 256]
    - [81, 30.03]
  - - [512, 256, 1, 4096, 512, 512, 4096, 256]
    - [81, 38.06]
  - - [512, 256, 1, 8192, 512, 512, 8192, 256]
    - [82, 43.13]
  - - [512, 512, 1, 128, 512, 512, 128, 512]
    - [73, 8.22]
  - - [512, 512, 1, 256, 512, 512, 256, 512]
    - [73, 14.51]
  - - [512, 512, 1, 512, 512, 512, 512, 512]
    - [73, 24.49]
  - - [512, 512, 1, 1024, 512, 512, 1024, 512]
    - [73, 37.27]
  - - [512, 512, 1, 2048, 512, 512, 2048, 512]
    - [75, 51.75]
  - - [512, 512, 1, 4096, 512, 512, 4096, 512]
    - [78, 63.23]
  - - [512, 512, 1, 8192, 512, 512, 8192, 512]
    - [72, 64.48]
  - - [512, 1024, 1, 128, 512, 512, 128, 1024]
    - [36, 14.85]
  - - [512, 1024, 1, 256, 512, 512, 256, 1024]
    - [36, 26.19]
  - - [512, 1024, 1, 512, 512, 512, 512, 1024]
    - [68, 43.15]
  - - [512, 1024, 1, 1024, 512, 512, 1024, 1024]
    - [68, 64.36]
  - - [512, 1024, 1, 2048, 512, 512, 2048, 1024]
    - [89, 86.99]
  - - [512, 1024, 1, 4096, 512, 512, 4096, 1024]
    - [89, 97.82]
  - - [512, 1024, 1, 8192, 512, 512, 8192, 1024]
    - [91, 106.79]
  - - [512, 2048, 1, 128, 512, 512, 128, 2048]
    - [29, 24.14]
  - - [512, 2048, 1, 256, 512, 512, 256, 2048]
    - [29, 42.96]
  - - [512, 2048, 1, 512, 512, 512, 512, 2048]
    - [34, 69.15]
  - - [512, 2048, 1, 1024, 512, 512, 1024, 2048]
    - [30, 100.52]
  - - [512, 2048, 1, 2048, 512, 512, 2048, 2048]
    - [85, 125.47]
  - - [512, 2048, 1, 4096, 512, 512, 4096, 2048]
    - [85, 150.54]
  - - [512, 2048, 1, 8192, 512, 512, 8192, 2048]
    - [86, 157.9]
  - - [512, 4096, 1, 128, 512, 512, 128, 4096]
    - [56, 37.58]
  - - [512, 4096, 1, 256, 512, 512, 256, 4096]
    - [22, 64.6]
  - - [512, 4096, 1, 512, 512, 512, 512, 4096]
    - [61, 105.36]
  - - [512, 4096, 1, 1024, 512, 512, 1024, 4096]
    - [61, 154.23]
  - - [512, 4096, 1, 2048, 512, 512, 2048, 4096]
    - [61, 188.93]
  - - [512, 4096, 1, 4096, 512, 512, 4096, 4096]
    - [61, 218.09]
  - - [512, 4096, 1, 8192, 512, 512, 8192, 4096]
    - [62, 201.79]
  - - [512, 8192, 1, 128, 512, 512, 128, 8192]
    - [15, 55.09]
  - - [512, 8192, 1, 256, 512, 512, 256, 8192]
    - [16, 95.17]
  - - [512, 8192, 1, 512, 512, 512, 512, 8192]
    - [16, 150.52]
  - - [512, 8192, 1, 1024, 512, 512, 1024, 8192]
    - [16, 202.15]
  - - [512, 8192, 1, 2048, 512, 512, 2048, 8192]
    - [11, 241.04]
  - - [512, 8192, 1, 4096, 512, 512, 4096, 8192]
    - [46, 252.44]
  - - [512, 8192, 1, 8192, 512, 512, 8192, 8192]
    - [42, 235.83]
  - - [1024, 128, 1, 128, 1024, 1024, 128, 128]
    - [41, 4.4]
  - - [1024, 128, 1, 256, 1024, 1024, 256, 128]
    - [79, 7.93]
  - - [1024, 128, 1, 512, 1024, 1024, 512, 128]
    - [79, 13.49]
  - - [1024, 128, 1, 1024, 1024, 1024, 1024, 128]
    - [79, 21.4]
  - - [1024, 128, 1, 2048, 1024, 1024, 2048, 128]
    - [81, 30.07]
  - - [1024, 128, 1, 4096, 1024, 1024, 4096, 128]
    - [81, 37.9]
  - - [1024, 128, 1, 8192, 1024, 1024, 8192, 128]
    - [82, 43.14]
  - - [1024, 256, 1, 128, 1024, 1024, 128, 256]
    - [73, 8.18]
  - - [1024, 256, 1, 256, 1024, 1024, 256, 256]
    - [74, 14.46]
  - - [1024, 256, 1, 512, 1024, 1024, 512, 256]
    - [73, 24.54]
  - - [1024, 256, 1, 1024, 1024, 1024, 1024, 256]
    - [75, 37.51]
  - - [1024, 256, 1, 2048, 1024, 1024, 2048, 256]
    - [75, 52.01]
  - - [1024, 256, 1, 4096, 1024, 1024, 4096, 256]
    - [76, 63.18]
  - - [1024, 256, 1, 8192, 1024, 1024, 8192, 256]
    - [96, 71.02]
  - - [1024, 512, 1, 128, 1024, 1024, 128, 512]
    - [35, 14.74]
  - - [1024, 512, 1, 256, 1024, 1024, 256, 512]
    - [35, 26.36]
  - - [1024, 512, 1, 512, 1024, 1024, 512, 512]
    - [35, 43.2]
  - - [1024, 512, 1, 1024, 1024, 1024, 1024, 512]
    - [67, 64.2]
  - - [1024, 512, 1, 2048, 1024, 1024, 2048, 512]
    - [89, 86.51]
  - - [1024, 512, 1, 4096, 1024, 1024, 4096, 512]
    - [90, 103.24]
  - - [1024, 512, 1, 8192, 1024, 1024, 8192, 512]
    - [92, 107.01]
  - - [1024, 1024, 1, 128, 1024, 1024, 128, 1024]
    - [29, 24.69]
  - - [1024, 1024, 1, 256, 1024, 1024, 256, 1024]
    - [28, 43.18]
  - - [1024, 1024, 1, 512, 1024, 1024, 512, 1024]
    - [30, 70.28]
  - - [1024, 1024, 1, 1024, 1024, 1024, 1024, 1024]
    - [30, 103.21]
  - - [1024, 1024, 1, 2048, 1024, 1024, 2048, 1024]
    - [87, 127.64]
  - - [1024, 1024, 1, 4096, 1024, 1024, 4096, 1024]
    - [86, 148.19]
  - - [1024, 1024, 1, 8192, 1024, 1024, 8192, 1024]
    - [86, 158.63]
  - - [1024, 2048, 1, 128, 1024, 1024, 128, 2048]
    - [23, 38.63]
  - - [1024, 2048, 1, 256, 1024, 1024, 256, 2048]
    - [23, 67.41]
  - - [1024, 2048, 1, 512, 1024, 1024, 512, 2048]
    - [61, 106.7]
  - - [1024, 2048, 1, 1024, 1024, 1024, 1024, 2048]
    - [61, 152.86]
  - - [1024, 2048, 1, 2048, 1024, 1024, 2048, 2048]
    - [61, 192.46]
  - - [1024, 2048, 1, 4096, 1024, 1024, 4096, 2048]
    - [63, 214.52]
  - - [1024, 2048, 1, 8192, 1024, 1024, 8192, 2048]
    - [63, 201.69]
  - - [1024, 4096, 1, 128, 1024, 1024, 128, 4096]
    - [19, 58.4]
  - - [1024, 4096, 1, 256, 1024, 1024, 256, 4096]
    - [20, 99.38]
  - - [1024, 4096, 1, 512, 1024, 1024, 512, 4096]
    - [16, 149.7]
  - - [1024, 4096, 1, 1024, 1024, 1024, 1024, 4096]
    - [17, 196.91]
  - - [1024, 4096, 1, 2048, 1024, 1024, 2048, 4096]
    - [49, 241.99]
  - - [1024, 4096, 1, 4096, 1024, 1024, 4096, 4096]
    - [42, 258.44]
  - - [1024, 4096, 1, 8192, 1024, 1024, 8192, 4096]
    - [49, 237.6]
  - - [1024, 8192, 1, 128, 1024, 1024, 128, 8192]
    - [4, 68.24]
  - - [1024, 8192, 1, 256, 1024, 1024, 256, 8192]
    - [4, 115.81]
  - - [1024, 8192, 1, 512, 1024, 1024, 512, 8192]
    - [4, 175.66]
  - - [1024, 8192, 1, 1024, 1024, 1024, 1024, 8192]
    - [8, 235.57]
  - - [1024, 8192, 1, 2048, 1024, 1024, 2048, 8192]
    - [4, 278.12]
  - - [1024, 8192, 1, 4096, 1024, 1024, 4096, 8192]
    - [8, 263.05]
  - - [1024, 8192, 1, 8192, 1024, 1024, 8192, 8192]
    - [3, 282.2]
  - - [2048, 128, 1, 128, 2048, 2048, 128, 128]
    - [40, 8.04]
  - - [2048, 128, 1, 256, 2048, 2048, 256, 128]
    - [39, 14.35]
  - - [2048, 128, 1, 512, 2048, 2048, 512, 128]
    - [73, 23.94]
  - - [2048, 128, 1, 1024, 2048, 2048, 1024, 128]
    - [75, 37.71]
  - - [2048, 128, 1, 2048, 2048, 2048, 2048, 128]
    - [75, 51.86]
  - - [2048, 128, 1, 4096, 2048, 2048, 4096, 128]
    - [77, 63.28]
  - - [2048, 128, 1, 8192, 2048, 2048, 8192, 128]
    - [94, 71.29]
  - - [2048, 256, 1, 128, 2048, 2048, 128, 256]
    - [38, 14.74]
  - - [2048, 256, 1, 256, 2048, 2048, 256, 256]
    - [37, 25.89]
  - - [2048, 256, 1, 512, 2048, 2048, 512, 256]
    - [70, 42.48]
  - - [2048, 256, 1, 1024, 2048, 2048, 1024, 256]
    - [69, 64.4]
  - - [2048, 256, 1, 2048, 2048, 2048, 2048, 256]
    - [92, 87.03]
  - - [2048, 256, 1, 4096, 2048, 2048, 4096, 256]
    - [91, 105.72]
  - - [2048, 256, 1, 8192, 2048, 2048, 8192, 256]
    - [91, 117.67]
  - - [2048, 512, 1, 128, 2048, 2048, 128, 512]
    - [27, 24.87]
  - - [2048, 512, 1, 256, 2048, 2048, 256, 512]
    - [33, 43.82]
  - - [2048, 512, 1, 512, 2048, 2048, 512, 512]
    - [32, 69.9]
  - - [2048, 512, 1, 1024, 2048, 2048, 1024, 512]
    - [34, 103.48]
  - - [2048, 512, 1, 2048, 2048, 2048, 2048, 512]
    - [32, 135.02]
  - - [2048, 512, 1, 4096, 2048, 2048, 4096, 512]
    - [88, 149.71]
  - - [2048, 512, 1, 8192, 2048, 2048, 8192, 512]
    - [87, 159.37]
  - - [2048, 1024, 1, 128, 2048, 2048, 128, 1024]
    - [57, 39.06]
  - - [2048, 1024, 1, 256, 2048, 2048, 256, 1024]
    - [23, 67.95]
  - - [2048, 1024, 1, 512, 2048, 2048, 512, 1024]
    - [61, 108.68]
  - - [2048, 1024, 1, 1024, 2048, 2048, 1024, 1024]
    - [61, 154.33]
  - - [2048, 1024, 1, 2048, 2048, 2048, 2048, 1024]
    - [62, 190.87]
  - - [2048, 1024, 1, 4096, 2048, 2048, 4096, 1024]
    - [62, 207.83]
  - - [2048, 1024, 1, 8192, 2048, 2048, 8192, 1024]
    - [62, 203.82]
  - - [2048, 2048, 1, 128, 2048, 2048, 128, 2048]
    - [15, 55.53]
  - - [2048, 2048, 1, 256, 2048, 2048, 256, 2048]
    - [17, 96.31]
  - - [2048, 2048, 1, 512, 2048, 2048, 512, 2048]
    - [16, 146.81]
  - - [2048, 2048, 1, 1024, 2048, 2048, 1024, 2048]
    - [16, 195.42]
  - - [2048, 2048, 1, 2048, 2048, 2048, 2048, 2048]
    - [43, 240.49]
  - - [2048, 2048, 1, 4096, 2048, 2048, 4096, 2048]
    - [45, 256.97]
  - - [2048, 2048, 1, 8192, 2048, 2048, 8192, 2048]
    - [44, 236.68]
  - - [2048, 4096, 1, 128, 2048, 2048, 128, 4096]
    - [2, 65.02]
  - - [2048, 4096, 1, 256, 2048, 2048, 256, 4096]
    - [2, 110.84]
  - - [2048, 4096, 1, 512, 2048, 2048, 512, 4096]
    - [2, 172.09]
  - - [2048, 4096, 1, 1024, 2048, 2048, 1024, 4096]
    - [8, 234.99]
  - - [2048, 4096, 1, 2048, 2048, 2048, 2048, 4096]
    - [7, 269.76]
  - - [2048, 4096, 1, 4096, 2048, 2048, 4096, 4096]
    - [9, 261.97]
  - - [2048, 4096, 1, 8192, 2048, 2048, 8192, 4096]
    - [3, 280.58]
  - - [2048, 8192, 1, 128, 2048, 2048, 128, 8192]
    - [2, 71.24]
  - - [2048, 8192, 1, 256, 2048, 2048, 256, 8192]
    - [0, 118.42]
  - - [2048, 8192, 1, 512, 2048, 2048, 512, 8192]
    - [2, 184.62]
  - - [2048, 8192, 1, 1024, 2048, 2048, 1024, 8192]
    - [2, 232.82]
  - - [2048, 8192, 1, 2048, 2048, 2048, 2048, 8192]
    - [13, 240.9]
  - - [2048, 8192, 1, 4096, 2048, 2048, 4096, 8192]
    - [45, 276.25]
  - - [2048, 8192, 1, 8192, 2048, 2048, 8192, 8192]
    - [48, 306.98]
  - - [4096, 128, 1, 128, 4096, 4096, 128, 128]
    - [36, 15.08]
  - - [4096, 128, 1, 256, 4096, 4096, 256, 128]
    - [36, 27.25]
  - - [4096, 128, 1, 512, 4096, 4096, 512, 128]
    - [68, 43.64]
  - - [4096, 128, 1, 1024, 4096, 4096, 1024, 128]
    - [67, 65.7]
  - - [4096, 128, 1, 2048, 4096, 4096, 2048, 128]
    - [89, 87.6]
  - - [4096, 128, 1, 4096, 4096, 4096, 4096, 128]
    - [90, 105.07]
  - - [4096, 128, 1, 8192, 4096, 4096, 8192, 128]
    - [90, 117.9]
  - - [4096, 256, 1, 128, 4096, 4096, 128, 256]
    - [31, 25.42]
  - - [4096, 256, 1, 256, 4096, 4096, 256, 256]
    - [30, 44.81]
  - - [4096, 256, 1, 512, 4096, 4096, 512, 256]
    - [30, 72.87]
  - - [4096, 256, 1, 1024, 4096, 4096, 1024, 256]
    - [32, 104.97]
  - - [4096, 256, 1, 2048, 4096, 4096, 2048, 256]
    - [34, 135.57]
  - - [4096, 256, 1, 4096, 4096, 4096, 4096, 256]
    - [88, 148.13]
  - - [4096, 256, 1, 8192, 4096, 4096, 8192, 256]
    - [86, 157.52]
  - - [4096, 512, 1, 128, 4096, 4096, 128, 512]
    - [23, 39.15]
  - - [4096, 512, 1, 256, 4096, 4096, 256, 512]
    - [23, 67.63]
  - - [4096, 512, 1, 512, 4096, 4096, 512, 512]
    - [62, 105.98]
  - - [4096, 512, 1, 1024, 4096, 4096, 1024, 512]
    - [63, 154.19]
  - - [4096, 512, 1, 2048, 4096, 4096, 2048, 512]
    - [64, 194.98]
  - - [4096, 512, 1, 4096, 4096, 4096, 4096, 512]
    - [64, 203.03]
  - - [4096, 512, 1, 8192, 4096, 4096, 8192, 512]
    - [63, 203.79]
  - - [4096, 1024, 1, 128, 4096, 4096, 128, 1024]
    - [21, 57.95]
  - - [4096, 1024, 1, 256, 4096, 4096, 256, 1024]
    - [20, 99.4]
  - - [4096, 1024, 1, 512, 4096, 4096, 512, 1024]
    - [21, 148.14]
  - - [4096, 1024, 1, 1024, 4096, 4096, 1024, 1024]
    - [20, 193.61]
  - - [4096, 1024, 1, 2048, 4096, 4096, 2048, 1024]
    - [43, 239.81]
  - - [4096, 1024, 1, 4096, 4096, 4096, 4096, 1024]
    - [45, 258.67]
  - - [4096, 1024, 1, 8192, 4096, 4096, 8192, 1024]
    - [44, 239.68]
  - - [4096, 2048, 1, 128, 4096, 4096, 128, 2048]
    - [1, 64.53]
  - - [4096, 2048, 1, 256, 4096, 4096, 256, 2048]
    - [8, 107.44]
  - - [4096, 2048, 1, 512, 4096, 4096, 512, 2048]
    - [2, 168.4]
  - - [4096, 2048, 1, 1024, 4096, 4096, 1024, 2048]
    - [3, 230.52]
  - - [4096, 2048, 1, 2048, 4096, 4096, 2048, 2048]
    - [8, 274.73]
  - - [4096, 2048, 1, 4096, 4096, 4096, 4096, 2048]
    - [52, 265.03]
  - - [4096, 2048, 1, 8192, 4096, 4096, 8192, 2048]
    - [52, 279.56]
  - - [4096, 4096, 1, 128, 4096, 4096, 128, 4096]
    - [17, 67.49]
  - - [4096, 4096, 1, 256, 4096, 4096, 256, 4096]
    - [16, 115.49]
  - - [4096, 4096, 1, 512, 4096, 4096, 512, 4096]
    - [4, 181.25]
  - - [4096, 4096, 1, 1024, 4096, 4096, 1024, 4096]
    - [8, 230.07]
  - - [4096, 4096, 1, 2048, 4096, 4096, 2048, 4096]
    - [13, 238.62]
  - - [4096, 4096, 1, 4096, 4096, 4096, 4096, 4096]
    - [50, 293.66]
  - - [4096, 4096, 1, 8192, 4096, 4096, 8192, 4096]
    - [49, 312.81]
  - - [4096, 8192, 1, 128, 4096, 4096, 128, 8192]
    - [14, 74.09]
  - - [4096, 8192, 1, 256, 4096, 4096, 256, 8192]
    - [0, 120.72]
  - - [4096, 8192, 1, 512, 4096, 4096, 512, 8192]
    - [12, 181.03]
  - - [4096, 8192, 1, 1024, 4096, 4096, 1024, 8192]
    - [47, 222.16]
  - - [4096, 8192, 1, 2048, 4096, 4096, 2048, 8192]
    - [1, 273.11]
  - - [4096, 8192, 1, 4096, 4096, 4096, 4096, 8192]
    - [2, 326.82]
  - - [4096, 8192, 1, 8192, 4096, 4096, 8192, 8192]
    - [2, 355.13]
  - - [8192, 128, 1, 128, 8192, 8192, 128, 128]
    - [25, 24.97]
  - - [8192, 128, 1, 256, 8192, 8192, 256, 128]
    - [26, 43.37]
  - - [8192, 128, 1, 512, 8192, 8192, 512, 128]
    - [30, 70.25]
  - - [8192, 128, 1, 1024, 8192, 8192, 1024, 128]
    - [30, 104.49]
  - - [8192, 128, 1, 2048, 8192, 8192, 2048, 128]
    - [34, 132.67]
  - - [8192, 128, 1, 4096, 8192, 8192, 4096, 128]
    - [66, 144.66]
  - - [8192, 128, 1, 8192, 8192, 8192, 8192, 128]
    - [91, 156.17]
  - - [8192, 256, 1, 128, 8192, 8192, 128, 256]
    - [55, 37.24]
  - - [8192, 256, 1, 256, 8192, 8192, 256, 256]
    - [24, 65.1]
  - - [8192, 256, 1, 512, 8192, 8192, 512, 256]
    - [62, 104.21]
  - - [8192, 256, 1, 1024, 8192, 8192, 1024, 256]
    - [63, 153.89]
  - - [8192, 256, 1, 2048, 8192, 8192, 2048, 256]
    - [62, 187.69]
  - - [8192, 256, 1, 4096, 8192, 8192, 4096, 256]
    - [63, 203.31]
  - - [8192, 256, 1, 8192, 8192, 8192, 8192, 256]
    - [64, 202.03]
  - - [8192, 512, 1, 128, 8192, 8192, 128, 512]
    - [21, 53.63]
  - - [8192, 512, 1, 256, 8192, 8192, 256, 512]
    - [20, 92.17]
  - - [8192, 512, 1, 512, 8192, 8192, 512, 512]
    - [59, 145.34]
  - - [8192, 512, 1, 1024, 8192, 8192, 1024, 512]
    - [59, 209.61]
  - - [8192, 512, 1, 2048, 8192, 8192, 2048, 512]
    - [60, 238.52]
  - - [8192, 512, 1, 4096, 8192, 8192, 4096, 512]
    - [58, 266.1]
  - - [8192, 512, 1, 8192, 8192, 8192, 8192, 512]
    - [59, 254.23]
  - - [8192, 1024, 1, 128, 8192, 8192, 128, 1024]
    - [4, 62.73]
  - - [8192, 1024, 1, 256, 8192, 8192, 256, 1024]
    - [52, 108.77]
  - - [8192, 1024, 1, 512, 8192, 8192, 512, 1024]
    - [54, 177.25]
  - - [8192, 1024, 1, 1024, 8192, 8192, 1024, 1024]
    - [10, 229.86]
  - - [8192, 1024, 1, 2048, 8192, 8192, 2048, 1024]
    - [53, 284.96]
  - - [8192, 1024, 1, 4096, 8192, 8192, 4096, 1024]
    - [51, 346.42]
  - - [8192, 1024, 1, 8192, 8192, 8192, 8192, 1024]
    - [52, 363.57]
  - - [8192, 2048, 1, 128, 8192, 8192, 128, 2048]
    - [54, 68.05]
  - - [8192, 2048, 1, 256, 8192, 8192, 256, 2048]
    - [54, 116.61]
  - - [8192, 2048, 1, 512, 8192, 8192, 512, 2048]
    - [4, 178.85]
  - - [8192, 2048, 1, 1024, 8192, 8192, 1024, 2048]
    - [52, 238.76]
  - - [8192, 2048, 1, 2048, 8192, 8192, 2048, 2048]
    - [51, 291.82]
  - - [8192, 2048, 1, 4096, 8192, 8192, 4096, 2048]
    - [51, 332.56]
  - - [8192, 2048, 1, 8192, 8192, 8192, 8192, 2048]
    - [51, 387.36]
  - - [8192, 4096, 1, 128, 8192, 8192, 128, 4096]
    - [6, 71.78]
  - - [8192, 4096, 1, 256, 8192, 8192, 256, 4096]
    - [0, 119.82]
  - - [8192, 4096, 1, 512, 8192, 8192, 512, 4096]
    - [54, 176.82]
  - - [8192, 4096, 1, 1024, 8192, 8192, 1024, 4096]
    - [54, 229.8]
  - - [8192, 4096, 1, 2048, 8192, 8192, 2048, 4096]
    - [51, 293.5]
  - - [8192, 4096, 1, 4096, 8192, 8192, 4096, 4096]
    - [51, 353.83]
  - - [8192, 4096, 1, 8192, 8192, 8192, 8192, 4096]
    - [52, 405.38]
  - - [8192, 8192, 1, 128, 8192, 8192, 128, 8192]
    - [4, 63.42]
  - - [8192, 8192, 1, 256, 8192, 8192, 256, 8192]
    - [18, 112.79]
  - - [8192, 8192, 1, 512, 8192, 8192, 512, 8192]
    - [5, 165.69]
  - - [8192, 8192, 1, 1024, 8192, 8192, 1024, 8192]
    - [7, 238.27]
  - - [8192, 8192, 1, 2048, 8192, 8192, 2048, 8192]
    - [51, 304.0]
  - - [8192, 8192, 1, 4096, 8192, 8192, 4096, 8192]
    - [51, 365.05]
  - - [8192, 8192, 1, 8192, 8192, 8192, 8192, 8192]
    - [52, 402.11]
- null
- null
- ExperimentalStreamK
- GridBased
