projects/hipblaslt/library/src/amd_detail/rocblaslt/src/Tensile/Logic/asm_full/aquavanjaram/gfx942_228cu/StreamK/aquavanjaram942_Cijk_Ailk_Bljk_F8NBS_BH_Bias_HAS_SAV_UserArgs.yaml
- {MinimumRequiredVersion: 4.33.0}
- aquavanjaram942
- {Architecture: gfx942, CUCount: 228}
- [Device 0049, Device 0050]
    SolutionIndex: 0
    SolutionNameMin: Cijk_Ailk_Bljk_F8NBS_BH_Bias_HAS_SAV_UserArgs_MT256x256x64_MI16x16x1_SN_LDSB1_CLR1_GRVWA16_GRVWB16_GSU0_GSUC0_GSUWGMRR0_K1_LBSPPA2048_LBSPPB512_LPA0_LPB16_LRVW8_MIWT8_8_PLR1_SU0_SUM0_SUS64_VWA8_VWB8_WGM1_WGMXCC1_WGMXCCGn1
    SolutionIndex: 1
    SolutionNameMin: Cijk_Ailk_Bljk_F8NBS_BH_Bias_HAS_SAV_UserArgs_MT256x256x64_MI16x16x1_SN_LDSB1_CLR1_GRVWA16_GRVWB8_GSU0_GSUC0_GSUWGMRR0_K1_LBSPPA2048_LBSPPB512_LPA0_LPB8_LRVW8_MIWT8_8_PLR1_SU0_SUM0_SUS64_VWA8_VWB8_WGM4_WGMXCC1_WGMXCCGn1
    SolutionIndex: 2
    SolutionNameMin: Cijk_Ailk_Bljk_F8NBS_BH_Bias_HAS_SAV_UserArgs_MT256x256x64_MI16x16x1_SN_LDSB1_CLR1_GRVWA8_GRVWB16_GSU0_GSUC0_GSUWGMRR0_K1_LBSPPA2048_LBSPPB512_LPA0_LPB16_LRVW8_MIWT8_8_PLR1_SU0_SUM0_SUS64_VWA8_VWB8_WGM4_WGMXCC1_WGMXCCGn1
    SolutionIndex: 3
    SolutionNameMin: Cijk_Ailk_Bljk_F8NBS_BH_Bias_HAS_SAV_UserArgs_MT256x256x64_MI16x16x1_SN_LDSB1_CLR1_GRVWA16_GRVWB16_GSU0_GSUC0_GSUWGMRR0_K1_LBSPPA2048_LBSPPB512_LPA0_LPB16_LRVW8_MIWT8_8_PLR1_SU0_SUM0_SUS64_VWA8_VWB8_WGM4_WGMXCC1_WGMXCCGn1
    SolutionIndex: 4
    SolutionNameMin: Cijk_Ailk_Bljk_F8NBS_BH_Bias_HAS_SAV_UserArgs_MT256x256x64_MI16x16x1_SN_LDSB1_CLR1_GRVWA8_GRVWB16_GSU0_GSUC0_GSUWGMRR0_K1_LBSPPA2048_LBSPPB512_LPA0_LPB16_LRVW8_MIWT8_8_PLR1_SU0_SUM0_SUS64_VWA8_VWB8_WGM6_WGMXCC1_WGMXCCGn1
    SolutionIndex: 5
    SolutionNameMin: Cijk_Ailk_Bljk_F8NBS_BH_Bias_HAS_SAV_UserArgs_MT256x256x64_MI16x16x1_SN_LDSB1_CLR1_GRVWA16_GRVWB16_GSU0_GSUC0_GSUWGMRR0_K1_LBSPPA2048_LBSPPB512_LPA0_LPB16_LRVW8_MIWT8_8_PLR1_SU0_SUM0_SUS64_VWA8_VWB8_WGM6_WGMXCC1_WGMXCCGn1
    SolutionIndex: 6
    SolutionNameMin: Cijk_Ailk_Bljk_F8NBS_BH_Bias_HAS_SAV_UserArgs_MT256x256x64_MI16x16x1_SN_LDSB1_CLR1_GRVWA16_GRVWB8_GSU0_GSUC0_GSUWGMRR0_K1_LBSPPA2048_LBSPPB512_LPA0_LPB8_LRVW8_MIWT8_8_PLR1_SU0_SUM0_SUS64_VWA8_VWB8_WGM8_WGMXCC1_WGMXCCGn1
    SolutionIndex: 7
    SolutionNameMin: Cijk_Ailk_Bljk_F8NBS_BH_Bias_HAS_SAV_UserArgs_MT256x256x64_MI16x16x1_SN_LDSB1_CLR1_GRVWA8_GRVWB16_GSU0_GSUC0_GSUWGMRR0_K1_LBSPPA2048_LBSPPB512_LPA0_LPB16_LRVW8_MIWT8_8_PLR1_SU0_SUM0_SUS64_VWA8_VWB8_WGM8_WGMXCC1_WGMXCCGn1
    SolutionIndex: 8
    SolutionNameMin: Cijk_Ailk_Bljk_F8NBS_BH_Bias_HAS_SAV_UserArgs_MT256x256x64_MI16x16x1_SN_LDSB1_CLR1_GRVWA16_GRVWB16_GSU0_GSUC0_GSUWGMRR0_K1_LBSPPA2048_LBSPPB512_LPA0_LPB16_LRVW8_MIWT8_8_PLR1_SU0_SUM0_SUS64_VWA8_VWB8_WGM8_WGMXCC1_WGMXCCGn1
    SolutionIndex: 9
    SolutionNameMin: Cijk_Ailk_Bljk_F8NBS_BH_Bias_HAS_SAV_UserArgs_MT128x256x64_MI16x16x1_SN_LDSB1_CLR1_GRVWA8_GRVWB16_GSU0_GSUC0_GSUWGMRR0_K1_LBSPPA1024_LBSPPB512_LPA64_LPB16_LRVW8_MIWT4_8_PLR1_SU0_SUM0_SUS64_VWA4_VWB8_WGM4_WGMXCC1_WGMXCCGn1
    SolutionIndex: 10
    SolutionNameMin: Cijk_Ailk_Bljk_F8NBS_BH_Bias_HAS_SAV_UserArgs_MT128x256x64_MI16x16x1_SN_LDSB1_CLR1_GRVWA8_GRVWB16_GSU0_GSUC0_GSUWGMRR0_K1_LBSPPA1024_LBSPPB512_LPA64_LPB16_LRVW8_MIWT4_8_PLR1_SU0_SUM0_SUS64_VWA4_VWB8_WGM6_WGMXCC1_WGMXCCGn1
    SolutionIndex: 11
    SolutionNameMin: Cijk_Ailk_Bljk_F8NBS_BH_Bias_HAS_SAV_UserArgs_MT128x256x64_MI16x16x1_SN_LDSB1_CLR1_GRVWA16_GRVWB16_GSU0_GSUC0_GSUWGMRR0_K1_LBSPPA1024_LBSPPB512_LPA64_LPB16_LRVW8_MIWT4_8_PLR1_SU0_SUM0_SUS64_VWA4_VWB8_WGM6_WGMXCC1_WGMXCCGn1
    SolutionIndex: 12
    SolutionNameMin: Cijk_Ailk_Bljk_F8NBS_BH_Bias_HAS_SAV_UserArgs_MT256x128x64_MI16x16x1_SN_LDSB1_CLR1_GRVWA16_GRVWB8_GSU0_GSUC0_GSUWGMRR0_K1_LBSPPA2048_LBSPPB256_LPA0_LPB8_LRVW8_MIWT8_4_PLR1_SU0_SUM0_SUS64_VWA8_VWB4_WGM1_WGMXCC1_WGMXCCGn1
    SolutionIndex: 13
    SolutionNameMin: Cijk_Ailk_Bljk_F8NBS_BH_Bias_HAS_SAV_UserArgs_MT256x128x64_MI16x16x1_SN_LDSB1_CLR1_GRVWA16_GRVWB16_GSU0_GSUC0_GSUWGMRR0_K1_LBSPPA2048_LBSPPB256_LPA0_LPB16_LRVW8_MIWT8_4_PLR1_SU0_SUM0_SUS64_VWA8_VWB4_WGM1_WGMXCC1_WGMXCCGn1
    SolutionIndex: 14
    SolutionNameMin: Cijk_Ailk_Bljk_F8NBS_BH_Bias_HAS_SAV_UserArgs_MT256x128x64_MI16x16x1_SN_LDSB1_CLR1_GRVWA8_GRVWB16_GSU0_GSUC0_GSUWGMRR0_K1_LBSPPA2048_LBSPPB256_LPA0_LPB16_LRVW8_MIWT8_4_PLR1_SU0_SUM0_SUS64_VWA8_VWB4_WGM8_WGMXCC1_WGMXCCGn1
    SolutionIndex: 15
    SolutionNameMin: Cijk_Ailk_Bljk_F8NBS_BH_Bias_HAS_SAV_UserArgs_MT256x128x64_MI16x16x1_SN_LDSB1_CLR1_GRVWA16_GRVWB16_GSU0_GSUC0_GSUWGMRR0_K1_LBSPPA2048_LBSPPB256_LPA0_LPB16_LRVW8_MIWT8_4_PLR1_SU0_SUM0_SUS64_VWA8_VWB4_WGM8_WGMXCC1_WGMXCCGn1
    SolutionIndex: 16
    SolutionNameMin: Cijk_Ailk_Bljk_F8NBS_BH_Bias_HAS_SAV_UserArgs_MT128x128x64_MI16x16x1_SN_LDSB1_CLR1_GRVWA8_GRVWB16_GSU0_GSUC0_GSUWGMRR0_K1_LBSPPA1024_LBSPPB128_LPA0_LPB16_LRVW8_MIWT8_2_PLR1_SU0_SUM0_SUS64_VWA8_VWB2_WGM1_WGMXCC1_WGMXCCGn1
    SolutionIndex: 17
    SolutionNameMin: Cijk_Ailk_Bljk_F8NBS_BH_Bias_HAS_SAV_UserArgs_MT128x128x64_MI16x16x1_SN_LDSB1_CLR1_GRVWA16_GRVWB16_GSU0_GSUC0_GSUWGMRR0_K1_LBSPPA1024_LBSPPB128_LPA0_LPB16_LRVW8_MIWT8_2_PLR1_SU0_SUM0_SUS64_VWA8_VWB2_WGM1_WGMXCC1_WGMXCCGn1
    SolutionIndex: 18
    SolutionNameMin: Cijk_Ailk_Bljk_F8NBS_BH_Bias_HAS_SAV_UserArgs_MT128x128x64_MI16x16x1_SN_LDSB1_CLR1_GRVWA16_GRVWB16_GSU0_GSUC0_GSUWGMRR0_K1_LBSPPA1024_LBSPPB128_LPA0_LPB16_LRVW8_MIWT8_2_PLR1_SU0_SUM0_SUS64_VWA8_VWB2_WGM6_WGMXCC1_WGMXCCGn1
    SolutionIndex: 19
    SolutionNameMin: Cijk_Ailk_Bljk_F8NBS_BH_Bias_HAS_SAV_UserArgs_MT128x64x64_MI16x16x1_SN_LDSB0_CLR1_GRVWA8_GRVWB16_GSU0_GSUC0_GSUWGMRR0_K1_LBSPPA1024_LBSPPB128_LPA0_LPB16_LRVW8_MIWT8_1_PLR1_SU0_SUM0_SUS64_VWA8_VWB1_WGM1_WGMXCC1_WGMXCCGn1
    SolutionIndex: 20
    SolutionNameMin: Cijk_Ailk_Bljk_F8NBS_BH_Bias_HAS_SAV_UserArgs_MT64x128x64_MI16x16x1_SN_LDSB0_CLR1_GRVWA16_GRVWB8_GSU0_GSUC0_GSUWGMRR0_K1_LBSPPA512_LBSPPB256_LPA32_LPB8_LRVW8_MIWT2_4_PLR1_SU0_SUM0_SUS64_VWA2_VWB4_WGM1_WGMXCC1_WGMXCCGn1
    SolutionIndex: 21
    SolutionNameMin: Cijk_Ailk_Bljk_F8NBS_BH_Bias_HAS_SAV_UserArgs_MT64x128x64_MI16x16x1_SN_LDSB0_CLR1_GRVWA8_GRVWB16_GSU0_GSUC0_GSUWGMRR0_K1_LBSPPA512_LBSPPB256_LPA32_LPB16_LRVW8_MIWT2_4_PLR1_SU0_SUM0_SUS64_VWA2_VWB4_WGM1_WGMXCC1_WGMXCCGn1
    SolutionIndex: 22
    SolutionNameMin: Cijk_Ailk_Bljk_F8NBS_BH_Bias_HAS_SAV_UserArgs_MT128x64x64_MI16x16x1_SN_LDSB0_CLR1_GRVWA8_GRVWB16_GSU0_GSUC0_GSUWGMRR0_K1_LBSPPA1024_LBSPPB128_LPA64_LPB16_LRVW8_MIWT4_2_PLR1_SU0_SUM0_SUS64_VWA4_VWB2_WGM1_WGMXCC1_WGMXCCGn1
    SolutionIndex: 23
    SolutionNameMin: Cijk_Ailk_Bljk_F8NBS_BH_Bias_HAS_SAV_UserArgs_MT128x64x64_MI16x16x1_SN_LDSB0_CLR1_GRVWA16_GRVWB16_GSU0_GSUC0_GSUWGMRR0_K1_LBSPPA1024_LBSPPB128_LPA64_LPB16_LRVW8_MIWT4_2_PLR1_SU0_SUM0_SUS64_VWA4_VWB2_WGM1_WGMXCC1_WGMXCCGn1
    SolutionIndex: 24
    SolutionNameMin: Cijk_Ailk_Bljk_F8NBS_BH_Bias_HAS_SAV_UserArgs_MT128x32x64_MI16x16x1_SN_LDSB0_CLR1_GRVWA16_GRVWB8_GSU0_GSUC0_GSUWGMRR0_K1_LBSPPA1024_LBSPPB128_LPA64_LPB8_LRVW8_MIWT4_1_PLR1_SU0_SUM0_SUS64_VWA4_VWB1_WGM1_WGMXCC1_WGMXCCGn1
    SolutionIndex: 25
    SolutionNameMin: Cijk_Ailk_Bljk_F8NBS_BH_Bias_HAS_SAV_UserArgs_MT64x64x64_MI16x16x1_SN_LDSB0_CLR1_GRVWA8_GRVWB8_GSU0_GSUC0_GSUWGMRR0_K1_LBSPPA512_LBSPPB128_LPA32_LPB8_LRVW8_MIWT2_2_PLR1_SU0_SUM0_SUS64_VWA2_VWB2_WGM1_WGMXCC1_WGMXCCGn1
    SolutionIndex: 26
    SolutionNameMin: Cijk_Ailk_Bljk_F8NBS_BH_Bias_HAS_SAV_UserArgs_MT64x64x64_MI16x16x1_SN_LDSB0_CLR1_GRVWA8_GRVWB16_GSU0_GSUC0_GSUWGMRR0_K1_LBSPPA512_LBSPPB128_LPA32_LPB16_LRVW8_MIWT2_2_PLR1_SU0_SUM0_SUS64_VWA2_VWB2_WGM1_WGMXCC1_WGMXCCGn1
    SolutionIndex: 27
    SolutionNameMin: Cijk_Ailk_Bljk_F8NBS_BH_Bias_HAS_SAV_UserArgs_MT64x32x64_MI16x16x1_SN_LDSB0_CLR1_GRVWA8_GRVWB8_GSU0_GSUC0_GSUWGMRR0_K1_LBSPPA512_LBSPPB128_LPA32_LPB8_LRVW8_MIWT2_1_PLR1_SU0_SUM0_SUS64_VWA2_VWB1_WGM1_WGMXCC1_WGMXCCGn1
    SolutionIndex: 28
    SolutionNameMin: Cijk_Ailk_Bljk_F8NBS_BH_Bias_HAS_SAV_UserArgs_MT32x32x64_MI16x16x1_SN_LDSB0_CLR1_GRVWA8_GRVWB8_GSU0_GSUC0_GSUWGMRR0_K1_LBSPPA256_LBSPPB128_LPA16_LPB8_LRVW8_MIWT1_1_PLR1_SU0_SUM0_SUS64_VWA1_VWB1_WGM1_WGMXCC1_WGMXCCGn1
    SolutionIndex: 29
    SolutionNameMin: Cijk_Ailk_Bljk_F8NBS_BH_Bias_HAS_SAV_UserArgs_MT128x256x128_MI16x16x1_SN_LDSB1_CLR1_GRVWA8_GRVWB16_GSU0_GSUC0_GSUWGMRR0_K1_LBSPPA1024_LBSPPB1024_LPA64_LPB16_LRVW8_MIWT4_8_PLR1_SU0_SUM0_SUS128_VWA4_VWB8_WGM1_WGMXCC1_WGMXCCGn1
    SolutionIndex: 30
    SolutionNameMin: Cijk_Ailk_Bljk_F8NBS_BH_Bias_HAS_SAV_UserArgs_MT128x256x128_MI16x16x1_SN_LDSB1_CLR1_GRVWA16_GRVWB16_GSU0_GSUC0_GSUWGMRR0_K1_LBSPPA1024_LBSPPB1024_LPA64_LPB16_LRVW8_MIWT4_8_PLR1_SU0_SUM0_SUS128_VWA4_VWB8_WGM1_WGMXCC1_WGMXCCGn1
    SolutionIndex: 31
    SolutionNameMin: Cijk_Ailk_Bljk_F8NBS_BH_Bias_HAS_SAV_UserArgs_MT128x256x128_MI16x16x1_SN_LDSB1_CLR1_GRVWA16_GRVWB16_GSU0_GSUC0_GSUWGMRR0_K1_LBSPPA1024_LBSPPB1024_LPA64_LPB16_LRVW8_MIWT4_8_PLR1_SU0_SUM0_SUS128_VWA4_VWB8_WGM4_WGMXCC1_WGMXCCGn1
    SolutionIndex: 32
    SolutionNameMin: Cijk_Ailk_Bljk_F8NBS_BH_Bias_HAS_SAV_UserArgs_MT128x256x128_MI16x16x1_SN_LDSB1_CLR1_GRVWA16_GRVWB16_GSU0_GSUC0_GSUWGMRR0_K1_LBSPPA1024_LBSPPB1024_LPA64_LPB16_LRVW8_MIWT4_8_PLR1_SU0_SUM0_SUS128_VWA4_VWB8_WGM6_WGMXCC1_WGMXCCGn1
    SolutionIndex: 33
    SolutionNameMin: Cijk_Ailk_Bljk_F8NBS_BH_Bias_HAS_SAV_UserArgs_MT128x256x128_MI16x16x1_SN_LDSB1_CLR1_GRVWA16_GRVWB16_GSU0_GSUC0_GSUWGMRR0_K1_LBSPPA1024_LBSPPB1024_LPA64_LPB16_LRVW8_MIWT4_8_PLR1_SU0_SUM0_SUS128_VWA4_VWB8_WGM8_WGMXCC1_WGMXCCGn1
    SolutionIndex: 34
    SolutionNameMin: Cijk_Ailk_Bljk_F8NBS_BH_Bias_HAS_SAV_UserArgs_MT256x144x128_MI16x16x1_SN_LDSB1_CLR1_GRVWA8_GRVWB8_GSU0_GSUC0_GSUWGMRR0_K1_LBSPPA2048_LBSPPB128_LPA64_LPB8_LRVW8_MIWT4_9_PLR1_SU0_SUM0_SUS128_VWA4_VWB1_WGM1_WGMXCC1_WGMXCCGn1
    SolutionIndex: 35
    SolutionNameMin: Cijk_Ailk_Bljk_F8NBS_BH_Bias_HAS_SAV_UserArgs_MT256x144x128_MI16x16x1_SN_LDSB1_CLR1_GRVWA16_GRVWB8_GSU0_GSUC0_GSUWGMRR0_K1_LBSPPA2048_LBSPPB128_LPA64_LPB8_LRVW8_MIWT4_9_PLR1_SU0_SUM0_SUS128_VWA4_VWB1_WGM1_WGMXCC1_WGMXCCGn1
    SolutionIndex: 36
    SolutionNameMin: Cijk_Ailk_Bljk_F8NBS_BH_Bias_HAS_SAV_UserArgs_MT256x144x128_MI16x16x1_SN_LDSB1_CLR1_GRVWA8_GRVWB8_GSU0_GSUC0_GSUWGMRR0_K1_LBSPPA2048_LBSPPB128_LPA64_LPB8_LRVW8_MIWT4_9_PLR1_SU0_SUM0_SUS128_VWA4_VWB1_WGM4_WGMXCC1_WGMXCCGn1
    SolutionIndex: 37
    SolutionNameMin: Cijk_Ailk_Bljk_F8NBS_BH_Bias_HAS_SAV_UserArgs_MT256x144x128_MI16x16x1_SN_LDSB1_CLR1_GRVWA16_GRVWB8_GSU0_GSUC0_GSUWGMRR0_K1_LBSPPA2048_LBSPPB128_LPA64_LPB8_LRVW8_MIWT4_9_PLR1_SU0_SUM0_SUS128_VWA4_VWB1_WGM4_WGMXCC1_WGMXCCGn1
    SolutionIndex: 38
    SolutionNameMin: Cijk_Ailk_Bljk_F8NBS_BH_Bias_HAS_SAV_UserArgs_MT256x144x128_MI16x16x1_SN_LDSB1_CLR1_GRVWA8_GRVWB8_GSU0_GSUC0_GSUWGMRR0_K1_LBSPPA2048_LBSPPB128_LPA64_LPB8_LRVW8_MIWT4_9_PLR1_SU0_SUM0_SUS128_VWA4_VWB1_WGM6_WGMXCC1_WGMXCCGn1
    SolutionIndex: 39
    SolutionNameMin: Cijk_Ailk_Bljk_F8NBS_BH_Bias_HAS_SAV_UserArgs_MT256x144x128_MI16x16x1_SN_LDSB1_CLR1_GRVWA16_GRVWB8_GSU0_GSUC0_GSUWGMRR0_K1_LBSPPA2048_LBSPPB128_LPA64_LPB8_LRVW8_MIWT4_9_PLR1_SU0_SUM0_SUS128_VWA4_VWB1_WGM6_WGMXCC1_WGMXCCGn1
    SolutionIndex: 40
    SolutionNameMin: Cijk_Ailk_Bljk_F8NBS_BH_Bias_HAS_SAV_UserArgs_MT256x144x128_MI16x16x1_SN_LDSB1_CLR1_GRVWA16_GRVWB8_GSU0_GSUC0_GSUWGMRR0_K1_LBSPPA2048_LBSPPB128_LPA64_LPB8_LRVW8_MIWT4_9_PLR1_SU0_SUM0_SUS128_VWA4_VWB1_WGM8_WGMXCC1_WGMXCCGn1
    SolutionIndex: 41
    SolutionNameMin: Cijk_Ailk_Bljk_F8NBS_BH_Bias_HAS_SAV_UserArgs_MT256x128x128_MI16x16x1_SN_LDSB1_CLR1_GRVWA16_GRVWB8_GSU0_GSUC0_GSUWGMRR0_K1_LBSPPA2048_LBSPPB512_LPA0_LPB8_LRVW8_MIWT8_4_PLR1_SU0_SUM0_SUS128_VWA8_VWB4_WGM1_WGMXCC1_WGMXCCGn1
    SolutionIndex: 42
    SolutionNameMin: Cijk_Ailk_Bljk_F8NBS_BH_Bias_HAS_SAV_UserArgs_MT256x128x128_MI16x16x1_SN_LDSB1_CLR1_GRVWA16_GRVWB16_GSU0_GSUC0_GSUWGMRR0_K1_LBSPPA2048_LBSPPB512_LPA0_LPB16_LRVW8_MIWT8_4_PLR1_SU0_SUM0_SUS128_VWA8_VWB4_WGM6_WGMXCC1_WGMXCCGn1
    SolutionIndex: 43
    SolutionNameMin: Cijk_Ailk_Bljk_F8NBS_BH_Bias_HAS_SAV_UserArgs_MT256x128x128_MI16x16x1_SN_LDSB1_CLR1_GRVWA8_GRVWB8_GSU0_GSUC0_GSUWGMRR0_K1_LBSPPA2048_LBSPPB512_LPA0_LPB8_LRVW8_MIWT8_4_PLR1_SU0_SUM0_SUS128_VWA8_VWB4_WGM8_WGMXCC1_WGMXCCGn1
    SolutionIndex: 44
    SolutionNameMin: Cijk_Ailk_Bljk_F8NBS_BH_Bias_HAS_SAV_UserArgs_MT256x128x128_MI16x16x1_SN_LDSB1_CLR1_GRVWA16_GRVWB8_GSU0_GSUC0_GSUWGMRR0_K1_LBSPPA2048_LBSPPB512_LPA0_LPB8_LRVW8_MIWT8_4_PLR1_SU0_SUM0_SUS128_VWA8_VWB4_WGM8_WGMXCC1_WGMXCCGn1
    SolutionIndex: 45
    SolutionNameMin: Cijk_Ailk_Bljk_F8NBS_BH_Bias_HAS_SAV_UserArgs_MT128x128x128_MI16x16x1_SN_LDSB1_CLR1_GRVWA8_GRVWB16_GSU0_GSUC0_GSUWGMRR0_K1_LBSPPA1024_LBSPPB256_LPA0_LPB16_LRVW8_MIWT8_2_PLR1_SU0_SUM0_SUS128_VWA8_VWB2_WGM1_WGMXCC1_WGMXCCGn1
    SolutionIndex: 46
    SolutionNameMin: Cijk_Ailk_Bljk_F8NBS_BH_Bias_HAS_SAV_UserArgs_MT128x128x128_MI16x16x1_SN_LDSB1_CLR1_GRVWA16_GRVWB16_GSU0_GSUC0_GSUWGMRR0_K1_LBSPPA1024_LBSPPB256_LPA0_LPB16_LRVW8_MIWT8_2_PLR1_SU0_SUM0_SUS128_VWA8_VWB2_WGM1_WGMXCC1_WGMXCCGn1
    SolutionIndex: 47
    SolutionNameMin: Cijk_Ailk_Bljk_F8NBS_BH_Bias_HAS_SAV_UserArgs_MT128x128x128_MI16x16x1_SN_LDSB1_CLR1_GRVWA16_GRVWB16_GSU0_GSUC0_GSUWGMRR0_K1_LBSPPA1024_LBSPPB256_LPA0_LPB16_LRVW8_MIWT8_2_PLR1_SU0_SUM0_SUS128_VWA8_VWB2_WGM6_WGMXCC1_WGMXCCGn1
    SolutionIndex: 48
    SolutionNameMin: Cijk_Ailk_Bljk_F8NBS_BH_Bias_HAS_SAV_UserArgs_MT128x144x128_MI16x16x1_SN_LDSB1_CLR1_GRVWA16_GRVWB8_GSU0_GSUC0_GSUWGMRR0_K1_LBSPPA1024_LBSPPB128_LPA32_LPB8_LRVW8_MIWT2_9_PLR1_SU0_SUM0_SUS128_VWA2_VWB1_WGM1_WGMXCC1_WGMXCCGn1
    SolutionIndex: 49
    SolutionNameMin: Cijk_Ailk_Bljk_F8NBS_BH_Bias_HAS_SAV_UserArgs_MT128x144x128_MI16x16x1_SN_LDSB1_CLR1_GRVWA16_GRVWB8_GSU0_GSUC0_GSUWGMRR0_K1_LBSPPA1024_LBSPPB128_LPA32_LPB8_LRVW8_MIWT2_9_PLR1_SU0_SUM0_SUS128_VWA2_VWB1_WGM6_WGMXCC1_WGMXCCGn1
    SolutionIndex: 50
    SolutionNameMin: Cijk_Ailk_Bljk_F8NBS_BH_Bias_HAS_SAV_UserArgs_MT128x128x128_MI16x16x1_SN_LDSB1_CLR1_GRVWA16_GRVWB16_GSU0_GSUC0_GSUWGMRR0_K1_LBSPPA1024_LBSPPB512_LPA64_LPB16_LRVW8_MIWT4_4_PLR1_SU0_SUM0_SUS128_VWA4_VWB4_WGM1_WGMXCC1_WGMXCCGn1
    SolutionIndex: 51
    SolutionNameMin: Cijk_Ailk_Bljk_F8NBS_BH_Bias_HAS_SAV_UserArgs_MT128x128x128_MI16x16x1_SN_LDSB1_CLR1_GRVWA16_GRVWB16_GSU0_GSUC0_GSUWGMRR0_K1_LBSPPA1024_LBSPPB512_LPA64_LPB16_LRVW8_MIWT4_4_PLR1_SU0_SUM0_SUS128_VWA4_VWB4_WGM4_WGMXCC1_WGMXCCGn1
    SolutionIndex: 52
    SolutionNameMin: Cijk_Ailk_Bljk_F8NBS_BH_Bias_HAS_SAV_UserArgs_MT128x128x128_MI16x16x1_SN_LDSB1_CLR1_GRVWA16_GRVWB16_GSU0_GSUC0_GSUWGMRR0_K1_LBSPPA1024_LBSPPB512_LPA64_LPB16_LRVW8_MIWT4_4_PLR1_SU0_SUM0_SUS128_VWA4_VWB4_WGM6_WGMXCC1_WGMXCCGn1
    SolutionIndex: 53
    SolutionNameMin: Cijk_Ailk_Bljk_F8NBS_BH_Bias_HAS_SAV_UserArgs_MT128x128x128_MI16x16x1_SN_LDSB1_CLR1_GRVWA16_GRVWB16_GSU0_GSUC0_GSUWGMRR0_K1_LBSPPA1024_LBSPPB512_LPA64_LPB16_LRVW8_MIWT4_4_PLR1_SU0_SUM0_SUS128_VWA4_VWB4_WGM8_WGMXCC1_WGMXCCGn1
    SolutionIndex: 54
    SolutionNameMin: Cijk_Ailk_Bljk_F8NBS_BH_Bias_HAS_SAV_UserArgs_MT64x128x128_MI16x16x1_SN_LDSB1_CLR1_GRVWA8_GRVWB16_GSU0_GSUC0_GSUWGMRR0_K1_LBSPPA512_LBSPPB512_LPA32_LPB16_LRVW8_MIWT2_4_PLR1_SU0_SUM0_SUS128_VWA2_VWB4_WGM1_WGMXCC1_WGMXCCGn1
    SolutionIndex: 55
    SolutionNameMin: Cijk_Ailk_Bljk_F8NBS_BH_Bias_HAS_SAV_UserArgs_MT64x128x128_MI16x16x1_SN_LDSB1_CLR1_GRVWA16_GRVWB16_GSU0_GSUC0_GSUWGMRR0_K1_LBSPPA512_LBSPPB512_LPA32_LPB16_LRVW8_MIWT2_4_PLR1_SU0_SUM0_SUS128_VWA2_VWB4_WGM1_WGMXCC1_WGMXCCGn1
    SolutionIndex: 56
    SolutionNameMin: Cijk_Ailk_Bljk_F8NBS_BH_Bias_HAS_SAV_UserArgs_MT128x64x128_MI16x16x1_SN_LDSB1_CLR1_GRVWA16_GRVWB16_GSU0_GSUC0_GSUWGMRR0_K1_LBSPPA1024_LBSPPB256_LPA64_LPB16_LRVW8_MIWT4_2_PLR1_SU0_SUM0_SUS128_VWA4_VWB2_WGM1_WGMXCC1_WGMXCCGn1
    SolutionIndex: 57
    SolutionNameMin: Cijk_Ailk_Bljk_F8NBS_BH_Bias_HAS_SAV_UserArgs_MT128x64x128_MI16x16x1_SN_LDSB1_CLR1_GRVWA16_GRVWB16_GSU0_GSUC0_GSUWGMRR0_K1_LBSPPA1024_LBSPPB256_LPA64_LPB16_LRVW8_MIWT4_2_PLR1_SU0_SUM0_SUS128_VWA4_VWB2_WGM4_WGMXCC1_WGMXCCGn1
    SolutionIndex: 58
    SolutionNameMin: Cijk_Ailk_Bljk_F8NBS_BH_Bias_HAS_SAV_UserArgs_MT128x64x128_MI16x16x1_SN_LDSB1_CLR1_GRVWA16_GRVWB16_GSU0_GSUC0_GSUWGMRR0_K1_LBSPPA1024_LBSPPB256_LPA64_LPB16_LRVW8_MIWT4_2_PLR1_SU0_SUM0_SUS128_VWA4_VWB2_WGM6_WGMXCC1_WGMXCCGn1
    SolutionIndex: 59
    SolutionNameMin: Cijk_Ailk_Bljk_F8NBS_BH_Bias_HAS_SAV_UserArgs_MT128x64x128_MI16x16x1_SN_LDSB1_CLR1_GRVWA16_GRVWB16_GSU0_GSUC0_GSUWGMRR0_K1_LBSPPA1024_LBSPPB256_LPA64_LPB16_LRVW8_MIWT4_2_PLR1_SU0_SUM0_SUS128_VWA4_VWB2_WGM8_WGMXCC1_WGMXCCGn1
    SolutionIndex: 60
    SolutionNameMin: Cijk_Ailk_Bljk_F8NBS_BH_Bias_HAS_SAV_UserArgs_MT64x64x128_MI16x16x1_SN_LDSB1_CLR1_GRVWA16_GRVWB8_GSU0_GSUC0_GSUWGMRR0_K1_LBSPPA512_LBSPPB256_LPA32_LPB8_LRVW8_MIWT2_2_PLR1_SU0_SUM0_SUS128_VWA2_VWB2_WGM1_WGMXCC1_WGMXCCGn1
    SolutionIndex: 61
    SolutionNameMin: Cijk_Ailk_Bljk_F8NBS_BH_Bias_HAS_SAV_UserArgs_MT64x64x128_MI16x16x1_SN_LDSB1_CLR1_GRVWA8_GRVWB16_GSU0_GSUC0_GSUWGMRR0_K1_LBSPPA512_LBSPPB256_LPA32_LPB16_LRVW8_MIWT2_2_PLR1_SU0_SUM0_SUS128_VWA2_VWB2_WGM1_WGMXCC1_WGMXCCGn1
    SolutionIndex: 62
    SolutionNameMin: Cijk_Ailk_Bljk_F8NBS_BH_Bias_HAS_SAV_UserArgs_MT64x64x128_MI16x16x1_SN_LDSB1_CLR1_GRVWA16_GRVWB16_GSU0_GSUC0_GSUWGMRR0_K1_LBSPPA512_LBSPPB256_LPA32_LPB16_LRVW8_MIWT2_2_PLR1_SU0_SUM0_SUS128_VWA2_VWB2_WGM1_WGMXCC1_WGMXCCGn1
    SolutionIndex: 63
    SolutionNameMin: Cijk_Ailk_Bljk_F8NBS_BH_Bias_HAS_SAV_UserArgs_MT64x64x128_MI16x16x1_SN_LDSB1_CLR1_GRVWA16_GRVWB8_GSU0_GSUC0_GSUWGMRR0_K1_LBSPPA512_LBSPPB256_LPA32_LPB8_LRVW8_MIWT2_2_PLR1_SU0_SUM0_SUS128_VWA2_VWB2_WGM4_WGMXCC1_WGMXCCGn1
    SolutionIndex: 64
    SolutionNameMin: Cijk_Ailk_Bljk_F8NBS_BH_Bias_HAS_SAV_UserArgs_MT64x64x128_MI16x16x1_SN_LDSB1_CLR1_GRVWA16_GRVWB16_GSU0_GSUC0_GSUWGMRR0_K1_LBSPPA512_LBSPPB256_LPA32_LPB16_LRVW8_MIWT2_2_PLR1_SU0_SUM0_SUS128_VWA2_VWB2_WGM4_WGMXCC1_WGMXCCGn1
    SolutionIndex: 65
    SolutionNameMin: Cijk_Ailk_Bljk_F8NBS_BH_Bias_HAS_SAV_UserArgs_MT64x64x128_MI16x16x1_SN_LDSB1_CLR1_GRVWA16_GRVWB16_GSU0_GSUC0_GSUWGMRR0_K1_LBSPPA512_LBSPPB256_LPA32_LPB16_LRVW8_MIWT2_2_PLR1_SU0_SUM0_SUS128_VWA2_VWB2_WGM6_WGMXCC1_WGMXCCGn1
    SolutionIndex: 66
    SolutionNameMin: Cijk_Ailk_Bljk_F8NBS_BH_Bias_HAS_SAV_UserArgs_MT64x64x128_MI16x16x1_SN_LDSB1_CLR1_GRVWA8_GRVWB16_GSU0_GSUC0_GSUWGMRR0_K1_LBSPPA512_LBSPPB256_LPA32_LPB16_LRVW8_MIWT2_2_PLR1_SU0_SUM0_SUS128_VWA2_VWB2_WGM8_WGMXCC1_WGMXCCGn1
    SolutionIndex: 67
    SolutionNameMin: Cijk_Ailk_Bljk_F8NBS_BH_Bias_HAS_SAV_UserArgs_MT32x64x128_MI16x16x1_SN_LDSB0_CLR1_GRVWA8_GRVWB8_GSU0_GSUC0_GSUWGMRR0_K1_LBSPPA256_LBSPPB256_LPA16_LPB8_LRVW8_MIWT1_2_PLR1_SU0_SUM0_SUS128_VWA1_VWB2_WGM1_WGMXCC1_WGMXCCGn1
    SolutionIndex: 68
    SolutionNameMin: Cijk_Ailk_Bljk_F8NBS_BH_Bias_HAS_SAV_UserArgs_MT32x64x128_MI16x16x1_SN_LDSB0_CLR1_GRVWA8_GRVWB16_GSU0_GSUC0_GSUWGMRR0_K1_LBSPPA256_LBSPPB256_LPA16_LPB16_LRVW8_MIWT1_2_PLR1_SU0_SUM0_SUS128_VWA1_VWB2_WGM1_WGMXCC1_WGMXCCGn1
    SolutionIndex: 69
    SolutionNameMin: Cijk_Ailk_Bljk_F8NBS_BH_Bias_HAS_SAV_UserArgs_MT32x64x128_MI16x16x1_SN_LDSB0_CLR1_GRVWA16_GRVWB16_GSU0_GSUC0_GSUWGMRR0_K1_LBSPPA256_LBSPPB256_LPA16_LPB16_LRVW8_MIWT1_2_PLR1_SU0_SUM0_SUS128_VWA1_VWB2_WGM4_WGMXCC1_WGMXCCGn1
    SolutionIndex: 70
    SolutionNameMin: Cijk_Ailk_Bljk_F8NBS_BH_Bias_HAS_SAV_UserArgs_MT32x64x128_MI16x16x1_SN_LDSB0_CLR1_GRVWA8_GRVWB16_GSU0_GSUC0_GSUWGMRR0_K1_LBSPPA256_LBSPPB256_LPA16_LPB16_LRVW8_MIWT1_2_PLR1_SU0_SUM0_SUS128_VWA1_VWB2_WGM6_WGMXCC1_WGMXCCGn1
    SolutionIndex: 71
    SolutionNameMin: Cijk_Ailk_Bljk_F8NBS_BH_Bias_HAS_SAV_UserArgs_MT64x32x128_MI16x16x1_SN_LDSB0_CLR1_GRVWA8_GRVWB8_GSU0_GSUC0_GSUWGMRR0_K1_LBSPPA512_LBSPPB128_LPA32_LPB8_LRVW8_MIWT2_1_PLR1_SU0_SUM0_SUS128_VWA2_VWB1_WGM1_WGMXCC1_WGMXCCGn1
    SolutionIndex: 72
    SolutionNameMin: Cijk_Ailk_Bljk_F8NBS_BH_Bias_HAS_SAV_UserArgs_MT64x32x128_MI16x16x1_SN_LDSB0_CLR1_GRVWA8_GRVWB16_GSU0_GSUC0_GSUWGMRR0_K1_LBSPPA512_LBSPPB128_LPA32_LPB16_LRVW8_MIWT2_1_PLR1_SU0_SUM0_SUS128_VWA2_VWB1_WGM1_WGMXCC1_WGMXCCGn1
    SolutionIndex: 73
    SolutionNameMin: Cijk_Ailk_Bljk_F8NBS_BH_Bias_HAS_SAV_UserArgs_MT64x32x128_MI16x16x1_SN_LDSB0_CLR1_GRVWA16_GRVWB16_GSU0_GSUC0_GSUWGMRR0_K1_LBSPPA512_LBSPPB128_LPA32_LPB16_LRVW8_MIWT2_1_PLR1_SU0_SUM0_SUS128_VWA2_VWB1_WGM1_WGMXCC1_WGMXCCGn1
    SolutionIndex: 74
    SolutionNameMin: Cijk_Ailk_Bljk_F8NBS_BH_Bias_HAS_SAV_UserArgs_MT64x32x128_MI16x16x1_SN_LDSB0_CLR1_GRVWA8_GRVWB16_GSU0_GSUC0_GSUWGMRR0_K1_LBSPPA512_LBSPPB128_LPA32_LPB16_LRVW8_MIWT2_1_PLR1_SU0_SUM0_SUS128_VWA2_VWB1_WGM8_WGMXCC1_WGMXCCGn1
    SolutionIndex: 75
    SolutionNameMin: Cijk_Ailk_Bljk_F8NBS_BH_Bias_HAS_SAV_UserArgs_MT32x32x128_MI16x16x1_SN_LDSB0_CLR1_GRVWA8_GRVWB8_GSU0_GSUC0_GSUWGMRR0_K1_LBSPPA256_LBSPPB128_LPA16_LPB8_LRVW8_MIWT1_1_PLR1_SU0_SUM0_SUS128_VWA1_VWB1_WGM1_WGMXCC1_WGMXCCGn1
    SolutionIndex: 76
    SolutionNameMin: Cijk_Ailk_Bljk_F8NBS_BH_Bias_HAS_SAV_UserArgs_MT32x32x128_MI16x16x1_SN_LDSB0_CLR1_GRVWA8_GRVWB16_GSU0_GSUC0_GSUWGMRR0_K1_LBSPPA256_LBSPPB128_LPA16_LPB16_LRVW8_MIWT1_1_PLR1_SU0_SUM0_SUS128_VWA1_VWB1_WGM1_WGMXCC1_WGMXCCGn1
    SolutionIndex: 77
    SolutionNameMin: Cijk_Ailk_Bljk_F8NBS_BH_Bias_HAS_SAV_UserArgs_MT64x64x256_MI16x16x1_SN_LDSB1_CLR1_GRVWA16_GRVWB16_GSU0_GSUC0_GSUWGMRR0_K1_LBSPPA512_LBSPPB512_LPA32_LPB16_LRVW8_MIWT2_2_PLR1_SU0_SUM0_SUS256_VWA2_VWB2_WGM1_WGMXCC1_WGMXCCGn1
    SolutionIndex: 78
    SolutionNameMin: Cijk_Ailk_Bljk_F8NBS_BH_Bias_HAS_SAV_UserArgs_MT64x32x256_MI16x16x1_SN_LDSB1_CLR1_GRVWA16_GRVWB16_GSU0_GSUC0_GSUWGMRR0_K1_LBSPPA512_LBSPPB256_LPA32_LPB16_LRVW8_MIWT2_1_PLR1_SU0_SUM0_SUS256_VWA2_VWB1_WGM1_WGMXCC1_WGMXCCGn1
    SolutionIndex: 79
    SolutionNameMin: Cijk_Ailk_Bljk_F8NBS_BH_Bias_HAS_SAV_UserArgs_MT64x32x256_MI16x16x1_SN_LDSB1_CLR1_GRVWA16_GRVWB16_GSU0_GSUC0_GSUWGMRR0_K1_LBSPPA512_LBSPPB256_LPA32_LPB16_LRVW8_MIWT2_1_PLR1_SU0_SUM0_SUS256_VWA2_VWB1_WGM4_WGMXCC1_WGMXCCGn1
    SolutionIndex: 80
    SolutionNameMin: Cijk_Ailk_Bljk_F8NBS_BH_Bias_HAS_SAV_UserArgs_MT64x32x256_MI16x16x1_SN_LDSB1_CLR1_GRVWA16_GRVWB16_GSU0_GSUC0_GSUWGMRR0_K1_LBSPPA512_LBSPPB256_LPA32_LPB16_LRVW8_MIWT2_1_PLR1_SU0_SUM0_SUS256_VWA2_VWB1_WGM6_WGMXCC1_WGMXCCGn1
    SolutionIndex: 81
    SolutionNameMin: Cijk_Ailk_Bljk_F8NBS_BH_Bias_HAS_SAV_UserArgs_MT32x32x256_MI16x16x1_SN_LDSB1_CLR1_GRVWA16_GRVWB16_GSU0_GSUC0_GSUWGMRR0_K1_LBSPPA256_LBSPPB256_LPA16_LPB16_LRVW8_MIWT1_1_PLR1_SU0_SUM0_SUS256_VWA1_VWB1_WGM4_WGMXCC1_WGMXCCGn1
    SolutionIndex: 82
    SolutionNameMin: Cijk_Ailk_Bljk_F8NBS_BH_Bias_HAS_SAV_UserArgs_MT32x32x256_MI16x16x1_SN_LDSB1_CLR1_GRVWA8_GRVWB16_GSU0_GSUC0_GSUWGMRR0_K1_LBSPPA256_LBSPPB256_LPA16_LPB16_LRVW8_MIWT1_1_PLR1_SU0_SUM0_SUS256_VWA1_VWB1_WGM6_WGMXCC1_WGMXCCGn1
    SolutionIndex: 83
    SolutionNameMin: Cijk_Ailk_Bljk_F8NBS_BH_Bias_HAS_SAV_UserArgs_MT32x32x256_MI16x16x1_SN_LDSB1_CLR1_GRVWA16_GRVWB16_GSU0_GSUC0_GSUWGMRR0_K1_LBSPPA256_LBSPPB256_LPA16_LPB16_LRVW8_MIWT1_1_PLR1_SU0_SUM0_SUS256_VWA1_VWB1_WGM6_WGMXCC1_WGMXCCGn1
- - - [128, 128, 1, 128, 128, 128, 128, 128]
    - [76, 0.56]
  - - [128, 128, 1, 256, 128, 128, 128, 256]
    - [76, 1.04]
  - - [128, 128, 1, 512, 128, 128, 128, 512]
    - [76, 1.71]
  - - [128, 128, 1, 1024, 128, 128, 128, 1024]
    - [76, 2.78]
  - - [128, 128, 1, 2048, 128, 128, 128, 2048]
    - [75, 3.87]
  - - [128, 128, 1, 4096, 128, 128, 128, 4096]
    - [75, 4.81]
  - - [128, 128, 1, 8192, 128, 128, 128, 8192]
    - [75, 5.48]
  - - [128, 256, 1, 128, 128, 128, 128, 128]
    - [75, 1.15]
  - - [128, 256, 1, 256, 128, 128, 128, 256]
    - [76, 2.07]
  - - [128, 256, 1, 512, 128, 128, 128, 512]
    - [76, 3.63]
  - - [128, 256, 1, 1024, 128, 128, 128, 1024]
    - [76, 5.6]
  - - [128, 256, 1, 2048, 128, 128, 128, 2048]
    - [75, 7.8]
  - - [128, 256, 1, 4096, 128, 128, 128, 4096]
    - [75, 9.67]
  - - [128, 256, 1, 8192, 128, 128, 128, 8192]
    - [75, 10.98]
  - - [128, 512, 1, 128, 128, 128, 128, 128]
    - [76, 2.28]
  - - [128, 512, 1, 256, 128, 128, 128, 256]
    - [76, 4.12]
  - - [128, 512, 1, 512, 128, 128, 128, 512]
    - [76, 7.11]
  - - [128, 512, 1, 1024, 128, 128, 128, 1024]
    - [76, 11.16]
  - - [128, 512, 1, 2048, 128, 128, 128, 2048]
    - [75, 15.45]
  - - [128, 512, 1, 4096, 128, 128, 128, 4096]
    - [75, 19.2]
  - - [128, 512, 1, 8192, 128, 128, 128, 8192]
    - [75, 21.88]
  - - [128, 1024, 1, 128, 128, 128, 128, 128]
    - [76, 4.48]
  - - [128, 1024, 1, 256, 128, 128, 128, 256]
    - [76, 8.08]
  - - [128, 1024, 1, 512, 128, 128, 128, 512]
    - [75, 13.23]
  - - [128, 1024, 1, 1024, 128, 128, 128, 1024]
    - [75, 20.97]
  - - [128, 1024, 1, 2048, 128, 128, 128, 2048]
    - [75, 29.68]
  - - [128, 1024, 1, 4096, 128, 128, 128, 4096]
    - [75, 37.79]
  - - [128, 1024, 1, 8192, 128, 128, 128, 8192]
    - [75, 43.05]
  - - [128, 2048, 1, 128, 128, 128, 128, 128]
    - [27, 8.17]
  - - [128, 2048, 1, 256, 128, 128, 128, 256]
    - [72, 14.64]
  - - [128, 2048, 1, 512, 128, 128, 128, 512]
    - [73, 24.74]
  - - [128, 2048, 1, 1024, 128, 128, 128, 1024]
    - [68, 37.59]
  - - [128, 2048, 1, 2048, 128, 128, 128, 2048]
    - [78, 51.51]
  - - [128, 2048, 1, 4096, 128, 128, 128, 4096]
    - [78, 63.58]
  - - [128, 2048, 1, 8192, 128, 128, 128, 8192]
    - [78, 71.88]
  - - [128, 4096, 1, 128, 128, 128, 128, 128]
    - [26, 14.73]
  - - [128, 4096, 1, 256, 128, 128, 128, 256]
    - [26, 25.96]
  - - [128, 4096, 1, 512, 128, 128, 128, 512]
    - [60, 42.43]
  - - [128, 4096, 1, 1024, 128, 128, 128, 1024]
    - [60, 63.31]
  - - [128, 4096, 1, 2048, 128, 128, 128, 2048]
    - [60, 84.12]
  - - [128, 4096, 1, 4096, 128, 128, 128, 4096]
    - [77, 102.14]
  - - [128, 4096, 1, 8192, 128, 128, 128, 8192]
    - [77, 112.87]
  - - [128, 8192, 1, 128, 128, 128, 128, 128]
    - [19, 24.33]
  - - [128, 8192, 1, 256, 128, 128, 128, 256]
    - [21, 43.01]
  - - [128, 8192, 1, 512, 128, 128, 128, 512]
    - [21, 69.51]
  - - [128, 8192, 1, 1024, 128, 128, 128, 1024]
    - [20, 101.01]
  - - [128, 8192, 1, 2048, 128, 128, 128, 2048]
    - [20, 131.58]
  - - [128, 8192, 1, 4096, 128, 128, 128, 4096]
    - [54, 141.82]
  - - [128, 8192, 1, 8192, 128, 128, 128, 8192]
    - [55, 150.4]
  - - [256, 128, 1, 128, 256, 256, 256, 128]
    - [28, 1.13]
  - - [256, 128, 1, 256, 256, 256, 256, 256]
    - [76, 2.07]
  - - [256, 128, 1, 512, 256, 256, 256, 512]
    - [76, 3.54]
  - - [256, 128, 1, 1024, 256, 256, 256, 1024]
    - [76, 5.55]
  - - [256, 128, 1, 2048, 256, 256, 256, 2048]
    - [76, 7.68]
  - - [256, 128, 1, 4096, 256, 256, 256, 4096]
    - [75, 9.54]
  - - [256, 128, 1, 8192, 256, 256, 256, 8192]
    - [75, 10.91]
  - - [256, 256, 1, 128, 256, 256, 256, 128]
    - [28, 2.18]
  - - [256, 256, 1, 256, 256, 256, 256, 256]
    - [76, 4.13]
  - - [256, 256, 1, 512, 256, 256, 256, 512]
    - [76, 7.12]
  - - [256, 256, 1, 1024, 256, 256, 256, 1024]
    - [76, 10.77]
  - - [256, 256, 1, 2048, 256, 256, 256, 2048]
    - [76, 15.05]
  - - [256, 256, 1, 4096, 256, 256, 256, 4096]
    - [75, 18.87]
  - - [256, 256, 1, 8192, 256, 256, 256, 8192]
    - [75, 21.7]
  - - [256, 512, 1, 128, 256, 256, 256, 128]
    - [75, 4.17]
  - - [256, 512, 1, 256, 256, 256, 256, 256]
    - [76, 8.1]
  - - [256, 512, 1, 512, 256, 256, 256, 512]
    - [76, 13.68]
  - - [256, 512, 1, 1024, 256, 256, 256, 1024]
    - [75, 21.59]
  - - [256, 512, 1, 2048, 256, 256, 256, 2048]
    - [75, 30.29]
  - - [256, 512, 1, 4096, 256, 256, 256, 4096]
    - [75, 37.68]
  - - [256, 512, 1, 8192, 256, 256, 256, 8192]
    - [75, 43.03]
  - - [256, 1024, 1, 128, 256, 256, 256, 128]
    - [72, 8.09]
  - - [256, 1024, 1, 256, 256, 256, 256, 256]
    - [71, 14.69]
  - - [256, 1024, 1, 512, 256, 256, 256, 512]
    - [72, 24.21]
  - - [256, 1024, 1, 1024, 256, 256, 256, 1024]
    - [78, 37.42]
  - - [256, 1024, 1, 2048, 256, 256, 256, 2048]
    - [78, 51.49]
  - - [256, 1024, 1, 4096, 256, 256, 256, 4096]
    - [78, 63.7]
  - - [256, 1024, 1, 8192, 256, 256, 256, 8192]
    - [78, 72.34]
  - - [256, 2048, 1, 128, 256, 256, 256, 128]
    - [24, 14.4]
  - - [256, 2048, 1, 256, 256, 256, 256, 256]
    - [25, 25.78]
  - - [256, 2048, 1, 512, 256, 256, 256, 512]
    - [25, 41.69]
  - - [256, 2048, 1, 1024, 256, 256, 256, 1024]
    - [60, 63.07]
  - - [256, 2048, 1, 2048, 256, 256, 256, 2048]
    - [60, 84.16]
  - - [256, 2048, 1, 4096, 256, 256, 256, 4096]
    - [77, 101.45]
  - - [256, 2048, 1, 8192, 256, 256, 256, 8192]
    - [63, 109.69]
  - - [256, 4096, 1, 128, 256, 256, 256, 128]
    - [21, 23.7]
  - - [256, 4096, 1, 256, 256, 256, 256, 256]
    - [21, 42.08]
  - - [256, 4096, 1, 512, 256, 256, 256, 512]
    - [21, 68.33]
  - - [256, 4096, 1, 1024, 256, 256, 256, 1024]
    - [20, 99.91]
  - - [256, 4096, 1, 2048, 256, 256, 256, 2048]
    - [20, 132.03]
  - - [256, 4096, 1, 4096, 256, 256, 256, 4096]
    - [55, 145.05]
  - - [256, 4096, 1, 8192, 256, 256, 256, 8192]
    - [55, 155.25]
  - - [256, 8192, 1, 128, 256, 256, 256, 128]
    - [45, 36.82]
  - - [256, 8192, 1, 256, 256, 256, 256, 256]
    - [46, 63.57]
  - - [256, 8192, 1, 512, 256, 256, 256, 512]
    - [50, 102.92]
  - - [256, 8192, 1, 1024, 256, 256, 256, 1024]
    - [50, 150.47]
  - - [256, 8192, 1, 2048, 256, 256, 256, 2048]
    - [50, 191.38]
  - - [256, 8192, 1, 4096, 256, 256, 256, 4096]
    - [50, 211.05]
  - - [256, 8192, 1, 8192, 256, 256, 256, 8192]
    - [52, 212.51]
  - - [512, 128, 1, 128, 512, 512, 512, 128]
    - [28, 2.24]
  - - [512, 128, 1, 256, 512, 512, 512, 256]
    - [28, 4.0]
  - - [512, 128, 1, 512, 512, 512, 512, 512]
    - [76, 7.04]
  - - [512, 128, 1, 1024, 512, 512, 512, 1024]
    - [75, 10.77]
  - - [512, 128, 1, 2048, 512, 512, 512, 2048]
    - [75, 15.07]
  - - [512, 128, 1, 4096, 512, 512, 512, 4096]
    - [75, 18.93]
  - - [512, 128, 1, 8192, 512, 512, 512, 8192]
    - [83, 18.55]
  - - [512, 256, 1, 128, 512, 512, 512, 128]
    - [28, 4.19]
  - - [512, 256, 1, 256, 512, 512, 512, 256]
    - [76, 8.02]
  - - [512, 256, 1, 512, 512, 512, 512, 512]
    - [76, 13.89]
  - - [512, 256, 1, 1024, 512, 512, 512, 1024]
    - [75, 21.24]
  - - [512, 256, 1, 2048, 512, 512, 512, 2048]
    - [76, 29.52]
  - - [512, 256, 1, 4096, 512, 512, 512, 4096]
    - [75, 37.05]
  - - [512, 256, 1, 8192, 512, 512, 512, 8192]
    - [81, 34.98]
  - - [512, 512, 1, 128, 512, 512, 512, 128]
    - [72, 8.24]
  - - [512, 512, 1, 256, 512, 512, 512, 256]
    - [72, 14.71]
  - - [512, 512, 1, 512, 512, 512, 512, 512]
    - [72, 24.97]
  - - [512, 512, 1, 1024, 512, 512, 512, 1024]
    - [72, 37.63]
  - - [512, 512, 1, 2048, 512, 512, 512, 2048]
    - [78, 51.94]
  - - [512, 512, 1, 4096, 512, 512, 512, 4096]
    - [78, 63.59]
  - - [512, 512, 1, 8192, 512, 512, 512, 8192]
    - [73, 62.53]
  - - [512, 1024, 1, 128, 512, 512, 512, 128]
    - [26, 14.57]
  - - [512, 1024, 1, 256, 512, 512, 512, 256]
    - [26, 25.8]
  - - [512, 1024, 1, 512, 512, 512, 512, 512]
    - [60, 41.73]
  - - [512, 1024, 1, 1024, 512, 512, 512, 1024]
    - [60, 62.52]
  - - [512, 1024, 1, 2048, 512, 512, 512, 2048]
    - [60, 83.05]
  - - [512, 1024, 1, 4096, 512, 512, 512, 4096]
    - [60, 99.58]
  - - [512, 1024, 1, 8192, 512, 512, 512, 8192]
    - [62, 101.75]
  - - [512, 2048, 1, 128, 512, 512, 512, 128]
    - [22, 24.12]
  - - [512, 2048, 1, 256, 512, 512, 512, 256]
    - [21, 43.2]
  - - [512, 2048, 1, 512, 512, 512, 512, 512]
    - [21, 67.67]
  - - [512, 2048, 1, 1024, 512, 512, 512, 1024]
    - [20, 99.2]
  - - [512, 2048, 1, 2048, 512, 512, 512, 2048]
    - [20, 130.25]
  - - [512, 2048, 1, 4096, 512, 512, 512, 4096]
    - [56, 139.35]
  - - [512, 2048, 1, 8192, 512, 512, 512, 8192]
    - [56, 146.64]
  - - [512, 4096, 1, 128, 512, 512, 512, 128]
    - [45, 37.2]
  - - [512, 4096, 1, 256, 512, 512, 512, 256]
    - [46, 63.97]
  - - [512, 4096, 1, 512, 512, 512, 512, 512]
    - [50, 103.33]
  - - [512, 4096, 1, 1024, 512, 512, 512, 1024]
    - [50, 150.75]
  - - [512, 4096, 1, 2048, 512, 512, 512, 2048]
    - [50, 194.21]
  - - [512, 4096, 1, 4096, 512, 512, 512, 4096]
    - [52, 196.85]
  - - [512, 4096, 1, 8192, 512, 512, 512, 8192]
    - [50, 194.46]
  - - [512, 8192, 1, 128, 512, 512, 512, 128]
    - [48, 55.43]
  - - [512, 8192, 1, 256, 512, 512, 512, 256]
    - [48, 96.13]
  - - [512, 8192, 1, 512, 512, 512, 512, 512]
    - [48, 157.32]
  - - [512, 8192, 1, 1024, 512, 512, 512, 1024]
    - [48, 199.83]
  - - [512, 8192, 1, 2048, 512, 512, 512, 2048]
    - [41, 225.43]
  - - [512, 8192, 1, 4096, 512, 512, 512, 4096]
    - [35, 248.07]
  - - [512, 8192, 1, 8192, 512, 512, 512, 8192]
    - [49, 245.98]
  - - [1024, 128, 1, 128, 1024, 1024, 1024, 128]
    - [28, 4.44]
  - - [1024, 128, 1, 256, 1024, 1024, 1024, 256]
    - [76, 8.04]
  - - [1024, 128, 1, 512, 1024, 1024, 1024, 512]
    - [76, 13.73]
  - - [1024, 128, 1, 1024, 1024, 1024, 1024, 1024]
    - [75, 21.62]
  - - [1024, 128, 1, 2048, 1024, 1024, 1024, 2048]
    - [75, 29.96]
  - - [1024, 128, 1, 4096, 1024, 1024, 1024, 4096]
    - [83, 30.98]
  - - [1024, 128, 1, 8192, 1024, 1024, 1024, 8192]
    - [82, 30.57]
  - - [1024, 256, 1, 128, 1024, 1024, 1024, 128]
    - [67, 7.87]
  - - [1024, 256, 1, 256, 1024, 1024, 1024, 256]
    - [71, 14.38]
  - - [1024, 256, 1, 512, 1024, 1024, 1024, 512]
    - [72, 24.03]
  - - [1024, 256, 1, 1024, 1024, 1024, 1024, 1024]
    - [72, 36.43]
  - - [1024, 256, 1, 2048, 1024, 1024, 1024, 2048]
    - [78, 50.38]
  - - [1024, 256, 1, 4096, 1024, 1024, 1024, 4096]
    - [70, 54.59]
  - - [1024, 256, 1, 8192, 1024, 1024, 1024, 8192]
    - [74, 58.88]
  - - [1024, 512, 1, 128, 1024, 1024, 1024, 128]
    - [26, 13.95]
  - - [1024, 512, 1, 256, 1024, 1024, 1024, 256]
    - [25, 24.55]
  - - [1024, 512, 1, 512, 1024, 1024, 1024, 512]
    - [61, 40.71]
  - - [1024, 512, 1, 1024, 1024, 1024, 1024, 1024]
    - [60, 60.57]
  - - [1024, 512, 1, 2048, 1024, 1024, 1024, 2048]
    - [60, 81.58]
  - - [1024, 512, 1, 4096, 1024, 1024, 1024, 4096]
    - [64, 93.0]
  - - [1024, 512, 1, 8192, 1024, 1024, 1024, 8192]
    - [62, 101.45]
  - - [1024, 1024, 1, 128, 1024, 1024, 1024, 128]
    - [21, 23.63]
  - - [1024, 1024, 1, 256, 1024, 1024, 1024, 256]
    - [21, 42.13]
  - - [1024, 1024, 1, 512, 1024, 1024, 1024, 512]
    - [21, 67.59]
  - - [1024, 1024, 1, 1024, 1024, 1024, 1024, 1024]
    - [20, 99.52]
  - - [1024, 1024, 1, 2048, 1024, 1024, 1024, 2048]
    - [20, 130.3]
  - - [1024, 1024, 1, 4096, 1024, 1024, 1024, 4096]
    - [58, 137.64]
  - - [1024, 1024, 1, 8192, 1024, 1024, 1024, 8192]
    - [58, 146.72]
  - - [1024, 2048, 1, 128, 1024, 1024, 1024, 128]
    - [45, 37.32]
  - - [1024, 2048, 1, 256, 1024, 1024, 1024, 256]
    - [16, 64.29]
  - - [1024, 2048, 1, 512, 1024, 1024, 1024, 512]
    - [50, 103.7]
  - - [1024, 2048, 1, 1024, 1024, 1024, 1024, 1024]
    - [50, 151.1]
  - - [1024, 2048, 1, 2048, 1024, 1024, 1024, 2048]
    - [50, 188.67]
  - - [1024, 2048, 1, 4096, 1024, 1024, 1024, 4096]
    - [50, 199.19]
  - - [1024, 2048, 1, 8192, 1024, 1024, 1024, 8192]
    - [53, 192.5]
  - - [1024, 4096, 1, 128, 1024, 1024, 1024, 128]
    - [14, 53.74]
  - - [1024, 4096, 1, 256, 1024, 1024, 1024, 256]
    - [14, 91.99]
  - - [1024, 4096, 1, 512, 1024, 1024, 1024, 512]
    - [13, 139.53]
  - - [1024, 4096, 1, 1024, 1024, 1024, 1024, 1024]
    - [12, 191.1]
  - - [1024, 4096, 1, 2048, 1024, 1024, 1024, 2048]
    - [15, 226.04]
  - - [1024, 4096, 1, 4096, 1024, 1024, 1024, 4096]
    - [40, 244.96]
  - - [1024, 4096, 1, 8192, 1024, 1024, 1024, 8192]
    - [35, 236.21]
  - - [1024, 8192, 1, 128, 1024, 1024, 1024, 128]
    - [39, 69.33]
  - - [1024, 8192, 1, 256, 1024, 1024, 1024, 256]
    - [39, 122.32]
  - - [1024, 8192, 1, 512, 1024, 1024, 1024, 512]
    - [40, 180.17]
  - - [1024, 8192, 1, 1024, 1024, 1024, 1024, 1024]
    - [6, 221.74]
  - - [1024, 8192, 1, 2048, 1024, 1024, 1024, 2048]
    - [34, 285.27]
  - - [1024, 8192, 1, 4096, 1024, 1024, 1024, 4096]
    - [35, 332.43]
  - - [1024, 8192, 1, 8192, 1024, 1024, 1024, 8192]
    - [40, 360.93]
  - - [2048, 128, 1, 128, 2048, 2048, 2048, 128]
    - [72, 8.07]
  - - [2048, 128, 1, 256, 2048, 2048, 2048, 256]
    - [72, 14.61]
  - - [2048, 128, 1, 512, 2048, 2048, 2048, 512]
    - [72, 24.31]
  - - [2048, 128, 1, 1024, 2048, 2048, 2048, 1024]
    - [72, 37.06]
  - - [2048, 128, 1, 2048, 2048, 2048, 2048, 2048]
    - [69, 43.47]
  - - [2048, 128, 1, 4096, 2048, 2048, 2048, 4096]
    - [79, 52.5]
  - - [2048, 128, 1, 8192, 2048, 2048, 2048, 8192]
    - [80, 59.39]
  - - [2048, 256, 1, 128, 2048, 2048, 2048, 128]
    - [24, 14.09]
  - - [2048, 256, 1, 256, 2048, 2048, 2048, 256]
    - [26, 24.81]
  - - [2048, 256, 1, 512, 2048, 2048, 2048, 512]
    - [66, 40.89]
  - - [2048, 256, 1, 1024, 2048, 2048, 2048, 1024]
    - [61, 61.53]
  - - [2048, 256, 1, 2048, 2048, 2048, 2048, 2048]
    - [65, 75.84]
  - - [2048, 256, 1, 4096, 2048, 2048, 2048, 4096]
    - [65, 91.98]
  - - [2048, 256, 1, 8192, 2048, 2048, 2048, 8192]
    - [64, 103.74]
  - - [2048, 512, 1, 128, 2048, 2048, 2048, 128]
    - [21, 23.21]
  - - [2048, 512, 1, 256, 2048, 2048, 2048, 256]
    - [21, 41.16]
  - - [2048, 512, 1, 512, 2048, 2048, 2048, 512]
    - [20, 67.73]
  - - [2048, 512, 1, 1024, 2048, 2048, 2048, 1024]
    - [20, 98.93]
  - - [2048, 512, 1, 2048, 2048, 2048, 2048, 2048]
    - [59, 118.78]
  - - [2048, 512, 1, 4096, 2048, 2048, 2048, 4096]
    - [59, 139.65]
  - - [2048, 512, 1, 8192, 2048, 2048, 2048, 8192]
    - [57, 145.32]
  - - [2048, 1024, 1, 128, 2048, 2048, 2048, 128]
    - [17, 37.1]
  - - [2048, 1024, 1, 256, 2048, 2048, 2048, 256]
    - [46, 63.61]
  - - [2048, 1024, 1, 512, 2048, 2048, 2048, 512]
    - [50, 103.01]
  - - [2048, 1024, 1, 1024, 2048, 2048, 2048, 1024]
    - [50, 150.55]
  - - [2048, 1024, 1, 2048, 2048, 2048, 2048, 2048]
    - [53, 175.97]
  - - [2048, 1024, 1, 4096, 2048, 2048, 2048, 4096]
    - [53, 196.09]
  - - [2048, 1024, 1, 8192, 2048, 2048, 2048, 8192]
    - [51, 192.0]
  - - [2048, 2048, 1, 128, 2048, 2048, 2048, 128]
    - [13, 51.76]
  - - [2048, 2048, 1, 256, 2048, 2048, 2048, 256]
    - [13, 89.9]
  - - [2048, 2048, 1, 512, 2048, 2048, 2048, 512]
    - [13, 140.4]
  - - [2048, 2048, 1, 1024, 2048, 2048, 2048, 1024]
    - [12, 189.75]
  - - [2048, 2048, 1, 2048, 2048, 2048, 2048, 2048]
    - [43, 227.73]
  - - [2048, 2048, 1, 4096, 2048, 2048, 2048, 4096]
    - [40, 240.85]
  - - [2048, 2048, 1, 8192, 2048, 2048, 2048, 8192]
    - [9, 232.4]
  - - [2048, 4096, 1, 128, 2048, 2048, 2048, 128]
    - [2, 60.61]
  - - [2048, 4096, 1, 256, 2048, 2048, 2048, 256]
    - [0, 103.24]
  - - [2048, 4096, 1, 512, 2048, 2048, 2048, 512]
    - [2, 160.88]
  - - [2048, 4096, 1, 1024, 2048, 2048, 2048, 1024]
    - [8, 219.39]
  - - [2048, 4096, 1, 2048, 2048, 2048, 2048, 2048]
    - [1, 253.76]
  - - [2048, 4096, 1, 4096, 2048, 2048, 2048, 4096]
    - [40, 266.72]
  - - [2048, 4096, 1, 8192, 2048, 2048, 2048, 8192]
    - [40, 310.06]
  - - [2048, 8192, 1, 128, 2048, 2048, 2048, 128]
    - [39, 69.96]
  - - [2048, 8192, 1, 256, 2048, 2048, 2048, 256]
    - [38, 121.22]
  - - [2048, 8192, 1, 512, 2048, 2048, 2048, 512]
    - [36, 173.84]
  - - [2048, 8192, 1, 1024, 2048, 2048, 2048, 1024]
    - [35, 251.63]
  - - [2048, 8192, 1, 2048, 2048, 2048, 2048, 2048]
    - [35, 305.5]
  - - [2048, 8192, 1, 4096, 2048, 2048, 2048, 4096]
    - [37, 334.51]
  - - [2048, 8192, 1, 8192, 2048, 2048, 2048, 8192]
    - [39, 380.04]
  - - [4096, 128, 1, 128, 4096, 4096, 4096, 128]
    - [26, 14.58]
  - - [4096, 128, 1, 256, 4096, 4096, 4096, 256]
    - [25, 25.27]
  - - [4096, 128, 1, 512, 4096, 4096, 4096, 512]
    - [61, 42.32]
  - - [4096, 128, 1, 1024, 4096, 4096, 4096, 1024]
    - [62, 62.65]
  - - [4096, 128, 1, 2048, 4096, 4096, 4096, 2048]
    - [64, 76.74]
  - - [4096, 128, 1, 4096, 4096, 4096, 4096, 4096]
    - [65, 92.23]
  - - [4096, 128, 1, 8192, 4096, 4096, 4096, 8192]
    - [64, 103.09]
  - - [4096, 256, 1, 128, 4096, 4096, 4096, 128]
    - [19, 23.61]
  - - [4096, 256, 1, 256, 4096, 4096, 4096, 256]
    - [21, 41.12]
  - - [4096, 256, 1, 512, 4096, 4096, 4096, 512]
    - [20, 66.65]
  - - [4096, 256, 1, 1024, 4096, 4096, 4096, 1024]
    - [20, 99.71]
  - - [4096, 256, 1, 2048, 4096, 4096, 4096, 2048]
    - [58, 117.06]
  - - [4096, 256, 1, 4096, 4096, 4096, 4096, 4096]
    - [57, 138.26]
  - - [4096, 256, 1, 8192, 4096, 4096, 4096, 8192]
    - [59, 145.78]
  - - [4096, 512, 1, 128, 4096, 4096, 4096, 128]
    - [17, 36.05]
  - - [4096, 512, 1, 256, 4096, 4096, 4096, 256]
    - [46, 64.01]
  - - [4096, 512, 1, 512, 4096, 4096, 4096, 512]
    - [50, 103.19]
  - - [4096, 512, 1, 1024, 4096, 4096, 4096, 1024]
    - [52, 143.59]
  - - [4096, 512, 1, 2048, 4096, 4096, 4096, 2048]
    - [53, 173.78]
  - - [4096, 512, 1, 4096, 4096, 4096, 4096, 4096]
    - [53, 200.37]
  - - [4096, 512, 1, 8192, 4096, 4096, 4096, 8192]
    - [51, 194.69]
  - - [4096, 1024, 1, 128, 4096, 4096, 4096, 128]
    - [13, 51.38]
  - - [4096, 1024, 1, 256, 4096, 4096, 4096, 256]
    - [13, 86.77]
  - - [4096, 1024, 1, 512, 4096, 4096, 4096, 512]
    - [15, 135.1]
  - - [4096, 1024, 1, 1024, 4096, 4096, 4096, 1024]
    - [15, 184.46]
  - - [4096, 1024, 1, 2048, 4096, 4096, 4096, 2048]
    - [44, 226.71]
  - - [4096, 1024, 1, 4096, 4096, 4096, 4096, 4096]
    - [32, 242.49]
  - - [4096, 1024, 1, 8192, 4096, 4096, 4096, 8192]
    - [31, 238.28]
  - - [4096, 2048, 1, 128, 4096, 4096, 4096, 128]
    - [3, 57.82]
  - - [4096, 2048, 1, 256, 4096, 4096, 4096, 256]
    - [3, 100.7]
  - - [4096, 2048, 1, 512, 4096, 4096, 4096, 512]
    - [3, 158.4]
  - - [4096, 2048, 1, 1024, 4096, 4096, 4096, 1024]
    - [8, 215.26]
  - - [4096, 2048, 1, 2048, 4096, 4096, 4096, 2048]
    - [6, 253.57]
  - - [4096, 2048, 1, 4096, 4096, 4096, 4096, 4096]
    - [35, 254.15]
  - - [4096, 2048, 1, 8192, 4096, 4096, 4096, 8192]
    - [29, 285.76]
  - - [4096, 4096, 1, 128, 4096, 4096, 4096, 128]
    - [7, 65.03]
  - - [4096, 4096, 1, 256, 4096, 4096, 4096, 256]
    - [7, 111.11]
  - - [4096, 4096, 1, 512, 4096, 4096, 4096, 512]
    - [8, 165.99]
  - - [4096, 4096, 1, 1024, 4096, 4096, 4096, 1024]
    - [5, 213.23]
  - - [4096, 4096, 1, 2048, 4096, 4096, 4096, 2048]
    - [37, 247.43]
  - - [4096, 4096, 1, 4096, 4096, 4096, 4096, 4096]
    - [39, 282.73]
  - - [4096, 4096, 1, 8192, 4096, 4096, 4096, 8192]
    - [4, 315.22]
  - - [4096, 8192, 1, 128, 4096, 4096, 4096, 128]
    - [34, 75.09]
  - - [4096, 8192, 1, 256, 4096, 4096, 4096, 256]
    - [34, 127.33]
  - - [4096, 8192, 1, 512, 4096, 4096, 4096, 512]
    - [39, 189.7]
  - - [4096, 8192, 1, 1024, 4096, 4096, 4096, 1024]
    - [39, 241.41]
  - - [4096, 8192, 1, 2048, 4096, 4096, 4096, 2048]
    - [39, 304.1]
  - - [4096, 8192, 1, 4096, 4096, 4096, 4096, 4096]
    - [40, 350.6]
  - - [4096, 8192, 1, 8192, 4096, 4096, 4096, 8192]
    - [40, 396.49]
  - - [8192, 128, 1, 128, 8192, 8192, 8192, 128]
    - [23, 24.16]
  - - [8192, 128, 1, 256, 8192, 8192, 8192, 256]
    - [23, 42.2]
  - - [8192, 128, 1, 512, 8192, 8192, 8192, 512]
    - [22, 67.19]
  - - [8192, 128, 1, 1024, 8192, 8192, 8192, 1024]
    - [20, 98.1]
  - - [8192, 128, 1, 2048, 8192, 8192, 8192, 2048]
    - [59, 115.58]
  - - [8192, 128, 1, 4096, 8192, 8192, 8192, 4096]
    - [59, 136.81]
  - - [8192, 128, 1, 8192, 8192, 8192, 8192, 8192]
    - [59, 142.19]
  - - [8192, 256, 1, 128, 8192, 8192, 8192, 128]
    - [18, 36.03]
  - - [8192, 256, 1, 256, 8192, 8192, 8192, 256]
    - [47, 62.4]
  - - [8192, 256, 1, 512, 8192, 8192, 8192, 512]
    - [53, 101.53]
  - - [8192, 256, 1, 1024, 8192, 8192, 8192, 1024]
    - [52, 143.5]
  - - [8192, 256, 1, 2048, 8192, 8192, 8192, 2048]
    - [53, 173.89]
  - - [8192, 256, 1, 4096, 8192, 8192, 8192, 4096]
    - [53, 199.62]
  - - [8192, 256, 1, 8192, 8192, 8192, 8192, 8192]
    - [51, 191.72]
  - - [8192, 512, 1, 128, 8192, 8192, 8192, 128]
    - [13, 50.31]
  - - [8192, 512, 1, 256, 8192, 8192, 8192, 256]
    - [13, 85.61]
  - - [8192, 512, 1, 512, 8192, 8192, 8192, 512]
    - [15, 133.16]
  - - [8192, 512, 1, 1024, 8192, 8192, 8192, 1024]
    - [11, 184.58]
  - - [8192, 512, 1, 2048, 8192, 8192, 8192, 2048]
    - [42, 226.78]
  - - [8192, 512, 1, 4096, 8192, 8192, 8192, 4096]
    - [32, 246.9]
  - - [8192, 512, 1, 8192, 8192, 8192, 8192, 8192]
    - [32, 237.93]
  - - [8192, 1024, 1, 128, 8192, 8192, 8192, 128]
    - [5, 58.98]
  - - [8192, 1024, 1, 256, 8192, 8192, 8192, 256]
    - [4, 101.63]
  - - [8192, 1024, 1, 512, 8192, 8192, 8192, 512]
    - [4, 159.08]
  - - [8192, 1024, 1, 1024, 8192, 8192, 8192, 1024]
    - [4, 215.49]
  - - [8192, 1024, 1, 2048, 8192, 8192, 8192, 2048]
    - [5, 253.15]
  - - [8192, 1024, 1, 4096, 8192, 8192, 8192, 4096]
    - [33, 254.73]
  - - [8192, 1024, 1, 8192, 8192, 8192, 8192, 8192]
    - [30, 293.66]
  - - [8192, 2048, 1, 128, 8192, 8192, 8192, 128]
    - [8, 63.82]
  - - [8192, 2048, 1, 256, 8192, 8192, 8192, 256]
    - [8, 109.66]
  - - [8192, 2048, 1, 512, 8192, 8192, 8192, 512]
    - [4, 167.1]
  - - [8192, 2048, 1, 1024, 8192, 8192, 8192, 1024]
    - [5, 214.63]
  - - [8192, 2048, 1, 2048, 8192, 8192, 8192, 2048]
    - [40, 233.66]
  - - [8192, 2048, 1, 4096, 8192, 8192, 8192, 4096]
    - [0, 279.82]
  - - [8192, 2048, 1, 8192, 8192, 8192, 8192, 8192]
    - [0, 332.58]
  - - [8192, 4096, 1, 128, 8192, 8192, 8192, 128]
    - [5, 68.18]
  - - [8192, 4096, 1, 256, 8192, 8192, 8192, 256]
    - [4, 111.87]
  - - [8192, 4096, 1, 512, 8192, 8192, 8192, 512]
    - [10, 167.89]
  - - [8192, 4096, 1, 1024, 8192, 8192, 8192, 1024]
    - [33, 215.5]
  - - [8192, 4096, 1, 2048, 8192, 8192, 8192, 2048]
    - [39, 274.18]
  - - [8192, 4096, 1, 4096, 8192, 8192, 8192, 4096]
    - [37, 312.55]
  - - [8192, 4096, 1, 8192, 8192, 8192, 8192, 8192]
    - [0, 347.54]
  - - [8192, 8192, 1, 128, 8192, 8192, 8192, 128]
    - [38, 71.9]
  - - [8192, 8192, 1, 256, 8192, 8192, 8192, 256]
    - [13, 117.85]
  - - [8192, 8192, 1, 512, 8192, 8192, 8192, 512]
    - [37, 171.5]
  - - [8192, 8192, 1, 1024, 8192, 8192, 8192, 1024]
    - [39, 246.3]
  - - [8192, 8192, 1, 2048, 8192, 8192, 8192, 2048]
    - [39, 314.54]
  - - [8192, 8192, 1, 4096, 8192, 8192, 8192, 4096]
    - [39, 364.5]
  - - [8192, 8192, 1, 8192, 8192, 8192, 8192, 8192]
    - [39, 397.21]
- null
- null
- ExperimentalStreamK
- GridBased
