projects/hipblaslt/library/src/amd_detail/rocblaslt/src/Tensile/Logic/asm_full/aquavanjaram/gfx942_228cu/StreamK/aquavanjaram942_Cijk_Ailk_Bjlk_B8F8NHS_BH_Bias_HAS_SAV_UserArgs.yaml
- {MinimumRequiredVersion: 4.33.0}
- aquavanjaram942
- {Architecture: gfx942, CUCount: 228}
- [Device 0049, Device 0050]
    SolutionIndex: 0
    SolutionNameMin: Cijk_Ailk_Bjlk_B8F8NHS_BH_Bias_HAS_SAV_UserArgs_MT256x256x64_MI16x16x1_SN_LDSB0_CLR1_GRVWA4_GRVWB4_GSU0_GSUC0_GSUWGMRR0_K1_LBSPPA2048_LBSPPB2048_LPA0_LPB0_MIWT8_8_PLR1_SU0_SUM0_SUS64_VWA8_VWB8_WGM1_WGMXCC1_WGMXCCGn1
    SolutionIndex: 1
    SolutionNameMin: Cijk_Ailk_Bjlk_B8F8NHS_BH_Bias_HAS_SAV_UserArgs_MT256x256x64_MI16x16x1_SN_LDSB0_CLR1_GRVWA16_GRVWB4_GSU0_GSUC0_GSUWGMRR0_K1_LBSPPA2048_LBSPPB2048_LPA0_LPB0_MIWT8_8_PLR1_SU0_SUM0_SUS64_VWA8_VWB8_WGM1_WGMXCC1_WGMXCCGn1
    SolutionIndex: 2
    SolutionNameMin: Cijk_Ailk_Bjlk_B8F8NHS_BH_Bias_HAS_SAV_UserArgs_MT256x256x64_MI16x16x1_SN_LDSB0_CLR1_GRVWA4_GRVWB8_GSU0_GSUC0_GSUWGMRR0_K1_LBSPPA2048_LBSPPB2048_LPA0_LPB0_MIWT8_8_PLR1_SU0_SUM0_SUS64_VWA8_VWB8_WGM1_WGMXCC1_WGMXCCGn1
    SolutionIndex: 3
    SolutionNameMin: Cijk_Ailk_Bjlk_B8F8NHS_BH_Bias_HAS_SAV_UserArgs_MT256x256x64_MI16x16x1_SN_LDSB0_CLR1_GRVWA4_GRVWB16_GSU0_GSUC0_GSUWGMRR0_K1_LBSPPA2048_LBSPPB2048_LPA0_LPB0_MIWT8_8_PLR1_SU0_SUM0_SUS64_VWA8_VWB8_WGM1_WGMXCC1_WGMXCCGn1
    SolutionIndex: 4
    SolutionNameMin: Cijk_Ailk_Bjlk_B8F8NHS_BH_Bias_HAS_SAV_UserArgs_MT256x256x64_MI16x16x1_SN_LDSB0_CLR1_GRVWA8_GRVWB16_GSU0_GSUC0_GSUWGMRR0_K1_LBSPPA2048_LBSPPB2048_LPA0_LPB0_MIWT8_8_PLR1_SU0_SUM0_SUS64_VWA8_VWB8_WGM1_WGMXCC1_WGMXCCGn1
    SolutionIndex: 5
    SolutionNameMin: Cijk_Ailk_Bjlk_B8F8NHS_BH_Bias_HAS_SAV_UserArgs_MT256x256x64_MI16x16x1_SN_LDSB0_CLR1_GRVWA16_GRVWB16_GSU0_GSUC0_GSUWGMRR0_K1_LBSPPA2048_LBSPPB2048_LPA0_LPB0_MIWT8_8_PLR1_SU0_SUM0_SUS64_VWA8_VWB8_WGM1_WGMXCC1_WGMXCCGn1
    SolutionIndex: 6
    SolutionNameMin: Cijk_Ailk_Bjlk_B8F8NHS_BH_Bias_HAS_SAV_UserArgs_MT256x256x64_MI16x16x1_SN_LDSB0_CLR1_GRVWA4_GRVWB4_GSU0_GSUC0_GSUWGMRR0_K1_LBSPPA2048_LBSPPB2048_LPA0_LPB0_MIWT8_8_PLR1_SU0_SUM0_SUS64_VWA8_VWB8_WGM4_WGMXCC1_WGMXCCGn1
    SolutionIndex: 7
    SolutionNameMin: Cijk_Ailk_Bjlk_B8F8NHS_BH_Bias_HAS_SAV_UserArgs_MT256x256x64_MI16x16x1_SN_LDSB0_CLR1_GRVWA4_GRVWB16_GSU0_GSUC0_GSUWGMRR0_K1_LBSPPA2048_LBSPPB2048_LPA0_LPB0_MIWT8_8_PLR1_SU0_SUM0_SUS64_VWA8_VWB8_WGM4_WGMXCC1_WGMXCCGn1
    SolutionIndex: 8
    SolutionNameMin: Cijk_Ailk_Bjlk_B8F8NHS_BH_Bias_HAS_SAV_UserArgs_MT256x256x64_MI16x16x1_SN_LDSB0_CLR1_GRVWA16_GRVWB16_GSU0_GSUC0_GSUWGMRR0_K1_LBSPPA2048_LBSPPB2048_LPA0_LPB0_MIWT8_8_PLR1_SU0_SUM0_SUS64_VWA8_VWB8_WGM4_WGMXCC1_WGMXCCGn1
    SolutionIndex: 9
    SolutionNameMin: Cijk_Ailk_Bjlk_B8F8NHS_BH_Bias_HAS_SAV_UserArgs_MT256x256x64_MI16x16x1_SN_LDSB0_CLR1_GRVWA16_GRVWB16_GSU0_GSUC0_GSUWGMRR0_K1_LBSPPA2048_LBSPPB2048_LPA0_LPB0_MIWT8_8_PLR1_SU0_SUM0_SUS64_VWA8_VWB8_WGM6_WGMXCC1_WGMXCCGn1
    SolutionIndex: 10
    SolutionNameMin: Cijk_Ailk_Bjlk_B8F8NHS_BH_Bias_HAS_SAV_UserArgs_MT256x256x64_MI16x16x1_SN_LDSB0_CLR1_GRVWA4_GRVWB8_GSU0_GSUC0_GSUWGMRR0_K1_LBSPPA2048_LBSPPB2048_LPA0_LPB0_MIWT8_8_PLR1_SU0_SUM0_SUS64_VWA8_VWB8_WGM8_WGMXCC1_WGMXCCGn1
    SolutionIndex: 11
    SolutionNameMin: Cijk_Ailk_Bjlk_B8F8NHS_BH_Bias_HAS_SAV_UserArgs_MT256x256x64_MI16x16x1_SN_LDSB0_CLR1_GRVWA8_GRVWB16_GSU0_GSUC0_GSUWGMRR0_K1_LBSPPA2048_LBSPPB2048_LPA0_LPB0_MIWT8_8_PLR1_SU0_SUM0_SUS64_VWA8_VWB8_WGM8_WGMXCC1_WGMXCCGn1
    SolutionIndex: 12
    SolutionNameMin: Cijk_Ailk_Bjlk_B8F8NHS_BH_Bias_HAS_SAV_UserArgs_MT256x256x64_MI16x16x1_SN_LDSB0_CLR1_GRVWA16_GRVWB16_GSU0_GSUC0_GSUWGMRR0_K1_LBSPPA2048_LBSPPB2048_LPA0_LPB0_MIWT8_8_PLR1_SU0_SUM0_SUS64_VWA8_VWB8_WGM8_WGMXCC1_WGMXCCGn1
    SolutionIndex: 13
    SolutionNameMin: Cijk_Ailk_Bjlk_B8F8NHS_BH_Bias_HAS_SAV_UserArgs_MT128x256x64_MI16x16x1_SN_LDSB1_CLR1_GRVWA8_GRVWB16_GSU0_GSUC0_GSUWGMRR0_K1_LBSPPA1024_LBSPPB2048_LPA64_LPB0_MIWT4_8_PLR1_SU0_SUM0_SUS64_VWA4_VWB8_WGM1_WGMXCC1_WGMXCCGn1
    SolutionIndex: 14
    SolutionNameMin: Cijk_Ailk_Bjlk_B8F8NHS_BH_Bias_HAS_SAV_UserArgs_MT128x256x64_MI16x16x1_SN_LDSB1_CLR1_GRVWA4_GRVWB16_GSU0_GSUC0_GSUWGMRR0_K1_LBSPPA1024_LBSPPB2048_LPA64_LPB0_MIWT4_8_PLR1_SU0_SUM0_SUS64_VWA4_VWB8_WGM4_WGMXCC1_WGMXCCGn1
    SolutionIndex: 15
    SolutionNameMin: Cijk_Ailk_Bjlk_B8F8NHS_BH_Bias_HAS_SAV_UserArgs_MT128x256x64_MI16x16x1_SN_LDSB1_CLR1_GRVWA16_GRVWB16_GSU0_GSUC0_GSUWGMRR0_K1_LBSPPA1024_LBSPPB2048_LPA64_LPB0_MIWT4_8_PLR1_SU0_SUM0_SUS64_VWA4_VWB8_WGM6_WGMXCC1_WGMXCCGn1
    SolutionIndex: 16
    SolutionNameMin: Cijk_Ailk_Bjlk_B8F8NHS_BH_Bias_HAS_SAV_UserArgs_MT128x256x64_MI16x16x1_SN_LDSB1_CLR1_GRVWA4_GRVWB16_GSU0_GSUC0_GSUWGMRR0_K1_LBSPPA1024_LBSPPB2048_LPA64_LPB0_MIWT4_8_PLR1_SU0_SUM0_SUS64_VWA4_VWB8_WGM8_WGMXCC1_WGMXCCGn1
    SolutionIndex: 17
    SolutionNameMin: Cijk_Ailk_Bjlk_B8F8NHS_BH_Bias_HAS_SAV_UserArgs_MT128x256x64_MI16x16x1_SN_LDSB1_CLR1_GRVWA8_GRVWB16_GSU0_GSUC0_GSUWGMRR0_K1_LBSPPA1024_LBSPPB2048_LPA64_LPB0_MIWT4_8_PLR1_SU0_SUM0_SUS64_VWA4_VWB8_WGM8_WGMXCC1_WGMXCCGn1
    SolutionIndex: 18
    SolutionNameMin: Cijk_Ailk_Bjlk_B8F8NHS_BH_Bias_HAS_SAV_UserArgs_MT128x256x64_MI16x16x1_SN_LDSB1_CLR1_GRVWA16_GRVWB16_GSU0_GSUC0_GSUWGMRR0_K1_LBSPPA1024_LBSPPB2048_LPA64_LPB0_MIWT4_8_PLR1_SU0_SUM0_SUS64_VWA4_VWB8_WGM8_WGMXCC1_WGMXCCGn1
    SolutionIndex: 19
    SolutionNameMin: Cijk_Ailk_Bjlk_B8F8NHS_BH_Bias_HAS_SAV_UserArgs_MT256x144x64_MI16x16x1_SN_LDSB0_CLR1_GRVWA8_GRVWB4_GSU0_GSUC0_GSUWGMRR0_K1_LBSPPA2048_LBSPPB1152_LPA64_LPB16_MIWT4_9_PLR1_SU0_SUM0_SUS64_VWA4_VWB1_WGM1_WGMXCC1_WGMXCCGn1
    SolutionIndex: 20
    SolutionNameMin: Cijk_Ailk_Bjlk_B8F8NHS_BH_Bias_HAS_SAV_UserArgs_MT256x144x64_MI16x16x1_SN_LDSB0_CLR1_GRVWA16_GRVWB4_GSU0_GSUC0_GSUWGMRR0_K1_LBSPPA2048_LBSPPB1152_LPA64_LPB16_MIWT4_9_PLR1_SU0_SUM0_SUS64_VWA4_VWB1_WGM1_WGMXCC1_WGMXCCGn1
    SolutionIndex: 21
    SolutionNameMin: Cijk_Ailk_Bjlk_B8F8NHS_BH_Bias_HAS_SAV_UserArgs_MT256x144x64_MI16x16x1_SN_LDSB0_CLR1_GRVWA16_GRVWB4_GSU0_GSUC0_GSUWGMRR0_K1_LBSPPA2048_LBSPPB1152_LPA64_LPB16_MIWT4_9_PLR1_SU0_SUM0_SUS64_VWA4_VWB1_WGM4_WGMXCC1_WGMXCCGn1
    SolutionIndex: 22
    SolutionNameMin: Cijk_Ailk_Bjlk_B8F8NHS_BH_Bias_HAS_SAV_UserArgs_MT256x144x64_MI16x16x1_SN_LDSB0_CLR1_GRVWA16_GRVWB4_GSU0_GSUC0_GSUWGMRR0_K1_LBSPPA2048_LBSPPB1152_LPA64_LPB16_MIWT4_9_PLR1_SU0_SUM0_SUS64_VWA4_VWB1_WGM6_WGMXCC1_WGMXCCGn1
    SolutionIndex: 23
    SolutionNameMin: Cijk_Ailk_Bjlk_B8F8NHS_BH_Bias_HAS_SAV_UserArgs_MT256x128x64_MI16x16x1_SN_LDSB1_CLR1_GRVWA16_GRVWB4_GSU0_GSUC0_GSUWGMRR0_K1_LBSPPA2048_LBSPPB1024_LPA0_LPB64_MIWT8_4_PLR1_SU0_SUM0_SUS64_VWA8_VWB4_WGM1_WGMXCC1_WGMXCCGn1
    SolutionIndex: 24
    SolutionNameMin: Cijk_Ailk_Bjlk_B8F8NHS_BH_Bias_HAS_SAV_UserArgs_MT256x128x64_MI16x16x1_SN_LDSB1_CLR1_GRVWA16_GRVWB8_GSU0_GSUC0_GSUWGMRR0_K1_LBSPPA2048_LBSPPB1024_LPA0_LPB64_MIWT8_4_PLR1_SU0_SUM0_SUS64_VWA8_VWB4_WGM1_WGMXCC1_WGMXCCGn1
    SolutionIndex: 25
    SolutionNameMin: Cijk_Ailk_Bjlk_B8F8NHS_BH_Bias_HAS_SAV_UserArgs_MT256x128x64_MI16x16x1_SN_LDSB1_CLR1_GRVWA8_GRVWB16_GSU0_GSUC0_GSUWGMRR0_K1_LBSPPA2048_LBSPPB1024_LPA0_LPB64_MIWT8_4_PLR1_SU0_SUM0_SUS64_VWA8_VWB4_WGM1_WGMXCC1_WGMXCCGn1
    SolutionIndex: 26
    SolutionNameMin: Cijk_Ailk_Bjlk_B8F8NHS_BH_Bias_HAS_SAV_UserArgs_MT256x128x64_MI16x16x1_SN_LDSB1_CLR1_GRVWA16_GRVWB16_GSU0_GSUC0_GSUWGMRR0_K1_LBSPPA2048_LBSPPB1024_LPA0_LPB64_MIWT8_4_PLR1_SU0_SUM0_SUS64_VWA8_VWB4_WGM1_WGMXCC1_WGMXCCGn1
    SolutionIndex: 27
    SolutionNameMin: Cijk_Ailk_Bjlk_B8F8NHS_BH_Bias_HAS_SAV_UserArgs_MT256x128x64_MI16x16x1_SN_LDSB1_CLR1_GRVWA16_GRVWB16_GSU0_GSUC0_GSUWGMRR0_K1_LBSPPA2048_LBSPPB1024_LPA0_LPB64_MIWT8_4_PLR1_SU0_SUM0_SUS64_VWA8_VWB4_WGM4_WGMXCC1_WGMXCCGn1
    SolutionIndex: 28
    SolutionNameMin: Cijk_Ailk_Bjlk_B8F8NHS_BH_Bias_HAS_SAV_UserArgs_MT256x128x64_MI16x16x1_SN_LDSB1_CLR1_GRVWA16_GRVWB16_GSU0_GSUC0_GSUWGMRR0_K1_LBSPPA2048_LBSPPB1024_LPA0_LPB64_MIWT8_4_PLR1_SU0_SUM0_SUS64_VWA8_VWB4_WGM6_WGMXCC1_WGMXCCGn1
    SolutionIndex: 29
    SolutionNameMin: Cijk_Ailk_Bjlk_B8F8NHS_BH_Bias_HAS_SAV_UserArgs_MT256x128x64_MI16x16x1_SN_LDSB1_CLR1_GRVWA4_GRVWB8_GSU0_GSUC0_GSUWGMRR0_K1_LBSPPA2048_LBSPPB1024_LPA0_LPB64_MIWT8_4_PLR1_SU0_SUM0_SUS64_VWA8_VWB4_WGM8_WGMXCC1_WGMXCCGn1
    SolutionIndex: 30
    SolutionNameMin: Cijk_Ailk_Bjlk_B8F8NHS_BH_Bias_HAS_SAV_UserArgs_MT256x128x64_MI16x16x1_SN_LDSB1_CLR1_GRVWA8_GRVWB16_GSU0_GSUC0_GSUWGMRR0_K1_LBSPPA2048_LBSPPB1024_LPA0_LPB64_MIWT8_4_PLR1_SU0_SUM0_SUS64_VWA8_VWB4_WGM8_WGMXCC1_WGMXCCGn1
    SolutionIndex: 31
    SolutionNameMin: Cijk_Ailk_Bjlk_B8F8NHS_BH_Bias_HAS_SAV_UserArgs_MT256x128x64_MI16x16x1_SN_LDSB1_CLR1_GRVWA16_GRVWB16_GSU0_GSUC0_GSUWGMRR0_K1_LBSPPA2048_LBSPPB1024_LPA0_LPB64_MIWT8_4_PLR1_SU0_SUM0_SUS64_VWA8_VWB4_WGM8_WGMXCC1_WGMXCCGn1
    SolutionIndex: 32
    SolutionNameMin: Cijk_Ailk_Bjlk_B8F8NHS_BH_Bias_HAS_SAV_UserArgs_MT144x256x64_MI16x16x1_SN_LDSB0_CLR1_GRVWA4_GRVWB16_GSU0_GSUC0_GSUWGMRR0_K1_LBSPPA1152_LBSPPB2048_LPA16_LPB64_MIWT9_4_PLR1_SU0_SUM0_SUS64_VWA1_VWB4_WGM4_WGMXCC1_WGMXCCGn1
    SolutionIndex: 33
    SolutionNameMin: Cijk_Ailk_Bjlk_B8F8NHS_BH_Bias_HAS_SAV_UserArgs_MT128x128x64_MI16x16x1_SN_LDSB1_CLR1_GRVWA4_GRVWB4_GSU0_GSUC0_GSUWGMRR0_K1_LBSPPA1024_LBSPPB1024_LPA0_LPB32_MIWT8_2_PLR1_SU0_SUM0_SUS64_VWA8_VWB2_WGM1_WGMXCC1_WGMXCCGn1
    SolutionIndex: 34
    SolutionNameMin: Cijk_Ailk_Bjlk_B8F8NHS_BH_Bias_HAS_SAV_UserArgs_MT128x128x64_MI16x16x1_SN_LDSB1_CLR1_GRVWA4_GRVWB16_GSU0_GSUC0_GSUWGMRR0_K1_LBSPPA1024_LBSPPB1024_LPA0_LPB32_MIWT8_2_PLR1_SU0_SUM0_SUS64_VWA8_VWB2_WGM1_WGMXCC1_WGMXCCGn1
    SolutionIndex: 35
    SolutionNameMin: Cijk_Ailk_Bjlk_B8F8NHS_BH_Bias_HAS_SAV_UserArgs_MT128x128x64_MI16x16x1_SN_LDSB1_CLR1_GRVWA16_GRVWB16_GSU0_GSUC0_GSUWGMRR0_K1_LBSPPA1024_LBSPPB1024_LPA0_LPB32_MIWT8_2_PLR1_SU0_SUM0_SUS64_VWA8_VWB2_WGM1_WGMXCC1_WGMXCCGn1
    SolutionIndex: 36
    SolutionNameMin: Cijk_Ailk_Bjlk_B8F8NHS_BH_Bias_HAS_SAV_UserArgs_MT128x128x64_MI16x16x1_SN_LDSB1_CLR1_GRVWA4_GRVWB4_GSU0_GSUC0_GSUWGMRR0_K1_LBSPPA1024_LBSPPB1024_LPA0_LPB32_MIWT8_2_PLR1_SU0_SUM0_SUS64_VWA8_VWB2_WGM4_WGMXCC1_WGMXCCGn1
    SolutionIndex: 37
    SolutionNameMin: Cijk_Ailk_Bjlk_B8F8NHS_BH_Bias_HAS_SAV_UserArgs_MT128x128x64_MI16x16x1_SN_LDSB1_CLR1_GRVWA4_GRVWB4_GSU0_GSUC0_GSUWGMRR0_K1_LBSPPA1024_LBSPPB1024_LPA0_LPB32_MIWT8_2_PLR1_SU0_SUM0_SUS64_VWA8_VWB2_WGM6_WGMXCC1_WGMXCCGn1
    SolutionIndex: 38
    SolutionNameMin: Cijk_Ailk_Bjlk_B8F8NHS_BH_Bias_HAS_SAV_UserArgs_MT128x64x64_MI16x16x1_SN_LDSB0_CLR1_GRVWA4_GRVWB8_GSU0_GSUC0_GSUWGMRR0_K1_LBSPPA1024_LBSPPB512_LPA0_LPB16_MIWT8_1_PLR1_SU0_SUM0_SUS64_VWA8_VWB1_WGM1_WGMXCC1_WGMXCCGn1
    SolutionIndex: 39
    SolutionNameMin: Cijk_Ailk_Bjlk_B8F8NHS_BH_Bias_HAS_SAV_UserArgs_MT128x128x64_MI16x16x1_SN_LDSB1_CLR1_GRVWA16_GRVWB8_GSU0_GSUC0_GSUWGMRR0_K1_LBSPPA1024_LBSPPB1024_LPA64_LPB64_MIWT4_4_PLR1_SU0_SUM0_SUS64_VWA4_VWB4_WGM1_WGMXCC1_WGMXCCGn1
    SolutionIndex: 40
    SolutionNameMin: Cijk_Ailk_Bjlk_B8F8NHS_BH_Bias_HAS_SAV_UserArgs_MT128x128x64_MI16x16x1_SN_LDSB1_CLR1_GRVWA8_GRVWB16_GSU0_GSUC0_GSUWGMRR0_K1_LBSPPA1024_LBSPPB1024_LPA64_LPB64_MIWT4_4_PLR1_SU0_SUM0_SUS64_VWA4_VWB4_WGM1_WGMXCC1_WGMXCCGn1
    SolutionIndex: 41
    SolutionNameMin: Cijk_Ailk_Bjlk_B8F8NHS_BH_Bias_HAS_SAV_UserArgs_MT128x128x64_MI16x16x1_SN_LDSB1_CLR1_GRVWA16_GRVWB16_GSU0_GSUC0_GSUWGMRR0_K1_LBSPPA1024_LBSPPB1024_LPA64_LPB64_MIWT4_4_PLR1_SU0_SUM0_SUS64_VWA4_VWB4_WGM1_WGMXCC1_WGMXCCGn1
    SolutionIndex: 42
    SolutionNameMin: Cijk_Ailk_Bjlk_B8F8NHS_BH_Bias_HAS_SAV_UserArgs_MT128x128x64_MI16x16x1_SN_LDSB1_CLR1_GRVWA16_GRVWB8_GSU0_GSUC0_GSUWGMRR0_K1_LBSPPA1024_LBSPPB1024_LPA64_LPB64_MIWT4_4_PLR1_SU0_SUM0_SUS64_VWA4_VWB4_WGM4_WGMXCC1_WGMXCCGn1
    SolutionIndex: 43
    SolutionNameMin: Cijk_Ailk_Bjlk_B8F8NHS_BH_Bias_HAS_SAV_UserArgs_MT128x128x64_MI16x16x1_SN_LDSB1_CLR1_GRVWA16_GRVWB16_GSU0_GSUC0_GSUWGMRR0_K1_LBSPPA1024_LBSPPB1024_LPA64_LPB64_MIWT4_4_PLR1_SU0_SUM0_SUS64_VWA4_VWB4_WGM4_WGMXCC1_WGMXCCGn1
    SolutionIndex: 44
    SolutionNameMin: Cijk_Ailk_Bjlk_B8F8NHS_BH_Bias_HAS_SAV_UserArgs_MT128x128x64_MI16x16x1_SN_LDSB1_CLR1_GRVWA16_GRVWB8_GSU0_GSUC0_GSUWGMRR0_K1_LBSPPA1024_LBSPPB1024_LPA64_LPB64_MIWT4_4_PLR1_SU0_SUM0_SUS64_VWA4_VWB4_WGM6_WGMXCC1_WGMXCCGn1
    SolutionIndex: 45
    SolutionNameMin: Cijk_Ailk_Bjlk_B8F8NHS_BH_Bias_HAS_SAV_UserArgs_MT128x128x64_MI16x16x1_SN_LDSB1_CLR1_GRVWA8_GRVWB16_GSU0_GSUC0_GSUWGMRR0_K1_LBSPPA1024_LBSPPB1024_LPA64_LPB64_MIWT4_4_PLR1_SU0_SUM0_SUS64_VWA4_VWB4_WGM8_WGMXCC1_WGMXCCGn1
    SolutionIndex: 46
    SolutionNameMin: Cijk_Ailk_Bjlk_B8F8NHS_BH_Bias_HAS_SAV_UserArgs_MT128x128x64_MI16x16x1_SN_LDSB1_CLR1_GRVWA16_GRVWB16_GSU0_GSUC0_GSUWGMRR0_K1_LBSPPA1024_LBSPPB1024_LPA64_LPB64_MIWT4_4_PLR1_SU0_SUM0_SUS64_VWA4_VWB4_WGM8_WGMXCC1_WGMXCCGn1
    SolutionIndex: 47
    SolutionNameMin: Cijk_Ailk_Bjlk_B8F8NHS_BH_Bias_HAS_SAV_UserArgs_MT64x128x64_MI16x16x1_SN_LDSB0_CLR1_GRVWA4_GRVWB4_GSU0_GSUC0_GSUWGMRR0_K1_LBSPPA512_LBSPPB1024_LPA32_LPB64_MIWT2_4_PLR1_SU0_SUM0_SUS64_VWA2_VWB4_WGM1_WGMXCC1_WGMXCCGn1
    SolutionIndex: 48
    SolutionNameMin: Cijk_Ailk_Bjlk_B8F8NHS_BH_Bias_HAS_SAV_UserArgs_MT64x128x64_MI16x16x1_SN_LDSB0_CLR1_GRVWA8_GRVWB4_GSU0_GSUC0_GSUWGMRR0_K1_LBSPPA512_LBSPPB1024_LPA32_LPB64_MIWT2_4_PLR1_SU0_SUM0_SUS64_VWA2_VWB4_WGM1_WGMXCC1_WGMXCCGn1
    SolutionIndex: 49
    SolutionNameMin: Cijk_Ailk_Bjlk_B8F8NHS_BH_Bias_HAS_SAV_UserArgs_MT64x128x64_MI16x16x1_SN_LDSB0_CLR1_GRVWA4_GRVWB8_GSU0_GSUC0_GSUWGMRR0_K1_LBSPPA512_LBSPPB1024_LPA32_LPB64_MIWT2_4_PLR1_SU0_SUM0_SUS64_VWA2_VWB4_WGM1_WGMXCC1_WGMXCCGn1
    SolutionIndex: 50
    SolutionNameMin: Cijk_Ailk_Bjlk_B8F8NHS_BH_Bias_HAS_SAV_UserArgs_MT64x128x64_MI16x16x1_SN_LDSB0_CLR1_GRVWA8_GRVWB8_GSU0_GSUC0_GSUWGMRR0_K1_LBSPPA512_LBSPPB1024_LPA32_LPB64_MIWT2_4_PLR1_SU0_SUM0_SUS64_VWA2_VWB4_WGM1_WGMXCC1_WGMXCCGn1
    SolutionIndex: 51
    SolutionNameMin: Cijk_Ailk_Bjlk_B8F8NHS_BH_Bias_HAS_SAV_UserArgs_MT64x128x64_MI16x16x1_SN_LDSB0_CLR1_GRVWA4_GRVWB16_GSU0_GSUC0_GSUWGMRR0_K1_LBSPPA512_LBSPPB1024_LPA32_LPB64_MIWT2_4_PLR1_SU0_SUM0_SUS64_VWA2_VWB4_WGM1_WGMXCC1_WGMXCCGn1
    SolutionIndex: 52
    SolutionNameMin: Cijk_Ailk_Bjlk_B8F8NHS_BH_Bias_HAS_SAV_UserArgs_MT64x128x64_MI16x16x1_SN_LDSB0_CLR1_GRVWA8_GRVWB16_GSU0_GSUC0_GSUWGMRR0_K1_LBSPPA512_LBSPPB1024_LPA32_LPB64_MIWT2_4_PLR1_SU0_SUM0_SUS64_VWA2_VWB4_WGM1_WGMXCC1_WGMXCCGn1
    SolutionIndex: 53
    SolutionNameMin: Cijk_Ailk_Bjlk_B8F8NHS_BH_Bias_HAS_SAV_UserArgs_MT64x128x64_MI16x16x1_SN_LDSB0_CLR1_GRVWA16_GRVWB16_GSU0_GSUC0_GSUWGMRR0_K1_LBSPPA512_LBSPPB1024_LPA32_LPB64_MIWT2_4_PLR1_SU0_SUM0_SUS64_VWA2_VWB4_WGM1_WGMXCC1_WGMXCCGn1
    SolutionIndex: 54
    SolutionNameMin: Cijk_Ailk_Bjlk_B8F8NHS_BH_Bias_HAS_SAV_UserArgs_MT128x64x64_MI16x16x1_SN_LDSB0_CLR1_GRVWA4_GRVWB4_GSU0_GSUC0_GSUWGMRR0_K1_LBSPPA1024_LBSPPB512_LPA64_LPB32_MIWT4_2_PLR1_SU0_SUM0_SUS64_VWA4_VWB2_WGM1_WGMXCC1_WGMXCCGn1
    SolutionIndex: 55
    SolutionNameMin: Cijk_Ailk_Bjlk_B8F8NHS_BH_Bias_HAS_SAV_UserArgs_MT128x64x64_MI16x16x1_SN_LDSB0_CLR1_GRVWA4_GRVWB8_GSU0_GSUC0_GSUWGMRR0_K1_LBSPPA1024_LBSPPB512_LPA64_LPB32_MIWT4_2_PLR1_SU0_SUM0_SUS64_VWA4_VWB2_WGM1_WGMXCC1_WGMXCCGn1
    SolutionIndex: 56
    SolutionNameMin: Cijk_Ailk_Bjlk_B8F8NHS_BH_Bias_HAS_SAV_UserArgs_MT128x32x64_MI16x16x1_SN_LDSB0_CLR1_GRVWA4_GRVWB4_GSU0_GSUC0_GSUWGMRR0_K1_LBSPPA1024_LBSPPB256_LPA64_LPB16_MIWT4_1_PLR1_SU0_SUM0_SUS64_VWA4_VWB1_WGM1_WGMXCC1_WGMXCCGn1
    SolutionIndex: 57
    SolutionNameMin: Cijk_Ailk_Bjlk_B8F8NHS_BH_Bias_HAS_SAV_UserArgs_MT64x64x64_MI16x16x1_SN_LDSB0_CLR1_GRVWA4_GRVWB4_GSU0_GSUC0_GSUWGMRR0_K1_LBSPPA512_LBSPPB512_LPA32_LPB32_MIWT2_2_PLR1_SU0_SUM0_SUS64_VWA2_VWB2_WGM1_WGMXCC1_WGMXCCGn1
    SolutionIndex: 58
    SolutionNameMin: Cijk_Ailk_Bjlk_B8F8NHS_BH_Bias_HAS_SAV_UserArgs_MT64x64x64_MI16x16x1_SN_LDSB0_CLR1_GRVWA4_GRVWB8_GSU0_GSUC0_GSUWGMRR0_K1_LBSPPA512_LBSPPB512_LPA32_LPB32_MIWT2_2_PLR1_SU0_SUM0_SUS64_VWA2_VWB2_WGM1_WGMXCC1_WGMXCCGn1
    SolutionIndex: 59
    SolutionNameMin: Cijk_Ailk_Bjlk_B8F8NHS_BH_Bias_HAS_SAV_UserArgs_MT64x64x64_MI16x16x1_SN_LDSB0_CLR1_GRVWA8_GRVWB8_GSU0_GSUC0_GSUWGMRR0_K1_LBSPPA512_LBSPPB512_LPA32_LPB32_MIWT2_2_PLR1_SU0_SUM0_SUS64_VWA2_VWB2_WGM1_WGMXCC1_WGMXCCGn1
    SolutionIndex: 60
    SolutionNameMin: Cijk_Ailk_Bjlk_B8F8NHS_BH_Bias_HAS_SAV_UserArgs_MT64x64x64_MI16x16x1_SN_LDSB0_CLR1_GRVWA4_GRVWB4_GSU0_GSUC0_GSUWGMRR0_K1_LBSPPA512_LBSPPB512_LPA32_LPB32_MIWT2_2_PLR1_SU0_SUM0_SUS64_VWA2_VWB2_WGM4_WGMXCC1_WGMXCCGn1
    SolutionIndex: 61
    SolutionNameMin: Cijk_Ailk_Bjlk_B8F8NHS_BH_Bias_HAS_SAV_UserArgs_MT64x64x64_MI16x16x1_SN_LDSB0_CLR1_GRVWA4_GRVWB8_GSU0_GSUC0_GSUWGMRR0_K1_LBSPPA512_LBSPPB512_LPA32_LPB32_MIWT2_2_PLR1_SU0_SUM0_SUS64_VWA2_VWB2_WGM6_WGMXCC1_WGMXCCGn1
    SolutionIndex: 62
    SolutionNameMin: Cijk_Ailk_Bjlk_B8F8NHS_BH_Bias_HAS_SAV_UserArgs_MT64x32x64_MI16x16x1_SN_LDSB0_CLR1_GRVWA4_GRVWB4_GSU0_GSUC0_GSUWGMRR0_K1_LBSPPA512_LBSPPB256_LPA32_LPB16_MIWT2_1_PLR1_SU0_SUM0_SUS64_VWA2_VWB1_WGM1_WGMXCC1_WGMXCCGn1
    SolutionIndex: 63
    SolutionNameMin: Cijk_Ailk_Bjlk_B8F8NHS_BH_Bias_HAS_SAV_UserArgs_MT64x32x64_MI16x16x1_SN_LDSB0_CLR1_GRVWA8_GRVWB4_GSU0_GSUC0_GSUWGMRR0_K1_LBSPPA512_LBSPPB256_LPA32_LPB16_MIWT2_1_PLR1_SU0_SUM0_SUS64_VWA2_VWB1_WGM1_WGMXCC1_WGMXCCGn1
    SolutionIndex: 64
    SolutionNameMin: Cijk_Ailk_Bjlk_B8F8NHS_BH_Bias_HAS_SAV_UserArgs_MT64x32x64_MI16x16x1_SN_LDSB0_CLR1_GRVWA4_GRVWB8_GSU0_GSUC0_GSUWGMRR0_K1_LBSPPA512_LBSPPB256_LPA32_LPB16_MIWT2_1_PLR1_SU0_SUM0_SUS64_VWA2_VWB1_WGM1_WGMXCC1_WGMXCCGn1
    SolutionIndex: 65
    SolutionNameMin: Cijk_Ailk_Bjlk_B8F8NHS_BH_Bias_HAS_SAV_UserArgs_MT64x32x64_MI16x16x1_SN_LDSB0_CLR1_GRVWA8_GRVWB8_GSU0_GSUC0_GSUWGMRR0_K1_LBSPPA512_LBSPPB256_LPA32_LPB16_MIWT2_1_PLR1_SU0_SUM0_SUS64_VWA2_VWB1_WGM1_WGMXCC1_WGMXCCGn1
    SolutionIndex: 66
    SolutionNameMin: Cijk_Ailk_Bjlk_B8F8NHS_BH_Bias_HAS_SAV_UserArgs_MT32x32x64_MI16x16x1_SN_LDSB0_CLR1_GRVWA4_GRVWB4_GSU0_GSUC0_GSUWGMRR0_K1_LBSPPA256_LBSPPB256_LPA16_LPB16_MIWT1_1_PLR1_SU0_SUM0_SUS64_VWA1_VWB1_WGM1_WGMXCC1_WGMXCCGn1
    SolutionIndex: 67
    SolutionNameMin: Cijk_Ailk_Bjlk_B8F8NHS_BH_Bias_HAS_SAV_UserArgs_MT32x32x64_MI16x16x1_SN_LDSB0_CLR1_GRVWA8_GRVWB4_GSU0_GSUC0_GSUWGMRR0_K1_LBSPPA256_LBSPPB256_LPA16_LPB16_MIWT1_1_PLR1_SU0_SUM0_SUS64_VWA1_VWB1_WGM1_WGMXCC1_WGMXCCGn1
    SolutionIndex: 68
    SolutionNameMin: Cijk_Ailk_Bjlk_B8F8NHS_BH_Bias_HAS_SAV_UserArgs_MT32x32x64_MI16x16x1_SN_LDSB0_CLR1_GRVWA4_GRVWB8_GSU0_GSUC0_GSUWGMRR0_K1_LBSPPA256_LBSPPB256_LPA16_LPB16_MIWT1_1_PLR1_SU0_SUM0_SUS64_VWA1_VWB1_WGM1_WGMXCC1_WGMXCCGn1
    SolutionIndex: 69
    SolutionNameMin: Cijk_Ailk_Bjlk_B8F8NHS_BH_Bias_HAS_SAV_UserArgs_MT32x32x64_MI16x16x1_SN_LDSB0_CLR1_GRVWA8_GRVWB8_GSU0_GSUC0_GSUWGMRR0_K1_LBSPPA256_LBSPPB256_LPA16_LPB16_MIWT1_1_PLR1_SU0_SUM0_SUS64_VWA1_VWB1_WGM1_WGMXCC1_WGMXCCGn1
    SolutionIndex: 70
    SolutionNameMin: Cijk_Ailk_Bjlk_B8F8NHS_BH_Bias_HAS_SAV_UserArgs_MT32x32x64_MI16x16x1_SN_LDSB0_CLR1_GRVWA8_GRVWB8_GSU0_GSUC0_GSUWGMRR0_K1_LBSPPA256_LBSPPB256_LPA16_LPB16_MIWT1_1_PLR1_SU0_SUM0_SUS64_VWA1_VWB1_WGM6_WGMXCC1_WGMXCCGn1
    SolutionIndex: 71
    SolutionNameMin: Cijk_Ailk_Bjlk_B8F8NHS_BH_Bias_HAS_SAV_UserArgs_MT256x256x128_MI16x16x1_SN_LDSB1_CLR1_GRVWA16_GRVWB8_GSU0_GSUC0_GSUWGMRR0_K1_LBSPPA2048_LBSPPB2048_LPA0_LPB0_MIWT8_8_PLR1_SU0_SUM0_SUS128_VWA8_VWB8_WGM1_WGMXCC1_WGMXCCGn1
    SolutionIndex: 72
    SolutionNameMin: Cijk_Ailk_Bjlk_B8F8NHS_BH_Bias_HAS_SAV_UserArgs_MT256x256x128_MI16x16x1_SN_LDSB1_CLR1_GRVWA16_GRVWB16_GSU0_GSUC0_GSUWGMRR0_K1_LBSPPA2048_LBSPPB2048_LPA0_LPB0_MIWT8_8_PLR1_SU0_SUM0_SUS128_VWA8_VWB8_WGM1_WGMXCC1_WGMXCCGn1
    SolutionIndex: 73
    SolutionNameMin: Cijk_Ailk_Bjlk_B8F8NHS_BH_Bias_HAS_SAV_UserArgs_MT256x256x128_MI16x16x1_SN_LDSB1_CLR1_GRVWA16_GRVWB8_GSU0_GSUC0_GSUWGMRR0_K1_LBSPPA2048_LBSPPB2048_LPA0_LPB0_MIWT8_8_PLR1_SU0_SUM0_SUS128_VWA8_VWB8_WGM4_WGMXCC1_WGMXCCGn1
    SolutionIndex: 74
    SolutionNameMin: Cijk_Ailk_Bjlk_B8F8NHS_BH_Bias_HAS_SAV_UserArgs_MT256x256x128_MI16x16x1_SN_LDSB1_CLR1_GRVWA16_GRVWB16_GSU0_GSUC0_GSUWGMRR0_K1_LBSPPA2048_LBSPPB2048_LPA0_LPB0_MIWT8_8_PLR1_SU0_SUM0_SUS128_VWA8_VWB8_WGM4_WGMXCC1_WGMXCCGn1
    SolutionIndex: 75
    SolutionNameMin: Cijk_Ailk_Bjlk_B8F8NHS_BH_Bias_HAS_SAV_UserArgs_MT256x256x128_MI16x16x1_SN_LDSB1_CLR1_GRVWA16_GRVWB16_GSU0_GSUC0_GSUWGMRR0_K1_LBSPPA2048_LBSPPB2048_LPA0_LPB0_MIWT8_8_PLR1_SU0_SUM0_SUS128_VWA8_VWB8_WGM6_WGMXCC1_WGMXCCGn1
    SolutionIndex: 76
    SolutionNameMin: Cijk_Ailk_Bjlk_B8F8NHS_BH_Bias_HAS_SAV_UserArgs_MT256x256x128_MI16x16x1_SN_LDSB1_CLR1_GRVWA16_GRVWB16_GSU0_GSUC0_GSUWGMRR0_K1_LBSPPA2048_LBSPPB2048_LPA0_LPB0_MIWT8_8_PLR1_SU0_SUM0_SUS128_VWA8_VWB8_WGM8_WGMXCC1_WGMXCCGn1
    SolutionIndex: 77
    SolutionNameMin: Cijk_Ailk_Bjlk_B8F8NHS_BH_Bias_HAS_SAV_UserArgs_MT128x256x128_MI16x16x1_SN_LDSB1_CLR1_GRVWA4_GRVWB16_GSU0_GSUC0_GSUWGMRR0_K1_LBSPPA1024_LBSPPB2048_LPA64_LPB0_MIWT4_8_PLR1_SU0_SUM0_SUS128_VWA4_VWB8_WGM1_WGMXCC1_WGMXCCGn1
    SolutionIndex: 78
    SolutionNameMin: Cijk_Ailk_Bjlk_B8F8NHS_BH_Bias_HAS_SAV_UserArgs_MT128x256x128_MI16x16x1_SN_LDSB1_CLR1_GRVWA16_GRVWB16_GSU0_GSUC0_GSUWGMRR0_K1_LBSPPA1024_LBSPPB2048_LPA64_LPB0_MIWT4_8_PLR1_SU0_SUM0_SUS128_VWA4_VWB8_WGM4_WGMXCC1_WGMXCCGn1
    SolutionIndex: 79
    SolutionNameMin: Cijk_Ailk_Bjlk_B8F8NHS_BH_Bias_HAS_SAV_UserArgs_MT128x256x128_MI16x16x1_SN_LDSB1_CLR1_GRVWA4_GRVWB16_GSU0_GSUC0_GSUWGMRR0_K1_LBSPPA1024_LBSPPB2048_LPA64_LPB0_MIWT4_8_PLR1_SU0_SUM0_SUS128_VWA4_VWB8_WGM6_WGMXCC1_WGMXCCGn1
    SolutionIndex: 80
    SolutionNameMin: Cijk_Ailk_Bjlk_B8F8NHS_BH_Bias_HAS_SAV_UserArgs_MT128x256x128_MI16x16x1_SN_LDSB1_CLR1_GRVWA16_GRVWB16_GSU0_GSUC0_GSUWGMRR0_K1_LBSPPA1024_LBSPPB2048_LPA64_LPB0_MIWT4_8_PLR1_SU0_SUM0_SUS128_VWA4_VWB8_WGM6_WGMXCC1_WGMXCCGn1
    SolutionIndex: 81
    SolutionNameMin: Cijk_Ailk_Bjlk_B8F8NHS_BH_Bias_HAS_SAV_UserArgs_MT128x256x128_MI16x16x1_SN_LDSB1_CLR1_GRVWA4_GRVWB16_GSU0_GSUC0_GSUWGMRR0_K1_LBSPPA1024_LBSPPB2048_LPA64_LPB0_MIWT4_8_PLR1_SU0_SUM0_SUS128_VWA4_VWB8_WGM8_WGMXCC1_WGMXCCGn1
    SolutionIndex: 82
    SolutionNameMin: Cijk_Ailk_Bjlk_B8F8NHS_BH_Bias_HAS_SAV_UserArgs_MT128x256x128_MI16x16x1_SN_LDSB1_CLR1_GRVWA8_GRVWB16_GSU0_GSUC0_GSUWGMRR0_K1_LBSPPA1024_LBSPPB2048_LPA64_LPB0_MIWT4_8_PLR1_SU0_SUM0_SUS128_VWA4_VWB8_WGM8_WGMXCC1_WGMXCCGn1
    SolutionIndex: 83
    SolutionNameMin: Cijk_Ailk_Bjlk_B8F8NHS_BH_Bias_HAS_SAV_UserArgs_MT128x256x128_MI16x16x1_SN_LDSB1_CLR1_GRVWA16_GRVWB16_GSU0_GSUC0_GSUWGMRR0_K1_LBSPPA1024_LBSPPB2048_LPA64_LPB0_MIWT4_8_PLR1_SU0_SUM0_SUS128_VWA4_VWB8_WGM8_WGMXCC1_WGMXCCGn1
    SolutionIndex: 84
    SolutionNameMin: Cijk_Ailk_Bjlk_B8F8NHS_BH_Bias_HAS_SAV_UserArgs_MT256x128x128_MI16x16x1_SN_LDSB1_CLR1_GRVWA8_GRVWB16_GSU0_GSUC0_GSUWGMRR0_K1_LBSPPA2048_LBSPPB1024_LPA0_LPB64_MIWT8_4_PLR1_SU0_SUM0_SUS128_VWA8_VWB4_WGM1_WGMXCC1_WGMXCCGn1
    SolutionIndex: 85
    SolutionNameMin: Cijk_Ailk_Bjlk_B8F8NHS_BH_Bias_HAS_SAV_UserArgs_MT256x128x128_MI16x16x1_SN_LDSB1_CLR1_GRVWA16_GRVWB16_GSU0_GSUC0_GSUWGMRR0_K1_LBSPPA2048_LBSPPB1024_LPA0_LPB64_MIWT8_4_PLR1_SU0_SUM0_SUS128_VWA8_VWB4_WGM4_WGMXCC1_WGMXCCGn1
    SolutionIndex: 86
    SolutionNameMin: Cijk_Ailk_Bjlk_B8F8NHS_BH_Bias_HAS_SAV_UserArgs_MT128x128x128_MI16x16x1_SN_LDSB1_CLR1_GRVWA16_GRVWB16_GSU0_GSUC0_GSUWGMRR0_K1_LBSPPA1024_LBSPPB1024_LPA64_LPB64_MIWT4_4_PLR1_SU0_SUM0_SUS128_VWA4_VWB4_WGM1_WGMXCC1_WGMXCCGn1
    SolutionIndex: 87
    SolutionNameMin: Cijk_Ailk_Bjlk_B8F8NHS_BH_Bias_HAS_SAV_UserArgs_MT128x128x128_MI16x16x1_SN_LDSB1_CLR1_GRVWA16_GRVWB16_GSU0_GSUC0_GSUWGMRR0_K1_LBSPPA1024_LBSPPB1024_LPA64_LPB64_MIWT4_4_PLR1_SU0_SUM0_SUS128_VWA4_VWB4_WGM4_WGMXCC1_WGMXCCGn1
    SolutionIndex: 88
    SolutionNameMin: Cijk_Ailk_Bjlk_B8F8NHS_BH_Bias_HAS_SAV_UserArgs_MT128x128x128_MI16x16x1_SN_LDSB1_CLR1_GRVWA16_GRVWB16_GSU0_GSUC0_GSUWGMRR0_K1_LBSPPA1024_LBSPPB1024_LPA64_LPB64_MIWT4_4_PLR1_SU0_SUM0_SUS128_VWA4_VWB4_WGM6_WGMXCC1_WGMXCCGn1
    SolutionIndex: 89
    SolutionNameMin: Cijk_Ailk_Bjlk_B8F8NHS_BH_Bias_HAS_SAV_UserArgs_MT128x64x128_MI16x16x1_SN_LDSB1_CLR1_GRVWA16_GRVWB16_GSU0_GSUC0_GSUWGMRR0_K1_LBSPPA1024_LBSPPB512_LPA64_LPB32_MIWT4_2_PLR1_SU0_SUM0_SUS128_VWA4_VWB2_WGM1_WGMXCC1_WGMXCCGn1
    SolutionIndex: 90
    SolutionNameMin: Cijk_Ailk_Bjlk_B8F8NHS_BH_Bias_HAS_SAV_UserArgs_MT128x64x128_MI16x16x1_SN_LDSB1_CLR1_GRVWA16_GRVWB16_GSU0_GSUC0_GSUWGMRR0_K1_LBSPPA1024_LBSPPB512_LPA64_LPB32_MIWT4_2_PLR1_SU0_SUM0_SUS128_VWA4_VWB2_WGM4_WGMXCC1_WGMXCCGn1
    SolutionIndex: 91
    SolutionNameMin: Cijk_Ailk_Bjlk_B8F8NHS_BH_Bias_HAS_SAV_UserArgs_MT128x64x128_MI16x16x1_SN_LDSB1_CLR1_GRVWA16_GRVWB16_GSU0_GSUC0_GSUWGMRR0_K1_LBSPPA1024_LBSPPB512_LPA64_LPB32_MIWT4_2_PLR1_SU0_SUM0_SUS128_VWA4_VWB2_WGM6_WGMXCC1_WGMXCCGn1
    SolutionIndex: 92
    SolutionNameMin: Cijk_Ailk_Bjlk_B8F8NHS_BH_Bias_HAS_SAV_UserArgs_MT128x64x128_MI16x16x1_SN_LDSB1_CLR1_GRVWA16_GRVWB16_GSU0_GSUC0_GSUWGMRR0_K1_LBSPPA1024_LBSPPB512_LPA64_LPB32_MIWT4_2_PLR1_SU0_SUM0_SUS128_VWA4_VWB2_WGM8_WGMXCC1_WGMXCCGn1
    SolutionIndex: 93
    SolutionNameMin: Cijk_Ailk_Bjlk_B8F8NHS_BH_Bias_HAS_SAV_UserArgs_MT64x64x128_MI16x16x1_SN_LDSB1_CLR1_GRVWA4_GRVWB4_GSU0_GSUC0_GSUWGMRR0_K1_LBSPPA512_LBSPPB512_LPA32_LPB32_MIWT2_2_PLR1_SU0_SUM0_SUS128_VWA2_VWB2_WGM1_WGMXCC1_WGMXCCGn1
    SolutionIndex: 94
    SolutionNameMin: Cijk_Ailk_Bjlk_B8F8NHS_BH_Bias_HAS_SAV_UserArgs_MT64x64x128_MI16x16x1_SN_LDSB1_CLR1_GRVWA16_GRVWB8_GSU0_GSUC0_GSUWGMRR0_K1_LBSPPA512_LBSPPB512_LPA32_LPB32_MIWT2_2_PLR1_SU0_SUM0_SUS128_VWA2_VWB2_WGM1_WGMXCC1_WGMXCCGn1
    SolutionIndex: 95
    SolutionNameMin: Cijk_Ailk_Bjlk_B8F8NHS_BH_Bias_HAS_SAV_UserArgs_MT64x64x128_MI16x16x1_SN_LDSB1_CLR1_GRVWA8_GRVWB16_GSU0_GSUC0_GSUWGMRR0_K1_LBSPPA512_LBSPPB512_LPA32_LPB32_MIWT2_2_PLR1_SU0_SUM0_SUS128_VWA2_VWB2_WGM1_WGMXCC1_WGMXCCGn1
    SolutionIndex: 96
    SolutionNameMin: Cijk_Ailk_Bjlk_B8F8NHS_BH_Bias_HAS_SAV_UserArgs_MT64x64x128_MI16x16x1_SN_LDSB1_CLR1_GRVWA16_GRVWB16_GSU0_GSUC0_GSUWGMRR0_K1_LBSPPA512_LBSPPB512_LPA32_LPB32_MIWT2_2_PLR1_SU0_SUM0_SUS128_VWA2_VWB2_WGM1_WGMXCC1_WGMXCCGn1
    SolutionIndex: 97
    SolutionNameMin: Cijk_Ailk_Bjlk_B8F8NHS_BH_Bias_HAS_SAV_UserArgs_MT64x64x128_MI16x16x1_SN_LDSB1_CLR1_GRVWA4_GRVWB16_GSU0_GSUC0_GSUWGMRR0_K1_LBSPPA512_LBSPPB512_LPA32_LPB32_MIWT2_2_PLR1_SU0_SUM0_SUS128_VWA2_VWB2_WGM4_WGMXCC1_WGMXCCGn1
    SolutionIndex: 98
    SolutionNameMin: Cijk_Ailk_Bjlk_B8F8NHS_BH_Bias_HAS_SAV_UserArgs_MT64x64x128_MI16x16x1_SN_LDSB1_CLR1_GRVWA4_GRVWB16_GSU0_GSUC0_GSUWGMRR0_K1_LBSPPA512_LBSPPB512_LPA32_LPB32_MIWT2_2_PLR1_SU0_SUM0_SUS128_VWA2_VWB2_WGM6_WGMXCC1_WGMXCCGn1
    SolutionIndex: 99
    SolutionNameMin: Cijk_Ailk_Bjlk_B8F8NHS_BH_Bias_HAS_SAV_UserArgs_MT64x64x128_MI16x16x1_SN_LDSB1_CLR1_GRVWA8_GRVWB16_GSU0_GSUC0_GSUWGMRR0_K1_LBSPPA512_LBSPPB512_LPA32_LPB32_MIWT2_2_PLR1_SU0_SUM0_SUS128_VWA2_VWB2_WGM6_WGMXCC1_WGMXCCGn1
    SolutionIndex: 100
    SolutionNameMin: Cijk_Ailk_Bjlk_B8F8NHS_BH_Bias_HAS_SAV_UserArgs_MT64x64x128_MI16x16x1_SN_LDSB1_CLR1_GRVWA16_GRVWB16_GSU0_GSUC0_GSUWGMRR0_K1_LBSPPA512_LBSPPB512_LPA32_LPB32_MIWT2_2_PLR1_SU0_SUM0_SUS128_VWA2_VWB2_WGM6_WGMXCC1_WGMXCCGn1
    SolutionIndex: 101
    SolutionNameMin: Cijk_Ailk_Bjlk_B8F8NHS_BH_Bias_HAS_SAV_UserArgs_MT64x64x128_MI16x16x1_SN_LDSB1_CLR1_GRVWA8_GRVWB16_GSU0_GSUC0_GSUWGMRR0_K1_LBSPPA512_LBSPPB512_LPA32_LPB32_MIWT2_2_PLR1_SU0_SUM0_SUS128_VWA2_VWB2_WGM8_WGMXCC1_WGMXCCGn1
    SolutionIndex: 102
    SolutionNameMin: Cijk_Ailk_Bjlk_B8F8NHS_BH_Bias_HAS_SAV_UserArgs_MT64x64x128_MI16x16x1_SN_LDSB1_CLR1_GRVWA16_GRVWB16_GSU0_GSUC0_GSUWGMRR0_K1_LBSPPA512_LBSPPB512_LPA32_LPB32_MIWT2_2_PLR1_SU0_SUM0_SUS128_VWA2_VWB2_WGM8_WGMXCC1_WGMXCCGn1
    SolutionIndex: 103
    SolutionNameMin: Cijk_Ailk_Bjlk_B8F8NHS_BH_Bias_HAS_SAV_UserArgs_MT32x64x128_MI16x16x1_SN_LDSB0_CLR1_GRVWA4_GRVWB16_GSU0_GSUC0_GSUWGMRR0_K1_LBSPPA256_LBSPPB512_LPA16_LPB32_MIWT1_2_PLR1_SU0_SUM0_SUS128_VWA1_VWB2_WGM1_WGMXCC1_WGMXCCGn1
    SolutionIndex: 104
    SolutionNameMin: Cijk_Ailk_Bjlk_B8F8NHS_BH_Bias_HAS_SAV_UserArgs_MT32x64x128_MI16x16x1_SN_LDSB0_CLR1_GRVWA16_GRVWB16_GSU0_GSUC0_GSUWGMRR0_K1_LBSPPA256_LBSPPB512_LPA16_LPB32_MIWT1_2_PLR1_SU0_SUM0_SUS128_VWA1_VWB2_WGM6_WGMXCC1_WGMXCCGn1
    SolutionIndex: 105
    SolutionNameMin: Cijk_Ailk_Bjlk_B8F8NHS_BH_Bias_HAS_SAV_UserArgs_MT32x64x128_MI16x16x1_SN_LDSB0_CLR1_GRVWA16_GRVWB16_GSU0_GSUC0_GSUWGMRR0_K1_LBSPPA256_LBSPPB512_LPA16_LPB32_MIWT1_2_PLR1_SU0_SUM0_SUS128_VWA1_VWB2_WGM8_WGMXCC1_WGMXCCGn1
    SolutionIndex: 106
    SolutionNameMin: Cijk_Ailk_Bjlk_B8F8NHS_BH_Bias_HAS_SAV_UserArgs_MT64x32x128_MI16x16x1_SN_LDSB0_CLR1_GRVWA4_GRVWB4_GSU0_GSUC0_GSUWGMRR0_K1_LBSPPA512_LBSPPB256_LPA32_LPB16_MIWT2_1_PLR1_SU0_SUM0_SUS128_VWA2_VWB1_WGM1_WGMXCC1_WGMXCCGn1
    SolutionIndex: 107
    SolutionNameMin: Cijk_Ailk_Bjlk_B8F8NHS_BH_Bias_HAS_SAV_UserArgs_MT64x32x128_MI16x16x1_SN_LDSB0_CLR1_GRVWA4_GRVWB8_GSU0_GSUC0_GSUWGMRR0_K1_LBSPPA512_LBSPPB256_LPA32_LPB16_MIWT2_1_PLR1_SU0_SUM0_SUS128_VWA2_VWB1_WGM1_WGMXCC1_WGMXCCGn1
    SolutionIndex: 108
    SolutionNameMin: Cijk_Ailk_Bjlk_B8F8NHS_BH_Bias_HAS_SAV_UserArgs_MT64x32x128_MI16x16x1_SN_LDSB0_CLR1_GRVWA8_GRVWB8_GSU0_GSUC0_GSUWGMRR0_K1_LBSPPA512_LBSPPB256_LPA32_LPB16_MIWT2_1_PLR1_SU0_SUM0_SUS128_VWA2_VWB1_WGM1_WGMXCC1_WGMXCCGn1
    SolutionIndex: 109
    SolutionNameMin: Cijk_Ailk_Bjlk_B8F8NHS_BH_Bias_HAS_SAV_UserArgs_MT64x32x128_MI16x16x1_SN_LDSB0_CLR1_GRVWA8_GRVWB16_GSU0_GSUC0_GSUWGMRR0_K1_LBSPPA512_LBSPPB256_LPA32_LPB16_MIWT2_1_PLR1_SU0_SUM0_SUS128_VWA2_VWB1_WGM1_WGMXCC1_WGMXCCGn1
    SolutionIndex: 110
    SolutionNameMin: Cijk_Ailk_Bjlk_B8F8NHS_BH_Bias_HAS_SAV_UserArgs_MT64x32x128_MI16x16x1_SN_LDSB0_CLR1_GRVWA16_GRVWB16_GSU0_GSUC0_GSUWGMRR0_K1_LBSPPA512_LBSPPB256_LPA32_LPB16_MIWT2_1_PLR1_SU0_SUM0_SUS128_VWA2_VWB1_WGM1_WGMXCC1_WGMXCCGn1
    SolutionIndex: 111
    SolutionNameMin: Cijk_Ailk_Bjlk_B8F8NHS_BH_Bias_HAS_SAV_UserArgs_MT64x32x128_MI16x16x1_SN_LDSB0_CLR1_GRVWA8_GRVWB16_GSU0_GSUC0_GSUWGMRR0_K1_LBSPPA512_LBSPPB256_LPA32_LPB16_MIWT2_1_PLR1_SU0_SUM0_SUS128_VWA2_VWB1_WGM8_WGMXCC1_WGMXCCGn1
    SolutionIndex: 112
    SolutionNameMin: Cijk_Ailk_Bjlk_B8F8NHS_BH_Bias_HAS_SAV_UserArgs_MT32x32x128_MI16x16x1_SN_LDSB0_CLR1_GRVWA4_GRVWB4_GSU0_GSUC0_GSUWGMRR0_K1_LBSPPA256_LBSPPB256_LPA16_LPB16_MIWT1_1_PLR1_SU0_SUM0_SUS128_VWA1_VWB1_WGM1_WGMXCC1_WGMXCCGn1
    SolutionIndex: 113
    SolutionNameMin: Cijk_Ailk_Bjlk_B8F8NHS_BH_Bias_HAS_SAV_UserArgs_MT32x32x128_MI16x16x1_SN_LDSB0_CLR1_GRVWA8_GRVWB4_GSU0_GSUC0_GSUWGMRR0_K1_LBSPPA256_LBSPPB256_LPA16_LPB16_MIWT1_1_PLR1_SU0_SUM0_SUS128_VWA1_VWB1_WGM1_WGMXCC1_WGMXCCGn1
    SolutionIndex: 114
    SolutionNameMin: Cijk_Ailk_Bjlk_B8F8NHS_BH_Bias_HAS_SAV_UserArgs_MT32x32x128_MI16x16x1_SN_LDSB0_CLR1_GRVWA16_GRVWB4_GSU0_GSUC0_GSUWGMRR0_K1_LBSPPA256_LBSPPB256_LPA16_LPB16_MIWT1_1_PLR1_SU0_SUM0_SUS128_VWA1_VWB1_WGM1_WGMXCC1_WGMXCCGn1
    SolutionIndex: 115
    SolutionNameMin: Cijk_Ailk_Bjlk_B8F8NHS_BH_Bias_HAS_SAV_UserArgs_MT32x32x128_MI16x16x1_SN_LDSB0_CLR1_GRVWA4_GRVWB8_GSU0_GSUC0_GSUWGMRR0_K1_LBSPPA256_LBSPPB256_LPA16_LPB16_MIWT1_1_PLR1_SU0_SUM0_SUS128_VWA1_VWB1_WGM1_WGMXCC1_WGMXCCGn1
    SolutionIndex: 116
    SolutionNameMin: Cijk_Ailk_Bjlk_B8F8NHS_BH_Bias_HAS_SAV_UserArgs_MT32x32x128_MI16x16x1_SN_LDSB0_CLR1_GRVWA8_GRVWB8_GSU0_GSUC0_GSUWGMRR0_K1_LBSPPA256_LBSPPB256_LPA16_LPB16_MIWT1_1_PLR1_SU0_SUM0_SUS128_VWA1_VWB1_WGM1_WGMXCC1_WGMXCCGn1
    SolutionIndex: 117
    SolutionNameMin: Cijk_Ailk_Bjlk_B8F8NHS_BH_Bias_HAS_SAV_UserArgs_MT32x32x128_MI16x16x1_SN_LDSB0_CLR1_GRVWA4_GRVWB16_GSU0_GSUC0_GSUWGMRR0_K1_LBSPPA256_LBSPPB256_LPA16_LPB16_MIWT1_1_PLR1_SU0_SUM0_SUS128_VWA1_VWB1_WGM1_WGMXCC1_WGMXCCGn1
    SolutionIndex: 118
    SolutionNameMin: Cijk_Ailk_Bjlk_B8F8NHS_BH_Bias_HAS_SAV_UserArgs_MT32x32x128_MI16x16x1_SN_LDSB0_CLR1_GRVWA8_GRVWB16_GSU0_GSUC0_GSUWGMRR0_K1_LBSPPA256_LBSPPB256_LPA16_LPB16_MIWT1_1_PLR1_SU0_SUM0_SUS128_VWA1_VWB1_WGM1_WGMXCC1_WGMXCCGn1
    SolutionIndex: 119
    SolutionNameMin: Cijk_Ailk_Bjlk_B8F8NHS_BH_Bias_HAS_SAV_UserArgs_MT32x32x128_MI16x16x1_SN_LDSB0_CLR1_GRVWA4_GRVWB16_GSU0_GSUC0_GSUWGMRR0_K1_LBSPPA256_LBSPPB256_LPA16_LPB16_MIWT1_1_PLR1_SU0_SUM0_SUS128_VWA1_VWB1_WGM6_WGMXCC1_WGMXCCGn1
    SolutionIndex: 120
    SolutionNameMin: Cijk_Ailk_Bjlk_B8F8NHS_BH_Bias_HAS_SAV_UserArgs_MT128x64x256_MI16x16x1_SN_LDSB1_CLR1_GRVWA16_GRVWB16_GSU0_GSUC0_GSUWGMRR0_K1_LBSPPA1024_LBSPPB512_LPA64_LPB32_MIWT4_2_PLR1_SU0_SUM0_SUS256_VWA4_VWB2_WGM1_WGMXCC1_WGMXCCGn1
    SolutionIndex: 121
    SolutionNameMin: Cijk_Ailk_Bjlk_B8F8NHS_BH_Bias_HAS_SAV_UserArgs_MT128x64x256_MI16x16x1_SN_LDSB1_CLR1_GRVWA16_GRVWB16_GSU0_GSUC0_GSUWGMRR0_K1_LBSPPA1024_LBSPPB512_LPA64_LPB32_MIWT4_2_PLR1_SU0_SUM0_SUS256_VWA4_VWB2_WGM6_WGMXCC1_WGMXCCGn1
    SolutionIndex: 122
    SolutionNameMin: Cijk_Ailk_Bjlk_B8F8NHS_BH_Bias_HAS_SAV_UserArgs_MT64x64x256_MI16x16x1_SN_LDSB1_CLR1_GRVWA4_GRVWB16_GSU0_GSUC0_GSUWGMRR0_K1_LBSPPA512_LBSPPB512_LPA32_LPB32_MIWT2_2_PLR1_SU0_SUM0_SUS256_VWA2_VWB2_WGM1_WGMXCC1_WGMXCCGn1
    SolutionIndex: 123
    SolutionNameMin: Cijk_Ailk_Bjlk_B8F8NHS_BH_Bias_HAS_SAV_UserArgs_MT64x64x256_MI16x16x1_SN_LDSB1_CLR1_GRVWA16_GRVWB16_GSU0_GSUC0_GSUWGMRR0_K1_LBSPPA512_LBSPPB512_LPA32_LPB32_MIWT2_2_PLR1_SU0_SUM0_SUS256_VWA2_VWB2_WGM1_WGMXCC1_WGMXCCGn1
    SolutionIndex: 124
    SolutionNameMin: Cijk_Ailk_Bjlk_B8F8NHS_BH_Bias_HAS_SAV_UserArgs_MT64x64x256_MI16x16x1_SN_LDSB1_CLR1_GRVWA16_GRVWB16_GSU0_GSUC0_GSUWGMRR0_K1_LBSPPA512_LBSPPB512_LPA32_LPB32_MIWT2_2_PLR1_SU0_SUM0_SUS256_VWA2_VWB2_WGM4_WGMXCC1_WGMXCCGn1
    SolutionIndex: 125
    SolutionNameMin: Cijk_Ailk_Bjlk_B8F8NHS_BH_Bias_HAS_SAV_UserArgs_MT64x32x256_MI16x16x1_SN_LDSB1_CLR1_GRVWA16_GRVWB16_GSU0_GSUC0_GSUWGMRR0_K1_LBSPPA512_LBSPPB256_LPA32_LPB16_MIWT2_1_PLR1_SU0_SUM0_SUS256_VWA2_VWB1_WGM1_WGMXCC1_WGMXCCGn1
    SolutionIndex: 126
    SolutionNameMin: Cijk_Ailk_Bjlk_B8F8NHS_BH_Bias_HAS_SAV_UserArgs_MT64x32x256_MI16x16x1_SN_LDSB1_CLR1_GRVWA16_GRVWB16_GSU0_GSUC0_GSUWGMRR0_K1_LBSPPA512_LBSPPB256_LPA32_LPB16_MIWT2_1_PLR1_SU0_SUM0_SUS256_VWA2_VWB1_WGM4_WGMXCC1_WGMXCCGn1
    SolutionIndex: 127
    SolutionNameMin: Cijk_Ailk_Bjlk_B8F8NHS_BH_Bias_HAS_SAV_UserArgs_MT64x32x256_MI16x16x1_SN_LDSB1_CLR1_GRVWA16_GRVWB16_GSU0_GSUC0_GSUWGMRR0_K1_LBSPPA512_LBSPPB256_LPA32_LPB16_MIWT2_1_PLR1_SU0_SUM0_SUS256_VWA2_VWB1_WGM6_WGMXCC1_WGMXCCGn1
    SolutionIndex: 128
    SolutionNameMin: Cijk_Ailk_Bjlk_B8F8NHS_BH_Bias_HAS_SAV_UserArgs_MT32x32x256_MI16x16x1_SN_LDSB1_CLR1_GRVWA16_GRVWB16_GSU0_GSUC0_GSUWGMRR0_K1_LBSPPA256_LBSPPB256_LPA16_LPB16_MIWT1_1_PLR1_SU0_SUM0_SUS256_VWA1_VWB1_WGM1_WGMXCC1_WGMXCCGn1
    SolutionIndex: 129
    SolutionNameMin: Cijk_Ailk_Bjlk_B8F8NHS_BH_Bias_HAS_SAV_UserArgs_MT32x32x256_MI16x16x1_SN_LDSB1_CLR1_GRVWA16_GRVWB16_GSU0_GSUC0_GSUWGMRR0_K1_LBSPPA256_LBSPPB256_LPA16_LPB16_MIWT1_1_PLR1_SU0_SUM0_SUS256_VWA1_VWB1_WGM4_WGMXCC1_WGMXCCGn1
    SolutionIndex: 130
    SolutionNameMin: Cijk_Ailk_Bjlk_B8F8NHS_BH_Bias_HAS_SAV_UserArgs_MT32x32x256_MI16x16x1_SN_LDSB1_CLR1_GRVWA16_GRVWB16_GSU0_GSUC0_GSUWGMRR0_K1_LBSPPA256_LBSPPB256_LPA16_LPB16_MIWT1_1_PLR1_SU0_SUM0_SUS256_VWA1_VWB1_WGM6_WGMXCC1_WGMXCCGn1
    SolutionIndex: 131
    SolutionNameMin: Cijk_Ailk_Bjlk_B8F8NHS_BH_Bias_HAS_SAV_UserArgs_MT32x32x256_MI16x16x1_SN_LDSB1_CLR1_GRVWA8_GRVWB16_GSU0_GSUC0_GSUWGMRR0_K1_LBSPPA256_LBSPPB256_LPA16_LPB16_MIWT1_1_PLR1_SU0_SUM0_SUS256_VWA1_VWB1_WGM8_WGMXCC1_WGMXCCGn1
- - - [128, 128, 1, 128, 128, 128, 128, 128]
    - [68, 0.5]
  - - [128, 128, 1, 256, 128, 128, 128, 128]
    - [66, 0.9]
  - - [128, 128, 1, 512, 128, 128, 128, 128]
    - [116, 1.48]
  - - [128, 128, 1, 1024, 128, 128, 128, 128]
    - [116, 2.2]
  - - [128, 128, 1, 2048, 128, 128, 128, 128]
    - [118, 2.93]
  - - [128, 128, 1, 4096, 128, 128, 128, 128]
    - [118, 3.53]
  - - [128, 128, 1, 8192, 128, 128, 128, 128]
    - [128, 3.95]
  - - [128, 256, 1, 128, 128, 128, 128, 256]
    - [66, 1.05]
  - - [128, 256, 1, 256, 128, 128, 128, 256]
    - [69, 1.79]
  - - [128, 256, 1, 512, 128, 128, 128, 256]
    - [116, 3.02]
  - - [128, 256, 1, 1024, 128, 128, 128, 256]
    - [118, 4.43]
  - - [128, 256, 1, 2048, 128, 128, 128, 256]
    - [118, 5.9]
  - - [128, 256, 1, 4096, 128, 128, 128, 256]
    - [118, 7.08]
  - - [128, 256, 1, 8192, 128, 128, 128, 256]
    - [128, 7.89]
  - - [128, 512, 1, 128, 128, 128, 128, 512]
    - [113, 1.99]
  - - [128, 512, 1, 256, 128, 128, 128, 512]
    - [68, 3.57]
  - - [128, 512, 1, 512, 128, 128, 128, 512]
    - [112, 5.98]
  - - [128, 512, 1, 1024, 128, 128, 128, 512]
    - [116, 8.76]
  - - [128, 512, 1, 2048, 128, 128, 128, 512]
    - [118, 11.64]
  - - [128, 512, 1, 4096, 128, 128, 128, 512]
    - [118, 13.98]
  - - [128, 512, 1, 8192, 128, 128, 128, 512]
    - [131, 14.73]
  - - [128, 1024, 1, 128, 128, 128, 128, 1024]
    - [67, 4.01]
  - - [128, 1024, 1, 256, 128, 128, 128, 1024]
    - [66, 6.99]
  - - [128, 1024, 1, 512, 128, 128, 128, 1024]
    - [114, 11.45]
  - - [128, 1024, 1, 1024, 128, 128, 128, 1024]
    - [116, 17.0]
  - - [128, 1024, 1, 2048, 128, 128, 128, 1024]
    - [116, 22.63]
  - - [128, 1024, 1, 4096, 128, 128, 128, 1024]
    - [128, 26.24]
  - - [128, 1024, 1, 8192, 128, 128, 128, 1024]
    - [119, 27.76]
  - - [128, 2048, 1, 128, 128, 128, 128, 2048]
    - [63, 7.51]
  - - [128, 2048, 1, 256, 128, 128, 128, 2048]
    - [62, 13.01]
  - - [128, 2048, 1, 512, 128, 128, 128, 2048]
    - [106, 20.92]
  - - [128, 2048, 1, 1024, 128, 128, 128, 2048]
    - [103, 30.64]
  - - [128, 2048, 1, 2048, 128, 128, 128, 2048]
    - [125, 39.19]
  - - [128, 2048, 1, 4096, 128, 128, 128, 2048]
    - [127, 47.45]
  - - [128, 2048, 1, 8192, 128, 128, 128, 2048]
    - [127, 53.42]
  - - [128, 4096, 1, 128, 128, 128, 128, 4096]
    - [57, 13.7]
  - - [128, 4096, 1, 256, 128, 128, 128, 4096]
    - [57, 23.6]
  - - [128, 4096, 1, 512, 128, 128, 128, 4096]
    - [93, 37.45]
  - - [128, 4096, 1, 1024, 128, 128, 128, 4096]
    - [94, 53.83]
  - - [128, 4096, 1, 2048, 128, 128, 128, 4096]
    - [123, 67.0]
  - - [128, 4096, 1, 4096, 128, 128, 128, 4096]
    - [123, 82.26]
  - - [128, 4096, 1, 8192, 128, 128, 128, 4096]
    - [124, 91.02]
  - - [128, 8192, 1, 128, 128, 128, 128, 8192]
    - [55, 23.87]
  - - [128, 8192, 1, 256, 128, 128, 128, 8192]
    - [49, 40.45]
  - - [128, 8192, 1, 512, 128, 128, 128, 8192]
    - [51, 62.63]
  - - [128, 8192, 1, 1024, 128, 128, 128, 8192]
    - [53, 87.58]
  - - [128, 8192, 1, 2048, 128, 128, 128, 8192]
    - [89, 107.1]
  - - [128, 8192, 1, 4096, 128, 128, 128, 8192]
    - [120, 125.25]
  - - [128, 8192, 1, 8192, 128, 128, 128, 8192]
    - [92, 127.37]
  - - [256, 128, 1, 128, 256, 256, 256, 128]
    - [67, 1.02]
  - - [256, 128, 1, 256, 256, 256, 256, 128]
    - [66, 1.81]
  - - [256, 128, 1, 512, 256, 256, 256, 128]
    - [116, 3.01]
  - - [256, 128, 1, 1024, 256, 256, 256, 128]
    - [115, 4.44]
  - - [256, 128, 1, 2048, 256, 256, 256, 128]
    - [118, 5.95]
  - - [256, 128, 1, 4096, 256, 256, 256, 128]
    - [128, 7.05]
  - - [256, 128, 1, 8192, 256, 256, 256, 128]
    - [128, 7.9]
  - - [256, 256, 1, 128, 256, 256, 256, 256]
    - [66, 2.05]
  - - [256, 256, 1, 256, 256, 256, 256, 256]
    - [112, 3.6]
  - - [256, 256, 1, 512, 256, 256, 256, 256]
    - [116, 5.9]
  - - [256, 256, 1, 1024, 256, 256, 256, 256]
    - [118, 8.86]
  - - [256, 256, 1, 2048, 256, 256, 256, 256]
    - [118, 11.82]
  - - [256, 256, 1, 4096, 256, 256, 256, 256]
    - [118, 14.08]
  - - [256, 256, 1, 8192, 256, 256, 256, 256]
    - [128, 15.58]
  - - [256, 512, 1, 128, 256, 256, 256, 512]
    - [69, 3.99]
  - - [256, 512, 1, 256, 256, 256, 256, 512]
    - [69, 6.99]
  - - [256, 512, 1, 512, 256, 256, 256, 512]
    - [113, 11.54]
  - - [256, 512, 1, 1024, 256, 256, 256, 512]
    - [116, 17.29]
  - - [256, 512, 1, 2048, 256, 256, 256, 512]
    - [118, 22.71]
  - - [256, 512, 1, 4096, 256, 256, 256, 512]
    - [118, 27.44]
  - - [256, 512, 1, 8192, 256, 256, 256, 512]
    - [128, 30.24]
  - - [256, 1024, 1, 128, 256, 256, 256, 1024]
    - [64, 7.45]
  - - [256, 1024, 1, 256, 256, 256, 256, 1024]
    - [62, 13.2]
  - - [256, 1024, 1, 512, 256, 256, 256, 1024]
    - [108, 20.95]
  - - [256, 1024, 1, 1024, 256, 256, 256, 1024]
    - [110, 30.73]
  - - [256, 1024, 1, 2048, 256, 256, 256, 1024]
    - [125, 40.77]
  - - [256, 1024, 1, 4096, 256, 256, 256, 1024]
    - [125, 48.38]
  - - [256, 1024, 1, 8192, 256, 256, 256, 1024]
    - [127, 54.02]
  - - [256, 2048, 1, 128, 256, 256, 256, 2048]
    - [57, 13.71]
  - - [256, 2048, 1, 256, 256, 256, 256, 2048]
    - [58, 23.6]
  - - [256, 2048, 1, 512, 256, 256, 256, 2048]
    - [93, 37.49]
  - - [256, 2048, 1, 1024, 256, 256, 256, 2048]
    - [95, 53.94]
  - - [256, 2048, 1, 2048, 256, 256, 256, 2048]
    - [95, 67.68]
  - - [256, 2048, 1, 4096, 256, 256, 256, 2048]
    - [123, 79.07]
  - - [256, 2048, 1, 8192, 256, 256, 256, 2048]
    - [122, 87.23]
  - - [256, 4096, 1, 128, 256, 256, 256, 4096]
    - [48, 23.07]
  - - [256, 4096, 1, 256, 256, 256, 256, 4096]
    - [50, 39.9]
  - - [256, 4096, 1, 512, 256, 256, 256, 4096]
    - [49, 62.76]
  - - [256, 4096, 1, 1024, 256, 256, 256, 4096]
    - [53, 87.49]
  - - [256, 4096, 1, 2048, 256, 256, 256, 4096]
    - [89, 106.79]
  - - [256, 4096, 1, 4096, 256, 256, 256, 4096]
    - [89, 124.94]
  - - [256, 4096, 1, 8192, 256, 256, 256, 4096]
    - [121, 128.84]
  - - [256, 8192, 1, 128, 256, 256, 256, 8192]
    - [34, 35.69]
  - - [256, 8192, 1, 256, 256, 256, 256, 8192]
    - [41, 60.34]
  - - [256, 8192, 1, 512, 256, 256, 256, 8192]
    - [41, 93.78]
  - - [256, 8192, 1, 1024, 256, 256, 256, 8192]
    - [86, 130.5]
  - - [256, 8192, 1, 2048, 256, 256, 256, 8192]
    - [86, 156.99]
  - - [256, 8192, 1, 4096, 256, 256, 256, 8192]
    - [86, 176.08]
  - - [256, 8192, 1, 8192, 256, 256, 256, 8192]
    - [86, 166.36]
  - - [512, 128, 1, 128, 512, 512, 512, 128]
    - [70, 1.9]
  - - [512, 128, 1, 256, 512, 512, 512, 128]
    - [69, 3.54]
  - - [512, 128, 1, 512, 512, 512, 512, 128]
    - [112, 5.78]
  - - [512, 128, 1, 1024, 512, 512, 512, 128]
    - [118, 8.8]
  - - [512, 128, 1, 2048, 512, 512, 512, 128]
    - [118, 11.76]
  - - [512, 128, 1, 4096, 512, 512, 512, 128]
    - [118, 14.05]
  - - [512, 128, 1, 8192, 512, 512, 512, 128]
    - [130, 14.48]
  - - [512, 256, 1, 128, 512, 512, 512, 256]
    - [66, 3.89]
  - - [512, 256, 1, 256, 512, 512, 512, 256]
    - [66, 7.05]
  - - [512, 256, 1, 512, 512, 512, 512, 256]
    - [115, 11.49]
  - - [512, 256, 1, 1024, 512, 512, 512, 256]
    - [115, 17.05]
  - - [512, 256, 1, 2048, 512, 512, 512, 256]
    - [118, 22.96]
  - - [512, 256, 1, 4096, 512, 512, 512, 256]
    - [118, 27.45]
  - - [512, 256, 1, 8192, 512, 512, 512, 256]
    - [129, 28.15]
  - - [512, 512, 1, 128, 512, 512, 512, 512]
    - [65, 7.45]
  - - [512, 512, 1, 256, 512, 512, 512, 512]
    - [64, 12.83]
  - - [512, 512, 1, 512, 512, 512, 512, 512]
    - [109, 21.03]
  - - [512, 512, 1, 1024, 512, 512, 512, 512]
    - [107, 30.87]
  - - [512, 512, 1, 2048, 512, 512, 512, 512]
    - [125, 40.43]
  - - [512, 512, 1, 4096, 512, 512, 512, 512]
    - [125, 47.28]
  - - [512, 512, 1, 8192, 512, 512, 512, 512]
    - [110, 50.32]
  - - [512, 1024, 1, 128, 512, 512, 512, 1024]
    - [57, 13.93]
  - - [512, 1024, 1, 256, 512, 512, 512, 1024]
    - [57, 23.81]
  - - [512, 1024, 1, 512, 512, 512, 512, 1024]
    - [95, 37.32]
  - - [512, 1024, 1, 1024, 512, 512, 512, 1024]
    - [96, 53.57]
  - - [512, 1024, 1, 2048, 512, 512, 512, 1024]
    - [95, 69.19]
  - - [512, 1024, 1, 4096, 512, 512, 512, 1024]
    - [96, 76.25]
  - - [512, 1024, 1, 8192, 512, 512, 512, 1024]
    - [100, 81.13]
  - - [512, 2048, 1, 128, 512, 512, 512, 2048]
    - [55, 23.24]
  - - [512, 2048, 1, 256, 512, 512, 512, 2048]
    - [55, 40.44]
  - - [512, 2048, 1, 512, 512, 512, 512, 2048]
    - [53, 62.35]
  - - [512, 2048, 1, 1024, 512, 512, 512, 2048]
    - [53, 86.97]
  - - [512, 2048, 1, 2048, 512, 512, 512, 2048]
    - [89, 107.66]
  - - [512, 2048, 1, 4096, 512, 512, 512, 2048]
    - [91, 123.29]
  - - [512, 2048, 1, 8192, 512, 512, 512, 2048]
    - [89, 127.32]
  - - [512, 4096, 1, 128, 512, 512, 512, 4096]
    - [33, 36.8]
  - - [512, 4096, 1, 256, 512, 512, 512, 4096]
    - [35, 61.37]
  - - [512, 4096, 1, 512, 512, 512, 512, 4096]
    - [41, 94.36]
  - - [512, 4096, 1, 1024, 512, 512, 512, 4096]
    - [86, 130.38]
  - - [512, 4096, 1, 2048, 512, 512, 512, 4096]
    - [40, 156.9]
  - - [512, 4096, 1, 4096, 512, 512, 512, 4096]
    - [43, 173.82]
  - - [512, 4096, 1, 8192, 512, 512, 512, 4096]
    - [39, 162.26]
  - - [512, 8192, 1, 128, 512, 512, 512, 8192]
    - [16, 53.2]
  - - [512, 8192, 1, 256, 512, 512, 512, 8192]
    - [26, 90.63]
  - - [512, 8192, 1, 512, 512, 512, 512, 8192]
    - [26, 138.16]
  - - [512, 8192, 1, 1024, 512, 512, 512, 8192]
    - [26, 186.2]
  - - [512, 8192, 1, 2048, 512, 512, 512, 8192]
    - [13, 219.68]
  - - [512, 8192, 1, 4096, 512, 512, 512, 8192]
    - [25, 225.0]
  - - [512, 8192, 1, 8192, 512, 512, 512, 8192]
    - [77, 209.67]
  - - [1024, 128, 1, 128, 1024, 1024, 1024, 128]
    - [66, 4.02]
  - - [1024, 128, 1, 256, 1024, 1024, 1024, 128]
    - [66, 7.11]
  - - [1024, 128, 1, 512, 1024, 1024, 1024, 128]
    - [113, 11.45]
  - - [1024, 128, 1, 1024, 1024, 1024, 1024, 128]
    - [117, 17.18]
  - - [1024, 128, 1, 2048, 1024, 1024, 1024, 128]
    - [118, 23.0]
  - - [1024, 128, 1, 4096, 1024, 1024, 1024, 128]
    - [130, 25.9]
  - - [1024, 128, 1, 8192, 1024, 1024, 1024, 128]
    - [130, 26.37]
  - - [1024, 256, 1, 128, 1024, 1024, 1024, 256]
    - [62, 7.53]
  - - [1024, 256, 1, 256, 1024, 1024, 1024, 256]
    - [107, 12.83]
  - - [1024, 256, 1, 512, 1024, 1024, 1024, 256]
    - [108, 21.01]
  - - [1024, 256, 1, 1024, 1024, 1024, 1024, 256]
    - [109, 30.62]
  - - [1024, 256, 1, 2048, 1024, 1024, 1024, 256]
    - [125, 40.7]
  - - [1024, 256, 1, 4096, 1024, 1024, 1024, 256]
    - [111, 46.07]
  - - [1024, 256, 1, 8192, 1024, 1024, 1024, 256]
    - [126, 49.33]
  - - [1024, 512, 1, 128, 1024, 1024, 1024, 512]
    - [57, 13.56]
  - - [1024, 512, 1, 256, 1024, 1024, 1024, 512]
    - [57, 23.32]
  - - [1024, 512, 1, 512, 1024, 1024, 1024, 512]
    - [57, 37.1]
  - - [1024, 512, 1, 1024, 1024, 1024, 1024, 512]
    - [95, 53.22]
  - - [1024, 512, 1, 2048, 1024, 1024, 1024, 512]
    - [95, 68.83]
  - - [1024, 512, 1, 4096, 1024, 1024, 1024, 512]
    - [100, 75.74]
  - - [1024, 512, 1, 8192, 1024, 1024, 1024, 512]
    - [98, 81.92]
  - - [1024, 1024, 1, 128, 1024, 1024, 1024, 1024]
    - [49, 23.42]
  - - [1024, 1024, 1, 256, 1024, 1024, 1024, 1024]
    - [52, 39.89]
  - - [1024, 1024, 1, 512, 1024, 1024, 1024, 1024]
    - [49, 62.81]
  - - [1024, 1024, 1, 1024, 1024, 1024, 1024, 1024]
    - [53, 87.76]
  - - [1024, 1024, 1, 2048, 1024, 1024, 1024, 1024]
    - [89, 108.36]
  - - [1024, 1024, 1, 4096, 1024, 1024, 1024, 1024]
    - [90, 124.14]
  - - [1024, 1024, 1, 8192, 1024, 1024, 1024, 1024]
    - [90, 125.43]
  - - [1024, 2048, 1, 128, 1024, 1024, 1024, 2048]
    - [33, 36.99]
  - - [1024, 2048, 1, 256, 1024, 1024, 1024, 2048]
    - [33, 61.99]
  - - [1024, 2048, 1, 512, 1024, 1024, 1024, 2048]
    - [40, 94.0]
  - - [1024, 2048, 1, 1024, 1024, 1024, 1024, 2048]
    - [41, 128.9]
  - - [1024, 2048, 1, 2048, 1024, 1024, 1024, 2048]
    - [40, 157.11]
  - - [1024, 2048, 1, 4096, 1024, 1024, 1024, 2048]
    - [42, 174.77]
  - - [1024, 2048, 1, 8192, 1024, 1024, 1024, 2048]
    - [41, 161.46]
  - - [1024, 4096, 1, 128, 1024, 1024, 1024, 4096]
    - [29, 56.01]
  - - [1024, 4096, 1, 256, 1024, 1024, 1024, 4096]
    - [31, 93.76]
  - - [1024, 4096, 1, 512, 1024, 1024, 1024, 4096]
    - [31, 138.51]
  - - [1024, 4096, 1, 1024, 1024, 1024, 1024, 4096]
    - [26, 187.11]
  - - [1024, 4096, 1, 2048, 1024, 1024, 1024, 4096]
    - [26, 226.35]
  - - [1024, 4096, 1, 4096, 1024, 1024, 1024, 4096]
    - [23, 227.99]
  - - [1024, 4096, 1, 8192, 1024, 1024, 1024, 4096]
    - [84, 210.76]
  - - [1024, 8192, 1, 128, 1024, 1024, 1024, 8192]
    - [20, 68.04]
  - - [1024, 8192, 1, 256, 1024, 1024, 1024, 8192]
    - [21, 113.18]
  - - [1024, 8192, 1, 512, 1024, 1024, 1024, 8192]
    - [8, 169.26]
  - - [1024, 8192, 1, 1024, 1024, 1024, 1024, 8192]
    - [5, 222.43]
  - - [1024, 8192, 1, 2048, 1024, 1024, 1024, 8192]
    - [8, 257.51]
  - - [1024, 8192, 1, 4096, 1024, 1024, 1024, 8192]
    - [75, 244.77]
  - - [1024, 8192, 1, 8192, 1024, 1024, 1024, 8192]
    - [73, 260.4]
  - - [2048, 128, 1, 128, 2048, 2048, 2048, 128]
    - [106, 7.45]
  - - [2048, 128, 1, 256, 2048, 2048, 2048, 128]
    - [107, 12.91]
  - - [2048, 128, 1, 512, 2048, 2048, 2048, 128]
    - [107, 20.96]
  - - [2048, 128, 1, 1024, 2048, 2048, 2048, 128]
    - [109, 30.67]
  - - [2048, 128, 1, 2048, 2048, 2048, 2048, 128]
    - [105, 37.93]
  - - [2048, 128, 1, 4096, 2048, 2048, 2048, 128]
    - [105, 45.23]
  - - [2048, 128, 1, 8192, 2048, 2048, 2048, 128]
    - [104, 50.56]
  - - [2048, 256, 1, 128, 2048, 2048, 2048, 256]
    - [60, 13.65]
  - - [2048, 256, 1, 256, 2048, 2048, 2048, 256]
    - [61, 23.42]
  - - [2048, 256, 1, 512, 2048, 2048, 2048, 256]
    - [98, 36.94]
  - - [2048, 256, 1, 1024, 2048, 2048, 2048, 256]
    - [99, 53.6]
  - - [2048, 256, 1, 2048, 2048, 2048, 2048, 256]
    - [101, 67.83]
  - - [2048, 256, 1, 4096, 2048, 2048, 2048, 256]
    - [97, 77.95]
  - - [2048, 256, 1, 8192, 2048, 2048, 2048, 256]
    - [102, 85.83]
  - - [2048, 512, 1, 128, 2048, 2048, 2048, 512]
    - [47, 23.42]
  - - [2048, 512, 1, 256, 2048, 2048, 2048, 512]
    - [48, 39.87]
  - - [2048, 512, 1, 512, 2048, 2048, 2048, 512]
    - [51, 62.13]
  - - [2048, 512, 1, 1024, 2048, 2048, 2048, 512]
    - [53, 87.6]
  - - [2048, 512, 1, 2048, 2048, 2048, 2048, 512]
    - [90, 107.08]
  - - [2048, 512, 1, 4096, 2048, 2048, 2048, 512]
    - [91, 124.34]
  - - [2048, 512, 1, 8192, 2048, 2048, 2048, 512]
    - [92, 128.24]
  - - [2048, 1024, 1, 128, 2048, 2048, 2048, 1024]
    - [33, 36.75]
  - - [2048, 1024, 1, 256, 2048, 2048, 2048, 1024]
    - [35, 61.54]
  - - [2048, 1024, 1, 512, 2048, 2048, 2048, 1024]
    - [41, 94.28]
  - - [2048, 1024, 1, 1024, 2048, 2048, 2048, 1024]
    - [86, 127.55]
  - - [2048, 1024, 1, 2048, 2048, 2048, 2048, 1024]
    - [46, 157.16]
  - - [2048, 1024, 1, 4096, 2048, 2048, 2048, 1024]
    - [46, 173.34]
  - - [2048, 1024, 1, 8192, 2048, 2048, 2048, 1024]
    - [44, 160.55]
  - - [2048, 2048, 1, 128, 2048, 2048, 2048, 2048]
    - [24, 53.27]
  - - [2048, 2048, 1, 256, 2048, 2048, 2048, 2048]
    - [26, 91.1]
  - - [2048, 2048, 1, 512, 2048, 2048, 2048, 2048]
    - [26, 137.47]
  - - [2048, 2048, 1, 1024, 2048, 2048, 2048, 2048]
    - [28, 185.39]
  - - [2048, 2048, 1, 2048, 2048, 2048, 2048, 2048]
    - [30, 219.46]
  - - [2048, 2048, 1, 4096, 2048, 2048, 2048, 2048]
    - [81, 225.6]
  - - [2048, 2048, 1, 8192, 2048, 2048, 2048, 2048]
    - [83, 213.09]
  - - [2048, 4096, 1, 128, 2048, 2048, 2048, 4096]
    - [7, 64.88]
  - - [2048, 4096, 1, 256, 2048, 2048, 2048, 4096]
    - [6, 108.43]
  - - [2048, 4096, 1, 512, 2048, 2048, 2048, 4096]
    - [6, 164.57]
  - - [2048, 4096, 1, 1024, 2048, 2048, 2048, 4096]
    - [5, 221.11]
  - - [2048, 4096, 1, 2048, 2048, 2048, 2048, 4096]
    - [5, 252.39]
  - - [2048, 4096, 1, 4096, 2048, 2048, 2048, 4096]
    - [5, 246.77]
  - - [2048, 4096, 1, 8192, 2048, 2048, 2048, 4096]
    - [72, 260.39]
  - - [2048, 8192, 1, 128, 2048, 2048, 2048, 8192]
    - [22, 70.49]
  - - [2048, 8192, 1, 256, 2048, 2048, 2048, 8192]
    - [0, 117.02]
  - - [2048, 8192, 1, 512, 2048, 2048, 2048, 8192]
    - [5, 175.64]
  - - [2048, 8192, 1, 1024, 2048, 2048, 2048, 8192]
    - [2, 217.68]
  - - [2048, 8192, 1, 2048, 2048, 2048, 2048, 8192]
    - [17, 226.61]
  - - [2048, 8192, 1, 4096, 2048, 2048, 2048, 8192]
    - [75, 273.41]
  - - [2048, 8192, 1, 8192, 2048, 2048, 2048, 8192]
    - [9, 322.25]
  - - [4096, 128, 1, 128, 4096, 4096, 4096, 128]
    - [56, 13.43]
  - - [4096, 128, 1, 256, 4096, 4096, 4096, 128]
    - [57, 23.65]
  - - [4096, 128, 1, 512, 4096, 4096, 4096, 128]
    - [59, 37.35]
  - - [4096, 128, 1, 1024, 4096, 4096, 4096, 128]
    - [95, 53.97]
  - - [4096, 128, 1, 2048, 4096, 4096, 4096, 128]
    - [100, 65.78]
  - - [4096, 128, 1, 4096, 4096, 4096, 4096, 128]
    - [102, 78.02]
  - - [4096, 128, 1, 8192, 4096, 4096, 4096, 128]
    - [100, 85.01]
  - - [4096, 256, 1, 128, 4096, 4096, 4096, 256]
    - [38, 23.59]
  - - [4096, 256, 1, 256, 4096, 4096, 4096, 256]
    - [54, 40.04]
  - - [4096, 256, 1, 512, 4096, 4096, 4096, 256]
    - [89, 62.05]
  - - [4096, 256, 1, 1024, 4096, 4096, 4096, 256]
    - [91, 86.14]
  - - [4096, 256, 1, 2048, 4096, 4096, 4096, 256]
    - [92, 107.58]
  - - [4096, 256, 1, 4096, 4096, 4096, 4096, 256]
    - [91, 124.45]
  - - [4096, 256, 1, 8192, 4096, 4096, 4096, 256]
    - [92, 130.43]
  - - [4096, 512, 1, 128, 4096, 4096, 4096, 512]
    - [33, 36.61]
  - - [4096, 512, 1, 256, 4096, 4096, 4096, 512]
    - [35, 60.93]
  - - [4096, 512, 1, 512, 4096, 4096, 4096, 512]
    - [87, 92.87]
  - - [4096, 512, 1, 1024, 4096, 4096, 4096, 512]
    - [45, 126.66]
  - - [4096, 512, 1, 2048, 4096, 4096, 4096, 512]
    - [43, 155.31]
  - - [4096, 512, 1, 4096, 4096, 4096, 4096, 512]
    - [44, 174.61]
  - - [4096, 512, 1, 8192, 4096, 4096, 4096, 512]
    - [43, 163.81]
  - - [4096, 1024, 1, 128, 4096, 4096, 4096, 1024]
    - [31, 55.18]
  - - [4096, 1024, 1, 256, 4096, 4096, 4096, 1024]
    - [31, 93.95]
  - - [4096, 1024, 1, 512, 4096, 4096, 4096, 1024]
    - [31, 141.12]
  - - [4096, 1024, 1, 1024, 4096, 4096, 4096, 1024]
    - [31, 188.13]
  - - [4096, 1024, 1, 2048, 4096, 4096, 4096, 1024]
    - [30, 222.84]
  - - [4096, 1024, 1, 4096, 4096, 4096, 4096, 1024]
    - [78, 226.28]
  - - [4096, 1024, 1, 8192, 4096, 4096, 4096, 1024]
    - [79, 212.1]
  - - [4096, 2048, 1, 128, 4096, 4096, 4096, 2048]
    - [5, 61.29]
  - - [4096, 2048, 1, 256, 4096, 4096, 4096, 2048]
    - [5, 102.9]
  - - [4096, 2048, 1, 512, 4096, 4096, 4096, 2048]
    - [5, 158.04]
  - - [4096, 2048, 1, 1024, 4096, 4096, 4096, 2048]
    - [9, 215.72]
  - - [4096, 2048, 1, 2048, 4096, 4096, 4096, 2048]
    - [9, 249.46]
  - - [4096, 2048, 1, 4096, 4096, 4096, 4096, 2048]
    - [9, 240.08]
  - - [4096, 2048, 1, 8192, 4096, 4096, 4096, 2048]
    - [79, 259.62]
  - - [4096, 4096, 1, 128, 4096, 4096, 4096, 4096]
    - [2, 67.4]
  - - [4096, 4096, 1, 256, 4096, 4096, 4096, 4096]
    - [0, 115.34]
  - - [4096, 4096, 1, 512, 4096, 4096, 4096, 4096]
    - [5, 170.77]
  - - [4096, 4096, 1, 1024, 4096, 4096, 4096, 4096]
    - [11, 209.29]
  - - [4096, 4096, 1, 2048, 4096, 4096, 4096, 4096]
    - [15, 225.54]
  - - [4096, 4096, 1, 4096, 4096, 4096, 4096, 4096]
    - [9, 273.23]
  - - [4096, 4096, 1, 8192, 4096, 4096, 4096, 4096]
    - [5, 324.02]
  - - [4096, 8192, 1, 128, 4096, 4096, 4096, 8192]
    - [20, 75.38]
  - - [4096, 8192, 1, 256, 4096, 4096, 4096, 8192]
    - [0, 121.08]
  - - [4096, 8192, 1, 512, 4096, 4096, 4096, 8192]
    - [13, 177.0]
  - - [4096, 8192, 1, 1024, 4096, 4096, 4096, 8192]
    - [85, 208.35]
  - - [4096, 8192, 1, 2048, 4096, 4096, 4096, 8192]
    - [4, 266.03]
  - - [4096, 8192, 1, 4096, 4096, 4096, 4096, 8192]
    - [3, 303.44]
  - - [4096, 8192, 1, 8192, 4096, 4096, 4096, 8192]
    - [71, 339.49]
  - - [8192, 128, 1, 128, 8192, 8192, 8192, 128]
    - [47, 23.42]
  - - [8192, 128, 1, 256, 8192, 8192, 8192, 128]
    - [51, 39.38]
  - - [8192, 128, 1, 512, 8192, 8192, 8192, 128]
    - [53, 61.9]
  - - [8192, 128, 1, 1024, 8192, 8192, 8192, 128]
    - [53, 86.48]
  - - [8192, 128, 1, 2048, 8192, 8192, 8192, 128]
    - [92, 106.72]
  - - [8192, 128, 1, 4096, 8192, 8192, 8192, 128]
    - [92, 124.12]
  - - [8192, 128, 1, 8192, 8192, 8192, 8192, 128]
    - [91, 125.07]
  - - [8192, 256, 1, 128, 8192, 8192, 8192, 256]
    - [36, 35.33]
  - - [8192, 256, 1, 256, 8192, 8192, 8192, 256]
    - [37, 59.48]
  - - [8192, 256, 1, 512, 8192, 8192, 8192, 256]
    - [46, 91.83]
  - - [8192, 256, 1, 1024, 8192, 8192, 8192, 256]
    - [88, 125.41]
  - - [8192, 256, 1, 2048, 8192, 8192, 8192, 256]
    - [43, 153.91]
  - - [8192, 256, 1, 4096, 8192, 8192, 8192, 256]
    - [45, 173.06]
  - - [8192, 256, 1, 8192, 8192, 8192, 8192, 256]
    - [46, 159.14]
  - - [8192, 512, 1, 128, 8192, 8192, 8192, 512]
    - [14, 50.47]
  - - [8192, 512, 1, 256, 8192, 8192, 8192, 512]
    - [14, 86.96]
  - - [8192, 512, 1, 512, 8192, 8192, 8192, 512]
    - [18, 130.83]
  - - [8192, 512, 1, 1024, 8192, 8192, 8192, 512]
    - [18, 177.99]
  - - [8192, 512, 1, 2048, 8192, 8192, 8192, 512]
    - [31, 216.83]
  - - [8192, 512, 1, 4096, 8192, 8192, 8192, 512]
    - [81, 228.2]
  - - [8192, 512, 1, 8192, 8192, 8192, 8192, 512]
    - [82, 210.88]
  - - [8192, 1024, 1, 128, 8192, 8192, 8192, 1024]
    - [5, 59.1]
  - - [8192, 1024, 1, 256, 8192, 8192, 8192, 1024]
    - [5, 100.12]
  - - [8192, 1024, 1, 512, 8192, 8192, 8192, 1024]
    - [32, 154.61]
  - - [8192, 1024, 1, 1024, 8192, 8192, 8192, 1024]
    - [2, 211.93]
  - - [8192, 1024, 1, 2048, 8192, 8192, 8192, 1024]
    - [12, 246.75]
  - - [8192, 1024, 1, 4096, 8192, 8192, 8192, 1024]
    - [12, 240.79]
  - - [8192, 1024, 1, 8192, 8192, 8192, 8192, 1024]
    - [13, 267.99]
  - - [8192, 2048, 1, 128, 8192, 8192, 8192, 2048]
    - [3, 65.32]
  - - [8192, 2048, 1, 256, 8192, 8192, 8192, 2048]
    - [0, 112.38]
  - - [8192, 2048, 1, 512, 8192, 8192, 8192, 2048]
    - [5, 167.13]
  - - [8192, 2048, 1, 1024, 8192, 8192, 8192, 2048]
    - [0, 206.47]
  - - [8192, 2048, 1, 2048, 8192, 8192, 8192, 2048]
    - [15, 221.15]
  - - [8192, 2048, 1, 4096, 8192, 8192, 8192, 2048]
    - [3, 278.52]
  - - [8192, 2048, 1, 8192, 8192, 8192, 8192, 2048]
    - [72, 328.97]
  - - [8192, 4096, 1, 128, 8192, 8192, 8192, 4096]
    - [3, 70.47]
  - - [8192, 4096, 1, 256, 8192, 8192, 8192, 4096]
    - [4, 112.45]
  - - [8192, 4096, 1, 512, 8192, 8192, 8192, 4096]
    - [27, 170.01]
  - - [8192, 4096, 1, 1024, 8192, 8192, 8192, 4096]
    - [80, 209.05]
  - - [8192, 4096, 1, 2048, 8192, 8192, 8192, 4096]
    - [1, 261.96]
  - - [8192, 4096, 1, 4096, 8192, 8192, 8192, 4096]
    - [75, 305.58]
  - - [8192, 4096, 1, 8192, 8192, 8192, 8192, 4096]
    - [76, 326.15]
  - - [8192, 8192, 1, 128, 8192, 8192, 8192, 8192]
    - [19, 69.11]
  - - [8192, 8192, 1, 256, 8192, 8192, 8192, 8192]
    - [24, 113.1]
  - - [8192, 8192, 1, 512, 8192, 8192, 8192, 8192]
    - [10, 173.31]
  - - [8192, 8192, 1, 1024, 8192, 8192, 8192, 8192]
    - [8, 233.0]
  - - [8192, 8192, 1, 2048, 8192, 8192, 8192, 8192]
    - [75, 296.91]
  - - [8192, 8192, 1, 4096, 8192, 8192, 8192, 8192]
    - [74, 335.26]
  - - [8192, 8192, 1, 8192, 8192, 8192, 8192, 8192]
    - [4, 350.54]
- null
- null
- ExperimentalStreamK
- GridBased
