projects/hipblaslt/library/src/amd_detail/rocblaslt/src/Tensile/Logic/asm_full/aquavanjaram/gfx942_228cu/StreamK/aquavanjaram942_Cijk_Alik_Bjlk_B8NHS_BH_Bias_HAS_SAV_UserArgs.yaml
- {MinimumRequiredVersion: 4.33.0}
- aquavanjaram942
- {Architecture: gfx942, CUCount: 228}
- [Device 0049, Device 0050]
    SolutionIndex: 0
    SolutionNameMin: Cijk_Alik_Bjlk_B8NHS_BH_Bias_HAS_SAV_UserArgs_MT256x256x64_MI16x16x1_SN_LDSB1_CLR1_GRVWA8_GRVWB8_GSU0_GSUC0_GSUWGMRR0_K1_LBSPPA512_LBSPPB2048_LPA8_LPB0_LRVW8_MIWT8_8_PLR1_SU0_SUM0_SUS64_VWA8_VWB8_WGM1_WGMXCC1_WGMXCCGn1
    SolutionIndex: 1
    SolutionNameMin: Cijk_Alik_Bjlk_B8NHS_BH_Bias_HAS_SAV_UserArgs_MT256x256x64_MI16x16x1_SN_LDSB1_CLR1_GRVWA8_GRVWB16_GSU0_GSUC0_GSUWGMRR0_K1_LBSPPA512_LBSPPB2048_LPA8_LPB0_LRVW8_MIWT8_8_PLR1_SU0_SUM0_SUS64_VWA8_VWB8_WGM1_WGMXCC1_WGMXCCGn1
    SolutionIndex: 2
    SolutionNameMin: Cijk_Alik_Bjlk_B8NHS_BH_Bias_HAS_SAV_UserArgs_MT256x256x64_MI16x16x1_SN_LDSB1_CLR1_GRVWA16_GRVWB16_GSU0_GSUC0_GSUWGMRR0_K1_LBSPPA512_LBSPPB2048_LPA16_LPB0_LRVW8_MIWT8_8_PLR1_SU0_SUM0_SUS64_VWA8_VWB8_WGM1_WGMXCC1_WGMXCCGn1
    SolutionIndex: 3
    SolutionNameMin: Cijk_Alik_Bjlk_B8NHS_BH_Bias_HAS_SAV_UserArgs_MT256x256x64_MI16x16x1_SN_LDSB1_CLR1_GRVWA8_GRVWB16_GSU0_GSUC0_GSUWGMRR0_K1_LBSPPA512_LBSPPB2048_LPA8_LPB0_LRVW8_MIWT8_8_PLR1_SU0_SUM0_SUS64_VWA8_VWB8_WGM4_WGMXCC1_WGMXCCGn1
    SolutionIndex: 4
    SolutionNameMin: Cijk_Alik_Bjlk_B8NHS_BH_Bias_HAS_SAV_UserArgs_MT256x256x64_MI16x16x1_SN_LDSB1_CLR1_GRVWA16_GRVWB16_GSU0_GSUC0_GSUWGMRR0_K1_LBSPPA512_LBSPPB2048_LPA16_LPB0_LRVW8_MIWT8_8_PLR1_SU0_SUM0_SUS64_VWA8_VWB8_WGM4_WGMXCC1_WGMXCCGn1
    SolutionIndex: 5
    SolutionNameMin: Cijk_Alik_Bjlk_B8NHS_BH_Bias_HAS_SAV_UserArgs_MT256x256x64_MI16x16x1_SN_LDSB1_CLR1_GRVWA8_GRVWB16_GSU0_GSUC0_GSUWGMRR0_K1_LBSPPA512_LBSPPB2048_LPA8_LPB0_LRVW8_MIWT8_8_PLR1_SU0_SUM0_SUS64_VWA8_VWB8_WGM6_WGMXCC1_WGMXCCGn1
    SolutionIndex: 6
    SolutionNameMin: Cijk_Alik_Bjlk_B8NHS_BH_Bias_HAS_SAV_UserArgs_MT256x256x64_MI16x16x1_SN_LDSB1_CLR1_GRVWA16_GRVWB16_GSU0_GSUC0_GSUWGMRR0_K1_LBSPPA512_LBSPPB2048_LPA16_LPB0_LRVW8_MIWT8_8_PLR1_SU0_SUM0_SUS64_VWA8_VWB8_WGM6_WGMXCC1_WGMXCCGn1
    SolutionIndex: 7
    SolutionNameMin: Cijk_Alik_Bjlk_B8NHS_BH_Bias_HAS_SAV_UserArgs_MT256x256x64_MI16x16x1_SN_LDSB1_CLR1_GRVWA16_GRVWB8_GSU0_GSUC0_GSUWGMRR0_K1_LBSPPA512_LBSPPB2048_LPA16_LPB0_LRVW8_MIWT8_8_PLR1_SU0_SUM0_SUS64_VWA8_VWB8_WGM8_WGMXCC1_WGMXCCGn1
    SolutionIndex: 8
    SolutionNameMin: Cijk_Alik_Bjlk_B8NHS_BH_Bias_HAS_SAV_UserArgs_MT256x256x64_MI16x16x1_SN_LDSB1_CLR1_GRVWA8_GRVWB16_GSU0_GSUC0_GSUWGMRR0_K1_LBSPPA512_LBSPPB2048_LPA8_LPB0_LRVW8_MIWT8_8_PLR1_SU0_SUM0_SUS64_VWA8_VWB8_WGM8_WGMXCC1_WGMXCCGn1
    SolutionIndex: 9
    SolutionNameMin: Cijk_Alik_Bjlk_B8NHS_BH_Bias_HAS_SAV_UserArgs_MT256x256x64_MI16x16x1_SN_LDSB1_CLR1_GRVWA16_GRVWB16_GSU0_GSUC0_GSUWGMRR0_K1_LBSPPA512_LBSPPB2048_LPA16_LPB0_LRVW8_MIWT8_8_PLR1_SU0_SUM0_SUS64_VWA8_VWB8_WGM8_WGMXCC1_WGMXCCGn1
    SolutionIndex: 10
    SolutionNameMin: Cijk_Alik_Bjlk_B8NHS_BH_Bias_HAS_SAV_UserArgs_MT128x256x64_MI16x16x1_SN_LDSB1_CLR1_GRVWA8_GRVWB16_GSU0_GSUC0_GSUWGMRR0_K1_LBSPPA256_LBSPPB2048_LPA8_LPB0_LRVW8_MIWT4_8_PLR1_SU0_SUM0_SUS64_VWA4_VWB8_WGM1_WGMXCC1_WGMXCCGn1
    SolutionIndex: 11
    SolutionNameMin: Cijk_Alik_Bjlk_B8NHS_BH_Bias_HAS_SAV_UserArgs_MT128x256x64_MI16x16x1_SN_LDSB1_CLR1_GRVWA16_GRVWB16_GSU0_GSUC0_GSUWGMRR0_K1_LBSPPA256_LBSPPB2048_LPA16_LPB0_LRVW8_MIWT4_8_PLR1_SU0_SUM0_SUS64_VWA4_VWB8_WGM1_WGMXCC1_WGMXCCGn1
    SolutionIndex: 12
    SolutionNameMin: Cijk_Alik_Bjlk_B8NHS_BH_Bias_HAS_SAV_UserArgs_MT128x256x64_MI16x16x1_SN_LDSB1_CLR1_GRVWA8_GRVWB16_GSU0_GSUC0_GSUWGMRR0_K1_LBSPPA256_LBSPPB2048_LPA8_LPB0_LRVW8_MIWT4_8_PLR1_SU0_SUM0_SUS64_VWA4_VWB8_WGM8_WGMXCC1_WGMXCCGn1
    SolutionIndex: 13
    SolutionNameMin: Cijk_Alik_Bjlk_B8NHS_BH_Bias_HAS_SAV_UserArgs_MT256x128x64_MI16x16x1_SN_LDSB1_CLR1_GRVWA8_GRVWB8_GSU0_GSUC0_GSUWGMRR0_K1_LBSPPA512_LBSPPB1024_LPA8_LPB64_LRVW8_MIWT8_4_PLR1_SU0_SUM0_SUS64_VWA8_VWB4_WGM1_WGMXCC1_WGMXCCGn1
    SolutionIndex: 14
    SolutionNameMin: Cijk_Alik_Bjlk_B8NHS_BH_Bias_HAS_SAV_UserArgs_MT256x128x64_MI16x16x1_SN_LDSB1_CLR1_GRVWA16_GRVWB8_GSU0_GSUC0_GSUWGMRR0_K1_LBSPPA512_LBSPPB1024_LPA16_LPB64_LRVW8_MIWT8_4_PLR1_SU0_SUM0_SUS64_VWA8_VWB4_WGM1_WGMXCC1_WGMXCCGn1
    SolutionIndex: 15
    SolutionNameMin: Cijk_Alik_Bjlk_B8NHS_BH_Bias_HAS_SAV_UserArgs_MT256x128x64_MI16x16x1_SN_LDSB1_CLR1_GRVWA8_GRVWB16_GSU0_GSUC0_GSUWGMRR0_K1_LBSPPA512_LBSPPB1024_LPA8_LPB64_LRVW8_MIWT8_4_PLR1_SU0_SUM0_SUS64_VWA8_VWB4_WGM1_WGMXCC1_WGMXCCGn1
    SolutionIndex: 16
    SolutionNameMin: Cijk_Alik_Bjlk_B8NHS_BH_Bias_HAS_SAV_UserArgs_MT256x128x64_MI16x16x1_SN_LDSB1_CLR1_GRVWA16_GRVWB16_GSU0_GSUC0_GSUWGMRR0_K1_LBSPPA512_LBSPPB1024_LPA16_LPB64_LRVW8_MIWT8_4_PLR1_SU0_SUM0_SUS64_VWA8_VWB4_WGM1_WGMXCC1_WGMXCCGn1
    SolutionIndex: 17
    SolutionNameMin: Cijk_Alik_Bjlk_B8NHS_BH_Bias_HAS_SAV_UserArgs_MT256x128x64_MI16x16x1_SN_LDSB1_CLR1_GRVWA16_GRVWB16_GSU0_GSUC0_GSUWGMRR0_K1_LBSPPA512_LBSPPB1024_LPA16_LPB64_LRVW8_MIWT8_4_PLR1_SU0_SUM0_SUS64_VWA8_VWB4_WGM6_WGMXCC1_WGMXCCGn1
    SolutionIndex: 18
    SolutionNameMin: Cijk_Alik_Bjlk_B8NHS_BH_Bias_HAS_SAV_UserArgs_MT256x128x64_MI16x16x1_SN_LDSB1_CLR1_GRVWA16_GRVWB8_GSU0_GSUC0_GSUWGMRR0_K1_LBSPPA512_LBSPPB1024_LPA16_LPB64_LRVW8_MIWT8_4_PLR1_SU0_SUM0_SUS64_VWA8_VWB4_WGM8_WGMXCC1_WGMXCCGn1
    SolutionIndex: 19
    SolutionNameMin: Cijk_Alik_Bjlk_B8NHS_BH_Bias_HAS_SAV_UserArgs_MT256x128x64_MI16x16x1_SN_LDSB1_CLR1_GRVWA8_GRVWB16_GSU0_GSUC0_GSUWGMRR0_K1_LBSPPA512_LBSPPB1024_LPA8_LPB64_LRVW8_MIWT8_4_PLR1_SU0_SUM0_SUS64_VWA8_VWB4_WGM8_WGMXCC1_WGMXCCGn1
    SolutionIndex: 20
    SolutionNameMin: Cijk_Alik_Bjlk_B8NHS_BH_Bias_HAS_SAV_UserArgs_MT256x128x64_MI16x16x1_SN_LDSB1_CLR1_GRVWA16_GRVWB16_GSU0_GSUC0_GSUWGMRR0_K1_LBSPPA512_LBSPPB1024_LPA16_LPB64_LRVW8_MIWT8_4_PLR1_SU0_SUM0_SUS64_VWA8_VWB4_WGM8_WGMXCC1_WGMXCCGn1
    SolutionIndex: 21
    SolutionNameMin: Cijk_Alik_Bjlk_B8NHS_BH_Bias_HAS_SAV_UserArgs_MT256x64x64_MI16x16x1_SN_LDSB1_CLR1_GRVWA16_GRVWB8_GSU0_GSUC0_GSUWGMRR0_K1_LBSPPA512_LBSPPB512_LPA16_LPB32_LRVW8_MIWT8_2_PLR1_SU0_SUM0_SUS64_VWA8_VWB2_WGM6_WGMXCC1_WGMXCCGn1
    SolutionIndex: 22
    SolutionNameMin: Cijk_Alik_Bjlk_B8NHS_BH_Bias_HAS_SAV_UserArgs_MT128x128x64_MI16x16x1_SN_LDSB1_CLR1_GRVWA8_GRVWB8_GSU0_GSUC0_GSUWGMRR0_K1_LBSPPA512_LBSPPB1024_LPA8_LPB32_LRVW8_MIWT8_2_PLR1_SU0_SUM0_SUS64_VWA8_VWB2_WGM1_WGMXCC1_WGMXCCGn1
    SolutionIndex: 23
    SolutionNameMin: Cijk_Alik_Bjlk_B8NHS_BH_Bias_HAS_SAV_UserArgs_MT128x128x64_MI16x16x1_SN_LDSB1_CLR1_GRVWA8_GRVWB16_GSU0_GSUC0_GSUWGMRR0_K1_LBSPPA512_LBSPPB1024_LPA8_LPB32_LRVW8_MIWT8_2_PLR1_SU0_SUM0_SUS64_VWA8_VWB2_WGM1_WGMXCC1_WGMXCCGn1
    SolutionIndex: 24
    SolutionNameMin: Cijk_Alik_Bjlk_B8NHS_BH_Bias_HAS_SAV_UserArgs_MT128x128x64_MI16x16x1_SN_LDSB1_CLR1_GRVWA8_GRVWB16_GSU0_GSUC0_GSUWGMRR0_K1_LBSPPA512_LBSPPB1024_LPA8_LPB32_LRVW8_MIWT8_2_PLR1_SU0_SUM0_SUS64_VWA8_VWB2_WGM6_WGMXCC1_WGMXCCGn1
    SolutionIndex: 25
    SolutionNameMin: Cijk_Alik_Bjlk_B8NHS_BH_Bias_HAS_SAV_UserArgs_MT128x128x64_MI16x16x1_SN_LDSB1_CLR1_GRVWA8_GRVWB16_GSU0_GSUC0_GSUWGMRR0_K1_LBSPPA512_LBSPPB1024_LPA8_LPB32_LRVW8_MIWT8_2_PLR1_SU0_SUM0_SUS64_VWA8_VWB2_WGM8_WGMXCC1_WGMXCCGn1
    SolutionIndex: 26
    SolutionNameMin: Cijk_Alik_Bjlk_B8NHS_BH_Bias_HAS_SAV_UserArgs_MT128x64x64_MI16x16x1_SN_LDSB0_CLR1_GRVWA8_GRVWB8_GSU0_GSUC0_GSUWGMRR0_K1_LBSPPA512_LBSPPB512_LPA8_LPB16_LRVW8_MIWT8_1_PLR1_SU0_SUM0_SUS64_VWA8_VWB1_WGM1_WGMXCC1_WGMXCCGn1
    SolutionIndex: 27
    SolutionNameMin: Cijk_Alik_Bjlk_B8NHS_BH_Bias_HAS_SAV_UserArgs_MT128x64x64_MI16x16x1_SN_LDSB0_CLR1_GRVWA8_GRVWB16_GSU0_GSUC0_GSUWGMRR0_K1_LBSPPA512_LBSPPB512_LPA8_LPB16_LRVW8_MIWT8_1_PLR1_SU0_SUM0_SUS64_VWA8_VWB1_WGM1_WGMXCC1_WGMXCCGn1
    SolutionIndex: 28
    SolutionNameMin: Cijk_Alik_Bjlk_B8NHS_BH_Bias_HAS_SAV_UserArgs_MT128x64x64_MI16x16x1_SN_LDSB0_CLR1_GRVWA8_GRVWB8_GSU0_GSUC0_GSUWGMRR0_K1_LBSPPA512_LBSPPB512_LPA8_LPB16_LRVW8_MIWT8_1_PLR1_SU0_SUM0_SUS64_VWA8_VWB1_WGM4_WGMXCC1_WGMXCCGn1
    SolutionIndex: 29
    SolutionNameMin: Cijk_Alik_Bjlk_B8NHS_BH_Bias_HAS_SAV_UserArgs_MT128x64x64_MI16x16x1_SN_LDSB0_CLR1_GRVWA8_GRVWB16_GSU0_GSUC0_GSUWGMRR0_K1_LBSPPA512_LBSPPB512_LPA8_LPB16_LRVW8_MIWT8_1_PLR1_SU0_SUM0_SUS64_VWA8_VWB1_WGM4_WGMXCC1_WGMXCCGn1
    SolutionIndex: 30
    SolutionNameMin: Cijk_Alik_Bjlk_B8NHS_BH_Bias_HAS_SAV_UserArgs_MT128x64x64_MI16x16x1_SN_LDSB0_CLR1_GRVWA8_GRVWB16_GSU0_GSUC0_GSUWGMRR0_K1_LBSPPA512_LBSPPB512_LPA8_LPB16_LRVW8_MIWT8_1_PLR1_SU0_SUM0_SUS64_VWA8_VWB1_WGM8_WGMXCC1_WGMXCCGn1
    SolutionIndex: 31
    SolutionNameMin: Cijk_Alik_Bjlk_B8NHS_BH_Bias_HAS_SAV_UserArgs_MT64x128x64_MI16x16x1_SN_LDSB0_CLR1_GRVWA16_GRVWB8_GSU0_GSUC0_GSUWGMRR0_K1_LBSPPA128_LBSPPB1024_LPA16_LPB64_LRVW8_MIWT2_4_PLR1_SU0_SUM0_SUS64_VWA2_VWB4_WGM1_WGMXCC1_WGMXCCGn1
    SolutionIndex: 32
    SolutionNameMin: Cijk_Alik_Bjlk_B8NHS_BH_Bias_HAS_SAV_UserArgs_MT64x128x64_MI16x16x1_SN_LDSB0_CLR1_GRVWA8_GRVWB16_GSU0_GSUC0_GSUWGMRR0_K1_LBSPPA128_LBSPPB1024_LPA8_LPB64_LRVW8_MIWT2_4_PLR1_SU0_SUM0_SUS64_VWA2_VWB4_WGM1_WGMXCC1_WGMXCCGn1
    SolutionIndex: 33
    SolutionNameMin: Cijk_Alik_Bjlk_B8NHS_BH_Bias_HAS_SAV_UserArgs_MT64x128x64_MI16x16x1_SN_LDSB0_CLR1_GRVWA16_GRVWB16_GSU0_GSUC0_GSUWGMRR0_K1_LBSPPA128_LBSPPB1024_LPA16_LPB64_LRVW8_MIWT2_4_PLR1_SU0_SUM0_SUS64_VWA2_VWB4_WGM6_WGMXCC1_WGMXCCGn1
    SolutionIndex: 34
    SolutionNameMin: Cijk_Alik_Bjlk_B8NHS_BH_Bias_HAS_SAV_UserArgs_MT64x128x64_MI16x16x1_SN_LDSB0_CLR1_GRVWA8_GRVWB16_GSU0_GSUC0_GSUWGMRR0_K1_LBSPPA128_LBSPPB1024_LPA8_LPB64_LRVW8_MIWT2_4_PLR1_SU0_SUM0_SUS64_VWA2_VWB4_WGM8_WGMXCC1_WGMXCCGn1
    SolutionIndex: 35
    SolutionNameMin: Cijk_Alik_Bjlk_B8NHS_BH_Bias_HAS_SAV_UserArgs_MT128x64x64_MI16x16x1_SN_LDSB0_CLR1_GRVWA8_GRVWB8_GSU0_GSUC0_GSUWGMRR0_K1_LBSPPA256_LBSPPB512_LPA8_LPB32_LRVW8_MIWT4_2_PLR1_SU0_SUM0_SUS64_VWA4_VWB2_WGM1_WGMXCC1_WGMXCCGn1
    SolutionIndex: 36
    SolutionNameMin: Cijk_Alik_Bjlk_B8NHS_BH_Bias_HAS_SAV_UserArgs_MT128x64x64_MI16x16x1_SN_LDSB0_CLR1_GRVWA16_GRVWB8_GSU0_GSUC0_GSUWGMRR0_K1_LBSPPA256_LBSPPB512_LPA16_LPB32_LRVW8_MIWT4_2_PLR1_SU0_SUM0_SUS64_VWA4_VWB2_WGM1_WGMXCC1_WGMXCCGn1
    SolutionIndex: 37
    SolutionNameMin: Cijk_Alik_Bjlk_B8NHS_BH_Bias_HAS_SAV_UserArgs_MT128x64x64_MI16x16x1_SN_LDSB0_CLR1_GRVWA8_GRVWB16_GSU0_GSUC0_GSUWGMRR0_K1_LBSPPA256_LBSPPB512_LPA8_LPB32_LRVW8_MIWT4_2_PLR1_SU0_SUM0_SUS64_VWA4_VWB2_WGM1_WGMXCC1_WGMXCCGn1
    SolutionIndex: 38
    SolutionNameMin: Cijk_Alik_Bjlk_B8NHS_BH_Bias_HAS_SAV_UserArgs_MT128x64x64_MI16x16x1_SN_LDSB0_CLR1_GRVWA16_GRVWB16_GSU0_GSUC0_GSUWGMRR0_K1_LBSPPA256_LBSPPB512_LPA16_LPB32_LRVW8_MIWT4_2_PLR1_SU0_SUM0_SUS64_VWA4_VWB2_WGM1_WGMXCC1_WGMXCCGn1
    SolutionIndex: 39
    SolutionNameMin: Cijk_Alik_Bjlk_B8NHS_BH_Bias_HAS_SAV_UserArgs_MT128x64x64_MI16x16x1_SN_LDSB0_CLR1_GRVWA16_GRVWB8_GSU0_GSUC0_GSUWGMRR0_K1_LBSPPA256_LBSPPB512_LPA16_LPB32_LRVW8_MIWT4_2_PLR1_SU0_SUM0_SUS64_VWA4_VWB2_WGM4_WGMXCC1_WGMXCCGn1
    SolutionIndex: 40
    SolutionNameMin: Cijk_Alik_Bjlk_B8NHS_BH_Bias_HAS_SAV_UserArgs_MT128x64x64_MI16x16x1_SN_LDSB0_CLR1_GRVWA8_GRVWB16_GSU0_GSUC0_GSUWGMRR0_K1_LBSPPA256_LBSPPB512_LPA8_LPB32_LRVW8_MIWT4_2_PLR1_SU0_SUM0_SUS64_VWA4_VWB2_WGM4_WGMXCC1_WGMXCCGn1
    SolutionIndex: 41
    SolutionNameMin: Cijk_Alik_Bjlk_B8NHS_BH_Bias_HAS_SAV_UserArgs_MT128x64x64_MI16x16x1_SN_LDSB0_CLR1_GRVWA8_GRVWB16_GSU0_GSUC0_GSUWGMRR0_K1_LBSPPA256_LBSPPB512_LPA8_LPB32_LRVW8_MIWT4_2_PLR1_SU0_SUM0_SUS64_VWA4_VWB2_WGM6_WGMXCC1_WGMXCCGn1
    SolutionIndex: 42
    SolutionNameMin: Cijk_Alik_Bjlk_B8NHS_BH_Bias_HAS_SAV_UserArgs_MT128x64x64_MI16x16x1_SN_LDSB0_CLR1_GRVWA8_GRVWB16_GSU0_GSUC0_GSUWGMRR0_K1_LBSPPA256_LBSPPB512_LPA8_LPB32_LRVW8_MIWT4_2_PLR1_SU0_SUM0_SUS64_VWA4_VWB2_WGM8_WGMXCC1_WGMXCCGn1
    SolutionIndex: 43
    SolutionNameMin: Cijk_Alik_Bjlk_B8NHS_BH_Bias_HAS_SAV_UserArgs_MT32x128x64_MI16x16x1_SN_LDSB0_CLR1_GRVWA8_GRVWB8_GSU0_GSUC0_GSUWGMRR0_K1_LBSPPA128_LBSPPB1024_LPA8_LPB64_LRVW8_MIWT1_4_PLR1_SU0_SUM0_SUS64_VWA1_VWB4_WGM1_WGMXCC1_WGMXCCGn1
    SolutionIndex: 44
    SolutionNameMin: Cijk_Alik_Bjlk_B8NHS_BH_Bias_HAS_SAV_UserArgs_MT64x64x64_MI16x16x1_SN_LDSB0_CLR1_GRVWA8_GRVWB8_GSU0_GSUC0_GSUWGMRR0_K1_LBSPPA128_LBSPPB512_LPA8_LPB32_LRVW8_MIWT2_2_PLR1_SU0_SUM0_SUS64_VWA2_VWB2_WGM1_WGMXCC1_WGMXCCGn1
    SolutionIndex: 45
    SolutionNameMin: Cijk_Alik_Bjlk_B8NHS_BH_Bias_HAS_SAV_UserArgs_MT64x64x64_MI16x16x1_SN_LDSB0_CLR1_GRVWA16_GRVWB8_GSU0_GSUC0_GSUWGMRR0_K1_LBSPPA128_LBSPPB512_LPA16_LPB32_LRVW8_MIWT2_2_PLR1_SU0_SUM0_SUS64_VWA2_VWB2_WGM1_WGMXCC1_WGMXCCGn1
    SolutionIndex: 46
    SolutionNameMin: Cijk_Alik_Bjlk_B8NHS_BH_Bias_HAS_SAV_UserArgs_MT64x64x64_MI16x16x1_SN_LDSB0_CLR1_GRVWA8_GRVWB8_GSU0_GSUC0_GSUWGMRR0_K1_LBSPPA128_LBSPPB512_LPA8_LPB32_LRVW8_MIWT2_2_PLR1_SU0_SUM0_SUS64_VWA2_VWB2_WGM4_WGMXCC1_WGMXCCGn1
    SolutionIndex: 47
    SolutionNameMin: Cijk_Alik_Bjlk_B8NHS_BH_Bias_HAS_SAV_UserArgs_MT64x64x64_MI16x16x1_SN_LDSB0_CLR1_GRVWA16_GRVWB8_GSU0_GSUC0_GSUWGMRR0_K1_LBSPPA128_LBSPPB512_LPA16_LPB32_LRVW8_MIWT2_2_PLR1_SU0_SUM0_SUS64_VWA2_VWB2_WGM4_WGMXCC1_WGMXCCGn1
    SolutionIndex: 48
    SolutionNameMin: Cijk_Alik_Bjlk_B8NHS_BH_Bias_HAS_SAV_UserArgs_MT64x64x64_MI16x16x1_SN_LDSB0_CLR1_GRVWA8_GRVWB16_GSU0_GSUC0_GSUWGMRR0_K1_LBSPPA128_LBSPPB512_LPA8_LPB32_LRVW8_MIWT2_2_PLR1_SU0_SUM0_SUS64_VWA2_VWB2_WGM4_WGMXCC1_WGMXCCGn1
    SolutionIndex: 49
    SolutionNameMin: Cijk_Alik_Bjlk_B8NHS_BH_Bias_HAS_SAV_UserArgs_MT32x64x64_MI16x16x1_SN_LDSB0_CLR1_GRVWA8_GRVWB16_GSU0_GSUC0_GSUWGMRR0_K1_LBSPPA128_LBSPPB512_LPA8_LPB32_LRVW8_MIWT1_2_PLR1_SU0_SUM0_SUS64_VWA1_VWB2_WGM1_WGMXCC1_WGMXCCGn1
    SolutionIndex: 50
    SolutionNameMin: Cijk_Alik_Bjlk_B8NHS_BH_Bias_HAS_SAV_UserArgs_MT32x64x64_MI16x16x1_SN_LDSB0_CLR1_GRVWA8_GRVWB16_GSU0_GSUC0_GSUWGMRR0_K1_LBSPPA128_LBSPPB512_LPA8_LPB32_LRVW8_MIWT1_2_PLR1_SU0_SUM0_SUS64_VWA1_VWB2_WGM4_WGMXCC1_WGMXCCGn1
    SolutionIndex: 51
    SolutionNameMin: Cijk_Alik_Bjlk_B8NHS_BH_Bias_HAS_SAV_UserArgs_MT64x32x64_MI16x16x1_SN_LDSB0_CLR1_GRVWA8_GRVWB8_GSU0_GSUC0_GSUWGMRR0_K1_LBSPPA128_LBSPPB256_LPA8_LPB16_LRVW8_MIWT2_1_PLR1_SU0_SUM0_SUS64_VWA2_VWB1_WGM1_WGMXCC1_WGMXCCGn1
    SolutionIndex: 52
    SolutionNameMin: Cijk_Alik_Bjlk_B8NHS_BH_Bias_HAS_SAV_UserArgs_MT64x32x64_MI16x16x1_SN_LDSB0_CLR1_GRVWA16_GRVWB8_GSU0_GSUC0_GSUWGMRR0_K1_LBSPPA128_LBSPPB256_LPA16_LPB16_LRVW8_MIWT2_1_PLR1_SU0_SUM0_SUS64_VWA2_VWB1_WGM1_WGMXCC1_WGMXCCGn1
    SolutionIndex: 53
    SolutionNameMin: Cijk_Alik_Bjlk_B8NHS_BH_Bias_HAS_SAV_UserArgs_MT64x32x64_MI16x16x1_SN_LDSB0_CLR1_GRVWA8_GRVWB8_GSU0_GSUC0_GSUWGMRR0_K1_LBSPPA128_LBSPPB256_LPA8_LPB16_LRVW8_MIWT2_1_PLR1_SU0_SUM0_SUS64_VWA2_VWB1_WGM8_WGMXCC1_WGMXCCGn1
    SolutionIndex: 54
    SolutionNameMin: Cijk_Alik_Bjlk_B8NHS_BH_Bias_HAS_SAV_UserArgs_MT32x32x64_MI16x16x1_SN_LDSB0_CLR1_GRVWA8_GRVWB8_GSU0_GSUC0_GSUWGMRR0_K1_LBSPPA128_LBSPPB256_LPA8_LPB16_LRVW8_MIWT1_1_PLR1_SU0_SUM0_SUS64_VWA1_VWB1_WGM1_WGMXCC1_WGMXCCGn1
    SolutionIndex: 55
    SolutionNameMin: Cijk_Alik_Bjlk_B8NHS_BH_Bias_HAS_SAV_UserArgs_MT32x32x64_MI16x16x1_SN_LDSB0_CLR1_GRVWA8_GRVWB8_GSU0_GSUC0_GSUWGMRR0_K1_LBSPPA128_LBSPPB256_LPA8_LPB16_LRVW8_MIWT1_1_PLR1_SU0_SUM0_SUS64_VWA1_VWB1_WGM4_WGMXCC1_WGMXCCGn1
    SolutionIndex: 56
    SolutionNameMin: Cijk_Alik_Bjlk_B8NHS_BH_Bias_HAS_SAV_UserArgs_MT32x32x64_MI16x16x1_SN_LDSB0_CLR1_GRVWA8_GRVWB8_GSU0_GSUC0_GSUWGMRR0_K1_LBSPPA128_LBSPPB256_LPA8_LPB16_LRVW8_MIWT1_1_PLR1_SU0_SUM0_SUS64_VWA1_VWB1_WGM8_WGMXCC1_WGMXCCGn1
    SolutionIndex: 57
    SolutionNameMin: Cijk_Alik_Bjlk_B8NHS_BH_Bias_HAS_SAV_UserArgs_MT128x256x128_MI16x16x1_SN_LDSB1_CLR1_GRVWA8_GRVWB16_GSU0_GSUC0_GSUWGMRR0_K1_LBSPPA512_LBSPPB2048_LPA8_LPB0_LRVW8_MIWT4_8_PLR1_SU0_SUM0_SUS128_VWA4_VWB8_WGM1_WGMXCC1_WGMXCCGn1
    SolutionIndex: 58
    SolutionNameMin: Cijk_Alik_Bjlk_B8NHS_BH_Bias_HAS_SAV_UserArgs_MT128x256x128_MI16x16x1_SN_LDSB1_CLR1_GRVWA8_GRVWB16_GSU0_GSUC0_GSUWGMRR0_K1_LBSPPA512_LBSPPB2048_LPA8_LPB0_LRVW8_MIWT4_8_PLR1_SU0_SUM0_SUS128_VWA4_VWB8_WGM4_WGMXCC1_WGMXCCGn1
    SolutionIndex: 59
    SolutionNameMin: Cijk_Alik_Bjlk_B8NHS_BH_Bias_HAS_SAV_UserArgs_MT128x256x128_MI16x16x1_SN_LDSB1_CLR1_GRVWA8_GRVWB16_GSU0_GSUC0_GSUWGMRR0_K1_LBSPPA512_LBSPPB2048_LPA8_LPB0_LRVW8_MIWT4_8_PLR1_SU0_SUM0_SUS128_VWA4_VWB8_WGM6_WGMXCC1_WGMXCCGn1
    SolutionIndex: 60
    SolutionNameMin: Cijk_Alik_Bjlk_B8NHS_BH_Bias_HAS_SAV_UserArgs_MT128x256x128_MI16x16x1_SN_LDSB1_CLR1_GRVWA8_GRVWB16_GSU0_GSUC0_GSUWGMRR0_K1_LBSPPA512_LBSPPB2048_LPA8_LPB0_LRVW8_MIWT4_8_PLR1_SU0_SUM0_SUS128_VWA4_VWB8_WGM8_WGMXCC1_WGMXCCGn1
    SolutionIndex: 61
    SolutionNameMin: Cijk_Alik_Bjlk_B8NHS_BH_Bias_HAS_SAV_UserArgs_MT256x128x128_MI16x16x1_SN_LDSB1_CLR1_GRVWA8_GRVWB16_GSU0_GSUC0_GSUWGMRR0_K1_LBSPPA1024_LBSPPB1024_LPA8_LPB64_LRVW8_MIWT8_4_PLR1_SU0_SUM0_SUS128_VWA8_VWB4_WGM1_WGMXCC1_WGMXCCGn1
    SolutionIndex: 62
    SolutionNameMin: Cijk_Alik_Bjlk_B8NHS_BH_Bias_HAS_SAV_UserArgs_MT256x128x128_MI16x16x1_SN_LDSB1_CLR1_GRVWA16_GRVWB16_GSU0_GSUC0_GSUWGMRR0_K1_LBSPPA1024_LBSPPB1024_LPA16_LPB64_LRVW8_MIWT8_4_PLR1_SU0_SUM0_SUS128_VWA8_VWB4_WGM1_WGMXCC1_WGMXCCGn1
    SolutionIndex: 63
    SolutionNameMin: Cijk_Alik_Bjlk_B8NHS_BH_Bias_HAS_SAV_UserArgs_MT256x128x128_MI16x16x1_SN_LDSB1_CLR1_GRVWA8_GRVWB16_GSU0_GSUC0_GSUWGMRR0_K1_LBSPPA1024_LBSPPB1024_LPA8_LPB64_LRVW8_MIWT8_4_PLR1_SU0_SUM0_SUS128_VWA8_VWB4_WGM4_WGMXCC1_WGMXCCGn1
    SolutionIndex: 64
    SolutionNameMin: Cijk_Alik_Bjlk_B8NHS_BH_Bias_HAS_SAV_UserArgs_MT256x128x128_MI16x16x1_SN_LDSB1_CLR1_GRVWA8_GRVWB16_GSU0_GSUC0_GSUWGMRR0_K1_LBSPPA1024_LBSPPB1024_LPA8_LPB64_LRVW8_MIWT8_4_PLR1_SU0_SUM0_SUS128_VWA8_VWB4_WGM8_WGMXCC1_WGMXCCGn1
    SolutionIndex: 65
    SolutionNameMin: Cijk_Alik_Bjlk_B8NHS_BH_Bias_HAS_SAV_UserArgs_MT144x256x128_MI16x16x1_SN_LDSB1_CLR1_GRVWA8_GRVWB16_GSU0_GSUC0_GSUWGMRR0_K1_LBSPPA128_LBSPPB2048_LPA8_LPB64_LRVW8_MIWT9_4_PLR1_SU0_SUM0_SUS128_VWA1_VWB4_WGM1_WGMXCC1_WGMXCCGn1
    SolutionIndex: 66
    SolutionNameMin: Cijk_Alik_Bjlk_B8NHS_BH_Bias_HAS_SAV_UserArgs_MT144x256x128_MI16x16x1_SN_LDSB1_CLR1_GRVWA8_GRVWB8_GSU0_GSUC0_GSUWGMRR0_K1_LBSPPA128_LBSPPB2048_LPA8_LPB64_LRVW8_MIWT9_4_PLR1_SU0_SUM0_SUS128_VWA1_VWB4_WGM4_WGMXCC1_WGMXCCGn1
    SolutionIndex: 67
    SolutionNameMin: Cijk_Alik_Bjlk_B8NHS_BH_Bias_HAS_SAV_UserArgs_MT144x256x128_MI16x16x1_SN_LDSB1_CLR1_GRVWA8_GRVWB16_GSU0_GSUC0_GSUWGMRR0_K1_LBSPPA128_LBSPPB2048_LPA8_LPB64_LRVW8_MIWT9_4_PLR1_SU0_SUM0_SUS128_VWA1_VWB4_WGM4_WGMXCC1_WGMXCCGn1
    SolutionIndex: 68
    SolutionNameMin: Cijk_Alik_Bjlk_B8NHS_BH_Bias_HAS_SAV_UserArgs_MT144x256x128_MI16x16x1_SN_LDSB1_CLR1_GRVWA8_GRVWB8_GSU0_GSUC0_GSUWGMRR0_K1_LBSPPA128_LBSPPB2048_LPA8_LPB64_LRVW8_MIWT9_4_PLR1_SU0_SUM0_SUS128_VWA1_VWB4_WGM6_WGMXCC1_WGMXCCGn1
    SolutionIndex: 69
    SolutionNameMin: Cijk_Alik_Bjlk_B8NHS_BH_Bias_HAS_SAV_UserArgs_MT144x256x128_MI16x16x1_SN_LDSB1_CLR1_GRVWA8_GRVWB16_GSU0_GSUC0_GSUWGMRR0_K1_LBSPPA128_LBSPPB2048_LPA8_LPB64_LRVW8_MIWT9_4_PLR1_SU0_SUM0_SUS128_VWA1_VWB4_WGM6_WGMXCC1_WGMXCCGn1
    SolutionIndex: 70
    SolutionNameMin: Cijk_Alik_Bjlk_B8NHS_BH_Bias_HAS_SAV_UserArgs_MT144x256x128_MI16x16x1_SN_LDSB1_CLR1_GRVWA8_GRVWB8_GSU0_GSUC0_GSUWGMRR0_K1_LBSPPA128_LBSPPB2048_LPA8_LPB64_LRVW8_MIWT9_4_PLR1_SU0_SUM0_SUS128_VWA1_VWB4_WGM8_WGMXCC1_WGMXCCGn1
    SolutionIndex: 71
    SolutionNameMin: Cijk_Alik_Bjlk_B8NHS_BH_Bias_HAS_SAV_UserArgs_MT144x256x128_MI16x16x1_SN_LDSB1_CLR1_GRVWA8_GRVWB16_GSU0_GSUC0_GSUWGMRR0_K1_LBSPPA128_LBSPPB2048_LPA8_LPB64_LRVW8_MIWT9_4_PLR1_SU0_SUM0_SUS128_VWA1_VWB4_WGM8_WGMXCC1_WGMXCCGn1
    SolutionIndex: 72
    SolutionNameMin: Cijk_Alik_Bjlk_B8NHS_BH_Bias_HAS_SAV_UserArgs_MT128x128x128_MI16x16x1_SN_LDSB1_CLR1_GRVWA8_GRVWB8_GSU0_GSUC0_GSUWGMRR0_K1_LBSPPA1024_LBSPPB1024_LPA8_LPB32_LRVW8_MIWT8_2_PLR1_SU0_SUM0_SUS128_VWA8_VWB2_WGM1_WGMXCC1_WGMXCCGn1
    SolutionIndex: 73
    SolutionNameMin: Cijk_Alik_Bjlk_B8NHS_BH_Bias_HAS_SAV_UserArgs_MT128x128x128_MI16x16x1_SN_LDSB1_CLR1_GRVWA8_GRVWB16_GSU0_GSUC0_GSUWGMRR0_K1_LBSPPA1024_LBSPPB1024_LPA8_LPB32_LRVW8_MIWT8_2_PLR1_SU0_SUM0_SUS128_VWA8_VWB2_WGM1_WGMXCC1_WGMXCCGn1
    SolutionIndex: 74
    SolutionNameMin: Cijk_Alik_Bjlk_B8NHS_BH_Bias_HAS_SAV_UserArgs_MT144x128x128_MI16x16x1_SN_LDSB1_CLR1_GRVWA8_GRVWB16_GSU0_GSUC0_GSUWGMRR0_K1_LBSPPA128_LBSPPB1024_LPA8_LPB32_LRVW8_MIWT9_2_PLR1_SU0_SUM0_SUS128_VWA1_VWB2_WGM6_WGMXCC1_WGMXCCGn1
    SolutionIndex: 75
    SolutionNameMin: Cijk_Alik_Bjlk_B8NHS_BH_Bias_HAS_SAV_UserArgs_MT144x128x128_MI16x16x1_SN_LDSB1_CLR1_GRVWA8_GRVWB16_GSU0_GSUC0_GSUWGMRR0_K1_LBSPPA128_LBSPPB1024_LPA8_LPB32_LRVW8_MIWT9_2_PLR1_SU0_SUM0_SUS128_VWA1_VWB2_WGM8_WGMXCC1_WGMXCCGn1
    SolutionIndex: 76
    SolutionNameMin: Cijk_Alik_Bjlk_B8NHS_BH_Bias_HAS_SAV_UserArgs_MT128x128x128_MI16x16x1_SN_LDSB1_CLR1_GRVWA16_GRVWB16_GSU0_GSUC0_GSUWGMRR0_K1_LBSPPA512_LBSPPB1024_LPA16_LPB64_LRVW8_MIWT4_4_PLR1_SU0_SUM0_SUS128_VWA4_VWB4_WGM1_WGMXCC1_WGMXCCGn1
    SolutionIndex: 77
    SolutionNameMin: Cijk_Alik_Bjlk_B8NHS_BH_Bias_HAS_SAV_UserArgs_MT128x128x128_MI16x16x1_SN_LDSB1_CLR1_GRVWA16_GRVWB8_GSU0_GSUC0_GSUWGMRR0_K1_LBSPPA512_LBSPPB1024_LPA16_LPB64_LRVW8_MIWT4_4_PLR1_SU0_SUM0_SUS128_VWA4_VWB4_WGM4_WGMXCC1_WGMXCCGn1
    SolutionIndex: 78
    SolutionNameMin: Cijk_Alik_Bjlk_B8NHS_BH_Bias_HAS_SAV_UserArgs_MT128x128x128_MI16x16x1_SN_LDSB1_CLR1_GRVWA16_GRVWB16_GSU0_GSUC0_GSUWGMRR0_K1_LBSPPA512_LBSPPB1024_LPA16_LPB64_LRVW8_MIWT4_4_PLR1_SU0_SUM0_SUS128_VWA4_VWB4_WGM4_WGMXCC1_WGMXCCGn1
    SolutionIndex: 79
    SolutionNameMin: Cijk_Alik_Bjlk_B8NHS_BH_Bias_HAS_SAV_UserArgs_MT128x128x128_MI16x16x1_SN_LDSB1_CLR1_GRVWA16_GRVWB16_GSU0_GSUC0_GSUWGMRR0_K1_LBSPPA512_LBSPPB1024_LPA16_LPB64_LRVW8_MIWT4_4_PLR1_SU0_SUM0_SUS128_VWA4_VWB4_WGM6_WGMXCC1_WGMXCCGn1
    SolutionIndex: 80
    SolutionNameMin: Cijk_Alik_Bjlk_B8NHS_BH_Bias_HAS_SAV_UserArgs_MT128x128x128_MI16x16x1_SN_LDSB1_CLR1_GRVWA16_GRVWB16_GSU0_GSUC0_GSUWGMRR0_K1_LBSPPA512_LBSPPB1024_LPA16_LPB64_LRVW8_MIWT4_4_PLR1_SU0_SUM0_SUS128_VWA4_VWB4_WGM8_WGMXCC1_WGMXCCGn1
    SolutionIndex: 81
    SolutionNameMin: Cijk_Alik_Bjlk_B8NHS_BH_Bias_HAS_SAV_UserArgs_MT64x128x128_MI16x16x1_SN_LDSB1_CLR1_GRVWA8_GRVWB16_GSU0_GSUC0_GSUWGMRR0_K1_LBSPPA256_LBSPPB1024_LPA8_LPB64_LRVW8_MIWT2_4_PLR1_SU0_SUM0_SUS128_VWA2_VWB4_WGM1_WGMXCC1_WGMXCCGn1
    SolutionIndex: 82
    SolutionNameMin: Cijk_Alik_Bjlk_B8NHS_BH_Bias_HAS_SAV_UserArgs_MT128x32x128_MI16x16x1_SN_LDSB1_CLR1_GRVWA8_GRVWB16_GSU0_GSUC0_GSUWGMRR0_K1_LBSPPA512_LBSPPB256_LPA8_LPB16_LRVW8_MIWT4_1_PLR1_SU0_SUM0_SUS128_VWA4_VWB1_WGM1_WGMXCC1_WGMXCCGn1
    SolutionIndex: 83
    SolutionNameMin: Cijk_Alik_Bjlk_B8NHS_BH_Bias_HAS_SAV_UserArgs_MT64x64x128_MI16x16x1_SN_LDSB1_CLR1_GRVWA16_GRVWB8_GSU0_GSUC0_GSUWGMRR0_K1_LBSPPA256_LBSPPB512_LPA16_LPB32_LRVW8_MIWT2_2_PLR1_SU0_SUM0_SUS128_VWA2_VWB2_WGM1_WGMXCC1_WGMXCCGn1
    SolutionIndex: 84
    SolutionNameMin: Cijk_Alik_Bjlk_B8NHS_BH_Bias_HAS_SAV_UserArgs_MT64x64x128_MI16x16x1_SN_LDSB1_CLR1_GRVWA8_GRVWB16_GSU0_GSUC0_GSUWGMRR0_K1_LBSPPA256_LBSPPB512_LPA8_LPB32_LRVW8_MIWT2_2_PLR1_SU0_SUM0_SUS128_VWA2_VWB2_WGM1_WGMXCC1_WGMXCCGn1
    SolutionIndex: 85
    SolutionNameMin: Cijk_Alik_Bjlk_B8NHS_BH_Bias_HAS_SAV_UserArgs_MT64x64x128_MI16x16x1_SN_LDSB1_CLR1_GRVWA8_GRVWB16_GSU0_GSUC0_GSUWGMRR0_K1_LBSPPA256_LBSPPB512_LPA8_LPB32_LRVW8_MIWT2_2_PLR1_SU0_SUM0_SUS128_VWA2_VWB2_WGM8_WGMXCC1_WGMXCCGn1
    SolutionIndex: 86
    SolutionNameMin: Cijk_Alik_Bjlk_B8NHS_BH_Bias_HAS_SAV_UserArgs_MT64x64x128_MI16x16x1_SN_LDSB1_CLR1_GRVWA16_GRVWB16_GSU0_GSUC0_GSUWGMRR0_K1_LBSPPA256_LBSPPB512_LPA16_LPB32_LRVW8_MIWT2_2_PLR1_SU0_SUM0_SUS128_VWA2_VWB2_WGM8_WGMXCC1_WGMXCCGn1
    SolutionIndex: 87
    SolutionNameMin: Cijk_Alik_Bjlk_B8NHS_BH_Bias_HAS_SAV_UserArgs_MT32x64x128_MI16x16x1_SN_LDSB0_CLR1_GRVWA8_GRVWB8_GSU0_GSUC0_GSUWGMRR0_K1_LBSPPA128_LBSPPB512_LPA8_LPB32_LRVW8_MIWT1_2_PLR1_SU0_SUM0_SUS128_VWA1_VWB2_WGM1_WGMXCC1_WGMXCCGn1
    SolutionIndex: 88
    SolutionNameMin: Cijk_Alik_Bjlk_B8NHS_BH_Bias_HAS_SAV_UserArgs_MT32x64x128_MI16x16x1_SN_LDSB0_CLR1_GRVWA16_GRVWB8_GSU0_GSUC0_GSUWGMRR0_K1_LBSPPA128_LBSPPB512_LPA16_LPB32_LRVW8_MIWT1_2_PLR1_SU0_SUM0_SUS128_VWA1_VWB2_WGM1_WGMXCC1_WGMXCCGn1
    SolutionIndex: 89
    SolutionNameMin: Cijk_Alik_Bjlk_B8NHS_BH_Bias_HAS_SAV_UserArgs_MT32x64x128_MI16x16x1_SN_LDSB0_CLR1_GRVWA16_GRVWB16_GSU0_GSUC0_GSUWGMRR0_K1_LBSPPA128_LBSPPB512_LPA16_LPB32_LRVW8_MIWT1_2_PLR1_SU0_SUM0_SUS128_VWA1_VWB2_WGM1_WGMXCC1_WGMXCCGn1
    SolutionIndex: 90
    SolutionNameMin: Cijk_Alik_Bjlk_B8NHS_BH_Bias_HAS_SAV_UserArgs_MT32x64x128_MI16x16x1_SN_LDSB0_CLR1_GRVWA8_GRVWB16_GSU0_GSUC0_GSUWGMRR0_K1_LBSPPA128_LBSPPB512_LPA8_LPB32_LRVW8_MIWT1_2_PLR1_SU0_SUM0_SUS128_VWA1_VWB2_WGM4_WGMXCC1_WGMXCCGn1
    SolutionIndex: 91
    SolutionNameMin: Cijk_Alik_Bjlk_B8NHS_BH_Bias_HAS_SAV_UserArgs_MT32x64x128_MI16x16x1_SN_LDSB0_CLR1_GRVWA8_GRVWB16_GSU0_GSUC0_GSUWGMRR0_K1_LBSPPA128_LBSPPB512_LPA8_LPB32_LRVW8_MIWT1_2_PLR1_SU0_SUM0_SUS128_VWA1_VWB2_WGM8_WGMXCC1_WGMXCCGn1
    SolutionIndex: 92
    SolutionNameMin: Cijk_Alik_Bjlk_B8NHS_BH_Bias_HAS_SAV_UserArgs_MT64x32x128_MI16x16x1_SN_LDSB0_CLR1_GRVWA8_GRVWB8_GSU0_GSUC0_GSUWGMRR0_K1_LBSPPA256_LBSPPB256_LPA8_LPB16_LRVW8_MIWT2_1_PLR1_SU0_SUM0_SUS128_VWA2_VWB1_WGM1_WGMXCC1_WGMXCCGn1
    SolutionIndex: 93
    SolutionNameMin: Cijk_Alik_Bjlk_B8NHS_BH_Bias_HAS_SAV_UserArgs_MT64x32x128_MI16x16x1_SN_LDSB0_CLR1_GRVWA16_GRVWB8_GSU0_GSUC0_GSUWGMRR0_K1_LBSPPA256_LBSPPB256_LPA16_LPB16_LRVW8_MIWT2_1_PLR1_SU0_SUM0_SUS128_VWA2_VWB1_WGM1_WGMXCC1_WGMXCCGn1
    SolutionIndex: 94
    SolutionNameMin: Cijk_Alik_Bjlk_B8NHS_BH_Bias_HAS_SAV_UserArgs_MT64x32x128_MI16x16x1_SN_LDSB0_CLR1_GRVWA8_GRVWB16_GSU0_GSUC0_GSUWGMRR0_K1_LBSPPA256_LBSPPB256_LPA8_LPB16_LRVW8_MIWT2_1_PLR1_SU0_SUM0_SUS128_VWA2_VWB1_WGM1_WGMXCC1_WGMXCCGn1
    SolutionIndex: 95
    SolutionNameMin: Cijk_Alik_Bjlk_B8NHS_BH_Bias_HAS_SAV_UserArgs_MT64x32x128_MI16x16x1_SN_LDSB0_CLR1_GRVWA8_GRVWB16_GSU0_GSUC0_GSUWGMRR0_K1_LBSPPA256_LBSPPB256_LPA8_LPB16_LRVW8_MIWT2_1_PLR1_SU0_SUM0_SUS128_VWA2_VWB1_WGM4_WGMXCC1_WGMXCCGn1
    SolutionIndex: 96
    SolutionNameMin: Cijk_Alik_Bjlk_B8NHS_BH_Bias_HAS_SAV_UserArgs_MT64x32x128_MI16x16x1_SN_LDSB0_CLR1_GRVWA8_GRVWB16_GSU0_GSUC0_GSUWGMRR0_K1_LBSPPA256_LBSPPB256_LPA8_LPB16_LRVW8_MIWT2_1_PLR1_SU0_SUM0_SUS128_VWA2_VWB1_WGM6_WGMXCC1_WGMXCCGn1
    SolutionIndex: 97
    SolutionNameMin: Cijk_Alik_Bjlk_B8NHS_BH_Bias_HAS_SAV_UserArgs_MT64x32x128_MI16x16x1_SN_LDSB0_CLR1_GRVWA16_GRVWB8_GSU0_GSUC0_GSUWGMRR0_K1_LBSPPA256_LBSPPB256_LPA16_LPB16_LRVW8_MIWT2_1_PLR1_SU0_SUM0_SUS128_VWA2_VWB1_WGM8_WGMXCC1_WGMXCCGn1
    SolutionIndex: 98
    SolutionNameMin: Cijk_Alik_Bjlk_B8NHS_BH_Bias_HAS_SAV_UserArgs_MT32x32x128_MI16x16x1_SN_LDSB0_CLR1_GRVWA8_GRVWB8_GSU0_GSUC0_GSUWGMRR0_K1_LBSPPA128_LBSPPB256_LPA8_LPB16_LRVW8_MIWT1_1_PLR1_SU0_SUM0_SUS128_VWA1_VWB1_WGM1_WGMXCC1_WGMXCCGn1
    SolutionIndex: 99
    SolutionNameMin: Cijk_Alik_Bjlk_B8NHS_BH_Bias_HAS_SAV_UserArgs_MT32x32x128_MI16x16x1_SN_LDSB0_CLR1_GRVWA16_GRVWB8_GSU0_GSUC0_GSUWGMRR0_K1_LBSPPA128_LBSPPB256_LPA16_LPB16_LRVW8_MIWT1_1_PLR1_SU0_SUM0_SUS128_VWA1_VWB1_WGM1_WGMXCC1_WGMXCCGn1
    SolutionIndex: 100
    SolutionNameMin: Cijk_Alik_Bjlk_B8NHS_BH_Bias_HAS_SAV_UserArgs_MT32x32x128_MI16x16x1_SN_LDSB0_CLR1_GRVWA8_GRVWB16_GSU0_GSUC0_GSUWGMRR0_K1_LBSPPA128_LBSPPB256_LPA8_LPB16_LRVW8_MIWT1_1_PLR1_SU0_SUM0_SUS128_VWA1_VWB1_WGM1_WGMXCC1_WGMXCCGn1
    SolutionIndex: 101
    SolutionNameMin: Cijk_Alik_Bjlk_B8NHS_BH_Bias_HAS_SAV_UserArgs_MT32x32x128_MI16x16x1_SN_LDSB0_CLR1_GRVWA16_GRVWB16_GSU0_GSUC0_GSUWGMRR0_K1_LBSPPA128_LBSPPB256_LPA16_LPB16_LRVW8_MIWT1_1_PLR1_SU0_SUM0_SUS128_VWA1_VWB1_WGM1_WGMXCC1_WGMXCCGn1
    SolutionIndex: 102
    SolutionNameMin: Cijk_Alik_Bjlk_B8NHS_BH_Bias_HAS_SAV_UserArgs_MT32x32x128_MI16x16x1_SN_LDSB0_CLR1_GRVWA8_GRVWB8_GSU0_GSUC0_GSUWGMRR0_K1_LBSPPA128_LBSPPB256_LPA8_LPB16_LRVW8_MIWT1_1_PLR1_SU0_SUM0_SUS128_VWA1_VWB1_WGM4_WGMXCC1_WGMXCCGn1
    SolutionIndex: 103
    SolutionNameMin: Cijk_Alik_Bjlk_B8NHS_BH_Bias_HAS_SAV_UserArgs_MT32x32x128_MI16x16x1_SN_LDSB0_CLR1_GRVWA8_GRVWB16_GSU0_GSUC0_GSUWGMRR0_K1_LBSPPA128_LBSPPB256_LPA8_LPB16_LRVW8_MIWT1_1_PLR1_SU0_SUM0_SUS128_VWA1_VWB1_WGM4_WGMXCC1_WGMXCCGn1
    SolutionIndex: 104
    SolutionNameMin: Cijk_Alik_Bjlk_B8NHS_BH_Bias_HAS_SAV_UserArgs_MT32x32x128_MI16x16x1_SN_LDSB0_CLR1_GRVWA8_GRVWB16_GSU0_GSUC0_GSUWGMRR0_K1_LBSPPA128_LBSPPB256_LPA8_LPB16_LRVW8_MIWT1_1_PLR1_SU0_SUM0_SUS128_VWA1_VWB1_WGM8_WGMXCC1_WGMXCCGn1
    SolutionIndex: 105
    SolutionNameMin: Cijk_Alik_Bjlk_B8NHS_BH_Bias_HAS_SAV_UserArgs_MT128x64x256_MI16x16x1_SN_LDSB1_CLR1_GRVWA16_GRVWB16_GSU0_GSUC0_GSUWGMRR0_K1_LBSPPA1024_LBSPPB512_LPA16_LPB32_LRVW8_MIWT4_2_PLR1_SU0_SUM0_SUS256_VWA4_VWB2_WGM1_WGMXCC1_WGMXCCGn1
    SolutionIndex: 106
    SolutionNameMin: Cijk_Alik_Bjlk_B8NHS_BH_Bias_HAS_SAV_UserArgs_MT128x64x256_MI16x16x1_SN_LDSB1_CLR1_GRVWA16_GRVWB16_GSU0_GSUC0_GSUWGMRR0_K1_LBSPPA1024_LBSPPB512_LPA16_LPB32_LRVW8_MIWT4_2_PLR1_SU0_SUM0_SUS256_VWA4_VWB2_WGM4_WGMXCC1_WGMXCCGn1
    SolutionIndex: 107
    SolutionNameMin: Cijk_Alik_Bjlk_B8NHS_BH_Bias_HAS_SAV_UserArgs_MT128x64x256_MI16x16x1_SN_LDSB1_CLR1_GRVWA16_GRVWB16_GSU0_GSUC0_GSUWGMRR0_K1_LBSPPA1024_LBSPPB512_LPA16_LPB32_LRVW8_MIWT4_2_PLR1_SU0_SUM0_SUS256_VWA4_VWB2_WGM6_WGMXCC1_WGMXCCGn1
    SolutionIndex: 108
    SolutionNameMin: Cijk_Alik_Bjlk_B8NHS_BH_Bias_HAS_SAV_UserArgs_MT128x64x256_MI16x16x1_SN_LDSB1_CLR1_GRVWA16_GRVWB16_GSU0_GSUC0_GSUWGMRR0_K1_LBSPPA1024_LBSPPB512_LPA16_LPB32_LRVW8_MIWT4_2_PLR1_SU0_SUM0_SUS256_VWA4_VWB2_WGM8_WGMXCC1_WGMXCCGn1
    SolutionIndex: 109
    SolutionNameMin: Cijk_Alik_Bjlk_B8NHS_BH_Bias_HAS_SAV_UserArgs_MT64x64x256_MI16x16x1_SN_LDSB1_CLR1_GRVWA16_GRVWB16_GSU0_GSUC0_GSUWGMRR0_K1_LBSPPA512_LBSPPB512_LPA16_LPB32_LRVW8_MIWT2_2_PLR1_SU0_SUM0_SUS256_VWA2_VWB2_WGM1_WGMXCC1_WGMXCCGn1
    SolutionIndex: 110
    SolutionNameMin: Cijk_Alik_Bjlk_B8NHS_BH_Bias_HAS_SAV_UserArgs_MT64x64x256_MI16x16x1_SN_LDSB1_CLR1_GRVWA16_GRVWB16_GSU0_GSUC0_GSUWGMRR0_K1_LBSPPA512_LBSPPB512_LPA16_LPB32_LRVW8_MIWT2_2_PLR1_SU0_SUM0_SUS256_VWA2_VWB2_WGM4_WGMXCC1_WGMXCCGn1
    SolutionIndex: 111
    SolutionNameMin: Cijk_Alik_Bjlk_B8NHS_BH_Bias_HAS_SAV_UserArgs_MT64x64x256_MI16x16x1_SN_LDSB1_CLR1_GRVWA16_GRVWB16_GSU0_GSUC0_GSUWGMRR0_K1_LBSPPA512_LBSPPB512_LPA16_LPB32_LRVW8_MIWT2_2_PLR1_SU0_SUM0_SUS256_VWA2_VWB2_WGM6_WGMXCC1_WGMXCCGn1
    SolutionIndex: 112
    SolutionNameMin: Cijk_Alik_Bjlk_B8NHS_BH_Bias_HAS_SAV_UserArgs_MT64x64x256_MI16x16x1_SN_LDSB1_CLR1_GRVWA16_GRVWB16_GSU0_GSUC0_GSUWGMRR0_K1_LBSPPA512_LBSPPB512_LPA16_LPB32_LRVW8_MIWT2_2_PLR1_SU0_SUM0_SUS256_VWA2_VWB2_WGM8_WGMXCC1_WGMXCCGn1
    SolutionIndex: 113
    SolutionNameMin: Cijk_Alik_Bjlk_B8NHS_BH_Bias_HAS_SAV_UserArgs_MT32x64x256_MI16x16x1_SN_LDSB1_CLR1_GRVWA8_GRVWB16_GSU0_GSUC0_GSUWGMRR0_K1_LBSPPA256_LBSPPB512_LPA8_LPB32_LRVW8_MIWT1_2_PLR1_SU0_SUM0_SUS256_VWA1_VWB2_WGM1_WGMXCC1_WGMXCCGn1
    SolutionIndex: 114
    SolutionNameMin: Cijk_Alik_Bjlk_B8NHS_BH_Bias_HAS_SAV_UserArgs_MT32x64x256_MI16x16x1_SN_LDSB1_CLR1_GRVWA16_GRVWB16_GSU0_GSUC0_GSUWGMRR0_K1_LBSPPA256_LBSPPB512_LPA16_LPB32_LRVW8_MIWT1_2_PLR1_SU0_SUM0_SUS256_VWA1_VWB2_WGM1_WGMXCC1_WGMXCCGn1
    SolutionIndex: 115
    SolutionNameMin: Cijk_Alik_Bjlk_B8NHS_BH_Bias_HAS_SAV_UserArgs_MT32x64x256_MI16x16x1_SN_LDSB1_CLR1_GRVWA8_GRVWB16_GSU0_GSUC0_GSUWGMRR0_K1_LBSPPA256_LBSPPB512_LPA8_LPB32_LRVW8_MIWT1_2_PLR1_SU0_SUM0_SUS256_VWA1_VWB2_WGM4_WGMXCC1_WGMXCCGn1
    SolutionIndex: 116
    SolutionNameMin: Cijk_Alik_Bjlk_B8NHS_BH_Bias_HAS_SAV_UserArgs_MT32x64x256_MI16x16x1_SN_LDSB1_CLR1_GRVWA16_GRVWB16_GSU0_GSUC0_GSUWGMRR0_K1_LBSPPA256_LBSPPB512_LPA16_LPB32_LRVW8_MIWT1_2_PLR1_SU0_SUM0_SUS256_VWA1_VWB2_WGM6_WGMXCC1_WGMXCCGn1
    SolutionIndex: 117
    SolutionNameMin: Cijk_Alik_Bjlk_B8NHS_BH_Bias_HAS_SAV_UserArgs_MT64x32x256_MI16x16x1_SN_LDSB1_CLR1_GRVWA16_GRVWB16_GSU0_GSUC0_GSUWGMRR0_K1_LBSPPA512_LBSPPB256_LPA16_LPB16_LRVW8_MIWT2_1_PLR1_SU0_SUM0_SUS256_VWA2_VWB1_WGM1_WGMXCC1_WGMXCCGn1
    SolutionIndex: 118
    SolutionNameMin: Cijk_Alik_Bjlk_B8NHS_BH_Bias_HAS_SAV_UserArgs_MT32x32x256_MI16x16x1_SN_LDSB1_CLR1_GRVWA8_GRVWB16_GSU0_GSUC0_GSUWGMRR0_K1_LBSPPA256_LBSPPB256_LPA8_LPB16_LRVW8_MIWT1_1_PLR1_SU0_SUM0_SUS256_VWA1_VWB1_WGM1_WGMXCC1_WGMXCCGn1
    SolutionIndex: 119
    SolutionNameMin: Cijk_Alik_Bjlk_B8NHS_BH_Bias_HAS_SAV_UserArgs_MT32x32x256_MI16x16x1_SN_LDSB1_CLR1_GRVWA16_GRVWB16_GSU0_GSUC0_GSUWGMRR0_K1_LBSPPA256_LBSPPB256_LPA16_LPB16_LRVW8_MIWT1_1_PLR1_SU0_SUM0_SUS256_VWA1_VWB1_WGM1_WGMXCC1_WGMXCCGn1
    SolutionIndex: 120
    SolutionNameMin: Cijk_Alik_Bjlk_B8NHS_BH_Bias_HAS_SAV_UserArgs_MT32x32x256_MI16x16x1_SN_LDSB1_CLR1_GRVWA16_GRVWB16_GSU0_GSUC0_GSUWGMRR0_K1_LBSPPA256_LBSPPB256_LPA16_LPB16_LRVW8_MIWT1_1_PLR1_SU0_SUM0_SUS256_VWA1_VWB1_WGM6_WGMXCC1_WGMXCCGn1
- - - [128, 128, 1, 128, 128, 128, 128, 128]
    - [54, 0.54]
  - - [128, 128, 1, 256, 128, 128, 256, 128]
    - [98, 1.02]
  - - [128, 128, 1, 512, 128, 128, 512, 128]
    - [101, 1.71]
  - - [128, 128, 1, 1024, 128, 128, 1024, 128]
    - [100, 2.71]
  - - [128, 128, 1, 2048, 128, 128, 2048, 128]
    - [100, 3.85]
  - - [128, 128, 1, 4096, 128, 128, 4096, 128]
    - [100, 4.8]
  - - [128, 128, 1, 8192, 128, 128, 8192, 128]
    - [103, 5.49]
  - - [128, 256, 1, 128, 128, 128, 128, 256]
    - [54, 1.1]
  - - [128, 256, 1, 256, 128, 128, 256, 256]
    - [99, 1.99]
  - - [128, 256, 1, 512, 128, 128, 512, 256]
    - [99, 3.46]
  - - [128, 256, 1, 1024, 128, 128, 1024, 256]
    - [98, 5.52]
  - - [128, 256, 1, 2048, 128, 128, 2048, 256]
    - [100, 7.66]
  - - [128, 256, 1, 4096, 128, 128, 4096, 256]
    - [100, 9.67]
  - - [128, 256, 1, 8192, 128, 128, 8192, 256]
    - [100, 11.07]
  - - [128, 512, 1, 128, 128, 128, 128, 512]
    - [54, 2.13]
  - - [128, 512, 1, 256, 128, 128, 256, 512]
    - [98, 3.98]
  - - [128, 512, 1, 512, 128, 128, 512, 512]
    - [98, 6.98]
  - - [128, 512, 1, 1024, 128, 128, 1024, 512]
    - [98, 11.01]
  - - [128, 512, 1, 2048, 128, 128, 2048, 512]
    - [100, 15.32]
  - - [128, 512, 1, 4096, 128, 128, 4096, 512]
    - [100, 19.26]
  - - [128, 512, 1, 8192, 128, 128, 8192, 512]
    - [119, 18.21]
  - - [128, 1024, 1, 128, 128, 128, 128, 1024]
    - [99, 4.38]
  - - [128, 1024, 1, 256, 128, 128, 256, 1024]
    - [98, 7.8]
  - - [128, 1024, 1, 512, 128, 128, 512, 1024]
    - [98, 13.4]
  - - [128, 1024, 1, 1024, 128, 128, 1024, 1024]
    - [98, 21.25]
  - - [128, 1024, 1, 2048, 128, 128, 2048, 1024]
    - [98, 29.78]
  - - [128, 1024, 1, 4096, 128, 128, 4096, 1024]
    - [119, 32.03]
  - - [128, 1024, 1, 8192, 128, 128, 8192, 1024]
    - [120, 32.12]
  - - [128, 2048, 1, 128, 128, 128, 128, 2048]
    - [87, 8.11]
  - - [128, 2048, 1, 256, 128, 128, 256, 2048]
    - [88, 14.64]
  - - [128, 2048, 1, 512, 128, 128, 512, 2048]
    - [93, 24.32]
  - - [128, 2048, 1, 1024, 128, 128, 1024, 2048]
    - [94, 37.38]
  - - [128, 2048, 1, 2048, 128, 128, 2048, 2048]
    - [114, 43.94]
  - - [128, 2048, 1, 4096, 128, 128, 4096, 2048]
    - [114, 52.63]
  - - [128, 2048, 1, 8192, 128, 128, 8192, 2048]
    - [116, 59.33]
  - - [128, 4096, 1, 128, 128, 128, 128, 4096]
    - [45, 14.98]
  - - [128, 4096, 1, 256, 128, 128, 256, 4096]
    - [45, 26.57]
  - - [128, 4096, 1, 512, 128, 128, 512, 4096]
    - [83, 44.02]
  - - [128, 4096, 1, 1024, 128, 128, 1024, 4096]
    - [84, 65.14]
  - - [128, 4096, 1, 2048, 128, 128, 2048, 4096]
    - [109, 78.44]
  - - [128, 4096, 1, 4096, 128, 128, 4096, 4096]
    - [109, 96.31]
  - - [128, 4096, 1, 8192, 128, 128, 8192, 4096]
    - [109, 108.18]
  - - [128, 8192, 1, 128, 128, 128, 128, 8192]
    - [36, 25.19]
  - - [128, 8192, 1, 256, 128, 128, 256, 8192]
    - [35, 44.73]
  - - [128, 8192, 1, 512, 128, 128, 512, 8192]
    - [36, 70.36]
  - - [128, 8192, 1, 1024, 128, 128, 1024, 8192]
    - [37, 103.45]
  - - [128, 8192, 1, 2048, 128, 128, 2048, 8192]
    - [81, 121.91]
  - - [128, 8192, 1, 4096, 128, 128, 4096, 8192]
    - [81, 144.66]
  - - [128, 8192, 1, 8192, 128, 128, 8192, 8192]
    - [106, 155.27]
  - - [256, 128, 1, 128, 256, 256, 128, 128]
    - [32, 0.64]
  - - [256, 128, 1, 256, 256, 256, 256, 128]
    - [26, 1.21]
  - - [256, 128, 1, 512, 256, 256, 512, 128]
    - [49, 2.53]
  - - [256, 128, 1, 1024, 256, 256, 1024, 128]
    - [91, 4.44]
  - - [256, 128, 1, 2048, 256, 256, 2048, 128]
    - [98, 7.39]
  - - [256, 128, 1, 4096, 256, 256, 4096, 128]
    - [100, 9.6]
  - - [256, 128, 1, 8192, 256, 256, 8192, 128]
    - [100, 11.08]
  - - [256, 256, 1, 128, 256, 256, 128, 256]
    - [48, 1.28]
  - - [256, 256, 1, 256, 256, 256, 256, 256]
    - [31, 2.54]
  - - [256, 256, 1, 512, 256, 256, 512, 256]
    - [56, 4.83]
  - - [256, 256, 1, 1024, 256, 256, 1024, 256]
    - [89, 8.84]
  - - [256, 256, 1, 2048, 256, 256, 2048, 256]
    - [100, 15.03]
  - - [256, 256, 1, 4096, 256, 256, 4096, 256]
    - [100, 19.16]
  - - [256, 256, 1, 8192, 256, 256, 8192, 256]
    - [104, 21.8]
  - - [256, 512, 1, 128, 256, 256, 128, 512]
    - [21, 2.59]
  - - [256, 512, 1, 256, 256, 256, 256, 512]
    - [29, 5.01]
  - - [256, 512, 1, 512, 256, 256, 512, 512]
    - [53, 9.63]
  - - [256, 512, 1, 1024, 256, 256, 1024, 512]
    - [56, 18.77]
  - - [256, 512, 1, 2048, 256, 256, 2048, 512]
    - [104, 29.27]
  - - [256, 512, 1, 4096, 256, 256, 4096, 512]
    - [100, 37.5]
  - - [256, 512, 1, 8192, 256, 256, 8192, 512]
    - [118, 38.7]
  - - [256, 1024, 1, 128, 256, 256, 128, 1024]
    - [33, 6.44]
  - - [256, 1024, 1, 256, 256, 256, 256, 1024]
    - [113, 13.21]
  - - [256, 1024, 1, 512, 256, 256, 512, 1024]
    - [82, 20.1]
  - - [256, 1024, 1, 1024, 256, 256, 1024, 1024]
    - [97, 35.98]
  - - [256, 1024, 1, 2048, 256, 256, 2048, 1024]
    - [94, 50.98]
  - - [256, 1024, 1, 4096, 256, 256, 4096, 1024]
    - [117, 57.98]
  - - [256, 1024, 1, 8192, 256, 256, 8192, 1024]
    - [116, 59.78]
  - - [256, 2048, 1, 128, 256, 256, 128, 2048]
    - [39, 12.77]
  - - [256, 2048, 1, 256, 256, 256, 256, 2048]
    - [38, 22.96]
  - - [256, 2048, 1, 512, 256, 256, 512, 2048]
    - [109, 40.68]
  - - [256, 2048, 1, 1024, 256, 256, 1024, 2048]
    - [84, 63.59]
  - - [256, 2048, 1, 2048, 256, 256, 2048, 2048]
    - [109, 79.48]
  - - [256, 2048, 1, 4096, 256, 256, 4096, 2048]
    - [109, 95.71]
  - - [256, 2048, 1, 8192, 256, 256, 8192, 2048]
    - [109, 108.06]
  - - [256, 4096, 1, 128, 256, 256, 128, 4096]
    - [30, 19.13]
  - - [256, 4096, 1, 256, 256, 256, 256, 4096]
    - [39, 38.01]
  - - [256, 4096, 1, 512, 256, 256, 512, 4096]
    - [38, 69.09]
  - - [256, 4096, 1, 1024, 256, 256, 1024, 4096]
    - [37, 102.29]
  - - [256, 4096, 1, 2048, 256, 256, 2048, 4096]
    - [105, 124.18]
  - - [256, 4096, 1, 4096, 256, 256, 4096, 4096]
    - [105, 147.99]
  - - [256, 4096, 1, 8192, 256, 256, 8192, 4096]
    - [105, 165.16]
  - - [256, 8192, 1, 128, 256, 256, 128, 8192]
    - [25, 37.0]
  - - [256, 8192, 1, 256, 256, 256, 256, 8192]
    - [76, 65.49]
  - - [256, 8192, 1, 512, 256, 256, 512, 8192]
    - [76, 105.99]
  - - [256, 8192, 1, 1024, 256, 256, 1024, 8192]
    - [76, 155.1]
  - - [256, 8192, 1, 2048, 256, 256, 2048, 8192]
    - [76, 182.08]
  - - [256, 8192, 1, 4096, 256, 256, 4096, 8192]
    - [76, 208.52]
  - - [256, 8192, 1, 8192, 256, 256, 8192, 8192]
    - [79, 203.6]
  - - [512, 128, 1, 128, 512, 512, 128, 128]
    - [34, 1.27]
  - - [512, 128, 1, 256, 512, 512, 256, 128]
    - [43, 2.44]
  - - [512, 128, 1, 512, 512, 512, 512, 128]
    - [50, 4.71]
  - - [512, 128, 1, 1024, 512, 512, 1024, 128]
    - [55, 9.12]
  - - [512, 128, 1, 2048, 512, 512, 2048, 128]
    - [102, 14.56]
  - - [512, 128, 1, 4096, 512, 512, 4096, 128]
    - [100, 19.13]
  - - [512, 128, 1, 8192, 512, 512, 8192, 128]
    - [100, 21.92]
  - - [512, 256, 1, 128, 512, 512, 128, 256]
    - [27, 2.46]
  - - [512, 256, 1, 256, 512, 512, 256, 256]
    - [26, 4.75]
  - - [512, 256, 1, 512, 512, 512, 512, 256]
    - [100, 13.52]
  - - [512, 256, 1, 1024, 512, 512, 1024, 256]
    - [98, 21.49]
  - - [512, 256, 1, 2048, 512, 512, 2048, 256]
    - [100, 29.78]
  - - [512, 256, 1, 4096, 512, 512, 4096, 256]
    - [100, 37.84]
  - - [512, 256, 1, 8192, 512, 512, 8192, 256]
    - [104, 43.13]
  - - [512, 512, 1, 128, 512, 512, 128, 512]
    - [92, 8.21]
  - - [512, 512, 1, 256, 512, 512, 256, 512]
    - [93, 14.61]
  - - [512, 512, 1, 512, 512, 512, 512, 512]
    - [93, 24.72]
  - - [512, 512, 1, 1024, 512, 512, 1024, 512]
    - [94, 37.77]
  - - [512, 512, 1, 2048, 512, 512, 2048, 512]
    - [94, 51.74]
  - - [512, 512, 1, 4096, 512, 512, 4096, 512]
    - [96, 63.16]
  - - [512, 512, 1, 8192, 512, 512, 8192, 512]
    - [90, 64.29]
  - - [512, 1024, 1, 128, 512, 512, 128, 1024]
    - [45, 15.09]
  - - [512, 1024, 1, 256, 512, 512, 256, 1024]
    - [45, 26.25]
  - - [512, 1024, 1, 512, 512, 512, 512, 1024]
    - [83, 43.65]
  - - [512, 1024, 1, 1024, 512, 512, 1024, 1024]
    - [109, 64.6]
  - - [512, 1024, 1, 2048, 512, 512, 2048, 1024]
    - [84, 86.9]
  - - [512, 1024, 1, 4096, 512, 512, 4096, 1024]
    - [109, 98.18]
  - - [512, 1024, 1, 8192, 512, 512, 8192, 1024]
    - [111, 106.67]
  - - [512, 2048, 1, 128, 512, 512, 128, 2048]
    - [36, 25.19]
  - - [512, 2048, 1, 256, 512, 512, 256, 2048]
    - [35, 42.69]
  - - [512, 2048, 1, 512, 512, 512, 512, 2048]
    - [37, 69.56]
  - - [512, 2048, 1, 1024, 512, 512, 1024, 2048]
    - [37, 103.57]
  - - [512, 2048, 1, 2048, 512, 512, 2048, 2048]
    - [105, 126.05]
  - - [512, 2048, 1, 4096, 512, 512, 4096, 2048]
    - [105, 151.0]
  - - [512, 2048, 1, 8192, 512, 512, 8192, 2048]
    - [105, 159.91]
  - - [512, 4096, 1, 128, 512, 512, 128, 4096]
    - [72, 38.19]
  - - [512, 4096, 1, 256, 512, 512, 256, 4096]
    - [23, 66.39]
  - - [512, 4096, 1, 512, 512, 512, 512, 4096]
    - [76, 105.91]
  - - [512, 4096, 1, 1024, 512, 512, 1024, 4096]
    - [76, 155.36]
  - - [512, 4096, 1, 2048, 512, 512, 2048, 4096]
    - [76, 189.55]
  - - [512, 4096, 1, 4096, 512, 512, 4096, 4096]
    - [76, 218.09]
  - - [512, 4096, 1, 8192, 512, 512, 8192, 4096]
    - [79, 205.09]
  - - [512, 8192, 1, 128, 512, 512, 128, 8192]
    - [14, 55.64]
  - - [512, 8192, 1, 256, 512, 512, 256, 8192]
    - [15, 96.05]
  - - [512, 8192, 1, 512, 512, 512, 512, 8192]
    - [15, 151.45]
  - - [512, 8192, 1, 1024, 512, 512, 1024, 8192]
    - [15, 200.39]
  - - [512, 8192, 1, 2048, 512, 512, 2048, 8192]
    - [10, 239.09]
  - - [512, 8192, 1, 4096, 512, 512, 4096, 8192]
    - [57, 259.53]
  - - [512, 8192, 1, 8192, 512, 512, 8192, 8192]
    - [61, 243.81]
  - - [1024, 128, 1, 128, 1024, 1024, 128, 128]
    - [54, 4.37]
  - - [1024, 128, 1, 256, 1024, 1024, 256, 128]
    - [98, 7.92]
  - - [1024, 128, 1, 512, 1024, 1024, 512, 128]
    - [98, 13.57]
  - - [1024, 128, 1, 1024, 1024, 1024, 1024, 128]
    - [98, 21.4]
  - - [1024, 128, 1, 2048, 1024, 1024, 2048, 128]
    - [100, 29.94]
  - - [1024, 128, 1, 4096, 1024, 1024, 4096, 128]
    - [100, 37.97]
  - - [1024, 128, 1, 8192, 1024, 1024, 8192, 128]
    - [103, 43.01]
  - - [1024, 256, 1, 128, 1024, 1024, 128, 256]
    - [52, 8.16]
  - - [1024, 256, 1, 256, 1024, 1024, 256, 256]
    - [92, 14.42]
  - - [1024, 256, 1, 512, 1024, 1024, 512, 256]
    - [92, 24.27]
  - - [1024, 256, 1, 1024, 1024, 1024, 1024, 256]
    - [92, 37.19]
  - - [1024, 256, 1, 2048, 1024, 1024, 2048, 256]
    - [94, 51.41]
  - - [1024, 256, 1, 4096, 1024, 1024, 4096, 256]
    - [95, 62.86]
  - - [1024, 256, 1, 8192, 1024, 1024, 8192, 256]
    - [115, 70.8]
  - - [1024, 512, 1, 128, 1024, 1024, 128, 512]
    - [44, 14.75]
  - - [1024, 512, 1, 256, 1024, 1024, 256, 512]
    - [44, 26.16]
  - - [1024, 512, 1, 512, 1024, 1024, 512, 512]
    - [83, 42.67]
  - - [1024, 512, 1, 1024, 1024, 1024, 1024, 512]
    - [84, 63.95]
  - - [1024, 512, 1, 2048, 1024, 1024, 2048, 512]
    - [109, 86.16]
  - - [1024, 512, 1, 4096, 1024, 1024, 4096, 512]
    - [110, 102.43]
  - - [1024, 512, 1, 8192, 1024, 1024, 8192, 512]
    - [112, 107.47]
  - - [1024, 1024, 1, 128, 1024, 1024, 128, 1024]
    - [31, 24.47]
  - - [1024, 1024, 1, 256, 1024, 1024, 256, 1024]
    - [36, 42.99]
  - - [1024, 1024, 1, 512, 1024, 1024, 512, 1024]
    - [37, 69.73]
  - - [1024, 1024, 1, 1024, 1024, 1024, 1024, 1024]
    - [37, 102.32]
  - - [1024, 1024, 1, 2048, 1024, 1024, 2048, 1024]
    - [107, 127.3]
  - - [1024, 1024, 1, 4096, 1024, 1024, 4096, 1024]
    - [106, 148.05]
  - - [1024, 1024, 1, 8192, 1024, 1024, 8192, 1024]
    - [107, 161.04]
  - - [1024, 2048, 1, 128, 1024, 1024, 128, 2048]
    - [23, 38.76]
  - - [1024, 2048, 1, 256, 1024, 1024, 256, 2048]
    - [23, 66.9]
  - - [1024, 2048, 1, 512, 1024, 1024, 512, 2048]
    - [76, 106.68]
  - - [1024, 2048, 1, 1024, 1024, 1024, 1024, 2048]
    - [76, 152.92]
  - - [1024, 2048, 1, 2048, 1024, 1024, 2048, 2048]
    - [76, 191.75]
  - - [1024, 2048, 1, 4096, 1024, 1024, 4096, 2048]
    - [78, 215.9]
  - - [1024, 2048, 1, 8192, 1024, 1024, 8192, 2048]
    - [78, 208.54]
  - - [1024, 4096, 1, 128, 1024, 1024, 128, 4096]
    - [18, 58.13]
  - - [1024, 4096, 1, 256, 1024, 1024, 256, 4096]
    - [19, 99.16]
  - - [1024, 4096, 1, 512, 1024, 1024, 512, 4096]
    - [13, 149.75]
  - - [1024, 4096, 1, 1024, 1024, 1024, 1024, 4096]
    - [16, 196.28]
  - - [1024, 4096, 1, 2048, 1024, 1024, 2048, 4096]
    - [61, 240.76]
  - - [1024, 4096, 1, 4096, 1024, 1024, 4096, 4096]
    - [57, 258.06]
  - - [1024, 4096, 1, 8192, 1024, 1024, 8192, 4096]
    - [61, 248.22]
  - - [1024, 8192, 1, 128, 1024, 1024, 128, 8192]
    - [4, 67.73]
  - - [1024, 8192, 1, 256, 1024, 1024, 256, 8192]
    - [4, 115.1]
  - - [1024, 8192, 1, 512, 1024, 1024, 512, 8192]
    - [3, 175.9]
  - - [1024, 8192, 1, 1024, 1024, 1024, 1024, 8192]
    - [6, 233.75]
  - - [1024, 8192, 1, 2048, 1024, 1024, 2048, 8192]
    - [8, 279.94]
  - - [1024, 8192, 1, 4096, 1024, 1024, 4096, 8192]
    - [6, 273.47]
  - - [1024, 8192, 1, 8192, 1024, 1024, 8192, 8192]
    - [5, 286.95]
  - - [2048, 128, 1, 128, 2048, 2048, 128, 128]
    - [93, 7.78]
  - - [2048, 128, 1, 256, 2048, 2048, 256, 128]
    - [51, 14.1]
  - - [2048, 128, 1, 512, 2048, 2048, 512, 128]
    - [92, 23.75]
  - - [2048, 128, 1, 1024, 2048, 2048, 1024, 128]
    - [92, 36.84]
  - - [2048, 128, 1, 2048, 2048, 2048, 2048, 128]
    - [94, 51.45]
  - - [2048, 128, 1, 4096, 2048, 2048, 4096, 128]
    - [95, 62.91]
  - - [2048, 128, 1, 8192, 2048, 2048, 8192, 128]
    - [115, 70.8]
  - - [2048, 256, 1, 128, 2048, 2048, 128, 256]
    - [47, 14.07]
  - - [2048, 256, 1, 256, 2048, 2048, 256, 256]
    - [46, 25.29]
  - - [2048, 256, 1, 512, 2048, 2048, 512, 256]
    - [86, 41.7]
  - - [2048, 256, 1, 1024, 2048, 2048, 1024, 256]
    - [85, 63.41]
  - - [2048, 256, 1, 2048, 2048, 2048, 2048, 256]
    - [110, 86.02]
  - - [2048, 256, 1, 4096, 2048, 2048, 4096, 256]
    - [111, 104.87]
  - - [2048, 256, 1, 8192, 2048, 2048, 8192, 256]
    - [112, 116.74]
  - - [2048, 512, 1, 128, 2048, 2048, 128, 512]
    - [28, 24.48]
  - - [2048, 512, 1, 256, 2048, 2048, 256, 512]
    - [36, 42.83]
  - - [2048, 512, 1, 512, 2048, 2048, 512, 512]
    - [41, 69.81]
  - - [2048, 512, 1, 1024, 2048, 2048, 1024, 512]
    - [40, 102.47]
  - - [2048, 512, 1, 2048, 2048, 2048, 2048, 512]
    - [42, 134.24]
  - - [2048, 512, 1, 4096, 2048, 2048, 4096, 512]
    - [108, 149.47]
  - - [2048, 512, 1, 8192, 2048, 2048, 8192, 512]
    - [108, 160.28]
  - - [2048, 1024, 1, 128, 2048, 2048, 128, 1024]
    - [73, 38.69]
  - - [2048, 1024, 1, 256, 2048, 2048, 256, 1024]
    - [23, 67.06]
  - - [2048, 1024, 1, 512, 2048, 2048, 512, 1024]
    - [76, 106.6]
  - - [2048, 1024, 1, 1024, 2048, 2048, 1024, 1024]
    - [78, 152.5]
  - - [2048, 1024, 1, 2048, 2048, 2048, 2048, 1024]
    - [78, 189.52]
  - - [2048, 1024, 1, 4096, 2048, 2048, 4096, 1024]
    - [78, 208.51]
  - - [2048, 1024, 1, 8192, 2048, 2048, 8192, 1024]
    - [79, 208.88]
  - - [2048, 2048, 1, 128, 2048, 2048, 128, 2048]
    - [14, 55.21]
  - - [2048, 2048, 1, 256, 2048, 2048, 256, 2048]
    - [16, 94.94]
  - - [2048, 2048, 1, 512, 2048, 2048, 512, 2048]
    - [15, 145.83]
  - - [2048, 2048, 1, 1024, 2048, 2048, 1024, 2048]
    - [15, 193.9]
  - - [2048, 2048, 1, 2048, 2048, 2048, 2048, 2048]
    - [58, 239.92]
  - - [2048, 2048, 1, 4096, 2048, 2048, 4096, 2048]
    - [59, 260.27]
  - - [2048, 2048, 1, 8192, 2048, 2048, 8192, 2048]
    - [63, 244.98]
  - - [2048, 4096, 1, 128, 2048, 2048, 128, 4096]
    - [1, 65.55]
  - - [2048, 4096, 1, 256, 2048, 2048, 256, 4096]
    - [2, 113.28]
  - - [2048, 4096, 1, 512, 2048, 2048, 512, 4096]
    - [4, 174.85]
  - - [2048, 4096, 1, 1024, 2048, 2048, 1024, 4096]
    - [4, 232.36]
  - - [2048, 4096, 1, 2048, 2048, 2048, 2048, 4096]
    - [9, 271.32]
  - - [2048, 4096, 1, 4096, 2048, 2048, 4096, 4096]
    - [3, 266.97]
  - - [2048, 4096, 1, 8192, 2048, 2048, 8192, 4096]
    - [59, 288.29]
  - - [2048, 8192, 1, 128, 2048, 2048, 128, 8192]
    - [2, 71.59]
  - - [2048, 8192, 1, 256, 2048, 2048, 256, 8192]
    - [4, 119.57]
  - - [2048, 8192, 1, 512, 2048, 2048, 512, 8192]
    - [4, 188.04]
  - - [2048, 8192, 1, 1024, 2048, 2048, 1024, 8192]
    - [4, 236.14]
  - - [2048, 8192, 1, 2048, 2048, 2048, 2048, 8192]
    - [10, 243.5]
  - - [2048, 8192, 1, 4096, 2048, 2048, 4096, 8192]
    - [2, 280.27]
  - - [2048, 8192, 1, 8192, 2048, 2048, 8192, 8192]
    - [62, 320.04]
  - - [4096, 128, 1, 128, 4096, 4096, 128, 128]
    - [45, 14.73]
  - - [4096, 128, 1, 256, 4096, 4096, 256, 128]
    - [45, 26.36]
  - - [4096, 128, 1, 512, 4096, 4096, 512, 128]
    - [83, 42.87]
  - - [4096, 128, 1, 1024, 4096, 4096, 1024, 128]
    - [84, 64.78]
  - - [4096, 128, 1, 2048, 4096, 4096, 2048, 128]
    - [109, 86.83]
  - - [4096, 128, 1, 4096, 4096, 4096, 4096, 128]
    - [111, 105.08]
  - - [4096, 128, 1, 8192, 4096, 4096, 8192, 128]
    - [112, 117.38]
  - - [4096, 256, 1, 128, 4096, 4096, 128, 256]
    - [35, 25.56]
  - - [4096, 256, 1, 256, 4096, 4096, 256, 256]
    - [36, 44.98]
  - - [4096, 256, 1, 512, 4096, 4096, 512, 256]
    - [37, 72.1]
  - - [4096, 256, 1, 1024, 4096, 4096, 1024, 256]
    - [42, 104.11]
  - - [4096, 256, 1, 2048, 4096, 4096, 2048, 256]
    - [42, 135.21]
  - - [4096, 256, 1, 4096, 4096, 4096, 4096, 256]
    - [106, 148.08]
  - - [4096, 256, 1, 8192, 4096, 4096, 8192, 256]
    - [108, 159.37]
  - - [4096, 512, 1, 128, 4096, 4096, 128, 512]
    - [22, 38.72]
  - - [4096, 512, 1, 256, 4096, 4096, 256, 512]
    - [23, 66.25]
  - - [4096, 512, 1, 512, 4096, 4096, 512, 512]
    - [78, 105.37]
  - - [4096, 512, 1, 1024, 4096, 4096, 1024, 512]
    - [79, 154.23]
  - - [4096, 512, 1, 2048, 4096, 4096, 2048, 512]
    - [79, 193.44]
  - - [4096, 512, 1, 4096, 4096, 4096, 4096, 512]
    - [79, 205.48]
  - - [4096, 512, 1, 8192, 4096, 4096, 8192, 512]
    - [79, 210.12]
  - - [4096, 1024, 1, 128, 4096, 4096, 128, 1024]
    - [15, 55.26]
  - - [4096, 1024, 1, 256, 4096, 4096, 256, 1024]
    - [15, 93.64]
  - - [4096, 1024, 1, 512, 4096, 4096, 512, 1024]
    - [20, 139.52]
  - - [4096, 1024, 1, 1024, 4096, 4096, 1024, 1024]
    - [63, 192.63]
  - - [4096, 1024, 1, 2048, 4096, 4096, 2048, 1024]
    - [60, 237.39]
  - - [4096, 1024, 1, 4096, 4096, 4096, 4096, 1024]
    - [59, 260.78]
  - - [4096, 1024, 1, 8192, 4096, 4096, 8192, 1024]
    - [60, 245.79]
  - - [4096, 2048, 1, 128, 4096, 4096, 128, 2048]
    - [1, 61.94]
  - - [4096, 2048, 1, 256, 4096, 4096, 256, 2048]
    - [2, 106.83]
  - - [4096, 2048, 1, 512, 4096, 4096, 512, 2048]
    - [4, 167.43]
  - - [4096, 2048, 1, 1024, 4096, 4096, 1024, 2048]
    - [9, 233.77]
  - - [4096, 2048, 1, 2048, 4096, 4096, 2048, 2048]
    - [9, 267.68]
  - - [4096, 2048, 1, 4096, 4096, 4096, 4096, 2048]
    - [67, 272.76]
  - - [4096, 2048, 1, 8192, 4096, 4096, 8192, 2048]
    - [71, 293.45]
  - - [4096, 4096, 1, 128, 4096, 4096, 128, 4096]
    - [2, 67.73]
  - - [4096, 4096, 1, 256, 4096, 4096, 256, 4096]
    - [0, 116.66]
  - - [4096, 4096, 1, 512, 4096, 4096, 512, 4096]
    - [9, 179.17]
  - - [4096, 4096, 1, 1024, 4096, 4096, 1024, 4096]
    - [4, 224.19]
  - - [4096, 4096, 1, 2048, 4096, 4096, 2048, 4096]
    - [66, 242.78]
  - - [4096, 4096, 1, 4096, 4096, 4096, 4096, 4096]
    - [65, 294.89]
  - - [4096, 4096, 1, 8192, 4096, 4096, 8192, 4096]
    - [67, 330.45]
  - - [4096, 8192, 1, 128, 4096, 4096, 128, 8192]
    - [2, 75.96]
  - - [4096, 8192, 1, 256, 4096, 4096, 256, 8192]
    - [2, 124.42]
  - - [4096, 8192, 1, 512, 4096, 4096, 512, 8192]
    - [12, 182.92]
  - - [4096, 8192, 1, 1024, 4096, 4096, 1024, 8192]
    - [64, 225.74]
  - - [4096, 8192, 1, 2048, 4096, 4096, 2048, 8192]
    - [60, 279.25]
  - - [4096, 8192, 1, 4096, 4096, 4096, 4096, 8192]
    - [1, 328.8]
  - - [4096, 8192, 1, 8192, 4096, 4096, 8192, 8192]
    - [2, 363.53]
  - - [8192, 128, 1, 128, 8192, 8192, 128, 128]
    - [36, 24.64]
  - - [8192, 128, 1, 256, 8192, 8192, 256, 128]
    - [26, 43.56]
  - - [8192, 128, 1, 512, 8192, 8192, 512, 128]
    - [37, 70.65]
  - - [8192, 128, 1, 1024, 8192, 8192, 1024, 128]
    - [37, 102.91]
  - - [8192, 128, 1, 2048, 8192, 8192, 2048, 128]
    - [41, 131.5]
  - - [8192, 128, 1, 4096, 8192, 8192, 4096, 128]
    - [81, 143.82]
  - - [8192, 128, 1, 8192, 8192, 8192, 8192, 128]
    - [108, 156.89]
  - - [8192, 256, 1, 128, 8192, 8192, 128, 256]
    - [77, 36.97]
  - - [8192, 256, 1, 256, 8192, 8192, 256, 256]
    - [24, 64.76]
  - - [8192, 256, 1, 512, 8192, 8192, 512, 256]
    - [80, 103.85]
  - - [8192, 256, 1, 1024, 8192, 8192, 1024, 256]
    - [78, 153.0]
  - - [8192, 256, 1, 2048, 8192, 8192, 2048, 256]
    - [80, 188.39]
  - - [8192, 256, 1, 4096, 8192, 8192, 4096, 256]
    - [79, 201.91]
  - - [8192, 256, 1, 8192, 8192, 8192, 8192, 256]
    - [78, 208.78]
  - - [8192, 512, 1, 128, 8192, 8192, 128, 512]
    - [17, 52.94]
  - - [8192, 512, 1, 256, 8192, 8192, 256, 512]
    - [19, 91.53]
  - - [8192, 512, 1, 512, 8192, 8192, 512, 512]
    - [74, 144.25]
  - - [8192, 512, 1, 1024, 8192, 8192, 1024, 512]
    - [75, 210.29]
  - - [8192, 512, 1, 2048, 8192, 8192, 2048, 512]
    - [12, 236.92]
  - - [8192, 512, 1, 4096, 8192, 8192, 4096, 512]
    - [75, 268.43]
  - - [8192, 512, 1, 8192, 8192, 8192, 8192, 512]
    - [75, 269.44]
  - - [8192, 1024, 1, 128, 8192, 8192, 128, 1024]
    - [9, 63.12]
  - - [8192, 1024, 1, 256, 8192, 8192, 256, 1024]
    - [71, 107.56]
  - - [8192, 1024, 1, 512, 8192, 8192, 512, 1024]
    - [71, 175.19]
  - - [8192, 1024, 1, 1024, 8192, 8192, 1024, 1024]
    - [5, 226.07]
  - - [8192, 1024, 1, 2048, 8192, 8192, 2048, 1024]
    - [71, 293.79]
  - - [8192, 1024, 1, 4096, 8192, 8192, 4096, 1024]
    - [71, 347.36]
  - - [8192, 1024, 1, 8192, 8192, 8192, 8192, 1024]
    - [69, 369.77]
  - - [8192, 2048, 1, 128, 8192, 8192, 128, 2048]
    - [70, 67.18]
  - - [8192, 2048, 1, 256, 8192, 8192, 256, 2048]
    - [71, 117.12]
  - - [8192, 2048, 1, 512, 8192, 8192, 512, 2048]
    - [71, 180.25]
  - - [8192, 2048, 1, 1024, 8192, 8192, 1024, 2048]
    - [67, 240.22]
  - - [8192, 2048, 1, 2048, 8192, 8192, 2048, 2048]
    - [68, 296.18]
  - - [8192, 2048, 1, 4096, 8192, 8192, 4096, 2048]
    - [71, 343.68]
  - - [8192, 2048, 1, 8192, 8192, 8192, 8192, 2048]
    - [69, 396.52]
  - - [8192, 4096, 1, 128, 8192, 8192, 128, 4096]
    - [70, 71.31]
  - - [8192, 4096, 1, 256, 8192, 8192, 256, 4096]
    - [71, 119.51]
  - - [8192, 4096, 1, 512, 8192, 8192, 512, 4096]
    - [11, 181.79]
  - - [8192, 4096, 1, 1024, 8192, 8192, 1024, 4096]
    - [71, 234.52]
  - - [8192, 4096, 1, 2048, 8192, 8192, 2048, 4096]
    - [67, 300.56]
  - - [8192, 4096, 1, 4096, 8192, 8192, 4096, 4096]
    - [67, 356.94]
  - - [8192, 4096, 1, 8192, 8192, 8192, 8192, 4096]
    - [67, 409.4]
  - - [8192, 8192, 1, 128, 8192, 8192, 128, 8192]
    - [7, 65.53]
  - - [8192, 8192, 1, 256, 8192, 8192, 256, 8192]
    - [13, 120.66]
  - - [8192, 8192, 1, 512, 8192, 8192, 512, 8192]
    - [2, 178.63]
  - - [8192, 8192, 1, 1024, 8192, 8192, 1024, 8192]
    - [4, 243.15]
  - - [8192, 8192, 1, 2048, 8192, 8192, 2048, 8192]
    - [69, 310.83]
  - - [8192, 8192, 1, 4096, 8192, 8192, 4096, 8192]
    - [67, 368.18]
  - - [8192, 8192, 1, 8192, 8192, 8192, 8192, 8192]
    - [69, 407.42]
- null
- null
- ExperimentalStreamK
- GridBased
