projects/hipblaslt/library/src/amd_detail/rocblaslt/src/Tensile/Logic/asm_full/aquavanjaram/gfx942_228cu/StreamK/aquavanjaram942_Cijk_Alik_Bljk_BSS_BH_Bias_HAS_SAV_UserArgs.yaml
- {MinimumRequiredVersion: 4.33.0}
- aquavanjaram942
- {Architecture: gfx942, CUCount: 228}
- [Device 0049, Device 0050]
    SolutionIndex: 0
    SolutionNameMin: Cijk_Alik_Bljk_BSS_BH_Bias_HAS_SAV_UserArgs_MT128x256x32_MI16x16x1_SN_LDSB1_CLR1_GSU0_GSUC0_GSUWGMRR0_K1_LBSPPA256_LBSPPB512_MIWT4_8_PLR1_SU0_SUM0_SUS64_VWA4_VWB8_WGM1_WGMXCC1_WGMXCCGn1
    SolutionIndex: 1
    SolutionNameMin: Cijk_Alik_Bljk_BSS_BH_Bias_HAS_SAV_UserArgs_MT128x256x32_MI16x16x1_SN_LDSB1_CLR1_GSU0_GSUC0_GSUWGMRR0_K1_LBSPPA256_LBSPPB512_MIWT4_8_PLR1_SU0_SUM0_SUS64_VWA4_VWB8_WGM1_WGMXCC1_WGMXCCGn1
    SolutionIndex: 2
    SolutionNameMin: Cijk_Alik_Bljk_BSS_BH_Bias_HAS_SAV_UserArgs_MT128x256x32_MI16x16x1_SN_LDSB1_CLR1_GSU0_GSUC0_GSUWGMRR0_K1_LBSPPA256_LBSPPB512_MIWT4_8_PLR1_SU0_SUM0_SUS64_VWA4_VWB8_WGM1_WGMXCC1_WGMXCCGn1
    SolutionIndex: 3
    SolutionNameMin: Cijk_Alik_Bljk_BSS_BH_Bias_HAS_SAV_UserArgs_MT128x256x32_MI16x16x1_SN_LDSB1_CLR1_GSU0_GSUC0_GSUWGMRR0_K1_LBSPPA256_LBSPPB512_MIWT4_8_PLR1_SU0_SUM0_SUS64_VWA4_VWB8_WGM4_WGMXCC1_WGMXCCGn1
    SolutionIndex: 4
    SolutionNameMin: Cijk_Alik_Bljk_BSS_BH_Bias_HAS_SAV_UserArgs_MT128x256x32_MI16x16x1_SN_LDSB1_CLR1_GSU0_GSUC0_GSUWGMRR0_K1_LBSPPA256_LBSPPB512_MIWT4_8_PLR1_SU0_SUM0_SUS64_VWA4_VWB8_WGM4_WGMXCC1_WGMXCCGn1
    SolutionIndex: 5
    SolutionNameMin: Cijk_Alik_Bljk_BSS_BH_Bias_HAS_SAV_UserArgs_MT128x256x32_MI16x16x1_SN_LDSB1_CLR1_GSU0_GSUC0_GSUWGMRR0_K1_LBSPPA256_LBSPPB512_MIWT4_8_PLR1_SU0_SUM0_SUS64_VWA4_VWB8_WGM4_WGMXCC1_WGMXCCGn1
    SolutionIndex: 6
    SolutionNameMin: Cijk_Alik_Bljk_BSS_BH_Bias_HAS_SAV_UserArgs_MT128x256x32_MI16x16x1_SN_LDSB1_CLR1_GSU0_GSUC0_GSUWGMRR0_K1_LBSPPA256_LBSPPB512_MIWT4_8_PLR1_SU0_SUM0_SUS64_VWA4_VWB8_WGM6_WGMXCC1_WGMXCCGn1
    SolutionIndex: 7
    SolutionNameMin: Cijk_Alik_Bljk_BSS_BH_Bias_HAS_SAV_UserArgs_MT128x256x32_MI16x16x1_SN_LDSB1_CLR1_GSU0_GSUC0_GSUWGMRR0_K1_LBSPPA256_LBSPPB512_MIWT4_8_PLR1_SU0_SUM0_SUS64_VWA4_VWB8_WGM8_WGMXCC1_WGMXCCGn1
    SolutionIndex: 8
    SolutionNameMin: Cijk_Alik_Bljk_BSS_BH_Bias_HAS_SAV_UserArgs_MT128x128x32_MI16x16x1_SN_LDSB1_CLR1_GSU0_GSUC0_GSUWGMRR0_K1_LBSPPA256_LBSPPB256_MIWT4_4_PLR1_SU0_SUM0_SUS64_VWA4_VWB4_WGM1_WGMXCC1_WGMXCCGn1
    SolutionIndex: 9
    SolutionNameMin: Cijk_Alik_Bljk_BSS_BH_Bias_HAS_SAV_UserArgs_MT128x128x32_MI16x16x1_SN_LDSB1_CLR1_GSU0_GSUC0_GSUWGMRR0_K1_LBSPPA256_LBSPPB256_MIWT4_4_PLR1_SU0_SUM0_SUS64_VWA4_VWB4_WGM1_WGMXCC1_WGMXCCGn1
    SolutionIndex: 10
    SolutionNameMin: Cijk_Alik_Bljk_BSS_BH_Bias_HAS_SAV_UserArgs_MT128x128x32_MI16x16x1_SN_LDSB1_CLR1_GSU0_GSUC0_GSUWGMRR0_K1_LBSPPA256_LBSPPB256_MIWT4_4_PLR1_SU0_SUM0_SUS64_VWA4_VWB4_WGM4_WGMXCC1_WGMXCCGn1
    SolutionIndex: 11
    SolutionNameMin: Cijk_Alik_Bljk_BSS_BH_Bias_HAS_SAV_UserArgs_MT128x128x32_MI16x16x1_SN_LDSB1_CLR1_GSU0_GSUC0_GSUWGMRR0_K1_LBSPPA256_LBSPPB256_MIWT4_4_PLR1_SU0_SUM0_SUS64_VWA4_VWB4_WGM6_WGMXCC1_WGMXCCGn1
    SolutionIndex: 12
    SolutionNameMin: Cijk_Alik_Bljk_BSS_BH_Bias_HAS_SAV_UserArgs_MT128x128x32_MI16x16x1_SN_LDSB1_CLR1_GSU0_GSUC0_GSUWGMRR0_K1_LBSPPA256_LBSPPB256_MIWT4_4_PLR1_SU0_SUM0_SUS64_VWA4_VWB4_WGM6_WGMXCC1_WGMXCCGn1
    SolutionIndex: 13
    SolutionNameMin: Cijk_Alik_Bljk_BSS_BH_Bias_HAS_SAV_UserArgs_MT128x128x32_MI16x16x1_SN_LDSB1_CLR1_GSU0_GSUC0_GSUWGMRR0_K1_LBSPPA256_LBSPPB256_MIWT4_4_PLR1_SU0_SUM0_SUS64_VWA4_VWB4_WGM8_WGMXCC1_WGMXCCGn1
    SolutionIndex: 14
    SolutionNameMin: Cijk_Alik_Bljk_BSS_BH_Bias_HAS_SAV_UserArgs_MT128x256x64_MI16x16x1_SN_LDSB1_CLR1_GSU0_GSUC0_GSUWGMRR0_K1_LBSPPA512_LBSPPB1024_MIWT4_8_PLR1_SU0_SUM0_SUS128_VWA4_VWB8_WGM1_WGMXCC1_WGMXCCGn1
    SolutionIndex: 15
    SolutionNameMin: Cijk_Alik_Bljk_BSS_BH_Bias_HAS_SAV_UserArgs_MT128x256x64_MI16x16x1_SN_LDSB1_CLR1_GSU0_GSUC0_GSUWGMRR0_K1_LBSPPA512_LBSPPB1024_MIWT4_8_PLR1_SU0_SUM0_SUS128_VWA4_VWB8_WGM1_WGMXCC1_WGMXCCGn1
    SolutionIndex: 16
    SolutionNameMin: Cijk_Alik_Bljk_BSS_BH_Bias_HAS_SAV_UserArgs_MT128x256x64_MI16x16x1_SN_LDSB1_CLR1_GSU0_GSUC0_GSUWGMRR0_K1_LBSPPA512_LBSPPB1024_MIWT4_8_PLR1_SU0_SUM0_SUS128_VWA4_VWB8_WGM1_WGMXCC1_WGMXCCGn1
    SolutionIndex: 17
    SolutionNameMin: Cijk_Alik_Bljk_BSS_BH_Bias_HAS_SAV_UserArgs_MT128x256x64_MI16x16x1_SN_LDSB1_CLR1_GSU0_GSUC0_GSUWGMRR0_K1_LBSPPA512_LBSPPB1024_MIWT4_8_PLR1_SU0_SUM0_SUS128_VWA4_VWB8_WGM4_WGMXCC1_WGMXCCGn1
    SolutionIndex: 18
    SolutionNameMin: Cijk_Alik_Bljk_BSS_BH_Bias_HAS_SAV_UserArgs_MT128x256x64_MI16x16x1_SN_LDSB1_CLR1_GSU0_GSUC0_GSUWGMRR0_K1_LBSPPA512_LBSPPB1024_MIWT4_8_PLR1_SU0_SUM0_SUS128_VWA4_VWB8_WGM4_WGMXCC1_WGMXCCGn1
    SolutionIndex: 19
    SolutionNameMin: Cijk_Alik_Bljk_BSS_BH_Bias_HAS_SAV_UserArgs_MT128x256x64_MI16x16x1_SN_LDSB1_CLR1_GSU0_GSUC0_GSUWGMRR0_K1_LBSPPA512_LBSPPB1024_MIWT4_8_PLR1_SU0_SUM0_SUS128_VWA4_VWB8_WGM4_WGMXCC1_WGMXCCGn1
    SolutionIndex: 20
    SolutionNameMin: Cijk_Alik_Bljk_BSS_BH_Bias_HAS_SAV_UserArgs_MT128x256x64_MI16x16x1_SN_LDSB1_CLR1_GSU0_GSUC0_GSUWGMRR0_K1_LBSPPA512_LBSPPB1024_MIWT4_8_PLR1_SU0_SUM0_SUS128_VWA4_VWB8_WGM6_WGMXCC1_WGMXCCGn1
    SolutionIndex: 21
    SolutionNameMin: Cijk_Alik_Bljk_BSS_BH_Bias_HAS_SAV_UserArgs_MT128x256x64_MI16x16x1_SN_LDSB1_CLR1_GSU0_GSUC0_GSUWGMRR0_K1_LBSPPA512_LBSPPB1024_MIWT4_8_PLR1_SU0_SUM0_SUS128_VWA4_VWB8_WGM6_WGMXCC1_WGMXCCGn1
    SolutionIndex: 22
    SolutionNameMin: Cijk_Alik_Bljk_BSS_BH_Bias_HAS_SAV_UserArgs_MT128x256x64_MI16x16x1_SN_LDSB1_CLR1_GSU0_GSUC0_GSUWGMRR0_K1_LBSPPA512_LBSPPB1024_MIWT4_8_PLR1_SU0_SUM0_SUS128_VWA4_VWB8_WGM6_WGMXCC1_WGMXCCGn1
    SolutionIndex: 23
    SolutionNameMin: Cijk_Alik_Bljk_BSS_BH_Bias_HAS_SAV_UserArgs_MT128x256x64_MI16x16x1_SN_LDSB1_CLR1_GSU0_GSUC0_GSUWGMRR0_K1_LBSPPA512_LBSPPB1024_MIWT4_8_PLR1_SU0_SUM0_SUS128_VWA4_VWB8_WGM8_WGMXCC1_WGMXCCGn1
    SolutionIndex: 24
    SolutionNameMin: Cijk_Alik_Bljk_BSS_BH_Bias_HAS_SAV_UserArgs_MT128x256x64_MI16x16x1_SN_LDSB1_CLR1_GSU0_GSUC0_GSUWGMRR0_K1_LBSPPA512_LBSPPB1024_MIWT4_8_PLR1_SU0_SUM0_SUS128_VWA4_VWB8_WGM8_WGMXCC1_WGMXCCGn1
    SolutionIndex: 25
    SolutionNameMin: Cijk_Alik_Bljk_BSS_BH_Bias_HAS_SAV_UserArgs_MT256x128x64_MI16x16x1_SN_LDSB1_CLR1_GSU0_GSUC0_GSUWGMRR0_K1_LBSPPA1024_LBSPPB512_MIWT8_4_PLR1_SU0_SUM0_SUS128_VWA8_VWB4_WGM6_WGMXCC1_WGMXCCGn1
    SolutionIndex: 26
    SolutionNameMin: Cijk_Alik_Bljk_BSS_BH_Bias_HAS_SAV_UserArgs_MT128x128x64_MI16x16x1_SN_LDSB1_CLR1_GSU0_GSUC0_GSUWGMRR0_K1_LBSPPA512_LBSPPB512_MIWT4_4_PLR1_SU0_SUM0_SUS128_VWA4_VWB4_WGM1_WGMXCC1_WGMXCCGn1
    SolutionIndex: 27
    SolutionNameMin: Cijk_Alik_Bljk_BSS_BH_Bias_HAS_SAV_UserArgs_MT128x128x64_MI16x16x1_SN_LDSB1_CLR1_GSU0_GSUC0_GSUWGMRR0_K1_LBSPPA512_LBSPPB512_MIWT4_4_PLR1_SU0_SUM0_SUS128_VWA4_VWB4_WGM1_WGMXCC1_WGMXCCGn1
    SolutionIndex: 28
    SolutionNameMin: Cijk_Alik_Bljk_BSS_BH_Bias_HAS_SAV_UserArgs_MT128x128x64_MI16x16x1_SN_LDSB1_CLR1_GSU0_GSUC0_GSUWGMRR0_K1_LBSPPA512_LBSPPB512_MIWT4_4_PLR1_SU0_SUM0_SUS128_VWA4_VWB4_WGM4_WGMXCC1_WGMXCCGn1
    SolutionIndex: 29
    SolutionNameMin: Cijk_Alik_Bljk_BSS_BH_Bias_HAS_SAV_UserArgs_MT128x128x64_MI16x16x1_SN_LDSB1_CLR1_GSU0_GSUC0_GSUWGMRR0_K1_LBSPPA512_LBSPPB512_MIWT4_4_PLR1_SU0_SUM0_SUS128_VWA4_VWB4_WGM6_WGMXCC1_WGMXCCGn1
    SolutionIndex: 30
    SolutionNameMin: Cijk_Alik_Bljk_BSS_BH_Bias_HAS_SAV_UserArgs_MT128x128x64_MI16x16x1_SN_LDSB1_CLR1_GSU0_GSUC0_GSUWGMRR0_K1_LBSPPA512_LBSPPB512_MIWT4_4_PLR1_SU0_SUM0_SUS128_VWA4_VWB4_WGM6_WGMXCC1_WGMXCCGn1
    SolutionIndex: 31
    SolutionNameMin: Cijk_Alik_Bljk_BSS_BH_Bias_HAS_SAV_UserArgs_MT128x128x64_MI16x16x1_SN_LDSB1_CLR1_GSU0_GSUC0_GSUWGMRR0_K1_LBSPPA512_LBSPPB512_MIWT4_4_PLR1_SU0_SUM0_SUS128_VWA4_VWB4_WGM8_WGMXCC1_WGMXCCGn1
    SolutionIndex: 32
    SolutionNameMin: Cijk_Alik_Bljk_BSS_BH_Bias_HAS_SAV_UserArgs_MT128x128x64_MI16x16x1_SN_LDSB1_CLR1_GSU0_GSUC0_GSUWGMRR0_K1_LBSPPA512_LBSPPB512_MIWT4_4_PLR1_SU0_SUM0_SUS128_VWA4_VWB4_WGM8_WGMXCC1_WGMXCCGn1
    SolutionIndex: 33
    SolutionNameMin: Cijk_Alik_Bljk_BSS_BH_Bias_HAS_SAV_UserArgs_MT64x128x64_MI16x16x1_SN_LDSB1_CLR1_GSU0_GSUC0_GSUWGMRR0_K1_LBSPPA256_LBSPPB512_MIWT2_4_PLR1_SU0_SUM0_SUS128_VWA2_VWB4_WGM1_WGMXCC1_WGMXCCGn1
    SolutionIndex: 34
    SolutionNameMin: Cijk_Alik_Bljk_BSS_BH_Bias_HAS_SAV_UserArgs_MT64x128x64_MI16x16x1_SN_LDSB1_CLR1_GSU0_GSUC0_GSUWGMRR0_K1_LBSPPA256_LBSPPB512_MIWT2_4_PLR1_SU0_SUM0_SUS128_VWA2_VWB4_WGM4_WGMXCC1_WGMXCCGn1
    SolutionIndex: 35
    SolutionNameMin: Cijk_Alik_Bljk_BSS_BH_Bias_HAS_SAV_UserArgs_MT64x128x64_MI16x16x1_SN_LDSB1_CLR1_GSU0_GSUC0_GSUWGMRR0_K1_LBSPPA256_LBSPPB512_MIWT2_4_PLR1_SU0_SUM0_SUS128_VWA2_VWB4_WGM6_WGMXCC1_WGMXCCGn1
    SolutionIndex: 36
    SolutionNameMin: Cijk_Alik_Bljk_BSS_BH_Bias_HAS_SAV_UserArgs_MT64x128x64_MI16x16x1_SN_LDSB1_CLR1_GSU0_GSUC0_GSUWGMRR0_K1_LBSPPA256_LBSPPB512_MIWT2_4_PLR1_SU0_SUM0_SUS128_VWA2_VWB4_WGM6_WGMXCC1_WGMXCCGn1
    SolutionIndex: 37
    SolutionNameMin: Cijk_Alik_Bljk_BSS_BH_Bias_HAS_SAV_UserArgs_MT128x64x64_MI16x16x1_SN_LDSB1_CLR1_GSU0_GSUC0_GSUWGMRR0_K1_LBSPPA512_LBSPPB256_MIWT4_2_PLR1_SU0_SUM0_SUS128_VWA4_VWB2_WGM1_WGMXCC1_WGMXCCGn1
    SolutionIndex: 38
    SolutionNameMin: Cijk_Alik_Bljk_BSS_BH_Bias_HAS_SAV_UserArgs_MT128x64x64_MI16x16x1_SN_LDSB1_CLR1_GSU0_GSUC0_GSUWGMRR0_K1_LBSPPA512_LBSPPB256_MIWT4_2_PLR1_SU0_SUM0_SUS128_VWA4_VWB2_WGM1_WGMXCC1_WGMXCCGn1
    SolutionIndex: 39
    SolutionNameMin: Cijk_Alik_Bljk_BSS_BH_Bias_HAS_SAV_UserArgs_MT128x64x64_MI16x16x1_SN_LDSB1_CLR1_GSU0_GSUC0_GSUWGMRR0_K1_LBSPPA512_LBSPPB256_MIWT4_2_PLR1_SU0_SUM0_SUS128_VWA4_VWB2_WGM1_WGMXCC1_WGMXCCGn1
    SolutionIndex: 40
    SolutionNameMin: Cijk_Alik_Bljk_BSS_BH_Bias_HAS_SAV_UserArgs_MT128x64x64_MI16x16x1_SN_LDSB1_CLR1_GSU0_GSUC0_GSUWGMRR0_K1_LBSPPA512_LBSPPB256_MIWT4_2_PLR1_SU0_SUM0_SUS128_VWA4_VWB2_WGM4_WGMXCC1_WGMXCCGn1
    SolutionIndex: 41
    SolutionNameMin: Cijk_Alik_Bljk_BSS_BH_Bias_HAS_SAV_UserArgs_MT128x64x64_MI16x16x1_SN_LDSB1_CLR1_GSU0_GSUC0_GSUWGMRR0_K1_LBSPPA512_LBSPPB256_MIWT4_2_PLR1_SU0_SUM0_SUS128_VWA4_VWB2_WGM4_WGMXCC1_WGMXCCGn1
    SolutionIndex: 42
    SolutionNameMin: Cijk_Alik_Bljk_BSS_BH_Bias_HAS_SAV_UserArgs_MT128x64x64_MI16x16x1_SN_LDSB1_CLR1_GSU0_GSUC0_GSUWGMRR0_K1_LBSPPA512_LBSPPB256_MIWT4_2_PLR1_SU0_SUM0_SUS128_VWA4_VWB2_WGM6_WGMXCC1_WGMXCCGn1
    SolutionIndex: 43
    SolutionNameMin: Cijk_Alik_Bljk_BSS_BH_Bias_HAS_SAV_UserArgs_MT128x64x64_MI16x16x1_SN_LDSB1_CLR1_GSU0_GSUC0_GSUWGMRR0_K1_LBSPPA512_LBSPPB256_MIWT4_2_PLR1_SU0_SUM0_SUS128_VWA4_VWB2_WGM8_WGMXCC1_WGMXCCGn1
    SolutionIndex: 44
    SolutionNameMin: Cijk_Alik_Bljk_BSS_BH_Bias_HAS_SAV_UserArgs_MT64x128x128_MI16x16x1_SN_LDSB1_CLR1_GSU0_GSUC0_GSUWGMRR0_K1_LBSPPA512_LBSPPB1024_MIWT2_4_PLR1_SU0_SUM0_SUS256_VWA2_VWB4_WGM1_WGMXCC1_WGMXCCGn1
    SolutionIndex: 45
    SolutionNameMin: Cijk_Alik_Bljk_BSS_BH_Bias_HAS_SAV_UserArgs_MT64x128x128_MI16x16x1_SN_LDSB1_CLR1_GSU0_GSUC0_GSUWGMRR0_K1_LBSPPA512_LBSPPB1024_MIWT2_4_PLR1_SU0_SUM0_SUS256_VWA2_VWB4_WGM1_WGMXCC1_WGMXCCGn1
    SolutionIndex: 46
    SolutionNameMin: Cijk_Alik_Bljk_BSS_BH_Bias_HAS_SAV_UserArgs_MT64x128x128_MI16x16x1_SN_LDSB1_CLR1_GSU0_GSUC0_GSUWGMRR0_K1_LBSPPA512_LBSPPB1024_MIWT2_4_PLR1_SU0_SUM0_SUS256_VWA2_VWB4_WGM4_WGMXCC1_WGMXCCGn1
    SolutionIndex: 47
    SolutionNameMin: Cijk_Alik_Bljk_BSS_BH_Bias_HAS_SAV_UserArgs_MT64x128x128_MI16x16x1_SN_LDSB1_CLR1_GSU0_GSUC0_GSUWGMRR0_K1_LBSPPA512_LBSPPB1024_MIWT2_4_PLR1_SU0_SUM0_SUS256_VWA2_VWB4_WGM4_WGMXCC1_WGMXCCGn1
    SolutionIndex: 48
    SolutionNameMin: Cijk_Alik_Bljk_BSS_BH_Bias_HAS_SAV_UserArgs_MT64x128x128_MI16x16x1_SN_LDSB1_CLR1_GSU0_GSUC0_GSUWGMRR0_K1_LBSPPA512_LBSPPB1024_MIWT2_4_PLR1_SU0_SUM0_SUS256_VWA2_VWB4_WGM6_WGMXCC1_WGMXCCGn1
    SolutionIndex: 49
    SolutionNameMin: Cijk_Alik_Bljk_BSS_BH_Bias_HAS_SAV_UserArgs_MT128x64x128_MI16x16x1_SN_LDSB1_CLR1_GSU0_GSUC0_GSUWGMRR0_K1_LBSPPA1024_LBSPPB512_MIWT4_2_PLR1_SU0_SUM0_SUS256_VWA4_VWB2_WGM1_WGMXCC1_WGMXCCGn1
    SolutionIndex: 50
    SolutionNameMin: Cijk_Alik_Bljk_BSS_BH_Bias_HAS_SAV_UserArgs_MT128x64x128_MI16x16x1_SN_LDSB1_CLR1_GSU0_GSUC0_GSUWGMRR0_K1_LBSPPA1024_LBSPPB512_MIWT4_2_PLR1_SU0_SUM0_SUS256_VWA4_VWB2_WGM4_WGMXCC1_WGMXCCGn1
    SolutionIndex: 51
    SolutionNameMin: Cijk_Alik_Bljk_BSS_BH_Bias_HAS_SAV_UserArgs_MT128x64x128_MI16x16x1_SN_LDSB1_CLR1_GSU0_GSUC0_GSUWGMRR0_K1_LBSPPA1024_LBSPPB512_MIWT4_2_PLR1_SU0_SUM0_SUS256_VWA4_VWB2_WGM6_WGMXCC1_WGMXCCGn1
    SolutionIndex: 52
    SolutionNameMin: Cijk_Alik_Bljk_BSS_BH_Bias_HAS_SAV_UserArgs_MT128x64x128_MI16x16x1_SN_LDSB1_CLR1_GSU0_GSUC0_GSUWGMRR0_K1_LBSPPA1024_LBSPPB512_MIWT4_2_PLR1_SU0_SUM0_SUS256_VWA4_VWB2_WGM8_WGMXCC1_WGMXCCGn1
    SolutionIndex: 53
    SolutionNameMin: Cijk_Alik_Bljk_BSS_BH_Bias_HAS_SAV_UserArgs_MT64x64x128_MI16x16x1_SN_LDSB1_CLR1_GSU0_GSUC0_GSUWGMRR0_K1_LBSPPA512_LBSPPB512_MIWT2_2_PLR1_SU0_SUM0_SUS256_VWA2_VWB2_WGM1_WGMXCC1_WGMXCCGn1
    SolutionIndex: 54
    SolutionNameMin: Cijk_Alik_Bljk_BSS_BH_Bias_HAS_SAV_UserArgs_MT64x64x128_MI16x16x1_SN_LDSB1_CLR1_GSU0_GSUC0_GSUWGMRR0_K1_LBSPPA512_LBSPPB512_MIWT2_2_PLR1_SU0_SUM0_SUS256_VWA2_VWB2_WGM1_WGMXCC1_WGMXCCGn1
    SolutionIndex: 55
    SolutionNameMin: Cijk_Alik_Bljk_BSS_BH_Bias_HAS_SAV_UserArgs_MT64x64x128_MI16x16x1_SN_LDSB1_CLR1_GSU0_GSUC0_GSUWGMRR0_K1_LBSPPA512_LBSPPB512_MIWT2_2_PLR1_SU0_SUM0_SUS256_VWA2_VWB2_WGM4_WGMXCC1_WGMXCCGn1
    SolutionIndex: 56
    SolutionNameMin: Cijk_Alik_Bljk_BSS_BH_Bias_HAS_SAV_UserArgs_MT64x64x128_MI16x16x1_SN_LDSB1_CLR1_GSU0_GSUC0_GSUWGMRR0_K1_LBSPPA512_LBSPPB512_MIWT2_2_PLR1_SU0_SUM0_SUS256_VWA2_VWB2_WGM4_WGMXCC1_WGMXCCGn1
    SolutionIndex: 57
    SolutionNameMin: Cijk_Alik_Bljk_BSS_BH_Bias_HAS_SAV_UserArgs_MT64x64x128_MI16x16x1_SN_LDSB1_CLR1_GSU0_GSUC0_GSUWGMRR0_K1_LBSPPA512_LBSPPB512_MIWT2_2_PLR1_SU0_SUM0_SUS256_VWA2_VWB2_WGM6_WGMXCC1_WGMXCCGn1
    SolutionIndex: 58
    SolutionNameMin: Cijk_Alik_Bljk_BSS_BH_Bias_HAS_SAV_UserArgs_MT64x64x128_MI16x16x1_SN_LDSB1_CLR1_GSU0_GSUC0_GSUWGMRR0_K1_LBSPPA512_LBSPPB512_MIWT2_2_PLR1_SU0_SUM0_SUS256_VWA2_VWB2_WGM6_WGMXCC1_WGMXCCGn1
    SolutionIndex: 59
    SolutionNameMin: Cijk_Alik_Bljk_BSS_BH_Bias_HAS_SAV_UserArgs_MT64x64x128_MI16x16x1_SN_LDSB1_CLR1_GSU0_GSUC0_GSUWGMRR0_K1_LBSPPA512_LBSPPB512_MIWT2_2_PLR1_SU0_SUM0_SUS256_VWA2_VWB2_WGM8_WGMXCC1_WGMXCCGn1
    SolutionIndex: 60
    SolutionNameMin: Cijk_Alik_Bljk_BSS_BH_Bias_HAS_SAV_UserArgs_MT32x64x128_MI16x16x1_SN_LDSB1_CLR1_GSU0_GSUC0_GSUWGMRR0_K1_LBSPPA256_LBSPPB512_MIWT1_2_PLR1_SU0_SUM0_SUS256_VWA1_VWB2_WGM1_WGMXCC1_WGMXCCGn1
    SolutionIndex: 61
    SolutionNameMin: Cijk_Alik_Bljk_BSS_BH_Bias_HAS_SAV_UserArgs_MT32x64x128_MI16x16x1_SN_LDSB1_CLR1_GSU0_GSUC0_GSUWGMRR0_K1_LBSPPA256_LBSPPB512_MIWT1_2_PLR1_SU0_SUM0_SUS256_VWA1_VWB2_WGM1_WGMXCC1_WGMXCCGn1
    SolutionIndex: 62
    SolutionNameMin: Cijk_Alik_Bljk_BSS_BH_Bias_HAS_SAV_UserArgs_MT32x64x128_MI16x16x1_SN_LDSB1_CLR1_GSU0_GSUC0_GSUWGMRR0_K1_LBSPPA256_LBSPPB512_MIWT1_2_PLR1_SU0_SUM0_SUS256_VWA1_VWB2_WGM1_WGMXCC1_WGMXCCGn1
    SolutionIndex: 63
    SolutionNameMin: Cijk_Alik_Bljk_BSS_BH_Bias_HAS_SAV_UserArgs_MT32x64x128_MI16x16x1_SN_LDSB1_CLR1_GSU0_GSUC0_GSUWGMRR0_K1_LBSPPA256_LBSPPB512_MIWT1_2_PLR1_SU0_SUM0_SUS256_VWA1_VWB2_WGM4_WGMXCC1_WGMXCCGn1
    SolutionIndex: 64
    SolutionNameMin: Cijk_Alik_Bljk_BSS_BH_Bias_HAS_SAV_UserArgs_MT32x64x128_MI16x16x1_SN_LDSB1_CLR1_GSU0_GSUC0_GSUWGMRR0_K1_LBSPPA256_LBSPPB512_MIWT1_2_PLR1_SU0_SUM0_SUS256_VWA1_VWB2_WGM4_WGMXCC1_WGMXCCGn1
    SolutionIndex: 65
    SolutionNameMin: Cijk_Alik_Bljk_BSS_BH_Bias_HAS_SAV_UserArgs_MT32x64x128_MI16x16x1_SN_LDSB1_CLR1_GSU0_GSUC0_GSUWGMRR0_K1_LBSPPA256_LBSPPB512_MIWT1_2_PLR1_SU0_SUM0_SUS256_VWA1_VWB2_WGM4_WGMXCC1_WGMXCCGn1
    SolutionIndex: 66
    SolutionNameMin: Cijk_Alik_Bljk_BSS_BH_Bias_HAS_SAV_UserArgs_MT32x64x128_MI16x16x1_SN_LDSB1_CLR1_GSU0_GSUC0_GSUWGMRR0_K1_LBSPPA256_LBSPPB512_MIWT1_2_PLR1_SU0_SUM0_SUS256_VWA1_VWB2_WGM6_WGMXCC1_WGMXCCGn1
    SolutionIndex: 67
    SolutionNameMin: Cijk_Alik_Bljk_BSS_BH_Bias_HAS_SAV_UserArgs_MT32x64x128_MI16x16x1_SN_LDSB1_CLR1_GSU0_GSUC0_GSUWGMRR0_K1_LBSPPA256_LBSPPB512_MIWT1_2_PLR1_SU0_SUM0_SUS256_VWA1_VWB2_WGM6_WGMXCC1_WGMXCCGn1
    SolutionIndex: 68
    SolutionNameMin: Cijk_Alik_Bljk_BSS_BH_Bias_HAS_SAV_UserArgs_MT32x64x128_MI16x16x1_SN_LDSB1_CLR1_GSU0_GSUC0_GSUWGMRR0_K1_LBSPPA256_LBSPPB512_MIWT1_2_PLR1_SU0_SUM0_SUS256_VWA1_VWB2_WGM6_WGMXCC1_WGMXCCGn1
    SolutionIndex: 69
    SolutionNameMin: Cijk_Alik_Bljk_BSS_BH_Bias_HAS_SAV_UserArgs_MT32x64x128_MI16x16x1_SN_LDSB1_CLR1_GSU0_GSUC0_GSUWGMRR0_K1_LBSPPA256_LBSPPB512_MIWT1_2_PLR1_SU0_SUM0_SUS256_VWA1_VWB2_WGM8_WGMXCC1_WGMXCCGn1
    SolutionIndex: 70
    SolutionNameMin: Cijk_Alik_Bljk_BSS_BH_Bias_HAS_SAV_UserArgs_MT32x64x128_MI16x16x1_SN_LDSB1_CLR1_GSU0_GSUC0_GSUWGMRR0_K1_LBSPPA256_LBSPPB512_MIWT1_2_PLR1_SU0_SUM0_SUS256_VWA1_VWB2_WGM8_WGMXCC1_WGMXCCGn1
    SolutionIndex: 71
    SolutionNameMin: Cijk_Alik_Bljk_BSS_BH_Bias_HAS_SAV_UserArgs_MT64x32x128_MI16x16x1_SN_LDSB1_CLR1_GSU0_GSUC0_GSUWGMRR0_K1_LBSPPA512_LBSPPB256_MIWT2_1_PLR1_SU0_SUM0_SUS256_VWA2_VWB1_WGM1_WGMXCC1_WGMXCCGn1
    SolutionIndex: 72
    SolutionNameMin: Cijk_Alik_Bljk_BSS_BH_Bias_HAS_SAV_UserArgs_MT64x32x128_MI16x16x1_SN_LDSB1_CLR1_GSU0_GSUC0_GSUWGMRR0_K1_LBSPPA512_LBSPPB256_MIWT2_1_PLR1_SU0_SUM0_SUS256_VWA2_VWB1_WGM1_WGMXCC1_WGMXCCGn1
    SolutionIndex: 73
    SolutionNameMin: Cijk_Alik_Bljk_BSS_BH_Bias_HAS_SAV_UserArgs_MT32x32x128_MI16x16x1_SN_LDSB1_CLR1_GSU0_GSUC0_GSUWGMRR0_K1_LBSPPA256_LBSPPB256_MIWT1_1_PLR1_SU0_SUM0_SUS256_VWA1_VWB1_WGM1_WGMXCC1_WGMXCCGn1
    SolutionIndex: 74
    SolutionNameMin: Cijk_Alik_Bljk_BSS_BH_Bias_HAS_SAV_UserArgs_MT32x32x128_MI16x16x1_SN_LDSB1_CLR1_GSU0_GSUC0_GSUWGMRR0_K1_LBSPPA256_LBSPPB256_MIWT1_1_PLR1_SU0_SUM0_SUS256_VWA1_VWB1_WGM1_WGMXCC1_WGMXCCGn1
    SolutionIndex: 75
    SolutionNameMin: Cijk_Alik_Bljk_BSS_BH_Bias_HAS_SAV_UserArgs_MT32x32x128_MI16x16x1_SN_LDSB1_CLR1_GSU0_GSUC0_GSUWGMRR0_K1_LBSPPA256_LBSPPB256_MIWT1_1_PLR1_SU0_SUM0_SUS256_VWA1_VWB1_WGM1_WGMXCC1_WGMXCCGn1
    SolutionIndex: 76
    SolutionNameMin: Cijk_Alik_Bljk_BSS_BH_Bias_HAS_SAV_UserArgs_MT32x32x128_MI16x16x1_SN_LDSB1_CLR1_GSU0_GSUC0_GSUWGMRR0_K1_LBSPPA256_LBSPPB256_MIWT1_1_PLR1_SU0_SUM0_SUS256_VWA1_VWB1_WGM1_WGMXCC1_WGMXCCGn1
    SolutionIndex: 77
    SolutionNameMin: Cijk_Alik_Bljk_BSS_BH_Bias_HAS_SAV_UserArgs_MT32x32x128_MI16x16x1_SN_LDSB1_CLR1_GSU0_GSUC0_GSUWGMRR0_K1_LBSPPA256_LBSPPB256_MIWT1_1_PLR1_SU0_SUM0_SUS256_VWA1_VWB1_WGM1_WGMXCC1_WGMXCCGn1
    SolutionIndex: 78
    SolutionNameMin: Cijk_Alik_Bljk_BSS_BH_Bias_HAS_SAV_UserArgs_MT32x32x128_MI16x16x1_SN_LDSB1_CLR1_GSU0_GSUC0_GSUWGMRR0_K1_LBSPPA256_LBSPPB256_MIWT1_1_PLR1_SU0_SUM0_SUS256_VWA1_VWB1_WGM4_WGMXCC1_WGMXCCGn1
    SolutionIndex: 79
    SolutionNameMin: Cijk_Alik_Bljk_BSS_BH_Bias_HAS_SAV_UserArgs_MT32x32x128_MI16x16x1_SN_LDSB1_CLR1_GSU0_GSUC0_GSUWGMRR0_K1_LBSPPA256_LBSPPB256_MIWT1_1_PLR1_SU0_SUM0_SUS256_VWA1_VWB1_WGM4_WGMXCC1_WGMXCCGn1
    SolutionIndex: 80
    SolutionNameMin: Cijk_Alik_Bljk_BSS_BH_Bias_HAS_SAV_UserArgs_MT32x32x128_MI16x16x1_SN_LDSB1_CLR1_GSU0_GSUC0_GSUWGMRR0_K1_LBSPPA256_LBSPPB256_MIWT1_1_PLR1_SU0_SUM0_SUS256_VWA1_VWB1_WGM4_WGMXCC1_WGMXCCGn1
    SolutionIndex: 81
    SolutionNameMin: Cijk_Alik_Bljk_BSS_BH_Bias_HAS_SAV_UserArgs_MT32x32x128_MI16x16x1_SN_LDSB1_CLR1_GSU0_GSUC0_GSUWGMRR0_K1_LBSPPA256_LBSPPB256_MIWT1_1_PLR1_SU0_SUM0_SUS256_VWA1_VWB1_WGM6_WGMXCC1_WGMXCCGn1
    SolutionIndex: 82
    SolutionNameMin: Cijk_Alik_Bljk_BSS_BH_Bias_HAS_SAV_UserArgs_MT32x32x128_MI16x16x1_SN_LDSB1_CLR1_GSU0_GSUC0_GSUWGMRR0_K1_LBSPPA256_LBSPPB256_MIWT1_1_PLR1_SU0_SUM0_SUS256_VWA1_VWB1_WGM6_WGMXCC1_WGMXCCGn1
    SolutionIndex: 83
    SolutionNameMin: Cijk_Alik_Bljk_BSS_BH_Bias_HAS_SAV_UserArgs_MT32x32x128_MI16x16x1_SN_LDSB1_CLR1_GSU0_GSUC0_GSUWGMRR0_K1_LBSPPA256_LBSPPB256_MIWT1_1_PLR1_SU0_SUM0_SUS256_VWA1_VWB1_WGM6_WGMXCC1_WGMXCCGn1
    SolutionIndex: 84
    SolutionNameMin: Cijk_Alik_Bljk_BSS_BH_Bias_HAS_SAV_UserArgs_MT32x32x128_MI16x16x1_SN_LDSB1_CLR1_GSU0_GSUC0_GSUWGMRR0_K1_LBSPPA256_LBSPPB256_MIWT1_1_PLR1_SU0_SUM0_SUS256_VWA1_VWB1_WGM6_WGMXCC1_WGMXCCGn1
    SolutionIndex: 85
    SolutionNameMin: Cijk_Alik_Bljk_BSS_BH_Bias_HAS_SAV_UserArgs_MT32x32x128_MI16x16x1_SN_LDSB1_CLR1_GSU0_GSUC0_GSUWGMRR0_K1_LBSPPA256_LBSPPB256_MIWT1_1_PLR1_SU0_SUM0_SUS256_VWA1_VWB1_WGM8_WGMXCC1_WGMXCCGn1
    SolutionIndex: 86
    SolutionNameMin: Cijk_Alik_Bljk_BSS_BH_Bias_HAS_SAV_UserArgs_MT32x32x128_MI16x16x1_SN_LDSB1_CLR1_GSU0_GSUC0_GSUWGMRR0_K1_LBSPPA256_LBSPPB256_MIWT1_1_PLR1_SU0_SUM0_SUS256_VWA1_VWB1_WGM8_WGMXCC1_WGMXCCGn1
    SolutionIndex: 87
    SolutionNameMin: Cijk_Alik_Bljk_BSS_BH_Bias_HAS_SAV_UserArgs_MT32x32x128_MI16x16x1_SN_LDSB1_CLR1_GSU0_GSUC0_GSUWGMRR0_K1_LBSPPA256_LBSPPB256_MIWT1_1_PLR1_SU0_SUM0_SUS256_VWA1_VWB1_WGM8_WGMXCC1_WGMXCCGn1
    SolutionIndex: 88
    SolutionNameMin: Cijk_Alik_Bljk_BSS_BH_Bias_HAS_SAV_UserArgs_MT32x32x32_MI16x16x1_SN_LDSB0_CLR0_GSU0_GSUC0_GSUWGMRR0_K1_LBSPPA128_LBSPPB128_MIWT1_1_PLR0_SU0_SUM0_SUS64_VWA1_VWB1_WGM1_WGMXCC1_WGMXCCGn1
- - - [128, 128, 1, 128, 128, 128, 128, 128]
    - [77, 0.49]
  - - [128, 128, 1, 256, 128, 128, 256, 256]
    - [77, 0.88]
  - - [128, 128, 1, 512, 128, 128, 512, 512]
    - [77, 1.48]
  - - [128, 128, 1, 1024, 128, 128, 1024, 1024]
    - [77, 2.26]
  - - [128, 128, 1, 2048, 128, 128, 2048, 2048]
    - [74, 3.03]
  - - [128, 128, 1, 4096, 128, 128, 4096, 4096]
    - [74, 3.9]
  - - [128, 128, 1, 8192, 128, 128, 8192, 8192]
    - [74, 4.56]
  - - [128, 256, 1, 128, 128, 128, 128, 128]
    - [77, 1.0]
  - - [128, 256, 1, 256, 128, 128, 256, 256]
    - [77, 1.76]
  - - [128, 256, 1, 512, 128, 128, 512, 512]
    - [77, 3.01]
  - - [128, 256, 1, 1024, 128, 128, 1024, 1024]
    - [77, 4.52]
  - - [128, 256, 1, 2048, 128, 128, 2048, 2048]
    - [74, 6.14]
  - - [128, 256, 1, 4096, 128, 128, 4096, 4096]
    - [74, 7.76]
  - - [128, 256, 1, 8192, 128, 128, 8192, 8192]
    - [78, 8.95]
  - - [128, 512, 1, 128, 128, 128, 128, 128]
    - [77, 1.92]
  - - [128, 512, 1, 256, 128, 128, 256, 256]
    - [77, 3.46]
  - - [128, 512, 1, 512, 128, 128, 512, 512]
    - [77, 5.84]
  - - [128, 512, 1, 1024, 128, 128, 1024, 1024]
    - [77, 8.76]
  - - [128, 512, 1, 2048, 128, 128, 2048, 2048]
    - [75, 12.08]
  - - [128, 512, 1, 4096, 128, 128, 4096, 4096]
    - [74, 15.13]
  - - [128, 512, 1, 8192, 128, 128, 8192, 8192]
    - [82, 17.86]
  - - [128, 1024, 1, 128, 128, 128, 128, 128]
    - [76, 3.76]
  - - [128, 1024, 1, 256, 128, 128, 256, 256]
    - [75, 6.65]
  - - [128, 1024, 1, 512, 128, 128, 512, 512]
    - [77, 11.06]
  - - [128, 1024, 1, 1024, 128, 128, 1024, 1024]
    - [77, 17.02]
  - - [128, 1024, 1, 2048, 128, 128, 2048, 2048]
    - [74, 23.05]
  - - [128, 1024, 1, 4096, 128, 128, 4096, 4096]
    - [75, 29.18]
  - - [128, 1024, 1, 8192, 128, 128, 8192, 8192]
    - [77, 34.99]
  - - [128, 2048, 1, 128, 128, 128, 128, 128]
    - [72, 6.74]
  - - [128, 2048, 1, 256, 128, 128, 256, 256]
    - [60, 11.3]
  - - [128, 2048, 1, 512, 128, 128, 512, 512]
    - [72, 19.37]
  - - [128, 2048, 1, 1024, 128, 128, 1024, 1024]
    - [62, 28.69]
  - - [128, 2048, 1, 2048, 128, 128, 2048, 2048]
    - [62, 37.96]
  - - [128, 2048, 1, 4096, 128, 128, 4096, 4096]
    - [60, 47.49]
  - - [128, 2048, 1, 8192, 128, 128, 8192, 8192]
    - [60, 53.07]
  - - [128, 4096, 1, 128, 128, 128, 128, 128]
    - [54, 10.85]
  - - [128, 4096, 1, 256, 128, 128, 256, 256]
    - [54, 17.93]
  - - [128, 4096, 1, 512, 128, 128, 512, 512]
    - [54, 30.33]
  - - [128, 4096, 1, 1024, 128, 128, 1024, 1024]
    - [54, 45.59]
  - - [128, 4096, 1, 2048, 128, 128, 2048, 2048]
    - [53, 60.96]
  - - [128, 4096, 1, 4096, 128, 128, 4096, 4096]
    - [53, 68.35]
  - - [128, 4096, 1, 8192, 128, 128, 8192, 8192]
    - [53, 79.71]
  - - [128, 8192, 1, 128, 128, 128, 128, 128]
    - [49, 16.34]
  - - [128, 8192, 1, 256, 128, 128, 256, 256]
    - [49, 27.69]
  - - [128, 8192, 1, 512, 128, 128, 512, 512]
    - [49, 43.87]
  - - [128, 8192, 1, 1024, 128, 128, 1024, 1024]
    - [45, 59.14]
  - - [128, 8192, 1, 2048, 128, 128, 2048, 2048]
    - [48, 70.88]
  - - [128, 8192, 1, 4096, 128, 128, 4096, 4096]
    - [44, 86.05]
  - - [128, 8192, 1, 8192, 128, 128, 8192, 8192]
    - [48, 90.03]
  - - [256, 128, 1, 128, 256, 256, 128, 128]
    - [73, 0.94]
  - - [256, 128, 1, 256, 256, 256, 256, 256]
    - [77, 1.69]
  - - [256, 128, 1, 512, 256, 256, 512, 512]
    - [77, 2.83]
  - - [256, 128, 1, 1024, 256, 256, 1024, 1024]
    - [77, 4.43]
  - - [256, 128, 1, 2048, 256, 256, 2048, 2048]
    - [74, 6.08]
  - - [256, 128, 1, 4096, 256, 256, 4096, 4096]
    - [74, 7.74]
  - - [256, 128, 1, 8192, 256, 256, 8192, 8192]
    - [77, 8.96]
  - - [256, 256, 1, 128, 256, 256, 128, 128]
    - [84, 1.89]
  - - [256, 256, 1, 256, 256, 256, 256, 256]
    - [77, 3.34]
  - - [256, 256, 1, 512, 256, 256, 512, 512]
    - [77, 5.65]
  - - [256, 256, 1, 1024, 256, 256, 1024, 1024]
    - [77, 8.65]
  - - [256, 256, 1, 2048, 256, 256, 2048, 2048]
    - [79, 11.8]
  - - [256, 256, 1, 4096, 256, 256, 4096, 4096]
    - [78, 15.11]
  - - [256, 256, 1, 8192, 256, 256, 8192, 8192]
    - [83, 17.91]
  - - [256, 512, 1, 128, 256, 256, 128, 128]
    - [77, 3.75]
  - - [256, 512, 1, 256, 256, 256, 256, 256]
    - [77, 6.71]
  - - [256, 512, 1, 512, 256, 256, 512, 512]
    - [77, 11.1]
  - - [256, 512, 1, 1024, 256, 256, 1024, 1024]
    - [84, 16.96]
  - - [256, 512, 1, 2048, 256, 256, 2048, 2048]
    - [84, 23.43]
  - - [256, 512, 1, 4096, 256, 256, 4096, 4096]
    - [81, 29.47]
  - - [256, 512, 1, 8192, 256, 256, 8192, 8192]
    - [84, 35.48]
  - - [256, 1024, 1, 128, 256, 256, 128, 128]
    - [72, 6.59]
  - - [256, 1024, 1, 256, 256, 256, 256, 256]
    - [72, 11.07]
  - - [256, 1024, 1, 512, 256, 256, 512, 512]
    - [62, 18.76]
  - - [256, 1024, 1, 1024, 256, 256, 1024, 1024]
    - [62, 28.6]
  - - [256, 1024, 1, 2048, 256, 256, 2048, 2048]
    - [61, 38.12]
  - - [256, 1024, 1, 4096, 256, 256, 4096, 4096]
    - [77, 48.7]
  - - [256, 1024, 1, 8192, 256, 256, 8192, 8192]
    - [66, 56.81]
  - - [256, 2048, 1, 128, 256, 256, 128, 128]
    - [54, 11.08]
  - - [256, 2048, 1, 256, 256, 256, 256, 256]
    - [54, 18.84]
  - - [256, 2048, 1, 512, 256, 256, 512, 512]
    - [54, 31.78]
  - - [256, 2048, 1, 1024, 256, 256, 1024, 1024]
    - [54, 47.08]
  - - [256, 2048, 1, 2048, 256, 256, 2048, 2048]
    - [54, 63.1]
  - - [256, 2048, 1, 4096, 256, 256, 4096, 4096]
    - [54, 76.67]
  - - [256, 2048, 1, 8192, 256, 256, 8192, 8192]
    - [54, 86.16]
  - - [256, 4096, 1, 128, 256, 256, 128, 128]
    - [49, 16.63]
  - - [256, 4096, 1, 256, 256, 256, 256, 256]
    - [49, 28.03]
  - - [256, 4096, 1, 512, 256, 256, 512, 512]
    - [49, 46.23]
  - - [256, 4096, 1, 1024, 256, 256, 1024, 1024]
    - [49, 65.42]
  - - [256, 4096, 1, 2048, 256, 256, 2048, 2048]
    - [45, 80.15]
  - - [256, 4096, 1, 4096, 256, 256, 4096, 4096]
    - [49, 94.92]
  - - [256, 4096, 1, 8192, 256, 256, 8192, 8192]
    - [52, 100.72]
  - - [256, 8192, 1, 128, 256, 256, 128, 128]
    - [9, 23.12]
  - - [256, 8192, 1, 256, 256, 256, 256, 256]
    - [27, 36.76]
  - - [256, 8192, 1, 512, 256, 256, 512, 512]
    - [49, 54.06]
  - - [256, 8192, 1, 1024, 256, 256, 1024, 1024]
    - [49, 72.83]
  - - [256, 8192, 1, 2048, 256, 256, 2048, 2048]
    - [37, 94.2]
  - - [256, 8192, 1, 4096, 256, 256, 4096, 4096]
    - [49, 119.61]
  - - [256, 8192, 1, 8192, 256, 256, 8192, 8192]
    - [49, 111.24]
  - - [512, 128, 1, 128, 512, 512, 128, 128]
    - [77, 1.93]
  - - [512, 128, 1, 256, 512, 512, 256, 256]
    - [77, 3.29]
  - - [512, 128, 1, 512, 512, 512, 512, 512]
    - [77, 5.61]
  - - [512, 128, 1, 1024, 512, 512, 1024, 1024]
    - [80, 8.57]
  - - [512, 128, 1, 2048, 512, 512, 2048, 2048]
    - [85, 11.85]
  - - [512, 128, 1, 4096, 512, 512, 4096, 4096]
    - [74, 14.98]
  - - [512, 128, 1, 8192, 512, 512, 8192, 8192]
    - [74, 17.73]
  - - [512, 256, 1, 128, 512, 512, 128, 128]
    - [77, 3.62]
  - - [512, 256, 1, 256, 512, 512, 256, 256]
    - [77, 6.41]
  - - [512, 256, 1, 512, 512, 512, 512, 512]
    - [80, 10.87]
  - - [512, 256, 1, 1024, 512, 512, 1024, 1024]
    - [84, 16.83]
  - - [512, 256, 1, 2048, 512, 512, 2048, 2048]
    - [78, 23.35]
  - - [512, 256, 1, 4096, 512, 512, 4096, 4096]
    - [81, 29.62]
  - - [512, 256, 1, 8192, 512, 512, 8192, 8192]
    - [80, 35.16]
  - - [512, 512, 1, 128, 512, 512, 128, 128]
    - [71, 6.37]
  - - [512, 512, 1, 256, 512, 512, 256, 256]
    - [63, 10.89]
  - - [512, 512, 1, 512, 512, 512, 512, 512]
    - [67, 18.67]
  - - [512, 512, 1, 1024, 512, 512, 1024, 1024]
    - [65, 29.02]
  - - [512, 512, 1, 2048, 512, 512, 2048, 2048]
    - [64, 38.9]
  - - [512, 512, 1, 4096, 512, 512, 4096, 4096]
    - [87, 48.67]
  - - [512, 512, 1, 8192, 512, 512, 8192, 8192]
    - [66, 56.58]
  - - [512, 1024, 1, 128, 512, 512, 128, 128]
    - [54, 10.84]
  - - [512, 1024, 1, 256, 512, 512, 256, 256]
    - [54, 18.71]
  - - [512, 1024, 1, 512, 512, 512, 512, 512]
    - [56, 31.6]
  - - [512, 1024, 1, 1024, 512, 512, 1024, 1024]
    - [54, 48.1]
  - - [512, 1024, 1, 2048, 512, 512, 2048, 2048]
    - [54, 63.78]
  - - [512, 1024, 1, 4096, 512, 512, 4096, 4096]
    - [58, 77.95]
  - - [512, 1024, 1, 8192, 512, 512, 8192, 8192]
    - [56, 88.97]
  - - [512, 2048, 1, 128, 512, 512, 128, 128]
    - [39, 16.58]
  - - [512, 2048, 1, 256, 512, 512, 256, 256]
    - [49, 28.25]
  - - [512, 2048, 1, 512, 512, 512, 512, 512]
    - [49, 45.93]
  - - [512, 2048, 1, 1024, 512, 512, 1024, 1024]
    - [49, 66.47]
  - - [512, 2048, 1, 2048, 512, 512, 2048, 2048]
    - [49, 83.98]
  - - [512, 2048, 1, 4096, 512, 512, 4096, 4096]
    - [49, 99.5]
  - - [512, 2048, 1, 8192, 512, 512, 8192, 8192]
    - [49, 101.66]
  - - [512, 4096, 1, 128, 512, 512, 128, 128]
    - [9, 23.87]
  - - [512, 4096, 1, 256, 512, 512, 256, 256]
    - [27, 38.1]
  - - [512, 4096, 1, 512, 512, 512, 512, 512]
    - [27, 57.18]
  - - [512, 4096, 1, 1024, 512, 512, 1024, 1024]
    - [49, 78.89]
  - - [512, 4096, 1, 2048, 512, 512, 2048, 2048]
    - [38, 97.24]
  - - [512, 4096, 1, 4096, 512, 512, 4096, 4096]
    - [50, 98.63]
  - - [512, 4096, 1, 8192, 512, 512, 8192, 8192]
    - [26, 108.55]
  - - [512, 8192, 1, 128, 512, 512, 128, 128]
    - [5, 28.94]
  - - [512, 8192, 1, 256, 512, 512, 256, 256]
    - [16, 44.83]
  - - [512, 8192, 1, 512, 512, 512, 512, 512]
    - [23, 66.48]
  - - [512, 8192, 1, 1024, 512, 512, 1024, 1024]
    - [9, 87.35]
  - - [512, 8192, 1, 2048, 512, 512, 2048, 2048]
    - [26, 118.75]
  - - [512, 8192, 1, 4096, 512, 512, 4096, 4096]
    - [28, 120.48]
  - - [512, 8192, 1, 8192, 512, 512, 8192, 8192]
    - [5, 129.83]
  - - [1024, 128, 1, 128, 1024, 1024, 128, 128]
    - [82, 3.51]
  - - [1024, 128, 1, 256, 1024, 1024, 256, 256]
    - [80, 6.33]
  - - [1024, 128, 1, 512, 1024, 1024, 512, 512]
    - [84, 10.77]
  - - [1024, 128, 1, 1024, 1024, 1024, 1024, 1024]
    - [80, 16.96]
  - - [1024, 128, 1, 2048, 1024, 1024, 2048, 2048]
    - [87, 22.98]
  - - [1024, 128, 1, 4096, 1024, 1024, 4096, 4096]
    - [78, 29.01]
  - - [1024, 128, 1, 8192, 1024, 1024, 8192, 8192]
    - [86, 35.02]
  - - [1024, 256, 1, 128, 1024, 1024, 128, 128]
    - [70, 6.43]
  - - [1024, 256, 1, 256, 1024, 1024, 256, 256]
    - [70, 11.13]
  - - [1024, 256, 1, 512, 1024, 1024, 512, 512]
    - [68, 19.15]
  - - [1024, 256, 1, 1024, 1024, 1024, 1024, 1024]
    - [67, 28.95]
  - - [1024, 256, 1, 2048, 1024, 1024, 2048, 2048]
    - [64, 38.77]
  - - [1024, 256, 1, 4096, 1024, 1024, 4096, 4096]
    - [87, 48.2]
  - - [1024, 256, 1, 8192, 1024, 1024, 8192, 8192]
    - [66, 55.44]
  - - [1024, 512, 1, 128, 1024, 1024, 128, 128]
    - [56, 10.74]
  - - [1024, 512, 1, 256, 1024, 1024, 256, 256]
    - [56, 18.38]
  - - [1024, 512, 1, 512, 1024, 1024, 512, 512]
    - [56, 31.46]
  - - [1024, 512, 1, 1024, 1024, 1024, 1024, 1024]
    - [58, 47.61]
  - - [1024, 512, 1, 2048, 1024, 1024, 2048, 2048]
    - [56, 64.44]
  - - [1024, 512, 1, 4096, 1024, 1024, 4096, 4096]
    - [56, 78.37]
  - - [1024, 512, 1, 8192, 1024, 1024, 8192, 8192]
    - [59, 88.56]
  - - [1024, 1024, 1, 128, 1024, 1024, 128, 128]
    - [52, 16.81]
  - - [1024, 1024, 1, 256, 1024, 1024, 256, 256]
    - [52, 28.34]
  - - [1024, 1024, 1, 512, 1024, 1024, 512, 512]
    - [52, 46.32]
  - - [1024, 1024, 1, 1024, 1024, 1024, 1024, 1024]
    - [52, 66.51]
  - - [1024, 1024, 1, 2048, 1024, 1024, 2048, 2048]
    - [50, 84.63]
  - - [1024, 1024, 1, 4096, 1024, 1024, 4096, 4096]
    - [47, 100.11]
  - - [1024, 1024, 1, 8192, 1024, 1024, 8192, 8192]
    - [52, 103.01]
  - - [1024, 2048, 1, 128, 1024, 1024, 128, 128]
    - [9, 23.7]
  - - [1024, 2048, 1, 256, 1024, 1024, 256, 256]
    - [27, 38.63]
  - - [1024, 2048, 1, 512, 1024, 1024, 512, 512]
    - [27, 58.0]
  - - [1024, 2048, 1, 1024, 1024, 1024, 1024, 1024]
    - [49, 80.11]
  - - [1024, 2048, 1, 2048, 1024, 1024, 2048, 2048]
    - [33, 96.95]
  - - [1024, 2048, 1, 4096, 1024, 1024, 4096, 4096]
    - [45, 103.88]
  - - [1024, 2048, 1, 8192, 1024, 1024, 8192, 8192]
    - [31, 109.1]
  - - [1024, 4096, 1, 128, 1024, 1024, 128, 128]
    - [2, 28.97]
  - - [1024, 4096, 1, 256, 1024, 1024, 256, 256]
    - [16, 45.16]
  - - [1024, 4096, 1, 512, 1024, 1024, 512, 512]
    - [16, 68.22]
  - - [1024, 4096, 1, 1024, 1024, 1024, 1024, 1024]
    - [9, 88.9]
  - - [1024, 4096, 1, 2048, 1024, 1024, 2048, 2048]
    - [27, 119.31]
  - - [1024, 4096, 1, 4096, 1024, 1024, 4096, 4096]
    - [16, 118.19]
  - - [1024, 4096, 1, 8192, 1024, 1024, 8192, 8192]
    - [16, 131.18]
  - - [1024, 8192, 1, 128, 1024, 1024, 128, 128]
    - [2, 33.25]
  - - [1024, 8192, 1, 256, 1024, 1024, 256, 256]
    - [24, 50.51]
  - - [1024, 8192, 1, 512, 1024, 1024, 512, 512]
    - [39, 77.76]
  - - [1024, 8192, 1, 1024, 1024, 1024, 1024, 1024]
    - [49, 102.82]
  - - [1024, 8192, 1, 2048, 1024, 1024, 2048, 2048]
    - [21, 124.73]
  - - [1024, 8192, 1, 4096, 1024, 1024, 4096, 4096]
    - [22, 145.34]
  - - [1024, 8192, 1, 8192, 1024, 1024, 8192, 8192]
    - [25, 153.77]
  - - [2048, 128, 1, 128, 2048, 2048, 128, 128]
    - [62, 6.65]
  - - [2048, 128, 1, 256, 2048, 2048, 256, 256]
    - [60, 11.19]
  - - [2048, 128, 1, 512, 2048, 2048, 512, 512]
    - [62, 19.01]
  - - [2048, 128, 1, 1024, 2048, 2048, 1024, 1024]
    - [62, 28.61]
  - - [2048, 128, 1, 2048, 2048, 2048, 2048, 2048]
    - [66, 38.16]
  - - [2048, 128, 1, 4096, 2048, 2048, 4096, 4096]
    - [69, 47.02]
  - - [2048, 128, 1, 8192, 2048, 2048, 8192, 8192]
    - [66, 53.1]
  - - [2048, 256, 1, 128, 2048, 2048, 128, 128]
    - [58, 10.77]
  - - [2048, 256, 1, 256, 2048, 2048, 256, 256]
    - [58, 18.57]
  - - [2048, 256, 1, 512, 2048, 2048, 512, 512]
    - [58, 31.44]
  - - [2048, 256, 1, 1024, 2048, 2048, 1024, 1024]
    - [59, 47.9]
  - - [2048, 256, 1, 2048, 2048, 2048, 2048, 2048]
    - [58, 63.73]
  - - [2048, 256, 1, 4096, 2048, 2048, 4096, 4096]
    - [58, 77.4]
  - - [2048, 256, 1, 8192, 2048, 2048, 8192, 8192]
    - [59, 85.79]
  - - [2048, 512, 1, 128, 2048, 2048, 128, 128]
    - [50, 16.85]
  - - [2048, 512, 1, 256, 2048, 2048, 256, 256]
    - [52, 28.03]
  - - [2048, 512, 1, 512, 2048, 2048, 512, 512]
    - [50, 46.07]
  - - [2048, 512, 1, 1024, 2048, 2048, 1024, 1024]
    - [50, 67.19]
  - - [2048, 512, 1, 2048, 2048, 2048, 2048, 2048]
    - [50, 85.51]
  - - [2048, 512, 1, 4096, 2048, 2048, 4096, 4096]
    - [47, 96.93]
  - - [2048, 512, 1, 8192, 2048, 2048, 8192, 8192]
    - [48, 101.05]
  - - [2048, 1024, 1, 128, 2048, 2048, 128, 128]
    - [8, 23.01]
  - - [2048, 1024, 1, 256, 2048, 2048, 256, 256]
    - [28, 38.39]
  - - [2048, 1024, 1, 512, 2048, 2048, 512, 512]
    - [28, 58.2]
  - - [2048, 1024, 1, 1024, 2048, 2048, 1024, 1024]
    - [50, 81.44]
  - - [2048, 1024, 1, 2048, 2048, 2048, 2048, 2048]
    - [34, 100.3]
  - - [2048, 1024, 1, 4096, 2048, 2048, 4096, 4096]
    - [45, 116.37]
  - - [2048, 1024, 1, 8192, 2048, 2048, 8192, 8192]
    - [44, 114.09]
  - - [2048, 2048, 1, 128, 2048, 2048, 128, 128]
    - [2, 28.1]
  - - [2048, 2048, 1, 256, 2048, 2048, 256, 256]
    - [16, 44.99]
  - - [2048, 2048, 1, 512, 2048, 2048, 512, 512]
    - [20, 66.32]
  - - [2048, 2048, 1, 1024, 2048, 2048, 1024, 1024]
    - [13, 89.8]
  - - [2048, 2048, 1, 2048, 2048, 2048, 2048, 2048]
    - [30, 118.76]
  - - [2048, 2048, 1, 4096, 2048, 2048, 4096, 4096]
    - [26, 126.71]
  - - [2048, 2048, 1, 8192, 2048, 2048, 8192, 8192]
    - [2, 131.46]
  - - [2048, 4096, 1, 128, 2048, 2048, 128, 128]
    - [2, 32.62]
  - - [2048, 4096, 1, 256, 2048, 2048, 256, 256]
    - [24, 50.19]
  - - [2048, 4096, 1, 512, 2048, 2048, 512, 512]
    - [41, 77.38]
  - - [2048, 4096, 1, 1024, 2048, 2048, 1024, 1024]
    - [1, 105.21]
  - - [2048, 4096, 1, 2048, 2048, 2048, 2048, 2048]
    - [16, 133.13]
  - - [2048, 4096, 1, 4096, 2048, 2048, 4096, 4096]
    - [15, 147.28]
  - - [2048, 4096, 1, 8192, 2048, 2048, 8192, 8192]
    - [16, 155.15]
  - - [2048, 8192, 1, 128, 2048, 2048, 128, 128]
    - [6, 34.75]
  - - [2048, 8192, 1, 256, 2048, 2048, 256, 256]
    - [39, 56.57]
  - - [2048, 8192, 1, 512, 2048, 2048, 512, 512]
    - [31, 84.99]
  - - [2048, 8192, 1, 1024, 2048, 2048, 1024, 1024]
    - [49, 101.9]
  - - [2048, 8192, 1, 2048, 2048, 2048, 2048, 2048]
    - [16, 128.91]
  - - [2048, 8192, 1, 4096, 2048, 2048, 4096, 4096]
    - [16, 165.83]
  - - [2048, 8192, 1, 8192, 2048, 2048, 8192, 8192]
    - [14, 181.25]
  - - [4096, 128, 1, 128, 4096, 4096, 128, 128]
    - [54, 10.69]
  - - [4096, 128, 1, 256, 4096, 4096, 256, 256]
    - [54, 17.87]
  - - [4096, 128, 1, 512, 4096, 4096, 512, 512]
    - [56, 30.26]
  - - [4096, 128, 1, 1024, 4096, 4096, 1024, 1024]
    - [59, 44.94]
  - - [4096, 128, 1, 2048, 4096, 4096, 2048, 2048]
    - [57, 60.25]
  - - [4096, 128, 1, 4096, 4096, 4096, 4096, 4096]
    - [57, 69.31]
  - - [4096, 128, 1, 8192, 4096, 4096, 8192, 8192]
    - [55, 79.8]
  - - [4096, 256, 1, 128, 4096, 4096, 128, 128]
    - [51, 16.32]
  - - [4096, 256, 1, 256, 4096, 4096, 256, 256]
    - [51, 27.38]
  - - [4096, 256, 1, 512, 4096, 4096, 512, 512]
    - [51, 45.49]
  - - [4096, 256, 1, 1024, 4096, 4096, 1024, 1024]
    - [50, 66.08]
  - - [4096, 256, 1, 2048, 4096, 4096, 2048, 2048]
    - [47, 80.61]
  - - [4096, 256, 1, 4096, 4096, 4096, 4096, 4096]
    - [48, 93.29]
  - - [4096, 256, 1, 8192, 4096, 4096, 8192, 8192]
    - [50, 97.99]
  - - [4096, 512, 1, 128, 4096, 4096, 128, 128]
    - [9, 22.52]
  - - [4096, 512, 1, 256, 4096, 4096, 256, 256]
    - [28, 37.48]
  - - [4096, 512, 1, 512, 4096, 4096, 512, 512]
    - [28, 56.9]
  - - [4096, 512, 1, 1024, 4096, 4096, 1024, 1024]
    - [50, 79.74]
  - - [4096, 512, 1, 2048, 4096, 4096, 2048, 2048]
    - [36, 96.76]
  - - [4096, 512, 1, 4096, 4096, 4096, 4096, 4096]
    - [45, 116.94]
  - - [4096, 512, 1, 8192, 4096, 4096, 8192, 8192]
    - [45, 114.53]
  - - [4096, 1024, 1, 128, 4096, 4096, 128, 128]
    - [2, 27.04]
  - - [4096, 1024, 1, 256, 4096, 4096, 256, 256]
    - [16, 43.49]
  - - [4096, 1024, 1, 512, 4096, 4096, 512, 512]
    - [24, 65.38]
  - - [4096, 1024, 1, 1024, 4096, 4096, 1024, 1024]
    - [10, 88.17]
  - - [4096, 1024, 1, 2048, 4096, 4096, 2048, 2048]
    - [28, 118.38]
  - - [4096, 1024, 1, 4096, 4096, 4096, 4096, 4096]
    - [26, 132.72]
  - - [4096, 1024, 1, 8192, 4096, 4096, 8192, 8192]
    - [27, 137.74]
  - - [4096, 2048, 1, 128, 4096, 4096, 128, 128]
    - [2, 31.86]
  - - [4096, 2048, 1, 256, 4096, 4096, 256, 256]
    - [19, 49.11]
  - - [4096, 2048, 1, 512, 4096, 4096, 512, 512]
    - [43, 74.78]
  - - [4096, 2048, 1, 1024, 4096, 4096, 1024, 1024]
    - [4, 104.45]
  - - [4096, 2048, 1, 2048, 4096, 4096, 2048, 2048]
    - [14, 134.95]
  - - [4096, 2048, 1, 4096, 4096, 4096, 4096, 4096]
    - [16, 152.2]
  - - [4096, 2048, 1, 8192, 4096, 4096, 8192, 8192]
    - [16, 167.99]
  - - [4096, 4096, 1, 128, 4096, 4096, 128, 128]
    - [0, 33.87]
  - - [4096, 4096, 1, 256, 4096, 4096, 256, 256]
    - [41, 55.66]
  - - [4096, 4096, 1, 512, 4096, 4096, 512, 512]
    - [28, 83.26]
  - - [4096, 4096, 1, 1024, 4096, 4096, 1024, 1024]
    - [52, 99.38]
  - - [4096, 4096, 1, 2048, 4096, 4096, 2048, 2048]
    - [16, 135.15]
  - - [4096, 4096, 1, 4096, 4096, 4096, 4096, 4096]
    - [16, 162.35]
  - - [4096, 4096, 1, 8192, 4096, 4096, 8192, 8192]
    - [15, 171.62]
  - - [4096, 8192, 1, 128, 4096, 4096, 128, 128]
    - [13, 36.97]
  - - [4096, 8192, 1, 256, 4096, 4096, 256, 256]
    - [27, 59.73]
  - - [4096, 8192, 1, 512, 4096, 4096, 512, 512]
    - [15, 85.51]
  - - [4096, 8192, 1, 1024, 4096, 4096, 1024, 1024]
    - [17, 116.8]
  - - [4096, 8192, 1, 2048, 4096, 4096, 2048, 2048]
    - [25, 147.83]
  - - [4096, 8192, 1, 4096, 4096, 4096, 4096, 4096]
    - [32, 165.38]
  - - [4096, 8192, 1, 8192, 4096, 4096, 8192, 8192]
    - [30, 178.91]
  - - [8192, 128, 1, 128, 8192, 8192, 128, 128]
    - [40, 16.01]
  - - [8192, 128, 1, 256, 8192, 8192, 256, 256]
    - [51, 26.54]
  - - [8192, 128, 1, 512, 8192, 8192, 512, 512]
    - [52, 43.51]
  - - [8192, 128, 1, 1024, 8192, 8192, 1024, 1024]
    - [52, 60.79]
  - - [8192, 128, 1, 2048, 8192, 8192, 2048, 2048]
    - [45, 73.34]
  - - [8192, 128, 1, 4096, 8192, 8192, 4096, 4096]
    - [46, 87.09]
  - - [8192, 128, 1, 8192, 8192, 8192, 8192, 8192]
    - [45, 88.6]
  - - [8192, 256, 1, 128, 8192, 8192, 128, 128]
    - [10, 22.34]
  - - [8192, 256, 1, 256, 8192, 8192, 256, 256]
    - [28, 36.66]
  - - [8192, 256, 1, 512, 8192, 8192, 512, 512]
    - [27, 54.87]
  - - [8192, 256, 1, 1024, 8192, 8192, 1024, 1024]
    - [45, 70.23]
  - - [8192, 256, 1, 2048, 8192, 8192, 2048, 2048]
    - [35, 92.67]
  - - [8192, 256, 1, 4096, 8192, 8192, 4096, 4096]
    - [47, 111.71]
  - - [8192, 256, 1, 8192, 8192, 8192, 8192, 8192]
    - [44, 112.31]
  - - [8192, 512, 1, 128, 8192, 8192, 128, 128]
    - [7, 27.38]
  - - [8192, 512, 1, 256, 8192, 8192, 256, 256]
    - [22, 43.46]
  - - [8192, 512, 1, 512, 8192, 8192, 512, 512]
    - [19, 64.74]
  - - [8192, 512, 1, 1024, 8192, 8192, 1024, 1024]
    - [12, 85.87]
  - - [8192, 512, 1, 2048, 8192, 8192, 2048, 2048]
    - [29, 119.58]
  - - [8192, 512, 1, 4096, 8192, 8192, 4096, 4096]
    - [27, 131.1]
  - - [8192, 512, 1, 8192, 8192, 8192, 8192, 8192]
    - [27, 135.58]
  - - [8192, 1024, 1, 128, 8192, 8192, 128, 128]
    - [2, 32.27]
  - - [8192, 1024, 1, 256, 8192, 8192, 256, 256]
    - [16, 48.45]
  - - [8192, 1024, 1, 512, 8192, 8192, 512, 512]
    - [42, 73.82]
  - - [8192, 1024, 1, 1024, 8192, 8192, 1024, 1024]
    - [3, 105.19]
  - - [8192, 1024, 1, 2048, 8192, 8192, 2048, 2048]
    - [16, 129.81]
  - - [8192, 1024, 1, 4096, 8192, 8192, 4096, 4096]
    - [14, 155.07]
  - - [8192, 1024, 1, 8192, 8192, 8192, 8192, 8192]
    - [15, 162.5]
  - - [8192, 2048, 1, 128, 8192, 8192, 128, 128]
    - [0, 34.59]
  - - [8192, 2048, 1, 256, 8192, 8192, 256, 256]
    - [41, 56.59]
  - - [8192, 2048, 1, 512, 8192, 8192, 512, 512]
    - [52, 84.33]
  - - [8192, 2048, 1, 1024, 8192, 8192, 1024, 1024]
    - [52, 99.79]
  - - [8192, 2048, 1, 2048, 8192, 8192, 2048, 2048]
    - [18, 127.73]
  - - [8192, 2048, 1, 4096, 8192, 8192, 4096, 4096]
    - [22, 162.44]
  - - [8192, 2048, 1, 8192, 8192, 8192, 8192, 8192]
    - [16, 170.15]
  - - [8192, 4096, 1, 128, 8192, 8192, 128, 128]
    - [11, 37.8]
  - - [8192, 4096, 1, 256, 8192, 8192, 256, 256]
    - [32, 58.26]
  - - [8192, 4096, 1, 512, 8192, 8192, 512, 512]
    - [16, 85.8]
  - - [8192, 4096, 1, 1024, 8192, 8192, 1024, 1024]
    - [20, 117.71]
  - - [8192, 4096, 1, 2048, 8192, 8192, 2048, 2048]
    - [22, 147.86]
  - - [8192, 4096, 1, 4096, 8192, 8192, 4096, 4096]
    - [16, 172.9]
  - - [8192, 4096, 1, 8192, 8192, 8192, 8192, 8192]
    - [32, 188.57]
  - - [8192, 8192, 1, 128, 8192, 8192, 128, 128]
    - [3, 38.59]
  - - [8192, 8192, 1, 256, 8192, 8192, 256, 256]
    - [24, 59.93]
  - - [8192, 8192, 1, 512, 8192, 8192, 512, 512]
    - [22, 90.12]
  - - [8192, 8192, 1, 1024, 8192, 8192, 1024, 1024]
    - [22, 129.99]
  - - [8192, 8192, 1, 2048, 8192, 8192, 2048, 2048]
    - [24, 164.88]
  - - [8192, 8192, 1, 4096, 8192, 8192, 4096, 4096]
    - [24, 191.9]
  - - [8192, 8192, 1, 8192, 8192, 8192, 8192, 8192]
    - [19, 214.13]
  - - [1, 1, 1, 32, 1, 1, 32, 32]
    - [88, 0.0]
- null
- null
- ExperimentalStreamK
- GridBased
