projects/hipblaslt/library/src/amd_detail/rocblaslt/src/Tensile/Logic/asm_full/aquavanjaram/gfx942_228cu/StreamK/aquavanjaram942_Cijk_Ailk_Bjlk_B8NSS_BH_Bias_HAS_SAV_UserArgs.yaml
- {MinimumRequiredVersion: 4.33.0}
- aquavanjaram942
- {Architecture: gfx942, CUCount: 228}
- [Device 0049, Device 0050]
    SolutionIndex: 0
    SolutionNameMin: Cijk_Ailk_Bjlk_B8NSS_BH_Bias_HAS_SAV_UserArgs_MT256x256x64_MI16x16x1_SN_LDSB0_CLR1_GRVWA16_GRVWB4_GSU0_GSUC0_GSUWGMRR0_K1_LBSPPA2048_LBSPPB2048_LPA0_LPB0_MIWT8_8_PLR1_SU0_SUM0_SUS64_VWA8_VWB8_WGM1_WGMXCC1_WGMXCCGn1
    SolutionIndex: 1
    SolutionNameMin: Cijk_Ailk_Bjlk_B8NSS_BH_Bias_HAS_SAV_UserArgs_MT256x256x64_MI16x16x1_SN_LDSB0_CLR1_GRVWA4_GRVWB16_GSU0_GSUC0_GSUWGMRR0_K1_LBSPPA2048_LBSPPB2048_LPA0_LPB0_MIWT8_8_PLR1_SU0_SUM0_SUS64_VWA8_VWB8_WGM1_WGMXCC1_WGMXCCGn1
    SolutionIndex: 2
    SolutionNameMin: Cijk_Ailk_Bjlk_B8NSS_BH_Bias_HAS_SAV_UserArgs_MT256x256x64_MI16x16x1_SN_LDSB0_CLR1_GRVWA16_GRVWB16_GSU0_GSUC0_GSUWGMRR0_K1_LBSPPA2048_LBSPPB2048_LPA0_LPB0_MIWT8_8_PLR1_SU0_SUM0_SUS64_VWA8_VWB8_WGM1_WGMXCC1_WGMXCCGn1
    SolutionIndex: 3
    SolutionNameMin: Cijk_Ailk_Bjlk_B8NSS_BH_Bias_HAS_SAV_UserArgs_MT256x256x64_MI16x16x1_SN_LDSB0_CLR1_GRVWA4_GRVWB4_GSU0_GSUC0_GSUWGMRR0_K1_LBSPPA2048_LBSPPB2048_LPA0_LPB0_MIWT8_8_PLR1_SU0_SUM0_SUS64_VWA8_VWB8_WGM6_WGMXCC1_WGMXCCGn1
    SolutionIndex: 4
    SolutionNameMin: Cijk_Ailk_Bjlk_B8NSS_BH_Bias_HAS_SAV_UserArgs_MT256x256x64_MI16x16x1_SN_LDSB0_CLR1_GRVWA8_GRVWB4_GSU0_GSUC0_GSUWGMRR0_K1_LBSPPA2048_LBSPPB2048_LPA0_LPB0_MIWT8_8_PLR1_SU0_SUM0_SUS64_VWA8_VWB8_WGM6_WGMXCC1_WGMXCCGn1
    SolutionIndex: 5
    SolutionNameMin: Cijk_Ailk_Bjlk_B8NSS_BH_Bias_HAS_SAV_UserArgs_MT256x256x64_MI16x16x1_SN_LDSB0_CLR1_GRVWA16_GRVWB16_GSU0_GSUC0_GSUWGMRR0_K1_LBSPPA2048_LBSPPB2048_LPA0_LPB0_MIWT8_8_PLR1_SU0_SUM0_SUS64_VWA8_VWB8_WGM6_WGMXCC1_WGMXCCGn1
    SolutionIndex: 6
    SolutionNameMin: Cijk_Ailk_Bjlk_B8NSS_BH_Bias_HAS_SAV_UserArgs_MT256x256x64_MI16x16x1_SN_LDSB0_CLR1_GRVWA16_GRVWB4_GSU0_GSUC0_GSUWGMRR0_K1_LBSPPA2048_LBSPPB2048_LPA0_LPB0_MIWT8_8_PLR1_SU0_SUM0_SUS64_VWA8_VWB8_WGM8_WGMXCC1_WGMXCCGn1
    SolutionIndex: 7
    SolutionNameMin: Cijk_Ailk_Bjlk_B8NSS_BH_Bias_HAS_SAV_UserArgs_MT256x256x64_MI16x16x1_SN_LDSB0_CLR1_GRVWA16_GRVWB8_GSU0_GSUC0_GSUWGMRR0_K1_LBSPPA2048_LBSPPB2048_LPA0_LPB0_MIWT8_8_PLR1_SU0_SUM0_SUS64_VWA8_VWB8_WGM8_WGMXCC1_WGMXCCGn1
    SolutionIndex: 8
    SolutionNameMin: Cijk_Ailk_Bjlk_B8NSS_BH_Bias_HAS_SAV_UserArgs_MT128x256x64_MI16x16x1_SN_LDSB1_CLR1_GRVWA8_GRVWB4_GSU0_GSUC0_GSUWGMRR0_K1_LBSPPA1024_LBSPPB2048_LPA64_LPB0_MIWT4_8_PLR1_SU0_SUM0_SUS64_VWA4_VWB8_WGM1_WGMXCC1_WGMXCCGn1
    SolutionIndex: 9
    SolutionNameMin: Cijk_Ailk_Bjlk_B8NSS_BH_Bias_HAS_SAV_UserArgs_MT128x256x64_MI16x16x1_SN_LDSB1_CLR1_GRVWA16_GRVWB4_GSU0_GSUC0_GSUWGMRR0_K1_LBSPPA1024_LBSPPB2048_LPA64_LPB0_MIWT4_8_PLR1_SU0_SUM0_SUS64_VWA4_VWB8_WGM1_WGMXCC1_WGMXCCGn1
    SolutionIndex: 10
    SolutionNameMin: Cijk_Ailk_Bjlk_B8NSS_BH_Bias_HAS_SAV_UserArgs_MT128x256x64_MI16x16x1_SN_LDSB1_CLR1_GRVWA4_GRVWB8_GSU0_GSUC0_GSUWGMRR0_K1_LBSPPA1024_LBSPPB2048_LPA64_LPB0_MIWT4_8_PLR1_SU0_SUM0_SUS64_VWA4_VWB8_WGM1_WGMXCC1_WGMXCCGn1
    SolutionIndex: 11
    SolutionNameMin: Cijk_Ailk_Bjlk_B8NSS_BH_Bias_HAS_SAV_UserArgs_MT128x256x64_MI16x16x1_SN_LDSB1_CLR1_GRVWA8_GRVWB8_GSU0_GSUC0_GSUWGMRR0_K1_LBSPPA1024_LBSPPB2048_LPA64_LPB0_MIWT4_8_PLR1_SU0_SUM0_SUS64_VWA4_VWB8_WGM1_WGMXCC1_WGMXCCGn1
    SolutionIndex: 12
    SolutionNameMin: Cijk_Ailk_Bjlk_B8NSS_BH_Bias_HAS_SAV_UserArgs_MT128x256x64_MI16x16x1_SN_LDSB1_CLR1_GRVWA16_GRVWB8_GSU0_GSUC0_GSUWGMRR0_K1_LBSPPA1024_LBSPPB2048_LPA64_LPB0_MIWT4_8_PLR1_SU0_SUM0_SUS64_VWA4_VWB8_WGM1_WGMXCC1_WGMXCCGn1
    SolutionIndex: 13
    SolutionNameMin: Cijk_Ailk_Bjlk_B8NSS_BH_Bias_HAS_SAV_UserArgs_MT128x256x64_MI16x16x1_SN_LDSB1_CLR1_GRVWA4_GRVWB16_GSU0_GSUC0_GSUWGMRR0_K1_LBSPPA1024_LBSPPB2048_LPA64_LPB0_MIWT4_8_PLR1_SU0_SUM0_SUS64_VWA4_VWB8_WGM1_WGMXCC1_WGMXCCGn1
    SolutionIndex: 14
    SolutionNameMin: Cijk_Ailk_Bjlk_B8NSS_BH_Bias_HAS_SAV_UserArgs_MT128x256x64_MI16x16x1_SN_LDSB1_CLR1_GRVWA8_GRVWB16_GSU0_GSUC0_GSUWGMRR0_K1_LBSPPA1024_LBSPPB2048_LPA64_LPB0_MIWT4_8_PLR1_SU0_SUM0_SUS64_VWA4_VWB8_WGM1_WGMXCC1_WGMXCCGn1
    SolutionIndex: 15
    SolutionNameMin: Cijk_Ailk_Bjlk_B8NSS_BH_Bias_HAS_SAV_UserArgs_MT128x256x64_MI16x16x1_SN_LDSB1_CLR1_GRVWA16_GRVWB16_GSU0_GSUC0_GSUWGMRR0_K1_LBSPPA1024_LBSPPB2048_LPA64_LPB0_MIWT4_8_PLR1_SU0_SUM0_SUS64_VWA4_VWB8_WGM1_WGMXCC1_WGMXCCGn1
    SolutionIndex: 16
    SolutionNameMin: Cijk_Ailk_Bjlk_B8NSS_BH_Bias_HAS_SAV_UserArgs_MT128x256x64_MI16x16x1_SN_LDSB1_CLR1_GRVWA4_GRVWB8_GSU0_GSUC0_GSUWGMRR0_K1_LBSPPA1024_LBSPPB2048_LPA64_LPB0_MIWT4_8_PLR1_SU0_SUM0_SUS64_VWA4_VWB8_WGM4_WGMXCC1_WGMXCCGn1
    SolutionIndex: 17
    SolutionNameMin: Cijk_Ailk_Bjlk_B8NSS_BH_Bias_HAS_SAV_UserArgs_MT128x256x64_MI16x16x1_SN_LDSB1_CLR1_GRVWA4_GRVWB16_GSU0_GSUC0_GSUWGMRR0_K1_LBSPPA1024_LBSPPB2048_LPA64_LPB0_MIWT4_8_PLR1_SU0_SUM0_SUS64_VWA4_VWB8_WGM4_WGMXCC1_WGMXCCGn1
    SolutionIndex: 18
    SolutionNameMin: Cijk_Ailk_Bjlk_B8NSS_BH_Bias_HAS_SAV_UserArgs_MT128x256x64_MI16x16x1_SN_LDSB1_CLR1_GRVWA8_GRVWB8_GSU0_GSUC0_GSUWGMRR0_K1_LBSPPA1024_LBSPPB2048_LPA64_LPB0_MIWT4_8_PLR1_SU0_SUM0_SUS64_VWA4_VWB8_WGM6_WGMXCC1_WGMXCCGn1
    SolutionIndex: 19
    SolutionNameMin: Cijk_Ailk_Bjlk_B8NSS_BH_Bias_HAS_SAV_UserArgs_MT128x256x64_MI16x16x1_SN_LDSB1_CLR1_GRVWA4_GRVWB16_GSU0_GSUC0_GSUWGMRR0_K1_LBSPPA1024_LBSPPB2048_LPA64_LPB0_MIWT4_8_PLR1_SU0_SUM0_SUS64_VWA4_VWB8_WGM6_WGMXCC1_WGMXCCGn1
    SolutionIndex: 20
    SolutionNameMin: Cijk_Ailk_Bjlk_B8NSS_BH_Bias_HAS_SAV_UserArgs_MT128x256x64_MI16x16x1_SN_LDSB1_CLR1_GRVWA8_GRVWB16_GSU0_GSUC0_GSUWGMRR0_K1_LBSPPA1024_LBSPPB2048_LPA64_LPB0_MIWT4_8_PLR1_SU0_SUM0_SUS64_VWA4_VWB8_WGM6_WGMXCC1_WGMXCCGn1
    SolutionIndex: 21
    SolutionNameMin: Cijk_Ailk_Bjlk_B8NSS_BH_Bias_HAS_SAV_UserArgs_MT128x256x64_MI16x16x1_SN_LDSB1_CLR1_GRVWA16_GRVWB16_GSU0_GSUC0_GSUWGMRR0_K1_LBSPPA1024_LBSPPB2048_LPA64_LPB0_MIWT4_8_PLR1_SU0_SUM0_SUS64_VWA4_VWB8_WGM6_WGMXCC1_WGMXCCGn1
    SolutionIndex: 22
    SolutionNameMin: Cijk_Ailk_Bjlk_B8NSS_BH_Bias_HAS_SAV_UserArgs_MT128x256x64_MI16x16x1_SN_LDSB1_CLR1_GRVWA4_GRVWB16_GSU0_GSUC0_GSUWGMRR0_K1_LBSPPA1024_LBSPPB2048_LPA64_LPB0_MIWT4_8_PLR1_SU0_SUM0_SUS64_VWA4_VWB8_WGM8_WGMXCC1_WGMXCCGn1
    SolutionIndex: 23
    SolutionNameMin: Cijk_Ailk_Bjlk_B8NSS_BH_Bias_HAS_SAV_UserArgs_MT128x256x64_MI16x16x1_SN_LDSB1_CLR1_GRVWA8_GRVWB16_GSU0_GSUC0_GSUWGMRR0_K1_LBSPPA1024_LBSPPB2048_LPA64_LPB0_MIWT4_8_PLR1_SU0_SUM0_SUS64_VWA4_VWB8_WGM8_WGMXCC1_WGMXCCGn1
    SolutionIndex: 24
    SolutionNameMin: Cijk_Ailk_Bjlk_B8NSS_BH_Bias_HAS_SAV_UserArgs_MT256x144x64_MI16x16x1_SN_LDSB0_CLR1_GRVWA4_GRVWB4_GSU0_GSUC0_GSUWGMRR0_K1_LBSPPA2048_LBSPPB1152_LPA64_LPB16_MIWT4_9_PLR1_SU0_SUM0_SUS64_VWA4_VWB1_WGM1_WGMXCC1_WGMXCCGn1
    SolutionIndex: 25
    SolutionNameMin: Cijk_Ailk_Bjlk_B8NSS_BH_Bias_HAS_SAV_UserArgs_MT256x144x64_MI16x16x1_SN_LDSB0_CLR1_GRVWA16_GRVWB4_GSU0_GSUC0_GSUWGMRR0_K1_LBSPPA2048_LBSPPB1152_LPA64_LPB16_MIWT4_9_PLR1_SU0_SUM0_SUS64_VWA4_VWB1_WGM1_WGMXCC1_WGMXCCGn1
    SolutionIndex: 26
    SolutionNameMin: Cijk_Ailk_Bjlk_B8NSS_BH_Bias_HAS_SAV_UserArgs_MT256x144x64_MI16x16x1_SN_LDSB0_CLR1_GRVWA16_GRVWB4_GSU0_GSUC0_GSUWGMRR0_K1_LBSPPA2048_LBSPPB1152_LPA64_LPB16_MIWT4_9_PLR1_SU0_SUM0_SUS64_VWA4_VWB1_WGM4_WGMXCC1_WGMXCCGn1
    SolutionIndex: 27
    SolutionNameMin: Cijk_Ailk_Bjlk_B8NSS_BH_Bias_HAS_SAV_UserArgs_MT256x144x64_MI16x16x1_SN_LDSB0_CLR1_GRVWA4_GRVWB4_GSU0_GSUC0_GSUWGMRR0_K1_LBSPPA2048_LBSPPB1152_LPA64_LPB16_MIWT4_9_PLR1_SU0_SUM0_SUS64_VWA4_VWB1_WGM6_WGMXCC1_WGMXCCGn1
    SolutionIndex: 28
    SolutionNameMin: Cijk_Ailk_Bjlk_B8NSS_BH_Bias_HAS_SAV_UserArgs_MT256x144x64_MI16x16x1_SN_LDSB0_CLR1_GRVWA8_GRVWB4_GSU0_GSUC0_GSUWGMRR0_K1_LBSPPA2048_LBSPPB1152_LPA64_LPB16_MIWT4_9_PLR1_SU0_SUM0_SUS64_VWA4_VWB1_WGM6_WGMXCC1_WGMXCCGn1
    SolutionIndex: 29
    SolutionNameMin: Cijk_Ailk_Bjlk_B8NSS_BH_Bias_HAS_SAV_UserArgs_MT256x144x64_MI16x16x1_SN_LDSB0_CLR1_GRVWA16_GRVWB4_GSU0_GSUC0_GSUWGMRR0_K1_LBSPPA2048_LBSPPB1152_LPA64_LPB16_MIWT4_9_PLR1_SU0_SUM0_SUS64_VWA4_VWB1_WGM6_WGMXCC1_WGMXCCGn1
    SolutionIndex: 30
    SolutionNameMin: Cijk_Ailk_Bjlk_B8NSS_BH_Bias_HAS_SAV_UserArgs_MT256x144x64_MI16x16x1_SN_LDSB0_CLR1_GRVWA8_GRVWB4_GSU0_GSUC0_GSUWGMRR0_K1_LBSPPA2048_LBSPPB1152_LPA64_LPB16_MIWT4_9_PLR1_SU0_SUM0_SUS64_VWA4_VWB1_WGM8_WGMXCC1_WGMXCCGn1
    SolutionIndex: 31
    SolutionNameMin: Cijk_Ailk_Bjlk_B8NSS_BH_Bias_HAS_SAV_UserArgs_MT144x256x64_MI16x16x1_SN_LDSB0_CLR1_GRVWA4_GRVWB16_GSU0_GSUC0_GSUWGMRR0_K1_LBSPPA1152_LBSPPB2048_LPA16_LPB64_MIWT9_4_PLR1_SU0_SUM0_SUS64_VWA1_VWB4_WGM1_WGMXCC1_WGMXCCGn1
    SolutionIndex: 32
    SolutionNameMin: Cijk_Ailk_Bjlk_B8NSS_BH_Bias_HAS_SAV_UserArgs_MT144x256x64_MI16x16x1_SN_LDSB0_CLR1_GRVWA4_GRVWB16_GSU0_GSUC0_GSUWGMRR0_K1_LBSPPA1152_LBSPPB2048_LPA16_LPB64_MIWT9_4_PLR1_SU0_SUM0_SUS64_VWA1_VWB4_WGM4_WGMXCC1_WGMXCCGn1
    SolutionIndex: 33
    SolutionNameMin: Cijk_Ailk_Bjlk_B8NSS_BH_Bias_HAS_SAV_UserArgs_MT144x256x64_MI16x16x1_SN_LDSB0_CLR1_GRVWA4_GRVWB16_GSU0_GSUC0_GSUWGMRR0_K1_LBSPPA1152_LBSPPB2048_LPA16_LPB64_MIWT9_4_PLR1_SU0_SUM0_SUS64_VWA1_VWB4_WGM6_WGMXCC1_WGMXCCGn1
    SolutionIndex: 34
    SolutionNameMin: Cijk_Ailk_Bjlk_B8NSS_BH_Bias_HAS_SAV_UserArgs_MT144x128x64_MI16x16x1_SN_LDSB1_CLR1_GRVWA4_GRVWB16_GSU0_GSUC0_GSUWGMRR0_K1_LBSPPA1152_LBSPPB1024_LPA16_LPB32_MIWT9_2_PLR1_SU0_SUM0_SUS64_VWA1_VWB2_WGM1_WGMXCC1_WGMXCCGn1
    SolutionIndex: 35
    SolutionNameMin: Cijk_Ailk_Bjlk_B8NSS_BH_Bias_HAS_SAV_UserArgs_MT128x128x64_MI16x16x1_SN_LDSB1_CLR1_GRVWA4_GRVWB4_GSU0_GSUC0_GSUWGMRR0_K1_LBSPPA1024_LBSPPB1024_LPA64_LPB64_MIWT4_4_PLR1_SU0_SUM0_SUS64_VWA4_VWB4_WGM1_WGMXCC1_WGMXCCGn1
    SolutionIndex: 36
    SolutionNameMin: Cijk_Ailk_Bjlk_B8NSS_BH_Bias_HAS_SAV_UserArgs_MT128x128x64_MI16x16x1_SN_LDSB1_CLR1_GRVWA4_GRVWB8_GSU0_GSUC0_GSUWGMRR0_K1_LBSPPA1024_LBSPPB1024_LPA64_LPB64_MIWT4_4_PLR1_SU0_SUM0_SUS64_VWA4_VWB4_WGM1_WGMXCC1_WGMXCCGn1
    SolutionIndex: 37
    SolutionNameMin: Cijk_Ailk_Bjlk_B8NSS_BH_Bias_HAS_SAV_UserArgs_MT128x128x64_MI16x16x1_SN_LDSB1_CLR1_GRVWA16_GRVWB8_GSU0_GSUC0_GSUWGMRR0_K1_LBSPPA1024_LBSPPB1024_LPA64_LPB64_MIWT4_4_PLR1_SU0_SUM0_SUS64_VWA4_VWB4_WGM1_WGMXCC1_WGMXCCGn1
    SolutionIndex: 38
    SolutionNameMin: Cijk_Ailk_Bjlk_B8NSS_BH_Bias_HAS_SAV_UserArgs_MT128x128x64_MI16x16x1_SN_LDSB1_CLR1_GRVWA4_GRVWB16_GSU0_GSUC0_GSUWGMRR0_K1_LBSPPA1024_LBSPPB1024_LPA64_LPB64_MIWT4_4_PLR1_SU0_SUM0_SUS64_VWA4_VWB4_WGM1_WGMXCC1_WGMXCCGn1
    SolutionIndex: 39
    SolutionNameMin: Cijk_Ailk_Bjlk_B8NSS_BH_Bias_HAS_SAV_UserArgs_MT128x128x64_MI16x16x1_SN_LDSB1_CLR1_GRVWA8_GRVWB16_GSU0_GSUC0_GSUWGMRR0_K1_LBSPPA1024_LBSPPB1024_LPA64_LPB64_MIWT4_4_PLR1_SU0_SUM0_SUS64_VWA4_VWB4_WGM1_WGMXCC1_WGMXCCGn1
    SolutionIndex: 40
    SolutionNameMin: Cijk_Ailk_Bjlk_B8NSS_BH_Bias_HAS_SAV_UserArgs_MT128x128x64_MI16x16x1_SN_LDSB1_CLR1_GRVWA16_GRVWB16_GSU0_GSUC0_GSUWGMRR0_K1_LBSPPA1024_LBSPPB1024_LPA64_LPB64_MIWT4_4_PLR1_SU0_SUM0_SUS64_VWA4_VWB4_WGM1_WGMXCC1_WGMXCCGn1
    SolutionIndex: 41
    SolutionNameMin: Cijk_Ailk_Bjlk_B8NSS_BH_Bias_HAS_SAV_UserArgs_MT128x128x64_MI16x16x1_SN_LDSB1_CLR1_GRVWA4_GRVWB8_GSU0_GSUC0_GSUWGMRR0_K1_LBSPPA1024_LBSPPB1024_LPA64_LPB64_MIWT4_4_PLR1_SU0_SUM0_SUS64_VWA4_VWB4_WGM4_WGMXCC1_WGMXCCGn1
    SolutionIndex: 42
    SolutionNameMin: Cijk_Ailk_Bjlk_B8NSS_BH_Bias_HAS_SAV_UserArgs_MT128x128x64_MI16x16x1_SN_LDSB1_CLR1_GRVWA16_GRVWB8_GSU0_GSUC0_GSUWGMRR0_K1_LBSPPA1024_LBSPPB1024_LPA64_LPB64_MIWT4_4_PLR1_SU0_SUM0_SUS64_VWA4_VWB4_WGM4_WGMXCC1_WGMXCCGn1
    SolutionIndex: 43
    SolutionNameMin: Cijk_Ailk_Bjlk_B8NSS_BH_Bias_HAS_SAV_UserArgs_MT128x128x64_MI16x16x1_SN_LDSB1_CLR1_GRVWA16_GRVWB16_GSU0_GSUC0_GSUWGMRR0_K1_LBSPPA1024_LBSPPB1024_LPA64_LPB64_MIWT4_4_PLR1_SU0_SUM0_SUS64_VWA4_VWB4_WGM4_WGMXCC1_WGMXCCGn1
    SolutionIndex: 44
    SolutionNameMin: Cijk_Ailk_Bjlk_B8NSS_BH_Bias_HAS_SAV_UserArgs_MT128x128x64_MI16x16x1_SN_LDSB1_CLR1_GRVWA8_GRVWB16_GSU0_GSUC0_GSUWGMRR0_K1_LBSPPA1024_LBSPPB1024_LPA64_LPB64_MIWT4_4_PLR1_SU0_SUM0_SUS64_VWA4_VWB4_WGM6_WGMXCC1_WGMXCCGn1
    SolutionIndex: 45
    SolutionNameMin: Cijk_Ailk_Bjlk_B8NSS_BH_Bias_HAS_SAV_UserArgs_MT128x128x64_MI16x16x1_SN_LDSB1_CLR1_GRVWA16_GRVWB16_GSU0_GSUC0_GSUWGMRR0_K1_LBSPPA1024_LBSPPB1024_LPA64_LPB64_MIWT4_4_PLR1_SU0_SUM0_SUS64_VWA4_VWB4_WGM6_WGMXCC1_WGMXCCGn1
    SolutionIndex: 46
    SolutionNameMin: Cijk_Ailk_Bjlk_B8NSS_BH_Bias_HAS_SAV_UserArgs_MT128x128x64_MI16x16x1_SN_LDSB1_CLR1_GRVWA4_GRVWB8_GSU0_GSUC0_GSUWGMRR0_K1_LBSPPA1024_LBSPPB1024_LPA64_LPB64_MIWT4_4_PLR1_SU0_SUM0_SUS64_VWA4_VWB4_WGM8_WGMXCC1_WGMXCCGn1
    SolutionIndex: 47
    SolutionNameMin: Cijk_Ailk_Bjlk_B8NSS_BH_Bias_HAS_SAV_UserArgs_MT128x128x64_MI16x16x1_SN_LDSB1_CLR1_GRVWA16_GRVWB8_GSU0_GSUC0_GSUWGMRR0_K1_LBSPPA1024_LBSPPB1024_LPA64_LPB64_MIWT4_4_PLR1_SU0_SUM0_SUS64_VWA4_VWB4_WGM8_WGMXCC1_WGMXCCGn1
    SolutionIndex: 48
    SolutionNameMin: Cijk_Ailk_Bjlk_B8NSS_BH_Bias_HAS_SAV_UserArgs_MT128x128x64_MI16x16x1_SN_LDSB1_CLR1_GRVWA8_GRVWB16_GSU0_GSUC0_GSUWGMRR0_K1_LBSPPA1024_LBSPPB1024_LPA64_LPB64_MIWT4_4_PLR1_SU0_SUM0_SUS64_VWA4_VWB4_WGM8_WGMXCC1_WGMXCCGn1
    SolutionIndex: 49
    SolutionNameMin: Cijk_Ailk_Bjlk_B8NSS_BH_Bias_HAS_SAV_UserArgs_MT128x128x64_MI16x16x1_SN_LDSB1_CLR1_GRVWA16_GRVWB16_GSU0_GSUC0_GSUWGMRR0_K1_LBSPPA1024_LBSPPB1024_LPA64_LPB64_MIWT4_4_PLR1_SU0_SUM0_SUS64_VWA4_VWB4_WGM8_WGMXCC1_WGMXCCGn1
    SolutionIndex: 50
    SolutionNameMin: Cijk_Ailk_Bjlk_B8NSS_BH_Bias_HAS_SAV_UserArgs_MT64x128x64_MI16x16x1_SN_LDSB0_CLR1_GRVWA4_GRVWB4_GSU0_GSUC0_GSUWGMRR0_K1_LBSPPA512_LBSPPB1024_LPA32_LPB64_MIWT2_4_PLR1_SU0_SUM0_SUS64_VWA2_VWB4_WGM1_WGMXCC1_WGMXCCGn1
    SolutionIndex: 51
    SolutionNameMin: Cijk_Ailk_Bjlk_B8NSS_BH_Bias_HAS_SAV_UserArgs_MT64x128x64_MI16x16x1_SN_LDSB0_CLR1_GRVWA4_GRVWB8_GSU0_GSUC0_GSUWGMRR0_K1_LBSPPA512_LBSPPB1024_LPA32_LPB64_MIWT2_4_PLR1_SU0_SUM0_SUS64_VWA2_VWB4_WGM1_WGMXCC1_WGMXCCGn1
    SolutionIndex: 52
    SolutionNameMin: Cijk_Ailk_Bjlk_B8NSS_BH_Bias_HAS_SAV_UserArgs_MT64x128x64_MI16x16x1_SN_LDSB0_CLR1_GRVWA4_GRVWB16_GSU0_GSUC0_GSUWGMRR0_K1_LBSPPA512_LBSPPB1024_LPA32_LPB64_MIWT2_4_PLR1_SU0_SUM0_SUS64_VWA2_VWB4_WGM1_WGMXCC1_WGMXCCGn1
    SolutionIndex: 53
    SolutionNameMin: Cijk_Ailk_Bjlk_B8NSS_BH_Bias_HAS_SAV_UserArgs_MT64x128x64_MI16x16x1_SN_LDSB0_CLR1_GRVWA16_GRVWB16_GSU0_GSUC0_GSUWGMRR0_K1_LBSPPA512_LBSPPB1024_LPA32_LPB64_MIWT2_4_PLR1_SU0_SUM0_SUS64_VWA2_VWB4_WGM1_WGMXCC1_WGMXCCGn1
    SolutionIndex: 54
    SolutionNameMin: Cijk_Ailk_Bjlk_B8NSS_BH_Bias_HAS_SAV_UserArgs_MT128x64x64_MI16x16x1_SN_LDSB0_CLR1_GRVWA4_GRVWB4_GSU0_GSUC0_GSUWGMRR0_K1_LBSPPA1024_LBSPPB512_LPA64_LPB32_MIWT4_2_PLR1_SU0_SUM0_SUS64_VWA4_VWB2_WGM1_WGMXCC1_WGMXCCGn1
    SolutionIndex: 55
    SolutionNameMin: Cijk_Ailk_Bjlk_B8NSS_BH_Bias_HAS_SAV_UserArgs_MT128x64x64_MI16x16x1_SN_LDSB0_CLR1_GRVWA4_GRVWB8_GSU0_GSUC0_GSUWGMRR0_K1_LBSPPA1024_LBSPPB512_LPA64_LPB32_MIWT4_2_PLR1_SU0_SUM0_SUS64_VWA4_VWB2_WGM1_WGMXCC1_WGMXCCGn1
    SolutionIndex: 56
    SolutionNameMin: Cijk_Ailk_Bjlk_B8NSS_BH_Bias_HAS_SAV_UserArgs_MT128x64x64_MI16x16x1_SN_LDSB0_CLR1_GRVWA16_GRVWB8_GSU0_GSUC0_GSUWGMRR0_K1_LBSPPA1024_LBSPPB512_LPA64_LPB32_MIWT4_2_PLR1_SU0_SUM0_SUS64_VWA4_VWB2_WGM1_WGMXCC1_WGMXCCGn1
    SolutionIndex: 57
    SolutionNameMin: Cijk_Ailk_Bjlk_B8NSS_BH_Bias_HAS_SAV_UserArgs_MT128x64x64_MI16x16x1_SN_LDSB0_CLR1_GRVWA4_GRVWB8_GSU0_GSUC0_GSUWGMRR0_K1_LBSPPA1024_LBSPPB512_LPA64_LPB32_MIWT4_2_PLR1_SU0_SUM0_SUS64_VWA4_VWB2_WGM4_WGMXCC1_WGMXCCGn1
    SolutionIndex: 58
    SolutionNameMin: Cijk_Ailk_Bjlk_B8NSS_BH_Bias_HAS_SAV_UserArgs_MT128x64x64_MI16x16x1_SN_LDSB0_CLR1_GRVWA16_GRVWB8_GSU0_GSUC0_GSUWGMRR0_K1_LBSPPA1024_LBSPPB512_LPA64_LPB32_MIWT4_2_PLR1_SU0_SUM0_SUS64_VWA4_VWB2_WGM4_WGMXCC1_WGMXCCGn1
    SolutionIndex: 59
    SolutionNameMin: Cijk_Ailk_Bjlk_B8NSS_BH_Bias_HAS_SAV_UserArgs_MT128x64x64_MI16x16x1_SN_LDSB0_CLR1_GRVWA4_GRVWB8_GSU0_GSUC0_GSUWGMRR0_K1_LBSPPA1024_LBSPPB512_LPA64_LPB32_MIWT4_2_PLR1_SU0_SUM0_SUS64_VWA4_VWB2_WGM8_WGMXCC1_WGMXCCGn1
    SolutionIndex: 60
    SolutionNameMin: Cijk_Ailk_Bjlk_B8NSS_BH_Bias_HAS_SAV_UserArgs_MT128x32x64_MI16x16x1_SN_LDSB0_CLR1_GRVWA4_GRVWB4_GSU0_GSUC0_GSUWGMRR0_K1_LBSPPA1024_LBSPPB256_LPA64_LPB16_MIWT4_1_PLR1_SU0_SUM0_SUS64_VWA4_VWB1_WGM1_WGMXCC1_WGMXCCGn1
    SolutionIndex: 61
    SolutionNameMin: Cijk_Ailk_Bjlk_B8NSS_BH_Bias_HAS_SAV_UserArgs_MT128x32x64_MI16x16x1_SN_LDSB0_CLR1_GRVWA8_GRVWB8_GSU0_GSUC0_GSUWGMRR0_K1_LBSPPA1024_LBSPPB256_LPA64_LPB16_MIWT4_1_PLR1_SU0_SUM0_SUS64_VWA4_VWB1_WGM1_WGMXCC1_WGMXCCGn1
    SolutionIndex: 62
    SolutionNameMin: Cijk_Ailk_Bjlk_B8NSS_BH_Bias_HAS_SAV_UserArgs_MT64x64x64_MI16x16x1_SN_LDSB0_CLR1_GRVWA4_GRVWB4_GSU0_GSUC0_GSUWGMRR0_K1_LBSPPA512_LBSPPB512_LPA32_LPB32_MIWT2_2_PLR1_SU0_SUM0_SUS64_VWA2_VWB2_WGM1_WGMXCC1_WGMXCCGn1
    SolutionIndex: 63
    SolutionNameMin: Cijk_Ailk_Bjlk_B8NSS_BH_Bias_HAS_SAV_UserArgs_MT64x64x64_MI16x16x1_SN_LDSB0_CLR1_GRVWA8_GRVWB8_GSU0_GSUC0_GSUWGMRR0_K1_LBSPPA512_LBSPPB512_LPA32_LPB32_MIWT2_2_PLR1_SU0_SUM0_SUS64_VWA2_VWB2_WGM1_WGMXCC1_WGMXCCGn1
    SolutionIndex: 64
    SolutionNameMin: Cijk_Ailk_Bjlk_B8NSS_BH_Bias_HAS_SAV_UserArgs_MT64x64x64_MI16x16x1_SN_LDSB0_CLR1_GRVWA4_GRVWB4_GSU0_GSUC0_GSUWGMRR0_K1_LBSPPA512_LBSPPB512_LPA32_LPB32_MIWT2_2_PLR1_SU0_SUM0_SUS64_VWA2_VWB2_WGM6_WGMXCC1_WGMXCCGn1
    SolutionIndex: 65
    SolutionNameMin: Cijk_Ailk_Bjlk_B8NSS_BH_Bias_HAS_SAV_UserArgs_MT32x64x64_MI16x16x1_SN_LDSB0_CLR1_GRVWA4_GRVWB4_GSU0_GSUC0_GSUWGMRR0_K1_LBSPPA256_LBSPPB512_LPA16_LPB32_MIWT1_2_PLR1_SU0_SUM0_SUS64_VWA1_VWB2_WGM1_WGMXCC1_WGMXCCGn1
    SolutionIndex: 66
    SolutionNameMin: Cijk_Ailk_Bjlk_B8NSS_BH_Bias_HAS_SAV_UserArgs_MT64x32x64_MI16x16x1_SN_LDSB0_CLR1_GRVWA4_GRVWB4_GSU0_GSUC0_GSUWGMRR0_K1_LBSPPA512_LBSPPB256_LPA32_LPB16_MIWT2_1_PLR1_SU0_SUM0_SUS64_VWA2_VWB1_WGM1_WGMXCC1_WGMXCCGn1
    SolutionIndex: 67
    SolutionNameMin: Cijk_Ailk_Bjlk_B8NSS_BH_Bias_HAS_SAV_UserArgs_MT32x32x64_MI16x16x1_SN_LDSB0_CLR1_GRVWA4_GRVWB4_GSU0_GSUC0_GSUWGMRR0_K1_LBSPPA256_LBSPPB256_LPA16_LPB16_MIWT1_1_PLR1_SU0_SUM0_SUS64_VWA1_VWB1_WGM1_WGMXCC1_WGMXCCGn1
    SolutionIndex: 68
    SolutionNameMin: Cijk_Ailk_Bjlk_B8NSS_BH_Bias_HAS_SAV_UserArgs_MT32x32x64_MI16x16x1_SN_LDSB0_CLR1_GRVWA8_GRVWB4_GSU0_GSUC0_GSUWGMRR0_K1_LBSPPA256_LBSPPB256_LPA16_LPB16_MIWT1_1_PLR1_SU0_SUM0_SUS64_VWA1_VWB1_WGM1_WGMXCC1_WGMXCCGn1
    SolutionIndex: 69
    SolutionNameMin: Cijk_Ailk_Bjlk_B8NSS_BH_Bias_HAS_SAV_UserArgs_MT32x32x64_MI16x16x1_SN_LDSB0_CLR1_GRVWA4_GRVWB8_GSU0_GSUC0_GSUWGMRR0_K1_LBSPPA256_LBSPPB256_LPA16_LPB16_MIWT1_1_PLR1_SU0_SUM0_SUS64_VWA1_VWB1_WGM1_WGMXCC1_WGMXCCGn1
    SolutionIndex: 70
    SolutionNameMin: Cijk_Ailk_Bjlk_B8NSS_BH_Bias_HAS_SAV_UserArgs_MT32x32x64_MI16x16x1_SN_LDSB0_CLR1_GRVWA4_GRVWB4_GSU0_GSUC0_GSUWGMRR0_K1_LBSPPA256_LBSPPB256_LPA16_LPB16_MIWT1_1_PLR1_SU0_SUM0_SUS64_VWA1_VWB1_WGM4_WGMXCC1_WGMXCCGn1
    SolutionIndex: 71
    SolutionNameMin: Cijk_Ailk_Bjlk_B8NSS_BH_Bias_HAS_SAV_UserArgs_MT256x256x128_MI16x16x1_SN_LDSB1_CLR1_GRVWA8_GRVWB16_GSU0_GSUC0_GSUWGMRR0_K1_LBSPPA2048_LBSPPB2048_LPA0_LPB0_MIWT8_8_PLR1_SU0_SUM0_SUS128_VWA8_VWB8_WGM1_WGMXCC1_WGMXCCGn1
    SolutionIndex: 72
    SolutionNameMin: Cijk_Ailk_Bjlk_B8NSS_BH_Bias_HAS_SAV_UserArgs_MT256x256x128_MI16x16x1_SN_LDSB1_CLR1_GRVWA16_GRVWB16_GSU0_GSUC0_GSUWGMRR0_K1_LBSPPA2048_LBSPPB2048_LPA0_LPB0_MIWT8_8_PLR1_SU0_SUM0_SUS128_VWA8_VWB8_WGM1_WGMXCC1_WGMXCCGn1
    SolutionIndex: 73
    SolutionNameMin: Cijk_Ailk_Bjlk_B8NSS_BH_Bias_HAS_SAV_UserArgs_MT256x256x128_MI16x16x1_SN_LDSB1_CLR1_GRVWA16_GRVWB16_GSU0_GSUC0_GSUWGMRR0_K1_LBSPPA2048_LBSPPB2048_LPA0_LPB0_MIWT8_8_PLR1_SU0_SUM0_SUS128_VWA8_VWB8_WGM4_WGMXCC1_WGMXCCGn1
    SolutionIndex: 74
    SolutionNameMin: Cijk_Ailk_Bjlk_B8NSS_BH_Bias_HAS_SAV_UserArgs_MT256x256x128_MI16x16x1_SN_LDSB1_CLR1_GRVWA16_GRVWB16_GSU0_GSUC0_GSUWGMRR0_K1_LBSPPA2048_LBSPPB2048_LPA0_LPB0_MIWT8_8_PLR1_SU0_SUM0_SUS128_VWA8_VWB8_WGM6_WGMXCC1_WGMXCCGn1
    SolutionIndex: 75
    SolutionNameMin: Cijk_Ailk_Bjlk_B8NSS_BH_Bias_HAS_SAV_UserArgs_MT256x256x128_MI16x16x1_SN_LDSB1_CLR1_GRVWA16_GRVWB16_GSU0_GSUC0_GSUWGMRR0_K1_LBSPPA2048_LBSPPB2048_LPA0_LPB0_MIWT8_8_PLR1_SU0_SUM0_SUS128_VWA8_VWB8_WGM8_WGMXCC1_WGMXCCGn1
    SolutionIndex: 76
    SolutionNameMin: Cijk_Ailk_Bjlk_B8NSS_BH_Bias_HAS_SAV_UserArgs_MT128x256x128_MI16x16x1_SN_LDSB1_CLR1_GRVWA4_GRVWB16_GSU0_GSUC0_GSUWGMRR0_K1_LBSPPA1024_LBSPPB2048_LPA64_LPB0_MIWT4_8_PLR1_SU0_SUM0_SUS128_VWA4_VWB8_WGM1_WGMXCC1_WGMXCCGn1
    SolutionIndex: 77
    SolutionNameMin: Cijk_Ailk_Bjlk_B8NSS_BH_Bias_HAS_SAV_UserArgs_MT128x256x128_MI16x16x1_SN_LDSB1_CLR1_GRVWA8_GRVWB16_GSU0_GSUC0_GSUWGMRR0_K1_LBSPPA1024_LBSPPB2048_LPA64_LPB0_MIWT4_8_PLR1_SU0_SUM0_SUS128_VWA4_VWB8_WGM1_WGMXCC1_WGMXCCGn1
    SolutionIndex: 78
    SolutionNameMin: Cijk_Ailk_Bjlk_B8NSS_BH_Bias_HAS_SAV_UserArgs_MT128x256x128_MI16x16x1_SN_LDSB1_CLR1_GRVWA16_GRVWB16_GSU0_GSUC0_GSUWGMRR0_K1_LBSPPA1024_LBSPPB2048_LPA64_LPB0_MIWT4_8_PLR1_SU0_SUM0_SUS128_VWA4_VWB8_WGM1_WGMXCC1_WGMXCCGn1
    SolutionIndex: 79
    SolutionNameMin: Cijk_Ailk_Bjlk_B8NSS_BH_Bias_HAS_SAV_UserArgs_MT128x256x128_MI16x16x1_SN_LDSB1_CLR1_GRVWA4_GRVWB8_GSU0_GSUC0_GSUWGMRR0_K1_LBSPPA1024_LBSPPB2048_LPA64_LPB0_MIWT4_8_PLR1_SU0_SUM0_SUS128_VWA4_VWB8_WGM4_WGMXCC1_WGMXCCGn1
    SolutionIndex: 80
    SolutionNameMin: Cijk_Ailk_Bjlk_B8NSS_BH_Bias_HAS_SAV_UserArgs_MT128x256x128_MI16x16x1_SN_LDSB1_CLR1_GRVWA4_GRVWB16_GSU0_GSUC0_GSUWGMRR0_K1_LBSPPA1024_LBSPPB2048_LPA64_LPB0_MIWT4_8_PLR1_SU0_SUM0_SUS128_VWA4_VWB8_WGM4_WGMXCC1_WGMXCCGn1
    SolutionIndex: 81
    SolutionNameMin: Cijk_Ailk_Bjlk_B8NSS_BH_Bias_HAS_SAV_UserArgs_MT128x256x128_MI16x16x1_SN_LDSB1_CLR1_GRVWA16_GRVWB16_GSU0_GSUC0_GSUWGMRR0_K1_LBSPPA1024_LBSPPB2048_LPA64_LPB0_MIWT4_8_PLR1_SU0_SUM0_SUS128_VWA4_VWB8_WGM4_WGMXCC1_WGMXCCGn1
    SolutionIndex: 82
    SolutionNameMin: Cijk_Ailk_Bjlk_B8NSS_BH_Bias_HAS_SAV_UserArgs_MT128x256x128_MI16x16x1_SN_LDSB1_CLR1_GRVWA16_GRVWB16_GSU0_GSUC0_GSUWGMRR0_K1_LBSPPA1024_LBSPPB2048_LPA64_LPB0_MIWT4_8_PLR1_SU0_SUM0_SUS128_VWA4_VWB8_WGM6_WGMXCC1_WGMXCCGn1
    SolutionIndex: 83
    SolutionNameMin: Cijk_Ailk_Bjlk_B8NSS_BH_Bias_HAS_SAV_UserArgs_MT128x256x128_MI16x16x1_SN_LDSB1_CLR1_GRVWA4_GRVWB16_GSU0_GSUC0_GSUWGMRR0_K1_LBSPPA1024_LBSPPB2048_LPA64_LPB0_MIWT4_8_PLR1_SU0_SUM0_SUS128_VWA4_VWB8_WGM8_WGMXCC1_WGMXCCGn1
    SolutionIndex: 84
    SolutionNameMin: Cijk_Ailk_Bjlk_B8NSS_BH_Bias_HAS_SAV_UserArgs_MT128x128x128_MI16x16x1_SN_LDSB1_CLR1_GRVWA16_GRVWB16_GSU0_GSUC0_GSUWGMRR0_K1_LBSPPA1024_LBSPPB1024_LPA64_LPB64_MIWT4_4_PLR1_SU0_SUM0_SUS128_VWA4_VWB4_WGM1_WGMXCC1_WGMXCCGn1
    SolutionIndex: 85
    SolutionNameMin: Cijk_Ailk_Bjlk_B8NSS_BH_Bias_HAS_SAV_UserArgs_MT128x64x128_MI16x16x1_SN_LDSB1_CLR1_GRVWA16_GRVWB16_GSU0_GSUC0_GSUWGMRR0_K1_LBSPPA1024_LBSPPB512_LPA64_LPB32_MIWT4_2_PLR1_SU0_SUM0_SUS128_VWA4_VWB2_WGM1_WGMXCC1_WGMXCCGn1
    SolutionIndex: 86
    SolutionNameMin: Cijk_Ailk_Bjlk_B8NSS_BH_Bias_HAS_SAV_UserArgs_MT128x64x128_MI16x16x1_SN_LDSB1_CLR1_GRVWA16_GRVWB16_GSU0_GSUC0_GSUWGMRR0_K1_LBSPPA1024_LBSPPB512_LPA64_LPB32_MIWT4_2_PLR1_SU0_SUM0_SUS128_VWA4_VWB2_WGM4_WGMXCC1_WGMXCCGn1
    SolutionIndex: 87
    SolutionNameMin: Cijk_Ailk_Bjlk_B8NSS_BH_Bias_HAS_SAV_UserArgs_MT128x64x128_MI16x16x1_SN_LDSB1_CLR1_GRVWA16_GRVWB16_GSU0_GSUC0_GSUWGMRR0_K1_LBSPPA1024_LBSPPB512_LPA64_LPB32_MIWT4_2_PLR1_SU0_SUM0_SUS128_VWA4_VWB2_WGM6_WGMXCC1_WGMXCCGn1
    SolutionIndex: 88
    SolutionNameMin: Cijk_Ailk_Bjlk_B8NSS_BH_Bias_HAS_SAV_UserArgs_MT128x64x128_MI16x16x1_SN_LDSB1_CLR1_GRVWA16_GRVWB16_GSU0_GSUC0_GSUWGMRR0_K1_LBSPPA1024_LBSPPB512_LPA64_LPB32_MIWT4_2_PLR1_SU0_SUM0_SUS128_VWA4_VWB2_WGM8_WGMXCC1_WGMXCCGn1
    SolutionIndex: 89
    SolutionNameMin: Cijk_Ailk_Bjlk_B8NSS_BH_Bias_HAS_SAV_UserArgs_MT64x64x128_MI16x16x1_SN_LDSB1_CLR1_GRVWA4_GRVWB8_GSU0_GSUC0_GSUWGMRR0_K1_LBSPPA512_LBSPPB512_LPA32_LPB32_MIWT2_2_PLR1_SU0_SUM0_SUS128_VWA2_VWB2_WGM1_WGMXCC1_WGMXCCGn1
    SolutionIndex: 90
    SolutionNameMin: Cijk_Ailk_Bjlk_B8NSS_BH_Bias_HAS_SAV_UserArgs_MT64x64x128_MI16x16x1_SN_LDSB1_CLR1_GRVWA8_GRVWB16_GSU0_GSUC0_GSUWGMRR0_K1_LBSPPA512_LBSPPB512_LPA32_LPB32_MIWT2_2_PLR1_SU0_SUM0_SUS128_VWA2_VWB2_WGM1_WGMXCC1_WGMXCCGn1
    SolutionIndex: 91
    SolutionNameMin: Cijk_Ailk_Bjlk_B8NSS_BH_Bias_HAS_SAV_UserArgs_MT64x64x128_MI16x16x1_SN_LDSB1_CLR1_GRVWA16_GRVWB16_GSU0_GSUC0_GSUWGMRR0_K1_LBSPPA512_LBSPPB512_LPA32_LPB32_MIWT2_2_PLR1_SU0_SUM0_SUS128_VWA2_VWB2_WGM1_WGMXCC1_WGMXCCGn1
    SolutionIndex: 92
    SolutionNameMin: Cijk_Ailk_Bjlk_B8NSS_BH_Bias_HAS_SAV_UserArgs_MT64x64x128_MI16x16x1_SN_LDSB1_CLR1_GRVWA4_GRVWB8_GSU0_GSUC0_GSUWGMRR0_K1_LBSPPA512_LBSPPB512_LPA32_LPB32_MIWT2_2_PLR1_SU0_SUM0_SUS128_VWA2_VWB2_WGM4_WGMXCC1_WGMXCCGn1
    SolutionIndex: 93
    SolutionNameMin: Cijk_Ailk_Bjlk_B8NSS_BH_Bias_HAS_SAV_UserArgs_MT64x64x128_MI16x16x1_SN_LDSB1_CLR1_GRVWA4_GRVWB16_GSU0_GSUC0_GSUWGMRR0_K1_LBSPPA512_LBSPPB512_LPA32_LPB32_MIWT2_2_PLR1_SU0_SUM0_SUS128_VWA2_VWB2_WGM4_WGMXCC1_WGMXCCGn1
    SolutionIndex: 94
    SolutionNameMin: Cijk_Ailk_Bjlk_B8NSS_BH_Bias_HAS_SAV_UserArgs_MT64x64x128_MI16x16x1_SN_LDSB1_CLR1_GRVWA8_GRVWB16_GSU0_GSUC0_GSUWGMRR0_K1_LBSPPA512_LBSPPB512_LPA32_LPB32_MIWT2_2_PLR1_SU0_SUM0_SUS128_VWA2_VWB2_WGM4_WGMXCC1_WGMXCCGn1
    SolutionIndex: 95
    SolutionNameMin: Cijk_Ailk_Bjlk_B8NSS_BH_Bias_HAS_SAV_UserArgs_MT64x64x128_MI16x16x1_SN_LDSB1_CLR1_GRVWA16_GRVWB16_GSU0_GSUC0_GSUWGMRR0_K1_LBSPPA512_LBSPPB512_LPA32_LPB32_MIWT2_2_PLR1_SU0_SUM0_SUS128_VWA2_VWB2_WGM4_WGMXCC1_WGMXCCGn1
    SolutionIndex: 96
    SolutionNameMin: Cijk_Ailk_Bjlk_B8NSS_BH_Bias_HAS_SAV_UserArgs_MT64x64x128_MI16x16x1_SN_LDSB1_CLR1_GRVWA4_GRVWB16_GSU0_GSUC0_GSUWGMRR0_K1_LBSPPA512_LBSPPB512_LPA32_LPB32_MIWT2_2_PLR1_SU0_SUM0_SUS128_VWA2_VWB2_WGM6_WGMXCC1_WGMXCCGn1
    SolutionIndex: 97
    SolutionNameMin: Cijk_Ailk_Bjlk_B8NSS_BH_Bias_HAS_SAV_UserArgs_MT64x64x128_MI16x16x1_SN_LDSB1_CLR1_GRVWA16_GRVWB16_GSU0_GSUC0_GSUWGMRR0_K1_LBSPPA512_LBSPPB512_LPA32_LPB32_MIWT2_2_PLR1_SU0_SUM0_SUS128_VWA2_VWB2_WGM6_WGMXCC1_WGMXCCGn1
    SolutionIndex: 98
    SolutionNameMin: Cijk_Ailk_Bjlk_B8NSS_BH_Bias_HAS_SAV_UserArgs_MT64x64x128_MI16x16x1_SN_LDSB1_CLR1_GRVWA8_GRVWB16_GSU0_GSUC0_GSUWGMRR0_K1_LBSPPA512_LBSPPB512_LPA32_LPB32_MIWT2_2_PLR1_SU0_SUM0_SUS128_VWA2_VWB2_WGM8_WGMXCC1_WGMXCCGn1
    SolutionIndex: 99
    SolutionNameMin: Cijk_Ailk_Bjlk_B8NSS_BH_Bias_HAS_SAV_UserArgs_MT32x64x128_MI16x16x1_SN_LDSB0_CLR1_GRVWA4_GRVWB4_GSU0_GSUC0_GSUWGMRR0_K1_LBSPPA256_LBSPPB512_LPA16_LPB32_MIWT1_2_PLR1_SU0_SUM0_SUS128_VWA1_VWB2_WGM1_WGMXCC1_WGMXCCGn1
    SolutionIndex: 100
    SolutionNameMin: Cijk_Ailk_Bjlk_B8NSS_BH_Bias_HAS_SAV_UserArgs_MT32x64x128_MI16x16x1_SN_LDSB0_CLR1_GRVWA4_GRVWB8_GSU0_GSUC0_GSUWGMRR0_K1_LBSPPA256_LBSPPB512_LPA16_LPB32_MIWT1_2_PLR1_SU0_SUM0_SUS128_VWA1_VWB2_WGM1_WGMXCC1_WGMXCCGn1
    SolutionIndex: 101
    SolutionNameMin: Cijk_Ailk_Bjlk_B8NSS_BH_Bias_HAS_SAV_UserArgs_MT32x64x128_MI16x16x1_SN_LDSB0_CLR1_GRVWA8_GRVWB8_GSU0_GSUC0_GSUWGMRR0_K1_LBSPPA256_LBSPPB512_LPA16_LPB32_MIWT1_2_PLR1_SU0_SUM0_SUS128_VWA1_VWB2_WGM1_WGMXCC1_WGMXCCGn1
    SolutionIndex: 102
    SolutionNameMin: Cijk_Ailk_Bjlk_B8NSS_BH_Bias_HAS_SAV_UserArgs_MT32x64x128_MI16x16x1_SN_LDSB0_CLR1_GRVWA4_GRVWB16_GSU0_GSUC0_GSUWGMRR0_K1_LBSPPA256_LBSPPB512_LPA16_LPB32_MIWT1_2_PLR1_SU0_SUM0_SUS128_VWA1_VWB2_WGM1_WGMXCC1_WGMXCCGn1
    SolutionIndex: 103
    SolutionNameMin: Cijk_Ailk_Bjlk_B8NSS_BH_Bias_HAS_SAV_UserArgs_MT32x64x128_MI16x16x1_SN_LDSB0_CLR1_GRVWA8_GRVWB16_GSU0_GSUC0_GSUWGMRR0_K1_LBSPPA256_LBSPPB512_LPA16_LPB32_MIWT1_2_PLR1_SU0_SUM0_SUS128_VWA1_VWB2_WGM1_WGMXCC1_WGMXCCGn1
    SolutionIndex: 104
    SolutionNameMin: Cijk_Ailk_Bjlk_B8NSS_BH_Bias_HAS_SAV_UserArgs_MT32x64x128_MI16x16x1_SN_LDSB0_CLR1_GRVWA16_GRVWB16_GSU0_GSUC0_GSUWGMRR0_K1_LBSPPA256_LBSPPB512_LPA16_LPB32_MIWT1_2_PLR1_SU0_SUM0_SUS128_VWA1_VWB2_WGM4_WGMXCC1_WGMXCCGn1
    SolutionIndex: 105
    SolutionNameMin: Cijk_Ailk_Bjlk_B8NSS_BH_Bias_HAS_SAV_UserArgs_MT32x64x128_MI16x16x1_SN_LDSB0_CLR1_GRVWA16_GRVWB16_GSU0_GSUC0_GSUWGMRR0_K1_LBSPPA256_LBSPPB512_LPA16_LPB32_MIWT1_2_PLR1_SU0_SUM0_SUS128_VWA1_VWB2_WGM6_WGMXCC1_WGMXCCGn1
    SolutionIndex: 106
    SolutionNameMin: Cijk_Ailk_Bjlk_B8NSS_BH_Bias_HAS_SAV_UserArgs_MT32x64x128_MI16x16x1_SN_LDSB0_CLR1_GRVWA16_GRVWB16_GSU0_GSUC0_GSUWGMRR0_K1_LBSPPA256_LBSPPB512_LPA16_LPB32_MIWT1_2_PLR1_SU0_SUM0_SUS128_VWA1_VWB2_WGM8_WGMXCC1_WGMXCCGn1
    SolutionIndex: 107
    SolutionNameMin: Cijk_Ailk_Bjlk_B8NSS_BH_Bias_HAS_SAV_UserArgs_MT64x32x128_MI16x16x1_SN_LDSB0_CLR1_GRVWA4_GRVWB4_GSU0_GSUC0_GSUWGMRR0_K1_LBSPPA512_LBSPPB256_LPA32_LPB16_MIWT2_1_PLR1_SU0_SUM0_SUS128_VWA2_VWB1_WGM1_WGMXCC1_WGMXCCGn1
    SolutionIndex: 108
    SolutionNameMin: Cijk_Ailk_Bjlk_B8NSS_BH_Bias_HAS_SAV_UserArgs_MT64x32x128_MI16x16x1_SN_LDSB0_CLR1_GRVWA4_GRVWB8_GSU0_GSUC0_GSUWGMRR0_K1_LBSPPA512_LBSPPB256_LPA32_LPB16_MIWT2_1_PLR1_SU0_SUM0_SUS128_VWA2_VWB1_WGM1_WGMXCC1_WGMXCCGn1
    SolutionIndex: 109
    SolutionNameMin: Cijk_Ailk_Bjlk_B8NSS_BH_Bias_HAS_SAV_UserArgs_MT64x32x128_MI16x16x1_SN_LDSB0_CLR1_GRVWA8_GRVWB16_GSU0_GSUC0_GSUWGMRR0_K1_LBSPPA512_LBSPPB256_LPA32_LPB16_MIWT2_1_PLR1_SU0_SUM0_SUS128_VWA2_VWB1_WGM1_WGMXCC1_WGMXCCGn1
    SolutionIndex: 110
    SolutionNameMin: Cijk_Ailk_Bjlk_B8NSS_BH_Bias_HAS_SAV_UserArgs_MT64x32x128_MI16x16x1_SN_LDSB0_CLR1_GRVWA16_GRVWB16_GSU0_GSUC0_GSUWGMRR0_K1_LBSPPA512_LBSPPB256_LPA32_LPB16_MIWT2_1_PLR1_SU0_SUM0_SUS128_VWA2_VWB1_WGM1_WGMXCC1_WGMXCCGn1
    SolutionIndex: 111
    SolutionNameMin: Cijk_Ailk_Bjlk_B8NSS_BH_Bias_HAS_SAV_UserArgs_MT32x32x128_MI16x16x1_SN_LDSB0_CLR1_GRVWA4_GRVWB4_GSU0_GSUC0_GSUWGMRR0_K1_LBSPPA256_LBSPPB256_LPA16_LPB16_MIWT1_1_PLR1_SU0_SUM0_SUS128_VWA1_VWB1_WGM1_WGMXCC1_WGMXCCGn1
    SolutionIndex: 112
    SolutionNameMin: Cijk_Ailk_Bjlk_B8NSS_BH_Bias_HAS_SAV_UserArgs_MT32x32x128_MI16x16x1_SN_LDSB0_CLR1_GRVWA8_GRVWB4_GSU0_GSUC0_GSUWGMRR0_K1_LBSPPA256_LBSPPB256_LPA16_LPB16_MIWT1_1_PLR1_SU0_SUM0_SUS128_VWA1_VWB1_WGM1_WGMXCC1_WGMXCCGn1
    SolutionIndex: 113
    SolutionNameMin: Cijk_Ailk_Bjlk_B8NSS_BH_Bias_HAS_SAV_UserArgs_MT32x32x128_MI16x16x1_SN_LDSB0_CLR1_GRVWA4_GRVWB8_GSU0_GSUC0_GSUWGMRR0_K1_LBSPPA256_LBSPPB256_LPA16_LPB16_MIWT1_1_PLR1_SU0_SUM0_SUS128_VWA1_VWB1_WGM1_WGMXCC1_WGMXCCGn1
    SolutionIndex: 114
    SolutionNameMin: Cijk_Ailk_Bjlk_B8NSS_BH_Bias_HAS_SAV_UserArgs_MT32x32x128_MI16x16x1_SN_LDSB0_CLR1_GRVWA8_GRVWB8_GSU0_GSUC0_GSUWGMRR0_K1_LBSPPA256_LBSPPB256_LPA16_LPB16_MIWT1_1_PLR1_SU0_SUM0_SUS128_VWA1_VWB1_WGM1_WGMXCC1_WGMXCCGn1
    SolutionIndex: 115
    SolutionNameMin: Cijk_Ailk_Bjlk_B8NSS_BH_Bias_HAS_SAV_UserArgs_MT32x32x128_MI16x16x1_SN_LDSB0_CLR1_GRVWA4_GRVWB16_GSU0_GSUC0_GSUWGMRR0_K1_LBSPPA256_LBSPPB256_LPA16_LPB16_MIWT1_1_PLR1_SU0_SUM0_SUS128_VWA1_VWB1_WGM1_WGMXCC1_WGMXCCGn1
    SolutionIndex: 116
    SolutionNameMin: Cijk_Ailk_Bjlk_B8NSS_BH_Bias_HAS_SAV_UserArgs_MT32x32x128_MI16x16x1_SN_LDSB0_CLR1_GRVWA8_GRVWB16_GSU0_GSUC0_GSUWGMRR0_K1_LBSPPA256_LBSPPB256_LPA16_LPB16_MIWT1_1_PLR1_SU0_SUM0_SUS128_VWA1_VWB1_WGM1_WGMXCC1_WGMXCCGn1
    SolutionIndex: 117
    SolutionNameMin: Cijk_Ailk_Bjlk_B8NSS_BH_Bias_HAS_SAV_UserArgs_MT32x32x128_MI16x16x1_SN_LDSB0_CLR1_GRVWA16_GRVWB16_GSU0_GSUC0_GSUWGMRR0_K1_LBSPPA256_LBSPPB256_LPA16_LPB16_MIWT1_1_PLR1_SU0_SUM0_SUS128_VWA1_VWB1_WGM4_WGMXCC1_WGMXCCGn1
    SolutionIndex: 118
    SolutionNameMin: Cijk_Ailk_Bjlk_B8NSS_BH_Bias_HAS_SAV_UserArgs_MT128x64x256_MI16x16x1_SN_LDSB1_CLR1_GRVWA4_GRVWB16_GSU0_GSUC0_GSUWGMRR0_K1_LBSPPA1024_LBSPPB512_LPA64_LPB32_MIWT4_2_PLR1_SU0_SUM0_SUS256_VWA4_VWB2_WGM1_WGMXCC1_WGMXCCGn1
    SolutionIndex: 119
    SolutionNameMin: Cijk_Ailk_Bjlk_B8NSS_BH_Bias_HAS_SAV_UserArgs_MT128x64x256_MI16x16x1_SN_LDSB1_CLR1_GRVWA16_GRVWB16_GSU0_GSUC0_GSUWGMRR0_K1_LBSPPA1024_LBSPPB512_LPA64_LPB32_MIWT4_2_PLR1_SU0_SUM0_SUS256_VWA4_VWB2_WGM6_WGMXCC1_WGMXCCGn1
    SolutionIndex: 120
    SolutionNameMin: Cijk_Ailk_Bjlk_B8NSS_BH_Bias_HAS_SAV_UserArgs_MT64x64x256_MI16x16x1_SN_LDSB1_CLR1_GRVWA16_GRVWB16_GSU0_GSUC0_GSUWGMRR0_K1_LBSPPA512_LBSPPB512_LPA32_LPB32_MIWT2_2_PLR1_SU0_SUM0_SUS256_VWA2_VWB2_WGM1_WGMXCC1_WGMXCCGn1
    SolutionIndex: 121
    SolutionNameMin: Cijk_Ailk_Bjlk_B8NSS_BH_Bias_HAS_SAV_UserArgs_MT64x64x256_MI16x16x1_SN_LDSB1_CLR1_GRVWA16_GRVWB16_GSU0_GSUC0_GSUWGMRR0_K1_LBSPPA512_LBSPPB512_LPA32_LPB32_MIWT2_2_PLR1_SU0_SUM0_SUS256_VWA2_VWB2_WGM6_WGMXCC1_WGMXCCGn1
    SolutionIndex: 122
    SolutionNameMin: Cijk_Ailk_Bjlk_B8NSS_BH_Bias_HAS_SAV_UserArgs_MT64x32x256_MI16x16x1_SN_LDSB1_CLR1_GRVWA16_GRVWB16_GSU0_GSUC0_GSUWGMRR0_K1_LBSPPA512_LBSPPB256_LPA32_LPB16_MIWT2_1_PLR1_SU0_SUM0_SUS256_VWA2_VWB1_WGM1_WGMXCC1_WGMXCCGn1
    SolutionIndex: 123
    SolutionNameMin: Cijk_Ailk_Bjlk_B8NSS_BH_Bias_HAS_SAV_UserArgs_MT64x32x256_MI16x16x1_SN_LDSB1_CLR1_GRVWA16_GRVWB16_GSU0_GSUC0_GSUWGMRR0_K1_LBSPPA512_LBSPPB256_LPA32_LPB16_MIWT2_1_PLR1_SU0_SUM0_SUS256_VWA2_VWB1_WGM4_WGMXCC1_WGMXCCGn1
    SolutionIndex: 124
    SolutionNameMin: Cijk_Ailk_Bjlk_B8NSS_BH_Bias_HAS_SAV_UserArgs_MT64x32x256_MI16x16x1_SN_LDSB1_CLR1_GRVWA16_GRVWB16_GSU0_GSUC0_GSUWGMRR0_K1_LBSPPA512_LBSPPB256_LPA32_LPB16_MIWT2_1_PLR1_SU0_SUM0_SUS256_VWA2_VWB1_WGM6_WGMXCC1_WGMXCCGn1
    SolutionIndex: 125
    SolutionNameMin: Cijk_Ailk_Bjlk_B8NSS_BH_Bias_HAS_SAV_UserArgs_MT32x32x256_MI16x16x1_SN_LDSB1_CLR1_GRVWA8_GRVWB16_GSU0_GSUC0_GSUWGMRR0_K1_LBSPPA256_LBSPPB256_LPA16_LPB16_MIWT1_1_PLR1_SU0_SUM0_SUS256_VWA1_VWB1_WGM1_WGMXCC1_WGMXCCGn1
    SolutionIndex: 126
    SolutionNameMin: Cijk_Ailk_Bjlk_B8NSS_BH_Bias_HAS_SAV_UserArgs_MT32x32x256_MI16x16x1_SN_LDSB1_CLR1_GRVWA16_GRVWB16_GSU0_GSUC0_GSUWGMRR0_K1_LBSPPA256_LBSPPB256_LPA16_LPB16_MIWT1_1_PLR1_SU0_SUM0_SUS256_VWA1_VWB1_WGM1_WGMXCC1_WGMXCCGn1
    SolutionIndex: 127
    SolutionNameMin: Cijk_Ailk_Bjlk_B8NSS_BH_Bias_HAS_SAV_UserArgs_MT32x32x256_MI16x16x1_SN_LDSB1_CLR1_GRVWA8_GRVWB16_GSU0_GSUC0_GSUWGMRR0_K1_LBSPPA256_LBSPPB256_LPA16_LPB16_MIWT1_1_PLR1_SU0_SUM0_SUS256_VWA1_VWB1_WGM6_WGMXCC1_WGMXCCGn1
    SolutionIndex: 128
    SolutionNameMin: Cijk_Ailk_Bjlk_B8NSS_BH_Bias_HAS_SAV_UserArgs_MT32x32x256_MI16x16x1_SN_LDSB1_CLR1_GRVWA16_GRVWB16_GSU0_GSUC0_GSUWGMRR0_K1_LBSPPA256_LBSPPB256_LPA16_LPB16_MIWT1_1_PLR1_SU0_SUM0_SUS256_VWA1_VWB1_WGM6_WGMXCC1_WGMXCCGn1
    SolutionIndex: 129
    SolutionNameMin: Cijk_Ailk_Bjlk_B8NSS_BH_Bias_HAS_SAV_UserArgs_MT32x32x256_MI16x16x1_SN_LDSB1_CLR1_GRVWA16_GRVWB16_GSU0_GSUC0_GSUWGMRR0_K1_LBSPPA256_LBSPPB256_LPA16_LPB16_MIWT1_1_PLR1_SU0_SUM0_SUS256_VWA1_VWB1_WGM8_WGMXCC1_WGMXCCGn1
- - - [128, 128, 1, 128, 128, 128, 128, 128]
    - [111, 0.52]
  - - [128, 128, 1, 256, 128, 128, 128, 128]
    - [111, 0.92]
  - - [128, 128, 1, 512, 128, 128, 128, 128]
    - [111, 1.5]
  - - [128, 128, 1, 1024, 128, 128, 128, 128]
    - [114, 2.22]
  - - [128, 128, 1, 2048, 128, 128, 128, 128]
    - [116, 2.95]
  - - [128, 128, 1, 4096, 128, 128, 128, 128]
    - [116, 3.53]
  - - [128, 128, 1, 8192, 128, 128, 128, 128]
    - [126, 3.93]
  - - [128, 256, 1, 128, 128, 128, 128, 256]
    - [69, 1.05]
  - - [128, 256, 1, 256, 128, 128, 128, 256]
    - [68, 1.86]
  - - [128, 256, 1, 512, 128, 128, 128, 256]
    - [114, 3.03]
  - - [128, 256, 1, 1024, 128, 128, 128, 256]
    - [114, 4.51]
  - - [128, 256, 1, 2048, 128, 128, 128, 256]
    - [116, 5.95]
  - - [128, 256, 1, 4096, 128, 128, 128, 256]
    - [126, 7.1]
  - - [128, 256, 1, 8192, 128, 128, 128, 256]
    - [126, 7.9]
  - - [128, 512, 1, 128, 128, 128, 128, 512]
    - [67, 2.1]
  - - [128, 512, 1, 256, 128, 128, 128, 512]
    - [68, 3.67]
  - - [128, 512, 1, 512, 128, 128, 128, 512]
    - [69, 5.81]
  - - [128, 512, 1, 1024, 128, 128, 128, 512]
    - [114, 8.77]
  - - [128, 512, 1, 2048, 128, 128, 128, 512]
    - [116, 11.63]
  - - [128, 512, 1, 4096, 128, 128, 128, 512]
    - [116, 13.81]
  - - [128, 512, 1, 8192, 128, 128, 128, 512]
    - [126, 15.09]
  - - [128, 1024, 1, 128, 128, 128, 128, 1024]
    - [112, 3.87]
  - - [128, 1024, 1, 256, 128, 128, 128, 1024]
    - [67, 7.13]
  - - [128, 1024, 1, 512, 128, 128, 128, 1024]
    - [111, 11.41]
  - - [128, 1024, 1, 1024, 128, 128, 128, 1024]
    - [114, 17.14]
  - - [128, 1024, 1, 2048, 128, 128, 128, 1024]
    - [116, 22.74]
  - - [128, 1024, 1, 4096, 128, 128, 128, 1024]
    - [125, 25.92]
  - - [128, 1024, 1, 8192, 128, 128, 128, 1024]
    - [127, 27.73]
  - - [128, 2048, 1, 128, 128, 128, 128, 2048]
    - [66, 7.38]
  - - [128, 2048, 1, 256, 128, 128, 128, 2048]
    - [66, 12.69]
  - - [128, 2048, 1, 512, 128, 128, 128, 2048]
    - [101, 20.72]
  - - [128, 2048, 1, 1024, 128, 128, 128, 2048]
    - [108, 30.36]
  - - [128, 2048, 1, 2048, 128, 128, 128, 2048]
    - [122, 38.85]
  - - [128, 2048, 1, 4096, 128, 128, 128, 2048]
    - [124, 47.13]
  - - [128, 2048, 1, 8192, 128, 128, 128, 2048]
    - [124, 53.2]
  - - [128, 4096, 1, 128, 128, 128, 128, 4096]
    - [60, 12.66]
  - - [128, 4096, 1, 256, 128, 128, 128, 4096]
    - [62, 21.87]
  - - [128, 4096, 1, 512, 128, 128, 128, 4096]
    - [89, 34.98]
  - - [128, 4096, 1, 1024, 128, 128, 128, 4096]
    - [91, 51.49]
  - - [128, 4096, 1, 2048, 128, 128, 128, 4096]
    - [120, 65.81]
  - - [128, 4096, 1, 4096, 128, 128, 128, 4096]
    - [120, 80.52]
  - - [128, 4096, 1, 8192, 128, 128, 128, 4096]
    - [121, 89.49]
  - - [128, 8192, 1, 128, 128, 128, 128, 8192]
    - [55, 20.44]
  - - [128, 8192, 1, 256, 128, 128, 128, 8192]
    - [55, 35.99]
  - - [128, 8192, 1, 512, 128, 128, 128, 8192]
    - [56, 56.82]
  - - [128, 8192, 1, 1024, 128, 128, 128, 8192]
    - [85, 81.35]
  - - [128, 8192, 1, 2048, 128, 128, 128, 8192]
    - [85, 102.33]
  - - [128, 8192, 1, 4096, 128, 128, 128, 8192]
    - [119, 121.05]
  - - [128, 8192, 1, 8192, 128, 128, 128, 8192]
    - [118, 126.39]
  - - [256, 128, 1, 128, 256, 256, 256, 128]
    - [70, 0.96]
  - - [256, 128, 1, 256, 256, 256, 256, 128]
    - [112, 1.85]
  - - [256, 128, 1, 512, 256, 256, 256, 128]
    - [115, 2.91]
  - - [256, 128, 1, 1024, 256, 256, 256, 128]
    - [116, 4.37]
  - - [256, 128, 1, 2048, 256, 256, 256, 128]
    - [116, 5.97]
  - - [256, 128, 1, 4096, 256, 256, 256, 128]
    - [116, 7.02]
  - - [256, 128, 1, 8192, 256, 256, 256, 128]
    - [126, 7.85]
  - - [256, 256, 1, 128, 256, 256, 256, 256]
    - [69, 2.02]
  - - [256, 256, 1, 256, 256, 256, 256, 256]
    - [112, 3.51]
  - - [256, 256, 1, 512, 256, 256, 256, 256]
    - [111, 5.74]
  - - [256, 256, 1, 1024, 256, 256, 256, 256]
    - [116, 8.7]
  - - [256, 256, 1, 2048, 256, 256, 256, 256]
    - [116, 11.63]
  - - [256, 256, 1, 4096, 256, 256, 256, 256]
    - [116, 14.13]
  - - [256, 256, 1, 8192, 256, 256, 256, 256]
    - [126, 15.61]
  - - [256, 512, 1, 128, 256, 256, 256, 512]
    - [67, 4.06]
  - - [256, 512, 1, 256, 256, 256, 256, 512]
    - [68, 6.8]
  - - [256, 512, 1, 512, 256, 256, 256, 512]
    - [111, 11.19]
  - - [256, 512, 1, 1024, 256, 256, 256, 512]
    - [114, 16.88]
  - - [256, 512, 1, 2048, 256, 256, 256, 512]
    - [116, 22.62]
  - - [256, 512, 1, 4096, 256, 256, 256, 512]
    - [116, 27.5]
  - - [256, 512, 1, 8192, 256, 256, 256, 512]
    - [125, 29.79]
  - - [256, 1024, 1, 128, 256, 256, 256, 1024]
    - [107, 7.3]
  - - [256, 1024, 1, 256, 256, 256, 256, 1024]
    - [65, 12.67]
  - - [256, 1024, 1, 512, 256, 256, 256, 1024]
    - [100, 20.72]
  - - [256, 1024, 1, 1024, 256, 256, 256, 1024]
    - [103, 30.41]
  - - [256, 1024, 1, 2048, 256, 256, 256, 1024]
    - [122, 40.53]
  - - [256, 1024, 1, 4096, 256, 256, 256, 1024]
    - [122, 48.32]
  - - [256, 1024, 1, 8192, 256, 256, 256, 1024]
    - [124, 53.74]
  - - [256, 2048, 1, 128, 256, 256, 256, 2048]
    - [60, 12.74]
  - - [256, 2048, 1, 256, 256, 256, 256, 2048]
    - [63, 22.09]
  - - [256, 2048, 1, 512, 256, 256, 256, 2048]
    - [63, 34.71]
  - - [256, 2048, 1, 1024, 256, 256, 256, 2048]
    - [90, 50.79]
  - - [256, 2048, 1, 2048, 256, 256, 256, 2048]
    - [90, 65.26]
  - - [256, 2048, 1, 4096, 256, 256, 256, 2048]
    - [90, 78.23]
  - - [256, 2048, 1, 8192, 256, 256, 256, 2048]
    - [91, 85.85]
  - - [256, 4096, 1, 128, 256, 256, 256, 4096]
    - [50, 20.27]
  - - [256, 4096, 1, 256, 256, 256, 256, 4096]
    - [59, 35.34]
  - - [256, 4096, 1, 512, 256, 256, 256, 4096]
    - [52, 56.26]
  - - [256, 4096, 1, 1024, 256, 256, 256, 4096]
    - [53, 81.04]
  - - [256, 4096, 1, 2048, 256, 256, 256, 4096]
    - [85, 102.3]
  - - [256, 4096, 1, 4096, 256, 256, 256, 4096]
    - [85, 121.58]
  - - [256, 4096, 1, 8192, 256, 256, 256, 4096]
    - [87, 126.6]
  - - [256, 8192, 1, 128, 256, 256, 256, 8192]
    - [35, 29.79]
  - - [256, 8192, 1, 256, 256, 256, 256, 8192]
    - [36, 51.91]
  - - [256, 8192, 1, 512, 256, 256, 256, 8192]
    - [40, 82.75]
  - - [256, 8192, 1, 1024, 256, 256, 256, 8192]
    - [39, 116.08]
  - - [256, 8192, 1, 2048, 256, 256, 256, 8192]
    - [40, 147.05]
  - - [256, 8192, 1, 4096, 256, 256, 256, 8192]
    - [40, 166.77]
  - - [256, 8192, 1, 8192, 256, 256, 256, 8192]
    - [84, 157.49]
  - - [512, 128, 1, 128, 512, 512, 512, 128]
    - [67, 2.12]
  - - [512, 128, 1, 256, 512, 512, 512, 128]
    - [67, 3.66]
  - - [512, 128, 1, 512, 512, 512, 512, 128]
    - [115, 5.99]
  - - [512, 128, 1, 1024, 512, 512, 512, 128]
    - [115, 8.88]
  - - [512, 128, 1, 2048, 512, 512, 512, 128]
    - [116, 11.84]
  - - [512, 128, 1, 4096, 512, 512, 512, 128]
    - [116, 14.14]
  - - [512, 128, 1, 8192, 512, 512, 512, 128]
    - [128, 14.8]
  - - [512, 256, 1, 128, 512, 512, 512, 256]
    - [69, 3.94]
  - - [512, 256, 1, 256, 512, 512, 512, 256]
    - [67, 7.01]
  - - [512, 256, 1, 512, 512, 512, 512, 256]
    - [113, 11.37]
  - - [512, 256, 1, 1024, 512, 512, 512, 256]
    - [114, 17.11]
  - - [512, 256, 1, 2048, 512, 512, 512, 256]
    - [116, 22.8]
  - - [512, 256, 1, 4096, 512, 512, 512, 256]
    - [116, 27.54]
  - - [512, 256, 1, 8192, 512, 512, 512, 256]
    - [117, 27.89]
  - - [512, 512, 1, 128, 512, 512, 512, 512]
    - [66, 7.31]
  - - [512, 512, 1, 256, 512, 512, 512, 512]
    - [65, 12.57]
  - - [512, 512, 1, 512, 512, 512, 512, 512]
    - [108, 20.6]
  - - [512, 512, 1, 1024, 512, 512, 512, 512]
    - [103, 30.27]
  - - [512, 512, 1, 2048, 512, 512, 512, 512]
    - [122, 40.28]
  - - [512, 512, 1, 4096, 512, 512, 512, 512]
    - [103, 46.09]
  - - [512, 512, 1, 8192, 512, 512, 512, 512]
    - [110, 50.09]
  - - [512, 1024, 1, 128, 512, 512, 512, 1024]
    - [60, 12.74]
  - - [512, 1024, 1, 256, 512, 512, 512, 1024]
    - [62, 21.77]
  - - [512, 1024, 1, 512, 512, 512, 512, 1024]
    - [63, 35.14]
  - - [512, 1024, 1, 1024, 512, 512, 512, 1024]
    - [90, 51.47]
  - - [512, 1024, 1, 2048, 512, 512, 512, 1024]
    - [90, 67.34]
  - - [512, 1024, 1, 4096, 512, 512, 512, 1024]
    - [96, 74.73]
  - - [512, 1024, 1, 8192, 512, 512, 512, 1024]
    - [97, 80.11]
  - - [512, 2048, 1, 128, 512, 512, 512, 2048]
    - [55, 20.46]
  - - [512, 2048, 1, 256, 512, 512, 512, 2048]
    - [55, 35.42]
  - - [512, 2048, 1, 512, 512, 512, 512, 2048]
    - [51, 56.45]
  - - [512, 2048, 1, 1024, 512, 512, 512, 2048]
    - [85, 81.53]
  - - [512, 2048, 1, 2048, 512, 512, 512, 2048]
    - [85, 102.34]
  - - [512, 2048, 1, 4096, 512, 512, 512, 2048]
    - [85, 120.67]
  - - [512, 2048, 1, 8192, 512, 512, 512, 2048]
    - [53, 124.64]
  - - [512, 4096, 1, 128, 512, 512, 512, 4096]
    - [46, 30.44]
  - - [512, 4096, 1, 256, 512, 512, 512, 4096]
    - [46, 52.13]
  - - [512, 4096, 1, 512, 512, 512, 512, 4096]
    - [36, 80.91]
  - - [512, 4096, 1, 1024, 512, 512, 512, 4096]
    - [40, 117.3]
  - - [512, 4096, 1, 2048, 512, 512, 512, 4096]
    - [40, 149.54]
  - - [512, 4096, 1, 4096, 512, 512, 512, 4096]
    - [40, 169.37]
  - - [512, 4096, 1, 8192, 512, 512, 512, 4096]
    - [42, 158.77]
  - - [512, 8192, 1, 128, 512, 512, 512, 8192]
    - [17, 38.02]
  - - [512, 8192, 1, 256, 512, 512, 512, 8192]
    - [17, 66.56]
  - - [512, 8192, 1, 512, 512, 512, 512, 8192]
    - [17, 106.44]
  - - [512, 8192, 1, 1024, 512, 512, 512, 8192]
    - [15, 153.05]
  - - [512, 8192, 1, 2048, 512, 512, 512, 8192]
    - [12, 193.04]
  - - [512, 8192, 1, 4096, 512, 512, 512, 8192]
    - [76, 206.43]
  - - [512, 8192, 1, 8192, 512, 512, 512, 8192]
    - [78, 206.59]
  - - [1024, 128, 1, 128, 1024, 1024, 1024, 128]
    - [67, 4.01]
  - - [1024, 128, 1, 256, 1024, 1024, 1024, 128]
    - [67, 7.13]
  - - [1024, 128, 1, 512, 1024, 1024, 1024, 128]
    - [114, 11.35]
  - - [1024, 128, 1, 1024, 1024, 1024, 1024, 128]
    - [114, 17.06]
  - - [1024, 128, 1, 2048, 1024, 1024, 1024, 128]
    - [116, 22.73]
  - - [1024, 128, 1, 4096, 1024, 1024, 1024, 128]
    - [129, 25.58]
  - - [1024, 128, 1, 8192, 1024, 1024, 1024, 128]
    - [129, 26.6]
  - - [1024, 256, 1, 128, 1024, 1024, 1024, 256]
    - [66, 7.25]
  - - [1024, 256, 1, 256, 1024, 1024, 1024, 256]
    - [66, 12.54]
  - - [1024, 256, 1, 512, 1024, 1024, 1024, 256]
    - [109, 20.52]
  - - [1024, 256, 1, 1024, 1024, 1024, 1024, 256]
    - [108, 30.28]
  - - [1024, 256, 1, 2048, 1024, 1024, 1024, 256]
    - [122, 40.43]
  - - [1024, 256, 1, 4096, 1024, 1024, 1024, 256]
    - [105, 46.1]
  - - [1024, 256, 1, 8192, 1024, 1024, 1024, 256]
    - [123, 49.03]
  - - [1024, 512, 1, 128, 1024, 1024, 1024, 512]
    - [64, 12.54]
  - - [1024, 512, 1, 256, 1024, 1024, 1024, 512]
    - [64, 21.85]
  - - [1024, 512, 1, 512, 1024, 1024, 1024, 512]
    - [92, 34.99]
  - - [1024, 512, 1, 1024, 1024, 1024, 1024, 512]
    - [98, 51.47]
  - - [1024, 512, 1, 2048, 1024, 1024, 1024, 512]
    - [94, 67.35]
  - - [1024, 512, 1, 4096, 1024, 1024, 1024, 512]
    - [97, 74.48]
  - - [1024, 512, 1, 8192, 1024, 1024, 1024, 512]
    - [96, 79.56]
  - - [1024, 1024, 1, 128, 1024, 1024, 1024, 1024]
    - [57, 20.41]
  - - [1024, 1024, 1, 256, 1024, 1024, 1024, 1024]
    - [57, 35.54]
  - - [1024, 1024, 1, 512, 1024, 1024, 1024, 1024]
    - [52, 56.67]
  - - [1024, 1024, 1, 1024, 1024, 1024, 1024, 1024]
    - [53, 81.51]
  - - [1024, 1024, 1, 2048, 1024, 1024, 1024, 1024]
    - [85, 103.25]
  - - [1024, 1024, 1, 4096, 1024, 1024, 1024, 1024]
    - [87, 120.45]
  - - [1024, 1024, 1, 8192, 1024, 1024, 1024, 1024]
    - [88, 122.9]
  - - [1024, 2048, 1, 128, 1024, 1024, 1024, 2048]
    - [36, 30.3]
  - - [1024, 2048, 1, 256, 1024, 1024, 1024, 2048]
    - [36, 52.75]
  - - [1024, 2048, 1, 512, 1024, 1024, 1024, 2048]
    - [40, 83.32]
  - - [1024, 2048, 1, 1024, 1024, 1024, 1024, 2048]
    - [40, 117.62]
  - - [1024, 2048, 1, 2048, 1024, 1024, 1024, 2048]
    - [39, 147.39]
  - - [1024, 2048, 1, 4096, 1024, 1024, 1024, 2048]
    - [40, 166.07]
  - - [1024, 2048, 1, 8192, 1024, 1024, 1024, 2048]
    - [47, 157.06]
  - - [1024, 4096, 1, 128, 1024, 1024, 1024, 4096]
    - [16, 37.93]
  - - [1024, 4096, 1, 256, 1024, 1024, 1024, 4096]
    - [15, 66.93]
  - - [1024, 4096, 1, 512, 1024, 1024, 1024, 4096]
    - [13, 107.79]
  - - [1024, 4096, 1, 1024, 1024, 1024, 1024, 4096]
    - [13, 155.24]
  - - [1024, 4096, 1, 2048, 1024, 1024, 1024, 4096]
    - [15, 195.2]
  - - [1024, 4096, 1, 4096, 1024, 1024, 1024, 4096]
    - [78, 202.47]
  - - [1024, 4096, 1, 8192, 1024, 1024, 1024, 4096]
    - [78, 205.72]
  - - [1024, 8192, 1, 128, 1024, 1024, 1024, 8192]
    - [25, 41.85]
  - - [1024, 8192, 1, 256, 1024, 1024, 1024, 8192]
    - [25, 73.99]
  - - [1024, 8192, 1, 512, 1024, 1024, 1024, 8192]
    - [26, 114.83]
  - - [1024, 8192, 1, 1024, 1024, 1024, 1024, 8192]
    - [29, 162.41]
  - - [1024, 8192, 1, 2048, 1024, 1024, 1024, 8192]
    - [73, 203.59]
  - - [1024, 8192, 1, 4096, 1024, 1024, 1024, 8192]
    - [82, 221.39]
  - - [1024, 8192, 1, 8192, 1024, 1024, 1024, 8192]
    - [5, 247.6]
  - - [2048, 128, 1, 128, 2048, 2048, 2048, 128]
    - [99, 7.37]
  - - [2048, 128, 1, 256, 2048, 2048, 2048, 128]
    - [65, 12.8]
  - - [2048, 128, 1, 512, 2048, 2048, 2048, 128]
    - [102, 20.69]
  - - [2048, 128, 1, 1024, 2048, 2048, 2048, 128]
    - [103, 30.55]
  - - [2048, 128, 1, 2048, 2048, 2048, 2048, 128]
    - [105, 37.56]
  - - [2048, 128, 1, 4096, 2048, 2048, 2048, 128]
    - [104, 45.23]
  - - [2048, 128, 1, 8192, 2048, 2048, 2048, 128]
    - [106, 50.08]
  - - [2048, 256, 1, 128, 2048, 2048, 2048, 256]
    - [62, 12.9]
  - - [2048, 256, 1, 256, 2048, 2048, 2048, 256]
    - [62, 21.94]
  - - [2048, 256, 1, 512, 2048, 2048, 2048, 256]
    - [90, 35.53]
  - - [2048, 256, 1, 1024, 2048, 2048, 2048, 256]
    - [90, 51.99]
  - - [2048, 256, 1, 2048, 2048, 2048, 2048, 256]
    - [98, 65.64]
  - - [2048, 256, 1, 4096, 2048, 2048, 2048, 256]
    - [93, 77.19]
  - - [2048, 256, 1, 8192, 2048, 2048, 2048, 256]
    - [97, 84.58]
  - - [2048, 512, 1, 128, 2048, 2048, 2048, 512]
    - [55, 20.5]
  - - [2048, 512, 1, 256, 2048, 2048, 2048, 512]
    - [54, 35.95]
  - - [2048, 512, 1, 512, 2048, 2048, 2048, 512]
    - [55, 57.19]
  - - [2048, 512, 1, 1024, 2048, 2048, 2048, 512]
    - [85, 81.56]
  - - [2048, 512, 1, 2048, 2048, 2048, 2048, 512]
    - [86, 102.47]
  - - [2048, 512, 1, 4096, 2048, 2048, 2048, 512]
    - [86, 120.03]
  - - [2048, 512, 1, 8192, 2048, 2048, 2048, 512]
    - [88, 126.51]
  - - [2048, 1024, 1, 128, 2048, 2048, 2048, 1024]
    - [36, 30.39]
  - - [2048, 1024, 1, 256, 2048, 2048, 2048, 1024]
    - [38, 52.25]
  - - [2048, 1024, 1, 512, 2048, 2048, 2048, 1024]
    - [40, 82.24]
  - - [2048, 1024, 1, 1024, 2048, 2048, 2048, 1024]
    - [48, 115.33]
  - - [2048, 1024, 1, 2048, 2048, 2048, 2048, 1024]
    - [49, 146.5]
  - - [2048, 1024, 1, 4096, 2048, 2048, 2048, 1024]
    - [49, 164.59]
  - - [2048, 1024, 1, 8192, 2048, 2048, 2048, 1024]
    - [49, 157.99]
  - - [2048, 2048, 1, 128, 2048, 2048, 2048, 2048]
    - [10, 35.09]
  - - [2048, 2048, 1, 256, 2048, 2048, 2048, 2048]
    - [10, 62.52]
  - - [2048, 2048, 1, 512, 2048, 2048, 2048, 2048]
    - [14, 101.67]
  - - [2048, 2048, 1, 1024, 2048, 2048, 2048, 2048]
    - [10, 147.75]
  - - [2048, 2048, 1, 2048, 2048, 2048, 2048, 2048]
    - [14, 188.97]
  - - [2048, 2048, 1, 4096, 2048, 2048, 2048, 2048]
    - [78, 207.94]
  - - [2048, 2048, 1, 8192, 2048, 2048, 2048, 2048]
    - [81, 205.25]
  - - [2048, 4096, 1, 128, 2048, 2048, 2048, 4096]
    - [8, 37.89]
  - - [2048, 4096, 1, 256, 2048, 2048, 2048, 4096]
    - [14, 67.41]
  - - [2048, 4096, 1, 512, 2048, 2048, 2048, 4096]
    - [14, 109.89]
  - - [2048, 4096, 1, 1024, 2048, 2048, 2048, 4096]
    - [72, 155.68]
  - - [2048, 4096, 1, 2048, 2048, 2048, 2048, 4096]
    - [72, 194.5]
  - - [2048, 4096, 1, 4096, 2048, 2048, 2048, 4096]
    - [78, 220.99]
  - - [2048, 4096, 1, 8192, 2048, 2048, 2048, 4096]
    - [2, 247.65]
  - - [2048, 8192, 1, 128, 2048, 2048, 2048, 8192]
    - [24, 45.61]
  - - [2048, 8192, 1, 256, 2048, 2048, 2048, 8192]
    - [24, 78.92]
  - - [2048, 8192, 1, 512, 2048, 2048, 2048, 8192]
    - [24, 123.28]
  - - [2048, 8192, 1, 1024, 2048, 2048, 2048, 8192]
    - [30, 158.55]
  - - [2048, 8192, 1, 2048, 2048, 2048, 2048, 8192]
    - [14, 202.71]
  - - [2048, 8192, 1, 4096, 2048, 2048, 2048, 8192]
    - [3, 249.63]
  - - [2048, 8192, 1, 8192, 2048, 2048, 2048, 8192]
    - [74, 300.85]
  - - [4096, 128, 1, 128, 4096, 4096, 4096, 128]
    - [60, 12.86]
  - - [4096, 128, 1, 256, 4096, 4096, 4096, 128]
    - [61, 21.83]
  - - [4096, 128, 1, 512, 4096, 4096, 4096, 128]
    - [90, 35.14]
  - - [4096, 128, 1, 1024, 4096, 4096, 4096, 128]
    - [90, 51.46]
  - - [4096, 128, 1, 2048, 4096, 4096, 4096, 128]
    - [91, 63.7]
  - - [4096, 128, 1, 4096, 4096, 4096, 4096, 128]
    - [97, 75.69]
  - - [4096, 128, 1, 8192, 4096, 4096, 4096, 128]
    - [95, 83.73]
  - - [4096, 256, 1, 128, 4096, 4096, 4096, 256]
    - [55, 19.65]
  - - [4096, 256, 1, 256, 4096, 4096, 4096, 256]
    - [55, 34.63]
  - - [4096, 256, 1, 512, 4096, 4096, 4096, 256]
    - [58, 56.11]
  - - [4096, 256, 1, 1024, 4096, 4096, 4096, 256]
    - [88, 78.91]
  - - [4096, 256, 1, 2048, 4096, 4096, 4096, 256]
    - [88, 103.09]
  - - [4096, 256, 1, 4096, 4096, 4096, 4096, 256]
    - [88, 119.98]
  - - [4096, 256, 1, 8192, 4096, 4096, 4096, 256]
    - [88, 125.68]
  - - [4096, 512, 1, 128, 4096, 4096, 4096, 512]
    - [38, 28.8]
  - - [4096, 512, 1, 256, 4096, 4096, 4096, 512]
    - [35, 49.75]
  - - [4096, 512, 1, 512, 4096, 4096, 4096, 512]
    - [40, 77.42]
  - - [4096, 512, 1, 1024, 4096, 4096, 4096, 512]
    - [41, 108.84]
  - - [4096, 512, 1, 2048, 4096, 4096, 4096, 512]
    - [44, 140.61]
  - - [4096, 512, 1, 4096, 4096, 4096, 4096, 512]
    - [45, 161.89]
  - - [4096, 512, 1, 8192, 4096, 4096, 4096, 512]
    - [47, 159.49]
  - - [4096, 1024, 1, 128, 4096, 4096, 4096, 1024]
    - [19, 34.23]
  - - [4096, 1024, 1, 256, 4096, 4096, 4096, 1024]
    - [21, 60.61]
  - - [4096, 1024, 1, 512, 4096, 4096, 4096, 1024]
    - [23, 99.88]
  - - [4096, 1024, 1, 1024, 4096, 4096, 4096, 1024]
    - [80, 149.31]
  - - [4096, 1024, 1, 2048, 4096, 4096, 4096, 1024]
    - [83, 193.62]
  - - [4096, 1024, 1, 4096, 4096, 4096, 4096, 1024]
    - [82, 205.5]
  - - [4096, 1024, 1, 8192, 4096, 4096, 4096, 1024]
    - [81, 206.63]
  - - [4096, 2048, 1, 128, 4096, 4096, 4096, 2048]
    - [13, 35.87]
  - - [4096, 2048, 1, 256, 4096, 4096, 4096, 2048]
    - [13, 63.3]
  - - [4096, 2048, 1, 512, 4096, 4096, 4096, 2048]
    - [11, 104.92]
  - - [4096, 2048, 1, 1024, 4096, 4096, 4096, 2048]
    - [4, 149.96]
  - - [4096, 2048, 1, 2048, 4096, 4096, 4096, 2048]
    - [6, 191.41]
  - - [4096, 2048, 1, 4096, 4096, 4096, 4096, 2048]
    - [21, 218.79]
  - - [4096, 2048, 1, 8192, 4096, 4096, 4096, 2048]
    - [13, 253.98]
  - - [4096, 4096, 1, 128, 4096, 4096, 4096, 4096]
    - [13, 39.37]
  - - [4096, 4096, 1, 256, 4096, 4096, 4096, 4096]
    - [10, 68.77]
  - - [4096, 4096, 1, 512, 4096, 4096, 4096, 4096]
    - [37, 113.78]
  - - [4096, 4096, 1, 1024, 4096, 4096, 4096, 4096]
    - [7, 150.21]
  - - [4096, 4096, 1, 2048, 4096, 4096, 4096, 4096]
    - [20, 198.9]
  - - [4096, 4096, 1, 4096, 4096, 4096, 4096, 4096]
    - [5, 248.13]
  - - [4096, 4096, 1, 8192, 4096, 4096, 4096, 4096]
    - [72, 303.3]
  - - [4096, 8192, 1, 128, 4096, 4096, 4096, 8192]
    - [27, 43.97]
  - - [4096, 8192, 1, 256, 4096, 4096, 4096, 8192]
    - [24, 73.22]
  - - [4096, 8192, 1, 512, 4096, 4096, 4096, 8192]
    - [13, 113.7]
  - - [4096, 8192, 1, 1024, 4096, 4096, 4096, 8192]
    - [79, 160.68]
  - - [4096, 8192, 1, 2048, 4096, 4096, 4096, 8192]
    - [76, 212.61]
  - - [4096, 8192, 1, 4096, 4096, 4096, 4096, 8192]
    - [73, 278.96]
  - - [4096, 8192, 1, 8192, 4096, 4096, 4096, 8192]
    - [71, 308.47]
  - - [8192, 128, 1, 128, 8192, 8192, 8192, 128]
    - [57, 19.76]
  - - [8192, 128, 1, 256, 8192, 8192, 8192, 128]
    - [55, 35.06]
  - - [8192, 128, 1, 512, 8192, 8192, 8192, 128]
    - [51, 56.05]
  - - [8192, 128, 1, 1024, 8192, 8192, 8192, 128]
    - [53, 80.14]
  - - [8192, 128, 1, 2048, 8192, 8192, 8192, 128]
    - [87, 100.84]
  - - [8192, 128, 1, 4096, 8192, 8192, 8192, 128]
    - [86, 120.28]
  - - [8192, 128, 1, 8192, 8192, 8192, 8192, 128]
    - [87, 122.5]
  - - [8192, 256, 1, 128, 8192, 8192, 8192, 256]
    - [36, 28.48]
  - - [8192, 256, 1, 256, 8192, 8192, 8192, 256]
    - [35, 50.07]
  - - [8192, 256, 1, 512, 8192, 8192, 8192, 256]
    - [35, 79.43]
  - - [8192, 256, 1, 1024, 8192, 8192, 8192, 256]
    - [40, 113.06]
  - - [8192, 256, 1, 2048, 8192, 8192, 8192, 256]
    - [40, 142.59]
  - - [8192, 256, 1, 4096, 8192, 8192, 8192, 256]
    - [43, 164.64]
  - - [8192, 256, 1, 8192, 8192, 8192, 8192, 256]
    - [43, 158.11]
  - - [8192, 512, 1, 128, 8192, 8192, 8192, 512]
    - [34, 36.46]
  - - [8192, 512, 1, 256, 8192, 8192, 8192, 512]
    - [19, 64.04]
  - - [8192, 512, 1, 512, 8192, 8192, 8192, 512]
    - [19, 103.77]
  - - [8192, 512, 1, 1024, 8192, 8192, 8192, 512]
    - [22, 150.82]
  - - [8192, 512, 1, 2048, 8192, 8192, 8192, 512]
    - [19, 193.24]
  - - [8192, 512, 1, 4096, 8192, 8192, 8192, 512]
    - [82, 212.21]
  - - [8192, 512, 1, 8192, 8192, 8192, 8192, 512]
    - [81, 207.13]
  - - [8192, 1024, 1, 128, 8192, 8192, 8192, 1024]
    - [31, 40.19]
  - - [8192, 1024, 1, 256, 8192, 8192, 8192, 1024]
    - [32, 71.57]
  - - [8192, 1024, 1, 512, 8192, 8192, 8192, 1024]
    - [32, 113.75]
  - - [8192, 1024, 1, 1024, 8192, 8192, 8192, 1024]
    - [32, 162.54]
  - - [8192, 1024, 1, 2048, 8192, 8192, 8192, 1024]
    - [5, 200.99]
  - - [8192, 1024, 1, 4096, 8192, 8192, 8192, 1024]
    - [77, 223.99]
  - - [8192, 1024, 1, 8192, 8192, 8192, 8192, 1024]
    - [77, 265.62]
  - - [8192, 2048, 1, 128, 8192, 8192, 8192, 2048]
    - [32, 44.16]
  - - [8192, 2048, 1, 256, 8192, 8192, 8192, 2048]
    - [31, 76.99]
  - - [8192, 2048, 1, 512, 8192, 8192, 8192, 2048]
    - [33, 119.72]
  - - [8192, 2048, 1, 1024, 8192, 8192, 8192, 2048]
    - [33, 161.9]
  - - [8192, 2048, 1, 2048, 8192, 8192, 8192, 2048]
    - [18, 202.79]
  - - [8192, 2048, 1, 4096, 8192, 8192, 8192, 2048]
    - [5, 254.6]
  - - [8192, 2048, 1, 8192, 8192, 8192, 8192, 2048]
    - [72, 308.27]
  - - [8192, 4096, 1, 128, 8192, 8192, 8192, 4096]
    - [32, 41.91]
  - - [8192, 4096, 1, 256, 8192, 8192, 8192, 4096]
    - [36, 70.71]
  - - [8192, 4096, 1, 512, 8192, 8192, 8192, 4096]
    - [12, 118.2]
  - - [8192, 4096, 1, 1024, 8192, 8192, 8192, 4096]
    - [9, 161.07]
  - - [8192, 4096, 1, 2048, 8192, 8192, 8192, 4096]
    - [1, 215.87]
  - - [8192, 4096, 1, 4096, 8192, 8192, 8192, 4096]
    - [0, 280.41]
  - - [8192, 4096, 1, 8192, 8192, 8192, 8192, 4096]
    - [75, 304.08]
  - - [8192, 8192, 1, 128, 8192, 8192, 8192, 8192]
    - [28, 39.61]
  - - [8192, 8192, 1, 256, 8192, 8192, 8192, 8192]
    - [13, 73.03]
  - - [8192, 8192, 1, 512, 8192, 8192, 8192, 8192]
    - [14, 116.92]
  - - [8192, 8192, 1, 1024, 8192, 8192, 8192, 8192]
    - [15, 171.24]
  - - [8192, 8192, 1, 2048, 8192, 8192, 8192, 8192]
    - [3, 236.62]
  - - [8192, 8192, 1, 4096, 8192, 8192, 8192, 8192]
    - [73, 293.64]
  - - [8192, 8192, 1, 8192, 8192, 8192, 8192, 8192]
    - [2, 315.82]
- null
- null
- ExperimentalStreamK
- GridBased
