projects/hipblaslt/library/src/amd_detail/rocblaslt/src/Tensile/Logic/asm_full/aquavanjaram/gfx942_228cu/StreamK/aquavanjaram942_Cijk_Ailk_Bjlk_HHS_BH_Bias_HAS_SAV_UserArgs.yaml
- {MinimumRequiredVersion: 4.33.0}
- aquavanjaram942
- {Architecture: gfx942, CUCount: 228}
- [Device 0049, Device 0050]
    SolutionIndex: 0
    SolutionNameMin: Cijk_Ailk_Bjlk_HHS_BH_Bias_AS_SAV_UserArgs_MT256x256x32_MI16x16x1_SN_LDSB0_CLR1_GRVWA2_GRVWB4_GSU0_GSUC0_GSUWGMRR0_K1_LBSPPA2048_LBSPPB2048_LPA0_LPB0_MIWT8_8_PLR1_SU0_SUM0_SUS64_VWA8_VWB8_WGM1_WGMXCC1_WGMXCCGn1
    SolutionIndex: 1
    SolutionNameMin: Cijk_Ailk_Bjlk_HHS_BH_Bias_AS_SAV_UserArgs_MT256x256x32_MI16x16x1_SN_LDSB0_CLR1_GRVWA2_GRVWB8_GSU0_GSUC0_GSUWGMRR0_K1_LBSPPA2048_LBSPPB2048_LPA0_LPB0_MIWT8_8_PLR1_SU0_SUM0_SUS64_VWA8_VWB8_WGM1_WGMXCC1_WGMXCCGn1
    SolutionIndex: 2
    SolutionNameMin: Cijk_Ailk_Bjlk_HHS_BH_Bias_AS_SAV_UserArgs_MT256x256x32_MI16x16x1_SN_LDSB0_CLR1_GRVWA4_GRVWB8_GSU0_GSUC0_GSUWGMRR0_K1_LBSPPA2048_LBSPPB2048_LPA0_LPB0_MIWT8_8_PLR1_SU0_SUM0_SUS64_VWA8_VWB8_WGM1_WGMXCC1_WGMXCCGn1
    SolutionIndex: 3
    SolutionNameMin: Cijk_Ailk_Bjlk_HHS_BH_Bias_AS_SAV_UserArgs_MT256x256x32_MI16x16x1_SN_LDSB0_CLR1_GRVWA8_GRVWB8_GSU0_GSUC0_GSUWGMRR0_K1_LBSPPA2048_LBSPPB2048_LPA0_LPB0_MIWT8_8_PLR1_SU0_SUM0_SUS64_VWA8_VWB8_WGM1_WGMXCC1_WGMXCCGn1
    SolutionIndex: 4
    SolutionNameMin: Cijk_Ailk_Bjlk_HHS_BH_Bias_AS_SAV_UserArgs_MT256x256x32_MI16x16x1_SN_LDSB0_CLR1_GRVWA4_GRVWB2_GSU0_GSUC0_GSUWGMRR0_K1_LBSPPA2048_LBSPPB2048_LPA0_LPB0_MIWT8_8_PLR1_SU0_SUM0_SUS64_VWA8_VWB8_WGM4_WGMXCC1_WGMXCCGn1
    SolutionIndex: 5
    SolutionNameMin: Cijk_Ailk_Bjlk_HHS_BH_Bias_AS_SAV_UserArgs_MT256x256x32_MI16x16x1_SN_LDSB0_CLR1_GRVWA4_GRVWB4_GSU0_GSUC0_GSUWGMRR0_K1_LBSPPA2048_LBSPPB2048_LPA0_LPB0_MIWT8_8_PLR1_SU0_SUM0_SUS64_VWA8_VWB8_WGM4_WGMXCC1_WGMXCCGn1
    SolutionIndex: 6
    SolutionNameMin: Cijk_Ailk_Bjlk_HHS_BH_Bias_AS_SAV_UserArgs_MT256x256x32_MI16x16x1_SN_LDSB0_CLR1_GRVWA8_GRVWB4_GSU0_GSUC0_GSUWGMRR0_K1_LBSPPA2048_LBSPPB2048_LPA0_LPB0_MIWT8_8_PLR1_SU0_SUM0_SUS64_VWA8_VWB8_WGM4_WGMXCC1_WGMXCCGn1
    SolutionIndex: 7
    SolutionNameMin: Cijk_Ailk_Bjlk_HHS_BH_Bias_AS_SAV_UserArgs_MT256x256x32_MI16x16x1_SN_LDSB0_CLR1_GRVWA4_GRVWB8_GSU0_GSUC0_GSUWGMRR0_K1_LBSPPA2048_LBSPPB2048_LPA0_LPB0_MIWT8_8_PLR1_SU0_SUM0_SUS64_VWA8_VWB8_WGM4_WGMXCC1_WGMXCCGn1
    SolutionIndex: 8
    SolutionNameMin: Cijk_Ailk_Bjlk_HHS_BH_Bias_AS_SAV_UserArgs_MT256x256x32_MI16x16x1_SN_LDSB0_CLR1_GRVWA8_GRVWB8_GSU0_GSUC0_GSUWGMRR0_K1_LBSPPA2048_LBSPPB2048_LPA0_LPB0_MIWT8_8_PLR1_SU0_SUM0_SUS64_VWA8_VWB8_WGM4_WGMXCC1_WGMXCCGn1
    SolutionIndex: 9
    SolutionNameMin: Cijk_Ailk_Bjlk_HHS_BH_Bias_AS_SAV_UserArgs_MT256x256x32_MI16x16x1_SN_LDSB0_CLR1_GRVWA2_GRVWB2_GSU0_GSUC0_GSUWGMRR0_K1_LBSPPA2048_LBSPPB2048_LPA0_LPB0_MIWT8_8_PLR1_SU0_SUM0_SUS64_VWA8_VWB8_WGM6_WGMXCC1_WGMXCCGn1
    SolutionIndex: 10
    SolutionNameMin: Cijk_Ailk_Bjlk_HHS_BH_Bias_AS_SAV_UserArgs_MT256x256x32_MI16x16x1_SN_LDSB0_CLR1_GRVWA8_GRVWB8_GSU0_GSUC0_GSUWGMRR0_K1_LBSPPA2048_LBSPPB2048_LPA0_LPB0_MIWT8_8_PLR1_SU0_SUM0_SUS64_VWA8_VWB8_WGM6_WGMXCC1_WGMXCCGn1
    SolutionIndex: 11
    SolutionNameMin: Cijk_Ailk_Bjlk_HHS_BH_Bias_AS_SAV_UserArgs_MT256x256x32_MI16x16x1_SN_LDSB0_CLR1_GRVWA2_GRVWB2_GSU0_GSUC0_GSUWGMRR0_K1_LBSPPA2048_LBSPPB2048_LPA0_LPB0_MIWT8_8_PLR1_SU0_SUM0_SUS64_VWA8_VWB8_WGM8_WGMXCC1_WGMXCCGn1
    SolutionIndex: 12
    SolutionNameMin: Cijk_Ailk_Bjlk_HHS_BH_Bias_AS_SAV_UserArgs_MT256x256x32_MI16x16x1_SN_LDSB0_CLR1_GRVWA4_GRVWB4_GSU0_GSUC0_GSUWGMRR0_K1_LBSPPA2048_LBSPPB2048_LPA0_LPB0_MIWT8_8_PLR1_SU0_SUM0_SUS64_VWA8_VWB8_WGM8_WGMXCC1_WGMXCCGn1
    SolutionIndex: 13
    SolutionNameMin: Cijk_Ailk_Bjlk_HHS_BH_Bias_AS_SAV_UserArgs_MT256x256x32_MI16x16x1_SN_LDSB0_CLR1_GRVWA8_GRVWB8_GSU0_GSUC0_GSUWGMRR0_K1_LBSPPA2048_LBSPPB2048_LPA0_LPB0_MIWT8_8_PLR1_SU0_SUM0_SUS64_VWA8_VWB8_WGM8_WGMXCC1_WGMXCCGn1
    SolutionIndex: 14
    SolutionNameMin: Cijk_Ailk_Bjlk_HHS_BH_Bias_AS_SAV_UserArgs_MT128x256x32_MI16x16x1_SN_LDSB1_CLR1_GRVWA2_GRVWB4_GSU0_GSUC0_GSUWGMRR0_K1_LBSPPA1024_LBSPPB2048_LPA0_LPB0_MIWT4_8_PLR1_SU0_SUM0_SUS64_VWA4_VWB8_WGM1_WGMXCC1_WGMXCCGn1
    SolutionIndex: 15
    SolutionNameMin: Cijk_Ailk_Bjlk_HHS_BH_Bias_AS_SAV_UserArgs_MT128x256x32_MI16x16x1_SN_LDSB1_CLR1_GRVWA8_GRVWB4_GSU0_GSUC0_GSUWGMRR0_K1_LBSPPA1024_LBSPPB2048_LPA0_LPB0_MIWT4_8_PLR1_SU0_SUM0_SUS64_VWA4_VWB8_WGM1_WGMXCC1_WGMXCCGn1
    SolutionIndex: 16
    SolutionNameMin: Cijk_Ailk_Bjlk_HHS_BH_Bias_AS_SAV_UserArgs_MT128x256x32_MI16x16x1_SN_LDSB1_CLR1_GRVWA2_GRVWB8_GSU0_GSUC0_GSUWGMRR0_K1_LBSPPA1024_LBSPPB2048_LPA0_LPB0_MIWT4_8_PLR1_SU0_SUM0_SUS64_VWA4_VWB8_WGM1_WGMXCC1_WGMXCCGn1
    SolutionIndex: 17
    SolutionNameMin: Cijk_Ailk_Bjlk_HHS_BH_Bias_AS_SAV_UserArgs_MT128x256x32_MI16x16x1_SN_LDSB1_CLR1_GRVWA4_GRVWB8_GSU0_GSUC0_GSUWGMRR0_K1_LBSPPA1024_LBSPPB2048_LPA0_LPB0_MIWT4_8_PLR1_SU0_SUM0_SUS64_VWA4_VWB8_WGM1_WGMXCC1_WGMXCCGn1
    SolutionIndex: 18
    SolutionNameMin: Cijk_Ailk_Bjlk_HHS_BH_Bias_AS_SAV_UserArgs_MT128x256x32_MI16x16x1_SN_LDSB1_CLR1_GRVWA8_GRVWB8_GSU0_GSUC0_GSUWGMRR0_K1_LBSPPA1024_LBSPPB2048_LPA0_LPB0_MIWT4_8_PLR1_SU0_SUM0_SUS64_VWA4_VWB8_WGM1_WGMXCC1_WGMXCCGn1
    SolutionIndex: 19
    SolutionNameMin: Cijk_Ailk_Bjlk_HHS_BH_Bias_AS_SAV_UserArgs_MT128x256x32_MI16x16x1_SN_LDSB1_CLR1_GRVWA2_GRVWB8_GSU0_GSUC0_GSUWGMRR0_K1_LBSPPA1024_LBSPPB2048_LPA0_LPB0_MIWT4_8_PLR1_SU0_SUM0_SUS64_VWA4_VWB8_WGM4_WGMXCC1_WGMXCCGn1
    SolutionIndex: 20
    SolutionNameMin: Cijk_Ailk_Bjlk_HHS_BH_Bias_AS_SAV_UserArgs_MT128x256x32_MI16x16x1_SN_LDSB1_CLR1_GRVWA8_GRVWB8_GSU0_GSUC0_GSUWGMRR0_K1_LBSPPA1024_LBSPPB2048_LPA0_LPB0_MIWT4_8_PLR1_SU0_SUM0_SUS64_VWA4_VWB8_WGM4_WGMXCC1_WGMXCCGn1
    SolutionIndex: 21
    SolutionNameMin: Cijk_Ailk_Bjlk_HHS_BH_Bias_AS_SAV_UserArgs_MT128x256x32_MI16x16x1_SN_LDSB1_CLR1_GRVWA4_GRVWB4_GSU0_GSUC0_GSUWGMRR0_K1_LBSPPA1024_LBSPPB2048_LPA0_LPB0_MIWT4_8_PLR1_SU0_SUM0_SUS64_VWA4_VWB8_WGM6_WGMXCC1_WGMXCCGn1
    SolutionIndex: 22
    SolutionNameMin: Cijk_Ailk_Bjlk_HHS_BH_Bias_AS_SAV_UserArgs_MT128x256x32_MI16x16x1_SN_LDSB1_CLR1_GRVWA2_GRVWB8_GSU0_GSUC0_GSUWGMRR0_K1_LBSPPA1024_LBSPPB2048_LPA0_LPB0_MIWT4_8_PLR1_SU0_SUM0_SUS64_VWA4_VWB8_WGM6_WGMXCC1_WGMXCCGn1
    SolutionIndex: 23
    SolutionNameMin: Cijk_Ailk_Bjlk_HHS_BH_Bias_AS_SAV_UserArgs_MT128x256x32_MI16x16x1_SN_LDSB1_CLR1_GRVWA8_GRVWB8_GSU0_GSUC0_GSUWGMRR0_K1_LBSPPA1024_LBSPPB2048_LPA0_LPB0_MIWT4_8_PLR1_SU0_SUM0_SUS64_VWA4_VWB8_WGM6_WGMXCC1_WGMXCCGn1
    SolutionIndex: 24
    SolutionNameMin: Cijk_Ailk_Bjlk_HHS_BH_Bias_AS_SAV_UserArgs_MT128x256x32_MI16x16x1_SN_LDSB1_CLR1_GRVWA8_GRVWB8_GSU0_GSUC0_GSUWGMRR0_K1_LBSPPA1024_LBSPPB2048_LPA0_LPB0_MIWT4_8_PLR1_SU0_SUM0_SUS64_VWA4_VWB8_WGM8_WGMXCC1_WGMXCCGn1
    SolutionIndex: 25
    SolutionNameMin: Cijk_Ailk_Bjlk_HHS_BH_Bias_AS_SAV_UserArgs_MT256x128x32_MI16x16x1_SN_LDSB1_CLR1_GRVWA8_GRVWB2_GSU0_GSUC0_GSUWGMRR0_K1_LBSPPA2048_LBSPPB1024_LPA0_LPB0_MIWT8_4_PLR1_SU0_SUM0_SUS64_VWA8_VWB4_WGM1_WGMXCC1_WGMXCCGn1
    SolutionIndex: 26
    SolutionNameMin: Cijk_Ailk_Bjlk_HHS_BH_Bias_AS_SAV_UserArgs_MT256x128x32_MI16x16x1_SN_LDSB1_CLR1_GRVWA2_GRVWB4_GSU0_GSUC0_GSUWGMRR0_K1_LBSPPA2048_LBSPPB1024_LPA0_LPB0_MIWT8_4_PLR1_SU0_SUM0_SUS64_VWA8_VWB4_WGM1_WGMXCC1_WGMXCCGn1
    SolutionIndex: 27
    SolutionNameMin: Cijk_Ailk_Bjlk_HHS_BH_Bias_AS_SAV_UserArgs_MT256x128x32_MI16x16x1_SN_LDSB1_CLR1_GRVWA4_GRVWB4_GSU0_GSUC0_GSUWGMRR0_K1_LBSPPA2048_LBSPPB1024_LPA0_LPB0_MIWT8_4_PLR1_SU0_SUM0_SUS64_VWA8_VWB4_WGM1_WGMXCC1_WGMXCCGn1
    SolutionIndex: 28
    SolutionNameMin: Cijk_Ailk_Bjlk_HHS_BH_Bias_AS_SAV_UserArgs_MT256x128x32_MI16x16x1_SN_LDSB1_CLR1_GRVWA8_GRVWB4_GSU0_GSUC0_GSUWGMRR0_K1_LBSPPA2048_LBSPPB1024_LPA0_LPB0_MIWT8_4_PLR1_SU0_SUM0_SUS64_VWA8_VWB4_WGM1_WGMXCC1_WGMXCCGn1
    SolutionIndex: 29
    SolutionNameMin: Cijk_Ailk_Bjlk_HHS_BH_Bias_AS_SAV_UserArgs_MT256x128x32_MI16x16x1_SN_LDSB1_CLR1_GRVWA8_GRVWB8_GSU0_GSUC0_GSUWGMRR0_K1_LBSPPA2048_LBSPPB1024_LPA0_LPB0_MIWT8_4_PLR1_SU0_SUM0_SUS64_VWA8_VWB4_WGM1_WGMXCC1_WGMXCCGn1
    SolutionIndex: 30
    SolutionNameMin: Cijk_Ailk_Bjlk_HHS_BH_Bias_AS_SAV_UserArgs_MT256x128x32_MI16x16x1_SN_LDSB1_CLR1_GRVWA8_GRVWB4_GSU0_GSUC0_GSUWGMRR0_K1_LBSPPA2048_LBSPPB1024_LPA0_LPB0_MIWT8_4_PLR1_SU0_SUM0_SUS64_VWA8_VWB4_WGM4_WGMXCC1_WGMXCCGn1
    SolutionIndex: 31
    SolutionNameMin: Cijk_Ailk_Bjlk_HHS_BH_Bias_AS_SAV_UserArgs_MT256x128x32_MI16x16x1_SN_LDSB1_CLR1_GRVWA4_GRVWB8_GSU0_GSUC0_GSUWGMRR0_K1_LBSPPA2048_LBSPPB1024_LPA0_LPB0_MIWT8_4_PLR1_SU0_SUM0_SUS64_VWA8_VWB4_WGM4_WGMXCC1_WGMXCCGn1
    SolutionIndex: 32
    SolutionNameMin: Cijk_Ailk_Bjlk_HHS_BH_Bias_AS_SAV_UserArgs_MT256x128x32_MI16x16x1_SN_LDSB1_CLR1_GRVWA8_GRVWB2_GSU0_GSUC0_GSUWGMRR0_K1_LBSPPA2048_LBSPPB1024_LPA0_LPB0_MIWT8_4_PLR1_SU0_SUM0_SUS64_VWA8_VWB4_WGM6_WGMXCC1_WGMXCCGn1
    SolutionIndex: 33
    SolutionNameMin: Cijk_Ailk_Bjlk_HHS_BH_Bias_AS_SAV_UserArgs_MT256x128x32_MI16x16x1_SN_LDSB1_CLR1_GRVWA8_GRVWB4_GSU0_GSUC0_GSUWGMRR0_K1_LBSPPA2048_LBSPPB1024_LPA0_LPB0_MIWT8_4_PLR1_SU0_SUM0_SUS64_VWA8_VWB4_WGM6_WGMXCC1_WGMXCCGn1
    SolutionIndex: 34
    SolutionNameMin: Cijk_Ailk_Bjlk_HHS_BH_Bias_AS_SAV_UserArgs_MT256x128x32_MI16x16x1_SN_LDSB1_CLR1_GRVWA8_GRVWB4_GSU0_GSUC0_GSUWGMRR0_K1_LBSPPA2048_LBSPPB1024_LPA0_LPB0_MIWT8_4_PLR1_SU0_SUM0_SUS64_VWA8_VWB4_WGM8_WGMXCC1_WGMXCCGn1
    SolutionIndex: 35
    SolutionNameMin: Cijk_Ailk_Bjlk_HHS_BH_Bias_AS_SAV_UserArgs_MT256x128x32_MI16x16x1_SN_LDSB1_CLR1_GRVWA2_GRVWB8_GSU0_GSUC0_GSUWGMRR0_K1_LBSPPA2048_LBSPPB1024_LPA0_LPB0_MIWT8_4_PLR1_SU0_SUM0_SUS64_VWA8_VWB4_WGM8_WGMXCC1_WGMXCCGn1
    SolutionIndex: 36
    SolutionNameMin: Cijk_Ailk_Bjlk_HHS_BH_Bias_AS_SAV_UserArgs_MT256x64x32_MI16x16x1_SN_LDSB1_CLR1_GRVWA2_GRVWB2_GSU0_GSUC0_GSUWGMRR0_K1_LBSPPA2048_LBSPPB512_LPA0_LPB32_MIWT8_2_PLR1_SU0_SUM0_SUS64_VWA8_VWB2_WGM1_WGMXCC1_WGMXCCGn1
    SolutionIndex: 37
    SolutionNameMin: Cijk_Ailk_Bjlk_HHS_BH_Bias_AS_SAV_UserArgs_MT256x64x32_MI16x16x1_SN_LDSB1_CLR1_GRVWA2_GRVWB2_GSU0_GSUC0_GSUWGMRR0_K1_LBSPPA2048_LBSPPB512_LPA0_LPB32_MIWT8_2_PLR1_SU0_SUM0_SUS64_VWA8_VWB2_WGM8_WGMXCC1_WGMXCCGn1
    SolutionIndex: 38
    SolutionNameMin: Cijk_Ailk_Bjlk_HHS_BH_Bias_AS_SAV_UserArgs_MT128x128x32_MI16x16x1_SN_LDSB0_CLR1_GRVWA2_GRVWB2_GSU0_GSUC0_GSUWGMRR0_K1_LBSPPA1024_LBSPPB1024_LPA0_LPB0_MIWT4_4_PLR1_SU0_SUM0_SUS64_VWA4_VWB4_WGM1_WGMXCC1_WGMXCCGn1
    SolutionIndex: 39
    SolutionNameMin: Cijk_Ailk_Bjlk_HHS_BH_Bias_AS_SAV_UserArgs_MT128x128x32_MI16x16x1_SN_LDSB0_CLR1_GRVWA4_GRVWB8_GSU0_GSUC0_GSUWGMRR0_K1_LBSPPA1024_LBSPPB1024_LPA0_LPB0_MIWT4_4_PLR1_SU0_SUM0_SUS64_VWA4_VWB4_WGM1_WGMXCC1_WGMXCCGn1
    SolutionIndex: 40
    SolutionNameMin: Cijk_Ailk_Bjlk_HHS_BH_Bias_AS_SAV_UserArgs_MT128x128x32_MI16x16x1_SN_LDSB0_CLR1_GRVWA8_GRVWB8_GSU0_GSUC0_GSUWGMRR0_K1_LBSPPA1024_LBSPPB1024_LPA0_LPB0_MIWT4_4_PLR1_SU0_SUM0_SUS64_VWA4_VWB4_WGM1_WGMXCC1_WGMXCCGn1
    SolutionIndex: 41
    SolutionNameMin: Cijk_Ailk_Bjlk_HHS_BH_Bias_AS_SAV_UserArgs_MT128x128x32_MI16x16x1_SN_LDSB0_CLR1_GRVWA8_GRVWB8_GSU0_GSUC0_GSUWGMRR0_K1_LBSPPA1024_LBSPPB1024_LPA0_LPB0_MIWT4_4_PLR1_SU0_SUM0_SUS64_VWA4_VWB4_WGM6_WGMXCC1_WGMXCCGn1
    SolutionIndex: 42
    SolutionNameMin: Cijk_Ailk_Bjlk_HHS_BH_Bias_AS_SAV_UserArgs_MT64x128x32_MI16x16x1_SN_LDSB0_CLR1_GRVWA8_GRVWB8_GSU0_GSUC0_GSUWGMRR0_K1_LBSPPA512_LBSPPB1024_LPA32_LPB0_MIWT2_4_PLR1_SU0_SUM0_SUS64_VWA2_VWB4_WGM4_WGMXCC1_WGMXCCGn1
    SolutionIndex: 43
    SolutionNameMin: Cijk_Ailk_Bjlk_HHS_BH_Bias_AS_SAV_UserArgs_MT64x128x32_MI16x16x1_SN_LDSB0_CLR1_GRVWA2_GRVWB8_GSU0_GSUC0_GSUWGMRR0_K1_LBSPPA512_LBSPPB1024_LPA32_LPB0_MIWT2_4_PLR1_SU0_SUM0_SUS64_VWA2_VWB4_WGM8_WGMXCC1_WGMXCCGn1
    SolutionIndex: 44
    SolutionNameMin: Cijk_Ailk_Bjlk_HHS_BH_Bias_AS_SAV_UserArgs_MT128x64x32_MI16x16x1_SN_LDSB0_CLR1_GRVWA2_GRVWB2_GSU0_GSUC0_GSUWGMRR0_K1_LBSPPA1024_LBSPPB512_LPA0_LPB32_MIWT4_2_PLR1_SU0_SUM0_SUS64_VWA4_VWB2_WGM1_WGMXCC1_WGMXCCGn1
    SolutionIndex: 45
    SolutionNameMin: Cijk_Ailk_Bjlk_HHS_BH_Bias_AS_SAV_UserArgs_MT128x64x32_MI16x16x1_SN_LDSB0_CLR1_GRVWA2_GRVWB8_GSU0_GSUC0_GSUWGMRR0_K1_LBSPPA1024_LBSPPB512_LPA0_LPB32_MIWT4_2_PLR1_SU0_SUM0_SUS64_VWA4_VWB2_WGM1_WGMXCC1_WGMXCCGn1
    SolutionIndex: 46
    SolutionNameMin: Cijk_Ailk_Bjlk_HHS_BH_Bias_AS_SAV_UserArgs_MT128x64x32_MI16x16x1_SN_LDSB0_CLR1_GRVWA8_GRVWB8_GSU0_GSUC0_GSUWGMRR0_K1_LBSPPA1024_LBSPPB512_LPA0_LPB32_MIWT4_2_PLR1_SU0_SUM0_SUS64_VWA4_VWB2_WGM1_WGMXCC1_WGMXCCGn1
    SolutionIndex: 47
    SolutionNameMin: Cijk_Ailk_Bjlk_HHS_BH_Bias_AS_SAV_UserArgs_MT128x64x32_MI16x16x1_SN_LDSB0_CLR1_GRVWA2_GRVWB8_GSU0_GSUC0_GSUWGMRR0_K1_LBSPPA1024_LBSPPB512_LPA0_LPB32_MIWT4_2_PLR1_SU0_SUM0_SUS64_VWA4_VWB2_WGM4_WGMXCC1_WGMXCCGn1
    SolutionIndex: 48
    SolutionNameMin: Cijk_Ailk_Bjlk_HHS_BH_Bias_AS_SAV_UserArgs_MT128x64x32_MI16x16x1_SN_LDSB0_CLR1_GRVWA2_GRVWB2_GSU0_GSUC0_GSUWGMRR0_K1_LBSPPA1024_LBSPPB512_LPA0_LPB32_MIWT4_2_PLR1_SU0_SUM0_SUS64_VWA4_VWB2_WGM8_WGMXCC1_WGMXCCGn1
    SolutionIndex: 49
    SolutionNameMin: Cijk_Ailk_Bjlk_HHS_BH_Bias_AS_SAV_UserArgs_MT64x64x32_MI16x16x1_SN_LDSB0_CLR1_GRVWA2_GRVWB2_GSU0_GSUC0_GSUWGMRR0_K1_LBSPPA512_LBSPPB512_LPA32_LPB32_MIWT2_2_PLR1_SU0_SUM0_SUS64_VWA2_VWB2_WGM1_WGMXCC1_WGMXCCGn1
    SolutionIndex: 50
    SolutionNameMin: Cijk_Ailk_Bjlk_HHS_BH_Bias_AS_SAV_UserArgs_MT64x64x32_MI16x16x1_SN_LDSB0_CLR1_GRVWA8_GRVWB2_GSU0_GSUC0_GSUWGMRR0_K1_LBSPPA512_LBSPPB512_LPA32_LPB32_MIWT2_2_PLR1_SU0_SUM0_SUS64_VWA2_VWB2_WGM1_WGMXCC1_WGMXCCGn1
    SolutionIndex: 51
    SolutionNameMin: Cijk_Ailk_Bjlk_HHS_BH_Bias_AS_SAV_UserArgs_MT64x64x32_MI16x16x1_SN_LDSB0_CLR1_GRVWA8_GRVWB8_GSU0_GSUC0_GSUWGMRR0_K1_LBSPPA512_LBSPPB512_LPA32_LPB32_MIWT2_2_PLR1_SU0_SUM0_SUS64_VWA2_VWB2_WGM1_WGMXCC1_WGMXCCGn1
    SolutionIndex: 52
    SolutionNameMin: Cijk_Ailk_Bjlk_HHS_BH_Bias_AS_SAV_UserArgs_MT64x64x32_MI16x16x1_SN_LDSB0_CLR1_GRVWA2_GRVWB2_GSU0_GSUC0_GSUWGMRR0_K1_LBSPPA512_LBSPPB512_LPA32_LPB32_MIWT2_2_PLR1_SU0_SUM0_SUS64_VWA2_VWB2_WGM4_WGMXCC1_WGMXCCGn1
    SolutionIndex: 53
    SolutionNameMin: Cijk_Ailk_Bjlk_HHS_BH_Bias_AS_SAV_UserArgs_MT64x64x32_MI16x16x1_SN_LDSB0_CLR1_GRVWA8_GRVWB8_GSU0_GSUC0_GSUWGMRR0_K1_LBSPPA512_LBSPPB512_LPA32_LPB32_MIWT2_2_PLR1_SU0_SUM0_SUS64_VWA2_VWB2_WGM8_WGMXCC1_WGMXCCGn1
    SolutionIndex: 54
    SolutionNameMin: Cijk_Ailk_Bjlk_HHS_BH_Bias_AS_SAV_UserArgs_MT32x64x32_MI16x16x1_SN_LDSB0_CLR1_GRVWA2_GRVWB2_GSU0_GSUC0_GSUWGMRR0_K1_LBSPPA256_LBSPPB512_LPA16_LPB32_MIWT1_2_PLR1_SU0_SUM0_SUS64_VWA1_VWB2_WGM8_WGMXCC1_WGMXCCGn1
    SolutionIndex: 55
    SolutionNameMin: Cijk_Ailk_Bjlk_HHS_BH_Bias_AS_SAV_UserArgs_MT64x32x32_MI16x16x1_SN_LDSB0_CLR1_GRVWA2_GRVWB2_GSU0_GSUC0_GSUWGMRR0_K1_LBSPPA512_LBSPPB256_LPA32_LPB16_MIWT2_1_PLR1_SU0_SUM0_SUS64_VWA2_VWB1_WGM1_WGMXCC1_WGMXCCGn1
    SolutionIndex: 56
    SolutionNameMin: Cijk_Ailk_Bjlk_HHS_BH_Bias_AS_SAV_UserArgs_MT32x32x32_MI16x16x1_SN_LDSB0_CLR1_GRVWA2_GRVWB2_GSU0_GSUC0_GSUWGMRR0_K1_LBSPPA256_LBSPPB256_LPA16_LPB16_MIWT1_1_PLR1_SU0_SUM0_SUS64_VWA1_VWB1_WGM1_WGMXCC1_WGMXCCGn1
    SolutionIndex: 57
    SolutionNameMin: Cijk_Ailk_Bjlk_HHS_BH_Bias_AS_SAV_UserArgs_MT32x32x32_MI16x16x1_SN_LDSB0_CLR1_GRVWA4_GRVWB2_GSU0_GSUC0_GSUWGMRR0_K1_LBSPPA256_LBSPPB256_LPA16_LPB16_MIWT1_1_PLR1_SU0_SUM0_SUS64_VWA1_VWB1_WGM1_WGMXCC1_WGMXCCGn1
    SolutionIndex: 58
    SolutionNameMin: Cijk_Ailk_Bjlk_HHS_BH_Bias_AS_SAV_UserArgs_MT32x32x32_MI16x16x1_SN_LDSB0_CLR1_GRVWA2_GRVWB2_GSU0_GSUC0_GSUWGMRR0_K1_LBSPPA256_LBSPPB256_LPA16_LPB16_MIWT1_1_PLR1_SU0_SUM0_SUS64_VWA1_VWB1_WGM4_WGMXCC1_WGMXCCGn1
    SolutionIndex: 59
    SolutionNameMin: Cijk_Ailk_Bjlk_HHS_BH_Bias_AS_SAV_UserArgs_MT32x32x32_MI16x16x1_SN_LDSB0_CLR1_GRVWA4_GRVWB2_GSU0_GSUC0_GSUWGMRR0_K1_LBSPPA256_LBSPPB256_LPA16_LPB16_MIWT1_1_PLR1_SU0_SUM0_SUS64_VWA1_VWB1_WGM6_WGMXCC1_WGMXCCGn1
    SolutionIndex: 60
    SolutionNameMin: Cijk_Ailk_Bjlk_HHS_BH_Bias_AS_SAV_UserArgs_MT256x256x64_MI16x16x1_SN_LDSB1_CLR1_GRVWA8_GRVWB4_GSU0_GSUC0_GSUWGMRR0_K1_LBSPPA2048_LBSPPB2048_LPA0_LPB0_MIWT8_8_PLR1_SU0_SUM0_SUS128_VWA8_VWB8_WGM1_WGMXCC1_WGMXCCGn1
    SolutionIndex: 61
    SolutionNameMin: Cijk_Ailk_Bjlk_HHS_BH_Bias_AS_SAV_UserArgs_MT256x256x64_MI16x16x1_SN_LDSB1_CLR1_GRVWA4_GRVWB8_GSU0_GSUC0_GSUWGMRR0_K1_LBSPPA2048_LBSPPB2048_LPA0_LPB0_MIWT8_8_PLR1_SU0_SUM0_SUS128_VWA8_VWB8_WGM1_WGMXCC1_WGMXCCGn1
    SolutionIndex: 62
    SolutionNameMin: Cijk_Ailk_Bjlk_HHS_BH_Bias_AS_SAV_UserArgs_MT256x256x64_MI16x16x1_SN_LDSB1_CLR1_GRVWA8_GRVWB4_GSU0_GSUC0_GSUWGMRR0_K1_LBSPPA2048_LBSPPB2048_LPA0_LPB0_MIWT8_8_PLR1_SU0_SUM0_SUS128_VWA8_VWB8_WGM6_WGMXCC1_WGMXCCGn1
    SolutionIndex: 63
    SolutionNameMin: Cijk_Ailk_Bjlk_HHS_BH_Bias_AS_SAV_UserArgs_MT256x256x64_MI16x16x1_SN_LDSB1_CLR1_GRVWA8_GRVWB8_GSU0_GSUC0_GSUWGMRR0_K1_LBSPPA2048_LBSPPB2048_LPA0_LPB0_MIWT8_8_PLR1_SU0_SUM0_SUS128_VWA8_VWB8_WGM6_WGMXCC1_WGMXCCGn1
    SolutionIndex: 64
    SolutionNameMin: Cijk_Ailk_Bjlk_HHS_BH_Bias_AS_SAV_UserArgs_MT128x256x64_MI16x16x1_SN_LDSB1_CLR1_GRVWA8_GRVWB8_GSU0_GSUC0_GSUWGMRR0_K1_LBSPPA1024_LBSPPB2048_LPA0_LPB0_MIWT4_8_PLR1_SU0_SUM0_SUS128_VWA4_VWB8_WGM1_WGMXCC1_WGMXCCGn1
    SolutionIndex: 65
    SolutionNameMin: Cijk_Ailk_Bjlk_HHS_BH_Bias_AS_SAV_UserArgs_MT128x256x64_MI16x16x1_SN_LDSB1_CLR1_GRVWA8_GRVWB8_GSU0_GSUC0_GSUWGMRR0_K1_LBSPPA1024_LBSPPB2048_LPA0_LPB0_MIWT4_8_PLR1_SU0_SUM0_SUS128_VWA4_VWB8_WGM6_WGMXCC1_WGMXCCGn1
    SolutionIndex: 66
    SolutionNameMin: Cijk_Ailk_Bjlk_HHS_BH_Bias_AS_SAV_UserArgs_MT128x128x64_MI16x16x1_SN_LDSB1_CLR1_GRVWA4_GRVWB8_GSU0_GSUC0_GSUWGMRR0_K1_LBSPPA1024_LBSPPB1024_LPA0_LPB0_MIWT4_4_PLR1_SU0_SUM0_SUS128_VWA4_VWB4_WGM1_WGMXCC1_WGMXCCGn1
    SolutionIndex: 67
    SolutionNameMin: Cijk_Ailk_Bjlk_HHS_BH_Bias_AS_SAV_UserArgs_MT128x128x64_MI16x16x1_SN_LDSB1_CLR1_GRVWA8_GRVWB8_GSU0_GSUC0_GSUWGMRR0_K1_LBSPPA1024_LBSPPB1024_LPA0_LPB0_MIWT4_4_PLR1_SU0_SUM0_SUS128_VWA4_VWB4_WGM1_WGMXCC1_WGMXCCGn1
    SolutionIndex: 68
    SolutionNameMin: Cijk_Ailk_Bjlk_HHS_BH_Bias_AS_SAV_UserArgs_MT128x128x64_MI16x16x1_SN_LDSB1_CLR1_GRVWA8_GRVWB8_GSU0_GSUC0_GSUWGMRR0_K1_LBSPPA1024_LBSPPB1024_LPA0_LPB0_MIWT4_4_PLR1_SU0_SUM0_SUS128_VWA4_VWB4_WGM4_WGMXCC1_WGMXCCGn1
    SolutionIndex: 69
    SolutionNameMin: Cijk_Ailk_Bjlk_HHS_BH_Bias_AS_SAV_UserArgs_MT128x128x64_MI16x16x1_SN_LDSB1_CLR1_GRVWA2_GRVWB8_GSU0_GSUC0_GSUWGMRR0_K1_LBSPPA1024_LBSPPB1024_LPA0_LPB0_MIWT4_4_PLR1_SU0_SUM0_SUS128_VWA4_VWB4_WGM6_WGMXCC1_WGMXCCGn1
    SolutionIndex: 70
    SolutionNameMin: Cijk_Ailk_Bjlk_HHS_BH_Bias_AS_SAV_UserArgs_MT128x128x64_MI16x16x1_SN_LDSB1_CLR1_GRVWA8_GRVWB8_GSU0_GSUC0_GSUWGMRR0_K1_LBSPPA1024_LBSPPB1024_LPA0_LPB0_MIWT4_4_PLR1_SU0_SUM0_SUS128_VWA4_VWB4_WGM6_WGMXCC1_WGMXCCGn1
    SolutionIndex: 71
    SolutionNameMin: Cijk_Ailk_Bjlk_HHS_BH_Bias_AS_SAV_UserArgs_MT128x128x64_MI16x16x1_SN_LDSB1_CLR1_GRVWA8_GRVWB8_GSU0_GSUC0_GSUWGMRR0_K1_LBSPPA1024_LBSPPB1024_LPA0_LPB0_MIWT4_4_PLR1_SU0_SUM0_SUS128_VWA4_VWB4_WGM8_WGMXCC1_WGMXCCGn1
    SolutionIndex: 72
    SolutionNameMin: Cijk_Ailk_Bjlk_HHS_BH_Bias_AS_SAV_UserArgs_MT64x128x64_MI16x16x1_SN_LDSB1_CLR1_GRVWA8_GRVWB8_GSU0_GSUC0_GSUWGMRR0_K1_LBSPPA512_LBSPPB1024_LPA32_LPB0_MIWT2_4_PLR1_SU0_SUM0_SUS128_VWA2_VWB4_WGM1_WGMXCC1_WGMXCCGn1
    SolutionIndex: 73
    SolutionNameMin: Cijk_Ailk_Bjlk_HHS_BH_Bias_AS_SAV_UserArgs_MT128x64x64_MI16x16x1_SN_LDSB1_CLR1_GRVWA8_GRVWB2_GSU0_GSUC0_GSUWGMRR0_K1_LBSPPA1024_LBSPPB512_LPA0_LPB32_MIWT4_2_PLR1_SU0_SUM0_SUS128_VWA4_VWB2_WGM1_WGMXCC1_WGMXCCGn1
    SolutionIndex: 74
    SolutionNameMin: Cijk_Ailk_Bjlk_HHS_BH_Bias_AS_SAV_UserArgs_MT128x64x64_MI16x16x1_SN_LDSB1_CLR1_GRVWA8_GRVWB8_GSU0_GSUC0_GSUWGMRR0_K1_LBSPPA1024_LBSPPB512_LPA0_LPB32_MIWT4_2_PLR1_SU0_SUM0_SUS128_VWA4_VWB2_WGM1_WGMXCC1_WGMXCCGn1
    SolutionIndex: 75
    SolutionNameMin: Cijk_Ailk_Bjlk_HHS_BH_Bias_AS_SAV_UserArgs_MT128x64x64_MI16x16x1_SN_LDSB1_CLR1_GRVWA2_GRVWB2_GSU0_GSUC0_GSUWGMRR0_K1_LBSPPA1024_LBSPPB512_LPA0_LPB32_MIWT4_2_PLR1_SU0_SUM0_SUS128_VWA4_VWB2_WGM4_WGMXCC1_WGMXCCGn1
    SolutionIndex: 76
    SolutionNameMin: Cijk_Ailk_Bjlk_HHS_BH_Bias_AS_SAV_UserArgs_MT128x64x64_MI16x16x1_SN_LDSB1_CLR1_GRVWA2_GRVWB8_GSU0_GSUC0_GSUWGMRR0_K1_LBSPPA1024_LBSPPB512_LPA0_LPB32_MIWT4_2_PLR1_SU0_SUM0_SUS128_VWA4_VWB2_WGM4_WGMXCC1_WGMXCCGn1
    SolutionIndex: 77
    SolutionNameMin: Cijk_Ailk_Bjlk_HHS_BH_Bias_AS_SAV_UserArgs_MT128x64x64_MI16x16x1_SN_LDSB1_CLR1_GRVWA8_GRVWB8_GSU0_GSUC0_GSUWGMRR0_K1_LBSPPA1024_LBSPPB512_LPA0_LPB32_MIWT4_2_PLR1_SU0_SUM0_SUS128_VWA4_VWB2_WGM4_WGMXCC1_WGMXCCGn1
    SolutionIndex: 78
    SolutionNameMin: Cijk_Ailk_Bjlk_HHS_BH_Bias_AS_SAV_UserArgs_MT128x64x64_MI16x16x1_SN_LDSB1_CLR1_GRVWA2_GRVWB2_GSU0_GSUC0_GSUWGMRR0_K1_LBSPPA1024_LBSPPB512_LPA0_LPB32_MIWT4_2_PLR1_SU0_SUM0_SUS128_VWA4_VWB2_WGM6_WGMXCC1_WGMXCCGn1
    SolutionIndex: 79
    SolutionNameMin: Cijk_Ailk_Bjlk_HHS_BH_Bias_AS_SAV_UserArgs_MT128x64x64_MI16x16x1_SN_LDSB1_CLR1_GRVWA2_GRVWB8_GSU0_GSUC0_GSUWGMRR0_K1_LBSPPA1024_LBSPPB512_LPA0_LPB32_MIWT4_2_PLR1_SU0_SUM0_SUS128_VWA4_VWB2_WGM6_WGMXCC1_WGMXCCGn1
    SolutionIndex: 80
    SolutionNameMin: Cijk_Ailk_Bjlk_HHS_BH_Bias_AS_SAV_UserArgs_MT128x64x64_MI16x16x1_SN_LDSB1_CLR1_GRVWA8_GRVWB8_GSU0_GSUC0_GSUWGMRR0_K1_LBSPPA1024_LBSPPB512_LPA0_LPB32_MIWT4_2_PLR1_SU0_SUM0_SUS128_VWA4_VWB2_WGM6_WGMXCC1_WGMXCCGn1
    SolutionIndex: 81
    SolutionNameMin: Cijk_Ailk_Bjlk_HHS_BH_Bias_AS_SAV_UserArgs_MT128x64x64_MI16x16x1_SN_LDSB1_CLR1_GRVWA8_GRVWB4_GSU0_GSUC0_GSUWGMRR0_K1_LBSPPA1024_LBSPPB512_LPA0_LPB32_MIWT4_2_PLR1_SU0_SUM0_SUS128_VWA4_VWB2_WGM8_WGMXCC1_WGMXCCGn1
    SolutionIndex: 82
    SolutionNameMin: Cijk_Ailk_Bjlk_HHS_BH_Bias_AS_SAV_UserArgs_MT128x64x64_MI16x16x1_SN_LDSB1_CLR1_GRVWA2_GRVWB8_GSU0_GSUC0_GSUWGMRR0_K1_LBSPPA1024_LBSPPB512_LPA0_LPB32_MIWT4_2_PLR1_SU0_SUM0_SUS128_VWA4_VWB2_WGM8_WGMXCC1_WGMXCCGn1
    SolutionIndex: 83
    SolutionNameMin: Cijk_Ailk_Bjlk_HHS_BH_Bias_AS_SAV_UserArgs_MT128x64x64_MI16x16x1_SN_LDSB1_CLR1_GRVWA8_GRVWB8_GSU0_GSUC0_GSUWGMRR0_K1_LBSPPA1024_LBSPPB512_LPA0_LPB32_MIWT4_2_PLR1_SU0_SUM0_SUS128_VWA4_VWB2_WGM8_WGMXCC1_WGMXCCGn1
    SolutionIndex: 84
    SolutionNameMin: Cijk_Ailk_Bjlk_HHS_BH_Bias_AS_SAV_UserArgs_MT64x64x64_MI16x16x1_SN_LDSB1_CLR1_GRVWA2_GRVWB2_GSU0_GSUC0_GSUWGMRR0_K1_LBSPPA512_LBSPPB512_LPA32_LPB32_MIWT2_2_PLR1_SU0_SUM0_SUS128_VWA2_VWB2_WGM1_WGMXCC1_WGMXCCGn1
    SolutionIndex: 85
    SolutionNameMin: Cijk_Ailk_Bjlk_HHS_BH_Bias_AS_SAV_UserArgs_MT64x64x64_MI16x16x1_SN_LDSB1_CLR1_GRVWA8_GRVWB2_GSU0_GSUC0_GSUWGMRR0_K1_LBSPPA512_LBSPPB512_LPA32_LPB32_MIWT2_2_PLR1_SU0_SUM0_SUS128_VWA2_VWB2_WGM1_WGMXCC1_WGMXCCGn1
    SolutionIndex: 86
    SolutionNameMin: Cijk_Ailk_Bjlk_HHS_BH_Bias_AS_SAV_UserArgs_MT64x64x64_MI16x16x1_SN_LDSB1_CLR1_GRVWA8_GRVWB4_GSU0_GSUC0_GSUWGMRR0_K1_LBSPPA512_LBSPPB512_LPA32_LPB32_MIWT2_2_PLR1_SU0_SUM0_SUS128_VWA2_VWB2_WGM1_WGMXCC1_WGMXCCGn1
    SolutionIndex: 87
    SolutionNameMin: Cijk_Ailk_Bjlk_HHS_BH_Bias_AS_SAV_UserArgs_MT64x64x64_MI16x16x1_SN_LDSB1_CLR1_GRVWA2_GRVWB8_GSU0_GSUC0_GSUWGMRR0_K1_LBSPPA512_LBSPPB512_LPA32_LPB32_MIWT2_2_PLR1_SU0_SUM0_SUS128_VWA2_VWB2_WGM1_WGMXCC1_WGMXCCGn1
    SolutionIndex: 88
    SolutionNameMin: Cijk_Ailk_Bjlk_HHS_BH_Bias_AS_SAV_UserArgs_MT64x64x64_MI16x16x1_SN_LDSB1_CLR1_GRVWA4_GRVWB8_GSU0_GSUC0_GSUWGMRR0_K1_LBSPPA512_LBSPPB512_LPA32_LPB32_MIWT2_2_PLR1_SU0_SUM0_SUS128_VWA2_VWB2_WGM1_WGMXCC1_WGMXCCGn1
    SolutionIndex: 89
    SolutionNameMin: Cijk_Ailk_Bjlk_HHS_BH_Bias_AS_SAV_UserArgs_MT64x64x64_MI16x16x1_SN_LDSB1_CLR1_GRVWA8_GRVWB8_GSU0_GSUC0_GSUWGMRR0_K1_LBSPPA512_LBSPPB512_LPA32_LPB32_MIWT2_2_PLR1_SU0_SUM0_SUS128_VWA2_VWB2_WGM1_WGMXCC1_WGMXCCGn1
    SolutionIndex: 90
    SolutionNameMin: Cijk_Ailk_Bjlk_HHS_BH_Bias_AS_SAV_UserArgs_MT64x64x64_MI16x16x1_SN_LDSB1_CLR1_GRVWA2_GRVWB8_GSU0_GSUC0_GSUWGMRR0_K1_LBSPPA512_LBSPPB512_LPA32_LPB32_MIWT2_2_PLR1_SU0_SUM0_SUS128_VWA2_VWB2_WGM4_WGMXCC1_WGMXCCGn1
    SolutionIndex: 91
    SolutionNameMin: Cijk_Ailk_Bjlk_HHS_BH_Bias_AS_SAV_UserArgs_MT64x64x64_MI16x16x1_SN_LDSB1_CLR1_GRVWA8_GRVWB8_GSU0_GSUC0_GSUWGMRR0_K1_LBSPPA512_LBSPPB512_LPA32_LPB32_MIWT2_2_PLR1_SU0_SUM0_SUS128_VWA2_VWB2_WGM4_WGMXCC1_WGMXCCGn1
    SolutionIndex: 92
    SolutionNameMin: Cijk_Ailk_Bjlk_HHS_BH_Bias_AS_SAV_UserArgs_MT64x64x64_MI16x16x1_SN_LDSB1_CLR1_GRVWA2_GRVWB2_GSU0_GSUC0_GSUWGMRR0_K1_LBSPPA512_LBSPPB512_LPA32_LPB32_MIWT2_2_PLR1_SU0_SUM0_SUS128_VWA2_VWB2_WGM6_WGMXCC1_WGMXCCGn1
    SolutionIndex: 93
    SolutionNameMin: Cijk_Ailk_Bjlk_HHS_BH_Bias_AS_SAV_UserArgs_MT64x64x64_MI16x16x1_SN_LDSB1_CLR1_GRVWA2_GRVWB8_GSU0_GSUC0_GSUWGMRR0_K1_LBSPPA512_LBSPPB512_LPA32_LPB32_MIWT2_2_PLR1_SU0_SUM0_SUS128_VWA2_VWB2_WGM6_WGMXCC1_WGMXCCGn1
    SolutionIndex: 94
    SolutionNameMin: Cijk_Ailk_Bjlk_HHS_BH_Bias_AS_SAV_UserArgs_MT64x64x64_MI16x16x1_SN_LDSB1_CLR1_GRVWA4_GRVWB8_GSU0_GSUC0_GSUWGMRR0_K1_LBSPPA512_LBSPPB512_LPA32_LPB32_MIWT2_2_PLR1_SU0_SUM0_SUS128_VWA2_VWB2_WGM6_WGMXCC1_WGMXCCGn1
    SolutionIndex: 95
    SolutionNameMin: Cijk_Ailk_Bjlk_HHS_BH_Bias_AS_SAV_UserArgs_MT64x64x64_MI16x16x1_SN_LDSB1_CLR1_GRVWA2_GRVWB8_GSU0_GSUC0_GSUWGMRR0_K1_LBSPPA512_LBSPPB512_LPA32_LPB32_MIWT2_2_PLR1_SU0_SUM0_SUS128_VWA2_VWB2_WGM8_WGMXCC1_WGMXCCGn1
    SolutionIndex: 96
    SolutionNameMin: Cijk_Ailk_Bjlk_HHS_BH_Bias_AS_SAV_UserArgs_MT32x64x64_MI16x16x1_SN_LDSB0_CLR1_GRVWA2_GRVWB2_GSU0_GSUC0_GSUWGMRR0_K1_LBSPPA256_LBSPPB512_LPA16_LPB32_MIWT1_2_PLR1_SU0_SUM0_SUS128_VWA1_VWB2_WGM1_WGMXCC1_WGMXCCGn1
    SolutionIndex: 97
    SolutionNameMin: Cijk_Ailk_Bjlk_HHS_BH_Bias_AS_SAV_UserArgs_MT64x32x64_MI16x16x1_SN_LDSB0_CLR1_GRVWA8_GRVWB2_GSU0_GSUC0_GSUWGMRR0_K1_LBSPPA512_LBSPPB256_LPA32_LPB16_MIWT2_1_PLR1_SU0_SUM0_SUS128_VWA2_VWB1_WGM1_WGMXCC1_WGMXCCGn1
    SolutionIndex: 98
    SolutionNameMin: Cijk_Ailk_Bjlk_HHS_BH_Bias_AS_SAV_UserArgs_MT64x32x64_MI16x16x1_SN_LDSB0_CLR1_GRVWA2_GRVWB8_GSU0_GSUC0_GSUWGMRR0_K1_LBSPPA512_LBSPPB256_LPA32_LPB16_MIWT2_1_PLR1_SU0_SUM0_SUS128_VWA2_VWB1_WGM1_WGMXCC1_WGMXCCGn1
    SolutionIndex: 99
    SolutionNameMin: Cijk_Ailk_Bjlk_HHS_BH_Bias_AS_SAV_UserArgs_MT64x32x64_MI16x16x1_SN_LDSB0_CLR1_GRVWA8_GRVWB2_GSU0_GSUC0_GSUWGMRR0_K1_LBSPPA512_LBSPPB256_LPA32_LPB16_MIWT2_1_PLR1_SU0_SUM0_SUS128_VWA2_VWB1_WGM4_WGMXCC1_WGMXCCGn1
    SolutionIndex: 100
    SolutionNameMin: Cijk_Ailk_Bjlk_HHS_BH_Bias_AS_SAV_UserArgs_MT32x32x64_MI16x16x1_SN_LDSB0_CLR1_GRVWA2_GRVWB2_GSU0_GSUC0_GSUWGMRR0_K1_LBSPPA256_LBSPPB256_LPA16_LPB16_MIWT1_1_PLR1_SU0_SUM0_SUS128_VWA1_VWB1_WGM1_WGMXCC1_WGMXCCGn1
    SolutionIndex: 101
    SolutionNameMin: Cijk_Ailk_Bjlk_HHS_BH_Bias_AS_SAV_UserArgs_MT32x32x64_MI16x16x1_SN_LDSB0_CLR1_GRVWA8_GRVWB2_GSU0_GSUC0_GSUWGMRR0_K1_LBSPPA256_LBSPPB256_LPA16_LPB16_MIWT1_1_PLR1_SU0_SUM0_SUS128_VWA1_VWB1_WGM1_WGMXCC1_WGMXCCGn1
    SolutionIndex: 102
    SolutionNameMin: Cijk_Ailk_Bjlk_HHS_BH_Bias_AS_SAV_UserArgs_MT32x32x64_MI16x16x1_SN_LDSB0_CLR1_GRVWA2_GRVWB4_GSU0_GSUC0_GSUWGMRR0_K1_LBSPPA256_LBSPPB256_LPA16_LPB16_MIWT1_1_PLR1_SU0_SUM0_SUS128_VWA1_VWB1_WGM1_WGMXCC1_WGMXCCGn1
    SolutionIndex: 103
    SolutionNameMin: Cijk_Ailk_Bjlk_HHS_BH_Bias_AS_SAV_UserArgs_MT32x32x64_MI16x16x1_SN_LDSB0_CLR1_GRVWA2_GRVWB8_GSU0_GSUC0_GSUWGMRR0_K1_LBSPPA256_LBSPPB256_LPA16_LPB16_MIWT1_1_PLR1_SU0_SUM0_SUS128_VWA1_VWB1_WGM1_WGMXCC1_WGMXCCGn1
    SolutionIndex: 104
    SolutionNameMin: Cijk_Ailk_Bjlk_HHS_BH_Bias_AS_SAV_UserArgs_MT32x32x64_MI16x16x1_SN_LDSB0_CLR1_GRVWA8_GRVWB8_GSU0_GSUC0_GSUWGMRR0_K1_LBSPPA256_LBSPPB256_LPA16_LPB16_MIWT1_1_PLR1_SU0_SUM0_SUS128_VWA1_VWB1_WGM1_WGMXCC1_WGMXCCGn1
    SolutionIndex: 105
    SolutionNameMin: Cijk_Ailk_Bjlk_HHS_BH_Bias_AS_SAV_UserArgs_MT32x32x64_MI16x16x1_SN_LDSB0_CLR1_GRVWA2_GRVWB2_GSU0_GSUC0_GSUWGMRR0_K1_LBSPPA256_LBSPPB256_LPA16_LPB16_MIWT1_1_PLR1_SU0_SUM0_SUS128_VWA1_VWB1_WGM6_WGMXCC1_WGMXCCGn1
    SolutionIndex: 106
    SolutionNameMin: Cijk_Ailk_Bjlk_HHS_BH_Bias_AS_SAV_UserArgs_MT128x128x128_MI16x16x1_SN_LDSB1_CLR1_GRVWA8_GRVWB8_GSU0_GSUC0_GSUWGMRR0_K1_LBSPPA1024_LBSPPB1024_LPA0_LPB0_MIWT4_4_PLR1_SU0_SUM0_SUS256_VWA4_VWB4_WGM1_WGMXCC1_WGMXCCGn1
    SolutionIndex: 107
    SolutionNameMin: Cijk_Ailk_Bjlk_HHS_BH_Bias_AS_SAV_UserArgs_MT64x64x128_MI16x16x1_SN_LDSB1_CLR1_GRVWA2_GRVWB8_GSU0_GSUC0_GSUWGMRR0_K1_LBSPPA512_LBSPPB512_LPA32_LPB32_MIWT2_2_PLR1_SU0_SUM0_SUS256_VWA2_VWB2_WGM1_WGMXCC1_WGMXCCGn1
    SolutionIndex: 108
    SolutionNameMin: Cijk_Ailk_Bjlk_HHS_BH_Bias_AS_SAV_UserArgs_MT64x64x128_MI16x16x1_SN_LDSB1_CLR1_GRVWA8_GRVWB8_GSU0_GSUC0_GSUWGMRR0_K1_LBSPPA512_LBSPPB512_LPA32_LPB32_MIWT2_2_PLR1_SU0_SUM0_SUS256_VWA2_VWB2_WGM1_WGMXCC1_WGMXCCGn1
    SolutionIndex: 109
    SolutionNameMin: Cijk_Ailk_Bjlk_HHS_BH_Bias_AS_SAV_UserArgs_MT64x64x128_MI16x16x1_SN_LDSB1_CLR1_GRVWA8_GRVWB8_GSU0_GSUC0_GSUWGMRR0_K1_LBSPPA512_LBSPPB512_LPA32_LPB32_MIWT2_2_PLR1_SU0_SUM0_SUS256_VWA2_VWB2_WGM4_WGMXCC1_WGMXCCGn1
    SolutionIndex: 110
    SolutionNameMin: Cijk_Ailk_Bjlk_HHS_BH_Bias_AS_SAV_UserArgs_MT64x64x128_MI16x16x1_SN_LDSB1_CLR1_GRVWA2_GRVWB8_GSU0_GSUC0_GSUWGMRR0_K1_LBSPPA512_LBSPPB512_LPA32_LPB32_MIWT2_2_PLR1_SU0_SUM0_SUS256_VWA2_VWB2_WGM8_WGMXCC1_WGMXCCGn1
    SolutionIndex: 111
    SolutionNameMin: Cijk_Ailk_Bjlk_HHS_BH_Bias_AS_SAV_UserArgs_MT32x64x128_MI16x16x1_SN_LDSB1_CLR1_GRVWA4_GRVWB4_GSU0_GSUC0_GSUWGMRR0_K1_LBSPPA256_LBSPPB512_LPA16_LPB32_MIWT1_2_PLR1_SU0_SUM0_SUS256_VWA1_VWB2_WGM1_WGMXCC1_WGMXCCGn1
    SolutionIndex: 112
    SolutionNameMin: Cijk_Ailk_Bjlk_HHS_BH_Bias_AS_SAV_UserArgs_MT32x64x128_MI16x16x1_SN_LDSB1_CLR1_GRVWA8_GRVWB8_GSU0_GSUC0_GSUWGMRR0_K1_LBSPPA256_LBSPPB512_LPA16_LPB32_MIWT1_2_PLR1_SU0_SUM0_SUS256_VWA1_VWB2_WGM1_WGMXCC1_WGMXCCGn1
    SolutionIndex: 113
    SolutionNameMin: Cijk_Ailk_Bjlk_HHS_BH_Bias_AS_SAV_UserArgs_MT32x64x128_MI16x16x1_SN_LDSB1_CLR1_GRVWA8_GRVWB2_GSU0_GSUC0_GSUWGMRR0_K1_LBSPPA256_LBSPPB512_LPA16_LPB32_MIWT1_2_PLR1_SU0_SUM0_SUS256_VWA1_VWB2_WGM6_WGMXCC1_WGMXCCGn1
    SolutionIndex: 114
    SolutionNameMin: Cijk_Ailk_Bjlk_HHS_BH_Bias_AS_SAV_UserArgs_MT64x32x128_MI16x16x1_SN_LDSB1_CLR1_GRVWA8_GRVWB8_GSU0_GSUC0_GSUWGMRR0_K1_LBSPPA512_LBSPPB256_LPA32_LPB16_MIWT2_1_PLR1_SU0_SUM0_SUS256_VWA2_VWB1_WGM1_WGMXCC1_WGMXCCGn1
    SolutionIndex: 115
    SolutionNameMin: Cijk_Ailk_Bjlk_HHS_BH_Bias_AS_SAV_UserArgs_MT64x32x128_MI16x16x1_SN_LDSB1_CLR1_GRVWA8_GRVWB8_GSU0_GSUC0_GSUWGMRR0_K1_LBSPPA512_LBSPPB256_LPA32_LPB16_MIWT2_1_PLR1_SU0_SUM0_SUS256_VWA2_VWB1_WGM4_WGMXCC1_WGMXCCGn1
    SolutionIndex: 116
    SolutionNameMin: Cijk_Ailk_Bjlk_HHS_BH_Bias_AS_SAV_UserArgs_MT64x32x128_MI16x16x1_SN_LDSB1_CLR1_GRVWA8_GRVWB8_GSU0_GSUC0_GSUWGMRR0_K1_LBSPPA512_LBSPPB256_LPA32_LPB16_MIWT2_1_PLR1_SU0_SUM0_SUS256_VWA2_VWB1_WGM6_WGMXCC1_WGMXCCGn1
    SolutionIndex: 117
    SolutionNameMin: Cijk_Ailk_Bjlk_HHS_BH_Bias_AS_SAV_UserArgs_MT64x32x128_MI16x16x1_SN_LDSB1_CLR1_GRVWA8_GRVWB8_GSU0_GSUC0_GSUWGMRR0_K1_LBSPPA512_LBSPPB256_LPA32_LPB16_MIWT2_1_PLR1_SU0_SUM0_SUS256_VWA2_VWB1_WGM8_WGMXCC1_WGMXCCGn1
    SolutionIndex: 118
    SolutionNameMin: Cijk_Ailk_Bjlk_HHS_BH_Bias_AS_SAV_UserArgs_MT32x32x128_MI16x16x1_SN_LDSB1_CLR1_GRVWA4_GRVWB2_GSU0_GSUC0_GSUWGMRR0_K1_LBSPPA256_LBSPPB256_LPA16_LPB16_MIWT1_1_PLR1_SU0_SUM0_SUS256_VWA1_VWB1_WGM1_WGMXCC1_WGMXCCGn1
    SolutionIndex: 119
    SolutionNameMin: Cijk_Ailk_Bjlk_HHS_BH_Bias_AS_SAV_UserArgs_MT32x32x128_MI16x16x1_SN_LDSB1_CLR1_GRVWA2_GRVWB4_GSU0_GSUC0_GSUWGMRR0_K1_LBSPPA256_LBSPPB256_LPA16_LPB16_MIWT1_1_PLR1_SU0_SUM0_SUS256_VWA1_VWB1_WGM1_WGMXCC1_WGMXCCGn1
    SolutionIndex: 120
    SolutionNameMin: Cijk_Ailk_Bjlk_HHS_BH_Bias_AS_SAV_UserArgs_MT32x32x128_MI16x16x1_SN_LDSB1_CLR1_GRVWA8_GRVWB4_GSU0_GSUC0_GSUWGMRR0_K1_LBSPPA256_LBSPPB256_LPA16_LPB16_MIWT1_1_PLR1_SU0_SUM0_SUS256_VWA1_VWB1_WGM1_WGMXCC1_WGMXCCGn1
    SolutionIndex: 121
    SolutionNameMin: Cijk_Ailk_Bjlk_HHS_BH_Bias_AS_SAV_UserArgs_MT32x32x128_MI16x16x1_SN_LDSB1_CLR1_GRVWA2_GRVWB8_GSU0_GSUC0_GSUWGMRR0_K1_LBSPPA256_LBSPPB256_LPA16_LPB16_MIWT1_1_PLR1_SU0_SUM0_SUS256_VWA1_VWB1_WGM1_WGMXCC1_WGMXCCGn1
    SolutionIndex: 122
    SolutionNameMin: Cijk_Ailk_Bjlk_HHS_BH_Bias_AS_SAV_UserArgs_MT32x32x128_MI16x16x1_SN_LDSB1_CLR1_GRVWA4_GRVWB8_GSU0_GSUC0_GSUWGMRR0_K1_LBSPPA256_LBSPPB256_LPA16_LPB16_MIWT1_1_PLR1_SU0_SUM0_SUS256_VWA1_VWB1_WGM1_WGMXCC1_WGMXCCGn1
    SolutionIndex: 123
    SolutionNameMin: Cijk_Ailk_Bjlk_HHS_BH_Bias_AS_SAV_UserArgs_MT32x32x128_MI16x16x1_SN_LDSB1_CLR1_GRVWA8_GRVWB8_GSU0_GSUC0_GSUWGMRR0_K1_LBSPPA256_LBSPPB256_LPA16_LPB16_MIWT1_1_PLR1_SU0_SUM0_SUS256_VWA1_VWB1_WGM1_WGMXCC1_WGMXCCGn1
    SolutionIndex: 124
    SolutionNameMin: Cijk_Ailk_Bjlk_HHS_BH_Bias_AS_SAV_UserArgs_MT32x32x128_MI16x16x1_SN_LDSB1_CLR1_GRVWA2_GRVWB8_GSU0_GSUC0_GSUWGMRR0_K1_LBSPPA256_LBSPPB256_LPA16_LPB16_MIWT1_1_PLR1_SU0_SUM0_SUS256_VWA1_VWB1_WGM4_WGMXCC1_WGMXCCGn1
    SolutionIndex: 125
    SolutionNameMin: Cijk_Ailk_Bjlk_HHS_BH_Bias_AS_SAV_UserArgs_MT32x32x128_MI16x16x1_SN_LDSB1_CLR1_GRVWA4_GRVWB8_GSU0_GSUC0_GSUWGMRR0_K1_LBSPPA256_LBSPPB256_LPA16_LPB16_MIWT1_1_PLR1_SU0_SUM0_SUS256_VWA1_VWB1_WGM4_WGMXCC1_WGMXCCGn1
    SolutionIndex: 126
    SolutionNameMin: Cijk_Ailk_Bjlk_HHS_BH_Bias_AS_SAV_UserArgs_MT32x32x128_MI16x16x1_SN_LDSB1_CLR1_GRVWA8_GRVWB8_GSU0_GSUC0_GSUWGMRR0_K1_LBSPPA256_LBSPPB256_LPA16_LPB16_MIWT1_1_PLR1_SU0_SUM0_SUS256_VWA1_VWB1_WGM4_WGMXCC1_WGMXCCGn1
    SolutionIndex: 127
    SolutionNameMin: Cijk_Ailk_Bjlk_HHS_BH_Bias_AS_SAV_UserArgs_MT32x32x128_MI16x16x1_SN_LDSB1_CLR1_GRVWA2_GRVWB8_GSU0_GSUC0_GSUWGMRR0_K1_LBSPPA256_LBSPPB256_LPA16_LPB16_MIWT1_1_PLR1_SU0_SUM0_SUS256_VWA1_VWB1_WGM6_WGMXCC1_WGMXCCGn1
    SolutionIndex: 128
    SolutionNameMin: Cijk_Ailk_Bjlk_HHS_BH_Bias_AS_SAV_UserArgs_MT32x32x128_MI16x16x1_SN_LDSB1_CLR1_GRVWA4_GRVWB8_GSU0_GSUC0_GSUWGMRR0_K1_LBSPPA256_LBSPPB256_LPA16_LPB16_MIWT1_1_PLR1_SU0_SUM0_SUS256_VWA1_VWB1_WGM6_WGMXCC1_WGMXCCGn1
    SolutionIndex: 129
    SolutionNameMin: Cijk_Ailk_Bjlk_HHS_BH_Bias_AS_SAV_UserArgs_MT32x32x128_MI16x16x1_SN_LDSB1_CLR1_GRVWA8_GRVWB8_GSU0_GSUC0_GSUWGMRR0_K1_LBSPPA256_LBSPPB256_LPA16_LPB16_MIWT1_1_PLR1_SU0_SUM0_SUS256_VWA1_VWB1_WGM6_WGMXCC1_WGMXCCGn1
    SolutionIndex: 130
    SolutionNameMin: Cijk_Ailk_Bjlk_HHS_BH_Bias_AS_SAV_UserArgs_MT32x32x128_MI16x16x1_SN_LDSB1_CLR1_GRVWA2_GRVWB8_GSU0_GSUC0_GSUWGMRR0_K1_LBSPPA256_LBSPPB256_LPA16_LPB16_MIWT1_1_PLR1_SU0_SUM0_SUS256_VWA1_VWB1_WGM8_WGMXCC1_WGMXCCGn1
- - - [128, 128, 1, 128, 128, 128, 128, 128]
    - [119, 0.41]
  - - [128, 128, 1, 256, 128, 128, 128, 128]
    - [121, 0.74]
  - - [128, 128, 1, 512, 128, 128, 128, 128]
    - [123, 1.2]
  - - [128, 128, 1, 1024, 128, 128, 128, 128]
    - [123, 1.77]
  - - [128, 128, 1, 2048, 128, 128, 128, 128]
    - [123, 2.39]
  - - [128, 128, 1, 4096, 128, 128, 128, 128]
    - [129, 2.93]
  - - [128, 128, 1, 8192, 128, 128, 128, 128]
    - [123, 3.18]
  - - [128, 256, 1, 128, 128, 128, 128, 256]
    - [100, 0.85]
  - - [128, 256, 1, 256, 128, 128, 128, 256]
    - [103, 1.43]
  - - [128, 256, 1, 512, 128, 128, 128, 256]
    - [123, 2.29]
  - - [128, 256, 1, 1024, 128, 128, 128, 256]
    - [123, 3.38]
  - - [128, 256, 1, 2048, 128, 128, 128, 256]
    - [123, 4.28]
  - - [128, 256, 1, 4096, 128, 128, 128, 256]
    - [123, 5.0]
  - - [128, 256, 1, 8192, 128, 128, 128, 256]
    - [57, 5.52]
  - - [128, 512, 1, 128, 128, 128, 128, 512]
    - [100, 1.7]
  - - [128, 512, 1, 256, 128, 128, 128, 512]
    - [123, 2.91]
  - - [128, 512, 1, 512, 128, 128, 128, 512]
    - [123, 4.57]
  - - [128, 512, 1, 1024, 128, 128, 128, 512]
    - [120, 6.53]
  - - [128, 512, 1, 2048, 128, 128, 128, 512]
    - [123, 8.43]
  - - [128, 512, 1, 4096, 128, 128, 128, 512]
    - [123, 9.81]
  - - [128, 512, 1, 8192, 128, 128, 128, 512]
    - [129, 10.77]
  - - [128, 1024, 1, 128, 128, 128, 128, 1024]
    - [100, 3.29]
  - - [128, 1024, 1, 256, 128, 128, 128, 1024]
    - [101, 5.5]
  - - [128, 1024, 1, 512, 128, 128, 128, 1024]
    - [123, 8.82]
  - - [128, 1024, 1, 1024, 128, 128, 128, 1024]
    - [123, 12.85]
  - - [128, 1024, 1, 2048, 128, 128, 128, 1024]
    - [123, 16.38]
  - - [128, 1024, 1, 4096, 128, 128, 128, 1024]
    - [123, 19.12]
  - - [128, 1024, 1, 8192, 128, 128, 128, 1024]
    - [126, 21.11]
  - - [128, 2048, 1, 128, 128, 128, 128, 2048]
    - [97, 6.01]
  - - [128, 2048, 1, 256, 128, 128, 128, 2048]
    - [98, 10.2]
  - - [128, 2048, 1, 512, 128, 128, 128, 2048]
    - [114, 16.16]
  - - [128, 2048, 1, 1024, 128, 128, 128, 2048]
    - [112, 22.87]
  - - [128, 2048, 1, 2048, 128, 128, 128, 2048]
    - [112, 29.75]
  - - [128, 2048, 1, 4096, 128, 128, 128, 2048]
    - [112, 34.83]
  - - [128, 2048, 1, 8192, 128, 128, 128, 2048]
    - [113, 35.74]
  - - [128, 4096, 1, 128, 128, 128, 128, 4096]
    - [87, 11.05]
  - - [128, 4096, 1, 256, 128, 128, 128, 4096]
    - [84, 18.84]
  - - [128, 4096, 1, 512, 128, 128, 128, 4096]
    - [89, 28.9]
  - - [128, 4096, 1, 1024, 128, 128, 128, 4096]
    - [108, 40.7]
  - - [128, 4096, 1, 2048, 128, 128, 128, 4096]
    - [108, 52.56]
  - - [128, 4096, 1, 4096, 128, 128, 128, 4096]
    - [107, 56.83]
  - - [128, 4096, 1, 8192, 128, 128, 128, 4096]
    - [109, 62.12]
  - - [128, 8192, 1, 128, 128, 128, 128, 8192]
    - [44, 18.01]
  - - [128, 8192, 1, 256, 128, 128, 128, 8192]
    - [74, 30.32]
  - - [128, 8192, 1, 512, 128, 128, 128, 8192]
    - [72, 45.93]
  - - [128, 8192, 1, 1024, 128, 128, 128, 8192]
    - [72, 61.99]
  - - [128, 8192, 1, 2048, 128, 128, 128, 8192]
    - [74, 70.73]
  - - [128, 8192, 1, 4096, 128, 128, 128, 8192]
    - [83, 78.99]
  - - [128, 8192, 1, 8192, 128, 128, 128, 8192]
    - [47, 82.45]
  - - [256, 128, 1, 128, 256, 256, 256, 128]
    - [118, 0.83]
  - - [256, 128, 1, 256, 256, 256, 256, 128]
    - [100, 1.45]
  - - [256, 128, 1, 512, 256, 256, 256, 128]
    - [122, 2.26]
  - - [256, 128, 1, 1024, 256, 256, 256, 128]
    - [122, 3.17]
  - - [256, 128, 1, 2048, 256, 256, 256, 128]
    - [122, 4.17]
  - - [256, 128, 1, 4096, 256, 256, 256, 128]
    - [123, 4.84]
  - - [256, 128, 1, 8192, 256, 256, 256, 128]
    - [58, 5.47]
  - - [256, 256, 1, 128, 256, 256, 256, 256]
    - [102, 1.69]
  - - [256, 256, 1, 256, 256, 256, 256, 256]
    - [100, 2.9]
  - - [256, 256, 1, 512, 256, 256, 256, 256]
    - [120, 4.47]
  - - [256, 256, 1, 1024, 256, 256, 256, 256]
    - [123, 6.32]
  - - [256, 256, 1, 2048, 256, 256, 256, 256]
    - [128, 7.92]
  - - [256, 256, 1, 4096, 256, 256, 256, 256]
    - [129, 9.16]
  - - [256, 256, 1, 8192, 256, 256, 256, 256]
    - [56, 10.57]
  - - [256, 512, 1, 128, 256, 256, 256, 512]
    - [100, 3.33]
  - - [256, 512, 1, 256, 256, 256, 256, 512]
    - [100, 5.49]
  - - [256, 512, 1, 512, 256, 256, 256, 512]
    - [123, 8.67]
  - - [256, 512, 1, 1024, 256, 256, 256, 512]
    - [123, 12.13]
  - - [256, 512, 1, 2048, 256, 256, 256, 512]
    - [123, 15.54]
  - - [256, 512, 1, 4096, 256, 256, 256, 512]
    - [129, 17.88]
  - - [256, 512, 1, 8192, 256, 256, 256, 512]
    - [54, 19.9]
  - - [256, 1024, 1, 128, 256, 256, 256, 1024]
    - [97, 5.92]
  - - [256, 1024, 1, 256, 256, 256, 256, 1024]
    - [97, 10.14]
  - - [256, 1024, 1, 512, 256, 256, 256, 1024]
    - [97, 15.71]
  - - [256, 1024, 1, 1024, 256, 256, 256, 1024]
    - [114, 22.18]
  - - [256, 1024, 1, 2048, 256, 256, 256, 1024]
    - [114, 28.02]
  - - [256, 1024, 1, 4096, 256, 256, 256, 1024]
    - [115, 31.84]
  - - [256, 1024, 1, 8192, 256, 256, 256, 1024]
    - [49, 37.14]
  - - [256, 2048, 1, 128, 256, 256, 256, 2048]
    - [87, 10.79]
  - - [256, 2048, 1, 256, 256, 256, 256, 2048]
    - [87, 18.35]
  - - [256, 2048, 1, 512, 256, 256, 256, 2048]
    - [87, 28.64]
  - - [256, 2048, 1, 1024, 256, 256, 256, 2048]
    - [89, 39.31]
  - - [256, 2048, 1, 2048, 256, 256, 256, 2048]
    - [89, 48.12]
  - - [256, 2048, 1, 4096, 256, 256, 256, 2048]
    - [89, 54.24]
  - - [256, 2048, 1, 8192, 256, 256, 256, 2048]
    - [50, 59.89]
  - - [256, 4096, 1, 128, 256, 256, 256, 4096]
    - [74, 18.5]
  - - [256, 4096, 1, 256, 256, 256, 256, 4096]
    - [73, 30.95]
  - - [256, 4096, 1, 512, 256, 256, 256, 4096]
    - [74, 47.81]
  - - [256, 4096, 1, 1024, 256, 256, 256, 4096]
    - [74, 64.73]
  - - [256, 4096, 1, 2048, 256, 256, 256, 4096]
    - [74, 79.17]
  - - [256, 4096, 1, 4096, 256, 256, 256, 4096]
    - [74, 87.04]
  - - [256, 4096, 1, 8192, 256, 256, 256, 4096]
    - [48, 87.14]
  - - [256, 8192, 1, 128, 256, 256, 256, 8192]
    - [38, 28.85]
  - - [256, 8192, 1, 256, 256, 256, 256, 8192]
    - [67, 49.33]
  - - [256, 8192, 1, 512, 256, 256, 256, 8192]
    - [67, 74.57]
  - - [256, 8192, 1, 1024, 256, 256, 256, 8192]
    - [67, 97.75]
  - - [256, 8192, 1, 2048, 256, 256, 256, 8192]
    - [66, 108.57]
  - - [256, 8192, 1, 4096, 256, 256, 256, 8192]
    - [68, 119.31]
  - - [256, 8192, 1, 8192, 256, 256, 256, 8192]
    - [106, 113.16]
  - - [512, 128, 1, 128, 512, 512, 512, 128]
    - [59, 1.32]
  - - [512, 128, 1, 256, 512, 512, 512, 128]
    - [122, 2.81]
  - - [512, 128, 1, 512, 512, 512, 512, 128]
    - [121, 4.42]
  - - [512, 128, 1, 1024, 512, 512, 512, 128]
    - [121, 6.33]
  - - [512, 128, 1, 2048, 512, 512, 512, 128]
    - [121, 8.23]
  - - [512, 128, 1, 4096, 512, 512, 512, 128]
    - [124, 9.54]
  - - [512, 128, 1, 8192, 512, 512, 512, 128]
    - [130, 10.51]
  - - [512, 256, 1, 128, 512, 512, 512, 256]
    - [100, 3.25]
  - - [512, 256, 1, 256, 512, 512, 512, 256]
    - [102, 5.5]
  - - [512, 256, 1, 512, 512, 512, 512, 256]
    - [125, 8.71]
  - - [512, 256, 1, 1024, 512, 512, 512, 256]
    - [129, 12.32]
  - - [512, 256, 1, 2048, 512, 512, 512, 256]
    - [128, 15.53]
  - - [512, 256, 1, 4096, 512, 512, 512, 256]
    - [129, 17.82]
  - - [512, 256, 1, 8192, 512, 512, 512, 256]
    - [55, 20.09]
  - - [512, 512, 1, 128, 512, 512, 512, 512]
    - [97, 5.96]
  - - [512, 512, 1, 256, 512, 512, 512, 512]
    - [97, 10.23]
  - - [512, 512, 1, 512, 512, 512, 512, 512]
    - [114, 15.83]
  - - [512, 512, 1, 1024, 512, 512, 512, 512]
    - [114, 22.6]
  - - [512, 512, 1, 2048, 512, 512, 512, 512]
    - [114, 28.3]
  - - [512, 512, 1, 4096, 512, 512, 512, 512]
    - [114, 32.13]
  - - [512, 512, 1, 8192, 512, 512, 512, 512]
    - [49, 37.6]
  - - [512, 1024, 1, 128, 512, 512, 512, 1024]
    - [85, 10.97]
  - - [512, 1024, 1, 256, 512, 512, 512, 1024]
    - [87, 18.83]
  - - [512, 1024, 1, 512, 512, 512, 512, 1024]
    - [89, 28.97]
  - - [512, 1024, 1, 1024, 512, 512, 512, 1024]
    - [88, 39.64]
  - - [512, 1024, 1, 2048, 512, 512, 512, 1024]
    - [88, 48.24]
  - - [512, 1024, 1, 4096, 512, 512, 512, 1024]
    - [92, 54.1]
  - - [512, 1024, 1, 8192, 512, 512, 512, 1024]
    - [51, 62.11]
  - - [512, 2048, 1, 128, 512, 512, 512, 2048]
    - [73, 18.31]
  - - [512, 2048, 1, 256, 512, 512, 512, 2048]
    - [74, 31.26]
  - - [512, 2048, 1, 512, 512, 512, 512, 2048]
    - [74, 48.06]
  - - [512, 2048, 1, 1024, 512, 512, 512, 2048]
    - [74, 65.27]
  - - [512, 2048, 1, 2048, 512, 512, 512, 2048]
    - [74, 79.41]
  - - [512, 2048, 1, 4096, 512, 512, 512, 2048]
    - [77, 88.42]
  - - [512, 2048, 1, 8192, 512, 512, 512, 2048]
    - [46, 88.68]
  - - [512, 4096, 1, 128, 512, 512, 512, 4096]
    - [36, 29.0]
  - - [512, 4096, 1, 256, 512, 512, 512, 4096]
    - [67, 48.33]
  - - [512, 4096, 1, 512, 512, 512, 512, 4096]
    - [67, 75.55]
  - - [512, 4096, 1, 1024, 512, 512, 512, 4096]
    - [71, 99.47]
  - - [512, 4096, 1, 2048, 512, 512, 512, 4096]
    - [67, 119.09]
  - - [512, 4096, 1, 4096, 512, 512, 512, 4096]
    - [67, 126.52]
  - - [512, 4096, 1, 8192, 512, 512, 512, 4096]
    - [67, 116.04]
  - - [512, 8192, 1, 128, 512, 512, 512, 8192]
    - [26, 40.91]
  - - [512, 8192, 1, 256, 512, 512, 512, 8192]
    - [28, 66.46]
  - - [512, 8192, 1, 512, 512, 512, 512, 8192]
    - [18, 94.14]
  - - [512, 8192, 1, 1024, 512, 512, 512, 8192]
    - [18, 119.52]
  - - [512, 8192, 1, 2048, 512, 512, 512, 8192]
    - [20, 135.41]
  - - [512, 8192, 1, 4096, 512, 512, 512, 8192]
    - [20, 124.22]
  - - [512, 8192, 1, 8192, 512, 512, 512, 8192]
    - [20, 134.84]
  - - [1024, 128, 1, 128, 1024, 1024, 1024, 128]
    - [104, 3.26]
  - - [1024, 128, 1, 256, 1024, 1024, 1024, 128]
    - [105, 5.42]
  - - [1024, 128, 1, 512, 1024, 1024, 1024, 128]
    - [121, 8.55]
  - - [1024, 128, 1, 1024, 1024, 1024, 1024, 128]
    - [129, 12.3]
  - - [1024, 128, 1, 2048, 1024, 1024, 1024, 128]
    - [123, 15.77]
  - - [1024, 128, 1, 4096, 1024, 1024, 1024, 128]
    - [130, 18.47]
  - - [1024, 128, 1, 8192, 1024, 1024, 1024, 128]
    - [127, 20.52]
  - - [1024, 256, 1, 128, 1024, 1024, 1024, 256]
    - [96, 5.89]
  - - [1024, 256, 1, 256, 1024, 1024, 1024, 256]
    - [99, 10.05]
  - - [1024, 256, 1, 512, 1024, 1024, 1024, 256]
    - [115, 15.86]
  - - [1024, 256, 1, 1024, 1024, 1024, 1024, 256]
    - [115, 22.06]
  - - [1024, 256, 1, 2048, 1024, 1024, 1024, 256]
    - [115, 27.78]
  - - [1024, 256, 1, 4096, 1024, 1024, 1024, 256]
    - [115, 32.13]
  - - [1024, 256, 1, 8192, 1024, 1024, 1024, 256]
    - [49, 37.28]
  - - [1024, 512, 1, 128, 1024, 1024, 1024, 512]
    - [95, 10.72]
  - - [1024, 512, 1, 256, 1024, 1024, 1024, 512]
    - [93, 18.62]
  - - [1024, 512, 1, 512, 1024, 1024, 1024, 512]
    - [93, 28.69]
  - - [1024, 512, 1, 1024, 1024, 1024, 1024, 512]
    - [95, 39.69]
  - - [1024, 512, 1, 2048, 1024, 1024, 1024, 512]
    - [94, 48.1]
  - - [1024, 512, 1, 4096, 1024, 1024, 1024, 512]
    - [95, 54.28]
  - - [1024, 512, 1, 8192, 1024, 1024, 1024, 512]
    - [53, 61.65]
  - - [1024, 1024, 1, 128, 1024, 1024, 1024, 1024]
    - [74, 18.12]
  - - [1024, 1024, 1, 256, 1024, 1024, 1024, 1024]
    - [74, 30.71]
  - - [1024, 1024, 1, 512, 1024, 1024, 1024, 1024]
    - [81, 46.6]
  - - [1024, 1024, 1, 1024, 1024, 1024, 1024, 1024]
    - [77, 63.93]
  - - [1024, 1024, 1, 2048, 1024, 1024, 1024, 1024]
    - [74, 77.72]
  - - [1024, 1024, 1, 4096, 1024, 1024, 1024, 1024]
    - [80, 86.91]
  - - [1024, 1024, 1, 8192, 1024, 1024, 1024, 1024]
    - [39, 83.92]
  - - [1024, 2048, 1, 128, 1024, 1024, 1024, 2048]
    - [67, 29.07]
  - - [1024, 2048, 1, 256, 1024, 1024, 1024, 2048]
    - [67, 49.43]
  - - [1024, 2048, 1, 512, 1024, 1024, 1024, 2048]
    - [67, 76.42]
  - - [1024, 2048, 1, 1024, 1024, 1024, 1024, 2048]
    - [67, 101.0]
  - - [1024, 2048, 1, 2048, 1024, 1024, 1024, 2048]
    - [67, 120.95]
  - - [1024, 2048, 1, 4096, 1024, 1024, 1024, 2048]
    - [68, 127.5]
  - - [1024, 2048, 1, 8192, 1024, 1024, 1024, 2048]
    - [71, 116.14]
  - - [1024, 4096, 1, 128, 1024, 1024, 1024, 4096]
    - [29, 41.6]
  - - [1024, 4096, 1, 256, 1024, 1024, 1024, 4096]
    - [25, 67.52]
  - - [1024, 4096, 1, 512, 1024, 1024, 1024, 4096]
    - [26, 97.08]
  - - [1024, 4096, 1, 1024, 1024, 1024, 1024, 4096]
    - [18, 121.25]
  - - [1024, 4096, 1, 2048, 1024, 1024, 1024, 4096]
    - [18, 139.38]
  - - [1024, 4096, 1, 4096, 1024, 1024, 1024, 4096]
    - [23, 126.43]
  - - [1024, 4096, 1, 8192, 1024, 1024, 1024, 4096]
    - [21, 137.53]
  - - [1024, 8192, 1, 128, 1024, 1024, 1024, 8192]
    - [3, 49.66]
  - - [1024, 8192, 1, 256, 1024, 1024, 1024, 8192]
    - [3, 79.27]
  - - [1024, 8192, 1, 512, 1024, 1024, 1024, 8192]
    - [3, 113.1]
  - - [1024, 8192, 1, 1024, 1024, 1024, 1024, 8192]
    - [2, 138.64]
  - - [1024, 8192, 1, 2048, 1024, 1024, 1024, 8192]
    - [3, 140.58]
  - - [1024, 8192, 1, 4096, 1024, 1024, 1024, 8192]
    - [8, 149.53]
  - - [1024, 8192, 1, 8192, 1024, 1024, 1024, 8192]
    - [4, 163.32]
  - - [2048, 128, 1, 128, 2048, 2048, 2048, 128]
    - [111, 5.74]
  - - [2048, 128, 1, 256, 2048, 2048, 2048, 128]
    - [96, 9.87]
  - - [2048, 128, 1, 512, 2048, 2048, 2048, 128]
    - [116, 15.72]
  - - [2048, 128, 1, 1024, 2048, 2048, 2048, 128]
    - [117, 22.63]
  - - [2048, 128, 1, 2048, 2048, 2048, 2048, 128]
    - [117, 29.25]
  - - [2048, 128, 1, 4096, 2048, 2048, 2048, 128]
    - [117, 34.65]
  - - [2048, 128, 1, 8192, 2048, 2048, 2048, 128]
    - [116, 34.52]
  - - [2048, 256, 1, 128, 2048, 2048, 2048, 256]
    - [90, 10.69]
  - - [2048, 256, 1, 256, 2048, 2048, 2048, 256]
    - [93, 18.32]
  - - [2048, 256, 1, 512, 2048, 2048, 2048, 256]
    - [90, 28.72]
  - - [2048, 256, 1, 1024, 2048, 2048, 2048, 256]
    - [95, 39.45]
  - - [2048, 256, 1, 2048, 2048, 2048, 2048, 256]
    - [90, 48.32]
  - - [2048, 256, 1, 4096, 2048, 2048, 2048, 256]
    - [90, 53.83]
  - - [2048, 256, 1, 8192, 2048, 2048, 2048, 256]
    - [52, 60.08]
  - - [2048, 512, 1, 128, 2048, 2048, 2048, 512]
    - [77, 17.86]
  - - [2048, 512, 1, 256, 2048, 2048, 2048, 512]
    - [80, 30.29]
  - - [2048, 512, 1, 512, 2048, 2048, 2048, 512]
    - [80, 46.67]
  - - [2048, 512, 1, 1024, 2048, 2048, 2048, 512]
    - [82, 62.99]
  - - [2048, 512, 1, 2048, 2048, 2048, 2048, 512]
    - [76, 76.7]
  - - [2048, 512, 1, 4096, 2048, 2048, 2048, 512]
    - [76, 86.0]
  - - [2048, 512, 1, 8192, 2048, 2048, 2048, 512]
    - [43, 87.88]
  - - [2048, 1024, 1, 128, 2048, 2048, 2048, 1024]
    - [39, 28.57]
  - - [2048, 1024, 1, 256, 2048, 2048, 2048, 1024]
    - [71, 48.39]
  - - [2048, 1024, 1, 512, 2048, 2048, 2048, 1024]
    - [70, 74.92]
  - - [2048, 1024, 1, 1024, 2048, 2048, 2048, 1024]
    - [68, 100.48]
  - - [2048, 1024, 1, 2048, 2048, 2048, 2048, 1024]
    - [68, 119.27]
  - - [2048, 1024, 1, 4096, 2048, 2048, 2048, 1024]
    - [71, 126.04]
  - - [2048, 1024, 1, 8192, 2048, 2048, 2048, 1024]
    - [71, 116.51]
  - - [2048, 2048, 1, 128, 2048, 2048, 2048, 2048]
    - [29, 41.61]
  - - [2048, 2048, 1, 256, 2048, 2048, 2048, 2048]
    - [34, 66.72]
  - - [2048, 2048, 1, 512, 2048, 2048, 2048, 2048]
    - [34, 97.57]
  - - [2048, 2048, 1, 1024, 2048, 2048, 2048, 2048]
    - [34, 123.13]
  - - [2048, 2048, 1, 2048, 2048, 2048, 2048, 2048]
    - [20, 139.8]
  - - [2048, 2048, 1, 4096, 2048, 2048, 2048, 2048]
    - [19, 126.48]
  - - [2048, 2048, 1, 8192, 2048, 2048, 2048, 2048]
    - [20, 140.18]
  - - [2048, 4096, 1, 128, 2048, 2048, 2048, 4096]
    - [3, 49.22]
  - - [2048, 4096, 1, 256, 2048, 2048, 2048, 4096]
    - [3, 79.52]
  - - [2048, 4096, 1, 512, 2048, 2048, 2048, 4096]
    - [3, 111.25]
  - - [2048, 4096, 1, 1024, 2048, 2048, 2048, 4096]
    - [8, 139.06]
  - - [2048, 4096, 1, 2048, 2048, 2048, 2048, 4096]
    - [8, 140.06]
  - - [2048, 4096, 1, 4096, 2048, 2048, 2048, 4096]
    - [8, 149.9]
  - - [2048, 4096, 1, 8192, 2048, 2048, 2048, 4096]
    - [3, 157.92]
  - - [2048, 8192, 1, 128, 2048, 2048, 2048, 8192]
    - [1, 56.13]
  - - [2048, 8192, 1, 256, 2048, 2048, 2048, 8192]
    - [1, 86.96]
  - - [2048, 8192, 1, 512, 2048, 2048, 2048, 8192]
    - [13, 117.74]
  - - [2048, 8192, 1, 1024, 2048, 2048, 2048, 8192]
    - [20, 127.22]
  - - [2048, 8192, 1, 2048, 2048, 2048, 2048, 8192]
    - [14, 149.17]
  - - [2048, 8192, 1, 4096, 2048, 2048, 2048, 8192]
    - [17, 175.15]
  - - [2048, 8192, 1, 8192, 2048, 2048, 2048, 8192]
    - [62, 185.25]
  - - [4096, 128, 1, 128, 4096, 4096, 4096, 128]
    - [86, 10.85]
  - - [4096, 128, 1, 256, 4096, 4096, 4096, 128]
    - [95, 18.54]
  - - [4096, 128, 1, 512, 4096, 4096, 4096, 128]
    - [90, 28.6]
  - - [4096, 128, 1, 1024, 4096, 4096, 4096, 128]
    - [91, 39.71]
  - - [4096, 128, 1, 2048, 4096, 4096, 4096, 128]
    - [89, 47.9]
  - - [4096, 128, 1, 4096, 4096, 4096, 4096, 128]
    - [110, 50.71]
  - - [4096, 128, 1, 8192, 4096, 4096, 4096, 128]
    - [45, 56.06]
  - - [4096, 256, 1, 128, 4096, 4096, 4096, 256]
    - [76, 18.2]
  - - [4096, 256, 1, 256, 4096, 4096, 4096, 256]
    - [78, 30.72]
  - - [4096, 256, 1, 512, 4096, 4096, 4096, 256]
    - [83, 47.37]
  - - [4096, 256, 1, 1024, 4096, 4096, 4096, 256]
    - [76, 64.27]
  - - [4096, 256, 1, 2048, 4096, 4096, 4096, 256]
    - [80, 77.27]
  - - [4096, 256, 1, 4096, 4096, 4096, 4096, 256]
    - [79, 83.32]
  - - [4096, 256, 1, 8192, 4096, 4096, 4096, 256]
    - [40, 83.48]
  - - [4096, 512, 1, 128, 4096, 4096, 4096, 512]
    - [41, 28.5]
  - - [4096, 512, 1, 256, 4096, 4096, 4096, 512]
    - [68, 48.63]
  - - [4096, 512, 1, 512, 4096, 4096, 4096, 512]
    - [71, 74.59]
  - - [4096, 512, 1, 1024, 4096, 4096, 4096, 512]
    - [71, 101.36]
  - - [4096, 512, 1, 2048, 4096, 4096, 4096, 512]
    - [71, 119.44]
  - - [4096, 512, 1, 4096, 4096, 4096, 4096, 512]
    - [71, 124.29]
  - - [4096, 512, 1, 8192, 4096, 4096, 4096, 512]
    - [70, 118.05]
  - - [4096, 1024, 1, 128, 4096, 4096, 4096, 1024]
    - [27, 40.46]
  - - [4096, 1024, 1, 256, 4096, 4096, 4096, 1024]
    - [30, 65.81]
  - - [4096, 1024, 1, 512, 4096, 4096, 4096, 1024]
    - [32, 95.97]
  - - [4096, 1024, 1, 1024, 4096, 4096, 4096, 1024]
    - [23, 120.35]
  - - [4096, 1024, 1, 2048, 4096, 4096, 4096, 1024]
    - [23, 136.89]
  - - [4096, 1024, 1, 4096, 4096, 4096, 4096, 1024]
    - [67, 129.77]
  - - [4096, 1024, 1, 8192, 4096, 4096, 4096, 1024]
    - [22, 139.37]
  - - [4096, 2048, 1, 128, 4096, 4096, 4096, 2048]
    - [3, 47.98]
  - - [4096, 2048, 1, 256, 4096, 4096, 4096, 2048]
    - [3, 76.81]
  - - [4096, 2048, 1, 512, 4096, 4096, 4096, 2048]
    - [8, 109.15]
  - - [4096, 2048, 1, 1024, 4096, 4096, 4096, 2048]
    - [8, 137.37]
  - - [4096, 2048, 1, 2048, 4096, 4096, 4096, 2048]
    - [7, 139.36]
  - - [4096, 2048, 1, 4096, 4096, 4096, 4096, 2048]
    - [8, 149.0]
  - - [4096, 2048, 1, 8192, 4096, 4096, 4096, 2048]
    - [3, 158.26]
  - - [4096, 4096, 1, 128, 4096, 4096, 4096, 4096]
    - [2, 54.09]
  - - [4096, 4096, 1, 256, 4096, 4096, 4096, 4096]
    - [13, 85.16]
  - - [4096, 4096, 1, 512, 4096, 4096, 4096, 4096]
    - [10, 115.97]
  - - [4096, 4096, 1, 1024, 4096, 4096, 4096, 4096]
    - [16, 130.24]
  - - [4096, 4096, 1, 2048, 4096, 4096, 4096, 4096]
    - [17, 151.97]
  - - [4096, 4096, 1, 4096, 4096, 4096, 4096, 4096]
    - [63, 169.92]
  - - [4096, 4096, 1, 8192, 4096, 4096, 4096, 4096]
    - [61, 186.14]
  - - [4096, 8192, 1, 128, 4096, 4096, 4096, 8192]
    - [1, 56.37]
  - - [4096, 8192, 1, 256, 4096, 4096, 4096, 8192]
    - [33, 88.52]
  - - [4096, 8192, 1, 512, 4096, 4096, 4096, 8192]
    - [31, 112.63]
  - - [4096, 8192, 1, 1024, 4096, 4096, 4096, 8192]
    - [19, 142.84]
  - - [4096, 8192, 1, 2048, 4096, 4096, 4096, 8192]
    - [12, 171.96]
  - - [4096, 8192, 1, 4096, 4096, 4096, 4096, 8192]
    - [6, 190.36]
  - - [4096, 8192, 1, 8192, 4096, 4096, 4096, 8192]
    - [11, 210.83]
  - - [8192, 128, 1, 128, 8192, 8192, 8192, 128]
    - [46, 17.85]
  - - [8192, 128, 1, 256, 8192, 8192, 8192, 128]
    - [82, 28.92]
  - - [8192, 128, 1, 512, 8192, 8192, 8192, 128]
    - [75, 44.89]
  - - [8192, 128, 1, 1024, 8192, 8192, 8192, 128]
    - [83, 61.9]
  - - [8192, 128, 1, 2048, 8192, 8192, 8192, 128]
    - [77, 71.02]
  - - [8192, 128, 1, 4096, 8192, 8192, 8192, 128]
    - [80, 78.69]
  - - [8192, 128, 1, 8192, 8192, 8192, 8192, 128]
    - [42, 80.4]
  - - [8192, 256, 1, 128, 8192, 8192, 8192, 256]
    - [37, 28.12]
  - - [8192, 256, 1, 256, 8192, 8192, 8192, 256]
    - [69, 46.79]
  - - [8192, 256, 1, 512, 8192, 8192, 8192, 256]
    - [70, 73.11]
  - - [8192, 256, 1, 1024, 8192, 8192, 8192, 256]
    - [68, 97.68]
  - - [8192, 256, 1, 2048, 8192, 8192, 8192, 256]
    - [70, 111.88]
  - - [8192, 256, 1, 4096, 8192, 8192, 8192, 256]
    - [68, 122.03]
  - - [8192, 256, 1, 8192, 8192, 8192, 8192, 256]
    - [71, 112.52]
  - - [8192, 512, 1, 128, 8192, 8192, 8192, 512]
    - [29, 39.21]
  - - [8192, 512, 1, 256, 8192, 8192, 8192, 512]
    - [34, 64.4]
  - - [8192, 512, 1, 512, 8192, 8192, 8192, 512]
    - [33, 94.0]
  - - [8192, 512, 1, 1024, 8192, 8192, 8192, 512]
    - [19, 117.89]
  - - [8192, 512, 1, 2048, 8192, 8192, 8192, 512]
    - [24, 135.74]
  - - [8192, 512, 1, 4096, 8192, 8192, 8192, 512]
    - [106, 126.72]
  - - [8192, 512, 1, 8192, 8192, 8192, 8192, 512]
    - [15, 133.24]
  - - [8192, 1024, 1, 128, 8192, 8192, 8192, 1024]
    - [2, 46.98]
  - - [8192, 1024, 1, 256, 8192, 8192, 8192, 1024]
    - [2, 75.42]
  - - [8192, 1024, 1, 512, 8192, 8192, 8192, 1024]
    - [13, 109.88]
  - - [8192, 1024, 1, 1024, 8192, 8192, 8192, 1024]
    - [8, 137.23]
  - - [8192, 1024, 1, 2048, 8192, 8192, 8192, 1024]
    - [9, 140.12]
  - - [8192, 1024, 1, 4096, 8192, 8192, 8192, 1024]
    - [64, 152.01]
  - - [8192, 1024, 1, 8192, 8192, 8192, 8192, 1024]
    - [63, 156.48]
  - - [8192, 2048, 1, 128, 8192, 8192, 8192, 2048]
    - [3, 54.33]
  - - [8192, 2048, 1, 256, 8192, 8192, 8192, 2048]
    - [3, 84.75]
  - - [8192, 2048, 1, 512, 8192, 8192, 8192, 2048]
    - [4, 113.12]
  - - [8192, 2048, 1, 1024, 8192, 8192, 8192, 2048]
    - [23, 129.78]
  - - [8192, 2048, 1, 2048, 8192, 8192, 8192, 2048]
    - [23, 153.8]
  - - [8192, 2048, 1, 4096, 8192, 8192, 8192, 2048]
    - [3, 179.56]
  - - [8192, 2048, 1, 8192, 8192, 8192, 8192, 2048]
    - [60, 194.32]
  - - [8192, 4096, 1, 128, 8192, 8192, 8192, 4096]
    - [2, 56.78]
  - - [8192, 4096, 1, 256, 8192, 8192, 8192, 4096]
    - [22, 86.98]
  - - [8192, 4096, 1, 512, 8192, 8192, 8192, 4096]
    - [65, 112.29]
  - - [8192, 4096, 1, 1024, 8192, 8192, 8192, 4096]
    - [3, 141.8]
  - - [8192, 4096, 1, 2048, 8192, 8192, 8192, 4096]
    - [3, 176.8]
  - - [8192, 4096, 1, 4096, 8192, 8192, 8192, 4096]
    - [0, 199.1]
  - - [8192, 4096, 1, 8192, 8192, 8192, 8192, 4096]
    - [3, 213.03]
  - - [8192, 8192, 1, 128, 8192, 8192, 8192, 8192]
    - [35, 56.99]
  - - [8192, 8192, 1, 256, 8192, 8192, 8192, 8192]
    - [0, 91.11]
  - - [8192, 8192, 1, 512, 8192, 8192, 8192, 8192]
    - [5, 124.46]
  - - [8192, 8192, 1, 1024, 8192, 8192, 8192, 8192]
    - [8, 158.55]
  - - [8192, 8192, 1, 2048, 8192, 8192, 8192, 8192]
    - [63, 187.18]
  - - [8192, 8192, 1, 4096, 8192, 8192, 8192, 8192]
    - [8, 204.49]
  - - [8192, 8192, 1, 8192, 8192, 8192, 8192, 8192]
    - [8, 216.21]
- null
- null
- ExperimentalStreamK
- GridBased
