projects/hipblaslt/library/src/amd_detail/rocblaslt/src/Tensile/Logic/asm_full/aquavanjaram/gfx942_228cu/StreamK/aquavanjaram942_Cijk_Ailk_Bjlk_B8NHS_BH_Bias_HAS_SAV_UserArgs.yaml
- {MinimumRequiredVersion: 4.33.0}
- aquavanjaram942
- {Architecture: gfx942, CUCount: 228}
- [Device 0049, Device 0050]
    SolutionIndex: 0
    SolutionNameMin: Cijk_Ailk_Bjlk_B8NHS_BH_Bias_HAS_SAV_UserArgs_MT256x256x64_MI16x16x1_SN_LDSB0_CLR1_GRVWA4_GRVWB4_GSU0_GSUC0_GSUWGMRR0_K1_LBSPPA2048_LBSPPB2048_LPA0_LPB0_MIWT8_8_PLR1_SU0_SUM0_SUS64_VWA8_VWB8_WGM1_WGMXCC1_WGMXCCGn1
    SolutionIndex: 1
    SolutionNameMin: Cijk_Ailk_Bjlk_B8NHS_BH_Bias_HAS_SAV_UserArgs_MT256x256x64_MI16x16x1_SN_LDSB0_CLR1_GRVWA4_GRVWB8_GSU0_GSUC0_GSUWGMRR0_K1_LBSPPA2048_LBSPPB2048_LPA0_LPB0_MIWT8_8_PLR1_SU0_SUM0_SUS64_VWA8_VWB8_WGM1_WGMXCC1_WGMXCCGn1
    SolutionIndex: 2
    SolutionNameMin: Cijk_Ailk_Bjlk_B8NHS_BH_Bias_HAS_SAV_UserArgs_MT256x256x64_MI16x16x1_SN_LDSB0_CLR1_GRVWA16_GRVWB8_GSU0_GSUC0_GSUWGMRR0_K1_LBSPPA2048_LBSPPB2048_LPA0_LPB0_MIWT8_8_PLR1_SU0_SUM0_SUS64_VWA8_VWB8_WGM1_WGMXCC1_WGMXCCGn1
    SolutionIndex: 3
    SolutionNameMin: Cijk_Ailk_Bjlk_B8NHS_BH_Bias_HAS_SAV_UserArgs_MT256x256x64_MI16x16x1_SN_LDSB0_CLR1_GRVWA4_GRVWB16_GSU0_GSUC0_GSUWGMRR0_K1_LBSPPA2048_LBSPPB2048_LPA0_LPB0_MIWT8_8_PLR1_SU0_SUM0_SUS64_VWA8_VWB8_WGM1_WGMXCC1_WGMXCCGn1
    SolutionIndex: 4
    SolutionNameMin: Cijk_Ailk_Bjlk_B8NHS_BH_Bias_HAS_SAV_UserArgs_MT256x256x64_MI16x16x1_SN_LDSB0_CLR1_GRVWA8_GRVWB16_GSU0_GSUC0_GSUWGMRR0_K1_LBSPPA2048_LBSPPB2048_LPA0_LPB0_MIWT8_8_PLR1_SU0_SUM0_SUS64_VWA8_VWB8_WGM1_WGMXCC1_WGMXCCGn1
    SolutionIndex: 5
    SolutionNameMin: Cijk_Ailk_Bjlk_B8NHS_BH_Bias_HAS_SAV_UserArgs_MT256x256x64_MI16x16x1_SN_LDSB0_CLR1_GRVWA16_GRVWB16_GSU0_GSUC0_GSUWGMRR0_K1_LBSPPA2048_LBSPPB2048_LPA0_LPB0_MIWT8_8_PLR1_SU0_SUM0_SUS64_VWA8_VWB8_WGM1_WGMXCC1_WGMXCCGn1
    SolutionIndex: 6
    SolutionNameMin: Cijk_Ailk_Bjlk_B8NHS_BH_Bias_HAS_SAV_UserArgs_MT256x256x64_MI16x16x1_SN_LDSB0_CLR1_GRVWA16_GRVWB16_GSU0_GSUC0_GSUWGMRR0_K1_LBSPPA2048_LBSPPB2048_LPA0_LPB0_MIWT8_8_PLR1_SU0_SUM0_SUS64_VWA8_VWB8_WGM4_WGMXCC1_WGMXCCGn1
    SolutionIndex: 7
    SolutionNameMin: Cijk_Ailk_Bjlk_B8NHS_BH_Bias_HAS_SAV_UserArgs_MT256x256x64_MI16x16x1_SN_LDSB0_CLR1_GRVWA4_GRVWB4_GSU0_GSUC0_GSUWGMRR0_K1_LBSPPA2048_LBSPPB2048_LPA0_LPB0_MIWT8_8_PLR1_SU0_SUM0_SUS64_VWA8_VWB8_WGM6_WGMXCC1_WGMXCCGn1
    SolutionIndex: 8
    SolutionNameMin: Cijk_Ailk_Bjlk_B8NHS_BH_Bias_HAS_SAV_UserArgs_MT256x256x64_MI16x16x1_SN_LDSB0_CLR1_GRVWA16_GRVWB8_GSU0_GSUC0_GSUWGMRR0_K1_LBSPPA2048_LBSPPB2048_LPA0_LPB0_MIWT8_8_PLR1_SU0_SUM0_SUS64_VWA8_VWB8_WGM6_WGMXCC1_WGMXCCGn1
    SolutionIndex: 9
    SolutionNameMin: Cijk_Ailk_Bjlk_B8NHS_BH_Bias_HAS_SAV_UserArgs_MT256x256x64_MI16x16x1_SN_LDSB0_CLR1_GRVWA16_GRVWB16_GSU0_GSUC0_GSUWGMRR0_K1_LBSPPA2048_LBSPPB2048_LPA0_LPB0_MIWT8_8_PLR1_SU0_SUM0_SUS64_VWA8_VWB8_WGM6_WGMXCC1_WGMXCCGn1
    SolutionIndex: 10
    SolutionNameMin: Cijk_Ailk_Bjlk_B8NHS_BH_Bias_HAS_SAV_UserArgs_MT256x256x64_MI16x16x1_SN_LDSB0_CLR1_GRVWA4_GRVWB4_GSU0_GSUC0_GSUWGMRR0_K1_LBSPPA2048_LBSPPB2048_LPA0_LPB0_MIWT8_8_PLR1_SU0_SUM0_SUS64_VWA8_VWB8_WGM8_WGMXCC1_WGMXCCGn1
    SolutionIndex: 11
    SolutionNameMin: Cijk_Ailk_Bjlk_B8NHS_BH_Bias_HAS_SAV_UserArgs_MT256x256x64_MI16x16x1_SN_LDSB0_CLR1_GRVWA4_GRVWB8_GSU0_GSUC0_GSUWGMRR0_K1_LBSPPA2048_LBSPPB2048_LPA0_LPB0_MIWT8_8_PLR1_SU0_SUM0_SUS64_VWA8_VWB8_WGM8_WGMXCC1_WGMXCCGn1
    SolutionIndex: 12
    SolutionNameMin: Cijk_Ailk_Bjlk_B8NHS_BH_Bias_HAS_SAV_UserArgs_MT256x256x64_MI16x16x1_SN_LDSB0_CLR1_GRVWA16_GRVWB16_GSU0_GSUC0_GSUWGMRR0_K1_LBSPPA2048_LBSPPB2048_LPA0_LPB0_MIWT8_8_PLR1_SU0_SUM0_SUS64_VWA8_VWB8_WGM8_WGMXCC1_WGMXCCGn1
    SolutionIndex: 13
    SolutionNameMin: Cijk_Ailk_Bjlk_B8NHS_BH_Bias_HAS_SAV_UserArgs_MT128x256x64_MI16x16x1_SN_LDSB1_CLR1_GRVWA16_GRVWB8_GSU0_GSUC0_GSUWGMRR0_K1_LBSPPA1024_LBSPPB2048_LPA64_LPB0_MIWT4_8_PLR1_SU0_SUM0_SUS64_VWA4_VWB8_WGM1_WGMXCC1_WGMXCCGn1
    SolutionIndex: 14
    SolutionNameMin: Cijk_Ailk_Bjlk_B8NHS_BH_Bias_HAS_SAV_UserArgs_MT128x256x64_MI16x16x1_SN_LDSB1_CLR1_GRVWA4_GRVWB16_GSU0_GSUC0_GSUWGMRR0_K1_LBSPPA1024_LBSPPB2048_LPA64_LPB0_MIWT4_8_PLR1_SU0_SUM0_SUS64_VWA4_VWB8_WGM1_WGMXCC1_WGMXCCGn1
    SolutionIndex: 15
    SolutionNameMin: Cijk_Ailk_Bjlk_B8NHS_BH_Bias_HAS_SAV_UserArgs_MT128x256x64_MI16x16x1_SN_LDSB1_CLR1_GRVWA8_GRVWB16_GSU0_GSUC0_GSUWGMRR0_K1_LBSPPA1024_LBSPPB2048_LPA64_LPB0_MIWT4_8_PLR1_SU0_SUM0_SUS64_VWA4_VWB8_WGM1_WGMXCC1_WGMXCCGn1
    SolutionIndex: 16
    SolutionNameMin: Cijk_Ailk_Bjlk_B8NHS_BH_Bias_HAS_SAV_UserArgs_MT128x256x64_MI16x16x1_SN_LDSB1_CLR1_GRVWA16_GRVWB16_GSU0_GSUC0_GSUWGMRR0_K1_LBSPPA1024_LBSPPB2048_LPA64_LPB0_MIWT4_8_PLR1_SU0_SUM0_SUS64_VWA4_VWB8_WGM6_WGMXCC1_WGMXCCGn1
    SolutionIndex: 17
    SolutionNameMin: Cijk_Ailk_Bjlk_B8NHS_BH_Bias_HAS_SAV_UserArgs_MT256x144x64_MI16x16x1_SN_LDSB0_CLR1_GRVWA4_GRVWB4_GSU0_GSUC0_GSUWGMRR0_K1_LBSPPA2048_LBSPPB1152_LPA64_LPB16_MIWT4_9_PLR1_SU0_SUM0_SUS64_VWA4_VWB1_WGM1_WGMXCC1_WGMXCCGn1
    SolutionIndex: 18
    SolutionNameMin: Cijk_Ailk_Bjlk_B8NHS_BH_Bias_HAS_SAV_UserArgs_MT256x144x64_MI16x16x1_SN_LDSB0_CLR1_GRVWA16_GRVWB4_GSU0_GSUC0_GSUWGMRR0_K1_LBSPPA2048_LBSPPB1152_LPA64_LPB16_MIWT4_9_PLR1_SU0_SUM0_SUS64_VWA4_VWB1_WGM1_WGMXCC1_WGMXCCGn1
    SolutionIndex: 19
    SolutionNameMin: Cijk_Ailk_Bjlk_B8NHS_BH_Bias_HAS_SAV_UserArgs_MT256x144x64_MI16x16x1_SN_LDSB0_CLR1_GRVWA16_GRVWB4_GSU0_GSUC0_GSUWGMRR0_K1_LBSPPA2048_LBSPPB1152_LPA64_LPB16_MIWT4_9_PLR1_SU0_SUM0_SUS64_VWA4_VWB1_WGM6_WGMXCC1_WGMXCCGn1
    SolutionIndex: 20
    SolutionNameMin: Cijk_Ailk_Bjlk_B8NHS_BH_Bias_HAS_SAV_UserArgs_MT256x144x64_MI16x16x1_SN_LDSB0_CLR1_GRVWA16_GRVWB4_GSU0_GSUC0_GSUWGMRR0_K1_LBSPPA2048_LBSPPB1152_LPA64_LPB16_MIWT4_9_PLR1_SU0_SUM0_SUS64_VWA4_VWB1_WGM8_WGMXCC1_WGMXCCGn1
    SolutionIndex: 21
    SolutionNameMin: Cijk_Ailk_Bjlk_B8NHS_BH_Bias_HAS_SAV_UserArgs_MT256x128x64_MI16x16x1_SN_LDSB1_CLR1_GRVWA4_GRVWB8_GSU0_GSUC0_GSUWGMRR0_K1_LBSPPA2048_LBSPPB1024_LPA0_LPB64_MIWT8_4_PLR1_SU0_SUM0_SUS64_VWA8_VWB4_WGM1_WGMXCC1_WGMXCCGn1
    SolutionIndex: 22
    SolutionNameMin: Cijk_Ailk_Bjlk_B8NHS_BH_Bias_HAS_SAV_UserArgs_MT256x128x64_MI16x16x1_SN_LDSB1_CLR1_GRVWA16_GRVWB8_GSU0_GSUC0_GSUWGMRR0_K1_LBSPPA2048_LBSPPB1024_LPA0_LPB64_MIWT8_4_PLR1_SU0_SUM0_SUS64_VWA8_VWB4_WGM1_WGMXCC1_WGMXCCGn1
    SolutionIndex: 23
    SolutionNameMin: Cijk_Ailk_Bjlk_B8NHS_BH_Bias_HAS_SAV_UserArgs_MT256x128x64_MI16x16x1_SN_LDSB1_CLR1_GRVWA16_GRVWB16_GSU0_GSUC0_GSUWGMRR0_K1_LBSPPA2048_LBSPPB1024_LPA0_LPB64_MIWT8_4_PLR1_SU0_SUM0_SUS64_VWA8_VWB4_WGM1_WGMXCC1_WGMXCCGn1
    SolutionIndex: 24
    SolutionNameMin: Cijk_Ailk_Bjlk_B8NHS_BH_Bias_HAS_SAV_UserArgs_MT256x128x64_MI16x16x1_SN_LDSB1_CLR1_GRVWA16_GRVWB16_GSU0_GSUC0_GSUWGMRR0_K1_LBSPPA2048_LBSPPB1024_LPA0_LPB64_MIWT8_4_PLR1_SU0_SUM0_SUS64_VWA8_VWB4_WGM4_WGMXCC1_WGMXCCGn1
    SolutionIndex: 25
    SolutionNameMin: Cijk_Ailk_Bjlk_B8NHS_BH_Bias_HAS_SAV_UserArgs_MT256x128x64_MI16x16x1_SN_LDSB1_CLR1_GRVWA16_GRVWB16_GSU0_GSUC0_GSUWGMRR0_K1_LBSPPA2048_LBSPPB1024_LPA0_LPB64_MIWT8_4_PLR1_SU0_SUM0_SUS64_VWA8_VWB4_WGM6_WGMXCC1_WGMXCCGn1
    SolutionIndex: 26
    SolutionNameMin: Cijk_Ailk_Bjlk_B8NHS_BH_Bias_HAS_SAV_UserArgs_MT256x128x64_MI16x16x1_SN_LDSB1_CLR1_GRVWA4_GRVWB4_GSU0_GSUC0_GSUWGMRR0_K1_LBSPPA2048_LBSPPB1024_LPA0_LPB64_MIWT8_4_PLR1_SU0_SUM0_SUS64_VWA8_VWB4_WGM8_WGMXCC1_WGMXCCGn1
    SolutionIndex: 27
    SolutionNameMin: Cijk_Ailk_Bjlk_B8NHS_BH_Bias_HAS_SAV_UserArgs_MT256x128x64_MI16x16x1_SN_LDSB1_CLR1_GRVWA4_GRVWB8_GSU0_GSUC0_GSUWGMRR0_K1_LBSPPA2048_LBSPPB1024_LPA0_LPB64_MIWT8_4_PLR1_SU0_SUM0_SUS64_VWA8_VWB4_WGM8_WGMXCC1_WGMXCCGn1
    SolutionIndex: 28
    SolutionNameMin: Cijk_Ailk_Bjlk_B8NHS_BH_Bias_HAS_SAV_UserArgs_MT256x128x64_MI16x16x1_SN_LDSB1_CLR1_GRVWA16_GRVWB8_GSU0_GSUC0_GSUWGMRR0_K1_LBSPPA2048_LBSPPB1024_LPA0_LPB64_MIWT8_4_PLR1_SU0_SUM0_SUS64_VWA8_VWB4_WGM8_WGMXCC1_WGMXCCGn1
    SolutionIndex: 29
    SolutionNameMin: Cijk_Ailk_Bjlk_B8NHS_BH_Bias_HAS_SAV_UserArgs_MT256x128x64_MI16x16x1_SN_LDSB1_CLR1_GRVWA16_GRVWB16_GSU0_GSUC0_GSUWGMRR0_K1_LBSPPA2048_LBSPPB1024_LPA0_LPB64_MIWT8_4_PLR1_SU0_SUM0_SUS64_VWA8_VWB4_WGM8_WGMXCC1_WGMXCCGn1
    SolutionIndex: 30
    SolutionNameMin: Cijk_Ailk_Bjlk_B8NHS_BH_Bias_HAS_SAV_UserArgs_MT128x128x64_MI16x16x1_SN_LDSB1_CLR1_GRVWA4_GRVWB4_GSU0_GSUC0_GSUWGMRR0_K1_LBSPPA1024_LBSPPB1024_LPA0_LPB32_MIWT8_2_PLR1_SU0_SUM0_SUS64_VWA8_VWB2_WGM1_WGMXCC1_WGMXCCGn1
    SolutionIndex: 31
    SolutionNameMin: Cijk_Ailk_Bjlk_B8NHS_BH_Bias_HAS_SAV_UserArgs_MT128x128x64_MI16x16x1_SN_LDSB1_CLR1_GRVWA8_GRVWB16_GSU0_GSUC0_GSUWGMRR0_K1_LBSPPA1024_LBSPPB1024_LPA0_LPB32_MIWT8_2_PLR1_SU0_SUM0_SUS64_VWA8_VWB2_WGM1_WGMXCC1_WGMXCCGn1
    SolutionIndex: 32
    SolutionNameMin: Cijk_Ailk_Bjlk_B8NHS_BH_Bias_HAS_SAV_UserArgs_MT128x128x64_MI16x16x1_SN_LDSB1_CLR1_GRVWA16_GRVWB16_GSU0_GSUC0_GSUWGMRR0_K1_LBSPPA1024_LBSPPB1024_LPA0_LPB32_MIWT8_2_PLR1_SU0_SUM0_SUS64_VWA8_VWB2_WGM1_WGMXCC1_WGMXCCGn1
    SolutionIndex: 33
    SolutionNameMin: Cijk_Ailk_Bjlk_B8NHS_BH_Bias_HAS_SAV_UserArgs_MT128x128x64_MI16x16x1_SN_LDSB1_CLR1_GRVWA4_GRVWB4_GSU0_GSUC0_GSUWGMRR0_K1_LBSPPA1024_LBSPPB1024_LPA0_LPB32_MIWT8_2_PLR1_SU0_SUM0_SUS64_VWA8_VWB2_WGM6_WGMXCC1_WGMXCCGn1
    SolutionIndex: 34
    SolutionNameMin: Cijk_Ailk_Bjlk_B8NHS_BH_Bias_HAS_SAV_UserArgs_MT128x128x64_MI16x16x1_SN_LDSB1_CLR1_GRVWA4_GRVWB4_GSU0_GSUC0_GSUWGMRR0_K1_LBSPPA1024_LBSPPB1024_LPA0_LPB32_MIWT8_2_PLR1_SU0_SUM0_SUS64_VWA8_VWB2_WGM8_WGMXCC1_WGMXCCGn1
    SolutionIndex: 35
    SolutionNameMin: Cijk_Ailk_Bjlk_B8NHS_BH_Bias_HAS_SAV_UserArgs_MT128x64x64_MI16x16x1_SN_LDSB0_CLR1_GRVWA4_GRVWB4_GSU0_GSUC0_GSUWGMRR0_K1_LBSPPA1024_LBSPPB512_LPA0_LPB16_MIWT8_1_PLR1_SU0_SUM0_SUS64_VWA8_VWB1_WGM1_WGMXCC1_WGMXCCGn1
    SolutionIndex: 36
    SolutionNameMin: Cijk_Ailk_Bjlk_B8NHS_BH_Bias_HAS_SAV_UserArgs_MT128x128x64_MI16x16x1_SN_LDSB1_CLR1_GRVWA4_GRVWB8_GSU0_GSUC0_GSUWGMRR0_K1_LBSPPA1024_LBSPPB1024_LPA64_LPB64_MIWT4_4_PLR1_SU0_SUM0_SUS64_VWA4_VWB4_WGM1_WGMXCC1_WGMXCCGn1
    SolutionIndex: 37
    SolutionNameMin: Cijk_Ailk_Bjlk_B8NHS_BH_Bias_HAS_SAV_UserArgs_MT128x128x64_MI16x16x1_SN_LDSB1_CLR1_GRVWA8_GRVWB16_GSU0_GSUC0_GSUWGMRR0_K1_LBSPPA1024_LBSPPB1024_LPA64_LPB64_MIWT4_4_PLR1_SU0_SUM0_SUS64_VWA4_VWB4_WGM1_WGMXCC1_WGMXCCGn1
    SolutionIndex: 38
    SolutionNameMin: Cijk_Ailk_Bjlk_B8NHS_BH_Bias_HAS_SAV_UserArgs_MT128x128x64_MI16x16x1_SN_LDSB1_CLR1_GRVWA16_GRVWB16_GSU0_GSUC0_GSUWGMRR0_K1_LBSPPA1024_LBSPPB1024_LPA64_LPB64_MIWT4_4_PLR1_SU0_SUM0_SUS64_VWA4_VWB4_WGM1_WGMXCC1_WGMXCCGn1
    SolutionIndex: 39
    SolutionNameMin: Cijk_Ailk_Bjlk_B8NHS_BH_Bias_HAS_SAV_UserArgs_MT128x128x64_MI16x16x1_SN_LDSB1_CLR1_GRVWA8_GRVWB16_GSU0_GSUC0_GSUWGMRR0_K1_LBSPPA1024_LBSPPB1024_LPA64_LPB64_MIWT4_4_PLR1_SU0_SUM0_SUS64_VWA4_VWB4_WGM4_WGMXCC1_WGMXCCGn1
    SolutionIndex: 40
    SolutionNameMin: Cijk_Ailk_Bjlk_B8NHS_BH_Bias_HAS_SAV_UserArgs_MT128x128x64_MI16x16x1_SN_LDSB1_CLR1_GRVWA16_GRVWB16_GSU0_GSUC0_GSUWGMRR0_K1_LBSPPA1024_LBSPPB1024_LPA64_LPB64_MIWT4_4_PLR1_SU0_SUM0_SUS64_VWA4_VWB4_WGM4_WGMXCC1_WGMXCCGn1
    SolutionIndex: 41
    SolutionNameMin: Cijk_Ailk_Bjlk_B8NHS_BH_Bias_HAS_SAV_UserArgs_MT128x128x64_MI16x16x1_SN_LDSB1_CLR1_GRVWA8_GRVWB16_GSU0_GSUC0_GSUWGMRR0_K1_LBSPPA1024_LBSPPB1024_LPA64_LPB64_MIWT4_4_PLR1_SU0_SUM0_SUS64_VWA4_VWB4_WGM6_WGMXCC1_WGMXCCGn1
    SolutionIndex: 42
    SolutionNameMin: Cijk_Ailk_Bjlk_B8NHS_BH_Bias_HAS_SAV_UserArgs_MT128x128x64_MI16x16x1_SN_LDSB1_CLR1_GRVWA16_GRVWB16_GSU0_GSUC0_GSUWGMRR0_K1_LBSPPA1024_LBSPPB1024_LPA64_LPB64_MIWT4_4_PLR1_SU0_SUM0_SUS64_VWA4_VWB4_WGM6_WGMXCC1_WGMXCCGn1
    SolutionIndex: 43
    SolutionNameMin: Cijk_Ailk_Bjlk_B8NHS_BH_Bias_HAS_SAV_UserArgs_MT128x128x64_MI16x16x1_SN_LDSB1_CLR1_GRVWA8_GRVWB16_GSU0_GSUC0_GSUWGMRR0_K1_LBSPPA1024_LBSPPB1024_LPA64_LPB64_MIWT4_4_PLR1_SU0_SUM0_SUS64_VWA4_VWB4_WGM8_WGMXCC1_WGMXCCGn1
    SolutionIndex: 44
    SolutionNameMin: Cijk_Ailk_Bjlk_B8NHS_BH_Bias_HAS_SAV_UserArgs_MT128x128x64_MI16x16x1_SN_LDSB1_CLR1_GRVWA16_GRVWB16_GSU0_GSUC0_GSUWGMRR0_K1_LBSPPA1024_LBSPPB1024_LPA64_LPB64_MIWT4_4_PLR1_SU0_SUM0_SUS64_VWA4_VWB4_WGM8_WGMXCC1_WGMXCCGn1
    SolutionIndex: 45
    SolutionNameMin: Cijk_Ailk_Bjlk_B8NHS_BH_Bias_HAS_SAV_UserArgs_MT64x128x64_MI16x16x1_SN_LDSB0_CLR1_GRVWA4_GRVWB4_GSU0_GSUC0_GSUWGMRR0_K1_LBSPPA512_LBSPPB1024_LPA32_LPB64_MIWT2_4_PLR1_SU0_SUM0_SUS64_VWA2_VWB4_WGM1_WGMXCC1_WGMXCCGn1
    SolutionIndex: 46
    SolutionNameMin: Cijk_Ailk_Bjlk_B8NHS_BH_Bias_HAS_SAV_UserArgs_MT64x128x64_MI16x16x1_SN_LDSB0_CLR1_GRVWA4_GRVWB8_GSU0_GSUC0_GSUWGMRR0_K1_LBSPPA512_LBSPPB1024_LPA32_LPB64_MIWT2_4_PLR1_SU0_SUM0_SUS64_VWA2_VWB4_WGM1_WGMXCC1_WGMXCCGn1
    SolutionIndex: 47
    SolutionNameMin: Cijk_Ailk_Bjlk_B8NHS_BH_Bias_HAS_SAV_UserArgs_MT64x128x64_MI16x16x1_SN_LDSB0_CLR1_GRVWA16_GRVWB8_GSU0_GSUC0_GSUWGMRR0_K1_LBSPPA512_LBSPPB1024_LPA32_LPB64_MIWT2_4_PLR1_SU0_SUM0_SUS64_VWA2_VWB4_WGM1_WGMXCC1_WGMXCCGn1
    SolutionIndex: 48
    SolutionNameMin: Cijk_Ailk_Bjlk_B8NHS_BH_Bias_HAS_SAV_UserArgs_MT64x128x64_MI16x16x1_SN_LDSB0_CLR1_GRVWA4_GRVWB16_GSU0_GSUC0_GSUWGMRR0_K1_LBSPPA512_LBSPPB1024_LPA32_LPB64_MIWT2_4_PLR1_SU0_SUM0_SUS64_VWA2_VWB4_WGM1_WGMXCC1_WGMXCCGn1
    SolutionIndex: 49
    SolutionNameMin: Cijk_Ailk_Bjlk_B8NHS_BH_Bias_HAS_SAV_UserArgs_MT64x128x64_MI16x16x1_SN_LDSB0_CLR1_GRVWA8_GRVWB16_GSU0_GSUC0_GSUWGMRR0_K1_LBSPPA512_LBSPPB1024_LPA32_LPB64_MIWT2_4_PLR1_SU0_SUM0_SUS64_VWA2_VWB4_WGM1_WGMXCC1_WGMXCCGn1
    SolutionIndex: 50
    SolutionNameMin: Cijk_Ailk_Bjlk_B8NHS_BH_Bias_HAS_SAV_UserArgs_MT64x128x64_MI16x16x1_SN_LDSB0_CLR1_GRVWA16_GRVWB16_GSU0_GSUC0_GSUWGMRR0_K1_LBSPPA512_LBSPPB1024_LPA32_LPB64_MIWT2_4_PLR1_SU0_SUM0_SUS64_VWA2_VWB4_WGM1_WGMXCC1_WGMXCCGn1
    SolutionIndex: 51
    SolutionNameMin: Cijk_Ailk_Bjlk_B8NHS_BH_Bias_HAS_SAV_UserArgs_MT128x64x64_MI16x16x1_SN_LDSB0_CLR1_GRVWA4_GRVWB8_GSU0_GSUC0_GSUWGMRR0_K1_LBSPPA1024_LBSPPB512_LPA64_LPB32_MIWT4_2_PLR1_SU0_SUM0_SUS64_VWA4_VWB2_WGM1_WGMXCC1_WGMXCCGn1
    SolutionIndex: 52
    SolutionNameMin: Cijk_Ailk_Bjlk_B8NHS_BH_Bias_HAS_SAV_UserArgs_MT128x64x64_MI16x16x1_SN_LDSB0_CLR1_GRVWA8_GRVWB8_GSU0_GSUC0_GSUWGMRR0_K1_LBSPPA1024_LBSPPB512_LPA64_LPB32_MIWT4_2_PLR1_SU0_SUM0_SUS64_VWA4_VWB2_WGM1_WGMXCC1_WGMXCCGn1
    SolutionIndex: 53
    SolutionNameMin: Cijk_Ailk_Bjlk_B8NHS_BH_Bias_HAS_SAV_UserArgs_MT128x64x64_MI16x16x1_SN_LDSB0_CLR1_GRVWA16_GRVWB8_GSU0_GSUC0_GSUWGMRR0_K1_LBSPPA1024_LBSPPB512_LPA64_LPB32_MIWT4_2_PLR1_SU0_SUM0_SUS64_VWA4_VWB2_WGM1_WGMXCC1_WGMXCCGn1
    SolutionIndex: 54
    SolutionNameMin: Cijk_Ailk_Bjlk_B8NHS_BH_Bias_HAS_SAV_UserArgs_MT128x32x64_MI16x16x1_SN_LDSB0_CLR1_GRVWA4_GRVWB4_GSU0_GSUC0_GSUWGMRR0_K1_LBSPPA1024_LBSPPB256_LPA64_LPB16_MIWT4_1_PLR1_SU0_SUM0_SUS64_VWA4_VWB1_WGM1_WGMXCC1_WGMXCCGn1
    SolutionIndex: 55
    SolutionNameMin: Cijk_Ailk_Bjlk_B8NHS_BH_Bias_HAS_SAV_UserArgs_MT64x64x64_MI16x16x1_SN_LDSB0_CLR1_GRVWA4_GRVWB4_GSU0_GSUC0_GSUWGMRR0_K1_LBSPPA512_LBSPPB512_LPA32_LPB32_MIWT2_2_PLR1_SU0_SUM0_SUS64_VWA2_VWB2_WGM1_WGMXCC1_WGMXCCGn1
    SolutionIndex: 56
    SolutionNameMin: Cijk_Ailk_Bjlk_B8NHS_BH_Bias_HAS_SAV_UserArgs_MT64x64x64_MI16x16x1_SN_LDSB0_CLR1_GRVWA4_GRVWB8_GSU0_GSUC0_GSUWGMRR0_K1_LBSPPA512_LBSPPB512_LPA32_LPB32_MIWT2_2_PLR1_SU0_SUM0_SUS64_VWA2_VWB2_WGM1_WGMXCC1_WGMXCCGn1
    SolutionIndex: 57
    SolutionNameMin: Cijk_Ailk_Bjlk_B8NHS_BH_Bias_HAS_SAV_UserArgs_MT64x64x64_MI16x16x1_SN_LDSB0_CLR1_GRVWA8_GRVWB8_GSU0_GSUC0_GSUWGMRR0_K1_LBSPPA512_LBSPPB512_LPA32_LPB32_MIWT2_2_PLR1_SU0_SUM0_SUS64_VWA2_VWB2_WGM1_WGMXCC1_WGMXCCGn1
    SolutionIndex: 58
    SolutionNameMin: Cijk_Ailk_Bjlk_B8NHS_BH_Bias_HAS_SAV_UserArgs_MT64x64x64_MI16x16x1_SN_LDSB0_CLR1_GRVWA4_GRVWB4_GSU0_GSUC0_GSUWGMRR0_K1_LBSPPA512_LBSPPB512_LPA32_LPB32_MIWT2_2_PLR1_SU0_SUM0_SUS64_VWA2_VWB2_WGM8_WGMXCC1_WGMXCCGn1
    SolutionIndex: 59
    SolutionNameMin: Cijk_Ailk_Bjlk_B8NHS_BH_Bias_HAS_SAV_UserArgs_MT64x32x64_MI16x16x1_SN_LDSB0_CLR1_GRVWA4_GRVWB4_GSU0_GSUC0_GSUWGMRR0_K1_LBSPPA512_LBSPPB256_LPA32_LPB16_MIWT2_1_PLR1_SU0_SUM0_SUS64_VWA2_VWB1_WGM1_WGMXCC1_WGMXCCGn1
    SolutionIndex: 60
    SolutionNameMin: Cijk_Ailk_Bjlk_B8NHS_BH_Bias_HAS_SAV_UserArgs_MT64x32x64_MI16x16x1_SN_LDSB0_CLR1_GRVWA8_GRVWB4_GSU0_GSUC0_GSUWGMRR0_K1_LBSPPA512_LBSPPB256_LPA32_LPB16_MIWT2_1_PLR1_SU0_SUM0_SUS64_VWA2_VWB1_WGM1_WGMXCC1_WGMXCCGn1
    SolutionIndex: 61
    SolutionNameMin: Cijk_Ailk_Bjlk_B8NHS_BH_Bias_HAS_SAV_UserArgs_MT64x32x64_MI16x16x1_SN_LDSB0_CLR1_GRVWA4_GRVWB8_GSU0_GSUC0_GSUWGMRR0_K1_LBSPPA512_LBSPPB256_LPA32_LPB16_MIWT2_1_PLR1_SU0_SUM0_SUS64_VWA2_VWB1_WGM1_WGMXCC1_WGMXCCGn1
    SolutionIndex: 62
    SolutionNameMin: Cijk_Ailk_Bjlk_B8NHS_BH_Bias_HAS_SAV_UserArgs_MT64x32x64_MI16x16x1_SN_LDSB0_CLR1_GRVWA16_GRVWB8_GSU0_GSUC0_GSUWGMRR0_K1_LBSPPA512_LBSPPB256_LPA32_LPB16_MIWT2_1_PLR1_SU0_SUM0_SUS64_VWA2_VWB1_WGM1_WGMXCC1_WGMXCCGn1
    SolutionIndex: 63
    SolutionNameMin: Cijk_Ailk_Bjlk_B8NHS_BH_Bias_HAS_SAV_UserArgs_MT32x32x64_MI16x16x1_SN_LDSB0_CLR1_GRVWA4_GRVWB4_GSU0_GSUC0_GSUWGMRR0_K1_LBSPPA256_LBSPPB256_LPA16_LPB16_MIWT1_1_PLR1_SU0_SUM0_SUS64_VWA1_VWB1_WGM1_WGMXCC1_WGMXCCGn1
    SolutionIndex: 64
    SolutionNameMin: Cijk_Ailk_Bjlk_B8NHS_BH_Bias_HAS_SAV_UserArgs_MT32x32x64_MI16x16x1_SN_LDSB0_CLR1_GRVWA8_GRVWB4_GSU0_GSUC0_GSUWGMRR0_K1_LBSPPA256_LBSPPB256_LPA16_LPB16_MIWT1_1_PLR1_SU0_SUM0_SUS64_VWA1_VWB1_WGM1_WGMXCC1_WGMXCCGn1
    SolutionIndex: 65
    SolutionNameMin: Cijk_Ailk_Bjlk_B8NHS_BH_Bias_HAS_SAV_UserArgs_MT32x32x64_MI16x16x1_SN_LDSB0_CLR1_GRVWA4_GRVWB8_GSU0_GSUC0_GSUWGMRR0_K1_LBSPPA256_LBSPPB256_LPA16_LPB16_MIWT1_1_PLR1_SU0_SUM0_SUS64_VWA1_VWB1_WGM1_WGMXCC1_WGMXCCGn1
    SolutionIndex: 66
    SolutionNameMin: Cijk_Ailk_Bjlk_B8NHS_BH_Bias_HAS_SAV_UserArgs_MT32x32x64_MI16x16x1_SN_LDSB0_CLR1_GRVWA8_GRVWB8_GSU0_GSUC0_GSUWGMRR0_K1_LBSPPA256_LBSPPB256_LPA16_LPB16_MIWT1_1_PLR1_SU0_SUM0_SUS64_VWA1_VWB1_WGM1_WGMXCC1_WGMXCCGn1
    SolutionIndex: 67
    SolutionNameMin: Cijk_Ailk_Bjlk_B8NHS_BH_Bias_HAS_SAV_UserArgs_MT256x256x128_MI16x16x1_SN_LDSB1_CLR1_GRVWA16_GRVWB8_GSU0_GSUC0_GSUWGMRR0_K1_LBSPPA2048_LBSPPB2048_LPA0_LPB0_MIWT8_8_PLR1_SU0_SUM0_SUS128_VWA8_VWB8_WGM4_WGMXCC1_WGMXCCGn1
    SolutionIndex: 68
    SolutionNameMin: Cijk_Ailk_Bjlk_B8NHS_BH_Bias_HAS_SAV_UserArgs_MT256x256x128_MI16x16x1_SN_LDSB1_CLR1_GRVWA8_GRVWB16_GSU0_GSUC0_GSUWGMRR0_K1_LBSPPA2048_LBSPPB2048_LPA0_LPB0_MIWT8_8_PLR1_SU0_SUM0_SUS128_VWA8_VWB8_WGM4_WGMXCC1_WGMXCCGn1
    SolutionIndex: 69
    SolutionNameMin: Cijk_Ailk_Bjlk_B8NHS_BH_Bias_HAS_SAV_UserArgs_MT256x256x128_MI16x16x1_SN_LDSB1_CLR1_GRVWA16_GRVWB16_GSU0_GSUC0_GSUWGMRR0_K1_LBSPPA2048_LBSPPB2048_LPA0_LPB0_MIWT8_8_PLR1_SU0_SUM0_SUS128_VWA8_VWB8_WGM4_WGMXCC1_WGMXCCGn1
    SolutionIndex: 70
    SolutionNameMin: Cijk_Ailk_Bjlk_B8NHS_BH_Bias_HAS_SAV_UserArgs_MT256x256x128_MI16x16x1_SN_LDSB1_CLR1_GRVWA8_GRVWB16_GSU0_GSUC0_GSUWGMRR0_K1_LBSPPA2048_LBSPPB2048_LPA0_LPB0_MIWT8_8_PLR1_SU0_SUM0_SUS128_VWA8_VWB8_WGM6_WGMXCC1_WGMXCCGn1
    SolutionIndex: 71
    SolutionNameMin: Cijk_Ailk_Bjlk_B8NHS_BH_Bias_HAS_SAV_UserArgs_MT256x256x128_MI16x16x1_SN_LDSB1_CLR1_GRVWA16_GRVWB16_GSU0_GSUC0_GSUWGMRR0_K1_LBSPPA2048_LBSPPB2048_LPA0_LPB0_MIWT8_8_PLR1_SU0_SUM0_SUS128_VWA8_VWB8_WGM6_WGMXCC1_WGMXCCGn1
    SolutionIndex: 72
    SolutionNameMin: Cijk_Ailk_Bjlk_B8NHS_BH_Bias_HAS_SAV_UserArgs_MT256x256x128_MI16x16x1_SN_LDSB1_CLR1_GRVWA8_GRVWB16_GSU0_GSUC0_GSUWGMRR0_K1_LBSPPA2048_LBSPPB2048_LPA0_LPB0_MIWT8_8_PLR1_SU0_SUM0_SUS128_VWA8_VWB8_WGM8_WGMXCC1_WGMXCCGn1
    SolutionIndex: 73
    SolutionNameMin: Cijk_Ailk_Bjlk_B8NHS_BH_Bias_HAS_SAV_UserArgs_MT256x256x128_MI16x16x1_SN_LDSB1_CLR1_GRVWA16_GRVWB16_GSU0_GSUC0_GSUWGMRR0_K1_LBSPPA2048_LBSPPB2048_LPA0_LPB0_MIWT8_8_PLR1_SU0_SUM0_SUS128_VWA8_VWB8_WGM8_WGMXCC1_WGMXCCGn1
    SolutionIndex: 74
    SolutionNameMin: Cijk_Ailk_Bjlk_B8NHS_BH_Bias_HAS_SAV_UserArgs_MT128x256x128_MI16x16x1_SN_LDSB1_CLR1_GRVWA4_GRVWB16_GSU0_GSUC0_GSUWGMRR0_K1_LBSPPA1024_LBSPPB2048_LPA64_LPB0_MIWT4_8_PLR1_SU0_SUM0_SUS128_VWA4_VWB8_WGM1_WGMXCC1_WGMXCCGn1
    SolutionIndex: 75
    SolutionNameMin: Cijk_Ailk_Bjlk_B8NHS_BH_Bias_HAS_SAV_UserArgs_MT128x256x128_MI16x16x1_SN_LDSB1_CLR1_GRVWA8_GRVWB16_GSU0_GSUC0_GSUWGMRR0_K1_LBSPPA1024_LBSPPB2048_LPA64_LPB0_MIWT4_8_PLR1_SU0_SUM0_SUS128_VWA4_VWB8_WGM1_WGMXCC1_WGMXCCGn1
    SolutionIndex: 76
    SolutionNameMin: Cijk_Ailk_Bjlk_B8NHS_BH_Bias_HAS_SAV_UserArgs_MT128x256x128_MI16x16x1_SN_LDSB1_CLR1_GRVWA16_GRVWB16_GSU0_GSUC0_GSUWGMRR0_K1_LBSPPA1024_LBSPPB2048_LPA64_LPB0_MIWT4_8_PLR1_SU0_SUM0_SUS128_VWA4_VWB8_WGM4_WGMXCC1_WGMXCCGn1
    SolutionIndex: 77
    SolutionNameMin: Cijk_Ailk_Bjlk_B8NHS_BH_Bias_HAS_SAV_UserArgs_MT128x256x128_MI16x16x1_SN_LDSB1_CLR1_GRVWA8_GRVWB16_GSU0_GSUC0_GSUWGMRR0_K1_LBSPPA1024_LBSPPB2048_LPA64_LPB0_MIWT4_8_PLR1_SU0_SUM0_SUS128_VWA4_VWB8_WGM6_WGMXCC1_WGMXCCGn1
    SolutionIndex: 78
    SolutionNameMin: Cijk_Ailk_Bjlk_B8NHS_BH_Bias_HAS_SAV_UserArgs_MT128x256x128_MI16x16x1_SN_LDSB1_CLR1_GRVWA16_GRVWB16_GSU0_GSUC0_GSUWGMRR0_K1_LBSPPA1024_LBSPPB2048_LPA64_LPB0_MIWT4_8_PLR1_SU0_SUM0_SUS128_VWA4_VWB8_WGM6_WGMXCC1_WGMXCCGn1
    SolutionIndex: 79
    SolutionNameMin: Cijk_Ailk_Bjlk_B8NHS_BH_Bias_HAS_SAV_UserArgs_MT128x256x128_MI16x16x1_SN_LDSB1_CLR1_GRVWA8_GRVWB16_GSU0_GSUC0_GSUWGMRR0_K1_LBSPPA1024_LBSPPB2048_LPA64_LPB0_MIWT4_8_PLR1_SU0_SUM0_SUS128_VWA4_VWB8_WGM8_WGMXCC1_WGMXCCGn1
    SolutionIndex: 80
    SolutionNameMin: Cijk_Ailk_Bjlk_B8NHS_BH_Bias_HAS_SAV_UserArgs_MT128x256x128_MI16x16x1_SN_LDSB1_CLR1_GRVWA16_GRVWB16_GSU0_GSUC0_GSUWGMRR0_K1_LBSPPA1024_LBSPPB2048_LPA64_LPB0_MIWT4_8_PLR1_SU0_SUM0_SUS128_VWA4_VWB8_WGM8_WGMXCC1_WGMXCCGn1
    SolutionIndex: 81
    SolutionNameMin: Cijk_Ailk_Bjlk_B8NHS_BH_Bias_HAS_SAV_UserArgs_MT256x128x128_MI16x16x1_SN_LDSB1_CLR1_GRVWA16_GRVWB8_GSU0_GSUC0_GSUWGMRR0_K1_LBSPPA2048_LBSPPB1024_LPA0_LPB64_MIWT8_4_PLR1_SU0_SUM0_SUS128_VWA8_VWB4_WGM1_WGMXCC1_WGMXCCGn1
    SolutionIndex: 82
    SolutionNameMin: Cijk_Ailk_Bjlk_B8NHS_BH_Bias_HAS_SAV_UserArgs_MT256x128x128_MI16x16x1_SN_LDSB1_CLR1_GRVWA16_GRVWB8_GSU0_GSUC0_GSUWGMRR0_K1_LBSPPA2048_LBSPPB1024_LPA0_LPB64_MIWT8_4_PLR1_SU0_SUM0_SUS128_VWA8_VWB4_WGM4_WGMXCC1_WGMXCCGn1
    SolutionIndex: 83
    SolutionNameMin: Cijk_Ailk_Bjlk_B8NHS_BH_Bias_HAS_SAV_UserArgs_MT128x128x128_MI16x16x1_SN_LDSB1_CLR1_GRVWA16_GRVWB16_GSU0_GSUC0_GSUWGMRR0_K1_LBSPPA1024_LBSPPB1024_LPA64_LPB64_MIWT4_4_PLR1_SU0_SUM0_SUS128_VWA4_VWB4_WGM1_WGMXCC1_WGMXCCGn1
    SolutionIndex: 84
    SolutionNameMin: Cijk_Ailk_Bjlk_B8NHS_BH_Bias_HAS_SAV_UserArgs_MT128x128x128_MI16x16x1_SN_LDSB1_CLR1_GRVWA16_GRVWB16_GSU0_GSUC0_GSUWGMRR0_K1_LBSPPA1024_LBSPPB1024_LPA64_LPB64_MIWT4_4_PLR1_SU0_SUM0_SUS128_VWA4_VWB4_WGM6_WGMXCC1_WGMXCCGn1
    SolutionIndex: 85
    SolutionNameMin: Cijk_Ailk_Bjlk_B8NHS_BH_Bias_HAS_SAV_UserArgs_MT128x64x128_MI16x16x1_SN_LDSB1_CLR1_GRVWA16_GRVWB16_GSU0_GSUC0_GSUWGMRR0_K1_LBSPPA1024_LBSPPB512_LPA64_LPB32_MIWT4_2_PLR1_SU0_SUM0_SUS128_VWA4_VWB2_WGM1_WGMXCC1_WGMXCCGn1
    SolutionIndex: 86
    SolutionNameMin: Cijk_Ailk_Bjlk_B8NHS_BH_Bias_HAS_SAV_UserArgs_MT128x64x128_MI16x16x1_SN_LDSB1_CLR1_GRVWA16_GRVWB16_GSU0_GSUC0_GSUWGMRR0_K1_LBSPPA1024_LBSPPB512_LPA64_LPB32_MIWT4_2_PLR1_SU0_SUM0_SUS128_VWA4_VWB2_WGM4_WGMXCC1_WGMXCCGn1
    SolutionIndex: 87
    SolutionNameMin: Cijk_Ailk_Bjlk_B8NHS_BH_Bias_HAS_SAV_UserArgs_MT128x64x128_MI16x16x1_SN_LDSB1_CLR1_GRVWA16_GRVWB16_GSU0_GSUC0_GSUWGMRR0_K1_LBSPPA1024_LBSPPB512_LPA64_LPB32_MIWT4_2_PLR1_SU0_SUM0_SUS128_VWA4_VWB2_WGM6_WGMXCC1_WGMXCCGn1
    SolutionIndex: 88
    SolutionNameMin: Cijk_Ailk_Bjlk_B8NHS_BH_Bias_HAS_SAV_UserArgs_MT128x64x128_MI16x16x1_SN_LDSB1_CLR1_GRVWA16_GRVWB16_GSU0_GSUC0_GSUWGMRR0_K1_LBSPPA1024_LBSPPB512_LPA64_LPB32_MIWT4_2_PLR1_SU0_SUM0_SUS128_VWA4_VWB2_WGM8_WGMXCC1_WGMXCCGn1
    SolutionIndex: 89
    SolutionNameMin: Cijk_Ailk_Bjlk_B8NHS_BH_Bias_HAS_SAV_UserArgs_MT64x64x128_MI16x16x1_SN_LDSB1_CLR1_GRVWA4_GRVWB4_GSU0_GSUC0_GSUWGMRR0_K1_LBSPPA512_LBSPPB512_LPA32_LPB32_MIWT2_2_PLR1_SU0_SUM0_SUS128_VWA2_VWB2_WGM1_WGMXCC1_WGMXCCGn1
    SolutionIndex: 90
    SolutionNameMin: Cijk_Ailk_Bjlk_B8NHS_BH_Bias_HAS_SAV_UserArgs_MT64x64x128_MI16x16x1_SN_LDSB1_CLR1_GRVWA4_GRVWB16_GSU0_GSUC0_GSUWGMRR0_K1_LBSPPA512_LBSPPB512_LPA32_LPB32_MIWT2_2_PLR1_SU0_SUM0_SUS128_VWA2_VWB2_WGM1_WGMXCC1_WGMXCCGn1
    SolutionIndex: 91
    SolutionNameMin: Cijk_Ailk_Bjlk_B8NHS_BH_Bias_HAS_SAV_UserArgs_MT64x64x128_MI16x16x1_SN_LDSB1_CLR1_GRVWA8_GRVWB16_GSU0_GSUC0_GSUWGMRR0_K1_LBSPPA512_LBSPPB512_LPA32_LPB32_MIWT2_2_PLR1_SU0_SUM0_SUS128_VWA2_VWB2_WGM1_WGMXCC1_WGMXCCGn1
    SolutionIndex: 92
    SolutionNameMin: Cijk_Ailk_Bjlk_B8NHS_BH_Bias_HAS_SAV_UserArgs_MT64x64x128_MI16x16x1_SN_LDSB1_CLR1_GRVWA16_GRVWB16_GSU0_GSUC0_GSUWGMRR0_K1_LBSPPA512_LBSPPB512_LPA32_LPB32_MIWT2_2_PLR1_SU0_SUM0_SUS128_VWA2_VWB2_WGM1_WGMXCC1_WGMXCCGn1
    SolutionIndex: 93
    SolutionNameMin: Cijk_Ailk_Bjlk_B8NHS_BH_Bias_HAS_SAV_UserArgs_MT64x64x128_MI16x16x1_SN_LDSB1_CLR1_GRVWA8_GRVWB16_GSU0_GSUC0_GSUWGMRR0_K1_LBSPPA512_LBSPPB512_LPA32_LPB32_MIWT2_2_PLR1_SU0_SUM0_SUS128_VWA2_VWB2_WGM4_WGMXCC1_WGMXCCGn1
    SolutionIndex: 94
    SolutionNameMin: Cijk_Ailk_Bjlk_B8NHS_BH_Bias_HAS_SAV_UserArgs_MT64x64x128_MI16x16x1_SN_LDSB1_CLR1_GRVWA16_GRVWB16_GSU0_GSUC0_GSUWGMRR0_K1_LBSPPA512_LBSPPB512_LPA32_LPB32_MIWT2_2_PLR1_SU0_SUM0_SUS128_VWA2_VWB2_WGM4_WGMXCC1_WGMXCCGn1
    SolutionIndex: 95
    SolutionNameMin: Cijk_Ailk_Bjlk_B8NHS_BH_Bias_HAS_SAV_UserArgs_MT64x64x128_MI16x16x1_SN_LDSB1_CLR1_GRVWA4_GRVWB16_GSU0_GSUC0_GSUWGMRR0_K1_LBSPPA512_LBSPPB512_LPA32_LPB32_MIWT2_2_PLR1_SU0_SUM0_SUS128_VWA2_VWB2_WGM6_WGMXCC1_WGMXCCGn1
    SolutionIndex: 96
    SolutionNameMin: Cijk_Ailk_Bjlk_B8NHS_BH_Bias_HAS_SAV_UserArgs_MT64x64x128_MI16x16x1_SN_LDSB1_CLR1_GRVWA8_GRVWB16_GSU0_GSUC0_GSUWGMRR0_K1_LBSPPA512_LBSPPB512_LPA32_LPB32_MIWT2_2_PLR1_SU0_SUM0_SUS128_VWA2_VWB2_WGM6_WGMXCC1_WGMXCCGn1
    SolutionIndex: 97
    SolutionNameMin: Cijk_Ailk_Bjlk_B8NHS_BH_Bias_HAS_SAV_UserArgs_MT64x64x128_MI16x16x1_SN_LDSB1_CLR1_GRVWA16_GRVWB16_GSU0_GSUC0_GSUWGMRR0_K1_LBSPPA512_LBSPPB512_LPA32_LPB32_MIWT2_2_PLR1_SU0_SUM0_SUS128_VWA2_VWB2_WGM6_WGMXCC1_WGMXCCGn1
    SolutionIndex: 98
    SolutionNameMin: Cijk_Ailk_Bjlk_B8NHS_BH_Bias_HAS_SAV_UserArgs_MT64x64x128_MI16x16x1_SN_LDSB1_CLR1_GRVWA16_GRVWB8_GSU0_GSUC0_GSUWGMRR0_K1_LBSPPA512_LBSPPB512_LPA32_LPB32_MIWT2_2_PLR1_SU0_SUM0_SUS128_VWA2_VWB2_WGM8_WGMXCC1_WGMXCCGn1
    SolutionIndex: 99
    SolutionNameMin: Cijk_Ailk_Bjlk_B8NHS_BH_Bias_HAS_SAV_UserArgs_MT64x64x128_MI16x16x1_SN_LDSB1_CLR1_GRVWA4_GRVWB16_GSU0_GSUC0_GSUWGMRR0_K1_LBSPPA512_LBSPPB512_LPA32_LPB32_MIWT2_2_PLR1_SU0_SUM0_SUS128_VWA2_VWB2_WGM8_WGMXCC1_WGMXCCGn1
    SolutionIndex: 100
    SolutionNameMin: Cijk_Ailk_Bjlk_B8NHS_BH_Bias_HAS_SAV_UserArgs_MT64x64x128_MI16x16x1_SN_LDSB1_CLR1_GRVWA16_GRVWB16_GSU0_GSUC0_GSUWGMRR0_K1_LBSPPA512_LBSPPB512_LPA32_LPB32_MIWT2_2_PLR1_SU0_SUM0_SUS128_VWA2_VWB2_WGM8_WGMXCC1_WGMXCCGn1
    SolutionIndex: 101
    SolutionNameMin: Cijk_Ailk_Bjlk_B8NHS_BH_Bias_HAS_SAV_UserArgs_MT32x64x128_MI16x16x1_SN_LDSB0_CLR1_GRVWA4_GRVWB8_GSU0_GSUC0_GSUWGMRR0_K1_LBSPPA256_LBSPPB512_LPA16_LPB32_MIWT1_2_PLR1_SU0_SUM0_SUS128_VWA1_VWB2_WGM1_WGMXCC1_WGMXCCGn1
    SolutionIndex: 102
    SolutionNameMin: Cijk_Ailk_Bjlk_B8NHS_BH_Bias_HAS_SAV_UserArgs_MT32x64x128_MI16x16x1_SN_LDSB0_CLR1_GRVWA16_GRVWB16_GSU0_GSUC0_GSUWGMRR0_K1_LBSPPA256_LBSPPB512_LPA16_LPB32_MIWT1_2_PLR1_SU0_SUM0_SUS128_VWA1_VWB2_WGM4_WGMXCC1_WGMXCCGn1
    SolutionIndex: 103
    SolutionNameMin: Cijk_Ailk_Bjlk_B8NHS_BH_Bias_HAS_SAV_UserArgs_MT32x64x128_MI16x16x1_SN_LDSB0_CLR1_GRVWA16_GRVWB16_GSU0_GSUC0_GSUWGMRR0_K1_LBSPPA256_LBSPPB512_LPA16_LPB32_MIWT1_2_PLR1_SU0_SUM0_SUS128_VWA1_VWB2_WGM6_WGMXCC1_WGMXCCGn1
    SolutionIndex: 104
    SolutionNameMin: Cijk_Ailk_Bjlk_B8NHS_BH_Bias_HAS_SAV_UserArgs_MT32x64x128_MI16x16x1_SN_LDSB0_CLR1_GRVWA16_GRVWB16_GSU0_GSUC0_GSUWGMRR0_K1_LBSPPA256_LBSPPB512_LPA16_LPB32_MIWT1_2_PLR1_SU0_SUM0_SUS128_VWA1_VWB2_WGM8_WGMXCC1_WGMXCCGn1
    SolutionIndex: 105
    SolutionNameMin: Cijk_Ailk_Bjlk_B8NHS_BH_Bias_HAS_SAV_UserArgs_MT64x32x128_MI16x16x1_SN_LDSB0_CLR1_GRVWA4_GRVWB4_GSU0_GSUC0_GSUWGMRR0_K1_LBSPPA512_LBSPPB256_LPA32_LPB16_MIWT2_1_PLR1_SU0_SUM0_SUS128_VWA2_VWB1_WGM1_WGMXCC1_WGMXCCGn1
    SolutionIndex: 106
    SolutionNameMin: Cijk_Ailk_Bjlk_B8NHS_BH_Bias_HAS_SAV_UserArgs_MT64x32x128_MI16x16x1_SN_LDSB0_CLR1_GRVWA4_GRVWB8_GSU0_GSUC0_GSUWGMRR0_K1_LBSPPA512_LBSPPB256_LPA32_LPB16_MIWT2_1_PLR1_SU0_SUM0_SUS128_VWA2_VWB1_WGM1_WGMXCC1_WGMXCCGn1
    SolutionIndex: 107
    SolutionNameMin: Cijk_Ailk_Bjlk_B8NHS_BH_Bias_HAS_SAV_UserArgs_MT64x32x128_MI16x16x1_SN_LDSB0_CLR1_GRVWA8_GRVWB8_GSU0_GSUC0_GSUWGMRR0_K1_LBSPPA512_LBSPPB256_LPA32_LPB16_MIWT2_1_PLR1_SU0_SUM0_SUS128_VWA2_VWB1_WGM1_WGMXCC1_WGMXCCGn1
    SolutionIndex: 108
    SolutionNameMin: Cijk_Ailk_Bjlk_B8NHS_BH_Bias_HAS_SAV_UserArgs_MT64x32x128_MI16x16x1_SN_LDSB0_CLR1_GRVWA8_GRVWB16_GSU0_GSUC0_GSUWGMRR0_K1_LBSPPA512_LBSPPB256_LPA32_LPB16_MIWT2_1_PLR1_SU0_SUM0_SUS128_VWA2_VWB1_WGM1_WGMXCC1_WGMXCCGn1
    SolutionIndex: 109
    SolutionNameMin: Cijk_Ailk_Bjlk_B8NHS_BH_Bias_HAS_SAV_UserArgs_MT64x32x128_MI16x16x1_SN_LDSB0_CLR1_GRVWA16_GRVWB16_GSU0_GSUC0_GSUWGMRR0_K1_LBSPPA512_LBSPPB256_LPA32_LPB16_MIWT2_1_PLR1_SU0_SUM0_SUS128_VWA2_VWB1_WGM1_WGMXCC1_WGMXCCGn1
    SolutionIndex: 110
    SolutionNameMin: Cijk_Ailk_Bjlk_B8NHS_BH_Bias_HAS_SAV_UserArgs_MT32x32x128_MI16x16x1_SN_LDSB0_CLR1_GRVWA4_GRVWB4_GSU0_GSUC0_GSUWGMRR0_K1_LBSPPA256_LBSPPB256_LPA16_LPB16_MIWT1_1_PLR1_SU0_SUM0_SUS128_VWA1_VWB1_WGM1_WGMXCC1_WGMXCCGn1
    SolutionIndex: 111
    SolutionNameMin: Cijk_Ailk_Bjlk_B8NHS_BH_Bias_HAS_SAV_UserArgs_MT32x32x128_MI16x16x1_SN_LDSB0_CLR1_GRVWA8_GRVWB4_GSU0_GSUC0_GSUWGMRR0_K1_LBSPPA256_LBSPPB256_LPA16_LPB16_MIWT1_1_PLR1_SU0_SUM0_SUS128_VWA1_VWB1_WGM1_WGMXCC1_WGMXCCGn1
    SolutionIndex: 112
    SolutionNameMin: Cijk_Ailk_Bjlk_B8NHS_BH_Bias_HAS_SAV_UserArgs_MT32x32x128_MI16x16x1_SN_LDSB0_CLR1_GRVWA16_GRVWB4_GSU0_GSUC0_GSUWGMRR0_K1_LBSPPA256_LBSPPB256_LPA16_LPB16_MIWT1_1_PLR1_SU0_SUM0_SUS128_VWA1_VWB1_WGM1_WGMXCC1_WGMXCCGn1
    SolutionIndex: 113
    SolutionNameMin: Cijk_Ailk_Bjlk_B8NHS_BH_Bias_HAS_SAV_UserArgs_MT32x32x128_MI16x16x1_SN_LDSB0_CLR1_GRVWA4_GRVWB8_GSU0_GSUC0_GSUWGMRR0_K1_LBSPPA256_LBSPPB256_LPA16_LPB16_MIWT1_1_PLR1_SU0_SUM0_SUS128_VWA1_VWB1_WGM1_WGMXCC1_WGMXCCGn1
    SolutionIndex: 114
    SolutionNameMin: Cijk_Ailk_Bjlk_B8NHS_BH_Bias_HAS_SAV_UserArgs_MT32x32x128_MI16x16x1_SN_LDSB0_CLR1_GRVWA8_GRVWB8_GSU0_GSUC0_GSUWGMRR0_K1_LBSPPA256_LBSPPB256_LPA16_LPB16_MIWT1_1_PLR1_SU0_SUM0_SUS128_VWA1_VWB1_WGM1_WGMXCC1_WGMXCCGn1
    SolutionIndex: 115
    SolutionNameMin: Cijk_Ailk_Bjlk_B8NHS_BH_Bias_HAS_SAV_UserArgs_MT32x32x128_MI16x16x1_SN_LDSB0_CLR1_GRVWA4_GRVWB16_GSU0_GSUC0_GSUWGMRR0_K1_LBSPPA256_LBSPPB256_LPA16_LPB16_MIWT1_1_PLR1_SU0_SUM0_SUS128_VWA1_VWB1_WGM1_WGMXCC1_WGMXCCGn1
    SolutionIndex: 116
    SolutionNameMin: Cijk_Ailk_Bjlk_B8NHS_BH_Bias_HAS_SAV_UserArgs_MT32x32x128_MI16x16x1_SN_LDSB0_CLR1_GRVWA8_GRVWB16_GSU0_GSUC0_GSUWGMRR0_K1_LBSPPA256_LBSPPB256_LPA16_LPB16_MIWT1_1_PLR1_SU0_SUM0_SUS128_VWA1_VWB1_WGM1_WGMXCC1_WGMXCCGn1
    SolutionIndex: 117
    SolutionNameMin: Cijk_Ailk_Bjlk_B8NHS_BH_Bias_HAS_SAV_UserArgs_MT128x64x256_MI16x16x1_SN_LDSB1_CLR1_GRVWA16_GRVWB16_GSU0_GSUC0_GSUWGMRR0_K1_LBSPPA1024_LBSPPB512_LPA64_LPB32_MIWT4_2_PLR1_SU0_SUM0_SUS256_VWA4_VWB2_WGM1_WGMXCC1_WGMXCCGn1
    SolutionIndex: 118
    SolutionNameMin: Cijk_Ailk_Bjlk_B8NHS_BH_Bias_HAS_SAV_UserArgs_MT64x64x256_MI16x16x1_SN_LDSB1_CLR1_GRVWA16_GRVWB16_GSU0_GSUC0_GSUWGMRR0_K1_LBSPPA512_LBSPPB512_LPA32_LPB32_MIWT2_2_PLR1_SU0_SUM0_SUS256_VWA2_VWB2_WGM1_WGMXCC1_WGMXCCGn1
    SolutionIndex: 119
    SolutionNameMin: Cijk_Ailk_Bjlk_B8NHS_BH_Bias_HAS_SAV_UserArgs_MT64x64x256_MI16x16x1_SN_LDSB1_CLR1_GRVWA16_GRVWB16_GSU0_GSUC0_GSUWGMRR0_K1_LBSPPA512_LBSPPB512_LPA32_LPB32_MIWT2_2_PLR1_SU0_SUM0_SUS256_VWA2_VWB2_WGM8_WGMXCC1_WGMXCCGn1
    SolutionIndex: 120
    SolutionNameMin: Cijk_Ailk_Bjlk_B8NHS_BH_Bias_HAS_SAV_UserArgs_MT64x32x256_MI16x16x1_SN_LDSB1_CLR1_GRVWA16_GRVWB16_GSU0_GSUC0_GSUWGMRR0_K1_LBSPPA512_LBSPPB256_LPA32_LPB16_MIWT2_1_PLR1_SU0_SUM0_SUS256_VWA2_VWB1_WGM1_WGMXCC1_WGMXCCGn1
    SolutionIndex: 121
    SolutionNameMin: Cijk_Ailk_Bjlk_B8NHS_BH_Bias_HAS_SAV_UserArgs_MT64x32x256_MI16x16x1_SN_LDSB1_CLR1_GRVWA16_GRVWB16_GSU0_GSUC0_GSUWGMRR0_K1_LBSPPA512_LBSPPB256_LPA32_LPB16_MIWT2_1_PLR1_SU0_SUM0_SUS256_VWA2_VWB1_WGM4_WGMXCC1_WGMXCCGn1
    SolutionIndex: 122
    SolutionNameMin: Cijk_Ailk_Bjlk_B8NHS_BH_Bias_HAS_SAV_UserArgs_MT64x32x256_MI16x16x1_SN_LDSB1_CLR1_GRVWA16_GRVWB16_GSU0_GSUC0_GSUWGMRR0_K1_LBSPPA512_LBSPPB256_LPA32_LPB16_MIWT2_1_PLR1_SU0_SUM0_SUS256_VWA2_VWB1_WGM6_WGMXCC1_WGMXCCGn1
    SolutionIndex: 123
    SolutionNameMin: Cijk_Ailk_Bjlk_B8NHS_BH_Bias_HAS_SAV_UserArgs_MT32x32x256_MI16x16x1_SN_LDSB1_CLR1_GRVWA16_GRVWB16_GSU0_GSUC0_GSUWGMRR0_K1_LBSPPA256_LBSPPB256_LPA16_LPB16_MIWT1_1_PLR1_SU0_SUM0_SUS256_VWA1_VWB1_WGM1_WGMXCC1_WGMXCCGn1
    SolutionIndex: 124
    SolutionNameMin: Cijk_Ailk_Bjlk_B8NHS_BH_Bias_HAS_SAV_UserArgs_MT32x32x256_MI16x16x1_SN_LDSB1_CLR1_GRVWA16_GRVWB16_GSU0_GSUC0_GSUWGMRR0_K1_LBSPPA256_LBSPPB256_LPA16_LPB16_MIWT1_1_PLR1_SU0_SUM0_SUS256_VWA1_VWB1_WGM4_WGMXCC1_WGMXCCGn1
    SolutionIndex: 125
    SolutionNameMin: Cijk_Ailk_Bjlk_B8NHS_BH_Bias_HAS_SAV_UserArgs_MT32x32x256_MI16x16x1_SN_LDSB1_CLR1_GRVWA8_GRVWB16_GSU0_GSUC0_GSUWGMRR0_K1_LBSPPA256_LBSPPB256_LPA16_LPB16_MIWT1_1_PLR1_SU0_SUM0_SUS256_VWA1_VWB1_WGM6_WGMXCC1_WGMXCCGn1
    SolutionIndex: 126
    SolutionNameMin: Cijk_Ailk_Bjlk_B8NHS_BH_Bias_HAS_SAV_UserArgs_MT32x32x256_MI16x16x1_SN_LDSB1_CLR1_GRVWA16_GRVWB16_GSU0_GSUC0_GSUWGMRR0_K1_LBSPPA256_LBSPPB256_LPA16_LPB16_MIWT1_1_PLR1_SU0_SUM0_SUS256_VWA1_VWB1_WGM8_WGMXCC1_WGMXCCGn1
- - - [128, 128, 1, 128, 128, 128, 128, 128]
    - [65, 0.51]
  - - [128, 128, 1, 256, 128, 128, 128, 128]
    - [66, 0.89]
  - - [128, 128, 1, 512, 128, 128, 128, 128]
    - [113, 1.49]
  - - [128, 128, 1, 1024, 128, 128, 128, 128]
    - [114, 2.21]
  - - [128, 128, 1, 2048, 128, 128, 128, 128]
    - [116, 2.94]
  - - [128, 128, 1, 4096, 128, 128, 128, 128]
    - [116, 3.53]
  - - [128, 128, 1, 8192, 128, 128, 128, 128]
    - [123, 3.93]
  - - [128, 256, 1, 128, 128, 128, 128, 256]
    - [111, 1.04]
  - - [128, 256, 1, 256, 128, 128, 128, 256]
    - [65, 1.83]
  - - [128, 256, 1, 512, 128, 128, 128, 256]
    - [114, 3.02]
  - - [128, 256, 1, 1024, 128, 128, 128, 256]
    - [115, 4.46]
  - - [128, 256, 1, 2048, 128, 128, 128, 256]
    - [116, 5.93]
  - - [128, 256, 1, 4096, 128, 128, 128, 256]
    - [123, 7.07]
  - - [128, 256, 1, 8192, 128, 128, 128, 256]
    - [123, 7.9]
  - - [128, 512, 1, 128, 128, 128, 128, 512]
    - [64, 2.08]
  - - [128, 512, 1, 256, 128, 128, 128, 512]
    - [65, 3.62]
  - - [128, 512, 1, 512, 128, 128, 128, 512]
    - [110, 5.87]
  - - [128, 512, 1, 1024, 128, 128, 128, 512]
    - [116, 8.73]
  - - [128, 512, 1, 2048, 128, 128, 128, 512]
    - [116, 11.68]
  - - [128, 512, 1, 4096, 128, 128, 128, 512]
    - [123, 14.01]
  - - [128, 512, 1, 8192, 128, 128, 128, 512]
    - [123, 15.2]
  - - [128, 1024, 1, 128, 128, 128, 128, 1024]
    - [63, 4.08]
  - - [128, 1024, 1, 256, 128, 128, 128, 1024]
    - [63, 7.09]
  - - [128, 1024, 1, 512, 128, 128, 128, 1024]
    - [112, 11.46]
  - - [128, 1024, 1, 1024, 128, 128, 128, 1024]
    - [114, 17.19]
  - - [128, 1024, 1, 2048, 128, 128, 128, 1024]
    - [116, 22.83]
  - - [128, 1024, 1, 4096, 128, 128, 128, 1024]
    - [123, 25.82]
  - - [128, 1024, 1, 8192, 128, 128, 128, 1024]
    - [125, 27.72]
  - - [128, 2048, 1, 128, 128, 128, 128, 2048]
    - [59, 7.77]
  - - [128, 2048, 1, 256, 128, 128, 128, 2048]
    - [59, 13.15]
  - - [128, 2048, 1, 512, 128, 128, 128, 2048]
    - [106, 21.29]
  - - [128, 2048, 1, 1024, 128, 128, 128, 2048]
    - [101, 31.06]
  - - [128, 2048, 1, 2048, 128, 128, 128, 2048]
    - [120, 39.14]
  - - [128, 2048, 1, 4096, 128, 128, 128, 2048]
    - [122, 47.14]
  - - [128, 2048, 1, 8192, 128, 128, 128, 2048]
    - [122, 53.37]
  - - [128, 4096, 1, 128, 128, 128, 128, 4096]
    - [55, 14.08]
  - - [128, 4096, 1, 256, 128, 128, 128, 4096]
    - [55, 24.18]
  - - [128, 4096, 1, 512, 128, 128, 128, 4096]
    - [89, 37.78]
  - - [128, 4096, 1, 1024, 128, 128, 128, 4096]
    - [92, 54.05]
  - - [128, 4096, 1, 2048, 128, 128, 128, 4096]
    - [91, 67.48]
  - - [128, 4096, 1, 4096, 128, 128, 128, 4096]
    - [118, 82.37]
  - - [128, 4096, 1, 8192, 128, 128, 128, 4096]
    - [119, 91.5]
  - - [128, 8192, 1, 128, 128, 128, 128, 8192]
    - [51, 23.82]
  - - [128, 8192, 1, 256, 128, 128, 128, 8192]
    - [51, 40.91]
  - - [128, 8192, 1, 512, 128, 128, 128, 8192]
    - [46, 63.08]
  - - [128, 8192, 1, 1024, 128, 128, 128, 8192]
    - [50, 88.33]
  - - [128, 8192, 1, 2048, 128, 128, 128, 8192]
    - [85, 107.15]
  - - [128, 8192, 1, 4096, 128, 128, 128, 8192]
    - [117, 125.26]
  - - [128, 8192, 1, 8192, 128, 128, 128, 8192]
    - [86, 128.73]
  - - [256, 128, 1, 128, 256, 256, 256, 128]
    - [65, 1.04]
  - - [256, 128, 1, 256, 256, 256, 256, 128]
    - [110, 1.82]
  - - [256, 128, 1, 512, 256, 256, 256, 128]
    - [114, 3.04]
  - - [256, 128, 1, 1024, 256, 256, 256, 128]
    - [116, 4.44]
  - - [256, 128, 1, 2048, 256, 256, 256, 128]
    - [116, 5.93]
  - - [256, 128, 1, 4096, 256, 256, 256, 128]
    - [116, 7.07]
  - - [256, 128, 1, 8192, 256, 256, 256, 128]
    - [123, 7.89]
  - - [256, 256, 1, 128, 256, 256, 256, 256]
    - [63, 2.1]
  - - [256, 256, 1, 256, 256, 256, 256, 256]
    - [65, 3.63]
  - - [256, 256, 1, 512, 256, 256, 256, 256]
    - [113, 5.91]
  - - [256, 256, 1, 1024, 256, 256, 256, 256]
    - [116, 8.82]
  - - [256, 256, 1, 2048, 256, 256, 256, 256]
    - [116, 11.74]
  - - [256, 256, 1, 4096, 256, 256, 256, 256]
    - [116, 14.1]
  - - [256, 256, 1, 8192, 256, 256, 256, 256]
    - [116, 15.58]
  - - [256, 512, 1, 128, 256, 256, 256, 512]
    - [65, 3.76]
  - - [256, 512, 1, 256, 256, 256, 256, 512]
    - [63, 7.03]
  - - [256, 512, 1, 512, 256, 256, 256, 512]
    - [110, 11.56]
  - - [256, 512, 1, 1024, 256, 256, 256, 512]
    - [114, 17.07]
  - - [256, 512, 1, 2048, 256, 256, 256, 512]
    - [116, 22.78]
  - - [256, 512, 1, 4096, 256, 256, 256, 512]
    - [116, 27.22]
  - - [256, 512, 1, 8192, 256, 256, 256, 512]
    - [123, 30.08]
  - - [256, 1024, 1, 128, 256, 256, 256, 1024]
    - [59, 7.18]
  - - [256, 1024, 1, 256, 256, 256, 256, 1024]
    - [59, 13.31]
  - - [256, 1024, 1, 512, 256, 256, 256, 1024]
    - [106, 20.28]
  - - [256, 1024, 1, 1024, 256, 256, 256, 1024]
    - [108, 29.92]
  - - [256, 1024, 1, 2048, 256, 256, 256, 1024]
    - [120, 40.18]
  - - [256, 1024, 1, 4096, 256, 256, 256, 1024]
    - [120, 47.82]
  - - [256, 1024, 1, 8192, 256, 256, 256, 1024]
    - [122, 53.65]
  - - [256, 2048, 1, 128, 256, 256, 256, 2048]
    - [54, 14.02]
  - - [256, 2048, 1, 256, 256, 256, 256, 2048]
    - [55, 23.75]
  - - [256, 2048, 1, 512, 256, 256, 256, 2048]
    - [91, 37.24]
  - - [256, 2048, 1, 1024, 256, 256, 256, 2048]
    - [98, 53.22]
  - - [256, 2048, 1, 2048, 256, 256, 256, 2048]
    - [91, 67.51]
  - - [256, 2048, 1, 4096, 256, 256, 256, 2048]
    - [92, 79.12]
  - - [256, 2048, 1, 8192, 256, 256, 256, 2048]
    - [118, 86.68]
  - - [256, 4096, 1, 128, 256, 256, 256, 4096]
    - [48, 23.09]
  - - [256, 4096, 1, 256, 256, 256, 256, 4096]
    - [46, 39.83]
  - - [256, 4096, 1, 512, 256, 256, 256, 4096]
    - [49, 62.38]
  - - [256, 4096, 1, 1024, 256, 256, 256, 4096]
    - [50, 87.18]
  - - [256, 4096, 1, 2048, 256, 256, 256, 4096]
    - [85, 107.08]
  - - [256, 4096, 1, 4096, 256, 256, 256, 4096]
    - [87, 124.27]
  - - [256, 4096, 1, 8192, 256, 256, 256, 4096]
    - [117, 132.41]
  - - [256, 8192, 1, 128, 256, 256, 256, 8192]
    - [30, 36.26]
  - - [256, 8192, 1, 256, 256, 256, 256, 8192]
    - [36, 60.44]
  - - [256, 8192, 1, 512, 256, 256, 256, 8192]
    - [38, 93.49]
  - - [256, 8192, 1, 1024, 256, 256, 256, 8192]
    - [83, 128.99]
  - - [256, 8192, 1, 2048, 256, 256, 256, 8192]
    - [83, 158.09]
  - - [256, 8192, 1, 4096, 256, 256, 256, 8192]
    - [83, 177.23]
  - - [256, 8192, 1, 8192, 256, 256, 256, 8192]
    - [38, 168.35]
  - - [512, 128, 1, 128, 512, 512, 512, 128]
    - [63, 2.06]
  - - [512, 128, 1, 256, 512, 512, 512, 128]
    - [111, 3.58]
  - - [512, 128, 1, 512, 512, 512, 512, 128]
    - [114, 5.93]
  - - [512, 128, 1, 1024, 512, 512, 512, 128]
    - [114, 8.77]
  - - [512, 128, 1, 2048, 512, 512, 512, 128]
    - [116, 11.71]
  - - [512, 128, 1, 4096, 512, 512, 512, 128]
    - [116, 14.02]
  - - [512, 128, 1, 8192, 512, 512, 512, 128]
    - [126, 14.94]
  - - [512, 256, 1, 128, 512, 512, 512, 256]
    - [63, 4.03]
  - - [512, 256, 1, 256, 512, 512, 512, 256]
    - [66, 6.98]
  - - [512, 256, 1, 512, 512, 512, 512, 256]
    - [113, 11.61]
  - - [512, 256, 1, 1024, 512, 512, 512, 256]
    - [114, 17.18]
  - - [512, 256, 1, 2048, 512, 512, 512, 256]
    - [116, 22.94]
  - - [512, 256, 1, 4096, 512, 512, 512, 256]
    - [116, 27.67]
  - - [512, 256, 1, 8192, 512, 512, 512, 256]
    - [124, 27.88]
  - - [512, 512, 1, 128, 512, 512, 512, 512]
    - [60, 7.68]
  - - [512, 512, 1, 256, 512, 512, 512, 512]
    - [61, 13.06]
  - - [512, 512, 1, 512, 512, 512, 512, 512]
    - [107, 21.2]
  - - [512, 512, 1, 1024, 512, 512, 512, 512]
    - [108, 30.8]
  - - [512, 512, 1, 2048, 512, 512, 512, 512]
    - [120, 40.76]
  - - [512, 512, 1, 4096, 512, 512, 512, 512]
    - [120, 47.17]
  - - [512, 512, 1, 8192, 512, 512, 512, 512]
    - [109, 50.61]
  - - [512, 1024, 1, 128, 512, 512, 512, 1024]
    - [55, 14.08]
  - - [512, 1024, 1, 256, 512, 512, 512, 1024]
    - [55, 23.89]
  - - [512, 1024, 1, 512, 512, 512, 512, 1024]
    - [90, 37.52]
  - - [512, 1024, 1, 1024, 512, 512, 512, 1024]
    - [92, 54.12]
  - - [512, 1024, 1, 2048, 512, 512, 512, 1024]
    - [118, 69.31]
  - - [512, 1024, 1, 4096, 512, 512, 512, 1024]
    - [90, 76.02]
  - - [512, 1024, 1, 8192, 512, 512, 512, 1024]
    - [90, 81.07]
  - - [512, 2048, 1, 128, 512, 512, 512, 2048]
    - [52, 23.53]
  - - [512, 2048, 1, 256, 512, 512, 512, 2048]
    - [46, 40.09]
  - - [512, 2048, 1, 512, 512, 512, 512, 2048]
    - [51, 62.51]
  - - [512, 2048, 1, 1024, 512, 512, 512, 2048]
    - [50, 87.06]
  - - [512, 2048, 1, 2048, 512, 512, 512, 2048]
    - [85, 107.71]
  - - [512, 2048, 1, 4096, 512, 512, 512, 2048]
    - [85, 124.77]
  - - [512, 2048, 1, 8192, 512, 512, 512, 2048]
    - [85, 127.95]
  - - [512, 4096, 1, 128, 512, 512, 512, 4096]
    - [30, 36.9]
  - - [512, 4096, 1, 256, 512, 512, 512, 4096]
    - [36, 61.47]
  - - [512, 4096, 1, 512, 512, 512, 512, 4096]
    - [83, 94.45]
  - - [512, 4096, 1, 1024, 512, 512, 512, 4096]
    - [37, 129.41]
  - - [512, 4096, 1, 2048, 512, 512, 512, 4096]
    - [37, 156.39]
  - - [512, 4096, 1, 4096, 512, 512, 512, 4096]
    - [38, 174.12]
  - - [512, 4096, 1, 8192, 512, 512, 512, 4096]
    - [38, 168.72]
  - - [512, 8192, 1, 128, 512, 512, 512, 8192]
    - [21, 53.07]
  - - [512, 8192, 1, 256, 512, 512, 512, 8192]
    - [21, 89.45]
  - - [512, 8192, 1, 512, 512, 512, 512, 8192]
    - [23, 137.92]
  - - [512, 8192, 1, 1024, 512, 512, 512, 8192]
    - [23, 186.55]
  - - [512, 8192, 1, 2048, 512, 512, 512, 8192]
    - [23, 224.33]
  - - [512, 8192, 1, 4096, 512, 512, 512, 8192]
    - [22, 228.97]
  - - [512, 8192, 1, 8192, 512, 512, 512, 8192]
    - [75, 215.87]
  - - [1024, 128, 1, 128, 1024, 1024, 1024, 128]
    - [65, 3.97]
  - - [1024, 128, 1, 256, 1024, 1024, 1024, 128]
    - [63, 6.94]
  - - [1024, 128, 1, 512, 1024, 1024, 1024, 128]
    - [113, 11.33]
  - - [1024, 128, 1, 1024, 1024, 1024, 1024, 128]
    - [114, 17.1]
  - - [1024, 128, 1, 2048, 1024, 1024, 1024, 128]
    - [116, 22.87]
  - - [1024, 128, 1, 4096, 1024, 1024, 1024, 128]
    - [124, 25.53]
  - - [1024, 128, 1, 8192, 1024, 1024, 1024, 128]
    - [126, 26.56]
  - - [1024, 256, 1, 128, 1024, 1024, 1024, 256]
    - [61, 7.64]
  - - [1024, 256, 1, 256, 1024, 1024, 1024, 256]
    - [59, 13.07]
  - - [1024, 256, 1, 512, 1024, 1024, 1024, 256]
    - [106, 21.16]
  - - [1024, 256, 1, 1024, 1024, 1024, 1024, 256]
    - [108, 31.06]
  - - [1024, 256, 1, 2048, 1024, 1024, 1024, 256]
    - [120, 40.67]
  - - [1024, 256, 1, 4096, 1024, 1024, 1024, 256]
    - [104, 46.32]
  - - [1024, 256, 1, 8192, 1024, 1024, 1024, 256]
    - [121, 49.3]
  - - [1024, 512, 1, 128, 1024, 1024, 1024, 512]
    - [54, 13.67]
  - - [1024, 512, 1, 256, 1024, 1024, 1024, 512]
    - [55, 23.75]
  - - [1024, 512, 1, 512, 1024, 1024, 1024, 512]
    - [57, 37.22]
  - - [1024, 512, 1, 1024, 1024, 1024, 1024, 512]
    - [91, 53.28]
  - - [1024, 512, 1, 2048, 1024, 1024, 1024, 512]
    - [92, 69.17]
  - - [1024, 512, 1, 4096, 1024, 1024, 1024, 512]
    - [99, 76.12]
  - - [1024, 512, 1, 8192, 1024, 1024, 1024, 512]
    - [97, 82.39]
  - - [1024, 1024, 1, 128, 1024, 1024, 1024, 1024]
    - [51, 23.18]
  - - [1024, 1024, 1, 256, 1024, 1024, 1024, 1024]
    - [46, 39.88]
  - - [1024, 1024, 1, 512, 1024, 1024, 1024, 1024]
    - [46, 62.29]
  - - [1024, 1024, 1, 1024, 1024, 1024, 1024, 1024]
    - [50, 87.11]
  - - [1024, 1024, 1, 2048, 1024, 1024, 1024, 1024]
    - [85, 107.82]
  - - [1024, 1024, 1, 4096, 1024, 1024, 1024, 1024]
    - [86, 124.06]
  - - [1024, 1024, 1, 8192, 1024, 1024, 1024, 1024]
    - [85, 128.88]
  - - [1024, 2048, 1, 128, 1024, 1024, 1024, 2048]
    - [30, 36.51]
  - - [1024, 2048, 1, 256, 1024, 1024, 1024, 2048]
    - [38, 61.42]
  - - [1024, 2048, 1, 512, 1024, 1024, 1024, 2048]
    - [37, 94.09]
  - - [1024, 2048, 1, 1024, 1024, 1024, 1024, 2048]
    - [38, 128.33]
  - - [1024, 2048, 1, 2048, 1024, 1024, 1024, 2048]
    - [37, 157.2]
  - - [1024, 2048, 1, 4096, 1024, 1024, 1024, 2048]
    - [39, 174.27]
  - - [1024, 2048, 1, 8192, 1024, 1024, 1024, 2048]
    - [42, 167.69]
  - - [1024, 4096, 1, 128, 1024, 1024, 1024, 4096]
    - [27, 55.77]
  - - [1024, 4096, 1, 256, 1024, 1024, 1024, 4096]
    - [28, 93.06]
  - - [1024, 4096, 1, 512, 1024, 1024, 1024, 4096]
    - [29, 138.63]
  - - [1024, 4096, 1, 1024, 1024, 1024, 1024, 4096]
    - [23, 186.86]
  - - [1024, 4096, 1, 2048, 1024, 1024, 1024, 4096]
    - [24, 224.5]
  - - [1024, 4096, 1, 4096, 1024, 1024, 1024, 4096]
    - [23, 230.71]
  - - [1024, 4096, 1, 8192, 1024, 1024, 1024, 4096]
    - [81, 217.8]
  - - [1024, 8192, 1, 128, 1024, 1024, 1024, 8192]
    - [20, 67.89]
  - - [1024, 8192, 1, 256, 1024, 1024, 1024, 8192]
    - [19, 113.02]
  - - [1024, 8192, 1, 512, 1024, 1024, 1024, 8192]
    - [6, 169.02]
  - - [1024, 8192, 1, 1024, 1024, 1024, 1024, 8192]
    - [5, 220.75]
  - - [1024, 8192, 1, 2048, 1024, 1024, 1024, 8192]
    - [6, 252.56]
  - - [1024, 8192, 1, 4096, 1024, 1024, 1024, 8192]
    - [5, 250.15]
  - - [1024, 8192, 1, 8192, 1024, 1024, 1024, 8192]
    - [5, 264.54]
  - - [2048, 128, 1, 128, 2048, 2048, 2048, 128]
    - [62, 7.17]
  - - [2048, 128, 1, 256, 2048, 2048, 2048, 128]
    - [59, 12.74]
  - - [2048, 128, 1, 512, 2048, 2048, 2048, 128]
    - [105, 20.88]
  - - [2048, 128, 1, 1024, 2048, 2048, 2048, 128]
    - [108, 30.59]
  - - [2048, 128, 1, 2048, 2048, 2048, 2048, 128]
    - [104, 37.51]
  - - [2048, 128, 1, 4096, 2048, 2048, 2048, 128]
    - [102, 45.25]
  - - [2048, 128, 1, 8192, 2048, 2048, 2048, 128]
    - [103, 50.63]
  - - [2048, 256, 1, 128, 2048, 2048, 2048, 256]
    - [58, 13.31]
  - - [2048, 256, 1, 256, 2048, 2048, 2048, 256]
    - [55, 22.88]
  - - [2048, 256, 1, 512, 2048, 2048, 2048, 256]
    - [91, 36.43]
  - - [2048, 256, 1, 1024, 2048, 2048, 2048, 256]
    - [93, 52.95]
  - - [2048, 256, 1, 2048, 2048, 2048, 2048, 256]
    - [96, 67.05]
  - - [2048, 256, 1, 4096, 2048, 2048, 2048, 256]
    - [95, 77.94]
  - - [2048, 256, 1, 8192, 2048, 2048, 2048, 256]
    - [97, 85.57]
  - - [2048, 512, 1, 128, 2048, 2048, 2048, 512]
    - [45, 22.81]
  - - [2048, 512, 1, 256, 2048, 2048, 2048, 512]
    - [48, 39.59]
  - - [2048, 512, 1, 512, 2048, 2048, 2048, 512]
    - [46, 62.22]
  - - [2048, 512, 1, 1024, 2048, 2048, 2048, 512]
    - [47, 86.05]
  - - [2048, 512, 1, 2048, 2048, 2048, 2048, 512]
    - [86, 106.28]
  - - [2048, 512, 1, 4096, 2048, 2048, 2048, 512]
    - [87, 123.87]
  - - [2048, 512, 1, 8192, 2048, 2048, 2048, 512]
    - [86, 128.34]
  - - [2048, 1024, 1, 128, 2048, 2048, 2048, 1024]
    - [31, 35.87]
  - - [2048, 1024, 1, 256, 2048, 2048, 2048, 1024]
    - [32, 60.67]
  - - [2048, 1024, 1, 512, 2048, 2048, 2048, 1024]
    - [37, 93.75]
  - - [2048, 1024, 1, 1024, 2048, 2048, 2048, 1024]
    - [36, 126.83]
  - - [2048, 1024, 1, 2048, 2048, 2048, 2048, 1024]
    - [44, 156.17]
  - - [2048, 1024, 1, 4096, 2048, 2048, 2048, 1024]
    - [40, 173.74]
  - - [2048, 1024, 1, 8192, 2048, 2048, 2048, 1024]
    - [43, 164.06]
  - - [2048, 2048, 1, 128, 2048, 2048, 2048, 2048]
    - [23, 52.8]
  - - [2048, 2048, 1, 256, 2048, 2048, 2048, 2048]
    - [23, 89.96]
  - - [2048, 2048, 1, 512, 2048, 2048, 2048, 2048]
    - [23, 137.26]
  - - [2048, 2048, 1, 1024, 2048, 2048, 2048, 2048]
    - [23, 185.72]
  - - [2048, 2048, 1, 2048, 2048, 2048, 2048, 2048]
    - [29, 220.88]
  - - [2048, 2048, 1, 4096, 2048, 2048, 2048, 2048]
    - [77, 231.05]
  - - [2048, 2048, 1, 8192, 2048, 2048, 2048, 2048]
    - [76, 216.85]
  - - [2048, 4096, 1, 128, 2048, 2048, 2048, 4096]
    - [3, 64.12]
  - - [2048, 4096, 1, 256, 2048, 2048, 2048, 4096]
    - [3, 108.5]
  - - [2048, 4096, 1, 512, 2048, 2048, 2048, 4096]
    - [5, 164.32]
  - - [2048, 4096, 1, 1024, 2048, 2048, 2048, 4096]
    - [6, 222.16]
  - - [2048, 4096, 1, 2048, 2048, 2048, 2048, 4096]
    - [9, 250.8]
  - - [2048, 4096, 1, 4096, 2048, 2048, 2048, 4096]
    - [9, 246.98]
  - - [2048, 4096, 1, 8192, 2048, 2048, 2048, 4096]
    - [12, 260.97]
  - - [2048, 8192, 1, 128, 2048, 2048, 2048, 8192]
    - [19, 70.8]
  - - [2048, 8192, 1, 256, 2048, 2048, 2048, 8192]
    - [5, 117.05]
  - - [2048, 8192, 1, 512, 2048, 2048, 2048, 8192]
    - [9, 174.6]
  - - [2048, 8192, 1, 1024, 2048, 2048, 2048, 8192]
    - [2, 213.61]
  - - [2048, 8192, 1, 2048, 2048, 2048, 2048, 8192]
    - [6, 227.69]
  - - [2048, 8192, 1, 4096, 2048, 2048, 2048, 8192]
    - [71, 274.16]
  - - [2048, 8192, 1, 8192, 2048, 2048, 2048, 8192]
    - [8, 326.67]
  - - [4096, 128, 1, 128, 4096, 4096, 4096, 128]
    - [56, 14.07]
  - - [4096, 128, 1, 256, 4096, 4096, 4096, 128]
    - [55, 23.69]
  - - [4096, 128, 1, 512, 4096, 4096, 4096, 128]
    - [55, 37.57]
  - - [4096, 128, 1, 1024, 4096, 4096, 4096, 128]
    - [91, 54.04]
  - - [4096, 128, 1, 2048, 4096, 4096, 4096, 128]
    - [94, 65.97]
  - - [4096, 128, 1, 4096, 4096, 4096, 4096, 128]
    - [97, 78.0]
  - - [4096, 128, 1, 8192, 4096, 4096, 4096, 128]
    - [100, 85.34]
  - - [4096, 256, 1, 128, 4096, 4096, 4096, 256]
    - [51, 23.5]
  - - [4096, 256, 1, 256, 4096, 4096, 4096, 256]
    - [51, 40.48]
  - - [4096, 256, 1, 512, 4096, 4096, 4096, 256]
    - [53, 61.99]
  - - [4096, 256, 1, 1024, 4096, 4096, 4096, 256]
    - [86, 85.85]
  - - [4096, 256, 1, 2048, 4096, 4096, 4096, 256]
    - [86, 106.17]
  - - [4096, 256, 1, 4096, 4096, 4096, 4096, 256]
    - [88, 124.19]
  - - [4096, 256, 1, 8192, 4096, 4096, 4096, 256]
    - [86, 131.4]
  - - [4096, 512, 1, 128, 4096, 4096, 4096, 512]
    - [30, 36.43]
  - - [4096, 512, 1, 256, 4096, 4096, 4096, 512]
    - [30, 60.7]
  - - [4096, 512, 1, 512, 4096, 4096, 4096, 512]
    - [40, 91.62]
  - - [4096, 512, 1, 1024, 4096, 4096, 4096, 512]
    - [41, 125.6]
  - - [4096, 512, 1, 2048, 4096, 4096, 4096, 512]
    - [43, 155.14]
  - - [4096, 512, 1, 4096, 4096, 4096, 4096, 512]
    - [40, 174.06]
  - - [4096, 512, 1, 8192, 4096, 4096, 4096, 512]
    - [41, 167.0]
  - - [4096, 1024, 1, 128, 4096, 4096, 4096, 1024]
    - [21, 53.39]
  - - [4096, 1024, 1, 256, 4096, 4096, 4096, 1024]
    - [23, 88.1]
  - - [4096, 1024, 1, 512, 4096, 4096, 4096, 1024]
    - [29, 133.19]
  - - [4096, 1024, 1, 1024, 4096, 4096, 4096, 1024]
    - [29, 181.25]
  - - [4096, 1024, 1, 2048, 4096, 4096, 4096, 1024]
    - [24, 218.36]
  - - [4096, 1024, 1, 4096, 4096, 4096, 4096, 1024]
    - [82, 228.07]
  - - [4096, 1024, 1, 8192, 4096, 4096, 4096, 1024]
    - [79, 217.12]
  - - [4096, 2048, 1, 128, 4096, 4096, 4096, 2048]
    - [3, 60.27]
  - - [4096, 2048, 1, 256, 4096, 4096, 4096, 2048]
    - [7, 101.95]
  - - [4096, 2048, 1, 512, 4096, 4096, 4096, 2048]
    - [1, 156.76]
  - - [4096, 2048, 1, 1024, 4096, 4096, 4096, 2048]
    - [6, 215.07]
  - - [4096, 2048, 1, 2048, 4096, 4096, 4096, 2048]
    - [12, 248.44]
  - - [4096, 2048, 1, 4096, 4096, 4096, 4096, 2048]
    - [12, 246.78]
  - - [4096, 2048, 1, 8192, 4096, 4096, 4096, 2048]
    - [14, 270.47]
  - - [4096, 4096, 1, 128, 4096, 4096, 4096, 4096]
    - [1, 67.19]
  - - [4096, 4096, 1, 256, 4096, 4096, 4096, 4096]
    - [0, 115.54]
  - - [4096, 4096, 1, 512, 4096, 4096, 4096, 4096]
    - [0, 171.01]
  - - [4096, 4096, 1, 1024, 4096, 4096, 4096, 4096]
    - [5, 213.64]
  - - [4096, 4096, 1, 2048, 4096, 4096, 4096, 4096]
    - [73, 227.19]
  - - [4096, 4096, 1, 4096, 4096, 4096, 4096, 4096]
    - [9, 277.86]
  - - [4096, 4096, 1, 8192, 4096, 4096, 4096, 4096]
    - [9, 329.06]
  - - [4096, 8192, 1, 128, 4096, 4096, 4096, 8192]
    - [18, 75.23]
  - - [4096, 8192, 1, 256, 4096, 4096, 4096, 8192]
    - [17, 120.79]
  - - [4096, 8192, 1, 512, 4096, 4096, 4096, 8192]
    - [15, 176.56]
  - - [4096, 8192, 1, 1024, 4096, 4096, 4096, 8192]
    - [26, 213.25]
  - - [4096, 8192, 1, 2048, 4096, 4096, 4096, 8192]
    - [4, 269.77]
  - - [4096, 8192, 1, 4096, 4096, 4096, 4096, 8192]
    - [72, 322.85]
  - - [4096, 8192, 1, 8192, 4096, 4096, 4096, 8192]
    - [67, 346.34]
  - - [8192, 128, 1, 128, 8192, 8192, 8192, 128]
    - [35, 22.73]
  - - [8192, 128, 1, 256, 8192, 8192, 8192, 128]
    - [46, 39.71]
  - - [8192, 128, 1, 512, 8192, 8192, 8192, 128]
    - [50, 62.03]
  - - [8192, 128, 1, 1024, 8192, 8192, 8192, 128]
    - [50, 86.35]
  - - [8192, 128, 1, 2048, 8192, 8192, 8192, 128]
    - [87, 106.51]
  - - [8192, 128, 1, 4096, 8192, 8192, 8192, 128]
    - [87, 124.51]
  - - [8192, 128, 1, 8192, 8192, 8192, 8192, 128]
    - [88, 127.24]
  - - [8192, 256, 1, 128, 8192, 8192, 8192, 256]
    - [34, 35.46]
  - - [8192, 256, 1, 256, 8192, 8192, 8192, 256]
    - [33, 59.3]
  - - [8192, 256, 1, 512, 8192, 8192, 8192, 256]
    - [42, 92.21]
  - - [8192, 256, 1, 1024, 8192, 8192, 8192, 256]
    - [84, 126.18]
  - - [8192, 256, 1, 2048, 8192, 8192, 8192, 256]
    - [41, 153.91]
  - - [8192, 256, 1, 4096, 8192, 8192, 8192, 256]
    - [44, 173.51]
  - - [8192, 256, 1, 8192, 8192, 8192, 8192, 256]
    - [44, 165.19]
  - - [8192, 512, 1, 128, 8192, 8192, 8192, 512]
    - [29, 52.2]
  - - [8192, 512, 1, 256, 8192, 8192, 8192, 512]
    - [25, 88.43]
  - - [8192, 512, 1, 512, 8192, 8192, 8192, 512]
    - [24, 133.19]
  - - [8192, 512, 1, 1024, 8192, 8192, 8192, 512]
    - [16, 176.75]
  - - [8192, 512, 1, 2048, 8192, 8192, 8192, 512]
    - [29, 217.36]
  - - [8192, 512, 1, 4096, 8192, 8192, 8192, 512]
    - [24, 229.51]
  - - [8192, 512, 1, 8192, 8192, 8192, 8192, 512]
    - [78, 216.39]
  - - [8192, 1024, 1, 128, 8192, 8192, 8192, 1024]
    - [10, 60.75]
  - - [8192, 1024, 1, 256, 8192, 8192, 8192, 1024]
    - [12, 103.08]
  - - [8192, 1024, 1, 512, 8192, 8192, 8192, 1024]
    - [10, 157.25]
  - - [8192, 1024, 1, 1024, 8192, 8192, 8192, 1024]
    - [6, 214.49]
  - - [8192, 1024, 1, 2048, 8192, 8192, 8192, 1024]
    - [12, 248.74]
  - - [8192, 1024, 1, 4096, 8192, 8192, 8192, 1024]
    - [12, 248.56]
  - - [8192, 1024, 1, 8192, 8192, 8192, 8192, 1024]
    - [74, 275.21]
  - - [8192, 2048, 1, 128, 8192, 8192, 8192, 2048]
    - [5, 64.3]
  - - [8192, 2048, 1, 256, 8192, 8192, 8192, 2048]
    - [0, 110.86]
  - - [8192, 2048, 1, 512, 8192, 8192, 8192, 2048]
    - [11, 165.05]
  - - [8192, 2048, 1, 1024, 8192, 8192, 8192, 2048]
    - [6, 215.15]
  - - [8192, 2048, 1, 2048, 8192, 8192, 8192, 2048]
    - [69, 225.21]
  - - [8192, 2048, 1, 4096, 8192, 8192, 8192, 2048]
    - [71, 280.65]
  - - [8192, 2048, 1, 8192, 8192, 8192, 8192, 2048]
    - [70, 330.26]
  - - [8192, 4096, 1, 128, 8192, 8192, 8192, 4096]
    - [0, 71.09]
  - - [8192, 4096, 1, 256, 8192, 8192, 8192, 4096]
    - [5, 116.16]
  - - [8192, 4096, 1, 512, 8192, 8192, 8192, 4096]
    - [13, 172.85]
  - - [8192, 4096, 1, 1024, 8192, 8192, 8192, 4096]
    - [80, 211.44]
  - - [8192, 4096, 1, 2048, 8192, 8192, 8192, 4096]
    - [5, 267.18]
  - - [8192, 4096, 1, 4096, 8192, 8192, 8192, 4096]
    - [8, 308.33]
  - - [8192, 4096, 1, 8192, 8192, 8192, 8192, 4096]
    - [2, 357.87]
  - - [8192, 8192, 1, 128, 8192, 8192, 8192, 8192]
    - [17, 68.29]
  - - [8192, 8192, 1, 256, 8192, 8192, 8192, 8192]
    - [22, 115.74]
  - - [8192, 8192, 1, 512, 8192, 8192, 8192, 8192]
    - [11, 176.52]
  - - [8192, 8192, 1, 1024, 8192, 8192, 8192, 8192]
    - [9, 239.08]
  - - [8192, 8192, 1, 2048, 8192, 8192, 8192, 8192]
    - [71, 302.36]
  - - [8192, 8192, 1, 4096, 8192, 8192, 8192, 8192]
    - [69, 341.04]
  - - [8192, 8192, 1, 8192, 8192, 8192, 8192, 8192]
    - [68, 359.79]
- null
- null
- ExperimentalStreamK
- GridBased
