projects/hipblaslt/library/src/amd_detail/rocblaslt/src/Tensile/Logic/asm_full/aquavanjaram/gfx942_228cu/StreamK/aquavanjaram942_Cijk_Alik_Bjlk_B8NF8NS_BH_Bias_HAS_SAV_UserArgs.yaml
- {MinimumRequiredVersion: 4.33.0}
- aquavanjaram942
- {Architecture: gfx942, CUCount: 228}
- [Device 0049, Device 0050]
    SolutionIndex: 0
    SolutionNameMin: Cijk_Alik_Bjlk_B8NF8NS_BH_Bias_HAS_SAV_UserArgs_MT256x256x64_MI16x16x1_SN_LDSB1_CLR1_GRVWA16_GRVWB8_GSU0_GSUC0_GSUWGMRR0_K1_LBSPPA512_LBSPPB2048_LPA16_LPB0_LRVW8_MIWT8_8_PLR1_SU0_SUM0_SUS64_VWA8_VWB8_WGM1_WGMXCC1_WGMXCCGn1
    SolutionIndex: 1
    SolutionNameMin: Cijk_Alik_Bjlk_B8NF8NS_BH_Bias_HAS_SAV_UserArgs_MT256x256x64_MI16x16x1_SN_LDSB1_CLR1_GRVWA8_GRVWB16_GSU0_GSUC0_GSUWGMRR0_K1_LBSPPA512_LBSPPB2048_LPA8_LPB0_LRVW8_MIWT8_8_PLR1_SU0_SUM0_SUS64_VWA8_VWB8_WGM1_WGMXCC1_WGMXCCGn1
    SolutionIndex: 2
    SolutionNameMin: Cijk_Alik_Bjlk_B8NF8NS_BH_Bias_HAS_SAV_UserArgs_MT256x256x64_MI16x16x1_SN_LDSB1_CLR1_GRVWA16_GRVWB16_GSU0_GSUC0_GSUWGMRR0_K1_LBSPPA512_LBSPPB2048_LPA16_LPB0_LRVW8_MIWT8_8_PLR1_SU0_SUM0_SUS64_VWA8_VWB8_WGM1_WGMXCC1_WGMXCCGn1
    SolutionIndex: 3
    SolutionNameMin: Cijk_Alik_Bjlk_B8NF8NS_BH_Bias_HAS_SAV_UserArgs_MT256x256x64_MI16x16x1_SN_LDSB1_CLR1_GRVWA8_GRVWB16_GSU0_GSUC0_GSUWGMRR0_K1_LBSPPA512_LBSPPB2048_LPA8_LPB0_LRVW8_MIWT8_8_PLR1_SU0_SUM0_SUS64_VWA8_VWB8_WGM4_WGMXCC1_WGMXCCGn1
    SolutionIndex: 4
    SolutionNameMin: Cijk_Alik_Bjlk_B8NF8NS_BH_Bias_HAS_SAV_UserArgs_MT256x256x64_MI16x16x1_SN_LDSB1_CLR1_GRVWA8_GRVWB16_GSU0_GSUC0_GSUWGMRR0_K1_LBSPPA512_LBSPPB2048_LPA8_LPB0_LRVW8_MIWT8_8_PLR1_SU0_SUM0_SUS64_VWA8_VWB8_WGM6_WGMXCC1_WGMXCCGn1
    SolutionIndex: 5
    SolutionNameMin: Cijk_Alik_Bjlk_B8NF8NS_BH_Bias_HAS_SAV_UserArgs_MT256x256x64_MI16x16x1_SN_LDSB1_CLR1_GRVWA16_GRVWB16_GSU0_GSUC0_GSUWGMRR0_K1_LBSPPA512_LBSPPB2048_LPA16_LPB0_LRVW8_MIWT8_8_PLR1_SU0_SUM0_SUS64_VWA8_VWB8_WGM6_WGMXCC1_WGMXCCGn1
    SolutionIndex: 6
    SolutionNameMin: Cijk_Alik_Bjlk_B8NF8NS_BH_Bias_HAS_SAV_UserArgs_MT256x256x64_MI16x16x1_SN_LDSB1_CLR1_GRVWA16_GRVWB8_GSU0_GSUC0_GSUWGMRR0_K1_LBSPPA512_LBSPPB2048_LPA16_LPB0_LRVW8_MIWT8_8_PLR1_SU0_SUM0_SUS64_VWA8_VWB8_WGM8_WGMXCC1_WGMXCCGn1
    SolutionIndex: 7
    SolutionNameMin: Cijk_Alik_Bjlk_B8NF8NS_BH_Bias_HAS_SAV_UserArgs_MT256x256x64_MI16x16x1_SN_LDSB1_CLR1_GRVWA8_GRVWB16_GSU0_GSUC0_GSUWGMRR0_K1_LBSPPA512_LBSPPB2048_LPA8_LPB0_LRVW8_MIWT8_8_PLR1_SU0_SUM0_SUS64_VWA8_VWB8_WGM8_WGMXCC1_WGMXCCGn1
    SolutionIndex: 8
    SolutionNameMin: Cijk_Alik_Bjlk_B8NF8NS_BH_Bias_HAS_SAV_UserArgs_MT256x256x64_MI16x16x1_SN_LDSB1_CLR1_GRVWA16_GRVWB16_GSU0_GSUC0_GSUWGMRR0_K1_LBSPPA512_LBSPPB2048_LPA16_LPB0_LRVW8_MIWT8_8_PLR1_SU0_SUM0_SUS64_VWA8_VWB8_WGM8_WGMXCC1_WGMXCCGn1
    SolutionIndex: 9
    SolutionNameMin: Cijk_Alik_Bjlk_B8NF8NS_BH_Bias_HAS_SAV_UserArgs_MT128x256x64_MI16x16x1_SN_LDSB1_CLR1_GRVWA8_GRVWB16_GSU0_GSUC0_GSUWGMRR0_K1_LBSPPA256_LBSPPB2048_LPA8_LPB0_LRVW8_MIWT4_8_PLR1_SU0_SUM0_SUS64_VWA4_VWB8_WGM1_WGMXCC1_WGMXCCGn1
    SolutionIndex: 10
    SolutionNameMin: Cijk_Alik_Bjlk_B8NF8NS_BH_Bias_HAS_SAV_UserArgs_MT128x256x64_MI16x16x1_SN_LDSB1_CLR1_GRVWA16_GRVWB16_GSU0_GSUC0_GSUWGMRR0_K1_LBSPPA256_LBSPPB2048_LPA16_LPB0_LRVW8_MIWT4_8_PLR1_SU0_SUM0_SUS64_VWA4_VWB8_WGM1_WGMXCC1_WGMXCCGn1
    SolutionIndex: 11
    SolutionNameMin: Cijk_Alik_Bjlk_B8NF8NS_BH_Bias_HAS_SAV_UserArgs_MT128x256x64_MI16x16x1_SN_LDSB1_CLR1_GRVWA8_GRVWB16_GSU0_GSUC0_GSUWGMRR0_K1_LBSPPA256_LBSPPB2048_LPA8_LPB0_LRVW8_MIWT4_8_PLR1_SU0_SUM0_SUS64_VWA4_VWB8_WGM6_WGMXCC1_WGMXCCGn1
    SolutionIndex: 12
    SolutionNameMin: Cijk_Alik_Bjlk_B8NF8NS_BH_Bias_HAS_SAV_UserArgs_MT128x256x64_MI16x16x1_SN_LDSB1_CLR1_GRVWA16_GRVWB16_GSU0_GSUC0_GSUWGMRR0_K1_LBSPPA256_LBSPPB2048_LPA16_LPB0_LRVW8_MIWT4_8_PLR1_SU0_SUM0_SUS64_VWA4_VWB8_WGM8_WGMXCC1_WGMXCCGn1
    SolutionIndex: 13
    SolutionNameMin: Cijk_Alik_Bjlk_B8NF8NS_BH_Bias_HAS_SAV_UserArgs_MT256x128x64_MI16x16x1_SN_LDSB1_CLR1_GRVWA8_GRVWB8_GSU0_GSUC0_GSUWGMRR0_K1_LBSPPA512_LBSPPB1024_LPA8_LPB64_LRVW8_MIWT8_4_PLR1_SU0_SUM0_SUS64_VWA8_VWB4_WGM1_WGMXCC1_WGMXCCGn1
    SolutionIndex: 14
    SolutionNameMin: Cijk_Alik_Bjlk_B8NF8NS_BH_Bias_HAS_SAV_UserArgs_MT256x128x64_MI16x16x1_SN_LDSB1_CLR1_GRVWA16_GRVWB8_GSU0_GSUC0_GSUWGMRR0_K1_LBSPPA512_LBSPPB1024_LPA16_LPB64_LRVW8_MIWT8_4_PLR1_SU0_SUM0_SUS64_VWA8_VWB4_WGM1_WGMXCC1_WGMXCCGn1
    SolutionIndex: 15
    SolutionNameMin: Cijk_Alik_Bjlk_B8NF8NS_BH_Bias_HAS_SAV_UserArgs_MT256x128x64_MI16x16x1_SN_LDSB1_CLR1_GRVWA8_GRVWB16_GSU0_GSUC0_GSUWGMRR0_K1_LBSPPA512_LBSPPB1024_LPA8_LPB64_LRVW8_MIWT8_4_PLR1_SU0_SUM0_SUS64_VWA8_VWB4_WGM1_WGMXCC1_WGMXCCGn1
    SolutionIndex: 16
    SolutionNameMin: Cijk_Alik_Bjlk_B8NF8NS_BH_Bias_HAS_SAV_UserArgs_MT256x128x64_MI16x16x1_SN_LDSB1_CLR1_GRVWA16_GRVWB16_GSU0_GSUC0_GSUWGMRR0_K1_LBSPPA512_LBSPPB1024_LPA16_LPB64_LRVW8_MIWT8_4_PLR1_SU0_SUM0_SUS64_VWA8_VWB4_WGM1_WGMXCC1_WGMXCCGn1
    SolutionIndex: 17
    SolutionNameMin: Cijk_Alik_Bjlk_B8NF8NS_BH_Bias_HAS_SAV_UserArgs_MT256x128x64_MI16x16x1_SN_LDSB1_CLR1_GRVWA8_GRVWB16_GSU0_GSUC0_GSUWGMRR0_K1_LBSPPA512_LBSPPB1024_LPA8_LPB64_LRVW8_MIWT8_4_PLR1_SU0_SUM0_SUS64_VWA8_VWB4_WGM4_WGMXCC1_WGMXCCGn1
    SolutionIndex: 18
    SolutionNameMin: Cijk_Alik_Bjlk_B8NF8NS_BH_Bias_HAS_SAV_UserArgs_MT256x128x64_MI16x16x1_SN_LDSB1_CLR1_GRVWA16_GRVWB8_GSU0_GSUC0_GSUWGMRR0_K1_LBSPPA512_LBSPPB1024_LPA16_LPB64_LRVW8_MIWT8_4_PLR1_SU0_SUM0_SUS64_VWA8_VWB4_WGM8_WGMXCC1_WGMXCCGn1
    SolutionIndex: 19
    SolutionNameMin: Cijk_Alik_Bjlk_B8NF8NS_BH_Bias_HAS_SAV_UserArgs_MT128x128x64_MI16x16x1_SN_LDSB1_CLR1_GRVWA8_GRVWB8_GSU0_GSUC0_GSUWGMRR0_K1_LBSPPA512_LBSPPB1024_LPA8_LPB32_LRVW8_MIWT8_2_PLR1_SU0_SUM0_SUS64_VWA8_VWB2_WGM1_WGMXCC1_WGMXCCGn1
    SolutionIndex: 20
    SolutionNameMin: Cijk_Alik_Bjlk_B8NF8NS_BH_Bias_HAS_SAV_UserArgs_MT128x128x64_MI16x16x1_SN_LDSB1_CLR1_GRVWA8_GRVWB16_GSU0_GSUC0_GSUWGMRR0_K1_LBSPPA512_LBSPPB1024_LPA8_LPB32_LRVW8_MIWT8_2_PLR1_SU0_SUM0_SUS64_VWA8_VWB2_WGM1_WGMXCC1_WGMXCCGn1
    SolutionIndex: 21
    SolutionNameMin: Cijk_Alik_Bjlk_B8NF8NS_BH_Bias_HAS_SAV_UserArgs_MT128x128x64_MI16x16x1_SN_LDSB1_CLR1_GRVWA16_GRVWB16_GSU0_GSUC0_GSUWGMRR0_K1_LBSPPA512_LBSPPB1024_LPA16_LPB32_LRVW8_MIWT8_2_PLR1_SU0_SUM0_SUS64_VWA8_VWB2_WGM8_WGMXCC1_WGMXCCGn1
    SolutionIndex: 22
    SolutionNameMin: Cijk_Alik_Bjlk_B8NF8NS_BH_Bias_HAS_SAV_UserArgs_MT128x64x64_MI16x16x1_SN_LDSB0_CLR1_GRVWA8_GRVWB8_GSU0_GSUC0_GSUWGMRR0_K1_LBSPPA512_LBSPPB512_LPA8_LPB16_LRVW8_MIWT8_1_PLR1_SU0_SUM0_SUS64_VWA8_VWB1_WGM1_WGMXCC1_WGMXCCGn1
    SolutionIndex: 23
    SolutionNameMin: Cijk_Alik_Bjlk_B8NF8NS_BH_Bias_HAS_SAV_UserArgs_MT128x128x64_MI16x16x1_SN_LDSB1_CLR1_GRVWA16_GRVWB8_GSU0_GSUC0_GSUWGMRR0_K1_LBSPPA256_LBSPPB1024_LPA16_LPB64_LRVW8_MIWT4_4_PLR1_SU0_SUM0_SUS64_VWA4_VWB4_WGM1_WGMXCC1_WGMXCCGn1
    SolutionIndex: 24
    SolutionNameMin: Cijk_Alik_Bjlk_B8NF8NS_BH_Bias_HAS_SAV_UserArgs_MT128x128x64_MI16x16x1_SN_LDSB1_CLR1_GRVWA16_GRVWB16_GSU0_GSUC0_GSUWGMRR0_K1_LBSPPA256_LBSPPB1024_LPA16_LPB64_LRVW8_MIWT4_4_PLR1_SU0_SUM0_SUS64_VWA4_VWB4_WGM1_WGMXCC1_WGMXCCGn1
    SolutionIndex: 25
    SolutionNameMin: Cijk_Alik_Bjlk_B8NF8NS_BH_Bias_HAS_SAV_UserArgs_MT128x64x64_MI16x16x1_SN_LDSB0_CLR1_GRVWA8_GRVWB8_GSU0_GSUC0_GSUWGMRR0_K1_LBSPPA256_LBSPPB512_LPA8_LPB32_LRVW8_MIWT4_2_PLR1_SU0_SUM0_SUS64_VWA4_VWB2_WGM1_WGMXCC1_WGMXCCGn1
    SolutionIndex: 26
    SolutionNameMin: Cijk_Alik_Bjlk_B8NF8NS_BH_Bias_HAS_SAV_UserArgs_MT128x64x64_MI16x16x1_SN_LDSB0_CLR1_GRVWA16_GRVWB8_GSU0_GSUC0_GSUWGMRR0_K1_LBSPPA256_LBSPPB512_LPA16_LPB32_LRVW8_MIWT4_2_PLR1_SU0_SUM0_SUS64_VWA4_VWB2_WGM1_WGMXCC1_WGMXCCGn1
    SolutionIndex: 27
    SolutionNameMin: Cijk_Alik_Bjlk_B8NF8NS_BH_Bias_HAS_SAV_UserArgs_MT128x64x64_MI16x16x1_SN_LDSB0_CLR1_GRVWA8_GRVWB16_GSU0_GSUC0_GSUWGMRR0_K1_LBSPPA256_LBSPPB512_LPA8_LPB32_LRVW8_MIWT4_2_PLR1_SU0_SUM0_SUS64_VWA4_VWB2_WGM1_WGMXCC1_WGMXCCGn1
    SolutionIndex: 28
    SolutionNameMin: Cijk_Alik_Bjlk_B8NF8NS_BH_Bias_HAS_SAV_UserArgs_MT128x64x64_MI16x16x1_SN_LDSB0_CLR1_GRVWA16_GRVWB16_GSU0_GSUC0_GSUWGMRR0_K1_LBSPPA256_LBSPPB512_LPA16_LPB32_LRVW8_MIWT4_2_PLR1_SU0_SUM0_SUS64_VWA4_VWB2_WGM1_WGMXCC1_WGMXCCGn1
    SolutionIndex: 29
    SolutionNameMin: Cijk_Alik_Bjlk_B8NF8NS_BH_Bias_HAS_SAV_UserArgs_MT128x64x64_MI16x16x1_SN_LDSB0_CLR1_GRVWA8_GRVWB16_GSU0_GSUC0_GSUWGMRR0_K1_LBSPPA256_LBSPPB512_LPA8_LPB32_LRVW8_MIWT4_2_PLR1_SU0_SUM0_SUS64_VWA4_VWB2_WGM4_WGMXCC1_WGMXCCGn1
    SolutionIndex: 30
    SolutionNameMin: Cijk_Alik_Bjlk_B8NF8NS_BH_Bias_HAS_SAV_UserArgs_MT128x64x64_MI16x16x1_SN_LDSB0_CLR1_GRVWA8_GRVWB8_GSU0_GSUC0_GSUWGMRR0_K1_LBSPPA256_LBSPPB512_LPA8_LPB32_LRVW8_MIWT4_2_PLR1_SU0_SUM0_SUS64_VWA4_VWB2_WGM8_WGMXCC1_WGMXCCGn1
    SolutionIndex: 31
    SolutionNameMin: Cijk_Alik_Bjlk_B8NF8NS_BH_Bias_HAS_SAV_UserArgs_MT128x64x64_MI16x16x1_SN_LDSB0_CLR1_GRVWA8_GRVWB16_GSU0_GSUC0_GSUWGMRR0_K1_LBSPPA256_LBSPPB512_LPA8_LPB32_LRVW8_MIWT4_2_PLR1_SU0_SUM0_SUS64_VWA4_VWB2_WGM8_WGMXCC1_WGMXCCGn1
    SolutionIndex: 32
    SolutionNameMin: Cijk_Alik_Bjlk_B8NF8NS_BH_Bias_HAS_SAV_UserArgs_MT128x64x64_MI16x16x1_SN_LDSB0_CLR1_GRVWA16_GRVWB16_GSU0_GSUC0_GSUWGMRR0_K1_LBSPPA256_LBSPPB512_LPA16_LPB32_LRVW8_MIWT4_2_PLR1_SU0_SUM0_SUS64_VWA4_VWB2_WGM8_WGMXCC1_WGMXCCGn1
    SolutionIndex: 33
    SolutionNameMin: Cijk_Alik_Bjlk_B8NF8NS_BH_Bias_HAS_SAV_UserArgs_MT64x64x64_MI16x16x1_SN_LDSB0_CLR1_GRVWA8_GRVWB8_GSU0_GSUC0_GSUWGMRR0_K1_LBSPPA128_LBSPPB512_LPA8_LPB32_LRVW8_MIWT2_2_PLR1_SU0_SUM0_SUS64_VWA2_VWB2_WGM1_WGMXCC1_WGMXCCGn1
    SolutionIndex: 34
    SolutionNameMin: Cijk_Alik_Bjlk_B8NF8NS_BH_Bias_HAS_SAV_UserArgs_MT64x64x64_MI16x16x1_SN_LDSB0_CLR1_GRVWA16_GRVWB8_GSU0_GSUC0_GSUWGMRR0_K1_LBSPPA128_LBSPPB512_LPA16_LPB32_LRVW8_MIWT2_2_PLR1_SU0_SUM0_SUS64_VWA2_VWB2_WGM1_WGMXCC1_WGMXCCGn1
    SolutionIndex: 35
    SolutionNameMin: Cijk_Alik_Bjlk_B8NF8NS_BH_Bias_HAS_SAV_UserArgs_MT64x64x64_MI16x16x1_SN_LDSB0_CLR1_GRVWA8_GRVWB16_GSU0_GSUC0_GSUWGMRR0_K1_LBSPPA128_LBSPPB512_LPA8_LPB32_LRVW8_MIWT2_2_PLR1_SU0_SUM0_SUS64_VWA2_VWB2_WGM1_WGMXCC1_WGMXCCGn1
    SolutionIndex: 36
    SolutionNameMin: Cijk_Alik_Bjlk_B8NF8NS_BH_Bias_HAS_SAV_UserArgs_MT64x64x64_MI16x16x1_SN_LDSB0_CLR1_GRVWA8_GRVWB8_GSU0_GSUC0_GSUWGMRR0_K1_LBSPPA128_LBSPPB512_LPA8_LPB32_LRVW8_MIWT2_2_PLR1_SU0_SUM0_SUS64_VWA2_VWB2_WGM6_WGMXCC1_WGMXCCGn1
    SolutionIndex: 37
    SolutionNameMin: Cijk_Alik_Bjlk_B8NF8NS_BH_Bias_HAS_SAV_UserArgs_MT64x64x64_MI16x16x1_SN_LDSB0_CLR1_GRVWA8_GRVWB16_GSU0_GSUC0_GSUWGMRR0_K1_LBSPPA128_LBSPPB512_LPA8_LPB32_LRVW8_MIWT2_2_PLR1_SU0_SUM0_SUS64_VWA2_VWB2_WGM6_WGMXCC1_WGMXCCGn1
    SolutionIndex: 38
    SolutionNameMin: Cijk_Alik_Bjlk_B8NF8NS_BH_Bias_HAS_SAV_UserArgs_MT64x32x64_MI16x16x1_SN_LDSB0_CLR1_GRVWA8_GRVWB8_GSU0_GSUC0_GSUWGMRR0_K1_LBSPPA128_LBSPPB256_LPA8_LPB16_LRVW8_MIWT2_1_PLR1_SU0_SUM0_SUS64_VWA2_VWB1_WGM1_WGMXCC1_WGMXCCGn1
    SolutionIndex: 39
    SolutionNameMin: Cijk_Alik_Bjlk_B8NF8NS_BH_Bias_HAS_SAV_UserArgs_MT64x32x64_MI16x16x1_SN_LDSB0_CLR1_GRVWA16_GRVWB8_GSU0_GSUC0_GSUWGMRR0_K1_LBSPPA128_LBSPPB256_LPA16_LPB16_LRVW8_MIWT2_1_PLR1_SU0_SUM0_SUS64_VWA2_VWB1_WGM1_WGMXCC1_WGMXCCGn1
    SolutionIndex: 40
    SolutionNameMin: Cijk_Alik_Bjlk_B8NF8NS_BH_Bias_HAS_SAV_UserArgs_MT64x32x64_MI16x16x1_SN_LDSB0_CLR1_GRVWA8_GRVWB8_GSU0_GSUC0_GSUWGMRR0_K1_LBSPPA128_LBSPPB256_LPA8_LPB16_LRVW8_MIWT2_1_PLR1_SU0_SUM0_SUS64_VWA2_VWB1_WGM4_WGMXCC1_WGMXCCGn1
    SolutionIndex: 41
    SolutionNameMin: Cijk_Alik_Bjlk_B8NF8NS_BH_Bias_HAS_SAV_UserArgs_MT32x32x64_MI16x16x1_SN_LDSB0_CLR1_GRVWA8_GRVWB8_GSU0_GSUC0_GSUWGMRR0_K1_LBSPPA128_LBSPPB256_LPA8_LPB16_LRVW8_MIWT1_1_PLR1_SU0_SUM0_SUS64_VWA1_VWB1_WGM1_WGMXCC1_WGMXCCGn1
    SolutionIndex: 42
    SolutionNameMin: Cijk_Alik_Bjlk_B8NF8NS_BH_Bias_HAS_SAV_UserArgs_MT128x256x128_MI16x16x1_SN_LDSB1_CLR1_GRVWA8_GRVWB16_GSU0_GSUC0_GSUWGMRR0_K1_LBSPPA512_LBSPPB2048_LPA8_LPB0_LRVW8_MIWT4_8_PLR1_SU0_SUM0_SUS128_VWA4_VWB8_WGM1_WGMXCC1_WGMXCCGn1
    SolutionIndex: 43
    SolutionNameMin: Cijk_Alik_Bjlk_B8NF8NS_BH_Bias_HAS_SAV_UserArgs_MT128x256x128_MI16x16x1_SN_LDSB1_CLR1_GRVWA16_GRVWB16_GSU0_GSUC0_GSUWGMRR0_K1_LBSPPA512_LBSPPB2048_LPA16_LPB0_LRVW8_MIWT4_8_PLR1_SU0_SUM0_SUS128_VWA4_VWB8_WGM4_WGMXCC1_WGMXCCGn1
    SolutionIndex: 44
    SolutionNameMin: Cijk_Alik_Bjlk_B8NF8NS_BH_Bias_HAS_SAV_UserArgs_MT128x256x128_MI16x16x1_SN_LDSB1_CLR1_GRVWA8_GRVWB16_GSU0_GSUC0_GSUWGMRR0_K1_LBSPPA512_LBSPPB2048_LPA8_LPB0_LRVW8_MIWT4_8_PLR1_SU0_SUM0_SUS128_VWA4_VWB8_WGM6_WGMXCC1_WGMXCCGn1
    SolutionIndex: 45
    SolutionNameMin: Cijk_Alik_Bjlk_B8NF8NS_BH_Bias_HAS_SAV_UserArgs_MT128x256x128_MI16x16x1_SN_LDSB1_CLR1_GRVWA16_GRVWB16_GSU0_GSUC0_GSUWGMRR0_K1_LBSPPA512_LBSPPB2048_LPA16_LPB0_LRVW8_MIWT4_8_PLR1_SU0_SUM0_SUS128_VWA4_VWB8_WGM6_WGMXCC1_WGMXCCGn1
    SolutionIndex: 46
    SolutionNameMin: Cijk_Alik_Bjlk_B8NF8NS_BH_Bias_HAS_SAV_UserArgs_MT128x256x128_MI16x16x1_SN_LDSB1_CLR1_GRVWA8_GRVWB16_GSU0_GSUC0_GSUWGMRR0_K1_LBSPPA512_LBSPPB2048_LPA8_LPB0_LRVW8_MIWT4_8_PLR1_SU0_SUM0_SUS128_VWA4_VWB8_WGM8_WGMXCC1_WGMXCCGn1
    SolutionIndex: 47
    SolutionNameMin: Cijk_Alik_Bjlk_B8NF8NS_BH_Bias_HAS_SAV_UserArgs_MT256x128x128_MI16x16x1_SN_LDSB1_CLR1_GRVWA8_GRVWB16_GSU0_GSUC0_GSUWGMRR0_K1_LBSPPA1024_LBSPPB1024_LPA8_LPB64_LRVW8_MIWT8_4_PLR1_SU0_SUM0_SUS128_VWA8_VWB4_WGM1_WGMXCC1_WGMXCCGn1
    SolutionIndex: 48
    SolutionNameMin: Cijk_Alik_Bjlk_B8NF8NS_BH_Bias_HAS_SAV_UserArgs_MT256x128x128_MI16x16x1_SN_LDSB1_CLR1_GRVWA8_GRVWB16_GSU0_GSUC0_GSUWGMRR0_K1_LBSPPA1024_LBSPPB1024_LPA8_LPB64_LRVW8_MIWT8_4_PLR1_SU0_SUM0_SUS128_VWA8_VWB4_WGM4_WGMXCC1_WGMXCCGn1
    SolutionIndex: 49
    SolutionNameMin: Cijk_Alik_Bjlk_B8NF8NS_BH_Bias_HAS_SAV_UserArgs_MT256x128x128_MI16x16x1_SN_LDSB1_CLR1_GRVWA16_GRVWB16_GSU0_GSUC0_GSUWGMRR0_K1_LBSPPA1024_LBSPPB1024_LPA16_LPB64_LRVW8_MIWT8_4_PLR1_SU0_SUM0_SUS128_VWA8_VWB4_WGM4_WGMXCC1_WGMXCCGn1
    SolutionIndex: 50
    SolutionNameMin: Cijk_Alik_Bjlk_B8NF8NS_BH_Bias_HAS_SAV_UserArgs_MT256x128x128_MI16x16x1_SN_LDSB1_CLR1_GRVWA8_GRVWB16_GSU0_GSUC0_GSUWGMRR0_K1_LBSPPA1024_LBSPPB1024_LPA8_LPB64_LRVW8_MIWT8_4_PLR1_SU0_SUM0_SUS128_VWA8_VWB4_WGM8_WGMXCC1_WGMXCCGn1
    SolutionIndex: 51
    SolutionNameMin: Cijk_Alik_Bjlk_B8NF8NS_BH_Bias_HAS_SAV_UserArgs_MT144x256x128_MI16x16x1_SN_LDSB1_CLR1_GRVWA8_GRVWB16_GSU0_GSUC0_GSUWGMRR0_K1_LBSPPA128_LBSPPB2048_LPA8_LPB64_LRVW8_MIWT9_4_PLR1_SU0_SUM0_SUS128_VWA1_VWB4_WGM4_WGMXCC1_WGMXCCGn1
    SolutionIndex: 52
    SolutionNameMin: Cijk_Alik_Bjlk_B8NF8NS_BH_Bias_HAS_SAV_UserArgs_MT144x256x128_MI16x16x1_SN_LDSB1_CLR1_GRVWA8_GRVWB16_GSU0_GSUC0_GSUWGMRR0_K1_LBSPPA128_LBSPPB2048_LPA8_LPB64_LRVW8_MIWT9_4_PLR1_SU0_SUM0_SUS128_VWA1_VWB4_WGM6_WGMXCC1_WGMXCCGn1
    SolutionIndex: 53
    SolutionNameMin: Cijk_Alik_Bjlk_B8NF8NS_BH_Bias_HAS_SAV_UserArgs_MT144x256x128_MI16x16x1_SN_LDSB1_CLR1_GRVWA8_GRVWB16_GSU0_GSUC0_GSUWGMRR0_K1_LBSPPA128_LBSPPB2048_LPA8_LPB64_LRVW8_MIWT9_4_PLR1_SU0_SUM0_SUS128_VWA1_VWB4_WGM8_WGMXCC1_WGMXCCGn1
    SolutionIndex: 54
    SolutionNameMin: Cijk_Alik_Bjlk_B8NF8NS_BH_Bias_HAS_SAV_UserArgs_MT144x128x128_MI16x16x1_SN_LDSB1_CLR1_GRVWA8_GRVWB16_GSU0_GSUC0_GSUWGMRR0_K1_LBSPPA128_LBSPPB1024_LPA8_LPB32_LRVW8_MIWT9_2_PLR1_SU0_SUM0_SUS128_VWA1_VWB2_WGM6_WGMXCC1_WGMXCCGn1
    SolutionIndex: 55
    SolutionNameMin: Cijk_Alik_Bjlk_B8NF8NS_BH_Bias_HAS_SAV_UserArgs_MT144x128x128_MI16x16x1_SN_LDSB1_CLR1_GRVWA8_GRVWB16_GSU0_GSUC0_GSUWGMRR0_K1_LBSPPA128_LBSPPB1024_LPA8_LPB32_LRVW8_MIWT9_2_PLR1_SU0_SUM0_SUS128_VWA1_VWB2_WGM8_WGMXCC1_WGMXCCGn1
    SolutionIndex: 56
    SolutionNameMin: Cijk_Alik_Bjlk_B8NF8NS_BH_Bias_HAS_SAV_UserArgs_MT128x128x128_MI16x16x1_SN_LDSB1_CLR1_GRVWA16_GRVWB8_GSU0_GSUC0_GSUWGMRR0_K1_LBSPPA512_LBSPPB1024_LPA16_LPB64_LRVW8_MIWT4_4_PLR1_SU0_SUM0_SUS128_VWA4_VWB4_WGM1_WGMXCC1_WGMXCCGn1
    SolutionIndex: 57
    SolutionNameMin: Cijk_Alik_Bjlk_B8NF8NS_BH_Bias_HAS_SAV_UserArgs_MT128x128x128_MI16x16x1_SN_LDSB1_CLR1_GRVWA16_GRVWB16_GSU0_GSUC0_GSUWGMRR0_K1_LBSPPA512_LBSPPB1024_LPA16_LPB64_LRVW8_MIWT4_4_PLR1_SU0_SUM0_SUS128_VWA4_VWB4_WGM1_WGMXCC1_WGMXCCGn1
    SolutionIndex: 58
    SolutionNameMin: Cijk_Alik_Bjlk_B8NF8NS_BH_Bias_HAS_SAV_UserArgs_MT128x128x128_MI16x16x1_SN_LDSB1_CLR1_GRVWA16_GRVWB16_GSU0_GSUC0_GSUWGMRR0_K1_LBSPPA512_LBSPPB1024_LPA16_LPB64_LRVW8_MIWT4_4_PLR1_SU0_SUM0_SUS128_VWA4_VWB4_WGM4_WGMXCC1_WGMXCCGn1
    SolutionIndex: 59
    SolutionNameMin: Cijk_Alik_Bjlk_B8NF8NS_BH_Bias_HAS_SAV_UserArgs_MT128x128x128_MI16x16x1_SN_LDSB1_CLR1_GRVWA16_GRVWB16_GSU0_GSUC0_GSUWGMRR0_K1_LBSPPA512_LBSPPB1024_LPA16_LPB64_LRVW8_MIWT4_4_PLR1_SU0_SUM0_SUS128_VWA4_VWB4_WGM6_WGMXCC1_WGMXCCGn1
    SolutionIndex: 60
    SolutionNameMin: Cijk_Alik_Bjlk_B8NF8NS_BH_Bias_HAS_SAV_UserArgs_MT128x128x128_MI16x16x1_SN_LDSB1_CLR1_GRVWA16_GRVWB16_GSU0_GSUC0_GSUWGMRR0_K1_LBSPPA512_LBSPPB1024_LPA16_LPB64_LRVW8_MIWT4_4_PLR1_SU0_SUM0_SUS128_VWA4_VWB4_WGM8_WGMXCC1_WGMXCCGn1
    SolutionIndex: 61
    SolutionNameMin: Cijk_Alik_Bjlk_B8NF8NS_BH_Bias_HAS_SAV_UserArgs_MT64x128x128_MI16x16x1_SN_LDSB1_CLR1_GRVWA8_GRVWB16_GSU0_GSUC0_GSUWGMRR0_K1_LBSPPA256_LBSPPB1024_LPA8_LPB64_LRVW8_MIWT2_4_PLR1_SU0_SUM0_SUS128_VWA2_VWB4_WGM1_WGMXCC1_WGMXCCGn1
    SolutionIndex: 62
    SolutionNameMin: Cijk_Alik_Bjlk_B8NF8NS_BH_Bias_HAS_SAV_UserArgs_MT128x64x128_MI16x16x1_SN_LDSB1_CLR1_GRVWA8_GRVWB8_GSU0_GSUC0_GSUWGMRR0_K1_LBSPPA512_LBSPPB512_LPA8_LPB32_LRVW8_MIWT4_2_PLR1_SU0_SUM0_SUS128_VWA4_VWB2_WGM1_WGMXCC1_WGMXCCGn1
    SolutionIndex: 63
    SolutionNameMin: Cijk_Alik_Bjlk_B8NF8NS_BH_Bias_HAS_SAV_UserArgs_MT64x64x128_MI16x16x1_SN_LDSB1_CLR1_GRVWA16_GRVWB8_GSU0_GSUC0_GSUWGMRR0_K1_LBSPPA256_LBSPPB512_LPA16_LPB32_LRVW8_MIWT2_2_PLR1_SU0_SUM0_SUS128_VWA2_VWB2_WGM1_WGMXCC1_WGMXCCGn1
    SolutionIndex: 64
    SolutionNameMin: Cijk_Alik_Bjlk_B8NF8NS_BH_Bias_HAS_SAV_UserArgs_MT64x64x128_MI16x16x1_SN_LDSB1_CLR1_GRVWA8_GRVWB16_GSU0_GSUC0_GSUWGMRR0_K1_LBSPPA256_LBSPPB512_LPA8_LPB32_LRVW8_MIWT2_2_PLR1_SU0_SUM0_SUS128_VWA2_VWB2_WGM1_WGMXCC1_WGMXCCGn1
    SolutionIndex: 65
    SolutionNameMin: Cijk_Alik_Bjlk_B8NF8NS_BH_Bias_HAS_SAV_UserArgs_MT64x64x128_MI16x16x1_SN_LDSB1_CLR1_GRVWA16_GRVWB16_GSU0_GSUC0_GSUWGMRR0_K1_LBSPPA256_LBSPPB512_LPA16_LPB32_LRVW8_MIWT2_2_PLR1_SU0_SUM0_SUS128_VWA2_VWB2_WGM1_WGMXCC1_WGMXCCGn1
    SolutionIndex: 66
    SolutionNameMin: Cijk_Alik_Bjlk_B8NF8NS_BH_Bias_HAS_SAV_UserArgs_MT32x64x128_MI16x16x1_SN_LDSB0_CLR1_GRVWA16_GRVWB8_GSU0_GSUC0_GSUWGMRR0_K1_LBSPPA128_LBSPPB512_LPA16_LPB32_LRVW8_MIWT1_2_PLR1_SU0_SUM0_SUS128_VWA1_VWB2_WGM1_WGMXCC1_WGMXCCGn1
    SolutionIndex: 67
    SolutionNameMin: Cijk_Alik_Bjlk_B8NF8NS_BH_Bias_HAS_SAV_UserArgs_MT32x64x128_MI16x16x1_SN_LDSB0_CLR1_GRVWA8_GRVWB16_GSU0_GSUC0_GSUWGMRR0_K1_LBSPPA128_LBSPPB512_LPA8_LPB32_LRVW8_MIWT1_2_PLR1_SU0_SUM0_SUS128_VWA1_VWB2_WGM4_WGMXCC1_WGMXCCGn1
    SolutionIndex: 68
    SolutionNameMin: Cijk_Alik_Bjlk_B8NF8NS_BH_Bias_HAS_SAV_UserArgs_MT64x32x128_MI16x16x1_SN_LDSB0_CLR1_GRVWA8_GRVWB8_GSU0_GSUC0_GSUWGMRR0_K1_LBSPPA256_LBSPPB256_LPA8_LPB16_LRVW8_MIWT2_1_PLR1_SU0_SUM0_SUS128_VWA2_VWB1_WGM1_WGMXCC1_WGMXCCGn1
    SolutionIndex: 69
    SolutionNameMin: Cijk_Alik_Bjlk_B8NF8NS_BH_Bias_HAS_SAV_UserArgs_MT64x32x128_MI16x16x1_SN_LDSB0_CLR1_GRVWA16_GRVWB8_GSU0_GSUC0_GSUWGMRR0_K1_LBSPPA256_LBSPPB256_LPA16_LPB16_LRVW8_MIWT2_1_PLR1_SU0_SUM0_SUS128_VWA2_VWB1_WGM1_WGMXCC1_WGMXCCGn1
    SolutionIndex: 70
    SolutionNameMin: Cijk_Alik_Bjlk_B8NF8NS_BH_Bias_HAS_SAV_UserArgs_MT64x32x128_MI16x16x1_SN_LDSB0_CLR1_GRVWA8_GRVWB16_GSU0_GSUC0_GSUWGMRR0_K1_LBSPPA256_LBSPPB256_LPA8_LPB16_LRVW8_MIWT2_1_PLR1_SU0_SUM0_SUS128_VWA2_VWB1_WGM1_WGMXCC1_WGMXCCGn1
    SolutionIndex: 71
    SolutionNameMin: Cijk_Alik_Bjlk_B8NF8NS_BH_Bias_HAS_SAV_UserArgs_MT64x32x128_MI16x16x1_SN_LDSB0_CLR1_GRVWA16_GRVWB16_GSU0_GSUC0_GSUWGMRR0_K1_LBSPPA256_LBSPPB256_LPA16_LPB16_LRVW8_MIWT2_1_PLR1_SU0_SUM0_SUS128_VWA2_VWB1_WGM1_WGMXCC1_WGMXCCGn1
    SolutionIndex: 72
    SolutionNameMin: Cijk_Alik_Bjlk_B8NF8NS_BH_Bias_HAS_SAV_UserArgs_MT64x32x128_MI16x16x1_SN_LDSB0_CLR1_GRVWA8_GRVWB16_GSU0_GSUC0_GSUWGMRR0_K1_LBSPPA256_LBSPPB256_LPA8_LPB16_LRVW8_MIWT2_1_PLR1_SU0_SUM0_SUS128_VWA2_VWB1_WGM4_WGMXCC1_WGMXCCGn1
    SolutionIndex: 73
    SolutionNameMin: Cijk_Alik_Bjlk_B8NF8NS_BH_Bias_HAS_SAV_UserArgs_MT64x32x128_MI16x16x1_SN_LDSB0_CLR1_GRVWA8_GRVWB16_GSU0_GSUC0_GSUWGMRR0_K1_LBSPPA256_LBSPPB256_LPA8_LPB16_LRVW8_MIWT2_1_PLR1_SU0_SUM0_SUS128_VWA2_VWB1_WGM8_WGMXCC1_WGMXCCGn1
    SolutionIndex: 74
    SolutionNameMin: Cijk_Alik_Bjlk_B8NF8NS_BH_Bias_HAS_SAV_UserArgs_MT32x32x128_MI16x16x1_SN_LDSB0_CLR1_GRVWA8_GRVWB8_GSU0_GSUC0_GSUWGMRR0_K1_LBSPPA128_LBSPPB256_LPA8_LPB16_LRVW8_MIWT1_1_PLR1_SU0_SUM0_SUS128_VWA1_VWB1_WGM1_WGMXCC1_WGMXCCGn1
    SolutionIndex: 75
    SolutionNameMin: Cijk_Alik_Bjlk_B8NF8NS_BH_Bias_HAS_SAV_UserArgs_MT32x32x128_MI16x16x1_SN_LDSB0_CLR1_GRVWA16_GRVWB8_GSU0_GSUC0_GSUWGMRR0_K1_LBSPPA128_LBSPPB256_LPA16_LPB16_LRVW8_MIWT1_1_PLR1_SU0_SUM0_SUS128_VWA1_VWB1_WGM1_WGMXCC1_WGMXCCGn1
    SolutionIndex: 76
    SolutionNameMin: Cijk_Alik_Bjlk_B8NF8NS_BH_Bias_HAS_SAV_UserArgs_MT32x32x128_MI16x16x1_SN_LDSB0_CLR1_GRVWA8_GRVWB16_GSU0_GSUC0_GSUWGMRR0_K1_LBSPPA128_LBSPPB256_LPA8_LPB16_LRVW8_MIWT1_1_PLR1_SU0_SUM0_SUS128_VWA1_VWB1_WGM1_WGMXCC1_WGMXCCGn1
    SolutionIndex: 77
    SolutionNameMin: Cijk_Alik_Bjlk_B8NF8NS_BH_Bias_HAS_SAV_UserArgs_MT32x32x128_MI16x16x1_SN_LDSB0_CLR1_GRVWA16_GRVWB16_GSU0_GSUC0_GSUWGMRR0_K1_LBSPPA128_LBSPPB256_LPA16_LPB16_LRVW8_MIWT1_1_PLR1_SU0_SUM0_SUS128_VWA1_VWB1_WGM1_WGMXCC1_WGMXCCGn1
    SolutionIndex: 78
    SolutionNameMin: Cijk_Alik_Bjlk_B8NF8NS_BH_Bias_HAS_SAV_UserArgs_MT32x32x128_MI16x16x1_SN_LDSB0_CLR1_GRVWA8_GRVWB16_GSU0_GSUC0_GSUWGMRR0_K1_LBSPPA128_LBSPPB256_LPA8_LPB16_LRVW8_MIWT1_1_PLR1_SU0_SUM0_SUS128_VWA1_VWB1_WGM4_WGMXCC1_WGMXCCGn1
    SolutionIndex: 79
    SolutionNameMin: Cijk_Alik_Bjlk_B8NF8NS_BH_Bias_HAS_SAV_UserArgs_MT32x32x128_MI16x16x1_SN_LDSB0_CLR1_GRVWA8_GRVWB16_GSU0_GSUC0_GSUWGMRR0_K1_LBSPPA128_LBSPPB256_LPA8_LPB16_LRVW8_MIWT1_1_PLR1_SU0_SUM0_SUS128_VWA1_VWB1_WGM8_WGMXCC1_WGMXCCGn1
    SolutionIndex: 80
    SolutionNameMin: Cijk_Alik_Bjlk_B8NF8NS_BH_Bias_HAS_SAV_UserArgs_MT128x64x256_MI16x16x1_SN_LDSB1_CLR1_GRVWA16_GRVWB16_GSU0_GSUC0_GSUWGMRR0_K1_LBSPPA1024_LBSPPB512_LPA16_LPB32_LRVW8_MIWT4_2_PLR1_SU0_SUM0_SUS256_VWA4_VWB2_WGM1_WGMXCC1_WGMXCCGn1
    SolutionIndex: 81
    SolutionNameMin: Cijk_Alik_Bjlk_B8NF8NS_BH_Bias_HAS_SAV_UserArgs_MT128x64x256_MI16x16x1_SN_LDSB1_CLR1_GRVWA16_GRVWB16_GSU0_GSUC0_GSUWGMRR0_K1_LBSPPA1024_LBSPPB512_LPA16_LPB32_LRVW8_MIWT4_2_PLR1_SU0_SUM0_SUS256_VWA4_VWB2_WGM4_WGMXCC1_WGMXCCGn1
    SolutionIndex: 82
    SolutionNameMin: Cijk_Alik_Bjlk_B8NF8NS_BH_Bias_HAS_SAV_UserArgs_MT128x64x256_MI16x16x1_SN_LDSB1_CLR1_GRVWA16_GRVWB16_GSU0_GSUC0_GSUWGMRR0_K1_LBSPPA1024_LBSPPB512_LPA16_LPB32_LRVW8_MIWT4_2_PLR1_SU0_SUM0_SUS256_VWA4_VWB2_WGM6_WGMXCC1_WGMXCCGn1
    SolutionIndex: 83
    SolutionNameMin: Cijk_Alik_Bjlk_B8NF8NS_BH_Bias_HAS_SAV_UserArgs_MT128x64x256_MI16x16x1_SN_LDSB1_CLR1_GRVWA16_GRVWB16_GSU0_GSUC0_GSUWGMRR0_K1_LBSPPA1024_LBSPPB512_LPA16_LPB32_LRVW8_MIWT4_2_PLR1_SU0_SUM0_SUS256_VWA4_VWB2_WGM8_WGMXCC1_WGMXCCGn1
    SolutionIndex: 84
    SolutionNameMin: Cijk_Alik_Bjlk_B8NF8NS_BH_Bias_HAS_SAV_UserArgs_MT64x64x256_MI16x16x1_SN_LDSB1_CLR1_GRVWA16_GRVWB16_GSU0_GSUC0_GSUWGMRR0_K1_LBSPPA512_LBSPPB512_LPA16_LPB32_LRVW8_MIWT2_2_PLR1_SU0_SUM0_SUS256_VWA2_VWB2_WGM1_WGMXCC1_WGMXCCGn1
    SolutionIndex: 85
    SolutionNameMin: Cijk_Alik_Bjlk_B8NF8NS_BH_Bias_HAS_SAV_UserArgs_MT64x64x256_MI16x16x1_SN_LDSB1_CLR1_GRVWA16_GRVWB16_GSU0_GSUC0_GSUWGMRR0_K1_LBSPPA512_LBSPPB512_LPA16_LPB32_LRVW8_MIWT2_2_PLR1_SU0_SUM0_SUS256_VWA2_VWB2_WGM4_WGMXCC1_WGMXCCGn1
    SolutionIndex: 86
    SolutionNameMin: Cijk_Alik_Bjlk_B8NF8NS_BH_Bias_HAS_SAV_UserArgs_MT64x64x256_MI16x16x1_SN_LDSB1_CLR1_GRVWA16_GRVWB16_GSU0_GSUC0_GSUWGMRR0_K1_LBSPPA512_LBSPPB512_LPA16_LPB32_LRVW8_MIWT2_2_PLR1_SU0_SUM0_SUS256_VWA2_VWB2_WGM6_WGMXCC1_WGMXCCGn1
    SolutionIndex: 87
    SolutionNameMin: Cijk_Alik_Bjlk_B8NF8NS_BH_Bias_HAS_SAV_UserArgs_MT64x64x256_MI16x16x1_SN_LDSB1_CLR1_GRVWA16_GRVWB16_GSU0_GSUC0_GSUWGMRR0_K1_LBSPPA512_LBSPPB512_LPA16_LPB32_LRVW8_MIWT2_2_PLR1_SU0_SUM0_SUS256_VWA2_VWB2_WGM8_WGMXCC1_WGMXCCGn1
    SolutionIndex: 88
    SolutionNameMin: Cijk_Alik_Bjlk_B8NF8NS_BH_Bias_HAS_SAV_UserArgs_MT32x64x256_MI16x16x1_SN_LDSB1_CLR1_GRVWA8_GRVWB16_GSU0_GSUC0_GSUWGMRR0_K1_LBSPPA256_LBSPPB512_LPA8_LPB32_LRVW8_MIWT1_2_PLR1_SU0_SUM0_SUS256_VWA1_VWB2_WGM1_WGMXCC1_WGMXCCGn1
    SolutionIndex: 89
    SolutionNameMin: Cijk_Alik_Bjlk_B8NF8NS_BH_Bias_HAS_SAV_UserArgs_MT32x64x256_MI16x16x1_SN_LDSB1_CLR1_GRVWA16_GRVWB16_GSU0_GSUC0_GSUWGMRR0_K1_LBSPPA256_LBSPPB512_LPA16_LPB32_LRVW8_MIWT1_2_PLR1_SU0_SUM0_SUS256_VWA1_VWB2_WGM1_WGMXCC1_WGMXCCGn1
    SolutionIndex: 90
    SolutionNameMin: Cijk_Alik_Bjlk_B8NF8NS_BH_Bias_HAS_SAV_UserArgs_MT32x64x256_MI16x16x1_SN_LDSB1_CLR1_GRVWA16_GRVWB16_GSU0_GSUC0_GSUWGMRR0_K1_LBSPPA256_LBSPPB512_LPA16_LPB32_LRVW8_MIWT1_2_PLR1_SU0_SUM0_SUS256_VWA1_VWB2_WGM6_WGMXCC1_WGMXCCGn1
    SolutionIndex: 91
    SolutionNameMin: Cijk_Alik_Bjlk_B8NF8NS_BH_Bias_HAS_SAV_UserArgs_MT32x64x256_MI16x16x1_SN_LDSB1_CLR1_GRVWA8_GRVWB16_GSU0_GSUC0_GSUWGMRR0_K1_LBSPPA256_LBSPPB512_LPA8_LPB32_LRVW8_MIWT1_2_PLR1_SU0_SUM0_SUS256_VWA1_VWB2_WGM8_WGMXCC1_WGMXCCGn1
    SolutionIndex: 92
    SolutionNameMin: Cijk_Alik_Bjlk_B8NF8NS_BH_Bias_HAS_SAV_UserArgs_MT64x32x256_MI16x16x1_SN_LDSB1_CLR1_GRVWA16_GRVWB16_GSU0_GSUC0_GSUWGMRR0_K1_LBSPPA512_LBSPPB256_LPA16_LPB16_LRVW8_MIWT2_1_PLR1_SU0_SUM0_SUS256_VWA2_VWB1_WGM8_WGMXCC1_WGMXCCGn1
    SolutionIndex: 93
    SolutionNameMin: Cijk_Alik_Bjlk_B8NF8NS_BH_Bias_HAS_SAV_UserArgs_MT32x32x256_MI16x16x1_SN_LDSB1_CLR1_GRVWA8_GRVWB8_GSU0_GSUC0_GSUWGMRR0_K1_LBSPPA256_LBSPPB256_LPA8_LPB16_LRVW8_MIWT1_1_PLR1_SU0_SUM0_SUS256_VWA1_VWB1_WGM1_WGMXCC1_WGMXCCGn1
    SolutionIndex: 94
    SolutionNameMin: Cijk_Alik_Bjlk_B8NF8NS_BH_Bias_HAS_SAV_UserArgs_MT32x32x256_MI16x16x1_SN_LDSB1_CLR1_GRVWA8_GRVWB16_GSU0_GSUC0_GSUWGMRR0_K1_LBSPPA256_LBSPPB256_LPA8_LPB16_LRVW8_MIWT1_1_PLR1_SU0_SUM0_SUS256_VWA1_VWB1_WGM1_WGMXCC1_WGMXCCGn1
    SolutionIndex: 95
    SolutionNameMin: Cijk_Alik_Bjlk_B8NF8NS_BH_Bias_HAS_SAV_UserArgs_MT32x32x256_MI16x16x1_SN_LDSB1_CLR1_GRVWA16_GRVWB16_GSU0_GSUC0_GSUWGMRR0_K1_LBSPPA256_LBSPPB256_LPA16_LPB16_LRVW8_MIWT1_1_PLR1_SU0_SUM0_SUS256_VWA1_VWB1_WGM1_WGMXCC1_WGMXCCGn1
    SolutionIndex: 96
    SolutionNameMin: Cijk_Alik_Bjlk_B8NF8NS_BH_Bias_HAS_SAV_UserArgs_MT32x32x256_MI16x16x1_SN_LDSB1_CLR1_GRVWA8_GRVWB16_GSU0_GSUC0_GSUWGMRR0_K1_LBSPPA256_LBSPPB256_LPA8_LPB16_LRVW8_MIWT1_1_PLR1_SU0_SUM0_SUS256_VWA1_VWB1_WGM6_WGMXCC1_WGMXCCGn1
    SolutionIndex: 97
    SolutionNameMin: Cijk_Alik_Bjlk_B8NF8NS_BH_Bias_HAS_SAV_UserArgs_MT32x32x256_MI16x16x1_SN_LDSB1_CLR1_GRVWA16_GRVWB16_GSU0_GSUC0_GSUWGMRR0_K1_LBSPPA256_LBSPPB256_LPA16_LPB16_LRVW8_MIWT1_1_PLR1_SU0_SUM0_SUS256_VWA1_VWB1_WGM8_WGMXCC1_WGMXCCGn1
- - - [128, 128, 1, 128, 128, 128, 128, 128]
    - [72, 0.49]
  - - [128, 128, 1, 256, 128, 128, 256, 128]
    - [74, 1.0]
  - - [128, 128, 1, 512, 128, 128, 512, 128]
    - [74, 1.72]
  - - [128, 128, 1, 1024, 128, 128, 1024, 128]
    - [74, 2.72]
  - - [128, 128, 1, 2048, 128, 128, 2048, 128]
    - [76, 3.81]
  - - [128, 128, 1, 4096, 128, 128, 4096, 128]
    - [76, 4.79]
  - - [128, 128, 1, 8192, 128, 128, 8192, 128]
    - [78, 5.51]
  - - [128, 256, 1, 128, 128, 128, 128, 256]
    - [74, 1.13]
  - - [128, 256, 1, 256, 128, 128, 256, 256]
    - [74, 2.06]
  - - [128, 256, 1, 512, 128, 128, 512, 256]
    - [75, 3.49]
  - - [128, 256, 1, 1024, 128, 128, 1024, 256]
    - [74, 5.5]
  - - [128, 256, 1, 2048, 128, 128, 2048, 256]
    - [76, 7.7]
  - - [128, 256, 1, 4096, 128, 128, 4096, 256]
    - [74, 9.58]
  - - [128, 256, 1, 8192, 128, 128, 8192, 256]
    - [76, 11.09]
  - - [128, 512, 1, 128, 128, 128, 128, 512]
    - [41, 2.21]
  - - [128, 512, 1, 256, 128, 128, 256, 512]
    - [74, 4.03]
  - - [128, 512, 1, 512, 128, 128, 512, 512]
    - [74, 6.98]
  - - [128, 512, 1, 1024, 128, 128, 1024, 512]
    - [74, 10.88]
  - - [128, 512, 1, 2048, 128, 128, 2048, 512]
    - [76, 15.18]
  - - [128, 512, 1, 4096, 128, 128, 4096, 512]
    - [76, 19.11]
  - - [128, 512, 1, 8192, 128, 128, 8192, 512]
    - [95, 18.47]
  - - [128, 1024, 1, 128, 128, 128, 128, 1024]
    - [74, 4.35]
  - - [128, 1024, 1, 256, 128, 128, 256, 1024]
    - [74, 7.92]
  - - [128, 1024, 1, 512, 128, 128, 512, 1024]
    - [74, 13.68]
  - - [128, 1024, 1, 1024, 128, 128, 1024, 1024]
    - [74, 20.99]
  - - [128, 1024, 1, 2048, 128, 128, 2048, 1024]
    - [76, 29.69]
  - - [128, 1024, 1, 4096, 128, 128, 4096, 1024]
    - [97, 30.71]
  - - [128, 1024, 1, 8192, 128, 128, 8192, 1024]
    - [96, 31.84]
  - - [128, 2048, 1, 128, 128, 128, 128, 2048]
    - [39, 8.05]
  - - [128, 2048, 1, 256, 128, 128, 256, 2048]
    - [66, 14.29]
  - - [128, 2048, 1, 512, 128, 128, 512, 2048]
    - [68, 23.96]
  - - [128, 2048, 1, 1024, 128, 128, 1024, 2048]
    - [70, 37.22]
  - - [128, 2048, 1, 2048, 128, 128, 2048, 2048]
    - [71, 43.74]
  - - [128, 2048, 1, 4096, 128, 128, 4096, 2048]
    - [89, 52.48]
  - - [128, 2048, 1, 8192, 128, 128, 8192, 2048]
    - [89, 59.4]
  - - [128, 4096, 1, 128, 128, 128, 128, 4096]
    - [34, 15.13]
  - - [128, 4096, 1, 256, 128, 128, 256, 4096]
    - [34, 26.75]
  - - [128, 4096, 1, 512, 128, 128, 512, 4096]
    - [64, 43.83]
  - - [128, 4096, 1, 1024, 128, 128, 1024, 4096]
    - [64, 65.59]
  - - [128, 4096, 1, 2048, 128, 128, 2048, 4096]
    - [84, 78.73]
  - - [128, 4096, 1, 4096, 128, 128, 4096, 4096]
    - [84, 96.24]
  - - [128, 4096, 1, 8192, 128, 128, 8192, 4096]
    - [84, 108.75]
  - - [128, 8192, 1, 128, 128, 128, 128, 8192]
    - [22, 26.2]
  - - [128, 8192, 1, 256, 128, 128, 256, 8192]
    - [22, 45.82]
  - - [128, 8192, 1, 512, 128, 128, 512, 8192]
    - [27, 74.02]
  - - [128, 8192, 1, 1024, 128, 128, 1024, 8192]
    - [27, 107.13]
  - - [128, 8192, 1, 2048, 128, 128, 2048, 8192]
    - [80, 123.86]
  - - [128, 8192, 1, 4096, 128, 128, 4096, 8192]
    - [61, 145.64]
  - - [128, 8192, 1, 8192, 128, 128, 8192, 8192]
    - [80, 155.48]
  - - [256, 128, 1, 128, 256, 256, 128, 128]
    - [41, 1.09]
  - - [256, 128, 1, 256, 256, 256, 256, 128]
    - [41, 1.95]
  - - [256, 128, 1, 512, 256, 256, 512, 128]
    - [77, 3.38]
  - - [256, 128, 1, 1024, 256, 256, 1024, 128]
    - [74, 5.37]
  - - [256, 128, 1, 2048, 256, 256, 2048, 128]
    - [76, 7.6]
  - - [256, 128, 1, 4096, 256, 256, 4096, 128]
    - [76, 9.58]
  - - [256, 128, 1, 8192, 256, 256, 8192, 128]
    - [76, 11.01]
  - - [256, 256, 1, 128, 256, 256, 128, 256]
    - [41, 2.07]
  - - [256, 256, 1, 256, 256, 256, 256, 256]
    - [93, 3.81]
  - - [256, 256, 1, 512, 256, 256, 512, 256]
    - [74, 6.71]
  - - [256, 256, 1, 1024, 256, 256, 1024, 256]
    - [74, 10.9]
  - - [256, 256, 1, 2048, 256, 256, 2048, 256]
    - [76, 15.16]
  - - [256, 256, 1, 4096, 256, 256, 4096, 256]
    - [76, 19.16]
  - - [256, 256, 1, 8192, 256, 256, 8192, 256]
    - [78, 21.88]
  - - [256, 512, 1, 128, 256, 256, 128, 512]
    - [74, 4.37]
  - - [256, 512, 1, 256, 256, 256, 256, 512]
    - [75, 7.96]
  - - [256, 512, 1, 512, 256, 256, 512, 512]
    - [74, 13.64]
  - - [256, 512, 1, 1024, 256, 256, 1024, 512]
    - [74, 21.06]
  - - [256, 512, 1, 2048, 256, 256, 2048, 512]
    - [74, 29.73]
  - - [256, 512, 1, 4096, 256, 256, 4096, 512]
    - [76, 37.51]
  - - [256, 512, 1, 8192, 256, 256, 8192, 512]
    - [94, 38.58]
  - - [256, 1024, 1, 128, 256, 256, 128, 1024]
    - [39, 7.87]
  - - [256, 1024, 1, 256, 256, 256, 256, 1024]
    - [69, 14.26]
  - - [256, 1024, 1, 512, 256, 256, 512, 1024]
    - [68, 24.01]
  - - [256, 1024, 1, 1024, 256, 256, 1024, 1024]
    - [70, 37.12]
  - - [256, 1024, 1, 2048, 256, 256, 2048, 1024]
    - [70, 51.19]
  - - [256, 1024, 1, 4096, 256, 256, 4096, 1024]
    - [92, 57.24]
  - - [256, 1024, 1, 8192, 256, 256, 8192, 1024]
    - [90, 59.72]
  - - [256, 2048, 1, 128, 256, 256, 128, 2048]
    - [34, 15.13]
  - - [256, 2048, 1, 256, 256, 256, 256, 2048]
    - [34, 26.48]
  - - [256, 2048, 1, 512, 256, 256, 512, 2048]
    - [63, 43.3]
  - - [256, 2048, 1, 1024, 256, 256, 1024, 2048]
    - [64, 64.81]
  - - [256, 2048, 1, 2048, 256, 256, 2048, 2048]
    - [84, 80.55]
  - - [256, 2048, 1, 4096, 256, 256, 4096, 2048]
    - [84, 96.39]
  - - [256, 2048, 1, 8192, 256, 256, 8192, 2048]
    - [84, 108.27]
  - - [256, 4096, 1, 128, 256, 256, 128, 4096]
    - [25, 26.02]
  - - [256, 4096, 1, 256, 256, 256, 256, 4096]
    - [26, 45.22]
  - - [256, 4096, 1, 512, 256, 256, 512, 4096]
    - [27, 73.43]
  - - [256, 4096, 1, 1024, 256, 256, 1024, 4096]
    - [27, 107.08]
  - - [256, 4096, 1, 2048, 256, 256, 2048, 4096]
    - [80, 126.07]
  - - [256, 4096, 1, 4096, 256, 256, 4096, 4096]
    - [80, 150.95]
  - - [256, 4096, 1, 8192, 256, 256, 8192, 4096]
    - [82, 163.4]
  - - [256, 8192, 1, 128, 256, 256, 128, 8192]
    - [23, 41.04]
  - - [256, 8192, 1, 256, 256, 256, 256, 8192]
    - [57, 70.05]
  - - [256, 8192, 1, 512, 256, 256, 512, 8192]
    - [57, 111.04]
  - - [256, 8192, 1, 1024, 256, 256, 1024, 8192]
    - [57, 160.93]
  - - [256, 8192, 1, 2048, 256, 256, 2048, 8192]
    - [57, 188.61]
  - - [256, 8192, 1, 4096, 256, 256, 4096, 8192]
    - [57, 214.99]
  - - [256, 8192, 1, 8192, 256, 256, 8192, 8192]
    - [58, 203.96]
  - - [512, 128, 1, 128, 512, 512, 128, 128]
    - [41, 2.2]
  - - [512, 128, 1, 256, 512, 512, 256, 128]
    - [41, 3.99]
  - - [512, 128, 1, 512, 512, 512, 512, 128]
    - [74, 6.89]
  - - [512, 128, 1, 1024, 512, 512, 1024, 128]
    - [76, 10.81]
  - - [512, 128, 1, 2048, 512, 512, 2048, 128]
    - [74, 15.04]
  - - [512, 128, 1, 4096, 512, 512, 4096, 128]
    - [76, 19.14]
  - - [512, 128, 1, 8192, 512, 512, 8192, 128]
    - [76, 21.95]
  - - [512, 256, 1, 128, 512, 512, 128, 256]
    - [74, 4.39]
  - - [512, 256, 1, 256, 512, 512, 256, 256]
    - [74, 7.92]
  - - [512, 256, 1, 512, 512, 512, 512, 256]
    - [74, 13.44]
  - - [512, 256, 1, 1024, 512, 512, 1024, 256]
    - [74, 21.65]
  - - [512, 256, 1, 2048, 512, 512, 2048, 256]
    - [76, 30.19]
  - - [512, 256, 1, 4096, 512, 512, 4096, 256]
    - [76, 37.9]
  - - [512, 256, 1, 8192, 512, 512, 8192, 256]
    - [79, 43.1]
  - - [512, 512, 1, 128, 512, 512, 128, 512]
    - [69, 8.17]
  - - [512, 512, 1, 256, 512, 512, 256, 512]
    - [38, 14.69]
  - - [512, 512, 1, 512, 512, 512, 512, 512]
    - [69, 25.04]
  - - [512, 512, 1, 1024, 512, 512, 1024, 512]
    - [68, 37.56]
  - - [512, 512, 1, 2048, 512, 512, 2048, 512]
    - [70, 52.18]
  - - [512, 512, 1, 4096, 512, 512, 4096, 512]
    - [73, 63.07]
  - - [512, 512, 1, 8192, 512, 512, 8192, 512]
    - [67, 64.14]
  - - [512, 1024, 1, 128, 512, 512, 128, 1024]
    - [34, 15.06]
  - - [512, 1024, 1, 256, 512, 512, 256, 1024]
    - [33, 26.53]
  - - [512, 1024, 1, 512, 512, 512, 512, 1024]
    - [63, 43.04]
  - - [512, 1024, 1, 1024, 512, 512, 1024, 1024]
    - [84, 63.83]
  - - [512, 1024, 1, 2048, 512, 512, 2048, 1024]
    - [84, 87.01]
  - - [512, 1024, 1, 4096, 512, 512, 4096, 1024]
    - [84, 97.39]
  - - [512, 1024, 1, 8192, 512, 512, 8192, 1024]
    - [86, 107.5]
  - - [512, 2048, 1, 128, 512, 512, 128, 2048]
    - [22, 25.88]
  - - [512, 2048, 1, 256, 512, 512, 256, 2048]
    - [26, 44.89]
  - - [512, 2048, 1, 512, 512, 512, 512, 2048]
    - [27, 72.46]
  - - [512, 2048, 1, 1024, 512, 512, 1024, 2048]
    - [27, 106.12]
  - - [512, 2048, 1, 2048, 512, 512, 2048, 2048]
    - [80, 127.65]
  - - [512, 2048, 1, 4096, 512, 512, 4096, 2048]
    - [80, 151.68]
  - - [512, 2048, 1, 8192, 512, 512, 8192, 2048]
    - [81, 162.43]
  - - [512, 4096, 1, 128, 512, 512, 128, 4096]
    - [23, 40.37]
  - - [512, 4096, 1, 256, 512, 512, 256, 4096]
    - [20, 69.61]
  - - [512, 4096, 1, 512, 512, 512, 512, 4096]
    - [57, 110.34]
  - - [512, 4096, 1, 1024, 512, 512, 1024, 4096]
    - [57, 159.16]
  - - [512, 4096, 1, 2048, 512, 512, 2048, 4096]
    - [57, 193.24]
  - - [512, 4096, 1, 4096, 512, 512, 4096, 4096]
    - [57, 224.9]
  - - [512, 4096, 1, 8192, 512, 512, 8192, 4096]
    - [57, 208.78]
  - - [512, 8192, 1, 128, 512, 512, 128, 8192]
    - [16, 58.01]
  - - [512, 8192, 1, 256, 512, 512, 256, 8192]
    - [14, 99.6]
  - - [512, 8192, 1, 512, 512, 512, 512, 8192]
    - [13, 157.18]
  - - [512, 8192, 1, 1024, 512, 512, 1024, 8192]
    - [15, 219.01]
  - - [512, 8192, 1, 2048, 512, 512, 2048, 8192]
    - [42, 247.97]
  - - [512, 8192, 1, 4096, 512, 512, 4096, 8192]
    - [47, 266.39]
  - - [512, 8192, 1, 8192, 512, 512, 8192, 8192]
    - [42, 238.75]
  - - [1024, 128, 1, 128, 1024, 1024, 128, 128]
    - [41, 4.34]
  - - [1024, 128, 1, 256, 1024, 1024, 256, 128]
    - [75, 7.75]
  - - [1024, 128, 1, 512, 1024, 1024, 512, 128]
    - [74, 13.36]
  - - [1024, 128, 1, 1024, 1024, 1024, 1024, 128]
    - [74, 21.21]
  - - [1024, 128, 1, 2048, 1024, 1024, 2048, 128]
    - [76, 29.93]
  - - [1024, 128, 1, 4096, 1024, 1024, 4096, 128]
    - [76, 37.77]
  - - [1024, 128, 1, 8192, 1024, 1024, 8192, 128]
    - [78, 43.08]
  - - [1024, 256, 1, 128, 1024, 1024, 128, 256]
    - [38, 8.27]
  - - [1024, 256, 1, 256, 1024, 1024, 256, 256]
    - [69, 14.74]
  - - [1024, 256, 1, 512, 1024, 1024, 512, 256]
    - [69, 24.67]
  - - [1024, 256, 1, 1024, 1024, 1024, 1024, 256]
    - [70, 38.07]
  - - [1024, 256, 1, 2048, 1024, 1024, 2048, 256]
    - [70, 52.18]
  - - [1024, 256, 1, 4096, 1024, 1024, 4096, 256]
    - [73, 63.28]
  - - [1024, 256, 1, 8192, 1024, 1024, 8192, 256]
    - [91, 71.27]
  - - [1024, 512, 1, 128, 1024, 1024, 128, 512]
    - [34, 15.11]
  - - [1024, 512, 1, 256, 1024, 1024, 256, 512]
    - [33, 26.78]
  - - [1024, 512, 1, 512, 1024, 1024, 512, 512]
    - [64, 43.54]
  - - [1024, 512, 1, 1024, 1024, 1024, 1024, 512]
    - [65, 64.81]
  - - [1024, 512, 1, 2048, 1024, 1024, 2048, 512]
    - [84, 86.91]
  - - [1024, 512, 1, 4096, 1024, 1024, 4096, 512]
    - [87, 105.17]
  - - [1024, 512, 1, 8192, 1024, 1024, 8192, 512]
    - [87, 108.05]
  - - [1024, 1024, 1, 128, 1024, 1024, 128, 1024]
    - [26, 26.06]
  - - [1024, 1024, 1, 256, 1024, 1024, 256, 1024]
    - [26, 45.68]
  - - [1024, 1024, 1, 512, 1024, 1024, 512, 1024]
    - [27, 73.08]
  - - [1024, 1024, 1, 1024, 1024, 1024, 1024, 1024]
    - [27, 105.88]
  - - [1024, 1024, 1, 2048, 1024, 1024, 2048, 1024]
    - [31, 135.91]
  - - [1024, 1024, 1, 4096, 1024, 1024, 4096, 1024]
    - [81, 148.07]
  - - [1024, 1024, 1, 8192, 1024, 1024, 8192, 1024]
    - [82, 160.33]
  - - [1024, 2048, 1, 128, 1024, 1024, 128, 2048]
    - [23, 41.02]
  - - [1024, 2048, 1, 256, 1024, 1024, 256, 2048]
    - [23, 70.61]
  - - [1024, 2048, 1, 512, 1024, 1024, 512, 2048]
    - [57, 110.92]
  - - [1024, 2048, 1, 1024, 1024, 1024, 1024, 2048]
    - [57, 160.57]
  - - [1024, 2048, 1, 2048, 1024, 1024, 2048, 2048]
    - [57, 194.94]
  - - [1024, 2048, 1, 4096, 1024, 1024, 4096, 2048]
    - [58, 222.85]
  - - [1024, 2048, 1, 8192, 1024, 1024, 8192, 2048]
    - [59, 203.03]
  - - [1024, 4096, 1, 128, 1024, 1024, 128, 4096]
    - [14, 58.71]
  - - [1024, 4096, 1, 256, 1024, 1024, 256, 4096]
    - [13, 99.63]
  - - [1024, 4096, 1, 512, 1024, 1024, 512, 4096]
    - [15, 156.08]
  - - [1024, 4096, 1, 1024, 1024, 1024, 1024, 4096]
    - [15, 215.08]
  - - [1024, 4096, 1, 2048, 1024, 1024, 2048, 4096]
    - [47, 254.83]
  - - [1024, 4096, 1, 4096, 1024, 1024, 4096, 4096]
    - [42, 262.61]
  - - [1024, 4096, 1, 8192, 1024, 1024, 8192, 4096]
    - [42, 239.24]
  - - [1024, 8192, 1, 128, 1024, 1024, 128, 8192]
    - [7, 74.22]
  - - [1024, 8192, 1, 256, 1024, 1024, 256, 8192]
    - [7, 123.96]
  - - [1024, 8192, 1, 512, 1024, 1024, 512, 8192]
    - [1, 184.56]
  - - [1024, 8192, 1, 1024, 1024, 1024, 1024, 8192]
    - [3, 244.33]
  - - [1024, 8192, 1, 2048, 1024, 1024, 2048, 8192]
    - [7, 281.32]
  - - [1024, 8192, 1, 4096, 1024, 1024, 4096, 8192]
    - [3, 268.33]
  - - [1024, 8192, 1, 8192, 1024, 1024, 8192, 8192]
    - [3, 282.93]
  - - [2048, 128, 1, 128, 2048, 2048, 128, 128]
    - [21, 4.97]
  - - [2048, 128, 1, 256, 2048, 2048, 256, 128]
    - [62, 9.63]
  - - [2048, 128, 1, 512, 2048, 2048, 512, 128]
    - [37, 18.38]
  - - [2048, 128, 1, 1024, 2048, 2048, 1024, 128]
    - [40, 34.07]
  - - [2048, 128, 1, 2048, 2048, 2048, 2048, 128]
    - [70, 51.25]
  - - [2048, 128, 1, 4096, 2048, 2048, 4096, 128]
    - [73, 62.7]
  - - [2048, 128, 1, 8192, 2048, 2048, 8192, 128]
    - [88, 70.52]
  - - [2048, 256, 1, 128, 2048, 2048, 128, 256]
    - [22, 10.03]
  - - [2048, 256, 1, 256, 2048, 2048, 256, 256]
    - [25, 18.69]
  - - [2048, 256, 1, 512, 2048, 2048, 512, 256]
    - [36, 40.71]
  - - [2048, 256, 1, 1024, 2048, 2048, 1024, 256]
    - [35, 61.49]
  - - [2048, 256, 1, 2048, 2048, 2048, 2048, 256]
    - [84, 86.75]
  - - [2048, 256, 1, 4096, 2048, 2048, 4096, 256]
    - [85, 104.54]
  - - [2048, 256, 1, 8192, 2048, 2048, 8192, 256]
    - [87, 116.32]
  - - [2048, 512, 1, 128, 2048, 2048, 128, 512]
    - [30, 20.03]
  - - [2048, 512, 1, 256, 2048, 2048, 256, 512]
    - [32, 38.85]
  - - [2048, 512, 1, 512, 2048, 2048, 512, 512]
    - [31, 71.75]
  - - [2048, 512, 1, 1024, 2048, 2048, 1024, 512]
    - [27, 105.04]
  - - [2048, 512, 1, 2048, 2048, 2048, 2048, 512]
    - [31, 135.5]
  - - [2048, 512, 1, 4096, 2048, 2048, 4096, 512]
    - [83, 151.8]
  - - [2048, 512, 1, 8192, 2048, 2048, 8192, 512]
    - [81, 160.32]
  - - [2048, 1024, 1, 128, 2048, 2048, 128, 1024]
    - [56, 41.41]
  - - [2048, 1024, 1, 256, 2048, 2048, 256, 1024]
    - [20, 70.4]
  - - [2048, 1024, 1, 512, 2048, 2048, 512, 1024]
    - [57, 112.1]
  - - [2048, 1024, 1, 1024, 2048, 2048, 1024, 1024]
    - [57, 160.3]
  - - [2048, 1024, 1, 2048, 2048, 2048, 2048, 1024]
    - [60, 198.15]
  - - [2048, 1024, 1, 4096, 2048, 2048, 4096, 1024]
    - [58, 210.02]
  - - [2048, 1024, 1, 8192, 2048, 2048, 8192, 1024]
    - [58, 207.4]
  - - [2048, 2048, 1, 128, 2048, 2048, 128, 2048]
    - [18, 58.54]
  - - [2048, 2048, 1, 256, 2048, 2048, 256, 2048]
    - [15, 100.22]
  - - [2048, 2048, 1, 512, 2048, 2048, 512, 2048]
    - [13, 156.82]
  - - [2048, 2048, 1, 1024, 2048, 2048, 1024, 2048]
    - [15, 205.79]
  - - [2048, 2048, 1, 2048, 2048, 2048, 2048, 2048]
    - [44, 248.81]
  - - [2048, 2048, 1, 4096, 2048, 2048, 4096, 2048]
    - [45, 262.26]
  - - [2048, 2048, 1, 8192, 2048, 2048, 8192, 2048]
    - [50, 240.21]
  - - [2048, 4096, 1, 128, 2048, 2048, 128, 4096]
    - [3, 72.71]
  - - [2048, 4096, 1, 256, 2048, 2048, 256, 4096]
    - [1, 122.84]
  - - [2048, 4096, 1, 512, 2048, 2048, 512, 4096]
    - [1, 185.1]
  - - [2048, 4096, 1, 1024, 2048, 2048, 1024, 4096]
    - [4, 249.22]
  - - [2048, 4096, 1, 2048, 2048, 2048, 2048, 4096]
    - [3, 282.75]
  - - [2048, 4096, 1, 4096, 2048, 2048, 4096, 4096]
    - [4, 265.85]
  - - [2048, 4096, 1, 8192, 2048, 2048, 8192, 4096]
    - [4, 280.34]
  - - [2048, 8192, 1, 128, 2048, 2048, 128, 8192]
    - [6, 80.04]
  - - [2048, 8192, 1, 256, 2048, 2048, 256, 8192]
    - [7, 133.79]
  - - [2048, 8192, 1, 512, 2048, 2048, 512, 8192]
    - [7, 200.18]
  - - [2048, 8192, 1, 1024, 2048, 2048, 1024, 8192]
    - [7, 243.9]
  - - [2048, 8192, 1, 2048, 2048, 2048, 2048, 8192]
    - [10, 247.41]
  - - [2048, 8192, 1, 4096, 2048, 2048, 4096, 8192]
    - [11, 278.52]
  - - [2048, 8192, 1, 8192, 2048, 2048, 8192, 8192]
    - [46, 311.34]
  - - [4096, 128, 1, 128, 4096, 4096, 128, 128]
    - [33, 14.82]
  - - [4096, 128, 1, 256, 4096, 4096, 256, 128]
    - [33, 26.63]
  - - [4096, 128, 1, 512, 4096, 4096, 512, 128]
    - [65, 43.27]
  - - [4096, 128, 1, 1024, 4096, 4096, 1024, 128]
    - [64, 64.6]
  - - [4096, 128, 1, 2048, 4096, 4096, 2048, 128]
    - [86, 86.93]
  - - [4096, 128, 1, 4096, 4096, 4096, 4096, 128]
    - [86, 104.99]
  - - [4096, 128, 1, 8192, 4096, 4096, 8192, 128]
    - [87, 117.69]
  - - [4096, 256, 1, 128, 4096, 4096, 128, 256]
    - [22, 25.65]
  - - [4096, 256, 1, 256, 4096, 4096, 256, 256]
    - [27, 44.18]
  - - [4096, 256, 1, 512, 4096, 4096, 512, 256]
    - [27, 72.2]
  - - [4096, 256, 1, 1024, 4096, 4096, 1024, 256]
    - [29, 105.65]
  - - [4096, 256, 1, 2048, 4096, 4096, 2048, 256]
    - [31, 136.42]
  - - [4096, 256, 1, 4096, 4096, 4096, 4096, 256]
    - [82, 152.2]
  - - [4096, 256, 1, 8192, 4096, 4096, 8192, 256]
    - [81, 160.16]
  - - [4096, 512, 1, 128, 4096, 4096, 128, 512]
    - [23, 41.44]
  - - [4096, 512, 1, 256, 4096, 4096, 256, 512]
    - [20, 70.31]
  - - [4096, 512, 1, 512, 4096, 4096, 512, 512]
    - [57, 112.89]
  - - [4096, 512, 1, 1024, 4096, 4096, 1024, 512]
    - [57, 159.81]
  - - [4096, 512, 1, 2048, 4096, 4096, 2048, 512]
    - [59, 199.23]
  - - [4096, 512, 1, 4096, 4096, 4096, 4096, 512]
    - [58, 209.39]
  - - [4096, 512, 1, 8192, 4096, 4096, 8192, 512]
    - [60, 204.73]
  - - [4096, 1024, 1, 128, 4096, 4096, 128, 1024]
    - [14, 57.85]
  - - [4096, 1024, 1, 256, 4096, 4096, 256, 1024]
    - [14, 99.02]
  - - [4096, 1024, 1, 512, 4096, 4096, 512, 1024]
    - [13, 155.2]
  - - [4096, 1024, 1, 1024, 4096, 4096, 1024, 1024]
    - [48, 209.67]
  - - [4096, 1024, 1, 2048, 4096, 4096, 2048, 1024]
    - [50, 252.96]
  - - [4096, 1024, 1, 4096, 4096, 4096, 4096, 1024]
    - [43, 264.96]
  - - [4096, 1024, 1, 8192, 4096, 4096, 8192, 1024]
    - [49, 241.52]
  - - [4096, 2048, 1, 128, 4096, 4096, 128, 2048]
    - [0, 71.78]
  - - [4096, 2048, 1, 256, 4096, 4096, 256, 2048]
    - [4, 120.17]
  - - [4096, 2048, 1, 512, 4096, 4096, 512, 2048]
    - [4, 181.94]
  - - [4096, 2048, 1, 1024, 4096, 4096, 1024, 2048]
    - [7, 249.37]
  - - [4096, 2048, 1, 2048, 4096, 4096, 2048, 2048]
    - [5, 279.8]
  - - [4096, 2048, 1, 4096, 4096, 4096, 4096, 2048]
    - [7, 270.98]
  - - [4096, 2048, 1, 8192, 4096, 4096, 8192, 2048]
    - [53, 289.18]
  - - [4096, 4096, 1, 128, 4096, 4096, 128, 4096]
    - [4, 78.51]
  - - [4096, 4096, 1, 256, 4096, 4096, 256, 4096]
    - [1, 131.31]
  - - [4096, 4096, 1, 512, 4096, 4096, 512, 4096]
    - [8, 196.69]
  - - [4096, 4096, 1, 1024, 4096, 4096, 1024, 4096]
    - [7, 242.19]
  - - [4096, 4096, 1, 2048, 4096, 4096, 2048, 4096]
    - [9, 242.19]
  - - [4096, 4096, 1, 4096, 4096, 4096, 4096, 4096]
    - [4, 279.58]
  - - [4096, 4096, 1, 8192, 4096, 4096, 8192, 4096]
    - [47, 316.55]
  - - [4096, 8192, 1, 128, 4096, 4096, 128, 8192]
    - [1, 85.12]
  - - [4096, 8192, 1, 256, 4096, 4096, 256, 8192]
    - [24, 138.43]
  - - [4096, 8192, 1, 512, 4096, 4096, 512, 8192]
    - [12, 202.99]
  - - [4096, 8192, 1, 1024, 4096, 4096, 1024, 8192]
    - [46, 236.21]
  - - [4096, 8192, 1, 2048, 4096, 4096, 2048, 8192]
    - [44, 281.54]
  - - [4096, 8192, 1, 4096, 4096, 4096, 4096, 8192]
    - [2, 326.11]
  - - [4096, 8192, 1, 8192, 4096, 4096, 8192, 8192]
    - [2, 365.59]
  - - [8192, 128, 1, 128, 8192, 8192, 128, 128]
    - [28, 25.56]
  - - [8192, 128, 1, 256, 8192, 8192, 256, 128]
    - [27, 44.92]
  - - [8192, 128, 1, 512, 8192, 8192, 512, 128]
    - [27, 73.73]
  - - [8192, 128, 1, 1024, 8192, 8192, 1024, 128]
    - [27, 105.41]
  - - [8192, 128, 1, 2048, 8192, 8192, 2048, 128]
    - [29, 135.44]
  - - [8192, 128, 1, 4096, 8192, 8192, 4096, 128]
    - [61, 146.11]
  - - [8192, 128, 1, 8192, 8192, 8192, 8192, 128]
    - [83, 158.62]
  - - [8192, 256, 1, 128, 8192, 8192, 128, 256]
    - [23, 40.77]
  - - [8192, 256, 1, 256, 8192, 8192, 256, 256]
    - [20, 70.83]
  - - [8192, 256, 1, 512, 8192, 8192, 512, 256]
    - [57, 112.52]
  - - [8192, 256, 1, 1024, 8192, 8192, 1024, 256]
    - [57, 160.22]
  - - [8192, 256, 1, 2048, 8192, 8192, 2048, 256]
    - [59, 199.12]
  - - [8192, 256, 1, 4096, 8192, 8192, 4096, 256]
    - [59, 208.65]
  - - [8192, 256, 1, 8192, 8192, 8192, 8192, 256]
    - [60, 204.69]
  - - [8192, 512, 1, 128, 8192, 8192, 128, 512]
    - [16, 58.29]
  - - [8192, 512, 1, 256, 8192, 8192, 256, 512]
    - [13, 99.69]
  - - [8192, 512, 1, 512, 8192, 8192, 512, 512]
    - [17, 155.06]
  - - [8192, 512, 1, 1024, 8192, 8192, 1024, 512]
    - [55, 224.75]
  - - [8192, 512, 1, 2048, 8192, 8192, 2048, 512]
    - [54, 263.52]
  - - [8192, 512, 1, 4096, 8192, 8192, 4096, 512]
    - [54, 277.2]
  - - [8192, 512, 1, 8192, 8192, 8192, 8192, 512]
    - [54, 264.11]
  - - [8192, 1024, 1, 128, 8192, 8192, 128, 1024]
    - [1, 72.27]
  - - [8192, 1024, 1, 256, 8192, 8192, 256, 1024]
    - [1, 120.08]
  - - [8192, 1024, 1, 512, 8192, 8192, 512, 1024]
    - [52, 185.92]
  - - [8192, 1024, 1, 1024, 8192, 8192, 1024, 1024]
    - [7, 242.25]
  - - [8192, 1024, 1, 2048, 8192, 8192, 2048, 1024]
    - [51, 311.92]
  - - [8192, 1024, 1, 4096, 8192, 8192, 4096, 1024]
    - [52, 345.7]
  - - [8192, 1024, 1, 8192, 8192, 8192, 8192, 1024]
    - [51, 368.0]
  - - [8192, 2048, 1, 128, 8192, 8192, 128, 2048]
    - [53, 78.47]
  - - [8192, 2048, 1, 256, 8192, 8192, 256, 2048]
    - [53, 134.87]
  - - [8192, 2048, 1, 512, 8192, 8192, 512, 2048]
    - [53, 199.75]
  - - [8192, 2048, 1, 1024, 8192, 8192, 1024, 2048]
    - [53, 263.03]
  - - [8192, 2048, 1, 2048, 8192, 8192, 2048, 2048]
    - [52, 299.36]
  - - [8192, 2048, 1, 4096, 8192, 8192, 4096, 2048]
    - [53, 341.71]
  - - [8192, 2048, 1, 8192, 8192, 8192, 8192, 2048]
    - [51, 388.97]
  - - [8192, 4096, 1, 128, 8192, 8192, 128, 4096]
    - [7, 83.23]
  - - [8192, 4096, 1, 256, 8192, 8192, 256, 4096]
    - [23, 137.12]
  - - [8192, 4096, 1, 512, 8192, 8192, 512, 4096]
    - [12, 197.57]
  - - [8192, 4096, 1, 1024, 8192, 8192, 1024, 4096]
    - [53, 251.29]
  - - [8192, 4096, 1, 2048, 8192, 8192, 2048, 4096]
    - [52, 304.53]
  - - [8192, 4096, 1, 4096, 8192, 8192, 4096, 4096]
    - [52, 364.03]
  - - [8192, 4096, 1, 8192, 8192, 8192, 8192, 4096]
    - [52, 407.82]
  - - [8192, 8192, 1, 128, 8192, 8192, 128, 8192]
    - [19, 86.55]
  - - [8192, 8192, 1, 256, 8192, 8192, 256, 8192]
    - [17, 149.52]
  - - [8192, 8192, 1, 512, 8192, 8192, 512, 8192]
    - [3, 214.96]
  - - [8192, 8192, 1, 1024, 8192, 8192, 1024, 8192]
    - [7, 276.69]
  - - [8192, 8192, 1, 2048, 8192, 8192, 2048, 8192]
    - [53, 326.62]
  - - [8192, 8192, 1, 4096, 8192, 8192, 4096, 8192]
    - [53, 376.43]
  - - [8192, 8192, 1, 8192, 8192, 8192, 8192, 8192]
    - [51, 407.76]
- null
- null
- ExperimentalStreamK
- GridBased
