projects/hipblaslt/library/src/amd_detail/rocblaslt/src/Tensile/Logic/asm_full/aquavanjaram/gfx942_228cu/StreamK/aquavanjaram942_Cijk_Alik_Bjlk_B8NBS_BH_Bias_HAS_SAV_UserArgs.yaml
- {MinimumRequiredVersion: 4.33.0}
- aquavanjaram942
- {Architecture: gfx942, CUCount: 228}
- [Device 0049, Device 0050]
    SolutionIndex: 0
    SolutionNameMin: Cijk_Alik_Bjlk_B8NBS_BH_Bias_HAS_SAV_UserArgs_MT256x256x64_MI16x16x1_SN_LDSB1_CLR1_GRVWA8_GRVWB8_GSU0_GSUC0_GSUWGMRR0_K1_LBSPPA512_LBSPPB2048_LPA8_LPB0_LRVW8_MIWT8_8_PLR1_SU0_SUM0_SUS64_VWA8_VWB8_WGM1_WGMXCC1_WGMXCCGn1
    SolutionIndex: 1
    SolutionNameMin: Cijk_Alik_Bjlk_B8NBS_BH_Bias_HAS_SAV_UserArgs_MT256x256x64_MI16x16x1_SN_LDSB1_CLR1_GRVWA8_GRVWB16_GSU0_GSUC0_GSUWGMRR0_K1_LBSPPA512_LBSPPB2048_LPA8_LPB0_LRVW8_MIWT8_8_PLR1_SU0_SUM0_SUS64_VWA8_VWB8_WGM1_WGMXCC1_WGMXCCGn1
    SolutionIndex: 2
    SolutionNameMin: Cijk_Alik_Bjlk_B8NBS_BH_Bias_HAS_SAV_UserArgs_MT256x256x64_MI16x16x1_SN_LDSB1_CLR1_GRVWA16_GRVWB16_GSU0_GSUC0_GSUWGMRR0_K1_LBSPPA512_LBSPPB2048_LPA16_LPB0_LRVW8_MIWT8_8_PLR1_SU0_SUM0_SUS64_VWA8_VWB8_WGM1_WGMXCC1_WGMXCCGn1
    SolutionIndex: 3
    SolutionNameMin: Cijk_Alik_Bjlk_B8NBS_BH_Bias_HAS_SAV_UserArgs_MT256x256x64_MI16x16x1_SN_LDSB1_CLR1_GRVWA8_GRVWB8_GSU0_GSUC0_GSUWGMRR0_K1_LBSPPA512_LBSPPB2048_LPA8_LPB0_LRVW8_MIWT8_8_PLR1_SU0_SUM0_SUS64_VWA8_VWB8_WGM4_WGMXCC1_WGMXCCGn1
    SolutionIndex: 4
    SolutionNameMin: Cijk_Alik_Bjlk_B8NBS_BH_Bias_HAS_SAV_UserArgs_MT256x256x64_MI16x16x1_SN_LDSB1_CLR1_GRVWA8_GRVWB16_GSU0_GSUC0_GSUWGMRR0_K1_LBSPPA512_LBSPPB2048_LPA8_LPB0_LRVW8_MIWT8_8_PLR1_SU0_SUM0_SUS64_VWA8_VWB8_WGM4_WGMXCC1_WGMXCCGn1
    SolutionIndex: 5
    SolutionNameMin: Cijk_Alik_Bjlk_B8NBS_BH_Bias_HAS_SAV_UserArgs_MT256x256x64_MI16x16x1_SN_LDSB1_CLR1_GRVWA16_GRVWB16_GSU0_GSUC0_GSUWGMRR0_K1_LBSPPA512_LBSPPB2048_LPA16_LPB0_LRVW8_MIWT8_8_PLR1_SU0_SUM0_SUS64_VWA8_VWB8_WGM4_WGMXCC1_WGMXCCGn1
    SolutionIndex: 6
    SolutionNameMin: Cijk_Alik_Bjlk_B8NBS_BH_Bias_HAS_SAV_UserArgs_MT256x256x64_MI16x16x1_SN_LDSB1_CLR1_GRVWA8_GRVWB16_GSU0_GSUC0_GSUWGMRR0_K1_LBSPPA512_LBSPPB2048_LPA8_LPB0_LRVW8_MIWT8_8_PLR1_SU0_SUM0_SUS64_VWA8_VWB8_WGM6_WGMXCC1_WGMXCCGn1
    SolutionIndex: 7
    SolutionNameMin: Cijk_Alik_Bjlk_B8NBS_BH_Bias_HAS_SAV_UserArgs_MT256x256x64_MI16x16x1_SN_LDSB1_CLR1_GRVWA16_GRVWB16_GSU0_GSUC0_GSUWGMRR0_K1_LBSPPA512_LBSPPB2048_LPA16_LPB0_LRVW8_MIWT8_8_PLR1_SU0_SUM0_SUS64_VWA8_VWB8_WGM6_WGMXCC1_WGMXCCGn1
    SolutionIndex: 8
    SolutionNameMin: Cijk_Alik_Bjlk_B8NBS_BH_Bias_HAS_SAV_UserArgs_MT256x256x64_MI16x16x1_SN_LDSB1_CLR1_GRVWA8_GRVWB16_GSU0_GSUC0_GSUWGMRR0_K1_LBSPPA512_LBSPPB2048_LPA8_LPB0_LRVW8_MIWT8_8_PLR1_SU0_SUM0_SUS64_VWA8_VWB8_WGM8_WGMXCC1_WGMXCCGn1
    SolutionIndex: 9
    SolutionNameMin: Cijk_Alik_Bjlk_B8NBS_BH_Bias_HAS_SAV_UserArgs_MT256x256x64_MI16x16x1_SN_LDSB1_CLR1_GRVWA16_GRVWB16_GSU0_GSUC0_GSUWGMRR0_K1_LBSPPA512_LBSPPB2048_LPA16_LPB0_LRVW8_MIWT8_8_PLR1_SU0_SUM0_SUS64_VWA8_VWB8_WGM8_WGMXCC1_WGMXCCGn1
    SolutionIndex: 10
    SolutionNameMin: Cijk_Alik_Bjlk_B8NBS_BH_Bias_HAS_SAV_UserArgs_MT128x256x64_MI16x16x1_SN_LDSB1_CLR1_GRVWA8_GRVWB16_GSU0_GSUC0_GSUWGMRR0_K1_LBSPPA256_LBSPPB2048_LPA8_LPB0_LRVW8_MIWT4_8_PLR1_SU0_SUM0_SUS64_VWA4_VWB8_WGM1_WGMXCC1_WGMXCCGn1
    SolutionIndex: 11
    SolutionNameMin: Cijk_Alik_Bjlk_B8NBS_BH_Bias_HAS_SAV_UserArgs_MT128x256x64_MI16x16x1_SN_LDSB1_CLR1_GRVWA8_GRVWB16_GSU0_GSUC0_GSUWGMRR0_K1_LBSPPA256_LBSPPB2048_LPA8_LPB0_LRVW8_MIWT4_8_PLR1_SU0_SUM0_SUS64_VWA4_VWB8_WGM4_WGMXCC1_WGMXCCGn1
    SolutionIndex: 12
    SolutionNameMin: Cijk_Alik_Bjlk_B8NBS_BH_Bias_HAS_SAV_UserArgs_MT128x256x64_MI16x16x1_SN_LDSB1_CLR1_GRVWA16_GRVWB16_GSU0_GSUC0_GSUWGMRR0_K1_LBSPPA256_LBSPPB2048_LPA16_LPB0_LRVW8_MIWT4_8_PLR1_SU0_SUM0_SUS64_VWA4_VWB8_WGM4_WGMXCC1_WGMXCCGn1
    SolutionIndex: 13
    SolutionNameMin: Cijk_Alik_Bjlk_B8NBS_BH_Bias_HAS_SAV_UserArgs_MT128x256x64_MI16x16x1_SN_LDSB1_CLR1_GRVWA8_GRVWB16_GSU0_GSUC0_GSUWGMRR0_K1_LBSPPA256_LBSPPB2048_LPA8_LPB0_LRVW8_MIWT4_8_PLR1_SU0_SUM0_SUS64_VWA4_VWB8_WGM6_WGMXCC1_WGMXCCGn1
    SolutionIndex: 14
    SolutionNameMin: Cijk_Alik_Bjlk_B8NBS_BH_Bias_HAS_SAV_UserArgs_MT128x256x64_MI16x16x1_SN_LDSB1_CLR1_GRVWA8_GRVWB16_GSU0_GSUC0_GSUWGMRR0_K1_LBSPPA256_LBSPPB2048_LPA8_LPB0_LRVW8_MIWT4_8_PLR1_SU0_SUM0_SUS64_VWA4_VWB8_WGM8_WGMXCC1_WGMXCCGn1
    SolutionIndex: 15
    SolutionNameMin: Cijk_Alik_Bjlk_B8NBS_BH_Bias_HAS_SAV_UserArgs_MT256x128x64_MI16x16x1_SN_LDSB1_CLR1_GRVWA8_GRVWB8_GSU0_GSUC0_GSUWGMRR0_K1_LBSPPA512_LBSPPB1024_LPA8_LPB64_LRVW8_MIWT8_4_PLR1_SU0_SUM0_SUS64_VWA8_VWB4_WGM1_WGMXCC1_WGMXCCGn1
    SolutionIndex: 16
    SolutionNameMin: Cijk_Alik_Bjlk_B8NBS_BH_Bias_HAS_SAV_UserArgs_MT256x128x64_MI16x16x1_SN_LDSB1_CLR1_GRVWA16_GRVWB8_GSU0_GSUC0_GSUWGMRR0_K1_LBSPPA512_LBSPPB1024_LPA16_LPB64_LRVW8_MIWT8_4_PLR1_SU0_SUM0_SUS64_VWA8_VWB4_WGM1_WGMXCC1_WGMXCCGn1
    SolutionIndex: 17
    SolutionNameMin: Cijk_Alik_Bjlk_B8NBS_BH_Bias_HAS_SAV_UserArgs_MT256x128x64_MI16x16x1_SN_LDSB1_CLR1_GRVWA8_GRVWB16_GSU0_GSUC0_GSUWGMRR0_K1_LBSPPA512_LBSPPB1024_LPA8_LPB64_LRVW8_MIWT8_4_PLR1_SU0_SUM0_SUS64_VWA8_VWB4_WGM1_WGMXCC1_WGMXCCGn1
    SolutionIndex: 18
    SolutionNameMin: Cijk_Alik_Bjlk_B8NBS_BH_Bias_HAS_SAV_UserArgs_MT256x128x64_MI16x16x1_SN_LDSB1_CLR1_GRVWA8_GRVWB8_GSU0_GSUC0_GSUWGMRR0_K1_LBSPPA512_LBSPPB1024_LPA8_LPB64_LRVW8_MIWT8_4_PLR1_SU0_SUM0_SUS64_VWA8_VWB4_WGM8_WGMXCC1_WGMXCCGn1
    SolutionIndex: 19
    SolutionNameMin: Cijk_Alik_Bjlk_B8NBS_BH_Bias_HAS_SAV_UserArgs_MT256x128x64_MI16x16x1_SN_LDSB1_CLR1_GRVWA16_GRVWB8_GSU0_GSUC0_GSUWGMRR0_K1_LBSPPA512_LBSPPB1024_LPA16_LPB64_LRVW8_MIWT8_4_PLR1_SU0_SUM0_SUS64_VWA8_VWB4_WGM8_WGMXCC1_WGMXCCGn1
    SolutionIndex: 20
    SolutionNameMin: Cijk_Alik_Bjlk_B8NBS_BH_Bias_HAS_SAV_UserArgs_MT256x128x64_MI16x16x1_SN_LDSB1_CLR1_GRVWA8_GRVWB16_GSU0_GSUC0_GSUWGMRR0_K1_LBSPPA512_LBSPPB1024_LPA8_LPB64_LRVW8_MIWT8_4_PLR1_SU0_SUM0_SUS64_VWA8_VWB4_WGM8_WGMXCC1_WGMXCCGn1
    SolutionIndex: 21
    SolutionNameMin: Cijk_Alik_Bjlk_B8NBS_BH_Bias_HAS_SAV_UserArgs_MT256x128x64_MI16x16x1_SN_LDSB1_CLR1_GRVWA16_GRVWB16_GSU0_GSUC0_GSUWGMRR0_K1_LBSPPA512_LBSPPB1024_LPA16_LPB64_LRVW8_MIWT8_4_PLR1_SU0_SUM0_SUS64_VWA8_VWB4_WGM8_WGMXCC1_WGMXCCGn1
    SolutionIndex: 22
    SolutionNameMin: Cijk_Alik_Bjlk_B8NBS_BH_Bias_HAS_SAV_UserArgs_MT128x128x64_MI16x16x1_SN_LDSB1_CLR1_GRVWA8_GRVWB8_GSU0_GSUC0_GSUWGMRR0_K1_LBSPPA512_LBSPPB1024_LPA8_LPB32_LRVW8_MIWT8_2_PLR1_SU0_SUM0_SUS64_VWA8_VWB2_WGM1_WGMXCC1_WGMXCCGn1
    SolutionIndex: 23
    SolutionNameMin: Cijk_Alik_Bjlk_B8NBS_BH_Bias_HAS_SAV_UserArgs_MT128x128x64_MI16x16x1_SN_LDSB1_CLR1_GRVWA8_GRVWB16_GSU0_GSUC0_GSUWGMRR0_K1_LBSPPA512_LBSPPB1024_LPA8_LPB32_LRVW8_MIWT8_2_PLR1_SU0_SUM0_SUS64_VWA8_VWB2_WGM1_WGMXCC1_WGMXCCGn1
    SolutionIndex: 24
    SolutionNameMin: Cijk_Alik_Bjlk_B8NBS_BH_Bias_HAS_SAV_UserArgs_MT128x128x64_MI16x16x1_SN_LDSB1_CLR1_GRVWA8_GRVWB16_GSU0_GSUC0_GSUWGMRR0_K1_LBSPPA512_LBSPPB1024_LPA8_LPB32_LRVW8_MIWT8_2_PLR1_SU0_SUM0_SUS64_VWA8_VWB2_WGM6_WGMXCC1_WGMXCCGn1
    SolutionIndex: 25
    SolutionNameMin: Cijk_Alik_Bjlk_B8NBS_BH_Bias_HAS_SAV_UserArgs_MT128x64x64_MI16x16x1_SN_LDSB0_CLR1_GRVWA8_GRVWB8_GSU0_GSUC0_GSUWGMRR0_K1_LBSPPA512_LBSPPB512_LPA8_LPB16_LRVW8_MIWT8_1_PLR1_SU0_SUM0_SUS64_VWA8_VWB1_WGM1_WGMXCC1_WGMXCCGn1
    SolutionIndex: 26
    SolutionNameMin: Cijk_Alik_Bjlk_B8NBS_BH_Bias_HAS_SAV_UserArgs_MT128x64x64_MI16x16x1_SN_LDSB0_CLR1_GRVWA8_GRVWB16_GSU0_GSUC0_GSUWGMRR0_K1_LBSPPA512_LBSPPB512_LPA8_LPB16_LRVW8_MIWT8_1_PLR1_SU0_SUM0_SUS64_VWA8_VWB1_WGM1_WGMXCC1_WGMXCCGn1
    SolutionIndex: 27
    SolutionNameMin: Cijk_Alik_Bjlk_B8NBS_BH_Bias_HAS_SAV_UserArgs_MT64x128x64_MI16x16x1_SN_LDSB0_CLR1_GRVWA8_GRVWB8_GSU0_GSUC0_GSUWGMRR0_K1_LBSPPA128_LBSPPB1024_LPA8_LPB64_LRVW8_MIWT2_4_PLR1_SU0_SUM0_SUS64_VWA2_VWB4_WGM1_WGMXCC1_WGMXCCGn1
    SolutionIndex: 28
    SolutionNameMin: Cijk_Alik_Bjlk_B8NBS_BH_Bias_HAS_SAV_UserArgs_MT64x128x64_MI16x16x1_SN_LDSB0_CLR1_GRVWA8_GRVWB16_GSU0_GSUC0_GSUWGMRR0_K1_LBSPPA128_LBSPPB1024_LPA8_LPB64_LRVW8_MIWT2_4_PLR1_SU0_SUM0_SUS64_VWA2_VWB4_WGM1_WGMXCC1_WGMXCCGn1
    SolutionIndex: 29
    SolutionNameMin: Cijk_Alik_Bjlk_B8NBS_BH_Bias_HAS_SAV_UserArgs_MT128x64x64_MI16x16x1_SN_LDSB0_CLR1_GRVWA8_GRVWB16_GSU0_GSUC0_GSUWGMRR0_K1_LBSPPA256_LBSPPB512_LPA8_LPB32_LRVW8_MIWT4_2_PLR1_SU0_SUM0_SUS64_VWA4_VWB2_WGM1_WGMXCC1_WGMXCCGn1
    SolutionIndex: 30
    SolutionNameMin: Cijk_Alik_Bjlk_B8NBS_BH_Bias_HAS_SAV_UserArgs_MT128x64x64_MI16x16x1_SN_LDSB0_CLR1_GRVWA8_GRVWB16_GSU0_GSUC0_GSUWGMRR0_K1_LBSPPA256_LBSPPB512_LPA8_LPB32_LRVW8_MIWT4_2_PLR1_SU0_SUM0_SUS64_VWA4_VWB2_WGM4_WGMXCC1_WGMXCCGn1
    SolutionIndex: 31
    SolutionNameMin: Cijk_Alik_Bjlk_B8NBS_BH_Bias_HAS_SAV_UserArgs_MT128x64x64_MI16x16x1_SN_LDSB0_CLR1_GRVWA8_GRVWB16_GSU0_GSUC0_GSUWGMRR0_K1_LBSPPA256_LBSPPB512_LPA8_LPB32_LRVW8_MIWT4_2_PLR1_SU0_SUM0_SUS64_VWA4_VWB2_WGM8_WGMXCC1_WGMXCCGn1
    SolutionIndex: 32
    SolutionNameMin: Cijk_Alik_Bjlk_B8NBS_BH_Bias_HAS_SAV_UserArgs_MT64x64x64_MI16x16x1_SN_LDSB0_CLR1_GRVWA8_GRVWB8_GSU0_GSUC0_GSUWGMRR0_K1_LBSPPA128_LBSPPB512_LPA8_LPB32_LRVW8_MIWT2_2_PLR1_SU0_SUM0_SUS64_VWA2_VWB2_WGM1_WGMXCC1_WGMXCCGn1
    SolutionIndex: 33
    SolutionNameMin: Cijk_Alik_Bjlk_B8NBS_BH_Bias_HAS_SAV_UserArgs_MT64x64x64_MI16x16x1_SN_LDSB0_CLR1_GRVWA16_GRVWB8_GSU0_GSUC0_GSUWGMRR0_K1_LBSPPA128_LBSPPB512_LPA16_LPB32_LRVW8_MIWT2_2_PLR1_SU0_SUM0_SUS64_VWA2_VWB2_WGM1_WGMXCC1_WGMXCCGn1
    SolutionIndex: 34
    SolutionNameMin: Cijk_Alik_Bjlk_B8NBS_BH_Bias_HAS_SAV_UserArgs_MT64x64x64_MI16x16x1_SN_LDSB0_CLR1_GRVWA8_GRVWB8_GSU0_GSUC0_GSUWGMRR0_K1_LBSPPA128_LBSPPB512_LPA8_LPB32_LRVW8_MIWT2_2_PLR1_SU0_SUM0_SUS64_VWA2_VWB2_WGM6_WGMXCC1_WGMXCCGn1
    SolutionIndex: 35
    SolutionNameMin: Cijk_Alik_Bjlk_B8NBS_BH_Bias_HAS_SAV_UserArgs_MT64x64x64_MI16x16x1_SN_LDSB0_CLR1_GRVWA8_GRVWB8_GSU0_GSUC0_GSUWGMRR0_K1_LBSPPA128_LBSPPB512_LPA8_LPB32_LRVW8_MIWT2_2_PLR1_SU0_SUM0_SUS64_VWA2_VWB2_WGM8_WGMXCC1_WGMXCCGn1
    SolutionIndex: 36
    SolutionNameMin: Cijk_Alik_Bjlk_B8NBS_BH_Bias_HAS_SAV_UserArgs_MT64x32x64_MI16x16x1_SN_LDSB0_CLR1_GRVWA8_GRVWB8_GSU0_GSUC0_GSUWGMRR0_K1_LBSPPA128_LBSPPB256_LPA8_LPB16_LRVW8_MIWT2_1_PLR1_SU0_SUM0_SUS64_VWA2_VWB1_WGM1_WGMXCC1_WGMXCCGn1
    SolutionIndex: 37
    SolutionNameMin: Cijk_Alik_Bjlk_B8NBS_BH_Bias_HAS_SAV_UserArgs_MT64x32x64_MI16x16x1_SN_LDSB0_CLR1_GRVWA16_GRVWB8_GSU0_GSUC0_GSUWGMRR0_K1_LBSPPA128_LBSPPB256_LPA16_LPB16_LRVW8_MIWT2_1_PLR1_SU0_SUM0_SUS64_VWA2_VWB1_WGM1_WGMXCC1_WGMXCCGn1
    SolutionIndex: 38
    SolutionNameMin: Cijk_Alik_Bjlk_B8NBS_BH_Bias_HAS_SAV_UserArgs_MT32x32x64_MI16x16x1_SN_LDSB0_CLR1_GRVWA8_GRVWB8_GSU0_GSUC0_GSUWGMRR0_K1_LBSPPA128_LBSPPB256_LPA8_LPB16_LRVW8_MIWT1_1_PLR1_SU0_SUM0_SUS64_VWA1_VWB1_WGM1_WGMXCC1_WGMXCCGn1
    SolutionIndex: 39
    SolutionNameMin: Cijk_Alik_Bjlk_B8NBS_BH_Bias_HAS_SAV_UserArgs_MT32x32x64_MI16x16x1_SN_LDSB0_CLR1_GRVWA8_GRVWB8_GSU0_GSUC0_GSUWGMRR0_K1_LBSPPA128_LBSPPB256_LPA8_LPB16_LRVW8_MIWT1_1_PLR1_SU0_SUM0_SUS64_VWA1_VWB1_WGM6_WGMXCC1_WGMXCCGn1
    SolutionIndex: 40
    SolutionNameMin: Cijk_Alik_Bjlk_B8NBS_BH_Bias_HAS_SAV_UserArgs_MT128x256x128_MI16x16x1_SN_LDSB1_CLR1_GRVWA8_GRVWB8_GSU0_GSUC0_GSUWGMRR0_K1_LBSPPA512_LBSPPB2048_LPA8_LPB0_LRVW8_MIWT4_8_PLR1_SU0_SUM0_SUS128_VWA4_VWB8_WGM1_WGMXCC1_WGMXCCGn1
    SolutionIndex: 41
    SolutionNameMin: Cijk_Alik_Bjlk_B8NBS_BH_Bias_HAS_SAV_UserArgs_MT128x256x128_MI16x16x1_SN_LDSB1_CLR1_GRVWA8_GRVWB16_GSU0_GSUC0_GSUWGMRR0_K1_LBSPPA512_LBSPPB2048_LPA8_LPB0_LRVW8_MIWT4_8_PLR1_SU0_SUM0_SUS128_VWA4_VWB8_WGM1_WGMXCC1_WGMXCCGn1
    SolutionIndex: 42
    SolutionNameMin: Cijk_Alik_Bjlk_B8NBS_BH_Bias_HAS_SAV_UserArgs_MT128x256x128_MI16x16x1_SN_LDSB1_CLR1_GRVWA16_GRVWB16_GSU0_GSUC0_GSUWGMRR0_K1_LBSPPA512_LBSPPB2048_LPA16_LPB0_LRVW8_MIWT4_8_PLR1_SU0_SUM0_SUS128_VWA4_VWB8_WGM1_WGMXCC1_WGMXCCGn1
    SolutionIndex: 43
    SolutionNameMin: Cijk_Alik_Bjlk_B8NBS_BH_Bias_HAS_SAV_UserArgs_MT128x256x128_MI16x16x1_SN_LDSB1_CLR1_GRVWA8_GRVWB16_GSU0_GSUC0_GSUWGMRR0_K1_LBSPPA512_LBSPPB2048_LPA8_LPB0_LRVW8_MIWT4_8_PLR1_SU0_SUM0_SUS128_VWA4_VWB8_WGM4_WGMXCC1_WGMXCCGn1
    SolutionIndex: 44
    SolutionNameMin: Cijk_Alik_Bjlk_B8NBS_BH_Bias_HAS_SAV_UserArgs_MT128x256x128_MI16x16x1_SN_LDSB1_CLR1_GRVWA16_GRVWB16_GSU0_GSUC0_GSUWGMRR0_K1_LBSPPA512_LBSPPB2048_LPA16_LPB0_LRVW8_MIWT4_8_PLR1_SU0_SUM0_SUS128_VWA4_VWB8_WGM4_WGMXCC1_WGMXCCGn1
    SolutionIndex: 45
    SolutionNameMin: Cijk_Alik_Bjlk_B8NBS_BH_Bias_HAS_SAV_UserArgs_MT128x256x128_MI16x16x1_SN_LDSB1_CLR1_GRVWA8_GRVWB16_GSU0_GSUC0_GSUWGMRR0_K1_LBSPPA512_LBSPPB2048_LPA8_LPB0_LRVW8_MIWT4_8_PLR1_SU0_SUM0_SUS128_VWA4_VWB8_WGM6_WGMXCC1_WGMXCCGn1
    SolutionIndex: 46
    SolutionNameMin: Cijk_Alik_Bjlk_B8NBS_BH_Bias_HAS_SAV_UserArgs_MT256x128x128_MI16x16x1_SN_LDSB1_CLR1_GRVWA8_GRVWB16_GSU0_GSUC0_GSUWGMRR0_K1_LBSPPA1024_LBSPPB1024_LPA8_LPB64_LRVW8_MIWT8_4_PLR1_SU0_SUM0_SUS128_VWA8_VWB4_WGM1_WGMXCC1_WGMXCCGn1
    SolutionIndex: 47
    SolutionNameMin: Cijk_Alik_Bjlk_B8NBS_BH_Bias_HAS_SAV_UserArgs_MT256x128x128_MI16x16x1_SN_LDSB1_CLR1_GRVWA8_GRVWB16_GSU0_GSUC0_GSUWGMRR0_K1_LBSPPA1024_LBSPPB1024_LPA8_LPB64_LRVW8_MIWT8_4_PLR1_SU0_SUM0_SUS128_VWA8_VWB4_WGM6_WGMXCC1_WGMXCCGn1
    SolutionIndex: 48
    SolutionNameMin: Cijk_Alik_Bjlk_B8NBS_BH_Bias_HAS_SAV_UserArgs_MT256x128x128_MI16x16x1_SN_LDSB1_CLR1_GRVWA8_GRVWB16_GSU0_GSUC0_GSUWGMRR0_K1_LBSPPA1024_LBSPPB1024_LPA8_LPB64_LRVW8_MIWT8_4_PLR1_SU0_SUM0_SUS128_VWA8_VWB4_WGM8_WGMXCC1_WGMXCCGn1
    SolutionIndex: 49
    SolutionNameMin: Cijk_Alik_Bjlk_B8NBS_BH_Bias_HAS_SAV_UserArgs_MT144x256x128_MI16x16x1_SN_LDSB1_CLR1_GRVWA8_GRVWB16_GSU0_GSUC0_GSUWGMRR0_K1_LBSPPA128_LBSPPB2048_LPA8_LPB64_LRVW8_MIWT9_4_PLR1_SU0_SUM0_SUS128_VWA1_VWB4_WGM1_WGMXCC1_WGMXCCGn1
    SolutionIndex: 50
    SolutionNameMin: Cijk_Alik_Bjlk_B8NBS_BH_Bias_HAS_SAV_UserArgs_MT144x256x128_MI16x16x1_SN_LDSB1_CLR1_GRVWA8_GRVWB16_GSU0_GSUC0_GSUWGMRR0_K1_LBSPPA128_LBSPPB2048_LPA8_LPB64_LRVW8_MIWT9_4_PLR1_SU0_SUM0_SUS128_VWA1_VWB4_WGM4_WGMXCC1_WGMXCCGn1
    SolutionIndex: 51
    SolutionNameMin: Cijk_Alik_Bjlk_B8NBS_BH_Bias_HAS_SAV_UserArgs_MT144x256x128_MI16x16x1_SN_LDSB1_CLR1_GRVWA8_GRVWB8_GSU0_GSUC0_GSUWGMRR0_K1_LBSPPA128_LBSPPB2048_LPA8_LPB64_LRVW8_MIWT9_4_PLR1_SU0_SUM0_SUS128_VWA1_VWB4_WGM6_WGMXCC1_WGMXCCGn1
    SolutionIndex: 52
    SolutionNameMin: Cijk_Alik_Bjlk_B8NBS_BH_Bias_HAS_SAV_UserArgs_MT144x256x128_MI16x16x1_SN_LDSB1_CLR1_GRVWA8_GRVWB16_GSU0_GSUC0_GSUWGMRR0_K1_LBSPPA128_LBSPPB2048_LPA8_LPB64_LRVW8_MIWT9_4_PLR1_SU0_SUM0_SUS128_VWA1_VWB4_WGM6_WGMXCC1_WGMXCCGn1
    SolutionIndex: 53
    SolutionNameMin: Cijk_Alik_Bjlk_B8NBS_BH_Bias_HAS_SAV_UserArgs_MT144x256x128_MI16x16x1_SN_LDSB1_CLR1_GRVWA8_GRVWB16_GSU0_GSUC0_GSUWGMRR0_K1_LBSPPA128_LBSPPB2048_LPA8_LPB64_LRVW8_MIWT9_4_PLR1_SU0_SUM0_SUS128_VWA1_VWB4_WGM8_WGMXCC1_WGMXCCGn1
    SolutionIndex: 54
    SolutionNameMin: Cijk_Alik_Bjlk_B8NBS_BH_Bias_HAS_SAV_UserArgs_MT128x128x128_MI16x16x1_SN_LDSB1_CLR1_GRVWA16_GRVWB8_GSU0_GSUC0_GSUWGMRR0_K1_LBSPPA1024_LBSPPB1024_LPA16_LPB32_LRVW8_MIWT8_2_PLR1_SU0_SUM0_SUS128_VWA8_VWB2_WGM1_WGMXCC1_WGMXCCGn1
    SolutionIndex: 55
    SolutionNameMin: Cijk_Alik_Bjlk_B8NBS_BH_Bias_HAS_SAV_UserArgs_MT128x128x128_MI16x16x1_SN_LDSB1_CLR1_GRVWA8_GRVWB16_GSU0_GSUC0_GSUWGMRR0_K1_LBSPPA1024_LBSPPB1024_LPA8_LPB32_LRVW8_MIWT8_2_PLR1_SU0_SUM0_SUS128_VWA8_VWB2_WGM1_WGMXCC1_WGMXCCGn1
    SolutionIndex: 56
    SolutionNameMin: Cijk_Alik_Bjlk_B8NBS_BH_Bias_HAS_SAV_UserArgs_MT128x128x128_MI16x16x1_SN_LDSB1_CLR1_GRVWA8_GRVWB16_GSU0_GSUC0_GSUWGMRR0_K1_LBSPPA1024_LBSPPB1024_LPA8_LPB32_LRVW8_MIWT8_2_PLR1_SU0_SUM0_SUS128_VWA8_VWB2_WGM6_WGMXCC1_WGMXCCGn1
    SolutionIndex: 57
    SolutionNameMin: Cijk_Alik_Bjlk_B8NBS_BH_Bias_HAS_SAV_UserArgs_MT64x128x128_MI16x16x1_SN_LDSB1_CLR1_GRVWA16_GRVWB8_GSU0_GSUC0_GSUWGMRR0_K1_LBSPPA128_LBSPPB1024_LPA16_LPB0_LRVW8_MIWT1_8_PLR1_SU0_SUM0_SUS128_VWA1_VWB8_WGM4_WGMXCC1_WGMXCCGn1
    SolutionIndex: 58
    SolutionNameMin: Cijk_Alik_Bjlk_B8NBS_BH_Bias_HAS_SAV_UserArgs_MT144x64x128_MI16x16x1_SN_LDSB1_CLR1_GRVWA8_GRVWB16_GSU0_GSUC0_GSUWGMRR0_K1_LBSPPA128_LBSPPB512_LPA8_LPB16_LRVW8_MIWT9_1_PLR1_SU0_SUM0_SUS128_VWA1_VWB1_WGM6_WGMXCC1_WGMXCCGn1
    SolutionIndex: 59
    SolutionNameMin: Cijk_Alik_Bjlk_B8NBS_BH_Bias_HAS_SAV_UserArgs_MT144x128x128_MI16x16x1_SN_LDSB1_CLR1_GRVWA8_GRVWB16_GSU0_GSUC0_GSUWGMRR0_K1_LBSPPA128_LBSPPB1024_LPA8_LPB32_LRVW8_MIWT9_2_PLR1_SU0_SUM0_SUS128_VWA1_VWB2_WGM4_WGMXCC1_WGMXCCGn1
    SolutionIndex: 60
    SolutionNameMin: Cijk_Alik_Bjlk_B8NBS_BH_Bias_HAS_SAV_UserArgs_MT144x128x128_MI16x16x1_SN_LDSB1_CLR1_GRVWA8_GRVWB16_GSU0_GSUC0_GSUWGMRR0_K1_LBSPPA128_LBSPPB1024_LPA8_LPB32_LRVW8_MIWT9_2_PLR1_SU0_SUM0_SUS128_VWA1_VWB2_WGM8_WGMXCC1_WGMXCCGn1
    SolutionIndex: 61
    SolutionNameMin: Cijk_Alik_Bjlk_B8NBS_BH_Bias_HAS_SAV_UserArgs_MT128x128x128_MI16x16x1_SN_LDSB1_CLR1_GRVWA16_GRVWB16_GSU0_GSUC0_GSUWGMRR0_K1_LBSPPA512_LBSPPB1024_LPA16_LPB64_LRVW8_MIWT4_4_PLR1_SU0_SUM0_SUS128_VWA4_VWB4_WGM1_WGMXCC1_WGMXCCGn1
    SolutionIndex: 62
    SolutionNameMin: Cijk_Alik_Bjlk_B8NBS_BH_Bias_HAS_SAV_UserArgs_MT128x128x128_MI16x16x1_SN_LDSB1_CLR1_GRVWA16_GRVWB16_GSU0_GSUC0_GSUWGMRR0_K1_LBSPPA512_LBSPPB1024_LPA16_LPB64_LRVW8_MIWT4_4_PLR1_SU0_SUM0_SUS128_VWA4_VWB4_WGM4_WGMXCC1_WGMXCCGn1
    SolutionIndex: 63
    SolutionNameMin: Cijk_Alik_Bjlk_B8NBS_BH_Bias_HAS_SAV_UserArgs_MT128x128x128_MI16x16x1_SN_LDSB1_CLR1_GRVWA16_GRVWB16_GSU0_GSUC0_GSUWGMRR0_K1_LBSPPA512_LBSPPB1024_LPA16_LPB64_LRVW8_MIWT4_4_PLR1_SU0_SUM0_SUS128_VWA4_VWB4_WGM6_WGMXCC1_WGMXCCGn1
    SolutionIndex: 64
    SolutionNameMin: Cijk_Alik_Bjlk_B8NBS_BH_Bias_HAS_SAV_UserArgs_MT128x128x128_MI16x16x1_SN_LDSB1_CLR1_GRVWA16_GRVWB16_GSU0_GSUC0_GSUWGMRR0_K1_LBSPPA512_LBSPPB1024_LPA16_LPB64_LRVW8_MIWT4_4_PLR1_SU0_SUM0_SUS128_VWA4_VWB4_WGM8_WGMXCC1_WGMXCCGn1
    SolutionIndex: 65
    SolutionNameMin: Cijk_Alik_Bjlk_B8NBS_BH_Bias_HAS_SAV_UserArgs_MT64x128x128_MI16x16x1_SN_LDSB1_CLR1_GRVWA8_GRVWB16_GSU0_GSUC0_GSUWGMRR0_K1_LBSPPA256_LBSPPB1024_LPA8_LPB64_LRVW8_MIWT2_4_PLR1_SU0_SUM0_SUS128_VWA2_VWB4_WGM1_WGMXCC1_WGMXCCGn1
    SolutionIndex: 66
    SolutionNameMin: Cijk_Alik_Bjlk_B8NBS_BH_Bias_HAS_SAV_UserArgs_MT128x64x128_MI16x16x1_SN_LDSB1_CLR1_GRVWA16_GRVWB16_GSU0_GSUC0_GSUWGMRR0_K1_LBSPPA512_LBSPPB512_LPA16_LPB32_LRVW8_MIWT4_2_PLR1_SU0_SUM0_SUS128_VWA4_VWB2_WGM1_WGMXCC1_WGMXCCGn1
    SolutionIndex: 67
    SolutionNameMin: Cijk_Alik_Bjlk_B8NBS_BH_Bias_HAS_SAV_UserArgs_MT128x64x128_MI16x16x1_SN_LDSB1_CLR1_GRVWA16_GRVWB16_GSU0_GSUC0_GSUWGMRR0_K1_LBSPPA512_LBSPPB512_LPA16_LPB32_LRVW8_MIWT4_2_PLR1_SU0_SUM0_SUS128_VWA4_VWB2_WGM4_WGMXCC1_WGMXCCGn1
    SolutionIndex: 68
    SolutionNameMin: Cijk_Alik_Bjlk_B8NBS_BH_Bias_HAS_SAV_UserArgs_MT128x64x128_MI16x16x1_SN_LDSB1_CLR1_GRVWA16_GRVWB16_GSU0_GSUC0_GSUWGMRR0_K1_LBSPPA512_LBSPPB512_LPA16_LPB32_LRVW8_MIWT4_2_PLR1_SU0_SUM0_SUS128_VWA4_VWB2_WGM8_WGMXCC1_WGMXCCGn1
    SolutionIndex: 69
    SolutionNameMin: Cijk_Alik_Bjlk_B8NBS_BH_Bias_HAS_SAV_UserArgs_MT64x64x128_MI16x16x1_SN_LDSB1_CLR1_GRVWA8_GRVWB16_GSU0_GSUC0_GSUWGMRR0_K1_LBSPPA256_LBSPPB512_LPA8_LPB32_LRVW8_MIWT2_2_PLR1_SU0_SUM0_SUS128_VWA2_VWB2_WGM1_WGMXCC1_WGMXCCGn1
    SolutionIndex: 70
    SolutionNameMin: Cijk_Alik_Bjlk_B8NBS_BH_Bias_HAS_SAV_UserArgs_MT64x64x128_MI16x16x1_SN_LDSB1_CLR1_GRVWA16_GRVWB16_GSU0_GSUC0_GSUWGMRR0_K1_LBSPPA256_LBSPPB512_LPA16_LPB32_LRVW8_MIWT2_2_PLR1_SU0_SUM0_SUS128_VWA2_VWB2_WGM1_WGMXCC1_WGMXCCGn1
    SolutionIndex: 71
    SolutionNameMin: Cijk_Alik_Bjlk_B8NBS_BH_Bias_HAS_SAV_UserArgs_MT64x64x128_MI16x16x1_SN_LDSB1_CLR1_GRVWA8_GRVWB16_GSU0_GSUC0_GSUWGMRR0_K1_LBSPPA256_LBSPPB512_LPA8_LPB32_LRVW8_MIWT2_2_PLR1_SU0_SUM0_SUS128_VWA2_VWB2_WGM4_WGMXCC1_WGMXCCGn1
    SolutionIndex: 72
    SolutionNameMin: Cijk_Alik_Bjlk_B8NBS_BH_Bias_HAS_SAV_UserArgs_MT64x64x128_MI16x16x1_SN_LDSB1_CLR1_GRVWA8_GRVWB16_GSU0_GSUC0_GSUWGMRR0_K1_LBSPPA256_LBSPPB512_LPA8_LPB32_LRVW8_MIWT2_2_PLR1_SU0_SUM0_SUS128_VWA2_VWB2_WGM8_WGMXCC1_WGMXCCGn1
    SolutionIndex: 73
    SolutionNameMin: Cijk_Alik_Bjlk_B8NBS_BH_Bias_HAS_SAV_UserArgs_MT32x64x128_MI16x16x1_SN_LDSB0_CLR1_GRVWA8_GRVWB8_GSU0_GSUC0_GSUWGMRR0_K1_LBSPPA128_LBSPPB512_LPA8_LPB32_LRVW8_MIWT1_2_PLR1_SU0_SUM0_SUS128_VWA1_VWB2_WGM1_WGMXCC1_WGMXCCGn1
    SolutionIndex: 74
    SolutionNameMin: Cijk_Alik_Bjlk_B8NBS_BH_Bias_HAS_SAV_UserArgs_MT32x64x128_MI16x16x1_SN_LDSB0_CLR1_GRVWA8_GRVWB16_GSU0_GSUC0_GSUWGMRR0_K1_LBSPPA128_LBSPPB512_LPA8_LPB32_LRVW8_MIWT1_2_PLR1_SU0_SUM0_SUS128_VWA1_VWB2_WGM4_WGMXCC1_WGMXCCGn1
    SolutionIndex: 75
    SolutionNameMin: Cijk_Alik_Bjlk_B8NBS_BH_Bias_HAS_SAV_UserArgs_MT64x32x128_MI16x16x1_SN_LDSB0_CLR1_GRVWA8_GRVWB8_GSU0_GSUC0_GSUWGMRR0_K1_LBSPPA256_LBSPPB256_LPA8_LPB16_LRVW8_MIWT2_1_PLR1_SU0_SUM0_SUS128_VWA2_VWB1_WGM1_WGMXCC1_WGMXCCGn1
    SolutionIndex: 76
    SolutionNameMin: Cijk_Alik_Bjlk_B8NBS_BH_Bias_HAS_SAV_UserArgs_MT64x32x128_MI16x16x1_SN_LDSB0_CLR1_GRVWA16_GRVWB8_GSU0_GSUC0_GSUWGMRR0_K1_LBSPPA256_LBSPPB256_LPA16_LPB16_LRVW8_MIWT2_1_PLR1_SU0_SUM0_SUS128_VWA2_VWB1_WGM1_WGMXCC1_WGMXCCGn1
    SolutionIndex: 77
    SolutionNameMin: Cijk_Alik_Bjlk_B8NBS_BH_Bias_HAS_SAV_UserArgs_MT64x32x128_MI16x16x1_SN_LDSB0_CLR1_GRVWA8_GRVWB16_GSU0_GSUC0_GSUWGMRR0_K1_LBSPPA256_LBSPPB256_LPA8_LPB16_LRVW8_MIWT2_1_PLR1_SU0_SUM0_SUS128_VWA2_VWB1_WGM1_WGMXCC1_WGMXCCGn1
    SolutionIndex: 78
    SolutionNameMin: Cijk_Alik_Bjlk_B8NBS_BH_Bias_HAS_SAV_UserArgs_MT64x32x128_MI16x16x1_SN_LDSB0_CLR1_GRVWA8_GRVWB16_GSU0_GSUC0_GSUWGMRR0_K1_LBSPPA256_LBSPPB256_LPA8_LPB16_LRVW8_MIWT2_1_PLR1_SU0_SUM0_SUS128_VWA2_VWB1_WGM4_WGMXCC1_WGMXCCGn1
    SolutionIndex: 79
    SolutionNameMin: Cijk_Alik_Bjlk_B8NBS_BH_Bias_HAS_SAV_UserArgs_MT64x32x128_MI16x16x1_SN_LDSB0_CLR1_GRVWA8_GRVWB16_GSU0_GSUC0_GSUWGMRR0_K1_LBSPPA256_LBSPPB256_LPA8_LPB16_LRVW8_MIWT2_1_PLR1_SU0_SUM0_SUS128_VWA2_VWB1_WGM6_WGMXCC1_WGMXCCGn1
    SolutionIndex: 80
    SolutionNameMin: Cijk_Alik_Bjlk_B8NBS_BH_Bias_HAS_SAV_UserArgs_MT32x32x128_MI16x16x1_SN_LDSB0_CLR1_GRVWA8_GRVWB8_GSU0_GSUC0_GSUWGMRR0_K1_LBSPPA128_LBSPPB256_LPA8_LPB16_LRVW8_MIWT1_1_PLR1_SU0_SUM0_SUS128_VWA1_VWB1_WGM1_WGMXCC1_WGMXCCGn1
    SolutionIndex: 81
    SolutionNameMin: Cijk_Alik_Bjlk_B8NBS_BH_Bias_HAS_SAV_UserArgs_MT32x32x128_MI16x16x1_SN_LDSB0_CLR1_GRVWA16_GRVWB8_GSU0_GSUC0_GSUWGMRR0_K1_LBSPPA128_LBSPPB256_LPA16_LPB16_LRVW8_MIWT1_1_PLR1_SU0_SUM0_SUS128_VWA1_VWB1_WGM1_WGMXCC1_WGMXCCGn1
    SolutionIndex: 82
    SolutionNameMin: Cijk_Alik_Bjlk_B8NBS_BH_Bias_HAS_SAV_UserArgs_MT32x32x128_MI16x16x1_SN_LDSB0_CLR1_GRVWA8_GRVWB16_GSU0_GSUC0_GSUWGMRR0_K1_LBSPPA128_LBSPPB256_LPA8_LPB16_LRVW8_MIWT1_1_PLR1_SU0_SUM0_SUS128_VWA1_VWB1_WGM1_WGMXCC1_WGMXCCGn1
    SolutionIndex: 83
    SolutionNameMin: Cijk_Alik_Bjlk_B8NBS_BH_Bias_HAS_SAV_UserArgs_MT32x32x128_MI16x16x1_SN_LDSB0_CLR1_GRVWA8_GRVWB16_GSU0_GSUC0_GSUWGMRR0_K1_LBSPPA128_LBSPPB256_LPA8_LPB16_LRVW8_MIWT1_1_PLR1_SU0_SUM0_SUS128_VWA1_VWB1_WGM4_WGMXCC1_WGMXCCGn1
    SolutionIndex: 84
    SolutionNameMin: Cijk_Alik_Bjlk_B8NBS_BH_Bias_HAS_SAV_UserArgs_MT32x32x128_MI16x16x1_SN_LDSB0_CLR1_GRVWA8_GRVWB8_GSU0_GSUC0_GSUWGMRR0_K1_LBSPPA128_LBSPPB256_LPA8_LPB16_LRVW8_MIWT1_1_PLR1_SU0_SUM0_SUS128_VWA1_VWB1_WGM8_WGMXCC1_WGMXCCGn1
    SolutionIndex: 85
    SolutionNameMin: Cijk_Alik_Bjlk_B8NBS_BH_Bias_HAS_SAV_UserArgs_MT32x32x128_MI16x16x1_SN_LDSB0_CLR1_GRVWA8_GRVWB16_GSU0_GSUC0_GSUWGMRR0_K1_LBSPPA128_LBSPPB256_LPA8_LPB16_LRVW8_MIWT1_1_PLR1_SU0_SUM0_SUS128_VWA1_VWB1_WGM8_WGMXCC1_WGMXCCGn1
    SolutionIndex: 86
    SolutionNameMin: Cijk_Alik_Bjlk_B8NBS_BH_Bias_HAS_SAV_UserArgs_MT32x32x128_MI16x16x1_SN_LDSB0_CLR1_GRVWA16_GRVWB16_GSU0_GSUC0_GSUWGMRR0_K1_LBSPPA128_LBSPPB256_LPA16_LPB16_LRVW8_MIWT1_1_PLR1_SU0_SUM0_SUS128_VWA1_VWB1_WGM8_WGMXCC1_WGMXCCGn1
    SolutionIndex: 87
    SolutionNameMin: Cijk_Alik_Bjlk_B8NBS_BH_Bias_HAS_SAV_UserArgs_MT128x64x256_MI16x16x1_SN_LDSB1_CLR1_GRVWA16_GRVWB16_GSU0_GSUC0_GSUWGMRR0_K1_LBSPPA1024_LBSPPB512_LPA16_LPB32_LRVW8_MIWT4_2_PLR1_SU0_SUM0_SUS256_VWA4_VWB2_WGM1_WGMXCC1_WGMXCCGn1
    SolutionIndex: 88
    SolutionNameMin: Cijk_Alik_Bjlk_B8NBS_BH_Bias_HAS_SAV_UserArgs_MT128x64x256_MI16x16x1_SN_LDSB1_CLR1_GRVWA16_GRVWB16_GSU0_GSUC0_GSUWGMRR0_K1_LBSPPA1024_LBSPPB512_LPA16_LPB32_LRVW8_MIWT4_2_PLR1_SU0_SUM0_SUS256_VWA4_VWB2_WGM4_WGMXCC1_WGMXCCGn1
    SolutionIndex: 89
    SolutionNameMin: Cijk_Alik_Bjlk_B8NBS_BH_Bias_HAS_SAV_UserArgs_MT128x64x256_MI16x16x1_SN_LDSB1_CLR1_GRVWA16_GRVWB16_GSU0_GSUC0_GSUWGMRR0_K1_LBSPPA1024_LBSPPB512_LPA16_LPB32_LRVW8_MIWT4_2_PLR1_SU0_SUM0_SUS256_VWA4_VWB2_WGM6_WGMXCC1_WGMXCCGn1
    SolutionIndex: 90
    SolutionNameMin: Cijk_Alik_Bjlk_B8NBS_BH_Bias_HAS_SAV_UserArgs_MT128x64x256_MI16x16x1_SN_LDSB1_CLR1_GRVWA16_GRVWB16_GSU0_GSUC0_GSUWGMRR0_K1_LBSPPA1024_LBSPPB512_LPA16_LPB32_LRVW8_MIWT4_2_PLR1_SU0_SUM0_SUS256_VWA4_VWB2_WGM8_WGMXCC1_WGMXCCGn1
    SolutionIndex: 91
    SolutionNameMin: Cijk_Alik_Bjlk_B8NBS_BH_Bias_HAS_SAV_UserArgs_MT64x64x256_MI16x16x1_SN_LDSB1_CLR1_GRVWA16_GRVWB16_GSU0_GSUC0_GSUWGMRR0_K1_LBSPPA512_LBSPPB512_LPA16_LPB32_LRVW8_MIWT2_2_PLR1_SU0_SUM0_SUS256_VWA2_VWB2_WGM1_WGMXCC1_WGMXCCGn1
    SolutionIndex: 92
    SolutionNameMin: Cijk_Alik_Bjlk_B8NBS_BH_Bias_HAS_SAV_UserArgs_MT64x64x256_MI16x16x1_SN_LDSB1_CLR1_GRVWA16_GRVWB16_GSU0_GSUC0_GSUWGMRR0_K1_LBSPPA512_LBSPPB512_LPA16_LPB32_LRVW8_MIWT2_2_PLR1_SU0_SUM0_SUS256_VWA2_VWB2_WGM4_WGMXCC1_WGMXCCGn1
    SolutionIndex: 93
    SolutionNameMin: Cijk_Alik_Bjlk_B8NBS_BH_Bias_HAS_SAV_UserArgs_MT64x64x256_MI16x16x1_SN_LDSB1_CLR1_GRVWA16_GRVWB16_GSU0_GSUC0_GSUWGMRR0_K1_LBSPPA512_LBSPPB512_LPA16_LPB32_LRVW8_MIWT2_2_PLR1_SU0_SUM0_SUS256_VWA2_VWB2_WGM6_WGMXCC1_WGMXCCGn1
    SolutionIndex: 94
    SolutionNameMin: Cijk_Alik_Bjlk_B8NBS_BH_Bias_HAS_SAV_UserArgs_MT64x64x256_MI16x16x1_SN_LDSB1_CLR1_GRVWA16_GRVWB16_GSU0_GSUC0_GSUWGMRR0_K1_LBSPPA512_LBSPPB512_LPA16_LPB32_LRVW8_MIWT2_2_PLR1_SU0_SUM0_SUS256_VWA2_VWB2_WGM8_WGMXCC1_WGMXCCGn1
    SolutionIndex: 95
    SolutionNameMin: Cijk_Alik_Bjlk_B8NBS_BH_Bias_HAS_SAV_UserArgs_MT32x64x256_MI16x16x1_SN_LDSB1_CLR1_GRVWA8_GRVWB16_GSU0_GSUC0_GSUWGMRR0_K1_LBSPPA256_LBSPPB512_LPA8_LPB32_LRVW8_MIWT1_2_PLR1_SU0_SUM0_SUS256_VWA1_VWB2_WGM1_WGMXCC1_WGMXCCGn1
    SolutionIndex: 96
    SolutionNameMin: Cijk_Alik_Bjlk_B8NBS_BH_Bias_HAS_SAV_UserArgs_MT32x64x256_MI16x16x1_SN_LDSB1_CLR1_GRVWA16_GRVWB16_GSU0_GSUC0_GSUWGMRR0_K1_LBSPPA256_LBSPPB512_LPA16_LPB32_LRVW8_MIWT1_2_PLR1_SU0_SUM0_SUS256_VWA1_VWB2_WGM1_WGMXCC1_WGMXCCGn1
    SolutionIndex: 97
    SolutionNameMin: Cijk_Alik_Bjlk_B8NBS_BH_Bias_HAS_SAV_UserArgs_MT32x64x256_MI16x16x1_SN_LDSB1_CLR1_GRVWA8_GRVWB16_GSU0_GSUC0_GSUWGMRR0_K1_LBSPPA256_LBSPPB512_LPA8_LPB32_LRVW8_MIWT1_2_PLR1_SU0_SUM0_SUS256_VWA1_VWB2_WGM6_WGMXCC1_WGMXCCGn1
    SolutionIndex: 98
    SolutionNameMin: Cijk_Alik_Bjlk_B8NBS_BH_Bias_HAS_SAV_UserArgs_MT32x64x256_MI16x16x1_SN_LDSB1_CLR1_GRVWA16_GRVWB16_GSU0_GSUC0_GSUWGMRR0_K1_LBSPPA256_LBSPPB512_LPA16_LPB32_LRVW8_MIWT1_2_PLR1_SU0_SUM0_SUS256_VWA1_VWB2_WGM6_WGMXCC1_WGMXCCGn1
    SolutionIndex: 99
    SolutionNameMin: Cijk_Alik_Bjlk_B8NBS_BH_Bias_HAS_SAV_UserArgs_MT32x64x256_MI16x16x1_SN_LDSB1_CLR1_GRVWA8_GRVWB16_GSU0_GSUC0_GSUWGMRR0_K1_LBSPPA256_LBSPPB512_LPA8_LPB32_LRVW8_MIWT1_2_PLR1_SU0_SUM0_SUS256_VWA1_VWB2_WGM8_WGMXCC1_WGMXCCGn1
    SolutionIndex: 100
    SolutionNameMin: Cijk_Alik_Bjlk_B8NBS_BH_Bias_HAS_SAV_UserArgs_MT64x32x256_MI16x16x1_SN_LDSB1_CLR1_GRVWA16_GRVWB16_GSU0_GSUC0_GSUWGMRR0_K1_LBSPPA512_LBSPPB256_LPA16_LPB16_LRVW8_MIWT2_1_PLR1_SU0_SUM0_SUS256_VWA2_VWB1_WGM1_WGMXCC1_WGMXCCGn1
    SolutionIndex: 101
    SolutionNameMin: Cijk_Alik_Bjlk_B8NBS_BH_Bias_HAS_SAV_UserArgs_MT32x32x256_MI16x16x1_SN_LDSB1_CLR1_GRVWA8_GRVWB16_GSU0_GSUC0_GSUWGMRR0_K1_LBSPPA256_LBSPPB256_LPA8_LPB16_LRVW8_MIWT1_1_PLR1_SU0_SUM0_SUS256_VWA1_VWB1_WGM1_WGMXCC1_WGMXCCGn1
    SolutionIndex: 102
    SolutionNameMin: Cijk_Alik_Bjlk_B8NBS_BH_Bias_HAS_SAV_UserArgs_MT32x32x256_MI16x16x1_SN_LDSB1_CLR1_GRVWA16_GRVWB16_GSU0_GSUC0_GSUWGMRR0_K1_LBSPPA256_LBSPPB256_LPA16_LPB16_LRVW8_MIWT1_1_PLR1_SU0_SUM0_SUS256_VWA1_VWB1_WGM1_WGMXCC1_WGMXCCGn1
    SolutionIndex: 103
    SolutionNameMin: Cijk_Alik_Bjlk_B8NBS_BH_Bias_HAS_SAV_UserArgs_MT32x32x256_MI16x16x1_SN_LDSB1_CLR1_GRVWA16_GRVWB16_GSU0_GSUC0_GSUWGMRR0_K1_LBSPPA256_LBSPPB256_LPA16_LPB16_LRVW8_MIWT1_1_PLR1_SU0_SUM0_SUS256_VWA1_VWB1_WGM6_WGMXCC1_WGMXCCGn1
- - - [128, 128, 1, 128, 128, 128, 128, 128]
    - [86, 0.51]
  - - [128, 128, 1, 256, 128, 128, 256, 128]
    - [80, 1.0]
  - - [128, 128, 1, 512, 128, 128, 512, 128]
    - [80, 1.72]
  - - [128, 128, 1, 1024, 128, 128, 1024, 128]
    - [80, 2.71]
  - - [128, 128, 1, 2048, 128, 128, 2048, 128]
    - [82, 3.83]
  - - [128, 128, 1, 4096, 128, 128, 4096, 128]
    - [82, 4.84]
  - - [128, 128, 1, 8192, 128, 128, 8192, 128]
    - [83, 5.5]
  - - [128, 256, 1, 128, 128, 128, 128, 256]
    - [39, 1.05]
  - - [128, 256, 1, 256, 128, 128, 256, 256]
    - [38, 1.96]
  - - [128, 256, 1, 512, 128, 128, 512, 256]
    - [80, 3.47]
  - - [128, 256, 1, 1024, 128, 128, 1024, 256]
    - [80, 5.48]
  - - [128, 256, 1, 2048, 128, 128, 2048, 256]
    - [80, 7.64]
  - - [128, 256, 1, 4096, 128, 128, 4096, 256]
    - [82, 9.69]
  - - [128, 256, 1, 8192, 128, 128, 8192, 256]
    - [82, 11.05]
  - - [128, 512, 1, 128, 128, 128, 128, 512]
    - [80, 2.22]
  - - [128, 512, 1, 256, 128, 128, 256, 512]
    - [38, 3.93]
  - - [128, 512, 1, 512, 128, 128, 512, 512]
    - [80, 6.8]
  - - [128, 512, 1, 1024, 128, 128, 1024, 512]
    - [80, 10.89]
  - - [128, 512, 1, 2048, 128, 128, 2048, 512]
    - [80, 15.26]
  - - [128, 512, 1, 4096, 128, 128, 4096, 512]
    - [82, 19.17]
  - - [128, 512, 1, 8192, 128, 128, 8192, 512]
    - [102, 18.23]
  - - [128, 1024, 1, 128, 128, 128, 128, 1024]
    - [38, 4.22]
  - - [128, 1024, 1, 256, 128, 128, 256, 1024]
    - [81, 7.68]
  - - [128, 1024, 1, 512, 128, 128, 512, 1024]
    - [80, 13.17]
  - - [128, 1024, 1, 1024, 128, 128, 1024, 1024]
    - [80, 20.83]
  - - [128, 1024, 1, 2048, 128, 128, 2048, 1024]
    - [80, 29.47]
  - - [128, 1024, 1, 4096, 128, 128, 4096, 1024]
    - [102, 31.01]
  - - [128, 1024, 1, 8192, 128, 128, 8192, 1024]
    - [103, 32.83]
  - - [128, 2048, 1, 128, 128, 128, 128, 2048]
    - [36, 7.94]
  - - [128, 2048, 1, 256, 128, 128, 256, 2048]
    - [73, 14.33]
  - - [128, 2048, 1, 512, 128, 128, 512, 2048]
    - [76, 24.08]
  - - [128, 2048, 1, 1024, 128, 128, 1024, 2048]
    - [77, 36.98]
  - - [128, 2048, 1, 2048, 128, 128, 2048, 2048]
    - [96, 43.85]
  - - [128, 2048, 1, 4096, 128, 128, 4096, 2048]
    - [96, 52.54]
  - - [128, 2048, 1, 8192, 128, 128, 8192, 2048]
    - [96, 59.33]
  - - [128, 4096, 1, 128, 128, 128, 128, 4096]
    - [32, 14.24]
  - - [128, 4096, 1, 256, 128, 128, 256, 4096]
    - [32, 25.69]
  - - [128, 4096, 1, 512, 128, 128, 512, 4096]
    - [70, 42.11]
  - - [128, 4096, 1, 1024, 128, 128, 1024, 4096]
    - [69, 63.41]
  - - [128, 4096, 1, 2048, 128, 128, 2048, 4096]
    - [91, 77.53]
  - - [128, 4096, 1, 4096, 128, 128, 4096, 4096]
    - [91, 95.91]
  - - [128, 4096, 1, 8192, 128, 128, 8192, 4096]
    - [91, 108.25]
  - - [128, 8192, 1, 128, 128, 128, 128, 8192]
    - [25, 23.97]
  - - [128, 8192, 1, 256, 128, 128, 256, 8192]
    - [29, 42.01]
  - - [128, 8192, 1, 512, 128, 128, 512, 8192]
    - [29, 68.94]
  - - [128, 8192, 1, 1024, 128, 128, 1024, 8192]
    - [29, 101.91]
  - - [128, 8192, 1, 2048, 128, 128, 2048, 8192]
    - [87, 119.69]
  - - [128, 8192, 1, 4096, 128, 128, 4096, 8192]
    - [65, 143.12]
  - - [128, 8192, 1, 8192, 128, 128, 8192, 8192]
    - [88, 152.98]
  - - [256, 128, 1, 128, 256, 256, 128, 128]
    - [83, 1.0]
  - - [256, 128, 1, 256, 256, 256, 256, 128]
    - [38, 1.96]
  - - [256, 128, 1, 512, 256, 256, 512, 128]
    - [80, 3.4]
  - - [256, 128, 1, 1024, 256, 256, 1024, 128]
    - [80, 5.46]
  - - [256, 128, 1, 2048, 256, 256, 2048, 128]
    - [80, 7.62]
  - - [256, 128, 1, 4096, 256, 256, 4096, 128]
    - [82, 9.57]
  - - [256, 128, 1, 8192, 256, 256, 8192, 128]
    - [82, 11.08]
  - - [256, 256, 1, 128, 256, 256, 128, 256]
    - [81, 2.07]
  - - [256, 256, 1, 256, 256, 256, 256, 256]
    - [38, 3.83]
  - - [256, 256, 1, 512, 256, 256, 512, 256]
    - [80, 6.84]
  - - [256, 256, 1, 1024, 256, 256, 1024, 256]
    - [80, 10.65]
  - - [256, 256, 1, 2048, 256, 256, 2048, 256]
    - [82, 15.21]
  - - [256, 256, 1, 4096, 256, 256, 4096, 256]
    - [82, 19.11]
  - - [256, 256, 1, 8192, 256, 256, 8192, 256]
    - [83, 21.84]
  - - [256, 512, 1, 128, 256, 256, 128, 512]
    - [84, 4.06]
  - - [256, 512, 1, 256, 256, 256, 256, 512]
    - [80, 7.89]
  - - [256, 512, 1, 512, 256, 256, 512, 512]
    - [80, 13.47]
  - - [256, 512, 1, 1024, 256, 256, 1024, 512]
    - [80, 21.38]
  - - [256, 512, 1, 2048, 256, 256, 2048, 512]
    - [80, 29.84]
  - - [256, 512, 1, 4096, 256, 256, 4096, 512]
    - [82, 37.54]
  - - [256, 512, 1, 8192, 256, 256, 8192, 512]
    - [101, 38.7]
  - - [256, 1024, 1, 128, 256, 256, 128, 1024]
    - [76, 7.97]
  - - [256, 1024, 1, 256, 256, 256, 256, 1024]
    - [75, 14.23]
  - - [256, 1024, 1, 512, 256, 256, 512, 1024]
    - [76, 24.47]
  - - [256, 1024, 1, 1024, 256, 256, 1024, 1024]
    - [77, 37.6]
  - - [256, 1024, 1, 2048, 256, 256, 2048, 1024]
    - [77, 51.42]
  - - [256, 1024, 1, 4096, 256, 256, 4096, 1024]
    - [100, 57.81]
  - - [256, 1024, 1, 8192, 256, 256, 8192, 1024]
    - [98, 59.71]
  - - [256, 2048, 1, 128, 256, 256, 128, 2048]
    - [32, 14.26]
  - - [256, 2048, 1, 256, 256, 256, 256, 2048]
    - [32, 25.91]
  - - [256, 2048, 1, 512, 256, 256, 512, 2048]
    - [32, 42.46]
  - - [256, 2048, 1, 1024, 256, 256, 1024, 2048]
    - [70, 63.71]
  - - [256, 2048, 1, 2048, 256, 256, 2048, 2048]
    - [91, 79.51]
  - - [256, 2048, 1, 4096, 256, 256, 4096, 2048]
    - [91, 96.12]
  - - [256, 2048, 1, 8192, 256, 256, 8192, 2048]
    - [91, 108.34]
  - - [256, 4096, 1, 128, 256, 256, 128, 4096]
    - [27, 23.36]
  - - [256, 4096, 1, 256, 256, 256, 256, 4096]
    - [26, 41.65]
  - - [256, 4096, 1, 512, 256, 256, 512, 4096]
    - [29, 67.87]
  - - [256, 4096, 1, 1024, 256, 256, 1024, 4096]
    - [29, 101.31]
  - - [256, 4096, 1, 2048, 256, 256, 2048, 4096]
    - [87, 122.9]
  - - [256, 4096, 1, 4096, 256, 256, 4096, 4096]
    - [87, 149.04]
  - - [256, 4096, 1, 8192, 256, 256, 8192, 4096]
    - [87, 164.05]
  - - [256, 8192, 1, 128, 256, 256, 128, 8192]
    - [55, 36.66]
  - - [256, 8192, 1, 256, 256, 256, 256, 8192]
    - [23, 63.09]
  - - [256, 8192, 1, 512, 256, 256, 512, 8192]
    - [23, 102.37]
  - - [256, 8192, 1, 1024, 256, 256, 1024, 8192]
    - [61, 151.07]
  - - [256, 8192, 1, 2048, 256, 256, 2048, 8192]
    - [61, 180.17]
  - - [256, 8192, 1, 4096, 256, 256, 4096, 8192]
    - [61, 206.43]
  - - [256, 8192, 1, 8192, 256, 256, 8192, 8192]
    - [61, 205.55]
  - - [512, 128, 1, 128, 512, 512, 128, 128]
    - [38, 2.18]
  - - [512, 128, 1, 256, 512, 512, 256, 128]
    - [80, 4.03]
  - - [512, 128, 1, 512, 512, 512, 512, 128]
    - [80, 6.82]
  - - [512, 128, 1, 1024, 512, 512, 1024, 128]
    - [82, 10.78]
  - - [512, 128, 1, 2048, 512, 512, 2048, 128]
    - [80, 15.04]
  - - [512, 128, 1, 4096, 512, 512, 4096, 128]
    - [82, 19.12]
  - - [512, 128, 1, 8192, 512, 512, 8192, 128]
    - [82, 21.98]
  - - [512, 256, 1, 128, 512, 512, 128, 256]
    - [80, 4.34]
  - - [512, 256, 1, 256, 512, 512, 256, 256]
    - [80, 7.79]
  - - [512, 256, 1, 512, 512, 512, 512, 256]
    - [80, 13.71]
  - - [512, 256, 1, 1024, 512, 512, 1024, 256]
    - [80, 21.3]
  - - [512, 256, 1, 2048, 512, 512, 2048, 256]
    - [82, 29.94]
  - - [512, 256, 1, 4096, 512, 512, 4096, 256]
    - [82, 37.44]
  - - [512, 256, 1, 8192, 512, 512, 8192, 256]
    - [85, 43.07]
  - - [512, 512, 1, 128, 512, 512, 128, 512]
    - [75, 8.03]
  - - [512, 512, 1, 256, 512, 512, 256, 512]
    - [76, 14.27]
  - - [512, 512, 1, 512, 512, 512, 512, 512]
    - [76, 24.46]
  - - [512, 512, 1, 1024, 512, 512, 1024, 512]
    - [77, 37.45]
  - - [512, 512, 1, 2048, 512, 512, 2048, 512]
    - [77, 50.92]
  - - [512, 512, 1, 4096, 512, 512, 4096, 512]
    - [78, 62.84]
  - - [512, 512, 1, 8192, 512, 512, 8192, 512]
    - [74, 63.94]
  - - [512, 1024, 1, 128, 512, 512, 128, 1024]
    - [33, 14.52]
  - - [512, 1024, 1, 256, 512, 512, 256, 1024]
    - [32, 25.64]
  - - [512, 1024, 1, 512, 512, 512, 512, 1024]
    - [69, 42.11]
  - - [512, 1024, 1, 1024, 512, 512, 1024, 1024]
    - [70, 63.07]
  - - [512, 1024, 1, 2048, 512, 512, 2048, 1024]
    - [91, 85.93]
  - - [512, 1024, 1, 4096, 512, 512, 4096, 1024]
    - [91, 96.91]
  - - [512, 1024, 1, 8192, 512, 512, 8192, 1024]
    - [93, 106.74]
  - - [512, 2048, 1, 128, 512, 512, 128, 2048]
    - [25, 23.44]
  - - [512, 2048, 1, 256, 512, 512, 256, 2048]
    - [25, 41.39]
  - - [512, 2048, 1, 512, 512, 512, 512, 2048]
    - [29, 68.04]
  - - [512, 2048, 1, 1024, 512, 512, 1024, 2048]
    - [29, 100.44]
  - - [512, 2048, 1, 2048, 512, 512, 2048, 2048]
    - [87, 124.72]
  - - [512, 2048, 1, 4096, 512, 512, 4096, 2048]
    - [87, 149.79]
  - - [512, 2048, 1, 8192, 512, 512, 8192, 2048]
    - [87, 160.04]
  - - [512, 4096, 1, 128, 512, 512, 128, 4096]
    - [55, 35.89]
  - - [512, 4096, 1, 256, 512, 512, 256, 4096]
    - [23, 63.96]
  - - [512, 4096, 1, 512, 512, 512, 512, 4096]
    - [61, 101.19]
  - - [512, 4096, 1, 1024, 512, 512, 1024, 4096]
    - [61, 149.28]
  - - [512, 4096, 1, 2048, 512, 512, 2048, 4096]
    - [61, 185.53]
  - - [512, 4096, 1, 4096, 512, 512, 4096, 4096]
    - [61, 213.8]
  - - [512, 4096, 1, 8192, 512, 512, 8192, 4096]
    - [61, 207.02]
  - - [512, 8192, 1, 128, 512, 512, 128, 8192]
    - [16, 51.09]
  - - [512, 8192, 1, 256, 512, 512, 256, 8192]
    - [16, 88.42]
  - - [512, 8192, 1, 512, 512, 512, 512, 8192]
    - [15, 141.82]
  - - [512, 8192, 1, 1024, 512, 512, 1024, 8192]
    - [46, 192.36]
  - - [512, 8192, 1, 2048, 512, 512, 2048, 8192]
    - [41, 232.37]
  - - [512, 8192, 1, 4096, 512, 512, 4096, 8192]
    - [41, 253.63]
  - - [512, 8192, 1, 8192, 512, 512, 8192, 8192]
    - [42, 241.1]
  - - [1024, 128, 1, 128, 1024, 1024, 128, 128]
    - [38, 4.18]
  - - [1024, 128, 1, 256, 1024, 1024, 256, 128]
    - [80, 7.58]
  - - [1024, 128, 1, 512, 1024, 1024, 512, 128]
    - [80, 13.12]
  - - [1024, 128, 1, 1024, 1024, 1024, 1024, 128]
    - [80, 20.78]
  - - [1024, 128, 1, 2048, 1024, 1024, 2048, 128]
    - [82, 29.52]
  - - [1024, 128, 1, 4096, 1024, 1024, 4096, 128]
    - [82, 37.49]
  - - [1024, 128, 1, 8192, 1024, 1024, 8192, 128]
    - [83, 42.89]
  - - [1024, 256, 1, 128, 1024, 1024, 128, 256]
    - [73, 7.53]
  - - [1024, 256, 1, 256, 1024, 1024, 256, 256]
    - [36, 14.16]
  - - [1024, 256, 1, 512, 1024, 1024, 512, 256]
    - [75, 23.61]
  - - [1024, 256, 1, 1024, 1024, 1024, 1024, 256]
    - [77, 36.83]
  - - [1024, 256, 1, 2048, 1024, 1024, 2048, 256]
    - [77, 50.63]
  - - [1024, 256, 1, 4096, 1024, 1024, 4096, 256]
    - [95, 62.37]
  - - [1024, 256, 1, 8192, 1024, 1024, 8192, 256]
    - [97, 70.69]
  - - [1024, 512, 1, 128, 1024, 1024, 128, 512]
    - [33, 14.0]
  - - [1024, 512, 1, 256, 1024, 1024, 256, 512]
    - [32, 25.16]
  - - [1024, 512, 1, 512, 1024, 1024, 512, 512]
    - [69, 41.05]
  - - [1024, 512, 1, 1024, 1024, 1024, 1024, 512]
    - [69, 61.96]
  - - [1024, 512, 1, 2048, 1024, 1024, 2048, 512]
    - [91, 85.61]
  - - [1024, 512, 1, 4096, 1024, 1024, 4096, 512]
    - [92, 102.25]
  - - [1024, 512, 1, 8192, 1024, 1024, 8192, 512]
    - [94, 107.34]
  - - [1024, 1024, 1, 128, 1024, 1024, 128, 1024]
    - [28, 23.24]
  - - [1024, 1024, 1, 256, 1024, 1024, 256, 1024]
    - [29, 41.39]
  - - [1024, 1024, 1, 512, 1024, 1024, 512, 1024]
    - [29, 68.0]
  - - [1024, 1024, 1, 1024, 1024, 1024, 1024, 1024]
    - [29, 100.75]
  - - [1024, 1024, 1, 2048, 1024, 1024, 2048, 1024]
    - [89, 126.13]
  - - [1024, 1024, 1, 4096, 1024, 1024, 4096, 1024]
    - [88, 146.8]
  - - [1024, 1024, 1, 8192, 1024, 1024, 8192, 1024]
    - [90, 158.72]
  - - [1024, 2048, 1, 128, 1024, 1024, 128, 2048]
    - [22, 36.11]
  - - [1024, 2048, 1, 256, 1024, 1024, 256, 2048]
    - [23, 63.38]
  - - [1024, 2048, 1, 512, 1024, 1024, 512, 2048]
    - [61, 102.05]
  - - [1024, 2048, 1, 1024, 1024, 1024, 1024, 2048]
    - [61, 145.53]
  - - [1024, 2048, 1, 2048, 1024, 1024, 2048, 2048]
    - [61, 185.23]
  - - [1024, 2048, 1, 4096, 1024, 1024, 4096, 2048]
    - [62, 213.18]
  - - [1024, 2048, 1, 8192, 1024, 1024, 8192, 2048]
    - [63, 204.61]
  - - [1024, 4096, 1, 128, 1024, 1024, 128, 4096]
    - [19, 52.56]
  - - [1024, 4096, 1, 256, 1024, 1024, 256, 4096]
    - [18, 90.85]
  - - [1024, 4096, 1, 512, 1024, 1024, 512, 4096]
    - [17, 137.91]
  - - [1024, 4096, 1, 1024, 1024, 1024, 1024, 4096]
    - [10, 185.83]
  - - [1024, 4096, 1, 2048, 1024, 1024, 2048, 4096]
    - [46, 235.3]
  - - [1024, 4096, 1, 4096, 1024, 1024, 4096, 4096]
    - [43, 255.91]
  - - [1024, 4096, 1, 8192, 1024, 1024, 8192, 4096]
    - [46, 244.14]
  - - [1024, 8192, 1, 128, 1024, 1024, 128, 8192]
    - [5, 60.3]
  - - [1024, 8192, 1, 256, 1024, 1024, 256, 8192]
    - [9, 104.56]
  - - [1024, 8192, 1, 512, 1024, 1024, 512, 8192]
    - [2, 163.6]
  - - [1024, 8192, 1, 1024, 1024, 1024, 1024, 8192]
    - [9, 226.77]
  - - [1024, 8192, 1, 2048, 1024, 1024, 2048, 8192]
    - [5, 267.78]
  - - [1024, 8192, 1, 4096, 1024, 1024, 4096, 8192]
    - [4, 265.27]
  - - [1024, 8192, 1, 8192, 1024, 1024, 8192, 8192]
    - [4, 283.97]
  - - [2048, 128, 1, 128, 2048, 2048, 128, 128]
    - [37, 7.75]
  - - [2048, 128, 1, 256, 2048, 2048, 256, 128]
    - [36, 14.02]
  - - [2048, 128, 1, 512, 2048, 2048, 512, 128]
    - [76, 23.49]
  - - [2048, 128, 1, 1024, 2048, 2048, 1024, 128]
    - [77, 36.64]
  - - [2048, 128, 1, 2048, 2048, 2048, 2048, 128]
    - [77, 50.73]
  - - [2048, 128, 1, 4096, 2048, 2048, 4096, 128]
    - [79, 62.99]
  - - [2048, 128, 1, 8192, 2048, 2048, 8192, 128]
    - [99, 71.01]
  - - [2048, 256, 1, 128, 2048, 2048, 128, 256]
    - [34, 13.67]
  - - [2048, 256, 1, 256, 2048, 2048, 256, 256]
    - [35, 24.7]
  - - [2048, 256, 1, 512, 2048, 2048, 512, 256]
    - [71, 41.18]
  - - [2048, 256, 1, 1024, 2048, 2048, 1024, 256]
    - [72, 61.81]
  - - [2048, 256, 1, 2048, 2048, 2048, 2048, 256]
    - [94, 84.88]
  - - [2048, 256, 1, 4096, 2048, 2048, 4096, 256]
    - [94, 103.94]
  - - [2048, 256, 1, 8192, 2048, 2048, 8192, 256]
    - [94, 116.21]
  - - [2048, 512, 1, 128, 2048, 2048, 128, 512]
    - [57, 19.05]
  - - [2048, 512, 1, 256, 2048, 2048, 256, 512]
    - [66, 37.91]
  - - [2048, 512, 1, 512, 2048, 2048, 512, 512]
    - [29, 65.85]
  - - [2048, 512, 1, 1024, 2048, 2048, 1024, 512]
    - [30, 100.05]
  - - [2048, 512, 1, 2048, 2048, 2048, 2048, 512]
    - [30, 130.66]
  - - [2048, 512, 1, 4096, 2048, 2048, 4096, 512]
    - [90, 148.48]
  - - [2048, 512, 1, 8192, 2048, 2048, 8192, 512]
    - [88, 160.75]
  - - [2048, 1024, 1, 128, 2048, 2048, 128, 1024]
    - [54, 35.17]
  - - [2048, 1024, 1, 256, 2048, 2048, 256, 1024]
    - [23, 63.23]
  - - [2048, 1024, 1, 512, 2048, 2048, 512, 1024]
    - [23, 100.29]
  - - [2048, 1024, 1, 1024, 2048, 2048, 1024, 1024]
    - [62, 147.97]
  - - [2048, 1024, 1, 2048, 2048, 2048, 2048, 1024]
    - [62, 186.16]
  - - [2048, 1024, 1, 4096, 2048, 2048, 4096, 1024]
    - [64, 203.86]
  - - [2048, 1024, 1, 8192, 2048, 2048, 8192, 1024]
    - [63, 205.62]
  - - [2048, 2048, 1, 128, 2048, 2048, 128, 2048]
    - [16, 51.34]
  - - [2048, 2048, 1, 256, 2048, 2048, 256, 2048]
    - [15, 89.38]
  - - [2048, 2048, 1, 512, 2048, 2048, 512, 2048]
    - [17, 138.2]
  - - [2048, 2048, 1, 1024, 2048, 2048, 1024, 2048]
    - [46, 186.65]
  - - [2048, 2048, 1, 2048, 2048, 2048, 2048, 2048]
    - [47, 232.33]
  - - [2048, 2048, 1, 4096, 2048, 2048, 4096, 2048]
    - [44, 252.03]
  - - [2048, 2048, 1, 8192, 2048, 2048, 8192, 2048]
    - [48, 242.48]
  - - [2048, 4096, 1, 128, 2048, 2048, 128, 4096]
    - [2, 59.98]
  - - [2048, 4096, 1, 256, 2048, 2048, 256, 4096]
    - [5, 103.56]
  - - [2048, 4096, 1, 512, 2048, 2048, 512, 4096]
    - [2, 163.22]
  - - [2048, 4096, 1, 1024, 2048, 2048, 1024, 4096]
    - [9, 226.01]
  - - [2048, 4096, 1, 2048, 2048, 2048, 2048, 4096]
    - [6, 266.31]
  - - [2048, 4096, 1, 4096, 2048, 2048, 4096, 4096]
    - [45, 265.25]
  - - [2048, 4096, 1, 8192, 2048, 2048, 8192, 4096]
    - [1, 281.11]
  - - [2048, 8192, 1, 128, 2048, 2048, 128, 8192]
    - [2, 67.28]
  - - [2048, 8192, 1, 256, 2048, 2048, 256, 8192]
    - [7, 113.38]
  - - [2048, 8192, 1, 512, 2048, 2048, 512, 8192]
    - [9, 176.37]
  - - [2048, 8192, 1, 1024, 2048, 2048, 1024, 8192]
    - [8, 222.64]
  - - [2048, 8192, 1, 2048, 2048, 2048, 2048, 8192]
    - [12, 240.88]
  - - [2048, 8192, 1, 4096, 2048, 2048, 4096, 8192]
    - [40, 286.91]
  - - [2048, 8192, 1, 8192, 2048, 2048, 8192, 8192]
    - [46, 319.73]
  - - [4096, 128, 1, 128, 4096, 4096, 128, 128]
    - [33, 14.53]
  - - [4096, 128, 1, 256, 4096, 4096, 256, 128]
    - [33, 25.99]
  - - [4096, 128, 1, 512, 4096, 4096, 512, 128]
    - [69, 42.21]
  - - [4096, 128, 1, 1024, 4096, 4096, 1024, 128]
    - [69, 63.97]
  - - [4096, 128, 1, 2048, 4096, 4096, 2048, 128]
    - [69, 86.35]
  - - [4096, 128, 1, 4096, 4096, 4096, 4096, 128]
    - [93, 104.69]
  - - [4096, 128, 1, 8192, 4096, 4096, 8192, 128]
    - [93, 116.53]
  - - [4096, 256, 1, 128, 4096, 4096, 128, 256]
    - [25, 24.35]
  - - [4096, 256, 1, 256, 4096, 4096, 256, 256]
    - [29, 42.46]
  - - [4096, 256, 1, 512, 4096, 4096, 512, 256]
    - [29, 69.69]
  - - [4096, 256, 1, 1024, 4096, 4096, 1024, 256]
    - [31, 101.22]
  - - [4096, 256, 1, 2048, 4096, 4096, 2048, 256]
    - [31, 132.58]
  - - [4096, 256, 1, 4096, 4096, 4096, 4096, 256]
    - [90, 146.95]
  - - [4096, 256, 1, 8192, 4096, 4096, 8192, 256]
    - [90, 160.13]
  - - [4096, 512, 1, 128, 4096, 4096, 128, 512]
    - [23, 36.58]
  - - [4096, 512, 1, 256, 4096, 4096, 256, 512]
    - [23, 64.55]
  - - [4096, 512, 1, 512, 4096, 4096, 512, 512]
    - [61, 101.61]
  - - [4096, 512, 1, 1024, 4096, 4096, 1024, 512]
    - [63, 148.65]
  - - [4096, 512, 1, 2048, 4096, 4096, 2048, 512]
    - [64, 190.37]
  - - [4096, 512, 1, 4096, 4096, 4096, 4096, 512]
    - [63, 204.85]
  - - [4096, 512, 1, 8192, 4096, 4096, 8192, 512]
    - [62, 206.09]
  - - [4096, 1024, 1, 128, 4096, 4096, 128, 1024]
    - [19, 53.27]
  - - [4096, 1024, 1, 256, 4096, 4096, 256, 1024]
    - [18, 91.8]
  - - [4096, 1024, 1, 512, 4096, 4096, 512, 1024]
    - [21, 137.15]
  - - [4096, 1024, 1, 1024, 4096, 4096, 1024, 1024]
    - [13, 190.73]
  - - [4096, 1024, 1, 2048, 4096, 4096, 2048, 1024]
    - [14, 236.52]
  - - [4096, 1024, 1, 4096, 4096, 4096, 4096, 1024]
    - [11, 256.01]
  - - [4096, 1024, 1, 8192, 4096, 4096, 8192, 1024]
    - [43, 244.43]
  - - [4096, 2048, 1, 128, 4096, 4096, 128, 2048]
    - [6, 57.38]
  - - [4096, 2048, 1, 256, 4096, 4096, 256, 2048]
    - [6, 98.88]
  - - [4096, 2048, 1, 512, 4096, 4096, 512, 2048]
    - [5, 158.45]
  - - [4096, 2048, 1, 1024, 4096, 4096, 1024, 2048]
    - [9, 222.35]
  - - [4096, 2048, 1, 2048, 4096, 4096, 2048, 2048]
    - [9, 264.07]
  - - [4096, 2048, 1, 4096, 4096, 4096, 4096, 2048]
    - [53, 269.27]
  - - [4096, 2048, 1, 8192, 4096, 4096, 8192, 2048]
    - [53, 288.34]
  - - [4096, 4096, 1, 128, 4096, 4096, 128, 4096]
    - [2, 64.67]
  - - [4096, 4096, 1, 256, 4096, 4096, 256, 4096]
    - [0, 112.21]
  - - [4096, 4096, 1, 512, 4096, 4096, 512, 4096]
    - [9, 172.4]
  - - [4096, 4096, 1, 1024, 4096, 4096, 1024, 4096]
    - [8, 223.11]
  - - [4096, 4096, 1, 2048, 4096, 4096, 2048, 4096]
    - [50, 242.36]
  - - [4096, 4096, 1, 4096, 4096, 4096, 4096, 4096]
    - [49, 293.48]
  - - [4096, 4096, 1, 8192, 4096, 4096, 8192, 4096]
    - [46, 316.53]
  - - [4096, 8192, 1, 128, 4096, 4096, 128, 8192]
    - [2, 71.07]
  - - [4096, 8192, 1, 256, 4096, 4096, 256, 8192]
    - [9, 116.78]
  - - [4096, 8192, 1, 512, 4096, 4096, 512, 8192]
    - [12, 176.2]
  - - [4096, 8192, 1, 1024, 4096, 4096, 1024, 8192]
    - [14, 221.42]
  - - [4096, 8192, 1, 2048, 4096, 4096, 2048, 8192]
    - [44, 272.11]
  - - [4096, 8192, 1, 4096, 4096, 4096, 4096, 8192]
    - [1, 328.25]
  - - [4096, 8192, 1, 8192, 4096, 4096, 8192, 8192]
    - [9, 375.86]
  - - [8192, 128, 1, 128, 8192, 8192, 128, 128]
    - [25, 24.25]
  - - [8192, 128, 1, 256, 8192, 8192, 256, 128]
    - [29, 41.91]
  - - [8192, 128, 1, 512, 8192, 8192, 512, 128]
    - [29, 69.62]
  - - [8192, 128, 1, 1024, 8192, 8192, 1024, 128]
    - [31, 98.26]
  - - [8192, 128, 1, 2048, 8192, 8192, 2048, 128]
    - [88, 125.08]
  - - [8192, 128, 1, 4096, 8192, 8192, 4096, 128]
    - [68, 143.07]
  - - [8192, 128, 1, 8192, 8192, 8192, 8192, 128]
    - [67, 154.53]
  - - [8192, 256, 1, 128, 8192, 8192, 128, 256]
    - [56, 35.87]
  - - [8192, 256, 1, 256, 8192, 8192, 256, 256]
    - [24, 62.76]
  - - [8192, 256, 1, 512, 8192, 8192, 512, 256]
    - [58, 100.46]
  - - [8192, 256, 1, 1024, 8192, 8192, 1024, 256]
    - [63, 148.63]
  - - [8192, 256, 1, 2048, 8192, 8192, 2048, 256]
    - [64, 184.8]
  - - [8192, 256, 1, 4096, 8192, 8192, 4096, 256]
    - [62, 200.08]
  - - [8192, 256, 1, 8192, 8192, 8192, 8192, 256]
    - [63, 200.56]
  - - [8192, 512, 1, 128, 8192, 8192, 128, 512]
    - [19, 51.63]
  - - [8192, 512, 1, 256, 8192, 8192, 256, 512]
    - [20, 89.39]
  - - [8192, 512, 1, 512, 8192, 8192, 512, 512]
    - [59, 140.15]
  - - [8192, 512, 1, 1024, 8192, 8192, 1024, 512]
    - [60, 203.16]
  - - [8192, 512, 1, 2048, 8192, 8192, 2048, 512]
    - [13, 231.94]
  - - [8192, 512, 1, 4096, 8192, 8192, 4096, 512]
    - [60, 266.99]
  - - [8192, 512, 1, 8192, 8192, 8192, 8192, 512]
    - [59, 263.04]
  - - [8192, 1024, 1, 128, 8192, 8192, 128, 1024]
    - [51, 58.5]
  - - [8192, 1024, 1, 256, 8192, 8192, 256, 1024]
    - [51, 103.95]
  - - [8192, 1024, 1, 512, 8192, 8192, 512, 1024]
    - [50, 167.66]
  - - [8192, 1024, 1, 1024, 8192, 8192, 1024, 1024]
    - [9, 220.81]
  - - [8192, 1024, 1, 2048, 8192, 8192, 2048, 1024]
    - [51, 286.6]
  - - [8192, 1024, 1, 4096, 8192, 8192, 4096, 1024]
    - [52, 341.19]
  - - [8192, 1024, 1, 8192, 8192, 8192, 8192, 1024]
    - [50, 381.85]
  - - [8192, 2048, 1, 128, 8192, 8192, 128, 2048]
    - [53, 65.7]
  - - [8192, 2048, 1, 256, 8192, 8192, 256, 2048]
    - [53, 113.35]
  - - [8192, 2048, 1, 512, 8192, 8192, 512, 2048]
    - [2, 167.31]
  - - [8192, 2048, 1, 1024, 8192, 8192, 1024, 2048]
    - [53, 242.91]
  - - [8192, 2048, 1, 2048, 8192, 8192, 2048, 2048]
    - [52, 301.62]
  - - [8192, 2048, 1, 4096, 8192, 8192, 4096, 2048]
    - [50, 344.92]
  - - [8192, 2048, 1, 8192, 8192, 8192, 8192, 2048]
    - [52, 393.73]
  - - [8192, 4096, 1, 128, 8192, 8192, 128, 4096]
    - [53, 69.51]
  - - [8192, 4096, 1, 256, 8192, 8192, 256, 4096]
    - [53, 116.46]
  - - [8192, 4096, 1, 512, 8192, 8192, 512, 4096]
    - [13, 174.71]
  - - [8192, 4096, 1, 1024, 8192, 8192, 1024, 4096]
    - [50, 233.63]
  - - [8192, 4096, 1, 2048, 8192, 8192, 2048, 4096]
    - [52, 298.27]
  - - [8192, 4096, 1, 4096, 8192, 8192, 4096, 4096]
    - [52, 360.3]
  - - [8192, 4096, 1, 8192, 8192, 8192, 8192, 4096]
    - [50, 408.59]
  - - [8192, 8192, 1, 128, 8192, 8192, 128, 8192]
    - [22, 62.43]
  - - [8192, 8192, 1, 256, 8192, 8192, 256, 8192]
    - [16, 113.37]
  - - [8192, 8192, 1, 512, 8192, 8192, 512, 8192]
    - [3, 173.19]
  - - [8192, 8192, 1, 1024, 8192, 8192, 1024, 8192]
    - [5, 239.07]
  - - [8192, 8192, 1, 2048, 8192, 8192, 2048, 8192]
    - [9, 310.85]
  - - [8192, 8192, 1, 4096, 8192, 8192, 4096, 8192]
    - [50, 367.46]
  - - [8192, 8192, 1, 8192, 8192, 8192, 8192, 8192]
    - [52, 405.52]
- null
- null
- ExperimentalStreamK
- GridBased
