projects/hipblaslt/library/src/amd_detail/rocblaslt/src/Tensile/Logic/asm_full/aquavanjaram/gfx942_228cu/StreamK/aquavanjaram942_Cijk_Ailk_Bljk_F8NSS_BH_Bias_HAS_SAV_UserArgs.yaml
- {MinimumRequiredVersion: 4.33.0}
- aquavanjaram942
- {Architecture: gfx942, CUCount: 228}
- [Device 0049, Device 0050]
    SolutionIndex: 0
    SolutionNameMin: Cijk_Ailk_Bljk_F8NSS_BH_Bias_HAS_SAV_UserArgs_MT256x256x64_MI16x16x1_SN_LDSB1_CLR1_GRVWA16_GRVWB8_GSU0_GSUC0_GSUWGMRR0_K1_LBSPPA2048_LBSPPB512_LPA0_LPB8_LRVW8_MIWT8_8_PLR1_SU0_SUM0_SUS64_VWA8_VWB8_WGM1_WGMXCC1_WGMXCCGn1
    SolutionIndex: 1
    SolutionNameMin: Cijk_Ailk_Bljk_F8NSS_BH_Bias_HAS_SAV_UserArgs_MT256x256x64_MI16x16x1_SN_LDSB1_CLR1_GRVWA16_GRVWB16_GSU0_GSUC0_GSUWGMRR0_K1_LBSPPA2048_LBSPPB512_LPA0_LPB16_LRVW8_MIWT8_8_PLR1_SU0_SUM0_SUS64_VWA8_VWB8_WGM1_WGMXCC1_WGMXCCGn1
    SolutionIndex: 2
    SolutionNameMin: Cijk_Ailk_Bljk_F8NSS_BH_Bias_HAS_SAV_UserArgs_MT256x256x64_MI16x16x1_SN_LDSB1_CLR1_GRVWA16_GRVWB8_GSU0_GSUC0_GSUWGMRR0_K1_LBSPPA2048_LBSPPB512_LPA0_LPB8_LRVW8_MIWT8_8_PLR1_SU0_SUM0_SUS64_VWA8_VWB8_WGM4_WGMXCC1_WGMXCCGn1
    SolutionIndex: 3
    SolutionNameMin: Cijk_Ailk_Bljk_F8NSS_BH_Bias_HAS_SAV_UserArgs_MT256x256x64_MI16x16x1_SN_LDSB1_CLR1_GRVWA16_GRVWB16_GSU0_GSUC0_GSUWGMRR0_K1_LBSPPA2048_LBSPPB512_LPA0_LPB16_LRVW8_MIWT8_8_PLR1_SU0_SUM0_SUS64_VWA8_VWB8_WGM6_WGMXCC1_WGMXCCGn1
    SolutionIndex: 4
    SolutionNameMin: Cijk_Ailk_Bljk_F8NSS_BH_Bias_HAS_SAV_UserArgs_MT256x256x64_MI16x16x1_SN_LDSB1_CLR1_GRVWA8_GRVWB8_GSU0_GSUC0_GSUWGMRR0_K1_LBSPPA2048_LBSPPB512_LPA0_LPB8_LRVW8_MIWT8_8_PLR1_SU0_SUM0_SUS64_VWA8_VWB8_WGM8_WGMXCC1_WGMXCCGn1
    SolutionIndex: 5
    SolutionNameMin: Cijk_Ailk_Bljk_F8NSS_BH_Bias_HAS_SAV_UserArgs_MT128x256x64_MI16x16x1_SN_LDSB1_CLR1_GRVWA8_GRVWB8_GSU0_GSUC0_GSUWGMRR0_K1_LBSPPA1024_LBSPPB512_LPA64_LPB8_LRVW8_MIWT4_8_PLR1_SU0_SUM0_SUS64_VWA4_VWB8_WGM1_WGMXCC1_WGMXCCGn1
    SolutionIndex: 6
    SolutionNameMin: Cijk_Ailk_Bljk_F8NSS_BH_Bias_HAS_SAV_UserArgs_MT128x256x64_MI16x16x1_SN_LDSB1_CLR1_GRVWA16_GRVWB8_GSU0_GSUC0_GSUWGMRR0_K1_LBSPPA1024_LBSPPB512_LPA64_LPB8_LRVW8_MIWT4_8_PLR1_SU0_SUM0_SUS64_VWA4_VWB8_WGM1_WGMXCC1_WGMXCCGn1
    SolutionIndex: 7
    SolutionNameMin: Cijk_Ailk_Bljk_F8NSS_BH_Bias_HAS_SAV_UserArgs_MT128x256x64_MI16x16x1_SN_LDSB1_CLR1_GRVWA8_GRVWB16_GSU0_GSUC0_GSUWGMRR0_K1_LBSPPA1024_LBSPPB512_LPA64_LPB16_LRVW8_MIWT4_8_PLR1_SU0_SUM0_SUS64_VWA4_VWB8_WGM1_WGMXCC1_WGMXCCGn1
    SolutionIndex: 8
    SolutionNameMin: Cijk_Ailk_Bljk_F8NSS_BH_Bias_HAS_SAV_UserArgs_MT128x256x64_MI16x16x1_SN_LDSB1_CLR1_GRVWA16_GRVWB16_GSU0_GSUC0_GSUWGMRR0_K1_LBSPPA1024_LBSPPB512_LPA64_LPB16_LRVW8_MIWT4_8_PLR1_SU0_SUM0_SUS64_VWA4_VWB8_WGM4_WGMXCC1_WGMXCCGn1
    SolutionIndex: 9
    SolutionNameMin: Cijk_Ailk_Bljk_F8NSS_BH_Bias_HAS_SAV_UserArgs_MT128x256x64_MI16x16x1_SN_LDSB1_CLR1_GRVWA8_GRVWB8_GSU0_GSUC0_GSUWGMRR0_K1_LBSPPA1024_LBSPPB512_LPA64_LPB8_LRVW8_MIWT4_8_PLR1_SU0_SUM0_SUS64_VWA4_VWB8_WGM6_WGMXCC1_WGMXCCGn1
    SolutionIndex: 10
    SolutionNameMin: Cijk_Ailk_Bljk_F8NSS_BH_Bias_HAS_SAV_UserArgs_MT128x256x64_MI16x16x1_SN_LDSB1_CLR1_GRVWA8_GRVWB16_GSU0_GSUC0_GSUWGMRR0_K1_LBSPPA1024_LBSPPB512_LPA64_LPB16_LRVW8_MIWT4_8_PLR1_SU0_SUM0_SUS64_VWA4_VWB8_WGM6_WGMXCC1_WGMXCCGn1
    SolutionIndex: 11
    SolutionNameMin: Cijk_Ailk_Bljk_F8NSS_BH_Bias_HAS_SAV_UserArgs_MT128x256x64_MI16x16x1_SN_LDSB1_CLR1_GRVWA16_GRVWB16_GSU0_GSUC0_GSUWGMRR0_K1_LBSPPA1024_LBSPPB512_LPA64_LPB16_LRVW8_MIWT4_8_PLR1_SU0_SUM0_SUS64_VWA4_VWB8_WGM6_WGMXCC1_WGMXCCGn1
    SolutionIndex: 12
    SolutionNameMin: Cijk_Ailk_Bljk_F8NSS_BH_Bias_HAS_SAV_UserArgs_MT128x256x64_MI16x16x1_SN_LDSB1_CLR1_GRVWA8_GRVWB16_GSU0_GSUC0_GSUWGMRR0_K1_LBSPPA1024_LBSPPB512_LPA64_LPB16_LRVW8_MIWT4_8_PLR1_SU0_SUM0_SUS64_VWA4_VWB8_WGM8_WGMXCC1_WGMXCCGn1
    SolutionIndex: 13
    SolutionNameMin: Cijk_Ailk_Bljk_F8NSS_BH_Bias_HAS_SAV_UserArgs_MT128x256x64_MI16x16x1_SN_LDSB1_CLR1_GRVWA16_GRVWB16_GSU0_GSUC0_GSUWGMRR0_K1_LBSPPA1024_LBSPPB512_LPA64_LPB16_LRVW8_MIWT4_8_PLR1_SU0_SUM0_SUS64_VWA4_VWB8_WGM8_WGMXCC1_WGMXCCGn1
    SolutionIndex: 14
    SolutionNameMin: Cijk_Ailk_Bljk_F8NSS_BH_Bias_HAS_SAV_UserArgs_MT64x128x64_MI16x16x1_SN_LDSB0_CLR1_GRVWA8_GRVWB16_GSU0_GSUC0_GSUWGMRR0_K1_LBSPPA512_LBSPPB512_LPA16_LPB16_LRVW8_MIWT1_8_PLR1_SU0_SUM0_SUS64_VWA1_VWB8_WGM1_WGMXCC1_WGMXCCGn1
    SolutionIndex: 15
    SolutionNameMin: Cijk_Ailk_Bljk_F8NSS_BH_Bias_HAS_SAV_UserArgs_MT64x128x64_MI16x16x1_SN_LDSB0_CLR1_GRVWA16_GRVWB8_GSU0_GSUC0_GSUWGMRR0_K1_LBSPPA512_LBSPPB512_LPA16_LPB8_LRVW8_MIWT1_8_PLR1_SU0_SUM0_SUS64_VWA1_VWB8_WGM6_WGMXCC1_WGMXCCGn1
    SolutionIndex: 16
    SolutionNameMin: Cijk_Ailk_Bljk_F8NSS_BH_Bias_HAS_SAV_UserArgs_MT128x128x64_MI16x16x1_SN_LDSB1_CLR1_GRVWA8_GRVWB16_GSU0_GSUC0_GSUWGMRR0_K1_LBSPPA1024_LBSPPB256_LPA64_LPB16_LRVW8_MIWT4_4_PLR1_SU0_SUM0_SUS64_VWA4_VWB4_WGM1_WGMXCC1_WGMXCCGn1
    SolutionIndex: 17
    SolutionNameMin: Cijk_Ailk_Bljk_F8NSS_BH_Bias_HAS_SAV_UserArgs_MT128x128x64_MI16x16x1_SN_LDSB1_CLR1_GRVWA16_GRVWB16_GSU0_GSUC0_GSUWGMRR0_K1_LBSPPA1024_LBSPPB256_LPA64_LPB16_LRVW8_MIWT4_4_PLR1_SU0_SUM0_SUS64_VWA4_VWB4_WGM1_WGMXCC1_WGMXCCGn1
    SolutionIndex: 18
    SolutionNameMin: Cijk_Ailk_Bljk_F8NSS_BH_Bias_HAS_SAV_UserArgs_MT128x128x64_MI16x16x1_SN_LDSB1_CLR1_GRVWA16_GRVWB8_GSU0_GSUC0_GSUWGMRR0_K1_LBSPPA1024_LBSPPB256_LPA64_LPB8_LRVW8_MIWT4_4_PLR1_SU0_SUM0_SUS64_VWA4_VWB4_WGM4_WGMXCC1_WGMXCCGn1
    SolutionIndex: 19
    SolutionNameMin: Cijk_Ailk_Bljk_F8NSS_BH_Bias_HAS_SAV_UserArgs_MT128x128x64_MI16x16x1_SN_LDSB1_CLR1_GRVWA8_GRVWB16_GSU0_GSUC0_GSUWGMRR0_K1_LBSPPA1024_LBSPPB256_LPA64_LPB16_LRVW8_MIWT4_4_PLR1_SU0_SUM0_SUS64_VWA4_VWB4_WGM4_WGMXCC1_WGMXCCGn1
    SolutionIndex: 20
    SolutionNameMin: Cijk_Ailk_Bljk_F8NSS_BH_Bias_HAS_SAV_UserArgs_MT128x128x64_MI16x16x1_SN_LDSB1_CLR1_GRVWA16_GRVWB16_GSU0_GSUC0_GSUWGMRR0_K1_LBSPPA1024_LBSPPB256_LPA64_LPB16_LRVW8_MIWT4_4_PLR1_SU0_SUM0_SUS64_VWA4_VWB4_WGM4_WGMXCC1_WGMXCCGn1
    SolutionIndex: 21
    SolutionNameMin: Cijk_Ailk_Bljk_F8NSS_BH_Bias_HAS_SAV_UserArgs_MT128x128x64_MI16x16x1_SN_LDSB1_CLR1_GRVWA16_GRVWB16_GSU0_GSUC0_GSUWGMRR0_K1_LBSPPA1024_LBSPPB256_LPA64_LPB16_LRVW8_MIWT4_4_PLR1_SU0_SUM0_SUS64_VWA4_VWB4_WGM6_WGMXCC1_WGMXCCGn1
    SolutionIndex: 22
    SolutionNameMin: Cijk_Ailk_Bljk_F8NSS_BH_Bias_HAS_SAV_UserArgs_MT128x128x64_MI16x16x1_SN_LDSB1_CLR1_GRVWA16_GRVWB8_GSU0_GSUC0_GSUWGMRR0_K1_LBSPPA1024_LBSPPB256_LPA64_LPB8_LRVW8_MIWT4_4_PLR1_SU0_SUM0_SUS64_VWA4_VWB4_WGM8_WGMXCC1_WGMXCCGn1
    SolutionIndex: 23
    SolutionNameMin: Cijk_Ailk_Bljk_F8NSS_BH_Bias_HAS_SAV_UserArgs_MT128x128x64_MI16x16x1_SN_LDSB1_CLR1_GRVWA16_GRVWB16_GSU0_GSUC0_GSUWGMRR0_K1_LBSPPA1024_LBSPPB256_LPA64_LPB16_LRVW8_MIWT4_4_PLR1_SU0_SUM0_SUS64_VWA4_VWB4_WGM8_WGMXCC1_WGMXCCGn1
    SolutionIndex: 24
    SolutionNameMin: Cijk_Ailk_Bljk_F8NSS_BH_Bias_HAS_SAV_UserArgs_MT64x128x64_MI16x16x1_SN_LDSB0_CLR1_GRVWA16_GRVWB8_GSU0_GSUC0_GSUWGMRR0_K1_LBSPPA512_LBSPPB256_LPA32_LPB8_LRVW8_MIWT2_4_PLR1_SU0_SUM0_SUS64_VWA2_VWB4_WGM1_WGMXCC1_WGMXCCGn1
    SolutionIndex: 25
    SolutionNameMin: Cijk_Ailk_Bljk_F8NSS_BH_Bias_HAS_SAV_UserArgs_MT64x128x64_MI16x16x1_SN_LDSB0_CLR1_GRVWA8_GRVWB16_GSU0_GSUC0_GSUWGMRR0_K1_LBSPPA512_LBSPPB256_LPA32_LPB16_LRVW8_MIWT2_4_PLR1_SU0_SUM0_SUS64_VWA2_VWB4_WGM1_WGMXCC1_WGMXCCGn1
    SolutionIndex: 26
    SolutionNameMin: Cijk_Ailk_Bljk_F8NSS_BH_Bias_HAS_SAV_UserArgs_MT64x128x64_MI16x16x1_SN_LDSB0_CLR1_GRVWA16_GRVWB16_GSU0_GSUC0_GSUWGMRR0_K1_LBSPPA512_LBSPPB256_LPA32_LPB16_LRVW8_MIWT2_4_PLR1_SU0_SUM0_SUS64_VWA2_VWB4_WGM1_WGMXCC1_WGMXCCGn1
    SolutionIndex: 27
    SolutionNameMin: Cijk_Ailk_Bljk_F8NSS_BH_Bias_HAS_SAV_UserArgs_MT64x128x64_MI16x16x1_SN_LDSB0_CLR1_GRVWA8_GRVWB16_GSU0_GSUC0_GSUWGMRR0_K1_LBSPPA512_LBSPPB256_LPA32_LPB16_LRVW8_MIWT2_4_PLR1_SU0_SUM0_SUS64_VWA2_VWB4_WGM4_WGMXCC1_WGMXCCGn1
    SolutionIndex: 28
    SolutionNameMin: Cijk_Ailk_Bljk_F8NSS_BH_Bias_HAS_SAV_UserArgs_MT64x128x64_MI16x16x1_SN_LDSB0_CLR1_GRVWA8_GRVWB16_GSU0_GSUC0_GSUWGMRR0_K1_LBSPPA512_LBSPPB256_LPA32_LPB16_LRVW8_MIWT2_4_PLR1_SU0_SUM0_SUS64_VWA2_VWB4_WGM6_WGMXCC1_WGMXCCGn1
    SolutionIndex: 29
    SolutionNameMin: Cijk_Ailk_Bljk_F8NSS_BH_Bias_HAS_SAV_UserArgs_MT64x128x64_MI16x16x1_SN_LDSB0_CLR1_GRVWA16_GRVWB8_GSU0_GSUC0_GSUWGMRR0_K1_LBSPPA512_LBSPPB256_LPA32_LPB8_LRVW8_MIWT2_4_PLR1_SU0_SUM0_SUS64_VWA2_VWB4_WGM8_WGMXCC1_WGMXCCGn1
    SolutionIndex: 30
    SolutionNameMin: Cijk_Ailk_Bljk_F8NSS_BH_Bias_HAS_SAV_UserArgs_MT128x64x64_MI16x16x1_SN_LDSB0_CLR1_GRVWA16_GRVWB8_GSU0_GSUC0_GSUWGMRR0_K1_LBSPPA1024_LBSPPB128_LPA64_LPB8_LRVW8_MIWT4_2_PLR1_SU0_SUM0_SUS64_VWA4_VWB2_WGM1_WGMXCC1_WGMXCCGn1
    SolutionIndex: 31
    SolutionNameMin: Cijk_Ailk_Bljk_F8NSS_BH_Bias_HAS_SAV_UserArgs_MT128x64x64_MI16x16x1_SN_LDSB0_CLR1_GRVWA8_GRVWB16_GSU0_GSUC0_GSUWGMRR0_K1_LBSPPA1024_LBSPPB128_LPA64_LPB16_LRVW8_MIWT4_2_PLR1_SU0_SUM0_SUS64_VWA4_VWB2_WGM1_WGMXCC1_WGMXCCGn1
    SolutionIndex: 32
    SolutionNameMin: Cijk_Ailk_Bljk_F8NSS_BH_Bias_HAS_SAV_UserArgs_MT128x64x64_MI16x16x1_SN_LDSB0_CLR1_GRVWA16_GRVWB16_GSU0_GSUC0_GSUWGMRR0_K1_LBSPPA1024_LBSPPB128_LPA64_LPB16_LRVW8_MIWT4_2_PLR1_SU0_SUM0_SUS64_VWA4_VWB2_WGM1_WGMXCC1_WGMXCCGn1
    SolutionIndex: 33
    SolutionNameMin: Cijk_Ailk_Bljk_F8NSS_BH_Bias_HAS_SAV_UserArgs_MT128x64x64_MI16x16x1_SN_LDSB0_CLR1_GRVWA8_GRVWB16_GSU0_GSUC0_GSUWGMRR0_K1_LBSPPA1024_LBSPPB128_LPA64_LPB16_LRVW8_MIWT4_2_PLR1_SU0_SUM0_SUS64_VWA4_VWB2_WGM4_WGMXCC1_WGMXCCGn1
    SolutionIndex: 34
    SolutionNameMin: Cijk_Ailk_Bljk_F8NSS_BH_Bias_HAS_SAV_UserArgs_MT32x128x64_MI16x16x1_SN_LDSB0_CLR1_GRVWA8_GRVWB8_GSU0_GSUC0_GSUWGMRR0_K1_LBSPPA256_LBSPPB256_LPA16_LPB8_LRVW8_MIWT1_4_PLR1_SU0_SUM0_SUS64_VWA1_VWB4_WGM1_WGMXCC1_WGMXCCGn1
    SolutionIndex: 35
    SolutionNameMin: Cijk_Ailk_Bljk_F8NSS_BH_Bias_HAS_SAV_UserArgs_MT32x128x64_MI16x16x1_SN_LDSB0_CLR1_GRVWA8_GRVWB16_GSU0_GSUC0_GSUWGMRR0_K1_LBSPPA256_LBSPPB256_LPA16_LPB16_LRVW8_MIWT1_4_PLR1_SU0_SUM0_SUS64_VWA1_VWB4_WGM4_WGMXCC1_WGMXCCGn1
    SolutionIndex: 36
    SolutionNameMin: Cijk_Ailk_Bljk_F8NSS_BH_Bias_HAS_SAV_UserArgs_MT128x32x64_MI16x16x1_SN_LDSB0_CLR1_GRVWA8_GRVWB8_GSU0_GSUC0_GSUWGMRR0_K1_LBSPPA1024_LBSPPB128_LPA64_LPB8_LRVW8_MIWT4_1_PLR1_SU0_SUM0_SUS64_VWA4_VWB1_WGM1_WGMXCC1_WGMXCCGn1
    SolutionIndex: 37
    SolutionNameMin: Cijk_Ailk_Bljk_F8NSS_BH_Bias_HAS_SAV_UserArgs_MT128x32x64_MI16x16x1_SN_LDSB0_CLR1_GRVWA16_GRVWB8_GSU0_GSUC0_GSUWGMRR0_K1_LBSPPA1024_LBSPPB128_LPA64_LPB8_LRVW8_MIWT4_1_PLR1_SU0_SUM0_SUS64_VWA4_VWB1_WGM1_WGMXCC1_WGMXCCGn1
    SolutionIndex: 38
    SolutionNameMin: Cijk_Ailk_Bljk_F8NSS_BH_Bias_HAS_SAV_UserArgs_MT128x32x64_MI16x16x1_SN_LDSB0_CLR1_GRVWA8_GRVWB8_GSU0_GSUC0_GSUWGMRR0_K1_LBSPPA1024_LBSPPB128_LPA64_LPB8_LRVW8_MIWT4_1_PLR1_SU0_SUM0_SUS64_VWA4_VWB1_WGM4_WGMXCC1_WGMXCCGn1
    SolutionIndex: 39
    SolutionNameMin: Cijk_Ailk_Bljk_F8NSS_BH_Bias_HAS_SAV_UserArgs_MT64x64x64_MI16x16x1_SN_LDSB0_CLR1_GRVWA8_GRVWB8_GSU0_GSUC0_GSUWGMRR0_K1_LBSPPA512_LBSPPB128_LPA32_LPB8_LRVW8_MIWT2_2_PLR1_SU0_SUM0_SUS64_VWA2_VWB2_WGM1_WGMXCC1_WGMXCCGn1
    SolutionIndex: 40
    SolutionNameMin: Cijk_Ailk_Bljk_F8NSS_BH_Bias_HAS_SAV_UserArgs_MT64x64x64_MI16x16x1_SN_LDSB0_CLR1_GRVWA8_GRVWB16_GSU0_GSUC0_GSUWGMRR0_K1_LBSPPA512_LBSPPB128_LPA32_LPB16_LRVW8_MIWT2_2_PLR1_SU0_SUM0_SUS64_VWA2_VWB2_WGM1_WGMXCC1_WGMXCCGn1
    SolutionIndex: 41
    SolutionNameMin: Cijk_Ailk_Bljk_F8NSS_BH_Bias_HAS_SAV_UserArgs_MT64x64x64_MI16x16x1_SN_LDSB0_CLR1_GRVWA8_GRVWB16_GSU0_GSUC0_GSUWGMRR0_K1_LBSPPA512_LBSPPB128_LPA32_LPB16_LRVW8_MIWT2_2_PLR1_SU0_SUM0_SUS64_VWA2_VWB2_WGM4_WGMXCC1_WGMXCCGn1
    SolutionIndex: 42
    SolutionNameMin: Cijk_Ailk_Bljk_F8NSS_BH_Bias_HAS_SAV_UserArgs_MT32x64x64_MI16x16x1_SN_LDSB0_CLR1_GRVWA8_GRVWB16_GSU0_GSUC0_GSUWGMRR0_K1_LBSPPA256_LBSPPB128_LPA16_LPB16_LRVW8_MIWT1_2_PLR1_SU0_SUM0_SUS64_VWA1_VWB2_WGM1_WGMXCC1_WGMXCCGn1
    SolutionIndex: 43
    SolutionNameMin: Cijk_Ailk_Bljk_F8NSS_BH_Bias_HAS_SAV_UserArgs_MT64x32x64_MI16x16x1_SN_LDSB0_CLR1_GRVWA16_GRVWB8_GSU0_GSUC0_GSUWGMRR0_K1_LBSPPA512_LBSPPB128_LPA32_LPB8_LRVW8_MIWT2_1_PLR1_SU0_SUM0_SUS64_VWA2_VWB1_WGM1_WGMXCC1_WGMXCCGn1
    SolutionIndex: 44
    SolutionNameMin: Cijk_Ailk_Bljk_F8NSS_BH_Bias_HAS_SAV_UserArgs_MT32x32x64_MI16x16x1_SN_LDSB0_CLR1_GRVWA8_GRVWB8_GSU0_GSUC0_GSUWGMRR0_K1_LBSPPA256_LBSPPB128_LPA16_LPB8_LRVW8_MIWT1_1_PLR1_SU0_SUM0_SUS64_VWA1_VWB1_WGM1_WGMXCC1_WGMXCCGn1
    SolutionIndex: 45
    SolutionNameMin: Cijk_Ailk_Bljk_F8NSS_BH_Bias_HAS_SAV_UserArgs_MT32x32x64_MI16x16x1_SN_LDSB0_CLR1_GRVWA8_GRVWB8_GSU0_GSUC0_GSUWGMRR0_K1_LBSPPA256_LBSPPB128_LPA16_LPB8_LRVW8_MIWT1_1_PLR1_SU0_SUM0_SUS64_VWA1_VWB1_WGM6_WGMXCC1_WGMXCCGn1
    SolutionIndex: 46
    SolutionNameMin: Cijk_Ailk_Bljk_F8NSS_BH_Bias_HAS_SAV_UserArgs_MT128x256x128_MI16x16x1_SN_LDSB1_CLR1_GRVWA16_GRVWB16_GSU0_GSUC0_GSUWGMRR0_K1_LBSPPA1024_LBSPPB1024_LPA64_LPB16_LRVW8_MIWT4_8_PLR1_SU0_SUM0_SUS128_VWA4_VWB8_WGM1_WGMXCC1_WGMXCCGn1
    SolutionIndex: 47
    SolutionNameMin: Cijk_Ailk_Bljk_F8NSS_BH_Bias_HAS_SAV_UserArgs_MT128x256x128_MI16x16x1_SN_LDSB1_CLR1_GRVWA16_GRVWB16_GSU0_GSUC0_GSUWGMRR0_K1_LBSPPA1024_LBSPPB1024_LPA64_LPB16_LRVW8_MIWT4_8_PLR1_SU0_SUM0_SUS128_VWA4_VWB8_WGM4_WGMXCC1_WGMXCCGn1
    SolutionIndex: 48
    SolutionNameMin: Cijk_Ailk_Bljk_F8NSS_BH_Bias_HAS_SAV_UserArgs_MT128x256x128_MI16x16x1_SN_LDSB1_CLR1_GRVWA8_GRVWB16_GSU0_GSUC0_GSUWGMRR0_K1_LBSPPA1024_LBSPPB1024_LPA64_LPB16_LRVW8_MIWT4_8_PLR1_SU0_SUM0_SUS128_VWA4_VWB8_WGM6_WGMXCC1_WGMXCCGn1
    SolutionIndex: 49
    SolutionNameMin: Cijk_Ailk_Bljk_F8NSS_BH_Bias_HAS_SAV_UserArgs_MT128x256x128_MI16x16x1_SN_LDSB1_CLR1_GRVWA16_GRVWB16_GSU0_GSUC0_GSUWGMRR0_K1_LBSPPA1024_LBSPPB1024_LPA64_LPB16_LRVW8_MIWT4_8_PLR1_SU0_SUM0_SUS128_VWA4_VWB8_WGM6_WGMXCC1_WGMXCCGn1
    SolutionIndex: 50
    SolutionNameMin: Cijk_Ailk_Bljk_F8NSS_BH_Bias_HAS_SAV_UserArgs_MT128x256x128_MI16x16x1_SN_LDSB1_CLR1_GRVWA8_GRVWB16_GSU0_GSUC0_GSUWGMRR0_K1_LBSPPA1024_LBSPPB1024_LPA64_LPB16_LRVW8_MIWT4_8_PLR1_SU0_SUM0_SUS128_VWA4_VWB8_WGM8_WGMXCC1_WGMXCCGn1
    SolutionIndex: 51
    SolutionNameMin: Cijk_Ailk_Bljk_F8NSS_BH_Bias_HAS_SAV_UserArgs_MT256x144x128_MI16x16x1_SN_LDSB1_CLR1_GRVWA8_GRVWB8_GSU0_GSUC0_GSUWGMRR0_K1_LBSPPA2048_LBSPPB128_LPA64_LPB8_LRVW8_MIWT4_9_PLR1_SU0_SUM0_SUS128_VWA4_VWB1_WGM1_WGMXCC1_WGMXCCGn1
    SolutionIndex: 52
    SolutionNameMin: Cijk_Ailk_Bljk_F8NSS_BH_Bias_HAS_SAV_UserArgs_MT256x144x128_MI16x16x1_SN_LDSB1_CLR1_GRVWA16_GRVWB8_GSU0_GSUC0_GSUWGMRR0_K1_LBSPPA2048_LBSPPB128_LPA64_LPB8_LRVW8_MIWT4_9_PLR1_SU0_SUM0_SUS128_VWA4_VWB1_WGM1_WGMXCC1_WGMXCCGn1
    SolutionIndex: 53
    SolutionNameMin: Cijk_Ailk_Bljk_F8NSS_BH_Bias_HAS_SAV_UserArgs_MT256x144x128_MI16x16x1_SN_LDSB1_CLR1_GRVWA8_GRVWB8_GSU0_GSUC0_GSUWGMRR0_K1_LBSPPA2048_LBSPPB128_LPA64_LPB8_LRVW8_MIWT4_9_PLR1_SU0_SUM0_SUS128_VWA4_VWB1_WGM4_WGMXCC1_WGMXCCGn1
    SolutionIndex: 54
    SolutionNameMin: Cijk_Ailk_Bljk_F8NSS_BH_Bias_HAS_SAV_UserArgs_MT256x144x128_MI16x16x1_SN_LDSB1_CLR1_GRVWA16_GRVWB8_GSU0_GSUC0_GSUWGMRR0_K1_LBSPPA2048_LBSPPB128_LPA64_LPB8_LRVW8_MIWT4_9_PLR1_SU0_SUM0_SUS128_VWA4_VWB1_WGM4_WGMXCC1_WGMXCCGn1
    SolutionIndex: 55
    SolutionNameMin: Cijk_Ailk_Bljk_F8NSS_BH_Bias_HAS_SAV_UserArgs_MT256x144x128_MI16x16x1_SN_LDSB1_CLR1_GRVWA8_GRVWB8_GSU0_GSUC0_GSUWGMRR0_K1_LBSPPA2048_LBSPPB128_LPA64_LPB8_LRVW8_MIWT4_9_PLR1_SU0_SUM0_SUS128_VWA4_VWB1_WGM6_WGMXCC1_WGMXCCGn1
    SolutionIndex: 56
    SolutionNameMin: Cijk_Ailk_Bljk_F8NSS_BH_Bias_HAS_SAV_UserArgs_MT256x144x128_MI16x16x1_SN_LDSB1_CLR1_GRVWA16_GRVWB8_GSU0_GSUC0_GSUWGMRR0_K1_LBSPPA2048_LBSPPB128_LPA64_LPB8_LRVW8_MIWT4_9_PLR1_SU0_SUM0_SUS128_VWA4_VWB1_WGM6_WGMXCC1_WGMXCCGn1
    SolutionIndex: 57
    SolutionNameMin: Cijk_Ailk_Bljk_F8NSS_BH_Bias_HAS_SAV_UserArgs_MT256x144x128_MI16x16x1_SN_LDSB1_CLR1_GRVWA8_GRVWB8_GSU0_GSUC0_GSUWGMRR0_K1_LBSPPA2048_LBSPPB128_LPA64_LPB8_LRVW8_MIWT4_9_PLR1_SU0_SUM0_SUS128_VWA4_VWB1_WGM8_WGMXCC1_WGMXCCGn1
    SolutionIndex: 58
    SolutionNameMin: Cijk_Ailk_Bljk_F8NSS_BH_Bias_HAS_SAV_UserArgs_MT256x144x128_MI16x16x1_SN_LDSB1_CLR1_GRVWA16_GRVWB8_GSU0_GSUC0_GSUWGMRR0_K1_LBSPPA2048_LBSPPB128_LPA64_LPB8_LRVW8_MIWT4_9_PLR1_SU0_SUM0_SUS128_VWA4_VWB1_WGM8_WGMXCC1_WGMXCCGn1
    SolutionIndex: 59
    SolutionNameMin: Cijk_Ailk_Bljk_F8NSS_BH_Bias_HAS_SAV_UserArgs_MT32x256x128_MI16x16x1_SN_LDSB1_CLR1_GRVWA16_GRVWB16_GSU0_GSUC0_GSUWGMRR0_K1_LBSPPA256_LBSPPB1024_LPA16_LPB16_LRVW8_MIWT1_8_PLR1_SU0_SUM0_SUS128_VWA1_VWB8_WGM1_WGMXCC1_WGMXCCGn1
    SolutionIndex: 60
    SolutionNameMin: Cijk_Ailk_Bljk_F8NSS_BH_Bias_HAS_SAV_UserArgs_MT64x144x128_MI16x16x1_SN_LDSB1_CLR1_GRVWA8_GRVWB8_GSU0_GSUC0_GSUWGMRR0_K1_LBSPPA512_LBSPPB128_LPA16_LPB8_LRVW8_MIWT1_9_PLR1_SU0_SUM0_SUS128_VWA1_VWB1_WGM1_WGMXCC1_WGMXCCGn1
    SolutionIndex: 61
    SolutionNameMin: Cijk_Ailk_Bljk_F8NSS_BH_Bias_HAS_SAV_UserArgs_MT64x144x128_MI16x16x1_SN_LDSB1_CLR1_GRVWA16_GRVWB8_GSU0_GSUC0_GSUWGMRR0_K1_LBSPPA512_LBSPPB128_LPA16_LPB8_LRVW8_MIWT1_9_PLR1_SU0_SUM0_SUS128_VWA1_VWB1_WGM1_WGMXCC1_WGMXCCGn1
    SolutionIndex: 62
    SolutionNameMin: Cijk_Ailk_Bljk_F8NSS_BH_Bias_HAS_SAV_UserArgs_MT64x144x128_MI16x16x1_SN_LDSB1_CLR1_GRVWA8_GRVWB8_GSU0_GSUC0_GSUWGMRR0_K1_LBSPPA512_LBSPPB128_LPA16_LPB8_LRVW8_MIWT1_9_PLR1_SU0_SUM0_SUS128_VWA1_VWB1_WGM8_WGMXCC1_WGMXCCGn1
    SolutionIndex: 63
    SolutionNameMin: Cijk_Ailk_Bljk_F8NSS_BH_Bias_HAS_SAV_UserArgs_MT128x144x128_MI16x16x1_SN_LDSB1_CLR1_GRVWA16_GRVWB8_GSU0_GSUC0_GSUWGMRR0_K1_LBSPPA1024_LBSPPB128_LPA32_LPB8_LRVW8_MIWT2_9_PLR1_SU0_SUM0_SUS128_VWA2_VWB1_WGM4_WGMXCC1_WGMXCCGn1
    SolutionIndex: 64
    SolutionNameMin: Cijk_Ailk_Bljk_F8NSS_BH_Bias_HAS_SAV_UserArgs_MT128x144x128_MI16x16x1_SN_LDSB1_CLR1_GRVWA16_GRVWB8_GSU0_GSUC0_GSUWGMRR0_K1_LBSPPA1024_LBSPPB128_LPA32_LPB8_LRVW8_MIWT2_9_PLR1_SU0_SUM0_SUS128_VWA2_VWB1_WGM6_WGMXCC1_WGMXCCGn1
    SolutionIndex: 65
    SolutionNameMin: Cijk_Ailk_Bljk_F8NSS_BH_Bias_HAS_SAV_UserArgs_MT128x144x128_MI16x16x1_SN_LDSB1_CLR1_GRVWA8_GRVWB8_GSU0_GSUC0_GSUWGMRR0_K1_LBSPPA1024_LBSPPB128_LPA32_LPB8_LRVW8_MIWT2_9_PLR1_SU0_SUM0_SUS128_VWA2_VWB1_WGM8_WGMXCC1_WGMXCCGn1
    SolutionIndex: 66
    SolutionNameMin: Cijk_Ailk_Bljk_F8NSS_BH_Bias_HAS_SAV_UserArgs_MT128x144x128_MI16x16x1_SN_LDSB1_CLR1_GRVWA16_GRVWB8_GSU0_GSUC0_GSUWGMRR0_K1_LBSPPA1024_LBSPPB128_LPA32_LPB8_LRVW8_MIWT2_9_PLR1_SU0_SUM0_SUS128_VWA2_VWB1_WGM8_WGMXCC1_WGMXCCGn1
    SolutionIndex: 67
    SolutionNameMin: Cijk_Ailk_Bljk_F8NSS_BH_Bias_HAS_SAV_UserArgs_MT128x64x128_MI16x16x1_SN_LDSB1_CLR1_GRVWA16_GRVWB16_GSU0_GSUC0_GSUWGMRR0_K1_LBSPPA1024_LBSPPB128_LPA0_LPB16_LRVW8_MIWT8_1_PLR1_SU0_SUM0_SUS128_VWA8_VWB1_WGM4_WGMXCC1_WGMXCCGn1
    SolutionIndex: 68
    SolutionNameMin: Cijk_Ailk_Bljk_F8NSS_BH_Bias_HAS_SAV_UserArgs_MT128x128x128_MI16x16x1_SN_LDSB1_CLR1_GRVWA16_GRVWB16_GSU0_GSUC0_GSUWGMRR0_K1_LBSPPA1024_LBSPPB512_LPA64_LPB16_LRVW8_MIWT4_4_PLR1_SU0_SUM0_SUS128_VWA4_VWB4_WGM1_WGMXCC1_WGMXCCGn1
    SolutionIndex: 69
    SolutionNameMin: Cijk_Ailk_Bljk_F8NSS_BH_Bias_HAS_SAV_UserArgs_MT128x128x128_MI16x16x1_SN_LDSB1_CLR1_GRVWA16_GRVWB16_GSU0_GSUC0_GSUWGMRR0_K1_LBSPPA1024_LBSPPB512_LPA64_LPB16_LRVW8_MIWT4_4_PLR1_SU0_SUM0_SUS128_VWA4_VWB4_WGM4_WGMXCC1_WGMXCCGn1
    SolutionIndex: 70
    SolutionNameMin: Cijk_Ailk_Bljk_F8NSS_BH_Bias_HAS_SAV_UserArgs_MT128x128x128_MI16x16x1_SN_LDSB1_CLR1_GRVWA16_GRVWB16_GSU0_GSUC0_GSUWGMRR0_K1_LBSPPA1024_LBSPPB512_LPA64_LPB16_LRVW8_MIWT4_4_PLR1_SU0_SUM0_SUS128_VWA4_VWB4_WGM6_WGMXCC1_WGMXCCGn1
    SolutionIndex: 71
    SolutionNameMin: Cijk_Ailk_Bljk_F8NSS_BH_Bias_HAS_SAV_UserArgs_MT128x128x128_MI16x16x1_SN_LDSB1_CLR1_GRVWA16_GRVWB16_GSU0_GSUC0_GSUWGMRR0_K1_LBSPPA1024_LBSPPB512_LPA64_LPB16_LRVW8_MIWT4_4_PLR1_SU0_SUM0_SUS128_VWA4_VWB4_WGM8_WGMXCC1_WGMXCCGn1
    SolutionIndex: 72
    SolutionNameMin: Cijk_Ailk_Bljk_F8NSS_BH_Bias_HAS_SAV_UserArgs_MT64x128x128_MI16x16x1_SN_LDSB1_CLR1_GRVWA8_GRVWB16_GSU0_GSUC0_GSUWGMRR0_K1_LBSPPA512_LBSPPB512_LPA32_LPB16_LRVW8_MIWT2_4_PLR1_SU0_SUM0_SUS128_VWA2_VWB4_WGM1_WGMXCC1_WGMXCCGn1
    SolutionIndex: 73
    SolutionNameMin: Cijk_Ailk_Bljk_F8NSS_BH_Bias_HAS_SAV_UserArgs_MT64x128x128_MI16x16x1_SN_LDSB1_CLR1_GRVWA16_GRVWB16_GSU0_GSUC0_GSUWGMRR0_K1_LBSPPA512_LBSPPB512_LPA32_LPB16_LRVW8_MIWT2_4_PLR1_SU0_SUM0_SUS128_VWA2_VWB4_WGM1_WGMXCC1_WGMXCCGn1
    SolutionIndex: 74
    SolutionNameMin: Cijk_Ailk_Bljk_F8NSS_BH_Bias_HAS_SAV_UserArgs_MT128x64x128_MI16x16x1_SN_LDSB1_CLR1_GRVWA8_GRVWB8_GSU0_GSUC0_GSUWGMRR0_K1_LBSPPA1024_LBSPPB256_LPA64_LPB8_LRVW8_MIWT4_2_PLR1_SU0_SUM0_SUS128_VWA4_VWB2_WGM1_WGMXCC1_WGMXCCGn1
    SolutionIndex: 75
    SolutionNameMin: Cijk_Ailk_Bljk_F8NSS_BH_Bias_HAS_SAV_UserArgs_MT128x64x128_MI16x16x1_SN_LDSB1_CLR1_GRVWA16_GRVWB16_GSU0_GSUC0_GSUWGMRR0_K1_LBSPPA1024_LBSPPB256_LPA64_LPB16_LRVW8_MIWT4_2_PLR1_SU0_SUM0_SUS128_VWA4_VWB2_WGM1_WGMXCC1_WGMXCCGn1
    SolutionIndex: 76
    SolutionNameMin: Cijk_Ailk_Bljk_F8NSS_BH_Bias_HAS_SAV_UserArgs_MT128x64x128_MI16x16x1_SN_LDSB1_CLR1_GRVWA16_GRVWB16_GSU0_GSUC0_GSUWGMRR0_K1_LBSPPA1024_LBSPPB256_LPA64_LPB16_LRVW8_MIWT4_2_PLR1_SU0_SUM0_SUS128_VWA4_VWB2_WGM4_WGMXCC1_WGMXCCGn1
    SolutionIndex: 77
    SolutionNameMin: Cijk_Ailk_Bljk_F8NSS_BH_Bias_HAS_SAV_UserArgs_MT128x64x128_MI16x16x1_SN_LDSB1_CLR1_GRVWA16_GRVWB16_GSU0_GSUC0_GSUWGMRR0_K1_LBSPPA1024_LBSPPB256_LPA64_LPB16_LRVW8_MIWT4_2_PLR1_SU0_SUM0_SUS128_VWA4_VWB2_WGM6_WGMXCC1_WGMXCCGn1
    SolutionIndex: 78
    SolutionNameMin: Cijk_Ailk_Bljk_F8NSS_BH_Bias_HAS_SAV_UserArgs_MT128x64x128_MI16x16x1_SN_LDSB1_CLR1_GRVWA16_GRVWB16_GSU0_GSUC0_GSUWGMRR0_K1_LBSPPA1024_LBSPPB256_LPA64_LPB16_LRVW8_MIWT4_2_PLR1_SU0_SUM0_SUS128_VWA4_VWB2_WGM8_WGMXCC1_WGMXCCGn1
    SolutionIndex: 79
    SolutionNameMin: Cijk_Ailk_Bljk_F8NSS_BH_Bias_HAS_SAV_UserArgs_MT64x64x128_MI16x16x1_SN_LDSB1_CLR1_GRVWA16_GRVWB8_GSU0_GSUC0_GSUWGMRR0_K1_LBSPPA512_LBSPPB256_LPA32_LPB8_LRVW8_MIWT2_2_PLR1_SU0_SUM0_SUS128_VWA2_VWB2_WGM1_WGMXCC1_WGMXCCGn1
    SolutionIndex: 80
    SolutionNameMin: Cijk_Ailk_Bljk_F8NSS_BH_Bias_HAS_SAV_UserArgs_MT64x64x128_MI16x16x1_SN_LDSB1_CLR1_GRVWA8_GRVWB16_GSU0_GSUC0_GSUWGMRR0_K1_LBSPPA512_LBSPPB256_LPA32_LPB16_LRVW8_MIWT2_2_PLR1_SU0_SUM0_SUS128_VWA2_VWB2_WGM1_WGMXCC1_WGMXCCGn1
    SolutionIndex: 81
    SolutionNameMin: Cijk_Ailk_Bljk_F8NSS_BH_Bias_HAS_SAV_UserArgs_MT64x64x128_MI16x16x1_SN_LDSB1_CLR1_GRVWA16_GRVWB16_GSU0_GSUC0_GSUWGMRR0_K1_LBSPPA512_LBSPPB256_LPA32_LPB16_LRVW8_MIWT2_2_PLR1_SU0_SUM0_SUS128_VWA2_VWB2_WGM1_WGMXCC1_WGMXCCGn1
    SolutionIndex: 82
    SolutionNameMin: Cijk_Ailk_Bljk_F8NSS_BH_Bias_HAS_SAV_UserArgs_MT64x64x128_MI16x16x1_SN_LDSB1_CLR1_GRVWA16_GRVWB8_GSU0_GSUC0_GSUWGMRR0_K1_LBSPPA512_LBSPPB256_LPA32_LPB8_LRVW8_MIWT2_2_PLR1_SU0_SUM0_SUS128_VWA2_VWB2_WGM4_WGMXCC1_WGMXCCGn1
    SolutionIndex: 83
    SolutionNameMin: Cijk_Ailk_Bljk_F8NSS_BH_Bias_HAS_SAV_UserArgs_MT64x64x128_MI16x16x1_SN_LDSB1_CLR1_GRVWA16_GRVWB16_GSU0_GSUC0_GSUWGMRR0_K1_LBSPPA512_LBSPPB256_LPA32_LPB16_LRVW8_MIWT2_2_PLR1_SU0_SUM0_SUS128_VWA2_VWB2_WGM4_WGMXCC1_WGMXCCGn1
    SolutionIndex: 84
    SolutionNameMin: Cijk_Ailk_Bljk_F8NSS_BH_Bias_HAS_SAV_UserArgs_MT64x64x128_MI16x16x1_SN_LDSB1_CLR1_GRVWA16_GRVWB16_GSU0_GSUC0_GSUWGMRR0_K1_LBSPPA512_LBSPPB256_LPA32_LPB16_LRVW8_MIWT2_2_PLR1_SU0_SUM0_SUS128_VWA2_VWB2_WGM6_WGMXCC1_WGMXCCGn1
    SolutionIndex: 85
    SolutionNameMin: Cijk_Ailk_Bljk_F8NSS_BH_Bias_HAS_SAV_UserArgs_MT64x64x128_MI16x16x1_SN_LDSB1_CLR1_GRVWA16_GRVWB8_GSU0_GSUC0_GSUWGMRR0_K1_LBSPPA512_LBSPPB256_LPA32_LPB8_LRVW8_MIWT2_2_PLR1_SU0_SUM0_SUS128_VWA2_VWB2_WGM8_WGMXCC1_WGMXCCGn1
    SolutionIndex: 86
    SolutionNameMin: Cijk_Ailk_Bljk_F8NSS_BH_Bias_HAS_SAV_UserArgs_MT64x64x128_MI16x16x1_SN_LDSB1_CLR1_GRVWA16_GRVWB16_GSU0_GSUC0_GSUWGMRR0_K1_LBSPPA512_LBSPPB256_LPA32_LPB16_LRVW8_MIWT2_2_PLR1_SU0_SUM0_SUS128_VWA2_VWB2_WGM8_WGMXCC1_WGMXCCGn1
    SolutionIndex: 87
    SolutionNameMin: Cijk_Ailk_Bljk_F8NSS_BH_Bias_HAS_SAV_UserArgs_MT32x64x128_MI16x16x1_SN_LDSB0_CLR1_GRVWA8_GRVWB8_GSU0_GSUC0_GSUWGMRR0_K1_LBSPPA256_LBSPPB256_LPA16_LPB8_LRVW8_MIWT1_2_PLR1_SU0_SUM0_SUS128_VWA1_VWB2_WGM1_WGMXCC1_WGMXCCGn1
    SolutionIndex: 88
    SolutionNameMin: Cijk_Ailk_Bljk_F8NSS_BH_Bias_HAS_SAV_UserArgs_MT32x64x128_MI16x16x1_SN_LDSB0_CLR1_GRVWA8_GRVWB16_GSU0_GSUC0_GSUWGMRR0_K1_LBSPPA256_LBSPPB256_LPA16_LPB16_LRVW8_MIWT1_2_PLR1_SU0_SUM0_SUS128_VWA1_VWB2_WGM1_WGMXCC1_WGMXCCGn1
    SolutionIndex: 89
    SolutionNameMin: Cijk_Ailk_Bljk_F8NSS_BH_Bias_HAS_SAV_UserArgs_MT32x64x128_MI16x16x1_SN_LDSB0_CLR1_GRVWA16_GRVWB16_GSU0_GSUC0_GSUWGMRR0_K1_LBSPPA256_LBSPPB256_LPA16_LPB16_LRVW8_MIWT1_2_PLR1_SU0_SUM0_SUS128_VWA1_VWB2_WGM1_WGMXCC1_WGMXCCGn1
    SolutionIndex: 90
    SolutionNameMin: Cijk_Ailk_Bljk_F8NSS_BH_Bias_HAS_SAV_UserArgs_MT32x64x128_MI16x16x1_SN_LDSB0_CLR1_GRVWA8_GRVWB16_GSU0_GSUC0_GSUWGMRR0_K1_LBSPPA256_LBSPPB256_LPA16_LPB16_LRVW8_MIWT1_2_PLR1_SU0_SUM0_SUS128_VWA1_VWB2_WGM4_WGMXCC1_WGMXCCGn1
    SolutionIndex: 91
    SolutionNameMin: Cijk_Ailk_Bljk_F8NSS_BH_Bias_HAS_SAV_UserArgs_MT32x64x128_MI16x16x1_SN_LDSB0_CLR1_GRVWA16_GRVWB16_GSU0_GSUC0_GSUWGMRR0_K1_LBSPPA256_LBSPPB256_LPA16_LPB16_LRVW8_MIWT1_2_PLR1_SU0_SUM0_SUS128_VWA1_VWB2_WGM4_WGMXCC1_WGMXCCGn1
    SolutionIndex: 92
    SolutionNameMin: Cijk_Ailk_Bljk_F8NSS_BH_Bias_HAS_SAV_UserArgs_MT32x64x128_MI16x16x1_SN_LDSB0_CLR1_GRVWA8_GRVWB16_GSU0_GSUC0_GSUWGMRR0_K1_LBSPPA256_LBSPPB256_LPA16_LPB16_LRVW8_MIWT1_2_PLR1_SU0_SUM0_SUS128_VWA1_VWB2_WGM6_WGMXCC1_WGMXCCGn1
    SolutionIndex: 93
    SolutionNameMin: Cijk_Ailk_Bljk_F8NSS_BH_Bias_HAS_SAV_UserArgs_MT64x32x128_MI16x16x1_SN_LDSB0_CLR1_GRVWA8_GRVWB16_GSU0_GSUC0_GSUWGMRR0_K1_LBSPPA512_LBSPPB128_LPA32_LPB16_LRVW8_MIWT2_1_PLR1_SU0_SUM0_SUS128_VWA2_VWB1_WGM1_WGMXCC1_WGMXCCGn1
    SolutionIndex: 94
    SolutionNameMin: Cijk_Ailk_Bljk_F8NSS_BH_Bias_HAS_SAV_UserArgs_MT64x32x128_MI16x16x1_SN_LDSB0_CLR1_GRVWA16_GRVWB16_GSU0_GSUC0_GSUWGMRR0_K1_LBSPPA512_LBSPPB128_LPA32_LPB16_LRVW8_MIWT2_1_PLR1_SU0_SUM0_SUS128_VWA2_VWB1_WGM1_WGMXCC1_WGMXCCGn1
    SolutionIndex: 95
    SolutionNameMin: Cijk_Ailk_Bljk_F8NSS_BH_Bias_HAS_SAV_UserArgs_MT64x32x128_MI16x16x1_SN_LDSB0_CLR1_GRVWA8_GRVWB16_GSU0_GSUC0_GSUWGMRR0_K1_LBSPPA512_LBSPPB128_LPA32_LPB16_LRVW8_MIWT2_1_PLR1_SU0_SUM0_SUS128_VWA2_VWB1_WGM8_WGMXCC1_WGMXCCGn1
    SolutionIndex: 96
    SolutionNameMin: Cijk_Ailk_Bljk_F8NSS_BH_Bias_HAS_SAV_UserArgs_MT32x32x128_MI16x16x1_SN_LDSB0_CLR1_GRVWA8_GRVWB8_GSU0_GSUC0_GSUWGMRR0_K1_LBSPPA256_LBSPPB128_LPA16_LPB8_LRVW8_MIWT1_1_PLR1_SU0_SUM0_SUS128_VWA1_VWB1_WGM1_WGMXCC1_WGMXCCGn1
    SolutionIndex: 97
    SolutionNameMin: Cijk_Ailk_Bljk_F8NSS_BH_Bias_HAS_SAV_UserArgs_MT32x32x128_MI16x16x1_SN_LDSB0_CLR1_GRVWA8_GRVWB16_GSU0_GSUC0_GSUWGMRR0_K1_LBSPPA256_LBSPPB128_LPA16_LPB16_LRVW8_MIWT1_1_PLR1_SU0_SUM0_SUS128_VWA1_VWB1_WGM1_WGMXCC1_WGMXCCGn1
    SolutionIndex: 98
    SolutionNameMin: Cijk_Ailk_Bljk_F8NSS_BH_Bias_HAS_SAV_UserArgs_MT32x32x128_MI16x16x1_SN_LDSB0_CLR1_GRVWA16_GRVWB16_GSU0_GSUC0_GSUWGMRR0_K1_LBSPPA256_LBSPPB128_LPA16_LPB16_LRVW8_MIWT1_1_PLR1_SU0_SUM0_SUS128_VWA1_VWB1_WGM1_WGMXCC1_WGMXCCGn1
    SolutionIndex: 99
    SolutionNameMin: Cijk_Ailk_Bljk_F8NSS_BH_Bias_HAS_SAV_UserArgs_MT32x32x128_MI16x16x1_SN_LDSB0_CLR1_GRVWA8_GRVWB16_GSU0_GSUC0_GSUWGMRR0_K1_LBSPPA256_LBSPPB128_LPA16_LPB16_LRVW8_MIWT1_1_PLR1_SU0_SUM0_SUS128_VWA1_VWB1_WGM8_WGMXCC1_WGMXCCGn1
    SolutionIndex: 100
    SolutionNameMin: Cijk_Ailk_Bljk_F8NSS_BH_Bias_HAS_SAV_UserArgs_MT64x64x256_MI16x16x1_SN_LDSB1_CLR1_GRVWA16_GRVWB16_GSU0_GSUC0_GSUWGMRR0_K1_LBSPPA512_LBSPPB512_LPA32_LPB16_LRVW8_MIWT2_2_PLR1_SU0_SUM0_SUS256_VWA2_VWB2_WGM1_WGMXCC1_WGMXCCGn1
    SolutionIndex: 101
    SolutionNameMin: Cijk_Ailk_Bljk_F8NSS_BH_Bias_HAS_SAV_UserArgs_MT64x64x256_MI16x16x1_SN_LDSB1_CLR1_GRVWA16_GRVWB16_GSU0_GSUC0_GSUWGMRR0_K1_LBSPPA512_LBSPPB512_LPA32_LPB16_LRVW8_MIWT2_2_PLR1_SU0_SUM0_SUS256_VWA2_VWB2_WGM6_WGMXCC1_WGMXCCGn1
    SolutionIndex: 102
    SolutionNameMin: Cijk_Ailk_Bljk_F8NSS_BH_Bias_HAS_SAV_UserArgs_MT64x32x256_MI16x16x1_SN_LDSB1_CLR1_GRVWA8_GRVWB16_GSU0_GSUC0_GSUWGMRR0_K1_LBSPPA512_LBSPPB256_LPA32_LPB16_LRVW8_MIWT2_1_PLR1_SU0_SUM0_SUS256_VWA2_VWB1_WGM1_WGMXCC1_WGMXCCGn1
    SolutionIndex: 103
    SolutionNameMin: Cijk_Ailk_Bljk_F8NSS_BH_Bias_HAS_SAV_UserArgs_MT64x32x256_MI16x16x1_SN_LDSB1_CLR1_GRVWA16_GRVWB16_GSU0_GSUC0_GSUWGMRR0_K1_LBSPPA512_LBSPPB256_LPA32_LPB16_LRVW8_MIWT2_1_PLR1_SU0_SUM0_SUS256_VWA2_VWB1_WGM1_WGMXCC1_WGMXCCGn1
    SolutionIndex: 104
    SolutionNameMin: Cijk_Ailk_Bljk_F8NSS_BH_Bias_HAS_SAV_UserArgs_MT64x32x256_MI16x16x1_SN_LDSB1_CLR1_GRVWA16_GRVWB16_GSU0_GSUC0_GSUWGMRR0_K1_LBSPPA512_LBSPPB256_LPA32_LPB16_LRVW8_MIWT2_1_PLR1_SU0_SUM0_SUS256_VWA2_VWB1_WGM4_WGMXCC1_WGMXCCGn1
    SolutionIndex: 105
    SolutionNameMin: Cijk_Ailk_Bljk_F8NSS_BH_Bias_HAS_SAV_UserArgs_MT64x32x256_MI16x16x1_SN_LDSB1_CLR1_GRVWA16_GRVWB16_GSU0_GSUC0_GSUWGMRR0_K1_LBSPPA512_LBSPPB256_LPA32_LPB16_LRVW8_MIWT2_1_PLR1_SU0_SUM0_SUS256_VWA2_VWB1_WGM6_WGMXCC1_WGMXCCGn1
    SolutionIndex: 106
    SolutionNameMin: Cijk_Ailk_Bljk_F8NSS_BH_Bias_HAS_SAV_UserArgs_MT32x32x256_MI16x16x1_SN_LDSB1_CLR1_GRVWA16_GRVWB16_GSU0_GSUC0_GSUWGMRR0_K1_LBSPPA256_LBSPPB256_LPA16_LPB16_LRVW8_MIWT1_1_PLR1_SU0_SUM0_SUS256_VWA1_VWB1_WGM4_WGMXCC1_WGMXCCGn1
    SolutionIndex: 107
    SolutionNameMin: Cijk_Ailk_Bljk_F8NSS_BH_Bias_HAS_SAV_UserArgs_MT32x32x256_MI16x16x1_SN_LDSB1_CLR1_GRVWA16_GRVWB16_GSU0_GSUC0_GSUWGMRR0_K1_LBSPPA256_LBSPPB256_LPA16_LPB16_LRVW8_MIWT1_1_PLR1_SU0_SUM0_SUS256_VWA1_VWB1_WGM6_WGMXCC1_WGMXCCGn1
- - - [128, 128, 1, 128, 128, 128, 128, 128]
    - [99, 0.53]
  - - [128, 128, 1, 256, 128, 128, 128, 256]
    - [96, 1.01]
  - - [128, 128, 1, 512, 128, 128, 128, 512]
    - [97, 1.75]
  - - [128, 128, 1, 1024, 128, 128, 128, 1024]
    - [97, 2.76]
  - - [128, 128, 1, 2048, 128, 128, 128, 2048]
    - [96, 3.84]
  - - [128, 128, 1, 4096, 128, 128, 128, 4096]
    - [96, 4.8]
  - - [128, 128, 1, 8192, 128, 128, 128, 8192]
    - [96, 5.48]
  - - [128, 256, 1, 128, 128, 128, 128, 128]
    - [97, 1.13]
  - - [128, 256, 1, 256, 128, 128, 128, 256]
    - [97, 2.02]
  - - [128, 256, 1, 512, 128, 128, 128, 512]
    - [97, 3.58]
  - - [128, 256, 1, 1024, 128, 128, 128, 1024]
    - [96, 5.59]
  - - [128, 256, 1, 2048, 128, 128, 128, 2048]
    - [96, 7.81]
  - - [128, 256, 1, 4096, 128, 128, 128, 4096]
    - [96, 9.65]
  - - [128, 256, 1, 8192, 128, 128, 128, 8192]
    - [96, 10.97]
  - - [128, 512, 1, 128, 128, 128, 128, 128]
    - [44, 2.26]
  - - [128, 512, 1, 256, 128, 128, 128, 256]
    - [96, 4.06]
  - - [128, 512, 1, 512, 128, 128, 128, 512]
    - [96, 7.02]
  - - [128, 512, 1, 1024, 128, 128, 128, 1024]
    - [96, 11.0]
  - - [128, 512, 1, 2048, 128, 128, 128, 2048]
    - [96, 15.01]
  - - [128, 512, 1, 4096, 128, 128, 128, 4096]
    - [96, 19.03]
  - - [128, 512, 1, 8192, 128, 128, 128, 8192]
    - [98, 21.67]
  - - [128, 1024, 1, 128, 128, 128, 128, 128]
    - [59, 2.77]
  - - [128, 1024, 1, 256, 128, 128, 128, 256]
    - [35, 5.54]
  - - [128, 1024, 1, 512, 128, 128, 128, 512]
    - [43, 11.47]
  - - [128, 1024, 1, 1024, 128, 128, 128, 1024]
    - [45, 19.3]
  - - [128, 1024, 1, 2048, 128, 128, 128, 2048]
    - [96, 29.87]
  - - [128, 1024, 1, 4096, 128, 128, 128, 4096]
    - [96, 37.54]
  - - [128, 1024, 1, 8192, 128, 128, 128, 8192]
    - [96, 42.95]
  - - [128, 2048, 1, 128, 128, 128, 128, 128]
    - [42, 7.73]
  - - [128, 2048, 1, 256, 128, 128, 128, 256]
    - [94, 13.69]
  - - [128, 2048, 1, 512, 128, 128, 128, 512]
    - [87, 23.68]
  - - [128, 2048, 1, 1024, 128, 128, 128, 1024]
    - [88, 37.05]
  - - [128, 2048, 1, 2048, 128, 128, 128, 2048]
    - [103, 50.98]
  - - [128, 2048, 1, 4096, 128, 128, 128, 4096]
    - [103, 63.25]
  - - [128, 2048, 1, 8192, 128, 128, 128, 8192]
    - [103, 71.25]
  - - [128, 4096, 1, 128, 128, 128, 128, 128]
    - [37, 13.3]
  - - [128, 4096, 1, 256, 128, 128, 128, 256]
    - [36, 23.48]
  - - [128, 4096, 1, 512, 128, 128, 128, 512]
    - [81, 38.71]
  - - [128, 4096, 1, 1024, 128, 128, 128, 1024]
    - [79, 60.04]
  - - [128, 4096, 1, 2048, 128, 128, 128, 2048]
    - [79, 80.88]
  - - [128, 4096, 1, 4096, 128, 128, 128, 4096]
    - [100, 99.54]
  - - [128, 4096, 1, 8192, 128, 128, 128, 8192]
    - [101, 110.03]
  - - [128, 8192, 1, 128, 128, 128, 128, 128]
    - [31, 21.16]
  - - [128, 8192, 1, 256, 128, 128, 128, 256]
    - [25, 37.58]
  - - [128, 8192, 1, 512, 128, 128, 128, 512]
    - [25, 62.17]
  - - [128, 8192, 1, 1024, 128, 128, 128, 1024]
    - [24, 93.48]
  - - [128, 8192, 1, 2048, 128, 128, 128, 2048]
    - [73, 117.77]
  - - [128, 8192, 1, 4096, 128, 128, 128, 4096]
    - [72, 136.5]
  - - [128, 8192, 1, 8192, 128, 128, 128, 8192]
    - [73, 151.15]
  - - [256, 128, 1, 128, 256, 256, 256, 128]
    - [44, 1.11]
  - - [256, 128, 1, 256, 256, 256, 256, 256]
    - [97, 1.98]
  - - [256, 128, 1, 512, 256, 256, 256, 512]
    - [97, 3.47]
  - - [256, 128, 1, 1024, 256, 256, 256, 1024]
    - [96, 5.44]
  - - [256, 128, 1, 2048, 256, 256, 256, 2048]
    - [97, 7.76]
  - - [256, 128, 1, 4096, 256, 256, 256, 4096]
    - [97, 9.6]
  - - [256, 128, 1, 8192, 256, 256, 256, 8192]
    - [98, 10.92]
  - - [256, 256, 1, 128, 256, 256, 256, 128]
    - [97, 2.2]
  - - [256, 256, 1, 256, 256, 256, 256, 256]
    - [97, 4.01]
  - - [256, 256, 1, 512, 256, 256, 256, 512]
    - [97, 6.99]
  - - [256, 256, 1, 1024, 256, 256, 256, 1024]
    - [97, 10.92]
  - - [256, 256, 1, 2048, 256, 256, 256, 2048]
    - [97, 15.22]
  - - [256, 256, 1, 4096, 256, 256, 256, 4096]
    - [96, 19.14]
  - - [256, 256, 1, 8192, 256, 256, 256, 8192]
    - [96, 21.76]
  - - [256, 512, 1, 128, 256, 256, 256, 128]
    - [97, 4.3]
  - - [256, 512, 1, 256, 256, 256, 256, 256]
    - [44, 7.65]
  - - [256, 512, 1, 512, 256, 256, 256, 512]
    - [97, 13.43]
  - - [256, 512, 1, 1024, 256, 256, 256, 1024]
    - [97, 21.1]
  - - [256, 512, 1, 2048, 256, 256, 256, 2048]
    - [97, 29.84]
  - - [256, 512, 1, 4096, 256, 256, 256, 4096]
    - [96, 37.44]
  - - [256, 512, 1, 8192, 256, 256, 256, 8192]
    - [96, 42.69]
  - - [256, 1024, 1, 128, 256, 256, 256, 128]
    - [87, 7.79]
  - - [256, 1024, 1, 256, 256, 256, 256, 256]
    - [88, 14.36]
  - - [256, 1024, 1, 512, 256, 256, 256, 512]
    - [88, 23.83]
  - - [256, 1024, 1, 1024, 256, 256, 256, 1024]
    - [94, 36.5]
  - - [256, 1024, 1, 2048, 256, 256, 256, 2048]
    - [103, 50.81]
  - - [256, 1024, 1, 4096, 256, 256, 256, 4096]
    - [103, 62.84]
  - - [256, 1024, 1, 8192, 256, 256, 256, 8192]
    - [103, 72.1]
  - - [256, 2048, 1, 128, 256, 256, 256, 128]
    - [36, 13.37]
  - - [256, 2048, 1, 256, 256, 256, 256, 256]
    - [74, 19.66]
  - - [256, 2048, 1, 512, 256, 256, 256, 512]
    - [85, 38.46]
  - - [256, 2048, 1, 1024, 256, 256, 256, 1024]
    - [82, 58.85]
  - - [256, 2048, 1, 2048, 256, 256, 256, 2048]
    - [100, 80.49]
  - - [256, 2048, 1, 4096, 256, 256, 256, 4096]
    - [100, 98.99]
  - - [256, 2048, 1, 8192, 256, 256, 256, 8192]
    - [79, 107.19]
  - - [256, 4096, 1, 128, 256, 256, 256, 128]
    - [14, 18.06]
  - - [256, 4096, 1, 256, 256, 256, 256, 256]
    - [15, 36.48]
  - - [256, 4096, 1, 512, 256, 256, 256, 512]
    - [26, 62.45]
  - - [256, 4096, 1, 1024, 256, 256, 256, 1024]
    - [24, 93.47]
  - - [256, 4096, 1, 2048, 256, 256, 256, 2048]
    - [24, 123.44]
  - - [256, 4096, 1, 4096, 256, 256, 256, 4096]
    - [73, 137.18]
  - - [256, 4096, 1, 8192, 256, 256, 256, 8192]
    - [73, 149.56]
  - - [256, 8192, 1, 128, 256, 256, 256, 128]
    - [61, 30.59]
  - - [256, 8192, 1, 256, 256, 256, 256, 256]
    - [61, 55.39]
  - - [256, 8192, 1, 512, 256, 256, 256, 512]
    - [60, 93.07]
  - - [256, 8192, 1, 1024, 256, 256, 256, 1024]
    - [68, 133.28]
  - - [256, 8192, 1, 2048, 256, 256, 256, 2048]
    - [68, 169.66]
  - - [256, 8192, 1, 4096, 256, 256, 256, 4096]
    - [68, 204.39]
  - - [256, 8192, 1, 8192, 256, 256, 256, 8192]
    - [69, 207.64]
  - - [512, 128, 1, 128, 512, 512, 512, 128]
    - [62, 1.25]
  - - [512, 128, 1, 256, 512, 512, 512, 256]
    - [67, 2.45]
  - - [512, 128, 1, 512, 512, 512, 512, 512]
    - [38, 4.74]
  - - [512, 128, 1, 1024, 512, 512, 512, 1024]
    - [95, 9.13]
  - - [512, 128, 1, 2048, 512, 512, 512, 2048]
    - [96, 15.26]
  - - [512, 128, 1, 4096, 512, 512, 512, 4096]
    - [96, 19.11]
  - - [512, 128, 1, 8192, 512, 512, 512, 8192]
    - [106, 18.62]
  - - [512, 256, 1, 128, 512, 512, 512, 128]
    - [97, 4.22]
  - - [512, 256, 1, 256, 512, 512, 512, 256]
    - [97, 7.81]
  - - [512, 256, 1, 512, 512, 512, 512, 512]
    - [97, 13.32]
  - - [512, 256, 1, 1024, 512, 512, 512, 1024]
    - [96, 21.17]
  - - [512, 256, 1, 2048, 512, 512, 512, 2048]
    - [96, 29.73]
  - - [512, 256, 1, 4096, 512, 512, 512, 4096]
    - [96, 37.37]
  - - [512, 256, 1, 8192, 512, 512, 512, 8192]
    - [106, 34.69]
  - - [512, 512, 1, 128, 512, 512, 512, 128]
    - [93, 7.71]
  - - [512, 512, 1, 256, 512, 512, 512, 256]
    - [93, 13.9]
  - - [512, 512, 1, 512, 512, 512, 512, 512]
    - [88, 23.68]
  - - [512, 512, 1, 1024, 512, 512, 512, 1024]
    - [93, 36.72]
  - - [512, 512, 1, 2048, 512, 512, 512, 2048]
    - [103, 50.49]
  - - [512, 512, 1, 4096, 512, 512, 512, 4096]
    - [103, 62.86]
  - - [512, 512, 1, 8192, 512, 512, 512, 8192]
    - [94, 60.94]
  - - [512, 1024, 1, 128, 512, 512, 512, 128]
    - [39, 13.2]
  - - [512, 1024, 1, 256, 512, 512, 512, 256]
    - [40, 23.81]
  - - [512, 1024, 1, 512, 512, 512, 512, 512]
    - [39, 39.29]
  - - [512, 1024, 1, 1024, 512, 512, 512, 1024]
    - [79, 59.58]
  - - [512, 1024, 1, 2048, 512, 512, 512, 2048]
    - [79, 80.94]
  - - [512, 1024, 1, 4096, 512, 512, 512, 4096]
    - [79, 97.95]
  - - [512, 1024, 1, 8192, 512, 512, 512, 8192]
    - [81, 102.65]
  - - [512, 2048, 1, 128, 512, 512, 512, 128]
    - [25, 21.47]
  - - [512, 2048, 1, 256, 512, 512, 512, 256]
    - [25, 38.31]
  - - [512, 2048, 1, 512, 512, 512, 512, 512]
    - [25, 64.0]
  - - [512, 2048, 1, 1024, 512, 512, 512, 1024]
    - [24, 94.19]
  - - [512, 2048, 1, 2048, 512, 512, 512, 2048]
    - [24, 125.81]
  - - [512, 2048, 1, 4096, 512, 512, 512, 4096]
    - [75, 134.13]
  - - [512, 2048, 1, 8192, 512, 512, 512, 8192]
    - [77, 143.6]
  - - [512, 4096, 1, 128, 512, 512, 512, 128]
    - [23, 31.56]
  - - [512, 4096, 1, 256, 512, 512, 512, 256]
    - [23, 56.51]
  - - [512, 4096, 1, 512, 512, 512, 512, 512]
    - [68, 91.08]
  - - [512, 4096, 1, 1024, 512, 512, 512, 1024]
    - [68, 134.1]
  - - [512, 4096, 1, 2048, 512, 512, 512, 2048]
    - [68, 170.71]
  - - [512, 4096, 1, 4096, 512, 512, 512, 4096]
    - [68, 193.45]
  - - [512, 4096, 1, 8192, 512, 512, 512, 8192]
    - [68, 196.89]
  - - [512, 8192, 1, 128, 512, 512, 512, 128]
    - [65, 40.29]
  - - [512, 8192, 1, 256, 512, 512, 512, 256]
    - [66, 71.71]
  - - [512, 8192, 1, 512, 512, 512, 512, 512]
    - [66, 119.18]
  - - [512, 8192, 1, 1024, 512, 512, 512, 1024]
    - [64, 167.38]
  - - [512, 8192, 1, 2048, 512, 512, 512, 2048]
    - [64, 212.68]
  - - [512, 8192, 1, 4096, 512, 512, 512, 4096]
    - [63, 247.12]
  - - [512, 8192, 1, 8192, 512, 512, 512, 8192]
    - [46, 241.41]
  - - [1024, 128, 1, 128, 1024, 1024, 1024, 128]
    - [97, 4.29]
  - - [1024, 128, 1, 256, 1024, 1024, 1024, 256]
    - [97, 7.68]
  - - [1024, 128, 1, 512, 1024, 1024, 1024, 512]
    - [96, 13.27]
  - - [1024, 128, 1, 1024, 1024, 1024, 1024, 1024]
    - [97, 21.0]
  - - [1024, 128, 1, 2048, 1024, 1024, 1024, 2048]
    - [96, 29.46]
  - - [1024, 128, 1, 4096, 1024, 1024, 1024, 4096]
    - [107, 29.87]
  - - [1024, 128, 1, 8192, 1024, 1024, 1024, 8192]
    - [106, 30.41]
  - - [1024, 256, 1, 128, 1024, 1024, 1024, 128]
    - [42, 7.57]
  - - [1024, 256, 1, 256, 1024, 1024, 1024, 256]
    - [102, 13.62]
  - - [1024, 256, 1, 512, 1024, 1024, 1024, 512]
    - [90, 23.35]
  - - [1024, 256, 1, 1024, 1024, 1024, 1024, 1024]
    - [92, 36.39]
  - - [1024, 256, 1, 2048, 1024, 1024, 1024, 2048]
    - [103, 50.3]
  - - [1024, 256, 1, 4096, 1024, 1024, 1024, 4096]
    - [91, 53.91]
  - - [1024, 256, 1, 8192, 1024, 1024, 1024, 8192]
    - [95, 58.49]
  - - [1024, 512, 1, 128, 1024, 1024, 1024, 128]
    - [41, 13.12]
  - - [1024, 512, 1, 256, 1024, 1024, 1024, 256]
    - [34, 23.33]
  - - [1024, 512, 1, 512, 1024, 1024, 1024, 512]
    - [82, 38.95]
  - - [1024, 512, 1, 1024, 1024, 1024, 1024, 1024]
    - [82, 58.68]
  - - [1024, 512, 1, 2048, 1024, 1024, 1024, 2048]
    - [82, 80.24]
  - - [1024, 512, 1, 4096, 1024, 1024, 1024, 4096]
    - [83, 92.16]
  - - [1024, 512, 1, 8192, 1024, 1024, 1024, 8192]
    - [86, 100.21]
  - - [1024, 1024, 1, 128, 1024, 1024, 1024, 128]
    - [25, 21.1]
  - - [1024, 1024, 1, 256, 1024, 1024, 1024, 256]
    - [25, 37.87]
  - - [1024, 1024, 1, 512, 1024, 1024, 1024, 512]
    - [25, 63.15]
  - - [1024, 1024, 1, 1024, 1024, 1024, 1024, 1024]
    - [24, 94.65]
  - - [1024, 1024, 1, 2048, 1024, 1024, 1024, 2048]
    - [25, 120.56]
  - - [1024, 1024, 1, 4096, 1024, 1024, 1024, 4096]
    - [77, 132.32]
  - - [1024, 1024, 1, 8192, 1024, 1024, 1024, 8192]
    - [76, 142.83]
  - - [1024, 2048, 1, 128, 1024, 1024, 1024, 128]
    - [17, 31.71]
  - - [1024, 2048, 1, 256, 1024, 1024, 1024, 256]
    - [21, 55.16]
  - - [1024, 2048, 1, 512, 1024, 1024, 1024, 512]
    - [68, 91.8]
  - - [1024, 2048, 1, 1024, 1024, 1024, 1024, 1024]
    - [68, 132.79]
  - - [1024, 2048, 1, 2048, 1024, 1024, 1024, 2048]
    - [68, 164.03]
  - - [1024, 2048, 1, 4096, 1024, 1024, 1024, 4096]
    - [68, 192.11]
  - - [1024, 2048, 1, 8192, 1024, 1024, 1024, 8192]
    - [68, 194.69]
  - - [1024, 4096, 1, 128, 1024, 1024, 1024, 128]
    - [7, 38.28]
  - - [1024, 4096, 1, 256, 1024, 1024, 1024, 256]
    - [7, 68.26]
  - - [1024, 4096, 1, 512, 1024, 1024, 1024, 512]
    - [7, 107.85]
  - - [1024, 4096, 1, 1024, 1024, 1024, 1024, 1024]
    - [7, 158.26]
  - - [1024, 4096, 1, 2048, 1024, 1024, 1024, 2048]
    - [54, 206.42]
  - - [1024, 4096, 1, 4096, 1024, 1024, 1024, 4096]
    - [56, 242.53]
  - - [1024, 4096, 1, 8192, 1024, 1024, 1024, 8192]
    - [52, 240.54]
  - - [1024, 8192, 1, 128, 1024, 1024, 1024, 128]
    - [52, 43.81]
  - - [1024, 8192, 1, 256, 1024, 1024, 1024, 256]
    - [52, 80.46]
  - - [1024, 8192, 1, 512, 1024, 1024, 1024, 512]
    - [56, 138.09]
  - - [1024, 8192, 1, 1024, 1024, 1024, 1024, 1024]
    - [51, 200.51]
  - - [1024, 8192, 1, 2048, 1024, 1024, 1024, 2048]
    - [52, 273.94]
  - - [1024, 8192, 1, 4096, 1024, 1024, 1024, 4096]
    - [54, 317.73]
  - - [1024, 8192, 1, 8192, 1024, 1024, 1024, 8192]
    - [56, 345.77]
  - - [2048, 128, 1, 128, 2048, 2048, 2048, 128]
    - [88, 7.97]
  - - [2048, 128, 1, 256, 2048, 2048, 2048, 256]
    - [88, 14.24]
  - - [2048, 128, 1, 512, 2048, 2048, 2048, 512]
    - [88, 23.74]
  - - [2048, 128, 1, 1024, 2048, 2048, 2048, 1024]
    - [88, 36.78]
  - - [2048, 128, 1, 2048, 2048, 2048, 2048, 2048]
    - [89, 43.28]
  - - [2048, 128, 1, 4096, 2048, 2048, 2048, 4096]
    - [104, 51.87]
  - - [2048, 128, 1, 8192, 2048, 2048, 2048, 8192]
    - [105, 58.81]
  - - [2048, 256, 1, 128, 2048, 2048, 2048, 128]
    - [40, 13.49]
  - - [2048, 256, 1, 256, 2048, 2048, 2048, 256]
    - [40, 24.01]
  - - [2048, 256, 1, 512, 2048, 2048, 2048, 512]
    - [80, 39.68]
  - - [2048, 256, 1, 1024, 2048, 2048, 2048, 1024]
    - [79, 59.91]
  - - [2048, 256, 1, 2048, 2048, 2048, 2048, 2048]
    - [86, 75.44]
  - - [2048, 256, 1, 4096, 2048, 2048, 2048, 4096]
    - [84, 91.38]
  - - [2048, 256, 1, 8192, 2048, 2048, 2048, 8192]
    - [84, 102.3]
  - - [2048, 512, 1, 128, 2048, 2048, 2048, 128]
    - [30, 21.87]
  - - [2048, 512, 1, 256, 2048, 2048, 2048, 256]
    - [32, 38.45]
  - - [2048, 512, 1, 512, 2048, 2048, 2048, 512]
    - [32, 62.28]
  - - [2048, 512, 1, 1024, 2048, 2048, 2048, 1024]
    - [27, 89.49]
  - - [2048, 512, 1, 2048, 2048, 2048, 2048, 2048]
    - [77, 114.06]
  - - [2048, 512, 1, 4096, 2048, 2048, 2048, 4096]
    - [78, 136.33]
  - - [2048, 512, 1, 8192, 2048, 2048, 2048, 8192]
    - [78, 143.24]
  - - [2048, 1024, 1, 128, 2048, 2048, 2048, 128]
    - [17, 31.56]
  - - [2048, 1024, 1, 256, 2048, 2048, 2048, 256]
    - [23, 55.75]
  - - [2048, 1024, 1, 512, 2048, 2048, 2048, 512]
    - [23, 88.73]
  - - [2048, 1024, 1, 1024, 2048, 2048, 2048, 1024]
    - [68, 126.45]
  - - [2048, 1024, 1, 2048, 2048, 2048, 2048, 2048]
    - [70, 163.75]
  - - [2048, 1024, 1, 4096, 2048, 2048, 2048, 4096]
    - [69, 194.67]
  - - [2048, 1024, 1, 8192, 2048, 2048, 2048, 8192]
    - [71, 191.88]
  - - [2048, 2048, 1, 128, 2048, 2048, 2048, 128]
    - [7, 36.19]
  - - [2048, 2048, 1, 256, 2048, 2048, 2048, 256]
    - [7, 65.0]
  - - [2048, 2048, 1, 512, 2048, 2048, 2048, 512]
    - [10, 105.12]
  - - [2048, 2048, 1, 1024, 2048, 2048, 2048, 1024]
    - [58, 155.62]
  - - [2048, 2048, 1, 2048, 2048, 2048, 2048, 2048]
    - [58, 205.77]
  - - [2048, 2048, 1, 4096, 2048, 2048, 2048, 4096]
    - [58, 240.35]
  - - [2048, 2048, 1, 8192, 2048, 2048, 2048, 8192]
    - [54, 238.43]
  - - [2048, 4096, 1, 128, 2048, 2048, 2048, 128]
    - [17, 38.62]
  - - [2048, 4096, 1, 256, 2048, 2048, 2048, 256]
    - [7, 69.83]
  - - [2048, 4096, 1, 512, 2048, 2048, 2048, 512]
    - [11, 113.68]
  - - [2048, 4096, 1, 1024, 2048, 2048, 2048, 1024]
    - [1, 168.81]
  - - [2048, 4096, 1, 2048, 2048, 2048, 2048, 2048]
    - [4, 213.43]
  - - [2048, 4096, 1, 4096, 2048, 2048, 2048, 4096]
    - [54, 253.14]
  - - [2048, 4096, 1, 8192, 2048, 2048, 2048, 8192]
    - [54, 309.5]
  - - [2048, 8192, 1, 128, 2048, 2048, 2048, 128]
    - [51, 47.98]
  - - [2048, 8192, 1, 256, 2048, 2048, 2048, 256]
    - [57, 85.92]
  - - [2048, 8192, 1, 512, 2048, 2048, 2048, 512]
    - [52, 147.33]
  - - [2048, 8192, 1, 1024, 2048, 2048, 2048, 1024]
    - [56, 219.54]
  - - [2048, 8192, 1, 2048, 2048, 2048, 2048, 2048]
    - [52, 263.47]
  - - [2048, 8192, 1, 4096, 2048, 2048, 2048, 4096]
    - [52, 313.11]
  - - [2048, 8192, 1, 8192, 2048, 2048, 2048, 8192]
    - [52, 363.37]
  - - [4096, 128, 1, 128, 4096, 4096, 4096, 128]
    - [36, 13.41]
  - - [4096, 128, 1, 256, 4096, 4096, 4096, 256]
    - [37, 23.56]
  - - [4096, 128, 1, 512, 4096, 4096, 4096, 512]
    - [81, 39.0]
  - - [4096, 128, 1, 1024, 4096, 4096, 4096, 1024]
    - [79, 58.3]
  - - [4096, 128, 1, 2048, 4096, 4096, 4096, 2048]
    - [84, 74.11]
  - - [4096, 128, 1, 4096, 4096, 4096, 4096, 4096]
    - [86, 91.06]
  - - [4096, 128, 1, 8192, 4096, 4096, 4096, 8192]
    - [83, 101.89]
  - - [4096, 256, 1, 128, 4096, 4096, 4096, 128]
    - [32, 21.54]
  - - [4096, 256, 1, 256, 4096, 4096, 4096, 256]
    - [31, 38.15]
  - - [4096, 256, 1, 512, 4096, 4096, 4096, 512]
    - [28, 61.25]
  - - [4096, 256, 1, 1024, 4096, 4096, 4096, 1024]
    - [29, 87.67]
  - - [4096, 256, 1, 2048, 4096, 4096, 4096, 2048]
    - [77, 113.12]
  - - [4096, 256, 1, 4096, 4096, 4096, 4096, 4096]
    - [78, 135.83]
  - - [4096, 256, 1, 8192, 4096, 4096, 4096, 8192]
    - [77, 145.0]
  - - [4096, 512, 1, 128, 4096, 4096, 4096, 128]
    - [19, 29.97]
  - - [4096, 512, 1, 256, 4096, 4096, 4096, 256]
    - [21, 53.35]
  - - [4096, 512, 1, 512, 4096, 4096, 4096, 512]
    - [20, 84.44]
  - - [4096, 512, 1, 1024, 4096, 4096, 4096, 1024]
    - [70, 124.77]
  - - [4096, 512, 1, 2048, 4096, 4096, 4096, 2048]
    - [71, 162.57]
  - - [4096, 512, 1, 4096, 4096, 4096, 4096, 4096]
    - [70, 193.58]
  - - [4096, 512, 1, 8192, 4096, 4096, 4096, 8192]
    - [69, 196.02]
  - - [4096, 1024, 1, 128, 4096, 4096, 4096, 128]
    - [50, 35.71]
  - - [4096, 1024, 1, 256, 4096, 4096, 4096, 256]
    - [9, 64.56]
  - - [4096, 1024, 1, 512, 4096, 4096, 4096, 512]
    - [58, 105.14]
  - - [4096, 1024, 1, 1024, 4096, 4096, 4096, 1024]
    - [58, 157.53]
  - - [4096, 1024, 1, 2048, 4096, 4096, 4096, 2048]
    - [58, 207.43]
  - - [4096, 1024, 1, 4096, 4096, 4096, 4096, 4096]
    - [58, 234.64]
  - - [4096, 1024, 1, 8192, 4096, 4096, 4096, 8192]
    - [49, 235.06]
  - - [4096, 2048, 1, 128, 4096, 4096, 4096, 128]
    - [57, 37.41]
  - - [4096, 2048, 1, 256, 4096, 4096, 4096, 256]
    - [9, 67.56]
  - - [4096, 2048, 1, 512, 4096, 4096, 4096, 512]
    - [58, 111.29]
  - - [4096, 2048, 1, 1024, 4096, 4096, 4096, 1024]
    - [54, 166.17]
  - - [4096, 2048, 1, 2048, 4096, 4096, 4096, 2048]
    - [2, 211.25]
  - - [4096, 2048, 1, 4096, 4096, 4096, 4096, 4096]
    - [46, 256.88]
  - - [4096, 2048, 1, 8192, 4096, 4096, 4096, 8192]
    - [46, 282.15]
  - - [4096, 4096, 1, 128, 4096, 4096, 4096, 128]
    - [51, 41.42]
  - - [4096, 4096, 1, 256, 4096, 4096, 4096, 256]
    - [32, 72.8]
  - - [4096, 4096, 1, 512, 4096, 4096, 4096, 512]
    - [17, 120.38]
  - - [4096, 4096, 1, 1024, 4096, 4096, 4096, 1024]
    - [68, 169.06]
  - - [4096, 4096, 1, 2048, 4096, 4096, 4096, 2048]
    - [57, 227.3]
  - - [4096, 4096, 1, 4096, 4096, 4096, 4096, 4096]
    - [52, 281.95]
  - - [4096, 4096, 1, 8192, 4096, 4096, 4096, 8192]
    - [54, 322.2]
  - - [4096, 8192, 1, 128, 4096, 4096, 4096, 128]
    - [55, 48.54]
  - - [4096, 8192, 1, 256, 4096, 4096, 4096, 256]
    - [55, 84.71]
  - - [4096, 8192, 1, 512, 4096, 4096, 4096, 512]
    - [52, 139.9]
  - - [4096, 8192, 1, 1024, 4096, 4096, 4096, 1024]
    - [53, 195.43]
  - - [4096, 8192, 1, 2048, 4096, 4096, 4096, 2048]
    - [56, 251.14]
  - - [4096, 8192, 1, 4096, 4096, 4096, 4096, 4096]
    - [56, 314.71]
  - - [4096, 8192, 1, 8192, 4096, 4096, 4096, 8192]
    - [56, 369.46]
  - - [8192, 128, 1, 128, 8192, 8192, 8192, 128]
    - [32, 21.04]
  - - [8192, 128, 1, 256, 8192, 8192, 8192, 256]
    - [31, 37.46]
  - - [8192, 128, 1, 512, 8192, 8192, 8192, 512]
    - [25, 62.64]
  - - [8192, 128, 1, 1024, 8192, 8192, 8192, 1024]
    - [24, 92.91]
  - - [8192, 128, 1, 2048, 8192, 8192, 8192, 2048]
    - [77, 110.91]
  - - [8192, 128, 1, 4096, 8192, 8192, 8192, 4096]
    - [76, 134.09]
  - - [8192, 128, 1, 8192, 8192, 8192, 8192, 8192]
    - [77, 141.68]
  - - [8192, 256, 1, 128, 8192, 8192, 8192, 128]
    - [16, 29.98]
  - - [8192, 256, 1, 256, 8192, 8192, 8192, 256]
    - [17, 53.55]
  - - [8192, 256, 1, 512, 8192, 8192, 8192, 512]
    - [18, 85.67]
  - - [8192, 256, 1, 1024, 8192, 8192, 8192, 1024]
    - [69, 126.13]
  - - [8192, 256, 1, 2048, 8192, 8192, 8192, 2048]
    - [69, 160.72]
  - - [8192, 256, 1, 4096, 8192, 8192, 8192, 4096]
    - [71, 192.74]
  - - [8192, 256, 1, 8192, 8192, 8192, 8192, 8192]
    - [70, 190.64]
  - - [8192, 512, 1, 128, 8192, 8192, 8192, 128]
    - [13, 37.03]
  - - [8192, 512, 1, 256, 8192, 8192, 8192, 256]
    - [12, 66.84]
  - - [8192, 512, 1, 512, 8192, 8192, 8192, 512]
    - [8, 105.68]
  - - [8192, 512, 1, 1024, 8192, 8192, 8192, 1024]
    - [47, 155.16]
  - - [8192, 512, 1, 2048, 8192, 8192, 8192, 2048]
    - [47, 206.72]
  - - [8192, 512, 1, 4096, 8192, 8192, 8192, 4096]
    - [47, 237.27]
  - - [8192, 512, 1, 8192, 8192, 8192, 8192, 8192]
    - [49, 237.53]
  - - [8192, 1024, 1, 128, 8192, 8192, 8192, 128]
    - [5, 40.23]
  - - [8192, 1024, 1, 256, 8192, 8192, 8192, 256]
    - [6, 73.13]
  - - [8192, 1024, 1, 512, 8192, 8192, 8192, 512]
    - [8, 114.12]
  - - [8192, 1024, 1, 1024, 8192, 8192, 8192, 1024]
    - [3, 164.56]
  - - [8192, 1024, 1, 2048, 8192, 8192, 8192, 2048]
    - [10, 213.58]
  - - [8192, 1024, 1, 4096, 8192, 8192, 8192, 4096]
    - [46, 252.14]
  - - [8192, 1024, 1, 8192, 8192, 8192, 8192, 8192]
    - [46, 294.58]
  - - [8192, 2048, 1, 128, 8192, 8192, 8192, 128]
    - [57, 44.94]
  - - [8192, 2048, 1, 256, 8192, 8192, 8192, 256]
    - [51, 77.61]
  - - [8192, 2048, 1, 512, 8192, 8192, 8192, 512]
    - [54, 131.92]
  - - [8192, 2048, 1, 1024, 8192, 8192, 8192, 1024]
    - [54, 182.8]
  - - [8192, 2048, 1, 2048, 8192, 8192, 8192, 2048]
    - [58, 220.77]
  - - [8192, 2048, 1, 4096, 8192, 8192, 8192, 4096]
    - [3, 267.31]
  - - [8192, 2048, 1, 8192, 8192, 8192, 8192, 8192]
    - [0, 328.05]
  - - [8192, 4096, 1, 128, 8192, 8192, 8192, 128]
    - [33, 41.72]
  - - [8192, 4096, 1, 256, 8192, 8192, 8192, 256]
    - [22, 75.47]
  - - [8192, 4096, 1, 512, 8192, 8192, 8192, 512]
    - [5, 120.85]
  - - [8192, 4096, 1, 1024, 8192, 8192, 8192, 1024]
    - [53, 178.97]
  - - [8192, 4096, 1, 2048, 8192, 8192, 8192, 2048]
    - [48, 237.22]
  - - [8192, 4096, 1, 4096, 8192, 8192, 8192, 4096]
    - [52, 290.67]
  - - [8192, 4096, 1, 8192, 8192, 8192, 8192, 8192]
    - [52, 332.07]
  - - [8192, 8192, 1, 128, 8192, 8192, 8192, 128]
    - [55, 42.68]
  - - [8192, 8192, 1, 256, 8192, 8192, 8192, 256]
    - [55, 74.48]
  - - [8192, 8192, 1, 512, 8192, 8192, 8192, 512]
    - [55, 122.44]
  - - [8192, 8192, 1, 1024, 8192, 8192, 8192, 1024]
    - [51, 184.58]
  - - [8192, 8192, 1, 2048, 8192, 8192, 8192, 2048]
    - [52, 256.48]
  - - [8192, 8192, 1, 4096, 8192, 8192, 8192, 4096]
    - [52, 319.08]
  - - [8192, 8192, 1, 8192, 8192, 8192, 8192, 8192]
    - [56, 372.83]
- null
- null
- ExperimentalStreamK
- GridBased
