projects/hipblaslt/library/src/amd_detail/rocblaslt/src/Tensile/Logic/asm_full/aquavanjaram/gfx942_228cu/StreamK/aquavanjaram942_Cijk_Alik_Bljk_B8F8NHS_BH_Bias_HAS_SAV_UserArgs.yaml
- {MinimumRequiredVersion: 4.33.0}
- aquavanjaram942
- {Architecture: gfx942, CUCount: 228}
- [Device 0049, Device 0050]
    SolutionIndex: 0
    SolutionNameMin: Cijk_Alik_Bljk_B8F8NHS_BH_Bias_HAS_SAV_UserArgs_MT256x256x64_MI16x16x1_SN_LDSB1_CLR1_GRVWA8_GRVWB16_GSU0_GSUC0_GSUWGMRR0_K1_LBSPPA512_LBSPPB512_LPA8_LPB16_LRVW8_MIWT8_8_PLR1_SU0_SUM0_SUS64_VWA8_VWB8_WGM1_WGMXCC1_WGMXCCGn1
    SolutionIndex: 1
    SolutionNameMin: Cijk_Alik_Bljk_B8F8NHS_BH_Bias_HAS_SAV_UserArgs_MT256x256x64_MI16x16x1_SN_LDSB1_CLR1_GRVWA16_GRVWB16_GSU0_GSUC0_GSUWGMRR0_K1_LBSPPA512_LBSPPB512_LPA16_LPB16_LRVW8_MIWT8_8_PLR1_SU0_SUM0_SUS64_VWA8_VWB8_WGM1_WGMXCC1_WGMXCCGn1
    SolutionIndex: 2
    SolutionNameMin: Cijk_Alik_Bljk_B8F8NHS_BH_Bias_HAS_SAV_UserArgs_MT256x256x64_MI16x16x1_SN_LDSB1_CLR1_GRVWA8_GRVWB16_GSU0_GSUC0_GSUWGMRR0_K1_LBSPPA512_LBSPPB512_LPA8_LPB16_LRVW8_MIWT8_8_PLR1_SU0_SUM0_SUS64_VWA8_VWB8_WGM4_WGMXCC1_WGMXCCGn1
    SolutionIndex: 3
    SolutionNameMin: Cijk_Alik_Bljk_B8F8NHS_BH_Bias_HAS_SAV_UserArgs_MT256x256x64_MI16x16x1_SN_LDSB1_CLR1_GRVWA16_GRVWB16_GSU0_GSUC0_GSUWGMRR0_K1_LBSPPA512_LBSPPB512_LPA16_LPB16_LRVW8_MIWT8_8_PLR1_SU0_SUM0_SUS64_VWA8_VWB8_WGM4_WGMXCC1_WGMXCCGn1
    SolutionIndex: 4
    SolutionNameMin: Cijk_Alik_Bljk_B8F8NHS_BH_Bias_HAS_SAV_UserArgs_MT256x256x64_MI16x16x1_SN_LDSB1_CLR1_GRVWA8_GRVWB16_GSU0_GSUC0_GSUWGMRR0_K1_LBSPPA512_LBSPPB512_LPA8_LPB16_LRVW8_MIWT8_8_PLR1_SU0_SUM0_SUS64_VWA8_VWB8_WGM6_WGMXCC1_WGMXCCGn1
    SolutionIndex: 5
    SolutionNameMin: Cijk_Alik_Bljk_B8F8NHS_BH_Bias_HAS_SAV_UserArgs_MT256x256x64_MI16x16x1_SN_LDSB1_CLR1_GRVWA16_GRVWB16_GSU0_GSUC0_GSUWGMRR0_K1_LBSPPA512_LBSPPB512_LPA16_LPB16_LRVW8_MIWT8_8_PLR1_SU0_SUM0_SUS64_VWA8_VWB8_WGM6_WGMXCC1_WGMXCCGn1
    SolutionIndex: 6
    SolutionNameMin: Cijk_Alik_Bljk_B8F8NHS_BH_Bias_HAS_SAV_UserArgs_MT256x256x64_MI16x16x1_SN_LDSB1_CLR1_GRVWA8_GRVWB16_GSU0_GSUC0_GSUWGMRR0_K1_LBSPPA512_LBSPPB512_LPA8_LPB16_LRVW8_MIWT8_8_PLR1_SU0_SUM0_SUS64_VWA8_VWB8_WGM8_WGMXCC1_WGMXCCGn1
    SolutionIndex: 7
    SolutionNameMin: Cijk_Alik_Bljk_B8F8NHS_BH_Bias_HAS_SAV_UserArgs_MT256x256x64_MI16x16x1_SN_LDSB1_CLR1_GRVWA16_GRVWB16_GSU0_GSUC0_GSUWGMRR0_K1_LBSPPA512_LBSPPB512_LPA16_LPB16_LRVW8_MIWT8_8_PLR1_SU0_SUM0_SUS64_VWA8_VWB8_WGM8_WGMXCC1_WGMXCCGn1
    SolutionIndex: 8
    SolutionNameMin: Cijk_Alik_Bljk_B8F8NHS_BH_Bias_HAS_SAV_UserArgs_MT256x128x64_MI16x16x1_SN_LDSB1_CLR1_GRVWA16_GRVWB8_GSU0_GSUC0_GSUWGMRR0_K1_LBSPPA512_LBSPPB256_LPA16_LPB8_LRVW8_MIWT8_4_PLR1_SU0_SUM0_SUS64_VWA8_VWB4_WGM1_WGMXCC1_WGMXCCGn1
    SolutionIndex: 9
    SolutionNameMin: Cijk_Alik_Bljk_B8F8NHS_BH_Bias_HAS_SAV_UserArgs_MT256x128x64_MI16x16x1_SN_LDSB1_CLR1_GRVWA8_GRVWB16_GSU0_GSUC0_GSUWGMRR0_K1_LBSPPA512_LBSPPB256_LPA8_LPB16_LRVW8_MIWT8_4_PLR1_SU0_SUM0_SUS64_VWA8_VWB4_WGM1_WGMXCC1_WGMXCCGn1
    SolutionIndex: 10
    SolutionNameMin: Cijk_Alik_Bljk_B8F8NHS_BH_Bias_HAS_SAV_UserArgs_MT256x128x64_MI16x16x1_SN_LDSB1_CLR1_GRVWA16_GRVWB16_GSU0_GSUC0_GSUWGMRR0_K1_LBSPPA512_LBSPPB256_LPA16_LPB16_LRVW8_MIWT8_4_PLR1_SU0_SUM0_SUS64_VWA8_VWB4_WGM1_WGMXCC1_WGMXCCGn1
    SolutionIndex: 11
    SolutionNameMin: Cijk_Alik_Bljk_B8F8NHS_BH_Bias_HAS_SAV_UserArgs_MT256x128x64_MI16x16x1_SN_LDSB1_CLR1_GRVWA8_GRVWB16_GSU0_GSUC0_GSUWGMRR0_K1_LBSPPA512_LBSPPB256_LPA8_LPB16_LRVW8_MIWT8_4_PLR1_SU0_SUM0_SUS64_VWA8_VWB4_WGM6_WGMXCC1_WGMXCCGn1
    SolutionIndex: 12
    SolutionNameMin: Cijk_Alik_Bljk_B8F8NHS_BH_Bias_HAS_SAV_UserArgs_MT256x128x64_MI16x16x1_SN_LDSB1_CLR1_GRVWA8_GRVWB8_GSU0_GSUC0_GSUWGMRR0_K1_LBSPPA512_LBSPPB256_LPA8_LPB8_LRVW8_MIWT8_4_PLR1_SU0_SUM0_SUS64_VWA8_VWB4_WGM8_WGMXCC1_WGMXCCGn1
    SolutionIndex: 13
    SolutionNameMin: Cijk_Alik_Bljk_B8F8NHS_BH_Bias_HAS_SAV_UserArgs_MT256x128x64_MI16x16x1_SN_LDSB1_CLR1_GRVWA8_GRVWB16_GSU0_GSUC0_GSUWGMRR0_K1_LBSPPA512_LBSPPB256_LPA8_LPB16_LRVW8_MIWT8_4_PLR1_SU0_SUM0_SUS64_VWA8_VWB4_WGM8_WGMXCC1_WGMXCCGn1
    SolutionIndex: 14
    SolutionNameMin: Cijk_Alik_Bljk_B8F8NHS_BH_Bias_HAS_SAV_UserArgs_MT128x128x64_MI16x16x1_SN_LDSB1_CLR1_GRVWA8_GRVWB16_GSU0_GSUC0_GSUWGMRR0_K1_LBSPPA512_LBSPPB128_LPA8_LPB16_LRVW8_MIWT8_2_PLR1_SU0_SUM0_SUS64_VWA8_VWB2_WGM1_WGMXCC1_WGMXCCGn1
    SolutionIndex: 15
    SolutionNameMin: Cijk_Alik_Bljk_B8F8NHS_BH_Bias_HAS_SAV_UserArgs_MT128x128x64_MI16x16x1_SN_LDSB1_CLR1_GRVWA8_GRVWB16_GSU0_GSUC0_GSUWGMRR0_K1_LBSPPA512_LBSPPB128_LPA8_LPB16_LRVW8_MIWT8_2_PLR1_SU0_SUM0_SUS64_VWA8_VWB2_WGM4_WGMXCC1_WGMXCCGn1
    SolutionIndex: 16
    SolutionNameMin: Cijk_Alik_Bljk_B8F8NHS_BH_Bias_HAS_SAV_UserArgs_MT128x128x64_MI16x16x1_SN_LDSB1_CLR1_GRVWA8_GRVWB16_GSU0_GSUC0_GSUWGMRR0_K1_LBSPPA512_LBSPPB128_LPA8_LPB16_LRVW8_MIWT8_2_PLR1_SU0_SUM0_SUS64_VWA8_VWB2_WGM6_WGMXCC1_WGMXCCGn1
    SolutionIndex: 17
    SolutionNameMin: Cijk_Alik_Bljk_B8F8NHS_BH_Bias_HAS_SAV_UserArgs_MT256x32x64_MI16x16x1_SN_LDSB1_CLR1_GRVWA16_GRVWB8_GSU0_GSUC0_GSUWGMRR0_K1_LBSPPA512_LBSPPB128_LPA16_LPB8_LRVW8_MIWT8_1_PLR1_SU0_SUM0_SUS64_VWA8_VWB1_WGM4_WGMXCC1_WGMXCCGn1
    SolutionIndex: 18
    SolutionNameMin: Cijk_Alik_Bljk_B8F8NHS_BH_Bias_HAS_SAV_UserArgs_MT128x64x64_MI16x16x1_SN_LDSB0_CLR1_GRVWA8_GRVWB16_GSU0_GSUC0_GSUWGMRR0_K1_LBSPPA512_LBSPPB128_LPA8_LPB16_LRVW8_MIWT8_1_PLR1_SU0_SUM0_SUS64_VWA8_VWB1_WGM1_WGMXCC1_WGMXCCGn1
    SolutionIndex: 19
    SolutionNameMin: Cijk_Alik_Bljk_B8F8NHS_BH_Bias_HAS_SAV_UserArgs_MT128x64x64_MI16x16x1_SN_LDSB0_CLR1_GRVWA8_GRVWB16_GSU0_GSUC0_GSUWGMRR0_K1_LBSPPA512_LBSPPB128_LPA8_LPB16_LRVW8_MIWT8_1_PLR1_SU0_SUM0_SUS64_VWA8_VWB1_WGM4_WGMXCC1_WGMXCCGn1
    SolutionIndex: 20
    SolutionNameMin: Cijk_Alik_Bljk_B8F8NHS_BH_Bias_HAS_SAV_UserArgs_MT128x64x64_MI16x16x1_SN_LDSB0_CLR1_GRVWA8_GRVWB8_GSU0_GSUC0_GSUWGMRR0_K1_LBSPPA512_LBSPPB128_LPA8_LPB8_LRVW8_MIWT8_1_PLR1_SU0_SUM0_SUS64_VWA8_VWB1_WGM8_WGMXCC1_WGMXCCGn1
    SolutionIndex: 21
    SolutionNameMin: Cijk_Alik_Bljk_B8F8NHS_BH_Bias_HAS_SAV_UserArgs_MT128x128x64_MI16x16x1_SN_LDSB1_CLR1_GRVWA16_GRVWB8_GSU0_GSUC0_GSUWGMRR0_K1_LBSPPA256_LBSPPB256_LPA16_LPB8_LRVW8_MIWT4_4_PLR1_SU0_SUM0_SUS64_VWA4_VWB4_WGM1_WGMXCC1_WGMXCCGn1
    SolutionIndex: 22
    SolutionNameMin: Cijk_Alik_Bljk_B8F8NHS_BH_Bias_HAS_SAV_UserArgs_MT128x128x64_MI16x16x1_SN_LDSB1_CLR1_GRVWA16_GRVWB16_GSU0_GSUC0_GSUWGMRR0_K1_LBSPPA256_LBSPPB256_LPA16_LPB16_LRVW8_MIWT4_4_PLR1_SU0_SUM0_SUS64_VWA4_VWB4_WGM4_WGMXCC1_WGMXCCGn1
    SolutionIndex: 23
    SolutionNameMin: Cijk_Alik_Bljk_B8F8NHS_BH_Bias_HAS_SAV_UserArgs_MT128x128x64_MI16x16x1_SN_LDSB1_CLR1_GRVWA16_GRVWB8_GSU0_GSUC0_GSUWGMRR0_K1_LBSPPA256_LBSPPB256_LPA16_LPB8_LRVW8_MIWT4_4_PLR1_SU0_SUM0_SUS64_VWA4_VWB4_WGM6_WGMXCC1_WGMXCCGn1
    SolutionIndex: 24
    SolutionNameMin: Cijk_Alik_Bljk_B8F8NHS_BH_Bias_HAS_SAV_UserArgs_MT64x128x64_MI16x16x1_SN_LDSB0_CLR1_GRVWA8_GRVWB8_GSU0_GSUC0_GSUWGMRR0_K1_LBSPPA128_LBSPPB256_LPA8_LPB8_LRVW8_MIWT2_4_PLR1_SU0_SUM0_SUS64_VWA2_VWB4_WGM1_WGMXCC1_WGMXCCGn1
    SolutionIndex: 25
    SolutionNameMin: Cijk_Alik_Bljk_B8F8NHS_BH_Bias_HAS_SAV_UserArgs_MT64x128x64_MI16x16x1_SN_LDSB0_CLR1_GRVWA16_GRVWB8_GSU0_GSUC0_GSUWGMRR0_K1_LBSPPA128_LBSPPB256_LPA16_LPB8_LRVW8_MIWT2_4_PLR1_SU0_SUM0_SUS64_VWA2_VWB4_WGM1_WGMXCC1_WGMXCCGn1
    SolutionIndex: 26
    SolutionNameMin: Cijk_Alik_Bljk_B8F8NHS_BH_Bias_HAS_SAV_UserArgs_MT64x128x64_MI16x16x1_SN_LDSB0_CLR1_GRVWA8_GRVWB16_GSU0_GSUC0_GSUWGMRR0_K1_LBSPPA128_LBSPPB256_LPA8_LPB16_LRVW8_MIWT2_4_PLR1_SU0_SUM0_SUS64_VWA2_VWB4_WGM1_WGMXCC1_WGMXCCGn1
    SolutionIndex: 27
    SolutionNameMin: Cijk_Alik_Bljk_B8F8NHS_BH_Bias_HAS_SAV_UserArgs_MT64x128x64_MI16x16x1_SN_LDSB0_CLR1_GRVWA16_GRVWB16_GSU0_GSUC0_GSUWGMRR0_K1_LBSPPA128_LBSPPB256_LPA16_LPB16_LRVW8_MIWT2_4_PLR1_SU0_SUM0_SUS64_VWA2_VWB4_WGM1_WGMXCC1_WGMXCCGn1
    SolutionIndex: 28
    SolutionNameMin: Cijk_Alik_Bljk_B8F8NHS_BH_Bias_HAS_SAV_UserArgs_MT64x128x64_MI16x16x1_SN_LDSB0_CLR1_GRVWA8_GRVWB8_GSU0_GSUC0_GSUWGMRR0_K1_LBSPPA128_LBSPPB256_LPA8_LPB8_LRVW8_MIWT2_4_PLR1_SU0_SUM0_SUS64_VWA2_VWB4_WGM6_WGMXCC1_WGMXCCGn1
    SolutionIndex: 29
    SolutionNameMin: Cijk_Alik_Bljk_B8F8NHS_BH_Bias_HAS_SAV_UserArgs_MT128x64x64_MI16x16x1_SN_LDSB0_CLR1_GRVWA8_GRVWB16_GSU0_GSUC0_GSUWGMRR0_K1_LBSPPA256_LBSPPB128_LPA8_LPB16_LRVW8_MIWT4_2_PLR1_SU0_SUM0_SUS64_VWA4_VWB2_WGM1_WGMXCC1_WGMXCCGn1
    SolutionIndex: 30
    SolutionNameMin: Cijk_Alik_Bljk_B8F8NHS_BH_Bias_HAS_SAV_UserArgs_MT128x64x64_MI16x16x1_SN_LDSB0_CLR1_GRVWA16_GRVWB16_GSU0_GSUC0_GSUWGMRR0_K1_LBSPPA256_LBSPPB128_LPA16_LPB16_LRVW8_MIWT4_2_PLR1_SU0_SUM0_SUS64_VWA4_VWB2_WGM1_WGMXCC1_WGMXCCGn1
    SolutionIndex: 31
    SolutionNameMin: Cijk_Alik_Bljk_B8F8NHS_BH_Bias_HAS_SAV_UserArgs_MT128x64x64_MI16x16x1_SN_LDSB0_CLR1_GRVWA8_GRVWB16_GSU0_GSUC0_GSUWGMRR0_K1_LBSPPA256_LBSPPB128_LPA8_LPB16_LRVW8_MIWT4_2_PLR1_SU0_SUM0_SUS64_VWA4_VWB2_WGM4_WGMXCC1_WGMXCCGn1
    SolutionIndex: 32
    SolutionNameMin: Cijk_Alik_Bljk_B8F8NHS_BH_Bias_HAS_SAV_UserArgs_MT128x64x64_MI16x16x1_SN_LDSB0_CLR1_GRVWA8_GRVWB16_GSU0_GSUC0_GSUWGMRR0_K1_LBSPPA256_LBSPPB128_LPA8_LPB16_LRVW8_MIWT4_2_PLR1_SU0_SUM0_SUS64_VWA4_VWB2_WGM6_WGMXCC1_WGMXCCGn1
    SolutionIndex: 33
    SolutionNameMin: Cijk_Alik_Bljk_B8F8NHS_BH_Bias_HAS_SAV_UserArgs_MT128x64x64_MI16x16x1_SN_LDSB0_CLR1_GRVWA8_GRVWB8_GSU0_GSUC0_GSUWGMRR0_K1_LBSPPA256_LBSPPB128_LPA8_LPB8_LRVW8_MIWT4_2_PLR1_SU0_SUM0_SUS64_VWA4_VWB2_WGM8_WGMXCC1_WGMXCCGn1
    SolutionIndex: 34
    SolutionNameMin: Cijk_Alik_Bljk_B8F8NHS_BH_Bias_HAS_SAV_UserArgs_MT128x64x64_MI16x16x1_SN_LDSB0_CLR1_GRVWA8_GRVWB16_GSU0_GSUC0_GSUWGMRR0_K1_LBSPPA256_LBSPPB128_LPA8_LPB16_LRVW8_MIWT4_2_PLR1_SU0_SUM0_SUS64_VWA4_VWB2_WGM8_WGMXCC1_WGMXCCGn1
    SolutionIndex: 35
    SolutionNameMin: Cijk_Alik_Bljk_B8F8NHS_BH_Bias_HAS_SAV_UserArgs_MT64x64x64_MI16x16x1_SN_LDSB0_CLR1_GRVWA8_GRVWB8_GSU0_GSUC0_GSUWGMRR0_K1_LBSPPA128_LBSPPB128_LPA8_LPB8_LRVW8_MIWT2_2_PLR1_SU0_SUM0_SUS64_VWA2_VWB2_WGM1_WGMXCC1_WGMXCCGn1
    SolutionIndex: 36
    SolutionNameMin: Cijk_Alik_Bljk_B8F8NHS_BH_Bias_HAS_SAV_UserArgs_MT64x64x64_MI16x16x1_SN_LDSB0_CLR1_GRVWA16_GRVWB8_GSU0_GSUC0_GSUWGMRR0_K1_LBSPPA128_LBSPPB128_LPA16_LPB8_LRVW8_MIWT2_2_PLR1_SU0_SUM0_SUS64_VWA2_VWB2_WGM1_WGMXCC1_WGMXCCGn1
    SolutionIndex: 37
    SolutionNameMin: Cijk_Alik_Bljk_B8F8NHS_BH_Bias_HAS_SAV_UserArgs_MT64x64x64_MI16x16x1_SN_LDSB0_CLR1_GRVWA8_GRVWB16_GSU0_GSUC0_GSUWGMRR0_K1_LBSPPA128_LBSPPB128_LPA8_LPB16_LRVW8_MIWT2_2_PLR1_SU0_SUM0_SUS64_VWA2_VWB2_WGM1_WGMXCC1_WGMXCCGn1
    SolutionIndex: 38
    SolutionNameMin: Cijk_Alik_Bljk_B8F8NHS_BH_Bias_HAS_SAV_UserArgs_MT64x64x64_MI16x16x1_SN_LDSB0_CLR1_GRVWA16_GRVWB16_GSU0_GSUC0_GSUWGMRR0_K1_LBSPPA128_LBSPPB128_LPA16_LPB16_LRVW8_MIWT2_2_PLR1_SU0_SUM0_SUS64_VWA2_VWB2_WGM1_WGMXCC1_WGMXCCGn1
    SolutionIndex: 39
    SolutionNameMin: Cijk_Alik_Bljk_B8F8NHS_BH_Bias_HAS_SAV_UserArgs_MT64x64x64_MI16x16x1_SN_LDSB0_CLR1_GRVWA8_GRVWB8_GSU0_GSUC0_GSUWGMRR0_K1_LBSPPA128_LBSPPB128_LPA8_LPB8_LRVW8_MIWT2_2_PLR1_SU0_SUM0_SUS64_VWA2_VWB2_WGM4_WGMXCC1_WGMXCCGn1
    SolutionIndex: 40
    SolutionNameMin: Cijk_Alik_Bljk_B8F8NHS_BH_Bias_HAS_SAV_UserArgs_MT64x64x64_MI16x16x1_SN_LDSB0_CLR1_GRVWA8_GRVWB8_GSU0_GSUC0_GSUWGMRR0_K1_LBSPPA128_LBSPPB128_LPA8_LPB8_LRVW8_MIWT2_2_PLR1_SU0_SUM0_SUS64_VWA2_VWB2_WGM6_WGMXCC1_WGMXCCGn1
    SolutionIndex: 41
    SolutionNameMin: Cijk_Alik_Bljk_B8F8NHS_BH_Bias_HAS_SAV_UserArgs_MT64x64x64_MI16x16x1_SN_LDSB0_CLR1_GRVWA16_GRVWB8_GSU0_GSUC0_GSUWGMRR0_K1_LBSPPA128_LBSPPB128_LPA16_LPB8_LRVW8_MIWT2_2_PLR1_SU0_SUM0_SUS64_VWA2_VWB2_WGM8_WGMXCC1_WGMXCCGn1
    SolutionIndex: 42
    SolutionNameMin: Cijk_Alik_Bljk_B8F8NHS_BH_Bias_HAS_SAV_UserArgs_MT32x64x64_MI16x16x1_SN_LDSB0_CLR1_GRVWA8_GRVWB8_GSU0_GSUC0_GSUWGMRR0_K1_LBSPPA128_LBSPPB128_LPA8_LPB8_LRVW8_MIWT1_2_PLR1_SU0_SUM0_SUS64_VWA1_VWB2_WGM4_WGMXCC1_WGMXCCGn1
    SolutionIndex: 43
    SolutionNameMin: Cijk_Alik_Bljk_B8F8NHS_BH_Bias_HAS_SAV_UserArgs_MT64x32x64_MI16x16x1_SN_LDSB0_CLR1_GRVWA8_GRVWB8_GSU0_GSUC0_GSUWGMRR0_K1_LBSPPA128_LBSPPB128_LPA8_LPB8_LRVW8_MIWT2_1_PLR1_SU0_SUM0_SUS64_VWA2_VWB1_WGM1_WGMXCC1_WGMXCCGn1
    SolutionIndex: 44
    SolutionNameMin: Cijk_Alik_Bljk_B8F8NHS_BH_Bias_HAS_SAV_UserArgs_MT64x32x64_MI16x16x1_SN_LDSB0_CLR1_GRVWA16_GRVWB8_GSU0_GSUC0_GSUWGMRR0_K1_LBSPPA128_LBSPPB128_LPA16_LPB8_LRVW8_MIWT2_1_PLR1_SU0_SUM0_SUS64_VWA2_VWB1_WGM1_WGMXCC1_WGMXCCGn1
    SolutionIndex: 45
    SolutionNameMin: Cijk_Alik_Bljk_B8F8NHS_BH_Bias_HAS_SAV_UserArgs_MT64x32x64_MI16x16x1_SN_LDSB0_CLR1_GRVWA16_GRVWB8_GSU0_GSUC0_GSUWGMRR0_K1_LBSPPA128_LBSPPB128_LPA16_LPB8_LRVW8_MIWT2_1_PLR1_SU0_SUM0_SUS64_VWA2_VWB1_WGM6_WGMXCC1_WGMXCCGn1
    SolutionIndex: 46
    SolutionNameMin: Cijk_Alik_Bljk_B8F8NHS_BH_Bias_HAS_SAV_UserArgs_MT32x32x64_MI16x16x1_SN_LDSB0_CLR1_GRVWA8_GRVWB8_GSU0_GSUC0_GSUWGMRR0_K1_LBSPPA128_LBSPPB128_LPA8_LPB8_LRVW8_MIWT1_1_PLR1_SU0_SUM0_SUS64_VWA1_VWB1_WGM1_WGMXCC1_WGMXCCGn1
    SolutionIndex: 47
    SolutionNameMin: Cijk_Alik_Bljk_B8F8NHS_BH_Bias_HAS_SAV_UserArgs_MT256x144x128_MI16x16x1_SN_LDSB1_CLR1_GRVWA8_GRVWB8_GSU0_GSUC0_GSUWGMRR0_K1_LBSPPA512_LBSPPB128_LPA8_LPB8_LRVW8_MIWT4_9_PLR1_SU0_SUM0_SUS128_VWA4_VWB1_WGM1_WGMXCC1_WGMXCCGn1
    SolutionIndex: 48
    SolutionNameMin: Cijk_Alik_Bljk_B8F8NHS_BH_Bias_HAS_SAV_UserArgs_MT256x144x128_MI16x16x1_SN_LDSB1_CLR1_GRVWA16_GRVWB8_GSU0_GSUC0_GSUWGMRR0_K1_LBSPPA512_LBSPPB128_LPA16_LPB8_LRVW8_MIWT4_9_PLR1_SU0_SUM0_SUS128_VWA4_VWB1_WGM1_WGMXCC1_WGMXCCGn1
    SolutionIndex: 49
    SolutionNameMin: Cijk_Alik_Bljk_B8F8NHS_BH_Bias_HAS_SAV_UserArgs_MT256x144x128_MI16x16x1_SN_LDSB1_CLR1_GRVWA8_GRVWB8_GSU0_GSUC0_GSUWGMRR0_K1_LBSPPA512_LBSPPB128_LPA8_LPB8_LRVW8_MIWT4_9_PLR1_SU0_SUM0_SUS128_VWA4_VWB1_WGM4_WGMXCC1_WGMXCCGn1
    SolutionIndex: 50
    SolutionNameMin: Cijk_Alik_Bljk_B8F8NHS_BH_Bias_HAS_SAV_UserArgs_MT256x144x128_MI16x16x1_SN_LDSB1_CLR1_GRVWA16_GRVWB8_GSU0_GSUC0_GSUWGMRR0_K1_LBSPPA512_LBSPPB128_LPA16_LPB8_LRVW8_MIWT4_9_PLR1_SU0_SUM0_SUS128_VWA4_VWB1_WGM4_WGMXCC1_WGMXCCGn1
    SolutionIndex: 51
    SolutionNameMin: Cijk_Alik_Bljk_B8F8NHS_BH_Bias_HAS_SAV_UserArgs_MT256x144x128_MI16x16x1_SN_LDSB1_CLR1_GRVWA8_GRVWB8_GSU0_GSUC0_GSUWGMRR0_K1_LBSPPA512_LBSPPB128_LPA8_LPB8_LRVW8_MIWT4_9_PLR1_SU0_SUM0_SUS128_VWA4_VWB1_WGM6_WGMXCC1_WGMXCCGn1
    SolutionIndex: 52
    SolutionNameMin: Cijk_Alik_Bljk_B8F8NHS_BH_Bias_HAS_SAV_UserArgs_MT256x144x128_MI16x16x1_SN_LDSB1_CLR1_GRVWA16_GRVWB8_GSU0_GSUC0_GSUWGMRR0_K1_LBSPPA512_LBSPPB128_LPA16_LPB8_LRVW8_MIWT4_9_PLR1_SU0_SUM0_SUS128_VWA4_VWB1_WGM6_WGMXCC1_WGMXCCGn1
    SolutionIndex: 53
    SolutionNameMin: Cijk_Alik_Bljk_B8F8NHS_BH_Bias_HAS_SAV_UserArgs_MT256x144x128_MI16x16x1_SN_LDSB1_CLR1_GRVWA8_GRVWB8_GSU0_GSUC0_GSUWGMRR0_K1_LBSPPA512_LBSPPB128_LPA8_LPB8_LRVW8_MIWT4_9_PLR1_SU0_SUM0_SUS128_VWA4_VWB1_WGM8_WGMXCC1_WGMXCCGn1
    SolutionIndex: 54
    SolutionNameMin: Cijk_Alik_Bljk_B8F8NHS_BH_Bias_HAS_SAV_UserArgs_MT256x144x128_MI16x16x1_SN_LDSB1_CLR1_GRVWA16_GRVWB8_GSU0_GSUC0_GSUWGMRR0_K1_LBSPPA512_LBSPPB128_LPA16_LPB8_LRVW8_MIWT4_9_PLR1_SU0_SUM0_SUS128_VWA4_VWB1_WGM8_WGMXCC1_WGMXCCGn1
    SolutionIndex: 55
    SolutionNameMin: Cijk_Alik_Bljk_B8F8NHS_BH_Bias_HAS_SAV_UserArgs_MT256x128x128_MI16x16x1_SN_LDSB1_CLR1_GRVWA8_GRVWB16_GSU0_GSUC0_GSUWGMRR0_K1_LBSPPA1024_LBSPPB512_LPA8_LPB16_LRVW8_MIWT8_4_PLR1_SU0_SUM0_SUS128_VWA8_VWB4_WGM1_WGMXCC1_WGMXCCGn1
    SolutionIndex: 56
    SolutionNameMin: Cijk_Alik_Bljk_B8F8NHS_BH_Bias_HAS_SAV_UserArgs_MT256x128x128_MI16x16x1_SN_LDSB1_CLR1_GRVWA8_GRVWB16_GSU0_GSUC0_GSUWGMRR0_K1_LBSPPA1024_LBSPPB512_LPA8_LPB16_LRVW8_MIWT8_4_PLR1_SU0_SUM0_SUS128_VWA8_VWB4_WGM4_WGMXCC1_WGMXCCGn1
    SolutionIndex: 57
    SolutionNameMin: Cijk_Alik_Bljk_B8F8NHS_BH_Bias_HAS_SAV_UserArgs_MT256x128x128_MI16x16x1_SN_LDSB1_CLR1_GRVWA8_GRVWB16_GSU0_GSUC0_GSUWGMRR0_K1_LBSPPA1024_LBSPPB512_LPA8_LPB16_LRVW8_MIWT8_4_PLR1_SU0_SUM0_SUS128_VWA8_VWB4_WGM6_WGMXCC1_WGMXCCGn1
    SolutionIndex: 58
    SolutionNameMin: Cijk_Alik_Bljk_B8F8NHS_BH_Bias_HAS_SAV_UserArgs_MT256x128x128_MI16x16x1_SN_LDSB1_CLR1_GRVWA8_GRVWB16_GSU0_GSUC0_GSUWGMRR0_K1_LBSPPA1024_LBSPPB512_LPA8_LPB16_LRVW8_MIWT8_4_PLR1_SU0_SUM0_SUS128_VWA8_VWB4_WGM8_WGMXCC1_WGMXCCGn1
    SolutionIndex: 59
    SolutionNameMin: Cijk_Alik_Bljk_B8F8NHS_BH_Bias_HAS_SAV_UserArgs_MT144x256x128_MI16x16x1_SN_LDSB1_CLR1_GRVWA8_GRVWB16_GSU0_GSUC0_GSUWGMRR0_K1_LBSPPA128_LBSPPB512_LPA8_LPB16_LRVW8_MIWT9_4_PLR1_SU0_SUM0_SUS128_VWA1_VWB4_WGM1_WGMXCC1_WGMXCCGn1
    SolutionIndex: 60
    SolutionNameMin: Cijk_Alik_Bljk_B8F8NHS_BH_Bias_HAS_SAV_UserArgs_MT144x256x128_MI16x16x1_SN_LDSB1_CLR1_GRVWA8_GRVWB16_GSU0_GSUC0_GSUWGMRR0_K1_LBSPPA128_LBSPPB512_LPA8_LPB16_LRVW8_MIWT9_4_PLR1_SU0_SUM0_SUS128_VWA1_VWB4_WGM4_WGMXCC1_WGMXCCGn1
    SolutionIndex: 61
    SolutionNameMin: Cijk_Alik_Bljk_B8F8NHS_BH_Bias_HAS_SAV_UserArgs_MT144x256x128_MI16x16x1_SN_LDSB1_CLR1_GRVWA8_GRVWB16_GSU0_GSUC0_GSUWGMRR0_K1_LBSPPA128_LBSPPB512_LPA8_LPB16_LRVW8_MIWT9_4_PLR1_SU0_SUM0_SUS128_VWA1_VWB4_WGM6_WGMXCC1_WGMXCCGn1
    SolutionIndex: 62
    SolutionNameMin: Cijk_Alik_Bljk_B8F8NHS_BH_Bias_HAS_SAV_UserArgs_MT144x256x128_MI16x16x1_SN_LDSB1_CLR1_GRVWA8_GRVWB16_GSU0_GSUC0_GSUWGMRR0_K1_LBSPPA128_LBSPPB512_LPA8_LPB16_LRVW8_MIWT9_4_PLR1_SU0_SUM0_SUS128_VWA1_VWB4_WGM8_WGMXCC1_WGMXCCGn1
    SolutionIndex: 63
    SolutionNameMin: Cijk_Alik_Bljk_B8F8NHS_BH_Bias_HAS_SAV_UserArgs_MT128x128x128_MI16x16x1_SN_LDSB1_CLR1_GRVWA8_GRVWB16_GSU0_GSUC0_GSUWGMRR0_K1_LBSPPA1024_LBSPPB256_LPA8_LPB16_LRVW8_MIWT8_2_PLR1_SU0_SUM0_SUS128_VWA8_VWB2_WGM1_WGMXCC1_WGMXCCGn1
    SolutionIndex: 64
    SolutionNameMin: Cijk_Alik_Bljk_B8F8NHS_BH_Bias_HAS_SAV_UserArgs_MT128x128x128_MI16x16x1_SN_LDSB1_CLR1_GRVWA8_GRVWB16_GSU0_GSUC0_GSUWGMRR0_K1_LBSPPA1024_LBSPPB256_LPA8_LPB16_LRVW8_MIWT8_2_PLR1_SU0_SUM0_SUS128_VWA8_VWB2_WGM4_WGMXCC1_WGMXCCGn1
    SolutionIndex: 65
    SolutionNameMin: Cijk_Alik_Bljk_B8F8NHS_BH_Bias_HAS_SAV_UserArgs_MT128x128x128_MI16x16x1_SN_LDSB1_CLR1_GRVWA8_GRVWB16_GSU0_GSUC0_GSUWGMRR0_K1_LBSPPA1024_LBSPPB256_LPA8_LPB16_LRVW8_MIWT8_2_PLR1_SU0_SUM0_SUS128_VWA8_VWB2_WGM6_WGMXCC1_WGMXCCGn1
    SolutionIndex: 66
    SolutionNameMin: Cijk_Alik_Bljk_B8F8NHS_BH_Bias_HAS_SAV_UserArgs_MT128x128x128_MI16x16x1_SN_LDSB1_CLR1_GRVWA8_GRVWB16_GSU0_GSUC0_GSUWGMRR0_K1_LBSPPA1024_LBSPPB256_LPA8_LPB16_LRVW8_MIWT8_2_PLR1_SU0_SUM0_SUS128_VWA8_VWB2_WGM8_WGMXCC1_WGMXCCGn1
    SolutionIndex: 67
    SolutionNameMin: Cijk_Alik_Bljk_B8F8NHS_BH_Bias_HAS_SAV_UserArgs_MT32x256x128_MI16x16x1_SN_LDSB1_CLR1_GRVWA16_GRVWB16_GSU0_GSUC0_GSUWGMRR0_K1_LBSPPA128_LBSPPB1024_LPA16_LPB16_LRVW8_MIWT1_8_PLR1_SU0_SUM0_SUS128_VWA1_VWB8_WGM4_WGMXCC1_WGMXCCGn1
    SolutionIndex: 68
    SolutionNameMin: Cijk_Alik_Bljk_B8F8NHS_BH_Bias_HAS_SAV_UserArgs_MT128x144x128_MI16x16x1_SN_LDSB1_CLR1_GRVWA16_GRVWB8_GSU0_GSUC0_GSUWGMRR0_K1_LBSPPA256_LBSPPB128_LPA16_LPB8_LRVW8_MIWT2_9_PLR1_SU0_SUM0_SUS128_VWA2_VWB1_WGM1_WGMXCC1_WGMXCCGn1
    SolutionIndex: 69
    SolutionNameMin: Cijk_Alik_Bljk_B8F8NHS_BH_Bias_HAS_SAV_UserArgs_MT128x64x128_MI16x16x1_SN_LDSB1_CLR1_GRVWA16_GRVWB8_GSU0_GSUC0_GSUWGMRR0_K1_LBSPPA1024_LBSPPB128_LPA16_LPB8_LRVW8_MIWT8_1_PLR1_SU0_SUM0_SUS128_VWA8_VWB1_WGM4_WGMXCC1_WGMXCCGn1
    SolutionIndex: 70
    SolutionNameMin: Cijk_Alik_Bljk_B8F8NHS_BH_Bias_HAS_SAV_UserArgs_MT144x128x128_MI16x16x1_SN_LDSB1_CLR1_GRVWA8_GRVWB16_GSU0_GSUC0_GSUWGMRR0_K1_LBSPPA128_LBSPPB256_LPA8_LPB16_LRVW8_MIWT9_2_PLR1_SU0_SUM0_SUS128_VWA1_VWB2_WGM4_WGMXCC1_WGMXCCGn1
    SolutionIndex: 71
    SolutionNameMin: Cijk_Alik_Bljk_B8F8NHS_BH_Bias_HAS_SAV_UserArgs_MT144x128x128_MI16x16x1_SN_LDSB1_CLR1_GRVWA8_GRVWB16_GSU0_GSUC0_GSUWGMRR0_K1_LBSPPA128_LBSPPB256_LPA8_LPB16_LRVW8_MIWT9_2_PLR1_SU0_SUM0_SUS128_VWA1_VWB2_WGM6_WGMXCC1_WGMXCCGn1
    SolutionIndex: 72
    SolutionNameMin: Cijk_Alik_Bljk_B8F8NHS_BH_Bias_HAS_SAV_UserArgs_MT128x128x128_MI16x16x1_SN_LDSB1_CLR1_GRVWA8_GRVWB16_GSU0_GSUC0_GSUWGMRR0_K1_LBSPPA512_LBSPPB512_LPA8_LPB16_LRVW8_MIWT4_4_PLR1_SU0_SUM0_SUS128_VWA4_VWB4_WGM1_WGMXCC1_WGMXCCGn1
    SolutionIndex: 73
    SolutionNameMin: Cijk_Alik_Bljk_B8F8NHS_BH_Bias_HAS_SAV_UserArgs_MT128x128x128_MI16x16x1_SN_LDSB1_CLR1_GRVWA16_GRVWB16_GSU0_GSUC0_GSUWGMRR0_K1_LBSPPA512_LBSPPB512_LPA16_LPB16_LRVW8_MIWT4_4_PLR1_SU0_SUM0_SUS128_VWA4_VWB4_WGM1_WGMXCC1_WGMXCCGn1
    SolutionIndex: 74
    SolutionNameMin: Cijk_Alik_Bljk_B8F8NHS_BH_Bias_HAS_SAV_UserArgs_MT128x128x128_MI16x16x1_SN_LDSB1_CLR1_GRVWA8_GRVWB16_GSU0_GSUC0_GSUWGMRR0_K1_LBSPPA512_LBSPPB512_LPA8_LPB16_LRVW8_MIWT4_4_PLR1_SU0_SUM0_SUS128_VWA4_VWB4_WGM4_WGMXCC1_WGMXCCGn1
    SolutionIndex: 75
    SolutionNameMin: Cijk_Alik_Bljk_B8F8NHS_BH_Bias_HAS_SAV_UserArgs_MT128x128x128_MI16x16x1_SN_LDSB1_CLR1_GRVWA8_GRVWB16_GSU0_GSUC0_GSUWGMRR0_K1_LBSPPA512_LBSPPB512_LPA8_LPB16_LRVW8_MIWT4_4_PLR1_SU0_SUM0_SUS128_VWA4_VWB4_WGM6_WGMXCC1_WGMXCCGn1
    SolutionIndex: 76
    SolutionNameMin: Cijk_Alik_Bljk_B8F8NHS_BH_Bias_HAS_SAV_UserArgs_MT128x128x128_MI16x16x1_SN_LDSB1_CLR1_GRVWA16_GRVWB16_GSU0_GSUC0_GSUWGMRR0_K1_LBSPPA512_LBSPPB512_LPA16_LPB16_LRVW8_MIWT4_4_PLR1_SU0_SUM0_SUS128_VWA4_VWB4_WGM6_WGMXCC1_WGMXCCGn1
    SolutionIndex: 77
    SolutionNameMin: Cijk_Alik_Bljk_B8F8NHS_BH_Bias_HAS_SAV_UserArgs_MT128x128x128_MI16x16x1_SN_LDSB1_CLR1_GRVWA16_GRVWB16_GSU0_GSUC0_GSUWGMRR0_K1_LBSPPA512_LBSPPB512_LPA16_LPB16_LRVW8_MIWT4_4_PLR1_SU0_SUM0_SUS128_VWA4_VWB4_WGM8_WGMXCC1_WGMXCCGn1
    SolutionIndex: 78
    SolutionNameMin: Cijk_Alik_Bljk_B8F8NHS_BH_Bias_HAS_SAV_UserArgs_MT64x128x128_MI16x16x1_SN_LDSB1_CLR1_GRVWA8_GRVWB16_GSU0_GSUC0_GSUWGMRR0_K1_LBSPPA256_LBSPPB512_LPA8_LPB16_LRVW8_MIWT2_4_PLR1_SU0_SUM0_SUS128_VWA2_VWB4_WGM1_WGMXCC1_WGMXCCGn1
    SolutionIndex: 79
    SolutionNameMin: Cijk_Alik_Bljk_B8F8NHS_BH_Bias_HAS_SAV_UserArgs_MT64x128x128_MI16x16x1_SN_LDSB1_CLR1_GRVWA8_GRVWB8_GSU0_GSUC0_GSUWGMRR0_K1_LBSPPA256_LBSPPB512_LPA8_LPB8_LRVW8_MIWT2_4_PLR1_SU0_SUM0_SUS128_VWA2_VWB4_WGM4_WGMXCC1_WGMXCCGn1
    SolutionIndex: 80
    SolutionNameMin: Cijk_Alik_Bljk_B8F8NHS_BH_Bias_HAS_SAV_UserArgs_MT64x128x128_MI16x16x1_SN_LDSB1_CLR1_GRVWA8_GRVWB16_GSU0_GSUC0_GSUWGMRR0_K1_LBSPPA256_LBSPPB512_LPA8_LPB16_LRVW8_MIWT2_4_PLR1_SU0_SUM0_SUS128_VWA2_VWB4_WGM6_WGMXCC1_WGMXCCGn1
    SolutionIndex: 81
    SolutionNameMin: Cijk_Alik_Bljk_B8F8NHS_BH_Bias_HAS_SAV_UserArgs_MT64x128x128_MI16x16x1_SN_LDSB1_CLR1_GRVWA8_GRVWB16_GSU0_GSUC0_GSUWGMRR0_K1_LBSPPA256_LBSPPB512_LPA8_LPB16_LRVW8_MIWT2_4_PLR1_SU0_SUM0_SUS128_VWA2_VWB4_WGM8_WGMXCC1_WGMXCCGn1
    SolutionIndex: 82
    SolutionNameMin: Cijk_Alik_Bljk_B8F8NHS_BH_Bias_HAS_SAV_UserArgs_MT128x64x128_MI16x16x1_SN_LDSB1_CLR1_GRVWA8_GRVWB8_GSU0_GSUC0_GSUWGMRR0_K1_LBSPPA512_LBSPPB256_LPA8_LPB8_LRVW8_MIWT4_2_PLR1_SU0_SUM0_SUS128_VWA4_VWB2_WGM4_WGMXCC1_WGMXCCGn1
    SolutionIndex: 83
    SolutionNameMin: Cijk_Alik_Bljk_B8F8NHS_BH_Bias_HAS_SAV_UserArgs_MT128x64x128_MI16x16x1_SN_LDSB1_CLR1_GRVWA16_GRVWB16_GSU0_GSUC0_GSUWGMRR0_K1_LBSPPA512_LBSPPB256_LPA16_LPB16_LRVW8_MIWT4_2_PLR1_SU0_SUM0_SUS128_VWA4_VWB2_WGM4_WGMXCC1_WGMXCCGn1
    SolutionIndex: 84
    SolutionNameMin: Cijk_Alik_Bljk_B8F8NHS_BH_Bias_HAS_SAV_UserArgs_MT128x64x128_MI16x16x1_SN_LDSB1_CLR1_GRVWA16_GRVWB16_GSU0_GSUC0_GSUWGMRR0_K1_LBSPPA512_LBSPPB256_LPA16_LPB16_LRVW8_MIWT4_2_PLR1_SU0_SUM0_SUS128_VWA4_VWB2_WGM6_WGMXCC1_WGMXCCGn1
    SolutionIndex: 85
    SolutionNameMin: Cijk_Alik_Bljk_B8F8NHS_BH_Bias_HAS_SAV_UserArgs_MT128x32x128_MI16x16x1_SN_LDSB1_CLR1_GRVWA16_GRVWB16_GSU0_GSUC0_GSUWGMRR0_K1_LBSPPA512_LBSPPB128_LPA16_LPB16_LRVW8_MIWT4_1_PLR1_SU0_SUM0_SUS128_VWA4_VWB1_WGM1_WGMXCC1_WGMXCCGn1
    SolutionIndex: 86
    SolutionNameMin: Cijk_Alik_Bljk_B8F8NHS_BH_Bias_HAS_SAV_UserArgs_MT128x32x128_MI16x16x1_SN_LDSB1_CLR1_GRVWA8_GRVWB16_GSU0_GSUC0_GSUWGMRR0_K1_LBSPPA512_LBSPPB128_LPA8_LPB16_LRVW8_MIWT4_1_PLR1_SU0_SUM0_SUS128_VWA4_VWB1_WGM6_WGMXCC1_WGMXCCGn1
    SolutionIndex: 87
    SolutionNameMin: Cijk_Alik_Bljk_B8F8NHS_BH_Bias_HAS_SAV_UserArgs_MT64x64x128_MI16x16x1_SN_LDSB1_CLR1_GRVWA16_GRVWB8_GSU0_GSUC0_GSUWGMRR0_K1_LBSPPA256_LBSPPB256_LPA16_LPB8_LRVW8_MIWT2_2_PLR1_SU0_SUM0_SUS128_VWA2_VWB2_WGM1_WGMXCC1_WGMXCCGn1
    SolutionIndex: 88
    SolutionNameMin: Cijk_Alik_Bljk_B8F8NHS_BH_Bias_HAS_SAV_UserArgs_MT64x64x128_MI16x16x1_SN_LDSB1_CLR1_GRVWA8_GRVWB16_GSU0_GSUC0_GSUWGMRR0_K1_LBSPPA256_LBSPPB256_LPA8_LPB16_LRVW8_MIWT2_2_PLR1_SU0_SUM0_SUS128_VWA2_VWB2_WGM1_WGMXCC1_WGMXCCGn1
    SolutionIndex: 89
    SolutionNameMin: Cijk_Alik_Bljk_B8F8NHS_BH_Bias_HAS_SAV_UserArgs_MT64x64x128_MI16x16x1_SN_LDSB1_CLR1_GRVWA8_GRVWB16_GSU0_GSUC0_GSUWGMRR0_K1_LBSPPA256_LBSPPB256_LPA8_LPB16_LRVW8_MIWT2_2_PLR1_SU0_SUM0_SUS128_VWA2_VWB2_WGM4_WGMXCC1_WGMXCCGn1
    SolutionIndex: 90
    SolutionNameMin: Cijk_Alik_Bljk_B8F8NHS_BH_Bias_HAS_SAV_UserArgs_MT64x64x128_MI16x16x1_SN_LDSB1_CLR1_GRVWA16_GRVWB8_GSU0_GSUC0_GSUWGMRR0_K1_LBSPPA256_LBSPPB256_LPA16_LPB8_LRVW8_MIWT2_2_PLR1_SU0_SUM0_SUS128_VWA2_VWB2_WGM6_WGMXCC1_WGMXCCGn1
    SolutionIndex: 91
    SolutionNameMin: Cijk_Alik_Bljk_B8F8NHS_BH_Bias_HAS_SAV_UserArgs_MT64x64x128_MI16x16x1_SN_LDSB1_CLR1_GRVWA16_GRVWB8_GSU0_GSUC0_GSUWGMRR0_K1_LBSPPA256_LBSPPB256_LPA16_LPB8_LRVW8_MIWT2_2_PLR1_SU0_SUM0_SUS128_VWA2_VWB2_WGM8_WGMXCC1_WGMXCCGn1
    SolutionIndex: 92
    SolutionNameMin: Cijk_Alik_Bljk_B8F8NHS_BH_Bias_HAS_SAV_UserArgs_MT32x64x128_MI16x16x1_SN_LDSB0_CLR1_GRVWA8_GRVWB8_GSU0_GSUC0_GSUWGMRR0_K1_LBSPPA128_LBSPPB256_LPA8_LPB8_LRVW8_MIWT1_2_PLR1_SU0_SUM0_SUS128_VWA1_VWB2_WGM1_WGMXCC1_WGMXCCGn1
    SolutionIndex: 93
    SolutionNameMin: Cijk_Alik_Bljk_B8F8NHS_BH_Bias_HAS_SAV_UserArgs_MT32x64x128_MI16x16x1_SN_LDSB0_CLR1_GRVWA8_GRVWB8_GSU0_GSUC0_GSUWGMRR0_K1_LBSPPA128_LBSPPB256_LPA8_LPB8_LRVW8_MIWT1_2_PLR1_SU0_SUM0_SUS128_VWA1_VWB2_WGM6_WGMXCC1_WGMXCCGn1
    SolutionIndex: 94
    SolutionNameMin: Cijk_Alik_Bljk_B8F8NHS_BH_Bias_HAS_SAV_UserArgs_MT32x64x128_MI16x16x1_SN_LDSB0_CLR1_GRVWA8_GRVWB8_GSU0_GSUC0_GSUWGMRR0_K1_LBSPPA128_LBSPPB256_LPA8_LPB8_LRVW8_MIWT1_2_PLR1_SU0_SUM0_SUS128_VWA1_VWB2_WGM8_WGMXCC1_WGMXCCGn1
    SolutionIndex: 95
    SolutionNameMin: Cijk_Alik_Bljk_B8F8NHS_BH_Bias_HAS_SAV_UserArgs_MT64x32x128_MI16x16x1_SN_LDSB0_CLR1_GRVWA8_GRVWB8_GSU0_GSUC0_GSUWGMRR0_K1_LBSPPA256_LBSPPB128_LPA8_LPB8_LRVW8_MIWT2_1_PLR1_SU0_SUM0_SUS128_VWA2_VWB1_WGM1_WGMXCC1_WGMXCCGn1
    SolutionIndex: 96
    SolutionNameMin: Cijk_Alik_Bljk_B8F8NHS_BH_Bias_HAS_SAV_UserArgs_MT64x32x128_MI16x16x1_SN_LDSB0_CLR1_GRVWA16_GRVWB8_GSU0_GSUC0_GSUWGMRR0_K1_LBSPPA256_LBSPPB128_LPA16_LPB8_LRVW8_MIWT2_1_PLR1_SU0_SUM0_SUS128_VWA2_VWB1_WGM1_WGMXCC1_WGMXCCGn1
    SolutionIndex: 97
    SolutionNameMin: Cijk_Alik_Bljk_B8F8NHS_BH_Bias_HAS_SAV_UserArgs_MT64x32x128_MI16x16x1_SN_LDSB0_CLR1_GRVWA8_GRVWB16_GSU0_GSUC0_GSUWGMRR0_K1_LBSPPA256_LBSPPB128_LPA8_LPB16_LRVW8_MIWT2_1_PLR1_SU0_SUM0_SUS128_VWA2_VWB1_WGM1_WGMXCC1_WGMXCCGn1
    SolutionIndex: 98
    SolutionNameMin: Cijk_Alik_Bljk_B8F8NHS_BH_Bias_HAS_SAV_UserArgs_MT64x32x128_MI16x16x1_SN_LDSB0_CLR1_GRVWA16_GRVWB16_GSU0_GSUC0_GSUWGMRR0_K1_LBSPPA256_LBSPPB128_LPA16_LPB16_LRVW8_MIWT2_1_PLR1_SU0_SUM0_SUS128_VWA2_VWB1_WGM1_WGMXCC1_WGMXCCGn1
    SolutionIndex: 99
    SolutionNameMin: Cijk_Alik_Bljk_B8F8NHS_BH_Bias_HAS_SAV_UserArgs_MT32x32x128_MI16x16x1_SN_LDSB0_CLR1_GRVWA8_GRVWB8_GSU0_GSUC0_GSUWGMRR0_K1_LBSPPA128_LBSPPB128_LPA8_LPB8_LRVW8_MIWT1_1_PLR1_SU0_SUM0_SUS128_VWA1_VWB1_WGM1_WGMXCC1_WGMXCCGn1
    SolutionIndex: 100
    SolutionNameMin: Cijk_Alik_Bljk_B8F8NHS_BH_Bias_HAS_SAV_UserArgs_MT32x32x128_MI16x16x1_SN_LDSB0_CLR1_GRVWA16_GRVWB8_GSU0_GSUC0_GSUWGMRR0_K1_LBSPPA128_LBSPPB128_LPA16_LPB8_LRVW8_MIWT1_1_PLR1_SU0_SUM0_SUS128_VWA1_VWB1_WGM1_WGMXCC1_WGMXCCGn1
    SolutionIndex: 101
    SolutionNameMin: Cijk_Alik_Bljk_B8F8NHS_BH_Bias_HAS_SAV_UserArgs_MT32x32x128_MI16x16x1_SN_LDSB0_CLR1_GRVWA8_GRVWB16_GSU0_GSUC0_GSUWGMRR0_K1_LBSPPA128_LBSPPB128_LPA8_LPB16_LRVW8_MIWT1_1_PLR1_SU0_SUM0_SUS128_VWA1_VWB1_WGM1_WGMXCC1_WGMXCCGn1
    SolutionIndex: 102
    SolutionNameMin: Cijk_Alik_Bljk_B8F8NHS_BH_Bias_HAS_SAV_UserArgs_MT32x32x128_MI16x16x1_SN_LDSB0_CLR1_GRVWA16_GRVWB16_GSU0_GSUC0_GSUWGMRR0_K1_LBSPPA128_LBSPPB128_LPA16_LPB16_LRVW8_MIWT1_1_PLR1_SU0_SUM0_SUS128_VWA1_VWB1_WGM1_WGMXCC1_WGMXCCGn1
    SolutionIndex: 103
    SolutionNameMin: Cijk_Alik_Bljk_B8F8NHS_BH_Bias_HAS_SAV_UserArgs_MT32x32x128_MI16x16x1_SN_LDSB0_CLR1_GRVWA8_GRVWB8_GSU0_GSUC0_GSUWGMRR0_K1_LBSPPA128_LBSPPB128_LPA8_LPB8_LRVW8_MIWT1_1_PLR1_SU0_SUM0_SUS128_VWA1_VWB1_WGM4_WGMXCC1_WGMXCCGn1
    SolutionIndex: 104
    SolutionNameMin: Cijk_Alik_Bljk_B8F8NHS_BH_Bias_HAS_SAV_UserArgs_MT32x32x128_MI16x16x1_SN_LDSB0_CLR1_GRVWA16_GRVWB8_GSU0_GSUC0_GSUWGMRR0_K1_LBSPPA128_LBSPPB128_LPA16_LPB8_LRVW8_MIWT1_1_PLR1_SU0_SUM0_SUS128_VWA1_VWB1_WGM4_WGMXCC1_WGMXCCGn1
    SolutionIndex: 105
    SolutionNameMin: Cijk_Alik_Bljk_B8F8NHS_BH_Bias_HAS_SAV_UserArgs_MT32x32x128_MI16x16x1_SN_LDSB0_CLR1_GRVWA16_GRVWB16_GSU0_GSUC0_GSUWGMRR0_K1_LBSPPA128_LBSPPB128_LPA16_LPB16_LRVW8_MIWT1_1_PLR1_SU0_SUM0_SUS128_VWA1_VWB1_WGM4_WGMXCC1_WGMXCCGn1
    SolutionIndex: 106
    SolutionNameMin: Cijk_Alik_Bljk_B8F8NHS_BH_Bias_HAS_SAV_UserArgs_MT32x32x128_MI16x16x1_SN_LDSB0_CLR1_GRVWA8_GRVWB8_GSU0_GSUC0_GSUWGMRR0_K1_LBSPPA128_LBSPPB128_LPA8_LPB8_LRVW8_MIWT1_1_PLR1_SU0_SUM0_SUS128_VWA1_VWB1_WGM6_WGMXCC1_WGMXCCGn1
    SolutionIndex: 107
    SolutionNameMin: Cijk_Alik_Bljk_B8F8NHS_BH_Bias_HAS_SAV_UserArgs_MT32x32x128_MI16x16x1_SN_LDSB0_CLR1_GRVWA8_GRVWB8_GSU0_GSUC0_GSUWGMRR0_K1_LBSPPA128_LBSPPB128_LPA8_LPB8_LRVW8_MIWT1_1_PLR1_SU0_SUM0_SUS128_VWA1_VWB1_WGM8_WGMXCC1_WGMXCCGn1
    SolutionIndex: 108
    SolutionNameMin: Cijk_Alik_Bljk_B8F8NHS_BH_Bias_HAS_SAV_UserArgs_MT64x128x256_MI16x16x1_SN_LDSB1_CLR1_GRVWA8_GRVWB8_GSU0_GSUC0_GSUWGMRR0_K1_LBSPPA512_LBSPPB1024_LPA8_LPB8_LRVW8_MIWT2_4_PLR1_SU0_SUM0_SUS256_VWA2_VWB4_WGM1_WGMXCC1_WGMXCCGn1
    SolutionIndex: 109
    SolutionNameMin: Cijk_Alik_Bljk_B8F8NHS_BH_Bias_HAS_SAV_UserArgs_MT128x64x256_MI16x16x1_SN_LDSB1_CLR1_GRVWA8_GRVWB16_GSU0_GSUC0_GSUWGMRR0_K1_LBSPPA1024_LBSPPB512_LPA8_LPB16_LRVW8_MIWT4_2_PLR1_SU0_SUM0_SUS256_VWA4_VWB2_WGM1_WGMXCC1_WGMXCCGn1
    SolutionIndex: 110
    SolutionNameMin: Cijk_Alik_Bljk_B8F8NHS_BH_Bias_HAS_SAV_UserArgs_MT128x64x256_MI16x16x1_SN_LDSB1_CLR1_GRVWA8_GRVWB16_GSU0_GSUC0_GSUWGMRR0_K1_LBSPPA1024_LBSPPB512_LPA8_LPB16_LRVW8_MIWT4_2_PLR1_SU0_SUM0_SUS256_VWA4_VWB2_WGM6_WGMXCC1_WGMXCCGn1
    SolutionIndex: 111
    SolutionNameMin: Cijk_Alik_Bljk_B8F8NHS_BH_Bias_HAS_SAV_UserArgs_MT128x64x256_MI16x16x1_SN_LDSB1_CLR1_GRVWA8_GRVWB16_GSU0_GSUC0_GSUWGMRR0_K1_LBSPPA1024_LBSPPB512_LPA8_LPB16_LRVW8_MIWT4_2_PLR1_SU0_SUM0_SUS256_VWA4_VWB2_WGM8_WGMXCC1_WGMXCCGn1
    SolutionIndex: 112
    SolutionNameMin: Cijk_Alik_Bljk_B8F8NHS_BH_Bias_HAS_SAV_UserArgs_MT64x64x256_MI16x16x1_SN_LDSB1_CLR1_GRVWA8_GRVWB16_GSU0_GSUC0_GSUWGMRR0_K1_LBSPPA512_LBSPPB512_LPA8_LPB16_LRVW8_MIWT2_2_PLR1_SU0_SUM0_SUS256_VWA2_VWB2_WGM1_WGMXCC1_WGMXCCGn1
    SolutionIndex: 113
    SolutionNameMin: Cijk_Alik_Bljk_B8F8NHS_BH_Bias_HAS_SAV_UserArgs_MT64x64x256_MI16x16x1_SN_LDSB1_CLR1_GRVWA8_GRVWB16_GSU0_GSUC0_GSUWGMRR0_K1_LBSPPA512_LBSPPB512_LPA8_LPB16_LRVW8_MIWT2_2_PLR1_SU0_SUM0_SUS256_VWA2_VWB2_WGM4_WGMXCC1_WGMXCCGn1
    SolutionIndex: 114
    SolutionNameMin: Cijk_Alik_Bljk_B8F8NHS_BH_Bias_HAS_SAV_UserArgs_MT64x64x256_MI16x16x1_SN_LDSB1_CLR1_GRVWA8_GRVWB16_GSU0_GSUC0_GSUWGMRR0_K1_LBSPPA512_LBSPPB512_LPA8_LPB16_LRVW8_MIWT2_2_PLR1_SU0_SUM0_SUS256_VWA2_VWB2_WGM6_WGMXCC1_WGMXCCGn1
    SolutionIndex: 115
    SolutionNameMin: Cijk_Alik_Bljk_B8F8NHS_BH_Bias_HAS_SAV_UserArgs_MT32x32x256_MI16x16x1_SN_LDSB1_CLR1_GRVWA8_GRVWB16_GSU0_GSUC0_GSUWGMRR0_K1_LBSPPA256_LBSPPB256_LPA8_LPB16_LRVW8_MIWT1_1_PLR1_SU0_SUM0_SUS256_VWA1_VWB1_WGM1_WGMXCC1_WGMXCCGn1
    SolutionIndex: 116
    SolutionNameMin: Cijk_Alik_Bljk_B8F8NHS_BH_Bias_HAS_SAV_UserArgs_MT32x32x256_MI16x16x1_SN_LDSB1_CLR1_GRVWA16_GRVWB16_GSU0_GSUC0_GSUWGMRR0_K1_LBSPPA256_LBSPPB256_LPA16_LPB16_LRVW8_MIWT1_1_PLR1_SU0_SUM0_SUS256_VWA1_VWB1_WGM6_WGMXCC1_WGMXCCGn1
    SolutionIndex: 117
    SolutionNameMin: Cijk_Alik_Bljk_B8F8NHS_BH_Bias_HAS_SAV_UserArgs_MT32x32x256_MI16x16x1_SN_LDSB1_CLR1_GRVWA8_GRVWB16_GSU0_GSUC0_GSUWGMRR0_K1_LBSPPA256_LBSPPB256_LPA8_LPB16_LRVW8_MIWT1_1_PLR1_SU0_SUM0_SUS256_VWA1_VWB1_WGM8_WGMXCC1_WGMXCCGn1
    SolutionIndex: 118
    SolutionNameMin: Cijk_Alik_Bljk_B8F8NHS_BH_Bias_HAS_SAV_UserArgs_MT32x64x32_MI16x16x1_SN_LDSB0_CLR0_GRVWA4_GRVWB4_GSU0_GSUC0_GSUWGMRR0_K1_LBSPPA128_LBSPPB128_LPA8_LPB8_LRVW8_MIWT1_2_PLR0_SU32_SUM0_SUS256_VWA1_VWB2_WGM8_WGMXCC1_WGMXCCGn1
- - - [128, 128, 1, 128, 128, 128, 128, 128]
    - [102, 0.63]
  - - [128, 128, 1, 256, 128, 128, 256, 256]
    - [100, 1.18]
  - - [128, 128, 1, 512, 128, 128, 512, 512]
    - [99, 2.08]
  - - [128, 128, 1, 1024, 128, 128, 1024, 1024]
    - [99, 3.47]
  - - [128, 128, 1, 2048, 128, 128, 2048, 2048]
    - [99, 5.33]
  - - [128, 128, 1, 4096, 128, 128, 4096, 4096]
    - [99, 7.23]
  - - [128, 128, 1, 8192, 128, 128, 8192, 8192]
    - [99, 8.7]
  - - [128, 256, 1, 128, 128, 128, 128, 128]
    - [99, 1.25]
  - - [128, 256, 1, 256, 128, 128, 256, 256]
    - [105, 2.27]
  - - [128, 256, 1, 512, 128, 128, 512, 512]
    - [99, 4.24]
  - - [128, 256, 1, 1024, 128, 128, 1024, 1024]
    - [99, 7.04]
  - - [128, 256, 1, 2048, 128, 128, 2048, 2048]
    - [99, 10.69]
  - - [128, 256, 1, 4096, 128, 128, 4096, 4096]
    - [99, 14.42]
  - - [128, 256, 1, 8192, 128, 128, 8192, 8192]
    - [99, 17.35]
  - - [128, 512, 1, 128, 128, 128, 128, 128]
    - [100, 2.49]
  - - [128, 512, 1, 256, 128, 128, 256, 256]
    - [101, 4.67]
  - - [128, 512, 1, 512, 128, 128, 512, 512]
    - [101, 8.45]
  - - [128, 512, 1, 1024, 128, 128, 1024, 1024]
    - [101, 14.04]
  - - [128, 512, 1, 2048, 128, 128, 2048, 2048]
    - [99, 21.35]
  - - [128, 512, 1, 4096, 128, 128, 4096, 4096]
    - [99, 28.7]
  - - [128, 512, 1, 8192, 128, 128, 8192, 8192]
    - [99, 34.6]
  - - [128, 1024, 1, 128, 128, 128, 128, 128]
    - [102, 4.73]
  - - [128, 1024, 1, 256, 128, 128, 256, 256]
    - [102, 9.28]
  - - [128, 1024, 1, 512, 128, 128, 512, 512]
    - [101, 16.5]
  - - [128, 1024, 1, 1024, 128, 128, 1024, 1024]
    - [99, 26.67]
  - - [128, 1024, 1, 2048, 128, 128, 2048, 2048]
    - [99, 40.92]
  - - [128, 1024, 1, 4096, 128, 128, 4096, 4096]
    - [115, 54.37]
  - - [128, 1024, 1, 8192, 128, 128, 8192, 8192]
    - [99, 66.97]
  - - [128, 2048, 1, 128, 128, 128, 128, 128]
    - [18, 7.91]
  - - [128, 2048, 1, 256, 128, 128, 256, 256]
    - [19, 11.25]
  - - [128, 2048, 1, 512, 128, 128, 512, 512]
    - [33, 20.07]
  - - [128, 2048, 1, 1024, 128, 128, 1024, 1024]
    - [90, 38.41]
  - - [128, 2048, 1, 2048, 128, 128, 2048, 2048]
    - [92, 68.97]
  - - [128, 2048, 1, 4096, 128, 128, 4096, 4096]
    - [92, 89.05]
  - - [128, 2048, 1, 8192, 128, 128, 8192, 8192]
    - [95, 101.97]
  - - [128, 4096, 1, 128, 128, 128, 128, 128]
    - [37, 17.0]
  - - [128, 4096, 1, 256, 128, 128, 256, 256]
    - [37, 30.73]
  - - [128, 4096, 1, 512, 128, 128, 512, 512]
    - [35, 50.76]
  - - [128, 4096, 1, 1024, 128, 128, 1024, 1024]
    - [88, 78.14]
  - - [128, 4096, 1, 2048, 128, 128, 2048, 2048]
    - [88, 106.83]
  - - [128, 4096, 1, 4096, 128, 128, 4096, 4096]
    - [88, 131.4]
  - - [128, 4096, 1, 8192, 128, 128, 8192, 8192]
    - [114, 140.61]
  - - [128, 8192, 1, 128, 128, 128, 128, 128]
    - [30, 27.56]
  - - [128, 8192, 1, 256, 128, 128, 256, 256]
    - [29, 50.07]
  - - [128, 8192, 1, 512, 128, 128, 512, 512]
    - [29, 82.78]
  - - [128, 8192, 1, 1024, 128, 128, 1024, 1024]
    - [29, 122.85]
  - - [128, 8192, 1, 2048, 128, 128, 2048, 2048]
    - [29, 161.23]
  - - [128, 8192, 1, 4096, 128, 128, 4096, 4096]
    - [108, 162.85]
  - - [128, 8192, 1, 8192, 128, 128, 8192, 8192]
    - [78, 180.29]
  - - [256, 128, 1, 128, 256, 256, 128, 128]
    - [102, 1.28]
  - - [256, 128, 1, 256, 256, 256, 256, 256]
    - [102, 2.39]
  - - [256, 128, 1, 512, 256, 256, 512, 512]
    - [99, 4.29]
  - - [256, 128, 1, 1024, 256, 256, 1024, 1024]
    - [99, 7.22]
  - - [256, 128, 1, 2048, 256, 256, 2048, 2048]
    - [99, 10.87]
  - - [256, 128, 1, 4096, 256, 256, 4096, 4096]
    - [99, 14.51]
  - - [256, 128, 1, 8192, 256, 256, 8192, 8192]
    - [99, 17.42]
  - - [256, 256, 1, 128, 256, 256, 128, 128]
    - [102, 2.55]
  - - [256, 256, 1, 256, 256, 256, 256, 256]
    - [101, 4.73]
  - - [256, 256, 1, 512, 256, 256, 512, 512]
    - [101, 8.5]
  - - [256, 256, 1, 1024, 256, 256, 1024, 1024]
    - [99, 14.1]
  - - [256, 256, 1, 2048, 256, 256, 2048, 2048]
    - [99, 21.63]
  - - [256, 256, 1, 4096, 256, 256, 4096, 4096]
    - [99, 28.77]
  - - [256, 256, 1, 8192, 256, 256, 8192, 8192]
    - [99, 34.63]
  - - [256, 512, 1, 128, 256, 256, 128, 128]
    - [46, 4.99]
  - - [256, 512, 1, 256, 256, 256, 256, 256]
    - [102, 9.32]
  - - [256, 512, 1, 512, 256, 256, 512, 512]
    - [101, 16.57]
  - - [256, 512, 1, 1024, 256, 256, 1024, 1024]
    - [101, 26.08]
  - - [256, 512, 1, 2048, 256, 256, 2048, 2048]
    - [99, 40.29]
  - - [256, 512, 1, 4096, 256, 256, 4096, 4096]
    - [99, 54.95]
  - - [256, 512, 1, 8192, 256, 256, 8192, 8192]
    - [99, 66.96]
  - - [256, 1024, 1, 128, 256, 256, 128, 128]
    - [45, 8.13]
  - - [256, 1024, 1, 256, 256, 256, 256, 256]
    - [43, 15.83]
  - - [256, 1024, 1, 512, 256, 256, 512, 512]
    - [95, 27.83]
  - - [256, 1024, 1, 1024, 256, 256, 1024, 1024]
    - [95, 45.58]
  - - [256, 1024, 1, 2048, 256, 256, 2048, 2048]
    - [95, 66.75]
  - - [256, 1024, 1, 4096, 256, 256, 4096, 4096]
    - [92, 86.98]
  - - [256, 1024, 1, 8192, 256, 256, 8192, 8192]
    - [95, 101.55]
  - - [256, 2048, 1, 128, 256, 256, 128, 128]
    - [35, 15.65]
  - - [256, 2048, 1, 256, 256, 256, 256, 256]
    - [37, 28.34]
  - - [256, 2048, 1, 512, 256, 256, 512, 512]
    - [88, 47.4]
  - - [256, 2048, 1, 1024, 256, 256, 1024, 1024]
    - [87, 73.69]
  - - [256, 2048, 1, 2048, 256, 256, 2048, 2048]
    - [88, 103.69]
  - - [256, 2048, 1, 4096, 256, 256, 4096, 4096]
    - [88, 129.07]
  - - [256, 2048, 1, 8192, 256, 256, 8192, 8192]
    - [112, 141.54]
  - - [256, 4096, 1, 128, 256, 256, 128, 128]
    - [27, 26.17]
  - - [256, 4096, 1, 256, 256, 256, 256, 256]
    - [25, 46.87]
  - - [256, 4096, 1, 512, 256, 256, 512, 512]
    - [29, 79.03]
  - - [256, 4096, 1, 1024, 256, 256, 1024, 1024]
    - [29, 118.67]
  - - [256, 4096, 1, 2048, 256, 256, 2048, 2048]
    - [29, 159.09]
  - - [256, 4096, 1, 4096, 256, 256, 4096, 4096]
    - [109, 170.87]
  - - [256, 4096, 1, 8192, 256, 256, 8192, 8192]
    - [78, 188.2]
  - - [256, 8192, 1, 128, 256, 256, 128, 128]
    - [63, 41.88]
  - - [256, 8192, 1, 256, 256, 256, 256, 256]
    - [14, 74.03]
  - - [256, 8192, 1, 512, 256, 256, 512, 512]
    - [14, 121.51]
  - - [256, 8192, 1, 1024, 256, 256, 1024, 1024]
    - [63, 177.29]
  - - [256, 8192, 1, 2048, 256, 256, 2048, 2048]
    - [63, 215.9]
  - - [256, 8192, 1, 4096, 256, 256, 4096, 4096]
    - [73, 213.37]
  - - [256, 8192, 1, 8192, 256, 256, 8192, 8192]
    - [72, 242.42]
  - - [512, 128, 1, 128, 512, 512, 128, 128]
    - [101, 2.5]
  - - [512, 128, 1, 256, 512, 512, 256, 256]
    - [46, 4.63]
  - - [512, 128, 1, 512, 512, 512, 512, 512]
    - [89, 5.07]
  - - [512, 128, 1, 1024, 512, 512, 1024, 1024]
    - [116, 12.22]
  - - [512, 128, 1, 2048, 512, 512, 2048, 2048]
    - [106, 20.64]
  - - [512, 128, 1, 4096, 512, 512, 4096, 4096]
    - [99, 28.41]
  - - [512, 128, 1, 8192, 512, 512, 8192, 8192]
    - [99, 34.34]
  - - [512, 256, 1, 128, 512, 512, 128, 128]
    - [83, 2.85]
  - - [512, 256, 1, 256, 512, 512, 256, 256]
    - [85, 6.93]
  - - [512, 256, 1, 512, 512, 512, 512, 512]
    - [96, 12.97]
  - - [512, 256, 1, 1024, 512, 512, 1024, 1024]
    - [46, 23.67]
  - - [512, 256, 1, 2048, 512, 512, 2048, 2048]
    - [104, 35.02]
  - - [512, 256, 1, 4096, 512, 512, 4096, 4096]
    - [107, 55.02]
  - - [512, 256, 1, 8192, 512, 512, 8192, 8192]
    - [107, 66.83]
  - - [512, 512, 1, 128, 512, 512, 128, 128]
    - [82, 5.35]
  - - [512, 512, 1, 256, 512, 512, 256, 256]
    - [69, 11.89]
  - - [512, 512, 1, 512, 512, 512, 512, 512]
    - [28, 20.56]
  - - [512, 512, 1, 1024, 512, 512, 1024, 1024]
    - [42, 41.28]
  - - [512, 512, 1, 2048, 512, 512, 2048, 2048]
    - [97, 67.29]
  - - [512, 512, 1, 4096, 512, 512, 4096, 4096]
    - [92, 87.92]
  - - [512, 512, 1, 8192, 512, 512, 8192, 8192]
    - [117, 96.14]
  - - [512, 1024, 1, 128, 512, 512, 128, 128]
    - [67, 10.88]
  - - [512, 1024, 1, 256, 512, 512, 256, 256]
    - [84, 23.45]
  - - [512, 1024, 1, 512, 512, 512, 512, 512]
    - [86, 42.07]
  - - [512, 1024, 1, 1024, 512, 512, 1024, 1024]
    - [88, 73.87]
  - - [512, 1024, 1, 2048, 512, 512, 2048, 2048]
    - [88, 103.41]
  - - [512, 1024, 1, 4096, 512, 512, 4096, 4096]
    - [88, 128.63]
  - - [512, 1024, 1, 8192, 512, 512, 8192, 8192]
    - [112, 140.93]
  - - [512, 2048, 1, 128, 512, 512, 128, 128]
    - [23, 21.12]
  - - [512, 2048, 1, 256, 512, 512, 256, 256]
    - [20, 44.48]
  - - [512, 2048, 1, 512, 512, 512, 512, 512]
    - [27, 75.91]
  - - [512, 2048, 1, 1024, 512, 512, 1024, 1024]
    - [32, 117.58]
  - - [512, 2048, 1, 2048, 512, 512, 2048, 2048]
    - [29, 156.84]
  - - [512, 2048, 1, 4096, 512, 512, 4096, 4096]
    - [109, 174.73]
  - - [512, 2048, 1, 8192, 512, 512, 8192, 8192]
    - [78, 187.51]
  - - [512, 4096, 1, 128, 512, 512, 128, 128]
    - [22, 38.0]
  - - [512, 4096, 1, 256, 512, 512, 256, 256]
    - [21, 70.09]
  - - [512, 4096, 1, 512, 512, 512, 512, 512]
    - [14, 118.11]
  - - [512, 4096, 1, 1024, 512, 512, 1024, 1024]
    - [14, 173.72]
  - - [512, 4096, 1, 2048, 512, 512, 2048, 2048]
    - [63, 227.62]
  - - [512, 4096, 1, 4096, 512, 512, 4096, 4096]
    - [73, 223.0]
  - - [512, 4096, 1, 8192, 512, 512, 8192, 8192]
    - [63, 242.73]
  - - [512, 8192, 1, 128, 512, 512, 128, 128]
    - [68, 58.44]
  - - [512, 8192, 1, 256, 512, 512, 256, 256]
    - [68, 106.56]
  - - [512, 8192, 1, 512, 512, 512, 512, 512]
    - [68, 176.01]
  - - [512, 8192, 1, 1024, 512, 512, 1024, 1024]
    - [68, 219.58]
  - - [512, 8192, 1, 2048, 512, 512, 2048, 2048]
    - [55, 233.13]
  - - [512, 8192, 1, 4096, 512, 512, 4096, 4096]
    - [68, 268.39]
  - - [512, 8192, 1, 8192, 512, 512, 8192, 8192]
    - [68, 285.47]
  - - [1024, 128, 1, 128, 1024, 1024, 128, 128]
    - [102, 4.95]
  - - [1024, 128, 1, 256, 1024, 1024, 256, 256]
    - [102, 9.16]
  - - [1024, 128, 1, 512, 1024, 1024, 512, 512]
    - [101, 16.55]
  - - [1024, 128, 1, 1024, 1024, 1024, 1024, 1024]
    - [99, 27.49]
  - - [1024, 128, 1, 2048, 1024, 1024, 2048, 2048]
    - [107, 41.2]
  - - [1024, 128, 1, 4096, 1024, 1024, 4096, 4096]
    - [106, 55.15]
  - - [1024, 128, 1, 8192, 1024, 1024, 8192, 8192]
    - [103, 66.87]
  - - [1024, 256, 1, 128, 1024, 1024, 128, 128]
    - [44, 8.99]
  - - [1024, 256, 1, 256, 1024, 1024, 256, 256]
    - [98, 16.77]
  - - [1024, 256, 1, 512, 1024, 1024, 512, 512]
    - [98, 29.09]
  - - [1024, 256, 1, 1024, 1024, 1024, 1024, 1024]
    - [97, 47.05]
  - - [1024, 256, 1, 2048, 1024, 1024, 2048, 2048]
    - [95, 68.02]
  - - [1024, 256, 1, 4096, 1024, 1024, 4096, 4096]
    - [92, 88.2]
  - - [1024, 256, 1, 8192, 1024, 1024, 8192, 8192]
    - [93, 101.04]
  - - [1024, 512, 1, 128, 1024, 1024, 128, 128]
    - [37, 16.13]
  - - [1024, 512, 1, 256, 1024, 1024, 256, 256]
    - [37, 29.15]
  - - [1024, 512, 1, 512, 1024, 1024, 512, 512]
    - [37, 49.12]
  - - [1024, 512, 1, 1024, 1024, 1024, 1024, 1024]
    - [88, 76.61]
  - - [1024, 512, 1, 2048, 1024, 1024, 2048, 2048]
    - [88, 105.72]
  - - [1024, 512, 1, 4096, 1024, 1024, 4096, 4096]
    - [89, 129.69]
  - - [1024, 512, 1, 8192, 1024, 1024, 8192, 8192]
    - [114, 141.07]
  - - [1024, 1024, 1, 128, 1024, 1024, 128, 128]
    - [17, 20.66]
  - - [1024, 1024, 1, 256, 1024, 1024, 256, 256]
    - [79, 39.1]
  - - [1024, 1024, 1, 512, 1024, 1024, 512, 512]
    - [24, 78.01]
  - - [1024, 1024, 1, 1024, 1024, 1024, 1024, 1024]
    - [29, 121.64]
  - - [1024, 1024, 1, 2048, 1024, 1024, 2048, 2048]
    - [29, 159.46]
  - - [1024, 1024, 1, 4096, 1024, 1024, 4096, 4096]
    - [111, 170.76]
  - - [1024, 1024, 1, 8192, 1024, 1024, 8192, 8192]
    - [80, 186.03]
  - - [1024, 2048, 1, 128, 1024, 1024, 128, 128]
    - [68, 37.16]
  - - [1024, 2048, 1, 256, 1024, 1024, 256, 256]
    - [21, 71.36]
  - - [1024, 2048, 1, 512, 1024, 1024, 512, 512]
    - [14, 121.98]
  - - [1024, 2048, 1, 1024, 1024, 1024, 1024, 1024]
    - [14, 177.24]
  - - [1024, 2048, 1, 2048, 1024, 1024, 2048, 2048]
    - [72, 222.5]
  - - [1024, 2048, 1, 4096, 1024, 1024, 4096, 4096]
    - [63, 223.75]
  - - [1024, 2048, 1, 8192, 1024, 1024, 8192, 8192]
    - [65, 243.23]
  - - [1024, 4096, 1, 128, 1024, 1024, 128, 128]
    - [12, 59.77]
  - - [1024, 4096, 1, 256, 1024, 1024, 256, 256]
    - [13, 105.0]
  - - [1024, 4096, 1, 512, 1024, 1024, 512, 512]
    - [9, 161.57]
  - - [1024, 4096, 1, 1024, 1024, 1024, 1024, 1024]
    - [55, 210.03]
  - - [1024, 4096, 1, 2048, 1024, 1024, 2048, 2048]
    - [55, 236.86]
  - - [1024, 4096, 1, 4096, 1024, 1024, 4096, 4096]
    - [57, 261.86]
  - - [1024, 4096, 1, 8192, 1024, 1024, 8192, 8192]
    - [56, 257.13]
  - - [1024, 8192, 1, 128, 1024, 1024, 128, 128]
    - [54, 74.66]
  - - [1024, 8192, 1, 256, 1024, 1024, 256, 256]
    - [50, 127.54]
  - - [1024, 8192, 1, 512, 1024, 1024, 512, 512]
    - [48, 190.67]
  - - [1024, 8192, 1, 1024, 1024, 1024, 1024, 1024]
    - [50, 231.43]
  - - [1024, 8192, 1, 2048, 1024, 1024, 2048, 2048]
    - [49, 293.89]
  - - [1024, 8192, 1, 4096, 1024, 1024, 4096, 4096]
    - [51, 335.29]
  - - [1024, 8192, 1, 8192, 1024, 1024, 8192, 8192]
    - [49, 354.87]
  - - [2048, 128, 1, 128, 2048, 2048, 128, 128]
    - [44, 9.08]
  - - [2048, 128, 1, 256, 2048, 2048, 256, 256]
    - [44, 16.63]
  - - [2048, 128, 1, 512, 2048, 2048, 512, 512]
    - [97, 29.22]
  - - [2048, 128, 1, 1024, 2048, 2048, 1024, 1024]
    - [97, 47.27]
  - - [2048, 128, 1, 2048, 2048, 2048, 2048, 2048]
    - [95, 68.32]
  - - [2048, 128, 1, 4096, 2048, 2048, 4096, 4096]
    - [92, 88.48]
  - - [2048, 128, 1, 8192, 2048, 2048, 8192, 8192]
    - [94, 100.36]
  - - [2048, 256, 1, 128, 2048, 2048, 128, 128]
    - [41, 16.01]
  - - [2048, 256, 1, 256, 2048, 2048, 256, 256]
    - [39, 29.26]
  - - [2048, 256, 1, 512, 2048, 2048, 512, 512]
    - [40, 48.93]
  - - [2048, 256, 1, 1024, 2048, 2048, 1024, 1024]
    - [89, 75.84]
  - - [2048, 256, 1, 2048, 2048, 2048, 2048, 2048]
    - [89, 104.63]
  - - [2048, 256, 1, 4096, 2048, 2048, 4096, 4096]
    - [89, 129.67]
  - - [2048, 256, 1, 8192, 2048, 2048, 8192, 8192]
    - [113, 142.11]
  - - [2048, 512, 1, 128, 2048, 2048, 128, 128]
    - [25, 27.06]
  - - [2048, 512, 1, 256, 2048, 2048, 256, 256]
    - [26, 46.97]
  - - [2048, 512, 1, 512, 2048, 2048, 512, 512]
    - [32, 80.88]
  - - [2048, 512, 1, 1024, 2048, 2048, 1024, 1024]
    - [34, 122.28]
  - - [2048, 512, 1, 2048, 2048, 2048, 2048, 2048]
    - [31, 159.79]
  - - [2048, 512, 1, 4096, 2048, 2048, 4096, 4096]
    - [81, 174.14]
  - - [2048, 512, 1, 8192, 2048, 2048, 8192, 8192]
    - [81, 188.64]
  - - [2048, 1024, 1, 128, 2048, 2048, 128, 128]
    - [63, 41.99]
  - - [2048, 1024, 1, 256, 2048, 2048, 256, 256]
    - [14, 74.86]
  - - [2048, 1024, 1, 512, 2048, 2048, 512, 512]
    - [14, 122.66]
  - - [2048, 1024, 1, 1024, 2048, 2048, 1024, 1024]
    - [14, 177.35]
  - - [2048, 1024, 1, 2048, 2048, 2048, 2048, 2048]
    - [74, 221.0]
  - - [2048, 1024, 1, 4096, 2048, 2048, 4096, 4096]
    - [64, 225.99]
  - - [2048, 1024, 1, 8192, 2048, 2048, 8192, 8192]
    - [75, 246.19]
  - - [2048, 2048, 1, 128, 2048, 2048, 128, 128]
    - [8, 59.32]
  - - [2048, 2048, 1, 256, 2048, 2048, 256, 256]
    - [9, 102.87]
  - - [2048, 2048, 1, 512, 2048, 2048, 512, 512]
    - [9, 159.76]
  - - [2048, 2048, 1, 1024, 2048, 2048, 1024, 1024]
    - [55, 204.63]
  - - [2048, 2048, 1, 2048, 2048, 2048, 2048, 2048]
    - [58, 240.11]
  - - [2048, 2048, 1, 4096, 2048, 2048, 4096, 4096]
    - [58, 262.9]
  - - [2048, 2048, 1, 8192, 2048, 2048, 8192, 8192]
    - [56, 255.57]
  - - [2048, 4096, 1, 128, 2048, 2048, 128, 128]
    - [3, 69.19]
  - - [2048, 4096, 1, 256, 2048, 2048, 256, 256]
    - [2, 116.75]
  - - [2048, 4096, 1, 512, 2048, 2048, 512, 512]
    - [1, 174.12]
  - - [2048, 4096, 1, 1024, 2048, 2048, 1024, 1024]
    - [7, 221.39]
  - - [2048, 4096, 1, 2048, 2048, 2048, 2048, 2048]
    - [1, 260.88]
  - - [2048, 4096, 1, 4096, 2048, 2048, 4096, 4096]
    - [53, 278.56]
  - - [2048, 4096, 1, 8192, 2048, 2048, 8192, 8192]
    - [53, 314.2]
  - - [2048, 8192, 1, 128, 2048, 2048, 128, 128]
    - [54, 75.99]
  - - [2048, 8192, 1, 256, 2048, 2048, 256, 256]
    - [50, 128.96]
  - - [2048, 8192, 1, 512, 2048, 2048, 512, 512]
    - [50, 189.79]
  - - [2048, 8192, 1, 1024, 2048, 2048, 1024, 1024]
    - [48, 251.89]
  - - [2048, 8192, 1, 2048, 2048, 2048, 2048, 2048]
    - [52, 311.18]
  - - [2048, 8192, 1, 4096, 2048, 2048, 4096, 4096]
    - [53, 318.44]
  - - [2048, 8192, 1, 8192, 2048, 2048, 8192, 8192]
    - [47, 361.7]
  - - [4096, 128, 1, 128, 4096, 4096, 128, 128]
    - [38, 16.69]
  - - [4096, 128, 1, 256, 4096, 4096, 256, 256]
    - [36, 29.97]
  - - [4096, 128, 1, 512, 4096, 4096, 512, 512]
    - [35, 50.11]
  - - [4096, 128, 1, 1024, 4096, 4096, 1024, 1024]
    - [88, 77.31]
  - - [4096, 128, 1, 2048, 4096, 4096, 2048, 2048]
    - [88, 106.29]
  - - [4096, 128, 1, 4096, 4096, 4096, 4096, 4096]
    - [91, 126.45]
  - - [4096, 128, 1, 8192, 4096, 4096, 8192, 8192]
    - [114, 141.34]
  - - [4096, 256, 1, 128, 4096, 4096, 128, 128]
    - [30, 26.2]
  - - [4096, 256, 1, 256, 4096, 4096, 256, 256]
    - [29, 47.52]
  - - [4096, 256, 1, 512, 4096, 4096, 512, 512]
    - [29, 82.23]
  - - [4096, 256, 1, 1024, 4096, 4096, 1024, 1024]
    - [34, 121.91]
  - - [4096, 256, 1, 2048, 4096, 4096, 2048, 2048]
    - [32, 158.66]
  - - [4096, 256, 1, 4096, 4096, 4096, 4096, 4096]
    - [110, 173.57]
  - - [4096, 256, 1, 8192, 4096, 4096, 8192, 8192]
    - [80, 189.66]
  - - [4096, 512, 1, 128, 4096, 4096, 128, 128]
    - [14, 42.01]
  - - [4096, 512, 1, 256, 4096, 4096, 256, 256]
    - [14, 74.74]
  - - [4096, 512, 1, 512, 4096, 4096, 512, 512]
    - [15, 120.26]
  - - [4096, 512, 1, 1024, 4096, 4096, 1024, 1024]
    - [15, 176.24]
  - - [4096, 512, 1, 2048, 4096, 4096, 2048, 2048]
    - [66, 222.12]
  - - [4096, 512, 1, 4096, 4096, 4096, 4096, 4096]
    - [77, 227.72]
  - - [4096, 512, 1, 8192, 4096, 4096, 8192, 8192]
    - [75, 245.76]
  - - [4096, 1024, 1, 128, 4096, 4096, 128, 128]
    - [9, 58.56]
  - - [4096, 1024, 1, 256, 4096, 4096, 256, 256]
    - [9, 101.25]
  - - [4096, 1024, 1, 512, 4096, 4096, 512, 512]
    - [9, 146.62]
  - - [4096, 1024, 1, 1024, 4096, 4096, 1024, 1024]
    - [56, 202.98]
  - - [4096, 1024, 1, 2048, 4096, 4096, 2048, 2048]
    - [56, 239.54]
  - - [4096, 1024, 1, 4096, 4096, 4096, 4096, 4096]
    - [57, 261.81]
  - - [4096, 1024, 1, 8192, 4096, 4096, 8192, 8192]
    - [71, 260.33]
  - - [4096, 2048, 1, 128, 4096, 4096, 128, 128]
    - [10, 63.58]
  - - [4096, 2048, 1, 256, 4096, 4096, 256, 256]
    - [0, 110.85]
  - - [4096, 2048, 1, 512, 4096, 4096, 512, 512]
    - [5, 166.34]
  - - [4096, 2048, 1, 1024, 4096, 4096, 1024, 1024]
    - [6, 220.14]
  - - [4096, 2048, 1, 2048, 4096, 4096, 2048, 2048]
    - [5, 256.74]
  - - [4096, 2048, 1, 4096, 4096, 4096, 4096, 4096]
    - [59, 282.77]
  - - [4096, 2048, 1, 8192, 4096, 4096, 8192, 8192]
    - [59, 306.41]
  - - [4096, 4096, 1, 128, 4096, 4096, 128, 128]
    - [9, 71.72]
  - - [4096, 4096, 1, 256, 4096, 4096, 256, 256]
    - [10, 119.15]
  - - [4096, 4096, 1, 512, 4096, 4096, 512, 512]
    - [4, 175.24]
  - - [4096, 4096, 1, 1024, 4096, 4096, 1024, 1024]
    - [5, 228.79]
  - - [4096, 4096, 1, 2048, 4096, 4096, 2048, 2048]
    - [51, 260.5]
  - - [4096, 4096, 1, 4096, 4096, 4096, 4096, 4096]
    - [59, 287.28]
  - - [4096, 4096, 1, 8192, 4096, 4096, 8192, 8192]
    - [61, 326.93]
  - - [4096, 8192, 1, 128, 4096, 4096, 128, 128]
    - [47, 80.39]
  - - [4096, 8192, 1, 256, 4096, 4096, 256, 256]
    - [54, 137.56]
  - - [4096, 8192, 1, 512, 4096, 4096, 512, 512]
    - [50, 202.77]
  - - [4096, 8192, 1, 1024, 4096, 4096, 1024, 1024]
    - [49, 252.19]
  - - [4096, 8192, 1, 2048, 4096, 4096, 2048, 2048]
    - [53, 295.53]
  - - [4096, 8192, 1, 4096, 4096, 4096, 4096, 4096]
    - [53, 328.22]
  - - [4096, 8192, 1, 8192, 4096, 4096, 8192, 8192]
    - [51, 382.8]
  - - [8192, 128, 1, 128, 8192, 8192, 128, 128]
    - [18, 27.46]
  - - [8192, 128, 1, 256, 8192, 8192, 256, 256]
    - [29, 48.54]
  - - [8192, 128, 1, 512, 8192, 8192, 512, 512]
    - [29, 81.08]
  - - [8192, 128, 1, 1024, 8192, 8192, 1024, 1024]
    - [29, 118.97]
  - - [8192, 128, 1, 2048, 8192, 8192, 2048, 2048]
    - [32, 158.1]
  - - [8192, 128, 1, 4096, 8192, 8192, 4096, 4096]
    - [111, 165.56]
  - - [8192, 128, 1, 8192, 8192, 8192, 8192, 8192]
    - [110, 181.27]
  - - [8192, 256, 1, 128, 8192, 8192, 128, 128]
    - [15, 40.59]
  - - [8192, 256, 1, 256, 8192, 8192, 256, 256]
    - [15, 72.76]
  - - [8192, 256, 1, 512, 8192, 8192, 512, 512]
    - [15, 119.29]
  - - [8192, 256, 1, 1024, 8192, 8192, 1024, 1024]
    - [16, 175.08]
  - - [8192, 256, 1, 2048, 8192, 8192, 2048, 2048]
    - [66, 215.39]
  - - [8192, 256, 1, 4096, 8192, 8192, 4096, 4096]
    - [76, 219.8]
  - - [8192, 256, 1, 8192, 8192, 8192, 8192, 8192]
    - [65, 238.4]
  - - [8192, 512, 1, 128, 8192, 8192, 128, 128]
    - [10, 56.18]
  - - [8192, 512, 1, 256, 8192, 8192, 256, 256]
    - [9, 95.83]
  - - [8192, 512, 1, 512, 8192, 8192, 512, 512]
    - [70, 154.79]
  - - [8192, 512, 1, 1024, 8192, 8192, 1024, 1024]
    - [57, 202.83]
  - - [8192, 512, 1, 2048, 8192, 8192, 2048, 2048]
    - [56, 237.99]
  - - [8192, 512, 1, 4096, 8192, 8192, 4096, 4096]
    - [71, 272.09]
  - - [8192, 512, 1, 8192, 8192, 8192, 8192, 8192]
    - [70, 321.1]
  - - [8192, 1024, 1, 128, 8192, 8192, 128, 128]
    - [10, 61.35]
  - - [8192, 1024, 1, 256, 8192, 8192, 256, 256]
    - [62, 109.88]
  - - [8192, 1024, 1, 512, 8192, 8192, 512, 512]
    - [62, 167.8]
  - - [8192, 1024, 1, 1024, 8192, 8192, 1024, 1024]
    - [7, 217.27]
  - - [8192, 1024, 1, 2048, 8192, 8192, 2048, 2048]
    - [60, 279.02]
  - - [8192, 1024, 1, 4096, 8192, 8192, 4096, 4096]
    - [61, 348.89]
  - - [8192, 1024, 1, 8192, 8192, 8192, 8192, 8192]
    - [61, 382.25]
  - - [8192, 2048, 1, 128, 8192, 8192, 128, 128]
    - [11, 68.12]
  - - [8192, 2048, 1, 256, 8192, 8192, 256, 256]
    - [9, 117.52]
  - - [8192, 2048, 1, 512, 8192, 8192, 512, 512]
    - [5, 170.79]
  - - [8192, 2048, 1, 1024, 8192, 8192, 1024, 1024]
    - [62, 238.61]
  - - [8192, 2048, 1, 2048, 8192, 8192, 2048, 2048]
    - [61, 301.33]
  - - [8192, 2048, 1, 4096, 8192, 8192, 4096, 4096]
    - [60, 338.66]
  - - [8192, 2048, 1, 8192, 8192, 8192, 8192, 8192]
    - [60, 395.78]
  - - [8192, 4096, 1, 128, 8192, 8192, 128, 128]
    - [9, 75.7]
  - - [8192, 4096, 1, 256, 8192, 8192, 256, 256]
    - [1, 121.52]
  - - [8192, 4096, 1, 512, 8192, 8192, 512, 512]
    - [62, 178.43]
  - - [8192, 4096, 1, 1024, 8192, 8192, 1024, 1024]
    - [62, 237.14]
  - - [8192, 4096, 1, 2048, 8192, 8192, 2048, 2048]
    - [60, 297.94]
  - - [8192, 4096, 1, 4096, 8192, 8192, 4096, 4096]
    - [61, 345.66]
  - - [8192, 4096, 1, 8192, 8192, 8192, 8192, 8192]
    - [60, 420.24]
  - - [8192, 8192, 1, 128, 8192, 8192, 128, 128]
    - [47, 79.02]
  - - [8192, 8192, 1, 256, 8192, 8192, 256, 256]
    - [48, 126.42]
  - - [8192, 8192, 1, 512, 8192, 8192, 512, 512]
    - [54, 181.08]
  - - [8192, 8192, 1, 1024, 8192, 8192, 1024, 1024]
    - [47, 240.95]
  - - [8192, 8192, 1, 2048, 8192, 8192, 2048, 2048]
    - [61, 298.72]
  - - [8192, 8192, 1, 4096, 8192, 8192, 4096, 4096]
    - [61, 355.33]
  - - [8192, 8192, 1, 8192, 8192, 8192, 8192, 8192]
    - [61, 403.37]
  - - [1, 1, 1, 32, 1, 1, 32, 32]
    - [118, 0.0]
- null
- null
- ExperimentalStreamK
- GridBased
