projects/hipblaslt/library/src/amd_detail/rocblaslt/src/Tensile/Logic/asm_full/aquavanjaram/gfx942_228cu/StreamK/aquavanjaram942_Cijk_Alik_Bjlk_B8F8NF8NS_BH_Bias_HAS_SAV_UserArgs.yaml
- {MinimumRequiredVersion: 4.33.0}
- aquavanjaram942
- {Architecture: gfx942, CUCount: 228}
- [Device 0049, Device 0050]
    SolutionIndex: 0
    SolutionNameMin: Cijk_Alik_Bjlk_B8F8NF8NS_BH_Bias_HAS_SAV_UserArgs_MT256x256x64_MI16x16x1_SN_LDSB1_CLR1_GRVWA8_GRVWB8_GSU0_GSUC0_GSUWGMRR0_K1_LBSPPA512_LBSPPB2048_LPA8_LPB0_LRVW8_MIWT8_8_PLR1_SU0_SUM0_SUS64_VWA8_VWB8_WGM1_WGMXCC1_WGMXCCGn1
    SolutionIndex: 1
    SolutionNameMin: Cijk_Alik_Bjlk_B8F8NF8NS_BH_Bias_HAS_SAV_UserArgs_MT256x256x64_MI16x16x1_SN_LDSB1_CLR1_GRVWA8_GRVWB16_GSU0_GSUC0_GSUWGMRR0_K1_LBSPPA512_LBSPPB2048_LPA8_LPB0_LRVW8_MIWT8_8_PLR1_SU0_SUM0_SUS64_VWA8_VWB8_WGM1_WGMXCC1_WGMXCCGn1
    SolutionIndex: 2
    SolutionNameMin: Cijk_Alik_Bjlk_B8F8NF8NS_BH_Bias_HAS_SAV_UserArgs_MT256x256x64_MI16x16x1_SN_LDSB1_CLR1_GRVWA8_GRVWB16_GSU0_GSUC0_GSUWGMRR0_K1_LBSPPA512_LBSPPB2048_LPA8_LPB0_LRVW8_MIWT8_8_PLR1_SU0_SUM0_SUS64_VWA8_VWB8_WGM4_WGMXCC1_WGMXCCGn1
    SolutionIndex: 3
    SolutionNameMin: Cijk_Alik_Bjlk_B8F8NF8NS_BH_Bias_HAS_SAV_UserArgs_MT256x256x64_MI16x16x1_SN_LDSB1_CLR1_GRVWA16_GRVWB16_GSU0_GSUC0_GSUWGMRR0_K1_LBSPPA512_LBSPPB2048_LPA16_LPB0_LRVW8_MIWT8_8_PLR1_SU0_SUM0_SUS64_VWA8_VWB8_WGM4_WGMXCC1_WGMXCCGn1
    SolutionIndex: 4
    SolutionNameMin: Cijk_Alik_Bjlk_B8F8NF8NS_BH_Bias_HAS_SAV_UserArgs_MT256x256x64_MI16x16x1_SN_LDSB1_CLR1_GRVWA16_GRVWB8_GSU0_GSUC0_GSUWGMRR0_K1_LBSPPA512_LBSPPB2048_LPA16_LPB0_LRVW8_MIWT8_8_PLR1_SU0_SUM0_SUS64_VWA8_VWB8_WGM6_WGMXCC1_WGMXCCGn1
    SolutionIndex: 5
    SolutionNameMin: Cijk_Alik_Bjlk_B8F8NF8NS_BH_Bias_HAS_SAV_UserArgs_MT256x256x64_MI16x16x1_SN_LDSB1_CLR1_GRVWA8_GRVWB16_GSU0_GSUC0_GSUWGMRR0_K1_LBSPPA512_LBSPPB2048_LPA8_LPB0_LRVW8_MIWT8_8_PLR1_SU0_SUM0_SUS64_VWA8_VWB8_WGM6_WGMXCC1_WGMXCCGn1
    SolutionIndex: 6
    SolutionNameMin: Cijk_Alik_Bjlk_B8F8NF8NS_BH_Bias_HAS_SAV_UserArgs_MT256x256x64_MI16x16x1_SN_LDSB1_CLR1_GRVWA8_GRVWB16_GSU0_GSUC0_GSUWGMRR0_K1_LBSPPA512_LBSPPB2048_LPA8_LPB0_LRVW8_MIWT8_8_PLR1_SU0_SUM0_SUS64_VWA8_VWB8_WGM8_WGMXCC1_WGMXCCGn1
    SolutionIndex: 7
    SolutionNameMin: Cijk_Alik_Bjlk_B8F8NF8NS_BH_Bias_HAS_SAV_UserArgs_MT256x256x64_MI16x16x1_SN_LDSB1_CLR1_GRVWA16_GRVWB16_GSU0_GSUC0_GSUWGMRR0_K1_LBSPPA512_LBSPPB2048_LPA16_LPB0_LRVW8_MIWT8_8_PLR1_SU0_SUM0_SUS64_VWA8_VWB8_WGM8_WGMXCC1_WGMXCCGn1
    SolutionIndex: 8
    SolutionNameMin: Cijk_Alik_Bjlk_B8F8NF8NS_BH_Bias_HAS_SAV_UserArgs_MT128x256x64_MI16x16x1_SN_LDSB1_CLR1_GRVWA8_GRVWB16_GSU0_GSUC0_GSUWGMRR0_K1_LBSPPA256_LBSPPB2048_LPA8_LPB0_LRVW8_MIWT4_8_PLR1_SU0_SUM0_SUS64_VWA4_VWB8_WGM1_WGMXCC1_WGMXCCGn1
    SolutionIndex: 9
    SolutionNameMin: Cijk_Alik_Bjlk_B8F8NF8NS_BH_Bias_HAS_SAV_UserArgs_MT128x256x64_MI16x16x1_SN_LDSB1_CLR1_GRVWA16_GRVWB16_GSU0_GSUC0_GSUWGMRR0_K1_LBSPPA256_LBSPPB2048_LPA16_LPB0_LRVW8_MIWT4_8_PLR1_SU0_SUM0_SUS64_VWA4_VWB8_WGM1_WGMXCC1_WGMXCCGn1
    SolutionIndex: 10
    SolutionNameMin: Cijk_Alik_Bjlk_B8F8NF8NS_BH_Bias_HAS_SAV_UserArgs_MT128x256x64_MI16x16x1_SN_LDSB1_CLR1_GRVWA16_GRVWB16_GSU0_GSUC0_GSUWGMRR0_K1_LBSPPA256_LBSPPB2048_LPA16_LPB0_LRVW8_MIWT4_8_PLR1_SU0_SUM0_SUS64_VWA4_VWB8_WGM4_WGMXCC1_WGMXCCGn1
    SolutionIndex: 11
    SolutionNameMin: Cijk_Alik_Bjlk_B8F8NF8NS_BH_Bias_HAS_SAV_UserArgs_MT256x128x64_MI16x16x1_SN_LDSB1_CLR1_GRVWA8_GRVWB8_GSU0_GSUC0_GSUWGMRR0_K1_LBSPPA512_LBSPPB1024_LPA8_LPB64_LRVW8_MIWT8_4_PLR1_SU0_SUM0_SUS64_VWA8_VWB4_WGM1_WGMXCC1_WGMXCCGn1
    SolutionIndex: 12
    SolutionNameMin: Cijk_Alik_Bjlk_B8F8NF8NS_BH_Bias_HAS_SAV_UserArgs_MT256x128x64_MI16x16x1_SN_LDSB1_CLR1_GRVWA16_GRVWB8_GSU0_GSUC0_GSUWGMRR0_K1_LBSPPA512_LBSPPB1024_LPA16_LPB64_LRVW8_MIWT8_4_PLR1_SU0_SUM0_SUS64_VWA8_VWB4_WGM1_WGMXCC1_WGMXCCGn1
    SolutionIndex: 13
    SolutionNameMin: Cijk_Alik_Bjlk_B8F8NF8NS_BH_Bias_HAS_SAV_UserArgs_MT256x128x64_MI16x16x1_SN_LDSB1_CLR1_GRVWA8_GRVWB16_GSU0_GSUC0_GSUWGMRR0_K1_LBSPPA512_LBSPPB1024_LPA8_LPB64_LRVW8_MIWT8_4_PLR1_SU0_SUM0_SUS64_VWA8_VWB4_WGM1_WGMXCC1_WGMXCCGn1
    SolutionIndex: 14
    SolutionNameMin: Cijk_Alik_Bjlk_B8F8NF8NS_BH_Bias_HAS_SAV_UserArgs_MT256x128x64_MI16x16x1_SN_LDSB1_CLR1_GRVWA16_GRVWB16_GSU0_GSUC0_GSUWGMRR0_K1_LBSPPA512_LBSPPB1024_LPA16_LPB64_LRVW8_MIWT8_4_PLR1_SU0_SUM0_SUS64_VWA8_VWB4_WGM1_WGMXCC1_WGMXCCGn1
    SolutionIndex: 15
    SolutionNameMin: Cijk_Alik_Bjlk_B8F8NF8NS_BH_Bias_HAS_SAV_UserArgs_MT256x128x64_MI16x16x1_SN_LDSB1_CLR1_GRVWA8_GRVWB16_GSU0_GSUC0_GSUWGMRR0_K1_LBSPPA512_LBSPPB1024_LPA8_LPB64_LRVW8_MIWT8_4_PLR1_SU0_SUM0_SUS64_VWA8_VWB4_WGM4_WGMXCC1_WGMXCCGn1
    SolutionIndex: 16
    SolutionNameMin: Cijk_Alik_Bjlk_B8F8NF8NS_BH_Bias_HAS_SAV_UserArgs_MT256x128x64_MI16x16x1_SN_LDSB1_CLR1_GRVWA16_GRVWB8_GSU0_GSUC0_GSUWGMRR0_K1_LBSPPA512_LBSPPB1024_LPA16_LPB64_LRVW8_MIWT8_4_PLR1_SU0_SUM0_SUS64_VWA8_VWB4_WGM6_WGMXCC1_WGMXCCGn1
    SolutionIndex: 17
    SolutionNameMin: Cijk_Alik_Bjlk_B8F8NF8NS_BH_Bias_HAS_SAV_UserArgs_MT256x128x64_MI16x16x1_SN_LDSB1_CLR1_GRVWA16_GRVWB8_GSU0_GSUC0_GSUWGMRR0_K1_LBSPPA512_LBSPPB1024_LPA16_LPB64_LRVW8_MIWT8_4_PLR1_SU0_SUM0_SUS64_VWA8_VWB4_WGM8_WGMXCC1_WGMXCCGn1
    SolutionIndex: 18
    SolutionNameMin: Cijk_Alik_Bjlk_B8F8NF8NS_BH_Bias_HAS_SAV_UserArgs_MT256x128x64_MI16x16x1_SN_LDSB1_CLR1_GRVWA8_GRVWB16_GSU0_GSUC0_GSUWGMRR0_K1_LBSPPA512_LBSPPB1024_LPA8_LPB64_LRVW8_MIWT8_4_PLR1_SU0_SUM0_SUS64_VWA8_VWB4_WGM8_WGMXCC1_WGMXCCGn1
    SolutionIndex: 19
    SolutionNameMin: Cijk_Alik_Bjlk_B8F8NF8NS_BH_Bias_HAS_SAV_UserArgs_MT128x128x64_MI16x16x1_SN_LDSB1_CLR1_GRVWA8_GRVWB16_GSU0_GSUC0_GSUWGMRR0_K1_LBSPPA512_LBSPPB1024_LPA8_LPB32_LRVW8_MIWT8_2_PLR1_SU0_SUM0_SUS64_VWA8_VWB2_WGM1_WGMXCC1_WGMXCCGn1
    SolutionIndex: 20
    SolutionNameMin: Cijk_Alik_Bjlk_B8F8NF8NS_BH_Bias_HAS_SAV_UserArgs_MT128x64x64_MI16x16x1_SN_LDSB0_CLR1_GRVWA8_GRVWB8_GSU0_GSUC0_GSUWGMRR0_K1_LBSPPA512_LBSPPB512_LPA8_LPB16_LRVW8_MIWT8_1_PLR1_SU0_SUM0_SUS64_VWA8_VWB1_WGM1_WGMXCC1_WGMXCCGn1
    SolutionIndex: 21
    SolutionNameMin: Cijk_Alik_Bjlk_B8F8NF8NS_BH_Bias_HAS_SAV_UserArgs_MT128x128x64_MI16x16x1_SN_LDSB1_CLR1_GRVWA8_GRVWB8_GSU0_GSUC0_GSUWGMRR0_K1_LBSPPA256_LBSPPB1024_LPA8_LPB64_LRVW8_MIWT4_4_PLR1_SU0_SUM0_SUS64_VWA4_VWB4_WGM1_WGMXCC1_WGMXCCGn1
    SolutionIndex: 22
    SolutionNameMin: Cijk_Alik_Bjlk_B8F8NF8NS_BH_Bias_HAS_SAV_UserArgs_MT128x128x64_MI16x16x1_SN_LDSB1_CLR1_GRVWA16_GRVWB8_GSU0_GSUC0_GSUWGMRR0_K1_LBSPPA256_LBSPPB1024_LPA16_LPB64_LRVW8_MIWT4_4_PLR1_SU0_SUM0_SUS64_VWA4_VWB4_WGM1_WGMXCC1_WGMXCCGn1
    SolutionIndex: 23
    SolutionNameMin: Cijk_Alik_Bjlk_B8F8NF8NS_BH_Bias_HAS_SAV_UserArgs_MT128x128x64_MI16x16x1_SN_LDSB1_CLR1_GRVWA8_GRVWB16_GSU0_GSUC0_GSUWGMRR0_K1_LBSPPA256_LBSPPB1024_LPA8_LPB64_LRVW8_MIWT4_4_PLR1_SU0_SUM0_SUS64_VWA4_VWB4_WGM1_WGMXCC1_WGMXCCGn1
    SolutionIndex: 24
    SolutionNameMin: Cijk_Alik_Bjlk_B8F8NF8NS_BH_Bias_HAS_SAV_UserArgs_MT128x128x64_MI16x16x1_SN_LDSB1_CLR1_GRVWA16_GRVWB16_GSU0_GSUC0_GSUWGMRR0_K1_LBSPPA256_LBSPPB1024_LPA16_LPB64_LRVW8_MIWT4_4_PLR1_SU0_SUM0_SUS64_VWA4_VWB4_WGM1_WGMXCC1_WGMXCCGn1
    SolutionIndex: 25
    SolutionNameMin: Cijk_Alik_Bjlk_B8F8NF8NS_BH_Bias_HAS_SAV_UserArgs_MT64x128x64_MI16x16x1_SN_LDSB0_CLR1_GRVWA16_GRVWB16_GSU0_GSUC0_GSUWGMRR0_K1_LBSPPA128_LBSPPB1024_LPA16_LPB64_LRVW8_MIWT2_4_PLR1_SU0_SUM0_SUS64_VWA2_VWB4_WGM4_WGMXCC1_WGMXCCGn1
    SolutionIndex: 26
    SolutionNameMin: Cijk_Alik_Bjlk_B8F8NF8NS_BH_Bias_HAS_SAV_UserArgs_MT128x64x64_MI16x16x1_SN_LDSB0_CLR1_GRVWA16_GRVWB8_GSU0_GSUC0_GSUWGMRR0_K1_LBSPPA256_LBSPPB512_LPA16_LPB32_LRVW8_MIWT4_2_PLR1_SU0_SUM0_SUS64_VWA4_VWB2_WGM1_WGMXCC1_WGMXCCGn1
    SolutionIndex: 27
    SolutionNameMin: Cijk_Alik_Bjlk_B8F8NF8NS_BH_Bias_HAS_SAV_UserArgs_MT128x64x64_MI16x16x1_SN_LDSB0_CLR1_GRVWA8_GRVWB16_GSU0_GSUC0_GSUWGMRR0_K1_LBSPPA256_LBSPPB512_LPA8_LPB32_LRVW8_MIWT4_2_PLR1_SU0_SUM0_SUS64_VWA4_VWB2_WGM1_WGMXCC1_WGMXCCGn1
    SolutionIndex: 28
    SolutionNameMin: Cijk_Alik_Bjlk_B8F8NF8NS_BH_Bias_HAS_SAV_UserArgs_MT128x64x64_MI16x16x1_SN_LDSB0_CLR1_GRVWA16_GRVWB16_GSU0_GSUC0_GSUWGMRR0_K1_LBSPPA256_LBSPPB512_LPA16_LPB32_LRVW8_MIWT4_2_PLR1_SU0_SUM0_SUS64_VWA4_VWB2_WGM1_WGMXCC1_WGMXCCGn1
    SolutionIndex: 29
    SolutionNameMin: Cijk_Alik_Bjlk_B8F8NF8NS_BH_Bias_HAS_SAV_UserArgs_MT128x64x64_MI16x16x1_SN_LDSB0_CLR1_GRVWA8_GRVWB8_GSU0_GSUC0_GSUWGMRR0_K1_LBSPPA256_LBSPPB512_LPA8_LPB32_LRVW8_MIWT4_2_PLR1_SU0_SUM0_SUS64_VWA4_VWB2_WGM4_WGMXCC1_WGMXCCGn1
    SolutionIndex: 30
    SolutionNameMin: Cijk_Alik_Bjlk_B8F8NF8NS_BH_Bias_HAS_SAV_UserArgs_MT128x64x64_MI16x16x1_SN_LDSB0_CLR1_GRVWA8_GRVWB16_GSU0_GSUC0_GSUWGMRR0_K1_LBSPPA256_LBSPPB512_LPA8_LPB32_LRVW8_MIWT4_2_PLR1_SU0_SUM0_SUS64_VWA4_VWB2_WGM4_WGMXCC1_WGMXCCGn1
    SolutionIndex: 31
    SolutionNameMin: Cijk_Alik_Bjlk_B8F8NF8NS_BH_Bias_HAS_SAV_UserArgs_MT128x64x64_MI16x16x1_SN_LDSB0_CLR1_GRVWA8_GRVWB16_GSU0_GSUC0_GSUWGMRR0_K1_LBSPPA256_LBSPPB512_LPA8_LPB32_LRVW8_MIWT4_2_PLR1_SU0_SUM0_SUS64_VWA4_VWB2_WGM6_WGMXCC1_WGMXCCGn1
    SolutionIndex: 32
    SolutionNameMin: Cijk_Alik_Bjlk_B8F8NF8NS_BH_Bias_HAS_SAV_UserArgs_MT128x64x64_MI16x16x1_SN_LDSB0_CLR1_GRVWA8_GRVWB16_GSU0_GSUC0_GSUWGMRR0_K1_LBSPPA256_LBSPPB512_LPA8_LPB32_LRVW8_MIWT4_2_PLR1_SU0_SUM0_SUS64_VWA4_VWB2_WGM8_WGMXCC1_WGMXCCGn1
    SolutionIndex: 33
    SolutionNameMin: Cijk_Alik_Bjlk_B8F8NF8NS_BH_Bias_HAS_SAV_UserArgs_MT128x64x64_MI16x16x1_SN_LDSB0_CLR1_GRVWA16_GRVWB16_GSU0_GSUC0_GSUWGMRR0_K1_LBSPPA256_LBSPPB512_LPA16_LPB32_LRVW8_MIWT4_2_PLR1_SU0_SUM0_SUS64_VWA4_VWB2_WGM8_WGMXCC1_WGMXCCGn1
    SolutionIndex: 34
    SolutionNameMin: Cijk_Alik_Bjlk_B8F8NF8NS_BH_Bias_HAS_SAV_UserArgs_MT128x32x64_MI16x16x1_SN_LDSB0_CLR1_GRVWA8_GRVWB8_GSU0_GSUC0_GSUWGMRR0_K1_LBSPPA256_LBSPPB256_LPA8_LPB16_LRVW8_MIWT4_1_PLR1_SU0_SUM0_SUS64_VWA4_VWB1_WGM1_WGMXCC1_WGMXCCGn1
    SolutionIndex: 35
    SolutionNameMin: Cijk_Alik_Bjlk_B8F8NF8NS_BH_Bias_HAS_SAV_UserArgs_MT128x32x64_MI16x16x1_SN_LDSB0_CLR1_GRVWA16_GRVWB8_GSU0_GSUC0_GSUWGMRR0_K1_LBSPPA256_LBSPPB256_LPA16_LPB16_LRVW8_MIWT4_1_PLR1_SU0_SUM0_SUS64_VWA4_VWB1_WGM1_WGMXCC1_WGMXCCGn1
    SolutionIndex: 36
    SolutionNameMin: Cijk_Alik_Bjlk_B8F8NF8NS_BH_Bias_HAS_SAV_UserArgs_MT64x64x64_MI16x16x1_SN_LDSB0_CLR1_GRVWA8_GRVWB8_GSU0_GSUC0_GSUWGMRR0_K1_LBSPPA128_LBSPPB512_LPA8_LPB32_LRVW8_MIWT2_2_PLR1_SU0_SUM0_SUS64_VWA2_VWB2_WGM1_WGMXCC1_WGMXCCGn1
    SolutionIndex: 37
    SolutionNameMin: Cijk_Alik_Bjlk_B8F8NF8NS_BH_Bias_HAS_SAV_UserArgs_MT64x64x64_MI16x16x1_SN_LDSB0_CLR1_GRVWA16_GRVWB8_GSU0_GSUC0_GSUWGMRR0_K1_LBSPPA128_LBSPPB512_LPA16_LPB32_LRVW8_MIWT2_2_PLR1_SU0_SUM0_SUS64_VWA2_VWB2_WGM1_WGMXCC1_WGMXCCGn1
    SolutionIndex: 38
    SolutionNameMin: Cijk_Alik_Bjlk_B8F8NF8NS_BH_Bias_HAS_SAV_UserArgs_MT64x64x64_MI16x16x1_SN_LDSB0_CLR1_GRVWA16_GRVWB16_GSU0_GSUC0_GSUWGMRR0_K1_LBSPPA128_LBSPPB512_LPA16_LPB32_LRVW8_MIWT2_2_PLR1_SU0_SUM0_SUS64_VWA2_VWB2_WGM1_WGMXCC1_WGMXCCGn1
    SolutionIndex: 39
    SolutionNameMin: Cijk_Alik_Bjlk_B8F8NF8NS_BH_Bias_HAS_SAV_UserArgs_MT64x64x64_MI16x16x1_SN_LDSB0_CLR1_GRVWA8_GRVWB16_GSU0_GSUC0_GSUWGMRR0_K1_LBSPPA128_LBSPPB512_LPA8_LPB32_LRVW8_MIWT2_2_PLR1_SU0_SUM0_SUS64_VWA2_VWB2_WGM4_WGMXCC1_WGMXCCGn1
    SolutionIndex: 40
    SolutionNameMin: Cijk_Alik_Bjlk_B8F8NF8NS_BH_Bias_HAS_SAV_UserArgs_MT64x64x64_MI16x16x1_SN_LDSB0_CLR1_GRVWA8_GRVWB16_GSU0_GSUC0_GSUWGMRR0_K1_LBSPPA128_LBSPPB512_LPA8_LPB32_LRVW8_MIWT2_2_PLR1_SU0_SUM0_SUS64_VWA2_VWB2_WGM8_WGMXCC1_WGMXCCGn1
    SolutionIndex: 41
    SolutionNameMin: Cijk_Alik_Bjlk_B8F8NF8NS_BH_Bias_HAS_SAV_UserArgs_MT32x64x64_MI16x16x1_SN_LDSB0_CLR1_GRVWA8_GRVWB8_GSU0_GSUC0_GSUWGMRR0_K1_LBSPPA128_LBSPPB512_LPA8_LPB32_LRVW8_MIWT1_2_PLR1_SU0_SUM0_SUS64_VWA1_VWB2_WGM1_WGMXCC1_WGMXCCGn1
    SolutionIndex: 42
    SolutionNameMin: Cijk_Alik_Bjlk_B8F8NF8NS_BH_Bias_HAS_SAV_UserArgs_MT64x32x64_MI16x16x1_SN_LDSB0_CLR1_GRVWA8_GRVWB8_GSU0_GSUC0_GSUWGMRR0_K1_LBSPPA128_LBSPPB256_LPA8_LPB16_LRVW8_MIWT2_1_PLR1_SU0_SUM0_SUS64_VWA2_VWB1_WGM1_WGMXCC1_WGMXCCGn1
    SolutionIndex: 43
    SolutionNameMin: Cijk_Alik_Bjlk_B8F8NF8NS_BH_Bias_HAS_SAV_UserArgs_MT64x32x64_MI16x16x1_SN_LDSB0_CLR1_GRVWA8_GRVWB8_GSU0_GSUC0_GSUWGMRR0_K1_LBSPPA128_LBSPPB256_LPA8_LPB16_LRVW8_MIWT2_1_PLR1_SU0_SUM0_SUS64_VWA2_VWB1_WGM4_WGMXCC1_WGMXCCGn1
    SolutionIndex: 44
    SolutionNameMin: Cijk_Alik_Bjlk_B8F8NF8NS_BH_Bias_HAS_SAV_UserArgs_MT32x32x64_MI16x16x1_SN_LDSB0_CLR1_GRVWA8_GRVWB8_GSU0_GSUC0_GSUWGMRR0_K1_LBSPPA128_LBSPPB256_LPA8_LPB16_LRVW8_MIWT1_1_PLR1_SU0_SUM0_SUS64_VWA1_VWB1_WGM1_WGMXCC1_WGMXCCGn1
    SolutionIndex: 45
    SolutionNameMin: Cijk_Alik_Bjlk_B8F8NF8NS_BH_Bias_HAS_SAV_UserArgs_MT32x32x64_MI16x16x1_SN_LDSB0_CLR1_GRVWA8_GRVWB8_GSU0_GSUC0_GSUWGMRR0_K1_LBSPPA128_LBSPPB256_LPA8_LPB16_LRVW8_MIWT1_1_PLR1_SU0_SUM0_SUS64_VWA1_VWB1_WGM6_WGMXCC1_WGMXCCGn1
    SolutionIndex: 46
    SolutionNameMin: Cijk_Alik_Bjlk_B8F8NF8NS_BH_Bias_HAS_SAV_UserArgs_MT128x256x128_MI16x16x1_SN_LDSB1_CLR1_GRVWA8_GRVWB16_GSU0_GSUC0_GSUWGMRR0_K1_LBSPPA512_LBSPPB2048_LPA8_LPB0_LRVW8_MIWT4_8_PLR1_SU0_SUM0_SUS128_VWA4_VWB8_WGM1_WGMXCC1_WGMXCCGn1
    SolutionIndex: 47
    SolutionNameMin: Cijk_Alik_Bjlk_B8F8NF8NS_BH_Bias_HAS_SAV_UserArgs_MT128x256x128_MI16x16x1_SN_LDSB1_CLR1_GRVWA8_GRVWB16_GSU0_GSUC0_GSUWGMRR0_K1_LBSPPA512_LBSPPB2048_LPA8_LPB0_LRVW8_MIWT4_8_PLR1_SU0_SUM0_SUS128_VWA4_VWB8_WGM4_WGMXCC1_WGMXCCGn1
    SolutionIndex: 48
    SolutionNameMin: Cijk_Alik_Bjlk_B8F8NF8NS_BH_Bias_HAS_SAV_UserArgs_MT128x256x128_MI16x16x1_SN_LDSB1_CLR1_GRVWA16_GRVWB16_GSU0_GSUC0_GSUWGMRR0_K1_LBSPPA512_LBSPPB2048_LPA16_LPB0_LRVW8_MIWT4_8_PLR1_SU0_SUM0_SUS128_VWA4_VWB8_WGM4_WGMXCC1_WGMXCCGn1
    SolutionIndex: 49
    SolutionNameMin: Cijk_Alik_Bjlk_B8F8NF8NS_BH_Bias_HAS_SAV_UserArgs_MT128x256x128_MI16x16x1_SN_LDSB1_CLR1_GRVWA8_GRVWB16_GSU0_GSUC0_GSUWGMRR0_K1_LBSPPA512_LBSPPB2048_LPA8_LPB0_LRVW8_MIWT4_8_PLR1_SU0_SUM0_SUS128_VWA4_VWB8_WGM6_WGMXCC1_WGMXCCGn1
    SolutionIndex: 50
    SolutionNameMin: Cijk_Alik_Bjlk_B8F8NF8NS_BH_Bias_HAS_SAV_UserArgs_MT128x256x128_MI16x16x1_SN_LDSB1_CLR1_GRVWA8_GRVWB16_GSU0_GSUC0_GSUWGMRR0_K1_LBSPPA512_LBSPPB2048_LPA8_LPB0_LRVW8_MIWT4_8_PLR1_SU0_SUM0_SUS128_VWA4_VWB8_WGM8_WGMXCC1_WGMXCCGn1
    SolutionIndex: 51
    SolutionNameMin: Cijk_Alik_Bjlk_B8F8NF8NS_BH_Bias_HAS_SAV_UserArgs_MT128x256x128_MI16x16x1_SN_LDSB1_CLR1_GRVWA16_GRVWB16_GSU0_GSUC0_GSUWGMRR0_K1_LBSPPA512_LBSPPB2048_LPA16_LPB0_LRVW8_MIWT4_8_PLR1_SU0_SUM0_SUS128_VWA4_VWB8_WGM8_WGMXCC1_WGMXCCGn1
    SolutionIndex: 52
    SolutionNameMin: Cijk_Alik_Bjlk_B8F8NF8NS_BH_Bias_HAS_SAV_UserArgs_MT256x128x128_MI16x16x1_SN_LDSB1_CLR1_GRVWA8_GRVWB16_GSU0_GSUC0_GSUWGMRR0_K1_LBSPPA1024_LBSPPB1024_LPA8_LPB64_LRVW8_MIWT8_4_PLR1_SU0_SUM0_SUS128_VWA8_VWB4_WGM1_WGMXCC1_WGMXCCGn1
    SolutionIndex: 53
    SolutionNameMin: Cijk_Alik_Bjlk_B8F8NF8NS_BH_Bias_HAS_SAV_UserArgs_MT144x256x128_MI16x16x1_SN_LDSB1_CLR1_GRVWA8_GRVWB16_GSU0_GSUC0_GSUWGMRR0_K1_LBSPPA128_LBSPPB2048_LPA8_LPB64_LRVW8_MIWT9_4_PLR1_SU0_SUM0_SUS128_VWA1_VWB4_WGM4_WGMXCC1_WGMXCCGn1
    SolutionIndex: 54
    SolutionNameMin: Cijk_Alik_Bjlk_B8F8NF8NS_BH_Bias_HAS_SAV_UserArgs_MT144x256x128_MI16x16x1_SN_LDSB1_CLR1_GRVWA8_GRVWB16_GSU0_GSUC0_GSUWGMRR0_K1_LBSPPA128_LBSPPB2048_LPA8_LPB64_LRVW8_MIWT9_4_PLR1_SU0_SUM0_SUS128_VWA1_VWB4_WGM6_WGMXCC1_WGMXCCGn1
    SolutionIndex: 55
    SolutionNameMin: Cijk_Alik_Bjlk_B8F8NF8NS_BH_Bias_HAS_SAV_UserArgs_MT144x256x128_MI16x16x1_SN_LDSB1_CLR1_GRVWA8_GRVWB16_GSU0_GSUC0_GSUWGMRR0_K1_LBSPPA128_LBSPPB2048_LPA8_LPB64_LRVW8_MIWT9_4_PLR1_SU0_SUM0_SUS128_VWA1_VWB4_WGM8_WGMXCC1_WGMXCCGn1
    SolutionIndex: 56
    SolutionNameMin: Cijk_Alik_Bjlk_B8F8NF8NS_BH_Bias_HAS_SAV_UserArgs_MT144x128x128_MI16x16x1_SN_LDSB1_CLR1_GRVWA8_GRVWB16_GSU0_GSUC0_GSUWGMRR0_K1_LBSPPA128_LBSPPB1024_LPA8_LPB32_LRVW8_MIWT9_2_PLR1_SU0_SUM0_SUS128_VWA1_VWB2_WGM4_WGMXCC1_WGMXCCGn1
    SolutionIndex: 57
    SolutionNameMin: Cijk_Alik_Bjlk_B8F8NF8NS_BH_Bias_HAS_SAV_UserArgs_MT144x128x128_MI16x16x1_SN_LDSB1_CLR1_GRVWA8_GRVWB16_GSU0_GSUC0_GSUWGMRR0_K1_LBSPPA128_LBSPPB1024_LPA8_LPB32_LRVW8_MIWT9_2_PLR1_SU0_SUM0_SUS128_VWA1_VWB2_WGM6_WGMXCC1_WGMXCCGn1
    SolutionIndex: 58
    SolutionNameMin: Cijk_Alik_Bjlk_B8F8NF8NS_BH_Bias_HAS_SAV_UserArgs_MT144x128x128_MI16x16x1_SN_LDSB1_CLR1_GRVWA8_GRVWB16_GSU0_GSUC0_GSUWGMRR0_K1_LBSPPA128_LBSPPB1024_LPA8_LPB32_LRVW8_MIWT9_2_PLR1_SU0_SUM0_SUS128_VWA1_VWB2_WGM8_WGMXCC1_WGMXCCGn1
    SolutionIndex: 59
    SolutionNameMin: Cijk_Alik_Bjlk_B8F8NF8NS_BH_Bias_HAS_SAV_UserArgs_MT128x128x128_MI16x16x1_SN_LDSB1_CLR1_GRVWA16_GRVWB8_GSU0_GSUC0_GSUWGMRR0_K1_LBSPPA512_LBSPPB1024_LPA16_LPB64_LRVW8_MIWT4_4_PLR1_SU0_SUM0_SUS128_VWA4_VWB4_WGM1_WGMXCC1_WGMXCCGn1
    SolutionIndex: 60
    SolutionNameMin: Cijk_Alik_Bjlk_B8F8NF8NS_BH_Bias_HAS_SAV_UserArgs_MT128x128x128_MI16x16x1_SN_LDSB1_CLR1_GRVWA16_GRVWB16_GSU0_GSUC0_GSUWGMRR0_K1_LBSPPA512_LBSPPB1024_LPA16_LPB64_LRVW8_MIWT4_4_PLR1_SU0_SUM0_SUS128_VWA4_VWB4_WGM1_WGMXCC1_WGMXCCGn1
    SolutionIndex: 61
    SolutionNameMin: Cijk_Alik_Bjlk_B8F8NF8NS_BH_Bias_HAS_SAV_UserArgs_MT128x128x128_MI16x16x1_SN_LDSB1_CLR1_GRVWA16_GRVWB16_GSU0_GSUC0_GSUWGMRR0_K1_LBSPPA512_LBSPPB1024_LPA16_LPB64_LRVW8_MIWT4_4_PLR1_SU0_SUM0_SUS128_VWA4_VWB4_WGM4_WGMXCC1_WGMXCCGn1
    SolutionIndex: 62
    SolutionNameMin: Cijk_Alik_Bjlk_B8F8NF8NS_BH_Bias_HAS_SAV_UserArgs_MT128x128x128_MI16x16x1_SN_LDSB1_CLR1_GRVWA16_GRVWB16_GSU0_GSUC0_GSUWGMRR0_K1_LBSPPA512_LBSPPB1024_LPA16_LPB64_LRVW8_MIWT4_4_PLR1_SU0_SUM0_SUS128_VWA4_VWB4_WGM6_WGMXCC1_WGMXCCGn1
    SolutionIndex: 63
    SolutionNameMin: Cijk_Alik_Bjlk_B8F8NF8NS_BH_Bias_HAS_SAV_UserArgs_MT128x128x128_MI16x16x1_SN_LDSB1_CLR1_GRVWA8_GRVWB8_GSU0_GSUC0_GSUWGMRR0_K1_LBSPPA512_LBSPPB1024_LPA8_LPB64_LRVW8_MIWT4_4_PLR1_SU0_SUM0_SUS128_VWA4_VWB4_WGM8_WGMXCC1_WGMXCCGn1
    SolutionIndex: 64
    SolutionNameMin: Cijk_Alik_Bjlk_B8F8NF8NS_BH_Bias_HAS_SAV_UserArgs_MT128x128x128_MI16x16x1_SN_LDSB1_CLR1_GRVWA16_GRVWB16_GSU0_GSUC0_GSUWGMRR0_K1_LBSPPA512_LBSPPB1024_LPA16_LPB64_LRVW8_MIWT4_4_PLR1_SU0_SUM0_SUS128_VWA4_VWB4_WGM8_WGMXCC1_WGMXCCGn1
    SolutionIndex: 65
    SolutionNameMin: Cijk_Alik_Bjlk_B8F8NF8NS_BH_Bias_HAS_SAV_UserArgs_MT64x128x128_MI16x16x1_SN_LDSB1_CLR1_GRVWA8_GRVWB16_GSU0_GSUC0_GSUWGMRR0_K1_LBSPPA256_LBSPPB1024_LPA8_LPB64_LRVW8_MIWT2_4_PLR1_SU0_SUM0_SUS128_VWA2_VWB4_WGM1_WGMXCC1_WGMXCCGn1
    SolutionIndex: 66
    SolutionNameMin: Cijk_Alik_Bjlk_B8F8NF8NS_BH_Bias_HAS_SAV_UserArgs_MT64x128x128_MI16x16x1_SN_LDSB1_CLR1_GRVWA16_GRVWB16_GSU0_GSUC0_GSUWGMRR0_K1_LBSPPA256_LBSPPB1024_LPA16_LPB64_LRVW8_MIWT2_4_PLR1_SU0_SUM0_SUS128_VWA2_VWB4_WGM4_WGMXCC1_WGMXCCGn1
    SolutionIndex: 67
    SolutionNameMin: Cijk_Alik_Bjlk_B8F8NF8NS_BH_Bias_HAS_SAV_UserArgs_MT64x64x128_MI16x16x1_SN_LDSB1_CLR1_GRVWA16_GRVWB8_GSU0_GSUC0_GSUWGMRR0_K1_LBSPPA256_LBSPPB512_LPA16_LPB32_LRVW8_MIWT2_2_PLR1_SU0_SUM0_SUS128_VWA2_VWB2_WGM1_WGMXCC1_WGMXCCGn1
    SolutionIndex: 68
    SolutionNameMin: Cijk_Alik_Bjlk_B8F8NF8NS_BH_Bias_HAS_SAV_UserArgs_MT64x64x128_MI16x16x1_SN_LDSB1_CLR1_GRVWA8_GRVWB16_GSU0_GSUC0_GSUWGMRR0_K1_LBSPPA256_LBSPPB512_LPA8_LPB32_LRVW8_MIWT2_2_PLR1_SU0_SUM0_SUS128_VWA2_VWB2_WGM1_WGMXCC1_WGMXCCGn1
    SolutionIndex: 69
    SolutionNameMin: Cijk_Alik_Bjlk_B8F8NF8NS_BH_Bias_HAS_SAV_UserArgs_MT32x64x128_MI16x16x1_SN_LDSB0_CLR1_GRVWA8_GRVWB8_GSU0_GSUC0_GSUWGMRR0_K1_LBSPPA128_LBSPPB512_LPA8_LPB32_LRVW8_MIWT1_2_PLR1_SU0_SUM0_SUS128_VWA1_VWB2_WGM1_WGMXCC1_WGMXCCGn1
    SolutionIndex: 70
    SolutionNameMin: Cijk_Alik_Bjlk_B8F8NF8NS_BH_Bias_HAS_SAV_UserArgs_MT32x64x128_MI16x16x1_SN_LDSB0_CLR1_GRVWA8_GRVWB8_GSU0_GSUC0_GSUWGMRR0_K1_LBSPPA128_LBSPPB512_LPA8_LPB32_LRVW8_MIWT1_2_PLR1_SU0_SUM0_SUS128_VWA1_VWB2_WGM4_WGMXCC1_WGMXCCGn1
    SolutionIndex: 71
    SolutionNameMin: Cijk_Alik_Bjlk_B8F8NF8NS_BH_Bias_HAS_SAV_UserArgs_MT32x64x128_MI16x16x1_SN_LDSB0_CLR1_GRVWA8_GRVWB16_GSU0_GSUC0_GSUWGMRR0_K1_LBSPPA128_LBSPPB512_LPA8_LPB32_LRVW8_MIWT1_2_PLR1_SU0_SUM0_SUS128_VWA1_VWB2_WGM4_WGMXCC1_WGMXCCGn1
    SolutionIndex: 72
    SolutionNameMin: Cijk_Alik_Bjlk_B8F8NF8NS_BH_Bias_HAS_SAV_UserArgs_MT64x32x128_MI16x16x1_SN_LDSB0_CLR1_GRVWA8_GRVWB8_GSU0_GSUC0_GSUWGMRR0_K1_LBSPPA256_LBSPPB256_LPA8_LPB16_LRVW8_MIWT2_1_PLR1_SU0_SUM0_SUS128_VWA2_VWB1_WGM1_WGMXCC1_WGMXCCGn1
    SolutionIndex: 73
    SolutionNameMin: Cijk_Alik_Bjlk_B8F8NF8NS_BH_Bias_HAS_SAV_UserArgs_MT64x32x128_MI16x16x1_SN_LDSB0_CLR1_GRVWA16_GRVWB8_GSU0_GSUC0_GSUWGMRR0_K1_LBSPPA256_LBSPPB256_LPA16_LPB16_LRVW8_MIWT2_1_PLR1_SU0_SUM0_SUS128_VWA2_VWB1_WGM1_WGMXCC1_WGMXCCGn1
    SolutionIndex: 74
    SolutionNameMin: Cijk_Alik_Bjlk_B8F8NF8NS_BH_Bias_HAS_SAV_UserArgs_MT64x32x128_MI16x16x1_SN_LDSB0_CLR1_GRVWA8_GRVWB16_GSU0_GSUC0_GSUWGMRR0_K1_LBSPPA256_LBSPPB256_LPA8_LPB16_LRVW8_MIWT2_1_PLR1_SU0_SUM0_SUS128_VWA2_VWB1_WGM1_WGMXCC1_WGMXCCGn1
    SolutionIndex: 75
    SolutionNameMin: Cijk_Alik_Bjlk_B8F8NF8NS_BH_Bias_HAS_SAV_UserArgs_MT64x32x128_MI16x16x1_SN_LDSB0_CLR1_GRVWA8_GRVWB16_GSU0_GSUC0_GSUWGMRR0_K1_LBSPPA256_LBSPPB256_LPA8_LPB16_LRVW8_MIWT2_1_PLR1_SU0_SUM0_SUS128_VWA2_VWB1_WGM6_WGMXCC1_WGMXCCGn1
    SolutionIndex: 76
    SolutionNameMin: Cijk_Alik_Bjlk_B8F8NF8NS_BH_Bias_HAS_SAV_UserArgs_MT64x32x128_MI16x16x1_SN_LDSB0_CLR1_GRVWA8_GRVWB16_GSU0_GSUC0_GSUWGMRR0_K1_LBSPPA256_LBSPPB256_LPA8_LPB16_LRVW8_MIWT2_1_PLR1_SU0_SUM0_SUS128_VWA2_VWB1_WGM8_WGMXCC1_WGMXCCGn1
    SolutionIndex: 77
    SolutionNameMin: Cijk_Alik_Bjlk_B8F8NF8NS_BH_Bias_HAS_SAV_UserArgs_MT32x32x128_MI16x16x1_SN_LDSB0_CLR1_GRVWA8_GRVWB8_GSU0_GSUC0_GSUWGMRR0_K1_LBSPPA128_LBSPPB256_LPA8_LPB16_LRVW8_MIWT1_1_PLR1_SU0_SUM0_SUS128_VWA1_VWB1_WGM1_WGMXCC1_WGMXCCGn1
    SolutionIndex: 78
    SolutionNameMin: Cijk_Alik_Bjlk_B8F8NF8NS_BH_Bias_HAS_SAV_UserArgs_MT32x32x128_MI16x16x1_SN_LDSB0_CLR1_GRVWA16_GRVWB8_GSU0_GSUC0_GSUWGMRR0_K1_LBSPPA128_LBSPPB256_LPA16_LPB16_LRVW8_MIWT1_1_PLR1_SU0_SUM0_SUS128_VWA1_VWB1_WGM1_WGMXCC1_WGMXCCGn1
    SolutionIndex: 79
    SolutionNameMin: Cijk_Alik_Bjlk_B8F8NF8NS_BH_Bias_HAS_SAV_UserArgs_MT32x32x128_MI16x16x1_SN_LDSB0_CLR1_GRVWA8_GRVWB16_GSU0_GSUC0_GSUWGMRR0_K1_LBSPPA128_LBSPPB256_LPA8_LPB16_LRVW8_MIWT1_1_PLR1_SU0_SUM0_SUS128_VWA1_VWB1_WGM1_WGMXCC1_WGMXCCGn1
    SolutionIndex: 80
    SolutionNameMin: Cijk_Alik_Bjlk_B8F8NF8NS_BH_Bias_HAS_SAV_UserArgs_MT32x32x128_MI16x16x1_SN_LDSB0_CLR1_GRVWA8_GRVWB8_GSU0_GSUC0_GSUWGMRR0_K1_LBSPPA128_LBSPPB256_LPA8_LPB16_LRVW8_MIWT1_1_PLR1_SU0_SUM0_SUS128_VWA1_VWB1_WGM4_WGMXCC1_WGMXCCGn1
    SolutionIndex: 81
    SolutionNameMin: Cijk_Alik_Bjlk_B8F8NF8NS_BH_Bias_HAS_SAV_UserArgs_MT32x32x128_MI16x16x1_SN_LDSB0_CLR1_GRVWA8_GRVWB16_GSU0_GSUC0_GSUWGMRR0_K1_LBSPPA128_LBSPPB256_LPA8_LPB16_LRVW8_MIWT1_1_PLR1_SU0_SUM0_SUS128_VWA1_VWB1_WGM4_WGMXCC1_WGMXCCGn1
    SolutionIndex: 82
    SolutionNameMin: Cijk_Alik_Bjlk_B8F8NF8NS_BH_Bias_HAS_SAV_UserArgs_MT32x32x128_MI16x16x1_SN_LDSB0_CLR1_GRVWA8_GRVWB16_GSU0_GSUC0_GSUWGMRR0_K1_LBSPPA128_LBSPPB256_LPA8_LPB16_LRVW8_MIWT1_1_PLR1_SU0_SUM0_SUS128_VWA1_VWB1_WGM8_WGMXCC1_WGMXCCGn1
    SolutionIndex: 83
    SolutionNameMin: Cijk_Alik_Bjlk_B8F8NF8NS_BH_Bias_HAS_SAV_UserArgs_MT128x64x256_MI16x16x1_SN_LDSB1_CLR1_GRVWA16_GRVWB16_GSU0_GSUC0_GSUWGMRR0_K1_LBSPPA1024_LBSPPB512_LPA16_LPB32_LRVW8_MIWT4_2_PLR1_SU0_SUM0_SUS256_VWA4_VWB2_WGM1_WGMXCC1_WGMXCCGn1
    SolutionIndex: 84
    SolutionNameMin: Cijk_Alik_Bjlk_B8F8NF8NS_BH_Bias_HAS_SAV_UserArgs_MT128x64x256_MI16x16x1_SN_LDSB1_CLR1_GRVWA16_GRVWB16_GSU0_GSUC0_GSUWGMRR0_K1_LBSPPA1024_LBSPPB512_LPA16_LPB32_LRVW8_MIWT4_2_PLR1_SU0_SUM0_SUS256_VWA4_VWB2_WGM4_WGMXCC1_WGMXCCGn1
    SolutionIndex: 85
    SolutionNameMin: Cijk_Alik_Bjlk_B8F8NF8NS_BH_Bias_HAS_SAV_UserArgs_MT128x64x256_MI16x16x1_SN_LDSB1_CLR1_GRVWA16_GRVWB16_GSU0_GSUC0_GSUWGMRR0_K1_LBSPPA1024_LBSPPB512_LPA16_LPB32_LRVW8_MIWT4_2_PLR1_SU0_SUM0_SUS256_VWA4_VWB2_WGM6_WGMXCC1_WGMXCCGn1
    SolutionIndex: 86
    SolutionNameMin: Cijk_Alik_Bjlk_B8F8NF8NS_BH_Bias_HAS_SAV_UserArgs_MT128x64x256_MI16x16x1_SN_LDSB1_CLR1_GRVWA16_GRVWB16_GSU0_GSUC0_GSUWGMRR0_K1_LBSPPA1024_LBSPPB512_LPA16_LPB32_LRVW8_MIWT4_2_PLR1_SU0_SUM0_SUS256_VWA4_VWB2_WGM8_WGMXCC1_WGMXCCGn1
    SolutionIndex: 87
    SolutionNameMin: Cijk_Alik_Bjlk_B8F8NF8NS_BH_Bias_HAS_SAV_UserArgs_MT64x64x256_MI16x16x1_SN_LDSB1_CLR1_GRVWA16_GRVWB16_GSU0_GSUC0_GSUWGMRR0_K1_LBSPPA512_LBSPPB512_LPA16_LPB32_LRVW8_MIWT2_2_PLR1_SU0_SUM0_SUS256_VWA2_VWB2_WGM1_WGMXCC1_WGMXCCGn1
    SolutionIndex: 88
    SolutionNameMin: Cijk_Alik_Bjlk_B8F8NF8NS_BH_Bias_HAS_SAV_UserArgs_MT64x64x256_MI16x16x1_SN_LDSB1_CLR1_GRVWA16_GRVWB16_GSU0_GSUC0_GSUWGMRR0_K1_LBSPPA512_LBSPPB512_LPA16_LPB32_LRVW8_MIWT2_2_PLR1_SU0_SUM0_SUS256_VWA2_VWB2_WGM4_WGMXCC1_WGMXCCGn1
    SolutionIndex: 89
    SolutionNameMin: Cijk_Alik_Bjlk_B8F8NF8NS_BH_Bias_HAS_SAV_UserArgs_MT64x64x256_MI16x16x1_SN_LDSB1_CLR1_GRVWA16_GRVWB16_GSU0_GSUC0_GSUWGMRR0_K1_LBSPPA512_LBSPPB512_LPA16_LPB32_LRVW8_MIWT2_2_PLR1_SU0_SUM0_SUS256_VWA2_VWB2_WGM6_WGMXCC1_WGMXCCGn1
    SolutionIndex: 90
    SolutionNameMin: Cijk_Alik_Bjlk_B8F8NF8NS_BH_Bias_HAS_SAV_UserArgs_MT64x64x256_MI16x16x1_SN_LDSB1_CLR1_GRVWA16_GRVWB16_GSU0_GSUC0_GSUWGMRR0_K1_LBSPPA512_LBSPPB512_LPA16_LPB32_LRVW8_MIWT2_2_PLR1_SU0_SUM0_SUS256_VWA2_VWB2_WGM8_WGMXCC1_WGMXCCGn1
    SolutionIndex: 91
    SolutionNameMin: Cijk_Alik_Bjlk_B8F8NF8NS_BH_Bias_HAS_SAV_UserArgs_MT32x64x256_MI16x16x1_SN_LDSB1_CLR1_GRVWA16_GRVWB16_GSU0_GSUC0_GSUWGMRR0_K1_LBSPPA256_LBSPPB512_LPA16_LPB32_LRVW8_MIWT1_2_PLR1_SU0_SUM0_SUS256_VWA1_VWB2_WGM1_WGMXCC1_WGMXCCGn1
    SolutionIndex: 92
    SolutionNameMin: Cijk_Alik_Bjlk_B8F8NF8NS_BH_Bias_HAS_SAV_UserArgs_MT32x64x256_MI16x16x1_SN_LDSB1_CLR1_GRVWA8_GRVWB16_GSU0_GSUC0_GSUWGMRR0_K1_LBSPPA256_LBSPPB512_LPA8_LPB32_LRVW8_MIWT1_2_PLR1_SU0_SUM0_SUS256_VWA1_VWB2_WGM6_WGMXCC1_WGMXCCGn1
    SolutionIndex: 93
    SolutionNameMin: Cijk_Alik_Bjlk_B8F8NF8NS_BH_Bias_HAS_SAV_UserArgs_MT32x64x256_MI16x16x1_SN_LDSB1_CLR1_GRVWA16_GRVWB16_GSU0_GSUC0_GSUWGMRR0_K1_LBSPPA256_LBSPPB512_LPA16_LPB32_LRVW8_MIWT1_2_PLR1_SU0_SUM0_SUS256_VWA1_VWB2_WGM6_WGMXCC1_WGMXCCGn1
    SolutionIndex: 94
    SolutionNameMin: Cijk_Alik_Bjlk_B8F8NF8NS_BH_Bias_HAS_SAV_UserArgs_MT64x32x256_MI16x16x1_SN_LDSB1_CLR1_GRVWA16_GRVWB16_GSU0_GSUC0_GSUWGMRR0_K1_LBSPPA512_LBSPPB256_LPA16_LPB16_LRVW8_MIWT2_1_PLR1_SU0_SUM0_SUS256_VWA2_VWB1_WGM1_WGMXCC1_WGMXCCGn1
    SolutionIndex: 95
    SolutionNameMin: Cijk_Alik_Bjlk_B8F8NF8NS_BH_Bias_HAS_SAV_UserArgs_MT32x32x256_MI16x16x1_SN_LDSB1_CLR1_GRVWA16_GRVWB16_GSU0_GSUC0_GSUWGMRR0_K1_LBSPPA256_LBSPPB256_LPA16_LPB16_LRVW8_MIWT1_1_PLR1_SU0_SUM0_SUS256_VWA1_VWB1_WGM1_WGMXCC1_WGMXCCGn1
    SolutionIndex: 96
    SolutionNameMin: Cijk_Alik_Bjlk_B8F8NF8NS_BH_Bias_HAS_SAV_UserArgs_MT32x32x256_MI16x16x1_SN_LDSB1_CLR1_GRVWA16_GRVWB16_GSU0_GSUC0_GSUWGMRR0_K1_LBSPPA256_LBSPPB256_LPA16_LPB16_LRVW8_MIWT1_1_PLR1_SU0_SUM0_SUS256_VWA1_VWB1_WGM6_WGMXCC1_WGMXCCGn1
- - - [128, 128, 1, 128, 128, 128, 128, 128]
    - [77, 0.53]
  - - [128, 128, 1, 256, 128, 128, 256, 128]
    - [77, 1.0]
  - - [128, 128, 1, 512, 128, 128, 512, 128]
    - [77, 1.73]
  - - [128, 128, 1, 1024, 128, 128, 1024, 128]
    - [77, 2.71]
  - - [128, 128, 1, 2048, 128, 128, 2048, 128]
    - [79, 3.83]
  - - [128, 128, 1, 4096, 128, 128, 4096, 128]
    - [79, 4.81]
  - - [128, 128, 1, 8192, 128, 128, 8192, 128]
    - [79, 5.51]
  - - [128, 256, 1, 128, 128, 128, 128, 256]
    - [45, 1.07]
  - - [128, 256, 1, 256, 128, 128, 256, 256]
    - [44, 2.03]
  - - [128, 256, 1, 512, 128, 128, 512, 256]
    - [77, 3.49]
  - - [128, 256, 1, 1024, 128, 128, 1024, 256]
    - [77, 5.49]
  - - [128, 256, 1, 2048, 128, 128, 2048, 256]
    - [79, 7.78]
  - - [128, 256, 1, 4096, 128, 128, 4096, 256]
    - [79, 9.63]
  - - [128, 256, 1, 8192, 128, 128, 8192, 256]
    - [79, 11.1]
  - - [128, 512, 1, 128, 128, 128, 128, 512]
    - [44, 2.18]
  - - [128, 512, 1, 256, 128, 128, 256, 512]
    - [78, 3.96]
  - - [128, 512, 1, 512, 128, 128, 512, 512]
    - [79, 6.77]
  - - [128, 512, 1, 1024, 128, 128, 1024, 512]
    - [77, 10.82]
  - - [128, 512, 1, 2048, 128, 128, 2048, 512]
    - [77, 15.2]
  - - [128, 512, 1, 4096, 128, 128, 4096, 512]
    - [79, 19.35]
  - - [128, 512, 1, 8192, 128, 128, 8192, 512]
    - [95, 18.27]
  - - [128, 1024, 1, 128, 128, 128, 128, 1024]
    - [78, 4.41]
  - - [128, 1024, 1, 256, 128, 128, 256, 1024]
    - [77, 8.07]
  - - [128, 1024, 1, 512, 128, 128, 512, 1024]
    - [77, 13.6]
  - - [128, 1024, 1, 1024, 128, 128, 1024, 1024]
    - [77, 21.51]
  - - [128, 1024, 1, 2048, 128, 128, 2048, 1024]
    - [79, 30.1]
  - - [128, 1024, 1, 4096, 128, 128, 4096, 1024]
    - [95, 32.43]
  - - [128, 1024, 1, 8192, 128, 128, 8192, 1024]
    - [96, 32.02]
  - - [128, 2048, 1, 128, 128, 128, 128, 2048]
    - [72, 8.28]
  - - [128, 2048, 1, 256, 128, 128, 256, 2048]
    - [72, 14.64]
  - - [128, 2048, 1, 512, 128, 128, 512, 2048]
    - [73, 24.87]
  - - [128, 2048, 1, 1024, 128, 128, 1024, 2048]
    - [74, 37.55]
  - - [128, 2048, 1, 2048, 128, 128, 2048, 2048]
    - [91, 44.33]
  - - [128, 2048, 1, 4096, 128, 128, 4096, 2048]
    - [91, 52.97]
  - - [128, 2048, 1, 8192, 128, 128, 8192, 2048]
    - [91, 59.82]
  - - [128, 4096, 1, 128, 128, 128, 128, 4096]
    - [37, 15.33]
  - - [128, 4096, 1, 256, 128, 128, 256, 4096]
    - [37, 26.87]
  - - [128, 4096, 1, 512, 128, 128, 512, 4096]
    - [68, 43.71]
  - - [128, 4096, 1, 1024, 128, 128, 1024, 4096]
    - [68, 65.44]
  - - [128, 4096, 1, 2048, 128, 128, 2048, 4096]
    - [87, 78.77]
  - - [128, 4096, 1, 4096, 128, 128, 4096, 4096]
    - [87, 96.96]
  - - [128, 4096, 1, 8192, 128, 128, 8192, 4096]
    - [87, 108.95]
  - - [128, 8192, 1, 128, 128, 128, 128, 8192]
    - [28, 25.79]
  - - [128, 8192, 1, 256, 128, 128, 256, 8192]
    - [28, 45.25]
  - - [128, 8192, 1, 512, 128, 128, 512, 8192]
    - [27, 73.25]
  - - [128, 8192, 1, 1024, 128, 128, 1024, 8192]
    - [27, 106.01]
  - - [128, 8192, 1, 2048, 128, 128, 2048, 8192]
    - [65, 123.78]
  - - [128, 8192, 1, 4096, 128, 128, 4096, 8192]
    - [65, 144.86]
  - - [128, 8192, 1, 8192, 128, 128, 8192, 8192]
    - [83, 155.65]
  - - [256, 128, 1, 128, 256, 256, 128, 128]
    - [44, 1.09]
  - - [256, 128, 1, 256, 256, 256, 256, 128]
    - [78, 1.99]
  - - [256, 128, 1, 512, 256, 256, 512, 128]
    - [79, 3.37]
  - - [256, 128, 1, 1024, 256, 256, 1024, 128]
    - [79, 5.4]
  - - [256, 128, 1, 2048, 256, 256, 2048, 128]
    - [79, 7.6]
  - - [256, 128, 1, 4096, 256, 256, 4096, 128]
    - [79, 9.65]
  - - [256, 128, 1, 8192, 256, 256, 8192, 128]
    - [79, 11.04]
  - - [256, 256, 1, 128, 256, 256, 128, 256]
    - [44, 2.23]
  - - [256, 256, 1, 256, 256, 256, 256, 256]
    - [44, 4.11]
  - - [256, 256, 1, 512, 256, 256, 512, 256]
    - [77, 7.06]
  - - [256, 256, 1, 1024, 256, 256, 1024, 256]
    - [77, 10.99]
  - - [256, 256, 1, 2048, 256, 256, 2048, 256]
    - [79, 15.24]
  - - [256, 256, 1, 4096, 256, 256, 4096, 256]
    - [79, 19.25]
  - - [256, 256, 1, 8192, 256, 256, 8192, 256]
    - [82, 21.92]
  - - [256, 512, 1, 128, 256, 256, 128, 512]
    - [78, 4.28]
  - - [256, 512, 1, 256, 256, 256, 256, 512]
    - [77, 7.68]
  - - [256, 512, 1, 512, 256, 256, 512, 512]
    - [77, 13.45]
  - - [256, 512, 1, 1024, 256, 256, 1024, 512]
    - [77, 21.29]
  - - [256, 512, 1, 2048, 256, 256, 2048, 512]
    - [77, 29.62]
  - - [256, 512, 1, 4096, 256, 256, 4096, 512]
    - [79, 37.66]
  - - [256, 512, 1, 8192, 256, 256, 8192, 512]
    - [95, 38.86]
  - - [256, 1024, 1, 128, 256, 256, 128, 1024]
    - [69, 8.17]
  - - [256, 1024, 1, 256, 256, 256, 256, 1024]
    - [72, 14.54]
  - - [256, 1024, 1, 512, 256, 256, 512, 1024]
    - [73, 24.37]
  - - [256, 1024, 1, 1024, 256, 256, 1024, 1024]
    - [74, 37.63]
  - - [256, 1024, 1, 2048, 256, 256, 2048, 1024]
    - [74, 50.98]
  - - [256, 1024, 1, 4096, 256, 256, 4096, 1024]
    - [94, 55.73]
  - - [256, 1024, 1, 8192, 256, 256, 8192, 1024]
    - [93, 59.81]
  - - [256, 2048, 1, 128, 256, 256, 128, 2048]
    - [25, 10.22]
  - - [256, 2048, 1, 256, 256, 256, 256, 2048]
    - [33, 19.01]
  - - [256, 2048, 1, 512, 256, 256, 512, 2048]
    - [40, 38.23]
  - - [256, 2048, 1, 1024, 256, 256, 1024, 2048]
    - [39, 60.5]
  - - [256, 2048, 1, 2048, 256, 256, 2048, 2048]
    - [87, 79.28]
  - - [256, 2048, 1, 4096, 256, 256, 4096, 2048]
    - [87, 96.5]
  - - [256, 2048, 1, 8192, 256, 256, 8192, 2048]
    - [87, 108.92]
  - - [256, 4096, 1, 128, 256, 256, 128, 4096]
    - [63, 18.36]
  - - [256, 4096, 1, 256, 256, 256, 256, 4096]
    - [66, 37.1]
  - - [256, 4096, 1, 512, 256, 256, 512, 4096]
    - [29, 69.52]
  - - [256, 4096, 1, 1024, 256, 256, 1024, 4096]
    - [27, 104.57]
  - - [256, 4096, 1, 2048, 256, 256, 2048, 4096]
    - [83, 124.86]
  - - [256, 4096, 1, 4096, 256, 256, 4096, 4096]
    - [83, 149.69]
  - - [256, 4096, 1, 8192, 256, 256, 8192, 4096]
    - [83, 165.69]
  - - [256, 8192, 1, 128, 256, 256, 128, 8192]
    - [22, 41.11]
  - - [256, 8192, 1, 256, 256, 256, 256, 8192]
    - [60, 69.7]
  - - [256, 8192, 1, 512, 256, 256, 512, 8192]
    - [60, 112.09]
  - - [256, 8192, 1, 1024, 256, 256, 1024, 8192]
    - [60, 161.67]
  - - [256, 8192, 1, 2048, 256, 256, 2048, 8192]
    - [60, 187.45]
  - - [256, 8192, 1, 4096, 256, 256, 4096, 8192]
    - [60, 212.67]
  - - [256, 8192, 1, 8192, 256, 256, 8192, 8192]
    - [60, 202.94]
  - - [512, 128, 1, 128, 512, 512, 128, 128]
    - [42, 2.11]
  - - [512, 128, 1, 256, 512, 512, 256, 128]
    - [44, 3.96]
  - - [512, 128, 1, 512, 512, 512, 512, 128]
    - [77, 6.86]
  - - [512, 128, 1, 1024, 512, 512, 1024, 128]
    - [77, 10.84]
  - - [512, 128, 1, 2048, 512, 512, 2048, 128]
    - [77, 15.16]
  - - [512, 128, 1, 4096, 512, 512, 4096, 128]
    - [79, 19.21]
  - - [512, 128, 1, 8192, 512, 512, 8192, 128]
    - [79, 22.02]
  - - [512, 256, 1, 128, 512, 512, 128, 256]
    - [44, 4.09]
  - - [512, 256, 1, 256, 512, 512, 256, 256]
    - [44, 7.83]
  - - [512, 256, 1, 512, 512, 512, 512, 256]
    - [80, 13.19]
  - - [512, 256, 1, 1024, 512, 512, 1024, 256]
    - [79, 21.11]
  - - [512, 256, 1, 2048, 512, 512, 2048, 256]
    - [79, 29.97]
  - - [512, 256, 1, 4096, 512, 512, 4096, 256]
    - [79, 37.75]
  - - [512, 256, 1, 8192, 512, 512, 8192, 256]
    - [81, 43.26]
  - - [512, 512, 1, 128, 512, 512, 128, 512]
    - [43, 7.7]
  - - [512, 512, 1, 256, 512, 512, 256, 512]
    - [73, 14.42]
  - - [512, 512, 1, 512, 512, 512, 512, 512]
    - [73, 24.3]
  - - [512, 512, 1, 1024, 512, 512, 1024, 512]
    - [74, 37.49]
  - - [512, 512, 1, 2048, 512, 512, 2048, 512]
    - [74, 51.73]
  - - [512, 512, 1, 4096, 512, 512, 4096, 512]
    - [76, 63.05]
  - - [512, 512, 1, 8192, 512, 512, 8192, 512]
    - [71, 64.35]
  - - [512, 1024, 1, 128, 512, 512, 128, 1024]
    - [38, 14.37]
  - - [512, 1024, 1, 256, 512, 512, 256, 1024]
    - [37, 25.77]
  - - [512, 1024, 1, 512, 512, 512, 512, 1024]
    - [68, 43.02]
  - - [512, 1024, 1, 1024, 512, 512, 1024, 1024]
    - [87, 64.2]
  - - [512, 1024, 1, 2048, 512, 512, 2048, 1024]
    - [87, 86.99]
  - - [512, 1024, 1, 4096, 512, 512, 4096, 1024]
    - [87, 98.01]
  - - [512, 1024, 1, 8192, 512, 512, 8192, 1024]
    - [89, 107.38]
  - - [512, 2048, 1, 128, 512, 512, 128, 2048]
    - [26, 25.98]
  - - [512, 2048, 1, 256, 512, 512, 256, 2048]
    - [20, 45.23]
  - - [512, 2048, 1, 512, 512, 512, 512, 2048]
    - [27, 73.02]
  - - [512, 2048, 1, 1024, 512, 512, 1024, 2048]
    - [27, 106.03]
  - - [512, 2048, 1, 2048, 512, 512, 2048, 2048]
    - [83, 128.05]
  - - [512, 2048, 1, 4096, 512, 512, 4096, 2048]
    - [83, 153.33]
  - - [512, 2048, 1, 8192, 512, 512, 8192, 2048]
    - [83, 162.69]
  - - [512, 4096, 1, 128, 512, 512, 128, 4096]
    - [22, 41.15]
  - - [512, 4096, 1, 256, 512, 512, 256, 4096]
    - [23, 70.15]
  - - [512, 4096, 1, 512, 512, 512, 512, 4096]
    - [60, 111.35]
  - - [512, 4096, 1, 1024, 512, 512, 1024, 4096]
    - [60, 160.37]
  - - [512, 4096, 1, 2048, 512, 512, 2048, 4096]
    - [60, 193.31]
  - - [512, 4096, 1, 4096, 512, 512, 4096, 4096]
    - [60, 222.39]
  - - [512, 4096, 1, 8192, 512, 512, 8192, 4096]
    - [61, 208.09]
  - - [512, 8192, 1, 128, 512, 512, 128, 8192]
    - [12, 58.24]
  - - [512, 8192, 1, 256, 512, 512, 256, 8192]
    - [12, 98.88]
  - - [512, 8192, 1, 512, 512, 512, 512, 8192]
    - [13, 155.59]
  - - [512, 8192, 1, 1024, 512, 512, 1024, 8192]
    - [13, 217.77]
  - - [512, 8192, 1, 2048, 512, 512, 2048, 8192]
    - [46, 249.22]
  - - [512, 8192, 1, 4096, 512, 512, 4096, 8192]
    - [50, 263.95]
  - - [512, 8192, 1, 8192, 512, 512, 8192, 8192]
    - [46, 239.88]
  - - [1024, 128, 1, 128, 1024, 1024, 128, 128]
    - [70, 3.87]
  - - [1024, 128, 1, 256, 1024, 1024, 256, 128]
    - [77, 7.39]
  - - [1024, 128, 1, 512, 1024, 1024, 512, 128]
    - [77, 13.18]
  - - [1024, 128, 1, 1024, 1024, 1024, 1024, 128]
    - [77, 21.23]
  - - [1024, 128, 1, 2048, 1024, 1024, 2048, 128]
    - [79, 29.96]
  - - [1024, 128, 1, 4096, 1024, 1024, 4096, 128]
    - [79, 37.51]
  - - [1024, 128, 1, 8192, 1024, 1024, 8192, 128]
    - [82, 43.12]
  - - [1024, 256, 1, 128, 1024, 1024, 128, 256]
    - [42, 8.01]
  - - [1024, 256, 1, 256, 1024, 1024, 256, 256]
    - [42, 14.17]
  - - [1024, 256, 1, 512, 1024, 1024, 512, 256]
    - [73, 24.26]
  - - [1024, 256, 1, 1024, 1024, 1024, 1024, 256]
    - [74, 37.48]
  - - [1024, 256, 1, 2048, 1024, 1024, 2048, 256]
    - [74, 51.6]
  - - [1024, 256, 1, 4096, 1024, 1024, 4096, 256]
    - [76, 63.17]
  - - [1024, 256, 1, 8192, 1024, 1024, 8192, 256]
    - [92, 71.19]
  - - [1024, 512, 1, 128, 1024, 1024, 128, 512]
    - [37, 14.82]
  - - [1024, 512, 1, 256, 1024, 1024, 256, 512]
    - [67, 25.9]
  - - [1024, 512, 1, 512, 1024, 1024, 512, 512]
    - [36, 42.77]
  - - [1024, 512, 1, 1024, 1024, 1024, 1024, 512]
    - [68, 64.08]
  - - [1024, 512, 1, 2048, 1024, 1024, 2048, 512]
    - [87, 86.77]
  - - [1024, 512, 1, 4096, 1024, 1024, 4096, 512]
    - [88, 104.44]
  - - [1024, 512, 1, 8192, 1024, 1024, 8192, 512]
    - [90, 108.85]
  - - [1024, 1024, 1, 128, 1024, 1024, 128, 1024]
    - [28, 25.83]
  - - [1024, 1024, 1, 256, 1024, 1024, 256, 1024]
    - [27, 45.09]
  - - [1024, 1024, 1, 512, 1024, 1024, 512, 1024]
    - [27, 73.0]
  - - [1024, 1024, 1, 1024, 1024, 1024, 1024, 1024]
    - [27, 106.02]
  - - [1024, 1024, 1, 2048, 1024, 1024, 2048, 1024]
    - [30, 135.57]
  - - [1024, 1024, 1, 4096, 1024, 1024, 4096, 1024]
    - [84, 148.28]
  - - [1024, 1024, 1, 8192, 1024, 1024, 8192, 1024]
    - [86, 160.77]
  - - [1024, 2048, 1, 128, 1024, 1024, 128, 2048]
    - [22, 41.24]
  - - [1024, 2048, 1, 256, 1024, 1024, 256, 2048]
    - [19, 70.1]
  - - [1024, 2048, 1, 512, 1024, 1024, 512, 2048]
    - [60, 111.85]
  - - [1024, 2048, 1, 1024, 1024, 1024, 1024, 2048]
    - [60, 160.96]
  - - [1024, 2048, 1, 2048, 1024, 1024, 2048, 2048]
    - [60, 194.8]
  - - [1024, 2048, 1, 4096, 1024, 1024, 4096, 2048]
    - [61, 221.62]
  - - [1024, 2048, 1, 8192, 1024, 1024, 8192, 2048]
    - [64, 211.52]
  - - [1024, 4096, 1, 128, 1024, 1024, 128, 4096]
    - [14, 58.21]
  - - [1024, 4096, 1, 256, 1024, 1024, 256, 4096]
    - [12, 99.58]
  - - [1024, 4096, 1, 512, 1024, 1024, 512, 4096]
    - [13, 155.14]
  - - [1024, 4096, 1, 1024, 1024, 1024, 1024, 4096]
    - [13, 212.91]
  - - [1024, 4096, 1, 2048, 1024, 1024, 2048, 4096]
    - [52, 254.51]
  - - [1024, 4096, 1, 4096, 1024, 1024, 4096, 4096]
    - [8, 261.77]
  - - [1024, 4096, 1, 8192, 1024, 1024, 8192, 4096]
    - [52, 240.53]
  - - [1024, 8192, 1, 128, 1024, 1024, 128, 8192]
    - [6, 73.82]
  - - [1024, 8192, 1, 256, 1024, 1024, 256, 8192]
    - [6, 123.06]
  - - [1024, 8192, 1, 512, 1024, 1024, 512, 8192]
    - [6, 184.51]
  - - [1024, 8192, 1, 1024, 1024, 1024, 1024, 8192]
    - [2, 247.62]
  - - [1024, 8192, 1, 2048, 1024, 1024, 2048, 8192]
    - [6, 283.74]
  - - [1024, 8192, 1, 4096, 1024, 1024, 4096, 8192]
    - [5, 267.64]
  - - [1024, 8192, 1, 8192, 1024, 1024, 8192, 8192]
    - [1, 285.13]
  - - [2048, 128, 1, 128, 2048, 2048, 128, 128]
    - [41, 7.9]
  - - [2048, 128, 1, 256, 2048, 2048, 256, 128]
    - [42, 14.57]
  - - [2048, 128, 1, 512, 2048, 2048, 512, 128]
    - [73, 24.48]
  - - [2048, 128, 1, 1024, 2048, 2048, 1024, 128]
    - [74, 37.32]
  - - [2048, 128, 1, 2048, 2048, 2048, 2048, 128]
    - [74, 51.35]
  - - [2048, 128, 1, 4096, 2048, 2048, 4096, 128]
    - [75, 62.91]
  - - [2048, 128, 1, 8192, 2048, 2048, 8192, 128]
    - [92, 70.94]
  - - [2048, 256, 1, 128, 2048, 2048, 128, 256]
    - [35, 14.53]
  - - [2048, 256, 1, 256, 2048, 2048, 256, 256]
    - [37, 25.94]
  - - [2048, 256, 1, 512, 2048, 2048, 512, 256]
    - [68, 42.49]
  - - [2048, 256, 1, 1024, 2048, 2048, 1024, 256]
    - [68, 64.46]
  - - [2048, 256, 1, 2048, 2048, 2048, 2048, 256]
    - [87, 86.59]
  - - [2048, 256, 1, 4096, 2048, 2048, 4096, 256]
    - [89, 105.05]
  - - [2048, 256, 1, 8192, 2048, 2048, 8192, 256]
    - [88, 117.25]
  - - [2048, 512, 1, 128, 2048, 2048, 128, 512]
    - [20, 25.27]
  - - [2048, 512, 1, 256, 2048, 2048, 256, 512]
    - [27, 44.25]
  - - [2048, 512, 1, 512, 2048, 2048, 512, 512]
    - [27, 72.04]
  - - [2048, 512, 1, 1024, 2048, 2048, 1024, 512]
    - [27, 105.17]
  - - [2048, 512, 1, 2048, 2048, 2048, 2048, 512]
    - [32, 135.46]
  - - [2048, 512, 1, 4096, 2048, 2048, 4096, 512]
    - [86, 153.36]
  - - [2048, 512, 1, 8192, 2048, 2048, 8192, 512]
    - [85, 161.84]
  - - [2048, 1024, 1, 128, 2048, 2048, 128, 1024]
    - [22, 40.86]
  - - [2048, 1024, 1, 256, 2048, 2048, 256, 1024]
    - [19, 70.09]
  - - [2048, 1024, 1, 512, 2048, 2048, 512, 1024]
    - [60, 111.94]
  - - [2048, 1024, 1, 1024, 2048, 2048, 1024, 1024]
    - [60, 160.97]
  - - [2048, 1024, 1, 2048, 2048, 2048, 2048, 1024]
    - [64, 198.16]
  - - [2048, 1024, 1, 4096, 2048, 2048, 4096, 1024]
    - [61, 214.28]
  - - [2048, 1024, 1, 8192, 2048, 2048, 8192, 1024]
    - [61, 211.65]
  - - [2048, 2048, 1, 128, 2048, 2048, 128, 2048]
    - [17, 58.89]
  - - [2048, 2048, 1, 256, 2048, 2048, 256, 2048]
    - [11, 99.97]
  - - [2048, 2048, 1, 512, 2048, 2048, 512, 2048]
    - [13, 156.62]
  - - [2048, 2048, 1, 1024, 2048, 2048, 1024, 2048]
    - [18, 205.13]
  - - [2048, 2048, 1, 2048, 2048, 2048, 2048, 2048]
    - [47, 248.16]
  - - [2048, 2048, 1, 4096, 2048, 2048, 4096, 2048]
    - [47, 263.51]
  - - [2048, 2048, 1, 8192, 2048, 2048, 8192, 2048]
    - [47, 238.76]
  - - [2048, 4096, 1, 128, 2048, 2048, 128, 4096]
    - [2, 73.61]
  - - [2048, 4096, 1, 256, 2048, 2048, 256, 4096]
    - [1, 123.64]
  - - [2048, 4096, 1, 512, 2048, 2048, 512, 4096]
    - [1, 182.69]
  - - [2048, 4096, 1, 1024, 2048, 2048, 1024, 4096]
    - [5, 248.76]
  - - [2048, 4096, 1, 2048, 2048, 2048, 2048, 4096]
    - [7, 285.2]
  - - [2048, 4096, 1, 4096, 2048, 2048, 4096, 4096]
    - [2, 273.45]
  - - [2048, 4096, 1, 8192, 2048, 2048, 8192, 4096]
    - [2, 283.63]
  - - [2048, 8192, 1, 128, 2048, 2048, 128, 8192]
    - [0, 79.37]
  - - [2048, 8192, 1, 256, 2048, 2048, 256, 8192]
    - [6, 132.12]
  - - [2048, 8192, 1, 512, 2048, 2048, 512, 8192]
    - [6, 196.92]
  - - [2048, 8192, 1, 1024, 2048, 2048, 1024, 8192]
    - [6, 245.2]
  - - [2048, 8192, 1, 2048, 2048, 2048, 2048, 8192]
    - [10, 250.09]
  - - [2048, 8192, 1, 4096, 2048, 2048, 4096, 8192]
    - [49, 283.04]
  - - [2048, 8192, 1, 8192, 2048, 2048, 8192, 8192]
    - [50, 311.92]
  - - [4096, 128, 1, 128, 4096, 4096, 128, 128]
    - [34, 14.72]
  - - [4096, 128, 1, 256, 4096, 4096, 256, 128]
    - [34, 25.91]
  - - [4096, 128, 1, 512, 4096, 4096, 512, 128]
    - [36, 42.28]
  - - [4096, 128, 1, 1024, 4096, 4096, 1024, 128]
    - [68, 64.28]
  - - [4096, 128, 1, 2048, 4096, 4096, 2048, 128]
    - [87, 86.35]
  - - [4096, 128, 1, 4096, 4096, 4096, 4096, 128]
    - [90, 105.61]
  - - [4096, 128, 1, 8192, 4096, 4096, 8192, 128]
    - [88, 118.01]
  - - [4096, 256, 1, 128, 4096, 4096, 128, 256]
    - [33, 24.97]
  - - [4096, 256, 1, 256, 4096, 4096, 256, 256]
    - [27, 44.07]
  - - [4096, 256, 1, 512, 4096, 4096, 512, 256]
    - [27, 71.95]
  - - [4096, 256, 1, 1024, 4096, 4096, 1024, 256]
    - [30, 105.14]
  - - [4096, 256, 1, 2048, 4096, 4096, 2048, 256]
    - [32, 135.64]
  - - [4096, 256, 1, 4096, 4096, 4096, 4096, 256]
    - [86, 151.87]
  - - [4096, 256, 1, 8192, 4096, 4096, 8192, 256]
    - [85, 159.42]
  - - [4096, 512, 1, 128, 4096, 4096, 128, 512]
    - [22, 41.5]
  - - [4096, 512, 1, 256, 4096, 4096, 256, 512]
    - [22, 70.16]
  - - [4096, 512, 1, 512, 4096, 4096, 512, 512]
    - [60, 112.49]
  - - [4096, 512, 1, 1024, 4096, 4096, 1024, 512]
    - [60, 157.78]
  - - [4096, 512, 1, 2048, 4096, 4096, 2048, 512]
    - [64, 199.4]
  - - [4096, 512, 1, 4096, 4096, 4096, 4096, 512]
    - [64, 210.01]
  - - [4096, 512, 1, 8192, 4096, 4096, 8192, 512]
    - [62, 209.84]
  - - [4096, 1024, 1, 128, 4096, 4096, 128, 1024]
    - [12, 58.36]
  - - [4096, 1024, 1, 256, 4096, 4096, 256, 1024]
    - [11, 99.62]
  - - [4096, 1024, 1, 512, 4096, 4096, 512, 1024]
    - [13, 156.39]
  - - [4096, 1024, 1, 1024, 4096, 4096, 1024, 1024]
    - [15, 210.41]
  - - [4096, 1024, 1, 2048, 4096, 4096, 2048, 1024]
    - [49, 251.17]
  - - [4096, 1024, 1, 4096, 4096, 4096, 4096, 1024]
    - [51, 263.42]
  - - [4096, 1024, 1, 8192, 4096, 4096, 8192, 1024]
    - [48, 240.56]
  - - [4096, 2048, 1, 128, 4096, 4096, 128, 2048]
    - [2, 72.24]
  - - [4096, 2048, 1, 256, 4096, 4096, 256, 2048]
    - [5, 121.63]
  - - [4096, 2048, 1, 512, 4096, 4096, 512, 2048]
    - [6, 182.99]
  - - [4096, 2048, 1, 1024, 4096, 4096, 1024, 2048]
    - [6, 247.09]
  - - [4096, 2048, 1, 2048, 4096, 4096, 2048, 2048]
    - [7, 282.34]
  - - [4096, 2048, 1, 4096, 4096, 4096, 4096, 2048]
    - [2, 271.19]
  - - [4096, 2048, 1, 8192, 4096, 4096, 8192, 2048]
    - [55, 291.68]
  - - [4096, 4096, 1, 128, 4096, 4096, 128, 4096]
    - [4, 78.07]
  - - [4096, 4096, 1, 256, 4096, 4096, 256, 4096]
    - [6, 131.04]
  - - [4096, 4096, 1, 512, 4096, 4096, 512, 4096]
    - [7, 195.55]
  - - [4096, 4096, 1, 1024, 4096, 4096, 1024, 4096]
    - [7, 239.57]
  - - [4096, 4096, 1, 2048, 4096, 4096, 2048, 4096]
    - [9, 246.72]
  - - [4096, 4096, 1, 4096, 4096, 4096, 4096, 4096]
    - [51, 280.19]
  - - [4096, 4096, 1, 8192, 4096, 4096, 8192, 4096]
    - [52, 317.53]
  - - [4096, 8192, 1, 128, 4096, 4096, 128, 8192]
    - [4, 83.89]
  - - [4096, 8192, 1, 256, 4096, 4096, 256, 8192]
    - [21, 138.88]
  - - [4096, 8192, 1, 512, 4096, 4096, 512, 8192]
    - [9, 198.81]
  - - [4096, 8192, 1, 1024, 4096, 4096, 1024, 8192]
    - [46, 237.8]
  - - [4096, 8192, 1, 2048, 4096, 4096, 2048, 8192]
    - [47, 286.44]
  - - [4096, 8192, 1, 4096, 4096, 4096, 4096, 8192]
    - [1, 336.24]
  - - [4096, 8192, 1, 8192, 4096, 4096, 8192, 8192]
    - [1, 365.66]
  - - [8192, 128, 1, 128, 8192, 8192, 128, 128]
    - [20, 26.42]
  - - [8192, 128, 1, 256, 8192, 8192, 256, 128]
    - [26, 45.75]
  - - [8192, 128, 1, 512, 8192, 8192, 512, 128]
    - [27, 74.48]
  - - [8192, 128, 1, 1024, 8192, 8192, 1024, 128]
    - [27, 107.71]
  - - [8192, 128, 1, 2048, 8192, 8192, 2048, 128]
    - [31, 135.9]
  - - [8192, 128, 1, 4096, 8192, 8192, 4096, 128]
    - [65, 147.09]
  - - [8192, 128, 1, 8192, 8192, 8192, 8192, 128]
    - [89, 158.57]
  - - [8192, 256, 1, 128, 8192, 8192, 128, 256]
    - [59, 41.25]
  - - [8192, 256, 1, 256, 8192, 8192, 256, 256]
    - [22, 70.64]
  - - [8192, 256, 1, 512, 8192, 8192, 512, 256]
    - [60, 111.11]
  - - [8192, 256, 1, 1024, 8192, 8192, 1024, 256]
    - [60, 160.72]
  - - [8192, 256, 1, 2048, 8192, 8192, 2048, 256]
    - [64, 199.48]
  - - [8192, 256, 1, 4096, 8192, 8192, 4096, 256]
    - [64, 209.36]
  - - [8192, 256, 1, 8192, 8192, 8192, 8192, 256]
    - [64, 207.4]
  - - [8192, 512, 1, 128, 8192, 8192, 128, 512]
    - [12, 58.06]
  - - [8192, 512, 1, 256, 8192, 8192, 256, 512]
    - [11, 100.55]
  - - [8192, 512, 1, 512, 8192, 8192, 512, 512]
    - [18, 155.19]
  - - [8192, 512, 1, 1024, 8192, 8192, 1024, 512]
    - [57, 224.76]
  - - [8192, 512, 1, 2048, 8192, 8192, 2048, 512]
    - [58, 253.44]
  - - [8192, 512, 1, 4096, 8192, 8192, 4096, 512]
    - [56, 276.35]
  - - [8192, 512, 1, 8192, 8192, 8192, 8192, 512]
    - [56, 259.51]
  - - [8192, 1024, 1, 128, 8192, 8192, 128, 1024]
    - [2, 72.29]
  - - [8192, 1024, 1, 256, 8192, 8192, 256, 1024]
    - [6, 122.37]
  - - [8192, 1024, 1, 512, 8192, 8192, 512, 1024]
    - [54, 185.06]
  - - [8192, 1024, 1, 1024, 8192, 8192, 1024, 1024]
    - [2, 246.65]
  - - [8192, 1024, 1, 2048, 8192, 8192, 2048, 1024]
    - [54, 296.27]
  - - [8192, 1024, 1, 4096, 8192, 8192, 4096, 1024]
    - [53, 354.63]
  - - [8192, 1024, 1, 8192, 8192, 8192, 8192, 1024]
    - [54, 371.69]
  - - [8192, 2048, 1, 128, 8192, 8192, 128, 2048]
    - [5, 78.63]
  - - [8192, 2048, 1, 256, 8192, 8192, 256, 2048]
    - [5, 130.6]
  - - [8192, 2048, 1, 512, 8192, 8192, 512, 2048]
    - [55, 198.02]
  - - [8192, 2048, 1, 1024, 8192, 8192, 1024, 2048]
    - [54, 254.75]
  - - [8192, 2048, 1, 2048, 8192, 8192, 2048, 2048]
    - [55, 297.15]
  - - [8192, 2048, 1, 4096, 8192, 8192, 4096, 2048]
    - [53, 340.71]
  - - [8192, 2048, 1, 8192, 8192, 8192, 8192, 2048]
    - [53, 394.7]
  - - [8192, 4096, 1, 128, 8192, 8192, 128, 4096]
    - [1, 83.5]
  - - [8192, 4096, 1, 256, 8192, 8192, 256, 4096]
    - [6, 134.47]
  - - [8192, 4096, 1, 512, 8192, 8192, 512, 4096]
    - [10, 197.13]
  - - [8192, 4096, 1, 1024, 8192, 8192, 1024, 4096]
    - [55, 239.7]
  - - [8192, 4096, 1, 2048, 8192, 8192, 2048, 4096]
    - [54, 304.52]
  - - [8192, 4096, 1, 4096, 8192, 8192, 4096, 4096]
    - [53, 365.06]
  - - [8192, 4096, 1, 8192, 8192, 8192, 8192, 4096]
    - [53, 413.12]
  - - [8192, 8192, 1, 128, 8192, 8192, 128, 8192]
    - [24, 85.96]
  - - [8192, 8192, 1, 256, 8192, 8192, 256, 8192]
    - [16, 148.36]
  - - [8192, 8192, 1, 512, 8192, 8192, 512, 8192]
    - [5, 217.27]
  - - [8192, 8192, 1, 1024, 8192, 8192, 1024, 8192]
    - [6, 278.86]
  - - [8192, 8192, 1, 2048, 8192, 8192, 2048, 8192]
    - [3, 331.32]
  - - [8192, 8192, 1, 4096, 8192, 8192, 4096, 8192]
    - [54, 379.84]
  - - [8192, 8192, 1, 8192, 8192, 8192, 8192, 8192]
    - [53, 415.18]
- null
- null
- ExperimentalStreamK
- GridBased
