projects/hipblaslt/library/src/amd_detail/rocblaslt/src/Tensile/Logic/asm_full/aquavanjaram/gfx942_228cu/StreamK/aquavanjaram942_Cijk_Alik_Bljk_F8B8NBS_BH_Bias_HAS_SAV_UserArgs.yaml
- {MinimumRequiredVersion: 4.33.0}
- aquavanjaram942
- {Architecture: gfx942, CUCount: 228}
- [Device 0049, Device 0050]
    SolutionIndex: 0
    SolutionNameMin: Cijk_Alik_Bljk_F8B8NBS_BH_Bias_HAS_SAV_UserArgs_MT256x256x64_MI16x16x1_SN_LDSB1_CLR1_GRVWA4_GRVWB16_GSU0_GSUC0_GSUWGMRR0_K1_LBSPPA512_LBSPPB512_LPA8_LPB16_LRVW8_MIWT8_8_PLR1_SU0_SUM0_SUS64_VWA8_VWB8_WGM1_WGMXCC1_WGMXCCGn1
    SolutionIndex: 1
    SolutionNameMin: Cijk_Alik_Bljk_F8B8NBS_BH_Bias_HAS_SAV_UserArgs_MT256x256x64_MI16x16x1_SN_LDSB1_CLR1_GRVWA16_GRVWB16_GSU0_GSUC0_GSUWGMRR0_K1_LBSPPA512_LBSPPB512_LPA32_LPB32_LRVW16_MIWT8_8_PLR1_SU0_SUM0_SUS64_VWA8_VWB8_WGM1_WGMXCC1_WGMXCCGn1
    SolutionIndex: 2
    SolutionNameMin: Cijk_Alik_Bljk_F8B8NBS_BH_Bias_HAS_SAV_UserArgs_MT256x256x64_MI16x16x1_SN_LDSB1_CLR1_GRVWA16_GRVWB16_GSU0_GSUC0_GSUWGMRR0_K1_LBSPPA512_LBSPPB512_LPA32_LPB32_LRVW16_MIWT8_8_PLR1_SU0_SUM0_SUS64_VWA8_VWB8_WGM4_WGMXCC1_WGMXCCGn1
    SolutionIndex: 3
    SolutionNameMin: Cijk_Alik_Bljk_F8B8NBS_BH_Bias_HAS_SAV_UserArgs_MT256x256x64_MI16x16x1_SN_LDSB1_CLR1_GRVWA16_GRVWB16_GSU0_GSUC0_GSUWGMRR0_K1_LBSPPA512_LBSPPB512_LPA32_LPB32_LRVW16_MIWT8_8_PLR1_SU0_SUM0_SUS64_VWA8_VWB8_WGM6_WGMXCC1_WGMXCCGn1
    SolutionIndex: 4
    SolutionNameMin: Cijk_Alik_Bljk_F8B8NBS_BH_Bias_HAS_SAV_UserArgs_MT256x256x64_MI16x16x1_SN_LDSB1_CLR1_GRVWA16_GRVWB16_GSU0_GSUC0_GSUWGMRR0_K1_LBSPPA512_LBSPPB512_LPA32_LPB32_LRVW16_MIWT8_8_PLR1_SU0_SUM0_SUS64_VWA8_VWB8_WGM8_WGMXCC1_WGMXCCGn1
    SolutionIndex: 5
    SolutionNameMin: Cijk_Alik_Bljk_F8B8NBS_BH_Bias_HAS_SAV_UserArgs_MT256x144x64_MI16x16x1_SN_LDSB0_CLR1_GRVWA16_GRVWB4_GSU0_GSUC0_GSUWGMRR0_K1_LBSPPA256_LBSPPB128_LPA16_LPB8_LRVW8_MIWT4_9_PLR1_SU0_SUM0_SUS64_VWA4_VWB1_WGM1_WGMXCC1_WGMXCCGn1
    SolutionIndex: 6
    SolutionNameMin: Cijk_Alik_Bljk_F8B8NBS_BH_Bias_HAS_SAV_UserArgs_MT256x144x64_MI16x16x1_SN_LDSB0_CLR1_GRVWA16_GRVWB4_GSU0_GSUC0_GSUWGMRR0_K1_LBSPPA256_LBSPPB128_LPA32_LPB32_LRVW16_MIWT4_9_PLR1_SU0_SUM0_SUS64_VWA4_VWB1_WGM1_WGMXCC1_WGMXCCGn1
    SolutionIndex: 7
    SolutionNameMin: Cijk_Alik_Bljk_F8B8NBS_BH_Bias_HAS_SAV_UserArgs_MT256x144x64_MI16x16x1_SN_LDSB0_CLR1_GRVWA4_GRVWB4_GSU0_GSUC0_GSUWGMRR0_K1_LBSPPA256_LBSPPB128_LPA8_LPB8_LRVW8_MIWT4_9_PLR1_SU0_SUM0_SUS64_VWA4_VWB1_WGM6_WGMXCC1_WGMXCCGn1
    SolutionIndex: 8
    SolutionNameMin: Cijk_Alik_Bljk_F8B8NBS_BH_Bias_HAS_SAV_UserArgs_MT256x144x64_MI16x16x1_SN_LDSB0_CLR1_GRVWA16_GRVWB4_GSU0_GSUC0_GSUWGMRR0_K1_LBSPPA256_LBSPPB128_LPA16_LPB8_LRVW8_MIWT4_9_PLR1_SU0_SUM0_SUS64_VWA4_VWB1_WGM8_WGMXCC1_WGMXCCGn1
    SolutionIndex: 9
    SolutionNameMin: Cijk_Alik_Bljk_F8B8NBS_BH_Bias_HAS_SAV_UserArgs_MT256x144x64_MI16x16x1_SN_LDSB0_CLR1_GRVWA16_GRVWB4_GSU0_GSUC0_GSUWGMRR0_K1_LBSPPA256_LBSPPB128_LPA32_LPB32_LRVW16_MIWT4_9_PLR1_SU0_SUM0_SUS64_VWA4_VWB1_WGM8_WGMXCC1_WGMXCCGn1
    SolutionIndex: 10
    SolutionNameMin: Cijk_Alik_Bljk_F8B8NBS_BH_Bias_HAS_SAV_UserArgs_MT256x128x64_MI16x16x1_SN_LDSB1_CLR1_GRVWA8_GRVWB8_GSU0_GSUC0_GSUWGMRR0_K1_LBSPPA512_LBSPPB256_LPA8_LPB8_LRVW8_MIWT8_4_PLR1_SU0_SUM0_SUS64_VWA8_VWB4_WGM1_WGMXCC1_WGMXCCGn1
    SolutionIndex: 11
    SolutionNameMin: Cijk_Alik_Bljk_F8B8NBS_BH_Bias_HAS_SAV_UserArgs_MT256x128x64_MI16x16x1_SN_LDSB1_CLR1_GRVWA4_GRVWB16_GSU0_GSUC0_GSUWGMRR0_K1_LBSPPA512_LBSPPB256_LPA8_LPB16_LRVW8_MIWT8_4_PLR1_SU0_SUM0_SUS64_VWA8_VWB4_WGM1_WGMXCC1_WGMXCCGn1
    SolutionIndex: 12
    SolutionNameMin: Cijk_Alik_Bljk_F8B8NBS_BH_Bias_HAS_SAV_UserArgs_MT256x128x64_MI16x16x1_SN_LDSB1_CLR1_GRVWA8_GRVWB16_GSU0_GSUC0_GSUWGMRR0_K1_LBSPPA512_LBSPPB256_LPA8_LPB16_LRVW8_MIWT8_4_PLR1_SU0_SUM0_SUS64_VWA8_VWB4_WGM1_WGMXCC1_WGMXCCGn1
    SolutionIndex: 13
    SolutionNameMin: Cijk_Alik_Bljk_F8B8NBS_BH_Bias_HAS_SAV_UserArgs_MT256x128x64_MI16x16x1_SN_LDSB1_CLR1_GRVWA16_GRVWB8_GSU0_GSUC0_GSUWGMRR0_K1_LBSPPA512_LBSPPB256_LPA32_LPB32_LRVW16_MIWT8_4_PLR1_SU0_SUM0_SUS64_VWA8_VWB4_WGM1_WGMXCC1_WGMXCCGn1
    SolutionIndex: 14
    SolutionNameMin: Cijk_Alik_Bljk_F8B8NBS_BH_Bias_HAS_SAV_UserArgs_MT256x128x64_MI16x16x1_SN_LDSB1_CLR1_GRVWA16_GRVWB16_GSU0_GSUC0_GSUWGMRR0_K1_LBSPPA512_LBSPPB256_LPA32_LPB32_LRVW16_MIWT8_4_PLR1_SU0_SUM0_SUS64_VWA8_VWB4_WGM1_WGMXCC1_WGMXCCGn1
    SolutionIndex: 15
    SolutionNameMin: Cijk_Alik_Bljk_F8B8NBS_BH_Bias_HAS_SAV_UserArgs_MT256x128x64_MI16x16x1_SN_LDSB1_CLR1_GRVWA16_GRVWB16_GSU0_GSUC0_GSUWGMRR0_K1_LBSPPA512_LBSPPB256_LPA32_LPB32_LRVW16_MIWT8_4_PLR1_SU0_SUM0_SUS64_VWA8_VWB4_WGM6_WGMXCC1_WGMXCCGn1
    SolutionIndex: 16
    SolutionNameMin: Cijk_Alik_Bljk_F8B8NBS_BH_Bias_HAS_SAV_UserArgs_MT256x128x64_MI16x16x1_SN_LDSB1_CLR1_GRVWA4_GRVWB8_GSU0_GSUC0_GSUWGMRR0_K1_LBSPPA512_LBSPPB256_LPA8_LPB8_LRVW8_MIWT8_4_PLR1_SU0_SUM0_SUS64_VWA8_VWB4_WGM8_WGMXCC1_WGMXCCGn1
    SolutionIndex: 17
    SolutionNameMin: Cijk_Alik_Bljk_F8B8NBS_BH_Bias_HAS_SAV_UserArgs_MT256x128x64_MI16x16x1_SN_LDSB1_CLR1_GRVWA16_GRVWB16_GSU0_GSUC0_GSUWGMRR0_K1_LBSPPA512_LBSPPB256_LPA32_LPB32_LRVW16_MIWT8_4_PLR1_SU0_SUM0_SUS64_VWA8_VWB4_WGM8_WGMXCC1_WGMXCCGn1
    SolutionIndex: 18
    SolutionNameMin: Cijk_Alik_Bljk_F8B8NBS_BH_Bias_HAS_SAV_UserArgs_MT144x256x64_MI16x16x1_SN_LDSB0_CLR1_GRVWA4_GRVWB16_GSU0_GSUC0_GSUWGMRR0_K1_LBSPPA128_LBSPPB256_LPA8_LPB16_LRVW8_MIWT9_4_PLR1_SU0_SUM0_SUS64_VWA1_VWB4_WGM6_WGMXCC1_WGMXCCGn1
    SolutionIndex: 19
    SolutionNameMin: Cijk_Alik_Bljk_F8B8NBS_BH_Bias_HAS_SAV_UserArgs_MT144x256x64_MI16x16x1_SN_LDSB0_CLR1_GRVWA4_GRVWB4_GSU0_GSUC0_GSUWGMRR0_K1_LBSPPA128_LBSPPB256_LPA8_LPB8_LRVW8_MIWT9_4_PLR1_SU0_SUM0_SUS64_VWA1_VWB4_WGM8_WGMXCC1_WGMXCCGn1
    SolutionIndex: 20
    SolutionNameMin: Cijk_Alik_Bljk_F8B8NBS_BH_Bias_HAS_SAV_UserArgs_MT144x256x64_MI16x16x1_SN_LDSB0_CLR1_GRVWA4_GRVWB16_GSU0_GSUC0_GSUWGMRR0_K1_LBSPPA128_LBSPPB256_LPA8_LPB16_LRVW8_MIWT9_4_PLR1_SU0_SUM0_SUS64_VWA1_VWB4_WGM8_WGMXCC1_WGMXCCGn1
    SolutionIndex: 21
    SolutionNameMin: Cijk_Alik_Bljk_F8B8NBS_BH_Bias_HAS_SAV_UserArgs_MT144x256x64_MI16x16x1_SN_LDSB0_CLR1_GRVWA4_GRVWB16_GSU0_GSUC0_GSUWGMRR0_K1_LBSPPA128_LBSPPB256_LPA32_LPB32_LRVW16_MIWT9_4_PLR1_SU0_SUM0_SUS64_VWA1_VWB4_WGM8_WGMXCC1_WGMXCCGn1
    SolutionIndex: 22
    SolutionNameMin: Cijk_Alik_Bljk_F8B8NBS_BH_Bias_HAS_SAV_UserArgs_MT128x128x64_MI16x16x1_SN_LDSB1_CLR1_GRVWA8_GRVWB16_GSU0_GSUC0_GSUWGMRR0_K1_LBSPPA512_LBSPPB128_LPA8_LPB16_LRVW8_MIWT8_2_PLR1_SU0_SUM0_SUS64_VWA8_VWB2_WGM1_WGMXCC1_WGMXCCGn1
    SolutionIndex: 23
    SolutionNameMin: Cijk_Alik_Bljk_F8B8NBS_BH_Bias_HAS_SAV_UserArgs_MT128x128x64_MI16x16x1_SN_LDSB1_CLR1_GRVWA4_GRVWB16_GSU0_GSUC0_GSUWGMRR0_K1_LBSPPA512_LBSPPB128_LPA32_LPB32_LRVW16_MIWT8_2_PLR1_SU0_SUM0_SUS64_VWA8_VWB2_WGM1_WGMXCC1_WGMXCCGn1
    SolutionIndex: 24
    SolutionNameMin: Cijk_Alik_Bljk_F8B8NBS_BH_Bias_HAS_SAV_UserArgs_MT128x128x64_MI16x16x1_SN_LDSB1_CLR1_GRVWA16_GRVWB16_GSU0_GSUC0_GSUWGMRR0_K1_LBSPPA512_LBSPPB128_LPA32_LPB32_LRVW16_MIWT8_2_PLR1_SU0_SUM0_SUS64_VWA8_VWB2_WGM1_WGMXCC1_WGMXCCGn1
    SolutionIndex: 25
    SolutionNameMin: Cijk_Alik_Bljk_F8B8NBS_BH_Bias_HAS_SAV_UserArgs_MT64x128x64_MI16x16x1_SN_LDSB0_CLR1_GRVWA16_GRVWB16_GSU0_GSUC0_GSUWGMRR0_K1_LBSPPA128_LBSPPB512_LPA32_LPB32_LRVW16_MIWT1_8_PLR1_SU0_SUM0_SUS64_VWA1_VWB8_WGM4_WGMXCC1_WGMXCCGn1
    SolutionIndex: 26
    SolutionNameMin: Cijk_Alik_Bljk_F8B8NBS_BH_Bias_HAS_SAV_UserArgs_MT128x144x64_MI16x16x1_SN_LDSB1_CLR1_GRVWA16_GRVWB4_GSU0_GSUC0_GSUWGMRR0_K1_LBSPPA128_LBSPPB128_LPA16_LPB8_LRVW8_MIWT2_9_PLR1_SU0_SUM0_SUS64_VWA2_VWB1_WGM1_WGMXCC1_WGMXCCGn1
    SolutionIndex: 27
    SolutionNameMin: Cijk_Alik_Bljk_F8B8NBS_BH_Bias_HAS_SAV_UserArgs_MT128x64x64_MI16x16x1_SN_LDSB0_CLR1_GRVWA16_GRVWB16_GSU0_GSUC0_GSUWGMRR0_K1_LBSPPA512_LBSPPB128_LPA32_LPB32_LRVW16_MIWT8_1_PLR1_SU0_SUM0_SUS64_VWA8_VWB1_WGM1_WGMXCC1_WGMXCCGn1
    SolutionIndex: 28
    SolutionNameMin: Cijk_Alik_Bljk_F8B8NBS_BH_Bias_HAS_SAV_UserArgs_MT64x128x64_MI16x16x1_SN_LDSB0_CLR1_GRVWA4_GRVWB16_GSU0_GSUC0_GSUWGMRR0_K1_LBSPPA128_LBSPPB256_LPA8_LPB16_LRVW8_MIWT2_4_PLR1_SU0_SUM0_SUS64_VWA2_VWB4_WGM1_WGMXCC1_WGMXCCGn1
    SolutionIndex: 29
    SolutionNameMin: Cijk_Alik_Bljk_F8B8NBS_BH_Bias_HAS_SAV_UserArgs_MT64x128x64_MI16x16x1_SN_LDSB0_CLR1_GRVWA8_GRVWB16_GSU0_GSUC0_GSUWGMRR0_K1_LBSPPA128_LBSPPB256_LPA32_LPB32_LRVW16_MIWT2_4_PLR1_SU0_SUM0_SUS64_VWA2_VWB4_WGM1_WGMXCC1_WGMXCCGn1
    SolutionIndex: 30
    SolutionNameMin: Cijk_Alik_Bljk_F8B8NBS_BH_Bias_HAS_SAV_UserArgs_MT64x128x64_MI16x16x1_SN_LDSB0_CLR1_GRVWA16_GRVWB16_GSU0_GSUC0_GSUWGMRR0_K1_LBSPPA128_LBSPPB256_LPA32_LPB32_LRVW16_MIWT2_4_PLR1_SU0_SUM0_SUS64_VWA2_VWB4_WGM1_WGMXCC1_WGMXCCGn1
    SolutionIndex: 31
    SolutionNameMin: Cijk_Alik_Bljk_F8B8NBS_BH_Bias_HAS_SAV_UserArgs_MT32x128x64_MI16x16x1_SN_LDSB0_CLR1_GRVWA4_GRVWB8_GSU0_GSUC0_GSUWGMRR0_K1_LBSPPA128_LBSPPB256_LPA8_LPB8_LRVW8_MIWT1_4_PLR1_SU0_SUM0_SUS64_VWA1_VWB4_WGM4_WGMXCC1_WGMXCCGn1
    SolutionIndex: 32
    SolutionNameMin: Cijk_Alik_Bljk_F8B8NBS_BH_Bias_HAS_SAV_UserArgs_MT32x128x64_MI16x16x1_SN_LDSB0_CLR1_GRVWA4_GRVWB4_GSU0_GSUC0_GSUWGMRR0_K1_LBSPPA128_LBSPPB256_LPA8_LPB8_LRVW8_MIWT1_4_PLR1_SU0_SUM0_SUS64_VWA1_VWB4_WGM8_WGMXCC1_WGMXCCGn1
    SolutionIndex: 33
    SolutionNameMin: Cijk_Alik_Bljk_F8B8NBS_BH_Bias_HAS_SAV_UserArgs_MT64x64x64_MI16x16x1_SN_LDSB0_CLR1_GRVWA16_GRVWB4_GSU0_GSUC0_GSUWGMRR0_K1_LBSPPA128_LBSPPB128_LPA16_LPB8_LRVW8_MIWT2_2_PLR1_SU0_SUM0_SUS64_VWA2_VWB2_WGM1_WGMXCC1_WGMXCCGn1
    SolutionIndex: 34
    SolutionNameMin: Cijk_Alik_Bljk_F8B8NBS_BH_Bias_HAS_SAV_UserArgs_MT64x64x64_MI16x16x1_SN_LDSB0_CLR1_GRVWA16_GRVWB8_GSU0_GSUC0_GSUWGMRR0_K1_LBSPPA128_LBSPPB128_LPA16_LPB8_LRVW8_MIWT2_2_PLR1_SU0_SUM0_SUS64_VWA2_VWB2_WGM1_WGMXCC1_WGMXCCGn1
    SolutionIndex: 35
    SolutionNameMin: Cijk_Alik_Bljk_F8B8NBS_BH_Bias_HAS_SAV_UserArgs_MT64x64x64_MI16x16x1_SN_LDSB0_CLR1_GRVWA8_GRVWB16_GSU0_GSUC0_GSUWGMRR0_K1_LBSPPA128_LBSPPB128_LPA8_LPB16_LRVW8_MIWT2_2_PLR1_SU0_SUM0_SUS64_VWA2_VWB2_WGM6_WGMXCC1_WGMXCCGn1
    SolutionIndex: 36
    SolutionNameMin: Cijk_Alik_Bljk_F8B8NBS_BH_Bias_HAS_SAV_UserArgs_MT32x64x64_MI16x16x1_SN_LDSB0_CLR1_GRVWA8_GRVWB8_GSU0_GSUC0_GSUWGMRR0_K1_LBSPPA128_LBSPPB128_LPA8_LPB8_LRVW8_MIWT1_2_PLR1_SU0_SUM0_SUS64_VWA1_VWB2_WGM1_WGMXCC1_WGMXCCGn1
    SolutionIndex: 37
    SolutionNameMin: Cijk_Alik_Bljk_F8B8NBS_BH_Bias_HAS_SAV_UserArgs_MT32x64x64_MI16x16x1_SN_LDSB0_CLR1_GRVWA8_GRVWB16_GSU0_GSUC0_GSUWGMRR0_K1_LBSPPA128_LBSPPB128_LPA32_LPB32_LRVW16_MIWT1_2_PLR1_SU0_SUM0_SUS64_VWA1_VWB2_WGM6_WGMXCC1_WGMXCCGn1
    SolutionIndex: 38
    SolutionNameMin: Cijk_Alik_Bljk_F8B8NBS_BH_Bias_HAS_SAV_UserArgs_MT64x32x64_MI16x16x1_SN_LDSB0_CLR1_GRVWA16_GRVWB8_GSU0_GSUC0_GSUWGMRR0_K1_LBSPPA128_LBSPPB128_LPA32_LPB32_LRVW16_MIWT2_1_PLR1_SU0_SUM0_SUS64_VWA2_VWB1_WGM1_WGMXCC1_WGMXCCGn1
    SolutionIndex: 39
    SolutionNameMin: Cijk_Alik_Bljk_F8B8NBS_BH_Bias_HAS_SAV_UserArgs_MT64x32x64_MI16x16x1_SN_LDSB0_CLR1_GRVWA8_GRVWB4_GSU0_GSUC0_GSUWGMRR0_K1_LBSPPA128_LBSPPB128_LPA32_LPB32_LRVW16_MIWT2_1_PLR1_SU0_SUM0_SUS64_VWA2_VWB1_WGM8_WGMXCC1_WGMXCCGn1
    SolutionIndex: 40
    SolutionNameMin: Cijk_Alik_Bljk_F8B8NBS_BH_Bias_HAS_SAV_UserArgs_MT64x32x64_MI16x16x1_SN_LDSB0_CLR1_GRVWA4_GRVWB8_GSU0_GSUC0_GSUWGMRR0_K1_LBSPPA128_LBSPPB128_LPA32_LPB32_LRVW16_MIWT2_1_PLR1_SU0_SUM0_SUS64_VWA2_VWB1_WGM8_WGMXCC1_WGMXCCGn1
    SolutionIndex: 41
    SolutionNameMin: Cijk_Alik_Bljk_F8B8NBS_BH_Bias_HAS_SAV_UserArgs_MT32x32x64_MI16x16x1_SN_LDSB0_CLR1_GRVWA4_GRVWB4_GSU0_GSUC0_GSUWGMRR0_K1_LBSPPA128_LBSPPB128_LPA8_LPB8_LRVW8_MIWT1_1_PLR1_SU0_SUM0_SUS64_VWA1_VWB1_WGM1_WGMXCC1_WGMXCCGn1
    SolutionIndex: 42
    SolutionNameMin: Cijk_Alik_Bljk_F8B8NBS_BH_Bias_HAS_SAV_UserArgs_MT32x32x64_MI16x16x1_SN_LDSB0_CLR1_GRVWA4_GRVWB4_GSU0_GSUC0_GSUWGMRR0_K1_LBSPPA128_LBSPPB128_LPA8_LPB8_LRVW8_MIWT1_1_PLR1_SU0_SUM0_SUS64_VWA1_VWB1_WGM6_WGMXCC1_WGMXCCGn1
    SolutionIndex: 43
    SolutionNameMin: Cijk_Alik_Bljk_F8B8NBS_BH_Bias_HAS_SAV_UserArgs_MT128x256x128_MI16x16x1_SN_LDSB1_CLR1_GRVWA8_GRVWB16_GSU0_GSUC0_GSUWGMRR0_K1_LBSPPA512_LBSPPB1024_LPA32_LPB32_LRVW16_MIWT4_8_PLR1_SU0_SUM0_SUS128_VWA4_VWB8_WGM1_WGMXCC1_WGMXCCGn1
    SolutionIndex: 44
    SolutionNameMin: Cijk_Alik_Bljk_F8B8NBS_BH_Bias_HAS_SAV_UserArgs_MT128x256x128_MI16x16x1_SN_LDSB1_CLR1_GRVWA16_GRVWB16_GSU0_GSUC0_GSUWGMRR0_K1_LBSPPA512_LBSPPB1024_LPA32_LPB32_LRVW16_MIWT4_8_PLR1_SU0_SUM0_SUS128_VWA4_VWB8_WGM1_WGMXCC1_WGMXCCGn1
    SolutionIndex: 45
    SolutionNameMin: Cijk_Alik_Bljk_F8B8NBS_BH_Bias_HAS_SAV_UserArgs_MT128x256x128_MI16x16x1_SN_LDSB1_CLR1_GRVWA4_GRVWB16_GSU0_GSUC0_GSUWGMRR0_K1_LBSPPA512_LBSPPB1024_LPA32_LPB32_LRVW16_MIWT4_8_PLR1_SU0_SUM0_SUS128_VWA4_VWB8_WGM6_WGMXCC1_WGMXCCGn1
    SolutionIndex: 46
    SolutionNameMin: Cijk_Alik_Bljk_F8B8NBS_BH_Bias_HAS_SAV_UserArgs_MT128x256x128_MI16x16x1_SN_LDSB1_CLR1_GRVWA16_GRVWB16_GSU0_GSUC0_GSUWGMRR0_K1_LBSPPA512_LBSPPB1024_LPA32_LPB32_LRVW16_MIWT4_8_PLR1_SU0_SUM0_SUS128_VWA4_VWB8_WGM6_WGMXCC1_WGMXCCGn1
    SolutionIndex: 47
    SolutionNameMin: Cijk_Alik_Bljk_F8B8NBS_BH_Bias_HAS_SAV_UserArgs_MT256x144x128_MI16x16x1_SN_LDSB1_CLR1_GRVWA4_GRVWB4_GSU0_GSUC0_GSUWGMRR0_K1_LBSPPA512_LBSPPB128_LPA8_LPB8_LRVW8_MIWT4_9_PLR1_SU0_SUM0_SUS128_VWA4_VWB1_WGM1_WGMXCC1_WGMXCCGn1
    SolutionIndex: 48
    SolutionNameMin: Cijk_Alik_Bljk_F8B8NBS_BH_Bias_HAS_SAV_UserArgs_MT256x144x128_MI16x16x1_SN_LDSB1_CLR1_GRVWA16_GRVWB4_GSU0_GSUC0_GSUWGMRR0_K1_LBSPPA512_LBSPPB128_LPA16_LPB8_LRVW8_MIWT4_9_PLR1_SU0_SUM0_SUS128_VWA4_VWB1_WGM1_WGMXCC1_WGMXCCGn1
    SolutionIndex: 49
    SolutionNameMin: Cijk_Alik_Bljk_F8B8NBS_BH_Bias_HAS_SAV_UserArgs_MT256x144x128_MI16x16x1_SN_LDSB1_CLR1_GRVWA4_GRVWB8_GSU0_GSUC0_GSUWGMRR0_K1_LBSPPA512_LBSPPB128_LPA8_LPB8_LRVW8_MIWT4_9_PLR1_SU0_SUM0_SUS128_VWA4_VWB1_WGM1_WGMXCC1_WGMXCCGn1
    SolutionIndex: 50
    SolutionNameMin: Cijk_Alik_Bljk_F8B8NBS_BH_Bias_HAS_SAV_UserArgs_MT256x144x128_MI16x16x1_SN_LDSB1_CLR1_GRVWA16_GRVWB8_GSU0_GSUC0_GSUWGMRR0_K1_LBSPPA512_LBSPPB128_LPA16_LPB8_LRVW8_MIWT4_9_PLR1_SU0_SUM0_SUS128_VWA4_VWB1_WGM1_WGMXCC1_WGMXCCGn1
    SolutionIndex: 51
    SolutionNameMin: Cijk_Alik_Bljk_F8B8NBS_BH_Bias_HAS_SAV_UserArgs_MT256x144x128_MI16x16x1_SN_LDSB1_CLR1_GRVWA16_GRVWB4_GSU0_GSUC0_GSUWGMRR0_K1_LBSPPA512_LBSPPB128_LPA32_LPB32_LRVW16_MIWT4_9_PLR1_SU0_SUM0_SUS128_VWA4_VWB1_WGM1_WGMXCC1_WGMXCCGn1
    SolutionIndex: 52
    SolutionNameMin: Cijk_Alik_Bljk_F8B8NBS_BH_Bias_HAS_SAV_UserArgs_MT256x144x128_MI16x16x1_SN_LDSB1_CLR1_GRVWA4_GRVWB8_GSU0_GSUC0_GSUWGMRR0_K1_LBSPPA512_LBSPPB128_LPA32_LPB32_LRVW16_MIWT4_9_PLR1_SU0_SUM0_SUS128_VWA4_VWB1_WGM1_WGMXCC1_WGMXCCGn1
    SolutionIndex: 53
    SolutionNameMin: Cijk_Alik_Bljk_F8B8NBS_BH_Bias_HAS_SAV_UserArgs_MT256x144x128_MI16x16x1_SN_LDSB1_CLR1_GRVWA16_GRVWB8_GSU0_GSUC0_GSUWGMRR0_K1_LBSPPA512_LBSPPB128_LPA32_LPB32_LRVW16_MIWT4_9_PLR1_SU0_SUM0_SUS128_VWA4_VWB1_WGM1_WGMXCC1_WGMXCCGn1
    SolutionIndex: 54
    SolutionNameMin: Cijk_Alik_Bljk_F8B8NBS_BH_Bias_HAS_SAV_UserArgs_MT256x144x128_MI16x16x1_SN_LDSB1_CLR1_GRVWA4_GRVWB4_GSU0_GSUC0_GSUWGMRR0_K1_LBSPPA512_LBSPPB128_LPA8_LPB8_LRVW8_MIWT4_9_PLR1_SU0_SUM0_SUS128_VWA4_VWB1_WGM4_WGMXCC1_WGMXCCGn1
    SolutionIndex: 55
    SolutionNameMin: Cijk_Alik_Bljk_F8B8NBS_BH_Bias_HAS_SAV_UserArgs_MT256x144x128_MI16x16x1_SN_LDSB1_CLR1_GRVWA16_GRVWB8_GSU0_GSUC0_GSUWGMRR0_K1_LBSPPA512_LBSPPB128_LPA16_LPB8_LRVW8_MIWT4_9_PLR1_SU0_SUM0_SUS128_VWA4_VWB1_WGM4_WGMXCC1_WGMXCCGn1
    SolutionIndex: 56
    SolutionNameMin: Cijk_Alik_Bljk_F8B8NBS_BH_Bias_HAS_SAV_UserArgs_MT256x144x128_MI16x16x1_SN_LDSB1_CLR1_GRVWA4_GRVWB8_GSU0_GSUC0_GSUWGMRR0_K1_LBSPPA512_LBSPPB128_LPA32_LPB32_LRVW16_MIWT4_9_PLR1_SU0_SUM0_SUS128_VWA4_VWB1_WGM4_WGMXCC1_WGMXCCGn1
    SolutionIndex: 57
    SolutionNameMin: Cijk_Alik_Bljk_F8B8NBS_BH_Bias_HAS_SAV_UserArgs_MT256x144x128_MI16x16x1_SN_LDSB1_CLR1_GRVWA16_GRVWB8_GSU0_GSUC0_GSUWGMRR0_K1_LBSPPA512_LBSPPB128_LPA32_LPB32_LRVW16_MIWT4_9_PLR1_SU0_SUM0_SUS128_VWA4_VWB1_WGM4_WGMXCC1_WGMXCCGn1
    SolutionIndex: 58
    SolutionNameMin: Cijk_Alik_Bljk_F8B8NBS_BH_Bias_HAS_SAV_UserArgs_MT256x144x128_MI16x16x1_SN_LDSB1_CLR1_GRVWA4_GRVWB4_GSU0_GSUC0_GSUWGMRR0_K1_LBSPPA512_LBSPPB128_LPA8_LPB8_LRVW8_MIWT4_9_PLR1_SU0_SUM0_SUS128_VWA4_VWB1_WGM6_WGMXCC1_WGMXCCGn1
    SolutionIndex: 59
    SolutionNameMin: Cijk_Alik_Bljk_F8B8NBS_BH_Bias_HAS_SAV_UserArgs_MT256x144x128_MI16x16x1_SN_LDSB1_CLR1_GRVWA16_GRVWB8_GSU0_GSUC0_GSUWGMRR0_K1_LBSPPA512_LBSPPB128_LPA16_LPB8_LRVW8_MIWT4_9_PLR1_SU0_SUM0_SUS128_VWA4_VWB1_WGM6_WGMXCC1_WGMXCCGn1
    SolutionIndex: 60
    SolutionNameMin: Cijk_Alik_Bljk_F8B8NBS_BH_Bias_HAS_SAV_UserArgs_MT256x144x128_MI16x16x1_SN_LDSB1_CLR1_GRVWA4_GRVWB4_GSU0_GSUC0_GSUWGMRR0_K1_LBSPPA512_LBSPPB128_LPA32_LPB32_LRVW16_MIWT4_9_PLR1_SU0_SUM0_SUS128_VWA4_VWB1_WGM6_WGMXCC1_WGMXCCGn1
    SolutionIndex: 61
    SolutionNameMin: Cijk_Alik_Bljk_F8B8NBS_BH_Bias_HAS_SAV_UserArgs_MT256x144x128_MI16x16x1_SN_LDSB1_CLR1_GRVWA4_GRVWB4_GSU0_GSUC0_GSUWGMRR0_K1_LBSPPA512_LBSPPB128_LPA8_LPB8_LRVW8_MIWT4_9_PLR1_SU0_SUM0_SUS128_VWA4_VWB1_WGM8_WGMXCC1_WGMXCCGn1
    SolutionIndex: 62
    SolutionNameMin: Cijk_Alik_Bljk_F8B8NBS_BH_Bias_HAS_SAV_UserArgs_MT256x144x128_MI16x16x1_SN_LDSB1_CLR1_GRVWA16_GRVWB8_GSU0_GSUC0_GSUWGMRR0_K1_LBSPPA512_LBSPPB128_LPA32_LPB32_LRVW16_MIWT4_9_PLR1_SU0_SUM0_SUS128_VWA4_VWB1_WGM8_WGMXCC1_WGMXCCGn1
    SolutionIndex: 63
    SolutionNameMin: Cijk_Alik_Bljk_F8B8NBS_BH_Bias_HAS_SAV_UserArgs_MT256x128x128_MI16x16x1_SN_LDSB1_CLR1_GRVWA4_GRVWB16_GSU0_GSUC0_GSUWGMRR0_K1_LBSPPA1024_LBSPPB512_LPA32_LPB32_LRVW16_MIWT8_4_PLR1_SU0_SUM0_SUS128_VWA8_VWB4_WGM1_WGMXCC1_WGMXCCGn1
    SolutionIndex: 64
    SolutionNameMin: Cijk_Alik_Bljk_F8B8NBS_BH_Bias_HAS_SAV_UserArgs_MT256x128x128_MI16x16x1_SN_LDSB1_CLR1_GRVWA16_GRVWB16_GSU0_GSUC0_GSUWGMRR0_K1_LBSPPA1024_LBSPPB512_LPA32_LPB32_LRVW16_MIWT8_4_PLR1_SU0_SUM0_SUS128_VWA8_VWB4_WGM1_WGMXCC1_WGMXCCGn1
    SolutionIndex: 65
    SolutionNameMin: Cijk_Alik_Bljk_F8B8NBS_BH_Bias_HAS_SAV_UserArgs_MT256x128x128_MI16x16x1_SN_LDSB1_CLR1_GRVWA4_GRVWB16_GSU0_GSUC0_GSUWGMRR0_K1_LBSPPA1024_LBSPPB512_LPA8_LPB16_LRVW8_MIWT8_4_PLR1_SU0_SUM0_SUS128_VWA8_VWB4_WGM4_WGMXCC1_WGMXCCGn1
    SolutionIndex: 66
    SolutionNameMin: Cijk_Alik_Bljk_F8B8NBS_BH_Bias_HAS_SAV_UserArgs_MT256x128x128_MI16x16x1_SN_LDSB1_CLR1_GRVWA4_GRVWB16_GSU0_GSUC0_GSUWGMRR0_K1_LBSPPA1024_LBSPPB512_LPA32_LPB32_LRVW16_MIWT8_4_PLR1_SU0_SUM0_SUS128_VWA8_VWB4_WGM4_WGMXCC1_WGMXCCGn1
    SolutionIndex: 67
    SolutionNameMin: Cijk_Alik_Bljk_F8B8NBS_BH_Bias_HAS_SAV_UserArgs_MT256x128x128_MI16x16x1_SN_LDSB1_CLR1_GRVWA16_GRVWB16_GSU0_GSUC0_GSUWGMRR0_K1_LBSPPA1024_LBSPPB512_LPA32_LPB32_LRVW16_MIWT8_4_PLR1_SU0_SUM0_SUS128_VWA8_VWB4_WGM4_WGMXCC1_WGMXCCGn1
    SolutionIndex: 68
    SolutionNameMin: Cijk_Alik_Bljk_F8B8NBS_BH_Bias_HAS_SAV_UserArgs_MT256x128x128_MI16x16x1_SN_LDSB1_CLR1_GRVWA16_GRVWB16_GSU0_GSUC0_GSUWGMRR0_K1_LBSPPA1024_LBSPPB512_LPA32_LPB32_LRVW16_MIWT8_4_PLR1_SU0_SUM0_SUS128_VWA8_VWB4_WGM6_WGMXCC1_WGMXCCGn1
    SolutionIndex: 69
    SolutionNameMin: Cijk_Alik_Bljk_F8B8NBS_BH_Bias_HAS_SAV_UserArgs_MT256x128x128_MI16x16x1_SN_LDSB1_CLR1_GRVWA4_GRVWB16_GSU0_GSUC0_GSUWGMRR0_K1_LBSPPA1024_LBSPPB512_LPA32_LPB32_LRVW16_MIWT8_4_PLR1_SU0_SUM0_SUS128_VWA8_VWB4_WGM8_WGMXCC1_WGMXCCGn1
    SolutionIndex: 70
    SolutionNameMin: Cijk_Alik_Bljk_F8B8NBS_BH_Bias_HAS_SAV_UserArgs_MT256x128x128_MI16x16x1_SN_LDSB1_CLR1_GRVWA16_GRVWB16_GSU0_GSUC0_GSUWGMRR0_K1_LBSPPA1024_LBSPPB512_LPA32_LPB32_LRVW16_MIWT8_4_PLR1_SU0_SUM0_SUS128_VWA8_VWB4_WGM8_WGMXCC1_WGMXCCGn1
    SolutionIndex: 71
    SolutionNameMin: Cijk_Alik_Bljk_F8B8NBS_BH_Bias_HAS_SAV_UserArgs_MT144x256x128_MI16x16x1_SN_LDSB1_CLR1_GRVWA4_GRVWB16_GSU0_GSUC0_GSUWGMRR0_K1_LBSPPA128_LBSPPB512_LPA32_LPB32_LRVW16_MIWT9_4_PLR1_SU0_SUM0_SUS128_VWA1_VWB4_WGM1_WGMXCC1_WGMXCCGn1
    SolutionIndex: 72
    SolutionNameMin: Cijk_Alik_Bljk_F8B8NBS_BH_Bias_HAS_SAV_UserArgs_MT144x256x128_MI16x16x1_SN_LDSB1_CLR1_GRVWA4_GRVWB8_GSU0_GSUC0_GSUWGMRR0_K1_LBSPPA128_LBSPPB512_LPA8_LPB8_LRVW8_MIWT9_4_PLR1_SU0_SUM0_SUS128_VWA1_VWB4_WGM4_WGMXCC1_WGMXCCGn1
    SolutionIndex: 73
    SolutionNameMin: Cijk_Alik_Bljk_F8B8NBS_BH_Bias_HAS_SAV_UserArgs_MT144x256x128_MI16x16x1_SN_LDSB1_CLR1_GRVWA4_GRVWB16_GSU0_GSUC0_GSUWGMRR0_K1_LBSPPA128_LBSPPB512_LPA32_LPB32_LRVW16_MIWT9_4_PLR1_SU0_SUM0_SUS128_VWA1_VWB4_WGM4_WGMXCC1_WGMXCCGn1
    SolutionIndex: 74
    SolutionNameMin: Cijk_Alik_Bljk_F8B8NBS_BH_Bias_HAS_SAV_UserArgs_MT144x256x128_MI16x16x1_SN_LDSB1_CLR1_GRVWA8_GRVWB16_GSU0_GSUC0_GSUWGMRR0_K1_LBSPPA128_LBSPPB512_LPA32_LPB32_LRVW16_MIWT9_4_PLR1_SU0_SUM0_SUS128_VWA1_VWB4_WGM4_WGMXCC1_WGMXCCGn1
    SolutionIndex: 75
    SolutionNameMin: Cijk_Alik_Bljk_F8B8NBS_BH_Bias_HAS_SAV_UserArgs_MT144x256x128_MI16x16x1_SN_LDSB1_CLR1_GRVWA4_GRVWB16_GSU0_GSUC0_GSUWGMRR0_K1_LBSPPA128_LBSPPB512_LPA8_LPB16_LRVW8_MIWT9_4_PLR1_SU0_SUM0_SUS128_VWA1_VWB4_WGM6_WGMXCC1_WGMXCCGn1
    SolutionIndex: 76
    SolutionNameMin: Cijk_Alik_Bljk_F8B8NBS_BH_Bias_HAS_SAV_UserArgs_MT144x256x128_MI16x16x1_SN_LDSB1_CLR1_GRVWA4_GRVWB16_GSU0_GSUC0_GSUWGMRR0_K1_LBSPPA128_LBSPPB512_LPA32_LPB32_LRVW16_MIWT9_4_PLR1_SU0_SUM0_SUS128_VWA1_VWB4_WGM6_WGMXCC1_WGMXCCGn1
    SolutionIndex: 77
    SolutionNameMin: Cijk_Alik_Bljk_F8B8NBS_BH_Bias_HAS_SAV_UserArgs_MT144x256x128_MI16x16x1_SN_LDSB1_CLR1_GRVWA8_GRVWB16_GSU0_GSUC0_GSUWGMRR0_K1_LBSPPA128_LBSPPB512_LPA32_LPB32_LRVW16_MIWT9_4_PLR1_SU0_SUM0_SUS128_VWA1_VWB4_WGM6_WGMXCC1_WGMXCCGn1
    SolutionIndex: 78
    SolutionNameMin: Cijk_Alik_Bljk_F8B8NBS_BH_Bias_HAS_SAV_UserArgs_MT144x256x128_MI16x16x1_SN_LDSB1_CLR1_GRVWA4_GRVWB16_GSU0_GSUC0_GSUWGMRR0_K1_LBSPPA128_LBSPPB512_LPA8_LPB16_LRVW8_MIWT9_4_PLR1_SU0_SUM0_SUS128_VWA1_VWB4_WGM8_WGMXCC1_WGMXCCGn1
    SolutionIndex: 79
    SolutionNameMin: Cijk_Alik_Bljk_F8B8NBS_BH_Bias_HAS_SAV_UserArgs_MT144x256x128_MI16x16x1_SN_LDSB1_CLR1_GRVWA4_GRVWB16_GSU0_GSUC0_GSUWGMRR0_K1_LBSPPA128_LBSPPB512_LPA32_LPB32_LRVW16_MIWT9_4_PLR1_SU0_SUM0_SUS128_VWA1_VWB4_WGM8_WGMXCC1_WGMXCCGn1
    SolutionIndex: 80
    SolutionNameMin: Cijk_Alik_Bljk_F8B8NBS_BH_Bias_HAS_SAV_UserArgs_MT144x256x128_MI16x16x1_SN_LDSB1_CLR1_GRVWA8_GRVWB16_GSU0_GSUC0_GSUWGMRR0_K1_LBSPPA128_LBSPPB512_LPA32_LPB32_LRVW16_MIWT9_4_PLR1_SU0_SUM0_SUS128_VWA1_VWB4_WGM8_WGMXCC1_WGMXCCGn1
    SolutionIndex: 81
    SolutionNameMin: Cijk_Alik_Bljk_F8B8NBS_BH_Bias_HAS_SAV_UserArgs_MT128x128x128_MI16x16x1_SN_LDSB1_CLR1_GRVWA4_GRVWB16_GSU0_GSUC0_GSUWGMRR0_K1_LBSPPA1024_LBSPPB256_LPA8_LPB16_LRVW8_MIWT8_2_PLR1_SU0_SUM0_SUS128_VWA8_VWB2_WGM1_WGMXCC1_WGMXCCGn1
    SolutionIndex: 82
    SolutionNameMin: Cijk_Alik_Bljk_F8B8NBS_BH_Bias_HAS_SAV_UserArgs_MT128x128x128_MI16x16x1_SN_LDSB1_CLR1_GRVWA16_GRVWB16_GSU0_GSUC0_GSUWGMRR0_K1_LBSPPA1024_LBSPPB256_LPA32_LPB32_LRVW16_MIWT8_2_PLR1_SU0_SUM0_SUS128_VWA8_VWB2_WGM1_WGMXCC1_WGMXCCGn1
    SolutionIndex: 83
    SolutionNameMin: Cijk_Alik_Bljk_F8B8NBS_BH_Bias_HAS_SAV_UserArgs_MT128x128x128_MI16x16x1_SN_LDSB1_CLR1_GRVWA16_GRVWB16_GSU0_GSUC0_GSUWGMRR0_K1_LBSPPA1024_LBSPPB256_LPA32_LPB32_LRVW16_MIWT8_2_PLR1_SU0_SUM0_SUS128_VWA8_VWB2_WGM4_WGMXCC1_WGMXCCGn1
    SolutionIndex: 84
    SolutionNameMin: Cijk_Alik_Bljk_F8B8NBS_BH_Bias_HAS_SAV_UserArgs_MT128x128x128_MI16x16x1_SN_LDSB1_CLR1_GRVWA4_GRVWB16_GSU0_GSUC0_GSUWGMRR0_K1_LBSPPA1024_LBSPPB256_LPA32_LPB32_LRVW16_MIWT8_2_PLR1_SU0_SUM0_SUS128_VWA8_VWB2_WGM6_WGMXCC1_WGMXCCGn1
    SolutionIndex: 85
    SolutionNameMin: Cijk_Alik_Bljk_F8B8NBS_BH_Bias_HAS_SAV_UserArgs_MT128x128x128_MI16x16x1_SN_LDSB1_CLR1_GRVWA16_GRVWB16_GSU0_GSUC0_GSUWGMRR0_K1_LBSPPA1024_LBSPPB256_LPA32_LPB32_LRVW16_MIWT8_2_PLR1_SU0_SUM0_SUS128_VWA8_VWB2_WGM6_WGMXCC1_WGMXCCGn1
    SolutionIndex: 86
    SolutionNameMin: Cijk_Alik_Bljk_F8B8NBS_BH_Bias_HAS_SAV_UserArgs_MT128x128x128_MI16x16x1_SN_LDSB1_CLR1_GRVWA16_GRVWB16_GSU0_GSUC0_GSUWGMRR0_K1_LBSPPA1024_LBSPPB256_LPA32_LPB32_LRVW16_MIWT8_2_PLR1_SU0_SUM0_SUS128_VWA8_VWB2_WGM8_WGMXCC1_WGMXCCGn1
    SolutionIndex: 87
    SolutionNameMin: Cijk_Alik_Bljk_F8B8NBS_BH_Bias_HAS_SAV_UserArgs_MT128x144x128_MI16x16x1_SN_LDSB1_CLR1_GRVWA4_GRVWB4_GSU0_GSUC0_GSUWGMRR0_K1_LBSPPA256_LBSPPB128_LPA32_LPB32_LRVW16_MIWT2_9_PLR1_SU0_SUM0_SUS128_VWA2_VWB1_WGM1_WGMXCC1_WGMXCCGn1
    SolutionIndex: 88
    SolutionNameMin: Cijk_Alik_Bljk_F8B8NBS_BH_Bias_HAS_SAV_UserArgs_MT128x144x128_MI16x16x1_SN_LDSB1_CLR1_GRVWA16_GRVWB4_GSU0_GSUC0_GSUWGMRR0_K1_LBSPPA256_LBSPPB128_LPA32_LPB32_LRVW16_MIWT2_9_PLR1_SU0_SUM0_SUS128_VWA2_VWB1_WGM1_WGMXCC1_WGMXCCGn1
    SolutionIndex: 89
    SolutionNameMin: Cijk_Alik_Bljk_F8B8NBS_BH_Bias_HAS_SAV_UserArgs_MT128x144x128_MI16x16x1_SN_LDSB1_CLR1_GRVWA16_GRVWB8_GSU0_GSUC0_GSUWGMRR0_K1_LBSPPA256_LBSPPB128_LPA32_LPB32_LRVW16_MIWT2_9_PLR1_SU0_SUM0_SUS128_VWA2_VWB1_WGM1_WGMXCC1_WGMXCCGn1
    SolutionIndex: 90
    SolutionNameMin: Cijk_Alik_Bljk_F8B8NBS_BH_Bias_HAS_SAV_UserArgs_MT128x64x128_MI16x16x1_SN_LDSB1_CLR1_GRVWA16_GRVWB8_GSU0_GSUC0_GSUWGMRR0_K1_LBSPPA1024_LBSPPB128_LPA16_LPB8_LRVW8_MIWT8_1_PLR1_SU0_SUM0_SUS128_VWA8_VWB1_WGM1_WGMXCC1_WGMXCCGn1
    SolutionIndex: 91
    SolutionNameMin: Cijk_Alik_Bljk_F8B8NBS_BH_Bias_HAS_SAV_UserArgs_MT128x64x128_MI16x16x1_SN_LDSB1_CLR1_GRVWA16_GRVWB8_GSU0_GSUC0_GSUWGMRR0_K1_LBSPPA1024_LBSPPB128_LPA32_LPB32_LRVW16_MIWT8_1_PLR1_SU0_SUM0_SUS128_VWA8_VWB1_WGM1_WGMXCC1_WGMXCCGn1
    SolutionIndex: 92
    SolutionNameMin: Cijk_Alik_Bljk_F8B8NBS_BH_Bias_HAS_SAV_UserArgs_MT128x64x128_MI16x16x1_SN_LDSB1_CLR1_GRVWA16_GRVWB16_GSU0_GSUC0_GSUWGMRR0_K1_LBSPPA1024_LBSPPB128_LPA32_LPB32_LRVW16_MIWT8_1_PLR1_SU0_SUM0_SUS128_VWA8_VWB1_WGM1_WGMXCC1_WGMXCCGn1
    SolutionIndex: 93
    SolutionNameMin: Cijk_Alik_Bljk_F8B8NBS_BH_Bias_HAS_SAV_UserArgs_MT144x128x128_MI16x16x1_SN_LDSB1_CLR1_GRVWA4_GRVWB16_GSU0_GSUC0_GSUWGMRR0_K1_LBSPPA128_LBSPPB256_LPA8_LPB16_LRVW8_MIWT9_2_PLR1_SU0_SUM0_SUS128_VWA1_VWB2_WGM4_WGMXCC1_WGMXCCGn1
    SolutionIndex: 94
    SolutionNameMin: Cijk_Alik_Bljk_F8B8NBS_BH_Bias_HAS_SAV_UserArgs_MT144x128x128_MI16x16x1_SN_LDSB1_CLR1_GRVWA8_GRVWB16_GSU0_GSUC0_GSUWGMRR0_K1_LBSPPA128_LBSPPB256_LPA32_LPB32_LRVW16_MIWT9_2_PLR1_SU0_SUM0_SUS128_VWA1_VWB2_WGM4_WGMXCC1_WGMXCCGn1
    SolutionIndex: 95
    SolutionNameMin: Cijk_Alik_Bljk_F8B8NBS_BH_Bias_HAS_SAV_UserArgs_MT144x128x128_MI16x16x1_SN_LDSB1_CLR1_GRVWA4_GRVWB16_GSU0_GSUC0_GSUWGMRR0_K1_LBSPPA128_LBSPPB256_LPA32_LPB32_LRVW16_MIWT9_2_PLR1_SU0_SUM0_SUS128_VWA1_VWB2_WGM6_WGMXCC1_WGMXCCGn1
    SolutionIndex: 96
    SolutionNameMin: Cijk_Alik_Bljk_F8B8NBS_BH_Bias_HAS_SAV_UserArgs_MT144x128x128_MI16x16x1_SN_LDSB1_CLR1_GRVWA4_GRVWB16_GSU0_GSUC0_GSUWGMRR0_K1_LBSPPA128_LBSPPB256_LPA8_LPB16_LRVW8_MIWT9_2_PLR1_SU0_SUM0_SUS128_VWA1_VWB2_WGM8_WGMXCC1_WGMXCCGn1
    SolutionIndex: 97
    SolutionNameMin: Cijk_Alik_Bljk_F8B8NBS_BH_Bias_HAS_SAV_UserArgs_MT144x128x128_MI16x16x1_SN_LDSB1_CLR1_GRVWA4_GRVWB16_GSU0_GSUC0_GSUWGMRR0_K1_LBSPPA128_LBSPPB256_LPA32_LPB32_LRVW16_MIWT9_2_PLR1_SU0_SUM0_SUS128_VWA1_VWB2_WGM8_WGMXCC1_WGMXCCGn1
    SolutionIndex: 98
    SolutionNameMin: Cijk_Alik_Bljk_F8B8NBS_BH_Bias_HAS_SAV_UserArgs_MT128x128x128_MI16x16x1_SN_LDSB1_CLR1_GRVWA4_GRVWB16_GSU0_GSUC0_GSUWGMRR0_K1_LBSPPA512_LBSPPB512_LPA32_LPB32_LRVW16_MIWT4_4_PLR1_SU0_SUM0_SUS128_VWA4_VWB4_WGM1_WGMXCC1_WGMXCCGn1
    SolutionIndex: 99
    SolutionNameMin: Cijk_Alik_Bljk_F8B8NBS_BH_Bias_HAS_SAV_UserArgs_MT128x128x128_MI16x16x1_SN_LDSB1_CLR1_GRVWA16_GRVWB16_GSU0_GSUC0_GSUWGMRR0_K1_LBSPPA512_LBSPPB512_LPA32_LPB32_LRVW16_MIWT4_4_PLR1_SU0_SUM0_SUS128_VWA4_VWB4_WGM1_WGMXCC1_WGMXCCGn1
    SolutionIndex: 100
    SolutionNameMin: Cijk_Alik_Bljk_F8B8NBS_BH_Bias_HAS_SAV_UserArgs_MT128x128x128_MI16x16x1_SN_LDSB1_CLR1_GRVWA16_GRVWB16_GSU0_GSUC0_GSUWGMRR0_K1_LBSPPA512_LBSPPB512_LPA32_LPB32_LRVW16_MIWT4_4_PLR1_SU0_SUM0_SUS128_VWA4_VWB4_WGM4_WGMXCC1_WGMXCCGn1
    SolutionIndex: 101
    SolutionNameMin: Cijk_Alik_Bljk_F8B8NBS_BH_Bias_HAS_SAV_UserArgs_MT128x128x128_MI16x16x1_SN_LDSB1_CLR1_GRVWA16_GRVWB16_GSU0_GSUC0_GSUWGMRR0_K1_LBSPPA512_LBSPPB512_LPA32_LPB32_LRVW16_MIWT4_4_PLR1_SU0_SUM0_SUS128_VWA4_VWB4_WGM6_WGMXCC1_WGMXCCGn1
    SolutionIndex: 102
    SolutionNameMin: Cijk_Alik_Bljk_F8B8NBS_BH_Bias_HAS_SAV_UserArgs_MT128x128x128_MI16x16x1_SN_LDSB1_CLR1_GRVWA16_GRVWB16_GSU0_GSUC0_GSUWGMRR0_K1_LBSPPA512_LBSPPB512_LPA32_LPB32_LRVW16_MIWT4_4_PLR1_SU0_SUM0_SUS128_VWA4_VWB4_WGM8_WGMXCC1_WGMXCCGn1
    SolutionIndex: 103
    SolutionNameMin: Cijk_Alik_Bljk_F8B8NBS_BH_Bias_HAS_SAV_UserArgs_MT64x128x128_MI16x16x1_SN_LDSB1_CLR1_GRVWA8_GRVWB16_GSU0_GSUC0_GSUWGMRR0_K1_LBSPPA256_LBSPPB512_LPA32_LPB32_LRVW16_MIWT2_4_PLR1_SU0_SUM0_SUS128_VWA2_VWB4_WGM1_WGMXCC1_WGMXCCGn1
    SolutionIndex: 104
    SolutionNameMin: Cijk_Alik_Bljk_F8B8NBS_BH_Bias_HAS_SAV_UserArgs_MT64x128x128_MI16x16x1_SN_LDSB1_CLR1_GRVWA16_GRVWB16_GSU0_GSUC0_GSUWGMRR0_K1_LBSPPA256_LBSPPB512_LPA32_LPB32_LRVW16_MIWT2_4_PLR1_SU0_SUM0_SUS128_VWA2_VWB4_WGM1_WGMXCC1_WGMXCCGn1
    SolutionIndex: 105
    SolutionNameMin: Cijk_Alik_Bljk_F8B8NBS_BH_Bias_HAS_SAV_UserArgs_MT128x64x128_MI16x16x1_SN_LDSB1_CLR1_GRVWA16_GRVWB16_GSU0_GSUC0_GSUWGMRR0_K1_LBSPPA512_LBSPPB256_LPA32_LPB32_LRVW16_MIWT4_2_PLR1_SU0_SUM0_SUS128_VWA4_VWB2_WGM1_WGMXCC1_WGMXCCGn1
    SolutionIndex: 106
    SolutionNameMin: Cijk_Alik_Bljk_F8B8NBS_BH_Bias_HAS_SAV_UserArgs_MT128x64x128_MI16x16x1_SN_LDSB1_CLR1_GRVWA16_GRVWB16_GSU0_GSUC0_GSUWGMRR0_K1_LBSPPA512_LBSPPB256_LPA32_LPB32_LRVW16_MIWT4_2_PLR1_SU0_SUM0_SUS128_VWA4_VWB2_WGM4_WGMXCC1_WGMXCCGn1
    SolutionIndex: 107
    SolutionNameMin: Cijk_Alik_Bljk_F8B8NBS_BH_Bias_HAS_SAV_UserArgs_MT128x64x128_MI16x16x1_SN_LDSB1_CLR1_GRVWA16_GRVWB16_GSU0_GSUC0_GSUWGMRR0_K1_LBSPPA512_LBSPPB256_LPA32_LPB32_LRVW16_MIWT4_2_PLR1_SU0_SUM0_SUS128_VWA4_VWB2_WGM6_WGMXCC1_WGMXCCGn1
    SolutionIndex: 108
    SolutionNameMin: Cijk_Alik_Bljk_F8B8NBS_BH_Bias_HAS_SAV_UserArgs_MT128x64x128_MI16x16x1_SN_LDSB1_CLR1_GRVWA16_GRVWB16_GSU0_GSUC0_GSUWGMRR0_K1_LBSPPA512_LBSPPB256_LPA32_LPB32_LRVW16_MIWT4_2_PLR1_SU0_SUM0_SUS128_VWA4_VWB2_WGM8_WGMXCC1_WGMXCCGn1
    SolutionIndex: 109
    SolutionNameMin: Cijk_Alik_Bljk_F8B8NBS_BH_Bias_HAS_SAV_UserArgs_MT32x128x128_MI16x16x1_SN_LDSB1_CLR1_GRVWA4_GRVWB4_GSU0_GSUC0_GSUWGMRR0_K1_LBSPPA128_LBSPPB512_LPA8_LPB8_LRVW8_MIWT1_4_PLR1_SU0_SUM0_SUS128_VWA1_VWB4_WGM1_WGMXCC1_WGMXCCGn1
    SolutionIndex: 110
    SolutionNameMin: Cijk_Alik_Bljk_F8B8NBS_BH_Bias_HAS_SAV_UserArgs_MT128x32x128_MI16x16x1_SN_LDSB1_CLR1_GRVWA16_GRVWB4_GSU0_GSUC0_GSUWGMRR0_K1_LBSPPA512_LBSPPB128_LPA32_LPB32_LRVW16_MIWT4_1_PLR1_SU0_SUM0_SUS128_VWA4_VWB1_WGM6_WGMXCC1_WGMXCCGn1
    SolutionIndex: 111
    SolutionNameMin: Cijk_Alik_Bljk_F8B8NBS_BH_Bias_HAS_SAV_UserArgs_MT64x64x128_MI16x16x1_SN_LDSB1_CLR1_GRVWA4_GRVWB8_GSU0_GSUC0_GSUWGMRR0_K1_LBSPPA256_LBSPPB256_LPA8_LPB8_LRVW8_MIWT2_2_PLR1_SU0_SUM0_SUS128_VWA2_VWB2_WGM1_WGMXCC1_WGMXCCGn1
    SolutionIndex: 112
    SolutionNameMin: Cijk_Alik_Bljk_F8B8NBS_BH_Bias_HAS_SAV_UserArgs_MT64x64x128_MI16x16x1_SN_LDSB1_CLR1_GRVWA4_GRVWB8_GSU0_GSUC0_GSUWGMRR0_K1_LBSPPA256_LBSPPB256_LPA32_LPB32_LRVW16_MIWT2_2_PLR1_SU0_SUM0_SUS128_VWA2_VWB2_WGM1_WGMXCC1_WGMXCCGn1
    SolutionIndex: 113
    SolutionNameMin: Cijk_Alik_Bljk_F8B8NBS_BH_Bias_HAS_SAV_UserArgs_MT64x64x128_MI16x16x1_SN_LDSB1_CLR1_GRVWA4_GRVWB16_GSU0_GSUC0_GSUWGMRR0_K1_LBSPPA256_LBSPPB256_LPA32_LPB32_LRVW16_MIWT2_2_PLR1_SU0_SUM0_SUS128_VWA2_VWB2_WGM1_WGMXCC1_WGMXCCGn1
    SolutionIndex: 114
    SolutionNameMin: Cijk_Alik_Bljk_F8B8NBS_BH_Bias_HAS_SAV_UserArgs_MT64x64x128_MI16x16x1_SN_LDSB1_CLR1_GRVWA8_GRVWB16_GSU0_GSUC0_GSUWGMRR0_K1_LBSPPA256_LBSPPB256_LPA32_LPB32_LRVW16_MIWT2_2_PLR1_SU0_SUM0_SUS128_VWA2_VWB2_WGM1_WGMXCC1_WGMXCCGn1
    SolutionIndex: 115
    SolutionNameMin: Cijk_Alik_Bljk_F8B8NBS_BH_Bias_HAS_SAV_UserArgs_MT64x64x128_MI16x16x1_SN_LDSB1_CLR1_GRVWA16_GRVWB16_GSU0_GSUC0_GSUWGMRR0_K1_LBSPPA256_LBSPPB256_LPA32_LPB32_LRVW16_MIWT2_2_PLR1_SU0_SUM0_SUS128_VWA2_VWB2_WGM1_WGMXCC1_WGMXCCGn1
    SolutionIndex: 116
    SolutionNameMin: Cijk_Alik_Bljk_F8B8NBS_BH_Bias_HAS_SAV_UserArgs_MT64x64x128_MI16x16x1_SN_LDSB1_CLR1_GRVWA16_GRVWB16_GSU0_GSUC0_GSUWGMRR0_K1_LBSPPA256_LBSPPB256_LPA32_LPB32_LRVW16_MIWT2_2_PLR1_SU0_SUM0_SUS128_VWA2_VWB2_WGM6_WGMXCC1_WGMXCCGn1
    SolutionIndex: 117
    SolutionNameMin: Cijk_Alik_Bljk_F8B8NBS_BH_Bias_HAS_SAV_UserArgs_MT64x64x128_MI16x16x1_SN_LDSB1_CLR1_GRVWA8_GRVWB8_GSU0_GSUC0_GSUWGMRR0_K1_LBSPPA256_LBSPPB256_LPA32_LPB32_LRVW16_MIWT2_2_PLR1_SU0_SUM0_SUS128_VWA2_VWB2_WGM8_WGMXCC1_WGMXCCGn1
    SolutionIndex: 118
    SolutionNameMin: Cijk_Alik_Bljk_F8B8NBS_BH_Bias_HAS_SAV_UserArgs_MT64x64x128_MI16x16x1_SN_LDSB1_CLR1_GRVWA16_GRVWB16_GSU0_GSUC0_GSUWGMRR0_K1_LBSPPA256_LBSPPB256_LPA32_LPB32_LRVW16_MIWT2_2_PLR1_SU0_SUM0_SUS128_VWA2_VWB2_WGM8_WGMXCC1_WGMXCCGn1
    SolutionIndex: 119
    SolutionNameMin: Cijk_Alik_Bljk_F8B8NBS_BH_Bias_HAS_SAV_UserArgs_MT32x64x128_MI16x16x1_SN_LDSB0_CLR1_GRVWA4_GRVWB16_GSU0_GSUC0_GSUWGMRR0_K1_LBSPPA128_LBSPPB256_LPA8_LPB16_LRVW8_MIWT1_2_PLR1_SU0_SUM0_SUS128_VWA1_VWB2_WGM1_WGMXCC1_WGMXCCGn1
    SolutionIndex: 120
    SolutionNameMin: Cijk_Alik_Bljk_F8B8NBS_BH_Bias_HAS_SAV_UserArgs_MT32x64x128_MI16x16x1_SN_LDSB0_CLR1_GRVWA4_GRVWB4_GSU0_GSUC0_GSUWGMRR0_K1_LBSPPA128_LBSPPB256_LPA32_LPB32_LRVW16_MIWT1_2_PLR1_SU0_SUM0_SUS128_VWA1_VWB2_WGM1_WGMXCC1_WGMXCCGn1
    SolutionIndex: 121
    SolutionNameMin: Cijk_Alik_Bljk_F8B8NBS_BH_Bias_HAS_SAV_UserArgs_MT32x64x128_MI16x16x1_SN_LDSB0_CLR1_GRVWA8_GRVWB16_GSU0_GSUC0_GSUWGMRR0_K1_LBSPPA128_LBSPPB256_LPA32_LPB32_LRVW16_MIWT1_2_PLR1_SU0_SUM0_SUS128_VWA1_VWB2_WGM1_WGMXCC1_WGMXCCGn1
    SolutionIndex: 122
    SolutionNameMin: Cijk_Alik_Bljk_F8B8NBS_BH_Bias_HAS_SAV_UserArgs_MT32x64x128_MI16x16x1_SN_LDSB0_CLR1_GRVWA16_GRVWB16_GSU0_GSUC0_GSUWGMRR0_K1_LBSPPA128_LBSPPB256_LPA32_LPB32_LRVW16_MIWT1_2_PLR1_SU0_SUM0_SUS128_VWA1_VWB2_WGM1_WGMXCC1_WGMXCCGn1
    SolutionIndex: 123
    SolutionNameMin: Cijk_Alik_Bljk_F8B8NBS_BH_Bias_HAS_SAV_UserArgs_MT32x64x128_MI16x16x1_SN_LDSB0_CLR1_GRVWA16_GRVWB16_GSU0_GSUC0_GSUWGMRR0_K1_LBSPPA128_LBSPPB256_LPA16_LPB16_LRVW8_MIWT1_2_PLR1_SU0_SUM0_SUS128_VWA1_VWB2_WGM6_WGMXCC1_WGMXCCGn1
    SolutionIndex: 124
    SolutionNameMin: Cijk_Alik_Bljk_F8B8NBS_BH_Bias_HAS_SAV_UserArgs_MT32x64x128_MI16x16x1_SN_LDSB0_CLR1_GRVWA16_GRVWB16_GSU0_GSUC0_GSUWGMRR0_K1_LBSPPA128_LBSPPB256_LPA32_LPB32_LRVW16_MIWT1_2_PLR1_SU0_SUM0_SUS128_VWA1_VWB2_WGM8_WGMXCC1_WGMXCCGn1
    SolutionIndex: 125
    SolutionNameMin: Cijk_Alik_Bljk_F8B8NBS_BH_Bias_HAS_SAV_UserArgs_MT64x32x128_MI16x16x1_SN_LDSB0_CLR1_GRVWA16_GRVWB4_GSU0_GSUC0_GSUWGMRR0_K1_LBSPPA256_LBSPPB128_LPA32_LPB32_LRVW16_MIWT2_1_PLR1_SU0_SUM0_SUS128_VWA2_VWB1_WGM1_WGMXCC1_WGMXCCGn1
    SolutionIndex: 126
    SolutionNameMin: Cijk_Alik_Bljk_F8B8NBS_BH_Bias_HAS_SAV_UserArgs_MT64x32x128_MI16x16x1_SN_LDSB0_CLR1_GRVWA16_GRVWB8_GSU0_GSUC0_GSUWGMRR0_K1_LBSPPA256_LBSPPB128_LPA32_LPB32_LRVW16_MIWT2_1_PLR1_SU0_SUM0_SUS128_VWA2_VWB1_WGM1_WGMXCC1_WGMXCCGn1
    SolutionIndex: 127
    SolutionNameMin: Cijk_Alik_Bljk_F8B8NBS_BH_Bias_HAS_SAV_UserArgs_MT64x32x128_MI16x16x1_SN_LDSB0_CLR1_GRVWA16_GRVWB16_GSU0_GSUC0_GSUWGMRR0_K1_LBSPPA256_LBSPPB128_LPA32_LPB32_LRVW16_MIWT2_1_PLR1_SU0_SUM0_SUS128_VWA2_VWB1_WGM1_WGMXCC1_WGMXCCGn1
    SolutionIndex: 128
    SolutionNameMin: Cijk_Alik_Bljk_F8B8NBS_BH_Bias_HAS_SAV_UserArgs_MT64x32x128_MI16x16x1_SN_LDSB0_CLR1_GRVWA4_GRVWB8_GSU0_GSUC0_GSUWGMRR0_K1_LBSPPA256_LBSPPB128_LPA8_LPB8_LRVW8_MIWT2_1_PLR1_SU0_SUM0_SUS128_VWA2_VWB1_WGM4_WGMXCC1_WGMXCCGn1
    SolutionIndex: 129
    SolutionNameMin: Cijk_Alik_Bljk_F8B8NBS_BH_Bias_HAS_SAV_UserArgs_MT64x32x128_MI16x16x1_SN_LDSB0_CLR1_GRVWA16_GRVWB16_GSU0_GSUC0_GSUWGMRR0_K1_LBSPPA256_LBSPPB128_LPA32_LPB32_LRVW16_MIWT2_1_PLR1_SU0_SUM0_SUS128_VWA2_VWB1_WGM8_WGMXCC1_WGMXCCGn1
    SolutionIndex: 130
    SolutionNameMin: Cijk_Alik_Bljk_F8B8NBS_BH_Bias_HAS_SAV_UserArgs_MT32x32x128_MI16x16x1_SN_LDSB0_CLR1_GRVWA4_GRVWB16_GSU0_GSUC0_GSUWGMRR0_K1_LBSPPA128_LBSPPB128_LPA8_LPB16_LRVW8_MIWT1_1_PLR1_SU0_SUM0_SUS128_VWA1_VWB1_WGM1_WGMXCC1_WGMXCCGn1
    SolutionIndex: 131
    SolutionNameMin: Cijk_Alik_Bljk_F8B8NBS_BH_Bias_HAS_SAV_UserArgs_MT32x32x128_MI16x16x1_SN_LDSB0_CLR1_GRVWA8_GRVWB4_GSU0_GSUC0_GSUWGMRR0_K1_LBSPPA128_LBSPPB128_LPA32_LPB32_LRVW16_MIWT1_1_PLR1_SU0_SUM0_SUS128_VWA1_VWB1_WGM1_WGMXCC1_WGMXCCGn1
    SolutionIndex: 132
    SolutionNameMin: Cijk_Alik_Bljk_F8B8NBS_BH_Bias_HAS_SAV_UserArgs_MT32x32x128_MI16x16x1_SN_LDSB0_CLR1_GRVWA16_GRVWB4_GSU0_GSUC0_GSUWGMRR0_K1_LBSPPA128_LBSPPB128_LPA32_LPB32_LRVW16_MIWT1_1_PLR1_SU0_SUM0_SUS128_VWA1_VWB1_WGM1_WGMXCC1_WGMXCCGn1
    SolutionIndex: 133
    SolutionNameMin: Cijk_Alik_Bljk_F8B8NBS_BH_Bias_HAS_SAV_UserArgs_MT32x32x128_MI16x16x1_SN_LDSB0_CLR1_GRVWA16_GRVWB8_GSU0_GSUC0_GSUWGMRR0_K1_LBSPPA128_LBSPPB128_LPA32_LPB32_LRVW16_MIWT1_1_PLR1_SU0_SUM0_SUS128_VWA1_VWB1_WGM1_WGMXCC1_WGMXCCGn1
    SolutionIndex: 134
    SolutionNameMin: Cijk_Alik_Bljk_F8B8NBS_BH_Bias_HAS_SAV_UserArgs_MT32x32x128_MI16x16x1_SN_LDSB0_CLR1_GRVWA4_GRVWB16_GSU0_GSUC0_GSUWGMRR0_K1_LBSPPA128_LBSPPB128_LPA32_LPB32_LRVW16_MIWT1_1_PLR1_SU0_SUM0_SUS128_VWA1_VWB1_WGM1_WGMXCC1_WGMXCCGn1
    SolutionIndex: 135
    SolutionNameMin: Cijk_Alik_Bljk_F8B8NBS_BH_Bias_HAS_SAV_UserArgs_MT32x32x128_MI16x16x1_SN_LDSB0_CLR1_GRVWA8_GRVWB16_GSU0_GSUC0_GSUWGMRR0_K1_LBSPPA128_LBSPPB128_LPA32_LPB32_LRVW16_MIWT1_1_PLR1_SU0_SUM0_SUS128_VWA1_VWB1_WGM1_WGMXCC1_WGMXCCGn1
    SolutionIndex: 136
    SolutionNameMin: Cijk_Alik_Bljk_F8B8NBS_BH_Bias_HAS_SAV_UserArgs_MT32x32x128_MI16x16x1_SN_LDSB0_CLR1_GRVWA16_GRVWB16_GSU0_GSUC0_GSUWGMRR0_K1_LBSPPA128_LBSPPB128_LPA32_LPB32_LRVW16_MIWT1_1_PLR1_SU0_SUM0_SUS128_VWA1_VWB1_WGM1_WGMXCC1_WGMXCCGn1
    SolutionIndex: 137
    SolutionNameMin: Cijk_Alik_Bljk_F8B8NBS_BH_Bias_HAS_SAV_UserArgs_MT32x32x128_MI16x16x1_SN_LDSB0_CLR1_GRVWA16_GRVWB16_GSU0_GSUC0_GSUWGMRR0_K1_LBSPPA128_LBSPPB128_LPA32_LPB32_LRVW16_MIWT1_1_PLR1_SU0_SUM0_SUS128_VWA1_VWB1_WGM4_WGMXCC1_WGMXCCGn1
    SolutionIndex: 138
    SolutionNameMin: Cijk_Alik_Bljk_F8B8NBS_BH_Bias_HAS_SAV_UserArgs_MT32x32x128_MI16x16x1_SN_LDSB0_CLR1_GRVWA8_GRVWB4_GSU0_GSUC0_GSUWGMRR0_K1_LBSPPA128_LBSPPB128_LPA32_LPB32_LRVW16_MIWT1_1_PLR1_SU0_SUM0_SUS128_VWA1_VWB1_WGM6_WGMXCC1_WGMXCCGn1
    SolutionIndex: 139
    SolutionNameMin: Cijk_Alik_Bljk_F8B8NBS_BH_Bias_HAS_SAV_UserArgs_MT32x32x128_MI16x16x1_SN_LDSB0_CLR1_GRVWA16_GRVWB4_GSU0_GSUC0_GSUWGMRR0_K1_LBSPPA128_LBSPPB128_LPA32_LPB32_LRVW16_MIWT1_1_PLR1_SU0_SUM0_SUS128_VWA1_VWB1_WGM6_WGMXCC1_WGMXCCGn1
    SolutionIndex: 140
    SolutionNameMin: Cijk_Alik_Bljk_F8B8NBS_BH_Bias_HAS_SAV_UserArgs_MT32x32x128_MI16x16x1_SN_LDSB0_CLR1_GRVWA16_GRVWB4_GSU0_GSUC0_GSUWGMRR0_K1_LBSPPA128_LBSPPB128_LPA32_LPB32_LRVW16_MIWT1_1_PLR1_SU0_SUM0_SUS128_VWA1_VWB1_WGM8_WGMXCC1_WGMXCCGn1
    SolutionIndex: 141
    SolutionNameMin: Cijk_Alik_Bljk_F8B8NBS_BH_Bias_HAS_SAV_UserArgs_MT32x32x128_MI16x16x1_SN_LDSB0_CLR1_GRVWA16_GRVWB16_GSU0_GSUC0_GSUWGMRR0_K1_LBSPPA128_LBSPPB128_LPA32_LPB32_LRVW16_MIWT1_1_PLR1_SU0_SUM0_SUS128_VWA1_VWB1_WGM8_WGMXCC1_WGMXCCGn1
    SolutionIndex: 142
    SolutionNameMin: Cijk_Alik_Bljk_F8B8NBS_BH_Bias_HAS_SAV_UserArgs_MT64x144x256_MI16x16x1_SN_LDSB1_CLR1_GRVWA16_GRVWB16_GSU0_GSUC0_GSUWGMRR0_K1_LBSPPA256_LBSPPB256_LPA32_LPB32_LRVW16_MIWT1_9_PLR1_SU0_SUM0_SUS256_VWA1_VWB1_WGM1_WGMXCC1_WGMXCCGn1
    SolutionIndex: 143
    SolutionNameMin: Cijk_Alik_Bljk_F8B8NBS_BH_Bias_HAS_SAV_UserArgs_MT144x64x256_MI16x16x1_SN_LDSB1_CLR1_GRVWA16_GRVWB16_GSU0_GSUC0_GSUWGMRR0_K1_LBSPPA256_LBSPPB256_LPA32_LPB32_LRVW16_MIWT9_1_PLR1_SU0_SUM0_SUS256_VWA1_VWB1_WGM4_WGMXCC1_WGMXCCGn1
    SolutionIndex: 144
    SolutionNameMin: Cijk_Alik_Bljk_F8B8NBS_BH_Bias_HAS_SAV_UserArgs_MT64x128x256_MI16x16x1_SN_LDSB1_CLR1_GRVWA4_GRVWB16_GSU0_GSUC0_GSUWGMRR0_K1_LBSPPA512_LBSPPB1024_LPA32_LPB32_LRVW16_MIWT2_4_PLR1_SU0_SUM0_SUS256_VWA2_VWB4_WGM1_WGMXCC1_WGMXCCGn1
    SolutionIndex: 145
    SolutionNameMin: Cijk_Alik_Bljk_F8B8NBS_BH_Bias_HAS_SAV_UserArgs_MT64x128x256_MI16x16x1_SN_LDSB1_CLR1_GRVWA16_GRVWB16_GSU0_GSUC0_GSUWGMRR0_K1_LBSPPA512_LBSPPB1024_LPA32_LPB32_LRVW16_MIWT2_4_PLR1_SU0_SUM0_SUS256_VWA2_VWB4_WGM1_WGMXCC1_WGMXCCGn1
    SolutionIndex: 146
    SolutionNameMin: Cijk_Alik_Bljk_F8B8NBS_BH_Bias_HAS_SAV_UserArgs_MT64x128x256_MI16x16x1_SN_LDSB1_CLR1_GRVWA16_GRVWB16_GSU0_GSUC0_GSUWGMRR0_K1_LBSPPA512_LBSPPB1024_LPA32_LPB32_LRVW16_MIWT2_4_PLR1_SU0_SUM0_SUS256_VWA2_VWB4_WGM4_WGMXCC1_WGMXCCGn1
    SolutionIndex: 147
    SolutionNameMin: Cijk_Alik_Bljk_F8B8NBS_BH_Bias_HAS_SAV_UserArgs_MT64x128x256_MI16x16x1_SN_LDSB1_CLR1_GRVWA16_GRVWB16_GSU0_GSUC0_GSUWGMRR0_K1_LBSPPA512_LBSPPB1024_LPA32_LPB32_LRVW16_MIWT2_4_PLR1_SU0_SUM0_SUS256_VWA2_VWB4_WGM6_WGMXCC1_WGMXCCGn1
    SolutionIndex: 148
    SolutionNameMin: Cijk_Alik_Bljk_F8B8NBS_BH_Bias_HAS_SAV_UserArgs_MT128x64x256_MI16x16x1_SN_LDSB1_CLR1_GRVWA16_GRVWB16_GSU0_GSUC0_GSUWGMRR0_K1_LBSPPA1024_LBSPPB512_LPA32_LPB32_LRVW16_MIWT4_2_PLR1_SU0_SUM0_SUS256_VWA4_VWB2_WGM1_WGMXCC1_WGMXCCGn1
    SolutionIndex: 149
    SolutionNameMin: Cijk_Alik_Bljk_F8B8NBS_BH_Bias_HAS_SAV_UserArgs_MT128x64x256_MI16x16x1_SN_LDSB1_CLR1_GRVWA16_GRVWB16_GSU0_GSUC0_GSUWGMRR0_K1_LBSPPA1024_LBSPPB512_LPA32_LPB32_LRVW16_MIWT4_2_PLR1_SU0_SUM0_SUS256_VWA4_VWB2_WGM4_WGMXCC1_WGMXCCGn1
    SolutionIndex: 150
    SolutionNameMin: Cijk_Alik_Bljk_F8B8NBS_BH_Bias_HAS_SAV_UserArgs_MT128x64x256_MI16x16x1_SN_LDSB1_CLR1_GRVWA16_GRVWB16_GSU0_GSUC0_GSUWGMRR0_K1_LBSPPA1024_LBSPPB512_LPA32_LPB32_LRVW16_MIWT4_2_PLR1_SU0_SUM0_SUS256_VWA4_VWB2_WGM6_WGMXCC1_WGMXCCGn1
    SolutionIndex: 151
    SolutionNameMin: Cijk_Alik_Bljk_F8B8NBS_BH_Bias_HAS_SAV_UserArgs_MT128x64x256_MI16x16x1_SN_LDSB1_CLR1_GRVWA16_GRVWB16_GSU0_GSUC0_GSUWGMRR0_K1_LBSPPA1024_LBSPPB512_LPA32_LPB32_LRVW16_MIWT4_2_PLR1_SU0_SUM0_SUS256_VWA4_VWB2_WGM8_WGMXCC1_WGMXCCGn1
    SolutionIndex: 152
    SolutionNameMin: Cijk_Alik_Bljk_F8B8NBS_BH_Bias_HAS_SAV_UserArgs_MT64x64x256_MI16x16x1_SN_LDSB1_CLR1_GRVWA16_GRVWB16_GSU0_GSUC0_GSUWGMRR0_K1_LBSPPA512_LBSPPB512_LPA32_LPB32_LRVW16_MIWT2_2_PLR1_SU0_SUM0_SUS256_VWA2_VWB2_WGM1_WGMXCC1_WGMXCCGn1
    SolutionIndex: 153
    SolutionNameMin: Cijk_Alik_Bljk_F8B8NBS_BH_Bias_HAS_SAV_UserArgs_MT64x64x256_MI16x16x1_SN_LDSB1_CLR1_GRVWA16_GRVWB16_GSU0_GSUC0_GSUWGMRR0_K1_LBSPPA512_LBSPPB512_LPA32_LPB32_LRVW16_MIWT2_2_PLR1_SU0_SUM0_SUS256_VWA2_VWB2_WGM4_WGMXCC1_WGMXCCGn1
    SolutionIndex: 154
    SolutionNameMin: Cijk_Alik_Bljk_F8B8NBS_BH_Bias_HAS_SAV_UserArgs_MT64x64x256_MI16x16x1_SN_LDSB1_CLR1_GRVWA16_GRVWB16_GSU0_GSUC0_GSUWGMRR0_K1_LBSPPA512_LBSPPB512_LPA32_LPB32_LRVW16_MIWT2_2_PLR1_SU0_SUM0_SUS256_VWA2_VWB2_WGM6_WGMXCC1_WGMXCCGn1
    SolutionIndex: 155
    SolutionNameMin: Cijk_Alik_Bljk_F8B8NBS_BH_Bias_HAS_SAV_UserArgs_MT64x64x256_MI16x16x1_SN_LDSB1_CLR1_GRVWA16_GRVWB16_GSU0_GSUC0_GSUWGMRR0_K1_LBSPPA512_LBSPPB512_LPA32_LPB32_LRVW16_MIWT2_2_PLR1_SU0_SUM0_SUS256_VWA2_VWB2_WGM8_WGMXCC1_WGMXCCGn1
    SolutionIndex: 156
    SolutionNameMin: Cijk_Alik_Bljk_F8B8NBS_BH_Bias_HAS_SAV_UserArgs_MT32x64x256_MI16x16x1_SN_LDSB1_CLR1_GRVWA16_GRVWB16_GSU0_GSUC0_GSUWGMRR0_K1_LBSPPA256_LBSPPB512_LPA32_LPB32_LRVW16_MIWT1_2_PLR1_SU0_SUM0_SUS256_VWA1_VWB2_WGM4_WGMXCC1_WGMXCCGn1
    SolutionIndex: 157
    SolutionNameMin: Cijk_Alik_Bljk_F8B8NBS_BH_Bias_HAS_SAV_UserArgs_MT32x64x256_MI16x16x1_SN_LDSB1_CLR1_GRVWA16_GRVWB16_GSU0_GSUC0_GSUWGMRR0_K1_LBSPPA256_LBSPPB512_LPA32_LPB32_LRVW16_MIWT1_2_PLR1_SU0_SUM0_SUS256_VWA1_VWB2_WGM6_WGMXCC1_WGMXCCGn1
    SolutionIndex: 158
    SolutionNameMin: Cijk_Alik_Bljk_F8B8NBS_BH_Bias_HAS_SAV_UserArgs_MT32x64x256_MI16x16x1_SN_LDSB1_CLR1_GRVWA16_GRVWB16_GSU0_GSUC0_GSUWGMRR0_K1_LBSPPA256_LBSPPB512_LPA32_LPB32_LRVW16_MIWT1_2_PLR1_SU0_SUM0_SUS256_VWA1_VWB2_WGM8_WGMXCC1_WGMXCCGn1
    SolutionIndex: 159
    SolutionNameMin: Cijk_Alik_Bljk_F8B8NBS_BH_Bias_HAS_SAV_UserArgs_MT64x32x256_MI16x16x1_SN_LDSB1_CLR1_GRVWA16_GRVWB16_GSU0_GSUC0_GSUWGMRR0_K1_LBSPPA512_LBSPPB256_LPA32_LPB32_LRVW16_MIWT2_1_PLR1_SU0_SUM0_SUS256_VWA2_VWB1_WGM1_WGMXCC1_WGMXCCGn1
    SolutionIndex: 160
    SolutionNameMin: Cijk_Alik_Bljk_F8B8NBS_BH_Bias_HAS_SAV_UserArgs_MT32x32x256_MI16x16x1_SN_LDSB1_CLR1_GRVWA4_GRVWB8_GSU0_GSUC0_GSUWGMRR0_K1_LBSPPA256_LBSPPB256_LPA32_LPB32_LRVW16_MIWT1_1_PLR1_SU0_SUM0_SUS256_VWA1_VWB1_WGM1_WGMXCC1_WGMXCCGn1
    SolutionIndex: 161
    SolutionNameMin: Cijk_Alik_Bljk_F8B8NBS_BH_Bias_HAS_SAV_UserArgs_MT32x32x256_MI16x16x1_SN_LDSB1_CLR1_GRVWA16_GRVWB16_GSU0_GSUC0_GSUWGMRR0_K1_LBSPPA256_LBSPPB256_LPA32_LPB32_LRVW16_MIWT1_1_PLR1_SU0_SUM0_SUS256_VWA1_VWB1_WGM1_WGMXCC1_WGMXCCGn1
    SolutionIndex: 162
    SolutionNameMin: Cijk_Alik_Bljk_F8B8NBS_BH_Bias_HAS_SAV_UserArgs_MT32x32x256_MI16x16x1_SN_LDSB1_CLR1_GRVWA16_GRVWB16_GSU0_GSUC0_GSUWGMRR0_K1_LBSPPA256_LBSPPB256_LPA32_LPB32_LRVW16_MIWT1_1_PLR1_SU0_SUM0_SUS256_VWA1_VWB1_WGM4_WGMXCC1_WGMXCCGn1
    SolutionIndex: 163
    SolutionNameMin: Cijk_Alik_Bljk_F8B8NBS_BH_Bias_HAS_SAV_UserArgs_MT32x32x256_MI16x16x1_SN_LDSB1_CLR1_GRVWA16_GRVWB16_GSU0_GSUC0_GSUWGMRR0_K1_LBSPPA256_LBSPPB256_LPA32_LPB32_LRVW16_MIWT1_1_PLR1_SU0_SUM0_SUS256_VWA1_VWB1_WGM8_WGMXCC1_WGMXCCGn1
    SolutionIndex: 164
    SolutionNameMin: Cijk_Alik_Bljk_F8B8NBS_BH_Bias_HAS_SAV_UserArgs_MT32x32x32_MI16x16x1_SN_LDSB0_CLR0_GRVWA4_GRVWB4_GSU0_GSUC0_GSUWGMRR0_K1_LBSPPA128_LBSPPB128_LPA8_LPB8_LRVW8_MIWT1_1_PLR0_SU32_SUM0_SUS256_VWA1_VWB1_WGM8_WGMXCC1_WGMXCCGn1
- - - [128, 128, 1, 128, 128, 128, 128, 128]
    - [119, 0.51]
  - - [128, 128, 1, 256, 128, 128, 256, 256]
    - [160, 0.93]
  - - [128, 128, 1, 512, 128, 128, 512, 512]
    - [132, 1.88]
  - - [128, 128, 1, 1024, 128, 128, 1024, 1024]
    - [132, 3.47]
  - - [128, 128, 1, 2048, 128, 128, 2048, 2048]
    - [136, 5.75]
  - - [128, 128, 1, 4096, 128, 128, 4096, 4096]
    - [161, 8.19]
  - - [128, 128, 1, 8192, 128, 128, 8192, 8192]
    - [161, 10.41]
  - - [128, 256, 1, 128, 128, 128, 128, 128]
    - [42, 0.94]
  - - [128, 256, 1, 256, 128, 128, 256, 256]
    - [139, 1.77]
  - - [128, 256, 1, 512, 128, 128, 512, 512]
    - [135, 3.5]
  - - [128, 256, 1, 1024, 128, 128, 1024, 1024]
    - [136, 7.38]
  - - [128, 256, 1, 2048, 128, 128, 2048, 2048]
    - [161, 11.68]
  - - [128, 256, 1, 4096, 128, 128, 4096, 4096]
    - [136, 16.42]
  - - [128, 256, 1, 8192, 128, 128, 8192, 8192]
    - [161, 20.92]
  - - [128, 512, 1, 128, 128, 128, 128, 128]
    - [109, 1.8]
  - - [128, 512, 1, 256, 128, 128, 256, 256]
    - [41, 3.75]
  - - [128, 512, 1, 512, 128, 128, 512, 512]
    - [138, 6.7]
  - - [128, 512, 1, 1024, 128, 128, 1024, 1024]
    - [163, 12.87]
  - - [128, 512, 1, 2048, 128, 128, 2048, 2048]
    - [136, 22.67]
  - - [128, 512, 1, 4096, 128, 128, 4096, 4096]
    - [161, 32.65]
  - - [128, 512, 1, 8192, 128, 128, 8192, 8192]
    - [161, 41.3]
  - - [128, 1024, 1, 128, 128, 128, 128, 128]
    - [140, 3.71]
  - - [128, 1024, 1, 256, 128, 128, 256, 256]
    - [36, 7.04]
  - - [128, 1024, 1, 512, 128, 128, 512, 512]
    - [161, 13.54]
  - - [128, 1024, 1, 1024, 128, 128, 1024, 1024]
    - [136, 27.77]
  - - [128, 1024, 1, 2048, 128, 128, 2048, 2048]
    - [161, 43.86]
  - - [128, 1024, 1, 4096, 128, 128, 4096, 4096]
    - [161, 64.31]
  - - [128, 1024, 1, 8192, 128, 128, 8192, 8192]
    - [136, 80.95]
  - - [128, 2048, 1, 128, 128, 128, 128, 128]
    - [40, 5.26]
  - - [128, 2048, 1, 256, 128, 128, 256, 256]
    - [25, 10.6]
  - - [128, 2048, 1, 512, 128, 128, 512, 512]
    - [37, 19.26]
  - - [128, 2048, 1, 1024, 128, 128, 1024, 1024]
    - [121, 49.06]
  - - [128, 2048, 1, 2048, 128, 128, 2048, 2048]
    - [121, 75.16]
  - - [128, 2048, 1, 4096, 128, 128, 4096, 4096]
    - [122, 100.62]
  - - [128, 2048, 1, 8192, 128, 128, 8192, 8192]
    - [159, 117.68]
  - - [128, 4096, 1, 128, 128, 128, 128, 128]
    - [116, 14.59]
  - - [128, 4096, 1, 256, 128, 128, 256, 256]
    - [112, 27.6]
  - - [128, 4096, 1, 512, 128, 128, 512, 512]
    - [115, 50.69]
  - - [128, 4096, 1, 1024, 128, 128, 1024, 1024]
    - [116, 81.34]
  - - [128, 4096, 1, 2048, 128, 128, 2048, 2048]
    - [152, 121.78]
  - - [128, 4096, 1, 4096, 128, 128, 4096, 4096]
    - [152, 158.45]
  - - [128, 4096, 1, 8192, 128, 128, 8192, 8192]
    - [152, 174.92]
  - - [128, 8192, 1, 128, 128, 128, 128, 128]
    - [27, 26.03]
  - - [128, 8192, 1, 256, 128, 128, 256, 256]
    - [105, 47.5]
  - - [128, 8192, 1, 512, 128, 128, 512, 512]
    - [105, 81.27]
  - - [128, 8192, 1, 1024, 128, 128, 1024, 1024]
    - [105, 125.93]
  - - [128, 8192, 1, 2048, 128, 128, 2048, 2048]
    - [148, 177.64]
  - - [128, 8192, 1, 4096, 128, 128, 4096, 4096]
    - [145, 195.19]
  - - [128, 8192, 1, 8192, 128, 128, 8192, 8192]
    - [145, 225.57]
  - - [256, 128, 1, 128, 256, 256, 128, 128]
    - [136, 1.23]
  - - [256, 128, 1, 256, 256, 256, 256, 256]
    - [134, 2.32]
  - - [256, 128, 1, 512, 256, 256, 512, 512]
    - [161, 4.2]
  - - [256, 128, 1, 1024, 256, 256, 1024, 1024]
    - [136, 7.49]
  - - [256, 128, 1, 2048, 256, 256, 2048, 2048]
    - [136, 11.63]
  - - [256, 128, 1, 4096, 256, 256, 4096, 4096]
    - [161, 16.44]
  - - [256, 128, 1, 8192, 256, 256, 8192, 8192]
    - [161, 20.96]
  - - [256, 256, 1, 128, 256, 256, 128, 128]
    - [110, 1.96]
  - - [256, 256, 1, 256, 256, 256, 256, 256]
    - [128, 3.85]
  - - [256, 256, 1, 512, 256, 256, 512, 512]
    - [136, 8.61]
  - - [256, 256, 1, 1024, 256, 256, 1024, 1024]
    - [161, 14.88]
  - - [256, 256, 1, 2048, 256, 256, 2048, 2048]
    - [136, 23.54]
  - - [256, 256, 1, 4096, 256, 256, 4096, 4096]
    - [136, 32.46]
  - - [256, 256, 1, 8192, 256, 256, 8192, 8192]
    - [161, 41.88]
  - - [256, 512, 1, 128, 256, 256, 128, 128]
    - [132, 4.81]
  - - [256, 512, 1, 256, 256, 256, 256, 256]
    - [136, 9.1]
  - - [256, 512, 1, 512, 256, 256, 512, 512]
    - [136, 16.69]
  - - [256, 512, 1, 1024, 256, 256, 1024, 1024]
    - [136, 28.72]
  - - [256, 512, 1, 2048, 256, 256, 2048, 2048]
    - [134, 45.2]
  - - [256, 512, 1, 4096, 256, 256, 4096, 4096]
    - [161, 63.67]
  - - [256, 512, 1, 8192, 256, 256, 8192, 8192]
    - [161, 81.19]
  - - [256, 1024, 1, 128, 256, 256, 128, 128]
    - [129, 8.55]
  - - [256, 1024, 1, 256, 256, 256, 256, 256]
    - [127, 16.38]
  - - [256, 1024, 1, 512, 256, 256, 512, 512]
    - [127, 30.02]
  - - [256, 1024, 1, 1024, 256, 256, 1024, 1024]
    - [122, 49.55]
  - - [256, 1024, 1, 2048, 256, 256, 2048, 2048]
    - [122, 75.46]
  - - [256, 1024, 1, 4096, 256, 256, 4096, 4096]
    - [121, 100.87]
  - - [256, 1024, 1, 8192, 256, 256, 8192, 8192]
    - [159, 118.99]
  - - [256, 2048, 1, 128, 256, 256, 128, 128]
    - [115, 15.88]
  - - [256, 2048, 1, 256, 256, 256, 256, 256]
    - [34, 27.94]
  - - [256, 2048, 1, 512, 256, 256, 512, 512]
    - [115, 50.66]
  - - [256, 2048, 1, 1024, 256, 256, 1024, 1024]
    - [115, 82.55]
  - - [256, 2048, 1, 2048, 256, 256, 2048, 2048]
    - [152, 119.76]
  - - [256, 2048, 1, 4096, 256, 256, 4096, 4096]
    - [152, 157.25]
  - - [256, 2048, 1, 8192, 256, 256, 8192, 8192]
    - [152, 181.48]
  - - [256, 4096, 1, 128, 256, 256, 128, 128]
    - [27, 25.78]
  - - [256, 4096, 1, 256, 256, 256, 256, 256]
    - [105, 47.69]
  - - [256, 4096, 1, 512, 256, 256, 512, 512]
    - [105, 80.57]
  - - [256, 4096, 1, 1024, 256, 256, 1024, 1024]
    - [105, 126.28]
  - - [256, 4096, 1, 2048, 256, 256, 2048, 2048]
    - [148, 177.42]
  - - [256, 4096, 1, 4096, 256, 256, 4096, 4096]
    - [148, 205.46]
  - - [256, 4096, 1, 8192, 256, 256, 8192, 8192]
    - [145, 231.94]
  - - [256, 8192, 1, 128, 256, 256, 128, 128]
    - [24, 39.51]
  - - [256, 8192, 1, 256, 256, 256, 256, 256]
    - [81, 70.17]
  - - [256, 8192, 1, 512, 256, 256, 512, 512]
    - [82, 120.4]
  - - [256, 8192, 1, 1024, 256, 256, 1024, 1024]
    - [82, 184.13]
  - - [256, 8192, 1, 2048, 256, 256, 2048, 2048]
    - [99, 239.19]
  - - [256, 8192, 1, 4096, 256, 256, 4096, 4096]
    - [142, 230.79]
  - - [256, 8192, 1, 8192, 256, 256, 8192, 8192]
    - [99, 283.79]
  - - [512, 128, 1, 128, 512, 512, 128, 128]
    - [136, 2.4]
  - - [512, 128, 1, 256, 512, 512, 256, 256]
    - [134, 4.55]
  - - [512, 128, 1, 512, 512, 512, 512, 512]
    - [161, 8.26]
  - - [512, 128, 1, 1024, 512, 512, 1024, 1024]
    - [136, 14.91]
  - - [512, 128, 1, 2048, 512, 512, 2048, 2048]
    - [136, 23.07]
  - - [512, 128, 1, 4096, 512, 512, 4096, 4096]
    - [161, 32.52]
  - - [512, 128, 1, 8192, 512, 512, 8192, 8192]
    - [161, 41.27]
  - - [512, 256, 1, 128, 512, 512, 128, 128]
    - [131, 4.78]
  - - [512, 256, 1, 256, 512, 512, 256, 256]
    - [136, 9.03]
  - - [512, 256, 1, 512, 512, 512, 512, 512]
    - [141, 16.32]
  - - [512, 256, 1, 1024, 512, 512, 1024, 1024]
    - [161, 28.5]
  - - [512, 256, 1, 2048, 512, 512, 2048, 2048]
    - [161, 44.76]
  - - [512, 256, 1, 4096, 512, 512, 4096, 4096]
    - [161, 63.48]
  - - [512, 256, 1, 8192, 512, 512, 8192, 8192]
    - [163, 80.25]
  - - [512, 512, 1, 128, 512, 512, 128, 128]
    - [125, 8.89]
  - - [512, 512, 1, 256, 512, 512, 256, 256]
    - [126, 16.43]
  - - [512, 512, 1, 512, 512, 512, 512, 512]
    - [122, 29.41]
  - - [512, 512, 1, 1024, 512, 512, 1024, 1024]
    - [122, 49.35]
  - - [512, 512, 1, 2048, 512, 512, 2048, 2048]
    - [122, 74.32]
  - - [512, 512, 1, 4096, 512, 512, 4096, 4096]
    - [121, 100.15]
  - - [512, 512, 1, 8192, 512, 512, 8192, 8192]
    - [156, 116.57]
  - - [512, 1024, 1, 128, 512, 512, 128, 128]
    - [111, 15.16]
  - - [512, 1024, 1, 256, 512, 512, 256, 256]
    - [113, 28.07]
  - - [512, 1024, 1, 512, 512, 512, 512, 512]
    - [114, 49.46]
  - - [512, 1024, 1, 1024, 512, 512, 1024, 1024]
    - [115, 81.65]
  - - [512, 1024, 1, 2048, 512, 512, 2048, 2048]
    - [152, 118.88]
  - - [512, 1024, 1, 4096, 512, 512, 4096, 4096]
    - [152, 156.64]
  - - [512, 1024, 1, 8192, 512, 512, 8192, 8192]
    - [152, 180.95]
  - - [512, 2048, 1, 128, 512, 512, 128, 128]
    - [92, 24.99]
  - - [512, 2048, 1, 256, 512, 512, 256, 256]
    - [29, 45.5]
  - - [512, 2048, 1, 512, 512, 512, 512, 512]
    - [108, 79.28]
  - - [512, 2048, 1, 1024, 512, 512, 1024, 1024]
    - [104, 125.5]
  - - [512, 2048, 1, 2048, 512, 512, 2048, 2048]
    - [148, 179.06]
  - - [512, 2048, 1, 4096, 512, 512, 4096, 4096]
    - [148, 218.05]
  - - [512, 2048, 1, 8192, 512, 512, 8192, 8192]
    - [144, 234.72]
  - - [512, 4096, 1, 128, 512, 512, 128, 128]
    - [82, 39.68]
  - - [512, 4096, 1, 256, 512, 512, 256, 256]
    - [82, 70.52]
  - - [512, 4096, 1, 512, 512, 512, 512, 512]
    - [82, 119.77]
  - - [512, 4096, 1, 1024, 512, 512, 1024, 1024]
    - [99, 183.86]
  - - [512, 4096, 1, 2048, 512, 512, 2048, 2048]
    - [99, 252.92]
  - - [512, 4096, 1, 4096, 512, 512, 4096, 4096]
    - [98, 241.25]
  - - [512, 4096, 1, 8192, 512, 512, 8192, 8192]
    - [98, 297.76]
  - - [512, 8192, 1, 128, 512, 512, 128, 128]
    - [26, 57.43]
  - - [512, 8192, 1, 256, 512, 512, 256, 256]
    - [26, 104.15]
  - - [512, 8192, 1, 512, 512, 512, 512, 512]
    - [88, 174.15]
  - - [512, 8192, 1, 1024, 512, 512, 1024, 1024]
    - [89, 241.26]
  - - [512, 8192, 1, 2048, 512, 512, 2048, 2048]
    - [87, 266.91]
  - - [512, 8192, 1, 4096, 512, 512, 4096, 4096]
    - [89, 303.63]
  - - [512, 8192, 1, 8192, 512, 512, 8192, 8192]
    - [89, 309.58]
  - - [1024, 128, 1, 128, 1024, 1024, 128, 128]
    - [130, 4.78]
  - - [1024, 128, 1, 256, 1024, 1024, 256, 256]
    - [133, 8.97]
  - - [1024, 128, 1, 512, 1024, 1024, 512, 512]
    - [161, 16.38]
  - - [1024, 128, 1, 1024, 1024, 1024, 1024, 1024]
    - [136, 28.6]
  - - [1024, 128, 1, 2048, 1024, 1024, 2048, 2048]
    - [137, 44.81]
  - - [1024, 128, 1, 4096, 1024, 1024, 4096, 4096]
    - [162, 62.65]
  - - [1024, 128, 1, 8192, 1024, 1024, 8192, 8192]
    - [162, 79.8]
  - - [1024, 256, 1, 128, 1024, 1024, 128, 128]
    - [120, 7.07]
  - - [1024, 256, 1, 256, 1024, 1024, 256, 256]
    - [153, 13.99]
  - - [1024, 256, 1, 512, 1024, 1024, 512, 512]
    - [129, 28.21]
  - - [1024, 256, 1, 1024, 1024, 1024, 1024, 1024]
    - [122, 47.67]
  - - [1024, 256, 1, 2048, 1024, 1024, 2048, 2048]
    - [124, 73.41]
  - - [1024, 256, 1, 4096, 1024, 1024, 4096, 4096]
    - [122, 98.49]
  - - [1024, 256, 1, 8192, 1024, 1024, 8192, 8192]
    - [158, 119.26]
  - - [1024, 512, 1, 128, 1024, 1024, 128, 128]
    - [117, 14.43]
  - - [1024, 512, 1, 256, 1024, 1024, 256, 256]
    - [33, 27.44]
  - - [1024, 512, 1, 512, 1024, 1024, 512, 512]
    - [116, 49.29]
  - - [1024, 512, 1, 1024, 1024, 1024, 1024, 1024]
    - [118, 80.17]
  - - [1024, 512, 1, 2048, 1024, 1024, 2048, 2048]
    - [152, 118.9]
  - - [1024, 512, 1, 4096, 1024, 1024, 4096, 4096]
    - [153, 155.53]
  - - [1024, 512, 1, 8192, 1024, 1024, 8192, 8192]
    - [153, 180.78]
  - - [1024, 1024, 1, 128, 1024, 1024, 128, 128]
    - [105, 25.76]
  - - [1024, 1024, 1, 256, 1024, 1024, 256, 256]
    - [104, 46.52]
  - - [1024, 1024, 1, 512, 1024, 1024, 512, 512]
    - [105, 80.93]
  - - [1024, 1024, 1, 1024, 1024, 1024, 1024, 1024]
    - [105, 126.34]
  - - [1024, 1024, 1, 2048, 1024, 1024, 2048, 2048]
    - [145, 176.03]
  - - [1024, 1024, 1, 4096, 1024, 1024, 4096, 4096]
    - [146, 211.68]
  - - [1024, 1024, 1, 8192, 1024, 1024, 8192, 8192]
    - [146, 233.1]
  - - [1024, 2048, 1, 128, 1024, 1024, 128, 128]
    - [82, 39.35]
  - - [1024, 2048, 1, 256, 1024, 1024, 256, 256]
    - [82, 70.61]
  - - [1024, 2048, 1, 512, 1024, 1024, 512, 512]
    - [82, 119.78]
  - - [1024, 2048, 1, 1024, 1024, 1024, 1024, 1024]
    - [82, 183.61]
  - - [1024, 2048, 1, 2048, 1024, 1024, 2048, 2048]
    - [99, 244.76]
  - - [1024, 2048, 1, 4096, 1024, 1024, 4096, 4096]
    - [99, 241.01]
  - - [1024, 2048, 1, 8192, 1024, 1024, 8192, 8192]
    - [99, 283.03]
  - - [1024, 4096, 1, 128, 1024, 1024, 128, 128]
    - [17, 55.16]
  - - [1024, 4096, 1, 256, 1024, 1024, 256, 256]
    - [16, 95.03]
  - - [1024, 4096, 1, 512, 1024, 1024, 512, 512]
    - [10, 151.15]
  - - [1024, 4096, 1, 1024, 1024, 1024, 1024, 1024]
    - [64, 213.58]
  - - [1024, 4096, 1, 2048, 1024, 1024, 2048, 2048]
    - [63, 253.22]
  - - [1024, 4096, 1, 4096, 1024, 1024, 4096, 4096]
    - [68, 288.95]
  - - [1024, 4096, 1, 8192, 1024, 1024, 8192, 8192]
    - [66, 284.66]
  - - [1024, 8192, 1, 128, 1024, 1024, 128, 128]
    - [9, 73.5]
  - - [1024, 8192, 1, 256, 1024, 1024, 256, 256]
    - [8, 130.58]
  - - [1024, 8192, 1, 512, 1024, 1024, 512, 512]
    - [57, 200.53]
  - - [1024, 8192, 1, 1024, 1024, 1024, 1024, 1024]
    - [50, 260.72]
  - - [1024, 8192, 1, 2048, 1024, 1024, 2048, 2048]
    - [57, 320.84]
  - - [1024, 8192, 1, 4096, 1024, 1024, 4096, 4096]
    - [49, 350.94]
  - - [1024, 8192, 1, 8192, 1024, 1024, 8192, 8192]
    - [47, 363.6]
  - - [2048, 128, 1, 128, 2048, 2048, 128, 128]
    - [38, 8.5]
  - - [2048, 128, 1, 256, 2048, 2048, 256, 256]
    - [35, 9.56]
  - - [2048, 128, 1, 512, 2048, 2048, 512, 512]
    - [39, 18.47]
  - - [2048, 128, 1, 1024, 2048, 2048, 1024, 1024]
    - [123, 42.45]
  - - [2048, 128, 1, 2048, 2048, 2048, 2048, 2048]
    - [122, 72.7]
  - - [2048, 128, 1, 4096, 2048, 2048, 4096, 4096]
    - [122, 98.0]
  - - [2048, 128, 1, 8192, 2048, 2048, 8192, 8192]
    - [157, 119.21]
  - - [2048, 256, 1, 128, 2048, 2048, 128, 128]
    - [90, 12.75]
  - - [2048, 256, 1, 256, 2048, 2048, 256, 256]
    - [32, 19.68]
  - - [2048, 256, 1, 512, 2048, 2048, 512, 512]
    - [103, 41.53]
  - - [2048, 256, 1, 1024, 2048, 2048, 1024, 1024]
    - [155, 80.61]
  - - [2048, 256, 1, 2048, 2048, 2048, 2048, 2048]
    - [155, 119.02]
  - - [2048, 256, 1, 4096, 2048, 2048, 4096, 4096]
    - [155, 156.5]
  - - [2048, 256, 1, 8192, 2048, 2048, 8192, 8192]
    - [153, 180.7]
  - - [2048, 512, 1, 128, 2048, 2048, 128, 128]
    - [30, 25.45]
  - - [2048, 512, 1, 256, 2048, 2048, 256, 256]
    - [104, 46.86]
  - - [2048, 512, 1, 512, 2048, 2048, 512, 512]
    - [104, 79.35]
  - - [2048, 512, 1, 1024, 2048, 2048, 1024, 1024]
    - [104, 125.56]
  - - [2048, 512, 1, 2048, 2048, 2048, 2048, 2048]
    - [151, 175.65]
  - - [2048, 512, 1, 4096, 2048, 2048, 4096, 4096]
    - [146, 214.76]
  - - [2048, 512, 1, 8192, 2048, 2048, 8192, 8192]
    - [147, 234.24]
  - - [2048, 1024, 1, 128, 2048, 2048, 128, 128]
    - [82, 39.34]
  - - [2048, 1024, 1, 256, 2048, 2048, 256, 256]
    - [82, 70.37]
  - - [2048, 1024, 1, 512, 2048, 2048, 512, 512]
    - [82, 120.08]
  - - [2048, 1024, 1, 1024, 2048, 2048, 1024, 1024]
    - [99, 183.47]
  - - [2048, 1024, 1, 2048, 2048, 2048, 2048, 2048]
    - [100, 242.03]
  - - [2048, 1024, 1, 4096, 2048, 2048, 4096, 4096]
    - [83, 239.34]
  - - [2048, 1024, 1, 8192, 2048, 2048, 8192, 8192]
    - [102, 290.33]
  - - [2048, 2048, 1, 128, 2048, 2048, 128, 128]
    - [14, 53.49]
  - - [2048, 2048, 1, 256, 2048, 2048, 256, 256]
    - [11, 93.69]
  - - [2048, 2048, 1, 512, 2048, 2048, 512, 512]
    - [12, 145.87]
  - - [2048, 2048, 1, 1024, 2048, 2048, 1024, 1024]
    - [64, 207.95]
  - - [2048, 2048, 1, 2048, 2048, 2048, 2048, 2048]
    - [69, 253.99]
  - - [2048, 2048, 1, 4096, 2048, 2048, 4096, 4096]
    - [69, 288.24]
  - - [2048, 2048, 1, 8192, 2048, 2048, 8192, 8192]
    - [46, 281.4]
  - - [2048, 4096, 1, 128, 2048, 2048, 128, 128]
    - [1, 63.39]
  - - [2048, 4096, 1, 256, 2048, 2048, 256, 256]
    - [1, 109.23]
  - - [2048, 4096, 1, 512, 2048, 2048, 512, 512]
    - [1, 167.03]
  - - [2048, 4096, 1, 1024, 2048, 2048, 1024, 1024]
    - [4, 222.49]
  - - [2048, 4096, 1, 2048, 2048, 2048, 2048, 2048]
    - [2, 267.63]
  - - [2048, 4096, 1, 4096, 2048, 2048, 4096, 4096]
    - [54, 285.34]
  - - [2048, 4096, 1, 8192, 2048, 2048, 8192, 8192]
    - [60, 321.77]
  - - [2048, 8192, 1, 128, 2048, 2048, 128, 128]
    - [59, 74.04]
  - - [2048, 8192, 1, 256, 2048, 2048, 256, 256]
    - [8, 129.92]
  - - [2048, 8192, 1, 512, 2048, 2048, 512, 512]
    - [53, 201.99]
  - - [2048, 8192, 1, 1024, 2048, 2048, 1024, 1024]
    - [51, 267.96]
  - - [2048, 8192, 1, 2048, 2048, 2048, 2048, 2048]
    - [58, 313.06]
  - - [2048, 8192, 1, 4096, 2048, 2048, 4096, 4096]
    - [52, 324.28]
  - - [2048, 8192, 1, 8192, 2048, 2048, 8192, 8192]
    - [52, 375.17]
  - - [4096, 128, 1, 128, 4096, 4096, 128, 128]
    - [31, 13.94]
  - - [4096, 128, 1, 256, 4096, 4096, 256, 256]
    - [115, 29.17]
  - - [4096, 128, 1, 512, 4096, 4096, 512, 512]
    - [115, 51.67]
  - - [4096, 128, 1, 1024, 4096, 4096, 1024, 1024]
    - [115, 81.89]
  - - [4096, 128, 1, 2048, 4096, 4096, 2048, 2048]
    - [152, 120.43]
  - - [4096, 128, 1, 4096, 4096, 4096, 4096, 4096]
    - [155, 156.91]
  - - [4096, 128, 1, 8192, 4096, 4096, 8192, 8192]
    - [154, 177.87]
  - - [4096, 256, 1, 128, 4096, 4096, 128, 128]
    - [28, 25.04]
  - - [4096, 256, 1, 256, 4096, 4096, 256, 256]
    - [92, 45.94]
  - - [4096, 256, 1, 512, 4096, 4096, 512, 512]
    - [105, 81.67]
  - - [4096, 256, 1, 1024, 4096, 4096, 1024, 1024]
    - [105, 125.94]
  - - [4096, 256, 1, 2048, 4096, 4096, 2048, 2048]
    - [151, 176.69]
  - - [4096, 256, 1, 4096, 4096, 4096, 4096, 4096]
    - [150, 209.97]
  - - [4096, 256, 1, 8192, 4096, 4096, 8192, 8192]
    - [147, 231.61]
  - - [4096, 512, 1, 128, 4096, 4096, 128, 128]
    - [22, 39.18]
  - - [4096, 512, 1, 256, 4096, 4096, 256, 256]
    - [82, 70.12]
  - - [4096, 512, 1, 512, 4096, 4096, 512, 512]
    - [83, 117.28]
  - - [4096, 512, 1, 1024, 4096, 4096, 1024, 1024]
    - [85, 182.72]
  - - [4096, 512, 1, 2048, 4096, 4096, 2048, 2048]
    - [102, 243.1]
  - - [4096, 512, 1, 4096, 4096, 4096, 4096, 4096]
    - [84, 240.41]
  - - [4096, 512, 1, 8192, 4096, 4096, 8192, 8192]
    - [100, 293.18]
  - - [4096, 1024, 1, 128, 4096, 4096, 128, 128]
    - [14, 52.46]
  - - [4096, 1024, 1, 256, 4096, 4096, 256, 256]
    - [15, 91.86]
  - - [4096, 1024, 1, 512, 4096, 4096, 512, 512]
    - [68, 141.32]
  - - [4096, 1024, 1, 1024, 4096, 4096, 1024, 1024]
    - [67, 206.27]
  - - [4096, 1024, 1, 2048, 4096, 4096, 2048, 2048]
    - [69, 257.53]
  - - [4096, 1024, 1, 4096, 4096, 4096, 4096, 4096]
    - [66, 286.55]
  - - [4096, 1024, 1, 8192, 4096, 4096, 8192, 8192]
    - [70, 281.6]
  - - [4096, 2048, 1, 128, 4096, 4096, 128, 128]
    - [14, 59.92]
  - - [4096, 2048, 1, 256, 4096, 4096, 256, 256]
    - [0, 103.78]
  - - [4096, 2048, 1, 512, 4096, 4096, 512, 512]
    - [3, 156.93]
  - - [4096, 2048, 1, 1024, 4096, 4096, 1024, 1024]
    - [3, 220.68]
  - - [4096, 2048, 1, 2048, 4096, 4096, 2048, 2048]
    - [2, 265.69]
  - - [4096, 2048, 1, 4096, 4096, 4096, 4096, 4096]
    - [43, 291.55]
  - - [4096, 2048, 1, 8192, 4096, 4096, 8192, 8192]
    - [44, 318.72]
  - - [4096, 4096, 1, 128, 4096, 4096, 128, 128]
    - [1, 69.21]
  - - [4096, 4096, 1, 256, 4096, 4096, 256, 256]
    - [1, 119.93]
  - - [4096, 4096, 1, 512, 4096, 4096, 512, 512]
    - [1, 174.07]
  - - [4096, 4096, 1, 1024, 4096, 4096, 1024, 1024]
    - [86, 227.53]
  - - [4096, 4096, 1, 2048, 4096, 4096, 2048, 2048]
    - [55, 256.04]
  - - [4096, 4096, 1, 4096, 4096, 4096, 4096, 4096]
    - [45, 296.53]
  - - [4096, 4096, 1, 8192, 4096, 4096, 8192, 8192]
    - [71, 357.41]
  - - [4096, 8192, 1, 128, 4096, 4096, 128, 128]
    - [5, 81.77]
  - - [4096, 8192, 1, 256, 4096, 4096, 256, 256]
    - [48, 141.92]
  - - [4096, 8192, 1, 512, 4096, 4096, 512, 512]
    - [56, 202.41]
  - - [4096, 8192, 1, 1024, 4096, 4096, 1024, 1024]
    - [57, 249.47]
  - - [4096, 8192, 1, 2048, 4096, 4096, 2048, 2048]
    - [57, 296.62]
  - - [4096, 8192, 1, 4096, 4096, 4096, 4096, 4096]
    - [60, 335.26]
  - - [4096, 8192, 1, 8192, 4096, 4096, 8192, 8192]
    - [61, 393.06]
  - - [8192, 128, 1, 128, 8192, 8192, 128, 128]
    - [91, 24.87]
  - - [8192, 128, 1, 256, 8192, 8192, 256, 256]
    - [107, 45.1]
  - - [8192, 128, 1, 512, 8192, 8192, 512, 512]
    - [106, 78.67]
  - - [8192, 128, 1, 1024, 8192, 8192, 1024, 1024]
    - [106, 122.29]
  - - [8192, 128, 1, 2048, 8192, 8192, 2048, 2048]
    - [145, 175.7]
  - - [8192, 128, 1, 4096, 8192, 8192, 4096, 4096]
    - [149, 194.28]
  - - [8192, 128, 1, 8192, 8192, 8192, 8192, 8192]
    - [151, 223.46]
  - - [8192, 256, 1, 128, 8192, 8192, 128, 128]
    - [23, 38.15]
  - - [8192, 256, 1, 256, 8192, 8192, 256, 256]
    - [82, 68.89]
  - - [8192, 256, 1, 512, 8192, 8192, 512, 512]
    - [101, 116.18]
  - - [8192, 256, 1, 1024, 8192, 8192, 1024, 1024]
    - [85, 179.81]
  - - [8192, 256, 1, 2048, 8192, 8192, 2048, 2048]
    - [102, 231.44]
  - - [8192, 256, 1, 4096, 8192, 8192, 4096, 4096]
    - [143, 231.16]
  - - [8192, 256, 1, 8192, 8192, 8192, 8192, 8192]
    - [101, 286.65]
  - - [8192, 512, 1, 128, 8192, 8192, 128, 128]
    - [13, 51.97]
  - - [8192, 512, 1, 256, 8192, 8192, 256, 256]
    - [93, 90.62]
  - - [8192, 512, 1, 512, 8192, 8192, 512, 512]
    - [96, 151.0]
  - - [8192, 512, 1, 1024, 8192, 8192, 1024, 1024]
    - [94, 229.45]
  - - [8192, 512, 1, 2048, 8192, 8192, 2048, 2048]
    - [69, 253.9]
  - - [8192, 512, 1, 4096, 8192, 8192, 4096, 4096]
    - [95, 312.55]
  - - [8192, 512, 1, 8192, 8192, 8192, 8192, 8192]
    - [97, 346.51]
  - - [8192, 1024, 1, 128, 8192, 8192, 128, 128]
    - [20, 60.47]
  - - [8192, 1024, 1, 256, 8192, 8192, 256, 256]
    - [18, 110.82]
  - - [8192, 1024, 1, 512, 8192, 8192, 512, 512]
    - [74, 181.94]
  - - [8192, 1024, 1, 1024, 8192, 8192, 1024, 1024]
    - [72, 229.14]
  - - [8192, 1024, 1, 2048, 8192, 8192, 2048, 2048]
    - [75, 313.8]
  - - [8192, 1024, 1, 4096, 8192, 8192, 4096, 4096]
    - [73, 364.58]
  - - [8192, 1024, 1, 8192, 8192, 8192, 8192, 8192]
    - [80, 392.77]
  - - [8192, 2048, 1, 128, 8192, 8192, 128, 128]
    - [19, 69.16]
  - - [8192, 2048, 1, 256, 8192, 8192, 256, 256]
    - [21, 121.67]
  - - [8192, 2048, 1, 512, 8192, 8192, 512, 512]
    - [78, 186.13]
  - - [8192, 2048, 1, 1024, 8192, 8192, 1024, 1024]
    - [78, 252.36]
  - - [8192, 2048, 1, 2048, 8192, 8192, 2048, 2048]
    - [80, 312.29]
  - - [8192, 2048, 1, 4096, 8192, 8192, 4096, 4096]
    - [73, 341.29]
  - - [8192, 2048, 1, 8192, 8192, 8192, 8192, 8192]
    - [77, 406.72]
  - - [8192, 4096, 1, 128, 8192, 8192, 128, 128]
    - [20, 73.31]
  - - [8192, 4096, 1, 256, 8192, 8192, 256, 256]
    - [20, 123.91]
  - - [8192, 4096, 1, 512, 8192, 8192, 512, 512]
    - [77, 183.14]
  - - [8192, 4096, 1, 1024, 8192, 8192, 1024, 1024]
    - [76, 246.35]
  - - [8192, 4096, 1, 2048, 8192, 8192, 2048, 2048]
    - [73, 298.17]
  - - [8192, 4096, 1, 4096, 8192, 8192, 4096, 4096]
    - [76, 353.91]
  - - [8192, 4096, 1, 8192, 8192, 8192, 8192, 8192]
    - [76, 431.54]
  - - [8192, 8192, 1, 128, 8192, 8192, 128, 128]
    - [6, 75.17]
  - - [8192, 8192, 1, 256, 8192, 8192, 256, 256]
    - [7, 122.98]
  - - [8192, 8192, 1, 512, 8192, 8192, 512, 512]
    - [65, 177.18]
  - - [8192, 8192, 1, 1024, 8192, 8192, 1024, 1024]
    - [62, 241.83]
  - - [8192, 8192, 1, 2048, 8192, 8192, 2048, 2048]
    - [76, 303.29]
  - - [8192, 8192, 1, 4096, 8192, 8192, 4096, 4096]
    - [76, 360.85]
  - - [8192, 8192, 1, 8192, 8192, 8192, 8192, 8192]
    - [79, 428.9]
  - - [1, 1, 1, 32, 1, 1, 32, 32]
    - [164, 0.0]
- null
- null
- ExperimentalStreamK
- GridBased
