projects/hipblaslt/library/src/amd_detail/rocblaslt/src/Tensile/Logic/asm_full/aquavanjaram/gfx942_228cu/StreamK/aquavanjaram942_Cijk_Ailk_Bljk_HHS_BH_Bias_HAS_SAV_UserArgs.yaml
- {MinimumRequiredVersion: 4.33.0}
- aquavanjaram942
- {Architecture: gfx942, CUCount: 228}
- [Device 0049, Device 0050]
    SolutionIndex: 0
    SolutionNameMin: Cijk_Ailk_Bljk_HHS_BH_Bias_AS_SAV_UserArgs_MT256x256x32_MI16x16x1_SN_LDSB1_CLR1_GRVWA8_GSU0_GSUC0_GSUWGMRR0_K1_LBSPPA2048_LBSPPB512_LPA0_MIWT8_8_PLR1_SU0_SUM0_SUS64_VWA8_VWB8_WGM1_WGMXCC1_WGMXCCGn1
    SolutionIndex: 1
    SolutionNameMin: Cijk_Ailk_Bljk_HHS_BH_Bias_AS_SAV_UserArgs_MT256x256x32_MI16x16x1_SN_LDSB1_CLR1_GRVWA8_GSU0_GSUC0_GSUWGMRR0_K1_LBSPPA2048_LBSPPB512_LPA0_MIWT8_8_PLR1_SU0_SUM0_SUS64_VWA8_VWB8_WGM1_WGMXCC1_WGMXCCGn1
    SolutionIndex: 2
    SolutionNameMin: Cijk_Ailk_Bljk_HHS_BH_Bias_AS_SAV_UserArgs_MT256x256x32_MI16x16x1_SN_LDSB1_CLR1_GRVWA2_GSU0_GSUC0_GSUWGMRR0_K1_LBSPPA2048_LBSPPB512_LPA0_MIWT8_8_PLR1_SU0_SUM0_SUS64_VWA8_VWB8_WGM1_WGMXCC1_WGMXCCGn1
    SolutionIndex: 3
    SolutionNameMin: Cijk_Ailk_Bljk_HHS_BH_Bias_AS_SAV_UserArgs_MT256x256x32_MI16x16x1_SN_LDSB1_CLR1_GRVWA8_GSU0_GSUC0_GSUWGMRR0_K1_LBSPPA2048_LBSPPB512_LPA0_MIWT8_8_PLR1_SU0_SUM0_SUS64_VWA8_VWB8_WGM1_WGMXCC1_WGMXCCGn1
    SolutionIndex: 4
    SolutionNameMin: Cijk_Ailk_Bljk_HHS_BH_Bias_AS_SAV_UserArgs_MT256x256x32_MI16x16x1_SN_LDSB1_CLR1_GRVWA8_GSU0_GSUC0_GSUWGMRR0_K1_LBSPPA4096_LBSPPB512_LPA0_MIWT8_8_PLR1_SU0_SUM0_SUS64_VWA8_VWB8_WGM1_WGMXCC1_WGMXCCGn1
    SolutionIndex: 5
    SolutionNameMin: Cijk_Ailk_Bljk_HHS_BH_Bias_AS_SAV_UserArgs_MT256x256x32_MI16x16x1_SN_LDSB1_CLR1_GRVWA2_GSU0_GSUC0_GSUWGMRR0_K1_LBSPPA2048_LBSPPB512_LPA0_MIWT8_8_PLR1_SU0_SUM0_SUS64_VWA8_VWB8_WGM4_WGMXCC1_WGMXCCGn1
    SolutionIndex: 6
    SolutionNameMin: Cijk_Ailk_Bljk_HHS_BH_Bias_AS_SAV_UserArgs_MT256x256x32_MI16x16x1_SN_LDSB1_CLR1_GRVWA8_GSU0_GSUC0_GSUWGMRR0_K1_LBSPPA2048_LBSPPB512_LPA0_MIWT8_8_PLR1_SU0_SUM0_SUS64_VWA8_VWB8_WGM4_WGMXCC1_WGMXCCGn1
    SolutionIndex: 7
    SolutionNameMin: Cijk_Ailk_Bljk_HHS_BH_Bias_AS_SAV_UserArgs_MT256x256x32_MI16x16x1_SN_LDSB1_CLR1_GRVWA8_GSU0_GSUC0_GSUWGMRR0_K1_LBSPPA4096_LBSPPB512_LPA0_MIWT8_8_PLR1_SU0_SUM0_SUS64_VWA8_VWB8_WGM4_WGMXCC1_WGMXCCGn1
    SolutionIndex: 8
    SolutionNameMin: Cijk_Ailk_Bljk_HHS_BH_Bias_AS_SAV_UserArgs_MT256x256x32_MI16x16x1_SN_LDSB1_CLR1_GRVWA8_GSU0_GSUC0_GSUWGMRR0_K1_LBSPPA2048_LBSPPB512_LPA0_MIWT8_8_PLR1_SU0_SUM0_SUS64_VWA8_VWB8_WGM6_WGMXCC1_WGMXCCGn1
    SolutionIndex: 9
    SolutionNameMin: Cijk_Ailk_Bljk_HHS_BH_Bias_AS_SAV_UserArgs_MT256x256x32_MI16x16x1_SN_LDSB1_CLR1_GRVWA8_GSU0_GSUC0_GSUWGMRR0_K1_LBSPPA2048_LBSPPB512_LPA0_MIWT8_8_PLR1_SU0_SUM0_SUS64_VWA8_VWB8_WGM6_WGMXCC1_WGMXCCGn1
    SolutionIndex: 10
    SolutionNameMin: Cijk_Ailk_Bljk_HHS_BH_Bias_AS_SAV_UserArgs_MT256x256x32_MI16x16x1_SN_LDSB1_CLR1_GRVWA8_GSU0_GSUC0_GSUWGMRR0_K1_LBSPPA4096_LBSPPB512_LPA0_MIWT8_8_PLR1_SU0_SUM0_SUS64_VWA8_VWB8_WGM6_WGMXCC1_WGMXCCGn1
    SolutionIndex: 11
    SolutionNameMin: Cijk_Ailk_Bljk_HHS_BH_Bias_AS_SAV_UserArgs_MT256x256x32_MI16x16x1_SN_LDSB1_CLR1_GRVWA2_GSU0_GSUC0_GSUWGMRR0_K1_LBSPPA2048_LBSPPB512_LPA0_MIWT8_8_PLR1_SU0_SUM0_SUS64_VWA8_VWB8_WGM8_WGMXCC1_WGMXCCGn1
    SolutionIndex: 12
    SolutionNameMin: Cijk_Ailk_Bljk_HHS_BH_Bias_AS_SAV_UserArgs_MT256x256x32_MI16x16x1_SN_LDSB1_CLR1_GRVWA4_GSU0_GSUC0_GSUWGMRR0_K1_LBSPPA2048_LBSPPB512_LPA0_MIWT8_8_PLR1_SU0_SUM0_SUS64_VWA8_VWB8_WGM8_WGMXCC1_WGMXCCGn1
    SolutionIndex: 13
    SolutionNameMin: Cijk_Ailk_Bljk_HHS_BH_Bias_AS_SAV_UserArgs_MT256x256x32_MI16x16x1_SN_LDSB1_CLR1_GRVWA8_GSU0_GSUC0_GSUWGMRR0_K1_LBSPPA2048_LBSPPB512_LPA0_MIWT8_8_PLR1_SU0_SUM0_SUS64_VWA8_VWB8_WGM8_WGMXCC1_WGMXCCGn1
    SolutionIndex: 14
    SolutionNameMin: Cijk_Ailk_Bljk_HHS_BH_Bias_AS_SAV_UserArgs_MT128x256x32_MI16x16x1_SN_LDSB1_CLR1_GRVWA2_GSU0_GSUC0_GSUWGMRR0_K1_LBSPPA1024_LBSPPB512_LPA0_MIWT4_8_PLR1_SU0_SUM0_SUS64_VWA4_VWB8_WGM1_WGMXCC1_WGMXCCGn1
    SolutionIndex: 15
    SolutionNameMin: Cijk_Ailk_Bljk_HHS_BH_Bias_AS_SAV_UserArgs_MT256x128x32_MI16x16x1_SN_LDSB1_CLR1_GRVWA8_GSU0_GSUC0_GSUWGMRR0_K1_LBSPPA2048_LBSPPB256_LPA0_MIWT8_4_PLR1_SU0_SUM0_SUS64_VWA8_VWB4_WGM1_WGMXCC1_WGMXCCGn1
    SolutionIndex: 16
    SolutionNameMin: Cijk_Ailk_Bljk_HHS_BH_Bias_AS_SAV_UserArgs_MT256x128x32_MI16x16x1_SN_LDSB1_CLR1_GRVWA2_GSU0_GSUC0_GSUWGMRR0_K1_LBSPPA2048_LBSPPB256_LPA0_MIWT8_4_PLR1_SU0_SUM0_SUS64_VWA8_VWB4_WGM1_WGMXCC1_WGMXCCGn1
    SolutionIndex: 17
    SolutionNameMin: Cijk_Ailk_Bljk_HHS_BH_Bias_AS_SAV_UserArgs_MT256x128x32_MI16x16x1_SN_LDSB1_CLR1_GRVWA8_GSU0_GSUC0_GSUWGMRR0_K1_LBSPPA2048_LBSPPB256_LPA0_MIWT8_4_PLR1_SU0_SUM0_SUS64_VWA8_VWB4_WGM1_WGMXCC1_WGMXCCGn1
    SolutionIndex: 18
    SolutionNameMin: Cijk_Ailk_Bljk_HHS_BH_Bias_AS_SAV_UserArgs_MT256x128x32_MI16x16x1_SN_LDSB1_CLR1_GRVWA8_GSU0_GSUC0_GSUWGMRR0_K1_LBSPPA2048_LBSPPB256_LPA0_MIWT8_4_PLR1_SU0_SUM0_SUS64_VWA8_VWB4_WGM1_WGMXCC1_WGMXCCGn1
    SolutionIndex: 19
    SolutionNameMin: Cijk_Ailk_Bljk_HHS_BH_Bias_AS_SAV_UserArgs_MT256x128x32_MI16x16x1_SN_LDSB1_CLR1_GRVWA8_GSU0_GSUC0_GSUWGMRR0_K1_LBSPPA2048_LBSPPB256_LPA0_MIWT8_4_PLR1_SU0_SUM0_SUS64_VWA8_VWB4_WGM4_WGMXCC1_WGMXCCGn1
    SolutionIndex: 20
    SolutionNameMin: Cijk_Ailk_Bljk_HHS_BH_Bias_AS_SAV_UserArgs_MT256x128x32_MI16x16x1_SN_LDSB1_CLR1_GRVWA8_GSU0_GSUC0_GSUWGMRR0_K1_LBSPPA2048_LBSPPB256_LPA0_MIWT8_4_PLR1_SU0_SUM0_SUS64_VWA8_VWB4_WGM4_WGMXCC1_WGMXCCGn1
    SolutionIndex: 21
    SolutionNameMin: Cijk_Ailk_Bljk_HHS_BH_Bias_AS_SAV_UserArgs_MT256x128x32_MI16x16x1_SN_LDSB1_CLR1_GRVWA8_GSU0_GSUC0_GSUWGMRR0_K1_LBSPPA2048_LBSPPB256_LPA0_MIWT8_4_PLR1_SU0_SUM0_SUS64_VWA8_VWB4_WGM4_WGMXCC1_WGMXCCGn1
    SolutionIndex: 22
    SolutionNameMin: Cijk_Ailk_Bljk_HHS_BH_Bias_AS_SAV_UserArgs_MT256x128x32_MI16x16x1_SN_LDSB1_CLR1_GRVWA8_GSU0_GSUC0_GSUWGMRR0_K1_LBSPPA2048_LBSPPB256_LPA0_MIWT8_4_PLR1_SU0_SUM0_SUS64_VWA8_VWB4_WGM6_WGMXCC1_WGMXCCGn1
    SolutionIndex: 23
    SolutionNameMin: Cijk_Ailk_Bljk_HHS_BH_Bias_AS_SAV_UserArgs_MT256x128x32_MI16x16x1_SN_LDSB1_CLR1_GRVWA8_GSU0_GSUC0_GSUWGMRR0_K1_LBSPPA2048_LBSPPB256_LPA0_MIWT8_4_PLR1_SU0_SUM0_SUS64_VWA8_VWB4_WGM8_WGMXCC1_WGMXCCGn1
    SolutionIndex: 24
    SolutionNameMin: Cijk_Ailk_Bljk_HHS_BH_Bias_AS_SAV_UserArgs_MT256x128x32_MI16x16x1_SN_LDSB1_CLR1_GRVWA8_GSU0_GSUC0_GSUWGMRR0_K1_LBSPPA2048_LBSPPB256_LPA0_MIWT8_4_PLR1_SU0_SUM0_SUS64_VWA8_VWB4_WGM8_WGMXCC1_WGMXCCGn1
    SolutionIndex: 25
    SolutionNameMin: Cijk_Ailk_Bljk_HHS_BH_Bias_AS_SAV_UserArgs_MT128x64x32_MI16x16x1_SN_LDSB0_CLR1_GRVWA8_GSU0_GSUC0_GSUWGMRR0_K1_LBSPPA1024_LBSPPB128_LPA0_MIWT4_2_PLR1_SU0_SUM0_SUS64_VWA4_VWB2_WGM1_WGMXCC1_WGMXCCGn1
    SolutionIndex: 26
    SolutionNameMin: Cijk_Ailk_Bljk_HHS_BH_Bias_AS_SAV_UserArgs_MT128x64x32_MI16x16x1_SN_LDSB0_CLR1_GRVWA2_GSU0_GSUC0_GSUWGMRR0_K1_LBSPPA2048_LBSPPB128_LPA0_MIWT4_2_PLR1_SU0_SUM0_SUS64_VWA4_VWB2_WGM1_WGMXCC1_WGMXCCGn1
    SolutionIndex: 27
    SolutionNameMin: Cijk_Ailk_Bljk_HHS_BH_Bias_AS_SAV_UserArgs_MT128x64x32_MI16x16x1_SN_LDSB0_CLR1_GRVWA2_GSU0_GSUC0_GSUWGMRR0_K1_LBSPPA1024_LBSPPB128_LPA0_MIWT4_2_PLR1_SU0_SUM0_SUS64_VWA4_VWB2_WGM8_WGMXCC1_WGMXCCGn1
    SolutionIndex: 28
    SolutionNameMin: Cijk_Ailk_Bljk_HHS_BH_Bias_AS_SAV_UserArgs_MT128x32x32_MI16x16x1_SN_LDSB0_CLR1_GRVWA8_GSU0_GSUC0_GSUWGMRR0_K1_LBSPPA1024_LBSPPB128_LPA0_MIWT4_1_PLR1_SU0_SUM0_SUS64_VWA4_VWB1_WGM1_WGMXCC1_WGMXCCGn1
    SolutionIndex: 29
    SolutionNameMin: Cijk_Ailk_Bljk_HHS_BH_Bias_AS_SAV_UserArgs_MT64x64x32_MI16x16x1_SN_LDSB0_CLR1_GRVWA2_GSU0_GSUC0_GSUWGMRR0_K1_LBSPPA512_LBSPPB128_LPA32_MIWT2_2_PLR1_SU0_SUM0_SUS64_VWA2_VWB2_WGM1_WGMXCC1_WGMXCCGn1
    SolutionIndex: 30
    SolutionNameMin: Cijk_Ailk_Bljk_HHS_BH_Bias_AS_SAV_UserArgs_MT64x64x32_MI16x16x1_SN_LDSB0_CLR1_GRVWA8_GSU0_GSUC0_GSUWGMRR0_K1_LBSPPA512_LBSPPB128_LPA32_MIWT2_2_PLR1_SU0_SUM0_SUS64_VWA2_VWB2_WGM1_WGMXCC1_WGMXCCGn1
    SolutionIndex: 31
    SolutionNameMin: Cijk_Ailk_Bljk_HHS_BH_Bias_AS_SAV_UserArgs_MT64x64x32_MI16x16x1_SN_LDSB0_CLR1_GRVWA2_GSU0_GSUC0_GSUWGMRR0_K1_LBSPPA512_LBSPPB128_LPA32_MIWT2_2_PLR1_SU0_SUM0_SUS64_VWA2_VWB2_WGM4_WGMXCC1_WGMXCCGn1
    SolutionIndex: 32
    SolutionNameMin: Cijk_Ailk_Bljk_HHS_BH_Bias_AS_SAV_UserArgs_MT64x32x32_MI16x16x1_SN_LDSB0_CLR1_GRVWA2_GSU0_GSUC0_GSUWGMRR0_K1_LBSPPA512_LBSPPB128_LPA32_MIWT2_1_PLR1_SU0_SUM0_SUS64_VWA2_VWB1_WGM6_WGMXCC1_WGMXCCGn1
    SolutionIndex: 33
    SolutionNameMin: Cijk_Ailk_Bljk_HHS_BH_Bias_AS_SAV_UserArgs_MT128x256x64_MI16x16x1_SN_LDSB1_CLR1_GRVWA2_GSU0_GSUC0_GSUWGMRR0_K1_LBSPPA2048_LBSPPB1024_LPA0_MIWT4_8_PLR1_SU0_SUM0_SUS128_VWA4_VWB8_WGM1_WGMXCC1_WGMXCCGn1
    SolutionIndex: 34
    SolutionNameMin: Cijk_Ailk_Bljk_HHS_BH_Bias_AS_SAV_UserArgs_MT128x256x64_MI16x16x1_SN_LDSB1_CLR1_GRVWA8_GSU0_GSUC0_GSUWGMRR0_K1_LBSPPA2048_LBSPPB1024_LPA0_MIWT4_8_PLR1_SU0_SUM0_SUS128_VWA4_VWB8_WGM1_WGMXCC1_WGMXCCGn1
    SolutionIndex: 35
    SolutionNameMin: Cijk_Ailk_Bljk_HHS_BH_Bias_AS_SAV_UserArgs_MT128x256x64_MI16x16x1_SN_LDSB1_CLR1_GRVWA8_GSU0_GSUC0_GSUWGMRR0_K1_LBSPPA2048_LBSPPB1024_LPA0_MIWT4_8_PLR1_SU0_SUM0_SUS128_VWA4_VWB8_WGM4_WGMXCC1_WGMXCCGn1
    SolutionIndex: 36
    SolutionNameMin: Cijk_Ailk_Bljk_HHS_BH_Bias_AS_SAV_UserArgs_MT128x256x64_MI16x16x1_SN_LDSB1_CLR1_GRVWA8_GSU0_GSUC0_GSUWGMRR0_K1_LBSPPA2048_LBSPPB1024_LPA0_MIWT4_8_PLR1_SU0_SUM0_SUS128_VWA4_VWB8_WGM6_WGMXCC1_WGMXCCGn1
    SolutionIndex: 37
    SolutionNameMin: Cijk_Ailk_Bljk_HHS_BH_Bias_AS_SAV_UserArgs_MT128x256x64_MI16x16x1_SN_LDSB1_CLR1_GRVWA8_GSU0_GSUC0_GSUWGMRR0_K1_LBSPPA2048_LBSPPB1024_LPA0_MIWT4_8_PLR1_SU0_SUM0_SUS128_VWA4_VWB8_WGM8_WGMXCC1_WGMXCCGn1
    SolutionIndex: 38
    SolutionNameMin: Cijk_Ailk_Bljk_HHS_BH_Bias_AS_SAV_UserArgs_MT256x128x64_MI16x16x1_SN_LDSB1_CLR1_GRVWA8_GSU0_GSUC0_GSUWGMRR0_K1_LBSPPA4096_LBSPPB512_LPA0_MIWT8_4_PLR1_SU0_SUM0_SUS128_VWA8_VWB4_WGM1_WGMXCC1_WGMXCCGn1
    SolutionIndex: 39
    SolutionNameMin: Cijk_Ailk_Bljk_HHS_BH_Bias_AS_SAV_UserArgs_MT256x128x64_MI16x16x1_SN_LDSB1_CLR1_GRVWA8_GSU0_GSUC0_GSUWGMRR0_K1_LBSPPA4096_LBSPPB512_LPA0_MIWT8_4_PLR1_SU0_SUM0_SUS128_VWA8_VWB4_WGM1_WGMXCC1_WGMXCCGn1
    SolutionIndex: 40
    SolutionNameMin: Cijk_Ailk_Bljk_HHS_BH_Bias_AS_SAV_UserArgs_MT256x128x64_MI16x16x1_SN_LDSB1_CLR1_GRVWA2_GSU0_GSUC0_GSUWGMRR0_K1_LBSPPA4096_LBSPPB512_LPA0_MIWT8_4_PLR1_SU0_SUM0_SUS128_VWA8_VWB4_WGM4_WGMXCC1_WGMXCCGn1
    SolutionIndex: 41
    SolutionNameMin: Cijk_Ailk_Bljk_HHS_BH_Bias_AS_SAV_UserArgs_MT256x128x64_MI16x16x1_SN_LDSB1_CLR1_GRVWA8_GSU0_GSUC0_GSUWGMRR0_K1_LBSPPA4096_LBSPPB512_LPA0_MIWT8_4_PLR1_SU0_SUM0_SUS128_VWA8_VWB4_WGM4_WGMXCC1_WGMXCCGn1
    SolutionIndex: 42
    SolutionNameMin: Cijk_Ailk_Bljk_HHS_BH_Bias_AS_SAV_UserArgs_MT256x128x64_MI16x16x1_SN_LDSB1_CLR1_GRVWA8_GSU0_GSUC0_GSUWGMRR0_K1_LBSPPA4096_LBSPPB512_LPA0_MIWT8_4_PLR1_SU0_SUM0_SUS128_VWA8_VWB4_WGM6_WGMXCC1_WGMXCCGn1
    SolutionIndex: 43
    SolutionNameMin: Cijk_Ailk_Bljk_HHS_BH_Bias_AS_SAV_UserArgs_MT256x128x64_MI16x16x1_SN_LDSB1_CLR1_GRVWA2_GSU0_GSUC0_GSUWGMRR0_K1_LBSPPA4096_LBSPPB512_LPA0_MIWT8_4_PLR1_SU0_SUM0_SUS128_VWA8_VWB4_WGM8_WGMXCC1_WGMXCCGn1
    SolutionIndex: 44
    SolutionNameMin: Cijk_Ailk_Bljk_HHS_BH_Bias_AS_SAV_UserArgs_MT256x128x64_MI16x16x1_SN_LDSB1_CLR1_GRVWA8_GSU0_GSUC0_GSUWGMRR0_K1_LBSPPA4096_LBSPPB512_LPA0_MIWT8_4_PLR1_SU0_SUM0_SUS128_VWA8_VWB4_WGM8_WGMXCC1_WGMXCCGn1
    SolutionIndex: 45
    SolutionNameMin: Cijk_Ailk_Bljk_HHS_BH_Bias_AS_SAV_UserArgs_MT256x64x64_MI16x16x1_SN_LDSB1_CLR1_GRVWA8_GSU0_GSUC0_GSUWGMRR0_K1_LBSPPA2048_LBSPPB256_LPA0_MIWT8_2_PLR1_SU0_SUM0_SUS128_VWA8_VWB2_WGM1_WGMXCC1_WGMXCCGn1
    SolutionIndex: 46
    SolutionNameMin: Cijk_Ailk_Bljk_HHS_BH_Bias_AS_SAV_UserArgs_MT256x64x64_MI16x16x1_SN_LDSB1_CLR1_GRVWA8_GSU0_GSUC0_GSUWGMRR0_K1_LBSPPA4096_LBSPPB256_LPA0_MIWT8_2_PLR1_SU0_SUM0_SUS128_VWA8_VWB2_WGM1_WGMXCC1_WGMXCCGn1
    SolutionIndex: 47
    SolutionNameMin: Cijk_Ailk_Bljk_HHS_BH_Bias_AS_SAV_UserArgs_MT256x64x64_MI16x16x1_SN_LDSB1_CLR1_GRVWA8_GSU0_GSUC0_GSUWGMRR0_K1_LBSPPA4096_LBSPPB256_LPA0_MIWT8_2_PLR1_SU0_SUM0_SUS128_VWA8_VWB2_WGM4_WGMXCC1_WGMXCCGn1
    SolutionIndex: 48
    SolutionNameMin: Cijk_Ailk_Bljk_HHS_BH_Bias_AS_SAV_UserArgs_MT256x64x64_MI16x16x1_SN_LDSB1_CLR1_GRVWA8_GSU0_GSUC0_GSUWGMRR0_K1_LBSPPA4096_LBSPPB256_LPA0_MIWT8_2_PLR1_SU0_SUM0_SUS128_VWA8_VWB2_WGM6_WGMXCC1_WGMXCCGn1
    SolutionIndex: 49
    SolutionNameMin: Cijk_Ailk_Bljk_HHS_BH_Bias_AS_SAV_UserArgs_MT256x64x64_MI16x16x1_SN_LDSB1_CLR1_GRVWA8_GSU0_GSUC0_GSUWGMRR0_K1_LBSPPA4096_LBSPPB256_LPA0_MIWT8_2_PLR1_SU0_SUM0_SUS128_VWA8_VWB2_WGM8_WGMXCC1_WGMXCCGn1
    SolutionIndex: 50
    SolutionNameMin: Cijk_Ailk_Bljk_HHS_BH_Bias_AS_SAV_UserArgs_MT128x128x64_MI16x16x1_SN_LDSB1_CLR1_GRVWA2_GSU0_GSUC0_GSUWGMRR0_K1_LBSPPA2048_LBSPPB512_LPA0_MIWT4_4_PLR1_SU0_SUM0_SUS128_VWA4_VWB4_WGM1_WGMXCC1_WGMXCCGn1
    SolutionIndex: 51
    SolutionNameMin: Cijk_Ailk_Bljk_HHS_BH_Bias_AS_SAV_UserArgs_MT128x128x64_MI16x16x1_SN_LDSB1_CLR1_GRVWA8_GSU0_GSUC0_GSUWGMRR0_K1_LBSPPA2048_LBSPPB512_LPA0_MIWT4_4_PLR1_SU0_SUM0_SUS128_VWA4_VWB4_WGM1_WGMXCC1_WGMXCCGn1
    SolutionIndex: 52
    SolutionNameMin: Cijk_Ailk_Bljk_HHS_BH_Bias_AS_SAV_UserArgs_MT128x128x64_MI16x16x1_SN_LDSB1_CLR1_GRVWA2_GSU0_GSUC0_GSUWGMRR0_K1_LBSPPA2048_LBSPPB512_LPA0_MIWT4_4_PLR1_SU0_SUM0_SUS128_VWA4_VWB4_WGM4_WGMXCC1_WGMXCCGn1
    SolutionIndex: 53
    SolutionNameMin: Cijk_Ailk_Bljk_HHS_BH_Bias_AS_SAV_UserArgs_MT128x128x64_MI16x16x1_SN_LDSB1_CLR1_GRVWA8_GSU0_GSUC0_GSUWGMRR0_K1_LBSPPA2048_LBSPPB512_LPA0_MIWT4_4_PLR1_SU0_SUM0_SUS128_VWA4_VWB4_WGM4_WGMXCC1_WGMXCCGn1
    SolutionIndex: 54
    SolutionNameMin: Cijk_Ailk_Bljk_HHS_BH_Bias_AS_SAV_UserArgs_MT128x128x64_MI16x16x1_SN_LDSB1_CLR1_GRVWA2_GSU0_GSUC0_GSUWGMRR0_K1_LBSPPA2048_LBSPPB512_LPA0_MIWT4_4_PLR1_SU0_SUM0_SUS128_VWA4_VWB4_WGM6_WGMXCC1_WGMXCCGn1
    SolutionIndex: 55
    SolutionNameMin: Cijk_Ailk_Bljk_HHS_BH_Bias_AS_SAV_UserArgs_MT128x128x64_MI16x16x1_SN_LDSB1_CLR1_GRVWA8_GSU0_GSUC0_GSUWGMRR0_K1_LBSPPA2048_LBSPPB512_LPA0_MIWT4_4_PLR1_SU0_SUM0_SUS128_VWA4_VWB4_WGM6_WGMXCC1_WGMXCCGn1
    SolutionIndex: 56
    SolutionNameMin: Cijk_Ailk_Bljk_HHS_BH_Bias_AS_SAV_UserArgs_MT128x128x64_MI16x16x1_SN_LDSB1_CLR1_GRVWA8_GSU0_GSUC0_GSUWGMRR0_K1_LBSPPA1024_LBSPPB512_LPA0_MIWT4_4_PLR1_SU0_SUM0_SUS128_VWA4_VWB4_WGM8_WGMXCC1_WGMXCCGn1
    SolutionIndex: 57
    SolutionNameMin: Cijk_Ailk_Bljk_HHS_BH_Bias_AS_SAV_UserArgs_MT128x128x64_MI16x16x1_SN_LDSB1_CLR1_GRVWA2_GSU0_GSUC0_GSUWGMRR0_K1_LBSPPA2048_LBSPPB512_LPA0_MIWT4_4_PLR1_SU0_SUM0_SUS128_VWA4_VWB4_WGM8_WGMXCC1_WGMXCCGn1
    SolutionIndex: 58
    SolutionNameMin: Cijk_Ailk_Bljk_HHS_BH_Bias_AS_SAV_UserArgs_MT128x128x64_MI16x16x1_SN_LDSB1_CLR1_GRVWA8_GSU0_GSUC0_GSUWGMRR0_K1_LBSPPA2048_LBSPPB512_LPA0_MIWT4_4_PLR1_SU0_SUM0_SUS128_VWA4_VWB4_WGM8_WGMXCC1_WGMXCCGn1
    SolutionIndex: 59
    SolutionNameMin: Cijk_Ailk_Bljk_HHS_BH_Bias_AS_SAV_UserArgs_MT128x64x64_MI16x16x1_SN_LDSB1_CLR1_GRVWA2_GSU0_GSUC0_GSUWGMRR0_K1_LBSPPA2048_LBSPPB256_LPA0_MIWT4_2_PLR1_SU0_SUM0_SUS128_VWA4_VWB2_WGM1_WGMXCC1_WGMXCCGn1
    SolutionIndex: 60
    SolutionNameMin: Cijk_Ailk_Bljk_HHS_BH_Bias_AS_SAV_UserArgs_MT128x64x64_MI16x16x1_SN_LDSB1_CLR1_GRVWA8_GSU0_GSUC0_GSUWGMRR0_K1_LBSPPA2048_LBSPPB256_LPA0_MIWT4_2_PLR1_SU0_SUM0_SUS128_VWA4_VWB2_WGM1_WGMXCC1_WGMXCCGn1
    SolutionIndex: 61
    SolutionNameMin: Cijk_Ailk_Bljk_HHS_BH_Bias_AS_SAV_UserArgs_MT128x64x64_MI16x16x1_SN_LDSB1_CLR1_GRVWA8_GSU0_GSUC0_GSUWGMRR0_K1_LBSPPA2048_LBSPPB256_LPA0_MIWT4_2_PLR1_SU0_SUM0_SUS128_VWA4_VWB2_WGM4_WGMXCC1_WGMXCCGn1
    SolutionIndex: 62
    SolutionNameMin: Cijk_Ailk_Bljk_HHS_BH_Bias_AS_SAV_UserArgs_MT128x64x64_MI16x16x1_SN_LDSB1_CLR1_GRVWA8_GSU0_GSUC0_GSUWGMRR0_K1_LBSPPA2048_LBSPPB256_LPA0_MIWT4_2_PLR1_SU0_SUM0_SUS128_VWA4_VWB2_WGM6_WGMXCC1_WGMXCCGn1
    SolutionIndex: 63
    SolutionNameMin: Cijk_Ailk_Bljk_HHS_BH_Bias_AS_SAV_UserArgs_MT128x64x64_MI16x16x1_SN_LDSB1_CLR1_GRVWA8_GSU0_GSUC0_GSUWGMRR0_K1_LBSPPA1024_LBSPPB256_LPA0_MIWT4_2_PLR1_SU0_SUM0_SUS128_VWA4_VWB2_WGM8_WGMXCC1_WGMXCCGn1
    SolutionIndex: 64
    SolutionNameMin: Cijk_Ailk_Bljk_HHS_BH_Bias_AS_SAV_UserArgs_MT128x64x64_MI16x16x1_SN_LDSB1_CLR1_GRVWA8_GSU0_GSUC0_GSUWGMRR0_K1_LBSPPA2048_LBSPPB256_LPA0_MIWT4_2_PLR1_SU0_SUM0_SUS128_VWA4_VWB2_WGM8_WGMXCC1_WGMXCCGn1
    SolutionIndex: 65
    SolutionNameMin: Cijk_Ailk_Bljk_HHS_BH_Bias_AS_SAV_UserArgs_MT128x32x64_MI16x16x1_SN_LDSB1_CLR1_GRVWA8_GSU0_GSUC0_GSUWGMRR0_K1_LBSPPA1024_LBSPPB128_LPA0_MIWT4_1_PLR1_SU0_SUM0_SUS128_VWA4_VWB1_WGM6_WGMXCC1_WGMXCCGn1
    SolutionIndex: 66
    SolutionNameMin: Cijk_Ailk_Bljk_HHS_BH_Bias_AS_SAV_UserArgs_MT64x64x64_MI16x16x1_SN_LDSB1_CLR1_GRVWA2_GSU0_GSUC0_GSUWGMRR0_K1_LBSPPA512_LBSPPB256_LPA32_MIWT2_2_PLR1_SU0_SUM0_SUS128_VWA2_VWB2_WGM1_WGMXCC1_WGMXCCGn1
    SolutionIndex: 67
    SolutionNameMin: Cijk_Ailk_Bljk_HHS_BH_Bias_AS_SAV_UserArgs_MT64x64x64_MI16x16x1_SN_LDSB1_CLR1_GRVWA8_GSU0_GSUC0_GSUWGMRR0_K1_LBSPPA512_LBSPPB256_LPA32_MIWT2_2_PLR1_SU0_SUM0_SUS128_VWA2_VWB2_WGM1_WGMXCC1_WGMXCCGn1
    SolutionIndex: 68
    SolutionNameMin: Cijk_Ailk_Bljk_HHS_BH_Bias_AS_SAV_UserArgs_MT64x64x64_MI16x16x1_SN_LDSB1_CLR1_GRVWA2_GSU0_GSUC0_GSUWGMRR0_K1_LBSPPA1024_LBSPPB256_LPA32_MIWT2_2_PLR1_SU0_SUM0_SUS128_VWA2_VWB2_WGM1_WGMXCC1_WGMXCCGn1
    SolutionIndex: 69
    SolutionNameMin: Cijk_Ailk_Bljk_HHS_BH_Bias_AS_SAV_UserArgs_MT64x64x64_MI16x16x1_SN_LDSB1_CLR1_GRVWA8_GSU0_GSUC0_GSUWGMRR0_K1_LBSPPA1024_LBSPPB256_LPA32_MIWT2_2_PLR1_SU0_SUM0_SUS128_VWA2_VWB2_WGM1_WGMXCC1_WGMXCCGn1
    SolutionIndex: 70
    SolutionNameMin: Cijk_Ailk_Bljk_HHS_BH_Bias_AS_SAV_UserArgs_MT64x64x64_MI16x16x1_SN_LDSB1_CLR1_GRVWA2_GSU0_GSUC0_GSUWGMRR0_K1_LBSPPA1024_LBSPPB256_LPA32_MIWT2_2_PLR1_SU0_SUM0_SUS128_VWA2_VWB2_WGM4_WGMXCC1_WGMXCCGn1
    SolutionIndex: 71
    SolutionNameMin: Cijk_Ailk_Bljk_HHS_BH_Bias_AS_SAV_UserArgs_MT64x64x64_MI16x16x1_SN_LDSB1_CLR1_GRVWA2_GSU0_GSUC0_GSUWGMRR0_K1_LBSPPA1024_LBSPPB256_LPA32_MIWT2_2_PLR1_SU0_SUM0_SUS128_VWA2_VWB2_WGM6_WGMXCC1_WGMXCCGn1
    SolutionIndex: 72
    SolutionNameMin: Cijk_Ailk_Bljk_HHS_BH_Bias_AS_SAV_UserArgs_MT64x64x64_MI16x16x1_SN_LDSB1_CLR1_GRVWA8_GSU0_GSUC0_GSUWGMRR0_K1_LBSPPA1024_LBSPPB256_LPA32_MIWT2_2_PLR1_SU0_SUM0_SUS128_VWA2_VWB2_WGM6_WGMXCC1_WGMXCCGn1
    SolutionIndex: 73
    SolutionNameMin: Cijk_Ailk_Bljk_HHS_BH_Bias_AS_SAV_UserArgs_MT32x64x64_MI16x16x1_SN_LDSB0_CLR1_GRVWA2_GSU0_GSUC0_GSUWGMRR0_K1_LBSPPA512_LBSPPB256_LPA16_MIWT1_2_PLR1_SU0_SUM0_SUS128_VWA1_VWB2_WGM1_WGMXCC1_WGMXCCGn1
    SolutionIndex: 74
    SolutionNameMin: Cijk_Ailk_Bljk_HHS_BH_Bias_AS_SAV_UserArgs_MT64x32x64_MI16x16x1_SN_LDSB0_CLR1_GRVWA8_GSU0_GSUC0_GSUWGMRR0_K1_LBSPPA1024_LBSPPB128_LPA32_MIWT2_1_PLR1_SU0_SUM0_SUS128_VWA2_VWB1_WGM1_WGMXCC1_WGMXCCGn1
    SolutionIndex: 75
    SolutionNameMin: Cijk_Ailk_Bljk_HHS_BH_Bias_AS_SAV_UserArgs_MT32x32x64_MI16x16x1_SN_LDSB0_CLR1_GRVWA2_GSU0_GSUC0_GSUWGMRR0_K1_LBSPPA256_LBSPPB128_LPA16_MIWT1_1_PLR1_SU0_SUM0_SUS128_VWA1_VWB1_WGM1_WGMXCC1_WGMXCCGn1
    SolutionIndex: 76
    SolutionNameMin: Cijk_Ailk_Bljk_HHS_BH_Bias_AS_SAV_UserArgs_MT32x32x64_MI16x16x1_SN_LDSB0_CLR1_GRVWA2_GSU0_GSUC0_GSUWGMRR0_K1_LBSPPA512_LBSPPB128_LPA16_MIWT1_1_PLR1_SU0_SUM0_SUS128_VWA1_VWB1_WGM1_WGMXCC1_WGMXCCGn1
    SolutionIndex: 77
    SolutionNameMin: Cijk_Ailk_Bljk_HHS_BH_Bias_AS_SAV_UserArgs_MT32x32x64_MI16x16x1_SN_LDSB0_CLR1_GRVWA2_GSU0_GSUC0_GSUWGMRR0_K1_LBSPPA512_LBSPPB128_LPA16_MIWT1_1_PLR1_SU0_SUM0_SUS128_VWA1_VWB1_WGM1_WGMXCC1_WGMXCCGn1
    SolutionIndex: 78
    SolutionNameMin: Cijk_Ailk_Bljk_HHS_BH_Bias_AS_SAV_UserArgs_MT32x32x64_MI16x16x1_SN_LDSB0_CLR1_GRVWA8_GSU0_GSUC0_GSUWGMRR0_K1_LBSPPA512_LBSPPB128_LPA16_MIWT1_1_PLR1_SU0_SUM0_SUS128_VWA1_VWB1_WGM1_WGMXCC1_WGMXCCGn1
    SolutionIndex: 79
    SolutionNameMin: Cijk_Ailk_Bljk_HHS_BH_Bias_AS_SAV_UserArgs_MT128x64x128_MI16x16x1_SN_LDSB1_CLR1_GRVWA8_GSU0_GSUC0_GSUWGMRR0_K1_LBSPPA2048_LBSPPB512_LPA0_MIWT4_2_PLR1_SU0_SUM0_SUS256_VWA4_VWB2_WGM1_WGMXCC1_WGMXCCGn1
    SolutionIndex: 80
    SolutionNameMin: Cijk_Ailk_Bljk_HHS_BH_Bias_AS_SAV_UserArgs_MT128x64x128_MI16x16x1_SN_LDSB1_CLR1_GRVWA8_GSU0_GSUC0_GSUWGMRR0_K1_LBSPPA2048_LBSPPB512_LPA0_MIWT4_2_PLR1_SU0_SUM0_SUS256_VWA4_VWB2_WGM4_WGMXCC1_WGMXCCGn1
    SolutionIndex: 81
    SolutionNameMin: Cijk_Ailk_Bljk_HHS_BH_Bias_AS_SAV_UserArgs_MT128x64x128_MI16x16x1_SN_LDSB1_CLR1_GRVWA8_GSU0_GSUC0_GSUWGMRR0_K1_LBSPPA2048_LBSPPB512_LPA0_MIWT4_2_PLR1_SU0_SUM0_SUS256_VWA4_VWB2_WGM6_WGMXCC1_WGMXCCGn1
    SolutionIndex: 82
    SolutionNameMin: Cijk_Ailk_Bljk_HHS_BH_Bias_AS_SAV_UserArgs_MT128x64x128_MI16x16x1_SN_LDSB1_CLR1_GRVWA8_GSU0_GSUC0_GSUWGMRR0_K1_LBSPPA2048_LBSPPB512_LPA0_MIWT4_2_PLR1_SU0_SUM0_SUS256_VWA4_VWB2_WGM8_WGMXCC1_WGMXCCGn1
    SolutionIndex: 83
    SolutionNameMin: Cijk_Ailk_Bljk_HHS_BH_Bias_AS_SAV_UserArgs_MT64x64x128_MI16x16x1_SN_LDSB1_CLR1_GRVWA8_GSU0_GSUC0_GSUWGMRR0_K1_LBSPPA1024_LBSPPB512_LPA32_MIWT2_2_PLR1_SU0_SUM0_SUS256_VWA2_VWB2_WGM1_WGMXCC1_WGMXCCGn1
    SolutionIndex: 84
    SolutionNameMin: Cijk_Ailk_Bljk_HHS_BH_Bias_AS_SAV_UserArgs_MT64x64x128_MI16x16x1_SN_LDSB1_CLR1_GRVWA2_GSU0_GSUC0_GSUWGMRR0_K1_LBSPPA1024_LBSPPB512_LPA32_MIWT2_2_PLR1_SU0_SUM0_SUS256_VWA2_VWB2_WGM4_WGMXCC1_WGMXCCGn1
    SolutionIndex: 85
    SolutionNameMin: Cijk_Ailk_Bljk_HHS_BH_Bias_AS_SAV_UserArgs_MT64x64x128_MI16x16x1_SN_LDSB1_CLR1_GRVWA2_GSU0_GSUC0_GSUWGMRR0_K1_LBSPPA1024_LBSPPB512_LPA32_MIWT2_2_PLR1_SU0_SUM0_SUS256_VWA2_VWB2_WGM6_WGMXCC1_WGMXCCGn1
    SolutionIndex: 86
    SolutionNameMin: Cijk_Ailk_Bljk_HHS_BH_Bias_AS_SAV_UserArgs_MT64x64x128_MI16x16x1_SN_LDSB1_CLR1_GRVWA8_GSU0_GSUC0_GSUWGMRR0_K1_LBSPPA1024_LBSPPB512_LPA32_MIWT2_2_PLR1_SU0_SUM0_SUS256_VWA2_VWB2_WGM6_WGMXCC1_WGMXCCGn1
    SolutionIndex: 87
    SolutionNameMin: Cijk_Ailk_Bljk_HHS_BH_Bias_AS_SAV_UserArgs_MT64x64x128_MI16x16x1_SN_LDSB1_CLR1_GRVWA8_GSU0_GSUC0_GSUWGMRR0_K1_LBSPPA1024_LBSPPB512_LPA32_MIWT2_2_PLR1_SU0_SUM0_SUS256_VWA2_VWB2_WGM8_WGMXCC1_WGMXCCGn1
    SolutionIndex: 88
    SolutionNameMin: Cijk_Ailk_Bljk_HHS_BH_Bias_AS_SAV_UserArgs_MT64x32x128_MI16x16x1_SN_LDSB1_CLR1_GRVWA8_GSU0_GSUC0_GSUWGMRR0_K1_LBSPPA512_LBSPPB256_LPA32_MIWT2_1_PLR1_SU0_SUM0_SUS256_VWA2_VWB1_WGM1_WGMXCC1_WGMXCCGn1
    SolutionIndex: 89
    SolutionNameMin: Cijk_Ailk_Bljk_HHS_BH_Bias_AS_SAV_UserArgs_MT64x32x128_MI16x16x1_SN_LDSB1_CLR1_GRVWA4_GSU0_GSUC0_GSUWGMRR0_K1_LBSPPA1024_LBSPPB256_LPA32_MIWT2_1_PLR1_SU0_SUM0_SUS256_VWA2_VWB1_WGM1_WGMXCC1_WGMXCCGn1
    SolutionIndex: 90
    SolutionNameMin: Cijk_Ailk_Bljk_HHS_BH_Bias_AS_SAV_UserArgs_MT64x32x128_MI16x16x1_SN_LDSB1_CLR1_GRVWA8_GSU0_GSUC0_GSUWGMRR0_K1_LBSPPA1024_LBSPPB256_LPA32_MIWT2_1_PLR1_SU0_SUM0_SUS256_VWA2_VWB1_WGM1_WGMXCC1_WGMXCCGn1
    SolutionIndex: 91
    SolutionNameMin: Cijk_Ailk_Bljk_HHS_BH_Bias_AS_SAV_UserArgs_MT64x32x128_MI16x16x1_SN_LDSB1_CLR1_GRVWA8_GSU0_GSUC0_GSUWGMRR0_K1_LBSPPA1024_LBSPPB256_LPA32_MIWT2_1_PLR1_SU0_SUM0_SUS256_VWA2_VWB1_WGM4_WGMXCC1_WGMXCCGn1
    SolutionIndex: 92
    SolutionNameMin: Cijk_Ailk_Bljk_HHS_BH_Bias_AS_SAV_UserArgs_MT64x32x128_MI16x16x1_SN_LDSB1_CLR1_GRVWA8_GSU0_GSUC0_GSUWGMRR0_K1_LBSPPA1024_LBSPPB256_LPA32_MIWT2_1_PLR1_SU0_SUM0_SUS256_VWA2_VWB1_WGM6_WGMXCC1_WGMXCCGn1
    SolutionIndex: 93
    SolutionNameMin: Cijk_Ailk_Bljk_HHS_BH_Bias_AS_SAV_UserArgs_MT64x32x128_MI16x16x1_SN_LDSB1_CLR1_GRVWA8_GSU0_GSUC0_GSUWGMRR0_K1_LBSPPA512_LBSPPB256_LPA32_MIWT2_1_PLR1_SU0_SUM0_SUS256_VWA2_VWB1_WGM8_WGMXCC1_WGMXCCGn1
    SolutionIndex: 94
    SolutionNameMin: Cijk_Ailk_Bljk_HHS_BH_Bias_AS_SAV_UserArgs_MT64x32x128_MI16x16x1_SN_LDSB1_CLR1_GRVWA8_GSU0_GSUC0_GSUWGMRR0_K1_LBSPPA1024_LBSPPB256_LPA32_MIWT2_1_PLR1_SU0_SUM0_SUS256_VWA2_VWB1_WGM8_WGMXCC1_WGMXCCGn1
    SolutionIndex: 95
    SolutionNameMin: Cijk_Ailk_Bljk_HHS_BH_Bias_AS_SAV_UserArgs_MT32x32x128_MI16x16x1_SN_LDSB1_CLR1_GRVWA8_GSU0_GSUC0_GSUWGMRR0_K1_LBSPPA512_LBSPPB256_LPA16_MIWT1_1_PLR1_SU0_SUM0_SUS256_VWA1_VWB1_WGM1_WGMXCC1_WGMXCCGn1
    SolutionIndex: 96
    SolutionNameMin: Cijk_Ailk_Bljk_HHS_BH_Bias_AS_SAV_UserArgs_MT32x32x128_MI16x16x1_SN_LDSB1_CLR1_GRVWA2_GSU0_GSUC0_GSUWGMRR0_K1_LBSPPA512_LBSPPB256_LPA16_MIWT1_1_PLR1_SU0_SUM0_SUS256_VWA1_VWB1_WGM1_WGMXCC1_WGMXCCGn1
    SolutionIndex: 97
    SolutionNameMin: Cijk_Ailk_Bljk_HHS_BH_Bias_AS_SAV_UserArgs_MT32x32x128_MI16x16x1_SN_LDSB1_CLR1_GRVWA4_GSU0_GSUC0_GSUWGMRR0_K1_LBSPPA512_LBSPPB256_LPA16_MIWT1_1_PLR1_SU0_SUM0_SUS256_VWA1_VWB1_WGM1_WGMXCC1_WGMXCCGn1
    SolutionIndex: 98
    SolutionNameMin: Cijk_Ailk_Bljk_HHS_BH_Bias_AS_SAV_UserArgs_MT32x32x128_MI16x16x1_SN_LDSB1_CLR1_GRVWA8_GSU0_GSUC0_GSUWGMRR0_K1_LBSPPA512_LBSPPB256_LPA16_MIWT1_1_PLR1_SU0_SUM0_SUS256_VWA1_VWB1_WGM1_WGMXCC1_WGMXCCGn1
    SolutionIndex: 99
    SolutionNameMin: Cijk_Ailk_Bljk_HHS_BH_Bias_AS_SAV_UserArgs_MT32x32x128_MI16x16x1_SN_LDSB1_CLR1_GRVWA4_GSU0_GSUC0_GSUWGMRR0_K1_LBSPPA512_LBSPPB256_LPA16_MIWT1_1_PLR1_SU0_SUM0_SUS256_VWA1_VWB1_WGM4_WGMXCC1_WGMXCCGn1
    SolutionIndex: 100
    SolutionNameMin: Cijk_Ailk_Bljk_HHS_BH_Bias_AS_SAV_UserArgs_MT32x32x128_MI16x16x1_SN_LDSB1_CLR1_GRVWA8_GSU0_GSUC0_GSUWGMRR0_K1_LBSPPA512_LBSPPB256_LPA16_MIWT1_1_PLR1_SU0_SUM0_SUS256_VWA1_VWB1_WGM4_WGMXCC1_WGMXCCGn1
    SolutionIndex: 101
    SolutionNameMin: Cijk_Ailk_Bljk_HHS_BH_Bias_AS_SAV_UserArgs_MT32x32x128_MI16x16x1_SN_LDSB1_CLR1_GRVWA4_GSU0_GSUC0_GSUWGMRR0_K1_LBSPPA512_LBSPPB256_LPA16_MIWT1_1_PLR1_SU0_SUM0_SUS256_VWA1_VWB1_WGM6_WGMXCC1_WGMXCCGn1
    SolutionIndex: 102
    SolutionNameMin: Cijk_Ailk_Bljk_HHS_BH_Bias_AS_SAV_UserArgs_MT32x32x128_MI16x16x1_SN_LDSB1_CLR1_GRVWA4_GSU0_GSUC0_GSUWGMRR0_K1_LBSPPA512_LBSPPB256_LPA16_MIWT1_1_PLR1_SU0_SUM0_SUS256_VWA1_VWB1_WGM8_WGMXCC1_WGMXCCGn1
    SolutionIndex: 103
    SolutionNameMin: Cijk_Ailk_Bljk_HHS_BH_Bias_AS_SAV_UserArgs_MT32x32x128_MI16x16x1_SN_LDSB1_CLR1_GRVWA8_GSU0_GSUC0_GSUWGMRR0_K1_LBSPPA512_LBSPPB256_LPA16_MIWT1_1_PLR1_SU0_SUM0_SUS256_VWA1_VWB1_WGM8_WGMXCC1_WGMXCCGn1
- - - [128, 128, 1, 128, 128, 128, 128, 128]
    - [75, 0.45]
  - - [128, 128, 1, 256, 128, 128, 128, 256]
    - [78, 0.78]
  - - [128, 128, 1, 512, 128, 128, 128, 512]
    - [98, 1.32]
  - - [128, 128, 1, 1024, 128, 128, 128, 1024]
    - [98, 1.92]
  - - [128, 128, 1, 2048, 128, 128, 128, 2048]
    - [98, 2.52]
  - - [128, 128, 1, 4096, 128, 128, 128, 4096]
    - [95, 3.02]
  - - [128, 128, 1, 8192, 128, 128, 128, 8192]
    - [96, 3.42]
  - - [128, 256, 1, 128, 128, 128, 128, 128]
    - [78, 0.91]
  - - [128, 256, 1, 256, 128, 128, 128, 256]
    - [77, 1.56]
  - - [128, 256, 1, 512, 128, 128, 128, 512]
    - [98, 2.6]
  - - [128, 256, 1, 1024, 128, 128, 128, 1024]
    - [98, 3.9]
  - - [128, 256, 1, 2048, 128, 128, 128, 2048]
    - [98, 5.09]
  - - [128, 256, 1, 4096, 128, 128, 128, 4096]
    - [98, 6.06]
  - - [128, 256, 1, 8192, 128, 128, 128, 8192]
    - [98, 6.88]
  - - [128, 512, 1, 128, 128, 128, 128, 128]
    - [98, 1.85]
  - - [128, 512, 1, 256, 128, 128, 128, 256]
    - [98, 3.15]
  - - [128, 512, 1, 512, 128, 128, 128, 512]
    - [98, 5.23]
  - - [128, 512, 1, 1024, 128, 128, 128, 1024]
    - [97, 7.7]
  - - [128, 512, 1, 2048, 128, 128, 128, 2048]
    - [98, 10.15]
  - - [128, 512, 1, 4096, 128, 128, 128, 4096]
    - [98, 12.13]
  - - [128, 512, 1, 8192, 128, 128, 128, 8192]
    - [98, 13.73]
  - - [128, 1024, 1, 128, 128, 128, 128, 128]
    - [97, 3.57]
  - - [128, 1024, 1, 256, 128, 128, 128, 256]
    - [97, 6.17]
  - - [128, 1024, 1, 512, 128, 128, 128, 512]
    - [97, 10.31]
  - - [128, 1024, 1, 1024, 128, 128, 128, 1024]
    - [98, 15.32]
  - - [128, 1024, 1, 2048, 128, 128, 128, 2048]
    - [98, 20.19]
  - - [128, 1024, 1, 4096, 128, 128, 128, 4096]
    - [98, 24.35]
  - - [128, 1024, 1, 8192, 128, 128, 128, 8192]
    - [98, 27.54]
  - - [128, 2048, 1, 128, 128, 128, 128, 128]
    - [90, 6.61]
  - - [128, 2048, 1, 256, 128, 128, 128, 256]
    - [74, 11.2]
  - - [128, 2048, 1, 512, 128, 128, 128, 512]
    - [90, 18.45]
  - - [128, 2048, 1, 1024, 128, 128, 128, 1024]
    - [90, 27.34]
  - - [128, 2048, 1, 2048, 128, 128, 128, 2048]
    - [90, 35.62]
  - - [128, 2048, 1, 4096, 128, 128, 128, 4096]
    - [91, 42.64]
  - - [128, 2048, 1, 8192, 128, 128, 128, 8192]
    - [91, 46.5]
  - - [128, 4096, 1, 128, 128, 128, 128, 128]
    - [66, 11.68]
  - - [128, 4096, 1, 256, 128, 128, 128, 256]
    - [68, 20.03]
  - - [128, 4096, 1, 512, 128, 128, 128, 512]
    - [83, 31.11]
  - - [128, 4096, 1, 1024, 128, 128, 128, 1024]
    - [83, 44.87]
  - - [128, 4096, 1, 2048, 128, 128, 128, 2048]
    - [83, 57.64]
  - - [128, 4096, 1, 4096, 128, 128, 128, 4096]
    - [83, 64.55]
  - - [128, 4096, 1, 8192, 128, 128, 128, 8192]
    - [85, 70.85]
  - - [128, 8192, 1, 128, 128, 128, 128, 128]
    - [60, 19.59]
  - - [128, 8192, 1, 256, 128, 128, 128, 256]
    - [79, 31.78]
  - - [128, 8192, 1, 512, 128, 128, 128, 512]
    - [79, 50.53]
  - - [128, 8192, 1, 1024, 128, 128, 128, 1024]
    - [79, 70.24]
  - - [128, 8192, 1, 2048, 128, 128, 128, 2048]
    - [79, 77.86]
  - - [128, 8192, 1, 4096, 128, 128, 128, 4096]
    - [79, 89.63]
  - - [128, 8192, 1, 8192, 128, 128, 128, 8192]
    - [81, 92.27]
  - - [256, 128, 1, 128, 256, 256, 256, 128]
    - [75, 0.88]
  - - [256, 128, 1, 256, 256, 256, 256, 256]
    - [77, 1.55]
  - - [256, 128, 1, 512, 256, 256, 256, 512]
    - [98, 2.43]
  - - [256, 128, 1, 1024, 256, 256, 256, 1024]
    - [97, 3.48]
  - - [256, 128, 1, 2048, 256, 256, 256, 2048]
    - [97, 4.43]
  - - [256, 128, 1, 4096, 256, 256, 256, 4096]
    - [97, 5.19]
  - - [256, 128, 1, 8192, 256, 256, 256, 8192]
    - [102, 5.71]
  - - [256, 256, 1, 128, 256, 256, 256, 128]
    - [77, 1.78]
  - - [256, 256, 1, 256, 256, 256, 256, 256]
    - [77, 3.02]
  - - [256, 256, 1, 512, 256, 256, 256, 512]
    - [97, 4.87]
  - - [256, 256, 1, 1024, 256, 256, 256, 1024]
    - [98, 6.98]
  - - [256, 256, 1, 2048, 256, 256, 256, 2048]
    - [97, 9.13]
  - - [256, 256, 1, 4096, 256, 256, 256, 4096]
    - [97, 10.69]
  - - [256, 256, 1, 8192, 256, 256, 256, 8192]
    - [101, 11.79]
  - - [256, 512, 1, 128, 256, 256, 256, 128]
    - [77, 3.52]
  - - [256, 512, 1, 256, 256, 256, 256, 256]
    - [76, 5.99]
  - - [256, 512, 1, 512, 256, 256, 256, 512]
    - [97, 9.65]
  - - [256, 512, 1, 1024, 256, 256, 256, 1024]
    - [98, 14.1]
  - - [256, 512, 1, 2048, 256, 256, 256, 2048]
    - [97, 18.13]
  - - [256, 512, 1, 4096, 256, 256, 256, 4096]
    - [97, 21.59]
  - - [256, 512, 1, 8192, 256, 256, 256, 8192]
    - [97, 23.84]
  - - [256, 1024, 1, 128, 256, 256, 256, 128]
    - [90, 6.41]
  - - [256, 1024, 1, 256, 256, 256, 256, 256]
    - [74, 11.07]
  - - [256, 1024, 1, 512, 256, 256, 256, 512]
    - [88, 17.66]
  - - [256, 1024, 1, 1024, 256, 256, 256, 1024]
    - [90, 25.84]
  - - [256, 1024, 1, 2048, 256, 256, 256, 2048]
    - [90, 33.3]
  - - [256, 1024, 1, 4096, 256, 256, 256, 4096]
    - [90, 39.31]
  - - [256, 1024, 1, 8192, 256, 256, 256, 8192]
    - [90, 43.13]
  - - [256, 2048, 1, 128, 256, 256, 256, 128]
    - [68, 11.85]
  - - [256, 2048, 1, 256, 256, 256, 256, 256]
    - [69, 19.81]
  - - [256, 2048, 1, 512, 256, 256, 256, 512]
    - [69, 30.22]
  - - [256, 2048, 1, 1024, 256, 256, 256, 1024]
    - [83, 41.7]
  - - [256, 2048, 1, 2048, 256, 256, 256, 2048]
    - [83, 51.3]
  - - [256, 2048, 1, 4096, 256, 256, 256, 4096]
    - [90, 62.2]
  - - [256, 2048, 1, 8192, 256, 256, 256, 8192]
    - [29, 62.78]
  - - [256, 4096, 1, 128, 256, 256, 256, 128]
    - [25, 19.31]
  - - [256, 4096, 1, 256, 256, 256, 256, 256]
    - [60, 32.77]
  - - [256, 4096, 1, 512, 256, 256, 256, 512]
    - [60, 50.76]
  - - [256, 4096, 1, 1024, 256, 256, 256, 1024]
    - [60, 69.52]
  - - [256, 4096, 1, 2048, 256, 256, 256, 2048]
    - [60, 83.78]
  - - [256, 4096, 1, 4096, 256, 256, 256, 4096]
    - [59, 91.26]
  - - [256, 4096, 1, 8192, 256, 256, 256, 8192]
    - [79, 90.28]
  - - [256, 8192, 1, 128, 256, 256, 256, 128]
    - [46, 29.19]
  - - [256, 8192, 1, 256, 256, 256, 256, 256]
    - [46, 48.81]
  - - [256, 8192, 1, 512, 256, 256, 256, 512]
    - [51, 72.12]
  - - [256, 8192, 1, 1024, 256, 256, 256, 1024]
    - [47, 92.24]
  - - [256, 8192, 1, 2048, 256, 256, 256, 2048]
    - [46, 104.17]
  - - [256, 8192, 1, 4096, 256, 256, 256, 4096]
    - [51, 116.0]
  - - [256, 8192, 1, 8192, 256, 256, 256, 8192]
    - [51, 109.12]
  - - [512, 128, 1, 128, 512, 512, 512, 128]
    - [76, 1.74]
  - - [512, 128, 1, 256, 512, 512, 512, 256]
    - [77, 3.03]
  - - [512, 128, 1, 512, 512, 512, 512, 512]
    - [97, 4.61]
  - - [512, 128, 1, 1024, 512, 512, 512, 1024]
    - [97, 6.73]
  - - [512, 128, 1, 2048, 512, 512, 512, 2048]
    - [99, 8.71]
  - - [512, 128, 1, 4096, 512, 512, 512, 4096]
    - [102, 10.17]
  - - [512, 128, 1, 8192, 512, 512, 512, 8192]
    - [101, 11.18]
  - - [512, 256, 1, 128, 512, 512, 512, 128]
    - [77, 3.4]
  - - [512, 256, 1, 256, 512, 512, 512, 256]
    - [77, 5.81]
  - - [512, 256, 1, 512, 512, 512, 512, 512]
    - [97, 9.4]
  - - [512, 256, 1, 1024, 512, 512, 512, 1024]
    - [99, 13.54]
  - - [512, 256, 1, 2048, 512, 512, 512, 2048]
    - [99, 17.68]
  - - [512, 256, 1, 4096, 512, 512, 512, 4096]
    - [102, 20.89]
  - - [512, 256, 1, 8192, 512, 512, 512, 8192]
    - [101, 22.92]
  - - [512, 512, 1, 128, 512, 512, 512, 128]
    - [73, 6.19]
  - - [512, 512, 1, 256, 512, 512, 512, 256]
    - [90, 10.74]
  - - [512, 512, 1, 512, 512, 512, 512, 512]
    - [94, 17.42]
  - - [512, 512, 1, 1024, 512, 512, 512, 1024]
    - [92, 25.43]
  - - [512, 512, 1, 2048, 512, 512, 512, 2048]
    - [90, 32.81]
  - - [512, 512, 1, 4096, 512, 512, 512, 4096]
    - [90, 38.54]
  - - [512, 512, 1, 8192, 512, 512, 512, 8192]
    - [90, 42.21]
  - - [512, 1024, 1, 128, 512, 512, 512, 128]
    - [66, 11.51]
  - - [512, 1024, 1, 256, 512, 512, 512, 256]
    - [68, 19.6]
  - - [512, 1024, 1, 512, 512, 512, 512, 512]
    - [68, 30.31]
  - - [512, 1024, 1, 1024, 512, 512, 512, 1024]
    - [86, 41.52]
  - - [512, 1024, 1, 2048, 512, 512, 512, 2048]
    - [87, 51.25]
  - - [512, 1024, 1, 4096, 512, 512, 512, 4096]
    - [87, 58.86]
  - - [512, 1024, 1, 8192, 512, 512, 512, 8192]
    - [28, 63.61]
  - - [512, 2048, 1, 128, 512, 512, 512, 128]
    - [25, 19.36]
  - - [512, 2048, 1, 256, 512, 512, 512, 256]
    - [60, 33.28]
  - - [512, 2048, 1, 512, 512, 512, 512, 512]
    - [60, 51.88]
  - - [512, 2048, 1, 1024, 512, 512, 512, 1024]
    - [60, 70.45]
  - - [512, 2048, 1, 2048, 512, 512, 512, 2048]
    - [60, 85.26]
  - - [512, 2048, 1, 4096, 512, 512, 512, 4096]
    - [60, 97.82]
  - - [512, 2048, 1, 8192, 512, 512, 512, 8192]
    - [62, 90.63]
  - - [512, 4096, 1, 128, 512, 512, 512, 128]
    - [46, 29.49]
  - - [512, 4096, 1, 256, 512, 512, 512, 256]
    - [46, 49.39]
  - - [512, 4096, 1, 512, 512, 512, 512, 512]
    - [45, 73.86]
  - - [512, 4096, 1, 1024, 512, 512, 512, 1024]
    - [50, 96.46]
  - - [512, 4096, 1, 2048, 512, 512, 512, 2048]
    - [46, 111.55]
  - - [512, 4096, 1, 4096, 512, 512, 512, 4096]
    - [51, 121.47]
  - - [512, 4096, 1, 8192, 512, 512, 512, 8192]
    - [51, 119.36]
  - - [512, 8192, 1, 128, 512, 512, 512, 128]
    - [18, 40.68]
  - - [512, 8192, 1, 256, 512, 512, 512, 256]
    - [18, 65.42]
  - - [512, 8192, 1, 512, 512, 512, 512, 512]
    - [39, 95.6]
  - - [512, 8192, 1, 1024, 512, 512, 512, 1024]
    - [39, 117.65]
  - - [512, 8192, 1, 2048, 512, 512, 512, 2048]
    - [41, 132.49]
  - - [512, 8192, 1, 4096, 512, 512, 512, 4096]
    - [34, 125.3]
  - - [512, 8192, 1, 8192, 512, 512, 512, 8192]
    - [34, 135.25]
  - - [1024, 128, 1, 128, 1024, 1024, 1024, 128]
    - [77, 3.41]
  - - [1024, 128, 1, 256, 1024, 1024, 1024, 256]
    - [75, 5.63]
  - - [1024, 128, 1, 512, 1024, 1024, 1024, 512]
    - [98, 9.04]
  - - [1024, 128, 1, 1024, 1024, 1024, 1024, 1024]
    - [100, 13.18]
  - - [1024, 128, 1, 2048, 1024, 1024, 1024, 2048]
    - [103, 16.81]
  - - [1024, 128, 1, 4096, 1024, 1024, 1024, 4096]
    - [98, 19.49]
  - - [1024, 128, 1, 8192, 1024, 1024, 1024, 8192]
    - [97, 21.34]
  - - [1024, 256, 1, 128, 1024, 1024, 1024, 128]
    - [89, 6.21]
  - - [1024, 256, 1, 256, 1024, 1024, 1024, 256]
    - [91, 10.44]
  - - [1024, 256, 1, 512, 1024, 1024, 1024, 512]
    - [93, 16.94]
  - - [1024, 256, 1, 1024, 1024, 1024, 1024, 1024]
    - [91, 24.69]
  - - [1024, 256, 1, 2048, 1024, 1024, 1024, 2048]
    - [94, 31.74]
  - - [1024, 256, 1, 4096, 1024, 1024, 1024, 4096]
    - [94, 37.16]
  - - [1024, 256, 1, 8192, 1024, 1024, 1024, 8192]
    - [91, 40.4]
  - - [1024, 512, 1, 128, 1024, 1024, 1024, 128]
    - [71, 11.22]
  - - [1024, 512, 1, 256, 1024, 1024, 1024, 256]
    - [72, 19.19]
  - - [1024, 512, 1, 512, 1024, 1024, 1024, 512]
    - [71, 29.96]
  - - [1024, 512, 1, 1024, 1024, 1024, 1024, 1024]
    - [71, 41.18]
  - - [1024, 512, 1, 2048, 1024, 1024, 1024, 2048]
    - [84, 50.92]
  - - [1024, 512, 1, 4096, 1024, 1024, 1024, 4096]
    - [85, 58.26]
  - - [1024, 512, 1, 8192, 1024, 1024, 1024, 8192]
    - [30, 62.86]
  - - [1024, 1024, 1, 128, 1024, 1024, 1024, 128]
    - [61, 19.0]
  - - [1024, 1024, 1, 256, 1024, 1024, 1024, 256]
    - [62, 33.02]
  - - [1024, 1024, 1, 512, 1024, 1024, 1024, 512]
    - [64, 51.11]
  - - [1024, 1024, 1, 1024, 1024, 1024, 1024, 1024]
    - [62, 69.57]
  - - [1024, 1024, 1, 2048, 1024, 1024, 1024, 2048]
    - [80, 84.84]
  - - [1024, 1024, 1, 4096, 1024, 1024, 1024, 4096]
    - [80, 95.05]
  - - [1024, 1024, 1, 8192, 1024, 1024, 1024, 8192]
    - [64, 89.98]
  - - [1024, 2048, 1, 128, 1024, 1024, 1024, 128]
    - [51, 29.46]
  - - [1024, 2048, 1, 256, 1024, 1024, 1024, 256]
    - [51, 49.85]
  - - [1024, 2048, 1, 512, 1024, 1024, 1024, 512]
    - [51, 75.19]
  - - [1024, 2048, 1, 1024, 1024, 1024, 1024, 1024]
    - [51, 98.1]
  - - [1024, 2048, 1, 2048, 1024, 1024, 1024, 2048]
    - [50, 115.34]
  - - [1024, 2048, 1, 4096, 1024, 1024, 1024, 4096]
    - [54, 122.06]
  - - [1024, 2048, 1, 8192, 1024, 1024, 1024, 8192]
    - [55, 114.83]
  - - [1024, 4096, 1, 128, 1024, 1024, 1024, 128]
    - [24, 42.74]
  - - [1024, 4096, 1, 256, 1024, 1024, 1024, 256]
    - [18, 67.62]
  - - [1024, 4096, 1, 512, 1024, 1024, 1024, 512]
    - [39, 96.65]
  - - [1024, 4096, 1, 1024, 1024, 1024, 1024, 1024]
    - [38, 121.69]
  - - [1024, 4096, 1, 2048, 1024, 1024, 1024, 2048]
    - [40, 137.36]
  - - [1024, 4096, 1, 4096, 1024, 1024, 1024, 4096]
    - [35, 126.67]
  - - [1024, 4096, 1, 8192, 1024, 1024, 1024, 8192]
    - [35, 136.71]
  - - [1024, 8192, 1, 128, 1024, 1024, 1024, 128]
    - [6, 49.4]
  - - [1024, 8192, 1, 256, 1024, 1024, 1024, 256]
    - [6, 77.93]
  - - [1024, 8192, 1, 512, 1024, 1024, 1024, 512]
    - [3, 108.96]
  - - [1024, 8192, 1, 1024, 1024, 1024, 1024, 1024]
    - [6, 131.58]
  - - [1024, 8192, 1, 2048, 1024, 1024, 1024, 2048]
    - [8, 131.27]
  - - [1024, 8192, 1, 4096, 1024, 1024, 1024, 4096]
    - [0, 144.33]
  - - [1024, 8192, 1, 8192, 1024, 1024, 1024, 8192]
    - [5, 163.6]
  - - [2048, 128, 1, 128, 2048, 2048, 2048, 128]
    - [65, 5.08]
  - - [2048, 128, 1, 256, 2048, 2048, 2048, 256]
    - [92, 10.26]
  - - [2048, 128, 1, 512, 2048, 2048, 2048, 512]
    - [94, 16.37]
  - - [2048, 128, 1, 1024, 2048, 2048, 2048, 1024]
    - [91, 23.74]
  - - [2048, 128, 1, 2048, 2048, 2048, 2048, 2048]
    - [91, 29.97]
  - - [2048, 128, 1, 4096, 2048, 2048, 2048, 4096]
    - [94, 35.37]
  - - [2048, 128, 1, 8192, 2048, 2048, 2048, 8192]
    - [32, 34.41]
  - - [2048, 256, 1, 128, 2048, 2048, 2048, 128]
    - [71, 11.14]
  - - [2048, 256, 1, 256, 2048, 2048, 2048, 256]
    - [71, 19.11]
  - - [2048, 256, 1, 512, 2048, 2048, 2048, 512]
    - [71, 29.63]
  - - [2048, 256, 1, 1024, 2048, 2048, 2048, 1024]
    - [70, 40.7]
  - - [2048, 256, 1, 2048, 2048, 2048, 2048, 2048]
    - [87, 50.27]
  - - [2048, 256, 1, 4096, 2048, 2048, 2048, 4096]
    - [87, 57.75]
  - - [2048, 256, 1, 8192, 2048, 2048, 2048, 8192]
    - [31, 59.73]
  - - [2048, 512, 1, 128, 2048, 2048, 2048, 128]
    - [61, 18.69]
  - - [2048, 512, 1, 256, 2048, 2048, 2048, 256]
    - [64, 32.53]
  - - [2048, 512, 1, 512, 2048, 2048, 2048, 512]
    - [64, 50.07]
  - - [2048, 512, 1, 1024, 2048, 2048, 2048, 1024]
    - [61, 68.51]
  - - [2048, 512, 1, 2048, 2048, 2048, 2048, 2048]
    - [80, 83.51]
  - - [2048, 512, 1, 4096, 2048, 2048, 2048, 4096]
    - [80, 94.36]
  - - [2048, 512, 1, 8192, 2048, 2048, 2048, 8192]
    - [61, 86.94]
  - - [2048, 1024, 1, 128, 2048, 2048, 2048, 128]
    - [51, 29.01]
  - - [2048, 1024, 1, 256, 2048, 2048, 2048, 256]
    - [53, 49.31]
  - - [2048, 1024, 1, 512, 2048, 2048, 2048, 512]
    - [48, 74.68]
  - - [2048, 1024, 1, 1024, 2048, 2048, 2048, 1024]
    - [52, 96.92]
  - - [2048, 1024, 1, 2048, 2048, 2048, 2048, 2048]
    - [52, 115.54]
  - - [2048, 1024, 1, 4096, 2048, 2048, 2048, 4096]
    - [52, 122.47]
  - - [2048, 1024, 1, 8192, 2048, 2048, 2048, 8192]
    - [53, 117.78]
  - - [2048, 2048, 1, 128, 2048, 2048, 2048, 128]
    - [18, 42.79]
  - - [2048, 2048, 1, 256, 2048, 2048, 2048, 256]
    - [15, 67.37]
  - - [2048, 2048, 1, 512, 2048, 2048, 2048, 512]
    - [42, 96.41]
  - - [2048, 2048, 1, 1024, 2048, 2048, 2048, 1024]
    - [44, 122.37]
  - - [2048, 2048, 1, 2048, 2048, 2048, 2048, 2048]
    - [42, 136.21]
  - - [2048, 2048, 1, 4096, 2048, 2048, 2048, 4096]
    - [36, 127.96]
  - - [2048, 2048, 1, 8192, 2048, 2048, 2048, 8192]
    - [35, 137.21]
  - - [2048, 4096, 1, 128, 2048, 2048, 2048, 128]
    - [2, 49.55]
  - - [2048, 4096, 1, 256, 2048, 2048, 2048, 256]
    - [3, 77.86]
  - - [2048, 4096, 1, 512, 2048, 2048, 2048, 512]
    - [6, 108.33]
  - - [2048, 4096, 1, 1024, 2048, 2048, 2048, 1024]
    - [9, 134.08]
  - - [2048, 4096, 1, 2048, 2048, 2048, 2048, 2048]
    - [34, 136.86]
  - - [2048, 4096, 1, 4096, 2048, 2048, 2048, 4096]
    - [33, 147.38]
  - - [2048, 4096, 1, 8192, 2048, 2048, 2048, 8192]
    - [7, 156.46]
  - - [2048, 8192, 1, 128, 2048, 2048, 2048, 128]
    - [3, 56.21]
  - - [2048, 8192, 1, 256, 2048, 2048, 2048, 256]
    - [3, 84.96]
  - - [2048, 8192, 1, 512, 2048, 2048, 2048, 512]
    - [1, 111.09]
  - - [2048, 8192, 1, 1024, 2048, 2048, 2048, 1024]
    - [17, 122.66]
  - - [2048, 8192, 1, 2048, 2048, 2048, 2048, 2048]
    - [34, 144.96]
  - - [2048, 8192, 1, 4096, 2048, 2048, 2048, 4096]
    - [37, 158.33]
  - - [2048, 8192, 1, 8192, 2048, 2048, 2048, 8192]
    - [10, 173.99]
  - - [4096, 128, 1, 128, 4096, 4096, 4096, 128]
    - [68, 11.31]
  - - [4096, 128, 1, 256, 4096, 4096, 4096, 256]
    - [69, 19.09]
  - - [4096, 128, 1, 512, 4096, 4096, 4096, 512]
    - [67, 28.81]
  - - [4096, 128, 1, 1024, 4096, 4096, 4096, 1024]
    - [83, 39.3]
  - - [4096, 128, 1, 2048, 4096, 4096, 4096, 2048]
    - [87, 50.13]
  - - [4096, 128, 1, 4096, 4096, 4096, 4096, 4096]
    - [87, 53.14]
  - - [4096, 128, 1, 8192, 4096, 4096, 4096, 8192]
    - [87, 56.35]
  - - [4096, 256, 1, 128, 4096, 4096, 4096, 128]
    - [27, 18.65]
  - - [4096, 256, 1, 256, 4096, 4096, 4096, 256]
    - [63, 31.77]
  - - [4096, 256, 1, 512, 4096, 4096, 4096, 512]
    - [61, 49.45]
  - - [4096, 256, 1, 1024, 4096, 4096, 4096, 1024]
    - [82, 67.3]
  - - [4096, 256, 1, 2048, 4096, 4096, 4096, 2048]
    - [82, 84.0]
  - - [4096, 256, 1, 4096, 4096, 4096, 4096, 4096]
    - [81, 90.84]
  - - [4096, 256, 1, 8192, 4096, 4096, 4096, 8192]
    - [80, 86.6]
  - - [4096, 512, 1, 128, 4096, 4096, 4096, 128]
    - [49, 29.26]
  - - [4096, 512, 1, 256, 4096, 4096, 4096, 256]
    - [47, 49.32]
  - - [4096, 512, 1, 512, 4096, 4096, 4096, 512]
    - [53, 74.48]
  - - [4096, 512, 1, 1024, 4096, 4096, 4096, 1024]
    - [58, 98.08]
  - - [4096, 512, 1, 2048, 4096, 4096, 4096, 2048]
    - [57, 115.78]
  - - [4096, 512, 1, 4096, 4096, 4096, 4096, 4096]
    - [52, 122.55]
  - - [4096, 512, 1, 8192, 4096, 4096, 4096, 8192]
    - [52, 117.67]
  - - [4096, 1024, 1, 128, 4096, 4096, 4096, 128]
    - [17, 41.84]
  - - [4096, 1024, 1, 256, 4096, 4096, 4096, 256]
    - [18, 66.2]
  - - [4096, 1024, 1, 512, 4096, 4096, 4096, 512]
    - [21, 95.58]
  - - [4096, 1024, 1, 1024, 4096, 4096, 4096, 1024]
    - [44, 121.05]
  - - [4096, 1024, 1, 2048, 4096, 4096, 4096, 2048]
    - [44, 136.48]
  - - [4096, 1024, 1, 4096, 4096, 4096, 4096, 4096]
    - [51, 131.64]
  - - [4096, 1024, 1, 8192, 4096, 4096, 4096, 8192]
    - [36, 136.86]
  - - [4096, 2048, 1, 128, 4096, 4096, 4096, 128]
    - [3, 48.84]
  - - [4096, 2048, 1, 256, 4096, 4096, 4096, 256]
    - [3, 76.48]
  - - [4096, 2048, 1, 512, 4096, 4096, 4096, 512]
    - [6, 106.46]
  - - [4096, 2048, 1, 1024, 4096, 4096, 4096, 1024]
    - [6, 130.94]
  - - [4096, 2048, 1, 2048, 4096, 4096, 4096, 2048]
    - [33, 143.27]
  - - [4096, 2048, 1, 4096, 4096, 4096, 4096, 4096]
    - [34, 160.02]
  - - [4096, 2048, 1, 8192, 4096, 4096, 4096, 8192]
    - [34, 158.57]
  - - [4096, 4096, 1, 128, 4096, 4096, 4096, 128]
    - [3, 55.75]
  - - [4096, 4096, 1, 256, 4096, 4096, 4096, 256]
    - [6, 83.83]
  - - [4096, 4096, 1, 512, 4096, 4096, 4096, 512]
    - [9, 107.98]
  - - [4096, 4096, 1, 1024, 4096, 4096, 4096, 1024]
    - [58, 125.14]
  - - [4096, 4096, 1, 2048, 4096, 4096, 4096, 2048]
    - [36, 150.39]
  - - [4096, 4096, 1, 4096, 4096, 4096, 4096, 4096]
    - [9, 162.35]
  - - [4096, 4096, 1, 8192, 4096, 4096, 4096, 8192]
    - [4, 181.27]
  - - [4096, 8192, 1, 128, 4096, 4096, 4096, 128]
    - [3, 57.12]
  - - [4096, 8192, 1, 256, 4096, 4096, 4096, 256]
    - [20, 87.71]
  - - [4096, 8192, 1, 512, 4096, 4096, 4096, 512]
    - [44, 112.1]
  - - [4096, 8192, 1, 1024, 4096, 4096, 4096, 1024]
    - [41, 142.31]
  - - [4096, 8192, 1, 2048, 4096, 4096, 4096, 2048]
    - [43, 168.72]
  - - [4096, 8192, 1, 4096, 4096, 4096, 4096, 4096]
    - [55, 180.0]
  - - [4096, 8192, 1, 8192, 4096, 4096, 4096, 8192]
    - [11, 202.54]
  - - [8192, 128, 1, 128, 8192, 8192, 8192, 128]
    - [26, 18.54]
  - - [8192, 128, 1, 256, 8192, 8192, 8192, 256]
    - [60, 30.96]
  - - [8192, 128, 1, 512, 8192, 8192, 8192, 512]
    - [64, 47.25]
  - - [8192, 128, 1, 1024, 8192, 8192, 8192, 1024]
    - [81, 66.25]
  - - [8192, 128, 1, 2048, 8192, 8192, 8192, 2048]
    - [81, 74.99]
  - - [8192, 128, 1, 4096, 8192, 8192, 8192, 4096]
    - [82, 84.93]
  - - [8192, 128, 1, 8192, 8192, 8192, 8192, 8192]
    - [80, 79.45]
  - - [8192, 256, 1, 128, 8192, 8192, 8192, 128]
    - [47, 28.79]
  - - [8192, 256, 1, 256, 8192, 8192, 8192, 256]
    - [48, 48.09]
  - - [8192, 256, 1, 512, 8192, 8192, 8192, 512]
    - [49, 72.82]
  - - [8192, 256, 1, 1024, 8192, 8192, 8192, 1024]
    - [53, 94.27]
  - - [8192, 256, 1, 2048, 8192, 8192, 8192, 2048]
    - [58, 104.63]
  - - [8192, 256, 1, 4096, 8192, 8192, 8192, 4096]
    - [56, 117.15]
  - - [8192, 256, 1, 8192, 8192, 8192, 8192, 8192]
    - [53, 109.74]
  - - [8192, 512, 1, 128, 8192, 8192, 8192, 128]
    - [22, 40.26]
  - - [8192, 512, 1, 256, 8192, 8192, 8192, 256]
    - [18, 64.16]
  - - [8192, 512, 1, 512, 8192, 8192, 8192, 512]
    - [41, 93.43]
  - - [8192, 512, 1, 1024, 8192, 8192, 8192, 1024]
    - [41, 117.01]
  - - [8192, 512, 1, 2048, 8192, 8192, 8192, 2048]
    - [42, 133.46]
  - - [8192, 512, 1, 4096, 8192, 8192, 8192, 4096]
    - [51, 130.92]
  - - [8192, 512, 1, 8192, 8192, 8192, 8192, 8192]
    - [14, 135.58]
  - - [8192, 1024, 1, 128, 8192, 8192, 8192, 128]
    - [2, 47.18]
  - - [8192, 1024, 1, 256, 8192, 8192, 8192, 256]
    - [9, 74.92]
  - - [8192, 1024, 1, 512, 8192, 8192, 8192, 512]
    - [13, 105.45]
  - - [8192, 1024, 1, 1024, 8192, 8192, 8192, 1024]
    - [13, 128.74]
  - - [8192, 1024, 1, 2048, 8192, 8192, 8192, 2048]
    - [33, 140.84]
  - - [8192, 1024, 1, 4096, 8192, 8192, 8192, 4096]
    - [34, 157.38]
  - - [8192, 1024, 1, 8192, 8192, 8192, 8192, 8192]
    - [1, 165.12]
  - - [8192, 2048, 1, 128, 8192, 8192, 8192, 128]
    - [3, 54.51]
  - - [8192, 2048, 1, 256, 8192, 8192, 8192, 256]
    - [6, 82.38]
  - - [8192, 2048, 1, 512, 8192, 8192, 8192, 512]
    - [9, 108.8]
  - - [8192, 2048, 1, 1024, 8192, 8192, 8192, 1024]
    - [58, 131.86]
  - - [8192, 2048, 1, 2048, 8192, 8192, 8192, 2048]
    - [23, 142.55]
  - - [8192, 2048, 1, 4096, 8192, 8192, 8192, 4096]
    - [1, 170.04]
  - - [8192, 2048, 1, 8192, 8192, 8192, 8192, 8192]
    - [0, 182.03]
  - - [8192, 4096, 1, 128, 8192, 8192, 8192, 128]
    - [3, 55.98]
  - - [8192, 4096, 1, 256, 8192, 8192, 8192, 256]
    - [19, 86.56]
  - - [8192, 4096, 1, 512, 8192, 8192, 8192, 512]
    - [44, 111.96]
  - - [8192, 4096, 1, 1024, 8192, 8192, 8192, 1024]
    - [43, 140.97]
  - - [8192, 4096, 1, 2048, 8192, 8192, 8192, 2048]
    - [44, 169.06]
  - - [8192, 4096, 1, 4096, 8192, 8192, 8192, 4096]
    - [0, 191.9]
  - - [8192, 4096, 1, 8192, 8192, 8192, 8192, 8192]
    - [10, 196.91]
  - - [8192, 8192, 1, 128, 8192, 8192, 8192, 128]
    - [16, 59.35]
  - - [8192, 8192, 1, 256, 8192, 8192, 8192, 256]
    - [2, 86.36]
  - - [8192, 8192, 1, 512, 8192, 8192, 8192, 512]
    - [12, 118.77]
  - - [8192, 8192, 1, 1024, 8192, 8192, 8192, 1024]
    - [6, 152.56]
  - - [8192, 8192, 1, 2048, 8192, 8192, 8192, 2048]
    - [44, 186.1]
  - - [8192, 8192, 1, 4096, 8192, 8192, 8192, 4096]
    - [36, 198.09]
  - - [8192, 8192, 1, 8192, 8192, 8192, 8192, 8192]
    - [5, 209.06]
- null
- null
- ExperimentalStreamK
- GridBased
