projects/hipblaslt/library/src/amd_detail/rocblaslt/src/Tensile/Logic/asm_full/aquavanjaram/gfx942_228cu/StreamK/aquavanjaram942_Cijk_Alik_Bjlk_BSS_BH_Bias_HAS_SAV_UserArgs.yaml
- {MinimumRequiredVersion: 4.33.0}
- aquavanjaram942
- {Architecture: gfx942, CUCount: 228}
- [Device 0049, Device 0050]
    SolutionIndex: 0
    SolutionNameMin: Cijk_Alik_Bjlk_BSS_BH_Bias_HAS_SAV_UserArgs_MT256x256x32_MI16x16x1_SN_LDSB1_CLR1_GRVWB8_GSU0_GSUC0_GSUWGMRR0_K1_LBSPPA512_LBSPPB2048_LPB0_MIWT8_8_PLR1_SU0_SUM0_SUS64_VWA8_VWB8_WGM1_WGMXCC1_WGMXCCGn1
    SolutionIndex: 1
    SolutionNameMin: Cijk_Alik_Bjlk_BSS_BH_Bias_HAS_SAV_UserArgs_MT256x256x32_MI16x16x1_SN_LDSB1_CLR1_GRVWB2_GSU0_GSUC0_GSUWGMRR0_K1_LBSPPA512_LBSPPB2048_LPB0_MIWT8_8_PLR1_SU0_SUM0_SUS64_VWA8_VWB8_WGM4_WGMXCC1_WGMXCCGn1
    SolutionIndex: 2
    SolutionNameMin: Cijk_Alik_Bjlk_BSS_BH_Bias_HAS_SAV_UserArgs_MT256x256x32_MI16x16x1_SN_LDSB1_CLR1_GRVWB8_GSU0_GSUC0_GSUWGMRR0_K1_LBSPPA512_LBSPPB2048_LPB0_MIWT8_8_PLR1_SU0_SUM0_SUS64_VWA8_VWB8_WGM6_WGMXCC1_WGMXCCGn1
    SolutionIndex: 3
    SolutionNameMin: Cijk_Alik_Bjlk_BSS_BH_Bias_HAS_SAV_UserArgs_MT256x256x32_MI16x16x1_SN_LDSB1_CLR1_GRVWB8_GSU0_GSUC0_GSUWGMRR0_K1_LBSPPA512_LBSPPB2048_LPB0_MIWT8_8_PLR1_SU0_SUM0_SUS64_VWA8_VWB8_WGM8_WGMXCC1_WGMXCCGn1
    SolutionIndex: 4
    SolutionNameMin: Cijk_Alik_Bjlk_BSS_BH_Bias_HAS_SAV_UserArgs_MT128x256x32_MI16x16x1_SN_LDSB1_CLR1_GRVWB2_GSU0_GSUC0_GSUWGMRR0_K1_LBSPPA256_LBSPPB2048_LPB0_MIWT4_8_PLR1_SU0_SUM0_SUS64_VWA4_VWB8_WGM1_WGMXCC1_WGMXCCGn1
    SolutionIndex: 5
    SolutionNameMin: Cijk_Alik_Bjlk_BSS_BH_Bias_HAS_SAV_UserArgs_MT128x256x32_MI16x16x1_SN_LDSB1_CLR1_GRVWB8_GSU0_GSUC0_GSUWGMRR0_K1_LBSPPA256_LBSPPB2048_LPB0_MIWT4_8_PLR1_SU0_SUM0_SUS64_VWA4_VWB8_WGM1_WGMXCC1_WGMXCCGn1
    SolutionIndex: 6
    SolutionNameMin: Cijk_Alik_Bjlk_BSS_BH_Bias_HAS_SAV_UserArgs_MT128x256x32_MI16x16x1_SN_LDSB1_CLR1_GRVWB8_GSU0_GSUC0_GSUWGMRR0_K1_LBSPPA256_LBSPPB2048_LPB0_MIWT4_8_PLR1_SU0_SUM0_SUS64_VWA4_VWB8_WGM1_WGMXCC1_WGMXCCGn1
    SolutionIndex: 7
    SolutionNameMin: Cijk_Alik_Bjlk_BSS_BH_Bias_HAS_SAV_UserArgs_MT128x256x32_MI16x16x1_SN_LDSB1_CLR1_GRVWB8_GSU0_GSUC0_GSUWGMRR0_K1_LBSPPA256_LBSPPB2048_LPB0_MIWT4_8_PLR1_SU0_SUM0_SUS64_VWA4_VWB8_WGM1_WGMXCC1_WGMXCCGn1
    SolutionIndex: 8
    SolutionNameMin: Cijk_Alik_Bjlk_BSS_BH_Bias_HAS_SAV_UserArgs_MT128x256x32_MI16x16x1_SN_LDSB1_CLR1_GRVWB8_GSU0_GSUC0_GSUWGMRR0_K1_LBSPPA256_LBSPPB2048_LPB0_MIWT4_8_PLR1_SU0_SUM0_SUS64_VWA4_VWB8_WGM4_WGMXCC1_WGMXCCGn1
    SolutionIndex: 9
    SolutionNameMin: Cijk_Alik_Bjlk_BSS_BH_Bias_HAS_SAV_UserArgs_MT128x256x32_MI16x16x1_SN_LDSB1_CLR1_GRVWB8_GSU0_GSUC0_GSUWGMRR0_K1_LBSPPA256_LBSPPB2048_LPB0_MIWT4_8_PLR1_SU0_SUM0_SUS64_VWA4_VWB8_WGM4_WGMXCC1_WGMXCCGn1
    SolutionIndex: 10
    SolutionNameMin: Cijk_Alik_Bjlk_BSS_BH_Bias_HAS_SAV_UserArgs_MT128x256x32_MI16x16x1_SN_LDSB1_CLR1_GRVWB8_GSU0_GSUC0_GSUWGMRR0_K1_LBSPPA256_LBSPPB2048_LPB0_MIWT4_8_PLR1_SU0_SUM0_SUS64_VWA4_VWB8_WGM6_WGMXCC1_WGMXCCGn1
    SolutionIndex: 11
    SolutionNameMin: Cijk_Alik_Bjlk_BSS_BH_Bias_HAS_SAV_UserArgs_MT128x256x32_MI16x16x1_SN_LDSB1_CLR1_GRVWB8_GSU0_GSUC0_GSUWGMRR0_K1_LBSPPA256_LBSPPB2048_LPB0_MIWT4_8_PLR1_SU0_SUM0_SUS64_VWA4_VWB8_WGM6_WGMXCC1_WGMXCCGn1
    SolutionIndex: 12
    SolutionNameMin: Cijk_Alik_Bjlk_BSS_BH_Bias_HAS_SAV_UserArgs_MT128x256x32_MI16x16x1_SN_LDSB1_CLR1_GRVWB8_GSU0_GSUC0_GSUWGMRR0_K1_LBSPPA256_LBSPPB2048_LPB0_MIWT4_8_PLR1_SU0_SUM0_SUS64_VWA4_VWB8_WGM6_WGMXCC1_WGMXCCGn1
    SolutionIndex: 13
    SolutionNameMin: Cijk_Alik_Bjlk_BSS_BH_Bias_HAS_SAV_UserArgs_MT128x256x32_MI16x16x1_SN_LDSB1_CLR1_GRVWB8_GSU0_GSUC0_GSUWGMRR0_K1_LBSPPA256_LBSPPB2048_LPB0_MIWT4_8_PLR1_SU0_SUM0_SUS64_VWA4_VWB8_WGM8_WGMXCC1_WGMXCCGn1
    SolutionIndex: 14
    SolutionNameMin: Cijk_Alik_Bjlk_BSS_BH_Bias_HAS_SAV_UserArgs_MT128x256x32_MI16x16x1_SN_LDSB1_CLR1_GRVWB8_GSU0_GSUC0_GSUWGMRR0_K1_LBSPPA256_LBSPPB2048_LPB0_MIWT4_8_PLR1_SU0_SUM0_SUS64_VWA4_VWB8_WGM8_WGMXCC1_WGMXCCGn1
    SolutionIndex: 15
    SolutionNameMin: Cijk_Alik_Bjlk_BSS_BH_Bias_HAS_SAV_UserArgs_MT128x128x32_MI16x16x1_SN_LDSB1_CLR1_GRVWB4_GSU0_GSUC0_GSUWGMRR0_K1_LBSPPA256_LBSPPB1024_LPB0_MIWT4_4_PLR1_SU0_SUM0_SUS64_VWA4_VWB4_WGM1_WGMXCC1_WGMXCCGn1
    SolutionIndex: 16
    SolutionNameMin: Cijk_Alik_Bjlk_BSS_BH_Bias_HAS_SAV_UserArgs_MT128x128x32_MI16x16x1_SN_LDSB1_CLR1_GRVWB8_GSU0_GSUC0_GSUWGMRR0_K1_LBSPPA256_LBSPPB1024_LPB0_MIWT4_4_PLR1_SU0_SUM0_SUS64_VWA4_VWB4_WGM1_WGMXCC1_WGMXCCGn1
    SolutionIndex: 17
    SolutionNameMin: Cijk_Alik_Bjlk_BSS_BH_Bias_HAS_SAV_UserArgs_MT128x128x32_MI16x16x1_SN_LDSB1_CLR1_GRVWB8_GSU0_GSUC0_GSUWGMRR0_K1_LBSPPA256_LBSPPB1024_LPB0_MIWT4_4_PLR1_SU0_SUM0_SUS64_VWA4_VWB4_WGM6_WGMXCC1_WGMXCCGn1
    SolutionIndex: 18
    SolutionNameMin: Cijk_Alik_Bjlk_BSS_BH_Bias_HAS_SAV_UserArgs_MT128x128x32_MI16x16x1_SN_LDSB1_CLR1_GRVWB8_GSU0_GSUC0_GSUWGMRR0_K1_LBSPPA256_LBSPPB1024_LPB0_MIWT4_4_PLR1_SU0_SUM0_SUS64_VWA4_VWB4_WGM6_WGMXCC1_WGMXCCGn1
    SolutionIndex: 19
    SolutionNameMin: Cijk_Alik_Bjlk_BSS_BH_Bias_HAS_SAV_UserArgs_MT128x128x32_MI16x16x1_SN_LDSB1_CLR1_GRVWB8_GSU0_GSUC0_GSUWGMRR0_K1_LBSPPA256_LBSPPB1024_LPB0_MIWT4_4_PLR1_SU0_SUM0_SUS64_VWA4_VWB4_WGM6_WGMXCC1_WGMXCCGn1
    SolutionIndex: 20
    SolutionNameMin: Cijk_Alik_Bjlk_BSS_BH_Bias_HAS_SAV_UserArgs_MT128x128x32_MI16x16x1_SN_LDSB1_CLR1_GRVWB8_GSU0_GSUC0_GSUWGMRR0_K1_LBSPPA256_LBSPPB2048_LPB0_MIWT4_4_PLR1_SU0_SUM0_SUS64_VWA4_VWB4_WGM6_WGMXCC1_WGMXCCGn1
    SolutionIndex: 21
    SolutionNameMin: Cijk_Alik_Bjlk_BSS_BH_Bias_HAS_SAV_UserArgs_MT128x128x32_MI16x16x1_SN_LDSB1_CLR1_GRVWB4_GSU0_GSUC0_GSUWGMRR0_K1_LBSPPA256_LBSPPB1024_LPB0_MIWT4_4_PLR1_SU0_SUM0_SUS64_VWA4_VWB4_WGM8_WGMXCC1_WGMXCCGn1
    SolutionIndex: 22
    SolutionNameMin: Cijk_Alik_Bjlk_BSS_BH_Bias_HAS_SAV_UserArgs_MT128x128x32_MI16x16x1_SN_LDSB1_CLR1_GRVWB8_GSU0_GSUC0_GSUWGMRR0_K1_LBSPPA256_LBSPPB1024_LPB0_MIWT4_4_PLR1_SU0_SUM0_SUS64_VWA4_VWB4_WGM8_WGMXCC1_WGMXCCGn1
    SolutionIndex: 23
    SolutionNameMin: Cijk_Alik_Bjlk_BSS_BH_Bias_HAS_SAV_UserArgs_MT64x64x32_MI16x16x1_SN_LDSB0_CLR1_GRVWB2_GSU0_GSUC0_GSUWGMRR0_K1_LBSPPA128_LBSPPB512_LPB32_MIWT2_2_PLR1_SU0_SUM0_SUS64_VWA2_VWB2_WGM1_WGMXCC1_WGMXCCGn1
    SolutionIndex: 24
    SolutionNameMin: Cijk_Alik_Bjlk_BSS_BH_Bias_HAS_SAV_UserArgs_MT64x64x32_MI16x16x1_SN_LDSB0_CLR1_GRVWB2_GSU0_GSUC0_GSUWGMRR0_K1_LBSPPA128_LBSPPB512_LPB32_MIWT2_2_PLR1_SU0_SUM0_SUS64_VWA2_VWB2_WGM4_WGMXCC1_WGMXCCGn1
    SolutionIndex: 25
    SolutionNameMin: Cijk_Alik_Bjlk_BSS_BH_Bias_HAS_SAV_UserArgs_MT64x64x32_MI16x16x1_SN_LDSB0_CLR1_GRVWB2_GSU0_GSUC0_GSUWGMRR0_K1_LBSPPA128_LBSPPB512_LPB32_MIWT2_2_PLR1_SU0_SUM0_SUS64_VWA2_VWB2_WGM8_WGMXCC1_WGMXCCGn1
    SolutionIndex: 26
    SolutionNameMin: Cijk_Alik_Bjlk_BSS_BH_Bias_HAS_SAV_UserArgs_MT128x256x64_MI16x16x1_SN_LDSB1_CLR1_GRVWB8_GSU0_GSUC0_GSUWGMRR0_K1_LBSPPA512_LBSPPB2048_LPB0_MIWT4_8_PLR1_SU0_SUM0_SUS128_VWA4_VWB8_WGM1_WGMXCC1_WGMXCCGn1
    SolutionIndex: 27
    SolutionNameMin: Cijk_Alik_Bjlk_BSS_BH_Bias_HAS_SAV_UserArgs_MT128x256x64_MI16x16x1_SN_LDSB1_CLR1_GRVWB8_GSU0_GSUC0_GSUWGMRR0_K1_LBSPPA512_LBSPPB4096_LPB0_MIWT4_8_PLR1_SU0_SUM0_SUS128_VWA4_VWB8_WGM1_WGMXCC1_WGMXCCGn1
    SolutionIndex: 28
    SolutionNameMin: Cijk_Alik_Bjlk_BSS_BH_Bias_HAS_SAV_UserArgs_MT128x256x64_MI16x16x1_SN_LDSB1_CLR1_GRVWB8_GSU0_GSUC0_GSUWGMRR0_K1_LBSPPA512_LBSPPB4096_LPB0_MIWT4_8_PLR1_SU0_SUM0_SUS128_VWA4_VWB8_WGM1_WGMXCC1_WGMXCCGn1
    SolutionIndex: 29
    SolutionNameMin: Cijk_Alik_Bjlk_BSS_BH_Bias_HAS_SAV_UserArgs_MT128x256x64_MI16x16x1_SN_LDSB1_CLR1_GRVWB8_GSU0_GSUC0_GSUWGMRR0_K1_LBSPPA512_LBSPPB4096_LPB0_MIWT4_8_PLR1_SU0_SUM0_SUS128_VWA4_VWB8_WGM1_WGMXCC1_WGMXCCGn1
    SolutionIndex: 30
    SolutionNameMin: Cijk_Alik_Bjlk_BSS_BH_Bias_HAS_SAV_UserArgs_MT128x256x64_MI16x16x1_SN_LDSB1_CLR1_GRVWB8_GSU0_GSUC0_GSUWGMRR0_K1_LBSPPA512_LBSPPB4096_LPB0_MIWT4_8_PLR1_SU0_SUM0_SUS128_VWA4_VWB8_WGM4_WGMXCC1_WGMXCCGn1
    SolutionIndex: 31
    SolutionNameMin: Cijk_Alik_Bjlk_BSS_BH_Bias_HAS_SAV_UserArgs_MT128x256x64_MI16x16x1_SN_LDSB1_CLR1_GRVWB8_GSU0_GSUC0_GSUWGMRR0_K1_LBSPPA512_LBSPPB4096_LPB0_MIWT4_8_PLR1_SU0_SUM0_SUS128_VWA4_VWB8_WGM4_WGMXCC1_WGMXCCGn1
    SolutionIndex: 32
    SolutionNameMin: Cijk_Alik_Bjlk_BSS_BH_Bias_HAS_SAV_UserArgs_MT128x256x64_MI16x16x1_SN_LDSB1_CLR1_GRVWB8_GSU0_GSUC0_GSUWGMRR0_K1_LBSPPA512_LBSPPB4096_LPB0_MIWT4_8_PLR1_SU0_SUM0_SUS128_VWA4_VWB8_WGM6_WGMXCC1_WGMXCCGn1
    SolutionIndex: 33
    SolutionNameMin: Cijk_Alik_Bjlk_BSS_BH_Bias_HAS_SAV_UserArgs_MT128x256x64_MI16x16x1_SN_LDSB1_CLR1_GRVWB8_GSU0_GSUC0_GSUWGMRR0_K1_LBSPPA512_LBSPPB4096_LPB0_MIWT4_8_PLR1_SU0_SUM0_SUS128_VWA4_VWB8_WGM6_WGMXCC1_WGMXCCGn1
    SolutionIndex: 34
    SolutionNameMin: Cijk_Alik_Bjlk_BSS_BH_Bias_HAS_SAV_UserArgs_MT128x128x64_MI16x16x1_SN_LDSB1_CLR1_GRVWB8_GSU0_GSUC0_GSUWGMRR0_K1_LBSPPA512_LBSPPB1024_LPB0_MIWT4_4_PLR1_SU0_SUM0_SUS128_VWA4_VWB4_WGM1_WGMXCC1_WGMXCCGn1
    SolutionIndex: 35
    SolutionNameMin: Cijk_Alik_Bjlk_BSS_BH_Bias_HAS_SAV_UserArgs_MT128x128x64_MI16x16x1_SN_LDSB1_CLR1_GRVWB8_GSU0_GSUC0_GSUWGMRR0_K1_LBSPPA512_LBSPPB1024_LPB0_MIWT4_4_PLR1_SU0_SUM0_SUS128_VWA4_VWB4_WGM1_WGMXCC1_WGMXCCGn1
    SolutionIndex: 36
    SolutionNameMin: Cijk_Alik_Bjlk_BSS_BH_Bias_HAS_SAV_UserArgs_MT128x128x64_MI16x16x1_SN_LDSB1_CLR1_GRVWB8_GSU0_GSUC0_GSUWGMRR0_K1_LBSPPA512_LBSPPB2048_LPB0_MIWT4_4_PLR1_SU0_SUM0_SUS128_VWA4_VWB4_WGM1_WGMXCC1_WGMXCCGn1
    SolutionIndex: 37
    SolutionNameMin: Cijk_Alik_Bjlk_BSS_BH_Bias_HAS_SAV_UserArgs_MT128x128x64_MI16x16x1_SN_LDSB1_CLR1_GRVWB8_GSU0_GSUC0_GSUWGMRR0_K1_LBSPPA512_LBSPPB2048_LPB0_MIWT4_4_PLR1_SU0_SUM0_SUS128_VWA4_VWB4_WGM1_WGMXCC1_WGMXCCGn1
    SolutionIndex: 38
    SolutionNameMin: Cijk_Alik_Bjlk_BSS_BH_Bias_HAS_SAV_UserArgs_MT128x128x64_MI16x16x1_SN_LDSB1_CLR1_GRVWB2_GSU0_GSUC0_GSUWGMRR0_K1_LBSPPA512_LBSPPB2048_LPB0_MIWT4_4_PLR1_SU0_SUM0_SUS128_VWA4_VWB4_WGM4_WGMXCC1_WGMXCCGn1
    SolutionIndex: 39
    SolutionNameMin: Cijk_Alik_Bjlk_BSS_BH_Bias_HAS_SAV_UserArgs_MT128x128x64_MI16x16x1_SN_LDSB1_CLR1_GRVWB8_GSU0_GSUC0_GSUWGMRR0_K1_LBSPPA512_LBSPPB2048_LPB0_MIWT4_4_PLR1_SU0_SUM0_SUS128_VWA4_VWB4_WGM4_WGMXCC1_WGMXCCGn1
    SolutionIndex: 40
    SolutionNameMin: Cijk_Alik_Bjlk_BSS_BH_Bias_HAS_SAV_UserArgs_MT128x128x64_MI16x16x1_SN_LDSB1_CLR1_GRVWB8_GSU0_GSUC0_GSUWGMRR0_K1_LBSPPA512_LBSPPB2048_LPB0_MIWT4_4_PLR1_SU0_SUM0_SUS128_VWA4_VWB4_WGM4_WGMXCC1_WGMXCCGn1
    SolutionIndex: 41
    SolutionNameMin: Cijk_Alik_Bjlk_BSS_BH_Bias_HAS_SAV_UserArgs_MT128x128x64_MI16x16x1_SN_LDSB1_CLR1_GRVWB8_GSU0_GSUC0_GSUWGMRR0_K1_LBSPPA512_LBSPPB2048_LPB0_MIWT4_4_PLR1_SU0_SUM0_SUS128_VWA4_VWB4_WGM6_WGMXCC1_WGMXCCGn1
    SolutionIndex: 42
    SolutionNameMin: Cijk_Alik_Bjlk_BSS_BH_Bias_HAS_SAV_UserArgs_MT128x128x64_MI16x16x1_SN_LDSB1_CLR1_GRVWB8_GSU0_GSUC0_GSUWGMRR0_K1_LBSPPA512_LBSPPB2048_LPB0_MIWT4_4_PLR1_SU0_SUM0_SUS128_VWA4_VWB4_WGM6_WGMXCC1_WGMXCCGn1
    SolutionIndex: 43
    SolutionNameMin: Cijk_Alik_Bjlk_BSS_BH_Bias_HAS_SAV_UserArgs_MT128x128x64_MI16x16x1_SN_LDSB1_CLR1_GRVWB8_GSU0_GSUC0_GSUWGMRR0_K1_LBSPPA512_LBSPPB2048_LPB0_MIWT4_4_PLR1_SU0_SUM0_SUS128_VWA4_VWB4_WGM6_WGMXCC1_WGMXCCGn1
    SolutionIndex: 44
    SolutionNameMin: Cijk_Alik_Bjlk_BSS_BH_Bias_HAS_SAV_UserArgs_MT128x128x64_MI16x16x1_SN_LDSB1_CLR1_GRVWB8_GSU0_GSUC0_GSUWGMRR0_K1_LBSPPA512_LBSPPB2048_LPB0_MIWT4_4_PLR1_SU0_SUM0_SUS128_VWA4_VWB4_WGM8_WGMXCC1_WGMXCCGn1
    SolutionIndex: 45
    SolutionNameMin: Cijk_Alik_Bjlk_BSS_BH_Bias_HAS_SAV_UserArgs_MT128x128x64_MI16x16x1_SN_LDSB1_CLR1_GRVWB8_GSU0_GSUC0_GSUWGMRR0_K1_LBSPPA512_LBSPPB2048_LPB0_MIWT4_4_PLR1_SU0_SUM0_SUS128_VWA4_VWB4_WGM8_WGMXCC1_WGMXCCGn1
    SolutionIndex: 46
    SolutionNameMin: Cijk_Alik_Bjlk_BSS_BH_Bias_HAS_SAV_UserArgs_MT64x128x64_MI16x16x1_SN_LDSB1_CLR1_GRVWB8_GSU0_GSUC0_GSUWGMRR0_K1_LBSPPA256_LBSPPB1024_LPB0_MIWT2_4_PLR1_SU0_SUM0_SUS128_VWA2_VWB4_WGM1_WGMXCC1_WGMXCCGn1
    SolutionIndex: 47
    SolutionNameMin: Cijk_Alik_Bjlk_BSS_BH_Bias_HAS_SAV_UserArgs_MT64x128x64_MI16x16x1_SN_LDSB1_CLR1_GRVWB8_GSU0_GSUC0_GSUWGMRR0_K1_LBSPPA256_LBSPPB1024_LPB0_MIWT2_4_PLR1_SU0_SUM0_SUS128_VWA2_VWB4_WGM1_WGMXCC1_WGMXCCGn1
    SolutionIndex: 48
    SolutionNameMin: Cijk_Alik_Bjlk_BSS_BH_Bias_HAS_SAV_UserArgs_MT64x128x64_MI16x16x1_SN_LDSB1_CLR1_GRVWB8_GSU0_GSUC0_GSUWGMRR0_K1_LBSPPA256_LBSPPB2048_LPB0_MIWT2_4_PLR1_SU0_SUM0_SUS128_VWA2_VWB4_WGM1_WGMXCC1_WGMXCCGn1
    SolutionIndex: 49
    SolutionNameMin: Cijk_Alik_Bjlk_BSS_BH_Bias_HAS_SAV_UserArgs_MT64x128x64_MI16x16x1_SN_LDSB1_CLR1_GRVWB8_GSU0_GSUC0_GSUWGMRR0_K1_LBSPPA256_LBSPPB2048_LPB0_MIWT2_4_PLR1_SU0_SUM0_SUS128_VWA2_VWB4_WGM1_WGMXCC1_WGMXCCGn1
    SolutionIndex: 50
    SolutionNameMin: Cijk_Alik_Bjlk_BSS_BH_Bias_HAS_SAV_UserArgs_MT64x128x64_MI16x16x1_SN_LDSB1_CLR1_GRVWB8_GSU0_GSUC0_GSUWGMRR0_K1_LBSPPA256_LBSPPB2048_LPB0_MIWT2_4_PLR1_SU0_SUM0_SUS128_VWA2_VWB4_WGM8_WGMXCC1_WGMXCCGn1
    SolutionIndex: 51
    SolutionNameMin: Cijk_Alik_Bjlk_BSS_BH_Bias_HAS_SAV_UserArgs_MT128x64x64_MI16x16x1_SN_LDSB1_CLR1_GRVWB2_GSU0_GSUC0_GSUWGMRR0_K1_LBSPPA512_LBSPPB1024_LPB32_MIWT4_2_PLR1_SU0_SUM0_SUS128_VWA4_VWB2_WGM1_WGMXCC1_WGMXCCGn1
    SolutionIndex: 52
    SolutionNameMin: Cijk_Alik_Bjlk_BSS_BH_Bias_HAS_SAV_UserArgs_MT128x64x64_MI16x16x1_SN_LDSB1_CLR1_GRVWB4_GSU0_GSUC0_GSUWGMRR0_K1_LBSPPA512_LBSPPB1024_LPB32_MIWT4_2_PLR1_SU0_SUM0_SUS128_VWA4_VWB2_WGM1_WGMXCC1_WGMXCCGn1
    SolutionIndex: 53
    SolutionNameMin: Cijk_Alik_Bjlk_BSS_BH_Bias_HAS_SAV_UserArgs_MT128x64x64_MI16x16x1_SN_LDSB1_CLR1_GRVWB8_GSU0_GSUC0_GSUWGMRR0_K1_LBSPPA512_LBSPPB1024_LPB32_MIWT4_2_PLR1_SU0_SUM0_SUS128_VWA4_VWB2_WGM1_WGMXCC1_WGMXCCGn1
    SolutionIndex: 54
    SolutionNameMin: Cijk_Alik_Bjlk_BSS_BH_Bias_HAS_SAV_UserArgs_MT128x64x64_MI16x16x1_SN_LDSB1_CLR1_GRVWB4_GSU0_GSUC0_GSUWGMRR0_K1_LBSPPA512_LBSPPB1024_LPB32_MIWT4_2_PLR1_SU0_SUM0_SUS128_VWA4_VWB2_WGM6_WGMXCC1_WGMXCCGn1
    SolutionIndex: 55
    SolutionNameMin: Cijk_Alik_Bjlk_BSS_BH_Bias_HAS_SAV_UserArgs_MT128x64x64_MI16x16x1_SN_LDSB1_CLR1_GRVWB8_GSU0_GSUC0_GSUWGMRR0_K1_LBSPPA512_LBSPPB512_LPB32_MIWT4_2_PLR1_SU0_SUM0_SUS128_VWA4_VWB2_WGM8_WGMXCC1_WGMXCCGn1
    SolutionIndex: 56
    SolutionNameMin: Cijk_Alik_Bjlk_BSS_BH_Bias_HAS_SAV_UserArgs_MT128x64x64_MI16x16x1_SN_LDSB1_CLR1_GRVWB8_GSU0_GSUC0_GSUWGMRR0_K1_LBSPPA512_LBSPPB1024_LPB32_MIWT4_2_PLR1_SU0_SUM0_SUS128_VWA4_VWB2_WGM8_WGMXCC1_WGMXCCGn1
    SolutionIndex: 57
    SolutionNameMin: Cijk_Alik_Bjlk_BSS_BH_Bias_HAS_SAV_UserArgs_MT128x32x64_MI16x16x1_SN_LDSB1_CLR1_GRVWB2_GSU0_GSUC0_GSUWGMRR0_K1_LBSPPA512_LBSPPB512_LPB16_MIWT4_1_PLR1_SU0_SUM0_SUS128_VWA4_VWB1_WGM1_WGMXCC1_WGMXCCGn1
    SolutionIndex: 58
    SolutionNameMin: Cijk_Alik_Bjlk_BSS_BH_Bias_HAS_SAV_UserArgs_MT64x64x64_MI16x16x1_SN_LDSB1_CLR1_GRVWB8_GSU0_GSUC0_GSUWGMRR0_K1_LBSPPA256_LBSPPB512_LPB32_MIWT2_2_PLR1_SU0_SUM0_SUS128_VWA2_VWB2_WGM1_WGMXCC1_WGMXCCGn1
    SolutionIndex: 59
    SolutionNameMin: Cijk_Alik_Bjlk_BSS_BH_Bias_HAS_SAV_UserArgs_MT64x64x64_MI16x16x1_SN_LDSB1_CLR1_GRVWB2_GSU0_GSUC0_GSUWGMRR0_K1_LBSPPA256_LBSPPB1024_LPB32_MIWT2_2_PLR1_SU0_SUM0_SUS128_VWA2_VWB2_WGM1_WGMXCC1_WGMXCCGn1
    SolutionIndex: 60
    SolutionNameMin: Cijk_Alik_Bjlk_BSS_BH_Bias_HAS_SAV_UserArgs_MT64x64x64_MI16x16x1_SN_LDSB1_CLR1_GRVWB8_GSU0_GSUC0_GSUWGMRR0_K1_LBSPPA256_LBSPPB1024_LPB32_MIWT2_2_PLR1_SU0_SUM0_SUS128_VWA2_VWB2_WGM1_WGMXCC1_WGMXCCGn1
    SolutionIndex: 61
    SolutionNameMin: Cijk_Alik_Bjlk_BSS_BH_Bias_HAS_SAV_UserArgs_MT64x64x64_MI16x16x1_SN_LDSB1_CLR1_GRVWB8_GSU0_GSUC0_GSUWGMRR0_K1_LBSPPA256_LBSPPB1024_LPB32_MIWT2_2_PLR1_SU0_SUM0_SUS128_VWA2_VWB2_WGM1_WGMXCC1_WGMXCCGn1
    SolutionIndex: 62
    SolutionNameMin: Cijk_Alik_Bjlk_BSS_BH_Bias_HAS_SAV_UserArgs_MT64x64x64_MI16x16x1_SN_LDSB1_CLR1_GRVWB2_GSU0_GSUC0_GSUWGMRR0_K1_LBSPPA256_LBSPPB512_LPB32_MIWT2_2_PLR1_SU0_SUM0_SUS128_VWA2_VWB2_WGM4_WGMXCC1_WGMXCCGn1
    SolutionIndex: 63
    SolutionNameMin: Cijk_Alik_Bjlk_BSS_BH_Bias_HAS_SAV_UserArgs_MT64x64x64_MI16x16x1_SN_LDSB1_CLR1_GRVWB8_GSU0_GSUC0_GSUWGMRR0_K1_LBSPPA256_LBSPPB1024_LPB32_MIWT2_2_PLR1_SU0_SUM0_SUS128_VWA2_VWB2_WGM8_WGMXCC1_WGMXCCGn1
    SolutionIndex: 64
    SolutionNameMin: Cijk_Alik_Bjlk_BSS_BH_Bias_HAS_SAV_UserArgs_MT32x64x64_MI16x16x1_SN_LDSB0_CLR1_GRVWB2_GSU0_GSUC0_GSUWGMRR0_K1_LBSPPA128_LBSPPB1024_LPB32_MIWT1_2_PLR1_SU0_SUM0_SUS128_VWA1_VWB2_WGM1_WGMXCC1_WGMXCCGn1
    SolutionIndex: 65
    SolutionNameMin: Cijk_Alik_Bjlk_BSS_BH_Bias_HAS_SAV_UserArgs_MT32x64x64_MI16x16x1_SN_LDSB0_CLR1_GRVWB8_GSU0_GSUC0_GSUWGMRR0_K1_LBSPPA128_LBSPPB1024_LPB32_MIWT1_2_PLR1_SU0_SUM0_SUS128_VWA1_VWB2_WGM1_WGMXCC1_WGMXCCGn1
    SolutionIndex: 66
    SolutionNameMin: Cijk_Alik_Bjlk_BSS_BH_Bias_HAS_SAV_UserArgs_MT32x32x64_MI16x16x1_SN_LDSB0_CLR1_GRVWB2_GSU0_GSUC0_GSUWGMRR0_K1_LBSPPA128_LBSPPB512_LPB16_MIWT1_1_PLR1_SU0_SUM0_SUS128_VWA1_VWB1_WGM1_WGMXCC1_WGMXCCGn1
    SolutionIndex: 67
    SolutionNameMin: Cijk_Alik_Bjlk_BSS_BH_Bias_HAS_SAV_UserArgs_MT32x32x64_MI16x16x1_SN_LDSB0_CLR1_GRVWB4_GSU0_GSUC0_GSUWGMRR0_K1_LBSPPA128_LBSPPB512_LPB16_MIWT1_1_PLR1_SU0_SUM0_SUS128_VWA1_VWB1_WGM1_WGMXCC1_WGMXCCGn1
    SolutionIndex: 68
    SolutionNameMin: Cijk_Alik_Bjlk_BSS_BH_Bias_HAS_SAV_UserArgs_MT32x32x64_MI16x16x1_SN_LDSB0_CLR1_GRVWB8_GSU0_GSUC0_GSUWGMRR0_K1_LBSPPA128_LBSPPB512_LPB16_MIWT1_1_PLR1_SU0_SUM0_SUS128_VWA1_VWB1_WGM1_WGMXCC1_WGMXCCGn1
    SolutionIndex: 69
    SolutionNameMin: Cijk_Alik_Bjlk_BSS_BH_Bias_HAS_SAV_UserArgs_MT64x128x128_MI16x16x1_SN_LDSB1_CLR1_GRVWB8_GSU0_GSUC0_GSUWGMRR0_K1_LBSPPA512_LBSPPB1024_LPB0_MIWT2_4_PLR1_SU0_SUM0_SUS256_VWA2_VWB4_WGM1_WGMXCC1_WGMXCCGn1
    SolutionIndex: 70
    SolutionNameMin: Cijk_Alik_Bjlk_BSS_BH_Bias_HAS_SAV_UserArgs_MT64x128x128_MI16x16x1_SN_LDSB1_CLR1_GRVWB8_GSU0_GSUC0_GSUWGMRR0_K1_LBSPPA512_LBSPPB2048_LPB0_MIWT2_4_PLR1_SU0_SUM0_SUS256_VWA2_VWB4_WGM1_WGMXCC1_WGMXCCGn1
    SolutionIndex: 71
    SolutionNameMin: Cijk_Alik_Bjlk_BSS_BH_Bias_HAS_SAV_UserArgs_MT64x128x128_MI16x16x1_SN_LDSB1_CLR1_GRVWB8_GSU0_GSUC0_GSUWGMRR0_K1_LBSPPA512_LBSPPB2048_LPB0_MIWT2_4_PLR1_SU0_SUM0_SUS256_VWA2_VWB4_WGM1_WGMXCC1_WGMXCCGn1
    SolutionIndex: 72
    SolutionNameMin: Cijk_Alik_Bjlk_BSS_BH_Bias_HAS_SAV_UserArgs_MT64x128x128_MI16x16x1_SN_LDSB1_CLR1_GRVWB8_GSU0_GSUC0_GSUWGMRR0_K1_LBSPPA512_LBSPPB2048_LPB0_MIWT2_4_PLR1_SU0_SUM0_SUS256_VWA2_VWB4_WGM4_WGMXCC1_WGMXCCGn1
    SolutionIndex: 73
    SolutionNameMin: Cijk_Alik_Bjlk_BSS_BH_Bias_HAS_SAV_UserArgs_MT64x128x128_MI16x16x1_SN_LDSB1_CLR1_GRVWB8_GSU0_GSUC0_GSUWGMRR0_K1_LBSPPA512_LBSPPB2048_LPB0_MIWT2_4_PLR1_SU0_SUM0_SUS256_VWA2_VWB4_WGM4_WGMXCC1_WGMXCCGn1
    SolutionIndex: 74
    SolutionNameMin: Cijk_Alik_Bjlk_BSS_BH_Bias_HAS_SAV_UserArgs_MT64x128x128_MI16x16x1_SN_LDSB1_CLR1_GRVWB8_GSU0_GSUC0_GSUWGMRR0_K1_LBSPPA512_LBSPPB1024_LPB0_MIWT2_4_PLR1_SU0_SUM0_SUS256_VWA2_VWB4_WGM6_WGMXCC1_WGMXCCGn1
    SolutionIndex: 75
    SolutionNameMin: Cijk_Alik_Bjlk_BSS_BH_Bias_HAS_SAV_UserArgs_MT64x128x128_MI16x16x1_SN_LDSB1_CLR1_GRVWB8_GSU0_GSUC0_GSUWGMRR0_K1_LBSPPA512_LBSPPB2048_LPB0_MIWT2_4_PLR1_SU0_SUM0_SUS256_VWA2_VWB4_WGM6_WGMXCC1_WGMXCCGn1
    SolutionIndex: 76
    SolutionNameMin: Cijk_Alik_Bjlk_BSS_BH_Bias_HAS_SAV_UserArgs_MT64x128x128_MI16x16x1_SN_LDSB1_CLR1_GRVWB8_GSU0_GSUC0_GSUWGMRR0_K1_LBSPPA512_LBSPPB2048_LPB0_MIWT2_4_PLR1_SU0_SUM0_SUS256_VWA2_VWB4_WGM6_WGMXCC1_WGMXCCGn1
    SolutionIndex: 77
    SolutionNameMin: Cijk_Alik_Bjlk_BSS_BH_Bias_HAS_SAV_UserArgs_MT64x128x128_MI16x16x1_SN_LDSB1_CLR1_GRVWB8_GSU0_GSUC0_GSUWGMRR0_K1_LBSPPA512_LBSPPB1024_LPB0_MIWT2_4_PLR1_SU0_SUM0_SUS256_VWA2_VWB4_WGM8_WGMXCC1_WGMXCCGn1
    SolutionIndex: 78
    SolutionNameMin: Cijk_Alik_Bjlk_BSS_BH_Bias_HAS_SAV_UserArgs_MT64x128x128_MI16x16x1_SN_LDSB1_CLR1_GRVWB8_GSU0_GSUC0_GSUWGMRR0_K1_LBSPPA512_LBSPPB2048_LPB0_MIWT2_4_PLR1_SU0_SUM0_SUS256_VWA2_VWB4_WGM8_WGMXCC1_WGMXCCGn1
    SolutionIndex: 79
    SolutionNameMin: Cijk_Alik_Bjlk_BSS_BH_Bias_HAS_SAV_UserArgs_MT128x64x128_MI16x16x1_SN_LDSB1_CLR1_GRVWB8_GSU0_GSUC0_GSUWGMRR0_K1_LBSPPA1024_LBSPPB1024_LPB32_MIWT4_2_PLR1_SU0_SUM0_SUS256_VWA4_VWB2_WGM1_WGMXCC1_WGMXCCGn1
    SolutionIndex: 80
    SolutionNameMin: Cijk_Alik_Bjlk_BSS_BH_Bias_HAS_SAV_UserArgs_MT32x128x128_MI16x16x1_SN_LDSB1_CLR1_GRVWB8_GSU0_GSUC0_GSUWGMRR0_K1_LBSPPA256_LBSPPB1024_LPB0_MIWT1_4_PLR1_SU0_SUM0_SUS256_VWA1_VWB4_WGM1_WGMXCC1_WGMXCCGn1
    SolutionIndex: 81
    SolutionNameMin: Cijk_Alik_Bjlk_BSS_BH_Bias_HAS_SAV_UserArgs_MT64x64x128_MI16x16x1_SN_LDSB1_CLR1_GRVWB8_GSU0_GSUC0_GSUWGMRR0_K1_LBSPPA512_LBSPPB512_LPB32_MIWT2_2_PLR1_SU0_SUM0_SUS256_VWA2_VWB2_WGM1_WGMXCC1_WGMXCCGn1
    SolutionIndex: 82
    SolutionNameMin: Cijk_Alik_Bjlk_BSS_BH_Bias_HAS_SAV_UserArgs_MT64x64x128_MI16x16x1_SN_LDSB1_CLR1_GRVWB8_GSU0_GSUC0_GSUWGMRR0_K1_LBSPPA512_LBSPPB1024_LPB32_MIWT2_2_PLR1_SU0_SUM0_SUS256_VWA2_VWB2_WGM1_WGMXCC1_WGMXCCGn1
    SolutionIndex: 83
    SolutionNameMin: Cijk_Alik_Bjlk_BSS_BH_Bias_HAS_SAV_UserArgs_MT64x64x128_MI16x16x1_SN_LDSB1_CLR1_GRVWB8_GSU0_GSUC0_GSUWGMRR0_K1_LBSPPA512_LBSPPB1024_LPB32_MIWT2_2_PLR1_SU0_SUM0_SUS256_VWA2_VWB2_WGM4_WGMXCC1_WGMXCCGn1
    SolutionIndex: 84
    SolutionNameMin: Cijk_Alik_Bjlk_BSS_BH_Bias_HAS_SAV_UserArgs_MT64x64x128_MI16x16x1_SN_LDSB1_CLR1_GRVWB4_GSU0_GSUC0_GSUWGMRR0_K1_LBSPPA512_LBSPPB1024_LPB32_MIWT2_2_PLR1_SU0_SUM0_SUS256_VWA2_VWB2_WGM6_WGMXCC1_WGMXCCGn1
    SolutionIndex: 85
    SolutionNameMin: Cijk_Alik_Bjlk_BSS_BH_Bias_HAS_SAV_UserArgs_MT64x64x128_MI16x16x1_SN_LDSB1_CLR1_GRVWB8_GSU0_GSUC0_GSUWGMRR0_K1_LBSPPA512_LBSPPB1024_LPB32_MIWT2_2_PLR1_SU0_SUM0_SUS256_VWA2_VWB2_WGM6_WGMXCC1_WGMXCCGn1
    SolutionIndex: 86
    SolutionNameMin: Cijk_Alik_Bjlk_BSS_BH_Bias_HAS_SAV_UserArgs_MT64x64x128_MI16x16x1_SN_LDSB1_CLR1_GRVWB8_GSU0_GSUC0_GSUWGMRR0_K1_LBSPPA512_LBSPPB512_LPB32_MIWT2_2_PLR1_SU0_SUM0_SUS256_VWA2_VWB2_WGM8_WGMXCC1_WGMXCCGn1
    SolutionIndex: 87
    SolutionNameMin: Cijk_Alik_Bjlk_BSS_BH_Bias_HAS_SAV_UserArgs_MT64x64x128_MI16x16x1_SN_LDSB1_CLR1_GRVWB8_GSU0_GSUC0_GSUWGMRR0_K1_LBSPPA512_LBSPPB1024_LPB32_MIWT2_2_PLR1_SU0_SUM0_SUS256_VWA2_VWB2_WGM8_WGMXCC1_WGMXCCGn1
    SolutionIndex: 88
    SolutionNameMin: Cijk_Alik_Bjlk_BSS_BH_Bias_HAS_SAV_UserArgs_MT64x64x128_MI16x16x1_SN_LDSB1_CLR1_GRVWB8_GSU0_GSUC0_GSUWGMRR0_K1_LBSPPA512_LBSPPB1024_LPB32_MIWT2_2_PLR1_SU0_SUM0_SUS256_VWA2_VWB2_WGM8_WGMXCC1_WGMXCCGn1
    SolutionIndex: 89
    SolutionNameMin: Cijk_Alik_Bjlk_BSS_BH_Bias_HAS_SAV_UserArgs_MT32x64x128_MI16x16x1_SN_LDSB1_CLR1_GRVWB8_GSU0_GSUC0_GSUWGMRR0_K1_LBSPPA256_LBSPPB512_LPB32_MIWT1_2_PLR1_SU0_SUM0_SUS256_VWA1_VWB2_WGM1_WGMXCC1_WGMXCCGn1
    SolutionIndex: 90
    SolutionNameMin: Cijk_Alik_Bjlk_BSS_BH_Bias_HAS_SAV_UserArgs_MT32x64x128_MI16x16x1_SN_LDSB1_CLR1_GRVWB8_GSU0_GSUC0_GSUWGMRR0_K1_LBSPPA256_LBSPPB512_LPB32_MIWT1_2_PLR1_SU0_SUM0_SUS256_VWA1_VWB2_WGM1_WGMXCC1_WGMXCCGn1
    SolutionIndex: 91
    SolutionNameMin: Cijk_Alik_Bjlk_BSS_BH_Bias_HAS_SAV_UserArgs_MT32x64x128_MI16x16x1_SN_LDSB1_CLR1_GRVWB8_GSU0_GSUC0_GSUWGMRR0_K1_LBSPPA256_LBSPPB512_LPB32_MIWT1_2_PLR1_SU0_SUM0_SUS256_VWA1_VWB2_WGM1_WGMXCC1_WGMXCCGn1
    SolutionIndex: 92
    SolutionNameMin: Cijk_Alik_Bjlk_BSS_BH_Bias_HAS_SAV_UserArgs_MT32x64x128_MI16x16x1_SN_LDSB1_CLR1_GRVWB4_GSU0_GSUC0_GSUWGMRR0_K1_LBSPPA256_LBSPPB1024_LPB32_MIWT1_2_PLR1_SU0_SUM0_SUS256_VWA1_VWB2_WGM1_WGMXCC1_WGMXCCGn1
    SolutionIndex: 93
    SolutionNameMin: Cijk_Alik_Bjlk_BSS_BH_Bias_HAS_SAV_UserArgs_MT32x64x128_MI16x16x1_SN_LDSB1_CLR1_GRVWB8_GSU0_GSUC0_GSUWGMRR0_K1_LBSPPA256_LBSPPB1024_LPB32_MIWT1_2_PLR1_SU0_SUM0_SUS256_VWA1_VWB2_WGM1_WGMXCC1_WGMXCCGn1
    SolutionIndex: 94
    SolutionNameMin: Cijk_Alik_Bjlk_BSS_BH_Bias_HAS_SAV_UserArgs_MT32x64x128_MI16x16x1_SN_LDSB1_CLR1_GRVWB8_GSU0_GSUC0_GSUWGMRR0_K1_LBSPPA256_LBSPPB1024_LPB32_MIWT1_2_PLR1_SU0_SUM0_SUS256_VWA1_VWB2_WGM1_WGMXCC1_WGMXCCGn1
    SolutionIndex: 95
    SolutionNameMin: Cijk_Alik_Bjlk_BSS_BH_Bias_HAS_SAV_UserArgs_MT32x64x128_MI16x16x1_SN_LDSB1_CLR1_GRVWB8_GSU0_GSUC0_GSUWGMRR0_K1_LBSPPA256_LBSPPB512_LPB32_MIWT1_2_PLR1_SU0_SUM0_SUS256_VWA1_VWB2_WGM4_WGMXCC1_WGMXCCGn1
    SolutionIndex: 96
    SolutionNameMin: Cijk_Alik_Bjlk_BSS_BH_Bias_HAS_SAV_UserArgs_MT32x64x128_MI16x16x1_SN_LDSB1_CLR1_GRVWB8_GSU0_GSUC0_GSUWGMRR0_K1_LBSPPA256_LBSPPB1024_LPB32_MIWT1_2_PLR1_SU0_SUM0_SUS256_VWA1_VWB2_WGM4_WGMXCC1_WGMXCCGn1
    SolutionIndex: 97
    SolutionNameMin: Cijk_Alik_Bjlk_BSS_BH_Bias_HAS_SAV_UserArgs_MT32x64x128_MI16x16x1_SN_LDSB1_CLR1_GRVWB4_GSU0_GSUC0_GSUWGMRR0_K1_LBSPPA256_LBSPPB1024_LPB32_MIWT1_2_PLR1_SU0_SUM0_SUS256_VWA1_VWB2_WGM6_WGMXCC1_WGMXCCGn1
    SolutionIndex: 98
    SolutionNameMin: Cijk_Alik_Bjlk_BSS_BH_Bias_HAS_SAV_UserArgs_MT32x64x128_MI16x16x1_SN_LDSB1_CLR1_GRVWB8_GSU0_GSUC0_GSUWGMRR0_K1_LBSPPA256_LBSPPB1024_LPB32_MIWT1_2_PLR1_SU0_SUM0_SUS256_VWA1_VWB2_WGM6_WGMXCC1_WGMXCCGn1
    SolutionIndex: 99
    SolutionNameMin: Cijk_Alik_Bjlk_BSS_BH_Bias_HAS_SAV_UserArgs_MT32x64x128_MI16x16x1_SN_LDSB1_CLR1_GRVWB8_GSU0_GSUC0_GSUWGMRR0_K1_LBSPPA256_LBSPPB1024_LPB32_MIWT1_2_PLR1_SU0_SUM0_SUS256_VWA1_VWB2_WGM6_WGMXCC1_WGMXCCGn1
    SolutionIndex: 100
    SolutionNameMin: Cijk_Alik_Bjlk_BSS_BH_Bias_HAS_SAV_UserArgs_MT32x64x128_MI16x16x1_SN_LDSB1_CLR1_GRVWB8_GSU0_GSUC0_GSUWGMRR0_K1_LBSPPA256_LBSPPB512_LPB32_MIWT1_2_PLR1_SU0_SUM0_SUS256_VWA1_VWB2_WGM8_WGMXCC1_WGMXCCGn1
    SolutionIndex: 101
    SolutionNameMin: Cijk_Alik_Bjlk_BSS_BH_Bias_HAS_SAV_UserArgs_MT32x64x128_MI16x16x1_SN_LDSB1_CLR1_GRVWB8_GSU0_GSUC0_GSUWGMRR0_K1_LBSPPA256_LBSPPB1024_LPB32_MIWT1_2_PLR1_SU0_SUM0_SUS256_VWA1_VWB2_WGM8_WGMXCC1_WGMXCCGn1
    SolutionIndex: 102
    SolutionNameMin: Cijk_Alik_Bjlk_BSS_BH_Bias_HAS_SAV_UserArgs_MT32x64x128_MI16x16x1_SN_LDSB1_CLR1_GRVWB8_GSU0_GSUC0_GSUWGMRR0_K1_LBSPPA256_LBSPPB1024_LPB32_MIWT1_2_PLR1_SU0_SUM0_SUS256_VWA1_VWB2_WGM8_WGMXCC1_WGMXCCGn1
    SolutionIndex: 103
    SolutionNameMin: Cijk_Alik_Bjlk_BSS_BH_Bias_HAS_SAV_UserArgs_MT64x32x128_MI16x16x1_SN_LDSB1_CLR1_GRVWB2_GSU0_GSUC0_GSUWGMRR0_K1_LBSPPA512_LBSPPB512_LPB16_MIWT2_1_PLR1_SU0_SUM0_SUS256_VWA2_VWB1_WGM4_WGMXCC1_WGMXCCGn1
    SolutionIndex: 104
    SolutionNameMin: Cijk_Alik_Bjlk_BSS_BH_Bias_HAS_SAV_UserArgs_MT32x32x128_MI16x16x1_SN_LDSB1_CLR1_GRVWB2_GSU0_GSUC0_GSUWGMRR0_K1_LBSPPA256_LBSPPB256_LPB16_MIWT1_1_PLR1_SU0_SUM0_SUS256_VWA1_VWB1_WGM1_WGMXCC1_WGMXCCGn1
    SolutionIndex: 105
    SolutionNameMin: Cijk_Alik_Bjlk_BSS_BH_Bias_HAS_SAV_UserArgs_MT32x32x128_MI16x16x1_SN_LDSB1_CLR1_GRVWB4_GSU0_GSUC0_GSUWGMRR0_K1_LBSPPA256_LBSPPB256_LPB16_MIWT1_1_PLR1_SU0_SUM0_SUS256_VWA1_VWB1_WGM1_WGMXCC1_WGMXCCGn1
    SolutionIndex: 106
    SolutionNameMin: Cijk_Alik_Bjlk_BSS_BH_Bias_HAS_SAV_UserArgs_MT32x32x128_MI16x16x1_SN_LDSB1_CLR1_GRVWB2_GSU0_GSUC0_GSUWGMRR0_K1_LBSPPA256_LBSPPB512_LPB16_MIWT1_1_PLR1_SU0_SUM0_SUS256_VWA1_VWB1_WGM1_WGMXCC1_WGMXCCGn1
    SolutionIndex: 107
    SolutionNameMin: Cijk_Alik_Bjlk_BSS_BH_Bias_HAS_SAV_UserArgs_MT32x32x128_MI16x16x1_SN_LDSB1_CLR1_GRVWB2_GSU0_GSUC0_GSUWGMRR0_K1_LBSPPA256_LBSPPB512_LPB16_MIWT1_1_PLR1_SU0_SUM0_SUS256_VWA1_VWB1_WGM1_WGMXCC1_WGMXCCGn1
    SolutionIndex: 108
    SolutionNameMin: Cijk_Alik_Bjlk_BSS_BH_Bias_HAS_SAV_UserArgs_MT32x32x128_MI16x16x1_SN_LDSB1_CLR1_GRVWB4_GSU0_GSUC0_GSUWGMRR0_K1_LBSPPA256_LBSPPB512_LPB16_MIWT1_1_PLR1_SU0_SUM0_SUS256_VWA1_VWB1_WGM1_WGMXCC1_WGMXCCGn1
    SolutionIndex: 109
    SolutionNameMin: Cijk_Alik_Bjlk_BSS_BH_Bias_HAS_SAV_UserArgs_MT32x32x128_MI16x16x1_SN_LDSB1_CLR1_GRVWB4_GSU0_GSUC0_GSUWGMRR0_K1_LBSPPA256_LBSPPB512_LPB16_MIWT1_1_PLR1_SU0_SUM0_SUS256_VWA1_VWB1_WGM1_WGMXCC1_WGMXCCGn1
    SolutionIndex: 110
    SolutionNameMin: Cijk_Alik_Bjlk_BSS_BH_Bias_HAS_SAV_UserArgs_MT32x32x128_MI16x16x1_SN_LDSB1_CLR1_GRVWB4_GSU0_GSUC0_GSUWGMRR0_K1_LBSPPA256_LBSPPB512_LPB16_MIWT1_1_PLR1_SU0_SUM0_SUS256_VWA1_VWB1_WGM1_WGMXCC1_WGMXCCGn1
    SolutionIndex: 111
    SolutionNameMin: Cijk_Alik_Bjlk_BSS_BH_Bias_HAS_SAV_UserArgs_MT32x32x128_MI16x16x1_SN_LDSB1_CLR1_GRVWB8_GSU0_GSUC0_GSUWGMRR0_K1_LBSPPA256_LBSPPB512_LPB16_MIWT1_1_PLR1_SU0_SUM0_SUS256_VWA1_VWB1_WGM1_WGMXCC1_WGMXCCGn1
    SolutionIndex: 112
    SolutionNameMin: Cijk_Alik_Bjlk_BSS_BH_Bias_HAS_SAV_UserArgs_MT32x32x128_MI16x16x1_SN_LDSB1_CLR1_GRVWB8_GSU0_GSUC0_GSUWGMRR0_K1_LBSPPA256_LBSPPB512_LPB16_MIWT1_1_PLR1_SU0_SUM0_SUS256_VWA1_VWB1_WGM1_WGMXCC1_WGMXCCGn1
    SolutionIndex: 113
    SolutionNameMin: Cijk_Alik_Bjlk_BSS_BH_Bias_HAS_SAV_UserArgs_MT32x32x128_MI16x16x1_SN_LDSB1_CLR1_GRVWB8_GSU0_GSUC0_GSUWGMRR0_K1_LBSPPA256_LBSPPB512_LPB16_MIWT1_1_PLR1_SU0_SUM0_SUS256_VWA1_VWB1_WGM4_WGMXCC1_WGMXCCGn1
    SolutionIndex: 114
    SolutionNameMin: Cijk_Alik_Bjlk_BSS_BH_Bias_HAS_SAV_UserArgs_MT32x32x128_MI16x16x1_SN_LDSB1_CLR1_GRVWB8_GSU0_GSUC0_GSUWGMRR0_K1_LBSPPA256_LBSPPB512_LPB16_MIWT1_1_PLR1_SU0_SUM0_SUS256_VWA1_VWB1_WGM4_WGMXCC1_WGMXCCGn1
    SolutionIndex: 115
    SolutionNameMin: Cijk_Alik_Bjlk_BSS_BH_Bias_HAS_SAV_UserArgs_MT32x32x128_MI16x16x1_SN_LDSB1_CLR1_GRVWB8_GSU0_GSUC0_GSUWGMRR0_K1_LBSPPA256_LBSPPB512_LPB16_MIWT1_1_PLR1_SU0_SUM0_SUS256_VWA1_VWB1_WGM6_WGMXCC1_WGMXCCGn1
    SolutionIndex: 116
    SolutionNameMin: Cijk_Alik_Bjlk_BSS_BH_Bias_HAS_SAV_UserArgs_MT32x32x128_MI16x16x1_SN_LDSB1_CLR1_GRVWB8_GSU0_GSUC0_GSUWGMRR0_K1_LBSPPA256_LBSPPB512_LPB16_MIWT1_1_PLR1_SU0_SUM0_SUS256_VWA1_VWB1_WGM6_WGMXCC1_WGMXCCGn1
    SolutionIndex: 117
    SolutionNameMin: Cijk_Alik_Bjlk_BSS_BH_Bias_HAS_SAV_UserArgs_MT32x32x128_MI16x16x1_SN_LDSB1_CLR1_GRVWB8_GSU0_GSUC0_GSUWGMRR0_K1_LBSPPA256_LBSPPB512_LPB16_MIWT1_1_PLR1_SU0_SUM0_SUS256_VWA1_VWB1_WGM6_WGMXCC1_WGMXCCGn1
    SolutionIndex: 118
    SolutionNameMin: Cijk_Alik_Bjlk_BSS_BH_Bias_HAS_SAV_UserArgs_MT32x32x128_MI16x16x1_SN_LDSB1_CLR1_GRVWB8_GSU0_GSUC0_GSUWGMRR0_K1_LBSPPA256_LBSPPB512_LPB16_MIWT1_1_PLR1_SU0_SUM0_SUS256_VWA1_VWB1_WGM8_WGMXCC1_WGMXCCGn1
- - - [128, 128, 1, 128, 128, 128, 128, 128]
    - [66, 0.46]
  - - [128, 128, 1, 256, 128, 128, 256, 128]
    - [112, 0.76]
  - - [128, 128, 1, 512, 128, 128, 512, 128]
    - [112, 1.32]
  - - [128, 128, 1, 1024, 128, 128, 1024, 128]
    - [112, 1.94]
  - - [128, 128, 1, 2048, 128, 128, 2048, 128]
    - [112, 2.56]
  - - [128, 128, 1, 4096, 128, 128, 4096, 128]
    - [112, 3.12]
  - - [128, 128, 1, 8192, 128, 128, 8192, 128]
    - [112, 3.5]
  - - [128, 256, 1, 128, 128, 128, 128, 256]
    - [66, 0.89]
  - - [128, 256, 1, 256, 128, 128, 256, 256]
    - [67, 1.49]
  - - [128, 256, 1, 512, 128, 128, 512, 256]
    - [112, 2.41]
  - - [128, 256, 1, 1024, 128, 128, 1024, 256]
    - [112, 3.47]
  - - [128, 256, 1, 2048, 128, 128, 2048, 256]
    - [112, 4.48]
  - - [128, 256, 1, 4096, 128, 128, 4096, 256]
    - [112, 5.35]
  - - [128, 256, 1, 8192, 128, 128, 8192, 256]
    - [112, 5.88]
  - - [128, 512, 1, 128, 128, 128, 128, 512]
    - [106, 1.74]
  - - [128, 512, 1, 256, 128, 128, 256, 512]
    - [66, 2.91]
  - - [128, 512, 1, 512, 128, 128, 512, 512]
    - [105, 4.64]
  - - [128, 512, 1, 1024, 128, 128, 1024, 512]
    - [110, 6.77]
  - - [128, 512, 1, 2048, 128, 128, 2048, 512]
    - [112, 8.88]
  - - [128, 512, 1, 4096, 128, 128, 4096, 512]
    - [117, 10.35]
  - - [128, 512, 1, 8192, 128, 128, 8192, 512]
    - [117, 11.25]
  - - [128, 1024, 1, 128, 128, 128, 128, 1024]
    - [107, 3.33]
  - - [128, 1024, 1, 256, 128, 128, 256, 1024]
    - [104, 5.6]
  - - [128, 1024, 1, 512, 128, 128, 512, 1024]
    - [107, 9.26]
  - - [128, 1024, 1, 1024, 128, 128, 1024, 1024]
    - [107, 13.59]
  - - [128, 1024, 1, 2048, 128, 128, 2048, 1024]
    - [112, 17.25]
  - - [128, 1024, 1, 4096, 128, 128, 4096, 1024]
    - [112, 20.47]
  - - [128, 1024, 1, 8192, 128, 128, 8192, 1024]
    - [112, 22.47]
  - - [128, 2048, 1, 128, 128, 128, 128, 2048]
    - [92, 5.96]
  - - [128, 2048, 1, 256, 128, 128, 256, 2048]
    - [64, 10.25]
  - - [128, 2048, 1, 512, 128, 128, 512, 2048]
    - [93, 16.27]
  - - [128, 2048, 1, 1024, 128, 128, 1024, 2048]
    - [93, 23.54]
  - - [128, 2048, 1, 2048, 128, 128, 2048, 2048]
    - [93, 30.42]
  - - [128, 2048, 1, 4096, 128, 128, 4096, 2048]
    - [93, 35.69]
  - - [128, 2048, 1, 8192, 128, 128, 8192, 2048]
    - [91, 35.68]
  - - [128, 4096, 1, 128, 128, 128, 128, 4096]
    - [57, 10.05]
  - - [128, 4096, 1, 256, 128, 128, 256, 4096]
    - [60, 17.3]
  - - [128, 4096, 1, 512, 128, 128, 512, 4096]
    - [82, 27.36]
  - - [128, 4096, 1, 1024, 128, 128, 1024, 4096]
    - [82, 39.46]
  - - [128, 4096, 1, 2048, 128, 128, 2048, 4096]
    - [82, 50.93]
  - - [128, 4096, 1, 4096, 128, 128, 4096, 4096]
    - [80, 55.02]
  - - [128, 4096, 1, 8192, 128, 128, 8192, 4096]
    - [85, 62.84]
  - - [128, 8192, 1, 128, 128, 128, 128, 8192]
    - [51, 15.87]
  - - [128, 8192, 1, 256, 128, 128, 256, 8192]
    - [46, 26.55]
  - - [128, 8192, 1, 512, 128, 128, 512, 8192]
    - [71, 43.49]
  - - [128, 8192, 1, 1024, 128, 128, 1024, 8192]
    - [71, 61.84]
  - - [128, 8192, 1, 2048, 128, 128, 2048, 8192]
    - [71, 74.72]
  - - [128, 8192, 1, 4096, 128, 128, 4096, 8192]
    - [70, 86.56]
  - - [128, 8192, 1, 8192, 128, 128, 8192, 8192]
    - [69, 86.29]
  - - [256, 128, 1, 128, 256, 256, 128, 128]
    - [112, 0.88]
  - - [256, 128, 1, 256, 256, 256, 256, 128]
    - [68, 1.51]
  - - [256, 128, 1, 512, 256, 256, 512, 128]
    - [112, 2.55]
  - - [256, 128, 1, 1024, 256, 256, 1024, 128]
    - [112, 3.8]
  - - [256, 128, 1, 2048, 256, 256, 2048, 128]
    - [112, 5.15]
  - - [256, 128, 1, 4096, 256, 256, 4096, 128]
    - [112, 6.23]
  - - [256, 128, 1, 8192, 256, 256, 8192, 128]
    - [112, 6.96]
  - - [256, 256, 1, 128, 256, 256, 128, 256]
    - [109, 1.75]
  - - [256, 256, 1, 256, 256, 256, 256, 256]
    - [108, 2.95]
  - - [256, 256, 1, 512, 256, 256, 512, 256]
    - [110, 4.85]
  - - [256, 256, 1, 1024, 256, 256, 1024, 256]
    - [112, 7.08]
  - - [256, 256, 1, 2048, 256, 256, 2048, 256]
    - [112, 9.18]
  - - [256, 256, 1, 4096, 256, 256, 4096, 256]
    - [112, 10.89]
  - - [256, 256, 1, 8192, 256, 256, 8192, 256]
    - [111, 11.87]
  - - [256, 512, 1, 128, 256, 256, 128, 512]
    - [104, 3.46]
  - - [256, 512, 1, 256, 256, 256, 256, 512]
    - [106, 5.73]
  - - [256, 512, 1, 512, 256, 256, 512, 512]
    - [110, 9.4]
  - - [256, 512, 1, 1024, 256, 256, 1024, 512]
    - [110, 13.74]
  - - [256, 512, 1, 2048, 256, 256, 2048, 512]
    - [112, 18.02]
  - - [256, 512, 1, 4096, 256, 256, 4096, 512]
    - [117, 21.04]
  - - [256, 512, 1, 8192, 256, 256, 8192, 512]
    - [117, 23.23]
  - - [256, 1024, 1, 128, 256, 256, 128, 1024]
    - [93, 6.0]
  - - [256, 1024, 1, 256, 256, 256, 256, 1024]
    - [65, 10.33]
  - - [256, 1024, 1, 512, 256, 256, 512, 1024]
    - [89, 16.79]
  - - [256, 1024, 1, 1024, 256, 256, 1024, 1024]
    - [93, 24.44]
  - - [256, 1024, 1, 2048, 256, 256, 2048, 1024]
    - [93, 31.48]
  - - [256, 1024, 1, 4096, 256, 256, 4096, 1024]
    - [99, 36.68]
  - - [256, 1024, 1, 8192, 256, 256, 8192, 1024]
    - [99, 40.33]
  - - [256, 2048, 1, 128, 256, 256, 128, 2048]
    - [61, 10.15]
  - - [256, 2048, 1, 256, 256, 256, 256, 2048]
    - [58, 17.48]
  - - [256, 2048, 1, 512, 256, 256, 512, 2048]
    - [82, 28.07]
  - - [256, 2048, 1, 1024, 256, 256, 1024, 2048]
    - [82, 40.41]
  - - [256, 2048, 1, 2048, 256, 256, 2048, 2048]
    - [82, 51.5]
  - - [256, 2048, 1, 4096, 256, 256, 4096, 2048]
    - [82, 60.37]
  - - [256, 2048, 1, 8192, 256, 256, 8192, 2048]
    - [23, 60.5]
  - - [256, 4096, 1, 128, 256, 256, 128, 4096]
    - [53, 16.06]
  - - [256, 4096, 1, 256, 256, 256, 256, 4096]
    - [48, 26.96]
  - - [256, 4096, 1, 512, 256, 256, 512, 4096]
    - [71, 43.79]
  - - [256, 4096, 1, 1024, 256, 256, 1024, 4096]
    - [71, 63.73]
  - - [256, 4096, 1, 2048, 256, 256, 2048, 4096]
    - [71, 81.06]
  - - [256, 4096, 1, 4096, 256, 256, 4096, 4096]
    - [71, 91.15]
  - - [256, 4096, 1, 8192, 256, 256, 8192, 4096]
    - [69, 93.11]
  - - [256, 8192, 1, 128, 256, 256, 128, 8192]
    - [15, 22.93]
  - - [256, 8192, 1, 256, 256, 256, 256, 8192]
    - [37, 37.95]
  - - [256, 8192, 1, 512, 256, 256, 512, 8192]
    - [37, 59.54]
  - - [256, 8192, 1, 1024, 256, 256, 1024, 8192]
    - [36, 81.69]
  - - [256, 8192, 1, 2048, 256, 256, 2048, 8192]
    - [36, 97.74]
  - - [256, 8192, 1, 4096, 256, 256, 4096, 8192]
    - [79, 110.01]
  - - [256, 8192, 1, 8192, 256, 256, 8192, 8192]
    - [37, 110.46]
  - - [512, 128, 1, 128, 512, 512, 128, 128]
    - [110, 1.77]
  - - [512, 128, 1, 256, 512, 512, 256, 128]
    - [112, 3.02]
  - - [512, 128, 1, 512, 512, 512, 512, 128]
    - [117, 5.04]
  - - [512, 128, 1, 1024, 512, 512, 1024, 128]
    - [110, 7.63]
  - - [512, 128, 1, 2048, 512, 512, 2048, 128]
    - [113, 10.23]
  - - [512, 128, 1, 4096, 512, 512, 4096, 128]
    - [118, 12.39]
  - - [512, 128, 1, 8192, 512, 512, 8192, 128]
    - [118, 13.84]
  - - [512, 256, 1, 128, 512, 512, 128, 256]
    - [106, 3.4]
  - - [512, 256, 1, 256, 512, 512, 256, 256]
    - [104, 5.64]
  - - [512, 256, 1, 512, 512, 512, 512, 256]
    - [118, 9.33]
  - - [512, 256, 1, 1024, 512, 512, 1024, 256]
    - [117, 14.03]
  - - [512, 256, 1, 2048, 512, 512, 2048, 256]
    - [117, 18.41]
  - - [512, 256, 1, 4096, 512, 512, 4096, 256]
    - [117, 21.79]
  - - [512, 256, 1, 8192, 512, 512, 8192, 256]
    - [116, 24.11]
  - - [512, 512, 1, 128, 512, 512, 128, 512]
    - [97, 5.91]
  - - [512, 512, 1, 256, 512, 512, 256, 512]
    - [95, 10.4]
  - - [512, 512, 1, 512, 512, 512, 512, 512]
    - [96, 17.0]
  - - [512, 512, 1, 1024, 512, 512, 1024, 512]
    - [99, 24.81]
  - - [512, 512, 1, 2048, 512, 512, 2048, 512]
    - [94, 32.05]
  - - [512, 512, 1, 4096, 512, 512, 4096, 512]
    - [99, 37.73]
  - - [512, 512, 1, 8192, 512, 512, 8192, 512]
    - [98, 41.57]
  - - [512, 1024, 1, 128, 512, 512, 128, 1024]
    - [84, 9.89]
  - - [512, 1024, 1, 256, 512, 512, 256, 1024]
    - [81, 17.17]
  - - [512, 1024, 1, 512, 512, 512, 512, 1024]
    - [85, 27.98]
  - - [512, 1024, 1, 1024, 512, 512, 1024, 1024]
    - [82, 40.71]
  - - [512, 1024, 1, 2048, 512, 512, 2048, 1024]
    - [82, 51.72]
  - - [512, 1024, 1, 4096, 512, 512, 4096, 1024]
    - [85, 60.8]
  - - [512, 1024, 1, 8192, 512, 512, 8192, 1024]
    - [25, 63.02]
  - - [512, 2048, 1, 128, 512, 512, 128, 2048]
    - [52, 15.73]
  - - [512, 2048, 1, 256, 512, 512, 256, 2048]
    - [49, 27.43]
  - - [512, 2048, 1, 512, 512, 512, 512, 2048]
    - [71, 44.16]
  - - [512, 2048, 1, 1024, 512, 512, 1024, 2048]
    - [71, 63.75]
  - - [512, 2048, 1, 2048, 512, 512, 2048, 2048]
    - [71, 82.6]
  - - [512, 2048, 1, 4096, 512, 512, 4096, 2048]
    - [71, 94.04]
  - - [512, 2048, 1, 8192, 512, 512, 8192, 2048]
    - [73, 93.45]
  - - [512, 4096, 1, 128, 512, 512, 128, 4096]
    - [21, 23.33]
  - - [512, 4096, 1, 256, 512, 512, 256, 4096]
    - [37, 38.81]
  - - [512, 4096, 1, 512, 512, 512, 512, 4096]
    - [37, 61.25]
  - - [512, 4096, 1, 1024, 512, 512, 1024, 4096]
    - [39, 84.26]
  - - [512, 4096, 1, 2048, 512, 512, 2048, 4096]
    - [36, 101.44]
  - - [512, 4096, 1, 4096, 512, 512, 4096, 4096]
    - [44, 110.16]
  - - [512, 4096, 1, 8192, 512, 512, 8192, 4096]
    - [37, 113.45]
  - - [512, 8192, 1, 128, 512, 512, 128, 8192]
    - [7, 29.78]
  - - [512, 8192, 1, 256, 512, 512, 256, 8192]
    - [7, 49.16]
  - - [512, 8192, 1, 512, 512, 512, 512, 8192]
    - [5, 74.69]
  - - [512, 8192, 1, 1024, 512, 512, 1024, 8192]
    - [28, 100.51]
  - - [512, 8192, 1, 2048, 512, 512, 2048, 8192]
    - [37, 125.25]
  - - [512, 8192, 1, 4096, 512, 512, 4096, 8192]
    - [27, 122.71]
  - - [512, 8192, 1, 8192, 512, 512, 8192, 8192]
    - [12, 134.84]
  - - [1024, 128, 1, 128, 1024, 1024, 128, 128]
    - [114, 3.43]
  - - [1024, 128, 1, 256, 1024, 1024, 256, 128]
    - [118, 5.9]
  - - [1024, 128, 1, 512, 1024, 1024, 512, 128]
    - [118, 9.94]
  - - [1024, 128, 1, 1024, 1024, 1024, 1024, 128]
    - [117, 14.99]
  - - [1024, 128, 1, 2048, 1024, 1024, 2048, 128]
    - [115, 20.24]
  - - [1024, 128, 1, 4096, 1024, 1024, 4096, 128]
    - [118, 25.14]
  - - [1024, 128, 1, 8192, 1024, 1024, 8192, 128]
    - [117, 27.65]
  - - [1024, 256, 1, 128, 1024, 1024, 128, 256]
    - [103, 5.84]
  - - [1024, 256, 1, 256, 1024, 1024, 256, 256]
    - [100, 10.18]
  - - [1024, 256, 1, 512, 1024, 1024, 512, 256]
    - [100, 16.86]
  - - [1024, 256, 1, 1024, 1024, 1024, 1024, 256]
    - [96, 25.2]
  - - [1024, 256, 1, 2048, 1024, 1024, 2048, 256]
    - [101, 32.18]
  - - [1024, 256, 1, 4096, 1024, 1024, 4096, 256]
    - [96, 37.98]
  - - [1024, 256, 1, 8192, 1024, 1024, 8192, 256]
    - [99, 42.56]
  - - [1024, 512, 1, 128, 1024, 1024, 128, 512]
    - [62, 10.08]
  - - [1024, 512, 1, 256, 1024, 1024, 256, 512]
    - [83, 17.4]
  - - [1024, 512, 1, 512, 1024, 1024, 512, 512]
    - [85, 28.84]
  - - [1024, 512, 1, 1024, 1024, 1024, 1024, 512]
    - [85, 41.44]
  - - [1024, 512, 1, 2048, 1024, 1024, 2048, 512]
    - [83, 52.3]
  - - [1024, 512, 1, 4096, 1024, 1024, 4096, 512]
    - [85, 61.44]
  - - [1024, 512, 1, 8192, 1024, 1024, 8192, 512]
    - [87, 64.99]
  - - [1024, 1024, 1, 128, 1024, 1024, 128, 1024]
    - [54, 15.9]
  - - [1024, 1024, 1, 256, 1024, 1024, 256, 1024]
    - [49, 27.71]
  - - [1024, 1024, 1, 512, 1024, 1024, 512, 1024]
    - [73, 44.16]
  - - [1024, 1024, 1, 1024, 1024, 1024, 1024, 1024]
    - [76, 64.08]
  - - [1024, 1024, 1, 2048, 1024, 1024, 2048, 1024]
    - [73, 83.12]
  - - [1024, 1024, 1, 4096, 1024, 1024, 4096, 1024]
    - [73, 96.96]
  - - [1024, 1024, 1, 8192, 1024, 1024, 8192, 1024]
    - [73, 98.46]
  - - [1024, 2048, 1, 128, 1024, 1024, 128, 2048]
    - [21, 23.22]
  - - [1024, 2048, 1, 256, 1024, 1024, 256, 2048]
    - [37, 38.72]
  - - [1024, 2048, 1, 512, 1024, 1024, 512, 2048]
    - [37, 60.76]
  - - [1024, 2048, 1, 1024, 1024, 1024, 1024, 2048]
    - [44, 84.55]
  - - [1024, 2048, 1, 2048, 1024, 1024, 2048, 2048]
    - [41, 105.96]
  - - [1024, 2048, 1, 4096, 1024, 1024, 4096, 2048]
    - [41, 112.35]
  - - [1024, 2048, 1, 8192, 1024, 1024, 8192, 2048]
    - [41, 114.92]
  - - [1024, 4096, 1, 128, 1024, 1024, 128, 4096]
    - [7, 29.42]
  - - [1024, 4096, 1, 256, 1024, 1024, 256, 4096]
    - [7, 49.17]
  - - [1024, 4096, 1, 512, 1024, 1024, 512, 4096]
    - [7, 74.47]
  - - [1024, 4096, 1, 1024, 1024, 1024, 1024, 4096]
    - [29, 99.68]
  - - [1024, 4096, 1, 2048, 1024, 1024, 2048, 4096]
    - [44, 120.43]
  - - [1024, 4096, 1, 4096, 1024, 1024, 4096, 4096]
    - [7, 123.82]
  - - [1024, 4096, 1, 8192, 1024, 1024, 8192, 4096]
    - [9, 138.61]
  - - [1024, 8192, 1, 128, 1024, 1024, 128, 8192]
    - [5, 33.78]
  - - [1024, 8192, 1, 256, 1024, 1024, 256, 8192]
    - [5, 54.66]
  - - [1024, 8192, 1, 512, 1024, 1024, 512, 8192]
    - [8, 81.17]
  - - [1024, 8192, 1, 1024, 1024, 1024, 1024, 8192]
    - [2, 108.19]
  - - [1024, 8192, 1, 2048, 1024, 1024, 2048, 8192]
    - [11, 124.81]
  - - [1024, 8192, 1, 4096, 1024, 1024, 4096, 8192]
    - [33, 139.95]
  - - [1024, 8192, 1, 8192, 1024, 1024, 8192, 8192]
    - [1, 164.49]
  - - [2048, 128, 1, 128, 2048, 2048, 128, 128]
    - [91, 6.19]
  - - [2048, 128, 1, 256, 2048, 2048, 256, 128]
    - [90, 10.55]
  - - [2048, 128, 1, 512, 2048, 2048, 512, 128]
    - [93, 17.94]
  - - [2048, 128, 1, 1024, 2048, 2048, 1024, 128]
    - [93, 26.5]
  - - [2048, 128, 1, 2048, 2048, 2048, 2048, 128]
    - [93, 35.62]
  - - [2048, 128, 1, 4096, 2048, 2048, 4096, 128]
    - [102, 42.5]
  - - [2048, 128, 1, 8192, 2048, 2048, 8192, 128]
    - [100, 46.65]
  - - [2048, 256, 1, 128, 2048, 2048, 128, 256]
    - [63, 10.1]
  - - [2048, 256, 1, 256, 2048, 2048, 256, 256]
    - [61, 17.64]
  - - [2048, 256, 1, 512, 2048, 2048, 512, 256]
    - [85, 28.65]
  - - [2048, 256, 1, 1024, 2048, 2048, 1024, 256]
    - [83, 41.54]
  - - [2048, 256, 1, 2048, 2048, 2048, 2048, 256]
    - [88, 52.3]
  - - [2048, 256, 1, 4096, 2048, 2048, 4096, 256]
    - [85, 61.94]
  - - [2048, 256, 1, 8192, 2048, 2048, 8192, 256]
    - [24, 63.27]
  - - [2048, 512, 1, 128, 2048, 2048, 128, 512]
    - [54, 15.88]
  - - [2048, 512, 1, 256, 2048, 2048, 256, 512]
    - [53, 26.99]
  - - [2048, 512, 1, 512, 2048, 2048, 512, 512]
    - [73, 43.79]
  - - [2048, 512, 1, 1024, 2048, 2048, 1024, 512]
    - [76, 64.33]
  - - [2048, 512, 1, 2048, 2048, 2048, 2048, 512]
    - [78, 83.32]
  - - [2048, 512, 1, 4096, 2048, 2048, 4096, 512]
    - [75, 95.29]
  - - [2048, 512, 1, 8192, 2048, 2048, 8192, 512]
    - [74, 93.75]
  - - [2048, 1024, 1, 128, 2048, 2048, 128, 1024]
    - [22, 22.96]
  - - [2048, 1024, 1, 256, 2048, 2048, 256, 1024]
    - [40, 38.43]
  - - [2048, 1024, 1, 512, 2048, 2048, 512, 1024]
    - [45, 60.8]
  - - [2048, 1024, 1, 1024, 2048, 2048, 1024, 1024]
    - [39, 85.48]
  - - [2048, 1024, 1, 2048, 2048, 2048, 2048, 1024]
    - [39, 105.76]
  - - [2048, 1024, 1, 4096, 2048, 2048, 4096, 1024]
    - [41, 113.67]
  - - [2048, 1024, 1, 8192, 2048, 2048, 8192, 1024]
    - [41, 114.86]
  - - [2048, 2048, 1, 128, 2048, 2048, 128, 2048]
    - [5, 28.05]
  - - [2048, 2048, 1, 256, 2048, 2048, 256, 2048]
    - [7, 47.11]
  - - [2048, 2048, 1, 512, 2048, 2048, 512, 2048]
    - [8, 70.39]
  - - [2048, 2048, 1, 1024, 2048, 2048, 1024, 2048]
    - [31, 98.02]
  - - [2048, 2048, 1, 2048, 2048, 2048, 2048, 2048]
    - [42, 118.79]
  - - [2048, 2048, 1, 4096, 2048, 2048, 4096, 2048]
    - [37, 124.5]
  - - [2048, 2048, 1, 8192, 2048, 2048, 8192, 2048]
    - [13, 136.37]
  - - [2048, 4096, 1, 128, 2048, 2048, 128, 4096]
    - [7, 32.19]
  - - [2048, 4096, 1, 256, 2048, 2048, 256, 4096]
    - [10, 53.1]
  - - [2048, 4096, 1, 512, 2048, 2048, 512, 4096]
    - [0, 80.21]
  - - [2048, 4096, 1, 1024, 2048, 2048, 1024, 4096]
    - [0, 109.88]
  - - [2048, 4096, 1, 2048, 2048, 2048, 2048, 4096]
    - [10, 128.25]
  - - [2048, 4096, 1, 4096, 2048, 2048, 4096, 4096]
    - [29, 144.23]
  - - [2048, 4096, 1, 8192, 2048, 2048, 8192, 4096]
    - [3, 156.87]
  - - [2048, 8192, 1, 128, 2048, 2048, 128, 8192]
    - [5, 34.93]
  - - [2048, 8192, 1, 256, 2048, 2048, 256, 8192]
    - [20, 57.18]
  - - [2048, 8192, 1, 512, 2048, 2048, 512, 8192]
    - [34, 87.86]
  - - [2048, 8192, 1, 1024, 2048, 2048, 1024, 8192]
    - [5, 110.76]
  - - [2048, 8192, 1, 2048, 2048, 2048, 2048, 8192]
    - [27, 144.0]
  - - [2048, 8192, 1, 4096, 2048, 2048, 4096, 8192]
    - [5, 165.8]
  - - [2048, 8192, 1, 8192, 2048, 2048, 8192, 8192]
    - [5, 178.06]
  - - [4096, 128, 1, 128, 4096, 4096, 128, 128]
    - [58, 10.0]
  - - [4096, 128, 1, 256, 4096, 4096, 256, 128]
    - [59, 17.33]
  - - [4096, 128, 1, 512, 4096, 4096, 512, 128]
    - [85, 28.44]
  - - [4096, 128, 1, 1024, 4096, 4096, 1024, 128]
    - [85, 41.54]
  - - [4096, 128, 1, 2048, 4096, 4096, 2048, 128]
    - [85, 55.68]
  - - [4096, 128, 1, 4096, 4096, 4096, 4096, 128]
    - [86, 65.28]
  - - [4096, 128, 1, 8192, 4096, 4096, 8192, 128]
    - [83, 72.37]
  - - [4096, 256, 1, 128, 4096, 4096, 128, 256]
    - [55, 15.89]
  - - [4096, 256, 1, 256, 4096, 4096, 256, 256]
    - [56, 26.63]
  - - [4096, 256, 1, 512, 4096, 4096, 512, 256]
    - [76, 42.64]
  - - [4096, 256, 1, 1024, 4096, 4096, 1024, 256]
    - [78, 62.51]
  - - [4096, 256, 1, 2048, 4096, 4096, 2048, 256]
    - [77, 79.79]
  - - [4096, 256, 1, 4096, 4096, 4096, 4096, 256]
    - [77, 92.71]
  - - [4096, 256, 1, 8192, 4096, 4096, 8192, 256]
    - [78, 91.57]
  - - [4096, 512, 1, 128, 4096, 4096, 128, 512]
    - [22, 22.2]
  - - [4096, 512, 1, 256, 4096, 4096, 256, 512]
    - [40, 37.17]
  - - [4096, 512, 1, 512, 4096, 4096, 512, 512]
    - [45, 59.62]
  - - [4096, 512, 1, 1024, 4096, 4096, 1024, 512]
    - [44, 81.09]
  - - [4096, 512, 1, 2048, 4096, 4096, 2048, 512]
    - [50, 100.2]
  - - [4096, 512, 1, 4096, 4096, 4096, 4096, 512]
    - [43, 111.48]
  - - [4096, 512, 1, 8192, 4096, 4096, 8192, 512]
    - [40, 113.19]
  - - [4096, 1024, 1, 128, 4096, 4096, 128, 1024]
    - [7, 27.23]
  - - [4096, 1024, 1, 256, 4096, 4096, 256, 1024]
    - [7, 46.27]
  - - [4096, 1024, 1, 512, 4096, 4096, 512, 1024]
    - [13, 70.77]
  - - [4096, 1024, 1, 1024, 4096, 4096, 1024, 1024]
    - [27, 97.27]
  - - [4096, 1024, 1, 2048, 4096, 4096, 2048, 1024]
    - [44, 118.43]
  - - [4096, 1024, 1, 4096, 4096, 4096, 4096, 1024]
    - [37, 129.54]
  - - [4096, 1024, 1, 8192, 4096, 4096, 8192, 1024]
    - [14, 135.37]
  - - [4096, 2048, 1, 128, 4096, 4096, 128, 2048]
    - [7, 31.64]
  - - [4096, 2048, 1, 256, 4096, 4096, 256, 2048]
    - [9, 51.38]
  - - [4096, 2048, 1, 512, 4096, 4096, 512, 2048]
    - [29, 79.18]
  - - [4096, 2048, 1, 1024, 4096, 4096, 1024, 2048]
    - [7, 109.18]
  - - [4096, 2048, 1, 2048, 4096, 4096, 2048, 2048]
    - [27, 131.04]
  - - [4096, 2048, 1, 4096, 4096, 4096, 4096, 2048]
    - [29, 146.67]
  - - [4096, 2048, 1, 8192, 4096, 4096, 8192, 2048]
    - [2, 157.92]
  - - [4096, 4096, 1, 128, 4096, 4096, 128, 4096]
    - [7, 33.79]
  - - [4096, 4096, 1, 256, 4096, 4096, 256, 4096]
    - [19, 56.29]
  - - [4096, 4096, 1, 512, 4096, 4096, 512, 4096]
    - [35, 84.65]
  - - [4096, 4096, 1, 1024, 4096, 4096, 1024, 4096]
    - [7, 108.58]
  - - [4096, 4096, 1, 2048, 4096, 4096, 2048, 4096]
    - [29, 141.23]
  - - [4096, 4096, 1, 4096, 4096, 4096, 4096, 4096]
    - [27, 159.26]
  - - [4096, 4096, 1, 8192, 4096, 4096, 8192, 4096]
    - [2, 170.47]
  - - [4096, 8192, 1, 128, 4096, 4096, 128, 8192]
    - [19, 35.76]
  - - [4096, 8192, 1, 256, 4096, 4096, 256, 8192]
    - [36, 59.85]
  - - [4096, 8192, 1, 512, 4096, 4096, 512, 8192]
    - [32, 90.68]
  - - [4096, 8192, 1, 1024, 4096, 4096, 1024, 8192]
    - [32, 122.15]
  - - [4096, 8192, 1, 2048, 4096, 4096, 2048, 8192]
    - [31, 155.3]
  - - [4096, 8192, 1, 4096, 4096, 4096, 4096, 8192]
    - [3, 177.14]
  - - [4096, 8192, 1, 8192, 4096, 4096, 8192, 8192]
    - [3, 204.41]
  - - [8192, 128, 1, 128, 8192, 8192, 128, 128]
    - [56, 15.58]
  - - [8192, 128, 1, 256, 8192, 8192, 256, 128]
    - [49, 26.35]
  - - [8192, 128, 1, 512, 8192, 8192, 512, 128]
    - [47, 41.88]
  - - [8192, 128, 1, 1024, 8192, 8192, 1024, 128]
    - [71, 59.07]
  - - [8192, 128, 1, 2048, 8192, 8192, 2048, 128]
    - [71, 73.55]
  - - [8192, 128, 1, 4096, 8192, 8192, 4096, 128]
    - [72, 86.51]
  - - [8192, 128, 1, 8192, 8192, 8192, 8192, 128]
    - [78, 83.15]
  - - [8192, 256, 1, 128, 8192, 8192, 128, 256]
    - [16, 22.2]
  - - [8192, 256, 1, 256, 8192, 8192, 256, 256]
    - [37, 36.95]
  - - [8192, 256, 1, 512, 8192, 8192, 512, 256]
    - [37, 58.14]
  - - [8192, 256, 1, 1024, 8192, 8192, 1024, 256]
    - [40, 77.74]
  - - [8192, 256, 1, 2048, 8192, 8192, 2048, 256]
    - [39, 96.59]
  - - [8192, 256, 1, 4096, 8192, 8192, 4096, 256]
    - [76, 108.34]
  - - [8192, 256, 1, 8192, 8192, 8192, 8192, 256]
    - [45, 107.57]
  - - [8192, 512, 1, 128, 8192, 8192, 128, 512]
    - [13, 28.04]
  - - [8192, 512, 1, 256, 8192, 8192, 256, 512]
    - [13, 46.69]
  - - [8192, 512, 1, 512, 8192, 8192, 512, 512]
    - [10, 71.15]
  - - [8192, 512, 1, 1024, 8192, 8192, 1024, 512]
    - [32, 97.53]
  - - [8192, 512, 1, 2048, 8192, 8192, 2048, 512]
    - [43, 125.17]
  - - [8192, 512, 1, 4096, 8192, 8192, 4096, 512]
    - [37, 125.21]
  - - [8192, 512, 1, 8192, 8192, 8192, 8192, 512]
    - [5, 135.7]
  - - [8192, 1024, 1, 128, 8192, 8192, 128, 1024]
    - [7, 32.62]
  - - [8192, 1024, 1, 256, 8192, 8192, 256, 1024]
    - [7, 52.95]
  - - [8192, 1024, 1, 512, 8192, 8192, 512, 1024]
    - [29, 79.29]
  - - [8192, 1024, 1, 1024, 8192, 8192, 1024, 1024]
    - [8, 109.36]
  - - [8192, 1024, 1, 2048, 8192, 8192, 2048, 1024]
    - [29, 129.55]
  - - [8192, 1024, 1, 4096, 8192, 8192, 4096, 1024]
    - [27, 144.19]
  - - [8192, 1024, 1, 8192, 8192, 8192, 8192, 1024]
    - [2, 154.33]
  - - [8192, 2048, 1, 128, 8192, 8192, 128, 2048]
    - [4, 34.89]
  - - [8192, 2048, 1, 256, 8192, 8192, 256, 2048]
    - [17, 56.25]
  - - [8192, 2048, 1, 512, 8192, 8192, 512, 2048]
    - [38, 85.6]
  - - [8192, 2048, 1, 1024, 8192, 8192, 1024, 2048]
    - [10, 113.05]
  - - [8192, 2048, 1, 2048, 8192, 8192, 2048, 2048]
    - [28, 141.91]
  - - [8192, 2048, 1, 4096, 8192, 8192, 4096, 2048]
    - [26, 157.99]
  - - [8192, 2048, 1, 8192, 8192, 8192, 8192, 2048]
    - [2, 169.94]
  - - [8192, 4096, 1, 128, 8192, 8192, 128, 4096]
    - [18, 37.48]
  - - [8192, 4096, 1, 256, 8192, 8192, 256, 4096]
    - [5, 59.01]
  - - [8192, 4096, 1, 512, 8192, 8192, 512, 4096]
    - [12, 92.36]
  - - [8192, 4096, 1, 1024, 8192, 8192, 1024, 4096]
    - [33, 122.5]
  - - [8192, 4096, 1, 2048, 8192, 8192, 2048, 4096]
    - [30, 151.45]
  - - [8192, 4096, 1, 4096, 8192, 8192, 4096, 4096]
    - [2, 176.45]
  - - [8192, 4096, 1, 8192, 8192, 8192, 8192, 4096]
    - [3, 206.64]
  - - [8192, 8192, 1, 128, 8192, 8192, 128, 8192]
    - [7, 39.39]
  - - [8192, 8192, 1, 256, 8192, 8192, 256, 8192]
    - [6, 61.92]
  - - [8192, 8192, 1, 512, 8192, 8192, 512, 8192]
    - [29, 96.64]
  - - [8192, 8192, 1, 1024, 8192, 8192, 1024, 8192]
    - [31, 138.56]
  - - [8192, 8192, 1, 2048, 8192, 8192, 2048, 8192]
    - [30, 166.94]
  - - [8192, 8192, 1, 4096, 8192, 8192, 4096, 8192]
    - [2, 194.0]
  - - [8192, 8192, 1, 8192, 8192, 8192, 8192, 8192]
    - [3, 207.59]
- null
- null
- ExperimentalStreamK
- GridBased
