projects/hipblaslt/library/src/amd_detail/rocblaslt/src/Tensile/Logic/asm_full/aquavanjaram/gfx942_228cu/StreamK/aquavanjaram942_Cijk_Ailk_Bjlk_F8B8NBS_BH_Bias_HAS_SAV_UserArgs.yaml
- {MinimumRequiredVersion: 4.33.0}
- aquavanjaram942
- {Architecture: gfx942, CUCount: 228}
- [Device 0049, Device 0050]
    SolutionIndex: 0
    SolutionNameMin: Cijk_Ailk_Bjlk_F8B8NBS_BH_Bias_HAS_SAV_UserArgs_MT256x256x64_MI16x16x1_SN_LDSB0_CLR1_GRVWA4_GRVWB4_GSU0_GSUC0_GSUWGMRR0_K1_LBSPPA2048_LBSPPB2048_LPA0_LPB0_MIWT8_8_PLR1_SU0_SUM0_SUS64_VWA8_VWB8_WGM1_WGMXCC1_WGMXCCGn1
    SolutionIndex: 1
    SolutionNameMin: Cijk_Ailk_Bjlk_F8B8NBS_BH_Bias_HAS_SAV_UserArgs_MT256x256x64_MI16x16x1_SN_LDSB0_CLR1_GRVWA16_GRVWB4_GSU0_GSUC0_GSUWGMRR0_K1_LBSPPA2048_LBSPPB2048_LPA0_LPB0_MIWT8_8_PLR1_SU0_SUM0_SUS64_VWA8_VWB8_WGM1_WGMXCC1_WGMXCCGn1
    SolutionIndex: 2
    SolutionNameMin: Cijk_Ailk_Bjlk_F8B8NBS_BH_Bias_HAS_SAV_UserArgs_MT256x256x64_MI16x16x1_SN_LDSB0_CLR1_GRVWA4_GRVWB8_GSU0_GSUC0_GSUWGMRR0_K1_LBSPPA2048_LBSPPB2048_LPA0_LPB0_MIWT8_8_PLR1_SU0_SUM0_SUS64_VWA8_VWB8_WGM1_WGMXCC1_WGMXCCGn1
    SolutionIndex: 3
    SolutionNameMin: Cijk_Ailk_Bjlk_F8B8NBS_BH_Bias_HAS_SAV_UserArgs_MT256x256x64_MI16x16x1_SN_LDSB0_CLR1_GRVWA16_GRVWB8_GSU0_GSUC0_GSUWGMRR0_K1_LBSPPA2048_LBSPPB2048_LPA0_LPB0_MIWT8_8_PLR1_SU0_SUM0_SUS64_VWA8_VWB8_WGM1_WGMXCC1_WGMXCCGn1
    SolutionIndex: 4
    SolutionNameMin: Cijk_Ailk_Bjlk_F8B8NBS_BH_Bias_HAS_SAV_UserArgs_MT256x256x64_MI16x16x1_SN_LDSB0_CLR1_GRVWA4_GRVWB16_GSU0_GSUC0_GSUWGMRR0_K1_LBSPPA2048_LBSPPB2048_LPA0_LPB0_MIWT8_8_PLR1_SU0_SUM0_SUS64_VWA8_VWB8_WGM1_WGMXCC1_WGMXCCGn1
    SolutionIndex: 5
    SolutionNameMin: Cijk_Ailk_Bjlk_F8B8NBS_BH_Bias_HAS_SAV_UserArgs_MT256x256x64_MI16x16x1_SN_LDSB0_CLR1_GRVWA16_GRVWB16_GSU0_GSUC0_GSUWGMRR0_K1_LBSPPA2048_LBSPPB2048_LPA0_LPB0_MIWT8_8_PLR1_SU0_SUM0_SUS64_VWA8_VWB8_WGM1_WGMXCC1_WGMXCCGn1
    SolutionIndex: 6
    SolutionNameMin: Cijk_Ailk_Bjlk_F8B8NBS_BH_Bias_HAS_SAV_UserArgs_MT256x256x64_MI16x16x1_SN_LDSB0_CLR1_GRVWA16_GRVWB4_GSU0_GSUC0_GSUWGMRR0_K1_LBSPPA2048_LBSPPB2048_LPA0_LPB0_MIWT8_8_PLR1_SU0_SUM0_SUS64_VWA8_VWB8_WGM4_WGMXCC1_WGMXCCGn1
    SolutionIndex: 7
    SolutionNameMin: Cijk_Ailk_Bjlk_F8B8NBS_BH_Bias_HAS_SAV_UserArgs_MT256x256x64_MI16x16x1_SN_LDSB0_CLR1_GRVWA16_GRVWB16_GSU0_GSUC0_GSUWGMRR0_K1_LBSPPA2048_LBSPPB2048_LPA0_LPB0_MIWT8_8_PLR1_SU0_SUM0_SUS64_VWA8_VWB8_WGM4_WGMXCC1_WGMXCCGn1
    SolutionIndex: 8
    SolutionNameMin: Cijk_Ailk_Bjlk_F8B8NBS_BH_Bias_HAS_SAV_UserArgs_MT256x256x64_MI16x16x1_SN_LDSB0_CLR1_GRVWA4_GRVWB4_GSU0_GSUC0_GSUWGMRR0_K1_LBSPPA2048_LBSPPB2048_LPA0_LPB0_MIWT8_8_PLR1_SU0_SUM0_SUS64_VWA8_VWB8_WGM6_WGMXCC1_WGMXCCGn1
    SolutionIndex: 9
    SolutionNameMin: Cijk_Ailk_Bjlk_F8B8NBS_BH_Bias_HAS_SAV_UserArgs_MT256x256x64_MI16x16x1_SN_LDSB0_CLR1_GRVWA4_GRVWB8_GSU0_GSUC0_GSUWGMRR0_K1_LBSPPA2048_LBSPPB2048_LPA0_LPB0_MIWT8_8_PLR1_SU0_SUM0_SUS64_VWA8_VWB8_WGM6_WGMXCC1_WGMXCCGn1
    SolutionIndex: 10
    SolutionNameMin: Cijk_Ailk_Bjlk_F8B8NBS_BH_Bias_HAS_SAV_UserArgs_MT256x256x64_MI16x16x1_SN_LDSB0_CLR1_GRVWA16_GRVWB8_GSU0_GSUC0_GSUWGMRR0_K1_LBSPPA2048_LBSPPB2048_LPA0_LPB0_MIWT8_8_PLR1_SU0_SUM0_SUS64_VWA8_VWB8_WGM6_WGMXCC1_WGMXCCGn1
    SolutionIndex: 11
    SolutionNameMin: Cijk_Ailk_Bjlk_F8B8NBS_BH_Bias_HAS_SAV_UserArgs_MT256x256x64_MI16x16x1_SN_LDSB0_CLR1_GRVWA8_GRVWB16_GSU0_GSUC0_GSUWGMRR0_K1_LBSPPA2048_LBSPPB2048_LPA0_LPB0_MIWT8_8_PLR1_SU0_SUM0_SUS64_VWA8_VWB8_WGM6_WGMXCC1_WGMXCCGn1
    SolutionIndex: 12
    SolutionNameMin: Cijk_Ailk_Bjlk_F8B8NBS_BH_Bias_HAS_SAV_UserArgs_MT256x256x64_MI16x16x1_SN_LDSB0_CLR1_GRVWA16_GRVWB16_GSU0_GSUC0_GSUWGMRR0_K1_LBSPPA2048_LBSPPB2048_LPA0_LPB0_MIWT8_8_PLR1_SU0_SUM0_SUS64_VWA8_VWB8_WGM6_WGMXCC1_WGMXCCGn1
    SolutionIndex: 13
    SolutionNameMin: Cijk_Ailk_Bjlk_F8B8NBS_BH_Bias_HAS_SAV_UserArgs_MT256x256x64_MI16x16x1_SN_LDSB0_CLR1_GRVWA4_GRVWB4_GSU0_GSUC0_GSUWGMRR0_K1_LBSPPA2048_LBSPPB2048_LPA0_LPB0_MIWT8_8_PLR1_SU0_SUM0_SUS64_VWA8_VWB8_WGM8_WGMXCC1_WGMXCCGn1
    SolutionIndex: 14
    SolutionNameMin: Cijk_Ailk_Bjlk_F8B8NBS_BH_Bias_HAS_SAV_UserArgs_MT256x256x64_MI16x16x1_SN_LDSB0_CLR1_GRVWA16_GRVWB8_GSU0_GSUC0_GSUWGMRR0_K1_LBSPPA2048_LBSPPB2048_LPA0_LPB0_MIWT8_8_PLR1_SU0_SUM0_SUS64_VWA8_VWB8_WGM8_WGMXCC1_WGMXCCGn1
    SolutionIndex: 15
    SolutionNameMin: Cijk_Ailk_Bjlk_F8B8NBS_BH_Bias_HAS_SAV_UserArgs_MT256x256x64_MI16x16x1_SN_LDSB0_CLR1_GRVWA16_GRVWB16_GSU0_GSUC0_GSUWGMRR0_K1_LBSPPA2048_LBSPPB2048_LPA0_LPB0_MIWT8_8_PLR1_SU0_SUM0_SUS64_VWA8_VWB8_WGM8_WGMXCC1_WGMXCCGn1
    SolutionIndex: 16
    SolutionNameMin: Cijk_Ailk_Bjlk_F8B8NBS_BH_Bias_HAS_SAV_UserArgs_MT128x256x64_MI16x16x1_SN_LDSB1_CLR1_GRVWA8_GRVWB16_GSU0_GSUC0_GSUWGMRR0_K1_LBSPPA1024_LBSPPB2048_LPA64_LPB0_MIWT4_8_PLR1_SU0_SUM0_SUS64_VWA4_VWB8_WGM1_WGMXCC1_WGMXCCGn1
    SolutionIndex: 17
    SolutionNameMin: Cijk_Ailk_Bjlk_F8B8NBS_BH_Bias_HAS_SAV_UserArgs_MT128x256x64_MI16x16x1_SN_LDSB1_CLR1_GRVWA16_GRVWB16_GSU0_GSUC0_GSUWGMRR0_K1_LBSPPA1024_LBSPPB2048_LPA64_LPB0_MIWT4_8_PLR1_SU0_SUM0_SUS64_VWA4_VWB8_WGM1_WGMXCC1_WGMXCCGn1
    SolutionIndex: 18
    SolutionNameMin: Cijk_Ailk_Bjlk_F8B8NBS_BH_Bias_HAS_SAV_UserArgs_MT128x256x64_MI16x16x1_SN_LDSB1_CLR1_GRVWA16_GRVWB16_GSU0_GSUC0_GSUWGMRR0_K1_LBSPPA1024_LBSPPB2048_LPA64_LPB0_MIWT4_8_PLR1_SU0_SUM0_SUS64_VWA4_VWB8_WGM4_WGMXCC1_WGMXCCGn1
    SolutionIndex: 19
    SolutionNameMin: Cijk_Ailk_Bjlk_F8B8NBS_BH_Bias_HAS_SAV_UserArgs_MT128x256x64_MI16x16x1_SN_LDSB1_CLR1_GRVWA8_GRVWB16_GSU0_GSUC0_GSUWGMRR0_K1_LBSPPA1024_LBSPPB2048_LPA64_LPB0_MIWT4_8_PLR1_SU0_SUM0_SUS64_VWA4_VWB8_WGM6_WGMXCC1_WGMXCCGn1
    SolutionIndex: 20
    SolutionNameMin: Cijk_Ailk_Bjlk_F8B8NBS_BH_Bias_HAS_SAV_UserArgs_MT256x144x64_MI16x16x1_SN_LDSB0_CLR1_GRVWA16_GRVWB4_GSU0_GSUC0_GSUWGMRR0_K1_LBSPPA2048_LBSPPB1152_LPA64_LPB16_MIWT4_9_PLR1_SU0_SUM0_SUS64_VWA4_VWB1_WGM1_WGMXCC1_WGMXCCGn1
    SolutionIndex: 21
    SolutionNameMin: Cijk_Ailk_Bjlk_F8B8NBS_BH_Bias_HAS_SAV_UserArgs_MT256x144x64_MI16x16x1_SN_LDSB0_CLR1_GRVWA16_GRVWB4_GSU0_GSUC0_GSUWGMRR0_K1_LBSPPA2048_LBSPPB1152_LPA64_LPB16_MIWT4_9_PLR1_SU0_SUM0_SUS64_VWA4_VWB1_WGM6_WGMXCC1_WGMXCCGn1
    SolutionIndex: 22
    SolutionNameMin: Cijk_Ailk_Bjlk_F8B8NBS_BH_Bias_HAS_SAV_UserArgs_MT256x144x64_MI16x16x1_SN_LDSB0_CLR1_GRVWA16_GRVWB4_GSU0_GSUC0_GSUWGMRR0_K1_LBSPPA2048_LBSPPB1152_LPA64_LPB16_MIWT4_9_PLR1_SU0_SUM0_SUS64_VWA4_VWB1_WGM8_WGMXCC1_WGMXCCGn1
    SolutionIndex: 23
    SolutionNameMin: Cijk_Ailk_Bjlk_F8B8NBS_BH_Bias_HAS_SAV_UserArgs_MT256x128x64_MI16x16x1_SN_LDSB1_CLR1_GRVWA4_GRVWB4_GSU0_GSUC0_GSUWGMRR0_K1_LBSPPA2048_LBSPPB1024_LPA0_LPB64_MIWT8_4_PLR1_SU0_SUM0_SUS64_VWA8_VWB4_WGM1_WGMXCC1_WGMXCCGn1
    SolutionIndex: 24
    SolutionNameMin: Cijk_Ailk_Bjlk_F8B8NBS_BH_Bias_HAS_SAV_UserArgs_MT256x128x64_MI16x16x1_SN_LDSB1_CLR1_GRVWA4_GRVWB8_GSU0_GSUC0_GSUWGMRR0_K1_LBSPPA2048_LBSPPB1024_LPA0_LPB64_MIWT8_4_PLR1_SU0_SUM0_SUS64_VWA8_VWB4_WGM1_WGMXCC1_WGMXCCGn1
    SolutionIndex: 25
    SolutionNameMin: Cijk_Ailk_Bjlk_F8B8NBS_BH_Bias_HAS_SAV_UserArgs_MT256x128x64_MI16x16x1_SN_LDSB1_CLR1_GRVWA8_GRVWB8_GSU0_GSUC0_GSUWGMRR0_K1_LBSPPA2048_LBSPPB1024_LPA0_LPB64_MIWT8_4_PLR1_SU0_SUM0_SUS64_VWA8_VWB4_WGM1_WGMXCC1_WGMXCCGn1
    SolutionIndex: 26
    SolutionNameMin: Cijk_Ailk_Bjlk_F8B8NBS_BH_Bias_HAS_SAV_UserArgs_MT256x128x64_MI16x16x1_SN_LDSB1_CLR1_GRVWA8_GRVWB16_GSU0_GSUC0_GSUWGMRR0_K1_LBSPPA2048_LBSPPB1024_LPA0_LPB64_MIWT8_4_PLR1_SU0_SUM0_SUS64_VWA8_VWB4_WGM1_WGMXCC1_WGMXCCGn1
    SolutionIndex: 27
    SolutionNameMin: Cijk_Ailk_Bjlk_F8B8NBS_BH_Bias_HAS_SAV_UserArgs_MT256x128x64_MI16x16x1_SN_LDSB1_CLR1_GRVWA16_GRVWB16_GSU0_GSUC0_GSUWGMRR0_K1_LBSPPA2048_LBSPPB1024_LPA0_LPB64_MIWT8_4_PLR1_SU0_SUM0_SUS64_VWA8_VWB4_WGM1_WGMXCC1_WGMXCCGn1
    SolutionIndex: 28
    SolutionNameMin: Cijk_Ailk_Bjlk_F8B8NBS_BH_Bias_HAS_SAV_UserArgs_MT256x128x64_MI16x16x1_SN_LDSB1_CLR1_GRVWA16_GRVWB16_GSU0_GSUC0_GSUWGMRR0_K1_LBSPPA2048_LBSPPB1024_LPA0_LPB64_MIWT8_4_PLR1_SU0_SUM0_SUS64_VWA8_VWB4_WGM4_WGMXCC1_WGMXCCGn1
    SolutionIndex: 29
    SolutionNameMin: Cijk_Ailk_Bjlk_F8B8NBS_BH_Bias_HAS_SAV_UserArgs_MT256x128x64_MI16x16x1_SN_LDSB1_CLR1_GRVWA4_GRVWB4_GSU0_GSUC0_GSUWGMRR0_K1_LBSPPA2048_LBSPPB1024_LPA0_LPB64_MIWT8_4_PLR1_SU0_SUM0_SUS64_VWA8_VWB4_WGM6_WGMXCC1_WGMXCCGn1
    SolutionIndex: 30
    SolutionNameMin: Cijk_Ailk_Bjlk_F8B8NBS_BH_Bias_HAS_SAV_UserArgs_MT256x128x64_MI16x16x1_SN_LDSB1_CLR1_GRVWA16_GRVWB8_GSU0_GSUC0_GSUWGMRR0_K1_LBSPPA2048_LBSPPB1024_LPA0_LPB64_MIWT8_4_PLR1_SU0_SUM0_SUS64_VWA8_VWB4_WGM6_WGMXCC1_WGMXCCGn1
    SolutionIndex: 31
    SolutionNameMin: Cijk_Ailk_Bjlk_F8B8NBS_BH_Bias_HAS_SAV_UserArgs_MT256x128x64_MI16x16x1_SN_LDSB1_CLR1_GRVWA16_GRVWB16_GSU0_GSUC0_GSUWGMRR0_K1_LBSPPA2048_LBSPPB1024_LPA0_LPB64_MIWT8_4_PLR1_SU0_SUM0_SUS64_VWA8_VWB4_WGM6_WGMXCC1_WGMXCCGn1
    SolutionIndex: 32
    SolutionNameMin: Cijk_Ailk_Bjlk_F8B8NBS_BH_Bias_HAS_SAV_UserArgs_MT256x128x64_MI16x16x1_SN_LDSB1_CLR1_GRVWA16_GRVWB4_GSU0_GSUC0_GSUWGMRR0_K1_LBSPPA2048_LBSPPB1024_LPA0_LPB64_MIWT8_4_PLR1_SU0_SUM0_SUS64_VWA8_VWB4_WGM8_WGMXCC1_WGMXCCGn1
    SolutionIndex: 33
    SolutionNameMin: Cijk_Ailk_Bjlk_F8B8NBS_BH_Bias_HAS_SAV_UserArgs_MT256x128x64_MI16x16x1_SN_LDSB1_CLR1_GRVWA4_GRVWB8_GSU0_GSUC0_GSUWGMRR0_K1_LBSPPA2048_LBSPPB1024_LPA0_LPB64_MIWT8_4_PLR1_SU0_SUM0_SUS64_VWA8_VWB4_WGM8_WGMXCC1_WGMXCCGn1
    SolutionIndex: 34
    SolutionNameMin: Cijk_Ailk_Bjlk_F8B8NBS_BH_Bias_HAS_SAV_UserArgs_MT256x128x64_MI16x16x1_SN_LDSB1_CLR1_GRVWA16_GRVWB16_GSU0_GSUC0_GSUWGMRR0_K1_LBSPPA2048_LBSPPB1024_LPA0_LPB64_MIWT8_4_PLR1_SU0_SUM0_SUS64_VWA8_VWB4_WGM8_WGMXCC1_WGMXCCGn1
    SolutionIndex: 35
    SolutionNameMin: Cijk_Ailk_Bjlk_F8B8NBS_BH_Bias_HAS_SAV_UserArgs_MT144x256x64_MI16x16x1_SN_LDSB0_CLR1_GRVWA4_GRVWB16_GSU0_GSUC0_GSUWGMRR0_K1_LBSPPA1152_LBSPPB2048_LPA16_LPB64_MIWT9_4_PLR1_SU0_SUM0_SUS64_VWA1_VWB4_WGM4_WGMXCC1_WGMXCCGn1
    SolutionIndex: 36
    SolutionNameMin: Cijk_Ailk_Bjlk_F8B8NBS_BH_Bias_HAS_SAV_UserArgs_MT128x128x64_MI16x16x1_SN_LDSB1_CLR1_GRVWA4_GRVWB4_GSU0_GSUC0_GSUWGMRR0_K1_LBSPPA1024_LBSPPB1024_LPA0_LPB32_MIWT8_2_PLR1_SU0_SUM0_SUS64_VWA8_VWB2_WGM1_WGMXCC1_WGMXCCGn1
    SolutionIndex: 37
    SolutionNameMin: Cijk_Ailk_Bjlk_F8B8NBS_BH_Bias_HAS_SAV_UserArgs_MT128x128x64_MI16x16x1_SN_LDSB1_CLR1_GRVWA16_GRVWB8_GSU0_GSUC0_GSUWGMRR0_K1_LBSPPA1024_LBSPPB1024_LPA0_LPB32_MIWT8_2_PLR1_SU0_SUM0_SUS64_VWA8_VWB2_WGM1_WGMXCC1_WGMXCCGn1
    SolutionIndex: 38
    SolutionNameMin: Cijk_Ailk_Bjlk_F8B8NBS_BH_Bias_HAS_SAV_UserArgs_MT128x128x64_MI16x16x1_SN_LDSB1_CLR1_GRVWA16_GRVWB16_GSU0_GSUC0_GSUWGMRR0_K1_LBSPPA1024_LBSPPB1024_LPA0_LPB32_MIWT8_2_PLR1_SU0_SUM0_SUS64_VWA8_VWB2_WGM1_WGMXCC1_WGMXCCGn1
    SolutionIndex: 39
    SolutionNameMin: Cijk_Ailk_Bjlk_F8B8NBS_BH_Bias_HAS_SAV_UserArgs_MT128x128x64_MI16x16x1_SN_LDSB1_CLR1_GRVWA4_GRVWB4_GSU0_GSUC0_GSUWGMRR0_K1_LBSPPA1024_LBSPPB1024_LPA0_LPB32_MIWT8_2_PLR1_SU0_SUM0_SUS64_VWA8_VWB2_WGM8_WGMXCC1_WGMXCCGn1
    SolutionIndex: 40
    SolutionNameMin: Cijk_Ailk_Bjlk_F8B8NBS_BH_Bias_HAS_SAV_UserArgs_MT128x64x64_MI16x16x1_SN_LDSB0_CLR1_GRVWA4_GRVWB4_GSU0_GSUC0_GSUWGMRR0_K1_LBSPPA1024_LBSPPB512_LPA0_LPB16_MIWT8_1_PLR1_SU0_SUM0_SUS64_VWA8_VWB1_WGM1_WGMXCC1_WGMXCCGn1
    SolutionIndex: 41
    SolutionNameMin: Cijk_Ailk_Bjlk_F8B8NBS_BH_Bias_HAS_SAV_UserArgs_MT128x128x64_MI16x16x1_SN_LDSB1_CLR1_GRVWA8_GRVWB16_GSU0_GSUC0_GSUWGMRR0_K1_LBSPPA1024_LBSPPB1024_LPA64_LPB64_MIWT4_4_PLR1_SU0_SUM0_SUS64_VWA4_VWB4_WGM1_WGMXCC1_WGMXCCGn1
    SolutionIndex: 42
    SolutionNameMin: Cijk_Ailk_Bjlk_F8B8NBS_BH_Bias_HAS_SAV_UserArgs_MT128x128x64_MI16x16x1_SN_LDSB1_CLR1_GRVWA16_GRVWB16_GSU0_GSUC0_GSUWGMRR0_K1_LBSPPA1024_LBSPPB1024_LPA64_LPB64_MIWT4_4_PLR1_SU0_SUM0_SUS64_VWA4_VWB4_WGM1_WGMXCC1_WGMXCCGn1
    SolutionIndex: 43
    SolutionNameMin: Cijk_Ailk_Bjlk_F8B8NBS_BH_Bias_HAS_SAV_UserArgs_MT128x128x64_MI16x16x1_SN_LDSB1_CLR1_GRVWA16_GRVWB8_GSU0_GSUC0_GSUWGMRR0_K1_LBSPPA1024_LBSPPB1024_LPA64_LPB64_MIWT4_4_PLR1_SU0_SUM0_SUS64_VWA4_VWB4_WGM4_WGMXCC1_WGMXCCGn1
    SolutionIndex: 44
    SolutionNameMin: Cijk_Ailk_Bjlk_F8B8NBS_BH_Bias_HAS_SAV_UserArgs_MT128x128x64_MI16x16x1_SN_LDSB1_CLR1_GRVWA8_GRVWB16_GSU0_GSUC0_GSUWGMRR0_K1_LBSPPA1024_LBSPPB1024_LPA64_LPB64_MIWT4_4_PLR1_SU0_SUM0_SUS64_VWA4_VWB4_WGM4_WGMXCC1_WGMXCCGn1
    SolutionIndex: 45
    SolutionNameMin: Cijk_Ailk_Bjlk_F8B8NBS_BH_Bias_HAS_SAV_UserArgs_MT128x128x64_MI16x16x1_SN_LDSB1_CLR1_GRVWA16_GRVWB16_GSU0_GSUC0_GSUWGMRR0_K1_LBSPPA1024_LBSPPB1024_LPA64_LPB64_MIWT4_4_PLR1_SU0_SUM0_SUS64_VWA4_VWB4_WGM4_WGMXCC1_WGMXCCGn1
    SolutionIndex: 46
    SolutionNameMin: Cijk_Ailk_Bjlk_F8B8NBS_BH_Bias_HAS_SAV_UserArgs_MT128x128x64_MI16x16x1_SN_LDSB1_CLR1_GRVWA8_GRVWB16_GSU0_GSUC0_GSUWGMRR0_K1_LBSPPA1024_LBSPPB1024_LPA64_LPB64_MIWT4_4_PLR1_SU0_SUM0_SUS64_VWA4_VWB4_WGM6_WGMXCC1_WGMXCCGn1
    SolutionIndex: 47
    SolutionNameMin: Cijk_Ailk_Bjlk_F8B8NBS_BH_Bias_HAS_SAV_UserArgs_MT128x128x64_MI16x16x1_SN_LDSB1_CLR1_GRVWA16_GRVWB16_GSU0_GSUC0_GSUWGMRR0_K1_LBSPPA1024_LBSPPB1024_LPA64_LPB64_MIWT4_4_PLR1_SU0_SUM0_SUS64_VWA4_VWB4_WGM6_WGMXCC1_WGMXCCGn1
    SolutionIndex: 48
    SolutionNameMin: Cijk_Ailk_Bjlk_F8B8NBS_BH_Bias_HAS_SAV_UserArgs_MT128x128x64_MI16x16x1_SN_LDSB1_CLR1_GRVWA16_GRVWB8_GSU0_GSUC0_GSUWGMRR0_K1_LBSPPA1024_LBSPPB1024_LPA64_LPB64_MIWT4_4_PLR1_SU0_SUM0_SUS64_VWA4_VWB4_WGM8_WGMXCC1_WGMXCCGn1
    SolutionIndex: 49
    SolutionNameMin: Cijk_Ailk_Bjlk_F8B8NBS_BH_Bias_HAS_SAV_UserArgs_MT128x128x64_MI16x16x1_SN_LDSB1_CLR1_GRVWA8_GRVWB16_GSU0_GSUC0_GSUWGMRR0_K1_LBSPPA1024_LBSPPB1024_LPA64_LPB64_MIWT4_4_PLR1_SU0_SUM0_SUS64_VWA4_VWB4_WGM8_WGMXCC1_WGMXCCGn1
    SolutionIndex: 50
    SolutionNameMin: Cijk_Ailk_Bjlk_F8B8NBS_BH_Bias_HAS_SAV_UserArgs_MT128x128x64_MI16x16x1_SN_LDSB1_CLR1_GRVWA16_GRVWB16_GSU0_GSUC0_GSUWGMRR0_K1_LBSPPA1024_LBSPPB1024_LPA64_LPB64_MIWT4_4_PLR1_SU0_SUM0_SUS64_VWA4_VWB4_WGM8_WGMXCC1_WGMXCCGn1
    SolutionIndex: 51
    SolutionNameMin: Cijk_Ailk_Bjlk_F8B8NBS_BH_Bias_HAS_SAV_UserArgs_MT64x128x64_MI16x16x1_SN_LDSB0_CLR1_GRVWA4_GRVWB4_GSU0_GSUC0_GSUWGMRR0_K1_LBSPPA512_LBSPPB1024_LPA32_LPB64_MIWT2_4_PLR1_SU0_SUM0_SUS64_VWA2_VWB4_WGM1_WGMXCC1_WGMXCCGn1
    SolutionIndex: 52
    SolutionNameMin: Cijk_Ailk_Bjlk_F8B8NBS_BH_Bias_HAS_SAV_UserArgs_MT64x128x64_MI16x16x1_SN_LDSB0_CLR1_GRVWA4_GRVWB8_GSU0_GSUC0_GSUWGMRR0_K1_LBSPPA512_LBSPPB1024_LPA32_LPB64_MIWT2_4_PLR1_SU0_SUM0_SUS64_VWA2_VWB4_WGM1_WGMXCC1_WGMXCCGn1
    SolutionIndex: 53
    SolutionNameMin: Cijk_Ailk_Bjlk_F8B8NBS_BH_Bias_HAS_SAV_UserArgs_MT64x128x64_MI16x16x1_SN_LDSB0_CLR1_GRVWA16_GRVWB8_GSU0_GSUC0_GSUWGMRR0_K1_LBSPPA512_LBSPPB1024_LPA32_LPB64_MIWT2_4_PLR1_SU0_SUM0_SUS64_VWA2_VWB4_WGM1_WGMXCC1_WGMXCCGn1
    SolutionIndex: 54
    SolutionNameMin: Cijk_Ailk_Bjlk_F8B8NBS_BH_Bias_HAS_SAV_UserArgs_MT64x128x64_MI16x16x1_SN_LDSB0_CLR1_GRVWA4_GRVWB16_GSU0_GSUC0_GSUWGMRR0_K1_LBSPPA512_LBSPPB1024_LPA32_LPB64_MIWT2_4_PLR1_SU0_SUM0_SUS64_VWA2_VWB4_WGM1_WGMXCC1_WGMXCCGn1
    SolutionIndex: 55
    SolutionNameMin: Cijk_Ailk_Bjlk_F8B8NBS_BH_Bias_HAS_SAV_UserArgs_MT64x128x64_MI16x16x1_SN_LDSB0_CLR1_GRVWA16_GRVWB16_GSU0_GSUC0_GSUWGMRR0_K1_LBSPPA512_LBSPPB1024_LPA32_LPB64_MIWT2_4_PLR1_SU0_SUM0_SUS64_VWA2_VWB4_WGM1_WGMXCC1_WGMXCCGn1
    SolutionIndex: 56
    SolutionNameMin: Cijk_Ailk_Bjlk_F8B8NBS_BH_Bias_HAS_SAV_UserArgs_MT128x64x64_MI16x16x1_SN_LDSB0_CLR1_GRVWA4_GRVWB4_GSU0_GSUC0_GSUWGMRR0_K1_LBSPPA1024_LBSPPB512_LPA64_LPB32_MIWT4_2_PLR1_SU0_SUM0_SUS64_VWA4_VWB2_WGM1_WGMXCC1_WGMXCCGn1
    SolutionIndex: 57
    SolutionNameMin: Cijk_Ailk_Bjlk_F8B8NBS_BH_Bias_HAS_SAV_UserArgs_MT128x64x64_MI16x16x1_SN_LDSB0_CLR1_GRVWA16_GRVWB4_GSU0_GSUC0_GSUWGMRR0_K1_LBSPPA1024_LBSPPB512_LPA64_LPB32_MIWT4_2_PLR1_SU0_SUM0_SUS64_VWA4_VWB2_WGM1_WGMXCC1_WGMXCCGn1
    SolutionIndex: 58
    SolutionNameMin: Cijk_Ailk_Bjlk_F8B8NBS_BH_Bias_HAS_SAV_UserArgs_MT128x64x64_MI16x16x1_SN_LDSB0_CLR1_GRVWA4_GRVWB8_GSU0_GSUC0_GSUWGMRR0_K1_LBSPPA1024_LBSPPB512_LPA64_LPB32_MIWT4_2_PLR1_SU0_SUM0_SUS64_VWA4_VWB2_WGM1_WGMXCC1_WGMXCCGn1
    SolutionIndex: 59
    SolutionNameMin: Cijk_Ailk_Bjlk_F8B8NBS_BH_Bias_HAS_SAV_UserArgs_MT64x64x64_MI16x16x1_SN_LDSB0_CLR1_GRVWA4_GRVWB4_GSU0_GSUC0_GSUWGMRR0_K1_LBSPPA512_LBSPPB512_LPA32_LPB32_MIWT2_2_PLR1_SU0_SUM0_SUS64_VWA2_VWB2_WGM1_WGMXCC1_WGMXCCGn1
    SolutionIndex: 60
    SolutionNameMin: Cijk_Ailk_Bjlk_F8B8NBS_BH_Bias_HAS_SAV_UserArgs_MT64x64x64_MI16x16x1_SN_LDSB0_CLR1_GRVWA8_GRVWB4_GSU0_GSUC0_GSUWGMRR0_K1_LBSPPA512_LBSPPB512_LPA32_LPB32_MIWT2_2_PLR1_SU0_SUM0_SUS64_VWA2_VWB2_WGM1_WGMXCC1_WGMXCCGn1
    SolutionIndex: 61
    SolutionNameMin: Cijk_Ailk_Bjlk_F8B8NBS_BH_Bias_HAS_SAV_UserArgs_MT64x64x64_MI16x16x1_SN_LDSB0_CLR1_GRVWA8_GRVWB8_GSU0_GSUC0_GSUWGMRR0_K1_LBSPPA512_LBSPPB512_LPA32_LPB32_MIWT2_2_PLR1_SU0_SUM0_SUS64_VWA2_VWB2_WGM1_WGMXCC1_WGMXCCGn1
    SolutionIndex: 62
    SolutionNameMin: Cijk_Ailk_Bjlk_F8B8NBS_BH_Bias_HAS_SAV_UserArgs_MT64x64x64_MI16x16x1_SN_LDSB0_CLR1_GRVWA4_GRVWB16_GSU0_GSUC0_GSUWGMRR0_K1_LBSPPA512_LBSPPB512_LPA32_LPB32_MIWT2_2_PLR1_SU0_SUM0_SUS64_VWA2_VWB2_WGM1_WGMXCC1_WGMXCCGn1
    SolutionIndex: 63
    SolutionNameMin: Cijk_Ailk_Bjlk_F8B8NBS_BH_Bias_HAS_SAV_UserArgs_MT64x64x64_MI16x16x1_SN_LDSB0_CLR1_GRVWA8_GRVWB8_GSU0_GSUC0_GSUWGMRR0_K1_LBSPPA512_LBSPPB512_LPA32_LPB32_MIWT2_2_PLR1_SU0_SUM0_SUS64_VWA2_VWB2_WGM4_WGMXCC1_WGMXCCGn1
    SolutionIndex: 64
    SolutionNameMin: Cijk_Ailk_Bjlk_F8B8NBS_BH_Bias_HAS_SAV_UserArgs_MT64x32x64_MI16x16x1_SN_LDSB0_CLR1_GRVWA4_GRVWB4_GSU0_GSUC0_GSUWGMRR0_K1_LBSPPA512_LBSPPB256_LPA32_LPB16_MIWT2_1_PLR1_SU0_SUM0_SUS64_VWA2_VWB1_WGM1_WGMXCC1_WGMXCCGn1
    SolutionIndex: 65
    SolutionNameMin: Cijk_Ailk_Bjlk_F8B8NBS_BH_Bias_HAS_SAV_UserArgs_MT64x32x64_MI16x16x1_SN_LDSB0_CLR1_GRVWA8_GRVWB4_GSU0_GSUC0_GSUWGMRR0_K1_LBSPPA512_LBSPPB256_LPA32_LPB16_MIWT2_1_PLR1_SU0_SUM0_SUS64_VWA2_VWB1_WGM1_WGMXCC1_WGMXCCGn1
    SolutionIndex: 66
    SolutionNameMin: Cijk_Ailk_Bjlk_F8B8NBS_BH_Bias_HAS_SAV_UserArgs_MT64x32x64_MI16x16x1_SN_LDSB0_CLR1_GRVWA4_GRVWB8_GSU0_GSUC0_GSUWGMRR0_K1_LBSPPA512_LBSPPB256_LPA32_LPB16_MIWT2_1_PLR1_SU0_SUM0_SUS64_VWA2_VWB1_WGM1_WGMXCC1_WGMXCCGn1
    SolutionIndex: 67
    SolutionNameMin: Cijk_Ailk_Bjlk_F8B8NBS_BH_Bias_HAS_SAV_UserArgs_MT32x32x64_MI16x16x1_SN_LDSB0_CLR1_GRVWA4_GRVWB4_GSU0_GSUC0_GSUWGMRR0_K1_LBSPPA256_LBSPPB256_LPA16_LPB16_MIWT1_1_PLR1_SU0_SUM0_SUS64_VWA1_VWB1_WGM1_WGMXCC1_WGMXCCGn1
    SolutionIndex: 68
    SolutionNameMin: Cijk_Ailk_Bjlk_F8B8NBS_BH_Bias_HAS_SAV_UserArgs_MT32x32x64_MI16x16x1_SN_LDSB0_CLR1_GRVWA8_GRVWB4_GSU0_GSUC0_GSUWGMRR0_K1_LBSPPA256_LBSPPB256_LPA16_LPB16_MIWT1_1_PLR1_SU0_SUM0_SUS64_VWA1_VWB1_WGM1_WGMXCC1_WGMXCCGn1
    SolutionIndex: 69
    SolutionNameMin: Cijk_Ailk_Bjlk_F8B8NBS_BH_Bias_HAS_SAV_UserArgs_MT32x32x64_MI16x16x1_SN_LDSB0_CLR1_GRVWA8_GRVWB8_GSU0_GSUC0_GSUWGMRR0_K1_LBSPPA256_LBSPPB256_LPA16_LPB16_MIWT1_1_PLR1_SU0_SUM0_SUS64_VWA1_VWB1_WGM1_WGMXCC1_WGMXCCGn1
    SolutionIndex: 70
    SolutionNameMin: Cijk_Ailk_Bjlk_F8B8NBS_BH_Bias_HAS_SAV_UserArgs_MT256x256x128_MI16x16x1_SN_LDSB1_CLR1_GRVWA16_GRVWB8_GSU0_GSUC0_GSUWGMRR0_K1_LBSPPA2048_LBSPPB2048_LPA0_LPB0_MIWT8_8_PLR1_SU0_SUM0_SUS128_VWA8_VWB8_WGM1_WGMXCC1_WGMXCCGn1
    SolutionIndex: 71
    SolutionNameMin: Cijk_Ailk_Bjlk_F8B8NBS_BH_Bias_HAS_SAV_UserArgs_MT256x256x128_MI16x16x1_SN_LDSB1_CLR1_GRVWA8_GRVWB16_GSU0_GSUC0_GSUWGMRR0_K1_LBSPPA2048_LBSPPB2048_LPA0_LPB0_MIWT8_8_PLR1_SU0_SUM0_SUS128_VWA8_VWB8_WGM1_WGMXCC1_WGMXCCGn1
    SolutionIndex: 72
    SolutionNameMin: Cijk_Ailk_Bjlk_F8B8NBS_BH_Bias_HAS_SAV_UserArgs_MT256x256x128_MI16x16x1_SN_LDSB1_CLR1_GRVWA8_GRVWB16_GSU0_GSUC0_GSUWGMRR0_K1_LBSPPA2048_LBSPPB2048_LPA0_LPB0_MIWT8_8_PLR1_SU0_SUM0_SUS128_VWA8_VWB8_WGM4_WGMXCC1_WGMXCCGn1
    SolutionIndex: 73
    SolutionNameMin: Cijk_Ailk_Bjlk_F8B8NBS_BH_Bias_HAS_SAV_UserArgs_MT256x256x128_MI16x16x1_SN_LDSB1_CLR1_GRVWA16_GRVWB16_GSU0_GSUC0_GSUWGMRR0_K1_LBSPPA2048_LBSPPB2048_LPA0_LPB0_MIWT8_8_PLR1_SU0_SUM0_SUS128_VWA8_VWB8_WGM4_WGMXCC1_WGMXCCGn1
    SolutionIndex: 74
    SolutionNameMin: Cijk_Ailk_Bjlk_F8B8NBS_BH_Bias_HAS_SAV_UserArgs_MT256x256x128_MI16x16x1_SN_LDSB1_CLR1_GRVWA8_GRVWB16_GSU0_GSUC0_GSUWGMRR0_K1_LBSPPA2048_LBSPPB2048_LPA0_LPB0_MIWT8_8_PLR1_SU0_SUM0_SUS128_VWA8_VWB8_WGM6_WGMXCC1_WGMXCCGn1
    SolutionIndex: 75
    SolutionNameMin: Cijk_Ailk_Bjlk_F8B8NBS_BH_Bias_HAS_SAV_UserArgs_MT256x256x128_MI16x16x1_SN_LDSB1_CLR1_GRVWA16_GRVWB16_GSU0_GSUC0_GSUWGMRR0_K1_LBSPPA2048_LBSPPB2048_LPA0_LPB0_MIWT8_8_PLR1_SU0_SUM0_SUS128_VWA8_VWB8_WGM6_WGMXCC1_WGMXCCGn1
    SolutionIndex: 76
    SolutionNameMin: Cijk_Ailk_Bjlk_F8B8NBS_BH_Bias_HAS_SAV_UserArgs_MT256x256x128_MI16x16x1_SN_LDSB1_CLR1_GRVWA16_GRVWB16_GSU0_GSUC0_GSUWGMRR0_K1_LBSPPA2048_LBSPPB2048_LPA0_LPB0_MIWT8_8_PLR1_SU0_SUM0_SUS128_VWA8_VWB8_WGM8_WGMXCC1_WGMXCCGn1
    SolutionIndex: 77
    SolutionNameMin: Cijk_Ailk_Bjlk_F8B8NBS_BH_Bias_HAS_SAV_UserArgs_MT128x256x128_MI16x16x1_SN_LDSB1_CLR1_GRVWA8_GRVWB16_GSU0_GSUC0_GSUWGMRR0_K1_LBSPPA1024_LBSPPB2048_LPA64_LPB0_MIWT4_8_PLR1_SU0_SUM0_SUS128_VWA4_VWB8_WGM4_WGMXCC1_WGMXCCGn1
    SolutionIndex: 78
    SolutionNameMin: Cijk_Ailk_Bjlk_F8B8NBS_BH_Bias_HAS_SAV_UserArgs_MT128x256x128_MI16x16x1_SN_LDSB1_CLR1_GRVWA4_GRVWB16_GSU0_GSUC0_GSUWGMRR0_K1_LBSPPA1024_LBSPPB2048_LPA64_LPB0_MIWT4_8_PLR1_SU0_SUM0_SUS128_VWA4_VWB8_WGM6_WGMXCC1_WGMXCCGn1
    SolutionIndex: 79
    SolutionNameMin: Cijk_Ailk_Bjlk_F8B8NBS_BH_Bias_HAS_SAV_UserArgs_MT128x256x128_MI16x16x1_SN_LDSB1_CLR1_GRVWA16_GRVWB16_GSU0_GSUC0_GSUWGMRR0_K1_LBSPPA1024_LBSPPB2048_LPA64_LPB0_MIWT4_8_PLR1_SU0_SUM0_SUS128_VWA4_VWB8_WGM8_WGMXCC1_WGMXCCGn1
    SolutionIndex: 80
    SolutionNameMin: Cijk_Ailk_Bjlk_F8B8NBS_BH_Bias_HAS_SAV_UserArgs_MT256x128x128_MI16x16x1_SN_LDSB1_CLR1_GRVWA16_GRVWB8_GSU0_GSUC0_GSUWGMRR0_K1_LBSPPA2048_LBSPPB1024_LPA0_LPB64_MIWT8_4_PLR1_SU0_SUM0_SUS128_VWA8_VWB4_WGM1_WGMXCC1_WGMXCCGn1
    SolutionIndex: 81
    SolutionNameMin: Cijk_Ailk_Bjlk_F8B8NBS_BH_Bias_HAS_SAV_UserArgs_MT128x128x128_MI16x16x1_SN_LDSB1_CLR1_GRVWA4_GRVWB4_GSU0_GSUC0_GSUWGMRR0_K1_LBSPPA1024_LBSPPB1024_LPA0_LPB32_MIWT8_2_PLR1_SU0_SUM0_SUS128_VWA8_VWB2_WGM1_WGMXCC1_WGMXCCGn1
    SolutionIndex: 82
    SolutionNameMin: Cijk_Ailk_Bjlk_F8B8NBS_BH_Bias_HAS_SAV_UserArgs_MT128x128x128_MI16x16x1_SN_LDSB1_CLR1_GRVWA4_GRVWB16_GSU0_GSUC0_GSUWGMRR0_K1_LBSPPA1024_LBSPPB1024_LPA64_LPB64_MIWT4_4_PLR1_SU0_SUM0_SUS128_VWA4_VWB4_WGM1_WGMXCC1_WGMXCCGn1
    SolutionIndex: 83
    SolutionNameMin: Cijk_Ailk_Bjlk_F8B8NBS_BH_Bias_HAS_SAV_UserArgs_MT128x128x128_MI16x16x1_SN_LDSB1_CLR1_GRVWA16_GRVWB16_GSU0_GSUC0_GSUWGMRR0_K1_LBSPPA1024_LBSPPB1024_LPA64_LPB64_MIWT4_4_PLR1_SU0_SUM0_SUS128_VWA4_VWB4_WGM1_WGMXCC1_WGMXCCGn1
    SolutionIndex: 84
    SolutionNameMin: Cijk_Ailk_Bjlk_F8B8NBS_BH_Bias_HAS_SAV_UserArgs_MT128x128x128_MI16x16x1_SN_LDSB1_CLR1_GRVWA16_GRVWB16_GSU0_GSUC0_GSUWGMRR0_K1_LBSPPA1024_LBSPPB1024_LPA64_LPB64_MIWT4_4_PLR1_SU0_SUM0_SUS128_VWA4_VWB4_WGM6_WGMXCC1_WGMXCCGn1
    SolutionIndex: 85
    SolutionNameMin: Cijk_Ailk_Bjlk_F8B8NBS_BH_Bias_HAS_SAV_UserArgs_MT128x64x128_MI16x16x1_SN_LDSB1_CLR1_GRVWA4_GRVWB8_GSU0_GSUC0_GSUWGMRR0_K1_LBSPPA1024_LBSPPB512_LPA64_LPB32_MIWT4_2_PLR1_SU0_SUM0_SUS128_VWA4_VWB2_WGM1_WGMXCC1_WGMXCCGn1
    SolutionIndex: 86
    SolutionNameMin: Cijk_Ailk_Bjlk_F8B8NBS_BH_Bias_HAS_SAV_UserArgs_MT128x64x128_MI16x16x1_SN_LDSB1_CLR1_GRVWA16_GRVWB16_GSU0_GSUC0_GSUWGMRR0_K1_LBSPPA1024_LBSPPB512_LPA64_LPB32_MIWT4_2_PLR1_SU0_SUM0_SUS128_VWA4_VWB2_WGM1_WGMXCC1_WGMXCCGn1
    SolutionIndex: 87
    SolutionNameMin: Cijk_Ailk_Bjlk_F8B8NBS_BH_Bias_HAS_SAV_UserArgs_MT128x64x128_MI16x16x1_SN_LDSB1_CLR1_GRVWA16_GRVWB16_GSU0_GSUC0_GSUWGMRR0_K1_LBSPPA1024_LBSPPB512_LPA64_LPB32_MIWT4_2_PLR1_SU0_SUM0_SUS128_VWA4_VWB2_WGM4_WGMXCC1_WGMXCCGn1
    SolutionIndex: 88
    SolutionNameMin: Cijk_Ailk_Bjlk_F8B8NBS_BH_Bias_HAS_SAV_UserArgs_MT128x64x128_MI16x16x1_SN_LDSB1_CLR1_GRVWA16_GRVWB16_GSU0_GSUC0_GSUWGMRR0_K1_LBSPPA1024_LBSPPB512_LPA64_LPB32_MIWT4_2_PLR1_SU0_SUM0_SUS128_VWA4_VWB2_WGM6_WGMXCC1_WGMXCCGn1
    SolutionIndex: 89
    SolutionNameMin: Cijk_Ailk_Bjlk_F8B8NBS_BH_Bias_HAS_SAV_UserArgs_MT128x64x128_MI16x16x1_SN_LDSB1_CLR1_GRVWA16_GRVWB16_GSU0_GSUC0_GSUWGMRR0_K1_LBSPPA1024_LBSPPB512_LPA64_LPB32_MIWT4_2_PLR1_SU0_SUM0_SUS128_VWA4_VWB2_WGM8_WGMXCC1_WGMXCCGn1
    SolutionIndex: 90
    SolutionNameMin: Cijk_Ailk_Bjlk_F8B8NBS_BH_Bias_HAS_SAV_UserArgs_MT64x64x128_MI16x16x1_SN_LDSB1_CLR1_GRVWA8_GRVWB16_GSU0_GSUC0_GSUWGMRR0_K1_LBSPPA512_LBSPPB512_LPA32_LPB32_MIWT2_2_PLR1_SU0_SUM0_SUS128_VWA2_VWB2_WGM1_WGMXCC1_WGMXCCGn1
    SolutionIndex: 91
    SolutionNameMin: Cijk_Ailk_Bjlk_F8B8NBS_BH_Bias_HAS_SAV_UserArgs_MT64x64x128_MI16x16x1_SN_LDSB1_CLR1_GRVWA16_GRVWB16_GSU0_GSUC0_GSUWGMRR0_K1_LBSPPA512_LBSPPB512_LPA32_LPB32_MIWT2_2_PLR1_SU0_SUM0_SUS128_VWA2_VWB2_WGM1_WGMXCC1_WGMXCCGn1
    SolutionIndex: 92
    SolutionNameMin: Cijk_Ailk_Bjlk_F8B8NBS_BH_Bias_HAS_SAV_UserArgs_MT64x64x128_MI16x16x1_SN_LDSB1_CLR1_GRVWA4_GRVWB16_GSU0_GSUC0_GSUWGMRR0_K1_LBSPPA512_LBSPPB512_LPA32_LPB32_MIWT2_2_PLR1_SU0_SUM0_SUS128_VWA2_VWB2_WGM6_WGMXCC1_WGMXCCGn1
    SolutionIndex: 93
    SolutionNameMin: Cijk_Ailk_Bjlk_F8B8NBS_BH_Bias_HAS_SAV_UserArgs_MT64x64x128_MI16x16x1_SN_LDSB1_CLR1_GRVWA8_GRVWB16_GSU0_GSUC0_GSUWGMRR0_K1_LBSPPA512_LBSPPB512_LPA32_LPB32_MIWT2_2_PLR1_SU0_SUM0_SUS128_VWA2_VWB2_WGM6_WGMXCC1_WGMXCCGn1
    SolutionIndex: 94
    SolutionNameMin: Cijk_Ailk_Bjlk_F8B8NBS_BH_Bias_HAS_SAV_UserArgs_MT64x64x128_MI16x16x1_SN_LDSB1_CLR1_GRVWA16_GRVWB16_GSU0_GSUC0_GSUWGMRR0_K1_LBSPPA512_LBSPPB512_LPA32_LPB32_MIWT2_2_PLR1_SU0_SUM0_SUS128_VWA2_VWB2_WGM6_WGMXCC1_WGMXCCGn1
    SolutionIndex: 95
    SolutionNameMin: Cijk_Ailk_Bjlk_F8B8NBS_BH_Bias_HAS_SAV_UserArgs_MT64x64x128_MI16x16x1_SN_LDSB1_CLR1_GRVWA4_GRVWB16_GSU0_GSUC0_GSUWGMRR0_K1_LBSPPA512_LBSPPB512_LPA32_LPB32_MIWT2_2_PLR1_SU0_SUM0_SUS128_VWA2_VWB2_WGM8_WGMXCC1_WGMXCCGn1
    SolutionIndex: 96
    SolutionNameMin: Cijk_Ailk_Bjlk_F8B8NBS_BH_Bias_HAS_SAV_UserArgs_MT64x64x128_MI16x16x1_SN_LDSB1_CLR1_GRVWA8_GRVWB16_GSU0_GSUC0_GSUWGMRR0_K1_LBSPPA512_LBSPPB512_LPA32_LPB32_MIWT2_2_PLR1_SU0_SUM0_SUS128_VWA2_VWB2_WGM8_WGMXCC1_WGMXCCGn1
    SolutionIndex: 97
    SolutionNameMin: Cijk_Ailk_Bjlk_F8B8NBS_BH_Bias_HAS_SAV_UserArgs_MT64x64x128_MI16x16x1_SN_LDSB1_CLR1_GRVWA16_GRVWB16_GSU0_GSUC0_GSUWGMRR0_K1_LBSPPA512_LBSPPB512_LPA32_LPB32_MIWT2_2_PLR1_SU0_SUM0_SUS128_VWA2_VWB2_WGM8_WGMXCC1_WGMXCCGn1
    SolutionIndex: 98
    SolutionNameMin: Cijk_Ailk_Bjlk_F8B8NBS_BH_Bias_HAS_SAV_UserArgs_MT32x64x128_MI16x16x1_SN_LDSB0_CLR1_GRVWA4_GRVWB8_GSU0_GSUC0_GSUWGMRR0_K1_LBSPPA256_LBSPPB512_LPA16_LPB32_MIWT1_2_PLR1_SU0_SUM0_SUS128_VWA1_VWB2_WGM1_WGMXCC1_WGMXCCGn1
    SolutionIndex: 99
    SolutionNameMin: Cijk_Ailk_Bjlk_F8B8NBS_BH_Bias_HAS_SAV_UserArgs_MT32x64x128_MI16x16x1_SN_LDSB0_CLR1_GRVWA8_GRVWB16_GSU0_GSUC0_GSUWGMRR0_K1_LBSPPA256_LBSPPB512_LPA16_LPB32_MIWT1_2_PLR1_SU0_SUM0_SUS128_VWA1_VWB2_WGM4_WGMXCC1_WGMXCCGn1
    SolutionIndex: 100
    SolutionNameMin: Cijk_Ailk_Bjlk_F8B8NBS_BH_Bias_HAS_SAV_UserArgs_MT32x64x128_MI16x16x1_SN_LDSB0_CLR1_GRVWA16_GRVWB16_GSU0_GSUC0_GSUWGMRR0_K1_LBSPPA256_LBSPPB512_LPA16_LPB32_MIWT1_2_PLR1_SU0_SUM0_SUS128_VWA1_VWB2_WGM6_WGMXCC1_WGMXCCGn1
    SolutionIndex: 101
    SolutionNameMin: Cijk_Ailk_Bjlk_F8B8NBS_BH_Bias_HAS_SAV_UserArgs_MT32x64x128_MI16x16x1_SN_LDSB0_CLR1_GRVWA16_GRVWB16_GSU0_GSUC0_GSUWGMRR0_K1_LBSPPA256_LBSPPB512_LPA16_LPB32_MIWT1_2_PLR1_SU0_SUM0_SUS128_VWA1_VWB2_WGM8_WGMXCC1_WGMXCCGn1
    SolutionIndex: 102
    SolutionNameMin: Cijk_Ailk_Bjlk_F8B8NBS_BH_Bias_HAS_SAV_UserArgs_MT64x32x128_MI16x16x1_SN_LDSB0_CLR1_GRVWA4_GRVWB4_GSU0_GSUC0_GSUWGMRR0_K1_LBSPPA512_LBSPPB256_LPA32_LPB16_MIWT2_1_PLR1_SU0_SUM0_SUS128_VWA2_VWB1_WGM1_WGMXCC1_WGMXCCGn1
    SolutionIndex: 103
    SolutionNameMin: Cijk_Ailk_Bjlk_F8B8NBS_BH_Bias_HAS_SAV_UserArgs_MT64x32x128_MI16x16x1_SN_LDSB0_CLR1_GRVWA4_GRVWB8_GSU0_GSUC0_GSUWGMRR0_K1_LBSPPA512_LBSPPB256_LPA32_LPB16_MIWT2_1_PLR1_SU0_SUM0_SUS128_VWA2_VWB1_WGM1_WGMXCC1_WGMXCCGn1
    SolutionIndex: 104
    SolutionNameMin: Cijk_Ailk_Bjlk_F8B8NBS_BH_Bias_HAS_SAV_UserArgs_MT64x32x128_MI16x16x1_SN_LDSB0_CLR1_GRVWA8_GRVWB16_GSU0_GSUC0_GSUWGMRR0_K1_LBSPPA512_LBSPPB256_LPA32_LPB16_MIWT2_1_PLR1_SU0_SUM0_SUS128_VWA2_VWB1_WGM1_WGMXCC1_WGMXCCGn1
    SolutionIndex: 105
    SolutionNameMin: Cijk_Ailk_Bjlk_F8B8NBS_BH_Bias_HAS_SAV_UserArgs_MT64x32x128_MI16x16x1_SN_LDSB0_CLR1_GRVWA16_GRVWB16_GSU0_GSUC0_GSUWGMRR0_K1_LBSPPA512_LBSPPB256_LPA32_LPB16_MIWT2_1_PLR1_SU0_SUM0_SUS128_VWA2_VWB1_WGM1_WGMXCC1_WGMXCCGn1
    SolutionIndex: 106
    SolutionNameMin: Cijk_Ailk_Bjlk_F8B8NBS_BH_Bias_HAS_SAV_UserArgs_MT32x32x128_MI16x16x1_SN_LDSB0_CLR1_GRVWA4_GRVWB4_GSU0_GSUC0_GSUWGMRR0_K1_LBSPPA256_LBSPPB256_LPA16_LPB16_MIWT1_1_PLR1_SU0_SUM0_SUS128_VWA1_VWB1_WGM1_WGMXCC1_WGMXCCGn1
    SolutionIndex: 107
    SolutionNameMin: Cijk_Ailk_Bjlk_F8B8NBS_BH_Bias_HAS_SAV_UserArgs_MT32x32x128_MI16x16x1_SN_LDSB0_CLR1_GRVWA8_GRVWB4_GSU0_GSUC0_GSUWGMRR0_K1_LBSPPA256_LBSPPB256_LPA16_LPB16_MIWT1_1_PLR1_SU0_SUM0_SUS128_VWA1_VWB1_WGM1_WGMXCC1_WGMXCCGn1
    SolutionIndex: 108
    SolutionNameMin: Cijk_Ailk_Bjlk_F8B8NBS_BH_Bias_HAS_SAV_UserArgs_MT32x32x128_MI16x16x1_SN_LDSB0_CLR1_GRVWA4_GRVWB8_GSU0_GSUC0_GSUWGMRR0_K1_LBSPPA256_LBSPPB256_LPA16_LPB16_MIWT1_1_PLR1_SU0_SUM0_SUS128_VWA1_VWB1_WGM1_WGMXCC1_WGMXCCGn1
    SolutionIndex: 109
    SolutionNameMin: Cijk_Ailk_Bjlk_F8B8NBS_BH_Bias_HAS_SAV_UserArgs_MT32x32x128_MI16x16x1_SN_LDSB0_CLR1_GRVWA8_GRVWB8_GSU0_GSUC0_GSUWGMRR0_K1_LBSPPA256_LBSPPB256_LPA16_LPB16_MIWT1_1_PLR1_SU0_SUM0_SUS128_VWA1_VWB1_WGM1_WGMXCC1_WGMXCCGn1
    SolutionIndex: 110
    SolutionNameMin: Cijk_Ailk_Bjlk_F8B8NBS_BH_Bias_HAS_SAV_UserArgs_MT32x32x128_MI16x16x1_SN_LDSB0_CLR1_GRVWA4_GRVWB16_GSU0_GSUC0_GSUWGMRR0_K1_LBSPPA256_LBSPPB256_LPA16_LPB16_MIWT1_1_PLR1_SU0_SUM0_SUS128_VWA1_VWB1_WGM1_WGMXCC1_WGMXCCGn1
    SolutionIndex: 111
    SolutionNameMin: Cijk_Ailk_Bjlk_F8B8NBS_BH_Bias_HAS_SAV_UserArgs_MT32x32x128_MI16x16x1_SN_LDSB0_CLR1_GRVWA8_GRVWB16_GSU0_GSUC0_GSUWGMRR0_K1_LBSPPA256_LBSPPB256_LPA16_LPB16_MIWT1_1_PLR1_SU0_SUM0_SUS128_VWA1_VWB1_WGM1_WGMXCC1_WGMXCCGn1
    SolutionIndex: 112
    SolutionNameMin: Cijk_Ailk_Bjlk_F8B8NBS_BH_Bias_HAS_SAV_UserArgs_MT32x32x128_MI16x16x1_SN_LDSB0_CLR1_GRVWA4_GRVWB16_GSU0_GSUC0_GSUWGMRR0_K1_LBSPPA256_LBSPPB256_LPA16_LPB16_MIWT1_1_PLR1_SU0_SUM0_SUS128_VWA1_VWB1_WGM6_WGMXCC1_WGMXCCGn1
    SolutionIndex: 113
    SolutionNameMin: Cijk_Ailk_Bjlk_F8B8NBS_BH_Bias_HAS_SAV_UserArgs_MT128x64x256_MI16x16x1_SN_LDSB1_CLR1_GRVWA16_GRVWB16_GSU0_GSUC0_GSUWGMRR0_K1_LBSPPA1024_LBSPPB512_LPA64_LPB32_MIWT4_2_PLR1_SU0_SUM0_SUS256_VWA4_VWB2_WGM1_WGMXCC1_WGMXCCGn1
    SolutionIndex: 114
    SolutionNameMin: Cijk_Ailk_Bjlk_F8B8NBS_BH_Bias_HAS_SAV_UserArgs_MT64x64x256_MI16x16x1_SN_LDSB1_CLR1_GRVWA16_GRVWB16_GSU0_GSUC0_GSUWGMRR0_K1_LBSPPA512_LBSPPB512_LPA32_LPB32_MIWT2_2_PLR1_SU0_SUM0_SUS256_VWA2_VWB2_WGM1_WGMXCC1_WGMXCCGn1
    SolutionIndex: 115
    SolutionNameMin: Cijk_Ailk_Bjlk_F8B8NBS_BH_Bias_HAS_SAV_UserArgs_MT64x64x256_MI16x16x1_SN_LDSB1_CLR1_GRVWA16_GRVWB16_GSU0_GSUC0_GSUWGMRR0_K1_LBSPPA512_LBSPPB512_LPA32_LPB32_MIWT2_2_PLR1_SU0_SUM0_SUS256_VWA2_VWB2_WGM6_WGMXCC1_WGMXCCGn1
    SolutionIndex: 116
    SolutionNameMin: Cijk_Ailk_Bjlk_F8B8NBS_BH_Bias_HAS_SAV_UserArgs_MT64x32x256_MI16x16x1_SN_LDSB1_CLR1_GRVWA16_GRVWB16_GSU0_GSUC0_GSUWGMRR0_K1_LBSPPA512_LBSPPB256_LPA32_LPB16_MIWT2_1_PLR1_SU0_SUM0_SUS256_VWA2_VWB1_WGM1_WGMXCC1_WGMXCCGn1
    SolutionIndex: 117
    SolutionNameMin: Cijk_Ailk_Bjlk_F8B8NBS_BH_Bias_HAS_SAV_UserArgs_MT64x32x256_MI16x16x1_SN_LDSB1_CLR1_GRVWA16_GRVWB16_GSU0_GSUC0_GSUWGMRR0_K1_LBSPPA512_LBSPPB256_LPA32_LPB16_MIWT2_1_PLR1_SU0_SUM0_SUS256_VWA2_VWB1_WGM4_WGMXCC1_WGMXCCGn1
    SolutionIndex: 118
    SolutionNameMin: Cijk_Ailk_Bjlk_F8B8NBS_BH_Bias_HAS_SAV_UserArgs_MT64x32x256_MI16x16x1_SN_LDSB1_CLR1_GRVWA16_GRVWB16_GSU0_GSUC0_GSUWGMRR0_K1_LBSPPA512_LBSPPB256_LPA32_LPB16_MIWT2_1_PLR1_SU0_SUM0_SUS256_VWA2_VWB1_WGM6_WGMXCC1_WGMXCCGn1
    SolutionIndex: 119
    SolutionNameMin: Cijk_Ailk_Bjlk_F8B8NBS_BH_Bias_HAS_SAV_UserArgs_MT32x32x256_MI16x16x1_SN_LDSB1_CLR1_GRVWA16_GRVWB16_GSU0_GSUC0_GSUWGMRR0_K1_LBSPPA256_LBSPPB256_LPA16_LPB16_MIWT1_1_PLR1_SU0_SUM0_SUS256_VWA1_VWB1_WGM1_WGMXCC1_WGMXCCGn1
    SolutionIndex: 120
    SolutionNameMin: Cijk_Ailk_Bjlk_F8B8NBS_BH_Bias_HAS_SAV_UserArgs_MT32x32x256_MI16x16x1_SN_LDSB1_CLR1_GRVWA16_GRVWB16_GSU0_GSUC0_GSUWGMRR0_K1_LBSPPA256_LBSPPB256_LPA16_LPB16_MIWT1_1_PLR1_SU0_SUM0_SUS256_VWA1_VWB1_WGM4_WGMXCC1_WGMXCCGn1
    SolutionIndex: 121
    SolutionNameMin: Cijk_Ailk_Bjlk_F8B8NBS_BH_Bias_HAS_SAV_UserArgs_MT32x32x256_MI16x16x1_SN_LDSB1_CLR1_GRVWA16_GRVWB16_GSU0_GSUC0_GSUWGMRR0_K1_LBSPPA256_LBSPPB256_LPA16_LPB16_MIWT1_1_PLR1_SU0_SUM0_SUS256_VWA1_VWB1_WGM6_WGMXCC1_WGMXCCGn1
    SolutionIndex: 122
    SolutionNameMin: Cijk_Ailk_Bjlk_F8B8NBS_BH_Bias_HAS_SAV_UserArgs_MT32x32x256_MI16x16x1_SN_LDSB1_CLR1_GRVWA8_GRVWB16_GSU0_GSUC0_GSUWGMRR0_K1_LBSPPA256_LBSPPB256_LPA16_LPB16_MIWT1_1_PLR1_SU0_SUM0_SUS256_VWA1_VWB1_WGM8_WGMXCC1_WGMXCCGn1
- - - [128, 128, 1, 128, 128, 128, 128, 128]
    - [68, 0.49]
  - - [128, 128, 1, 256, 128, 128, 128, 128]
    - [107, 0.88]
  - - [128, 128, 1, 512, 128, 128, 128, 128]
    - [106, 1.45]
  - - [128, 128, 1, 1024, 128, 128, 128, 128]
    - [109, 2.18]
  - - [128, 128, 1, 2048, 128, 128, 128, 128]
    - [111, 2.92]
  - - [128, 128, 1, 4096, 128, 128, 128, 128]
    - [111, 3.51]
  - - [128, 128, 1, 8192, 128, 128, 128, 128]
    - [119, 3.93]
  - - [128, 256, 1, 128, 128, 128, 128, 256]
    - [67, 1.03]
  - - [128, 256, 1, 256, 128, 128, 128, 256]
    - [69, 1.8]
  - - [128, 256, 1, 512, 128, 128, 128, 256]
    - [109, 2.96]
  - - [128, 256, 1, 1024, 128, 128, 128, 256]
    - [109, 4.39]
  - - [128, 256, 1, 2048, 128, 128, 128, 256]
    - [111, 5.86]
  - - [128, 256, 1, 4096, 128, 128, 128, 256]
    - [111, 7.06]
  - - [128, 256, 1, 8192, 128, 128, 128, 256]
    - [119, 7.88]
  - - [128, 512, 1, 128, 128, 128, 128, 512]
    - [68, 2.01]
  - - [128, 512, 1, 256, 128, 128, 128, 512]
    - [67, 3.52]
  - - [128, 512, 1, 512, 128, 128, 128, 512]
    - [106, 5.84]
  - - [128, 512, 1, 1024, 128, 128, 128, 512]
    - [108, 8.66]
  - - [128, 512, 1, 2048, 128, 128, 128, 512]
    - [111, 11.61]
  - - [128, 512, 1, 4096, 128, 128, 128, 512]
    - [119, 13.92]
  - - [128, 512, 1, 8192, 128, 128, 128, 512]
    - [119, 15.08]
  - - [128, 1024, 1, 128, 128, 128, 128, 1024]
    - [68, 3.88]
  - - [128, 1024, 1, 256, 128, 128, 128, 1024]
    - [67, 6.92]
  - - [128, 1024, 1, 512, 128, 128, 128, 1024]
    - [106, 11.24]
  - - [128, 1024, 1, 1024, 128, 128, 128, 1024]
    - [111, 16.8]
  - - [128, 1024, 1, 2048, 128, 128, 128, 1024]
    - [111, 22.65]
  - - [128, 1024, 1, 4096, 128, 128, 128, 1024]
    - [122, 25.5]
  - - [128, 1024, 1, 8192, 128, 128, 128, 1024]
    - [112, 27.65]
  - - [128, 2048, 1, 128, 128, 128, 128, 2048]
    - [102, 7.38]
  - - [128, 2048, 1, 256, 128, 128, 128, 2048]
    - [64, 12.94]
  - - [128, 2048, 1, 512, 128, 128, 128, 2048]
    - [103, 20.88]
  - - [128, 2048, 1, 1024, 128, 128, 128, 2048]
    - [98, 30.62]
  - - [128, 2048, 1, 2048, 128, 128, 128, 2048]
    - [116, 38.68]
  - - [128, 2048, 1, 4096, 128, 128, 128, 2048]
    - [118, 47.12]
  - - [128, 2048, 1, 8192, 128, 128, 128, 2048]
    - [118, 53.28]
  - - [128, 4096, 1, 128, 128, 128, 128, 4096]
    - [59, 13.59]
  - - [128, 4096, 1, 256, 128, 128, 128, 4096]
    - [59, 23.29]
  - - [128, 4096, 1, 512, 128, 128, 128, 4096]
    - [61, 37.0]
  - - [128, 4096, 1, 1024, 128, 128, 128, 4096]
    - [90, 53.41]
  - - [128, 4096, 1, 2048, 128, 128, 128, 4096]
    - [114, 66.78]
  - - [128, 4096, 1, 4096, 128, 128, 128, 4096]
    - [114, 81.7]
  - - [128, 4096, 1, 8192, 128, 128, 128, 4096]
    - [114, 90.95]
  - - [128, 8192, 1, 128, 128, 128, 128, 8192]
    - [58, 23.0]
  - - [128, 8192, 1, 256, 128, 128, 128, 8192]
    - [58, 39.14]
  - - [128, 8192, 1, 512, 128, 128, 128, 8192]
    - [58, 60.62]
  - - [128, 8192, 1, 1024, 128, 128, 128, 8192]
    - [55, 85.73]
  - - [128, 8192, 1, 2048, 128, 128, 128, 8192]
    - [86, 105.86]
  - - [128, 8192, 1, 4096, 128, 128, 128, 8192]
    - [113, 124.0]
  - - [128, 8192, 1, 8192, 128, 128, 128, 8192]
    - [88, 129.06]
  - - [256, 128, 1, 128, 256, 256, 256, 128]
    - [106, 1.02]
  - - [256, 128, 1, 256, 256, 256, 256, 128]
    - [68, 1.84]
  - - [256, 128, 1, 512, 256, 256, 256, 128]
    - [107, 2.93]
  - - [256, 128, 1, 1024, 256, 256, 256, 128]
    - [111, 4.42]
  - - [256, 128, 1, 2048, 256, 256, 256, 128]
    - [111, 5.94]
  - - [256, 128, 1, 4096, 256, 256, 256, 128]
    - [111, 7.07]
  - - [256, 128, 1, 8192, 256, 256, 256, 128]
    - [119, 7.88]
  - - [256, 256, 1, 128, 256, 256, 256, 256]
    - [106, 2.03]
  - - [256, 256, 1, 256, 256, 256, 256, 256]
    - [68, 3.61]
  - - [256, 256, 1, 512, 256, 256, 256, 256]
    - [106, 5.91]
  - - [256, 256, 1, 1024, 256, 256, 256, 256]
    - [109, 8.81]
  - - [256, 256, 1, 2048, 256, 256, 256, 256]
    - [111, 11.78]
  - - [256, 256, 1, 4096, 256, 256, 256, 256]
    - [111, 14.03]
  - - [256, 256, 1, 8192, 256, 256, 256, 256]
    - [111, 15.53]
  - - [256, 512, 1, 128, 256, 256, 256, 512]
    - [69, 4.02]
  - - [256, 512, 1, 256, 256, 256, 256, 512]
    - [68, 7.04]
  - - [256, 512, 1, 512, 256, 256, 256, 512]
    - [108, 11.41]
  - - [256, 512, 1, 1024, 256, 256, 256, 512]
    - [109, 17.14]
  - - [256, 512, 1, 2048, 256, 256, 256, 512]
    - [111, 22.83]
  - - [256, 512, 1, 4096, 256, 256, 256, 512]
    - [111, 27.24]
  - - [256, 512, 1, 8192, 256, 256, 256, 512]
    - [119, 30.05]
  - - [256, 1024, 1, 128, 256, 256, 256, 1024]
    - [64, 7.28]
  - - [256, 1024, 1, 256, 256, 256, 256, 1024]
    - [64, 12.64]
  - - [256, 1024, 1, 512, 256, 256, 256, 1024]
    - [98, 20.67]
  - - [256, 1024, 1, 1024, 256, 256, 256, 1024]
    - [104, 30.49]
  - - [256, 1024, 1, 2048, 256, 256, 256, 1024]
    - [116, 40.63]
  - - [256, 1024, 1, 4096, 256, 256, 256, 1024]
    - [116, 47.94]
  - - [256, 1024, 1, 8192, 256, 256, 256, 1024]
    - [118, 53.5]
  - - [256, 2048, 1, 128, 256, 256, 256, 2048]
    - [60, 13.5]
  - - [256, 2048, 1, 256, 256, 256, 256, 2048]
    - [61, 23.07]
  - - [256, 2048, 1, 512, 256, 256, 256, 2048]
    - [61, 37.09]
  - - [256, 2048, 1, 1024, 256, 256, 256, 2048]
    - [90, 53.34]
  - - [256, 2048, 1, 2048, 256, 256, 256, 2048]
    - [91, 67.23]
  - - [256, 2048, 1, 4096, 256, 256, 256, 2048]
    - [91, 79.0]
  - - [256, 2048, 1, 8192, 256, 256, 256, 2048]
    - [115, 87.14]
  - - [256, 4096, 1, 128, 256, 256, 256, 4096]
    - [40, 22.34]
  - - [256, 4096, 1, 256, 256, 256, 256, 4096]
    - [52, 38.44]
  - - [256, 4096, 1, 512, 256, 256, 256, 4096]
    - [54, 60.21]
  - - [256, 4096, 1, 1024, 256, 256, 256, 4096]
    - [85, 84.9]
  - - [256, 4096, 1, 2048, 256, 256, 256, 4096]
    - [86, 106.0]
  - - [256, 4096, 1, 4096, 256, 256, 256, 4096]
    - [86, 123.92]
  - - [256, 4096, 1, 8192, 256, 256, 256, 4096]
    - [86, 129.65]
  - - [256, 8192, 1, 128, 256, 256, 256, 8192]
    - [36, 34.73]
  - - [256, 8192, 1, 256, 256, 256, 256, 8192]
    - [36, 58.05]
  - - [256, 8192, 1, 512, 256, 256, 256, 8192]
    - [82, 90.26]
  - - [256, 8192, 1, 1024, 256, 256, 256, 8192]
    - [83, 126.86]
  - - [256, 8192, 1, 2048, 256, 256, 256, 8192]
    - [83, 154.59]
  - - [256, 8192, 1, 4096, 256, 256, 256, 8192]
    - [83, 175.0]
  - - [256, 8192, 1, 8192, 256, 256, 256, 8192]
    - [83, 170.59]
  - - [512, 128, 1, 128, 512, 512, 512, 128]
    - [106, 2.03]
  - - [512, 128, 1, 256, 512, 512, 512, 128]
    - [68, 3.57]
  - - [512, 128, 1, 512, 512, 512, 512, 128]
    - [110, 5.86]
  - - [512, 128, 1, 1024, 512, 512, 512, 128]
    - [110, 8.66]
  - - [512, 128, 1, 2048, 512, 512, 512, 128]
    - [111, 11.65]
  - - [512, 128, 1, 4096, 512, 512, 512, 128]
    - [111, 14.06]
  - - [512, 128, 1, 8192, 512, 512, 512, 128]
    - [120, 15.11]
  - - [512, 256, 1, 128, 512, 512, 512, 256]
    - [68, 3.96]
  - - [512, 256, 1, 256, 512, 512, 512, 256]
    - [68, 6.93]
  - - [512, 256, 1, 512, 512, 512, 512, 256]
    - [109, 11.45]
  - - [512, 256, 1, 1024, 512, 512, 512, 256]
    - [111, 16.9]
  - - [512, 256, 1, 2048, 512, 512, 512, 256]
    - [111, 22.71]
  - - [512, 256, 1, 4096, 512, 512, 512, 256]
    - [111, 27.42]
  - - [512, 256, 1, 8192, 512, 512, 512, 256]
    - [121, 27.83]
  - - [512, 512, 1, 128, 512, 512, 512, 512]
    - [65, 7.37]
  - - [512, 512, 1, 256, 512, 512, 512, 512]
    - [102, 12.72]
  - - [512, 512, 1, 512, 512, 512, 512, 512]
    - [102, 20.58]
  - - [512, 512, 1, 1024, 512, 512, 512, 512]
    - [104, 30.59]
  - - [512, 512, 1, 2048, 512, 512, 512, 512]
    - [116, 40.39]
  - - [512, 512, 1, 4096, 512, 512, 512, 512]
    - [116, 47.0]
  - - [512, 512, 1, 8192, 512, 512, 512, 512]
    - [105, 50.52]
  - - [512, 1024, 1, 128, 512, 512, 512, 1024]
    - [62, 13.35]
  - - [512, 1024, 1, 256, 512, 512, 512, 1024]
    - [59, 22.81]
  - - [512, 1024, 1, 512, 512, 512, 512, 1024]
    - [61, 36.5]
  - - [512, 1024, 1, 1024, 512, 512, 512, 1024]
    - [91, 53.18]
  - - [512, 1024, 1, 2048, 512, 512, 512, 1024]
    - [91, 68.41]
  - - [512, 1024, 1, 4096, 512, 512, 512, 1024]
    - [91, 75.87]
  - - [512, 1024, 1, 8192, 512, 512, 512, 1024]
    - [94, 80.88]
  - - [512, 2048, 1, 128, 512, 512, 512, 2048]
    - [51, 22.26]
  - - [512, 2048, 1, 256, 512, 512, 512, 2048]
    - [52, 38.65]
  - - [512, 2048, 1, 512, 512, 512, 512, 2048]
    - [55, 60.2]
  - - [512, 2048, 1, 1024, 512, 512, 512, 2048]
    - [52, 84.88]
  - - [512, 2048, 1, 2048, 512, 512, 512, 2048]
    - [55, 106.96]
  - - [512, 2048, 1, 4096, 512, 512, 512, 2048]
    - [88, 123.49]
  - - [512, 2048, 1, 8192, 512, 512, 512, 2048]
    - [86, 129.7]
  - - [512, 4096, 1, 128, 512, 512, 512, 4096]
    - [36, 34.69]
  - - [512, 4096, 1, 256, 512, 512, 512, 4096]
    - [36, 58.61]
  - - [512, 4096, 1, 512, 512, 512, 512, 4096]
    - [83, 90.36]
  - - [512, 4096, 1, 1024, 512, 512, 512, 4096]
    - [83, 126.75]
  - - [512, 4096, 1, 2048, 512, 512, 512, 4096]
    - [41, 153.99]
  - - [512, 4096, 1, 4096, 512, 512, 512, 4096]
    - [42, 174.29]
  - - [512, 4096, 1, 8192, 512, 512, 512, 4096]
    - [42, 171.01]
  - - [512, 8192, 1, 128, 512, 512, 512, 8192]
    - [23, 48.97]
  - - [512, 8192, 1, 256, 512, 512, 512, 8192]
    - [27, 83.67]
  - - [512, 8192, 1, 512, 512, 512, 512, 8192]
    - [27, 130.22]
  - - [512, 8192, 1, 1024, 512, 512, 512, 8192]
    - [27, 177.79]
  - - [512, 8192, 1, 2048, 512, 512, 512, 8192]
    - [25, 216.07]
  - - [512, 8192, 1, 4096, 512, 512, 512, 8192]
    - [80, 225.85]
  - - [512, 8192, 1, 8192, 512, 512, 512, 8192]
    - [26, 213.79]
  - - [1024, 128, 1, 128, 1024, 1024, 1024, 128]
    - [67, 3.98]
  - - [1024, 128, 1, 256, 1024, 1024, 1024, 128]
    - [67, 7.03]
  - - [1024, 128, 1, 512, 1024, 1024, 1024, 128]
    - [106, 11.41]
  - - [1024, 128, 1, 1024, 1024, 1024, 1024, 128]
    - [109, 17.03]
  - - [1024, 128, 1, 2048, 1024, 1024, 1024, 128]
    - [111, 22.86]
  - - [1024, 128, 1, 4096, 1024, 1024, 1024, 128]
    - [121, 25.05]
  - - [1024, 128, 1, 8192, 1024, 1024, 1024, 128]
    - [121, 26.51]
  - - [1024, 256, 1, 128, 1024, 1024, 1024, 256]
    - [66, 7.45]
  - - [1024, 256, 1, 256, 1024, 1024, 1024, 256]
    - [103, 13.02]
  - - [1024, 256, 1, 512, 1024, 1024, 1024, 256]
    - [103, 20.62]
  - - [1024, 256, 1, 1024, 1024, 1024, 1024, 256]
    - [104, 30.74]
  - - [1024, 256, 1, 2048, 1024, 1024, 1024, 256]
    - [116, 40.63]
  - - [1024, 256, 1, 4096, 1024, 1024, 1024, 256]
    - [99, 46.07]
  - - [1024, 256, 1, 8192, 1024, 1024, 1024, 256]
    - [117, 49.21]
  - - [1024, 512, 1, 128, 1024, 1024, 1024, 512]
    - [59, 13.6]
  - - [1024, 512, 1, 256, 1024, 1024, 1024, 512]
    - [59, 23.06]
  - - [1024, 512, 1, 512, 1024, 1024, 1024, 512]
    - [61, 36.85]
  - - [1024, 512, 1, 1024, 1024, 1024, 1024, 512]
    - [91, 52.93]
  - - [1024, 512, 1, 2048, 1024, 1024, 1024, 512]
    - [91, 68.61]
  - - [1024, 512, 1, 4096, 1024, 1024, 1024, 512]
    - [92, 75.76]
  - - [1024, 512, 1, 8192, 1024, 1024, 1024, 512]
    - [92, 82.12]
  - - [1024, 1024, 1, 128, 1024, 1024, 1024, 1024]
    - [58, 22.36]
  - - [1024, 1024, 1, 256, 1024, 1024, 1024, 1024]
    - [52, 38.66]
  - - [1024, 1024, 1, 512, 1024, 1024, 1024, 1024]
    - [53, 60.77]
  - - [1024, 1024, 1, 1024, 1024, 1024, 1024, 1024]
    - [55, 85.67]
  - - [1024, 1024, 1, 2048, 1024, 1024, 1024, 1024]
    - [86, 106.88]
  - - [1024, 1024, 1, 4096, 1024, 1024, 1024, 1024]
    - [88, 123.4]
  - - [1024, 1024, 1, 8192, 1024, 1024, 1024, 1024]
    - [88, 127.35]
  - - [1024, 2048, 1, 128, 1024, 1024, 1024, 2048]
    - [36, 34.96]
  - - [1024, 2048, 1, 256, 1024, 1024, 1024, 2048]
    - [36, 59.12]
  - - [1024, 2048, 1, 512, 1024, 1024, 1024, 2048]
    - [42, 90.6]
  - - [1024, 2048, 1, 1024, 1024, 1024, 1024, 2048]
    - [83, 123.96]
  - - [1024, 2048, 1, 2048, 1024, 1024, 1024, 2048]
    - [42, 154.56]
  - - [1024, 2048, 1, 4096, 1024, 1024, 1024, 2048]
    - [47, 172.49]
  - - [1024, 2048, 1, 8192, 1024, 1024, 1024, 2048]
    - [41, 167.61]
  - - [1024, 4096, 1, 128, 1024, 1024, 1024, 4096]
    - [33, 51.37]
  - - [1024, 4096, 1, 256, 1024, 1024, 1024, 4096]
    - [33, 86.99]
  - - [1024, 4096, 1, 512, 1024, 1024, 1024, 4096]
    - [28, 132.05]
  - - [1024, 4096, 1, 1024, 1024, 1024, 1024, 4096]
    - [28, 179.15]
  - - [1024, 4096, 1, 2048, 1024, 1024, 1024, 4096]
    - [28, 219.66]
  - - [1024, 4096, 1, 4096, 1024, 1024, 1024, 4096]
    - [34, 225.16]
  - - [1024, 4096, 1, 8192, 1024, 1024, 1024, 4096]
    - [27, 215.62]
  - - [1024, 8192, 1, 128, 1024, 1024, 1024, 8192]
    - [22, 65.94]
  - - [1024, 8192, 1, 256, 1024, 1024, 1024, 8192]
    - [21, 109.74]
  - - [1024, 8192, 1, 512, 1024, 1024, 1024, 8192]
    - [22, 158.64]
  - - [1024, 8192, 1, 1024, 1024, 1024, 1024, 8192]
    - [13, 214.3]
  - - [1024, 8192, 1, 2048, 1024, 1024, 1024, 8192]
    - [13, 250.21]
  - - [1024, 8192, 1, 4096, 1024, 1024, 1024, 8192]
    - [7, 246.57]
  - - [1024, 8192, 1, 8192, 1024, 1024, 1024, 8192]
    - [70, 261.16]
  - - [2048, 128, 1, 128, 2048, 2048, 2048, 128]
    - [66, 7.37]
  - - [2048, 128, 1, 256, 2048, 2048, 2048, 128]
    - [65, 12.84]
  - - [2048, 128, 1, 512, 2048, 2048, 2048, 128]
    - [102, 20.78]
  - - [2048, 128, 1, 1024, 2048, 2048, 2048, 128]
    - [104, 30.63]
  - - [2048, 128, 1, 2048, 2048, 2048, 2048, 128]
    - [101, 37.61]
  - - [2048, 128, 1, 4096, 2048, 2048, 2048, 128]
    - [100, 45.11]
  - - [2048, 128, 1, 8192, 2048, 2048, 2048, 128]
    - [101, 50.4]
  - - [2048, 256, 1, 128, 2048, 2048, 2048, 256]
    - [59, 13.19]
  - - [2048, 256, 1, 256, 2048, 2048, 2048, 256]
    - [59, 22.87]
  - - [2048, 256, 1, 512, 2048, 2048, 2048, 256]
    - [63, 35.8]
  - - [2048, 256, 1, 1024, 2048, 2048, 2048, 256]
    - [93, 52.28]
  - - [2048, 256, 1, 2048, 2048, 2048, 2048, 256]
    - [96, 66.72]
  - - [2048, 256, 1, 4096, 2048, 2048, 2048, 256]
    - [92, 77.71]
  - - [2048, 256, 1, 8192, 2048, 2048, 2048, 256]
    - [97, 85.42]
  - - [2048, 512, 1, 128, 2048, 2048, 2048, 512]
    - [51, 22.21]
  - - [2048, 512, 1, 256, 2048, 2048, 2048, 512]
    - [51, 38.76]
  - - [2048, 512, 1, 512, 2048, 2048, 2048, 512]
    - [52, 60.45]
  - - [2048, 512, 1, 1024, 2048, 2048, 2048, 512]
    - [55, 85.37]
  - - [2048, 512, 1, 2048, 2048, 2048, 2048, 512]
    - [87, 105.53]
  - - [2048, 512, 1, 4096, 2048, 2048, 2048, 512]
    - [88, 123.2]
  - - [2048, 512, 1, 8192, 2048, 2048, 2048, 512]
    - [89, 129.44]
  - - [2048, 1024, 1, 128, 2048, 2048, 2048, 1024]
    - [81, 34.78]
  - - [2048, 1024, 1, 256, 2048, 2048, 2048, 1024]
    - [36, 58.41]
  - - [2048, 1024, 1, 512, 2048, 2048, 2048, 1024]
    - [41, 89.85]
  - - [2048, 1024, 1, 1024, 2048, 2048, 2048, 1024]
    - [83, 122.42]
  - - [2048, 1024, 1, 2048, 2048, 2048, 2048, 1024]
    - [47, 152.76]
  - - [2048, 1024, 1, 4096, 2048, 2048, 2048, 1024]
    - [43, 172.7]
  - - [2048, 1024, 1, 8192, 2048, 2048, 2048, 1024]
    - [48, 164.87]
  - - [2048, 2048, 1, 128, 2048, 2048, 2048, 2048]
    - [24, 50.71]
  - - [2048, 2048, 1, 256, 2048, 2048, 2048, 2048]
    - [27, 85.84]
  - - [2048, 2048, 1, 512, 2048, 2048, 2048, 2048]
    - [27, 133.27]
  - - [2048, 2048, 1, 1024, 2048, 2048, 2048, 2048]
    - [31, 177.6]
  - - [2048, 2048, 1, 2048, 2048, 2048, 2048, 2048]
    - [31, 216.03]
  - - [2048, 2048, 1, 4096, 2048, 2048, 2048, 2048]
    - [27, 225.03]
  - - [2048, 2048, 1, 8192, 2048, 2048, 2048, 2048]
    - [77, 215.24]
  - - [2048, 4096, 1, 128, 2048, 2048, 2048, 4096]
    - [4, 59.01]
  - - [2048, 4096, 1, 256, 2048, 2048, 2048, 4096]
    - [5, 99.99]
  - - [2048, 4096, 1, 512, 2048, 2048, 2048, 4096]
    - [4, 154.57]
  - - [2048, 4096, 1, 1024, 2048, 2048, 2048, 4096]
    - [5, 212.98]
  - - [2048, 4096, 1, 2048, 2048, 2048, 2048, 4096]
    - [5, 250.32]
  - - [2048, 4096, 1, 4096, 2048, 2048, 2048, 4096]
    - [75, 243.77]
  - - [2048, 4096, 1, 8192, 2048, 2048, 2048, 4096]
    - [73, 260.6]
  - - [2048, 8192, 1, 128, 2048, 2048, 2048, 8192]
    - [20, 68.01]
  - - [2048, 8192, 1, 256, 2048, 2048, 2048, 8192]
    - [0, 111.67]
  - - [2048, 8192, 1, 512, 2048, 2048, 2048, 8192]
    - [5, 165.88]
  - - [2048, 8192, 1, 1024, 2048, 2048, 2048, 8192]
    - [6, 204.54]
  - - [2048, 8192, 1, 2048, 2048, 2048, 2048, 8192]
    - [18, 222.92]
  - - [2048, 8192, 1, 4096, 2048, 2048, 2048, 8192]
    - [9, 272.63]
  - - [2048, 8192, 1, 8192, 2048, 2048, 2048, 8192]
    - [74, 328.9]
  - - [4096, 128, 1, 128, 4096, 4096, 4096, 128]
    - [59, 13.78]
  - - [4096, 128, 1, 256, 4096, 4096, 4096, 128]
    - [59, 23.58]
  - - [4096, 128, 1, 512, 4096, 4096, 4096, 128]
    - [61, 37.16]
  - - [4096, 128, 1, 1024, 4096, 4096, 4096, 128]
    - [90, 53.77]
  - - [4096, 128, 1, 2048, 4096, 4096, 4096, 128]
    - [91, 65.19]
  - - [4096, 128, 1, 4096, 4096, 4096, 4096, 128]
    - [97, 77.41]
  - - [4096, 128, 1, 8192, 4096, 4096, 4096, 128]
    - [95, 84.53]
  - - [4096, 256, 1, 128, 4096, 4096, 4096, 256]
    - [57, 22.87]
  - - [4096, 256, 1, 256, 4096, 4096, 4096, 256]
    - [56, 39.17]
  - - [4096, 256, 1, 512, 4096, 4096, 4096, 256]
    - [58, 61.45]
  - - [4096, 256, 1, 1024, 4096, 4096, 4096, 256]
    - [55, 85.46]
  - - [4096, 256, 1, 2048, 4096, 4096, 4096, 256]
    - [88, 106.48]
  - - [4096, 256, 1, 4096, 4096, 4096, 4096, 256]
    - [89, 124.57]
  - - [4096, 256, 1, 8192, 4096, 4096, 4096, 256]
    - [89, 129.45]
  - - [4096, 512, 1, 128, 4096, 4096, 4096, 512]
    - [36, 34.77]
  - - [4096, 512, 1, 256, 4096, 4096, 4096, 512]
    - [37, 58.47]
  - - [4096, 512, 1, 512, 4096, 4096, 4096, 512]
    - [38, 90.0]
  - - [4096, 512, 1, 1024, 4096, 4096, 4096, 512]
    - [49, 122.2]
  - - [4096, 512, 1, 2048, 4096, 4096, 4096, 512]
    - [46, 152.7]
  - - [4096, 512, 1, 4096, 4096, 4096, 4096, 512]
    - [45, 172.99]
  - - [4096, 512, 1, 8192, 4096, 4096, 4096, 512]
    - [43, 166.23]
  - - [4096, 1024, 1, 128, 4096, 4096, 4096, 1024]
    - [33, 50.61]
  - - [4096, 1024, 1, 256, 4096, 4096, 4096, 1024]
    - [33, 86.27]
  - - [4096, 1024, 1, 512, 4096, 4096, 4096, 1024]
    - [34, 132.59]
  - - [4096, 1024, 1, 1024, 4096, 4096, 4096, 1024]
    - [34, 180.67]
  - - [4096, 1024, 1, 2048, 4096, 4096, 4096, 1024]
    - [34, 216.98]
  - - [4096, 1024, 1, 4096, 4096, 4096, 4096, 1024]
    - [79, 224.62]
  - - [4096, 1024, 1, 8192, 4096, 4096, 4096, 1024]
    - [78, 216.64]
  - - [4096, 2048, 1, 128, 4096, 4096, 4096, 2048]
    - [4, 57.57]
  - - [4096, 2048, 1, 256, 4096, 4096, 4096, 2048]
    - [4, 97.87]
  - - [4096, 2048, 1, 512, 4096, 4096, 4096, 2048]
    - [4, 151.39]
  - - [4096, 2048, 1, 1024, 4096, 4096, 4096, 2048]
    - [8, 208.86]
  - - [4096, 2048, 1, 2048, 4096, 4096, 4096, 2048]
    - [12, 246.26]
  - - [4096, 2048, 1, 4096, 4096, 4096, 4096, 2048]
    - [73, 243.72]
  - - [4096, 2048, 1, 8192, 4096, 4096, 4096, 2048]
    - [16, 264.44]
  - - [4096, 4096, 1, 128, 4096, 4096, 4096, 4096]
    - [5, 64.13]
  - - [4096, 4096, 1, 256, 4096, 4096, 4096, 4096]
    - [3, 109.66]
  - - [4096, 4096, 1, 512, 4096, 4096, 4096, 4096]
    - [8, 163.54]
  - - [4096, 4096, 1, 1024, 4096, 4096, 4096, 4096]
    - [8, 205.76]
  - - [4096, 4096, 1, 2048, 4096, 4096, 4096, 4096]
    - [19, 224.41]
  - - [4096, 4096, 1, 4096, 4096, 4096, 4096, 4096]
    - [8, 275.19]
  - - [4096, 4096, 1, 8192, 4096, 4096, 4096, 4096]
    - [71, 329.55]
  - - [4096, 8192, 1, 128, 4096, 4096, 4096, 8192]
    - [20, 72.08]
  - - [4096, 8192, 1, 256, 4096, 4096, 4096, 8192]
    - [1, 112.98]
  - - [4096, 8192, 1, 512, 4096, 4096, 4096, 8192]
    - [28, 165.8]
  - - [4096, 8192, 1, 1024, 4096, 4096, 4096, 8192]
    - [30, 207.66]
  - - [4096, 8192, 1, 2048, 4096, 4096, 4096, 8192]
    - [3, 265.28]
  - - [4096, 8192, 1, 4096, 4096, 4096, 4096, 8192]
    - [73, 306.12]
  - - [4096, 8192, 1, 8192, 4096, 4096, 4096, 8192]
    - [73, 361.58]
  - - [8192, 128, 1, 128, 8192, 8192, 8192, 128]
    - [58, 22.84]
  - - [8192, 128, 1, 256, 8192, 8192, 8192, 128]
    - [57, 38.51]
  - - [8192, 128, 1, 512, 8192, 8192, 8192, 128]
    - [56, 60.3]
  - - [8192, 128, 1, 1024, 8192, 8192, 8192, 128]
    - [55, 83.01]
  - - [8192, 128, 1, 2048, 8192, 8192, 8192, 128]
    - [88, 104.38]
  - - [8192, 128, 1, 4096, 8192, 8192, 8192, 128]
    - [88, 122.76]
  - - [8192, 128, 1, 8192, 8192, 8192, 8192, 128]
    - [88, 126.03]
  - - [8192, 256, 1, 128, 8192, 8192, 8192, 256]
    - [39, 33.62]
  - - [8192, 256, 1, 256, 8192, 8192, 8192, 256]
    - [39, 56.89]
  - - [8192, 256, 1, 512, 8192, 8192, 8192, 256]
    - [45, 87.89]
  - - [8192, 256, 1, 1024, 8192, 8192, 8192, 256]
    - [84, 122.17]
  - - [8192, 256, 1, 2048, 8192, 8192, 8192, 256]
    - [47, 152.63]
  - - [8192, 256, 1, 4096, 8192, 8192, 8192, 256]
    - [44, 171.77]
  - - [8192, 256, 1, 8192, 8192, 8192, 8192, 256]
    - [50, 163.74]
  - - [8192, 512, 1, 128, 8192, 8192, 8192, 512]
    - [29, 47.45]
  - - [8192, 512, 1, 256, 8192, 8192, 8192, 512]
    - [34, 80.48]
  - - [8192, 512, 1, 512, 8192, 8192, 8192, 512]
    - [34, 125.4]
  - - [8192, 512, 1, 1024, 8192, 8192, 8192, 512]
    - [28, 173.14]
  - - [8192, 512, 1, 2048, 8192, 8192, 8192, 512]
    - [34, 214.25]
  - - [8192, 512, 1, 4096, 8192, 8192, 8192, 512]
    - [28, 226.01]
  - - [8192, 512, 1, 8192, 8192, 8192, 8192, 512]
    - [79, 218.3]
  - - [8192, 1024, 1, 128, 8192, 8192, 8192, 1024]
    - [4, 55.47]
  - - [8192, 1024, 1, 256, 8192, 8192, 8192, 1024]
    - [35, 95.27]
  - - [8192, 1024, 1, 512, 8192, 8192, 8192, 1024]
    - [4, 146.5]
  - - [8192, 1024, 1, 1024, 8192, 8192, 8192, 1024]
    - [7, 202.43]
  - - [8192, 1024, 1, 2048, 8192, 8192, 8192, 1024]
    - [12, 241.21]
  - - [8192, 1024, 1, 4096, 8192, 8192, 8192, 1024]
    - [72, 242.72]
  - - [8192, 1024, 1, 8192, 8192, 8192, 8192, 1024]
    - [17, 270.35]
  - - [8192, 2048, 1, 128, 8192, 8192, 8192, 2048]
    - [2, 62.4]
  - - [8192, 2048, 1, 256, 8192, 8192, 8192, 2048]
    - [0, 107.47]
  - - [8192, 2048, 1, 512, 8192, 8192, 8192, 2048]
    - [12, 161.55]
  - - [8192, 2048, 1, 1024, 8192, 8192, 8192, 2048]
    - [10, 200.86]
  - - [8192, 2048, 1, 2048, 8192, 8192, 8192, 2048]
    - [17, 226.4]
  - - [8192, 2048, 1, 4096, 8192, 8192, 8192, 2048]
    - [11, 276.99]
  - - [8192, 2048, 1, 8192, 8192, 8192, 8192, 2048]
    - [75, 331.54]
  - - [8192, 4096, 1, 128, 8192, 8192, 8192, 4096]
    - [0, 67.27]
  - - [8192, 4096, 1, 256, 8192, 8192, 8192, 4096]
    - [1, 110.94]
  - - [8192, 4096, 1, 512, 8192, 8192, 8192, 4096]
    - [28, 166.47]
  - - [8192, 4096, 1, 1024, 8192, 8192, 8192, 4096]
    - [32, 208.02]
  - - [8192, 4096, 1, 2048, 8192, 8192, 8192, 4096]
    - [5, 261.83]
  - - [8192, 4096, 1, 4096, 8192, 8192, 8192, 4096]
    - [14, 321.74]
  - - [8192, 4096, 1, 8192, 8192, 8192, 8192, 4096]
    - [14, 361.12]
  - - [8192, 8192, 1, 128, 8192, 8192, 8192, 8192]
    - [20, 66.26]
  - - [8192, 8192, 1, 256, 8192, 8192, 8192, 8192]
    - [33, 109.57]
  - - [8192, 8192, 1, 512, 8192, 8192, 8192, 8192]
    - [5, 170.16]
  - - [8192, 8192, 1, 1024, 8192, 8192, 8192, 8192]
    - [15, 238.28]
  - - [8192, 8192, 1, 2048, 8192, 8192, 8192, 8192]
    - [73, 300.74]
  - - [8192, 8192, 1, 4096, 8192, 8192, 8192, 8192]
    - [73, 341.76]
  - - [8192, 8192, 1, 8192, 8192, 8192, 8192, 8192]
    - [76, 351.15]
- null
- null
- ExperimentalStreamK
- GridBased
