projects/hipblaslt/library/src/amd_detail/rocblaslt/src/Tensile/Logic/asm_full/aquavanjaram/gfx942_38cu/StreamK/aquavanjaram942_Cijk_Ailk_Bjlk_I8_BH_UserArgs.yaml
- {MinimumRequiredVersion: 4.33.0}
- aquavanjaram942
- {Architecture: gfx942, CUCount: 38}
- [Device 0049, Device 0050]
    SolutionIndex: 0
    SolutionNameMin: Cijk_Ailk_Bjlk_I8_BH_UserArgs_MT256x256x32_MI16x16x1_SN_LDSB0_AFC0_AFEM1_AFEM1_ASEM1_CLR0_CADS0_DTVA0_DTVB0_EPS0_FDSI0_GRPM1_GRVWA4_GRVWB4_GSU0_GSUAMB_GSUC0_GSUWGMRR0_GLS0_ISA942_IU1_K1_LBSPPA2048_LBSPPB2048_LBSPPM0_LPA64_LPB64_LPM0_LRVW8_LWPMn1_MIAV0_MIWT8_8_MO40_NTn1_NTA0_NTB0_NTC0_NTD0_NTM0_NEPBS0_NLCA1_NLCB1_ONLL1_PGR2_PLR0_PKA1_SIA3_SS1_SU0_SUM0_SUS32_SPO0_SRVW0_SSO0_SVW4_SK3_SKXCCM8_TLDS0_ULSGRO0_USL1_UIOFGRO0_USFGRO0_VSn1_VWA4_VWB4_WSGRA0_WSGRB0_WS64_WG32_8_1_WGM1_WGMXCC1_WGMXCCGn1
    SolutionIndex: 1
    SolutionNameMin: Cijk_Ailk_Bjlk_I8_BH_UserArgs_MT256x256x32_MI16x16x1_SN_LDSB0_AFC0_AFEM1_AFEM1_ASEM1_CLR0_CADS0_DTVA0_DTVB0_EPS0_FDSI0_GRPM1_GRVWA4_GRVWB4_GSU0_GSUAMB_GSUC0_GSUWGMRR0_GLS0_ISA942_IU1_K1_LBSPPA2048_LBSPPB2048_LBSPPM0_LPA0_LPB64_LPM0_LRVW8_LWPMn1_MIAV0_MIWT8_8_MO40_NTn1_NTA0_NTB0_NTC0_NTD0_NTM0_NEPBS0_NLCA1_NLCB1_ONLL1_PGR2_PLR0_PKA1_SIA3_SS1_SU0_SUM0_SUS32_SPO0_SRVW0_SSO0_SVW8_SK3_SKXCCM8_TLDS0_ULSGRO0_USL1_UIOFGRO0_USFGRO0_VSn1_VWA8_VWB4_WSGRA0_WSGRB0_WS64_WG32_8_1_WGM1_WGMXCC1_WGMXCCGn1
    SolutionIndex: 2
    SolutionNameMin: Cijk_Ailk_Bjlk_I8_BH_UserArgs_MT256x256x32_MI16x16x1_SN_LDSB0_AFC0_AFEM1_AFEM1_ASEM1_CLR0_CADS0_DTVA0_DTVB0_EPS0_FDSI0_GRPM1_GRVWA4_GRVWB4_GSU0_GSUAMB_GSUC0_GSUWGMRR0_GLS0_ISA942_IU1_K1_LBSPPA2048_LBSPPB2048_LBSPPM0_LPA0_LPB0_LPM0_LRVW8_LWPMn1_MIAV0_MIWT8_8_MO40_NTn1_NTA0_NTB0_NTC0_NTD0_NTM0_NEPBS0_NLCA1_NLCB1_ONLL1_PGR2_PLR0_PKA1_SIA3_SS1_SU0_SUM0_SUS32_SPO0_SRVW0_SSO0_SVW8_SK3_SKXCCM8_TLDS0_ULSGRO0_USL1_UIOFGRO0_USFGRO0_VSn1_VWA8_VWB8_WSGRA0_WSGRB0_WS64_WG32_8_1_WGM1_WGMXCC1_WGMXCCGn1
    SolutionIndex: 3
    SolutionNameMin: Cijk_Ailk_Bjlk_I8_BH_UserArgs_MT256x256x32_MI16x16x1_SN_LDSB0_AFC0_AFEM1_AFEM1_ASEM1_CLR0_CADS0_DTVA0_DTVB0_EPS0_FDSI0_GRPM1_GRVWA8_GRVWB4_GSU0_GSUAMB_GSUC0_GSUWGMRR0_GLS0_ISA942_IU1_K1_LBSPPA2048_LBSPPB2048_LBSPPM0_LPA64_LPB64_LPM0_LRVW8_LWPMn1_MIAV0_MIWT8_8_MO40_NTn1_NTA0_NTB0_NTC0_NTD0_NTM0_NEPBS0_NLCA1_NLCB1_ONLL1_PGR2_PLR0_PKA1_SIA3_SS1_SU0_SUM0_SUS32_SPO0_SRVW0_SSO0_SVW4_SK3_SKXCCM8_TLDS0_ULSGRO0_USL1_UIOFGRO0_USFGRO0_VSn1_VWA4_VWB4_WSGRA0_WSGRB0_WS64_WG32_8_1_WGM1_WGMXCC1_WGMXCCGn1
    SolutionIndex: 4
    SolutionNameMin: Cijk_Ailk_Bjlk_I8_BH_UserArgs_MT256x256x32_MI16x16x1_SN_LDSB0_AFC0_AFEM1_AFEM1_ASEM1_CLR0_CADS0_DTVA0_DTVB0_EPS0_FDSI0_GRPM1_GRVWA8_GRVWB4_GSU0_GSUAMB_GSUC0_GSUWGMRR0_GLS0_ISA942_IU1_K1_LBSPPA2048_LBSPPB2048_LBSPPM0_LPA64_LPB0_LPM0_LRVW8_LWPMn1_MIAV0_MIWT8_8_MO40_NTn1_NTA0_NTB0_NTC0_NTD0_NTM0_NEPBS0_NLCA1_NLCB1_ONLL1_PGR2_PLR0_PKA1_SIA3_SS1_SU0_SUM0_SUS32_SPO0_SRVW0_SSO0_SVW4_SK3_SKXCCM8_TLDS0_ULSGRO0_USL1_UIOFGRO0_USFGRO0_VSn1_VWA4_VWB8_WSGRA0_WSGRB0_WS64_WG32_8_1_WGM1_WGMXCC1_WGMXCCGn1
    SolutionIndex: 5
    SolutionNameMin: Cijk_Ailk_Bjlk_I8_BH_UserArgs_MT256x256x32_MI16x16x1_SN_LDSB0_AFC0_AFEM1_AFEM1_ASEM1_CLR0_CADS0_DTVA0_DTVB0_EPS0_FDSI0_GRPM1_GRVWA8_GRVWB4_GSU0_GSUAMB_GSUC0_GSUWGMRR0_GLS0_ISA942_IU1_K1_LBSPPA2048_LBSPPB2048_LBSPPM0_LPA0_LPB0_LPM0_LRVW8_LWPMn1_MIAV0_MIWT8_8_MO40_NTn1_NTA0_NTB0_NTC0_NTD0_NTM0_NEPBS0_NLCA1_NLCB1_ONLL1_PGR2_PLR0_PKA1_SIA3_SS1_SU0_SUM0_SUS32_SPO0_SRVW0_SSO0_SVW8_SK3_SKXCCM8_TLDS0_ULSGRO0_USL1_UIOFGRO0_USFGRO0_VSn1_VWA8_VWB8_WSGRA0_WSGRB0_WS64_WG32_8_1_WGM1_WGMXCC1_WGMXCCGn1
    SolutionIndex: 6
    SolutionNameMin: Cijk_Ailk_Bjlk_I8_BH_UserArgs_MT256x256x32_MI16x16x1_SN_LDSB0_AFC0_AFEM1_AFEM1_ASEM1_CLR0_CADS0_DTVA0_DTVB0_EPS0_FDSI0_GRPM1_GRVWA4_GRVWB8_GSU0_GSUAMB_GSUC0_GSUWGMRR0_GLS0_ISA942_IU1_K1_LBSPPA2048_LBSPPB2048_LBSPPM0_LPA0_LPB64_LPM0_LRVW8_LWPMn1_MIAV0_MIWT8_8_MO40_NTn1_NTA0_NTB0_NTC0_NTD0_NTM0_NEPBS0_NLCA1_NLCB1_ONLL1_PGR2_PLR0_PKA1_SIA3_SS1_SU0_SUM0_SUS32_SPO0_SRVW0_SSO0_SVW8_SK3_SKXCCM8_TLDS0_ULSGRO0_USL1_UIOFGRO0_USFGRO0_VSn1_VWA8_VWB4_WSGRA0_WSGRB0_WS64_WG32_8_1_WGM1_WGMXCC1_WGMXCCGn1
    SolutionIndex: 7
    SolutionNameMin: Cijk_Ailk_Bjlk_I8_BH_UserArgs_MT256x256x32_MI16x16x1_SN_LDSB0_AFC0_AFEM1_AFEM1_ASEM1_CLR0_CADS0_DTVA0_DTVB0_EPS0_FDSI0_GRPM1_GRVWA8_GRVWB8_GSU0_GSUAMB_GSUC0_GSUWGMRR0_GLS0_ISA942_IU1_K1_LBSPPA2048_LBSPPB2048_LBSPPM0_LPA0_LPB32_LPM0_LRVW8_LWPMn1_MIAV0_MIWT8_8_MO40_NTn1_NTA0_NTB0_NTC0_NTD0_NTM0_NEPBS0_NLCA1_NLCB1_ONLL1_PGR2_PLR0_PKA1_SIA3_SS1_SU0_SUM0_SUS32_SPO0_SRVW0_SSO0_SVW8_SK3_SKXCCM8_TLDS0_ULSGRO0_USL1_UIOFGRO0_USFGRO0_VSn1_VWA8_VWB2_WSGRA0_WSGRB0_WS64_WG32_8_1_WGM1_WGMXCC1_WGMXCCGn1
    SolutionIndex: 8
    SolutionNameMin: Cijk_Ailk_Bjlk_I8_BH_UserArgs_MT256x256x32_MI16x16x1_SN_LDSB0_AFC0_AFEM1_AFEM1_ASEM1_CLR0_CADS0_DTVA0_DTVB0_EPS0_FDSI0_GRPM1_GRVWA8_GRVWB8_GSU0_GSUAMB_GSUC0_GSUWGMRR0_GLS0_ISA942_IU1_K1_LBSPPA2048_LBSPPB2048_LBSPPM0_LPA0_LPB0_LPM0_LRVW8_LWPMn1_MIAV0_MIWT8_8_MO40_NTn1_NTA0_NTB0_NTC0_NTD0_NTM0_NEPBS0_NLCA1_NLCB1_ONLL1_PGR2_PLR0_PKA1_SIA3_SS1_SU0_SUM0_SUS32_SPO0_SRVW0_SSO0_SVW8_SK3_SKXCCM8_TLDS0_ULSGRO0_USL1_UIOFGRO0_USFGRO0_VSn1_VWA8_VWB8_WSGRA0_WSGRB0_WS64_WG32_8_1_WGM1_WGMXCC1_WGMXCCGn1
    SolutionIndex: 9
    SolutionNameMin: Cijk_Ailk_Bjlk_I8_BH_UserArgs_MT256x256x32_MI16x16x1_SN_LDSB0_AFC0_AFEM1_AFEM1_ASEM1_CLR0_CADS0_DTVA0_DTVB0_EPS0_FDSI0_GRPM1_GRVWA4_GRVWB4_GSU0_GSUAMB_GSUC0_GSUWGMRR0_GLS0_ISA942_IU1_K1_LBSPPA2048_LBSPPB2048_LBSPPM0_LPA0_LPB64_LPM0_LRVW8_LWPMn1_MIAV0_MIWT8_8_MO40_NTn1_NTA0_NTB0_NTC0_NTD0_NTM0_NEPBS0_NLCA1_NLCB1_ONLL1_PGR2_PLR0_PKA1_SIA3_SS1_SU0_SUM0_SUS32_SPO0_SRVW0_SSO0_SVW8_SK3_SKXCCM8_TLDS0_ULSGRO0_USL1_UIOFGRO0_USFGRO0_VSn1_VWA8_VWB4_WSGRA0_WSGRB0_WS64_WG32_8_1_WGM4_WGMXCC1_WGMXCCGn1
    SolutionIndex: 10
    SolutionNameMin: Cijk_Ailk_Bjlk_I8_BH_UserArgs_MT256x256x32_MI16x16x1_SN_LDSB0_AFC0_AFEM1_AFEM1_ASEM1_CLR0_CADS0_DTVA0_DTVB0_EPS0_FDSI0_GRPM1_GRVWA8_GRVWB4_GSU0_GSUAMB_GSUC0_GSUWGMRR0_GLS0_ISA942_IU1_K1_LBSPPA2048_LBSPPB2048_LBSPPM0_LPA0_LPB64_LPM0_LRVW8_LWPMn1_MIAV0_MIWT8_8_MO40_NTn1_NTA0_NTB0_NTC0_NTD0_NTM0_NEPBS0_NLCA1_NLCB1_ONLL1_PGR2_PLR0_PKA1_SIA3_SS1_SU0_SUM0_SUS32_SPO0_SRVW0_SSO0_SVW8_SK3_SKXCCM8_TLDS0_ULSGRO0_USL1_UIOFGRO0_USFGRO0_VSn1_VWA8_VWB4_WSGRA0_WSGRB0_WS64_WG32_8_1_WGM4_WGMXCC1_WGMXCCGn1
    SolutionIndex: 11
    SolutionNameMin: Cijk_Ailk_Bjlk_I8_BH_UserArgs_MT256x256x32_MI16x16x1_SN_LDSB0_AFC0_AFEM1_AFEM1_ASEM1_CLR0_CADS0_DTVA0_DTVB0_EPS0_FDSI0_GRPM1_GRVWA8_GRVWB4_GSU0_GSUAMB_GSUC0_GSUWGMRR0_GLS0_ISA942_IU1_K1_LBSPPA2048_LBSPPB2048_LBSPPM0_LPA0_LPB0_LPM0_LRVW8_LWPMn1_MIAV0_MIWT8_8_MO40_NTn1_NTA0_NTB0_NTC0_NTD0_NTM0_NEPBS0_NLCA1_NLCB1_ONLL1_PGR2_PLR0_PKA1_SIA3_SS1_SU0_SUM0_SUS32_SPO0_SRVW0_SSO0_SVW8_SK3_SKXCCM8_TLDS0_ULSGRO0_USL1_UIOFGRO0_USFGRO0_VSn1_VWA8_VWB8_WSGRA0_WSGRB0_WS64_WG32_8_1_WGM4_WGMXCC1_WGMXCCGn1
    SolutionIndex: 12
    SolutionNameMin: Cijk_Ailk_Bjlk_I8_BH_UserArgs_MT256x256x32_MI16x16x1_SN_LDSB0_AFC0_AFEM1_AFEM1_ASEM1_CLR0_CADS0_DTVA0_DTVB0_EPS0_FDSI0_GRPM1_GRVWA8_GRVWB8_GSU0_GSUAMB_GSUC0_GSUWGMRR0_GLS0_ISA942_IU1_K1_LBSPPA2048_LBSPPB2048_LBSPPM0_LPA0_LPB0_LPM0_LRVW8_LWPMn1_MIAV0_MIWT8_8_MO40_NTn1_NTA0_NTB0_NTC0_NTD0_NTM0_NEPBS0_NLCA1_NLCB1_ONLL1_PGR2_PLR0_PKA1_SIA3_SS1_SU0_SUM0_SUS32_SPO0_SRVW0_SSO0_SVW8_SK3_SKXCCM8_TLDS0_ULSGRO0_USL1_UIOFGRO0_USFGRO0_VSn1_VWA8_VWB8_WSGRA0_WSGRB0_WS64_WG32_8_1_WGM4_WGMXCC1_WGMXCCGn1
    SolutionIndex: 13
    SolutionNameMin: Cijk_Ailk_Bjlk_I8_BH_UserArgs_MT256x256x32_MI16x16x1_SN_LDSB0_AFC0_AFEM1_AFEM1_ASEM1_CLR0_CADS0_DTVA0_DTVB0_EPS0_FDSI0_GRPM1_GRVWA4_GRVWB4_GSU0_GSUAMB_GSUC0_GSUWGMRR0_GLS0_ISA942_IU1_K1_LBSPPA2048_LBSPPB2048_LBSPPM0_LPA0_LPB64_LPM0_LRVW8_LWPMn1_MIAV0_MIWT8_8_MO40_NTn1_NTA0_NTB0_NTC0_NTD0_NTM0_NEPBS0_NLCA1_NLCB1_ONLL1_PGR2_PLR0_PKA1_SIA3_SS1_SU0_SUM0_SUS32_SPO0_SRVW0_SSO0_SVW8_SK3_SKXCCM8_TLDS0_ULSGRO0_USL1_UIOFGRO0_USFGRO0_VSn1_VWA8_VWB4_WSGRA0_WSGRB0_WS64_WG32_8_1_WGM8_WGMXCC1_WGMXCCGn1
    SolutionIndex: 14
    SolutionNameMin: Cijk_Ailk_Bjlk_I8_BH_UserArgs_MT256x256x32_MI16x16x1_SN_LDSB0_AFC0_AFEM1_AFEM1_ASEM1_CLR0_CADS0_DTVA0_DTVB0_EPS0_FDSI0_GRPM1_GRVWA4_GRVWB4_GSU0_GSUAMB_GSUC0_GSUWGMRR0_GLS0_ISA942_IU1_K1_LBSPPA2048_LBSPPB2048_LBSPPM0_LPA0_LPB0_LPM0_LRVW8_LWPMn1_MIAV0_MIWT8_8_MO40_NTn1_NTA0_NTB0_NTC0_NTD0_NTM0_NEPBS0_NLCA1_NLCB1_ONLL1_PGR2_PLR0_PKA1_SIA3_SS1_SU0_SUM0_SUS32_SPO0_SRVW0_SSO0_SVW8_SK3_SKXCCM8_TLDS0_ULSGRO0_USL1_UIOFGRO0_USFGRO0_VSn1_VWA8_VWB8_WSGRA0_WSGRB0_WS64_WG32_8_1_WGM8_WGMXCC1_WGMXCCGn1
    SolutionIndex: 15
    SolutionNameMin: Cijk_Ailk_Bjlk_I8_BH_UserArgs_MT256x256x32_MI16x16x1_SN_LDSB0_AFC0_AFEM1_AFEM1_ASEM1_CLR0_CADS0_DTVA0_DTVB0_EPS0_FDSI0_GRPM1_GRVWA4_GRVWB8_GSU0_GSUAMB_GSUC0_GSUWGMRR0_GLS0_ISA942_IU1_K1_LBSPPA2048_LBSPPB2048_LBSPPM0_LPA0_LPB64_LPM0_LRVW8_LWPMn1_MIAV0_MIWT8_8_MO40_NTn1_NTA0_NTB0_NTC0_NTD0_NTM0_NEPBS0_NLCA1_NLCB1_ONLL1_PGR2_PLR0_PKA1_SIA3_SS1_SU0_SUM0_SUS32_SPO0_SRVW0_SSO0_SVW8_SK3_SKXCCM8_TLDS0_ULSGRO0_USL1_UIOFGRO0_USFGRO0_VSn1_VWA8_VWB4_WSGRA0_WSGRB0_WS64_WG32_8_1_WGM8_WGMXCC1_WGMXCCGn1
    SolutionIndex: 16
    SolutionNameMin: Cijk_Ailk_Bjlk_I8_BH_UserArgs_MT128x256x32_MI16x16x1_SN_LDSB0_AFC0_AFEM1_AFEM1_ASEM1_CLR0_CADS0_DTVA0_DTVB0_EPS0_FDSI0_GRPM1_GRVWA4_GRVWB8_GSU0_GSUAMB_GSUC0_GSUWGMRR0_GLS0_ISA942_IU1_K1_LBSPPA1024_LBSPPB2048_LBSPPM0_LPA64_LPB64_LPM0_LRVW8_LWPMn1_MIAV0_MIWT4_8_MO40_NTn1_NTA0_NTB0_NTC0_NTD0_NTM0_NEPBS0_NLCA1_NLCB1_ONLL1_PGR2_PLR0_PKA1_SIA3_SS1_SU0_SUM0_SUS32_SPO0_SRVW0_SSO0_SVW4_SK3_SKXCCM8_TLDS0_ULSGRO0_USL1_UIOFGRO0_USFGRO0_VSn1_VWA4_VWB4_WSGRA0_WSGRB0_WS64_WG32_8_1_WGM1_WGMXCC1_WGMXCCGn1
    SolutionIndex: 17
    SolutionNameMin: Cijk_Ailk_Bjlk_I8_BH_UserArgs_MT128x256x32_MI16x16x1_SN_LDSB0_AFC0_AFEM1_AFEM1_ASEM1_CLR0_CADS0_DTVA0_DTVB0_EPS0_FDSI0_GRPM1_GRVWA4_GRVWB8_GSU0_GSUAMB_GSUC0_GSUWGMRR0_GLS0_ISA942_IU1_K1_LBSPPA1024_LBSPPB2048_LBSPPM0_LPA64_LPB64_LPM0_LRVW8_LWPMn1_MIAV0_MIWT4_8_MO40_NTn1_NTA0_NTB0_NTC0_NTD0_NTM0_NEPBS0_NLCA1_NLCB1_ONLL1_PGR2_PLR0_PKA1_SIA3_SS1_SU0_SUM0_SUS32_SPO0_SRVW0_SSO0_SVW4_SK3_SKXCCM8_TLDS0_ULSGRO0_USL1_UIOFGRO0_USFGRO0_VSn1_VWA4_VWB4_WSGRA0_WSGRB0_WS64_WG32_8_1_WGM8_WGMXCC1_WGMXCCGn1
    SolutionIndex: 18
    SolutionNameMin: Cijk_Ailk_Bjlk_I8_BH_UserArgs_MT256x128x32_MI16x16x1_SN_LDSB0_AFC0_AFEM1_AFEM1_ASEM1_CLR0_CADS0_DTVA0_DTVB0_EPS0_FDSI0_GRPM1_GRVWA4_GRVWB4_GSU0_GSUAMB_GSUC0_GSUWGMRR0_GLS0_ISA942_IU1_K1_LBSPPA2048_LBSPPB1024_LBSPPM0_LPA0_LPB64_LPM0_LRVW8_LWPMn1_MIAV0_MIWT8_4_MO40_NTn1_NTA0_NTB0_NTC0_NTD0_NTM0_NEPBS0_NLCA1_NLCB1_ONLL1_PGR2_PLR0_PKA1_SIA3_SS1_SU0_SUM0_SUS32_SPO0_SRVW0_SSO0_SVW8_SK3_SKXCCM8_TLDS0_ULSGRO0_USL1_UIOFGRO0_USFGRO0_VSn1_VWA8_VWB4_WSGRA0_WSGRB0_WS64_WG32_8_1_WGM1_WGMXCC1_WGMXCCGn1
    SolutionIndex: 19
    SolutionNameMin: Cijk_Ailk_Bjlk_I8_BH_UserArgs_MT256x128x32_MI16x16x1_SN_LDSB0_AFC0_AFEM1_AFEM1_ASEM1_CLR0_CADS0_DTVA0_DTVB0_EPS0_FDSI0_GRPM1_GRVWA4_GRVWB8_GSU0_GSUAMB_GSUC0_GSUWGMRR0_GLS0_ISA942_IU1_K1_LBSPPA2048_LBSPPB1024_LBSPPM0_LPA64_LPB16_LPM0_LRVW8_LWPMn1_MIAV0_MIWT8_4_MO40_NTn1_NTA0_NTB0_NTC0_NTD0_NTM0_NEPBS0_NLCA1_NLCB1_ONLL1_PGR2_PLR0_PKA1_SIA3_SS1_SU0_SUM0_SUS32_SPO0_SRVW0_SSO0_SVW4_SK3_SKXCCM8_TLDS0_ULSGRO0_USL1_UIOFGRO0_USFGRO0_VSn1_VWA4_VWB1_WSGRA0_WSGRB0_WS64_WG32_8_1_WGM1_WGMXCC1_WGMXCCGn1
    SolutionIndex: 20
    SolutionNameMin: Cijk_Ailk_Bjlk_I8_BH_UserArgs_MT128x128x32_MI16x16x1_SN_LDSB0_AFC0_AFEM1_AFEM1_ASEM1_CLR0_CADS0_DTVA0_DTVB0_EPS0_FDSI0_GRPM1_GRVWA4_GRVWB8_GSU0_GSUAMB_GSUC0_GSUWGMRR0_GLS0_ISA942_IU1_K1_LBSPPA1024_LBSPPB1024_LBSPPM0_LPA64_LPB64_LPM0_LRVW8_LWPMn1_MIAV0_MIWT4_4_MO40_NTn1_NTA0_NTB0_NTC0_NTD0_NTM0_NEPBS0_NLCA1_NLCB1_ONLL1_PGR2_PLR0_PKA1_SIA3_SS1_SU0_SUM0_SUS32_SPO0_SRVW0_SSO0_SVW4_SK3_SKXCCM8_TLDS0_ULSGRO0_USL1_UIOFGRO0_USFGRO0_VSn1_VWA4_VWB4_WSGRA0_WSGRB0_WS64_WG32_8_1_WGM1_WGMXCC1_WGMXCCGn1
    SolutionIndex: 21
    SolutionNameMin: Cijk_Ailk_Bjlk_I8_BH_UserArgs_MT64x64x32_MI16x16x1_SN_LDSB0_AFC0_AFEM1_AFEM1_ASEM1_CLR0_CADS0_DTVA0_DTVB0_EPS0_FDSI0_GRPM1_GRVWA2_GRVWB2_GSU0_GSUAMB_GSUC0_GSUWGMRR0_GLS0_ISA942_IU1_K1_LBSPPA512_LBSPPB512_LBSPPM0_LPA32_LPB16_LPM0_LRVW8_LWPMn1_MIAV0_MIWT2_2_MO40_NTn1_NTA0_NTB0_NTC0_NTD0_NTM0_NEPBS0_NLCA1_NLCB1_ONLL1_PGR2_PLR0_PKA1_SIA3_SS1_SU0_SUM0_SUS32_SPO0_SRVW0_SSO0_SVW2_SK3_SKXCCM8_TLDS0_ULSGRO0_USL1_UIOFGRO0_USFGRO0_VSn1_VWA2_VWB1_WSGRA0_WSGRB0_WS64_WG32_8_1_WGM4_WGMXCC1_WGMXCCGn1
    SolutionIndex: 22
    SolutionNameMin: Cijk_Ailk_Bjlk_I8_BH_UserArgs_MT256x256x64_MI16x16x1_SN_LDSB1_AFC0_AFEM1_AFEM1_ASEM1_CLR1_CADS0_DTVA0_DTVB0_EPS0_FDSI0_GRPM1_GRVWA4_GRVWB4_GSU0_GSUAMB_GSUC0_GSUWGMRR0_GLS0_ISA942_IU1_K1_LBSPPA2048_LBSPPB2048_LBSPPM0_LPA64_LPB32_LPM0_LRVW8_LWPMn1_MIAV0_MIWT8_8_MO40_NTn1_NTA0_NTB0_NTC0_NTD0_NTM0_NEPBS0_NLCA1_NLCB1_ONLL1_PGR2_PLR1_PKA1_SIA3_SS1_SU0_SUM0_SUS64_SPO0_SRVW0_SSO0_SVW4_SK3_SKXCCM8_TLDS0_ULSGRO0_USL1_UIOFGRO0_USFGRO0_VSn1_VWA4_VWB2_WSGRA0_WSGRB0_WS64_WG32_8_1_WGM1_WGMXCC1_WGMXCCGn1
    SolutionIndex: 23
    SolutionNameMin: Cijk_Ailk_Bjlk_I8_BH_UserArgs_MT256x256x64_MI16x16x1_SN_LDSB1_AFC0_AFEM1_AFEM1_ASEM1_CLR1_CADS0_DTVA0_DTVB0_EPS0_FDSI0_GRPM1_GRVWA4_GRVWB4_GSU0_GSUAMB_GSUC0_GSUWGMRR0_GLS0_ISA942_IU1_K1_LBSPPA2048_LBSPPB2048_LBSPPM0_LPA0_LPB64_LPM0_LRVW8_LWPMn1_MIAV0_MIWT8_8_MO40_NTn1_NTA0_NTB0_NTC0_NTD0_NTM0_NEPBS0_NLCA1_NLCB1_ONLL1_PGR2_PLR1_PKA1_SIA3_SS1_SU0_SUM0_SUS64_SPO0_SRVW0_SSO0_SVW8_SK3_SKXCCM8_TLDS0_ULSGRO0_USL1_UIOFGRO0_USFGRO0_VSn1_VWA8_VWB4_WSGRA0_WSGRB0_WS64_WG32_8_1_WGM1_WGMXCC1_WGMXCCGn1
    SolutionIndex: 24
    SolutionNameMin: Cijk_Ailk_Bjlk_I8_BH_UserArgs_MT256x256x64_MI16x16x1_SN_LDSB1_AFC0_AFEM1_AFEM1_ASEM1_CLR1_CADS0_DTVA0_DTVB0_EPS0_FDSI0_GRPM1_GRVWA4_GRVWB4_GSU0_GSUAMB_GSUC0_GSUWGMRR0_GLS0_ISA942_IU1_K1_LBSPPA2048_LBSPPB2048_LBSPPM0_LPA64_LPB0_LPM0_LRVW8_LWPMn1_MIAV0_MIWT8_8_MO40_NTn1_NTA0_NTB0_NTC0_NTD0_NTM0_NEPBS0_NLCA1_NLCB1_ONLL1_PGR2_PLR1_PKA1_SIA3_SS1_SU0_SUM0_SUS64_SPO0_SRVW0_SSO0_SVW4_SK3_SKXCCM8_TLDS0_ULSGRO0_USL1_UIOFGRO0_USFGRO0_VSn1_VWA4_VWB8_WSGRA0_WSGRB0_WS64_WG32_8_1_WGM1_WGMXCC1_WGMXCCGn1
    SolutionIndex: 25
    SolutionNameMin: Cijk_Ailk_Bjlk_I8_BH_UserArgs_MT256x256x64_MI16x16x1_SN_LDSB0_AFC0_AFEM1_AFEM1_ASEM1_CLR1_CADS0_DTVA0_DTVB0_EPS0_FDSI0_GRPM1_GRVWA4_GRVWB4_GSU0_GSUAMB_GSUC0_GSUWGMRR0_GLS0_ISA942_IU1_K1_LBSPPA2048_LBSPPB2048_LBSPPM0_LPA0_LPB0_LPM0_LRVW8_LWPMn1_MIAV0_MIWT8_8_MO40_NTn1_NTA0_NTB0_NTC0_NTD0_NTM0_NEPBS0_NLCA1_NLCB1_ONLL1_PGR2_PLR1_PKA1_SIA3_SS1_SU0_SUM0_SUS64_SPO0_SRVW0_SSO0_SVW8_SK3_SKXCCM8_TLDS0_ULSGRO0_USL1_UIOFGRO0_USFGRO0_VSn1_VWA8_VWB8_WSGRA0_WSGRB0_WS64_WG32_8_1_WGM1_WGMXCC1_WGMXCCGn1
    SolutionIndex: 26
    SolutionNameMin: Cijk_Ailk_Bjlk_I8_BH_UserArgs_MT256x256x64_MI16x16x1_SN_LDSB1_AFC0_AFEM1_AFEM1_ASEM1_CLR1_CADS0_DTVA0_DTVB0_EPS0_FDSI0_GRPM1_GRVWA8_GRVWB4_GSU0_GSUAMB_GSUC0_GSUWGMRR0_GLS0_ISA942_IU1_K1_LBSPPA2048_LBSPPB2048_LBSPPM0_LPA0_LPB32_LPM0_LRVW8_LWPMn1_MIAV0_MIWT8_8_MO40_NTn1_NTA0_NTB0_NTC0_NTD0_NTM0_NEPBS0_NLCA1_NLCB1_ONLL1_PGR2_PLR1_PKA1_SIA3_SS1_SU0_SUM0_SUS64_SPO0_SRVW0_SSO0_SVW8_SK3_SKXCCM8_TLDS0_ULSGRO0_USL1_UIOFGRO0_USFGRO0_VSn1_VWA8_VWB2_WSGRA0_WSGRB0_WS64_WG32_8_1_WGM1_WGMXCC1_WGMXCCGn1
    SolutionIndex: 27
    SolutionNameMin: Cijk_Ailk_Bjlk_I8_BH_UserArgs_MT256x256x64_MI16x16x1_SN_LDSB1_AFC0_AFEM1_AFEM1_ASEM1_CLR1_CADS0_DTVA0_DTVB0_EPS0_FDSI0_GRPM1_GRVWA8_GRVWB4_GSU0_GSUAMB_GSUC0_GSUWGMRR0_GLS0_ISA942_IU1_K1_LBSPPA2048_LBSPPB2048_LBSPPM0_LPA64_LPB64_LPM0_LRVW8_LWPMn1_MIAV0_MIWT8_8_MO40_NTn1_NTA0_NTB0_NTC0_NTD0_NTM0_NEPBS0_NLCA1_NLCB1_ONLL1_PGR2_PLR1_PKA1_SIA3_SS1_SU0_SUM0_SUS64_SPO0_SRVW0_SSO0_SVW4_SK3_SKXCCM8_TLDS0_ULSGRO0_USL1_UIOFGRO0_USFGRO0_VSn1_VWA4_VWB4_WSGRA0_WSGRB0_WS64_WG32_8_1_WGM1_WGMXCC1_WGMXCCGn1
    SolutionIndex: 28
    SolutionNameMin: Cijk_Ailk_Bjlk_I8_BH_UserArgs_MT256x256x64_MI16x16x1_SN_LDSB1_AFC0_AFEM1_AFEM1_ASEM1_CLR1_CADS0_DTVA0_DTVB0_EPS0_FDSI0_GRPM1_GRVWA8_GRVWB4_GSU0_GSUAMB_GSUC0_GSUWGMRR0_GLS0_ISA942_IU1_K1_LBSPPA2048_LBSPPB2048_LBSPPM0_LPA0_LPB64_LPM0_LRVW8_LWPMn1_MIAV0_MIWT8_8_MO40_NTn1_NTA0_NTB0_NTC0_NTD0_NTM0_NEPBS0_NLCA1_NLCB1_ONLL1_PGR2_PLR1_PKA1_SIA3_SS1_SU0_SUM0_SUS64_SPO0_SRVW0_SSO0_SVW8_SK3_SKXCCM8_TLDS0_ULSGRO0_USL1_UIOFGRO0_USFGRO0_VSn1_VWA8_VWB4_WSGRA0_WSGRB0_WS64_WG32_8_1_WGM1_WGMXCC1_WGMXCCGn1
    SolutionIndex: 29
    SolutionNameMin: Cijk_Ailk_Bjlk_I8_BH_UserArgs_MT256x256x64_MI16x16x1_SN_LDSB1_AFC0_AFEM1_AFEM1_ASEM1_CLR1_CADS0_DTVA0_DTVB0_EPS0_FDSI0_GRPM1_GRVWA8_GRVWB4_GSU0_GSUAMB_GSUC0_GSUWGMRR0_GLS0_ISA942_IU1_K1_LBSPPA2048_LBSPPB2048_LBSPPM0_LPA64_LPB0_LPM0_LRVW8_LWPMn1_MIAV0_MIWT8_8_MO40_NTn1_NTA0_NTB0_NTC0_NTD0_NTM0_NEPBS0_NLCA1_NLCB1_ONLL1_PGR2_PLR1_PKA1_SIA3_SS1_SU0_SUM0_SUS64_SPO0_SRVW0_SSO0_SVW4_SK3_SKXCCM8_TLDS0_ULSGRO0_USL1_UIOFGRO0_USFGRO0_VSn1_VWA4_VWB8_WSGRA0_WSGRB0_WS64_WG32_8_1_WGM1_WGMXCC1_WGMXCCGn1
    SolutionIndex: 30
    SolutionNameMin: Cijk_Ailk_Bjlk_I8_BH_UserArgs_MT256x256x64_MI16x16x1_SN_LDSB0_AFC0_AFEM1_AFEM1_ASEM1_CLR1_CADS0_DTVA0_DTVB0_EPS0_FDSI0_GRPM1_GRVWA8_GRVWB4_GSU0_GSUAMB_GSUC0_GSUWGMRR0_GLS0_ISA942_IU1_K1_LBSPPA2048_LBSPPB2048_LBSPPM0_LPA0_LPB0_LPM0_LRVW8_LWPMn1_MIAV0_MIWT8_8_MO40_NTn1_NTA0_NTB0_NTC0_NTD0_NTM0_NEPBS0_NLCA1_NLCB1_ONLL1_PGR2_PLR1_PKA1_SIA3_SS1_SU0_SUM0_SUS64_SPO0_SRVW0_SSO0_SVW8_SK3_SKXCCM8_TLDS0_ULSGRO0_USL1_UIOFGRO0_USFGRO0_VSn1_VWA8_VWB8_WSGRA0_WSGRB0_WS64_WG32_8_1_WGM1_WGMXCC1_WGMXCCGn1
    SolutionIndex: 31
    SolutionNameMin: Cijk_Ailk_Bjlk_I8_BH_UserArgs_MT256x256x64_MI16x16x1_SN_LDSB1_AFC0_AFEM1_AFEM1_ASEM1_CLR1_CADS0_DTVA0_DTVB0_EPS0_FDSI0_GRPM1_GRVWA4_GRVWB8_GSU0_GSUAMB_GSUC0_GSUWGMRR0_GLS0_ISA942_IU1_K1_LBSPPA2048_LBSPPB2048_LBSPPM0_LPA0_LPB64_LPM0_LRVW8_LWPMn1_MIAV0_MIWT8_8_MO40_NTn1_NTA0_NTB0_NTC0_NTD0_NTM0_NEPBS0_NLCA1_NLCB1_ONLL1_PGR2_PLR1_PKA1_SIA3_SS1_SU0_SUM0_SUS64_SPO0_SRVW0_SSO0_SVW8_SK3_SKXCCM8_TLDS0_ULSGRO0_USL1_UIOFGRO0_USFGRO0_VSn1_VWA8_VWB4_WSGRA0_WSGRB0_WS64_WG32_8_1_WGM1_WGMXCC1_WGMXCCGn1
    SolutionIndex: 32
    SolutionNameMin: Cijk_Ailk_Bjlk_I8_BH_UserArgs_MT256x256x64_MI16x16x1_SN_LDSB1_AFC0_AFEM1_AFEM1_ASEM1_CLR1_CADS0_DTVA0_DTVB0_EPS0_FDSI0_GRPM1_GRVWA4_GRVWB8_GSU0_GSUAMB_GSUC0_GSUWGMRR0_GLS0_ISA942_IU1_K1_LBSPPA2048_LBSPPB2048_LBSPPM0_LPA64_LPB0_LPM0_LRVW8_LWPMn1_MIAV0_MIWT8_8_MO40_NTn1_NTA0_NTB0_NTC0_NTD0_NTM0_NEPBS0_NLCA1_NLCB1_ONLL1_PGR2_PLR1_PKA1_SIA3_SS1_SU0_SUM0_SUS64_SPO0_SRVW0_SSO0_SVW4_SK3_SKXCCM8_TLDS0_ULSGRO0_USL1_UIOFGRO0_USFGRO0_VSn1_VWA4_VWB8_WSGRA0_WSGRB0_WS64_WG32_8_1_WGM1_WGMXCC1_WGMXCCGn1
    SolutionIndex: 33
    SolutionNameMin: Cijk_Ailk_Bjlk_I8_BH_UserArgs_MT256x256x64_MI16x16x1_SN_LDSB0_AFC0_AFEM1_AFEM1_ASEM1_CLR1_CADS0_DTVA0_DTVB0_EPS0_FDSI0_GRPM1_GRVWA4_GRVWB8_GSU0_GSUAMB_GSUC0_GSUWGMRR0_GLS0_ISA942_IU1_K1_LBSPPA2048_LBSPPB2048_LBSPPM0_LPA0_LPB0_LPM0_LRVW8_LWPMn1_MIAV0_MIWT8_8_MO40_NTn1_NTA0_NTB0_NTC0_NTD0_NTM0_NEPBS0_NLCA1_NLCB1_ONLL1_PGR2_PLR1_PKA1_SIA3_SS1_SU0_SUM0_SUS64_SPO0_SRVW0_SSO0_SVW8_SK3_SKXCCM8_TLDS0_ULSGRO0_USL1_UIOFGRO0_USFGRO0_VSn1_VWA8_VWB8_WSGRA0_WSGRB0_WS64_WG32_8_1_WGM1_WGMXCC1_WGMXCCGn1
    SolutionIndex: 34
    SolutionNameMin: Cijk_Ailk_Bjlk_I8_BH_UserArgs_MT256x256x64_MI16x16x1_SN_LDSB1_AFC0_AFEM1_AFEM1_ASEM1_CLR1_CADS0_DTVA0_DTVB0_EPS0_FDSI0_GRPM1_GRVWA8_GRVWB8_GSU0_GSUAMB_GSUC0_GSUWGMRR0_GLS0_ISA942_IU1_K1_LBSPPA2048_LBSPPB2048_LBSPPM0_LPA0_LPB32_LPM0_LRVW8_LWPMn1_MIAV0_MIWT8_8_MO40_NTn1_NTA0_NTB0_NTC0_NTD0_NTM0_NEPBS0_NLCA1_NLCB1_ONLL1_PGR2_PLR1_PKA1_SIA3_SS1_SU0_SUM0_SUS64_SPO0_SRVW0_SSO0_SVW8_SK3_SKXCCM8_TLDS0_ULSGRO0_USL1_UIOFGRO0_USFGRO0_VSn1_VWA8_VWB2_WSGRA0_WSGRB0_WS64_WG32_8_1_WGM1_WGMXCC1_WGMXCCGn1
    SolutionIndex: 35
    SolutionNameMin: Cijk_Ailk_Bjlk_I8_BH_UserArgs_MT256x256x64_MI16x16x1_SN_LDSB1_AFC0_AFEM1_AFEM1_ASEM1_CLR1_CADS0_DTVA0_DTVB0_EPS0_FDSI0_GRPM1_GRVWA4_GRVWB4_GSU0_GSUAMB_GSUC0_GSUWGMRR0_GLS0_ISA942_IU1_K1_LBSPPA2048_LBSPPB2048_LBSPPM0_LPA0_LPB64_LPM0_LRVW8_LWPMn1_MIAV0_MIWT8_8_MO40_NTn1_NTA0_NTB0_NTC0_NTD0_NTM0_NEPBS0_NLCA1_NLCB1_ONLL1_PGR2_PLR1_PKA1_SIA3_SS1_SU0_SUM0_SUS64_SPO0_SRVW0_SSO0_SVW8_SK3_SKXCCM8_TLDS0_ULSGRO0_USL1_UIOFGRO0_USFGRO0_VSn1_VWA8_VWB4_WSGRA0_WSGRB0_WS64_WG32_8_1_WGM4_WGMXCC1_WGMXCCGn1
    SolutionIndex: 36
    SolutionNameMin: Cijk_Ailk_Bjlk_I8_BH_UserArgs_MT256x256x64_MI16x16x1_SN_LDSB1_AFC0_AFEM1_AFEM1_ASEM1_CLR1_CADS0_DTVA0_DTVB0_EPS0_FDSI0_GRPM1_GRVWA4_GRVWB4_GSU0_GSUAMB_GSUC0_GSUWGMRR0_GLS0_ISA942_IU1_K1_LBSPPA2048_LBSPPB2048_LBSPPM0_LPA64_LPB0_LPM0_LRVW8_LWPMn1_MIAV0_MIWT8_8_MO40_NTn1_NTA0_NTB0_NTC0_NTD0_NTM0_NEPBS0_NLCA1_NLCB1_ONLL1_PGR2_PLR1_PKA1_SIA3_SS1_SU0_SUM0_SUS64_SPO0_SRVW0_SSO0_SVW4_SK3_SKXCCM8_TLDS0_ULSGRO0_USL1_UIOFGRO0_USFGRO0_VSn1_VWA4_VWB8_WSGRA0_WSGRB0_WS64_WG32_8_1_WGM4_WGMXCC1_WGMXCCGn1
    SolutionIndex: 37
    SolutionNameMin: Cijk_Ailk_Bjlk_I8_BH_UserArgs_MT256x256x64_MI16x16x1_SN_LDSB0_AFC0_AFEM1_AFEM1_ASEM1_CLR1_CADS0_DTVA0_DTVB0_EPS0_FDSI0_GRPM1_GRVWA4_GRVWB4_GSU0_GSUAMB_GSUC0_GSUWGMRR0_GLS0_ISA942_IU1_K1_LBSPPA2048_LBSPPB2048_LBSPPM0_LPA0_LPB0_LPM0_LRVW8_LWPMn1_MIAV0_MIWT8_8_MO40_NTn1_NTA0_NTB0_NTC0_NTD0_NTM0_NEPBS0_NLCA1_NLCB1_ONLL1_PGR2_PLR1_PKA1_SIA3_SS1_SU0_SUM0_SUS64_SPO0_SRVW0_SSO0_SVW8_SK3_SKXCCM8_TLDS0_ULSGRO0_USL1_UIOFGRO0_USFGRO0_VSn1_VWA8_VWB8_WSGRA0_WSGRB0_WS64_WG32_8_1_WGM4_WGMXCC1_WGMXCCGn1
    SolutionIndex: 38
    SolutionNameMin: Cijk_Ailk_Bjlk_I8_BH_UserArgs_MT256x256x64_MI16x16x1_SN_LDSB1_AFC0_AFEM1_AFEM1_ASEM1_CLR1_CADS0_DTVA0_DTVB0_EPS0_FDSI0_GRPM1_GRVWA8_GRVWB4_GSU0_GSUAMB_GSUC0_GSUWGMRR0_GLS0_ISA942_IU1_K1_LBSPPA2048_LBSPPB2048_LBSPPM0_LPA0_LPB32_LPM0_LRVW8_LWPMn1_MIAV0_MIWT8_8_MO40_NTn1_NTA0_NTB0_NTC0_NTD0_NTM0_NEPBS0_NLCA1_NLCB1_ONLL1_PGR2_PLR1_PKA1_SIA3_SS1_SU0_SUM0_SUS64_SPO0_SRVW0_SSO0_SVW8_SK3_SKXCCM8_TLDS0_ULSGRO0_USL1_UIOFGRO0_USFGRO0_VSn1_VWA8_VWB2_WSGRA0_WSGRB0_WS64_WG32_8_1_WGM4_WGMXCC1_WGMXCCGn1
    SolutionIndex: 39
    SolutionNameMin: Cijk_Ailk_Bjlk_I8_BH_UserArgs_MT256x256x64_MI16x16x1_SN_LDSB1_AFC0_AFEM1_AFEM1_ASEM1_CLR1_CADS0_DTVA0_DTVB0_EPS0_FDSI0_GRPM1_GRVWA8_GRVWB4_GSU0_GSUAMB_GSUC0_GSUWGMRR0_GLS0_ISA942_IU1_K1_LBSPPA2048_LBSPPB2048_LBSPPM0_LPA0_LPB64_LPM0_LRVW8_LWPMn1_MIAV0_MIWT8_8_MO40_NTn1_NTA0_NTB0_NTC0_NTD0_NTM0_NEPBS0_NLCA1_NLCB1_ONLL1_PGR2_PLR1_PKA1_SIA3_SS1_SU0_SUM0_SUS64_SPO0_SRVW0_SSO0_SVW8_SK3_SKXCCM8_TLDS0_ULSGRO0_USL1_UIOFGRO0_USFGRO0_VSn1_VWA8_VWB4_WSGRA0_WSGRB0_WS64_WG32_8_1_WGM4_WGMXCC1_WGMXCCGn1
    SolutionIndex: 40
    SolutionNameMin: Cijk_Ailk_Bjlk_I8_BH_UserArgs_MT256x256x64_MI16x16x1_SN_LDSB0_AFC0_AFEM1_AFEM1_ASEM1_CLR1_CADS0_DTVA0_DTVB0_EPS0_FDSI0_GRPM1_GRVWA8_GRVWB4_GSU0_GSUAMB_GSUC0_GSUWGMRR0_GLS0_ISA942_IU1_K1_LBSPPA2048_LBSPPB2048_LBSPPM0_LPA0_LPB0_LPM0_LRVW8_LWPMn1_MIAV0_MIWT8_8_MO40_NTn1_NTA0_NTB0_NTC0_NTD0_NTM0_NEPBS0_NLCA1_NLCB1_ONLL1_PGR2_PLR1_PKA1_SIA3_SS1_SU0_SUM0_SUS64_SPO0_SRVW0_SSO0_SVW8_SK3_SKXCCM8_TLDS0_ULSGRO0_USL1_UIOFGRO0_USFGRO0_VSn1_VWA8_VWB8_WSGRA0_WSGRB0_WS64_WG32_8_1_WGM4_WGMXCC1_WGMXCCGn1
    SolutionIndex: 41
    SolutionNameMin: Cijk_Ailk_Bjlk_I8_BH_UserArgs_MT256x256x64_MI16x16x1_SN_LDSB0_AFC0_AFEM1_AFEM1_ASEM1_CLR1_CADS0_DTVA0_DTVB0_EPS0_FDSI0_GRPM1_GRVWA4_GRVWB8_GSU0_GSUAMB_GSUC0_GSUWGMRR0_GLS0_ISA942_IU1_K1_LBSPPA2048_LBSPPB2048_LBSPPM0_LPA0_LPB0_LPM0_LRVW8_LWPMn1_MIAV0_MIWT8_8_MO40_NTn1_NTA0_NTB0_NTC0_NTD0_NTM0_NEPBS0_NLCA1_NLCB1_ONLL1_PGR2_PLR1_PKA1_SIA3_SS1_SU0_SUM0_SUS64_SPO0_SRVW0_SSO0_SVW8_SK3_SKXCCM8_TLDS0_ULSGRO0_USL1_UIOFGRO0_USFGRO0_VSn1_VWA8_VWB8_WSGRA0_WSGRB0_WS64_WG32_8_1_WGM4_WGMXCC1_WGMXCCGn1
    SolutionIndex: 42
    SolutionNameMin: Cijk_Ailk_Bjlk_I8_BH_UserArgs_MT256x256x64_MI16x16x1_SN_LDSB0_AFC0_AFEM1_AFEM1_ASEM1_CLR0_CADS0_DTVA0_DTVB0_EPS0_FDSI0_GRPM1_GRVWA2_GRVWB4_GSU0_GSUAMB_GSUC0_GSUWGMRR0_GLS0_ISA942_IU1_K1_LBSPPA2048_LBSPPB2048_LBSPPM0_LPA0_LPB0_LPM0_LRVW8_LWPMn1_MIAV0_MIWT8_8_MO40_NTn1_NTA0_NTB0_NTC0_NTD0_NTM0_NEPBS0_NLCA1_NLCB1_ONLL1_PGR2_PLR0_PKA1_SIA3_SS1_SU0_SUM0_SUS64_SPO0_SRVW0_SSO0_SVW8_SK3_SKXCCM8_TLDS0_ULSGRO0_USL1_UIOFGRO0_USFGRO0_VSn1_VWA8_VWB8_WSGRA0_WSGRB0_WS64_WG32_8_1_WGM4_WGMXCC1_WGMXCCGn1
    SolutionIndex: 43
    SolutionNameMin: Cijk_Ailk_Bjlk_I8_BH_UserArgs_MT256x256x64_MI16x16x1_SN_LDSB0_AFC0_AFEM1_AFEM1_ASEM1_CLR0_CADS0_DTVA0_DTVB0_EPS0_FDSI0_GRPM1_GRVWA4_GRVWB4_GSU0_GSUAMB_GSUC0_GSUWGMRR0_GLS0_ISA942_IU1_K1_LBSPPA2048_LBSPPB2048_LBSPPM0_LPA0_LPB0_LPM0_LRVW8_LWPMn1_MIAV0_MIWT8_8_MO40_NTn1_NTA0_NTB0_NTC0_NTD0_NTM0_NEPBS0_NLCA1_NLCB1_ONLL1_PGR2_PLR0_PKA1_SIA3_SS1_SU0_SUM0_SUS64_SPO0_SRVW0_SSO0_SVW8_SK3_SKXCCM8_TLDS0_ULSGRO0_USL1_UIOFGRO0_USFGRO0_VSn1_VWA8_VWB8_WSGRA0_WSGRB0_WS64_WG32_8_1_WGM4_WGMXCC1_WGMXCCGn1
    SolutionIndex: 44
    SolutionNameMin: Cijk_Ailk_Bjlk_I8_BH_UserArgs_MT256x256x64_MI16x16x1_SN_LDSB1_AFC0_AFEM1_AFEM1_ASEM1_CLR1_CADS0_DTVA0_DTVB0_EPS0_FDSI0_GRPM1_GRVWA4_GRVWB4_GSU0_GSUAMB_GSUC0_GSUWGMRR0_GLS0_ISA942_IU1_K1_LBSPPA2048_LBSPPB2048_LBSPPM0_LPA64_LPB32_LPM0_LRVW8_LWPMn1_MIAV0_MIWT8_8_MO40_NTn1_NTA0_NTB0_NTC0_NTD0_NTM0_NEPBS0_NLCA1_NLCB1_ONLL1_PGR2_PLR1_PKA1_SIA3_SS1_SU0_SUM0_SUS64_SPO0_SRVW0_SSO0_SVW4_SK3_SKXCCM8_TLDS0_ULSGRO0_USL1_UIOFGRO0_USFGRO0_VSn1_VWA4_VWB2_WSGRA0_WSGRB0_WS64_WG32_8_1_WGM8_WGMXCC1_WGMXCCGn1
    SolutionIndex: 45
    SolutionNameMin: Cijk_Ailk_Bjlk_I8_BH_UserArgs_MT256x256x64_MI16x16x1_SN_LDSB1_AFC0_AFEM1_AFEM1_ASEM1_CLR1_CADS0_DTVA0_DTVB0_EPS0_FDSI0_GRPM1_GRVWA4_GRVWB4_GSU0_GSUAMB_GSUC0_GSUWGMRR0_GLS0_ISA942_IU1_K1_LBSPPA2048_LBSPPB2048_LBSPPM0_LPA0_LPB32_LPM0_LRVW8_LWPMn1_MIAV0_MIWT8_8_MO40_NTn1_NTA0_NTB0_NTC0_NTD0_NTM0_NEPBS0_NLCA1_NLCB1_ONLL1_PGR2_PLR1_PKA1_SIA3_SS1_SU0_SUM0_SUS64_SPO0_SRVW0_SSO0_SVW8_SK3_SKXCCM8_TLDS0_ULSGRO0_USL1_UIOFGRO0_USFGRO0_VSn1_VWA8_VWB2_WSGRA0_WSGRB0_WS64_WG32_8_1_WGM8_WGMXCC1_WGMXCCGn1
    SolutionIndex: 46
    SolutionNameMin: Cijk_Ailk_Bjlk_I8_BH_UserArgs_MT256x256x64_MI16x16x1_SN_LDSB1_AFC0_AFEM1_AFEM1_ASEM1_CLR1_CADS0_DTVA0_DTVB0_EPS0_FDSI0_GRPM1_GRVWA4_GRVWB4_GSU0_GSUAMB_GSUC0_GSUWGMRR0_GLS0_ISA942_IU1_K1_LBSPPA2048_LBSPPB2048_LBSPPM0_LPA64_LPB64_LPM0_LRVW8_LWPMn1_MIAV0_MIWT8_8_MO40_NTn1_NTA0_NTB0_NTC0_NTD0_NTM0_NEPBS0_NLCA1_NLCB1_ONLL1_PGR2_PLR1_PKA1_SIA3_SS1_SU0_SUM0_SUS64_SPO0_SRVW0_SSO0_SVW4_SK3_SKXCCM8_TLDS0_ULSGRO0_USL1_UIOFGRO0_USFGRO0_VSn1_VWA4_VWB4_WSGRA0_WSGRB0_WS64_WG32_8_1_WGM8_WGMXCC1_WGMXCCGn1
    SolutionIndex: 47
    SolutionNameMin: Cijk_Ailk_Bjlk_I8_BH_UserArgs_MT256x256x64_MI16x16x1_SN_LDSB1_AFC0_AFEM1_AFEM1_ASEM1_CLR1_CADS0_DTVA0_DTVB0_EPS0_FDSI0_GRPM1_GRVWA4_GRVWB4_GSU0_GSUAMB_GSUC0_GSUWGMRR0_GLS0_ISA942_IU1_K1_LBSPPA2048_LBSPPB2048_LBSPPM0_LPA0_LPB64_LPM0_LRVW8_LWPMn1_MIAV0_MIWT8_8_MO40_NTn1_NTA0_NTB0_NTC0_NTD0_NTM0_NEPBS0_NLCA1_NLCB1_ONLL1_PGR2_PLR1_PKA1_SIA3_SS1_SU0_SUM0_SUS64_SPO0_SRVW0_SSO0_SVW8_SK3_SKXCCM8_TLDS0_ULSGRO0_USL1_UIOFGRO0_USFGRO0_VSn1_VWA8_VWB4_WSGRA0_WSGRB0_WS64_WG32_8_1_WGM8_WGMXCC1_WGMXCCGn1
    SolutionIndex: 48
    SolutionNameMin: Cijk_Ailk_Bjlk_I8_BH_UserArgs_MT256x256x64_MI16x16x1_SN_LDSB1_AFC0_AFEM1_AFEM1_ASEM1_CLR1_CADS0_DTVA0_DTVB0_EPS0_FDSI0_GRPM1_GRVWA4_GRVWB4_GSU0_GSUAMB_GSUC0_GSUWGMRR0_GLS0_ISA942_IU1_K1_LBSPPA2048_LBSPPB2048_LBSPPM0_LPA64_LPB0_LPM0_LRVW8_LWPMn1_MIAV0_MIWT8_8_MO40_NTn1_NTA0_NTB0_NTC0_NTD0_NTM0_NEPBS0_NLCA1_NLCB1_ONLL1_PGR2_PLR1_PKA1_SIA3_SS1_SU0_SUM0_SUS64_SPO0_SRVW0_SSO0_SVW4_SK3_SKXCCM8_TLDS0_ULSGRO0_USL1_UIOFGRO0_USFGRO0_VSn1_VWA4_VWB8_WSGRA0_WSGRB0_WS64_WG32_8_1_WGM8_WGMXCC1_WGMXCCGn1
    SolutionIndex: 49
    SolutionNameMin: Cijk_Ailk_Bjlk_I8_BH_UserArgs_MT256x256x64_MI16x16x1_SN_LDSB0_AFC0_AFEM1_AFEM1_ASEM1_CLR1_CADS0_DTVA0_DTVB0_EPS0_FDSI0_GRPM1_GRVWA4_GRVWB4_GSU0_GSUAMB_GSUC0_GSUWGMRR0_GLS0_ISA942_IU1_K1_LBSPPA2048_LBSPPB2048_LBSPPM0_LPA0_LPB0_LPM0_LRVW8_LWPMn1_MIAV0_MIWT8_8_MO40_NTn1_NTA0_NTB0_NTC0_NTD0_NTM0_NEPBS0_NLCA1_NLCB1_ONLL1_PGR2_PLR1_PKA1_SIA3_SS1_SU0_SUM0_SUS64_SPO0_SRVW0_SSO0_SVW8_SK3_SKXCCM8_TLDS0_ULSGRO0_USL1_UIOFGRO0_USFGRO0_VSn1_VWA8_VWB8_WSGRA0_WSGRB0_WS64_WG32_8_1_WGM8_WGMXCC1_WGMXCCGn1
    SolutionIndex: 50
    SolutionNameMin: Cijk_Ailk_Bjlk_I8_BH_UserArgs_MT256x256x64_MI16x16x1_SN_LDSB1_AFC0_AFEM1_AFEM1_ASEM1_CLR1_CADS0_DTVA0_DTVB0_EPS0_FDSI0_GRPM1_GRVWA8_GRVWB4_GSU0_GSUAMB_GSUC0_GSUWGMRR0_GLS0_ISA942_IU1_K1_LBSPPA2048_LBSPPB2048_LBSPPM0_LPA0_LPB32_LPM0_LRVW8_LWPMn1_MIAV0_MIWT8_8_MO40_NTn1_NTA0_NTB0_NTC0_NTD0_NTM0_NEPBS0_NLCA1_NLCB1_ONLL1_PGR2_PLR1_PKA1_SIA3_SS1_SU0_SUM0_SUS64_SPO0_SRVW0_SSO0_SVW8_SK3_SKXCCM8_TLDS0_ULSGRO0_USL1_UIOFGRO0_USFGRO0_VSn1_VWA8_VWB2_WSGRA0_WSGRB0_WS64_WG32_8_1_WGM8_WGMXCC1_WGMXCCGn1
    SolutionIndex: 51
    SolutionNameMin: Cijk_Ailk_Bjlk_I8_BH_UserArgs_MT256x256x64_MI16x16x1_SN_LDSB1_AFC0_AFEM1_AFEM1_ASEM1_CLR1_CADS0_DTVA0_DTVB0_EPS0_FDSI0_GRPM1_GRVWA8_GRVWB4_GSU0_GSUAMB_GSUC0_GSUWGMRR0_GLS0_ISA942_IU1_K1_LBSPPA2048_LBSPPB2048_LBSPPM0_LPA0_LPB64_LPM0_LRVW8_LWPMn1_MIAV0_MIWT8_8_MO40_NTn1_NTA0_NTB0_NTC0_NTD0_NTM0_NEPBS0_NLCA1_NLCB1_ONLL1_PGR2_PLR1_PKA1_SIA3_SS1_SU0_SUM0_SUS64_SPO0_SRVW0_SSO0_SVW8_SK3_SKXCCM8_TLDS0_ULSGRO0_USL1_UIOFGRO0_USFGRO0_VSn1_VWA8_VWB4_WSGRA0_WSGRB0_WS64_WG32_8_1_WGM8_WGMXCC1_WGMXCCGn1
    SolutionIndex: 52
    SolutionNameMin: Cijk_Ailk_Bjlk_I8_BH_UserArgs_MT256x256x64_MI16x16x1_SN_LDSB1_AFC0_AFEM1_AFEM1_ASEM1_CLR1_CADS0_DTVA0_DTVB0_EPS0_FDSI0_GRPM1_GRVWA8_GRVWB4_GSU0_GSUAMB_GSUC0_GSUWGMRR0_GLS0_ISA942_IU1_K1_LBSPPA2048_LBSPPB2048_LBSPPM0_LPA64_LPB0_LPM0_LRVW8_LWPMn1_MIAV0_MIWT8_8_MO40_NTn1_NTA0_NTB0_NTC0_NTD0_NTM0_NEPBS0_NLCA1_NLCB1_ONLL1_PGR2_PLR1_PKA1_SIA3_SS1_SU0_SUM0_SUS64_SPO0_SRVW0_SSO0_SVW4_SK3_SKXCCM8_TLDS0_ULSGRO0_USL1_UIOFGRO0_USFGRO0_VSn1_VWA4_VWB8_WSGRA0_WSGRB0_WS64_WG32_8_1_WGM8_WGMXCC1_WGMXCCGn1
    SolutionIndex: 53
    SolutionNameMin: Cijk_Ailk_Bjlk_I8_BH_UserArgs_MT256x256x64_MI16x16x1_SN_LDSB0_AFC0_AFEM1_AFEM1_ASEM1_CLR1_CADS0_DTVA0_DTVB0_EPS0_FDSI0_GRPM1_GRVWA8_GRVWB4_GSU0_GSUAMB_GSUC0_GSUWGMRR0_GLS0_ISA942_IU1_K1_LBSPPA2048_LBSPPB2048_LBSPPM0_LPA0_LPB0_LPM0_LRVW8_LWPMn1_MIAV0_MIWT8_8_MO40_NTn1_NTA0_NTB0_NTC0_NTD0_NTM0_NEPBS0_NLCA1_NLCB1_ONLL1_PGR2_PLR1_PKA1_SIA3_SS1_SU0_SUM0_SUS64_SPO0_SRVW0_SSO0_SVW8_SK3_SKXCCM8_TLDS0_ULSGRO0_USL1_UIOFGRO0_USFGRO0_VSn1_VWA8_VWB8_WSGRA0_WSGRB0_WS64_WG32_8_1_WGM8_WGMXCC1_WGMXCCGn1
    SolutionIndex: 54
    SolutionNameMin: Cijk_Ailk_Bjlk_I8_BH_UserArgs_MT256x256x64_MI16x16x1_SN_LDSB1_AFC0_AFEM1_AFEM1_ASEM1_CLR1_CADS0_DTVA0_DTVB0_EPS0_FDSI0_GRPM1_GRVWA4_GRVWB8_GSU0_GSUAMB_GSUC0_GSUWGMRR0_GLS0_ISA942_IU1_K1_LBSPPA2048_LBSPPB2048_LBSPPM0_LPA0_LPB64_LPM0_LRVW8_LWPMn1_MIAV0_MIWT8_8_MO40_NTn1_NTA0_NTB0_NTC0_NTD0_NTM0_NEPBS0_NLCA1_NLCB1_ONLL1_PGR2_PLR1_PKA1_SIA3_SS1_SU0_SUM0_SUS64_SPO0_SRVW0_SSO0_SVW8_SK3_SKXCCM8_TLDS0_ULSGRO0_USL1_UIOFGRO0_USFGRO0_VSn1_VWA8_VWB4_WSGRA0_WSGRB0_WS64_WG32_8_1_WGM8_WGMXCC1_WGMXCCGn1
    SolutionIndex: 55
    SolutionNameMin: Cijk_Ailk_Bjlk_I8_BH_UserArgs_MT256x256x64_MI16x16x1_SN_LDSB1_AFC0_AFEM1_AFEM1_ASEM1_CLR1_CADS0_DTVA0_DTVB0_EPS0_FDSI0_GRPM1_GRVWA4_GRVWB8_GSU0_GSUAMB_GSUC0_GSUWGMRR0_GLS0_ISA942_IU1_K1_LBSPPA2048_LBSPPB2048_LBSPPM0_LPA64_LPB0_LPM0_LRVW8_LWPMn1_MIAV0_MIWT8_8_MO40_NTn1_NTA0_NTB0_NTC0_NTD0_NTM0_NEPBS0_NLCA1_NLCB1_ONLL1_PGR2_PLR1_PKA1_SIA3_SS1_SU0_SUM0_SUS64_SPO0_SRVW0_SSO0_SVW4_SK3_SKXCCM8_TLDS0_ULSGRO0_USL1_UIOFGRO0_USFGRO0_VSn1_VWA4_VWB8_WSGRA0_WSGRB0_WS64_WG32_8_1_WGM8_WGMXCC1_WGMXCCGn1
    SolutionIndex: 56
    SolutionNameMin: Cijk_Ailk_Bjlk_I8_BH_UserArgs_MT256x256x64_MI16x16x1_SN_LDSB0_AFC0_AFEM1_AFEM1_ASEM1_CLR1_CADS0_DTVA0_DTVB0_EPS0_FDSI0_GRPM1_GRVWA4_GRVWB8_GSU0_GSUAMB_GSUC0_GSUWGMRR0_GLS0_ISA942_IU1_K1_LBSPPA2048_LBSPPB2048_LBSPPM0_LPA0_LPB0_LPM0_LRVW8_LWPMn1_MIAV0_MIWT8_8_MO40_NTn1_NTA0_NTB0_NTC0_NTD0_NTM0_NEPBS0_NLCA1_NLCB1_ONLL1_PGR2_PLR1_PKA1_SIA3_SS1_SU0_SUM0_SUS64_SPO0_SRVW0_SSO0_SVW8_SK3_SKXCCM8_TLDS0_ULSGRO0_USL1_UIOFGRO0_USFGRO0_VSn1_VWA8_VWB8_WSGRA0_WSGRB0_WS64_WG32_8_1_WGM8_WGMXCC1_WGMXCCGn1
    SolutionIndex: 57
    SolutionNameMin: Cijk_Ailk_Bjlk_I8_BH_UserArgs_MT256x256x64_MI16x16x1_SN_LDSB0_AFC0_AFEM1_AFEM1_ASEM1_CLR1_CADS0_DTVA0_DTVB0_EPS0_FDSI0_GRPM1_GRVWA8_GRVWB8_GSU0_GSUAMB_GSUC0_GSUWGMRR0_GLS0_ISA942_IU1_K1_LBSPPA2048_LBSPPB2048_LBSPPM0_LPA0_LPB0_LPM0_LRVW8_LWPMn1_MIAV0_MIWT8_8_MO40_NTn1_NTA0_NTB0_NTC0_NTD0_NTM0_NEPBS0_NLCA1_NLCB1_ONLL1_PGR2_PLR1_PKA1_SIA3_SS1_SU0_SUM0_SUS64_SPO0_SRVW0_SSO0_SVW8_SK3_SKXCCM8_TLDS0_ULSGRO0_USL1_UIOFGRO0_USFGRO0_VSn1_VWA8_VWB8_WSGRA0_WSGRB0_WS64_WG32_8_1_WGM8_WGMXCC1_WGMXCCGn1
    SolutionIndex: 58
    SolutionNameMin: Cijk_Ailk_Bjlk_I8_BH_UserArgs_MT256x256x64_MI16x16x1_SN_LDSB0_AFC0_AFEM1_AFEM1_ASEM1_CLR0_CADS0_DTVA0_DTVB0_EPS0_FDSI0_GRPM1_GRVWA4_GRVWB4_GSU0_GSUAMB_GSUC0_GSUWGMRR0_GLS0_ISA942_IU1_K1_LBSPPA2048_LBSPPB2048_LBSPPM0_LPA0_LPB0_LPM0_LRVW8_LWPMn1_MIAV0_MIWT8_8_MO40_NTn1_NTA0_NTB0_NTC0_NTD0_NTM0_NEPBS0_NLCA1_NLCB1_ONLL1_PGR2_PLR0_PKA1_SIA3_SS1_SU0_SUM0_SUS64_SPO0_SRVW0_SSO0_SVW8_SK3_SKXCCM8_TLDS0_ULSGRO0_USL1_UIOFGRO0_USFGRO0_VSn1_VWA8_VWB8_WSGRA0_WSGRB0_WS64_WG32_8_1_WGM8_WGMXCC1_WGMXCCGn1
    SolutionIndex: 59
    SolutionNameMin: Cijk_Ailk_Bjlk_I8_BH_UserArgs_MT128x256x64_MI16x16x1_SN_LDSB1_AFC0_AFEM1_AFEM1_ASEM1_CLR1_CADS0_DTVA0_DTVB0_EPS0_FDSI0_GRPM1_GRVWA4_GRVWB4_GSU0_GSUAMB_GSUC0_GSUWGMRR0_GLS0_ISA942_IU1_K1_LBSPPA1024_LBSPPB2048_LBSPPM0_LPA64_LPB64_LPM0_LRVW8_LWPMn1_MIAV0_MIWT4_8_MO40_NTn1_NTA0_NTB0_NTC0_NTD0_NTM0_NEPBS0_NLCA1_NLCB1_ONLL1_PGR2_PLR1_PKA1_SIA3_SS1_SU0_SUM0_SUS64_SPO0_SRVW0_SSO0_SVW4_SK3_SKXCCM8_TLDS0_ULSGRO0_USL1_UIOFGRO0_USFGRO0_VSn1_VWA4_VWB4_WSGRA0_WSGRB0_WS64_WG32_8_1_WGM1_WGMXCC1_WGMXCCGn1
    SolutionIndex: 60
    SolutionNameMin: Cijk_Ailk_Bjlk_I8_BH_UserArgs_MT128x256x64_MI16x16x1_SN_LDSB1_AFC0_AFEM1_AFEM1_ASEM1_CLR1_CADS0_DTVA0_DTVB0_EPS0_FDSI0_GRPM1_GRVWA4_GRVWB8_GSU0_GSUAMB_GSUC0_GSUWGMRR0_GLS0_ISA942_IU1_K1_LBSPPA1024_LBSPPB2048_LBSPPM0_LPA64_LPB64_LPM0_LRVW8_LWPMn1_MIAV0_MIWT4_8_MO40_NTn1_NTA0_NTB0_NTC0_NTD0_NTM0_NEPBS0_NLCA1_NLCB1_ONLL1_PGR2_PLR1_PKA1_SIA3_SS1_SU0_SUM0_SUS64_SPO0_SRVW0_SSO0_SVW4_SK3_SKXCCM8_TLDS0_ULSGRO0_USL1_UIOFGRO0_USFGRO0_VSn1_VWA4_VWB4_WSGRA0_WSGRB0_WS64_WG32_8_1_WGM1_WGMXCC1_WGMXCCGn1
    SolutionIndex: 61
    SolutionNameMin: Cijk_Ailk_Bjlk_I8_BH_UserArgs_MT128x256x64_MI16x16x1_SN_LDSB1_AFC0_AFEM1_AFEM1_ASEM1_CLR1_CADS0_DTVA0_DTVB0_EPS0_FDSI0_GRPM1_GRVWA4_GRVWB8_GSU0_GSUAMB_GSUC0_GSUWGMRR0_GLS0_ISA942_IU1_K1_LBSPPA1024_LBSPPB2048_LBSPPM0_LPA64_LPB0_LPM0_LRVW8_LWPMn1_MIAV0_MIWT4_8_MO40_NTn1_NTA0_NTB0_NTC0_NTD0_NTM0_NEPBS0_NLCA1_NLCB1_ONLL1_PGR2_PLR1_PKA1_SIA3_SS1_SU0_SUM0_SUS64_SPO0_SRVW0_SSO0_SVW4_SK3_SKXCCM8_TLDS0_ULSGRO0_USL1_UIOFGRO0_USFGRO0_VSn1_VWA4_VWB8_WSGRA0_WSGRB0_WS64_WG32_8_1_WGM1_WGMXCC1_WGMXCCGn1
    SolutionIndex: 62
    SolutionNameMin: Cijk_Ailk_Bjlk_I8_BH_UserArgs_MT128x256x64_MI16x16x1_SN_LDSB1_AFC0_AFEM1_AFEM1_ASEM1_CLR1_CADS0_DTVA0_DTVB0_EPS0_FDSI0_GRPM1_GRVWA4_GRVWB8_GSU0_GSUAMB_GSUC0_GSUWGMRR0_GLS0_ISA942_IU1_K1_LBSPPA1024_LBSPPB2048_LBSPPM0_LPA64_LPB32_LPM0_LRVW8_LWPMn1_MIAV0_MIWT4_8_MO40_NTn1_NTA0_NTB0_NTC0_NTD0_NTM0_NEPBS0_NLCA1_NLCB1_ONLL1_PGR2_PLR1_PKA1_SIA3_SS1_SU0_SUM0_SUS64_SPO0_SRVW0_SSO0_SVW4_SK3_SKXCCM8_TLDS0_ULSGRO0_USL1_UIOFGRO0_USFGRO0_VSn1_VWA4_VWB2_WSGRA0_WSGRB0_WS64_WG32_8_1_WGM4_WGMXCC1_WGMXCCGn1
    SolutionIndex: 63
    SolutionNameMin: Cijk_Ailk_Bjlk_I8_BH_UserArgs_MT128x256x64_MI16x16x1_SN_LDSB1_AFC0_AFEM1_AFEM1_ASEM1_CLR1_CADS0_DTVA0_DTVB0_EPS0_FDSI0_GRPM1_GRVWA4_GRVWB8_GSU0_GSUAMB_GSUC0_GSUWGMRR0_GLS0_ISA942_IU1_K1_LBSPPA1024_LBSPPB2048_LBSPPM0_LPA64_LPB64_LPM0_LRVW8_LWPMn1_MIAV0_MIWT4_8_MO40_NTn1_NTA0_NTB0_NTC0_NTD0_NTM0_NEPBS0_NLCA1_NLCB1_ONLL1_PGR2_PLR1_PKA1_SIA3_SS1_SU0_SUM0_SUS64_SPO0_SRVW0_SSO0_SVW4_SK3_SKXCCM8_TLDS0_ULSGRO0_USL1_UIOFGRO0_USFGRO0_VSn1_VWA4_VWB4_WSGRA0_WSGRB0_WS64_WG32_8_1_WGM4_WGMXCC1_WGMXCCGn1
    SolutionIndex: 64
    SolutionNameMin: Cijk_Ailk_Bjlk_I8_BH_UserArgs_MT128x256x64_MI16x16x1_SN_LDSB1_AFC0_AFEM1_AFEM1_ASEM1_CLR1_CADS0_DTVA0_DTVB0_EPS0_FDSI0_GRPM1_GRVWA4_GRVWB8_GSU0_GSUAMB_GSUC0_GSUWGMRR0_GLS0_ISA942_IU1_K1_LBSPPA1024_LBSPPB2048_LBSPPM0_LPA64_LPB0_LPM0_LRVW8_LWPMn1_MIAV0_MIWT4_8_MO40_NTn1_NTA0_NTB0_NTC0_NTD0_NTM0_NEPBS0_NLCA1_NLCB1_ONLL1_PGR2_PLR1_PKA1_SIA3_SS1_SU0_SUM0_SUS64_SPO0_SRVW0_SSO0_SVW4_SK3_SKXCCM8_TLDS0_ULSGRO0_USL1_UIOFGRO0_USFGRO0_VSn1_VWA4_VWB8_WSGRA0_WSGRB0_WS64_WG32_8_1_WGM4_WGMXCC1_WGMXCCGn1
    SolutionIndex: 65
    SolutionNameMin: Cijk_Ailk_Bjlk_I8_BH_UserArgs_MT128x256x64_MI16x16x1_SN_LDSB1_AFC0_AFEM1_AFEM1_ASEM1_CLR1_CADS0_DTVA0_DTVB0_EPS0_FDSI0_GRPM1_GRVWA4_GRVWB8_GSU0_GSUAMB_GSUC0_GSUWGMRR0_GLS0_ISA942_IU1_K1_LBSPPA1024_LBSPPB2048_LBSPPM0_LPA64_LPB0_LPM0_LRVW8_LWPMn1_MIAV0_MIWT4_8_MO40_NTn1_NTA0_NTB0_NTC0_NTD0_NTM0_NEPBS0_NLCA1_NLCB1_ONLL1_PGR2_PLR1_PKA1_SIA3_SS1_SU0_SUM0_SUS64_SPO0_SRVW0_SSO0_SVW4_SK3_SKXCCM8_TLDS0_ULSGRO0_USL1_UIOFGRO0_USFGRO0_VSn1_VWA4_VWB8_WSGRA0_WSGRB0_WS64_WG32_8_1_WGM8_WGMXCC1_WGMXCCGn1
    SolutionIndex: 66
    SolutionNameMin: Cijk_Ailk_Bjlk_I8_BH_UserArgs_MT256x128x64_MI16x16x1_SN_LDSB1_AFC0_AFEM1_AFEM1_ASEM1_CLR1_CADS0_DTVA0_DTVB0_EPS0_FDSI0_GRPM1_GRVWA4_GRVWB4_GSU0_GSUAMB_GSUC0_GSUWGMRR0_GLS0_ISA942_IU1_K1_LBSPPA2048_LBSPPB1024_LBSPPM0_LPA0_LPB32_LPM0_LRVW8_LWPMn1_MIAV0_MIWT8_4_MO40_NTn1_NTA0_NTB0_NTC0_NTD0_NTM0_NEPBS0_NLCA1_NLCB1_ONLL1_PGR2_PLR1_PKA1_SIA3_SS1_SU0_SUM0_SUS64_SPO0_SRVW0_SSO0_SVW8_SK3_SKXCCM8_TLDS0_ULSGRO0_USL1_UIOFGRO0_USFGRO0_VSn1_VWA8_VWB2_WSGRA0_WSGRB0_WS64_WG32_8_1_WGM1_WGMXCC1_WGMXCCGn1
    SolutionIndex: 67
    SolutionNameMin: Cijk_Ailk_Bjlk_I8_BH_UserArgs_MT256x128x64_MI16x16x1_SN_LDSB1_AFC0_AFEM1_AFEM1_ASEM1_CLR1_CADS0_DTVA0_DTVB0_EPS0_FDSI0_GRPM1_GRVWA4_GRVWB4_GSU0_GSUAMB_GSUC0_GSUWGMRR0_GLS0_ISA942_IU1_K1_LBSPPA2048_LBSPPB1024_LBSPPM0_LPA64_LPB64_LPM0_LRVW8_LWPMn1_MIAV0_MIWT8_4_MO40_NTn1_NTA0_NTB0_NTC0_NTD0_NTM0_NEPBS0_NLCA1_NLCB1_ONLL1_PGR2_PLR1_PKA1_SIA3_SS1_SU0_SUM0_SUS64_SPO0_SRVW0_SSO0_SVW4_SK3_SKXCCM8_TLDS0_ULSGRO0_USL1_UIOFGRO0_USFGRO0_VSn1_VWA4_VWB4_WSGRA0_WSGRB0_WS64_WG32_8_1_WGM1_WGMXCC1_WGMXCCGn1
    SolutionIndex: 68
    SolutionNameMin: Cijk_Ailk_Bjlk_I8_BH_UserArgs_MT256x128x64_MI16x16x1_SN_LDSB1_AFC0_AFEM1_AFEM1_ASEM1_CLR1_CADS0_DTVA0_DTVB0_EPS0_FDSI0_GRPM1_GRVWA4_GRVWB8_GSU0_GSUAMB_GSUC0_GSUWGMRR0_GLS0_ISA942_IU1_K1_LBSPPA2048_LBSPPB1024_LBSPPM0_LPA64_LPB64_LPM0_LRVW8_LWPMn1_MIAV0_MIWT8_4_MO40_NTn1_NTA0_NTB0_NTC0_NTD0_NTM0_NEPBS0_NLCA1_NLCB1_ONLL1_PGR2_PLR1_PKA1_SIA3_SS1_SU0_SUM0_SUS64_SPO0_SRVW0_SSO0_SVW4_SK3_SKXCCM8_TLDS0_ULSGRO0_USL1_UIOFGRO0_USFGRO0_VSn1_VWA4_VWB4_WSGRA0_WSGRB0_WS64_WG32_8_1_WGM1_WGMXCC1_WGMXCCGn1
    SolutionIndex: 69
    SolutionNameMin: Cijk_Ailk_Bjlk_I8_BH_UserArgs_MT256x128x64_MI16x16x1_SN_LDSB1_AFC0_AFEM1_AFEM1_ASEM1_CLR1_CADS0_DTVA0_DTVB0_EPS0_FDSI0_GRPM1_GRVWA4_GRVWB8_GSU0_GSUAMB_GSUC0_GSUWGMRR0_GLS0_ISA942_IU1_K1_LBSPPA2048_LBSPPB1024_LBSPPM0_LPA0_LPB64_LPM0_LRVW8_LWPMn1_MIAV0_MIWT8_4_MO40_NTn1_NTA0_NTB0_NTC0_NTD0_NTM0_NEPBS0_NLCA1_NLCB1_ONLL1_PGR2_PLR1_PKA1_SIA3_SS1_SU0_SUM0_SUS64_SPO0_SRVW0_SSO0_SVW8_SK3_SKXCCM8_TLDS0_ULSGRO0_USL1_UIOFGRO0_USFGRO0_VSn1_VWA8_VWB4_WSGRA0_WSGRB0_WS64_WG32_8_1_WGM1_WGMXCC1_WGMXCCGn1
    SolutionIndex: 70
    SolutionNameMin: Cijk_Ailk_Bjlk_I8_BH_UserArgs_MT256x128x64_MI16x16x1_SN_LDSB1_AFC0_AFEM1_AFEM1_ASEM1_CLR1_CADS0_DTVA0_DTVB0_EPS0_FDSI0_GRPM1_GRVWA8_GRVWB8_GSU0_GSUAMB_GSUC0_GSUWGMRR0_GLS0_ISA942_IU1_K1_LBSPPA2048_LBSPPB1024_LBSPPM0_LPA0_LPB64_LPM0_LRVW8_LWPMn1_MIAV0_MIWT8_4_MO40_NTn1_NTA0_NTB0_NTC0_NTD0_NTM0_NEPBS0_NLCA1_NLCB1_ONLL1_PGR2_PLR1_PKA1_SIA3_SS1_SU0_SUM0_SUS64_SPO0_SRVW0_SSO0_SVW8_SK3_SKXCCM8_TLDS0_ULSGRO0_USL1_UIOFGRO0_USFGRO0_VSn1_VWA8_VWB4_WSGRA0_WSGRB0_WS64_WG32_8_1_WGM1_WGMXCC1_WGMXCCGn1
    SolutionIndex: 71
    SolutionNameMin: Cijk_Ailk_Bjlk_I8_BH_UserArgs_MT256x128x64_MI16x16x1_SN_LDSB1_AFC0_AFEM1_AFEM1_ASEM1_CLR1_CADS0_DTVA0_DTVB0_EPS0_FDSI0_GRPM1_GRVWA4_GRVWB4_GSU0_GSUAMB_GSUC0_GSUWGMRR0_GLS0_ISA942_IU1_K1_LBSPPA2048_LBSPPB1024_LBSPPM0_LPA64_LPB64_LPM0_LRVW8_LWPMn1_MIAV0_MIWT8_4_MO40_NTn1_NTA0_NTB0_NTC0_NTD0_NTM0_NEPBS0_NLCA1_NLCB1_ONLL1_PGR2_PLR1_PKA1_SIA3_SS1_SU0_SUM0_SUS64_SPO0_SRVW0_SSO0_SVW4_SK3_SKXCCM8_TLDS0_ULSGRO0_USL1_UIOFGRO0_USFGRO0_VSn1_VWA4_VWB4_WSGRA0_WSGRB0_WS64_WG32_8_1_WGM4_WGMXCC1_WGMXCCGn1
    SolutionIndex: 72
    SolutionNameMin: Cijk_Ailk_Bjlk_I8_BH_UserArgs_MT256x128x64_MI16x16x1_SN_LDSB1_AFC0_AFEM1_AFEM1_ASEM1_CLR1_CADS0_DTVA0_DTVB0_EPS0_FDSI0_GRPM1_GRVWA4_GRVWB8_GSU0_GSUAMB_GSUC0_GSUWGMRR0_GLS0_ISA942_IU1_K1_LBSPPA2048_LBSPPB1024_LBSPPM0_LPA64_LPB32_LPM0_LRVW8_LWPMn1_MIAV0_MIWT8_4_MO40_NTn1_NTA0_NTB0_NTC0_NTD0_NTM0_NEPBS0_NLCA1_NLCB1_ONLL1_PGR2_PLR1_PKA1_SIA3_SS1_SU0_SUM0_SUS64_SPO0_SRVW0_SSO0_SVW4_SK3_SKXCCM8_TLDS0_ULSGRO0_USL1_UIOFGRO0_USFGRO0_VSn1_VWA4_VWB2_WSGRA0_WSGRB0_WS64_WG32_8_1_WGM4_WGMXCC1_WGMXCCGn1
    SolutionIndex: 73
    SolutionNameMin: Cijk_Ailk_Bjlk_I8_BH_UserArgs_MT256x128x64_MI16x16x1_SN_LDSB1_AFC0_AFEM1_AFEM1_ASEM1_CLR1_CADS0_DTVA0_DTVB0_EPS0_FDSI0_GRPM1_GRVWA8_GRVWB8_GSU0_GSUAMB_GSUC0_GSUWGMRR0_GLS0_ISA942_IU1_K1_LBSPPA2048_LBSPPB1024_LBSPPM0_LPA0_LPB64_LPM0_LRVW8_LWPMn1_MIAV0_MIWT8_4_MO40_NTn1_NTA0_NTB0_NTC0_NTD0_NTM0_NEPBS0_NLCA1_NLCB1_ONLL1_PGR2_PLR1_PKA1_SIA3_SS1_SU0_SUM0_SUS64_SPO0_SRVW0_SSO0_SVW8_SK3_SKXCCM8_TLDS0_ULSGRO0_USL1_UIOFGRO0_USFGRO0_VSn1_VWA8_VWB4_WSGRA0_WSGRB0_WS64_WG32_8_1_WGM4_WGMXCC1_WGMXCCGn1
    SolutionIndex: 74
    SolutionNameMin: Cijk_Ailk_Bjlk_I8_BH_UserArgs_MT256x128x64_MI16x16x1_SN_LDSB1_AFC0_AFEM1_AFEM1_ASEM1_CLR1_CADS0_DTVA0_DTVB0_EPS0_FDSI0_GRPM1_GRVWA4_GRVWB4_GSU0_GSUAMB_GSUC0_GSUWGMRR0_GLS0_ISA942_IU1_K1_LBSPPA2048_LBSPPB1024_LBSPPM0_LPA64_LPB64_LPM0_LRVW8_LWPMn1_MIAV0_MIWT8_4_MO40_NTn1_NTA0_NTB0_NTC0_NTD0_NTM0_NEPBS0_NLCA1_NLCB1_ONLL1_PGR2_PLR1_PKA1_SIA3_SS1_SU0_SUM0_SUS64_SPO0_SRVW0_SSO0_SVW4_SK3_SKXCCM8_TLDS0_ULSGRO0_USL1_UIOFGRO0_USFGRO0_VSn1_VWA4_VWB4_WSGRA0_WSGRB0_WS64_WG32_8_1_WGM8_WGMXCC1_WGMXCCGn1
    SolutionIndex: 75
    SolutionNameMin: Cijk_Ailk_Bjlk_I8_BH_UserArgs_MT256x128x64_MI16x16x1_SN_LDSB1_AFC0_AFEM1_AFEM1_ASEM1_CLR1_CADS0_DTVA0_DTVB0_EPS0_FDSI0_GRPM1_GRVWA8_GRVWB8_GSU0_GSUAMB_GSUC0_GSUWGMRR0_GLS0_ISA942_IU1_K1_LBSPPA2048_LBSPPB1024_LBSPPM0_LPA0_LPB64_LPM0_LRVW8_LWPMn1_MIAV0_MIWT8_4_MO40_NTn1_NTA0_NTB0_NTC0_NTD0_NTM0_NEPBS0_NLCA1_NLCB1_ONLL1_PGR2_PLR1_PKA1_SIA3_SS1_SU0_SUM0_SUS64_SPO0_SRVW0_SSO0_SVW8_SK3_SKXCCM8_TLDS0_ULSGRO0_USL1_UIOFGRO0_USFGRO0_VSn1_VWA8_VWB4_WSGRA0_WSGRB0_WS64_WG32_8_1_WGM8_WGMXCC1_WGMXCCGn1
    SolutionIndex: 76
    SolutionNameMin: Cijk_Ailk_Bjlk_I8_BH_UserArgs_MT128x128x64_MI16x16x1_SN_LDSB1_AFC0_AFEM1_AFEM1_ASEM1_CLR1_CADS0_DTVA0_DTVB0_EPS0_FDSI0_GRPM1_GRVWA4_GRVWB4_GSU0_GSUAMB_GSUC0_GSUWGMRR0_GLS0_ISA942_IU1_K1_LBSPPA1024_LBSPPB1024_LBSPPM0_LPA64_LPB32_LPM0_LRVW8_LWPMn1_MIAV0_MIWT4_4_MO40_NTn1_NTA0_NTB0_NTC0_NTD0_NTM0_NEPBS0_NLCA1_NLCB1_ONLL1_PGR2_PLR1_PKA1_SIA3_SS1_SU0_SUM0_SUS64_SPO0_SRVW0_SSO0_SVW4_SK3_SKXCCM8_TLDS0_ULSGRO0_USL1_UIOFGRO0_USFGRO0_VSn1_VWA4_VWB2_WSGRA0_WSGRB0_WS64_WG32_8_1_WGM1_WGMXCC1_WGMXCCGn1
    SolutionIndex: 77
    SolutionNameMin: Cijk_Ailk_Bjlk_I8_BH_UserArgs_MT128x128x64_MI16x16x1_SN_LDSB1_AFC0_AFEM1_AFEM1_ASEM1_CLR1_CADS0_DTVA0_DTVB0_EPS0_FDSI0_GRPM1_GRVWA4_GRVWB4_GSU0_GSUAMB_GSUC0_GSUWGMRR0_GLS0_ISA942_IU1_K1_LBSPPA1024_LBSPPB1024_LBSPPM0_LPA64_LPB64_LPM0_LRVW8_LWPMn1_MIAV0_MIWT4_4_MO40_NTn1_NTA0_NTB0_NTC0_NTD0_NTM0_NEPBS0_NLCA1_NLCB1_ONLL1_PGR2_PLR1_PKA1_SIA3_SS1_SU0_SUM0_SUS64_SPO0_SRVW0_SSO0_SVW4_SK3_SKXCCM8_TLDS0_ULSGRO0_USL1_UIOFGRO0_USFGRO0_VSn1_VWA4_VWB4_WSGRA0_WSGRB0_WS64_WG32_8_1_WGM1_WGMXCC1_WGMXCCGn1
    SolutionIndex: 78
    SolutionNameMin: Cijk_Ailk_Bjlk_I8_BH_UserArgs_MT128x128x64_MI16x16x1_SN_LDSB1_AFC0_AFEM1_AFEM1_ASEM1_CLR1_CADS0_DTVA0_DTVB0_EPS0_FDSI0_GRPM1_GRVWA4_GRVWB8_GSU0_GSUAMB_GSUC0_GSUWGMRR0_GLS0_ISA942_IU1_K1_LBSPPA1024_LBSPPB1024_LBSPPM0_LPA64_LPB32_LPM0_LRVW8_LWPMn1_MIAV0_MIWT4_4_MO40_NTn1_NTA0_NTB0_NTC0_NTD0_NTM0_NEPBS0_NLCA1_NLCB1_ONLL1_PGR2_PLR1_PKA1_SIA3_SS1_SU0_SUM0_SUS64_SPO0_SRVW0_SSO0_SVW4_SK3_SKXCCM8_TLDS0_ULSGRO0_USL1_UIOFGRO0_USFGRO0_VSn1_VWA4_VWB2_WSGRA0_WSGRB0_WS64_WG32_8_1_WGM1_WGMXCC1_WGMXCCGn1
    SolutionIndex: 79
    SolutionNameMin: Cijk_Ailk_Bjlk_I8_BH_UserArgs_MT128x128x64_MI16x16x1_SN_LDSB1_AFC0_AFEM1_AFEM1_ASEM1_CLR1_CADS0_DTVA0_DTVB0_EPS0_FDSI0_GRPM1_GRVWA4_GRVWB8_GSU0_GSUAMB_GSUC0_GSUWGMRR0_GLS0_ISA942_IU1_K1_LBSPPA1024_LBSPPB1024_LBSPPM0_LPA64_LPB64_LPM0_LRVW8_LWPMn1_MIAV0_MIWT4_4_MO40_NTn1_NTA0_NTB0_NTC0_NTD0_NTM0_NEPBS0_NLCA1_NLCB1_ONLL1_PGR2_PLR1_PKA1_SIA3_SS1_SU0_SUM0_SUS64_SPO0_SRVW0_SSO0_SVW4_SK3_SKXCCM8_TLDS0_ULSGRO0_USL1_UIOFGRO0_USFGRO0_VSn1_VWA4_VWB4_WSGRA0_WSGRB0_WS64_WG32_8_1_WGM1_WGMXCC1_WGMXCCGn1
    SolutionIndex: 80
    SolutionNameMin: Cijk_Ailk_Bjlk_I8_BH_UserArgs_MT128x128x64_MI16x16x1_SN_LDSB1_AFC0_AFEM1_AFEM1_ASEM1_CLR1_CADS0_DTVA0_DTVB0_EPS0_FDSI0_GRPM1_GRVWA4_GRVWB8_GSU0_GSUAMB_GSUC0_GSUWGMRR0_GLS0_ISA942_IU1_K1_LBSPPA1024_LBSPPB1024_LBSPPM0_LPA64_LPB64_LPM0_LRVW8_LWPMn1_MIAV0_MIWT4_4_MO40_NTn1_NTA0_NTB0_NTC0_NTD0_NTM0_NEPBS0_NLCA1_NLCB1_ONLL1_PGR2_PLR1_PKA1_SIA3_SS1_SU0_SUM0_SUS64_SPO0_SRVW0_SSO0_SVW4_SK3_SKXCCM8_TLDS0_ULSGRO0_USL1_UIOFGRO0_USFGRO0_VSn1_VWA4_VWB4_WSGRA0_WSGRB0_WS64_WG32_8_1_WGM4_WGMXCC1_WGMXCCGn1
    SolutionIndex: 81
    SolutionNameMin: Cijk_Ailk_Bjlk_I8_BH_UserArgs_MT128x128x64_MI16x16x1_SN_LDSB1_AFC0_AFEM1_AFEM1_ASEM1_CLR1_CADS0_DTVA0_DTVB0_EPS0_FDSI0_GRPM1_GRVWA4_GRVWB4_GSU0_GSUAMB_GSUC0_GSUWGMRR0_GLS0_ISA942_IU1_K1_LBSPPA1024_LBSPPB1024_LBSPPM0_LPA64_LPB64_LPM0_LRVW8_LWPMn1_MIAV0_MIWT4_4_MO40_NTn1_NTA0_NTB0_NTC0_NTD0_NTM0_NEPBS0_NLCA1_NLCB1_ONLL1_PGR2_PLR1_PKA1_SIA3_SS1_SU0_SUM0_SUS64_SPO0_SRVW0_SSO0_SVW4_SK3_SKXCCM8_TLDS0_ULSGRO0_USL1_UIOFGRO0_USFGRO0_VSn1_VWA4_VWB4_WSGRA0_WSGRB0_WS64_WG32_8_1_WGM8_WGMXCC1_WGMXCCGn1
    SolutionIndex: 82
    SolutionNameMin: Cijk_Ailk_Bjlk_I8_BH_UserArgs_MT128x128x64_MI16x16x1_SN_LDSB1_AFC0_AFEM1_AFEM1_ASEM1_CLR1_CADS0_DTVA0_DTVB0_EPS0_FDSI0_GRPM1_GRVWA4_GRVWB8_GSU0_GSUAMB_GSUC0_GSUWGMRR0_GLS0_ISA942_IU1_K1_LBSPPA1024_LBSPPB1024_LBSPPM0_LPA64_LPB32_LPM0_LRVW8_LWPMn1_MIAV0_MIWT4_4_MO40_NTn1_NTA0_NTB0_NTC0_NTD0_NTM0_NEPBS0_NLCA1_NLCB1_ONLL1_PGR2_PLR1_PKA1_SIA3_SS1_SU0_SUM0_SUS64_SPO0_SRVW0_SSO0_SVW4_SK3_SKXCCM8_TLDS0_ULSGRO0_USL1_UIOFGRO0_USFGRO0_VSn1_VWA4_VWB2_WSGRA0_WSGRB0_WS64_WG32_8_1_WGM8_WGMXCC1_WGMXCCGn1
    SolutionIndex: 83
    SolutionNameMin: Cijk_Ailk_Bjlk_I8_BH_UserArgs_MT128x128x64_MI16x16x1_SN_LDSB1_AFC0_AFEM1_AFEM1_ASEM1_CLR1_CADS0_DTVA0_DTVB0_EPS0_FDSI0_GRPM1_GRVWA4_GRVWB8_GSU0_GSUAMB_GSUC0_GSUWGMRR0_GLS0_ISA942_IU1_K1_LBSPPA1024_LBSPPB1024_LBSPPM0_LPA64_LPB64_LPM0_LRVW8_LWPMn1_MIAV0_MIWT4_4_MO40_NTn1_NTA0_NTB0_NTC0_NTD0_NTM0_NEPBS0_NLCA1_NLCB1_ONLL1_PGR2_PLR1_PKA1_SIA3_SS1_SU0_SUM0_SUS64_SPO0_SRVW0_SSO0_SVW4_SK3_SKXCCM8_TLDS0_ULSGRO0_USL1_UIOFGRO0_USFGRO0_VSn1_VWA4_VWB4_WSGRA0_WSGRB0_WS64_WG32_8_1_WGM8_WGMXCC1_WGMXCCGn1
    SolutionIndex: 84
    SolutionNameMin: Cijk_Ailk_Bjlk_I8_BH_UserArgs_MT64x128x64_MI16x16x1_SN_LDSB0_AFC0_AFEM1_AFEM1_ASEM1_CLR1_CADS0_DTVA0_DTVB0_EPS0_FDSI0_GRPM1_GRVWA4_GRVWB2_GSU0_GSUAMB_GSUC0_GSUWGMRR0_GLS0_ISA942_IU1_K1_LBSPPA512_LBSPPB1024_LBSPPM0_LPA32_LPB32_LPM0_LRVW8_LWPMn1_MIAV0_MIWT2_4_MO40_NTn1_NTA0_NTB0_NTC0_NTD0_NTM0_NEPBS0_NLCA1_NLCB1_ONLL1_PGR2_PLR1_PKA1_SIA3_SS1_SU0_SUM0_SUS64_SPO0_SRVW0_SSO0_SVW2_SK3_SKXCCM8_TLDS0_ULSGRO0_USL1_UIOFGRO0_USFGRO0_VSn1_VWA2_VWB2_WSGRA0_WSGRB0_WS64_WG32_8_1_WGM1_WGMXCC1_WGMXCCGn1
    SolutionIndex: 85
    SolutionNameMin: Cijk_Ailk_Bjlk_I8_BH_UserArgs_MT64x128x64_MI16x16x1_SN_LDSB0_AFC0_AFEM1_AFEM1_ASEM1_CLR1_CADS0_DTVA0_DTVB0_EPS0_FDSI0_GRPM1_GRVWA4_GRVWB8_GSU0_GSUAMB_GSUC0_GSUWGMRR0_GLS0_ISA942_IU1_K1_LBSPPA512_LBSPPB1024_LBSPPM0_LPA32_LPB32_LPM0_LRVW8_LWPMn1_MIAV0_MIWT2_4_MO40_NTn1_NTA0_NTB0_NTC0_NTD0_NTM0_NEPBS0_NLCA1_NLCB1_ONLL1_PGR2_PLR1_PKA1_SIA3_SS1_SU0_SUM0_SUS64_SPO0_SRVW0_SSO0_SVW2_SK3_SKXCCM8_TLDS0_ULSGRO0_USL1_UIOFGRO0_USFGRO0_VSn1_VWA2_VWB2_WSGRA0_WSGRB0_WS64_WG32_8_1_WGM1_WGMXCC1_WGMXCCGn1
    SolutionIndex: 86
    SolutionNameMin: Cijk_Ailk_Bjlk_I8_BH_UserArgs_MT64x128x64_MI16x16x1_SN_LDSB0_AFC0_AFEM1_AFEM1_ASEM1_CLR1_CADS0_DTVA0_DTVB0_EPS0_FDSI0_GRPM1_GRVWA4_GRVWB8_GSU0_GSUAMB_GSUC0_GSUWGMRR0_GLS0_ISA942_IU1_K1_LBSPPA512_LBSPPB1024_LBSPPM0_LPA32_LPB64_LPM0_LRVW8_LWPMn1_MIAV0_MIWT2_4_MO40_NTn1_NTA0_NTB0_NTC0_NTD0_NTM0_NEPBS0_NLCA1_NLCB1_ONLL1_PGR2_PLR1_PKA1_SIA3_SS1_SU0_SUM0_SUS64_SPO0_SRVW0_SSO0_SVW2_SK3_SKXCCM8_TLDS0_ULSGRO0_USL1_UIOFGRO0_USFGRO0_VSn1_VWA2_VWB4_WSGRA0_WSGRB0_WS64_WG32_8_1_WGM1_WGMXCC1_WGMXCCGn1
    SolutionIndex: 87
    SolutionNameMin: Cijk_Ailk_Bjlk_I8_BH_UserArgs_MT64x128x64_MI16x16x1_SN_LDSB0_AFC0_AFEM1_AFEM1_ASEM1_CLR1_CADS0_DTVA0_DTVB0_EPS0_FDSI0_GRPM1_GRVWA8_GRVWB8_GSU0_GSUAMB_GSUC0_GSUWGMRR0_GLS0_ISA942_IU1_K1_LBSPPA512_LBSPPB1024_LBSPPM0_LPA32_LPB64_LPM0_LRVW8_LWPMn1_MIAV0_MIWT2_4_MO40_NTn1_NTA0_NTB0_NTC0_NTD0_NTM0_NEPBS0_NLCA1_NLCB1_ONLL1_PGR2_PLR1_PKA1_SIA3_SS1_SU0_SUM0_SUS64_SPO0_SRVW0_SSO0_SVW2_SK3_SKXCCM8_TLDS0_ULSGRO0_USL1_UIOFGRO0_USFGRO0_VSn1_VWA2_VWB4_WSGRA0_WSGRB0_WS64_WG32_8_1_WGM1_WGMXCC1_WGMXCCGn1
    SolutionIndex: 88
    SolutionNameMin: Cijk_Ailk_Bjlk_I8_BH_UserArgs_MT64x128x64_MI16x16x1_SN_LDSB0_AFC0_AFEM1_AFEM1_ASEM1_CLR1_CADS0_DTVA0_DTVB0_EPS0_FDSI0_GRPM1_GRVWA4_GRVWB8_GSU0_GSUAMB_GSUC0_GSUWGMRR0_GLS0_ISA942_IU1_K1_LBSPPA512_LBSPPB1024_LBSPPM0_LPA32_LPB64_LPM0_LRVW8_LWPMn1_MIAV0_MIWT2_4_MO40_NTn1_NTA0_NTB0_NTC0_NTD0_NTM0_NEPBS0_NLCA1_NLCB1_ONLL1_PGR2_PLR1_PKA1_SIA3_SS1_SU0_SUM0_SUS64_SPO0_SRVW0_SSO0_SVW2_SK3_SKXCCM8_TLDS0_ULSGRO0_USL1_UIOFGRO0_USFGRO0_VSn1_VWA2_VWB4_WSGRA0_WSGRB0_WS64_WG32_8_1_WGM4_WGMXCC1_WGMXCCGn1
    SolutionIndex: 89
    SolutionNameMin: Cijk_Ailk_Bjlk_I8_BH_UserArgs_MT128x64x64_MI16x16x1_SN_LDSB0_AFC0_AFEM1_AFEM1_ASEM1_CLR1_CADS0_DTVA0_DTVB0_EPS0_FDSI0_GRPM1_GRVWA8_GRVWB8_GSU0_GSUAMB_GSUC0_GSUWGMRR0_GLS0_ISA942_IU1_K1_LBSPPA1024_LBSPPB512_LBSPPM0_LPA64_LPB32_LPM0_LRVW8_LWPMn1_MIAV0_MIWT4_2_MO40_NTn1_NTA0_NTB0_NTC0_NTD0_NTM0_NEPBS0_NLCA1_NLCB1_ONLL1_PGR2_PLR1_PKA1_SIA3_SS1_SU0_SUM0_SUS64_SPO0_SRVW0_SSO0_SVW4_SK3_SKXCCM8_TLDS0_ULSGRO0_USL1_UIOFGRO0_USFGRO0_VSn1_VWA4_VWB2_WSGRA0_WSGRB0_WS64_WG32_8_1_WGM1_WGMXCC1_WGMXCCGn1
    SolutionIndex: 90
    SolutionNameMin: Cijk_Ailk_Bjlk_I8_BH_UserArgs_MT128x64x64_MI16x16x1_SN_LDSB0_AFC0_AFEM1_AFEM1_ASEM1_CLR0_CADS0_DTVA0_DTVB0_EPS0_FDSI0_GRPM1_GRVWA4_GRVWB4_GSU0_GSUAMB_GSUC0_GSUWGMRR0_GLS0_ISA942_IU1_K1_LBSPPA1024_LBSPPB512_LBSPPM0_LPA64_LPB32_LPM0_LRVW8_LWPMn1_MIAV0_MIWT4_2_MO40_NTn1_NTA0_NTB0_NTC0_NTD0_NTM0_NEPBS0_NLCA1_NLCB1_ONLL1_PGR2_PLR0_PKA1_SIA3_SS1_SU0_SUM0_SUS64_SPO0_SRVW0_SSO0_SVW4_SK3_SKXCCM8_TLDS0_ULSGRO0_USL1_UIOFGRO0_USFGRO0_VSn1_VWA4_VWB2_WSGRA0_WSGRB0_WS64_WG32_8_1_WGM1_WGMXCC1_WGMXCCGn1
    SolutionIndex: 91
    SolutionNameMin: Cijk_Ailk_Bjlk_I8_BH_UserArgs_MT128x64x64_MI16x16x1_SN_LDSB0_AFC0_AFEM1_AFEM1_ASEM1_CLR1_CADS0_DTVA0_DTVB0_EPS0_FDSI0_GRPM1_GRVWA4_GRVWB2_GSU0_GSUAMB_GSUC0_GSUWGMRR0_GLS0_ISA942_IU1_K1_LBSPPA1024_LBSPPB512_LBSPPM0_LPA64_LPB32_LPM0_LRVW8_LWPMn1_MIAV0_MIWT4_2_MO40_NTn1_NTA0_NTB0_NTC0_NTD0_NTM0_NEPBS0_NLCA1_NLCB1_ONLL1_PGR2_PLR1_PKA1_SIA3_SS1_SU0_SUM0_SUS64_SPO0_SRVW0_SSO0_SVW4_SK3_SKXCCM8_TLDS0_ULSGRO0_USL1_UIOFGRO0_USFGRO0_VSn1_VWA4_VWB2_WSGRA0_WSGRB0_WS64_WG32_8_1_WGM4_WGMXCC1_WGMXCCGn1
    SolutionIndex: 92
    SolutionNameMin: Cijk_Ailk_Bjlk_I8_BH_UserArgs_MT128x64x64_MI16x16x1_SN_LDSB0_AFC0_AFEM1_AFEM1_ASEM1_CLR1_CADS0_DTVA0_DTVB0_EPS0_FDSI0_GRPM1_GRVWA2_GRVWB4_GSU0_GSUAMB_GSUC0_GSUWGMRR0_GLS0_ISA942_IU1_K1_LBSPPA1024_LBSPPB512_LBSPPM0_LPA32_LPB32_LPM0_LRVW8_LWPMn1_MIAV0_MIWT4_2_MO40_NTn1_NTA0_NTB0_NTC0_NTD0_NTM0_NEPBS0_NLCA1_NLCB1_ONLL1_PGR2_PLR1_PKA1_SIA3_SS1_SU0_SUM0_SUS64_SPO0_SRVW0_SSO0_SVW2_SK3_SKXCCM8_TLDS0_ULSGRO0_USL1_UIOFGRO0_USFGRO0_VSn1_VWA2_VWB2_WSGRA0_WSGRB0_WS64_WG32_8_1_WGM4_WGMXCC1_WGMXCCGn1
    SolutionIndex: 93
    SolutionNameMin: Cijk_Ailk_Bjlk_I8_BH_UserArgs_MT128x64x64_MI16x16x1_SN_LDSB0_AFC0_AFEM1_AFEM1_ASEM1_CLR0_CADS0_DTVA0_DTVB0_EPS0_FDSI0_GRPM1_GRVWA4_GRVWB8_GSU0_GSUAMB_GSUC0_GSUWGMRR0_GLS0_ISA942_IU1_K1_LBSPPA1024_LBSPPB512_LBSPPM0_LPA64_LPB16_LPM0_LRVW8_LWPMn1_MIAV0_MIWT4_2_MO40_NTn1_NTA0_NTB0_NTC0_NTD0_NTM0_NEPBS0_NLCA1_NLCB1_ONLL1_PGR2_PLR0_PKA1_SIA3_SS1_SU0_SUM0_SUS64_SPO0_SRVW0_SSO0_SVW4_SK3_SKXCCM8_TLDS0_ULSGRO0_USL1_UIOFGRO0_USFGRO0_VSn1_VWA4_VWB1_WSGRA0_WSGRB0_WS64_WG32_8_1_WGM4_WGMXCC1_WGMXCCGn1
    SolutionIndex: 94
    SolutionNameMin: Cijk_Ailk_Bjlk_I8_BH_UserArgs_MT128x64x64_MI16x16x1_SN_LDSB0_AFC0_AFEM1_AFEM1_ASEM1_CLR1_CADS0_DTVA0_DTVB0_EPS0_FDSI0_GRPM1_GRVWA8_GRVWB8_GSU0_GSUAMB_GSUC0_GSUWGMRR0_GLS0_ISA942_IU1_K1_LBSPPA1024_LBSPPB512_LBSPPM0_LPA64_LPB32_LPM0_LRVW8_LWPMn1_MIAV0_MIWT4_2_MO40_NTn1_NTA0_NTB0_NTC0_NTD0_NTM0_NEPBS0_NLCA1_NLCB1_ONLL1_PGR2_PLR1_PKA1_SIA3_SS1_SU0_SUM0_SUS64_SPO0_SRVW0_SSO0_SVW4_SK3_SKXCCM8_TLDS0_ULSGRO0_USL1_UIOFGRO0_USFGRO0_VSn1_VWA4_VWB2_WSGRA0_WSGRB0_WS64_WG32_8_1_WGM8_WGMXCC1_WGMXCCGn1
    SolutionIndex: 95
    SolutionNameMin: Cijk_Ailk_Bjlk_I8_BH_UserArgs_MT32x128x64_MI16x16x1_SN_LDSB0_AFC0_AFEM1_AFEM1_ASEM1_CLR0_CADS0_DTVA0_DTVB0_EPS0_FDSI0_GRPM1_GRVWA2_GRVWB2_GSU0_GSUAMB_GSUC0_GSUWGMRR0_GLS0_ISA942_IU1_K1_LBSPPA256_LBSPPB1024_LBSPPM0_LPA16_LPB16_LPM0_LRVW8_LWPMn1_MIAV0_MIWT1_4_MO40_NTn1_NTA0_NTB0_NTC0_NTD0_NTM0_NEPBS0_NLCA1_NLCB1_ONLL1_PGR2_PLR0_PKA1_SIA3_SS1_SU0_SUM0_SUS64_SPO0_SRVW0_SSO0_SVW1_SK3_SKXCCM8_TLDS0_ULSGRO0_USL1_UIOFGRO0_USFGRO0_VSn1_VWA1_VWB1_WSGRA0_WSGRB0_WS64_WG32_8_1_WGM1_WGMXCC1_WGMXCCGn1
    SolutionIndex: 96
    SolutionNameMin: Cijk_Ailk_Bjlk_I8_BH_UserArgs_MT128x32x64_MI16x16x1_SN_LDSB0_AFC0_AFEM1_AFEM1_ASEM1_CLR1_CADS0_DTVA0_DTVB0_EPS0_FDSI0_GRPM1_GRVWA8_GRVWB8_GSU0_GSUAMB_GSUC0_GSUWGMRR0_GLS0_ISA942_IU1_K1_LBSPPA1024_LBSPPB256_LBSPPM0_LPA64_LPB16_LPM0_LRVW8_LWPMn1_MIAV0_MIWT4_1_MO40_NTn1_NTA0_NTB0_NTC0_NTD0_NTM0_NEPBS0_NLCA1_NLCB1_ONLL1_PGR2_PLR1_PKA1_SIA3_SS1_SU0_SUM0_SUS64_SPO0_SRVW0_SSO0_SVW4_SK3_SKXCCM8_TLDS0_ULSGRO0_USL1_UIOFGRO0_USFGRO0_VSn1_VWA4_VWB1_WSGRA0_WSGRB0_WS64_WG32_8_1_WGM1_WGMXCC1_WGMXCCGn1
    SolutionIndex: 97
    SolutionNameMin: Cijk_Ailk_Bjlk_I8_BH_UserArgs_MT128x32x64_MI16x16x1_SN_LDSB0_AFC0_AFEM1_AFEM1_ASEM1_CLR0_CADS0_DTVA0_DTVB0_EPS0_FDSI0_GRPM1_GRVWA2_GRVWB8_GSU0_GSUAMB_GSUC0_GSUWGMRR0_GLS0_ISA942_IU1_K1_LBSPPA1024_LBSPPB256_LBSPPM0_LPA64_LPB16_LPM0_LRVW8_LWPMn1_MIAV0_MIWT4_1_MO40_NTn1_NTA0_NTB0_NTC0_NTD0_NTM0_NEPBS0_NLCA1_NLCB1_ONLL1_PGR2_PLR0_PKA1_SIA3_SS1_SU0_SUM0_SUS64_SPO0_SRVW0_SSO0_SVW4_SK3_SKXCCM8_TLDS0_ULSGRO0_USL1_UIOFGRO0_USFGRO0_VSn1_VWA4_VWB1_WSGRA0_WSGRB0_WS64_WG32_8_1_WGM1_WGMXCC1_WGMXCCGn1
    SolutionIndex: 98
    SolutionNameMin: Cijk_Ailk_Bjlk_I8_BH_UserArgs_MT64x64x64_MI16x16x1_SN_LDSB0_AFC0_AFEM1_AFEM1_ASEM1_CLR1_CADS0_DTVA0_DTVB0_EPS0_FDSI0_GRPM1_GRVWA8_GRVWB2_GSU0_GSUAMB_GSUC0_GSUWGMRR0_GLS0_ISA942_IU1_K1_LBSPPA512_LBSPPB512_LBSPPM0_LPA32_LPB16_LPM0_LRVW8_LWPMn1_MIAV0_MIWT2_2_MO40_NTn1_NTA0_NTB0_NTC0_NTD0_NTM0_NEPBS0_NLCA1_NLCB1_ONLL1_PGR2_PLR1_PKA1_SIA3_SS1_SU0_SUM0_SUS64_SPO0_SRVW0_SSO0_SVW2_SK3_SKXCCM8_TLDS0_ULSGRO0_USL1_UIOFGRO0_USFGRO0_VSn1_VWA2_VWB1_WSGRA0_WSGRB0_WS64_WG32_8_1_WGM1_WGMXCC1_WGMXCCGn1
    SolutionIndex: 99
    SolutionNameMin: Cijk_Ailk_Bjlk_I8_BH_UserArgs_MT64x64x64_MI16x16x1_SN_LDSB0_AFC0_AFEM1_AFEM1_ASEM1_CLR1_CADS0_DTVA0_DTVB0_EPS0_FDSI0_GRPM1_GRVWA8_GRVWB4_GSU0_GSUAMB_GSUC0_GSUWGMRR0_GLS0_ISA942_IU1_K1_LBSPPA512_LBSPPB512_LBSPPM0_LPA32_LPB32_LPM0_LRVW8_LWPMn1_MIAV0_MIWT2_2_MO40_NTn1_NTA0_NTB0_NTC0_NTD0_NTM0_NEPBS0_NLCA1_NLCB1_ONLL1_PGR2_PLR1_PKA1_SIA3_SS1_SU0_SUM0_SUS64_SPO0_SRVW0_SSO0_SVW2_SK3_SKXCCM8_TLDS0_ULSGRO0_USL1_UIOFGRO0_USFGRO0_VSn1_VWA2_VWB2_WSGRA0_WSGRB0_WS64_WG32_8_1_WGM1_WGMXCC1_WGMXCCGn1
    SolutionIndex: 100
    SolutionNameMin: Cijk_Ailk_Bjlk_I8_BH_UserArgs_MT64x64x64_MI16x16x1_SN_LDSB0_AFC0_AFEM1_AFEM1_ASEM1_CLR0_CADS0_DTVA0_DTVB0_EPS0_FDSI0_GRPM1_GRVWA4_GRVWB8_GSU0_GSUAMB_GSUC0_GSUWGMRR0_GLS0_ISA942_IU1_K1_LBSPPA512_LBSPPB512_LBSPPM0_LPA32_LPB16_LPM0_LRVW8_LWPMn1_MIAV0_MIWT2_2_MO40_NTn1_NTA0_NTB0_NTC0_NTD0_NTM0_NEPBS0_NLCA1_NLCB1_ONLL1_PGR2_PLR0_PKA1_SIA3_SS1_SU0_SUM0_SUS64_SPO0_SRVW0_SSO0_SVW2_SK3_SKXCCM8_TLDS0_ULSGRO0_USL1_UIOFGRO0_USFGRO0_VSn1_VWA2_VWB1_WSGRA0_WSGRB0_WS64_WG32_8_1_WGM1_WGMXCC1_WGMXCCGn1
    SolutionIndex: 101
    SolutionNameMin: Cijk_Ailk_Bjlk_I8_BH_UserArgs_MT64x64x64_MI16x16x1_SN_LDSB0_AFC0_AFEM1_AFEM1_ASEM1_CLR0_CADS0_DTVA0_DTVB0_EPS0_FDSI0_GRPM1_GRVWA4_GRVWB8_GSU0_GSUAMB_GSUC0_GSUWGMRR0_GLS0_ISA942_IU1_K1_LBSPPA512_LBSPPB512_LBSPPM0_LPA32_LPB32_LPM0_LRVW8_LWPMn1_MIAV0_MIWT2_2_MO40_NTn1_NTA0_NTB0_NTC0_NTD0_NTM0_NEPBS0_NLCA1_NLCB1_ONLL1_PGR2_PLR0_PKA1_SIA3_SS1_SU0_SUM0_SUS64_SPO0_SRVW0_SSO0_SVW2_SK3_SKXCCM8_TLDS0_ULSGRO0_USL1_UIOFGRO0_USFGRO0_VSn1_VWA2_VWB2_WSGRA0_WSGRB0_WS64_WG32_8_1_WGM1_WGMXCC1_WGMXCCGn1
    SolutionIndex: 102
    SolutionNameMin: Cijk_Ailk_Bjlk_I8_BH_UserArgs_MT64x64x64_MI16x16x1_SN_LDSB0_AFC0_AFEM1_AFEM1_ASEM1_CLR1_CADS0_DTVA0_DTVB0_EPS0_FDSI0_GRPM1_GRVWA4_GRVWB4_GSU0_GSUAMB_GSUC0_GSUWGMRR0_GLS0_ISA942_IU1_K1_LBSPPA512_LBSPPB512_LBSPPM0_LPA32_LPB32_LPM0_LRVW8_LWPMn1_MIAV0_MIWT2_2_MO40_NTn1_NTA0_NTB0_NTC0_NTD0_NTM0_NEPBS0_NLCA1_NLCB1_ONLL1_PGR2_PLR1_PKA1_SIA3_SS1_SU0_SUM0_SUS64_SPO0_SRVW0_SSO0_SVW2_SK3_SKXCCM8_TLDS0_ULSGRO0_USL1_UIOFGRO0_USFGRO0_VSn1_VWA2_VWB2_WSGRA0_WSGRB0_WS64_WG32_8_1_WGM8_WGMXCC1_WGMXCCGn1
    SolutionIndex: 103
    SolutionNameMin: Cijk_Ailk_Bjlk_I8_BH_UserArgs_MT64x64x64_MI16x16x1_SN_LDSB0_AFC0_AFEM1_AFEM1_ASEM1_CLR1_CADS0_DTVA0_DTVB0_EPS0_FDSI0_GRPM1_GRVWA4_GRVWB8_GSU0_GSUAMB_GSUC0_GSUWGMRR0_GLS0_ISA942_IU1_K1_LBSPPA512_LBSPPB512_LBSPPM0_LPA32_LPB32_LPM0_LRVW8_LWPMn1_MIAV0_MIWT2_2_MO40_NTn1_NTA0_NTB0_NTC0_NTD0_NTM0_NEPBS0_NLCA1_NLCB1_ONLL1_PGR2_PLR1_PKA1_SIA3_SS1_SU0_SUM0_SUS64_SPO0_SRVW0_SSO0_SVW2_SK3_SKXCCM8_TLDS0_ULSGRO0_USL1_UIOFGRO0_USFGRO0_VSn1_VWA2_VWB2_WSGRA0_WSGRB0_WS64_WG32_8_1_WGM8_WGMXCC1_WGMXCCGn1
    SolutionIndex: 104
    SolutionNameMin: Cijk_Ailk_Bjlk_I8_BH_UserArgs_MT64x64x64_MI16x16x1_SN_LDSB0_AFC0_AFEM1_AFEM1_ASEM1_CLR1_CADS0_DTVA0_DTVB0_EPS0_FDSI0_GRPM1_GRVWA8_GRVWB8_GSU0_GSUAMB_GSUC0_GSUWGMRR0_GLS0_ISA942_IU1_K1_LBSPPA512_LBSPPB512_LBSPPM0_LPA32_LPB32_LPM0_LRVW8_LWPMn1_MIAV0_MIWT2_2_MO40_NTn1_NTA0_NTB0_NTC0_NTD0_NTM0_NEPBS0_NLCA1_NLCB1_ONLL1_PGR2_PLR1_PKA1_SIA3_SS1_SU0_SUM0_SUS64_SPO0_SRVW0_SSO0_SVW2_SK3_SKXCCM8_TLDS0_ULSGRO0_USL1_UIOFGRO0_USFGRO0_VSn1_VWA2_VWB2_WSGRA0_WSGRB0_WS64_WG32_8_1_WGM8_WGMXCC1_WGMXCCGn1
    SolutionIndex: 105
    SolutionNameMin: Cijk_Ailk_Bjlk_I8_BH_UserArgs_MT64x64x64_MI16x16x1_SN_LDSB0_AFC0_AFEM1_AFEM1_ASEM1_CLR0_CADS0_DTVA0_DTVB0_EPS0_FDSI0_GRPM1_GRVWA8_GRVWB2_GSU0_GSUAMB_GSUC0_GSUWGMRR0_GLS0_ISA942_IU1_K1_LBSPPA512_LBSPPB512_LBSPPM0_LPA32_LPB16_LPM0_LRVW8_LWPMn1_MIAV0_MIWT2_2_MO40_NTn1_NTA0_NTB0_NTC0_NTD0_NTM0_NEPBS0_NLCA1_NLCB1_ONLL1_PGR2_PLR0_PKA1_SIA3_SS1_SU0_SUM0_SUS64_SPO0_SRVW0_SSO0_SVW2_SK3_SKXCCM8_TLDS0_ULSGRO0_USL1_UIOFGRO0_USFGRO0_VSn1_VWA2_VWB1_WSGRA0_WSGRB0_WS64_WG32_8_1_WGM8_WGMXCC1_WGMXCCGn1
    SolutionIndex: 106
    SolutionNameMin: Cijk_Ailk_Bjlk_I8_BH_UserArgs_MT32x64x64_MI16x16x1_SN_LDSB0_AFC0_AFEM1_AFEM1_ASEM1_CLR1_CADS0_DTVA0_DTVB0_EPS0_FDSI0_GRPM1_GRVWA4_GRVWB8_GSU0_GSUAMB_GSUC0_GSUWGMRR0_GLS0_ISA942_IU1_K1_LBSPPA256_LBSPPB512_LBSPPM0_LPA16_LPB16_LPM0_LRVW8_LWPMn1_MIAV0_MIWT1_2_MO40_NTn1_NTA0_NTB0_NTC0_NTD0_NTM0_NEPBS0_NLCA1_NLCB1_ONLL1_PGR2_PLR1_PKA1_SIA3_SS1_SU0_SUM0_SUS64_SPO0_SRVW0_SSO0_SVW1_SK3_SKXCCM8_TLDS0_ULSGRO0_USL1_UIOFGRO0_USFGRO0_VSn1_VWA1_VWB1_WSGRA0_WSGRB0_WS64_WG32_8_1_WGM1_WGMXCC1_WGMXCCGn1
    SolutionIndex: 107
    SolutionNameMin: Cijk_Ailk_Bjlk_I8_BH_UserArgs_MT32x64x64_MI16x16x1_SN_LDSB0_AFC0_AFEM1_AFEM1_ASEM1_CLR1_CADS0_DTVA0_DTVB0_EPS0_FDSI0_GRPM1_GRVWA8_GRVWB4_GSU0_GSUAMB_GSUC0_GSUWGMRR0_GLS0_ISA942_IU1_K1_LBSPPA256_LBSPPB512_LBSPPM0_LPA16_LPB16_LPM0_LRVW8_LWPMn1_MIAV0_MIWT1_2_MO40_NTn1_NTA0_NTB0_NTC0_NTD0_NTM0_NEPBS0_NLCA1_NLCB1_ONLL1_PGR2_PLR1_PKA1_SIA3_SS1_SU0_SUM0_SUS64_SPO0_SRVW0_SSO0_SVW1_SK3_SKXCCM8_TLDS0_ULSGRO0_USL1_UIOFGRO0_USFGRO0_VSn1_VWA1_VWB1_WSGRA0_WSGRB0_WS64_WG32_8_1_WGM4_WGMXCC1_WGMXCCGn1
    SolutionIndex: 108
    SolutionNameMin: Cijk_Ailk_Bjlk_I8_BH_UserArgs_MT64x32x64_MI16x16x1_SN_LDSB0_AFC0_AFEM1_AFEM1_ASEM1_CLR1_CADS0_DTVA0_DTVB0_EPS0_FDSI0_GRPM1_GRVWA4_GRVWB8_GSU0_GSUAMB_GSUC0_GSUWGMRR0_GLS0_ISA942_IU1_K1_LBSPPA512_LBSPPB256_LBSPPM0_LPA32_LPB16_LPM0_LRVW8_LWPMn1_MIAV0_MIWT2_1_MO40_NTn1_NTA0_NTB0_NTC0_NTD0_NTM0_NEPBS0_NLCA1_NLCB1_ONLL1_PGR2_PLR1_PKA1_SIA3_SS1_SU0_SUM0_SUS64_SPO0_SRVW0_SSO0_SVW2_SK3_SKXCCM8_TLDS0_ULSGRO0_USL1_UIOFGRO0_USFGRO0_VSn1_VWA2_VWB1_WSGRA0_WSGRB0_WS64_WG32_8_1_WGM1_WGMXCC1_WGMXCCGn1
    SolutionIndex: 109
    SolutionNameMin: Cijk_Ailk_Bjlk_I8_BH_UserArgs_MT64x32x64_MI16x16x1_SN_LDSB0_AFC0_AFEM1_AFEM1_ASEM1_CLR1_CADS0_DTVA0_DTVB0_EPS0_FDSI0_GRPM1_GRVWA8_GRVWB8_GSU0_GSUAMB_GSUC0_GSUWGMRR0_GLS0_ISA942_IU1_K1_LBSPPA512_LBSPPB256_LBSPPM0_LPA32_LPB16_LPM0_LRVW8_LWPMn1_MIAV0_MIWT2_1_MO40_NTn1_NTA0_NTB0_NTC0_NTD0_NTM0_NEPBS0_NLCA1_NLCB1_ONLL1_PGR2_PLR1_PKA1_SIA3_SS1_SU0_SUM0_SUS64_SPO0_SRVW0_SSO0_SVW2_SK3_SKXCCM8_TLDS0_ULSGRO0_USL1_UIOFGRO0_USFGRO0_VSn1_VWA2_VWB1_WSGRA0_WSGRB0_WS64_WG32_8_1_WGM1_WGMXCC1_WGMXCCGn1
    SolutionIndex: 110
    SolutionNameMin: Cijk_Ailk_Bjlk_I8_BH_UserArgs_MT64x32x64_MI16x16x1_SN_LDSB0_AFC0_AFEM1_AFEM1_ASEM1_CLR1_CADS0_DTVA0_DTVB0_EPS0_FDSI0_GRPM1_GRVWA4_GRVWB2_GSU0_GSUAMB_GSUC0_GSUWGMRR0_GLS0_ISA942_IU1_K1_LBSPPA512_LBSPPB256_LBSPPM0_LPA32_LPB16_LPM0_LRVW8_LWPMn1_MIAV0_MIWT2_1_MO40_NTn1_NTA0_NTB0_NTC0_NTD0_NTM0_NEPBS0_NLCA1_NLCB1_ONLL1_PGR2_PLR1_PKA1_SIA3_SS1_SU0_SUM0_SUS64_SPO0_SRVW0_SSO0_SVW2_SK3_SKXCCM8_TLDS0_ULSGRO0_USL1_UIOFGRO0_USFGRO0_VSn1_VWA2_VWB1_WSGRA0_WSGRB0_WS64_WG32_8_1_WGM4_WGMXCC1_WGMXCCGn1
    SolutionIndex: 111
    SolutionNameMin: Cijk_Ailk_Bjlk_I8_BH_UserArgs_MT64x32x64_MI16x16x1_SN_LDSB0_AFC0_AFEM1_AFEM1_ASEM1_CLR1_CADS0_DTVA0_DTVB0_EPS0_FDSI0_GRPM1_GRVWA2_GRVWB4_GSU0_GSUAMB_GSUC0_GSUWGMRR0_GLS0_ISA942_IU1_K1_LBSPPA512_LBSPPB256_LBSPPM0_LPA16_LPB16_LPM0_LRVW8_LWPMn1_MIAV0_MIWT2_1_MO40_NTn1_NTA0_NTB0_NTC0_NTD0_NTM0_NEPBS0_NLCA1_NLCB1_ONLL1_PGR2_PLR1_PKA1_SIA3_SS1_SU0_SUM0_SUS64_SPO0_SRVW0_SSO0_SVW1_SK3_SKXCCM8_TLDS0_ULSGRO0_USL1_UIOFGRO0_USFGRO0_VSn1_VWA1_VWB1_WSGRA0_WSGRB0_WS64_WG32_8_1_WGM8_WGMXCC1_WGMXCCGn1
    SolutionIndex: 112
    SolutionNameMin: Cijk_Ailk_Bjlk_I8_BH_UserArgs_MT64x32x64_MI16x16x1_SN_LDSB0_AFC0_AFEM1_AFEM1_ASEM1_CLR0_CADS0_DTVA0_DTVB0_EPS0_FDSI0_GRPM1_GRVWA8_GRVWB4_GSU0_GSUAMB_GSUC0_GSUWGMRR0_GLS0_ISA942_IU1_K1_LBSPPA512_LBSPPB256_LBSPPM0_LPA16_LPB16_LPM0_LRVW8_LWPMn1_MIAV0_MIWT2_1_MO40_NTn1_NTA0_NTB0_NTC0_NTD0_NTM0_NEPBS0_NLCA1_NLCB1_ONLL1_PGR2_PLR0_PKA1_SIA3_SS1_SU0_SUM0_SUS64_SPO0_SRVW0_SSO0_SVW1_SK3_SKXCCM8_TLDS0_ULSGRO0_USL1_UIOFGRO0_USFGRO0_VSn1_VWA1_VWB1_WSGRA0_WSGRB0_WS64_WG32_8_1_WGM8_WGMXCC1_WGMXCCGn1
    SolutionIndex: 113
    SolutionNameMin: Cijk_Ailk_Bjlk_I8_BH_UserArgs_MT32x32x64_MI16x16x1_SN_LDSB0_AFC0_AFEM1_AFEM1_ASEM1_CLR1_CADS0_DTVA0_DTVB0_EPS0_FDSI0_GRPM1_GRVWA4_GRVWB2_GSU0_GSUAMB_GSUC0_GSUWGMRR0_GLS0_ISA942_IU1_K1_LBSPPA256_LBSPPB256_LBSPPM0_LPA16_LPB16_LPM0_LRVW8_LWPMn1_MIAV0_MIWT1_1_MO40_NTn1_NTA0_NTB0_NTC0_NTD0_NTM0_NEPBS0_NLCA1_NLCB1_ONLL1_PGR2_PLR1_PKA1_SIA3_SS1_SU0_SUM0_SUS64_SPO0_SRVW0_SSO0_SVW1_SK3_SKXCCM8_TLDS0_ULSGRO0_USL1_UIOFGRO0_USFGRO0_VSn1_VWA1_VWB1_WSGRA0_WSGRB0_WS64_WG32_8_1_WGM1_WGMXCC1_WGMXCCGn1
    SolutionIndex: 114
    SolutionNameMin: Cijk_Ailk_Bjlk_I8_BH_UserArgs_MT32x32x64_MI16x16x1_SN_LDSB0_AFC0_AFEM1_AFEM1_ASEM1_CLR1_CADS0_DTVA0_DTVB0_EPS0_FDSI0_GRPM1_GRVWA4_GRVWB4_GSU0_GSUAMB_GSUC0_GSUWGMRR0_GLS0_ISA942_IU1_K1_LBSPPA256_LBSPPB256_LBSPPM0_LPA16_LPB16_LPM0_LRVW8_LWPMn1_MIAV0_MIWT1_1_MO40_NTn1_NTA0_NTB0_NTC0_NTD0_NTM0_NEPBS0_NLCA1_NLCB1_ONLL1_PGR2_PLR1_PKA1_SIA3_SS1_SU0_SUM0_SUS64_SPO0_SRVW0_SSO0_SVW1_SK3_SKXCCM8_TLDS0_ULSGRO0_USL1_UIOFGRO0_USFGRO0_VSn1_VWA1_VWB1_WSGRA0_WSGRB0_WS64_WG32_8_1_WGM4_WGMXCC1_WGMXCCGn1
    SolutionIndex: 115
    SolutionNameMin: Cijk_Ailk_Bjlk_I8_BH_UserArgs_MT32x32x64_MI16x16x1_SN_LDSB0_AFC0_AFEM1_AFEM1_ASEM1_CLR0_CADS0_DTVA0_DTVB0_EPS0_FDSI0_GRPM1_GRVWA2_GRVWB8_GSU0_GSUAMB_GSUC0_GSUWGMRR0_GLS0_ISA942_IU1_K1_LBSPPA256_LBSPPB256_LBSPPM0_LPA16_LPB16_LPM0_LRVW8_LWPMn1_MIAV0_MIWT1_1_MO40_NTn1_NTA0_NTB0_NTC0_NTD0_NTM0_NEPBS0_NLCA1_NLCB1_ONLL1_PGR2_PLR0_PKA1_SIA3_SS1_SU0_SUM0_SUS64_SPO0_SRVW0_SSO0_SVW1_SK3_SKXCCM8_TLDS0_ULSGRO0_USL1_UIOFGRO0_USFGRO0_VSn1_VWA1_VWB1_WSGRA0_WSGRB0_WS64_WG32_8_1_WGM4_WGMXCC1_WGMXCCGn1
    SolutionIndex: 116
    SolutionNameMin: Cijk_Ailk_Bjlk_I8_BH_UserArgs_MT32x32x64_MI16x16x1_SN_LDSB0_AFC0_AFEM1_AFEM1_ASEM1_CLR1_CADS0_DTVA0_DTVB0_EPS0_FDSI0_GRPM1_GRVWA2_GRVWB4_GSU0_GSUAMB_GSUC0_GSUWGMRR0_GLS0_ISA942_IU1_K1_LBSPPA256_LBSPPB256_LBSPPM0_LPA16_LPB16_LPM0_LRVW8_LWPMn1_MIAV0_MIWT1_1_MO40_NTn1_NTA0_NTB0_NTC0_NTD0_NTM0_NEPBS0_NLCA1_NLCB1_ONLL1_PGR2_PLR1_PKA1_SIA3_SS1_SU0_SUM0_SUS64_SPO0_SRVW0_SSO0_SVW1_SK3_SKXCCM8_TLDS0_ULSGRO0_USL1_UIOFGRO0_USFGRO0_VSn1_VWA1_VWB1_WSGRA0_WSGRB0_WS64_WG32_8_1_WGM8_WGMXCC1_WGMXCCGn1
    SolutionIndex: 117
    SolutionNameMin: Cijk_Ailk_Bjlk_I8_BH_UserArgs_MT32x32x64_MI16x16x1_SN_LDSB0_AFC0_AFEM1_AFEM1_ASEM1_CLR1_CADS0_DTVA0_DTVB0_EPS0_FDSI0_GRPM1_GRVWA4_GRVWB8_GSU0_GSUAMB_GSUC0_GSUWGMRR0_GLS0_ISA942_IU1_K1_LBSPPA256_LBSPPB256_LBSPPM0_LPA16_LPB16_LPM0_LRVW8_LWPMn1_MIAV0_MIWT1_1_MO40_NTn1_NTA0_NTB0_NTC0_NTD0_NTM0_NEPBS0_NLCA1_NLCB1_ONLL1_PGR2_PLR1_PKA1_SIA3_SS1_SU0_SUM0_SUS64_SPO0_SRVW0_SSO0_SVW1_SK3_SKXCCM8_TLDS0_ULSGRO0_USL1_UIOFGRO0_USFGRO0_VSn1_VWA1_VWB1_WSGRA0_WSGRB0_WS64_WG32_8_1_WGM8_WGMXCC1_WGMXCCGn1
    SolutionIndex: 118
    SolutionNameMin: Cijk_Ailk_Bjlk_I8_BH_UserArgs_MT32x32x64_MI16x16x1_SN_LDSB0_AFC0_AFEM1_AFEM1_ASEM1_CLR0_CADS0_DTVA0_DTVB0_EPS0_FDSI0_GRPM1_GRVWA2_GRVWB2_GSU0_GSUAMB_GSUC0_GSUWGMRR0_GLS0_ISA942_IU1_K1_LBSPPA256_LBSPPB256_LBSPPM0_LPA16_LPB16_LPM0_LRVW8_LWPMn1_MIAV0_MIWT1_1_MO40_NTn1_NTA0_NTB0_NTC0_NTD0_NTM0_NEPBS0_NLCA1_NLCB1_ONLL1_PGR2_PLR0_PKA1_SIA3_SS1_SU0_SUM0_SUS64_SPO0_SRVW0_SSO0_SVW1_SK3_SKXCCM8_TLDS0_ULSGRO0_USL1_UIOFGRO0_USFGRO0_VSn1_VWA1_VWB1_WSGRA0_WSGRB0_WS64_WG32_8_1_WGM8_WGMXCC1_WGMXCCGn1
    SolutionIndex: 119
    SolutionNameMin: Cijk_Ailk_Bjlk_I8_BH_UserArgs_MT32x32x64_MI16x16x1_SN_LDSB0_AFC0_AFEM1_AFEM1_ASEM1_CLR0_CADS0_DTVA0_DTVB0_EPS0_FDSI0_GRPM1_GRVWA8_GRVWB4_GSU0_GSUAMB_GSUC0_GSUWGMRR0_GLS0_ISA942_IU1_K1_LBSPPA256_LBSPPB256_LBSPPM0_LPA16_LPB16_LPM0_LRVW8_LWPMn1_MIAV0_MIWT1_1_MO40_NTn1_NTA0_NTB0_NTC0_NTD0_NTM0_NEPBS0_NLCA1_NLCB1_ONLL1_PGR2_PLR0_PKA1_SIA3_SS1_SU0_SUM0_SUS64_SPO0_SRVW0_SSO0_SVW1_SK3_SKXCCM8_TLDS0_ULSGRO0_USL1_UIOFGRO0_USFGRO0_VSn1_VWA1_VWB1_WSGRA0_WSGRB0_WS64_WG32_8_1_WGM8_WGMXCC1_WGMXCCGn1
    SolutionIndex: 120
    SolutionNameMin: Cijk_Ailk_Bjlk_I8_BH_UserArgs_MT128x256x128_MI16x16x1_SN_LDSB1_AFC0_AFEM1_AFEM1_ASEM1_CLR1_CADS0_DTVA0_DTVB0_EPS0_FDSI0_GRPM1_GRVWA8_GRVWB8_GSU0_GSUAMB_GSUC0_GSUWGMRR0_GLS0_ISA942_IU1_K1_LBSPPA1024_LBSPPB2048_LBSPPM0_LPA64_LPB0_LPM0_LRVW8_LWPMn1_MIAV0_MIWT4_8_MO40_NTn1_NTA0_NTB0_NTC0_NTD0_NTM0_NEPBS0_NLCA1_NLCB1_ONLL1_PGR2_PLR1_PKA1_SIA3_SS1_SU0_SUM0_SUS128_SPO0_SRVW0_SSO0_SVW4_SK3_SKXCCM8_TLDS0_ULSGRO0_USL1_UIOFGRO0_USFGRO0_VSn1_VWA4_VWB8_WSGRA0_WSGRB0_WS64_WG32_8_1_WGM8_WGMXCC1_WGMXCCGn1
    SolutionIndex: 121
    SolutionNameMin: Cijk_Ailk_Bjlk_I8_BH_UserArgs_MT256x128x128_MI16x16x1_SN_LDSB1_AFC0_AFEM1_AFEM1_ASEM1_CLR1_CADS0_DTVA0_DTVB0_EPS0_FDSI0_GRPM1_GRVWA4_GRVWB8_GSU0_GSUAMB_GSUC0_GSUWGMRR0_GLS0_ISA942_IU1_K1_LBSPPA2048_LBSPPB1024_LBSPPM0_LPA0_LPB64_LPM0_LRVW8_LWPMn1_MIAV0_MIWT8_4_MO40_NTn1_NTA0_NTB0_NTC0_NTD0_NTM0_NEPBS0_NLCA1_NLCB1_ONLL1_PGR2_PLR2_PKA1_SIA3_SS1_SU0_SUM0_SUS128_SPO0_SRVW0_SSO0_SVW8_SK3_SKXCCM8_TLDS0_ULSGRO0_USL1_UIOFGRO0_USFGRO0_VSn1_VWA8_VWB4_WSGRA0_WSGRB0_WS64_WG32_8_1_WGM8_WGMXCC1_WGMXCCGn1
    SolutionIndex: 122
    SolutionNameMin: Cijk_Ailk_Bjlk_I8_BH_UserArgs_MT256x64x128_MI16x16x1_SN_LDSB1_AFC0_AFEM1_AFEM1_ASEM1_CLR1_CADS0_DTVA0_DTVB0_EPS0_FDSI0_GRPM1_GRVWA8_GRVWB4_GSU0_GSUAMB_GSUC0_GSUWGMRR0_GLS0_ISA942_IU1_K1_LBSPPA2048_LBSPPB512_LBSPPM0_LPA64_LPB32_LPM0_LRVW8_LWPMn1_MIAV0_MIWT8_2_MO40_NTn1_NTA0_NTB0_NTC0_NTD0_NTM0_NEPBS0_NLCA1_NLCB1_ONLL1_PGR2_PLR2_PKA1_SIA3_SS1_SU0_SUM0_SUS128_SPO0_SRVW0_SSO0_SVW4_SK3_SKXCCM8_TLDS0_ULSGRO0_USL1_UIOFGRO0_USFGRO0_VSn1_VWA4_VWB2_WSGRA0_WSGRB0_WS64_WG32_8_1_WGM4_WGMXCC1_WGMXCCGn1
    SolutionIndex: 123
    SolutionNameMin: Cijk_Ailk_Bjlk_I8_BH_UserArgs_MT128x128x128_MI16x16x1_SN_LDSB1_AFC0_AFEM1_AFEM1_ASEM1_CLR1_CADS0_DTVA0_DTVB0_EPS0_FDSI0_GRPM1_GRVWA4_GRVWB4_GSU0_GSUAMB_GSUC0_GSUWGMRR0_GLS0_ISA942_IU1_K1_LBSPPA1024_LBSPPB1024_LBSPPM0_LPA64_LPB32_LPM0_LRVW8_LWPMn1_MIAV0_MIWT4_4_MO40_NTn1_NTA0_NTB0_NTC0_NTD0_NTM0_NEPBS0_NLCA1_NLCB1_ONLL1_PGR2_PLR1_PKA1_SIA3_SS1_SU0_SUM0_SUS128_SPO0_SRVW0_SSO0_SVW4_SK3_SKXCCM8_TLDS0_ULSGRO0_USL1_UIOFGRO0_USFGRO0_VSn1_VWA4_VWB2_WSGRA0_WSGRB0_WS64_WG32_8_1_WGM1_WGMXCC1_WGMXCCGn1
    SolutionIndex: 124
    SolutionNameMin: Cijk_Ailk_Bjlk_I8_BH_UserArgs_MT128x128x128_MI16x16x1_SN_LDSB1_AFC0_AFEM1_AFEM1_ASEM1_CLR1_CADS0_DTVA0_DTVB0_EPS0_FDSI0_GRPM1_GRVWA8_GRVWB4_GSU0_GSUAMB_GSUC0_GSUWGMRR0_GLS0_ISA942_IU1_K1_LBSPPA1024_LBSPPB1024_LBSPPM0_LPA64_LPB64_LPM0_LRVW8_LWPMn1_MIAV0_MIWT4_4_MO40_NTn1_NTA0_NTB0_NTC0_NTD0_NTM0_NEPBS0_NLCA1_NLCB1_ONLL1_PGR2_PLR1_PKA1_SIA3_SS1_SU0_SUM0_SUS128_SPO0_SRVW0_SSO0_SVW4_SK3_SKXCCM8_TLDS0_ULSGRO0_USL1_UIOFGRO0_USFGRO0_VSn1_VWA4_VWB4_WSGRA0_WSGRB0_WS64_WG32_8_1_WGM1_WGMXCC1_WGMXCCGn1
    SolutionIndex: 125
    SolutionNameMin: Cijk_Ailk_Bjlk_I8_BH_UserArgs_MT128x128x128_MI16x16x1_SN_LDSB1_AFC0_AFEM1_AFEM1_ASEM1_CLR1_CADS0_DTVA0_DTVB0_EPS0_FDSI0_GRPM1_GRVWA4_GRVWB8_GSU0_GSUAMB_GSUC0_GSUWGMRR0_GLS0_ISA942_IU1_K1_LBSPPA1024_LBSPPB1024_LBSPPM0_LPA64_LPB64_LPM0_LRVW8_LWPMn1_MIAV0_MIWT4_4_MO40_NTn1_NTA0_NTB0_NTC0_NTD0_NTM0_NEPBS0_NLCA1_NLCB1_ONLL1_PGR2_PLR1_PKA1_SIA3_SS1_SU0_SUM0_SUS128_SPO0_SRVW0_SSO0_SVW4_SK3_SKXCCM8_TLDS0_ULSGRO0_USL1_UIOFGRO0_USFGRO0_VSn1_VWA4_VWB4_WSGRA0_WSGRB0_WS64_WG32_8_1_WGM1_WGMXCC1_WGMXCCGn1
    SolutionIndex: 126
    SolutionNameMin: Cijk_Ailk_Bjlk_I8_BH_UserArgs_MT128x128x128_MI16x16x1_SN_LDSB1_AFC0_AFEM1_AFEM1_ASEM1_CLR1_CADS0_DTVA0_DTVB0_EPS0_FDSI0_GRPM1_GRVWA8_GRVWB8_GSU0_GSUAMB_GSUC0_GSUWGMRR0_GLS0_ISA942_IU1_K1_LBSPPA1024_LBSPPB1024_LBSPPM0_LPA64_LPB16_LPM0_LRVW8_LWPMn1_MIAV0_MIWT4_4_MO40_NTn1_NTA0_NTB0_NTC0_NTD0_NTM0_NEPBS0_NLCA1_NLCB1_ONLL1_PGR2_PLR1_PKA1_SIA3_SS1_SU0_SUM0_SUS128_SPO0_SRVW0_SSO0_SVW4_SK3_SKXCCM8_TLDS0_ULSGRO0_USL1_UIOFGRO0_USFGRO0_VSn1_VWA4_VWB1_WSGRA0_WSGRB0_WS64_WG32_8_1_WGM1_WGMXCC1_WGMXCCGn1
    SolutionIndex: 127
    SolutionNameMin: Cijk_Ailk_Bjlk_I8_BH_UserArgs_MT128x128x128_MI16x16x1_SN_LDSB1_AFC0_AFEM1_AFEM1_ASEM1_CLR1_CADS0_DTVA0_DTVB0_EPS0_FDSI0_GRPM1_GRVWA8_GRVWB8_GSU0_GSUAMB_GSUC0_GSUWGMRR0_GLS0_ISA942_IU1_K1_LBSPPA1024_LBSPPB1024_LBSPPM0_LPA64_LPB64_LPM0_LRVW8_LWPMn1_MIAV0_MIWT4_4_MO40_NTn1_NTA0_NTB0_NTC0_NTD0_NTM0_NEPBS0_NLCA1_NLCB1_ONLL1_PGR2_PLR1_PKA1_SIA3_SS1_SU0_SUM0_SUS128_SPO0_SRVW0_SSO0_SVW4_SK3_SKXCCM8_TLDS0_ULSGRO0_USL1_UIOFGRO0_USFGRO0_VSn1_VWA4_VWB4_WSGRA0_WSGRB0_WS64_WG32_8_1_WGM1_WGMXCC1_WGMXCCGn1
    SolutionIndex: 128
    SolutionNameMin: Cijk_Ailk_Bjlk_I8_BH_UserArgs_MT128x128x128_MI16x16x1_SN_LDSB1_AFC0_AFEM1_AFEM1_ASEM1_CLR1_CADS0_DTVA0_DTVB0_EPS0_FDSI0_GRPM1_GRVWA4_GRVWB4_GSU0_GSUAMB_GSUC0_GSUWGMRR0_GLS0_ISA942_IU1_K1_LBSPPA1024_LBSPPB1024_LBSPPM0_LPA64_LPB32_LPM0_LRVW8_LWPMn1_MIAV0_MIWT4_4_MO40_NTn1_NTA0_NTB0_NTC0_NTD0_NTM0_NEPBS0_NLCA1_NLCB1_ONLL1_PGR2_PLR2_PKA1_SIA3_SS1_SU0_SUM0_SUS128_SPO0_SRVW0_SSO0_SVW4_SK3_SKXCCM8_TLDS0_ULSGRO0_USL1_UIOFGRO0_USFGRO0_VSn1_VWA4_VWB2_WSGRA0_WSGRB0_WS64_WG32_8_1_WGM1_WGMXCC1_WGMXCCGn1
    SolutionIndex: 129
    SolutionNameMin: Cijk_Ailk_Bjlk_I8_BH_UserArgs_MT128x128x128_MI16x16x1_SN_LDSB1_AFC0_AFEM1_AFEM1_ASEM1_CLR1_CADS0_DTVA0_DTVB0_EPS0_FDSI0_GRPM1_GRVWA4_GRVWB4_GSU0_GSUAMB_GSUC0_GSUWGMRR0_GLS0_ISA942_IU1_K1_LBSPPA1024_LBSPPB1024_LBSPPM0_LPA64_LPB64_LPM0_LRVW8_LWPMn1_MIAV0_MIWT4_4_MO40_NTn1_NTA0_NTB0_NTC0_NTD0_NTM0_NEPBS0_NLCA1_NLCB1_ONLL1_PGR2_PLR2_PKA1_SIA3_SS1_SU0_SUM0_SUS128_SPO0_SRVW0_SSO0_SVW4_SK3_SKXCCM8_TLDS0_ULSGRO0_USL1_UIOFGRO0_USFGRO0_VSn1_VWA4_VWB4_WSGRA0_WSGRB0_WS64_WG32_8_1_WGM1_WGMXCC1_WGMXCCGn1
    SolutionIndex: 130
    SolutionNameMin: Cijk_Ailk_Bjlk_I8_BH_UserArgs_MT128x128x128_MI16x16x1_SN_LDSB1_AFC0_AFEM1_AFEM1_ASEM1_CLR1_CADS0_DTVA0_DTVB0_EPS0_FDSI0_GRPM1_GRVWA4_GRVWB4_GSU0_GSUAMB_GSUC0_GSUWGMRR0_GLS0_ISA942_IU1_K1_LBSPPA1024_LBSPPB1024_LBSPPM0_LPA64_LPB32_LPM0_LRVW8_LWPMn1_MIAV0_MIWT4_4_MO40_NTn1_NTA0_NTB0_NTC0_NTD0_NTM0_NEPBS0_NLCA1_NLCB1_ONLL1_PGR2_PLR1_PKA1_SIA3_SS1_SU0_SUM0_SUS128_SPO0_SRVW0_SSO0_SVW4_SK3_SKXCCM8_TLDS0_ULSGRO0_USL1_UIOFGRO0_USFGRO0_VSn1_VWA4_VWB2_WSGRA0_WSGRB0_WS64_WG32_8_1_WGM4_WGMXCC1_WGMXCCGn1
    SolutionIndex: 131
    SolutionNameMin: Cijk_Ailk_Bjlk_I8_BH_UserArgs_MT128x128x128_MI16x16x1_SN_LDSB1_AFC0_AFEM1_AFEM1_ASEM1_CLR1_CADS0_DTVA0_DTVB0_EPS0_FDSI0_GRPM1_GRVWA4_GRVWB4_GSU0_GSUAMB_GSUC0_GSUWGMRR0_GLS0_ISA942_IU1_K1_LBSPPA1024_LBSPPB1024_LBSPPM0_LPA32_LPB64_LPM0_LRVW8_LWPMn1_MIAV0_MIWT4_4_MO40_NTn1_NTA0_NTB0_NTC0_NTD0_NTM0_NEPBS0_NLCA1_NLCB1_ONLL1_PGR2_PLR2_PKA1_SIA3_SS1_SU0_SUM0_SUS128_SPO0_SRVW0_SSO0_SVW2_SK3_SKXCCM8_TLDS0_ULSGRO0_USL1_UIOFGRO0_USFGRO0_VSn1_VWA2_VWB4_WSGRA0_WSGRB0_WS64_WG32_8_1_WGM4_WGMXCC1_WGMXCCGn1
    SolutionIndex: 132
    SolutionNameMin: Cijk_Ailk_Bjlk_I8_BH_UserArgs_MT128x128x128_MI16x16x1_SN_LDSB1_AFC0_AFEM1_AFEM1_ASEM1_CLR1_CADS0_DTVA0_DTVB0_EPS0_FDSI0_GRPM1_GRVWA4_GRVWB4_GSU0_GSUAMB_GSUC0_GSUWGMRR0_GLS0_ISA942_IU1_K1_LBSPPA1024_LBSPPB1024_LBSPPM0_LPA64_LPB64_LPM0_LRVW8_LWPMn1_MIAV0_MIWT4_4_MO40_NTn1_NTA0_NTB0_NTC0_NTD0_NTM0_NEPBS0_NLCA1_NLCB1_ONLL1_PGR2_PLR2_PKA1_SIA3_SS1_SU0_SUM0_SUS128_SPO0_SRVW0_SSO0_SVW4_SK3_SKXCCM8_TLDS0_ULSGRO0_USL1_UIOFGRO0_USFGRO0_VSn1_VWA4_VWB4_WSGRA0_WSGRB0_WS64_WG32_8_1_WGM4_WGMXCC1_WGMXCCGn1
    SolutionIndex: 133
    SolutionNameMin: Cijk_Ailk_Bjlk_I8_BH_UserArgs_MT128x128x128_MI16x16x1_SN_LDSB1_AFC0_AFEM1_AFEM1_ASEM1_CLR1_CADS0_DTVA0_DTVB0_EPS0_FDSI0_GRPM1_GRVWA4_GRVWB4_GSU0_GSUAMB_GSUC0_GSUWGMRR0_GLS0_ISA942_IU1_K1_LBSPPA1024_LBSPPB1024_LBSPPM0_LPA64_LPB64_LPM0_LRVW8_LWPMn1_MIAV0_MIWT4_4_MO40_NTn1_NTA0_NTB0_NTC0_NTD0_NTM0_NEPBS0_NLCA1_NLCB1_ONLL1_PGR2_PLR2_PKA1_SIA3_SS1_SU0_SUM0_SUS128_SPO0_SRVW0_SSO0_SVW4_SK3_SKXCCM8_TLDS0_ULSGRO0_USL1_UIOFGRO0_USFGRO0_VSn1_VWA4_VWB4_WSGRA0_WSGRB0_WS64_WG32_8_1_WGM8_WGMXCC1_WGMXCCGn1
    SolutionIndex: 134
    SolutionNameMin: Cijk_Ailk_Bjlk_I8_BH_UserArgs_MT128x64x128_MI16x16x1_SN_LDSB1_AFC0_AFEM1_AFEM1_ASEM1_CLR1_CADS0_DTVA0_DTVB0_EPS0_FDSI0_GRPM1_GRVWA4_GRVWB8_GSU0_GSUAMB_GSUC0_GSUWGMRR0_GLS0_ISA942_IU1_K1_LBSPPA1024_LBSPPB512_LBSPPM0_LPA64_LPB32_LPM0_LRVW8_LWPMn1_MIAV0_MIWT4_2_MO40_NTn1_NTA0_NTB0_NTC0_NTD0_NTM0_NEPBS0_NLCA1_NLCB1_ONLL1_PGR2_PLR1_PKA1_SIA3_SS1_SU0_SUM0_SUS128_SPO0_SRVW0_SSO0_SVW4_SK3_SKXCCM8_TLDS0_ULSGRO0_USL1_UIOFGRO0_USFGRO0_VSn1_VWA4_VWB2_WSGRA0_WSGRB0_WS64_WG32_8_1_WGM1_WGMXCC1_WGMXCCGn1
    SolutionIndex: 135
    SolutionNameMin: Cijk_Ailk_Bjlk_I8_BH_UserArgs_MT128x64x128_MI16x16x1_SN_LDSB1_AFC0_AFEM1_AFEM1_ASEM1_CLR1_CADS0_DTVA0_DTVB0_EPS0_FDSI0_GRPM1_GRVWA4_GRVWB4_GSU0_GSUAMB_GSUC0_GSUWGMRR0_GLS0_ISA942_IU1_K1_LBSPPA1024_LBSPPB512_LBSPPM0_LPA64_LPB32_LPM0_LRVW8_LWPMn1_MIAV0_MIWT4_2_MO40_NTn1_NTA0_NTB0_NTC0_NTD0_NTM0_NEPBS0_NLCA1_NLCB1_ONLL1_PGR2_PLR2_PKA1_SIA3_SS1_SU0_SUM0_SUS128_SPO0_SRVW0_SSO0_SVW4_SK3_SKXCCM8_TLDS0_ULSGRO0_USL1_UIOFGRO0_USFGRO0_VSn1_VWA4_VWB2_WSGRA0_WSGRB0_WS64_WG32_8_1_WGM1_WGMXCC1_WGMXCCGn1
    SolutionIndex: 136
    SolutionNameMin: Cijk_Ailk_Bjlk_I8_BH_UserArgs_MT128x64x128_MI16x16x1_SN_LDSB1_AFC0_AFEM1_AFEM1_ASEM1_CLR1_CADS0_DTVA0_DTVB0_EPS0_FDSI0_GRPM1_GRVWA4_GRVWB8_GSU0_GSUAMB_GSUC0_GSUWGMRR0_GLS0_ISA942_IU1_K1_LBSPPA1024_LBSPPB512_LBSPPM0_LPA32_LPB32_LPM0_LRVW8_LWPMn1_MIAV0_MIWT4_2_MO40_NTn1_NTA0_NTB0_NTC0_NTD0_NTM0_NEPBS0_NLCA1_NLCB1_ONLL1_PGR2_PLR2_PKA1_SIA3_SS1_SU0_SUM0_SUS128_SPO0_SRVW0_SSO0_SVW2_SK3_SKXCCM8_TLDS0_ULSGRO0_USL1_UIOFGRO0_USFGRO0_VSn1_VWA2_VWB2_WSGRA0_WSGRB0_WS64_WG32_8_1_WGM1_WGMXCC1_WGMXCCGn1
    SolutionIndex: 137
    SolutionNameMin: Cijk_Ailk_Bjlk_I8_BH_UserArgs_MT128x64x128_MI16x16x1_SN_LDSB1_AFC0_AFEM1_AFEM1_ASEM1_CLR1_CADS0_DTVA0_DTVB0_EPS0_FDSI0_GRPM1_GRVWA4_GRVWB8_GSU0_GSUAMB_GSUC0_GSUWGMRR0_GLS0_ISA942_IU1_K1_LBSPPA1024_LBSPPB512_LBSPPM0_LPA64_LPB32_LPM0_LRVW8_LWPMn1_MIAV0_MIWT4_2_MO40_NTn1_NTA0_NTB0_NTC0_NTD0_NTM0_NEPBS0_NLCA1_NLCB1_ONLL1_PGR2_PLR2_PKA1_SIA3_SS1_SU0_SUM0_SUS128_SPO0_SRVW0_SSO0_SVW4_SK3_SKXCCM8_TLDS0_ULSGRO0_USL1_UIOFGRO0_USFGRO0_VSn1_VWA4_VWB2_WSGRA0_WSGRB0_WS64_WG32_8_1_WGM1_WGMXCC1_WGMXCCGn1
    SolutionIndex: 138
    SolutionNameMin: Cijk_Ailk_Bjlk_I8_BH_UserArgs_MT128x64x128_MI16x16x1_SN_LDSB1_AFC0_AFEM1_AFEM1_ASEM1_CLR1_CADS0_DTVA0_DTVB0_EPS0_FDSI0_GRPM1_GRVWA4_GRVWB8_GSU0_GSUAMB_GSUC0_GSUWGMRR0_GLS0_ISA942_IU1_K1_LBSPPA1024_LBSPPB512_LBSPPM0_LPA64_LPB32_LPM0_LRVW8_LWPMn1_MIAV0_MIWT4_2_MO40_NTn1_NTA0_NTB0_NTC0_NTD0_NTM0_NEPBS0_NLCA1_NLCB1_ONLL1_PGR2_PLR1_PKA1_SIA3_SS1_SU0_SUM0_SUS128_SPO0_SRVW0_SSO0_SVW4_SK3_SKXCCM8_TLDS0_ULSGRO0_USL1_UIOFGRO0_USFGRO0_VSn1_VWA4_VWB2_WSGRA0_WSGRB0_WS64_WG32_8_1_WGM4_WGMXCC1_WGMXCCGn1
    SolutionIndex: 139
    SolutionNameMin: Cijk_Ailk_Bjlk_I8_BH_UserArgs_MT128x64x128_MI16x16x1_SN_LDSB1_AFC0_AFEM1_AFEM1_ASEM1_CLR1_CADS0_DTVA0_DTVB0_EPS0_FDSI0_GRPM1_GRVWA4_GRVWB8_GSU0_GSUAMB_GSUC0_GSUWGMRR0_GLS0_ISA942_IU1_K1_LBSPPA1024_LBSPPB512_LBSPPM0_LPA64_LPB32_LPM0_LRVW8_LWPMn1_MIAV0_MIWT4_2_MO40_NTn1_NTA0_NTB0_NTC0_NTD0_NTM0_NEPBS0_NLCA1_NLCB1_ONLL1_PGR2_PLR2_PKA1_SIA3_SS1_SU0_SUM0_SUS128_SPO0_SRVW0_SSO0_SVW4_SK3_SKXCCM8_TLDS0_ULSGRO0_USL1_UIOFGRO0_USFGRO0_VSn1_VWA4_VWB2_WSGRA0_WSGRB0_WS64_WG32_8_1_WGM4_WGMXCC1_WGMXCCGn1
    SolutionIndex: 140
    SolutionNameMin: Cijk_Ailk_Bjlk_I8_BH_UserArgs_MT128x64x128_MI16x16x1_SN_LDSB1_AFC0_AFEM1_AFEM1_ASEM1_CLR1_CADS0_DTVA0_DTVB0_EPS0_FDSI0_GRPM1_GRVWA4_GRVWB8_GSU0_GSUAMB_GSUC0_GSUWGMRR0_GLS0_ISA942_IU1_K1_LBSPPA1024_LBSPPB512_LBSPPM0_LPA64_LPB32_LPM0_LRVW8_LWPMn1_MIAV0_MIWT4_2_MO40_NTn1_NTA0_NTB0_NTC0_NTD0_NTM0_NEPBS0_NLCA1_NLCB1_ONLL1_PGR2_PLR1_PKA1_SIA3_SS1_SU0_SUM0_SUS128_SPO0_SRVW0_SSO0_SVW4_SK3_SKXCCM8_TLDS0_ULSGRO0_USL1_UIOFGRO0_USFGRO0_VSn1_VWA4_VWB2_WSGRA0_WSGRB0_WS64_WG32_8_1_WGM8_WGMXCC1_WGMXCCGn1
    SolutionIndex: 141
    SolutionNameMin: Cijk_Ailk_Bjlk_I8_BH_UserArgs_MT128x64x128_MI16x16x1_SN_LDSB1_AFC0_AFEM1_AFEM1_ASEM1_CLR1_CADS0_DTVA0_DTVB0_EPS0_FDSI0_GRPM1_GRVWA4_GRVWB8_GSU0_GSUAMB_GSUC0_GSUWGMRR0_GLS0_ISA942_IU1_K1_LBSPPA1024_LBSPPB512_LBSPPM0_LPA64_LPB32_LPM0_LRVW8_LWPMn1_MIAV0_MIWT4_2_MO40_NTn1_NTA0_NTB0_NTC0_NTD0_NTM0_NEPBS0_NLCA1_NLCB1_ONLL1_PGR2_PLR2_PKA1_SIA3_SS1_SU0_SUM0_SUS128_SPO0_SRVW0_SSO0_SVW4_SK3_SKXCCM8_TLDS0_ULSGRO0_USL1_UIOFGRO0_USFGRO0_VSn1_VWA4_VWB2_WSGRA0_WSGRB0_WS64_WG32_8_1_WGM8_WGMXCC1_WGMXCCGn1
    SolutionIndex: 142
    SolutionNameMin: Cijk_Ailk_Bjlk_I8_BH_UserArgs_MT64x64x128_MI16x16x1_SN_LDSB1_AFC0_AFEM1_AFEM1_ASEM1_CLR1_CADS0_DTVA0_DTVB0_EPS0_FDSI0_GRPM1_GRVWA4_GRVWB4_GSU0_GSUAMB_GSUC0_GSUWGMRR0_GLS0_ISA942_IU1_K1_LBSPPA512_LBSPPB512_LBSPPM0_LPA32_LPB32_LPM0_LRVW8_LWPMn1_MIAV0_MIWT2_2_MO40_NTn1_NTA0_NTB0_NTC0_NTD0_NTM0_NEPBS0_NLCA1_NLCB1_ONLL1_PGR2_PLR1_PKA1_SIA3_SS1_SU0_SUM0_SUS128_SPO0_SRVW0_SSO0_SVW2_SK3_SKXCCM8_TLDS0_ULSGRO0_USL1_UIOFGRO0_USFGRO0_VSn1_VWA2_VWB2_WSGRA0_WSGRB0_WS64_WG32_8_1_WGM1_WGMXCC1_WGMXCCGn1
    SolutionIndex: 143
    SolutionNameMin: Cijk_Ailk_Bjlk_I8_BH_UserArgs_MT64x64x128_MI16x16x1_SN_LDSB1_AFC0_AFEM1_AFEM1_ASEM1_CLR1_CADS0_DTVA0_DTVB0_EPS0_FDSI0_GRPM1_GRVWA8_GRVWB4_GSU0_GSUAMB_GSUC0_GSUWGMRR0_GLS0_ISA942_IU1_K1_LBSPPA512_LBSPPB512_LBSPPM0_LPA32_LPB32_LPM0_LRVW8_LWPMn1_MIAV0_MIWT2_2_MO40_NTn1_NTA0_NTB0_NTC0_NTD0_NTM0_NEPBS0_NLCA1_NLCB1_ONLL1_PGR2_PLR1_PKA1_SIA3_SS1_SU0_SUM0_SUS128_SPO0_SRVW0_SSO0_SVW2_SK3_SKXCCM8_TLDS0_ULSGRO0_USL1_UIOFGRO0_USFGRO0_VSn1_VWA2_VWB2_WSGRA0_WSGRB0_WS64_WG32_8_1_WGM1_WGMXCC1_WGMXCCGn1
    SolutionIndex: 144
    SolutionNameMin: Cijk_Ailk_Bjlk_I8_BH_UserArgs_MT64x64x128_MI16x16x1_SN_LDSB1_AFC0_AFEM1_AFEM1_ASEM1_CLR1_CADS0_DTVA0_DTVB0_EPS0_FDSI0_GRPM1_GRVWA4_GRVWB8_GSU0_GSUAMB_GSUC0_GSUWGMRR0_GLS0_ISA942_IU1_K1_LBSPPA512_LBSPPB512_LBSPPM0_LPA32_LPB32_LPM0_LRVW8_LWPMn1_MIAV0_MIWT2_2_MO40_NTn1_NTA0_NTB0_NTC0_NTD0_NTM0_NEPBS0_NLCA1_NLCB1_ONLL1_PGR2_PLR1_PKA1_SIA3_SS1_SU0_SUM0_SUS128_SPO0_SRVW0_SSO0_SVW2_SK3_SKXCCM8_TLDS0_ULSGRO0_USL1_UIOFGRO0_USFGRO0_VSn1_VWA2_VWB2_WSGRA0_WSGRB0_WS64_WG32_8_1_WGM1_WGMXCC1_WGMXCCGn1
    SolutionIndex: 145
    SolutionNameMin: Cijk_Ailk_Bjlk_I8_BH_UserArgs_MT64x64x128_MI16x16x1_SN_LDSB1_AFC0_AFEM1_AFEM1_ASEM1_CLR1_CADS0_DTVA0_DTVB0_EPS0_FDSI0_GRPM1_GRVWA4_GRVWB8_GSU0_GSUAMB_GSUC0_GSUWGMRR0_GLS0_ISA942_IU1_K1_LBSPPA512_LBSPPB512_LBSPPM0_LPA32_LPB32_LPM0_LRVW8_LWPMn1_MIAV0_MIWT2_2_MO40_NTn1_NTA0_NTB0_NTC0_NTD0_NTM0_NEPBS0_NLCA1_NLCB1_ONLL1_PGR2_PLR2_PKA1_SIA3_SS1_SU0_SUM0_SUS128_SPO0_SRVW0_SSO0_SVW2_SK3_SKXCCM8_TLDS0_ULSGRO0_USL1_UIOFGRO0_USFGRO0_VSn1_VWA2_VWB2_WSGRA0_WSGRB0_WS64_WG32_8_1_WGM1_WGMXCC1_WGMXCCGn1
    SolutionIndex: 146
    SolutionNameMin: Cijk_Ailk_Bjlk_I8_BH_UserArgs_MT64x64x128_MI16x16x1_SN_LDSB1_AFC0_AFEM1_AFEM1_ASEM1_CLR1_CADS0_DTVA0_DTVB0_EPS0_FDSI0_GRPM1_GRVWA8_GRVWB4_GSU0_GSUAMB_GSUC0_GSUWGMRR0_GLS0_ISA942_IU1_K1_LBSPPA512_LBSPPB512_LBSPPM0_LPA32_LPB32_LPM0_LRVW8_LWPMn1_MIAV0_MIWT2_2_MO40_NTn1_NTA0_NTB0_NTC0_NTD0_NTM0_NEPBS0_NLCA1_NLCB1_ONLL1_PGR2_PLR1_PKA1_SIA3_SS1_SU0_SUM0_SUS128_SPO0_SRVW0_SSO0_SVW2_SK3_SKXCCM8_TLDS0_ULSGRO0_USL1_UIOFGRO0_USFGRO0_VSn1_VWA2_VWB2_WSGRA0_WSGRB0_WS64_WG32_8_1_WGM4_WGMXCC1_WGMXCCGn1
    SolutionIndex: 147
    SolutionNameMin: Cijk_Ailk_Bjlk_I8_BH_UserArgs_MT64x64x128_MI16x16x1_SN_LDSB1_AFC0_AFEM1_AFEM1_ASEM1_CLR1_CADS0_DTVA0_DTVB0_EPS0_FDSI0_GRPM1_GRVWA4_GRVWB8_GSU0_GSUAMB_GSUC0_GSUWGMRR0_GLS0_ISA942_IU1_K1_LBSPPA512_LBSPPB512_LBSPPM0_LPA32_LPB32_LPM0_LRVW8_LWPMn1_MIAV0_MIWT2_2_MO40_NTn1_NTA0_NTB0_NTC0_NTD0_NTM0_NEPBS0_NLCA1_NLCB1_ONLL1_PGR2_PLR1_PKA1_SIA3_SS1_SU0_SUM0_SUS128_SPO0_SRVW0_SSO0_SVW2_SK3_SKXCCM8_TLDS0_ULSGRO0_USL1_UIOFGRO0_USFGRO0_VSn1_VWA2_VWB2_WSGRA0_WSGRB0_WS64_WG32_8_1_WGM4_WGMXCC1_WGMXCCGn1
    SolutionIndex: 148
    SolutionNameMin: Cijk_Ailk_Bjlk_I8_BH_UserArgs_MT64x64x128_MI16x16x1_SN_LDSB1_AFC0_AFEM1_AFEM1_ASEM1_CLR1_CADS0_DTVA0_DTVB0_EPS0_FDSI0_GRPM1_GRVWA4_GRVWB8_GSU0_GSUAMB_GSUC0_GSUWGMRR0_GLS0_ISA942_IU1_K1_LBSPPA512_LBSPPB512_LBSPPM0_LPA32_LPB32_LPM0_LRVW8_LWPMn1_MIAV0_MIWT2_2_MO40_NTn1_NTA0_NTB0_NTC0_NTD0_NTM0_NEPBS0_NLCA1_NLCB1_ONLL1_PGR2_PLR1_PKA1_SIA3_SS1_SU0_SUM0_SUS128_SPO0_SRVW0_SSO0_SVW2_SK3_SKXCCM8_TLDS0_ULSGRO0_USL1_UIOFGRO0_USFGRO0_VSn1_VWA2_VWB2_WSGRA0_WSGRB0_WS64_WG32_8_1_WGM8_WGMXCC1_WGMXCCGn1
    SolutionIndex: 149
    SolutionNameMin: Cijk_Ailk_Bjlk_I8_BH_UserArgs_MT64x64x128_MI16x16x1_SN_LDSB1_AFC0_AFEM1_AFEM1_ASEM1_CLR1_CADS0_DTVA0_DTVB0_EPS0_FDSI0_GRPM1_GRVWA4_GRVWB8_GSU0_GSUAMB_GSUC0_GSUWGMRR0_GLS0_ISA942_IU1_K1_LBSPPA512_LBSPPB512_LBSPPM0_LPA32_LPB32_LPM0_LRVW8_LWPMn1_MIAV0_MIWT2_2_MO40_NTn1_NTA0_NTB0_NTC0_NTD0_NTM0_NEPBS0_NLCA1_NLCB1_ONLL1_PGR2_PLR2_PKA1_SIA3_SS1_SU0_SUM0_SUS128_SPO0_SRVW0_SSO0_SVW2_SK3_SKXCCM8_TLDS0_ULSGRO0_USL1_UIOFGRO0_USFGRO0_VSn1_VWA2_VWB2_WSGRA0_WSGRB0_WS64_WG32_8_1_WGM8_WGMXCC1_WGMXCCGn1
    SolutionIndex: 150
    SolutionNameMin: Cijk_Ailk_Bjlk_I8_BH_UserArgs_MT32x64x128_MI16x16x1_SN_LDSB0_AFC0_AFEM1_AFEM1_ASEM1_CLR1_CADS0_DTVA0_DTVB0_EPS0_FDSI0_GRPM1_GRVWA8_GRVWB8_GSU0_GSUAMB_GSUC0_GSUWGMRR0_GLS0_ISA942_IU1_K1_LBSPPA256_LBSPPB512_LBSPPM0_LPA16_LPB32_LPM0_LRVW8_LWPMn1_MIAV0_MIWT1_2_MO40_NTn1_NTA0_NTB0_NTC0_NTD0_NTM0_NEPBS0_NLCA1_NLCB1_ONLL1_PGR2_PLR1_PKA1_SIA3_SS1_SU0_SUM0_SUS128_SPO0_SRVW0_SSO0_SVW1_SK3_SKXCCM8_TLDS0_ULSGRO0_USL1_UIOFGRO0_USFGRO0_VSn1_VWA1_VWB2_WSGRA0_WSGRB0_WS64_WG32_8_1_WGM1_WGMXCC1_WGMXCCGn1
    SolutionIndex: 151
    SolutionNameMin: Cijk_Ailk_Bjlk_I8_BH_UserArgs_MT32x64x128_MI16x16x1_SN_LDSB0_AFC0_AFEM1_AFEM1_ASEM1_CLR1_CADS0_DTVA0_DTVB0_EPS0_FDSI0_GRPM1_GRVWA8_GRVWB8_GSU0_GSUAMB_GSUC0_GSUWGMRR0_GLS0_ISA942_IU1_K1_LBSPPA256_LBSPPB512_LBSPPM0_LPA16_LPB32_LPM0_LRVW8_LWPMn1_MIAV0_MIWT1_2_MO40_NTn1_NTA0_NTB0_NTC0_NTD0_NTM0_NEPBS0_NLCA1_NLCB1_ONLL1_PGR2_PLR2_PKA1_SIA3_SS1_SU0_SUM0_SUS128_SPO0_SRVW0_SSO0_SVW1_SK3_SKXCCM8_TLDS0_ULSGRO0_USL1_UIOFGRO0_USFGRO0_VSn1_VWA1_VWB2_WSGRA0_WSGRB0_WS64_WG32_8_1_WGM8_WGMXCC1_WGMXCCGn1
    SolutionIndex: 152
    SolutionNameMin: Cijk_Ailk_Bjlk_I8_BH_UserArgs_MT64x32x128_MI16x16x1_SN_LDSB0_AFC0_AFEM1_AFEM1_ASEM1_CLR1_CADS0_DTVA0_DTVB0_EPS0_FDSI0_GRPM1_GRVWA8_GRVWB8_GSU0_GSUAMB_GSUC0_GSUWGMRR0_GLS0_ISA942_IU1_K1_LBSPPA512_LBSPPB256_LBSPPM0_LPA32_LPB16_LPM0_LRVW8_LWPMn1_MIAV0_MIWT2_1_MO40_NTn1_NTA0_NTB0_NTC0_NTD0_NTM0_NEPBS0_NLCA1_NLCB1_ONLL1_PGR2_PLR1_PKA1_SIA3_SS1_SU0_SUM0_SUS128_SPO0_SRVW0_SSO0_SVW2_SK3_SKXCCM8_TLDS0_ULSGRO0_USL1_UIOFGRO0_USFGRO0_VSn1_VWA2_VWB1_WSGRA0_WSGRB0_WS64_WG32_8_1_WGM1_WGMXCC1_WGMXCCGn1
    SolutionIndex: 153
    SolutionNameMin: Cijk_Ailk_Bjlk_I8_BH_UserArgs_MT64x32x128_MI16x16x1_SN_LDSB0_AFC0_AFEM1_AFEM1_ASEM1_CLR1_CADS0_DTVA0_DTVB0_EPS0_FDSI0_GRPM1_GRVWA4_GRVWB2_GSU0_GSUAMB_GSUC0_GSUWGMRR0_GLS0_ISA942_IU1_K1_LBSPPA512_LBSPPB256_LBSPPM0_LPA32_LPB16_LPM0_LRVW8_LWPMn1_MIAV0_MIWT2_1_MO40_NTn1_NTA0_NTB0_NTC0_NTD0_NTM0_NEPBS0_NLCA1_NLCB1_ONLL1_PGR2_PLR1_PKA1_SIA3_SS1_SU0_SUM0_SUS128_SPO0_SRVW0_SSO0_SVW2_SK3_SKXCCM8_TLDS0_ULSGRO0_USL1_UIOFGRO0_USFGRO0_VSn1_VWA2_VWB1_WSGRA0_WSGRB0_WS64_WG32_8_1_WGM4_WGMXCC1_WGMXCCGn1
    SolutionIndex: 154
    SolutionNameMin: Cijk_Ailk_Bjlk_I8_BH_UserArgs_MT64x32x128_MI16x16x1_SN_LDSB0_AFC0_AFEM1_AFEM1_ASEM1_CLR1_CADS0_DTVA0_DTVB0_EPS0_FDSI0_GRPM1_GRVWA4_GRVWB8_GSU0_GSUAMB_GSUC0_GSUWGMRR0_GLS0_ISA942_IU1_K1_LBSPPA512_LBSPPB256_LBSPPM0_LPA32_LPB16_LPM0_LRVW8_LWPMn1_MIAV0_MIWT2_1_MO40_NTn1_NTA0_NTB0_NTC0_NTD0_NTM0_NEPBS0_NLCA1_NLCB1_ONLL1_PGR2_PLR1_PKA1_SIA3_SS1_SU0_SUM0_SUS128_SPO0_SRVW0_SSO0_SVW2_SK3_SKXCCM8_TLDS0_ULSGRO0_USL1_UIOFGRO0_USFGRO0_VSn1_VWA2_VWB1_WSGRA0_WSGRB0_WS64_WG32_8_1_WGM4_WGMXCC1_WGMXCCGn1
    SolutionIndex: 155
    SolutionNameMin: Cijk_Ailk_Bjlk_I8_BH_UserArgs_MT64x32x128_MI16x16x1_SN_LDSB0_AFC0_AFEM1_AFEM1_ASEM1_CLR1_CADS0_DTVA0_DTVB0_EPS0_FDSI0_GRPM1_GRVWA8_GRVWB8_GSU0_GSUAMB_GSUC0_GSUWGMRR0_GLS0_ISA942_IU1_K1_LBSPPA512_LBSPPB256_LBSPPM0_LPA32_LPB16_LPM0_LRVW8_LWPMn1_MIAV0_MIWT2_1_MO40_NTn1_NTA0_NTB0_NTC0_NTD0_NTM0_NEPBS0_NLCA1_NLCB1_ONLL1_PGR2_PLR1_PKA1_SIA3_SS1_SU0_SUM0_SUS128_SPO0_SRVW0_SSO0_SVW2_SK3_SKXCCM8_TLDS0_ULSGRO0_USL1_UIOFGRO0_USFGRO0_VSn1_VWA2_VWB1_WSGRA0_WSGRB0_WS64_WG32_8_1_WGM4_WGMXCC1_WGMXCCGn1
    SolutionIndex: 156
    SolutionNameMin: Cijk_Ailk_Bjlk_I8_BH_UserArgs_MT32x32x128_MI16x16x1_SN_LDSB0_AFC0_AFEM1_AFEM1_ASEM1_CLR1_CADS0_DTVA0_DTVB0_EPS0_FDSI0_GRPM1_GRVWA4_GRVWB8_GSU0_GSUAMB_GSUC0_GSUWGMRR0_GLS0_ISA942_IU1_K1_LBSPPA256_LBSPPB256_LBSPPM0_LPA16_LPB16_LPM0_LRVW8_LWPMn1_MIAV0_MIWT1_1_MO40_NTn1_NTA0_NTB0_NTC0_NTD0_NTM0_NEPBS0_NLCA1_NLCB1_ONLL1_PGR2_PLR1_PKA1_SIA3_SS1_SU0_SUM0_SUS128_SPO0_SRVW0_SSO0_SVW1_SK3_SKXCCM8_TLDS0_ULSGRO0_USL1_UIOFGRO0_USFGRO0_VSn1_VWA1_VWB1_WSGRA0_WSGRB0_WS64_WG32_8_1_WGM1_WGMXCC1_WGMXCCGn1
    SolutionIndex: 157
    SolutionNameMin: Cijk_Ailk_Bjlk_I8_BH_UserArgs_MT32x32x128_MI16x16x1_SN_LDSB0_AFC0_AFEM1_AFEM1_ASEM1_CLR1_CADS0_DTVA0_DTVB0_EPS0_FDSI0_GRPM1_GRVWA8_GRVWB8_GSU0_GSUAMB_GSUC0_GSUWGMRR0_GLS0_ISA942_IU1_K1_LBSPPA256_LBSPPB256_LBSPPM0_LPA16_LPB16_LPM0_LRVW8_LWPMn1_MIAV0_MIWT1_1_MO40_NTn1_NTA0_NTB0_NTC0_NTD0_NTM0_NEPBS0_NLCA1_NLCB1_ONLL1_PGR2_PLR1_PKA1_SIA3_SS1_SU0_SUM0_SUS128_SPO0_SRVW0_SSO0_SVW1_SK3_SKXCCM8_TLDS0_ULSGRO0_USL1_UIOFGRO0_USFGRO0_VSn1_VWA1_VWB1_WSGRA0_WSGRB0_WS64_WG32_8_1_WGM1_WGMXCC1_WGMXCCGn1
    SolutionIndex: 158
    SolutionNameMin: Cijk_Ailk_Bjlk_I8_BH_UserArgs_MT32x32x128_MI16x16x1_SN_LDSB0_AFC0_AFEM1_AFEM1_ASEM1_CLR1_CADS0_DTVA0_DTVB0_EPS0_FDSI0_GRPM1_GRVWA4_GRVWB2_GSU0_GSUAMB_GSUC0_GSUWGMRR0_GLS0_ISA942_IU1_K1_LBSPPA256_LBSPPB256_LBSPPM0_LPA16_LPB16_LPM0_LRVW8_LWPMn1_MIAV0_MIWT1_1_MO40_NTn1_NTA0_NTB0_NTC0_NTD0_NTM0_NEPBS0_NLCA1_NLCB1_ONLL1_PGR2_PLR2_PKA1_SIA3_SS1_SU0_SUM0_SUS128_SPO0_SRVW0_SSO0_SVW1_SK3_SKXCCM8_TLDS0_ULSGRO0_USL1_UIOFGRO0_USFGRO0_VSn1_VWA1_VWB1_WSGRA0_WSGRB0_WS64_WG32_8_1_WGM1_WGMXCC1_WGMXCCGn1
    SolutionIndex: 159
    SolutionNameMin: Cijk_Ailk_Bjlk_I8_BH_UserArgs_MT32x32x128_MI16x16x1_SN_LDSB0_AFC0_AFEM1_AFEM1_ASEM1_CLR1_CADS0_DTVA0_DTVB0_EPS0_FDSI0_GRPM1_GRVWA8_GRVWB8_GSU0_GSUAMB_GSUC0_GSUWGMRR0_GLS0_ISA942_IU1_K1_LBSPPA256_LBSPPB256_LBSPPM0_LPA16_LPB16_LPM0_LRVW8_LWPMn1_MIAV0_MIWT1_1_MO40_NTn1_NTA0_NTB0_NTC0_NTD0_NTM0_NEPBS0_NLCA1_NLCB1_ONLL1_PGR2_PLR2_PKA1_SIA3_SS1_SU0_SUM0_SUS128_SPO0_SRVW0_SSO0_SVW1_SK3_SKXCCM8_TLDS0_ULSGRO0_USL1_UIOFGRO0_USFGRO0_VSn1_VWA1_VWB1_WSGRA0_WSGRB0_WS64_WG32_8_1_WGM1_WGMXCC1_WGMXCCGn1
    SolutionIndex: 160
    SolutionNameMin: Cijk_Ailk_Bjlk_I8_BH_UserArgs_MT32x32x128_MI16x16x1_SN_LDSB0_AFC0_AFEM1_AFEM1_ASEM1_CLR1_CADS0_DTVA0_DTVB0_EPS0_FDSI0_GRPM1_GRVWA8_GRVWB8_GSU0_GSUAMB_GSUC0_GSUWGMRR0_GLS0_ISA942_IU1_K1_LBSPPA256_LBSPPB256_LBSPPM0_LPA16_LPB16_LPM0_LRVW8_LWPMn1_MIAV0_MIWT1_1_MO40_NTn1_NTA0_NTB0_NTC0_NTD0_NTM0_NEPBS0_NLCA1_NLCB1_ONLL1_PGR2_PLR1_PKA1_SIA3_SS1_SU0_SUM0_SUS128_SPO0_SRVW0_SSO0_SVW1_SK3_SKXCCM8_TLDS0_ULSGRO0_USL1_UIOFGRO0_USFGRO0_VSn1_VWA1_VWB1_WSGRA0_WSGRB0_WS64_WG32_8_1_WGM8_WGMXCC1_WGMXCCGn1
    SolutionIndex: 161
    SolutionNameMin: Cijk_Ailk_Bjlk_I8_BH_UserArgs_MT64x64x256_MI16x16x1_SN_LDSB1_AFC0_AFEM1_AFEM1_ASEM1_CLR1_CADS0_DTVA0_DTVB0_EPS0_FDSI0_GRPM1_GRVWA4_GRVWB8_GSU0_GSUAMB_GSUC0_GSUWGMRR0_GLS0_ISA942_IU1_K1_LBSPPA512_LBSPPB512_LBSPPM0_LPA32_LPB32_LPM0_LRVW8_LWPMn1_MIAV0_MIWT2_2_MO40_NTn1_NTA0_NTB0_NTC0_NTD0_NTM0_NEPBS0_NLCA1_NLCB1_ONLL1_PGR2_PLR1_PKA1_SIA3_SS1_SU0_SUM0_SUS256_SPO0_SRVW0_SSO0_SVW2_SK3_SKXCCM8_TLDS0_ULSGRO0_USL1_UIOFGRO0_USFGRO0_VSn1_VWA2_VWB2_WSGRA0_WSGRB0_WS64_WG32_8_1_WGM1_WGMXCC1_WGMXCCGn1
    SolutionIndex: 162
    SolutionNameMin: Cijk_Ailk_Bjlk_I8_BH_UserArgs_MT64x32x256_MI16x16x1_SN_LDSB1_AFC0_AFEM1_AFEM1_ASEM1_CLR1_CADS0_DTVA0_DTVB0_EPS0_FDSI0_GRPM1_GRVWA4_GRVWB8_GSU0_GSUAMB_GSUC0_GSUWGMRR0_GLS0_ISA942_IU1_K1_LBSPPA512_LBSPPB256_LBSPPM0_LPA32_LPB16_LPM0_LRVW8_LWPMn1_MIAV0_MIWT2_1_MO40_NTn1_NTA0_NTB0_NTC0_NTD0_NTM0_NEPBS0_NLCA1_NLCB1_ONLL1_PGR2_PLR1_PKA1_SIA3_SS1_SU0_SUM0_SUS256_SPO0_SRVW0_SSO0_SVW2_SK3_SKXCCM8_TLDS0_ULSGRO0_USL1_UIOFGRO0_USFGRO0_VSn1_VWA2_VWB1_WSGRA0_WSGRB0_WS64_WG32_8_1_WGM1_WGMXCC1_WGMXCCGn1
    SolutionIndex: 163
    SolutionNameMin: Cijk_Ailk_Bjlk_I8_BH_UserArgs_MT64x32x256_MI16x16x1_SN_LDSB1_AFC0_AFEM1_AFEM1_ASEM1_CLR1_CADS0_DTVA0_DTVB0_EPS0_FDSI0_GRPM1_GRVWA4_GRVWB8_GSU0_GSUAMB_GSUC0_GSUWGMRR0_GLS0_ISA942_IU1_K1_LBSPPA512_LBSPPB256_LBSPPM0_LPA32_LPB16_LPM0_LRVW8_LWPMn1_MIAV0_MIWT2_1_MO40_NTn1_NTA0_NTB0_NTC0_NTD0_NTM0_NEPBS0_NLCA1_NLCB1_ONLL1_PGR2_PLR2_PKA1_SIA3_SS1_SU0_SUM0_SUS256_SPO0_SRVW0_SSO0_SVW2_SK3_SKXCCM8_TLDS0_ULSGRO0_USL1_UIOFGRO0_USFGRO0_VSn1_VWA2_VWB1_WSGRA0_WSGRB0_WS64_WG32_8_1_WGM1_WGMXCC1_WGMXCCGn1
    SolutionIndex: 164
    SolutionNameMin: Cijk_Ailk_Bjlk_I8_BH_UserArgs_MT32x32x256_MI16x16x1_SN_LDSB1_AFC0_AFEM1_AFEM1_ASEM1_CLR1_CADS0_DTVA0_DTVB0_EPS0_FDSI0_GRPM1_GRVWA4_GRVWB8_GSU0_GSUAMB_GSUC0_GSUWGMRR0_GLS0_ISA942_IU1_K1_LBSPPA256_LBSPPB256_LBSPPM0_LPA16_LPB16_LPM0_LRVW8_LWPMn1_MIAV0_MIWT1_1_MO40_NTn1_NTA0_NTB0_NTC0_NTD0_NTM0_NEPBS0_NLCA1_NLCB1_ONLL1_PGR2_PLR1_PKA1_SIA3_SS1_SU0_SUM0_SUS256_SPO0_SRVW0_SSO0_SVW1_SK3_SKXCCM8_TLDS0_ULSGRO0_USL1_UIOFGRO0_USFGRO0_VSn1_VWA1_VWB1_WSGRA0_WSGRB0_WS64_WG32_8_1_WGM1_WGMXCC1_WGMXCCGn1
    SolutionIndex: 165
    SolutionNameMin: Cijk_Ailk_Bjlk_I8_BH_UserArgs_MT32x32x256_MI16x16x1_SN_LDSB1_AFC0_AFEM1_AFEM1_ASEM1_CLR1_CADS0_DTVA0_DTVB0_EPS0_FDSI0_GRPM1_GRVWA2_GRVWB4_GSU0_GSUAMB_GSUC0_GSUWGMRR0_GLS0_ISA942_IU1_K1_LBSPPA256_LBSPPB256_LBSPPM0_LPA16_LPB16_LPM0_LRVW8_LWPMn1_MIAV0_MIWT1_1_MO40_NTn1_NTA0_NTB0_NTC0_NTD0_NTM0_NEPBS0_NLCA1_NLCB1_ONLL1_PGR2_PLR2_PKA1_SIA3_SS1_SU0_SUM0_SUS256_SPO0_SRVW0_SSO0_SVW1_SK3_SKXCCM8_TLDS0_ULSGRO0_USL1_UIOFGRO0_USFGRO0_VSn1_VWA1_VWB1_WSGRA0_WSGRB0_WS64_WG32_8_1_WGM1_WGMXCC1_WGMXCCGn1
    SolutionIndex: 166
    SolutionNameMin: Cijk_Ailk_Bjlk_I8_BH_UserArgs_MT32x32x256_MI16x16x1_SN_LDSB1_AFC0_AFEM1_AFEM1_ASEM1_CLR1_CADS0_DTVA0_DTVB0_EPS0_FDSI0_GRPM1_GRVWA4_GRVWB8_GSU0_GSUAMB_GSUC0_GSUWGMRR0_GLS0_ISA942_IU1_K1_LBSPPA256_LBSPPB256_LBSPPM0_LPA16_LPB16_LPM0_LRVW8_LWPMn1_MIAV0_MIWT1_1_MO40_NTn1_NTA0_NTB0_NTC0_NTD0_NTM0_NEPBS0_NLCA1_NLCB1_ONLL1_PGR2_PLR1_PKA1_SIA3_SS1_SU0_SUM0_SUS256_SPO0_SRVW0_SSO0_SVW1_SK3_SKXCCM8_TLDS0_ULSGRO0_USL1_UIOFGRO0_USFGRO0_VSn1_VWA1_VWB1_WSGRA0_WSGRB0_WS64_WG32_8_1_WGM4_WGMXCC1_WGMXCCGn1
    SolutionIndex: 167
    SolutionNameMin: Cijk_Ailk_Bjlk_I8_BH_UserArgs_MT32x32x32_MI16x16x1_SN_LDSB0_AFC0_AFEM1_AFEM1_ASEM1_CLR0_CADS0_DTVA0_DTVB0_EPS0_FDSI0_GRPM1_GRVWA1_GRVWB1_GSU0_GSUAMB_GSUC0_GSUWGMRR0_GLS0_ISA942_IU1_K1_LBSPPA256_LBSPPB256_LBSPPM0_LPA16_LPB16_LPM0_LRVW8_LWPMn1_MIAV0_MIWT1_1_MO40_NTn1_NTA0_NTB0_NTC0_NTD0_NTM0_NEPBS0_NLCA1_NLCB1_ONLL1_PGR2_PLR0_PKA1_SIA3_SS1_SU32_SUM0_SUS256_SPO0_SRVW0_SSO0_SVW1_SK3_SKXCCM0_TLDS0_ULSGRO0_USL1_UIOFGRO0_USFGROn1_VSn1_VWA1_VWB1_WSGRA0_WSGRB0_WS64_WG32_8_1_WGM8_WGMXCC1_WGMXCCGn1
- - - [128, 128, 1, 128, 128, 128, 128, 128]
    - [116, 0.61]
  - - [128, 128, 1, 256, 128, 128, 128, 128]
    - [158, 0.99]
  - - [128, 128, 1, 512, 128, 128, 128, 128]
    - [116, 1.51]
  - - [128, 128, 1, 1024, 128, 128, 128, 128]
    - [166, 2.09]
  - - [128, 128, 1, 2048, 128, 128, 128, 128]
    - [160, 2.86]
  - - [128, 128, 1, 4096, 128, 128, 128, 128]
    - [157, 3.47]
  - - [128, 128, 1, 8192, 128, 128, 128, 128]
    - [160, 3.83]
  - - [128, 256, 1, 128, 128, 128, 128, 256]
    - [117, 0.89]
  - - [128, 256, 1, 256, 128, 128, 128, 256]
    - [115, 1.53]
  - - [128, 256, 1, 512, 128, 128, 128, 256]
    - [116, 2.64]
  - - [128, 256, 1, 1024, 128, 128, 128, 256]
    - [165, 4.08]
  - - [128, 256, 1, 2048, 128, 128, 128, 256]
    - [157, 5.58]
  - - [128, 256, 1, 4096, 128, 128, 128, 256]
    - [164, 6.74]
  - - [128, 256, 1, 8192, 128, 128, 128, 256]
    - [164, 7.49]
  - - [128, 512, 1, 128, 128, 128, 128, 512]
    - [96, 1.7]
  - - [128, 512, 1, 256, 128, 128, 128, 512]
    - [103, 3.05]
  - - [128, 512, 1, 512, 128, 128, 128, 512]
    - [110, 4.97]
  - - [128, 512, 1, 1024, 128, 128, 128, 512]
    - [153, 7.43]
  - - [128, 512, 1, 2048, 128, 128, 128, 512]
    - [155, 10.01]
  - - [128, 512, 1, 4096, 128, 128, 128, 512]
    - [152, 11.58]
  - - [128, 512, 1, 8192, 128, 128, 128, 512]
    - [162, 12.79]
  - - [128, 1024, 1, 128, 128, 128, 128, 1024]
    - [105, 3.14]
  - - [128, 1024, 1, 256, 128, 128, 128, 1024]
    - [97, 5.76]
  - - [128, 1024, 1, 512, 128, 128, 128, 1024]
    - [142, 9.17]
  - - [128, 1024, 1, 1024, 128, 128, 128, 1024]
    - [142, 13.14]
  - - [128, 1024, 1, 2048, 128, 128, 128, 1024]
    - [149, 16.87]
  - - [128, 1024, 1, 4096, 128, 128, 128, 1024]
    - [144, 20.03]
  - - [128, 1024, 1, 8192, 128, 128, 128, 1024]
    - [144, 21.53]
  - - [128, 2048, 1, 128, 128, 128, 128, 2048]
    - [92, 5.79]
  - - [128, 2048, 1, 256, 128, 128, 128, 2048]
    - [85, 10.22]
  - - [128, 2048, 1, 512, 128, 128, 128, 2048]
    - [138, 15.86]
  - - [128, 2048, 1, 1024, 128, 128, 128, 2048]
    - [135, 21.9]
  - - [128, 2048, 1, 2048, 128, 128, 128, 2048]
    - [137, 27.6]
  - - [128, 2048, 1, 4096, 128, 128, 128, 2048]
    - [137, 31.28]
  - - [128, 2048, 1, 8192, 128, 128, 128, 2048]
    - [137, 33.91]
  - - [128, 4096, 1, 128, 128, 128, 128, 4096]
    - [126, 9.89]
  - - [128, 4096, 1, 256, 128, 128, 128, 4096]
    - [132, 16.55]
  - - [128, 4096, 1, 512, 128, 128, 128, 4096]
    - [81, 24.23]
  - - [128, 4096, 1, 1024, 128, 128, 128, 4096]
    - [131, 32.44]
  - - [128, 4096, 1, 2048, 128, 128, 128, 4096]
    - [82, 39.87]
  - - [128, 4096, 1, 4096, 128, 128, 128, 4096]
    - [129, 44.78]
  - - [128, 4096, 1, 8192, 128, 128, 128, 4096]
    - [129, 47.86]
  - - [128, 8192, 1, 128, 128, 128, 128, 8192]
    - [17, 15.1]
  - - [128, 8192, 1, 256, 128, 128, 128, 8192]
    - [62, 23.01]
  - - [128, 8192, 1, 512, 128, 128, 128, 8192]
    - [64, 35.02]
  - - [128, 8192, 1, 1024, 128, 128, 128, 8192]
    - [60, 45.68]
  - - [128, 8192, 1, 2048, 128, 128, 128, 8192]
    - [63, 54.76]
  - - [128, 8192, 1, 4096, 128, 128, 128, 8192]
    - [120, 59.7]
  - - [128, 8192, 1, 8192, 128, 128, 128, 8192]
    - [65, 64.36]
  - - [256, 128, 1, 128, 256, 256, 256, 128]
    - [118, 0.94]
  - - [256, 128, 1, 256, 256, 256, 256, 128]
    - [113, 1.68]
  - - [256, 128, 1, 512, 256, 256, 256, 128]
    - [114, 2.72]
  - - [256, 128, 1, 1024, 256, 256, 256, 128]
    - [119, 4.23]
  - - [256, 128, 1, 2048, 256, 256, 256, 128]
    - [156, 5.49]
  - - [256, 128, 1, 4096, 256, 256, 256, 128]
    - [160, 6.73]
  - - [256, 128, 1, 8192, 256, 256, 256, 128]
    - [159, 7.48]
  - - [256, 256, 1, 128, 256, 256, 256, 256]
    - [111, 1.79]
  - - [256, 256, 1, 256, 256, 256, 256, 256]
    - [106, 3.23]
  - - [256, 256, 1, 512, 256, 256, 256, 256]
    - [108, 4.99]
  - - [256, 256, 1, 1024, 256, 256, 256, 256]
    - [154, 7.59]
  - - [256, 256, 1, 2048, 256, 256, 256, 256]
    - [151, 10.05]
  - - [256, 256, 1, 4096, 256, 256, 256, 256]
    - [150, 11.51]
  - - [256, 256, 1, 8192, 256, 256, 256, 256]
    - [163, 12.73]
  - - [256, 512, 1, 128, 256, 256, 256, 512]
    - [98, 3.31]
  - - [256, 512, 1, 256, 256, 256, 256, 512]
    - [104, 5.73]
  - - [256, 512, 1, 512, 256, 256, 256, 512]
    - [101, 8.99]
  - - [256, 512, 1, 1024, 256, 256, 256, 512]
    - [161, 13.4]
  - - [256, 512, 1, 2048, 256, 256, 256, 512]
    - [144, 16.88]
  - - [256, 512, 1, 4096, 256, 256, 256, 512]
    - [144, 20.06]
  - - [256, 512, 1, 8192, 256, 256, 256, 512]
    - [148, 21.43]
  - - [256, 1024, 1, 128, 256, 256, 256, 1024]
    - [86, 6.25]
  - - [256, 1024, 1, 256, 256, 256, 256, 1024]
    - [90, 10.11]
  - - [256, 1024, 1, 512, 256, 256, 256, 1024]
    - [87, 15.55]
  - - [256, 1024, 1, 1024, 256, 256, 256, 1024]
    - [135, 21.58]
  - - [256, 1024, 1, 2048, 256, 256, 256, 1024]
    - [137, 27.48]
  - - [256, 1024, 1, 4096, 256, 256, 256, 1024]
    - [141, 31.08]
  - - [256, 1024, 1, 8192, 256, 256, 256, 1024]
    - [139, 34.13]
  - - [256, 2048, 1, 128, 256, 256, 256, 2048]
    - [79, 10.25]
  - - [256, 2048, 1, 256, 256, 256, 256, 2048]
    - [78, 16.88]
  - - [256, 2048, 1, 512, 256, 256, 256, 2048]
    - [125, 24.18]
  - - [256, 2048, 1, 1024, 256, 256, 256, 2048]
    - [80, 33.34]
  - - [256, 2048, 1, 2048, 256, 256, 256, 2048]
    - [129, 39.91]
  - - [256, 2048, 1, 4096, 256, 256, 256, 2048]
    - [133, 45.67]
  - - [256, 2048, 1, 8192, 256, 256, 256, 2048]
    - [132, 48.77]
  - - [256, 4096, 1, 128, 256, 256, 256, 4096]
    - [69, 15.31]
  - - [256, 4096, 1, 256, 256, 256, 256, 4096]
    - [66, 23.79]
  - - [256, 4096, 1, 512, 256, 256, 256, 4096]
    - [69, 35.08]
  - - [256, 4096, 1, 1024, 256, 256, 256, 4096]
    - [65, 45.83]
  - - [256, 4096, 1, 2048, 256, 256, 256, 4096]
    - [61, 55.57]
  - - [256, 4096, 1, 4096, 256, 256, 256, 4096]
    - [75, 61.52]
  - - [256, 4096, 1, 8192, 256, 256, 256, 4096]
    - [73, 64.91]
  - - [256, 8192, 1, 128, 256, 256, 256, 8192]
    - [11, 18.85]
  - - [256, 8192, 1, 256, 256, 256, 256, 8192]
    - [9, 31.22]
  - - [256, 8192, 1, 512, 256, 256, 256, 8192]
    - [25, 45.6]
  - - [256, 8192, 1, 1024, 256, 256, 256, 8192]
    - [56, 59.4]
  - - [256, 8192, 1, 2048, 256, 256, 256, 8192]
    - [32, 70.52]
  - - [256, 8192, 1, 4096, 256, 256, 256, 8192]
    - [33, 77.9]
  - - [256, 8192, 1, 8192, 256, 256, 256, 8192]
    - [31, 81.25]
  - - [512, 128, 1, 128, 512, 512, 512, 128]
    - [112, 1.65]
  - - [512, 128, 1, 256, 512, 512, 512, 128]
    - [107, 3.35]
  - - [512, 128, 1, 512, 512, 512, 512, 128]
    - [109, 5.18]
  - - [512, 128, 1, 1024, 512, 512, 512, 128]
    - [155, 7.71]
  - - [512, 128, 1, 2048, 512, 512, 512, 128]
    - [150, 10.03]
  - - [512, 128, 1, 4096, 512, 512, 512, 128]
    - [152, 11.49]
  - - [512, 128, 1, 8192, 512, 512, 512, 128]
    - [155, 12.57]
  - - [512, 256, 1, 128, 512, 512, 512, 256]
    - [21, 3.43]
  - - [512, 256, 1, 256, 512, 512, 512, 256]
    - [102, 6.14]
  - - [512, 256, 1, 512, 512, 512, 512, 256]
    - [99, 9.66]
  - - [512, 256, 1, 1024, 512, 512, 512, 256]
    - [146, 13.22]
  - - [512, 256, 1, 2048, 512, 512, 512, 256]
    - [148, 16.71]
  - - [512, 256, 1, 4096, 512, 512, 512, 256]
    - [145, 19.71]
  - - [512, 256, 1, 8192, 512, 512, 512, 256]
    - [145, 20.3]
  - - [512, 512, 1, 128, 512, 512, 512, 512]
    - [93, 6.05]
  - - [512, 512, 1, 256, 512, 512, 512, 512]
    - [89, 10.67]
  - - [512, 512, 1, 512, 512, 512, 512, 512]
    - [88, 15.89]
  - - [512, 512, 1, 1024, 512, 512, 512, 512]
    - [86, 21.93]
  - - [512, 512, 1, 2048, 512, 512, 512, 512]
    - [137, 27.45]
  - - [512, 512, 1, 4096, 512, 512, 512, 512]
    - [137, 31.16]
  - - [512, 512, 1, 8192, 512, 512, 512, 512]
    - [139, 33.3]
  - - [512, 1024, 1, 128, 512, 512, 512, 1024]
    - [20, 9.81]
  - - [512, 1024, 1, 256, 512, 512, 512, 1024]
    - [124, 16.75]
  - - [512, 1024, 1, 512, 512, 512, 512, 1024]
    - [130, 25.25]
  - - [512, 1024, 1, 1024, 512, 512, 512, 1024]
    - [129, 33.56]
  - - [512, 1024, 1, 2048, 512, 512, 512, 1024]
    - [129, 40.3]
  - - [512, 1024, 1, 4096, 512, 512, 512, 1024]
    - [83, 44.39]
  - - [512, 1024, 1, 8192, 512, 512, 512, 1024]
    - [129, 47.78]
  - - [512, 2048, 1, 128, 512, 512, 512, 2048]
    - [68, 14.91]
  - - [512, 2048, 1, 256, 512, 512, 512, 2048]
    - [59, 23.65]
  - - [512, 2048, 1, 512, 512, 512, 512, 2048]
    - [63, 35.63]
  - - [512, 2048, 1, 1024, 512, 512, 512, 2048]
    - [61, 47.18]
  - - [512, 2048, 1, 2048, 512, 512, 512, 2048]
    - [70, 55.72]
  - - [512, 2048, 1, 4096, 512, 512, 512, 2048]
    - [61, 61.35]
  - - [512, 2048, 1, 8192, 512, 512, 512, 2048]
    - [61, 64.96]
  - - [512, 4096, 1, 128, 512, 512, 512, 4096]
    - [13, 19.18]
  - - [512, 4096, 1, 256, 512, 512, 512, 4096]
    - [33, 30.73]
  - - [512, 4096, 1, 512, 512, 512, 512, 4096]
    - [23, 45.38]
  - - [512, 4096, 1, 1024, 512, 512, 512, 4096]
    - [33, 59.75]
  - - [512, 4096, 1, 2048, 512, 512, 512, 4096]
    - [32, 70.5]
  - - [512, 4096, 1, 4096, 512, 512, 512, 4096]
    - [32, 77.66]
  - - [512, 4096, 1, 8192, 512, 512, 512, 4096]
    - [56, 81.91]
  - - [512, 8192, 1, 128, 512, 512, 512, 8192]
    - [12, 20.33]
  - - [512, 8192, 1, 256, 512, 512, 512, 8192]
    - [33, 33.24]
  - - [512, 8192, 1, 512, 512, 512, 512, 8192]
    - [56, 47.82]
  - - [512, 8192, 1, 1024, 512, 512, 512, 8192]
    - [33, 61.1]
  - - [512, 8192, 1, 2048, 512, 512, 512, 8192]
    - [33, 71.64]
  - - [512, 8192, 1, 4096, 512, 512, 512, 8192]
    - [33, 78.2]
  - - [512, 8192, 1, 8192, 512, 512, 512, 8192]
    - [41, 82.16]
  - - [1024, 128, 1, 128, 1024, 1024, 1024, 128]
    - [95, 3.3]
  - - [1024, 128, 1, 256, 1024, 1024, 1024, 128]
    - [100, 5.99]
  - - [1024, 128, 1, 512, 1024, 1024, 1024, 128]
    - [143, 9.15]
  - - [1024, 128, 1, 1024, 1024, 1024, 1024, 128]
    - [144, 12.8]
  - - [1024, 128, 1, 2048, 1024, 1024, 1024, 128]
    - [147, 16.79]
  - - [1024, 128, 1, 4096, 1024, 1024, 1024, 128]
    - [145, 18.61]
  - - [1024, 128, 1, 8192, 1024, 1024, 1024, 128]
    - [148, 20.1]
  - - [1024, 256, 1, 128, 1024, 1024, 1024, 256]
    - [84, 5.71]
  - - [1024, 256, 1, 256, 1024, 1024, 1024, 256]
    - [91, 10.47]
  - - [1024, 256, 1, 512, 1024, 1024, 1024, 256]
    - [94, 15.82]
  - - [1024, 256, 1, 1024, 1024, 1024, 1024, 256]
    - [134, 21.88]
  - - [1024, 256, 1, 2048, 1024, 1024, 1024, 256]
    - [137, 27.27]
  - - [1024, 256, 1, 4096, 1024, 1024, 1024, 256]
    - [88, 30.2]
  - - [1024, 256, 1, 8192, 1024, 1024, 1024, 256]
    - [139, 33.12]
  - - [1024, 512, 1, 128, 1024, 1024, 1024, 512]
    - [127, 9.83]
  - - [1024, 512, 1, 256, 1024, 1024, 1024, 512]
    - [81, 16.04]
  - - [1024, 512, 1, 512, 1024, 1024, 1024, 512]
    - [76, 24.32]
  - - [1024, 512, 1, 1024, 1024, 1024, 1024, 512]
    - [128, 32.99]
  - - [1024, 512, 1, 2048, 1024, 1024, 1024, 512]
    - [129, 40.17]
  - - [1024, 512, 1, 4096, 1024, 1024, 1024, 512]
    - [83, 44.96]
  - - [1024, 512, 1, 8192, 1024, 1024, 1024, 512]
    - [129, 47.36]
  - - [1024, 1024, 1, 128, 1024, 1024, 1024, 1024]
    - [67, 14.73]
  - - [1024, 1024, 1, 256, 1024, 1024, 1024, 1024]
    - [73, 23.6]
  - - [1024, 1024, 1, 512, 1024, 1024, 1024, 1024]
    - [69, 35.12]
  - - [1024, 1024, 1, 1024, 1024, 1024, 1024, 1024]
    - [70, 46.73]
  - - [1024, 1024, 1, 2048, 1024, 1024, 1024, 1024]
    - [64, 55.79]
  - - [1024, 1024, 1, 4096, 1024, 1024, 1024, 1024]
    - [64, 61.43]
  - - [1024, 1024, 1, 8192, 1024, 1024, 1024, 1024]
    - [75, 65.11]
  - - [1024, 2048, 1, 128, 1024, 1024, 1024, 2048]
    - [14, 18.65]
  - - [1024, 2048, 1, 256, 1024, 1024, 1024, 2048]
    - [57, 30.62]
  - - [1024, 2048, 1, 512, 1024, 1024, 1024, 2048]
    - [31, 44.5]
  - - [1024, 2048, 1, 1024, 1024, 1024, 1024, 2048]
    - [32, 59.22]
  - - [1024, 2048, 1, 2048, 1024, 1024, 1024, 2048]
    - [23, 70.59]
  - - [1024, 2048, 1, 4096, 1024, 1024, 1024, 2048]
    - [32, 77.86]
  - - [1024, 2048, 1, 8192, 1024, 1024, 1024, 2048]
    - [33, 82.22]
  - - [1024, 4096, 1, 128, 1024, 1024, 1024, 4096]
    - [33, 20.1]
  - - [1024, 4096, 1, 256, 1024, 1024, 1024, 4096]
    - [5, 32.61]
  - - [1024, 4096, 1, 512, 1024, 1024, 1024, 4096]
    - [56, 47.85]
  - - [1024, 4096, 1, 1024, 1024, 1024, 1024, 4096]
    - [33, 62.01]
  - - [1024, 4096, 1, 2048, 1024, 1024, 1024, 4096]
    - [33, 72.39]
  - - [1024, 4096, 1, 4096, 1024, 1024, 1024, 4096]
    - [56, 78.76]
  - - [1024, 4096, 1, 8192, 1024, 1024, 1024, 4096]
    - [33, 82.83]
  - - [1024, 8192, 1, 128, 1024, 1024, 1024, 8192]
    - [8, 21.11]
  - - [1024, 8192, 1, 256, 1024, 1024, 1024, 8192]
    - [24, 34.06]
  - - [1024, 8192, 1, 512, 1024, 1024, 1024, 8192]
    - [25, 48.94]
  - - [1024, 8192, 1, 1024, 1024, 1024, 1024, 8192]
    - [23, 62.74]
  - - [1024, 8192, 1, 2048, 1024, 1024, 1024, 8192]
    - [33, 73.01]
  - - [1024, 8192, 1, 4096, 1024, 1024, 1024, 8192]
    - [56, 79.37]
  - - [1024, 8192, 1, 8192, 1024, 1024, 1024, 8192]
    - [4, 81.29]
  - - [2048, 128, 1, 128, 2048, 2048, 2048, 128]
    - [89, 6.2]
  - - [2048, 128, 1, 256, 2048, 2048, 2048, 128]
    - [140, 10.11]
  - - [2048, 128, 1, 512, 2048, 2048, 2048, 128]
    - [136, 15.65]
  - - [2048, 128, 1, 1024, 2048, 2048, 2048, 128]
    - [134, 22.22]
  - - [2048, 128, 1, 2048, 2048, 2048, 2048, 128]
    - [139, 26.19]
  - - [2048, 128, 1, 4096, 2048, 2048, 2048, 128]
    - [137, 30.34]
  - - [2048, 128, 1, 8192, 2048, 2048, 2048, 128]
    - [139, 33.05]
  - - [2048, 256, 1, 128, 2048, 2048, 2048, 256]
    - [20, 10.27]
  - - [2048, 256, 1, 256, 2048, 2048, 2048, 256]
    - [82, 16.63]
  - - [2048, 256, 1, 512, 2048, 2048, 2048, 256]
    - [79, 24.58]
  - - [2048, 256, 1, 1024, 2048, 2048, 2048, 256]
    - [123, 33.6]
  - - [2048, 256, 1, 2048, 2048, 2048, 2048, 256]
    - [79, 39.58]
  - - [2048, 256, 1, 4096, 2048, 2048, 2048, 256]
    - [79, 44.12]
  - - [2048, 256, 1, 8192, 2048, 2048, 2048, 256]
    - [79, 47.19]
  - - [2048, 512, 1, 128, 2048, 2048, 2048, 512]
    - [19, 14.42]
  - - [2048, 512, 1, 256, 2048, 2048, 2048, 512]
    - [72, 24.19]
  - - [2048, 512, 1, 512, 2048, 2048, 2048, 512]
    - [71, 35.61]
  - - [2048, 512, 1, 1024, 2048, 2048, 2048, 512]
    - [61, 46.94]
  - - [2048, 512, 1, 2048, 2048, 2048, 2048, 512]
    - [64, 55.44]
  - - [2048, 512, 1, 4096, 2048, 2048, 2048, 512]
    - [61, 61.09]
  - - [2048, 512, 1, 8192, 2048, 2048, 2048, 512]
    - [70, 65.31]
  - - [2048, 1024, 1, 128, 2048, 2048, 2048, 1024]
    - [33, 19.0]
  - - [2048, 1024, 1, 256, 2048, 2048, 2048, 1024]
    - [6, 30.56]
  - - [2048, 1024, 1, 512, 2048, 2048, 2048, 1024]
    - [33, 45.54]
  - - [2048, 1024, 1, 1024, 2048, 2048, 2048, 1024]
    - [49, 59.41]
  - - [2048, 1024, 1, 2048, 2048, 2048, 2048, 1024]
    - [25, 70.4]
  - - [2048, 1024, 1, 4096, 2048, 2048, 2048, 1024]
    - [36, 77.02]
  - - [2048, 1024, 1, 8192, 2048, 2048, 2048, 1024]
    - [41, 82.23]
  - - [2048, 2048, 1, 128, 2048, 2048, 2048, 2048]
    - [2, 20.04]
  - - [2048, 2048, 1, 256, 2048, 2048, 2048, 2048]
    - [33, 32.09]
  - - [2048, 2048, 1, 512, 2048, 2048, 2048, 2048]
    - [25, 47.07]
  - - [2048, 2048, 1, 1024, 2048, 2048, 2048, 2048]
    - [33, 61.94]
  - - [2048, 2048, 1, 2048, 2048, 2048, 2048, 2048]
    - [33, 71.99]
  - - [2048, 2048, 1, 4096, 2048, 2048, 2048, 2048]
    - [56, 79.02]
  - - [2048, 2048, 1, 8192, 2048, 2048, 2048, 2048]
    - [41, 82.84]
  - - [2048, 4096, 1, 128, 2048, 2048, 2048, 4096]
    - [1, 21.21]
  - - [2048, 4096, 1, 256, 2048, 2048, 2048, 4096]
    - [55, 33.48]
  - - [2048, 4096, 1, 512, 2048, 2048, 2048, 4096]
    - [23, 48.65]
  - - [2048, 4096, 1, 1024, 2048, 2048, 2048, 4096]
    - [23, 62.54]
  - - [2048, 4096, 1, 2048, 2048, 2048, 2048, 4096]
    - [33, 72.77]
  - - [2048, 4096, 1, 4096, 2048, 2048, 2048, 4096]
    - [56, 79.27]
  - - [2048, 4096, 1, 8192, 2048, 2048, 2048, 4096]
    - [38, 83.05]
  - - [2048, 8192, 1, 128, 2048, 2048, 2048, 8192]
    - [24, 21.95]
  - - [2048, 8192, 1, 256, 2048, 2048, 2048, 8192]
    - [23, 34.49]
  - - [2048, 8192, 1, 512, 2048, 2048, 2048, 8192]
    - [47, 49.46]
  - - [2048, 8192, 1, 1024, 2048, 2048, 2048, 8192]
    - [33, 63.7]
  - - [2048, 8192, 1, 2048, 2048, 2048, 2048, 8192]
    - [29, 75.12]
  - - [2048, 8192, 1, 4096, 2048, 2048, 2048, 8192]
    - [40, 83.59]
  - - [2048, 8192, 1, 8192, 2048, 2048, 2048, 8192]
    - [38, 84.86]
  - - [4096, 128, 1, 128, 4096, 4096, 4096, 128]
    - [122, 9.92]
  - - [4096, 128, 1, 256, 4096, 4096, 4096, 128]
    - [79, 16.68]
  - - [4096, 128, 1, 512, 4096, 4096, 4096, 128]
    - [77, 25.02]
  - - [4096, 128, 1, 1024, 4096, 4096, 4096, 128]
    - [78, 33.0]
  - - [4096, 128, 1, 2048, 4096, 4096, 4096, 128]
    - [83, 39.29]
  - - [4096, 128, 1, 4096, 4096, 4096, 4096, 128]
    - [79, 43.79]
  - - [4096, 128, 1, 8192, 4096, 4096, 4096, 128]
    - [79, 46.99]
  - - [4096, 256, 1, 128, 4096, 4096, 4096, 256]
    - [16, 14.86]
  - - [4096, 256, 1, 256, 4096, 4096, 4096, 256]
    - [69, 24.08]
  - - [4096, 256, 1, 512, 4096, 4096, 4096, 256]
    - [70, 35.21]
  - - [4096, 256, 1, 1024, 4096, 4096, 4096, 256]
    - [61, 46.08]
  - - [4096, 256, 1, 2048, 4096, 4096, 4096, 256]
    - [70, 54.79]
  - - [4096, 256, 1, 4096, 4096, 4096, 4096, 256]
    - [73, 60.87]
  - - [4096, 256, 1, 8192, 4096, 4096, 4096, 256]
    - [65, 65.2]
  - - [4096, 512, 1, 128, 4096, 4096, 4096, 512]
    - [15, 18.56]
  - - [4096, 512, 1, 256, 4096, 4096, 4096, 512]
    - [41, 30.94]
  - - [4096, 512, 1, 512, 4096, 4096, 4096, 512]
    - [32, 45.0]
  - - [4096, 512, 1, 1024, 4096, 4096, 4096, 512]
    - [23, 59.18]
  - - [4096, 512, 1, 2048, 4096, 4096, 4096, 512]
    - [23, 69.68]
  - - [4096, 512, 1, 4096, 4096, 4096, 4096, 512]
    - [55, 77.44]
  - - [4096, 512, 1, 8192, 4096, 4096, 4096, 512]
    - [33, 81.76]
  - - [4096, 1024, 1, 128, 4096, 4096, 4096, 1024]
    - [7, 20.24]
  - - [4096, 1024, 1, 256, 4096, 4096, 4096, 1024]
    - [24, 31.85]
  - - [4096, 1024, 1, 512, 4096, 4096, 4096, 1024]
    - [41, 47.42]
  - - [4096, 1024, 1, 1024, 4096, 4096, 4096, 1024]
    - [47, 61.69]
  - - [4096, 1024, 1, 2048, 4096, 4096, 4096, 1024]
    - [56, 72.17]
  - - [4096, 1024, 1, 4096, 4096, 4096, 4096, 1024]
    - [56, 78.36]
  - - [4096, 1024, 1, 8192, 4096, 4096, 4096, 1024]
    - [33, 82.62]
  - - [4096, 2048, 1, 128, 4096, 4096, 4096, 2048]
    - [3, 21.15]
  - - [4096, 2048, 1, 256, 4096, 4096, 4096, 2048]
    - [48, 33.79]
  - - [4096, 2048, 1, 512, 4096, 4096, 4096, 2048]
    - [48, 48.79]
  - - [4096, 2048, 1, 1024, 4096, 4096, 4096, 2048]
    - [33, 63.01]
  - - [4096, 2048, 1, 2048, 4096, 4096, 4096, 2048]
    - [54, 72.37]
  - - [4096, 2048, 1, 4096, 4096, 4096, 4096, 2048]
    - [41, 79.1]
  - - [4096, 2048, 1, 8192, 4096, 4096, 4096, 2048]
    - [1, 82.35]
  - - [4096, 4096, 1, 128, 4096, 4096, 4096, 4096]
    - [1, 22.06]
  - - [4096, 4096, 1, 256, 4096, 4096, 4096, 4096]
    - [48, 34.84]
  - - [4096, 4096, 1, 512, 4096, 4096, 4096, 4096]
    - [24, 50.1]
  - - [4096, 4096, 1, 1024, 4096, 4096, 4096, 4096]
    - [32, 63.38]
  - - [4096, 4096, 1, 2048, 4096, 4096, 4096, 4096]
    - [30, 76.17]
  - - [4096, 4096, 1, 4096, 4096, 4096, 4096, 4096]
    - [39, 83.55]
  - - [4096, 4096, 1, 8192, 4096, 4096, 4096, 4096]
    - [58, 84.68]
  - - [4096, 8192, 1, 128, 4096, 4096, 4096, 8192]
    - [1, 22.07]
  - - [4096, 8192, 1, 256, 4096, 4096, 4096, 8192]
    - [24, 34.71]
  - - [4096, 8192, 1, 512, 4096, 4096, 4096, 8192]
    - [0, 50.61]
  - - [4096, 8192, 1, 1024, 4096, 4096, 4096, 8192]
    - [46, 66.51]
  - - [4096, 8192, 1, 2048, 4096, 4096, 4096, 8192]
    - [45, 77.24]
  - - [4096, 8192, 1, 4096, 4096, 4096, 4096, 8192]
    - [53, 83.07]
  - - [4096, 8192, 1, 8192, 4096, 4096, 4096, 8192]
    - [27, 83.48]
  - - [8192, 128, 1, 128, 8192, 8192, 8192, 128]
    - [74, 15.54]
  - - [8192, 128, 1, 256, 8192, 8192, 8192, 128]
    - [18, 24.03]
  - - [8192, 128, 1, 512, 8192, 8192, 8192, 128]
    - [70, 35.94]
  - - [8192, 128, 1, 1024, 8192, 8192, 8192, 128]
    - [73, 46.59]
  - - [8192, 128, 1, 2048, 8192, 8192, 8192, 128]
    - [70, 56.11]
  - - [8192, 128, 1, 4096, 8192, 8192, 8192, 128]
    - [73, 60.8]
  - - [8192, 128, 1, 8192, 8192, 8192, 8192, 128]
    - [121, 61.74]
  - - [8192, 256, 1, 128, 8192, 8192, 8192, 256]
    - [1, 18.9]
  - - [8192, 256, 1, 256, 8192, 8192, 8192, 256]
    - [34, 30.56]
  - - [8192, 256, 1, 512, 8192, 8192, 8192, 256]
    - [51, 45.05]
  - - [8192, 256, 1, 1024, 8192, 8192, 8192, 256]
    - [56, 58.83]
  - - [8192, 256, 1, 2048, 8192, 8192, 8192, 256]
    - [32, 70.13]
  - - [8192, 256, 1, 4096, 8192, 8192, 8192, 256]
    - [54, 77.41]
  - - [8192, 256, 1, 8192, 8192, 8192, 8192, 256]
    - [41, 81.21]
  - - [8192, 512, 1, 128, 8192, 8192, 8192, 512]
    - [35, 20.08]
  - - [8192, 512, 1, 256, 8192, 8192, 8192, 512]
    - [37, 32.44]
  - - [8192, 512, 1, 512, 8192, 8192, 8192, 512]
    - [47, 47.71]
  - - [8192, 512, 1, 1024, 8192, 8192, 8192, 512]
    - [10, 54.4]
  - - [8192, 512, 1, 2048, 8192, 8192, 8192, 512]
    - [56, 71.89]
  - - [8192, 512, 1, 4096, 8192, 8192, 8192, 512]
    - [33, 78.49]
  - - [8192, 512, 1, 8192, 8192, 8192, 8192, 512]
    - [33, 82.31]
  - - [8192, 1024, 1, 128, 8192, 8192, 8192, 1024]
    - [1, 21.18]
  - - [8192, 1024, 1, 256, 8192, 8192, 8192, 1024]
    - [24, 34.16]
  - - [8192, 1024, 1, 512, 8192, 8192, 8192, 1024]
    - [31, 48.9]
  - - [8192, 1024, 1, 1024, 8192, 8192, 8192, 1024]
    - [41, 62.85]
  - - [8192, 1024, 1, 2048, 8192, 8192, 8192, 1024]
    - [24, 72.63]
  - - [8192, 1024, 1, 4096, 8192, 8192, 8192, 1024]
    - [31, 79.15]
  - - [8192, 1024, 1, 8192, 8192, 8192, 8192, 1024]
    - [26, 81.63]
  - - [8192, 2048, 1, 128, 8192, 8192, 8192, 2048]
    - [23, 22.04]
  - - [8192, 2048, 1, 256, 8192, 8192, 8192, 2048]
    - [23, 35.02]
  - - [8192, 2048, 1, 512, 8192, 8192, 8192, 2048]
    - [24, 50.08]
  - - [8192, 2048, 1, 1024, 8192, 8192, 8192, 2048]
    - [24, 63.32]
  - - [8192, 2048, 1, 2048, 8192, 8192, 8192, 2048]
    - [22, 74.23]
  - - [8192, 2048, 1, 4096, 8192, 8192, 8192, 2048]
    - [44, 79.55]
  - - [8192, 2048, 1, 8192, 8192, 8192, 8192, 2048]
    - [42, 83.3]
  - - [8192, 4096, 1, 128, 8192, 8192, 8192, 4096]
    - [23, 21.99]
  - - [8192, 4096, 1, 256, 8192, 8192, 8192, 4096]
    - [23, 35.03]
  - - [8192, 4096, 1, 512, 8192, 8192, 8192, 4096]
    - [0, 50.72]
  - - [8192, 4096, 1, 1024, 8192, 8192, 8192, 4096]
    - [28, 65.89]
  - - [8192, 4096, 1, 2048, 8192, 8192, 8192, 4096]
    - [40, 77.7]
  - - [8192, 4096, 1, 4096, 8192, 8192, 8192, 4096]
    - [52, 81.87]
  - - [8192, 4096, 1, 8192, 8192, 8192, 8192, 4096]
    - [38, 83.23]
  - - [8192, 8192, 1, 128, 8192, 8192, 8192, 8192]
    - [23, 21.69]
  - - [8192, 8192, 1, 256, 8192, 8192, 8192, 8192]
    - [3, 38.5]
  - - [8192, 8192, 1, 512, 8192, 8192, 8192, 8192]
    - [29, 53.79]
  - - [8192, 8192, 1, 1024, 8192, 8192, 8192, 8192]
    - [44, 67.15]
  - - [8192, 8192, 1, 2048, 8192, 8192, 8192, 8192]
    - [50, 76.55]
  - - [8192, 8192, 1, 4096, 8192, 8192, 8192, 8192]
    - [43, 81.93]
  - - [8192, 8192, 1, 8192, 8192, 8192, 8192, 8192]
    - [58, 84.63]
  - - [1, 1, 1, 32, 1, 1, 1, 1]
    - [167, 0.0]
- null
- null
- ExperimentalStreamK
- GridBased
