projects/hipblaslt/library/src/amd_detail/rocblaslt/src/Tensile/Logic/asm_full/aquavanjaram/gfx942_38cu/StreamK/aquavanjaram942_Cijk_Ailk_Bjlk_I8II_BH_UserArgs.yaml
- {MinimumRequiredVersion: 5.0.0}
- aquavanjaram942
- {Architecture: gfx942, CUCount: 38}
- [Device 0049, Device 0050]
    SolutionIndex: 0
    SolutionNameMin: Cijk_Ailk_Bjlk_I8II_BH_UserArgs_MT256x256x32_MI16x16x1_SN_LDSB0_AFC0_AFEM1_AFEM1_ASEM1_CLR0_CADS0_DTVA0_DTVB0_EPS0_FDSI0_GRPM1_GRVWA4_GRVWB4_GSU0_GSUAMB_GSUC0_GSUWGMRR0_GLS0_ISA942_IU1_K1_LBSPPA2048_LBSPPB2048_LBSPPM0_LPA64_LPB32_LPM0_LRVW8_LWPMn1_MIAV0_MIWT8_8_MO40_NTn1_NTA0_NTB0_NTC0_NTD0_NTM0_NEPBS0_NLCA1_NLCB1_ONLL1_PGR2_PLR0_PKA1_SIA3_SS1_SU0_SUM0_SUS32_SPO0_SRVW0_SSO0_SVW4_SK3_SKXCCM8_TLDS0_ULSGRO0_USL1_UIOFGRO0_USFGRO0_VSn1_VWA4_VWB2_WSGRA0_WSGRB0_WS64_WG32_8_1_WGM1_WGMXCC1_WGMXCCGn1
    SolutionIndex: 1
    SolutionNameMin: Cijk_Ailk_Bjlk_I8II_BH_UserArgs_MT256x256x32_MI16x16x1_SN_LDSB0_AFC0_AFEM1_AFEM1_ASEM1_CLR0_CADS0_DTVA0_DTVB0_EPS0_FDSI0_GRPM1_GRVWA4_GRVWB4_GSU0_GSUAMB_GSUC0_GSUWGMRR0_GLS0_ISA942_IU1_K1_LBSPPA2048_LBSPPB2048_LBSPPM0_LPA64_LPB64_LPM0_LRVW8_LWPMn1_MIAV0_MIWT8_8_MO40_NTn1_NTA0_NTB0_NTC0_NTD0_NTM0_NEPBS0_NLCA1_NLCB1_ONLL1_PGR2_PLR0_PKA1_SIA3_SS1_SU0_SUM0_SUS32_SPO0_SRVW0_SSO0_SVW4_SK3_SKXCCM8_TLDS0_ULSGRO0_USL1_UIOFGRO0_USFGRO0_VSn1_VWA4_VWB4_WSGRA0_WSGRB0_WS64_WG32_8_1_WGM1_WGMXCC1_WGMXCCGn1
    SolutionIndex: 2
    SolutionNameMin: Cijk_Ailk_Bjlk_I8II_BH_UserArgs_MT256x256x32_MI16x16x1_SN_LDSB0_AFC0_AFEM1_AFEM1_ASEM1_CLR0_CADS0_DTVA0_DTVB0_EPS0_FDSI0_GRPM1_GRVWA4_GRVWB4_GSU0_GSUAMB_GSUC0_GSUWGMRR0_GLS0_ISA942_IU1_K1_LBSPPA2048_LBSPPB2048_LBSPPM0_LPA32_LPB0_LPM0_LRVW8_LWPMn1_MIAV0_MIWT8_8_MO40_NTn1_NTA0_NTB0_NTC0_NTD0_NTM0_NEPBS0_NLCA1_NLCB1_ONLL1_PGR2_PLR0_PKA1_SIA3_SS1_SU0_SUM0_SUS32_SPO0_SRVW0_SSO0_SVW2_SK3_SKXCCM8_TLDS0_ULSGRO0_USL1_UIOFGRO0_USFGRO0_VSn1_VWA2_VWB8_WSGRA0_WSGRB0_WS64_WG32_8_1_WGM1_WGMXCC1_WGMXCCGn1
    SolutionIndex: 3
    SolutionNameMin: Cijk_Ailk_Bjlk_I8II_BH_UserArgs_MT256x256x32_MI16x16x1_SN_LDSB0_AFC0_AFEM1_AFEM1_ASEM1_CLR0_CADS0_DTVA0_DTVB0_EPS0_FDSI0_GRPM1_GRVWA4_GRVWB4_GSU0_GSUAMB_GSUC0_GSUWGMRR0_GLS0_ISA942_IU1_K1_LBSPPA2048_LBSPPB2048_LBSPPM0_LPA64_LPB0_LPM0_LRVW8_LWPMn1_MIAV0_MIWT8_8_MO40_NTn1_NTA0_NTB0_NTC0_NTD0_NTM0_NEPBS0_NLCA1_NLCB1_ONLL1_PGR2_PLR0_PKA1_SIA3_SS1_SU0_SUM0_SUS32_SPO0_SRVW0_SSO0_SVW4_SK3_SKXCCM8_TLDS0_ULSGRO0_USL1_UIOFGRO0_USFGRO0_VSn1_VWA4_VWB8_WSGRA0_WSGRB0_WS64_WG32_8_1_WGM1_WGMXCC1_WGMXCCGn1
    SolutionIndex: 4
    SolutionNameMin: Cijk_Ailk_Bjlk_I8II_BH_UserArgs_MT256x256x32_MI16x16x1_SN_LDSB0_AFC0_AFEM1_AFEM1_ASEM1_CLR0_CADS0_DTVA0_DTVB0_EPS0_FDSI0_GRPM1_GRVWA8_GRVWB4_GSU0_GSUAMB_GSUC0_GSUWGMRR0_GLS0_ISA942_IU1_K1_LBSPPA2048_LBSPPB2048_LBSPPM0_LPA64_LPB0_LPM0_LRVW8_LWPMn1_MIAV0_MIWT8_8_MO40_NTn1_NTA0_NTB0_NTC0_NTD0_NTM0_NEPBS0_NLCA1_NLCB1_ONLL1_PGR2_PLR0_PKA1_SIA3_SS1_SU0_SUM0_SUS32_SPO0_SRVW0_SSO0_SVW4_SK3_SKXCCM8_TLDS0_ULSGRO0_USL1_UIOFGRO0_USFGRO0_VSn1_VWA4_VWB8_WSGRA0_WSGRB0_WS64_WG32_8_1_WGM1_WGMXCC1_WGMXCCGn1
    SolutionIndex: 5
    SolutionNameMin: Cijk_Ailk_Bjlk_I8II_BH_UserArgs_MT256x256x32_MI16x16x1_SN_LDSB0_AFC0_AFEM1_AFEM1_ASEM1_CLR0_CADS0_DTVA0_DTVB0_EPS0_FDSI0_GRPM1_GRVWA2_GRVWB8_GSU0_GSUAMB_GSUC0_GSUWGMRR0_GLS0_ISA942_IU1_K1_LBSPPA2048_LBSPPB2048_LBSPPM0_LPA64_LPB64_LPM0_LRVW8_LWPMn1_MIAV0_MIWT8_8_MO40_NTn1_NTA0_NTB0_NTC0_NTD0_NTM0_NEPBS0_NLCA1_NLCB1_ONLL1_PGR2_PLR0_PKA1_SIA3_SS1_SU0_SUM0_SUS32_SPO0_SRVW0_SSO0_SVW4_SK3_SKXCCM8_TLDS0_ULSGRO0_USL1_UIOFGRO0_USFGRO0_VSn1_VWA4_VWB4_WSGRA0_WSGRB0_WS64_WG32_8_1_WGM1_WGMXCC1_WGMXCCGn1
    SolutionIndex: 6
    SolutionNameMin: Cijk_Ailk_Bjlk_I8II_BH_UserArgs_MT256x256x32_MI16x16x1_SN_LDSB0_AFC0_AFEM1_AFEM1_ASEM1_CLR0_CADS0_DTVA0_DTVB0_EPS0_FDSI0_GRPM1_GRVWA4_GRVWB8_GSU0_GSUAMB_GSUC0_GSUWGMRR0_GLS0_ISA942_IU1_K1_LBSPPA2048_LBSPPB2048_LBSPPM0_LPA64_LPB64_LPM0_LRVW8_LWPMn1_MIAV0_MIWT8_8_MO40_NTn1_NTA0_NTB0_NTC0_NTD0_NTM0_NEPBS0_NLCA1_NLCB1_ONLL1_PGR2_PLR0_PKA1_SIA3_SS1_SU0_SUM0_SUS32_SPO0_SRVW0_SSO0_SVW4_SK3_SKXCCM8_TLDS0_ULSGRO0_USL1_UIOFGRO0_USFGRO0_VSn1_VWA4_VWB4_WSGRA0_WSGRB0_WS64_WG32_8_1_WGM1_WGMXCC1_WGMXCCGn1
    SolutionIndex: 7
    SolutionNameMin: Cijk_Ailk_Bjlk_I8II_BH_UserArgs_MT256x256x32_MI16x16x1_SN_LDSB0_AFC0_AFEM1_AFEM1_ASEM1_CLR0_CADS0_DTVA0_DTVB0_EPS0_FDSI0_GRPM1_GRVWA4_GRVWB8_GSU0_GSUAMB_GSUC0_GSUWGMRR0_GLS0_ISA942_IU1_K1_LBSPPA2048_LBSPPB2048_LBSPPM0_LPA64_LPB0_LPM0_LRVW8_LWPMn1_MIAV0_MIWT8_8_MO40_NTn1_NTA0_NTB0_NTC0_NTD0_NTM0_NEPBS0_NLCA1_NLCB1_ONLL1_PGR2_PLR0_PKA1_SIA3_SS1_SU0_SUM0_SUS32_SPO0_SRVW0_SSO0_SVW4_SK3_SKXCCM8_TLDS0_ULSGRO0_USL1_UIOFGRO0_USFGRO0_VSn1_VWA4_VWB8_WSGRA0_WSGRB0_WS64_WG32_8_1_WGM1_WGMXCC1_WGMXCCGn1
    SolutionIndex: 8
    SolutionNameMin: Cijk_Ailk_Bjlk_I8II_BH_UserArgs_MT256x256x32_MI16x16x1_SN_LDSB0_AFC0_AFEM1_AFEM1_ASEM1_CLR0_CADS0_DTVA0_DTVB0_EPS0_FDSI0_GRPM1_GRVWA4_GRVWB4_GSU0_GSUAMB_GSUC0_GSUWGMRR0_GLS0_ISA942_IU1_K1_LBSPPA2048_LBSPPB2048_LBSPPM0_LPA64_LPB64_LPM0_LRVW8_LWPMn1_MIAV0_MIWT8_8_MO40_NTn1_NTA0_NTB0_NTC0_NTD0_NTM0_NEPBS0_NLCA1_NLCB1_ONLL1_PGR2_PLR0_PKA1_SIA3_SS1_SU0_SUM0_SUS32_SPO0_SRVW0_SSO0_SVW4_SK3_SKXCCM8_TLDS0_ULSGRO0_USL1_UIOFGRO0_USFGRO0_VSn1_VWA4_VWB4_WSGRA0_WSGRB0_WS64_WG32_8_1_WGM4_WGMXCC1_WGMXCCGn1
    SolutionIndex: 9
    SolutionNameMin: Cijk_Ailk_Bjlk_I8II_BH_UserArgs_MT256x256x32_MI16x16x1_SN_LDSB0_AFC0_AFEM1_AFEM1_ASEM1_CLR0_CADS0_DTVA0_DTVB0_EPS0_FDSI0_GRPM1_GRVWA2_GRVWB8_GSU0_GSUAMB_GSUC0_GSUWGMRR0_GLS0_ISA942_IU1_K1_LBSPPA2048_LBSPPB2048_LBSPPM0_LPA64_LPB0_LPM0_LRVW8_LWPMn1_MIAV0_MIWT8_8_MO40_NTn1_NTA0_NTB0_NTC0_NTD0_NTM0_NEPBS0_NLCA1_NLCB1_ONLL1_PGR2_PLR0_PKA1_SIA3_SS1_SU0_SUM0_SUS32_SPO0_SRVW0_SSO0_SVW4_SK3_SKXCCM8_TLDS0_ULSGRO0_USL1_UIOFGRO0_USFGRO0_VSn1_VWA4_VWB8_WSGRA0_WSGRB0_WS64_WG32_8_1_WGM4_WGMXCC1_WGMXCCGn1
    SolutionIndex: 10
    SolutionNameMin: Cijk_Ailk_Bjlk_I8II_BH_UserArgs_MT256x256x32_MI16x16x1_SN_LDSB0_AFC0_AFEM1_AFEM1_ASEM1_CLR0_CADS0_DTVA0_DTVB0_EPS0_FDSI0_GRPM1_GRVWA4_GRVWB8_GSU0_GSUAMB_GSUC0_GSUWGMRR0_GLS0_ISA942_IU1_K1_LBSPPA2048_LBSPPB2048_LBSPPM0_LPA64_LPB0_LPM0_LRVW8_LWPMn1_MIAV0_MIWT8_8_MO40_NTn1_NTA0_NTB0_NTC0_NTD0_NTM0_NEPBS0_NLCA1_NLCB1_ONLL1_PGR2_PLR0_PKA1_SIA3_SS1_SU0_SUM0_SUS32_SPO0_SRVW0_SSO0_SVW4_SK3_SKXCCM8_TLDS0_ULSGRO0_USL1_UIOFGRO0_USFGRO0_VSn1_VWA4_VWB8_WSGRA0_WSGRB0_WS64_WG32_8_1_WGM4_WGMXCC1_WGMXCCGn1
    SolutionIndex: 11
    SolutionNameMin: Cijk_Ailk_Bjlk_I8II_BH_UserArgs_MT256x256x32_MI16x16x1_SN_LDSB0_AFC0_AFEM1_AFEM1_ASEM1_CLR0_CADS0_DTVA0_DTVB0_EPS0_FDSI0_GRPM1_GRVWA4_GRVWB4_GSU0_GSUAMB_GSUC0_GSUWGMRR0_GLS0_ISA942_IU1_K1_LBSPPA2048_LBSPPB2048_LBSPPM0_LPA32_LPB64_LPM0_LRVW8_LWPMn1_MIAV0_MIWT8_8_MO40_NTn1_NTA0_NTB0_NTC0_NTD0_NTM0_NEPBS0_NLCA1_NLCB1_ONLL1_PGR2_PLR0_PKA1_SIA3_SS1_SU0_SUM0_SUS32_SPO0_SRVW0_SSO0_SVW2_SK3_SKXCCM8_TLDS0_ULSGRO0_USL1_UIOFGRO0_USFGRO0_VSn1_VWA2_VWB4_WSGRA0_WSGRB0_WS64_WG32_8_1_WGM8_WGMXCC1_WGMXCCGn1
    SolutionIndex: 12
    SolutionNameMin: Cijk_Ailk_Bjlk_I8II_BH_UserArgs_MT256x256x32_MI16x16x1_SN_LDSB0_AFC0_AFEM1_AFEM1_ASEM1_CLR0_CADS0_DTVA0_DTVB0_EPS0_FDSI0_GRPM1_GRVWA4_GRVWB4_GSU0_GSUAMB_GSUC0_GSUWGMRR0_GLS0_ISA942_IU1_K1_LBSPPA2048_LBSPPB2048_LBSPPM0_LPA64_LPB64_LPM0_LRVW8_LWPMn1_MIAV0_MIWT8_8_MO40_NTn1_NTA0_NTB0_NTC0_NTD0_NTM0_NEPBS0_NLCA1_NLCB1_ONLL1_PGR2_PLR0_PKA1_SIA3_SS1_SU0_SUM0_SUS32_SPO0_SRVW0_SSO0_SVW4_SK3_SKXCCM8_TLDS0_ULSGRO0_USL1_UIOFGRO0_USFGRO0_VSn1_VWA4_VWB4_WSGRA0_WSGRB0_WS64_WG32_8_1_WGM8_WGMXCC1_WGMXCCGn1
    SolutionIndex: 13
    SolutionNameMin: Cijk_Ailk_Bjlk_I8II_BH_UserArgs_MT256x256x32_MI16x16x1_SN_LDSB0_AFC0_AFEM1_AFEM1_ASEM1_CLR0_CADS0_DTVA0_DTVB0_EPS0_FDSI0_GRPM1_GRVWA4_GRVWB4_GSU0_GSUAMB_GSUC0_GSUWGMRR0_GLS0_ISA942_IU1_K1_LBSPPA2048_LBSPPB2048_LBSPPM0_LPA64_LPB0_LPM0_LRVW8_LWPMn1_MIAV0_MIWT8_8_MO40_NTn1_NTA0_NTB0_NTC0_NTD0_NTM0_NEPBS0_NLCA1_NLCB1_ONLL1_PGR2_PLR0_PKA1_SIA3_SS1_SU0_SUM0_SUS32_SPO0_SRVW0_SSO0_SVW4_SK3_SKXCCM8_TLDS0_ULSGRO0_USL1_UIOFGRO0_USFGRO0_VSn1_VWA4_VWB8_WSGRA0_WSGRB0_WS64_WG32_8_1_WGM8_WGMXCC1_WGMXCCGn1
    SolutionIndex: 14
    SolutionNameMin: Cijk_Ailk_Bjlk_I8II_BH_UserArgs_MT256x256x32_MI16x16x1_SN_LDSB0_AFC0_AFEM1_AFEM1_ASEM1_CLR0_CADS0_DTVA0_DTVB0_EPS0_FDSI0_GRPM1_GRVWA8_GRVWB4_GSU0_GSUAMB_GSUC0_GSUWGMRR0_GLS0_ISA942_IU1_K1_LBSPPA2048_LBSPPB2048_LBSPPM0_LPA64_LPB0_LPM0_LRVW8_LWPMn1_MIAV0_MIWT8_8_MO40_NTn1_NTA0_NTB0_NTC0_NTD0_NTM0_NEPBS0_NLCA1_NLCB1_ONLL1_PGR2_PLR0_PKA1_SIA3_SS1_SU0_SUM0_SUS32_SPO0_SRVW0_SSO0_SVW4_SK3_SKXCCM8_TLDS0_ULSGRO0_USL1_UIOFGRO0_USFGRO0_VSn1_VWA4_VWB8_WSGRA0_WSGRB0_WS64_WG32_8_1_WGM8_WGMXCC1_WGMXCCGn1
    SolutionIndex: 15
    SolutionNameMin: Cijk_Ailk_Bjlk_I8II_BH_UserArgs_MT256x256x32_MI16x16x1_SN_LDSB0_AFC0_AFEM1_AFEM1_ASEM1_CLR0_CADS0_DTVA0_DTVB0_EPS0_FDSI0_GRPM1_GRVWA4_GRVWB8_GSU0_GSUAMB_GSUC0_GSUWGMRR0_GLS0_ISA942_IU1_K1_LBSPPA2048_LBSPPB2048_LBSPPM0_LPA64_LPB32_LPM0_LRVW8_LWPMn1_MIAV0_MIWT8_8_MO40_NTn1_NTA0_NTB0_NTC0_NTD0_NTM0_NEPBS0_NLCA1_NLCB1_ONLL1_PGR2_PLR0_PKA1_SIA3_SS1_SU0_SUM0_SUS32_SPO0_SRVW0_SSO0_SVW4_SK3_SKXCCM8_TLDS0_ULSGRO0_USL1_UIOFGRO0_USFGRO0_VSn1_VWA4_VWB2_WSGRA0_WSGRB0_WS64_WG32_8_1_WGM8_WGMXCC1_WGMXCCGn1
    SolutionIndex: 16
    SolutionNameMin: Cijk_Ailk_Bjlk_I8II_BH_UserArgs_MT128x256x32_MI16x16x1_SN_LDSB0_AFC0_AFEM1_AFEM1_ASEM1_CLR0_CADS0_DTVA0_DTVB0_EPS0_FDSI0_GRPM1_GRVWA2_GRVWB4_GSU0_GSUAMB_GSUC0_GSUWGMRR0_GLS0_ISA942_IU1_K1_LBSPPA1024_LBSPPB2048_LBSPPM0_LPA64_LPB0_LPM0_LRVW8_LWPMn1_MIAV0_MIWT4_8_MO40_NTn1_NTA0_NTB0_NTC0_NTD0_NTM0_NEPBS0_NLCA1_NLCB1_ONLL1_PGR2_PLR0_PKA1_SIA3_SS1_SU0_SUM0_SUS32_SPO0_SRVW0_SSO0_SVW4_SK3_SKXCCM8_TLDS0_ULSGRO0_USL1_UIOFGRO0_USFGRO0_VSn1_VWA4_VWB8_WSGRA0_WSGRB0_WS64_WG32_8_1_WGM1_WGMXCC1_WGMXCCGn1
    SolutionIndex: 17
    SolutionNameMin: Cijk_Ailk_Bjlk_I8II_BH_UserArgs_MT128x256x32_MI16x16x1_SN_LDSB0_AFC0_AFEM1_AFEM1_ASEM1_CLR0_CADS0_DTVA0_DTVB0_EPS0_FDSI0_GRPM1_GRVWA4_GRVWB4_GSU0_GSUAMB_GSUC0_GSUWGMRR0_GLS0_ISA942_IU1_K1_LBSPPA1024_LBSPPB2048_LBSPPM0_LPA64_LPB32_LPM0_LRVW8_LWPMn1_MIAV0_MIWT4_8_MO40_NTn1_NTA0_NTB0_NTC0_NTD0_NTM0_NEPBS0_NLCA1_NLCB1_ONLL1_PGR2_PLR0_PKA1_SIA3_SS1_SU0_SUM0_SUS32_SPO0_SRVW0_SSO0_SVW4_SK3_SKXCCM8_TLDS0_ULSGRO0_USL1_UIOFGRO0_USFGRO0_VSn1_VWA4_VWB2_WSGRA0_WSGRB0_WS64_WG32_8_1_WGM1_WGMXCC1_WGMXCCGn1
    SolutionIndex: 18
    SolutionNameMin: Cijk_Ailk_Bjlk_I8II_BH_UserArgs_MT128x256x32_MI16x16x1_SN_LDSB0_AFC0_AFEM1_AFEM1_ASEM1_CLR0_CADS0_DTVA0_DTVB0_EPS0_FDSI0_GRPM1_GRVWA2_GRVWB8_GSU0_GSUAMB_GSUC0_GSUWGMRR0_GLS0_ISA942_IU1_K1_LBSPPA1024_LBSPPB2048_LBSPPM0_LPA64_LPB0_LPM0_LRVW8_LWPMn1_MIAV0_MIWT4_8_MO40_NTn1_NTA0_NTB0_NTC0_NTD0_NTM0_NEPBS0_NLCA1_NLCB1_ONLL1_PGR2_PLR0_PKA1_SIA3_SS1_SU0_SUM0_SUS32_SPO0_SRVW0_SSO0_SVW4_SK3_SKXCCM8_TLDS0_ULSGRO0_USL1_UIOFGRO0_USFGRO0_VSn1_VWA4_VWB8_WSGRA0_WSGRB0_WS64_WG32_8_1_WGM1_WGMXCC1_WGMXCCGn1
    SolutionIndex: 19
    SolutionNameMin: Cijk_Ailk_Bjlk_I8II_BH_UserArgs_MT128x256x32_MI16x16x1_SN_LDSB0_AFC0_AFEM1_AFEM1_ASEM1_CLR0_CADS0_DTVA0_DTVB0_EPS0_FDSI0_GRPM1_GRVWA4_GRVWB4_GSU0_GSUAMB_GSUC0_GSUWGMRR0_GLS0_ISA942_IU1_K1_LBSPPA1024_LBSPPB2048_LBSPPM0_LPA64_LPB32_LPM0_LRVW8_LWPMn1_MIAV0_MIWT4_8_MO40_NTn1_NTA0_NTB0_NTC0_NTD0_NTM0_NEPBS0_NLCA1_NLCB1_ONLL1_PGR2_PLR0_PKA1_SIA3_SS1_SU0_SUM0_SUS32_SPO0_SRVW0_SSO0_SVW4_SK3_SKXCCM8_TLDS0_ULSGRO0_USL1_UIOFGRO0_USFGRO0_VSn1_VWA4_VWB2_WSGRA0_WSGRB0_WS64_WG32_8_1_WGM8_WGMXCC1_WGMXCCGn1
    SolutionIndex: 20
    SolutionNameMin: Cijk_Ailk_Bjlk_I8II_BH_UserArgs_MT128x256x32_MI16x16x1_SN_LDSB0_AFC0_AFEM1_AFEM1_ASEM1_CLR0_CADS0_DTVA0_DTVB0_EPS0_FDSI0_GRPM1_GRVWA4_GRVWB8_GSU0_GSUAMB_GSUC0_GSUWGMRR0_GLS0_ISA942_IU1_K1_LBSPPA1024_LBSPPB2048_LBSPPM0_LPA64_LPB0_LPM0_LRVW8_LWPMn1_MIAV0_MIWT4_8_MO40_NTn1_NTA0_NTB0_NTC0_NTD0_NTM0_NEPBS0_NLCA1_NLCB1_ONLL1_PGR2_PLR0_PKA1_SIA3_SS1_SU0_SUM0_SUS32_SPO0_SRVW0_SSO0_SVW4_SK3_SKXCCM8_TLDS0_ULSGRO0_USL1_UIOFGRO0_USFGRO0_VSn1_VWA4_VWB8_WSGRA0_WSGRB0_WS64_WG32_8_1_WGM8_WGMXCC1_WGMXCCGn1
    SolutionIndex: 21
    SolutionNameMin: Cijk_Ailk_Bjlk_I8II_BH_UserArgs_MT256x128x32_MI16x16x1_SN_LDSB0_AFC0_AFEM1_AFEM1_ASEM1_CLR0_CADS0_DTVA0_DTVB0_EPS0_FDSI0_GRPM1_GRVWA4_GRVWB4_GSU0_GSUAMB_GSUC0_GSUWGMRR0_GLS0_ISA942_IU1_K1_LBSPPA2048_LBSPPB1024_LBSPPM0_LPA64_LPB32_LPM0_LRVW8_LWPMn1_MIAV0_MIWT8_4_MO40_NTn1_NTA0_NTB0_NTC0_NTD0_NTM0_NEPBS0_NLCA1_NLCB1_ONLL1_PGR2_PLR0_PKA1_SIA3_SS1_SU0_SUM0_SUS32_SPO0_SRVW0_SSO0_SVW4_SK3_SKXCCM8_TLDS0_ULSGRO0_USL1_UIOFGRO0_USFGRO0_VSn1_VWA4_VWB2_WSGRA0_WSGRB0_WS64_WG32_8_1_WGM1_WGMXCC1_WGMXCCGn1
    SolutionIndex: 22
    SolutionNameMin: Cijk_Ailk_Bjlk_I8II_BH_UserArgs_MT256x128x32_MI16x16x1_SN_LDSB0_AFC0_AFEM1_AFEM1_ASEM1_CLR0_CADS0_DTVA0_DTVB0_EPS0_FDSI0_GRPM1_GRVWA4_GRVWB8_GSU0_GSUAMB_GSUC0_GSUWGMRR0_GLS0_ISA942_IU1_K1_LBSPPA2048_LBSPPB1024_LBSPPM0_LPA64_LPB64_LPM0_LRVW8_LWPMn1_MIAV0_MIWT8_4_MO40_NTn1_NTA0_NTB0_NTC0_NTD0_NTM0_NEPBS0_NLCA1_NLCB1_ONLL1_PGR2_PLR0_PKA1_SIA3_SS1_SU0_SUM0_SUS32_SPO0_SRVW0_SSO0_SVW4_SK3_SKXCCM8_TLDS0_ULSGRO0_USL1_UIOFGRO0_USFGRO0_VSn1_VWA4_VWB4_WSGRA0_WSGRB0_WS64_WG32_8_1_WGM1_WGMXCC1_WGMXCCGn1
    SolutionIndex: 23
    SolutionNameMin: Cijk_Ailk_Bjlk_I8II_BH_UserArgs_MT256x128x32_MI16x16x1_SN_LDSB0_AFC0_AFEM1_AFEM1_ASEM1_CLR0_CADS0_DTVA0_DTVB0_EPS0_FDSI0_GRPM1_GRVWA8_GRVWB8_GSU0_GSUAMB_GSUC0_GSUWGMRR0_GLS0_ISA942_IU1_K1_LBSPPA2048_LBSPPB1024_LBSPPM0_LPA64_LPB64_LPM0_LRVW8_LWPMn1_MIAV0_MIWT8_4_MO40_NTn1_NTA0_NTB0_NTC0_NTD0_NTM0_NEPBS0_NLCA1_NLCB1_ONLL1_PGR2_PLR0_PKA1_SIA3_SS1_SU0_SUM0_SUS32_SPO0_SRVW0_SSO0_SVW4_SK3_SKXCCM8_TLDS0_ULSGRO0_USL1_UIOFGRO0_USFGRO0_VSn1_VWA4_VWB4_WSGRA0_WSGRB0_WS64_WG32_8_1_WGM1_WGMXCC1_WGMXCCGn1
    SolutionIndex: 24
    SolutionNameMin: Cijk_Ailk_Bjlk_I8II_BH_UserArgs_MT256x128x32_MI16x16x1_SN_LDSB0_AFC0_AFEM1_AFEM1_ASEM1_CLR0_CADS0_DTVA0_DTVB0_EPS0_FDSI0_GRPM1_GRVWA4_GRVWB8_GSU0_GSUAMB_GSUC0_GSUWGMRR0_GLS0_ISA942_IU1_K1_LBSPPA2048_LBSPPB1024_LBSPPM0_LPA64_LPB64_LPM0_LRVW8_LWPMn1_MIAV0_MIWT8_4_MO40_NTn1_NTA0_NTB0_NTC0_NTD0_NTM0_NEPBS0_NLCA1_NLCB1_ONLL1_PGR2_PLR0_PKA1_SIA3_SS1_SU0_SUM0_SUS32_SPO0_SRVW0_SSO0_SVW4_SK3_SKXCCM8_TLDS0_ULSGRO0_USL1_UIOFGRO0_USFGRO0_VSn1_VWA4_VWB4_WSGRA0_WSGRB0_WS64_WG32_8_1_WGM4_WGMXCC1_WGMXCCGn1
    SolutionIndex: 25
    SolutionNameMin: Cijk_Ailk_Bjlk_I8II_BH_UserArgs_MT128x128x32_MI16x16x1_SN_LDSB0_AFC0_AFEM1_AFEM1_ASEM1_CLR0_CADS0_DTVA0_DTVB0_EPS0_FDSI0_GRPM1_GRVWA4_GRVWB4_GSU0_GSUAMB_GSUC0_GSUWGMRR0_GLS0_ISA942_IU1_K1_LBSPPA1024_LBSPPB1024_LBSPPM0_LPA64_LPB64_LPM0_LRVW8_LWPMn1_MIAV0_MIWT4_4_MO40_NTn1_NTA0_NTB0_NTC0_NTD0_NTM0_NEPBS0_NLCA1_NLCB1_ONLL1_PGR2_PLR0_PKA1_SIA3_SS1_SU0_SUM0_SUS32_SPO0_SRVW0_SSO0_SVW4_SK3_SKXCCM8_TLDS0_ULSGRO0_USL1_UIOFGRO0_USFGRO0_VSn1_VWA4_VWB4_WSGRA0_WSGRB0_WS64_WG32_8_1_WGM1_WGMXCC1_WGMXCCGn1
    SolutionIndex: 26
    SolutionNameMin: Cijk_Ailk_Bjlk_I8II_BH_UserArgs_MT128x32x32_MI16x16x1_SN_LDSB0_AFC0_AFEM1_AFEM1_ASEM1_CLR0_CADS0_DTVA0_DTVB0_EPS0_FDSI0_GRPM1_GRVWA2_GRVWB4_GSU0_GSUAMB_GSUC0_GSUWGMRR0_GLS0_ISA942_IU1_K1_LBSPPA1024_LBSPPB256_LBSPPM0_LPA64_LPB16_LPM0_LRVW8_LWPMn1_MIAV0_MIWT4_1_MO40_NTn1_NTA0_NTB0_NTC0_NTD0_NTM0_NEPBS0_NLCA1_NLCB1_ONLL1_PGR2_PLR0_PKA1_SIA3_SS1_SU0_SUM0_SUS32_SPO0_SRVW0_SSO0_SVW4_SK3_SKXCCM8_TLDS0_ULSGRO0_USL1_UIOFGRO0_USFGRO0_VSn1_VWA4_VWB1_WSGRA0_WSGRB0_WS64_WG32_8_1_WGM1_WGMXCC1_WGMXCCGn1
    SolutionIndex: 27
    SolutionNameMin: Cijk_Ailk_Bjlk_I8II_BH_UserArgs_MT64x64x32_MI16x16x1_SN_LDSB0_AFC0_AFEM1_AFEM1_ASEM1_CLR0_CADS0_DTVA0_DTVB0_EPS0_FDSI0_GRPM1_GRVWA8_GRVWB4_GSU0_GSUAMB_GSUC0_GSUWGMRR0_GLS0_ISA942_IU1_K1_LBSPPA512_LBSPPB512_LBSPPM0_LPA16_LPB32_LPM0_LRVW8_LWPMn1_MIAV0_MIWT2_2_MO40_NTn1_NTA0_NTB0_NTC0_NTD0_NTM0_NEPBS0_NLCA1_NLCB1_ONLL1_PGR2_PLR0_PKA1_SIA3_SS1_SU0_SUM0_SUS32_SPO0_SRVW0_SSO0_SVW1_SK3_SKXCCM8_TLDS0_ULSGRO0_USL1_UIOFGRO0_USFGRO0_VSn1_VWA1_VWB2_WSGRA0_WSGRB0_WS64_WG32_8_1_WGM8_WGMXCC1_WGMXCCGn1
    SolutionIndex: 28
    SolutionNameMin: Cijk_Ailk_Bjlk_I8II_BH_UserArgs_MT32x32x32_MI16x16x1_SN_LDSB0_AFC0_AFEM1_AFEM1_ASEM1_CLR0_CADS0_DTVA0_DTVB0_EPS0_FDSI0_GRPM1_GRVWA2_GRVWB4_GSU0_GSUAMB_GSUC0_GSUWGMRR0_GLS0_ISA942_IU1_K1_LBSPPA256_LBSPPB256_LBSPPM0_LPA16_LPB16_LPM0_LRVW8_LWPMn1_MIAV0_MIWT1_1_MO40_NTn1_NTA0_NTB0_NTC0_NTD0_NTM0_NEPBS0_NLCA1_NLCB1_ONLL1_PGR2_PLR0_PKA1_SIA3_SS1_SU0_SUM0_SUS32_SPO0_SRVW0_SSO0_SVW1_SK3_SKXCCM8_TLDS0_ULSGRO0_USL1_UIOFGRO0_USFGRO0_VSn1_VWA1_VWB1_WSGRA0_WSGRB0_WS64_WG32_8_1_WGM1_WGMXCC1_WGMXCCGn1
    SolutionIndex: 29
    SolutionNameMin: Cijk_Ailk_Bjlk_I8II_BH_UserArgs_MT256x256x64_MI16x16x1_SN_LDSB1_AFC0_AFEM1_AFEM1_ASEM1_CLR1_CADS0_DTVA0_DTVB0_EPS0_FDSI0_GRPM1_GRVWA4_GRVWB4_GSU0_GSUAMB_GSUC0_GSUWGMRR0_GLS0_ISA942_IU1_K1_LBSPPA2048_LBSPPB2048_LBSPPM0_LPA64_LPB32_LPM0_LRVW8_LWPMn1_MIAV0_MIWT8_8_MO40_NTn1_NTA0_NTB0_NTC0_NTD0_NTM0_NEPBS0_NLCA1_NLCB1_ONLL1_PGR2_PLR1_PKA1_SIA3_SS1_SU0_SUM0_SUS64_SPO0_SRVW0_SSO0_SVW4_SK3_SKXCCM8_TLDS0_ULSGRO0_USL1_UIOFGRO0_USFGRO0_VSn1_VWA4_VWB2_WSGRA0_WSGRB0_WS64_WG32_8_1_WGM1_WGMXCC1_WGMXCCGn1
    SolutionIndex: 30
    SolutionNameMin: Cijk_Ailk_Bjlk_I8II_BH_UserArgs_MT256x256x64_MI16x16x1_SN_LDSB1_AFC0_AFEM1_AFEM1_ASEM1_CLR1_CADS0_DTVA0_DTVB0_EPS0_FDSI0_GRPM1_GRVWA4_GRVWB4_GSU0_GSUAMB_GSUC0_GSUWGMRR0_GLS0_ISA942_IU1_K1_LBSPPA2048_LBSPPB2048_LBSPPM0_LPA64_LPB64_LPM0_LRVW8_LWPMn1_MIAV0_MIWT8_8_MO40_NTn1_NTA0_NTB0_NTC0_NTD0_NTM0_NEPBS0_NLCA1_NLCB1_ONLL1_PGR2_PLR1_PKA1_SIA3_SS1_SU0_SUM0_SUS64_SPO0_SRVW0_SSO0_SVW4_SK3_SKXCCM8_TLDS0_ULSGRO0_USL1_UIOFGRO0_USFGRO0_VSn1_VWA4_VWB4_WSGRA0_WSGRB0_WS64_WG32_8_1_WGM1_WGMXCC1_WGMXCCGn1
    SolutionIndex: 31
    SolutionNameMin: Cijk_Ailk_Bjlk_I8II_BH_UserArgs_MT256x256x64_MI16x16x1_SN_LDSB1_AFC0_AFEM1_AFEM1_ASEM1_CLR1_CADS0_DTVA0_DTVB0_EPS0_FDSI0_GRPM1_GRVWA4_GRVWB4_GSU0_GSUAMB_GSUC0_GSUWGMRR0_GLS0_ISA942_IU1_K1_LBSPPA2048_LBSPPB2048_LBSPPM0_LPA64_LPB0_LPM0_LRVW8_LWPMn1_MIAV0_MIWT8_8_MO40_NTn1_NTA0_NTB0_NTC0_NTD0_NTM0_NEPBS0_NLCA1_NLCB1_ONLL1_PGR2_PLR1_PKA1_SIA3_SS1_SU0_SUM0_SUS64_SPO0_SRVW0_SSO0_SVW4_SK3_SKXCCM8_TLDS0_ULSGRO0_USL1_UIOFGRO0_USFGRO0_VSn1_VWA4_VWB8_WSGRA0_WSGRB0_WS64_WG32_8_1_WGM1_WGMXCC1_WGMXCCGn1
    SolutionIndex: 32
    SolutionNameMin: Cijk_Ailk_Bjlk_I8II_BH_UserArgs_MT256x256x64_MI16x16x1_SN_LDSB1_AFC0_AFEM1_AFEM1_ASEM1_CLR1_CADS0_DTVA0_DTVB0_EPS0_FDSI0_GRPM1_GRVWA8_GRVWB4_GSU0_GSUAMB_GSUC0_GSUWGMRR0_GLS0_ISA942_IU1_K1_LBSPPA2048_LBSPPB2048_LBSPPM0_LPA32_LPB0_LPM0_LRVW8_LWPMn1_MIAV0_MIWT8_8_MO40_NTn1_NTA0_NTB0_NTC0_NTD0_NTM0_NEPBS0_NLCA1_NLCB1_ONLL1_PGR2_PLR1_PKA1_SIA3_SS1_SU0_SUM0_SUS64_SPO0_SRVW0_SSO0_SVW2_SK3_SKXCCM8_TLDS0_ULSGRO0_USL1_UIOFGRO0_USFGRO0_VSn1_VWA2_VWB8_WSGRA0_WSGRB0_WS64_WG32_8_1_WGM1_WGMXCC1_WGMXCCGn1
    SolutionIndex: 33
    SolutionNameMin: Cijk_Ailk_Bjlk_I8II_BH_UserArgs_MT256x256x64_MI16x16x1_SN_LDSB1_AFC0_AFEM1_AFEM1_ASEM1_CLR1_CADS0_DTVA0_DTVB0_EPS0_FDSI0_GRPM1_GRVWA8_GRVWB4_GSU0_GSUAMB_GSUC0_GSUWGMRR0_GLS0_ISA942_IU1_K1_LBSPPA2048_LBSPPB2048_LBSPPM0_LPA64_LPB0_LPM0_LRVW8_LWPMn1_MIAV0_MIWT8_8_MO40_NTn1_NTA0_NTB0_NTC0_NTD0_NTM0_NEPBS0_NLCA1_NLCB1_ONLL1_PGR2_PLR1_PKA1_SIA3_SS1_SU0_SUM0_SUS64_SPO0_SRVW0_SSO0_SVW4_SK3_SKXCCM8_TLDS0_ULSGRO0_USL1_UIOFGRO0_USFGRO0_VSn1_VWA4_VWB8_WSGRA0_WSGRB0_WS64_WG32_8_1_WGM1_WGMXCC1_WGMXCCGn1
    SolutionIndex: 34
    SolutionNameMin: Cijk_Ailk_Bjlk_I8II_BH_UserArgs_MT256x256x64_MI16x16x1_SN_LDSB1_AFC0_AFEM1_AFEM1_ASEM1_CLR1_CADS0_DTVA0_DTVB0_EPS0_FDSI0_GRPM1_GRVWA4_GRVWB8_GSU0_GSUAMB_GSUC0_GSUWGMRR0_GLS0_ISA942_IU1_K1_LBSPPA2048_LBSPPB2048_LBSPPM0_LPA64_LPB32_LPM0_LRVW8_LWPMn1_MIAV0_MIWT8_8_MO40_NTn1_NTA0_NTB0_NTC0_NTD0_NTM0_NEPBS0_NLCA1_NLCB1_ONLL1_PGR2_PLR1_PKA1_SIA3_SS1_SU0_SUM0_SUS64_SPO0_SRVW0_SSO0_SVW4_SK3_SKXCCM8_TLDS0_ULSGRO0_USL1_UIOFGRO0_USFGRO0_VSn1_VWA4_VWB2_WSGRA0_WSGRB0_WS64_WG32_8_1_WGM1_WGMXCC1_WGMXCCGn1
    SolutionIndex: 35
    SolutionNameMin: Cijk_Ailk_Bjlk_I8II_BH_UserArgs_MT256x256x64_MI16x16x1_SN_LDSB1_AFC0_AFEM1_AFEM1_ASEM1_CLR1_CADS0_DTVA0_DTVB0_EPS0_FDSI0_GRPM1_GRVWA4_GRVWB8_GSU0_GSUAMB_GSUC0_GSUWGMRR0_GLS0_ISA942_IU1_K1_LBSPPA2048_LBSPPB2048_LBSPPM0_LPA64_LPB64_LPM0_LRVW8_LWPMn1_MIAV0_MIWT8_8_MO40_NTn1_NTA0_NTB0_NTC0_NTD0_NTM0_NEPBS0_NLCA1_NLCB1_ONLL1_PGR2_PLR1_PKA1_SIA3_SS1_SU0_SUM0_SUS64_SPO0_SRVW0_SSO0_SVW4_SK3_SKXCCM8_TLDS0_ULSGRO0_USL1_UIOFGRO0_USFGRO0_VSn1_VWA4_VWB4_WSGRA0_WSGRB0_WS64_WG32_8_1_WGM1_WGMXCC1_WGMXCCGn1
    SolutionIndex: 36
    SolutionNameMin: Cijk_Ailk_Bjlk_I8II_BH_UserArgs_MT256x256x64_MI16x16x1_SN_LDSB1_AFC0_AFEM1_AFEM1_ASEM1_CLR1_CADS0_DTVA0_DTVB0_EPS0_FDSI0_GRPM1_GRVWA4_GRVWB8_GSU0_GSUAMB_GSUC0_GSUWGMRR0_GLS0_ISA942_IU1_K1_LBSPPA2048_LBSPPB2048_LBSPPM0_LPA32_LPB0_LPM0_LRVW8_LWPMn1_MIAV0_MIWT8_8_MO40_NTn1_NTA0_NTB0_NTC0_NTD0_NTM0_NEPBS0_NLCA1_NLCB1_ONLL1_PGR2_PLR1_PKA1_SIA3_SS1_SU0_SUM0_SUS64_SPO0_SRVW0_SSO0_SVW2_SK3_SKXCCM8_TLDS0_ULSGRO0_USL1_UIOFGRO0_USFGRO0_VSn1_VWA2_VWB8_WSGRA0_WSGRB0_WS64_WG32_8_1_WGM1_WGMXCC1_WGMXCCGn1
    SolutionIndex: 37
    SolutionNameMin: Cijk_Ailk_Bjlk_I8II_BH_UserArgs_MT256x256x64_MI16x16x1_SN_LDSB1_AFC0_AFEM1_AFEM1_ASEM1_CLR1_CADS0_DTVA0_DTVB0_EPS0_FDSI0_GRPM1_GRVWA4_GRVWB8_GSU0_GSUAMB_GSUC0_GSUWGMRR0_GLS0_ISA942_IU1_K1_LBSPPA2048_LBSPPB2048_LBSPPM0_LPA64_LPB0_LPM0_LRVW8_LWPMn1_MIAV0_MIWT8_8_MO40_NTn1_NTA0_NTB0_NTC0_NTD0_NTM0_NEPBS0_NLCA1_NLCB1_ONLL1_PGR2_PLR1_PKA1_SIA3_SS1_SU0_SUM0_SUS64_SPO0_SRVW0_SSO0_SVW4_SK3_SKXCCM8_TLDS0_ULSGRO0_USL1_UIOFGRO0_USFGRO0_VSn1_VWA4_VWB8_WSGRA0_WSGRB0_WS64_WG32_8_1_WGM1_WGMXCC1_WGMXCCGn1
    SolutionIndex: 38
    SolutionNameMin: Cijk_Ailk_Bjlk_I8II_BH_UserArgs_MT256x256x64_MI16x16x1_SN_LDSB1_AFC0_AFEM1_AFEM1_ASEM1_CLR1_CADS0_DTVA0_DTVB0_EPS0_FDSI0_GRPM1_GRVWA4_GRVWB4_GSU0_GSUAMB_GSUC0_GSUWGMRR0_GLS0_ISA942_IU1_K1_LBSPPA2048_LBSPPB2048_LBSPPM0_LPA64_LPB16_LPM0_LRVW8_LWPMn1_MIAV0_MIWT8_8_MO40_NTn1_NTA0_NTB0_NTC0_NTD0_NTM0_NEPBS0_NLCA1_NLCB1_ONLL1_PGR2_PLR1_PKA1_SIA3_SS1_SU0_SUM0_SUS64_SPO0_SRVW0_SSO0_SVW4_SK3_SKXCCM8_TLDS0_ULSGRO0_USL1_UIOFGRO0_USFGRO0_VSn1_VWA4_VWB1_WSGRA0_WSGRB0_WS64_WG32_8_1_WGM4_WGMXCC1_WGMXCCGn1
    SolutionIndex: 39
    SolutionNameMin: Cijk_Ailk_Bjlk_I8II_BH_UserArgs_MT256x256x64_MI16x16x1_SN_LDSB1_AFC0_AFEM1_AFEM1_ASEM1_CLR1_CADS0_DTVA0_DTVB0_EPS0_FDSI0_GRPM1_GRVWA4_GRVWB4_GSU0_GSUAMB_GSUC0_GSUWGMRR0_GLS0_ISA942_IU1_K1_LBSPPA2048_LBSPPB2048_LBSPPM0_LPA64_LPB32_LPM0_LRVW8_LWPMn1_MIAV0_MIWT8_8_MO40_NTn1_NTA0_NTB0_NTC0_NTD0_NTM0_NEPBS0_NLCA1_NLCB1_ONLL1_PGR2_PLR1_PKA1_SIA3_SS1_SU0_SUM0_SUS64_SPO0_SRVW0_SSO0_SVW4_SK3_SKXCCM8_TLDS0_ULSGRO0_USL1_UIOFGRO0_USFGRO0_VSn1_VWA4_VWB2_WSGRA0_WSGRB0_WS64_WG32_8_1_WGM4_WGMXCC1_WGMXCCGn1
    SolutionIndex: 40
    SolutionNameMin: Cijk_Ailk_Bjlk_I8II_BH_UserArgs_MT256x256x64_MI16x16x1_SN_LDSB1_AFC0_AFEM1_AFEM1_ASEM1_CLR1_CADS0_DTVA0_DTVB0_EPS0_FDSI0_GRPM1_GRVWA4_GRVWB4_GSU0_GSUAMB_GSUC0_GSUWGMRR0_GLS0_ISA942_IU1_K1_LBSPPA2048_LBSPPB2048_LBSPPM0_LPA64_LPB64_LPM0_LRVW8_LWPMn1_MIAV0_MIWT8_8_MO40_NTn1_NTA0_NTB0_NTC0_NTD0_NTM0_NEPBS0_NLCA1_NLCB1_ONLL1_PGR2_PLR1_PKA1_SIA3_SS1_SU0_SUM0_SUS64_SPO0_SRVW0_SSO0_SVW4_SK3_SKXCCM8_TLDS0_ULSGRO0_USL1_UIOFGRO0_USFGRO0_VSn1_VWA4_VWB4_WSGRA0_WSGRB0_WS64_WG32_8_1_WGM4_WGMXCC1_WGMXCCGn1
    SolutionIndex: 41
    SolutionNameMin: Cijk_Ailk_Bjlk_I8II_BH_UserArgs_MT256x256x64_MI16x16x1_SN_LDSB1_AFC0_AFEM1_AFEM1_ASEM1_CLR1_CADS0_DTVA0_DTVB0_EPS0_FDSI0_GRPM1_GRVWA4_GRVWB4_GSU0_GSUAMB_GSUC0_GSUWGMRR0_GLS0_ISA942_IU1_K1_LBSPPA2048_LBSPPB2048_LBSPPM0_LPA64_LPB0_LPM0_LRVW8_LWPMn1_MIAV0_MIWT8_8_MO40_NTn1_NTA0_NTB0_NTC0_NTD0_NTM0_NEPBS0_NLCA1_NLCB1_ONLL1_PGR2_PLR1_PKA1_SIA3_SS1_SU0_SUM0_SUS64_SPO0_SRVW0_SSO0_SVW4_SK3_SKXCCM8_TLDS0_ULSGRO0_USL1_UIOFGRO0_USFGRO0_VSn1_VWA4_VWB8_WSGRA0_WSGRB0_WS64_WG32_8_1_WGM4_WGMXCC1_WGMXCCGn1
    SolutionIndex: 42
    SolutionNameMin: Cijk_Ailk_Bjlk_I8II_BH_UserArgs_MT256x256x64_MI16x16x1_SN_LDSB1_AFC0_AFEM1_AFEM1_ASEM1_CLR1_CADS0_DTVA0_DTVB0_EPS0_FDSI0_GRPM1_GRVWA8_GRVWB4_GSU0_GSUAMB_GSUC0_GSUWGMRR0_GLS0_ISA942_IU1_K1_LBSPPA2048_LBSPPB2048_LBSPPM0_LPA32_LPB0_LPM0_LRVW8_LWPMn1_MIAV0_MIWT8_8_MO40_NTn1_NTA0_NTB0_NTC0_NTD0_NTM0_NEPBS0_NLCA1_NLCB1_ONLL1_PGR2_PLR1_PKA1_SIA3_SS1_SU0_SUM0_SUS64_SPO0_SRVW0_SSO0_SVW2_SK3_SKXCCM8_TLDS0_ULSGRO0_USL1_UIOFGRO0_USFGRO0_VSn1_VWA2_VWB8_WSGRA0_WSGRB0_WS64_WG32_8_1_WGM4_WGMXCC1_WGMXCCGn1
    SolutionIndex: 43
    SolutionNameMin: Cijk_Ailk_Bjlk_I8II_BH_UserArgs_MT256x256x64_MI16x16x1_SN_LDSB1_AFC0_AFEM1_AFEM1_ASEM1_CLR1_CADS0_DTVA0_DTVB0_EPS0_FDSI0_GRPM1_GRVWA4_GRVWB8_GSU0_GSUAMB_GSUC0_GSUWGMRR0_GLS0_ISA942_IU1_K1_LBSPPA2048_LBSPPB2048_LBSPPM0_LPA64_LPB32_LPM0_LRVW8_LWPMn1_MIAV0_MIWT8_8_MO40_NTn1_NTA0_NTB0_NTC0_NTD0_NTM0_NEPBS0_NLCA1_NLCB1_ONLL1_PGR2_PLR1_PKA1_SIA3_SS1_SU0_SUM0_SUS64_SPO0_SRVW0_SSO0_SVW4_SK3_SKXCCM8_TLDS0_ULSGRO0_USL1_UIOFGRO0_USFGRO0_VSn1_VWA4_VWB2_WSGRA0_WSGRB0_WS64_WG32_8_1_WGM4_WGMXCC1_WGMXCCGn1
    SolutionIndex: 44
    SolutionNameMin: Cijk_Ailk_Bjlk_I8II_BH_UserArgs_MT256x256x64_MI16x16x1_SN_LDSB1_AFC0_AFEM1_AFEM1_ASEM1_CLR1_CADS0_DTVA0_DTVB0_EPS0_FDSI0_GRPM1_GRVWA4_GRVWB8_GSU0_GSUAMB_GSUC0_GSUWGMRR0_GLS0_ISA942_IU1_K1_LBSPPA2048_LBSPPB2048_LBSPPM0_LPA64_LPB64_LPM0_LRVW8_LWPMn1_MIAV0_MIWT8_8_MO40_NTn1_NTA0_NTB0_NTC0_NTD0_NTM0_NEPBS0_NLCA1_NLCB1_ONLL1_PGR2_PLR1_PKA1_SIA3_SS1_SU0_SUM0_SUS64_SPO0_SRVW0_SSO0_SVW4_SK3_SKXCCM8_TLDS0_ULSGRO0_USL1_UIOFGRO0_USFGRO0_VSn1_VWA4_VWB4_WSGRA0_WSGRB0_WS64_WG32_8_1_WGM4_WGMXCC1_WGMXCCGn1
    SolutionIndex: 45
    SolutionNameMin: Cijk_Ailk_Bjlk_I8II_BH_UserArgs_MT256x256x64_MI16x16x1_SN_LDSB1_AFC0_AFEM1_AFEM1_ASEM1_CLR1_CADS0_DTVA0_DTVB0_EPS0_FDSI0_GRPM1_GRVWA4_GRVWB8_GSU0_GSUAMB_GSUC0_GSUWGMRR0_GLS0_ISA942_IU1_K1_LBSPPA2048_LBSPPB2048_LBSPPM0_LPA64_LPB0_LPM0_LRVW8_LWPMn1_MIAV0_MIWT8_8_MO40_NTn1_NTA0_NTB0_NTC0_NTD0_NTM0_NEPBS0_NLCA1_NLCB1_ONLL1_PGR2_PLR1_PKA1_SIA3_SS1_SU0_SUM0_SUS64_SPO0_SRVW0_SSO0_SVW4_SK3_SKXCCM8_TLDS0_ULSGRO0_USL1_UIOFGRO0_USFGRO0_VSn1_VWA4_VWB8_WSGRA0_WSGRB0_WS64_WG32_8_1_WGM4_WGMXCC1_WGMXCCGn1
    SolutionIndex: 46
    SolutionNameMin: Cijk_Ailk_Bjlk_I8II_BH_UserArgs_MT256x256x64_MI16x16x1_SN_LDSB1_AFC0_AFEM1_AFEM1_ASEM1_CLR1_CADS0_DTVA0_DTVB0_EPS0_FDSI0_GRPM1_GRVWA8_GRVWB8_GSU0_GSUAMB_GSUC0_GSUWGMRR0_GLS0_ISA942_IU1_K1_LBSPPA2048_LBSPPB2048_LBSPPM0_LPA64_LPB64_LPM0_LRVW8_LWPMn1_MIAV0_MIWT8_8_MO40_NTn1_NTA0_NTB0_NTC0_NTD0_NTM0_NEPBS0_NLCA1_NLCB1_ONLL1_PGR2_PLR1_PKA1_SIA3_SS1_SU0_SUM0_SUS64_SPO0_SRVW0_SSO0_SVW4_SK3_SKXCCM8_TLDS0_ULSGRO0_USL1_UIOFGRO0_USFGRO0_VSn1_VWA4_VWB4_WSGRA0_WSGRB0_WS64_WG32_8_1_WGM4_WGMXCC1_WGMXCCGn1
    SolutionIndex: 47
    SolutionNameMin: Cijk_Ailk_Bjlk_I8II_BH_UserArgs_MT256x256x64_MI16x16x1_SN_LDSB1_AFC0_AFEM1_AFEM1_ASEM1_CLR1_CADS0_DTVA0_DTVB0_EPS0_FDSI0_GRPM1_GRVWA4_GRVWB4_GSU0_GSUAMB_GSUC0_GSUWGMRR0_GLS0_ISA942_IU1_K1_LBSPPA2048_LBSPPB2048_LBSPPM0_LPA64_LPB32_LPM0_LRVW8_LWPMn1_MIAV0_MIWT8_8_MO40_NTn1_NTA0_NTB0_NTC0_NTD0_NTM0_NEPBS0_NLCA1_NLCB1_ONLL1_PGR2_PLR1_PKA1_SIA3_SS1_SU0_SUM0_SUS64_SPO0_SRVW0_SSO0_SVW4_SK3_SKXCCM8_TLDS0_ULSGRO0_USL1_UIOFGRO0_USFGRO0_VSn1_VWA4_VWB2_WSGRA0_WSGRB0_WS64_WG32_8_1_WGM8_WGMXCC1_WGMXCCGn1
    SolutionIndex: 48
    SolutionNameMin: Cijk_Ailk_Bjlk_I8II_BH_UserArgs_MT256x256x64_MI16x16x1_SN_LDSB1_AFC0_AFEM1_AFEM1_ASEM1_CLR1_CADS0_DTVA0_DTVB0_EPS0_FDSI0_GRPM1_GRVWA4_GRVWB4_GSU0_GSUAMB_GSUC0_GSUWGMRR0_GLS0_ISA942_IU1_K1_LBSPPA2048_LBSPPB2048_LBSPPM0_LPA64_LPB64_LPM0_LRVW8_LWPMn1_MIAV0_MIWT8_8_MO40_NTn1_NTA0_NTB0_NTC0_NTD0_NTM0_NEPBS0_NLCA1_NLCB1_ONLL1_PGR2_PLR1_PKA1_SIA3_SS1_SU0_SUM0_SUS64_SPO0_SRVW0_SSO0_SVW4_SK3_SKXCCM8_TLDS0_ULSGRO0_USL1_UIOFGRO0_USFGRO0_VSn1_VWA4_VWB4_WSGRA0_WSGRB0_WS64_WG32_8_1_WGM8_WGMXCC1_WGMXCCGn1
    SolutionIndex: 49
    SolutionNameMin: Cijk_Ailk_Bjlk_I8II_BH_UserArgs_MT256x256x64_MI16x16x1_SN_LDSB1_AFC0_AFEM1_AFEM1_ASEM1_CLR1_CADS0_DTVA0_DTVB0_EPS0_FDSI0_GRPM1_GRVWA4_GRVWB4_GSU0_GSUAMB_GSUC0_GSUWGMRR0_GLS0_ISA942_IU1_K1_LBSPPA2048_LBSPPB2048_LBSPPM0_LPA64_LPB0_LPM0_LRVW8_LWPMn1_MIAV0_MIWT8_8_MO40_NTn1_NTA0_NTB0_NTC0_NTD0_NTM0_NEPBS0_NLCA1_NLCB1_ONLL1_PGR2_PLR1_PKA1_SIA3_SS1_SU0_SUM0_SUS64_SPO0_SRVW0_SSO0_SVW4_SK3_SKXCCM8_TLDS0_ULSGRO0_USL1_UIOFGRO0_USFGRO0_VSn1_VWA4_VWB8_WSGRA0_WSGRB0_WS64_WG32_8_1_WGM8_WGMXCC1_WGMXCCGn1
    SolutionIndex: 50
    SolutionNameMin: Cijk_Ailk_Bjlk_I8II_BH_UserArgs_MT256x256x64_MI16x16x1_SN_LDSB1_AFC0_AFEM1_AFEM1_ASEM1_CLR1_CADS0_DTVA0_DTVB0_EPS0_FDSI0_GRPM1_GRVWA8_GRVWB4_GSU0_GSUAMB_GSUC0_GSUWGMRR0_GLS0_ISA942_IU1_K1_LBSPPA2048_LBSPPB2048_LBSPPM0_LPA64_LPB64_LPM0_LRVW8_LWPMn1_MIAV0_MIWT8_8_MO40_NTn1_NTA0_NTB0_NTC0_NTD0_NTM0_NEPBS0_NLCA1_NLCB1_ONLL1_PGR2_PLR1_PKA1_SIA3_SS1_SU0_SUM0_SUS64_SPO0_SRVW0_SSO0_SVW4_SK3_SKXCCM8_TLDS0_ULSGRO0_USL1_UIOFGRO0_USFGRO0_VSn1_VWA4_VWB4_WSGRA0_WSGRB0_WS64_WG32_8_1_WGM8_WGMXCC1_WGMXCCGn1
    SolutionIndex: 51
    SolutionNameMin: Cijk_Ailk_Bjlk_I8II_BH_UserArgs_MT256x256x64_MI16x16x1_SN_LDSB1_AFC0_AFEM1_AFEM1_ASEM1_CLR1_CADS0_DTVA0_DTVB0_EPS0_FDSI0_GRPM1_GRVWA4_GRVWB8_GSU0_GSUAMB_GSUC0_GSUWGMRR0_GLS0_ISA942_IU1_K1_LBSPPA2048_LBSPPB2048_LBSPPM0_LPA64_LPB32_LPM0_LRVW8_LWPMn1_MIAV0_MIWT8_8_MO40_NTn1_NTA0_NTB0_NTC0_NTD0_NTM0_NEPBS0_NLCA1_NLCB1_ONLL1_PGR2_PLR1_PKA1_SIA3_SS1_SU0_SUM0_SUS64_SPO0_SRVW0_SSO0_SVW4_SK3_SKXCCM8_TLDS0_ULSGRO0_USL1_UIOFGRO0_USFGRO0_VSn1_VWA4_VWB2_WSGRA0_WSGRB0_WS64_WG32_8_1_WGM8_WGMXCC1_WGMXCCGn1
    SolutionIndex: 52
    SolutionNameMin: Cijk_Ailk_Bjlk_I8II_BH_UserArgs_MT256x256x64_MI16x16x1_SN_LDSB1_AFC0_AFEM1_AFEM1_ASEM1_CLR1_CADS0_DTVA0_DTVB0_EPS0_FDSI0_GRPM1_GRVWA4_GRVWB8_GSU0_GSUAMB_GSUC0_GSUWGMRR0_GLS0_ISA942_IU1_K1_LBSPPA2048_LBSPPB2048_LBSPPM0_LPA64_LPB64_LPM0_LRVW8_LWPMn1_MIAV0_MIWT8_8_MO40_NTn1_NTA0_NTB0_NTC0_NTD0_NTM0_NEPBS0_NLCA1_NLCB1_ONLL1_PGR2_PLR1_PKA1_SIA3_SS1_SU0_SUM0_SUS64_SPO0_SRVW0_SSO0_SVW4_SK3_SKXCCM8_TLDS0_ULSGRO0_USL1_UIOFGRO0_USFGRO0_VSn1_VWA4_VWB4_WSGRA0_WSGRB0_WS64_WG32_8_1_WGM8_WGMXCC1_WGMXCCGn1
    SolutionIndex: 53
    SolutionNameMin: Cijk_Ailk_Bjlk_I8II_BH_UserArgs_MT256x256x64_MI16x16x1_SN_LDSB1_AFC0_AFEM1_AFEM1_ASEM1_CLR1_CADS0_DTVA0_DTVB0_EPS0_FDSI0_GRPM1_GRVWA4_GRVWB8_GSU0_GSUAMB_GSUC0_GSUWGMRR0_GLS0_ISA942_IU1_K1_LBSPPA2048_LBSPPB2048_LBSPPM0_LPA0_LPB64_LPM0_LRVW8_LWPMn1_MIAV0_MIWT8_8_MO40_NTn1_NTA0_NTB0_NTC0_NTD0_NTM0_NEPBS0_NLCA1_NLCB1_ONLL1_PGR2_PLR1_PKA1_SIA3_SS1_SU0_SUM0_SUS64_SPO0_SRVW0_SSO0_SVW8_SK3_SKXCCM8_TLDS0_ULSGRO0_USL1_UIOFGRO0_USFGRO0_VSn1_VWA8_VWB4_WSGRA0_WSGRB0_WS64_WG32_8_1_WGM8_WGMXCC1_WGMXCCGn1
    SolutionIndex: 54
    SolutionNameMin: Cijk_Ailk_Bjlk_I8II_BH_UserArgs_MT256x256x64_MI16x16x1_SN_LDSB1_AFC0_AFEM1_AFEM1_ASEM1_CLR1_CADS0_DTVA0_DTVB0_EPS0_FDSI0_GRPM1_GRVWA4_GRVWB8_GSU0_GSUAMB_GSUC0_GSUWGMRR0_GLS0_ISA942_IU1_K1_LBSPPA2048_LBSPPB2048_LBSPPM0_LPA64_LPB0_LPM0_LRVW8_LWPMn1_MIAV0_MIWT8_8_MO40_NTn1_NTA0_NTB0_NTC0_NTD0_NTM0_NEPBS0_NLCA1_NLCB1_ONLL1_PGR2_PLR1_PKA1_SIA3_SS1_SU0_SUM0_SUS64_SPO0_SRVW0_SSO0_SVW4_SK3_SKXCCM8_TLDS0_ULSGRO0_USL1_UIOFGRO0_USFGRO0_VSn1_VWA4_VWB8_WSGRA0_WSGRB0_WS64_WG32_8_1_WGM8_WGMXCC1_WGMXCCGn1
    SolutionIndex: 55
    SolutionNameMin: Cijk_Ailk_Bjlk_I8II_BH_UserArgs_MT256x256x64_MI16x16x1_SN_LDSB1_AFC0_AFEM1_AFEM1_ASEM1_CLR1_CADS0_DTVA0_DTVB0_EPS0_FDSI0_GRPM1_GRVWA8_GRVWB8_GSU0_GSUAMB_GSUC0_GSUWGMRR0_GLS0_ISA942_IU1_K1_LBSPPA2048_LBSPPB2048_LBSPPM0_LPA64_LPB64_LPM0_LRVW8_LWPMn1_MIAV0_MIWT8_8_MO40_NTn1_NTA0_NTB0_NTC0_NTD0_NTM0_NEPBS0_NLCA1_NLCB1_ONLL1_PGR2_PLR1_PKA1_SIA3_SS1_SU0_SUM0_SUS64_SPO0_SRVW0_SSO0_SVW4_SK3_SKXCCM8_TLDS0_ULSGRO0_USL1_UIOFGRO0_USFGRO0_VSn1_VWA4_VWB4_WSGRA0_WSGRB0_WS64_WG32_8_1_WGM8_WGMXCC1_WGMXCCGn1
    SolutionIndex: 56
    SolutionNameMin: Cijk_Ailk_Bjlk_I8II_BH_UserArgs_MT256x256x64_MI16x16x1_SN_LDSB1_AFC0_AFEM1_AFEM1_ASEM1_CLR1_CADS0_DTVA0_DTVB0_EPS0_FDSI0_GRPM1_GRVWA8_GRVWB8_GSU0_GSUAMB_GSUC0_GSUWGMRR0_GLS0_ISA942_IU1_K1_LBSPPA2048_LBSPPB2048_LBSPPM0_LPA64_LPB0_LPM0_LRVW8_LWPMn1_MIAV0_MIWT8_8_MO40_NTn1_NTA0_NTB0_NTC0_NTD0_NTM0_NEPBS0_NLCA1_NLCB1_ONLL1_PGR2_PLR1_PKA1_SIA3_SS1_SU0_SUM0_SUS64_SPO0_SRVW0_SSO0_SVW4_SK3_SKXCCM8_TLDS0_ULSGRO0_USL1_UIOFGRO0_USFGRO0_VSn1_VWA4_VWB8_WSGRA0_WSGRB0_WS64_WG32_8_1_WGM8_WGMXCC1_WGMXCCGn1
    SolutionIndex: 57
    SolutionNameMin: Cijk_Ailk_Bjlk_I8II_BH_UserArgs_MT128x256x64_MI16x16x1_SN_LDSB1_AFC0_AFEM1_AFEM1_ASEM1_CLR1_CADS0_DTVA0_DTVB0_EPS0_FDSI0_GRPM1_GRVWA4_GRVWB4_GSU0_GSUAMB_GSUC0_GSUWGMRR0_GLS0_ISA942_IU1_K1_LBSPPA1024_LBSPPB2048_LBSPPM0_LPA64_LPB64_LPM0_LRVW8_LWPMn1_MIAV0_MIWT4_8_MO40_NTn1_NTA0_NTB0_NTC0_NTD0_NTM0_NEPBS0_NLCA1_NLCB1_ONLL1_PGR2_PLR1_PKA1_SIA3_SS1_SU0_SUM0_SUS64_SPO0_SRVW0_SSO0_SVW4_SK3_SKXCCM8_TLDS0_ULSGRO0_USL1_UIOFGRO0_USFGRO0_VSn1_VWA4_VWB4_WSGRA0_WSGRB0_WS64_WG32_8_1_WGM1_WGMXCC1_WGMXCCGn1
    SolutionIndex: 58
    SolutionNameMin: Cijk_Ailk_Bjlk_I8II_BH_UserArgs_MT128x256x64_MI16x16x1_SN_LDSB1_AFC0_AFEM1_AFEM1_ASEM1_CLR1_CADS0_DTVA0_DTVB0_EPS0_FDSI0_GRPM1_GRVWA4_GRVWB4_GSU0_GSUAMB_GSUC0_GSUWGMRR0_GLS0_ISA942_IU1_K1_LBSPPA1024_LBSPPB2048_LBSPPM0_LPA32_LPB0_LPM0_LRVW8_LWPMn1_MIAV0_MIWT4_8_MO40_NTn1_NTA0_NTB0_NTC0_NTD0_NTM0_NEPBS0_NLCA1_NLCB1_ONLL1_PGR2_PLR1_PKA1_SIA3_SS1_SU0_SUM0_SUS64_SPO0_SRVW0_SSO0_SVW2_SK3_SKXCCM8_TLDS0_ULSGRO0_USL1_UIOFGRO0_USFGRO0_VSn1_VWA2_VWB8_WSGRA0_WSGRB0_WS64_WG32_8_1_WGM1_WGMXCC1_WGMXCCGn1
    SolutionIndex: 59
    SolutionNameMin: Cijk_Ailk_Bjlk_I8II_BH_UserArgs_MT128x256x64_MI16x16x1_SN_LDSB1_AFC0_AFEM1_AFEM1_ASEM1_CLR1_CADS0_DTVA0_DTVB0_EPS0_FDSI0_GRPM1_GRVWA4_GRVWB4_GSU0_GSUAMB_GSUC0_GSUWGMRR0_GLS0_ISA942_IU1_K1_LBSPPA1024_LBSPPB2048_LBSPPM0_LPA64_LPB0_LPM0_LRVW8_LWPMn1_MIAV0_MIWT4_8_MO40_NTn1_NTA0_NTB0_NTC0_NTD0_NTM0_NEPBS0_NLCA1_NLCB1_ONLL1_PGR2_PLR1_PKA1_SIA3_SS1_SU0_SUM0_SUS64_SPO0_SRVW0_SSO0_SVW4_SK3_SKXCCM8_TLDS0_ULSGRO0_USL1_UIOFGRO0_USFGRO0_VSn1_VWA4_VWB8_WSGRA0_WSGRB0_WS64_WG32_8_1_WGM1_WGMXCC1_WGMXCCGn1
    SolutionIndex: 60
    SolutionNameMin: Cijk_Ailk_Bjlk_I8II_BH_UserArgs_MT128x256x64_MI16x16x1_SN_LDSB1_AFC0_AFEM1_AFEM1_ASEM1_CLR1_CADS0_DTVA0_DTVB0_EPS0_FDSI0_GRPM1_GRVWA4_GRVWB8_GSU0_GSUAMB_GSUC0_GSUWGMRR0_GLS0_ISA942_IU1_K1_LBSPPA1024_LBSPPB2048_LBSPPM0_LPA64_LPB64_LPM0_LRVW8_LWPMn1_MIAV0_MIWT4_8_MO40_NTn1_NTA0_NTB0_NTC0_NTD0_NTM0_NEPBS0_NLCA1_NLCB1_ONLL1_PGR2_PLR1_PKA1_SIA3_SS1_SU0_SUM0_SUS64_SPO0_SRVW0_SSO0_SVW4_SK3_SKXCCM8_TLDS0_ULSGRO0_USL1_UIOFGRO0_USFGRO0_VSn1_VWA4_VWB4_WSGRA0_WSGRB0_WS64_WG32_8_1_WGM1_WGMXCC1_WGMXCCGn1
    SolutionIndex: 61
    SolutionNameMin: Cijk_Ailk_Bjlk_I8II_BH_UserArgs_MT128x256x64_MI16x16x1_SN_LDSB1_AFC0_AFEM1_AFEM1_ASEM1_CLR1_CADS0_DTVA0_DTVB0_EPS0_FDSI0_GRPM1_GRVWA4_GRVWB8_GSU0_GSUAMB_GSUC0_GSUWGMRR0_GLS0_ISA942_IU1_K1_LBSPPA1024_LBSPPB2048_LBSPPM0_LPA32_LPB0_LPM0_LRVW8_LWPMn1_MIAV0_MIWT4_8_MO40_NTn1_NTA0_NTB0_NTC0_NTD0_NTM0_NEPBS0_NLCA1_NLCB1_ONLL1_PGR2_PLR1_PKA1_SIA3_SS1_SU0_SUM0_SUS64_SPO0_SRVW0_SSO0_SVW2_SK3_SKXCCM8_TLDS0_ULSGRO0_USL1_UIOFGRO0_USFGRO0_VSn1_VWA2_VWB8_WSGRA0_WSGRB0_WS64_WG32_8_1_WGM1_WGMXCC1_WGMXCCGn1
    SolutionIndex: 62
    SolutionNameMin: Cijk_Ailk_Bjlk_I8II_BH_UserArgs_MT128x256x64_MI16x16x1_SN_LDSB1_AFC0_AFEM1_AFEM1_ASEM1_CLR1_CADS0_DTVA0_DTVB0_EPS0_FDSI0_GRPM1_GRVWA4_GRVWB8_GSU0_GSUAMB_GSUC0_GSUWGMRR0_GLS0_ISA942_IU1_K1_LBSPPA1024_LBSPPB2048_LBSPPM0_LPA64_LPB0_LPM0_LRVW8_LWPMn1_MIAV0_MIWT4_8_MO40_NTn1_NTA0_NTB0_NTC0_NTD0_NTM0_NEPBS0_NLCA1_NLCB1_ONLL1_PGR2_PLR1_PKA1_SIA3_SS1_SU0_SUM0_SUS64_SPO0_SRVW0_SSO0_SVW4_SK3_SKXCCM8_TLDS0_ULSGRO0_USL1_UIOFGRO0_USFGRO0_VSn1_VWA4_VWB8_WSGRA0_WSGRB0_WS64_WG32_8_1_WGM1_WGMXCC1_WGMXCCGn1
    SolutionIndex: 63
    SolutionNameMin: Cijk_Ailk_Bjlk_I8II_BH_UserArgs_MT128x256x64_MI16x16x1_SN_LDSB1_AFC0_AFEM1_AFEM1_ASEM1_CLR1_CADS0_DTVA0_DTVB0_EPS0_FDSI0_GRPM1_GRVWA8_GRVWB8_GSU0_GSUAMB_GSUC0_GSUWGMRR0_GLS0_ISA942_IU1_K1_LBSPPA1024_LBSPPB2048_LBSPPM0_LPA64_LPB0_LPM0_LRVW8_LWPMn1_MIAV0_MIWT4_8_MO40_NTn1_NTA0_NTB0_NTC0_NTD0_NTM0_NEPBS0_NLCA1_NLCB1_ONLL1_PGR2_PLR1_PKA1_SIA3_SS1_SU0_SUM0_SUS64_SPO0_SRVW0_SSO0_SVW4_SK3_SKXCCM8_TLDS0_ULSGRO0_USL1_UIOFGRO0_USFGRO0_VSn1_VWA4_VWB8_WSGRA0_WSGRB0_WS64_WG32_8_1_WGM1_WGMXCC1_WGMXCCGn1
    SolutionIndex: 64
    SolutionNameMin: Cijk_Ailk_Bjlk_I8II_BH_UserArgs_MT128x256x64_MI16x16x1_SN_LDSB1_AFC0_AFEM1_AFEM1_ASEM1_CLR1_CADS0_DTVA0_DTVB0_EPS0_FDSI0_GRPM1_GRVWA4_GRVWB4_GSU0_GSUAMB_GSUC0_GSUWGMRR0_GLS0_ISA942_IU1_K1_LBSPPA1024_LBSPPB2048_LBSPPM0_LPA64_LPB0_LPM0_LRVW8_LWPMn1_MIAV0_MIWT4_8_MO40_NTn1_NTA0_NTB0_NTC0_NTD0_NTM0_NEPBS0_NLCA1_NLCB1_ONLL1_PGR2_PLR1_PKA1_SIA3_SS1_SU0_SUM0_SUS64_SPO0_SRVW0_SSO0_SVW4_SK3_SKXCCM8_TLDS0_ULSGRO0_USL1_UIOFGRO0_USFGRO0_VSn1_VWA4_VWB8_WSGRA0_WSGRB0_WS64_WG32_8_1_WGM4_WGMXCC1_WGMXCCGn1
    SolutionIndex: 65
    SolutionNameMin: Cijk_Ailk_Bjlk_I8II_BH_UserArgs_MT128x256x64_MI16x16x1_SN_LDSB1_AFC0_AFEM1_AFEM1_ASEM1_CLR1_CADS0_DTVA0_DTVB0_EPS0_FDSI0_GRPM1_GRVWA4_GRVWB8_GSU0_GSUAMB_GSUC0_GSUWGMRR0_GLS0_ISA942_IU1_K1_LBSPPA1024_LBSPPB2048_LBSPPM0_LPA64_LPB64_LPM0_LRVW8_LWPMn1_MIAV0_MIWT4_8_MO40_NTn1_NTA0_NTB0_NTC0_NTD0_NTM0_NEPBS0_NLCA1_NLCB1_ONLL1_PGR2_PLR1_PKA1_SIA3_SS1_SU0_SUM0_SUS64_SPO0_SRVW0_SSO0_SVW4_SK3_SKXCCM8_TLDS0_ULSGRO0_USL1_UIOFGRO0_USFGRO0_VSn1_VWA4_VWB4_WSGRA0_WSGRB0_WS64_WG32_8_1_WGM4_WGMXCC1_WGMXCCGn1
    SolutionIndex: 66
    SolutionNameMin: Cijk_Ailk_Bjlk_I8II_BH_UserArgs_MT128x256x64_MI16x16x1_SN_LDSB1_AFC0_AFEM1_AFEM1_ASEM1_CLR1_CADS0_DTVA0_DTVB0_EPS0_FDSI0_GRPM1_GRVWA4_GRVWB8_GSU0_GSUAMB_GSUC0_GSUWGMRR0_GLS0_ISA942_IU1_K1_LBSPPA1024_LBSPPB2048_LBSPPM0_LPA64_LPB0_LPM0_LRVW8_LWPMn1_MIAV0_MIWT4_8_MO40_NTn1_NTA0_NTB0_NTC0_NTD0_NTM0_NEPBS0_NLCA1_NLCB1_ONLL1_PGR2_PLR1_PKA1_SIA3_SS1_SU0_SUM0_SUS64_SPO0_SRVW0_SSO0_SVW4_SK3_SKXCCM8_TLDS0_ULSGRO0_USL1_UIOFGRO0_USFGRO0_VSn1_VWA4_VWB8_WSGRA0_WSGRB0_WS64_WG32_8_1_WGM4_WGMXCC1_WGMXCCGn1
    SolutionIndex: 67
    SolutionNameMin: Cijk_Ailk_Bjlk_I8II_BH_UserArgs_MT128x256x64_MI16x16x1_SN_LDSB1_AFC0_AFEM1_AFEM1_ASEM1_CLR1_CADS0_DTVA0_DTVB0_EPS0_FDSI0_GRPM1_GRVWA8_GRVWB8_GSU0_GSUAMB_GSUC0_GSUWGMRR0_GLS0_ISA942_IU1_K1_LBSPPA1024_LBSPPB2048_LBSPPM0_LPA64_LPB0_LPM0_LRVW8_LWPMn1_MIAV0_MIWT4_8_MO40_NTn1_NTA0_NTB0_NTC0_NTD0_NTM0_NEPBS0_NLCA1_NLCB1_ONLL1_PGR2_PLR1_PKA1_SIA3_SS1_SU0_SUM0_SUS64_SPO0_SRVW0_SSO0_SVW4_SK3_SKXCCM8_TLDS0_ULSGRO0_USL1_UIOFGRO0_USFGRO0_VSn1_VWA4_VWB8_WSGRA0_WSGRB0_WS64_WG32_8_1_WGM4_WGMXCC1_WGMXCCGn1
    SolutionIndex: 68
    SolutionNameMin: Cijk_Ailk_Bjlk_I8II_BH_UserArgs_MT128x256x64_MI16x16x1_SN_LDSB1_AFC0_AFEM1_AFEM1_ASEM1_CLR1_CADS0_DTVA0_DTVB0_EPS0_FDSI0_GRPM1_GRVWA4_GRVWB4_GSU0_GSUAMB_GSUC0_GSUWGMRR0_GLS0_ISA942_IU1_K1_LBSPPA1024_LBSPPB2048_LBSPPM0_LPA64_LPB0_LPM0_LRVW8_LWPMn1_MIAV0_MIWT4_8_MO40_NTn1_NTA0_NTB0_NTC0_NTD0_NTM0_NEPBS0_NLCA1_NLCB1_ONLL1_PGR2_PLR1_PKA1_SIA3_SS1_SU0_SUM0_SUS64_SPO0_SRVW0_SSO0_SVW4_SK3_SKXCCM8_TLDS0_ULSGRO0_USL1_UIOFGRO0_USFGRO0_VSn1_VWA4_VWB8_WSGRA0_WSGRB0_WS64_WG32_8_1_WGM8_WGMXCC1_WGMXCCGn1
    SolutionIndex: 69
    SolutionNameMin: Cijk_Ailk_Bjlk_I8II_BH_UserArgs_MT128x256x64_MI16x16x1_SN_LDSB1_AFC0_AFEM1_AFEM1_ASEM1_CLR1_CADS0_DTVA0_DTVB0_EPS0_FDSI0_GRPM1_GRVWA8_GRVWB8_GSU0_GSUAMB_GSUC0_GSUWGMRR0_GLS0_ISA942_IU1_K1_LBSPPA1024_LBSPPB2048_LBSPPM0_LPA64_LPB64_LPM0_LRVW8_LWPMn1_MIAV0_MIWT4_8_MO40_NTn1_NTA0_NTB0_NTC0_NTD0_NTM0_NEPBS0_NLCA1_NLCB1_ONLL1_PGR2_PLR1_PKA1_SIA3_SS1_SU0_SUM0_SUS64_SPO0_SRVW0_SSO0_SVW4_SK3_SKXCCM8_TLDS0_ULSGRO0_USL1_UIOFGRO0_USFGRO0_VSn1_VWA4_VWB4_WSGRA0_WSGRB0_WS64_WG32_8_1_WGM8_WGMXCC1_WGMXCCGn1
    SolutionIndex: 70
    SolutionNameMin: Cijk_Ailk_Bjlk_I8II_BH_UserArgs_MT128x256x64_MI16x16x1_SN_LDSB1_AFC0_AFEM1_AFEM1_ASEM1_CLR1_CADS0_DTVA0_DTVB0_EPS0_FDSI0_GRPM1_GRVWA8_GRVWB8_GSU0_GSUAMB_GSUC0_GSUWGMRR0_GLS0_ISA942_IU1_K1_LBSPPA1024_LBSPPB2048_LBSPPM0_LPA64_LPB0_LPM0_LRVW8_LWPMn1_MIAV0_MIWT4_8_MO40_NTn1_NTA0_NTB0_NTC0_NTD0_NTM0_NEPBS0_NLCA1_NLCB1_ONLL1_PGR2_PLR1_PKA1_SIA3_SS1_SU0_SUM0_SUS64_SPO0_SRVW0_SSO0_SVW4_SK3_SKXCCM8_TLDS0_ULSGRO0_USL1_UIOFGRO0_USFGRO0_VSn1_VWA4_VWB8_WSGRA0_WSGRB0_WS64_WG32_8_1_WGM8_WGMXCC1_WGMXCCGn1
    SolutionIndex: 71
    SolutionNameMin: Cijk_Ailk_Bjlk_I8II_BH_UserArgs_MT256x128x64_MI16x16x1_SN_LDSB1_AFC0_AFEM1_AFEM1_ASEM1_CLR1_CADS0_DTVA0_DTVB0_EPS0_FDSI0_GRPM1_GRVWA4_GRVWB4_GSU0_GSUAMB_GSUC0_GSUWGMRR0_GLS0_ISA942_IU1_K1_LBSPPA2048_LBSPPB1024_LBSPPM0_LPA64_LPB64_LPM0_LRVW8_LWPMn1_MIAV0_MIWT8_4_MO40_NTn1_NTA0_NTB0_NTC0_NTD0_NTM0_NEPBS0_NLCA1_NLCB1_ONLL1_PGR2_PLR1_PKA1_SIA3_SS1_SU0_SUM0_SUS64_SPO0_SRVW0_SSO0_SVW4_SK3_SKXCCM8_TLDS0_ULSGRO0_USL1_UIOFGRO0_USFGRO0_VSn1_VWA4_VWB4_WSGRA0_WSGRB0_WS64_WG32_8_1_WGM1_WGMXCC1_WGMXCCGn1
    SolutionIndex: 72
    SolutionNameMin: Cijk_Ailk_Bjlk_I8II_BH_UserArgs_MT256x128x64_MI16x16x1_SN_LDSB1_AFC0_AFEM1_AFEM1_ASEM1_CLR1_CADS0_DTVA0_DTVB0_EPS0_FDSI0_GRPM1_GRVWA4_GRVWB8_GSU0_GSUAMB_GSUC0_GSUWGMRR0_GLS0_ISA942_IU1_K1_LBSPPA2048_LBSPPB1024_LBSPPM0_LPA64_LPB64_LPM0_LRVW8_LWPMn1_MIAV0_MIWT8_4_MO40_NTn1_NTA0_NTB0_NTC0_NTD0_NTM0_NEPBS0_NLCA1_NLCB1_ONLL1_PGR2_PLR1_PKA1_SIA3_SS1_SU0_SUM0_SUS64_SPO0_SRVW0_SSO0_SVW4_SK3_SKXCCM8_TLDS0_ULSGRO0_USL1_UIOFGRO0_USFGRO0_VSn1_VWA4_VWB4_WSGRA0_WSGRB0_WS64_WG32_8_1_WGM1_WGMXCC1_WGMXCCGn1
    SolutionIndex: 73
    SolutionNameMin: Cijk_Ailk_Bjlk_I8II_BH_UserArgs_MT256x128x64_MI16x16x1_SN_LDSB1_AFC0_AFEM1_AFEM1_ASEM1_CLR1_CADS0_DTVA0_DTVB0_EPS0_FDSI0_GRPM1_GRVWA8_GRVWB8_GSU0_GSUAMB_GSUC0_GSUWGMRR0_GLS0_ISA942_IU1_K1_LBSPPA2048_LBSPPB1024_LBSPPM0_LPA0_LPB64_LPM0_LRVW8_LWPMn1_MIAV0_MIWT8_4_MO40_NTn1_NTA0_NTB0_NTC0_NTD0_NTM0_NEPBS0_NLCA1_NLCB1_ONLL1_PGR2_PLR1_PKA1_SIA3_SS1_SU0_SUM0_SUS64_SPO0_SRVW0_SSO0_SVW8_SK3_SKXCCM8_TLDS0_ULSGRO0_USL1_UIOFGRO0_USFGRO0_VSn1_VWA8_VWB4_WSGRA0_WSGRB0_WS64_WG32_8_1_WGM4_WGMXCC1_WGMXCCGn1
    SolutionIndex: 74
    SolutionNameMin: Cijk_Ailk_Bjlk_I8II_BH_UserArgs_MT256x128x64_MI16x16x1_SN_LDSB1_AFC0_AFEM1_AFEM1_ASEM1_CLR1_CADS0_DTVA0_DTVB0_EPS0_FDSI0_GRPM1_GRVWA4_GRVWB4_GSU0_GSUAMB_GSUC0_GSUWGMRR0_GLS0_ISA942_IU1_K1_LBSPPA2048_LBSPPB1024_LBSPPM0_LPA64_LPB64_LPM0_LRVW8_LWPMn1_MIAV0_MIWT8_4_MO40_NTn1_NTA0_NTB0_NTC0_NTD0_NTM0_NEPBS0_NLCA1_NLCB1_ONLL1_PGR2_PLR1_PKA1_SIA3_SS1_SU0_SUM0_SUS64_SPO0_SRVW0_SSO0_SVW4_SK3_SKXCCM8_TLDS0_ULSGRO0_USL1_UIOFGRO0_USFGRO0_VSn1_VWA4_VWB4_WSGRA0_WSGRB0_WS64_WG32_8_1_WGM8_WGMXCC1_WGMXCCGn1
    SolutionIndex: 75
    SolutionNameMin: Cijk_Ailk_Bjlk_I8II_BH_UserArgs_MT256x128x64_MI16x16x1_SN_LDSB1_AFC0_AFEM1_AFEM1_ASEM1_CLR1_CADS0_DTVA0_DTVB0_EPS0_FDSI0_GRPM1_GRVWA4_GRVWB8_GSU0_GSUAMB_GSUC0_GSUWGMRR0_GLS0_ISA942_IU1_K1_LBSPPA2048_LBSPPB1024_LBSPPM0_LPA64_LPB64_LPM0_LRVW8_LWPMn1_MIAV0_MIWT8_4_MO40_NTn1_NTA0_NTB0_NTC0_NTD0_NTM0_NEPBS0_NLCA1_NLCB1_ONLL1_PGR2_PLR1_PKA1_SIA3_SS1_SU0_SUM0_SUS64_SPO0_SRVW0_SSO0_SVW4_SK3_SKXCCM8_TLDS0_ULSGRO0_USL1_UIOFGRO0_USFGRO0_VSn1_VWA4_VWB4_WSGRA0_WSGRB0_WS64_WG32_8_1_WGM8_WGMXCC1_WGMXCCGn1
    SolutionIndex: 76
    SolutionNameMin: Cijk_Ailk_Bjlk_I8II_BH_UserArgs_MT128x128x64_MI16x16x1_SN_LDSB1_AFC0_AFEM1_AFEM1_ASEM1_CLR1_CADS0_DTVA0_DTVB0_EPS0_FDSI0_GRPM1_GRVWA4_GRVWB4_GSU0_GSUAMB_GSUC0_GSUWGMRR0_GLS0_ISA942_IU1_K1_LBSPPA1024_LBSPPB1024_LBSPPM0_LPA64_LPB64_LPM0_LRVW8_LWPMn1_MIAV0_MIWT4_4_MO40_NTn1_NTA0_NTB0_NTC0_NTD0_NTM0_NEPBS0_NLCA1_NLCB1_ONLL1_PGR2_PLR1_PKA1_SIA3_SS1_SU0_SUM0_SUS64_SPO0_SRVW0_SSO0_SVW4_SK3_SKXCCM8_TLDS0_ULSGRO0_USL1_UIOFGRO0_USFGRO0_VSn1_VWA4_VWB4_WSGRA0_WSGRB0_WS64_WG32_8_1_WGM1_WGMXCC1_WGMXCCGn1
    SolutionIndex: 77
    SolutionNameMin: Cijk_Ailk_Bjlk_I8II_BH_UserArgs_MT128x128x64_MI16x16x1_SN_LDSB1_AFC0_AFEM1_AFEM1_ASEM1_CLR1_CADS0_DTVA0_DTVB0_EPS0_FDSI0_GRPM1_GRVWA8_GRVWB4_GSU0_GSUAMB_GSUC0_GSUWGMRR0_GLS0_ISA942_IU1_K1_LBSPPA1024_LBSPPB1024_LBSPPM0_LPA64_LPB32_LPM0_LRVW8_LWPMn1_MIAV0_MIWT4_4_MO40_NTn1_NTA0_NTB0_NTC0_NTD0_NTM0_NEPBS0_NLCA1_NLCB1_ONLL1_PGR2_PLR1_PKA1_SIA3_SS1_SU0_SUM0_SUS64_SPO0_SRVW0_SSO0_SVW4_SK3_SKXCCM8_TLDS0_ULSGRO0_USL1_UIOFGRO0_USFGRO0_VSn1_VWA4_VWB2_WSGRA0_WSGRB0_WS64_WG32_8_1_WGM1_WGMXCC1_WGMXCCGn1
    SolutionIndex: 78
    SolutionNameMin: Cijk_Ailk_Bjlk_I8II_BH_UserArgs_MT128x128x64_MI16x16x1_SN_LDSB1_AFC0_AFEM1_AFEM1_ASEM1_CLR1_CADS0_DTVA0_DTVB0_EPS0_FDSI0_GRPM1_GRVWA4_GRVWB8_GSU0_GSUAMB_GSUC0_GSUWGMRR0_GLS0_ISA942_IU1_K1_LBSPPA1024_LBSPPB1024_LBSPPM0_LPA64_LPB32_LPM0_LRVW8_LWPMn1_MIAV0_MIWT4_4_MO40_NTn1_NTA0_NTB0_NTC0_NTD0_NTM0_NEPBS0_NLCA1_NLCB1_ONLL1_PGR2_PLR1_PKA1_SIA3_SS1_SU0_SUM0_SUS64_SPO0_SRVW0_SSO0_SVW4_SK3_SKXCCM8_TLDS0_ULSGRO0_USL1_UIOFGRO0_USFGRO0_VSn1_VWA4_VWB2_WSGRA0_WSGRB0_WS64_WG32_8_1_WGM1_WGMXCC1_WGMXCCGn1
    SolutionIndex: 79
    SolutionNameMin: Cijk_Ailk_Bjlk_I8II_BH_UserArgs_MT128x128x64_MI16x16x1_SN_LDSB1_AFC0_AFEM1_AFEM1_ASEM1_CLR1_CADS0_DTVA0_DTVB0_EPS0_FDSI0_GRPM1_GRVWA4_GRVWB8_GSU0_GSUAMB_GSUC0_GSUWGMRR0_GLS0_ISA942_IU1_K1_LBSPPA1024_LBSPPB1024_LBSPPM0_LPA64_LPB64_LPM0_LRVW8_LWPMn1_MIAV0_MIWT4_4_MO40_NTn1_NTA0_NTB0_NTC0_NTD0_NTM0_NEPBS0_NLCA1_NLCB1_ONLL1_PGR2_PLR1_PKA1_SIA3_SS1_SU0_SUM0_SUS64_SPO0_SRVW0_SSO0_SVW4_SK3_SKXCCM8_TLDS0_ULSGRO0_USL1_UIOFGRO0_USFGRO0_VSn1_VWA4_VWB4_WSGRA0_WSGRB0_WS64_WG32_8_1_WGM1_WGMXCC1_WGMXCCGn1
    SolutionIndex: 80
    SolutionNameMin: Cijk_Ailk_Bjlk_I8II_BH_UserArgs_MT128x128x64_MI16x16x1_SN_LDSB1_AFC0_AFEM1_AFEM1_ASEM1_CLR1_CADS0_DTVA0_DTVB0_EPS0_FDSI0_GRPM1_GRVWA4_GRVWB4_GSU0_GSUAMB_GSUC0_GSUWGMRR0_GLS0_ISA942_IU1_K1_LBSPPA1024_LBSPPB1024_LBSPPM0_LPA64_LPB64_LPM0_LRVW8_LWPMn1_MIAV0_MIWT4_4_MO40_NTn1_NTA0_NTB0_NTC0_NTD0_NTM0_NEPBS0_NLCA1_NLCB1_ONLL1_PGR2_PLR1_PKA1_SIA3_SS1_SU0_SUM0_SUS64_SPO0_SRVW0_SSO0_SVW4_SK3_SKXCCM8_TLDS0_ULSGRO0_USL1_UIOFGRO0_USFGRO0_VSn1_VWA4_VWB4_WSGRA0_WSGRB0_WS64_WG32_8_1_WGM4_WGMXCC1_WGMXCCGn1
    SolutionIndex: 81
    SolutionNameMin: Cijk_Ailk_Bjlk_I8II_BH_UserArgs_MT128x128x64_MI16x16x1_SN_LDSB1_AFC0_AFEM1_AFEM1_ASEM1_CLR1_CADS0_DTVA0_DTVB0_EPS0_FDSI0_GRPM1_GRVWA8_GRVWB4_GSU0_GSUAMB_GSUC0_GSUWGMRR0_GLS0_ISA942_IU1_K1_LBSPPA1024_LBSPPB1024_LBSPPM0_LPA64_LPB32_LPM0_LRVW8_LWPMn1_MIAV0_MIWT4_4_MO40_NTn1_NTA0_NTB0_NTC0_NTD0_NTM0_NEPBS0_NLCA1_NLCB1_ONLL1_PGR2_PLR1_PKA1_SIA3_SS1_SU0_SUM0_SUS64_SPO0_SRVW0_SSO0_SVW4_SK3_SKXCCM8_TLDS0_ULSGRO0_USL1_UIOFGRO0_USFGRO0_VSn1_VWA4_VWB2_WSGRA0_WSGRB0_WS64_WG32_8_1_WGM4_WGMXCC1_WGMXCCGn1
    SolutionIndex: 82
    SolutionNameMin: Cijk_Ailk_Bjlk_I8II_BH_UserArgs_MT128x128x64_MI16x16x1_SN_LDSB1_AFC0_AFEM1_AFEM1_ASEM1_CLR1_CADS0_DTVA0_DTVB0_EPS0_FDSI0_GRPM1_GRVWA4_GRVWB8_GSU0_GSUAMB_GSUC0_GSUWGMRR0_GLS0_ISA942_IU1_K1_LBSPPA1024_LBSPPB1024_LBSPPM0_LPA64_LPB64_LPM0_LRVW8_LWPMn1_MIAV0_MIWT4_4_MO40_NTn1_NTA0_NTB0_NTC0_NTD0_NTM0_NEPBS0_NLCA1_NLCB1_ONLL1_PGR2_PLR1_PKA1_SIA3_SS1_SU0_SUM0_SUS64_SPO0_SRVW0_SSO0_SVW4_SK3_SKXCCM8_TLDS0_ULSGRO0_USL1_UIOFGRO0_USFGRO0_VSn1_VWA4_VWB4_WSGRA0_WSGRB0_WS64_WG32_8_1_WGM4_WGMXCC1_WGMXCCGn1
    SolutionIndex: 83
    SolutionNameMin: Cijk_Ailk_Bjlk_I8II_BH_UserArgs_MT128x128x64_MI16x16x1_SN_LDSB1_AFC0_AFEM1_AFEM1_ASEM1_CLR1_CADS0_DTVA0_DTVB0_EPS0_FDSI0_GRPM1_GRVWA4_GRVWB8_GSU0_GSUAMB_GSUC0_GSUWGMRR0_GLS0_ISA942_IU1_K1_LBSPPA1024_LBSPPB1024_LBSPPM0_LPA64_LPB32_LPM0_LRVW8_LWPMn1_MIAV0_MIWT4_4_MO40_NTn1_NTA0_NTB0_NTC0_NTD0_NTM0_NEPBS0_NLCA1_NLCB1_ONLL1_PGR2_PLR1_PKA1_SIA3_SS1_SU0_SUM0_SUS64_SPO0_SRVW0_SSO0_SVW4_SK3_SKXCCM8_TLDS0_ULSGRO0_USL1_UIOFGRO0_USFGRO0_VSn1_VWA4_VWB2_WSGRA0_WSGRB0_WS64_WG32_8_1_WGM8_WGMXCC1_WGMXCCGn1
    SolutionIndex: 84
    SolutionNameMin: Cijk_Ailk_Bjlk_I8II_BH_UserArgs_MT128x128x64_MI16x16x1_SN_LDSB1_AFC0_AFEM1_AFEM1_ASEM1_CLR1_CADS0_DTVA0_DTVB0_EPS0_FDSI0_GRPM1_GRVWA4_GRVWB8_GSU0_GSUAMB_GSUC0_GSUWGMRR0_GLS0_ISA942_IU1_K1_LBSPPA1024_LBSPPB1024_LBSPPM0_LPA64_LPB64_LPM0_LRVW8_LWPMn1_MIAV0_MIWT4_4_MO40_NTn1_NTA0_NTB0_NTC0_NTD0_NTM0_NEPBS0_NLCA1_NLCB1_ONLL1_PGR2_PLR1_PKA1_SIA3_SS1_SU0_SUM0_SUS64_SPO0_SRVW0_SSO0_SVW4_SK3_SKXCCM8_TLDS0_ULSGRO0_USL1_UIOFGRO0_USFGRO0_VSn1_VWA4_VWB4_WSGRA0_WSGRB0_WS64_WG32_8_1_WGM8_WGMXCC1_WGMXCCGn1
    SolutionIndex: 85
    SolutionNameMin: Cijk_Ailk_Bjlk_I8II_BH_UserArgs_MT64x128x64_MI16x16x1_SN_LDSB0_AFC0_AFEM1_AFEM1_ASEM1_CLR1_CADS0_DTVA0_DTVB0_EPS0_FDSI0_GRPM1_GRVWA4_GRVWB4_GSU0_GSUAMB_GSUC0_GSUWGMRR0_GLS0_ISA942_IU1_K1_LBSPPA512_LBSPPB1024_LBSPPM0_LPA32_LPB64_LPM0_LRVW8_LWPMn1_MIAV0_MIWT2_4_MO40_NTn1_NTA0_NTB0_NTC0_NTD0_NTM0_NEPBS0_NLCA1_NLCB1_ONLL1_PGR2_PLR1_PKA1_SIA3_SS1_SU0_SUM0_SUS64_SPO0_SRVW0_SSO0_SVW2_SK3_SKXCCM8_TLDS0_ULSGRO0_USL1_UIOFGRO0_USFGRO0_VSn1_VWA2_VWB4_WSGRA0_WSGRB0_WS64_WG32_8_1_WGM1_WGMXCC1_WGMXCCGn1
    SolutionIndex: 86
    SolutionNameMin: Cijk_Ailk_Bjlk_I8II_BH_UserArgs_MT64x128x64_MI16x16x1_SN_LDSB0_AFC0_AFEM1_AFEM1_ASEM1_CLR1_CADS0_DTVA0_DTVB0_EPS0_FDSI0_GRPM1_GRVWA2_GRVWB8_GSU0_GSUAMB_GSUC0_GSUWGMRR0_GLS0_ISA942_IU1_K1_LBSPPA512_LBSPPB1024_LBSPPM0_LPA32_LPB64_LPM0_LRVW8_LWPMn1_MIAV0_MIWT2_4_MO40_NTn1_NTA0_NTB0_NTC0_NTD0_NTM0_NEPBS0_NLCA1_NLCB1_ONLL1_PGR2_PLR1_PKA1_SIA3_SS1_SU0_SUM0_SUS64_SPO0_SRVW0_SSO0_SVW2_SK3_SKXCCM8_TLDS0_ULSGRO0_USL1_UIOFGRO0_USFGRO0_VSn1_VWA2_VWB4_WSGRA0_WSGRB0_WS64_WG32_8_1_WGM1_WGMXCC1_WGMXCCGn1
    SolutionIndex: 87
    SolutionNameMin: Cijk_Ailk_Bjlk_I8II_BH_UserArgs_MT64x128x64_MI16x16x1_SN_LDSB0_AFC0_AFEM1_AFEM1_ASEM1_CLR1_CADS0_DTVA0_DTVB0_EPS0_FDSI0_GRPM1_GRVWA4_GRVWB8_GSU0_GSUAMB_GSUC0_GSUWGMRR0_GLS0_ISA942_IU1_K1_LBSPPA512_LBSPPB1024_LBSPPM0_LPA32_LPB64_LPM0_LRVW8_LWPMn1_MIAV0_MIWT2_4_MO40_NTn1_NTA0_NTB0_NTC0_NTD0_NTM0_NEPBS0_NLCA1_NLCB1_ONLL1_PGR2_PLR1_PKA1_SIA3_SS1_SU0_SUM0_SUS64_SPO0_SRVW0_SSO0_SVW2_SK3_SKXCCM8_TLDS0_ULSGRO0_USL1_UIOFGRO0_USFGRO0_VSn1_VWA2_VWB4_WSGRA0_WSGRB0_WS64_WG32_8_1_WGM1_WGMXCC1_WGMXCCGn1
    SolutionIndex: 88
    SolutionNameMin: Cijk_Ailk_Bjlk_I8II_BH_UserArgs_MT64x128x64_MI16x16x1_SN_LDSB0_AFC0_AFEM1_AFEM1_ASEM1_CLR1_CADS0_DTVA0_DTVB0_EPS0_FDSI0_GRPM1_GRVWA8_GRVWB8_GSU0_GSUAMB_GSUC0_GSUWGMRR0_GLS0_ISA942_IU1_K1_LBSPPA512_LBSPPB1024_LBSPPM0_LPA32_LPB64_LPM0_LRVW8_LWPMn1_MIAV0_MIWT2_4_MO40_NTn1_NTA0_NTB0_NTC0_NTD0_NTM0_NEPBS0_NLCA1_NLCB1_ONLL1_PGR2_PLR1_PKA1_SIA3_SS1_SU0_SUM0_SUS64_SPO0_SRVW0_SSO0_SVW2_SK3_SKXCCM8_TLDS0_ULSGRO0_USL1_UIOFGRO0_USFGRO0_VSn1_VWA2_VWB4_WSGRA0_WSGRB0_WS64_WG32_8_1_WGM1_WGMXCC1_WGMXCCGn1
    SolutionIndex: 89
    SolutionNameMin: Cijk_Ailk_Bjlk_I8II_BH_UserArgs_MT64x128x64_MI16x16x1_SN_LDSB0_AFC0_AFEM1_AFEM1_ASEM1_CLR1_CADS0_DTVA0_DTVB0_EPS0_FDSI0_GRPM1_GRVWA4_GRVWB8_GSU0_GSUAMB_GSUC0_GSUWGMRR0_GLS0_ISA942_IU1_K1_LBSPPA512_LBSPPB1024_LBSPPM0_LPA32_LPB64_LPM0_LRVW8_LWPMn1_MIAV0_MIWT2_4_MO40_NTn1_NTA0_NTB0_NTC0_NTD0_NTM0_NEPBS0_NLCA1_NLCB1_ONLL1_PGR2_PLR1_PKA1_SIA3_SS1_SU0_SUM0_SUS64_SPO0_SRVW0_SSO0_SVW2_SK3_SKXCCM8_TLDS0_ULSGRO0_USL1_UIOFGRO0_USFGRO0_VSn1_VWA2_VWB4_WSGRA0_WSGRB0_WS64_WG32_8_1_WGM4_WGMXCC1_WGMXCCGn1
    SolutionIndex: 90
    SolutionNameMin: Cijk_Ailk_Bjlk_I8II_BH_UserArgs_MT64x128x64_MI16x16x1_SN_LDSB0_AFC0_AFEM1_AFEM1_ASEM1_CLR1_CADS0_DTVA0_DTVB0_EPS0_FDSI0_GRPM1_GRVWA4_GRVWB4_GSU0_GSUAMB_GSUC0_GSUWGMRR0_GLS0_ISA942_IU1_K1_LBSPPA512_LBSPPB1024_LBSPPM0_LPA32_LPB64_LPM0_LRVW8_LWPMn1_MIAV0_MIWT2_4_MO40_NTn1_NTA0_NTB0_NTC0_NTD0_NTM0_NEPBS0_NLCA1_NLCB1_ONLL1_PGR2_PLR1_PKA1_SIA3_SS1_SU0_SUM0_SUS64_SPO0_SRVW0_SSO0_SVW2_SK3_SKXCCM8_TLDS0_ULSGRO0_USL1_UIOFGRO0_USFGRO0_VSn1_VWA2_VWB4_WSGRA0_WSGRB0_WS64_WG32_8_1_WGM8_WGMXCC1_WGMXCCGn1
    SolutionIndex: 91
    SolutionNameMin: Cijk_Ailk_Bjlk_I8II_BH_UserArgs_MT64x128x64_MI16x16x1_SN_LDSB0_AFC0_AFEM1_AFEM1_ASEM1_CLR1_CADS0_DTVA0_DTVB0_EPS0_FDSI0_GRPM1_GRVWA4_GRVWB8_GSU0_GSUAMB_GSUC0_GSUWGMRR0_GLS0_ISA942_IU1_K1_LBSPPA512_LBSPPB1024_LBSPPM0_LPA32_LPB64_LPM0_LRVW8_LWPMn1_MIAV0_MIWT2_4_MO40_NTn1_NTA0_NTB0_NTC0_NTD0_NTM0_NEPBS0_NLCA1_NLCB1_ONLL1_PGR2_PLR1_PKA1_SIA3_SS1_SU0_SUM0_SUS64_SPO0_SRVW0_SSO0_SVW2_SK3_SKXCCM8_TLDS0_ULSGRO0_USL1_UIOFGRO0_USFGRO0_VSn1_VWA2_VWB4_WSGRA0_WSGRB0_WS64_WG32_8_1_WGM8_WGMXCC1_WGMXCCGn1
    SolutionIndex: 92
    SolutionNameMin: Cijk_Ailk_Bjlk_I8II_BH_UserArgs_MT64x128x64_MI16x16x1_SN_LDSB0_AFC0_AFEM1_AFEM1_ASEM1_CLR0_CADS0_DTVA0_DTVB0_EPS0_FDSI0_GRPM1_GRVWA4_GRVWB4_GSU0_GSUAMB_GSUC0_GSUWGMRR0_GLS0_ISA942_IU1_K1_LBSPPA512_LBSPPB1024_LBSPPM0_LPA16_LPB64_LPM0_LRVW8_LWPMn1_MIAV0_MIWT2_4_MO40_NTn1_NTA0_NTB0_NTC0_NTD0_NTM0_NEPBS0_NLCA1_NLCB1_ONLL1_PGR2_PLR0_PKA1_SIA3_SS1_SU0_SUM0_SUS64_SPO0_SRVW0_SSO0_SVW1_SK3_SKXCCM8_TLDS0_ULSGRO0_USL1_UIOFGRO0_USFGRO0_VSn1_VWA1_VWB4_WSGRA0_WSGRB0_WS64_WG32_8_1_WGM8_WGMXCC1_WGMXCCGn1
    SolutionIndex: 93
    SolutionNameMin: Cijk_Ailk_Bjlk_I8II_BH_UserArgs_MT128x64x64_MI16x16x1_SN_LDSB0_AFC0_AFEM1_AFEM1_ASEM1_CLR1_CADS0_DTVA0_DTVB0_EPS0_FDSI0_GRPM1_GRVWA4_GRVWB2_GSU0_GSUAMB_GSUC0_GSUWGMRR0_GLS0_ISA942_IU1_K1_LBSPPA1024_LBSPPB512_LBSPPM0_LPA64_LPB32_LPM0_LRVW8_LWPMn1_MIAV0_MIWT4_2_MO40_NTn1_NTA0_NTB0_NTC0_NTD0_NTM0_NEPBS0_NLCA1_NLCB1_ONLL1_PGR2_PLR1_PKA1_SIA3_SS1_SU0_SUM0_SUS64_SPO0_SRVW0_SSO0_SVW4_SK3_SKXCCM8_TLDS0_ULSGRO0_USL1_UIOFGRO0_USFGRO0_VSn1_VWA4_VWB2_WSGRA0_WSGRB0_WS64_WG32_8_1_WGM1_WGMXCC1_WGMXCCGn1
    SolutionIndex: 94
    SolutionNameMin: Cijk_Ailk_Bjlk_I8II_BH_UserArgs_MT128x64x64_MI16x16x1_SN_LDSB0_AFC0_AFEM1_AFEM1_ASEM1_CLR1_CADS0_DTVA0_DTVB0_EPS0_FDSI0_GRPM1_GRVWA4_GRVWB8_GSU0_GSUAMB_GSUC0_GSUWGMRR0_GLS0_ISA942_IU1_K1_LBSPPA1024_LBSPPB512_LBSPPM0_LPA32_LPB16_LPM0_LRVW8_LWPMn1_MIAV0_MIWT4_2_MO40_NTn1_NTA0_NTB0_NTC0_NTD0_NTM0_NEPBS0_NLCA1_NLCB1_ONLL1_PGR2_PLR1_PKA1_SIA3_SS1_SU0_SUM0_SUS64_SPO0_SRVW0_SSO0_SVW2_SK3_SKXCCM8_TLDS0_ULSGRO0_USL1_UIOFGRO0_USFGRO0_VSn1_VWA2_VWB1_WSGRA0_WSGRB0_WS64_WG32_8_1_WGM1_WGMXCC1_WGMXCCGn1
    SolutionIndex: 95
    SolutionNameMin: Cijk_Ailk_Bjlk_I8II_BH_UserArgs_MT128x64x64_MI16x16x1_SN_LDSB0_AFC0_AFEM1_AFEM1_ASEM1_CLR1_CADS0_DTVA0_DTVB0_EPS0_FDSI0_GRPM1_GRVWA4_GRVWB8_GSU0_GSUAMB_GSUC0_GSUWGMRR0_GLS0_ISA942_IU1_K1_LBSPPA1024_LBSPPB512_LBSPPM0_LPA64_LPB32_LPM0_LRVW8_LWPMn1_MIAV0_MIWT4_2_MO40_NTn1_NTA0_NTB0_NTC0_NTD0_NTM0_NEPBS0_NLCA1_NLCB1_ONLL1_PGR2_PLR1_PKA1_SIA3_SS1_SU0_SUM0_SUS64_SPO0_SRVW0_SSO0_SVW4_SK3_SKXCCM8_TLDS0_ULSGRO0_USL1_UIOFGRO0_USFGRO0_VSn1_VWA4_VWB2_WSGRA0_WSGRB0_WS64_WG32_8_1_WGM1_WGMXCC1_WGMXCCGn1
    SolutionIndex: 96
    SolutionNameMin: Cijk_Ailk_Bjlk_I8II_BH_UserArgs_MT128x64x64_MI16x16x1_SN_LDSB0_AFC0_AFEM1_AFEM1_ASEM1_CLR1_CADS0_DTVA0_DTVB0_EPS0_FDSI0_GRPM1_GRVWA4_GRVWB8_GSU0_GSUAMB_GSUC0_GSUWGMRR0_GLS0_ISA942_IU1_K1_LBSPPA1024_LBSPPB512_LBSPPM0_LPA64_LPB32_LPM0_LRVW8_LWPMn1_MIAV0_MIWT4_2_MO40_NTn1_NTA0_NTB0_NTC0_NTD0_NTM0_NEPBS0_NLCA1_NLCB1_ONLL1_PGR2_PLR1_PKA1_SIA3_SS1_SU0_SUM0_SUS64_SPO0_SRVW0_SSO0_SVW4_SK3_SKXCCM8_TLDS0_ULSGRO0_USL1_UIOFGRO0_USFGRO0_VSn1_VWA4_VWB2_WSGRA0_WSGRB0_WS64_WG32_8_1_WGM8_WGMXCC1_WGMXCCGn1
    SolutionIndex: 97
    SolutionNameMin: Cijk_Ailk_Bjlk_I8II_BH_UserArgs_MT128x64x64_MI16x16x1_SN_LDSB0_AFC0_AFEM1_AFEM1_ASEM1_CLR1_CADS0_DTVA0_DTVB0_EPS0_FDSI0_GRPM1_GRVWA8_GRVWB8_GSU0_GSUAMB_GSUC0_GSUWGMRR0_GLS0_ISA942_IU1_K1_LBSPPA1024_LBSPPB512_LBSPPM0_LPA64_LPB32_LPM0_LRVW8_LWPMn1_MIAV0_MIWT4_2_MO40_NTn1_NTA0_NTB0_NTC0_NTD0_NTM0_NEPBS0_NLCA1_NLCB1_ONLL1_PGR2_PLR1_PKA1_SIA3_SS1_SU0_SUM0_SUS64_SPO0_SRVW0_SSO0_SVW4_SK3_SKXCCM8_TLDS0_ULSGRO0_USL1_UIOFGRO0_USFGRO0_VSn1_VWA4_VWB2_WSGRA0_WSGRB0_WS64_WG32_8_1_WGM8_WGMXCC1_WGMXCCGn1
    SolutionIndex: 98
    SolutionNameMin: Cijk_Ailk_Bjlk_I8II_BH_UserArgs_MT128x64x64_MI16x16x1_SN_LDSB0_AFC0_AFEM1_AFEM1_ASEM1_CLR0_CADS0_DTVA0_DTVB0_EPS0_FDSI0_GRPM1_GRVWA4_GRVWB8_GSU0_GSUAMB_GSUC0_GSUWGMRR0_GLS0_ISA942_IU1_K1_LBSPPA1024_LBSPPB512_LBSPPM0_LPA64_LPB32_LPM0_LRVW8_LWPMn1_MIAV0_MIWT4_2_MO40_NTn1_NTA0_NTB0_NTC0_NTD0_NTM0_NEPBS0_NLCA1_NLCB1_ONLL1_PGR2_PLR0_PKA1_SIA3_SS1_SU0_SUM0_SUS64_SPO0_SRVW0_SSO0_SVW4_SK3_SKXCCM8_TLDS0_ULSGRO0_USL1_UIOFGRO0_USFGRO0_VSn1_VWA4_VWB2_WSGRA0_WSGRB0_WS64_WG32_8_1_WGM8_WGMXCC1_WGMXCCGn1
    SolutionIndex: 99
    SolutionNameMin: Cijk_Ailk_Bjlk_I8II_BH_UserArgs_MT32x128x64_MI16x16x1_SN_LDSB0_AFC0_AFEM1_AFEM1_ASEM1_CLR0_CADS0_DTVA0_DTVB0_EPS0_FDSI0_GRPM1_GRVWA8_GRVWB2_GSU0_GSUAMB_GSUC0_GSUWGMRR0_GLS0_ISA942_IU1_K1_LBSPPA256_LBSPPB1024_LBSPPM0_LPA16_LPB64_LPM0_LRVW8_LWPMn1_MIAV0_MIWT1_4_MO40_NTn1_NTA0_NTB0_NTC0_NTD0_NTM0_NEPBS0_NLCA1_NLCB1_ONLL1_PGR2_PLR0_PKA1_SIA3_SS1_SU0_SUM0_SUS64_SPO0_SRVW0_SSO0_SVW1_SK3_SKXCCM8_TLDS0_ULSGRO0_USL1_UIOFGRO0_USFGRO0_VSn1_VWA1_VWB4_WSGRA0_WSGRB0_WS64_WG32_8_1_WGM1_WGMXCC1_WGMXCCGn1
    SolutionIndex: 100
    SolutionNameMin: Cijk_Ailk_Bjlk_I8II_BH_UserArgs_MT128x32x64_MI16x16x1_SN_LDSB0_AFC0_AFEM1_AFEM1_ASEM1_CLR1_CADS0_DTVA0_DTVB0_EPS0_FDSI0_GRPM1_GRVWA4_GRVWB4_GSU0_GSUAMB_GSUC0_GSUWGMRR0_GLS0_ISA942_IU1_K1_LBSPPA1024_LBSPPB256_LBSPPM0_LPA64_LPB16_LPM0_LRVW8_LWPMn1_MIAV0_MIWT4_1_MO40_NTn1_NTA0_NTB0_NTC0_NTD0_NTM0_NEPBS0_NLCA1_NLCB1_ONLL1_PGR2_PLR1_PKA1_SIA3_SS1_SU0_SUM0_SUS64_SPO0_SRVW0_SSO0_SVW4_SK3_SKXCCM8_TLDS0_ULSGRO0_USL1_UIOFGRO0_USFGRO0_VSn1_VWA4_VWB1_WSGRA0_WSGRB0_WS64_WG32_8_1_WGM1_WGMXCC1_WGMXCCGn1
    SolutionIndex: 101
    SolutionNameMin: Cijk_Ailk_Bjlk_I8II_BH_UserArgs_MT128x32x64_MI16x16x1_SN_LDSB0_AFC0_AFEM1_AFEM1_ASEM1_CLR0_CADS0_DTVA0_DTVB0_EPS0_FDSI0_GRPM1_GRVWA4_GRVWB4_GSU0_GSUAMB_GSUC0_GSUWGMRR0_GLS0_ISA942_IU1_K1_LBSPPA1024_LBSPPB256_LBSPPM0_LPA32_LPB16_LPM0_LRVW8_LWPMn1_MIAV0_MIWT4_1_MO40_NTn1_NTA0_NTB0_NTC0_NTD0_NTM0_NEPBS0_NLCA1_NLCB1_ONLL1_PGR2_PLR0_PKA1_SIA3_SS1_SU0_SUM0_SUS64_SPO0_SRVW0_SSO0_SVW2_SK3_SKXCCM8_TLDS0_ULSGRO0_USL1_UIOFGRO0_USFGRO0_VSn1_VWA2_VWB1_WSGRA0_WSGRB0_WS64_WG32_8_1_WGM1_WGMXCC1_WGMXCCGn1
    SolutionIndex: 102
    SolutionNameMin: Cijk_Ailk_Bjlk_I8II_BH_UserArgs_MT128x32x64_MI16x16x1_SN_LDSB0_AFC0_AFEM1_AFEM1_ASEM1_CLR1_CADS0_DTVA0_DTVB0_EPS0_FDSI0_GRPM1_GRVWA8_GRVWB2_GSU0_GSUAMB_GSUC0_GSUWGMRR0_GLS0_ISA942_IU1_K1_LBSPPA1024_LBSPPB256_LBSPPM0_LPA32_LPB16_LPM0_LRVW8_LWPMn1_MIAV0_MIWT4_1_MO40_NTn1_NTA0_NTB0_NTC0_NTD0_NTM0_NEPBS0_NLCA1_NLCB1_ONLL1_PGR2_PLR1_PKA1_SIA3_SS1_SU0_SUM0_SUS64_SPO0_SRVW0_SSO0_SVW2_SK3_SKXCCM8_TLDS0_ULSGRO0_USL1_UIOFGRO0_USFGRO0_VSn1_VWA2_VWB1_WSGRA0_WSGRB0_WS64_WG32_8_1_WGM4_WGMXCC1_WGMXCCGn1
    SolutionIndex: 103
    SolutionNameMin: Cijk_Ailk_Bjlk_I8II_BH_UserArgs_MT64x64x64_MI16x16x1_SN_LDSB0_AFC0_AFEM1_AFEM1_ASEM1_CLR1_CADS0_DTVA0_DTVB0_EPS0_FDSI0_GRPM1_GRVWA8_GRVWB4_GSU0_GSUAMB_GSUC0_GSUWGMRR0_GLS0_ISA942_IU1_K1_LBSPPA512_LBSPPB512_LBSPPM0_LPA32_LPB32_LPM0_LRVW8_LWPMn1_MIAV0_MIWT2_2_MO40_NTn1_NTA0_NTB0_NTC0_NTD0_NTM0_NEPBS0_NLCA1_NLCB1_ONLL1_PGR2_PLR1_PKA1_SIA3_SS1_SU0_SUM0_SUS64_SPO0_SRVW0_SSO0_SVW2_SK3_SKXCCM8_TLDS0_ULSGRO0_USL1_UIOFGRO0_USFGRO0_VSn1_VWA2_VWB2_WSGRA0_WSGRB0_WS64_WG32_8_1_WGM1_WGMXCC1_WGMXCCGn1
    SolutionIndex: 104
    SolutionNameMin: Cijk_Ailk_Bjlk_I8II_BH_UserArgs_MT64x64x64_MI16x16x1_SN_LDSB0_AFC0_AFEM1_AFEM1_ASEM1_CLR1_CADS0_DTVA0_DTVB0_EPS0_FDSI0_GRPM1_GRVWA4_GRVWB8_GSU0_GSUAMB_GSUC0_GSUWGMRR0_GLS0_ISA942_IU1_K1_LBSPPA512_LBSPPB512_LBSPPM0_LPA32_LPB32_LPM0_LRVW8_LWPMn1_MIAV0_MIWT2_2_MO40_NTn1_NTA0_NTB0_NTC0_NTD0_NTM0_NEPBS0_NLCA1_NLCB1_ONLL1_PGR2_PLR1_PKA1_SIA3_SS1_SU0_SUM0_SUS64_SPO0_SRVW0_SSO0_SVW2_SK3_SKXCCM8_TLDS0_ULSGRO0_USL1_UIOFGRO0_USFGRO0_VSn1_VWA2_VWB2_WSGRA0_WSGRB0_WS64_WG32_8_1_WGM1_WGMXCC1_WGMXCCGn1
    SolutionIndex: 105
    SolutionNameMin: Cijk_Ailk_Bjlk_I8II_BH_UserArgs_MT64x64x64_MI16x16x1_SN_LDSB0_AFC0_AFEM1_AFEM1_ASEM1_CLR1_CADS0_DTVA0_DTVB0_EPS0_FDSI0_GRPM1_GRVWA8_GRVWB8_GSU0_GSUAMB_GSUC0_GSUWGMRR0_GLS0_ISA942_IU1_K1_LBSPPA512_LBSPPB512_LBSPPM0_LPA32_LPB32_LPM0_LRVW8_LWPMn1_MIAV0_MIWT2_2_MO40_NTn1_NTA0_NTB0_NTC0_NTD0_NTM0_NEPBS0_NLCA1_NLCB1_ONLL1_PGR2_PLR1_PKA1_SIA3_SS1_SU0_SUM0_SUS64_SPO0_SRVW0_SSO0_SVW2_SK3_SKXCCM8_TLDS0_ULSGRO0_USL1_UIOFGRO0_USFGRO0_VSn1_VWA2_VWB2_WSGRA0_WSGRB0_WS64_WG32_8_1_WGM1_WGMXCC1_WGMXCCGn1
    SolutionIndex: 106
    SolutionNameMin: Cijk_Ailk_Bjlk_I8II_BH_UserArgs_MT64x64x64_MI16x16x1_SN_LDSB0_AFC0_AFEM1_AFEM1_ASEM1_CLR0_CADS0_DTVA0_DTVB0_EPS0_FDSI0_GRPM1_GRVWA4_GRVWB4_GSU0_GSUAMB_GSUC0_GSUWGMRR0_GLS0_ISA942_IU1_K1_LBSPPA512_LBSPPB512_LBSPPM0_LPA32_LPB32_LPM0_LRVW8_LWPMn1_MIAV0_MIWT2_2_MO40_NTn1_NTA0_NTB0_NTC0_NTD0_NTM0_NEPBS0_NLCA1_NLCB1_ONLL1_PGR2_PLR0_PKA1_SIA3_SS1_SU0_SUM0_SUS64_SPO0_SRVW0_SSO0_SVW2_SK3_SKXCCM8_TLDS0_ULSGRO0_USL1_UIOFGRO0_USFGRO0_VSn1_VWA2_VWB2_WSGRA0_WSGRB0_WS64_WG32_8_1_WGM1_WGMXCC1_WGMXCCGn1
    SolutionIndex: 107
    SolutionNameMin: Cijk_Ailk_Bjlk_I8II_BH_UserArgs_MT64x64x64_MI16x16x1_SN_LDSB0_AFC0_AFEM1_AFEM1_ASEM1_CLR1_CADS0_DTVA0_DTVB0_EPS0_FDSI0_GRPM1_GRVWA8_GRVWB4_GSU0_GSUAMB_GSUC0_GSUWGMRR0_GLS0_ISA942_IU1_K1_LBSPPA512_LBSPPB512_LBSPPM0_LPA32_LPB32_LPM0_LRVW8_LWPMn1_MIAV0_MIWT2_2_MO40_NTn1_NTA0_NTB0_NTC0_NTD0_NTM0_NEPBS0_NLCA1_NLCB1_ONLL1_PGR2_PLR1_PKA1_SIA3_SS1_SU0_SUM0_SUS64_SPO0_SRVW0_SSO0_SVW2_SK3_SKXCCM8_TLDS0_ULSGRO0_USL1_UIOFGRO0_USFGRO0_VSn1_VWA2_VWB2_WSGRA0_WSGRB0_WS64_WG32_8_1_WGM4_WGMXCC1_WGMXCCGn1
    SolutionIndex: 108
    SolutionNameMin: Cijk_Ailk_Bjlk_I8II_BH_UserArgs_MT64x64x64_MI16x16x1_SN_LDSB0_AFC0_AFEM1_AFEM1_ASEM1_CLR1_CADS0_DTVA0_DTVB0_EPS0_FDSI0_GRPM1_GRVWA2_GRVWB8_GSU0_GSUAMB_GSUC0_GSUWGMRR0_GLS0_ISA942_IU1_K1_LBSPPA512_LBSPPB512_LBSPPM0_LPA16_LPB16_LPM0_LRVW8_LWPMn1_MIAV0_MIWT2_2_MO40_NTn1_NTA0_NTB0_NTC0_NTD0_NTM0_NEPBS0_NLCA1_NLCB1_ONLL1_PGR2_PLR1_PKA1_SIA3_SS1_SU0_SUM0_SUS64_SPO0_SRVW0_SSO0_SVW1_SK3_SKXCCM8_TLDS0_ULSGRO0_USL1_UIOFGRO0_USFGRO0_VSn1_VWA1_VWB1_WSGRA0_WSGRB0_WS64_WG32_8_1_WGM4_WGMXCC1_WGMXCCGn1
    SolutionIndex: 109
    SolutionNameMin: Cijk_Ailk_Bjlk_I8II_BH_UserArgs_MT64x64x64_MI16x16x1_SN_LDSB0_AFC0_AFEM1_AFEM1_ASEM1_CLR0_CADS0_DTVA0_DTVB0_EPS0_FDSI0_GRPM1_GRVWA4_GRVWB8_GSU0_GSUAMB_GSUC0_GSUWGMRR0_GLS0_ISA942_IU1_K1_LBSPPA512_LBSPPB512_LBSPPM0_LPA32_LPB16_LPM0_LRVW8_LWPMn1_MIAV0_MIWT2_2_MO40_NTn1_NTA0_NTB0_NTC0_NTD0_NTM0_NEPBS0_NLCA1_NLCB1_ONLL1_PGR2_PLR0_PKA1_SIA3_SS1_SU0_SUM0_SUS64_SPO0_SRVW0_SSO0_SVW2_SK3_SKXCCM8_TLDS0_ULSGRO0_USL1_UIOFGRO0_USFGRO0_VSn1_VWA2_VWB1_WSGRA0_WSGRB0_WS64_WG32_8_1_WGM8_WGMXCC1_WGMXCCGn1
    SolutionIndex: 110
    SolutionNameMin: Cijk_Ailk_Bjlk_I8II_BH_UserArgs_MT32x64x64_MI16x16x1_SN_LDSB0_AFC0_AFEM1_AFEM1_ASEM1_CLR1_CADS0_DTVA0_DTVB0_EPS0_FDSI0_GRPM1_GRVWA4_GRVWB8_GSU0_GSUAMB_GSUC0_GSUWGMRR0_GLS0_ISA942_IU1_K1_LBSPPA256_LBSPPB512_LBSPPM0_LPA16_LPB32_LPM0_LRVW8_LWPMn1_MIAV0_MIWT1_2_MO40_NTn1_NTA0_NTB0_NTC0_NTD0_NTM0_NEPBS0_NLCA1_NLCB1_ONLL1_PGR2_PLR1_PKA1_SIA3_SS1_SU0_SUM0_SUS64_SPO0_SRVW0_SSO0_SVW1_SK3_SKXCCM8_TLDS0_ULSGRO0_USL1_UIOFGRO0_USFGRO0_VSn1_VWA1_VWB2_WSGRA0_WSGRB0_WS64_WG32_8_1_WGM4_WGMXCC1_WGMXCCGn1
    SolutionIndex: 111
    SolutionNameMin: Cijk_Ailk_Bjlk_I8II_BH_UserArgs_MT32x64x64_MI16x16x1_SN_LDSB0_AFC0_AFEM1_AFEM1_ASEM1_CLR0_CADS0_DTVA0_DTVB0_EPS0_FDSI0_GRPM1_GRVWA4_GRVWB4_GSU0_GSUAMB_GSUC0_GSUWGMRR0_GLS0_ISA942_IU1_K1_LBSPPA256_LBSPPB512_LBSPPM0_LPA16_LPB16_LPM0_LRVW8_LWPMn1_MIAV0_MIWT1_2_MO40_NTn1_NTA0_NTB0_NTC0_NTD0_NTM0_NEPBS0_NLCA1_NLCB1_ONLL1_PGR2_PLR0_PKA1_SIA3_SS1_SU0_SUM0_SUS64_SPO0_SRVW0_SSO0_SVW1_SK3_SKXCCM8_TLDS0_ULSGRO0_USL1_UIOFGRO0_USFGRO0_VSn1_VWA1_VWB1_WSGRA0_WSGRB0_WS64_WG32_8_1_WGM4_WGMXCC1_WGMXCCGn1
    SolutionIndex: 112
    SolutionNameMin: Cijk_Ailk_Bjlk_I8II_BH_UserArgs_MT32x64x64_MI16x16x1_SN_LDSB0_AFC0_AFEM1_AFEM1_ASEM1_CLR0_CADS0_DTVA0_DTVB0_EPS0_FDSI0_GRPM1_GRVWA2_GRVWB4_GSU0_GSUAMB_GSUC0_GSUWGMRR0_GLS0_ISA942_IU1_K1_LBSPPA256_LBSPPB512_LBSPPM0_LPA16_LPB32_LPM0_LRVW8_LWPMn1_MIAV0_MIWT1_2_MO40_NTn1_NTA0_NTB0_NTC0_NTD0_NTM0_NEPBS0_NLCA1_NLCB1_ONLL1_PGR2_PLR0_PKA1_SIA3_SS1_SU0_SUM0_SUS64_SPO0_SRVW0_SSO0_SVW1_SK3_SKXCCM8_TLDS0_ULSGRO0_USL1_UIOFGRO0_USFGRO0_VSn1_VWA1_VWB2_WSGRA0_WSGRB0_WS64_WG32_8_1_WGM8_WGMXCC1_WGMXCCGn1
    SolutionIndex: 113
    SolutionNameMin: Cijk_Ailk_Bjlk_I8II_BH_UserArgs_MT32x64x64_MI16x16x1_SN_LDSB0_AFC0_AFEM1_AFEM1_ASEM1_CLR0_CADS0_DTVA0_DTVB0_EPS0_FDSI0_GRPM1_GRVWA4_GRVWB8_GSU0_GSUAMB_GSUC0_GSUWGMRR0_GLS0_ISA942_IU1_K1_LBSPPA256_LBSPPB512_LBSPPM0_LPA16_LPB32_LPM0_LRVW8_LWPMn1_MIAV0_MIWT1_2_MO40_NTn1_NTA0_NTB0_NTC0_NTD0_NTM0_NEPBS0_NLCA1_NLCB1_ONLL1_PGR2_PLR0_PKA1_SIA3_SS1_SU0_SUM0_SUS64_SPO0_SRVW0_SSO0_SVW1_SK3_SKXCCM8_TLDS0_ULSGRO0_USL1_UIOFGRO0_USFGRO0_VSn1_VWA1_VWB2_WSGRA0_WSGRB0_WS64_WG32_8_1_WGM8_WGMXCC1_WGMXCCGn1
    SolutionIndex: 114
    SolutionNameMin: Cijk_Ailk_Bjlk_I8II_BH_UserArgs_MT64x32x64_MI16x16x1_SN_LDSB0_AFC0_AFEM1_AFEM1_ASEM1_CLR0_CADS0_DTVA0_DTVB0_EPS0_FDSI0_GRPM1_GRVWA2_GRVWB4_GSU0_GSUAMB_GSUC0_GSUWGMRR0_GLS0_ISA942_IU1_K1_LBSPPA512_LBSPPB256_LBSPPM0_LPA16_LPB16_LPM0_LRVW8_LWPMn1_MIAV0_MIWT2_1_MO40_NTn1_NTA0_NTB0_NTC0_NTD0_NTM0_NEPBS0_NLCA1_NLCB1_ONLL1_PGR2_PLR0_PKA1_SIA3_SS1_SU0_SUM0_SUS64_SPO0_SRVW0_SSO0_SVW1_SK3_SKXCCM8_TLDS0_ULSGRO0_USL1_UIOFGRO0_USFGRO0_VSn1_VWA1_VWB1_WSGRA0_WSGRB0_WS64_WG32_8_1_WGM1_WGMXCC1_WGMXCCGn1
    SolutionIndex: 115
    SolutionNameMin: Cijk_Ailk_Bjlk_I8II_BH_UserArgs_MT64x32x64_MI16x16x1_SN_LDSB0_AFC0_AFEM1_AFEM1_ASEM1_CLR0_CADS0_DTVA0_DTVB0_EPS0_FDSI0_GRPM1_GRVWA4_GRVWB8_GSU0_GSUAMB_GSUC0_GSUWGMRR0_GLS0_ISA942_IU1_K1_LBSPPA512_LBSPPB256_LBSPPM0_LPA32_LPB16_LPM0_LRVW8_LWPMn1_MIAV0_MIWT2_1_MO40_NTn1_NTA0_NTB0_NTC0_NTD0_NTM0_NEPBS0_NLCA1_NLCB1_ONLL1_PGR2_PLR0_PKA1_SIA3_SS1_SU0_SUM0_SUS64_SPO0_SRVW0_SSO0_SVW2_SK3_SKXCCM8_TLDS0_ULSGRO0_USL1_UIOFGRO0_USFGRO0_VSn1_VWA2_VWB1_WSGRA0_WSGRB0_WS64_WG32_8_1_WGM1_WGMXCC1_WGMXCCGn1
    SolutionIndex: 116
    SolutionNameMin: Cijk_Ailk_Bjlk_I8II_BH_UserArgs_MT64x32x64_MI16x16x1_SN_LDSB0_AFC0_AFEM1_AFEM1_ASEM1_CLR1_CADS0_DTVA0_DTVB0_EPS0_FDSI0_GRPM1_GRVWA8_GRVWB8_GSU0_GSUAMB_GSUC0_GSUWGMRR0_GLS0_ISA942_IU1_K1_LBSPPA512_LBSPPB256_LBSPPM0_LPA16_LPB16_LPM0_LRVW8_LWPMn1_MIAV0_MIWT2_1_MO40_NTn1_NTA0_NTB0_NTC0_NTD0_NTM0_NEPBS0_NLCA1_NLCB1_ONLL1_PGR2_PLR1_PKA1_SIA3_SS1_SU0_SUM0_SUS64_SPO0_SRVW0_SSO0_SVW1_SK3_SKXCCM8_TLDS0_ULSGRO0_USL1_UIOFGRO0_USFGRO0_VSn1_VWA1_VWB1_WSGRA0_WSGRB0_WS64_WG32_8_1_WGM4_WGMXCC1_WGMXCCGn1
    SolutionIndex: 117
    SolutionNameMin: Cijk_Ailk_Bjlk_I8II_BH_UserArgs_MT64x32x64_MI16x16x1_SN_LDSB0_AFC0_AFEM1_AFEM1_ASEM1_CLR1_CADS0_DTVA0_DTVB0_EPS0_FDSI0_GRPM1_GRVWA4_GRVWB4_GSU0_GSUAMB_GSUC0_GSUWGMRR0_GLS0_ISA942_IU1_K1_LBSPPA512_LBSPPB256_LBSPPM0_LPA32_LPB16_LPM0_LRVW8_LWPMn1_MIAV0_MIWT2_1_MO40_NTn1_NTA0_NTB0_NTC0_NTD0_NTM0_NEPBS0_NLCA1_NLCB1_ONLL1_PGR2_PLR1_PKA1_SIA3_SS1_SU0_SUM0_SUS64_SPO0_SRVW0_SSO0_SVW2_SK3_SKXCCM8_TLDS0_ULSGRO0_USL1_UIOFGRO0_USFGRO0_VSn1_VWA2_VWB1_WSGRA0_WSGRB0_WS64_WG32_8_1_WGM8_WGMXCC1_WGMXCCGn1
    SolutionIndex: 118
    SolutionNameMin: Cijk_Ailk_Bjlk_I8II_BH_UserArgs_MT64x32x64_MI16x16x1_SN_LDSB0_AFC0_AFEM1_AFEM1_ASEM1_CLR1_CADS0_DTVA0_DTVB0_EPS0_FDSI0_GRPM1_GRVWA4_GRVWB8_GSU0_GSUAMB_GSUC0_GSUWGMRR0_GLS0_ISA942_IU1_K1_LBSPPA512_LBSPPB256_LBSPPM0_LPA32_LPB16_LPM0_LRVW8_LWPMn1_MIAV0_MIWT2_1_MO40_NTn1_NTA0_NTB0_NTC0_NTD0_NTM0_NEPBS0_NLCA1_NLCB1_ONLL1_PGR2_PLR1_PKA1_SIA3_SS1_SU0_SUM0_SUS64_SPO0_SRVW0_SSO0_SVW2_SK3_SKXCCM8_TLDS0_ULSGRO0_USL1_UIOFGRO0_USFGRO0_VSn1_VWA2_VWB1_WSGRA0_WSGRB0_WS64_WG32_8_1_WGM8_WGMXCC1_WGMXCCGn1
    SolutionIndex: 119
    SolutionNameMin: Cijk_Ailk_Bjlk_I8II_BH_UserArgs_MT32x32x64_MI16x16x1_SN_LDSB0_AFC0_AFEM1_AFEM1_ASEM1_CLR1_CADS0_DTVA0_DTVB0_EPS0_FDSI0_GRPM1_GRVWA2_GRVWB2_GSU0_GSUAMB_GSUC0_GSUWGMRR0_GLS0_ISA942_IU1_K1_LBSPPA256_LBSPPB256_LBSPPM0_LPA16_LPB16_LPM0_LRVW8_LWPMn1_MIAV0_MIWT1_1_MO40_NTn1_NTA0_NTB0_NTC0_NTD0_NTM0_NEPBS0_NLCA1_NLCB1_ONLL1_PGR2_PLR1_PKA1_SIA3_SS1_SU0_SUM0_SUS64_SPO0_SRVW0_SSO0_SVW1_SK3_SKXCCM8_TLDS0_ULSGRO0_USL1_UIOFGRO0_USFGRO0_VSn1_VWA1_VWB1_WSGRA0_WSGRB0_WS64_WG32_8_1_WGM1_WGMXCC1_WGMXCCGn1
    SolutionIndex: 120
    SolutionNameMin: Cijk_Ailk_Bjlk_I8II_BH_UserArgs_MT32x32x64_MI16x16x1_SN_LDSB0_AFC0_AFEM1_AFEM1_ASEM1_CLR0_CADS0_DTVA0_DTVB0_EPS0_FDSI0_GRPM1_GRVWA8_GRVWB2_GSU0_GSUAMB_GSUC0_GSUWGMRR0_GLS0_ISA942_IU1_K1_LBSPPA256_LBSPPB256_LBSPPM0_LPA16_LPB16_LPM0_LRVW8_LWPMn1_MIAV0_MIWT1_1_MO40_NTn1_NTA0_NTB0_NTC0_NTD0_NTM0_NEPBS0_NLCA1_NLCB1_ONLL1_PGR2_PLR0_PKA1_SIA3_SS1_SU0_SUM0_SUS64_SPO0_SRVW0_SSO0_SVW1_SK3_SKXCCM8_TLDS0_ULSGRO0_USL1_UIOFGRO0_USFGRO0_VSn1_VWA1_VWB1_WSGRA0_WSGRB0_WS64_WG32_8_1_WGM1_WGMXCC1_WGMXCCGn1
    SolutionIndex: 121
    SolutionNameMin: Cijk_Ailk_Bjlk_I8II_BH_UserArgs_MT32x32x64_MI16x16x1_SN_LDSB0_AFC0_AFEM1_AFEM1_ASEM1_CLR1_CADS0_DTVA0_DTVB0_EPS0_FDSI0_GRPM1_GRVWA2_GRVWB8_GSU0_GSUAMB_GSUC0_GSUWGMRR0_GLS0_ISA942_IU1_K1_LBSPPA256_LBSPPB256_LBSPPM0_LPA16_LPB16_LPM0_LRVW8_LWPMn1_MIAV0_MIWT1_1_MO40_NTn1_NTA0_NTB0_NTC0_NTD0_NTM0_NEPBS0_NLCA1_NLCB1_ONLL1_PGR2_PLR1_PKA1_SIA3_SS1_SU0_SUM0_SUS64_SPO0_SRVW0_SSO0_SVW1_SK3_SKXCCM8_TLDS0_ULSGRO0_USL1_UIOFGRO0_USFGRO0_VSn1_VWA1_VWB1_WSGRA0_WSGRB0_WS64_WG32_8_1_WGM4_WGMXCC1_WGMXCCGn1
    SolutionIndex: 122
    SolutionNameMin: Cijk_Ailk_Bjlk_I8II_BH_UserArgs_MT32x32x64_MI16x16x1_SN_LDSB0_AFC0_AFEM1_AFEM1_ASEM1_CLR0_CADS0_DTVA0_DTVB0_EPS0_FDSI0_GRPM1_GRVWA4_GRVWB8_GSU0_GSUAMB_GSUC0_GSUWGMRR0_GLS0_ISA942_IU1_K1_LBSPPA256_LBSPPB256_LBSPPM0_LPA16_LPB16_LPM0_LRVW8_LWPMn1_MIAV0_MIWT1_1_MO40_NTn1_NTA0_NTB0_NTC0_NTD0_NTM0_NEPBS0_NLCA1_NLCB1_ONLL1_PGR2_PLR0_PKA1_SIA3_SS1_SU0_SUM0_SUS64_SPO0_SRVW0_SSO0_SVW1_SK3_SKXCCM8_TLDS0_ULSGRO0_USL1_UIOFGRO0_USFGRO0_VSn1_VWA1_VWB1_WSGRA0_WSGRB0_WS64_WG32_8_1_WGM4_WGMXCC1_WGMXCCGn1
    SolutionIndex: 123
    SolutionNameMin: Cijk_Ailk_Bjlk_I8II_BH_UserArgs_MT128x256x128_MI16x16x1_SN_LDSB1_AFC0_AFEM1_AFEM1_ASEM1_CLR1_CADS0_DTVA0_DTVB0_EPS0_FDSI0_GRPM1_GRVWA4_GRVWB8_GSU0_GSUAMB_GSUC0_GSUWGMRR0_GLS0_ISA942_IU1_K1_LBSPPA1024_LBSPPB2048_LBSPPM0_LPA64_LPB0_LPM0_LRVW8_LWPMn1_MIAV0_MIWT4_8_MO40_NTn1_NTA0_NTB0_NTC0_NTD0_NTM0_NEPBS0_NLCA1_NLCB1_ONLL1_PGR2_PLR1_PKA1_SIA3_SS1_SU0_SUM0_SUS128_SPO0_SRVW0_SSO0_SVW4_SK3_SKXCCM8_TLDS0_ULSGRO0_USL1_UIOFGRO0_USFGRO0_VSn1_VWA4_VWB8_WSGRA0_WSGRB0_WS64_WG32_8_1_WGM1_WGMXCC1_WGMXCCGn1
    SolutionIndex: 124
    SolutionNameMin: Cijk_Ailk_Bjlk_I8II_BH_UserArgs_MT128x256x128_MI16x16x1_SN_LDSB1_AFC0_AFEM1_AFEM1_ASEM1_CLR1_CADS0_DTVA0_DTVB0_EPS0_FDSI0_GRPM1_GRVWA8_GRVWB8_GSU0_GSUAMB_GSUC0_GSUWGMRR0_GLS0_ISA942_IU1_K1_LBSPPA1024_LBSPPB2048_LBSPPM0_LPA64_LPB0_LPM0_LRVW8_LWPMn1_MIAV0_MIWT4_8_MO40_NTn1_NTA0_NTB0_NTC0_NTD0_NTM0_NEPBS0_NLCA1_NLCB1_ONLL1_PGR2_PLR1_PKA1_SIA3_SS1_SU0_SUM0_SUS128_SPO0_SRVW0_SSO0_SVW4_SK3_SKXCCM8_TLDS0_ULSGRO0_USL1_UIOFGRO0_USFGRO0_VSn1_VWA4_VWB8_WSGRA0_WSGRB0_WS64_WG32_8_1_WGM1_WGMXCC1_WGMXCCGn1
    SolutionIndex: 125
    SolutionNameMin: Cijk_Ailk_Bjlk_I8II_BH_UserArgs_MT128x256x128_MI16x16x1_SN_LDSB1_AFC0_AFEM1_AFEM1_ASEM1_CLR1_CADS0_DTVA0_DTVB0_EPS0_FDSI0_GRPM1_GRVWA8_GRVWB8_GSU0_GSUAMB_GSUC0_GSUWGMRR0_GLS0_ISA942_IU1_K1_LBSPPA1024_LBSPPB2048_LBSPPM0_LPA64_LPB0_LPM0_LRVW8_LWPMn1_MIAV0_MIWT4_8_MO40_NTn1_NTA0_NTB0_NTC0_NTD0_NTM0_NEPBS0_NLCA1_NLCB1_ONLL1_PGR2_PLR1_PKA1_SIA3_SS1_SU0_SUM0_SUS128_SPO0_SRVW0_SSO0_SVW4_SK3_SKXCCM8_TLDS0_ULSGRO0_USL1_UIOFGRO0_USFGRO0_VSn1_VWA4_VWB8_WSGRA0_WSGRB0_WS64_WG32_8_1_WGM8_WGMXCC1_WGMXCCGn1
    SolutionIndex: 126
    SolutionNameMin: Cijk_Ailk_Bjlk_I8II_BH_UserArgs_MT128x128x128_MI16x16x1_SN_LDSB1_AFC0_AFEM1_AFEM1_ASEM1_CLR1_CADS0_DTVA0_DTVB0_EPS0_FDSI0_GRPM1_GRVWA4_GRVWB4_GSU0_GSUAMB_GSUC0_GSUWGMRR0_GLS0_ISA942_IU1_K1_LBSPPA1024_LBSPPB1024_LBSPPM0_LPA64_LPB64_LPM0_LRVW8_LWPMn1_MIAV0_MIWT4_4_MO40_NTn1_NTA0_NTB0_NTC0_NTD0_NTM0_NEPBS0_NLCA1_NLCB1_ONLL1_PGR2_PLR2_PKA1_SIA3_SS1_SU0_SUM0_SUS128_SPO0_SRVW0_SSO0_SVW4_SK3_SKXCCM8_TLDS0_ULSGRO0_USL1_UIOFGRO0_USFGRO0_VSn1_VWA4_VWB4_WSGRA0_WSGRB0_WS64_WG32_8_1_WGM1_WGMXCC1_WGMXCCGn1
    SolutionIndex: 127
    SolutionNameMin: Cijk_Ailk_Bjlk_I8II_BH_UserArgs_MT128x128x128_MI16x16x1_SN_LDSB1_AFC0_AFEM1_AFEM1_ASEM1_CLR1_CADS0_DTVA0_DTVB0_EPS0_FDSI0_GRPM1_GRVWA4_GRVWB8_GSU0_GSUAMB_GSUC0_GSUWGMRR0_GLS0_ISA942_IU1_K1_LBSPPA1024_LBSPPB1024_LBSPPM0_LPA64_LPB64_LPM0_LRVW8_LWPMn1_MIAV0_MIWT4_4_MO40_NTn1_NTA0_NTB0_NTC0_NTD0_NTM0_NEPBS0_NLCA1_NLCB1_ONLL1_PGR2_PLR2_PKA1_SIA3_SS1_SU0_SUM0_SUS128_SPO0_SRVW0_SSO0_SVW4_SK3_SKXCCM8_TLDS0_ULSGRO0_USL1_UIOFGRO0_USFGRO0_VSn1_VWA4_VWB4_WSGRA0_WSGRB0_WS64_WG32_8_1_WGM1_WGMXCC1_WGMXCCGn1
    SolutionIndex: 128
    SolutionNameMin: Cijk_Ailk_Bjlk_I8II_BH_UserArgs_MT128x128x128_MI16x16x1_SN_LDSB1_AFC0_AFEM1_AFEM1_ASEM1_CLR1_CADS0_DTVA0_DTVB0_EPS0_FDSI0_GRPM1_GRVWA4_GRVWB4_GSU0_GSUAMB_GSUC0_GSUWGMRR0_GLS0_ISA942_IU1_K1_LBSPPA1024_LBSPPB1024_LBSPPM0_LPA64_LPB64_LPM0_LRVW8_LWPMn1_MIAV0_MIWT4_4_MO40_NTn1_NTA0_NTB0_NTC0_NTD0_NTM0_NEPBS0_NLCA1_NLCB1_ONLL1_PGR2_PLR2_PKA1_SIA3_SS1_SU0_SUM0_SUS128_SPO0_SRVW0_SSO0_SVW4_SK3_SKXCCM8_TLDS0_ULSGRO0_USL1_UIOFGRO0_USFGRO0_VSn1_VWA4_VWB4_WSGRA0_WSGRB0_WS64_WG32_8_1_WGM4_WGMXCC1_WGMXCCGn1
    SolutionIndex: 129
    SolutionNameMin: Cijk_Ailk_Bjlk_I8II_BH_UserArgs_MT128x128x128_MI16x16x1_SN_LDSB1_AFC0_AFEM1_AFEM1_ASEM1_CLR1_CADS0_DTVA0_DTVB0_EPS0_FDSI0_GRPM1_GRVWA4_GRVWB4_GSU0_GSUAMB_GSUC0_GSUWGMRR0_GLS0_ISA942_IU1_K1_LBSPPA1024_LBSPPB1024_LBSPPM0_LPA64_LPB32_LPM0_LRVW8_LWPMn1_MIAV0_MIWT4_4_MO40_NTn1_NTA0_NTB0_NTC0_NTD0_NTM0_NEPBS0_NLCA1_NLCB1_ONLL1_PGR2_PLR1_PKA1_SIA3_SS1_SU0_SUM0_SUS128_SPO0_SRVW0_SSO0_SVW4_SK3_SKXCCM8_TLDS0_ULSGRO0_USL1_UIOFGRO0_USFGRO0_VSn1_VWA4_VWB2_WSGRA0_WSGRB0_WS64_WG32_8_1_WGM8_WGMXCC1_WGMXCCGn1
    SolutionIndex: 130
    SolutionNameMin: Cijk_Ailk_Bjlk_I8II_BH_UserArgs_MT128x128x128_MI16x16x1_SN_LDSB1_AFC0_AFEM1_AFEM1_ASEM1_CLR1_CADS0_DTVA0_DTVB0_EPS0_FDSI0_GRPM1_GRVWA4_GRVWB4_GSU0_GSUAMB_GSUC0_GSUWGMRR0_GLS0_ISA942_IU1_K1_LBSPPA1024_LBSPPB1024_LBSPPM0_LPA64_LPB64_LPM0_LRVW8_LWPMn1_MIAV0_MIWT4_4_MO40_NTn1_NTA0_NTB0_NTC0_NTD0_NTM0_NEPBS0_NLCA1_NLCB1_ONLL1_PGR2_PLR1_PKA1_SIA3_SS1_SU0_SUM0_SUS128_SPO0_SRVW0_SSO0_SVW4_SK3_SKXCCM8_TLDS0_ULSGRO0_USL1_UIOFGRO0_USFGRO0_VSn1_VWA4_VWB4_WSGRA0_WSGRB0_WS64_WG32_8_1_WGM8_WGMXCC1_WGMXCCGn1
    SolutionIndex: 131
    SolutionNameMin: Cijk_Ailk_Bjlk_I8II_BH_UserArgs_MT128x128x128_MI16x16x1_SN_LDSB1_AFC0_AFEM1_AFEM1_ASEM1_CLR1_CADS0_DTVA0_DTVB0_EPS0_FDSI0_GRPM1_GRVWA4_GRVWB4_GSU0_GSUAMB_GSUC0_GSUWGMRR0_GLS0_ISA942_IU1_K1_LBSPPA1024_LBSPPB1024_LBSPPM0_LPA64_LPB64_LPM0_LRVW8_LWPMn1_MIAV0_MIWT4_4_MO40_NTn1_NTA0_NTB0_NTC0_NTD0_NTM0_NEPBS0_NLCA1_NLCB1_ONLL1_PGR2_PLR2_PKA1_SIA3_SS1_SU0_SUM0_SUS128_SPO0_SRVW0_SSO0_SVW4_SK3_SKXCCM8_TLDS0_ULSGRO0_USL1_UIOFGRO0_USFGRO0_VSn1_VWA4_VWB4_WSGRA0_WSGRB0_WS64_WG32_8_1_WGM8_WGMXCC1_WGMXCCGn1
    SolutionIndex: 132
    SolutionNameMin: Cijk_Ailk_Bjlk_I8II_BH_UserArgs_MT64x128x128_MI16x16x1_SN_LDSB1_AFC0_AFEM1_AFEM1_ASEM1_CLR1_CADS0_DTVA0_DTVB0_EPS0_FDSI0_GRPM1_GRVWA4_GRVWB4_GSU0_GSUAMB_GSUC0_GSUWGMRR0_GLS0_ISA942_IU1_K1_LBSPPA512_LBSPPB1024_LBSPPM0_LPA32_LPB64_LPM0_LRVW8_LWPMn1_MIAV0_MIWT2_4_MO40_NTn1_NTA0_NTB0_NTC0_NTD0_NTM0_NEPBS0_NLCA1_NLCB1_ONLL1_PGR2_PLR1_PKA1_SIA3_SS1_SU0_SUM0_SUS128_SPO0_SRVW0_SSO0_SVW2_SK3_SKXCCM8_TLDS0_ULSGRO0_USL1_UIOFGRO0_USFGRO0_VSn1_VWA2_VWB4_WSGRA0_WSGRB0_WS64_WG32_8_1_WGM1_WGMXCC1_WGMXCCGn1
    SolutionIndex: 133
    SolutionNameMin: Cijk_Ailk_Bjlk_I8II_BH_UserArgs_MT64x128x128_MI16x16x1_SN_LDSB1_AFC0_AFEM1_AFEM1_ASEM1_CLR1_CADS0_DTVA0_DTVB0_EPS0_FDSI0_GRPM1_GRVWA4_GRVWB4_GSU0_GSUAMB_GSUC0_GSUWGMRR0_GLS0_ISA942_IU1_K1_LBSPPA512_LBSPPB1024_LBSPPM0_LPA32_LPB64_LPM0_LRVW8_LWPMn1_MIAV0_MIWT2_4_MO40_NTn1_NTA0_NTB0_NTC0_NTD0_NTM0_NEPBS0_NLCA1_NLCB1_ONLL1_PGR2_PLR2_PKA1_SIA3_SS1_SU0_SUM0_SUS128_SPO0_SRVW0_SSO0_SVW2_SK3_SKXCCM8_TLDS0_ULSGRO0_USL1_UIOFGRO0_USFGRO0_VSn1_VWA2_VWB4_WSGRA0_WSGRB0_WS64_WG32_8_1_WGM1_WGMXCC1_WGMXCCGn1
    SolutionIndex: 134
    SolutionNameMin: Cijk_Ailk_Bjlk_I8II_BH_UserArgs_MT128x64x128_MI16x16x1_SN_LDSB1_AFC0_AFEM1_AFEM1_ASEM1_CLR1_CADS0_DTVA0_DTVB0_EPS0_FDSI0_GRPM1_GRVWA4_GRVWB4_GSU0_GSUAMB_GSUC0_GSUWGMRR0_GLS0_ISA942_IU1_K1_LBSPPA1024_LBSPPB512_LBSPPM0_LPA64_LPB32_LPM0_LRVW8_LWPMn1_MIAV0_MIWT4_2_MO40_NTn1_NTA0_NTB0_NTC0_NTD0_NTM0_NEPBS0_NLCA1_NLCB1_ONLL1_PGR2_PLR1_PKA1_SIA3_SS1_SU0_SUM0_SUS128_SPO0_SRVW0_SSO0_SVW4_SK3_SKXCCM8_TLDS0_ULSGRO0_USL1_UIOFGRO0_USFGRO0_VSn1_VWA4_VWB2_WSGRA0_WSGRB0_WS64_WG32_8_1_WGM1_WGMXCC1_WGMXCCGn1
    SolutionIndex: 135
    SolutionNameMin: Cijk_Ailk_Bjlk_I8II_BH_UserArgs_MT128x64x128_MI16x16x1_SN_LDSB1_AFC0_AFEM1_AFEM1_ASEM1_CLR1_CADS0_DTVA0_DTVB0_EPS0_FDSI0_GRPM1_GRVWA4_GRVWB4_GSU0_GSUAMB_GSUC0_GSUWGMRR0_GLS0_ISA942_IU1_K1_LBSPPA1024_LBSPPB512_LBSPPM0_LPA64_LPB32_LPM0_LRVW8_LWPMn1_MIAV0_MIWT4_2_MO40_NTn1_NTA0_NTB0_NTC0_NTD0_NTM0_NEPBS0_NLCA1_NLCB1_ONLL1_PGR2_PLR2_PKA1_SIA3_SS1_SU0_SUM0_SUS128_SPO0_SRVW0_SSO0_SVW4_SK3_SKXCCM8_TLDS0_ULSGRO0_USL1_UIOFGRO0_USFGRO0_VSn1_VWA4_VWB2_WSGRA0_WSGRB0_WS64_WG32_8_1_WGM1_WGMXCC1_WGMXCCGn1
    SolutionIndex: 136
    SolutionNameMin: Cijk_Ailk_Bjlk_I8II_BH_UserArgs_MT128x64x128_MI16x16x1_SN_LDSB1_AFC0_AFEM1_AFEM1_ASEM1_CLR1_CADS0_DTVA0_DTVB0_EPS0_FDSI0_GRPM1_GRVWA4_GRVWB8_GSU0_GSUAMB_GSUC0_GSUWGMRR0_GLS0_ISA942_IU1_K1_LBSPPA1024_LBSPPB512_LBSPPM0_LPA64_LPB32_LPM0_LRVW8_LWPMn1_MIAV0_MIWT4_2_MO40_NTn1_NTA0_NTB0_NTC0_NTD0_NTM0_NEPBS0_NLCA1_NLCB1_ONLL1_PGR2_PLR2_PKA1_SIA3_SS1_SU0_SUM0_SUS128_SPO0_SRVW0_SSO0_SVW4_SK3_SKXCCM8_TLDS0_ULSGRO0_USL1_UIOFGRO0_USFGRO0_VSn1_VWA4_VWB2_WSGRA0_WSGRB0_WS64_WG32_8_1_WGM1_WGMXCC1_WGMXCCGn1
    SolutionIndex: 137
    SolutionNameMin: Cijk_Ailk_Bjlk_I8II_BH_UserArgs_MT128x64x128_MI16x16x1_SN_LDSB1_AFC0_AFEM1_AFEM1_ASEM1_CLR1_CADS0_DTVA0_DTVB0_EPS0_FDSI0_GRPM1_GRVWA4_GRVWB4_GSU0_GSUAMB_GSUC0_GSUWGMRR0_GLS0_ISA942_IU1_K1_LBSPPA1024_LBSPPB512_LBSPPM0_LPA64_LPB32_LPM0_LRVW8_LWPMn1_MIAV0_MIWT4_2_MO40_NTn1_NTA0_NTB0_NTC0_NTD0_NTM0_NEPBS0_NLCA1_NLCB1_ONLL1_PGR2_PLR1_PKA1_SIA3_SS1_SU0_SUM0_SUS128_SPO0_SRVW0_SSO0_SVW4_SK3_SKXCCM8_TLDS0_ULSGRO0_USL1_UIOFGRO0_USFGRO0_VSn1_VWA4_VWB2_WSGRA0_WSGRB0_WS64_WG32_8_1_WGM4_WGMXCC1_WGMXCCGn1
    SolutionIndex: 138
    SolutionNameMin: Cijk_Ailk_Bjlk_I8II_BH_UserArgs_MT128x64x128_MI16x16x1_SN_LDSB1_AFC0_AFEM1_AFEM1_ASEM1_CLR1_CADS0_DTVA0_DTVB0_EPS0_FDSI0_GRPM1_GRVWA4_GRVWB8_GSU0_GSUAMB_GSUC0_GSUWGMRR0_GLS0_ISA942_IU1_K1_LBSPPA1024_LBSPPB512_LBSPPM0_LPA64_LPB32_LPM0_LRVW8_LWPMn1_MIAV0_MIWT4_2_MO40_NTn1_NTA0_NTB0_NTC0_NTD0_NTM0_NEPBS0_NLCA1_NLCB1_ONLL1_PGR2_PLR2_PKA1_SIA3_SS1_SU0_SUM0_SUS128_SPO0_SRVW0_SSO0_SVW4_SK3_SKXCCM8_TLDS0_ULSGRO0_USL1_UIOFGRO0_USFGRO0_VSn1_VWA4_VWB2_WSGRA0_WSGRB0_WS64_WG32_8_1_WGM4_WGMXCC1_WGMXCCGn1
    SolutionIndex: 139
    SolutionNameMin: Cijk_Ailk_Bjlk_I8II_BH_UserArgs_MT128x64x128_MI16x16x1_SN_LDSB1_AFC0_AFEM1_AFEM1_ASEM1_CLR1_CADS0_DTVA0_DTVB0_EPS0_FDSI0_GRPM1_GRVWA8_GRVWB8_GSU0_GSUAMB_GSUC0_GSUWGMRR0_GLS0_ISA942_IU1_K1_LBSPPA1024_LBSPPB512_LBSPPM0_LPA64_LPB32_LPM0_LRVW8_LWPMn1_MIAV0_MIWT4_2_MO40_NTn1_NTA0_NTB0_NTC0_NTD0_NTM0_NEPBS0_NLCA1_NLCB1_ONLL1_PGR2_PLR1_PKA1_SIA3_SS1_SU0_SUM0_SUS128_SPO0_SRVW0_SSO0_SVW4_SK3_SKXCCM8_TLDS0_ULSGRO0_USL1_UIOFGRO0_USFGRO0_VSn1_VWA4_VWB2_WSGRA0_WSGRB0_WS64_WG32_8_1_WGM8_WGMXCC1_WGMXCCGn1
    SolutionIndex: 140
    SolutionNameMin: Cijk_Ailk_Bjlk_I8II_BH_UserArgs_MT128x64x128_MI16x16x1_SN_LDSB1_AFC0_AFEM1_AFEM1_ASEM1_CLR1_CADS0_DTVA0_DTVB0_EPS0_FDSI0_GRPM1_GRVWA4_GRVWB8_GSU0_GSUAMB_GSUC0_GSUWGMRR0_GLS0_ISA942_IU1_K1_LBSPPA1024_LBSPPB512_LBSPPM0_LPA64_LPB32_LPM0_LRVW8_LWPMn1_MIAV0_MIWT4_2_MO40_NTn1_NTA0_NTB0_NTC0_NTD0_NTM0_NEPBS0_NLCA1_NLCB1_ONLL1_PGR2_PLR2_PKA1_SIA3_SS1_SU0_SUM0_SUS128_SPO0_SRVW0_SSO0_SVW4_SK3_SKXCCM8_TLDS0_ULSGRO0_USL1_UIOFGRO0_USFGRO0_VSn1_VWA4_VWB2_WSGRA0_WSGRB0_WS64_WG32_8_1_WGM8_WGMXCC1_WGMXCCGn1
    SolutionIndex: 141
    SolutionNameMin: Cijk_Ailk_Bjlk_I8II_BH_UserArgs_MT128x32x128_MI16x16x1_SN_LDSB1_AFC0_AFEM1_AFEM1_ASEM1_CLR1_CADS0_DTVA0_DTVB0_EPS0_FDSI0_GRPM1_GRVWA4_GRVWB4_GSU0_GSUAMB_GSUC0_GSUWGMRR0_GLS0_ISA942_IU1_K1_LBSPPA1024_LBSPPB256_LBSPPM0_LPA64_LPB16_LPM0_LRVW8_LWPMn1_MIAV0_MIWT4_1_MO40_NTn1_NTA0_NTB0_NTC0_NTD0_NTM0_NEPBS0_NLCA1_NLCB1_ONLL1_PGR2_PLR2_PKA1_SIA3_SS1_SU0_SUM0_SUS128_SPO0_SRVW0_SSO0_SVW4_SK3_SKXCCM8_TLDS0_ULSGRO0_USL1_UIOFGRO0_USFGRO0_VSn1_VWA4_VWB1_WSGRA0_WSGRB0_WS64_WG32_8_1_WGM1_WGMXCC1_WGMXCCGn1
    SolutionIndex: 142
    SolutionNameMin: Cijk_Ailk_Bjlk_I8II_BH_UserArgs_MT64x64x128_MI16x16x1_SN_LDSB1_AFC0_AFEM1_AFEM1_ASEM1_CLR1_CADS0_DTVA0_DTVB0_EPS0_FDSI0_GRPM1_GRVWA4_GRVWB4_GSU0_GSUAMB_GSUC0_GSUWGMRR0_GLS0_ISA942_IU1_K1_LBSPPA512_LBSPPB512_LBSPPM0_LPA32_LPB32_LPM0_LRVW8_LWPMn1_MIAV0_MIWT2_2_MO40_NTn1_NTA0_NTB0_NTC0_NTD0_NTM0_NEPBS0_NLCA1_NLCB1_ONLL1_PGR2_PLR1_PKA1_SIA3_SS1_SU0_SUM0_SUS128_SPO0_SRVW0_SSO0_SVW2_SK3_SKXCCM8_TLDS0_ULSGRO0_USL1_UIOFGRO0_USFGRO0_VSn1_VWA2_VWB2_WSGRA0_WSGRB0_WS64_WG32_8_1_WGM1_WGMXCC1_WGMXCCGn1
    SolutionIndex: 143
    SolutionNameMin: Cijk_Ailk_Bjlk_I8II_BH_UserArgs_MT64x64x128_MI16x16x1_SN_LDSB1_AFC0_AFEM1_AFEM1_ASEM1_CLR1_CADS0_DTVA0_DTVB0_EPS0_FDSI0_GRPM1_GRVWA4_GRVWB8_GSU0_GSUAMB_GSUC0_GSUWGMRR0_GLS0_ISA942_IU1_K1_LBSPPA512_LBSPPB512_LBSPPM0_LPA32_LPB32_LPM0_LRVW8_LWPMn1_MIAV0_MIWT2_2_MO40_NTn1_NTA0_NTB0_NTC0_NTD0_NTM0_NEPBS0_NLCA1_NLCB1_ONLL1_PGR2_PLR1_PKA1_SIA3_SS1_SU0_SUM0_SUS128_SPO0_SRVW0_SSO0_SVW2_SK3_SKXCCM8_TLDS0_ULSGRO0_USL1_UIOFGRO0_USFGRO0_VSn1_VWA2_VWB2_WSGRA0_WSGRB0_WS64_WG32_8_1_WGM1_WGMXCC1_WGMXCCGn1
    SolutionIndex: 144
    SolutionNameMin: Cijk_Ailk_Bjlk_I8II_BH_UserArgs_MT64x64x128_MI16x16x1_SN_LDSB1_AFC0_AFEM1_AFEM1_ASEM1_CLR1_CADS0_DTVA0_DTVB0_EPS0_FDSI0_GRPM1_GRVWA4_GRVWB8_GSU0_GSUAMB_GSUC0_GSUWGMRR0_GLS0_ISA942_IU1_K1_LBSPPA512_LBSPPB512_LBSPPM0_LPA32_LPB32_LPM0_LRVW8_LWPMn1_MIAV0_MIWT2_2_MO40_NTn1_NTA0_NTB0_NTC0_NTD0_NTM0_NEPBS0_NLCA1_NLCB1_ONLL1_PGR2_PLR2_PKA1_SIA3_SS1_SU0_SUM0_SUS128_SPO0_SRVW0_SSO0_SVW2_SK3_SKXCCM8_TLDS0_ULSGRO0_USL1_UIOFGRO0_USFGRO0_VSn1_VWA2_VWB2_WSGRA0_WSGRB0_WS64_WG32_8_1_WGM1_WGMXCC1_WGMXCCGn1
    SolutionIndex: 145
    SolutionNameMin: Cijk_Ailk_Bjlk_I8II_BH_UserArgs_MT64x64x128_MI16x16x1_SN_LDSB1_AFC0_AFEM1_AFEM1_ASEM1_CLR1_CADS0_DTVA0_DTVB0_EPS0_FDSI0_GRPM1_GRVWA8_GRVWB8_GSU0_GSUAMB_GSUC0_GSUWGMRR0_GLS0_ISA942_IU1_K1_LBSPPA512_LBSPPB512_LBSPPM0_LPA32_LPB32_LPM0_LRVW8_LWPMn1_MIAV0_MIWT2_2_MO40_NTn1_NTA0_NTB0_NTC0_NTD0_NTM0_NEPBS0_NLCA1_NLCB1_ONLL1_PGR2_PLR2_PKA1_SIA3_SS1_SU0_SUM0_SUS128_SPO0_SRVW0_SSO0_SVW2_SK3_SKXCCM8_TLDS0_ULSGRO0_USL1_UIOFGRO0_USFGRO0_VSn1_VWA2_VWB2_WSGRA0_WSGRB0_WS64_WG32_8_1_WGM1_WGMXCC1_WGMXCCGn1
    SolutionIndex: 146
    SolutionNameMin: Cijk_Ailk_Bjlk_I8II_BH_UserArgs_MT64x64x128_MI16x16x1_SN_LDSB1_AFC0_AFEM1_AFEM1_ASEM1_CLR1_CADS0_DTVA0_DTVB0_EPS0_FDSI0_GRPM1_GRVWA4_GRVWB8_GSU0_GSUAMB_GSUC0_GSUWGMRR0_GLS0_ISA942_IU1_K1_LBSPPA512_LBSPPB512_LBSPPM0_LPA32_LPB32_LPM0_LRVW8_LWPMn1_MIAV0_MIWT2_2_MO40_NTn1_NTA0_NTB0_NTC0_NTD0_NTM0_NEPBS0_NLCA1_NLCB1_ONLL1_PGR2_PLR1_PKA1_SIA3_SS1_SU0_SUM0_SUS128_SPO0_SRVW0_SSO0_SVW2_SK3_SKXCCM8_TLDS0_ULSGRO0_USL1_UIOFGRO0_USFGRO0_VSn1_VWA2_VWB2_WSGRA0_WSGRB0_WS64_WG32_8_1_WGM4_WGMXCC1_WGMXCCGn1
    SolutionIndex: 147
    SolutionNameMin: Cijk_Ailk_Bjlk_I8II_BH_UserArgs_MT64x64x128_MI16x16x1_SN_LDSB1_AFC0_AFEM1_AFEM1_ASEM1_CLR1_CADS0_DTVA0_DTVB0_EPS0_FDSI0_GRPM1_GRVWA4_GRVWB8_GSU0_GSUAMB_GSUC0_GSUWGMRR0_GLS0_ISA942_IU1_K1_LBSPPA512_LBSPPB512_LBSPPM0_LPA32_LPB32_LPM0_LRVW8_LWPMn1_MIAV0_MIWT2_2_MO40_NTn1_NTA0_NTB0_NTC0_NTD0_NTM0_NEPBS0_NLCA1_NLCB1_ONLL1_PGR2_PLR2_PKA1_SIA3_SS1_SU0_SUM0_SUS128_SPO0_SRVW0_SSO0_SVW2_SK3_SKXCCM8_TLDS0_ULSGRO0_USL1_UIOFGRO0_USFGRO0_VSn1_VWA2_VWB2_WSGRA0_WSGRB0_WS64_WG32_8_1_WGM4_WGMXCC1_WGMXCCGn1
    SolutionIndex: 148
    SolutionNameMin: Cijk_Ailk_Bjlk_I8II_BH_UserArgs_MT64x64x128_MI16x16x1_SN_LDSB1_AFC0_AFEM1_AFEM1_ASEM1_CLR1_CADS0_DTVA0_DTVB0_EPS0_FDSI0_GRPM1_GRVWA4_GRVWB8_GSU0_GSUAMB_GSUC0_GSUWGMRR0_GLS0_ISA942_IU1_K1_LBSPPA512_LBSPPB512_LBSPPM0_LPA32_LPB32_LPM0_LRVW8_LWPMn1_MIAV0_MIWT2_2_MO40_NTn1_NTA0_NTB0_NTC0_NTD0_NTM0_NEPBS0_NLCA1_NLCB1_ONLL1_PGR2_PLR1_PKA1_SIA3_SS1_SU0_SUM0_SUS128_SPO0_SRVW0_SSO0_SVW2_SK3_SKXCCM8_TLDS0_ULSGRO0_USL1_UIOFGRO0_USFGRO0_VSn1_VWA2_VWB2_WSGRA0_WSGRB0_WS64_WG32_8_1_WGM8_WGMXCC1_WGMXCCGn1
    SolutionIndex: 149
    SolutionNameMin: Cijk_Ailk_Bjlk_I8II_BH_UserArgs_MT64x64x128_MI16x16x1_SN_LDSB1_AFC0_AFEM1_AFEM1_ASEM1_CLR1_CADS0_DTVA0_DTVB0_EPS0_FDSI0_GRPM1_GRVWA4_GRVWB8_GSU0_GSUAMB_GSUC0_GSUWGMRR0_GLS0_ISA942_IU1_K1_LBSPPA512_LBSPPB512_LBSPPM0_LPA32_LPB32_LPM0_LRVW8_LWPMn1_MIAV0_MIWT2_2_MO40_NTn1_NTA0_NTB0_NTC0_NTD0_NTM0_NEPBS0_NLCA1_NLCB1_ONLL1_PGR2_PLR2_PKA1_SIA3_SS1_SU0_SUM0_SUS128_SPO0_SRVW0_SSO0_SVW2_SK3_SKXCCM8_TLDS0_ULSGRO0_USL1_UIOFGRO0_USFGRO0_VSn1_VWA2_VWB2_WSGRA0_WSGRB0_WS64_WG32_8_1_WGM8_WGMXCC1_WGMXCCGn1
    SolutionIndex: 150
    SolutionNameMin: Cijk_Ailk_Bjlk_I8II_BH_UserArgs_MT32x64x128_MI16x16x1_SN_LDSB0_AFC0_AFEM1_AFEM1_ASEM1_CLR1_CADS0_DTVA0_DTVB0_EPS0_FDSI0_GRPM1_GRVWA4_GRVWB4_GSU0_GSUAMB_GSUC0_GSUWGMRR0_GLS0_ISA942_IU1_K1_LBSPPA256_LBSPPB512_LBSPPM0_LPA16_LPB32_LPM0_LRVW8_LWPMn1_MIAV0_MIWT1_2_MO40_NTn1_NTA0_NTB0_NTC0_NTD0_NTM0_NEPBS0_NLCA1_NLCB1_ONLL1_PGR2_PLR2_PKA1_SIA3_SS1_SU0_SUM0_SUS128_SPO0_SRVW0_SSO0_SVW1_SK3_SKXCCM8_TLDS0_ULSGRO0_USL1_UIOFGRO0_USFGRO0_VSn1_VWA1_VWB2_WSGRA0_WSGRB0_WS64_WG32_8_1_WGM4_WGMXCC1_WGMXCCGn1
    SolutionIndex: 151
    SolutionNameMin: Cijk_Ailk_Bjlk_I8II_BH_UserArgs_MT32x64x128_MI16x16x1_SN_LDSB0_AFC0_AFEM1_AFEM1_ASEM1_CLR1_CADS0_DTVA0_DTVB0_EPS0_FDSI0_GRPM1_GRVWA2_GRVWB8_GSU0_GSUAMB_GSUC0_GSUWGMRR0_GLS0_ISA942_IU1_K1_LBSPPA256_LBSPPB512_LBSPPM0_LPA16_LPB32_LPM0_LRVW8_LWPMn1_MIAV0_MIWT1_2_MO40_NTn1_NTA0_NTB0_NTC0_NTD0_NTM0_NEPBS0_NLCA1_NLCB1_ONLL1_PGR2_PLR1_PKA1_SIA3_SS1_SU0_SUM0_SUS128_SPO0_SRVW0_SSO0_SVW1_SK3_SKXCCM8_TLDS0_ULSGRO0_USL1_UIOFGRO0_USFGRO0_VSn1_VWA1_VWB2_WSGRA0_WSGRB0_WS64_WG32_8_1_WGM8_WGMXCC1_WGMXCCGn1
    SolutionIndex: 152
    SolutionNameMin: Cijk_Ailk_Bjlk_I8II_BH_UserArgs_MT32x64x128_MI16x16x1_SN_LDSB0_AFC0_AFEM1_AFEM1_ASEM1_CLR1_CADS0_DTVA0_DTVB0_EPS0_FDSI0_GRPM1_GRVWA4_GRVWB4_GSU0_GSUAMB_GSUC0_GSUWGMRR0_GLS0_ISA942_IU1_K1_LBSPPA256_LBSPPB512_LBSPPM0_LPA16_LPB32_LPM0_LRVW8_LWPMn1_MIAV0_MIWT1_2_MO40_NTn1_NTA0_NTB0_NTC0_NTD0_NTM0_NEPBS0_NLCA1_NLCB1_ONLL1_PGR2_PLR2_PKA1_SIA3_SS1_SU0_SUM0_SUS128_SPO0_SRVW0_SSO0_SVW1_SK3_SKXCCM8_TLDS0_ULSGRO0_USL1_UIOFGRO0_USFGRO0_VSn1_VWA1_VWB2_WSGRA0_WSGRB0_WS64_WG32_8_1_WGM8_WGMXCC1_WGMXCCGn1
    SolutionIndex: 153
    SolutionNameMin: Cijk_Ailk_Bjlk_I8II_BH_UserArgs_MT32x64x128_MI16x16x1_SN_LDSB0_AFC0_AFEM1_AFEM1_ASEM1_CLR1_CADS0_DTVA0_DTVB0_EPS0_FDSI0_GRPM1_GRVWA4_GRVWB8_GSU0_GSUAMB_GSUC0_GSUWGMRR0_GLS0_ISA942_IU1_K1_LBSPPA256_LBSPPB512_LBSPPM0_LPA16_LPB32_LPM0_LRVW8_LWPMn1_MIAV0_MIWT1_2_MO40_NTn1_NTA0_NTB0_NTC0_NTD0_NTM0_NEPBS0_NLCA1_NLCB1_ONLL1_PGR2_PLR2_PKA1_SIA3_SS1_SU0_SUM0_SUS128_SPO0_SRVW0_SSO0_SVW1_SK3_SKXCCM8_TLDS0_ULSGRO0_USL1_UIOFGRO0_USFGRO0_VSn1_VWA1_VWB2_WSGRA0_WSGRB0_WS64_WG32_8_1_WGM8_WGMXCC1_WGMXCCGn1
    SolutionIndex: 154
    SolutionNameMin: Cijk_Ailk_Bjlk_I8II_BH_UserArgs_MT64x32x128_MI16x16x1_SN_LDSB0_AFC0_AFEM1_AFEM1_ASEM1_CLR1_CADS0_DTVA0_DTVB0_EPS0_FDSI0_GRPM1_GRVWA4_GRVWB8_GSU0_GSUAMB_GSUC0_GSUWGMRR0_GLS0_ISA942_IU1_K1_LBSPPA512_LBSPPB256_LBSPPM0_LPA32_LPB16_LPM0_LRVW8_LWPMn1_MIAV0_MIWT2_1_MO40_NTn1_NTA0_NTB0_NTC0_NTD0_NTM0_NEPBS0_NLCA1_NLCB1_ONLL1_PGR2_PLR1_PKA1_SIA3_SS1_SU0_SUM0_SUS128_SPO0_SRVW0_SSO0_SVW2_SK3_SKXCCM8_TLDS0_ULSGRO0_USL1_UIOFGRO0_USFGRO0_VSn1_VWA2_VWB1_WSGRA0_WSGRB0_WS64_WG32_8_1_WGM1_WGMXCC1_WGMXCCGn1
    SolutionIndex: 155
    SolutionNameMin: Cijk_Ailk_Bjlk_I8II_BH_UserArgs_MT64x32x128_MI16x16x1_SN_LDSB0_AFC0_AFEM1_AFEM1_ASEM1_CLR1_CADS0_DTVA0_DTVB0_EPS0_FDSI0_GRPM1_GRVWA8_GRVWB8_GSU0_GSUAMB_GSUC0_GSUWGMRR0_GLS0_ISA942_IU1_K1_LBSPPA512_LBSPPB256_LBSPPM0_LPA32_LPB16_LPM0_LRVW8_LWPMn1_MIAV0_MIWT2_1_MO40_NTn1_NTA0_NTB0_NTC0_NTD0_NTM0_NEPBS0_NLCA1_NLCB1_ONLL1_PGR2_PLR1_PKA1_SIA3_SS1_SU0_SUM0_SUS128_SPO0_SRVW0_SSO0_SVW2_SK3_SKXCCM8_TLDS0_ULSGRO0_USL1_UIOFGRO0_USFGRO0_VSn1_VWA2_VWB1_WSGRA0_WSGRB0_WS64_WG32_8_1_WGM1_WGMXCC1_WGMXCCGn1
    SolutionIndex: 156
    SolutionNameMin: Cijk_Ailk_Bjlk_I8II_BH_UserArgs_MT64x32x128_MI16x16x1_SN_LDSB0_AFC0_AFEM1_AFEM1_ASEM1_CLR1_CADS0_DTVA0_DTVB0_EPS0_FDSI0_GRPM1_GRVWA4_GRVWB8_GSU0_GSUAMB_GSUC0_GSUWGMRR0_GLS0_ISA942_IU1_K1_LBSPPA512_LBSPPB256_LBSPPM0_LPA32_LPB16_LPM0_LRVW8_LWPMn1_MIAV0_MIWT2_1_MO40_NTn1_NTA0_NTB0_NTC0_NTD0_NTM0_NEPBS0_NLCA1_NLCB1_ONLL1_PGR2_PLR2_PKA1_SIA3_SS1_SU0_SUM0_SUS128_SPO0_SRVW0_SSO0_SVW2_SK3_SKXCCM8_TLDS0_ULSGRO0_USL1_UIOFGRO0_USFGRO0_VSn1_VWA2_VWB1_WSGRA0_WSGRB0_WS64_WG32_8_1_WGM1_WGMXCC1_WGMXCCGn1
    SolutionIndex: 157
    SolutionNameMin: Cijk_Ailk_Bjlk_I8II_BH_UserArgs_MT64x32x128_MI16x16x1_SN_LDSB0_AFC0_AFEM1_AFEM1_ASEM1_CLR1_CADS0_DTVA0_DTVB0_EPS0_FDSI0_GRPM1_GRVWA4_GRVWB4_GSU0_GSUAMB_GSUC0_GSUWGMRR0_GLS0_ISA942_IU1_K1_LBSPPA512_LBSPPB256_LBSPPM0_LPA32_LPB16_LPM0_LRVW8_LWPMn1_MIAV0_MIWT2_1_MO40_NTn1_NTA0_NTB0_NTC0_NTD0_NTM0_NEPBS0_NLCA1_NLCB1_ONLL1_PGR2_PLR2_PKA1_SIA3_SS1_SU0_SUM0_SUS128_SPO0_SRVW0_SSO0_SVW2_SK3_SKXCCM8_TLDS0_ULSGRO0_USL1_UIOFGRO0_USFGRO0_VSn1_VWA2_VWB1_WSGRA0_WSGRB0_WS64_WG32_8_1_WGM4_WGMXCC1_WGMXCCGn1
    SolutionIndex: 158
    SolutionNameMin: Cijk_Ailk_Bjlk_I8II_BH_UserArgs_MT64x32x128_MI16x16x1_SN_LDSB0_AFC0_AFEM1_AFEM1_ASEM1_CLR1_CADS0_DTVA0_DTVB0_EPS0_FDSI0_GRPM1_GRVWA4_GRVWB4_GSU0_GSUAMB_GSUC0_GSUWGMRR0_GLS0_ISA942_IU1_K1_LBSPPA512_LBSPPB256_LBSPPM0_LPA32_LPB16_LPM0_LRVW8_LWPMn1_MIAV0_MIWT2_1_MO40_NTn1_NTA0_NTB0_NTC0_NTD0_NTM0_NEPBS0_NLCA1_NLCB1_ONLL1_PGR2_PLR1_PKA1_SIA3_SS1_SU0_SUM0_SUS128_SPO0_SRVW0_SSO0_SVW2_SK3_SKXCCM8_TLDS0_ULSGRO0_USL1_UIOFGRO0_USFGRO0_VSn1_VWA2_VWB1_WSGRA0_WSGRB0_WS64_WG32_8_1_WGM8_WGMXCC1_WGMXCCGn1
    SolutionIndex: 159
    SolutionNameMin: Cijk_Ailk_Bjlk_I8II_BH_UserArgs_MT32x32x128_MI16x16x1_SN_LDSB0_AFC0_AFEM1_AFEM1_ASEM1_CLR1_CADS0_DTVA0_DTVB0_EPS0_FDSI0_GRPM1_GRVWA4_GRVWB8_GSU0_GSUAMB_GSUC0_GSUWGMRR0_GLS0_ISA942_IU1_K1_LBSPPA256_LBSPPB256_LBSPPM0_LPA16_LPB16_LPM0_LRVW8_LWPMn1_MIAV0_MIWT1_1_MO40_NTn1_NTA0_NTB0_NTC0_NTD0_NTM0_NEPBS0_NLCA1_NLCB1_ONLL1_PGR2_PLR1_PKA1_SIA3_SS1_SU0_SUM0_SUS128_SPO0_SRVW0_SSO0_SVW1_SK3_SKXCCM8_TLDS0_ULSGRO0_USL1_UIOFGRO0_USFGRO0_VSn1_VWA1_VWB1_WSGRA0_WSGRB0_WS64_WG32_8_1_WGM1_WGMXCC1_WGMXCCGn1
    SolutionIndex: 160
    SolutionNameMin: Cijk_Ailk_Bjlk_I8II_BH_UserArgs_MT32x32x128_MI16x16x1_SN_LDSB0_AFC0_AFEM1_AFEM1_ASEM1_CLR1_CADS0_DTVA0_DTVB0_EPS0_FDSI0_GRPM1_GRVWA4_GRVWB2_GSU0_GSUAMB_GSUC0_GSUWGMRR0_GLS0_ISA942_IU1_K1_LBSPPA256_LBSPPB256_LBSPPM0_LPA16_LPB16_LPM0_LRVW8_LWPMn1_MIAV0_MIWT1_1_MO40_NTn1_NTA0_NTB0_NTC0_NTD0_NTM0_NEPBS0_NLCA1_NLCB1_ONLL1_PGR2_PLR2_PKA1_SIA3_SS1_SU0_SUM0_SUS128_SPO0_SRVW0_SSO0_SVW1_SK3_SKXCCM8_TLDS0_ULSGRO0_USL1_UIOFGRO0_USFGRO0_VSn1_VWA1_VWB1_WSGRA0_WSGRB0_WS64_WG32_8_1_WGM1_WGMXCC1_WGMXCCGn1
    SolutionIndex: 161
    SolutionNameMin: Cijk_Ailk_Bjlk_I8II_BH_UserArgs_MT32x32x128_MI16x16x1_SN_LDSB0_AFC0_AFEM1_AFEM1_ASEM1_CLR1_CADS0_DTVA0_DTVB0_EPS0_FDSI0_GRPM1_GRVWA4_GRVWB8_GSU0_GSUAMB_GSUC0_GSUWGMRR0_GLS0_ISA942_IU1_K1_LBSPPA256_LBSPPB256_LBSPPM0_LPA16_LPB16_LPM0_LRVW8_LWPMn1_MIAV0_MIWT1_1_MO40_NTn1_NTA0_NTB0_NTC0_NTD0_NTM0_NEPBS0_NLCA1_NLCB1_ONLL1_PGR2_PLR2_PKA1_SIA3_SS1_SU0_SUM0_SUS128_SPO0_SRVW0_SSO0_SVW1_SK3_SKXCCM8_TLDS0_ULSGRO0_USL1_UIOFGRO0_USFGRO0_VSn1_VWA1_VWB1_WSGRA0_WSGRB0_WS64_WG32_8_1_WGM1_WGMXCC1_WGMXCCGn1
    SolutionIndex: 162
    SolutionNameMin: Cijk_Ailk_Bjlk_I8II_BH_UserArgs_MT32x32x128_MI16x16x1_SN_LDSB0_AFC0_AFEM1_AFEM1_ASEM1_CLR1_CADS0_DTVA0_DTVB0_EPS0_FDSI0_GRPM1_GRVWA8_GRVWB8_GSU0_GSUAMB_GSUC0_GSUWGMRR0_GLS0_ISA942_IU1_K1_LBSPPA256_LBSPPB256_LBSPPM0_LPA16_LPB16_LPM0_LRVW8_LWPMn1_MIAV0_MIWT1_1_MO40_NTn1_NTA0_NTB0_NTC0_NTD0_NTM0_NEPBS0_NLCA1_NLCB1_ONLL1_PGR2_PLR2_PKA1_SIA3_SS1_SU0_SUM0_SUS128_SPO0_SRVW0_SSO0_SVW1_SK3_SKXCCM8_TLDS0_ULSGRO0_USL1_UIOFGRO0_USFGRO0_VSn1_VWA1_VWB1_WSGRA0_WSGRB0_WS64_WG32_8_1_WGM1_WGMXCC1_WGMXCCGn1
    SolutionIndex: 163
    SolutionNameMin: Cijk_Ailk_Bjlk_I8II_BH_UserArgs_MT32x32x128_MI16x16x1_SN_LDSB0_AFC0_AFEM1_AFEM1_ASEM1_CLR1_CADS0_DTVA0_DTVB0_EPS0_FDSI0_GRPM1_GRVWA8_GRVWB8_GSU0_GSUAMB_GSUC0_GSUWGMRR0_GLS0_ISA942_IU1_K1_LBSPPA256_LBSPPB256_LBSPPM0_LPA16_LPB16_LPM0_LRVW8_LWPMn1_MIAV0_MIWT1_1_MO40_NTn1_NTA0_NTB0_NTC0_NTD0_NTM0_NEPBS0_NLCA1_NLCB1_ONLL1_PGR2_PLR1_PKA1_SIA3_SS1_SU0_SUM0_SUS128_SPO0_SRVW0_SSO0_SVW1_SK3_SKXCCM8_TLDS0_ULSGRO0_USL1_UIOFGRO0_USFGRO0_VSn1_VWA1_VWB1_WSGRA0_WSGRB0_WS64_WG32_8_1_WGM4_WGMXCC1_WGMXCCGn1
    SolutionIndex: 164
    SolutionNameMin: Cijk_Ailk_Bjlk_I8II_BH_UserArgs_MT32x32x128_MI16x16x1_SN_LDSB0_AFC0_AFEM1_AFEM1_ASEM1_CLR1_CADS0_DTVA0_DTVB0_EPS0_FDSI0_GRPM1_GRVWA2_GRVWB8_GSU0_GSUAMB_GSUC0_GSUWGMRR0_GLS0_ISA942_IU1_K1_LBSPPA256_LBSPPB256_LBSPPM0_LPA16_LPB16_LPM0_LRVW8_LWPMn1_MIAV0_MIWT1_1_MO40_NTn1_NTA0_NTB0_NTC0_NTD0_NTM0_NEPBS0_NLCA1_NLCB1_ONLL1_PGR2_PLR2_PKA1_SIA3_SS1_SU0_SUM0_SUS128_SPO0_SRVW0_SSO0_SVW1_SK3_SKXCCM8_TLDS0_ULSGRO0_USL1_UIOFGRO0_USFGRO0_VSn1_VWA1_VWB1_WSGRA0_WSGRB0_WS64_WG32_8_1_WGM4_WGMXCC1_WGMXCCGn1
    SolutionIndex: 165
    SolutionNameMin: Cijk_Ailk_Bjlk_I8II_BH_UserArgs_MT32x32x128_MI16x16x1_SN_LDSB0_AFC0_AFEM1_AFEM1_ASEM1_CLR1_CADS0_DTVA0_DTVB0_EPS0_FDSI0_GRPM1_GRVWA8_GRVWB8_GSU0_GSUAMB_GSUC0_GSUWGMRR0_GLS0_ISA942_IU1_K1_LBSPPA256_LBSPPB256_LBSPPM0_LPA16_LPB16_LPM0_LRVW8_LWPMn1_MIAV0_MIWT1_1_MO40_NTn1_NTA0_NTB0_NTC0_NTD0_NTM0_NEPBS0_NLCA1_NLCB1_ONLL1_PGR2_PLR2_PKA1_SIA3_SS1_SU0_SUM0_SUS128_SPO0_SRVW0_SSO0_SVW1_SK3_SKXCCM8_TLDS0_ULSGRO0_USL1_UIOFGRO0_USFGRO0_VSn1_VWA1_VWB1_WSGRA0_WSGRB0_WS64_WG32_8_1_WGM4_WGMXCC1_WGMXCCGn1
    SolutionIndex: 166
    SolutionNameMin: Cijk_Ailk_Bjlk_I8II_BH_UserArgs_MT32x32x128_MI16x16x1_SN_LDSB0_AFC0_AFEM1_AFEM1_ASEM1_CLR1_CADS0_DTVA0_DTVB0_EPS0_FDSI0_GRPM1_GRVWA8_GRVWB8_GSU0_GSUAMB_GSUC0_GSUWGMRR0_GLS0_ISA942_IU1_K1_LBSPPA256_LBSPPB256_LBSPPM0_LPA16_LPB16_LPM0_LRVW8_LWPMn1_MIAV0_MIWT1_1_MO40_NTn1_NTA0_NTB0_NTC0_NTD0_NTM0_NEPBS0_NLCA1_NLCB1_ONLL1_PGR2_PLR1_PKA1_SIA3_SS1_SU0_SUM0_SUS128_SPO0_SRVW0_SSO0_SVW1_SK3_SKXCCM8_TLDS0_ULSGRO0_USL1_UIOFGRO0_USFGRO0_VSn1_VWA1_VWB1_WSGRA0_WSGRB0_WS64_WG32_8_1_WGM8_WGMXCC1_WGMXCCGn1
    SolutionIndex: 167
    SolutionNameMin: Cijk_Ailk_Bjlk_I8II_BH_UserArgs_MT64x64x256_MI16x16x1_SN_LDSB1_AFC0_AFEM1_AFEM1_ASEM1_CLR1_CADS0_DTVA0_DTVB0_EPS0_FDSI0_GRPM1_GRVWA4_GRVWB4_GSU0_GSUAMB_GSUC0_GSUWGMRR0_GLS0_ISA942_IU1_K1_LBSPPA512_LBSPPB512_LBSPPM0_LPA32_LPB32_LPM0_LRVW8_LWPMn1_MIAV0_MIWT2_2_MO40_NTn1_NTA0_NTB0_NTC0_NTD0_NTM0_NEPBS0_NLCA1_NLCB1_ONLL1_PGR2_PLR2_PKA1_SIA3_SS1_SU0_SUM0_SUS256_SPO0_SRVW0_SSO0_SVW2_SK3_SKXCCM8_TLDS0_ULSGRO0_USL1_UIOFGRO0_USFGRO0_VSn1_VWA2_VWB2_WSGRA0_WSGRB0_WS64_WG32_8_1_WGM4_WGMXCC1_WGMXCCGn1
    SolutionIndex: 168
    SolutionNameMin: Cijk_Ailk_Bjlk_I8II_BH_UserArgs_MT64x32x256_MI16x16x1_SN_LDSB1_AFC0_AFEM1_AFEM1_ASEM1_CLR1_CADS0_DTVA0_DTVB0_EPS0_FDSI0_GRPM1_GRVWA4_GRVWB8_GSU0_GSUAMB_GSUC0_GSUWGMRR0_GLS0_ISA942_IU1_K1_LBSPPA512_LBSPPB256_LBSPPM0_LPA32_LPB16_LPM0_LRVW8_LWPMn1_MIAV0_MIWT2_1_MO40_NTn1_NTA0_NTB0_NTC0_NTD0_NTM0_NEPBS0_NLCA1_NLCB1_ONLL1_PGR2_PLR2_PKA1_SIA3_SS1_SU0_SUM0_SUS256_SPO0_SRVW0_SSO0_SVW2_SK3_SKXCCM8_TLDS0_ULSGRO0_USL1_UIOFGRO0_USFGRO0_VSn1_VWA2_VWB1_WSGRA0_WSGRB0_WS64_WG32_8_1_WGM1_WGMXCC1_WGMXCCGn1
    SolutionIndex: 169
    SolutionNameMin: Cijk_Ailk_Bjlk_I8II_BH_UserArgs_MT32x32x256_MI16x16x1_SN_LDSB1_AFC0_AFEM1_AFEM1_ASEM1_CLR1_CADS0_DTVA0_DTVB0_EPS0_FDSI0_GRPM1_GRVWA4_GRVWB8_GSU0_GSUAMB_GSUC0_GSUWGMRR0_GLS0_ISA942_IU1_K1_LBSPPA256_LBSPPB256_LBSPPM0_LPA16_LPB16_LPM0_LRVW8_LWPMn1_MIAV0_MIWT1_1_MO40_NTn1_NTA0_NTB0_NTC0_NTD0_NTM0_NEPBS0_NLCA1_NLCB1_ONLL1_PGR2_PLR1_PKA1_SIA3_SS1_SU0_SUM0_SUS256_SPO0_SRVW0_SSO0_SVW1_SK3_SKXCCM8_TLDS0_ULSGRO0_USL1_UIOFGRO0_USFGRO0_VSn1_VWA1_VWB1_WSGRA0_WSGRB0_WS64_WG32_8_1_WGM1_WGMXCC1_WGMXCCGn1
    SolutionIndex: 170
    SolutionNameMin: Cijk_Ailk_Bjlk_I8II_BH_UserArgs_MT32x32x256_MI16x16x1_SN_LDSB1_AFC0_AFEM1_AFEM1_ASEM1_CLR1_CADS0_DTVA0_DTVB0_EPS0_FDSI0_GRPM1_GRVWA4_GRVWB8_GSU0_GSUAMB_GSUC0_GSUWGMRR0_GLS0_ISA942_IU1_K1_LBSPPA256_LBSPPB256_LBSPPM0_LPA16_LPB16_LPM0_LRVW8_LWPMn1_MIAV0_MIWT1_1_MO40_NTn1_NTA0_NTB0_NTC0_NTD0_NTM0_NEPBS0_NLCA1_NLCB1_ONLL1_PGR2_PLR2_PKA1_SIA3_SS1_SU0_SUM0_SUS256_SPO0_SRVW0_SSO0_SVW1_SK3_SKXCCM8_TLDS0_ULSGRO0_USL1_UIOFGRO0_USFGRO0_VSn1_VWA1_VWB1_WSGRA0_WSGRB0_WS64_WG32_8_1_WGM1_WGMXCC1_WGMXCCGn1
    SolutionIndex: 171
    SolutionNameMin: Cijk_Ailk_Bjlk_I8II_BH_UserArgs_MT32x32x256_MI16x16x1_SN_LDSB1_AFC0_AFEM1_AFEM1_ASEM1_CLR1_CADS0_DTVA0_DTVB0_EPS0_FDSI0_GRPM1_GRVWA4_GRVWB8_GSU0_GSUAMB_GSUC0_GSUWGMRR0_GLS0_ISA942_IU1_K1_LBSPPA256_LBSPPB256_LBSPPM0_LPA16_LPB16_LPM0_LRVW8_LWPMn1_MIAV0_MIWT1_1_MO40_NTn1_NTA0_NTB0_NTC0_NTD0_NTM0_NEPBS0_NLCA1_NLCB1_ONLL1_PGR2_PLR1_PKA1_SIA3_SS1_SU0_SUM0_SUS256_SPO0_SRVW0_SSO0_SVW1_SK3_SKXCCM8_TLDS0_ULSGRO0_USL1_UIOFGRO0_USFGRO0_VSn1_VWA1_VWB1_WSGRA0_WSGRB0_WS64_WG32_8_1_WGM4_WGMXCC1_WGMXCCGn1
    SolutionIndex: 172
    SolutionNameMin: Cijk_Ailk_Bjlk_I8II_BH_UserArgs_MT32x32x32_MI16x16x1_SN_LDSB0_AFC0_AFEM1_AFEM1_ASEM1_CLR0_CADS0_DTVA0_DTVB0_EPS0_FDSI0_GRPM1_GRVWA1_GRVWB1_GSU0_GSUAMB_GSUC0_GSUWGMRR0_GLS0_ISA942_IU1_K1_LBSPPA256_LBSPPB256_LBSPPM0_LPA16_LPB16_LPM0_LRVW8_LWPMn1_MIAV0_MIWT1_1_MO40_NTn1_NTA0_NTB0_NTC0_NTD0_NTM0_NEPBS0_NLCA1_NLCB1_ONLL1_PGR2_PLR0_PKA1_SIA3_SS1_SU32_SUM0_SUS256_SPO0_SRVW0_SSO0_SVW1_SK3_SKXCCM8_TLDS0_ULSGRO0_USL1_UIOFGRO0_USFGROn1_VSn1_VWA1_VWB1_WSGRA0_WSGRB0_WS64_WG32_8_1_WGM1_WGMXCC1_WGMXCCGn1
- - - [128, 128, 1, 128, 128, 128, 128, 128]
    - [28, 0.47]
  - - [128, 128, 1, 256, 128, 128, 128, 128]
    - [110, 0.86]
  - - [128, 128, 1, 512, 128, 128, 128, 128]
    - [121, 1.39]
  - - [128, 128, 1, 1024, 128, 128, 128, 128]
    - [160, 2.07]
  - - [128, 128, 1, 2048, 128, 128, 128, 128]
    - [163, 2.91]
  - - [128, 128, 1, 4096, 128, 128, 128, 128]
    - [170, 3.48]
  - - [128, 128, 1, 8192, 128, 128, 128, 128]
    - [169, 3.83]
  - - [128, 256, 1, 128, 128, 128, 128, 256]
    - [122, 0.79]
  - - [128, 256, 1, 256, 128, 128, 128, 256]
    - [119, 1.59]
  - - [128, 256, 1, 512, 128, 128, 128, 256]
    - [119, 3.01]
  - - [128, 256, 1, 1024, 128, 128, 128, 256]
    - [164, 4.37]
  - - [128, 256, 1, 2048, 128, 128, 128, 256]
    - [165, 5.57]
  - - [128, 256, 1, 4096, 128, 128, 128, 256]
    - [171, 6.83]
  - - [128, 256, 1, 8192, 128, 128, 128, 256]
    - [169, 7.59]
  - - [128, 512, 1, 128, 128, 128, 128, 512]
    - [118, 1.67]
  - - [128, 512, 1, 256, 128, 128, 128, 512]
    - [112, 3.12]
  - - [128, 512, 1, 512, 128, 128, 128, 512]
    - [117, 5.11]
  - - [128, 512, 1, 1024, 128, 128, 128, 512]
    - [158, 7.63]
  - - [128, 512, 1, 2048, 128, 128, 128, 512]
    - [150, 10.19]
  - - [128, 512, 1, 4096, 128, 128, 128, 512]
    - [168, 11.79]
  - - [128, 512, 1, 8192, 128, 128, 128, 512]
    - [168, 12.78]
  - - [128, 1024, 1, 128, 128, 128, 128, 1024]
    - [99, 3.25]
  - - [128, 1024, 1, 256, 128, 128, 128, 1024]
    - [109, 5.96]
  - - [128, 1024, 1, 512, 128, 128, 128, 1024]
    - [103, 9.35]
  - - [128, 1024, 1, 1024, 128, 128, 128, 1024]
    - [148, 12.81]
  - - [128, 1024, 1, 2048, 128, 128, 128, 1024]
    - [147, 17.26]
  - - [128, 1024, 1, 4096, 128, 128, 128, 1024]
    - [142, 18.86]
  - - [128, 1024, 1, 8192, 128, 128, 128, 1024]
    - [144, 21.18]
  - - [128, 2048, 1, 128, 128, 128, 128, 2048]
    - [92, 5.71]
  - - [128, 2048, 1, 256, 128, 128, 128, 2048]
    - [94, 9.53]
  - - [128, 2048, 1, 512, 128, 128, 128, 2048]
    - [132, 15.33]
  - - [128, 2048, 1, 1024, 128, 128, 128, 2048]
    - [137, 21.17]
  - - [128, 2048, 1, 2048, 128, 128, 128, 2048]
    - [95, 25.59]
  - - [128, 2048, 1, 4096, 128, 128, 128, 2048]
    - [138, 30.39]
  - - [128, 2048, 1, 8192, 128, 128, 128, 2048]
    - [140, 33.4]
  - - [128, 4096, 1, 128, 128, 128, 128, 4096]
    - [78, 7.68]
  - - [128, 4096, 1, 256, 128, 128, 128, 4096]
    - [78, 13.59]
  - - [128, 4096, 1, 512, 128, 128, 128, 4096]
    - [79, 23.26]
  - - [128, 4096, 1, 1024, 128, 128, 128, 4096]
    - [82, 31.2]
  - - [128, 4096, 1, 2048, 128, 128, 128, 4096]
    - [130, 37.51]
  - - [128, 4096, 1, 4096, 128, 128, 128, 4096]
    - [126, 42.94]
  - - [128, 4096, 1, 8192, 128, 128, 128, 4096]
    - [131, 46.73]
  - - [128, 8192, 1, 128, 128, 128, 128, 8192]
    - [20, 10.14]
  - - [128, 8192, 1, 256, 128, 128, 128, 8192]
    - [16, 17.52]
  - - [128, 8192, 1, 512, 128, 128, 128, 8192]
    - [67, 28.43]
  - - [128, 8192, 1, 1024, 128, 128, 128, 8192]
    - [59, 40.41]
  - - [128, 8192, 1, 2048, 128, 128, 128, 8192]
    - [68, 50.14]
  - - [128, 8192, 1, 4096, 128, 128, 128, 8192]
    - [62, 55.76]
  - - [128, 8192, 1, 8192, 128, 128, 128, 8192]
    - [123, 59.68]
  - - [256, 128, 1, 128, 256, 256, 256, 128]
    - [101, 0.86]
  - - [256, 128, 1, 256, 256, 256, 256, 128]
    - [116, 1.6]
  - - [256, 128, 1, 512, 256, 256, 256, 128]
    - [120, 2.86]
  - - [256, 128, 1, 1024, 256, 256, 256, 128]
    - [161, 4.22]
  - - [256, 128, 1, 2048, 256, 256, 256, 128]
    - [159, 5.91]
  - - [256, 128, 1, 4096, 256, 256, 256, 128]
    - [162, 6.88]
  - - [256, 128, 1, 8192, 256, 256, 256, 128]
    - [166, 7.44]
  - - [256, 256, 1, 128, 256, 256, 256, 256]
    - [114, 1.76]
  - - [256, 256, 1, 256, 256, 256, 256, 256]
    - [115, 3.23]
  - - [256, 256, 1, 512, 256, 256, 256, 256]
    - [154, 5.25]
  - - [256, 256, 1, 1024, 256, 256, 256, 256]
    - [152, 7.87]
  - - [256, 256, 1, 2048, 256, 256, 256, 256]
    - [157, 9.93]
  - - [256, 256, 1, 4096, 256, 256, 256, 256]
    - [153, 11.56]
  - - [256, 256, 1, 8192, 256, 256, 256, 256]
    - [168, 12.63]
  - - [256, 512, 1, 128, 256, 256, 256, 512]
    - [108, 3.46]
  - - [256, 512, 1, 256, 256, 256, 256, 512]
    - [107, 6.1]
  - - [256, 512, 1, 512, 256, 256, 256, 512]
    - [143, 9.2]
  - - [256, 512, 1, 1024, 256, 256, 256, 512]
    - [145, 12.96]
  - - [256, 512, 1, 2048, 256, 256, 256, 512]
    - [144, 17.66]
  - - [256, 512, 1, 4096, 256, 256, 256, 512]
    - [148, 20.05]
  - - [256, 512, 1, 8192, 256, 256, 256, 512]
    - [148, 21.38]
  - - [256, 1024, 1, 128, 256, 256, 256, 1024]
    - [98, 5.8]
  - - [256, 1024, 1, 256, 256, 256, 256, 1024]
    - [93, 9.46]
  - - [256, 1024, 1, 512, 256, 256, 256, 1024]
    - [87, 15.08]
  - - [256, 1024, 1, 1024, 256, 256, 256, 1024]
    - [135, 21.5]
  - - [256, 1024, 1, 2048, 256, 256, 256, 1024]
    - [138, 27.04]
  - - [256, 1024, 1, 4096, 256, 256, 256, 1024]
    - [136, 31.0]
  - - [256, 1024, 1, 8192, 256, 256, 256, 1024]
    - [140, 33.36]
  - - [256, 2048, 1, 128, 256, 256, 256, 2048]
    - [78, 8.19]
  - - [256, 2048, 1, 256, 256, 256, 256, 2048]
    - [76, 13.48]
  - - [256, 2048, 1, 512, 256, 256, 256, 2048]
    - [78, 20.62]
  - - [256, 2048, 1, 1024, 256, 256, 256, 2048]
    - [126, 30.87]
  - - [256, 2048, 1, 2048, 256, 256, 256, 2048]
    - [128, 38.72]
  - - [256, 2048, 1, 4096, 256, 256, 256, 2048]
    - [80, 42.63]
  - - [256, 2048, 1, 8192, 256, 256, 256, 2048]
    - [129, 46.08]
  - - [256, 4096, 1, 128, 256, 256, 256, 4096]
    - [60, 10.4]
  - - [256, 4096, 1, 256, 256, 256, 256, 4096]
    - [69, 17.72]
  - - [256, 4096, 1, 512, 256, 256, 256, 4096]
    - [65, 28.64]
  - - [256, 4096, 1, 1024, 256, 256, 256, 4096]
    - [64, 40.3]
  - - [256, 4096, 1, 2048, 256, 256, 256, 4096]
    - [60, 50.56]
  - - [256, 4096, 1, 4096, 256, 256, 256, 4096]
    - [66, 58.8]
  - - [256, 4096, 1, 8192, 256, 256, 256, 4096]
    - [66, 63.89]
  - - [256, 8192, 1, 128, 256, 256, 256, 8192]
    - [11, 12.13]
  - - [256, 8192, 1, 256, 256, 256, 256, 8192]
    - [30, 21.79]
  - - [256, 8192, 1, 512, 256, 256, 256, 8192]
    - [55, 34.12]
  - - [256, 8192, 1, 1024, 256, 256, 256, 8192]
    - [30, 49.34]
  - - [256, 8192, 1, 2048, 256, 256, 256, 8192]
    - [49, 62.59]
  - - [256, 8192, 1, 4096, 256, 256, 256, 8192]
    - [31, 73.54]
  - - [256, 8192, 1, 8192, 256, 256, 256, 8192]
    - [53, 76.06]
  - - [512, 128, 1, 128, 512, 512, 512, 128]
    - [102, 1.7]
  - - [512, 128, 1, 256, 512, 512, 512, 128]
    - [111, 3.41]
  - - [512, 128, 1, 512, 512, 512, 512, 128]
    - [113, 5.32]
  - - [512, 128, 1, 1024, 512, 512, 512, 128]
    - [156, 8.08]
  - - [512, 128, 1, 2048, 512, 512, 512, 128]
    - [151, 9.74]
  - - [512, 128, 1, 4096, 512, 512, 512, 128]
    - [156, 11.74]
  - - [512, 128, 1, 8192, 512, 512, 512, 128]
    - [155, 12.64]
  - - [512, 256, 1, 128, 512, 512, 512, 256]
    - [26, 3.43]
  - - [512, 256, 1, 256, 512, 512, 512, 256]
    - [106, 6.31]
  - - [512, 256, 1, 512, 512, 512, 512, 256]
    - [141, 9.59]
  - - [512, 256, 1, 1024, 512, 512, 512, 256]
    - [105, 13.55]
  - - [512, 256, 1, 2048, 512, 512, 512, 256]
    - [167, 16.66]
  - - [512, 256, 1, 4096, 512, 512, 512, 256]
    - [147, 19.87]
  - - [512, 256, 1, 8192, 512, 512, 512, 256]
    - [143, 20.47]
  - - [512, 512, 1, 128, 512, 512, 512, 512]
    - [85, 5.82]
  - - [512, 512, 1, 256, 512, 512, 512, 512]
    - [90, 10.08]
  - - [512, 512, 1, 512, 512, 512, 512, 512]
    - [140, 15.76]
  - - [512, 512, 1, 1024, 512, 512, 512, 512]
    - [86, 21.34]
  - - [512, 512, 1, 2048, 512, 512, 512, 512]
    - [133, 26.99]
  - - [512, 512, 1, 4096, 512, 512, 512, 512]
    - [89, 30.09]
  - - [512, 512, 1, 8192, 512, 512, 512, 512]
    - [138, 33.27]
  - - [512, 1024, 1, 128, 512, 512, 512, 1024]
    - [84, 8.62]
  - - [512, 1024, 1, 256, 512, 512, 512, 1024]
    - [83, 13.9]
  - - [512, 1024, 1, 512, 512, 512, 512, 1024]
    - [82, 21.36]
  - - [512, 1024, 1, 1024, 512, 512, 512, 1024]
    - [127, 30.23]
  - - [512, 1024, 1, 2048, 512, 512, 512, 1024]
    - [79, 38.86]
  - - [512, 1024, 1, 4096, 512, 512, 512, 1024]
    - [126, 43.72]
  - - [512, 1024, 1, 8192, 512, 512, 512, 1024]
    - [126, 47.19]
  - - [512, 2048, 1, 128, 512, 512, 512, 2048]
    - [66, 10.56]
  - - [512, 2048, 1, 256, 512, 512, 512, 2048]
    - [61, 18.18]
  - - [512, 2048, 1, 512, 512, 512, 512, 2048]
    - [58, 28.8]
  - - [512, 2048, 1, 1024, 512, 512, 512, 2048]
    - [62, 40.95]
  - - [512, 2048, 1, 2048, 512, 512, 512, 2048]
    - [64, 52.3]
  - - [512, 2048, 1, 4096, 512, 512, 512, 2048]
    - [124, 58.81]
  - - [512, 2048, 1, 8192, 512, 512, 512, 2048]
    - [66, 63.45]
  - - [512, 4096, 1, 128, 512, 512, 512, 4096]
    - [18, 12.09]
  - - [512, 4096, 1, 256, 512, 512, 512, 4096]
    - [37, 21.22]
  - - [512, 4096, 1, 512, 512, 512, 512, 4096]
    - [54, 34.28]
  - - [512, 4096, 1, 1024, 512, 512, 512, 4096]
    - [45, 49.25]
  - - [512, 4096, 1, 2048, 512, 512, 512, 4096]
    - [49, 63.02]
  - - [512, 4096, 1, 4096, 512, 512, 512, 4096]
    - [41, 72.63]
  - - [512, 4096, 1, 8192, 512, 512, 512, 4096]
    - [31, 77.93]
  - - [512, 8192, 1, 128, 512, 512, 512, 8192]
    - [4, 13.51]
  - - [512, 8192, 1, 256, 512, 512, 512, 8192]
    - [54, 22.99]
  - - [512, 8192, 1, 512, 512, 512, 512, 8192]
    - [41, 37.09]
  - - [512, 8192, 1, 1024, 512, 512, 512, 8192]
    - [44, 51.13]
  - - [512, 8192, 1, 2048, 512, 512, 512, 8192]
    - [41, 65.86]
  - - [512, 8192, 1, 4096, 512, 512, 512, 8192]
    - [49, 74.9]
  - - [512, 8192, 1, 8192, 512, 512, 512, 8192]
    - [45, 76.9]
  - - [1024, 128, 1, 128, 1024, 1024, 1024, 128]
    - [27, 3.68]
  - - [1024, 128, 1, 256, 1024, 1024, 1024, 128]
    - [100, 6.75]
  - - [1024, 128, 1, 512, 1024, 1024, 1024, 128]
    - [104, 10.11]
  - - [1024, 128, 1, 1024, 1024, 1024, 1024, 128]
    - [149, 13.94]
  - - [1024, 128, 1, 2048, 1024, 1024, 1024, 128]
    - [144, 17.27]
  - - [1024, 128, 1, 4096, 1024, 1024, 1024, 128]
    - [146, 18.85]
  - - [1024, 128, 1, 8192, 1024, 1024, 1024, 128]
    - [143, 20.32]
  - - [1024, 256, 1, 128, 1024, 1024, 1024, 256]
    - [97, 6.34]
  - - [1024, 256, 1, 256, 1024, 1024, 1024, 256]
    - [86, 10.02]
  - - [1024, 256, 1, 512, 1024, 1024, 1024, 256]
    - [134, 15.76]
  - - [1024, 256, 1, 1024, 1024, 1024, 1024, 256]
    - [88, 21.62]
  - - [1024, 256, 1, 2048, 1024, 1024, 1024, 256]
    - [140, 25.83]
  - - [1024, 256, 1, 4096, 1024, 1024, 1024, 256]
    - [140, 30.58]
  - - [1024, 256, 1, 8192, 1024, 1024, 1024, 256]
    - [136, 33.31]
  - - [1024, 512, 1, 128, 1024, 1024, 1024, 512]
    - [25, 8.03]
  - - [1024, 512, 1, 256, 1024, 1024, 1024, 512]
    - [79, 14.61]
  - - [1024, 512, 1, 512, 1024, 1024, 1024, 512]
    - [82, 22.09]
  - - [1024, 512, 1, 1024, 1024, 1024, 1024, 512]
    - [78, 31.31]
  - - [1024, 512, 1, 2048, 1024, 1024, 1024, 512]
    - [82, 39.2]
  - - [1024, 512, 1, 4096, 1024, 1024, 1024, 512]
    - [84, 44.17]
  - - [1024, 512, 1, 8192, 1024, 1024, 1024, 512]
    - [84, 47.31]
  - - [1024, 1024, 1, 128, 1024, 1024, 1024, 1024]
    - [24, 10.56]
  - - [1024, 1024, 1, 256, 1024, 1024, 1024, 1024]
    - [58, 18.12]
  - - [1024, 1024, 1, 512, 1024, 1024, 1024, 1024]
    - [62, 29.94]
  - - [1024, 1024, 1, 1024, 1024, 1024, 1024, 1024]
    - [57, 41.11]
  - - [1024, 1024, 1, 2048, 1024, 1024, 1024, 1024]
    - [59, 51.24]
  - - [1024, 1024, 1, 4096, 1024, 1024, 1024, 1024]
    - [63, 58.81]
  - - [1024, 1024, 1, 8192, 1024, 1024, 1024, 1024]
    - [125, 63.93]
  - - [1024, 2048, 1, 128, 1024, 1024, 1024, 2048]
    - [42, 12.54]
  - - [1024, 2048, 1, 256, 1024, 1024, 1024, 2048]
    - [36, 22.18]
  - - [1024, 2048, 1, 512, 1024, 1024, 1024, 2048]
    - [36, 35.42]
  - - [1024, 2048, 1, 1024, 1024, 1024, 1024, 2048]
    - [56, 49.6]
  - - [1024, 2048, 1, 2048, 1024, 1024, 1024, 2048]
    - [48, 62.52]
  - - [1024, 2048, 1, 4096, 1024, 1024, 1024, 2048]
    - [49, 73.91]
  - - [1024, 2048, 1, 8192, 1024, 1024, 1024, 2048]
    - [37, 79.85]
  - - [1024, 4096, 1, 128, 1024, 1024, 1024, 4096]
    - [10, 14.38]
  - - [1024, 4096, 1, 256, 1024, 1024, 1024, 4096]
    - [37, 24.05]
  - - [1024, 4096, 1, 512, 1024, 1024, 1024, 4096]
    - [45, 37.53]
  - - [1024, 4096, 1, 1024, 1024, 1024, 1024, 4096]
    - [31, 53.23]
  - - [1024, 4096, 1, 2048, 1024, 1024, 1024, 4096]
    - [40, 64.42]
  - - [1024, 4096, 1, 4096, 1024, 1024, 1024, 4096]
    - [31, 75.24]
  - - [1024, 4096, 1, 8192, 1024, 1024, 1024, 4096]
    - [9, 79.09]
  - - [1024, 8192, 1, 128, 1024, 1024, 1024, 8192]
    - [14, 15.65]
  - - [1024, 8192, 1, 256, 1024, 1024, 1024, 8192]
    - [7, 24.82]
  - - [1024, 8192, 1, 512, 1024, 1024, 1024, 8192]
    - [52, 36.04]
  - - [1024, 8192, 1, 1024, 1024, 1024, 1024, 8192]
    - [48, 48.6]
  - - [1024, 8192, 1, 2048, 1024, 1024, 1024, 8192]
    - [49, 61.93]
  - - [1024, 8192, 1, 4096, 1024, 1024, 1024, 8192]
    - [37, 72.28]
  - - [1024, 8192, 1, 8192, 1024, 1024, 1024, 8192]
    - [13, 79.33]
  - - [2048, 128, 1, 128, 2048, 2048, 2048, 128]
    - [139, 6.21]
  - - [2048, 128, 1, 256, 2048, 2048, 2048, 128]
    - [96, 10.98]
  - - [2048, 128, 1, 512, 2048, 2048, 2048, 128]
    - [86, 15.98]
  - - [2048, 128, 1, 1024, 2048, 2048, 2048, 128]
    - [95, 22.26]
  - - [2048, 128, 1, 2048, 2048, 2048, 2048, 128]
    - [140, 27.14]
  - - [2048, 128, 1, 4096, 2048, 2048, 2048, 128]
    - [89, 30.31]
  - - [2048, 128, 1, 8192, 2048, 2048, 2048, 128]
    - [91, 32.82]
  - - [2048, 256, 1, 128, 2048, 2048, 2048, 256]
    - [81, 8.53]
  - - [2048, 256, 1, 256, 2048, 2048, 2048, 256]
    - [81, 14.47]
  - - [2048, 256, 1, 512, 2048, 2048, 2048, 256]
    - [76, 22.65]
  - - [2048, 256, 1, 1024, 2048, 2048, 2048, 256]
    - [76, 31.87]
  - - [2048, 256, 1, 2048, 2048, 2048, 2048, 256]
    - [79, 39.41]
  - - [2048, 256, 1, 4096, 2048, 2048, 2048, 256]
    - [82, 43.94]
  - - [2048, 256, 1, 8192, 2048, 2048, 2048, 256]
    - [79, 47.2]
  - - [2048, 512, 1, 128, 2048, 2048, 2048, 512]
    - [22, 10.72]
  - - [2048, 512, 1, 256, 2048, 2048, 2048, 512]
    - [22, 18.64]
  - - [2048, 512, 1, 512, 2048, 2048, 2048, 512]
    - [70, 29.77]
  - - [2048, 512, 1, 1024, 2048, 2048, 2048, 512]
    - [62, 42.01]
  - - [2048, 512, 1, 2048, 2048, 2048, 2048, 512]
    - [62, 52.08]
  - - [2048, 512, 1, 4096, 2048, 2048, 2048, 512]
    - [66, 59.62]
  - - [2048, 512, 1, 8192, 2048, 2048, 2048, 512]
    - [66, 63.68]
  - - [2048, 1024, 1, 128, 2048, 2048, 2048, 1024]
    - [2, 12.81]
  - - [2048, 1024, 1, 256, 2048, 2048, 2048, 1024]
    - [31, 22.42]
  - - [2048, 1024, 1, 512, 2048, 2048, 2048, 1024]
    - [37, 35.23]
  - - [2048, 1024, 1, 1024, 2048, 2048, 2048, 1024]
    - [31, 50.34]
  - - [2048, 1024, 1, 2048, 2048, 2048, 2048, 1024]
    - [45, 64.14]
  - - [2048, 1024, 1, 4096, 2048, 2048, 2048, 1024]
    - [49, 74.05]
  - - [2048, 1024, 1, 8192, 2048, 2048, 2048, 1024]
    - [45, 80.01]
  - - [2048, 2048, 1, 128, 2048, 2048, 2048, 2048]
    - [7, 14.15]
  - - [2048, 2048, 1, 256, 2048, 2048, 2048, 2048]
    - [52, 24.46]
  - - [2048, 2048, 1, 512, 2048, 2048, 2048, 2048]
    - [48, 38.26]
  - - [2048, 2048, 1, 1024, 2048, 2048, 2048, 2048]
    - [48, 53.43]
  - - [2048, 2048, 1, 2048, 2048, 2048, 2048, 2048]
    - [54, 65.9]
  - - [2048, 2048, 1, 4096, 2048, 2048, 2048, 2048]
    - [54, 75.25]
  - - [2048, 2048, 1, 8192, 2048, 2048, 2048, 2048]
    - [54, 80.7]
  - - [2048, 4096, 1, 128, 2048, 2048, 2048, 4096]
    - [15, 15.43]
  - - [2048, 4096, 1, 256, 2048, 2048, 2048, 4096]
    - [52, 25.49]
  - - [2048, 4096, 1, 512, 2048, 2048, 2048, 4096]
    - [37, 38.86]
  - - [2048, 4096, 1, 1024, 2048, 2048, 2048, 4096]
    - [52, 50.9]
  - - [2048, 4096, 1, 2048, 2048, 2048, 2048, 4096]
    - [49, 62.46]
  - - [2048, 4096, 1, 4096, 2048, 2048, 2048, 4096]
    - [31, 72.76]
  - - [2048, 4096, 1, 8192, 2048, 2048, 2048, 4096]
    - [32, 79.91]
  - - [2048, 8192, 1, 128, 2048, 2048, 2048, 8192]
    - [19, 12.45]
  - - [2048, 8192, 1, 256, 2048, 2048, 2048, 8192]
    - [52, 21.97]
  - - [2048, 8192, 1, 512, 2048, 2048, 2048, 8192]
    - [48, 35.95]
  - - [2048, 8192, 1, 1024, 2048, 2048, 2048, 8192]
    - [52, 50.66]
  - - [2048, 8192, 1, 2048, 2048, 2048, 2048, 8192]
    - [46, 65.87]
  - - [2048, 8192, 1, 4096, 2048, 2048, 2048, 8192]
    - [39, 75.93]
  - - [2048, 8192, 1, 8192, 2048, 2048, 2048, 8192]
    - [13, 80.99]
  - - [4096, 128, 1, 128, 4096, 4096, 4096, 128]
    - [77, 8.25]
  - - [4096, 128, 1, 256, 4096, 4096, 4096, 128]
    - [78, 14.2]
  - - [4096, 128, 1, 512, 4096, 4096, 4096, 128]
    - [83, 22.67]
  - - [4096, 128, 1, 1024, 4096, 4096, 4096, 128]
    - [82, 31.18]
  - - [4096, 128, 1, 2048, 4096, 4096, 4096, 128]
    - [84, 38.62]
  - - [4096, 128, 1, 4096, 4096, 4096, 4096, 128]
    - [82, 44.04]
  - - [4096, 128, 1, 8192, 4096, 4096, 4096, 128]
    - [84, 47.22]
  - - [4096, 256, 1, 128, 4096, 4096, 4096, 256]
    - [74, 10.71]
  - - [4096, 256, 1, 256, 4096, 4096, 4096, 256]
    - [71, 18.94]
  - - [4096, 256, 1, 512, 4096, 4096, 4096, 256]
    - [59, 29.45]
  - - [4096, 256, 1, 1024, 4096, 4096, 4096, 256]
    - [66, 41.24]
  - - [4096, 256, 1, 2048, 4096, 4096, 4096, 256]
    - [63, 51.38]
  - - [4096, 256, 1, 4096, 4096, 4096, 4096, 256]
    - [66, 59.35]
  - - [4096, 256, 1, 8192, 4096, 4096, 4096, 256]
    - [62, 64.14]
  - - [4096, 512, 1, 128, 4096, 4096, 4096, 512]
    - [5, 12.39]
  - - [4096, 512, 1, 256, 4096, 4096, 4096, 512]
    - [35, 21.68]
  - - [4096, 512, 1, 512, 4096, 4096, 4096, 512]
    - [37, 35.08]
  - - [4096, 512, 1, 1024, 4096, 4096, 4096, 512]
    - [31, 49.96]
  - - [4096, 512, 1, 2048, 4096, 4096, 4096, 512]
    - [37, 63.75]
  - - [4096, 512, 1, 4096, 4096, 4096, 4096, 512]
    - [31, 73.63]
  - - [4096, 512, 1, 8192, 4096, 4096, 4096, 512]
    - [45, 79.58]
  - - [4096, 1024, 1, 128, 4096, 4096, 4096, 1024]
    - [39, 14.16]
  - - [4096, 1024, 1, 256, 4096, 4096, 4096, 1024]
    - [47, 23.92]
  - - [4096, 1024, 1, 512, 4096, 4096, 4096, 1024]
    - [37, 37.63]
  - - [4096, 1024, 1, 1024, 4096, 4096, 4096, 1024]
    - [37, 52.53]
  - - [4096, 1024, 1, 2048, 4096, 4096, 4096, 1024]
    - [31, 65.34]
  - - [4096, 1024, 1, 4096, 4096, 4096, 4096, 1024]
    - [31, 74.78]
  - - [4096, 1024, 1, 8192, 4096, 4096, 4096, 1024]
    - [1, 79.63]
  - - [4096, 2048, 1, 128, 4096, 4096, 4096, 2048]
    - [15, 14.88]
  - - [4096, 2048, 1, 256, 4096, 4096, 4096, 2048]
    - [47, 24.84]
  - - [4096, 2048, 1, 512, 4096, 4096, 4096, 2048]
    - [52, 37.68]
  - - [4096, 2048, 1, 1024, 4096, 4096, 4096, 2048]
    - [31, 50.23]
  - - [4096, 2048, 1, 2048, 4096, 4096, 4096, 2048]
    - [31, 61.85]
  - - [4096, 2048, 1, 4096, 4096, 4096, 4096, 2048]
    - [12, 72.55]
  - - [4096, 2048, 1, 8192, 4096, 4096, 4096, 2048]
    - [35, 79.64]
  - - [4096, 4096, 1, 128, 4096, 4096, 4096, 4096]
    - [47, 12.53]
  - - [4096, 4096, 1, 256, 4096, 4096, 4096, 4096]
    - [51, 22.04]
  - - [4096, 4096, 1, 512, 4096, 4096, 4096, 4096]
    - [30, 35.65]
  - - [4096, 4096, 1, 1024, 4096, 4096, 4096, 4096]
    - [48, 50.92]
  - - [4096, 4096, 1, 2048, 4096, 4096, 4096, 4096]
    - [39, 66.3]
  - - [4096, 4096, 1, 4096, 4096, 4096, 4096, 4096]
    - [33, 77.23]
  - - [4096, 4096, 1, 8192, 4096, 4096, 4096, 4096]
    - [13, 80.77]
  - - [4096, 8192, 1, 128, 4096, 4096, 4096, 8192]
    - [43, 13.2]
  - - [4096, 8192, 1, 256, 4096, 4096, 4096, 8192]
    - [39, 23.6]
  - - [4096, 8192, 1, 512, 4096, 4096, 4096, 8192]
    - [52, 38.06]
  - - [4096, 8192, 1, 1024, 4096, 4096, 4096, 8192]
    - [48, 56.69]
  - - [4096, 8192, 1, 2048, 4096, 4096, 4096, 8192]
    - [29, 69.06]
  - - [4096, 8192, 1, 4096, 4096, 4096, 4096, 8192]
    - [50, 76.38]
  - - [4096, 8192, 1, 8192, 4096, 4096, 4096, 8192]
    - [12, 80.13]
  - - [8192, 128, 1, 128, 8192, 8192, 8192, 128]
    - [21, 10.76]
  - - [8192, 128, 1, 256, 8192, 8192, 8192, 128]
    - [23, 18.64]
  - - [8192, 128, 1, 512, 8192, 8192, 8192, 128]
    - [71, 29.01]
  - - [8192, 128, 1, 1024, 8192, 8192, 8192, 128]
    - [72, 40.54]
  - - [8192, 128, 1, 2048, 8192, 8192, 8192, 128]
    - [72, 50.64]
  - - [8192, 128, 1, 4096, 8192, 8192, 8192, 128]
    - [75, 57.28]
  - - [8192, 128, 1, 8192, 8192, 8192, 8192, 128]
    - [73, 60.86]
  - - [8192, 256, 1, 128, 8192, 8192, 8192, 256]
    - [6, 12.44]
  - - [8192, 256, 1, 256, 8192, 8192, 8192, 256]
    - [37, 21.73]
  - - [8192, 256, 1, 512, 8192, 8192, 8192, 256]
    - [31, 34.7]
  - - [8192, 256, 1, 1024, 8192, 8192, 8192, 256]
    - [54, 49.27]
  - - [8192, 256, 1, 2048, 8192, 8192, 8192, 256]
    - [37, 63.24]
  - - [8192, 256, 1, 4096, 8192, 8192, 8192, 256]
    - [37, 73.26]
  - - [8192, 256, 1, 8192, 8192, 8192, 8192, 256]
    - [37, 77.31]
  - - [8192, 512, 1, 128, 8192, 8192, 8192, 512]
    - [10, 13.93]
  - - [8192, 512, 1, 256, 8192, 8192, 8192, 512]
    - [49, 24.44]
  - - [8192, 512, 1, 512, 8192, 8192, 8192, 512]
    - [45, 38.29]
  - - [8192, 512, 1, 1024, 8192, 8192, 8192, 512]
    - [41, 53.3]
  - - [8192, 512, 1, 2048, 8192, 8192, 8192, 512]
    - [45, 66.21]
  - - [8192, 512, 1, 4096, 8192, 8192, 8192, 512]
    - [37, 73.24]
  - - [8192, 512, 1, 8192, 8192, 8192, 8192, 512]
    - [3, 79.8]
  - - [8192, 1024, 1, 128, 8192, 8192, 8192, 1024]
    - [38, 14.3]
  - - [8192, 1024, 1, 256, 8192, 8192, 8192, 1024]
    - [43, 23.68]
  - - [8192, 1024, 1, 512, 8192, 8192, 8192, 1024]
    - [47, 34.78]
  - - [8192, 1024, 1, 1024, 8192, 8192, 8192, 1024]
    - [52, 48.0]
  - - [8192, 1024, 1, 2048, 8192, 8192, 8192, 1024]
    - [52, 60.96]
  - - [8192, 1024, 1, 4096, 8192, 8192, 8192, 1024]
    - [8, 72.56]
  - - [8192, 1024, 1, 8192, 8192, 8192, 8192, 1024]
    - [47, 79.53]
  - - [8192, 2048, 1, 128, 8192, 8192, 8192, 2048]
    - [29, 12.28]
  - - [8192, 2048, 1, 256, 8192, 8192, 8192, 2048]
    - [34, 21.98]
  - - [8192, 2048, 1, 512, 8192, 8192, 8192, 2048]
    - [29, 34.89]
  - - [8192, 2048, 1, 1024, 8192, 8192, 8192, 2048]
    - [30, 49.56]
  - - [8192, 2048, 1, 2048, 8192, 8192, 8192, 2048]
    - [43, 66.34]
  - - [8192, 2048, 1, 4096, 8192, 8192, 8192, 2048]
    - [29, 76.73]
  - - [8192, 2048, 1, 8192, 8192, 8192, 8192, 2048]
    - [8, 80.7]
  - - [8192, 4096, 1, 128, 8192, 8192, 8192, 4096]
    - [34, 12.97]
  - - [8192, 4096, 1, 256, 8192, 8192, 8192, 4096]
    - [34, 23.59]
  - - [8192, 4096, 1, 512, 8192, 8192, 8192, 4096]
    - [34, 37.74]
  - - [8192, 4096, 1, 1024, 8192, 8192, 8192, 4096]
    - [29, 55.46]
  - - [8192, 4096, 1, 2048, 8192, 8192, 8192, 4096]
    - [29, 69.45]
  - - [8192, 4096, 1, 4096, 8192, 8192, 8192, 4096]
    - [29, 77.89]
  - - [8192, 4096, 1, 8192, 8192, 8192, 8192, 4096]
    - [1, 79.47]
  - - [8192, 8192, 1, 128, 8192, 8192, 8192, 8192]
    - [17, 13.59]
  - - [8192, 8192, 1, 256, 8192, 8192, 8192, 8192]
    - [0, 24.98]
  - - [8192, 8192, 1, 512, 8192, 8192, 8192, 8192]
    - [29, 42.69]
  - - [8192, 8192, 1, 1024, 8192, 8192, 8192, 8192]
    - [39, 59.53]
  - - [8192, 8192, 1, 2048, 8192, 8192, 8192, 8192]
    - [39, 71.87]
  - - [8192, 8192, 1, 4096, 8192, 8192, 8192, 8192]
    - [12, 77.81]
  - - [8192, 8192, 1, 8192, 8192, 8192, 8192, 8192]
    - [47, 84.97]
  - - [1, 1, 1, 32, 1, 1, 1, 1]
    - [172, 0.0]
- null
- null
- ExperimentalStreamK
- GridBased
