projects/hipblaslt/library/src/amd_detail/rocblaslt/src/Tensile/Logic/asm_full/gfx1200/GridBased/gfx1200_Cijk_Alik_Bjlk_BSS_BH_Bias_SHB_HA_S_SAB_SCD_SAV_UserArgs.yaml
- {MinimumRequiredVersion: 5.0.0}
- gfx1200
- gfx1200
- [Device 7580]
    SolutionIndex: 0
    SolutionNameMin: Cijk_Alik_Bjlk_BSS_BH_Bias_HA_S_SAB_SCD_SAV_UserArgs_MT64x32x32_MI16x16x1_CMS_SN_LDSB0_AFC1_AG0_AFEM1_AFEM1_ASEM1_CLR1_CADS0_DTLA0_DTLB0_DTVA0_DTVB0_DTVSM0_DPLBn1_EPS0_ELFLR0_EMLLn1_FDSI0_GRPM1_GRVWA1_GRVWB1_GSU1_GSUAMB_GSUC0_GSUWGMRR0_GLS0_ISA1200_IU1_LDSTI0_LBSPPA128_LBSPPB512_LBSPPM0_LPA16_LPB16_LPM0_LRVW8_LWPMn1_MIAV1_MIWT2_1_MO40_MGRIPMn1_NTn1_NTA0_NTB0_NTC0_NTD0_NTM0_NEPBS0_NLCA1_NLCB1_ONLL1_PGR1_PLR1_PKA0_SGROBn1_SIA3_SS0_SU32_SUM1_SUS256_SPO0_SRVW0_SSO0_SVW8_SK0_SKFTR0_SKXCCM0_SGRO0_TIN0_TLDS1_TLDSM1_ULSGRO0_USL1_UIOFGRO0_USFGROn1_VSn1_VWA1_VWB1_WSGRA0_WSGRB0_WS32_WG32_4_1_WGM8_WGMXCC1_WGMXCCGn1
    SolutionIndex: 1
    SolutionNameMin: Cijk_Alik_Bjlk_BSS_BH_Bias_HA_S_SAB_SCD_SAV_UserArgs_MT64x32x32_MI16x16x1_CMS_SN_LDSB0_AFC1_AG0_AFEM1_AFEM1_ASEM1_CLR1_CADS0_DTLA0_DTLB0_DTVA0_DTVB0_DTVSM0_DPLBn1_EPS0_ELFLR0_EMLLn1_FDSI0_GRPM1_GRVWA1_GRVWB1_GSU1_GSUAMB_GSUC0_GSUWGMRR0_GLS0_ISA1200_IU1_LDSTI0_LBSPPA128_LBSPPB512_LBSPPM0_LPA16_LPB16_LPM0_LRVW8_LWPMn1_MIAV1_MIWT2_1_MO40_MGRIPMn1_NTn1_NTA0_NTB0_NTC0_NTD0_NTM0_NEPBS0_NLCA1_NLCB1_ONLL1_PGR2_PLR1_PKA0_SGROBn1_SIA3_SS0_SU32_SUM1_SUS256_SPO0_SRVW0_SSO0_SVW8_SK0_SKFTR0_SKXCCM0_SGRO0_TIN0_TLDS1_TLDSM1_ULSGRO0_USL1_UIOFGRO0_USFGROn1_VSn1_VWA1_VWB1_WSGRA0_WSGRB0_WS32_WG32_4_1_WGM8_WGMXCC1_WGMXCCGn1
    SolutionIndex: 2
    SolutionNameMin: Cijk_Alik_Bjlk_BSS_BH_Bias_HA_S_SAB_SCD_SAV_UserArgs_MT32x64x32_MI16x16x1_CMS_SN_LDSB0_AFC1_AG0_AFEM1_AFEM1_ASEM1_CLR1_CADS0_DTLA0_DTLB0_DTVA0_DTVB0_DTVSM0_DPLBn1_EPS0_ELFLR0_EMLLn1_FDSI0_GRPM1_GRVWA1_GRVWB1_GSU1_GSUAMB_GSUC0_GSUWGMRR0_GLS0_ISA1200_IU1_LDSTI0_LBSPPA128_LBSPPB1024_LBSPPM0_LPA16_LPB16_LPM0_LRVW8_LWPMn1_MIAV1_MIWT2_1_MO40_MGRIPMn1_NTn1_NTA0_NTB0_NTC0_NTD0_NTM0_NEPBS0_NLCA1_NLCB1_ONLL1_PGR1_PLR1_PKA0_SGROBn1_SIA3_SS0_SU32_SUM1_SUS256_SPO0_SRVW0_SSO0_SVW8_SK0_SKFTR0_SKXCCM0_SGRO0_TIN0_TLDS1_TLDSM1_ULSGRO0_USL1_UIOFGRO0_USFGROn1_VSn1_VWA1_VWB1_WSGRA0_WSGRB0_WS32_WG16_8_1_WGM8_WGMXCC1_WGMXCCGn1
    SolutionIndex: 3
    SolutionNameMin: Cijk_Alik_Bjlk_BSS_BH_Bias_HA_S_SAB_SCD_SAV_UserArgs_MT32x64x32_MI16x16x1_CMS_SN_LDSB0_AFC1_AG0_AFEM1_AFEM1_ASEM1_CLR0_CADS0_DTLA0_DTLB0_DTVA0_DTVB0_DTVSM0_DPLBn1_EPS0_ELFLR0_EMLLn1_FDSI0_GRPM1_GRVWA1_GRVWB1_GSU1_GSUAMB_GSUC0_GSUWGMRR0_GLS0_ISA1200_IU1_LDSTI0_LBSPPA128_LBSPPB1024_LBSPPM0_LPA16_LPB16_LPM0_LRVW8_LWPMn1_MIAV1_MIWT2_1_MO40_MGRIPMn1_NTn1_NTA0_NTB0_NTC0_NTD0_NTM0_NEPBS0_NLCA1_NLCB1_ONLL1_PGR1_PLR0_PKA0_SGROBn1_SIA3_SS0_SU32_SUM1_SUS256_SPO0_SRVW0_SSO0_SVW8_SK0_SKFTR0_SKXCCM0_SGRO0_TIN0_TLDS1_TLDSM1_ULSGRO0_USL1_UIOFGRO0_USFGROn1_VSn1_VWA1_VWB1_WSGRA0_WSGRB0_WS32_WG16_8_1_WGM8_WGMXCC1_WGMXCCGn1
    SolutionIndex: 4
    SolutionNameMin: Cijk_Alik_Bjlk_BSS_BH_Bias_HA_S_SAB_SCD_SAV_UserArgs_MT32x32x64_MI16x16x1_CMS_SN_LDSB0_AFC1_AG0_AFEM1_AFEM1_ASEM1_CLR0_CADS0_DTLA0_DTLB0_DTVA0_DTVB0_DTVSM0_DPLBn1_EPS0_ELFLR0_EMLLn1_FDSI0_GRPM1_GRVWA1_GRVWB1_GSU1_GSUAMB_GSUC0_GSUWGMRR0_GLS0_ISA1200_IU1_LDSTI0_LBSPPA128_LBSPPB512_LBSPPM0_LPA16_LPB16_LPM0_LRVW8_LWPMn1_MIAV1_MIWT1_1_MO40_MGRIPMn1_NTn1_NTA0_NTB0_NTC0_NTD0_NTM0_NEPBS0_NLCA1_NLCB1_ONLL1_PGR1_PLR0_PKA0_SGROBn1_SIA3_SS0_SU32_SUM1_SUS256_SPO0_SRVW0_SSO0_SVW8_SK0_SKFTR0_SKXCCM0_SGRO0_TIN0_TLDS1_TLDSM1_ULSGRO0_USL1_UIOFGRO0_USFGROn1_VSn1_VWA1_VWB1_WSGRA0_WSGRB0_WS32_WG32_4_1_WGM8_WGMXCC1_WGMXCCGn1
    SolutionIndex: 5
    SolutionNameMin: Cijk_Alik_Bjlk_BSS_BH_Bias_HA_S_SAB_SCD_SAV_UserArgs_MT64x16x32_MI16x16x1_CMS_SN_LDSB0_AFC1_AG0_AFEM1_AFEM1_ASEM1_CLR0_CADS0_DTLA0_DTLB0_DTVA0_DTVB0_DTVSM0_DPLBn1_EPS0_ELFLR0_EMLLn1_FDSI0_GRPM1_GRVWA1_GRVWB1_GSU1_GSUAMB_GSUC0_GSUWGMRR0_GLS0_ISA1200_IU1_LDSTI0_LBSPPA128_LBSPPB256_LBSPPM0_LPA16_LPB16_LPM0_LRVW8_LWPMn1_MIAV1_MIWT1_1_MO40_MGRIPMn1_NTn1_NTA0_NTB0_NTC0_NTD0_NTM0_NEPBS0_NLCA1_NLCB1_ONLL1_PGR1_PLR0_PKA0_SGROBn1_SIA3_SS1_SU32_SUM1_SUS256_SPO0_SRVW0_SSO0_SVW1_SK0_SKFTR0_SKXCCM0_SGRO0_TIN0_TLDS1_TLDSM1_ULSGRO0_USL1_UIOFGRO0_USFGROn1_VSn1_VWA1_VWB1_WSGRA0_WSGRB0_WS32_WG64_2_1_WGM8_WGMXCC1_WGMXCCGn1
    SolutionIndex: 6
    SolutionNameMin: Cijk_Alik_Bjlk_BSS_BH_Bias_HA_S_SAB_SCD_SAV_UserArgs_MT32x32x32_MI16x16x1_CMS_SN_LDSB0_AFC1_AG0_AFEM1_AFEM1_ASEM1_CLR1_CADS0_DTLA0_DTLB0_DTVA0_DTVB0_DTVSM0_DPLBn1_EPS0_ELFLR0_EMLLn1_FDSI0_GRPM1_GRVWA1_GRVWB1_GSU1_GSUAMB_GSUC0_GSUWGMRR0_GLS0_ISA1200_IU1_LDSTI0_LBSPPA512_LBSPPB512_LBSPPM0_LPA16_LPB16_LPM0_LRVW8_LWPMn1_MIAV1_MIWT1_1_MO40_MGRIPMn1_NTn1_NTA0_NTB0_NTC0_NTD0_NTM0_NEPBS0_NLCA1_NLCB1_ONLL1_PGR1_PLR1_PKA0_SGROBn1_SIA3_SS1_SU32_SUM1_SUS256_SPO0_SRVW0_SSO0_SVW1_SK0_SKFTR0_SKXCCM0_SGRO0_TIN0_TLDS0_TLDSM1_ULSGRO0_USL1_UIOFGRO0_USFGROn1_VSn1_VWA1_VWB1_WSGRA0_WSGRB0_WS32_WG32_4_1_WGM8_WGMXCC1_WGMXCCGn1
    SolutionIndex: 7
    SolutionNameMin: Cijk_Alik_Bjlk_BSS_BH_Bias_HA_S_SAB_SCD_SAV_UserArgs_MT32x32x32_MI16x16x1_CMS_SN_LDSB0_AFC1_AG0_AFEM1_AFEM1_ASEM1_CLR1_CADS0_DTLA0_DTLB0_DTVA0_DTVB0_DTVSM0_DPLBn1_EPS0_ELFLR0_EMLLn1_FDSI0_GRPM1_GRVWA1_GRVWB1_GSU1_GSUAMB_GSUC0_GSUWGMRR0_GLS0_ISA1200_IU1_LDSTI0_LBSPPA128_LBSPPB512_LBSPPM0_LPA16_LPB16_LPM0_LRVW8_LWPMn1_MIAV1_MIWT1_1_MO40_MGRIPMn1_NTn1_NTA0_NTB0_NTC0_NTD0_NTM0_NEPBS0_NLCA1_NLCB1_ONLL1_PGR1_PLR1_PKA0_SGROBn1_SIA3_SS1_SU32_SUM1_SUS256_SPO0_SRVW0_SSO0_SVW1_SK0_SKFTR0_SKXCCM0_SGRO0_TIN0_TLDS1_TLDSM1_ULSGRO0_USL1_UIOFGRO0_USFGROn1_VSn1_VWA1_VWB1_WSGRA0_WSGRB0_WS32_WG32_4_1_WGM8_WGMXCC1_WGMXCCGn1
    SolutionIndex: 8
    SolutionNameMin: Cijk_Alik_Bjlk_BSS_BH_Bias_HA_S_SAB_SCD_SAV_UserArgs_MT64x32x32_MI16x16x1_CMS_SN_LDSB0_AFC1_AG0_AFEM1_AFEM1_ASEM1_CLR1_CADS0_DTLA0_DTLB0_DTVA0_DTVB0_DTVSM0_DPLBn1_EPS0_ELFLR0_EMLLn1_FDSI0_GRPM1_GRVWA1_GRVWB1_GSU1_GSUAMB_GSUC0_GSUWGMRR0_GLS0_ISA1200_IU1_LDSTI0_LBSPPA128_LBSPPB512_LBSPPM0_LPA16_LPB16_LPM0_LRVW8_LWPMn1_MIAV1_MIWT2_1_MO40_MGRIPMn1_NTn1_NTA0_NTB0_NTC0_NTD0_NTM0_NEPBS0_NLCA1_NLCB1_ONLL1_PGR1_PLR1_PKA0_SGROBn1_SIA3_SS1_SU32_SUM1_SUS256_SPO0_SRVW0_SSO0_SVW1_SK0_SKFTR0_SKXCCM0_SGRO0_TIN0_TLDS1_TLDSM1_ULSGRO0_USL1_UIOFGRO0_USFGROn1_VSn1_VWA1_VWB1_WSGRA0_WSGRB0_WS32_WG32_4_1_WGM8_WGMXCC1_WGMXCCGn1
    SolutionIndex: 9
    SolutionNameMin: Cijk_Alik_Bjlk_BSS_BH_Bias_HA_S_SAB_SCD_SAV_UserArgs_MT64x32x32_MI16x16x1_CMS_SN_LDSB0_AFC1_AG0_AFEM1_AFEM1_ASEM1_CLR0_CADS0_DTLA0_DTLB0_DTVA0_DTVB0_DTVSM0_DPLBn1_EPS0_ELFLR0_EMLLn1_FDSI0_GRPM1_GRVWA1_GRVWB1_GSU1_GSUAMB_GSUC0_GSUWGMRR0_GLS0_ISA1200_IU1_LDSTI0_LBSPPA128_LBSPPB512_LBSPPM0_LPA16_LPB16_LPM0_LRVW8_LWPMn1_MIAV1_MIWT2_1_MO40_MGRIPMn1_NTn1_NTA0_NTB0_NTC0_NTD0_NTM0_NEPBS0_NLCA1_NLCB1_ONLL1_PGR1_PLR0_PKA0_SGROBn1_SIA3_SS1_SU32_SUM1_SUS256_SPO0_SRVW0_SSO0_SVW1_SK0_SKFTR0_SKXCCM0_SGRO0_TIN0_TLDS1_TLDSM1_ULSGRO0_USL1_UIOFGRO0_USFGROn1_VSn1_VWA1_VWB1_WSGRA0_WSGRB0_WS32_WG32_4_1_WGM8_WGMXCC1_WGMXCCGn1
    SolutionIndex: 10
    SolutionNameMin: Cijk_Alik_Bjlk_BSS_BH_Bias_HA_S_SAB_SCD_SAV_UserArgs_MT16x64x32_MI16x16x1_CMS_SN_LDSB0_AFC1_AG0_AFEM1_AFEM1_ASEM1_CLR1_CADS0_DTLA0_DTLB0_DTVA0_DTVB0_DTVSM0_DPLBn1_EPS0_ELFLR0_EMLLn1_FDSI0_GRPM1_GRVWA1_GRVWB1_GSU1_GSUAMB_GSUC0_GSUWGMRR0_GLS0_ISA1200_IU1_LDSTI0_LBSPPA128_LBSPPB1024_LBSPPM0_LPA16_LPB16_LPM0_LRVW8_LWPMn1_MIAV1_MIWT1_1_MO40_MGRIPMn1_NTn1_NTA0_NTB0_NTC0_NTD0_NTM0_NEPBS0_NLCA1_NLCB1_ONLL1_PGR1_PLR1_PKA0_SGROBn1_SIA3_SS1_SU32_SUM1_SUS256_SPO0_SRVW0_SSO0_SVW1_SK0_SKFTR0_SKXCCM0_SGRO0_TIN0_TLDS1_TLDSM1_ULSGRO0_USL1_UIOFGRO0_USFGROn1_VSn1_VWA1_VWB1_WSGRA0_WSGRB0_WS32_WG16_8_1_WGM8_WGMXCC1_WGMXCCGn1
    SolutionIndex: 11
    SolutionNameMin: Cijk_Alik_Bjlk_BSS_BH_Bias_HA_S_SAB_SCD_SAV_UserArgs_MT32x64x32_MI16x16x1_CMS_SN_LDSB0_AFC1_AG0_AFEM1_AFEM1_ASEM1_CLR1_CADS0_DTLA0_DTLB0_DTVA0_DTVB0_DTVSM0_DPLBn1_EPS0_ELFLR0_EMLLn1_FDSI0_GRPM1_GRVWA1_GRVWB1_GSU1_GSUAMB_GSUC0_GSUWGMRR0_GLS0_ISA1200_IU1_LDSTI0_LBSPPA128_LBSPPB1024_LBSPPM0_LPA16_LPB16_LPM0_LRVW8_LWPMn1_MIAV1_MIWT2_1_MO40_MGRIPMn1_NTn1_NTA0_NTB0_NTC0_NTD0_NTM0_NEPBS0_NLCA1_NLCB1_ONLL1_PGR1_PLR1_PKA0_SGROBn1_SIA3_SS1_SU32_SUM1_SUS256_SPO0_SRVW0_SSO0_SVW1_SK0_SKFTR0_SKXCCM0_SGRO0_TIN0_TLDS1_TLDSM1_ULSGRO0_USL1_UIOFGRO0_USFGROn1_VSn1_VWA1_VWB1_WSGRA0_WSGRB0_WS32_WG16_8_1_WGM8_WGMXCC1_WGMXCCGn1
    SolutionIndex: 12
    SolutionNameMin: Cijk_Alik_Bjlk_BSS_BH_Bias_HA_S_SAB_SCD_SAV_UserArgs_MT32x64x32_MI16x16x1_CMS_SN_LDSB0_AFC1_AG0_AFEM1_AFEM1_ASEM1_CLR1_CADS0_DTLA0_DTLB0_DTVA0_DTVB0_DTVSM0_DPLBn1_EPS0_ELFLR0_EMLLn1_FDSI0_GRPM1_GRVWA1_GRVWB1_GSU1_GSUAMB_GSUC0_GSUWGMRR0_GLS0_ISA1200_IU1_LDSTI0_LBSPPA128_LBSPPB1024_LBSPPM0_LPA16_LPB16_LPM0_LRVW8_LWPMn1_MIAV1_MIWT2_1_MO40_MGRIPMn1_NTn1_NTA0_NTB0_NTC0_NTD0_NTM0_NEPBS0_NLCA1_NLCB1_ONLL1_PGR2_PLR1_PKA0_SGROBn1_SIA3_SS1_SU32_SUM1_SUS256_SPO0_SRVW0_SSO0_SVW1_SK0_SKFTR0_SKXCCM0_SGRO0_TIN0_TLDS1_TLDSM1_ULSGRO0_USL1_UIOFGRO0_USFGROn1_VSn1_VWA1_VWB1_WSGRA0_WSGRB0_WS32_WG16_8_1_WGM8_WGMXCC1_WGMXCCGn1
    SolutionIndex: 13
    SolutionNameMin: Cijk_Alik_Bjlk_BSS_BH_Bias_HA_S_SAB_SCD_SAV_UserArgs_MT32x64x32_MI16x16x1_CMS_SN_LDSB0_AFC1_AG0_AFEM1_AFEM1_ASEM1_CLR0_CADS0_DTLA0_DTLB0_DTVA0_DTVB0_DTVSM0_DPLBn1_EPS0_ELFLR0_EMLLn1_FDSI0_GRPM1_GRVWA1_GRVWB1_GSU1_GSUAMB_GSUC0_GSUWGMRR0_GLS0_ISA1200_IU1_LDSTI0_LBSPPA128_LBSPPB1024_LBSPPM0_LPA16_LPB16_LPM0_LRVW8_LWPMn1_MIAV1_MIWT2_1_MO40_MGRIPMn1_NTn1_NTA0_NTB0_NTC0_NTD0_NTM0_NEPBS0_NLCA1_NLCB1_ONLL1_PGR1_PLR0_PKA0_SGROBn1_SIA3_SS1_SU32_SUM1_SUS256_SPO0_SRVW0_SSO0_SVW1_SK0_SKFTR0_SKXCCM0_SGRO0_TIN0_TLDS1_TLDSM1_ULSGRO0_USL1_UIOFGRO0_USFGROn1_VSn1_VWA1_VWB1_WSGRA0_WSGRB0_WS32_WG16_8_1_WGM8_WGMXCC1_WGMXCCGn1
    SolutionIndex: 14
    SolutionNameMin: Cijk_Alik_Bjlk_BSS_BH_Bias_HA_S_SAB_SCD_SAV_UserArgs_MT32x32x64_MI16x16x1_CMS_SN_LDSB0_AFC1_AG0_AFEM1_AFEM1_ASEM1_CLR1_CADS0_DTLA0_DTLB0_DTVA0_DTVB0_DTVSM0_DPLBn1_EPS0_ELFLR0_EMLLn1_FDSI0_GRPM1_GRVWA1_GRVWB1_GSU1_GSUAMB_GSUC0_GSUWGMRR0_GLS0_ISA1200_IU1_LDSTI0_LBSPPA128_LBSPPB512_LBSPPM0_LPA16_LPB16_LPM0_LRVW8_LWPMn1_MIAV1_MIWT1_1_MO40_MGRIPMn1_NTn1_NTA0_NTB0_NTC0_NTD0_NTM0_NEPBS0_NLCA1_NLCB1_ONLL1_PGR2_PLR1_PKA0_SGROBn1_SIA3_SS1_SU32_SUM1_SUS256_SPO0_SRVW0_SSO0_SVW1_SK0_SKFTR0_SKXCCM0_SGRO0_TIN0_TLDS1_TLDSM1_ULSGRO0_USL1_UIOFGRO0_USFGROn1_VSn1_VWA1_VWB1_WSGRA0_WSGRB0_WS32_WG32_4_1_WGM8_WGMXCC1_WGMXCCGn1
    SolutionIndex: 15
    SolutionNameMin: Cijk_Alik_Bjlk_BSS_BH_Bias_HA_S_SAB_SCD_SAV_UserArgs_MT32x32x64_MI16x16x1_CMS_SN_LDSB0_AFC1_AG0_AFEM1_AFEM1_ASEM1_CLR1_CADS0_DTLA0_DTLB0_DTVA0_DTVB0_DTVSM0_DPLBn1_EPS0_ELFLR0_EMLLn1_FDSI0_GRPM1_GRVWA1_GRVWB1_GSU1_GSUAMB_GSUC0_GSUWGMRR0_GLS0_ISA1200_IU1_LDSTI0_LBSPPA128_LBSPPB512_LBSPPM0_LPA16_LPB16_LPM0_LRVW8_LWPMn1_MIAV1_MIWT1_1_MO40_MGRIPMn1_NTn1_NTA0_NTB0_NTC0_NTD0_NTM0_NEPBS0_NLCA1_NLCB1_ONLL1_PGR2_PLR3_PKA0_SGROBn1_SIA3_SS1_SU32_SUM1_SUS256_SPO0_SRVW0_SSO0_SVW1_SK0_SKFTR0_SKXCCM0_SGRO0_TIN0_TLDS1_TLDSM1_ULSGRO0_USL1_UIOFGRO0_USFGROn1_VSn1_VWA1_VWB1_WSGRA0_WSGRB0_WS32_WG32_4_1_WGM8_WGMXCC1_WGMXCCGn1
    SolutionIndex: 16
    SolutionNameMin: Cijk_Alik_Bjlk_BSS_BH_Bias_HA_S_SAB_SCD_SAV_UserArgs_MT16x16x64_MI16x16x1_SN_LDSB1_AFC1_AG0_AFEM1_AFEM1_ASEM1_CLR1_CADS0_DTLA0_DTLB0_DTVA0_DTVB0_DTVSM0_DPLBn1_EPS1_ELFLR0_EMLLn1_FDSI0_GRPM1_GRVWA8_GRVWB8_GSUn1_GSUAMB_GSUC0_GSUWGMRR0_GLS0_ISA1200_IU4_K1_LDSTI0_LBSPPA128_LBSPPB256_LBSPPM0_LPA16_LPB16_LPM0_LRVW8_LWPMn1_MIAV1_MIWT1_1_MO40_MGRIPMn1_NTn1_NTA0_NTB0_NTC0_NTD0_NTM0_NEPBS0_NLCA1_NLCB1_ONLL0_PGR1_PLR1_PKA0_SGROBn1_SIA2_SS0_SU32_SUM0_SUS256_SPO0_SRVW0_SSO0_SVW8_SK0_SKFTR0_SKXCCM0_SGRO0_TIN0_TLDS1_TLDSM1_ULSGRO0_USL1_UIOFGRO0_USFGROn1_VSn1_VWA1_VWB1_WSGRA0_WSGRB0_WS32_WG16_2_1_WGM8_WGMXCC1_WGMXCCGn1
    SolutionIndex: 17
    SolutionNameMin: Cijk_Alik_Bjlk_BSS_BH_Bias_HA_S_SAB_SCD_SAV_UserArgs_MT16x32x64_MI16x16x1_SN_LDSB0_AFC1_AG0_AFEM1_AFEM1_ASEM1_CLR1_CADS0_DTLA0_DTLB0_DTVA0_DTVB1_DTVSM0_DPLBn1_EPS1_ELFLR0_EMLLn1_FDSI0_GRPM1_GRVWA8_GRVWB8_GSUn1_GSUAMB_GSUC0_GSUWGMRR0_GLS0_ISA1200_IU1_K1_LDSTI0_LBSPPA128_LBSPPB0_LBSPPM0_LPA16_LPB0_LPM0_LRVW8_LWPMn1_MIAV1_MIWT1_1_MO40_MGRIPMn1_NTn1_NTA0_NTB0_NTC0_NTD0_NTM0_NEPBS0_NLCA1_NLCB1_ONLL0_PGR1_PLR1_PKA0_SGROBn1_SIA3_SS0_SU32_SUM0_SUS256_SPO0_SRVW0_SSO0_SVW8_SK0_SKFTR0_SKXCCM0_SGRO0_TIN0_TLDS1_TLDSM1_ULSGRO0_USL1_UIOFGRO0_USFGROn1_VSn1_VWA1_VWB1_WSGRA0_WSGRB0_WS32_WG16_4_1_WGM8_WGMXCC1_WGMXCCGn1
    SolutionIndex: 18
    SolutionNameMin: Cijk_Alik_Bjlk_BSS_BH_Bias_HA_S_SAB_SCD_SAV_UserArgs_MT32x32x64_MI16x16x1_SN_LDSB0_AFC1_AG0_AFEM1_AFEM1_ASEM64_CLR1_CADS0_DTLA0_DTLB0_DTVA1_DTVB0_DTVSM0_DPLBn1_EPS0_ELFLR0_EMLLn1_FDSI0_GRPM1_GRVWA8_GRVWB8_GSUn1_GSUAMB_GSUC0_GSUWGMRR0_GLS0_ISA1200_IU1_K1_LDSTI0_LBSPPA0_LBSPPB512_LBSPPM0_LPA0_LPB16_LPM0_LRVW8_LWPMn1_MIAV1_MIWT1_1_MO40_MGRIPMn1_NTn1_NTA0_NTB0_NTC0_NTD0_NTM0_NEPBS0_NLCA4_NLCB1_ONLL0_PGR2_PLR1_PKA0_SGROBn1_SIA3_SS0_SU32_SUM0_SUS256_SPO0_SRVW0_SSO0_SVW8_SK0_SKFTR0_SKXCCM0_SGRO0_TIN0_TLDS1_TLDSM1_ULSGRO0_USL1_UIOFGRO0_USFGROn1_VSn1_VWA1_VWB1_WSGRA0_WSGRB0_WS32_WG32_4_1_WGM8_WGMXCC1_WGMXCCGn1
    SolutionIndex: 19
    SolutionNameMin: Cijk_Alik_Bjlk_BSS_BH_Bias_HA_S_SAB_SCD_SAV_UserArgs_MT32x32x32_MI16x16x1_SN_LDSB0_AFC1_AG0_AFEM1_AFEM1_ASEM1_CLR1_CADS0_DTLA0_DTLB0_DTVA0_DTVB1_DTVSM0_DPLBn1_EPS1_ELFLR0_EMLLn1_FDSI0_GRPM1_GRVWA8_GRVWB8_GSUn1_GSUAMB_GSUC0_GSUWGMRR0_GLS0_ISA1200_IU1_K1_LDSTI0_LBSPPA128_LBSPPB0_LBSPPM0_LPA16_LPB0_LPM0_LRVW8_LWPMn1_MIAV1_MIWT1_1_MO40_MGRIPMn1_NTn1_NTA0_NTB0_NTC0_NTD0_NTM0_NEPBS0_NLCA1_NLCB1_ONLL0_PGR1_PLR1_PKA0_SGROBn1_SIA3_SS0_SU32_SUM0_SUS256_SPO0_SRVW0_SSO0_SVW8_SK0_SKFTR0_SKXCCM0_SGRO0_TIN0_TLDS1_TLDSM1_ULSGRO0_USL1_UIOFGRO0_USFGROn1_VSn1_VWA1_VWB1_WSGRA0_WSGRB0_WS32_WG32_4_1_WGM8_WGMXCC1_WGMXCCGn1
    SolutionIndex: 20
    SolutionNameMin: Cijk_Alik_Bjlk_BSS_BH_Bias_HA_S_SAB_SCD_SAV_UserArgs_MT16x32x32_MI16x16x1_SN_LDSB0_AFC1_AG0_AFEM1_AFEM1_ASEM1_CLR1_CADS0_DTLA0_DTLB0_DTVA0_DTVB1_DTVSM0_DPLBn1_EPS1_ELFLR0_EMLLn1_FDSI0_GRPM1_GRVWA8_GRVWB8_GSUn1_GSUAMB_GSUC0_GSUWGMRR0_GLS0_ISA1200_IU1_K1_LDSTI0_LBSPPA128_LBSPPB0_LBSPPM0_LPA16_LPB0_LPM0_LRVW8_LWPMn1_MIAV1_MIWT1_1_MO40_MGRIPMn1_NTn1_NTA0_NTB0_NTC0_NTD0_NTM0_NEPBS0_NLCA1_NLCB1_ONLL0_PGR1_PLR1_PKA0_SGROBn1_SIA3_SS0_SU32_SUM0_SUS256_SPO0_SRVW0_SSO0_SVW8_SK0_SKFTR0_SKXCCM0_SGRO0_TIN0_TLDS1_TLDSM1_ULSGRO0_USL1_UIOFGRO0_USFGROn1_VSn1_VWA1_VWB1_WSGRA0_WSGRB0_WS32_WG16_4_1_WGM8_WGMXCC1_WGMXCCGn1
    SolutionIndex: 21
    SolutionNameMin: Cijk_Alik_Bjlk_BSS_BH_Bias_HA_S_SAB_SCD_SAV_UserArgs_MT16x16x32_MI16x16x1_SN_LDSB0_AFC1_AG0_AFEM1_AFEM1_ASEM32_CLR1_CADS0_DTLA0_DTLB0_DTVA1_DTVB0_DTVSM0_DPLBn1_EPS1_ELFLR0_EMLLn1_FDSI0_GRPM1_GRVWA8_GRVWB8_GSUn1_GSUAMB_GSUC0_GSUWGMRR0_GLS0_ISA1200_IU1_K1_LDSTI0_LBSPPA0_LBSPPB256_LBSPPM0_LPA0_LPB16_LPM0_LRVW8_LWPMn1_MIAV1_MIWT1_1_MO40_MGRIPMn1_NTn1_NTA0_NTB0_NTC0_NTD0_NTM0_NEPBS0_NLCA2_NLCB1_ONLL0_PGR1_PLR1_PKA0_SGROBn1_SIA3_SS0_SU32_SUM0_SUS256_SPO0_SRVW0_SSO0_SVW8_SK0_SKFTR0_SKXCCM0_SGRO0_TIN0_TLDS1_TLDSM1_ULSGRO0_USL1_UIOFGRO0_USFGROn1_VSn1_VWA1_VWB1_WSGRA0_WSGRB0_WS32_WG16_2_1_WGM8_WGMXCC1_WGMXCCGn1
    SolutionIndex: 22
    SolutionNameMin: Cijk_Alik_Bjlk_BSS_BH_Bias_HA_S_SAB_SCD_SAV_UserArgs_MT16x32x16_MI16x16x1_SN_LDSB1_AFC1_AG0_AFEM1_AFEM1_ASEM1_CLR1_CADS0_DTLA0_DTLB0_DTVA0_DTVB0_DTVSM0_DPLBn1_EPS0_ELFLR0_EMLLn1_FDSI0_GRPM1_GRVWA4_GRVWB8_GSUn1_GSUAMB_GSUC0_GSUWGMRR0_GLS0_ISA1200_IU1_K1_LDSTI0_LBSPPA128_LBSPPB512_LBSPPM0_LPA16_LPB16_LPM0_LRVW8_LWPMn1_MIAV1_MIWT1_1_MO40_MGRIPMn1_NTn1_NTA0_NTB0_NTC0_NTD0_NTM0_NEPBS0_NLCA1_NLCB1_ONLL0_PGR2_PLR1_PKA0_SGROBn1_SIA2_SS0_SU32_SUM0_SUS256_SPO0_SRVW0_SSO0_SVW8_SK0_SKFTR0_SKXCCM0_SGRO0_TIN0_TLDS1_TLDSM1_ULSGRO0_USL1_UIOFGRO0_USFGROn1_VSn1_VWA1_VWB1_WSGRA0_WSGRB0_WS32_WG16_4_1_WGM8_WGMXCC1_WGMXCCGn1
    SolutionIndex: 23
    SolutionNameMin: Cijk_Alik_Bjlk_BSS_BH_Bias_HA_S_SAB_SCD_SAV_UserArgs_MT32x32x64_MI16x16x1_SN_LDSB0_AFC1_AG0_AFEM1_AFEM1_ASEM64_CLR1_CADS0_DTLA0_DTLB0_DTVA1_DTVB0_DTVSM0_DPLBn1_EPS1_ELFLR0_EMLLn1_FDSI0_GRPM1_GRVWA8_GRVWB8_GSUn1_GSUAMB_GSUC0_GSUWGMRR0_GLS0_ISA1200_IU1_K1_LDSTI0_LBSPPA0_LBSPPB512_LBSPPM0_LPA0_LPB16_LPM0_LRVW8_LWPMn1_MIAV1_MIWT1_1_MO40_MGRIPMn1_NTn1_NTA0_NTB0_NTC0_NTD0_NTM0_NEPBS0_NLCA4_NLCB1_ONLL0_PGR1_PLR1_PKA0_SGROBn1_SIA3_SS0_SU32_SUM0_SUS256_SPO0_SRVW0_SSO0_SVW8_SK0_SKFTR0_SKXCCM0_SGRO0_TIN0_TLDS1_TLDSM1_ULSGRO0_USL1_UIOFGRO0_USFGROn1_VSn1_VWA1_VWB1_WSGRA0_WSGRB0_WS32_WG32_4_1_WGM8_WGMXCC1_WGMXCCGn1
    SolutionIndex: 24
    SolutionNameMin: Cijk_Alik_Bjlk_BSS_BH_Bias_HA_S_SAB_SCD_SAV_UserArgs_MT16x32x64_MI16x16x1_SN_LDSB0_AFC1_AG0_AFEM1_AFEM1_ASEM64_CLR1_CADS0_DTLA0_DTLB0_DTVA1_DTVB0_DTVSM0_DPLBn1_EPS1_ELFLR0_EMLLn1_FDSI0_GRPM1_GRVWA8_GRVWB8_GSUn1_GSUAMB_GSUC0_GSUWGMRR0_GLS0_ISA1200_IU1_K1_LDSTI0_LBSPPA0_LBSPPB512_LBSPPM0_LPA0_LPB16_LPM0_LRVW8_LWPMn1_MIAV1_MIWT1_1_MO40_MGRIPMn1_NTn1_NTA0_NTB0_NTC0_NTD0_NTM0_NEPBS0_NLCA4_NLCB1_ONLL0_PGR1_PLR1_PKA0_SGROBn1_SIA3_SS0_SU32_SUM0_SUS256_SPO0_SRVW0_SSO0_SVW8_SK0_SKFTR0_SKXCCM0_SGRO0_TIN0_TLDS1_TLDSM1_ULSGRO0_USL1_UIOFGRO0_USFGROn1_VSn1_VWA1_VWB1_WSGRA0_WSGRB0_WS32_WG16_4_1_WGM8_WGMXCC1_WGMXCCGn1
    SolutionIndex: 25
    SolutionNameMin: Cijk_Alik_Bjlk_BSS_BH_Bias_HA_S_SAB_SCD_SAV_UserArgs_MT16x16x16_MI16x16x1_SN_LDSB0_AFC1_AG0_AFEM1_AFEM1_ASEM16_CLR1_CADS0_DTLA0_DTLB0_DTVA1_DTVB1_DTVSM0_DPLBn1_EPS0_ELFLR0_EMLLn1_FDSI0_GRPM1_GRVWA8_GRVWB8_GSUn1_GSUAMB_GSUC0_GSUWGMRR0_GLS0_ISA1200_IU1_K1_LDSTI0_LBSPPA0_LBSPPB0_LBSPPM0_LPA0_LPB0_LPM0_LRVW8_LWPMn1_MIAV1_MIWT1_1_MO40_MGRIPMn1_NTn1_NTA0_NTB0_NTC0_NTD0_NTM0_NEPBS0_NLCA1_NLCB1_ONLL0_PGR1_PLR0_PKA0_SGROBn1_SIA3_SS0_SU32_SUM0_SUS256_SPO0_SRVW0_SSO0_SVW8_SK0_SKFTR0_SKXCCM0_SGRO0_TIN0_TLDS1_TLDSM1_ULSGRO0_USL1_UIOFGRO0_USFGROn1_VSn1_VWA1_VWB1_WSGRA0_WSGRB0_WS32_WG16_2_1_WGM8_WGMXCC1_WGMXCCGn1
    SolutionIndex: 26
    SolutionNameMin: Cijk_Alik_Bjlk_BSS_BH_Bias_HA_S_SAB_SCD_SAV_UserArgs_MT64x64x64_MI16x16x1_SN_LDSB1_AFC1_AG0_AFEM1_AFEM1_ASEM1_CLR1_CADS0_DTLA0_DTLB0_DTVA0_DTVB0_DTVSM0_DPLBn1_EPS1_ELFLR0_EMLLn1_FDSI0_GRPM1_GRVWA8_GRVWB8_GSUn1_GSUAMB_GSUC0_GSUWGMRR0_GLS0_ISA1200_IU4_K1_LDSTI0_LBSPPA256_LBSPPB1024_LBSPPM0_LPA16_LPB32_LPM0_LRVW8_LWPMn1_MIAV1_MIWT2_2_MO40_MGRIPMn1_NTn1_NTA0_NTB0_NTC0_NTD0_NTM0_NEPBS0_NLCA1_NLCB1_ONLL0_PGR1_PLR1_PKA0_SGROBn1_SIA2_SS0_SU32_SUM0_SUS256_SPO0_SRVW0_SSO0_SVW8_SK0_SKFTR0_SKXCCM0_SGRO0_TIN0_TLDS1_TLDSM1_ULSGRO0_USL1_UIOFGRO0_USFGROn1_VSn1_VWA2_VWB2_WSGRA0_WSGRB0_WS32_WG32_4_1_WGM8_WGMXCC1_WGMXCCGn1
    SolutionIndex: 27
    SolutionNameMin: Cijk_Alik_Bjlk_BSS_BH_Bias_HA_S_SAB_SCD_SAV_UserArgs_MT128x32x64_MI16x16x1_SN_LDSB1_AFC1_AG0_AFEM1_AFEM1_ASEM1_CLR1_CADS0_DTLA0_DTLB0_DTVA0_DTVB0_DTVSM0_DPLBn1_EPS0_ELFLR0_EMLLn1_FDSI0_GRPM1_GRVWA8_GRVWB8_GSUn1_GSUAMB_GSUC0_GSUWGMRR0_GLS0_ISA1200_IU4_K1_LDSTI0_LBSPPA512_LBSPPB512_LBSPPM0_LPA16_LPB16_LPM0_LRVW8_LWPMn1_MIAV1_MIWT4_1_MO40_MGRIPMn1_NTn1_NTA0_NTB0_NTC0_NTD0_NTM0_NEPBS0_NLCA1_NLCB1_ONLL0_PGR2_PLR1_PKA0_SGROBn1_SIA2_SS0_SU32_SUM0_SUS256_SPO0_SRVW0_SSO0_SVW8_SK0_SKFTR0_SKXCCM0_SGRO0_TIN0_TLDS1_TLDSM1_ULSGRO1_USL1_UIOFGRO0_USFGROn1_VSn1_VWA4_VWB1_WSGRA0_WSGRB0_WS32_WG32_4_1_WGM8_WGMXCC1_WGMXCCGn1
    SolutionIndex: 28
    SolutionNameMin: Cijk_Alik_Bjlk_BSS_BH_Bias_HA_S_SAB_SCD_SAV_UserArgs_MT64x64x64_MI16x16x1_SN_LDSB0_AFC1_AG0_AFEM1_AFEM1_ASEM64_CLR1_CADS0_DTLA0_DTLB0_DTVA1_DTVB1_DTVSM0_DPLBn1_EPS0_ELFLR0_EMLLn1_FDSI0_GRPM1_GRVWA8_GRVWB8_GSUn1_GSUAMB_GSUC0_GSUWGMRR0_GLS0_ISA1200_IU1_K1_LDSTI0_LBSPPA0_LBSPPB0_LBSPPM0_LPA0_LPB0_LPM0_LRVW8_LWPMn1_MIAV1_MIWT2_2_MO40_MGRIPMn1_NTn1_NTA0_NTB0_NTC0_NTD0_NTM0_NEPBS0_NLCA4_NLCB4_ONLL0_PGR1_PLR0_PKA0_SGROBn1_SIA3_SS0_SU32_SUM0_SUS256_SPO0_SRVW0_SSO0_SVW8_SK0_SKFTR0_SKXCCM0_SGRO0_TIN0_TLDS1_TLDSM1_ULSGRO0_USL1_UIOFGRO0_USFGROn1_VSn1_VWA2_VWB1_WSGRA0_WSGRB0_WS32_WG32_4_1_WGM8_WGMXCC1_WGMXCCGn1
    SolutionIndex: 29
    SolutionNameMin: Cijk_Alik_Bjlk_BSS_BH_Bias_HA_S_SAB_SCD_SAV_UserArgs_MT64x64x64_MI16x16x1_SN_LDSB0_AFC1_AG0_AFEM1_AFEM1_ASEM1_CLR1_CADS0_DTLA0_DTLB0_DTVA0_DTVB1_DTVSM0_DPLBn1_EPS0_ELFLR0_EMLLn1_FDSI0_GRPM1_GRVWA8_GRVWB8_GSUn1_GSUAMB_GSUC0_GSUWGMRR0_GLS0_ISA1200_IU1_K1_LDSTI0_LBSPPA256_LBSPPB0_LBSPPM0_LPA16_LPB0_LPM0_LRVW8_LWPMn1_MIAV1_MIWT2_2_MO40_MGRIPMn1_NTn1_NTA0_NTB0_NTC0_NTD0_NTM0_NEPBS0_NLCA1_NLCB4_ONLL0_PGR2_PLR1_PKA0_SGROBn1_SIA3_SS0_SU32_SUM0_SUS256_SPO0_SRVW0_SSO0_SVW8_SK0_SKFTR0_SKXCCM0_SGRO0_TIN0_TLDS1_TLDSM1_ULSGRO0_USL1_UIOFGRO0_USFGROn1_VSn1_VWA2_VWB1_WSGRA0_WSGRB0_WS32_WG32_4_1_WGM8_WGMXCC1_WGMXCCGn1
    SolutionIndex: 30
    SolutionNameMin: Cijk_Alik_Bjlk_BSS_BH_Bias_HA_S_SAB_SCD_SAV_UserArgs_MT64x64x64_MI16x16x1_SN_LDSB1_AFC1_AG0_AFEM1_AFEM1_ASEM1_CLR1_CADS0_DTLA0_DTLB0_DTVA0_DTVB0_DTVSM0_DPLBn1_EPS0_ELFLR0_EMLLn1_FDSI0_GRPM1_GRVWA8_GRVWB8_GSUn1_GSUAMB_GSUC0_GSUWGMRR0_GLS0_ISA1200_IU4_K1_LDSTI0_LBSPPA256_LBSPPB1024_LBSPPM0_LPA16_LPB32_LPM0_LRVW8_LWPMn1_MIAV1_MIWT2_2_MO40_MGRIPMn1_NTn1_NTA0_NTB0_NTC0_NTD0_NTM0_NEPBS0_NLCA1_NLCB1_ONLL0_PGR2_PLR1_PKA0_SGROBn1_SIA2_SS0_SU32_SUM0_SUS256_SPO0_SRVW0_SSO0_SVW8_SK0_SKFTR0_SKXCCM0_SGRO0_TIN0_TLDS1_TLDSM1_ULSGRO0_USL1_UIOFGRO0_USFGROn1_VSn1_VWA2_VWB2_WSGRA0_WSGRB0_WS32_WG32_4_1_WGM8_WGMXCC1_WGMXCCGn1
    SolutionIndex: 31
    SolutionNameMin: Cijk_Alik_Bjlk_BSS_BH_Bias_HA_S_SAB_SCD_SAV_UserArgs_MT64x64x32_MI16x16x1_SN_LDSB0_AFC1_AG0_AFEM1_AFEM1_ASEM1_CLR1_CADS0_DTLA0_DTLB0_DTVA0_DTVB1_DTVSM0_DPLBn1_EPS1_ELFLR0_EMLLn1_FDSI0_GRPM1_GRVWA8_GRVWB8_GSUn1_GSUAMB_GSUC0_GSUWGMRR0_GLS0_ISA1200_IU1_K1_LDSTI0_LBSPPA128_LBSPPB0_LBSPPM0_LPA16_LPB0_LPM0_LRVW8_LWPMn1_MIAV1_MIWT2_2_MO40_MGRIPMn1_NTn1_NTA0_NTB0_NTC0_NTD0_NTM0_NEPBS0_NLCA1_NLCB2_ONLL0_PGR1_PLR1_PKA0_SGROBn1_SIA3_SS0_SU32_SUM0_SUS256_SPO0_SRVW0_SSO0_SVW8_SK0_SKFTR0_SKXCCM0_SGRO0_TIN0_TLDS1_TLDSM1_ULSGRO0_USL1_UIOFGRO0_USFGROn1_VSn1_VWA2_VWB1_WSGRA0_WSGRB0_WS32_WG32_4_1_WGM8_WGMXCC1_WGMXCCGn1
    SolutionIndex: 32
    SolutionNameMin: Cijk_Alik_Bjlk_BSS_BH_Bias_HA_S_SAB_SCD_SAV_UserArgs_MT16x16x64_MI16x16x1_SN_LDSB0_AFC1_AG0_AFEM1_AFEM1_ASEM1_CLR1_CADS0_DTLA0_DTLB0_DTVA0_DTVB1_DTVSM0_DPLBn1_EPS0_ELFLR0_EMLLn1_FDSI0_GRPM1_GRVWA8_GRVWB8_GSUn1_GSUAMB_GSUC0_GSUWGMRR0_GLS0_ISA1200_IU1_K1_LDSTI0_LBSPPA128_LBSPPB0_LBSPPM0_LPA16_LPB0_LPM0_LRVW8_LWPMn1_MIAV1_MIWT1_1_MO40_MGRIPMn1_NTn1_NTA0_NTB0_NTC0_NTD0_NTM0_NEPBS0_NLCA1_NLCB1_ONLL0_PGR2_PLR1_PKA0_SGROBn1_SIA3_SS0_SU32_SUM0_SUS256_SPO0_SRVW0_SSO0_SVW8_SK0_SKFTR0_SKXCCM0_SGRO0_TIN0_TLDS1_TLDSM1_ULSGRO0_USL1_UIOFGRO0_USFGROn1_VSn1_VWA1_VWB1_WSGRA0_WSGRB0_WS32_WG16_2_1_WGM8_WGMXCC1_WGMXCCGn1
    SolutionIndex: 33
    SolutionNameMin: Cijk_Alik_Bjlk_BSS_BH_Bias_HA_S_SAB_SCD_SAV_UserArgs_MT32x16x64_MI16x16x1_SN_LDSB0_AFC1_AG0_AFEM1_AFEM1_ASEM1_CLR1_CADS0_DTLA0_DTLB0_DTVA0_DTVB0_DTVSM0_DPLBn1_EPS1_ELFLR0_EMLLn1_FDSI0_GRPM1_GRVWA8_GRVWB8_GSUn1_GSUAMB_GSUC0_GSUWGMRR0_GLS0_ISA1200_IU1_K1_LDSTI0_LBSPPA128_LBSPPB256_LBSPPM0_LPA16_LPB16_LPM0_LRVW8_LWPMn1_MIAV1_MIWT1_1_MO40_MGRIPMn1_NTn1_NTA0_NTB0_NTC0_NTD0_NTM0_NEPBS0_NLCA1_NLCB1_ONLL0_PGR1_PLR1_PKA0_SGROBn1_SIA3_SS0_SU32_SUM0_SUS256_SPO0_SRVW0_SSO0_SVW8_SK0_SKFTR0_SKXCCM0_SGRO0_TIN0_TLDS1_TLDSM1_ULSGRO0_USL1_UIOFGRO0_USFGROn1_VSn1_VWA1_VWB1_WSGRA0_WSGRB0_WS32_WG32_2_1_WGM8_WGMXCC1_WGMXCCGn1
    SolutionIndex: 34
    SolutionNameMin: Cijk_Alik_Bjlk_BSS_BH_Bias_HA_S_SAB_SCD_SAV_UserArgs_MT32x32x32_MI16x16x1_SN_LDSB0_AFC1_AG0_AFEM1_AFEM1_ASEM32_CLR1_CADS0_DTLA0_DTLB0_DTVA1_DTVB1_DTVSM0_DPLBn1_EPS0_ELFLR0_EMLLn1_FDSI0_GRPM1_GRVWA8_GRVWB8_GSUn1_GSUAMB_GSUC0_GSUWGMRR0_GLS0_ISA1200_IU1_K1_LDSTI0_LBSPPA0_LBSPPB0_LBSPPM0_LPA0_LPB0_LPM0_LRVW8_LWPMn1_MIAV1_MIWT1_1_MO40_MGRIPMn1_NTn1_NTA0_NTB0_NTC0_NTD0_NTM0_NEPBS0_NLCA2_NLCB1_ONLL0_PGR1_PLR0_PKA0_SGROBn1_SIA3_SS0_SU32_SUM0_SUS256_SPO0_SRVW0_SSO0_SVW8_SK0_SKFTR0_SKXCCM0_SGRO0_TIN0_TLDS1_TLDSM1_ULSGRO0_USL1_UIOFGRO0_USFGROn1_VSn1_VWA1_VWB1_WSGRA0_WSGRB0_WS32_WG32_4_1_WGM8_WGMXCC1_WGMXCCGn1
    SolutionIndex: 35
    SolutionNameMin: Cijk_Alik_Bjlk_BSS_BH_Bias_HA_S_SAB_SCD_SAV_UserArgs_MT32x16x64_MI16x16x1_SN_LDSB0_AFC1_AG0_AFEM1_AFEM1_ASEM1_CLR1_CADS0_DTLA0_DTLB0_DTVA0_DTVB1_DTVSM0_DPLBn1_EPS0_ELFLR0_EMLLn1_FDSI0_GRPM1_GRVWA8_GRVWB8_GSUn1_GSUAMB_GSUC0_GSUWGMRR0_GLS0_ISA1200_IU1_K1_LDSTI0_LBSPPA128_LBSPPB0_LBSPPM0_LPA16_LPB0_LPM0_LRVW8_LWPMn1_MIAV1_MIWT1_1_MO40_MGRIPMn1_NTn1_NTA0_NTB0_NTC0_NTD0_NTM0_NEPBS0_NLCA1_NLCB1_ONLL0_PGR2_PLR1_PKA0_SGROBn1_SIA3_SS1_SU32_SUM0_SUS256_SPO0_SRVW0_SSO0_SVW1_SK0_SKFTR0_SKXCCM0_SGRO0_TIN0_TLDS1_TLDSM1_ULSGRO0_USL1_UIOFGRO0_USFGROn1_VSn1_VWA1_VWB1_WSGRA0_WSGRB0_WS32_WG32_2_1_WGM8_WGMXCC1_WGMXCCGn1
    SolutionIndex: 36
    SolutionNameMin: Cijk_Alik_Bjlk_BSS_BH_Bias_HA_S_SAB_SCD_SAV_UserArgs_MT64x64x64_MI16x16x1_SN_LDSB0_AFC1_AG0_AFEM1_AFEM1_ASEM1_CLR1_CADS0_DTLA0_DTLB0_DTVA0_DTVB1_DTVSM0_DPLBn1_EPS0_ELFLR0_EMLLn1_FDSI0_GRPM1_GRVWA8_GRVWB8_GSUn1_GSUAMB_GSUC0_GSUWGMRR0_GLS0_ISA1200_IU1_K1_LDSTI0_LBSPPA256_LBSPPB0_LBSPPM0_LPA16_LPB0_LPM0_LRVW8_LWPMn1_MIAV1_MIWT2_2_MO40_MGRIPMn1_NTn1_NTA0_NTB0_NTC0_NTD0_NTM0_NEPBS0_NLCA1_NLCB4_ONLL0_PGR2_PLR1_PKA0_SGROBn1_SIA3_SS1_SU32_SUM0_SUS256_SPO0_SRVW0_SSO0_SVW2_SK0_SKFTR0_SKXCCM0_SGRO0_TIN0_TLDS1_TLDSM1_ULSGRO0_USL1_UIOFGRO0_USFGROn1_VSn1_VWA2_VWB1_WSGRA0_WSGRB0_WS32_WG32_4_1_WGM8_WGMXCC1_WGMXCCGn1
    SolutionIndex: 37
    SolutionNameMin: Cijk_Alik_Bjlk_BSS_BH_Bias_HA_S_SAB_SCD_SAV_UserArgs_MT64x64x64_MI16x16x1_SN_LDSB1_AFC1_AG0_AFEM1_AFEM1_ASEM1_CLR1_CADS0_DTLA0_DTLB0_DTVA0_DTVB0_DTVSM0_DPLBn1_EPS0_ELFLR0_EMLLn1_FDSI0_GRPM1_GRVWA8_GRVWB8_GSUn1_GSUAMB_GSUC0_GSUWGMRR0_GLS0_ISA1200_IU4_K1_LDSTI0_LBSPPA256_LBSPPB1024_LBSPPM0_LPA16_LPB32_LPM0_LRVW8_LWPMn1_MIAV1_MIWT2_2_MO40_MGRIPMn1_NTn1_NTA0_NTB0_NTC0_NTD0_NTM0_NEPBS0_NLCA1_NLCB1_ONLL0_PGR2_PLR1_PKA0_SGROBn1_SIA2_SS1_SU32_SUM0_SUS256_SPO0_SRVW0_SSO0_SVW2_SK0_SKFTR0_SKXCCM0_SGRO0_TIN0_TLDS1_TLDSM1_ULSGRO1_USL1_UIOFGRO0_USFGROn1_VSn1_VWA2_VWB2_WSGRA0_WSGRB0_WS32_WG32_4_1_WGM8_WGMXCC1_WGMXCCGn1
    SolutionIndex: 38
    SolutionNameMin: Cijk_Alik_Bjlk_BSS_BH_Bias_HA_S_SAB_SCD_SAV_UserArgs_MT32x128x32_MI16x16x1_SN_LDSB1_AFC1_AG0_AFEM1_AFEM1_ASEM1_CLR1_CADS0_DTLA0_DTLB0_DTVA0_DTVB0_DTVSM0_DPLBn1_EPS0_ELFLR0_EMLLn1_FDSI0_GRPM1_GRVWA8_GRVWB8_GSUn1_GSUAMB_GSUC0_GSUWGMRR0_GLS0_ISA1200_IU2_K1_LDSTI0_LBSPPA128_LBSPPB2048_LBSPPM0_LPA16_LPB0_LPM0_LRVW8_LWPMn1_MIAV1_MIWT1_4_MO40_MGRIPMn1_NTn1_NTA0_NTB0_NTC0_NTD0_NTM0_NEPBS0_NLCA1_NLCB1_ONLL0_PGR2_PLR1_PKA0_SGROBn1_SIA2_SS0_SU32_SUM0_SUS256_SPO0_SRVW0_SSO0_SVW8_SK0_SKFTR0_SKXCCM0_SGRO0_TIN0_TLDS1_TLDSM1_ULSGRO0_USL1_UIOFGRO0_USFGROn1_VSn1_VWA1_VWB4_WSGRA0_WSGRB0_WS32_WG32_4_1_WGM8_WGMXCC1_WGMXCCGn1
    SolutionIndex: 39
    SolutionNameMin: Cijk_Alik_Bjlk_BSS_BH_Bias_HA_S_SAB_SCD_SAV_UserArgs_MT64x64x16_MI16x16x1_SN_LDSB0_AFC1_AG0_AFEM1_AFEM1_ASEM16_CLR1_CADS0_DTLA0_DTLB0_DTVA1_DTVB1_DTVSM0_DPLBn1_EPS0_ELFLR0_EMLLn1_FDSI0_GRPM1_GRVWA8_GRVWB8_GSUn1_GSUAMB_GSUC0_GSUWGMRR0_GLS0_ISA1200_IU1_K1_LDSTI0_LBSPPA0_LBSPPB0_LBSPPM0_LPA0_LPB0_LPM0_LRVW8_LWPMn1_MIAV1_MIWT2_2_MO40_MGRIPMn1_NTn1_NTA0_NTB0_NTC0_NTD0_NTM0_NEPBS0_NLCA1_NLCB1_ONLL0_PGR1_PLR0_PKA0_SGROBn1_SIA3_SS0_SU32_SUM0_SUS256_SPO0_SRVW0_SSO0_SVW8_SK0_SKFTR0_SKXCCM0_SGRO0_TIN0_TLDS1_TLDSM1_ULSGRO0_USL1_UIOFGRO0_USFGROn1_VSn1_VWA2_VWB1_WSGRA0_WSGRB0_WS32_WG32_4_1_WGM8_WGMXCC1_WGMXCCGn1
    SolutionIndex: 40
    SolutionNameMin: Cijk_Alik_Bjlk_BSS_BH_Bias_HA_S_SAB_SCD_SAV_UserArgs_MT64x64x64_MI16x16x1_SN_LDSB0_AFC1_AG0_AFEM1_AFEM1_ASEM64_CLR1_CADS0_DTLA0_DTLB0_DTVA1_DTVB0_DTVSM0_DPLBn1_EPS0_ELFLR0_EMLLn1_FDSI0_GRPM1_GRVWA8_GRVWB8_GSUn1_GSUAMB_GSUC0_GSUWGMRR0_GLS0_ISA1200_IU1_K1_LDSTI0_LBSPPA0_LBSPPB1024_LBSPPM0_LPA0_LPB32_LPM0_LRVW8_LWPMn1_MIAV1_MIWT2_2_MO40_MGRIPMn1_NTn1_NTA0_NTB0_NTC0_NTD0_NTM0_NEPBS0_NLCA4_NLCB1_ONLL0_PGR2_PLR1_PKA0_SGROBn1_SIA3_SS0_SU32_SUM0_SUS256_SPO0_SRVW0_SSO0_SVW8_SK0_SKFTR0_SKXCCM0_SGRO0_TIN0_TLDS1_TLDSM1_ULSGRO0_USL1_UIOFGRO0_USFGROn1_VSn1_VWA2_VWB2_WSGRA0_WSGRB0_WS32_WG32_4_1_WGM8_WGMXCC1_WGMXCCGn1
    SolutionIndex: 41
    SolutionNameMin: Cijk_Alik_Bjlk_BSS_BH_Bias_HA_S_SAB_SCD_SAV_UserArgs_MT128x32x64_MI16x16x1_SN_LDSB0_AFC1_AG0_AFEM1_AFEM1_ASEM64_CLR1_CADS0_DTLA0_DTLB0_DTVA1_DTVB0_DTVSM0_DPLBn1_EPS1_ELFLR0_EMLLn1_FDSI0_GRPM1_GRVWA8_GRVWB8_GSUn1_GSUAMB_GSUC0_GSUWGMRR0_GLS0_ISA1200_IU1_K1_LDSTI0_LBSPPA0_LBSPPB512_LBSPPM0_LPA0_LPB16_LPM0_LRVW8_LWPMn1_MIAV1_MIWT4_1_MO40_MGRIPMn1_NTn1_NTA0_NTB0_NTC0_NTD0_NTM0_NEPBS0_NLCA4_NLCB1_ONLL0_PGR1_PLR1_PKA0_SGROBn1_SIA3_SS1_SU32_SUM0_SUS256_SPO0_SRVW0_SSO0_SVW4_SK0_SKFTR0_SKXCCM0_SGRO0_TIN0_TLDS1_TLDSM1_ULSGRO0_USL1_UIOFGRO0_USFGROn1_VSn1_VWA4_VWB1_WSGRA0_WSGRB0_WS32_WG32_4_1_WGM8_WGMXCC1_WGMXCCGn1
    SolutionIndex: 42
    SolutionNameMin: Cijk_Alik_Bjlk_BSS_BH_Bias_HA_S_SAB_SCD_SAV_UserArgs_MT16x32x64_MI16x16x1_SN_LDSB0_AFC1_AG0_AFEM1_AFEM1_ASEM1_CLR1_CADS0_DTLA0_DTLB0_DTVA0_DTVB1_DTVSM0_DPLBn1_EPS0_ELFLR0_EMLLn1_FDSI0_GRPM1_GRVWA8_GRVWB8_GSUn1_GSUAMB_GSUC0_GSUWGMRR0_GLS0_ISA1200_IU1_K1_LDSTI0_LBSPPA128_LBSPPB0_LBSPPM0_LPA16_LPB0_LPM0_LRVW8_LWPMn1_MIAV1_MIWT1_1_MO40_MGRIPMn1_NTn1_NTA0_NTB0_NTC0_NTD0_NTM0_NEPBS0_NLCA1_NLCB1_ONLL0_PGR2_PLR1_PKA0_SGROBn1_SIA3_SS0_SU32_SUM0_SUS256_SPO0_SRVW0_SSO0_SVW8_SK0_SKFTR0_SKXCCM0_SGRO0_TIN0_TLDS1_TLDSM1_ULSGRO0_USL1_UIOFGRO0_USFGROn1_VSn1_VWA1_VWB1_WSGRA0_WSGRB0_WS32_WG16_4_1_WGM8_WGMXCC1_WGMXCCGn1
    SolutionIndex: 43
    SolutionNameMin: Cijk_Alik_Bjlk_BSS_BH_Bias_HA_S_SAB_SCD_SAV_UserArgs_MT16x32x64_MI16x16x1_SN_LDSB0_AFC1_AG0_AFEM1_AFEM1_ASEM64_CLR1_CADS0_DTLA0_DTLB0_DTVA1_DTVB1_DTVSM0_DPLBn1_EPS0_ELFLR0_EMLLn1_FDSI0_GRPM1_GRVWA8_GRVWB8_GSUn1_GSUAMB_GSUC0_GSUWGMRR0_GLS0_ISA1200_IU1_K1_LDSTI0_LBSPPA0_LBSPPB0_LBSPPM0_LPA0_LPB0_LPM0_LRVW8_LWPMn1_MIAV1_MIWT1_1_MO40_MGRIPMn1_NTn1_NTA0_NTB0_NTC0_NTD0_NTM0_NEPBS0_NLCA4_NLCB1_ONLL0_PGR1_PLR0_PKA0_SGROBn1_SIA3_SS0_SU32_SUM0_SUS256_SPO0_SRVW0_SSO0_SVW8_SK0_SKFTR0_SKXCCM0_SGRO0_TIN0_TLDS1_TLDSM1_ULSGRO0_USL1_UIOFGRO0_USFGROn1_VSn1_VWA1_VWB1_WSGRA0_WSGRB0_WS32_WG16_4_1_WGM8_WGMXCC1_WGMXCCGn1
    SolutionIndex: 44
    SolutionNameMin: Cijk_Alik_Bjlk_BSS_BH_Bias_HA_S_SAB_SCD_SAV_UserArgs_MT64x64x32_MI16x16x1_SN_LDSB0_AFC1_AG0_AFEM1_AFEM1_ASEM1_CLR1_CADS0_DTLA0_DTLB0_DTVA0_DTVB1_DTVSM0_DPLBn1_EPS0_ELFLR0_EMLLn1_FDSI0_GRPM1_GRVWA8_GRVWB8_GSUn1_GSUAMB_GSUC0_GSUWGMRR0_GLS0_ISA1200_IU1_K1_LDSTI0_LBSPPA128_LBSPPB0_LBSPPM0_LPA16_LPB0_LPM0_LRVW8_LWPMn1_MIAV1_MIWT2_2_MO40_MGRIPMn1_NTn1_NTA0_NTB0_NTC0_NTD0_NTM0_NEPBS0_NLCA1_NLCB2_ONLL0_PGR2_PLR1_PKA0_SGROBn1_SIA3_SS0_SU32_SUM0_SUS256_SPO0_SRVW0_SSO0_SVW8_SK0_SKFTR0_SKXCCM0_SGRO0_TIN0_TLDS1_TLDSM1_ULSGRO0_USL1_UIOFGRO0_USFGROn1_VSn1_VWA2_VWB1_WSGRA0_WSGRB0_WS32_WG32_4_1_WGM8_WGMXCC1_WGMXCCGn1
    SolutionIndex: 45
    SolutionNameMin: Cijk_Alik_Bjlk_BSS_BH_Bias_HA_S_SAB_SCD_SAV_UserArgs_MT64x64x16_MI16x16x1_SN_LDSB1_AFC1_AG0_AFEM1_AFEM1_ASEM1_CLR1_CADS0_DTLA0_DTLB0_DTVA0_DTVB0_DTVSM0_DPLBn1_EPS0_ELFLR0_EMLLn1_FDSI0_GRPM1_GRVWA8_GRVWB8_GSUn1_GSUAMB_GSUC0_GSUWGMRR0_GLS0_ISA1200_IU1_K1_LDSTI0_LBSPPA128_LBSPPB1024_LBSPPM0_LPA16_LPB32_LPM0_LRVW8_LWPMn1_MIAV1_MIWT2_2_MO40_MGRIPMn1_NTn1_NTA0_NTB0_NTC0_NTD0_NTM0_NEPBS0_NLCA1_NLCB1_ONLL0_PGR2_PLR1_PKA0_SGROBn1_SIA2_SS0_SU32_SUM0_SUS256_SPO0_SRVW0_SSO0_SVW8_SK0_SKFTR0_SKXCCM0_SGRO0_TIN0_TLDS1_TLDSM1_ULSGRO0_USL1_UIOFGRO0_USFGROn1_VSn1_VWA2_VWB2_WSGRA0_WSGRB0_WS32_WG32_4_1_WGM8_WGMXCC1_WGMXCCGn1
    SolutionIndex: 46
    SolutionNameMin: Cijk_Alik_Bjlk_BSS_BH_Bias_HA_S_SAB_SCD_SAV_UserArgs_MT64x64x32_MI16x16x1_SN_LDSB0_AFC1_AG0_AFEM1_AFEM1_ASEM32_CLR1_CADS0_DTLA0_DTLB0_DTVA1_DTVB1_DTVSM0_DPLBn1_EPS0_ELFLR0_EMLLn1_FDSI0_GRPM1_GRVWA8_GRVWB8_GSUn1_GSUAMB_GSUC0_GSUWGMRR0_GLS0_ISA1200_IU1_K1_LDSTI0_LBSPPA0_LBSPPB0_LBSPPM0_LPA0_LPB0_LPM0_LRVW8_LWPMn1_MIAV1_MIWT2_2_MO40_MGRIPMn1_NTn1_NTA0_NTB0_NTC0_NTD0_NTM0_NEPBS0_NLCA2_NLCB2_ONLL0_PGR1_PLR0_PKA0_SGROBn1_SIA3_SS0_SU32_SUM0_SUS256_SPO0_SRVW0_SSO0_SVW8_SK0_SKFTR0_SKXCCM0_SGRO0_TIN0_TLDS1_TLDSM1_ULSGRO0_USL1_UIOFGRO0_USFGROn1_VSn1_VWA2_VWB1_WSGRA0_WSGRB0_WS32_WG32_4_1_WGM8_WGMXCC1_WGMXCCGn1
    SolutionIndex: 47
    SolutionNameMin: Cijk_Alik_Bjlk_BSS_BH_Bias_HA_S_SAB_SCD_SAV_UserArgs_MT64x64x16_MI16x16x1_SN_LDSB1_AFC1_AG0_AFEM1_AFEM1_ASEM1_CLR1_CADS0_DTLA0_DTLB0_DTVA0_DTVB0_DTVSM0_DPLBn1_EPS1_ELFLR0_EMLLn1_FDSI0_GRPM1_GRVWA8_GRVWB8_GSUn1_GSUAMB_GSUC0_GSUWGMRR0_GLS0_ISA1200_IU1_K1_LDSTI0_LBSPPA128_LBSPPB1024_LBSPPM0_LPA16_LPB32_LPM0_LRVW8_LWPMn1_MIAV1_MIWT2_2_MO40_MGRIPMn1_NTn1_NTA0_NTB0_NTC0_NTD0_NTM0_NEPBS0_NLCA1_NLCB1_ONLL0_PGR1_PLR1_PKA0_SGROBn1_SIA2_SS0_SU32_SUM0_SUS256_SPO0_SRVW0_SSO0_SVW8_SK0_SKFTR0_SKXCCM0_SGRO0_TIN0_TLDS1_TLDSM1_ULSGRO0_USL1_UIOFGRO0_USFGROn1_VSn1_VWA2_VWB2_WSGRA0_WSGRB0_WS32_WG32_4_1_WGM8_WGMXCC1_WGMXCCGn1
    SolutionIndex: 48
    SolutionNameMin: Cijk_Alik_Bjlk_BSS_BH_Bias_HA_S_SAB_SCD_SAV_UserArgs_MT128x32x64_MI16x16x1_SN_LDSB1_AFC1_AG0_AFEM1_AFEM1_ASEM1_CLR1_CADS0_DTLA0_DTLB0_DTVA0_DTVB0_DTVSM0_DPLBn1_EPS0_ELFLR0_EMLLn1_FDSI0_GRPM1_GRVWA8_GRVWB8_GSUn1_GSUAMB_GSUC0_GSUWGMRR0_GLS0_ISA1200_IU4_K1_LDSTI0_LBSPPA512_LBSPPB512_LBSPPM0_LPA16_LPB16_LPM0_LRVW8_LWPMn1_MIAV1_MIWT4_1_MO40_MGRIPMn1_NTn1_NTA0_NTB0_NTC0_NTD0_NTM0_NEPBS0_NLCA1_NLCB1_ONLL0_PGR2_PLR1_PKA0_SGROBn1_SIA2_SS1_SU32_SUM0_SUS256_SPO0_SRVW0_SSO0_SVW4_SK0_SKFTR0_SKXCCM0_SGRO0_TIN0_TLDS1_TLDSM1_ULSGRO1_USL1_UIOFGRO0_USFGROn1_VSn1_VWA4_VWB1_WSGRA0_WSGRB0_WS32_WG32_4_1_WGM8_WGMXCC1_WGMXCCGn1
    SolutionIndex: 49
    SolutionNameMin: Cijk_Alik_Bjlk_BSS_BH_Bias_HA_S_SAB_SCD_SAV_UserArgs_MT64x64x32_MI16x16x1_SN_LDSB0_AFC1_AG0_AFEM1_AFEM1_ASEM1_CLR1_CADS0_DTLA0_DTLB0_DTVA0_DTVB1_DTVSM0_DPLBn1_EPS1_ELFLR0_EMLLn1_FDSI0_GRPM1_GRVWA8_GRVWB8_GSUn1_GSUAMB_GSUC0_GSUWGMRR0_GLS0_ISA1200_IU1_K1_LDSTI0_LBSPPA128_LBSPPB0_LBSPPM0_LPA16_LPB0_LPM0_LRVW8_LWPMn1_MIAV1_MIWT2_2_MO40_MGRIPMn1_NTn1_NTA0_NTB0_NTC0_NTD0_NTM0_NEPBS0_NLCA1_NLCB2_ONLL0_PGR1_PLR1_PKA0_SGROBn1_SIA3_SS1_SU32_SUM0_SUS256_SPO0_SRVW0_SSO0_SVW2_SK0_SKFTR0_SKXCCM0_SGRO0_TIN0_TLDS1_TLDSM1_ULSGRO0_USL1_UIOFGRO0_USFGROn1_VSn1_VWA2_VWB1_WSGRA0_WSGRB0_WS32_WG32_4_1_WGM8_WGMXCC1_WGMXCCGn1
    SolutionIndex: 50
    SolutionNameMin: Cijk_Alik_Bjlk_BSS_BH_Bias_HA_S_SAB_SCD_SAV_UserArgs_MT64x64x32_MI16x16x1_SN_LDSB0_AFC1_AG0_AFEM1_AFEM1_ASEM1_CLR1_CADS0_DTLA0_DTLB0_DTVA0_DTVB0_DTVSM0_DPLBn1_EPS0_ELFLR0_EMLLn1_FDSI0_GRPM1_GRVWA8_GRVWB8_GSUn1_GSUAMB_GSUC0_GSUWGMRR0_GLS0_ISA1200_IU1_K1_LDSTI0_LBSPPA128_LBSPPB1024_LBSPPM0_LPA16_LPB32_LPM0_LRVW8_LWPMn1_MIAV1_MIWT2_2_MO40_MGRIPMn1_NTn1_NTA0_NTB0_NTC0_NTD0_NTM0_NEPBS0_NLCA1_NLCB1_ONLL0_PGR2_PLR1_PKA0_SGROBn1_SIA3_SS0_SU32_SUM0_SUS256_SPO0_SRVW0_SSO0_SVW8_SK0_SKFTR0_SKXCCM0_SGRO0_TIN0_TLDS1_TLDSM1_ULSGRO1_USL1_UIOFGRO0_USFGROn1_VSn1_VWA2_VWB2_WSGRA0_WSGRB0_WS32_WG32_4_1_WGM8_WGMXCC1_WGMXCCGn1
    SolutionIndex: 51
    SolutionNameMin: Cijk_Alik_Bjlk_BSS_BH_Bias_HA_S_SAB_SCD_SAV_UserArgs_MT64x64x64_MI16x16x1_SN_LDSB0_AFC1_AG0_AFEM1_AFEM1_ASEM1_CLR1_CADS0_DTLA0_DTLB0_DTVA0_DTVB1_DTVSM0_DPLBn1_EPS1_ELFLR0_EMLLn1_FDSI0_GRPM1_GRVWA8_GRVWB8_GSUn1_GSUAMB_GSUC0_GSUWGMRR0_GLS0_ISA1200_IU1_K1_LDSTI0_LBSPPA256_LBSPPB0_LBSPPM0_LPA16_LPB0_LPM0_LRVW8_LWPMn1_MIAV1_MIWT2_2_MO40_MGRIPMn1_NTn1_NTA0_NTB0_NTC0_NTD0_NTM0_NEPBS0_NLCA1_NLCB4_ONLL0_PGR1_PLR1_PKA0_SGROBn1_SIA3_SS0_SU32_SUM0_SUS256_SPO0_SRVW0_SSO0_SVW8_SK0_SKFTR0_SKXCCM0_SGRO0_TIN0_TLDS1_TLDSM1_ULSGRO0_USL1_UIOFGRO0_USFGROn1_VSn1_VWA2_VWB1_WSGRA0_WSGRB0_WS32_WG32_4_1_WGM8_WGMXCC1_WGMXCCGn1
    SolutionIndex: 52
    SolutionNameMin: Cijk_Alik_Bjlk_BSS_BH_Bias_HA_S_SAB_SCD_SAV_UserArgs_MT32x32x16_MI16x16x1_SN_LDSB1_AFC1_AG0_AFEM1_AFEM1_ASEM1_CLR1_CADS0_DTLA0_DTLB0_DTVA0_DTVB0_DTVSM0_DPLBn1_EPS0_ELFLR0_EMLLn1_FDSI0_GRPM1_GRVWA4_GRVWB4_GSUn1_GSUAMB_GSUC0_GSUWGMRR0_GLS0_ISA1200_IU1_K1_LDSTI0_LBSPPA128_LBSPPB512_LBSPPM0_LPA16_LPB16_LPM0_LRVW8_LWPMn1_MIAV1_MIWT1_1_MO40_MGRIPMn1_NTn1_NTA0_NTB0_NTC0_NTD0_NTM0_NEPBS0_NLCA1_NLCB1_ONLL0_PGR2_PLR1_PKA0_SGROBn1_SIA2_SS0_SU32_SUM0_SUS256_SPO0_SRVW0_SSO0_SVW8_SK0_SKFTR0_SKXCCM0_SGRO0_TIN0_TLDS1_TLDSM1_ULSGRO0_USL1_UIOFGRO0_USFGROn1_VSn1_VWA1_VWB1_WSGRA0_WSGRB0_WS32_WG32_4_1_WGM8_WGMXCC1_WGMXCCGn1
    SolutionIndex: 53
    SolutionNameMin: Cijk_Alik_Bjlk_BSS_BH_Bias_HA_S_SAB_SCD_SAV_UserArgs_MT16x32x64_MI16x16x1_SN_LDSB0_AFC1_AG0_AFEM1_AFEM1_ASEM1_CLR1_CADS0_DTLA0_DTLB0_DTVA0_DTVB0_DTVSM0_DPLBn1_EPS0_ELFLR0_EMLLn1_FDSI0_GRPM1_GRVWA8_GRVWB8_GSUn1_GSUAMB_GSUC0_GSUWGMRR0_GLS0_ISA1200_IU1_K1_LDSTI0_LBSPPA128_LBSPPB512_LBSPPM0_LPA16_LPB16_LPM0_LRVW8_LWPMn1_MIAV1_MIWT1_1_MO40_MGRIPMn1_NTn1_NTA0_NTB0_NTC0_NTD0_NTM0_NEPBS0_NLCA1_NLCB1_ONLL0_PGR2_PLR1_PKA0_SGROBn1_SIA3_SS0_SU32_SUM0_SUS256_SPO0_SRVW0_SSO0_SVW8_SK0_SKFTR0_SKXCCM0_SGRO0_TIN0_TLDS1_TLDSM1_ULSGRO1_USL1_UIOFGRO0_USFGROn1_VSn1_VWA1_VWB1_WSGRA0_WSGRB0_WS32_WG16_4_1_WGM8_WGMXCC1_WGMXCCGn1
    SolutionIndex: 54
    SolutionNameMin: Cijk_Alik_Bjlk_BSS_BH_Bias_HA_S_SAB_SCD_SAV_UserArgs_MT32x128x32_MI16x16x1_SN_LDSB0_AFC1_AG0_AFEM1_AFEM1_ASEM1_CLR1_CADS0_DTLA0_DTLB0_DTVA0_DTVB1_DTVSM0_DPLBn1_EPS1_ELFLR0_EMLLn1_FDSI0_GRPM1_GRVWA8_GRVWB8_GSUn1_GSUAMB_GSUC0_GSUWGMRR0_GLS0_ISA1200_IU1_K1_LDSTI0_LBSPPA128_LBSPPB0_LBSPPM0_LPA16_LPB0_LPM0_LRVW8_LWPMn1_MIAV1_MIWT1_4_MO40_MGRIPMn1_NTn1_NTA0_NTB0_NTC0_NTD0_NTM0_NEPBS0_NLCA1_NLCB2_ONLL0_PGR1_PLR1_PKA0_SGROBn1_SIA3_SS0_SU32_SUM0_SUS256_SPO0_SRVW0_SSO0_SVW8_SK0_SKFTR0_SKXCCM0_SGRO0_TIN0_TLDS1_TLDSM1_ULSGRO0_USL1_UIOFGRO0_USFGROn1_VSn1_VWA1_VWB1_WSGRA0_WSGRB0_WS32_WG32_4_1_WGM8_WGMXCC1_WGMXCCGn1
    SolutionIndex: 55
    SolutionNameMin: Cijk_Alik_Bjlk_BSS_BH_Bias_HA_S_SAB_SCD_SAV_UserArgs_MT32x128x32_MI16x16x1_SN_LDSB1_AFC1_AG0_AFEM1_AFEM1_ASEM1_CLR1_CADS0_DTLA0_DTLB0_DTVA0_DTVB0_DTVSM0_DPLBn1_EPS1_ELFLR0_EMLLn1_FDSI0_GRPM1_GRVWA8_GRVWB8_GSUn1_GSUAMB_GSUC0_GSUWGMRR0_GLS0_ISA1200_IU2_K1_LDSTI0_LBSPPA128_LBSPPB2048_LBSPPM0_LPA16_LPB0_LPM0_LRVW8_LWPMn1_MIAV1_MIWT1_4_MO40_MGRIPMn1_NTn1_NTA0_NTB0_NTC0_NTD0_NTM0_NEPBS0_NLCA1_NLCB1_ONLL0_PGR1_PLR1_PKA0_SGROBn1_SIA2_SS0_SU32_SUM0_SUS256_SPO0_SRVW0_SSO0_SVW8_SK0_SKFTR0_SKXCCM0_SGRO0_TIN0_TLDS1_TLDSM1_ULSGRO0_USL1_UIOFGRO0_USFGROn1_VSn1_VWA1_VWB4_WSGRA0_WSGRB0_WS32_WG32_4_1_WGM8_WGMXCC1_WGMXCCGn1
    SolutionIndex: 56
    SolutionNameMin: Cijk_Alik_Bjlk_BSS_BH_Bias_HA_S_SAB_SCD_SAV_UserArgs_MT64x64x64_MI16x16x1_SN_LDSB0_AFC1_AG0_AFEM1_AFEM1_ASEM64_CLR1_CADS0_DTLA0_DTLB0_DTVA1_DTVB0_DTVSM0_DPLBn1_EPS1_ELFLR0_EMLLn1_FDSI0_GRPM1_GRVWA8_GRVWB8_GSUn1_GSUAMB_GSUC0_GSUWGMRR0_GLS0_ISA1200_IU1_K1_LDSTI0_LBSPPA0_LBSPPB1024_LBSPPM0_LPA0_LPB32_LPM0_LRVW8_LWPMn1_MIAV1_MIWT2_2_MO40_MGRIPMn1_NTn1_NTA0_NTB0_NTC0_NTD0_NTM0_NEPBS0_NLCA4_NLCB1_ONLL0_PGR1_PLR1_PKA0_SGROBn1_SIA3_SS0_SU32_SUM0_SUS256_SPO0_SRVW0_SSO0_SVW8_SK0_SKFTR0_SKXCCM0_SGRO0_TIN0_TLDS1_TLDSM1_ULSGRO0_USL1_UIOFGRO0_USFGROn1_VSn1_VWA2_VWB2_WSGRA0_WSGRB0_WS32_WG32_4_1_WGM8_WGMXCC1_WGMXCCGn1
    SolutionIndex: 57
    SolutionNameMin: Cijk_Alik_Bjlk_BSS_BH_Bias_HA_S_SAB_SCD_SAV_UserArgs_MT64x64x64_MI16x16x1_SN_LDSB1_AFC1_AG0_AFEM1_AFEM1_ASEM1_CLR1_CADS0_DTLA0_DTLB0_DTVA0_DTVB0_DTVSM0_DPLBn1_EPS0_ELFLR0_EMLLn1_FDSI0_GRPM1_GRVWA8_GRVWB8_GSUn1_GSUAMB_GSUC0_GSUWGMRR0_GLS0_ISA1200_IU4_K1_LDSTI0_LBSPPA256_LBSPPB1024_LBSPPM0_LPA16_LPB32_LPM0_LRVW8_LWPMn1_MIAV1_MIWT2_2_MO40_MGRIPMn1_NTn1_NTA0_NTB0_NTC0_NTD0_NTM0_NEPBS0_NLCA1_NLCB1_ONLL0_PGR2_PLR1_PKA0_SGROBn1_SIA2_SS1_SU32_SUM0_SUS256_SPO0_SRVW0_SSO0_SVW2_SK0_SKFTR0_SKXCCM0_SGRO0_TIN0_TLDS1_TLDSM1_ULSGRO0_USL1_UIOFGRO0_USFGROn1_VSn1_VWA2_VWB2_WSGRA0_WSGRB0_WS32_WG32_4_1_WGM8_WGMXCC1_WGMXCCGn1
    SolutionIndex: 58
    SolutionNameMin: Cijk_Alik_Bjlk_BSS_BH_Bias_HA_S_SAB_SCD_SAV_UserArgs_MT64x64x64_MI16x16x1_SN_LDSB0_AFC1_AG0_AFEM1_AFEM1_ASEM64_CLR1_CADS0_DTLA0_DTLB0_DTVA1_DTVB0_DTVSM0_DPLBn1_EPS0_ELFLR0_EMLLn1_FDSI0_GRPM1_GRVWA8_GRVWB8_GSUn1_GSUAMB_GSUC0_GSUWGMRR0_GLS0_ISA1200_IU1_K1_LDSTI0_LBSPPA0_LBSPPB1024_LBSPPM0_LPA0_LPB32_LPM0_LRVW8_LWPMn1_MIAV1_MIWT2_2_MO40_MGRIPMn1_NTn1_NTA0_NTB0_NTC0_NTD0_NTM0_NEPBS0_NLCA4_NLCB1_ONLL0_PGR2_PLR1_PKA0_SGROBn1_SIA3_SS1_SU32_SUM0_SUS256_SPO0_SRVW0_SSO0_SVW2_SK0_SKFTR0_SKXCCM0_SGRO0_TIN0_TLDS1_TLDSM1_ULSGRO0_USL1_UIOFGRO0_USFGROn1_VSn1_VWA2_VWB2_WSGRA0_WSGRB0_WS32_WG32_4_1_WGM8_WGMXCC1_WGMXCCGn1
    SolutionIndex: 59
    SolutionNameMin: Cijk_Alik_Bjlk_BSS_BH_Bias_HA_S_SAB_SCD_SAV_UserArgs_MT64x64x32_MI16x16x1_SN_LDSB0_AFC1_AG0_AFEM1_AFEM1_ASEM1_CLR1_CADS0_DTLA0_DTLB0_DTVA0_DTVB0_DTVSM0_DPLBn1_EPS0_ELFLR0_EMLLn1_FDSI0_GRPM1_GRVWA8_GRVWB8_GSUn1_GSUAMB_GSUC0_GSUWGMRR0_GLS0_ISA1200_IU1_K1_LDSTI0_LBSPPA128_LBSPPB1024_LBSPPM0_LPA16_LPB32_LPM0_LRVW8_LWPMn1_MIAV1_MIWT2_2_MO40_MGRIPMn1_NTn1_NTA0_NTB0_NTC0_NTD0_NTM0_NEPBS0_NLCA1_NLCB1_ONLL0_PGR2_PLR1_PKA0_SGROBn1_SIA3_SS1_SU32_SUM0_SUS256_SPO0_SRVW0_SSO0_SVW2_SK0_SKFTR0_SKXCCM0_SGRO0_TIN0_TLDS1_TLDSM1_ULSGRO1_USL1_UIOFGRO0_USFGROn1_VSn1_VWA2_VWB2_WSGRA0_WSGRB0_WS32_WG32_4_1_WGM8_WGMXCC1_WGMXCCGn1
    SolutionIndex: 60
    SolutionNameMin: Cijk_Alik_Bjlk_BSS_BH_Bias_HA_S_SAB_SCD_SAV_UserArgs_MT32x128x64_MI16x16x1_SN_LDSB0_AFC1_AG0_AFEM1_AFEM1_ASEM1_CLR1_CADS0_DTLA0_DTLB0_DTVA0_DTVB1_DTVSM0_DPLBn1_EPS1_ELFLR0_EMLLn1_FDSI0_GRPM1_GRVWA8_GRVWB8_GSUn1_GSUAMB_GSUC0_GSUWGMRR0_GLS0_ISA1200_IU1_K1_LDSTI0_LBSPPA128_LBSPPB0_LBSPPM0_LPA16_LPB0_LPM0_LRVW8_LWPMn1_MIAV1_MIWT1_4_MO40_MGRIPMn1_NTn1_NTA0_NTB0_NTC0_NTD0_NTM0_NEPBS0_NLCA1_NLCB4_ONLL0_PGR1_PLR1_PKA0_SGROBn1_SIA3_SS0_SU32_SUM0_SUS256_SPO0_SRVW0_SSO0_SVW8_SK0_SKFTR0_SKXCCM0_SGRO0_TIN0_TLDS1_TLDSM1_ULSGRO0_USL1_UIOFGRO0_USFGROn1_VSn1_VWA1_VWB1_WSGRA0_WSGRB0_WS32_WG32_4_1_WGM8_WGMXCC1_WGMXCCGn1
    SolutionIndex: 61
    SolutionNameMin: Cijk_Alik_Bjlk_BSS_BH_Bias_HA_S_SAB_SCD_SAV_UserArgs_MT64x128x32_MI16x16x1_SN_LDSB1_AFC1_AG0_AFEM1_AFEM1_ASEM1_CLR1_CADS0_DTLA0_DTLB0_DTVA0_DTVB0_DTVSM0_DPLBn1_EPS0_ELFLR0_EMLLn1_FDSI0_GRPM1_GRVWA8_GRVWB8_GSUn1_GSUAMB_GSUC0_GSUWGMRR0_GLS0_ISA1200_IU2_K1_LDSTI0_LBSPPA128_LBSPPB2048_LBSPPM0_LPA16_LPB0_LPM0_LRVW8_LWPMn1_MIAV1_MIWT1_8_MO40_MGRIPMn1_NTn1_NTA0_NTB0_NTC0_NTD0_NTM0_NEPBS0_NLCA1_NLCB1_ONLL0_PGR2_PLR1_PKA0_SGROBn1_SIA2_SS0_SU32_SUM0_SUS256_SPO0_SRVW0_SSO0_SVW8_SK0_SKFTR0_SKXCCM0_SGRO0_TIN0_TLDS1_TLDSM1_ULSGRO1_USL1_UIOFGRO0_USFGROn1_VSn1_VWA1_VWB8_WSGRA0_WSGRB0_WS32_WG64_2_1_WGM8_WGMXCC1_WGMXCCGn1
    SolutionIndex: 62
    SolutionNameMin: Cijk_Alik_Bjlk_BSS_BH_Bias_HA_S_SAB_SCD_SAV_UserArgs_MT64x128x32_MI16x16x1_SN_LDSB0_AFC1_AG0_AFEM1_AFEM1_ASEM32_CLR1_CADS0_DTLA0_DTLB0_DTVA1_DTVB0_DTVSM0_DPLBn1_EPS1_ELFLR0_EMLLn1_FDSI0_GRPM1_GRVWA8_GRVWB8_GSUn1_GSUAMB_GSUC0_GSUWGMRR0_GLS0_ISA1200_IU1_K1_LDSTI0_LBSPPA0_LBSPPB2048_LBSPPM0_LPA0_LPB0_LPM0_LRVW8_LWPMn1_MIAV1_MIWT1_8_MO40_MGRIPMn1_NTn1_NTA0_NTB0_NTC0_NTD0_NTM0_NEPBS0_NLCA2_NLCB1_ONLL0_PGR1_PLR1_PKA0_SGROBn1_SIA3_SS0_SU32_SUM0_SUS256_SPO0_SRVW0_SSO0_SVW8_SK0_SKFTR0_SKXCCM0_SGRO0_TIN0_TLDS1_TLDSM1_ULSGRO0_USL1_UIOFGRO0_USFGROn1_VSn1_VWA1_VWB8_WSGRA0_WSGRB0_WS32_WG64_2_1_WGM8_WGMXCC1_WGMXCCGn1
    SolutionIndex: 63
    SolutionNameMin: Cijk_Alik_Bjlk_BSS_BH_Bias_HA_S_SAB_SCD_SAV_UserArgs_MT64x128x16_MI16x16x1_SN_LDSB0_AFC1_AG0_AFEM1_AFEM1_ASEM1_CLR0_CADS0_DTLA0_DTLB0_DTVA0_DTVB0_DTVSM0_DPLBn1_EPS0_ELFLR0_EMLLn1_FDSI0_GRPM1_GRVWA8_GRVWB8_GSUn1_GSUAMB_GSUC0_GSUWGMRR0_GLS0_ISA1200_IU1_K1_LDSTI0_LBSPPA128_LBSPPB2048_LBSPPM0_LPA16_LPB0_LPM0_LRVW8_LWPMn1_MIAV1_MIWT1_8_MO40_MGRIPMn1_NTn1_NTA0_NTB0_NTC0_NTD0_NTM0_NEPBS0_NLCA1_NLCB1_ONLL0_PGR2_PLR0_PKA0_SGROBn1_SIA3_SS0_SU32_SUM0_SUS256_SPO0_SRVW0_SSO0_SVW8_SK0_SKFTR0_SKXCCM0_SGRO0_TIN0_TLDS1_TLDSM1_ULSGRO1_USL1_UIOFGRO0_USFGROn1_VSn1_VWA1_VWB8_WSGRA0_WSGRB0_WS32_WG64_2_1_WGM8_WGMXCC1_WGMXCCGn1
    SolutionIndex: 64
    SolutionNameMin: Cijk_Alik_Bjlk_BSS_BH_Bias_HA_S_SAB_SCD_SAV_UserArgs_MT32x16x32_MI16x16x1_SN_LDSB0_AFC1_AG0_AFEM1_AFEM1_ASEM1_CLR1_CADS0_DTLA0_DTLB0_DTVA0_DTVB0_DTVSM0_DPLBn1_EPS0_ELFLR0_EMLLn1_FDSI0_GRPM1_GRVWA8_GRVWB8_GSUn1_GSUAMB_GSUC0_GSUWGMRR0_GLS0_ISA1200_IU1_K1_LDSTI0_LBSPPA128_LBSPPB256_LBSPPM0_LPA16_LPB16_LPM0_LRVW8_LWPMn1_MIAV1_MIWT1_1_MO40_MGRIPMn1_NTn1_NTA0_NTB0_NTC0_NTD0_NTM0_NEPBS0_NLCA1_NLCB1_ONLL0_PGR2_PLR1_PKA0_SGROBn1_SIA3_SS0_SU32_SUM0_SUS256_SPO0_SRVW0_SSO0_SVW8_SK0_SKFTR0_SKXCCM0_SGRO0_TIN0_TLDS1_TLDSM1_ULSGRO0_USL1_UIOFGRO0_USFGROn1_VSn1_VWA1_VWB1_WSGRA0_WSGRB0_WS32_WG32_2_1_WGM8_WGMXCC1_WGMXCCGn1
    SolutionIndex: 65
    SolutionNameMin: Cijk_Alik_Bjlk_BSS_BH_Bias_HA_S_SAB_SCD_SAV_UserArgs_MT64x64x32_MI16x16x1_SN_LDSB0_AFC1_AG0_AFEM1_AFEM1_ASEM1_CLR1_CADS0_DTLA0_DTLB0_DTVA0_DTVB0_DTVSM0_DPLBn1_EPS0_ELFLR0_EMLLn1_FDSI0_GRPM1_GRVWA8_GRVWB8_GSUn1_GSUAMB_GSUC0_GSUWGMRR0_GLS0_ISA1200_IU1_K1_LDSTI0_LBSPPA128_LBSPPB1024_LBSPPM0_LPA16_LPB32_LPM0_LRVW8_LWPMn1_MIAV1_MIWT2_2_MO40_MGRIPMn1_NTn1_NTA0_NTB0_NTC0_NTD0_NTM0_NEPBS0_NLCA1_NLCB1_ONLL0_PGR2_PLR1_PKA0_SGROBn1_SIA3_SS0_SU32_SUM0_SUS256_SPO0_SRVW0_SSO0_SVW8_SK0_SKFTR0_SKXCCM0_SGRO0_TIN0_TLDS1_TLDSM1_ULSGRO0_USL1_UIOFGRO0_USFGROn1_VSn1_VWA2_VWB2_WSGRA0_WSGRB0_WS32_WG32_4_1_WGM8_WGMXCC1_WGMXCCGn1
    SolutionIndex: 66
    SolutionNameMin: Cijk_Alik_Bjlk_BSS_BH_Bias_HA_S_SAB_SCD_SAV_UserArgs_MT128x32x32_MI16x16x1_SN_LDSB0_AFC1_AG0_AFEM1_AFEM1_ASEM1_CLR1_CADS0_DTLA0_DTLB0_DTVA0_DTVB1_DTVSM0_DPLBn1_EPS0_ELFLR0_EMLLn1_FDSI0_GRPM1_GRVWA8_GRVWB8_GSUn1_GSUAMB_GSUC0_GSUWGMRR0_GLS0_ISA1200_IU1_K1_LDSTI0_LBSPPA256_LBSPPB0_LBSPPM0_LPA16_LPB0_LPM0_LRVW8_LWPMn1_MIAV1_MIWT4_1_MO40_MGRIPMn1_NTn1_NTA0_NTB0_NTC0_NTD0_NTM0_NEPBS0_NLCA1_NLCB1_ONLL0_PGR2_PLR1_PKA0_SGROBn1_SIA3_SS0_SU32_SUM0_SUS256_SPO0_SRVW0_SSO0_SVW8_SK0_SKFTR0_SKXCCM0_SGRO0_TIN0_TLDS1_TLDSM1_ULSGRO0_USL1_UIOFGRO0_USFGROn1_VSn1_VWA4_VWB1_WSGRA0_WSGRB0_WS32_WG32_4_1_WGM8_WGMXCC1_WGMXCCGn1
    SolutionIndex: 67
    SolutionNameMin: Cijk_Alik_Bjlk_BSS_BH_Bias_HA_S_SAB_SCD_SAV_UserArgs_MT64x64x32_MI16x16x1_SN_LDSB0_AFC1_AG0_AFEM1_AFEM1_ASEM1_CLR1_CADS0_DTLA0_DTLB0_DTVA0_DTVB0_DTVSM0_DPLBn1_EPS1_ELFLR0_EMLLn1_FDSI0_GRPM1_GRVWA8_GRVWB8_GSUn1_GSUAMB_GSUC0_GSUWGMRR0_GLS0_ISA1200_IU1_K1_LDSTI0_LBSPPA128_LBSPPB1024_LBSPPM0_LPA16_LPB32_LPM0_LRVW8_LWPMn1_MIAV1_MIWT2_2_MO40_MGRIPMn1_NTn1_NTA0_NTB0_NTC0_NTD0_NTM0_NEPBS0_NLCA1_NLCB1_ONLL0_PGR1_PLR1_PKA0_SGROBn1_SIA3_SS0_SU32_SUM0_SUS256_SPO0_SRVW0_SSO0_SVW8_SK0_SKFTR0_SKXCCM0_SGRO0_TIN0_TLDS1_TLDSM1_ULSGRO0_USL1_UIOFGRO0_USFGROn1_VSn1_VWA2_VWB2_WSGRA0_WSGRB0_WS32_WG32_4_1_WGM8_WGMXCC1_WGMXCCGn1
    SolutionIndex: 68
    SolutionNameMin: Cijk_Alik_Bjlk_BSS_BH_Bias_HA_S_SAB_SCD_SAV_UserArgs_MT128x32x64_MI16x16x1_SN_LDSB1_AFC1_AG0_AFEM1_AFEM1_ASEM1_CLR1_CADS0_DTLA0_DTLB0_DTVA0_DTVB1_DTVSM0_DPLBn1_EPS0_ELFLR0_EMLLn1_FDSI0_GRPM1_GRVWA8_GRVWB8_GSUn1_GSUAMB_GSUC0_GSUWGMRR0_GLS0_ISA1200_IU1_K1_LDSTI0_LBSPPA512_LBSPPB0_LBSPPM0_LPA16_LPB0_LPM0_LRVW8_LWPMn1_MIAV1_MIWT4_1_MO40_MGRIPMn1_NTn1_NTA0_NTB0_NTC0_NTD0_NTM0_NEPBS0_NLCA1_NLCB1_ONLL0_PGR2_PLR1_PKA0_SGROBn1_SIA3_SS0_SU32_SUM0_SUS256_SPO0_SRVW0_SSO0_SVW8_SK0_SKFTR0_SKXCCM0_SGRO0_TIN0_TLDS1_TLDSM1_ULSGRO0_USL1_UIOFGRO0_USFGROn1_VSn1_VWA4_VWB1_WSGRA0_WSGRB0_WS32_WG32_4_1_WGM8_WGMXCC1_WGMXCCGn1
    SolutionIndex: 69
    SolutionNameMin: Cijk_Alik_Bjlk_BSS_BH_Bias_HA_S_SAB_SCD_SAV_UserArgs_MT64x64x32_MI16x16x1_SN_LDSB1_AFC1_AG0_AFEM1_AFEM1_ASEM1_CLR1_CADS0_DTLA0_DTLB0_DTVA0_DTVB0_DTVSM0_DPLBn1_EPS1_ELFLR0_EMLLn1_FDSI0_GRPM1_GRVWA8_GRVWB8_GSUn1_GSUAMB_GSUC0_GSUWGMRR0_GLS0_ISA1200_IU2_K1_LDSTI0_LBSPPA128_LBSPPB1024_LBSPPM0_LPA16_LPB32_LPM0_LRVW8_LWPMn1_MIAV1_MIWT2_2_MO40_MGRIPMn1_NTn1_NTA0_NTB0_NTC0_NTD0_NTM0_NEPBS0_NLCA1_NLCB1_ONLL0_PGR1_PLR1_PKA0_SGROBn1_SIA2_SS0_SU32_SUM0_SUS256_SPO0_SRVW0_SSO0_SVW8_SK0_SKFTR0_SKXCCM0_SGRO0_TIN0_TLDS1_TLDSM1_ULSGRO0_USL1_UIOFGRO0_USFGROn1_VSn1_VWA2_VWB2_WSGRA0_WSGRB0_WS32_WG32_4_1_WGM8_WGMXCC1_WGMXCCGn1
    SolutionIndex: 70
    SolutionNameMin: Cijk_Alik_Bjlk_BSS_BH_Bias_HA_S_SAB_SCD_SAV_UserArgs_MT128x32x32_MI16x16x1_SN_LDSB0_AFC1_AG0_AFEM1_AFEM1_ASEM1_CLR1_CADS0_DTLA0_DTLB0_DTVA0_DTVB1_DTVSM0_DPLBn1_EPS1_ELFLR0_EMLLn1_FDSI0_GRPM1_GRVWA8_GRVWB8_GSUn1_GSUAMB_GSUC0_GSUWGMRR0_GLS0_ISA1200_IU1_K1_LDSTI0_LBSPPA256_LBSPPB0_LBSPPM0_LPA16_LPB0_LPM0_LRVW8_LWPMn1_MIAV1_MIWT4_1_MO40_MGRIPMn1_NTn1_NTA0_NTB0_NTC0_NTD0_NTM0_NEPBS0_NLCA1_NLCB1_ONLL0_PGR1_PLR1_PKA0_SGROBn1_SIA3_SS1_SU32_SUM0_SUS256_SPO0_SRVW0_SSO0_SVW4_SK0_SKFTR0_SKXCCM0_SGRO0_TIN0_TLDS1_TLDSM1_ULSGRO0_USL1_UIOFGRO0_USFGROn1_VSn1_VWA4_VWB1_WSGRA0_WSGRB0_WS32_WG32_4_1_WGM8_WGMXCC1_WGMXCCGn1
    SolutionIndex: 71
    SolutionNameMin: Cijk_Alik_Bjlk_BSS_BH_Bias_HA_S_SAB_SCD_SAV_UserArgs_MT64x128x32_MI16x16x1_SN_LDSB0_AFC1_AG0_AFEM1_AFEM1_ASEM1_CLR1_CADS0_DTLA0_DTLB0_DTVA0_DTVB0_DTVSM0_DPLBn1_EPS0_ELFLR0_EMLLn1_FDSI0_GRPM1_GRVWA8_GRVWB8_GSUn1_GSUAMB_GSUC0_GSUWGMRR0_GLS0_ISA1200_IU1_K1_LDSTI0_LBSPPA128_LBSPPB2048_LBSPPM0_LPA16_LPB0_LPM0_LRVW8_LWPMn1_MIAV1_MIWT1_8_MO40_MGRIPMn1_NTn1_NTA0_NTB0_NTC0_NTD0_NTM0_NEPBS0_NLCA1_NLCB1_ONLL0_PGR2_PLR1_PKA0_SGROBn1_SIA3_SS0_SU32_SUM0_SUS256_SPO0_SRVW0_SSO0_SVW8_SK0_SKFTR0_SKXCCM0_SGRO0_TIN0_TLDS1_TLDSM1_ULSGRO0_USL1_UIOFGRO0_USFGROn1_VSn1_VWA1_VWB8_WSGRA0_WSGRB0_WS32_WG64_2_1_WGM8_WGMXCC1_WGMXCCGn1
    SolutionIndex: 72
    SolutionNameMin: Cijk_Alik_Bjlk_BSS_BH_Bias_HA_S_SAB_SCD_SAV_UserArgs_MT64x128x32_MI16x16x1_SN_LDSB0_AFC1_AG0_AFEM1_AFEM1_ASEM1_CLR1_CADS0_DTLA0_DTLB0_DTVA0_DTVB1_DTVSM0_DPLBn1_EPS1_ELFLR0_EMLLn1_FDSI0_GRPM1_GRVWA8_GRVWB8_GSUn1_GSUAMB_GSUC0_GSUWGMRR0_GLS0_ISA1200_IU1_K1_LDSTI0_LBSPPA128_LBSPPB0_LBSPPM0_LPA16_LPB0_LPM0_LRVW8_LWPMn1_MIAV1_MIWT1_8_MO40_MGRIPMn1_NTn1_NTA0_NTB0_NTC0_NTD0_NTM0_NEPBS0_NLCA1_NLCB2_ONLL0_PGR1_PLR1_PKA0_SGROBn1_SIA3_SS0_SU32_SUM0_SUS256_SPO0_SRVW0_SSO0_SVW8_SK0_SKFTR0_SKXCCM0_SGRO0_TIN0_TLDS1_TLDSM1_ULSGRO0_USL1_UIOFGRO0_USFGROn1_VSn1_VWA1_VWB1_WSGRA0_WSGRB0_WS32_WG64_2_1_WGM8_WGMXCC1_WGMXCCGn1
    SolutionIndex: 73
    SolutionNameMin: Cijk_Alik_Bjlk_BSS_BH_Bias_HA_S_SAB_SCD_SAV_UserArgs_MT128x32x16_MI16x16x1_SN_LDSB1_AFC1_AG0_AFEM1_AFEM1_ASEM1_CLR1_CADS0_DTLA0_DTLB0_DTVA0_DTVB0_DTVSM0_DPLBn1_EPS0_ELFLR0_EMLLn1_FDSI0_GRPM1_GRVWA4_GRVWB4_GSUn1_GSUAMB_GSUC0_GSUWGMRR0_GLS0_ISA1200_IU1_K1_LDSTI0_LBSPPA128_LBSPPB512_LBSPPM0_LPA16_LPB16_LPM0_LRVW8_LWPMn1_MIAV1_MIWT4_1_MO40_MGRIPMn1_NTn1_NTA0_NTB0_NTC0_NTD0_NTM0_NEPBS0_NLCA1_NLCB1_ONLL0_PGR2_PLR1_PKA0_SGROBn1_SIA2_SS1_SU32_SUM0_SUS256_SPO0_SRVW0_SSO0_SVW4_SK0_SKFTR0_SKXCCM0_SGRO0_TIN0_TLDS1_TLDSM1_ULSGRO1_USL1_UIOFGRO0_USFGROn1_VSn1_VWA4_VWB1_WSGRA0_WSGRB0_WS32_WG32_4_1_WGM8_WGMXCC1_WGMXCCGn1
    SolutionIndex: 74
    SolutionNameMin: Cijk_Alik_Bjlk_BSS_BH_Bias_HA_S_SAB_SCD_SAV_UserArgs_MT64x64x32_MI16x16x1_SN_LDSB1_AFC1_AG0_AFEM1_AFEM1_ASEM1_CLR1_CADS0_DTLA0_DTLB0_DTVA0_DTVB0_DTVSM0_DPLBn1_EPS0_ELFLR0_EMLLn1_FDSI0_GRPM1_GRVWA8_GRVWB8_GSUn1_GSUAMB_GSUC0_GSUWGMRR0_GLS0_ISA1200_IU2_K1_LDSTI0_LBSPPA128_LBSPPB1024_LBSPPM0_LPA16_LPB32_LPM0_LRVW8_LWPMn1_MIAV1_MIWT2_2_MO40_MGRIPMn1_NTn1_NTA0_NTB0_NTC0_NTD0_NTM0_NEPBS0_NLCA1_NLCB1_ONLL0_PGR2_PLR1_PKA0_SGROBn1_SIA2_SS0_SU32_SUM0_SUS256_SPO0_SRVW0_SSO0_SVW8_SK0_SKFTR0_SKXCCM0_SGRO0_TIN0_TLDS1_TLDSM1_ULSGRO1_USL1_UIOFGRO0_USFGROn1_VSn1_VWA2_VWB2_WSGRA0_WSGRB0_WS32_WG32_4_1_WGM8_WGMXCC1_WGMXCCGn1
    SolutionIndex: 75
    SolutionNameMin: Cijk_Alik_Bjlk_BSS_BH_Bias_HA_S_SAB_SCD_SAV_UserArgs_MT64x64x64_MI16x16x1_SN_LDSB0_AFC1_AG0_AFEM1_AFEM1_ASEM64_CLR1_CADS0_DTLA0_DTLB0_DTVA1_DTVB1_DTVSM0_DPLBn1_EPS0_ELFLR0_EMLLn1_FDSI0_GRPM1_GRVWA8_GRVWB8_GSUn1_GSUAMB_GSUC0_GSUWGMRR0_GLS0_ISA1200_IU1_K1_LDSTI0_LBSPPA0_LBSPPB0_LBSPPM0_LPA0_LPB0_LPM0_LRVW8_LWPMn1_MIAV1_MIWT2_2_MO40_MGRIPMn1_NTn1_NTA0_NTB0_NTC0_NTD0_NTM0_NEPBS0_NLCA4_NLCB4_ONLL0_PGR1_PLR0_PKA0_SGROBn1_SIA3_SS1_SU32_SUM0_SUS256_SPO0_SRVW0_SSO0_SVW2_SK0_SKFTR0_SKXCCM0_SGRO0_TIN0_TLDS1_TLDSM1_ULSGRO0_USL1_UIOFGRO0_USFGROn1_VSn1_VWA2_VWB1_WSGRA0_WSGRB0_WS32_WG32_4_1_WGM8_WGMXCC1_WGMXCCGn1
    SolutionIndex: 76
    SolutionNameMin: Cijk_Alik_Bjlk_BSS_BH_Bias_HA_S_SAB_SCD_SAV_UserArgs_MT32x128x32_MI16x16x1_SN_LDSB0_AFC1_AG0_AFEM1_AFEM1_ASEM1_CLR1_CADS0_DTLA0_DTLB0_DTVA0_DTVB1_DTVSM0_DPLBn1_EPS0_ELFLR0_EMLLn1_FDSI0_GRPM1_GRVWA8_GRVWB8_GSUn1_GSUAMB_GSUC0_GSUWGMRR0_GLS0_ISA1200_IU1_K1_LDSTI0_LBSPPA128_LBSPPB0_LBSPPM0_LPA16_LPB0_LPM0_LRVW8_LWPMn1_MIAV1_MIWT1_4_MO40_MGRIPMn1_NTn1_NTA0_NTB0_NTC0_NTD0_NTM0_NEPBS0_NLCA1_NLCB2_ONLL0_PGR2_PLR1_PKA0_SGROBn1_SIA3_SS0_SU32_SUM0_SUS256_SPO0_SRVW0_SSO0_SVW8_SK0_SKFTR0_SKXCCM0_SGRO0_TIN0_TLDS1_TLDSM1_ULSGRO0_USL1_UIOFGRO0_USFGROn1_VSn1_VWA1_VWB1_WSGRA0_WSGRB0_WS32_WG32_4_1_WGM8_WGMXCC1_WGMXCCGn1
    SolutionIndex: 77
    SolutionNameMin: Cijk_Alik_Bjlk_BSS_BH_Bias_HA_S_SAB_SCD_SAV_UserArgs_MT64x64x32_MI16x16x1_SN_LDSB0_AFC1_AG0_AFEM1_AFEM1_ASEM32_CLR1_CADS0_DTLA0_DTLB0_DTVA1_DTVB1_DTVSM0_DPLBn1_EPS0_ELFLR0_EMLLn1_FDSI0_GRPM1_GRVWA8_GRVWB8_GSUn1_GSUAMB_GSUC0_GSUWGMRR0_GLS0_ISA1200_IU1_K1_LDSTI0_LBSPPA0_LBSPPB0_LBSPPM0_LPA0_LPB0_LPM0_LRVW8_LWPMn1_MIAV1_MIWT2_2_MO40_MGRIPMn1_NTn1_NTA0_NTB0_NTC0_NTD0_NTM0_NEPBS0_NLCA2_NLCB2_ONLL0_PGR1_PLR0_PKA0_SGROBn1_SIA3_SS1_SU32_SUM0_SUS256_SPO0_SRVW0_SSO0_SVW2_SK0_SKFTR0_SKXCCM0_SGRO0_TIN0_TLDS1_TLDSM1_ULSGRO0_USL1_UIOFGRO0_USFGROn1_VSn1_VWA2_VWB1_WSGRA0_WSGRB0_WS32_WG32_4_1_WGM8_WGMXCC1_WGMXCCGn1
    SolutionIndex: 78
    SolutionNameMin: Cijk_Alik_Bjlk_BSS_BH_Bias_HA_S_SAB_SCD_SAV_UserArgs_MT16x128x32_MI16x16x1_SN_LDSB0_AFC1_AG0_AFEM1_AFEM1_ASEM1_CLR1_CADS0_DTLA0_DTLB0_DTVA0_DTVB1_DTVSM0_DPLBn1_EPS1_ELFLR0_EMLLn1_FDSI0_GRPM1_GRVWA8_GRVWB8_GSUn1_GSUAMB_GSUC0_GSUWGMRR0_GLS0_ISA1200_IU1_K1_LDSTI0_LBSPPA128_LBSPPB0_LBSPPM0_LPA16_LPB0_LPM0_LRVW8_LWPMn1_MIAV1_MIWT1_8_MO40_MGRIPMn1_NTn1_NTA0_NTB0_NTC0_NTD0_NTM0_NEPBS0_NLCA1_NLCB2_ONLL0_PGR1_PLR1_PKA0_SGROBn1_SIA3_SS0_SU32_SUM0_SUS256_SPO0_SRVW0_SSO0_SVW8_SK0_SKFTR0_SKXCCM0_SGRO0_TIN0_TLDS1_TLDSM1_ULSGRO0_USL1_UIOFGRO0_USFGROn1_VSn1_VWA1_VWB1_WSGRA0_WSGRB0_WS32_WG16_2_1_WGM8_WGMXCC1_WGMXCCGn1
    SolutionIndex: 79
    SolutionNameMin: Cijk_Alik_Bjlk_BSS_BH_Bias_HA_S_SAB_SCD_SAV_UserArgs_MT128x64x16_MI16x16x1_SN_LDSB0_AFC1_AG0_AFEM1_AFEM1_ASEM1_CLR0_CADS0_DTLA0_DTLB0_DTVA0_DTVB0_DTVSM0_DPLBn1_EPS0_ELFLR0_EMLLn1_FDSI0_GRPM1_GRVWA8_GRVWB8_GSUn1_GSUAMB_GSUC0_GSUWGMRR0_GLS0_ISA1200_IU1_K1_LDSTI0_LBSPPA256_LBSPPB1024_LBSPPM0_LPA16_LPB16_LPM0_LRVW8_LWPMn1_MIAV1_MIWT8_1_MO40_MGRIPMn1_NTn1_NTA0_NTB0_NTC0_NTD0_NTM0_NEPBS0_NLCA1_NLCB1_ONLL0_PGR2_PLR0_PKA0_SGROBn1_SIA3_SS1_SU32_SUM0_SUS256_SPO0_SRVW0_SSO0_SVW8_SK0_SKFTR0_SKXCCM0_SGRO0_TIN0_TLDS1_TLDSM1_ULSGRO1_USL1_UIOFGRO0_USFGROn1_VSn1_VWA8_VWB1_WSGRA0_WSGRB0_WS32_WG16_8_1_WGM8_WGMXCC1_WGMXCCGn1
    SolutionIndex: 80
    SolutionNameMin: Cijk_Alik_Bjlk_BSS_BH_Bias_HA_S_SAB_SCD_SAV_UserArgs_MT16x128x32_MI16x16x1_SN_LDSB0_AFC1_AG0_AFEM1_AFEM1_ASEM32_CLR1_CADS0_DTLA0_DTLB0_DTVA1_DTVB1_DTVSM0_DPLBn1_EPS0_ELFLR0_EMLLn1_FDSI0_GRPM1_GRVWA8_GRVWB8_GSUn1_GSUAMB_GSUC0_GSUWGMRR0_GLS0_ISA1200_IU1_K1_LDSTI0_LBSPPA0_LBSPPB0_LBSPPM0_LPA0_LPB0_LPM0_LRVW8_LWPMn1_MIAV1_MIWT1_8_MO40_MGRIPMn1_NTn1_NTA0_NTB0_NTC0_NTD0_NTM0_NEPBS0_NLCA2_NLCB2_ONLL0_PGR1_PLR0_PKA0_SGROBn1_SIA3_SS0_SU32_SUM0_SUS256_SPO0_SRVW0_SSO0_SVW8_SK0_SKFTR0_SKXCCM0_SGRO0_TIN0_TLDS1_TLDSM1_ULSGRO0_USL1_UIOFGRO0_USFGROn1_VSn1_VWA1_VWB1_WSGRA0_WSGRB0_WS32_WG16_2_1_WGM8_WGMXCC1_WGMXCCGn1
    SolutionIndex: 81
    SolutionNameMin: Cijk_Alik_Bjlk_BSS_BH_Bias_HA_S_SAB_SCD_SAV_UserArgs_MT128x32x32_MI16x16x1_SN_LDSB0_AFC1_AG0_AFEM1_AFEM1_ASEM32_CLR1_CADS0_DTLA0_DTLB0_DTVA1_DTVB0_DTVSM0_DPLBn1_EPS0_ELFLR0_EMLLn1_FDSI0_GRPM1_GRVWA8_GRVWB8_GSUn1_GSUAMB_GSUC0_GSUWGMRR0_GLS0_ISA1200_IU1_K1_LDSTI0_LBSPPA0_LBSPPB512_LBSPPM0_LPA0_LPB16_LPM0_LRVW8_LWPMn1_MIAV1_MIWT4_1_MO40_MGRIPMn1_NTn1_NTA0_NTB0_NTC0_NTD0_NTM0_NEPBS0_NLCA2_NLCB1_ONLL0_PGR2_PLR1_PKA0_SGROBn1_SIA3_SS1_SU32_SUM0_SUS256_SPO0_SRVW0_SSO0_SVW4_SK0_SKFTR0_SKXCCM0_SGRO0_TIN0_TLDS1_TLDSM1_ULSGRO0_USL1_UIOFGRO0_USFGROn1_VSn1_VWA4_VWB1_WSGRA0_WSGRB0_WS32_WG32_4_1_WGM8_WGMXCC1_WGMXCCGn1
    SolutionIndex: 82
    SolutionNameMin: Cijk_Alik_Bjlk_BSS_BH_Bias_HA_S_SAB_SCD_SAV_UserArgs_MT128x64x32_MI16x16x1_SN_LDSB0_AFC1_AG0_AFEM1_AFEM1_ASEM32_CLR1_CADS0_DTLA0_DTLB0_DTVA1_DTVB0_DTVSM0_DPLBn1_EPS1_ELFLR0_EMLLn1_FDSI0_GRPM1_GRVWA8_GRVWB8_GSUn1_GSUAMB_GSUC0_GSUWGMRR0_GLS0_ISA1200_IU1_K1_LDSTI0_LBSPPA0_LBSPPB1024_LBSPPM0_LPA0_LPB16_LPM0_LRVW8_LWPMn1_MIAV1_MIWT8_1_MO40_MGRIPMn1_NTn1_NTA0_NTB0_NTC0_NTD0_NTM0_NEPBS0_NLCA2_NLCB1_ONLL0_PGR1_PLR1_PKA0_SGROBn1_SIA3_SS1_SU32_SUM0_SUS256_SPO0_SRVW0_SSO0_SVW8_SK0_SKFTR0_SKXCCM0_SGRO0_TIN0_TLDS1_TLDSM1_ULSGRO0_USL1_UIOFGRO0_USFGROn1_VSn1_VWA8_VWB1_WSGRA0_WSGRB0_WS32_WG16_8_1_WGM8_WGMXCC1_WGMXCCGn1
    SolutionIndex: 83
    SolutionNameMin: Cijk_Alik_Bjlk_BSS_BH_Bias_HA_S_SAB_SCD_SAV_UserArgs_MT64x128x16_MI16x16x1_SN_LDSB0_AFC1_AG0_AFEM1_AFEM1_ASEM16_CLR1_CADS0_DTLA0_DTLB0_DTVA1_DTVB1_DTVSM0_DPLBn1_EPS0_ELFLR0_EMLLn1_FDSI0_GRPM1_GRVWA8_GRVWB8_GSUn1_GSUAMB_GSUC0_GSUWGMRR0_GLS0_ISA1200_IU1_K1_LDSTI0_LBSPPA0_LBSPPB0_LBSPPM0_LPA0_LPB0_LPM0_LRVW8_LWPMn1_MIAV1_MIWT1_8_MO40_MGRIPMn1_NTn1_NTA0_NTB0_NTC0_NTD0_NTM0_NEPBS0_NLCA1_NLCB1_ONLL0_PGR1_PLR0_PKA0_SGROBn1_SIA3_SS0_SU32_SUM0_SUS256_SPO0_SRVW0_SSO0_SVW8_SK0_SKFTR0_SKXCCM0_SGRO0_TIN0_TLDS1_TLDSM1_ULSGRO0_USL1_UIOFGRO0_USFGROn1_VSn1_VWA1_VWB1_WSGRA0_WSGRB0_WS32_WG64_2_1_WGM8_WGMXCC1_WGMXCCGn1
    SolutionIndex: 84
    SolutionNameMin: Cijk_Alik_Bjlk_BSS_BH_Bias_HA_S_SAB_SCD_SAV_UserArgs_MT16x32x32_MI16x16x1_SN_LDSB0_AFC1_AG0_AFEM1_AFEM1_ASEM32_CLR1_CADS0_DTLA0_DTLB0_DTVA1_DTVB1_DTVSM0_DPLBn1_EPS0_ELFLR0_EMLLn1_FDSI0_GRPM1_GRVWA8_GRVWB8_GSUn1_GSUAMB_GSUC0_GSUWGMRR0_GLS0_ISA1200_IU1_K1_LDSTI0_LBSPPA0_LBSPPB0_LBSPPM0_LPA0_LPB0_LPM0_LRVW8_LWPMn1_MIAV1_MIWT1_1_MO40_MGRIPMn1_NTn1_NTA0_NTB0_NTC0_NTD0_NTM0_NEPBS0_NLCA2_NLCB1_ONLL0_PGR1_PLR0_PKA0_SGROBn1_SIA3_SS0_SU32_SUM0_SUS256_SPO0_SRVW0_SSO0_SVW8_SK0_SKFTR0_SKXCCM0_SGRO0_TIN0_TLDS1_TLDSM1_ULSGRO0_USL1_UIOFGRO0_USFGROn1_VSn1_VWA1_VWB1_WSGRA0_WSGRB0_WS32_WG16_4_1_WGM8_WGMXCC1_WGMXCCGn1
    SolutionIndex: 85
    SolutionNameMin: Cijk_Alik_Bjlk_BSS_BH_Bias_HA_S_SAB_SCD_SAV_UserArgs_MT16x256x32_MI16x16x1_SN_LDSB0_AFC1_AG0_AFEM1_AFEM1_ASEM1_CLR1_CADS0_DTLA0_DTLB0_DTVA0_DTVB1_DTVSM0_DPLBn1_EPS0_ELFLR0_EMLLn1_FDSI0_GRPM1_GRVWA8_GRVWB8_GSUn1_GSUAMB_GSUC0_GSUWGMRR0_GLS0_ISA1200_IU1_K1_LDSTI0_LBSPPA128_LBSPPB0_LBSPPM0_LPA16_LPB0_LPM0_LRVW8_LWPMn1_MIAV1_MIWT1_8_MO40_MGRIPMn1_NTn1_NTA0_NTB0_NTC0_NTD0_NTM0_NEPBS0_NLCA1_NLCB2_ONLL0_PGR2_PLR1_PKA0_SGROBn1_SIA3_SS0_SU32_SUM0_SUS256_SPO0_SRVW0_SSO0_SVW8_SK0_SKFTR0_SKXCCM0_SGRO0_TIN0_TLDS1_TLDSM1_ULSGRO0_USL1_UIOFGRO0_USFGROn1_VSn1_VWA1_VWB1_WSGRA0_WSGRB0_WS32_WG16_4_1_WGM8_WGMXCC1_WGMXCCGn1
    SolutionIndex: 86
    SolutionNameMin: Cijk_Alik_Bjlk_BSS_BH_Bias_HA_S_SAB_SCD_SAV_UserArgs_MT64x64x16_MI16x16x1_SN_LDSB0_AFC1_AG0_AFEM1_AFEM1_ASEM16_CLR1_CADS0_DTLA0_DTLB0_DTVA1_DTVB1_DTVSM0_DPLBn1_EPS0_ELFLR0_EMLLn1_FDSI0_GRPM1_GRVWA8_GRVWB8_GSUn1_GSUAMB_GSUC0_GSUWGMRR0_GLS0_ISA1200_IU1_K1_LDSTI0_LBSPPA0_LBSPPB0_LBSPPM0_LPA0_LPB0_LPM0_LRVW8_LWPMn1_MIAV1_MIWT2_2_MO40_MGRIPMn1_NTn1_NTA0_NTB0_NTC0_NTD0_NTM0_NEPBS0_NLCA1_NLCB1_ONLL0_PGR1_PLR0_PKA0_SGROBn1_SIA3_SS1_SU32_SUM0_SUS256_SPO0_SRVW0_SSO0_SVW2_SK0_SKFTR0_SKXCCM0_SGRO0_TIN0_TLDS1_TLDSM1_ULSGRO0_USL1_UIOFGRO0_USFGROn1_VSn1_VWA2_VWB1_WSGRA0_WSGRB0_WS32_WG32_4_1_WGM8_WGMXCC1_WGMXCCGn1
    SolutionIndex: 87
    SolutionNameMin: Cijk_Alik_Bjlk_BSS_BH_Bias_HA_S_SAB_SCD_SAV_UserArgs_MT16x256x32_MI16x16x1_SN_LDSB0_AFC1_AG0_AFEM1_AFEM1_ASEM1_CLR1_CADS0_DTLA0_DTLB0_DTVA0_DTVB1_DTVSM0_DPLBn1_EPS1_ELFLR0_EMLLn1_FDSI0_GRPM1_GRVWA8_GRVWB8_GSUn1_GSUAMB_GSUC0_GSUWGMRR0_GLS0_ISA1200_IU1_K1_LDSTI0_LBSPPA128_LBSPPB0_LBSPPM0_LPA16_LPB0_LPM0_LRVW8_LWPMn1_MIAV1_MIWT1_8_MO40_MGRIPMn1_NTn1_NTA0_NTB0_NTC0_NTD0_NTM0_NEPBS0_NLCA1_NLCB2_ONLL0_PGR1_PLR1_PKA0_SGROBn1_SIA3_SS0_SU32_SUM0_SUS256_SPO0_SRVW0_SSO0_SVW8_SK0_SKFTR0_SKXCCM0_SGRO0_TIN0_TLDS1_TLDSM1_ULSGRO0_USL1_UIOFGRO0_USFGROn1_VSn1_VWA1_VWB1_WSGRA0_WSGRB0_WS32_WG16_4_1_WGM8_WGMXCC1_WGMXCCGn1
    SolutionIndex: 88
    SolutionNameMin: Cijk_Alik_Bjlk_BSS_BH_Bias_HA_S_SAB_SCD_SAV_UserArgs_MT128x128x32_MI16x16x1_SN_LDSB0_AFC1_AG0_AFEM1_AFEM1_ASEM1_CLR1_CADS0_DTLA0_DTLB0_DTVA0_DTVB1_DTVSM0_DPLBn1_EPS1_ELFLR0_EMLLn1_FDSI0_GRPM1_GRVWA8_GRVWB8_GSUn1_GSUAMB_GSUC0_GSUWGMRR0_GLS0_ISA1200_IU1_K1_LDSTI0_LBSPPA512_LBSPPB0_LBSPPM0_LPA16_LPB0_LPM0_LRVW8_LWPMn1_MIAV1_MIWT8_2_MO40_MGRIPMn1_NTn1_NTA0_NTB0_NTC0_NTD0_NTM0_NEPBS0_NLCA1_NLCB2_ONLL0_PGR1_PLR1_PKA0_SGROBn1_SIA3_SS1_SU32_SUM0_SUS256_SPO0_SRVW0_SSO0_SVW8_SK0_SKFTR0_SKXCCM0_SGRO0_TIN0_TLDS1_TLDSM1_ULSGRO0_USL1_UIOFGRO0_USFGROn1_VSn1_VWA8_VWB1_WSGRA0_WSGRB0_WS32_WG16_8_1_WGM8_WGMXCC1_WGMXCCGn1
    SolutionIndex: 89
    SolutionNameMin: Cijk_Alik_Bjlk_BSS_BH_Bias_HA_S_SAB_SCD_SAV_UserArgs_MT64x128x16_MI16x16x1_SN_LDSB1_AFC1_AG0_AFEM1_AFEM1_ASEM1_CLR1_CADS0_DTLA0_DTLB0_DTVA0_DTVB0_DTVSM0_DPLBn1_EPS0_ELFLR0_EMLLn1_FDSI0_GRPM1_GRVWA8_GRVWB8_GSUn1_GSUAMB_GSUC0_GSUWGMRR0_GLS0_ISA1200_IU1_K1_LDSTI0_LBSPPA128_LBSPPB2048_LBSPPM0_LPA16_LPB0_LPM0_LRVW8_LWPMn1_MIAV1_MIWT1_8_MO40_MGRIPMn1_NTn1_NTA0_NTB0_NTC0_NTD0_NTM0_NEPBS0_NLCA1_NLCB1_ONLL0_PGR2_PLR1_PKA0_SGROBn1_SIA2_SS0_SU32_SUM0_SUS256_SPO0_SRVW0_SSO0_SVW8_SK0_SKFTR0_SKXCCM0_SGRO0_TIN0_TLDS1_TLDSM1_ULSGRO0_USL1_UIOFGRO0_USFGROn1_VSn1_VWA1_VWB8_WSGRA0_WSGRB0_WS32_WG64_2_1_WGM8_WGMXCC1_WGMXCCGn1
    SolutionIndex: 90
    SolutionNameMin: Cijk_Alik_Bjlk_BSS_BH_Bias_HA_S_SAB_SCD_SAV_UserArgs_MT32x32x32_MI16x16x1_SN_LDSB0_AFC1_AG0_AFEM1_AFEM1_ASEM1_CLR1_CADS0_DTLA0_DTLB0_DTVA0_DTVB0_DTVSM0_DPLBn1_EPS0_ELFLR0_EMLLn1_FDSI0_GRPM1_GRVWA8_GRVWB8_GSUn1_GSUAMB_GSUC0_GSUWGMRR0_GLS0_ISA1200_IU1_K1_LDSTI0_LBSPPA128_LBSPPB512_LBSPPM0_LPA16_LPB16_LPM0_LRVW8_LWPMn1_MIAV1_MIWT1_1_MO40_MGRIPMn1_NTn1_NTA0_NTB0_NTC0_NTD0_NTM0_NEPBS0_NLCA1_NLCB1_ONLL0_PGR2_PLR1_PKA0_SGROBn1_SIA3_SS0_SU32_SUM0_SUS256_SPO0_SRVW0_SSO0_SVW8_SK0_SKFTR0_SKXCCM0_SGRO0_TIN0_TLDS1_TLDSM1_ULSGRO1_USL1_UIOFGRO0_USFGROn1_VSn1_VWA1_VWB1_WSGRA0_WSGRB0_WS32_WG32_4_1_WGM8_WGMXCC1_WGMXCCGn1
    SolutionIndex: 91
    SolutionNameMin: Cijk_Alik_Bjlk_BSS_BH_Bias_HA_S_SAB_SCD_SAV_UserArgs_MT64x64x32_MI16x16x1_SN_LDSB1_AFC1_AG0_AFEM1_AFEM1_ASEM1_CLR1_CADS0_DTLA0_DTLB0_DTVA0_DTVB0_DTVSM0_DPLBn1_EPS0_ELFLR0_EMLLn1_FDSI0_GRPM1_GRVWA8_GRVWB8_GSUn1_GSUAMB_GSUC0_GSUWGMRR0_GLS0_ISA1200_IU2_K1_LDSTI0_LBSPPA128_LBSPPB1024_LBSPPM0_LPA16_LPB32_LPM0_LRVW8_LWPMn1_MIAV1_MIWT2_2_MO40_MGRIPMn1_NTn1_NTA0_NTB0_NTC0_NTD0_NTM0_NEPBS0_NLCA1_NLCB1_ONLL0_PGR2_PLR1_PKA0_SGROBn1_SIA2_SS0_SU32_SUM0_SUS256_SPO0_SRVW0_SSO0_SVW8_SK0_SKFTR0_SKXCCM0_SGRO0_TIN0_TLDS1_TLDSM1_ULSGRO0_USL1_UIOFGRO0_USFGROn1_VSn1_VWA2_VWB2_WSGRA0_WSGRB0_WS32_WG32_4_1_WGM8_WGMXCC1_WGMXCCGn1
    SolutionIndex: 92
    SolutionNameMin: Cijk_Alik_Bjlk_BSS_BH_Bias_HA_S_SAB_SCD_SAV_UserArgs_MT64x128x32_MI16x16x1_SN_LDSB1_AFC1_AG0_AFEM1_AFEM1_ASEM1_CLR1_CADS0_DTLA0_DTLB0_DTVA0_DTVB0_DTVSM0_DPLBn1_EPS0_ELFLR0_EMLLn1_FDSI0_GRPM1_GRVWA8_GRVWB8_GSUn1_GSUAMB_GSUC0_GSUWGMRR0_GLS0_ISA1200_IU2_K1_LDSTI0_LBSPPA128_LBSPPB2048_LBSPPM0_LPA16_LPB0_LPM0_LRVW8_LWPMn1_MIAV1_MIWT1_8_MO40_MGRIPMn1_NTn1_NTA0_NTB0_NTC0_NTD0_NTM0_NEPBS0_NLCA1_NLCB1_ONLL0_PGR2_PLR1_PKA0_SGROBn1_SIA2_SS0_SU32_SUM0_SUS256_SPO0_SRVW0_SSO0_SVW8_SK0_SKFTR0_SKXCCM0_SGRO0_TIN0_TLDS1_TLDSM1_ULSGRO0_USL1_UIOFGRO0_USFGROn1_VSn1_VWA1_VWB8_WSGRA0_WSGRB0_WS32_WG64_2_1_WGM8_WGMXCC1_WGMXCCGn1
    SolutionIndex: 93
    SolutionNameMin: Cijk_Alik_Bjlk_BSS_BH_Bias_HA_S_SAB_SCD_SAV_UserArgs_MT64x128x16_MI16x16x1_SN_LDSB1_AFC1_AG0_AFEM1_AFEM1_ASEM1_CLR1_CADS0_DTLA0_DTLB0_DTVA0_DTVB0_DTVSM0_DPLBn1_EPS0_ELFLR0_EMLLn1_FDSI0_GRPM1_GRVWA8_GRVWB8_GSUn1_GSUAMB_GSUC0_GSUWGMRR0_GLS0_ISA1200_IU1_K1_LDSTI0_LBSPPA128_LBSPPB2048_LBSPPM0_LPA16_LPB0_LPM0_LRVW8_LWPMn1_MIAV1_MIWT1_8_MO40_MGRIPMn1_NTn1_NTA0_NTB0_NTC0_NTD0_NTM0_NEPBS0_NLCA1_NLCB1_ONLL0_PGR2_PLR1_PKA0_SGROBn1_SIA2_SS0_SU32_SUM0_SUS256_SPO0_SRVW0_SSO0_SVW8_SK0_SKFTR0_SKXCCM0_SGRO0_TIN0_TLDS1_TLDSM1_ULSGRO1_USL1_UIOFGRO0_USFGROn1_VSn1_VWA1_VWB8_WSGRA0_WSGRB0_WS32_WG64_2_1_WGM8_WGMXCC1_WGMXCCGn1
    SolutionIndex: 94
    SolutionNameMin: Cijk_Alik_Bjlk_BSS_BH_Bias_HA_S_SAB_SCD_SAV_UserArgs_MT16x128x32_MI16x16x1_SN_LDSB0_AFC1_AG0_AFEM1_AFEM1_ASEM1_CLR1_CADS0_DTLA0_DTLB0_DTVA0_DTVB1_DTVSM0_DPLBn1_EPS0_ELFLR0_EMLLn1_FDSI0_GRPM1_GRVWA8_GRVWB8_GSUn1_GSUAMB_GSUC0_GSUWGMRR0_GLS0_ISA1200_IU1_K1_LDSTI0_LBSPPA128_LBSPPB0_LBSPPM0_LPA16_LPB0_LPM0_LRVW8_LWPMn1_MIAV1_MIWT1_8_MO40_MGRIPMn1_NTn1_NTA0_NTB0_NTC0_NTD0_NTM0_NEPBS0_NLCA1_NLCB2_ONLL0_PGR2_PLR1_PKA0_SGROBn1_SIA3_SS0_SU32_SUM0_SUS256_SPO0_SRVW0_SSO0_SVW8_SK0_SKFTR0_SKXCCM0_SGRO0_TIN0_TLDS1_TLDSM1_ULSGRO0_USL1_UIOFGRO0_USFGROn1_VSn1_VWA1_VWB1_WSGRA0_WSGRB0_WS32_WG16_2_1_WGM8_WGMXCC1_WGMXCCGn1
    SolutionIndex: 95
    SolutionNameMin: Cijk_Alik_Bjlk_BSS_BH_Bias_HA_S_SAB_SCD_SAV_UserArgs_MT128x32x32_MI16x16x1_SN_LDSB0_AFC1_AG0_AFEM1_AFEM1_ASEM1_CLR1_CADS0_DTLA0_DTLB0_DTVA0_DTVB1_DTVSM0_DPLBn1_EPS0_ELFLR0_EMLLn1_FDSI0_GRPM1_GRVWA8_GRVWB8_GSUn1_GSUAMB_GSUC0_GSUWGMRR0_GLS0_ISA1200_IU1_K1_LDSTI0_LBSPPA256_LBSPPB0_LBSPPM0_LPA16_LPB0_LPM0_LRVW8_LWPMn1_MIAV1_MIWT4_1_MO40_MGRIPMn1_NTn1_NTA0_NTB0_NTC0_NTD0_NTM0_NEPBS0_NLCA1_NLCB1_ONLL0_PGR2_PLR1_PKA0_SGROBn1_SIA3_SS1_SU32_SUM0_SUS256_SPO0_SRVW0_SSO0_SVW4_SK0_SKFTR0_SKXCCM0_SGRO0_TIN0_TLDS1_TLDSM1_ULSGRO0_USL1_UIOFGRO0_USFGROn1_VSn1_VWA4_VWB1_WSGRA0_WSGRB0_WS32_WG32_4_1_WGM8_WGMXCC1_WGMXCCGn1
    SolutionIndex: 96
    SolutionNameMin: Cijk_Alik_Bjlk_BSS_BH_Bias_HA_S_SAB_SCD_SAV_UserArgs_MT64x128x32_MI16x16x1_SN_LDSB0_AFC1_AG0_AFEM1_AFEM1_ASEM32_CLR1_CADS0_DTLA0_DTLB0_DTVA1_DTVB0_DTVSM0_DPLBn1_EPS0_ELFLR0_EMLLn1_FDSI0_GRPM1_GRVWA8_GRVWB8_GSUn1_GSUAMB_GSUC0_GSUWGMRR0_GLS0_ISA1200_IU1_K1_LDSTI0_LBSPPA0_LBSPPB2048_LBSPPM0_LPA0_LPB0_LPM0_LRVW8_LWPMn1_MIAV1_MIWT1_8_MO40_MGRIPMn1_NTn1_NTA0_NTB0_NTC0_NTD0_NTM0_NEPBS0_NLCA2_NLCB1_ONLL0_PGR2_PLR1_PKA0_SGROBn1_SIA3_SS0_SU32_SUM0_SUS256_SPO0_SRVW0_SSO0_SVW8_SK0_SKFTR0_SKXCCM0_SGRO0_TIN0_TLDS1_TLDSM1_ULSGRO0_USL1_UIOFGRO0_USFGROn1_VSn1_VWA1_VWB8_WSGRA0_WSGRB0_WS32_WG64_2_1_WGM8_WGMXCC1_WGMXCCGn1
    SolutionIndex: 97
    SolutionNameMin: Cijk_Alik_Bjlk_BSS_BH_Bias_HA_S_SAB_SCD_SAV_UserArgs_MT64x128x16_MI16x16x1_SN_LDSB1_AFC1_AG0_AFEM1_AFEM1_ASEM1_CLR1_CADS0_DTLA0_DTLB0_DTVA0_DTVB0_DTVSM0_DPLBn1_EPS1_ELFLR0_EMLLn1_FDSI0_GRPM1_GRVWA8_GRVWB8_GSUn1_GSUAMB_GSUC0_GSUWGMRR0_GLS0_ISA1200_IU1_K1_LDSTI0_LBSPPA128_LBSPPB2048_LBSPPM0_LPA16_LPB0_LPM0_LRVW8_LWPMn1_MIAV1_MIWT1_8_MO40_MGRIPMn1_NTn1_NTA0_NTB0_NTC0_NTD0_NTM0_NEPBS0_NLCA1_NLCB1_ONLL0_PGR1_PLR1_PKA0_SGROBn1_SIA2_SS0_SU32_SUM0_SUS256_SPO0_SRVW0_SSO0_SVW8_SK0_SKFTR0_SKXCCM0_SGRO0_TIN0_TLDS1_TLDSM1_ULSGRO0_USL1_UIOFGRO0_USFGROn1_VSn1_VWA1_VWB8_WSGRA0_WSGRB0_WS32_WG64_2_1_WGM8_WGMXCC1_WGMXCCGn1
    SolutionIndex: 98
    SolutionNameMin: Cijk_Alik_Bjlk_BSS_BH_Bias_HA_S_SAB_SCD_SAV_UserArgs_MT128x32x64_MI16x16x1_SN_LDSB1_AFC1_AG0_AFEM1_AFEM1_ASEM1_CLR1_CADS0_DTLA0_DTLB0_DTVA0_DTVB1_DTVSM0_DPLBn1_EPS0_ELFLR0_EMLLn1_FDSI0_GRPM1_GRVWA8_GRVWB8_GSUn1_GSUAMB_GSUC0_GSUWGMRR0_GLS0_ISA1200_IU1_K1_LDSTI0_LBSPPA512_LBSPPB0_LBSPPM0_LPA16_LPB0_LPM0_LRVW8_LWPMn1_MIAV1_MIWT4_1_MO40_MGRIPMn1_NTn1_NTA0_NTB0_NTC0_NTD0_NTM0_NEPBS0_NLCA1_NLCB1_ONLL0_PGR2_PLR1_PKA0_SGROBn1_SIA3_SS1_SU32_SUM0_SUS256_SPO0_SRVW0_SSO0_SVW4_SK0_SKFTR0_SKXCCM0_SGRO0_TIN0_TLDS1_TLDSM1_ULSGRO0_USL1_UIOFGRO0_USFGROn1_VSn1_VWA4_VWB1_WSGRA0_WSGRB0_WS32_WG32_4_1_WGM8_WGMXCC1_WGMXCCGn1
    SolutionIndex: 99
    SolutionNameMin: Cijk_Alik_Bjlk_BSS_BH_Bias_HA_S_SAB_SCD_SAV_UserArgs_MT64x64x64_MI16x16x1_SN_LDSB1_AFC1_AG0_AFEM1_AFEM1_ASEM1_CLR1_CADS0_DTLA0_DTLB0_DTVA0_DTVB0_DTVSM0_DPLBn1_EPS1_ELFLR0_EMLLn1_FDSI0_GRPM1_GRVWA8_GRVWB8_GSUn1_GSUAMB_GSUC0_GSUWGMRR0_GLS0_ISA1200_IU1_K1_LDSTI0_LBSPPA256_LBSPPB1024_LBSPPM0_LPA16_LPB32_LPM0_LRVW8_LWPMn1_MIAV1_MIWT2_2_MO40_MGRIPMn1_NTn1_NTA0_NTB0_NTC0_NTD0_NTM0_NEPBS0_NLCA1_NLCB1_ONLL0_PGR1_PLR1_PKA0_SGROBn1_SIA3_SS0_SU32_SUM0_SUS256_SPO0_SRVW0_SSO0_SVW8_SK0_SKFTR0_SKXCCM0_SGRO0_TIN0_TLDS1_TLDSM1_ULSGRO0_USL1_UIOFGRO0_USFGROn1_VSn1_VWA2_VWB2_WSGRA0_WSGRB0_WS32_WG32_4_1_WGM8_WGMXCC1_WGMXCCGn1
    SolutionIndex: 100
    SolutionNameMin: Cijk_Alik_Bjlk_BSS_BH_Bias_HA_S_SAB_SCD_SAV_UserArgs_MT64x64x16_MI16x16x1_SN_LDSB0_AFC1_AG0_AFEM1_AFEM1_ASEM1_CLR0_CADS0_DTLA0_DTLB0_DTVA0_DTVB0_DTVSM0_DPLBn1_EPS0_ELFLR0_EMLLn1_FDSI0_GRPM1_GRVWA8_GRVWB8_GSUn1_GSUAMB_GSUC0_GSUWGMRR0_GLS0_ISA1200_IU1_K1_LDSTI0_LBSPPA128_LBSPPB1024_LBSPPM0_LPA16_LPB32_LPM0_LRVW8_LWPMn1_MIAV1_MIWT2_2_MO40_MGRIPMn1_NTn1_NTA0_NTB0_NTC0_NTD0_NTM0_NEPBS0_NLCA1_NLCB1_ONLL0_PGR2_PLR0_PKA0_SGROBn1_SIA3_SS0_SU32_SUM0_SUS256_SPO0_SRVW0_SSO0_SVW8_SK0_SKFTR0_SKXCCM0_SGRO0_TIN0_TLDS1_TLDSM1_ULSGRO1_USL1_UIOFGRO0_USFGROn1_VSn1_VWA2_VWB2_WSGRA0_WSGRB0_WS32_WG32_4_1_WGM8_WGMXCC1_WGMXCCGn1
    SolutionIndex: 101
    SolutionNameMin: Cijk_Alik_Bjlk_BSS_BH_Bias_HA_S_SAB_SCD_SAV_UserArgs_MT128x32x32_MI16x16x1_SN_LDSB0_AFC1_AG0_AFEM1_AFEM1_ASEM32_CLR1_CADS0_DTLA0_DTLB0_DTVA1_DTVB0_DTVSM0_DPLBn1_EPS1_ELFLR0_EMLLn1_FDSI0_GRPM1_GRVWA8_GRVWB8_GSUn1_GSUAMB_GSUC0_GSUWGMRR0_GLS0_ISA1200_IU1_K1_LDSTI0_LBSPPA0_LBSPPB512_LBSPPM0_LPA0_LPB16_LPM0_LRVW8_LWPMn1_MIAV1_MIWT4_1_MO40_MGRIPMn1_NTn1_NTA0_NTB0_NTC0_NTD0_NTM0_NEPBS0_NLCA2_NLCB1_ONLL0_PGR1_PLR1_PKA0_SGROBn1_SIA3_SS1_SU32_SUM0_SUS256_SPO0_SRVW0_SSO0_SVW4_SK0_SKFTR0_SKXCCM0_SGRO0_TIN0_TLDS1_TLDSM1_ULSGRO0_USL1_UIOFGRO0_USFGROn1_VSn1_VWA4_VWB1_WSGRA0_WSGRB0_WS32_WG32_4_1_WGM8_WGMXCC1_WGMXCCGn1
    SolutionIndex: 102
    SolutionNameMin: Cijk_Alik_Bjlk_BSS_BH_Bias_HA_S_SAB_SCD_SAV_UserArgs_MT128x64x16_MI16x16x1_SN_LDSB0_AFC1_AG0_AFEM1_AFEM1_ASEM1_CLR0_CADS0_DTLA0_DTLB0_DTVA0_DTVB0_DTVSM0_DPLBn1_EPS0_ELFLR0_EMLLn1_FDSI0_GRPM1_GRVWA8_GRVWB8_GSUn1_GSUAMB_GSUC0_GSUWGMRR0_GLS0_ISA1200_IU1_K1_LDSTI0_LBSPPA256_LBSPPB1024_LBSPPM0_LPA16_LPB16_LPM0_LRVW8_LWPMn1_MIAV1_MIWT8_1_MO40_MGRIPMn1_NTn1_NTA0_NTB0_NTC0_NTD0_NTM0_NEPBS0_NLCA1_NLCB1_ONLL0_PGR2_PLR0_PKA0_SGROBn1_SIA3_SS1_SU32_SUM0_SUS256_SPO0_SRVW0_SSO0_SVW8_SK0_SKFTR0_SKXCCM0_SGRO0_TIN0_TLDS1_TLDSM1_ULSGRO0_USL1_UIOFGRO0_USFGROn1_VSn1_VWA8_VWB1_WSGRA0_WSGRB0_WS32_WG16_8_1_WGM8_WGMXCC1_WGMXCCGn1
    SolutionIndex: 103
    SolutionNameMin: Cijk_Alik_Bjlk_BSS_BH_Bias_HA_S_SAB_SCD_SAV_UserArgs_MT64x128x32_MI16x16x1_SN_LDSB0_AFC1_AG0_AFEM1_AFEM1_ASEM1_CLR1_CADS0_DTLA0_DTLB0_DTVA0_DTVB0_DTVSM0_DPLBn1_EPS1_ELFLR0_EMLLn1_FDSI0_GRPM1_GRVWA8_GRVWB8_GSUn1_GSUAMB_GSUC0_GSUWGMRR0_GLS0_ISA1200_IU1_K1_LDSTI0_LBSPPA128_LBSPPB2048_LBSPPM0_LPA16_LPB0_LPM0_LRVW8_LWPMn1_MIAV1_MIWT1_8_MO40_MGRIPMn1_NTn1_NTA0_NTB0_NTC0_NTD0_NTM0_NEPBS0_NLCA1_NLCB1_ONLL0_PGR1_PLR1_PKA0_SGROBn1_SIA3_SS0_SU32_SUM0_SUS256_SPO0_SRVW0_SSO0_SVW8_SK0_SKFTR0_SKXCCM0_SGRO0_TIN0_TLDS1_TLDSM1_ULSGRO0_USL1_UIOFGRO0_USFGROn1_VSn1_VWA1_VWB8_WSGRA0_WSGRB0_WS32_WG64_2_1_WGM8_WGMXCC1_WGMXCCGn1
    SolutionIndex: 104
    SolutionNameMin: Cijk_Alik_Bjlk_BSS_BH_Bias_HA_S_SAB_SCD_SAV_UserArgs_MT128x128x16_MI16x16x1_SN_LDSB1_AFC1_AG0_AFEM1_AFEM1_ASEM1_CLR1_CADS0_DTLA0_DTLB0_DTVA0_DTVB0_DTVSM0_DPLBn1_EPS1_ELFLR0_EMLLn1_FDSI0_GRPM1_GRVWA8_GRVWB8_GSUn1_GSUAMB_GSUC0_GSUWGMRR0_GLS0_ISA1200_IU1_K1_LDSTI0_LBSPPA256_LBSPPB2048_LBSPPM0_LPA16_LPB32_LPM0_LRVW8_LWPMn1_MIAV1_MIWT8_2_MO40_MGRIPMn1_NTn1_NTA0_NTB0_NTC0_NTD0_NTM0_NEPBS0_NLCA1_NLCB1_ONLL0_PGR1_PLR1_PKA0_SGROBn1_SIA2_SS0_SU32_SUM0_SUS256_SPO0_SRVW0_SSO0_SVW8_SK0_SKFTR0_SKXCCM0_SGRO0_TIN0_TLDS1_TLDSM1_ULSGRO0_USL1_UIOFGRO0_USFGROn1_VSn1_VWA8_VWB2_WSGRA0_WSGRB0_WS32_WG16_8_1_WGM8_WGMXCC1_WGMXCCGn1
    SolutionIndex: 105
    SolutionNameMin: Cijk_Alik_Bjlk_BSS_BH_Bias_HA_S_SAB_SCD_SAV_UserArgs_MT128x64x32_MI16x16x1_SN_LDSB0_AFC1_AG0_AFEM1_AFEM1_ASEM1_CLR1_CADS0_DTLA0_DTLB0_DTVA0_DTVB1_DTVSM0_DPLBn1_EPS1_ELFLR0_EMLLn1_FDSI0_GRPM1_GRVWA8_GRVWB8_GSUn1_GSUAMB_GSUC0_GSUWGMRR0_GLS0_ISA1200_IU1_K1_LDSTI0_LBSPPA512_LBSPPB0_LBSPPM0_LPA16_LPB0_LPM0_LRVW8_LWPMn1_MIAV1_MIWT8_1_MO40_MGRIPMn1_NTn1_NTA0_NTB0_NTC0_NTD0_NTM0_NEPBS0_NLCA1_NLCB1_ONLL0_PGR1_PLR1_PKA0_SGROBn1_SIA3_SS1_SU32_SUM0_SUS256_SPO0_SRVW0_SSO0_SVW8_SK0_SKFTR0_SKXCCM0_SGRO0_TIN0_TLDS1_TLDSM1_ULSGRO0_USL1_UIOFGRO0_USFGROn1_VSn1_VWA8_VWB1_WSGRA0_WSGRB0_WS32_WG16_8_1_WGM8_WGMXCC1_WGMXCCGn1
    SolutionIndex: 106
    SolutionNameMin: Cijk_Alik_Bjlk_BSS_BH_Bias_HA_S_SAB_SCD_SAV_UserArgs_MT64x128x32_MI16x16x1_SN_LDSB0_AFC1_AG0_AFEM1_AFEM1_ASEM32_CLR1_CADS0_DTLA0_DTLB0_DTVA1_DTVB1_DTVSM0_DPLBn1_EPS0_ELFLR0_EMLLn1_FDSI0_GRPM1_GRVWA8_GRVWB8_GSUn1_GSUAMB_GSUC0_GSUWGMRR0_GLS0_ISA1200_IU1_K1_LDSTI0_LBSPPA0_LBSPPB0_LBSPPM0_LPA0_LPB0_LPM0_LRVW8_LWPMn1_MIAV1_MIWT1_8_MO40_MGRIPMn1_NTn1_NTA0_NTB0_NTC0_NTD0_NTM0_NEPBS0_NLCA2_NLCB2_ONLL0_PGR1_PLR0_PKA0_SGROBn1_SIA3_SS0_SU32_SUM0_SUS256_SPO0_SRVW0_SSO0_SVW8_SK0_SKFTR0_SKXCCM0_SGRO0_TIN0_TLDS1_TLDSM1_ULSGRO0_USL1_UIOFGRO0_USFGROn1_VSn1_VWA1_VWB1_WSGRA0_WSGRB0_WS32_WG64_2_1_WGM8_WGMXCC1_WGMXCCGn1
    SolutionIndex: 107
    SolutionNameMin: Cijk_Alik_Bjlk_BSS_BH_Bias_HA_S_SAB_SCD_SAV_UserArgs_MT128x64x32_MI16x16x1_SN_LDSB0_AFC1_AG0_AFEM1_AFEM1_ASEM1_CLR1_CADS0_DTLA0_DTLB0_DTVA0_DTVB1_DTVSM0_DPLBn1_EPS0_ELFLR0_EMLLn1_FDSI0_GRPM1_GRVWA8_GRVWB8_GSUn1_GSUAMB_GSUC0_GSUWGMRR0_GLS0_ISA1200_IU1_K1_LDSTI0_LBSPPA512_LBSPPB0_LBSPPM0_LPA16_LPB0_LPM0_LRVW8_LWPMn1_MIAV1_MIWT8_1_MO40_MGRIPMn1_NTn1_NTA0_NTB0_NTC0_NTD0_NTM0_NEPBS0_NLCA1_NLCB1_ONLL0_PGR2_PLR1_PKA0_SGROBn1_SIA3_SS0_SU32_SUM0_SUS256_SPO0_SRVW0_SSO0_SVW8_SK0_SKFTR0_SKXCCM0_SGRO0_TIN0_TLDS1_TLDSM1_ULSGRO0_USL1_UIOFGRO0_USFGROn1_VSn1_VWA8_VWB1_WSGRA0_WSGRB0_WS32_WG16_8_1_WGM8_WGMXCC1_WGMXCCGn1
    SolutionIndex: 108
    SolutionNameMin: Cijk_Alik_Bjlk_BSS_BH_Bias_HA_S_SAB_SCD_SAV_UserArgs_MT32x128x32_MI16x16x1_SN_LDSB0_AFC1_AG0_AFEM1_AFEM1_ASEM32_CLR1_CADS0_DTLA0_DTLB0_DTVA1_DTVB0_DTVSM0_DPLBn1_EPS0_ELFLR0_EMLLn1_FDSI0_GRPM1_GRVWA8_GRVWB8_GSUn1_GSUAMB_GSUC0_GSUWGMRR0_GLS0_ISA1200_IU1_K1_LDSTI0_LBSPPA0_LBSPPB2048_LBSPPM0_LPA0_LPB0_LPM0_LRVW8_LWPMn1_MIAV1_MIWT1_4_MO40_MGRIPMn1_NTn1_NTA0_NTB0_NTC0_NTD0_NTM0_NEPBS0_NLCA2_NLCB1_ONLL0_PGR2_PLR1_PKA0_SGROBn1_SIA3_SS0_SU32_SUM0_SUS256_SPO0_SRVW0_SSO0_SVW8_SK0_SKFTR0_SKXCCM0_SGRO0_TIN0_TLDS1_TLDSM1_ULSGRO0_USL1_UIOFGRO0_USFGROn1_VSn1_VWA1_VWB4_WSGRA0_WSGRB0_WS32_WG32_4_1_WGM8_WGMXCC1_WGMXCCGn1
    SolutionIndex: 109
    SolutionNameMin: Cijk_Alik_Bjlk_BSS_BH_Bias_HA_S_SAB_SCD_SAV_UserArgs_MT16x128x16_MI16x16x1_SN_LDSB0_AFC1_AG0_AFEM1_AFEM1_ASEM16_CLR1_CADS0_DTLA0_DTLB0_DTVA1_DTVB1_DTVSM0_DPLBn1_EPS0_ELFLR0_EMLLn1_FDSI0_GRPM1_GRVWA8_GRVWB8_GSUn1_GSUAMB_GSUC0_GSUWGMRR0_GLS0_ISA1200_IU1_K1_LDSTI0_LBSPPA0_LBSPPB0_LBSPPM0_LPA0_LPB0_LPM0_LRVW8_LWPMn1_MIAV1_MIWT1_8_MO40_MGRIPMn1_NTn1_NTA0_NTB0_NTC0_NTD0_NTM0_NEPBS0_NLCA1_NLCB1_ONLL0_PGR1_PLR0_PKA0_SGROBn1_SIA3_SS0_SU32_SUM0_SUS256_SPO0_SRVW0_SSO0_SVW8_SK0_SKFTR0_SKXCCM0_SGRO0_TIN0_TLDS1_TLDSM1_ULSGRO0_USL1_UIOFGRO0_USFGROn1_VSn1_VWA1_VWB1_WSGRA0_WSGRB0_WS32_WG16_2_1_WGM8_WGMXCC1_WGMXCCGn1
    SolutionIndex: 110
    SolutionNameMin: Cijk_Alik_Bjlk_BSS_BH_Bias_HA_S_SAB_SCD_SAV_UserArgs_MT128x64x32_MI16x16x1_SN_LDSB0_AFC1_AG0_AFEM1_AFEM1_ASEM1_CLR1_CADS0_DTLA0_DTLB0_DTVA0_DTVB1_DTVSM0_DPLBn1_EPS0_ELFLR0_EMLLn1_FDSI0_GRPM1_GRVWA8_GRVWB8_GSUn1_GSUAMB_GSUC0_GSUWGMRR0_GLS0_ISA1200_IU1_K1_LDSTI0_LBSPPA512_LBSPPB0_LBSPPM0_LPA16_LPB0_LPM0_LRVW8_LWPMn1_MIAV1_MIWT8_1_MO40_MGRIPMn1_NTn1_NTA0_NTB0_NTC0_NTD0_NTM0_NEPBS0_NLCA1_NLCB1_ONLL0_PGR2_PLR1_PKA0_SGROBn1_SIA3_SS1_SU32_SUM0_SUS256_SPO0_SRVW0_SSO0_SVW8_SK0_SKFTR0_SKXCCM0_SGRO0_TIN0_TLDS1_TLDSM1_ULSGRO0_USL1_UIOFGRO0_USFGROn1_VSn1_VWA8_VWB1_WSGRA0_WSGRB0_WS32_WG16_8_1_WGM8_WGMXCC1_WGMXCCGn1
    SolutionIndex: 111
    SolutionNameMin: Cijk_Alik_Bjlk_BSS_BH_Bias_HA_S_SAB_SCD_SAV_UserArgs_MT64x128x32_MI16x16x1_SN_LDSB0_AFC1_AG0_AFEM1_AFEM1_ASEM1_CLR1_CADS0_DTLA0_DTLB0_DTVA0_DTVB0_DTVSM0_DPLBn1_EPS0_ELFLR0_EMLLn1_FDSI0_GRPM1_GRVWA8_GRVWB8_GSUn1_GSUAMB_GSUC0_GSUWGMRR0_GLS0_ISA1200_IU1_K1_LDSTI0_LBSPPA128_LBSPPB2048_LBSPPM0_LPA16_LPB0_LPM0_LRVW8_LWPMn1_MIAV1_MIWT1_8_MO40_MGRIPMn1_NTn1_NTA0_NTB0_NTC0_NTD0_NTM0_NEPBS0_NLCA1_NLCB1_ONLL0_PGR2_PLR1_PKA0_SGROBn1_SIA3_SS0_SU32_SUM0_SUS256_SPO0_SRVW0_SSO0_SVW8_SK0_SKFTR0_SKXCCM0_SGRO0_TIN0_TLDS1_TLDSM1_ULSGRO1_USL1_UIOFGRO0_USFGROn1_VSn1_VWA1_VWB8_WSGRA0_WSGRB0_WS32_WG64_2_1_WGM8_WGMXCC1_WGMXCCGn1
    SolutionIndex: 112
    SolutionNameMin: Cijk_Alik_Bjlk_BSS_BH_Bias_HA_S_SAB_SCD_SAV_UserArgs_MT128x16x16_MI16x16x1_SN_LDSB0_AFC1_AG0_AFEM1_AFEM1_ASEM16_CLR1_CADS0_DTLA0_DTLB0_DTVA1_DTVB1_DTVSM0_DPLBn1_EPS0_ELFLR0_EMLLn1_FDSI0_GRPM1_GRVWA8_GRVWB8_GSUn1_GSUAMB_GSUC0_GSUWGMRR0_GLS0_ISA1200_IU1_K1_LDSTI0_LBSPPA0_LBSPPB0_LBSPPM0_LPA0_LPB0_LPM0_LRVW8_LWPMn1_MIAV1_MIWT8_1_MO40_MGRIPMn1_NTn1_NTA0_NTB0_NTC0_NTD0_NTM0_NEPBS0_NLCA1_NLCB1_ONLL0_PGR1_PLR0_PKA0_SGROBn1_SIA3_SS1_SU32_SUM0_SUS256_SPO0_SRVW0_SSO0_SVW8_SK0_SKFTR0_SKXCCM0_SGRO0_TIN0_TLDS1_TLDSM1_ULSGRO0_USL1_UIOFGRO0_USFGROn1_VSn1_VWA8_VWB1_WSGRA0_WSGRB0_WS32_WG16_2_1_WGM8_WGMXCC1_WGMXCCGn1
    SolutionIndex: 113
    SolutionNameMin: Cijk_Alik_Bjlk_BSS_BH_Bias_HA_S_SAB_SCD_SAV_UserArgs_MT64x128x32_MI16x16x1_SN_LDSB0_AFC1_AG0_AFEM1_AFEM1_ASEM1_CLR1_CADS0_DTLA0_DTLB0_DTVA0_DTVB1_DTVSM0_DPLBn1_EPS0_ELFLR0_EMLLn1_FDSI0_GRPM1_GRVWA8_GRVWB8_GSUn1_GSUAMB_GSUC0_GSUWGMRR0_GLS0_ISA1200_IU1_K1_LDSTI0_LBSPPA128_LBSPPB0_LBSPPM0_LPA16_LPB0_LPM0_LRVW8_LWPMn1_MIAV1_MIWT1_8_MO40_MGRIPMn1_NTn1_NTA0_NTB0_NTC0_NTD0_NTM0_NEPBS0_NLCA1_NLCB2_ONLL0_PGR2_PLR1_PKA0_SGROBn1_SIA3_SS0_SU32_SUM0_SUS256_SPO0_SRVW0_SSO0_SVW8_SK0_SKFTR0_SKXCCM0_SGRO0_TIN0_TLDS1_TLDSM1_ULSGRO0_USL1_UIOFGRO0_USFGROn1_VSn1_VWA1_VWB1_WSGRA0_WSGRB0_WS32_WG64_2_1_WGM8_WGMXCC1_WGMXCCGn1
    SolutionIndex: 114
    SolutionNameMin: Cijk_Alik_Bjlk_BSS_BH_Bias_HA_S_SAB_SCD_SAV_UserArgs_MT128x128x16_MI16x16x1_SN_LDSB0_AFC1_AG0_AFEM1_AFEM1_ASEM1_CLR0_CADS0_DTLA0_DTLB0_DTVA0_DTVB0_DTVSM0_DPLBn1_EPS1_ELFLR0_EMLLn1_FDSI0_GRPM1_GRVWA8_GRVWB8_GSUn1_GSUAMB_GSUC0_GSUWGMRR0_GLS0_ISA1200_IU1_K1_LDSTI0_LBSPPA256_LBSPPB2048_LBSPPM0_LPA16_LPB32_LPM0_LRVW8_LWPMn1_MIAV1_MIWT8_2_MO40_MGRIPMn1_NTn1_NTA0_NTB0_NTC0_NTD0_NTM0_NEPBS0_NLCA1_NLCB1_ONLL0_PGR1_PLR0_PKA0_SGROBn1_SIA3_SS1_SU32_SUM0_SUS256_SPO0_SRVW0_SSO0_SVW8_SK0_SKFTR0_SKXCCM0_SGRO0_TIN0_TLDS1_TLDSM1_ULSGRO0_USL1_UIOFGRO0_USFGROn1_VSn1_VWA8_VWB2_WSGRA0_WSGRB0_WS32_WG16_8_1_WGM8_WGMXCC1_WGMXCCGn1
    SolutionIndex: 115
    SolutionNameMin: Cijk_Alik_Bjlk_BSS_BH_Bias_HA_S_SAB_SCD_SAV_UserArgs_MT64x64x64_MI16x16x1_SN_LDSB1_AFC1_AG0_AFEM1_AFEM1_ASEM1_CLR1_CADS0_DTLA0_DTLB0_DTVA0_DTVB0_DTVSM0_DPLBn1_EPS0_ELFLR0_EMLLn1_FDSI0_GRPM1_GRVWA8_GRVWB8_GSUn1_GSUAMB_GSUC0_GSUWGMRR0_GLS0_ISA1200_IU1_K1_LDSTI0_LBSPPA256_LBSPPB1024_LBSPPM0_LPA16_LPB32_LPM0_LRVW8_LWPMn1_MIAV1_MIWT2_2_MO40_MGRIPMn1_NTn1_NTA0_NTB0_NTC0_NTD0_NTM0_NEPBS0_NLCA1_NLCB1_ONLL0_PGR2_PLR1_PKA0_SGROBn1_SIA3_SS0_SU32_SUM0_SUS256_SPO0_SRVW0_SSO0_SVW8_SK0_SKFTR0_SKXCCM0_SGRO0_TIN0_TLDS1_TLDSM1_ULSGRO0_USL1_UIOFGRO0_USFGROn1_VSn1_VWA2_VWB2_WSGRA0_WSGRB0_WS32_WG32_4_1_WGM8_WGMXCC1_WGMXCCGn1
    SolutionIndex: 116
    SolutionNameMin: Cijk_Alik_Bjlk_BSS_BH_Bias_HA_S_SAB_SCD_SAV_UserArgs_MT128x32x64_MI16x16x1_SN_LDSB0_AFC1_AG0_AFEM1_AFEM1_ASEM64_CLR1_CADS0_DTLA0_DTLB0_DTVA1_DTVB1_DTVSM0_DPLBn1_EPS0_ELFLR0_EMLLn1_FDSI0_GRPM1_GRVWA8_GRVWB8_GSUn1_GSUAMB_GSUC0_GSUWGMRR0_GLS0_ISA1200_IU1_K1_LDSTI0_LBSPPA0_LBSPPB0_LBSPPM0_LPA0_LPB0_LPM0_LRVW8_LWPMn1_MIAV1_MIWT4_1_MO40_MGRIPMn1_NTn1_NTA0_NTB0_NTC0_NTD0_NTM0_NEPBS0_NLCA4_NLCB1_ONLL0_PGR1_PLR0_PKA0_SGROBn1_SIA3_SS1_SU32_SUM0_SUS256_SPO0_SRVW0_SSO0_SVW4_SK0_SKFTR0_SKXCCM0_SGRO0_TIN0_TLDS1_TLDSM1_ULSGRO0_USL1_UIOFGRO0_USFGROn1_VSn1_VWA4_VWB1_WSGRA0_WSGRB0_WS32_WG32_4_1_WGM8_WGMXCC1_WGMXCCGn1
    SolutionIndex: 117
    SolutionNameMin: Cijk_Alik_Bjlk_BSS_BH_Bias_HA_S_SAB_SCD_SAV_UserArgs_MT128x64x16_MI16x16x1_SN_LDSB1_AFC1_AG0_AFEM1_AFEM1_ASEM1_CLR1_CADS0_DTLA0_DTLB0_DTVA0_DTVB0_DTVSM0_DPLBn1_EPS0_ELFLR0_EMLLn1_FDSI0_GRPM1_GRVWA8_GRVWB8_GSUn1_GSUAMB_GSUC0_GSUWGMRR0_GLS0_ISA1200_IU1_K1_LDSTI0_LBSPPA256_LBSPPB1024_LBSPPM0_LPA16_LPB16_LPM0_LRVW8_LWPMn1_MIAV1_MIWT8_1_MO40_MGRIPMn1_NTn1_NTA0_NTB0_NTC0_NTD0_NTM0_NEPBS0_NLCA1_NLCB1_ONLL0_PGR2_PLR1_PKA0_SGROBn1_SIA2_SS1_SU32_SUM0_SUS256_SPO0_SRVW0_SSO0_SVW8_SK0_SKFTR0_SKXCCM0_SGRO0_TIN0_TLDS1_TLDSM1_ULSGRO0_USL1_UIOFGRO0_USFGROn1_VSn1_VWA8_VWB1_WSGRA0_WSGRB0_WS32_WG16_8_1_WGM8_WGMXCC1_WGMXCCGn1
    SolutionIndex: 118
    SolutionNameMin: Cijk_Alik_Bjlk_BSS_BH_Bias_HA_S_SAB_SCD_SAV_UserArgs_MT128x64x16_MI16x16x1_SN_LDSB0_AFC1_AG0_AFEM1_AFEM1_ASEM1_CLR0_CADS0_DTLA0_DTLB0_DTVA0_DTVB0_DTVSM0_DPLBn1_EPS0_ELFLR0_EMLLn1_FDSI0_GRPM1_GRVWA8_GRVWB8_GSUn1_GSUAMB_GSUC0_GSUWGMRR0_GLS0_ISA1200_IU1_K1_LDSTI0_LBSPPA256_LBSPPB1024_LBSPPM0_LPA16_LPB16_LPM0_LRVW8_LWPMn1_MIAV1_MIWT8_1_MO40_MGRIPMn1_NTn1_NTA0_NTB0_NTC0_NTD0_NTM0_NEPBS0_NLCA1_NLCB1_ONLL0_PGR2_PLR0_PKA0_SGROBn1_SIA3_SS0_SU32_SUM0_SUS256_SPO0_SRVW0_SSO0_SVW8_SK0_SKFTR0_SKXCCM0_SGRO0_TIN0_TLDS1_TLDSM1_ULSGRO1_USL1_UIOFGRO0_USFGROn1_VSn1_VWA8_VWB1_WSGRA0_WSGRB0_WS32_WG16_8_1_WGM8_WGMXCC1_WGMXCCGn1
    SolutionIndex: 119
    SolutionNameMin: Cijk_Alik_Bjlk_BSS_BH_Bias_HA_S_SAB_SCD_SAV_UserArgs_MT64x64x16_MI16x16x1_SN_LDSB0_AFC1_AG0_AFEM1_AFEM1_ASEM1_CLR0_CADS0_DTLA0_DTLB0_DTVA0_DTVB0_DTVSM0_DPLBn1_EPS0_ELFLR0_EMLLn1_FDSI0_GRPM1_GRVWA8_GRVWB8_GSUn1_GSUAMB_GSUC0_GSUWGMRR0_GLS0_ISA1200_IU1_K1_LDSTI0_LBSPPA128_LBSPPB1024_LBSPPM0_LPA16_LPB32_LPM0_LRVW8_LWPMn1_MIAV1_MIWT2_2_MO40_MGRIPMn1_NTn1_NTA0_NTB0_NTC0_NTD0_NTM0_NEPBS0_NLCA1_NLCB1_ONLL0_PGR2_PLR0_PKA0_SGROBn1_SIA3_SS1_SU32_SUM0_SUS256_SPO0_SRVW0_SSO0_SVW2_SK0_SKFTR0_SKXCCM0_SGRO0_TIN0_TLDS1_TLDSM1_ULSGRO1_USL1_UIOFGRO0_USFGROn1_VSn1_VWA2_VWB2_WSGRA0_WSGRB0_WS32_WG32_4_1_WGM8_WGMXCC1_WGMXCCGn1
    SolutionIndex: 120
    SolutionNameMin: Cijk_Alik_Bjlk_BSS_BH_Bias_HA_S_SAB_SCD_SAV_UserArgs_MT64x64x32_MI16x16x1_SN_LDSB0_AFC1_AG0_AFEM1_AFEM1_ASEM1_CLR1_CADS0_DTLA0_DTLB0_DTVA0_DTVB0_DTVSM0_DPLBn1_EPS1_ELFLR0_EMLLn1_FDSI0_GRPM1_GRVWA8_GRVWB8_GSUn1_GSUAMB_GSUC0_GSUWGMRR0_GLS0_ISA1200_IU1_K1_LDSTI0_LBSPPA128_LBSPPB1024_LBSPPM0_LPA16_LPB32_LPM0_LRVW8_LWPMn1_MIAV1_MIWT2_2_MO40_MGRIPMn1_NTn1_NTA0_NTB0_NTC0_NTD0_NTM0_NEPBS0_NLCA1_NLCB1_ONLL0_PGR1_PLR1_PKA0_SGROBn1_SIA3_SS1_SU32_SUM0_SUS256_SPO0_SRVW0_SSO0_SVW2_SK0_SKFTR0_SKXCCM0_SGRO0_TIN0_TLDS1_TLDSM1_ULSGRO0_USL1_UIOFGRO0_USFGROn1_VSn1_VWA2_VWB2_WSGRA0_WSGRB0_WS32_WG32_4_1_WGM8_WGMXCC1_WGMXCCGn1
    SolutionIndex: 121
    SolutionNameMin: Cijk_Alik_Bjlk_BSS_BH_Bias_HA_S_SAB_SCD_SAV_UserArgs_MT64x64x32_MI16x16x1_SN_LDSB1_AFC1_AG0_AFEM1_AFEM1_ASEM1_CLR1_CADS0_DTLA0_DTLB0_DTVA0_DTVB0_DTVSM0_DPLBn1_EPS0_ELFLR0_EMLLn1_FDSI0_GRPM1_GRVWA8_GRVWB8_GSUn1_GSUAMB_GSUC0_GSUWGMRR0_GLS0_ISA1200_IU2_K1_LDSTI0_LBSPPA128_LBSPPB1024_LBSPPM0_LPA16_LPB32_LPM0_LRVW8_LWPMn1_MIAV1_MIWT2_2_MO40_MGRIPMn1_NTn1_NTA0_NTB0_NTC0_NTD0_NTM0_NEPBS0_NLCA1_NLCB1_ONLL0_PGR2_PLR1_PKA0_SGROBn1_SIA2_SS1_SU32_SUM0_SUS256_SPO0_SRVW0_SSO0_SVW2_SK0_SKFTR0_SKXCCM0_SGRO0_TIN0_TLDS1_TLDSM1_ULSGRO1_USL1_UIOFGRO0_USFGROn1_VSn1_VWA2_VWB2_WSGRA0_WSGRB0_WS32_WG32_4_1_WGM8_WGMXCC1_WGMXCCGn1
    SolutionIndex: 122
    SolutionNameMin: Cijk_Alik_Bjlk_BSS_BH_Bias_HA_S_SAB_SCD_SAV_UserArgs_MT128x128x16_MI16x16x1_SN_LDSB1_AFC1_AG0_AFEM1_AFEM1_ASEM1_CLR1_CADS0_DTLA0_DTLB0_DTVA0_DTVB0_DTVSM0_DPLBn1_EPS0_ELFLR0_EMLLn1_FDSI0_GRPM1_GRVWA8_GRVWB8_GSUn1_GSUAMB_GSUC0_GSUWGMRR0_GLS0_ISA1200_IU1_K1_LDSTI0_LBSPPA256_LBSPPB2048_LBSPPM0_LPA16_LPB32_LPM0_LRVW8_LWPMn1_MIAV1_MIWT8_2_MO40_MGRIPMn1_NTn1_NTA0_NTB0_NTC0_NTD0_NTM0_NEPBS0_NLCA1_NLCB1_ONLL0_PGR2_PLR1_PKA0_SGROBn1_SIA2_SS1_SU32_SUM0_SUS256_SPO0_SRVW0_SSO0_SVW8_SK0_SKFTR0_SKXCCM0_SGRO0_TIN0_TLDS1_TLDSM1_ULSGRO1_USL1_UIOFGRO0_USFGROn1_VSn1_VWA8_VWB2_WSGRA0_WSGRB0_WS32_WG16_8_1_WGM8_WGMXCC1_WGMXCCGn1
    SolutionIndex: 123
    SolutionNameMin: Cijk_Alik_Bjlk_BSS_BH_Bias_HA_S_SAB_SCD_SAV_UserArgs_MT128x128x16_MI16x16x1_SN_LDSB1_AFC1_AG0_AFEM1_AFEM1_ASEM1_CLR1_CADS0_DTLA0_DTLB0_DTVA0_DTVB0_DTVSM0_DPLBn1_EPS0_ELFLR0_EMLLn1_FDSI0_GRPM1_GRVWA8_GRVWB8_GSUn1_GSUAMB_GSUC0_GSUWGMRR0_GLS0_ISA1200_IU1_K1_LDSTI0_LBSPPA256_LBSPPB2048_LBSPPM0_LPA16_LPB32_LPM0_LRVW8_LWPMn1_MIAV1_MIWT8_2_MO40_MGRIPMn1_NTn1_NTA0_NTB0_NTC0_NTD0_NTM0_NEPBS0_NLCA1_NLCB1_ONLL0_PGR2_PLR1_PKA0_SGROBn1_SIA2_SS1_SU32_SUM0_SUS256_SPO0_SRVW0_SSO0_SVW8_SK0_SKFTR0_SKXCCM0_SGRO0_TIN0_TLDS1_TLDSM1_ULSGRO0_USL1_UIOFGRO0_USFGROn1_VSn1_VWA8_VWB2_WSGRA0_WSGRB0_WS32_WG16_8_1_WGM8_WGMXCC1_WGMXCCGn1
    SolutionIndex: 124
    SolutionNameMin: Cijk_Alik_Bjlk_BSS_BH_Bias_HA_S_SAB_SCD_SAV_UserArgs_MT128x128x16_MI16x16x1_SN_LDSB0_AFC1_AG0_AFEM1_AFEM1_ASEM1_CLR0_CADS0_DTLA0_DTLB0_DTVA0_DTVB0_DTVSM0_DPLBn1_EPS0_ELFLR0_EMLLn1_FDSI0_GRPM1_GRVWA8_GRVWB8_GSUn1_GSUAMB_GSUC0_GSUWGMRR0_GLS0_ISA1200_IU1_K1_LDSTI0_LBSPPA256_LBSPPB2048_LBSPPM0_LPA16_LPB32_LPM0_LRVW8_LWPMn1_MIAV1_MIWT8_2_MO40_MGRIPMn1_NTn1_NTA0_NTB0_NTC0_NTD0_NTM0_NEPBS0_NLCA1_NLCB1_ONLL0_PGR2_PLR0_PKA0_SGROBn1_SIA3_SS1_SU32_SUM0_SUS256_SPO0_SRVW0_SSO0_SVW8_SK0_SKFTR0_SKXCCM0_SGRO0_TIN0_TLDS1_TLDSM1_ULSGRO0_USL1_UIOFGRO0_USFGROn1_VSn1_VWA8_VWB2_WSGRA0_WSGRB0_WS32_WG16_8_1_WGM8_WGMXCC1_WGMXCCGn1
    SolutionIndex: 125
    SolutionNameMin: Cijk_Alik_Bjlk_BSS_BH_Bias_HA_S_SAB_SCD_SAV_UserArgs_MT128x128x32_MI16x16x1_SN_LDSB0_AFC1_AG0_AFEM1_AFEM1_ASEM1_CLR1_CADS0_DTLA0_DTLB0_DTVA0_DTVB1_DTVSM0_DPLBn1_EPS0_ELFLR0_EMLLn1_FDSI0_GRPM1_GRVWA8_GRVWB8_GSUn1_GSUAMB_GSUC0_GSUWGMRR0_GLS0_ISA1200_IU1_K1_LDSTI0_LBSPPA512_LBSPPB0_LBSPPM0_LPA16_LPB0_LPM0_LRVW8_LWPMn1_MIAV1_MIWT8_2_MO40_MGRIPMn1_NTn1_NTA0_NTB0_NTC0_NTD0_NTM0_NEPBS0_NLCA1_NLCB2_ONLL0_PGR2_PLR1_PKA0_SGROBn1_SIA3_SS1_SU32_SUM0_SUS256_SPO0_SRVW0_SSO0_SVW8_SK0_SKFTR0_SKXCCM0_SGRO0_TIN0_TLDS1_TLDSM1_ULSGRO0_USL1_UIOFGRO0_USFGROn1_VSn1_VWA8_VWB1_WSGRA0_WSGRB0_WS32_WG16_8_1_WGM8_WGMXCC1_WGMXCCGn1
    SolutionIndex: 126
    SolutionNameMin: Cijk_Alik_Bjlk_BSS_BH_Bias_HA_S_SAB_SCD_SAV_UserArgs_MT32x128x32_MI16x16x1_SN_LDSB1_AFC1_AG0_AFEM1_AFEM1_ASEM1_CLR1_CADS0_DTLA0_DTLB0_DTVA0_DTVB0_DTVSM0_DPLBn1_EPS0_ELFLR0_EMLLn1_FDSI0_GRPM1_GRVWA8_GRVWB8_GSUn1_GSUAMB_GSUC0_GSUWGMRR0_GLS0_ISA1200_IU2_K1_LDSTI0_LBSPPA128_LBSPPB2048_LBSPPM0_LPA16_LPB0_LPM0_LRVW8_LWPMn1_MIAV1_MIWT1_4_MO40_MGRIPMn1_NTn1_NTA0_NTB0_NTC0_NTD0_NTM0_NEPBS0_NLCA1_NLCB1_ONLL0_PGR2_PLR1_PKA0_SGROBn1_SIA2_SS0_SU32_SUM0_SUS256_SPO0_SRVW0_SSO0_SVW8_SK0_SKFTR0_SKXCCM0_SGRO0_TIN0_TLDS1_TLDSM1_ULSGRO1_USL1_UIOFGRO0_USFGROn1_VSn1_VWA1_VWB4_WSGRA0_WSGRB0_WS32_WG32_4_1_WGM8_WGMXCC1_WGMXCCGn1
    SolutionIndex: 127
    SolutionNameMin: Cijk_Alik_Bjlk_BSS_BH_Bias_HA_S_SAB_SCD_SAV_UserArgs_MT32x128x64_MI16x16x1_SN_LDSB0_AFC1_AG0_AFEM1_AFEM1_ASEM64_CLR1_CADS0_DTLA0_DTLB0_DTVA1_DTVB1_DTVSM0_DPLBn1_EPS0_ELFLR0_EMLLn1_FDSI0_GRPM1_GRVWA8_GRVWB8_GSUn1_GSUAMB_GSUC0_GSUWGMRR0_GLS0_ISA1200_IU1_K1_LDSTI0_LBSPPA0_LBSPPB0_LBSPPM0_LPA0_LPB0_LPM0_LRVW8_LWPMn1_MIAV1_MIWT1_4_MO40_MGRIPMn1_NTn1_NTA0_NTB0_NTC0_NTD0_NTM0_NEPBS0_NLCA4_NLCB4_ONLL0_PGR1_PLR0_PKA0_SGROBn1_SIA3_SS1_SU32_SUM0_SUS256_SPO0_SRVW0_SSO0_SVW1_SK0_SKFTR0_SKXCCM0_SGRO0_TIN0_TLDS1_TLDSM1_ULSGRO0_USL1_UIOFGRO0_USFGROn1_VSn1_VWA1_VWB1_WSGRA0_WSGRB0_WS32_WG32_4_1_WGM8_WGMXCC1_WGMXCCGn1
    SolutionIndex: 128
    SolutionNameMin: Cijk_Alik_Bjlk_BSS_BH_Bias_HA_S_SAB_SCD_SAV_UserArgs_MT32x128x64_MI16x16x1_SN_LDSB1_AFC1_AG0_AFEM1_AFEM1_ASEM1_CLR1_CADS0_DTLA0_DTLB0_DTVA0_DTVB0_DTVSM0_DPLBn1_EPS0_ELFLR0_EMLLn1_FDSI0_GRPM1_GRVWA8_GRVWB8_GSUn1_GSUAMB_GSUC0_GSUWGMRR0_GLS0_ISA1200_IU1_K1_LDSTI0_LBSPPA128_LBSPPB2048_LBSPPM0_LPA16_LPB0_LPM0_LRVW8_LWPMn1_MIAV1_MIWT1_4_MO40_MGRIPMn1_NTn1_NTA0_NTB0_NTC0_NTD0_NTM0_NEPBS0_NLCA1_NLCB1_ONLL0_PGR2_PLR1_PKA0_SGROBn1_SIA3_SS0_SU32_SUM0_SUS256_SPO0_SRVW0_SSO0_SVW8_SK0_SKFTR0_SKXCCM0_SGRO0_TIN0_TLDS1_TLDSM1_ULSGRO0_USL1_UIOFGRO0_USFGROn1_VSn1_VWA1_VWB4_WSGRA0_WSGRB0_WS32_WG32_4_1_WGM8_WGMXCC1_WGMXCCGn1
    SolutionIndex: 129
    SolutionNameMin: Cijk_Alik_Bjlk_BSS_BH_Bias_HA_S_SAB_SCD_SAV_UserArgs_MT128x64x32_MI16x16x1_SN_LDSB1_AFC1_AG0_AFEM1_AFEM1_ASEM1_CLR1_CADS0_DTLA0_DTLB0_DTVA0_DTVB0_DTVSM0_DPLBn1_EPS0_ELFLR0_EMLLn1_FDSI0_GRPM1_GRVWA8_GRVWB8_GSUn1_GSUAMB_GSUC0_GSUWGMRR0_GLS0_ISA1200_IU2_K1_LDSTI0_LBSPPA512_LBSPPB1024_LBSPPM0_LPA16_LPB16_LPM0_LRVW8_LWPMn1_MIAV1_MIWT8_1_MO40_MGRIPMn1_NTn1_NTA0_NTB0_NTC0_NTD0_NTM0_NEPBS0_NLCA1_NLCB1_ONLL0_PGR2_PLR1_PKA0_SGROBn1_SIA2_SS1_SU32_SUM0_SUS256_SPO0_SRVW0_SSO0_SVW8_SK0_SKFTR0_SKXCCM0_SGRO0_TIN0_TLDS1_TLDSM1_ULSGRO1_USL1_UIOFGRO0_USFGROn1_VSn1_VWA8_VWB1_WSGRA0_WSGRB0_WS32_WG16_8_1_WGM8_WGMXCC1_WGMXCCGn1
    SolutionIndex: 130
    SolutionNameMin: Cijk_Alik_Bjlk_BSS_BH_Bias_HA_S_SAB_SCD_SAV_UserArgs_MT128x64x16_MI16x16x1_SN_LDSB0_AFC1_AG0_AFEM1_AFEM1_ASEM1_CLR0_CADS0_DTLA0_DTLB0_DTVA0_DTVB0_DTVSM0_DPLBn1_EPS1_ELFLR0_EMLLn1_FDSI0_GRPM1_GRVWA8_GRVWB8_GSUn1_GSUAMB_GSUC0_GSUWGMRR0_GLS0_ISA1200_IU1_K1_LDSTI0_LBSPPA256_LBSPPB1024_LBSPPM0_LPA16_LPB16_LPM0_LRVW8_LWPMn1_MIAV1_MIWT8_1_MO40_MGRIPMn1_NTn1_NTA0_NTB0_NTC0_NTD0_NTM0_NEPBS0_NLCA1_NLCB1_ONLL0_PGR1_PLR0_PKA0_SGROBn1_SIA3_SS1_SU32_SUM0_SUS256_SPO0_SRVW0_SSO0_SVW8_SK0_SKFTR0_SKXCCM0_SGRO0_TIN0_TLDS1_TLDSM1_ULSGRO0_USL1_UIOFGRO0_USFGROn1_VSn1_VWA8_VWB1_WSGRA0_WSGRB0_WS32_WG16_8_1_WGM8_WGMXCC1_WGMXCCGn1
    SolutionIndex: 131
    SolutionNameMin: Cijk_Alik_Bjlk_BSS_BH_Bias_HA_S_SAB_SCD_SAV_UserArgs_MT32x128x64_MI16x16x1_SN_LDSB1_AFC1_AG0_AFEM1_AFEM1_ASEM1_CLR1_CADS0_DTLA0_DTLB0_DTVA0_DTVB0_DTVSM0_DPLBn1_EPS0_ELFLR0_EMLLn1_FDSI0_GRPM1_GRVWA8_GRVWB8_GSUn1_GSUAMB_GSUC0_GSUWGMRR0_GLS0_ISA1200_IU4_K1_LDSTI0_LBSPPA128_LBSPPB2048_LBSPPM0_LPA16_LPB0_LPM0_LRVW8_LWPMn1_MIAV1_MIWT1_4_MO40_MGRIPMn1_NTn1_NTA0_NTB0_NTC0_NTD0_NTM0_NEPBS0_NLCA1_NLCB1_ONLL0_PGR2_PLR1_PKA0_SGROBn1_SIA2_SS0_SU32_SUM0_SUS256_SPO0_SRVW0_SSO0_SVW8_SK0_SKFTR0_SKXCCM0_SGRO0_TIN0_TLDS1_TLDSM1_ULSGRO1_USL1_UIOFGRO0_USFGROn1_VSn1_VWA1_VWB4_WSGRA0_WSGRB0_WS32_WG32_4_1_WGM8_WGMXCC1_WGMXCCGn1
    SolutionIndex: 132
    SolutionNameMin: Cijk_Alik_Bjlk_BSS_BH_Bias_HA_S_SAB_SCD_SAV_UserArgs_MT128x128x16_MI16x16x1_SN_LDSB0_AFC1_AG0_AFEM1_AFEM1_ASEM1_CLR0_CADS0_DTLA0_DTLB0_DTVA0_DTVB0_DTVSM0_DPLBn1_EPS0_ELFLR0_EMLLn1_FDSI0_GRPM1_GRVWA8_GRVWB8_GSUn1_GSUAMB_GSUC0_GSUWGMRR0_GLS0_ISA1200_IU1_K1_LDSTI0_LBSPPA256_LBSPPB2048_LBSPPM0_LPA16_LPB32_LPM0_LRVW8_LWPMn1_MIAV1_MIWT8_2_MO40_MGRIPMn1_NTn1_NTA0_NTB0_NTC0_NTD0_NTM0_NEPBS0_NLCA1_NLCB1_ONLL0_PGR2_PLR0_PKA0_SGROBn1_SIA3_SS1_SU32_SUM0_SUS256_SPO0_SRVW0_SSO0_SVW8_SK0_SKFTR0_SKXCCM0_SGRO0_TIN0_TLDS1_TLDSM1_ULSGRO1_USL1_UIOFGRO0_USFGROn1_VSn1_VWA8_VWB2_WSGRA0_WSGRB0_WS32_WG16_8_1_WGM8_WGMXCC1_WGMXCCGn1
    SolutionIndex: 133
    SolutionNameMin: Cijk_Alik_Bjlk_BSS_BH_Bias_HA_S_SAB_SCD_SAV_UserArgs_MT128x128x16_MI16x16x1_SN_LDSB1_AFC1_AG0_AFEM1_AFEM1_ASEM1_CLR1_CADS0_DTLA0_DTLB0_DTVA0_DTVB0_DTVSM0_DPLBn1_EPS1_ELFLR0_EMLLn1_FDSI0_GRPM1_GRVWA8_GRVWB8_GSUn1_GSUAMB_GSUC0_GSUWGMRR0_GLS0_ISA1200_IU1_K1_LDSTI0_LBSPPA128_LBSPPB2048_LBSPPM0_LPA16_LPB0_LPM0_LRVW8_LWPMn1_MIAV1_MIWT4_4_MO40_MGRIPMn1_NTn1_NTA0_NTB0_NTC0_NTD0_NTM0_NEPBS0_NLCA1_NLCB1_ONLL0_PGR1_PLR1_PKA0_SGROBn1_SIA2_SS1_SU32_SUM0_SUS256_SPO0_SRVW0_SSO0_SVW4_SK0_SKFTR0_SKXCCM0_SGRO0_TIN0_TLDS1_TLDSM1_ULSGRO0_USL1_UIOFGRO0_USFGROn1_VSn1_VWA4_VWB4_WSGRA0_WSGRB0_WS32_WG32_4_1_WGM8_WGMXCC1_WGMXCCGn1
    SolutionIndex: 134
    SolutionNameMin: Cijk_Alik_Bjlk_BSS_BH_Bias_HA_S_SAB_SCD_SAV_UserArgs_MT64x64x64_MI16x16x1_SN_LDSB1_AFC1_AG0_AFEM1_AFEM1_ASEM1_CLR1_CADS0_DTLA0_DTLB0_DTVA0_DTVB0_DTVSM0_DPLBn1_EPS0_ELFLR0_EMLLn1_FDSI0_GRPM1_GRVWA8_GRVWB8_GSUn1_GSUAMB_GSUC0_GSUWGMRR0_GLS0_ISA1200_IU1_K1_LDSTI0_LBSPPA256_LBSPPB1024_LBSPPM0_LPA16_LPB32_LPM0_LRVW8_LWPMn1_MIAV1_MIWT2_2_MO40_MGRIPMn1_NTn1_NTA0_NTB0_NTC0_NTD0_NTM0_NEPBS0_NLCA1_NLCB1_ONLL0_PGR2_PLR1_PKA0_SGROBn1_SIA3_SS0_SU32_SUM0_SUS256_SPO0_SRVW0_SSO0_SVW8_SK0_SKFTR0_SKXCCM0_SGRO0_TIN0_TLDS1_TLDSM1_ULSGRO1_USL1_UIOFGRO0_USFGROn1_VSn1_VWA2_VWB2_WSGRA0_WSGRB0_WS32_WG32_4_1_WGM8_WGMXCC1_WGMXCCGn1
    SolutionIndex: 135
    SolutionNameMin: Cijk_Alik_Bjlk_BSS_BH_Bias_HA_S_SAB_SCD_SAV_UserArgs_MT32x128x64_MI16x16x1_SN_LDSB0_AFC1_AG0_AFEM1_AFEM1_ASEM64_CLR1_CADS0_DTLA0_DTLB0_DTVA1_DTVB1_DTVSM0_DPLBn1_EPS0_ELFLR0_EMLLn1_FDSI0_GRPM1_GRVWA8_GRVWB8_GSUn1_GSUAMB_GSUC0_GSUWGMRR0_GLS0_ISA1200_IU1_K1_LDSTI0_LBSPPA0_LBSPPB0_LBSPPM0_LPA0_LPB0_LPM0_LRVW8_LWPMn1_MIAV1_MIWT1_4_MO40_MGRIPMn1_NTn1_NTA0_NTB0_NTC0_NTD0_NTM0_NEPBS0_NLCA4_NLCB4_ONLL0_PGR1_PLR0_PKA0_SGROBn1_SIA3_SS0_SU32_SUM0_SUS256_SPO0_SRVW0_SSO0_SVW8_SK0_SKFTR0_SKXCCM0_SGRO0_TIN0_TLDS1_TLDSM1_ULSGRO0_USL1_UIOFGRO0_USFGROn1_VSn1_VWA1_VWB1_WSGRA0_WSGRB0_WS32_WG32_4_1_WGM8_WGMXCC1_WGMXCCGn1
    SolutionIndex: 136
    SolutionNameMin: Cijk_Alik_Bjlk_BSS_BH_Bias_HA_S_SAB_SCD_SAV_UserArgs_MT64x64x64_MI16x16x1_SN_LDSB0_AFC1_AG0_AFEM1_AFEM1_ASEM1_CLR1_CADS0_DTLA0_DTLB0_DTVA0_DTVB1_DTVSM0_DPLBn1_EPS1_ELFLR0_EMLLn1_FDSI0_GRPM1_GRVWA8_GRVWB8_GSUn1_GSUAMB_GSUC0_GSUWGMRR0_GLS0_ISA1200_IU1_K1_LDSTI0_LBSPPA256_LBSPPB0_LBSPPM0_LPA16_LPB0_LPM0_LRVW8_LWPMn1_MIAV1_MIWT2_2_MO40_MGRIPMn1_NTn1_NTA0_NTB0_NTC0_NTD0_NTM0_NEPBS0_NLCA1_NLCB4_ONLL0_PGR1_PLR1_PKA0_SGROBn1_SIA3_SS1_SU32_SUM0_SUS256_SPO0_SRVW0_SSO0_SVW2_SK0_SKFTR0_SKXCCM0_SGRO0_TIN0_TLDS1_TLDSM1_ULSGRO0_USL1_UIOFGRO0_USFGROn1_VSn1_VWA2_VWB1_WSGRA0_WSGRB0_WS32_WG32_4_1_WGM8_WGMXCC1_WGMXCCGn1
    SolutionIndex: 137
    SolutionNameMin: Cijk_Alik_Bjlk_BSS_BH_Bias_HA_S_SAB_SCD_SAV_UserArgs_MT32x128x64_MI16x16x1_SN_LDSB0_AFC1_AG0_AFEM1_AFEM1_ASEM64_CLR1_CADS0_DTLA0_DTLB0_DTVA1_DTVB0_DTVSM0_DPLBn1_EPS0_ELFLR0_EMLLn1_FDSI0_GRPM1_GRVWA8_GRVWB8_GSUn1_GSUAMB_GSUC0_GSUWGMRR0_GLS0_ISA1200_IU1_K1_LDSTI0_LBSPPA0_LBSPPB2048_LBSPPM0_LPA0_LPB0_LPM0_LRVW8_LWPMn1_MIAV1_MIWT1_4_MO40_MGRIPMn1_NTn1_NTA0_NTB0_NTC0_NTD0_NTM0_NEPBS0_NLCA4_NLCB1_ONLL0_PGR2_PLR1_PKA0_SGROBn1_SIA3_SS0_SU32_SUM0_SUS256_SPO0_SRVW0_SSO0_SVW8_SK0_SKFTR0_SKXCCM0_SGRO0_TIN0_TLDS1_TLDSM1_ULSGRO0_USL1_UIOFGRO0_USFGROn1_VSn1_VWA1_VWB4_WSGRA0_WSGRB0_WS32_WG32_4_1_WGM8_WGMXCC1_WGMXCCGn1
    SolutionIndex: 138
    SolutionNameMin: Cijk_Alik_Bjlk_BSS_BH_Bias_HA_S_SAB_SCD_SAV_UserArgs_MT128x64x16_MI16x16x1_SN_LDSB1_AFC1_AG0_AFEM1_AFEM1_ASEM1_CLR1_CADS0_DTLA0_DTLB0_DTVA0_DTVB0_DTVSM0_DPLBn1_EPS0_ELFLR0_EMLLn1_FDSI0_GRPM1_GRVWA8_GRVWB8_GSUn1_GSUAMB_GSUC0_GSUWGMRR0_GLS0_ISA1200_IU1_K1_LDSTI0_LBSPPA256_LBSPPB1024_LBSPPM0_LPA16_LPB16_LPM0_LRVW8_LWPMn1_MIAV1_MIWT8_1_MO40_MGRIPMn1_NTn1_NTA0_NTB0_NTC0_NTD0_NTM0_NEPBS0_NLCA1_NLCB1_ONLL0_PGR2_PLR1_PKA0_SGROBn1_SIA2_SS1_SU32_SUM0_SUS256_SPO0_SRVW0_SSO0_SVW8_SK0_SKFTR0_SKXCCM0_SGRO0_TIN0_TLDS1_TLDSM1_ULSGRO1_USL1_UIOFGRO0_USFGROn1_VSn1_VWA8_VWB1_WSGRA0_WSGRB0_WS32_WG16_8_1_WGM8_WGMXCC1_WGMXCCGn1
    SolutionIndex: 139
    SolutionNameMin: Cijk_Alik_Bjlk_BSS_BH_Bias_HA_S_SAB_SCD_SAV_UserArgs_MT128x128x32_MI16x16x1_SN_LDSB1_AFC1_AG0_AFEM1_AFEM1_ASEM1_CLR1_CADS0_DTLA0_DTLB0_DTVA0_DTVB0_DTVSM0_DPLBn1_EPS0_ELFLR0_EMLLn1_FDSI0_GRPM1_GRVWA8_GRVWB8_GSUn1_GSUAMB_GSUC0_GSUWGMRR0_GLS0_ISA1200_IU1_K1_LDSTI0_LBSPPA256_LBSPPB2048_LBSPPM0_LPA16_LPB0_LPM0_LRVW8_LWPMn1_MIAV1_MIWT4_4_MO40_MGRIPMn1_NTn1_NTA0_NTB0_NTC0_NTD0_NTM0_NEPBS0_NLCA1_NLCB1_ONLL0_PGR2_PLR1_PKA0_SGROBn1_SIA3_SS1_SU32_SUM0_SUS256_SPO0_SRVW0_SSO0_SVW4_SK0_SKFTR0_SKXCCM0_SGRO0_TIN0_TLDS1_TLDSM1_ULSGRO1_USL1_UIOFGRO0_USFGROn1_VSn1_VWA4_VWB4_WSGRA0_WSGRB0_WS32_WG32_4_1_WGM8_WGMXCC1_WGMXCCGn1
    SolutionIndex: 140
    SolutionNameMin: Cijk_Alik_Bjlk_BSS_BH_Bias_HA_S_SAB_SCD_SAV_UserArgs_MT32x16x128_MI16x16x1_SN_LDSB0_AFC1_AG0_AFEM1_AFEM1_ASEM1_CLR1_CADS0_DTLA0_DTLB0_DTVA0_DTVB1_DTVSM0_DPLBn1_EPS1_ELFLR0_EMLLn1_FDSI0_GRPM1_GRVWA8_GRVWB8_GSUn1_GSUAMB_GSUC0_GSUWGMRR0_GLS0_ISA1200_IU1_K1_LDSTI0_LBSPPA256_LBSPPB0_LBSPPM0_LPA16_LPB0_LPM0_LRVW8_LWPMn1_MIAV1_MIWT1_1_MO40_MGRIPMn1_NTn1_NTA0_NTB0_NTC0_NTD0_NTM0_NEPBS0_NLCA1_NLCB1_ONLL0_PGR1_PLR1_PKA0_SGROBn1_SIA3_SS0_SU32_SUM0_SUS256_SPO0_SRVW0_SSO0_SVW8_SK0_SKFTR0_SKXCCM0_SGRO0_TIN0_TLDS1_TLDSM1_ULSGRO0_USL1_UIOFGRO0_USFGROn1_VSn1_VWA1_VWB1_WSGRA0_WSGRB0_WS32_WG32_2_1_WGM8_WGMXCC1_WGMXCCGn1
    SolutionIndex: 141
    SolutionNameMin: Cijk_Alik_Bjlk_BSS_BH_Bias_HA_S_SAB_SCD_SAV_UserArgs_MT32x32x128_MI16x16x1_SN_LDSB0_AFC1_AG0_AFEM1_AFEM1_ASEM1_CLR1_CADS0_DTLA0_DTLB0_DTVA0_DTVB1_DTVSM0_DPLBn1_EPS0_ELFLR0_EMLLn1_FDSI0_GRPM1_GRVWA8_GRVWB8_GSUn1_GSUAMB_GSUC0_GSUWGMRR0_GLS0_ISA1200_IU1_K1_LDSTI0_LBSPPA256_LBSPPB0_LBSPPM0_LPA16_LPB0_LPM0_LRVW8_LWPMn1_MIAV1_MIWT1_1_MO40_MGRIPMn1_NTn1_NTA0_NTB0_NTC0_NTD0_NTM0_NEPBS0_NLCA1_NLCB1_ONLL0_PGR2_PLR1_PKA0_SGROBn1_SIA3_SS0_SU32_SUM0_SUS256_SPO0_SRVW0_SSO0_SVW8_SK0_SKFTR0_SKXCCM0_SGRO0_TIN0_TLDS1_TLDSM1_ULSGRO0_USL1_UIOFGRO0_USFGROn1_VSn1_VWA1_VWB1_WSGRA0_WSGRB0_WS32_WG32_4_1_WGM8_WGMXCC1_WGMXCCGn1
    SolutionIndex: 142
    SolutionNameMin: Cijk_Alik_Bjlk_BSS_BH_Bias_HA_S_SAB_SCD_SAV_UserArgs_MT32x16x128_MI16x16x1_SN_LDSB0_AFC1_AG0_AFEM1_AFEM1_ASEM1_CLR1_CADS0_DTLA0_DTLB0_DTVA0_DTVB0_DTVSM0_DPLBn1_EPS0_ELFLR0_EMLLn1_FDSI0_GRPM1_GRVWA8_GRVWB8_GSUn1_GSUAMB_GSUC0_GSUWGMRR0_GLS0_ISA1200_IU1_K1_LDSTI0_LBSPPA256_LBSPPB256_LBSPPM0_LPA16_LPB16_LPM0_LRVW8_LWPMn1_MIAV1_MIWT1_1_MO40_MGRIPMn1_NTn1_NTA0_NTB0_NTC0_NTD0_NTM0_NEPBS0_NLCA1_NLCB1_ONLL0_PGR2_PLR1_PKA0_SGROBn1_SIA3_SS0_SU32_SUM0_SUS256_SPO0_SRVW0_SSO0_SVW8_SK0_SKFTR0_SKXCCM0_SGRO0_TIN0_TLDS1_TLDSM1_ULSGRO1_USL1_UIOFGRO0_USFGROn1_VSn1_VWA1_VWB1_WSGRA0_WSGRB0_WS32_WG32_2_1_WGM8_WGMXCC1_WGMXCCGn1
    SolutionIndex: 143
    SolutionNameMin: Cijk_Alik_Bjlk_BSS_BH_Bias_HA_S_SAB_SCD_SAV_UserArgs_MT16x32x128_MI16x16x1_SN_LDSB0_AFC1_AG0_AFEM1_AFEM1_ASEM1_CLR1_CADS0_DTLA0_DTLB0_DTVA0_DTVB1_DTVSM0_DPLBn1_EPS0_ELFLR0_EMLLn1_FDSI0_GRPM1_GRVWA8_GRVWB8_GSUn1_GSUAMB_GSUC0_GSUWGMRR0_GLS0_ISA1200_IU1_K1_LDSTI0_LBSPPA256_LBSPPB0_LBSPPM0_LPA16_LPB0_LPM0_LRVW8_LWPMn1_MIAV1_MIWT1_1_MO40_MGRIPMn1_NTn1_NTA0_NTB0_NTC0_NTD0_NTM0_NEPBS0_NLCA1_NLCB1_ONLL0_PGR2_PLR1_PKA0_SGROBn1_SIA3_SS1_SU32_SUM0_SUS256_SPO0_SRVW0_SSO0_SVW1_SK0_SKFTR0_SKXCCM0_SGRO0_TIN0_TLDS1_TLDSM1_ULSGRO0_USL1_UIOFGRO0_USFGROn1_VSn1_VWA1_VWB1_WSGRA0_WSGRB0_WS32_WG16_4_1_WGM8_WGMXCC1_WGMXCCGn1
    SolutionIndex: 144
    SolutionNameMin: Cijk_Alik_Bjlk_BSS_BH_Bias_HA_S_SAB_SCD_SAV_UserArgs_MT16x32x128_MI16x16x1_SN_LDSB0_AFC1_AG0_AFEM1_AFEM1_ASEM1_CLR1_CADS0_DTLA0_DTLB0_DTVA0_DTVB1_DTVSM0_DPLBn1_EPS0_ELFLR0_EMLLn1_FDSI0_GRPM1_GRVWA8_GRVWB8_GSUn1_GSUAMB_GSUC0_GSUWGMRR0_GLS0_ISA1200_IU1_K1_LDSTI0_LBSPPA256_LBSPPB0_LBSPPM0_LPA16_LPB0_LPM0_LRVW8_LWPMn1_MIAV1_MIWT1_1_MO40_MGRIPMn1_NTn1_NTA0_NTB0_NTC0_NTD0_NTM0_NEPBS0_NLCA1_NLCB1_ONLL0_PGR2_PLR1_PKA0_SGROBn1_SIA3_SS0_SU32_SUM0_SUS256_SPO0_SRVW0_SSO0_SVW8_SK0_SKFTR0_SKXCCM0_SGRO0_TIN0_TLDS1_TLDSM1_ULSGRO0_USL1_UIOFGRO0_USFGROn1_VSn1_VWA1_VWB1_WSGRA0_WSGRB0_WS32_WG16_4_1_WGM8_WGMXCC1_WGMXCCGn1
    SolutionIndex: 145
    SolutionNameMin: Cijk_Alik_Bjlk_BSS_BH_Bias_HA_S_SAB_SCD_SAV_UserArgs_MT32x32x32_MI16x16x1_SN_LDSB0_AFC1_AG0_AFEM1_AFEM1_ASEM32_CLR1_CADS0_DTLA0_DTLB0_DTVA1_DTVB0_DTVSM0_DPLBn1_EPS0_ELFLR0_EMLLn1_FDSI0_GRPM1_GRVWA8_GRVWB8_GSUn1_GSUAMB_GSUC0_GSUWGMRR0_GLS0_ISA1200_IU1_K1_LDSTI0_LBSPPA0_LBSPPB512_LBSPPM0_LPA0_LPB16_LPM0_LRVW8_LWPMn1_MIAV1_MIWT1_1_MO40_MGRIPMn1_NTn1_NTA0_NTB0_NTC0_NTD0_NTM0_NEPBS0_NLCA2_NLCB1_ONLL0_PGR2_PLR1_PKA0_SGROBn1_SIA3_SS0_SU32_SUM0_SUS256_SPO0_SRVW0_SSO0_SVW8_SK0_SKFTR0_SKXCCM0_SGRO0_TIN0_TLDS1_TLDSM1_ULSGRO0_USL1_UIOFGRO0_USFGROn1_VSn1_VWA1_VWB1_WSGRA0_WSGRB0_WS32_WG32_4_1_WGM8_WGMXCC1_WGMXCCGn1
    SolutionIndex: 146
    SolutionNameMin: Cijk_Alik_Bjlk_BSS_BH_Bias_HA_S_SAB_SCD_SAV_UserArgs_MT32x16x64_MI16x16x1_SN_LDSB0_AFC1_AG0_AFEM1_AFEM1_ASEM1_CLR1_CADS0_DTLA0_DTLB0_DTVA0_DTVB1_DTVSM0_DPLBn1_EPS0_ELFLR0_EMLLn1_FDSI0_GRPM1_GRVWA8_GRVWB8_GSUn1_GSUAMB_GSUC0_GSUWGMRR0_GLS0_ISA1200_IU1_K1_LDSTI0_LBSPPA128_LBSPPB0_LBSPPM0_LPA16_LPB0_LPM0_LRVW8_LWPMn1_MIAV1_MIWT1_1_MO40_MGRIPMn1_NTn1_NTA0_NTB0_NTC0_NTD0_NTM0_NEPBS0_NLCA1_NLCB1_ONLL0_PGR2_PLR1_PKA0_SGROBn1_SIA3_SS0_SU32_SUM0_SUS256_SPO0_SRVW0_SSO0_SVW8_SK0_SKFTR0_SKXCCM0_SGRO0_TIN0_TLDS1_TLDSM1_ULSGRO0_USL1_UIOFGRO0_USFGROn1_VSn1_VWA1_VWB1_WSGRA0_WSGRB0_WS32_WG32_2_1_WGM8_WGMXCC1_WGMXCCGn1
    SolutionIndex: 147
    SolutionNameMin: Cijk_Alik_Bjlk_BSS_BH_Bias_HA_S_SAB_SCD_SAV_UserArgs_MT16x32x128_MI16x16x1_SN_LDSB0_AFC1_AG0_AFEM1_AFEM1_ASEM1_CLR1_CADS0_DTLA0_DTLB0_DTVA0_DTVB1_DTVSM0_DPLBn1_EPS1_ELFLR0_EMLLn1_FDSI0_GRPM1_GRVWA8_GRVWB8_GSUn1_GSUAMB_GSUC0_GSUWGMRR0_GLS0_ISA1200_IU1_K1_LDSTI0_LBSPPA256_LBSPPB0_LBSPPM0_LPA16_LPB0_LPM0_LRVW8_LWPMn1_MIAV1_MIWT1_1_MO40_MGRIPMn1_NTn1_NTA0_NTB0_NTC0_NTD0_NTM0_NEPBS0_NLCA1_NLCB1_ONLL0_PGR1_PLR1_PKA0_SGROBn1_SIA3_SS0_SU32_SUM0_SUS256_SPO0_SRVW0_SSO0_SVW8_SK0_SKFTR0_SKXCCM0_SGRO0_TIN0_TLDS1_TLDSM1_ULSGRO0_USL1_UIOFGRO0_USFGROn1_VSn1_VWA1_VWB1_WSGRA0_WSGRB0_WS32_WG16_4_1_WGM8_WGMXCC1_WGMXCCGn1
    SolutionIndex: 148
    SolutionNameMin: Cijk_Alik_Bjlk_BSS_BH_Bias_HA_S_SAB_SCD_SAV_UserArgs_MT32x32x128_MI16x16x1_SN_LDSB0_AFC1_AG0_AFEM1_AFEM1_ASEM128_CLR1_CADS0_DTLA0_DTLB0_DTVA1_DTVB0_DTVSM0_DPLBn1_EPS0_ELFLR0_EMLLn1_FDSI0_GRPM1_GRVWA8_GRVWB8_GSUn1_GSUAMB_GSUC0_GSUWGMRR0_GLS0_ISA1200_IU1_K1_LDSTI0_LBSPPA0_LBSPPB512_LBSPPM0_LPA0_LPB16_LPM0_LRVW8_LWPMn1_MIAV1_MIWT1_1_MO40_MGRIPMn1_NTn1_NTA0_NTB0_NTC0_NTD0_NTM0_NEPBS0_NLCA8_NLCB1_ONLL0_PGR2_PLR1_PKA0_SGROBn1_SIA3_SS1_SU32_SUM0_SUS256_SPO0_SRVW0_SSO0_SVW1_SK0_SKFTR0_SKXCCM0_SGRO0_TIN0_TLDS1_TLDSM1_ULSGRO0_USL1_UIOFGRO0_USFGROn1_VSn1_VWA1_VWB1_WSGRA0_WSGRB0_WS32_WG32_4_1_WGM8_WGMXCC1_WGMXCCGn1
    SolutionIndex: 149
    SolutionNameMin: Cijk_Alik_Bjlk_BSS_BH_Bias_HA_S_SAB_SCD_SAV_UserArgs_MT32x32x64_MI16x16x1_SN_LDSB0_AFC1_AG0_AFEM1_AFEM1_ASEM1_CLR1_CADS0_DTLA0_DTLB0_DTVA0_DTVB1_DTVSM0_DPLBn1_EPS0_ELFLR0_EMLLn1_FDSI0_GRPM1_GRVWA8_GRVWB8_GSUn1_GSUAMB_GSUC0_GSUWGMRR0_GLS0_ISA1200_IU1_K1_LDSTI0_LBSPPA128_LBSPPB0_LBSPPM0_LPA16_LPB0_LPM0_LRVW8_LWPMn1_MIAV1_MIWT1_1_MO40_MGRIPMn1_NTn1_NTA0_NTB0_NTC0_NTD0_NTM0_NEPBS0_NLCA1_NLCB1_ONLL0_PGR2_PLR1_PKA0_SGROBn1_SIA3_SS0_SU32_SUM0_SUS256_SPO0_SRVW0_SSO0_SVW8_SK0_SKFTR0_SKXCCM0_SGRO0_TIN0_TLDS1_TLDSM1_ULSGRO0_USL1_UIOFGRO0_USFGROn1_VSn1_VWA1_VWB1_WSGRA0_WSGRB0_WS32_WG32_4_1_WGM8_WGMXCC1_WGMXCCGn1
    SolutionIndex: 150
    SolutionNameMin: Cijk_Alik_Bjlk_BSS_BH_Bias_HA_S_SAB_SCD_SAV_UserArgs_MT16x32x128_MI16x16x1_SN_LDSB1_AFC1_AG0_AFEM1_AFEM1_ASEM1_CLR1_CADS0_DTLA0_DTLB0_DTVA0_DTVB0_DTVSM0_DPLBn1_EPS1_ELFLR0_EMLLn1_FDSI0_GRPM1_GRVWA8_GRVWB8_GSUn1_GSUAMB_GSUC0_GSUWGMRR0_GLS0_ISA1200_IU8_K1_LDSTI0_LBSPPA256_LBSPPB512_LBSPPM0_LPA16_LPB16_LPM0_LRVW8_LWPMn1_MIAV1_MIWT1_1_MO40_MGRIPMn1_NTn1_NTA0_NTB0_NTC0_NTD0_NTM0_NEPBS0_NLCA1_NLCB1_ONLL0_PGR1_PLR1_PKA0_SGROBn1_SIA2_SS0_SU32_SUM0_SUS256_SPO0_SRVW0_SSO0_SVW8_SK0_SKFTR0_SKXCCM0_SGRO0_TIN0_TLDS1_TLDSM1_ULSGRO0_USL1_UIOFGRO0_USFGROn1_VSn1_VWA1_VWB1_WSGRA0_WSGRB0_WS32_WG16_4_1_WGM8_WGMXCC1_WGMXCCGn1
    SolutionIndex: 151
    SolutionNameMin: Cijk_Alik_Bjlk_BSS_BH_Bias_HA_S_SAB_SCD_SAV_UserArgs_MT16x32x128_MI16x16x1_SN_LDSB0_AFC1_AG0_AFEM1_AFEM1_ASEM1_CLR1_CADS0_DTLA0_DTLB0_DTVA0_DTVB1_DTVSM0_DPLBn1_EPS1_ELFLR0_EMLLn1_FDSI0_GRPM1_GRVWA8_GRVWB8_GSUn1_GSUAMB_GSUC0_GSUWGMRR0_GLS0_ISA1200_IU1_K1_LDSTI0_LBSPPA256_LBSPPB0_LBSPPM0_LPA16_LPB0_LPM0_LRVW8_LWPMn1_MIAV1_MIWT1_1_MO40_MGRIPMn1_NTn1_NTA0_NTB0_NTC0_NTD0_NTM0_NEPBS0_NLCA1_NLCB1_ONLL0_PGR1_PLR1_PKA0_SGROBn1_SIA3_SS1_SU32_SUM0_SUS256_SPO0_SRVW0_SSO0_SVW1_SK0_SKFTR0_SKXCCM0_SGRO0_TIN0_TLDS1_TLDSM1_ULSGRO0_USL1_UIOFGRO0_USFGROn1_VSn1_VWA1_VWB1_WSGRA0_WSGRB0_WS32_WG16_4_1_WGM8_WGMXCC1_WGMXCCGn1
    SolutionIndex: 152
    SolutionNameMin: Cijk_Alik_Bjlk_BSS_BH_Bias_HA_S_SAB_SCD_SAV_UserArgs_MT32x16x64_MI16x16x1_SN_LDSB0_AFC1_AG0_AFEM1_AFEM1_ASEM64_CLR1_CADS0_DTLA0_DTLB0_DTVA1_DTVB0_DTVSM0_DPLBn1_EPS0_ELFLR0_EMLLn1_FDSI0_GRPM1_GRVWA8_GRVWB8_GSUn1_GSUAMB_GSUC0_GSUWGMRR0_GLS0_ISA1200_IU1_K1_LDSTI0_LBSPPA0_LBSPPB256_LBSPPM0_LPA0_LPB16_LPM0_LRVW8_LWPMn1_MIAV1_MIWT1_1_MO40_MGRIPMn1_NTn1_NTA0_NTB0_NTC0_NTD0_NTM0_NEPBS0_NLCA4_NLCB1_ONLL0_PGR2_PLR1_PKA0_SGROBn1_SIA3_SS1_SU32_SUM0_SUS256_SPO0_SRVW0_SSO0_SVW1_SK0_SKFTR0_SKXCCM0_SGRO0_TIN0_TLDS1_TLDSM1_ULSGRO0_USL1_UIOFGRO0_USFGROn1_VSn1_VWA1_VWB1_WSGRA0_WSGRB0_WS32_WG32_2_1_WGM8_WGMXCC1_WGMXCCGn1
    SolutionIndex: 153
    SolutionNameMin: Cijk_Alik_Bjlk_BSS_BH_Bias_HA_S_SAB_SCD_SAV_UserArgs_MT16x32x64_MI16x16x1_SN_LDSB0_AFC1_AG0_AFEM1_AFEM1_ASEM1_CLR1_CADS0_DTLA0_DTLB0_DTVA0_DTVB1_DTVSM0_DPLBn1_EPS0_ELFLR0_EMLLn1_FDSI0_GRPM1_GRVWA8_GRVWB8_GSUn1_GSUAMB_GSUC0_GSUWGMRR0_GLS0_ISA1200_IU1_K1_LDSTI0_LBSPPA128_LBSPPB0_LBSPPM0_LPA16_LPB0_LPM0_LRVW8_LWPMn1_MIAV1_MIWT1_1_MO40_MGRIPMn1_NTn1_NTA0_NTB0_NTC0_NTD0_NTM0_NEPBS0_NLCA1_NLCB1_ONLL0_PGR2_PLR1_PKA0_SGROBn1_SIA3_SS1_SU32_SUM0_SUS256_SPO0_SRVW0_SSO0_SVW1_SK0_SKFTR0_SKXCCM0_SGRO0_TIN0_TLDS1_TLDSM1_ULSGRO0_USL1_UIOFGRO0_USFGROn1_VSn1_VWA1_VWB1_WSGRA0_WSGRB0_WS32_WG16_4_1_WGM8_WGMXCC1_WGMXCCGn1
    SolutionIndex: 154
    SolutionNameMin: Cijk_Alik_Bjlk_BSS_BH_Bias_HA_S_SAB_SCD_SAV_UserArgs_MT32x128x64_MI16x16x1_SN_LDSB0_AFC1_AG0_AFEM1_AFEM1_ASEM1_CLR1_CADS0_DTLA0_DTLB0_DTVA0_DTVB1_DTVSM0_DPLBn1_EPS0_ELFLR0_EMLLn1_FDSI0_GRPM1_GRVWA8_GRVWB8_GSUn1_GSUAMB_GSUC0_GSUWGMRR0_GLS0_ISA1200_IU1_K1_LDSTI0_LBSPPA128_LBSPPB0_LBSPPM0_LPA16_LPB0_LPM0_LRVW8_LWPMn1_MIAV1_MIWT1_4_MO40_MGRIPMn1_NTn1_NTA0_NTB0_NTC0_NTD0_NTM0_NEPBS0_NLCA1_NLCB4_ONLL0_PGR2_PLR1_PKA0_SGROBn1_SIA3_SS0_SU32_SUM0_SUS256_SPO0_SRVW0_SSO0_SVW8_SK0_SKFTR0_SKXCCM0_SGRO0_TIN0_TLDS1_TLDSM1_ULSGRO0_USL1_UIOFGRO0_USFGROn1_VSn1_VWA1_VWB1_WSGRA0_WSGRB0_WS32_WG32_4_1_WGM8_WGMXCC1_WGMXCCGn1
    SolutionIndex: 155
    SolutionNameMin: Cijk_Alik_Bjlk_BSS_BH_Bias_HA_S_SAB_SCD_SAV_UserArgs_MT64x64x64_MI16x16x1_SN_LDSB1_AFC1_AG0_AFEM1_AFEM1_ASEM1_CLR1_CADS0_DTLA0_DTLB0_DTVA0_DTVB0_DTVSM0_DPLBn1_EPS0_ELFLR0_EMLLn1_FDSI0_GRPM1_GRVWA8_GRVWB8_GSUn1_GSUAMB_GSUC0_GSUWGMRR0_GLS0_ISA1200_IU4_K1_LDSTI0_LBSPPA256_LBSPPB1024_LBSPPM0_LPA16_LPB32_LPM0_LRVW8_LWPMn1_MIAV1_MIWT2_2_MO40_MGRIPMn1_NTn1_NTA0_NTB0_NTC0_NTD0_NTM0_NEPBS0_NLCA1_NLCB1_ONLL0_PGR2_PLR1_PKA0_SGROBn1_SIA2_SS0_SU32_SUM0_SUS256_SPO0_SRVW0_SSO0_SVW8_SK0_SKFTR0_SKXCCM0_SGRO0_TIN0_TLDS1_TLDSM1_ULSGRO1_USL1_UIOFGRO0_USFGROn1_VSn1_VWA2_VWB2_WSGRA0_WSGRB0_WS32_WG32_4_1_WGM8_WGMXCC1_WGMXCCGn1
    SolutionIndex: 156
    SolutionNameMin: Cijk_Alik_Bjlk_BSS_BH_Bias_HA_S_SAB_SCD_SAV_UserArgs_MT128x64x32_MI16x16x1_SN_LDSB0_AFC1_AG0_AFEM1_AFEM1_ASEM32_CLR1_CADS0_DTLA0_DTLB0_DTVA1_DTVB1_DTVSM0_DPLBn1_EPS0_ELFLR0_EMLLn1_FDSI0_GRPM1_GRVWA8_GRVWB8_GSUn1_GSUAMB_GSUC0_GSUWGMRR0_GLS0_ISA1200_IU1_K1_LDSTI0_LBSPPA0_LBSPPB0_LBSPPM0_LPA0_LPB0_LPM0_LRVW8_LWPMn1_MIAV1_MIWT8_1_MO40_MGRIPMn1_NTn1_NTA0_NTB0_NTC0_NTD0_NTM0_NEPBS0_NLCA2_NLCB1_ONLL0_PGR1_PLR0_PKA0_SGROBn1_SIA3_SS1_SU32_SUM0_SUS256_SPO0_SRVW0_SSO0_SVW8_SK0_SKFTR0_SKXCCM0_SGRO0_TIN0_TLDS1_TLDSM1_ULSGRO0_USL1_UIOFGRO0_USFGROn1_VSn1_VWA8_VWB1_WSGRA0_WSGRB0_WS32_WG16_8_1_WGM8_WGMXCC1_WGMXCCGn1
    SolutionIndex: 157
    SolutionNameMin: Cijk_Alik_Bjlk_BSS_BH_Bias_HA_S_SAB_SCD_SAV_UserArgs_MT64x64x32_MI16x16x1_SN_LDSB0_AFC1_AG0_AFEM1_AFEM1_ASEM32_CLR1_CADS0_DTLA0_DTLB0_DTVA1_DTVB0_DTVSM0_DPLBn1_EPS0_ELFLR0_EMLLn1_FDSI0_GRPM1_GRVWA8_GRVWB8_GSUn1_GSUAMB_GSUC0_GSUWGMRR0_GLS0_ISA1200_IU1_K1_LDSTI0_LBSPPA0_LBSPPB1024_LBSPPM0_LPA0_LPB32_LPM0_LRVW8_LWPMn1_MIAV1_MIWT2_2_MO40_MGRIPMn1_NTn1_NTA0_NTB0_NTC0_NTD0_NTM0_NEPBS0_NLCA2_NLCB1_ONLL0_PGR2_PLR1_PKA0_SGROBn1_SIA3_SS1_SU32_SUM0_SUS256_SPO0_SRVW0_SSO0_SVW2_SK0_SKFTR0_SKXCCM0_SGRO0_TIN0_TLDS1_TLDSM1_ULSGRO0_USL1_UIOFGRO0_USFGROn1_VSn1_VWA2_VWB2_WSGRA0_WSGRB0_WS32_WG32_4_1_WGM8_WGMXCC1_WGMXCCGn1
    SolutionIndex: 158
    SolutionNameMin: Cijk_Alik_Bjlk_BSS_BH_Bias_HA_S_SAB_SCD_SAV_UserArgs_MT64x64x32_MI16x16x1_SN_LDSB0_AFC1_AG0_AFEM1_AFEM1_ASEM32_CLR1_CADS0_DTLA0_DTLB0_DTVA1_DTVB0_DTVSM0_DPLBn1_EPS0_ELFLR0_EMLLn1_FDSI0_GRPM1_GRVWA8_GRVWB8_GSUn1_GSUAMB_GSUC0_GSUWGMRR0_GLS0_ISA1200_IU1_K1_LDSTI0_LBSPPA0_LBSPPB1024_LBSPPM0_LPA0_LPB32_LPM0_LRVW8_LWPMn1_MIAV1_MIWT2_2_MO40_MGRIPMn1_NTn1_NTA0_NTB0_NTC0_NTD0_NTM0_NEPBS0_NLCA2_NLCB1_ONLL0_PGR2_PLR1_PKA0_SGROBn1_SIA3_SS0_SU32_SUM0_SUS256_SPO0_SRVW0_SSO0_SVW8_SK0_SKFTR0_SKXCCM0_SGRO0_TIN0_TLDS1_TLDSM1_ULSGRO0_USL1_UIOFGRO0_USFGROn1_VSn1_VWA2_VWB2_WSGRA0_WSGRB0_WS32_WG32_4_1_WGM8_WGMXCC1_WGMXCCGn1
    SolutionIndex: 159
    SolutionNameMin: Cijk_Alik_Bjlk_BSS_BH_Bias_HA_S_SAB_SCD_SAV_UserArgs_MT64x64x32_MI16x16x1_SN_LDSB0_AFC1_AG0_AFEM1_AFEM1_ASEM1_CLR1_CADS0_DTLA0_DTLB0_DTVA0_DTVB1_DTVSM0_DPLBn1_EPS0_ELFLR0_EMLLn1_FDSI0_GRPM1_GRVWA8_GRVWB8_GSUn1_GSUAMB_GSUC0_GSUWGMRR0_GLS0_ISA1200_IU1_K1_LDSTI0_LBSPPA128_LBSPPB0_LBSPPM0_LPA16_LPB0_LPM0_LRVW8_LWPMn1_MIAV1_MIWT2_2_MO40_MGRIPMn1_NTn1_NTA0_NTB0_NTC0_NTD0_NTM0_NEPBS0_NLCA1_NLCB2_ONLL0_PGR2_PLR1_PKA0_SGROBn1_SIA3_SS1_SU32_SUM0_SUS256_SPO0_SRVW0_SSO0_SVW2_SK0_SKFTR0_SKXCCM0_SGRO0_TIN0_TLDS1_TLDSM1_ULSGRO0_USL1_UIOFGRO0_USFGROn1_VSn1_VWA2_VWB1_WSGRA0_WSGRB0_WS32_WG32_4_1_WGM8_WGMXCC1_WGMXCCGn1
    SolutionIndex: 160
    SolutionNameMin: Cijk_Alik_Bjlk_BSS_BH_Bias_HA_S_SAB_SCD_SAV_UserArgs_MT32x32x128_MI16x16x1_SN_LDSB0_AFC1_AG0_AFEM1_AFEM1_ASEM1_CLR1_CADS0_DTLA0_DTLB0_DTVA0_DTVB1_DTVSM0_DPLBn1_EPS1_ELFLR0_EMLLn1_FDSI0_GRPM1_GRVWA8_GRVWB8_GSUn1_GSUAMB_GSUC0_GSUWGMRR0_GLS0_ISA1200_IU1_K1_LDSTI0_LBSPPA256_LBSPPB0_LBSPPM0_LPA16_LPB0_LPM0_LRVW8_LWPMn1_MIAV1_MIWT1_1_MO40_MGRIPMn1_NTn1_NTA0_NTB0_NTC0_NTD0_NTM0_NEPBS0_NLCA1_NLCB1_ONLL0_PGR1_PLR1_PKA0_SGROBn1_SIA3_SS0_SU32_SUM0_SUS256_SPO0_SRVW0_SSO0_SVW8_SK0_SKFTR0_SKXCCM0_SGRO0_TIN0_TLDS1_TLDSM1_ULSGRO0_USL1_UIOFGRO0_USFGROn1_VSn1_VWA1_VWB1_WSGRA0_WSGRB0_WS32_WG32_4_1_WGM8_WGMXCC1_WGMXCCGn1
    SolutionIndex: 161
    SolutionNameMin: Cijk_Alik_Bjlk_BSS_BH_Bias_HA_S_SAB_SCD_SAV_UserArgs_MT32x32x128_MI16x16x1_SN_LDSB0_AFC1_AG0_AFEM1_AFEM1_ASEM1_CLR1_CADS0_DTLA0_DTLB0_DTVA0_DTVB1_DTVSM0_DPLBn1_EPS1_ELFLR0_EMLLn1_FDSI0_GRPM1_GRVWA8_GRVWB8_GSUn1_GSUAMB_GSUC0_GSUWGMRR0_GLS0_ISA1200_IU1_K1_LDSTI0_LBSPPA256_LBSPPB0_LBSPPM0_LPA16_LPB0_LPM0_LRVW8_LWPMn1_MIAV1_MIWT1_1_MO40_MGRIPMn1_NTn1_NTA0_NTB0_NTC0_NTD0_NTM0_NEPBS0_NLCA1_NLCB1_ONLL0_PGR1_PLR1_PKA0_SGROBn1_SIA3_SS1_SU32_SUM0_SUS256_SPO0_SRVW0_SSO0_SVW1_SK0_SKFTR0_SKXCCM0_SGRO0_TIN0_TLDS1_TLDSM1_ULSGRO0_USL1_UIOFGRO0_USFGROn1_VSn1_VWA1_VWB1_WSGRA0_WSGRB0_WS32_WG32_4_1_WGM8_WGMXCC1_WGMXCCGn1
    SolutionIndex: 162
    SolutionNameMin: Cijk_Alik_Bjlk_BSS_BH_Bias_HA_S_SAB_SCD_SAV_UserArgs_MT64x64x64_MI16x16x1_SN_LDSB1_AFC1_AG0_AFEM1_AFEM1_ASEM1_CLR1_CADS0_DTLA0_DTLB0_DTVA0_DTVB0_DTVSM0_DPLBn1_EPS0_ELFLR0_EMLLn1_FDSI0_GRPM1_GRVWA8_GRVWB8_GSUn1_GSUAMB_GSUC0_GSUWGMRR0_GLS0_ISA1200_IU1_K1_LDSTI0_LBSPPA256_LBSPPB1024_LBSPPM0_LPA16_LPB32_LPM0_LRVW8_LWPMn1_MIAV1_MIWT2_2_MO40_MGRIPMn1_NTn1_NTA0_NTB0_NTC0_NTD0_NTM0_NEPBS0_NLCA1_NLCB1_ONLL0_PGR2_PLR1_PKA0_SGROBn1_SIA3_SS1_SU32_SUM0_SUS256_SPO0_SRVW0_SSO0_SVW2_SK0_SKFTR0_SKXCCM0_SGRO0_TIN0_TLDS1_TLDSM1_ULSGRO0_USL1_UIOFGRO0_USFGROn1_VSn1_VWA2_VWB2_WSGRA0_WSGRB0_WS32_WG32_4_1_WGM8_WGMXCC1_WGMXCCGn1
    SolutionIndex: 163
    SolutionNameMin: Cijk_Alik_Bjlk_BSS_BH_Bias_HA_S_SAB_SCD_SAV_UserArgs_MT128x128x16_MI16x16x1_SN_LDSB1_AFC1_AG0_AFEM1_AFEM1_ASEM1_CLR1_CADS0_DTLA0_DTLB0_DTVA0_DTVB0_DTVSM0_DPLBn1_EPS0_ELFLR0_EMLLn1_FDSI0_GRPM1_GRVWA8_GRVWB8_GSUn1_GSUAMB_GSUC0_GSUWGMRR0_GLS0_ISA1200_IU1_K1_LDSTI0_LBSPPA128_LBSPPB2048_LBSPPM0_LPA16_LPB0_LPM0_LRVW8_LWPMn1_MIAV1_MIWT4_4_MO40_MGRIPMn1_NTn1_NTA0_NTB0_NTC0_NTD0_NTM0_NEPBS0_NLCA1_NLCB1_ONLL0_PGR2_PLR1_PKA0_SGROBn1_SIA2_SS1_SU32_SUM0_SUS256_SPO0_SRVW0_SSO0_SVW4_SK0_SKFTR0_SKXCCM0_SGRO0_TIN0_TLDS1_TLDSM1_ULSGRO1_USL1_UIOFGRO0_USFGROn1_VSn1_VWA4_VWB4_WSGRA0_WSGRB0_WS32_WG32_4_1_WGM8_WGMXCC1_WGMXCCGn1
    SolutionIndex: 164
    SolutionNameMin: Cijk_Alik_Bjlk_BSS_BH_Bias_HA_S_SAB_SCD_SAV_UserArgs_MT128x128x32_MI16x16x1_SN_LDSB1_AFC1_AG0_AFEM1_AFEM1_ASEM1_CLR1_CADS0_DTLA0_DTLB0_DTVA0_DTVB0_DTVSM0_DPLBn1_EPS1_ELFLR0_EMLLn1_FDSI0_GRPM1_GRVWA8_GRVWB8_GSUn1_GSUAMB_GSUC0_GSUWGMRR0_GLS0_ISA1200_IU1_K1_LDSTI0_LBSPPA256_LBSPPB2048_LBSPPM0_LPA16_LPB0_LPM0_LRVW8_LWPMn1_MIAV1_MIWT4_4_MO40_MGRIPMn1_NTn1_NTA0_NTB0_NTC0_NTD0_NTM0_NEPBS0_NLCA1_NLCB1_ONLL0_PGR1_PLR1_PKA0_SGROBn1_SIA3_SS1_SU32_SUM0_SUS256_SPO0_SRVW0_SSO0_SVW4_SK0_SKFTR0_SKXCCM0_SGRO0_TIN0_TLDS1_TLDSM1_ULSGRO0_USL1_UIOFGRO0_USFGROn1_VSn1_VWA4_VWB4_WSGRA0_WSGRB0_WS32_WG32_4_1_WGM8_WGMXCC1_WGMXCCGn1
    SolutionIndex: 165
    SolutionNameMin: Cijk_Alik_Bjlk_BSS_BH_Bias_HA_S_SAB_SCD_SAV_UserArgs_MT128x64x16_MI16x16x1_SN_LDSB0_AFC1_AG0_AFEM1_AFEM1_ASEM16_CLR1_CADS0_DTLA0_DTLB0_DTVA1_DTVB1_DTVSM0_DPLBn1_EPS0_ELFLR0_EMLLn1_FDSI0_GRPM1_GRVWA8_GRVWB8_GSUn1_GSUAMB_GSUC0_GSUWGMRR0_GLS0_ISA1200_IU1_K1_LDSTI0_LBSPPA0_LBSPPB0_LBSPPM0_LPA0_LPB0_LPM0_LRVW8_LWPMn1_MIAV1_MIWT8_1_MO40_MGRIPMn1_NTn1_NTA0_NTB0_NTC0_NTD0_NTM0_NEPBS0_NLCA1_NLCB1_ONLL0_PGR1_PLR0_PKA0_SGROBn1_SIA3_SS1_SU32_SUM0_SUS256_SPO0_SRVW0_SSO0_SVW8_SK0_SKFTR0_SKXCCM0_SGRO0_TIN0_TLDS1_TLDSM1_ULSGRO0_USL1_UIOFGRO0_USFGROn1_VSn1_VWA8_VWB1_WSGRA0_WSGRB0_WS32_WG16_8_1_WGM8_WGMXCC1_WGMXCCGn1
    SolutionIndex: 166
    SolutionNameMin: Cijk_Alik_Bjlk_BSS_BH_Bias_HA_S_SAB_SCD_SAV_UserArgs_MT64x64x32_MI16x16x1_SN_LDSB1_AFC1_AG0_AFEM1_AFEM1_ASEM1_CLR1_CADS0_DTLA0_DTLB0_DTVA0_DTVB0_DTVSM0_DPLBn1_EPS1_ELFLR0_EMLLn1_FDSI0_GRPM1_GRVWA8_GRVWB8_GSUn1_GSUAMB_GSUC0_GSUWGMRR0_GLS0_ISA1200_IU2_K1_LDSTI0_LBSPPA128_LBSPPB1024_LBSPPM0_LPA16_LPB32_LPM0_LRVW8_LWPMn1_MIAV1_MIWT2_2_MO40_MGRIPMn1_NTn1_NTA0_NTB0_NTC0_NTD0_NTM0_NEPBS0_NLCA1_NLCB1_ONLL0_PGR1_PLR1_PKA0_SGROBn1_SIA2_SS1_SU32_SUM0_SUS256_SPO0_SRVW0_SSO0_SVW2_SK0_SKFTR0_SKXCCM0_SGRO0_TIN0_TLDS1_TLDSM1_ULSGRO0_USL1_UIOFGRO0_USFGROn1_VSn1_VWA2_VWB2_WSGRA0_WSGRB0_WS32_WG32_4_1_WGM8_WGMXCC1_WGMXCCGn1
    SolutionIndex: 167
    SolutionNameMin: Cijk_Alik_Bjlk_BSS_BH_Bias_HA_S_SAB_SCD_SAV_UserArgs_MT128x128x16_MI16x16x1_SN_LDSB1_AFC1_AG0_AFEM1_AFEM1_ASEM1_CLR1_CADS0_DTLA0_DTLB0_DTVA0_DTVB0_DTVSM0_DPLBn1_EPS0_ELFLR0_EMLLn1_FDSI0_GRPM1_GRVWA8_GRVWB8_GSUn1_GSUAMB_GSUC0_GSUWGMRR0_GLS0_ISA1200_IU1_K1_LDSTI0_LBSPPA128_LBSPPB2048_LBSPPM0_LPA16_LPB0_LPM0_LRVW8_LWPMn1_MIAV1_MIWT4_4_MO40_MGRIPMn1_NTn1_NTA0_NTB0_NTC0_NTD0_NTM0_NEPBS0_NLCA1_NLCB1_ONLL0_PGR2_PLR1_PKA0_SGROBn1_SIA2_SS1_SU32_SUM0_SUS256_SPO0_SRVW0_SSO0_SVW4_SK0_SKFTR0_SKXCCM0_SGRO0_TIN0_TLDS1_TLDSM1_ULSGRO0_USL1_UIOFGRO0_USFGROn1_VSn1_VWA4_VWB4_WSGRA0_WSGRB0_WS32_WG32_4_1_WGM8_WGMXCC1_WGMXCCGn1
    SolutionIndex: 168
    SolutionNameMin: Cijk_Alik_Bjlk_BSS_BH_Bias_HA_S_SAB_SCD_SAV_UserArgs_MT64x64x32_MI16x16x1_SN_LDSB1_AFC1_AG0_AFEM1_AFEM1_ASEM1_CLR1_CADS0_DTLA0_DTLB0_DTVA0_DTVB0_DTVSM0_DPLBn1_EPS0_ELFLR0_EMLLn1_FDSI0_GRPM1_GRVWA8_GRVWB8_GSUn1_GSUAMB_GSUC0_GSUWGMRR0_GLS0_ISA1200_IU2_K1_LDSTI0_LBSPPA128_LBSPPB1024_LBSPPM0_LPA16_LPB32_LPM0_LRVW8_LWPMn1_MIAV1_MIWT2_2_MO40_MGRIPMn1_NTn1_NTA0_NTB0_NTC0_NTD0_NTM0_NEPBS0_NLCA1_NLCB1_ONLL0_PGR2_PLR1_PKA0_SGROBn1_SIA2_SS1_SU32_SUM0_SUS256_SPO0_SRVW0_SSO0_SVW2_SK0_SKFTR0_SKXCCM0_SGRO0_TIN0_TLDS1_TLDSM1_ULSGRO0_USL1_UIOFGRO0_USFGROn1_VSn1_VWA2_VWB2_WSGRA0_WSGRB0_WS32_WG32_4_1_WGM8_WGMXCC1_WGMXCCGn1
    SolutionIndex: 169
    SolutionNameMin: Cijk_Alik_Bjlk_BSS_BH_Bias_HA_S_SAB_SCD_SAV_UserArgs_MT128x128x16_MI16x16x1_SN_LDSB0_AFC1_AG0_AFEM1_AFEM1_ASEM16_CLR1_CADS0_DTLA0_DTLB0_DTVA1_DTVB1_DTVSM0_DPLBn1_EPS0_ELFLR0_EMLLn1_FDSI0_GRPM1_GRVWA8_GRVWB8_GSUn1_GSUAMB_GSUC0_GSUWGMRR0_GLS0_ISA1200_IU1_K1_LDSTI0_LBSPPA0_LBSPPB0_LBSPPM0_LPA0_LPB0_LPM0_LRVW8_LWPMn1_MIAV1_MIWT4_4_MO40_MGRIPMn1_NTn1_NTA0_NTB0_NTC0_NTD0_NTM0_NEPBS0_NLCA1_NLCB1_ONLL0_PGR1_PLR0_PKA0_SGROBn1_SIA3_SS0_SU32_SUM0_SUS256_SPO0_SRVW0_SSO0_SVW8_SK0_SKFTR0_SKXCCM0_SGRO0_TIN0_TLDS1_TLDSM1_ULSGRO0_USL1_UIOFGRO0_USFGROn1_VSn1_VWA4_VWB1_WSGRA0_WSGRB0_WS32_WG32_4_1_WGM8_WGMXCC1_WGMXCCGn1
    SolutionIndex: 170
    SolutionNameMin: Cijk_Alik_Bjlk_BSS_BH_Bias_HA_S_SAB_SCD_SAV_UserArgs_MT128x32x32_MI16x16x1_SN_LDSB0_AFC1_AG0_AFEM1_AFEM1_ASEM32_CLR1_CADS0_DTLA0_DTLB0_DTVA1_DTVB1_DTVSM0_DPLBn1_EPS0_ELFLR0_EMLLn1_FDSI0_GRPM1_GRVWA8_GRVWB8_GSUn1_GSUAMB_GSUC0_GSUWGMRR0_GLS0_ISA1200_IU1_K1_LDSTI0_LBSPPA0_LBSPPB0_LBSPPM0_LPA0_LPB0_LPM0_LRVW8_LWPMn1_MIAV1_MIWT4_1_MO40_MGRIPMn1_NTn1_NTA0_NTB0_NTC0_NTD0_NTM0_NEPBS0_NLCA2_NLCB1_ONLL0_PGR1_PLR0_PKA0_SGROBn1_SIA3_SS1_SU32_SUM0_SUS256_SPO0_SRVW0_SSO0_SVW4_SK0_SKFTR0_SKXCCM0_SGRO0_TIN0_TLDS1_TLDSM1_ULSGRO0_USL1_UIOFGRO0_USFGROn1_VSn1_VWA4_VWB1_WSGRA0_WSGRB0_WS32_WG32_4_1_WGM8_WGMXCC1_WGMXCCGn1
    SolutionIndex: 171
    SolutionNameMin: Cijk_Alik_Bjlk_BSS_BH_Bias_HA_S_SAB_SCD_SAV_UserArgs_MT128x64x32_MI16x16x1_SN_LDSB0_AFC1_AG0_AFEM1_AFEM1_ASEM32_CLR1_CADS0_DTLA0_DTLB0_DTVA1_DTVB0_DTVSM0_DPLBn1_EPS0_ELFLR0_EMLLn1_FDSI0_GRPM1_GRVWA8_GRVWB8_GSUn1_GSUAMB_GSUC0_GSUWGMRR0_GLS0_ISA1200_IU1_K1_LDSTI0_LBSPPA0_LBSPPB1024_LBSPPM0_LPA0_LPB16_LPM0_LRVW8_LWPMn1_MIAV1_MIWT8_1_MO40_MGRIPMn1_NTn1_NTA0_NTB0_NTC0_NTD0_NTM0_NEPBS0_NLCA2_NLCB1_ONLL0_PGR2_PLR1_PKA0_SGROBn1_SIA3_SS1_SU32_SUM0_SUS256_SPO0_SRVW0_SSO0_SVW8_SK0_SKFTR0_SKXCCM0_SGRO0_TIN0_TLDS1_TLDSM1_ULSGRO0_USL1_UIOFGRO0_USFGROn1_VSn1_VWA8_VWB1_WSGRA0_WSGRB0_WS32_WG16_8_1_WGM8_WGMXCC1_WGMXCCGn1
    SolutionIndex: 172
    SolutionNameMin: Cijk_Alik_Bjlk_BSS_BH_Bias_HA_S_SAB_SCD_SAV_UserArgs_MT64x64x64_MI16x16x1_SN_LDSB0_AFC1_AG0_AFEM1_AFEM1_ASEM64_CLR1_CADS0_DTLA0_DTLB0_DTVA1_DTVB0_DTVSM0_DPLBn1_EPS1_ELFLR0_EMLLn1_FDSI0_GRPM1_GRVWA8_GRVWB8_GSUn1_GSUAMB_GSUC0_GSUWGMRR0_GLS0_ISA1200_IU1_K1_LDSTI0_LBSPPA0_LBSPPB1024_LBSPPM0_LPA0_LPB32_LPM0_LRVW8_LWPMn1_MIAV1_MIWT2_2_MO40_MGRIPMn1_NTn1_NTA0_NTB0_NTC0_NTD0_NTM0_NEPBS0_NLCA4_NLCB1_ONLL0_PGR1_PLR1_PKA0_SGROBn1_SIA3_SS1_SU32_SUM0_SUS256_SPO0_SRVW0_SSO0_SVW2_SK0_SKFTR0_SKXCCM0_SGRO0_TIN0_TLDS1_TLDSM1_ULSGRO0_USL1_UIOFGRO0_USFGROn1_VSn1_VWA2_VWB2_WSGRA0_WSGRB0_WS32_WG32_4_1_WGM8_WGMXCC1_WGMXCCGn1
    SolutionIndex: 173
    SolutionNameMin: Cijk_Alik_Bjlk_BSS_BH_Bias_HA_S_SAB_SCD_SAV_UserArgs_MT64x64x128_MI16x16x1_SN_LDSB1_AFC1_AG0_AFEM1_AFEM1_ASEM1_CLR1_CADS0_DTLA0_DTLB0_DTVA0_DTVB0_DTVSM0_DPLBn1_EPS0_ELFLR0_EMLLn1_FDSI0_GRPM1_GRVWA8_GRVWB8_GSUn1_GSUAMB_GSUC0_GSUWGMRR0_GLS0_ISA1200_IU1_K1_LDSTI0_LBSPPA512_LBSPPB1024_LBSPPM0_LPA16_LPB32_LPM0_LRVW8_LWPMn1_MIAV1_MIWT2_2_MO40_MGRIPMn1_NTn1_NTA0_NTB0_NTC0_NTD0_NTM0_NEPBS0_NLCA1_NLCB1_ONLL0_PGR2_PLR1_PKA0_SGROBn1_SIA3_SS0_SU32_SUM0_SUS256_SPO0_SRVW0_SSO0_SVW8_SK0_SKFTR0_SKXCCM0_SGRO0_TIN0_TLDS1_TLDSM1_ULSGRO0_USL1_UIOFGRO0_USFGROn1_VSn1_VWA2_VWB2_WSGRA0_WSGRB0_WS32_WG32_4_1_WGM8_WGMXCC1_WGMXCCGn1
    SolutionIndex: 174
    SolutionNameMin: Cijk_Alik_Bjlk_BSS_BH_Bias_HA_S_SAB_SCD_SAV_UserArgs_MT64x64x16_MI16x16x1_SN_LDSB1_AFC1_AG0_AFEM1_AFEM1_ASEM1_CLR1_CADS0_DTLA0_DTLB0_DTVA0_DTVB0_DTVSM0_DPLBn1_EPS0_ELFLR0_EMLLn1_FDSI0_GRPM1_GRVWA8_GRVWB8_GSUn1_GSUAMB_GSUC0_GSUWGMRR0_GLS0_ISA1200_IU1_K1_LDSTI0_LBSPPA128_LBSPPB1024_LBSPPM0_LPA16_LPB32_LPM0_LRVW8_LWPMn1_MIAV1_MIWT2_2_MO40_MGRIPMn1_NTn1_NTA0_NTB0_NTC0_NTD0_NTM0_NEPBS0_NLCA1_NLCB1_ONLL0_PGR2_PLR1_PKA0_SGROBn1_SIA2_SS0_SU32_SUM0_SUS256_SPO0_SRVW0_SSO0_SVW8_SK0_SKFTR0_SKXCCM0_SGRO0_TIN0_TLDS1_TLDSM1_ULSGRO1_USL1_UIOFGRO0_USFGROn1_VSn1_VWA2_VWB2_WSGRA0_WSGRB0_WS32_WG32_4_1_WGM8_WGMXCC1_WGMXCCGn1
    SolutionIndex: 175
    SolutionNameMin: Cijk_Alik_Bjlk_BSS_BH_Bias_HA_S_SAB_SCD_SAV_UserArgs_MT128x128x32_MI16x16x1_SN_LDSB0_AFC1_AG0_AFEM1_AFEM1_ASEM1_CLR1_CADS0_DTLA0_DTLB0_DTVA0_DTVB1_DTVSM0_DPLBn1_EPS0_ELFLR0_EMLLn1_FDSI0_GRPM1_GRVWA8_GRVWB8_GSUn1_GSUAMB_GSUC0_GSUWGMRR0_GLS0_ISA1200_IU1_K1_LDSTI0_LBSPPA512_LBSPPB0_LBSPPM0_LPA16_LPB0_LPM0_LRVW8_LWPMn1_MIAV1_MIWT8_2_MO40_MGRIPMn1_NTn1_NTA0_NTB0_NTC0_NTD0_NTM0_NEPBS0_NLCA1_NLCB2_ONLL0_PGR2_PLR1_PKA0_SGROBn1_SIA3_SS0_SU32_SUM0_SUS256_SPO0_SRVW0_SSO0_SVW8_SK0_SKFTR0_SKXCCM0_SGRO0_TIN0_TLDS1_TLDSM1_ULSGRO0_USL1_UIOFGRO0_USFGROn1_VSn1_VWA8_VWB1_WSGRA0_WSGRB0_WS32_WG16_8_1_WGM8_WGMXCC1_WGMXCCGn1
    SolutionIndex: 176
    SolutionNameMin: Cijk_Alik_Bjlk_BSS_BH_Bias_HA_S_SAB_SCD_SAV_UserArgs_MT64x64x128_MI16x16x1_SN_LDSB1_AFC1_AG0_AFEM1_AFEM1_ASEM1_CLR1_CADS0_DTLA0_DTLB0_DTVA0_DTVB0_DTVSM0_DPLBn1_EPS1_ELFLR0_EMLLn1_FDSI0_GRPM1_GRVWA8_GRVWB8_GSUn1_GSUAMB_GSUC0_GSUWGMRR0_GLS0_ISA1200_IU1_K1_LDSTI0_LBSPPA512_LBSPPB1024_LBSPPM0_LPA16_LPB32_LPM0_LRVW8_LWPMn1_MIAV1_MIWT2_2_MO40_MGRIPMn1_NTn1_NTA0_NTB0_NTC0_NTD0_NTM0_NEPBS0_NLCA1_NLCB1_ONLL0_PGR1_PLR1_PKA0_SGROBn1_SIA3_SS0_SU32_SUM0_SUS256_SPO0_SRVW0_SSO0_SVW8_SK0_SKFTR0_SKXCCM0_SGRO0_TIN0_TLDS1_TLDSM1_ULSGRO0_USL1_UIOFGRO0_USFGROn1_VSn1_VWA2_VWB2_WSGRA0_WSGRB0_WS32_WG32_4_1_WGM8_WGMXCC1_WGMXCCGn1
    SolutionIndex: 177
    SolutionNameMin: Cijk_Alik_Bjlk_BSS_BH_Bias_HA_S_SAB_SCD_SAV_UserArgs_MT64x64x64_MI16x16x1_SN_LDSB1_AFC1_AG0_AFEM1_AFEM1_ASEM1_CLR1_CADS0_DTLA0_DTLB0_DTVA0_DTVB0_DTVSM0_DPLBn1_EPS0_ELFLR0_EMLLn1_FDSI0_GRPM1_GRVWA8_GRVWB8_GSUn1_GSUAMB_GSUC0_GSUWGMRR0_GLS0_ISA1200_IU1_K1_LDSTI0_LBSPPA256_LBSPPB1024_LBSPPM0_LPA16_LPB32_LPM0_LRVW8_LWPMn1_MIAV1_MIWT2_2_MO40_MGRIPMn1_NTn1_NTA0_NTB0_NTC0_NTD0_NTM0_NEPBS0_NLCA1_NLCB1_ONLL0_PGR2_PLR1_PKA0_SGROBn1_SIA3_SS1_SU32_SUM0_SUS256_SPO0_SRVW0_SSO0_SVW2_SK0_SKFTR0_SKXCCM0_SGRO0_TIN0_TLDS1_TLDSM1_ULSGRO1_USL1_UIOFGRO0_USFGROn1_VSn1_VWA2_VWB2_WSGRA0_WSGRB0_WS32_WG32_4_1_WGM8_WGMXCC1_WGMXCCGn1
    SolutionIndex: 178
    SolutionNameMin: Cijk_Alik_Bjlk_BSS_BH_Bias_HA_S_SAB_SCD_SAV_UserArgs_MT128x128x16_MI16x16x1_SN_LDSB0_AFC1_AG0_AFEM1_AFEM1_ASEM1_CLR0_CADS0_DTLA0_DTLB0_DTVA0_DTVB0_DTVSM0_DPLBn1_EPS0_ELFLR0_EMLLn1_FDSI0_GRPM1_GRVWA8_GRVWB8_GSUn1_GSUAMB_GSUC0_GSUWGMRR0_GLS0_ISA1200_IU1_K1_LDSTI0_LBSPPA128_LBSPPB2048_LBSPPM0_LPA16_LPB0_LPM0_LRVW8_LWPMn1_MIAV1_MIWT4_4_MO40_MGRIPMn1_NTn1_NTA0_NTB0_NTC0_NTD0_NTM0_NEPBS0_NLCA1_NLCB1_ONLL0_PGR2_PLR0_PKA0_SGROBn1_SIA3_SS1_SU32_SUM0_SUS256_SPO0_SRVW0_SSO0_SVW4_SK0_SKFTR0_SKXCCM0_SGRO0_TIN0_TLDS1_TLDSM1_ULSGRO0_USL1_UIOFGRO0_USFGROn1_VSn1_VWA4_VWB4_WSGRA0_WSGRB0_WS32_WG32_4_1_WGM8_WGMXCC1_WGMXCCGn1
    SolutionIndex: 179
    SolutionNameMin: Cijk_Alik_Bjlk_BSS_BH_Bias_HA_S_SAB_SCD_SAV_UserArgs_MT128x128x16_MI16x16x1_SN_LDSB1_AFC1_AG0_AFEM1_AFEM1_ASEM1_CLR1_CADS0_DTLA0_DTLB0_DTVA0_DTVB0_DTVSM0_DPLBn1_EPS1_ELFLR0_EMLLn1_FDSI0_GRPM1_GRVWA8_GRVWB8_GSUn1_GSUAMB_GSUC0_GSUWGMRR0_GLS0_ISA1200_IU1_K1_LDSTI0_LBSPPA128_LBSPPB2048_LBSPPM0_LPA16_LPB0_LPM0_LRVW8_LWPMn1_MIAV1_MIWT4_4_MO40_MGRIPMn1_NTn1_NTA0_NTB0_NTC0_NTD0_NTM0_NEPBS0_NLCA1_NLCB1_ONLL0_PGR1_PLR1_PKA0_SGROBn1_SIA2_SS0_SU32_SUM0_SUS256_SPO0_SRVW0_SSO0_SVW8_SK0_SKFTR0_SKXCCM0_SGRO0_TIN0_TLDS1_TLDSM1_ULSGRO0_USL1_UIOFGRO0_USFGROn1_VSn1_VWA4_VWB4_WSGRA0_WSGRB0_WS32_WG32_4_1_WGM8_WGMXCC1_WGMXCCGn1
    SolutionIndex: 180
    SolutionNameMin: Cijk_Alik_Bjlk_BSS_BH_Bias_HA_S_SAB_SCD_SAV_UserArgs_MT128x128x32_MI16x16x1_SN_LDSB0_AFC1_AG0_AFEM1_AFEM1_ASEM1_CLR1_CADS0_DTLA0_DTLB0_DTVA0_DTVB1_DTVSM0_DPLBn1_EPS1_ELFLR0_EMLLn1_FDSI0_GRPM1_GRVWA8_GRVWB8_GSUn1_GSUAMB_GSUC0_GSUWGMRR0_GLS0_ISA1200_IU1_K1_LDSTI0_LBSPPA512_LBSPPB0_LBSPPM0_LPA16_LPB0_LPM0_LRVW8_LWPMn1_MIAV1_MIWT8_2_MO40_MGRIPMn1_NTn1_NTA0_NTB0_NTC0_NTD0_NTM0_NEPBS0_NLCA1_NLCB2_ONLL0_PGR1_PLR1_PKA0_SGROBn1_SIA3_SS0_SU32_SUM0_SUS256_SPO0_SRVW0_SSO0_SVW8_SK0_SKFTR0_SKXCCM0_SGRO0_TIN0_TLDS1_TLDSM1_ULSGRO0_USL1_UIOFGRO0_USFGROn1_VSn1_VWA8_VWB1_WSGRA0_WSGRB0_WS32_WG16_8_1_WGM8_WGMXCC1_WGMXCCGn1
    SolutionIndex: 181
    SolutionNameMin: Cijk_Alik_Bjlk_BSS_BH_Bias_HA_S_SAB_SCD_SAV_UserArgs_MT32x16x128_MI16x16x1_SN_LDSB0_AFC1_AG0_AFEM1_AFEM1_ASEM128_CLR1_CADS0_DTLA0_DTLB0_DTVA1_DTVB0_DTVSM0_DPLBn1_EPS0_ELFLR0_EMLLn1_FDSI0_GRPM1_GRVWA8_GRVWB8_GSUn1_GSUAMB_GSUC0_GSUWGMRR0_GLS0_ISA1200_IU1_K1_LDSTI0_LBSPPA0_LBSPPB256_LBSPPM0_LPA0_LPB16_LPM0_LRVW8_LWPMn1_MIAV1_MIWT1_1_MO40_MGRIPMn1_NTn1_NTA0_NTB0_NTC0_NTD0_NTM0_NEPBS0_NLCA8_NLCB1_ONLL0_PGR2_PLR1_PKA0_SGROBn1_SIA3_SS0_SU32_SUM0_SUS256_SPO0_SRVW0_SSO0_SVW8_SK0_SKFTR0_SKXCCM0_SGRO0_TIN0_TLDS1_TLDSM1_ULSGRO0_USL1_UIOFGRO0_USFGROn1_VSn1_VWA1_VWB1_WSGRA0_WSGRB0_WS32_WG32_2_1_WGM8_WGMXCC1_WGMXCCGn1
    SolutionIndex: 182
    SolutionNameMin: Cijk_Alik_Bjlk_BSS_BH_Bias_HA_S_SAB_SCD_SAV_UserArgs_MT16x16x128_MI16x16x1_SN_LDSB0_AFC1_AG0_AFEM1_AFEM1_ASEM1_CLR1_CADS0_DTLA0_DTLB0_DTVA0_DTVB1_DTVSM0_DPLBn1_EPS0_ELFLR0_EMLLn1_FDSI0_GRPM1_GRVWA8_GRVWB8_GSUn1_GSUAMB_GSUC0_GSUWGMRR0_GLS0_ISA1200_IU1_K1_LDSTI0_LBSPPA256_LBSPPB0_LBSPPM0_LPA16_LPB0_LPM0_LRVW8_LWPMn1_MIAV1_MIWT1_1_MO40_MGRIPMn1_NTn1_NTA0_NTB0_NTC0_NTD0_NTM0_NEPBS0_NLCA1_NLCB1_ONLL0_PGR2_PLR1_PKA0_SGROBn1_SIA3_SS0_SU32_SUM0_SUS256_SPO0_SRVW0_SSO0_SVW8_SK0_SKFTR0_SKXCCM0_SGRO0_TIN0_TLDS1_TLDSM1_ULSGRO0_USL1_UIOFGRO0_USFGROn1_VSn1_VWA1_VWB1_WSGRA0_WSGRB0_WS32_WG16_2_1_WGM8_WGMXCC1_WGMXCCGn1
    SolutionIndex: 183
    SolutionNameMin: Cijk_Alik_Bjlk_BSS_BH_Bias_HA_S_SAB_SCD_SAV_UserArgs_MT32x32x128_MI16x16x1_SN_LDSB0_AFC1_AG0_AFEM1_AFEM1_ASEM1_CLR1_CADS0_DTLA0_DTLB0_DTVA0_DTVB1_DTVSM0_DPLBn1_EPS0_ELFLR0_EMLLn1_FDSI0_GRPM1_GRVWA8_GRVWB8_GSUn1_GSUAMB_GSUC0_GSUWGMRR0_GLS0_ISA1200_IU1_K1_LDSTI0_LBSPPA256_LBSPPB0_LBSPPM0_LPA16_LPB0_LPM0_LRVW8_LWPMn1_MIAV1_MIWT1_1_MO40_MGRIPMn1_NTn1_NTA0_NTB0_NTC0_NTD0_NTM0_NEPBS0_NLCA1_NLCB1_ONLL0_PGR2_PLR1_PKA0_SGROBn1_SIA3_SS1_SU32_SUM0_SUS256_SPO0_SRVW0_SSO0_SVW1_SK0_SKFTR0_SKXCCM0_SGRO0_TIN0_TLDS1_TLDSM1_ULSGRO0_USL1_UIOFGRO0_USFGROn1_VSn1_VWA1_VWB1_WSGRA0_WSGRB0_WS32_WG32_4_1_WGM8_WGMXCC1_WGMXCCGn1
    SolutionIndex: 184
    SolutionNameMin: Cijk_Alik_Bjlk_BSS_BH_Bias_HA_S_SAB_SCD_SAV_UserArgs_MT32x16x128_MI16x16x1_SN_LDSB0_AFC1_AG0_AFEM1_AFEM1_ASEM1_CLR1_CADS0_DTLA0_DTLB0_DTVA0_DTVB1_DTVSM0_DPLBn1_EPS0_ELFLR0_EMLLn1_FDSI0_GRPM1_GRVWA8_GRVWB8_GSUn1_GSUAMB_GSUC0_GSUWGMRR0_GLS0_ISA1200_IU1_K1_LDSTI0_LBSPPA256_LBSPPB0_LBSPPM0_LPA16_LPB0_LPM0_LRVW8_LWPMn1_MIAV1_MIWT1_1_MO40_MGRIPMn1_NTn1_NTA0_NTB0_NTC0_NTD0_NTM0_NEPBS0_NLCA1_NLCB1_ONLL0_PGR2_PLR1_PKA0_SGROBn1_SIA3_SS0_SU32_SUM0_SUS256_SPO0_SRVW0_SSO0_SVW8_SK0_SKFTR0_SKXCCM0_SGRO0_TIN0_TLDS1_TLDSM1_ULSGRO0_USL1_UIOFGRO0_USFGROn1_VSn1_VWA1_VWB1_WSGRA0_WSGRB0_WS32_WG32_2_1_WGM8_WGMXCC1_WGMXCCGn1
    SolutionIndex: 185
    SolutionNameMin: Cijk_Alik_Bjlk_BSS_BH_Bias_HA_S_SAB_SCD_SAV_UserArgs_MT32x16x32_MI16x16x1_SN_LDSB0_AFC1_AG0_AFEM1_AFEM1_ASEM32_CLR1_CADS0_DTLA0_DTLB0_DTVA1_DTVB0_DTVSM0_DPLBn1_EPS0_ELFLR0_EMLLn1_FDSI0_GRPM1_GRVWA8_GRVWB8_GSUn1_GSUAMB_GSUC0_GSUWGMRR0_GLS0_ISA1200_IU1_K1_LDSTI0_LBSPPA0_LBSPPB256_LBSPPM0_LPA0_LPB16_LPM0_LRVW8_LWPMn1_MIAV1_MIWT1_1_MO40_MGRIPMn1_NTn1_NTA0_NTB0_NTC0_NTD0_NTM0_NEPBS0_NLCA2_NLCB1_ONLL0_PGR2_PLR1_PKA0_SGROBn1_SIA3_SS0_SU32_SUM0_SUS256_SPO0_SRVW0_SSO0_SVW8_SK0_SKFTR0_SKXCCM0_SGRO0_TIN0_TLDS1_TLDSM1_ULSGRO0_USL1_UIOFGRO0_USFGROn1_VSn1_VWA1_VWB1_WSGRA0_WSGRB0_WS32_WG32_2_1_WGM8_WGMXCC1_WGMXCCGn1
    SolutionIndex: 186
    SolutionNameMin: Cijk_Alik_Bjlk_BSS_BH_Bias_HA_S_SAB_SCD_SAV_UserArgs_MT32x32x128_MI16x16x1_SN_LDSB0_AFC1_AG0_AFEM1_AFEM1_ASEM128_CLR1_CADS0_DTLA0_DTLB0_DTVA1_DTVB0_DTVSM0_DPLBn1_EPS1_ELFLR0_EMLLn1_FDSI0_GRPM1_GRVWA8_GRVWB8_GSUn1_GSUAMB_GSUC0_GSUWGMRR0_GLS0_ISA1200_IU1_K1_LDSTI0_LBSPPA0_LBSPPB512_LBSPPM0_LPA0_LPB16_LPM0_LRVW8_LWPMn1_MIAV1_MIWT1_1_MO40_MGRIPMn1_NTn1_NTA0_NTB0_NTC0_NTD0_NTM0_NEPBS0_NLCA8_NLCB1_ONLL0_PGR1_PLR1_PKA0_SGROBn1_SIA3_SS0_SU32_SUM0_SUS256_SPO0_SRVW0_SSO0_SVW8_SK0_SKFTR0_SKXCCM0_SGRO0_TIN0_TLDS1_TLDSM1_ULSGRO0_USL1_UIOFGRO0_USFGROn1_VSn1_VWA1_VWB1_WSGRA0_WSGRB0_WS32_WG32_4_1_WGM8_WGMXCC1_WGMXCCGn1
    SolutionIndex: 187
    SolutionNameMin: Cijk_Alik_Bjlk_BSS_BH_Bias_HA_S_SAB_SCD_SAV_UserArgs_MT128x128x16_MI16x16x1_SN_LDSB0_AFC1_AG0_AFEM1_AFEM1_ASEM1_CLR0_CADS0_DTLA0_DTLB0_DTVA0_DTVB0_DTVSM0_DPLBn1_EPS0_ELFLR0_EMLLn1_FDSI0_GRPM1_GRVWA8_GRVWB8_GSUn1_GSUAMB_GSUC0_GSUWGMRR0_GLS0_ISA1200_IU1_K1_LDSTI0_LBSPPA128_LBSPPB2048_LBSPPM0_LPA16_LPB0_LPM0_LRVW8_LWPMn1_MIAV1_MIWT4_4_MO40_MGRIPMn1_NTn1_NTA0_NTB0_NTC0_NTD0_NTM0_NEPBS0_NLCA1_NLCB1_ONLL0_PGR2_PLR0_PKA0_SGROBn1_SIA3_SS0_SU32_SUM0_SUS256_SPO0_SRVW0_SSO0_SVW8_SK0_SKFTR0_SKXCCM0_SGRO0_TIN0_TLDS1_TLDSM1_ULSGRO0_USL1_UIOFGRO0_USFGROn1_VSn1_VWA4_VWB4_WSGRA0_WSGRB0_WS32_WG32_4_1_WGM8_WGMXCC1_WGMXCCGn1
    SolutionIndex: 188
    SolutionNameMin: Cijk_Alik_Bjlk_BSS_BH_Bias_HA_S_SAB_SCD_SAV_UserArgs_MT128x128x16_MI16x16x1_SN_LDSB0_AFC1_AG0_AFEM1_AFEM1_ASEM16_CLR1_CADS0_DTLA0_DTLB0_DTVA1_DTVB1_DTVSM0_DPLBn1_EPS0_ELFLR0_EMLLn1_FDSI0_GRPM1_GRVWA8_GRVWB8_GSUn1_GSUAMB_GSUC0_GSUWGMRR0_GLS0_ISA1200_IU1_K1_LDSTI0_LBSPPA0_LBSPPB0_LBSPPM0_LPA0_LPB0_LPM0_LRVW8_LWPMn1_MIAV1_MIWT4_4_MO40_MGRIPMn1_NTn1_NTA0_NTB0_NTC0_NTD0_NTM0_NEPBS0_NLCA1_NLCB1_ONLL0_PGR1_PLR0_PKA0_SGROBn1_SIA3_SS1_SU32_SUM0_SUS256_SPO0_SRVW0_SSO0_SVW4_SK0_SKFTR0_SKXCCM0_SGRO0_TIN0_TLDS1_TLDSM1_ULSGRO0_USL1_UIOFGRO0_USFGROn1_VSn1_VWA4_VWB1_WSGRA0_WSGRB0_WS32_WG32_4_1_WGM8_WGMXCC1_WGMXCCGn1
    SolutionIndex: 189
    SolutionNameMin: Cijk_Alik_Bjlk_BSS_BH_Bias_HA_S_SAB_SCD_SAV_UserArgs_MT16x16x128_MI16x16x1_SN_LDSB0_AFC1_AG0_AFEM1_AFEM1_ASEM1_CLR1_CADS0_DTLA0_DTLB0_DTVA0_DTVB1_DTVSM0_DPLBn1_EPS0_ELFLR0_EMLLn1_FDSI0_GRPM1_GRVWA8_GRVWB8_GSUn1_GSUAMB_GSUC0_GSUWGMRR0_GLS0_ISA1200_IU1_K1_LDSTI0_LBSPPA256_LBSPPB0_LBSPPM0_LPA16_LPB0_LPM0_LRVW8_LWPMn1_MIAV1_MIWT1_1_MO40_MGRIPMn1_NTn1_NTA0_NTB0_NTC0_NTD0_NTM0_NEPBS0_NLCA1_NLCB1_ONLL0_PGR2_PLR1_PKA0_SGROBn1_SIA3_SS1_SU32_SUM0_SUS256_SPO0_SRVW0_SSO0_SVW1_SK0_SKFTR0_SKXCCM0_SGRO0_TIN0_TLDS1_TLDSM1_ULSGRO0_USL1_UIOFGRO0_USFGROn1_VSn1_VWA1_VWB1_WSGRA0_WSGRB0_WS32_WG16_2_1_WGM8_WGMXCC1_WGMXCCGn1
    SolutionIndex: 190
    SolutionNameMin: Cijk_Alik_Bjlk_BSS_BH_Bias_HA_S_SAB_SCD_SAV_UserArgs_MT16x16x128_MI16x16x1_SN_LDSB0_AFC1_AG0_AFEM1_AFEM1_ASEM1_CLR1_CADS0_DTLA0_DTLB0_DTVA0_DTVB1_DTVSM0_DPLBn1_EPS1_ELFLR0_EMLLn1_FDSI0_GRPM1_GRVWA8_GRVWB8_GSUn1_GSUAMB_GSUC0_GSUWGMRR0_GLS0_ISA1200_IU1_K1_LDSTI0_LBSPPA256_LBSPPB0_LBSPPM0_LPA16_LPB0_LPM0_LRVW8_LWPMn1_MIAV1_MIWT1_1_MO40_MGRIPMn1_NTn1_NTA0_NTB0_NTC0_NTD0_NTM0_NEPBS0_NLCA1_NLCB1_ONLL0_PGR1_PLR1_PKA0_SGROBn1_SIA3_SS0_SU32_SUM0_SUS256_SPO0_SRVW0_SSO0_SVW8_SK0_SKFTR0_SKXCCM0_SGRO0_TIN0_TLDS1_TLDSM1_ULSGRO0_USL1_UIOFGRO0_USFGROn1_VSn1_VWA1_VWB1_WSGRA0_WSGRB0_WS32_WG16_2_1_WGM8_WGMXCC1_WGMXCCGn1
    SolutionIndex: 191
    SolutionNameMin: Cijk_Alik_Bjlk_BSS_BH_Bias_HA_S_SAB_SCD_SAV_UserArgs_MT32x128x64_MI16x16x1_SN_LDSB0_AFC1_AG0_AFEM1_AFEM1_ASEM1_CLR1_CADS0_DTLA0_DTLB0_DTVA0_DTVB1_DTVSM0_DPLBn1_EPS1_ELFLR0_EMLLn1_FDSI0_GRPM1_GRVWA8_GRVWB8_GSUn1_GSUAMB_GSUC0_GSUWGMRR0_GLS0_ISA1200_IU1_K1_LDSTI0_LBSPPA128_LBSPPB0_LBSPPM0_LPA16_LPB0_LPM0_LRVW8_LWPMn1_MIAV1_MIWT1_4_MO40_MGRIPMn1_NTn1_NTA0_NTB0_NTC0_NTD0_NTM0_NEPBS0_NLCA1_NLCB4_ONLL0_PGR1_PLR1_PKA0_SGROBn1_SIA3_SS1_SU32_SUM0_SUS256_SPO0_SRVW0_SSO0_SVW1_SK0_SKFTR0_SKXCCM0_SGRO0_TIN0_TLDS1_TLDSM1_ULSGRO0_USL1_UIOFGRO0_USFGROn1_VSn1_VWA1_VWB1_WSGRA0_WSGRB0_WS32_WG32_4_1_WGM8_WGMXCC1_WGMXCCGn1
    SolutionIndex: 192
    SolutionNameMin: Cijk_Alik_Bjlk_BSS_BH_Bias_HA_S_SAB_SCD_SAV_UserArgs_MT128x128x32_MI16x16x1_SN_LDSB1_AFC1_AG0_AFEM1_AFEM1_ASEM1_CLR1_CADS0_DTLA0_DTLB0_DTVA0_DTVB0_DTVSM0_DPLBn1_EPS0_ELFLR0_EMLLn1_FDSI0_GRPM1_GRVWA8_GRVWB8_GSUn1_GSUAMB_GSUC0_GSUWGMRR0_GLS0_ISA1200_IU1_K1_LDSTI0_LBSPPA256_LBSPPB2048_LBSPPM0_LPA16_LPB0_LPM0_LRVW8_LWPMn1_MIAV1_MIWT4_4_MO40_MGRIPMn1_NTn1_NTA0_NTB0_NTC0_NTD0_NTM0_NEPBS0_NLCA1_NLCB1_ONLL0_PGR2_PLR1_PKA0_SGROBn1_SIA3_SS0_SU32_SUM0_SUS256_SPO0_SRVW0_SSO0_SVW8_SK0_SKFTR0_SKXCCM0_SGRO0_TIN0_TLDS1_TLDSM1_ULSGRO0_USL1_UIOFGRO0_USFGROn1_VSn1_VWA4_VWB4_WSGRA0_WSGRB0_WS32_WG32_4_1_WGM8_WGMXCC1_WGMXCCGn1
    SolutionIndex: 193
    SolutionNameMin: Cijk_Alik_Bjlk_BSS_BH_Bias_HA_S_SAB_SCD_SAV_UserArgs_MT32x32x128_MI16x16x1_SN_LDSB0_AFC1_AG0_AFEM1_AFEM1_ASEM128_CLR1_CADS0_DTLA0_DTLB0_DTVA1_DTVB0_DTVSM0_DPLBn1_EPS1_ELFLR0_EMLLn1_FDSI0_GRPM1_GRVWA8_GRVWB8_GSUn1_GSUAMB_GSUC0_GSUWGMRR0_GLS0_ISA1200_IU1_K1_LDSTI0_LBSPPA0_LBSPPB512_LBSPPM0_LPA0_LPB16_LPM0_LRVW8_LWPMn1_MIAV1_MIWT1_1_MO40_MGRIPMn1_NTn1_NTA0_NTB0_NTC0_NTD0_NTM0_NEPBS0_NLCA8_NLCB1_ONLL0_PGR1_PLR1_PKA0_SGROBn1_SIA3_SS1_SU32_SUM0_SUS256_SPO0_SRVW0_SSO0_SVW1_SK0_SKFTR0_SKXCCM0_SGRO0_TIN0_TLDS1_TLDSM1_ULSGRO0_USL1_UIOFGRO0_USFGROn1_VSn1_VWA1_VWB1_WSGRA0_WSGRB0_WS32_WG32_4_1_WGM8_WGMXCC1_WGMXCCGn1
    SolutionIndex: 194
    SolutionNameMin: Cijk_Alik_Bjlk_BSS_BH_Bias_HA_S_SAB_SCD_SAV_UserArgs_MT32x128x64_MI16x16x1_SN_LDSB0_AFC1_AG0_AFEM1_AFEM1_ASEM64_CLR1_CADS0_DTLA0_DTLB0_DTVA1_DTVB0_DTVSM0_DPLBn1_EPS1_ELFLR0_EMLLn1_FDSI0_GRPM1_GRVWA8_GRVWB8_GSUn1_GSUAMB_GSUC0_GSUWGMRR0_GLS0_ISA1200_IU1_K1_LDSTI0_LBSPPA0_LBSPPB2048_LBSPPM0_LPA0_LPB0_LPM0_LRVW8_LWPMn1_MIAV1_MIWT1_4_MO40_MGRIPMn1_NTn1_NTA0_NTB0_NTC0_NTD0_NTM0_NEPBS0_NLCA4_NLCB1_ONLL0_PGR1_PLR1_PKA0_SGROBn1_SIA3_SS0_SU32_SUM0_SUS256_SPO0_SRVW0_SSO0_SVW8_SK0_SKFTR0_SKXCCM0_SGRO0_TIN0_TLDS1_TLDSM1_ULSGRO0_USL1_UIOFGRO0_USFGROn1_VSn1_VWA1_VWB4_WSGRA0_WSGRB0_WS32_WG32_4_1_WGM8_WGMXCC1_WGMXCCGn1
    SolutionIndex: 195
    SolutionNameMin: Cijk_Alik_Bjlk_BSS_BH_Bias_HA_S_SAB_SCD_SAV_UserArgs_MT64x64x128_MI16x16x1_SN_LDSB1_AFC1_AG0_AFEM1_AFEM1_ASEM1_CLR1_CADS0_DTLA0_DTLB0_DTVA0_DTVB0_DTVSM0_DPLBn1_EPS1_ELFLR0_EMLLn1_FDSI0_GRPM1_GRVWA8_GRVWB8_GSUn1_GSUAMB_GSUC0_GSUWGMRR0_GLS0_ISA1200_IU1_K1_LDSTI0_LBSPPA512_LBSPPB1024_LBSPPM0_LPA16_LPB32_LPM0_LRVW8_LWPMn1_MIAV1_MIWT2_2_MO40_MGRIPMn1_NTn1_NTA0_NTB0_NTC0_NTD0_NTM0_NEPBS0_NLCA1_NLCB1_ONLL0_PGR1_PLR1_PKA0_SGROBn1_SIA3_SS1_SU32_SUM0_SUS256_SPO0_SRVW0_SSO0_SVW2_SK0_SKFTR0_SKXCCM0_SGRO0_TIN0_TLDS1_TLDSM1_ULSGRO0_USL1_UIOFGRO0_USFGROn1_VSn1_VWA2_VWB2_WSGRA0_WSGRB0_WS32_WG32_4_1_WGM8_WGMXCC1_WGMXCCGn1
    SolutionIndex: 196
    SolutionNameMin: Cijk_Alik_Bjlk_BSS_BH_Bias_HA_S_SAB_SCD_SAV_UserArgs_MT16x256x32_MI16x16x1_SN_LDSB0_AFC1_AG0_AFEM1_AFEM1_ASEM1_CLR1_CADS0_DTLA0_DTLB0_DTVA0_DTVB1_DTVSM0_DPLBn1_EPS0_ELFLR0_EMLLn1_FDSI0_GRPM1_GRVWA8_GRVWB8_GSUn1_GSUAMB_GSUC0_GSUWGMRR0_GLS0_ISA1200_IU1_K1_LDSTI0_LBSPPA128_LBSPPB0_LBSPPM0_LPA16_LPB0_LPM0_LRVW8_LWPMn1_MIAV1_MIWT1_8_MO40_MGRIPMn1_NTn1_NTA0_NTB0_NTC0_NTD0_NTM0_NEPBS0_NLCA1_NLCB2_ONLL0_PGR2_PLR1_PKA0_SGROBn1_SIA3_SS1_SU32_SUM0_SUS256_SPO0_SRVW0_SSO0_SVW1_SK0_SKFTR0_SKXCCM0_SGRO0_TIN0_TLDS1_TLDSM1_ULSGRO0_USL1_UIOFGRO0_USFGROn1_VSn1_VWA1_VWB1_WSGRA0_WSGRB0_WS32_WG16_4_1_WGM8_WGMXCC1_WGMXCCGn1
    SolutionIndex: 197
    SolutionNameMin: Cijk_Alik_Bjlk_BSS_BH_Bias_HA_S_SAB_SCD_SAV_UserArgs_MT64x64x64_MI16x16x1_SN_LDSB1_AFC1_AG0_AFEM1_AFEM1_ASEM1_CLR1_CADS0_DTLA0_DTLB0_DTVA0_DTVB0_DTVSM0_DPLBn1_EPS1_ELFLR0_EMLLn1_FDSI0_GRPM1_GRVWA8_GRVWB8_GSUn1_GSUAMB_GSUC0_GSUWGMRR0_GLS0_ISA1200_IU1_K1_LDSTI0_LBSPPA256_LBSPPB1024_LBSPPM0_LPA16_LPB32_LPM0_LRVW8_LWPMn1_MIAV1_MIWT2_2_MO40_MGRIPMn1_NTn1_NTA0_NTB0_NTC0_NTD0_NTM0_NEPBS0_NLCA1_NLCB1_ONLL0_PGR1_PLR1_PKA0_SGROBn1_SIA3_SS1_SU32_SUM0_SUS256_SPO0_SRVW0_SSO0_SVW2_SK0_SKFTR0_SKXCCM0_SGRO0_TIN0_TLDS1_TLDSM1_ULSGRO0_USL1_UIOFGRO0_USFGROn1_VSn1_VWA2_VWB2_WSGRA0_WSGRB0_WS32_WG32_4_1_WGM8_WGMXCC1_WGMXCCGn1
    SolutionIndex: 198
    SolutionNameMin: Cijk_Alik_Bjlk_BSS_BH_Bias_HA_S_SAB_SCD_SAV_UserArgs_MT128x128x16_MI16x16x1_SN_LDSB1_AFC1_AG0_AFEM1_AFEM1_ASEM1_CLR1_CADS0_DTLA0_DTLB0_DTVA0_DTVB0_DTVSM0_DPLBn1_EPS1_ELFLR0_EMLLn1_FDSI0_GRPM1_GRVWA8_GRVWB8_GSUn1_GSUAMB_GSUC0_GSUWGMRR0_GLS0_ISA1200_IU1_K1_LDSTI0_LBSPPA256_LBSPPB2048_LBSPPM0_LPA16_LPB32_LPM0_LRVW8_LWPMn1_MIAV1_MIWT8_2_MO40_MGRIPMn1_NTn1_NTA0_NTB0_NTC0_NTD0_NTM0_NEPBS0_NLCA1_NLCB1_ONLL0_PGR1_PLR1_PKA0_SGROBn1_SIA2_SS1_SU32_SUM0_SUS256_SPO0_SRVW0_SSO0_SVW8_SK0_SKFTR0_SKXCCM0_SGRO0_TIN0_TLDS1_TLDSM1_ULSGRO0_USL1_UIOFGRO0_USFGROn1_VSn1_VWA8_VWB2_WSGRA0_WSGRB0_WS32_WG16_8_1_WGM8_WGMXCC1_WGMXCCGn1
    SolutionIndex: 199
    SolutionNameMin: Cijk_Alik_Bjlk_BSS_BH_Bias_HA_S_SAB_SCD_SAV_UserArgs_MT64x128x32_MI16x16x1_SN_LDSB1_AFC1_AG0_AFEM1_AFEM1_ASEM1_CLR1_CADS0_DTLA0_DTLB0_DTVA0_DTVB0_DTVSM0_DPLBn1_EPS1_ELFLR0_EMLLn1_FDSI0_GRPM1_GRVWA8_GRVWB8_GSUn1_GSUAMB_GSUC0_GSUWGMRR0_GLS0_ISA1200_IU2_K1_LDSTI0_LBSPPA128_LBSPPB2048_LBSPPM0_LPA16_LPB0_LPM0_LRVW8_LWPMn1_MIAV1_MIWT1_8_MO40_MGRIPMn1_NTn1_NTA0_NTB0_NTC0_NTD0_NTM0_NEPBS0_NLCA1_NLCB1_ONLL0_PGR1_PLR1_PKA0_SGROBn1_SIA2_SS1_SU32_SUM0_SUS256_SPO0_SRVW0_SSO0_SVW1_SK0_SKFTR0_SKXCCM0_SGRO0_TIN0_TLDS1_TLDSM1_ULSGRO0_USL1_UIOFGRO0_USFGROn1_VSn1_VWA1_VWB8_WSGRA0_WSGRB0_WS32_WG64_2_1_WGM8_WGMXCC1_WGMXCCGn1
    SolutionIndex: 200
    SolutionNameMin: Cijk_Alik_Bjlk_BSS_BH_Bias_HA_S_SAB_SCD_SAV_UserArgs_MT128x128x32_MI16x16x1_SN_LDSB1_AFC1_AG0_AFEM1_AFEM1_ASEM1_CLR1_CADS0_DTLA0_DTLB0_DTVA0_DTVB0_DTVSM0_DPLBn1_EPS0_ELFLR0_EMLLn1_FDSI0_GRPM1_GRVWA8_GRVWB8_GSUn1_GSUAMB_GSUC0_GSUWGMRR0_GLS0_ISA1200_IU1_K1_LDSTI0_LBSPPA256_LBSPPB2048_LBSPPM0_LPA16_LPB0_LPM0_LRVW8_LWPMn1_MIAV1_MIWT4_4_MO40_MGRIPMn1_NTn1_NTA0_NTB0_NTC0_NTD0_NTM0_NEPBS0_NLCA1_NLCB1_ONLL0_PGR2_PLR1_PKA0_SGROBn1_SIA3_SS1_SU32_SUM0_SUS256_SPO0_SRVW0_SSO0_SVW4_SK0_SKFTR0_SKXCCM0_SGRO0_TIN0_TLDS1_TLDSM1_ULSGRO0_USL1_UIOFGRO0_USFGROn1_VSn1_VWA4_VWB4_WSGRA0_WSGRB0_WS32_WG32_4_1_WGM8_WGMXCC1_WGMXCCGn1
    SolutionIndex: 201
    SolutionNameMin: Cijk_Alik_Bjlk_BSS_BH_Bias_HA_S_SAB_SCD_SAV_UserArgs_MT128x128x16_MI16x16x1_SN_LDSB0_AFC1_AG0_AFEM1_AFEM1_ASEM1_CLR0_CADS0_DTLA0_DTLB0_DTVA0_DTVB0_DTVSM0_DPLBn1_EPS1_ELFLR0_EMLLn1_FDSI0_GRPM1_GRVWA8_GRVWB8_GSUn1_GSUAMB_GSUC0_GSUWGMRR0_GLS0_ISA1200_IU1_K1_LDSTI0_LBSPPA128_LBSPPB2048_LBSPPM0_LPA16_LPB0_LPM0_LRVW8_LWPMn1_MIAV1_MIWT4_4_MO40_MGRIPMn1_NTn1_NTA0_NTB0_NTC0_NTD0_NTM0_NEPBS0_NLCA1_NLCB1_ONLL0_PGR1_PLR0_PKA0_SGROBn1_SIA3_SS1_SU32_SUM0_SUS256_SPO0_SRVW0_SSO0_SVW4_SK0_SKFTR0_SKXCCM0_SGRO0_TIN0_TLDS1_TLDSM1_ULSGRO0_USL1_UIOFGRO0_USFGROn1_VSn1_VWA4_VWB4_WSGRA0_WSGRB0_WS32_WG32_4_1_WGM8_WGMXCC1_WGMXCCGn1
    SolutionIndex: 202
    SolutionNameMin: Cijk_Alik_Bjlk_BSS_BH_Bias_HA_S_SAB_SCD_SAV_UserArgs_MT64x128x32_MI16x16x1_SN_LDSB0_AFC1_AG0_AFEM1_AFEM1_ASEM1_CLR1_CADS0_DTLA0_DTLB0_DTVA0_DTVB1_DTVSM0_DPLBn1_EPS0_ELFLR0_EMLLn1_FDSI0_GRPM1_GRVWA8_GRVWB8_GSUn1_GSUAMB_GSUC0_GSUWGMRR0_GLS0_ISA1200_IU1_K1_LDSTI0_LBSPPA128_LBSPPB0_LBSPPM0_LPA16_LPB0_LPM0_LRVW8_LWPMn1_MIAV1_MIWT1_8_MO40_MGRIPMn1_NTn1_NTA0_NTB0_NTC0_NTD0_NTM0_NEPBS0_NLCA1_NLCB2_ONLL0_PGR2_PLR1_PKA0_SGROBn1_SIA3_SS1_SU32_SUM0_SUS256_SPO0_SRVW0_SSO0_SVW1_SK0_SKFTR0_SKXCCM0_SGRO0_TIN0_TLDS1_TLDSM1_ULSGRO0_USL1_UIOFGRO0_USFGROn1_VSn1_VWA1_VWB1_WSGRA0_WSGRB0_WS32_WG64_2_1_WGM8_WGMXCC1_WGMXCCGn1
    SolutionIndex: 203
    SolutionNameMin: Cijk_Alik_Bjlk_BSS_BH_Bias_HA_S_SAB_SCD_SAV_UserArgs_MT32x128x32_MI16x16x1_SN_LDSB0_AFC1_AG0_AFEM1_AFEM1_ASEM1_CLR1_CADS0_DTLA0_DTLB0_DTVA0_DTVB1_DTVSM0_DPLBn1_EPS0_ELFLR0_EMLLn1_FDSI0_GRPM1_GRVWA8_GRVWB8_GSUn1_GSUAMB_GSUC0_GSUWGMRR0_GLS0_ISA1200_IU1_K1_LDSTI0_LBSPPA128_LBSPPB0_LBSPPM0_LPA16_LPB0_LPM0_LRVW8_LWPMn1_MIAV1_MIWT1_4_MO40_MGRIPMn1_NTn1_NTA0_NTB0_NTC0_NTD0_NTM0_NEPBS0_NLCA1_NLCB2_ONLL0_PGR2_PLR1_PKA0_SGROBn1_SIA3_SS1_SU32_SUM0_SUS256_SPO0_SRVW0_SSO0_SVW1_SK0_SKFTR0_SKXCCM0_SGRO0_TIN0_TLDS1_TLDSM1_ULSGRO0_USL1_UIOFGRO0_USFGROn1_VSn1_VWA1_VWB1_WSGRA0_WSGRB0_WS32_WG32_4_1_WGM8_WGMXCC1_WGMXCCGn1
    SolutionIndex: 204
    SolutionNameMin: Cijk_Alik_Bjlk_BSS_BH_Bias_HA_S_SAB_SCD_SAV_UserArgs_MT16x128x32_MI16x16x1_SN_LDSB0_AFC1_AG0_AFEM1_AFEM1_ASEM1_CLR1_CADS0_DTLA0_DTLB0_DTVA0_DTVB1_DTVSM0_DPLBn1_EPS0_ELFLR0_EMLLn1_FDSI0_GRPM1_GRVWA8_GRVWB8_GSUn1_GSUAMB_GSUC0_GSUWGMRR0_GLS0_ISA1200_IU1_K1_LDSTI0_LBSPPA128_LBSPPB0_LBSPPM0_LPA16_LPB0_LPM0_LRVW8_LWPMn1_MIAV1_MIWT1_8_MO40_MGRIPMn1_NTn1_NTA0_NTB0_NTC0_NTD0_NTM0_NEPBS0_NLCA1_NLCB2_ONLL0_PGR2_PLR1_PKA0_SGROBn1_SIA3_SS1_SU32_SUM0_SUS256_SPO0_SRVW0_SSO0_SVW1_SK0_SKFTR0_SKXCCM0_SGRO0_TIN0_TLDS1_TLDSM1_ULSGRO0_USL1_UIOFGRO0_USFGROn1_VSn1_VWA1_VWB1_WSGRA0_WSGRB0_WS32_WG16_2_1_WGM8_WGMXCC1_WGMXCCGn1
    SolutionIndex: 205
    SolutionNameMin: Cijk_Alik_Bjlk_BSS_BH_Bias_HA_S_SAB_SCD_SAV_UserArgs_MT16x128x32_MI16x16x1_SN_LDSB0_AFC1_AG0_AFEM1_AFEM1_ASEM1_CLR1_CADS0_DTLA0_DTLB0_DTVA0_DTVB1_DTVSM0_DPLBn1_EPS1_ELFLR0_EMLLn1_FDSI0_GRPM1_GRVWA8_GRVWB8_GSUn1_GSUAMB_GSUC0_GSUWGMRR0_GLS0_ISA1200_IU1_K1_LDSTI0_LBSPPA128_LBSPPB0_LBSPPM0_LPA16_LPB0_LPM0_LRVW8_LWPMn1_MIAV1_MIWT1_8_MO40_MGRIPMn1_NTn1_NTA0_NTB0_NTC0_NTD0_NTM0_NEPBS0_NLCA1_NLCB2_ONLL0_PGR1_PLR1_PKA0_SGROBn1_SIA3_SS1_SU32_SUM0_SUS256_SPO0_SRVW0_SSO0_SVW1_SK0_SKFTR0_SKXCCM0_SGRO0_TIN0_TLDS1_TLDSM1_ULSGRO0_USL1_UIOFGRO0_USFGROn1_VSn1_VWA1_VWB1_WSGRA0_WSGRB0_WS32_WG16_2_1_WGM8_WGMXCC1_WGMXCCGn1
    SolutionIndex: 206
    SolutionNameMin: Cijk_Alik_Bjlk_BSS_BH_Bias_HA_S_SAB_SCD_SAV_UserArgs_MT128x128x16_MI16x16x1_SN_LDSB1_AFC1_AG0_AFEM1_AFEM1_ASEM1_CLR1_CADS0_DTLA0_DTLB0_DTVA0_DTVB0_DTVSM0_DPLBn1_EPS0_ELFLR0_EMLLn1_FDSI0_GRPM1_GRVWA8_GRVWB8_GSUn1_GSUAMB_GSUC0_GSUWGMRR0_GLS0_ISA1200_IU1_K1_LDSTI0_LBSPPA128_LBSPPB2048_LBSPPM0_LPA16_LPB0_LPM0_LRVW8_LWPMn1_MIAV1_MIWT4_4_MO40_MGRIPMn1_NTn1_NTA0_NTB0_NTC0_NTD0_NTM0_NEPBS0_NLCA1_NLCB1_ONLL0_PGR2_PLR1_PKA0_SGROBn1_SIA2_SS0_SU32_SUM0_SUS256_SPO0_SRVW0_SSO0_SVW8_SK0_SKFTR0_SKXCCM0_SGRO0_TIN0_TLDS1_TLDSM1_ULSGRO1_USL1_UIOFGRO0_USFGROn1_VSn1_VWA4_VWB4_WSGRA0_WSGRB0_WS32_WG32_4_1_WGM8_WGMXCC1_WGMXCCGn1
    SolutionIndex: 207
    SolutionNameMin: Cijk_Alik_Bjlk_BSS_BH_Bias_HA_S_SAB_SCD_SAV_UserArgs_MT128x128x16_MI16x16x1_SN_LDSB0_AFC1_AG0_AFEM1_AFEM1_ASEM1_CLR0_CADS0_DTLA0_DTLB0_DTVA0_DTVB0_DTVSM0_DPLBn1_EPS1_ELFLR0_EMLLn1_FDSI0_GRPM1_GRVWA8_GRVWB8_GSUn1_GSUAMB_GSUC0_GSUWGMRR0_GLS0_ISA1200_IU1_K1_LDSTI0_LBSPPA128_LBSPPB2048_LBSPPM0_LPA16_LPB0_LPM0_LRVW8_LWPMn1_MIAV1_MIWT4_4_MO40_MGRIPMn1_NTn1_NTA0_NTB0_NTC0_NTD0_NTM0_NEPBS0_NLCA1_NLCB1_ONLL0_PGR1_PLR0_PKA0_SGROBn1_SIA3_SS0_SU32_SUM0_SUS256_SPO0_SRVW0_SSO0_SVW8_SK0_SKFTR0_SKXCCM0_SGRO0_TIN0_TLDS1_TLDSM1_ULSGRO0_USL1_UIOFGRO0_USFGROn1_VSn1_VWA4_VWB4_WSGRA0_WSGRB0_WS32_WG32_4_1_WGM8_WGMXCC1_WGMXCCGn1
    SolutionIndex: 208
    SolutionNameMin: Cijk_Alik_Bjlk_BSS_BH_Bias_HA_S_SAB_SCD_SAV_UserArgs_MT128x128x16_MI16x16x1_SN_LDSB0_AFC1_AG0_AFEM1_AFEM1_ASEM1_CLR0_CADS0_DTLA0_DTLB0_DTVA0_DTVB0_DTVSM0_DPLBn1_EPS0_ELFLR0_EMLLn1_FDSI0_GRPM1_GRVWA8_GRVWB8_GSUn1_GSUAMB_GSUC0_GSUWGMRR0_GLS0_ISA1200_IU1_K1_LDSTI0_LBSPPA128_LBSPPB2048_LBSPPM0_LPA16_LPB0_LPM0_LRVW8_LWPMn1_MIAV1_MIWT4_4_MO40_MGRIPMn1_NTn1_NTA0_NTB0_NTC0_NTD0_NTM0_NEPBS0_NLCA1_NLCB1_ONLL0_PGR2_PLR0_PKA0_SGROBn1_SIA3_SS1_SU32_SUM0_SUS256_SPO0_SRVW0_SSO0_SVW4_SK0_SKFTR0_SKXCCM0_SGRO0_TIN0_TLDS1_TLDSM1_ULSGRO1_USL1_UIOFGRO0_USFGROn1_VSn1_VWA4_VWB4_WSGRA0_WSGRB0_WS32_WG32_4_1_WGM8_WGMXCC1_WGMXCCGn1
    SolutionIndex: 209
    SolutionNameMin: Cijk_Alik_Bjlk_BSS_BH_Bias_HA_S_SAB_SCD_SAV_UserArgs_MT32x128x32_MI16x16x1_SN_LDSB0_AFC1_AG0_AFEM1_AFEM1_ASEM32_CLR1_CADS0_DTLA0_DTLB0_DTVA1_DTVB0_DTVSM0_DPLBn1_EPS1_ELFLR0_EMLLn1_FDSI0_GRPM1_GRVWA8_GRVWB8_GSUn1_GSUAMB_GSUC0_GSUWGMRR0_GLS0_ISA1200_IU1_K1_LDSTI0_LBSPPA0_LBSPPB2048_LBSPPM0_LPA0_LPB0_LPM0_LRVW8_LWPMn1_MIAV1_MIWT1_4_MO40_MGRIPMn1_NTn1_NTA0_NTB0_NTC0_NTD0_NTM0_NEPBS0_NLCA2_NLCB1_ONLL0_PGR1_PLR1_PKA0_SGROBn1_SIA3_SS0_SU32_SUM0_SUS256_SPO0_SRVW0_SSO0_SVW8_SK0_SKFTR0_SKXCCM0_SGRO0_TIN0_TLDS1_TLDSM1_ULSGRO0_USL1_UIOFGRO0_USFGROn1_VSn1_VWA1_VWB4_WSGRA0_WSGRB0_WS32_WG32_4_1_WGM8_WGMXCC1_WGMXCCGn1
    SolutionIndex: 210
    SolutionNameMin: Cijk_Alik_Bjlk_BSS_BH_Bias_HA_S_SAB_SCD_SAV_UserArgs_MT64x128x32_MI16x16x1_SN_LDSB0_AFC1_AG0_AFEM1_AFEM1_ASEM32_CLR1_CADS0_DTLA0_DTLB0_DTVA1_DTVB1_DTVSM0_DPLBn1_EPS0_ELFLR0_EMLLn1_FDSI0_GRPM1_GRVWA8_GRVWB8_GSUn1_GSUAMB_GSUC0_GSUWGMRR0_GLS0_ISA1200_IU1_K1_LDSTI0_LBSPPA0_LBSPPB0_LBSPPM0_LPA0_LPB0_LPM0_LRVW8_LWPMn1_MIAV1_MIWT1_8_MO40_MGRIPMn1_NTn1_NTA0_NTB0_NTC0_NTD0_NTM0_NEPBS0_NLCA2_NLCB2_ONLL0_PGR1_PLR0_PKA0_SGROBn1_SIA3_SS1_SU32_SUM0_SUS256_SPO0_SRVW0_SSO0_SVW1_SK0_SKFTR0_SKXCCM0_SGRO0_TIN0_TLDS1_TLDSM1_ULSGRO0_USL1_UIOFGRO0_USFGROn1_VSn1_VWA1_VWB1_WSGRA0_WSGRB0_WS32_WG64_2_1_WGM8_WGMXCC1_WGMXCCGn1
    SolutionIndex: 211
    SolutionNameMin: Cijk_Alik_Bjlk_BSS_BH_Bias_HA_S_SAB_SCD_SAV_UserArgs_MT64x128x16_MI16x16x1_SN_LDSB0_AFC1_AG0_AFEM1_AFEM1_ASEM16_CLR1_CADS0_DTLA0_DTLB0_DTVA1_DTVB1_DTVSM0_DPLBn1_EPS0_ELFLR0_EMLLn1_FDSI0_GRPM1_GRVWA8_GRVWB8_GSUn1_GSUAMB_GSUC0_GSUWGMRR0_GLS0_ISA1200_IU1_K1_LDSTI0_LBSPPA0_LBSPPB0_LBSPPM0_LPA0_LPB0_LPM0_LRVW8_LWPMn1_MIAV1_MIWT1_8_MO40_MGRIPMn1_NTn1_NTA0_NTB0_NTC0_NTD0_NTM0_NEPBS0_NLCA1_NLCB1_ONLL0_PGR1_PLR0_PKA0_SGROBn1_SIA3_SS1_SU32_SUM0_SUS256_SPO0_SRVW0_SSO0_SVW1_SK0_SKFTR0_SKXCCM0_SGRO0_TIN0_TLDS1_TLDSM1_ULSGRO0_USL1_UIOFGRO0_USFGROn1_VSn1_VWA1_VWB1_WSGRA0_WSGRB0_WS32_WG64_2_1_WGM8_WGMXCC1_WGMXCCGn1
    SolutionIndex: 212
    SolutionNameMin: Cijk_Alik_Bjlk_BSS_BH_Bias_HA_S_SAB_SCD_SAV_UserArgs_MT64x64x128_MI16x16x1_SN_LDSB1_AFC1_AG0_AFEM1_AFEM1_ASEM1_CLR1_CADS0_DTLA0_DTLB0_DTVA0_DTVB0_DTVSM0_DPLBn1_EPS0_ELFLR0_EMLLn1_FDSI0_GRPM1_GRVWA8_GRVWB8_GSUn1_GSUAMB_GSUC0_GSUWGMRR0_GLS0_ISA1200_IU1_K1_LDSTI0_LBSPPA512_LBSPPB1024_LBSPPM0_LPA16_LPB32_LPM0_LRVW8_LWPMn1_MIAV1_MIWT2_2_MO40_MGRIPMn1_NTn1_NTA0_NTB0_NTC0_NTD0_NTM0_NEPBS0_NLCA1_NLCB1_ONLL0_PGR2_PLR1_PKA0_SGROBn1_SIA3_SS1_SU32_SUM0_SUS256_SPO0_SRVW0_SSO0_SVW2_SK0_SKFTR0_SKXCCM0_SGRO0_TIN0_TLDS1_TLDSM1_ULSGRO0_USL1_UIOFGRO0_USFGROn1_VSn1_VWA2_VWB2_WSGRA0_WSGRB0_WS32_WG32_4_1_WGM8_WGMXCC1_WGMXCCGn1
    SolutionIndex: 213
    SolutionNameMin: Cijk_Alik_Bjlk_BSS_BH_Bias_HA_S_SAB_SCD_SAV_UserArgs_MT64x128x32_MI16x16x1_SN_LDSB0_AFC1_AG0_AFEM1_AFEM1_ASEM1_CLR1_CADS0_DTLA0_DTLB0_DTVA0_DTVB1_DTVSM0_DPLBn1_EPS1_ELFLR0_EMLLn1_FDSI0_GRPM1_GRVWA8_GRVWB8_GSUn1_GSUAMB_GSUC0_GSUWGMRR0_GLS0_ISA1200_IU1_K1_LDSTI0_LBSPPA128_LBSPPB0_LBSPPM0_LPA16_LPB0_LPM0_LRVW8_LWPMn1_MIAV1_MIWT1_8_MO40_MGRIPMn1_NTn1_NTA0_NTB0_NTC0_NTD0_NTM0_NEPBS0_NLCA1_NLCB2_ONLL0_PGR1_PLR1_PKA0_SGROBn1_SIA3_SS1_SU32_SUM0_SUS256_SPO0_SRVW0_SSO0_SVW1_SK0_SKFTR0_SKXCCM0_SGRO0_TIN0_TLDS1_TLDSM1_ULSGRO0_USL1_UIOFGRO0_USFGROn1_VSn1_VWA1_VWB1_WSGRA0_WSGRB0_WS32_WG64_2_1_WGM8_WGMXCC1_WGMXCCGn1
    SolutionIndex: 214
    SolutionNameMin: Cijk_Alik_Bjlk_BSS_BH_Bias_HA_S_SAB_SCD_SAV_UserArgs_MT32x128x64_MI16x16x1_SN_LDSB0_AFC1_AG0_AFEM1_AFEM1_ASEM64_CLR1_CADS0_DTLA0_DTLB0_DTVA1_DTVB0_DTVSM0_DPLBn1_EPS1_ELFLR0_EMLLn1_FDSI0_GRPM1_GRVWA8_GRVWB8_GSUn1_GSUAMB_GSUC0_GSUWGMRR0_GLS0_ISA1200_IU1_K1_LDSTI0_LBSPPA0_LBSPPB2048_LBSPPM0_LPA0_LPB0_LPM0_LRVW8_LWPMn1_MIAV1_MIWT1_4_MO40_MGRIPMn1_NTn1_NTA0_NTB0_NTC0_NTD0_NTM0_NEPBS0_NLCA4_NLCB1_ONLL0_PGR1_PLR1_PKA0_SGROBn1_SIA3_SS1_SU32_SUM0_SUS256_SPO0_SRVW0_SSO0_SVW1_SK0_SKFTR0_SKXCCM0_SGRO0_TIN0_TLDS1_TLDSM1_ULSGRO0_USL1_UIOFGRO0_USFGROn1_VSn1_VWA1_VWB4_WSGRA0_WSGRB0_WS32_WG32_4_1_WGM8_WGMXCC1_WGMXCCGn1
    SolutionIndex: 215
    SolutionNameMin: Cijk_Alik_Bjlk_BSS_BH_Bias_HA_S_SAB_SCD_SAV_UserArgs_MT32x32x64_MI16x16x1_SN_LDSB0_AFC1_AG0_AFEM1_AFEM1_ASEM1_CLR1_CADS0_DTLA0_DTLB0_DTVA0_DTVB1_DTVSM0_DPLBn1_EPS0_ELFLR0_EMLLn1_FDSI0_GRPM1_GRVWA8_GRVWB8_GSUn1_GSUAMB_GSUC0_GSUWGMRR0_GLS0_ISA1200_IU1_K1_LDSTI0_LBSPPA128_LBSPPB0_LBSPPM0_LPA16_LPB0_LPM0_LRVW8_LWPMn1_MIAV1_MIWT1_1_MO40_MGRIPMn1_NTn1_NTA0_NTB0_NTC0_NTD0_NTM0_NEPBS0_NLCA1_NLCB1_ONLL0_PGR2_PLR1_PKA0_SGROBn1_SIA3_SS1_SU32_SUM0_SUS256_SPO0_SRVW0_SSO0_SVW1_SK0_SKFTR0_SKXCCM0_SGRO0_TIN0_TLDS1_TLDSM1_ULSGRO0_USL1_UIOFGRO0_USFGROn1_VSn1_VWA1_VWB1_WSGRA0_WSGRB0_WS32_WG32_4_1_WGM8_WGMXCC1_WGMXCCGn1
    SolutionIndex: 216
    SolutionNameMin: Cijk_Alik_Bjlk_BSS_BH_Bias_HA_S_SAB_SCD_SAV_UserArgs_MT32x128x64_MI16x16x1_SN_LDSB0_AFC1_AG0_AFEM1_AFEM1_ASEM64_CLR1_CADS0_DTLA0_DTLB0_DTVA1_DTVB0_DTVSM0_DPLBn1_EPS0_ELFLR0_EMLLn1_FDSI0_GRPM1_GRVWA8_GRVWB8_GSUn1_GSUAMB_GSUC0_GSUWGMRR0_GLS0_ISA1200_IU1_K1_LDSTI0_LBSPPA0_LBSPPB2048_LBSPPM0_LPA0_LPB0_LPM0_LRVW8_LWPMn1_MIAV1_MIWT1_4_MO40_MGRIPMn1_NTn1_NTA0_NTB0_NTC0_NTD0_NTM0_NEPBS0_NLCA4_NLCB1_ONLL0_PGR2_PLR1_PKA0_SGROBn1_SIA3_SS1_SU32_SUM0_SUS256_SPO0_SRVW0_SSO0_SVW1_SK0_SKFTR0_SKXCCM0_SGRO0_TIN0_TLDS1_TLDSM1_ULSGRO0_USL1_UIOFGRO0_USFGROn1_VSn1_VWA1_VWB4_WSGRA0_WSGRB0_WS32_WG32_4_1_WGM8_WGMXCC1_WGMXCCGn1
    SolutionIndex: 217
    SolutionNameMin: Cijk_Alik_Bjlk_BSS_BH_Bias_HA_S_SAB_SCD_SAV_UserArgs_MT64x64x32_MI16x16x1_SN_LDSB0_AFC1_AG0_AFEM1_AFEM1_ASEM32_CLR1_CADS0_DTLA0_DTLB0_DTVA1_DTVB0_DTVSM0_DPLBn1_EPS1_ELFLR0_EMLLn1_FDSI0_GRPM1_GRVWA8_GRVWB8_GSUn1_GSUAMB_GSUC0_GSUWGMRR0_GLS0_ISA1200_IU1_K1_LDSTI0_LBSPPA0_LBSPPB1024_LBSPPM0_LPA0_LPB32_LPM0_LRVW8_LWPMn1_MIAV1_MIWT2_2_MO40_MGRIPMn1_NTn1_NTA0_NTB0_NTC0_NTD0_NTM0_NEPBS0_NLCA2_NLCB1_ONLL0_PGR1_PLR1_PKA0_SGROBn1_SIA3_SS0_SU32_SUM0_SUS256_SPO0_SRVW0_SSO0_SVW8_SK0_SKFTR0_SKXCCM0_SGRO0_TIN0_TLDS1_TLDSM1_ULSGRO0_USL1_UIOFGRO0_USFGROn1_VSn1_VWA2_VWB2_WSGRA0_WSGRB0_WS32_WG32_4_1_WGM8_WGMXCC1_WGMXCCGn1
    SolutionIndex: 218
    SolutionNameMin: Cijk_Alik_Bjlk_BSS_BH_Bias_HA_S_SAB_SCD_SAV_UserArgs_MT16x128x16_MI16x16x1_SN_LDSB1_AFC1_AG0_AFEM1_AFEM1_ASEM1_CLR1_CADS0_DTLA0_DTLB0_DTVA0_DTVB0_DTVSM0_DPLBn1_EPS0_ELFLR0_EMLLn1_FDSI0_GRPM1_GRVWA8_GRVWB8_GSUn1_GSUAMB_GSUC0_GSUWGMRR0_GLS0_ISA1200_IU1_K1_LDSTI0_LBSPPA128_LBSPPB2048_LBSPPM0_LPA16_LPB0_LPM0_LRVW8_LWPMn1_MIAV1_MIWT1_8_MO40_MGRIPMn1_NTn1_NTA0_NTB0_NTC0_NTD0_NTM0_NEPBS0_NLCA1_NLCB1_ONLL0_PGR2_PLR1_PKA0_SGROBn1_SIA2_SS0_SU32_SUM0_SUS256_SPO0_SRVW0_SSO0_SVW8_SK0_SKFTR0_SKXCCM0_SGRO0_TIN0_TLDS1_TLDSM1_ULSGRO0_USL1_UIOFGRO0_USFGROn1_VSn1_VWA1_VWB8_WSGRA0_WSGRB0_WS32_WG16_2_1_WGM8_WGMXCC1_WGMXCCGn1
    SolutionIndex: 219
    SolutionNameMin: Cijk_Alik_Bjlk_BSS_BH_Bias_HA_S_SAB_SCD_SAV_UserArgs_MT32x128x32_MI16x16x1_SN_LDSB0_AFC1_AG0_AFEM1_AFEM1_ASEM32_CLR1_CADS0_DTLA0_DTLB0_DTVA1_DTVB1_DTVSM0_DPLBn1_EPS0_ELFLR0_EMLLn1_FDSI0_GRPM1_GRVWA8_GRVWB8_GSUn1_GSUAMB_GSUC0_GSUWGMRR0_GLS0_ISA1200_IU1_K1_LDSTI0_LBSPPA0_LBSPPB0_LBSPPM0_LPA0_LPB0_LPM0_LRVW8_LWPMn1_MIAV1_MIWT1_4_MO40_MGRIPMn1_NTn1_NTA0_NTB0_NTC0_NTD0_NTM0_NEPBS0_NLCA2_NLCB2_ONLL0_PGR1_PLR0_PKA0_SGROBn1_SIA3_SS0_SU32_SUM0_SUS256_SPO0_SRVW0_SSO0_SVW8_SK0_SKFTR0_SKXCCM0_SGRO0_TIN0_TLDS1_TLDSM1_ULSGRO0_USL1_UIOFGRO0_USFGROn1_VSn1_VWA1_VWB1_WSGRA0_WSGRB0_WS32_WG32_4_1_WGM8_WGMXCC1_WGMXCCGn1
    SolutionIndex: 220
    SolutionNameMin: Cijk_Alik_Bjlk_BSS_BH_Bias_HA_S_SAB_SCD_SAV_UserArgs_MT64x64x16_MI16x16x1_SN_LDSB1_AFC1_AG0_AFEM1_AFEM1_ASEM1_CLR1_CADS0_DTLA0_DTLB0_DTVA0_DTVB0_DTVSM0_DPLBn1_EPS1_ELFLR0_EMLLn1_FDSI0_GRPM1_GRVWA8_GRVWB8_GSUn1_GSUAMB_GSUC0_GSUWGMRR0_GLS0_ISA1200_IU1_K1_LDSTI0_LBSPPA128_LBSPPB1024_LBSPPM0_LPA16_LPB32_LPM0_LRVW8_LWPMn1_MIAV1_MIWT2_2_MO40_MGRIPMn1_NTn1_NTA0_NTB0_NTC0_NTD0_NTM0_NEPBS0_NLCA1_NLCB1_ONLL0_PGR1_PLR1_PKA0_SGROBn1_SIA2_SS1_SU32_SUM0_SUS256_SPO0_SRVW0_SSO0_SVW2_SK0_SKFTR0_SKXCCM0_SGRO0_TIN0_TLDS1_TLDSM1_ULSGRO0_USL1_UIOFGRO0_USFGROn1_VSn1_VWA2_VWB2_WSGRA0_WSGRB0_WS32_WG32_4_1_WGM8_WGMXCC1_WGMXCCGn1
    SolutionIndex: 221
    SolutionNameMin: Cijk_Alik_Bjlk_BSS_BH_Bias_HA_S_SAB_SCD_SAV_UserArgs_MT64x64x16_MI16x16x1_SN_LDSB0_AFC1_AG0_AFEM1_AFEM1_ASEM1_CLR0_CADS0_DTLA0_DTLB0_DTVA0_DTVB0_DTVSM0_DPLBn1_EPS0_ELFLR0_EMLLn1_FDSI0_GRPM1_GRVWA8_GRVWB8_GSUn1_GSUAMB_GSUC0_GSUWGMRR0_GLS0_ISA1200_IU1_K1_LDSTI0_LBSPPA128_LBSPPB1024_LBSPPM0_LPA16_LPB32_LPM0_LRVW8_LWPMn1_MIAV1_MIWT2_2_MO40_MGRIPMn1_NTn1_NTA0_NTB0_NTC0_NTD0_NTM0_NEPBS0_NLCA1_NLCB1_ONLL0_PGR2_PLR0_PKA0_SGROBn1_SIA3_SS0_SU32_SUM0_SUS256_SPO0_SRVW0_SSO0_SVW8_SK0_SKFTR0_SKXCCM0_SGRO0_TIN0_TLDS1_TLDSM1_ULSGRO0_USL1_UIOFGRO0_USFGROn1_VSn1_VWA2_VWB2_WSGRA0_WSGRB0_WS32_WG32_4_1_WGM8_WGMXCC1_WGMXCCGn1
    SolutionIndex: 222
    SolutionNameMin: Cijk_Alik_Bjlk_BSS_BH_Bias_HA_S_SAB_SCD_SAV_UserArgs_MT64x64x16_MI16x16x1_SN_LDSB1_AFC1_AG0_AFEM1_AFEM1_ASEM1_CLR1_CADS0_DTLA0_DTLB0_DTVA0_DTVB0_DTVSM0_DPLBn1_EPS0_ELFLR0_EMLLn1_FDSI0_GRPM1_GRVWA8_GRVWB8_GSUn1_GSUAMB_GSUC0_GSUWGMRR0_GLS0_ISA1200_IU1_K1_LDSTI0_LBSPPA128_LBSPPB1024_LBSPPM0_LPA16_LPB32_LPM0_LRVW8_LWPMn1_MIAV1_MIWT2_2_MO40_MGRIPMn1_NTn1_NTA0_NTB0_NTC0_NTD0_NTM0_NEPBS0_NLCA1_NLCB1_ONLL0_PGR2_PLR1_PKA0_SGROBn1_SIA2_SS1_SU32_SUM0_SUS256_SPO0_SRVW0_SSO0_SVW2_SK0_SKFTR0_SKXCCM0_SGRO0_TIN0_TLDS1_TLDSM1_ULSGRO1_USL1_UIOFGRO0_USFGROn1_VSn1_VWA2_VWB2_WSGRA0_WSGRB0_WS32_WG32_4_1_WGM8_WGMXCC1_WGMXCCGn1
    SolutionIndex: 223
    SolutionNameMin: Cijk_Alik_Bjlk_BSS_BH_Bias_HA_S_SAB_SCD_SAV_UserArgs_MT32x128x32_MI16x16x1_SN_LDSB0_AFC1_AG0_AFEM1_AFEM1_ASEM32_CLR1_CADS0_DTLA0_DTLB0_DTVA1_DTVB0_DTVSM0_DPLBn1_EPS1_ELFLR0_EMLLn1_FDSI0_GRPM1_GRVWA8_GRVWB8_GSUn1_GSUAMB_GSUC0_GSUWGMRR0_GLS0_ISA1200_IU1_K1_LDSTI0_LBSPPA0_LBSPPB2048_LBSPPM0_LPA0_LPB0_LPM0_LRVW8_LWPMn1_MIAV1_MIWT1_4_MO40_MGRIPMn1_NTn1_NTA0_NTB0_NTC0_NTD0_NTM0_NEPBS0_NLCA2_NLCB1_ONLL0_PGR1_PLR1_PKA0_SGROBn1_SIA3_SS1_SU32_SUM0_SUS256_SPO0_SRVW0_SSO0_SVW1_SK0_SKFTR0_SKXCCM0_SGRO0_TIN0_TLDS1_TLDSM1_ULSGRO0_USL1_UIOFGRO0_USFGROn1_VSn1_VWA1_VWB4_WSGRA0_WSGRB0_WS32_WG32_4_1_WGM8_WGMXCC1_WGMXCCGn1
    SolutionIndex: 224
    SolutionNameMin: Cijk_Alik_Bjlk_BSS_BH_Bias_HA_S_SAB_SCD_SAV_UserArgs_MT16x256x32_MI16x16x1_SN_LDSB0_AFC1_AG0_AFEM1_AFEM1_ASEM32_CLR1_CADS0_DTLA0_DTLB0_DTVA1_DTVB1_DTVSM0_DPLBn1_EPS0_ELFLR0_EMLLn1_FDSI0_GRPM1_GRVWA8_GRVWB8_GSUn1_GSUAMB_GSUC0_GSUWGMRR0_GLS0_ISA1200_IU1_K1_LDSTI0_LBSPPA0_LBSPPB0_LBSPPM0_LPA0_LPB0_LPM0_LRVW8_LWPMn1_MIAV1_MIWT1_8_MO40_MGRIPMn1_NTn1_NTA0_NTB0_NTC0_NTD0_NTM0_NEPBS0_NLCA2_NLCB2_ONLL0_PGR1_PLR0_PKA0_SGROBn1_SIA3_SS0_SU32_SUM0_SUS256_SPO0_SRVW0_SSO0_SVW8_SK0_SKFTR0_SKXCCM0_SGRO0_TIN0_TLDS1_TLDSM1_ULSGRO0_USL1_UIOFGRO0_USFGROn1_VSn1_VWA1_VWB1_WSGRA0_WSGRB0_WS32_WG16_4_1_WGM8_WGMXCC1_WGMXCCGn1
    SolutionIndex: 225
    SolutionNameMin: Cijk_Alik_Bjlk_BSS_BH_Bias_HA_S_SAB_SCD_SAV_UserArgs_MT64x64x16_MI16x16x1_SN_LDSB1_AFC1_AG0_AFEM1_AFEM1_ASEM1_CLR1_CADS0_DTLA0_DTLB0_DTVA0_DTVB0_DTVSM0_DPLBn1_EPS0_ELFLR0_EMLLn1_FDSI0_GRPM1_GRVWA8_GRVWB8_GSUn1_GSUAMB_GSUC0_GSUWGMRR0_GLS0_ISA1200_IU1_K1_LDSTI0_LBSPPA128_LBSPPB1024_LBSPPM0_LPA16_LPB32_LPM0_LRVW8_LWPMn1_MIAV1_MIWT2_2_MO40_MGRIPMn1_NTn1_NTA0_NTB0_NTC0_NTD0_NTM0_NEPBS0_NLCA1_NLCB1_ONLL0_PGR2_PLR1_PKA0_SGROBn1_SIA2_SS1_SU32_SUM0_SUS256_SPO0_SRVW0_SSO0_SVW2_SK0_SKFTR0_SKXCCM0_SGRO0_TIN0_TLDS1_TLDSM1_ULSGRO0_USL1_UIOFGRO0_USFGROn1_VSn1_VWA2_VWB2_WSGRA0_WSGRB0_WS32_WG32_4_1_WGM8_WGMXCC1_WGMXCCGn1
    SolutionIndex: 226
    SolutionNameMin: Cijk_Alik_Bjlk_BSS_BH_Bias_HA_S_SAB_SCD_SAV_UserArgs_MT16x128x16_MI16x16x1_SN_LDSB0_AFC1_AG0_AFEM1_AFEM1_ASEM16_CLR1_CADS0_DTLA0_DTLB0_DTVA1_DTVB1_DTVSM0_DPLBn1_EPS0_ELFLR0_EMLLn1_FDSI0_GRPM1_GRVWA8_GRVWB8_GSUn1_GSUAMB_GSUC0_GSUWGMRR0_GLS0_ISA1200_IU1_K1_LDSTI0_LBSPPA0_LBSPPB0_LBSPPM0_LPA0_LPB0_LPM0_LRVW8_LWPMn1_MIAV1_MIWT1_8_MO40_MGRIPMn1_NTn1_NTA0_NTB0_NTC0_NTD0_NTM0_NEPBS0_NLCA1_NLCB1_ONLL0_PGR1_PLR0_PKA0_SGROBn1_SIA3_SS1_SU32_SUM0_SUS256_SPO0_SRVW0_SSO0_SVW1_SK0_SKFTR0_SKXCCM0_SGRO0_TIN0_TLDS1_TLDSM1_ULSGRO0_USL1_UIOFGRO0_USFGROn1_VSn1_VWA1_VWB1_WSGRA0_WSGRB0_WS32_WG16_2_1_WGM8_WGMXCC1_WGMXCCGn1
    SolutionIndex: 227
    SolutionNameMin: Cijk_Alik_Bjlk_BSS_BH_Bias_HA_S_SAB_SCD_SAV_UserArgs_MT16x32x64_MI16x16x1_SN_LDSB0_AFC1_AG0_AFEM1_AFEM1_ASEM64_CLR1_CADS0_DTLA0_DTLB0_DTVA1_DTVB1_DTVSM0_DPLBn1_EPS0_ELFLR0_EMLLn1_FDSI0_GRPM1_GRVWA8_GRVWB8_GSUn1_GSUAMB_GSUC0_GSUWGMRR0_GLS0_ISA1200_IU1_K1_LDSTI0_LBSPPA0_LBSPPB0_LBSPPM0_LPA0_LPB0_LPM0_LRVW8_LWPMn1_MIAV1_MIWT1_1_MO40_MGRIPMn1_NTn1_NTA0_NTB0_NTC0_NTD0_NTM0_NEPBS0_NLCA4_NLCB1_ONLL0_PGR1_PLR0_PKA0_SGROBn1_SIA3_SS1_SU32_SUM0_SUS256_SPO0_SRVW0_SSO0_SVW1_SK0_SKFTR0_SKXCCM0_SGRO0_TIN0_TLDS1_TLDSM1_ULSGRO0_USL1_UIOFGRO0_USFGROn1_VSn1_VWA1_VWB1_WSGRA0_WSGRB0_WS32_WG16_4_1_WGM8_WGMXCC1_WGMXCCGn1
- - - [512, 512, 1, 64]
    - [93, 0.0]
  - - [1024, 512, 1, 64]
    - [88, 0.0]
  - - [1536, 512, 1, 64]
    - [8, 2864.15]
  - - [2048, 512, 1, 64]
    - [13, 3524.53]
  - - [2560, 512, 1, 64]
    - [13, 4346.2]
  - - [3072, 512, 1, 64]
    - [8, 4950.61]
  - - [512, 1024, 1, 64]
    - [124, 0.0]
  - - [1024, 1024, 1, 64]
    - [122, 0.0]
  - - [1536, 1024, 1, 64]
    - [114, 0.0]
  - - [2048, 1024, 1, 64]
    - [178, 0.0]
  - - [2560, 1024, 1, 64]
    - [1, 6752.35]
  - - [3072, 1024, 1, 64]
    - [11, 8066.94]
  - - [512, 1536, 1, 64]
    - [9, 2943.03]
  - - [1024, 1536, 1, 64]
    - [124, 0.0]
  - - [1536, 1536, 1, 64]
    - [133, 0.0]
  - - [2048, 1536, 1, 64]
    - [198, 0.0]
  - - [2560, 1536, 1, 64]
    - [2, 9327.24]
  - - [3072, 1536, 1, 64]
    - [11, 10215.8]
  - - [512, 2048, 1, 64]
    - [8, 3550.64]
  - - [1024, 2048, 1, 64]
    - [88, 0.0]
  - - [1536, 2048, 1, 64]
    - [122, 0.0]
  - - [2048, 2048, 1, 64]
    - [123, 0.0]
  - - [2560, 2048, 1, 64]
    - [0, 10746.5]
  - - [3072, 2048, 1, 64]
    - [11, 11673.0]
  - - [512, 2560, 1, 64]
    - [8, 4152.16]
  - - [1024, 2560, 1, 64]
    - [3, 7208.57]
  - - [1536, 2560, 1, 64]
    - [1, 9020.82]
  - - [2048, 2560, 1, 64]
    - [12, 10822.8]
  - - [2560, 2560, 1, 64]
    - [2, 11898.4]
  - - [3072, 2560, 1, 64]
    - [12, 12932.7]
  - - [512, 3072, 1, 64]
    - [1, 5006.13]
  - - [1024, 3072, 1, 64]
    - [2, 8018.58]
  - - [1536, 3072, 1, 64]
    - [2, 10433.4]
  - - [2048, 3072, 1, 64]
    - [1, 11705.2]
  - - [2560, 3072, 1, 64]
    - [2, 13376.8]
  - - [3072, 3072, 1, 64]
    - [12, 13829.9]
  - - [512, 512, 1, 256]
    - [165, 0.0]
  - - [1024, 512, 1, 256]
    - [88, 0.0]
  - - [1536, 512, 1, 256]
    - [13, 9173.52]
  - - [2048, 512, 1, 256]
    - [11, 11450.1]
  - - [2560, 512, 1, 256]
    - [2, 12209.6]
  - - [3072, 512, 1, 256]
    - [8, 14469.6]
  - - [512, 1024, 1, 256]
    - [122, 0.0]
  - - [1024, 1024, 1, 256]
    - [167, 0.0]
  - - [1536, 1024, 1, 256]
    - [88, 0.0]
  - - [2048, 1024, 1, 256]
    - [180, 0.0]
  - - [2560, 1024, 1, 256]
    - [2, 18409.4]
  - - [3072, 1024, 1, 256]
    - [11, 20115.1]
  - - [512, 1536, 1, 256]
    - [8, 9255.97]
  - - [1024, 1536, 1, 256]
    - [88, 0.0]
  - - [1536, 1536, 1, 256]
    - [88, 0.0]
  - - [2048, 1536, 1, 256]
    - [88, 0.0]
  - - [2560, 1536, 1, 256]
    - [8, 22000.0]
  - - [3072, 1536, 1, 256]
    - [11, 23257.9]
  - - [512, 2048, 1, 256]
    - [2, 10949.4]
  - - [1024, 2048, 1, 256]
    - [104, 0.0]
  - - [1536, 2048, 1, 256]
    - [88, 0.0]
  - - [2048, 2048, 1, 256]
    - [88, 0.0]
  - - [2560, 2048, 1, 256]
    - [11, 24519.8]
  - - [3072, 2048, 1, 256]
    - [11, 25142.1]
  - - [512, 2560, 1, 256]
    - [8, 12062.6]
  - - [1024, 2560, 1, 256]
    - [8, 18083.8]
  - - [1536, 2560, 1, 256]
    - [2, 21061.5]
  - - [2048, 2560, 1, 256]
    - [11, 23674.9]
  - - [2560, 2560, 1, 256]
    - [2, 25032.6]
  - - [3072, 2560, 1, 256]
    - [13, 26240.2]
  - - [512, 3072, 1, 256]
    - [2, 14611.6]
  - - [1024, 3072, 1, 256]
    - [2, 19915.6]
  - - [1536, 3072, 1, 256]
    - [2, 22850.1]
  - - [2048, 3072, 1, 256]
    - [11, 25191.2]
  - - [2560, 3072, 1, 256]
    - [11, 26812.6]
  - - [3072, 3072, 1, 256]
    - [11, 27356.8]
  - - [512, 512, 1, 512]
    - [175, 0.0]
  - - [1024, 512, 1, 512]
    - [29, 0.0]
  - - [1536, 512, 1, 512]
    - [8, 14415.0]
  - - [2048, 512, 1, 512]
    - [11, 17163.9]
  - - [2560, 512, 1, 512]
    - [11, 18258.9]
  - - [3072, 512, 1, 512]
    - [11, 20989.3]
  - - [512, 1024, 1, 512]
    - [51, 0.0]
  - - [1024, 1024, 1, 512]
    - [88, 0.0]
  - - [1536, 1024, 1, 512]
    - [2, 20462.9]
  - - [2048, 1024, 1, 512]
    - [11, 23074.8]
  - - [2560, 1024, 1, 512]
    - [11, 25446.8]
  - - [3072, 1024, 1, 512]
    - [11, 26332.0]
  - - [512, 1536, 1, 512]
    - [8, 14340.8]
  - - [1024, 1536, 1, 512]
    - [11, 20875.0]
  - - [1536, 1536, 1, 512]
    - [2, 23809.0]
  - - [2048, 1536, 1, 512]
    - [11, 26184.4]
  - - [2560, 1536, 1, 512]
    - [0, 27540.3]
  - - [3072, 1536, 1, 512]
    - [8, 29385.4]
  - - [512, 2048, 1, 512]
    - [2, 16984.5]
  - - [1024, 2048, 1, 512]
    - [11, 23371.9]
  - - [1536, 2048, 1, 512]
    - [2, 26615.5]
  - - [2048, 2048, 1, 512]
    - [8, 27718.1]
  - - [2560, 2048, 1, 512]
    - [2, 29927.9]
  - - [3072, 2048, 1, 512]
    - [11, 30270.4]
  - - [512, 2560, 1, 512]
    - [11, 18702.4]
  - - [1024, 2560, 1, 512]
    - [2, 24372.9]
  - - [1536, 2560, 1, 512]
    - [2, 27480.0]
  - - [2048, 2560, 1, 512]
    - [3, 29571.2]
  - - [2560, 2560, 1, 512]
    - [8, 30571.6]
  - - [3072, 2560, 1, 512]
    - [11, 31374.7]
  - - [512, 3072, 1, 512]
    - [2, 21069.2]
  - - [1024, 3072, 1, 512]
    - [2, 26356.0]
  - - [1536, 3072, 1, 512]
    - [2, 29084.2]
  - - [2048, 3072, 1, 512]
    - [11, 31097.4]
  - - [2560, 3072, 1, 512]
    - [11, 31395.6]
  - - [3072, 3072, 1, 512]
    - [11, 32045.7]
  - - [512, 512, 1, 1024]
    - [175, 0.0]
  - - [1024, 512, 1, 1024]
    - [114, 0.0]
  - - [1536, 512, 1, 1024]
    - [2, 19817.1]
  - - [2048, 512, 1, 1024]
    - [8, 24008.2]
  - - [2560, 512, 1, 1024]
    - [8, 23969.4]
  - - [3072, 512, 1, 1024]
    - [11, 27194.1]
  - - [512, 1024, 1, 1024]
    - [201, 0.0]
  - - [1024, 1024, 1, 1024]
    - [125, 0.0]
  - - [1536, 1024, 1, 1024]
    - [88, 0.0]
  - - [2048, 1024, 1, 1024]
    - [88, 0.0]
  - - [2560, 1024, 1, 1024]
    - [0, 30260.9]
  - - [3072, 1024, 1, 1024]
    - [11, 30840.8]
  - - [512, 1536, 1, 1024]
    - [11, 19359.0]
  - - [1024, 1536, 1, 1024]
    - [180, 0.0]
  - - [1536, 1536, 1, 1024]
    - [180, 0.0]
  - - [2048, 1536, 1, 1024]
    - [125, 0.0]
  - - [2560, 1536, 1, 1024]
    - [11, 31425.1]
  - - [3072, 1536, 1, 1024]
    - [11, 33172.1]
  - - [512, 2048, 1, 1024]
    - [8, 24157.0]
  - - [1024, 2048, 1, 1024]
    - [200, 0.0]
  - - [1536, 2048, 1, 1024]
    - [88, 0.0]
  - - [2048, 2048, 1, 1024]
    - [125, 0.0]
  - - [2560, 2048, 1, 1024]
    - [11, 33925.8]
  - - [3072, 2048, 1, 1024]
    - [0, 33969.8]
  - - [512, 2560, 1, 1024]
    - [11, 24499.7]
  - - [1024, 2560, 1, 1024]
    - [2, 30559.4]
  - - [1536, 2560, 1, 1024]
    - [2, 31804.4]
  - - [2048, 2560, 1, 1024]
    - [8, 32905.1]
  - - [2560, 2560, 1, 1024]
    - [2, 33734.2]
  - - [3072, 2560, 1, 1024]
    - [11, 34400.0]
  - - [512, 3072, 1, 1024]
    - [2, 27866.0]
  - - [1024, 3072, 1, 1024]
    - [11, 30767.1]
  - - [1536, 3072, 1, 1024]
    - [8, 33047.1]
  - - [2048, 3072, 1, 1024]
    - [8, 33781.6]
  - - [2560, 3072, 1, 1024]
    - [11, 34664.0]
  - - [3072, 3072, 1, 1024]
    - [11, 35196.1]
  - - [512, 512, 1, 2048]
    - [88, 0.0]
  - - [1024, 512, 1, 2048]
    - [198, 0.0]
  - - [1536, 512, 1, 2048]
    - [8, 24214.3]
  - - [2048, 512, 1, 2048]
    - [11, 29182.3]
  - - [2560, 512, 1, 2048]
    - [2, 28571.6]
  - - [3072, 512, 1, 2048]
    - [11, 31617.2]
  - - [512, 1024, 1, 2048]
    - [72, 0.0]
  - - [1024, 1024, 1, 2048]
    - [88, 0.0]
  - - [1536, 1024, 1, 2048]
    - [11, 31330.8]
  - - [2048, 1024, 1, 2048]
    - [2, 32764.3]
  - - [2560, 1024, 1, 2048]
    - [2, 33601.5]
  - - [3072, 1024, 1, 2048]
    - [11, 35286.8]
  - - [512, 1536, 1, 2048]
    - [11, 24854.6]
  - - [1024, 1536, 1, 2048]
    - [11, 31566.1]
  - - [1536, 1536, 1, 2048]
    - [8, 32252.6]
  - - [2048, 1536, 1, 2048]
    - [2, 34579.0]
  - - [2560, 1536, 1, 2048]
    - [2, 34288.5]
  - - [3072, 1536, 1, 2048]
    - [11, 34956.3]
  - - [512, 2048, 1, 2048]
    - [2, 29930.1]
  - - [1024, 2048, 1, 2048]
    - [11, 33006.5]
  - - [1536, 2048, 1, 2048]
    - [2, 35072.3]
  - - [2048, 2048, 1, 2048]
    - [125, 0.0]
  - - [2560, 2048, 1, 2048]
    - [11, 35317.9]
  - - [3072, 2048, 1, 2048]
    - [2, 36310.1]
  - - [512, 2560, 1, 2048]
    - [2, 28781.9]
  - - [1024, 2560, 1, 2048]
    - [11, 34219.5]
  - - [1536, 2560, 1, 2048]
    - [11, 33626.5]
  - - [2048, 2560, 1, 2048]
    - [0, 35274.3]
  - - [2560, 2560, 1, 2048]
    - [0, 35392.3]
  - - [3072, 2560, 1, 2048]
    - [8, 36196.6]
  - - [512, 3072, 1, 2048]
    - [2, 32525.6]
  - - [1024, 3072, 1, 2048]
    - [11, 34810.3]
  - - [1536, 3072, 1, 2048]
    - [2, 35115.4]
  - - [2048, 3072, 1, 2048]
    - [11, 35705.7]
  - - [2560, 3072, 1, 2048]
    - [11, 36105.2]
  - - [3072, 3072, 1, 2048]
    - [2, 36794.1]
  - - [512, 512, 1, 3072]
    - [7, 18101.2]
  - - [1024, 512, 1, 3072]
    - [11, 27407.5]
  - - [1536, 512, 1, 3072]
    - [11, 26558.5]
  - - [2048, 512, 1, 3072]
    - [11, 31656.4]
  - - [2560, 512, 1, 3072]
    - [2, 29794.3]
  - - [3072, 512, 1, 3072]
    - [11, 33958.2]
  - - [512, 1024, 1, 3072]
    - [11, 27605.0]
  - - [1024, 1024, 1, 3072]
    - [0, 31643.8]
  - - [1536, 1024, 1, 3072]
    - [11, 33254.4]
  - - [2048, 1024, 1, 3072]
    - [8, 34139.3]
  - - [2560, 1024, 1, 3072]
    - [2, 35012.1]
  - - [3072, 1024, 1, 3072]
    - [11, 35445.0]
  - - [512, 1536, 1, 3072]
    - [11, 27221.0]
  - - [1024, 1536, 1, 3072]
    - [11, 33581.0]
  - - [1536, 1536, 1, 3072]
    - [11, 33789.2]
  - - [2048, 1536, 1, 3072]
    - [11, 35114.7]
  - - [2560, 1536, 1, 3072]
    - [8, 35238.0]
  - - [3072, 1536, 1, 3072]
    - [8, 35861.7]
  - - [512, 2048, 1, 3072]
    - [11, 32182.2]
  - - [1024, 2048, 1, 3072]
    - [11, 34070.6]
  - - [1536, 2048, 1, 3072]
    - [11, 35333.4]
  - - [2048, 2048, 1, 3072]
    - [11, 35785.7]
  - - [2560, 2048, 1, 3072]
    - [2, 36387.1]
  - - [3072, 2048, 1, 3072]
    - [2, 37185.3]
  - - [512, 2560, 1, 3072]
    - [13, 30673.2]
  - - [1024, 2560, 1, 3072]
    - [11, 34868.5]
  - - [1536, 2560, 1, 3072]
    - [11, 34535.1]
  - - [2048, 2560, 1, 3072]
    - [11, 36026.7]
  - - [2560, 2560, 1, 3072]
    - [2, 36226.7]
  - - [3072, 2560, 1, 3072]
    - [11, 36351.1]
  - - [512, 3072, 1, 3072]
    - [8, 34107.1]
  - - [1024, 3072, 1, 3072]
    - [11, 35181.3]
  - - [1536, 3072, 1, 3072]
    - [0, 35908.0]
  - - [2048, 3072, 1, 3072]
    - [2, 36244.9]
  - - [2560, 3072, 1, 3072]
    - [11, 36438.8]
  - - [3072, 3072, 1, 3072]
    - [175, 0.0]
  - - [1, 1, 1, 1]
    - [10, 6.42715e-05]
  - - [1, 1, 1, 64]
    - [4, 0.0042151]
  - - [1, 64, 1, 1]
    - [10, 0.00430165]
  - - [64, 1, 1, 1]
    - [5, 0.004144]
  - - [64, 64, 1, 1]
    - [14, 0.268344]
  - - [64, 1, 1, 64]
    - [6, 0.263087]
  - - [1, 64, 1, 64]
    - [15, 0.273468]
  - - [64, 64, 1, 64]
    - [16, 0.0]
  - - [64, 64, 1, 256]
    - [140, 0.0]
  - - [64, 64, 1, 512]
    - [140, 0.0]
  - - [64, 64, 1, 1024]
    - [189, 0.0]
  - - [64, 64, 1, 2048]
    - [189, 0.0]
  - - [64, 64, 1, 4096]
    - [36, 0.0]
  - - [128, 64, 1, 64]
    - [17, 0.0]
  - - [192, 64, 1, 64]
    - [18, 0.0]
  - - [256, 64, 1, 64]
    - [19, 0.0]
  - - [320, 64, 1, 64]
    - [20, 0.0]
  - - [384, 64, 1, 64]
    - [21, 0.0]
  - - [448, 64, 1, 64]
    - [22, 0.0]
  - - [512, 64, 1, 64]
    - [23, 0.0]
  - - [576, 64, 1, 64]
    - [24, 0.0]
  - - [640, 64, 1, 64]
    - [25, 0.0]
  - - [704, 64, 1, 64]
    - [26, 0.0]
  - - [768, 64, 1, 64]
    - [27, 0.0]
  - - [832, 64, 1, 64]
    - [28, 0.0]
  - - [896, 64, 1, 64]
    - [29, 0.0]
  - - [960, 64, 1, 64]
    - [30, 0.0]
  - - [1024, 64, 1, 64]
    - [31, 0.0]
  - - [64, 128, 1, 64]
    - [32, 0.0]
  - - [128, 128, 1, 64]
    - [33, 0.0]
  - - [192, 128, 1, 64]
    - [34, 0.0]
  - - [256, 128, 1, 64]
    - [35, 0.0]
  - - [320, 128, 1, 64]
    - [36, 0.0]
  - - [384, 128, 1, 64]
    - [37, 0.0]
  - - [448, 128, 1, 64]
    - [38, 0.0]
  - - [512, 128, 1, 64]
    - [26, 0.0]
  - - [576, 128, 1, 64]
    - [39, 0.0]
  - - [640, 128, 1, 64]
    - [38, 0.0]
  - - [704, 128, 1, 64]
    - [29, 0.0]
  - - [768, 128, 1, 64]
    - [31, 0.0]
  - - [832, 128, 1, 64]
    - [29, 0.0]
  - - [896, 128, 1, 64]
    - [40, 0.0]
  - - [960, 128, 1, 64]
    - [29, 0.0]
  - - [1024, 128, 1, 64]
    - [41, 0.0]
  - - [64, 192, 1, 64]
    - [42, 0.0]
  - - [128, 192, 1, 64]
    - [43, 0.0]
  - - [192, 192, 1, 64]
    - [44, 0.0]
  - - [256, 192, 1, 64]
    - [28, 0.0]
  - - [320, 192, 1, 64]
    - [45, 0.0]
  - - [384, 192, 1, 64]
    - [37, 0.0]
  - - [448, 192, 1, 64]
    - [46, 0.0]
  - - [512, 192, 1, 64]
    - [47, 0.0]
  - - [576, 192, 1, 64]
    - [31, 0.0]
  - - [640, 192, 1, 64]
    - [48, 0.0]
  - - [704, 192, 1, 64]
    - [49, 0.0]
  - - [768, 192, 1, 64]
    - [50, 0.0]
  - - [832, 192, 1, 64]
    - [51, 0.0]
  - - [896, 192, 1, 64]
    - [44, 0.0]
  - - [960, 192, 1, 64]
    - [49, 0.0]
  - - [1024, 192, 1, 64]
    - [46, 0.0]
  - - [64, 256, 1, 64]
    - [52, 0.0]
  - - [128, 256, 1, 64]
    - [53, 0.0]
  - - [192, 256, 1, 64]
    - [54, 0.0]
  - - [256, 256, 1, 64]
    - [55, 0.0]
  - - [320, 256, 1, 64]
    - [46, 0.0]
  - - [384, 256, 1, 64]
    - [56, 0.0]
  - - [448, 256, 1, 64]
    - [57, 0.0]
  - - [512, 256, 1, 64]
    - [58, 0.0]
  - - [576, 256, 1, 64]
    - [44, 0.0]
  - - [640, 256, 1, 64]
    - [59, 0.0]
  - - [704, 256, 1, 64]
    - [60, 0.0]
  - - [768, 256, 1, 64]
    - [50, 0.0]
  - - [832, 256, 1, 64]
    - [61, 0.0]
  - - [896, 256, 1, 64]
    - [62, 0.0]
  - - [960, 256, 1, 64]
    - [39, 0.0]
  - - [1024, 256, 1, 64]
    - [63, 0.0]
  - - [64, 320, 1, 64]
    - [64, 0.0]
  - - [128, 320, 1, 64]
    - [39, 0.0]
  - - [192, 320, 1, 64]
    - [65, 0.0]
  - - [256, 320, 1, 64]
    - [44, 0.0]
  - - [320, 320, 1, 64]
    - [65, 0.0]
  - - [384, 320, 1, 64]
    - [66, 0.0]
  - - [448, 320, 1, 64]
    - [50, 0.0]
  - - [512, 320, 1, 64]
    - [38, 0.0]
  - - [576, 320, 1, 64]
    - [67, 0.0]
  - - [640, 320, 1, 64]
    - [68, 0.0]
  - - [704, 320, 1, 64]
    - [69, 0.0]
  - - [768, 320, 1, 64]
    - [70, 0.0]
  - - [832, 320, 1, 64]
    - [71, 0.0]
  - - [896, 320, 1, 64]
    - [47, 0.0]
  - - [960, 320, 1, 64]
    - [72, 0.0]
  - - [1024, 320, 1, 64]
    - [73, 0.0]
  - - [64, 384, 1, 64]
    - [24, 0.0]
  - - [128, 384, 1, 64]
    - [74, 0.0]
  - - [192, 384, 1, 64]
    - [75, 0.0]
  - - [256, 384, 1, 64]
    - [76, 0.0]
  - - [320, 384, 1, 64]
    - [50, 0.0]
  - - [384, 384, 1, 64]
    - [77, 0.0]
  - - [448, 384, 1, 64]
    - [51, 0.0]
  - - [512, 384, 1, 64]
    - [44, 0.0]
  - - [576, 384, 1, 64]
    - [78, 0.0]
  - - [640, 384, 1, 64]
    - [79, 0.0]
  - - [704, 384, 1, 64]
    - [80, 0.0]
  - - [768, 384, 1, 64]
    - [81, 0.0]
  - - [832, 384, 1, 64]
    - [44, 0.0]
  - - [896, 384, 1, 64]
    - [82, 0.0]
  - - [960, 384, 1, 64]
    - [83, 0.0]
  - - [1024, 384, 1, 64]
    - [83, 0.0]
  - - [64, 448, 1, 64]
    - [84, 0.0]
  - - [128, 448, 1, 64]
    - [60, 0.0]
  - - [192, 448, 1, 64]
    - [57, 0.0]
  - - [256, 448, 1, 64]
    - [28, 0.0]
  - - [320, 448, 1, 64]
    - [44, 0.0]
  - - [384, 448, 1, 64]
    - [51, 0.0]
  - - [448, 448, 1, 64]
    - [83, 0.0]
  - - [512, 448, 1, 64]
    - [85, 0.0]
  - - [576, 448, 1, 64]
    - [67, 0.0]
  - - [640, 448, 1, 64]
    - [86, 0.0]
  - - [704, 448, 1, 64]
    - [39, 0.0]
  - - [768, 448, 1, 64]
    - [87, 0.0]
  - - [832, 448, 1, 64]
    - [39, 0.0]
  - - [896, 448, 1, 64]
    - [88, 0.0]
  - - [960, 448, 1, 64]
    - [89, 0.0]
  - - [1024, 448, 1, 64]
    - [79, 0.0]
  - - [64, 512, 1, 64]
    - [90, 0.0]
  - - [128, 512, 1, 64]
    - [91, 0.0]
  - - [192, 512, 1, 64]
    - [75, 0.0]
  - - [256, 512, 1, 64]
    - [39, 0.0]
  - - [320, 512, 1, 64]
    - [28, 0.0]
  - - [384, 512, 1, 64]
    - [77, 0.0]
  - - [448, 512, 1, 64]
    - [92, 0.0]
  - - [576, 512, 1, 64]
    - [94, 0.0]
  - - [640, 512, 1, 64]
    - [95, 0.0]
  - - [704, 512, 1, 64]
    - [62, 0.0]
  - - [768, 512, 1, 64]
    - [96, 0.0]
  - - [832, 512, 1, 64]
    - [83, 0.0]
  - - [896, 512, 1, 64]
    - [87, 0.0]
  - - [960, 512, 1, 64]
    - [97, 0.0]
  - - [64, 576, 1, 64]
    - [24, 0.0]
  - - [128, 576, 1, 64]
    - [98, 0.0]
  - - [192, 576, 1, 64]
    - [99, 0.0]
  - - [256, 576, 1, 64]
    - [100, 0.0]
  - - [320, 576, 1, 64]
    - [29, 0.0]
  - - [384, 576, 1, 64]
    - [83, 0.0]
  - - [448, 576, 1, 64]
    - [31, 0.0]
  - - [512, 576, 1, 64]
    - [101, 0.0]
  - - [576, 576, 1, 64]
    - [62, 0.0]
  - - [640, 576, 1, 64]
    - [102, 0.0]
  - - [704, 576, 1, 64]
    - [103, 0.0]
  - - [768, 576, 1, 64]
    - [104, 0.0]
  - - [832, 576, 1, 64]
    - [83, 0.0]
  - - [896, 576, 1, 64]
    - [105, 0.0]
  - - [960, 576, 1, 64]
    - [106, 0.0]
  - - [1024, 576, 1, 64]
    - [107, 0.0]
  - - [64, 640, 1, 64]
    - [108, 0.0]
  - - [128, 640, 1, 64]
    - [44, 0.0]
  - - [192, 640, 1, 64]
    - [51, 0.0]
  - - [256, 640, 1, 64]
    - [86, 0.0]
  - - [320, 640, 1, 64]
    - [109, 0.0]
  - - [384, 640, 1, 64]
    - [110, 0.0]
  - - [448, 640, 1, 64]
    - [111, 0.0]
  - - [512, 640, 1, 64]
    - [112, 0.0]
  - - [576, 640, 1, 64]
    - [113, 0.0]
  - - [640, 640, 1, 64]
    - [114, 0.0]
  - - [704, 640, 1, 64]
    - [83, 0.0]
  - - [768, 640, 1, 64]
    - [114, 0.0]
  - - [832, 640, 1, 64]
    - [78, 0.0]
  - - [896, 640, 1, 64]
    - [105, 0.0]
  - - [960, 640, 1, 64]
    - [113, 0.0]
  - - [1024, 640, 1, 64]
    - [79, 0.0]
  - - [64, 704, 1, 64]
    - [55, 0.0]
  - - [128, 704, 1, 64]
    - [115, 0.0]
  - - [192, 704, 1, 64]
    - [28, 0.0]
  - - [256, 704, 1, 64]
    - [116, 0.0]
  - - [320, 704, 1, 64]
    - [113, 0.0]
  - - [384, 704, 1, 64]
    - [72, 0.0]
  - - [448, 704, 1, 64]
    - [86, 0.0]
  - - [512, 704, 1, 64]
    - [106, 0.0]
  - - [576, 704, 1, 64]
    - [83, 0.0]
  - - [640, 704, 1, 64]
    - [110, 0.0]
  - - [704, 704, 1, 64]
    - [83, 0.0]
  - - [768, 704, 1, 64]
    - [102, 0.0]
  - - [832, 704, 1, 64]
    - [94, 0.0]
  - - [896, 704, 1, 64]
    - [117, 0.0]
  - - [960, 704, 1, 64]
    - [93, 0.0]
  - - [1024, 704, 1, 64]
    - [118, 0.0]
  - - [64, 768, 1, 64]
    - [119, 0.0]
  - - [128, 768, 1, 64]
    - [120, 0.0]
  - - [192, 768, 1, 64]
    - [39, 0.0]
  - - [256, 768, 1, 64]
    - [51, 0.0]
  - - [320, 768, 1, 64]
    - [121, 0.0]
  - - [384, 768, 1, 64]
    - [122, 0.0]
  - - [448, 768, 1, 64]
    - [72, 0.0]
  - - [512, 768, 1, 64]
    - [105, 0.0]
  - - [576, 768, 1, 64]
    - [109, 0.0]
  - - [640, 768, 1, 64]
    - [123, 0.0]
  - - [704, 768, 1, 64]
    - [106, 0.0]
  - - [768, 768, 1, 64]
    - [124, 0.0]
  - - [832, 768, 1, 64]
    - [83, 0.0]
  - - [896, 768, 1, 64]
    - [125, 0.0]
  - - [960, 768, 1, 64]
    - [83, 0.0]
  - - [1024, 768, 1, 64]
    - [114, 0.0]
  - - [64, 832, 1, 64]
    - [126, 0.0]
  - - [128, 832, 1, 64]
    - [44, 0.0]
  - - [192, 832, 1, 64]
    - [127, 0.0]
  - - [256, 832, 1, 64]
    - [128, 0.0]
  - - [320, 832, 1, 64]
    - [83, 0.0]
  - - [384, 832, 1, 64]
    - [70, 0.0]
  - - [448, 832, 1, 64]
    - [44, 0.0]
  - - [512, 832, 1, 64]
    - [88, 0.0]
  - - [576, 832, 1, 64]
    - [83, 0.0]
  - - [640, 832, 1, 64]
    - [129, 0.0]
  - - [704, 832, 1, 64]
    - [72, 0.0]
  - - [768, 832, 1, 64]
    - [102, 0.0]
  - - [832, 832, 1, 64]
    - [93, 0.0]
  - - [896, 832, 1, 64]
    - [130, 0.0]
  - - [960, 832, 1, 64]
    - [83, 0.0]
  - - [1024, 832, 1, 64]
    - [79, 0.0]
  - - [64, 896, 1, 64]
    - [131, 0.0]
  - - [128, 896, 1, 64]
    - [60, 0.0]
  - - [192, 896, 1, 64]
    - [55, 0.0]
  - - [256, 896, 1, 64]
    - [97, 0.0]
  - - [320, 896, 1, 64]
    - [94, 0.0]
  - - [384, 896, 1, 64]
    - [96, 0.0]
  - - [448, 896, 1, 64]
    - [103, 0.0]
  - - [512, 896, 1, 64]
    - [132, 0.0]
  - - [576, 896, 1, 64]
    - [106, 0.0]
  - - [640, 896, 1, 64]
    - [105, 0.0]
  - - [704, 896, 1, 64]
    - [78, 0.0]
  - - [768, 896, 1, 64]
    - [123, 0.0]
  - - [832, 896, 1, 64]
    - [109, 0.0]
  - - [896, 896, 1, 64]
    - [125, 0.0]
  - - [960, 896, 1, 64]
    - [83, 0.0]
  - - [1024, 896, 1, 64]
    - [133, 0.0]
  - - [64, 960, 1, 64]
    - [39, 0.0]
  - - [128, 960, 1, 64]
    - [29, 0.0]
  - - [192, 960, 1, 64]
    - [50, 0.0]
  - - [256, 960, 1, 64]
    - [83, 0.0]
  - - [320, 960, 1, 64]
    - [134, 0.0]
  - - [384, 960, 1, 64]
    - [72, 0.0]
  - - [448, 960, 1, 64]
    - [87, 0.0]
  - - [512, 960, 1, 64]
    - [88, 0.0]
  - - [576, 960, 1, 64]
    - [78, 0.0]
  - - [640, 960, 1, 64]
    - [102, 0.0]
  - - [704, 960, 1, 64]
    - [78, 0.0]
  - - [768, 960, 1, 64]
    - [88, 0.0]
  - - [832, 960, 1, 64]
    - [83, 0.0]
  - - [896, 960, 1, 64]
    - [117, 0.0]
  - - [960, 960, 1, 64]
    - [83, 0.0]
  - - [1024, 960, 1, 64]
    - [124, 0.0]
  - - [64, 1024, 1, 64]
    - [135, 0.0]
  - - [128, 1024, 1, 64]
    - [136, 0.0]
  - - [192, 1024, 1, 64]
    - [137, 0.0]
  - - [256, 1024, 1, 64]
    - [113, 0.0]
  - - [320, 1024, 1, 64]
    - [87, 0.0]
  - - [384, 1024, 1, 64]
    - [72, 0.0]
  - - [448, 1024, 1, 64]
    - [83, 0.0]
  - - [576, 1024, 1, 64]
    - [83, 0.0]
  - - [640, 1024, 1, 64]
    - [138, 0.0]
  - - [704, 1024, 1, 64]
    - [63, 0.0]
  - - [768, 1024, 1, 64]
    - [139, 0.0]
  - - [832, 1024, 1, 64]
    - [83, 0.0]
  - - [896, 1024, 1, 64]
    - [124, 0.0]
  - - [960, 1024, 1, 64]
    - [109, 0.0]
  - - [128, 64, 1, 256]
    - [141, 0.0]
  - - [192, 64, 1, 256]
    - [142, 0.0]
  - - [256, 64, 1, 256]
    - [42, 0.0]
  - - [320, 64, 1, 256]
    - [141, 0.0]
  - - [384, 64, 1, 256]
    - [143, 0.0]
  - - [448, 64, 1, 256]
    - [144, 0.0]
  - - [512, 64, 1, 256]
    - [144, 0.0]
  - - [576, 64, 1, 256]
    - [144, 0.0]
  - - [640, 64, 1, 256]
    - [51, 0.0]
  - - [704, 64, 1, 256]
    - [145, 0.0]
  - - [768, 64, 1, 256]
    - [95, 0.0]
  - - [832, 64, 1, 256]
    - [51, 0.0]
  - - [896, 64, 1, 256]
    - [56, 0.0]
  - - [960, 64, 1, 256]
    - [51, 0.0]
  - - [1024, 64, 1, 256]
    - [29, 0.0]
  - - [64, 128, 1, 256]
    - [146, 0.0]
  - - [128, 128, 1, 256]
    - [147, 0.0]
  - - [192, 128, 1, 256]
    - [148, 0.0]
  - - [256, 128, 1, 256]
    - [149, 0.0]
  - - [320, 128, 1, 256]
    - [18, 0.0]
  - - [384, 128, 1, 256]
    - [56, 0.0]
  - - [448, 128, 1, 256]
    - [29, 0.0]
  - - [512, 128, 1, 256]
    - [51, 0.0]
  - - [576, 128, 1, 256]
    - [51, 0.0]
  - - [640, 128, 1, 256]
    - [76, 0.0]
  - - [704, 128, 1, 256]
    - [29, 0.0]
  - - [768, 128, 1, 256]
    - [60, 0.0]
  - - [832, 128, 1, 256]
    - [136, 0.0]
  - - [896, 128, 1, 256]
    - [44, 0.0]
  - - [960, 128, 1, 256]
    - [76, 0.0]
  - - [1024, 128, 1, 256]
    - [51, 0.0]
  - - [64, 192, 1, 256]
    - [150, 0.0]
  - - [128, 192, 1, 256]
    - [144, 0.0]
  - - [192, 192, 1, 256]
    - [151, 0.0]
  - - [256, 192, 1, 256]
    - [76, 0.0]
  - - [320, 192, 1, 256]
    - [29, 0.0]
  - - [384, 192, 1, 256]
    - [29, 0.0]
  - - [448, 192, 1, 256]
    - [30, 0.0]
  - - [512, 192, 1, 256]
    - [44, 0.0]
  - - [576, 192, 1, 256]
    - [30, 0.0]
  - - [640, 192, 1, 256]
    - [29, 0.0]
  - - [704, 192, 1, 256]
    - [51, 0.0]
  - - [768, 192, 1, 256]
    - [44, 0.0]
  - - [832, 192, 1, 256]
    - [31, 0.0]
  - - [896, 192, 1, 256]
    - [44, 0.0]
  - - [960, 192, 1, 256]
    - [49, 0.0]
  - - [1024, 192, 1, 256]
    - [51, 0.0]
  - - [64, 256, 1, 256]
    - [152, 0.0]
  - - [128, 256, 1, 256]
    - [153, 0.0]
  - - [192, 256, 1, 256]
    - [36, 0.0]
  - - [256, 256, 1, 256]
    - [154, 0.0]
  - - [320, 256, 1, 256]
    - [29, 0.0]
  - - [384, 256, 1, 256]
    - [29, 0.0]
  - - [448, 256, 1, 256]
    - [44, 0.0]
  - - [512, 256, 1, 256]
    - [155, 0.0]
  - - [576, 256, 1, 256]
    - [51, 0.0]
  - - [640, 256, 1, 256]
    - [56, 0.0]
  - - [704, 256, 1, 256]
    - [44, 0.0]
  - - [768, 256, 1, 256]
    - [44, 0.0]
  - - [832, 256, 1, 256]
    - [51, 0.0]
  - - [896, 256, 1, 256]
    - [88, 0.0]
  - - [960, 256, 1, 256]
    - [62, 0.0]
  - - [1024, 256, 1, 256]
    - [156, 0.0]
  - - [64, 320, 1, 256]
    - [144, 0.0]
  - - [128, 320, 1, 256]
    - [144, 0.0]
  - - [192, 320, 1, 256]
    - [51, 0.0]
  - - [256, 320, 1, 256]
    - [51, 0.0]
  - - [320, 320, 1, 256]
    - [157, 0.0]
  - - [384, 320, 1, 256]
    - [136, 0.0]
  - - [448, 320, 1, 256]
    - [44, 0.0]
  - - [512, 320, 1, 256]
    - [158, 0.0]
  - - [576, 320, 1, 256]
    - [159, 0.0]
  - - [640, 320, 1, 256]
    - [113, 0.0]
  - - [704, 320, 1, 256]
    - [44, 0.0]
  - - [768, 320, 1, 256]
    - [31, 0.0]
  - - [832, 320, 1, 256]
    - [29, 0.0]
  - - [896, 320, 1, 256]
    - [69, 0.0]
  - - [960, 320, 1, 256]
    - [28, 0.0]
  - - [1024, 320, 1, 256]
    - [155, 0.0]
  - - [64, 384, 1, 256]
    - [160, 0.0]
  - - [128, 384, 1, 256]
    - [60, 0.0]
  - - [192, 384, 1, 256]
    - [76, 0.0]
  - - [256, 384, 1, 256]
    - [87, 0.0]
  - - [320, 384, 1, 256]
    - [54, 0.0]
  - - [384, 384, 1, 256]
    - [49, 0.0]
  - - [448, 384, 1, 256]
    - [51, 0.0]
  - - [512, 384, 1, 256]
    - [29, 0.0]
  - - [576, 384, 1, 256]
    - [154, 0.0]
  - - [640, 384, 1, 256]
    - [72, 0.0]
  - - [704, 384, 1, 256]
    - [83, 0.0]
  - - [768, 384, 1, 256]
    - [51, 0.0]
  - - [832, 384, 1, 256]
    - [26, 0.0]
  - - [896, 384, 1, 256]
    - [83, 0.0]
  - - [960, 384, 1, 256]
    - [83, 0.0]
  - - [1024, 384, 1, 256]
    - [83, 0.0]
  - - [64, 448, 1, 256]
    - [161, 0.0]
  - - [128, 448, 1, 256]
    - [29, 0.0]
  - - [192, 448, 1, 256]
    - [29, 0.0]
  - - [256, 448, 1, 256]
    - [87, 0.0]
  - - [320, 448, 1, 256]
    - [44, 0.0]
  - - [384, 448, 1, 256]
    - [31, 0.0]
  - - [448, 448, 1, 256]
    - [44, 0.0]
  - - [512, 448, 1, 256]
    - [82, 0.0]
  - - [576, 448, 1, 256]
    - [28, 0.0]
  - - [640, 448, 1, 256]
    - [115, 0.0]
  - - [704, 448, 1, 256]
    - [162, 0.0]
  - - [768, 448, 1, 256]
    - [85, 0.0]
  - - [832, 448, 1, 256]
    - [74, 0.0]
  - - [896, 448, 1, 256]
    - [163, 0.0]
  - - [960, 448, 1, 256]
    - [115, 0.0]
  - - [1024, 448, 1, 256]
    - [164, 0.0]
  - - [64, 512, 1, 256]
    - [143, 0.0]
  - - [128, 512, 1, 256]
    - [29, 0.0]
  - - [192, 512, 1, 256]
    - [29, 0.0]
  - - [256, 512, 1, 256]
    - [136, 0.0]
  - - [320, 512, 1, 256]
    - [44, 0.0]
  - - [384, 512, 1, 256]
    - [29, 0.0]
  - - [448, 512, 1, 256]
    - [159, 0.0]
  - - [576, 512, 1, 256]
    - [74, 0.0]
  - - [640, 512, 1, 256]
    - [166, 0.0]
  - - [704, 512, 1, 256]
    - [103, 0.0]
  - - [768, 512, 1, 256]
    - [125, 0.0]
  - - [832, 512, 1, 256]
    - [74, 0.0]
  - - [896, 512, 1, 256]
    - [167, 0.0]
  - - [960, 512, 1, 256]
    - [51, 0.0]
  - - [64, 576, 1, 256]
    - [147, 0.0]
  - - [128, 576, 1, 256]
    - [29, 0.0]
  - - [192, 576, 1, 256]
    - [44, 0.0]
  - - [256, 576, 1, 256]
    - [51, 0.0]
  - - [320, 576, 1, 256]
    - [51, 0.0]
  - - [384, 576, 1, 256]
    - [29, 0.0]
  - - [448, 576, 1, 256]
    - [26, 0.0]
  - - [512, 576, 1, 256]
    - [31, 0.0]
  - - [576, 576, 1, 256]
    - [168, 0.0]
  - - [640, 576, 1, 256]
    - [82, 0.0]
  - - [704, 576, 1, 256]
    - [29, 0.0]
  - - [768, 576, 1, 256]
    - [169, 0.0]
  - - [832, 576, 1, 256]
    - [40, 0.0]
  - - [896, 576, 1, 256]
    - [105, 0.0]
  - - [960, 576, 1, 256]
    - [115, 0.0]
  - - [1024, 576, 1, 256]
    - [91, 0.0]
  - - [64, 640, 1, 256]
    - [29, 0.0]
  - - [128, 640, 1, 256]
    - [159, 0.0]
  - - [192, 640, 1, 256]
    - [26, 0.0]
  - - [256, 640, 1, 256]
    - [170, 0.0]
  - - [320, 640, 1, 256]
    - [29, 0.0]
  - - [384, 640, 1, 256]
    - [171, 0.0]
  - - [448, 640, 1, 256]
    - [51, 0.0]
  - - [512, 640, 1, 256]
    - [72, 0.0]
  - - [576, 640, 1, 256]
    - [89, 0.0]
  - - [640, 640, 1, 256]
    - [167, 0.0]
  - - [704, 640, 1, 256]
    - [106, 0.0]
  - - [768, 640, 1, 256]
    - [163, 0.0]
  - - [832, 640, 1, 256]
    - [106, 0.0]
  - - [896, 640, 1, 256]
    - [88, 0.0]
  - - [960, 640, 1, 256]
    - [106, 0.0]
  - - [1024, 640, 1, 256]
    - [88, 0.0]
  - - [64, 704, 1, 256]
    - [141, 0.0]
  - - [128, 704, 1, 256]
    - [172, 0.0]
  - - [192, 704, 1, 256]
    - [36, 0.0]
  - - [256, 704, 1, 256]
    - [172, 0.0]
  - - [320, 704, 1, 256]
    - [57, 0.0]
  - - [384, 704, 1, 256]
    - [166, 0.0]
  - - [448, 704, 1, 256]
    - [57, 0.0]
  - - [512, 704, 1, 256]
    - [111, 0.0]
  - - [576, 704, 1, 256]
    - [31, 0.0]
  - - [640, 704, 1, 256]
    - [125, 0.0]
  - - [704, 704, 1, 256]
    - [51, 0.0]
  - - [768, 704, 1, 256]
    - [44, 0.0]
  - - [832, 704, 1, 256]
    - [44, 0.0]
  - - [896, 704, 1, 256]
    - [44, 0.0]
  - - [960, 704, 1, 256]
    - [31, 0.0]
  - - [1024, 704, 1, 256]
    - [124, 0.0]
  - - [64, 768, 1, 256]
    - [29, 0.0]
  - - [128, 768, 1, 256]
    - [173, 0.0]
  - - [192, 768, 1, 256]
    - [29, 0.0]
  - - [256, 768, 1, 256]
    - [174, 0.0]
  - - [320, 768, 1, 256]
    - [72, 0.0]
  - - [384, 768, 1, 256]
    - [29, 0.0]
  - - [448, 768, 1, 256]
    - [113, 0.0]
  - - [512, 768, 1, 256]
    - [72, 0.0]
  - - [576, 768, 1, 256]
    - [72, 0.0]
  - - [640, 768, 1, 256]
    - [175, 0.0]
  - - [704, 768, 1, 256]
    - [29, 0.0]
  - - [768, 768, 1, 256]
    - [80, 0.0]
  - - [832, 768, 1, 256]
    - [72, 0.0]
  - - [896, 768, 1, 256]
    - [125, 0.0]
  - - [960, 768, 1, 256]
    - [44, 0.0]
  - - [1024, 768, 1, 256]
    - [124, 0.0]
  - - [64, 832, 1, 256]
    - [154, 0.0]
  - - [128, 832, 1, 256]
    - [36, 0.0]
  - - [192, 832, 1, 256]
    - [29, 0.0]
  - - [256, 832, 1, 256]
    - [156, 0.0]
  - - [320, 832, 1, 256]
    - [29, 0.0]
  - - [384, 832, 1, 256]
    - [121, 0.0]
  - - [448, 832, 1, 256]
    - [121, 0.0]
  - - [512, 832, 1, 256]
    - [106, 0.0]
  - - [576, 832, 1, 256]
    - [51, 0.0]
  - - [640, 832, 1, 256]
    - [51, 0.0]
  - - [704, 832, 1, 256]
    - [136, 0.0]
  - - [768, 832, 1, 256]
    - [104, 0.0]
  - - [832, 832, 1, 256]
    - [31, 0.0]
  - - [896, 832, 1, 256]
    - [44, 0.0]
  - - [960, 832, 1, 256]
    - [72, 0.0]
  - - [1024, 832, 1, 256]
    - [113, 0.0]
  - - [64, 896, 1, 256]
    - [176, 0.0]
  - - [128, 896, 1, 256]
    - [44, 0.0]
  - - [192, 896, 1, 256]
    - [177, 0.0]
  - - [256, 896, 1, 256]
    - [165, 0.0]
  - - [320, 896, 1, 256]
    - [134, 0.0]
  - - [384, 896, 1, 256]
    - [72, 0.0]
  - - [448, 896, 1, 256]
    - [74, 0.0]
  - - [512, 896, 1, 256]
    - [122, 0.0]
  - - [576, 896, 1, 256]
    - [113, 0.0]
  - - [640, 896, 1, 256]
    - [88, 0.0]
  - - [704, 896, 1, 256]
    - [106, 0.0]
  - - [768, 896, 1, 256]
    - [88, 0.0]
  - - [832, 896, 1, 256]
    - [113, 0.0]
  - - [896, 896, 1, 256]
    - [113, 0.0]
  - - [960, 896, 1, 256]
    - [72, 0.0]
  - - [1024, 896, 1, 256]
    - [178, 0.0]
  - - [64, 960, 1, 256]
    - [51, 0.0]
  - - [128, 960, 1, 256]
    - [157, 0.0]
  - - [192, 960, 1, 256]
    - [76, 0.0]
  - - [256, 960, 1, 256]
    - [83, 0.0]
  - - [320, 960, 1, 256]
    - [91, 0.0]
  - - [384, 960, 1, 256]
    - [83, 0.0]
  - - [448, 960, 1, 256]
    - [106, 0.0]
  - - [512, 960, 1, 256]
    - [104, 0.0]
  - - [576, 960, 1, 256]
    - [134, 0.0]
  - - [640, 960, 1, 256]
    - [94, 0.0]
  - - [704, 960, 1, 256]
    - [166, 0.0]
  - - [768, 960, 1, 256]
    - [179, 0.0]
  - - [832, 960, 1, 256]
    - [54, 0.0]
  - - [896, 960, 1, 256]
    - [72, 0.0]
  - - [960, 960, 1, 256]
    - [74, 0.0]
  - - [1024, 960, 1, 256]
    - [124, 0.0]
  - - [64, 1024, 1, 256]
    - [65, 0.0]
  - - [128, 1024, 1, 256]
    - [36, 0.0]
  - - [192, 1024, 1, 256]
    - [29, 0.0]
  - - [256, 1024, 1, 256]
    - [87, 0.0]
  - - [320, 1024, 1, 256]
    - [91, 0.0]
  - - [384, 1024, 1, 256]
    - [82, 0.0]
  - - [448, 1024, 1, 256]
    - [87, 0.0]
  - - [576, 1024, 1, 256]
    - [83, 0.0]
  - - [640, 1024, 1, 256]
    - [180, 0.0]
  - - [704, 1024, 1, 256]
    - [113, 0.0]
  - - [768, 1024, 1, 256]
    - [122, 0.0]
  - - [832, 1024, 1, 256]
    - [72, 0.0]
  - - [896, 1024, 1, 256]
    - [123, 0.0]
  - - [960, 1024, 1, 256]
    - [94, 0.0]
  - - [128, 64, 1, 512]
    - [147, 0.0]
  - - [192, 64, 1, 512]
    - [181, 0.0]
  - - [256, 64, 1, 512]
    - [182, 0.0]
  - - [320, 64, 1, 512]
    - [141, 0.0]
  - - [384, 64, 1, 512]
    - [143, 0.0]
  - - [448, 64, 1, 512]
    - [144, 0.0]
  - - [512, 64, 1, 512]
    - [42, 0.0]
  - - [576, 64, 1, 512]
    - [144, 0.0]
  - - [640, 64, 1, 512]
    - [18, 0.0]
  - - [704, 64, 1, 512]
    - [183, 0.0]
  - - [768, 64, 1, 512]
    - [149, 0.0]
  - - [832, 64, 1, 512]
    - [56, 0.0]
  - - [896, 64, 1, 512]
    - [29, 0.0]
  - - [960, 64, 1, 512]
    - [51, 0.0]
  - - [1024, 64, 1, 512]
    - [51, 0.0]
  - - [64, 128, 1, 512]
    - [144, 0.0]
  - - [128, 128, 1, 512]
    - [184, 0.0]
  - - [192, 128, 1, 512]
    - [18, 0.0]
  - - [256, 128, 1, 512]
    - [185, 0.0]
  - - [320, 128, 1, 512]
    - [29, 0.0]
  - - [384, 128, 1, 512]
    - [60, 0.0]
  - - [448, 128, 1, 512]
    - [60, 0.0]
  - - [512, 128, 1, 512]
    - [51, 0.0]
  - - [576, 128, 1, 512]
    - [40, 0.0]
  - - [640, 128, 1, 512]
    - [154, 0.0]
  - - [704, 128, 1, 512]
    - [154, 0.0]
  - - [768, 128, 1, 512]
    - [51, 0.0]
  - - [832, 128, 1, 512]
    - [154, 0.0]
  - - [896, 128, 1, 512]
    - [29, 0.0]
  - - [960, 128, 1, 512]
    - [29, 0.0]
  - - [1024, 128, 1, 512]
    - [76, 0.0]
  - - [64, 192, 1, 512]
    - [184, 0.0]
  - - [128, 192, 1, 512]
    - [141, 0.0]
  - - [192, 192, 1, 512]
    - [51, 0.0]
  - - [256, 192, 1, 512]
    - [40, 0.0]
  - - [320, 192, 1, 512]
    - [51, 0.0]
  - - [384, 192, 1, 512]
    - [29, 0.0]
  - - [448, 192, 1, 512]
    - [29, 0.0]
  - - [512, 192, 1, 512]
    - [51, 0.0]
  - - [576, 192, 1, 512]
    - [136, 0.0]
  - - [640, 192, 1, 512]
    - [29, 0.0]
  - - [704, 192, 1, 512]
    - [51, 0.0]
  - - [768, 192, 1, 512]
    - [29, 0.0]
  - - [832, 192, 1, 512]
    - [44, 0.0]
  - - [896, 192, 1, 512]
    - [29, 0.0]
  - - [960, 192, 1, 512]
    - [44, 0.0]
  - - [1024, 192, 1, 512]
    - [51, 0.0]
  - - [64, 256, 1, 512]
    - [147, 0.0]
  - - [128, 256, 1, 512]
    - [143, 0.0]
  - - [192, 256, 1, 512]
    - [40, 0.0]
  - - [256, 256, 1, 512]
    - [154, 0.0]
  - - [320, 256, 1, 512]
    - [51, 0.0]
  - - [384, 256, 1, 512]
    - [29, 0.0]
  - - [448, 256, 1, 512]
    - [51, 0.0]
  - - [512, 256, 1, 512]
    - [29, 0.0]
  - - [576, 256, 1, 512]
    - [44, 0.0]
  - - [640, 256, 1, 512]
    - [29, 0.0]
  - - [704, 256, 1, 512]
    - [31, 0.0]
  - - [768, 256, 1, 512]
    - [56, 0.0]
  - - [832, 256, 1, 512]
    - [49, 0.0]
  - - [896, 256, 1, 512]
    - [88, 0.0]
  - - [960, 256, 1, 512]
    - [92, 0.0]
  - - [1024, 256, 1, 512]
    - [82, 0.0]
  - - [64, 320, 1, 512]
    - [141, 0.0]
  - - [128, 320, 1, 512]
    - [29, 0.0]
  - - [192, 320, 1, 512]
    - [51, 0.0]
  - - [256, 320, 1, 512]
    - [44, 0.0]
  - - [320, 320, 1, 512]
    - [29, 0.0]
  - - [384, 320, 1, 512]
    - [51, 0.0]
  - - [448, 320, 1, 512]
    - [36, 0.0]
  - - [512, 320, 1, 512]
    - [29, 0.0]
  - - [576, 320, 1, 512]
    - [29, 0.0]
  - - [640, 320, 1, 512]
    - [44, 0.0]
  - - [704, 320, 1, 512]
    - [51, 0.0]
  - - [768, 320, 1, 512]
    - [31, 0.0]
  - - [832, 320, 1, 512]
    - [31, 0.0]
  - - [896, 320, 1, 512]
    - [31, 0.0]
  - - [960, 320, 1, 512]
    - [31, 0.0]
  - - [1024, 320, 1, 512]
    - [37, 0.0]
  - - [64, 384, 1, 512]
    - [147, 0.0]
  - - [128, 384, 1, 512]
    - [147, 0.0]
  - - [192, 384, 1, 512]
    - [29, 0.0]
  - - [256, 384, 1, 512]
    - [44, 0.0]
  - - [320, 384, 1, 512]
    - [29, 0.0]
  - - [384, 384, 1, 512]
    - [60, 0.0]
  - - [448, 384, 1, 512]
    - [29, 0.0]
  - - [512, 384, 1, 512]
    - [29, 0.0]
  - - [576, 384, 1, 512]
    - [29, 0.0]
  - - [640, 384, 1, 512]
    - [180, 0.0]
  - - [704, 384, 1, 512]
    - [28, 0.0]
  - - [768, 384, 1, 512]
    - [31, 0.0]
  - - [832, 384, 1, 512]
    - [74, 0.0]
  - - [896, 384, 1, 512]
    - [29, 0.0]
  - - [960, 384, 1, 512]
    - [106, 0.0]
  - - [1024, 384, 1, 512]
    - [51, 0.0]
  - - [64, 448, 1, 512]
    - [186, 0.0]
  - - [128, 448, 1, 512]
    - [29, 0.0]
  - - [192, 448, 1, 512]
    - [51, 0.0]
  - - [256, 448, 1, 512]
    - [44, 0.0]
  - - [320, 448, 1, 512]
    - [29, 0.0]
  - - [384, 448, 1, 512]
    - [136, 0.0]
  - - [448, 448, 1, 512]
    - [31, 0.0]
  - - [512, 448, 1, 512]
    - [72, 0.0]
  - - [576, 448, 1, 512]
    - [36, 0.0]
  - - [640, 448, 1, 512]
    - [30, 0.0]
  - - [704, 448, 1, 512]
    - [69, 0.0]
  - - [768, 448, 1, 512]
    - [136, 0.0]
  - - [832, 448, 1, 512]
    - [29, 0.0]
  - - [896, 448, 1, 512]
    - [29, 0.0]
  - - [960, 448, 1, 512]
    - [51, 0.0]
  - - [1024, 448, 1, 512]
    - [56, 0.0]
  - - [64, 512, 1, 512]
    - [42, 0.0]
  - - [128, 512, 1, 512]
    - [60, 0.0]
  - - [192, 512, 1, 512]
    - [29, 0.0]
  - - [256, 512, 1, 512]
    - [56, 0.0]
  - - [320, 512, 1, 512]
    - [51, 0.0]
  - - [384, 512, 1, 512]
    - [136, 0.0]
  - - [448, 512, 1, 512]
    - [29, 0.0]
  - - [576, 512, 1, 512]
    - [28, 0.0]
  - - [640, 512, 1, 512]
    - [30, 0.0]
  - - [704, 512, 1, 512]
    - [29, 0.0]
  - - [768, 512, 1, 512]
    - [187, 0.0]
  - - [832, 512, 1, 512]
    - [56, 0.0]
  - - [896, 512, 1, 512]
    - [175, 0.0]
  - - [960, 512, 1, 512]
    - [56, 0.0]
  - - [64, 576, 1, 512]
    - [153, 0.0]
  - - [128, 576, 1, 512]
    - [29, 0.0]
  - - [192, 576, 1, 512]
    - [51, 0.0]
  - - [256, 576, 1, 512]
    - [31, 0.0]
  - - [320, 576, 1, 512]
    - [51, 0.0]
  - - [384, 576, 1, 512]
    - [31, 0.0]
  - - [448, 576, 1, 512]
    - [44, 0.0]
  - - [512, 576, 1, 512]
    - [29, 0.0]
  - - [576, 576, 1, 512]
    - [29, 0.0]
  - - [640, 576, 1, 512]
    - [51, 0.0]
  - - [704, 576, 1, 512]
    - [29, 0.0]
  - - [768, 576, 1, 512]
    - [29, 0.0]
  - - [832, 576, 1, 512]
    - [51, 0.0]
  - - [896, 576, 1, 512]
    - [29, 0.0]
  - - [960, 576, 1, 512]
    - [29, 0.0]
  - - [1024, 576, 1, 512]
    - [51, 0.0]
  - - [64, 640, 1, 512]
    - [60, 0.0]
  - - [128, 640, 1, 512]
    - [136, 0.0]
  - - [192, 640, 1, 512]
    - [51, 0.0]
  - - [256, 640, 1, 512]
    - [159, 0.0]
  - - [320, 640, 1, 512]
    - [28, 0.0]
  - - [384, 640, 1, 512]
    - [88, 0.0]
  - - [448, 640, 1, 512]
    - [36, 0.0]
  - - [512, 640, 1, 512]
    - [155, 0.0]
  - - [576, 640, 1, 512]
    - [56, 0.0]
  - - [640, 640, 1, 512]
    - [180, 0.0]
  - - [704, 640, 1, 512]
    - [136, 0.0]
  - - [768, 640, 1, 512]
    - [51, 0.0]
  - - [832, 640, 1, 512]
    - [29, 0.0]
  - - [896, 640, 1, 512]
    - [29, 0.0]
  - - [960, 640, 1, 512]
    - [29, 0.0]
  - - [1024, 640, 1, 512]
    - [125, 0.0]
  - - [64, 704, 1, 512]
    - [58, 0.0]
  - - [128, 704, 1, 512]
    - [29, 0.0]
  - - [192, 704, 1, 512]
    - [56, 0.0]
  - - [256, 704, 1, 512]
    - [29, 0.0]
  - - [320, 704, 1, 512]
    - [51, 0.0]
  - - [384, 704, 1, 512]
    - [44, 0.0]
  - - [448, 704, 1, 512]
    - [26, 0.0]
  - - [512, 704, 1, 512]
    - [51, 0.0]
  - - [576, 704, 1, 512]
    - [40, 0.0]
  - - [640, 704, 1, 512]
    - [51, 0.0]
  - - [704, 704, 1, 512]
    - [29, 0.0]
  - - [768, 704, 1, 512]
    - [40, 0.0]
  - - [832, 704, 1, 512]
    - [136, 0.0]
  - - [896, 704, 1, 512]
    - [29, 0.0]
  - - [960, 704, 1, 512]
    - [44, 0.0]
  - - [1024, 704, 1, 512]
    - [88, 0.0]
  - - [64, 768, 1, 512]
    - [29, 0.0]
  - - [128, 768, 1, 512]
    - [51, 0.0]
  - - [192, 768, 1, 512]
    - [136, 0.0]
  - - [256, 768, 1, 512]
    - [136, 0.0]
  - - [320, 768, 1, 512]
    - [28, 0.0]
  - - [384, 768, 1, 512]
    - [51, 0.0]
  - - [448, 768, 1, 512]
    - [29, 0.0]
  - - [512, 768, 1, 512]
    - [113, 0.0]
  - - [576, 768, 1, 512]
    - [51, 0.0]
  - - [640, 768, 1, 512]
    - [175, 0.0]
  - - [704, 768, 1, 512]
    - [51, 0.0]
  - - [768, 768, 1, 512]
    - [36, 0.0]
  - - [832, 768, 1, 512]
    - [51, 0.0]
  - - [896, 768, 1, 512]
    - [88, 0.0]
  - - [960, 768, 1, 512]
    - [159, 0.0]
  - - [1024, 768, 1, 512]
    - [88, 0.0]
  - - [64, 832, 1, 512]
    - [40, 0.0]
  - - [128, 832, 1, 512]
    - [136, 0.0]
  - - [192, 832, 1, 512]
    - [51, 0.0]
  - - [256, 832, 1, 512]
    - [180, 0.0]
  - - [320, 832, 1, 512]
    - [44, 0.0]
  - - [384, 832, 1, 512]
    - [30, 0.0]
  - - [448, 832, 1, 512]
    - [29, 0.0]
  - - [512, 832, 1, 512]
    - [136, 0.0]
  - - [576, 832, 1, 512]
    - [51, 0.0]
  - - [640, 832, 1, 512]
    - [51, 0.0]
  - - [704, 832, 1, 512]
    - [51, 0.0]
  - - [768, 832, 1, 512]
    - [51, 0.0]
  - - [832, 832, 1, 512]
    - [159, 0.0]
  - - [896, 832, 1, 512]
    - [31, 0.0]
  - - [960, 832, 1, 512]
    - [51, 0.0]
  - - [1024, 832, 1, 512]
    - [29, 0.0]
  - - [64, 896, 1, 512]
    - [29, 0.0]
  - - [128, 896, 1, 512]
    - [29, 0.0]
  - - [192, 896, 1, 512]
    - [44, 0.0]
  - - [256, 896, 1, 512]
    - [88, 0.0]
  - - [320, 896, 1, 512]
    - [28, 0.0]
  - - [384, 896, 1, 512]
    - [29, 0.0]
  - - [448, 896, 1, 512]
    - [40, 0.0]
  - - [512, 896, 1, 512]
    - [88, 0.0]
  - - [576, 896, 1, 512]
    - [29, 0.0]
  - - [640, 896, 1, 512]
    - [51, 0.0]
  - - [704, 896, 1, 512]
    - [51, 0.0]
  - - [768, 896, 1, 512]
    - [125, 0.0]
  - - [832, 896, 1, 512]
    - [51, 0.0]
  - - [896, 896, 1, 512]
    - [88, 0.0]
  - - [960, 896, 1, 512]
    - [113, 0.0]
  - - [1024, 896, 1, 512]
    - [164, 0.0]
  - - [64, 960, 1, 512]
    - [60, 0.0]
  - - [128, 960, 1, 512]
    - [44, 0.0]
  - - [192, 960, 1, 512]
    - [29, 0.0]
  - - [256, 960, 1, 512]
    - [180, 0.0]
  - - [320, 960, 1, 512]
    - [51, 0.0]
  - - [384, 960, 1, 512]
    - [106, 0.0]
  - - [448, 960, 1, 512]
    - [51, 0.0]
  - - [512, 960, 1, 512]
    - [29, 0.0]
  - - [576, 960, 1, 512]
    - [29, 0.0]
  - - [640, 960, 1, 512]
    - [29, 0.0]
  - - [704, 960, 1, 512]
    - [113, 0.0]
  - - [768, 960, 1, 512]
    - [167, 0.0]
  - - [832, 960, 1, 512]
    - [159, 0.0]
  - - [896, 960, 1, 512]
    - [88, 0.0]
  - - [960, 960, 1, 512]
    - [72, 0.0]
  - - [1024, 960, 1, 512]
    - [163, 0.0]
  - - [64, 1024, 1, 512]
    - [29, 0.0]
  - - [128, 1024, 1, 512]
    - [44, 0.0]
  - - [192, 1024, 1, 512]
    - [154, 0.0]
  - - [256, 1024, 1, 512]
    - [188, 0.0]
  - - [320, 1024, 1, 512]
    - [83, 0.0]
  - - [384, 1024, 1, 512]
    - [29, 0.0]
  - - [448, 1024, 1, 512]
    - [29, 0.0]
  - - [576, 1024, 1, 512]
    - [28, 0.0]
  - - [640, 1024, 1, 512]
    - [88, 0.0]
  - - [704, 1024, 1, 512]
    - [72, 0.0]
  - - [768, 1024, 1, 512]
    - [139, 0.0]
  - - [832, 1024, 1, 512]
    - [113, 0.0]
  - - [896, 1024, 1, 512]
    - [88, 0.0]
  - - [960, 1024, 1, 512]
    - [78, 0.0]
  - - [128, 64, 1, 1024]
    - [184, 0.0]
  - - [192, 64, 1, 1024]
    - [144, 0.0]
  - - [256, 64, 1, 1024]
    - [141, 0.0]
  - - [320, 64, 1, 1024]
    - [144, 0.0]
  - - [384, 64, 1, 1024]
    - [144, 0.0]
  - - [448, 64, 1, 1024]
    - [141, 0.0]
  - - [512, 64, 1, 1024]
    - [143, 0.0]
  - - [576, 64, 1, 1024]
    - [140, 0.0]
  - - [640, 64, 1, 1024]
    - [161, 0.0]
  - - [704, 64, 1, 1024]
    - [29, 0.0]
  - - [768, 64, 1, 1024]
    - [29, 0.0]
  - - [832, 64, 1, 1024]
    - [51, 0.0]
  - - [896, 64, 1, 1024]
    - [36, 0.0]
  - - [960, 64, 1, 1024]
    - [51, 0.0]
  - - [1024, 64, 1, 1024]
    - [40, 0.0]
  - - [64, 128, 1, 1024]
    - [190, 0.0]
  - - [128, 128, 1, 1024]
    - [151, 0.0]
  - - [192, 128, 1, 1024]
    - [42, 0.0]
  - - [256, 128, 1, 1024]
    - [149, 0.0]
  - - [320, 128, 1, 1024]
    - [29, 0.0]
  - - [384, 128, 1, 1024]
    - [60, 0.0]
  - - [448, 128, 1, 1024]
    - [51, 0.0]
  - - [512, 128, 1, 1024]
    - [60, 0.0]
  - - [576, 128, 1, 1024]
    - [136, 0.0]
  - - [640, 128, 1, 1024]
    - [191, 0.0]
  - - [704, 128, 1, 1024]
    - [154, 0.0]
  - - [768, 128, 1, 1024]
    - [154, 0.0]
  - - [832, 128, 1, 1024]
    - [136, 0.0]
  - - [896, 128, 1, 1024]
    - [29, 0.0]
  - - [960, 128, 1, 1024]
    - [51, 0.0]
  - - [1024, 128, 1, 1024]
    - [51, 0.0]
  - - [64, 192, 1, 1024]
    - [141, 0.0]
  - - [128, 192, 1, 1024]
    - [144, 0.0]
  - - [192, 192, 1, 1024]
    - [29, 0.0]
  - - [256, 192, 1, 1024]
    - [51, 0.0]
  - - [320, 192, 1, 1024]
    - [136, 0.0]
  - - [384, 192, 1, 1024]
    - [36, 0.0]
  - - [448, 192, 1, 1024]
    - [44, 0.0]
  - - [512, 192, 1, 1024]
    - [36, 0.0]
  - - [576, 192, 1, 1024]
    - [29, 0.0]
  - - [640, 192, 1, 1024]
    - [29, 0.0]
  - - [704, 192, 1, 1024]
    - [158, 0.0]
  - - [768, 192, 1, 1024]
    - [29, 0.0]
  - - [832, 192, 1, 1024]
    - [29, 0.0]
  - - [896, 192, 1, 1024]
    - [51, 0.0]
  - - [960, 192, 1, 1024]
    - [136, 0.0]
  - - [1024, 192, 1, 1024]
    - [136, 0.0]
  - - [64, 256, 1, 1024]
    - [160, 0.0]
  - - [128, 256, 1, 1024]
    - [160, 0.0]
  - - [192, 256, 1, 1024]
    - [29, 0.0]
  - - [256, 256, 1, 1024]
    - [51, 0.0]
  - - [320, 256, 1, 1024]
    - [29, 0.0]
  - - [384, 256, 1, 1024]
    - [29, 0.0]
  - - [448, 256, 1, 1024]
    - [51, 0.0]
  - - [512, 256, 1, 1024]
    - [36, 0.0]
  - - [576, 256, 1, 1024]
    - [51, 0.0]
  - - [640, 256, 1, 1024]
    - [136, 0.0]
  - - [704, 256, 1, 1024]
    - [51, 0.0]
  - - [768, 256, 1, 1024]
    - [136, 0.0]
  - - [832, 256, 1, 1024]
    - [29, 0.0]
  - - [896, 256, 1, 1024]
    - [88, 0.0]
  - - [960, 256, 1, 1024]
    - [49, 0.0]
  - - [1024, 256, 1, 1024]
    - [192, 0.0]
  - - [64, 320, 1, 1024]
    - [147, 0.0]
  - - [128, 320, 1, 1024]
    - [193, 0.0]
  - - [192, 320, 1, 1024]
    - [51, 0.0]
  - - [256, 320, 1, 1024]
    - [136, 0.0]
  - - [320, 320, 1, 1024]
    - [51, 0.0]
  - - [384, 320, 1, 1024]
    - [51, 0.0]
  - - [448, 320, 1, 1024]
    - [51, 0.0]
  - - [512, 320, 1, 1024]
    - [136, 0.0]
  - - [576, 320, 1, 1024]
    - [29, 0.0]
  - - [640, 320, 1, 1024]
    - [44, 0.0]
  - - [704, 320, 1, 1024]
    - [176, 0.0]
  - - [768, 320, 1, 1024]
    - [65, 0.0]
  - - [832, 320, 1, 1024]
    - [51, 0.0]
  - - [896, 320, 1, 1024]
    - [136, 0.0]
  - - [960, 320, 1, 1024]
    - [28, 0.0]
  - - [1024, 320, 1, 1024]
    - [29, 0.0]
  - - [64, 384, 1, 1024]
    - [147, 0.0]
  - - [128, 384, 1, 1024]
    - [51, 0.0]
  - - [192, 384, 1, 1024]
    - [29, 0.0]
  - - [256, 384, 1, 1024]
    - [41, 0.0]
  - - [320, 384, 1, 1024]
    - [51, 0.0]
  - - [384, 384, 1, 1024]
    - [51, 0.0]
  - - [448, 384, 1, 1024]
    - [51, 0.0]
  - - [512, 384, 1, 1024]
    - [136, 0.0]
  - - [576, 384, 1, 1024]
    - [113, 0.0]
  - - [640, 384, 1, 1024]
    - [180, 0.0]
  - - [704, 384, 1, 1024]
    - [194, 0.0]
  - - [768, 384, 1, 1024]
    - [40, 0.0]
  - - [832, 384, 1, 1024]
    - [36, 0.0]
  - - [896, 384, 1, 1024]
    - [51, 0.0]
  - - [960, 384, 1, 1024]
    - [106, 0.0]
  - - [1024, 384, 1, 1024]
    - [133, 0.0]
  - - [64, 448, 1, 1024]
    - [183, 0.0]
  - - [128, 448, 1, 1024]
    - [29, 0.0]
  - - [192, 448, 1, 1024]
    - [159, 0.0]
  - - [256, 448, 1, 1024]
    - [29, 0.0]
  - - [320, 448, 1, 1024]
    - [31, 0.0]
  - - [384, 448, 1, 1024]
    - [51, 0.0]
  - - [448, 448, 1, 1024]
    - [29, 0.0]
  - - [512, 448, 1, 1024]
    - [173, 0.0]
  - - [576, 448, 1, 1024]
    - [194, 0.0]
  - - [640, 448, 1, 1024]
    - [137, 0.0]
  - - [704, 448, 1, 1024]
    - [51, 0.0]
  - - [768, 448, 1, 1024]
    - [36, 0.0]
  - - [832, 448, 1, 1024]
    - [136, 0.0]
  - - [896, 448, 1, 1024]
    - [51, 0.0]
  - - [960, 448, 1, 1024]
    - [51, 0.0]
  - - [1024, 448, 1, 1024]
    - [51, 0.0]
  - - [64, 512, 1, 1024]
    - [141, 0.0]
  - - [128, 512, 1, 1024]
    - [51, 0.0]
  - - [192, 512, 1, 1024]
    - [136, 0.0]
  - - [256, 512, 1, 1024]
    - [136, 0.0]
  - - [320, 512, 1, 1024]
    - [29, 0.0]
  - - [384, 512, 1, 1024]
    - [136, 0.0]
  - - [448, 512, 1, 1024]
    - [75, 0.0]
  - - [576, 512, 1, 1024]
    - [137, 0.0]
  - - [640, 512, 1, 1024]
    - [29, 0.0]
  - - [704, 512, 1, 1024]
    - [51, 0.0]
  - - [768, 512, 1, 1024]
    - [163, 0.0]
  - - [832, 512, 1, 1024]
    - [29, 0.0]
  - - [896, 512, 1, 1024]
    - [178, 0.0]
  - - [960, 512, 1, 1024]
    - [36, 0.0]
  - - [64, 576, 1, 1024]
    - [29, 0.0]
  - - [128, 576, 1, 1024]
    - [51, 0.0]
  - - [192, 576, 1, 1024]
    - [44, 0.0]
  - - [256, 576, 1, 1024]
    - [51, 0.0]
  - - [320, 576, 1, 1024]
    - [51, 0.0]
  - - [384, 576, 1, 1024]
    - [88, 0.0]
  - - [448, 576, 1, 1024]
    - [195, 0.0]
  - - [512, 576, 1, 1024]
    - [88, 0.0]
  - - [576, 576, 1, 1024]
    - [136, 0.0]
  - - [640, 576, 1, 1024]
    - [136, 0.0]
  - - [704, 576, 1, 1024]
    - [136, 0.0]
  - - [768, 576, 1, 1024]
    - [136, 0.0]
  - - [832, 576, 1, 1024]
    - [51, 0.0]
  - - [896, 576, 1, 1024]
    - [51, 0.0]
  - - [960, 576, 1, 1024]
    - [29, 0.0]
  - - [1024, 576, 1, 1024]
    - [136, 0.0]
  - - [64, 640, 1, 1024]
    - [29, 0.0]
  - - [128, 640, 1, 1024]
    - [136, 0.0]
  - - [192, 640, 1, 1024]
    - [36, 0.0]
  - - [256, 640, 1, 1024]
    - [136, 0.0]
  - - [320, 640, 1, 1024]
    - [49, 0.0]
  - - [384, 640, 1, 1024]
    - [125, 0.0]
  - - [448, 640, 1, 1024]
    - [194, 0.0]
  - - [512, 640, 1, 1024]
    - [28, 0.0]
  - - [576, 640, 1, 1024]
    - [83, 0.0]
  - - [640, 640, 1, 1024]
    - [88, 0.0]
  - - [704, 640, 1, 1024]
    - [29, 0.0]
  - - [768, 640, 1, 1024]
    - [167, 0.0]
  - - [832, 640, 1, 1024]
    - [136, 0.0]
  - - [896, 640, 1, 1024]
    - [36, 0.0]
  - - [960, 640, 1, 1024]
    - [71, 0.0]
  - - [1024, 640, 1, 1024]
    - [104, 0.0]
  - - [64, 704, 1, 1024]
    - [29, 0.0]
  - - [128, 704, 1, 1024]
    - [196, 0.0]
  - - [192, 704, 1, 1024]
    - [44, 0.0]
  - - [256, 704, 1, 1024]
    - [197, 0.0]
  - - [320, 704, 1, 1024]
    - [51, 0.0]
  - - [384, 704, 1, 1024]
    - [65, 0.0]
  - - [448, 704, 1, 1024]
    - [136, 0.0]
  - - [512, 704, 1, 1024]
    - [121, 0.0]
  - - [576, 704, 1, 1024]
    - [51, 0.0]
  - - [640, 704, 1, 1024]
    - [198, 0.0]
  - - [704, 704, 1, 1024]
    - [51, 0.0]
  - - [768, 704, 1, 1024]
    - [51, 0.0]
  - - [832, 704, 1, 1024]
    - [36, 0.0]
  - - [896, 704, 1, 1024]
    - [51, 0.0]
  - - [960, 704, 1, 1024]
    - [29, 0.0]
  - - [1024, 704, 1, 1024]
    - [114, 0.0]
  - - [64, 768, 1, 1024]
    - [36, 0.0]
  - - [128, 768, 1, 1024]
    - [51, 0.0]
  - - [192, 768, 1, 1024]
    - [159, 0.0]
  - - [256, 768, 1, 1024]
    - [36, 0.0]
  - - [320, 768, 1, 1024]
    - [199, 0.0]
  - - [384, 768, 1, 1024]
    - [28, 0.0]
  - - [448, 768, 1, 1024]
    - [51, 0.0]
  - - [512, 768, 1, 1024]
    - [133, 0.0]
  - - [576, 768, 1, 1024]
    - [51, 0.0]
  - - [640, 768, 1, 1024]
    - [133, 0.0]
  - - [704, 768, 1, 1024]
    - [136, 0.0]
  - - [768, 768, 1, 1024]
    - [51, 0.0]
  - - [832, 768, 1, 1024]
    - [29, 0.0]
  - - [896, 768, 1, 1024]
    - [88, 0.0]
  - - [960, 768, 1, 1024]
    - [29, 0.0]
  - - [1024, 768, 1, 1024]
    - [167, 0.0]
  - - [64, 832, 1, 1024]
    - [36, 0.0]
  - - [128, 832, 1, 1024]
    - [36, 0.0]
  - - [192, 832, 1, 1024]
    - [44, 0.0]
  - - [256, 832, 1, 1024]
    - [51, 0.0]
  - - [320, 832, 1, 1024]
    - [28, 0.0]
  - - [384, 832, 1, 1024]
    - [75, 0.0]
  - - [448, 832, 1, 1024]
    - [36, 0.0]
  - - [512, 832, 1, 1024]
    - [29, 0.0]
  - - [576, 832, 1, 1024]
    - [136, 0.0]
  - - [640, 832, 1, 1024]
    - [136, 0.0]
  - - [704, 832, 1, 1024]
    - [51, 0.0]
  - - [768, 832, 1, 1024]
    - [36, 0.0]
  - - [832, 832, 1, 1024]
    - [51, 0.0]
  - - [896, 832, 1, 1024]
    - [51, 0.0]
  - - [960, 832, 1, 1024]
    - [136, 0.0]
  - - [1024, 832, 1, 1024]
    - [125, 0.0]
  - - [64, 896, 1, 1024]
    - [154, 0.0]
  - - [128, 896, 1, 1024]
    - [29, 0.0]
  - - [192, 896, 1, 1024]
    - [51, 0.0]
  - - [256, 896, 1, 1024]
    - [88, 0.0]
  - - [320, 896, 1, 1024]
    - [29, 0.0]
  - - [384, 896, 1, 1024]
    - [51, 0.0]
  - - [448, 896, 1, 1024]
    - [136, 0.0]
  - - [512, 896, 1, 1024]
    - [125, 0.0]
  - - [576, 896, 1, 1024]
    - [136, 0.0]
  - - [640, 896, 1, 1024]
    - [29, 0.0]
  - - [704, 896, 1, 1024]
    - [51, 0.0]
  - - [768, 896, 1, 1024]
    - [164, 0.0]
  - - [832, 896, 1, 1024]
    - [29, 0.0]
  - - [896, 896, 1, 1024]
    - [88, 0.0]
  - - [960, 896, 1, 1024]
    - [31, 0.0]
  - - [1024, 896, 1, 1024]
    - [200, 0.0]
  - - [64, 960, 1, 1024]
    - [29, 0.0]
  - - [128, 960, 1, 1024]
    - [29, 0.0]
  - - [192, 960, 1, 1024]
    - [36, 0.0]
  - - [256, 960, 1, 1024]
    - [175, 0.0]
  - - [320, 960, 1, 1024]
    - [51, 0.0]
  - - [384, 960, 1, 1024]
    - [29, 0.0]
  - - [448, 960, 1, 1024]
    - [51, 0.0]
  - - [512, 960, 1, 1024]
    - [51, 0.0]
  - - [576, 960, 1, 1024]
    - [136, 0.0]
  - - [640, 960, 1, 1024]
    - [51, 0.0]
  - - [704, 960, 1, 1024]
    - [136, 0.0]
  - - [768, 960, 1, 1024]
    - [88, 0.0]
  - - [832, 960, 1, 1024]
    - [51, 0.0]
  - - [896, 960, 1, 1024]
    - [51, 0.0]
  - - [960, 960, 1, 1024]
    - [49, 0.0]
  - - [1024, 960, 1, 1024]
    - [88, 0.0]
  - - [64, 1024, 1, 1024]
    - [60, 0.0]
  - - [128, 1024, 1, 1024]
    - [60, 0.0]
  - - [192, 1024, 1, 1024]
    - [136, 0.0]
  - - [256, 1024, 1, 1024]
    - [180, 0.0]
  - - [320, 1024, 1, 1024]
    - [83, 0.0]
  - - [384, 1024, 1, 1024]
    - [133, 0.0]
  - - [448, 1024, 1, 1024]
    - [29, 0.0]
  - - [576, 1024, 1, 1024]
    - [136, 0.0]
  - - [640, 1024, 1, 1024]
    - [88, 0.0]
  - - [704, 1024, 1, 1024]
    - [51, 0.0]
  - - [768, 1024, 1, 1024]
    - [139, 0.0]
  - - [832, 1024, 1, 1024]
    - [159, 0.0]
  - - [896, 1024, 1, 1024]
    - [88, 0.0]
  - - [960, 1024, 1, 1024]
    - [202, 0.0]
  - - [128, 64, 1, 2048]
    - [147, 0.0]
  - - [192, 64, 1, 2048]
    - [144, 0.0]
  - - [256, 64, 1, 2048]
    - [143, 0.0]
  - - [320, 64, 1, 2048]
    - [144, 0.0]
  - - [384, 64, 1, 2048]
    - [184, 0.0]
  - - [448, 64, 1, 2048]
    - [143, 0.0]
  - - [512, 64, 1, 2048]
    - [42, 0.0]
  - - [576, 64, 1, 2048]
    - [42, 0.0]
  - - [640, 64, 1, 2048]
    - [144, 0.0]
  - - [704, 64, 1, 2048]
    - [144, 0.0]
  - - [768, 64, 1, 2048]
    - [153, 0.0]
  - - [832, 64, 1, 2048]
    - [29, 0.0]
  - - [896, 64, 1, 2048]
    - [29, 0.0]
  - - [960, 64, 1, 2048]
    - [153, 0.0]
  - - [1024, 64, 1, 2048]
    - [149, 0.0]
  - - [64, 128, 1, 2048]
    - [143, 0.0]
  - - [128, 128, 1, 2048]
    - [141, 0.0]
  - - [192, 128, 1, 2048]
    - [149, 0.0]
  - - [256, 128, 1, 2048]
    - [149, 0.0]
  - - [320, 128, 1, 2048]
    - [42, 0.0]
  - - [384, 128, 1, 2048]
    - [29, 0.0]
  - - [448, 128, 1, 2048]
    - [154, 0.0]
  - - [512, 128, 1, 2048]
    - [29, 0.0]
  - - [576, 128, 1, 2048]
    - [60, 0.0]
  - - [640, 128, 1, 2048]
    - [60, 0.0]
  - - [704, 128, 1, 2048]
    - [29, 0.0]
  - - [768, 128, 1, 2048]
    - [29, 0.0]
  - - [832, 128, 1, 2048]
    - [29, 0.0]
  - - [896, 128, 1, 2048]
    - [29, 0.0]
  - - [960, 128, 1, 2048]
    - [36, 0.0]
  - - [1024, 128, 1, 2048]
    - [51, 0.0]
  - - [64, 192, 1, 2048]
    - [144, 0.0]
  - - [128, 192, 1, 2048]
    - [144, 0.0]
  - - [192, 192, 1, 2048]
    - [29, 0.0]
  - - [256, 192, 1, 2048]
    - [36, 0.0]
  - - [320, 192, 1, 2048]
    - [29, 0.0]
  - - [384, 192, 1, 2048]
    - [51, 0.0]
  - - [448, 192, 1, 2048]
    - [51, 0.0]
  - - [512, 192, 1, 2048]
    - [36, 0.0]
  - - [576, 192, 1, 2048]
    - [29, 0.0]
  - - [640, 192, 1, 2048]
    - [29, 0.0]
  - - [704, 192, 1, 2048]
    - [136, 0.0]
  - - [768, 192, 1, 2048]
    - [136, 0.0]
  - - [832, 192, 1, 2048]
    - [51, 0.0]
  - - [896, 192, 1, 2048]
    - [136, 0.0]
  - - [960, 192, 1, 2048]
    - [136, 0.0]
  - - [1024, 192, 1, 2048]
    - [44, 0.0]
  - - [64, 256, 1, 2048]
    - [141, 0.0]
  - - [128, 256, 1, 2048]
    - [151, 0.0]
  - - [192, 256, 1, 2048]
    - [29, 0.0]
  - - [256, 256, 1, 2048]
    - [29, 0.0]
  - - [320, 256, 1, 2048]
    - [136, 0.0]
  - - [384, 256, 1, 2048]
    - [36, 0.0]
  - - [448, 256, 1, 2048]
    - [29, 0.0]
  - - [512, 256, 1, 2048]
    - [51, 0.0]
  - - [576, 256, 1, 2048]
    - [44, 0.0]
  - - [640, 256, 1, 2048]
    - [51, 0.0]
  - - [704, 256, 1, 2048]
    - [36, 0.0]
  - - [768, 256, 1, 2048]
    - [136, 0.0]
  - - [832, 256, 1, 2048]
    - [159, 0.0]
  - - [896, 256, 1, 2048]
    - [125, 0.0]
  - - [960, 256, 1, 2048]
    - [49, 0.0]
  - - [1024, 256, 1, 2048]
    - [175, 0.0]
  - - [64, 320, 1, 2048]
    - [144, 0.0]
  - - [128, 320, 1, 2048]
    - [29, 0.0]
  - - [192, 320, 1, 2048]
    - [29, 0.0]
  - - [256, 320, 1, 2048]
    - [29, 0.0]
  - - [320, 320, 1, 2048]
    - [36, 0.0]
  - - [384, 320, 1, 2048]
    - [29, 0.0]
  - - [448, 320, 1, 2048]
    - [29, 0.0]
  - - [512, 320, 1, 2048]
    - [51, 0.0]
  - - [576, 320, 1, 2048]
    - [159, 0.0]
  - - [640, 320, 1, 2048]
    - [49, 0.0]
  - - [704, 320, 1, 2048]
    - [49, 0.0]
  - - [768, 320, 1, 2048]
    - [51, 0.0]
  - - [832, 320, 1, 2048]
    - [136, 0.0]
  - - [896, 320, 1, 2048]
    - [31, 0.0]
  - - [960, 320, 1, 2048]
    - [51, 0.0]
  - - [1024, 320, 1, 2048]
    - [36, 0.0]
  - - [64, 384, 1, 2048]
    - [151, 0.0]
  - - [128, 384, 1, 2048]
    - [36, 0.0]
  - - [192, 384, 1, 2048]
    - [36, 0.0]
  - - [256, 384, 1, 2048]
    - [136, 0.0]
  - - [320, 384, 1, 2048]
    - [136, 0.0]
  - - [384, 384, 1, 2048]
    - [29, 0.0]
  - - [448, 384, 1, 2048]
    - [136, 0.0]
  - - [512, 384, 1, 2048]
    - [125, 0.0]
  - - [576, 384, 1, 2048]
    - [29, 0.0]
  - - [640, 384, 1, 2048]
    - [175, 0.0]
  - - [704, 384, 1, 2048]
    - [136, 0.0]
  - - [768, 384, 1, 2048]
    - [136, 0.0]
  - - [832, 384, 1, 2048]
    - [36, 0.0]
  - - [896, 384, 1, 2048]
    - [88, 0.0]
  - - [960, 384, 1, 2048]
    - [106, 0.0]
  - - [1024, 384, 1, 2048]
    - [180, 0.0]
  - - [64, 448, 1, 2048]
    - [151, 0.0]
  - - [128, 448, 1, 2048]
    - [29, 0.0]
  - - [192, 448, 1, 2048]
    - [154, 0.0]
  - - [256, 448, 1, 2048]
    - [29, 0.0]
  - - [320, 448, 1, 2048]
    - [51, 0.0]
  - - [384, 448, 1, 2048]
    - [36, 0.0]
  - - [448, 448, 1, 2048]
    - [29, 0.0]
  - - [512, 448, 1, 2048]
    - [88, 0.0]
  - - [576, 448, 1, 2048]
    - [59, 0.0]
  - - [640, 448, 1, 2048]
    - [36, 0.0]
  - - [704, 448, 1, 2048]
    - [76, 0.0]
  - - [768, 448, 1, 2048]
    - [203, 0.0]
  - - [832, 448, 1, 2048]
    - [204, 0.0]
  - - [896, 448, 1, 2048]
    - [29, 0.0]
  - - [960, 448, 1, 2048]
    - [36, 0.0]
  - - [1024, 448, 1, 2048]
    - [205, 0.0]
  - - [64, 512, 1, 2048]
    - [141, 0.0]
  - - [128, 512, 1, 2048]
    - [36, 0.0]
  - - [192, 512, 1, 2048]
    - [29, 0.0]
  - - [256, 512, 1, 2048]
    - [29, 0.0]
  - - [320, 512, 1, 2048]
    - [44, 0.0]
  - - [384, 512, 1, 2048]
    - [125, 0.0]
  - - [448, 512, 1, 2048]
    - [31, 0.0]
  - - [576, 512, 1, 2048]
    - [49, 0.0]
  - - [640, 512, 1, 2048]
    - [28, 0.0]
  - - [704, 512, 1, 2048]
    - [136, 0.0]
  - - [768, 512, 1, 2048]
    - [206, 0.0]
  - - [832, 512, 1, 2048]
    - [29, 0.0]
  - - [896, 512, 1, 2048]
    - [125, 0.0]
  - - [960, 512, 1, 2048]
    - [136, 0.0]
  - - [64, 576, 1, 2048]
    - [29, 0.0]
  - - [128, 576, 1, 2048]
    - [51, 0.0]
  - - [192, 576, 1, 2048]
    - [29, 0.0]
  - - [256, 576, 1, 2048]
    - [136, 0.0]
  - - [320, 576, 1, 2048]
    - [136, 0.0]
  - - [384, 576, 1, 2048]
    - [125, 0.0]
  - - [448, 576, 1, 2048]
    - [31, 0.0]
  - - [512, 576, 1, 2048]
    - [28, 0.0]
  - - [576, 576, 1, 2048]
    - [51, 0.0]
  - - [640, 576, 1, 2048]
    - [36, 0.0]
  - - [704, 576, 1, 2048]
    - [51, 0.0]
  - - [768, 576, 1, 2048]
    - [200, 0.0]
  - - [832, 576, 1, 2048]
    - [29, 0.0]
  - - [896, 576, 1, 2048]
    - [29, 0.0]
  - - [960, 576, 1, 2048]
    - [136, 0.0]
  - - [1024, 576, 1, 2048]
    - [136, 0.0]
  - - [64, 640, 1, 2048]
    - [36, 0.0]
  - - [128, 640, 1, 2048]
    - [51, 0.0]
  - - [192, 640, 1, 2048]
    - [29, 0.0]
  - - [256, 640, 1, 2048]
    - [44, 0.0]
  - - [320, 640, 1, 2048]
    - [49, 0.0]
  - - [384, 640, 1, 2048]
    - [175, 0.0]
  - - [448, 640, 1, 2048]
    - [75, 0.0]
  - - [512, 640, 1, 2048]
    - [75, 0.0]
  - - [576, 640, 1, 2048]
    - [106, 0.0]
  - - [640, 640, 1, 2048]
    - [29, 0.0]
  - - [704, 640, 1, 2048]
    - [29, 0.0]
  - - [768, 640, 1, 2048]
    - [113, 0.0]
  - - [832, 640, 1, 2048]
    - [29, 0.0]
  - - [896, 640, 1, 2048]
    - [136, 0.0]
  - - [960, 640, 1, 2048]
    - [159, 0.0]
  - - [1024, 640, 1, 2048]
    - [29, 0.0]
  - - [64, 704, 1, 2048]
    - [36, 0.0]
  - - [128, 704, 1, 2048]
    - [36, 0.0]
  - - [192, 704, 1, 2048]
    - [136, 0.0]
  - - [256, 704, 1, 2048]
    - [44, 0.0]
  - - [320, 704, 1, 2048]
    - [31, 0.0]
  - - [384, 704, 1, 2048]
    - [28, 0.0]
  - - [448, 704, 1, 2048]
    - [75, 0.0]
  - - [512, 704, 1, 2048]
    - [29, 0.0]
  - - [576, 704, 1, 2048]
    - [136, 0.0]
  - - [640, 704, 1, 2048]
    - [58, 0.0]
  - - [704, 704, 1, 2048]
    - [29, 0.0]
  - - [768, 704, 1, 2048]
    - [29, 0.0]
  - - [832, 704, 1, 2048]
    - [136, 0.0]
  - - [896, 704, 1, 2048]
    - [207, 0.0]
  - - [960, 704, 1, 2048]
    - [49, 0.0]
  - - [1024, 704, 1, 2048]
    - [180, 0.0]
  - - [64, 768, 1, 2048]
    - [29, 0.0]
  - - [128, 768, 1, 2048]
    - [51, 0.0]
  - - [192, 768, 1, 2048]
    - [51, 0.0]
  - - [256, 768, 1, 2048]
    - [175, 0.0]
  - - [320, 768, 1, 2048]
    - [31, 0.0]
  - - [384, 768, 1, 2048]
    - [29, 0.0]
  - - [448, 768, 1, 2048]
    - [36, 0.0]
  - - [512, 768, 1, 2048]
    - [137, 0.0]
  - - [576, 768, 1, 2048]
    - [137, 0.0]
  - - [640, 768, 1, 2048]
    - [163, 0.0]
  - - [704, 768, 1, 2048]
    - [36, 0.0]
  - - [768, 768, 1, 2048]
    - [88, 0.0]
  - - [832, 768, 1, 2048]
    - [136, 0.0]
  - - [896, 768, 1, 2048]
    - [108, 0.0]
  - - [960, 768, 1, 2048]
    - [49, 0.0]
  - - [1024, 768, 1, 2048]
    - [175, 0.0]
  - - [64, 832, 1, 2048]
    - [29, 0.0]
  - - [128, 832, 1, 2048]
    - [51, 0.0]
  - - [192, 832, 1, 2048]
    - [51, 0.0]
  - - [256, 832, 1, 2048]
    - [88, 0.0]
  - - [320, 832, 1, 2048]
    - [51, 0.0]
  - - [384, 832, 1, 2048]
    - [75, 0.0]
  - - [448, 832, 1, 2048]
    - [51, 0.0]
  - - [512, 832, 1, 2048]
    - [36, 0.0]
  - - [576, 832, 1, 2048]
    - [40, 0.0]
  - - [640, 832, 1, 2048]
    - [36, 0.0]
  - - [704, 832, 1, 2048]
    - [29, 0.0]
  - - [768, 832, 1, 2048]
    - [88, 0.0]
  - - [832, 832, 1, 2048]
    - [36, 0.0]
  - - [896, 832, 1, 2048]
    - [29, 0.0]
  - - [960, 832, 1, 2048]
    - [51, 0.0]
  - - [1024, 832, 1, 2048]
    - [88, 0.0]
  - - [64, 896, 1, 2048]
    - [29, 0.0]
  - - [128, 896, 1, 2048]
    - [29, 0.0]
  - - [192, 896, 1, 2048]
    - [136, 0.0]
  - - [256, 896, 1, 2048]
    - [175, 0.0]
  - - [320, 896, 1, 2048]
    - [51, 0.0]
  - - [384, 896, 1, 2048]
    - [83, 0.0]
  - - [448, 896, 1, 2048]
    - [136, 0.0]
  - - [512, 896, 1, 2048]
    - [88, 0.0]
  - - [576, 896, 1, 2048]
    - [36, 0.0]
  - - [640, 896, 1, 2048]
    - [108, 0.0]
  - - [704, 896, 1, 2048]
    - [136, 0.0]
  - - [768, 896, 1, 2048]
    - [29, 0.0]
  - - [832, 896, 1, 2048]
    - [29, 0.0]
  - - [896, 896, 1, 2048]
    - [36, 0.0]
  - - [960, 896, 1, 2048]
    - [44, 0.0]
  - - [1024, 896, 1, 2048]
    - [180, 0.0]
  - - [64, 960, 1, 2048]
    - [29, 0.0]
  - - [128, 960, 1, 2048]
    - [136, 0.0]
  - - [192, 960, 1, 2048]
    - [49, 0.0]
  - - [256, 960, 1, 2048]
    - [180, 0.0]
  - - [320, 960, 1, 2048]
    - [136, 0.0]
  - - [384, 960, 1, 2048]
    - [51, 0.0]
  - - [448, 960, 1, 2048]
    - [36, 0.0]
  - - [512, 960, 1, 2048]
    - [58, 0.0]
  - - [576, 960, 1, 2048]
    - [159, 0.0]
  - - [640, 960, 1, 2048]
    - [29, 0.0]
  - - [704, 960, 1, 2048]
    - [29, 0.0]
  - - [768, 960, 1, 2048]
    - [208, 0.0]
  - - [832, 960, 1, 2048]
    - [51, 0.0]
  - - [896, 960, 1, 2048]
    - [159, 0.0]
  - - [960, 960, 1, 2048]
    - [159, 0.0]
  - - [1024, 960, 1, 2048]
    - [51, 0.0]
  - - [64, 1024, 1, 2048]
    - [29, 0.0]
  - - [128, 1024, 1, 2048]
    - [60, 0.0]
  - - [192, 1024, 1, 2048]
    - [136, 0.0]
  - - [256, 1024, 1, 2048]
    - [88, 0.0]
  - - [320, 1024, 1, 2048]
    - [209, 0.0]
  - - [384, 1024, 1, 2048]
    - [54, 0.0]
  - - [448, 1024, 1, 2048]
    - [29, 0.0]
  - - [576, 1024, 1, 2048]
    - [29, 0.0]
  - - [640, 1024, 1, 2048]
    - [210, 0.0]
  - - [704, 1024, 1, 2048]
    - [211, 0.0]
  - - [768, 1024, 1, 2048]
    - [180, 0.0]
  - - [832, 1024, 1, 2048]
    - [72, 0.0]
  - - [896, 1024, 1, 2048]
    - [88, 0.0]
  - - [960, 1024, 1, 2048]
    - [29, 0.0]
  - - [128, 64, 1, 4096]
    - [143, 0.0]
  - - [192, 64, 1, 4096]
    - [143, 0.0]
  - - [256, 64, 1, 4096]
    - [143, 0.0]
  - - [320, 64, 1, 4096]
    - [143, 0.0]
  - - [384, 64, 1, 4096]
    - [147, 0.0]
  - - [448, 64, 1, 4096]
    - [144, 0.0]
  - - [512, 64, 1, 4096]
    - [151, 0.0]
  - - [576, 64, 1, 4096]
    - [151, 0.0]
  - - [640, 64, 1, 4096]
    - [144, 0.0]
  - - [704, 64, 1, 4096]
    - [143, 0.0]
  - - [768, 64, 1, 4096]
    - [144, 0.0]
  - - [832, 64, 1, 4096]
    - [42, 0.0]
  - - [896, 64, 1, 4096]
    - [173, 0.0]
  - - [960, 64, 1, 4096]
    - [212, 0.0]
  - - [1024, 64, 1, 4096]
    - [173, 0.0]
  - - [64, 128, 1, 4096]
    - [113, 0.0]
  - - [128, 128, 1, 4096]
    - [143, 0.0]
  - - [192, 128, 1, 4096]
    - [202, 0.0]
  - - [256, 128, 1, 4096]
    - [153, 0.0]
  - - [320, 128, 1, 4096]
    - [36, 0.0]
  - - [384, 128, 1, 4096]
    - [29, 0.0]
  - - [448, 128, 1, 4096]
    - [173, 0.0]
  - - [512, 128, 1, 4096]
    - [212, 0.0]
  - - [576, 128, 1, 4096]
    - [36, 0.0]
  - - [640, 128, 1, 4096]
    - [29, 0.0]
  - - [704, 128, 1, 4096]
    - [60, 0.0]
  - - [768, 128, 1, 4096]
    - [29, 0.0]
  - - [832, 128, 1, 4096]
    - [154, 0.0]
  - - [896, 128, 1, 4096]
    - [136, 0.0]
  - - [960, 128, 1, 4096]
    - [51, 0.0]
  - - [1024, 128, 1, 4096]
    - [51, 0.0]
  - - [64, 192, 1, 4096]
    - [141, 0.0]
  - - [128, 192, 1, 4096]
    - [144, 0.0]
  - - [192, 192, 1, 4096]
    - [29, 0.0]
  - - [256, 192, 1, 4096]
    - [36, 0.0]
  - - [320, 192, 1, 4096]
    - [29, 0.0]
  - - [384, 192, 1, 4096]
    - [36, 0.0]
  - - [448, 192, 1, 4096]
    - [36, 0.0]
  - - [512, 192, 1, 4096]
    - [29, 0.0]
  - - [576, 192, 1, 4096]
    - [51, 0.0]
  - - [640, 192, 1, 4096]
    - [36, 0.0]
  - - [704, 192, 1, 4096]
    - [36, 0.0]
  - - [768, 192, 1, 4096]
    - [51, 0.0]
  - - [832, 192, 1, 4096]
    - [29, 0.0]
  - - [896, 192, 1, 4096]
    - [136, 0.0]
  - - [960, 192, 1, 4096]
    - [136, 0.0]
  - - [1024, 192, 1, 4096]
    - [29, 0.0]
  - - [64, 256, 1, 4096]
    - [183, 0.0]
  - - [128, 256, 1, 4096]
    - [147, 0.0]
  - - [192, 256, 1, 4096]
    - [36, 0.0]
  - - [256, 256, 1, 4096]
    - [36, 0.0]
  - - [320, 256, 1, 4096]
    - [29, 0.0]
  - - [384, 256, 1, 4096]
    - [29, 0.0]
  - - [448, 256, 1, 4096]
    - [36, 0.0]
  - - [512, 256, 1, 4096]
    - [29, 0.0]
  - - [576, 256, 1, 4096]
    - [51, 0.0]
  - - [640, 256, 1, 4096]
    - [51, 0.0]
  - - [704, 256, 1, 4096]
    - [29, 0.0]
  - - [768, 256, 1, 4096]
    - [56, 0.0]
  - - [832, 256, 1, 4096]
    - [51, 0.0]
  - - [896, 256, 1, 4096]
    - [56, 0.0]
  - - [960, 256, 1, 4096]
    - [40, 0.0]
  - - [1024, 256, 1, 4096]
    - [29, 0.0]
  - - [64, 320, 1, 4096]
    - [183, 0.0]
  - - [128, 320, 1, 4096]
    - [29, 0.0]
  - - [192, 320, 1, 4096]
    - [29, 0.0]
  - - [256, 320, 1, 4096]
    - [29, 0.0]
  - - [320, 320, 1, 4096]
    - [36, 0.0]
  - - [384, 320, 1, 4096]
    - [51, 0.0]
  - - [448, 320, 1, 4096]
    - [36, 0.0]
  - - [512, 320, 1, 4096]
    - [29, 0.0]
  - - [576, 320, 1, 4096]
    - [136, 0.0]
  - - [640, 320, 1, 4096]
    - [51, 0.0]
  - - [704, 320, 1, 4096]
    - [51, 0.0]
  - - [768, 320, 1, 4096]
    - [51, 0.0]
  - - [832, 320, 1, 4096]
    - [29, 0.0]
  - - [896, 320, 1, 4096]
    - [51, 0.0]
  - - [960, 320, 1, 4096]
    - [136, 0.0]
  - - [1024, 320, 1, 4096]
    - [213, 0.0]
  - - [64, 384, 1, 4096]
    - [143, 0.0]
  - - [128, 384, 1, 4096]
    - [125, 0.0]
  - - [192, 384, 1, 4096]
    - [36, 0.0]
  - - [256, 384, 1, 4096]
    - [29, 0.0]
  - - [320, 384, 1, 4096]
    - [51, 0.0]
  - - [384, 384, 1, 4096]
    - [29, 0.0]
  - - [448, 384, 1, 4096]
    - [36, 0.0]
  - - [512, 384, 1, 4096]
    - [51, 0.0]
  - - [576, 384, 1, 4096]
    - [29, 0.0]
  - - [640, 384, 1, 4096]
    - [58, 0.0]
  - - [704, 384, 1, 4096]
    - [31, 0.0]
  - - [768, 384, 1, 4096]
    - [213, 0.0]
  - - [832, 384, 1, 4096]
    - [49, 0.0]
  - - [896, 384, 1, 4096]
    - [88, 0.0]
  - - [960, 384, 1, 4096]
    - [106, 0.0]
  - - [1024, 384, 1, 4096]
    - [180, 0.0]
  - - [64, 448, 1, 4096]
    - [29, 0.0]
  - - [128, 448, 1, 4096]
    - [29, 0.0]
  - - [192, 448, 1, 4096]
    - [36, 0.0]
  - - [256, 448, 1, 4096]
    - [29, 0.0]
  - - [320, 448, 1, 4096]
    - [51, 0.0]
  - - [384, 448, 1, 4096]
    - [51, 0.0]
  - - [448, 448, 1, 4096]
    - [36, 0.0]
  - - [512, 448, 1, 4096]
    - [76, 0.0]
  - - [576, 448, 1, 4096]
    - [51, 0.0]
  - - [640, 448, 1, 4096]
    - [136, 0.0]
  - - [704, 448, 1, 4096]
    - [36, 0.0]
  - - [768, 448, 1, 4096]
    - [72, 0.0]
  - - [832, 448, 1, 4096]
    - [94, 0.0]
  - - [896, 448, 1, 4096]
    - [72, 0.0]
  - - [960, 448, 1, 4096]
    - [51, 0.0]
  - - [1024, 448, 1, 4096]
    - [136, 0.0]
  - - [64, 512, 1, 4096]
    - [147, 0.0]
  - - [128, 512, 1, 4096]
    - [29, 0.0]
  - - [192, 512, 1, 4096]
    - [29, 0.0]
  - - [256, 512, 1, 4096]
    - [29, 0.0]
  - - [320, 512, 1, 4096]
    - [51, 0.0]
  - - [384, 512, 1, 4096]
    - [44, 0.0]
  - - [448, 512, 1, 4096]
    - [44, 0.0]
  - - [512, 512, 1, 4096]
    - [214, 0.0]
  - - [576, 512, 1, 4096]
    - [49, 0.0]
  - - [640, 512, 1, 4096]
    - [57, 0.0]
  - - [704, 512, 1, 4096]
    - [137, 0.0]
  - - [768, 512, 1, 4096]
    - [187, 0.0]
  - - [832, 512, 1, 4096]
    - [51, 0.0]
  - - [896, 512, 1, 4096]
    - [88, 0.0]
  - - [960, 512, 1, 4096]
    - [51, 0.0]
  - - [1024, 512, 1, 4096]
    - [88, 0.0]
  - - [64, 576, 1, 4096]
    - [215, 0.0]
  - - [128, 576, 1, 4096]
    - [36, 0.0]
  - - [192, 576, 1, 4096]
    - [136, 0.0]
  - - [256, 576, 1, 4096]
    - [136, 0.0]
  - - [320, 576, 1, 4096]
    - [159, 0.0]
  - - [384, 576, 1, 4096]
    - [137, 0.0]
  - - [448, 576, 1, 4096]
    - [31, 0.0]
  - - [512, 576, 1, 4096]
    - [60, 0.0]
  - - [576, 576, 1, 4096]
    - [49, 0.0]
  - - [640, 576, 1, 4096]
    - [180, 0.0]
  - - [704, 576, 1, 4096]
    - [136, 0.0]
  - - [768, 576, 1, 4096]
    - [88, 0.0]
  - - [832, 576, 1, 4096]
    - [29, 0.0]
  - - [896, 576, 1, 4096]
    - [113, 0.0]
  - - [960, 576, 1, 4096]
    - [72, 0.0]
  - - [1024, 576, 1, 4096]
    - [136, 0.0]
  - - [64, 640, 1, 4096]
    - [202, 0.0]
  - - [128, 640, 1, 4096]
    - [36, 0.0]
  - - [192, 640, 1, 4096]
    - [51, 0.0]
  - - [256, 640, 1, 4096]
    - [51, 0.0]
  - - [320, 640, 1, 4096]
    - [31, 0.0]
  - - [384, 640, 1, 4096]
    - [36, 0.0]
  - - [448, 640, 1, 4096]
    - [49, 0.0]
  - - [512, 640, 1, 4096]
    - [172, 0.0]
  - - [576, 640, 1, 4096]
    - [137, 0.0]
  - - [640, 640, 1, 4096]
    - [88, 0.0]
  - - [704, 640, 1, 4096]
    - [36, 0.0]
  - - [768, 640, 1, 4096]
    - [180, 0.0]
  - - [832, 640, 1, 4096]
    - [36, 0.0]
  - - [896, 640, 1, 4096]
    - [136, 0.0]
  - - [960, 640, 1, 4096]
    - [29, 0.0]
  - - [1024, 640, 1, 4096]
    - [163, 0.0]
  - - [64, 704, 1, 4096]
    - [29, 0.0]
  - - [128, 704, 1, 4096]
    - [36, 0.0]
  - - [192, 704, 1, 4096]
    - [51, 0.0]
  - - [256, 704, 1, 4096]
    - [60, 0.0]
  - - [320, 704, 1, 4096]
    - [49, 0.0]
  - - [384, 704, 1, 4096]
    - [31, 0.0]
  - - [448, 704, 1, 4096]
    - [58, 0.0]
  - - [512, 704, 1, 4096]
    - [85, 0.0]
  - - [576, 704, 1, 4096]
    - [136, 0.0]
  - - [640, 704, 1, 4096]
    - [180, 0.0]
  - - [704, 704, 1, 4096]
    - [36, 0.0]
  - - [768, 704, 1, 4096]
    - [51, 0.0]
  - - [832, 704, 1, 4096]
    - [88, 0.0]
  - - [896, 704, 1, 4096]
    - [136, 0.0]
  - - [960, 704, 1, 4096]
    - [125, 0.0]
  - - [1024, 704, 1, 4096]
    - [175, 0.0]
  - - [64, 768, 1, 4096]
    - [36, 0.0]
  - - [128, 768, 1, 4096]
    - [29, 0.0]
  - - [192, 768, 1, 4096]
    - [36, 0.0]
  - - [256, 768, 1, 4096]
    - [175, 0.0]
  - - [320, 768, 1, 4096]
    - [49, 0.0]
  - - [384, 768, 1, 4096]
    - [51, 0.0]
  - - [448, 768, 1, 4096]
    - [51, 0.0]
  - - [512, 768, 1, 4096]
    - [180, 0.0]
  - - [576, 768, 1, 4096]
    - [51, 0.0]
  - - [640, 768, 1, 4096]
    - [180, 0.0]
  - - [704, 768, 1, 4096]
    - [172, 0.0]
  - - [768, 768, 1, 4096]
    - [29, 0.0]
  - - [832, 768, 1, 4096]
    - [172, 0.0]
  - - [896, 768, 1, 4096]
    - [88, 0.0]
  - - [960, 768, 1, 4096]
    - [125, 0.0]
  - - [1024, 768, 1, 4096]
    - [125, 0.0]
  - - [64, 832, 1, 4096]
    - [29, 0.0]
  - - [128, 832, 1, 4096]
    - [136, 0.0]
  - - [192, 832, 1, 4096]
    - [51, 0.0]
  - - [256, 832, 1, 4096]
    - [44, 0.0]
  - - [320, 832, 1, 4096]
    - [136, 0.0]
  - - [384, 832, 1, 4096]
    - [29, 0.0]
  - - [448, 832, 1, 4096]
    - [134, 0.0]
  - - [512, 832, 1, 4096]
    - [88, 0.0]
  - - [576, 832, 1, 4096]
    - [29, 0.0]
  - - [640, 832, 1, 4096]
    - [51, 0.0]
  - - [704, 832, 1, 4096]
    - [29, 0.0]
  - - [768, 832, 1, 4096]
    - [136, 0.0]
  - - [832, 832, 1, 4096]
    - [36, 0.0]
  - - [896, 832, 1, 4096]
    - [51, 0.0]
  - - [960, 832, 1, 4096]
    - [180, 0.0]
  - - [1024, 832, 1, 4096]
    - [29, 0.0]
  - - [64, 896, 1, 4096]
    - [36, 0.0]
  - - [128, 896, 1, 4096]
    - [29, 0.0]
  - - [192, 896, 1, 4096]
    - [36, 0.0]
  - - [256, 896, 1, 4096]
    - [125, 0.0]
  - - [320, 896, 1, 4096]
    - [31, 0.0]
  - - [384, 896, 1, 4096]
    - [29, 0.0]
  - - [448, 896, 1, 4096]
    - [29, 0.0]
  - - [512, 896, 1, 4096]
    - [88, 0.0]
  - - [576, 896, 1, 4096]
    - [29, 0.0]
  - - [640, 896, 1, 4096]
    - [88, 0.0]
  - - [704, 896, 1, 4096]
    - [88, 0.0]
  - - [768, 896, 1, 4096]
    - [180, 0.0]
  - - [832, 896, 1, 4096]
    - [29, 0.0]
  - - [896, 896, 1, 4096]
    - [136, 0.0]
  - - [960, 896, 1, 4096]
    - [36, 0.0]
  - - [1024, 896, 1, 4096]
    - [175, 0.0]
  - - [64, 960, 1, 4096]
    - [29, 0.0]
  - - [128, 960, 1, 4096]
    - [51, 0.0]
  - - [192, 960, 1, 4096]
    - [76, 0.0]
  - - [256, 960, 1, 4096]
    - [51, 0.0]
  - - [320, 960, 1, 4096]
    - [216, 0.0]
  - - [384, 960, 1, 4096]
    - [29, 0.0]
  - - [448, 960, 1, 4096]
    - [133, 0.0]
  - - [512, 960, 1, 4096]
    - [125, 0.0]
  - - [576, 960, 1, 4096]
    - [109, 0.0]
  - - [640, 960, 1, 4096]
    - [36, 0.0]
  - - [704, 960, 1, 4096]
    - [125, 0.0]
  - - [768, 960, 1, 4096]
    - [201, 0.0]
  - - [832, 960, 1, 4096]
    - [51, 0.0]
  - - [896, 960, 1, 4096]
    - [51, 0.0]
  - - [960, 960, 1, 4096]
    - [29, 0.0]
  - - [1024, 960, 1, 4096]
    - [136, 0.0]
  - - [64, 1024, 1, 4096]
    - [29, 0.0]
  - - [128, 1024, 1, 4096]
    - [154, 0.0]
  - - [192, 1024, 1, 4096]
    - [203, 0.0]
  - - [256, 1024, 1, 4096]
    - [191, 0.0]
  - - [320, 1024, 1, 4096]
    - [51, 0.0]
  - - [384, 1024, 1, 4096]
    - [205, 0.0]
  - - [448, 1024, 1, 4096]
    - [88, 0.0]
  - - [512, 1024, 1, 4096]
    - [200, 0.0]
  - - [576, 1024, 1, 4096]
    - [51, 0.0]
  - - [640, 1024, 1, 4096]
    - [191, 0.0]
  - - [704, 1024, 1, 4096]
    - [88, 0.0]
  - - [768, 1024, 1, 4096]
    - [88, 0.0]
  - - [832, 1024, 1, 4096]
    - [136, 0.0]
  - - [896, 1024, 1, 4096]
    - [175, 0.0]
  - - [960, 1024, 1, 4096]
    - [29, 0.0]
  - - [1024, 1024, 1, 4096]
    - [136, 0.0]
  - - [1088, 64, 1, 64]
    - [86, 0.0]
  - - [1216, 64, 1, 64]
    - [51, 0.0]
  - - [1344, 64, 1, 64]
    - [67, 0.0]
  - - [1472, 64, 1, 64]
    - [39, 0.0]
  - - [1600, 64, 1, 64]
    - [47, 0.0]
  - - [1728, 64, 1, 64]
    - [28, 0.0]
  - - [1856, 64, 1, 64]
    - [116, 0.0]
  - - [1984, 64, 1, 64]
    - [158, 0.0]
  - - [1088, 192, 1, 64]
    - [50, 0.0]
  - - [1216, 192, 1, 64]
    - [115, 0.0]
  - - [1344, 192, 1, 64]
    - [65, 0.0]
  - - [1472, 192, 1, 64]
    - [87, 0.0]
  - - [1600, 192, 1, 64]
    - [44, 0.0]
  - - [1728, 192, 1, 64]
    - [174, 0.0]
  - - [1856, 192, 1, 64]
    - [39, 0.0]
  - - [1984, 192, 1, 64]
    - [39, 0.0]
  - - [1088, 320, 1, 64]
    - [31, 0.0]
  - - [1216, 320, 1, 64]
    - [86, 0.0]
  - - [1344, 320, 1, 64]
    - [61, 0.0]
  - - [1472, 320, 1, 64]
    - [46, 0.0]
  - - [1600, 320, 1, 64]
    - [39, 0.0]
  - - [1728, 320, 1, 64]
    - [83, 0.0]
  - - [1856, 320, 1, 64]
    - [39, 0.0]
  - - [1984, 320, 1, 64]
    - [83, 0.0]
  - - [1088, 448, 1, 64]
    - [217, 0.0]
  - - [1216, 448, 1, 64]
    - [96, 0.0]
  - - [1344, 448, 1, 64]
    - [109, 0.0]
  - - [1472, 448, 1, 64]
    - [106, 0.0]
  - - [1600, 448, 1, 64]
    - [109, 0.0]
  - - [1728, 448, 1, 64]
    - [83, 0.0]
  - - [1856, 448, 1, 64]
    - [109, 0.0]
  - - [1984, 448, 1, 64]
    - [109, 0.0]
  - - [1088, 576, 1, 64]
    - [109, 0.0]
  - - [1216, 576, 1, 64]
    - [83, 0.0]
  - - [1344, 576, 1, 64]
    - [83, 0.0]
  - - [1472, 576, 1, 64]
    - [83, 0.0]
  - - [1600, 576, 1, 64]
    - [83, 0.0]
  - - [1728, 576, 1, 64]
    - [109, 0.0]
  - - [1856, 576, 1, 64]
    - [109, 0.0]
  - - [1984, 576, 1, 64]
    - [83, 0.0]
  - - [1088, 704, 1, 64]
    - [83, 0.0]
  - - [1216, 704, 1, 64]
    - [83, 0.0]
  - - [1344, 704, 1, 64]
    - [83, 0.0]
  - - [1472, 704, 1, 64]
    - [83, 0.0]
  - - [1600, 704, 1, 64]
    - [83, 0.0]
  - - [1728, 704, 1, 64]
    - [83, 0.0]
  - - [1856, 704, 1, 64]
    - [109, 0.0]
  - - [1984, 704, 1, 64]
    - [109, 0.0]
  - - [1088, 832, 1, 64]
    - [83, 0.0]
  - - [1216, 832, 1, 64]
    - [218, 0.0]
  - - [1344, 832, 1, 64]
    - [109, 0.0]
  - - [1472, 832, 1, 64]
    - [83, 0.0]
  - - [1600, 832, 1, 64]
    - [83, 0.0]
  - - [1728, 832, 1, 64]
    - [83, 0.0]
  - - [1856, 832, 1, 64]
    - [83, 0.0]
  - - [1984, 832, 1, 64]
    - [83, 0.0]
  - - [1088, 960, 1, 64]
    - [83, 0.0]
  - - [1216, 960, 1, 64]
    - [109, 0.0]
  - - [1344, 960, 1, 64]
    - [109, 0.0]
  - - [1472, 960, 1, 64]
    - [109, 0.0]
  - - [1600, 960, 1, 64]
    - [109, 0.0]
  - - [1728, 960, 1, 64]
    - [109, 0.0]
  - - [1856, 960, 1, 64]
    - [83, 0.0]
  - - [1984, 960, 1, 64]
    - [109, 0.0]
  - - [64, 1088, 1, 64]
    - [50, 0.0]
  - - [192, 1088, 1, 64]
    - [83, 0.0]
  - - [320, 1088, 1, 64]
    - [83, 0.0]
  - - [448, 1088, 1, 64]
    - [83, 0.0]
  - - [576, 1088, 1, 64]
    - [83, 0.0]
  - - [704, 1088, 1, 64]
    - [109, 0.0]
  - - [832, 1088, 1, 64]
    - [109, 0.0]
  - - [960, 1088, 1, 64]
    - [83, 0.0]
  - - [1088, 1088, 1, 64]
    - [83, 0.0]
  - - [1216, 1088, 1, 64]
    - [109, 0.0]
  - - [1344, 1088, 1, 64]
    - [109, 0.0]
  - - [1472, 1088, 1, 64]
    - [83, 0.0]
  - - [1600, 1088, 1, 64]
    - [83, 0.0]
  - - [1728, 1088, 1, 64]
    - [83, 0.0]
  - - [1856, 1088, 1, 64]
    - [83, 0.0]
  - - [1984, 1088, 1, 64]
    - [109, 0.0]
  - - [64, 1216, 1, 64]
    - [38, 0.0]
  - - [192, 1216, 1, 64]
    - [89, 0.0]
  - - [320, 1216, 1, 64]
    - [39, 0.0]
  - - [448, 1216, 1, 64]
    - [109, 0.0]
  - - [576, 1216, 1, 64]
    - [83, 0.0]
  - - [704, 1216, 1, 64]
    - [83, 0.0]
  - - [832, 1216, 1, 64]
    - [83, 0.0]
  - - [960, 1216, 1, 64]
    - [83, 0.0]
  - - [1088, 1216, 1, 64]
    - [109, 0.0]
  - - [1216, 1216, 1, 64]
    - [109, 0.0]
  - - [1344, 1216, 1, 64]
    - [109, 0.0]
  - - [1472, 1216, 1, 64]
    - [83, 0.0]
  - - [1600, 1216, 1, 64]
    - [83, 0.0]
  - - [1728, 1216, 1, 64]
    - [109, 0.0]
  - - [1856, 1216, 1, 64]
    - [109, 0.0]
  - - [1984, 1216, 1, 64]
    - [109, 0.0]
  - - [64, 1344, 1, 64]
    - [219, 0.0]
  - - [192, 1344, 1, 64]
    - [29, 0.0]
  - - [320, 1344, 1, 64]
    - [109, 0.0]
  - - [448, 1344, 1, 64]
    - [80, 0.0]
  - - [576, 1344, 1, 64]
    - [109, 0.0]
  - - [704, 1344, 1, 64]
    - [106, 0.0]
  - - [832, 1344, 1, 64]
    - [109, 0.0]
  - - [960, 1344, 1, 64]
    - [83, 0.0]
  - - [1088, 1344, 1, 64]
    - [83, 0.0]
  - - [1216, 1344, 1, 64]
    - [109, 0.0]
  - - [1344, 1344, 1, 64]
    - [83, 0.0]
  - - [1472, 1344, 1, 64]
    - [83, 0.0]
  - - [1600, 1344, 1, 64]
    - [83, 0.0]
  - - [1728, 1344, 1, 64]
    - [83, 0.0]
  - - [1856, 1344, 1, 64]
    - [83, 0.0]
  - - [1984, 1344, 1, 64]
    - [109, 0.0]
  - - [64, 1472, 1, 64]
    - [46, 0.0]
  - - [192, 1472, 1, 64]
    - [54, 0.0]
  - - [320, 1472, 1, 64]
    - [113, 0.0]
  - - [448, 1472, 1, 64]
    - [83, 0.0]
  - - [576, 1472, 1, 64]
    - [83, 0.0]
  - - [704, 1472, 1, 64]
    - [83, 0.0]
  - - [832, 1472, 1, 64]
    - [109, 0.0]
  - - [960, 1472, 1, 64]
    - [83, 0.0]
  - - [1088, 1472, 1, 64]
    - [109, 0.0]
  - - [1216, 1472, 1, 64]
    - [83, 0.0]
  - - [1344, 1472, 1, 64]
    - [109, 0.0]
  - - [1472, 1472, 1, 64]
    - [109, 0.0]
  - - [1600, 1472, 1, 64]
    - [109, 0.0]
  - - [1728, 1472, 1, 64]
    - [109, 0.0]
  - - [1856, 1472, 1, 64]
    - [109, 0.0]
  - - [1984, 1472, 1, 64]
    - [83, 0.0]
  - - [64, 1600, 1, 64]
    - [40, 0.0]
  - - [192, 1600, 1, 64]
    - [51, 0.0]
  - - [320, 1600, 1, 64]
    - [109, 0.0]
  - - [448, 1600, 1, 64]
    - [109, 0.0]
  - - [576, 1600, 1, 64]
    - [80, 0.0]
  - - [704, 1600, 1, 64]
    - [109, 0.0]
  - - [832, 1600, 1, 64]
    - [109, 0.0]
  - - [960, 1600, 1, 64]
    - [109, 0.0]
  - - [1088, 1600, 1, 64]
    - [83, 0.0]
  - - [1216, 1600, 1, 64]
    - [109, 0.0]
  - - [1344, 1600, 1, 64]
    - [83, 0.0]
  - - [1472, 1600, 1, 64]
    - [109, 0.0]
  - - [1600, 1600, 1, 64]
    - [83, 0.0]
  - - [1728, 1600, 1, 64]
    - [109, 0.0]
  - - [1856, 1600, 1, 64]
    - [109, 0.0]
  - - [1984, 1600, 1, 64]
    - [83, 0.0]
  - - [64, 1728, 1, 64]
    - [57, 0.0]
  - - [192, 1728, 1, 64]
    - [113, 0.0]
  - - [320, 1728, 1, 64]
    - [109, 0.0]
  - - [448, 1728, 1, 64]
    - [109, 0.0]
  - - [576, 1728, 1, 64]
    - [109, 0.0]
  - - [704, 1728, 1, 64]
    - [109, 0.0]
  - - [832, 1728, 1, 64]
    - [83, 0.0]
  - - [960, 1728, 1, 64]
    - [109, 0.0]
  - - [1088, 1728, 1, 64]
    - [109, 0.0]
  - - [1216, 1728, 1, 64]
    - [109, 0.0]
  - - [1344, 1728, 1, 64]
    - [83, 0.0]
  - - [1472, 1728, 1, 64]
    - [83, 0.0]
  - - [1600, 1728, 1, 64]
    - [109, 0.0]
  - - [1728, 1728, 1, 64]
    - [109, 0.0]
  - - [1856, 1728, 1, 64]
    - [109, 0.0]
  - - [1984, 1728, 1, 64]
    - [109, 0.0]
  - - [64, 1856, 1, 64]
    - [29, 0.0]
  - - [192, 1856, 1, 64]
    - [63, 0.0]
  - - [320, 1856, 1, 64]
    - [93, 0.0]
  - - [448, 1856, 1, 64]
    - [89, 0.0]
  - - [576, 1856, 1, 64]
    - [83, 0.0]
  - - [704, 1856, 1, 64]
    - [83, 0.0]
  - - [832, 1856, 1, 64]
    - [109, 0.0]
  - - [960, 1856, 1, 64]
    - [83, 0.0]
  - - [1088, 1856, 1, 64]
    - [109, 0.0]
  - - [1216, 1856, 1, 64]
    - [83, 0.0]
  - - [1344, 1856, 1, 64]
    - [109, 0.0]
  - - [1472, 1856, 1, 64]
    - [83, 0.0]
  - - [1600, 1856, 1, 64]
    - [83, 0.0]
  - - [1728, 1856, 1, 64]
    - [83, 0.0]
  - - [1856, 1856, 1, 64]
    - [83, 0.0]
  - - [1984, 1856, 1, 64]
    - [83, 0.0]
  - - [64, 1984, 1, 64]
    - [220, 0.0]
  - - [192, 1984, 1, 64]
    - [83, 0.0]
  - - [320, 1984, 1, 64]
    - [78, 0.0]
  - - [448, 1984, 1, 64]
    - [83, 0.0]
  - - [576, 1984, 1, 64]
    - [83, 0.0]
  - - [704, 1984, 1, 64]
    - [83, 0.0]
  - - [832, 1984, 1, 64]
    - [83, 0.0]
  - - [960, 1984, 1, 64]
    - [83, 0.0]
  - - [1088, 1984, 1, 64]
    - [109, 0.0]
  - - [1216, 1984, 1, 64]
    - [109, 0.0]
  - - [1344, 1984, 1, 64]
    - [83, 0.0]
  - - [1472, 1984, 1, 64]
    - [109, 0.0]
  - - [1600, 1984, 1, 64]
    - [83, 0.0]
  - - [1728, 1984, 1, 64]
    - [83, 0.0]
  - - [1856, 1984, 1, 64]
    - [109, 0.0]
  - - [1984, 1984, 1, 64]
    - [83, 0.0]
  - - [1088, 64, 1, 256]
    - [44, 0.0]
  - - [1216, 64, 1, 256]
    - [51, 0.0]
  - - [1344, 64, 1, 256]
    - [51, 0.0]
  - - [1472, 64, 1, 256]
    - [49, 0.0]
  - - [1600, 64, 1, 256]
    - [44, 0.0]
  - - [1728, 64, 1, 256]
    - [26, 0.0]
  - - [1856, 64, 1, 256]
    - [36, 0.0]
  - - [1984, 64, 1, 256]
    - [136, 0.0]
  - - [1088, 192, 1, 256]
    - [31, 0.0]
  - - [1216, 192, 1, 256]
    - [28, 0.0]
  - - [1344, 192, 1, 256]
    - [49, 0.0]
  - - [1472, 192, 1, 256]
    - [44, 0.0]
  - - [1600, 192, 1, 256]
    - [51, 0.0]
  - - [1728, 192, 1, 256]
    - [166, 0.0]
  - - [1856, 192, 1, 256]
    - [121, 0.0]
  - - [1984, 192, 1, 256]
    - [74, 0.0]
  - - [1088, 320, 1, 256]
    - [91, 0.0]
  - - [1216, 320, 1, 256]
    - [121, 0.0]
  - - [1344, 320, 1, 256]
    - [74, 0.0]
  - - [1472, 320, 1, 256]
    - [29, 0.0]
  - - [1600, 320, 1, 256]
    - [168, 0.0]
  - - [1728, 320, 1, 256]
    - [29, 0.0]
  - - [1856, 320, 1, 256]
    - [29, 0.0]
  - - [1984, 320, 1, 256]
    - [44, 0.0]
  - - [1088, 448, 1, 256]
    - [99, 0.0]
  - - [1216, 448, 1, 256]
    - [51, 0.0]
  - - [1344, 448, 1, 256]
    - [113, 0.0]
  - - [1472, 448, 1, 256]
    - [44, 0.0]
  - - [1600, 448, 1, 256]
    - [78, 0.0]
  - - [1728, 448, 1, 256]
    - [31, 0.0]
  - - [1856, 448, 1, 256]
    - [78, 0.0]
  - - [1984, 448, 1, 256]
    - [31, 0.0]
  - - [1088, 576, 1, 256]
    - [29, 0.0]
  - - [1216, 576, 1, 256]
    - [49, 0.0]
  - - [1344, 576, 1, 256]
    - [113, 0.0]
  - - [1472, 576, 1, 256]
    - [69, 0.0]
  - - [1600, 576, 1, 256]
    - [44, 0.0]
  - - [1728, 576, 1, 256]
    - [49, 0.0]
  - - [1856, 576, 1, 256]
    - [72, 0.0]
  - - [1984, 576, 1, 256]
    - [83, 0.0]
  - - [1088, 704, 1, 256]
    - [85, 0.0]
  - - [1216, 704, 1, 256]
    - [44, 0.0]
  - - [1344, 704, 1, 256]
    - [113, 0.0]
  - - [1472, 704, 1, 256]
    - [85, 0.0]
  - - [1600, 704, 1, 256]
    - [78, 0.0]
  - - [1728, 704, 1, 256]
    - [44, 0.0]
  - - [1856, 704, 1, 256]
    - [113, 0.0]
  - - [1984, 704, 1, 256]
    - [85, 0.0]
  - - [1088, 832, 1, 256]
    - [44, 0.0]
  - - [1216, 832, 1, 256]
    - [113, 0.0]
  - - [1344, 832, 1, 256]
    - [113, 0.0]
  - - [1472, 832, 1, 256]
    - [83, 0.0]
  - - [1600, 832, 1, 256]
    - [113, 0.0]
  - - [1728, 832, 1, 256]
    - [83, 0.0]
  - - [1856, 832, 1, 256]
    - [72, 0.0]
  - - [1984, 832, 1, 256]
    - [72, 0.0]
  - - [1088, 960, 1, 256]
    - [159, 0.0]
  - - [1216, 960, 1, 256]
    - [113, 0.0]
  - - [1344, 960, 1, 256]
    - [83, 0.0]
  - - [1472, 960, 1, 256]
    - [221, 0.0]
  - - [1600, 960, 1, 256]
    - [83, 0.0]
  - - [1728, 960, 1, 256]
    - [83, 0.0]
  - - [1856, 960, 1, 256]
    - [113, 0.0]
  - - [1984, 960, 1, 256]
    - [78, 0.0]
  - - [64, 1088, 1, 256]
    - [44, 0.0]
  - - [192, 1088, 1, 256]
    - [31, 0.0]
  - - [320, 1088, 1, 256]
    - [29, 0.0]
  - - [448, 1088, 1, 256]
    - [113, 0.0]
  - - [576, 1088, 1, 256]
    - [78, 0.0]
  - - [704, 1088, 1, 256]
    - [94, 0.0]
  - - [832, 1088, 1, 256]
    - [106, 0.0]
  - - [960, 1088, 1, 256]
    - [113, 0.0]
  - - [1088, 1088, 1, 256]
    - [106, 0.0]
  - - [1216, 1088, 1, 256]
    - [109, 0.0]
  - - [1344, 1088, 1, 256]
    - [83, 0.0]
  - - [1472, 1088, 1, 256]
    - [83, 0.0]
  - - [1600, 1088, 1, 256]
    - [83, 0.0]
  - - [1728, 1088, 1, 256]
    - [83, 0.0]
  - - [1856, 1088, 1, 256]
    - [83, 0.0]
  - - [1984, 1088, 1, 256]
    - [83, 0.0]
  - - [64, 1216, 1, 256]
    - [76, 0.0]
  - - [192, 1216, 1, 256]
    - [83, 0.0]
  - - [320, 1216, 1, 256]
    - [44, 0.0]
  - - [448, 1216, 1, 256]
    - [29, 0.0]
  - - [576, 1216, 1, 256]
    - [44, 0.0]
  - - [704, 1216, 1, 256]
    - [94, 0.0]
  - - [832, 1216, 1, 256]
    - [94, 0.0]
  - - [960, 1216, 1, 256]
    - [113, 0.0]
  - - [1088, 1216, 1, 256]
    - [109, 0.0]
  - - [1216, 1216, 1, 256]
    - [109, 0.0]
  - - [1344, 1216, 1, 256]
    - [83, 0.0]
  - - [1472, 1216, 1, 256]
    - [83, 0.0]
  - - [1600, 1216, 1, 256]
    - [113, 0.0]
  - - [1728, 1216, 1, 256]
    - [83, 0.0]
  - - [1856, 1216, 1, 256]
    - [106, 0.0]
  - - [1984, 1216, 1, 256]
    - [78, 0.0]
  - - [64, 1344, 1, 256]
    - [51, 0.0]
  - - [192, 1344, 1, 256]
    - [29, 0.0]
  - - [320, 1344, 1, 256]
    - [83, 0.0]
  - - [448, 1344, 1, 256]
    - [83, 0.0]
  - - [576, 1344, 1, 256]
    - [113, 0.0]
  - - [704, 1344, 1, 256]
    - [71, 0.0]
  - - [832, 1344, 1, 256]
    - [72, 0.0]
  - - [960, 1344, 1, 256]
    - [85, 0.0]
  - - [1088, 1344, 1, 256]
    - [78, 0.0]
  - - [1216, 1344, 1, 256]
    - [94, 0.0]
  - - [1344, 1344, 1, 256]
    - [83, 0.0]
  - - [1472, 1344, 1, 256]
    - [113, 0.0]
  - - [1600, 1344, 1, 256]
    - [83, 0.0]
  - - [1728, 1344, 1, 256]
    - [78, 0.0]
  - - [1856, 1344, 1, 256]
    - [72, 0.0]
  - - [1984, 1344, 1, 256]
    - [83, 0.0]
  - - [64, 1472, 1, 256]
    - [44, 0.0]
  - - [192, 1472, 1, 256]
    - [74, 0.0]
  - - [320, 1472, 1, 256]
    - [36, 0.0]
  - - [448, 1472, 1, 256]
    - [85, 0.0]
  - - [576, 1472, 1, 256]
    - [78, 0.0]
  - - [704, 1472, 1, 256]
    - [31, 0.0]
  - - [832, 1472, 1, 256]
    - [44, 0.0]
  - - [960, 1472, 1, 256]
    - [109, 0.0]
  - - [1088, 1472, 1, 256]
    - [72, 0.0]
  - - [1216, 1472, 1, 256]
    - [106, 0.0]
  - - [1344, 1472, 1, 256]
    - [113, 0.0]
  - - [1472, 1472, 1, 256]
    - [72, 0.0]
  - - [1600, 1472, 1, 256]
    - [83, 0.0]
  - - [1728, 1472, 1, 256]
    - [88, 0.0]
  - - [1856, 1472, 1, 256]
    - [83, 0.0]
  - - [1984, 1472, 1, 256]
    - [83, 0.0]
  - - [64, 1600, 1, 256]
    - [60, 0.0]
  - - [192, 1600, 1, 256]
    - [222, 0.0]
  - - [320, 1600, 1, 256]
    - [72, 0.0]
  - - [448, 1600, 1, 256]
    - [223, 0.0]
  - - [576, 1600, 1, 256]
    - [78, 0.0]
  - - [704, 1600, 1, 256]
    - [94, 0.0]
  - - [832, 1600, 1, 256]
    - [113, 0.0]
  - - [960, 1600, 1, 256]
    - [72, 0.0]
  - - [1088, 1600, 1, 256]
    - [113, 0.0]
  - - [1216, 1600, 1, 256]
    - [83, 0.0]
  - - [1344, 1600, 1, 256]
    - [72, 0.0]
  - - [1472, 1600, 1, 256]
    - [72, 0.0]
  - - [1600, 1600, 1, 256]
    - [83, 0.0]
  - - [1728, 1600, 1, 256]
    - [72, 0.0]
  - - [1856, 1600, 1, 256]
    - [83, 0.0]
  - - [1984, 1600, 1, 256]
    - [83, 0.0]
  - - [64, 1728, 1, 256]
    - [51, 0.0]
  - - [192, 1728, 1, 256]
    - [221, 0.0]
  - - [320, 1728, 1, 256]
    - [109, 0.0]
  - - [448, 1728, 1, 256]
    - [26, 0.0]
  - - [576, 1728, 1, 256]
    - [31, 0.0]
  - - [704, 1728, 1, 256]
    - [113, 0.0]
  - - [832, 1728, 1, 256]
    - [31, 0.0]
  - - [960, 1728, 1, 256]
    - [121, 0.0]
  - - [1088, 1728, 1, 256]
    - [72, 0.0]
  - - [1216, 1728, 1, 256]
    - [83, 0.0]
  - - [1344, 1728, 1, 256]
    - [83, 0.0]
  - - [1472, 1728, 1, 256]
    - [113, 0.0]
  - - [1600, 1728, 1, 256]
    - [113, 0.0]
  - - [1728, 1728, 1, 256]
    - [72, 0.0]
  - - [1856, 1728, 1, 256]
    - [72, 0.0]
  - - [1984, 1728, 1, 256]
    - [88, 0.0]
  - - [64, 1856, 1, 256]
    - [40, 0.0]
  - - [192, 1856, 1, 256]
    - [72, 0.0]
  - - [320, 1856, 1, 256]
    - [44, 0.0]
  - - [448, 1856, 1, 256]
    - [55, 0.0]
  - - [576, 1856, 1, 256]
    - [113, 0.0]
  - - [704, 1856, 1, 256]
    - [83, 0.0]
  - - [832, 1856, 1, 256]
    - [72, 0.0]
  - - [960, 1856, 1, 256]
    - [72, 0.0]
  - - [1088, 1856, 1, 256]
    - [83, 0.0]
  - - [1216, 1856, 1, 256]
    - [83, 0.0]
  - - [1344, 1856, 1, 256]
    - [83, 0.0]
  - - [1472, 1856, 1, 256]
    - [83, 0.0]
  - - [1600, 1856, 1, 256]
    - [83, 0.0]
  - - [1728, 1856, 1, 256]
    - [83, 0.0]
  - - [1856, 1856, 1, 256]
    - [88, 0.0]
  - - [1984, 1856, 1, 256]
    - [83, 0.0]
  - - [64, 1984, 1, 256]
    - [30, 0.0]
  - - [192, 1984, 1, 256]
    - [224, 0.0]
  - - [320, 1984, 1, 256]
    - [106, 0.0]
  - - [448, 1984, 1, 256]
    - [166, 0.0]
  - - [576, 1984, 1, 256]
    - [78, 0.0]
  - - [704, 1984, 1, 256]
    - [78, 0.0]
  - - [832, 1984, 1, 256]
    - [83, 0.0]
  - - [960, 1984, 1, 256]
    - [83, 0.0]
  - - [1088, 1984, 1, 256]
    - [83, 0.0]
  - - [1216, 1984, 1, 256]
    - [113, 0.0]
  - - [1344, 1984, 1, 256]
    - [83, 0.0]
  - - [1472, 1984, 1, 256]
    - [83, 0.0]
  - - [1600, 1984, 1, 256]
    - [83, 0.0]
  - - [1728, 1984, 1, 256]
    - [88, 0.0]
  - - [1856, 1984, 1, 256]
    - [88, 0.0]
  - - [1984, 1984, 1, 256]
    - [83, 0.0]
  - - [1088, 64, 1, 512]
    - [51, 0.0]
  - - [1216, 64, 1, 512]
    - [29, 0.0]
  - - [1344, 64, 1, 512]
    - [51, 0.0]
  - - [1472, 64, 1, 512]
    - [29, 0.0]
  - - [1600, 64, 1, 512]
    - [136, 0.0]
  - - [1728, 64, 1, 512]
    - [51, 0.0]
  - - [1856, 64, 1, 512]
    - [44, 0.0]
  - - [1984, 64, 1, 512]
    - [36, 0.0]
  - - [1088, 192, 1, 512]
    - [31, 0.0]
  - - [1216, 192, 1, 512]
    - [29, 0.0]
  - - [1344, 192, 1, 512]
    - [29, 0.0]
  - - [1472, 192, 1, 512]
    - [29, 0.0]
  - - [1600, 192, 1, 512]
    - [69, 0.0]
  - - [1728, 192, 1, 512]
    - [51, 0.0]
  - - [1856, 192, 1, 512]
    - [29, 0.0]
  - - [1984, 192, 1, 512]
    - [51, 0.0]
  - - [1088, 320, 1, 512]
    - [56, 0.0]
  - - [1216, 320, 1, 512]
    - [51, 0.0]
  - - [1344, 320, 1, 512]
    - [56, 0.0]
  - - [1472, 320, 1, 512]
    - [51, 0.0]
  - - [1600, 320, 1, 512]
    - [51, 0.0]
  - - [1728, 320, 1, 512]
    - [29, 0.0]
  - - [1856, 320, 1, 512]
    - [51, 0.0]
  - - [1984, 320, 1, 512]
    - [51, 0.0]
  - - [1088, 448, 1, 512]
    - [51, 0.0]
  - - [1216, 448, 1, 512]
    - [51, 0.0]
  - - [1344, 448, 1, 512]
    - [136, 0.0]
  - - [1472, 448, 1, 512]
    - [51, 0.0]
  - - [1600, 448, 1, 512]
    - [159, 0.0]
  - - [1728, 448, 1, 512]
    - [29, 0.0]
  - - [1856, 448, 1, 512]
    - [29, 0.0]
  - - [1984, 448, 1, 512]
    - [136, 0.0]
  - - [1088, 576, 1, 512]
    - [29, 0.0]
  - - [1216, 576, 1, 512]
    - [44, 0.0]
  - - [1344, 576, 1, 512]
    - [29, 0.0]
  - - [1472, 576, 1, 512]
    - [29, 0.0]
  - - [1600, 576, 1, 512]
    - [136, 0.0]
  - - [1728, 576, 1, 512]
    - [51, 0.0]
  - - [1856, 576, 1, 512]
    - [51, 0.0]
  - - [1984, 576, 1, 512]
    - [51, 0.0]
  - - [1088, 704, 1, 512]
    - [31, 0.0]
  - - [1216, 704, 1, 512]
    - [51, 0.0]
  - - [1344, 704, 1, 512]
    - [51, 0.0]
  - - [1472, 704, 1, 512]
    - [51, 0.0]
  - - [1600, 704, 1, 512]
    - [51, 0.0]
  - - [1728, 704, 1, 512]
    - [29, 0.0]
  - - [1856, 704, 1, 512]
    - [31, 0.0]
  - - [1984, 704, 1, 512]
    - [51, 0.0]
  - - [1088, 832, 1, 512]
    - [51, 0.0]
  - - [1216, 832, 1, 512]
    - [51, 0.0]
  - - [1344, 832, 1, 512]
    - [51, 0.0]
  - - [1472, 832, 1, 512]
    - [51, 0.0]
  - - [1600, 832, 1, 512]
    - [113, 0.0]
  - - [1728, 832, 1, 512]
    - [51, 0.0]
  - - [1856, 832, 1, 512]
    - [72, 0.0]
  - - [1984, 832, 1, 512]
    - [29, 0.0]
  - - [1088, 960, 1, 512]
    - [72, 0.0]
  - - [1216, 960, 1, 512]
    - [51, 0.0]
  - - [1344, 960, 1, 512]
    - [72, 0.0]
  - - [1472, 960, 1, 512]
    - [157, 0.0]
  - - [1600, 960, 1, 512]
    - [51, 0.0]
  - - [1728, 960, 1, 512]
    - [113, 0.0]
  - - [1856, 960, 1, 512]
    - [113, 0.0]
  - - [1984, 960, 1, 512]
    - [211, 0.0]
  - - [64, 1088, 1, 512]
    - [51, 0.0]
  - - [192, 1088, 1, 512]
    - [113, 0.0]
  - - [320, 1088, 1, 512]
    - [51, 0.0]
  - - [448, 1088, 1, 512]
    - [136, 0.0]
  - - [576, 1088, 1, 512]
    - [40, 0.0]
  - - [704, 1088, 1, 512]
    - [29, 0.0]
  - - [832, 1088, 1, 512]
    - [113, 0.0]
  - - [960, 1088, 1, 512]
    - [72, 0.0]
  - - [1088, 1088, 1, 512]
    - [106, 0.0]
  - - [1216, 1088, 1, 512]
    - [113, 0.0]
  - - [1344, 1088, 1, 512]
    - [51, 0.0]
  - - [1472, 1088, 1, 512]
    - [72, 0.0]
  - - [1600, 1088, 1, 512]
    - [125, 0.0]
  - - [1728, 1088, 1, 512]
    - [113, 0.0]
  - - [1856, 1088, 1, 512]
    - [72, 0.0]
  - - [1984, 1088, 1, 512]
    - [180, 0.0]
  - - [64, 1216, 1, 512]
    - [76, 0.0]
  - - [192, 1216, 1, 512]
    - [113, 0.0]
  - - [320, 1216, 1, 512]
    - [136, 0.0]
  - - [448, 1216, 1, 512]
    - [51, 0.0]
  - - [576, 1216, 1, 512]
    - [159, 0.0]
  - - [704, 1216, 1, 512]
    - [72, 0.0]
  - - [832, 1216, 1, 512]
    - [113, 0.0]
  - - [960, 1216, 1, 512]
    - [72, 0.0]
  - - [1088, 1216, 1, 512]
    - [113, 0.0]
  - - [1216, 1216, 1, 512]
    - [113, 0.0]
  - - [1344, 1216, 1, 512]
    - [72, 0.0]
  - - [1472, 1216, 1, 512]
    - [159, 0.0]
  - - [1600, 1216, 1, 512]
    - [88, 0.0]
  - - [1728, 1216, 1, 512]
    - [113, 0.0]
  - - [1856, 1216, 1, 512]
    - [51, 0.0]
  - - [1984, 1216, 1, 512]
    - [72, 0.0]
  - - [64, 1344, 1, 512]
    - [44, 0.0]
  - - [192, 1344, 1, 512]
    - [29, 0.0]
  - - [320, 1344, 1, 512]
    - [29, 0.0]
  - - [448, 1344, 1, 512]
    - [29, 0.0]
  - - [576, 1344, 1, 512]
    - [94, 0.0]
  - - [704, 1344, 1, 512]
    - [72, 0.0]
  - - [832, 1344, 1, 512]
    - [113, 0.0]
  - - [960, 1344, 1, 512]
    - [29, 0.0]
  - - [1088, 1344, 1, 512]
    - [113, 0.0]
  - - [1216, 1344, 1, 512]
    - [40, 0.0]
  - - [1344, 1344, 1, 512]
    - [113, 0.0]
  - - [1472, 1344, 1, 512]
    - [69, 0.0]
  - - [1600, 1344, 1, 512]
    - [31, 0.0]
  - - [1728, 1344, 1, 512]
    - [78, 0.0]
  - - [1856, 1344, 1, 512]
    - [180, 0.0]
  - - [1984, 1344, 1, 512]
    - [113, 0.0]
  - - [64, 1472, 1, 512]
    - [51, 0.0]
  - - [192, 1472, 1, 512]
    - [51, 0.0]
  - - [320, 1472, 1, 512]
    - [29, 0.0]
  - - [448, 1472, 1, 512]
    - [72, 0.0]
  - - [576, 1472, 1, 512]
    - [29, 0.0]
  - - [704, 1472, 1, 512]
    - [72, 0.0]
  - - [832, 1472, 1, 512]
    - [51, 0.0]
  - - [960, 1472, 1, 512]
    - [113, 0.0]
  - - [1088, 1472, 1, 512]
    - [113, 0.0]
  - - [1216, 1472, 1, 512]
    - [72, 0.0]
  - - [1344, 1472, 1, 512]
    - [113, 0.0]
  - - [1472, 1472, 1, 512]
    - [83, 0.0]
  - - [1600, 1472, 1, 512]
    - [198, 0.0]
  - - [1728, 1472, 1, 512]
    - [136, 0.0]
  - - [1856, 1472, 1, 512]
    - [125, 0.0]
  - - [1984, 1472, 1, 512]
    - [44, 0.0]
  - - [64, 1600, 1, 512]
    - [36, 0.0]
  - - [192, 1600, 1, 512]
    - [29, 0.0]
  - - [320, 1600, 1, 512]
    - [51, 0.0]
  - - [448, 1600, 1, 512]
    - [113, 0.0]
  - - [576, 1600, 1, 512]
    - [72, 0.0]
  - - [704, 1600, 1, 512]
    - [113, 0.0]
  - - [832, 1600, 1, 512]
    - [113, 0.0]
  - - [960, 1600, 1, 512]
    - [72, 0.0]
  - - [1088, 1600, 1, 512]
    - [113, 0.0]
  - - [1216, 1600, 1, 512]
    - [72, 0.0]
  - - [1344, 1600, 1, 512]
    - [113, 0.0]
  - - [1472, 1600, 1, 512]
    - [72, 0.0]
  - - [1600, 1600, 1, 512]
    - [88, 0.0]
  - - [1728, 1600, 1, 512]
    - [72, 0.0]
  - - [1856, 1600, 1, 512]
    - [72, 0.0]
  - - [1984, 1600, 1, 512]
    - [180, 0.0]
  - - [64, 1728, 1, 512]
    - [29, 0.0]
  - - [192, 1728, 1, 512]
    - [51, 0.0]
  - - [320, 1728, 1, 512]
    - [29, 0.0]
  - - [448, 1728, 1, 512]
    - [51, 0.0]
  - - [576, 1728, 1, 512]
    - [29, 0.0]
  - - [704, 1728, 1, 512]
    - [72, 0.0]
  - - [832, 1728, 1, 512]
    - [225, 0.0]
  - - [960, 1728, 1, 512]
    - [88, 0.0]
  - - [1088, 1728, 1, 512]
    - [113, 0.0]
  - - [1216, 1728, 1, 512]
    - [180, 0.0]
  - - [1344, 1728, 1, 512]
    - [88, 0.0]
  - - [1472, 1728, 1, 512]
    - [222, 0.0]
  - - [1600, 1728, 1, 512]
    - [113, 0.0]
  - - [1728, 1728, 1, 512]
    - [113, 0.0]
  - - [1856, 1728, 1, 512]
    - [125, 0.0]
  - - [1984, 1728, 1, 512]
    - [125, 0.0]
  - - [64, 1856, 1, 512]
    - [76, 0.0]
  - - [192, 1856, 1, 512]
    - [51, 0.0]
  - - [320, 1856, 1, 512]
    - [51, 0.0]
  - - [448, 1856, 1, 512]
    - [72, 0.0]
  - - [576, 1856, 1, 512]
    - [72, 0.0]
  - - [704, 1856, 1, 512]
    - [113, 0.0]
  - - [832, 1856, 1, 512]
    - [72, 0.0]
  - - [960, 1856, 1, 512]
    - [36, 0.0]
  - - [1088, 1856, 1, 512]
    - [88, 0.0]
  - - [1216, 1856, 1, 512]
    - [109, 0.0]
  - - [1344, 1856, 1, 512]
    - [113, 0.0]
  - - [1472, 1856, 1, 512]
    - [51, 0.0]
  - - [1600, 1856, 1, 512]
    - [125, 0.0]
  - - [1728, 1856, 1, 512]
    - [88, 0.0]
  - - [1856, 1856, 1, 512]
    - [88, 0.0]
  - - [1984, 1856, 1, 512]
    - [88, 0.0]
  - - [64, 1984, 1, 512]
    - [51, 0.0]
  - - [192, 1984, 1, 512]
    - [83, 0.0]
  - - [320, 1984, 1, 512]
    - [51, 0.0]
  - - [448, 1984, 1, 512]
    - [29, 0.0]
  - - [576, 1984, 1, 512]
    - [51, 0.0]
  - - [704, 1984, 1, 512]
    - [76, 0.0]
  - - [832, 1984, 1, 512]
    - [72, 0.0]
  - - [960, 1984, 1, 512]
    - [180, 0.0]
  - - [1088, 1984, 1, 512]
    - [180, 0.0]
  - - [1216, 1984, 1, 512]
    - [51, 0.0]
  - - [1344, 1984, 1, 512]
    - [51, 0.0]
  - - [1472, 1984, 1, 512]
    - [113, 0.0]
  - - [1600, 1984, 1, 512]
    - [72, 0.0]
  - - [1728, 1984, 1, 512]
    - [83, 0.0]
  - - [1856, 1984, 1, 512]
    - [88, 0.0]
  - - [1984, 1984, 1, 512]
    - [88, 0.0]
  - - [1088, 64, 1, 1024]
    - [29, 0.0]
  - - [1216, 64, 1, 1024]
    - [51, 0.0]
  - - [1344, 64, 1, 1024]
    - [58, 0.0]
  - - [1472, 64, 1, 1024]
    - [29, 0.0]
  - - [1600, 64, 1, 1024]
    - [29, 0.0]
  - - [1728, 64, 1, 1024]
    - [29, 0.0]
  - - [1856, 64, 1, 1024]
    - [36, 0.0]
  - - [1984, 64, 1, 1024]
    - [29, 0.0]
  - - [1088, 192, 1, 1024]
    - [36, 0.0]
  - - [1216, 192, 1, 1024]
    - [29, 0.0]
  - - [1344, 192, 1, 1024]
    - [29, 0.0]
  - - [1472, 192, 1, 1024]
    - [29, 0.0]
  - - [1600, 192, 1, 1024]
    - [51, 0.0]
  - - [1728, 192, 1, 1024]
    - [29, 0.0]
  - - [1856, 192, 1, 1024]
    - [36, 0.0]
  - - [1984, 192, 1, 1024]
    - [56, 0.0]
  - - [1088, 320, 1, 1024]
    - [36, 0.0]
  - - [1216, 320, 1, 1024]
    - [29, 0.0]
  - - [1344, 320, 1, 1024]
    - [56, 0.0]
  - - [1472, 320, 1, 1024]
    - [51, 0.0]
  - - [1600, 320, 1, 1024]
    - [29, 0.0]
  - - [1728, 320, 1, 1024]
    - [36, 0.0]
  - - [1856, 320, 1, 1024]
    - [58, 0.0]
  - - [1984, 320, 1, 1024]
    - [29, 0.0]
  - - [1088, 448, 1, 1024]
    - [136, 0.0]
  - - [1216, 448, 1, 1024]
    - [51, 0.0]
  - - [1344, 448, 1, 1024]
    - [36, 0.0]
  - - [1472, 448, 1, 1024]
    - [29, 0.0]
  - - [1600, 448, 1, 1024]
    - [29, 0.0]
  - - [1728, 448, 1, 1024]
    - [51, 0.0]
  - - [1856, 448, 1, 1024]
    - [29, 0.0]
  - - [1984, 448, 1, 1024]
    - [31, 0.0]
  - - [1088, 576, 1, 1024]
    - [36, 0.0]
  - - [1216, 576, 1, 1024]
    - [136, 0.0]
  - - [1344, 576, 1, 1024]
    - [136, 0.0]
  - - [1472, 576, 1, 1024]
    - [29, 0.0]
  - - [1600, 576, 1, 1024]
    - [136, 0.0]
  - - [1728, 576, 1, 1024]
    - [36, 0.0]
  - - [1856, 576, 1, 1024]
    - [72, 0.0]
  - - [1984, 576, 1, 1024]
    - [113, 0.0]
  - - [1088, 704, 1, 1024]
    - [51, 0.0]
  - - [1216, 704, 1, 1024]
    - [113, 0.0]
  - - [1344, 704, 1, 1024]
    - [29, 0.0]
  - - [1472, 704, 1, 1024]
    - [36, 0.0]
  - - [1600, 704, 1, 1024]
    - [29, 0.0]
  - - [1728, 704, 1, 1024]
    - [29, 0.0]
  - - [1856, 704, 1, 1024]
    - [136, 0.0]
  - - [1984, 704, 1, 1024]
    - [51, 0.0]
  - - [1088, 832, 1, 1024]
    - [36, 0.0]
  - - [1216, 832, 1, 1024]
    - [51, 0.0]
  - - [1344, 832, 1, 1024]
    - [44, 0.0]
  - - [1472, 832, 1, 1024]
    - [159, 0.0]
  - - [1600, 832, 1, 1024]
    - [29, 0.0]
  - - [1728, 832, 1, 1024]
    - [29, 0.0]
  - - [1856, 832, 1, 1024]
    - [44, 0.0]
  - - [1984, 832, 1, 1024]
    - [44, 0.0]
  - - [1088, 960, 1, 1024]
    - [31, 0.0]
  - - [1216, 960, 1, 1024]
    - [78, 0.0]
  - - [1344, 960, 1, 1024]
    - [113, 0.0]
  - - [1472, 960, 1, 1024]
    - [159, 0.0]
  - - [1600, 960, 1, 1024]
    - [159, 0.0]
  - - [1728, 960, 1, 1024]
    - [44, 0.0]
  - - [1856, 960, 1, 1024]
    - [159, 0.0]
  - - [1984, 960, 1, 1024]
    - [44, 0.0]
  - - [64, 1088, 1, 1024]
    - [36, 0.0]
  - - [192, 1088, 1, 1024]
    - [28, 0.0]
  - - [320, 1088, 1, 1024]
    - [51, 0.0]
  - - [448, 1088, 1, 1024]
    - [51, 0.0]
  - - [576, 1088, 1, 1024]
    - [136, 0.0]
  - - [704, 1088, 1, 1024]
    - [136, 0.0]
  - - [832, 1088, 1, 1024]
    - [159, 0.0]
  - - [960, 1088, 1, 1024]
    - [159, 0.0]
  - - [1088, 1088, 1, 1024]
    - [51, 0.0]
  - - [1216, 1088, 1, 1024]
    - [136, 0.0]
  - - [1344, 1088, 1, 1024]
    - [44, 0.0]
  - - [1472, 1088, 1, 1024]
    - [72, 0.0]
  - - [1600, 1088, 1, 1024]
    - [159, 0.0]
  - - [1728, 1088, 1, 1024]
    - [88, 0.0]
  - - [1856, 1088, 1, 1024]
    - [83, 0.0]
  - - [1984, 1088, 1, 1024]
    - [159, 0.0]
  - - [64, 1216, 1, 1024]
    - [29, 0.0]
  - - [192, 1216, 1, 1024]
    - [31, 0.0]
  - - [320, 1216, 1, 1024]
    - [51, 0.0]
  - - [448, 1216, 1, 1024]
    - [29, 0.0]
  - - [576, 1216, 1, 1024]
    - [136, 0.0]
  - - [704, 1216, 1, 1024]
    - [51, 0.0]
  - - [832, 1216, 1, 1024]
    - [159, 0.0]
  - - [960, 1216, 1, 1024]
    - [159, 0.0]
  - - [1088, 1216, 1, 1024]
    - [31, 0.0]
  - - [1216, 1216, 1, 1024]
    - [72, 0.0]
  - - [1344, 1216, 1, 1024]
    - [36, 0.0]
  - - [1472, 1216, 1, 1024]
    - [51, 0.0]
  - - [1600, 1216, 1, 1024]
    - [31, 0.0]
  - - [1728, 1216, 1, 1024]
    - [180, 0.0]
  - - [1856, 1216, 1, 1024]
    - [44, 0.0]
  - - [1984, 1216, 1, 1024]
    - [180, 0.0]
  - - [64, 1344, 1, 1024]
    - [29, 0.0]
  - - [192, 1344, 1, 1024]
    - [31, 0.0]
  - - [320, 1344, 1, 1024]
    - [40, 0.0]
  - - [448, 1344, 1, 1024]
    - [29, 0.0]
  - - [576, 1344, 1, 1024]
    - [51, 0.0]
  - - [704, 1344, 1, 1024]
    - [202, 0.0]
  - - [832, 1344, 1, 1024]
    - [51, 0.0]
  - - [960, 1344, 1, 1024]
    - [36, 0.0]
  - - [1088, 1344, 1, 1024]
    - [51, 0.0]
  - - [1216, 1344, 1, 1024]
    - [49, 0.0]
  - - [1344, 1344, 1, 1024]
    - [49, 0.0]
  - - [1472, 1344, 1, 1024]
    - [51, 0.0]
  - - [1600, 1344, 1, 1024]
    - [44, 0.0]
  - - [1728, 1344, 1, 1024]
    - [44, 0.0]
  - - [1856, 1344, 1, 1024]
    - [88, 0.0]
  - - [1984, 1344, 1, 1024]
    - [159, 0.0]
  - - [64, 1472, 1, 1024]
    - [36, 0.0]
  - - [192, 1472, 1, 1024]
    - [75, 0.0]
  - - [320, 1472, 1, 1024]
    - [51, 0.0]
  - - [448, 1472, 1, 1024]
    - [51, 0.0]
  - - [576, 1472, 1, 1024]
    - [44, 0.0]
  - - [704, 1472, 1, 1024]
    - [29, 0.0]
  - - [832, 1472, 1, 1024]
    - [49, 0.0]
  - - [960, 1472, 1, 1024]
    - [51, 0.0]
  - - [1088, 1472, 1, 1024]
    - [29, 0.0]
  - - [1216, 1472, 1, 1024]
    - [44, 0.0]
  - - [1344, 1472, 1, 1024]
    - [51, 0.0]
  - - [1472, 1472, 1, 1024]
    - [88, 0.0]
  - - [1600, 1472, 1, 1024]
    - [44, 0.0]
  - - [1728, 1472, 1, 1024]
    - [44, 0.0]
  - - [1856, 1472, 1, 1024]
    - [159, 0.0]
  - - [1984, 1472, 1, 1024]
    - [44, 0.0]
  - - [64, 1600, 1, 1024]
    - [51, 0.0]
  - - [192, 1600, 1, 1024]
    - [51, 0.0]
  - - [320, 1600, 1, 1024]
    - [36, 0.0]
  - - [448, 1600, 1, 1024]
    - [226, 0.0]
  - - [576, 1600, 1, 1024]
    - [159, 0.0]
  - - [704, 1600, 1, 1024]
    - [31, 0.0]
  - - [832, 1600, 1, 1024]
    - [180, 0.0]
  - - [960, 1600, 1, 1024]
    - [44, 0.0]
  - - [1088, 1600, 1, 1024]
    - [180, 0.0]
  - - [1216, 1600, 1, 1024]
    - [29, 0.0]
  - - [1344, 1600, 1, 1024]
    - [88, 0.0]
  - - [1472, 1600, 1, 1024]
    - [44, 0.0]
  - - [1600, 1600, 1, 1024]
    - [180, 0.0]
  - - [1728, 1600, 1, 1024]
    - [136, 0.0]
  - - [1856, 1600, 1, 1024]
    - [88, 0.0]
  - - [1984, 1600, 1, 1024]
    - [44, 0.0]
  - - [64, 1728, 1, 1024]
    - [36, 0.0]
  - - [192, 1728, 1, 1024]
    - [51, 0.0]
  - - [320, 1728, 1, 1024]
    - [36, 0.0]
  - - [448, 1728, 1, 1024]
    - [136, 0.0]
  - - [576, 1728, 1, 1024]
    - [88, 0.0]
  - - [704, 1728, 1, 1024]
    - [36, 0.0]
  - - [832, 1728, 1, 1024]
    - [159, 0.0]
  - - [960, 1728, 1, 1024]
    - [172, 0.0]
  - - [1088, 1728, 1, 1024]
    - [51, 0.0]
  - - [1216, 1728, 1, 1024]
    - [44, 0.0]
  - - [1344, 1728, 1, 1024]
    - [159, 0.0]
  - - [1472, 1728, 1, 1024]
    - [88, 0.0]
  - - [1600, 1728, 1, 1024]
    - [44, 0.0]
  - - [1728, 1728, 1, 1024]
    - [44, 0.0]
  - - [1856, 1728, 1, 1024]
    - [180, 0.0]
  - - [1984, 1728, 1, 1024]
    - [125, 0.0]
  - - [64, 1856, 1, 1024]
    - [36, 0.0]
  - - [192, 1856, 1, 1024]
    - [83, 0.0]
  - - [320, 1856, 1, 1024]
    - [51, 0.0]
  - - [448, 1856, 1, 1024]
    - [108, 0.0]
  - - [576, 1856, 1, 1024]
    - [31, 0.0]
  - - [704, 1856, 1, 1024]
    - [159, 0.0]
  - - [832, 1856, 1, 1024]
    - [44, 0.0]
  - - [960, 1856, 1, 1024]
    - [175, 0.0]
  - - [1088, 1856, 1, 1024]
    - [44, 0.0]
  - - [1216, 1856, 1, 1024]
    - [44, 0.0]
  - - [1344, 1856, 1, 1024]
    - [44, 0.0]
  - - [1472, 1856, 1, 1024]
    - [159, 0.0]
  - - [1600, 1856, 1, 1024]
    - [159, 0.0]
  - - [1728, 1856, 1, 1024]
    - [175, 0.0]
  - - [1856, 1856, 1, 1024]
    - [88, 0.0]
  - - [1984, 1856, 1, 1024]
    - [180, 0.0]
  - - [64, 1984, 1, 1024]
    - [136, 0.0]
  - - [192, 1984, 1, 1024]
    - [136, 0.0]
  - - [320, 1984, 1, 1024]
    - [136, 0.0]
  - - [448, 1984, 1, 1024]
    - [31, 0.0]
  - - [576, 1984, 1, 1024]
    - [49, 0.0]
  - - [704, 1984, 1, 1024]
    - [159, 0.0]
  - - [832, 1984, 1, 1024]
    - [44, 0.0]
  - - [960, 1984, 1, 1024]
    - [44, 0.0]
  - - [1088, 1984, 1, 1024]
    - [51, 0.0]
  - - [1216, 1984, 1, 1024]
    - [29, 0.0]
  - - [1344, 1984, 1, 1024]
    - [180, 0.0]
  - - [1472, 1984, 1, 1024]
    - [31, 0.0]
  - - [1600, 1984, 1, 1024]
    - [88, 0.0]
  - - [1728, 1984, 1, 1024]
    - [180, 0.0]
  - - [1856, 1984, 1, 1024]
    - [180, 0.0]
  - - [1984, 1984, 1, 1024]
    - [180, 0.0]
  - - [1088, 64, 1, 2048]
    - [227, 0.0]
  - - [1216, 64, 1, 2048]
    - [43, 0.0]
  - - [1344, 64, 1, 2048]
    - [51, 0.0]
  - - [1472, 64, 1, 2048]
    - [58, 0.0]
  - - [1600, 64, 1, 2048]
    - [40, 0.0]
  - - [1728, 64, 1, 2048]
    - [136, 0.0]
  - - [1856, 64, 1, 2048]
    - [51, 0.0]
  - - [1984, 64, 1, 2048]
    - [136, 0.0]
  - - [1088, 192, 1, 2048]
    - [29, 0.0]
  - - [1216, 192, 1, 2048]
    - [31, 0.0]
  - - [1344, 192, 1, 2048]
    - [51, 0.0]
  - - [1472, 192, 1, 2048]
    - [136, 0.0]
  - - [1600, 192, 1, 2048]
    - [51, 0.0]
  - - [1728, 192, 1, 2048]
    - [72, 0.0]
  - - [1856, 192, 1, 2048]
    - [29, 0.0]
  - - [1984, 192, 1, 2048]
    - [51, 0.0]
  - - [1088, 320, 1, 2048]
    - [51, 0.0]
  - - [1216, 320, 1, 2048]
    - [51, 0.0]
  - - [1344, 320, 1, 2048]
    - [56, 0.0]
