projects/hipblaslt/library/src/amd_detail/rocblaslt/src/Tensile/Logic/asm_full/gfx1200/GridBased/gfx1200_Cijk_Ailk_Bjlk_HSS_BH_Bias_S_HA_S_SAV_UserArgs.yaml
- {MinimumRequiredVersion: 5.0.0}
- gfx1200
- gfx1200
- [Device 73f0]
    SolutionIndex: 0
    SolutionNameMin: Cijk_Ailk_Bjlk_HSS_BH_Bias_HAS_SAV_UserArgs_MT64x32x32_MI16x16x1_SN_CLR1_GSU1_LBSPPA1024_LBSPPB512_MIWT2_1_PGR1_PLR1_SS0_SU32_SUM0_SUS256_SVW8_WG32_4_1_WGM8
    SolutionIndex: 1
    SolutionNameMin: Cijk_Ailk_Bjlk_HSS_BH_Bias_HAS_SAV_UserArgs_MT64x32x32_MI16x16x1_SN_CLR1_GSU1_LBSPPA1024_LBSPPB512_MIWT2_1_PGR2_PLR1_SS0_SU32_SUM0_SUS256_SVW8_WG32_4_1_WGM8
    SolutionIndex: 2
    SolutionNameMin: Cijk_Ailk_Bjlk_HSS_BH_Bias_HAS_SAV_UserArgs_MT64x32x32_MI16x16x1_SN_CLR0_GSU1_LBSPPA1024_LBSPPB512_MIWT2_1_PGR1_PLR0_SS0_SU32_SUM0_SUS256_SVW8_WG32_4_1_WGM8
    SolutionIndex: 3
    SolutionNameMin: Cijk_Ailk_Bjlk_HSS_BH_Bias_HAS_SAV_UserArgs_MT64x32x32_MI16x16x1_SN_CLR0_GSU1_LBSPPA1024_LBSPPB512_MIWT2_1_PGR2_PLR0_SS0_SU32_SUM0_SUS256_SVW8_WG32_4_1_WGM8
    SolutionIndex: 4
    SolutionNameMin: Cijk_Ailk_Bjlk_HSS_BH_Bias_HAS_SAV_UserArgs_MT32x64x32_MI16x16x1_SN_CLR1_GSU1_LBSPPA512_LBSPPB1024_MIWT2_1_PGR1_PLR1_SS0_SU32_SUM0_SUS256_SVW8_WG16_8_1_WGM8
    SolutionIndex: 5
    SolutionNameMin: Cijk_Ailk_Bjlk_HSS_BH_Bias_HAS_SAV_UserArgs_MT32x64x32_MI16x16x1_SN_CLR1_GSU1_LBSPPA512_LBSPPB1024_MIWT2_1_PGR2_PLR1_SS0_SU32_SUM0_SUS256_SVW8_WG16_8_1_WGM8
    SolutionIndex: 6
    SolutionNameMin: Cijk_Ailk_Bjlk_HSS_BH_Bias_HAS_SAV_UserArgs_MT32x64x32_MI16x16x1_SN_CLR0_GSU1_LBSPPA512_LBSPPB1024_MIWT2_1_PGR1_PLR0_SS0_SU32_SUM0_SUS256_SVW8_WG16_8_1_WGM8
    SolutionIndex: 7
    SolutionNameMin: Cijk_Ailk_Bjlk_HSS_BH_Bias_HAS_SAV_UserArgs_MT32x64x32_MI16x16x1_SN_CLR0_GSU1_LBSPPA512_LBSPPB1024_MIWT2_1_PGR2_PLR0_SS0_SU32_SUM0_SUS256_SVW8_WG16_8_1_WGM8
    SolutionIndex: 8
    SolutionNameMin: Cijk_Ailk_Bjlk_HSS_BH_Bias_HAS_SAV_UserArgs_MT32x32x64_MI16x16x1_SN_CLR1_GSU1_LBSPPA512_LBSPPB512_MIWT1_1_PGR1_PLR1_SS0_SU32_SUM0_SUS256_SVW8_WG32_4_1_WGM8
    SolutionIndex: 9
    SolutionNameMin: Cijk_Ailk_Bjlk_HSS_BH_Bias_HAS_SAV_UserArgs_MT64x32x64_MI16x16x1_SN_CLR1_GSU1_LBSPPA1024_LBSPPB512_MIWT2_1_PGR1_PLR3_SS0_SU32_SUM0_SUS256_SVW8_WG32_4_1_WGM8
    SolutionIndex: 10
    SolutionNameMin: Cijk_Ailk_Bjlk_HSS_BH_Bias_HAS_SAV_UserArgs_MT64x16x32_MI16x16x1_SN_CLR1_GSU1_LBSPPA1024_LBSPPB256_MIWT1_1_PGR2_PLR1_SS1_SU32_SUM0_SUS256_SVW1_WG64_2_1_WGM8
    SolutionIndex: 11
    SolutionNameMin: Cijk_Ailk_Bjlk_HSS_BH_Bias_HAS_SAV_UserArgs_MT64x16x32_MI16x16x1_SN_CLR0_GSU1_LBSPPA1024_LBSPPB256_MIWT1_1_PGR2_PLR0_SS1_SU32_SUM0_SUS256_SVW1_WG64_2_1_WGM8
    SolutionIndex: 12
    SolutionNameMin: Cijk_Ailk_Bjlk_HSS_BH_Bias_HAS_SAV_UserArgs_MT32x32x32_MI16x16x1_SN_CLR0_GSU1_LBSPPA512_LBSPPB512_MIWT1_1_PGR2_PLR0_SS1_SU32_SUM0_SUS256_SVW1_WG32_4_1_WGM8
    SolutionIndex: 13
    SolutionNameMin: Cijk_Ailk_Bjlk_HSS_BH_Bias_HAS_SAV_UserArgs_MT64x32x32_MI16x16x1_SN_CLR1_GSU1_LBSPPA1024_LBSPPB512_MIWT2_1_PGR1_PLR1_SS1_SU32_SUM0_SUS256_SVW1_WG32_4_1_WGM8
    SolutionIndex: 14
    SolutionNameMin: Cijk_Ailk_Bjlk_HSS_BH_Bias_HAS_SAV_UserArgs_MT64x32x32_MI16x16x1_SN_CLR1_GSU1_LBSPPA1024_LBSPPB512_MIWT2_1_PGR2_PLR1_SS1_SU32_SUM0_SUS256_SVW1_WG32_4_1_WGM8
    SolutionIndex: 15
    SolutionNameMin: Cijk_Ailk_Bjlk_HSS_BH_Bias_HAS_SAV_UserArgs_MT32x64x32_MI16x16x1_SN_CLR1_GSU1_LBSPPA512_LBSPPB1024_MIWT2_1_PGR1_PLR1_SS1_SU32_SUM0_SUS256_SVW1_WG16_8_1_WGM8
    SolutionIndex: 16
    SolutionNameMin: Cijk_Ailk_Bjlk_HSS_BH_Bias_HAS_SAV_UserArgs_MT32x64x32_MI16x16x1_SN_CLR0_GSU1_LBSPPA512_LBSPPB1024_MIWT2_1_PGR1_PLR0_SS1_SU32_SUM0_SUS256_SVW1_WG16_8_1_WGM8
    SolutionIndex: 17
    SolutionNameMin: Cijk_Ailk_Bjlk_HSS_BH_Bias_HAS_SAV_UserArgs_MT64x32x64_MI16x16x1_SN_CLR1_GSU1_LBSPPA1024_LBSPPB512_MIWT2_1_PGR1_PLR1_SS1_SU32_SUM0_SUS256_SVW1_WG32_4_1_WGM8
    SolutionIndex: 18
    SolutionNameMin: Cijk_Ailk_Bjlk_HSS_BH_Bias_HAS_SAV_UserArgs_MT32x64x64_MI16x16x1_SN_CLR1_GSU1_LBSPPA512_LBSPPB1024_MIWT2_1_PGR1_PLR3_SS1_SU32_SUM0_SUS256_SVW1_WG16_8_1_WGM8
    SolutionIndex: 19
    SolutionNameMin: Cijk_Ailk_Bjlk_HSS_BH_Bias_S_HA_S_SAV_UserArgs_MT64x64x32_MI16x16x1_SN_LDSB0_AFC1_AFEM1_AFEM1_ASEM1_CLR1_CADS0_DTVA0_DTVB0_EPS0_FDSI0_GRPM1_GRVWA8_GRVWB8_GSU1_GSUAMB_GSUC0_GSUWGMRR0_GLS0_ISA1200_IU1_K1_LBSPPA1024_LBSPPB1024_LBSPPM0_LPA16_LPB16_LPM0_LRVW8_LWPMn1_MIAV1_MIWT2_2_MO40_NTn1_NTA0_NTB0_NTC0_NTD0_NTM0_NEPBS0_NLCA1_NLCB1_ONLL1_PGR2_PLR1_PKA0_SIA1_SS0_SU32_SUM0_SUS256_SPO0_SRVW0_SSO0_SVW8_SK0_SKXCCM0_TLDS0_ULSGRO0_USL1_UIOFGRO0_USFGROn1_VSn1_VWA1_VWB1_WSGRA0_WSGRB0_WS32_WG32_4_1_WGM8_WGMXCC1_WGMXCCGn1
    SolutionIndex: 20
    SolutionNameMin: Cijk_Ailk_Bjlk_HSS_BH_Bias_S_HA_S_SAV_UserArgs_MT128x128x32_MI16x16x1_SN_LDSB0_AFC1_AFEM1_AFEM1_ASEM1_CLR0_CADS0_DTVA0_DTVB0_EPS0_FDSI0_GRPM1_GRVWA8_GRVWB8_GSU1_GSUAMB_GSUC0_GSUWGMRR0_GLS0_ISA1200_IU1_K1_LBSPPA2048_LBSPPB2048_LBSPPM0_LPA0_LPB0_LPM0_LRVW8_LWPMn1_MIAV1_MIWT4_4_MO40_NTn1_NTA0_NTB0_NTC0_NTD0_NTM0_NEPBS0_NLCA1_NLCB1_ONLL1_PGR2_PLR0_PKA0_SIA1_SS1_SU32_SUM0_SUS256_SPO0_SRVW0_SSO0_SVW4_SK0_SKXCCM0_TLDS0_ULSGRO0_USL1_UIOFGRO0_USFGROn1_VSn1_VWA4_VWB4_WSGRA0_WSGRB0_WS32_WG32_4_1_WGM8_WGMXCC1_WGMXCCGn1
    SolutionIndex: 21
    SolutionNameMin: Cijk_Ailk_Bjlk_HSS_BH_Bias_S_HA_S_SAV_UserArgs_MT128x128x32_MI16x16x1_SN_LDSB0_AFC1_AFEM1_AFEM1_ASEM1_CLR0_CADS0_DTVA0_DTVB0_EPS0_FDSI0_GRPM1_GRVWA4_GRVWB8_GSU1_GSUAMB_GSUC0_GSUWGMRR0_GLS0_ISA1200_IU1_K1_LBSPPA2048_LBSPPB2048_LBSPPM0_LPA0_LPB0_LPM0_LRVW8_LWPMn1_MIAV1_MIWT4_4_MO40_NTn1_NTA0_NTB0_NTC0_NTD0_NTM0_NEPBS0_NLCA1_NLCB1_ONLL1_PGR2_PLR0_PKA0_SIA1_SS0_SU32_SUM0_SUS256_SPO0_SRVW0_SSO0_SVW8_SK0_SKXCCM0_TLDS0_ULSGRO0_USL1_UIOFGRO0_USFGROn1_VSn1_VWA4_VWB4_WSGRA0_WSGRB0_WS32_WG32_4_1_WGM8_WGMXCC1_WGMXCCGn1
    SolutionIndex: 22
    SolutionNameMin: Cijk_Ailk_Bjlk_HSS_BH_Bias_S_HA_S_SAV_UserArgs_MT128x128x32_MI16x16x1_SN_LDSB0_AFC1_AFEM1_AFEM1_ASEM1_CLR0_CADS0_DTVA0_DTVB0_EPS0_FDSI0_GRPM1_GRVWA8_GRVWB4_GSU1_GSUAMB_GSUC0_GSUWGMRR0_GLS0_ISA1200_IU1_K1_LBSPPA2048_LBSPPB2048_LBSPPM0_LPA0_LPB0_LPM0_LRVW8_LWPMn1_MIAV1_MIWT4_4_MO40_NTn1_NTA0_NTB0_NTC0_NTD0_NTM0_NEPBS0_NLCA1_NLCB1_ONLL1_PGR2_PLR0_PKA0_SIA1_SS0_SU32_SUM0_SUS256_SPO0_SRVW0_SSO0_SVW8_SK0_SKXCCM0_TLDS0_ULSGRO0_USL1_UIOFGRO0_USFGROn1_VSn1_VWA4_VWB4_WSGRA0_WSGRB0_WS32_WG32_4_1_WGM8_WGMXCC1_WGMXCCGn1
    SolutionIndex: 23
    SolutionNameMin: Cijk_Ailk_Bjlk_HSS_BH_Bias_S_HA_S_SAV_UserArgs_MT128x128x32_MI16x16x1_SN_LDSB0_AFC1_AFEM1_AFEM1_ASEM1_CLR0_CADS0_DTVA0_DTVB0_EPS0_FDSI0_GRPM1_GRVWA8_GRVWB8_GSU1_GSUAMB_GSUC0_GSUWGMRR0_GLS0_ISA1200_IU1_K1_LBSPPA2048_LBSPPB2048_LBSPPM0_LPA0_LPB16_LPM0_LRVW8_LWPMn1_MIAV1_MIWT4_4_MO40_NTn1_NTA0_NTB0_NTC0_NTD0_NTM0_NEPBS0_NLCA1_NLCB1_ONLL1_PGR2_PLR0_PKA0_SIA1_SS1_SU32_SUM0_SUS256_SPO0_SRVW0_SSO0_SVW4_SK0_SKXCCM0_TLDS0_ULSGRO0_USL1_UIOFGRO0_USFGROn1_VSn1_VWA4_VWB1_WSGRA0_WSGRB0_WS32_WG32_4_1_WGM8_WGMXCC1_WGMXCCGn1
    SolutionIndex: 24
    SolutionNameMin: Cijk_Ailk_Bjlk_HSS_BH_Bias_S_HA_S_SAV_UserArgs_MT16x16x32_MI16x16x1_SN_LDSB1_AFC1_AFEM1_AFEM1_ASEM1_CLR1_CADS0_DTVA0_DTVB0_EPS0_FDSI0_GRPM1_GRVWA8_GRVWB8_GSU1_GSUAMB_GSUC0_GSUWGMRR0_GLS0_ISA1200_IU1_K1_LBSPPA256_LBSPPB256_LBSPPM0_LPA16_LPB16_LPM0_LRVW8_LWPMn1_MIAV1_MIWT1_1_MO40_NTn1_NTA0_NTB0_NTC0_NTD0_NTM0_NEPBS0_NLCA1_NLCB1_ONLL1_PGR2_PLR1_PKA0_SIA3_SS0_SU32_SUM0_SUS256_SPO0_SRVW0_SSO0_SVW8_SK0_SKXCCM0_TLDS0_ULSGRO0_USL1_UIOFGRO0_USFGROn1_VSn1_VWA1_VWB1_WSGRA0_WSGRB0_WS32_WG16_2_1_WGM8_WGMXCC1_WGMXCCGn1
    SolutionIndex: 25
    SolutionNameMin: Cijk_Ailk_Bjlk_HSS_BH_Bias_S_HA_S_SAV_UserArgs_MT64x64x32_MI16x16x1_SN_LDSB0_AFC1_AFEM1_AFEM1_ASEM1_CLR1_CADS0_DTVA0_DTVB0_EPS0_FDSI0_GRPM1_GRVWA4_GRVWB8_GSU1_GSUAMB_GSUC0_GSUWGMRR0_GLS0_ISA1200_IU1_K1_LBSPPA1024_LBSPPB1024_LBSPPM0_LPA16_LPB16_LPM0_LRVW8_LWPMn1_MIAV1_MIWT2_2_MO40_NTn1_NTA0_NTB0_NTC0_NTD0_NTM0_NEPBS0_NLCA1_NLCB1_ONLL1_PGR2_PLR1_PKA0_SIA1_SS0_SU32_SUM0_SUS256_SPO0_SRVW0_SSO0_SVW8_SK0_SKXCCM0_TLDS0_ULSGRO0_USL1_UIOFGRO0_USFGROn1_VSn1_VWA1_VWB1_WSGRA0_WSGRB0_WS32_WG32_4_1_WGM8_WGMXCC1_WGMXCCGn1
    SolutionIndex: 26
    SolutionNameMin: Cijk_Ailk_Bjlk_HSS_BH_Bias_S_HA_S_SAV_UserArgs_MT16x16x32_MI16x16x1_SN_LDSB0_AFC1_AFEM1_AFEM1_ASEM1_CLR1_CADS0_DTVA0_DTVB0_EPS0_FDSI0_GRPM1_GRVWA8_GRVWB8_GSU1_GSUAMB_GSUC0_GSUWGMRR0_GLS0_ISA1200_IU1_K1_LBSPPA256_LBSPPB256_LBSPPM0_LPA16_LPB16_LPM0_LRVW8_LWPMn1_MIAV1_MIWT1_1_MO40_NTn1_NTA0_NTB0_NTC0_NTD0_NTM0_NEPBS0_NLCA1_NLCB1_ONLL1_PGR2_PLR1_PKA0_SIA1_SS0_SU32_SUM0_SUS256_SPO0_SRVW0_SSO0_SVW8_SK0_SKXCCM0_TLDS0_ULSGRO0_USL1_UIOFGRO0_USFGROn1_VSn1_VWA1_VWB1_WSGRA0_WSGRB0_WS32_WG16_2_1_WGM8_WGMXCC1_WGMXCCGn1
    SolutionIndex: 27
    SolutionNameMin: Cijk_Ailk_Bjlk_HSS_BH_Bias_S_HA_S_SAV_UserArgs_MT64x64x32_MI16x16x1_SN_LDSB0_AFC1_AFEM1_AFEM1_ASEM1_CLR0_CADS0_DTVA0_DTVB0_EPS0_FDSI0_GRPM1_GRVWA8_GRVWB8_GSU1_GSUAMB_GSUC0_GSUWGMRR0_GLS0_ISA1200_IU1_K1_LBSPPA1024_LBSPPB1024_LBSPPM0_LPA16_LPB16_LPM0_LRVW8_LWPMn1_MIAV1_MIWT2_2_MO40_NTn1_NTA0_NTB0_NTC0_NTD0_NTM0_NEPBS0_NLCA1_NLCB1_ONLL1_PGR2_PLR1_PKA0_SIA1_SS0_SU32_SUM0_SUS256_SPO0_SRVW0_SSO0_SVW8_SK0_SKXCCM0_TLDS0_ULSGRO0_USL1_UIOFGRO0_USFGROn1_VSn1_VWA1_VWB1_WSGRA0_WSGRB0_WS32_WG32_4_1_WGM8_WGMXCC1_WGMXCCGn1
    SolutionIndex: 28
    SolutionNameMin: Cijk_Ailk_Bjlk_HSS_BH_Bias_S_HA_S_SAV_UserArgs_MT64x64x32_MI16x16x1_SN_LDSB0_AFC1_AFEM1_AFEM1_ASEM1_CLR1_CADS0_DTVA0_DTVB0_EPS0_FDSI0_GRPM1_GRVWA8_GRVWB8_GSU1_GSUAMB_GSUC0_GSUWGMRR0_GLS0_ISA1200_IU1_K1_LBSPPA1024_LBSPPB1024_LBSPPM0_LPA16_LPB16_LPM0_LRVW8_LWPMn1_MIAV1_MIWT2_2_MO40_NTn1_NTA0_NTB0_NTC0_NTD0_NTM0_NEPBS0_NLCA1_NLCB1_ONLL1_PGR2_PLR1_PKA0_SIA3_SS0_SU32_SUM0_SUS256_SPO0_SRVW0_SSO0_SVW8_SK0_SKXCCM0_TLDS0_ULSGRO0_USL1_UIOFGRO0_USFGROn1_VSn1_VWA1_VWB1_WSGRA0_WSGRB0_WS32_WG32_4_1_WGM8_WGMXCC1_WGMXCCGn1
    SolutionIndex: 29
    SolutionNameMin: Cijk_Ailk_Bjlk_HSS_BH_Bias_S_HA_S_SAV_UserArgs_MT64x64x32_MI16x16x1_SN_LDSB1_AFC1_AFEM1_AFEM1_ASEM1_CLR1_CADS0_DTVA0_DTVB0_EPS0_FDSI0_GRPM1_GRVWA8_GRVWB8_GSU1_GSUAMB_GSUC0_GSUWGMRR0_GLS0_ISA1200_IU1_K1_LBSPPA1024_LBSPPB1024_LBSPPM0_LPA16_LPB16_LPM0_LRVW8_LWPMn1_MIAV1_MIWT2_2_MO40_NTn1_NTA0_NTB0_NTC0_NTD0_NTM0_NEPBS0_NLCA1_NLCB1_ONLL1_PGR1_PLR1_PKA0_SIA3_SS0_SU32_SUM0_SUS256_SPO0_SRVW0_SSO0_SVW8_SK0_SKXCCM0_TLDS0_ULSGRO0_USL1_UIOFGRO0_USFGROn1_VSn1_VWA1_VWB1_WSGRA0_WSGRB0_WS32_WG32_4_1_WGM8_WGMXCC1_WGMXCCGn1
    SolutionIndex: 30
    SolutionNameMin: Cijk_Ailk_Bjlk_HSS_BH_Bias_S_HA_S_SAV_UserArgs_MT64x64x32_MI16x16x1_SN_LDSB0_AFC1_AFEM1_AFEM1_ASEM1_CLR0_CADS0_DTVA0_DTVB0_EPS1_FDSI0_GRPM1_GRVWA8_GRVWB8_GSU1_GSUAMB_GSUC0_GSUWGMRR0_GLS0_ISA1200_IU1_K1_LBSPPA1024_LBSPPB1024_LBSPPM0_LPA16_LPB16_LPM0_LRVW8_LWPMn1_MIAV1_MIWT2_2_MO40_NTn1_NTA0_NTB0_NTC0_NTD0_NTM0_NEPBS0_NLCA1_NLCB1_ONLL1_PGR1_PLR1_PKA0_SIA3_SS0_SU32_SUM0_SUS256_SPO0_SRVW0_SSO0_SVW8_SK0_SKXCCM0_TLDS0_ULSGRO0_USL1_UIOFGRO0_USFGROn1_VSn1_VWA1_VWB1_WSGRA0_WSGRB0_WS32_WG32_4_1_WGM8_WGMXCC1_WGMXCCGn1
    SolutionIndex: 31
    SolutionNameMin: Cijk_Ailk_Bjlk_HSS_BH_Bias_S_HA_S_SAV_UserArgs_MT64x64x32_MI16x16x1_SN_LDSB0_AFC1_AFEM1_AFEM1_ASEM1_CLR1_CADS0_DTVA0_DTVB0_EPS0_FDSI0_GRPM1_GRVWA8_GRVWB4_GSU1_GSUAMB_GSUC0_GSUWGMRR0_GLS0_ISA1200_IU1_K1_LBSPPA1024_LBSPPB1024_LBSPPM0_LPA16_LPB16_LPM0_LRVW8_LWPMn1_MIAV1_MIWT2_2_MO40_NTn1_NTA0_NTB0_NTC0_NTD0_NTM0_NEPBS0_NLCA1_NLCB1_ONLL1_PGR2_PLR1_PKA0_SIA1_SS0_SU32_SUM0_SUS256_SPO0_SRVW0_SSO0_SVW8_SK0_SKXCCM0_TLDS0_ULSGRO0_USL1_UIOFGRO0_USFGROn1_VSn1_VWA1_VWB1_WSGRA0_WSGRB0_WS32_WG32_4_1_WGM8_WGMXCC1_WGMXCCGn1
    SolutionIndex: 32
    SolutionNameMin: Cijk_Ailk_Bjlk_HSS_BH_Bias_S_HA_S_SAV_UserArgs_MT64x64x32_MI16x16x1_SN_LDSB1_AFC1_AFEM1_AFEM1_ASEM1_CLR1_CADS0_DTVA0_DTVB0_EPS0_FDSI0_GRPM1_GRVWA8_GRVWB4_GSU1_GSUAMB_GSUC0_GSUWGMRR0_GLS0_ISA1200_IU1_K1_LBSPPA1024_LBSPPB1024_LBSPPM0_LPA16_LPB16_LPM0_LRVW8_LWPMn1_MIAV1_MIWT2_2_MO40_NTn1_NTA0_NTB0_NTC0_NTD0_NTM0_NEPBS0_NLCA1_NLCB1_ONLL1_PGR2_PLR1_PKA0_SIA3_SS0_SU32_SUM0_SUS256_SPO0_SRVW0_SSO0_SVW8_SK0_SKXCCM0_TLDS0_ULSGRO0_USL1_UIOFGRO0_USFGROn1_VSn1_VWA1_VWB1_WSGRA0_WSGRB0_WS32_WG32_4_1_WGM8_WGMXCC1_WGMXCCGn1
    SolutionIndex: 33
    SolutionNameMin: Cijk_Ailk_Bjlk_HSS_BH_Bias_S_HA_S_SAV_UserArgs_MT64x64x32_MI16x16x1_SN_LDSB0_AFC1_AFEM1_AFEM1_ASEM1_CLR0_CADS0_DTVA0_DTVB0_EPS1_FDSI0_GRPM1_GRVWA4_GRVWB8_GSU1_GSUAMB_GSUC0_GSUWGMRR0_GLS0_ISA1200_IU1_K1_LBSPPA1024_LBSPPB1024_LBSPPM0_LPA16_LPB16_LPM0_LRVW8_LWPMn1_MIAV1_MIWT2_2_MO40_NTn1_NTA0_NTB0_NTC0_NTD0_NTM0_NEPBS0_NLCA1_NLCB1_ONLL1_PGR1_PLR1_PKA0_SIA3_SS0_SU32_SUM0_SUS256_SPO0_SRVW0_SSO0_SVW8_SK0_SKXCCM0_TLDS0_ULSGRO0_USL1_UIOFGRO0_USFGROn1_VSn1_VWA1_VWB1_WSGRA0_WSGRB0_WS32_WG32_4_1_WGM8_WGMXCC1_WGMXCCGn1
    SolutionIndex: 34
    SolutionNameMin: Cijk_Ailk_Bjlk_HSS_BH_Bias_S_HA_S_SAV_UserArgs_MT64x64x32_MI16x16x1_SN_LDSB0_AFC1_AFEM1_AFEM1_ASEM1_CLR0_CADS0_DTVA0_DTVB0_EPS0_FDSI0_GRPM1_GRVWA4_GRVWB8_GSU1_GSUAMB_GSUC0_GSUWGMRR0_GLS0_ISA1200_IU1_K1_LBSPPA1024_LBSPPB1024_LBSPPM0_LPA16_LPB16_LPM0_LRVW8_LWPMn1_MIAV1_MIWT2_2_MO40_NTn1_NTA0_NTB0_NTC0_NTD0_NTM0_NEPBS0_NLCA1_NLCB1_ONLL1_PGR2_PLR1_PKA0_SIA3_SS0_SU32_SUM0_SUS256_SPO0_SRVW0_SSO0_SVW8_SK0_SKXCCM0_TLDS0_ULSGRO0_USL1_UIOFGRO0_USFGROn1_VSn1_VWA1_VWB1_WSGRA0_WSGRB0_WS32_WG32_4_1_WGM8_WGMXCC1_WGMXCCGn1
    SolutionIndex: 35
    SolutionNameMin: Cijk_Ailk_Bjlk_HSS_BH_Bias_S_HA_S_SAV_UserArgs_MT64x64x32_MI16x16x1_SN_LDSB0_AFC1_AFEM1_AFEM1_ASEM1_CLR0_CADS0_DTVA0_DTVB0_EPS0_FDSI0_GRPM1_GRVWA8_GRVWB8_GSU1_GSUAMB_GSUC0_GSUWGMRR0_GLS0_ISA1200_IU1_K1_LBSPPA1024_LBSPPB1024_LBSPPM0_LPA16_LPB16_LPM0_LRVW8_LWPMn1_MIAV1_MIWT2_2_MO40_NTn1_NTA0_NTB0_NTC0_NTD0_NTM0_NEPBS0_NLCA1_NLCB1_ONLL1_PGR2_PLR0_PKA0_SIA1_SS0_SU32_SUM0_SUS256_SPO0_SRVW0_SSO0_SVW8_SK0_SKXCCM0_TLDS0_ULSGRO0_USL1_UIOFGRO0_USFGROn1_VSn1_VWA1_VWB1_WSGRA0_WSGRB0_WS32_WG32_4_1_WGM8_WGMXCC1_WGMXCCGn1
    SolutionIndex: 36
    SolutionNameMin: Cijk_Ailk_Bjlk_HSS_BH_Bias_S_HA_S_SAV_UserArgs_MT64x64x32_MI16x16x1_SN_LDSB0_AFC1_AFEM1_AFEM1_ASEM1_CLR1_CADS0_DTVA0_DTVB0_EPS0_FDSI0_GRPM1_GRVWA8_GRVWB8_GSU1_GSUAMB_GSUC0_GSUWGMRR0_GLS0_ISA1200_IU1_K1_LBSPPA1024_LBSPPB1024_LBSPPM0_LPA16_LPB16_LPM0_LRVW8_LWPMn1_MIAV1_MIWT2_2_MO40_NTn1_NTA0_NTB0_NTC0_NTD0_NTM0_NEPBS0_NLCA1_NLCB1_ONLL1_PGR1_PLR1_PKA0_SIA1_SS0_SU32_SUM0_SUS256_SPO0_SRVW0_SSO0_SVW8_SK0_SKXCCM0_TLDS0_ULSGRO0_USL1_UIOFGRO0_USFGROn1_VSn1_VWA1_VWB1_WSGRA0_WSGRB0_WS32_WG32_4_1_WGM8_WGMXCC1_WGMXCCGn1
    SolutionIndex: 37
    SolutionNameMin: Cijk_Ailk_Bjlk_HSS_BH_Bias_S_HA_S_SAV_UserArgs_MT64x64x32_MI16x16x1_SN_LDSB0_AFC1_AFEM1_AFEM1_ASEM1_CLR0_CADS0_DTVA0_DTVB0_EPS0_FDSI0_GRPM1_GRVWA8_GRVWB4_GSU1_GSUAMB_GSUC0_GSUWGMRR0_GLS0_ISA1200_IU1_K1_LBSPPA1024_LBSPPB1024_LBSPPM0_LPA16_LPB16_LPM0_LRVW8_LWPMn1_MIAV1_MIWT2_2_MO40_NTn1_NTA0_NTB0_NTC0_NTD0_NTM0_NEPBS0_NLCA1_NLCB1_ONLL1_PGR2_PLR1_PKA0_SIA1_SS0_SU32_SUM0_SUS256_SPO0_SRVW0_SSO0_SVW8_SK0_SKXCCM0_TLDS0_ULSGRO0_USL1_UIOFGRO0_USFGROn1_VSn1_VWA1_VWB1_WSGRA0_WSGRB0_WS32_WG32_4_1_WGM8_WGMXCC1_WGMXCCGn1
    SolutionIndex: 38
    SolutionNameMin: Cijk_Ailk_Bjlk_HSS_BH_Bias_S_HA_S_SAV_UserArgs_MT64x64x32_MI16x16x1_SN_LDSB1_AFC1_AFEM1_AFEM1_ASEM1_CLR0_CADS0_DTVA0_DTVB0_EPS1_FDSI0_GRPM1_GRVWA8_GRVWB8_GSU1_GSUAMB_GSUC0_GSUWGMRR0_GLS0_ISA1200_IU1_K1_LBSPPA1024_LBSPPB1024_LBSPPM0_LPA16_LPB16_LPM0_LRVW8_LWPMn1_MIAV1_MIWT2_2_MO40_NTn1_NTA0_NTB0_NTC0_NTD0_NTM0_NEPBS0_NLCA1_NLCB1_ONLL1_PGR1_PLR1_PKA0_SIA3_SS0_SU32_SUM0_SUS256_SPO0_SRVW0_SSO0_SVW8_SK0_SKXCCM0_TLDS0_ULSGRO0_USL1_UIOFGRO0_USFGROn1_VSn1_VWA1_VWB1_WSGRA0_WSGRB0_WS32_WG32_4_1_WGM8_WGMXCC1_WGMXCCGn1
    SolutionIndex: 39
    SolutionNameMin: Cijk_Ailk_Bjlk_HSS_BH_Bias_S_HA_S_SAV_UserArgs_MT64x64x32_MI16x16x1_SN_LDSB0_AFC1_AFEM1_AFEM1_ASEM1_CLR0_CADS0_DTVA0_DTVB0_EPS0_FDSI0_GRPM1_GRVWA4_GRVWB8_GSU1_GSUAMB_GSUC0_GSUWGMRR0_GLS0_ISA1200_IU1_K1_LBSPPA1024_LBSPPB1024_LBSPPM0_LPA16_LPB16_LPM0_LRVW8_LWPMn1_MIAV1_MIWT2_2_MO40_NTn1_NTA0_NTB0_NTC0_NTD0_NTM0_NEPBS0_NLCA1_NLCB1_ONLL1_PGR2_PLR1_PKA0_SIA1_SS0_SU32_SUM0_SUS256_SPO0_SRVW0_SSO0_SVW8_SK0_SKXCCM0_TLDS0_ULSGRO0_USL1_UIOFGRO0_USFGROn1_VSn1_VWA1_VWB1_WSGRA0_WSGRB0_WS32_WG32_4_1_WGM8_WGMXCC1_WGMXCCGn1
    SolutionIndex: 40
    SolutionNameMin: Cijk_Ailk_Bjlk_HSS_BH_Bias_S_HA_S_SAV_UserArgs_MT64x64x32_MI16x16x1_SN_LDSB0_AFC1_AFEM1_AFEM1_ASEM1_CLR0_CADS0_DTVA0_DTVB0_EPS0_FDSI0_GRPM1_GRVWA4_GRVWB4_GSU1_GSUAMB_GSUC0_GSUWGMRR0_GLS0_ISA1200_IU1_K1_LBSPPA1024_LBSPPB1024_LBSPPM0_LPA16_LPB16_LPM0_LRVW8_LWPMn1_MIAV1_MIWT2_2_MO40_NTn1_NTA0_NTB0_NTC0_NTD0_NTM0_NEPBS0_NLCA1_NLCB1_ONLL1_PGR2_PLR1_PKA0_SIA1_SS0_SU32_SUM0_SUS256_SPO0_SRVW0_SSO0_SVW8_SK0_SKXCCM0_TLDS0_ULSGRO0_USL1_UIOFGRO0_USFGROn1_VSn1_VWA1_VWB1_WSGRA0_WSGRB0_WS32_WG32_4_1_WGM8_WGMXCC1_WGMXCCGn1
    SolutionIndex: 41
    SolutionNameMin: Cijk_Ailk_Bjlk_HSS_BH_Bias_S_HA_S_SAV_UserArgs_MT64x64x32_MI16x16x1_SN_LDSB1_AFC1_AFEM1_AFEM1_ASEM1_CLR0_CADS0_DTVA0_DTVB0_EPS0_FDSI0_GRPM1_GRVWA8_GRVWB8_GSU1_GSUAMB_GSUC0_GSUWGMRR0_GLS0_ISA1200_IU1_K1_LBSPPA1024_LBSPPB1024_LBSPPM0_LPA16_LPB16_LPM0_LRVW8_LWPMn1_MIAV1_MIWT2_2_MO40_NTn1_NTA0_NTB0_NTC0_NTD0_NTM0_NEPBS0_NLCA1_NLCB1_ONLL1_PGR2_PLR1_PKA0_SIA3_SS0_SU32_SUM0_SUS256_SPO0_SRVW0_SSO0_SVW8_SK0_SKXCCM0_TLDS0_ULSGRO0_USL1_UIOFGRO0_USFGROn1_VSn1_VWA1_VWB1_WSGRA0_WSGRB0_WS32_WG32_4_1_WGM8_WGMXCC1_WGMXCCGn1
    SolutionIndex: 42
    SolutionNameMin: Cijk_Ailk_Bjlk_HSS_BH_Bias_S_HA_S_SAV_UserArgs_MT64x64x32_MI16x16x1_SN_LDSB1_AFC1_AFEM1_AFEM1_ASEM1_CLR0_CADS0_DTVA0_DTVB0_EPS0_FDSI0_GRPM1_GRVWA8_GRVWB8_GSU1_GSUAMB_GSUC0_GSUWGMRR0_GLS0_ISA1200_IU1_K1_LBSPPA1024_LBSPPB1024_LBSPPM0_LPA16_LPB16_LPM0_LRVW8_LWPMn1_MIAV1_MIWT2_2_MO40_NTn1_NTA0_NTB0_NTC0_NTD0_NTM0_NEPBS0_NLCA1_NLCB1_ONLL1_PGR1_PLR1_PKA0_SIA3_SS0_SU32_SUM0_SUS256_SPO0_SRVW0_SSO0_SVW8_SK0_SKXCCM0_TLDS0_ULSGRO0_USL1_UIOFGRO0_USFGROn1_VSn1_VWA1_VWB1_WSGRA0_WSGRB0_WS32_WG32_4_1_WGM8_WGMXCC1_WGMXCCGn1
    SolutionIndex: 43
    SolutionNameMin: Cijk_Ailk_Bjlk_HSS_BH_Bias_S_HA_S_SAV_UserArgs_MT64x64x32_MI16x16x1_SN_LDSB1_AFC1_AFEM1_AFEM1_ASEM1_CLR1_CADS0_DTVA0_DTVB0_EPS1_FDSI0_GRPM1_GRVWA8_GRVWB8_GSU1_GSUAMB_GSUC0_GSUWGMRR0_GLS0_ISA1200_IU1_K1_LBSPPA1024_LBSPPB1024_LBSPPM0_LPA16_LPB16_LPM0_LRVW8_LWPMn1_MIAV1_MIWT2_2_MO40_NTn1_NTA0_NTB0_NTC0_NTD0_NTM0_NEPBS0_NLCA1_NLCB1_ONLL1_PGR1_PLR1_PKA0_SIA3_SS0_SU32_SUM0_SUS256_SPO0_SRVW0_SSO0_SVW8_SK0_SKXCCM0_TLDS0_ULSGRO0_USL1_UIOFGRO0_USFGROn1_VSn1_VWA1_VWB1_WSGRA0_WSGRB0_WS32_WG32_4_1_WGM8_WGMXCC1_WGMXCCGn1
    SolutionIndex: 44
    SolutionNameMin: Cijk_Ailk_Bjlk_HSS_BH_Bias_S_HA_S_SAV_UserArgs_MT64x64x32_MI16x16x1_SN_LDSB1_AFC1_AFEM1_AFEM1_ASEM1_CLR1_CADS0_DTVA0_DTVB0_EPS0_FDSI0_GRPM1_GRVWA8_GRVWB8_GSU1_GSUAMB_GSUC0_GSUWGMRR0_GLS0_ISA1200_IU1_K1_LBSPPA1024_LBSPPB1024_LBSPPM0_LPA16_LPB16_LPM0_LRVW8_LWPMn1_MIAV1_MIWT2_2_MO40_NTn1_NTA0_NTB0_NTC0_NTD0_NTM0_NEPBS0_NLCA1_NLCB1_ONLL1_PGR2_PLR0_PKA0_SIA3_SS0_SU32_SUM0_SUS256_SPO0_SRVW0_SSO0_SVW8_SK0_SKXCCM0_TLDS0_ULSGRO0_USL1_UIOFGRO0_USFGROn1_VSn1_VWA1_VWB1_WSGRA0_WSGRB0_WS32_WG32_4_1_WGM8_WGMXCC1_WGMXCCGn1
    SolutionIndex: 45
    SolutionNameMin: Cijk_Ailk_Bjlk_HSS_BH_Bias_S_HA_S_SAV_UserArgs_MT64x64x32_MI16x16x1_SN_LDSB1_AFC1_AFEM1_AFEM1_ASEM1_CLR1_CADS0_DTVA0_DTVB0_EPS0_FDSI0_GRPM1_GRVWA8_GRVWB8_GSU1_GSUAMB_GSUC0_GSUWGMRR0_GLS0_ISA1200_IU1_K1_LBSPPA1024_LBSPPB1024_LBSPPM0_LPA16_LPB16_LPM0_LRVW8_LWPMn1_MIAV1_MIWT2_2_MO40_NTn1_NTA0_NTB0_NTC0_NTD0_NTM0_NEPBS0_NLCA1_NLCB1_ONLL1_PGR1_PLR0_PKA0_SIA3_SS0_SU32_SUM0_SUS256_SPO0_SRVW0_SSO0_SVW8_SK0_SKXCCM0_TLDS0_ULSGRO0_USL1_UIOFGRO0_USFGROn1_VSn1_VWA1_VWB1_WSGRA0_WSGRB0_WS32_WG32_4_1_WGM8_WGMXCC1_WGMXCCGn1
    SolutionIndex: 46
    SolutionNameMin: Cijk_Ailk_Bjlk_HSS_BH_Bias_S_HA_S_SAV_UserArgs_MT64x64x32_MI16x16x1_SN_LDSB1_AFC1_AFEM1_AFEM1_ASEM1_CLR1_CADS0_DTVA0_DTVB0_EPS0_FDSI0_GRPM1_GRVWA1_GRVWB1_GSU1_GSUAMB_GSUC0_GSUWGMRR0_GLS0_ISA1200_IU1_K1_LBSPPA1024_LBSPPB1024_LBSPPM0_LPA16_LPB16_LPM0_LRVW8_LWPMn1_MIAV1_MIWT2_2_MO40_NTn1_NTA0_NTB0_NTC0_NTD0_NTM0_NEPBS0_NLCA1_NLCB1_ONLL1_PGR2_PLR0_PKA0_SIA3_SS0_SU32_SUM0_SUS256_SPO0_SRVW0_SSO0_SVW8_SK0_SKXCCM0_TLDS0_ULSGRO0_USL1_UIOFGRO0_USFGROn1_VSn1_VWA1_VWB1_WSGRA0_WSGRB0_WS32_WG32_4_1_WGM8_WGMXCC1_WGMXCCGn1
    SolutionIndex: 47
    SolutionNameMin: Cijk_Ailk_Bjlk_HSS_BH_Bias_S_HA_S_SAV_UserArgs_MT64x64x32_MI16x16x1_SN_LDSB1_AFC1_AFEM1_AFEM1_ASEM1_CLR1_CADS0_DTVA0_DTVB0_EPS1_FDSI0_GRPM1_GRVWA8_GRVWB8_GSU1_GSUAMB_GSUC0_GSUWGMRR0_GLS0_ISA1200_IU1_K1_LBSPPA1024_LBSPPB1024_LBSPPM0_LPA16_LPB16_LPM0_LRVW8_LWPMn1_MIAV1_MIWT2_2_MO40_NTn1_NTA0_NTB0_NTC0_NTD0_NTM0_NEPBS0_NLCA1_NLCB1_ONLL1_PGR1_PLR0_PKA0_SIA3_SS0_SU32_SUM0_SUS256_SPO0_SRVW0_SSO0_SVW8_SK0_SKXCCM0_TLDS0_ULSGRO0_USL1_UIOFGRO0_USFGROn1_VSn1_VWA1_VWB1_WSGRA0_WSGRB0_WS32_WG32_4_1_WGM8_WGMXCC1_WGMXCCGn1
    SolutionIndex: 48
    SolutionNameMin: Cijk_Ailk_Bjlk_HSS_BH_Bias_S_HA_S_SAV_UserArgs_MT64x64x32_MI16x16x1_SN_LDSB1_AFC1_AFEM1_AFEM1_ASEM1_CLR1_CADS0_DTVA0_DTVB0_EPS0_FDSI0_GRPM1_GRVWA8_GRVWB8_GSU1_GSUAMB_GSUC0_GSUWGMRR0_GLS0_ISA1200_IU1_K1_LBSPPA1024_LBSPPB1024_LBSPPM0_LPA16_LPB16_LPM0_LRVW8_LWPMn1_MIAV1_MIWT2_2_MO40_NTn1_NTA0_NTB0_NTC0_NTD0_NTM0_NEPBS0_NLCA1_NLCB1_ONLL1_PGR2_PLR1_PKA0_SIA3_SS0_SU32_SUM0_SUS256_SPO0_SRVW0_SSO0_SVW8_SK0_SKXCCM0_TLDS0_ULSGRO0_USL1_UIOFGRO0_USFGROn1_VSn1_VWA1_VWB1_WSGRA0_WSGRB0_WS32_WG32_4_1_WGM8_WGMXCC1_WGMXCCGn1
    SolutionIndex: 49
    SolutionNameMin: Cijk_Ailk_Bjlk_HSS_BH_Bias_S_HA_S_SAV_UserArgs_MT64x64x32_MI16x16x1_SN_LDSB1_AFC1_AFEM1_AFEM1_ASEM1_CLR1_CADS0_DTVA0_DTVB0_EPS1_FDSI0_GRPM1_GRVWA1_GRVWB1_GSU1_GSUAMB_GSUC0_GSUWGMRR0_GLS0_ISA1200_IU1_K1_LBSPPA1024_LBSPPB1024_LBSPPM0_LPA16_LPB16_LPM0_LRVW8_LWPMn1_MIAV1_MIWT2_2_MO40_NTn1_NTA0_NTB0_NTC0_NTD0_NTM0_NEPBS0_NLCA1_NLCB1_ONLL1_PGR1_PLR0_PKA0_SIA3_SS0_SU32_SUM0_SUS256_SPO0_SRVW0_SSO0_SVW8_SK0_SKXCCM0_TLDS0_ULSGRO0_USL1_UIOFGRO0_USFGROn1_VSn1_VWA1_VWB1_WSGRA0_WSGRB0_WS32_WG32_4_1_WGM8_WGMXCC1_WGMXCCGn1
    SolutionIndex: 50
    SolutionNameMin: Cijk_Ailk_Bjlk_HSS_BH_Bias_S_HA_S_SAV_UserArgs_MT64x64x32_MI16x16x1_SN_LDSB1_AFC1_AFEM1_AFEM1_ASEM1_CLR0_CADS0_DTVA0_DTVB0_EPS0_FDSI0_GRPM1_GRVWA1_GRVWB1_GSU1_GSUAMB_GSUC0_GSUWGMRR0_GLS0_ISA1200_IU1_K1_LBSPPA1024_LBSPPB1024_LBSPPM0_LPA16_LPB16_LPM0_LRVW8_LWPMn1_MIAV1_MIWT2_2_MO40_NTn1_NTA0_NTB0_NTC0_NTD0_NTM0_NEPBS0_NLCA1_NLCB1_ONLL1_PGR2_PLR1_PKA0_SIA3_SS0_SU32_SUM0_SUS256_SPO0_SRVW0_SSO0_SVW8_SK0_SKXCCM0_TLDS0_ULSGRO0_USL1_UIOFGRO0_USFGROn1_VSn1_VWA1_VWB1_WSGRA0_WSGRB0_WS32_WG32_4_1_WGM8_WGMXCC1_WGMXCCGn1
    SolutionIndex: 51
    SolutionNameMin: Cijk_Ailk_Bjlk_HSS_BH_Bias_S_HA_S_SAV_UserArgs_MT64x64x32_MI16x16x1_SN_LDSB1_AFC1_AFEM1_AFEM1_ASEM1_CLR1_CADS0_DTVA0_DTVB0_EPS0_FDSI0_GRPM1_GRVWA1_GRVWB1_GSU1_GSUAMB_GSUC0_GSUWGMRR0_GLS0_ISA1200_IU1_K1_LBSPPA1024_LBSPPB1024_LBSPPM0_LPA16_LPB16_LPM0_LRVW8_LWPMn1_MIAV1_MIWT2_2_MO40_NTn1_NTA0_NTB0_NTC0_NTD0_NTM0_NEPBS0_NLCA1_NLCB1_ONLL1_PGR1_PLR0_PKA0_SIA3_SS0_SU32_SUM0_SUS256_SPO0_SRVW0_SSO0_SVW8_SK0_SKXCCM0_TLDS0_ULSGRO0_USL1_UIOFGRO0_USFGROn1_VSn1_VWA1_VWB1_WSGRA0_WSGRB0_WS32_WG32_4_1_WGM8_WGMXCC1_WGMXCCGn1
    SolutionIndex: 52
    SolutionNameMin: Cijk_Ailk_Bjlk_HSS_BH_Bias_S_HA_S_SAV_UserArgs_MT128x128x32_MI16x16x1_SN_LDSB0_AFC1_AFEM1_AFEM1_ASEM1_CLR0_CADS0_DTVA0_DTVB0_EPS0_FDSI0_GRPM1_GRVWA4_GRVWB8_GSU1_GSUAMB_GSUC0_GSUWGMRR0_GLS0_ISA1200_IU1_K1_LBSPPA2048_LBSPPB2048_LBSPPM0_LPA0_LPB0_LPM0_LRVW8_LWPMn1_MIAV1_MIWT4_4_MO40_NTn1_NTA0_NTB0_NTC0_NTD0_NTM0_NEPBS0_NLCA1_NLCB1_ONLL1_PGR1_PLR0_PKA0_SIA1_SS1_SU32_SUM0_SUS256_SPO0_SRVW0_SSO0_SVW4_SK0_SKXCCM0_TLDS0_ULSGRO0_USL1_UIOFGRO0_USFGROn1_VSn1_VWA4_VWB4_WSGRA0_WSGRB0_WS32_WG32_4_1_WGM8_WGMXCC1_WGMXCCGn1
    SolutionIndex: 53
    SolutionNameMin: Cijk_Ailk_Bjlk_HSS_BH_Bias_S_HA_S_SAV_UserArgs_MT128x128x32_MI16x16x1_SN_LDSB0_AFC1_AFEM1_AFEM1_ASEM1_CLR0_CADS0_DTVA0_DTVB0_EPS0_FDSI0_GRPM1_GRVWA8_GRVWB4_GSU1_GSUAMB_GSUC0_GSUWGMRR0_GLS0_ISA1200_IU1_K1_LBSPPA2048_LBSPPB2048_LBSPPM0_LPA0_LPB0_LPM0_LRVW8_LWPMn1_MIAV1_MIWT4_4_MO40_NTn1_NTA0_NTB0_NTC0_NTD0_NTM0_NEPBS0_NLCA1_NLCB1_ONLL1_PGR1_PLR0_PKA0_SIA1_SS1_SU32_SUM0_SUS256_SPO0_SRVW0_SSO0_SVW4_SK0_SKXCCM0_TLDS0_ULSGRO0_USL1_UIOFGRO0_USFGROn1_VSn1_VWA4_VWB4_WSGRA0_WSGRB0_WS32_WG32_4_1_WGM8_WGMXCC1_WGMXCCGn1
    SolutionIndex: 54
    SolutionNameMin: Cijk_Ailk_Bjlk_HSS_BH_Bias_S_HA_S_SAV_UserArgs_MT128x128x32_MI16x16x1_SN_LDSB0_AFC1_AFEM1_AFEM1_ASEM1_CLR0_CADS0_DTVA0_DTVB0_EPS1_FDSI0_GRPM1_GRVWA8_GRVWB8_GSU1_GSUAMB_GSUC0_GSUWGMRR0_GLS0_ISA1200_IU1_K1_LBSPPA2048_LBSPPB2048_LBSPPM0_LPA0_LPB0_LPM0_LRVW8_LWPMn1_MIAV1_MIWT4_4_MO40_NTn1_NTA0_NTB0_NTC0_NTD0_NTM0_NEPBS0_NLCA1_NLCB1_ONLL1_PGR1_PLR0_PKA0_SIA1_SS1_SU32_SUM0_SUS256_SPO0_SRVW0_SSO0_SVW4_SK0_SKXCCM0_TLDS0_ULSGRO0_USL1_UIOFGRO0_USFGROn1_VSn1_VWA4_VWB4_WSGRA0_WSGRB0_WS32_WG32_4_1_WGM8_WGMXCC1_WGMXCCGn1
    SolutionIndex: 55
    SolutionNameMin: Cijk_Ailk_Bjlk_HSS_BH_Bias_S_HA_S_SAV_UserArgs_MT128x128x32_MI16x16x1_SN_LDSB0_AFC1_AFEM1_AFEM1_ASEM1_CLR0_CADS0_DTVA0_DTVB0_EPS0_FDSI0_GRPM1_GRVWA8_GRVWB8_GSU1_GSUAMB_GSUC0_GSUWGMRR0_GLS0_ISA1200_IU1_K1_LBSPPA2048_LBSPPB2048_LBSPPM0_LPA0_LPB0_LPM0_LRVW8_LWPMn1_MIAV1_MIWT4_4_MO40_NTn1_NTA0_NTB0_NTC0_NTD0_NTM0_NEPBS0_NLCA1_NLCB1_ONLL1_PGR1_PLR0_PKA0_SIA1_SS1_SU32_SUM0_SUS256_SPO0_SRVW0_SSO0_SVW4_SK0_SKXCCM0_TLDS0_ULSGRO0_USL1_UIOFGRO0_USFGROn1_VSn1_VWA4_VWB4_WSGRA0_WSGRB0_WS32_WG32_4_1_WGM8_WGMXCC1_WGMXCCGn1
    SolutionIndex: 56
    SolutionNameMin: Cijk_Ailk_Bjlk_HSS_BH_Bias_S_HA_S_SAV_UserArgs_MT128x128x32_MI16x16x1_SN_LDSB0_AFC1_AFEM1_AFEM1_ASEM1_CLR0_CADS0_DTVA0_DTVB0_EPS1_FDSI0_GRPM1_GRVWA8_GRVWB8_GSU1_GSUAMB_GSUC0_GSUWGMRR0_GLS0_ISA1200_IU1_K1_LBSPPA2048_LBSPPB2048_LBSPPM0_LPA0_LPB0_LPM0_LRVW8_LWPMn1_MIAV1_MIWT4_4_MO40_NTn1_NTA0_NTB0_NTC0_NTD0_NTM0_NEPBS0_NLCA1_NLCB1_ONLL1_PGR1_PLR0_PKA0_SIA3_SS1_SU32_SUM0_SUS256_SPO0_SRVW0_SSO0_SVW4_SK0_SKXCCM0_TLDS0_ULSGRO0_USL1_UIOFGRO0_USFGROn1_VSn1_VWA4_VWB4_WSGRA0_WSGRB0_WS32_WG32_4_1_WGM8_WGMXCC1_WGMXCCGn1
    SolutionIndex: 57
    SolutionNameMin: Cijk_Ailk_Bjlk_HSS_BH_Bias_S_HA_S_SAV_UserArgs_MT64x64x32_MI16x16x1_SN_LDSB1_AFC1_AFEM1_AFEM1_ASEM1_CLR0_CADS0_DTVA0_DTVB0_EPS1_FDSI0_GRPM1_GRVWA1_GRVWB1_GSU1_GSUAMB_GSUC0_GSUWGMRR0_GLS0_ISA1200_IU1_K1_LBSPPA1024_LBSPPB1024_LBSPPM0_LPA16_LPB16_LPM0_LRVW8_LWPMn1_MIAV1_MIWT2_2_MO40_NTn1_NTA0_NTB0_NTC0_NTD0_NTM0_NEPBS0_NLCA1_NLCB1_ONLL1_PGR1_PLR1_PKA0_SIA3_SS0_SU32_SUM0_SUS256_SPO0_SRVW0_SSO0_SVW8_SK0_SKXCCM0_TLDS0_ULSGRO0_USL1_UIOFGRO0_USFGROn1_VSn1_VWA1_VWB1_WSGRA0_WSGRB0_WS32_WG32_4_1_WGM8_WGMXCC1_WGMXCCGn1
    SolutionIndex: 58
    SolutionNameMin: Cijk_Ailk_Bjlk_HSS_BH_Bias_S_HA_S_SAV_UserArgs_MT128x128x32_MI16x16x1_SN_LDSB0_AFC1_AFEM1_AFEM1_ASEM1_CLR0_CADS0_DTVA0_DTVB0_EPS0_FDSI0_GRPM1_GRVWA4_GRVWB8_GSU1_GSUAMB_GSUC0_GSUWGMRR0_GLS0_ISA1200_IU1_K1_LBSPPA2048_LBSPPB2048_LBSPPM0_LPA0_LPB0_LPM0_LRVW8_LWPMn1_MIAV1_MIWT4_4_MO40_NTn1_NTA0_NTB0_NTC0_NTD0_NTM0_NEPBS0_NLCA1_NLCB1_ONLL1_PGR1_PLR0_PKA0_SIA3_SS1_SU32_SUM0_SUS256_SPO0_SRVW0_SSO0_SVW4_SK0_SKXCCM0_TLDS0_ULSGRO0_USL1_UIOFGRO0_USFGROn1_VSn1_VWA4_VWB4_WSGRA0_WSGRB0_WS32_WG32_4_1_WGM8_WGMXCC1_WGMXCCGn1
    SolutionIndex: 59
    SolutionNameMin: Cijk_Ailk_Bjlk_HSS_BH_Bias_S_HA_S_SAV_UserArgs_MT128x128x32_MI16x16x1_SN_LDSB0_AFC1_AFEM1_AFEM1_ASEM1_CLR0_CADS0_DTVA0_DTVB0_EPS0_FDSI0_GRPM1_GRVWA8_GRVWB8_GSU1_GSUAMB_GSUC0_GSUWGMRR0_GLS0_ISA1200_IU1_K1_LBSPPA2048_LBSPPB2048_LBSPPM0_LPA0_LPB0_LPM0_LRVW8_LWPMn1_MIAV1_MIWT4_4_MO40_NTn1_NTA0_NTB0_NTC0_NTD0_NTM0_NEPBS0_NLCA1_NLCB1_ONLL1_PGR1_PLR0_PKA0_SIA3_SS1_SU32_SUM0_SUS256_SPO0_SRVW0_SSO0_SVW4_SK0_SKXCCM0_TLDS0_ULSGRO0_USL1_UIOFGRO0_USFGROn1_VSn1_VWA4_VWB4_WSGRA0_WSGRB0_WS32_WG32_4_1_WGM8_WGMXCC1_WGMXCCGn1
    SolutionIndex: 60
    SolutionNameMin: Cijk_Ailk_Bjlk_HSS_BH_Bias_S_HA_S_SAV_UserArgs_MT64x64x32_MI16x16x1_SN_LDSB1_AFC1_AFEM1_AFEM1_ASEM1_CLR1_CADS0_DTVA0_DTVB0_EPS0_FDSI0_GRPM1_GRVWA1_GRVWB1_GSU1_GSUAMB_GSUC0_GSUWGMRR0_GLS0_ISA1200_IU1_K1_LBSPPA1024_LBSPPB1024_LBSPPM0_LPA16_LPB16_LPM0_LRVW8_LWPMn1_MIAV1_MIWT2_2_MO40_NTn1_NTA0_NTB0_NTC0_NTD0_NTM0_NEPBS0_NLCA1_NLCB1_ONLL1_PGR1_PLR1_PKA0_SIA3_SS0_SU32_SUM0_SUS256_SPO0_SRVW0_SSO0_SVW8_SK0_SKXCCM0_TLDS0_ULSGRO0_USL1_UIOFGRO0_USFGROn1_VSn1_VWA1_VWB1_WSGRA0_WSGRB0_WS32_WG32_4_1_WGM8_WGMXCC1_WGMXCCGn1
    SolutionIndex: 61
    SolutionNameMin: Cijk_Ailk_Bjlk_HSS_BH_Bias_S_HA_S_SAV_UserArgs_MT64x64x32_MI16x16x1_SN_LDSB1_AFC1_AFEM1_AFEM1_ASEM1_CLR0_CADS0_DTVA0_DTVB0_EPS0_FDSI0_GRPM1_GRVWA1_GRVWB1_GSU1_GSUAMB_GSUC0_GSUWGMRR0_GLS0_ISA1200_IU1_K1_LBSPPA1024_LBSPPB1024_LBSPPM0_LPA16_LPB16_LPM0_LRVW8_LWPMn1_MIAV1_MIWT2_2_MO40_NTn1_NTA0_NTB0_NTC0_NTD0_NTM0_NEPBS0_NLCA1_NLCB1_ONLL1_PGR1_PLR1_PKA0_SIA3_SS0_SU32_SUM0_SUS256_SPO0_SRVW0_SSO0_SVW8_SK0_SKXCCM0_TLDS0_ULSGRO0_USL1_UIOFGRO0_USFGROn1_VSn1_VWA1_VWB1_WSGRA0_WSGRB0_WS32_WG32_4_1_WGM8_WGMXCC1_WGMXCCGn1
    SolutionIndex: 62
    SolutionNameMin: Cijk_Ailk_Bjlk_HSS_BH_Bias_S_HA_S_SAV_UserArgs_MT128x128x32_MI16x16x1_SN_LDSB0_AFC1_AFEM1_AFEM1_ASEM1_CLR0_CADS0_DTVA0_DTVB0_EPS0_FDSI0_GRPM1_GRVWA4_GRVWB8_GSU1_GSUAMB_GSUC0_GSUWGMRR0_GLS0_ISA1200_IU1_K1_LBSPPA2048_LBSPPB2048_LBSPPM0_LPA0_LPB0_LPM0_LRVW8_LWPMn1_MIAV1_MIWT4_4_MO40_NTn1_NTA0_NTB0_NTC0_NTD0_NTM0_NEPBS0_NLCA1_NLCB1_ONLL1_PGR2_PLR0_PKA0_SIA1_SS1_SU32_SUM0_SUS256_SPO0_SRVW0_SSO0_SVW4_SK0_SKXCCM0_TLDS0_ULSGRO0_USL1_UIOFGRO0_USFGROn1_VSn1_VWA4_VWB4_WSGRA0_WSGRB0_WS32_WG32_4_1_WGM8_WGMXCC1_WGMXCCGn1
    SolutionIndex: 63
    SolutionNameMin: Cijk_Ailk_Bjlk_HSS_BH_Bias_S_HA_S_SAV_UserArgs_MT128x128x32_MI16x16x1_SN_LDSB0_AFC1_AFEM1_AFEM1_ASEM1_CLR0_CADS0_DTVA0_DTVB0_EPS0_FDSI0_GRPM1_GRVWA8_GRVWB4_GSU1_GSUAMB_GSUC0_GSUWGMRR0_GLS0_ISA1200_IU1_K1_LBSPPA2048_LBSPPB2048_LBSPPM0_LPA0_LPB0_LPM0_LRVW8_LWPMn1_MIAV1_MIWT4_4_MO40_NTn1_NTA0_NTB0_NTC0_NTD0_NTM0_NEPBS0_NLCA1_NLCB1_ONLL1_PGR2_PLR0_PKA0_SIA1_SS1_SU32_SUM0_SUS256_SPO0_SRVW0_SSO0_SVW4_SK0_SKXCCM0_TLDS0_ULSGRO0_USL1_UIOFGRO0_USFGROn1_VSn1_VWA4_VWB4_WSGRA0_WSGRB0_WS32_WG32_4_1_WGM8_WGMXCC1_WGMXCCGn1
    SolutionIndex: 64
    SolutionNameMin: Cijk_Ailk_Bjlk_HSS_BH_Bias_S_HA_S_SAV_UserArgs_MT128x128x32_MI16x16x1_SN_LDSB0_AFC1_AFEM1_AFEM1_ASEM1_CLR0_CADS0_DTVA0_DTVB0_EPS0_FDSI0_GRPM1_GRVWA8_GRVWB8_GSU1_GSUAMB_GSUC0_GSUWGMRR0_GLS0_ISA1200_IU1_K1_LBSPPA2048_LBSPPB2048_LBSPPM0_LPA0_LPB0_LPM0_LRVW8_LWPMn1_MIAV1_MIWT4_4_MO40_NTn1_NTA0_NTB0_NTC0_NTD0_NTM0_NEPBS0_NLCA1_NLCB1_ONLL1_PGR2_PLR0_PKA0_SIA3_SS1_SU32_SUM0_SUS256_SPO0_SRVW0_SSO0_SVW4_SK0_SKXCCM0_TLDS0_ULSGRO0_USL1_UIOFGRO0_USFGROn1_VSn1_VWA4_VWB4_WSGRA0_WSGRB0_WS32_WG32_4_1_WGM8_WGMXCC1_WGMXCCGn1
    SolutionIndex: 65
    SolutionNameMin: Cijk_Ailk_Bjlk_HSS_BH_Bias_S_HA_S_SAV_UserArgs_MT64x64x32_MI16x16x1_SN_LDSB0_AFC1_AFEM1_AFEM1_ASEM1_CLR1_CADS0_DTVA0_DTVB0_EPS1_FDSI0_GRPM1_GRVWA8_GRVWB8_GSU1_GSUAMB_GSUC0_GSUWGMRR0_GLS0_ISA1200_IU1_K1_LBSPPA1024_LBSPPB1024_LBSPPM0_LPA16_LPB16_LPM0_LRVW8_LWPMn1_MIAV1_MIWT2_2_MO40_NTn1_NTA0_NTB0_NTC0_NTD0_NTM0_NEPBS0_NLCA1_NLCB1_ONLL1_PGR1_PLR1_PKA0_SIA1_SS0_SU32_SUM0_SUS256_SPO0_SRVW0_SSO0_SVW8_SK0_SKXCCM0_TLDS0_ULSGRO0_USL1_UIOFGRO0_USFGROn1_VSn1_VWA1_VWB1_WSGRA0_WSGRB0_WS32_WG32_4_1_WGM8_WGMXCC1_WGMXCCGn1
    SolutionIndex: 66
    SolutionNameMin: Cijk_Ailk_Bjlk_HSS_BH_Bias_S_HA_S_SAV_UserArgs_MT64x64x32_MI16x16x1_SN_LDSB0_AFC1_AFEM1_AFEM1_ASEM1_CLR1_CADS0_DTVA0_DTVB0_EPS1_FDSI0_GRPM1_GRVWA8_GRVWB4_GSU1_GSUAMB_GSUC0_GSUWGMRR0_GLS0_ISA1200_IU1_K1_LBSPPA1024_LBSPPB1024_LBSPPM0_LPA16_LPB16_LPM0_LRVW8_LWPMn1_MIAV1_MIWT2_2_MO40_NTn1_NTA0_NTB0_NTC0_NTD0_NTM0_NEPBS0_NLCA1_NLCB1_ONLL1_PGR1_PLR1_PKA0_SIA3_SS0_SU32_SUM0_SUS256_SPO0_SRVW0_SSO0_SVW8_SK0_SKXCCM0_TLDS0_ULSGRO0_USL1_UIOFGRO0_USFGROn1_VSn1_VWA1_VWB1_WSGRA0_WSGRB0_WS32_WG32_4_1_WGM8_WGMXCC1_WGMXCCGn1
    SolutionIndex: 67
    SolutionNameMin: Cijk_Ailk_Bjlk_HSS_BH_Bias_S_HA_S_SAV_UserArgs_MT64x64x32_MI16x16x1_SN_LDSB0_AFC1_AFEM1_AFEM1_ASEM1_CLR1_CADS0_DTVA0_DTVB0_EPS0_FDSI0_GRPM1_GRVWA4_GRVWB4_GSU1_GSUAMB_GSUC0_GSUWGMRR0_GLS0_ISA1200_IU1_K1_LBSPPA1024_LBSPPB1024_LBSPPM0_LPA16_LPB16_LPM0_LRVW8_LWPMn1_MIAV1_MIWT2_2_MO40_NTn1_NTA0_NTB0_NTC0_NTD0_NTM0_NEPBS0_NLCA1_NLCB1_ONLL1_PGR2_PLR1_PKA0_SIA1_SS0_SU32_SUM0_SUS256_SPO0_SRVW0_SSO0_SVW8_SK0_SKXCCM0_TLDS0_ULSGRO0_USL1_UIOFGRO0_USFGROn1_VSn1_VWA1_VWB1_WSGRA0_WSGRB0_WS32_WG32_4_1_WGM8_WGMXCC1_WGMXCCGn1
    SolutionIndex: 68
    SolutionNameMin: Cijk_Ailk_Bjlk_HSS_BH_Bias_S_HA_S_SAV_UserArgs_MT16x16x32_MI16x16x1_SN_LDSB0_AFC1_AFEM1_AFEM1_ASEM1_CLR0_CADS0_DTVA0_DTVB0_EPS0_FDSI0_GRPM1_GRVWA8_GRVWB8_GSU1_GSUAMB_GSUC0_GSUWGMRR0_GLS0_ISA1200_IU1_K1_LBSPPA256_LBSPPB256_LBSPPM0_LPA16_LPB16_LPM0_LRVW8_LWPMn1_MIAV1_MIWT1_1_MO40_NTn1_NTA0_NTB0_NTC0_NTD0_NTM0_NEPBS0_NLCA1_NLCB1_ONLL1_PGR2_PLR1_PKA0_SIA1_SS0_SU32_SUM0_SUS256_SPO0_SRVW0_SSO0_SVW8_SK0_SKXCCM0_TLDS0_ULSGRO0_USL1_UIOFGRO0_USFGROn1_VSn1_VWA1_VWB1_WSGRA0_WSGRB0_WS32_WG16_2_1_WGM8_WGMXCC1_WGMXCCGn1
    SolutionIndex: 69
    SolutionNameMin: Cijk_Ailk_Bjlk_HSS_BH_Bias_S_HA_S_SAV_UserArgs_MT64x64x32_MI16x16x1_SN_LDSB0_AFC1_AFEM1_AFEM1_ASEM1_CLR0_CADS0_DTVA0_DTVB0_EPS0_FDSI0_GRPM1_GRVWA8_GRVWB4_GSU1_GSUAMB_GSUC0_GSUWGMRR0_GLS0_ISA1200_IU1_K1_LBSPPA1024_LBSPPB1024_LBSPPM0_LPA16_LPB16_LPM0_LRVW8_LWPMn1_MIAV1_MIWT2_2_MO40_NTn1_NTA0_NTB0_NTC0_NTD0_NTM0_NEPBS0_NLCA1_NLCB1_ONLL1_PGR2_PLR1_PKA0_SIA3_SS0_SU32_SUM0_SUS256_SPO0_SRVW0_SSO0_SVW8_SK0_SKXCCM0_TLDS0_ULSGRO0_USL1_UIOFGRO0_USFGROn1_VSn1_VWA1_VWB1_WSGRA0_WSGRB0_WS32_WG32_4_1_WGM8_WGMXCC1_WGMXCCGn1
    SolutionIndex: 70
    SolutionNameMin: Cijk_Ailk_Bjlk_HSS_BH_Bias_S_HA_S_SAV_UserArgs_MT64x64x32_MI16x16x1_SN_LDSB1_AFC1_AFEM1_AFEM1_ASEM1_CLR0_CADS0_DTVA0_DTVB0_EPS0_FDSI0_GRPM1_GRVWA8_GRVWB4_GSU1_GSUAMB_GSUC0_GSUWGMRR0_GLS0_ISA1200_IU1_K1_LBSPPA1024_LBSPPB1024_LBSPPM0_LPA16_LPB16_LPM0_LRVW8_LWPMn1_MIAV1_MIWT2_2_MO40_NTn1_NTA0_NTB0_NTC0_NTD0_NTM0_NEPBS0_NLCA1_NLCB1_ONLL1_PGR2_PLR1_PKA0_SIA3_SS0_SU32_SUM0_SUS256_SPO0_SRVW0_SSO0_SVW8_SK0_SKXCCM0_TLDS0_ULSGRO0_USL1_UIOFGRO0_USFGROn1_VSn1_VWA1_VWB1_WSGRA0_WSGRB0_WS32_WG32_4_1_WGM8_WGMXCC1_WGMXCCGn1
    SolutionIndex: 71
    SolutionNameMin: Cijk_Ailk_Bjlk_HSS_BH_Bias_S_HA_S_SAV_UserArgs_MT64x64x32_MI16x16x1_SN_LDSB0_AFC1_AFEM1_AFEM1_ASEM1_CLR1_CADS0_DTVA0_DTVB0_EPS0_FDSI0_GRPM1_GRVWA8_GRVWB8_GSU1_GSUAMB_GSUC0_GSUWGMRR0_GLS0_ISA1200_IU1_K1_LBSPPA1024_LBSPPB1024_LBSPPM0_LPA16_LPB16_LPM0_LRVW8_LWPMn1_MIAV1_MIWT2_2_MO40_NTn1_NTA0_NTB0_NTC0_NTD0_NTM0_NEPBS0_NLCA1_NLCB1_ONLL1_PGR2_PLR1_PKA0_SIA3_SS1_SU32_SUM0_SUS256_SPO0_SRVW0_SSO0_SVW1_SK0_SKXCCM0_TLDS0_ULSGRO0_USL1_UIOFGRO0_USFGROn1_VSn1_VWA1_VWB1_WSGRA0_WSGRB0_WS32_WG32_4_1_WGM8_WGMXCC1_WGMXCCGn1
    SolutionIndex: 72
    SolutionNameMin: Cijk_Ailk_Bjlk_HSS_BH_Bias_S_HA_S_SAV_UserArgs_MT64x64x32_MI16x16x1_SN_LDSB0_AFC1_AFEM1_AFEM1_ASEM1_CLR1_CADS0_DTVA0_DTVB0_EPS0_FDSI0_GRPM1_GRVWA8_GRVWB4_GSU1_GSUAMB_GSUC0_GSUWGMRR0_GLS0_ISA1200_IU1_K1_LBSPPA1024_LBSPPB1024_LBSPPM0_LPA16_LPB16_LPM0_LRVW8_LWPMn1_MIAV1_MIWT2_2_MO40_NTn1_NTA0_NTB0_NTC0_NTD0_NTM0_NEPBS0_NLCA1_NLCB1_ONLL1_PGR2_PLR1_PKA0_SIA3_SS1_SU32_SUM0_SUS256_SPO0_SRVW0_SSO0_SVW1_SK0_SKXCCM0_TLDS0_ULSGRO0_USL1_UIOFGRO0_USFGROn1_VSn1_VWA1_VWB1_WSGRA0_WSGRB0_WS32_WG32_4_1_WGM8_WGMXCC1_WGMXCCGn1
    SolutionIndex: 73
    SolutionNameMin: Cijk_Ailk_Bjlk_HSS_BH_Bias_S_HA_S_SAV_UserArgs_MT64x64x32_MI16x16x1_SN_LDSB0_AFC1_AFEM1_AFEM1_ASEM1_CLR0_CADS0_DTVA0_DTVB0_EPS0_FDSI0_GRPM1_GRVWA8_GRVWB8_GSU1_GSUAMB_GSUC0_GSUWGMRR0_GLS0_ISA1200_IU1_K1_LBSPPA1024_LBSPPB1024_LBSPPM0_LPA16_LPB16_LPM0_LRVW8_LWPMn1_MIAV1_MIWT2_2_MO40_NTn1_NTA0_NTB0_NTC0_NTD0_NTM0_NEPBS0_NLCA1_NLCB1_ONLL1_PGR1_PLR1_PKA0_SIA1_SS0_SU32_SUM0_SUS256_SPO0_SRVW0_SSO0_SVW8_SK0_SKXCCM0_TLDS0_ULSGRO0_USL1_UIOFGRO0_USFGROn1_VSn1_VWA1_VWB1_WSGRA0_WSGRB0_WS32_WG32_4_1_WGM8_WGMXCC1_WGMXCCGn1
    SolutionIndex: 74
    SolutionNameMin: Cijk_Ailk_Bjlk_HSS_BH_Bias_S_HA_S_SAV_UserArgs_MT64x64x32_MI16x16x1_SN_LDSB0_AFC1_AFEM1_AFEM1_ASEM1_CLR0_CADS0_DTVA0_DTVB0_EPS0_FDSI0_GRPM1_GRVWA8_GRVWB8_GSU1_GSUAMB_GSUC0_GSUWGMRR0_GLS0_ISA1200_IU1_K1_LBSPPA1024_LBSPPB1024_LBSPPM0_LPA16_LPB16_LPM0_LRVW8_LWPMn1_MIAV1_MIWT2_2_MO40_NTn1_NTA0_NTB0_NTC0_NTD0_NTM0_NEPBS0_NLCA1_NLCB1_ONLL1_PGR2_PLR1_PKA0_SIA1_SS1_SU32_SUM0_SUS256_SPO0_SRVW0_SSO0_SVW1_SK0_SKXCCM0_TLDS0_ULSGRO0_USL1_UIOFGRO0_USFGROn1_VSn1_VWA1_VWB1_WSGRA0_WSGRB0_WS32_WG32_4_1_WGM8_WGMXCC1_WGMXCCGn1
    SolutionIndex: 75
    SolutionNameMin: Cijk_Ailk_Bjlk_HSS_BH_Bias_S_HA_S_SAV_UserArgs_MT64x64x32_MI16x16x1_SN_LDSB0_AFC1_AFEM1_AFEM1_ASEM1_CLR0_CADS0_DTVA0_DTVB0_EPS0_FDSI0_GRPM1_GRVWA8_GRVWB4_GSU1_GSUAMB_GSUC0_GSUWGMRR0_GLS0_ISA1200_IU1_K1_LBSPPA1024_LBSPPB1024_LBSPPM0_LPA16_LPB16_LPM0_LRVW8_LWPMn1_MIAV1_MIWT2_2_MO40_NTn1_NTA0_NTB0_NTC0_NTD0_NTM0_NEPBS0_NLCA1_NLCB1_ONLL1_PGR1_PLR1_PKA0_SIA1_SS0_SU32_SUM0_SUS256_SPO0_SRVW0_SSO0_SVW8_SK0_SKXCCM0_TLDS0_ULSGRO0_USL1_UIOFGRO0_USFGROn1_VSn1_VWA1_VWB1_WSGRA0_WSGRB0_WS32_WG32_4_1_WGM8_WGMXCC1_WGMXCCGn1
    SolutionIndex: 76
    SolutionNameMin: Cijk_Ailk_Bjlk_HSS_BH_Bias_S_HA_S_SAV_UserArgs_MT64x64x32_MI16x16x1_SN_LDSB1_AFC1_AFEM1_AFEM1_ASEM1_CLR0_CADS0_DTVA0_DTVB0_EPS0_FDSI0_GRPM1_GRVWA4_GRVWB8_GSU1_GSUAMB_GSUC0_GSUWGMRR0_GLS0_ISA1200_IU1_K1_LBSPPA1024_LBSPPB1024_LBSPPM0_LPA16_LPB16_LPM0_LRVW8_LWPMn1_MIAV1_MIWT2_2_MO40_NTn1_NTA0_NTB0_NTC0_NTD0_NTM0_NEPBS0_NLCA1_NLCB1_ONLL1_PGR2_PLR1_PKA0_SIA3_SS0_SU32_SUM0_SUS256_SPO0_SRVW0_SSO0_SVW8_SK0_SKXCCM0_TLDS0_ULSGRO0_USL1_UIOFGRO0_USFGROn1_VSn1_VWA1_VWB1_WSGRA0_WSGRB0_WS32_WG32_4_1_WGM8_WGMXCC1_WGMXCCGn1
    SolutionIndex: 77
    SolutionNameMin: Cijk_Ailk_Bjlk_HSS_BH_Bias_S_HA_S_SAV_UserArgs_MT64x64x32_MI16x16x1_SN_LDSB0_AFC1_AFEM1_AFEM1_ASEM1_CLR0_CADS0_DTVA0_DTVB0_EPS0_FDSI0_GRPM1_GRVWA8_GRVWB8_GSU1_GSUAMB_GSUC0_GSUWGMRR0_GLS0_ISA1200_IU1_K1_LBSPPA1024_LBSPPB1024_LBSPPM0_LPA16_LPB16_LPM0_LRVW8_LWPMn1_MIAV1_MIWT2_2_MO40_NTn1_NTA0_NTB0_NTC0_NTD0_NTM0_NEPBS0_NLCA1_NLCB1_ONLL1_PGR2_PLR1_PKA0_SIA3_SS0_SU32_SUM0_SUS256_SPO0_SRVW0_SSO0_SVW8_SK0_SKXCCM0_TLDS0_ULSGRO0_USL1_UIOFGRO0_USFGROn1_VSn1_VWA1_VWB1_WSGRA0_WSGRB0_WS32_WG32_4_1_WGM8_WGMXCC1_WGMXCCGn1
    SolutionIndex: 78
    SolutionNameMin: Cijk_Ailk_Bjlk_HSS_BH_Bias_S_HA_S_SAV_UserArgs_MT64x64x32_MI16x16x1_SN_LDSB0_AFC1_AFEM1_AFEM1_ASEM1_CLR1_CADS0_DTVA0_DTVB0_EPS0_FDSI0_GRPM1_GRVWA8_GRVWB8_GSU1_GSUAMB_GSUC0_GSUWGMRR0_GLS0_ISA1200_IU1_K1_LBSPPA1024_LBSPPB1024_LBSPPM0_LPA16_LPB16_LPM0_LRVW8_LWPMn1_MIAV1_MIWT2_2_MO40_NTn1_NTA0_NTB0_NTC0_NTD0_NTM0_NEPBS0_NLCA1_NLCB1_ONLL1_PGR2_PLR0_PKA0_SIA1_SS0_SU32_SUM0_SUS256_SPO0_SRVW0_SSO0_SVW8_SK0_SKXCCM0_TLDS0_ULSGRO0_USL1_UIOFGRO0_USFGROn1_VSn1_VWA1_VWB1_WSGRA0_WSGRB0_WS32_WG32_4_1_WGM8_WGMXCC1_WGMXCCGn1
    SolutionIndex: 79
    SolutionNameMin: Cijk_Ailk_Bjlk_HSS_BH_Bias_S_HA_S_SAV_UserArgs_MT64x64x32_MI16x16x1_SN_LDSB1_AFC1_AFEM1_AFEM1_ASEM1_CLR0_CADS0_DTVA0_DTVB0_EPS0_FDSI0_GRPM1_GRVWA8_GRVWB8_GSU1_GSUAMB_GSUC0_GSUWGMRR0_GLS0_ISA1200_IU1_K1_LBSPPA1024_LBSPPB1024_LBSPPM0_LPA16_LPB16_LPM0_LRVW8_LWPMn1_MIAV1_MIWT2_2_MO40_NTn1_NTA0_NTB0_NTC0_NTD0_NTM0_NEPBS0_NLCA1_NLCB1_ONLL1_PGR2_PLR1_PKA0_SIA3_SS1_SU32_SUM0_SUS256_SPO0_SRVW0_SSO0_SVW1_SK0_SKXCCM0_TLDS0_ULSGRO0_USL1_UIOFGRO0_USFGROn1_VSn1_VWA1_VWB1_WSGRA0_WSGRB0_WS32_WG32_4_1_WGM8_WGMXCC1_WGMXCCGn1
    SolutionIndex: 80
    SolutionNameMin: Cijk_Ailk_Bjlk_HSS_BH_Bias_S_HA_S_SAV_UserArgs_MT64x64x32_MI16x16x1_SN_LDSB0_AFC1_AFEM1_AFEM1_ASEM1_CLR0_CADS0_DTVA0_DTVB0_EPS0_FDSI0_GRPM1_GRVWA8_GRVWB8_GSU1_GSUAMB_GSUC0_GSUWGMRR0_GLS0_ISA1200_IU1_K1_LBSPPA1024_LBSPPB1024_LBSPPM0_LPA16_LPB16_LPM0_LRVW8_LWPMn1_MIAV1_MIWT2_2_MO40_NTn1_NTA0_NTB0_NTC0_NTD0_NTM0_NEPBS0_NLCA1_NLCB1_ONLL1_PGR1_PLR1_PKA0_SIA3_SS0_SU32_SUM0_SUS256_SPO0_SRVW0_SSO0_SVW8_SK0_SKXCCM0_TLDS0_ULSGRO0_USL1_UIOFGRO0_USFGROn1_VSn1_VWA1_VWB1_WSGRA0_WSGRB0_WS32_WG32_4_1_WGM8_WGMXCC1_WGMXCCGn1
    SolutionIndex: 81
    SolutionNameMin: Cijk_Ailk_Bjlk_HSS_BH_Bias_S_HA_S_SAV_UserArgs_MT64x64x32_MI16x16x1_SN_LDSB1_AFC1_AFEM1_AFEM1_ASEM1_CLR1_CADS0_DTVA0_DTVB0_EPS0_FDSI0_GRPM1_GRVWA8_GRVWB8_GSU1_GSUAMB_GSUC0_GSUWGMRR0_GLS0_ISA1200_IU1_K1_LBSPPA1024_LBSPPB1024_LBSPPM0_LPA16_LPB16_LPM0_LRVW8_LWPMn1_MIAV1_MIWT2_2_MO40_NTn1_NTA0_NTB0_NTC0_NTD0_NTM0_NEPBS0_NLCA1_NLCB1_ONLL1_PGR2_PLR1_PKA0_SIA3_SS1_SU32_SUM0_SUS256_SPO0_SRVW0_SSO0_SVW1_SK0_SKXCCM0_TLDS0_ULSGRO0_USL1_UIOFGRO0_USFGROn1_VSn1_VWA1_VWB1_WSGRA0_WSGRB0_WS32_WG32_4_1_WGM8_WGMXCC1_WGMXCCGn1
    SolutionIndex: 82
    SolutionNameMin: Cijk_Ailk_Bjlk_HSS_BH_Bias_S_HA_S_SAV_UserArgs_MT128x128x32_MI16x16x1_SN_LDSB0_AFC1_AFEM1_AFEM1_ASEM1_CLR0_CADS0_DTVA0_DTVB0_EPS1_FDSI0_GRPM1_GRVWA4_GRVWB8_GSU1_GSUAMB_GSUC0_GSUWGMRR0_GLS0_ISA1200_IU1_K1_LBSPPA2048_LBSPPB2048_LBSPPM0_LPA0_LPB0_LPM0_LRVW8_LWPMn1_MIAV1_MIWT4_4_MO40_NTn1_NTA0_NTB0_NTC0_NTD0_NTM0_NEPBS0_NLCA1_NLCB1_ONLL1_PGR1_PLR0_PKA0_SIA1_SS1_SU32_SUM0_SUS256_SPO0_SRVW0_SSO0_SVW4_SK0_SKXCCM0_TLDS0_ULSGRO0_USL1_UIOFGRO0_USFGROn1_VSn1_VWA4_VWB4_WSGRA0_WSGRB0_WS32_WG32_4_1_WGM8_WGMXCC1_WGMXCCGn1
    SolutionIndex: 83
    SolutionNameMin: Cijk_Ailk_Bjlk_HSS_BH_Bias_S_HA_S_SAV_UserArgs_MT128x128x32_MI16x16x1_SN_LDSB0_AFC1_AFEM1_AFEM1_ASEM1_CLR0_CADS0_DTVA0_DTVB0_EPS1_FDSI0_GRPM1_GRVWA8_GRVWB4_GSU1_GSUAMB_GSUC0_GSUWGMRR0_GLS0_ISA1200_IU1_K1_LBSPPA2048_LBSPPB2048_LBSPPM0_LPA0_LPB0_LPM0_LRVW8_LWPMn1_MIAV1_MIWT4_4_MO40_NTn1_NTA0_NTB0_NTC0_NTD0_NTM0_NEPBS0_NLCA1_NLCB1_ONLL1_PGR1_PLR0_PKA0_SIA1_SS1_SU32_SUM0_SUS256_SPO0_SRVW0_SSO0_SVW4_SK0_SKXCCM0_TLDS0_ULSGRO0_USL1_UIOFGRO0_USFGROn1_VSn1_VWA4_VWB4_WSGRA0_WSGRB0_WS32_WG32_4_1_WGM8_WGMXCC1_WGMXCCGn1
    SolutionIndex: 84
    SolutionNameMin: Cijk_Ailk_Bjlk_HSS_BH_Bias_S_HA_S_SAV_UserArgs_MT128x128x32_MI16x16x1_SN_LDSB0_AFC1_AFEM1_AFEM1_ASEM1_CLR0_CADS0_DTVA0_DTVB0_EPS0_FDSI0_GRPM1_GRVWA4_GRVWB4_GSU1_GSUAMB_GSUC0_GSUWGMRR0_GLS0_ISA1200_IU1_K1_LBSPPA2048_LBSPPB2048_LBSPPM0_LPA0_LPB0_LPM0_LRVW8_LWPMn1_MIAV1_MIWT4_4_MO40_NTn1_NTA0_NTB0_NTC0_NTD0_NTM0_NEPBS0_NLCA1_NLCB1_ONLL1_PGR2_PLR0_PKA0_SIA1_SS1_SU32_SUM0_SUS256_SPO0_SRVW0_SSO0_SVW4_SK0_SKXCCM0_TLDS0_ULSGRO0_USL1_UIOFGRO0_USFGROn1_VSn1_VWA4_VWB4_WSGRA0_WSGRB0_WS32_WG32_4_1_WGM8_WGMXCC1_WGMXCCGn1
    SolutionIndex: 85
    SolutionNameMin: Cijk_Ailk_Bjlk_HSS_BH_Bias_S_HA_S_SAV_UserArgs_MT128x128x32_MI16x16x1_SN_LDSB0_AFC1_AFEM1_AFEM1_ASEM1_CLR0_CADS0_DTVA0_DTVB0_EPS0_FDSI0_GRPM1_GRVWA4_GRVWB4_GSU1_GSUAMB_GSUC0_GSUWGMRR0_GLS0_ISA1200_IU1_K1_LBSPPA2048_LBSPPB2048_LBSPPM0_LPA0_LPB0_LPM0_LRVW8_LWPMn1_MIAV1_MIWT4_4_MO40_NTn1_NTA0_NTB0_NTC0_NTD0_NTM0_NEPBS0_NLCA1_NLCB1_ONLL1_PGR1_PLR0_PKA0_SIA1_SS1_SU32_SUM0_SUS256_SPO0_SRVW0_SSO0_SVW4_SK0_SKXCCM0_TLDS0_ULSGRO0_USL1_UIOFGRO0_USFGROn1_VSn1_VWA4_VWB4_WSGRA0_WSGRB0_WS32_WG32_4_1_WGM8_WGMXCC1_WGMXCCGn1
    SolutionIndex: 86
    SolutionNameMin: Cijk_Ailk_Bjlk_HSS_BH_Bias_S_HA_S_SAV_UserArgs_MT128x128x32_MI16x16x1_SN_LDSB0_AFC1_AFEM1_AFEM1_ASEM1_CLR0_CADS0_DTVA0_DTVB0_EPS0_FDSI0_GRPM1_GRVWA8_GRVWB4_GSU1_GSUAMB_GSUC0_GSUWGMRR0_GLS0_ISA1200_IU1_K1_LBSPPA2048_LBSPPB2048_LBSPPM0_LPA0_LPB0_LPM0_LRVW8_LWPMn1_MIAV1_MIWT4_4_MO40_NTn1_NTA0_NTB0_NTC0_NTD0_NTM0_NEPBS0_NLCA1_NLCB1_ONLL1_PGR1_PLR0_PKA0_SIA3_SS1_SU32_SUM0_SUS256_SPO0_SRVW0_SSO0_SVW4_SK0_SKXCCM0_TLDS0_ULSGRO0_USL1_UIOFGRO0_USFGROn1_VSn1_VWA4_VWB4_WSGRA0_WSGRB0_WS32_WG32_4_1_WGM8_WGMXCC1_WGMXCCGn1
    SolutionIndex: 87
    SolutionNameMin: Cijk_Ailk_Bjlk_HSS_BH_Bias_S_HA_S_SAV_UserArgs_MT128x128x32_MI16x16x1_SN_LDSB0_AFC1_AFEM1_AFEM1_ASEM1_CLR0_CADS0_DTVA0_DTVB0_EPS0_FDSI0_GRPM1_GRVWA4_GRVWB8_GSU1_GSUAMB_GSUC0_GSUWGMRR0_GLS0_ISA1200_IU1_K1_LBSPPA2048_LBSPPB2048_LBSPPM0_LPA0_LPB0_LPM0_LRVW8_LWPMn1_MIAV1_MIWT4_4_MO40_NTn1_NTA0_NTB0_NTC0_NTD0_NTM0_NEPBS0_NLCA1_NLCB1_ONLL1_PGR2_PLR0_PKA0_SIA3_SS1_SU32_SUM0_SUS256_SPO0_SRVW0_SSO0_SVW4_SK0_SKXCCM0_TLDS0_ULSGRO0_USL1_UIOFGRO0_USFGROn1_VSn1_VWA4_VWB4_WSGRA0_WSGRB0_WS32_WG32_4_1_WGM8_WGMXCC1_WGMXCCGn1
    SolutionIndex: 88
    SolutionNameMin: Cijk_Ailk_Bjlk_HSS_BH_Bias_S_HA_S_SAV_UserArgs_MT64x64x32_MI16x16x1_SN_LDSB0_AFC1_AFEM1_AFEM1_ASEM1_CLR1_CADS0_DTVA0_DTVB0_EPS0_FDSI0_GRPM1_GRVWA8_GRVWB8_GSU1_GSUAMB_GSUC0_GSUWGMRR0_GLS0_ISA1200_IU1_K1_LBSPPA1024_LBSPPB1024_LBSPPM0_LPA16_LPB16_LPM0_LRVW8_LWPMn1_MIAV1_MIWT2_2_MO40_NTn1_NTA0_NTB0_NTC0_NTD0_NTM0_NEPBS0_NLCA1_NLCB1_ONLL1_PGR2_PLR1_PKA0_SIA1_SS1_SU32_SUM0_SUS256_SPO0_SRVW0_SSO0_SVW1_SK0_SKXCCM0_TLDS0_ULSGRO0_USL1_UIOFGRO0_USFGROn1_VSn1_VWA1_VWB1_WSGRA0_WSGRB0_WS32_WG32_4_1_WGM8_WGMXCC1_WGMXCCGn1
    SolutionIndex: 89
    SolutionNameMin: Cijk_Ailk_Bjlk_HSS_BH_Bias_S_HA_S_SAV_UserArgs_MT128x128x32_MI16x16x1_SN_LDSB0_AFC1_AFEM1_AFEM1_ASEM1_CLR0_CADS0_DTVA0_DTVB0_EPS1_FDSI0_GRPM1_GRVWA4_GRVWB4_GSU1_GSUAMB_GSUC0_GSUWGMRR0_GLS0_ISA1200_IU1_K1_LBSPPA2048_LBSPPB2048_LBSPPM0_LPA0_LPB0_LPM0_LRVW8_LWPMn1_MIAV1_MIWT4_4_MO40_NTn1_NTA0_NTB0_NTC0_NTD0_NTM0_NEPBS0_NLCA1_NLCB1_ONLL1_PGR1_PLR0_PKA0_SIA3_SS1_SU32_SUM0_SUS256_SPO0_SRVW0_SSO0_SVW4_SK0_SKXCCM0_TLDS0_ULSGRO0_USL1_UIOFGRO0_USFGROn1_VSn1_VWA4_VWB4_WSGRA0_WSGRB0_WS32_WG32_4_1_WGM8_WGMXCC1_WGMXCCGn1
    SolutionIndex: 90
    SolutionNameMin: Cijk_Ailk_Bjlk_HSS_BH_Bias_S_HA_S_SAV_UserArgs_MT128x128x32_MI16x16x1_SN_LDSB0_AFC1_AFEM1_AFEM1_ASEM1_CLR0_CADS0_DTVA0_DTVB0_EPS1_FDSI0_GRPM1_GRVWA8_GRVWB4_GSU1_GSUAMB_GSUC0_GSUWGMRR0_GLS0_ISA1200_IU1_K1_LBSPPA2048_LBSPPB2048_LBSPPM0_LPA0_LPB0_LPM0_LRVW8_LWPMn1_MIAV1_MIWT4_4_MO40_NTn1_NTA0_NTB0_NTC0_NTD0_NTM0_NEPBS0_NLCA1_NLCB1_ONLL1_PGR1_PLR0_PKA0_SIA3_SS1_SU32_SUM0_SUS256_SPO0_SRVW0_SSO0_SVW4_SK0_SKXCCM0_TLDS0_ULSGRO0_USL1_UIOFGRO0_USFGROn1_VSn1_VWA4_VWB4_WSGRA0_WSGRB0_WS32_WG32_4_1_WGM8_WGMXCC1_WGMXCCGn1
    SolutionIndex: 91
    SolutionNameMin: Cijk_Ailk_Bjlk_HSS_BH_Bias_S_HA_S_SAV_UserArgs_MT64x64x32_MI16x16x1_SN_LDSB0_AFC1_AFEM1_AFEM1_ASEM1_CLR0_CADS0_DTVA0_DTVB0_EPS0_FDSI0_GRPM1_GRVWA4_GRVWB8_GSU1_GSUAMB_GSUC0_GSUWGMRR0_GLS0_ISA1200_IU1_K1_LBSPPA1024_LBSPPB1024_LBSPPM0_LPA16_LPB16_LPM0_LRVW8_LWPMn1_MIAV1_MIWT2_2_MO40_NTn1_NTA0_NTB0_NTC0_NTD0_NTM0_NEPBS0_NLCA1_NLCB1_ONLL1_PGR2_PLR0_PKA0_SIA1_SS1_SU32_SUM0_SUS256_SPO0_SRVW0_SSO0_SVW1_SK0_SKXCCM0_TLDS0_ULSGRO0_USL1_UIOFGRO0_USFGROn1_VSn1_VWA1_VWB1_WSGRA0_WSGRB0_WS32_WG32_4_1_WGM8_WGMXCC1_WGMXCCGn1
    SolutionIndex: 92
    SolutionNameMin: Cijk_Ailk_Bjlk_HSS_BH_Bias_S_HA_S_SAV_UserArgs_MT128x128x32_MI16x16x1_SN_LDSB0_AFC1_AFEM1_AFEM1_ASEM1_CLR0_CADS0_DTVA0_DTVB0_EPS0_FDSI0_GRPM1_GRVWA4_GRVWB4_GSU1_GSUAMB_GSUC0_GSUWGMRR0_GLS0_ISA1200_IU1_K1_LBSPPA2048_LBSPPB2048_LBSPPM0_LPA0_LPB0_LPM0_LRVW8_LWPMn1_MIAV1_MIWT4_4_MO40_NTn1_NTA0_NTB0_NTC0_NTD0_NTM0_NEPBS0_NLCA1_NLCB1_ONLL1_PGR1_PLR0_PKA0_SIA3_SS1_SU32_SUM0_SUS256_SPO0_SRVW0_SSO0_SVW4_SK0_SKXCCM0_TLDS0_ULSGRO0_USL1_UIOFGRO0_USFGROn1_VSn1_VWA4_VWB4_WSGRA0_WSGRB0_WS32_WG32_4_1_WGM8_WGMXCC1_WGMXCCGn1
    SolutionIndex: 93
    SolutionNameMin: Cijk_Ailk_Bjlk_HSS_BH_Bias_S_HA_S_SAV_UserArgs_MT64x64x32_MI16x16x1_SN_LDSB1_AFC1_AFEM1_AFEM1_ASEM1_CLR1_CADS0_DTVA0_DTVB0_EPS0_FDSI0_GRPM1_GRVWA4_GRVWB8_GSU1_GSUAMB_GSUC0_GSUWGMRR0_GLS0_ISA1200_IU1_K1_LBSPPA1024_LBSPPB1024_LBSPPM0_LPA16_LPB16_LPM0_LRVW8_LWPMn1_MIAV1_MIWT2_2_MO40_NTn1_NTA0_NTB0_NTC0_NTD0_NTM0_NEPBS0_NLCA1_NLCB1_ONLL1_PGR2_PLR1_PKA0_SIA3_SS0_SU32_SUM0_SUS256_SPO0_SRVW0_SSO0_SVW8_SK0_SKXCCM0_TLDS0_ULSGRO0_USL1_UIOFGRO0_USFGROn1_VSn1_VWA1_VWB1_WSGRA0_WSGRB0_WS32_WG32_4_1_WGM8_WGMXCC1_WGMXCCGn1
    SolutionIndex: 94
    SolutionNameMin: Cijk_Ailk_Bjlk_HSS_BH_Bias_S_HA_S_SAV_UserArgs_MT128x128x32_MI16x16x1_SN_LDSB0_AFC1_AFEM1_AFEM1_ASEM1_CLR0_CADS0_DTVA0_DTVB0_EPS1_FDSI0_GRPM1_GRVWA4_GRVWB4_GSU1_GSUAMB_GSUC0_GSUWGMRR0_GLS0_ISA1200_IU1_K1_LBSPPA2048_LBSPPB2048_LBSPPM0_LPA0_LPB0_LPM0_LRVW8_LWPMn1_MIAV1_MIWT4_4_MO40_NTn1_NTA0_NTB0_NTC0_NTD0_NTM0_NEPBS0_NLCA1_NLCB1_ONLL1_PGR1_PLR0_PKA0_SIA1_SS1_SU32_SUM0_SUS256_SPO0_SRVW0_SSO0_SVW4_SK0_SKXCCM0_TLDS0_ULSGRO0_USL1_UIOFGRO0_USFGROn1_VSn1_VWA4_VWB4_WSGRA0_WSGRB0_WS32_WG32_4_1_WGM8_WGMXCC1_WGMXCCGn1
    SolutionIndex: 95
    SolutionNameMin: Cijk_Ailk_Bjlk_HSS_BH_Bias_S_HA_S_SAV_UserArgs_MT64x64x32_MI16x16x1_SN_LDSB0_AFC1_AFEM1_AFEM1_ASEM1_CLR1_CADS0_DTVA0_DTVB0_EPS0_FDSI0_GRPM1_GRVWA8_GRVWB8_GSU1_GSUAMB_GSUC0_GSUWGMRR0_GLS0_ISA1200_IU1_K1_LBSPPA1024_LBSPPB1024_LBSPPM0_LPA16_LPB16_LPM0_LRVW8_LWPMn1_MIAV1_MIWT2_2_MO40_NTn1_NTA0_NTB0_NTC0_NTD0_NTM0_NEPBS0_NLCA1_NLCB1_ONLL1_PGR1_PLR0_PKA0_SIA1_SS1_SU32_SUM0_SUS256_SPO0_SRVW0_SSO0_SVW1_SK0_SKXCCM0_TLDS0_ULSGRO0_USL1_UIOFGRO0_USFGROn1_VSn1_VWA1_VWB1_WSGRA0_WSGRB0_WS32_WG32_4_1_WGM8_WGMXCC1_WGMXCCGn1
    SolutionIndex: 96
    SolutionNameMin: Cijk_Ailk_Bjlk_HSS_BH_Bias_S_HA_S_SAV_UserArgs_MT64x64x32_MI16x16x1_SN_LDSB1_AFC1_AFEM1_AFEM1_ASEM1_CLR1_CADS0_DTVA0_DTVB0_EPS1_FDSI0_GRPM1_GRVWA8_GRVWB8_GSU1_GSUAMB_GSUC0_GSUWGMRR0_GLS0_ISA1200_IU1_K1_LBSPPA1024_LBSPPB1024_LBSPPM0_LPA16_LPB16_LPM0_LRVW8_LWPMn1_MIAV1_MIWT2_2_MO40_NTn1_NTA0_NTB0_NTC0_NTD0_NTM0_NEPBS0_NLCA1_NLCB1_ONLL1_PGR1_PLR0_PKA0_SIA3_SS1_SU32_SUM0_SUS256_SPO0_SRVW0_SSO0_SVW1_SK0_SKXCCM0_TLDS0_ULSGRO0_USL1_UIOFGRO0_USFGROn1_VSn1_VWA1_VWB1_WSGRA0_WSGRB0_WS32_WG32_4_1_WGM8_WGMXCC1_WGMXCCGn1
    SolutionIndex: 97
    SolutionNameMin: Cijk_Ailk_Bjlk_HSS_BH_Bias_S_HA_S_SAV_UserArgs_MT64x64x32_MI16x16x1_SN_LDSB0_AFC1_AFEM1_AFEM1_ASEM1_CLR1_CADS0_DTVA0_DTVB0_EPS0_FDSI0_GRPM1_GRVWA8_GRVWB4_GSU1_GSUAMB_GSUC0_GSUWGMRR0_GLS0_ISA1200_IU1_K1_LBSPPA1024_LBSPPB1024_LBSPPM0_LPA16_LPB16_LPM0_LRVW8_LWPMn1_MIAV1_MIWT2_2_MO40_NTn1_NTA0_NTB0_NTC0_NTD0_NTM0_NEPBS0_NLCA1_NLCB1_ONLL1_PGR2_PLR0_PKA0_SIA1_SS0_SU32_SUM0_SUS256_SPO0_SRVW0_SSO0_SVW8_SK0_SKXCCM0_TLDS0_ULSGRO0_USL1_UIOFGRO0_USFGROn1_VSn1_VWA1_VWB1_WSGRA0_WSGRB0_WS32_WG32_4_1_WGM8_WGMXCC1_WGMXCCGn1
    SolutionIndex: 98
    SolutionNameMin: Cijk_Ailk_Bjlk_HSS_BH_Bias_S_HA_S_SAV_UserArgs_MT16x16x32_MI16x16x1_SN_LDSB1_AFC1_AFEM1_AFEM1_ASEM1_CLR1_CADS0_DTVA0_DTVB0_EPS0_FDSI0_GRPM1_GRVWA8_GRVWB8_GSU1_GSUAMB_GSUC0_GSUWGMRR0_GLS0_ISA1200_IU1_K1_LBSPPA256_LBSPPB256_LBSPPM0_LPA16_LPB16_LPM0_LRVW8_LWPMn1_MIAV1_MIWT1_1_MO40_NTn1_NTA0_NTB0_NTC0_NTD0_NTM0_NEPBS0_NLCA1_NLCB1_ONLL1_PGR2_PLR0_PKA0_SIA3_SS0_SU32_SUM0_SUS256_SPO0_SRVW0_SSO0_SVW8_SK0_SKXCCM0_TLDS0_ULSGRO0_USL1_UIOFGRO0_USFGROn1_VSn1_VWA1_VWB1_WSGRA0_WSGRB0_WS32_WG16_2_1_WGM8_WGMXCC1_WGMXCCGn1
    SolutionIndex: 99
    SolutionNameMin: Cijk_Ailk_Bjlk_HSS_BH_Bias_S_HA_S_SAV_UserArgs_MT64x64x32_MI16x16x1_SN_LDSB0_AFC1_AFEM1_AFEM1_ASEM1_CLR1_CADS0_DTVA0_DTVB0_EPS0_FDSI0_GRPM1_GRVWA4_GRVWB8_GSU1_GSUAMB_GSUC0_GSUWGMRR0_GLS0_ISA1200_IU1_K1_LBSPPA1024_LBSPPB1024_LBSPPM0_LPA16_LPB16_LPM0_LRVW8_LWPMn1_MIAV1_MIWT2_2_MO40_NTn1_NTA0_NTB0_NTC0_NTD0_NTM0_NEPBS0_NLCA1_NLCB1_ONLL1_PGR2_PLR1_PKA0_SIA3_SS0_SU32_SUM0_SUS256_SPO0_SRVW0_SSO0_SVW8_SK0_SKXCCM0_TLDS0_ULSGRO0_USL1_UIOFGRO0_USFGROn1_VSn1_VWA1_VWB1_WSGRA0_WSGRB0_WS32_WG32_4_1_WGM8_WGMXCC1_WGMXCCGn1
    SolutionIndex: 100
    SolutionNameMin: Cijk_Ailk_Bjlk_HSS_BH_Bias_S_HA_S_SAV_UserArgs_MT64x64x32_MI16x16x1_SN_LDSB0_AFC1_AFEM1_AFEM1_ASEM1_CLR1_CADS0_DTVA0_DTVB0_EPS0_FDSI0_GRPM1_GRVWA4_GRVWB4_GSU1_GSUAMB_GSUC0_GSUWGMRR0_GLS0_ISA1200_IU1_K1_LBSPPA1024_LBSPPB1024_LBSPPM0_LPA16_LPB16_LPM0_LRVW8_LWPMn1_MIAV1_MIWT2_2_MO40_NTn1_NTA0_NTB0_NTC0_NTD0_NTM0_NEPBS0_NLCA1_NLCB1_ONLL1_PGR2_PLR1_PKA0_SIA3_SS0_SU32_SUM0_SUS256_SPO0_SRVW0_SSO0_SVW8_SK0_SKXCCM0_TLDS0_ULSGRO0_USL1_UIOFGRO0_USFGROn1_VSn1_VWA1_VWB1_WSGRA0_WSGRB0_WS32_WG32_4_1_WGM8_WGMXCC1_WGMXCCGn1
    SolutionIndex: 101
    SolutionNameMin: Cijk_Ailk_Bjlk_HSS_BH_Bias_S_HA_S_SAV_UserArgs_MT64x64x32_MI16x16x1_SN_LDSB0_AFC1_AFEM1_AFEM1_ASEM1_CLR0_CADS0_DTVA0_DTVB0_EPS1_FDSI0_GRPM1_GRVWA4_GRVWB8_GSU1_GSUAMB_GSUC0_GSUWGMRR0_GLS0_ISA1200_IU1_K1_LBSPPA1024_LBSPPB1024_LBSPPM0_LPA16_LPB16_LPM0_LRVW8_LWPMn1_MIAV1_MIWT2_2_MO40_NTn1_NTA0_NTB0_NTC0_NTD0_NTM0_NEPBS0_NLCA1_NLCB1_ONLL1_PGR1_PLR1_PKA0_SIA1_SS0_SU32_SUM0_SUS256_SPO0_SRVW0_SSO0_SVW8_SK0_SKXCCM0_TLDS0_ULSGRO0_USL1_UIOFGRO0_USFGROn1_VSn1_VWA1_VWB1_WSGRA0_WSGRB0_WS32_WG32_4_1_WGM8_WGMXCC1_WGMXCCGn1
    SolutionIndex: 102
    SolutionNameMin: Cijk_Ailk_Bjlk_HSS_BH_Bias_S_HA_S_SAV_UserArgs_MT64x64x32_MI16x16x1_SN_LDSB0_AFC1_AFEM1_AFEM1_ASEM1_CLR0_CADS0_DTVA0_DTVB0_EPS0_FDSI0_GRPM1_GRVWA4_GRVWB8_GSU1_GSUAMB_GSUC0_GSUWGMRR0_GLS0_ISA1200_IU1_K1_LBSPPA1024_LBSPPB1024_LBSPPM0_LPA16_LPB16_LPM0_LRVW8_LWPMn1_MIAV1_MIWT2_2_MO40_NTn1_NTA0_NTB0_NTC0_NTD0_NTM0_NEPBS0_NLCA1_NLCB1_ONLL1_PGR2_PLR1_PKA0_SIA3_SS1_SU32_SUM0_SUS256_SPO0_SRVW0_SSO0_SVW1_SK0_SKXCCM0_TLDS0_ULSGRO0_USL1_UIOFGRO0_USFGROn1_VSn1_VWA1_VWB1_WSGRA0_WSGRB0_WS32_WG32_4_1_WGM8_WGMXCC1_WGMXCCGn1
    SolutionIndex: 103
    SolutionNameMin: Cijk_Ailk_Bjlk_HSS_BH_Bias_S_HA_S_SAV_UserArgs_MT64x64x32_MI16x16x1_SN_LDSB0_AFC1_AFEM1_AFEM1_ASEM1_CLR0_CADS0_DTVA0_DTVB0_EPS1_FDSI0_GRPM1_GRVWA8_GRVWB8_GSU1_GSUAMB_GSUC0_GSUWGMRR0_GLS0_ISA1200_IU1_K1_LBSPPA1024_LBSPPB1024_LBSPPM0_LPA16_LPB16_LPM0_LRVW8_LWPMn1_MIAV1_MIWT2_2_MO40_NTn1_NTA0_NTB0_NTC0_NTD0_NTM0_NEPBS0_NLCA1_NLCB1_ONLL1_PGR1_PLR1_PKA0_SIA1_SS0_SU32_SUM0_SUS256_SPO0_SRVW0_SSO0_SVW8_SK0_SKXCCM0_TLDS0_ULSGRO0_USL1_UIOFGRO0_USFGROn1_VSn1_VWA1_VWB1_WSGRA0_WSGRB0_WS32_WG32_4_1_WGM8_WGMXCC1_WGMXCCGn1
    SolutionIndex: 104
    SolutionNameMin: Cijk_Ailk_Bjlk_HSS_BH_Bias_S_HA_S_SAV_UserArgs_MT64x64x32_MI16x16x1_SN_LDSB0_AFC1_AFEM1_AFEM1_ASEM1_CLR0_CADS0_DTVA0_DTVB0_EPS0_FDSI0_GRPM1_GRVWA8_GRVWB8_GSU1_GSUAMB_GSUC0_GSUWGMRR0_GLS0_ISA1200_IU1_K1_LBSPPA1024_LBSPPB1024_LBSPPM0_LPA16_LPB16_LPM0_LRVW8_LWPMn1_MIAV1_MIWT2_2_MO40_NTn1_NTA0_NTB0_NTC0_NTD0_NTM0_NEPBS0_NLCA1_NLCB1_ONLL1_PGR2_PLR1_PKA0_SIA3_SS1_SU32_SUM0_SUS256_SPO0_SRVW0_SSO0_SVW1_SK0_SKXCCM0_TLDS0_ULSGRO0_USL1_UIOFGRO0_USFGROn1_VSn1_VWA1_VWB1_WSGRA0_WSGRB0_WS32_WG32_4_1_WGM8_WGMXCC1_WGMXCCGn1
    SolutionIndex: 105
    SolutionNameMin: Cijk_Ailk_Bjlk_HSS_BH_Bias_S_HA_S_SAV_UserArgs_MT64x64x32_MI16x16x1_SN_LDSB0_AFC1_AFEM1_AFEM1_ASEM1_CLR0_CADS0_DTVA0_DTVB0_EPS0_FDSI0_GRPM1_GRVWA4_GRVWB4_GSU1_GSUAMB_GSUC0_GSUWGMRR0_GLS0_ISA1200_IU1_K1_LBSPPA1024_LBSPPB1024_LBSPPM0_LPA16_LPB16_LPM0_LRVW8_LWPMn1_MIAV1_MIWT2_2_MO40_NTn1_NTA0_NTB0_NTC0_NTD0_NTM0_NEPBS0_NLCA1_NLCB1_ONLL1_PGR2_PLR1_PKA0_SIA3_SS0_SU32_SUM0_SUS256_SPO0_SRVW0_SSO0_SVW8_SK0_SKXCCM0_TLDS0_ULSGRO0_USL1_UIOFGRO0_USFGROn1_VSn1_VWA1_VWB1_WSGRA0_WSGRB0_WS32_WG32_4_1_WGM8_WGMXCC1_WGMXCCGn1
    SolutionIndex: 106
    SolutionNameMin: Cijk_Ailk_Bjlk_HSS_BH_Bias_S_HA_S_SAV_UserArgs_MT128x128x32_MI16x16x1_SN_LDSB0_AFC1_AFEM1_AFEM1_ASEM1_CLR0_CADS0_DTVA0_DTVB0_EPS1_FDSI0_GRPM1_GRVWA8_GRVWB8_GSU1_GSUAMB_GSUC0_GSUWGMRR0_GLS0_ISA1200_IU1_K1_LBSPPA2048_LBSPPB2048_LBSPPM0_LPA0_LPB0_LPM0_LRVW8_LWPMn1_MIAV1_MIWT4_4_MO40_NTn1_NTA0_NTB0_NTC0_NTD0_NTM0_NEPBS0_NLCA1_NLCB1_ONLL1_PGR1_PLR0_PKA0_SIA1_SS0_SU32_SUM0_SUS256_SPO0_SRVW0_SSO0_SVW8_SK0_SKXCCM0_TLDS0_ULSGRO0_USL1_UIOFGRO0_USFGROn1_VSn1_VWA4_VWB4_WSGRA0_WSGRB0_WS32_WG32_4_1_WGM8_WGMXCC1_WGMXCCGn1
    SolutionIndex: 107
    SolutionNameMin: Cijk_Ailk_Bjlk_HSS_BH_Bias_S_HA_S_SAV_UserArgs_MT128x128x32_MI16x16x1_SN_LDSB0_AFC1_AFEM1_AFEM1_ASEM1_CLR0_CADS0_DTVA0_DTVB0_EPS0_FDSI0_GRPM1_GRVWA8_GRVWB4_GSU1_GSUAMB_GSUC0_GSUWGMRR0_GLS0_ISA1200_IU1_K1_LBSPPA2048_LBSPPB2048_LBSPPM0_LPA0_LPB0_LPM0_LRVW8_LWPMn1_MIAV1_MIWT4_4_MO40_NTn1_NTA0_NTB0_NTC0_NTD0_NTM0_NEPBS0_NLCA1_NLCB1_ONLL1_PGR1_PLR0_PKA0_SIA1_SS0_SU32_SUM0_SUS256_SPO0_SRVW0_SSO0_SVW8_SK0_SKXCCM0_TLDS0_ULSGRO0_USL1_UIOFGRO0_USFGROn1_VSn1_VWA4_VWB4_WSGRA0_WSGRB0_WS32_WG32_4_1_WGM8_WGMXCC1_WGMXCCGn1
    SolutionIndex: 108
    SolutionNameMin: Cijk_Ailk_Bjlk_HSS_BH_Bias_S_HA_S_SAV_UserArgs_MT64x64x32_MI16x16x1_SN_LDSB0_AFC1_AFEM1_AFEM1_ASEM1_CLR1_CADS0_DTVA0_DTVB0_EPS0_FDSI0_GRPM1_GRVWA8_GRVWB4_GSU1_GSUAMB_GSUC0_GSUWGMRR0_GLS0_ISA1200_IU1_K1_LBSPPA1024_LBSPPB1024_LBSPPM0_LPA16_LPB16_LPM0_LRVW8_LWPMn1_MIAV1_MIWT2_2_MO40_NTn1_NTA0_NTB0_NTC0_NTD0_NTM0_NEPBS0_NLCA1_NLCB1_ONLL1_PGR2_PLR1_PKA0_SIA3_SS0_SU32_SUM0_SUS256_SPO0_SRVW0_SSO0_SVW8_SK0_SKXCCM0_TLDS0_ULSGRO0_USL1_UIOFGRO0_USFGROn1_VSn1_VWA1_VWB1_WSGRA0_WSGRB0_WS32_WG32_4_1_WGM8_WGMXCC1_WGMXCCGn1
    SolutionIndex: 109
    SolutionNameMin: Cijk_Ailk_Bjlk_HSS_BH_Bias_S_HA_S_SAV_UserArgs_MT64x64x32_MI16x16x1_SN_LDSB0_AFC1_AFEM1_AFEM1_ASEM1_CLR0_CADS0_DTVA0_DTVB0_EPS1_FDSI0_GRPM1_GRVWA8_GRVWB4_GSU1_GSUAMB_GSUC0_GSUWGMRR0_GLS0_ISA1200_IU1_K1_LBSPPA1024_LBSPPB1024_LBSPPM0_LPA16_LPB16_LPM0_LRVW8_LWPMn1_MIAV1_MIWT2_2_MO40_NTn1_NTA0_NTB0_NTC0_NTD0_NTM0_NEPBS0_NLCA1_NLCB1_ONLL1_PGR1_PLR0_PKA0_SIA1_SS0_SU32_SUM0_SUS256_SPO0_SRVW0_SSO0_SVW8_SK0_SKXCCM0_TLDS0_ULSGRO0_USL1_UIOFGRO0_USFGROn1_VSn1_VWA1_VWB1_WSGRA0_WSGRB0_WS32_WG32_4_1_WGM8_WGMXCC1_WGMXCCGn1
    SolutionIndex: 110
    SolutionNameMin: Cijk_Ailk_Bjlk_HSS_BH_Bias_S_HA_S_SAV_UserArgs_MT128x128x32_MI16x16x1_SN_LDSB0_AFC1_AFEM1_AFEM1_ASEM1_CLR0_CADS0_DTVA0_DTVB0_EPS0_FDSI0_GRPM1_GRVWA8_GRVWB8_GSU1_GSUAMB_GSUC0_GSUWGMRR0_GLS0_ISA1200_IU1_K1_LBSPPA2048_LBSPPB2048_LBSPPM0_LPA0_LPB0_LPM0_LRVW8_LWPMn1_MIAV1_MIWT4_4_MO40_NTn1_NTA0_NTB0_NTC0_NTD0_NTM0_NEPBS0_NLCA1_NLCB1_ONLL1_PGR2_PLR0_PKA0_SIA1_SS0_SU32_SUM0_SUS256_SPO0_SRVW0_SSO0_SVW8_SK0_SKXCCM0_TLDS0_ULSGRO0_USL1_UIOFGRO0_USFGROn1_VSn1_VWA4_VWB4_WSGRA0_WSGRB0_WS32_WG32_4_1_WGM8_WGMXCC1_WGMXCCGn1
    SolutionIndex: 111
    SolutionNameMin: Cijk_Ailk_Bjlk_HSS_BH_Bias_S_HA_S_SAV_UserArgs_MT128x128x32_MI16x16x1_SN_LDSB0_AFC1_AFEM1_AFEM1_ASEM1_CLR0_CADS0_DTVA0_DTVB0_EPS0_FDSI0_GRPM1_GRVWA8_GRVWB8_GSU1_GSUAMB_GSUC0_GSUWGMRR0_GLS0_ISA1200_IU1_K1_LBSPPA2048_LBSPPB2048_LBSPPM0_LPA0_LPB0_LPM0_LRVW8_LWPMn1_MIAV1_MIWT4_4_MO40_NTn1_NTA0_NTB0_NTC0_NTD0_NTM0_NEPBS0_NLCA1_NLCB1_ONLL1_PGR1_PLR0_PKA0_SIA1_SS0_SU32_SUM0_SUS256_SPO0_SRVW0_SSO0_SVW8_SK0_SKXCCM0_TLDS0_ULSGRO0_USL1_UIOFGRO0_USFGROn1_VSn1_VWA4_VWB4_WSGRA0_WSGRB0_WS32_WG32_4_1_WGM8_WGMXCC1_WGMXCCGn1
    SolutionIndex: 112
    SolutionNameMin: Cijk_Ailk_Bjlk_HSS_BH_Bias_S_HA_S_SAV_UserArgs_MT128x128x32_MI16x16x1_SN_LDSB0_AFC1_AFEM1_AFEM1_ASEM1_CLR0_CADS0_DTVA0_DTVB0_EPS1_FDSI0_GRPM1_GRVWA4_GRVWB8_GSU1_GSUAMB_GSUC0_GSUWGMRR0_GLS0_ISA1200_IU1_K1_LBSPPA2048_LBSPPB2048_LBSPPM0_LPA0_LPB0_LPM0_LRVW8_LWPMn1_MIAV1_MIWT4_4_MO40_NTn1_NTA0_NTB0_NTC0_NTD0_NTM0_NEPBS0_NLCA1_NLCB1_ONLL1_PGR1_PLR0_PKA0_SIA3_SS1_SU32_SUM0_SUS256_SPO0_SRVW0_SSO0_SVW4_SK0_SKXCCM0_TLDS0_ULSGRO0_USL1_UIOFGRO0_USFGROn1_VSn1_VWA4_VWB4_WSGRA0_WSGRB0_WS32_WG32_4_1_WGM8_WGMXCC1_WGMXCCGn1
    SolutionIndex: 113
    SolutionNameMin: Cijk_Ailk_Bjlk_HSS_BH_Bias_S_HA_S_SAV_UserArgs_MT128x128x32_MI16x16x1_SN_LDSB0_AFC1_AFEM1_AFEM1_ASEM1_CLR0_CADS0_DTVA0_DTVB0_EPS1_FDSI0_GRPM1_GRVWA8_GRVWB4_GSU1_GSUAMB_GSUC0_GSUWGMRR0_GLS0_ISA1200_IU1_K1_LBSPPA2048_LBSPPB2048_LBSPPM0_LPA0_LPB0_LPM0_LRVW8_LWPMn1_MIAV1_MIWT4_4_MO40_NTn1_NTA0_NTB0_NTC0_NTD0_NTM0_NEPBS0_NLCA1_NLCB1_ONLL1_PGR1_PLR0_PKA0_SIA1_SS0_SU32_SUM0_SUS256_SPO0_SRVW0_SSO0_SVW8_SK0_SKXCCM0_TLDS0_ULSGRO0_USL1_UIOFGRO0_USFGROn1_VSn1_VWA4_VWB4_WSGRA0_WSGRB0_WS32_WG32_4_1_WGM8_WGMXCC1_WGMXCCGn1
    SolutionIndex: 114
    SolutionNameMin: Cijk_Ailk_Bjlk_HSS_BH_Bias_S_HA_S_SAV_UserArgs_MT64x64x32_MI16x16x1_SN_LDSB0_AFC1_AFEM1_AFEM1_ASEM1_CLR0_CADS0_DTVA0_DTVB0_EPS0_FDSI0_GRPM1_GRVWA8_GRVWB4_GSU1_GSUAMB_GSUC0_GSUWGMRR0_GLS0_ISA1200_IU1_K1_LBSPPA1024_LBSPPB1024_LBSPPM0_LPA16_LPB16_LPM0_LRVW8_LWPMn1_MIAV1_MIWT2_2_MO40_NTn1_NTA0_NTB0_NTC0_NTD0_NTM0_NEPBS0_NLCA1_NLCB1_ONLL1_PGR2_PLR1_PKA0_SIA3_SS1_SU32_SUM0_SUS256_SPO0_SRVW0_SSO0_SVW1_SK0_SKXCCM0_TLDS0_ULSGRO0_USL1_UIOFGRO0_USFGROn1_VSn1_VWA1_VWB1_WSGRA0_WSGRB0_WS32_WG32_4_1_WGM8_WGMXCC1_WGMXCCGn1
    SolutionIndex: 115
    SolutionNameMin: Cijk_Ailk_Bjlk_HSS_BH_Bias_S_HA_S_SAV_UserArgs_MT128x128x32_MI16x16x1_SN_LDSB0_AFC1_AFEM1_AFEM1_ASEM1_CLR0_CADS0_DTVA0_DTVB0_EPS0_FDSI0_GRPM1_GRVWA4_GRVWB4_GSU1_GSUAMB_GSUC0_GSUWGMRR0_GLS0_ISA1200_IU1_K1_LBSPPA2048_LBSPPB2048_LBSPPM0_LPA0_LPB0_LPM0_LRVW8_LWPMn1_MIAV1_MIWT4_4_MO40_NTn1_NTA0_NTB0_NTC0_NTD0_NTM0_NEPBS0_NLCA1_NLCB1_ONLL1_PGR2_PLR0_PKA0_SIA1_SS0_SU32_SUM0_SUS256_SPO0_SRVW0_SSO0_SVW8_SK0_SKXCCM0_TLDS0_ULSGRO0_USL1_UIOFGRO0_USFGROn1_VSn1_VWA4_VWB4_WSGRA0_WSGRB0_WS32_WG32_4_1_WGM8_WGMXCC1_WGMXCCGn1
    SolutionIndex: 116
    SolutionNameMin: Cijk_Ailk_Bjlk_HSS_BH_Bias_S_HA_S_SAV_UserArgs_MT16x16x32_MI16x16x1_SN_LDSB1_AFC1_AFEM1_AFEM1_ASEM1_CLR0_CADS0_DTVA0_DTVB0_EPS0_FDSI0_GRPM1_GRVWA8_GRVWB8_GSU1_GSUAMB_GSUC0_GSUWGMRR0_GLS0_ISA1200_IU1_K1_LBSPPA256_LBSPPB256_LBSPPM0_LPA16_LPB16_LPM0_LRVW8_LWPMn1_MIAV1_MIWT1_1_MO40_NTn1_NTA0_NTB0_NTC0_NTD0_NTM0_NEPBS0_NLCA1_NLCB1_ONLL1_PGR2_PLR1_PKA0_SIA3_SS0_SU32_SUM0_SUS256_SPO0_SRVW0_SSO0_SVW8_SK0_SKXCCM0_TLDS0_ULSGRO0_USL1_UIOFGRO0_USFGROn1_VSn1_VWA1_VWB1_WSGRA0_WSGRB0_WS32_WG16_2_1_WGM8_WGMXCC1_WGMXCCGn1
    SolutionIndex: 117
    SolutionNameMin: Cijk_Ailk_Bjlk_HSS_BH_Bias_S_HA_S_SAV_UserArgs_MT128x128x32_MI16x16x1_SN_LDSB0_AFC1_AFEM1_AFEM1_ASEM1_CLR0_CADS0_DTVA0_DTVB0_EPS0_FDSI0_GRPM1_GRVWA8_GRVWB8_GSU1_GSUAMB_GSUC0_GSUWGMRR0_GLS0_ISA1200_IU1_K1_LBSPPA2048_LBSPPB2048_LBSPPM0_LPA16_LPB0_LPM0_LRVW8_LWPMn1_MIAV1_MIWT4_4_MO40_NTn1_NTA0_NTB0_NTC0_NTD0_NTM0_NEPBS0_NLCA1_NLCB1_ONLL1_PGR2_PLR0_PKA0_SIA1_SS1_SU32_SUM0_SUS256_SPO0_SRVW0_SSO0_SVW1_SK0_SKXCCM0_TLDS0_ULSGRO0_USL1_UIOFGRO0_USFGROn1_VSn1_VWA1_VWB4_WSGRA0_WSGRB0_WS32_WG32_4_1_WGM8_WGMXCC1_WGMXCCGn1
    SolutionIndex: 118
    SolutionNameMin: Cijk_Ailk_Bjlk_HSS_BH_Bias_S_HA_S_SAV_UserArgs_MT128x128x32_MI16x16x1_SN_LDSB0_AFC1_AFEM1_AFEM1_ASEM1_CLR0_CADS0_DTVA0_DTVB0_EPS0_FDSI0_GRPM1_GRVWA8_GRVWB8_GSU1_GSUAMB_GSUC0_GSUWGMRR0_GLS0_ISA1200_IU1_K1_LBSPPA2048_LBSPPB2048_LBSPPM0_LPA0_LPB16_LPM0_LRVW8_LWPMn1_MIAV1_MIWT4_4_MO40_NTn1_NTA0_NTB0_NTC0_NTD0_NTM0_NEPBS0_NLCA1_NLCB1_ONLL1_PGR2_PLR0_PKA0_SIA1_SS0_SU32_SUM0_SUS256_SPO0_SRVW0_SSO0_SVW8_SK0_SKXCCM0_TLDS0_ULSGRO0_USL1_UIOFGRO0_USFGROn1_VSn1_VWA4_VWB1_WSGRA0_WSGRB0_WS32_WG32_4_1_WGM8_WGMXCC1_WGMXCCGn1
    SolutionIndex: 119
    SolutionNameMin: Cijk_Ailk_Bjlk_HSS_BH_Bias_S_HA_S_SAV_UserArgs_MT128x128x32_MI16x16x1_SN_LDSB0_AFC1_AFEM1_AFEM1_ASEM1_CLR0_CADS0_DTVA0_DTVB0_EPS0_FDSI0_GRPM1_GRVWA4_GRVWB8_GSU1_GSUAMB_GSUC0_GSUWGMRR0_GLS0_ISA1200_IU1_K1_LBSPPA2048_LBSPPB2048_LBSPPM0_LPA16_LPB0_LPM0_LRVW8_LWPMn1_MIAV1_MIWT4_4_MO40_NTn1_NTA0_NTB0_NTC0_NTD0_NTM0_NEPBS0_NLCA1_NLCB1_ONLL1_PGR2_PLR0_PKA0_SIA1_SS0_SU32_SUM0_SUS256_SPO0_SRVW0_SSO0_SVW8_SK0_SKXCCM0_TLDS0_ULSGRO0_USL1_UIOFGRO0_USFGROn1_VSn1_VWA1_VWB4_WSGRA0_WSGRB0_WS32_WG32_4_1_WGM8_WGMXCC1_WGMXCCGn1
    SolutionIndex: 120
    SolutionNameMin: Cijk_Ailk_Bjlk_HSS_BH_Bias_S_HA_S_SAV_UserArgs_MT128x128x32_MI16x16x1_SN_LDSB0_AFC1_AFEM1_AFEM1_ASEM1_CLR0_CADS0_DTVA0_DTVB0_EPS0_FDSI0_GRPM1_GRVWA8_GRVWB8_GSU1_GSUAMB_GSUC0_GSUWGMRR0_GLS0_ISA1200_IU1_K1_LBSPPA2048_LBSPPB2048_LBSPPM0_LPA16_LPB0_LPM0_LRVW8_LWPMn1_MIAV1_MIWT4_4_MO40_NTn1_NTA0_NTB0_NTC0_NTD0_NTM0_NEPBS0_NLCA1_NLCB1_ONLL1_PGR2_PLR0_PKA0_SIA1_SS0_SU32_SUM0_SUS256_SPO0_SRVW0_SSO0_SVW8_SK0_SKXCCM0_TLDS0_ULSGRO0_USL1_UIOFGRO0_USFGROn1_VSn1_VWA1_VWB4_WSGRA0_WSGRB0_WS32_WG32_4_1_WGM8_WGMXCC1_WGMXCCGn1
    SolutionIndex: 121
    SolutionNameMin: Cijk_Ailk_Bjlk_HSS_BH_Bias_S_HA_S_SAV_UserArgs_MT128x128x32_MI16x16x1_SN_LDSB0_AFC1_AFEM1_AFEM1_ASEM1_CLR0_CADS0_DTVA0_DTVB0_EPS1_FDSI0_GRPM1_GRVWA4_GRVWB8_GSU1_GSUAMB_GSUC0_GSUWGMRR0_GLS0_ISA1200_IU1_K1_LBSPPA2048_LBSPPB2048_LBSPPM0_LPA0_LPB0_LPM0_LRVW8_LWPMn1_MIAV1_MIWT4_4_MO40_NTn1_NTA0_NTB0_NTC0_NTD0_NTM0_NEPBS0_NLCA1_NLCB1_ONLL1_PGR1_PLR0_PKA0_SIA1_SS0_SU32_SUM0_SUS256_SPO0_SRVW0_SSO0_SVW8_SK0_SKXCCM0_TLDS0_ULSGRO0_USL1_UIOFGRO0_USFGROn1_VSn1_VWA4_VWB4_WSGRA0_WSGRB0_WS32_WG32_4_1_WGM8_WGMXCC1_WGMXCCGn1
    SolutionIndex: 122
    SolutionNameMin: Cijk_Ailk_Bjlk_HSS_BH_Bias_S_HA_S_SAV_UserArgs_MT128x128x32_MI16x16x1_SN_LDSB0_AFC1_AFEM1_AFEM1_ASEM1_CLR0_CADS0_DTVA0_DTVB0_EPS0_FDSI0_GRPM1_GRVWA4_GRVWB4_GSU1_GSUAMB_GSUC0_GSUWGMRR0_GLS0_ISA1200_IU1_K1_LBSPPA2048_LBSPPB2048_LBSPPM0_LPA0_LPB0_LPM0_LRVW8_LWPMn1_MIAV1_MIWT4_4_MO40_NTn1_NTA0_NTB0_NTC0_NTD0_NTM0_NEPBS0_NLCA1_NLCB1_ONLL1_PGR1_PLR0_PKA0_SIA1_SS0_SU32_SUM0_SUS256_SPO0_SRVW0_SSO0_SVW8_SK0_SKXCCM0_TLDS0_ULSGRO0_USL1_UIOFGRO0_USFGROn1_VSn1_VWA4_VWB4_WSGRA0_WSGRB0_WS32_WG32_4_1_WGM8_WGMXCC1_WGMXCCGn1
    SolutionIndex: 123
    SolutionNameMin: Cijk_Ailk_Bjlk_HSS_BH_Bias_S_HA_S_SAV_UserArgs_MT128x128x32_MI16x16x1_SN_LDSB0_AFC1_AFEM1_AFEM1_ASEM1_CLR0_CADS0_DTVA0_DTVB0_EPS0_FDSI0_GRPM1_GRVWA4_GRVWB8_GSU1_GSUAMB_GSUC0_GSUWGMRR0_GLS0_ISA1200_IU1_K1_LBSPPA2048_LBSPPB2048_LBSPPM0_LPA0_LPB0_LPM0_LRVW8_LWPMn1_MIAV1_MIWT4_4_MO40_NTn1_NTA0_NTB0_NTC0_NTD0_NTM0_NEPBS0_NLCA1_NLCB1_ONLL1_PGR1_PLR0_PKA0_SIA1_SS0_SU32_SUM0_SUS256_SPO0_SRVW0_SSO0_SVW8_SK0_SKXCCM0_TLDS0_ULSGRO0_USL1_UIOFGRO0_USFGROn1_VSn1_VWA4_VWB4_WSGRA0_WSGRB0_WS32_WG32_4_1_WGM8_WGMXCC1_WGMXCCGn1
    SolutionIndex: 124
    SolutionNameMin: Cijk_Ailk_Bjlk_HSS_BH_Bias_S_HA_S_SAV_UserArgs_MT128x128x32_MI16x16x1_SN_LDSB0_AFC1_AFEM1_AFEM1_ASEM1_CLR0_CADS0_DTVA0_DTVB0_EPS0_FDSI0_GRPM1_GRVWA4_GRVWB8_GSU1_GSUAMB_GSUC0_GSUWGMRR0_GLS0_ISA1200_IU1_K1_LBSPPA2048_LBSPPB2048_LBSPPM0_LPA16_LPB0_LPM0_LRVW8_LWPMn1_MIAV1_MIWT4_4_MO40_NTn1_NTA0_NTB0_NTC0_NTD0_NTM0_NEPBS0_NLCA1_NLCB1_ONLL1_PGR2_PLR0_PKA0_SIA1_SS1_SU32_SUM0_SUS256_SPO0_SRVW0_SSO0_SVW1_SK0_SKXCCM0_TLDS0_ULSGRO0_USL1_UIOFGRO0_USFGROn1_VSn1_VWA1_VWB4_WSGRA0_WSGRB0_WS32_WG32_4_1_WGM8_WGMXCC1_WGMXCCGn1
    SolutionIndex: 125
    SolutionNameMin: Cijk_Ailk_Bjlk_HSS_BH_Bias_S_HA_S_SAV_UserArgs_MT128x128x32_MI16x16x1_SN_LDSB0_AFC1_AFEM1_AFEM1_ASEM1_CLR0_CADS0_DTVA0_DTVB0_EPS1_FDSI0_GRPM1_GRVWA4_GRVWB4_GSU1_GSUAMB_GSUC0_GSUWGMRR0_GLS0_ISA1200_IU1_K1_LBSPPA2048_LBSPPB2048_LBSPPM0_LPA0_LPB0_LPM0_LRVW8_LWPMn1_MIAV1_MIWT4_4_MO40_NTn1_NTA0_NTB0_NTC0_NTD0_NTM0_NEPBS0_NLCA1_NLCB1_ONLL1_PGR1_PLR0_PKA0_SIA1_SS0_SU32_SUM0_SUS256_SPO0_SRVW0_SSO0_SVW8_SK0_SKXCCM0_TLDS0_ULSGRO0_USL1_UIOFGRO0_USFGROn1_VSn1_VWA4_VWB4_WSGRA0_WSGRB0_WS32_WG32_4_1_WGM8_WGMXCC1_WGMXCCGn1
    SolutionIndex: 126
    SolutionNameMin: Cijk_Ailk_Bjlk_HSS_BH_Bias_S_HA_S_SAV_UserArgs_MT128x128x32_MI16x16x1_SN_LDSB0_AFC1_AFEM1_AFEM1_ASEM1_CLR0_CADS0_DTVA0_DTVB0_EPS0_FDSI0_GRPM1_GRVWA8_GRVWB4_GSU1_GSUAMB_GSUC0_GSUWGMRR0_GLS0_ISA1200_IU1_K1_LBSPPA2048_LBSPPB2048_LBSPPM0_LPA0_LPB16_LPM0_LRVW8_LWPMn1_MIAV1_MIWT4_4_MO40_NTn1_NTA0_NTB0_NTC0_NTD0_NTM0_NEPBS0_NLCA1_NLCB1_ONLL1_PGR2_PLR0_PKA0_SIA1_SS1_SU32_SUM0_SUS256_SPO0_SRVW0_SSO0_SVW4_SK0_SKXCCM0_TLDS0_ULSGRO0_USL1_UIOFGRO0_USFGROn1_VSn1_VWA4_VWB1_WSGRA0_WSGRB0_WS32_WG32_4_1_WGM8_WGMXCC1_WGMXCCGn1
    SolutionIndex: 127
    SolutionNameMin: Cijk_Ailk_Bjlk_HSS_BH_Bias_S_HA_S_SAV_UserArgs_MT128x128x32_MI16x16x1_SN_LDSB0_AFC1_AFEM1_AFEM1_ASEM1_CLR0_CADS0_DTVA0_DTVB0_EPS1_FDSI0_GRPM1_GRVWA8_GRVWB8_GSU1_GSUAMB_GSUC0_GSUWGMRR0_GLS0_ISA1200_IU1_K1_LBSPPA2048_LBSPPB2048_LBSPPM0_LPA0_LPB0_LPM0_LRVW8_LWPMn1_MIAV1_MIWT4_4_MO40_NTn1_NTA0_NTB0_NTC0_NTD0_NTM0_NEPBS0_NLCA1_NLCB1_ONLL1_PGR1_PLR0_PKA0_SIA3_SS0_SU32_SUM0_SUS256_SPO0_SRVW0_SSO0_SVW8_SK0_SKXCCM0_TLDS0_ULSGRO0_USL1_UIOFGRO0_USFGROn1_VSn1_VWA4_VWB4_WSGRA0_WSGRB0_WS32_WG32_4_1_WGM8_WGMXCC1_WGMXCCGn1
    SolutionIndex: 128
    SolutionNameMin: Cijk_Ailk_Bjlk_HSS_BH_Bias_S_HA_S_SAV_UserArgs_MT128x128x32_MI16x16x1_SN_LDSB0_AFC1_AFEM1_AFEM1_ASEM1_CLR0_CADS0_DTVA0_DTVB0_EPS0_FDSI0_GRPM1_GRVWA8_GRVWB4_GSU1_GSUAMB_GSUC0_GSUWGMRR0_GLS0_ISA1200_IU1_K1_LBSPPA2048_LBSPPB2048_LBSPPM0_LPA0_LPB16_LPM0_LRVW8_LWPMn1_MIAV1_MIWT4_4_MO40_NTn1_NTA0_NTB0_NTC0_NTD0_NTM0_NEPBS0_NLCA1_NLCB1_ONLL1_PGR2_PLR0_PKA0_SIA1_SS0_SU32_SUM0_SUS256_SPO0_SRVW0_SSO0_SVW8_SK0_SKXCCM0_TLDS0_ULSGRO0_USL1_UIOFGRO0_USFGROn1_VSn1_VWA4_VWB1_WSGRA0_WSGRB0_WS32_WG32_4_1_WGM8_WGMXCC1_WGMXCCGn1
    SolutionIndex: 129
    SolutionNameMin: Cijk_Ailk_Bjlk_HSS_BH_Bias_S_HA_S_SAV_UserArgs_MT128x128x32_MI16x16x1_SN_LDSB0_AFC1_AFEM1_AFEM1_ASEM1_CLR0_CADS0_DTVA0_DTVB0_EPS1_FDSI0_GRPM1_GRVWA4_GRVWB4_GSU1_GSUAMB_GSUC0_GSUWGMRR0_GLS0_ISA1200_IU1_K1_LBSPPA2048_LBSPPB2048_LBSPPM0_LPA0_LPB0_LPM0_LRVW8_LWPMn1_MIAV1_MIWT4_4_MO40_NTn1_NTA0_NTB0_NTC0_NTD0_NTM0_NEPBS0_NLCA1_NLCB1_ONLL1_PGR1_PLR0_PKA0_SIA3_SS0_SU32_SUM0_SUS256_SPO0_SRVW0_SSO0_SVW8_SK0_SKXCCM0_TLDS0_ULSGRO0_USL1_UIOFGRO0_USFGROn1_VSn1_VWA4_VWB4_WSGRA0_WSGRB0_WS32_WG32_4_1_WGM8_WGMXCC1_WGMXCCGn1
    SolutionIndex: 130
    SolutionNameMin: Cijk_Ailk_Bjlk_HSS_BH_Bias_S_HA_S_SAV_UserArgs_MT128x128x32_MI16x16x1_SN_LDSB0_AFC1_AFEM1_AFEM1_ASEM1_CLR0_CADS0_DTVA0_DTVB0_EPS0_FDSI0_GRPM1_GRVWA8_GRVWB4_GSU1_GSUAMB_GSUC0_GSUWGMRR0_GLS0_ISA1200_IU1_K1_LBSPPA2048_LBSPPB2048_LBSPPM0_LPA0_LPB0_LPM0_LRVW8_LWPMn1_MIAV1_MIWT4_4_MO40_NTn1_NTA0_NTB0_NTC0_NTD0_NTM0_NEPBS0_NLCA1_NLCB1_ONLL1_PGR2_PLR0_PKA0_SIA3_SS1_SU32_SUM0_SUS256_SPO0_SRVW0_SSO0_SVW4_SK0_SKXCCM0_TLDS0_ULSGRO0_USL1_UIOFGRO0_USFGROn1_VSn1_VWA4_VWB4_WSGRA0_WSGRB0_WS32_WG32_4_1_WGM8_WGMXCC1_WGMXCCGn1
    SolutionIndex: 131
    SolutionNameMin: Cijk_Ailk_Bjlk_HSS_BH_Bias_S_HA_S_SAV_UserArgs_MT128x128x32_MI16x16x1_SN_LDSB0_AFC1_AFEM1_AFEM1_ASEM1_CLR0_CADS0_DTVA0_DTVB0_EPS0_FDSI0_GRPM1_GRVWA8_GRVWB4_GSU1_GSUAMB_GSUC0_GSUWGMRR0_GLS0_ISA1200_IU1_K1_LBSPPA2048_LBSPPB2048_LBSPPM0_LPA16_LPB0_LPM0_LRVW8_LWPMn1_MIAV1_MIWT4_4_MO40_NTn1_NTA0_NTB0_NTC0_NTD0_NTM0_NEPBS0_NLCA1_NLCB1_ONLL1_PGR2_PLR0_PKA0_SIA1_SS0_SU32_SUM0_SUS256_SPO0_SRVW0_SSO0_SVW8_SK0_SKXCCM0_TLDS0_ULSGRO0_USL1_UIOFGRO0_USFGROn1_VSn1_VWA1_VWB4_WSGRA0_WSGRB0_WS32_WG32_4_1_WGM8_WGMXCC1_WGMXCCGn1
    SolutionIndex: 132
    SolutionNameMin: Cijk_Ailk_Bjlk_HSS_BH_Bias_S_HA_S_SAV_UserArgs_MT128x128x32_MI16x16x1_SN_LDSB0_AFC1_AFEM1_AFEM1_ASEM1_CLR0_CADS0_DTVA0_DTVB0_EPS1_FDSI0_GRPM1_GRVWA8_GRVWB4_GSU1_GSUAMB_GSUC0_GSUWGMRR0_GLS0_ISA1200_IU1_K1_LBSPPA2048_LBSPPB2048_LBSPPM0_LPA0_LPB0_LPM0_LRVW8_LWPMn1_MIAV1_MIWT4_4_MO40_NTn1_NTA0_NTB0_NTC0_NTD0_NTM0_NEPBS0_NLCA1_NLCB1_ONLL1_PGR1_PLR0_PKA0_SIA3_SS0_SU32_SUM0_SUS256_SPO0_SRVW0_SSO0_SVW8_SK0_SKXCCM0_TLDS0_ULSGRO0_USL1_UIOFGRO0_USFGROn1_VSn1_VWA4_VWB4_WSGRA0_WSGRB0_WS32_WG32_4_1_WGM8_WGMXCC1_WGMXCCGn1
    SolutionIndex: 133
    SolutionNameMin: Cijk_Ailk_Bjlk_HSS_BH_Bias_S_HA_S_SAV_UserArgs_MT128x128x32_MI16x16x1_SN_LDSB0_AFC1_AFEM1_AFEM1_ASEM1_CLR0_CADS0_DTVA0_DTVB0_EPS0_FDSI0_GRPM1_GRVWA4_GRVWB8_GSU1_GSUAMB_GSUC0_GSUWGMRR0_GLS0_ISA1200_IU1_K1_LBSPPA2048_LBSPPB2048_LBSPPM0_LPA0_LPB0_LPM0_LRVW8_LWPMn1_MIAV1_MIWT4_4_MO40_NTn1_NTA0_NTB0_NTC0_NTD0_NTM0_NEPBS0_NLCA1_NLCB1_ONLL1_PGR1_PLR0_PKA0_SIA3_SS0_SU32_SUM0_SUS256_SPO0_SRVW0_SSO0_SVW8_SK0_SKXCCM0_TLDS0_ULSGRO0_USL1_UIOFGRO0_USFGROn1_VSn1_VWA4_VWB4_WSGRA0_WSGRB0_WS32_WG32_4_1_WGM8_WGMXCC1_WGMXCCGn1
    SolutionIndex: 134
    SolutionNameMin: Cijk_Ailk_Bjlk_HSS_BH_Bias_S_HA_S_SAV_UserArgs_MT128x128x32_MI16x16x1_SN_LDSB0_AFC1_AFEM1_AFEM1_ASEM1_CLR0_CADS0_DTVA0_DTVB0_EPS0_FDSI0_GRPM1_GRVWA4_GRVWB4_GSU1_GSUAMB_GSUC0_GSUWGMRR0_GLS0_ISA1200_IU1_K1_LBSPPA2048_LBSPPB2048_LBSPPM0_LPA0_LPB0_LPM0_LRVW8_LWPMn1_MIAV1_MIWT4_4_MO40_NTn1_NTA0_NTB0_NTC0_NTD0_NTM0_NEPBS0_NLCA1_NLCB1_ONLL1_PGR1_PLR0_PKA0_SIA3_SS0_SU32_SUM0_SUS256_SPO0_SRVW0_SSO0_SVW8_SK0_SKXCCM0_TLDS0_ULSGRO0_USL1_UIOFGRO0_USFGROn1_VSn1_VWA4_VWB4_WSGRA0_WSGRB0_WS32_WG32_4_1_WGM8_WGMXCC1_WGMXCCGn1
    SolutionIndex: 135
    SolutionNameMin: Cijk_Ailk_Bjlk_HSS_BH_Bias_S_HA_S_SAV_UserArgs_MT16x16x32_MI16x16x1_SN_LDSB0_AFC1_AFEM1_AFEM1_ASEM1_CLR0_CADS0_DTVA0_DTVB0_EPS0_FDSI0_GRPM1_GRVWA8_GRVWB8_GSU1_GSUAMB_GSUC0_GSUWGMRR0_GLS0_ISA1200_IU1_K1_LBSPPA256_LBSPPB256_LBSPPM0_LPA16_LPB16_LPM0_LRVW8_LWPMn1_MIAV1_MIWT1_1_MO40_NTn1_NTA0_NTB0_NTC0_NTD0_NTM0_NEPBS0_NLCA1_NLCB1_ONLL1_PGR2_PLR0_PKA0_SIA1_SS0_SU32_SUM0_SUS256_SPO0_SRVW0_SSO0_SVW8_SK0_SKXCCM0_TLDS0_ULSGRO0_USL1_UIOFGRO0_USFGROn1_VSn1_VWA1_VWB1_WSGRA0_WSGRB0_WS32_WG16_2_1_WGM8_WGMXCC1_WGMXCCGn1
    SolutionIndex: 136
    SolutionNameMin: Cijk_Ailk_Bjlk_HSS_BH_Bias_S_HA_S_SAV_UserArgs_MT16x16x32_MI16x16x1_SN_LDSB1_AFC1_AFEM1_AFEM1_ASEM1_CLR0_CADS0_DTVA0_DTVB0_EPS0_FDSI0_GRPM1_GRVWA8_GRVWB8_GSU1_GSUAMB_GSUC0_GSUWGMRR0_GLS0_ISA1200_IU1_K1_LBSPPA128_LBSPPB128_LBSPPM0_LPA16_LPB16_LPM0_LRVW8_LWPMn1_MIAV1_MIWT1_1_MO40_NTn1_NTA0_NTB0_NTC0_NTD0_NTM0_NEPBS0_NLCA1_NLCB1_ONLL1_PGR2_PLR1_PKA0_SIA3_SS0_SU32_SUM0_SUS256_SPO0_SRVW0_SSO0_SVW8_SK0_SKXCCM0_TLDS2_ULSGRO0_USL1_UIOFGRO0_USFGROn1_VSn1_VWA1_VWB1_WSGRA0_WSGRB0_WS32_WG16_2_1_WGM8_WGMXCC1_WGMXCCGn1
    SolutionIndex: 137
    SolutionNameMin: Cijk_Ailk_Bjlk_HSS_BH_Bias_S_HA_S_SAV_UserArgs_MT64x64x32_MI16x16x1_SN_LDSB0_AFC1_AFEM1_AFEM1_ASEM1_CLR1_CADS0_DTVA0_DTVB0_EPS1_FDSI0_GRPM1_GRVWA8_GRVWB8_GSU1_GSUAMB_GSUC0_GSUWGMRR0_GLS0_ISA1200_IU1_K1_LBSPPA1024_LBSPPB1024_LBSPPM0_LPA16_LPB16_LPM0_LRVW8_LWPMn1_MIAV1_MIWT2_2_MO40_NTn1_NTA0_NTB0_NTC0_NTD0_NTM0_NEPBS0_NLCA1_NLCB1_ONLL1_PGR1_PLR1_PKA0_SIA3_SS0_SU32_SUM0_SUS256_SPO0_SRVW0_SSO0_SVW8_SK0_SKXCCM0_TLDS0_ULSGRO0_USL1_UIOFGRO0_USFGROn1_VSn1_VWA1_VWB1_WSGRA0_WSGRB0_WS32_WG32_4_1_WGM8_WGMXCC1_WGMXCCGn1
    SolutionIndex: 138
    SolutionNameMin: Cijk_Ailk_Bjlk_HSS_BH_Bias_S_HA_S_SAV_UserArgs_MT64x64x32_MI16x16x1_SN_LDSB1_AFC1_AFEM1_AFEM1_ASEM1_CLR1_CADS0_DTVA0_DTVB0_EPS0_FDSI0_GRPM1_GRVWA1_GRVWB1_GSU1_GSUAMB_GSUC0_GSUWGMRR0_GLS0_ISA1200_IU1_K1_LBSPPA1024_LBSPPB1024_LBSPPM0_LPA16_LPB16_LPM0_LRVW8_LWPMn1_MIAV1_MIWT2_2_MO40_NTn1_NTA0_NTB0_NTC0_NTD0_NTM0_NEPBS0_NLCA1_NLCB1_ONLL1_PGR2_PLR1_PKA0_SIA3_SS0_SU32_SUM0_SUS256_SPO0_SRVW0_SSO0_SVW8_SK0_SKXCCM0_TLDS0_ULSGRO0_USL1_UIOFGRO0_USFGROn1_VSn1_VWA1_VWB1_WSGRA0_WSGRB0_WS32_WG32_4_1_WGM8_WGMXCC1_WGMXCCGn1
    SolutionIndex: 139
    SolutionNameMin: Cijk_Ailk_Bjlk_HSS_BH_Bias_S_HA_S_SAV_UserArgs_MT64x64x32_MI16x16x1_SN_LDSB0_AFC1_AFEM1_AFEM1_ASEM1_CLR1_CADS0_DTVA0_DTVB0_EPS0_FDSI0_GRPM1_GRVWA8_GRVWB8_GSU1_GSUAMB_GSUC0_GSUWGMRR0_GLS0_ISA1200_IU1_K1_LBSPPA1024_LBSPPB1024_LBSPPM0_LPA16_LPB16_LPM0_LRVW8_LWPMn1_MIAV1_MIWT2_2_MO40_NTn1_NTA0_NTB0_NTC0_NTD0_NTM0_NEPBS0_NLCA1_NLCB1_ONLL1_PGR1_PLR1_PKA0_SIA3_SS0_SU32_SUM0_SUS256_SPO0_SRVW0_SSO0_SVW8_SK0_SKXCCM0_TLDS0_ULSGRO0_USL1_UIOFGRO0_USFGROn1_VSn1_VWA1_VWB1_WSGRA0_WSGRB0_WS32_WG32_4_1_WGM8_WGMXCC1_WGMXCCGn1
    SolutionIndex: 140
    SolutionNameMin: Cijk_Ailk_Bjlk_HSS_BH_Bias_S_HA_S_SAV_UserArgs_MT64x64x32_MI16x16x1_SN_LDSB1_AFC1_AFEM1_AFEM1_ASEM1_CLR1_CADS0_DTVA0_DTVB0_EPS1_FDSI0_GRPM1_GRVWA1_GRVWB1_GSU1_GSUAMB_GSUC0_GSUWGMRR0_GLS0_ISA1200_IU1_K1_LBSPPA1024_LBSPPB1024_LBSPPM0_LPA16_LPB16_LPM0_LRVW8_LWPMn1_MIAV1_MIWT2_2_MO40_NTn1_NTA0_NTB0_NTC0_NTD0_NTM0_NEPBS0_NLCA1_NLCB1_ONLL1_PGR1_PLR1_PKA0_SIA3_SS0_SU32_SUM0_SUS256_SPO0_SRVW0_SSO0_SVW8_SK0_SKXCCM0_TLDS0_ULSGRO0_USL1_UIOFGRO0_USFGROn1_VSn1_VWA1_VWB1_WSGRA0_WSGRB0_WS32_WG32_4_1_WGM8_WGMXCC1_WGMXCCGn1
    SolutionIndex: 141
    SolutionNameMin: Cijk_Ailk_Bjlk_HSS_BH_Bias_S_HA_S_SAV_UserArgs_MT64x64x32_MI16x16x1_SN_LDSB0_AFC1_AFEM1_AFEM1_ASEM1_CLR0_CADS0_DTVA0_DTVB0_EPS0_FDSI0_GRPM1_GRVWA8_GRVWB8_GSU1_GSUAMB_GSUC0_GSUWGMRR0_GLS0_ISA1200_IU1_K1_LBSPPA1024_LBSPPB1024_LBSPPM0_LPA16_LPB16_LPM0_LRVW8_LWPMn1_MIAV1_MIWT2_2_MO40_NTn1_NTA0_NTB0_NTC0_NTD0_NTM0_NEPBS0_NLCA1_NLCB1_ONLL1_PGR1_PLR0_PKA0_SIA1_SS0_SU32_SUM0_SUS256_SPO0_SRVW0_SSO0_SVW8_SK0_SKXCCM0_TLDS0_ULSGRO0_USL1_UIOFGRO0_USFGROn1_VSn1_VWA1_VWB1_WSGRA0_WSGRB0_WS32_WG32_4_1_WGM8_WGMXCC1_WGMXCCGn1
    SolutionIndex: 142
    SolutionNameMin: Cijk_Ailk_Bjlk_HSS_BH_Bias_S_HA_S_SAV_UserArgs_MT16x16x32_MI16x16x1_SN_LDSB1_AFC1_AFEM1_AFEM1_ASEM1_CLR1_CADS0_DTVA0_DTVB0_EPS0_FDSI0_GRPM1_GRVWA8_GRVWB8_GSU1_GSUAMB_GSUC0_GSUWGMRR0_GLS0_ISA1200_IU1_K1_LBSPPA128_LBSPPB128_LBSPPM0_LPA16_LPB16_LPM0_LRVW8_LWPMn1_MIAV1_MIWT1_1_MO40_NTn1_NTA0_NTB0_NTC0_NTD0_NTM0_NEPBS0_NLCA1_NLCB1_ONLL1_PGR2_PLR1_PKA0_SIA3_SS0_SU32_SUM0_SUS256_SPO0_SRVW0_SSO0_SVW8_SK0_SKXCCM0_TLDS2_ULSGRO0_USL1_UIOFGRO0_USFGROn1_VSn1_VWA1_VWB1_WSGRA0_WSGRB0_WS32_WG16_2_1_WGM8_WGMXCC1_WGMXCCGn1
    SolutionIndex: 143
    SolutionNameMin: Cijk_Ailk_Bjlk_HSS_BH_Bias_S_HA_S_SAV_UserArgs_MT64x64x32_MI16x16x1_SN_LDSB1_AFC1_AFEM1_AFEM1_ASEM1_CLR0_CADS0_DTVA0_DTVB0_EPS0_FDSI0_GRPM1_GRVWA8_GRVWB8_GSU1_GSUAMB_GSUC0_GSUWGMRR0_GLS0_ISA1200_IU1_K1_LBSPPA1024_LBSPPB1024_LBSPPM0_LPA16_LPB16_LPM0_LRVW8_LWPMn1_MIAV1_MIWT2_2_MO40_NTn1_NTA0_NTB0_NTC0_NTD0_NTM0_NEPBS0_NLCA1_NLCB1_ONLL1_PGR1_PLR1_PKA0_SIA3_SS1_SU32_SUM0_SUS256_SPO0_SRVW0_SSO0_SVW1_SK0_SKXCCM0_TLDS0_ULSGRO0_USL1_UIOFGRO0_USFGROn1_VSn1_VWA1_VWB1_WSGRA0_WSGRB0_WS32_WG32_4_1_WGM8_WGMXCC1_WGMXCCGn1
    SolutionIndex: 144
    SolutionNameMin: Cijk_Ailk_Bjlk_HSS_BH_Bias_S_HA_S_SAV_UserArgs_MT64x64x32_MI16x16x1_SN_LDSB1_AFC1_AFEM1_AFEM1_ASEM1_CLR0_CADS0_DTVA0_DTVB0_EPS1_FDSI0_GRPM1_GRVWA8_GRVWB8_GSU1_GSUAMB_GSUC0_GSUWGMRR0_GLS0_ISA1200_IU1_K1_LBSPPA1024_LBSPPB1024_LBSPPM0_LPA16_LPB16_LPM0_LRVW8_LWPMn1_MIAV1_MIWT2_2_MO40_NTn1_NTA0_NTB0_NTC0_NTD0_NTM0_NEPBS0_NLCA1_NLCB1_ONLL1_PGR1_PLR1_PKA0_SIA3_SS1_SU32_SUM0_SUS256_SPO0_SRVW0_SSO0_SVW1_SK0_SKXCCM0_TLDS0_ULSGRO0_USL1_UIOFGRO0_USFGROn1_VSn1_VWA1_VWB1_WSGRA0_WSGRB0_WS32_WG32_4_1_WGM8_WGMXCC1_WGMXCCGn1
    SolutionIndex: 145
    SolutionNameMin: Cijk_Ailk_Bjlk_HSS_BH_Bias_S_HA_S_SAV_UserArgs_MT64x64x32_MI16x16x1_SN_LDSB1_AFC1_AFEM1_AFEM1_ASEM1_CLR1_CADS0_DTVA0_DTVB0_EPS0_FDSI0_GRPM1_GRVWA8_GRVWB8_GSU1_GSUAMB_GSUC0_GSUWGMRR0_GLS0_ISA1200_IU1_K1_LBSPPA1024_LBSPPB1024_LBSPPM0_LPA16_LPB16_LPM0_LRVW8_LWPMn1_MIAV1_MIWT2_2_MO40_NTn1_NTA0_NTB0_NTC0_NTD0_NTM0_NEPBS0_NLCA1_NLCB1_ONLL1_PGR1_PLR1_PKA0_SIA3_SS1_SU32_SUM0_SUS256_SPO0_SRVW0_SSO0_SVW1_SK0_SKXCCM0_TLDS0_ULSGRO0_USL1_UIOFGRO0_USFGROn1_VSn1_VWA1_VWB1_WSGRA0_WSGRB0_WS32_WG32_4_1_WGM8_WGMXCC1_WGMXCCGn1
    SolutionIndex: 146
    SolutionNameMin: Cijk_Ailk_Bjlk_HSS_BH_Bias_S_HA_S_SAV_UserArgs_MT64x64x32_MI16x16x1_SN_LDSB1_AFC1_AFEM1_AFEM1_ASEM1_CLR1_CADS0_DTVA0_DTVB0_EPS0_FDSI0_GRPM1_GRVWA8_GRVWB8_GSU1_GSUAMB_GSUC0_GSUWGMRR0_GLS0_ISA1200_IU1_K1_LBSPPA1024_LBSPPB1024_LBSPPM0_LPA16_LPB16_LPM0_LRVW8_LWPMn1_MIAV1_MIWT2_2_MO40_NTn1_NTA0_NTB0_NTC0_NTD0_NTM0_NEPBS0_NLCA1_NLCB1_ONLL1_PGR1_PLR0_PKA0_SIA3_SS1_SU32_SUM0_SUS256_SPO0_SRVW0_SSO0_SVW1_SK0_SKXCCM0_TLDS0_ULSGRO0_USL1_UIOFGRO0_USFGROn1_VSn1_VWA1_VWB1_WSGRA0_WSGRB0_WS32_WG32_4_1_WGM8_WGMXCC1_WGMXCCGn1
    SolutionIndex: 147
    SolutionNameMin: Cijk_Ailk_Bjlk_HSS_BH_Bias_S_HA_S_SAV_UserArgs_MT64x64x32_MI16x16x1_SN_LDSB0_AFC1_AFEM1_AFEM1_ASEM1_CLR1_CADS0_DTVA0_DTVB0_EPS1_FDSI0_GRPM1_GRVWA8_GRVWB8_GSU1_GSUAMB_GSUC0_GSUWGMRR0_GLS0_ISA1200_IU1_K1_LBSPPA1024_LBSPPB1024_LBSPPM0_LPA16_LPB16_LPM0_LRVW8_LWPMn1_MIAV1_MIWT2_2_MO40_NTn1_NTA0_NTB0_NTC0_NTD0_NTM0_NEPBS0_NLCA1_NLCB1_ONLL1_PGR1_PLR0_PKA0_SIA1_SS0_SU32_SUM0_SUS256_SPO0_SRVW0_SSO0_SVW8_SK0_SKXCCM0_TLDS0_ULSGRO0_USL1_UIOFGRO0_USFGROn1_VSn1_VWA1_VWB1_WSGRA0_WSGRB0_WS32_WG32_4_1_WGM8_WGMXCC1_WGMXCCGn1
    SolutionIndex: 148
    SolutionNameMin: Cijk_Ailk_Bjlk_HSS_BH_Bias_S_HA_S_SAV_UserArgs_MT16x16x32_MI16x16x1_SN_LDSB1_AFC1_AFEM1_AFEM1_ASEM1_CLR1_CADS0_DTVA0_DTVB0_EPS0_FDSI0_GRPM1_GRVWA8_GRVWB8_GSU1_GSUAMB_GSUC0_GSUWGMRR0_GLS0_ISA1200_IU1_K1_LBSPPA256_LBSPPB256_LBSPPM0_LPA16_LPB16_LPM0_LRVW8_LWPMn1_MIAV1_MIWT1_1_MO40_NTn1_NTA0_NTB0_NTC0_NTD0_NTM0_NEPBS0_NLCA1_NLCB1_ONLL1_PGR2_PLR1_PKA0_SIA3_SS1_SU32_SUM0_SUS256_SPO0_SRVW0_SSO0_SVW1_SK0_SKXCCM0_TLDS0_ULSGRO0_USL1_UIOFGRO0_USFGROn1_VSn1_VWA1_VWB1_WSGRA0_WSGRB0_WS32_WG16_2_1_WGM8_WGMXCC1_WGMXCCGn1
    SolutionIndex: 149
    SolutionNameMin: Cijk_Ailk_Bjlk_HSS_BH_Bias_S_HA_S_SAV_UserArgs_MT16x16x32_MI16x16x1_SN_LDSB0_AFC1_AFEM1_AFEM1_ASEM1_CLR1_CADS0_DTVA0_DTVB0_EPS0_FDSI0_GRPM1_GRVWA8_GRVWB8_GSU1_GSUAMB_GSUC0_GSUWGMRR0_GLS0_ISA1200_IU1_K1_LBSPPA256_LBSPPB256_LBSPPM0_LPA16_LPB16_LPM0_LRVW8_LWPMn1_MIAV1_MIWT1_1_MO40_NTn1_NTA0_NTB0_NTC0_NTD0_NTM0_NEPBS0_NLCA1_NLCB1_ONLL1_PGR2_PLR1_PKA0_SIA3_SS0_SU32_SUM0_SUS256_SPO0_SRVW0_SSO0_SVW8_SK0_SKXCCM0_TLDS0_ULSGRO0_USL1_UIOFGRO0_USFGROn1_VSn1_VWA1_VWB1_WSGRA0_WSGRB0_WS32_WG16_2_1_WGM8_WGMXCC1_WGMXCCGn1
    SolutionIndex: 150
    SolutionNameMin: Cijk_Ailk_Bjlk_HSS_BH_Bias_S_HA_S_SAV_UserArgs_MT16x16x32_MI16x16x1_SN_LDSB0_AFC1_AFEM1_AFEM1_ASEM1_CLR0_CADS0_DTVA0_DTVB0_EPS0_FDSI0_GRPM1_GRVWA8_GRVWB8_GSU1_GSUAMB_GSUC0_GSUWGMRR0_GLS0_ISA1200_IU1_K1_LBSPPA256_LBSPPB256_LBSPPM0_LPA16_LPB16_LPM0_LRVW8_LWPMn1_MIAV1_MIWT1_1_MO40_NTn1_NTA0_NTB0_NTC0_NTD0_NTM0_NEPBS0_NLCA1_NLCB1_ONLL1_PGR2_PLR1_PKA0_SIA3_SS0_SU32_SUM0_SUS256_SPO0_SRVW0_SSO0_SVW8_SK0_SKXCCM0_TLDS0_ULSGRO0_USL1_UIOFGRO0_USFGROn1_VSn1_VWA1_VWB1_WSGRA0_WSGRB0_WS32_WG16_2_1_WGM8_WGMXCC1_WGMXCCGn1
    SolutionIndex: 151
    SolutionNameMin: Cijk_Ailk_Bjlk_HSS_BH_Bias_S_HA_S_SAV_UserArgs_MT16x16x32_MI16x16x1_SN_LDSB1_AFC1_AFEM1_AFEM1_ASEM1_CLR0_CADS0_DTVA0_DTVB0_EPS0_FDSI0_GRPM1_GRVWA1_GRVWB1_GSU1_GSUAMB_GSUC0_GSUWGMRR0_GLS0_ISA1200_IU1_K1_LBSPPA128_LBSPPB128_LBSPPM0_LPA16_LPB16_LPM0_LRVW8_LWPMn1_MIAV1_MIWT1_1_MO40_NTn1_NTA0_NTB0_NTC0_NTD0_NTM0_NEPBS0_NLCA1_NLCB1_ONLL1_PGR2_PLR1_PKA0_SIA3_SS0_SU32_SUM0_SUS256_SPO0_SRVW0_SSO0_SVW8_SK0_SKXCCM0_TLDS2_ULSGRO0_USL1_UIOFGRO0_USFGROn1_VSn1_VWA1_VWB1_WSGRA0_WSGRB0_WS32_WG16_2_1_WGM8_WGMXCC1_WGMXCCGn1
    SolutionIndex: 152
    SolutionNameMin: Cijk_Ailk_Bjlk_HSS_BH_Bias_S_HA_S_SAV_UserArgs_MT16x16x32_MI16x16x1_SN_LDSB0_AFC1_AFEM1_AFEM1_ASEM1_CLR1_CADS0_DTVA0_DTVB0_EPS0_FDSI0_GRPM1_GRVWA8_GRVWB8_GSU1_GSUAMB_GSUC0_GSUWGMRR0_GLS0_ISA1200_IU1_K1_LBSPPA256_LBSPPB256_LBSPPM0_LPA16_LPB16_LPM0_LRVW8_LWPMn1_MIAV1_MIWT1_1_MO40_NTn1_NTA0_NTB0_NTC0_NTD0_NTM0_NEPBS0_NLCA1_NLCB1_ONLL1_PGR2_PLR0_PKA0_SIA1_SS0_SU32_SUM0_SUS256_SPO0_SRVW0_SSO0_SVW8_SK0_SKXCCM0_TLDS0_ULSGRO0_USL1_UIOFGRO0_USFGROn1_VSn1_VWA1_VWB1_WSGRA0_WSGRB0_WS32_WG16_2_1_WGM8_WGMXCC1_WGMXCCGn1
    SolutionIndex: 153
    SolutionNameMin: Cijk_Ailk_Bjlk_HSS_BH_Bias_S_HA_S_SAV_UserArgs_MT16x16x32_MI16x16x1_SN_LDSB0_AFC1_AFEM1_AFEM1_ASEM1_CLR1_CADS0_DTVA0_DTVB0_EPS1_FDSI0_GRPM1_GRVWA8_GRVWB8_GSU1_GSUAMB_GSUC0_GSUWGMRR0_GLS0_ISA1200_IU1_K1_LBSPPA256_LBSPPB256_LBSPPM0_LPA16_LPB16_LPM0_LRVW8_LWPMn1_MIAV1_MIWT1_1_MO40_NTn1_NTA0_NTB0_NTC0_NTD0_NTM0_NEPBS0_NLCA1_NLCB1_ONLL1_PGR1_PLR1_PKA0_SIA1_SS0_SU32_SUM0_SUS256_SPO0_SRVW0_SSO0_SVW8_SK0_SKXCCM0_TLDS0_ULSGRO0_USL1_UIOFGRO0_USFGROn1_VSn1_VWA1_VWB1_WSGRA0_WSGRB0_WS32_WG16_2_1_WGM8_WGMXCC1_WGMXCCGn1
    SolutionIndex: 154
    SolutionNameMin: Cijk_Ailk_Bjlk_HSS_BH_Bias_S_HA_S_SAV_UserArgs_MT64x64x32_MI16x16x1_SN_LDSB0_AFC1_AFEM1_AFEM1_ASEM1_CLR0_CADS0_DTVA0_DTVB0_EPS0_FDSI0_GRPM1_GRVWA1_GRVWB1_GSU1_GSUAMB_GSUC0_GSUWGMRR0_GLS0_ISA1200_IU1_K1_LBSPPA1024_LBSPPB1024_LBSPPM0_LPA16_LPB16_LPM0_LRVW8_LWPMn1_MIAV1_MIWT2_2_MO40_NTn1_NTA0_NTB0_NTC0_NTD0_NTM0_NEPBS0_NLCA1_NLCB1_ONLL1_PGR2_PLR1_PKA0_SIA1_SS0_SU32_SUM0_SUS256_SPO0_SRVW0_SSO0_SVW8_SK0_SKXCCM0_TLDS0_ULSGRO0_USL1_UIOFGRO0_USFGROn1_VSn1_VWA1_VWB1_WSGRA0_WSGRB0_WS32_WG32_4_1_WGM8_WGMXCC1_WGMXCCGn1
    SolutionIndex: 155
    SolutionNameMin: Cijk_Ailk_Bjlk_HSS_BH_Bias_S_HA_S_SAV_UserArgs_MT64x64x32_MI16x16x1_SN_LDSB1_AFC1_AFEM1_AFEM1_ASEM1_CLR1_CADS0_DTVA0_DTVB0_EPS0_FDSI0_GRPM1_GRVWA8_GRVWB1_GSU1_GSUAMB_GSUC0_GSUWGMRR0_GLS0_ISA1200_IU1_K1_LBSPPA1024_LBSPPB1024_LBSPPM0_LPA16_LPB16_LPM0_LRVW8_LWPMn1_MIAV1_MIWT2_2_MO40_NTn1_NTA0_NTB0_NTC0_NTD0_NTM0_NEPBS0_NLCA1_NLCB1_ONLL1_PGR1_PLR1_PKA0_SIA3_SS0_SU32_SUM0_SUS256_SPO0_SRVW0_SSO0_SVW8_SK0_SKXCCM0_TLDS0_ULSGRO0_USL1_UIOFGRO0_USFGROn1_VSn1_VWA1_VWB1_WSGRA0_WSGRB0_WS32_WG32_4_1_WGM8_WGMXCC1_WGMXCCGn1
    SolutionIndex: 156
    SolutionNameMin: Cijk_Ailk_Bjlk_HSS_BH_Bias_S_HA_S_SAV_UserArgs_MT16x16x32_MI16x16x1_SN_LDSB0_AFC1_AFEM1_AFEM1_ASEM1_CLR0_CADS0_DTVA0_DTVB0_EPS0_FDSI0_GRPM1_GRVWA1_GRVWB1_GSU1_GSUAMB_GSUC0_GSUWGMRR0_GLS0_ISA1200_IU1_K1_LBSPPA128_LBSPPB128_LBSPPM0_LPA16_LPB16_LPM0_LRVW8_LWPMn1_MIAV1_MIWT1_1_MO40_NTn1_NTA0_NTB0_NTC0_NTD0_NTM0_NEPBS0_NLCA1_NLCB1_ONLL1_PGR2_PLR1_PKA0_SIA1_SS1_SU32_SUM0_SUS256_SPO0_SRVW0_SSO0_SVW1_SK0_SKXCCM0_TLDS2_ULSGRO0_USL1_UIOFGRO0_USFGROn1_VSn1_VWA1_VWB1_WSGRA0_WSGRB0_WS32_WG16_2_1_WGM8_WGMXCC1_WGMXCCGn1
    SolutionIndex: 157
    SolutionNameMin: Cijk_Ailk_Bjlk_HSS_BH_Bias_S_HA_S_SAV_UserArgs_MT16x16x32_MI16x16x1_SN_LDSB0_AFC1_AFEM1_AFEM1_ASEM1_CLR0_CADS0_DTVA0_DTVB0_EPS0_FDSI0_GRPM1_GRVWA8_GRVWB8_GSU1_GSUAMB_GSUC0_GSUWGMRR0_GLS0_ISA1200_IU1_K1_LBSPPA256_LBSPPB256_LBSPPM0_LPA16_LPB16_LPM0_LRVW8_LWPMn1_MIAV1_MIWT1_1_MO40_NTn1_NTA0_NTB0_NTC0_NTD0_NTM0_NEPBS0_NLCA1_NLCB1_ONLL1_PGR1_PLR1_PKA0_SIA1_SS0_SU32_SUM0_SUS256_SPO0_SRVW0_SSO0_SVW8_SK0_SKXCCM0_TLDS0_ULSGRO0_USL1_UIOFGRO0_USFGROn1_VSn1_VWA1_VWB1_WSGRA0_WSGRB0_WS32_WG16_2_1_WGM8_WGMXCC1_WGMXCCGn1
    SolutionIndex: 158
    SolutionNameMin: Cijk_Ailk_Bjlk_HSS_BH_Bias_S_HA_S_SAV_UserArgs_MT16x16x32_MI16x16x1_SN_LDSB0_AFC1_AFEM1_AFEM1_ASEM1_CLR0_CADS0_DTVA0_DTVB0_EPS1_FDSI0_GRPM1_GRVWA8_GRVWB8_GSU1_GSUAMB_GSUC0_GSUWGMRR0_GLS0_ISA1200_IU1_K1_LBSPPA256_LBSPPB256_LBSPPM0_LPA16_LPB16_LPM0_LRVW8_LWPMn1_MIAV1_MIWT1_1_MO40_NTn1_NTA0_NTB0_NTC0_NTD0_NTM0_NEPBS0_NLCA1_NLCB1_ONLL1_PGR1_PLR1_PKA0_SIA1_SS0_SU32_SUM0_SUS256_SPO0_SRVW0_SSO0_SVW8_SK0_SKXCCM0_TLDS0_ULSGRO0_USL1_UIOFGRO0_USFGROn1_VSn1_VWA1_VWB1_WSGRA0_WSGRB0_WS32_WG16_2_1_WGM8_WGMXCC1_WGMXCCGn1
    SolutionIndex: 159
    SolutionNameMin: Cijk_Ailk_Bjlk_HSS_BH_Bias_S_HA_S_SAV_UserArgs_MT16x16x32_MI16x16x1_SN_LDSB1_AFC1_AFEM1_AFEM1_ASEM1_CLR1_CADS0_DTVA0_DTVB0_EPS1_FDSI0_GRPM1_GRVWA1_GRVWB1_GSU1_GSUAMB_GSUC0_GSUWGMRR0_GLS0_ISA1200_IU1_K1_LBSPPA128_LBSPPB128_LBSPPM0_LPA16_LPB16_LPM0_LRVW8_LWPMn1_MIAV1_MIWT1_1_MO40_NTn1_NTA0_NTB0_NTC0_NTD0_NTM0_NEPBS0_NLCA1_NLCB1_ONLL1_PGR1_PLR0_PKA0_SIA3_SS0_SU32_SUM0_SUS256_SPO0_SRVW0_SSO0_SVW8_SK0_SKXCCM0_TLDS2_ULSGRO0_USL1_UIOFGRO0_USFGROn1_VSn1_VWA1_VWB1_WSGRA0_WSGRB0_WS32_WG16_2_1_WGM8_WGMXCC1_WGMXCCGn1
    SolutionIndex: 160
    SolutionNameMin: Cijk_Ailk_Bjlk_HSS_BH_Bias_S_HA_S_SAV_UserArgs_MT64x64x32_MI16x16x1_SN_LDSB0_AFC1_AFEM1_AFEM1_ASEM1_CLR1_CADS0_DTVA0_DTVB0_EPS1_FDSI0_GRPM1_GRVWA1_GRVWB1_GSU1_GSUAMB_GSUC0_GSUWGMRR0_GLS0_ISA1200_IU1_K1_LBSPPA1024_LBSPPB1024_LBSPPM0_LPA16_LPB16_LPM0_LRVW8_LWPMn1_MIAV1_MIWT2_2_MO40_NTn1_NTA0_NTB0_NTC0_NTD0_NTM0_NEPBS0_NLCA1_NLCB1_ONLL1_PGR1_PLR1_PKA0_SIA1_SS0_SU32_SUM0_SUS256_SPO0_SRVW0_SSO0_SVW8_SK0_SKXCCM0_TLDS0_ULSGRO0_USL1_UIOFGRO0_USFGROn1_VSn1_VWA1_VWB1_WSGRA0_WSGRB0_WS32_WG32_4_1_WGM8_WGMXCC1_WGMXCCGn1
    SolutionIndex: 161
    SolutionNameMin: Cijk_Ailk_Bjlk_HSS_BH_Bias_S_HA_S_SAV_UserArgs_MT16x16x32_MI16x16x1_SN_LDSB0_AFC1_AFEM1_AFEM1_ASEM1_CLR0_CADS0_DTVA0_DTVB0_EPS0_FDSI0_GRPM1_GRVWA8_GRVWB8_GSU1_GSUAMB_GSUC0_GSUWGMRR0_GLS0_ISA1200_IU1_K1_LBSPPA256_LBSPPB256_LBSPPM0_LPA16_LPB16_LPM0_LRVW8_LWPMn1_MIAV1_MIWT1_1_MO40_NTn1_NTA0_NTB0_NTC0_NTD0_NTM0_NEPBS0_NLCA1_NLCB1_ONLL1_PGR1_PLR1_PKA0_SIA1_SS1_SU32_SUM0_SUS256_SPO0_SRVW0_SSO0_SVW1_SK0_SKXCCM0_TLDS0_ULSGRO0_USL1_UIOFGRO0_USFGROn1_VSn1_VWA1_VWB1_WSGRA0_WSGRB0_WS32_WG16_2_1_WGM8_WGMXCC1_WGMXCCGn1
    SolutionIndex: 162
    SolutionNameMin: Cijk_Ailk_Bjlk_HSS_BH_Bias_S_HA_S_SAV_UserArgs_MT16x16x32_MI16x16x1_SN_LDSB0_AFC1_AFEM1_AFEM1_ASEM1_CLR0_CADS0_DTVA0_DTVB0_EPS1_FDSI0_GRPM1_GRVWA8_GRVWB8_GSU1_GSUAMB_GSUC0_GSUWGMRR0_GLS0_ISA1200_IU1_K1_LBSPPA256_LBSPPB256_LBSPPM0_LPA16_LPB16_LPM0_LRVW8_LWPMn1_MIAV1_MIWT1_1_MO40_NTn1_NTA0_NTB0_NTC0_NTD0_NTM0_NEPBS0_NLCA1_NLCB1_ONLL1_PGR1_PLR0_PKA0_SIA1_SS0_SU32_SUM0_SUS256_SPO0_SRVW0_SSO0_SVW8_SK0_SKXCCM0_TLDS0_ULSGRO0_USL1_UIOFGRO0_USFGROn1_VSn1_VWA1_VWB1_WSGRA0_WSGRB0_WS32_WG16_2_1_WGM8_WGMXCC1_WGMXCCGn1
    SolutionIndex: 163
    SolutionNameMin: Cijk_Ailk_Bjlk_HSS_BH_Bias_S_HA_S_SAV_UserArgs_MT64x64x32_MI16x16x1_SN_LDSB0_AFC1_AFEM1_AFEM1_ASEM1_CLR0_CADS0_DTVA0_DTVB0_EPS1_FDSI0_GRPM1_GRVWA1_GRVWB1_GSU1_GSUAMB_GSUC0_GSUWGMRR0_GLS0_ISA1200_IU1_K1_LBSPPA1024_LBSPPB1024_LBSPPM0_LPA16_LPB16_LPM0_LRVW8_LWPMn1_MIAV1_MIWT2_2_MO40_NTn1_NTA0_NTB0_NTC0_NTD0_NTM0_NEPBS0_NLCA1_NLCB1_ONLL1_PGR1_PLR1_PKA0_SIA1_SS0_SU32_SUM0_SUS256_SPO0_SRVW0_SSO0_SVW8_SK0_SKXCCM0_TLDS0_ULSGRO0_USL1_UIOFGRO0_USFGROn1_VSn1_VWA1_VWB1_WSGRA0_WSGRB0_WS32_WG32_4_1_WGM8_WGMXCC1_WGMXCCGn1
    SolutionIndex: 164
    SolutionNameMin: Cijk_Ailk_Bjlk_HSS_BH_Bias_S_HA_S_SAV_UserArgs_MT16x16x32_MI16x16x1_SN_LDSB0_AFC1_AFEM1_AFEM1_ASEM1_CLR0_CADS0_DTVA0_DTVB0_EPS0_FDSI0_GRPM1_GRVWA8_GRVWB8_GSU1_GSUAMB_GSUC0_GSUWGMRR0_GLS0_ISA1200_IU1_K1_LBSPPA128_LBSPPB128_LBSPPM0_LPA16_LPB16_LPM0_LRVW8_LWPMn1_MIAV1_MIWT1_1_MO40_NTn1_NTA0_NTB0_NTC0_NTD0_NTM0_NEPBS0_NLCA1_NLCB1_ONLL1_PGR2_PLR1_PKA0_SIA1_SS1_SU32_SUM0_SUS256_SPO0_SRVW0_SSO0_SVW1_SK0_SKXCCM0_TLDS2_ULSGRO0_USL1_UIOFGRO0_USFGROn1_VSn1_VWA1_VWB1_WSGRA0_WSGRB0_WS32_WG16_2_1_WGM8_WGMXCC1_WGMXCCGn1
    SolutionIndex: 165
    SolutionNameMin: Cijk_Ailk_Bjlk_HSS_BH_Bias_S_HA_S_SAV_UserArgs_MT64x64x32_MI16x16x1_SN_LDSB0_AFC1_AFEM1_AFEM1_ASEM1_CLR1_CADS0_DTVA0_DTVB0_EPS0_FDSI0_GRPM1_GRVWA1_GRVWB8_GSU1_GSUAMB_GSUC0_GSUWGMRR0_GLS0_ISA1200_IU1_K1_LBSPPA1024_LBSPPB1024_LBSPPM0_LPA16_LPB16_LPM0_LRVW8_LWPMn1_MIAV1_MIWT2_2_MO40_NTn1_NTA0_NTB0_NTC0_NTD0_NTM0_NEPBS0_NLCA1_NLCB1_ONLL1_PGR2_PLR1_PKA0_SIA1_SS0_SU32_SUM0_SUS256_SPO0_SRVW0_SSO0_SVW8_SK0_SKXCCM0_TLDS0_ULSGRO0_USL1_UIOFGRO0_USFGROn1_VSn1_VWA1_VWB1_WSGRA0_WSGRB0_WS32_WG32_4_1_WGM8_WGMXCC1_WGMXCCGn1
    SolutionIndex: 166
    SolutionNameMin: Cijk_Ailk_Bjlk_HSS_BH_Bias_S_HA_S_SAV_UserArgs_MT64x64x32_MI16x16x1_SN_LDSB0_AFC1_AFEM1_AFEM1_ASEM1_CLR1_CADS0_DTVA0_DTVB0_EPS0_FDSI0_GRPM1_GRVWA8_GRVWB8_GSU1_GSUAMB_GSUC0_GSUWGMRR0_GLS0_ISA1200_IU1_K1_LBSPPA1024_LBSPPB1024_LBSPPM0_LPA16_LPB16_LPM0_LRVW8_LWPMn1_MIAV1_MIWT2_2_MO40_NTn1_NTA0_NTB0_NTC0_NTD0_NTM0_NEPBS0_NLCA1_NLCB1_ONLL1_PGR1_PLR1_PKA0_SIA1_SS1_SU32_SUM0_SUS256_SPO0_SRVW0_SSO0_SVW1_SK0_SKXCCM0_TLDS0_ULSGRO0_USL1_UIOFGRO0_USFGROn1_VSn1_VWA1_VWB1_WSGRA0_WSGRB0_WS32_WG32_4_1_WGM8_WGMXCC1_WGMXCCGn1
    SolutionIndex: 167
    SolutionNameMin: Cijk_Ailk_Bjlk_HSS_BH_Bias_S_HA_S_SAV_UserArgs_MT128x128x32_MI16x16x1_SN_LDSB0_AFC1_AFEM1_AFEM1_ASEM1_CLR0_CADS0_DTVA0_DTVB0_EPS1_FDSI0_GRPM1_GRVWA8_GRVWB8_GSU1_GSUAMB_GSUC0_GSUWGMRR0_GLS0_ISA1200_IU1_K1_LBSPPA2048_LBSPPB2048_LBSPPM0_LPA0_LPB16_LPM0_LRVW8_LWPMn1_MIAV1_MIWT4_4_MO40_NTn1_NTA0_NTB0_NTC0_NTD0_NTM0_NEPBS0_NLCA1_NLCB1_ONLL1_PGR1_PLR0_PKA0_SIA3_SS1_SU32_SUM0_SUS256_SPO0_SRVW0_SSO0_SVW4_SK0_SKXCCM0_TLDS0_ULSGRO0_USL1_UIOFGRO0_USFGROn1_VSn1_VWA4_VWB1_WSGRA0_WSGRB0_WS32_WG32_4_1_WGM8_WGMXCC1_WGMXCCGn1
    SolutionIndex: 168
    SolutionNameMin: Cijk_Ailk_Bjlk_HSS_BH_Bias_S_HA_S_SAV_UserArgs_MT64x64x32_MI16x16x1_SN_LDSB0_AFC1_AFEM1_AFEM1_ASEM1_CLR0_CADS0_DTVA0_DTVB0_EPS0_FDSI0_GRPM1_GRVWA1_GRVWB8_GSU1_GSUAMB_GSUC0_GSUWGMRR0_GLS0_ISA1200_IU1_K1_LBSPPA1024_LBSPPB1024_LBSPPM0_LPA16_LPB16_LPM0_LRVW8_LWPMn1_MIAV1_MIWT2_2_MO40_NTn1_NTA0_NTB0_NTC0_NTD0_NTM0_NEPBS0_NLCA1_NLCB1_ONLL1_PGR2_PLR1_PKA0_SIA1_SS0_SU32_SUM0_SUS256_SPO0_SRVW0_SSO0_SVW8_SK0_SKXCCM0_TLDS0_ULSGRO0_USL1_UIOFGRO0_USFGROn1_VSn1_VWA1_VWB1_WSGRA0_WSGRB0_WS32_WG32_4_1_WGM8_WGMXCC1_WGMXCCGn1
    SolutionIndex: 169
    SolutionNameMin: Cijk_Ailk_Bjlk_HSS_BH_Bias_S_HA_S_SAV_UserArgs_MT128x128x32_MI16x16x1_SN_LDSB0_AFC1_AFEM1_AFEM1_ASEM1_CLR0_CADS0_DTVA0_DTVB0_EPS0_FDSI0_GRPM1_GRVWA8_GRVWB8_GSU1_GSUAMB_GSUC0_GSUWGMRR0_GLS0_ISA1200_IU1_K1_LBSPPA2048_LBSPPB2048_LBSPPM0_LPA16_LPB0_LPM0_LRVW8_LWPMn1_MIAV1_MIWT4_4_MO40_NTn1_NTA0_NTB0_NTC0_NTD0_NTM0_NEPBS0_NLCA1_NLCB1_ONLL1_PGR1_PLR0_PKA0_SIA1_SS0_SU32_SUM0_SUS256_SPO0_SRVW0_SSO0_SVW8_SK0_SKXCCM0_TLDS0_ULSGRO0_USL1_UIOFGRO0_USFGROn1_VSn1_VWA1_VWB4_WSGRA0_WSGRB0_WS32_WG32_4_1_WGM8_WGMXCC1_WGMXCCGn1
    SolutionIndex: 170
    SolutionNameMin: Cijk_Ailk_Bjlk_HSS_BH_Bias_S_HA_S_SAV_UserArgs_MT128x128x32_MI16x16x1_SN_LDSB0_AFC1_AFEM1_AFEM1_ASEM1_CLR0_CADS0_DTVA0_DTVB0_EPS0_FDSI0_GRPM1_GRVWA8_GRVWB8_GSU1_GSUAMB_GSUC0_GSUWGMRR0_GLS0_ISA1200_IU1_K1_LBSPPA2048_LBSPPB2048_LBSPPM0_LPA16_LPB0_LPM0_LRVW8_LWPMn1_MIAV1_MIWT4_4_MO40_NTn1_NTA0_NTB0_NTC0_NTD0_NTM0_NEPBS0_NLCA1_NLCB1_ONLL1_PGR2_PLR0_PKA0_SIA3_SS0_SU32_SUM0_SUS256_SPO0_SRVW0_SSO0_SVW8_SK0_SKXCCM0_TLDS0_ULSGRO0_USL1_UIOFGRO0_USFGROn1_VSn1_VWA1_VWB4_WSGRA0_WSGRB0_WS32_WG32_4_1_WGM8_WGMXCC1_WGMXCCGn1
    SolutionIndex: 171
    SolutionNameMin: Cijk_Ailk_Bjlk_HSS_BH_Bias_S_HA_S_SAV_UserArgs_MT64x64x32_MI16x16x1_SN_LDSB0_AFC1_AFEM1_AFEM1_ASEM1_CLR0_CADS0_DTVA0_DTVB0_EPS1_FDSI0_GRPM1_GRVWA8_GRVWB8_GSU1_GSUAMB_GSUC0_GSUWGMRR0_GLS0_ISA1200_IU1_K1_LBSPPA1024_LBSPPB1024_LBSPPM0_LPA16_LPB16_LPM0_LRVW8_LWPMn1_MIAV1_MIWT2_2_MO40_NTn1_NTA0_NTB0_NTC0_NTD0_NTM0_NEPBS0_NLCA1_NLCB1_ONLL1_PGR1_PLR1_PKA0_SIA1_SS1_SU32_SUM0_SUS256_SPO0_SRVW0_SSO0_SVW1_SK0_SKXCCM0_TLDS0_ULSGRO0_USL1_UIOFGRO0_USFGROn1_VSn1_VWA1_VWB1_WSGRA0_WSGRB0_WS32_WG32_4_1_WGM8_WGMXCC1_WGMXCCGn1
    SolutionIndex: 172
    SolutionNameMin: Cijk_Ailk_Bjlk_HSS_BH_Bias_S_HA_S_SAV_UserArgs_MT128x128x32_MI16x16x1_SN_LDSB0_AFC1_AFEM1_AFEM1_ASEM1_CLR0_CADS0_DTVA0_DTVB0_EPS1_FDSI0_GRPM1_GRVWA8_GRVWB8_GSU1_GSUAMB_GSUC0_GSUWGMRR0_GLS0_ISA1200_IU1_K1_LBSPPA2048_LBSPPB2048_LBSPPM0_LPA16_LPB0_LPM0_LRVW8_LWPMn1_MIAV1_MIWT4_4_MO40_NTn1_NTA0_NTB0_NTC0_NTD0_NTM0_NEPBS0_NLCA1_NLCB1_ONLL1_PGR1_PLR0_PKA0_SIA3_SS0_SU32_SUM0_SUS256_SPO0_SRVW0_SSO0_SVW8_SK0_SKXCCM0_TLDS0_ULSGRO0_USL1_UIOFGRO0_USFGROn1_VSn1_VWA1_VWB4_WSGRA0_WSGRB0_WS32_WG32_4_1_WGM8_WGMXCC1_WGMXCCGn1
    SolutionIndex: 173
    SolutionNameMin: Cijk_Ailk_Bjlk_HSS_BH_Bias_S_HA_S_SAV_UserArgs_MT128x128x32_MI16x16x1_SN_LDSB0_AFC1_AFEM1_AFEM1_ASEM1_CLR0_CADS0_DTVA0_DTVB0_EPS1_FDSI0_GRPM1_GRVWA8_GRVWB8_GSU1_GSUAMB_GSUC0_GSUWGMRR0_GLS0_ISA1200_IU1_K1_LBSPPA2048_LBSPPB2048_LBSPPM0_LPA16_LPB16_LPM0_LRVW8_LWPMn1_MIAV1_MIWT4_4_MO40_NTn1_NTA0_NTB0_NTC0_NTD0_NTM0_NEPBS0_NLCA1_NLCB1_ONLL1_PGR1_PLR0_PKA0_SIA1_SS0_SU32_SUM0_SUS256_SPO0_SRVW0_SSO0_SVW8_SK0_SKXCCM0_TLDS0_ULSGRO0_USL1_UIOFGRO0_USFGROn1_VSn1_VWA1_VWB1_WSGRA0_WSGRB0_WS32_WG32_4_1_WGM8_WGMXCC1_WGMXCCGn1
    SolutionIndex: 174
    SolutionNameMin: Cijk_Ailk_Bjlk_HSS_BH_Bias_S_HA_S_SAV_UserArgs_MT16x16x32_MI16x16x1_SN_LDSB0_AFC1_AFEM1_AFEM1_ASEM1_CLR0_CADS0_DTVA0_DTVB0_EPS0_FDSI0_GRPM1_GRVWA8_GRVWB8_GSU1_GSUAMB_GSUC0_GSUWGMRR0_GLS0_ISA1200_IU1_K1_LBSPPA128_LBSPPB128_LBSPPM0_LPA16_LPB16_LPM0_LRVW8_LWPMn1_MIAV1_MIWT1_1_MO40_NTn1_NTA0_NTB0_NTC0_NTD0_NTM0_NEPBS0_NLCA1_NLCB1_ONLL1_PGR2_PLR0_PKA0_SIA1_SS0_SU32_SUM0_SUS256_SPO0_SRVW0_SSO0_SVW8_SK0_SKXCCM0_TLDS2_ULSGRO0_USL1_UIOFGRO0_USFGROn1_VSn1_VWA1_VWB1_WSGRA0_WSGRB0_WS32_WG16_2_1_WGM8_WGMXCC1_WGMXCCGn1
    SolutionIndex: 175
    SolutionNameMin: Cijk_Ailk_Bjlk_HSS_BH_Bias_S_HA_S_SAV_UserArgs_MT128x128x32_MI16x16x1_SN_LDSB0_AFC1_AFEM1_AFEM1_ASEM1_CLR0_CADS0_DTVA0_DTVB0_EPS1_FDSI0_GRPM1_GRVWA8_GRVWB8_GSU1_GSUAMB_GSUC0_GSUWGMRR0_GLS0_ISA1200_IU1_K1_LBSPPA2048_LBSPPB2048_LBSPPM0_LPA16_LPB0_LPM0_LRVW8_LWPMn1_MIAV1_MIWT4_4_MO40_NTn1_NTA0_NTB0_NTC0_NTD0_NTM0_NEPBS0_NLCA1_NLCB1_ONLL1_PGR1_PLR0_PKA0_SIA1_SS0_SU32_SUM0_SUS256_SPO0_SRVW0_SSO0_SVW8_SK0_SKXCCM0_TLDS0_ULSGRO0_USL1_UIOFGRO0_USFGROn1_VSn1_VWA1_VWB4_WSGRA0_WSGRB0_WS32_WG32_4_1_WGM8_WGMXCC1_WGMXCCGn1
    SolutionIndex: 176
    SolutionNameMin: Cijk_Ailk_Bjlk_HSS_BH_Bias_S_HA_S_SAV_UserArgs_MT64x64x32_MI16x16x1_SN_LDSB0_AFC1_AFEM1_AFEM1_ASEM1_CLR0_CADS0_DTVA0_DTVB0_EPS0_FDSI0_GRPM1_GRVWA8_GRVWB8_GSU1_GSUAMB_GSUC0_GSUWGMRR0_GLS0_ISA1200_IU1_K1_LBSPPA1024_LBSPPB1024_LBSPPM0_LPA16_LPB16_LPM0_LRVW8_LWPMn1_MIAV1_MIWT2_2_MO40_NTn1_NTA0_NTB0_NTC0_NTD0_NTM0_NEPBS0_NLCA1_NLCB1_ONLL1_PGR1_PLR0_PKA0_SIA3_SS0_SU32_SUM0_SUS256_SPO0_SRVW0_SSO0_SVW8_SK0_SKXCCM0_TLDS0_ULSGRO0_USL1_UIOFGRO0_USFGROn1_VSn1_VWA1_VWB1_WSGRA0_WSGRB0_WS32_WG32_4_1_WGM8_WGMXCC1_WGMXCCGn1
    SolutionIndex: 177
    SolutionNameMin: Cijk_Ailk_Bjlk_HSS_BH_Bias_S_HA_S_SAV_UserArgs_MT16x16x32_MI16x16x1_SN_LDSB0_AFC1_AFEM1_AFEM1_ASEM1_CLR1_CADS0_DTVA0_DTVB0_EPS0_FDSI0_GRPM1_GRVWA8_GRVWB8_GSU1_GSUAMB_GSUC0_GSUWGMRR0_GLS0_ISA1200_IU1_K1_LBSPPA128_LBSPPB128_LBSPPM0_LPA16_LPB16_LPM0_LRVW8_LWPMn1_MIAV1_MIWT1_1_MO40_NTn1_NTA0_NTB0_NTC0_NTD0_NTM0_NEPBS0_NLCA1_NLCB1_ONLL1_PGR2_PLR1_PKA0_SIA1_SS0_SU32_SUM0_SUS256_SPO0_SRVW0_SSO0_SVW8_SK0_SKXCCM0_TLDS2_ULSGRO0_USL1_UIOFGRO0_USFGROn1_VSn1_VWA1_VWB1_WSGRA0_WSGRB0_WS32_WG16_2_1_WGM8_WGMXCC1_WGMXCCGn1
    SolutionIndex: 178
    SolutionNameMin: Cijk_Ailk_Bjlk_HSS_BH_Bias_S_HA_S_SAV_UserArgs_MT16x16x32_MI16x16x1_SN_LDSB1_AFC1_AFEM1_AFEM1_ASEM1_CLR1_CADS0_DTVA0_DTVB0_EPS0_FDSI0_GRPM1_GRVWA8_GRVWB8_GSU1_GSUAMB_GSUC0_GSUWGMRR0_GLS0_ISA1200_IU1_K1_LBSPPA128_LBSPPB128_LBSPPM0_LPA16_LPB16_LPM0_LRVW8_LWPMn1_MIAV1_MIWT1_1_MO40_NTn1_NTA0_NTB0_NTC0_NTD0_NTM0_NEPBS0_NLCA1_NLCB1_ONLL1_PGR2_PLR0_PKA0_SIA3_SS0_SU32_SUM0_SUS256_SPO0_SRVW0_SSO0_SVW8_SK0_SKXCCM0_TLDS2_ULSGRO0_USL1_UIOFGRO0_USFGROn1_VSn1_VWA1_VWB1_WSGRA0_WSGRB0_WS32_WG16_2_1_WGM8_WGMXCC1_WGMXCCGn1
    SolutionIndex: 179
    SolutionNameMin: Cijk_Ailk_Bjlk_HSS_BH_Bias_S_HA_S_SAV_UserArgs_MT16x16x32_MI16x16x1_SN_LDSB0_AFC1_AFEM1_AFEM1_ASEM1_CLR1_CADS0_DTVA0_DTVB0_EPS0_FDSI0_GRPM1_GRVWA8_GRVWB8_GSU1_GSUAMB_GSUC0_GSUWGMRR0_GLS0_ISA1200_IU1_K1_LBSPPA256_LBSPPB256_LBSPPM0_LPA16_LPB16_LPM0_LRVW8_LWPMn1_MIAV1_MIWT1_1_MO40_NTn1_NTA0_NTB0_NTC0_NTD0_NTM0_NEPBS0_NLCA1_NLCB1_ONLL1_PGR2_PLR1_PKA0_SIA1_SS1_SU32_SUM0_SUS256_SPO0_SRVW0_SSO0_SVW1_SK0_SKXCCM0_TLDS0_ULSGRO0_USL1_UIOFGRO0_USFGROn1_VSn1_VWA1_VWB1_WSGRA0_WSGRB0_WS32_WG16_2_1_WGM8_WGMXCC1_WGMXCCGn1
    SolutionIndex: 180
    SolutionNameMin: Cijk_Ailk_Bjlk_HSS_BH_Bias_S_HA_S_SAV_UserArgs_MT16x16x32_MI16x16x1_SN_LDSB0_AFC1_AFEM1_AFEM1_ASEM1_CLR1_CADS0_DTVA0_DTVB0_EPS0_FDSI0_GRPM1_GRVWA8_GRVWB8_GSU1_GSUAMB_GSUC0_GSUWGMRR0_GLS0_ISA1200_IU1_K1_LBSPPA256_LBSPPB256_LBSPPM0_LPA16_LPB16_LPM0_LRVW8_LWPMn1_MIAV1_MIWT1_1_MO40_NTn1_NTA0_NTB0_NTC0_NTD0_NTM0_NEPBS0_NLCA1_NLCB1_ONLL1_PGR2_PLR0_PKA0_SIA1_SS1_SU32_SUM0_SUS256_SPO0_SRVW0_SSO0_SVW1_SK0_SKXCCM0_TLDS0_ULSGRO0_USL1_UIOFGRO0_USFGROn1_VSn1_VWA1_VWB1_WSGRA0_WSGRB0_WS32_WG16_2_1_WGM8_WGMXCC1_WGMXCCGn1
    SolutionIndex: 181
    SolutionNameMin: Cijk_Ailk_Bjlk_HSS_BH_Bias_S_HA_S_SAV_UserArgs_MT16x16x32_MI16x16x1_SN_LDSB0_AFC1_AFEM1_AFEM1_ASEM1_CLR1_CADS0_DTVA0_DTVB0_EPS0_FDSI0_GRPM1_GRVWA8_GRVWB8_GSU1_GSUAMB_GSUC0_GSUWGMRR0_GLS0_ISA1200_IU1_K1_LBSPPA256_LBSPPB256_LBSPPM0_LPA16_LPB16_LPM0_LRVW8_LWPMn1_MIAV1_MIWT1_1_MO40_NTn1_NTA0_NTB0_NTC0_NTD0_NTM0_NEPBS0_NLCA1_NLCB1_ONLL1_PGR2_PLR0_PKA0_SIA3_SS0_SU32_SUM0_SUS256_SPO0_SRVW0_SSO0_SVW8_SK0_SKXCCM0_TLDS0_ULSGRO0_USL1_UIOFGRO0_USFGROn1_VSn1_VWA1_VWB1_WSGRA0_WSGRB0_WS32_WG16_2_1_WGM8_WGMXCC1_WGMXCCGn1
    SolutionIndex: 182
    SolutionNameMin: Cijk_Ailk_Bjlk_HSS_BH_Bias_S_HA_S_SAV_UserArgs_MT16x16x32_MI16x16x1_SN_LDSB0_AFC1_AFEM1_AFEM1_ASEM1_CLR0_CADS0_DTVA0_DTVB0_EPS0_FDSI0_GRPM1_GRVWA8_GRVWB8_GSU1_GSUAMB_GSUC0_GSUWGMRR0_GLS0_ISA1200_IU1_K1_LBSPPA256_LBSPPB256_LBSPPM0_LPA16_LPB16_LPM0_LRVW8_LWPMn1_MIAV1_MIWT1_1_MO40_NTn1_NTA0_NTB0_NTC0_NTD0_NTM0_NEPBS0_NLCA1_NLCB1_ONLL1_PGR2_PLR1_PKA0_SIA3_SS1_SU32_SUM0_SUS256_SPO0_SRVW0_SSO0_SVW1_SK0_SKXCCM0_TLDS0_ULSGRO0_USL1_UIOFGRO0_USFGROn1_VSn1_VWA1_VWB1_WSGRA0_WSGRB0_WS32_WG16_2_1_WGM8_WGMXCC1_WGMXCCGn1
    SolutionIndex: 183
    SolutionNameMin: Cijk_Ailk_Bjlk_HSS_BH_Bias_S_HA_S_SAV_UserArgs_MT128x128x32_MI16x16x1_SN_LDSB0_AFC1_AFEM1_AFEM1_ASEM1_CLR0_CADS0_DTVA0_DTVB0_EPS0_FDSI0_GRPM1_GRVWA8_GRVWB8_GSU1_GSUAMB_GSUC0_GSUWGMRR0_GLS0_ISA1200_IU1_K1_LBSPPA2048_LBSPPB2048_LBSPPM0_LPA0_LPB0_LPM0_LRVW8_LWPMn1_MIAV1_MIWT4_4_MO40_NTn1_NTA0_NTB0_NTC0_NTD0_NTM0_NEPBS0_NLCA1_NLCB1_ONLL1_PGR2_PLR0_PKA0_SIA3_SS0_SU32_SUM0_SUS256_SPO0_SRVW0_SSO0_SVW8_SK0_SKXCCM0_TLDS0_ULSGRO0_USL1_UIOFGRO0_USFGROn1_VSn1_VWA4_VWB4_WSGRA0_WSGRB0_WS32_WG32_4_1_WGM8_WGMXCC1_WGMXCCGn1
    SolutionIndex: 184
    SolutionNameMin: Cijk_Ailk_Bjlk_HSS_BH_Bias_S_HA_S_SAV_UserArgs_MT16x16x32_MI16x16x1_SN_LDSB0_AFC1_AFEM1_AFEM1_ASEM1_CLR0_CADS0_DTVA0_DTVB0_EPS0_FDSI0_GRPM1_GRVWA8_GRVWB8_GSU1_GSUAMB_GSUC0_GSUWGMRR0_GLS0_ISA1200_IU1_K1_LBSPPA256_LBSPPB256_LBSPPM0_LPA16_LPB16_LPM0_LRVW8_LWPMn1_MIAV1_MIWT1_1_MO40_NTn1_NTA0_NTB0_NTC0_NTD0_NTM0_NEPBS0_NLCA1_NLCB1_ONLL1_PGR2_PLR0_PKA0_SIA3_SS0_SU32_SUM0_SUS256_SPO0_SRVW0_SSO0_SVW8_SK0_SKXCCM0_TLDS0_ULSGRO0_USL1_UIOFGRO0_USFGROn1_VSn1_VWA1_VWB1_WSGRA0_WSGRB0_WS32_WG16_2_1_WGM8_WGMXCC1_WGMXCCGn1
    SolutionIndex: 185
    SolutionNameMin: Cijk_Ailk_Bjlk_HSS_BH_Bias_S_HA_S_SAV_UserArgs_MT16x16x32_MI16x16x1_SN_LDSB0_AFC1_AFEM1_AFEM1_ASEM1_CLR0_CADS0_DTVA0_DTVB0_EPS0_FDSI0_GRPM1_GRVWA8_GRVWB8_GSU1_GSUAMB_GSUC0_GSUWGMRR0_GLS0_ISA1200_IU1_K1_LBSPPA256_LBSPPB256_LBSPPM0_LPA16_LPB16_LPM0_LRVW8_LWPMn1_MIAV1_MIWT1_1_MO40_NTn1_NTA0_NTB0_NTC0_NTD0_NTM0_NEPBS0_NLCA1_NLCB1_ONLL1_PGR2_PLR0_PKA0_SIA1_SS1_SU32_SUM0_SUS256_SPO0_SRVW0_SSO0_SVW1_SK0_SKXCCM0_TLDS0_ULSGRO0_USL1_UIOFGRO0_USFGROn1_VSn1_VWA1_VWB1_WSGRA0_WSGRB0_WS32_WG16_2_1_WGM8_WGMXCC1_WGMXCCGn1
    SolutionIndex: 186
    SolutionNameMin: Cijk_Ailk_Bjlk_HSS_BH_Bias_S_HA_S_SAV_UserArgs_MT128x128x32_MI16x16x1_SN_LDSB0_AFC1_AFEM1_AFEM1_ASEM1_CLR0_CADS0_DTVA0_DTVB0_EPS1_FDSI0_GRPM1_GRVWA8_GRVWB8_GSU1_GSUAMB_GSUC0_GSUWGMRR0_GLS0_ISA1200_IU1_K1_LBSPPA2048_LBSPPB2048_LBSPPM0_LPA0_LPB16_LPM0_LRVW8_LWPMn1_MIAV1_MIWT4_4_MO40_NTn1_NTA0_NTB0_NTC0_NTD0_NTM0_NEPBS0_NLCA1_NLCB1_ONLL1_PGR1_PLR0_PKA0_SIA3_SS0_SU32_SUM0_SUS256_SPO0_SRVW0_SSO0_SVW8_SK0_SKXCCM0_TLDS0_ULSGRO0_USL1_UIOFGRO0_USFGROn1_VSn1_VWA4_VWB1_WSGRA0_WSGRB0_WS32_WG32_4_1_WGM8_WGMXCC1_WGMXCCGn1
    SolutionIndex: 187
    SolutionNameMin: Cijk_Ailk_Bjlk_HSS_BH_Bias_S_HA_S_SAV_UserArgs_MT16x16x32_MI16x16x1_SN_LDSB0_AFC1_AFEM1_AFEM1_ASEM1_CLR0_CADS0_DTVA0_DTVB0_EPS0_FDSI0_GRPM1_GRVWA8_GRVWB8_GSU1_GSUAMB_GSUC0_GSUWGMRR0_GLS0_ISA1200_IU1_K1_LBSPPA256_LBSPPB256_LBSPPM0_LPA16_LPB16_LPM0_LRVW8_LWPMn1_MIAV1_MIWT1_1_MO40_NTn1_NTA0_NTB0_NTC0_NTD0_NTM0_NEPBS0_NLCA1_NLCB1_ONLL1_PGR2_PLR1_PKA0_SIA1_SS1_SU32_SUM0_SUS256_SPO0_SRVW0_SSO0_SVW1_SK0_SKXCCM0_TLDS0_ULSGRO0_USL1_UIOFGRO0_USFGROn1_VSn1_VWA1_VWB1_WSGRA0_WSGRB0_WS32_WG16_2_1_WGM8_WGMXCC1_WGMXCCGn1
    SolutionIndex: 188
    SolutionNameMin: Cijk_Ailk_Bjlk_HSS_BH_Bias_S_HA_S_SAV_UserArgs_MT16x16x32_MI16x16x1_SN_LDSB1_AFC1_AFEM1_AFEM1_ASEM1_CLR0_CADS0_DTVA0_DTVB0_EPS0_FDSI0_GRPM1_GRVWA8_GRVWB8_GSU1_GSUAMB_GSUC0_GSUWGMRR0_GLS0_ISA1200_IU1_K1_LBSPPA256_LBSPPB256_LBSPPM0_LPA16_LPB16_LPM0_LRVW8_LWPMn1_MIAV1_MIWT1_1_MO40_NTn1_NTA0_NTB0_NTC0_NTD0_NTM0_NEPBS0_NLCA1_NLCB1_ONLL1_PGR2_PLR1_PKA0_SIA3_SS1_SU32_SUM0_SUS256_SPO0_SRVW0_SSO0_SVW1_SK0_SKXCCM0_TLDS0_ULSGRO0_USL1_UIOFGRO0_USFGROn1_VSn1_VWA1_VWB1_WSGRA0_WSGRB0_WS32_WG16_2_1_WGM8_WGMXCC1_WGMXCCGn1
    SolutionIndex: 190
    SolutionNameMin: Cijk_Ailk_Bjlk_HSS_BH_Bias_S_HA_S_SAV_UserArgs_MT16x16x32_MI16x16x1_SN_LDSB0_AFC1_AFEM1_AFEM1_ASEM1_CLR0_CADS0_DTVA0_DTVB0_EPS1_FDSI0_GRPM1_GRVWA1_GRVWB1_GSU1_GSUAMB_GSUC0_GSUWGMRR0_GLS0_ISA1200_IU1_K1_LBSPPA128_LBSPPB128_LBSPPM0_LPA16_LPB16_LPM0_LRVW8_LWPMn1_MIAV1_MIWT1_1_MO40_NTn1_NTA0_NTB0_NTC0_NTD0_NTM0_NEPBS0_NLCA1_NLCB1_ONLL1_PGR1_PLR0_PKA0_SIA3_SS1_SU32_SUM0_SUS256_SPO0_SRVW0_SSO0_SVW1_SK0_SKXCCM0_TLDS2_ULSGRO0_USL1_UIOFGRO0_USFGROn1_VSn1_VWA1_VWB1_WSGRA0_WSGRB0_WS32_WG16_2_1_WGM8_WGMXCC1_WGMXCCGn1
- - - [512, 512, 1, 64]
    - [169, 0.0]
  - - [1024, 512, 1, 64]
    - [56, 0.0]
  - - [1536, 512, 1, 64]
    - [6, 2764.79]
  - - [2048, 512, 1, 64]
    - [15, 3519.82]
  - - [2560, 512, 1, 64]
    - [7, 4377.96]
  - - [3072, 512, 1, 64]
    - [5, 5057.82]
  - - [512, 1024, 1, 64]
    - [20, 0.0]
  - - [1024, 1024, 1, 64]
    - [54, 0.0]
  - - [1536, 1024, 1, 64]
    - [4, 4845.64]
  - - [2048, 1024, 1, 64]
    - [7, 6096.37]
  - - [2560, 1024, 1, 64]
    - [4, 7148.67]
  - - [3072, 1024, 1, 64]
    - [4, 7922.19]
  - - [512, 1536, 1, 64]
    - [4, 2895.54]
  - - [1024, 1536, 1, 64]
    - [18, 4027.82]
  - - [1536, 1536, 1, 64]
    - [4, 6702.84]
  - - [2048, 1536, 1, 64]
    - [1, 7639.17]
  - - [2560, 1536, 1, 64]
    - [7, 9019.2]
  - - [3072, 1536, 1, 64]
    - [5, 9848.67]
  - - [512, 2048, 1, 64]
    - [4, 3739.91]
  - - [1024, 2048, 1, 64]
    - [7, 6187.86]
  - - [1536, 2048, 1, 64]
    - [5, 7769.18]
  - - [2048, 2048, 1, 64]
    - [4, 9177.28]
  - - [2560, 2048, 1, 64]
    - [2, 10608.8]
  - - [3072, 2048, 1, 64]
    - [4, 12018.4]
  - - [512, 2560, 1, 64]
    - [5, 4229.73]
  - - [1024, 2560, 1, 64]
    - [4, 7224.09]
  - - [1536, 2560, 1, 64]
    - [5, 8998.24]
  - - [2048, 2560, 1, 64]
    - [1, 10791.5]
  - - [2560, 2560, 1, 64]
    - [5, 12205.3]
  - - [3072, 2560, 1, 64]
    - [3, 12526.4]
  - - [512, 3072, 1, 64]
    - [17, 3995.76]
  - - [1024, 3072, 1, 64]
    - [7, 7679.97]
  - - [1536, 3072, 1, 64]
    - [1, 10270.0]
  - - [2048, 3072, 1, 64]
    - [4, 11815.3]
  - - [2560, 3072, 1, 64]
    - [5, 12965.9]
  - - [3072, 3072, 1, 64]
    - [7, 13879.2]
  - - [512, 512, 1, 256]
    - [120, 0.0]
  - - [1024, 512, 1, 256]
    - [20, 0.0]
  - - [1536, 512, 1, 256]
    - [6, 8778.71]
  - - [2048, 512, 1, 256]
    - [4, 10953.9]
  - - [2560, 512, 1, 256]
    - [15, 12527.3]
  - - [3072, 512, 1, 256]
    - [0, 9610.21]
  - - [512, 1024, 1, 256]
    - [23, 0.0]
  - - [1024, 1024, 1, 256]
    - [20, 0.0]
  - - [1536, 1024, 1, 256]
    - [4, 14206.2]
  - - [2048, 1024, 1, 256]
    - [4, 16510.7]
  - - [2560, 1024, 1, 256]
    - [4, 18361.3]
  - - [3072, 1024, 1, 256]
    - [13, 19686.5]
  - - [512, 1536, 1, 256]
    - [4, 8780.82]
  - - [1024, 1536, 1, 256]
    - [4, 14508.7]
  - - [1536, 1536, 1, 256]
    - [13, 16967.2]
  - - [2048, 1536, 1, 256]
    - [4, 19927.9]
  - - [2560, 1536, 1, 256]
    - [4, 21248.4]
  - - [3072, 1536, 1, 256]
    - [4, 22807.0]
  - - [512, 2048, 1, 256]
    - [14, 7492.55]
  - - [1024, 2048, 1, 256]
    - [4, 16369.8]
  - - [1536, 2048, 1, 256]
    - [0, 19975.1]
  - - [2048, 2048, 1, 256]
    - [13, 21887.6]
  - - [2560, 2048, 1, 256]
    - [4, 23864.7]
  - - [3072, 2048, 1, 256]
    - [4, 25187.5]
  - - [512, 2560, 1, 256]
    - [4, 12600.2]
  - - [1024, 2560, 1, 256]
    - [15, 18341.3]
  - - [1536, 2560, 1, 256]
    - [4, 21642.2]
  - - [2048, 2560, 1, 256]
    - [4, 23746.5]
  - - [2560, 2560, 1, 256]
    - [4, 25374.1]
  - - [3072, 2560, 1, 256]
    - [4, 26900.8]
  - - [512, 3072, 1, 256]
    - [13, 14040.0]
  - - [1024, 3072, 1, 256]
    - [4, 20017.3]
  - - [1536, 3072, 1, 256]
    - [4, 22886.9]
  - - [2048, 3072, 1, 256]
    - [4, 25132.2]
  - - [2560, 3072, 1, 256]
    - [0, 26647.4]
  - - [3072, 3072, 1, 256]
    - [15, 27327.5]
  - - [512, 512, 1, 512]
    - [20, 0.0]
  - - [1024, 512, 1, 512]
    - [120, 0.0]
  - - [1536, 512, 1, 512]
    - [15, 14221.5]
  - - [2048, 512, 1, 512]
    - [13, 17068.4]
  - - [2560, 512, 1, 512]
    - [15, 18650.2]
  - - [3072, 512, 1, 512]
    - [4, 20663.2]
  - - [512, 1024, 1, 512]
    - [23, 0.0]
  - - [1024, 1024, 1, 512]
    - [20, 0.0]
  - - [1536, 1024, 1, 512]
    - [4, 20655.0]
  - - [2048, 1024, 1, 512]
    - [15, 22773.6]
  - - [2560, 1024, 1, 512]
    - [13, 24229.7]
  - - [3072, 1024, 1, 512]
    - [15, 25706.9]
  - - [512, 1536, 1, 512]
    - [4, 14320.4]
  - - [1024, 1536, 1, 512]
    - [4, 20400.7]
  - - [1536, 1536, 1, 512]
    - [4, 23523.4]
  - - [2048, 1536, 1, 512]
    - [13, 26308.4]
  - - [2560, 1536, 1, 512]
    - [15, 27021.9]
  - - [3072, 1536, 1, 512]
    - [4, 29369.5]
  - - [512, 2048, 1, 512]
    - [4, 16680.5]
  - - [1024, 2048, 1, 512]
    - [15, 22463.2]
  - - [1536, 2048, 1, 512]
    - [13, 25764.7]
  - - [2048, 2048, 1, 512]
    - [4, 27882.2]
  - - [2560, 2048, 1, 512]
    - [4, 29294.8]
  - - [3072, 2048, 1, 512]
    - [13, 30521.8]
  - - [512, 2560, 1, 512]
    - [15, 18251.5]
  - - [1024, 2560, 1, 512]
    - [13, 19232.6]
  - - [1536, 2560, 1, 512]
    - [13, 27498.9]
  - - [2048, 2560, 1, 512]
    - [15, 29866.3]
  - - [2560, 2560, 1, 512]
    - [15, 30820.6]
  - - [3072, 2560, 1, 512]
    - [4, 32075.9]
  - - [512, 3072, 1, 512]
    - [17, 15962.5]
  - - [1024, 3072, 1, 512]
    - [13, 25657.7]
  - - [1536, 3072, 1, 512]
    - [13, 28584.3]
  - - [2048, 3072, 1, 512]
    - [4, 30594.4]
  - - [2560, 3072, 1, 512]
    - [0, 30950.8]
  - - [3072, 3072, 1, 512]
    - [13, 32420.7]
  - - [512, 512, 1, 1024]
    - [110, 0.0]
  - - [1024, 512, 1, 1024]
    - [120, 0.0]
  - - [1536, 512, 1, 1024]
    - [4, 20059.7]
  - - [2048, 512, 1, 1024]
    - [15, 22638.7]
  - - [2560, 512, 1, 1024]
    - [16, 23365.2]
  - - [3072, 512, 1, 1024]
    - [4, 26126.8]
  - - [512, 1024, 1, 1024]
    - [23, 0.0]
  - - [1024, 1024, 1, 1024]
    - [23, 0.0]
  - - [1536, 1024, 1, 1024]
    - [13, 26046.3]
  - - [2048, 1024, 1, 1024]
    - [13, 28018.9]
  - - [2560, 1024, 1, 1024]
    - [4, 29343.0]
  - - [3072, 1024, 1, 1024]
    - [15, 30870.5]
  - - [512, 1536, 1, 1024]
    - [15, 19795.4]
  - - [1024, 1536, 1, 1024]
    - [15, 25787.3]
  - - [1536, 1536, 1, 1024]
    - [13, 24877.5]
  - - [2048, 1536, 1, 1024]
    - [0, 30148.3]
  - - [2560, 1536, 1, 1024]
    - [15, 32041.5]
  - - [3072, 1536, 1, 1024]
    - [4, 32160.4]
  - - [512, 2048, 1, 1024]
    - [15, 23000.9]
  - - [1024, 2048, 1, 1024]
    - [15, 27958.6]
  - - [1536, 2048, 1, 1024]
    - [16, 30353.3]
  - - [2048, 2048, 1, 1024]
    - [13, 32910.4]
  - - [2560, 2048, 1, 1024]
    - [0, 33207.0]
  - - [3072, 2048, 1, 1024]
    - [0, 34410.8]
  - - [512, 2560, 1, 1024]
    - [15, 19293.7]
  - - [1024, 2560, 1, 1024]
    - [16, 28586.9]
  - - [1536, 2560, 1, 1024]
    - [4, 31516.4]
  - - [2048, 2560, 1, 1024]
    - [4, 32695.5]
  - - [2560, 2560, 1, 1024]
    - [13, 33584.5]
  - - [3072, 2560, 1, 1024]
    - [4, 34444.3]
  - - [512, 3072, 1, 1024]
    - [4, 26250.5]
  - - [1024, 3072, 1, 1024]
    - [13, 30288.9]
  - - [1536, 3072, 1, 1024]
    - [15, 32653.5]
  - - [2048, 3072, 1, 1024]
    - [15, 34049.1]
  - - [2560, 3072, 1, 1024]
    - [13, 34721.0]
  - - [3072, 3072, 1, 1024]
    - [4, 34981.8]
  - - [512, 512, 1, 2048]
    - [20, 0.0]
  - - [1024, 512, 1, 2048]
    - [23, 0.0]
  - - [1536, 512, 1, 2048]
    - [15, 24494.7]
  - - [2048, 512, 1, 2048]
    - [4, 27958.6]
  - - [2560, 512, 1, 2048]
    - [13, 28495.7]
  - - [3072, 512, 1, 2048]
    - [15, 29965.7]
  - - [512, 1024, 1, 2048]
    - [23, 0.0]
  - - [1024, 1024, 1, 2048]
    - [23, 0.0]
  - - [1536, 1024, 1, 2048]
    - [15, 30559.4]
  - - [2048, 1024, 1, 2048]
    - [15, 31352.9]
  - - [2560, 1024, 1, 2048]
    - [13, 32903.2]
  - - [3072, 1024, 1, 2048]
    - [15, 34230.3]
  - - [512, 1536, 1, 2048]
    - [15, 24394.2]
  - - [1024, 1536, 1, 2048]
    - [4, 29957.4]
  - - [1536, 1536, 1, 2048]
    - [4, 32132.4]
  - - [2048, 1536, 1, 2048]
    - [4, 32967.6]
  - - [2560, 1536, 1, 2048]
    - [15, 34108.8]
  - - [3072, 1536, 1, 2048]
    - [4, 35303.1]
  - - [512, 2048, 1, 2048]
    - [15, 27543.7]
  - - [1024, 2048, 1, 2048]
    - [15, 31852.7]
  - - [1536, 2048, 1, 2048]
    - [4, 33429.5]
  - - [2048, 2048, 1, 2048]
    - [22, 0.0]
  - - [2560, 2048, 1, 2048]
    - [15, 35012.8]
  - - [3072, 2048, 1, 2048]
    - [4, 34927.5]
  - - [512, 2560, 1, 2048]
    - [15, 28473.1]
  - - [1024, 2560, 1, 2048]
    - [13, 32443.1]
  - - [1536, 2560, 1, 2048]
    - [15, 33703.4]
  - - [2048, 2560, 1, 2048]
    - [15, 34952.8]
  - - [2560, 2560, 1, 2048]
    - [15, 35427.5]
  - - [3072, 2560, 1, 2048]
    - [15, 35568.4]
  - - [512, 3072, 1, 2048]
    - [0, 30643.9]
  - - [1024, 3072, 1, 2048]
    - [4, 33135.0]
  - - [1536, 3072, 1, 2048]
    - [15, 35086.0]
  - - [2048, 3072, 1, 2048]
    - [13, 35286.5]
  - - [2560, 3072, 1, 2048]
    - [4, 35540.8]
  - - [3072, 3072, 1, 2048]
    - [15, 35994.4]
  - - [512, 512, 1, 3072]
    - [9, 17907.8]
  - - [1024, 512, 1, 3072]
    - [13, 25523.4]
  - - [1536, 512, 1, 3072]
    - [15, 26395.7]
  - - [2048, 512, 1, 3072]
    - [13, 29236.7]
  - - [2560, 512, 1, 3072]
    - [4, 30260.9]
  - - [3072, 512, 1, 3072]
    - [15, 31219.3]
  - - [512, 1024, 1, 3072]
    - [2, 24676.9]
  - - [1024, 1024, 1, 3072]
    - [15, 29555.2]
  - - [1536, 1024, 1, 3072]
    - [4, 31553.2]
  - - [2048, 1024, 1, 3072]
    - [4, 32571.0]
  - - [2560, 1024, 1, 3072]
    - [13, 33635.7]
  - - [3072, 1024, 1, 3072]
    - [0, 34003.7]
  - - [512, 1536, 1, 3072]
    - [4, 26965.3]
  - - [1024, 1536, 1, 3072]
    - [13, 31697.3]
  - - [1536, 1536, 1, 3072]
    - [15, 33471.2]
  - - [2048, 1536, 1, 3072]
    - [15, 34142.1]
  - - [2560, 1536, 1, 3072]
    - [4, 34520.7]
  - - [3072, 1536, 1, 3072]
    - [0, 35005.5]
  - - [512, 2048, 1, 3072]
    - [0, 30031.5]
  - - [1024, 2048, 1, 3072]
    - [15, 33287.7]
  - - [1536, 2048, 1, 3072]
    - [13, 34538.9]
  - - [2048, 2048, 1, 3072]
    - [4, 34890.2]
  - - [2560, 2048, 1, 3072]
    - [15, 35540.9]
  - - [3072, 2048, 1, 3072]
    - [15, 35493.7]
  - - [512, 2560, 1, 3072]
    - [15, 30412.2]
  - - [1024, 2560, 1, 3072]
    - [13, 34182.2]
  - - [1536, 2560, 1, 3072]
    - [4, 34612.4]
  - - [2048, 2560, 1, 3072]
    - [4, 34945.9]
  - - [2560, 2560, 1, 3072]
    - [15, 35803.3]
  - - [3072, 2560, 1, 3072]
    - [0, 35815.1]
  - - [512, 3072, 1, 3072]
    - [0, 32031.1]
  - - [1024, 3072, 1, 3072]
    - [15, 33794.0]
  - - [1536, 3072, 1, 3072]
    - [0, 34947.1]
  - - [2048, 3072, 1, 3072]
    - [15, 35799.6]
  - - [2560, 3072, 1, 3072]
    - [0, 35674.7]
  - - [3072, 3072, 1, 3072]
    - [20, 0.0]
  - - [1, 1, 1, 1]
    - [190, 0.0]
  - - [1, 1, 1, 64]
    - [12, 0.004]
  - - [1, 64, 1, 1]
    - [11, 0.00423883]
  - - [64, 1, 1, 1]
    - [11, 0.00425858]
  - - [64, 64, 1, 1]
    - [8, 0.269323]
  - - [64, 1, 1, 64]
    - [10, 0.267914]
  - - [1, 64, 1, 64]
    - [12, 0.266945]
  - - [64, 64, 1, 64]
    - [151, 0.0]
  - - [64, 64, 1, 256]
    - [177, 0.0]
  - - [64, 64, 1, 512]
    - [150, 0.0]
  - - [64, 64, 1, 1024]
    - [148, 0.0]
  - - [64, 64, 1, 2048]
    - [98, 0.0]
  - - [64, 64, 1, 4096]
    - [150, 0.0]
  - - [256, 256, 1, 256]
    - [19, 0.0]
  - - [4096, 4096, 1, 4096]
    - [23, 0.0]
  - - [320, 64, 1, 64]
    - [26, 0.0]
  - - [576, 64, 1, 64]
    - [154, 0.0]
  - - [832, 64, 1, 64]
    - [27, 0.0]
  - - [1088, 64, 1, 64]
    - [103, 0.0]
  - - [1344, 64, 1, 64]
    - [35, 0.0]
  - - [1600, 64, 1, 64]
    - [103, 0.0]
  - - [1856, 64, 1, 64]
    - [27, 0.0]
  - - [2112, 64, 1, 64]
    - [32, 0.0]
  - - [2368, 64, 1, 64]
    - [33, 0.0]
  - - [2624, 64, 1, 64]
    - [34, 0.0]
  - - [2880, 64, 1, 64]
    - [27, 0.0]
  - - [3136, 64, 1, 64]
    - [35, 0.0]
  - - [3392, 64, 1, 64]
    - [36, 0.0]
  - - [3648, 64, 1, 64]
    - [37, 0.0]
  - - [3904, 64, 1, 64]
    - [38, 0.0]
  - - [64, 320, 1, 64]
    - [162, 0.0]
  - - [320, 320, 1, 64]
    - [27, 0.0]
  - - [576, 320, 1, 64]
    - [73, 0.0]
  - - [832, 320, 1, 64]
    - [19, 0.0]
  - - [1088, 320, 1, 64]
    - [41, 0.0]
  - - [1344, 320, 1, 64]
    - [42, 0.0]
  - - [1600, 320, 1, 64]
    - [45, 0.0]
  - - [1856, 320, 1, 64]
    - [42, 0.0]
  - - [2112, 320, 1, 64]
    - [43, 0.0]
  - - [2368, 320, 1, 64]
    - [43, 0.0]
  - - [2624, 320, 1, 64]
    - [44, 0.0]
  - - [2880, 320, 1, 64]
    - [38, 0.0]
  - - [3136, 320, 1, 64]
    - [38, 0.0]
  - - [3392, 320, 1, 64]
    - [45, 0.0]
  - - [3648, 320, 1, 64]
    - [38, 0.0]
  - - [3904, 320, 1, 64]
    - [45, 0.0]
  - - [64, 576, 1, 64]
    - [103, 0.0]
  - - [320, 576, 1, 64]
    - [73, 0.0]
  - - [576, 576, 1, 64]
    - [41, 0.0]
  - - [832, 576, 1, 64]
    - [38, 0.0]
  - - [1088, 576, 1, 64]
    - [29, 0.0]
  - - [1344, 576, 1, 64]
    - [42, 0.0]
  - - [1600, 576, 1, 64]
    - [42, 0.0]
  - - [1856, 576, 1, 64]
    - [47, 0.0]
  - - [2112, 576, 1, 64]
    - [44, 0.0]
  - - [2368, 576, 1, 64]
    - [45, 0.0]
  - - [2624, 576, 1, 64]
    - [29, 0.0]
  - - [2880, 576, 1, 64]
    - [45, 0.0]
  - - [3136, 576, 1, 64]
    - [45, 0.0]
  - - [3392, 576, 1, 64]
    - [38, 0.0]
  - - [3648, 576, 1, 64]
    - [42, 0.0]
  - - [3904, 576, 1, 64]
    - [43, 0.0]
  - - [64, 832, 1, 64]
    - [73, 0.0]
  - - [320, 832, 1, 64]
    - [73, 0.0]
  - - [576, 832, 1, 64]
    - [42, 0.0]
  - - [832, 832, 1, 64]
    - [42, 0.0]
  - - [1088, 832, 1, 64]
    - [42, 0.0]
  - - [1344, 832, 1, 64]
    - [60, 0.0]
  - - [1600, 832, 1, 64]
    - [43, 0.0]
  - - [1856, 832, 1, 64]
    - [61, 0.0]
  - - [2112, 832, 1, 64]
    - [42, 0.0]
  - - [2368, 832, 1, 64]
    - [45, 0.0]
  - - [2624, 832, 1, 64]
    - [45, 0.0]
  - - [2880, 832, 1, 64]
    - [49, 0.0]
  - - [3136, 832, 1, 64]
    - [38, 0.0]
  - - [3392, 832, 1, 64]
    - [38, 0.0]
  - - [3648, 832, 1, 64]
    - [45, 0.0]
  - - [3904, 832, 1, 64]
    - [50, 0.0]
  - - [64, 1088, 1, 64]
    - [139, 0.0]
  - - [320, 1088, 1, 64]
    - [42, 0.0]
  - - [576, 1088, 1, 64]
    - [43, 0.0]
  - - [832, 1088, 1, 64]
    - [43, 0.0]
  - - [1088, 1088, 1, 64]
    - [29, 0.0]
  - - [1344, 1088, 1, 64]
    - [47, 0.0]
  - - [1600, 1088, 1, 64]
    - [45, 0.0]
  - - [1856, 1088, 1, 64]
    - [49, 0.0]
  - - [2112, 1088, 1, 64]
    - [42, 0.0]
  - - [2368, 1088, 1, 64]
    - [41, 0.0]
  - - [2624, 1088, 1, 64]
    - [20, 0.0]
  - - [2880, 1088, 1, 64]
    - [52, 0.0]
  - - [3136, 1088, 1, 64]
    - [53, 0.0]
  - - [3392, 1088, 1, 64]
    - [54, 0.0]
  - - [3648, 1088, 1, 64]
    - [55, 0.0]
  - - [3904, 1088, 1, 64]
    - [54, 0.0]
  - - [64, 1344, 1, 64]
    - [19, 0.0]
  - - [320, 1344, 1, 64]
    - [43, 0.0]
  - - [576, 1344, 1, 64]
    - [44, 0.0]
  - - [832, 1344, 1, 64]
    - [50, 0.0]
  - - [1088, 1344, 1, 64]
    - [42, 0.0]
  - - [1344, 1344, 1, 64]
    - [38, 0.0]
  - - [1600, 1344, 1, 64]
    - [47, 0.0]
  - - [1856, 1344, 1, 64]
    - [140, 0.0]
  - - [2112, 1344, 1, 64]
    - [20, 0.0]
  - - [2368, 1344, 1, 64]
    - [54, 0.0]
  - - [2624, 1344, 1, 64]
    - [55, 0.0]
  - - [2880, 1344, 1, 64]
    - [56, 0.0]
  - - [3136, 1344, 1, 64]
    - [20, 0.0]
  - - [3392, 1344, 1, 64]
    - [55, 0.0]
  - - [3648, 1344, 1, 64]
    - [20, 0.0]
  - - [3904, 1344, 1, 64]
    - [20, 0.0]
  - - [64, 1600, 1, 64]
    - [73, 0.0]
  - - [320, 1600, 1, 64]
    - [47, 0.0]
  - - [576, 1600, 1, 64]
    - [45, 0.0]
  - - [832, 1600, 1, 64]
    - [47, 0.0]
  - - [1088, 1600, 1, 64]
    - [138, 0.0]
  - - [1344, 1600, 1, 64]
    - [49, 0.0]
  - - [1600, 1600, 1, 64]
    - [61, 0.0]
  - - [1856, 1600, 1, 64]
    - [47, 0.0]
  - - [2112, 1600, 1, 64]
    - [55, 0.0]
  - - [2368, 1600, 1, 64]
    - [58, 0.0]
  - - [2624, 1600, 1, 64]
    - [54, 0.0]
  - - [2880, 1600, 1, 64]
    - [59, 0.0]
  - - [3136, 1600, 1, 64]
    - [20, 0.0]
  - - [3392, 1600, 1, 64]
    - [54, 0.0]
  - - [3648, 1600, 1, 64]
    - [54, 0.0]
  - - [3904, 1600, 1, 64]
    - [20, 0.0]
  - - [64, 1856, 1, 64]
    - [73, 0.0]
  - - [320, 1856, 1, 64]
    - [43, 0.0]
  - - [576, 1856, 1, 64]
    - [60, 0.0]
  - - [832, 1856, 1, 64]
    - [46, 0.0]
  - - [1088, 1856, 1, 64]
    - [61, 0.0]
  - - [1344, 1856, 1, 64]
    - [60, 0.0]
  - - [1600, 1856, 1, 64]
    - [29, 0.0]
  - - [1856, 1856, 1, 64]
    - [20, 0.0]
  - - [2112, 1856, 1, 64]
    - [20, 0.0]
  - - [2368, 1856, 1, 64]
    - [20, 0.0]
  - - [2624, 1856, 1, 64]
    - [54, 0.0]
  - - [2880, 1856, 1, 64]
    - [20, 0.0]
  - - [3136, 1856, 1, 64]
    - [54, 0.0]
  - - [3392, 1856, 1, 64]
    - [20, 0.0]
  - - [3648, 1856, 1, 64]
    - [20, 0.0]
  - - [3904, 1856, 1, 64]
    - [20, 0.0]
  - - [64, 2112, 1, 64]
    - [40, 0.0]
  - - [320, 2112, 1, 64]
    - [43, 0.0]
  - - [576, 2112, 1, 64]
    - [61, 0.0]
  - - [832, 2112, 1, 64]
    - [42, 0.0]
  - - [1088, 2112, 1, 64]
    - [49, 0.0]
  - - [1344, 2112, 1, 64]
    - [44, 0.0]
  - - [1600, 2112, 1, 64]
    - [62, 0.0]
  - - [1856, 2112, 1, 64]
    - [59, 0.0]
  - - [2112, 2112, 1, 64]
    - [20, 0.0]
  - - [2368, 2112, 1, 64]
    - [54, 0.0]
  - - [2624, 2112, 1, 64]
    - [55, 0.0]
  - - [2880, 2112, 1, 64]
    - [20, 0.0]
  - - [3136, 2112, 1, 64]
    - [20, 0.0]
  - - [3392, 2112, 1, 64]
    - [20, 0.0]
  - - [3648, 2112, 1, 64]
    - [55, 0.0]
  - - [3904, 2112, 1, 64]
    - [55, 0.0]
  - - [64, 2368, 1, 64]
    - [45, 0.0]
  - - [320, 2368, 1, 64]
    - [47, 0.0]
  - - [576, 2368, 1, 64]
    - [42, 0.0]
  - - [832, 2368, 1, 64]
    - [29, 0.0]
  - - [1088, 2368, 1, 64]
    - [47, 0.0]
  - - [1344, 2368, 1, 64]
    - [51, 0.0]
  - - [1600, 2368, 1, 64]
    - [55, 0.0]
  - - [1856, 2368, 1, 64]
    - [20, 0.0]
  - - [2112, 2368, 1, 64]
    - [20, 0.0]
  - - [2368, 2368, 1, 64]
    - [20, 0.0]
  - - [2624, 2368, 1, 64]
    - [55, 0.0]
  - - [2880, 2368, 1, 64]
    - [63, 0.0]
  - - [3136, 2368, 1, 64]
    - [64, 0.0]
  - - [3392, 2368, 1, 64]
    - [20, 0.0]
  - - [3648, 2368, 1, 64]
    - [20, 0.0]
  - - [3904, 2368, 1, 64]
    - [54, 0.0]
  - - [64, 2624, 1, 64]
    - [39, 0.0]
  - - [320, 2624, 1, 64]
    - [48, 0.0]
  - - [576, 2624, 1, 64]
    - [45, 0.0]
  - - [832, 2624, 1, 64]
    - [41, 0.0]
  - - [1088, 2624, 1, 64]
    - [44, 0.0]
  - - [1344, 2624, 1, 64]
    - [62, 0.0]
  - - [1600, 2624, 1, 64]
    - [55, 0.0]
  - - [1856, 2624, 1, 64]
    - [55, 0.0]
  - - [2112, 2624, 1, 64]
    - [54, 0.0]
  - - [2368, 2624, 1, 64]
    - [54, 0.0]
  - - [2624, 2624, 1, 64]
    - [20, 0.0]
  - - [2880, 2624, 1, 64]
    - [20, 0.0]
  - - [3136, 2624, 1, 64]
    - [54, 0.0]
  - - [3392, 2624, 1, 64]
    - [56, 0.0]
  - - [3648, 2624, 1, 64]
    - [54, 0.0]
  - - [3904, 2624, 1, 64]
    - [63, 0.0]
  - - [64, 2880, 1, 64]
    - [65, 0.0]
  - - [320, 2880, 1, 64]
    - [45, 0.0]
  - - [576, 2880, 1, 64]
    - [44, 0.0]
  - - [832, 2880, 1, 64]
    - [42, 0.0]
  - - [1088, 2880, 1, 64]
    - [43, 0.0]
  - - [1344, 2880, 1, 64]
    - [54, 0.0]
  - - [1600, 2880, 1, 64]
    - [54, 0.0]
  - - [1856, 2880, 1, 64]
    - [54, 0.0]
  - - [2112, 2880, 1, 64]
    - [64, 0.0]
  - - [2368, 2880, 1, 64]
    - [20, 0.0]
  - - [2624, 2880, 1, 64]
    - [59, 0.0]
  - - [2880, 2880, 1, 64]
    - [20, 0.0]
  - - [3136, 2880, 1, 64]
    - [20, 0.0]
  - - [3392, 2880, 1, 64]
    - [54, 0.0]
  - - [3648, 2880, 1, 64]
    - [20, 0.0]
  - - [3904, 2880, 1, 64]
    - [52, 0.0]
  - - [64, 3136, 1, 64]
    - [66, 0.0]
  - - [320, 3136, 1, 64]
    - [45, 0.0]
  - - [576, 3136, 1, 64]
    - [46, 0.0]
  - - [832, 3136, 1, 64]
    - [61, 0.0]
  - - [1088, 3136, 1, 64]
    - [45, 0.0]
  - - [1344, 3136, 1, 64]
    - [56, 0.0]
  - - [1600, 3136, 1, 64]
    - [62, 0.0]
  - - [1856, 3136, 1, 64]
    - [54, 0.0]
  - - [2112, 3136, 1, 64]
    - [55, 0.0]
  - - [2368, 3136, 1, 64]
    - [64, 0.0]
  - - [2624, 3136, 1, 64]
    - [55, 0.0]
  - - [2880, 3136, 1, 64]
    - [55, 0.0]
  - - [3136, 3136, 1, 64]
    - [64, 0.0]
  - - [3392, 3136, 1, 64]
    - [54, 0.0]
  - - [3648, 3136, 1, 64]
    - [20, 0.0]
  - - [3904, 3136, 1, 64]
    - [20, 0.0]
  - - [64, 3392, 1, 64]
    - [67, 0.0]
  - - [320, 3392, 1, 64]
    - [44, 0.0]
  - - [576, 3392, 1, 64]
    - [38, 0.0]
  - - [832, 3392, 1, 64]
    - [43, 0.0]
  - - [1088, 3392, 1, 64]
    - [47, 0.0]
  - - [1344, 3392, 1, 64]
    - [55, 0.0]
  - - [1600, 3392, 1, 64]
    - [20, 0.0]
  - - [1856, 3392, 1, 64]
    - [63, 0.0]
  - - [2112, 3392, 1, 64]
    - [55, 0.0]
  - - [2368, 3392, 1, 64]
    - [64, 0.0]
  - - [2624, 3392, 1, 64]
    - [55, 0.0]
  - - [2880, 3392, 1, 64]
    - [54, 0.0]
  - - [3136, 3392, 1, 64]
    - [55, 0.0]
  - - [3392, 3392, 1, 64]
    - [20, 0.0]
  - - [3648, 3392, 1, 64]
    - [55, 0.0]
  - - [3904, 3392, 1, 64]
    - [20, 0.0]
  - - [64, 3648, 1, 64]
    - [36, 0.0]
  - - [320, 3648, 1, 64]
    - [41, 0.0]
  - - [576, 3648, 1, 64]
    - [42, 0.0]
  - - [832, 3648, 1, 64]
    - [42, 0.0]
  - - [1088, 3648, 1, 64]
    - [48, 0.0]
  - - [1344, 3648, 1, 64]
    - [55, 0.0]
  - - [1600, 3648, 1, 64]
    - [20, 0.0]
  - - [1856, 3648, 1, 64]
    - [54, 0.0]
  - - [2112, 3648, 1, 64]
    - [54, 0.0]
  - - [2368, 3648, 1, 64]
    - [20, 0.0]
  - - [2624, 3648, 1, 64]
    - [20, 0.0]
  - - [2880, 3648, 1, 64]
    - [59, 0.0]
  - - [3136, 3648, 1, 64]
    - [54, 0.0]
  - - [3392, 3648, 1, 64]
    - [55, 0.0]
  - - [3648, 3648, 1, 64]
    - [20, 0.0]
  - - [3904, 3648, 1, 64]
    - [20, 0.0]
  - - [64, 3904, 1, 64]
    - [27, 0.0]
  - - [320, 3904, 1, 64]
    - [47, 0.0]
  - - [576, 3904, 1, 64]
    - [45, 0.0]
  - - [832, 3904, 1, 64]
    - [46, 0.0]
  - - [1088, 3904, 1, 64]
    - [55, 0.0]
  - - [1344, 3904, 1, 64]
    - [55, 0.0]
  - - [1600, 3904, 1, 64]
    - [53, 0.0]
  - - [1856, 3904, 1, 64]
    - [20, 0.0]
  - - [2112, 3904, 1, 64]
    - [55, 0.0]
  - - [2368, 3904, 1, 64]
    - [64, 0.0]
  - - [2624, 3904, 1, 64]
    - [54, 0.0]
  - - [2880, 3904, 1, 64]
    - [56, 0.0]
  - - [3136, 3904, 1, 64]
    - [20, 0.0]
  - - [3392, 3904, 1, 64]
    - [52, 0.0]
  - - [3648, 3904, 1, 64]
    - [20, 0.0]
  - - [3904, 3904, 1, 64]
    - [59, 0.0]
  - - [320, 64, 1, 256]
    - [179, 0.0]
  - - [576, 64, 1, 256]
    - [24, 0.0]
  - - [832, 64, 1, 256]
    - [27, 0.0]
  - - [1088, 64, 1, 256]
    - [73, 0.0]
  - - [1344, 64, 1, 256]
    - [35, 0.0]
  - - [1600, 64, 1, 256]
    - [78, 0.0]
  - - [1856, 64, 1, 256]
    - [27, 0.0]
  - - [2112, 64, 1, 256]
    - [70, 0.0]
  - - [2368, 64, 1, 256]
    - [71, 0.0]
  - - [2624, 64, 1, 256]
    - [27, 0.0]
  - - [2880, 64, 1, 256]
    - [19, 0.0]
  - - [3136, 64, 1, 256]
    - [72, 0.0]
  - - [3392, 64, 1, 256]
    - [73, 0.0]
  - - [3648, 64, 1, 256]
    - [27, 0.0]
  - - [3904, 64, 1, 256]
    - [74, 0.0]
  - - [64, 320, 1, 256]
    - [150, 0.0]
  - - [320, 320, 1, 256]
    - [73, 0.0]
  - - [576, 320, 1, 256]
    - [35, 0.0]
  - - [832, 320, 1, 256]
    - [77, 0.0]
  - - [1088, 320, 1, 256]
    - [19, 0.0]
  - - [1344, 320, 1, 256]
    - [41, 0.0]
  - - [1600, 320, 1, 256]
    - [28, 0.0]
  - - [1856, 320, 1, 256]
    - [19, 0.0]
  - - [2112, 320, 1, 256]
    - [27, 0.0]
  - - [2368, 320, 1, 256]
    - [28, 0.0]
  - - [2624, 320, 1, 256]
    - [77, 0.0]
  - - [2880, 320, 1, 256]
    - [27, 0.0]
  - - [3136, 320, 1, 256]
    - [28, 0.0]
  - - [3392, 320, 1, 256]
    - [32, 0.0]
  - - [3648, 320, 1, 256]
    - [27, 0.0]
  - - [3904, 320, 1, 256]
    - [78, 0.0]
  - - [64, 576, 1, 256]
    - [27, 0.0]
  - - [320, 576, 1, 256]
    - [28, 0.0]
  - - [576, 576, 1, 256]
    - [27, 0.0]
  - - [832, 576, 1, 256]
    - [28, 0.0]
  - - [1088, 576, 1, 256]
    - [35, 0.0]
  - - [1344, 576, 1, 256]
    - [81, 0.0]
  - - [1600, 576, 1, 256]
    - [77, 0.0]
  - - [1856, 576, 1, 256]
    - [45, 0.0]
  - - [2112, 576, 1, 256]
    - [27, 0.0]
  - - [2368, 576, 1, 256]
    - [48, 0.0]
  - - [2624, 576, 1, 256]
    - [41, 0.0]
  - - [2880, 576, 1, 256]
    - [76, 0.0]
  - - [3136, 576, 1, 256]
    - [79, 0.0]
  - - [3392, 576, 1, 256]
    - [76, 0.0]
  - - [3648, 576, 1, 256]
    - [63, 0.0]
  - - [3904, 576, 1, 256]
    - [63, 0.0]
  - - [64, 832, 1, 256]
    - [19, 0.0]
  - - [320, 832, 1, 256]
    - [19, 0.0]
  - - [576, 832, 1, 256]
    - [77, 0.0]
  - - [832, 832, 1, 256]
    - [19, 0.0]
  - - [1088, 832, 1, 256]
    - [77, 0.0]
  - - [1344, 832, 1, 256]
    - [143, 0.0]
  - - [1600, 832, 1, 256]
    - [81, 0.0]
  - - [1856, 832, 1, 256]
    - [145, 0.0]
  - - [2112, 832, 1, 256]
    - [54, 0.0]
  - - [2368, 832, 1, 256]
    - [20, 0.0]
  - - [2624, 832, 1, 256]
    - [20, 0.0]
  - - [2880, 832, 1, 256]
    - [54, 0.0]
  - - [3136, 832, 1, 256]
    - [20, 0.0]
  - - [3392, 832, 1, 256]
    - [63, 0.0]
  - - [3648, 832, 1, 256]
    - [62, 0.0]
  - - [3904, 832, 1, 256]
    - [63, 0.0]
  - - [64, 1088, 1, 256]
    - [36, 0.0]
  - - [320, 1088, 1, 256]
    - [28, 0.0]
  - - [576, 1088, 1, 256]
    - [28, 0.0]
  - - [832, 1088, 1, 256]
    - [27, 0.0]
  - - [1088, 1088, 1, 256]
    - [81, 0.0]
  - - [1344, 1088, 1, 256]
    - [146, 0.0]
  - - [1600, 1088, 1, 256]
    - [20, 0.0]
  - - [1856, 1088, 1, 256]
    - [20, 0.0]
  - - [2112, 1088, 1, 256]
    - [54, 0.0]
  - - [2368, 1088, 1, 256]
    - [59, 0.0]
  - - [2624, 1088, 1, 256]
    - [63, 0.0]
  - - [2880, 1088, 1, 256]
    - [55, 0.0]
  - - [3136, 1088, 1, 256]
    - [62, 0.0]
  - - [3392, 1088, 1, 256]
    - [20, 0.0]
  - - [3648, 1088, 1, 256]
    - [54, 0.0]
  - - [3904, 1088, 1, 256]
    - [62, 0.0]
  - - [64, 1344, 1, 256]
    - [27, 0.0]
  - - [320, 1344, 1, 256]
    - [73, 0.0]
  - - [576, 1344, 1, 256]
    - [79, 0.0]
  - - [832, 1344, 1, 256]
    - [48, 0.0]
  - - [1088, 1344, 1, 256]
    - [81, 0.0]
  - - [1344, 1344, 1, 256]
    - [20, 0.0]
  - - [1600, 1344, 1, 256]
    - [20, 0.0]
  - - [1856, 1344, 1, 256]
    - [20, 0.0]
  - - [2112, 1344, 1, 256]
    - [56, 0.0]
  - - [2368, 1344, 1, 256]
    - [82, 0.0]
  - - [2624, 1344, 1, 256]
    - [20, 0.0]
  - - [2880, 1344, 1, 256]
    - [20, 0.0]
  - - [3136, 1344, 1, 256]
    - [62, 0.0]
  - - [3392, 1344, 1, 256]
    - [62, 0.0]
  - - [3648, 1344, 1, 256]
    - [83, 0.0]
  - - [3904, 1344, 1, 256]
    - [55, 0.0]
  - - [64, 1600, 1, 256]
    - [19, 0.0]
  - - [320, 1600, 1, 256]
    - [28, 0.0]
  - - [576, 1600, 1, 256]
    - [19, 0.0]
  - - [832, 1600, 1, 256]
    - [28, 0.0]
  - - [1088, 1600, 1, 256]
    - [55, 0.0]
  - - [1344, 1600, 1, 256]
    - [20, 0.0]
  - - [1600, 1600, 1, 256]
    - [20, 0.0]
  - - [1856, 1600, 1, 256]
    - [20, 0.0]
  - - [2112, 1600, 1, 256]
    - [84, 0.0]
  - - [2368, 1600, 1, 256]
    - [55, 0.0]
  - - [2624, 1600, 1, 256]
    - [20, 0.0]
  - - [2880, 1600, 1, 256]
    - [85, 0.0]
  - - [3136, 1600, 1, 256]
    - [64, 0.0]
  - - [3392, 1600, 1, 256]
    - [62, 0.0]
  - - [3648, 1600, 1, 256]
    - [63, 0.0]
  - - [3904, 1600, 1, 256]
    - [54, 0.0]
  - - [64, 1856, 1, 256]
    - [27, 0.0]
  - - [320, 1856, 1, 256]
    - [77, 0.0]
  - - [576, 1856, 1, 256]
    - [81, 0.0]
  - - [832, 1856, 1, 256]
    - [20, 0.0]
  - - [1088, 1856, 1, 256]
    - [54, 0.0]
  - - [1344, 1856, 1, 256]
    - [55, 0.0]
  - - [1600, 1856, 1, 256]
    - [20, 0.0]
  - - [1856, 1856, 1, 256]
    - [54, 0.0]
  - - [2112, 1856, 1, 256]
    - [20, 0.0]
  - - [2368, 1856, 1, 256]
    - [55, 0.0]
  - - [2624, 1856, 1, 256]
    - [54, 0.0]
  - - [2880, 1856, 1, 256]
    - [55, 0.0]
  - - [3136, 1856, 1, 256]
    - [20, 0.0]
  - - [3392, 1856, 1, 256]
    - [20, 0.0]
  - - [3648, 1856, 1, 256]
    - [86, 0.0]
  - - [3904, 1856, 1, 256]
    - [85, 0.0]
  - - [64, 2112, 1, 256]
    - [31, 0.0]
  - - [320, 2112, 1, 256]
    - [28, 0.0]
  - - [576, 2112, 1, 256]
    - [28, 0.0]
  - - [832, 2112, 1, 256]
    - [87, 0.0]
  - - [1088, 2112, 1, 256]
    - [20, 0.0]
  - - [1344, 2112, 1, 256]
    - [54, 0.0]
  - - [1600, 2112, 1, 256]
    - [20, 0.0]
  - - [1856, 2112, 1, 256]
    - [64, 0.0]
  - - [2112, 2112, 1, 256]
    - [62, 0.0]
  - - [2368, 2112, 1, 256]
    - [55, 0.0]
  - - [2624, 2112, 1, 256]
    - [83, 0.0]
  - - [2880, 2112, 1, 256]
    - [20, 0.0]
  - - [3136, 2112, 1, 256]
    - [62, 0.0]
  - - [3392, 2112, 1, 256]
    - [20, 0.0]
  - - [3648, 2112, 1, 256]
    - [52, 0.0]
  - - [3904, 2112, 1, 256]
    - [82, 0.0]
  - - [64, 2368, 1, 256]
    - [27, 0.0]
  - - [320, 2368, 1, 256]
    - [77, 0.0]
  - - [576, 2368, 1, 256]
    - [48, 0.0]
  - - [832, 2368, 1, 256]
    - [82, 0.0]
  - - [1088, 2368, 1, 256]
    - [82, 0.0]
  - - [1344, 2368, 1, 256]
    - [20, 0.0]
  - - [1600, 2368, 1, 256]
    - [82, 0.0]
  - - [1856, 2368, 1, 256]
    - [20, 0.0]
  - - [2112, 2368, 1, 256]
    - [54, 0.0]
  - - [2368, 2368, 1, 256]
    - [55, 0.0]
  - - [2624, 2368, 1, 256]
    - [55, 0.0]
  - - [2880, 2368, 1, 256]
    - [20, 0.0]
  - - [3136, 2368, 1, 256]
    - [54, 0.0]
  - - [3392, 2368, 1, 256]
    - [59, 0.0]
  - - [3648, 2368, 1, 256]
    - [83, 0.0]
  - - [3904, 2368, 1, 256]
    - [54, 0.0]
  - - [64, 2624, 1, 256]
    - [88, 0.0]
  - - [320, 2624, 1, 256]
    - [28, 0.0]
  - - [576, 2624, 1, 256]
    - [28, 0.0]
  - - [832, 2624, 1, 256]
    - [20, 0.0]
  - - [1088, 2624, 1, 256]
    - [64, 0.0]
  - - [1344, 2624, 1, 256]
    - [54, 0.0]
  - - [1600, 2624, 1, 256]
    - [89, 0.0]
  - - [1856, 2624, 1, 256]
    - [20, 0.0]
  - - [2112, 2624, 1, 256]
    - [55, 0.0]
  - - [2368, 2624, 1, 256]
    - [85, 0.0]
  - - [2624, 2624, 1, 256]
    - [20, 0.0]
  - - [2880, 2624, 1, 256]
    - [52, 0.0]
  - - [3136, 2624, 1, 256]
    - [54, 0.0]
  - - [3392, 2624, 1, 256]
    - [90, 0.0]
  - - [3648, 2624, 1, 256]
    - [20, 0.0]
  - - [3904, 2624, 1, 256]
    - [20, 0.0]
  - - [64, 2880, 1, 256]
    - [91, 0.0]
  - - [320, 2880, 1, 256]
    - [27, 0.0]
  - - [576, 2880, 1, 256]
    - [77, 0.0]
  - - [832, 2880, 1, 256]
    - [20, 0.0]
  - - [1088, 2880, 1, 256]
    - [82, 0.0]
  - - [1344, 2880, 1, 256]
    - [20, 0.0]
  - - [1600, 2880, 1, 256]
    - [20, 0.0]
  - - [1856, 2880, 1, 256]
    - [20, 0.0]
  - - [2112, 2880, 1, 256]
    - [20, 0.0]
  - - [2368, 2880, 1, 256]
    - [92, 0.0]
  - - [2624, 2880, 1, 256]
    - [82, 0.0]
  - - [2880, 2880, 1, 256]
    - [54, 0.0]
  - - [3136, 2880, 1, 256]
    - [54, 0.0]
  - - [3392, 2880, 1, 256]
    - [20, 0.0]
  - - [3648, 2880, 1, 256]
    - [54, 0.0]
  - - [3904, 2880, 1, 256]
    - [82, 0.0]
  - - [64, 3136, 1, 256]
    - [28, 0.0]
  - - [320, 3136, 1, 256]
    - [78, 0.0]
  - - [576, 3136, 1, 256]
    - [93, 0.0]
  - - [832, 3136, 1, 256]
    - [55, 0.0]
  - - [1088, 3136, 1, 256]
    - [20, 0.0]
  - - [1344, 3136, 1, 256]
    - [64, 0.0]
  - - [1600, 3136, 1, 256]
    - [55, 0.0]
  - - [1856, 3136, 1, 256]
    - [54, 0.0]
  - - [2112, 3136, 1, 256]
    - [55, 0.0]
  - - [2368, 3136, 1, 256]
    - [64, 0.0]
  - - [2624, 3136, 1, 256]
    - [63, 0.0]
  - - [2880, 3136, 1, 256]
    - [20, 0.0]
  - - [3136, 3136, 1, 256]
    - [59, 0.0]
  - - [3392, 3136, 1, 256]
    - [20, 0.0]
  - - [3648, 3136, 1, 256]
    - [62, 0.0]
  - - [3904, 3136, 1, 256]
    - [20, 0.0]
  - - [64, 3392, 1, 256]
    - [27, 0.0]
  - - [320, 3392, 1, 256]
    - [41, 0.0]
  - - [576, 3392, 1, 256]
    - [93, 0.0]
  - - [832, 3392, 1, 256]
    - [20, 0.0]
  - - [1088, 3392, 1, 256]
    - [62, 0.0]
  - - [1344, 3392, 1, 256]
    - [20, 0.0]
  - - [1600, 3392, 1, 256]
    - [63, 0.0]
  - - [1856, 3392, 1, 256]
    - [94, 0.0]
  - - [2112, 3392, 1, 256]
    - [20, 0.0]
  - - [2368, 3392, 1, 256]
    - [64, 0.0]
  - - [2624, 3392, 1, 256]
    - [62, 0.0]
  - - [2880, 3392, 1, 256]
    - [56, 0.0]
  - - [3136, 3392, 1, 256]
    - [83, 0.0]
  - - [3392, 3392, 1, 256]
    - [62, 0.0]
  - - [3648, 3392, 1, 256]
    - [20, 0.0]
  - - [3904, 3392, 1, 256]
    - [20, 0.0]
  - - [64, 3648, 1, 256]
    - [95, 0.0]
  - - [320, 3648, 1, 256]
    - [48, 0.0]
  - - [576, 3648, 1, 256]
    - [96, 0.0]
  - - [832, 3648, 1, 256]
    - [63, 0.0]
  - - [1088, 3648, 1, 256]
    - [55, 0.0]
  - - [1344, 3648, 1, 256]
    - [20, 0.0]
  - - [1600, 3648, 1, 256]
    - [62, 0.0]
  - - [1856, 3648, 1, 256]
    - [20, 0.0]
  - - [2112, 3648, 1, 256]
    - [20, 0.0]
  - - [2368, 3648, 1, 256]
    - [87, 0.0]
  - - [2624, 3648, 1, 256]
    - [55, 0.0]
  - - [2880, 3648, 1, 256]
    - [83, 0.0]
  - - [3136, 3648, 1, 256]
    - [20, 0.0]
  - - [3392, 3648, 1, 256]
    - [54, 0.0]
  - - [3648, 3648, 1, 256]
    - [20, 0.0]
  - - [3904, 3648, 1, 256]
    - [84, 0.0]
  - - [64, 3904, 1, 256]
    - [97, 0.0]
  - - [320, 3904, 1, 256]
    - [81, 0.0]
  - - [576, 3904, 1, 256]
    - [52, 0.0]
  - - [832, 3904, 1, 256]
    - [20, 0.0]
  - - [1088, 3904, 1, 256]
    - [62, 0.0]
  - - [1344, 3904, 1, 256]
    - [20, 0.0]
  - - [1600, 3904, 1, 256]
    - [56, 0.0]
  - - [1856, 3904, 1, 256]
    - [52, 0.0]
  - - [2112, 3904, 1, 256]
    - [55, 0.0]
  - - [2368, 3904, 1, 256]
    - [62, 0.0]
  - - [2624, 3904, 1, 256]
    - [20, 0.0]
  - - [2880, 3904, 1, 256]
    - [56, 0.0]
  - - [3136, 3904, 1, 256]
    - [62, 0.0]
  - - [3392, 3904, 1, 256]
    - [54, 0.0]
  - - [3648, 3904, 1, 256]
    - [20, 0.0]
  - - [3904, 3904, 1, 256]
    - [62, 0.0]
  - - [320, 64, 1, 512]
    - [68, 0.0]
  - - [576, 64, 1, 512]
    - [27, 0.0]
  - - [832, 64, 1, 512]
    - [19, 0.0]
  - - [1088, 64, 1, 512]
    - [27, 0.0]
  - - [1344, 64, 1, 512]
    - [27, 0.0]
  - - [1600, 64, 1, 512]
    - [19, 0.0]
  - - [1856, 64, 1, 512]
    - [27, 0.0]
  - - [2112, 64, 1, 512]
    - [72, 0.0]
  - - [2368, 64, 1, 512]
    - [99, 0.0]
  - - [2624, 64, 1, 512]
    - [100, 0.0]
  - - [2880, 64, 1, 512]
    - [27, 0.0]
  - - [3136, 64, 1, 512]
    - [19, 0.0]
  - - [3392, 64, 1, 512]
    - [19, 0.0]
  - - [3648, 64, 1, 512]
    - [77, 0.0]
  - - [3904, 64, 1, 512]
    - [28, 0.0]
  - - [64, 320, 1, 512]
    - [184, 0.0]
  - - [320, 320, 1, 512]
    - [19, 0.0]
  - - [576, 320, 1, 512]
    - [19, 0.0]
  - - [832, 320, 1, 512]
    - [19, 0.0]
  - - [1088, 320, 1, 512]
    - [28, 0.0]
  - - [1344, 320, 1, 512]
    - [71, 0.0]
  - - [1600, 320, 1, 512]
    - [77, 0.0]
  - - [1856, 320, 1, 512]
    - [28, 0.0]
  - - [2112, 320, 1, 512]
    - [77, 0.0]
  - - [2368, 320, 1, 512]
    - [77, 0.0]
  - - [2624, 320, 1, 512]
    - [101, 0.0]
  - - [2880, 320, 1, 512]
    - [69, 0.0]
  - - [3136, 320, 1, 512]
    - [102, 0.0]
  - - [3392, 320, 1, 512]
    - [75, 0.0]
  - - [3648, 320, 1, 512]
    - [55, 0.0]
  - - [3904, 320, 1, 512]
    - [62, 0.0]
  - - [64, 576, 1, 512]
    - [88, 0.0]
  - - [320, 576, 1, 512]
    - [28, 0.0]
  - - [576, 576, 1, 512]
    - [77, 0.0]
  - - [832, 576, 1, 512]
    - [77, 0.0]
  - - [1088, 576, 1, 512]
    - [71, 0.0]
  - - [1344, 576, 1, 512]
    - [74, 0.0]
  - - [1600, 576, 1, 512]
    - [77, 0.0]
  - - [1856, 576, 1, 512]
    - [20, 0.0]
  - - [2112, 576, 1, 512]
    - [20, 0.0]
  - - [2368, 576, 1, 512]
    - [94, 0.0]
  - - [2624, 576, 1, 512]
    - [62, 0.0]
  - - [2880, 576, 1, 512]
    - [20, 0.0]
  - - [3136, 576, 1, 512]
    - [20, 0.0]
  - - [3392, 576, 1, 512]
    - [20, 0.0]
  - - [3648, 576, 1, 512]
    - [20, 0.0]
  - - [3904, 576, 1, 512]
    - [62, 0.0]
  - - [64, 832, 1, 512]
    - [28, 0.0]
  - - [320, 832, 1, 512]
    - [28, 0.0]
  - - [576, 832, 1, 512]
    - [77, 0.0]
  - - [832, 832, 1, 512]
    - [27, 0.0]
  - - [1088, 832, 1, 512]
    - [55, 0.0]
  - - [1344, 832, 1, 512]
    - [55, 0.0]
  - - [1600, 832, 1, 512]
    - [20, 0.0]
  - - [1856, 832, 1, 512]
    - [20, 0.0]
  - - [2112, 832, 1, 512]
    - [20, 0.0]
  - - [2368, 832, 1, 512]
    - [55, 0.0]
  - - [2624, 832, 1, 512]
    - [63, 0.0]
  - - [2880, 832, 1, 512]
    - [20, 0.0]
  - - [3136, 832, 1, 512]
    - [52, 0.0]
  - - [3392, 832, 1, 512]
    - [52, 0.0]
  - - [3648, 832, 1, 512]
    - [20, 0.0]
  - - [3904, 832, 1, 512]
    - [54, 0.0]
  - - [64, 1088, 1, 512]
    - [19, 0.0]
  - - [320, 1088, 1, 512]
    - [28, 0.0]
  - - [576, 1088, 1, 512]
    - [88, 0.0]
  - - [832, 1088, 1, 512]
    - [20, 0.0]
  - - [1088, 1088, 1, 512]
    - [20, 0.0]
  - - [1344, 1088, 1, 512]
    - [20, 0.0]
  - - [1600, 1088, 1, 512]
    - [20, 0.0]
  - - [1856, 1088, 1, 512]
    - [20, 0.0]
  - - [2112, 1088, 1, 512]
    - [62, 0.0]
  - - [2368, 1088, 1, 512]
    - [85, 0.0]
  - - [2624, 1088, 1, 512]
    - [20, 0.0]
  - - [2880, 1088, 1, 512]
    - [20, 0.0]
  - - [3136, 1088, 1, 512]
    - [53, 0.0]
  - - [3392, 1088, 1, 512]
    - [63, 0.0]
  - - [3648, 1088, 1, 512]
    - [20, 0.0]
  - - [3904, 1088, 1, 512]
    - [55, 0.0]
  - - [64, 1344, 1, 512]
    - [19, 0.0]
  - - [320, 1344, 1, 512]
    - [28, 0.0]
  - - [576, 1344, 1, 512]
    - [71, 0.0]
  - - [832, 1344, 1, 512]
    - [20, 0.0]
  - - [1088, 1344, 1, 512]
    - [20, 0.0]
  - - [1344, 1344, 1, 512]
    - [55, 0.0]
  - - [1600, 1344, 1, 512]
    - [20, 0.0]
  - - [1856, 1344, 1, 512]
    - [20, 0.0]
  - - [2112, 1344, 1, 512]
    - [55, 0.0]
  - - [2368, 1344, 1, 512]
    - [85, 0.0]
  - - [2624, 1344, 1, 512]
    - [52, 0.0]
  - - [2880, 1344, 1, 512]
    - [20, 0.0]
  - - [3136, 1344, 1, 512]
    - [107, 0.0]
  - - [3392, 1344, 1, 512]
    - [54, 0.0]
  - - [3648, 1344, 1, 512]
    - [20, 0.0]
  - - [3904, 1344, 1, 512]
    - [62, 0.0]
  - - [64, 1600, 1, 512]
    - [103, 0.0]
  - - [320, 1600, 1, 512]
    - [28, 0.0]
  - - [576, 1600, 1, 512]
    - [28, 0.0]
  - - [832, 1600, 1, 512]
    - [20, 0.0]
  - - [1088, 1600, 1, 512]
    - [54, 0.0]
  - - [1344, 1600, 1, 512]
    - [20, 0.0]
  - - [1600, 1600, 1, 512]
    - [20, 0.0]
  - - [1856, 1600, 1, 512]
    - [20, 0.0]
  - - [2112, 1600, 1, 512]
    - [20, 0.0]
  - - [2368, 1600, 1, 512]
    - [62, 0.0]
  - - [2624, 1600, 1, 512]
    - [63, 0.0]
  - - [2880, 1600, 1, 512]
    - [94, 0.0]
  - - [3136, 1600, 1, 512]
    - [63, 0.0]
  - - [3392, 1600, 1, 512]
    - [94, 0.0]
  - - [3648, 1600, 1, 512]
    - [82, 0.0]
  - - [3904, 1600, 1, 512]
    - [20, 0.0]
  - - [64, 1856, 1, 512]
    - [77, 0.0]
  - - [320, 1856, 1, 512]
    - [28, 0.0]
  - - [576, 1856, 1, 512]
    - [20, 0.0]
  - - [832, 1856, 1, 512]
    - [20, 0.0]
  - - [1088, 1856, 1, 512]
    - [20, 0.0]
  - - [1344, 1856, 1, 512]
    - [20, 0.0]
  - - [1600, 1856, 1, 512]
    - [54, 0.0]
  - - [1856, 1856, 1, 512]
    - [20, 0.0]
  - - [2112, 1856, 1, 512]
    - [82, 0.0]
  - - [2368, 1856, 1, 512]
    - [63, 0.0]
  - - [2624, 1856, 1, 512]
    - [20, 0.0]
  - - [2880, 1856, 1, 512]
    - [82, 0.0]
  - - [3136, 1856, 1, 512]
    - [54, 0.0]
  - - [3392, 1856, 1, 512]
    - [20, 0.0]
  - - [3648, 1856, 1, 512]
    - [62, 0.0]
  - - [3904, 1856, 1, 512]
    - [54, 0.0]
  - - [64, 2112, 1, 512]
    - [37, 0.0]
  - - [320, 2112, 1, 512]
    - [28, 0.0]
  - - [576, 2112, 1, 512]
    - [82, 0.0]
  - - [832, 2112, 1, 512]
    - [20, 0.0]
  - - [1088, 2112, 1, 512]
    - [54, 0.0]
  - - [1344, 2112, 1, 512]
    - [20, 0.0]
  - - [1600, 2112, 1, 512]
    - [52, 0.0]
  - - [1856, 2112, 1, 512]
    - [20, 0.0]
  - - [2112, 2112, 1, 512]
    - [20, 0.0]
  - - [2368, 2112, 1, 512]
    - [55, 0.0]
  - - [2624, 2112, 1, 512]
    - [82, 0.0]
  - - [2880, 2112, 1, 512]
    - [62, 0.0]
  - - [3136, 2112, 1, 512]
    - [90, 0.0]
  - - [3392, 2112, 1, 512]
    - [55, 0.0]
  - - [3648, 2112, 1, 512]
    - [20, 0.0]
  - - [3904, 2112, 1, 512]
    - [55, 0.0]
  - - [64, 2368, 1, 512]
    - [39, 0.0]
  - - [320, 2368, 1, 512]
    - [77, 0.0]
  - - [576, 2368, 1, 512]
    - [63, 0.0]
  - - [832, 2368, 1, 512]
    - [55, 0.0]
  - - [1088, 2368, 1, 512]
    - [20, 0.0]
  - - [1344, 2368, 1, 512]
    - [54, 0.0]
  - - [1600, 2368, 1, 512]
    - [54, 0.0]
  - - [1856, 2368, 1, 512]
    - [20, 0.0]
  - - [2112, 2368, 1, 512]
    - [20, 0.0]
  - - [2368, 2368, 1, 512]
    - [83, 0.0]
  - - [2624, 2368, 1, 512]
    - [82, 0.0]
  - - [2880, 2368, 1, 512]
    - [55, 0.0]
  - - [3136, 2368, 1, 512]
    - [55, 0.0]
  - - [3392, 2368, 1, 512]
    - [20, 0.0]
  - - [3648, 2368, 1, 512]
    - [59, 0.0]
  - - [3904, 2368, 1, 512]
    - [82, 0.0]
  - - [64, 2624, 1, 512]
    - [108, 0.0]
  - - [320, 2624, 1, 512]
    - [39, 0.0]
  - - [576, 2624, 1, 512]
    - [82, 0.0]
  - - [832, 2624, 1, 512]
    - [54, 0.0]
  - - [1088, 2624, 1, 512]
    - [63, 0.0]
  - - [1344, 2624, 1, 512]
    - [20, 0.0]
  - - [1600, 2624, 1, 512]
    - [84, 0.0]
  - - [1856, 2624, 1, 512]
    - [54, 0.0]
  - - [2112, 2624, 1, 512]
    - [20, 0.0]
  - - [2368, 2624, 1, 512]
    - [20, 0.0]
  - - [2624, 2624, 1, 512]
    - [54, 0.0]
  - - [2880, 2624, 1, 512]
    - [55, 0.0]
  - - [3136, 2624, 1, 512]
    - [54, 0.0]
  - - [3392, 2624, 1, 512]
    - [59, 0.0]
  - - [3648, 2624, 1, 512]
    - [56, 0.0]
  - - [3904, 2624, 1, 512]
    - [55, 0.0]
  - - [64, 2880, 1, 512]
    - [41, 0.0]
  - - [320, 2880, 1, 512]
    - [109, 0.0]
  - - [576, 2880, 1, 512]
    - [54, 0.0]
  - - [832, 2880, 1, 512]
    - [55, 0.0]
  - - [1088, 2880, 1, 512]
    - [20, 0.0]
  - - [1344, 2880, 1, 512]
    - [83, 0.0]
  - - [1600, 2880, 1, 512]
    - [62, 0.0]
  - - [1856, 2880, 1, 512]
    - [52, 0.0]
  - - [2112, 2880, 1, 512]
    - [52, 0.0]
  - - [2368, 2880, 1, 512]
    - [82, 0.0]
  - - [2624, 2880, 1, 512]
    - [85, 0.0]
  - - [2880, 2880, 1, 512]
    - [63, 0.0]
  - - [3136, 2880, 1, 512]
    - [20, 0.0]
  - - [3392, 2880, 1, 512]
    - [63, 0.0]
  - - [3648, 2880, 1, 512]
    - [20, 0.0]
  - - [3904, 2880, 1, 512]
    - [20, 0.0]
  - - [64, 3136, 1, 512]
    - [69, 0.0]
  - - [320, 3136, 1, 512]
    - [77, 0.0]
  - - [576, 3136, 1, 512]
    - [63, 0.0]
  - - [832, 3136, 1, 512]
    - [20, 0.0]
  - - [1088, 3136, 1, 512]
    - [54, 0.0]
  - - [1344, 3136, 1, 512]
    - [20, 0.0]
  - - [1600, 3136, 1, 512]
    - [85, 0.0]
  - - [1856, 3136, 1, 512]
    - [85, 0.0]
  - - [2112, 3136, 1, 512]
    - [53, 0.0]
  - - [2368, 3136, 1, 512]
    - [82, 0.0]
  - - [2624, 3136, 1, 512]
    - [82, 0.0]
  - - [2880, 3136, 1, 512]
    - [84, 0.0]
  - - [3136, 3136, 1, 512]
    - [20, 0.0]
  - - [3392, 3136, 1, 512]
    - [62, 0.0]
  - - [3648, 3136, 1, 512]
    - [55, 0.0]
  - - [3904, 3136, 1, 512]
    - [20, 0.0]
  - - [64, 3392, 1, 512]
    - [77, 0.0]
  - - [320, 3392, 1, 512]
    - [79, 0.0]
  - - [576, 3392, 1, 512]
    - [52, 0.0]
  - - [832, 3392, 1, 512]
    - [54, 0.0]
  - - [1088, 3392, 1, 512]
    - [55, 0.0]
  - - [1344, 3392, 1, 512]
    - [53, 0.0]
  - - [1600, 3392, 1, 512]
    - [54, 0.0]
  - - [1856, 3392, 1, 512]
    - [53, 0.0]
  - - [2112, 3392, 1, 512]
    - [110, 0.0]
  - - [2368, 3392, 1, 512]
    - [63, 0.0]
  - - [2624, 3392, 1, 512]
    - [20, 0.0]
  - - [2880, 3392, 1, 512]
    - [20, 0.0]
  - - [3136, 3392, 1, 512]
    - [54, 0.0]
  - - [3392, 3392, 1, 512]
    - [53, 0.0]
  - - [3648, 3392, 1, 512]
    - [54, 0.0]
  - - [3904, 3392, 1, 512]
    - [110, 0.0]
  - - [64, 3648, 1, 512]
    - [40, 0.0]
  - - [320, 3648, 1, 512]
    - [81, 0.0]
  - - [576, 3648, 1, 512]
    - [20, 0.0]
  - - [832, 3648, 1, 512]
    - [20, 0.0]
  - - [1088, 3648, 1, 512]
    - [52, 0.0]
  - - [1344, 3648, 1, 512]
    - [62, 0.0]
  - - [1600, 3648, 1, 512]
    - [55, 0.0]
  - - [1856, 3648, 1, 512]
    - [63, 0.0]
  - - [2112, 3648, 1, 512]
    - [54, 0.0]
  - - [2368, 3648, 1, 512]
    - [55, 0.0]
  - - [2624, 3648, 1, 512]
    - [20, 0.0]
  - - [2880, 3648, 1, 512]
    - [20, 0.0]
  - - [3136, 3648, 1, 512]
    - [20, 0.0]
  - - [3392, 3648, 1, 512]
    - [85, 0.0]
  - - [3648, 3648, 1, 512]
    - [94, 0.0]
  - - [3904, 3648, 1, 512]
    - [63, 0.0]
  - - [64, 3904, 1, 512]
    - [19, 0.0]
  - - [320, 3904, 1, 512]
    - [20, 0.0]
  - - [576, 3904, 1, 512]
    - [20, 0.0]
  - - [832, 3904, 1, 512]
    - [20, 0.0]
  - - [1088, 3904, 1, 512]
    - [63, 0.0]
  - - [1344, 3904, 1, 512]
    - [55, 0.0]
  - - [1600, 3904, 1, 512]
    - [94, 0.0]
  - - [1856, 3904, 1, 512]
    - [55, 0.0]
  - - [2112, 3904, 1, 512]
    - [106, 0.0]
  - - [2368, 3904, 1, 512]
    - [20, 0.0]
  - - [2624, 3904, 1, 512]
    - [54, 0.0]
  - - [2880, 3904, 1, 512]
    - [63, 0.0]
  - - [3136, 3904, 1, 512]
    - [63, 0.0]
  - - [3392, 3904, 1, 512]
    - [20, 0.0]
  - - [3648, 3904, 1, 512]
    - [55, 0.0]
  - - [3904, 3904, 1, 512]
    - [54, 0.0]
  - - [320, 64, 1, 1024]
    - [187, 0.0]
  - - [576, 64, 1, 1024]
    - [27, 0.0]
  - - [832, 64, 1, 1024]
    - [28, 0.0]
  - - [1088, 64, 1, 1024]
    - [19, 0.0]
  - - [1344, 64, 1, 1024]
    - [74, 0.0]
  - - [1600, 64, 1, 1024]
    - [19, 0.0]
  - - [1856, 64, 1, 1024]
    - [27, 0.0]
  - - [2112, 64, 1, 1024]
    - [28, 0.0]
  - - [2368, 64, 1, 1024]
    - [27, 0.0]
  - - [2624, 64, 1, 1024]
    - [108, 0.0]
  - - [2880, 64, 1, 1024]
    - [19, 0.0]
  - - [3136, 64, 1, 1024]
    - [27, 0.0]
  - - [3392, 64, 1, 1024]
    - [105, 0.0]
  - - [3648, 64, 1, 1024]
    - [71, 0.0]
  - - [3904, 64, 1, 1024]
    - [100, 0.0]
  - - [64, 320, 1, 1024]
    - [188, 0.0]
  - - [320, 320, 1, 1024]
    - [27, 0.0]
  - - [576, 320, 1, 1024]
    - [27, 0.0]
  - - [832, 320, 1, 1024]
    - [28, 0.0]
  - - [1088, 320, 1, 1024]
    - [117, 0.0]
  - - [1344, 320, 1, 1024]
    - [27, 0.0]
  - - [1600, 320, 1, 1024]
    - [28, 0.0]
  - - [1856, 320, 1, 1024]
    - [20, 0.0]
  - - [2112, 320, 1, 1024]
    - [105, 0.0]
  - - [2368, 320, 1, 1024]
    - [63, 0.0]
  - - [2624, 320, 1, 1024]
    - [52, 0.0]
  - - [2880, 320, 1, 1024]
    - [63, 0.0]
  - - [3136, 320, 1, 1024]
    - [62, 0.0]
  - - [3392, 320, 1, 1024]
    - [85, 0.0]
  - - [3648, 320, 1, 1024]
    - [20, 0.0]
  - - [3904, 320, 1, 1024]
    - [20, 0.0]
  - - [64, 576, 1, 1024]
    - [19, 0.0]
  - - [320, 576, 1, 1024]
    - [73, 0.0]
  - - [576, 576, 1, 1024]
    - [117, 0.0]
  - - [832, 576, 1, 1024]
    - [28, 0.0]
  - - [1088, 576, 1, 1024]
    - [20, 0.0]
  - - [1344, 576, 1, 1024]
    - [23, 0.0]
  - - [1600, 576, 1, 1024]
    - [110, 0.0]
  - - [1856, 576, 1, 1024]
    - [20, 0.0]
  - - [2112, 576, 1, 1024]
    - [63, 0.0]
  - - [2368, 576, 1, 1024]
    - [20, 0.0]
  - - [2624, 576, 1, 1024]
    - [20, 0.0]
  - - [2880, 576, 1, 1024]
    - [63, 0.0]
  - - [3136, 576, 1, 1024]
    - [20, 0.0]
  - - [3392, 576, 1, 1024]
    - [63, 0.0]
  - - [3648, 576, 1, 1024]
    - [62, 0.0]
  - - [3904, 576, 1, 1024]
    - [54, 0.0]
  - - [64, 832, 1, 1024]
    - [19, 0.0]
  - - [320, 832, 1, 1024]
    - [77, 0.0]
  - - [576, 832, 1, 1024]
    - [19, 0.0]
  - - [832, 832, 1, 1024]
    - [23, 0.0]
  - - [1088, 832, 1, 1024]
    - [23, 0.0]
  - - [1344, 832, 1, 1024]
    - [20, 0.0]
  - - [1600, 832, 1, 1024]
    - [20, 0.0]
  - - [1856, 832, 1, 1024]
    - [20, 0.0]
  - - [2112, 832, 1, 1024]
    - [20, 0.0]
  - - [2368, 832, 1, 1024]
    - [63, 0.0]
  - - [2624, 832, 1, 1024]
    - [54, 0.0]
  - - [2880, 832, 1, 1024]
    - [62, 0.0]
  - - [3136, 832, 1, 1024]
    - [54, 0.0]
  - - [3392, 832, 1, 1024]
    - [52, 0.0]
  - - [3648, 832, 1, 1024]
    - [54, 0.0]
  - - [3904, 832, 1, 1024]
    - [53, 0.0]
  - - [64, 1088, 1, 1024]
    - [27, 0.0]
  - - [320, 1088, 1, 1024]
    - [23, 0.0]
  - - [576, 1088, 1, 1024]
    - [55, 0.0]
  - - [832, 1088, 1, 1024]
    - [23, 0.0]
  - - [1088, 1088, 1, 1024]
    - [20, 0.0]
  - - [1344, 1088, 1, 1024]
    - [20, 0.0]
  - - [1600, 1088, 1, 1024]
    - [54, 0.0]
  - - [1856, 1088, 1, 1024]
    - [20, 0.0]
  - - [2112, 1088, 1, 1024]
    - [52, 0.0]
  - - [2368, 1088, 1, 1024]
    - [20, 0.0]
  - - [2624, 1088, 1, 1024]
    - [20, 0.0]
  - - [2880, 1088, 1, 1024]
    - [52, 0.0]
  - - [3136, 1088, 1, 1024]
    - [63, 0.0]
  - - [3392, 1088, 1, 1024]
    - [62, 0.0]
  - - [3648, 1088, 1, 1024]
    - [22, 0.0]
  - - [3904, 1088, 1, 1024]
    - [53, 0.0]
  - - [64, 1344, 1, 1024]
    - [74, 0.0]
  - - [320, 1344, 1, 1024]
    - [28, 0.0]
  - - [576, 1344, 1, 1024]
    - [54, 0.0]
  - - [832, 1344, 1, 1024]
    - [20, 0.0]
  - - [1088, 1344, 1, 1024]
    - [20, 0.0]
  - - [1344, 1344, 1, 1024]
    - [20, 0.0]
  - - [1600, 1344, 1, 1024]
    - [20, 0.0]
  - - [1856, 1344, 1, 1024]
    - [20, 0.0]
  - - [2112, 1344, 1, 1024]
    - [83, 0.0]
  - - [2368, 1344, 1, 1024]
    - [112, 0.0]
  - - [2624, 1344, 1, 1024]
    - [82, 0.0]
  - - [2880, 1344, 1, 1024]
    - [89, 0.0]
  - - [3136, 1344, 1, 1024]
    - [83, 0.0]
  - - [3392, 1344, 1, 1024]
    - [63, 0.0]
  - - [3648, 1344, 1, 1024]
    - [21, 0.0]
  - - [3904, 1344, 1, 1024]
    - [55, 0.0]
  - - [64, 1600, 1, 1024]
    - [35, 0.0]
  - - [320, 1600, 1, 1024]
    - [28, 0.0]
  - - [576, 1600, 1, 1024]
    - [20, 0.0]
  - - [832, 1600, 1, 1024]
    - [20, 0.0]
  - - [1088, 1600, 1, 1024]
    - [20, 0.0]
  - - [1344, 1600, 1, 1024]
    - [110, 0.0]
  - - [1600, 1600, 1, 1024]
    - [110, 0.0]
  - - [1856, 1600, 1, 1024]
    - [20, 0.0]
  - - [2112, 1600, 1, 1024]
    - [55, 0.0]
  - - [2368, 1600, 1, 1024]
    - [20, 0.0]
  - - [2624, 1600, 1, 1024]
    - [54, 0.0]
  - - [2880, 1600, 1, 1024]
    - [63, 0.0]
  - - [3136, 1600, 1, 1024]
    - [20, 0.0]
  - - [3392, 1600, 1, 1024]
    - [54, 0.0]
  - - [3648, 1600, 1, 1024]
    - [20, 0.0]
  - - [3904, 1600, 1, 1024]
    - [62, 0.0]
  - - [64, 1856, 1, 1024]
    - [28, 0.0]
  - - [320, 1856, 1, 1024]
    - [20, 0.0]
  - - [576, 1856, 1, 1024]
    - [20, 0.0]
  - - [832, 1856, 1, 1024]
    - [20, 0.0]
  - - [1088, 1856, 1, 1024]
    - [110, 0.0]
  - - [1344, 1856, 1, 1024]
    - [20, 0.0]
  - - [1600, 1856, 1, 1024]
    - [20, 0.0]
  - - [1856, 1856, 1, 1024]
    - [54, 0.0]
  - - [2112, 1856, 1, 1024]
    - [106, 0.0]
  - - [2368, 1856, 1, 1024]
    - [94, 0.0]
  - - [2624, 1856, 1, 1024]
    - [20, 0.0]
  - - [2880, 1856, 1, 1024]
    - [20, 0.0]
  - - [3136, 1856, 1, 1024]
    - [55, 0.0]
  - - [3392, 1856, 1, 1024]
    - [55, 0.0]
  - - [3648, 1856, 1, 1024]
    - [54, 0.0]
  - - [3904, 1856, 1, 1024]
    - [63, 0.0]
  - - [64, 2112, 1, 1024]
    - [28, 0.0]
  - - [320, 2112, 1, 1024]
    - [105, 0.0]
  - - [576, 2112, 1, 1024]
    - [62, 0.0]
  - - [832, 2112, 1, 1024]
    - [94, 0.0]
  - - [1088, 2112, 1, 1024]
    - [84, 0.0]
  - - [1344, 2112, 1, 1024]
    - [62, 0.0]
  - - [1600, 2112, 1, 1024]
    - [62, 0.0]
  - - [1856, 2112, 1, 1024]
    - [62, 0.0]
  - - [2112, 2112, 1, 1024]
    - [85, 0.0]
  - - [2368, 2112, 1, 1024]
    - [20, 0.0]
  - - [2624, 2112, 1, 1024]
    - [110, 0.0]
  - - [2880, 2112, 1, 1024]
    - [54, 0.0]
  - - [3136, 2112, 1, 1024]
    - [54, 0.0]
  - - [3392, 2112, 1, 1024]
    - [84, 0.0]
  - - [3648, 2112, 1, 1024]
    - [54, 0.0]
  - - [3904, 2112, 1, 1024]
    - [113, 0.0]
  - - [64, 2368, 1, 1024]
    - [28, 0.0]
  - - [320, 2368, 1, 1024]
    - [53, 0.0]
  - - [576, 2368, 1, 1024]
    - [89, 0.0]
  - - [832, 2368, 1, 1024]
    - [83, 0.0]
  - - [1088, 2368, 1, 1024]
    - [63, 0.0]
  - - [1344, 2368, 1, 1024]
    - [52, 0.0]
  - - [1600, 2368, 1, 1024]
    - [63, 0.0]
  - - [1856, 2368, 1, 1024]
    - [85, 0.0]
  - - [2112, 2368, 1, 1024]
    - [85, 0.0]
  - - [2368, 2368, 1, 1024]
    - [20, 0.0]
  - - [2624, 2368, 1, 1024]
    - [55, 0.0]
  - - [2880, 2368, 1, 1024]
    - [55, 0.0]
  - - [3136, 2368, 1, 1024]
    - [20, 0.0]
  - - [3392, 2368, 1, 1024]
    - [63, 0.0]
  - - [3648, 2368, 1, 1024]
    - [62, 0.0]
  - - [3904, 2368, 1, 1024]
    - [54, 0.0]
  - - [64, 2624, 1, 1024]
    - [28, 0.0]
  - - [320, 2624, 1, 1024]
    - [52, 0.0]
  - - [576, 2624, 1, 1024]
    - [54, 0.0]
  - - [832, 2624, 1, 1024]
    - [63, 0.0]
  - - [1088, 2624, 1, 1024]
    - [106, 0.0]
  - - [1344, 2624, 1, 1024]
    - [59, 0.0]
  - - [1600, 2624, 1, 1024]
    - [85, 0.0]
  - - [1856, 2624, 1, 1024]
    - [20, 0.0]
  - - [2112, 2624, 1, 1024]
    - [53, 0.0]
  - - [2368, 2624, 1, 1024]
    - [20, 0.0]
  - - [2624, 2624, 1, 1024]
    - [94, 0.0]
  - - [2880, 2624, 1, 1024]
    - [83, 0.0]
  - - [3136, 2624, 1, 1024]
    - [54, 0.0]
  - - [3392, 2624, 1, 1024]
    - [54, 0.0]
  - - [3648, 2624, 1, 1024]
    - [84, 0.0]
  - - [3904, 2624, 1, 1024]
    - [82, 0.0]
  - - [64, 2880, 1, 1024]
    - [77, 0.0]
  - - [320, 2880, 1, 1024]
    - [20, 0.0]
  - - [576, 2880, 1, 1024]
    - [63, 0.0]
  - - [832, 2880, 1, 1024]
    - [52, 0.0]
  - - [1088, 2880, 1, 1024]
    - [63, 0.0]
  - - [1344, 2880, 1, 1024]
    - [84, 0.0]
  - - [1600, 2880, 1, 1024]
    - [54, 0.0]
  - - [1856, 2880, 1, 1024]
    - [82, 0.0]
  - - [2112, 2880, 1, 1024]
    - [54, 0.0]
  - - [2368, 2880, 1, 1024]
    - [20, 0.0]
  - - [2624, 2880, 1, 1024]
    - [20, 0.0]
  - - [2880, 2880, 1, 1024]
    - [82, 0.0]
  - - [3136, 2880, 1, 1024]
    - [94, 0.0]
  - - [3392, 2880, 1, 1024]
    - [54, 0.0]
  - - [3648, 2880, 1, 1024]
    - [62, 0.0]
  - - [3904, 2880, 1, 1024]
    - [52, 0.0]
  - - [64, 3136, 1, 1024]
    - [99, 0.0]
  - - [320, 3136, 1, 1024]
    - [110, 0.0]
  - - [576, 3136, 1, 1024]
    - [52, 0.0]
  - - [832, 3136, 1, 1024]
    - [20, 0.0]
  - - [1088, 3136, 1, 1024]
    - [20, 0.0]
  - - [1344, 3136, 1, 1024]
    - [20, 0.0]
  - - [1600, 3136, 1, 1024]
    - [82, 0.0]
  - - [1856, 3136, 1, 1024]
    - [54, 0.0]
  - - [2112, 3136, 1, 1024]
    - [20, 0.0]
  - - [2368, 3136, 1, 1024]
    - [110, 0.0]
  - - [2624, 3136, 1, 1024]
    - [64, 0.0]
  - - [2880, 3136, 1, 1024]
    - [63, 0.0]
  - - [3136, 3136, 1, 1024]
    - [20, 0.0]
  - - [3392, 3136, 1, 1024]
    - [54, 0.0]
  - - [3648, 3136, 1, 1024]
    - [53, 0.0]
  - - [3904, 3136, 1, 1024]
    - [20, 0.0]
  - - [64, 3392, 1, 1024]
    - [114, 0.0]
  - - [320, 3392, 1, 1024]
    - [20, 0.0]
  - - [576, 3392, 1, 1024]
    - [53, 0.0]
  - - [832, 3392, 1, 1024]
    - [94, 0.0]
  - - [1088, 3392, 1, 1024]
    - [62, 0.0]
  - - [1344, 3392, 1, 1024]
    - [62, 0.0]
  - - [1600, 3392, 1, 1024]
    - [63, 0.0]
  - - [1856, 3392, 1, 1024]
    - [82, 0.0]
  - - [2112, 3392, 1, 1024]
    - [54, 0.0]
  - - [2368, 3392, 1, 1024]
    - [20, 0.0]
  - - [2624, 3392, 1, 1024]
    - [115, 0.0]
  - - [2880, 3392, 1, 1024]
    - [62, 0.0]
  - - [3136, 3392, 1, 1024]
    - [94, 0.0]
  - - [3392, 3392, 1, 1024]
    - [84, 0.0]
  - - [3648, 3392, 1, 1024]
    - [55, 0.0]
  - - [3904, 3392, 1, 1024]
    - [63, 0.0]
  - - [64, 3648, 1, 1024]
    - [25, 0.0]
  - - [320, 3648, 1, 1024]
    - [85, 0.0]
  - - [576, 3648, 1, 1024]
    - [63, 0.0]
  - - [832, 3648, 1, 1024]
    - [56, 0.0]
  - - [1088, 3648, 1, 1024]
    - [54, 0.0]
  - - [1344, 3648, 1, 1024]
    - [21, 0.0]
  - - [1600, 3648, 1, 1024]
    - [62, 0.0]
  - - [1856, 3648, 1, 1024]
    - [20, 0.0]
  - - [2112, 3648, 1, 1024]
    - [53, 0.0]
  - - [2368, 3648, 1, 1024]
    - [52, 0.0]
  - - [2624, 3648, 1, 1024]
    - [20, 0.0]
  - - [2880, 3648, 1, 1024]
    - [20, 0.0]
  - - [3136, 3648, 1, 1024]
    - [62, 0.0]
  - - [3392, 3648, 1, 1024]
    - [94, 0.0]
  - - [3648, 3648, 1, 1024]
    - [82, 0.0]
  - - [3904, 3648, 1, 1024]
    - [53, 0.0]
  - - [64, 3904, 1, 1024]
    - [69, 0.0]
  - - [320, 3904, 1, 1024]
    - [62, 0.0]
  - - [576, 3904, 1, 1024]
    - [20, 0.0]
  - - [832, 3904, 1, 1024]
    - [94, 0.0]
  - - [1088, 3904, 1, 1024]
    - [20, 0.0]
  - - [1344, 3904, 1, 1024]
    - [55, 0.0]
  - - [1600, 3904, 1, 1024]
    - [94, 0.0]
  - - [1856, 3904, 1, 1024]
    - [54, 0.0]
  - - [2112, 3904, 1, 1024]
    - [115, 0.0]
  - - [2368, 3904, 1, 1024]
    - [55, 0.0]
  - - [2624, 3904, 1, 1024]
    - [20, 0.0]
  - - [2880, 3904, 1, 1024]
    - [62, 0.0]
  - - [3136, 3904, 1, 1024]
    - [22, 0.0]
  - - [3392, 3904, 1, 1024]
    - [82, 0.0]
  - - [3648, 3904, 1, 1024]
    - [94, 0.0]
  - - [3904, 3904, 1, 1024]
    - [83, 0.0]
  - - [320, 64, 1, 2048]
    - [188, 0.0]
  - - [576, 64, 1, 2048]
    - [19, 0.0]
  - - [832, 64, 1, 2048]
    - [77, 0.0]
  - - [1088, 64, 1, 2048]
    - [27, 0.0]
  - - [1344, 64, 1, 2048]
    - [19, 0.0]
  - - [1600, 64, 1, 2048]
    - [19, 0.0]
  - - [1856, 64, 1, 2048]
    - [27, 0.0]
  - - [2112, 64, 1, 2048]
    - [69, 0.0]
  - - [2368, 64, 1, 2048]
    - [102, 0.0]
  - - [2624, 64, 1, 2048]
    - [28, 0.0]
  - - [2880, 64, 1, 2048]
    - [105, 0.0]
  - - [3136, 64, 1, 2048]
    - [25, 0.0]
  - - [3392, 64, 1, 2048]
    - [88, 0.0]
  - - [3648, 64, 1, 2048]
    - [77, 0.0]
  - - [3904, 64, 1, 2048]
    - [108, 0.0]
  - - [64, 320, 1, 2048]
    - [182, 0.0]
  - - [320, 320, 1, 2048]
    - [27, 0.0]
  - - [576, 320, 1, 2048]
    - [28, 0.0]
  - - [832, 320, 1, 2048]
    - [117, 0.0]
  - - [1088, 320, 1, 2048]
    - [117, 0.0]
  - - [1344, 320, 1, 2048]
    - [77, 0.0]
  - - [1600, 320, 1, 2048]
    - [20, 0.0]
  - - [1856, 320, 1, 2048]
    - [20, 0.0]
  - - [2112, 320, 1, 2048]
    - [119, 0.0]
  - - [2368, 320, 1, 2048]
    - [110, 0.0]
  - - [2624, 320, 1, 2048]
    - [22, 0.0]
  - - [2880, 320, 1, 2048]
    - [110, 0.0]
  - - [3136, 320, 1, 2048]
    - [63, 0.0]
  - - [3392, 320, 1, 2048]
    - [20, 0.0]
  - - [3648, 320, 1, 2048]
    - [20, 0.0]
  - - [3904, 320, 1, 2048]
    - [20, 0.0]
  - - [64, 576, 1, 2048]
    - [27, 0.0]
  - - [320, 576, 1, 2048]
    - [88, 0.0]
  - - [576, 576, 1, 2048]
    - [117, 0.0]
  - - [832, 576, 1, 2048]
    - [20, 0.0]
  - - [1088, 576, 1, 2048]
    - [20, 0.0]
  - - [1344, 576, 1, 2048]
    - [23, 0.0]
  - - [1600, 576, 1, 2048]
    - [20, 0.0]
  - - [1856, 576, 1, 2048]
    - [20, 0.0]
  - - [2112, 576, 1, 2048]
    - [20, 0.0]
  - - [2368, 576, 1, 2048]
    - [20, 0.0]
  - - [2624, 576, 1, 2048]
    - [20, 0.0]
  - - [2880, 576, 1, 2048]
    - [20, 0.0]
  - - [3136, 576, 1, 2048]
    - [20, 0.0]
  - - [3392, 576, 1, 2048]
    - [20, 0.0]
  - - [3648, 576, 1, 2048]
    - [63, 0.0]
  - - [3904, 576, 1, 2048]
    - [55, 0.0]
  - - [64, 832, 1, 2048]
    - [28, 0.0]
  - - [320, 832, 1, 2048]
    - [117, 0.0]
  - - [576, 832, 1, 2048]
    - [20, 0.0]
  - - [832, 832, 1, 2048]
    - [23, 0.0]
  - - [1088, 832, 1, 2048]
    - [23, 0.0]
  - - [1344, 832, 1, 2048]
    - [20, 0.0]
  - - [1600, 832, 1, 2048]
    - [23, 0.0]
  - - [1856, 832, 1, 2048]
    - [110, 0.0]
  - - [2112, 832, 1, 2048]
    - [55, 0.0]
  - - [2368, 832, 1, 2048]
    - [62, 0.0]
  - - [2624, 832, 1, 2048]
    - [63, 0.0]
  - - [2880, 832, 1, 2048]
    - [20, 0.0]
  - - [3136, 832, 1, 2048]
    - [20, 0.0]
  - - [3392, 832, 1, 2048]
    - [63, 0.0]
  - - [3648, 832, 1, 2048]
    - [20, 0.0]
  - - [3904, 832, 1, 2048]
    - [62, 0.0]
  - - [64, 1088, 1, 2048]
    - [27, 0.0]
  - - [320, 1088, 1, 2048]
    - [117, 0.0]
  - - [576, 1088, 1, 2048]
    - [20, 0.0]
  - - [832, 1088, 1, 2048]
    - [23, 0.0]
  - - [1088, 1088, 1, 2048]
    - [23, 0.0]
  - - [1344, 1088, 1, 2048]
    - [54, 0.0]
  - - [1600, 1088, 1, 2048]
    - [20, 0.0]
  - - [1856, 1088, 1, 2048]
    - [20, 0.0]
  - - [2112, 1088, 1, 2048]
    - [20, 0.0]
  - - [2368, 1088, 1, 2048]
    - [84, 0.0]
  - - [2624, 1088, 1, 2048]
    - [62, 0.0]
  - - [2880, 1088, 1, 2048]
    - [84, 0.0]
  - - [3136, 1088, 1, 2048]
    - [22, 0.0]
  - - [3392, 1088, 1, 2048]
    - [62, 0.0]
  - - [3648, 1088, 1, 2048]
    - [55, 0.0]
  - - [3904, 1088, 1, 2048]
    - [20, 0.0]
  - - [64, 1344, 1, 2048]
    - [27, 0.0]
  - - [320, 1344, 1, 2048]
    - [104, 0.0]
  - - [576, 1344, 1, 2048]
    - [23, 0.0]
  - - [832, 1344, 1, 2048]
    - [20, 0.0]
  - - [1088, 1344, 1, 2048]
    - [20, 0.0]
  - - [1344, 1344, 1, 2048]
    - [110, 0.0]
  - - [1600, 1344, 1, 2048]
    - [20, 0.0]
  - - [1856, 1344, 1, 2048]
    - [20, 0.0]
  - - [2112, 1344, 1, 2048]
    - [62, 0.0]
  - - [2368, 1344, 1, 2048]
    - [83, 0.0]
  - - [2624, 1344, 1, 2048]
    - [56, 0.0]
  - - [2880, 1344, 1, 2048]
    - [54, 0.0]
  - - [3136, 1344, 1, 2048]
    - [54, 0.0]
  - - [3392, 1344, 1, 2048]
    - [54, 0.0]
  - - [3648, 1344, 1, 2048]
    - [82, 0.0]
  - - [3904, 1344, 1, 2048]
    - [83, 0.0]
  - - [64, 1600, 1, 2048]
    - [19, 0.0]
  - - [320, 1600, 1, 2048]
    - [20, 0.0]
  - - [576, 1600, 1, 2048]
    - [20, 0.0]
  - - [832, 1600, 1, 2048]
    - [20, 0.0]
  - - [1088, 1600, 1, 2048]
    - [20, 0.0]
  - - [1344, 1600, 1, 2048]
    - [110, 0.0]
  - - [1600, 1600, 1, 2048]
    - [20, 0.0]
  - - [1856, 1600, 1, 2048]
    - [110, 0.0]
  - - [2112, 1600, 1, 2048]
    - [63, 0.0]
  - - [2368, 1600, 1, 2048]
    - [20, 0.0]
  - - [2624, 1600, 1, 2048]
    - [20, 0.0]
  - - [2880, 1600, 1, 2048]
    - [20, 0.0]
  - - [3136, 1600, 1, 2048]
    - [64, 0.0]
  - - [3392, 1600, 1, 2048]
    - [55, 0.0]
  - - [3648, 1600, 1, 2048]
    - [52, 0.0]
  - - [3904, 1600, 1, 2048]
    - [121, 0.0]
  - - [64, 1856, 1, 2048]
    - [19, 0.0]
  - - [320, 1856, 1, 2048]
    - [20, 0.0]
  - - [576, 1856, 1, 2048]
    - [20, 0.0]
  - - [832, 1856, 1, 2048]
    - [110, 0.0]
  - - [1088, 1856, 1, 2048]
    - [20, 0.0]
  - - [1344, 1856, 1, 2048]
    - [20, 0.0]
  - - [1600, 1856, 1, 2048]
    - [20, 0.0]
  - - [1856, 1856, 1, 2048]
    - [54, 0.0]
  - - [2112, 1856, 1, 2048]
    - [94, 0.0]
  - - [2368, 1856, 1, 2048]
    - [94, 0.0]
  - - [2624, 1856, 1, 2048]
    - [84, 0.0]
  - - [2880, 1856, 1, 2048]
    - [121, 0.0]
  - - [3136, 1856, 1, 2048]
    - [85, 0.0]
  - - [3392, 1856, 1, 2048]
    - [20, 0.0]
  - - [3648, 1856, 1, 2048]
    - [82, 0.0]
  - - [3904, 1856, 1, 2048]
    - [53, 0.0]
  - - [64, 2112, 1, 2048]
    - [34, 0.0]
  - - [320, 2112, 1, 2048]
    - [23, 0.0]
  - - [576, 2112, 1, 2048]
    - [122, 0.0]
  - - [832, 2112, 1, 2048]
    - [55, 0.0]
  - - [1088, 2112, 1, 2048]
    - [20, 0.0]
  - - [1344, 2112, 1, 2048]
    - [20, 0.0]
  - - [1600, 2112, 1, 2048]
    - [62, 0.0]
  - - [1856, 2112, 1, 2048]
    - [54, 0.0]
  - - [2112, 2112, 1, 2048]
    - [63, 0.0]
  - - [2368, 2112, 1, 2048]
    - [20, 0.0]
  - - [2624, 2112, 1, 2048]
    - [54, 0.0]
  - - [2880, 2112, 1, 2048]
    - [62, 0.0]
  - - [3136, 2112, 1, 2048]
    - [53, 0.0]
  - - [3392, 2112, 1, 2048]
    - [123, 0.0]
  - - [3648, 2112, 1, 2048]
    - [55, 0.0]
  - - [3904, 2112, 1, 2048]
    - [84, 0.0]
  - - [64, 2368, 1, 2048]
    - [37, 0.0]
  - - [320, 2368, 1, 2048]
    - [124, 0.0]
  - - [576, 2368, 1, 2048]
    - [85, 0.0]
  - - [832, 2368, 1, 2048]
    - [62, 0.0]
  - - [1088, 2368, 1, 2048]
    - [54, 0.0]
  - - [1344, 2368, 1, 2048]
    - [20, 0.0]
  - - [1600, 2368, 1, 2048]
    - [62, 0.0]
  - - [1856, 2368, 1, 2048]
    - [20, 0.0]
  - - [2112, 2368, 1, 2048]
    - [82, 0.0]
  - - [2368, 2368, 1, 2048]
    - [20, 0.0]
  - - [2624, 2368, 1, 2048]
    - [20, 0.0]
  - - [2880, 2368, 1, 2048]
    - [106, 0.0]
  - - [3136, 2368, 1, 2048]
    - [82, 0.0]
  - - [3392, 2368, 1, 2048]
    - [84, 0.0]
  - - [3648, 2368, 1, 2048]
    - [82, 0.0]
  - - [3904, 2368, 1, 2048]
    - [54, 0.0]
  - - [64, 2624, 1, 2048]
    - [99, 0.0]
  - - [320, 2624, 1, 2048]
    - [123, 0.0]
  - - [576, 2624, 1, 2048]
    - [84, 0.0]
  - - [832, 2624, 1, 2048]
    - [20, 0.0]
  - - [1088, 2624, 1, 2048]
    - [63, 0.0]
  - - [1344, 2624, 1, 2048]
    - [82, 0.0]
  - - [1600, 2624, 1, 2048]
    - [52, 0.0]
  - - [1856, 2624, 1, 2048]
    - [54, 0.0]
  - - [2112, 2624, 1, 2048]
    - [106, 0.0]
  - - [2368, 2624, 1, 2048]
    - [84, 0.0]
  - - [2624, 2624, 1, 2048]
    - [125, 0.0]
  - - [2880, 2624, 1, 2048]
    - [20, 0.0]
  - - [3136, 2624, 1, 2048]
    - [20, 0.0]
  - - [3392, 2624, 1, 2048]
    - [106, 0.0]
  - - [3648, 2624, 1, 2048]
    - [54, 0.0]
  - - [3904, 2624, 1, 2048]
    - [55, 0.0]
  - - [64, 2880, 1, 2048]
    - [28, 0.0]
  - - [320, 2880, 1, 2048]
    - [20, 0.0]
  - - [576, 2880, 1, 2048]
    - [20, 0.0]
  - - [832, 2880, 1, 2048]
    - [20, 0.0]
  - - [1088, 2880, 1, 2048]
    - [55, 0.0]
  - - [1344, 2880, 1, 2048]
    - [82, 0.0]
  - - [1600, 2880, 1, 2048]
    - [22, 0.0]
  - - [1856, 2880, 1, 2048]
    - [82, 0.0]
  - - [2112, 2880, 1, 2048]
    - [82, 0.0]
  - - [2368, 2880, 1, 2048]
    - [20, 0.0]
  - - [2624, 2880, 1, 2048]
    - [63, 0.0]
  - - [2880, 2880, 1, 2048]
    - [110, 0.0]
  - - [3136, 2880, 1, 2048]
    - [94, 0.0]
  - - [3392, 2880, 1, 2048]
    - [62, 0.0]
  - - [3648, 2880, 1, 2048]
    - [94, 0.0]
  - - [3904, 2880, 1, 2048]
    - [55, 0.0]
  - - [64, 3136, 1, 2048]
    - [37, 0.0]
  - - [320, 3136, 1, 2048]
    - [63, 0.0]
  - - [576, 3136, 1, 2048]
    - [22, 0.0]
  - - [832, 3136, 1, 2048]
    - [110, 0.0]
  - - [1088, 3136, 1, 2048]
    - [20, 0.0]
  - - [1344, 3136, 1, 2048]
    - [20, 0.0]
  - - [1600, 3136, 1, 2048]
    - [62, 0.0]
  - - [1856, 3136, 1, 2048]
    - [85, 0.0]
  - - [2112, 3136, 1, 2048]
    - [123, 0.0]
  - - [2368, 3136, 1, 2048]
    - [55, 0.0]
  - - [2624, 3136, 1, 2048]
    - [63, 0.0]
  - - [2880, 3136, 1, 2048]
    - [62, 0.0]
  - - [3136, 3136, 1, 2048]
    - [63, 0.0]
  - - [3392, 3136, 1, 2048]
    - [85, 0.0]
  - - [3648, 3136, 1, 2048]
    - [126, 0.0]
  - - [3904, 3136, 1, 2048]
    - [83, 0.0]
  - - [64, 3392, 1, 2048]
    - [74, 0.0]
  - - [320, 3392, 1, 2048]
    - [63, 0.0]
  - - [576, 3392, 1, 2048]
    - [127, 0.0]
  - - [832, 3392, 1, 2048]
    - [54, 0.0]
  - - [1088, 3392, 1, 2048]
    - [82, 0.0]
  - - [1344, 3392, 1, 2048]
    - [63, 0.0]
  - - [1600, 3392, 1, 2048]
    - [54, 0.0]
  - - [1856, 3392, 1, 2048]
    - [113, 0.0]
  - - [2112, 3392, 1, 2048]
    - [20, 0.0]
  - - [2368, 3392, 1, 2048]
    - [20, 0.0]
  - - [2624, 3392, 1, 2048]
    - [20, 0.0]
  - - [2880, 3392, 1, 2048]
    - [125, 0.0]
  - - [3136, 3392, 1, 2048]
    - [20, 0.0]
  - - [3392, 3392, 1, 2048]
    - [128, 0.0]
  - - [3648, 3392, 1, 2048]
    - [121, 0.0]
  - - [3904, 3392, 1, 2048]
    - [113, 0.0]
  - - [64, 3648, 1, 2048]
    - [27, 0.0]
  - - [320, 3648, 1, 2048]
    - [23, 0.0]
  - - [576, 3648, 1, 2048]
    - [62, 0.0]
  - - [832, 3648, 1, 2048]
    - [20, 0.0]
  - - [1088, 3648, 1, 2048]
    - [83, 0.0]
  - - [1344, 3648, 1, 2048]
    - [55, 0.0]
  - - [1600, 3648, 1, 2048]
    - [20, 0.0]
  - - [1856, 3648, 1, 2048]
    - [54, 0.0]
  - - [2112, 3648, 1, 2048]
    - [82, 0.0]
  - - [2368, 3648, 1, 2048]
    - [52, 0.0]
  - - [2624, 3648, 1, 2048]
    - [106, 0.0]
  - - [2880, 3648, 1, 2048]
    - [113, 0.0]
  - - [3136, 3648, 1, 2048]
    - [54, 0.0]
  - - [3392, 3648, 1, 2048]
    - [94, 0.0]
  - - [3648, 3648, 1, 2048]
    - [94, 0.0]
  - - [3904, 3648, 1, 2048]
    - [82, 0.0]
  - - [64, 3904, 1, 2048]
    - [72, 0.0]
  - - [320, 3904, 1, 2048]
    - [90, 0.0]
  - - [576, 3904, 1, 2048]
    - [62, 0.0]
  - - [832, 3904, 1, 2048]
    - [83, 0.0]
  - - [1088, 3904, 1, 2048]
    - [55, 0.0]
  - - [1344, 3904, 1, 2048]
    - [54, 0.0]
  - - [1600, 3904, 1, 2048]
    - [63, 0.0]
  - - [1856, 3904, 1, 2048]
    - [22, 0.0]
  - - [2112, 3904, 1, 2048]
    - [54, 0.0]
  - - [2368, 3904, 1, 2048]
    - [111, 0.0]
  - - [2624, 3904, 1, 2048]
    - [52, 0.0]
  - - [2880, 3904, 1, 2048]
    - [84, 0.0]
  - - [3136, 3904, 1, 2048]
    - [63, 0.0]
  - - [3392, 3904, 1, 2048]
    - [52, 0.0]
  - - [3648, 3904, 1, 2048]
    - [83, 0.0]
  - - [3904, 3904, 1, 2048]
    - [125, 0.0]
  - - [320, 64, 1, 4096]
    - [150, 0.0]
  - - [576, 64, 1, 4096]
    - [88, 0.0]
  - - [832, 64, 1, 4096]
    - [19, 0.0]
  - - [1088, 64, 1, 4096]
    - [27, 0.0]
  - - [1344, 64, 1, 4096]
    - [19, 0.0]
  - - [1600, 64, 1, 4096]
    - [27, 0.0]
  - - [1856, 64, 1, 4096]
    - [27, 0.0]
  - - [2112, 64, 1, 4096]
    - [100, 0.0]
  - - [2368, 64, 1, 4096]
    - [27, 0.0]
  - - [2624, 64, 1, 4096]
    - [69, 0.0]
  - - [2880, 64, 1, 4096]
    - [88, 0.0]
  - - [3136, 64, 1, 4096]
    - [34, 0.0]
  - - [3392, 64, 1, 4096]
    - [108, 0.0]
  - - [3648, 64, 1, 4096]
    - [27, 0.0]
  - - [3904, 64, 1, 4096]
    - [100, 0.0]
  - - [64, 320, 1, 4096]
    - [19, 0.0]
  - - [320, 320, 1, 4096]
    - [19, 0.0]
  - - [576, 320, 1, 4096]
    - [28, 0.0]
  - - [832, 320, 1, 4096]
    - [117, 0.0]
  - - [1088, 320, 1, 4096]
    - [117, 0.0]
  - - [1344, 320, 1, 4096]
    - [77, 0.0]
  - - [1600, 320, 1, 4096]
    - [20, 0.0]
  - - [1856, 320, 1, 4096]
    - [20, 0.0]
  - - [2112, 320, 1, 4096]
    - [23, 0.0]
  - - [2368, 320, 1, 4096]
    - [117, 0.0]
  - - [2624, 320, 1, 4096]
    - [130, 0.0]
  - - [2880, 320, 1, 4096]
    - [20, 0.0]
  - - [3136, 320, 1, 4096]
    - [20, 0.0]
  - - [3392, 320, 1, 4096]
    - [23, 0.0]
  - - [3648, 320, 1, 4096]
    - [117, 0.0]
  - - [3904, 320, 1, 4096]
    - [84, 0.0]
  - - [64, 576, 1, 4096]
    - [19, 0.0]
  - - [320, 576, 1, 4096]
    - [28, 0.0]
  - - [576, 576, 1, 4096]
    - [117, 0.0]
  - - [832, 576, 1, 4096]
    - [20, 0.0]
  - - [1088, 576, 1, 4096]
    - [110, 0.0]
  - - [1344, 576, 1, 4096]
    - [23, 0.0]
  - - [1600, 576, 1, 4096]
    - [110, 0.0]
  - - [1856, 576, 1, 4096]
    - [20, 0.0]
  - - [2112, 576, 1, 4096]
    - [21, 0.0]
  - - [2368, 576, 1, 4096]
    - [54, 0.0]
  - - [2624, 576, 1, 4096]
    - [62, 0.0]
  - - [2880, 576, 1, 4096]
    - [62, 0.0]
  - - [3136, 576, 1, 4096]
    - [63, 0.0]
  - - [3392, 576, 1, 4096]
    - [84, 0.0]
  - - [3648, 576, 1, 4096]
    - [20, 0.0]
  - - [3904, 576, 1, 4096]
    - [63, 0.0]
  - - [64, 832, 1, 4096]
    - [28, 0.0]
  - - [320, 832, 1, 4096]
    - [117, 0.0]
  - - [576, 832, 1, 4096]
    - [110, 0.0]
  - - [832, 832, 1, 4096]
    - [23, 0.0]
  - - [1088, 832, 1, 4096]
    - [23, 0.0]
  - - [1344, 832, 1, 4096]
    - [20, 0.0]
  - - [1600, 832, 1, 4096]
    - [23, 0.0]
  - - [1856, 832, 1, 4096]
    - [110, 0.0]
  - - [2112, 832, 1, 4096]
    - [20, 0.0]
  - - [2368, 832, 1, 4096]
    - [63, 0.0]
  - - [2624, 832, 1, 4096]
    - [22, 0.0]
  - - [2880, 832, 1, 4096]
    - [63, 0.0]
  - - [3136, 832, 1, 4096]
    - [54, 0.0]
  - - [3392, 832, 1, 4096]
    - [94, 0.0]
  - - [3648, 832, 1, 4096]
    - [54, 0.0]
  - - [3904, 832, 1, 4096]
    - [21, 0.0]
  - - [64, 1088, 1, 4096]
    - [19, 0.0]
  - - [320, 1088, 1, 4096]
    - [117, 0.0]
  - - [576, 1088, 1, 4096]
    - [110, 0.0]
  - - [832, 1088, 1, 4096]
    - [117, 0.0]
  - - [1088, 1088, 1, 4096]
    - [23, 0.0]
  - - [1344, 1088, 1, 4096]
    - [110, 0.0]
  - - [1600, 1088, 1, 4096]
    - [23, 0.0]
  - - [1856, 1088, 1, 4096]
    - [110, 0.0]
  - - [2112, 1088, 1, 4096]
    - [55, 0.0]
  - - [2368, 1088, 1, 4096]
    - [110, 0.0]
  - - [2624, 1088, 1, 4096]
    - [110, 0.0]
  - - [2880, 1088, 1, 4096]
    - [20, 0.0]
  - - [3136, 1088, 1, 4096]
    - [20, 0.0]
  - - [3392, 1088, 1, 4096]
    - [121, 0.0]
  - - [3648, 1088, 1, 4096]
    - [83, 0.0]
  - - [3904, 1088, 1, 4096]
    - [20, 0.0]
  - - [64, 1344, 1, 4096]
    - [19, 0.0]
  - - [320, 1344, 1, 4096]
    - [71, 0.0]
  - - [576, 1344, 1, 4096]
    - [23, 0.0]
  - - [832, 1344, 1, 4096]
    - [20, 0.0]
  - - [1088, 1344, 1, 4096]
    - [20, 0.0]
  - - [1344, 1344, 1, 4096]
    - [120, 0.0]
  - - [1600, 1344, 1, 4096]
    - [110, 0.0]
  - - [1856, 1344, 1, 4096]
    - [110, 0.0]
  - - [2112, 1344, 1, 4096]
    - [20, 0.0]
  - - [2368, 1344, 1, 4096]
    - [20, 0.0]
  - - [2624, 1344, 1, 4096]
    - [82, 0.0]
  - - [2880, 1344, 1, 4096]
    - [83, 0.0]
  - - [3136, 1344, 1, 4096]
    - [20, 0.0]
  - - [3392, 1344, 1, 4096]
    - [54, 0.0]
  - - [3648, 1344, 1, 4096]
    - [54, 0.0]
  - - [3904, 1344, 1, 4096]
    - [20, 0.0]
  - - [64, 1600, 1, 4096]
    - [19, 0.0]
  - - [320, 1600, 1, 4096]
    - [20, 0.0]
  - - [576, 1600, 1, 4096]
    - [110, 0.0]
  - - [832, 1600, 1, 4096]
    - [117, 0.0]
  - - [1088, 1600, 1, 4096]
    - [23, 0.0]
  - - [1344, 1600, 1, 4096]
    - [20, 0.0]
  - - [1600, 1600, 1, 4096]
    - [20, 0.0]
  - - [1856, 1600, 1, 4096]
    - [110, 0.0]
  - - [2112, 1600, 1, 4096]
    - [94, 0.0]
  - - [2368, 1600, 1, 4096]
    - [20, 0.0]
  - - [2624, 1600, 1, 4096]
    - [23, 0.0]
  - - [2880, 1600, 1, 4096]
    - [52, 0.0]
  - - [3136, 1600, 1, 4096]
    - [63, 0.0]
  - - [3392, 1600, 1, 4096]
    - [131, 0.0]
  - - [3648, 1600, 1, 4096]
    - [55, 0.0]
  - - [3904, 1600, 1, 4096]
    - [131, 0.0]
  - - [64, 1856, 1, 4096]
    - [27, 0.0]
  - - [320, 1856, 1, 4096]
    - [20, 0.0]
  - - [576, 1856, 1, 4096]
    - [20, 0.0]
  - - [832, 1856, 1, 4096]
    - [20, 0.0]
  - - [1088, 1856, 1, 4096]
    - [20, 0.0]
  - - [1344, 1856, 1, 4096]
    - [110, 0.0]
  - - [1600, 1856, 1, 4096]
    - [20, 0.0]
  - - [1856, 1856, 1, 4096]
    - [54, 0.0]
  - - [2112, 1856, 1, 4096]
    - [63, 0.0]
  - - [2368, 1856, 1, 4096]
    - [55, 0.0]
  - - [2624, 1856, 1, 4096]
    - [110, 0.0]
  - - [2880, 1856, 1, 4096]
    - [53, 0.0]
  - - [3136, 1856, 1, 4096]
    - [110, 0.0]
  - - [3392, 1856, 1, 4096]
    - [23, 0.0]
  - - [3648, 1856, 1, 4096]
    - [22, 0.0]
  - - [3904, 1856, 1, 4096]
    - [110, 0.0]
  - - [64, 2112, 1, 4096]
    - [27, 0.0]
  - - [320, 2112, 1, 4096]
    - [128, 0.0]
  - - [576, 2112, 1, 4096]
    - [110, 0.0]
  - - [832, 2112, 1, 4096]
    - [115, 0.0]
  - - [1088, 2112, 1, 4096]
    - [63, 0.0]
  - - [1344, 2112, 1, 4096]
    - [54, 0.0]
  - - [1600, 2112, 1, 4096]
    - [54, 0.0]
  - - [1856, 2112, 1, 4096]
    - [110, 0.0]
  - - [2112, 2112, 1, 4096]
    - [55, 0.0]
  - - [2368, 2112, 1, 4096]
    - [20, 0.0]
  - - [2624, 2112, 1, 4096]
    - [54, 0.0]
  - - [2880, 2112, 1, 4096]
    - [23, 0.0]
  - - [3136, 2112, 1, 4096]
    - [121, 0.0]
  - - [3392, 2112, 1, 4096]
    - [110, 0.0]
  - - [3648, 2112, 1, 4096]
    - [62, 0.0]
  - - [3904, 2112, 1, 4096]
    - [22, 0.0]
  - - [64, 2368, 1, 4096]
    - [77, 0.0]
  - - [320, 2368, 1, 4096]
    - [131, 0.0]
  - - [576, 2368, 1, 4096]
    - [22, 0.0]
  - - [832, 2368, 1, 4096]
    - [20, 0.0]
  - - [1088, 2368, 1, 4096]
    - [63, 0.0]
  - - [1344, 2368, 1, 4096]
    - [62, 0.0]
  - - [1600, 2368, 1, 4096]
    - [111, 0.0]
  - - [1856, 2368, 1, 4096]
    - [54, 0.0]
  - - [2112, 2368, 1, 4096]
    - [132, 0.0]
  - - [2368, 2368, 1, 4096]
    - [54, 0.0]
  - - [2624, 2368, 1, 4096]
    - [110, 0.0]
  - - [2880, 2368, 1, 4096]
    - [63, 0.0]
  - - [3136, 2368, 1, 4096]
    - [110, 0.0]
  - - [3392, 2368, 1, 4096]
    - [62, 0.0]
  - - [3648, 2368, 1, 4096]
    - [62, 0.0]
  - - [3904, 2368, 1, 4096]
    - [110, 0.0]
  - - [64, 2624, 1, 4096]
    - [34, 0.0]
  - - [320, 2624, 1, 4096]
    - [94, 0.0]
  - - [576, 2624, 1, 4096]
    - [63, 0.0]
  - - [832, 2624, 1, 4096]
    - [20, 0.0]
  - - [1088, 2624, 1, 4096]
    - [113, 0.0]
  - - [1344, 2624, 1, 4096]
    - [82, 0.0]
  - - [1600, 2624, 1, 4096]
    - [94, 0.0]
  - - [1856, 2624, 1, 4096]
    - [63, 0.0]
  - - [2112, 2624, 1, 4096]
    - [89, 0.0]
  - - [2368, 2624, 1, 4096]
    - [62, 0.0]
  - - [2624, 2624, 1, 4096]
    - [21, 0.0]
  - - [2880, 2624, 1, 4096]
    - [22, 0.0]
  - - [3136, 2624, 1, 4096]
    - [62, 0.0]
  - - [3392, 2624, 1, 4096]
    - [110, 0.0]
  - - [3648, 2624, 1, 4096]
    - [110, 0.0]
  - - [3904, 2624, 1, 4096]
    - [20, 0.0]
  - - [64, 2880, 1, 4096]
    - [108, 0.0]
  - - [320, 2880, 1, 4096]
    - [20, 0.0]
  - - [576, 2880, 1, 4096]
    - [21, 0.0]
  - - [832, 2880, 1, 4096]
    - [62, 0.0]
  - - [1088, 2880, 1, 4096]
    - [110, 0.0]
  - - [1344, 2880, 1, 4096]
    - [113, 0.0]
  - - [1600, 2880, 1, 4096]
    - [126, 0.0]
  - - [1856, 2880, 1, 4096]
    - [82, 0.0]
  - - [2112, 2880, 1, 4096]
    - [133, 0.0]
  - - [2368, 2880, 1, 4096]
    - [22, 0.0]
  - - [2624, 2880, 1, 4096]
    - [62, 0.0]
  - - [2880, 2880, 1, 4096]
    - [62, 0.0]
  - - [3136, 2880, 1, 4096]
    - [110, 0.0]
  - - [3392, 2880, 1, 4096]
    - [20, 0.0]
  - - [3648, 2880, 1, 4096]
    - [63, 0.0]
  - - [3904, 2880, 1, 4096]
    - [20, 0.0]
  - - [64, 3136, 1, 4096]
    - [105, 0.0]
  - - [320, 3136, 1, 4096]
    - [62, 0.0]
  - - [576, 3136, 1, 4096]
    - [111, 0.0]
  - - [832, 3136, 1, 4096]
    - [53, 0.0]
  - - [1088, 3136, 1, 4096]
    - [82, 0.0]
  - - [1344, 3136, 1, 4096]
    - [56, 0.0]
  - - [1600, 3136, 1, 4096]
    - [110, 0.0]
  - - [1856, 3136, 1, 4096]
    - [134, 0.0]
  - - [2112, 3136, 1, 4096]
    - [110, 0.0]
  - - [2368, 3136, 1, 4096]
    - [20, 0.0]
  - - [2624, 3136, 1, 4096]
    - [121, 0.0]
  - - [2880, 3136, 1, 4096]
    - [62, 0.0]
  - - [3136, 3136, 1, 4096]
    - [21, 0.0]
  - - [3392, 3136, 1, 4096]
    - [21, 0.0]
  - - [3648, 3136, 1, 4096]
    - [22, 0.0]
  - - [3904, 3136, 1, 4096]
    - [115, 0.0]
  - - [64, 3392, 1, 4096]
    - [19, 0.0]
  - - [320, 3392, 1, 4096]
    - [23, 0.0]
  - - [576, 3392, 1, 4096]
    - [84, 0.0]
  - - [832, 3392, 1, 4096]
    - [22, 0.0]
  - - [1088, 3392, 1, 4096]
    - [110, 0.0]
  - - [1344, 3392, 1, 4096]
    - [106, 0.0]
  - - [1600, 3392, 1, 4096]
    - [129, 0.0]
  - - [1856, 3392, 1, 4096]
    - [121, 0.0]
  - - [2112, 3392, 1, 4096]
    - [122, 0.0]
  - - [2368, 3392, 1, 4096]
    - [22, 0.0]
  - - [2624, 3392, 1, 4096]
    - [63, 0.0]
  - - [2880, 3392, 1, 4096]
    - [20, 0.0]
  - - [3136, 3392, 1, 4096]
    - [62, 0.0]
  - - [3392, 3392, 1, 4096]
    - [22, 0.0]
  - - [3648, 3392, 1, 4096]
    - [63, 0.0]
  - - [3904, 3392, 1, 4096]
    - [110, 0.0]
  - - [64, 3648, 1, 4096]
    - [77, 0.0]
  - - [320, 3648, 1, 4096]
    - [110, 0.0]
  - - [576, 3648, 1, 4096]
    - [22, 0.0]
  - - [832, 3648, 1, 4096]
    - [21, 0.0]
  - - [1088, 3648, 1, 4096]
    - [83, 0.0]
  - - [1344, 3648, 1, 4096]
    - [94, 0.0]
  - - [1600, 3648, 1, 4096]
    - [118, 0.0]
  - - [1856, 3648, 1, 4096]
    - [63, 0.0]
  - - [2112, 3648, 1, 4096]
    - [21, 0.0]
  - - [2368, 3648, 1, 4096]
    - [110, 0.0]
  - - [2624, 3648, 1, 4096]
    - [62, 0.0]
  - - [2880, 3648, 1, 4096]
    - [20, 0.0]
  - - [3136, 3648, 1, 4096]
    - [20, 0.0]
  - - [3392, 3648, 1, 4096]
    - [21, 0.0]
  - - [3648, 3648, 1, 4096]
    - [20, 0.0]
  - - [3904, 3648, 1, 4096]
    - [62, 0.0]
  - - [64, 3904, 1, 4096]
    - [34, 0.0]
  - - [320, 3904, 1, 4096]
    - [52, 0.0]
  - - [576, 3904, 1, 4096]
    - [20, 0.0]
  - - [832, 3904, 1, 4096]
    - [22, 0.0]
  - - [1088, 3904, 1, 4096]
    - [20, 0.0]
  - - [1344, 3904, 1, 4096]
    - [126, 0.0]
  - - [1600, 3904, 1, 4096]
    - [110, 0.0]
  - - [1856, 3904, 1, 4096]
    - [63, 0.0]
  - - [2112, 3904, 1, 4096]
    - [115, 0.0]
  - - [2368, 3904, 1, 4096]
    - [63, 0.0]
  - - [2624, 3904, 1, 4096]
    - [62, 0.0]
  - - [2880, 3904, 1, 4096]
    - [20, 0.0]
  - - [3136, 3904, 1, 4096]
    - [110, 0.0]
  - - [3392, 3904, 1, 4096]
    - [20, 0.0]
  - - [3648, 3904, 1, 4096]
    - [22, 0.0]
  - - [3904, 3904, 1, 4096]
    - [63, 0.0]
  - - [192, 64, 1, 64]
    - [149, 0.0]
  - - [448, 64, 1, 64]
    - [27, 0.0]
  - - [704, 64, 1, 64]
    - [27, 0.0]
  - - [960, 64, 1, 64]
    - [27, 0.0]
  - - [1216, 64, 1, 64]
    - [80, 0.0]
  - - [1472, 64, 1, 64]
    - [103, 0.0]
  - - [1728, 64, 1, 64]
    - [73, 0.0]
  - - [1984, 64, 1, 64]
    - [78, 0.0]
  - - [64, 192, 1, 64]
    - [159, 0.0]
  - - [192, 192, 1, 64]
    - [103, 0.0]
  - - [320, 192, 1, 64]
    - [19, 0.0]
  - - [448, 192, 1, 64]
    - [48, 0.0]
  - - [576, 192, 1, 64]
    - [137, 0.0]
  - - [704, 192, 1, 64]
    - [73, 0.0]
  - - [832, 192, 1, 64]
    - [47, 0.0]
  - - [960, 192, 1, 64]
    - [80, 0.0]
  - - [1088, 192, 1, 64]
    - [73, 0.0]
  - - [1216, 192, 1, 64]
    - [36, 0.0]
  - - [1344, 192, 1, 64]
    - [36, 0.0]
  - - [1472, 192, 1, 64]
    - [27, 0.0]
  - - [1600, 192, 1, 64]
    - [27, 0.0]
  - - [1728, 192, 1, 64]
    - [48, 0.0]
  - - [1856, 192, 1, 64]
    - [42, 0.0]
  - - [1984, 192, 1, 64]
    - [29, 0.0]
  - - [192, 320, 1, 64]
    - [163, 0.0]
  - - [448, 320, 1, 64]
    - [36, 0.0]
  - - [704, 320, 1, 64]
    - [19, 0.0]
  - - [960, 320, 1, 64]
    - [28, 0.0]
  - - [1216, 320, 1, 64]
    - [47, 0.0]
  - - [1472, 320, 1, 64]
    - [29, 0.0]
  - - [1728, 320, 1, 64]
    - [42, 0.0]
  - - [1984, 320, 1, 64]
    - [43, 0.0]
  - - [64, 448, 1, 64]
    - [164, 0.0]
  - - [192, 448, 1, 64]
    - [27, 0.0]
  - - [320, 448, 1, 64]
    - [103, 0.0]
  - - [448, 448, 1, 64]
    - [73, 0.0]
  - - [576, 448, 1, 64]
    - [73, 0.0]
  - - [704, 448, 1, 64]
    - [27, 0.0]
  - - [832, 448, 1, 64]
    - [45, 0.0]
  - - [960, 448, 1, 64]
    - [48, 0.0]
  - - [1088, 448, 1, 64]
    - [47, 0.0]
  - - [1216, 448, 1, 64]
    - [44, 0.0]
  - - [1344, 448, 1, 64]
    - [47, 0.0]
  - - [1472, 448, 1, 64]
    - [29, 0.0]
  - - [1600, 448, 1, 64]
    - [47, 0.0]
  - - [1728, 448, 1, 64]
    - [29, 0.0]
  - - [1856, 448, 1, 64]
    - [45, 0.0]
  - - [1984, 448, 1, 64]
    - [41, 0.0]
  - - [192, 576, 1, 64]
    - [73, 0.0]
  - - [448, 576, 1, 64]
    - [80, 0.0]
  - - [704, 576, 1, 64]
    - [41, 0.0]
  - - [960, 576, 1, 64]
    - [49, 0.0]
  - - [1216, 576, 1, 64]
    - [42, 0.0]
  - - [1472, 576, 1, 64]
    - [45, 0.0]
  - - [1728, 576, 1, 64]
    - [38, 0.0]
  - - [1984, 576, 1, 64]
    - [29, 0.0]
  - - [64, 704, 1, 64]
    - [19, 0.0]
  - - [192, 704, 1, 64]
    - [27, 0.0]
  - - [320, 704, 1, 64]
    - [36, 0.0]
  - - [448, 704, 1, 64]
    - [19, 0.0]
  - - [576, 704, 1, 64]
    - [29, 0.0]
  - - [704, 704, 1, 64]
    - [47, 0.0]
  - - [832, 704, 1, 64]
    - [47, 0.0]
  - - [960, 704, 1, 64]
    - [44, 0.0]
  - - [1088, 704, 1, 64]
    - [43, 0.0]
  - - [1216, 704, 1, 64]
    - [45, 0.0]
  - - [1344, 704, 1, 64]
    - [47, 0.0]
  - - [1472, 704, 1, 64]
    - [45, 0.0]
  - - [1600, 704, 1, 64]
    - [61, 0.0]
  - - [1728, 704, 1, 64]
    - [43, 0.0]
  - - [1856, 704, 1, 64]
    - [44, 0.0]
  - - [1984, 704, 1, 64]
    - [45, 0.0]
  - - [192, 832, 1, 64]
    - [36, 0.0]
  - - [448, 832, 1, 64]
    - [38, 0.0]
  - - [704, 832, 1, 64]
    - [43, 0.0]
  - - [960, 832, 1, 64]
    - [48, 0.0]
  - - [1216, 832, 1, 64]
    - [45, 0.0]
  - - [1472, 832, 1, 64]
    - [138, 0.0]
  - - [1728, 832, 1, 64]
    - [138, 0.0]
  - - [1984, 832, 1, 64]
    - [51, 0.0]
  - - [64, 960, 1, 64]
    - [176, 0.0]
  - - [192, 960, 1, 64]
    - [19, 0.0]
  - - [320, 960, 1, 64]
    - [27, 0.0]
  - - [448, 960, 1, 64]
    - [45, 0.0]
  - - [576, 960, 1, 64]
    - [29, 0.0]
  - - [704, 960, 1, 64]
    - [47, 0.0]
  - - [832, 960, 1, 64]
    - [44, 0.0]
  - - [960, 960, 1, 64]
    - [41, 0.0]
  - - [1088, 960, 1, 64]
    - [57, 0.0]
  - - [1216, 960, 1, 64]
    - [42, 0.0]
  - - [1344, 960, 1, 64]
    - [29, 0.0]
  - - [1472, 960, 1, 64]
    - [47, 0.0]
  - - [1600, 960, 1, 64]
    - [49, 0.0]
  - - [1728, 960, 1, 64]
    - [47, 0.0]
  - - [1856, 960, 1, 64]
    - [47, 0.0]
  - - [1984, 960, 1, 64]
    - [44, 0.0]
  - - [192, 1088, 1, 64]
    - [103, 0.0]
  - - [448, 1088, 1, 64]
    - [43, 0.0]
  - - [704, 1088, 1, 64]
    - [29, 0.0]
  - - [960, 1088, 1, 64]
    - [29, 0.0]
  - - [1216, 1088, 1, 64]
    - [138, 0.0]
  - - [1472, 1088, 1, 64]
    - [47, 0.0]
  - - [1728, 1088, 1, 64]
    - [61, 0.0]
  - - [1984, 1088, 1, 64]
    - [140, 0.0]
  - - [64, 1216, 1, 64]
    - [80, 0.0]
  - - [192, 1216, 1, 64]
    - [19, 0.0]
  - - [320, 1216, 1, 64]
    - [42, 0.0]
  - - [448, 1216, 1, 64]
    - [60, 0.0]
  - - [576, 1216, 1, 64]
    - [43, 0.0]
  - - [704, 1216, 1, 64]
    - [43, 0.0]
  - - [832, 1216, 1, 64]
    - [61, 0.0]
  - - [960, 1216, 1, 64]
    - [45, 0.0]
  - - [1088, 1216, 1, 64]
    - [44, 0.0]
  - - [1216, 1216, 1, 64]
    - [45, 0.0]
  - - [1344, 1216, 1, 64]
    - [61, 0.0]
  - - [1472, 1216, 1, 64]
    - [138, 0.0]
  - - [1600, 1216, 1, 64]
    - [60, 0.0]
  - - [1728, 1216, 1, 64]
    - [51, 0.0]
  - - [1856, 1216, 1, 64]
    - [51, 0.0]
  - - [1984, 1216, 1, 64]
    - [29, 0.0]
  - - [192, 1344, 1, 64]
    - [27, 0.0]
  - - [448, 1344, 1, 64]
    - [29, 0.0]
  - - [704, 1344, 1, 64]
    - [29, 0.0]
  - - [960, 1344, 1, 64]
    - [29, 0.0]
  - - [1216, 1344, 1, 64]
    - [42, 0.0]
  - - [1472, 1344, 1, 64]
    - [51, 0.0]
  - - [1728, 1344, 1, 64]
    - [29, 0.0]
  - - [1984, 1344, 1, 64]
    - [49, 0.0]
  - - [64, 1472, 1, 64]
    - [141, 0.0]
  - - [192, 1472, 1, 64]
    - [141, 0.0]
  - - [320, 1472, 1, 64]
    - [43, 0.0]
  - - [448, 1472, 1, 64]
    - [48, 0.0]
  - - [576, 1472, 1, 64]
    - [43, 0.0]
  - - [704, 1472, 1, 64]
    - [29, 0.0]
  - - [832, 1472, 1, 64]
    - [138, 0.0]
  - - [960, 1472, 1, 64]
    - [45, 0.0]
  - - [1088, 1472, 1, 64]
    - [50, 0.0]
  - - [1216, 1472, 1, 64]
    - [42, 0.0]
  - - [1344, 1472, 1, 64]
    - [61, 0.0]
  - - [1472, 1472, 1, 64]
    - [138, 0.0]
  - - [1600, 1472, 1, 64]
    - [60, 0.0]
  - - [1728, 1472, 1, 64]
    - [61, 0.0]
  - - [1856, 1472, 1, 64]
    - [61, 0.0]
  - - [1984, 1472, 1, 64]
    - [42, 0.0]
  - - [192, 1600, 1, 64]
    - [73, 0.0]
  - - [448, 1600, 1, 64]
    - [44, 0.0]
  - - [704, 1600, 1, 64]
    - [140, 0.0]
  - - [960, 1600, 1, 64]
    - [42, 0.0]
  - - [1216, 1600, 1, 64]
    - [138, 0.0]
  - - [1472, 1600, 1, 64]
    - [61, 0.0]
  - - [1728, 1600, 1, 64]
    - [140, 0.0]
  - - [1984, 1600, 1, 64]
    - [61, 0.0]
  - - [64, 1728, 1, 64]
    - [65, 0.0]
  - - [192, 1728, 1, 64]
    - [48, 0.0]
  - - [320, 1728, 1, 64]
    - [57, 0.0]
  - - [448, 1728, 1, 64]
    - [45, 0.0]
  - - [576, 1728, 1, 64]
    - [42, 0.0]
  - - [704, 1728, 1, 64]
    - [45, 0.0]
  - - [832, 1728, 1, 64]
    - [47, 0.0]
  - - [960, 1728, 1, 64]
    - [42, 0.0]
  - - [1088, 1728, 1, 64]
    - [49, 0.0]
  - - [1216, 1728, 1, 64]
    - [44, 0.0]
  - - [1344, 1728, 1, 64]
    - [60, 0.0]
  - - [1472, 1728, 1, 64]
    - [61, 0.0]
  - - [1600, 1728, 1, 64]
    - [61, 0.0]
  - - [1728, 1728, 1, 64]
    - [61, 0.0]
  - - [1856, 1728, 1, 64]
    - [51, 0.0]
  - - [1984, 1728, 1, 64]
    - [55, 0.0]
  - - [192, 1856, 1, 64]
    - [41, 0.0]
  - - [448, 1856, 1, 64]
    - [47, 0.0]
  - - [704, 1856, 1, 64]
    - [49, 0.0]
  - - [960, 1856, 1, 64]
    - [45, 0.0]
  - - [1216, 1856, 1, 64]
    - [61, 0.0]
  - - [1472, 1856, 1, 64]
    - [29, 0.0]
  - - [1728, 1856, 1, 64]
    - [61, 0.0]
  - - [1984, 1856, 1, 64]
    - [20, 0.0]
  - - [64, 1984, 1, 64]
    - [77, 0.0]
  - - [192, 1984, 1, 64]
    - [41, 0.0]
  - - [320, 1984, 1, 64]
    - [47, 0.0]
  - - [448, 1984, 1, 64]
    - [45, 0.0]
  - - [576, 1984, 1, 64]
    - [43, 0.0]
  - - [704, 1984, 1, 64]
    - [45, 0.0]
  - - [832, 1984, 1, 64]
    - [47, 0.0]
  - - [960, 1984, 1, 64]
    - [51, 0.0]
  - - [1088, 1984, 1, 64]
    - [45, 0.0]
  - - [1216, 1984, 1, 64]
    - [47, 0.0]
  - - [1344, 1984, 1, 64]
    - [61, 0.0]
  - - [1472, 1984, 1, 64]
    - [138, 0.0]
  - - [1600, 1984, 1, 64]
    - [51, 0.0]
  - - [1728, 1984, 1, 64]
    - [51, 0.0]
  - - [1856, 1984, 1, 64]
    - [54, 0.0]
  - - [1984, 1984, 1, 64]
    - [20, 0.0]
  - - [192, 64, 1, 256]
    - [178, 0.0]
  - - [448, 64, 1, 256]
    - [135, 0.0]
  - - [704, 64, 1, 256]
    - [28, 0.0]
  - - [960, 64, 1, 256]
    - [27, 0.0]
  - - [1216, 64, 1, 256]
    - [27, 0.0]
  - - [1472, 64, 1, 256]
    - [73, 0.0]
  - - [1728, 64, 1, 256]
    - [27, 0.0]
  - - [1984, 64, 1, 256]
    - [27, 0.0]
  - - [64, 192, 1, 256]
    - [181, 0.0]
  - - [192, 192, 1, 256]
    - [19, 0.0]
  - - [320, 192, 1, 256]
    - [19, 0.0]
  - - [448, 192, 1, 256]
    - [28, 0.0]
  - - [576, 192, 1, 256]
    - [27, 0.0]
  - - [704, 192, 1, 256]
    - [19, 0.0]
  - - [832, 192, 1, 256]
    - [27, 0.0]
  - - [960, 192, 1, 256]
    - [27, 0.0]
  - - [1088, 192, 1, 256]
    - [27, 0.0]
  - - [1216, 192, 1, 256]
    - [77, 0.0]
  - - [1344, 192, 1, 256]
    - [77, 0.0]
  - - [1472, 192, 1, 256]
    - [28, 0.0]
  - - [1600, 192, 1, 256]
    - [30, 0.0]
  - - [1728, 192, 1, 256]
    - [27, 0.0]
  - - [1856, 192, 1, 256]
    - [41, 0.0]
  - - [1984, 192, 1, 256]
    - [27, 0.0]
  - - [192, 320, 1, 256]
    - [27, 0.0]
  - - [448, 320, 1, 256]
    - [48, 0.0]
  - - [704, 320, 1, 256]
    - [28, 0.0]
  - - [960, 320, 1, 256]
    - [28, 0.0]
  - - [1216, 320, 1, 256]
    - [28, 0.0]
  - - [1472, 320, 1, 256]
    - [27, 0.0]
  - - [1728, 320, 1, 256]
    - [19, 0.0]
  - - [1984, 320, 1, 256]
    - [77, 0.0]
  - - [64, 448, 1, 256]
    - [19, 0.0]
  - - [192, 448, 1, 256]
    - [77, 0.0]
  - - [320, 448, 1, 256]
    - [77, 0.0]
  - - [448, 448, 1, 256]
    - [19, 0.0]
  - - [576, 448, 1, 256]
    - [27, 0.0]
  - - [704, 448, 1, 256]
    - [28, 0.0]
  - - [832, 448, 1, 256]
    - [35, 0.0]
  - - [960, 448, 1, 256]
    - [78, 0.0]
  - - [1088, 448, 1, 256]
    - [78, 0.0]
  - - [1216, 448, 1, 256]
    - [28, 0.0]
  - - [1344, 448, 1, 256]
    - [77, 0.0]
  - - [1472, 448, 1, 256]
    - [27, 0.0]
  - - [1600, 448, 1, 256]
    - [41, 0.0]
  - - [1728, 448, 1, 256]
    - [79, 0.0]
  - - [1856, 448, 1, 256]
    - [79, 0.0]
  - - [1984, 448, 1, 256]
    - [28, 0.0]
  - - [192, 576, 1, 256]
    - [27, 0.0]
  - - [448, 576, 1, 256]
    - [28, 0.0]
  - - [704, 576, 1, 256]
    - [27, 0.0]
  - - [960, 576, 1, 256]
    - [79, 0.0]
  - - [1216, 576, 1, 256]
    - [19, 0.0]
  - - [1472, 576, 1, 256]
    - [79, 0.0]
  - - [1728, 576, 1, 256]
    - [81, 0.0]
  - - [1984, 576, 1, 256]
    - [38, 0.0]
  - - [64, 704, 1, 256]
    - [19, 0.0]
  - - [192, 704, 1, 256]
    - [36, 0.0]
  - - [320, 704, 1, 256]
    - [28, 0.0]
  - - [448, 704, 1, 256]
    - [78, 0.0]
  - - [576, 704, 1, 256]
    - [28, 0.0]
  - - [704, 704, 1, 256]
    - [19, 0.0]
  - - [832, 704, 1, 256]
    - [77, 0.0]
  - - [960, 704, 1, 256]
    - [78, 0.0]
  - - [1088, 704, 1, 256]
    - [27, 0.0]
  - - [1216, 704, 1, 256]
    - [81, 0.0]
  - - [1344, 704, 1, 256]
    - [27, 0.0]
  - - [1472, 704, 1, 256]
    - [28, 0.0]
  - - [1600, 704, 1, 256]
    - [41, 0.0]
  - - [1728, 704, 1, 256]
    - [48, 0.0]
  - - [1856, 704, 1, 256]
    - [79, 0.0]
  - - [1984, 704, 1, 256]
    - [79, 0.0]
  - - [192, 832, 1, 256]
    - [28, 0.0]
  - - [448, 832, 1, 256]
    - [27, 0.0]
  - - [704, 832, 1, 256]
    - [77, 0.0]
  - - [960, 832, 1, 256]
    - [81, 0.0]
  - - [1216, 832, 1, 256]
    - [41, 0.0]
  - - [1472, 832, 1, 256]
    - [144, 0.0]
  - - [1728, 832, 1, 256]
    - [81, 0.0]
  - - [1984, 832, 1, 256]
    - [54, 0.0]
  - - [64, 960, 1, 256]
    - [19, 0.0]
  - - [192, 960, 1, 256]
    - [19, 0.0]
  - - [320, 960, 1, 256]
    - [19, 0.0]
  - - [448, 960, 1, 256]
    - [28, 0.0]
  - - [576, 960, 1, 256]
    - [77, 0.0]
  - - [704, 960, 1, 256]
    - [77, 0.0]
  - - [832, 960, 1, 256]
    - [81, 0.0]
  - - [960, 960, 1, 256]
    - [27, 0.0]
  - - [1088, 960, 1, 256]
    - [81, 0.0]
  - - [1216, 960, 1, 256]
    - [28, 0.0]
  - - [1344, 960, 1, 256]
    - [79, 0.0]
  - - [1472, 960, 1, 256]
    - [79, 0.0]
  - - [1600, 960, 1, 256]
    - [55, 0.0]
  - - [1728, 960, 1, 256]
    - [20, 0.0]
  - - [1856, 960, 1, 256]
    - [54, 0.0]
  - - [1984, 960, 1, 256]
    - [55, 0.0]
  - - [192, 1088, 1, 256]
    - [28, 0.0]
  - - [448, 1088, 1, 256]
    - [28, 0.0]
  - - [704, 1088, 1, 256]
    - [77, 0.0]
  - - [960, 1088, 1, 256]
    - [79, 0.0]
  - - [1216, 1088, 1, 256]
    - [20, 0.0]
  - - [1472, 1088, 1, 256]
    - [54, 0.0]
  - - [1728, 1088, 1, 256]
    - [55, 0.0]
  - - [1984, 1088, 1, 256]
    - [55, 0.0]
  - - [64, 1216, 1, 256]
    - [78, 0.0]
  - - [192, 1216, 1, 256]
    - [27, 0.0]
  - - [320, 1216, 1, 256]
    - [28, 0.0]
  - - [448, 1216, 1, 256]
    - [35, 0.0]
  - - [576, 1216, 1, 256]
    - [28, 0.0]
  - - [704, 1216, 1, 256]
    - [79, 0.0]
  - - [832, 1216, 1, 256]
    - [78, 0.0]
  - - [960, 1216, 1, 256]
    - [81, 0.0]
  - - [1088, 1216, 1, 256]
    - [20, 0.0]
  - - [1216, 1216, 1, 256]
    - [81, 0.0]
  - - [1344, 1216, 1, 256]
    - [55, 0.0]
  - - [1472, 1216, 1, 256]
    - [20, 0.0]
  - - [1600, 1216, 1, 256]
    - [20, 0.0]
  - - [1728, 1216, 1, 256]
    - [54, 0.0]
  - - [1856, 1216, 1, 256]
    - [20, 0.0]
  - - [1984, 1216, 1, 256]
    - [55, 0.0]
  - - [192, 1344, 1, 256]
    - [28, 0.0]
  - - [448, 1344, 1, 256]
    - [27, 0.0]
  - - [704, 1344, 1, 256]
    - [78, 0.0]
  - - [960, 1344, 1, 256]
    - [19, 0.0]
  - - [1216, 1344, 1, 256]
    - [110, 0.0]
  - - [1472, 1344, 1, 256]
    - [55, 0.0]
  - - [1728, 1344, 1, 256]
    - [20, 0.0]
  - - [1984, 1344, 1, 256]
    - [20, 0.0]
  - - [64, 1472, 1, 256]
    - [36, 0.0]
  - - [192, 1472, 1, 256]
    - [27, 0.0]
  - - [320, 1472, 1, 256]
    - [28, 0.0]
  - - [448, 1472, 1, 256]
    - [79, 0.0]
  - - [576, 1472, 1, 256]
    - [79, 0.0]
  - - [704, 1472, 1, 256]
    - [77, 0.0]
  - - [832, 1472, 1, 256]
    - [96, 0.0]
  - - [960, 1472, 1, 256]
    - [20, 0.0]
  - - [1088, 1472, 1, 256]
    - [55, 0.0]
  - - [1216, 1472, 1, 256]
    - [55, 0.0]
  - - [1344, 1472, 1, 256]
    - [20, 0.0]
  - - [1472, 1472, 1, 256]
    - [55, 0.0]
  - - [1600, 1472, 1, 256]
    - [20, 0.0]
  - - [1728, 1472, 1, 256]
    - [54, 0.0]
  - - [1856, 1472, 1, 256]
    - [20, 0.0]
  - - [1984, 1472, 1, 256]
    - [20, 0.0]
  - - [192, 1600, 1, 256]
    - [77, 0.0]
  - - [448, 1600, 1, 256]
    - [79, 0.0]
  - - [704, 1600, 1, 256]
    - [78, 0.0]
  - - [960, 1600, 1, 256]
    - [81, 0.0]
  - - [1216, 1600, 1, 256]
    - [20, 0.0]
  - - [1472, 1600, 1, 256]
    - [56, 0.0]
  - - [1728, 1600, 1, 256]
    - [20, 0.0]
  - - [1984, 1600, 1, 256]
    - [20, 0.0]
  - - [64, 1728, 1, 256]
    - [73, 0.0]
  - - [192, 1728, 1, 256]
    - [77, 0.0]
  - - [320, 1728, 1, 256]
    - [35, 0.0]
  - - [448, 1728, 1, 256]
    - [78, 0.0]
  - - [576, 1728, 1, 256]
    - [28, 0.0]
  - - [704, 1728, 1, 256]
    - [35, 0.0]
  - - [832, 1728, 1, 256]
    - [146, 0.0]
  - - [960, 1728, 1, 256]
    - [20, 0.0]
  - - [1088, 1728, 1, 256]
    - [20, 0.0]
  - - [1216, 1728, 1, 256]
    - [54, 0.0]
  - - [1344, 1728, 1, 256]
    - [54, 0.0]
  - - [1472, 1728, 1, 256]
    - [64, 0.0]
  - - [1600, 1728, 1, 256]
    - [20, 0.0]
  - - [1728, 1728, 1, 256]
    - [20, 0.0]
  - - [1856, 1728, 1, 256]
    - [55, 0.0]
  - - [1984, 1728, 1, 256]
    - [55, 0.0]
  - - [192, 1856, 1, 256]
    - [27, 0.0]
  - - [448, 1856, 1, 256]
    - [79, 0.0]
  - - [704, 1856, 1, 256]
    - [79, 0.0]
  - - [960, 1856, 1, 256]
    - [20, 0.0]
  - - [1216, 1856, 1, 256]
    - [20, 0.0]
  - - [1472, 1856, 1, 256]
    - [20, 0.0]
  - - [1728, 1856, 1, 256]
    - [110, 0.0]
  - - [1984, 1856, 1, 256]
    - [20, 0.0]
  - - [64, 1984, 1, 256]
    - [147, 0.0]
  - - [192, 1984, 1, 256]
    - [19, 0.0]
  - - [320, 1984, 1, 256]
    - [28, 0.0]
  - - [448, 1984, 1, 256]
    - [28, 0.0]
  - - [576, 1984, 1, 256]
    - [28, 0.0]
  - - [704, 1984, 1, 256]
    - [20, 0.0]
  - - [832, 1984, 1, 256]
    - [20, 0.0]
  - - [960, 1984, 1, 256]
    - [20, 0.0]
  - - [1088, 1984, 1, 256]
    - [111, 0.0]
  - - [1216, 1984, 1, 256]
    - [20, 0.0]
  - - [1344, 1984, 1, 256]
    - [20, 0.0]
  - - [1472, 1984, 1, 256]
    - [55, 0.0]
  - - [1600, 1984, 1, 256]
    - [55, 0.0]
  - - [1728, 1984, 1, 256]
    - [56, 0.0]
  - - [1856, 1984, 1, 256]
    - [20, 0.0]
  - - [1984, 1984, 1, 256]
    - [20, 0.0]
  - - [192, 64, 1, 512]
    - [24, 0.0]
  - - [448, 64, 1, 512]
    - [135, 0.0]
  - - [704, 64, 1, 512]
    - [27, 0.0]
  - - [960, 64, 1, 512]
    - [27, 0.0]
  - - [1216, 64, 1, 512]
    - [27, 0.0]
  - - [1472, 64, 1, 512]
    - [19, 0.0]
  - - [1728, 64, 1, 512]
    - [27, 0.0]
  - - [1984, 64, 1, 512]
    - [27, 0.0]
  - - [64, 192, 1, 512]
    - [149, 0.0]
  - - [192, 192, 1, 512]
    - [19, 0.0]
  - - [320, 192, 1, 512]
    - [27, 0.0]
  - - [448, 192, 1, 512]
    - [28, 0.0]
  - - [576, 192, 1, 512]
    - [77, 0.0]
  - - [704, 192, 1, 512]
    - [28, 0.0]
  - - [832, 192, 1, 512]
    - [27, 0.0]
  - - [960, 192, 1, 512]
    - [28, 0.0]
  - - [1088, 192, 1, 512]
    - [27, 0.0]
  - - [1216, 192, 1, 512]
    - [77, 0.0]
  - - [1344, 192, 1, 512]
    - [28, 0.0]
  - - [1472, 192, 1, 512]
    - [104, 0.0]
  - - [1600, 192, 1, 512]
    - [71, 0.0]
  - - [1728, 192, 1, 512]
    - [36, 0.0]
  - - [1856, 192, 1, 512]
    - [28, 0.0]
  - - [1984, 192, 1, 512]
    - [28, 0.0]
  - - [192, 320, 1, 512]
    - [19, 0.0]
  - - [448, 320, 1, 512]
    - [19, 0.0]
  - - [704, 320, 1, 512]
    - [28, 0.0]
  - - [960, 320, 1, 512]
    - [28, 0.0]
  - - [1216, 320, 1, 512]
    - [77, 0.0]
  - - [1472, 320, 1, 512]
    - [28, 0.0]
  - - [1728, 320, 1, 512]
    - [27, 0.0]
  - - [1984, 320, 1, 512]
    - [28, 0.0]
  - - [64, 448, 1, 512]
    - [27, 0.0]
  - - [192, 448, 1, 512]
    - [77, 0.0]
  - - [320, 448, 1, 512]
    - [73, 0.0]
  - - [448, 448, 1, 512]
    - [28, 0.0]
  - - [576, 448, 1, 512]
    - [19, 0.0]
  - - [704, 448, 1, 512]
    - [27, 0.0]
  - - [832, 448, 1, 512]
    - [28, 0.0]
  - - [960, 448, 1, 512]
    - [28, 0.0]
  - - [1088, 448, 1, 512]
    - [77, 0.0]
  - - [1216, 448, 1, 512]
    - [28, 0.0]
  - - [1344, 448, 1, 512]
    - [28, 0.0]
  - - [1472, 448, 1, 512]
    - [20, 0.0]
  - - [1600, 448, 1, 512]
    - [88, 0.0]
  - - [1728, 448, 1, 512]
    - [77, 0.0]
  - - [1856, 448, 1, 512]
    - [20, 0.0]
  - - [1984, 448, 1, 512]
    - [20, 0.0]
  - - [192, 576, 1, 512]
    - [19, 0.0]
  - - [448, 576, 1, 512]
    - [27, 0.0]
  - - [704, 576, 1, 512]
    - [35, 0.0]
  - - [960, 576, 1, 512]
    - [28, 0.0]
  - - [1216, 576, 1, 512]
    - [28, 0.0]
  - - [1472, 576, 1, 512]
    - [55, 0.0]
  - - [1728, 576, 1, 512]
    - [20, 0.0]
  - - [1984, 576, 1, 512]
    - [20, 0.0]
  - - [64, 704, 1, 512]
    - [19, 0.0]
  - - [192, 704, 1, 512]
    - [77, 0.0]
  - - [320, 704, 1, 512]
    - [27, 0.0]
  - - [448, 704, 1, 512]
    - [77, 0.0]
  - - [576, 704, 1, 512]
    - [28, 0.0]
  - - [704, 704, 1, 512]
    - [19, 0.0]
  - - [832, 704, 1, 512]
    - [104, 0.0]
  - - [960, 704, 1, 512]
    - [20, 0.0]
  - - [1088, 704, 1, 512]
    - [19, 0.0]
  - - [1216, 704, 1, 512]
    - [20, 0.0]
  - - [1344, 704, 1, 512]
    - [28, 0.0]
  - - [1472, 704, 1, 512]
    - [20, 0.0]
  - - [1600, 704, 1, 512]
    - [20, 0.0]
  - - [1728, 704, 1, 512]
    - [20, 0.0]
  - - [1856, 704, 1, 512]
    - [20, 0.0]
  - - [1984, 704, 1, 512]
    - [55, 0.0]
  - - [192, 832, 1, 512]
    - [77, 0.0]
  - - [448, 832, 1, 512]
    - [77, 0.0]
  - - [704, 832, 1, 512]
    - [28, 0.0]
  - - [960, 832, 1, 512]
    - [20, 0.0]
  - - [1216, 832, 1, 512]
    - [55, 0.0]
  - - [1472, 832, 1, 512]
    - [20, 0.0]
  - - [1728, 832, 1, 512]
    - [54, 0.0]
  - - [1984, 832, 1, 512]
    - [54, 0.0]
  - - [64, 960, 1, 512]
    - [27, 0.0]
  - - [192, 960, 1, 512]
    - [77, 0.0]
  - - [320, 960, 1, 512]
    - [27, 0.0]
  - - [448, 960, 1, 512]
    - [28, 0.0]
  - - [576, 960, 1, 512]
    - [71, 0.0]
  - - [704, 960, 1, 512]
    - [20, 0.0]
  - - [832, 960, 1, 512]
    - [20, 0.0]
  - - [960, 960, 1, 512]
    - [54, 0.0]
  - - [1088, 960, 1, 512]
    - [20, 0.0]
  - - [1216, 960, 1, 512]
    - [110, 0.0]
  - - [1344, 960, 1, 512]
    - [55, 0.0]
  - - [1472, 960, 1, 512]
    - [20, 0.0]
  - - [1600, 960, 1, 512]
    - [55, 0.0]
  - - [1728, 960, 1, 512]
    - [110, 0.0]
  - - [1856, 960, 1, 512]
    - [55, 0.0]
  - - [1984, 960, 1, 512]
    - [20, 0.0]
  - - [192, 1088, 1, 512]
    - [28, 0.0]
  - - [448, 1088, 1, 512]
    - [19, 0.0]
  - - [704, 1088, 1, 512]
    - [77, 0.0]
  - - [960, 1088, 1, 512]
    - [20, 0.0]
  - - [1216, 1088, 1, 512]
    - [20, 0.0]
  - - [1472, 1088, 1, 512]
    - [54, 0.0]
  - - [1728, 1088, 1, 512]
    - [55, 0.0]
  - - [1984, 1088, 1, 512]
    - [20, 0.0]
  - - [64, 1216, 1, 512]
    - [19, 0.0]
  - - [192, 1216, 1, 512]
    - [27, 0.0]
  - - [320, 1216, 1, 512]
    - [19, 0.0]
  - - [448, 1216, 1, 512]
    - [77, 0.0]
  - - [576, 1216, 1, 512]
    - [71, 0.0]
  - - [704, 1216, 1, 512]
    - [110, 0.0]
  - - [832, 1216, 1, 512]
    - [20, 0.0]
  - - [960, 1216, 1, 512]
    - [20, 0.0]
  - - [1088, 1216, 1, 512]
    - [20, 0.0]
  - - [1216, 1216, 1, 512]
    - [20, 0.0]
  - - [1344, 1216, 1, 512]
    - [55, 0.0]
  - - [1472, 1216, 1, 512]
    - [56, 0.0]
  - - [1600, 1216, 1, 512]
    - [20, 0.0]
  - - [1728, 1216, 1, 512]
    - [20, 0.0]
  - - [1856, 1216, 1, 512]
    - [20, 0.0]
  - - [1984, 1216, 1, 512]
    - [20, 0.0]
  - - [192, 1344, 1, 512]
    - [27, 0.0]
  - - [448, 1344, 1, 512]
    - [77, 0.0]
  - - [704, 1344, 1, 512]
    - [77, 0.0]
  - - [960, 1344, 1, 512]
    - [20, 0.0]
  - - [1216, 1344, 1, 512]
    - [20, 0.0]
  - - [1472, 1344, 1, 512]
    - [54, 0.0]
  - - [1728, 1344, 1, 512]
    - [20, 0.0]
  - - [1984, 1344, 1, 512]
    - [20, 0.0]
  - - [64, 1472, 1, 512]
    - [77, 0.0]
  - - [192, 1472, 1, 512]
    - [88, 0.0]
  - - [320, 1472, 1, 512]
    - [27, 0.0]
  - - [448, 1472, 1, 512]
    - [20, 0.0]
  - - [576, 1472, 1, 512]
    - [55, 0.0]
  - - [704, 1472, 1, 512]
    - [20, 0.0]
  - - [832, 1472, 1, 512]
    - [54, 0.0]
  - - [960, 1472, 1, 512]
    - [110, 0.0]
  - - [1088, 1472, 1, 512]
    - [20, 0.0]
  - - [1216, 1472, 1, 512]
    - [20, 0.0]
  - - [1344, 1472, 1, 512]
    - [20, 0.0]
  - - [1472, 1472, 1, 512]
    - [20, 0.0]
  - - [1600, 1472, 1, 512]
    - [20, 0.0]
  - - [1728, 1472, 1, 512]
    - [110, 0.0]
  - - [1856, 1472, 1, 512]
    - [20, 0.0]
  - - [1984, 1472, 1, 512]
    - [110, 0.0]
  - - [192, 1600, 1, 512]
    - [73, 0.0]
  - - [448, 1600, 1, 512]
    - [77, 0.0]
  - - [704, 1600, 1, 512]
    - [20, 0.0]
  - - [960, 1600, 1, 512]
    - [20, 0.0]
  - - [1216, 1600, 1, 512]
    - [20, 0.0]
  - - [1472, 1600, 1, 512]
    - [20, 0.0]
  - - [1728, 1600, 1, 512]
    - [20, 0.0]
  - - [1984, 1600, 1, 512]
    - [20, 0.0]
  - - [64, 1728, 1, 512]
    - [27, 0.0]
  - - [192, 1728, 1, 512]
    - [19, 0.0]
  - - [320, 1728, 1, 512]
    - [77, 0.0]
  - - [448, 1728, 1, 512]
    - [77, 0.0]
  - - [576, 1728, 1, 512]
    - [20, 0.0]
  - - [704, 1728, 1, 512]
    - [20, 0.0]
  - - [832, 1728, 1, 512]
    - [20, 0.0]
  - - [960, 1728, 1, 512]
    - [20, 0.0]
  - - [1088, 1728, 1, 512]
    - [20, 0.0]
  - - [1216, 1728, 1, 512]
    - [110, 0.0]
  - - [1344, 1728, 1, 512]
    - [110, 0.0]
  - - [1472, 1728, 1, 512]
    - [20, 0.0]
  - - [1600, 1728, 1, 512]
    - [20, 0.0]
  - - [1728, 1728, 1, 512]
    - [20, 0.0]
  - - [1856, 1728, 1, 512]
    - [20, 0.0]
  - - [1984, 1728, 1, 512]
    - [20, 0.0]
  - - [192, 1856, 1, 512]
    - [77, 0.0]
  - - [448, 1856, 1, 512]
    - [55, 0.0]
  - - [704, 1856, 1, 512]
    - [20, 0.0]
  - - [960, 1856, 1, 512]
    - [20, 0.0]
  - - [1216, 1856, 1, 512]
    - [111, 0.0]
  - - [1472, 1856, 1, 512]
    - [20, 0.0]
  - - [1728, 1856, 1, 512]
    - [20, 0.0]
  - - [1984, 1856, 1, 512]
    - [20, 0.0]
  - - [64, 1984, 1, 512]
    - [28, 0.0]
  - - [192, 1984, 1, 512]
    - [77, 0.0]
  - - [320, 1984, 1, 512]
    - [103, 0.0]
  - - [448, 1984, 1, 512]
    - [55, 0.0]
  - - [576, 1984, 1, 512]
    - [20, 0.0]
  - - [704, 1984, 1, 512]
    - [20, 0.0]
  - - [832, 1984, 1, 512]
    - [55, 0.0]
  - - [960, 1984, 1, 512]
    - [110, 0.0]
  - - [1088, 1984, 1, 512]
    - [20, 0.0]
  - - [1216, 1984, 1, 512]
    - [20, 0.0]
  - - [1344, 1984, 1, 512]
    - [64, 0.0]
  - - [1472, 1984, 1, 512]
    - [20, 0.0]
  - - [1600, 1984, 1, 512]
    - [20, 0.0]
  - - [1728, 1984, 1, 512]
    - [55, 0.0]
  - - [1856, 1984, 1, 512]
    - [20, 0.0]
  - - [1984, 1984, 1, 512]
    - [20, 0.0]
  - - [192, 64, 1, 1024]
    - [98, 0.0]
  - - [448, 64, 1, 1024]
    - [27, 0.0]
  - - [704, 64, 1, 1024]
    - [19, 0.0]
  - - [960, 64, 1, 1024]
    - [28, 0.0]
  - - [1216, 64, 1, 1024]
    - [19, 0.0]
  - - [1472, 64, 1, 1024]
    - [77, 0.0]
  - - [1728, 64, 1, 1024]
    - [74, 0.0]
  - - [1984, 64, 1, 1024]
    - [19, 0.0]
  - - [64, 192, 1, 1024]
    - [149, 0.0]
  - - [192, 192, 1, 1024]
    - [88, 0.0]
  - - [320, 192, 1, 1024]
    - [19, 0.0]
  - - [448, 192, 1, 1024]
    - [27, 0.0]
  - - [576, 192, 1, 1024]
    - [19, 0.0]
  - - [704, 192, 1, 1024]
    - [71, 0.0]
  - - [832, 192, 1, 1024]
    - [28, 0.0]
  - - [960, 192, 1, 1024]
    - [28, 0.0]
  - - [1088, 192, 1, 1024]
    - [74, 0.0]
  - - [1216, 192, 1, 1024]
    - [28, 0.0]
  - - [1344, 192, 1, 1024]
    - [28, 0.0]
  - - [1472, 192, 1, 1024]
    - [77, 0.0]
  - - [1600, 192, 1, 1024]
    - [77, 0.0]
  - - [1728, 192, 1, 1024]
    - [23, 0.0]
  - - [1856, 192, 1, 1024]
    - [28, 0.0]
  - - [1984, 192, 1, 1024]
    - [23, 0.0]
  - - [192, 320, 1, 1024]
    - [19, 0.0]
  - - [448, 320, 1, 1024]
    - [28, 0.0]
  - - [704, 320, 1, 1024]
    - [28, 0.0]
  - - [960, 320, 1, 1024]
    - [19, 0.0]
  - - [1216, 320, 1, 1024]
    - [117, 0.0]
  - - [1472, 320, 1, 1024]
    - [77, 0.0]
  - - [1728, 320, 1, 1024]
    - [20, 0.0]
  - - [1984, 320, 1, 1024]
    - [20, 0.0]
  - - [64, 448, 1, 1024]
    - [27, 0.0]
  - - [192, 448, 1, 1024]
    - [27, 0.0]
  - - [320, 448, 1, 1024]
    - [28, 0.0]
  - - [448, 448, 1, 1024]
    - [71, 0.0]
  - - [576, 448, 1, 1024]
    - [77, 0.0]
  - - [704, 448, 1, 1024]
    - [77, 0.0]
  - - [832, 448, 1, 1024]
    - [23, 0.0]
  - - [960, 448, 1, 1024]
    - [117, 0.0]
  - - [1088, 448, 1, 1024]
    - [77, 0.0]
  - - [1216, 448, 1, 1024]
    - [20, 0.0]
  - - [1344, 448, 1, 1024]
    - [20, 0.0]
  - - [1472, 448, 1, 1024]
    - [20, 0.0]
  - - [1600, 448, 1, 1024]
    - [20, 0.0]
  - - [1728, 448, 1, 1024]
    - [20, 0.0]
  - - [1856, 448, 1, 1024]
    - [23, 0.0]
  - - [1984, 448, 1, 1024]
    - [23, 0.0]
  - - [192, 576, 1, 1024]
    - [77, 0.0]
  - - [448, 576, 1, 1024]
    - [19, 0.0]
  - - [704, 576, 1, 1024]
    - [117, 0.0]
  - - [960, 576, 1, 1024]
    - [20, 0.0]
  - - [1216, 576, 1, 1024]
    - [23, 0.0]
  - - [1472, 576, 1, 1024]
    - [20, 0.0]
  - - [1728, 576, 1, 1024]
    - [20, 0.0]
  - - [1984, 576, 1, 1024]
    - [20, 0.0]
  - - [64, 704, 1, 1024]
    - [19, 0.0]
  - - [192, 704, 1, 1024]
    - [77, 0.0]
  - - [320, 704, 1, 1024]
    - [28, 0.0]
  - - [448, 704, 1, 1024]
    - [88, 0.0]
  - - [576, 704, 1, 1024]
    - [120, 0.0]
  - - [704, 704, 1, 1024]
    - [104, 0.0]
  - - [832, 704, 1, 1024]
    - [20, 0.0]
  - - [960, 704, 1, 1024]
    - [20, 0.0]
  - - [1088, 704, 1, 1024]
    - [23, 0.0]
  - - [1216, 704, 1, 1024]
    - [20, 0.0]
  - - [1344, 704, 1, 1024]
    - [20, 0.0]
  - - [1472, 704, 1, 1024]
    - [20, 0.0]
  - - [1600, 704, 1, 1024]
    - [20, 0.0]
  - - [1728, 704, 1, 1024]
    - [20, 0.0]
  - - [1856, 704, 1, 1024]
    - [20, 0.0]
  - - [1984, 704, 1, 1024]
    - [55, 0.0]
  - - [192, 832, 1, 1024]
    - [28, 0.0]
  - - [448, 832, 1, 1024]
    - [117, 0.0]
  - - [704, 832, 1, 1024]
    - [20, 0.0]
  - - [960, 832, 1, 1024]
    - [23, 0.0]
  - - [1216, 832, 1, 1024]
    - [110, 0.0]
  - - [1472, 832, 1, 1024]
    - [20, 0.0]
  - - [1728, 832, 1, 1024]
    - [20, 0.0]
  - - [1984, 832, 1, 1024]
    - [111, 0.0]
  - - [64, 960, 1, 1024]
    - [28, 0.0]
  - - [192, 960, 1, 1024]
    - [28, 0.0]
  - - [320, 960, 1, 1024]
    - [28, 0.0]
  - - [448, 960, 1, 1024]
    - [23, 0.0]
  - - [576, 960, 1, 1024]
    - [20, 0.0]
  - - [704, 960, 1, 1024]
    - [20, 0.0]
  - - [832, 960, 1, 1024]
    - [20, 0.0]
  - - [960, 960, 1, 1024]
    - [20, 0.0]
  - - [1088, 960, 1, 1024]
    - [20, 0.0]
  - - [1216, 960, 1, 1024]
    - [20, 0.0]
  - - [1344, 960, 1, 1024]
    - [55, 0.0]
  - - [1472, 960, 1, 1024]
    - [20, 0.0]
  - - [1600, 960, 1, 1024]
    - [111, 0.0]
  - - [1728, 960, 1, 1024]
    - [110, 0.0]
  - - [1856, 960, 1, 1024]
    - [20, 0.0]
  - - [1984, 960, 1, 1024]
    - [20, 0.0]
  - - [192, 1088, 1, 1024]
    - [77, 0.0]
  - - [448, 1088, 1, 1024]
    - [77, 0.0]
  - - [704, 1088, 1, 1024]
    - [23, 0.0]
  - - [960, 1088, 1, 1024]
    - [20, 0.0]
  - - [1216, 1088, 1, 1024]
    - [20, 0.0]
  - - [1472, 1088, 1, 1024]
    - [20, 0.0]
  - - [1728, 1088, 1, 1024]
    - [20, 0.0]
  - - [1984, 1088, 1, 1024]
    - [55, 0.0]
  - - [64, 1216, 1, 1024]
    - [28, 0.0]
  - - [192, 1216, 1, 1024]
    - [77, 0.0]
  - - [320, 1216, 1, 1024]
    - [117, 0.0]
  - - [448, 1216, 1, 1024]
    - [55, 0.0]
  - - [576, 1216, 1, 1024]
    - [23, 0.0]
  - - [704, 1216, 1, 1024]
    - [20, 0.0]
  - - [832, 1216, 1, 1024]
    - [20, 0.0]
  - - [960, 1216, 1, 1024]
    - [20, 0.0]
  - - [1088, 1216, 1, 1024]
    - [54, 0.0]
  - - [1216, 1216, 1, 1024]
    - [55, 0.0]
  - - [1344, 1216, 1, 1024]
    - [20, 0.0]
  - - [1472, 1216, 1, 1024]
    - [20, 0.0]
  - - [1600, 1216, 1, 1024]
    - [20, 0.0]
  - - [1728, 1216, 1, 1024]
    - [54, 0.0]
  - - [1856, 1216, 1, 1024]
    - [110, 0.0]
  - - [1984, 1216, 1, 1024]
    - [20, 0.0]
  - - [192, 1344, 1, 1024]
    - [77, 0.0]
  - - [448, 1344, 1, 1024]
    - [20, 0.0]
  - - [704, 1344, 1, 1024]
    - [20, 0.0]
  - - [960, 1344, 1, 1024]
    - [20, 0.0]
  - - [1216, 1344, 1, 1024]
    - [20, 0.0]
  - - [1472, 1344, 1, 1024]
    - [20, 0.0]
  - - [1728, 1344, 1, 1024]
    - [20, 0.0]
  - - [1984, 1344, 1, 1024]
    - [20, 0.0]
  - - [64, 1472, 1, 1024]
    - [19, 0.0]
  - - [192, 1472, 1, 1024]
    - [28, 0.0]
  - - [320, 1472, 1, 1024]
    - [77, 0.0]
  - - [448, 1472, 1, 1024]
    - [20, 0.0]
  - - [576, 1472, 1, 1024]
    - [55, 0.0]
  - - [704, 1472, 1, 1024]
    - [55, 0.0]
  - - [832, 1472, 1, 1024]
    - [20, 0.0]
  - - [960, 1472, 1, 1024]
    - [110, 0.0]
  - - [1088, 1472, 1, 1024]
    - [20, 0.0]
  - - [1216, 1472, 1, 1024]
    - [20, 0.0]
  - - [1344, 1472, 1, 1024]
    - [20, 0.0]
  - - [1472, 1472, 1, 1024]
    - [110, 0.0]
  - - [1600, 1472, 1, 1024]
    - [20, 0.0]
  - - [1728, 1472, 1, 1024]
    - [20, 0.0]
  - - [1856, 1472, 1, 1024]
    - [20, 0.0]
  - - [1984, 1472, 1, 1024]
    - [110, 0.0]
  - - [192, 1600, 1, 1024]
    - [27, 0.0]
  - - [448, 1600, 1, 1024]
    - [23, 0.0]
  - - [704, 1600, 1, 1024]
    - [20, 0.0]
  - - [960, 1600, 1, 1024]
    - [20, 0.0]
  - - [1216, 1600, 1, 1024]
    - [20, 0.0]
  - - [1472, 1600, 1, 1024]
    - [106, 0.0]
  - - [1728, 1600, 1, 1024]
    - [20, 0.0]
  - - [1984, 1600, 1, 1024]
    - [20, 0.0]
  - - [64, 1728, 1, 1024]
    - [19, 0.0]
  - - [192, 1728, 1, 1024]
    - [117, 0.0]
  - - [320, 1728, 1, 1024]
    - [20, 0.0]
  - - [448, 1728, 1, 1024]
    - [23, 0.0]
  - - [576, 1728, 1, 1024]
    - [20, 0.0]
  - - [704, 1728, 1, 1024]
    - [20, 0.0]
  - - [832, 1728, 1, 1024]
    - [20, 0.0]
  - - [960, 1728, 1, 1024]
    - [55, 0.0]
  - - [1088, 1728, 1, 1024]
    - [20, 0.0]
  - - [1216, 1728, 1, 1024]
    - [110, 0.0]
  - - [1344, 1728, 1, 1024]
    - [20, 0.0]
  - - [1472, 1728, 1, 1024]
    - [20, 0.0]
  - - [1600, 1728, 1, 1024]
    - [20, 0.0]
  - - [1728, 1728, 1, 1024]
    - [110, 0.0]
  - - [1856, 1728, 1, 1024]
    - [20, 0.0]
  - - [1984, 1728, 1, 1024]
    - [20, 0.0]
  - - [192, 1856, 1, 1024]
    - [117, 0.0]
  - - [448, 1856, 1, 1024]
    - [55, 0.0]
  - - [704, 1856, 1, 1024]
    - [20, 0.0]
  - - [960, 1856, 1, 1024]
    - [55, 0.0]
  - - [1216, 1856, 1, 1024]
    - [54, 0.0]
  - - [1472, 1856, 1, 1024]
    - [20, 0.0]
  - - [1728, 1856, 1, 1024]
    - [20, 0.0]
  - - [1984, 1856, 1, 1024]
    - [20, 0.0]
  - - [64, 1984, 1, 1024]
    - [77, 0.0]
  - - [192, 1984, 1, 1024]
    - [23, 0.0]
  - - [320, 1984, 1, 1024]
    - [59, 0.0]
  - - [448, 1984, 1, 1024]
    - [55, 0.0]
  - - [576, 1984, 1, 1024]
    - [20, 0.0]
  - - [704, 1984, 1, 1024]
    - [20, 0.0]
  - - [832, 1984, 1, 1024]
    - [20, 0.0]
  - - [960, 1984, 1, 1024]
    - [56, 0.0]
  - - [1088, 1984, 1, 1024]
    - [20, 0.0]
  - - [1216, 1984, 1, 1024]
    - [20, 0.0]
  - - [1344, 1984, 1, 1024]
    - [20, 0.0]
  - - [1472, 1984, 1, 1024]
    - [20, 0.0]
  - - [1600, 1984, 1, 1024]
    - [20, 0.0]
  - - [1728, 1984, 1, 1024]
    - [20, 0.0]
  - - [1856, 1984, 1, 1024]
    - [110, 0.0]
  - - [1984, 1984, 1, 1024]
    - [20, 0.0]
  - - [192, 64, 1, 2048]
    - [187, 0.0]
  - - [448, 64, 1, 2048]
    - [19, 0.0]
  - - [704, 64, 1, 2048]
    - [27, 0.0]
  - - [960, 64, 1, 2048]
    - [27, 0.0]
  - - [1216, 64, 1, 2048]
    - [19, 0.0]
  - - [1472, 64, 1, 2048]
    - [28, 0.0]
  - - [1728, 64, 1, 2048]
    - [27, 0.0]
  - - [1984, 64, 1, 2048]
    - [28, 0.0]
  - - [64, 192, 1, 2048]
    - [116, 0.0]
  - - [192, 192, 1, 2048]
    - [28, 0.0]
  - - [320, 192, 1, 2048]
    - [28, 0.0]
  - - [448, 192, 1, 2048]
    - [27, 0.0]
  - - [576, 192, 1, 2048]
    - [27, 0.0]
  - - [704, 192, 1, 2048]
    - [77, 0.0]
  - - [832, 192, 1, 2048]
    - [28, 0.0]
  - - [960, 192, 1, 2048]
    - [19, 0.0]
  - - [1088, 192, 1, 2048]
    - [77, 0.0]
  - - [1216, 192, 1, 2048]
    - [19, 0.0]
  - - [1344, 192, 1, 2048]
    - [19, 0.0]
  - - [1472, 192, 1, 2048]
    - [23, 0.0]
  - - [1600, 192, 1, 2048]
    - [28, 0.0]
  - - [1728, 192, 1, 2048]
    - [23, 0.0]
  - - [1856, 192, 1, 2048]
    - [23, 0.0]
  - - [1984, 192, 1, 2048]
    - [23, 0.0]
  - - [192, 320, 1, 2048]
    - [77, 0.0]
  - - [448, 320, 1, 2048]
    - [77, 0.0]
  - - [704, 320, 1, 2048]
    - [28, 0.0]
  - - [960, 320, 1, 2048]
    - [117, 0.0]
  - - [1216, 320, 1, 2048]
    - [23, 0.0]
  - - [1472, 320, 1, 2048]
    - [20, 0.0]
  - - [1728, 320, 1, 2048]
    - [20, 0.0]
  - - [1984, 320, 1, 2048]
    - [20, 0.0]
  - - [64, 448, 1, 2048]
    - [19, 0.0]
  - - [192, 448, 1, 2048]
    - [19, 0.0]
  - - [320, 448, 1, 2048]
    - [77, 0.0]
  - - [448, 448, 1, 2048]
    - [20, 0.0]
  - - [576, 448, 1, 2048]
    - [77, 0.0]
  - - [704, 448, 1, 2048]
    - [117, 0.0]
  - - [832, 448, 1, 2048]
    - [118, 0.0]
  - - [960, 448, 1, 2048]
    - [23, 0.0]
  - - [1088, 448, 1, 2048]
    - [20, 0.0]
  - - [1216, 448, 1, 2048]
    - [20, 0.0]
  - - [1344, 448, 1, 2048]
    - [110, 0.0]
  - - [1472, 448, 1, 2048]
    - [20, 0.0]
  - - [1600, 448, 1, 2048]
    - [23, 0.0]
  - - [1728, 448, 1, 2048]
    - [23, 0.0]
  - - [1856, 448, 1, 2048]
    - [23, 0.0]
  - - [1984, 448, 1, 2048]
    - [23, 0.0]
  - - [192, 576, 1, 2048]
    - [88, 0.0]
  - - [448, 576, 1, 2048]
    - [27, 0.0]
  - - [704, 576, 1, 2048]
    - [117, 0.0]
  - - [960, 576, 1, 2048]
    - [20, 0.0]
  - - [1216, 576, 1, 2048]
    - [120, 0.0]
  - - [1472, 576, 1, 2048]
    - [23, 0.0]
  - - [1728, 576, 1, 2048]
    - [110, 0.0]
  - - [1984, 576, 1, 2048]
    - [20, 0.0]
  - - [64, 704, 1, 2048]
    - [27, 0.0]
  - - [192, 704, 1, 2048]
    - [28, 0.0]
  - - [320, 704, 1, 2048]
    - [19, 0.0]
  - - [448, 704, 1, 2048]
    - [117, 0.0]
  - - [576, 704, 1, 2048]
    - [117, 0.0]
  - - [704, 704, 1, 2048]
    - [20, 0.0]
  - - [832, 704, 1, 2048]
    - [20, 0.0]
  - - [960, 704, 1, 2048]
    - [110, 0.0]
  - - [1088, 704, 1, 2048]
    - [120, 0.0]
  - - [1216, 704, 1, 2048]
    - [120, 0.0]
  - - [1344, 704, 1, 2048]
    - [110, 0.0]
  - - [1472, 704, 1, 2048]
    - [20, 0.0]
  - - [1600, 704, 1, 2048]
    - [20, 0.0]
  - - [1728, 704, 1, 2048]
    - [120, 0.0]
  - - [1856, 704, 1, 2048]
    - [20, 0.0]
  - - [1984, 704, 1, 2048]
    - [20, 0.0]
  - - [192, 832, 1, 2048]
    - [19, 0.0]
  - - [448, 832, 1, 2048]
    - [117, 0.0]
  - - [704, 832, 1, 2048]
    - [20, 0.0]
  - - [960, 832, 1, 2048]
    - [23, 0.0]
  - - [1216, 832, 1, 2048]
    - [110, 0.0]
  - - [1472, 832, 1, 2048]
    - [23, 0.0]
  - - [1728, 832, 1, 2048]
    - [110, 0.0]
  - - [1984, 832, 1, 2048]
    - [20, 0.0]
  - - [64, 960, 1, 2048]
    - [27, 0.0]
  - - [192, 960, 1, 2048]
    - [19, 0.0]
  - - [320, 960, 1, 2048]
    - [23, 0.0]
  - - [448, 960, 1, 2048]
    - [23, 0.0]
  - - [576, 960, 1, 2048]
    - [20, 0.0]
  - - [704, 960, 1, 2048]
    - [20, 0.0]
  - - [832, 960, 1, 2048]
    - [23, 0.0]
  - - [960, 960, 1, 2048]
    - [23, 0.0]
  - - [1088, 960, 1, 2048]
    - [110, 0.0]
  - - [1216, 960, 1, 2048]
    - [110, 0.0]
  - - [1344, 960, 1, 2048]
    - [120, 0.0]
  - - [1472, 960, 1, 2048]
    - [23, 0.0]
  - - [1600, 960, 1, 2048]
    - [20, 0.0]
  - - [1728, 960, 1, 2048]
    - [20, 0.0]
  - - [1856, 960, 1, 2048]
    - [23, 0.0]
  - - [1984, 960, 1, 2048]
    - [20, 0.0]
  - - [192, 1088, 1, 2048]
    - [88, 0.0]
  - - [448, 1088, 1, 2048]
    - [20, 0.0]
  - - [704, 1088, 1, 2048]
    - [23, 0.0]
  - - [960, 1088, 1, 2048]
    - [20, 0.0]
  - - [1216, 1088, 1, 2048]
    - [23, 0.0]
  - - [1472, 1088, 1, 2048]
    - [20, 0.0]
  - - [1728, 1088, 1, 2048]
    - [110, 0.0]
  - - [1984, 1088, 1, 2048]
    - [110, 0.0]
  - - [64, 1216, 1, 2048]
    - [27, 0.0]
  - - [192, 1216, 1, 2048]
    - [28, 0.0]
  - - [320, 1216, 1, 2048]
    - [117, 0.0]
  - - [448, 1216, 1, 2048]
    - [20, 0.0]
  - - [576, 1216, 1, 2048]
    - [23, 0.0]
  - - [704, 1216, 1, 2048]
    - [23, 0.0]
  - - [832, 1216, 1, 2048]
    - [20, 0.0]
  - - [960, 1216, 1, 2048]
    - [20, 0.0]
  - - [1088, 1216, 1, 2048]
    - [23, 0.0]
  - - [1216, 1216, 1, 2048]
    - [20, 0.0]
  - - [1344, 1216, 1, 2048]
    - [20, 0.0]
  - - [1472, 1216, 1, 2048]
    - [23, 0.0]
  - - [1600, 1216, 1, 2048]
    - [20, 0.0]
  - - [1728, 1216, 1, 2048]
    - [20, 0.0]
  - - [1856, 1216, 1, 2048]
    - [20, 0.0]
  - - [1984, 1216, 1, 2048]
    - [20, 0.0]
  - - [192, 1344, 1, 2048]
    - [28, 0.0]
  - - [448, 1344, 1, 2048]
    - [110, 0.0]
  - - [704, 1344, 1, 2048]
    - [20, 0.0]
  - - [960, 1344, 1, 2048]
    - [23, 0.0]
  - - [1216, 1344, 1, 2048]
    - [110, 0.0]
  - - [1472, 1344, 1, 2048]
    - [20, 0.0]
  - - [1728, 1344, 1, 2048]
    - [20, 0.0]
  - - [1984, 1344, 1, 2048]
    - [54, 0.0]
  - - [64, 1472, 1, 2048]
    - [74, 0.0]
  - - [192, 1472, 1, 2048]
    - [23, 0.0]
  - - [320, 1472, 1, 2048]
    - [20, 0.0]
  - - [448, 1472, 1, 2048]
    - [20, 0.0]
  - - [576, 1472, 1, 2048]
    - [23, 0.0]
  - - [704, 1472, 1, 2048]
    - [20, 0.0]
  - - [832, 1472, 1, 2048]
    - [23, 0.0]
  - - [960, 1472, 1, 2048]
    - [20, 0.0]
  - - [1088, 1472, 1, 2048]
    - [110, 0.0]
  - - [1216, 1472, 1, 2048]
    - [20, 0.0]
  - - [1344, 1472, 1, 2048]
    - [20, 0.0]
  - - [1472, 1472, 1, 2048]
    - [20, 0.0]
  - - [1600, 1472, 1, 2048]
    - [20, 0.0]
  - - [1728, 1472, 1, 2048]
    - [20, 0.0]
  - - [1856, 1472, 1, 2048]
    - [110, 0.0]
  - - [1984, 1472, 1, 2048]
    - [20, 0.0]
  - - [192, 1600, 1, 2048]
    - [23, 0.0]
  - - [448, 1600, 1, 2048]
    - [23, 0.0]
  - - [704, 1600, 1, 2048]
    - [20, 0.0]
  - - [960, 1600, 1, 2048]
    - [20, 0.0]
  - - [1216, 1600, 1, 2048]
    - [20, 0.0]
  - - [1472, 1600, 1, 2048]
    - [20, 0.0]
  - - [1728, 1600, 1, 2048]
    - [110, 0.0]
  - - [1984, 1600, 1, 2048]
    - [20, 0.0]
  - - [64, 1728, 1, 2048]
    - [88, 0.0]
  - - [192, 1728, 1, 2048]
    - [117, 0.0]
  - - [320, 1728, 1, 2048]
    - [20, 0.0]
  - - [448, 1728, 1, 2048]
    - [117, 0.0]
  - - [576, 1728, 1, 2048]
    - [110, 0.0]
  - - [704, 1728, 1, 2048]
    - [23, 0.0]
  - - [832, 1728, 1, 2048]
    - [20, 0.0]
  - - [960, 1728, 1, 2048]
    - [20, 0.0]
  - - [1088, 1728, 1, 2048]
    - [20, 0.0]
  - - [1216, 1728, 1, 2048]
    - [20, 0.0]
  - - [1344, 1728, 1, 2048]
    - [20, 0.0]
  - - [1472, 1728, 1, 2048]
    - [20, 0.0]
  - - [1600, 1728, 1, 2048]
    - [110, 0.0]
  - - [1728, 1728, 1, 2048]
    - [110, 0.0]
  - - [1856, 1728, 1, 2048]
    - [20, 0.0]
  - - [1984, 1728, 1, 2048]
    - [20, 0.0]
  - - [192, 1856, 1, 2048]
    - [23, 0.0]
  - - [448, 1856, 1, 2048]
    - [20, 0.0]
  - - [704, 1856, 1, 2048]
    - [20, 0.0]
  - - [960, 1856, 1, 2048]
    - [20, 0.0]
  - - [1216, 1856, 1, 2048]
    - [23, 0.0]
  - - [1472, 1856, 1, 2048]
    - [20, 0.0]
  - - [1728, 1856, 1, 2048]
    - [110, 0.0]
  - - [1984, 1856, 1, 2048]
    - [20, 0.0]
  - - [64, 1984, 1, 2048]
    - [27, 0.0]
  - - [192, 1984, 1, 2048]
    - [23, 0.0]
  - - [320, 1984, 1, 2048]
    - [20, 0.0]
  - - [448, 1984, 1, 2048]
    - [110, 0.0]
  - - [576, 1984, 1, 2048]
    - [110, 0.0]
  - - [704, 1984, 1, 2048]
    - [20, 0.0]
  - - [832, 1984, 1, 2048]
    - [110, 0.0]
  - - [960, 1984, 1, 2048]
    - [20, 0.0]
  - - [1088, 1984, 1, 2048]
    - [20, 0.0]
  - - [1216, 1984, 1, 2048]
    - [110, 0.0]
  - - [1344, 1984, 1, 2048]
    - [110, 0.0]
  - - [1472, 1984, 1, 2048]
    - [20, 0.0]
  - - [1600, 1984, 1, 2048]
    - [110, 0.0]
  - - [1728, 1984, 1, 2048]
    - [20, 0.0]
  - - [1856, 1984, 1, 2048]
    - [20, 0.0]
  - - [1984, 1984, 1, 2048]
    - [20, 0.0]
  - - [192, 64, 1, 4096]
    - [26, 0.0]
  - - [448, 64, 1, 4096]
    - [27, 0.0]
  - - [704, 64, 1, 4096]
    - [27, 0.0]
  - - [960, 64, 1, 4096]
    - [27, 0.0]
  - - [1216, 64, 1, 4096]
    - [19, 0.0]
  - - [1472, 64, 1, 4096]
    - [19, 0.0]
  - - [1728, 64, 1, 4096]
    - [19, 0.0]
  - - [1984, 64, 1, 4096]
    - [19, 0.0]
  - - [64, 192, 1, 4096]
    - [68, 0.0]
  - - [192, 192, 1, 4096]
    - [27, 0.0]
  - - [320, 192, 1, 4096]
    - [28, 0.0]
  - - [448, 192, 1, 4096]
    - [27, 0.0]
  - - [576, 192, 1, 4096]
    - [19, 0.0]
  - - [704, 192, 1, 4096]
    - [28, 0.0]
  - - [832, 192, 1, 4096]
    - [71, 0.0]
  - - [960, 192, 1, 4096]
    - [28, 0.0]
  - - [1088, 192, 1, 4096]
    - [28, 0.0]
  - - [1216, 192, 1, 4096]
    - [19, 0.0]
  - - [1344, 192, 1, 4096]
    - [28, 0.0]
  - - [1472, 192, 1, 4096]
    - [23, 0.0]
  - - [1600, 192, 1, 4096]
    - [117, 0.0]
  - - [1728, 192, 1, 4096]
    - [23, 0.0]
  - - [1856, 192, 1, 4096]
    - [117, 0.0]
  - - [1984, 192, 1, 4096]
    - [23, 0.0]
  - - [192, 320, 1, 4096]
    - [27, 0.0]
  - - [448, 320, 1, 4096]
    - [28, 0.0]
  - - [704, 320, 1, 4096]
    - [71, 0.0]
  - - [960, 320, 1, 4096]
    - [117, 0.0]
  - - [1216, 320, 1, 4096]
    - [117, 0.0]
  - - [1472, 320, 1, 4096]
    - [20, 0.0]
  - - [1728, 320, 1, 4096]
    - [20, 0.0]
  - - [1984, 320, 1, 4096]
    - [20, 0.0]
  - - [64, 448, 1, 4096]
    - [19, 0.0]
  - - [192, 448, 1, 4096]
    - [19, 0.0]
  - - [320, 448, 1, 4096]
    - [28, 0.0]
  - - [448, 448, 1, 4096]
    - [110, 0.0]
  - - [576, 448, 1, 4096]
    - [27, 0.0]
  - - [704, 448, 1, 4096]
    - [118, 0.0]
  - - [832, 448, 1, 4096]
    - [118, 0.0]
  - - [960, 448, 1, 4096]
    - [23, 0.0]
  - - [1088, 448, 1, 4096]
    - [20, 0.0]
  - - [1216, 448, 1, 4096]
    - [20, 0.0]
  - - [1344, 448, 1, 4096]
    - [20, 0.0]
  - - [1472, 448, 1, 4096]
    - [110, 0.0]
  - - [1600, 448, 1, 4096]
    - [23, 0.0]
  - - [1728, 448, 1, 4096]
    - [23, 0.0]
  - - [1856, 448, 1, 4096]
    - [120, 0.0]
  - - [1984, 448, 1, 4096]
    - [118, 0.0]
  - - [192, 576, 1, 4096]
    - [88, 0.0]
  - - [448, 576, 1, 4096]
    - [77, 0.0]
  - - [704, 576, 1, 4096]
    - [117, 0.0]
  - - [960, 576, 1, 4096]
    - [20, 0.0]
  - - [1216, 576, 1, 4096]
    - [117, 0.0]
  - - [1472, 576, 1, 4096]
    - [120, 0.0]
  - - [1728, 576, 1, 4096]
    - [20, 0.0]
  - - [1984, 576, 1, 4096]
    - [110, 0.0]
  - - [64, 704, 1, 4096]
    - [27, 0.0]
  - - [192, 704, 1, 4096]
    - [104, 0.0]
  - - [320, 704, 1, 4096]
    - [19, 0.0]
  - - [448, 704, 1, 4096]
    - [117, 0.0]
  - - [576, 704, 1, 4096]
    - [117, 0.0]
  - - [704, 704, 1, 4096]
    - [20, 0.0]
  - - [832, 704, 1, 4096]
    - [20, 0.0]
  - - [960, 704, 1, 4096]
    - [20, 0.0]
  - - [1088, 704, 1, 4096]
    - [120, 0.0]
  - - [1216, 704, 1, 4096]
    - [23, 0.0]
  - - [1344, 704, 1, 4096]
    - [20, 0.0]
  - - [1472, 704, 1, 4096]
    - [20, 0.0]
  - - [1600, 704, 1, 4096]
    - [20, 0.0]
  - - [1728, 704, 1, 4096]
    - [23, 0.0]
  - - [1856, 704, 1, 4096]
    - [120, 0.0]
  - - [1984, 704, 1, 4096]
    - [118, 0.0]
  - - [192, 832, 1, 4096]
    - [77, 0.0]
  - - [448, 832, 1, 4096]
    - [117, 0.0]
  - - [704, 832, 1, 4096]
    - [20, 0.0]
  - - [960, 832, 1, 4096]
    - [120, 0.0]
  - - [1216, 832, 1, 4096]
    - [20, 0.0]
  - - [1472, 832, 1, 4096]
    - [23, 0.0]
  - - [1728, 832, 1, 4096]
    - [54, 0.0]
  - - [1984, 832, 1, 4096]
    - [20, 0.0]
  - - [64, 960, 1, 4096]
    - [28, 0.0]
  - - [192, 960, 1, 4096]
    - [104, 0.0]
  - - [320, 960, 1, 4096]
    - [23, 0.0]
  - - [448, 960, 1, 4096]
    - [117, 0.0]
  - - [576, 960, 1, 4096]
    - [20, 0.0]
  - - [704, 960, 1, 4096]
    - [110, 0.0]
  - - [832, 960, 1, 4096]
    - [120, 0.0]
  - - [960, 960, 1, 4096]
    - [23, 0.0]
  - - [1088, 960, 1, 4096]
    - [20, 0.0]
  - - [1216, 960, 1, 4096]
    - [110, 0.0]
  - - [1344, 960, 1, 4096]
    - [23, 0.0]
  - - [1472, 960, 1, 4096]
    - [120, 0.0]
  - - [1600, 960, 1, 4096]
    - [20, 0.0]
  - - [1728, 960, 1, 4096]
    - [20, 0.0]
  - - [1856, 960, 1, 4096]
    - [120, 0.0]
  - - [1984, 960, 1, 4096]
    - [118, 0.0]
  - - [192, 1088, 1, 4096]
    - [88, 0.0]
  - - [448, 1088, 1, 4096]
    - [20, 0.0]
  - - [704, 1088, 1, 4096]
    - [23, 0.0]
  - - [960, 1088, 1, 4096]
    - [20, 0.0]
  - - [1216, 1088, 1, 4096]
    - [23, 0.0]
  - - [1472, 1088, 1, 4096]
    - [20, 0.0]
  - - [1728, 1088, 1, 4096]
    - [120, 0.0]
  - - [1984, 1088, 1, 4096]
    - [20, 0.0]
  - - [64, 1216, 1, 4096]
    - [27, 0.0]
  - - [192, 1216, 1, 4096]
    - [19, 0.0]
  - - [320, 1216, 1, 4096]
    - [23, 0.0]
  - - [448, 1216, 1, 4096]
    - [20, 0.0]
  - - [576, 1216, 1, 4096]
    - [23, 0.0]
  - - [704, 1216, 1, 4096]
    - [23, 0.0]
  - - [832, 1216, 1, 4096]
    - [110, 0.0]
  - - [960, 1216, 1, 4096]
    - [20, 0.0]
  - - [1088, 1216, 1, 4096]
    - [23, 0.0]
  - - [1216, 1216, 1, 4096]
    - [110, 0.0]
  - - [1344, 1216, 1, 4096]
    - [110, 0.0]
  - - [1472, 1216, 1, 4096]
    - [23, 0.0]
  - - [1600, 1216, 1, 4096]
    - [110, 0.0]
  - - [1728, 1216, 1, 4096]
    - [110, 0.0]
  - - [1856, 1216, 1, 4096]
    - [23, 0.0]
  - - [1984, 1216, 1, 4096]
    - [20, 0.0]
  - - [192, 1344, 1, 4096]
    - [77, 0.0]
  - - [448, 1344, 1, 4096]
    - [110, 0.0]
  - - [704, 1344, 1, 4096]
    - [20, 0.0]
  - - [960, 1344, 1, 4096]
    - [117, 0.0]
  - - [1216, 1344, 1, 4096]
    - [110, 0.0]
  - - [1472, 1344, 1, 4096]
    - [20, 0.0]
  - - [1728, 1344, 1, 4096]
    - [117, 0.0]
  - - [1984, 1344, 1, 4096]
    - [110, 0.0]
  - - [64, 1472, 1, 4096]
    - [19, 0.0]
  - - [192, 1472, 1, 4096]
    - [117, 0.0]
  - - [320, 1472, 1, 4096]
    - [54, 0.0]
  - - [448, 1472, 1, 4096]
    - [20, 0.0]
  - - [576, 1472, 1, 4096]
    - [23, 0.0]
  - - [704, 1472, 1, 4096]
    - [20, 0.0]
  - - [832, 1472, 1, 4096]
    - [23, 0.0]
  - - [960, 1472, 1, 4096]
    - [23, 0.0]
  - - [1088, 1472, 1, 4096]
    - [20, 0.0]
  - - [1216, 1472, 1, 4096]
    - [20, 0.0]
  - - [1344, 1472, 1, 4096]
    - [20, 0.0]
  - - [1472, 1472, 1, 4096]
    - [20, 0.0]
  - - [1600, 1472, 1, 4096]
    - [110, 0.0]
  - - [1728, 1472, 1, 4096]
    - [20, 0.0]
  - - [1856, 1472, 1, 4096]
    - [23, 0.0]
  - - [1984, 1472, 1, 4096]
    - [20, 0.0]
  - - [192, 1600, 1, 4096]
    - [118, 0.0]
  - - [448, 1600, 1, 4096]
    - [23, 0.0]
  - - [704, 1600, 1, 4096]
    - [20, 0.0]
  - - [960, 1600, 1, 4096]
    - [20, 0.0]
  - - [1216, 1600, 1, 4096]
    - [110, 0.0]
  - - [1472, 1600, 1, 4096]
    - [20, 0.0]
  - - [1728, 1600, 1, 4096]
    - [118, 0.0]
  - - [1984, 1600, 1, 4096]
    - [20, 0.0]
  - - [64, 1728, 1, 4096]
    - [19, 0.0]
  - - [192, 1728, 1, 4096]
    - [117, 0.0]
  - - [320, 1728, 1, 4096]
    - [20, 0.0]
  - - [448, 1728, 1, 4096]
    - [120, 0.0]
  - - [576, 1728, 1, 4096]
    - [20, 0.0]
  - - [704, 1728, 1, 4096]
    - [117, 0.0]
  - - [832, 1728, 1, 4096]
    - [20, 0.0]
  - - [960, 1728, 1, 4096]
    - [20, 0.0]
  - - [1088, 1728, 1, 4096]
    - [23, 0.0]
  - - [1216, 1728, 1, 4096]
    - [110, 0.0]
  - - [1344, 1728, 1, 4096]
    - [20, 0.0]
  - - [1472, 1728, 1, 4096]
    - [111, 0.0]
  - - [1600, 1728, 1, 4096]
    - [110, 0.0]
  - - [1728, 1728, 1, 4096]
    - [20, 0.0]
  - - [1856, 1728, 1, 4096]
    - [118, 0.0]
  - - [1984, 1728, 1, 4096]
    - [110, 0.0]
  - - [192, 1856, 1, 4096]
    - [117, 0.0]
  - - [448, 1856, 1, 4096]
    - [23, 0.0]
  - - [704, 1856, 1, 4096]
    - [23, 0.0]
  - - [960, 1856, 1, 4096]
    - [23, 0.0]
  - - [1216, 1856, 1, 4096]
    - [23, 0.0]
  - - [1472, 1856, 1, 4096]
    - [23, 0.0]
  - - [1728, 1856, 1, 4096]
    - [118, 0.0]
  - - [1984, 1856, 1, 4096]
    - [20, 0.0]
  - - [64, 1984, 1, 4096]
    - [19, 0.0]
  - - [192, 1984, 1, 4096]
    - [23, 0.0]
  - - [320, 1984, 1, 4096]
    - [20, 0.0]
  - - [448, 1984, 1, 4096]
    - [23, 0.0]
  - - [576, 1984, 1, 4096]
    - [110, 0.0]
  - - [704, 1984, 1, 4096]
    - [23, 0.0]
  - - [832, 1984, 1, 4096]
    - [20, 0.0]
  - - [960, 1984, 1, 4096]
    - [20, 0.0]
  - - [1088, 1984, 1, 4096]
    - [20, 0.0]
  - - [1216, 1984, 1, 4096]
    - [20, 0.0]
  - - [1344, 1984, 1, 4096]
    - [20, 0.0]
  - - [1472, 1984, 1, 4096]
    - [20, 0.0]
  - - [1600, 1984, 1, 4096]
    - [20, 0.0]
  - - [1728, 1984, 1, 4096]
    - [110, 0.0]
  - - [1856, 1984, 1, 4096]
    - [20, 0.0]
  - - [1984, 1984, 1, 4096]
    - [20, 0.0]
  - - [128, 64, 1, 64]
    - [24, 0.0]
  - - [256, 64, 1, 64]
    - [152, 0.0]
  - - [384, 64, 1, 64]
    - [74, 0.0]
  - - [512, 64, 1, 64]
    - [153, 0.0]
  - - [640, 64, 1, 64]
    - [153, 0.0]
  - - [768, 64, 1, 64]
    - [27, 0.0]
  - - [896, 64, 1, 64]
    - [155, 0.0]
  - - [1024, 64, 1, 64]
    - [78, 0.0]
  - - [64, 128, 1, 64]
    - [156, 0.0]
  - - [128, 128, 1, 64]
    - [157, 0.0]
  - - [192, 128, 1, 64]
    - [142, 0.0]
  - - [256, 128, 1, 64]
    - [158, 0.0]
  - - [320, 128, 1, 64]
    - [48, 0.0]
  - - [384, 128, 1, 64]
    - [41, 0.0]
  - - [448, 128, 1, 64]
    - [41, 0.0]
  - - [512, 128, 1, 64]
    - [73, 0.0]
  - - [576, 128, 1, 64]
    - [45, 0.0]
  - - [640, 128, 1, 64]
    - [27, 0.0]
  - - [704, 128, 1, 64]
    - [88, 0.0]
  - - [768, 128, 1, 64]
    - [19, 0.0]
  - - [832, 128, 1, 64]
    - [103, 0.0]
  - - [896, 128, 1, 64]
    - [19, 0.0]
  - - [960, 128, 1, 64]
    - [73, 0.0]
  - - [1024, 128, 1, 64]
    - [28, 0.0]
  - - [128, 192, 1, 64]
    - [24, 0.0]
  - - [256, 192, 1, 64]
    - [160, 0.0]
  - - [384, 192, 1, 64]
    - [103, 0.0]
  - - [512, 192, 1, 64]
    - [41, 0.0]
  - - [640, 192, 1, 64]
    - [19, 0.0]
  - - [768, 192, 1, 64]
    - [27, 0.0]
  - - [896, 192, 1, 64]
    - [103, 0.0]
  - - [1024, 192, 1, 64]
    - [77, 0.0]
  - - [64, 256, 1, 64]
    - [161, 0.0]
  - - [128, 256, 1, 64]
    - [98, 0.0]
  - - [192, 256, 1, 64]
    - [19, 0.0]
  - - [256, 256, 1, 64]
    - [160, 0.0]
  - - [320, 256, 1, 64]
    - [19, 0.0]
  - - [384, 256, 1, 64]
    - [27, 0.0]
  - - [448, 256, 1, 64]
    - [73, 0.0]
  - - [512, 256, 1, 64]
    - [79, 0.0]
  - - [576, 256, 1, 64]
    - [78, 0.0]
  - - [640, 256, 1, 64]
    - [73, 0.0]
  - - [704, 256, 1, 64]
    - [42, 0.0]
  - - [768, 256, 1, 64]
    - [103, 0.0]
  - - [832, 256, 1, 64]
    - [141, 0.0]
  - - [896, 256, 1, 64]
    - [65, 0.0]
  - - [960, 256, 1, 64]
    - [28, 0.0]
  - - [1024, 256, 1, 64]
    - [19, 0.0]
  - - [128, 320, 1, 64]
    - [27, 0.0]
  - - [256, 320, 1, 64]
    - [35, 0.0]
  - - [384, 320, 1, 64]
    - [36, 0.0]
  - - [512, 320, 1, 64]
    - [42, 0.0]
  - - [640, 320, 1, 64]
    - [73, 0.0]
  - - [768, 320, 1, 64]
    - [73, 0.0]
  - - [896, 320, 1, 64]
    - [103, 0.0]
  - - [1024, 320, 1, 64]
    - [73, 0.0]
  - - [64, 384, 1, 64]
    - [68, 0.0]
  - - [128, 384, 1, 64]
    - [27, 0.0]
  - - [192, 384, 1, 64]
    - [45, 0.0]
  - - [256, 384, 1, 64]
    - [103, 0.0]
  - - [320, 384, 1, 64]
    - [19, 0.0]
  - - [384, 384, 1, 64]
    - [78, 0.0]
  - - [448, 384, 1, 64]
    - [19, 0.0]
  - - [512, 384, 1, 64]
    - [19, 0.0]
  - - [576, 384, 1, 64]
    - [137, 0.0]
  - - [640, 384, 1, 64]
    - [27, 0.0]
  - - [704, 384, 1, 64]
    - [139, 0.0]
  - - [768, 384, 1, 64]
    - [103, 0.0]
  - - [832, 384, 1, 64]
    - [73, 0.0]
  - - [896, 384, 1, 64]
    - [54, 0.0]
  - - [960, 384, 1, 64]
    - [43, 0.0]
  - - [1024, 384, 1, 64]
    - [55, 0.0]
  - - [128, 448, 1, 64]
    - [165, 0.0]
  - - [256, 448, 1, 64]
    - [77, 0.0]
  - - [384, 448, 1, 64]
    - [78, 0.0]
  - - [512, 448, 1, 64]
    - [166, 0.0]
  - - [640, 448, 1, 64]
    - [80, 0.0]
  - - [768, 448, 1, 64]
    - [41, 0.0]
  - - [896, 448, 1, 64]
    - [47, 0.0]
  - - [1024, 448, 1, 64]
    - [167, 0.0]
  - - [64, 512, 1, 64]
    - [168, 0.0]
  - - [128, 512, 1, 64]
    - [27, 0.0]
  - - [192, 512, 1, 64]
    - [35, 0.0]
  - - [256, 512, 1, 64]
    - [137, 0.0]
  - - [320, 512, 1, 64]
    - [28, 0.0]
  - - [384, 512, 1, 64]
    - [19, 0.0]
  - - [448, 512, 1, 64]
    - [73, 0.0]
  - - [576, 512, 1, 64]
    - [28, 0.0]
  - - [640, 512, 1, 64]
    - [103, 0.0]
  - - [704, 512, 1, 64]
    - [47, 0.0]
  - - [768, 512, 1, 64]
    - [170, 0.0]
  - - [832, 512, 1, 64]
    - [38, 0.0]
  - - [896, 512, 1, 64]
    - [55, 0.0]
  - - [960, 512, 1, 64]
    - [44, 0.0]
  - - [128, 576, 1, 64]
    - [27, 0.0]
  - - [256, 576, 1, 64]
    - [78, 0.0]
  - - [384, 576, 1, 64]
    - [28, 0.0]
  - - [512, 576, 1, 64]
    - [171, 0.0]
  - - [640, 576, 1, 64]
    - [38, 0.0]
  - - [768, 576, 1, 64]
    - [172, 0.0]
  - - [896, 576, 1, 64]
    - [43, 0.0]
  - - [1024, 576, 1, 64]
    - [43, 0.0]
  - - [64, 640, 1, 64]
    - [98, 0.0]
  - - [128, 640, 1, 64]
    - [103, 0.0]
  - - [192, 640, 1, 64]
    - [48, 0.0]
  - - [256, 640, 1, 64]
    - [36, 0.0]
  - - [320, 640, 1, 64]
    - [35, 0.0]
  - - [384, 640, 1, 64]
    - [36, 0.0]
  - - [448, 640, 1, 64]
    - [139, 0.0]
  - - [512, 640, 1, 64]
    - [20, 0.0]
  - - [576, 640, 1, 64]
    - [43, 0.0]
  - - [640, 640, 1, 64]
    - [173, 0.0]
  - - [704, 640, 1, 64]
    - [43, 0.0]
  - - [768, 640, 1, 64]
    - [56, 0.0]
  - - [832, 640, 1, 64]
    - [45, 0.0]
  - - [896, 640, 1, 64]
    - [55, 0.0]
  - - [960, 640, 1, 64]
    - [43, 0.0]
  - - [1024, 640, 1, 64]
    - [59, 0.0]
  - - [128, 704, 1, 64]
    - [141, 0.0]
  - - [256, 704, 1, 64]
    - [139, 0.0]
  - - [384, 704, 1, 64]
    - [36, 0.0]
  - - [512, 704, 1, 64]
    - [172, 0.0]
  - - [640, 704, 1, 64]
    - [41, 0.0]
  - - [768, 704, 1, 64]
    - [138, 0.0]
  - - [896, 704, 1, 64]
    - [64, 0.0]
  - - [1024, 704, 1, 64]
    - [55, 0.0]
  - - [64, 768, 1, 64]
    - [174, 0.0]
  - - [128, 768, 1, 64]
    - [27, 0.0]
  - - [192, 768, 1, 64]
    - [19, 0.0]
  - - [256, 768, 1, 64]
    - [45, 0.0]
  - - [320, 768, 1, 64]
    - [36, 0.0]
  - - [384, 768, 1, 64]
    - [73, 0.0]
  - - [448, 768, 1, 64]
    - [41, 0.0]
  - - [512, 768, 1, 64]
    - [59, 0.0]
  - - [576, 768, 1, 64]
    - [45, 0.0]
  - - [640, 768, 1, 64]
    - [20, 0.0]
  - - [704, 768, 1, 64]
    - [29, 0.0]
  - - [768, 768, 1, 64]
    - [20, 0.0]
  - - [832, 768, 1, 64]
    - [51, 0.0]
  - - [896, 768, 1, 64]
    - [55, 0.0]
  - - [960, 768, 1, 64]
    - [45, 0.0]
  - - [1024, 768, 1, 64]
    - [20, 0.0]
  - - [128, 832, 1, 64]
    - [27, 0.0]
  - - [256, 832, 1, 64]
    - [45, 0.0]
  - - [384, 832, 1, 64]
    - [73, 0.0]
  - - [512, 832, 1, 64]
    - [172, 0.0]
  - - [640, 832, 1, 64]
    - [45, 0.0]
  - - [768, 832, 1, 64]
    - [55, 0.0]
  - - [896, 832, 1, 64]
    - [54, 0.0]
  - - [1024, 832, 1, 64]
    - [56, 0.0]
  - - [64, 896, 1, 64]
    - [29, 0.0]
  - - [128, 896, 1, 64]
    - [80, 0.0]
  - - [192, 896, 1, 64]
    - [73, 0.0]
  - - [256, 896, 1, 64]
    - [137, 0.0]
  - - [320, 896, 1, 64]
    - [73, 0.0]
  - - [384, 896, 1, 64]
    - [175, 0.0]
  - - [448, 896, 1, 64]
    - [41, 0.0]
  - - [512, 896, 1, 64]
    - [120, 0.0]
  - - [576, 896, 1, 64]
    - [43, 0.0]
  - - [640, 896, 1, 64]
    - [55, 0.0]
  - - [704, 896, 1, 64]
    - [29, 0.0]
  - - [768, 896, 1, 64]
    - [55, 0.0]
  - - [832, 896, 1, 64]
    - [45, 0.0]
  - - [896, 896, 1, 64]
    - [54, 0.0]
  - - [960, 896, 1, 64]
    - [29, 0.0]
  - - [1024, 896, 1, 64]
    - [59, 0.0]
  - - [128, 960, 1, 64]
    - [27, 0.0]
  - - [256, 960, 1, 64]
    - [65, 0.0]
  - - [384, 960, 1, 64]
    - [47, 0.0]
  - - [512, 960, 1, 64]
    - [120, 0.0]
  - - [640, 960, 1, 64]
    - [55, 0.0]
  - - [768, 960, 1, 64]
    - [56, 0.0]
  - - [896, 960, 1, 64]
    - [20, 0.0]
  - - [1024, 960, 1, 64]
    - [56, 0.0]
  - - [64, 1024, 1, 64]
    - [160, 0.0]
  - - [128, 1024, 1, 64]
    - [73, 0.0]
  - - [192, 1024, 1, 64]
    - [73, 0.0]
  - - [256, 1024, 1, 64]
    - [80, 0.0]
  - - [320, 1024, 1, 64]
    - [19, 0.0]
  - - [384, 1024, 1, 64]
    - [54, 0.0]
  - - [448, 1024, 1, 64]
    - [44, 0.0]
  - - [576, 1024, 1, 64]
    - [43, 0.0]
  - - [640, 1024, 1, 64]
    - [20, 0.0]
  - - [704, 1024, 1, 64]
    - [42, 0.0]
  - - [768, 1024, 1, 64]
    - [55, 0.0]
  - - [832, 1024, 1, 64]
    - [45, 0.0]
  - - [896, 1024, 1, 64]
    - [55, 0.0]
  - - [960, 1024, 1, 64]
    - [45, 0.0]
  - - [128, 64, 1, 256]
    - [149, 0.0]
  - - [256, 64, 1, 256]
    - [149, 0.0]
  - - [384, 64, 1, 256]
    - [116, 0.0]
  - - [512, 64, 1, 256]
    - [180, 0.0]
  - - [640, 64, 1, 256]
    - [78, 0.0]
  - - [768, 64, 1, 256]
    - [28, 0.0]
  - - [896, 64, 1, 256]
    - [27, 0.0]
  - - [1024, 64, 1, 256]
    - [77, 0.0]
  - - [64, 128, 1, 256]
    - [178, 0.0]
  - - [128, 128, 1, 256]
    - [152, 0.0]
  - - [192, 128, 1, 256]
    - [135, 0.0]
  - - [256, 128, 1, 256]
    - [27, 0.0]
  - - [320, 128, 1, 256]
    - [27, 0.0]
  - - [384, 128, 1, 256]
    - [77, 0.0]
  - - [448, 128, 1, 256]
    - [77, 0.0]
  - - [512, 128, 1, 256]
    - [19, 0.0]
  - - [576, 128, 1, 256]
    - [27, 0.0]
  - - [640, 128, 1, 256]
    - [19, 0.0]
  - - [704, 128, 1, 256]
    - [35, 0.0]
  - - [768, 128, 1, 256]
    - [103, 0.0]
  - - [832, 128, 1, 256]
    - [78, 0.0]
  - - [896, 128, 1, 256]
    - [19, 0.0]
  - - [960, 128, 1, 256]
    - [80, 0.0]
  - - [1024, 128, 1, 256]
    - [27, 0.0]
  - - [128, 192, 1, 256]
    - [182, 0.0]
  - - [256, 192, 1, 256]
    - [19, 0.0]
  - - [384, 192, 1, 256]
    - [19, 0.0]
  - - [512, 192, 1, 256]
    - [36, 0.0]
  - - [640, 192, 1, 256]
    - [73, 0.0]
  - - [768, 192, 1, 256]
    - [73, 0.0]
  - - [896, 192, 1, 256]
    - [19, 0.0]
  - - [1024, 192, 1, 256]
    - [27, 0.0]
  - - [64, 256, 1, 256]
    - [180, 0.0]
  - - [128, 256, 1, 256]
    - [98, 0.0]
  - - [192, 256, 1, 256]
    - [27, 0.0]
  - - [320, 256, 1, 256]
    - [78, 0.0]
  - - [384, 256, 1, 256]
    - [36, 0.0]
  - - [448, 256, 1, 256]
    - [73, 0.0]
  - - [512, 256, 1, 256]
    - [74, 0.0]
  - - [576, 256, 1, 256]
    - [28, 0.0]
  - - [640, 256, 1, 256]
    - [78, 0.0]
  - - [704, 256, 1, 256]
    - [36, 0.0]
  - - [768, 256, 1, 256]
    - [77, 0.0]
  - - [832, 256, 1, 256]
    - [77, 0.0]
  - - [896, 256, 1, 256]
    - [20, 0.0]
  - - [960, 256, 1, 256]
    - [28, 0.0]
  - - [1024, 256, 1, 256]
    - [20, 0.0]
  - - [128, 320, 1, 256]
    - [27, 0.0]
  - - [256, 320, 1, 256]
    - [77, 0.0]
  - - [384, 320, 1, 256]
    - [103, 0.0]
  - - [512, 320, 1, 256]
    - [28, 0.0]
  - - [640, 320, 1, 256]
    - [19, 0.0]
  - - [768, 320, 1, 256]
    - [77, 0.0]
  - - [896, 320, 1, 256]
    - [28, 0.0]
  - - [1024, 320, 1, 256]
    - [19, 0.0]
  - - [64, 384, 1, 256]
    - [116, 0.0]
  - - [128, 384, 1, 256]
    - [28, 0.0]
  - - [192, 384, 1, 256]
    - [19, 0.0]
  - - [256, 384, 1, 256]
    - [103, 0.0]
  - - [320, 384, 1, 256]
    - [73, 0.0]
  - - [384, 384, 1, 256]
    - [77, 0.0]
  - - [448, 384, 1, 256]
    - [27, 0.0]
  - - [512, 384, 1, 256]
    - [74, 0.0]
  - - [576, 384, 1, 256]
    - [28, 0.0]
  - - [640, 384, 1, 256]
    - [54, 0.0]
  - - [704, 384, 1, 256]
    - [65, 0.0]
  - - [768, 384, 1, 256]
    - [120, 0.0]
  - - [832, 384, 1, 256]
    - [77, 0.0]
  - - [896, 384, 1, 256]
    - [167, 0.0]
  - - [960, 384, 1, 256]
    - [19, 0.0]
  - - [1024, 384, 1, 256]
    - [23, 0.0]
  - - [128, 448, 1, 256]
    - [19, 0.0]
  - - [256, 448, 1, 256]
    - [19, 0.0]
  - - [384, 448, 1, 256]
    - [19, 0.0]
  - - [512, 448, 1, 256]
    - [77, 0.0]
  - - [640, 448, 1, 256]
    - [27, 0.0]
  - - [768, 448, 1, 256]
    - [118, 0.0]
  - - [896, 448, 1, 256]
    - [120, 0.0]
  - - [1024, 448, 1, 256]
    - [120, 0.0]
  - - [64, 512, 1, 256]
    - [19, 0.0]
  - - [128, 512, 1, 256]
    - [78, 0.0]
  - - [192, 512, 1, 256]
    - [78, 0.0]
  - - [256, 512, 1, 256]
    - [73, 0.0]
  - - [320, 512, 1, 256]
    - [28, 0.0]
  - - [384, 512, 1, 256]
    - [137, 0.0]
  - - [448, 512, 1, 256]
    - [77, 0.0]
  - - [576, 512, 1, 256]
    - [19, 0.0]
  - - [640, 512, 1, 256]
    - [120, 0.0]
  - - [704, 512, 1, 256]
    - [78, 0.0]
  - - [768, 512, 1, 256]
    - [120, 0.0]
  - - [832, 512, 1, 256]
    - [28, 0.0]
  - - [896, 512, 1, 256]
    - [23, 0.0]
  - - [960, 512, 1, 256]
    - [28, 0.0]
  - - [128, 576, 1, 256]
    - [78, 0.0]
  - - [256, 576, 1, 256]
    - [28, 0.0]
  - - [384, 576, 1, 256]
    - [28, 0.0]
  - - [512, 576, 1, 256]
    - [77, 0.0]
  - - [640, 576, 1, 256]
    - [118, 0.0]
  - - [768, 576, 1, 256]
    - [23, 0.0]
  - - [896, 576, 1, 256]
    - [55, 0.0]
  - - [1024, 576, 1, 256]
    - [59, 0.0]
  - - [64, 640, 1, 256]
    - [19, 0.0]
  - - [128, 640, 1, 256]
    - [45, 0.0]
  - - [192, 640, 1, 256]
    - [103, 0.0]
  - - [256, 640, 1, 256]
    - [35, 0.0]
  - - [320, 640, 1, 256]
    - [28, 0.0]
  - - [384, 640, 1, 256]
    - [20, 0.0]
  - - [448, 640, 1, 256]
    - [77, 0.0]
  - - [512, 640, 1, 256]
    - [172, 0.0]
  - - [576, 640, 1, 256]
    - [27, 0.0]
  - - [640, 640, 1, 256]
    - [23, 0.0]
  - - [704, 640, 1, 256]
    - [77, 0.0]
  - - [768, 640, 1, 256]
    - [23, 0.0]
  - - [832, 640, 1, 256]
    - [19, 0.0]
  - - [896, 640, 1, 256]
    - [56, 0.0]
  - - [960, 640, 1, 256]
    - [28, 0.0]
  - - [1024, 640, 1, 256]
    - [20, 0.0]
  - - [128, 704, 1, 256]
    - [19, 0.0]
  - - [256, 704, 1, 256]
    - [103, 0.0]
  - - [384, 704, 1, 256]
    - [28, 0.0]
  - - [512, 704, 1, 256]
    - [23, 0.0]
  - - [640, 704, 1, 256]
    - [23, 0.0]
  - - [768, 704, 1, 256]
    - [183, 0.0]
  - - [896, 704, 1, 256]
    - [64, 0.0]
  - - [1024, 704, 1, 256]
    - [56, 0.0]
  - - [64, 768, 1, 256]
    - [27, 0.0]
  - - [128, 768, 1, 256]
    - [28, 0.0]
  - - [192, 768, 1, 256]
    - [147, 0.0]
  - - [256, 768, 1, 256]
    - [20, 0.0]
  - - [320, 768, 1, 256]
    - [103, 0.0]
  - - [384, 768, 1, 256]
    - [118, 0.0]
  - - [448, 768, 1, 256]
    - [28, 0.0]
  - - [512, 768, 1, 256]
    - [120, 0.0]
  - - [576, 768, 1, 256]
    - [27, 0.0]
  - - [640, 768, 1, 256]
    - [23, 0.0]
  - - [704, 768, 1, 256]
    - [19, 0.0]
  - - [768, 768, 1, 256]
    - [127, 0.0]
  - - [832, 768, 1, 256]
    - [27, 0.0]
  - - [896, 768, 1, 256]
    - [20, 0.0]
  - - [960, 768, 1, 256]
    - [28, 0.0]
  - - [1024, 768, 1, 256]
    - [20, 0.0]
  - - [128, 832, 1, 256]
    - [19, 0.0]
  - - [256, 832, 1, 256]
    - [19, 0.0]
  - - [384, 832, 1, 256]
    - [27, 0.0]
  - - [512, 832, 1, 256]
    - [120, 0.0]
  - - [640, 832, 1, 256]
    - [59, 0.0]
  - - [768, 832, 1, 256]
    - [183, 0.0]
  - - [896, 832, 1, 256]
    - [54, 0.0]
  - - [1024, 832, 1, 256]
    - [20, 0.0]
  - - [64, 896, 1, 256]
    - [19, 0.0]
  - - [128, 896, 1, 256]
    - [36, 0.0]
  - - [192, 896, 1, 256]
    - [27, 0.0]
  - - [256, 896, 1, 256]
    - [20, 0.0]
  - - [320, 896, 1, 256]
    - [28, 0.0]
  - - [384, 896, 1, 256]
    - [120, 0.0]
  - - [448, 896, 1, 256]
    - [28, 0.0]
  - - [512, 896, 1, 256]
    - [23, 0.0]
  - - [576, 896, 1, 256]
    - [78, 0.0]
  - - [640, 896, 1, 256]
    - [20, 0.0]
  - - [704, 896, 1, 256]
    - [41, 0.0]
  - - [768, 896, 1, 256]
    - [56, 0.0]
  - - [832, 896, 1, 256]
    - [81, 0.0]
  - - [896, 896, 1, 256]
    - [20, 0.0]
  - - [960, 896, 1, 256]
    - [27, 0.0]
  - - [1024, 896, 1, 256]
    - [54, 0.0]
  - - [128, 960, 1, 256]
    - [19, 0.0]
  - - [256, 960, 1, 256]
    - [110, 0.0]
  - - [384, 960, 1, 256]
    - [120, 0.0]
  - - [512, 960, 1, 256]
    - [167, 0.0]
  - - [640, 960, 1, 256]
    - [20, 0.0]
  - - [768, 960, 1, 256]
    - [110, 0.0]
  - - [896, 960, 1, 256]
    - [54, 0.0]
  - - [1024, 960, 1, 256]
    - [20, 0.0]
  - - [64, 1024, 1, 256]
    - [27, 0.0]
  - - [128, 1024, 1, 256]
    - [27, 0.0]
  - - [192, 1024, 1, 256]
    - [27, 0.0]
  - - [256, 1024, 1, 256]
    - [20, 0.0]
  - - [320, 1024, 1, 256]
    - [77, 0.0]
  - - [384, 1024, 1, 256]
    - [120, 0.0]
  - - [448, 1024, 1, 256]
    - [77, 0.0]
  - - [576, 1024, 1, 256]
    - [28, 0.0]
  - - [640, 1024, 1, 256]
    - [56, 0.0]
  - - [704, 1024, 1, 256]
    - [27, 0.0]
  - - [768, 1024, 1, 256]
    - [20, 0.0]
  - - [832, 1024, 1, 256]
    - [27, 0.0]
  - - [896, 1024, 1, 256]
    - [20, 0.0]
  - - [960, 1024, 1, 256]
    - [20, 0.0]
  - - [128, 64, 1, 512]
    - [26, 0.0]
  - - [256, 64, 1, 512]
    - [184, 0.0]
  - - [384, 64, 1, 512]
    - [26, 0.0]
  - - [512, 64, 1, 512]
    - [19, 0.0]
  - - [640, 64, 1, 512]
    - [19, 0.0]
  - - [768, 64, 1, 512]
    - [19, 0.0]
  - - [896, 64, 1, 512]
    - [27, 0.0]
  - - [1024, 64, 1, 512]
    - [19, 0.0]
  - - [64, 128, 1, 512]
    - [136, 0.0]
  - - [128, 128, 1, 512]
    - [98, 0.0]
  - - [192, 128, 1, 512]
    - [27, 0.0]
  - - [256, 128, 1, 512]
    - [27, 0.0]
  - - [320, 128, 1, 512]
    - [35, 0.0]
  - - [384, 128, 1, 512]
    - [28, 0.0]
  - - [448, 128, 1, 512]
    - [19, 0.0]
  - - [512, 128, 1, 512]
    - [74, 0.0]
  - - [576, 128, 1, 512]
    - [19, 0.0]
  - - [640, 128, 1, 512]
    - [19, 0.0]
  - - [704, 128, 1, 512]
    - [19, 0.0]
  - - [768, 128, 1, 512]
    - [19, 0.0]
  - - [832, 128, 1, 512]
    - [19, 0.0]
  - - [896, 128, 1, 512]
    - [19, 0.0]
  - - [960, 128, 1, 512]
    - [19, 0.0]
  - - [1024, 128, 1, 512]
    - [27, 0.0]
  - - [128, 192, 1, 512]
    - [19, 0.0]
  - - [256, 192, 1, 512]
    - [19, 0.0]
  - - [384, 192, 1, 512]
    - [27, 0.0]
  - - [512, 192, 1, 512]
    - [19, 0.0]
  - - [640, 192, 1, 512]
    - [77, 0.0]
  - - [768, 192, 1, 512]
    - [28, 0.0]
  - - [896, 192, 1, 512]
    - [77, 0.0]
  - - [1024, 192, 1, 512]
    - [19, 0.0]
  - - [64, 256, 1, 512]
    - [68, 0.0]
  - - [128, 256, 1, 512]
    - [27, 0.0]
  - - [192, 256, 1, 512]
    - [35, 0.0]
  - - [256, 256, 1, 512]
    - [35, 0.0]
  - - [320, 256, 1, 512]
    - [27, 0.0]
  - - [384, 256, 1, 512]
    - [27, 0.0]
  - - [448, 256, 1, 512]
    - [19, 0.0]
  - - [512, 256, 1, 512]
    - [74, 0.0]
  - - [576, 256, 1, 512]
    - [77, 0.0]
  - - [640, 256, 1, 512]
    - [19, 0.0]
  - - [704, 256, 1, 512]
    - [19, 0.0]
  - - [768, 256, 1, 512]
    - [27, 0.0]
  - - [832, 256, 1, 512]
    - [77, 0.0]
  - - [896, 256, 1, 512]
    - [20, 0.0]
  - - [960, 256, 1, 512]
    - [77, 0.0]
  - - [1024, 256, 1, 512]
    - [20, 0.0]
  - - [128, 320, 1, 512]
    - [27, 0.0]
  - - [256, 320, 1, 512]
    - [27, 0.0]
  - - [384, 320, 1, 512]
    - [28, 0.0]
  - - [512, 320, 1, 512]
    - [27, 0.0]
  - - [640, 320, 1, 512]
    - [110, 0.0]
  - - [768, 320, 1, 512]
    - [19, 0.0]
  - - [896, 320, 1, 512]
    - [28, 0.0]
  - - [1024, 320, 1, 512]
    - [28, 0.0]
  - - [64, 384, 1, 512]
    - [185, 0.0]
  - - [128, 384, 1, 512]
    - [27, 0.0]
  - - [192, 384, 1, 512]
    - [78, 0.0]
  - - [256, 384, 1, 512]
    - [27, 0.0]
  - - [320, 384, 1, 512]
    - [28, 0.0]
  - - [384, 384, 1, 512]
    - [77, 0.0]
  - - [448, 384, 1, 512]
    - [77, 0.0]
  - - [512, 384, 1, 512]
    - [74, 0.0]
  - - [576, 384, 1, 512]
    - [19, 0.0]
  - - [640, 384, 1, 512]
    - [20, 0.0]
  - - [704, 384, 1, 512]
    - [77, 0.0]
  - - [768, 384, 1, 512]
    - [120, 0.0]
  - - [832, 384, 1, 512]
    - [77, 0.0]
  - - [896, 384, 1, 512]
    - [120, 0.0]
  - - [960, 384, 1, 512]
    - [28, 0.0]
  - - [1024, 384, 1, 512]
    - [23, 0.0]
  - - [128, 448, 1, 512]
    - [19, 0.0]
  - - [256, 448, 1, 512]
    - [27, 0.0]
  - - [384, 448, 1, 512]
    - [28, 0.0]
  - - [512, 448, 1, 512]
    - [20, 0.0]
  - - [640, 448, 1, 512]
    - [120, 0.0]
  - - [768, 448, 1, 512]
    - [118, 0.0]
  - - [896, 448, 1, 512]
    - [118, 0.0]
  - - [1024, 448, 1, 512]
    - [120, 0.0]
  - - [64, 512, 1, 512]
    - [19, 0.0]
  - - [128, 512, 1, 512]
    - [27, 0.0]
  - - [192, 512, 1, 512]
    - [28, 0.0]
  - - [256, 512, 1, 512]
    - [78, 0.0]
  - - [320, 512, 1, 512]
    - [28, 0.0]
  - - [384, 512, 1, 512]
    - [19, 0.0]
  - - [448, 512, 1, 512]
    - [28, 0.0]
  - - [576, 512, 1, 512]
    - [77, 0.0]
  - - [640, 512, 1, 512]
    - [23, 0.0]
  - - [704, 512, 1, 512]
    - [28, 0.0]
  - - [768, 512, 1, 512]
    - [120, 0.0]
  - - [832, 512, 1, 512]
    - [28, 0.0]
  - - [896, 512, 1, 512]
    - [23, 0.0]
  - - [960, 512, 1, 512]
    - [23, 0.0]
  - - [128, 576, 1, 512]
    - [19, 0.0]
  - - [256, 576, 1, 512]
    - [28, 0.0]
  - - [384, 576, 1, 512]
    - [77, 0.0]
  - - [512, 576, 1, 512]
    - [120, 0.0]
  - - [640, 576, 1, 512]
    - [186, 0.0]
  - - [768, 576, 1, 512]
    - [118, 0.0]
  - - [896, 576, 1, 512]
    - [110, 0.0]
  - - [1024, 576, 1, 512]
    - [20, 0.0]
  - - [64, 640, 1, 512]
    - [27, 0.0]
  - - [128, 640, 1, 512]
    - [19, 0.0]
  - - [192, 640, 1, 512]
    - [27, 0.0]
  - - [256, 640, 1, 512]
    - [27, 0.0]
  - - [320, 640, 1, 512]
    - [28, 0.0]
  - - [384, 640, 1, 512]
    - [110, 0.0]
  - - [448, 640, 1, 512]
    - [28, 0.0]
  - - [512, 640, 1, 512]
    - [23, 0.0]
  - - [576, 640, 1, 512]
    - [27, 0.0]
  - - [640, 640, 1, 512]
    - [120, 0.0]
  - - [704, 640, 1, 512]
    - [28, 0.0]
  - - [768, 640, 1, 512]
    - [23, 0.0]
  - - [832, 640, 1, 512]
    - [28, 0.0]
  - - [896, 640, 1, 512]
    - [20, 0.0]
  - - [960, 640, 1, 512]
    - [74, 0.0]
  - - [1024, 640, 1, 512]
    - [20, 0.0]
  - - [128, 704, 1, 512]
    - [27, 0.0]
  - - [256, 704, 1, 512]
    - [19, 0.0]
  - - [384, 704, 1, 512]
    - [118, 0.0]
  - - [512, 704, 1, 512]
    - [23, 0.0]
  - - [640, 704, 1, 512]
    - [120, 0.0]
  - - [768, 704, 1, 512]
    - [20, 0.0]
  - - [896, 704, 1, 512]
    - [110, 0.0]
  - - [1024, 704, 1, 512]
    - [20, 0.0]
  - - [64, 768, 1, 512]
    - [19, 0.0]
  - - [128, 768, 1, 512]
    - [19, 0.0]
  - - [192, 768, 1, 512]
    - [28, 0.0]
  - - [256, 768, 1, 512]
    - [19, 0.0]
  - - [320, 768, 1, 512]
    - [27, 0.0]
  - - [384, 768, 1, 512]
    - [118, 0.0]
  - - [448, 768, 1, 512]
    - [73, 0.0]
  - - [512, 768, 1, 512]
    - [120, 0.0]
  - - [576, 768, 1, 512]
    - [28, 0.0]
  - - [640, 768, 1, 512]
    - [23, 0.0]
  - - [704, 768, 1, 512]
    - [27, 0.0]
  - - [768, 768, 1, 512]
    - [54, 0.0]
  - - [832, 768, 1, 512]
    - [77, 0.0]
  - - [896, 768, 1, 512]
    - [55, 0.0]
  - - [960, 768, 1, 512]
    - [20, 0.0]
  - - [1024, 768, 1, 512]
    - [20, 0.0]
  - - [128, 832, 1, 512]
    - [27, 0.0]
  - - [256, 832, 1, 512]
    - [74, 0.0]
  - - [384, 832, 1, 512]
    - [23, 0.0]
  - - [512, 832, 1, 512]
    - [120, 0.0]
  - - [640, 832, 1, 512]
    - [20, 0.0]
  - - [768, 832, 1, 512]
    - [20, 0.0]
  - - [896, 832, 1, 512]
    - [23, 0.0]
  - - [1024, 832, 1, 512]
    - [20, 0.0]
  - - [64, 896, 1, 512]
    - [27, 0.0]
  - - [128, 896, 1, 512]
    - [19, 0.0]
  - - [192, 896, 1, 512]
    - [77, 0.0]
  - - [256, 896, 1, 512]
    - [110, 0.0]
  - - [320, 896, 1, 512]
    - [19, 0.0]
  - - [384, 896, 1, 512]
    - [23, 0.0]
  - - [448, 896, 1, 512]
    - [28, 0.0]
  - - [512, 896, 1, 512]
    - [23, 0.0]
  - - [576, 896, 1, 512]
    - [77, 0.0]
  - - [640, 896, 1, 512]
    - [110, 0.0]
  - - [704, 896, 1, 512]
    - [28, 0.0]
  - - [768, 896, 1, 512]
    - [110, 0.0]
  - - [832, 896, 1, 512]
    - [19, 0.0]
  - - [896, 896, 1, 512]
    - [20, 0.0]
  - - [960, 896, 1, 512]
    - [20, 0.0]
  - - [1024, 896, 1, 512]
    - [20, 0.0]
  - - [128, 960, 1, 512]
    - [19, 0.0]
  - - [256, 960, 1, 512]
    - [110, 0.0]
  - - [384, 960, 1, 512]
    - [118, 0.0]
  - - [512, 960, 1, 512]
    - [120, 0.0]
  - - [640, 960, 1, 512]
    - [54, 0.0]
  - - [768, 960, 1, 512]
    - [110, 0.0]
  - - [896, 960, 1, 512]
    - [54, 0.0]
  - - [1024, 960, 1, 512]
    - [20, 0.0]
  - - [64, 1024, 1, 512]
    - [19, 0.0]
  - - [128, 1024, 1, 512]
    - [78, 0.0]
  - - [192, 1024, 1, 512]
    - [103, 0.0]
  - - [256, 1024, 1, 512]
    - [20, 0.0]
  - - [320, 1024, 1, 512]
    - [19, 0.0]
  - - [384, 1024, 1, 512]
    - [118, 0.0]
  - - [448, 1024, 1, 512]
    - [77, 0.0]
  - - [576, 1024, 1, 512]
    - [77, 0.0]
  - - [640, 1024, 1, 512]
    - [20, 0.0]
  - - [704, 1024, 1, 512]
    - [20, 0.0]
  - - [768, 1024, 1, 512]
    - [20, 0.0]
  - - [832, 1024, 1, 512]
    - [20, 0.0]
  - - [896, 1024, 1, 512]
    - [20, 0.0]
  - - [960, 1024, 1, 512]
    - [20, 0.0]
  - - [128, 64, 1, 1024]
    - [178, 0.0]
  - - [256, 64, 1, 1024]
    - [152, 0.0]
  - - [384, 64, 1, 1024]
    - [149, 0.0]
  - - [512, 64, 1, 1024]
    - [19, 0.0]
  - - [640, 64, 1, 1024]
    - [27, 0.0]
  - - [768, 64, 1, 1024]
    - [77, 0.0]
  - - [896, 64, 1, 1024]
    - [19, 0.0]
  - - [1024, 64, 1, 1024]
    - [77, 0.0]
  - - [64, 128, 1, 1024]
    - [181, 0.0]
  - - [128, 128, 1, 1024]
    - [181, 0.0]
  - - [192, 128, 1, 1024]
    - [27, 0.0]
  - - [256, 128, 1, 1024]
    - [27, 0.0]
  - - [320, 128, 1, 1024]
    - [77, 0.0]
  - - [384, 128, 1, 1024]
    - [28, 0.0]
  - - [448, 128, 1, 1024]
    - [19, 0.0]
  - - [512, 128, 1, 1024]
    - [77, 0.0]
  - - [576, 128, 1, 1024]
    - [27, 0.0]
  - - [640, 128, 1, 1024]
    - [28, 0.0]
  - - [704, 128, 1, 1024]
    - [27, 0.0]
  - - [768, 128, 1, 1024]
    - [28, 0.0]
  - - [832, 128, 1, 1024]
    - [28, 0.0]
  - - [896, 128, 1, 1024]
    - [27, 0.0]
  - - [960, 128, 1, 1024]
    - [27, 0.0]
  - - [1024, 128, 1, 1024]
    - [19, 0.0]
  - - [128, 192, 1, 1024]
    - [27, 0.0]
  - - [256, 192, 1, 1024]
    - [19, 0.0]
  - - [384, 192, 1, 1024]
    - [19, 0.0]
  - - [512, 192, 1, 1024]
    - [27, 0.0]
  - - [640, 192, 1, 1024]
    - [78, 0.0]
  - - [768, 192, 1, 1024]
    - [77, 0.0]
  - - [896, 192, 1, 1024]
    - [28, 0.0]
  - - [1024, 192, 1, 1024]
    - [78, 0.0]
  - - [64, 256, 1, 1024]
    - [187, 0.0]
  - - [128, 256, 1, 1024]
    - [28, 0.0]
  - - [192, 256, 1, 1024]
    - [27, 0.0]
  - - [256, 256, 1, 1024]
    - [74, 0.0]
  - - [320, 256, 1, 1024]
    - [27, 0.0]
  - - [384, 256, 1, 1024]
    - [19, 0.0]
  - - [448, 256, 1, 1024]
    - [27, 0.0]
  - - [512, 256, 1, 1024]
    - [19, 0.0]
  - - [576, 256, 1, 1024]
    - [28, 0.0]
  - - [640, 256, 1, 1024]
    - [28, 0.0]
  - - [704, 256, 1, 1024]
    - [28, 0.0]
  - - [768, 256, 1, 1024]
    - [110, 0.0]
  - - [832, 256, 1, 1024]
    - [28, 0.0]
  - - [896, 256, 1, 1024]
    - [20, 0.0]
  - - [960, 256, 1, 1024]
    - [19, 0.0]
  - - [1024, 256, 1, 1024]
    - [110, 0.0]
  - - [128, 320, 1, 1024]
    - [27, 0.0]
  - - [256, 320, 1, 1024]
    - [27, 0.0]
  - - [384, 320, 1, 1024]
    - [77, 0.0]
  - - [512, 320, 1, 1024]
    - [77, 0.0]
  - - [640, 320, 1, 1024]
    - [20, 0.0]
  - - [768, 320, 1, 1024]
    - [77, 0.0]
  - - [896, 320, 1, 1024]
    - [23, 0.0]
  - - [1024, 320, 1, 1024]
    - [118, 0.0]
  - - [64, 384, 1, 1024]
    - [187, 0.0]
  - - [128, 384, 1, 1024]
    - [27, 0.0]
  - - [192, 384, 1, 1024]
    - [27, 0.0]
  - - [256, 384, 1, 1024]
    - [88, 0.0]
  - - [320, 384, 1, 1024]
    - [19, 0.0]
  - - [384, 384, 1, 1024]
    - [20, 0.0]
  - - [448, 384, 1, 1024]
    - [28, 0.0]
  - - [512, 384, 1, 1024]
    - [20, 0.0]
  - - [576, 384, 1, 1024]
    - [28, 0.0]
  - - [640, 384, 1, 1024]
    - [20, 0.0]
  - - [704, 384, 1, 1024]
    - [27, 0.0]
  - - [768, 384, 1, 1024]
    - [120, 0.0]
  - - [832, 384, 1, 1024]
    - [28, 0.0]
  - - [896, 384, 1, 1024]
    - [23, 0.0]
  - - [960, 384, 1, 1024]
    - [23, 0.0]
  - - [1024, 384, 1, 1024]
    - [118, 0.0]
  - - [128, 448, 1, 1024]
    - [19, 0.0]
  - - [256, 448, 1, 1024]
    - [19, 0.0]
  - - [384, 448, 1, 1024]
    - [77, 0.0]
  - - [512, 448, 1, 1024]
    - [20, 0.0]
  - - [640, 448, 1, 1024]
    - [23, 0.0]
  - - [768, 448, 1, 1024]
    - [120, 0.0]
  - - [896, 448, 1, 1024]
    - [120, 0.0]
  - - [1024, 448, 1, 1024]
    - [120, 0.0]
  - - [64, 512, 1, 1024]
    - [28, 0.0]
  - - [128, 512, 1, 1024]
    - [19, 0.0]
  - - [192, 512, 1, 1024]
    - [77, 0.0]
  - - [256, 512, 1, 1024]
    - [19, 0.0]
  - - [320, 512, 1, 1024]
    - [28, 0.0]
  - - [384, 512, 1, 1024]
    - [20, 0.0]
  - - [448, 512, 1, 1024]
    - [74, 0.0]
  - - [576, 512, 1, 1024]
    - [28, 0.0]
  - - [640, 512, 1, 1024]
    - [120, 0.0]
  - - [704, 512, 1, 1024]
    - [23, 0.0]
  - - [768, 512, 1, 1024]
    - [118, 0.0]
  - - [832, 512, 1, 1024]
    - [117, 0.0]
  - - [896, 512, 1, 1024]
    - [120, 0.0]
  - - [960, 512, 1, 1024]
    - [117, 0.0]
  - - [128, 576, 1, 1024]
    - [19, 0.0]
  - - [256, 576, 1, 1024]
    - [28, 0.0]
  - - [384, 576, 1, 1024]
    - [20, 0.0]
  - - [512, 576, 1, 1024]
    - [23, 0.0]
  - - [640, 576, 1, 1024]
    - [118, 0.0]
  - - [768, 576, 1, 1024]
    - [23, 0.0]
  - - [896, 576, 1, 1024]
    - [20, 0.0]
  - - [1024, 576, 1, 1024]
    - [20, 0.0]
  - - [64, 640, 1, 1024]
    - [27, 0.0]
  - - [128, 640, 1, 1024]
    - [27, 0.0]
  - - [192, 640, 1, 1024]
    - [27, 0.0]
  - - [256, 640, 1, 1024]
    - [77, 0.0]
  - - [320, 640, 1, 1024]
    - [77, 0.0]
  - - [384, 640, 1, 1024]
    - [20, 0.0]
  - - [448, 640, 1, 1024]
    - [104, 0.0]
  - - [512, 640, 1, 1024]
    - [23, 0.0]
  - - [576, 640, 1, 1024]
    - [117, 0.0]
  - - [640, 640, 1, 1024]
    - [23, 0.0]
  - - [704, 640, 1, 1024]
    - [117, 0.0]
  - - [768, 640, 1, 1024]
    - [23, 0.0]
  - - [832, 640, 1, 1024]
    - [20, 0.0]
  - - [896, 640, 1, 1024]
    - [20, 0.0]
  - - [960, 640, 1, 1024]
    - [20, 0.0]
  - - [1024, 640, 1, 1024]
    - [20, 0.0]
  - - [128, 704, 1, 1024]
    - [27, 0.0]
  - - [256, 704, 1, 1024]
    - [77, 0.0]
  - - [384, 704, 1, 1024]
    - [118, 0.0]
  - - [512, 704, 1, 1024]
    - [23, 0.0]
  - - [640, 704, 1, 1024]
    - [120, 0.0]
  - - [768, 704, 1, 1024]
    - [54, 0.0]
  - - [896, 704, 1, 1024]
    - [20, 0.0]
  - - [1024, 704, 1, 1024]
    - [20, 0.0]
  - - [64, 768, 1, 1024]
    - [27, 0.0]
  - - [128, 768, 1, 1024]
    - [27, 0.0]
  - - [192, 768, 1, 1024]
    - [77, 0.0]
  - - [256, 768, 1, 1024]
    - [110, 0.0]
  - - [320, 768, 1, 1024]
    - [28, 0.0]
  - - [384, 768, 1, 1024]
    - [118, 0.0]
  - - [448, 768, 1, 1024]
    - [23, 0.0]
  - - [512, 768, 1, 1024]
    - [23, 0.0]
  - - [576, 768, 1, 1024]
    - [23, 0.0]
  - - [640, 768, 1, 1024]
    - [23, 0.0]
  - - [704, 768, 1, 1024]
    - [20, 0.0]
  - - [768, 768, 1, 1024]
    - [20, 0.0]
  - - [832, 768, 1, 1024]
    - [55, 0.0]
  - - [896, 768, 1, 1024]
    - [20, 0.0]
  - - [960, 768, 1, 1024]
    - [20, 0.0]
  - - [1024, 768, 1, 1024]
    - [55, 0.0]
  - - [128, 832, 1, 1024]
    - [74, 0.0]
  - - [256, 832, 1, 1024]
    - [110, 0.0]
  - - [384, 832, 1, 1024]
    - [23, 0.0]
  - - [512, 832, 1, 1024]
    - [23, 0.0]
  - - [640, 832, 1, 1024]
    - [110, 0.0]
  - - [768, 832, 1, 1024]
    - [56, 0.0]
  - - [896, 832, 1, 1024]
    - [23, 0.0]
  - - [1024, 832, 1, 1024]
    - [118, 0.0]
  - - [64, 896, 1, 1024]
    - [28, 0.0]
  - - [128, 896, 1, 1024]
    - [74, 0.0]
  - - [192, 896, 1, 1024]
    - [28, 0.0]
  - - [256, 896, 1, 1024]
    - [110, 0.0]
  - - [320, 896, 1, 1024]
    - [28, 0.0]
  - - [384, 896, 1, 1024]
    - [120, 0.0]
  - - [448, 896, 1, 1024]
    - [23, 0.0]
  - - [512, 896, 1, 1024]
    - [23, 0.0]
  - - [576, 896, 1, 1024]
    - [71, 0.0]
  - - [640, 896, 1, 1024]
    - [20, 0.0]
  - - [704, 896, 1, 1024]
    - [20, 0.0]
  - - [768, 896, 1, 1024]
    - [20, 0.0]
  - - [832, 896, 1, 1024]
    - [23, 0.0]
  - - [896, 896, 1, 1024]
    - [20, 0.0]
  - - [960, 896, 1, 1024]
    - [20, 0.0]
  - - [1024, 896, 1, 1024]
    - [23, 0.0]
  - - [128, 960, 1, 1024]
    - [74, 0.0]
  - - [256, 960, 1, 1024]
    - [110, 0.0]
  - - [384, 960, 1, 1024]
    - [118, 0.0]
  - - [512, 960, 1, 1024]
    - [120, 0.0]
  - - [640, 960, 1, 1024]
    - [20, 0.0]
  - - [768, 960, 1, 1024]
    - [110, 0.0]
  - - [896, 960, 1, 1024]
    - [23, 0.0]
  - - [1024, 960, 1, 1024]
    - [120, 0.0]
  - - [64, 1024, 1, 1024]
    - [77, 0.0]
  - - [128, 1024, 1, 1024]
    - [77, 0.0]
  - - [192, 1024, 1, 1024]
    - [77, 0.0]
  - - [256, 1024, 1, 1024]
    - [20, 0.0]
  - - [320, 1024, 1, 1024]
    - [77, 0.0]
  - - [384, 1024, 1, 1024]
    - [23, 0.0]
  - - [448, 1024, 1, 1024]
    - [23, 0.0]
  - - [576, 1024, 1, 1024]
    - [20, 0.0]
  - - [640, 1024, 1, 1024]
    - [110, 0.0]
  - - [704, 1024, 1, 1024]
    - [20, 0.0]
  - - [768, 1024, 1, 1024]
    - [20, 0.0]
  - - [832, 1024, 1, 1024]
    - [20, 0.0]
  - - [896, 1024, 1, 1024]
    - [23, 0.0]
  - - [960, 1024, 1, 1024]
    - [20, 0.0]
  - - [128, 64, 1, 2048]
    - [188, 0.0]
  - - [256, 64, 1, 2048]
    - [68, 0.0]
  - - [384, 64, 1, 2048]
    - [135, 0.0]
  - - [512, 64, 1, 2048]
    - [19, 0.0]
  - - [640, 64, 1, 2048]
    - [19, 0.0]
  - - [768, 64, 1, 2048]
    - [19, 0.0]
  - - [896, 64, 1, 2048]
    - [27, 0.0]
  - - [1024, 64, 1, 2048]
    - [88, 0.0]
  - - [64, 128, 1, 2048]
    - [181, 0.0]
  - - [128, 128, 1, 2048]
    - [116, 0.0]
  - - [192, 128, 1, 2048]
    - [88, 0.0]
  - - [256, 128, 1, 2048]
    - [27, 0.0]
  - - [320, 128, 1, 2048]
    - [19, 0.0]
  - - [384, 128, 1, 2048]
    - [27, 0.0]
  - - [448, 128, 1, 2048]
    - [27, 0.0]
  - - [512, 128, 1, 2048]
    - [19, 0.0]
  - - [576, 128, 1, 2048]
    - [27, 0.0]
  - - [640, 128, 1, 2048]
    - [19, 0.0]
  - - [704, 128, 1, 2048]
    - [77, 0.0]
  - - [768, 128, 1, 2048]
    - [19, 0.0]
  - - [832, 128, 1, 2048]
    - [19, 0.0]
  - - [896, 128, 1, 2048]
    - [78, 0.0]
  - - [960, 128, 1, 2048]
    - [27, 0.0]
  - - [1024, 128, 1, 2048]
    - [27, 0.0]
  - - [128, 192, 1, 2048]
    - [27, 0.0]
