projects/hipblaslt/library/src/amd_detail/rocblaslt/src/Tensile/Logic/asm_full/gfx1200/GridBased/gfx1200_Cijk_Ailk_Bjlk_HSS_BH_Bias_SHB_HA_S_SAB_SCD_SAV_UserArgs.yaml
- {MinimumRequiredVersion: 5.0.0}
- gfx1200
- gfx1200
- [Device 73f0]
    SolutionIndex: 0
    SolutionNameMin: Cijk_Ailk_Bjlk_HSS_BH_Bias_HAS_SAV_UserArgs_MT64x32x32_MI16x16x1_SN_CLR1_GSU1_LBSPPA1024_LBSPPB512_MIWT2_1_PGR1_PLR1_SS0_SU32_SUM0_SUS256_SVW8_WG32_4_1_WGM8
    SolutionIndex: 1
    SolutionNameMin: Cijk_Ailk_Bjlk_HSS_BH_Bias_HAS_SAV_UserArgs_MT64x32x32_MI16x16x1_SN_CLR1_GSU1_LBSPPA1024_LBSPPB512_MIWT2_1_PGR2_PLR1_SS0_SU32_SUM0_SUS256_SVW8_WG32_4_1_WGM8
    SolutionIndex: 2
    SolutionNameMin: Cijk_Ailk_Bjlk_HSS_BH_Bias_HAS_SAV_UserArgs_MT64x32x32_MI16x16x1_SN_CLR0_GSU1_LBSPPA1024_LBSPPB512_MIWT2_1_PGR1_PLR0_SS0_SU32_SUM0_SUS256_SVW8_WG32_4_1_WGM8
    SolutionIndex: 3
    SolutionNameMin: Cijk_Ailk_Bjlk_HSS_BH_Bias_HAS_SAV_UserArgs_MT64x32x32_MI16x16x1_SN_CLR0_GSU1_LBSPPA1024_LBSPPB512_MIWT2_1_PGR2_PLR0_SS0_SU32_SUM0_SUS256_SVW8_WG32_4_1_WGM8
    SolutionIndex: 4
    SolutionNameMin: Cijk_Ailk_Bjlk_HSS_BH_Bias_HAS_SAV_UserArgs_MT32x64x32_MI16x16x1_SN_CLR1_GSU1_LBSPPA512_LBSPPB1024_MIWT2_1_PGR1_PLR1_SS0_SU32_SUM0_SUS256_SVW8_WG16_8_1_WGM8
    SolutionIndex: 5
    SolutionNameMin: Cijk_Ailk_Bjlk_HSS_BH_Bias_HAS_SAV_UserArgs_MT32x64x32_MI16x16x1_SN_CLR1_GSU1_LBSPPA512_LBSPPB1024_MIWT2_1_PGR2_PLR1_SS0_SU32_SUM0_SUS256_SVW8_WG16_8_1_WGM8
    SolutionIndex: 6
    SolutionNameMin: Cijk_Ailk_Bjlk_HSS_BH_Bias_HAS_SAV_UserArgs_MT32x64x32_MI16x16x1_SN_CLR0_GSU1_LBSPPA512_LBSPPB1024_MIWT2_1_PGR1_PLR0_SS0_SU32_SUM0_SUS256_SVW8_WG16_8_1_WGM8
    SolutionIndex: 7
    SolutionNameMin: Cijk_Ailk_Bjlk_HSS_BH_Bias_HAS_SAV_UserArgs_MT32x64x32_MI16x16x1_SN_CLR0_GSU1_LBSPPA512_LBSPPB1024_MIWT2_1_PGR2_PLR0_SS0_SU32_SUM0_SUS256_SVW8_WG16_8_1_WGM8
    SolutionIndex: 8
    SolutionNameMin: Cijk_Ailk_Bjlk_HSS_BH_Bias_HAS_SAV_UserArgs_MT32x32x64_MI16x16x1_SN_CLR1_GSU1_LBSPPA512_LBSPPB512_MIWT1_1_PGR1_PLR1_SS0_SU32_SUM0_SUS256_SVW8_WG32_4_1_WGM8
    SolutionIndex: 9
    SolutionNameMin: Cijk_Ailk_Bjlk_HSS_BH_Bias_HAS_SAV_UserArgs_MT64x32x64_MI16x16x1_SN_CLR1_GSU1_LBSPPA1024_LBSPPB512_MIWT2_1_PGR1_PLR3_SS0_SU32_SUM0_SUS256_SVW8_WG32_4_1_WGM8
    SolutionIndex: 10
    SolutionNameMin: Cijk_Ailk_Bjlk_HSS_BH_Bias_HAS_SAV_UserArgs_MT64x16x32_MI16x16x1_SN_CLR1_GSU1_LBSPPA1024_LBSPPB256_MIWT1_1_PGR2_PLR1_SS1_SU32_SUM0_SUS256_SVW1_WG64_2_1_WGM8
    SolutionIndex: 11
    SolutionNameMin: Cijk_Ailk_Bjlk_HSS_BH_Bias_HAS_SAV_UserArgs_MT64x16x32_MI16x16x1_SN_CLR0_GSU1_LBSPPA1024_LBSPPB256_MIWT1_1_PGR2_PLR0_SS1_SU32_SUM0_SUS256_SVW1_WG64_2_1_WGM8
    SolutionIndex: 12
    SolutionNameMin: Cijk_Ailk_Bjlk_HSS_BH_Bias_HAS_SAV_UserArgs_MT32x32x32_MI16x16x1_SN_CLR0_GSU1_LBSPPA512_LBSPPB512_MIWT1_1_PGR2_PLR0_SS1_SU32_SUM0_SUS256_SVW1_WG32_4_1_WGM8
    SolutionIndex: 13
    SolutionNameMin: Cijk_Ailk_Bjlk_HSS_BH_Bias_HAS_SAV_UserArgs_MT64x32x32_MI16x16x1_SN_CLR1_GSU1_LBSPPA1024_LBSPPB512_MIWT2_1_PGR1_PLR1_SS1_SU32_SUM0_SUS256_SVW1_WG32_4_1_WGM8
    SolutionIndex: 14
    SolutionNameMin: Cijk_Ailk_Bjlk_HSS_BH_Bias_HAS_SAV_UserArgs_MT64x32x32_MI16x16x1_SN_CLR1_GSU1_LBSPPA1024_LBSPPB512_MIWT2_1_PGR2_PLR1_SS1_SU32_SUM0_SUS256_SVW1_WG32_4_1_WGM8
    SolutionIndex: 15
    SolutionNameMin: Cijk_Ailk_Bjlk_HSS_BH_Bias_HAS_SAV_UserArgs_MT32x64x32_MI16x16x1_SN_CLR1_GSU1_LBSPPA512_LBSPPB1024_MIWT2_1_PGR1_PLR1_SS1_SU32_SUM0_SUS256_SVW1_WG16_8_1_WGM8
    SolutionIndex: 16
    SolutionNameMin: Cijk_Ailk_Bjlk_HSS_BH_Bias_HAS_SAV_UserArgs_MT32x64x32_MI16x16x1_SN_CLR0_GSU1_LBSPPA512_LBSPPB1024_MIWT2_1_PGR1_PLR0_SS1_SU32_SUM0_SUS256_SVW1_WG16_8_1_WGM8
    SolutionIndex: 17
    SolutionNameMin: Cijk_Ailk_Bjlk_HSS_BH_Bias_HAS_SAV_UserArgs_MT64x32x64_MI16x16x1_SN_CLR1_GSU1_LBSPPA1024_LBSPPB512_MIWT2_1_PGR1_PLR1_SS1_SU32_SUM0_SUS256_SVW1_WG32_4_1_WGM8
    SolutionIndex: 160
    SolutionNameMin: Cijk_Ailk_Bjlk_HSS_BH_Bias_SHB_HA_S_SAB_SCD_SAV_UserArgs_MT32x16x32_MI16x16x1_SN_LDSB0_AFC1_AFEM1_AFEM1_ASEM1_CLR1_CADS0_DTLA0_DTLB0_DTVA1_DTVB0_EPS0_FDSI0_GRPM1_GRVWA8_GRVWB1_GSU1_GSUAMB_GSUC0_GSUWGMRR0_GLS0_ISA1200_IU1_K1_LBSPPA0_LBSPPB256_LBSPPM0_LPA0_LPB16_LPM0_LRVW8_LWPMn1_MIAV1_MIWT1_1_MO40_NTn1_NTA0_NTB0_NTC0_NTD0_NTM0_NEPBS0_NLCA1_NLCB1_ONLL0_PGR2_PLR1_PKA0_SIA3_SS0_SU32_SUM0_SUS256_SPO0_SRVW0_SSO0_SVW8_SK0_SKXCCM0_TLDS0_ULSGRO0_USL1_UIOFGRO0_USFGROn1_VSn1_VWA1_VWB1_WSGRA0_WSGRB0_WS32_WG32_2_1_WGM8_WGMXCC1_WGMXCCGn1
    SolutionIndex: 162
    SolutionNameMin: Cijk_Ailk_Bjlk_HSS_BH_Bias_SHB_HA_S_SAB_SCD_SAV_UserArgs_MT32x32x64_MI16x16x1_SN_LDSB0_AFC1_AFEM1_AFEM1_ASEM1_CLR1_CADS0_DTLA0_DTLB0_DTVA0_DTVB0_EPS0_FDSI0_GRPM1_GRVWA1_GRVWB1_GSU1_GSUAMB_GSUC0_GSUWGMRR0_GLS0_ISA1200_IU1_K1_LBSPPA512_LBSPPB512_LBSPPM0_LPA16_LPB16_LPM0_LRVW8_LWPMn1_MIAV1_MIWT1_1_MO40_NTn1_NTA0_NTB0_NTC0_NTD0_NTM0_NEPBS0_NLCA1_NLCB1_ONLL0_PGR2_PLR1_PKA0_SIA3_SS0_SU32_SUM0_SUS256_SPO0_SRVW0_SSO0_SVW8_SK0_SKXCCM0_TLDS0_ULSGRO1_USL1_UIOFGRO0_USFGROn1_VSn1_VWA1_VWB1_WSGRA0_WSGRB0_WS32_WG32_4_1_WGM8_WGMXCC1_WGMXCCGn1
    SolutionIndex: 164
    SolutionNameMin: Cijk_Ailk_Bjlk_HSS_BH_Bias_SHB_HA_S_SAB_SCD_SAV_UserArgs_MT16x32x32_MI16x16x1_SN_LDSB1_AFC1_AFEM1_AFEM1_ASEM1_CLR1_CADS0_DTLA0_DTLB0_DTVA0_DTVB0_EPS0_FDSI0_GRPM1_GRVWA1_GRVWB4_GSU1_GSUAMB_GSUC0_GSUWGMRR0_GLS0_ISA1200_IU2_K1_LBSPPA256_LBSPPB512_LBSPPM0_LPA16_LPB16_LPM0_LRVW8_LWPMn1_MIAV1_MIWT1_1_MO40_NTn1_NTA0_NTB0_NTC0_NTD0_NTM0_NEPBS0_NLCA1_NLCB1_ONLL0_PGR2_PLR1_PKA0_SIA2_SS0_SU32_SUM0_SUS256_SPO0_SRVW0_SSO0_SVW8_SK0_SKXCCM0_TLDS0_ULSGRO1_USL1_UIOFGRO0_USFGROn1_VSn1_VWA1_VWB1_WSGRA0_WSGRB0_WS32_WG16_4_1_WGM8_WGMXCC1_WGMXCCGn1
    SolutionIndex: 166
    SolutionNameMin: Cijk_Ailk_Bjlk_HSS_BH_Bias_SHB_HA_S_SAB_SCD_SAV_UserArgs_MT32x16x32_MI16x16x1_SN_LDSB1_AFC1_AFEM1_AFEM1_ASEM1_CLR1_CADS0_DTLA0_DTLB0_DTVA0_DTVB0_EPS0_FDSI0_GRPM1_GRVWA8_GRVWB1_GSU1_GSUAMB_GSUC0_GSUWGMRR0_GLS0_ISA1200_IU2_K1_LBSPPA512_LBSPPB256_LBSPPM0_LPA16_LPB16_LPM0_LRVW8_LWPMn1_MIAV1_MIWT1_1_MO40_NTn1_NTA0_NTB0_NTC0_NTD0_NTM0_NEPBS0_NLCA1_NLCB1_ONLL0_PGR2_PLR1_PKA0_SIA2_SS1_SU32_SUM0_SUS256_SPO0_SRVW0_SSO0_SVW1_SK0_SKXCCM0_TLDS0_ULSGRO0_USL1_UIOFGRO0_USFGROn1_VSn1_VWA1_VWB1_WSGRA0_WSGRB0_WS32_WG32_2_1_WGM8_WGMXCC1_WGMXCCGn1
    SolutionIndex: 168
    SolutionNameMin: Cijk_Ailk_Bjlk_HSS_BH_Bias_SHB_HA_S_SAB_SCD_SAV_UserArgs_MT64x64x32_MI16x16x1_SN_LDSB1_AFC1_AFEM1_AFEM1_ASEM1_CLR1_CADS0_DTLA0_DTLB0_DTVA0_DTVB0_EPS0_FDSI0_GRPM1_GRVWA1_GRVWB1_GSU1_GSUAMB_GSUC0_GSUWGMRR0_GLS0_ISA1200_IU2_K1_LBSPPA1024_LBSPPB1024_LBSPPM0_LPA32_LPB32_LPM0_LRVW8_LWPMn1_MIAV1_MIWT2_2_MO40_NTn1_NTA0_NTB0_NTC0_NTD0_NTM0_NEPBS0_NLCA1_NLCB1_ONLL0_PGR2_PLR1_PKA0_SIA2_SS1_SU32_SUM0_SUS256_SPO0_SRVW0_SSO0_SVW2_SK0_SKXCCM0_TLDS0_ULSGRO1_USL1_UIOFGRO0_USFGROn1_VSn1_VWA2_VWB2_WSGRA0_WSGRB0_WS32_WG32_4_1_WGM8_WGMXCC1_WGMXCCGn1
    SolutionIndex: 170
    SolutionNameMin: Cijk_Ailk_Bjlk_HSS_BH_Bias_SHB_HA_S_SAB_SCD_SAV_UserArgs_MT32x16x32_MI16x16x1_SN_LDSB1_AFC1_AFEM1_AFEM1_ASEM1_CLR1_CADS0_DTLA0_DTLB0_DTVA0_DTVB0_EPS1_FDSI0_GRPM1_GRVWA4_GRVWB1_GSU1_GSUAMB_GSUC0_GSUWGMRR0_GLS0_ISA1200_IU2_K1_LBSPPA512_LBSPPB256_LBSPPM0_LPA16_LPB16_LPM0_LRVW8_LWPMn1_MIAV1_MIWT1_1_MO40_NTn1_NTA0_NTB0_NTC0_NTD0_NTM0_NEPBS0_NLCA1_NLCB1_ONLL0_PGR1_PLR1_PKA0_SIA2_SS0_SU32_SUM0_SUS256_SPO0_SRVW0_SSO0_SVW8_SK0_SKXCCM0_TLDS0_ULSGRO0_USL1_UIOFGRO0_USFGROn1_VSn1_VWA1_VWB1_WSGRA0_WSGRB0_WS32_WG32_2_1_WGM8_WGMXCC1_WGMXCCGn1
    SolutionIndex: 172
    SolutionNameMin: Cijk_Ailk_Bjlk_HSS_BH_Bias_SHB_HA_S_SAB_SCD_SAV_UserArgs_MT64x64x32_MI16x16x1_SN_LDSB1_AFC1_AFEM1_AFEM1_ASEM1_CLR1_CADS0_DTLA0_DTLB0_DTVA0_DTVB0_EPS1_FDSI0_GRPM1_GRVWA8_GRVWB4_GSU1_GSUAMB_GSUC0_GSUWGMRR0_GLS0_ISA1200_IU2_K1_LBSPPA1024_LBSPPB1024_LBSPPM0_LPA32_LPB32_LPM0_LRVW8_LWPMn1_MIAV1_MIWT2_2_MO40_NTn1_NTA0_NTB0_NTC0_NTD0_NTM0_NEPBS0_NLCA1_NLCB1_ONLL0_PGR1_PLR1_PKA0_SIA2_SS1_SU32_SUM0_SUS256_SPO0_SRVW0_SSO0_SVW2_SK0_SKXCCM0_TLDS0_ULSGRO0_USL1_UIOFGRO0_USFGROn1_VSn1_VWA2_VWB2_WSGRA0_WSGRB0_WS32_WG32_4_1_WGM8_WGMXCC1_WGMXCCGn1
    SolutionIndex: 174
    SolutionNameMin: Cijk_Ailk_Bjlk_HSS_BH_Bias_SHB_HA_S_SAB_SCD_SAV_UserArgs_MT32x32x32_MI16x16x1_SN_LDSB0_AFC1_AFEM1_AFEM1_ASEM1_CLR1_CADS0_DTLA0_DTLB0_DTVA0_DTVB1_EPS1_FDSI0_GRPM1_GRVWA4_GRVWB8_GSU1_GSUAMB_GSUC0_GSUWGMRR0_GLS0_ISA1200_IU1_K1_LBSPPA512_LBSPPB0_LBSPPM0_LPA16_LPB0_LPM0_LRVW8_LWPMn1_MIAV1_MIWT1_1_MO40_NTn1_NTA0_NTB0_NTC0_NTD0_NTM0_NEPBS0_NLCA1_NLCB1_ONLL0_PGR1_PLR1_PKA0_SIA3_SS0_SU32_SUM0_SUS256_SPO0_SRVW0_SSO0_SVW8_SK0_SKXCCM0_TLDS0_ULSGRO0_USL1_UIOFGRO0_USFGROn1_VSn1_VWA1_VWB1_WSGRA0_WSGRB0_WS32_WG32_4_1_WGM8_WGMXCC1_WGMXCCGn1
    SolutionIndex: 182
    SolutionNameMin: Cijk_Ailk_Bjlk_HSS_BH_Bias_SHB_HA_S_SAB_SCD_SAV_UserArgs_MT64x64x32_MI16x16x1_SN_LDSB1_AFC1_AFEM1_AFEM1_ASEM1_CLR1_CADS0_DTLA0_DTLB0_DTVA0_DTVB0_EPS1_FDSI0_GRPM1_GRVWA8_GRVWB8_GSU1_GSUAMB_GSUC0_GSUWGMRR0_GLS0_ISA1200_IU2_K1_LBSPPA1024_LBSPPB1024_LBSPPM0_LPA32_LPB32_LPM0_LRVW8_LWPMn1_MIAV1_MIWT2_2_MO40_NTn1_NTA0_NTB0_NTC0_NTD0_NTM0_NEPBS0_NLCA1_NLCB1_ONLL0_PGR1_PLR1_PKA0_SIA2_SS1_SU32_SUM0_SUS256_SPO0_SRVW0_SSO0_SVW2_SK0_SKXCCM0_TLDS0_ULSGRO0_USL1_UIOFGRO0_USFGROn1_VSn1_VWA2_VWB2_WSGRA0_WSGRB0_WS32_WG32_4_1_WGM8_WGMXCC1_WGMXCCGn1
    SolutionIndex: 185
    SolutionNameMin: Cijk_Ailk_Bjlk_HSS_BH_Bias_SHB_HA_S_SAB_SCD_SAV_UserArgs_MT64x64x32_MI16x16x1_SN_LDSB1_AFC1_AFEM1_AFEM1_ASEM1_CLR1_CADS0_DTLA0_DTLB0_DTVA0_DTVB0_EPS0_FDSI0_GRPM1_GRVWA1_GRVWB8_GSU1_GSUAMB_GSUC0_GSUWGMRR0_GLS0_ISA1200_IU2_K1_LBSPPA1024_LBSPPB1024_LBSPPM0_LPA32_LPB32_LPM0_LRVW8_LWPMn1_MIAV1_MIWT2_2_MO40_NTn1_NTA0_NTB0_NTC0_NTD0_NTM0_NEPBS0_NLCA1_NLCB1_ONLL0_PGR2_PLR1_PKA0_SIA2_SS1_SU32_SUM0_SUS256_SPO0_SRVW0_SSO0_SVW2_SK0_SKXCCM0_TLDS0_ULSGRO0_USL1_UIOFGRO0_USFGROn1_VSn1_VWA2_VWB2_WSGRA0_WSGRB0_WS32_WG32_4_1_WGM8_WGMXCC1_WGMXCCGn1
    SolutionIndex: 187
    SolutionNameMin: Cijk_Ailk_Bjlk_HSS_BH_Bias_SHB_HA_S_SAB_SCD_SAV_UserArgs_MT32x128x64_MI16x16x1_SN_LDSB0_AFC1_AFEM1_AFEM1_ASEM1_CLR1_CADS0_DTLA0_DTLB0_DTVA0_DTVB1_EPS1_FDSI0_GRPM1_GRVWA4_GRVWB8_GSU1_GSUAMB_GSUC0_GSUWGMRR0_GLS0_ISA1200_IU1_K1_LBSPPA512_LBSPPB0_LBSPPM0_LPA16_LPB0_LPM0_LRVW8_LWPMn1_MIAV1_MIWT1_4_MO40_NTn1_NTA0_NTB0_NTC0_NTD0_NTM0_NEPBS0_NLCA1_NLCB4_ONLL0_PGR1_PLR1_PKA0_SIA3_SS0_SU32_SUM0_SUS256_SPO0_SRVW0_SSO0_SVW8_SK0_SKXCCM0_TLDS0_ULSGRO0_USL1_UIOFGRO0_USFGROn1_VSn1_VWA1_VWB1_WSGRA0_WSGRB0_WS32_WG32_4_1_WGM8_WGMXCC1_WGMXCCGn1
    SolutionIndex: 189
    SolutionNameMin: Cijk_Ailk_Bjlk_HSS_BH_Bias_SHB_HA_S_SAB_SCD_SAV_UserArgs_MT32x32x64_MI16x16x1_SN_LDSB0_AFC1_AFEM1_AFEM1_ASEM1_CLR1_CADS0_DTLA0_DTLB0_DTVA0_DTVB1_EPS1_FDSI0_GRPM1_GRVWA4_GRVWB8_GSU1_GSUAMB_GSUC0_GSUWGMRR0_GLS0_ISA1200_IU1_K1_LBSPPA512_LBSPPB0_LBSPPM0_LPA16_LPB0_LPM0_LRVW8_LWPMn1_MIAV1_MIWT1_1_MO40_NTn1_NTA0_NTB0_NTC0_NTD0_NTM0_NEPBS0_NLCA1_NLCB1_ONLL0_PGR1_PLR1_PKA0_SIA3_SS0_SU32_SUM0_SUS256_SPO0_SRVW0_SSO0_SVW8_SK0_SKXCCM0_TLDS0_ULSGRO0_USL1_UIOFGRO0_USFGROn1_VSn1_VWA1_VWB1_WSGRA0_WSGRB0_WS32_WG32_4_1_WGM8_WGMXCC1_WGMXCCGn1
    SolutionIndex: 191
    SolutionNameMin: Cijk_Ailk_Bjlk_HSS_BH_Bias_SHB_HA_S_SAB_SCD_SAV_UserArgs_MT32x32x32_MI16x16x1_SN_LDSB1_AFC1_AFEM1_AFEM1_ASEM1_CLR1_CADS0_DTLA0_DTLB0_DTVA0_DTVB0_EPS0_FDSI0_GRPM1_GRVWA8_GRVWB4_GSU1_GSUAMB_GSUC0_GSUWGMRR0_GLS0_ISA1200_IU2_K1_LBSPPA512_LBSPPB512_LBSPPM0_LPA16_LPB16_LPM0_LRVW8_LWPMn1_MIAV1_MIWT1_1_MO40_NTn1_NTA0_NTB0_NTC0_NTD0_NTM0_NEPBS0_NLCA1_NLCB1_ONLL0_PGR2_PLR1_PKA0_SIA2_SS0_SU32_SUM0_SUS256_SPO0_SRVW0_SSO0_SVW8_SK0_SKXCCM0_TLDS0_ULSGRO0_USL1_UIOFGRO0_USFGROn1_VSn1_VWA1_VWB1_WSGRA0_WSGRB0_WS32_WG32_4_1_WGM8_WGMXCC1_WGMXCCGn1
    SolutionIndex: 192
    SolutionNameMin: Cijk_Ailk_Bjlk_HSS_BH_Bias_SHB_HA_S_SAB_SCD_SAV_UserArgs_MT64x64x16_MI16x16x1_SN_LDSB1_AFC1_AFEM1_AFEM1_ASEM1_CLR1_CADS0_DTLA0_DTLB0_DTVA0_DTVB0_EPS0_FDSI0_GRPM1_GRVWA8_GRVWB8_GSU1_GSUAMB_GSUC0_GSUWGMRR0_GLS0_ISA1200_IU1_K1_LBSPPA1024_LBSPPB1024_LBSPPM0_LPA32_LPB32_LPM0_LRVW8_LWPMn1_MIAV1_MIWT2_2_MO40_NTn1_NTA0_NTB0_NTC0_NTD0_NTM0_NEPBS0_NLCA1_NLCB1_ONLL0_PGR2_PLR1_PKA0_SIA2_SS1_SU32_SUM0_SUS256_SPO0_SRVW0_SSO0_SVW2_SK0_SKXCCM0_TLDS0_ULSGRO1_USL1_UIOFGRO0_USFGROn1_VSn1_VWA2_VWB2_WSGRA0_WSGRB0_WS32_WG32_4_1_WGM8_WGMXCC1_WGMXCCGn1
    SolutionIndex: 193
    SolutionNameMin: Cijk_Ailk_Bjlk_HSS_BH_Bias_SHB_HA_S_SAB_SCD_SAV_UserArgs_MT32x128x32_MI16x16x1_SN_LDSB1_AFC1_AFEM1_AFEM1_ASEM1_CLR1_CADS0_DTLA0_DTLB0_DTVA0_DTVB0_EPS0_FDSI0_GRPM1_GRVWA4_GRVWB8_GSU1_GSUAMB_GSUC0_GSUWGMRR0_GLS0_ISA1200_IU2_K1_LBSPPA512_LBSPPB2048_LBSPPM0_LPA16_LPB0_LPM0_LRVW8_LWPMn1_MIAV1_MIWT1_4_MO40_NTn1_NTA0_NTB0_NTC0_NTD0_NTM0_NEPBS0_NLCA1_NLCB1_ONLL0_PGR2_PLR1_PKA0_SIA2_SS0_SU32_SUM0_SUS256_SPO0_SRVW0_SSO0_SVW8_SK0_SKXCCM0_TLDS0_ULSGRO1_USL1_UIOFGRO0_USFGROn1_VSn1_VWA1_VWB4_WSGRA0_WSGRB0_WS32_WG32_4_1_WGM8_WGMXCC1_WGMXCCGn1
    SolutionIndex: 194
    SolutionNameMin: Cijk_Ailk_Bjlk_HSS_BH_Bias_SHB_HA_S_SAB_SCD_SAV_UserArgs_MT64x64x32_MI16x16x1_SN_LDSB1_AFC1_AFEM1_AFEM1_ASEM1_CLR1_CADS0_DTLA0_DTLB0_DTVA0_DTVB0_EPS0_FDSI0_GRPM1_GRVWA4_GRVWB4_GSU1_GSUAMB_GSUC0_GSUWGMRR0_GLS0_ISA1200_IU2_K1_LBSPPA1024_LBSPPB1024_LBSPPM0_LPA32_LPB32_LPM0_LRVW8_LWPMn1_MIAV1_MIWT2_2_MO40_NTn1_NTA0_NTB0_NTC0_NTD0_NTM0_NEPBS0_NLCA1_NLCB1_ONLL0_PGR2_PLR1_PKA0_SIA2_SS1_SU32_SUM0_SUS256_SPO0_SRVW0_SSO0_SVW2_SK0_SKXCCM0_TLDS0_ULSGRO1_USL1_UIOFGRO0_USFGROn1_VSn1_VWA2_VWB2_WSGRA0_WSGRB0_WS32_WG32_4_1_WGM8_WGMXCC1_WGMXCCGn1
    SolutionIndex: 195
    SolutionNameMin: Cijk_Ailk_Bjlk_HSS_BH_Bias_SHB_HA_S_SAB_SCD_SAV_UserArgs_MT64x64x64_MI16x16x1_SN_LDSB0_AFC1_AFEM1_AFEM1_ASEM1_CLR1_CADS0_DTLA0_DTLB0_DTVA1_DTVB1_EPS0_FDSI0_GRPM1_GRVWA8_GRVWB8_GSU1_GSUAMB_GSUC0_GSUWGMRR0_GLS0_ISA1200_IU1_K1_LBSPPA0_LBSPPB0_LBSPPM0_LPA0_LPB0_LPM0_LRVW8_LWPMn1_MIAV1_MIWT2_2_MO40_NTn1_NTA0_NTB0_NTC0_NTD0_NTM0_NEPBS0_NLCA4_NLCB4_ONLL0_PGR1_PLR0_PKA0_SIA3_SS0_SU32_SUM0_SUS256_SPO0_SRVW0_SSO0_SVW8_SK0_SKXCCM0_TLDS0_ULSGRO0_USL1_UIOFGRO0_USFGROn1_VSn1_VWA1_VWB1_WSGRA0_WSGRB0_WS32_WG32_4_1_WGM8_WGMXCC1_WGMXCCGn1
    SolutionIndex: 196
    SolutionNameMin: Cijk_Ailk_Bjlk_HSS_BH_Bias_SHB_HA_S_SAB_SCD_SAV_UserArgs_MT128x32x16_MI16x16x1_SN_LDSB1_AFC1_AFEM1_AFEM1_ASEM1_CLR1_CADS0_DTLA0_DTLB0_DTVA0_DTVB0_EPS1_FDSI0_GRPM1_GRVWA8_GRVWB4_GSU1_GSUAMB_GSUC0_GSUWGMRR0_GLS0_ISA1200_IU1_K1_LBSPPA2048_LBSPPB512_LBSPPM0_LPA0_LPB16_LPM0_LRVW8_LWPMn1_MIAV1_MIWT4_1_MO40_NTn1_NTA0_NTB0_NTC0_NTD0_NTM0_NEPBS0_NLCA1_NLCB1_ONLL0_PGR1_PLR1_PKA0_SIA2_SS1_SU32_SUM0_SUS256_SPO0_SRVW0_SSO0_SVW4_SK0_SKXCCM0_TLDS0_ULSGRO0_USL1_UIOFGRO0_USFGROn1_VSn1_VWA4_VWB1_WSGRA0_WSGRB0_WS32_WG32_4_1_WGM8_WGMXCC1_WGMXCCGn1
    SolutionIndex: 197
    SolutionNameMin: Cijk_Ailk_Bjlk_HSS_BH_Bias_SHB_HA_S_SAB_SCD_SAV_UserArgs_MT64x64x32_MI16x16x1_SN_LDSB1_AFC1_AFEM1_AFEM1_ASEM1_CLR1_CADS0_DTLA0_DTLB0_DTVA0_DTVB0_EPS0_FDSI0_GRPM1_GRVWA1_GRVWB4_GSU1_GSUAMB_GSUC0_GSUWGMRR0_GLS0_ISA1200_IU2_K1_LBSPPA1024_LBSPPB1024_LBSPPM0_LPA32_LPB32_LPM0_LRVW8_LWPMn1_MIAV1_MIWT2_2_MO40_NTn1_NTA0_NTB0_NTC0_NTD0_NTM0_NEPBS0_NLCA1_NLCB1_ONLL0_PGR2_PLR1_PKA0_SIA2_SS1_SU32_SUM0_SUS256_SPO0_SRVW0_SSO0_SVW2_SK0_SKXCCM0_TLDS0_ULSGRO1_USL1_UIOFGRO0_USFGROn1_VSn1_VWA2_VWB2_WSGRA0_WSGRB0_WS32_WG32_4_1_WGM8_WGMXCC1_WGMXCCGn1
    SolutionIndex: 198
    SolutionNameMin: Cijk_Ailk_Bjlk_HSS_BH_Bias_SHB_HA_S_SAB_SCD_SAV_UserArgs_MT64x64x32_MI16x16x1_SN_LDSB1_AFC1_AFEM1_AFEM1_ASEM1_CLR1_CADS0_DTLA0_DTLB0_DTVA0_DTVB0_EPS1_FDSI0_GRPM1_GRVWA1_GRVWB1_GSU1_GSUAMB_GSUC0_GSUWGMRR0_GLS0_ISA1200_IU2_K1_LBSPPA1024_LBSPPB1024_LBSPPM0_LPA32_LPB32_LPM0_LRVW8_LWPMn1_MIAV1_MIWT2_2_MO40_NTn1_NTA0_NTB0_NTC0_NTD0_NTM0_NEPBS0_NLCA1_NLCB1_ONLL0_PGR1_PLR1_PKA0_SIA2_SS1_SU32_SUM0_SUS256_SPO0_SRVW0_SSO0_SVW2_SK0_SKXCCM0_TLDS0_ULSGRO0_USL1_UIOFGRO0_USFGROn1_VSn1_VWA2_VWB2_WSGRA0_WSGRB0_WS32_WG32_4_1_WGM8_WGMXCC1_WGMXCCGn1
    SolutionIndex: 199
    SolutionNameMin: Cijk_Ailk_Bjlk_HSS_BH_Bias_SHB_HA_S_SAB_SCD_SAV_UserArgs_MT64x64x64_MI16x16x1_SN_LDSB1_AFC1_AFEM1_AFEM1_ASEM1_CLR1_CADS0_DTLA0_DTLB0_DTVA0_DTVB0_EPS1_FDSI0_GRPM1_GRVWA8_GRVWB8_GSU1_GSUAMB_GSUC0_GSUWGMRR0_GLS0_ISA1200_IU4_K1_LBSPPA1024_LBSPPB1024_LBSPPM0_LPA32_LPB32_LPM0_LRVW8_LWPMn1_MIAV1_MIWT2_2_MO40_NTn1_NTA0_NTB0_NTC0_NTD0_NTM0_NEPBS0_NLCA1_NLCB1_ONLL0_PGR1_PLR1_PKA0_SIA2_SS1_SU32_SUM0_SUS256_SPO0_SRVW0_SSO0_SVW2_SK0_SKXCCM0_TLDS0_ULSGRO0_USL1_UIOFGRO0_USFGROn1_VSn1_VWA2_VWB2_WSGRA0_WSGRB0_WS32_WG32_4_1_WGM8_WGMXCC1_WGMXCCGn1
    SolutionIndex: 202
    SolutionNameMin: Cijk_Ailk_Bjlk_HSS_BH_Bias_SHB_HA_S_SAB_SCD_SAV_UserArgs_MT64x64x32_MI16x16x1_SN_LDSB1_AFC1_AFEM1_AFEM1_ASEM1_CLR1_CADS0_DTLA0_DTLB0_DTVA0_DTVB0_EPS0_FDSI0_GRPM1_GRVWA8_GRVWB4_GSU1_GSUAMB_GSUC0_GSUWGMRR0_GLS0_ISA1200_IU2_K1_LBSPPA1024_LBSPPB1024_LBSPPM0_LPA32_LPB32_LPM0_LRVW8_LWPMn1_MIAV1_MIWT2_2_MO40_NTn1_NTA0_NTB0_NTC0_NTD0_NTM0_NEPBS0_NLCA1_NLCB1_ONLL0_PGR2_PLR1_PKA0_SIA2_SS1_SU32_SUM0_SUS256_SPO0_SRVW0_SSO0_SVW2_SK0_SKXCCM0_TLDS0_ULSGRO0_USL1_UIOFGRO0_USFGROn1_VSn1_VWA2_VWB2_WSGRA0_WSGRB0_WS32_WG32_4_1_WGM8_WGMXCC1_WGMXCCGn1
    SolutionIndex: 203
    SolutionNameMin: Cijk_Ailk_Bjlk_HSS_BH_Bias_SHB_HA_S_SAB_SCD_SAV_UserArgs_MT64x64x32_MI16x16x1_SN_LDSB1_AFC1_AFEM1_AFEM1_ASEM1_CLR1_CADS0_DTLA0_DTLB0_DTVA0_DTVB0_EPS0_FDSI0_GRPM1_GRVWA1_GRVWB1_GSU1_GSUAMB_GSUC0_GSUWGMRR0_GLS0_ISA1200_IU2_K1_LBSPPA1024_LBSPPB1024_LBSPPM0_LPA32_LPB32_LPM0_LRVW8_LWPMn1_MIAV1_MIWT2_2_MO40_NTn1_NTA0_NTB0_NTC0_NTD0_NTM0_NEPBS0_NLCA1_NLCB1_ONLL0_PGR2_PLR1_PKA0_SIA2_SS1_SU32_SUM0_SUS256_SPO0_SRVW0_SSO0_SVW2_SK0_SKXCCM0_TLDS0_ULSGRO0_USL1_UIOFGRO0_USFGROn1_VSn1_VWA2_VWB2_WSGRA0_WSGRB0_WS32_WG32_4_1_WGM8_WGMXCC1_WGMXCCGn1
    SolutionIndex: 207
    SolutionNameMin: Cijk_Ailk_Bjlk_HSS_BH_Bias_SHB_HA_S_SAB_SCD_SAV_UserArgs_MT32x128x32_MI16x16x1_SN_LDSB0_AFC1_AFEM1_AFEM1_ASEM1_CLR1_CADS0_DTLA0_DTLB0_DTVA1_DTVB0_EPS0_FDSI0_GRPM1_GRVWA8_GRVWB8_GSU1_GSUAMB_GSUC0_GSUWGMRR0_GLS0_ISA1200_IU1_K1_LBSPPA0_LBSPPB2048_LBSPPM0_LPA0_LPB0_LPM0_LRVW8_LWPMn1_MIAV1_MIWT1_4_MO40_NTn1_NTA0_NTB0_NTC0_NTD0_NTM0_NEPBS0_NLCA1_NLCB1_ONLL0_PGR2_PLR1_PKA0_SIA3_SS0_SU32_SUM0_SUS256_SPO0_SRVW0_SSO0_SVW8_SK0_SKXCCM0_TLDS0_ULSGRO0_USL1_UIOFGRO0_USFGROn1_VSn1_VWA1_VWB4_WSGRA0_WSGRB0_WS32_WG32_4_1_WGM8_WGMXCC1_WGMXCCGn1
    SolutionIndex: 213
    SolutionNameMin: Cijk_Ailk_Bjlk_HSS_BH_Bias_SHB_HA_S_SAB_SCD_SAV_UserArgs_MT64x64x16_MI16x16x1_SN_LDSB1_AFC1_AFEM1_AFEM1_ASEM1_CLR1_CADS0_DTLA0_DTLB0_DTVA0_DTVB0_EPS1_FDSI0_GRPM1_GRVWA8_GRVWB4_GSU1_GSUAMB_GSUC0_GSUWGMRR0_GLS0_ISA1200_IU1_K1_LBSPPA1024_LBSPPB1024_LBSPPM0_LPA32_LPB32_LPM0_LRVW8_LWPMn1_MIAV1_MIWT2_2_MO40_NTn1_NTA0_NTB0_NTC0_NTD0_NTM0_NEPBS0_NLCA1_NLCB1_ONLL0_PGR1_PLR1_PKA0_SIA2_SS1_SU32_SUM0_SUS256_SPO0_SRVW0_SSO0_SVW2_SK0_SKXCCM0_TLDS0_ULSGRO0_USL1_UIOFGRO0_USFGROn1_VSn1_VWA2_VWB2_WSGRA0_WSGRB0_WS32_WG32_4_1_WGM8_WGMXCC1_WGMXCCGn1
    SolutionIndex: 214
    SolutionNameMin: Cijk_Ailk_Bjlk_HSS_BH_Bias_SHB_HA_S_SAB_SCD_SAV_UserArgs_MT64x64x16_MI16x16x1_SN_LDSB1_AFC1_AFEM1_AFEM1_ASEM1_CLR1_CADS0_DTLA0_DTLB0_DTVA0_DTVB0_EPS0_FDSI0_GRPM1_GRVWA1_GRVWB4_GSU1_GSUAMB_GSUC0_GSUWGMRR0_GLS0_ISA1200_IU1_K1_LBSPPA1024_LBSPPB1024_LBSPPM0_LPA32_LPB32_LPM0_LRVW8_LWPMn1_MIAV1_MIWT2_2_MO40_NTn1_NTA0_NTB0_NTC0_NTD0_NTM0_NEPBS0_NLCA1_NLCB1_ONLL0_PGR2_PLR1_PKA0_SIA2_SS1_SU32_SUM0_SUS256_SPO0_SRVW0_SSO0_SVW2_SK0_SKXCCM0_TLDS0_ULSGRO1_USL1_UIOFGRO0_USFGROn1_VSn1_VWA2_VWB2_WSGRA0_WSGRB0_WS32_WG32_4_1_WGM8_WGMXCC1_WGMXCCGn1
    SolutionIndex: 216
    SolutionNameMin: Cijk_Ailk_Bjlk_HSS_BH_Bias_SHB_HA_S_SAB_SCD_SAV_UserArgs_MT64x64x32_MI16x16x1_SN_LDSB1_AFC1_AFEM1_AFEM1_ASEM1_CLR1_CADS0_DTLA0_DTLB0_DTVA0_DTVB0_EPS0_FDSI0_GRPM1_GRVWA4_GRVWB8_GSU1_GSUAMB_GSUC0_GSUWGMRR0_GLS0_ISA1200_IU2_K1_LBSPPA1024_LBSPPB1024_LBSPPM0_LPA32_LPB32_LPM0_LRVW8_LWPMn1_MIAV1_MIWT2_2_MO40_NTn1_NTA0_NTB0_NTC0_NTD0_NTM0_NEPBS0_NLCA1_NLCB1_ONLL0_PGR2_PLR1_PKA0_SIA2_SS1_SU32_SUM0_SUS256_SPO0_SRVW0_SSO0_SVW2_SK0_SKXCCM0_TLDS0_ULSGRO1_USL1_UIOFGRO0_USFGROn1_VSn1_VWA2_VWB2_WSGRA0_WSGRB0_WS32_WG32_4_1_WGM8_WGMXCC1_WGMXCCGn1
    SolutionIndex: 218
    SolutionNameMin: Cijk_Ailk_Bjlk_HSS_BH_Bias_SHB_HA_S_SAB_SCD_SAV_UserArgs_MT16x16x32_MI16x16x1_SN_LDSB0_AFC1_AFEM1_AFEM1_ASEM1_CLR1_CADS0_DTLA0_DTLB0_DTVA0_DTVB0_EPS1_FDSI0_GRPM1_GRVWA4_GRVWB4_GSU1_GSUAMB_GSUC0_GSUWGMRR0_GLS0_ISA1200_IU1_K1_LBSPPA256_LBSPPB256_LBSPPM0_LPA16_LPB16_LPM0_LRVW8_LWPMn1_MIAV1_MIWT1_1_MO40_NTn1_NTA0_NTB0_NTC0_NTD0_NTM0_NEPBS0_NLCA1_NLCB1_ONLL0_PGR1_PLR1_PKA0_SIA3_SS0_SU32_SUM0_SUS256_SPO0_SRVW0_SSO0_SVW8_SK0_SKXCCM0_TLDS0_ULSGRO0_USL1_UIOFGRO0_USFGROn1_VSn1_VWA1_VWB1_WSGRA0_WSGRB0_WS32_WG16_2_1_WGM8_WGMXCC1_WGMXCCGn1
    SolutionIndex: 219
    SolutionNameMin: Cijk_Ailk_Bjlk_HSS_BH_Bias_SHB_HA_S_SAB_SCD_SAV_UserArgs_MT32x32x64_MI16x16x1_SN_LDSB1_AFC1_AFEM1_AFEM1_ASEM1_CLR1_CADS0_DTLA0_DTLB0_DTVA0_DTVB0_EPS0_FDSI0_GRPM1_GRVWA1_GRVWB1_GSU1_GSUAMB_GSUC0_GSUWGMRR0_GLS0_ISA1200_IU4_K1_LBSPPA512_LBSPPB512_LBSPPM0_LPA16_LPB16_LPM0_LRVW8_LWPMn1_MIAV1_MIWT1_1_MO40_NTn1_NTA0_NTB0_NTC0_NTD0_NTM0_NEPBS0_NLCA1_NLCB1_ONLL0_PGR2_PLR1_PKA0_SIA2_SS0_SU32_SUM0_SUS256_SPO0_SRVW0_SSO0_SVW8_SK0_SKXCCM0_TLDS0_ULSGRO0_USL1_UIOFGRO0_USFGROn1_VSn1_VWA1_VWB1_WSGRA0_WSGRB0_WS32_WG32_4_1_WGM8_WGMXCC1_WGMXCCGn1
    SolutionIndex: 220
    SolutionNameMin: Cijk_Ailk_Bjlk_HSS_BH_Bias_SHB_HA_S_SAB_SCD_SAV_UserArgs_MT64x64x32_MI16x16x1_SN_LDSB0_AFC1_AFEM1_AFEM1_ASEM1_CLR1_CADS0_DTLA0_DTLB0_DTVA1_DTVB0_EPS1_FDSI0_GRPM1_GRVWA8_GRVWB4_GSU1_GSUAMB_GSUC0_GSUWGMRR0_GLS0_ISA1200_IU1_K1_LBSPPA0_LBSPPB1024_LBSPPM0_LPA0_LPB32_LPM0_LRVW8_LWPMn1_MIAV1_MIWT2_2_MO40_NTn1_NTA0_NTB0_NTC0_NTD0_NTM0_NEPBS0_NLCA2_NLCB1_ONLL0_PGR1_PLR1_PKA0_SIA3_SS0_SU32_SUM0_SUS256_SPO0_SRVW0_SSO0_SVW8_SK0_SKXCCM0_TLDS0_ULSGRO0_USL1_UIOFGRO0_USFGROn1_VSn1_VWA1_VWB2_WSGRA0_WSGRB0_WS32_WG32_4_1_WGM8_WGMXCC1_WGMXCCGn1
    SolutionIndex: 221
    SolutionNameMin: Cijk_Ailk_Bjlk_HSS_BH_Bias_SHB_HA_S_SAB_SCD_SAV_UserArgs_MT64x64x16_MI16x16x1_SN_LDSB1_AFC1_AFEM1_AFEM1_ASEM1_CLR1_CADS0_DTLA0_DTLB0_DTVA0_DTVB0_EPS0_FDSI0_GRPM1_GRVWA8_GRVWB8_GSU1_GSUAMB_GSUC0_GSUWGMRR0_GLS0_ISA1200_IU1_K1_LBSPPA1024_LBSPPB1024_LBSPPM0_LPA32_LPB32_LPM0_LRVW8_LWPMn1_MIAV1_MIWT2_2_MO40_NTn1_NTA0_NTB0_NTC0_NTD0_NTM0_NEPBS0_NLCA1_NLCB1_ONLL0_PGR2_PLR1_PKA0_SIA2_SS1_SU32_SUM0_SUS256_SPO0_SRVW0_SSO0_SVW2_SK0_SKXCCM0_TLDS0_ULSGRO0_USL1_UIOFGRO0_USFGROn1_VSn1_VWA2_VWB2_WSGRA0_WSGRB0_WS32_WG32_4_1_WGM8_WGMXCC1_WGMXCCGn1
    SolutionIndex: 223
    SolutionNameMin: Cijk_Ailk_Bjlk_HSS_BH_Bias_SHB_HA_S_SAB_SCD_SAV_UserArgs_MT64x64x32_MI16x16x1_SN_LDSB1_AFC1_AFEM1_AFEM1_ASEM1_CLR1_CADS0_DTLA0_DTLB0_DTVA0_DTVB0_EPS1_FDSI0_GRPM1_GRVWA4_GRVWB8_GSU1_GSUAMB_GSUC0_GSUWGMRR0_GLS0_ISA1200_IU2_K1_LBSPPA1024_LBSPPB1024_LBSPPM0_LPA32_LPB32_LPM0_LRVW8_LWPMn1_MIAV1_MIWT2_2_MO40_NTn1_NTA0_NTB0_NTC0_NTD0_NTM0_NEPBS0_NLCA1_NLCB1_ONLL0_PGR1_PLR1_PKA0_SIA2_SS1_SU32_SUM0_SUS256_SPO0_SRVW0_SSO0_SVW2_SK0_SKXCCM0_TLDS0_ULSGRO0_USL1_UIOFGRO0_USFGROn1_VSn1_VWA2_VWB2_WSGRA0_WSGRB0_WS32_WG32_4_1_WGM8_WGMXCC1_WGMXCCGn1
    SolutionIndex: 224
    SolutionNameMin: Cijk_Ailk_Bjlk_HSS_BH_Bias_SHB_HA_S_SAB_SCD_SAV_UserArgs_MT64x64x32_MI16x16x1_SN_LDSB1_AFC1_AFEM1_AFEM1_ASEM1_CLR1_CADS0_DTLA0_DTLB0_DTVA0_DTVB0_EPS0_FDSI0_GRPM1_GRVWA4_GRVWB1_GSU1_GSUAMB_GSUC0_GSUWGMRR0_GLS0_ISA1200_IU2_K1_LBSPPA1024_LBSPPB1024_LBSPPM0_LPA32_LPB32_LPM0_LRVW8_LWPMn1_MIAV1_MIWT2_2_MO40_NTn1_NTA0_NTB0_NTC0_NTD0_NTM0_NEPBS0_NLCA1_NLCB1_ONLL0_PGR2_PLR1_PKA0_SIA2_SS1_SU32_SUM0_SUS256_SPO0_SRVW0_SSO0_SVW2_SK0_SKXCCM0_TLDS0_ULSGRO1_USL1_UIOFGRO0_USFGROn1_VSn1_VWA2_VWB2_WSGRA0_WSGRB0_WS32_WG32_4_1_WGM8_WGMXCC1_WGMXCCGn1
    SolutionIndex: 226
    SolutionNameMin: Cijk_Ailk_Bjlk_HSS_BH_Bias_SHB_HA_S_SAB_SCD_SAV_UserArgs_MT64x64x32_MI16x16x1_SN_LDSB0_AFC1_AFEM1_AFEM1_ASEM1_CLR1_CADS0_DTLA0_DTLB0_DTVA0_DTVB0_EPS0_FDSI0_GRPM1_GRVWA4_GRVWB4_GSU1_GSUAMB_GSUC0_GSUWGMRR0_GLS0_ISA1200_IU1_K1_LBSPPA1024_LBSPPB1024_LBSPPM0_LPA32_LPB32_LPM0_LRVW8_LWPMn1_MIAV1_MIWT2_2_MO40_NTn1_NTA0_NTB0_NTC0_NTD0_NTM0_NEPBS0_NLCA1_NLCB1_ONLL0_PGR2_PLR1_PKA0_SIA3_SS1_SU32_SUM0_SUS256_SPO0_SRVW0_SSO0_SVW2_SK0_SKXCCM0_TLDS0_ULSGRO1_USL1_UIOFGRO0_USFGROn1_VSn1_VWA2_VWB2_WSGRA0_WSGRB0_WS32_WG32_4_1_WGM8_WGMXCC1_WGMXCCGn1
    SolutionIndex: 227
    SolutionNameMin: Cijk_Ailk_Bjlk_HSS_BH_Bias_SHB_HA_S_SAB_SCD_SAV_UserArgs_MT128x32x16_MI16x16x1_SN_LDSB1_AFC1_AFEM1_AFEM1_ASEM1_CLR1_CADS0_DTLA0_DTLB0_DTVA0_DTVB0_EPS1_FDSI0_GRPM1_GRVWA4_GRVWB4_GSU1_GSUAMB_GSUC0_GSUWGMRR0_GLS0_ISA1200_IU1_K1_LBSPPA2048_LBSPPB512_LBSPPM0_LPA0_LPB16_LPM0_LRVW8_LWPMn1_MIAV1_MIWT4_1_MO40_NTn1_NTA0_NTB0_NTC0_NTD0_NTM0_NEPBS0_NLCA1_NLCB1_ONLL0_PGR1_PLR1_PKA0_SIA2_SS1_SU32_SUM0_SUS256_SPO0_SRVW0_SSO0_SVW4_SK0_SKXCCM0_TLDS0_ULSGRO0_USL1_UIOFGRO0_USFGROn1_VSn1_VWA4_VWB1_WSGRA0_WSGRB0_WS32_WG32_4_1_WGM8_WGMXCC1_WGMXCCGn1
    SolutionIndex: 228
    SolutionNameMin: Cijk_Ailk_Bjlk_HSS_BH_Bias_SHB_HA_S_SAB_SCD_SAV_UserArgs_MT64x64x32_MI16x16x1_SN_LDSB0_AFC1_AFEM1_AFEM1_ASEM1_CLR1_CADS0_DTLA0_DTLB0_DTVA0_DTVB1_EPS0_FDSI0_GRPM1_GRVWA8_GRVWB8_GSU1_GSUAMB_GSUC0_GSUWGMRR0_GLS0_ISA1200_IU1_K1_LBSPPA1024_LBSPPB0_LBSPPM0_LPA32_LPB0_LPM0_LRVW8_LWPMn1_MIAV1_MIWT2_2_MO40_NTn1_NTA0_NTB0_NTC0_NTD0_NTM0_NEPBS0_NLCA1_NLCB2_ONLL0_PGR2_PLR1_PKA0_SIA3_SS1_SU32_SUM0_SUS256_SPO0_SRVW0_SSO0_SVW2_SK0_SKXCCM0_TLDS0_ULSGRO0_USL1_UIOFGRO0_USFGROn1_VSn1_VWA2_VWB1_WSGRA0_WSGRB0_WS32_WG32_4_1_WGM8_WGMXCC1_WGMXCCGn1
    SolutionIndex: 230
    SolutionNameMin: Cijk_Ailk_Bjlk_HSS_BH_Bias_SHB_HA_S_SAB_SCD_SAV_UserArgs_MT64x64x16_MI16x16x1_SN_LDSB1_AFC1_AFEM1_AFEM1_ASEM1_CLR1_CADS0_DTLA0_DTLB0_DTVA0_DTVB0_EPS0_FDSI0_GRPM1_GRVWA1_GRVWB1_GSU1_GSUAMB_GSUC0_GSUWGMRR0_GLS0_ISA1200_IU1_K1_LBSPPA1024_LBSPPB1024_LBSPPM0_LPA32_LPB32_LPM0_LRVW8_LWPMn1_MIAV1_MIWT2_2_MO40_NTn1_NTA0_NTB0_NTC0_NTD0_NTM0_NEPBS0_NLCA1_NLCB1_ONLL0_PGR2_PLR1_PKA0_SIA2_SS1_SU32_SUM0_SUS256_SPO0_SRVW0_SSO0_SVW2_SK0_SKXCCM0_TLDS0_ULSGRO0_USL1_UIOFGRO0_USFGROn1_VSn1_VWA2_VWB2_WSGRA0_WSGRB0_WS32_WG32_4_1_WGM8_WGMXCC1_WGMXCCGn1
    SolutionIndex: 231
    SolutionNameMin: Cijk_Ailk_Bjlk_HSS_BH_Bias_SHB_HA_S_SAB_SCD_SAV_UserArgs_MT64x64x64_MI16x16x1_SN_LDSB1_AFC1_AFEM1_AFEM1_ASEM1_CLR1_CADS0_DTLA0_DTLB0_DTVA0_DTVB0_EPS0_FDSI0_GRPM1_GRVWA8_GRVWB8_GSU1_GSUAMB_GSUC0_GSUWGMRR0_GLS0_ISA1200_IU1_K1_LBSPPA1024_LBSPPB1024_LBSPPM0_LPA32_LPB32_LPM0_LRVW8_LWPMn1_MIAV1_MIWT2_2_MO40_NTn1_NTA0_NTB0_NTC0_NTD0_NTM0_NEPBS0_NLCA1_NLCB1_ONLL0_PGR2_PLR1_PKA0_SIA3_SS1_SU32_SUM0_SUS256_SPO0_SRVW0_SSO0_SVW2_SK0_SKXCCM0_TLDS0_ULSGRO0_USL1_UIOFGRO0_USFGROn1_VSn1_VWA2_VWB2_WSGRA0_WSGRB0_WS32_WG32_4_1_WGM8_WGMXCC1_WGMXCCGn1
    SolutionIndex: 234
    SolutionNameMin: Cijk_Ailk_Bjlk_HSS_BH_Bias_SHB_HA_S_SAB_SCD_SAV_UserArgs_MT16x256x32_MI16x16x1_SN_LDSB0_AFC1_AFEM1_AFEM1_ASEM1_CLR1_CADS0_DTLA0_DTLB0_DTVA0_DTVB1_EPS0_FDSI0_GRPM1_GRVWA8_GRVWB8_GSU1_GSUAMB_GSUC0_GSUWGMRR0_GLS0_ISA1200_IU1_K1_LBSPPA256_LBSPPB0_LBSPPM0_LPA16_LPB0_LPM0_LRVW8_LWPMn1_MIAV1_MIWT1_8_MO40_NTn1_NTA0_NTB0_NTC0_NTD0_NTM0_NEPBS0_NLCA1_NLCB2_ONLL0_PGR2_PLR1_PKA0_SIA3_SS0_SU32_SUM0_SUS256_SPO0_SRVW0_SSO0_SVW8_SK0_SKXCCM0_TLDS0_ULSGRO0_USL1_UIOFGRO0_USFGROn1_VSn1_VWA1_VWB1_WSGRA0_WSGRB0_WS32_WG16_4_1_WGM8_WGMXCC1_WGMXCCGn1
    SolutionIndex: 235
    SolutionNameMin: Cijk_Ailk_Bjlk_HSS_BH_Bias_SHB_HA_S_SAB_SCD_SAV_UserArgs_MT64x64x16_MI16x16x1_SN_LDSB1_AFC1_AFEM1_AFEM1_ASEM1_CLR1_CADS0_DTLA0_DTLB0_DTVA0_DTVB0_EPS1_FDSI0_GRPM1_GRVWA8_GRVWB8_GSU1_GSUAMB_GSUC0_GSUWGMRR0_GLS0_ISA1200_IU1_K1_LBSPPA1024_LBSPPB1024_LBSPPM0_LPA32_LPB32_LPM0_LRVW8_LWPMn1_MIAV1_MIWT2_2_MO40_NTn1_NTA0_NTB0_NTC0_NTD0_NTM0_NEPBS0_NLCA1_NLCB1_ONLL0_PGR1_PLR1_PKA0_SIA2_SS1_SU32_SUM0_SUS256_SPO0_SRVW0_SSO0_SVW2_SK0_SKXCCM0_TLDS0_ULSGRO0_USL1_UIOFGRO0_USFGROn1_VSn1_VWA2_VWB2_WSGRA0_WSGRB0_WS32_WG32_4_1_WGM8_WGMXCC1_WGMXCCGn1
    SolutionIndex: 236
    SolutionNameMin: Cijk_Ailk_Bjlk_HSS_BH_Bias_SHB_HA_S_SAB_SCD_SAV_UserArgs_MT64x64x32_MI16x16x1_SN_LDSB1_AFC1_AFEM1_AFEM1_ASEM1_CLR1_CADS0_DTLA0_DTLB0_DTVA0_DTVB0_EPS0_FDSI0_GRPM1_GRVWA8_GRVWB8_GSU1_GSUAMB_GSUC0_GSUWGMRR0_GLS0_ISA1200_IU2_K1_LBSPPA1024_LBSPPB1024_LBSPPM0_LPA32_LPB32_LPM0_LRVW8_LWPMn1_MIAV1_MIWT2_2_MO40_NTn1_NTA0_NTB0_NTC0_NTD0_NTM0_NEPBS0_NLCA1_NLCB1_ONLL0_PGR2_PLR1_PKA0_SIA2_SS1_SU32_SUM0_SUS256_SPO0_SRVW0_SSO0_SVW2_SK0_SKXCCM0_TLDS0_ULSGRO0_USL1_UIOFGRO0_USFGROn1_VSn1_VWA2_VWB2_WSGRA0_WSGRB0_WS32_WG32_4_1_WGM8_WGMXCC1_WGMXCCGn1
    SolutionIndex: 240
    SolutionNameMin: Cijk_Ailk_Bjlk_HSS_BH_Bias_SHB_HA_S_SAB_SCD_SAV_UserArgs_MT64x64x16_MI16x16x1_SN_LDSB1_AFC1_AFEM1_AFEM1_ASEM1_CLR1_CADS0_DTLA0_DTLB0_DTVA0_DTVB0_EPS0_FDSI0_GRPM1_GRVWA4_GRVWB8_GSU1_GSUAMB_GSUC0_GSUWGMRR0_GLS0_ISA1200_IU1_K1_LBSPPA1024_LBSPPB1024_LBSPPM0_LPA32_LPB32_LPM0_LRVW8_LWPMn1_MIAV1_MIWT2_2_MO40_NTn1_NTA0_NTB0_NTC0_NTD0_NTM0_NEPBS0_NLCA1_NLCB1_ONLL0_PGR2_PLR1_PKA0_SIA2_SS1_SU32_SUM0_SUS256_SPO0_SRVW0_SSO0_SVW2_SK0_SKXCCM0_TLDS0_ULSGRO1_USL1_UIOFGRO0_USFGROn1_VSn1_VWA2_VWB2_WSGRA0_WSGRB0_WS32_WG32_4_1_WGM8_WGMXCC1_WGMXCCGn1
    SolutionIndex: 244
    SolutionNameMin: Cijk_Ailk_Bjlk_HSS_BH_Bias_SHB_HA_S_SAB_SCD_SAV_UserArgs_MT64x64x64_MI16x16x1_SN_LDSB0_AFC1_AFEM1_AFEM1_ASEM1_CLR1_CADS0_DTLA0_DTLB0_DTVA0_DTVB1_EPS1_FDSI0_GRPM1_GRVWA8_GRVWB8_GSU1_GSUAMB_GSUC0_GSUWGMRR0_GLS0_ISA1200_IU1_K1_LBSPPA1024_LBSPPB0_LBSPPM0_LPA32_LPB0_LPM0_LRVW8_LWPMn1_MIAV1_MIWT2_2_MO40_NTn1_NTA0_NTB0_NTC0_NTD0_NTM0_NEPBS0_NLCA1_NLCB4_ONLL0_PGR1_PLR1_PKA0_SIA3_SS1_SU32_SUM0_SUS256_SPO0_SRVW0_SSO0_SVW2_SK0_SKXCCM0_TLDS0_ULSGRO0_USL1_UIOFGRO0_USFGROn1_VSn1_VWA2_VWB1_WSGRA0_WSGRB0_WS32_WG32_4_1_WGM8_WGMXCC1_WGMXCCGn1
    SolutionIndex: 245
    SolutionNameMin: Cijk_Ailk_Bjlk_HSS_BH_Bias_SHB_HA_S_SAB_SCD_SAV_UserArgs_MT128x128x16_MI16x16x1_SN_LDSB1_AFC1_AFEM1_AFEM1_ASEM1_CLR1_CADS0_DTLA0_DTLB0_DTVA0_DTVB0_EPS0_FDSI0_GRPM1_GRVWA8_GRVWB4_GSU1_GSUAMB_GSUC0_GSUWGMRR0_GLS0_ISA1200_IU1_K1_LBSPPA2048_LBSPPB2048_LBSPPM0_LPA0_LPB0_LPM0_LRVW8_LWPMn1_MIAV1_MIWT4_4_MO40_NTn1_NTA0_NTB0_NTC0_NTD0_NTM0_NEPBS0_NLCA1_NLCB1_ONLL0_PGR2_PLR1_PKA0_SIA2_SS1_SU32_SUM0_SUS256_SPO0_SRVW0_SSO0_SVW4_SK0_SKXCCM0_TLDS0_ULSGRO0_USL1_UIOFGRO0_USFGROn1_VSn1_VWA4_VWB4_WSGRA0_WSGRB0_WS32_WG32_4_1_WGM8_WGMXCC1_WGMXCCGn1
    SolutionIndex: 246
    SolutionNameMin: Cijk_Ailk_Bjlk_HSS_BH_Bias_SHB_HA_S_SAB_SCD_SAV_UserArgs_MT128x128x16_MI16x16x1_SN_LDSB1_AFC1_AFEM1_AFEM1_ASEM1_CLR1_CADS0_DTLA0_DTLB0_DTVA0_DTVB0_EPS1_FDSI0_GRPM1_GRVWA1_GRVWB1_GSU1_GSUAMB_GSUC0_GSUWGMRR0_GLS0_ISA1200_IU1_K1_LBSPPA2048_LBSPPB2048_LBSPPM0_LPA0_LPB0_LPM0_LRVW8_LWPMn1_MIAV1_MIWT4_4_MO40_NTn1_NTA0_NTB0_NTC0_NTD0_NTM0_NEPBS0_NLCA1_NLCB1_ONLL0_PGR1_PLR1_PKA0_SIA2_SS1_SU32_SUM0_SUS256_SPO0_SRVW0_SSO0_SVW4_SK0_SKXCCM0_TLDS0_ULSGRO0_USL1_UIOFGRO0_USFGROn1_VSn1_VWA4_VWB4_WSGRA0_WSGRB0_WS32_WG32_4_1_WGM8_WGMXCC1_WGMXCCGn1
    SolutionIndex: 247
    SolutionNameMin: Cijk_Ailk_Bjlk_HSS_BH_Bias_SHB_HA_S_SAB_SCD_SAV_UserArgs_MT32x32x32_MI16x16x1_SN_LDSB0_AFC1_AFEM1_AFEM1_ASEM1_CLR1_CADS0_DTLA0_DTLB0_DTVA1_DTVB0_EPS1_FDSI0_GRPM1_GRVWA8_GRVWB1_GSU1_GSUAMB_GSUC0_GSUWGMRR0_GLS0_ISA1200_IU1_K1_LBSPPA0_LBSPPB512_LBSPPM0_LPA0_LPB16_LPM0_LRVW8_LWPMn1_MIAV1_MIWT1_1_MO40_NTn1_NTA0_NTB0_NTC0_NTD0_NTM0_NEPBS0_NLCA1_NLCB1_ONLL0_PGR1_PLR1_PKA0_SIA3_SS1_SU32_SUM0_SUS256_SPO0_SRVW0_SSO0_SVW1_SK0_SKXCCM0_TLDS0_ULSGRO0_USL1_UIOFGRO0_USFGROn1_VSn1_VWA1_VWB1_WSGRA0_WSGRB0_WS32_WG32_4_1_WGM8_WGMXCC1_WGMXCCGn1
    SolutionIndex: 249
    SolutionNameMin: Cijk_Ailk_Bjlk_HSS_BH_Bias_SHB_HA_S_SAB_SCD_SAV_UserArgs_MT64x64x32_MI16x16x1_SN_LDSB1_AFC1_AFEM1_AFEM1_ASEM1_CLR1_CADS0_DTLA0_DTLB0_DTVA0_DTVB0_EPS1_FDSI0_GRPM1_GRVWA4_GRVWB4_GSU1_GSUAMB_GSUC0_GSUWGMRR0_GLS0_ISA1200_IU2_K1_LBSPPA1024_LBSPPB1024_LBSPPM0_LPA32_LPB32_LPM0_LRVW8_LWPMn1_MIAV1_MIWT2_2_MO40_NTn1_NTA0_NTB0_NTC0_NTD0_NTM0_NEPBS0_NLCA1_NLCB1_ONLL0_PGR1_PLR1_PKA0_SIA2_SS1_SU32_SUM0_SUS256_SPO0_SRVW0_SSO0_SVW2_SK0_SKXCCM0_TLDS0_ULSGRO0_USL1_UIOFGRO0_USFGROn1_VSn1_VWA2_VWB2_WSGRA0_WSGRB0_WS32_WG32_4_1_WGM8_WGMXCC1_WGMXCCGn1
    SolutionIndex: 251
    SolutionNameMin: Cijk_Ailk_Bjlk_HSS_BH_Bias_SHB_HA_S_SAB_SCD_SAV_UserArgs_MT16x256x16_MI16x16x1_SN_LDSB0_AFC1_AFEM1_AFEM1_ASEM1_CLR1_CADS0_DTLA0_DTLB0_DTVA1_DTVB1_EPS0_FDSI0_GRPM1_GRVWA8_GRVWB8_GSU1_GSUAMB_GSUC0_GSUWGMRR0_GLS0_ISA1200_IU1_K1_LBSPPA0_LBSPPB0_LBSPPM0_LPA0_LPB0_LPM0_LRVW8_LWPMn1_MIAV1_MIWT1_8_MO40_NTn1_NTA0_NTB0_NTC0_NTD0_NTM0_NEPBS0_NLCA1_NLCB1_ONLL0_PGR1_PLR0_PKA0_SIA3_SS0_SU32_SUM0_SUS256_SPO0_SRVW0_SSO0_SVW8_SK0_SKXCCM0_TLDS0_ULSGRO0_USL1_UIOFGRO0_USFGROn1_VSn1_VWA1_VWB1_WSGRA0_WSGRB0_WS32_WG16_4_1_WGM8_WGMXCC1_WGMXCCGn1
    SolutionIndex: 252
    SolutionNameMin: Cijk_Ailk_Bjlk_HSS_BH_Bias_SHB_HA_S_SAB_SCD_SAV_UserArgs_MT64x64x64_MI16x16x1_SN_LDSB1_AFC1_AFEM1_AFEM1_ASEM1_CLR1_CADS0_DTLA0_DTLB0_DTVA0_DTVB0_EPS1_FDSI0_GRPM1_GRVWA4_GRVWB4_GSU1_GSUAMB_GSUC0_GSUWGMRR0_GLS0_ISA1200_IU4_K1_LBSPPA1024_LBSPPB1024_LBSPPM0_LPA32_LPB32_LPM0_LRVW8_LWPMn1_MIAV1_MIWT2_2_MO40_NTn1_NTA0_NTB0_NTC0_NTD0_NTM0_NEPBS0_NLCA1_NLCB1_ONLL0_PGR1_PLR1_PKA0_SIA2_SS1_SU32_SUM0_SUS256_SPO0_SRVW0_SSO0_SVW2_SK0_SKXCCM0_TLDS0_ULSGRO0_USL1_UIOFGRO0_USFGROn1_VSn1_VWA2_VWB2_WSGRA0_WSGRB0_WS32_WG32_4_1_WGM8_WGMXCC1_WGMXCCGn1
    SolutionIndex: 253
    SolutionNameMin: Cijk_Ailk_Bjlk_HSS_BH_Bias_SHB_HA_S_SAB_SCD_SAV_UserArgs_MT64x64x16_MI16x16x1_SN_LDSB0_AFC1_AFEM1_AFEM1_ASEM1_CLR0_CADS0_DTLA0_DTLB0_DTVA0_DTVB0_EPS0_FDSI0_GRPM1_GRVWA4_GRVWB8_GSU1_GSUAMB_GSUC0_GSUWGMRR0_GLS0_ISA1200_IU1_K1_LBSPPA1024_LBSPPB1024_LBSPPM0_LPA32_LPB32_LPM0_LRVW8_LWPMn1_MIAV1_MIWT2_2_MO40_NTn1_NTA0_NTB0_NTC0_NTD0_NTM0_NEPBS0_NLCA1_NLCB1_ONLL0_PGR2_PLR0_PKA0_SIA3_SS1_SU32_SUM0_SUS256_SPO0_SRVW0_SSO0_SVW2_SK0_SKXCCM0_TLDS0_ULSGRO1_USL1_UIOFGRO0_USFGROn1_VSn1_VWA2_VWB2_WSGRA0_WSGRB0_WS32_WG32_4_1_WGM8_WGMXCC1_WGMXCCGn1
    SolutionIndex: 254
    SolutionNameMin: Cijk_Ailk_Bjlk_HSS_BH_Bias_SHB_HA_S_SAB_SCD_SAV_UserArgs_MT128x128x16_MI16x16x1_SN_LDSB1_AFC1_AFEM1_AFEM1_ASEM1_CLR1_CADS0_DTLA0_DTLB0_DTVA0_DTVB0_EPS0_FDSI0_GRPM1_GRVWA8_GRVWB4_GSU1_GSUAMB_GSUC0_GSUWGMRR0_GLS0_ISA1200_IU1_K1_LBSPPA2048_LBSPPB2048_LBSPPM0_LPA0_LPB0_LPM0_LRVW8_LWPMn1_MIAV1_MIWT4_4_MO40_NTn1_NTA0_NTB0_NTC0_NTD0_NTM0_NEPBS0_NLCA1_NLCB1_ONLL0_PGR2_PLR1_PKA0_SIA2_SS1_SU32_SUM0_SUS256_SPO0_SRVW0_SSO0_SVW4_SK0_SKXCCM0_TLDS0_ULSGRO1_USL1_UIOFGRO0_USFGROn1_VSn1_VWA4_VWB4_WSGRA0_WSGRB0_WS32_WG32_4_1_WGM8_WGMXCC1_WGMXCCGn1
    SolutionIndex: 255
    SolutionNameMin: Cijk_Ailk_Bjlk_HSS_BH_Bias_SHB_HA_S_SAB_SCD_SAV_UserArgs_MT64x64x64_MI16x16x1_SN_LDSB1_AFC1_AFEM1_AFEM1_ASEM1_CLR1_CADS0_DTLA0_DTLB0_DTVA0_DTVB0_EPS1_FDSI0_GRPM1_GRVWA4_GRVWB4_GSU1_GSUAMB_GSUC0_GSUWGMRR0_GLS0_ISA1200_IU1_K1_LBSPPA1024_LBSPPB1024_LBSPPM0_LPA32_LPB32_LPM0_LRVW8_LWPMn1_MIAV1_MIWT2_2_MO40_NTn1_NTA0_NTB0_NTC0_NTD0_NTM0_NEPBS0_NLCA1_NLCB1_ONLL0_PGR1_PLR1_PKA0_SIA3_SS1_SU32_SUM0_SUS256_SPO0_SRVW0_SSO0_SVW2_SK0_SKXCCM0_TLDS0_ULSGRO0_USL1_UIOFGRO0_USFGROn1_VSn1_VWA2_VWB2_WSGRA0_WSGRB0_WS32_WG32_4_1_WGM8_WGMXCC1_WGMXCCGn1
    SolutionIndex: 256
    SolutionNameMin: Cijk_Ailk_Bjlk_HSS_BH_Bias_SHB_HA_S_SAB_SCD_SAV_UserArgs_MT64x64x16_MI16x16x1_SN_LDSB1_AFC1_AFEM1_AFEM1_ASEM1_CLR1_CADS0_DTLA0_DTLB0_DTVA0_DTVB0_EPS0_FDSI0_GRPM1_GRVWA1_GRVWB1_GSU1_GSUAMB_GSUC0_GSUWGMRR0_GLS0_ISA1200_IU1_K1_LBSPPA1024_LBSPPB1024_LBSPPM0_LPA32_LPB32_LPM0_LRVW8_LWPMn1_MIAV1_MIWT2_2_MO40_NTn1_NTA0_NTB0_NTC0_NTD0_NTM0_NEPBS0_NLCA1_NLCB1_ONLL0_PGR2_PLR1_PKA0_SIA2_SS1_SU32_SUM0_SUS256_SPO0_SRVW0_SSO0_SVW2_SK0_SKXCCM0_TLDS0_ULSGRO1_USL1_UIOFGRO0_USFGROn1_VSn1_VWA2_VWB2_WSGRA0_WSGRB0_WS32_WG32_4_1_WGM8_WGMXCC1_WGMXCCGn1
    SolutionIndex: 257
    SolutionNameMin: Cijk_Ailk_Bjlk_HSS_BH_Bias_SHB_HA_S_SAB_SCD_SAV_UserArgs_MT64x64x16_MI16x16x1_SN_LDSB1_AFC1_AFEM1_AFEM1_ASEM1_CLR1_CADS0_DTLA0_DTLB0_DTVA0_DTVB0_EPS1_FDSI0_GRPM1_GRVWA1_GRVWB1_GSU1_GSUAMB_GSUC0_GSUWGMRR0_GLS0_ISA1200_IU1_K1_LBSPPA1024_LBSPPB1024_LBSPPM0_LPA32_LPB32_LPM0_LRVW8_LWPMn1_MIAV1_MIWT2_2_MO40_NTn1_NTA0_NTB0_NTC0_NTD0_NTM0_NEPBS0_NLCA1_NLCB1_ONLL0_PGR1_PLR1_PKA0_SIA2_SS1_SU32_SUM0_SUS256_SPO0_SRVW0_SSO0_SVW2_SK0_SKXCCM0_TLDS0_ULSGRO0_USL1_UIOFGRO0_USFGROn1_VSn1_VWA2_VWB2_WSGRA0_WSGRB0_WS32_WG32_4_1_WGM8_WGMXCC1_WGMXCCGn1
    SolutionIndex: 258
    SolutionNameMin: Cijk_Ailk_Bjlk_HSS_BH_Bias_SHB_HA_S_SAB_SCD_SAV_UserArgs_MT128x128x16_MI16x16x1_SN_LDSB1_AFC1_AFEM1_AFEM1_ASEM1_CLR1_CADS0_DTLA0_DTLB0_DTVA0_DTVB0_EPS0_FDSI0_GRPM1_GRVWA4_GRVWB4_GSU1_GSUAMB_GSUC0_GSUWGMRR0_GLS0_ISA1200_IU1_K1_LBSPPA2048_LBSPPB2048_LBSPPM0_LPA0_LPB0_LPM0_LRVW8_LWPMn1_MIAV1_MIWT4_4_MO40_NTn1_NTA0_NTB0_NTC0_NTD0_NTM0_NEPBS0_NLCA1_NLCB1_ONLL0_PGR2_PLR1_PKA0_SIA2_SS1_SU32_SUM0_SUS256_SPO0_SRVW0_SSO0_SVW4_SK0_SKXCCM0_TLDS0_ULSGRO0_USL1_UIOFGRO0_USFGROn1_VSn1_VWA4_VWB4_WSGRA0_WSGRB0_WS32_WG32_4_1_WGM8_WGMXCC1_WGMXCCGn1
    SolutionIndex: 263
    SolutionNameMin: Cijk_Ailk_Bjlk_HSS_BH_Bias_SHB_HA_S_SAB_SCD_SAV_UserArgs_MT128x128x16_MI16x16x1_SN_LDSB1_AFC1_AFEM1_AFEM1_ASEM1_CLR1_CADS0_DTLA0_DTLB0_DTVA0_DTVB0_EPS0_FDSI0_GRPM1_GRVWA8_GRVWB8_GSU1_GSUAMB_GSUC0_GSUWGMRR0_GLS0_ISA1200_IU1_K1_LBSPPA2048_LBSPPB2048_LBSPPM0_LPA0_LPB0_LPM0_LRVW8_LWPMn1_MIAV1_MIWT4_4_MO40_NTn1_NTA0_NTB0_NTC0_NTD0_NTM0_NEPBS0_NLCA1_NLCB1_ONLL0_PGR2_PLR1_PKA0_SIA2_SS1_SU32_SUM0_SUS256_SPO0_SRVW0_SSO0_SVW4_SK0_SKXCCM0_TLDS0_ULSGRO0_USL1_UIOFGRO0_USFGROn1_VSn1_VWA4_VWB4_WSGRA0_WSGRB0_WS32_WG32_4_1_WGM8_WGMXCC1_WGMXCCGn1
    SolutionIndex: 264
    SolutionNameMin: Cijk_Ailk_Bjlk_HSS_BH_Bias_SHB_HA_S_SAB_SCD_SAV_UserArgs_MT64x64x32_MI16x16x1_SN_LDSB0_AFC1_AFEM1_AFEM1_ASEM1_CLR1_CADS0_DTLA0_DTLB0_DTVA0_DTVB0_EPS0_FDSI0_GRPM1_GRVWA8_GRVWB8_GSU1_GSUAMB_GSUC0_GSUWGMRR0_GLS0_ISA1200_IU1_K1_LBSPPA1024_LBSPPB1024_LBSPPM0_LPA32_LPB32_LPM0_LRVW8_LWPMn1_MIAV1_MIWT2_2_MO40_NTn1_NTA0_NTB0_NTC0_NTD0_NTM0_NEPBS0_NLCA1_NLCB1_ONLL0_PGR2_PLR1_PKA0_SIA3_SS1_SU32_SUM0_SUS256_SPO0_SRVW0_SSO0_SVW2_SK0_SKXCCM0_TLDS0_ULSGRO1_USL1_UIOFGRO0_USFGROn1_VSn1_VWA2_VWB2_WSGRA0_WSGRB0_WS32_WG32_4_1_WGM8_WGMXCC1_WGMXCCGn1
    SolutionIndex: 265
    SolutionNameMin: Cijk_Ailk_Bjlk_HSS_BH_Bias_SHB_HA_S_SAB_SCD_SAV_UserArgs_MT64x64x32_MI16x16x1_SN_LDSB0_AFC1_AFEM1_AFEM1_ASEM1_CLR1_CADS0_DTLA0_DTLB0_DTVA0_DTVB1_EPS1_FDSI0_GRPM1_GRVWA8_GRVWB8_GSU1_GSUAMB_GSUC0_GSUWGMRR0_GLS0_ISA1200_IU1_K1_LBSPPA1024_LBSPPB0_LBSPPM0_LPA32_LPB0_LPM0_LRVW8_LWPMn1_MIAV1_MIWT2_2_MO40_NTn1_NTA0_NTB0_NTC0_NTD0_NTM0_NEPBS0_NLCA1_NLCB2_ONLL0_PGR1_PLR1_PKA0_SIA3_SS1_SU32_SUM0_SUS256_SPO0_SRVW0_SSO0_SVW2_SK0_SKXCCM0_TLDS0_ULSGRO0_USL1_UIOFGRO0_USFGROn1_VSn1_VWA2_VWB1_WSGRA0_WSGRB0_WS32_WG32_4_1_WGM8_WGMXCC1_WGMXCCGn1
    SolutionIndex: 266
    SolutionNameMin: Cijk_Ailk_Bjlk_HSS_BH_Bias_SHB_HA_S_SAB_SCD_SAV_UserArgs_MT64x64x64_MI16x16x1_SN_LDSB1_AFC1_AFEM1_AFEM1_ASEM1_CLR1_CADS0_DTLA0_DTLB0_DTVA0_DTVB0_EPS1_FDSI0_GRPM1_GRVWA8_GRVWB8_GSU1_GSUAMB_GSUC0_GSUWGMRR0_GLS0_ISA1200_IU1_K1_LBSPPA1024_LBSPPB1024_LBSPPM0_LPA32_LPB32_LPM0_LRVW8_LWPMn1_MIAV1_MIWT2_2_MO40_NTn1_NTA0_NTB0_NTC0_NTD0_NTM0_NEPBS0_NLCA1_NLCB1_ONLL0_PGR1_PLR1_PKA0_SIA3_SS1_SU32_SUM0_SUS256_SPO0_SRVW0_SSO0_SVW2_SK0_SKXCCM0_TLDS0_ULSGRO0_USL1_UIOFGRO0_USFGROn1_VSn1_VWA2_VWB2_WSGRA0_WSGRB0_WS32_WG32_4_1_WGM8_WGMXCC1_WGMXCCGn1
    SolutionIndex: 267
    SolutionNameMin: Cijk_Ailk_Bjlk_HSS_BH_Bias_SHB_HA_S_SAB_SCD_SAV_UserArgs_MT128x128x16_MI16x16x1_SN_LDSB0_AFC1_AFEM1_AFEM1_ASEM1_CLR0_CADS0_DTLA0_DTLB0_DTVA0_DTVB0_EPS0_FDSI0_GRPM1_GRVWA4_GRVWB4_GSU1_GSUAMB_GSUC0_GSUWGMRR0_GLS0_ISA1200_IU1_K1_LBSPPA2048_LBSPPB2048_LBSPPM0_LPA0_LPB0_LPM0_LRVW8_LWPMn1_MIAV1_MIWT4_4_MO40_NTn1_NTA0_NTB0_NTC0_NTD0_NTM0_NEPBS0_NLCA1_NLCB1_ONLL0_PGR2_PLR0_PKA0_SIA3_SS1_SU32_SUM0_SUS256_SPO0_SRVW0_SSO0_SVW4_SK0_SKXCCM0_TLDS0_ULSGRO1_USL1_UIOFGRO0_USFGROn1_VSn1_VWA4_VWB4_WSGRA0_WSGRB0_WS32_WG32_4_1_WGM8_WGMXCC1_WGMXCCGn1
    SolutionIndex: 268
    SolutionNameMin: Cijk_Ailk_Bjlk_HSS_BH_Bias_SHB_HA_S_SAB_SCD_SAV_UserArgs_MT32x32x32_MI16x16x1_SN_LDSB1_AFC1_AFEM1_AFEM1_ASEM1_CLR1_CADS0_DTLA0_DTLB0_DTVA0_DTVB0_EPS0_FDSI0_GRPM1_GRVWA8_GRVWB8_GSU1_GSUAMB_GSUC0_GSUWGMRR0_GLS0_ISA1200_IU2_K1_LBSPPA512_LBSPPB512_LBSPPM0_LPA16_LPB16_LPM0_LRVW8_LWPMn1_MIAV1_MIWT1_1_MO40_NTn1_NTA0_NTB0_NTC0_NTD0_NTM0_NEPBS0_NLCA1_NLCB1_ONLL0_PGR2_PLR1_PKA0_SIA2_SS0_SU32_SUM0_SUS256_SPO0_SRVW0_SSO0_SVW8_SK0_SKXCCM0_TLDS0_ULSGRO1_USL1_UIOFGRO0_USFGROn1_VSn1_VWA1_VWB1_WSGRA0_WSGRB0_WS32_WG32_4_1_WGM8_WGMXCC1_WGMXCCGn1
    SolutionIndex: 272
    SolutionNameMin: Cijk_Ailk_Bjlk_HSS_BH_Bias_SHB_HA_S_SAB_SCD_SAV_UserArgs_MT64x64x16_MI16x16x1_SN_LDSB0_AFC1_AFEM1_AFEM1_ASEM1_CLR0_CADS0_DTLA0_DTLB0_DTVA0_DTVB0_EPS0_FDSI0_GRPM1_GRVWA1_GRVWB1_GSU1_GSUAMB_GSUC0_GSUWGMRR0_GLS0_ISA1200_IU1_K1_LBSPPA1024_LBSPPB1024_LBSPPM0_LPA32_LPB32_LPM0_LRVW8_LWPMn1_MIAV1_MIWT2_2_MO40_NTn1_NTA0_NTB0_NTC0_NTD0_NTM0_NEPBS0_NLCA1_NLCB1_ONLL0_PGR2_PLR0_PKA0_SIA3_SS1_SU32_SUM0_SUS256_SPO0_SRVW0_SSO0_SVW2_SK0_SKXCCM0_TLDS0_ULSGRO1_USL1_UIOFGRO0_USFGROn1_VSn1_VWA2_VWB2_WSGRA0_WSGRB0_WS32_WG32_4_1_WGM8_WGMXCC1_WGMXCCGn1
    SolutionIndex: 273
    SolutionNameMin: Cijk_Ailk_Bjlk_HSS_BH_Bias_SHB_HA_S_SAB_SCD_SAV_UserArgs_MT64x64x16_MI16x16x1_SN_LDSB0_AFC1_AFEM1_AFEM1_ASEM1_CLR0_CADS0_DTLA0_DTLB0_DTVA0_DTVB0_EPS0_FDSI0_GRPM1_GRVWA8_GRVWB8_GSU1_GSUAMB_GSUC0_GSUWGMRR0_GLS0_ISA1200_IU1_K1_LBSPPA1024_LBSPPB1024_LBSPPM0_LPA32_LPB32_LPM0_LRVW8_LWPMn1_MIAV1_MIWT2_2_MO40_NTn1_NTA0_NTB0_NTC0_NTD0_NTM0_NEPBS0_NLCA1_NLCB1_ONLL0_PGR2_PLR0_PKA0_SIA3_SS1_SU32_SUM0_SUS256_SPO0_SRVW0_SSO0_SVW2_SK0_SKXCCM0_TLDS0_ULSGRO1_USL1_UIOFGRO0_USFGROn1_VSn1_VWA2_VWB2_WSGRA0_WSGRB0_WS32_WG32_4_1_WGM8_WGMXCC1_WGMXCCGn1
    SolutionIndex: 275
    SolutionNameMin: Cijk_Ailk_Bjlk_HSS_BH_Bias_SHB_HA_S_SAB_SCD_SAV_UserArgs_MT64x64x16_MI16x16x1_SN_LDSB1_AFC1_AFEM1_AFEM1_ASEM1_CLR1_CADS0_DTLA0_DTLB0_DTVA0_DTVB0_EPS0_FDSI0_GRPM1_GRVWA4_GRVWB4_GSU1_GSUAMB_GSUC0_GSUWGMRR0_GLS0_ISA1200_IU1_K1_LBSPPA1024_LBSPPB1024_LBSPPM0_LPA32_LPB32_LPM0_LRVW8_LWPMn1_MIAV1_MIWT2_2_MO40_NTn1_NTA0_NTB0_NTC0_NTD0_NTM0_NEPBS0_NLCA1_NLCB1_ONLL0_PGR2_PLR1_PKA0_SIA2_SS1_SU32_SUM0_SUS256_SPO0_SRVW0_SSO0_SVW2_SK0_SKXCCM0_TLDS0_ULSGRO1_USL1_UIOFGRO0_USFGROn1_VSn1_VWA2_VWB2_WSGRA0_WSGRB0_WS32_WG32_4_1_WGM8_WGMXCC1_WGMXCCGn1
    SolutionIndex: 278
    SolutionNameMin: Cijk_Ailk_Bjlk_HSS_BH_Bias_SHB_HA_S_SAB_SCD_SAV_UserArgs_MT64x64x32_MI16x16x1_SN_LDSB0_AFC1_AFEM1_AFEM1_ASEM1_CLR1_CADS0_DTLA0_DTLB0_DTVA0_DTVB0_EPS0_FDSI0_GRPM1_GRVWA8_GRVWB4_GSU1_GSUAMB_GSUC0_GSUWGMRR0_GLS0_ISA1200_IU1_K1_LBSPPA1024_LBSPPB1024_LBSPPM0_LPA32_LPB32_LPM0_LRVW8_LWPMn1_MIAV1_MIWT2_2_MO40_NTn1_NTA0_NTB0_NTC0_NTD0_NTM0_NEPBS0_NLCA1_NLCB1_ONLL0_PGR2_PLR1_PKA0_SIA3_SS1_SU32_SUM0_SUS256_SPO0_SRVW0_SSO0_SVW2_SK0_SKXCCM0_TLDS0_ULSGRO1_USL1_UIOFGRO0_USFGROn1_VSn1_VWA2_VWB2_WSGRA0_WSGRB0_WS32_WG32_4_1_WGM8_WGMXCC1_WGMXCCGn1
    SolutionIndex: 280
    SolutionNameMin: Cijk_Ailk_Bjlk_HSS_BH_Bias_SHB_HA_S_SAB_SCD_SAV_UserArgs_MT64x64x64_MI16x16x1_SN_LDSB1_AFC1_AFEM1_AFEM1_ASEM1_CLR1_CADS0_DTLA0_DTLB0_DTVA0_DTVB0_EPS0_FDSI0_GRPM1_GRVWA8_GRVWB4_GSU1_GSUAMB_GSUC0_GSUWGMRR0_GLS0_ISA1200_IU4_K1_LBSPPA1024_LBSPPB1024_LBSPPM0_LPA32_LPB32_LPM0_LRVW8_LWPMn1_MIAV1_MIWT2_2_MO40_NTn1_NTA0_NTB0_NTC0_NTD0_NTM0_NEPBS0_NLCA1_NLCB1_ONLL0_PGR2_PLR1_PKA0_SIA2_SS1_SU32_SUM0_SUS256_SPO0_SRVW0_SSO0_SVW2_SK0_SKXCCM0_TLDS0_ULSGRO0_USL1_UIOFGRO0_USFGROn1_VSn1_VWA2_VWB2_WSGRA0_WSGRB0_WS32_WG32_4_1_WGM8_WGMXCC1_WGMXCCGn1
    SolutionIndex: 282
    SolutionNameMin: Cijk_Ailk_Bjlk_HSS_BH_Bias_SHB_HA_S_SAB_SCD_SAV_UserArgs_MT16x128x16_MI16x16x1_SN_LDSB0_AFC1_AFEM1_AFEM1_ASEM1_CLR1_CADS0_DTLA0_DTLB0_DTVA1_DTVB1_EPS0_FDSI0_GRPM1_GRVWA8_GRVWB8_GSU1_GSUAMB_GSUC0_GSUWGMRR0_GLS0_ISA1200_IU1_K1_LBSPPA0_LBSPPB0_LBSPPM0_LPA0_LPB0_LPM0_LRVW8_LWPMn1_MIAV1_MIWT1_8_MO40_NTn1_NTA0_NTB0_NTC0_NTD0_NTM0_NEPBS0_NLCA1_NLCB1_ONLL0_PGR1_PLR0_PKA0_SIA3_SS0_SU32_SUM0_SUS256_SPO0_SRVW0_SSO0_SVW8_SK0_SKXCCM0_TLDS0_ULSGRO0_USL1_UIOFGRO0_USFGROn1_VSn1_VWA1_VWB1_WSGRA0_WSGRB0_WS32_WG16_2_1_WGM8_WGMXCC1_WGMXCCGn1
    SolutionIndex: 284
    SolutionNameMin: Cijk_Ailk_Bjlk_HSS_BH_Bias_SHB_HA_S_SAB_SCD_SAV_UserArgs_MT128x128x16_MI16x16x1_SN_LDSB1_AFC1_AFEM1_AFEM1_ASEM1_CLR1_CADS0_DTLA0_DTLB0_DTVA0_DTVB0_EPS0_FDSI0_GRPM1_GRVWA4_GRVWB8_GSU1_GSUAMB_GSUC0_GSUWGMRR0_GLS0_ISA1200_IU1_K1_LBSPPA2048_LBSPPB2048_LBSPPM0_LPA0_LPB0_LPM0_LRVW8_LWPMn1_MIAV1_MIWT4_4_MO40_NTn1_NTA0_NTB0_NTC0_NTD0_NTM0_NEPBS0_NLCA1_NLCB1_ONLL0_PGR2_PLR1_PKA0_SIA2_SS1_SU32_SUM0_SUS256_SPO0_SRVW0_SSO0_SVW4_SK0_SKXCCM0_TLDS0_ULSGRO1_USL1_UIOFGRO0_USFGROn1_VSn1_VWA4_VWB4_WSGRA0_WSGRB0_WS32_WG32_4_1_WGM8_WGMXCC1_WGMXCCGn1
    SolutionIndex: 286
    SolutionNameMin: Cijk_Ailk_Bjlk_HSS_BH_Bias_SHB_HA_S_SAB_SCD_SAV_UserArgs_MT128x128x16_MI16x16x1_SN_LDSB1_AFC1_AFEM1_AFEM1_ASEM1_CLR1_CADS0_DTLA0_DTLB0_DTVA0_DTVB0_EPS1_FDSI0_GRPM1_GRVWA8_GRVWB4_GSU1_GSUAMB_GSUC0_GSUWGMRR0_GLS0_ISA1200_IU1_K1_LBSPPA2048_LBSPPB2048_LBSPPM0_LPA0_LPB0_LPM0_LRVW8_LWPMn1_MIAV1_MIWT4_4_MO40_NTn1_NTA0_NTB0_NTC0_NTD0_NTM0_NEPBS0_NLCA1_NLCB1_ONLL0_PGR1_PLR1_PKA0_SIA2_SS1_SU32_SUM0_SUS256_SPO0_SRVW0_SSO0_SVW4_SK0_SKXCCM0_TLDS0_ULSGRO0_USL1_UIOFGRO0_USFGROn1_VSn1_VWA4_VWB4_WSGRA0_WSGRB0_WS32_WG32_4_1_WGM8_WGMXCC1_WGMXCCGn1
    SolutionIndex: 287
    SolutionNameMin: Cijk_Ailk_Bjlk_HSS_BH_Bias_SHB_HA_S_SAB_SCD_SAV_UserArgs_MT64x128x16_MI16x16x1_SN_LDSB0_AFC1_AFEM1_AFEM1_ASEM1_CLR1_CADS0_DTLA0_DTLB0_DTVA1_DTVB1_EPS0_FDSI0_GRPM1_GRVWA8_GRVWB8_GSU1_GSUAMB_GSUC0_GSUWGMRR0_GLS0_ISA1200_IU1_K1_LBSPPA0_LBSPPB0_LBSPPM0_LPA0_LPB0_LPM0_LRVW8_LWPMn1_MIAV1_MIWT1_8_MO40_NTn1_NTA0_NTB0_NTC0_NTD0_NTM0_NEPBS0_NLCA1_NLCB1_ONLL0_PGR1_PLR0_PKA0_SIA3_SS0_SU32_SUM0_SUS256_SPO0_SRVW0_SSO0_SVW8_SK0_SKXCCM0_TLDS0_ULSGRO0_USL1_UIOFGRO0_USFGROn1_VSn1_VWA1_VWB1_WSGRA0_WSGRB0_WS32_WG64_2_1_WGM8_WGMXCC1_WGMXCCGn1
    SolutionIndex: 288
    SolutionNameMin: Cijk_Ailk_Bjlk_HSS_BH_Bias_SHB_HA_S_SAB_SCD_SAV_UserArgs_MT128x128x16_MI16x16x1_SN_LDSB1_AFC1_AFEM1_AFEM1_ASEM1_CLR1_CADS0_DTLA0_DTLB0_DTVA0_DTVB0_EPS1_FDSI0_GRPM1_GRVWA4_GRVWB8_GSU1_GSUAMB_GSUC0_GSUWGMRR0_GLS0_ISA1200_IU1_K1_LBSPPA2048_LBSPPB2048_LBSPPM0_LPA0_LPB0_LPM0_LRVW8_LWPMn1_MIAV1_MIWT4_4_MO40_NTn1_NTA0_NTB0_NTC0_NTD0_NTM0_NEPBS0_NLCA1_NLCB1_ONLL0_PGR1_PLR1_PKA0_SIA2_SS1_SU32_SUM0_SUS256_SPO0_SRVW0_SSO0_SVW4_SK0_SKXCCM0_TLDS0_ULSGRO0_USL1_UIOFGRO0_USFGROn1_VSn1_VWA4_VWB4_WSGRA0_WSGRB0_WS32_WG32_4_1_WGM8_WGMXCC1_WGMXCCGn1
    SolutionIndex: 289
    SolutionNameMin: Cijk_Ailk_Bjlk_HSS_BH_Bias_SHB_HA_S_SAB_SCD_SAV_UserArgs_MT32x16x64_MI16x16x1_SN_LDSB0_AFC1_AFEM1_AFEM1_ASEM1_CLR1_CADS0_DTLA0_DTLB0_DTVA1_DTVB0_EPS0_FDSI0_GRPM1_GRVWA8_GRVWB4_GSU1_GSUAMB_GSUC0_GSUWGMRR0_GLS0_ISA1200_IU1_K1_LBSPPA0_LBSPPB256_LBSPPM0_LPA0_LPB16_LPM0_LRVW8_LWPMn1_MIAV1_MIWT1_1_MO40_NTn1_NTA0_NTB0_NTC0_NTD0_NTM0_NEPBS0_NLCA1_NLCB1_ONLL0_PGR2_PLR1_PKA0_SIA3_SS0_SU32_SUM0_SUS256_SPO0_SRVW0_SSO0_SVW8_SK0_SKXCCM0_TLDS0_ULSGRO0_USL1_UIOFGRO0_USFGROn1_VSn1_VWA1_VWB1_WSGRA0_WSGRB0_WS32_WG32_2_1_WGM8_WGMXCC1_WGMXCCGn1
    SolutionIndex: 291
    SolutionNameMin: Cijk_Ailk_Bjlk_HSS_BH_Bias_SHB_HA_S_SAB_SCD_SAV_UserArgs_MT64x64x16_MI16x16x1_SN_LDSB1_AFC1_AFEM1_AFEM1_ASEM1_CLR1_CADS0_DTLA0_DTLB0_DTVA0_DTVB0_EPS1_FDSI0_GRPM1_GRVWA4_GRVWB8_GSU1_GSUAMB_GSUC0_GSUWGMRR0_GLS0_ISA1200_IU1_K1_LBSPPA1024_LBSPPB1024_LBSPPM0_LPA32_LPB32_LPM0_LRVW8_LWPMn1_MIAV1_MIWT2_2_MO40_NTn1_NTA0_NTB0_NTC0_NTD0_NTM0_NEPBS0_NLCA1_NLCB1_ONLL0_PGR1_PLR1_PKA0_SIA2_SS1_SU32_SUM0_SUS256_SPO0_SRVW0_SSO0_SVW2_SK0_SKXCCM0_TLDS0_ULSGRO0_USL1_UIOFGRO0_USFGROn1_VSn1_VWA2_VWB2_WSGRA0_WSGRB0_WS32_WG32_4_1_WGM8_WGMXCC1_WGMXCCGn1
    SolutionIndex: 293
    SolutionNameMin: Cijk_Ailk_Bjlk_HSS_BH_Bias_SHB_HA_S_SAB_SCD_SAV_UserArgs_MT128x128x16_MI16x16x1_SN_LDSB0_AFC1_AFEM1_AFEM1_ASEM1_CLR0_CADS0_DTLA0_DTLB0_DTVA0_DTVB0_EPS1_FDSI0_GRPM1_GRVWA4_GRVWB4_GSU1_GSUAMB_GSUC0_GSUWGMRR0_GLS0_ISA1200_IU1_K1_LBSPPA2048_LBSPPB2048_LBSPPM0_LPA0_LPB0_LPM0_LRVW8_LWPMn1_MIAV1_MIWT4_4_MO40_NTn1_NTA0_NTB0_NTC0_NTD0_NTM0_NEPBS0_NLCA1_NLCB1_ONLL0_PGR1_PLR0_PKA0_SIA3_SS1_SU32_SUM0_SUS256_SPO0_SRVW0_SSO0_SVW4_SK0_SKXCCM0_TLDS0_ULSGRO0_USL1_UIOFGRO0_USFGROn1_VSn1_VWA4_VWB4_WSGRA0_WSGRB0_WS32_WG32_4_1_WGM8_WGMXCC1_WGMXCCGn1
    SolutionIndex: 294
    SolutionNameMin: Cijk_Ailk_Bjlk_HSS_BH_Bias_SHB_HA_S_SAB_SCD_SAV_UserArgs_MT64x64x16_MI16x16x1_SN_LDSB1_AFC1_AFEM1_AFEM1_ASEM1_CLR1_CADS0_DTLA0_DTLB0_DTVA0_DTVB0_EPS0_FDSI0_GRPM1_GRVWA8_GRVWB1_GSU1_GSUAMB_GSUC0_GSUWGMRR0_GLS0_ISA1200_IU1_K1_LBSPPA1024_LBSPPB1024_LBSPPM0_LPA32_LPB32_LPM0_LRVW8_LWPMn1_MIAV1_MIWT2_2_MO40_NTn1_NTA0_NTB0_NTC0_NTD0_NTM0_NEPBS0_NLCA1_NLCB1_ONLL0_PGR2_PLR1_PKA0_SIA2_SS1_SU32_SUM0_SUS256_SPO0_SRVW0_SSO0_SVW2_SK0_SKXCCM0_TLDS0_ULSGRO0_USL1_UIOFGRO0_USFGROn1_VSn1_VWA2_VWB2_WSGRA0_WSGRB0_WS32_WG32_4_1_WGM8_WGMXCC1_WGMXCCGn1
    SolutionIndex: 296
    SolutionNameMin: Cijk_Ailk_Bjlk_HSS_BH_Bias_SHB_HA_S_SAB_SCD_SAV_UserArgs_MT128x128x16_MI16x16x1_SN_LDSB1_AFC1_AFEM1_AFEM1_ASEM1_CLR1_CADS0_DTLA0_DTLB0_DTVA0_DTVB0_EPS0_FDSI0_GRPM1_GRVWA8_GRVWB8_GSU1_GSUAMB_GSUC0_GSUWGMRR0_GLS0_ISA1200_IU1_K1_LBSPPA2048_LBSPPB2048_LBSPPM0_LPA0_LPB0_LPM0_LRVW8_LWPMn1_MIAV1_MIWT4_4_MO40_NTn1_NTA0_NTB0_NTC0_NTD0_NTM0_NEPBS0_NLCA1_NLCB1_ONLL0_PGR2_PLR1_PKA0_SIA2_SS1_SU32_SUM0_SUS256_SPO0_SRVW0_SSO0_SVW4_SK0_SKXCCM0_TLDS0_ULSGRO1_USL1_UIOFGRO0_USFGROn1_VSn1_VWA4_VWB4_WSGRA0_WSGRB0_WS32_WG32_4_1_WGM8_WGMXCC1_WGMXCCGn1
    SolutionIndex: 299
    SolutionNameMin: Cijk_Ailk_Bjlk_HSS_BH_Bias_SHB_HA_S_SAB_SCD_SAV_UserArgs_MT64x64x16_MI16x16x1_SN_LDSB1_AFC1_AFEM1_AFEM1_ASEM1_CLR1_CADS0_DTLA0_DTLB0_DTVA0_DTVB0_EPS0_FDSI0_GRPM1_GRVWA8_GRVWB4_GSU1_GSUAMB_GSUC0_GSUWGMRR0_GLS0_ISA1200_IU1_K1_LBSPPA1024_LBSPPB1024_LBSPPM0_LPA32_LPB32_LPM0_LRVW8_LWPMn1_MIAV1_MIWT2_2_MO40_NTn1_NTA0_NTB0_NTC0_NTD0_NTM0_NEPBS0_NLCA1_NLCB1_ONLL0_PGR2_PLR1_PKA0_SIA2_SS1_SU32_SUM0_SUS256_SPO0_SRVW0_SSO0_SVW2_SK0_SKXCCM0_TLDS0_ULSGRO0_USL1_UIOFGRO0_USFGROn1_VSn1_VWA2_VWB2_WSGRA0_WSGRB0_WS32_WG32_4_1_WGM8_WGMXCC1_WGMXCCGn1
    SolutionIndex: 301
    SolutionNameMin: Cijk_Ailk_Bjlk_HSS_BH_Bias_SHB_HA_S_SAB_SCD_SAV_UserArgs_MT128x128x16_MI16x16x1_SN_LDSB1_AFC1_AFEM1_AFEM1_ASEM1_CLR1_CADS0_DTLA0_DTLB0_DTVA0_DTVB0_EPS0_FDSI0_GRPM1_GRVWA4_GRVWB4_GSU1_GSUAMB_GSUC0_GSUWGMRR0_GLS0_ISA1200_IU1_K1_LBSPPA2048_LBSPPB2048_LBSPPM0_LPA0_LPB0_LPM0_LRVW8_LWPMn1_MIAV1_MIWT4_4_MO40_NTn1_NTA0_NTB0_NTC0_NTD0_NTM0_NEPBS0_NLCA1_NLCB1_ONLL0_PGR2_PLR1_PKA0_SIA2_SS1_SU32_SUM0_SUS256_SPO0_SRVW0_SSO0_SVW4_SK0_SKXCCM0_TLDS0_ULSGRO1_USL1_UIOFGRO0_USFGROn1_VSn1_VWA4_VWB4_WSGRA0_WSGRB0_WS32_WG32_4_1_WGM8_WGMXCC1_WGMXCCGn1
    SolutionIndex: 302
    SolutionNameMin: Cijk_Ailk_Bjlk_HSS_BH_Bias_SHB_HA_S_SAB_SCD_SAV_UserArgs_MT128x128x16_MI16x16x1_SN_LDSB0_AFC1_AFEM1_AFEM1_ASEM1_CLR0_CADS0_DTLA0_DTLB0_DTVA0_DTVB0_EPS1_FDSI0_GRPM1_GRVWA4_GRVWB8_GSU1_GSUAMB_GSUC0_GSUWGMRR0_GLS0_ISA1200_IU1_K1_LBSPPA2048_LBSPPB2048_LBSPPM0_LPA0_LPB0_LPM0_LRVW8_LWPMn1_MIAV1_MIWT4_4_MO40_NTn1_NTA0_NTB0_NTC0_NTD0_NTM0_NEPBS0_NLCA1_NLCB1_ONLL0_PGR1_PLR0_PKA0_SIA3_SS1_SU32_SUM0_SUS256_SPO0_SRVW0_SSO0_SVW4_SK0_SKXCCM0_TLDS0_ULSGRO0_USL1_UIOFGRO0_USFGROn1_VSn1_VWA4_VWB4_WSGRA0_WSGRB0_WS32_WG32_4_1_WGM8_WGMXCC1_WGMXCCGn1
    SolutionIndex: 303
    SolutionNameMin: Cijk_Ailk_Bjlk_HSS_BH_Bias_SHB_HA_S_SAB_SCD_SAV_UserArgs_MT16x16x32_MI16x16x1_SN_LDSB0_AFC1_AFEM1_AFEM1_ASEM1_CLR1_CADS0_DTLA0_DTLB0_DTVA0_DTVB0_EPS0_FDSI0_GRPM1_GRVWA1_GRVWB1_GSU1_GSUAMB_GSUC0_GSUWGMRR0_GLS0_ISA1200_IU1_K1_LBSPPA256_LBSPPB256_LBSPPM0_LPA16_LPB16_LPM0_LRVW8_LWPMn1_MIAV1_MIWT1_1_MO40_NTn1_NTA0_NTB0_NTC0_NTD0_NTM0_NEPBS0_NLCA1_NLCB1_ONLL0_PGR2_PLR1_PKA0_SIA3_SS0_SU32_SUM0_SUS256_SPO0_SRVW0_SSO0_SVW8_SK0_SKXCCM0_TLDS0_ULSGRO0_USL1_UIOFGRO0_USFGROn1_VSn1_VWA1_VWB1_WSGRA0_WSGRB0_WS32_WG16_2_1_WGM8_WGMXCC1_WGMXCCGn1
    SolutionIndex: 307
    SolutionNameMin: Cijk_Ailk_Bjlk_HSS_BH_Bias_SHB_HA_S_SAB_SCD_SAV_UserArgs_MT128x128x16_MI16x16x1_SN_LDSB1_AFC1_AFEM1_AFEM1_ASEM1_CLR1_CADS0_DTLA0_DTLB0_DTVA0_DTVB0_EPS1_FDSI0_GRPM1_GRVWA4_GRVWB4_GSU1_GSUAMB_GSUC0_GSUWGMRR0_GLS0_ISA1200_IU1_K1_LBSPPA2048_LBSPPB2048_LBSPPM0_LPA0_LPB0_LPM0_LRVW8_LWPMn1_MIAV1_MIWT4_4_MO40_NTn1_NTA0_NTB0_NTC0_NTD0_NTM0_NEPBS0_NLCA1_NLCB1_ONLL0_PGR1_PLR1_PKA0_SIA2_SS1_SU32_SUM0_SUS256_SPO0_SRVW0_SSO0_SVW4_SK0_SKXCCM0_TLDS0_ULSGRO0_USL1_UIOFGRO0_USFGROn1_VSn1_VWA4_VWB4_WSGRA0_WSGRB0_WS32_WG32_4_1_WGM8_WGMXCC1_WGMXCCGn1
    SolutionIndex: 308
    SolutionNameMin: Cijk_Ailk_Bjlk_HSS_BH_Bias_SHB_HA_S_SAB_SCD_SAV_UserArgs_MT64x64x16_MI16x16x1_SN_LDSB0_AFC1_AFEM1_AFEM1_ASEM1_CLR0_CADS0_DTLA0_DTLB0_DTVA0_DTVB0_EPS0_FDSI0_GRPM1_GRVWA1_GRVWB1_GSU1_GSUAMB_GSUC0_GSUWGMRR0_GLS0_ISA1200_IU1_K1_LBSPPA1024_LBSPPB1024_LBSPPM0_LPA32_LPB32_LPM0_LRVW8_LWPMn1_MIAV1_MIWT2_2_MO40_NTn1_NTA0_NTB0_NTC0_NTD0_NTM0_NEPBS0_NLCA1_NLCB1_ONLL0_PGR2_PLR0_PKA0_SIA3_SS1_SU32_SUM0_SUS256_SPO0_SRVW0_SSO0_SVW2_SK0_SKXCCM0_TLDS0_ULSGRO0_USL1_UIOFGRO0_USFGROn1_VSn1_VWA2_VWB2_WSGRA0_WSGRB0_WS32_WG32_4_1_WGM8_WGMXCC1_WGMXCCGn1
    SolutionIndex: 311
    SolutionNameMin: Cijk_Ailk_Bjlk_HSS_BH_Bias_SHB_HA_S_SAB_SCD_SAV_UserArgs_MT64x64x64_MI16x16x1_SN_LDSB1_AFC1_AFEM1_AFEM1_ASEM1_CLR1_CADS0_DTLA0_DTLB0_DTVA0_DTVB0_EPS1_FDSI0_GRPM1_GRVWA8_GRVWB4_GSU1_GSUAMB_GSUC0_GSUWGMRR0_GLS0_ISA1200_IU4_K1_LBSPPA1024_LBSPPB1024_LBSPPM0_LPA32_LPB32_LPM0_LRVW8_LWPMn1_MIAV1_MIWT2_2_MO40_NTn1_NTA0_NTB0_NTC0_NTD0_NTM0_NEPBS0_NLCA1_NLCB1_ONLL0_PGR1_PLR1_PKA0_SIA2_SS1_SU32_SUM0_SUS256_SPO0_SRVW0_SSO0_SVW2_SK0_SKXCCM0_TLDS0_ULSGRO0_USL1_UIOFGRO0_USFGROn1_VSn1_VWA2_VWB2_WSGRA0_WSGRB0_WS32_WG32_4_1_WGM8_WGMXCC1_WGMXCCGn1
    SolutionIndex: 312
    SolutionNameMin: Cijk_Ailk_Bjlk_HSS_BH_Bias_SHB_HA_S_SAB_SCD_SAV_UserArgs_MT64x64x16_MI16x16x1_SN_LDSB1_AFC1_AFEM1_AFEM1_ASEM1_CLR1_CADS0_DTLA0_DTLB0_DTVA0_DTVB0_EPS1_FDSI0_GRPM1_GRVWA4_GRVWB4_GSU1_GSUAMB_GSUC0_GSUWGMRR0_GLS0_ISA1200_IU1_K1_LBSPPA1024_LBSPPB1024_LBSPPM0_LPA32_LPB32_LPM0_LRVW8_LWPMn1_MIAV1_MIWT2_2_MO40_NTn1_NTA0_NTB0_NTC0_NTD0_NTM0_NEPBS0_NLCA1_NLCB1_ONLL0_PGR1_PLR1_PKA0_SIA2_SS1_SU32_SUM0_SUS256_SPO0_SRVW0_SSO0_SVW2_SK0_SKXCCM0_TLDS0_ULSGRO0_USL1_UIOFGRO0_USFGROn1_VSn1_VWA2_VWB2_WSGRA0_WSGRB0_WS32_WG32_4_1_WGM8_WGMXCC1_WGMXCCGn1
    SolutionIndex: 313
    SolutionNameMin: Cijk_Ailk_Bjlk_HSS_BH_Bias_SHB_HA_S_SAB_SCD_SAV_UserArgs_MT64x128x16_MI16x16x1_SN_LDSB0_AFC1_AFEM1_AFEM1_ASEM1_CLR0_CADS0_DTLA0_DTLB0_DTVA0_DTVB0_EPS0_FDSI0_GRPM1_GRVWA4_GRVWB8_GSU1_GSUAMB_GSUC0_GSUWGMRR0_GLS0_ISA1200_IU1_K1_LBSPPA1024_LBSPPB2048_LBSPPM0_LPA16_LPB0_LPM0_LRVW8_LWPMn1_MIAV1_MIWT1_8_MO40_NTn1_NTA0_NTB0_NTC0_NTD0_NTM0_NEPBS0_NLCA1_NLCB1_ONLL0_PGR2_PLR0_PKA0_SIA3_SS0_SU32_SUM0_SUS256_SPO0_SRVW0_SSO0_SVW8_SK0_SKXCCM0_TLDS0_ULSGRO0_USL1_UIOFGRO0_USFGROn1_VSn1_VWA1_VWB8_WSGRA0_WSGRB0_WS32_WG64_2_1_WGM8_WGMXCC1_WGMXCCGn1
    SolutionIndex: 314
    SolutionNameMin: Cijk_Ailk_Bjlk_HSS_BH_Bias_SHB_HA_S_SAB_SCD_SAV_UserArgs_MT128x128x16_MI16x16x1_SN_LDSB1_AFC1_AFEM1_AFEM1_ASEM1_CLR1_CADS0_DTLA0_DTLB0_DTVA0_DTVB0_EPS1_FDSI0_GRPM1_GRVWA8_GRVWB8_GSU1_GSUAMB_GSUC0_GSUWGMRR0_GLS0_ISA1200_IU1_K1_LBSPPA2048_LBSPPB2048_LBSPPM0_LPA0_LPB0_LPM0_LRVW8_LWPMn1_MIAV1_MIWT4_4_MO40_NTn1_NTA0_NTB0_NTC0_NTD0_NTM0_NEPBS0_NLCA1_NLCB1_ONLL0_PGR1_PLR1_PKA0_SIA2_SS1_SU32_SUM0_SUS256_SPO0_SRVW0_SSO0_SVW4_SK0_SKXCCM0_TLDS0_ULSGRO0_USL1_UIOFGRO0_USFGROn1_VSn1_VWA4_VWB4_WSGRA0_WSGRB0_WS32_WG32_4_1_WGM8_WGMXCC1_WGMXCCGn1
    SolutionIndex: 315
    SolutionNameMin: Cijk_Ailk_Bjlk_HSS_BH_Bias_SHB_HA_S_SAB_SCD_SAV_UserArgs_MT64x64x32_MI16x16x1_SN_LDSB1_AFC1_AFEM1_AFEM1_ASEM1_CLR1_CADS0_DTLA0_DTLB0_DTVA0_DTVB0_EPS0_FDSI0_GRPM1_GRVWA8_GRVWB8_GSU1_GSUAMB_GSUC0_GSUWGMRR0_GLS0_ISA1200_IU2_K1_LBSPPA1024_LBSPPB1024_LBSPPM0_LPA32_LPB32_LPM0_LRVW8_LWPMn1_MIAV1_MIWT2_2_MO40_NTn1_NTA0_NTB0_NTC0_NTD0_NTM0_NEPBS0_NLCA1_NLCB1_ONLL0_PGR2_PLR1_PKA0_SIA2_SS1_SU32_SUM0_SUS256_SPO0_SRVW0_SSO0_SVW2_SK0_SKXCCM0_TLDS0_ULSGRO1_USL1_UIOFGRO0_USFGROn1_VSn1_VWA2_VWB2_WSGRA0_WSGRB0_WS32_WG32_4_1_WGM8_WGMXCC1_WGMXCCGn1
    SolutionIndex: 316
    SolutionNameMin: Cijk_Ailk_Bjlk_HSS_BH_Bias_SHB_HA_S_SAB_SCD_SAV_UserArgs_MT128x128x16_MI16x16x1_SN_LDSB0_AFC1_AFEM1_AFEM1_ASEM1_CLR0_CADS0_DTLA0_DTLB0_DTVA0_DTVB0_EPS0_FDSI0_GRPM1_GRVWA8_GRVWB8_GSU1_GSUAMB_GSUC0_GSUWGMRR0_GLS0_ISA1200_IU1_K1_LBSPPA2048_LBSPPB2048_LBSPPM0_LPA0_LPB0_LPM0_LRVW8_LWPMn1_MIAV1_MIWT4_4_MO40_NTn1_NTA0_NTB0_NTC0_NTD0_NTM0_NEPBS0_NLCA1_NLCB1_ONLL0_PGR2_PLR0_PKA0_SIA3_SS1_SU32_SUM0_SUS256_SPO0_SRVW0_SSO0_SVW4_SK0_SKXCCM0_TLDS0_ULSGRO1_USL1_UIOFGRO0_USFGROn1_VSn1_VWA4_VWB4_WSGRA0_WSGRB0_WS32_WG32_4_1_WGM8_WGMXCC1_WGMXCCGn1
    SolutionIndex: 317
    SolutionNameMin: Cijk_Ailk_Bjlk_HSS_BH_Bias_SHB_HA_S_SAB_SCD_SAV_UserArgs_MT128x128x16_MI16x16x1_SN_LDSB1_AFC1_AFEM1_AFEM1_ASEM1_CLR1_CADS0_DTLA0_DTLB0_DTVA0_DTVB0_EPS0_FDSI0_GRPM1_GRVWA4_GRVWB8_GSU1_GSUAMB_GSUC0_GSUWGMRR0_GLS0_ISA1200_IU1_K1_LBSPPA2048_LBSPPB2048_LBSPPM0_LPA0_LPB0_LPM0_LRVW8_LWPMn1_MIAV1_MIWT4_4_MO40_NTn1_NTA0_NTB0_NTC0_NTD0_NTM0_NEPBS0_NLCA1_NLCB1_ONLL0_PGR2_PLR1_PKA0_SIA2_SS1_SU32_SUM0_SUS256_SPO0_SRVW0_SSO0_SVW4_SK0_SKXCCM0_TLDS0_ULSGRO0_USL1_UIOFGRO0_USFGROn1_VSn1_VWA4_VWB4_WSGRA0_WSGRB0_WS32_WG32_4_1_WGM8_WGMXCC1_WGMXCCGn1
    SolutionIndex: 319
    SolutionNameMin: Cijk_Ailk_Bjlk_HSS_BH_Bias_SHB_HA_S_SAB_SCD_SAV_UserArgs_MT128x128x16_MI16x16x1_SN_LDSB0_AFC1_AFEM1_AFEM1_ASEM1_CLR0_CADS0_DTLA0_DTLB0_DTVA0_DTVB0_EPS1_FDSI0_GRPM1_GRVWA8_GRVWB8_GSU1_GSUAMB_GSUC0_GSUWGMRR0_GLS0_ISA1200_IU1_K1_LBSPPA2048_LBSPPB2048_LBSPPM0_LPA0_LPB0_LPM0_LRVW8_LWPMn1_MIAV1_MIWT4_4_MO40_NTn1_NTA0_NTB0_NTC0_NTD0_NTM0_NEPBS0_NLCA1_NLCB1_ONLL0_PGR1_PLR0_PKA0_SIA3_SS1_SU32_SUM0_SUS256_SPO0_SRVW0_SSO0_SVW4_SK0_SKXCCM0_TLDS0_ULSGRO0_USL1_UIOFGRO0_USFGROn1_VSn1_VWA4_VWB4_WSGRA0_WSGRB0_WS32_WG32_4_1_WGM8_WGMXCC1_WGMXCCGn1
    SolutionIndex: 320
    SolutionNameMin: Cijk_Ailk_Bjlk_HSS_BH_Bias_SHB_HA_S_SAB_SCD_SAV_UserArgs_MT32x32x64_MI16x16x1_SN_LDSB0_AFC1_AFEM1_AFEM1_ASEM1_CLR1_CADS0_DTLA0_DTLB0_DTVA0_DTVB1_EPS0_FDSI0_GRPM1_GRVWA4_GRVWB8_GSU1_GSUAMB_GSUC0_GSUWGMRR0_GLS0_ISA1200_IU1_K1_LBSPPA512_LBSPPB0_LBSPPM0_LPA16_LPB0_LPM0_LRVW8_LWPMn1_MIAV1_MIWT1_1_MO40_NTn1_NTA0_NTB0_NTC0_NTD0_NTM0_NEPBS0_NLCA1_NLCB1_ONLL0_PGR2_PLR1_PKA0_SIA3_SS0_SU32_SUM0_SUS256_SPO0_SRVW0_SSO0_SVW8_SK0_SKXCCM0_TLDS0_ULSGRO0_USL1_UIOFGRO0_USFGROn1_VSn1_VWA1_VWB1_WSGRA0_WSGRB0_WS32_WG32_4_1_WGM8_WGMXCC1_WGMXCCGn1
    SolutionIndex: 321
    SolutionNameMin: Cijk_Ailk_Bjlk_HSS_BH_Bias_SHB_HA_S_SAB_SCD_SAV_UserArgs_MT64x64x16_MI16x16x1_SN_LDSB1_AFC1_AFEM1_AFEM1_ASEM1_CLR1_CADS0_DTLA0_DTLB0_DTVA0_DTVB0_EPS1_FDSI0_GRPM1_GRVWA4_GRVWB1_GSU1_GSUAMB_GSUC0_GSUWGMRR0_GLS0_ISA1200_IU1_K1_LBSPPA1024_LBSPPB1024_LBSPPM0_LPA32_LPB32_LPM0_LRVW8_LWPMn1_MIAV1_MIWT2_2_MO40_NTn1_NTA0_NTB0_NTC0_NTD0_NTM0_NEPBS0_NLCA1_NLCB1_ONLL0_PGR1_PLR1_PKA0_SIA2_SS1_SU32_SUM0_SUS256_SPO0_SRVW0_SSO0_SVW2_SK0_SKXCCM0_TLDS0_ULSGRO0_USL1_UIOFGRO0_USFGROn1_VSn1_VWA2_VWB2_WSGRA0_WSGRB0_WS32_WG32_4_1_WGM8_WGMXCC1_WGMXCCGn1
    SolutionIndex: 323
    SolutionNameMin: Cijk_Ailk_Bjlk_HSS_BH_Bias_SHB_HA_S_SAB_SCD_SAV_UserArgs_MT128x128x16_MI16x16x1_SN_LDSB1_AFC1_AFEM1_AFEM1_ASEM1_CLR1_CADS0_DTLA0_DTLB0_DTVA0_DTVB0_EPS0_FDSI0_GRPM1_GRVWA1_GRVWB1_GSU1_GSUAMB_GSUC0_GSUWGMRR0_GLS0_ISA1200_IU1_K1_LBSPPA2048_LBSPPB2048_LBSPPM0_LPA0_LPB0_LPM0_LRVW8_LWPMn1_MIAV1_MIWT4_4_MO40_NTn1_NTA0_NTB0_NTC0_NTD0_NTM0_NEPBS0_NLCA1_NLCB1_ONLL0_PGR2_PLR1_PKA0_SIA2_SS1_SU32_SUM0_SUS256_SPO0_SRVW0_SSO0_SVW4_SK0_SKXCCM0_TLDS0_ULSGRO0_USL1_UIOFGRO0_USFGROn1_VSn1_VWA4_VWB4_WSGRA0_WSGRB0_WS32_WG32_4_1_WGM8_WGMXCC1_WGMXCCGn1
    SolutionIndex: 324
    SolutionNameMin: Cijk_Ailk_Bjlk_HSS_BH_Bias_SHB_HA_S_SAB_SCD_SAV_UserArgs_MT128x128x16_MI16x16x1_SN_LDSB0_AFC1_AFEM1_AFEM1_ASEM1_CLR0_CADS0_DTLA0_DTLB0_DTVA0_DTVB0_EPS1_FDSI0_GRPM1_GRVWA8_GRVWB4_GSU1_GSUAMB_GSUC0_GSUWGMRR0_GLS0_ISA1200_IU1_K1_LBSPPA2048_LBSPPB2048_LBSPPM0_LPA0_LPB0_LPM0_LRVW8_LWPMn1_MIAV1_MIWT4_4_MO40_NTn1_NTA0_NTB0_NTC0_NTD0_NTM0_NEPBS0_NLCA1_NLCB1_ONLL0_PGR1_PLR0_PKA0_SIA3_SS1_SU32_SUM0_SUS256_SPO0_SRVW0_SSO0_SVW4_SK0_SKXCCM0_TLDS0_ULSGRO0_USL1_UIOFGRO0_USFGROn1_VSn1_VWA4_VWB4_WSGRA0_WSGRB0_WS32_WG32_4_1_WGM8_WGMXCC1_WGMXCCGn1
    SolutionIndex: 325
    SolutionNameMin: Cijk_Ailk_Bjlk_HSS_BH_Bias_SHB_HA_S_SAB_SCD_SAV_UserArgs_MT32x16x64_MI16x16x1_SN_LDSB1_AFC1_AFEM1_AFEM1_ASEM1_CLR1_CADS0_DTLA0_DTLB0_DTVA0_DTVB0_EPS1_FDSI0_GRPM1_GRVWA4_GRVWB8_GSU1_GSUAMB_GSUC0_GSUWGMRR0_GLS0_ISA1200_IU4_K1_LBSPPA512_LBSPPB256_LBSPPM0_LPA16_LPB16_LPM0_LRVW8_LWPMn1_MIAV1_MIWT1_1_MO40_NTn1_NTA0_NTB0_NTC0_NTD0_NTM0_NEPBS0_NLCA1_NLCB1_ONLL0_PGR1_PLR1_PKA0_SIA2_SS0_SU32_SUM0_SUS256_SPO0_SRVW0_SSO0_SVW8_SK0_SKXCCM0_TLDS0_ULSGRO0_USL1_UIOFGRO0_USFGROn1_VSn1_VWA1_VWB1_WSGRA0_WSGRB0_WS32_WG32_2_1_WGM8_WGMXCC1_WGMXCCGn1
    SolutionIndex: 326
    SolutionNameMin: Cijk_Ailk_Bjlk_HSS_BH_Bias_SHB_HA_S_SAB_SCD_SAV_UserArgs_MT16x32x64_MI16x16x1_SN_LDSB1_AFC1_AFEM1_AFEM1_ASEM1_CLR1_CADS0_DTLA0_DTLB0_DTVA0_DTVB0_EPS0_FDSI0_GRPM1_GRVWA8_GRVWB8_GSU1_GSUAMB_GSUC0_GSUWGMRR0_GLS0_ISA1200_IU4_K1_LBSPPA256_LBSPPB512_LBSPPM0_LPA16_LPB16_LPM0_LRVW8_LWPMn1_MIAV1_MIWT1_1_MO40_NTn1_NTA0_NTB0_NTC0_NTD0_NTM0_NEPBS0_NLCA1_NLCB1_ONLL0_PGR2_PLR1_PKA0_SIA2_SS0_SU32_SUM0_SUS256_SPO0_SRVW0_SSO0_SVW8_SK0_SKXCCM0_TLDS0_ULSGRO0_USL1_UIOFGRO0_USFGROn1_VSn1_VWA1_VWB1_WSGRA0_WSGRB0_WS32_WG16_4_1_WGM8_WGMXCC1_WGMXCCGn1
    SolutionIndex: 327
    SolutionNameMin: Cijk_Ailk_Bjlk_HSS_BH_Bias_SHB_HA_S_SAB_SCD_SAV_UserArgs_MT32x32x128_MI16x16x1_SN_LDSB0_AFC1_AFEM1_AFEM1_ASEM1_CLR1_CADS0_DTLA0_DTLB0_DTVA1_DTVB0_EPS0_FDSI0_GRPM1_GRVWA8_GRVWB8_GSU1_GSUAMB_GSUC0_GSUWGMRR0_GLS0_ISA1200_IU1_K1_LBSPPA0_LBSPPB512_LBSPPM0_LPA0_LPB16_LPM0_LRVW8_LWPMn1_MIAV1_MIWT1_1_MO40_NTn1_NTA0_NTB0_NTC0_NTD0_NTM0_NEPBS0_NLCA1_NLCB1_ONLL0_PGR2_PLR1_PKA0_SIA3_SS0_SU32_SUM0_SUS256_SPO0_SRVW0_SSO0_SVW8_SK0_SKXCCM0_TLDS0_ULSGRO0_USL1_UIOFGRO0_USFGROn1_VSn1_VWA1_VWB1_WSGRA0_WSGRB0_WS32_WG32_4_1_WGM8_WGMXCC1_WGMXCCGn1
    SolutionIndex: 329
    SolutionNameMin: Cijk_Ailk_Bjlk_HSS_BH_Bias_SHB_HA_S_SAB_SCD_SAV_UserArgs_MT16x16x64_MI16x16x1_SN_LDSB1_AFC1_AFEM1_AFEM1_ASEM1_CLR1_CADS0_DTLA0_DTLB0_DTVA0_DTVB0_EPS0_FDSI0_GRPM1_GRVWA8_GRVWB8_GSU1_GSUAMB_GSUC0_GSUWGMRR0_GLS0_ISA1200_IU4_K1_LBSPPA256_LBSPPB256_LBSPPM0_LPA16_LPB16_LPM0_LRVW8_LWPMn1_MIAV1_MIWT1_1_MO40_NTn1_NTA0_NTB0_NTC0_NTD0_NTM0_NEPBS0_NLCA1_NLCB1_ONLL0_PGR2_PLR1_PKA0_SIA2_SS0_SU32_SUM0_SUS256_SPO0_SRVW0_SSO0_SVW8_SK0_SKXCCM0_TLDS0_ULSGRO0_USL1_UIOFGRO0_USFGROn1_VSn1_VWA1_VWB1_WSGRA0_WSGRB0_WS32_WG16_2_1_WGM8_WGMXCC1_WGMXCCGn1
    SolutionIndex: 331
    SolutionNameMin: Cijk_Ailk_Bjlk_HSS_BH_Bias_SHB_HA_S_SAB_SCD_SAV_UserArgs_MT64x64x64_MI16x16x1_SN_LDSB0_AFC1_AFEM1_AFEM1_ASEM1_CLR1_CADS0_DTLA0_DTLB0_DTVA1_DTVB0_EPS1_FDSI0_GRPM1_GRVWA8_GRVWB8_GSU1_GSUAMB_GSUC0_GSUWGMRR0_GLS0_ISA1200_IU1_K1_LBSPPA0_LBSPPB1024_LBSPPM0_LPA0_LPB32_LPM0_LRVW8_LWPMn1_MIAV1_MIWT2_2_MO40_NTn1_NTA0_NTB0_NTC0_NTD0_NTM0_NEPBS0_NLCA4_NLCB1_ONLL0_PGR1_PLR1_PKA0_SIA3_SS0_SU32_SUM0_SUS256_SPO0_SRVW0_SSO0_SVW8_SK0_SKXCCM0_TLDS0_ULSGRO0_USL1_UIOFGRO0_USFGROn1_VSn1_VWA1_VWB2_WSGRA0_WSGRB0_WS32_WG32_4_1_WGM8_WGMXCC1_WGMXCCGn1
    SolutionIndex: 332
    SolutionNameMin: Cijk_Ailk_Bjlk_HSS_BH_Bias_SHB_HA_S_SAB_SCD_SAV_UserArgs_MT32x32x128_MI16x16x1_SN_LDSB0_AFC1_AFEM1_AFEM1_ASEM1_CLR1_CADS0_DTLA0_DTLB0_DTVA0_DTVB1_EPS0_FDSI0_GRPM1_GRVWA4_GRVWB8_GSU1_GSUAMB_GSUC0_GSUWGMRR0_GLS0_ISA1200_IU1_K1_LBSPPA512_LBSPPB0_LBSPPM0_LPA16_LPB0_LPM0_LRVW8_LWPMn1_MIAV1_MIWT1_1_MO40_NTn1_NTA0_NTB0_NTC0_NTD0_NTM0_NEPBS0_NLCA1_NLCB1_ONLL0_PGR2_PLR1_PKA0_SIA3_SS0_SU32_SUM0_SUS256_SPO0_SRVW0_SSO0_SVW8_SK0_SKXCCM0_TLDS0_ULSGRO0_USL1_UIOFGRO0_USFGROn1_VSn1_VWA1_VWB1_WSGRA0_WSGRB0_WS32_WG32_4_1_WGM8_WGMXCC1_WGMXCCGn1
    SolutionIndex: 333
    SolutionNameMin: Cijk_Ailk_Bjlk_HSS_BH_Bias_SHB_HA_S_SAB_SCD_SAV_UserArgs_MT32x32x128_MI16x16x1_SN_LDSB0_AFC1_AFEM1_AFEM1_ASEM1_CLR1_CADS0_DTLA0_DTLB0_DTVA0_DTVB1_EPS1_FDSI0_GRPM1_GRVWA4_GRVWB8_GSU1_GSUAMB_GSUC0_GSUWGMRR0_GLS0_ISA1200_IU1_K1_LBSPPA512_LBSPPB0_LBSPPM0_LPA16_LPB0_LPM0_LRVW8_LWPMn1_MIAV1_MIWT1_1_MO40_NTn1_NTA0_NTB0_NTC0_NTD0_NTM0_NEPBS0_NLCA1_NLCB1_ONLL0_PGR1_PLR1_PKA0_SIA3_SS0_SU32_SUM0_SUS256_SPO0_SRVW0_SSO0_SVW8_SK0_SKXCCM0_TLDS0_ULSGRO0_USL1_UIOFGRO0_USFGROn1_VSn1_VWA1_VWB1_WSGRA0_WSGRB0_WS32_WG32_4_1_WGM8_WGMXCC1_WGMXCCGn1
    SolutionIndex: 334
    SolutionNameMin: Cijk_Ailk_Bjlk_HSS_BH_Bias_SHB_HA_S_SAB_SCD_SAV_UserArgs_MT64x64x64_MI16x16x1_SN_LDSB0_AFC1_AFEM1_AFEM1_ASEM1_CLR1_CADS0_DTLA0_DTLB0_DTVA1_DTVB0_EPS0_FDSI0_GRPM1_GRVWA8_GRVWB8_GSU1_GSUAMB_GSUC0_GSUWGMRR0_GLS0_ISA1200_IU1_K1_LBSPPA0_LBSPPB1024_LBSPPM0_LPA0_LPB32_LPM0_LRVW8_LWPMn1_MIAV1_MIWT2_2_MO40_NTn1_NTA0_NTB0_NTC0_NTD0_NTM0_NEPBS0_NLCA4_NLCB1_ONLL0_PGR2_PLR1_PKA0_SIA3_SS0_SU32_SUM0_SUS256_SPO0_SRVW0_SSO0_SVW8_SK0_SKXCCM0_TLDS0_ULSGRO0_USL1_UIOFGRO0_USFGROn1_VSn1_VWA1_VWB2_WSGRA0_WSGRB0_WS32_WG32_4_1_WGM8_WGMXCC1_WGMXCCGn1
    SolutionIndex: 335
    SolutionNameMin: Cijk_Ailk_Bjlk_HSS_BH_Bias_SHB_HA_S_SAB_SCD_SAV_UserArgs_MT64x64x64_MI16x16x1_SN_LDSB0_AFC1_AFEM1_AFEM1_ASEM1_CLR1_CADS0_DTLA0_DTLB0_DTVA1_DTVB0_EPS1_FDSI0_GRPM1_GRVWA8_GRVWB4_GSU1_GSUAMB_GSUC0_GSUWGMRR0_GLS0_ISA1200_IU1_K1_LBSPPA0_LBSPPB1024_LBSPPM0_LPA0_LPB32_LPM0_LRVW8_LWPMn1_MIAV1_MIWT2_2_MO40_NTn1_NTA0_NTB0_NTC0_NTD0_NTM0_NEPBS0_NLCA4_NLCB1_ONLL0_PGR1_PLR1_PKA0_SIA3_SS0_SU32_SUM0_SUS256_SPO0_SRVW0_SSO0_SVW8_SK0_SKXCCM0_TLDS0_ULSGRO0_USL1_UIOFGRO0_USFGROn1_VSn1_VWA1_VWB2_WSGRA0_WSGRB0_WS32_WG32_4_1_WGM8_WGMXCC1_WGMXCCGn1
    SolutionIndex: 342
    SolutionNameMin: Cijk_Ailk_Bjlk_HSS_BH_Bias_SHB_HA_S_SAB_SCD_SAV_UserArgs_MT32x128x32_MI16x16x1_SN_LDSB0_AFC1_AFEM1_AFEM1_ASEM1_CLR1_CADS0_DTLA0_DTLB0_DTVA0_DTVB1_EPS0_FDSI0_GRPM1_GRVWA4_GRVWB8_GSU1_GSUAMB_GSUC0_GSUWGMRR0_GLS0_ISA1200_IU1_K1_LBSPPA512_LBSPPB0_LBSPPM0_LPA16_LPB0_LPM0_LRVW8_LWPMn1_MIAV1_MIWT1_4_MO40_NTn1_NTA0_NTB0_NTC0_NTD0_NTM0_NEPBS0_NLCA1_NLCB2_ONLL0_PGR2_PLR1_PKA0_SIA3_SS0_SU32_SUM0_SUS256_SPO0_SRVW0_SSO0_SVW8_SK0_SKXCCM0_TLDS0_ULSGRO0_USL1_UIOFGRO0_USFGROn1_VSn1_VWA1_VWB1_WSGRA0_WSGRB0_WS32_WG32_4_1_WGM8_WGMXCC1_WGMXCCGn1
    SolutionIndex: 343
    SolutionNameMin: Cijk_Ailk_Bjlk_HSS_BH_Bias_SHB_HA_S_SAB_SCD_SAV_UserArgs_MT64x64x32_MI16x16x1_SN_LDSB1_AFC1_AFEM1_AFEM1_ASEM1_CLR1_CADS0_DTLA0_DTLB0_DTVA0_DTVB0_EPS0_FDSI0_GRPM1_GRVWA8_GRVWB4_GSU1_GSUAMB_GSUC0_GSUWGMRR0_GLS0_ISA1200_IU2_K1_LBSPPA1024_LBSPPB1024_LBSPPM0_LPA32_LPB32_LPM0_LRVW8_LWPMn1_MIAV1_MIWT2_2_MO40_NTn1_NTA0_NTB0_NTC0_NTD0_NTM0_NEPBS0_NLCA1_NLCB1_ONLL0_PGR2_PLR1_PKA0_SIA2_SS1_SU32_SUM0_SUS256_SPO0_SRVW0_SSO0_SVW2_SK0_SKXCCM0_TLDS0_ULSGRO1_USL1_UIOFGRO0_USFGROn1_VSn1_VWA2_VWB2_WSGRA0_WSGRB0_WS32_WG32_4_1_WGM8_WGMXCC1_WGMXCCGn1
    SolutionIndex: 344
    SolutionNameMin: Cijk_Ailk_Bjlk_HSS_BH_Bias_SHB_HA_S_SAB_SCD_SAV_UserArgs_MT16x32x128_MI16x16x1_SN_LDSB0_AFC1_AFEM1_AFEM1_ASEM1_CLR1_CADS0_DTLA0_DTLB0_DTVA0_DTVB1_EPS1_FDSI0_GRPM1_GRVWA8_GRVWB8_GSU1_GSUAMB_GSUC0_GSUWGMRR0_GLS0_ISA1200_IU1_K1_LBSPPA256_LBSPPB0_LBSPPM0_LPA16_LPB0_LPM0_LRVW8_LWPMn1_MIAV1_MIWT1_1_MO40_NTn1_NTA0_NTB0_NTC0_NTD0_NTM0_NEPBS0_NLCA1_NLCB1_ONLL0_PGR1_PLR1_PKA0_SIA3_SS0_SU32_SUM0_SUS256_SPO0_SRVW0_SSO0_SVW8_SK0_SKXCCM0_TLDS0_ULSGRO0_USL1_UIOFGRO0_USFGROn1_VSn1_VWA1_VWB1_WSGRA0_WSGRB0_WS32_WG16_4_1_WGM8_WGMXCC1_WGMXCCGn1
    SolutionIndex: 346
    SolutionNameMin: Cijk_Ailk_Bjlk_HSS_BH_Bias_SHB_HA_S_SAB_SCD_SAV_UserArgs_MT64x64x64_MI16x16x1_SN_LDSB0_AFC1_AFEM1_AFEM1_ASEM1_CLR1_CADS0_DTLA0_DTLB0_DTVA1_DTVB0_EPS0_FDSI0_GRPM1_GRVWA8_GRVWB4_GSU1_GSUAMB_GSUC0_GSUWGMRR0_GLS0_ISA1200_IU1_K1_LBSPPA0_LBSPPB1024_LBSPPM0_LPA0_LPB32_LPM0_LRVW8_LWPMn1_MIAV1_MIWT2_2_MO40_NTn1_NTA0_NTB0_NTC0_NTD0_NTM0_NEPBS0_NLCA4_NLCB1_ONLL0_PGR2_PLR1_PKA0_SIA3_SS0_SU32_SUM0_SUS256_SPO0_SRVW0_SSO0_SVW8_SK0_SKXCCM0_TLDS0_ULSGRO0_USL1_UIOFGRO0_USFGROn1_VSn1_VWA1_VWB2_WSGRA0_WSGRB0_WS32_WG32_4_1_WGM8_WGMXCC1_WGMXCCGn1
    SolutionIndex: 347
    SolutionNameMin: Cijk_Ailk_Bjlk_HSS_BH_Bias_SHB_HA_S_SAB_SCD_SAV_UserArgs_MT64x64x32_MI16x16x1_SN_LDSB0_AFC1_AFEM1_AFEM1_ASEM1_CLR1_CADS0_DTLA0_DTLB0_DTVA1_DTVB0_EPS0_FDSI0_GRPM1_GRVWA8_GRVWB4_GSU1_GSUAMB_GSUC0_GSUWGMRR0_GLS0_ISA1200_IU1_K1_LBSPPA0_LBSPPB1024_LBSPPM0_LPA0_LPB32_LPM0_LRVW8_LWPMn1_MIAV1_MIWT2_2_MO40_NTn1_NTA0_NTB0_NTC0_NTD0_NTM0_NEPBS0_NLCA2_NLCB1_ONLL0_PGR2_PLR1_PKA0_SIA3_SS0_SU32_SUM0_SUS256_SPO0_SRVW0_SSO0_SVW8_SK0_SKXCCM0_TLDS0_ULSGRO0_USL1_UIOFGRO0_USFGROn1_VSn1_VWA1_VWB2_WSGRA0_WSGRB0_WS32_WG32_4_1_WGM8_WGMXCC1_WGMXCCGn1
    SolutionIndex: 349
    SolutionNameMin: Cijk_Ailk_Bjlk_HSS_BH_Bias_SHB_HA_S_SAB_SCD_SAV_UserArgs_MT64x64x64_MI16x16x1_SN_LDSB0_AFC1_AFEM1_AFEM1_ASEM1_CLR1_CADS0_DTLA0_DTLB0_DTVA0_DTVB1_EPS0_FDSI0_GRPM1_GRVWA8_GRVWB8_GSU1_GSUAMB_GSUC0_GSUWGMRR0_GLS0_ISA1200_IU1_K1_LBSPPA1024_LBSPPB0_LBSPPM0_LPA32_LPB0_LPM0_LRVW8_LWPMn1_MIAV1_MIWT2_2_MO40_NTn1_NTA0_NTB0_NTC0_NTD0_NTM0_NEPBS0_NLCA1_NLCB4_ONLL0_PGR2_PLR1_PKA0_SIA3_SS0_SU32_SUM0_SUS256_SPO0_SRVW0_SSO0_SVW8_SK0_SKXCCM0_TLDS0_ULSGRO0_USL1_UIOFGRO0_USFGROn1_VSn1_VWA2_VWB1_WSGRA0_WSGRB0_WS32_WG32_4_1_WGM8_WGMXCC1_WGMXCCGn1
    SolutionIndex: 350
    SolutionNameMin: Cijk_Ailk_Bjlk_HSS_BH_Bias_SHB_HA_S_SAB_SCD_SAV_UserArgs_MT64x64x64_MI16x16x1_SN_LDSB1_AFC1_AFEM1_AFEM1_ASEM1_CLR1_CADS0_DTLA0_DTLB0_DTVA0_DTVB0_EPS1_FDSI0_GRPM1_GRVWA4_GRVWB8_GSU1_GSUAMB_GSUC0_GSUWGMRR0_GLS0_ISA1200_IU4_K1_LBSPPA1024_LBSPPB1024_LBSPPM0_LPA32_LPB32_LPM0_LRVW8_LWPMn1_MIAV1_MIWT2_2_MO40_NTn1_NTA0_NTB0_NTC0_NTD0_NTM0_NEPBS0_NLCA1_NLCB1_ONLL0_PGR1_PLR1_PKA0_SIA2_SS1_SU32_SUM0_SUS256_SPO0_SRVW0_SSO0_SVW2_SK0_SKXCCM0_TLDS0_ULSGRO0_USL1_UIOFGRO0_USFGROn1_VSn1_VWA2_VWB2_WSGRA0_WSGRB0_WS32_WG32_4_1_WGM8_WGMXCC1_WGMXCCGn1
    SolutionIndex: 354
    SolutionNameMin: Cijk_Ailk_Bjlk_HSS_BH_Bias_SHB_HA_S_SAB_SCD_SAV_UserArgs_MT64x64x64_MI16x16x1_SN_LDSB1_AFC1_AFEM1_AFEM1_ASEM1_CLR1_CADS0_DTLA0_DTLB0_DTVA0_DTVB0_EPS0_FDSI0_GRPM1_GRVWA8_GRVWB8_GSU1_GSUAMB_GSUC0_GSUWGMRR0_GLS0_ISA1200_IU4_K1_LBSPPA1024_LBSPPB1024_LBSPPM0_LPA32_LPB32_LPM0_LRVW8_LWPMn1_MIAV1_MIWT2_2_MO40_NTn1_NTA0_NTB0_NTC0_NTD0_NTM0_NEPBS0_NLCA1_NLCB1_ONLL0_PGR2_PLR1_PKA0_SIA2_SS1_SU32_SUM0_SUS256_SPO0_SRVW0_SSO0_SVW2_SK0_SKXCCM0_TLDS0_ULSGRO0_USL1_UIOFGRO0_USFGROn1_VSn1_VWA2_VWB2_WSGRA0_WSGRB0_WS32_WG32_4_1_WGM8_WGMXCC1_WGMXCCGn1
    SolutionIndex: 355
    SolutionNameMin: Cijk_Ailk_Bjlk_HSS_BH_Bias_SHB_HA_S_SAB_SCD_SAV_UserArgs_MT64x64x16_MI16x16x1_SN_LDSB0_AFC1_AFEM1_AFEM1_ASEM1_CLR1_CADS0_DTLA0_DTLB0_DTVA1_DTVB1_EPS0_FDSI0_GRPM1_GRVWA8_GRVWB8_GSU1_GSUAMB_GSUC0_GSUWGMRR0_GLS0_ISA1200_IU1_K1_LBSPPA0_LBSPPB0_LBSPPM0_LPA0_LPB0_LPM0_LRVW8_LWPMn1_MIAV1_MIWT2_2_MO40_NTn1_NTA0_NTB0_NTC0_NTD0_NTM0_NEPBS0_NLCA1_NLCB1_ONLL0_PGR1_PLR0_PKA0_SIA3_SS0_SU32_SUM0_SUS256_SPO0_SRVW0_SSO0_SVW8_SK0_SKXCCM0_TLDS0_ULSGRO0_USL1_UIOFGRO0_USFGROn1_VSn1_VWA1_VWB1_WSGRA0_WSGRB0_WS32_WG32_4_1_WGM8_WGMXCC1_WGMXCCGn1
    SolutionIndex: 356
    SolutionNameMin: Cijk_Ailk_Bjlk_HSS_BH_Bias_SHB_HA_S_SAB_SCD_SAV_UserArgs_MT64x64x16_MI16x16x1_SN_LDSB1_AFC1_AFEM1_AFEM1_ASEM1_CLR1_CADS0_DTLA0_DTLB0_DTVA0_DTVB0_EPS1_FDSI0_GRPM1_GRVWA8_GRVWB1_GSU1_GSUAMB_GSUC0_GSUWGMRR0_GLS0_ISA1200_IU1_K1_LBSPPA1024_LBSPPB1024_LBSPPM0_LPA32_LPB32_LPM0_LRVW8_LWPMn1_MIAV1_MIWT2_2_MO40_NTn1_NTA0_NTB0_NTC0_NTD0_NTM0_NEPBS0_NLCA1_NLCB1_ONLL0_PGR1_PLR1_PKA0_SIA2_SS1_SU32_SUM0_SUS256_SPO0_SRVW0_SSO0_SVW2_SK0_SKXCCM0_TLDS0_ULSGRO0_USL1_UIOFGRO0_USFGROn1_VSn1_VWA2_VWB2_WSGRA0_WSGRB0_WS32_WG32_4_1_WGM8_WGMXCC1_WGMXCCGn1
    SolutionIndex: 357
    SolutionNameMin: Cijk_Ailk_Bjlk_HSS_BH_Bias_SHB_HA_S_SAB_SCD_SAV_UserArgs_MT64x64x32_MI16x16x1_SN_LDSB0_AFC1_AFEM1_AFEM1_ASEM1_CLR1_CADS0_DTLA0_DTLB0_DTVA1_DTVB0_EPS0_FDSI0_GRPM1_GRVWA8_GRVWB8_GSU1_GSUAMB_GSUC0_GSUWGMRR0_GLS0_ISA1200_IU1_K1_LBSPPA0_LBSPPB1024_LBSPPM0_LPA0_LPB32_LPM0_LRVW8_LWPMn1_MIAV1_MIWT2_2_MO40_NTn1_NTA0_NTB0_NTC0_NTD0_NTM0_NEPBS0_NLCA2_NLCB1_ONLL0_PGR2_PLR1_PKA0_SIA3_SS0_SU32_SUM0_SUS256_SPO0_SRVW0_SSO0_SVW8_SK0_SKXCCM0_TLDS0_ULSGRO0_USL1_UIOFGRO0_USFGROn1_VSn1_VWA1_VWB2_WSGRA0_WSGRB0_WS32_WG32_4_1_WGM8_WGMXCC1_WGMXCCGn1
    SolutionIndex: 359
    SolutionNameMin: Cijk_Ailk_Bjlk_HSS_BH_Bias_SHB_HA_S_SAB_SCD_SAV_UserArgs_MT64x64x32_MI16x16x1_SN_LDSB0_AFC1_AFEM1_AFEM1_ASEM1_CLR1_CADS0_DTLA0_DTLB0_DTVA0_DTVB1_EPS0_FDSI0_GRPM1_GRVWA4_GRVWB8_GSU1_GSUAMB_GSUC0_GSUWGMRR0_GLS0_ISA1200_IU1_K1_LBSPPA1024_LBSPPB0_LBSPPM0_LPA32_LPB0_LPM0_LRVW8_LWPMn1_MIAV1_MIWT2_2_MO40_NTn1_NTA0_NTB0_NTC0_NTD0_NTM0_NEPBS0_NLCA1_NLCB2_ONLL0_PGR2_PLR1_PKA0_SIA3_SS1_SU32_SUM0_SUS256_SPO0_SRVW0_SSO0_SVW2_SK0_SKXCCM0_TLDS0_ULSGRO0_USL1_UIOFGRO0_USFGROn1_VSn1_VWA2_VWB1_WSGRA0_WSGRB0_WS32_WG32_4_1_WGM8_WGMXCC1_WGMXCCGn1
    SolutionIndex: 360
    SolutionNameMin: Cijk_Ailk_Bjlk_HSS_BH_Bias_SHB_HA_S_SAB_SCD_SAV_UserArgs_MT128x64x16_MI16x16x1_SN_LDSB0_AFC1_AFEM1_AFEM1_ASEM1_CLR1_CADS0_DTLA0_DTLB0_DTVA1_DTVB1_EPS0_FDSI0_GRPM1_GRVWA8_GRVWB8_GSU1_GSUAMB_GSUC0_GSUWGMRR0_GLS0_ISA1200_IU1_K1_LBSPPA0_LBSPPB0_LBSPPM0_LPA0_LPB0_LPM0_LRVW8_LWPMn1_MIAV1_MIWT8_1_MO40_NTn1_NTA0_NTB0_NTC0_NTD0_NTM0_NEPBS0_NLCA1_NLCB1_ONLL0_PGR1_PLR0_PKA0_SIA3_SS0_SU32_SUM0_SUS256_SPO0_SRVW0_SSO0_SVW8_SK0_SKXCCM0_TLDS0_ULSGRO0_USL1_UIOFGRO0_USFGROn1_VSn1_VWA1_VWB1_WSGRA0_WSGRB0_WS32_WG16_8_1_WGM8_WGMXCC1_WGMXCCGn1
    SolutionIndex: 361
    SolutionNameMin: Cijk_Ailk_Bjlk_HSS_BH_Bias_SHB_HA_S_SAB_SCD_SAV_UserArgs_MT64x64x64_MI16x16x1_SN_LDSB0_AFC1_AFEM1_AFEM1_ASEM1_CLR1_CADS0_DTLA0_DTLB0_DTVA0_DTVB1_EPS1_FDSI0_GRPM1_GRVWA4_GRVWB8_GSU1_GSUAMB_GSUC0_GSUWGMRR0_GLS0_ISA1200_IU1_K1_LBSPPA1024_LBSPPB0_LBSPPM0_LPA32_LPB0_LPM0_LRVW8_LWPMn1_MIAV1_MIWT2_2_MO40_NTn1_NTA0_NTB0_NTC0_NTD0_NTM0_NEPBS0_NLCA1_NLCB4_ONLL0_PGR1_PLR1_PKA0_SIA3_SS0_SU32_SUM0_SUS256_SPO0_SRVW0_SSO0_SVW8_SK0_SKXCCM0_TLDS0_ULSGRO0_USL1_UIOFGRO0_USFGROn1_VSn1_VWA2_VWB1_WSGRA0_WSGRB0_WS32_WG32_4_1_WGM8_WGMXCC1_WGMXCCGn1
    SolutionIndex: 362
    SolutionNameMin: Cijk_Ailk_Bjlk_HSS_BH_Bias_SHB_HA_S_SAB_SCD_SAV_UserArgs_MT64x64x64_MI16x16x1_SN_LDSB0_AFC1_AFEM1_AFEM1_ASEM1_CLR1_CADS0_DTLA0_DTLB0_DTVA0_DTVB1_EPS1_FDSI0_GRPM1_GRVWA4_GRVWB8_GSU1_GSUAMB_GSUC0_GSUWGMRR0_GLS0_ISA1200_IU1_K1_LBSPPA1024_LBSPPB0_LBSPPM0_LPA32_LPB0_LPM0_LRVW8_LWPMn1_MIAV1_MIWT2_2_MO40_NTn1_NTA0_NTB0_NTC0_NTD0_NTM0_NEPBS0_NLCA1_NLCB4_ONLL0_PGR1_PLR1_PKA0_SIA3_SS1_SU32_SUM0_SUS256_SPO0_SRVW0_SSO0_SVW2_SK0_SKXCCM0_TLDS0_ULSGRO0_USL1_UIOFGRO0_USFGROn1_VSn1_VWA2_VWB1_WSGRA0_WSGRB0_WS32_WG32_4_1_WGM8_WGMXCC1_WGMXCCGn1
    SolutionIndex: 363
    SolutionNameMin: Cijk_Ailk_Bjlk_HSS_BH_Bias_SHB_HA_S_SAB_SCD_SAV_UserArgs_MT64x64x32_MI16x16x1_SN_LDSB0_AFC1_AFEM1_AFEM1_ASEM1_CLR1_CADS0_DTLA0_DTLB0_DTVA1_DTVB1_EPS0_FDSI0_GRPM1_GRVWA8_GRVWB8_GSU1_GSUAMB_GSUC0_GSUWGMRR0_GLS0_ISA1200_IU1_K1_LBSPPA0_LBSPPB0_LBSPPM0_LPA0_LPB0_LPM0_LRVW8_LWPMn1_MIAV1_MIWT2_2_MO40_NTn1_NTA0_NTB0_NTC0_NTD0_NTM0_NEPBS0_NLCA2_NLCB2_ONLL0_PGR1_PLR0_PKA0_SIA3_SS0_SU32_SUM0_SUS256_SPO0_SRVW0_SSO0_SVW8_SK0_SKXCCM0_TLDS0_ULSGRO0_USL1_UIOFGRO0_USFGROn1_VSn1_VWA1_VWB1_WSGRA0_WSGRB0_WS32_WG32_4_1_WGM8_WGMXCC1_WGMXCCGn1
    SolutionIndex: 365
    SolutionNameMin: Cijk_Ailk_Bjlk_HSS_BH_Bias_SHB_HA_S_SAB_SCD_SAV_UserArgs_MT32x32x128_MI16x16x1_SN_LDSB0_AFC1_AFEM1_AFEM1_ASEM1_CLR1_CADS0_DTLA0_DTLB0_DTVA1_DTVB0_EPS0_FDSI0_GRPM1_GRVWA8_GRVWB8_GSU1_GSUAMB_GSUC0_GSUWGMRR0_GLS0_ISA1200_IU1_K1_LBSPPA0_LBSPPB512_LBSPPM0_LPA0_LPB16_LPM0_LRVW8_LWPMn1_MIAV1_MIWT1_1_MO40_NTn1_NTA0_NTB0_NTC0_NTD0_NTM0_NEPBS0_NLCA1_NLCB1_ONLL0_PGR2_PLR1_PKA0_SIA3_SS1_SU32_SUM0_SUS256_SPO0_SRVW0_SSO0_SVW1_SK0_SKXCCM0_TLDS0_ULSGRO0_USL1_UIOFGRO0_USFGROn1_VSn1_VWA1_VWB1_WSGRA0_WSGRB0_WS32_WG32_4_1_WGM8_WGMXCC1_WGMXCCGn1
    SolutionIndex: 369
    SolutionNameMin: Cijk_Ailk_Bjlk_HSS_BH_Bias_SHB_HA_S_SAB_SCD_SAV_UserArgs_MT64x64x32_MI16x16x1_SN_LDSB0_AFC1_AFEM1_AFEM1_ASEM1_CLR1_CADS0_DTLA0_DTLB0_DTVA1_DTVB1_EPS0_FDSI0_GRPM1_GRVWA8_GRVWB8_GSU1_GSUAMB_GSUC0_GSUWGMRR0_GLS0_ISA1200_IU1_K1_LBSPPA0_LBSPPB0_LBSPPM0_LPA0_LPB0_LPM0_LRVW8_LWPMn1_MIAV1_MIWT2_2_MO40_NTn1_NTA0_NTB0_NTC0_NTD0_NTM0_NEPBS0_NLCA2_NLCB2_ONLL0_PGR1_PLR0_PKA0_SIA3_SS1_SU32_SUM0_SUS256_SPO0_SRVW0_SSO0_SVW1_SK0_SKXCCM0_TLDS0_ULSGRO0_USL1_UIOFGRO0_USFGROn1_VSn1_VWA1_VWB1_WSGRA0_WSGRB0_WS32_WG32_4_1_WGM8_WGMXCC1_WGMXCCGn1
    SolutionIndex: 371
    SolutionNameMin: Cijk_Ailk_Bjlk_HSS_BH_Bias_SHB_HA_S_SAB_SCD_SAV_UserArgs_MT64x128x32_MI16x16x1_SN_LDSB0_AFC1_AFEM1_AFEM1_ASEM1_CLR1_CADS0_DTLA0_DTLB0_DTVA0_DTVB1_EPS1_FDSI0_GRPM1_GRVWA8_GRVWB8_GSU1_GSUAMB_GSUC0_GSUWGMRR0_GLS0_ISA1200_IU1_K1_LBSPPA1024_LBSPPB0_LBSPPM0_LPA16_LPB0_LPM0_LRVW8_LWPMn1_MIAV1_MIWT1_8_MO40_NTn1_NTA0_NTB0_NTC0_NTD0_NTM0_NEPBS0_NLCA1_NLCB2_ONLL0_PGR1_PLR1_PKA0_SIA3_SS0_SU32_SUM0_SUS256_SPO0_SRVW0_SSO0_SVW8_SK0_SKXCCM0_TLDS0_ULSGRO0_USL1_UIOFGRO0_USFGROn1_VSn1_VWA1_VWB1_WSGRA0_WSGRB0_WS32_WG64_2_1_WGM8_WGMXCC1_WGMXCCGn1
    SolutionIndex: 372
    SolutionNameMin: Cijk_Ailk_Bjlk_HSS_BH_Bias_SHB_HA_S_SAB_SCD_SAV_UserArgs_MT64x128x32_MI16x16x1_SN_LDSB0_AFC1_AFEM1_AFEM1_ASEM1_CLR1_CADS0_DTLA0_DTLB0_DTVA0_DTVB1_EPS0_FDSI0_GRPM1_GRVWA8_GRVWB8_GSU1_GSUAMB_GSUC0_GSUWGMRR0_GLS0_ISA1200_IU1_K1_LBSPPA1024_LBSPPB0_LBSPPM0_LPA16_LPB0_LPM0_LRVW8_LWPMn1_MIAV1_MIWT1_8_MO40_NTn1_NTA0_NTB0_NTC0_NTD0_NTM0_NEPBS0_NLCA1_NLCB2_ONLL0_PGR2_PLR1_PKA0_SIA3_SS0_SU32_SUM0_SUS256_SPO0_SRVW0_SSO0_SVW8_SK0_SKXCCM0_TLDS0_ULSGRO0_USL1_UIOFGRO0_USFGROn1_VSn1_VWA1_VWB1_WSGRA0_WSGRB0_WS32_WG64_2_1_WGM8_WGMXCC1_WGMXCCGn1
    SolutionIndex: 373
    SolutionNameMin: Cijk_Ailk_Bjlk_HSS_BH_Bias_SHB_HA_S_SAB_SCD_SAV_UserArgs_MT64x128x32_MI16x16x1_SN_LDSB0_AFC1_AFEM1_AFEM1_ASEM1_CLR1_CADS0_DTLA0_DTLB0_DTVA0_DTVB1_EPS0_FDSI0_GRPM1_GRVWA4_GRVWB8_GSU1_GSUAMB_GSUC0_GSUWGMRR0_GLS0_ISA1200_IU1_K1_LBSPPA1024_LBSPPB0_LBSPPM0_LPA16_LPB0_LPM0_LRVW8_LWPMn1_MIAV1_MIWT1_8_MO40_NTn1_NTA0_NTB0_NTC0_NTD0_NTM0_NEPBS0_NLCA1_NLCB2_ONLL0_PGR2_PLR1_PKA0_SIA3_SS0_SU32_SUM0_SUS256_SPO0_SRVW0_SSO0_SVW8_SK0_SKXCCM0_TLDS0_ULSGRO0_USL1_UIOFGRO0_USFGROn1_VSn1_VWA1_VWB1_WSGRA0_WSGRB0_WS32_WG64_2_1_WGM8_WGMXCC1_WGMXCCGn1
    SolutionIndex: 374
    SolutionNameMin: Cijk_Ailk_Bjlk_HSS_BH_Bias_SHB_HA_S_SAB_SCD_SAV_UserArgs_MT32x32x128_MI16x16x1_SN_LDSB0_AFC1_AFEM1_AFEM1_ASEM1_CLR1_CADS0_DTLA0_DTLB0_DTVA1_DTVB0_EPS1_FDSI0_GRPM1_GRVWA8_GRVWB8_GSU1_GSUAMB_GSUC0_GSUWGMRR0_GLS0_ISA1200_IU1_K1_LBSPPA0_LBSPPB512_LBSPPM0_LPA0_LPB16_LPM0_LRVW8_LWPMn1_MIAV1_MIWT1_1_MO40_NTn1_NTA0_NTB0_NTC0_NTD0_NTM0_NEPBS0_NLCA1_NLCB1_ONLL0_PGR1_PLR1_PKA0_SIA3_SS0_SU32_SUM0_SUS256_SPO0_SRVW0_SSO0_SVW8_SK0_SKXCCM0_TLDS0_ULSGRO0_USL1_UIOFGRO0_USFGROn1_VSn1_VWA1_VWB1_WSGRA0_WSGRB0_WS32_WG32_4_1_WGM8_WGMXCC1_WGMXCCGn1
    SolutionIndex: 375
    SolutionNameMin: Cijk_Ailk_Bjlk_HSS_BH_Bias_SHB_HA_S_SAB_SCD_SAV_UserArgs_MT32x128x64_MI16x16x1_SN_LDSB0_AFC1_AFEM1_AFEM1_ASEM1_CLR1_CADS0_DTLA0_DTLB0_DTVA0_DTVB1_EPS1_FDSI0_GRPM1_GRVWA8_GRVWB8_GSU1_GSUAMB_GSUC0_GSUWGMRR0_GLS0_ISA1200_IU1_K1_LBSPPA512_LBSPPB0_LBSPPM0_LPA16_LPB0_LPM0_LRVW8_LWPMn1_MIAV1_MIWT1_4_MO40_NTn1_NTA0_NTB0_NTC0_NTD0_NTM0_NEPBS0_NLCA1_NLCB4_ONLL0_PGR1_PLR1_PKA0_SIA3_SS0_SU32_SUM0_SUS256_SPO0_SRVW0_SSO0_SVW8_SK0_SKXCCM0_TLDS0_ULSGRO0_USL1_UIOFGRO0_USFGROn1_VSn1_VWA1_VWB1_WSGRA0_WSGRB0_WS32_WG32_4_1_WGM8_WGMXCC1_WGMXCCGn1
    SolutionIndex: 376
    SolutionNameMin: Cijk_Ailk_Bjlk_HSS_BH_Bias_SHB_HA_S_SAB_SCD_SAV_UserArgs_MT64x64x64_MI16x16x1_SN_LDSB1_AFC1_AFEM1_AFEM1_ASEM1_CLR1_CADS0_DTLA0_DTLB0_DTVA0_DTVB0_EPS0_FDSI0_GRPM1_GRVWA4_GRVWB4_GSU1_GSUAMB_GSUC0_GSUWGMRR0_GLS0_ISA1200_IU4_K1_LBSPPA1024_LBSPPB1024_LBSPPM0_LPA32_LPB32_LPM0_LRVW8_LWPMn1_MIAV1_MIWT2_2_MO40_NTn1_NTA0_NTB0_NTC0_NTD0_NTM0_NEPBS0_NLCA1_NLCB1_ONLL0_PGR2_PLR1_PKA0_SIA2_SS1_SU32_SUM0_SUS256_SPO0_SRVW0_SSO0_SVW2_SK0_SKXCCM0_TLDS0_ULSGRO0_USL1_UIOFGRO0_USFGROn1_VSn1_VWA2_VWB2_WSGRA0_WSGRB0_WS32_WG32_4_1_WGM8_WGMXCC1_WGMXCCGn1
    SolutionIndex: 377
    SolutionNameMin: Cijk_Ailk_Bjlk_HSS_BH_Bias_SHB_HA_S_SAB_SCD_SAV_UserArgs_MT64x64x64_MI16x16x1_SN_LDSB0_AFC1_AFEM1_AFEM1_ASEM1_CLR1_CADS0_DTLA0_DTLB0_DTVA0_DTVB1_EPS0_FDSI0_GRPM1_GRVWA4_GRVWB8_GSU1_GSUAMB_GSUC0_GSUWGMRR0_GLS0_ISA1200_IU1_K1_LBSPPA1024_LBSPPB0_LBSPPM0_LPA32_LPB0_LPM0_LRVW8_LWPMn1_MIAV1_MIWT2_2_MO40_NTn1_NTA0_NTB0_NTC0_NTD0_NTM0_NEPBS0_NLCA1_NLCB4_ONLL0_PGR2_PLR1_PKA0_SIA3_SS1_SU32_SUM0_SUS256_SPO0_SRVW0_SSO0_SVW2_SK0_SKXCCM0_TLDS0_ULSGRO0_USL1_UIOFGRO0_USFGROn1_VSn1_VWA2_VWB1_WSGRA0_WSGRB0_WS32_WG32_4_1_WGM8_WGMXCC1_WGMXCCGn1
    SolutionIndex: 378
    SolutionNameMin: Cijk_Ailk_Bjlk_HSS_BH_Bias_SHB_HA_S_SAB_SCD_SAV_UserArgs_MT64x128x32_MI16x16x1_SN_LDSB0_AFC1_AFEM1_AFEM1_ASEM1_CLR1_CADS0_DTLA0_DTLB0_DTVA0_DTVB1_EPS1_FDSI0_GRPM1_GRVWA4_GRVWB8_GSU1_GSUAMB_GSUC0_GSUWGMRR0_GLS0_ISA1200_IU1_K1_LBSPPA1024_LBSPPB0_LBSPPM0_LPA16_LPB0_LPM0_LRVW8_LWPMn1_MIAV1_MIWT1_8_MO40_NTn1_NTA0_NTB0_NTC0_NTD0_NTM0_NEPBS0_NLCA1_NLCB2_ONLL0_PGR1_PLR1_PKA0_SIA3_SS0_SU32_SUM0_SUS256_SPO0_SRVW0_SSO0_SVW8_SK0_SKXCCM0_TLDS0_ULSGRO0_USL1_UIOFGRO0_USFGROn1_VSn1_VWA1_VWB1_WSGRA0_WSGRB0_WS32_WG64_2_1_WGM8_WGMXCC1_WGMXCCGn1
    SolutionIndex: 379
    SolutionNameMin: Cijk_Ailk_Bjlk_HSS_BH_Bias_SHB_HA_S_SAB_SCD_SAV_UserArgs_MT64x64x32_MI16x16x1_SN_LDSB0_AFC1_AFEM1_AFEM1_ASEM1_CLR1_CADS0_DTLA0_DTLB0_DTVA0_DTVB1_EPS1_FDSI0_GRPM1_GRVWA4_GRVWB8_GSU1_GSUAMB_GSUC0_GSUWGMRR0_GLS0_ISA1200_IU1_K1_LBSPPA1024_LBSPPB0_LBSPPM0_LPA32_LPB0_LPM0_LRVW8_LWPMn1_MIAV1_MIWT2_2_MO40_NTn1_NTA0_NTB0_NTC0_NTD0_NTM0_NEPBS0_NLCA1_NLCB2_ONLL0_PGR1_PLR1_PKA0_SIA3_SS1_SU32_SUM0_SUS256_SPO0_SRVW0_SSO0_SVW2_SK0_SKXCCM0_TLDS0_ULSGRO0_USL1_UIOFGRO0_USFGROn1_VSn1_VWA2_VWB1_WSGRA0_WSGRB0_WS32_WG32_4_1_WGM8_WGMXCC1_WGMXCCGn1
    SolutionIndex: 382
    SolutionNameMin: Cijk_Ailk_Bjlk_HSS_BH_Bias_SHB_HA_S_SAB_SCD_SAV_UserArgs_MT64x64x16_MI16x16x1_SN_LDSB0_AFC1_AFEM1_AFEM1_ASEM1_CLR1_CADS0_DTLA0_DTLB0_DTVA1_DTVB1_EPS0_FDSI0_GRPM1_GRVWA8_GRVWB8_GSU1_GSUAMB_GSUC0_GSUWGMRR0_GLS0_ISA1200_IU1_K1_LBSPPA0_LBSPPB0_LBSPPM0_LPA0_LPB0_LPM0_LRVW8_LWPMn1_MIAV1_MIWT2_2_MO40_NTn1_NTA0_NTB0_NTC0_NTD0_NTM0_NEPBS0_NLCA1_NLCB1_ONLL0_PGR1_PLR0_PKA0_SIA3_SS1_SU32_SUM0_SUS256_SPO0_SRVW0_SSO0_SVW1_SK0_SKXCCM0_TLDS0_ULSGRO0_USL1_UIOFGRO0_USFGROn1_VSn1_VWA1_VWB1_WSGRA0_WSGRB0_WS32_WG32_4_1_WGM8_WGMXCC1_WGMXCCGn1
    SolutionIndex: 383
    SolutionNameMin: Cijk_Ailk_Bjlk_HSS_BH_Bias_SHB_HA_S_SAB_SCD_SAV_UserArgs_MT32x32x64_MI16x16x1_SN_LDSB0_AFC1_AFEM1_AFEM1_ASEM1_CLR1_CADS0_DTLA0_DTLB0_DTVA0_DTVB0_EPS0_FDSI0_GRPM1_GRVWA4_GRVWB4_GSU1_GSUAMB_GSUC0_GSUWGMRR0_GLS0_ISA1200_IU1_K1_LBSPPA512_LBSPPB512_LBSPPM0_LPA16_LPB16_LPM0_LRVW8_LWPMn1_MIAV1_MIWT1_1_MO40_NTn1_NTA0_NTB0_NTC0_NTD0_NTM0_NEPBS0_NLCA1_NLCB1_ONLL0_PGR2_PLR1_PKA0_SIA3_SS0_SU32_SUM0_SUS256_SPO0_SRVW0_SSO0_SVW8_SK0_SKXCCM0_TLDS0_ULSGRO0_USL1_UIOFGRO0_USFGROn1_VSn1_VWA1_VWB1_WSGRA0_WSGRB0_WS32_WG32_4_1_WGM8_WGMXCC1_WGMXCCGn1
    SolutionIndex: 384
    SolutionNameMin: Cijk_Ailk_Bjlk_HSS_BH_Bias_SHB_HA_S_SAB_SCD_SAV_UserArgs_MT64x64x64_MI16x16x1_SN_LDSB1_AFC1_AFEM1_AFEM1_ASEM1_CLR1_CADS0_DTLA0_DTLB0_DTVA0_DTVB0_EPS0_FDSI0_GRPM1_GRVWA8_GRVWB8_GSU1_GSUAMB_GSUC0_GSUWGMRR0_GLS0_ISA1200_IU4_K1_LBSPPA1024_LBSPPB1024_LBSPPM0_LPA32_LPB32_LPM0_LRVW8_LWPMn1_MIAV1_MIWT2_2_MO40_NTn1_NTA0_NTB0_NTC0_NTD0_NTM0_NEPBS0_NLCA1_NLCB1_ONLL0_PGR2_PLR1_PKA0_SIA2_SS1_SU32_SUM0_SUS256_SPO0_SRVW0_SSO0_SVW2_SK0_SKXCCM0_TLDS0_ULSGRO1_USL1_UIOFGRO0_USFGROn1_VSn1_VWA2_VWB2_WSGRA0_WSGRB0_WS32_WG32_4_1_WGM8_WGMXCC1_WGMXCCGn1
    SolutionIndex: 386
    SolutionNameMin: Cijk_Ailk_Bjlk_HSS_BH_Bias_SHB_HA_S_SAB_SCD_SAV_UserArgs_MT64x128x32_MI16x16x1_SN_LDSB0_AFC1_AFEM1_AFEM1_ASEM1_CLR1_CADS0_DTLA0_DTLB0_DTVA1_DTVB1_EPS0_FDSI0_GRPM1_GRVWA8_GRVWB8_GSU1_GSUAMB_GSUC0_GSUWGMRR0_GLS0_ISA1200_IU1_K1_LBSPPA0_LBSPPB0_LBSPPM0_LPA0_LPB0_LPM0_LRVW8_LWPMn1_MIAV1_MIWT1_8_MO40_NTn1_NTA0_NTB0_NTC0_NTD0_NTM0_NEPBS0_NLCA1_NLCB2_ONLL0_PGR1_PLR0_PKA0_SIA3_SS0_SU32_SUM0_SUS256_SPO0_SRVW0_SSO0_SVW8_SK0_SKXCCM0_TLDS0_ULSGRO0_USL1_UIOFGRO0_USFGROn1_VSn1_VWA1_VWB1_WSGRA0_WSGRB0_WS32_WG64_2_1_WGM8_WGMXCC1_WGMXCCGn1
    SolutionIndex: 389
    SolutionNameMin: Cijk_Ailk_Bjlk_HSS_BH_Bias_SHB_HA_S_SAB_SCD_SAV_UserArgs_MT64x64x64_MI16x16x1_SN_LDSB0_AFC1_AFEM1_AFEM1_ASEM1_CLR1_CADS0_DTLA0_DTLB0_DTVA0_DTVB1_EPS0_FDSI0_GRPM1_GRVWA8_GRVWB8_GSU1_GSUAMB_GSUC0_GSUWGMRR0_GLS0_ISA1200_IU1_K1_LBSPPA1024_LBSPPB0_LBSPPM0_LPA32_LPB0_LPM0_LRVW8_LWPMn1_MIAV1_MIWT2_2_MO40_NTn1_NTA0_NTB0_NTC0_NTD0_NTM0_NEPBS0_NLCA1_NLCB4_ONLL0_PGR2_PLR1_PKA0_SIA3_SS1_SU32_SUM0_SUS256_SPO0_SRVW0_SSO0_SVW2_SK0_SKXCCM0_TLDS0_ULSGRO0_USL1_UIOFGRO0_USFGROn1_VSn1_VWA2_VWB1_WSGRA0_WSGRB0_WS32_WG32_4_1_WGM8_WGMXCC1_WGMXCCGn1
    SolutionIndex: 390
    SolutionNameMin: Cijk_Ailk_Bjlk_HSS_BH_Bias_SHB_HA_S_SAB_SCD_SAV_UserArgs_MT128x128x16_MI16x16x1_SN_LDSB0_AFC1_AFEM1_AFEM1_ASEM1_CLR1_CADS0_DTLA0_DTLB0_DTVA1_DTVB1_EPS0_FDSI0_GRPM1_GRVWA8_GRVWB8_GSU1_GSUAMB_GSUC0_GSUWGMRR0_GLS0_ISA1200_IU1_K1_LBSPPA0_LBSPPB0_LBSPPM0_LPA0_LPB0_LPM0_LRVW8_LWPMn1_MIAV1_MIWT4_4_MO40_NTn1_NTA0_NTB0_NTC0_NTD0_NTM0_NEPBS0_NLCA1_NLCB1_ONLL0_PGR1_PLR0_PKA0_SIA3_SS0_SU32_SUM0_SUS256_SPO0_SRVW0_SSO0_SVW8_SK0_SKXCCM0_TLDS0_ULSGRO0_USL1_UIOFGRO0_USFGROn1_VSn1_VWA1_VWB1_WSGRA0_WSGRB0_WS32_WG32_4_1_WGM8_WGMXCC1_WGMXCCGn1
    SolutionIndex: 392
    SolutionNameMin: Cijk_Ailk_Bjlk_HSS_BH_Bias_SHB_HA_S_SAB_SCD_SAV_UserArgs_MT64x64x16_MI16x16x1_SN_LDSB1_AFC1_AFEM1_AFEM1_ASEM1_CLR1_CADS0_DTLA0_DTLB0_DTVA0_DTVB0_EPS0_FDSI0_GRPM1_GRVWA4_GRVWB4_GSU1_GSUAMB_GSUC0_GSUWGMRR0_GLS0_ISA1200_IU1_K1_LBSPPA1024_LBSPPB1024_LBSPPM0_LPA32_LPB32_LPM0_LRVW8_LWPMn1_MIAV1_MIWT2_2_MO40_NTn1_NTA0_NTB0_NTC0_NTD0_NTM0_NEPBS0_NLCA1_NLCB1_ONLL0_PGR2_PLR1_PKA0_SIA2_SS1_SU32_SUM0_SUS256_SPO0_SRVW0_SSO0_SVW2_SK0_SKXCCM0_TLDS0_ULSGRO0_USL1_UIOFGRO0_USFGROn1_VSn1_VWA2_VWB2_WSGRA0_WSGRB0_WS32_WG32_4_1_WGM8_WGMXCC1_WGMXCCGn1
    SolutionIndex: 397
    SolutionNameMin: Cijk_Ailk_Bjlk_HSS_BH_Bias_SHB_HA_S_SAB_SCD_SAV_UserArgs_MT16x32x64_MI16x16x1_SN_LDSB0_AFC1_AFEM1_AFEM1_ASEM1_CLR1_CADS0_DTLA0_DTLB0_DTVA1_DTVB0_EPS0_FDSI0_GRPM1_GRVWA8_GRVWB4_GSU1_GSUAMB_GSUC0_GSUWGMRR0_GLS0_ISA1200_IU1_K1_LBSPPA0_LBSPPB512_LBSPPM0_LPA0_LPB16_LPM0_LRVW8_LWPMn1_MIAV1_MIWT1_1_MO40_NTn1_NTA0_NTB0_NTC0_NTD0_NTM0_NEPBS0_NLCA1_NLCB1_ONLL0_PGR2_PLR1_PKA0_SIA3_SS1_SU32_SUM0_SUS256_SPO0_SRVW0_SSO0_SVW1_SK0_SKXCCM0_TLDS0_ULSGRO0_USL1_UIOFGRO0_USFGROn1_VSn1_VWA1_VWB1_WSGRA0_WSGRB0_WS32_WG16_4_1_WGM8_WGMXCC1_WGMXCCGn1
    SolutionIndex: 398
    SolutionNameMin: Cijk_Ailk_Bjlk_HSS_BH_Bias_SHB_HA_S_SAB_SCD_SAV_UserArgs_MT32x32x128_MI16x16x1_SN_LDSB0_AFC1_AFEM1_AFEM1_ASEM1_CLR1_CADS0_DTLA0_DTLB0_DTVA0_DTVB1_EPS0_FDSI0_GRPM1_GRVWA8_GRVWB8_GSU1_GSUAMB_GSUC0_GSUWGMRR0_GLS0_ISA1200_IU1_K1_LBSPPA512_LBSPPB0_LBSPPM0_LPA16_LPB0_LPM0_LRVW8_LWPMn1_MIAV1_MIWT1_1_MO40_NTn1_NTA0_NTB0_NTC0_NTD0_NTM0_NEPBS0_NLCA1_NLCB1_ONLL0_PGR2_PLR1_PKA0_SIA3_SS1_SU32_SUM0_SUS256_SPO0_SRVW0_SSO0_SVW1_SK0_SKXCCM0_TLDS0_ULSGRO0_USL1_UIOFGRO0_USFGROn1_VSn1_VWA1_VWB1_WSGRA0_WSGRB0_WS32_WG32_4_1_WGM8_WGMXCC1_WGMXCCGn1
    SolutionIndex: 399
    SolutionNameMin: Cijk_Ailk_Bjlk_HSS_BH_Bias_SHB_HA_S_SAB_SCD_SAV_UserArgs_MT32x32x64_MI16x16x1_SN_LDSB0_AFC1_AFEM1_AFEM1_ASEM1_CLR1_CADS0_DTLA0_DTLB0_DTVA1_DTVB0_EPS0_FDSI0_GRPM1_GRVWA8_GRVWB4_GSU1_GSUAMB_GSUC0_GSUWGMRR0_GLS0_ISA1200_IU1_K1_LBSPPA0_LBSPPB512_LBSPPM0_LPA0_LPB16_LPM0_LRVW8_LWPMn1_MIAV1_MIWT1_1_MO40_NTn1_NTA0_NTB0_NTC0_NTD0_NTM0_NEPBS0_NLCA1_NLCB1_ONLL0_PGR2_PLR1_PKA0_SIA3_SS0_SU32_SUM0_SUS256_SPO0_SRVW0_SSO0_SVW8_SK0_SKXCCM0_TLDS0_ULSGRO0_USL1_UIOFGRO0_USFGROn1_VSn1_VWA1_VWB1_WSGRA0_WSGRB0_WS32_WG32_4_1_WGM8_WGMXCC1_WGMXCCGn1
    SolutionIndex: 400
    SolutionNameMin: Cijk_Ailk_Bjlk_HSS_BH_Bias_SHB_HA_S_SAB_SCD_SAV_UserArgs_MT32x32x128_MI16x16x1_SN_LDSB0_AFC1_AFEM1_AFEM1_ASEM1_CLR1_CADS0_DTLA0_DTLB0_DTVA0_DTVB1_EPS1_FDSI0_GRPM1_GRVWA8_GRVWB8_GSU1_GSUAMB_GSUC0_GSUWGMRR0_GLS0_ISA1200_IU1_K1_LBSPPA512_LBSPPB0_LBSPPM0_LPA16_LPB0_LPM0_LRVW8_LWPMn1_MIAV1_MIWT1_1_MO40_NTn1_NTA0_NTB0_NTC0_NTD0_NTM0_NEPBS0_NLCA1_NLCB1_ONLL0_PGR1_PLR1_PKA0_SIA3_SS0_SU32_SUM0_SUS256_SPO0_SRVW0_SSO0_SVW8_SK0_SKXCCM0_TLDS0_ULSGRO0_USL1_UIOFGRO0_USFGROn1_VSn1_VWA1_VWB1_WSGRA0_WSGRB0_WS32_WG32_4_1_WGM8_WGMXCC1_WGMXCCGn1
    SolutionIndex: 402
    SolutionNameMin: Cijk_Ailk_Bjlk_HSS_BH_Bias_SHB_HA_S_SAB_SCD_SAV_UserArgs_MT64x64x64_MI16x16x1_SN_LDSB0_AFC1_AFEM1_AFEM1_ASEM1_CLR1_CADS0_DTLA0_DTLB0_DTVA0_DTVB1_EPS1_FDSI0_GRPM1_GRVWA8_GRVWB8_GSU1_GSUAMB_GSUC0_GSUWGMRR0_GLS0_ISA1200_IU1_K1_LBSPPA1024_LBSPPB0_LBSPPM0_LPA32_LPB0_LPM0_LRVW8_LWPMn1_MIAV1_MIWT2_2_MO40_NTn1_NTA0_NTB0_NTC0_NTD0_NTM0_NEPBS0_NLCA1_NLCB4_ONLL0_PGR1_PLR1_PKA0_SIA3_SS0_SU32_SUM0_SUS256_SPO0_SRVW0_SSO0_SVW8_SK0_SKXCCM0_TLDS0_ULSGRO0_USL1_UIOFGRO0_USFGROn1_VSn1_VWA2_VWB1_WSGRA0_WSGRB0_WS32_WG32_4_1_WGM8_WGMXCC1_WGMXCCGn1
    SolutionIndex: 404
    SolutionNameMin: Cijk_Ailk_Bjlk_HSS_BH_Bias_SHB_HA_S_SAB_SCD_SAV_UserArgs_MT32x32x64_MI16x16x1_SN_LDSB0_AFC1_AFEM1_AFEM1_ASEM1_CLR1_CADS0_DTLA0_DTLB0_DTVA0_DTVB1_EPS0_FDSI0_GRPM1_GRVWA4_GRVWB8_GSU1_GSUAMB_GSUC0_GSUWGMRR0_GLS0_ISA1200_IU1_K1_LBSPPA512_LBSPPB0_LBSPPM0_LPA16_LPB0_LPM0_LRVW8_LWPMn1_MIAV1_MIWT1_1_MO40_NTn1_NTA0_NTB0_NTC0_NTD0_NTM0_NEPBS0_NLCA1_NLCB1_ONLL0_PGR2_PLR1_PKA0_SIA3_SS1_SU32_SUM0_SUS256_SPO0_SRVW0_SSO0_SVW1_SK0_SKXCCM0_TLDS0_ULSGRO0_USL1_UIOFGRO0_USFGROn1_VSn1_VWA1_VWB1_WSGRA0_WSGRB0_WS32_WG32_4_1_WGM8_WGMXCC1_WGMXCCGn1
    SolutionIndex: 407
    SolutionNameMin: Cijk_Ailk_Bjlk_HSS_BH_Bias_SHB_HA_S_SAB_SCD_SAV_UserArgs_MT128x32x32_MI16x16x1_SN_LDSB0_AFC1_AFEM1_AFEM1_ASEM1_CLR1_CADS0_DTLA0_DTLB0_DTVA1_DTVB0_EPS0_FDSI0_GRPM1_GRVWA8_GRVWB4_GSU1_GSUAMB_GSUC0_GSUWGMRR0_GLS0_ISA1200_IU1_K1_LBSPPA0_LBSPPB512_LBSPPM0_LPA0_LPB16_LPM0_LRVW8_LWPMn1_MIAV1_MIWT4_1_MO40_NTn1_NTA0_NTB0_NTC0_NTD0_NTM0_NEPBS0_NLCA2_NLCB1_ONLL0_PGR2_PLR1_PKA0_SIA3_SS0_SU32_SUM0_SUS256_SPO0_SRVW0_SSO0_SVW8_SK0_SKXCCM0_TLDS0_ULSGRO0_USL1_UIOFGRO0_USFGROn1_VSn1_VWA1_VWB1_WSGRA0_WSGRB0_WS32_WG32_4_1_WGM8_WGMXCC1_WGMXCCGn1
    SolutionIndex: 408
    SolutionNameMin: Cijk_Ailk_Bjlk_HSS_BH_Bias_SHB_HA_S_SAB_SCD_SAV_UserArgs_MT32x16x128_MI16x16x1_SN_LDSB0_AFC1_AFEM1_AFEM1_ASEM1_CLR1_CADS0_DTLA0_DTLB0_DTVA1_DTVB0_EPS0_FDSI0_GRPM1_GRVWA8_GRVWB8_GSU1_GSUAMB_GSUC0_GSUWGMRR0_GLS0_ISA1200_IU1_K1_LBSPPA0_LBSPPB256_LBSPPM0_LPA0_LPB16_LPM0_LRVW8_LWPMn1_MIAV1_MIWT1_1_MO40_NTn1_NTA0_NTB0_NTC0_NTD0_NTM0_NEPBS0_NLCA1_NLCB1_ONLL0_PGR2_PLR1_PKA0_SIA3_SS0_SU32_SUM0_SUS256_SPO0_SRVW0_SSO0_SVW8_SK0_SKXCCM0_TLDS0_ULSGRO0_USL1_UIOFGRO0_USFGROn1_VSn1_VWA1_VWB1_WSGRA0_WSGRB0_WS32_WG32_2_1_WGM8_WGMXCC1_WGMXCCGn1
    SolutionIndex: 411
    SolutionNameMin: Cijk_Ailk_Bjlk_HSS_BH_Bias_SHB_HA_S_SAB_SCD_SAV_UserArgs_MT64x64x32_MI16x16x1_SN_LDSB0_AFC1_AFEM1_AFEM1_ASEM1_CLR1_CADS0_DTLA0_DTLB0_DTVA1_DTVB0_EPS1_FDSI0_GRPM1_GRVWA8_GRVWB8_GSU1_GSUAMB_GSUC0_GSUWGMRR0_GLS0_ISA1200_IU1_K1_LBSPPA0_LBSPPB1024_LBSPPM0_LPA0_LPB32_LPM0_LRVW8_LWPMn1_MIAV1_MIWT2_2_MO40_NTn1_NTA0_NTB0_NTC0_NTD0_NTM0_NEPBS0_NLCA2_NLCB1_ONLL0_PGR1_PLR1_PKA0_SIA3_SS0_SU32_SUM0_SUS256_SPO0_SRVW0_SSO0_SVW8_SK0_SKXCCM0_TLDS0_ULSGRO0_USL1_UIOFGRO0_USFGROn1_VSn1_VWA1_VWB2_WSGRA0_WSGRB0_WS32_WG32_4_1_WGM8_WGMXCC1_WGMXCCGn1
    SolutionIndex: 419
    SolutionNameMin: Cijk_Ailk_Bjlk_HSS_BH_Bias_SHB_HA_S_SAB_SCD_SAV_UserArgs_MT64x64x64_MI16x16x1_SN_LDSB0_AFC1_AFEM1_AFEM1_ASEM1_CLR1_CADS0_DTLA0_DTLB0_DTVA1_DTVB0_EPS0_FDSI0_GRPM1_GRVWA8_GRVWB8_GSU1_GSUAMB_GSUC0_GSUWGMRR0_GLS0_ISA1200_IU1_K1_LBSPPA0_LBSPPB1024_LBSPPM0_LPA0_LPB32_LPM0_LRVW8_LWPMn1_MIAV1_MIWT2_2_MO40_NTn1_NTA0_NTB0_NTC0_NTD0_NTM0_NEPBS0_NLCA4_NLCB1_ONLL0_PGR2_PLR1_PKA0_SIA3_SS1_SU32_SUM0_SUS256_SPO0_SRVW0_SSO0_SVW1_SK0_SKXCCM0_TLDS0_ULSGRO0_USL1_UIOFGRO0_USFGROn1_VSn1_VWA1_VWB2_WSGRA0_WSGRB0_WS32_WG32_4_1_WGM8_WGMXCC1_WGMXCCGn1
    SolutionIndex: 420
    SolutionNameMin: Cijk_Ailk_Bjlk_HSS_BH_Bias_SHB_HA_S_SAB_SCD_SAV_UserArgs_MT64x64x32_MI16x16x1_SN_LDSB0_AFC1_AFEM1_AFEM1_ASEM1_CLR1_CADS0_DTLA0_DTLB0_DTVA1_DTVB0_EPS0_FDSI0_GRPM1_GRVWA8_GRVWB8_GSU1_GSUAMB_GSUC0_GSUWGMRR0_GLS0_ISA1200_IU1_K1_LBSPPA0_LBSPPB1024_LBSPPM0_LPA0_LPB32_LPM0_LRVW8_LWPMn1_MIAV1_MIWT2_2_MO40_NTn1_NTA0_NTB0_NTC0_NTD0_NTM0_NEPBS0_NLCA2_NLCB1_ONLL0_PGR2_PLR1_PKA0_SIA3_SS1_SU32_SUM0_SUS256_SPO0_SRVW0_SSO0_SVW1_SK0_SKXCCM0_TLDS0_ULSGRO0_USL1_UIOFGRO0_USFGROn1_VSn1_VWA1_VWB2_WSGRA0_WSGRB0_WS32_WG32_4_1_WGM8_WGMXCC1_WGMXCCGn1
    SolutionIndex: 425
    SolutionNameMin: Cijk_Ailk_Bjlk_HSS_BH_Bias_SHB_HA_S_SAB_SCD_SAV_UserArgs_MT32x128x32_MI16x16x1_SN_LDSB0_AFC1_AFEM1_AFEM1_ASEM1_CLR1_CADS0_DTLA0_DTLB0_DTVA0_DTVB0_EPS0_FDSI0_GRPM1_GRVWA8_GRVWB1_GSU1_GSUAMB_GSUC0_GSUWGMRR0_GLS0_ISA1200_IU1_K1_LBSPPA512_LBSPPB2048_LBSPPM0_LPA16_LPB0_LPM0_LRVW8_LWPMn1_MIAV1_MIWT1_4_MO40_NTn1_NTA0_NTB0_NTC0_NTD0_NTM0_NEPBS0_NLCA1_NLCB1_ONLL0_PGR2_PLR1_PKA0_SIA3_SS0_SU32_SUM0_SUS256_SPO0_SRVW0_SSO0_SVW8_SK0_SKXCCM0_TLDS0_ULSGRO1_USL1_UIOFGRO0_USFGROn1_VSn1_VWA1_VWB4_WSGRA0_WSGRB0_WS32_WG32_4_1_WGM8_WGMXCC1_WGMXCCGn1
    SolutionIndex: 426
    SolutionNameMin: Cijk_Ailk_Bjlk_HSS_BH_Bias_SHB_HA_S_SAB_SCD_SAV_UserArgs_MT64x64x64_MI16x16x1_SN_LDSB0_AFC1_AFEM1_AFEM1_ASEM1_CLR1_CADS0_DTLA0_DTLB0_DTVA1_DTVB1_EPS0_FDSI0_GRPM1_GRVWA8_GRVWB8_GSU1_GSUAMB_GSUC0_GSUWGMRR0_GLS0_ISA1200_IU1_K1_LBSPPA0_LBSPPB0_LBSPPM0_LPA0_LPB0_LPM0_LRVW8_LWPMn1_MIAV1_MIWT2_2_MO40_NTn1_NTA0_NTB0_NTC0_NTD0_NTM0_NEPBS0_NLCA4_NLCB4_ONLL0_PGR1_PLR0_PKA0_SIA3_SS1_SU32_SUM0_SUS256_SPO0_SRVW0_SSO0_SVW1_SK0_SKXCCM0_TLDS0_ULSGRO0_USL1_UIOFGRO0_USFGROn1_VSn1_VWA1_VWB1_WSGRA0_WSGRB0_WS32_WG32_4_1_WGM8_WGMXCC1_WGMXCCGn1
    SolutionIndex: 427
    SolutionNameMin: Cijk_Ailk_Bjlk_HSS_BH_Bias_SHB_HA_S_SAB_SCD_SAV_UserArgs_MT128x128x16_MI16x16x1_SN_LDSB0_AFC1_AFEM1_AFEM1_ASEM1_CLR0_CADS0_DTLA0_DTLB0_DTVA0_DTVB0_EPS0_FDSI0_GRPM1_GRVWA8_GRVWB8_GSU1_GSUAMB_GSUC0_GSUWGMRR0_GLS0_ISA1200_IU1_K1_LBSPPA2048_LBSPPB2048_LBSPPM0_LPA0_LPB0_LPM0_LRVW8_LWPMn1_MIAV1_MIWT4_4_MO40_NTn1_NTA0_NTB0_NTC0_NTD0_NTM0_NEPBS0_NLCA1_NLCB1_ONLL0_PGR2_PLR0_PKA0_SIA3_SS1_SU32_SUM0_SUS256_SPO0_SRVW0_SSO0_SVW4_SK0_SKXCCM0_TLDS0_ULSGRO0_USL1_UIOFGRO0_USFGROn1_VSn1_VWA4_VWB4_WSGRA0_WSGRB0_WS32_WG32_4_1_WGM8_WGMXCC1_WGMXCCGn1
    SolutionIndex: 428
    SolutionNameMin: Cijk_Ailk_Bjlk_HSS_BH_Bias_SHB_HA_S_SAB_SCD_SAV_UserArgs_MT64x64x32_MI16x16x1_SN_LDSB0_AFC1_AFEM1_AFEM1_ASEM1_CLR1_CADS0_DTLA0_DTLB0_DTVA0_DTVB1_EPS0_FDSI0_GRPM1_GRVWA4_GRVWB8_GSU1_GSUAMB_GSUC0_GSUWGMRR0_GLS0_ISA1200_IU1_K1_LBSPPA1024_LBSPPB0_LBSPPM0_LPA32_LPB0_LPM0_LRVW8_LWPMn1_MIAV1_MIWT2_2_MO40_NTn1_NTA0_NTB0_NTC0_NTD0_NTM0_NEPBS0_NLCA1_NLCB2_ONLL0_PGR2_PLR1_PKA0_SIA3_SS0_SU32_SUM0_SUS256_SPO0_SRVW0_SSO0_SVW8_SK0_SKXCCM0_TLDS0_ULSGRO0_USL1_UIOFGRO0_USFGROn1_VSn1_VWA2_VWB1_WSGRA0_WSGRB0_WS32_WG32_4_1_WGM8_WGMXCC1_WGMXCCGn1
    SolutionIndex: 429
    SolutionNameMin: Cijk_Ailk_Bjlk_HSS_BH_Bias_SHB_HA_S_SAB_SCD_SAV_UserArgs_MT128x128x16_MI16x16x1_SN_LDSB1_AFC1_AFEM1_AFEM1_ASEM1_CLR1_CADS0_DTLA0_DTLB0_DTVA0_DTVB0_EPS1_FDSI0_GRPM1_GRVWA4_GRVWB1_GSU1_GSUAMB_GSUC0_GSUWGMRR0_GLS0_ISA1200_IU1_K1_LBSPPA2048_LBSPPB2048_LBSPPM0_LPA0_LPB0_LPM0_LRVW8_LWPMn1_MIAV1_MIWT4_4_MO40_NTn1_NTA0_NTB0_NTC0_NTD0_NTM0_NEPBS0_NLCA1_NLCB1_ONLL0_PGR1_PLR1_PKA0_SIA2_SS1_SU32_SUM0_SUS256_SPO0_SRVW0_SSO0_SVW4_SK0_SKXCCM0_TLDS0_ULSGRO0_USL1_UIOFGRO0_USFGROn1_VSn1_VWA4_VWB4_WSGRA0_WSGRB0_WS32_WG32_4_1_WGM8_WGMXCC1_WGMXCCGn1
    SolutionIndex: 430
    SolutionNameMin: Cijk_Ailk_Bjlk_HSS_BH_Bias_SHB_HA_S_SAB_SCD_SAV_UserArgs_MT64x64x16_MI16x16x1_SN_LDSB1_AFC1_AFEM1_AFEM1_ASEM1_CLR1_CADS0_DTLA0_DTLB0_DTVA0_DTVB0_EPS0_FDSI0_GRPM1_GRVWA8_GRVWB4_GSU1_GSUAMB_GSUC0_GSUWGMRR0_GLS0_ISA1200_IU1_K1_LBSPPA1024_LBSPPB1024_LBSPPM0_LPA32_LPB32_LPM0_LRVW8_LWPMn1_MIAV1_MIWT2_2_MO40_NTn1_NTA0_NTB0_NTC0_NTD0_NTM0_NEPBS0_NLCA1_NLCB1_ONLL0_PGR2_PLR1_PKA0_SIA2_SS1_SU32_SUM0_SUS256_SPO0_SRVW0_SSO0_SVW2_SK0_SKXCCM0_TLDS0_ULSGRO1_USL1_UIOFGRO0_USFGROn1_VSn1_VWA2_VWB2_WSGRA0_WSGRB0_WS32_WG32_4_1_WGM8_WGMXCC1_WGMXCCGn1
    SolutionIndex: 431
    SolutionNameMin: Cijk_Ailk_Bjlk_HSS_BH_Bias_SHB_HA_S_SAB_SCD_SAV_UserArgs_MT64x64x32_MI16x16x1_SN_LDSB0_AFC1_AFEM1_AFEM1_ASEM1_CLR1_CADS0_DTLA0_DTLB0_DTVA0_DTVB1_EPS1_FDSI0_GRPM1_GRVWA1_GRVWB8_GSU1_GSUAMB_GSUC0_GSUWGMRR0_GLS0_ISA1200_IU1_K1_LBSPPA1024_LBSPPB0_LBSPPM0_LPA32_LPB0_LPM0_LRVW8_LWPMn1_MIAV1_MIWT2_2_MO40_NTn1_NTA0_NTB0_NTC0_NTD0_NTM0_NEPBS0_NLCA1_NLCB2_ONLL0_PGR1_PLR1_PKA0_SIA3_SS1_SU32_SUM0_SUS256_SPO0_SRVW0_SSO0_SVW2_SK0_SKXCCM0_TLDS0_ULSGRO0_USL1_UIOFGRO0_USFGROn1_VSn1_VWA2_VWB1_WSGRA0_WSGRB0_WS32_WG32_4_1_WGM8_WGMXCC1_WGMXCCGn1
    SolutionIndex: 432
    SolutionNameMin: Cijk_Ailk_Bjlk_HSS_BH_Bias_SHB_HA_S_SAB_SCD_SAV_UserArgs_MT128x64x32_MI16x16x1_SN_LDSB0_AFC1_AFEM1_AFEM1_ASEM1_CLR1_CADS0_DTLA0_DTLB0_DTVA1_DTVB0_EPS0_FDSI0_GRPM1_GRVWA8_GRVWB8_GSU1_GSUAMB_GSUC0_GSUWGMRR0_GLS0_ISA1200_IU1_K1_LBSPPA0_LBSPPB1024_LBSPPM0_LPA0_LPB16_LPM0_LRVW8_LWPMn1_MIAV1_MIWT8_1_MO40_NTn1_NTA0_NTB0_NTC0_NTD0_NTM0_NEPBS0_NLCA2_NLCB1_ONLL0_PGR2_PLR1_PKA0_SIA3_SS1_SU32_SUM0_SUS256_SPO0_SRVW0_SSO0_SVW1_SK0_SKXCCM0_TLDS0_ULSGRO0_USL1_UIOFGRO0_USFGROn1_VSn1_VWA1_VWB1_WSGRA0_WSGRB0_WS32_WG16_8_1_WGM8_WGMXCC1_WGMXCCGn1
    SolutionIndex: 434
    SolutionNameMin: Cijk_Ailk_Bjlk_HSS_BH_Bias_SHB_HA_S_SAB_SCD_SAV_UserArgs_MT128x64x32_MI16x16x1_SN_LDSB0_AFC1_AFEM1_AFEM1_ASEM1_CLR1_CADS0_DTLA0_DTLB0_DTVA1_DTVB0_EPS0_FDSI0_GRPM1_GRVWA8_GRVWB4_GSU1_GSUAMB_GSUC0_GSUWGMRR0_GLS0_ISA1200_IU1_K1_LBSPPA0_LBSPPB1024_LBSPPM0_LPA0_LPB16_LPM0_LRVW8_LWPMn1_MIAV1_MIWT8_1_MO40_NTn1_NTA0_NTB0_NTC0_NTD0_NTM0_NEPBS0_NLCA2_NLCB1_ONLL0_PGR2_PLR1_PKA0_SIA3_SS1_SU32_SUM0_SUS256_SPO0_SRVW0_SSO0_SVW1_SK0_SKXCCM0_TLDS0_ULSGRO0_USL1_UIOFGRO0_USFGROn1_VSn1_VWA1_VWB1_WSGRA0_WSGRB0_WS32_WG16_8_1_WGM8_WGMXCC1_WGMXCCGn1
    SolutionIndex: 435
    SolutionNameMin: Cijk_Ailk_Bjlk_HSS_BH_Bias_SHB_HA_S_SAB_SCD_SAV_UserArgs_MT32x128x64_MI16x16x1_SN_LDSB0_AFC1_AFEM1_AFEM1_ASEM1_CLR1_CADS0_DTLA0_DTLB0_DTVA1_DTVB0_EPS1_FDSI0_GRPM1_GRVWA8_GRVWB8_GSU1_GSUAMB_GSUC0_GSUWGMRR0_GLS0_ISA1200_IU1_K1_LBSPPA0_LBSPPB2048_LBSPPM0_LPA0_LPB0_LPM0_LRVW8_LWPMn1_MIAV1_MIWT1_4_MO40_NTn1_NTA0_NTB0_NTC0_NTD0_NTM0_NEPBS0_NLCA1_NLCB1_ONLL0_PGR1_PLR1_PKA0_SIA3_SS1_SU32_SUM0_SUS256_SPO0_SRVW0_SSO0_SVW1_SK0_SKXCCM0_TLDS0_ULSGRO0_USL1_UIOFGRO0_USFGROn1_VSn1_VWA1_VWB4_WSGRA0_WSGRB0_WS32_WG32_4_1_WGM8_WGMXCC1_WGMXCCGn1
    SolutionIndex: 436
    SolutionNameMin: Cijk_Ailk_Bjlk_HSS_BH_Bias_SHB_HA_S_SAB_SCD_SAV_UserArgs_MT32x32x128_MI16x16x1_SN_LDSB0_AFC1_AFEM1_AFEM1_ASEM1_CLR1_CADS0_DTLA0_DTLB0_DTVA0_DTVB1_EPS0_FDSI0_GRPM1_GRVWA8_GRVWB8_GSU1_GSUAMB_GSUC0_GSUWGMRR0_GLS0_ISA1200_IU1_K1_LBSPPA512_LBSPPB0_LBSPPM0_LPA16_LPB0_LPM0_LRVW8_LWPMn1_MIAV1_MIWT1_1_MO40_NTn1_NTA0_NTB0_NTC0_NTD0_NTM0_NEPBS0_NLCA1_NLCB1_ONLL0_PGR2_PLR1_PKA0_SIA3_SS0_SU32_SUM0_SUS256_SPO0_SRVW0_SSO0_SVW8_SK0_SKXCCM0_TLDS0_ULSGRO0_USL1_UIOFGRO0_USFGROn1_VSn1_VWA1_VWB1_WSGRA0_WSGRB0_WS32_WG32_4_1_WGM8_WGMXCC1_WGMXCCGn1
    SolutionIndex: 437
    SolutionNameMin: Cijk_Ailk_Bjlk_HSS_BH_Bias_SHB_HA_S_SAB_SCD_SAV_UserArgs_MT32x32x128_MI16x16x1_SN_LDSB0_AFC1_AFEM1_AFEM1_ASEM1_CLR1_CADS0_DTLA0_DTLB0_DTVA1_DTVB0_EPS0_FDSI0_GRPM1_GRVWA8_GRVWB4_GSU1_GSUAMB_GSUC0_GSUWGMRR0_GLS0_ISA1200_IU1_K1_LBSPPA0_LBSPPB512_LBSPPM0_LPA0_LPB16_LPM0_LRVW8_LWPMn1_MIAV1_MIWT1_1_MO40_NTn1_NTA0_NTB0_NTC0_NTD0_NTM0_NEPBS0_NLCA1_NLCB1_ONLL0_PGR2_PLR1_PKA0_SIA3_SS0_SU32_SUM0_SUS256_SPO0_SRVW0_SSO0_SVW8_SK0_SKXCCM0_TLDS0_ULSGRO0_USL1_UIOFGRO0_USFGROn1_VSn1_VWA1_VWB1_WSGRA0_WSGRB0_WS32_WG32_4_1_WGM8_WGMXCC1_WGMXCCGn1
    SolutionIndex: 438
    SolutionNameMin: Cijk_Ailk_Bjlk_HSS_BH_Bias_SHB_HA_S_SAB_SCD_SAV_UserArgs_MT32x16x64_MI16x16x1_SN_LDSB0_AFC1_AFEM1_AFEM1_ASEM1_CLR1_CADS0_DTLA0_DTLB0_DTVA1_DTVB0_EPS0_FDSI0_GRPM1_GRVWA8_GRVWB4_GSU1_GSUAMB_GSUC0_GSUWGMRR0_GLS0_ISA1200_IU1_K1_LBSPPA0_LBSPPB256_LBSPPM0_LPA0_LPB16_LPM0_LRVW8_LWPMn1_MIAV1_MIWT1_1_MO40_NTn1_NTA0_NTB0_NTC0_NTD0_NTM0_NEPBS0_NLCA1_NLCB1_ONLL0_PGR2_PLR1_PKA0_SIA3_SS1_SU32_SUM0_SUS256_SPO0_SRVW0_SSO0_SVW1_SK0_SKXCCM0_TLDS0_ULSGRO0_USL1_UIOFGRO0_USFGROn1_VSn1_VWA1_VWB1_WSGRA0_WSGRB0_WS32_WG32_2_1_WGM8_WGMXCC1_WGMXCCGn1
    SolutionIndex: 439
    SolutionNameMin: Cijk_Ailk_Bjlk_HSS_BH_Bias_SHB_HA_S_SAB_SCD_SAV_UserArgs_MT32x32x128_MI16x16x1_SN_LDSB0_AFC1_AFEM1_AFEM1_ASEM1_CLR1_CADS0_DTLA0_DTLB0_DTVA0_DTVB1_EPS1_FDSI0_GRPM1_GRVWA8_GRVWB8_GSU1_GSUAMB_GSUC0_GSUWGMRR0_GLS0_ISA1200_IU1_K1_LBSPPA512_LBSPPB0_LBSPPM0_LPA16_LPB0_LPM0_LRVW8_LWPMn1_MIAV1_MIWT1_1_MO40_NTn1_NTA0_NTB0_NTC0_NTD0_NTM0_NEPBS0_NLCA1_NLCB1_ONLL0_PGR1_PLR1_PKA0_SIA3_SS1_SU32_SUM0_SUS256_SPO0_SRVW0_SSO0_SVW1_SK0_SKXCCM0_TLDS0_ULSGRO0_USL1_UIOFGRO0_USFGROn1_VSn1_VWA1_VWB1_WSGRA0_WSGRB0_WS32_WG32_4_1_WGM8_WGMXCC1_WGMXCCGn1
    SolutionIndex: 441
    SolutionNameMin: Cijk_Ailk_Bjlk_HSS_BH_Bias_SHB_HA_S_SAB_SCD_SAV_UserArgs_MT32x128x64_MI16x16x1_SN_LDSB0_AFC1_AFEM1_AFEM1_ASEM1_CLR1_CADS0_DTLA0_DTLB0_DTVA0_DTVB1_EPS0_FDSI0_GRPM1_GRVWA8_GRVWB8_GSU1_GSUAMB_GSUC0_GSUWGMRR0_GLS0_ISA1200_IU1_K1_LBSPPA512_LBSPPB0_LBSPPM0_LPA16_LPB0_LPM0_LRVW8_LWPMn1_MIAV1_MIWT1_4_MO40_NTn1_NTA0_NTB0_NTC0_NTD0_NTM0_NEPBS0_NLCA1_NLCB4_ONLL0_PGR2_PLR1_PKA0_SIA3_SS0_SU32_SUM0_SUS256_SPO0_SRVW0_SSO0_SVW8_SK0_SKXCCM0_TLDS0_ULSGRO0_USL1_UIOFGRO0_USFGROn1_VSn1_VWA1_VWB1_WSGRA0_WSGRB0_WS32_WG32_4_1_WGM8_WGMXCC1_WGMXCCGn1
    SolutionIndex: 442
    SolutionNameMin: Cijk_Ailk_Bjlk_HSS_BH_Bias_SHB_HA_S_SAB_SCD_SAV_UserArgs_MT64x64x64_MI16x16x1_SN_LDSB0_AFC1_AFEM1_AFEM1_ASEM1_CLR1_CADS0_DTLA0_DTLB0_DTVA0_DTVB1_EPS0_FDSI0_GRPM1_GRVWA4_GRVWB8_GSU1_GSUAMB_GSUC0_GSUWGMRR0_GLS0_ISA1200_IU1_K1_LBSPPA1024_LBSPPB0_LBSPPM0_LPA32_LPB0_LPM0_LRVW8_LWPMn1_MIAV1_MIWT2_2_MO40_NTn1_NTA0_NTB0_NTC0_NTD0_NTM0_NEPBS0_NLCA1_NLCB4_ONLL0_PGR2_PLR1_PKA0_SIA3_SS0_SU32_SUM0_SUS256_SPO0_SRVW0_SSO0_SVW8_SK0_SKXCCM0_TLDS0_ULSGRO0_USL1_UIOFGRO0_USFGROn1_VSn1_VWA2_VWB1_WSGRA0_WSGRB0_WS32_WG32_4_1_WGM8_WGMXCC1_WGMXCCGn1
    SolutionIndex: 443
    SolutionNameMin: Cijk_Ailk_Bjlk_HSS_BH_Bias_SHB_HA_S_SAB_SCD_SAV_UserArgs_MT16x32x128_MI16x16x1_SN_LDSB0_AFC1_AFEM1_AFEM1_ASEM1_CLR1_CADS0_DTLA0_DTLB0_DTVA0_DTVB1_EPS1_FDSI0_GRPM1_GRVWA4_GRVWB8_GSU1_GSUAMB_GSUC0_GSUWGMRR0_GLS0_ISA1200_IU1_K1_LBSPPA256_LBSPPB0_LBSPPM0_LPA16_LPB0_LPM0_LRVW8_LWPMn1_MIAV1_MIWT1_1_MO40_NTn1_NTA0_NTB0_NTC0_NTD0_NTM0_NEPBS0_NLCA1_NLCB1_ONLL0_PGR1_PLR1_PKA0_SIA3_SS0_SU32_SUM0_SUS256_SPO0_SRVW0_SSO0_SVW8_SK0_SKXCCM0_TLDS0_ULSGRO0_USL1_UIOFGRO0_USFGROn1_VSn1_VWA1_VWB1_WSGRA0_WSGRB0_WS32_WG16_4_1_WGM8_WGMXCC1_WGMXCCGn1
    SolutionIndex: 447
    SolutionNameMin: Cijk_Ailk_Bjlk_HSS_BH_Bias_SHB_HA_S_SAB_SCD_SAV_UserArgs_MT64x64x32_MI16x16x1_SN_LDSB0_AFC1_AFEM1_AFEM1_ASEM1_CLR1_CADS0_DTLA0_DTLB0_DTVA1_DTVB0_EPS1_FDSI0_GRPM1_GRVWA8_GRVWB1_GSU1_GSUAMB_GSUC0_GSUWGMRR0_GLS0_ISA1200_IU1_K1_LBSPPA0_LBSPPB1024_LBSPPM0_LPA0_LPB32_LPM0_LRVW8_LWPMn1_MIAV1_MIWT2_2_MO40_NTn1_NTA0_NTB0_NTC0_NTD0_NTM0_NEPBS0_NLCA2_NLCB1_ONLL0_PGR1_PLR1_PKA0_SIA3_SS0_SU32_SUM0_SUS256_SPO0_SRVW0_SSO0_SVW8_SK0_SKXCCM0_TLDS0_ULSGRO0_USL1_UIOFGRO0_USFGROn1_VSn1_VWA1_VWB2_WSGRA0_WSGRB0_WS32_WG32_4_1_WGM8_WGMXCC1_WGMXCCGn1
    SolutionIndex: 448
    SolutionNameMin: Cijk_Ailk_Bjlk_HSS_BH_Bias_SHB_HA_S_SAB_SCD_SAV_UserArgs_MT64x64x64_MI16x16x1_SN_LDSB0_AFC1_AFEM1_AFEM1_ASEM1_CLR1_CADS0_DTLA0_DTLB0_DTVA1_DTVB0_EPS1_FDSI0_GRPM1_GRVWA8_GRVWB8_GSU1_GSUAMB_GSUC0_GSUWGMRR0_GLS0_ISA1200_IU1_K1_LBSPPA0_LBSPPB1024_LBSPPM0_LPA0_LPB32_LPM0_LRVW8_LWPMn1_MIAV1_MIWT2_2_MO40_NTn1_NTA0_NTB0_NTC0_NTD0_NTM0_NEPBS0_NLCA4_NLCB1_ONLL0_PGR1_PLR1_PKA0_SIA3_SS1_SU32_SUM0_SUS256_SPO0_SRVW0_SSO0_SVW1_SK0_SKXCCM0_TLDS0_ULSGRO0_USL1_UIOFGRO0_USFGROn1_VSn1_VWA1_VWB2_WSGRA0_WSGRB0_WS32_WG32_4_1_WGM8_WGMXCC1_WGMXCCGn1
    SolutionIndex: 449
    SolutionNameMin: Cijk_Ailk_Bjlk_HSS_BH_Bias_SHB_HA_S_SAB_SCD_SAV_UserArgs_MT64x64x32_MI16x16x1_SN_LDSB0_AFC1_AFEM1_AFEM1_ASEM1_CLR1_CADS0_DTLA0_DTLB0_DTVA1_DTVB0_EPS1_FDSI0_GRPM1_GRVWA8_GRVWB8_GSU1_GSUAMB_GSUC0_GSUWGMRR0_GLS0_ISA1200_IU1_K1_LBSPPA0_LBSPPB1024_LBSPPM0_LPA0_LPB32_LPM0_LRVW8_LWPMn1_MIAV1_MIWT2_2_MO40_NTn1_NTA0_NTB0_NTC0_NTD0_NTM0_NEPBS0_NLCA2_NLCB1_ONLL0_PGR1_PLR1_PKA0_SIA3_SS1_SU32_SUM0_SUS256_SPO0_SRVW0_SSO0_SVW1_SK0_SKXCCM0_TLDS0_ULSGRO0_USL1_UIOFGRO0_USFGROn1_VSn1_VWA1_VWB2_WSGRA0_WSGRB0_WS32_WG32_4_1_WGM8_WGMXCC1_WGMXCCGn1
    SolutionIndex: 450
    SolutionNameMin: Cijk_Ailk_Bjlk_HSS_BH_Bias_SHB_HA_S_SAB_SCD_SAV_UserArgs_MT64x64x32_MI16x16x1_SN_LDSB0_AFC1_AFEM1_AFEM1_ASEM1_CLR1_CADS0_DTLA0_DTLB0_DTVA0_DTVB1_EPS0_FDSI0_GRPM1_GRVWA8_GRVWB8_GSU1_GSUAMB_GSUC0_GSUWGMRR0_GLS0_ISA1200_IU1_K1_LBSPPA1024_LBSPPB0_LBSPPM0_LPA32_LPB0_LPM0_LRVW8_LWPMn1_MIAV1_MIWT2_2_MO40_NTn1_NTA0_NTB0_NTC0_NTD0_NTM0_NEPBS0_NLCA1_NLCB2_ONLL0_PGR2_PLR1_PKA0_SIA3_SS0_SU32_SUM0_SUS256_SPO0_SRVW0_SSO0_SVW8_SK0_SKXCCM0_TLDS0_ULSGRO0_USL1_UIOFGRO0_USFGROn1_VSn1_VWA2_VWB1_WSGRA0_WSGRB0_WS32_WG32_4_1_WGM8_WGMXCC1_WGMXCCGn1
    SolutionIndex: 452
    SolutionNameMin: Cijk_Ailk_Bjlk_HSS_BH_Bias_SHB_HA_S_SAB_SCD_SAV_UserArgs_MT128x128x16_MI16x16x1_SN_LDSB0_AFC1_AFEM1_AFEM1_ASEM1_CLR1_CADS0_DTLA0_DTLB0_DTVA1_DTVB1_EPS0_FDSI0_GRPM1_GRVWA8_GRVWB8_GSU1_GSUAMB_GSUC0_GSUWGMRR0_GLS0_ISA1200_IU1_K1_LBSPPA0_LBSPPB0_LBSPPM0_LPA0_LPB0_LPM0_LRVW8_LWPMn1_MIAV1_MIWT8_2_MO40_NTn1_NTA0_NTB0_NTC0_NTD0_NTM0_NEPBS0_NLCA1_NLCB1_ONLL0_PGR1_PLR0_PKA0_SIA3_SS0_SU32_SUM0_SUS256_SPO0_SRVW0_SSO0_SVW8_SK0_SKXCCM0_TLDS0_ULSGRO0_USL1_UIOFGRO0_USFGROn1_VSn1_VWA1_VWB1_WSGRA0_WSGRB0_WS32_WG16_8_1_WGM8_WGMXCC1_WGMXCCGn1
    SolutionIndex: 453
    SolutionNameMin: Cijk_Ailk_Bjlk_HSS_BH_Bias_SHB_HA_S_SAB_SCD_SAV_UserArgs_MT64x64x64_MI16x16x1_SN_LDSB0_AFC1_AFEM1_AFEM1_ASEM1_CLR1_CADS0_DTLA0_DTLB0_DTVA1_DTVB0_EPS0_FDSI0_GRPM1_GRVWA8_GRVWB4_GSU1_GSUAMB_GSUC0_GSUWGMRR0_GLS0_ISA1200_IU1_K1_LBSPPA0_LBSPPB1024_LBSPPM0_LPA0_LPB32_LPM0_LRVW8_LWPMn1_MIAV1_MIWT2_2_MO40_NTn1_NTA0_NTB0_NTC0_NTD0_NTM0_NEPBS0_NLCA4_NLCB1_ONLL0_PGR2_PLR1_PKA0_SIA3_SS1_SU32_SUM0_SUS256_SPO0_SRVW0_SSO0_SVW1_SK0_SKXCCM0_TLDS0_ULSGRO0_USL1_UIOFGRO0_USFGROn1_VSn1_VWA1_VWB2_WSGRA0_WSGRB0_WS32_WG32_4_1_WGM8_WGMXCC1_WGMXCCGn1
    SolutionIndex: 455
    SolutionNameMin: Cijk_Ailk_Bjlk_HSS_BH_Bias_SHB_HA_S_SAB_SCD_SAV_UserArgs_MT64x64x32_MI16x16x1_SN_LDSB0_AFC1_AFEM1_AFEM1_ASEM1_CLR1_CADS0_DTLA0_DTLB0_DTVA1_DTVB0_EPS0_FDSI0_GRPM1_GRVWA8_GRVWB4_GSU1_GSUAMB_GSUC0_GSUWGMRR0_GLS0_ISA1200_IU1_K1_LBSPPA0_LBSPPB1024_LBSPPM0_LPA0_LPB32_LPM0_LRVW8_LWPMn1_MIAV1_MIWT2_2_MO40_NTn1_NTA0_NTB0_NTC0_NTD0_NTM0_NEPBS0_NLCA2_NLCB1_ONLL0_PGR2_PLR1_PKA0_SIA3_SS1_SU32_SUM0_SUS256_SPO0_SRVW0_SSO0_SVW1_SK0_SKXCCM0_TLDS0_ULSGRO0_USL1_UIOFGRO0_USFGROn1_VSn1_VWA1_VWB2_WSGRA0_WSGRB0_WS32_WG32_4_1_WGM8_WGMXCC1_WGMXCCGn1
    SolutionIndex: 456
    SolutionNameMin: Cijk_Ailk_Bjlk_HSS_BH_Bias_SHB_HA_S_SAB_SCD_SAV_UserArgs_MT64x64x64_MI16x16x1_SN_LDSB0_AFC1_AFEM1_AFEM1_ASEM1_CLR1_CADS0_DTLA0_DTLB0_DTVA1_DTVB0_EPS1_FDSI0_GRPM1_GRVWA8_GRVWB4_GSU1_GSUAMB_GSUC0_GSUWGMRR0_GLS0_ISA1200_IU1_K1_LBSPPA0_LBSPPB1024_LBSPPM0_LPA0_LPB32_LPM0_LRVW8_LWPMn1_MIAV1_MIWT2_2_MO40_NTn1_NTA0_NTB0_NTC0_NTD0_NTM0_NEPBS0_NLCA4_NLCB1_ONLL0_PGR1_PLR1_PKA0_SIA3_SS1_SU32_SUM0_SUS256_SPO0_SRVW0_SSO0_SVW1_SK0_SKXCCM0_TLDS0_ULSGRO0_USL1_UIOFGRO0_USFGROn1_VSn1_VWA1_VWB2_WSGRA0_WSGRB0_WS32_WG32_4_1_WGM8_WGMXCC1_WGMXCCGn1
    SolutionIndex: 457
    SolutionNameMin: Cijk_Ailk_Bjlk_HSS_BH_Bias_SHB_HA_S_SAB_SCD_SAV_UserArgs_MT64x64x64_MI16x16x1_SN_LDSB0_AFC1_AFEM1_AFEM1_ASEM1_CLR1_CADS0_DTLA0_DTLB0_DTVA0_DTVB1_EPS1_FDSI0_GRPM1_GRVWA1_GRVWB8_GSU1_GSUAMB_GSUC0_GSUWGMRR0_GLS0_ISA1200_IU1_K1_LBSPPA1024_LBSPPB0_LBSPPM0_LPA32_LPB0_LPM0_LRVW8_LWPMn1_MIAV1_MIWT2_2_MO40_NTn1_NTA0_NTB0_NTC0_NTD0_NTM0_NEPBS0_NLCA1_NLCB4_ONLL0_PGR1_PLR1_PKA0_SIA3_SS1_SU32_SUM0_SUS256_SPO0_SRVW0_SSO0_SVW2_SK0_SKXCCM0_TLDS0_ULSGRO0_USL1_UIOFGRO0_USFGROn1_VSn1_VWA2_VWB1_WSGRA0_WSGRB0_WS32_WG32_4_1_WGM8_WGMXCC1_WGMXCCGn1
    SolutionIndex: 459
    SolutionNameMin: Cijk_Ailk_Bjlk_HSS_BH_Bias_SHB_HA_S_SAB_SCD_SAV_UserArgs_MT64x128x32_MI16x16x1_SN_LDSB0_AFC1_AFEM1_AFEM1_ASEM1_CLR1_CADS0_DTLA0_DTLB0_DTVA0_DTVB1_EPS1_FDSI0_GRPM1_GRVWA8_GRVWB8_GSU1_GSUAMB_GSUC0_GSUWGMRR0_GLS0_ISA1200_IU1_K1_LBSPPA1024_LBSPPB0_LBSPPM0_LPA16_LPB0_LPM0_LRVW8_LWPMn1_MIAV1_MIWT1_8_MO40_NTn1_NTA0_NTB0_NTC0_NTD0_NTM0_NEPBS0_NLCA1_NLCB2_ONLL0_PGR1_PLR1_PKA0_SIA3_SS1_SU32_SUM0_SUS256_SPO0_SRVW0_SSO0_SVW1_SK0_SKXCCM0_TLDS0_ULSGRO0_USL1_UIOFGRO0_USFGROn1_VSn1_VWA1_VWB1_WSGRA0_WSGRB0_WS32_WG64_2_1_WGM8_WGMXCC1_WGMXCCGn1
    SolutionIndex: 460
    SolutionNameMin: Cijk_Ailk_Bjlk_HSS_BH_Bias_SHB_HA_S_SAB_SCD_SAV_UserArgs_MT64x128x32_MI16x16x1_SN_LDSB0_AFC1_AFEM1_AFEM1_ASEM1_CLR1_CADS0_DTLA0_DTLB0_DTVA0_DTVB1_EPS1_FDSI0_GRPM1_GRVWA4_GRVWB8_GSU1_GSUAMB_GSUC0_GSUWGMRR0_GLS0_ISA1200_IU1_K1_LBSPPA1024_LBSPPB0_LBSPPM0_LPA16_LPB0_LPM0_LRVW8_LWPMn1_MIAV1_MIWT1_8_MO40_NTn1_NTA0_NTB0_NTC0_NTD0_NTM0_NEPBS0_NLCA1_NLCB2_ONLL0_PGR1_PLR1_PKA0_SIA3_SS1_SU32_SUM0_SUS256_SPO0_SRVW0_SSO0_SVW1_SK0_SKXCCM0_TLDS0_ULSGRO0_USL1_UIOFGRO0_USFGROn1_VSn1_VWA1_VWB1_WSGRA0_WSGRB0_WS32_WG64_2_1_WGM8_WGMXCC1_WGMXCCGn1
    SolutionIndex: 461
    SolutionNameMin: Cijk_Ailk_Bjlk_HSS_BH_Bias_SHB_HA_S_SAB_SCD_SAV_UserArgs_MT128x64x16_MI16x16x1_SN_LDSB0_AFC1_AFEM1_AFEM1_ASEM1_CLR1_CADS0_DTLA0_DTLB0_DTVA1_DTVB1_EPS0_FDSI0_GRPM1_GRVWA8_GRVWB8_GSU1_GSUAMB_GSUC0_GSUWGMRR0_GLS0_ISA1200_IU1_K1_LBSPPA0_LBSPPB0_LBSPPM0_LPA0_LPB0_LPM0_LRVW8_LWPMn1_MIAV1_MIWT8_1_MO40_NTn1_NTA0_NTB0_NTC0_NTD0_NTM0_NEPBS0_NLCA1_NLCB1_ONLL0_PGR1_PLR0_PKA0_SIA3_SS1_SU32_SUM0_SUS256_SPO0_SRVW0_SSO0_SVW1_SK0_SKXCCM0_TLDS0_ULSGRO0_USL1_UIOFGRO0_USFGROn1_VSn1_VWA1_VWB1_WSGRA0_WSGRB0_WS32_WG16_8_1_WGM8_WGMXCC1_WGMXCCGn1
    SolutionIndex: 465
    SolutionNameMin: Cijk_Ailk_Bjlk_HSS_BH_Bias_SHB_HA_S_SAB_SCD_SAV_UserArgs_MT64x64x32_MI16x16x1_SN_LDSB1_AFC1_AFEM1_AFEM1_ASEM1_CLR1_CADS0_DTLA0_DTLB0_DTVA0_DTVB0_EPS0_FDSI0_GRPM1_GRVWA4_GRVWB8_GSU1_GSUAMB_GSUC0_GSUWGMRR0_GLS0_ISA1200_IU2_K1_LBSPPA1024_LBSPPB1024_LBSPPM0_LPA32_LPB32_LPM0_LRVW8_LWPMn1_MIAV1_MIWT2_2_MO40_NTn1_NTA0_NTB0_NTC0_NTD0_NTM0_NEPBS0_NLCA1_NLCB1_ONLL0_PGR2_PLR1_PKA0_SIA2_SS1_SU32_SUM0_SUS256_SPO0_SRVW0_SSO0_SVW2_SK0_SKXCCM0_TLDS0_ULSGRO0_USL1_UIOFGRO0_USFGROn1_VSn1_VWA2_VWB2_WSGRA0_WSGRB0_WS32_WG32_4_1_WGM8_WGMXCC1_WGMXCCGn1
    SolutionIndex: 466
    SolutionNameMin: Cijk_Ailk_Bjlk_HSS_BH_Bias_SHB_HA_S_SAB_SCD_SAV_UserArgs_MT128x32x64_MI16x16x1_SN_LDSB0_AFC1_AFEM1_AFEM1_ASEM1_CLR1_CADS0_DTLA0_DTLB0_DTVA1_DTVB0_EPS0_FDSI0_GRPM1_GRVWA8_GRVWB8_GSU1_GSUAMB_GSUC0_GSUWGMRR0_GLS0_ISA1200_IU1_K1_LBSPPA0_LBSPPB512_LBSPPM0_LPA0_LPB16_LPM0_LRVW8_LWPMn1_MIAV1_MIWT4_1_MO40_NTn1_NTA0_NTB0_NTC0_NTD0_NTM0_NEPBS0_NLCA4_NLCB1_ONLL0_PGR2_PLR1_PKA0_SIA3_SS0_SU32_SUM0_SUS256_SPO0_SRVW0_SSO0_SVW8_SK0_SKXCCM0_TLDS0_ULSGRO0_USL1_UIOFGRO0_USFGROn1_VSn1_VWA1_VWB1_WSGRA0_WSGRB0_WS32_WG32_4_1_WGM8_WGMXCC1_WGMXCCGn1
    SolutionIndex: 470
    SolutionNameMin: Cijk_Ailk_Bjlk_HSS_BH_Bias_SHB_HA_S_SAB_SCD_SAV_UserArgs_MT64x64x64_MI16x16x1_SN_LDSB0_AFC1_AFEM1_AFEM1_ASEM1_CLR1_CADS0_DTLA0_DTLB0_DTVA1_DTVB0_EPS0_FDSI0_GRPM1_GRVWA8_GRVWB1_GSU1_GSUAMB_GSUC0_GSUWGMRR0_GLS0_ISA1200_IU1_K1_LBSPPA0_LBSPPB1024_LBSPPM0_LPA0_LPB32_LPM0_LRVW8_LWPMn1_MIAV1_MIWT2_2_MO40_NTn1_NTA0_NTB0_NTC0_NTD0_NTM0_NEPBS0_NLCA4_NLCB1_ONLL0_PGR2_PLR1_PKA0_SIA3_SS0_SU32_SUM0_SUS256_SPO0_SRVW0_SSO0_SVW8_SK0_SKXCCM0_TLDS0_ULSGRO0_USL1_UIOFGRO0_USFGROn1_VSn1_VWA1_VWB2_WSGRA0_WSGRB0_WS32_WG32_4_1_WGM8_WGMXCC1_WGMXCCGn1
    SolutionIndex: 471
    SolutionNameMin: Cijk_Ailk_Bjlk_HSS_BH_Bias_SHB_HA_S_SAB_SCD_SAV_UserArgs_MT64x128x32_MI16x16x1_SN_LDSB0_AFC1_AFEM1_AFEM1_ASEM1_CLR1_CADS0_DTLA0_DTLB0_DTVA0_DTVB1_EPS0_FDSI0_GRPM1_GRVWA4_GRVWB8_GSU1_GSUAMB_GSUC0_GSUWGMRR0_GLS0_ISA1200_IU1_K1_LBSPPA1024_LBSPPB0_LBSPPM0_LPA16_LPB0_LPM0_LRVW8_LWPMn1_MIAV1_MIWT1_8_MO40_NTn1_NTA0_NTB0_NTC0_NTD0_NTM0_NEPBS0_NLCA1_NLCB2_ONLL0_PGR2_PLR1_PKA0_SIA3_SS1_SU32_SUM0_SUS256_SPO0_SRVW0_SSO0_SVW1_SK0_SKXCCM0_TLDS0_ULSGRO0_USL1_UIOFGRO0_USFGROn1_VSn1_VWA1_VWB1_WSGRA0_WSGRB0_WS32_WG64_2_1_WGM8_WGMXCC1_WGMXCCGn1
    SolutionIndex: 473
    SolutionNameMin: Cijk_Ailk_Bjlk_HSS_BH_Bias_SHB_HA_S_SAB_SCD_SAV_UserArgs_MT64x64x32_MI16x16x1_SN_LDSB0_AFC1_AFEM1_AFEM1_ASEM1_CLR1_CADS0_DTLA0_DTLB0_DTVA1_DTVB0_EPS1_FDSI0_GRPM1_GRVWA8_GRVWB4_GSU1_GSUAMB_GSUC0_GSUWGMRR0_GLS0_ISA1200_IU1_K1_LBSPPA0_LBSPPB1024_LBSPPM0_LPA0_LPB32_LPM0_LRVW8_LWPMn1_MIAV1_MIWT2_2_MO40_NTn1_NTA0_NTB0_NTC0_NTD0_NTM0_NEPBS0_NLCA2_NLCB1_ONLL0_PGR1_PLR1_PKA0_SIA3_SS1_SU32_SUM0_SUS256_SPO0_SRVW0_SSO0_SVW1_SK0_SKXCCM0_TLDS0_ULSGRO0_USL1_UIOFGRO0_USFGROn1_VSn1_VWA1_VWB2_WSGRA0_WSGRB0_WS32_WG32_4_1_WGM8_WGMXCC1_WGMXCCGn1
    SolutionIndex: 474
    SolutionNameMin: Cijk_Ailk_Bjlk_HSS_BH_Bias_SHB_HA_S_SAB_SCD_SAV_UserArgs_MT128x64x32_MI16x16x1_SN_LDSB0_AFC1_AFEM1_AFEM1_ASEM1_CLR1_CADS0_DTLA0_DTLB0_DTVA1_DTVB0_EPS1_FDSI0_GRPM1_GRVWA8_GRVWB4_GSU1_GSUAMB_GSUC0_GSUWGMRR0_GLS0_ISA1200_IU1_K1_LBSPPA0_LBSPPB1024_LBSPPM0_LPA0_LPB16_LPM0_LRVW8_LWPMn1_MIAV1_MIWT8_1_MO40_NTn1_NTA0_NTB0_NTC0_NTD0_NTM0_NEPBS0_NLCA2_NLCB1_ONLL0_PGR1_PLR1_PKA0_SIA3_SS1_SU32_SUM0_SUS256_SPO0_SRVW0_SSO0_SVW1_SK0_SKXCCM0_TLDS0_ULSGRO0_USL1_UIOFGRO0_USFGROn1_VSn1_VWA1_VWB1_WSGRA0_WSGRB0_WS32_WG16_8_1_WGM8_WGMXCC1_WGMXCCGn1
    SolutionIndex: 480
    SolutionNameMin: Cijk_Ailk_Bjlk_HSS_BH_Bias_SHB_HA_S_SAB_SCD_SAV_UserArgs_MT64x128x32_MI16x16x1_SN_LDSB0_AFC1_AFEM1_AFEM1_ASEM1_CLR1_CADS0_DTLA0_DTLB0_DTVA0_DTVB1_EPS0_FDSI0_GRPM1_GRVWA8_GRVWB8_GSU1_GSUAMB_GSUC0_GSUWGMRR0_GLS0_ISA1200_IU1_K1_LBSPPA1024_LBSPPB0_LBSPPM0_LPA16_LPB0_LPM0_LRVW8_LWPMn1_MIAV1_MIWT1_8_MO40_NTn1_NTA0_NTB0_NTC0_NTD0_NTM0_NEPBS0_NLCA1_NLCB2_ONLL0_PGR2_PLR1_PKA0_SIA3_SS1_SU32_SUM0_SUS256_SPO0_SRVW0_SSO0_SVW1_SK0_SKXCCM0_TLDS0_ULSGRO0_USL1_UIOFGRO0_USFGROn1_VSn1_VWA1_VWB1_WSGRA0_WSGRB0_WS32_WG64_2_1_WGM8_WGMXCC1_WGMXCCGn1
    SolutionIndex: 481
    SolutionNameMin: Cijk_Ailk_Bjlk_HSS_BH_Bias_SHB_HA_S_SAB_SCD_SAV_UserArgs_MT32x32x128_MI16x16x1_SN_LDSB0_AFC1_AFEM1_AFEM1_ASEM1_CLR1_CADS0_DTLA0_DTLB0_DTVA0_DTVB1_EPS1_FDSI0_GRPM1_GRVWA4_GRVWB8_GSU1_GSUAMB_GSUC0_GSUWGMRR0_GLS0_ISA1200_IU1_K1_LBSPPA512_LBSPPB0_LBSPPM0_LPA16_LPB0_LPM0_LRVW8_LWPMn1_MIAV1_MIWT1_1_MO40_NTn1_NTA0_NTB0_NTC0_NTD0_NTM0_NEPBS0_NLCA1_NLCB1_ONLL0_PGR1_PLR1_PKA0_SIA3_SS1_SU32_SUM0_SUS256_SPO0_SRVW0_SSO0_SVW1_SK0_SKXCCM0_TLDS0_ULSGRO0_USL1_UIOFGRO0_USFGROn1_VSn1_VWA1_VWB1_WSGRA0_WSGRB0_WS32_WG32_4_1_WGM8_WGMXCC1_WGMXCCGn1
    SolutionIndex: 482
    SolutionNameMin: Cijk_Ailk_Bjlk_HSS_BH_Bias_SHB_HA_S_SAB_SCD_SAV_UserArgs_MT32x128x64_MI16x16x1_SN_LDSB0_AFC1_AFEM1_AFEM1_ASEM1_CLR1_CADS0_DTLA0_DTLB0_DTVA0_DTVB1_EPS0_FDSI0_GRPM1_GRVWA4_GRVWB8_GSU1_GSUAMB_GSUC0_GSUWGMRR0_GLS0_ISA1200_IU1_K1_LBSPPA512_LBSPPB0_LBSPPM0_LPA16_LPB0_LPM0_LRVW8_LWPMn1_MIAV1_MIWT1_4_MO40_NTn1_NTA0_NTB0_NTC0_NTD0_NTM0_NEPBS0_NLCA1_NLCB4_ONLL0_PGR2_PLR1_PKA0_SIA3_SS0_SU32_SUM0_SUS256_SPO0_SRVW0_SSO0_SVW8_SK0_SKXCCM0_TLDS0_ULSGRO0_USL1_UIOFGRO0_USFGROn1_VSn1_VWA1_VWB1_WSGRA0_WSGRB0_WS32_WG32_4_1_WGM8_WGMXCC1_WGMXCCGn1
    SolutionIndex: 483
    SolutionNameMin: Cijk_Ailk_Bjlk_HSS_BH_Bias_SHB_HA_S_SAB_SCD_SAV_UserArgs_MT128x64x32_MI16x16x1_SN_LDSB0_AFC1_AFEM1_AFEM1_ASEM1_CLR1_CADS0_DTLA0_DTLB0_DTVA1_DTVB0_EPS0_FDSI0_GRPM1_GRVWA8_GRVWB8_GSU1_GSUAMB_GSUC0_GSUWGMRR0_GLS0_ISA1200_IU1_K1_LBSPPA0_LBSPPB1024_LBSPPM0_LPA0_LPB16_LPM0_LRVW8_LWPMn1_MIAV1_MIWT8_1_MO40_NTn1_NTA0_NTB0_NTC0_NTD0_NTM0_NEPBS0_NLCA2_NLCB1_ONLL0_PGR2_PLR1_PKA0_SIA3_SS0_SU32_SUM0_SUS256_SPO0_SRVW0_SSO0_SVW8_SK0_SKXCCM0_TLDS0_ULSGRO0_USL1_UIOFGRO0_USFGROn1_VSn1_VWA1_VWB1_WSGRA0_WSGRB0_WS32_WG16_8_1_WGM8_WGMXCC1_WGMXCCGn1
    SolutionIndex: 484
    SolutionNameMin: Cijk_Ailk_Bjlk_HSS_BH_Bias_SHB_HA_S_SAB_SCD_SAV_UserArgs_MT64x64x32_MI16x16x1_SN_LDSB0_AFC1_AFEM1_AFEM1_ASEM1_CLR1_CADS0_DTLA0_DTLB0_DTVA0_DTVB1_EPS1_FDSI0_GRPM1_GRVWA8_GRVWB8_GSU1_GSUAMB_GSUC0_GSUWGMRR0_GLS0_ISA1200_IU1_K1_LBSPPA1024_LBSPPB0_LBSPPM0_LPA32_LPB0_LPM0_LRVW8_LWPMn1_MIAV1_MIWT2_2_MO40_NTn1_NTA0_NTB0_NTC0_NTD0_NTM0_NEPBS0_NLCA1_NLCB2_ONLL0_PGR1_PLR1_PKA0_SIA3_SS0_SU32_SUM0_SUS256_SPO0_SRVW0_SSO0_SVW8_SK0_SKXCCM0_TLDS0_ULSGRO0_USL1_UIOFGRO0_USFGROn1_VSn1_VWA2_VWB1_WSGRA0_WSGRB0_WS32_WG32_4_1_WGM8_WGMXCC1_WGMXCCGn1
    SolutionIndex: 485
    SolutionNameMin: Cijk_Ailk_Bjlk_HSS_BH_Bias_SHB_HA_S_SAB_SCD_SAV_UserArgs_MT32x128x32_MI16x16x1_SN_LDSB0_AFC1_AFEM1_AFEM1_ASEM1_CLR1_CADS0_DTLA0_DTLB0_DTVA0_DTVB1_EPS1_FDSI0_GRPM1_GRVWA4_GRVWB8_GSU1_GSUAMB_GSUC0_GSUWGMRR0_GLS0_ISA1200_IU1_K1_LBSPPA512_LBSPPB0_LBSPPM0_LPA16_LPB0_LPM0_LRVW8_LWPMn1_MIAV1_MIWT1_4_MO40_NTn1_NTA0_NTB0_NTC0_NTD0_NTM0_NEPBS0_NLCA1_NLCB2_ONLL0_PGR1_PLR1_PKA0_SIA3_SS1_SU32_SUM0_SUS256_SPO0_SRVW0_SSO0_SVW1_SK0_SKXCCM0_TLDS0_ULSGRO0_USL1_UIOFGRO0_USFGROn1_VSn1_VWA1_VWB1_WSGRA0_WSGRB0_WS32_WG32_4_1_WGM8_WGMXCC1_WGMXCCGn1
    SolutionIndex: 486
    SolutionNameMin: Cijk_Ailk_Bjlk_HSS_BH_Bias_SHB_HA_S_SAB_SCD_SAV_UserArgs_MT128x128x16_MI16x16x1_SN_LDSB0_AFC1_AFEM1_AFEM1_ASEM1_CLR1_CADS0_DTLA0_DTLB0_DTVA1_DTVB1_EPS0_FDSI0_GRPM1_GRVWA8_GRVWB8_GSU1_GSUAMB_GSUC0_GSUWGMRR0_GLS0_ISA1200_IU1_K1_LBSPPA0_LBSPPB0_LBSPPM0_LPA0_LPB0_LPM0_LRVW8_LWPMn1_MIAV1_MIWT4_4_MO40_NTn1_NTA0_NTB0_NTC0_NTD0_NTM0_NEPBS0_NLCA1_NLCB1_ONLL0_PGR1_PLR0_PKA0_SIA3_SS1_SU32_SUM0_SUS256_SPO0_SRVW0_SSO0_SVW1_SK0_SKXCCM0_TLDS0_ULSGRO0_USL1_UIOFGRO0_USFGROn1_VSn1_VWA1_VWB1_WSGRA0_WSGRB0_WS32_WG32_4_1_WGM8_WGMXCC1_WGMXCCGn1
    SolutionIndex: 488
    SolutionNameMin: Cijk_Ailk_Bjlk_HSS_BH_Bias_SHB_HA_S_SAB_SCD_SAV_UserArgs_MT64x128x16_MI16x16x1_SN_LDSB0_AFC1_AFEM1_AFEM1_ASEM1_CLR1_CADS0_DTLA0_DTLB0_DTVA1_DTVB1_EPS0_FDSI0_GRPM1_GRVWA8_GRVWB8_GSU1_GSUAMB_GSUC0_GSUWGMRR0_GLS0_ISA1200_IU1_K1_LBSPPA0_LBSPPB0_LBSPPM0_LPA0_LPB0_LPM0_LRVW8_LWPMn1_MIAV1_MIWT1_8_MO40_NTn1_NTA0_NTB0_NTC0_NTD0_NTM0_NEPBS0_NLCA1_NLCB1_ONLL0_PGR1_PLR0_PKA0_SIA3_SS1_SU32_SUM0_SUS256_SPO0_SRVW0_SSO0_SVW1_SK0_SKXCCM0_TLDS0_ULSGRO0_USL1_UIOFGRO0_USFGROn1_VSn1_VWA1_VWB1_WSGRA0_WSGRB0_WS32_WG64_2_1_WGM8_WGMXCC1_WGMXCCGn1
    SolutionIndex: 489
    SolutionNameMin: Cijk_Ailk_Bjlk_HSS_BH_Bias_SHB_HA_S_SAB_SCD_SAV_UserArgs_MT32x16x32_MI16x16x1_SN_LDSB1_AFC1_AFEM1_AFEM1_ASEM1_CLR1_CADS0_DTLA0_DTLB0_DTVA0_DTVB0_EPS1_FDSI0_GRPM1_GRVWA1_GRVWB1_GSU1_GSUAMB_GSUC0_GSUWGMRR0_GLS0_ISA1200_IU2_K1_LBSPPA512_LBSPPB256_LBSPPM0_LPA16_LPB16_LPM0_LRVW8_LWPMn1_MIAV1_MIWT1_1_MO40_NTn1_NTA0_NTB0_NTC0_NTD0_NTM0_NEPBS0_NLCA1_NLCB1_ONLL0_PGR1_PLR1_PKA0_SIA2_SS0_SU32_SUM0_SUS256_SPO0_SRVW0_SSO0_SVW8_SK0_SKXCCM0_TLDS0_ULSGRO0_USL1_UIOFGRO0_USFGROn1_VSn1_VWA1_VWB1_WSGRA0_WSGRB0_WS32_WG32_2_1_WGM8_WGMXCC1_WGMXCCGn1
    SolutionIndex: 490
    SolutionNameMin: Cijk_Ailk_Bjlk_HSS_BH_Bias_SHB_HA_S_SAB_SCD_SAV_UserArgs_MT64x64x32_MI16x16x1_SN_LDSB0_AFC1_AFEM1_AFEM1_ASEM1_CLR1_CADS0_DTLA0_DTLB0_DTVA0_DTVB0_EPS0_FDSI0_GRPM1_GRVWA4_GRVWB8_GSU1_GSUAMB_GSUC0_GSUWGMRR0_GLS0_ISA1200_IU1_K1_LBSPPA1024_LBSPPB1024_LBSPPM0_LPA32_LPB32_LPM0_LRVW8_LWPMn1_MIAV1_MIWT2_2_MO40_NTn1_NTA0_NTB0_NTC0_NTD0_NTM0_NEPBS0_NLCA1_NLCB1_ONLL0_PGR2_PLR1_PKA0_SIA3_SS1_SU32_SUM0_SUS256_SPO0_SRVW0_SSO0_SVW2_SK0_SKXCCM0_TLDS0_ULSGRO0_USL1_UIOFGRO0_USFGROn1_VSn1_VWA2_VWB2_WSGRA0_WSGRB0_WS32_WG32_4_1_WGM8_WGMXCC1_WGMXCCGn1
    SolutionIndex: 491
    SolutionNameMin: Cijk_Ailk_Bjlk_HSS_BH_Bias_SHB_HA_S_SAB_SCD_SAV_UserArgs_MT64x64x32_MI16x16x1_SN_LDSB0_AFC1_AFEM1_AFEM1_ASEM1_CLR1_CADS0_DTLA0_DTLB0_DTVA0_DTVB0_EPS1_FDSI0_GRPM1_GRVWA1_GRVWB1_GSU1_GSUAMB_GSUC0_GSUWGMRR0_GLS0_ISA1200_IU1_K1_LBSPPA1024_LBSPPB1024_LBSPPM0_LPA32_LPB32_LPM0_LRVW8_LWPMn1_MIAV1_MIWT2_2_MO40_NTn1_NTA0_NTB0_NTC0_NTD0_NTM0_NEPBS0_NLCA1_NLCB1_ONLL0_PGR1_PLR1_PKA0_SIA3_SS1_SU32_SUM0_SUS256_SPO0_SRVW0_SSO0_SVW2_SK0_SKXCCM0_TLDS0_ULSGRO0_USL1_UIOFGRO0_USFGROn1_VSn1_VWA2_VWB2_WSGRA0_WSGRB0_WS32_WG32_4_1_WGM8_WGMXCC1_WGMXCCGn1
    SolutionIndex: 492
    SolutionNameMin: Cijk_Ailk_Bjlk_HSS_BH_Bias_SHB_HA_S_SAB_SCD_SAV_UserArgs_MT64x64x16_MI16x16x1_SN_LDSB0_AFC1_AFEM1_AFEM1_ASEM1_CLR0_CADS0_DTLA0_DTLB0_DTVA0_DTVB0_EPS1_FDSI0_GRPM1_GRVWA1_GRVWB1_GSU1_GSUAMB_GSUC0_GSUWGMRR0_GLS0_ISA1200_IU1_K1_LBSPPA1024_LBSPPB1024_LBSPPM0_LPA32_LPB32_LPM0_LRVW8_LWPMn1_MIAV1_MIWT2_2_MO40_NTn1_NTA0_NTB0_NTC0_NTD0_NTM0_NEPBS0_NLCA1_NLCB1_ONLL0_PGR1_PLR0_PKA0_SIA3_SS1_SU32_SUM0_SUS256_SPO0_SRVW0_SSO0_SVW2_SK0_SKXCCM0_TLDS0_ULSGRO0_USL1_UIOFGRO0_USFGROn1_VSn1_VWA2_VWB2_WSGRA0_WSGRB0_WS32_WG32_4_1_WGM8_WGMXCC1_WGMXCCGn1
    SolutionIndex: 493
    SolutionNameMin: Cijk_Ailk_Bjlk_HSS_BH_Bias_SHB_HA_S_SAB_SCD_SAV_UserArgs_MT64x64x16_MI16x16x1_SN_LDSB0_AFC1_AFEM1_AFEM1_ASEM1_CLR0_CADS0_DTLA0_DTLB0_DTVA0_DTVB0_EPS0_FDSI0_GRPM1_GRVWA8_GRVWB4_GSU1_GSUAMB_GSUC0_GSUWGMRR0_GLS0_ISA1200_IU1_K1_LBSPPA1024_LBSPPB1024_LBSPPM0_LPA32_LPB32_LPM0_LRVW8_LWPMn1_MIAV1_MIWT2_2_MO40_NTn1_NTA0_NTB0_NTC0_NTD0_NTM0_NEPBS0_NLCA1_NLCB1_ONLL0_PGR2_PLR0_PKA0_SIA3_SS1_SU32_SUM0_SUS256_SPO0_SRVW0_SSO0_SVW2_SK0_SKXCCM0_TLDS0_ULSGRO1_USL1_UIOFGRO0_USFGROn1_VSn1_VWA2_VWB2_WSGRA0_WSGRB0_WS32_WG32_4_1_WGM8_WGMXCC1_WGMXCCGn1
    SolutionIndex: 494
    SolutionNameMin: Cijk_Ailk_Bjlk_HSS_BH_Bias_SHB_HA_S_SAB_SCD_SAV_UserArgs_MT64x128x16_MI16x16x1_SN_LDSB0_AFC1_AFEM1_AFEM1_ASEM1_CLR0_CADS0_DTLA0_DTLB0_DTVA0_DTVB0_EPS0_FDSI0_GRPM1_GRVWA8_GRVWB8_GSU1_GSUAMB_GSUC0_GSUWGMRR0_GLS0_ISA1200_IU1_K1_LBSPPA1024_LBSPPB2048_LBSPPM0_LPA16_LPB0_LPM0_LRVW8_LWPMn1_MIAV1_MIWT1_8_MO40_NTn1_NTA0_NTB0_NTC0_NTD0_NTM0_NEPBS0_NLCA1_NLCB1_ONLL0_PGR2_PLR0_PKA0_SIA3_SS0_SU32_SUM0_SUS256_SPO0_SRVW0_SSO0_SVW8_SK0_SKXCCM0_TLDS0_ULSGRO1_USL1_UIOFGRO0_USFGROn1_VSn1_VWA1_VWB8_WSGRA0_WSGRB0_WS32_WG64_2_1_WGM8_WGMXCC1_WGMXCCGn1
    SolutionIndex: 495
    SolutionNameMin: Cijk_Ailk_Bjlk_HSS_BH_Bias_SHB_HA_S_SAB_SCD_SAV_UserArgs_MT64x64x16_MI16x16x1_SN_LDSB0_AFC1_AFEM1_AFEM1_ASEM1_CLR0_CADS0_DTLA0_DTLB0_DTVA0_DTVB0_EPS0_FDSI0_GRPM1_GRVWA8_GRVWB1_GSU1_GSUAMB_GSUC0_GSUWGMRR0_GLS0_ISA1200_IU1_K1_LBSPPA1024_LBSPPB1024_LBSPPM0_LPA32_LPB32_LPM0_LRVW8_LWPMn1_MIAV1_MIWT2_2_MO40_NTn1_NTA0_NTB0_NTC0_NTD0_NTM0_NEPBS0_NLCA1_NLCB1_ONLL0_PGR2_PLR0_PKA0_SIA3_SS1_SU32_SUM0_SUS256_SPO0_SRVW0_SSO0_SVW2_SK0_SKXCCM0_TLDS0_ULSGRO0_USL1_UIOFGRO0_USFGROn1_VSn1_VWA2_VWB2_WSGRA0_WSGRB0_WS32_WG32_4_1_WGM8_WGMXCC1_WGMXCCGn1
    SolutionIndex: 496
    SolutionNameMin: Cijk_Ailk_Bjlk_HSS_BH_Bias_SHB_HA_S_SAB_SCD_SAV_UserArgs_MT64x128x16_MI16x16x1_SN_LDSB0_AFC1_AFEM1_AFEM1_ASEM1_CLR0_CADS0_DTLA0_DTLB0_DTVA0_DTVB0_EPS0_FDSI0_GRPM1_GRVWA8_GRVWB8_GSU1_GSUAMB_GSUC0_GSUWGMRR0_GLS0_ISA1200_IU1_K1_LBSPPA1024_LBSPPB2048_LBSPPM0_LPA16_LPB0_LPM0_LRVW8_LWPMn1_MIAV1_MIWT1_8_MO40_NTn1_NTA0_NTB0_NTC0_NTD0_NTM0_NEPBS0_NLCA1_NLCB1_ONLL0_PGR2_PLR0_PKA0_SIA3_SS0_SU32_SUM0_SUS256_SPO0_SRVW0_SSO0_SVW8_SK0_SKXCCM0_TLDS0_ULSGRO0_USL1_UIOFGRO0_USFGROn1_VSn1_VWA1_VWB8_WSGRA0_WSGRB0_WS32_WG64_2_1_WGM8_WGMXCC1_WGMXCCGn1
    SolutionIndex: 497
    SolutionNameMin: Cijk_Ailk_Bjlk_HSS_BH_Bias_SHB_HA_S_SAB_SCD_SAV_UserArgs_MT64x64x16_MI16x16x1_SN_LDSB0_AFC1_AFEM1_AFEM1_ASEM1_CLR0_CADS0_DTLA0_DTLB0_DTVA0_DTVB0_EPS0_FDSI0_GRPM1_GRVWA1_GRVWB4_GSU1_GSUAMB_GSUC0_GSUWGMRR0_GLS0_ISA1200_IU1_K1_LBSPPA1024_LBSPPB1024_LBSPPM0_LPA32_LPB32_LPM0_LRVW8_LWPMn1_MIAV1_MIWT2_2_MO40_NTn1_NTA0_NTB0_NTC0_NTD0_NTM0_NEPBS0_NLCA1_NLCB1_ONLL0_PGR2_PLR0_PKA0_SIA3_SS0_SU32_SUM0_SUS256_SPO0_SRVW0_SSO0_SVW8_SK0_SKXCCM0_TLDS0_ULSGRO0_USL1_UIOFGRO0_USFGROn1_VSn1_VWA2_VWB2_WSGRA0_WSGRB0_WS32_WG32_4_1_WGM8_WGMXCC1_WGMXCCGn1
    SolutionIndex: 498
    SolutionNameMin: Cijk_Ailk_Bjlk_HSS_BH_Bias_SHB_HA_S_SAB_SCD_SAV_UserArgs_MT64x64x32_MI16x16x1_SN_LDSB0_AFC1_AFEM1_AFEM1_ASEM1_CLR1_CADS0_DTLA0_DTLB0_DTVA0_DTVB0_EPS0_FDSI0_GRPM1_GRVWA1_GRVWB1_GSU1_GSUAMB_GSUC0_GSUWGMRR0_GLS0_ISA1200_IU1_K1_LBSPPA1024_LBSPPB1024_LBSPPM0_LPA32_LPB32_LPM0_LRVW8_LWPMn1_MIAV1_MIWT2_2_MO40_NTn1_NTA0_NTB0_NTC0_NTD0_NTM0_NEPBS0_NLCA1_NLCB1_ONLL0_PGR2_PLR1_PKA0_SIA3_SS1_SU32_SUM0_SUS256_SPO0_SRVW0_SSO0_SVW2_SK0_SKXCCM0_TLDS0_ULSGRO1_USL1_UIOFGRO0_USFGROn1_VSn1_VWA2_VWB2_WSGRA0_WSGRB0_WS32_WG32_4_1_WGM8_WGMXCC1_WGMXCCGn1
    SolutionIndex: 499
    SolutionNameMin: Cijk_Ailk_Bjlk_HSS_BH_Bias_SHB_HA_S_SAB_SCD_SAV_UserArgs_MT32x128x16_MI16x16x1_SN_LDSB0_AFC1_AFEM1_AFEM1_ASEM1_CLR1_CADS0_DTLA0_DTLB0_DTVA1_DTVB1_EPS0_FDSI0_GRPM1_GRVWA8_GRVWB8_GSU1_GSUAMB_GSUC0_GSUWGMRR0_GLS0_ISA1200_IU1_K1_LBSPPA0_LBSPPB0_LBSPPM0_LPA0_LPB0_LPM0_LRVW8_LWPMn1_MIAV1_MIWT1_4_MO40_NTn1_NTA0_NTB0_NTC0_NTD0_NTM0_NEPBS0_NLCA1_NLCB1_ONLL0_PGR1_PLR0_PKA0_SIA3_SS0_SU32_SUM0_SUS256_SPO0_SRVW0_SSO0_SVW8_SK0_SKXCCM0_TLDS0_ULSGRO0_USL1_UIOFGRO0_USFGROn1_VSn1_VWA1_VWB1_WSGRA0_WSGRB0_WS32_WG32_4_1_WGM8_WGMXCC1_WGMXCCGn1
    SolutionIndex: 500
    SolutionNameMin: Cijk_Ailk_Bjlk_HSS_BH_Bias_SHB_HA_S_SAB_SCD_SAV_UserArgs_MT64x64x32_MI16x16x1_SN_LDSB1_AFC1_AFEM1_AFEM1_ASEM1_CLR1_CADS0_DTLA0_DTLB0_DTVA0_DTVB0_EPS1_FDSI0_GRPM1_GRVWA1_GRVWB8_GSU1_GSUAMB_GSUC0_GSUWGMRR0_GLS0_ISA1200_IU2_K1_LBSPPA1024_LBSPPB1024_LBSPPM0_LPA32_LPB32_LPM0_LRVW8_LWPMn1_MIAV1_MIWT2_2_MO40_NTn1_NTA0_NTB0_NTC0_NTD0_NTM0_NEPBS0_NLCA1_NLCB1_ONLL0_PGR1_PLR1_PKA0_SIA2_SS1_SU32_SUM0_SUS256_SPO0_SRVW0_SSO0_SVW2_SK0_SKXCCM0_TLDS0_ULSGRO0_USL1_UIOFGRO0_USFGROn1_VSn1_VWA2_VWB2_WSGRA0_WSGRB0_WS32_WG32_4_1_WGM8_WGMXCC1_WGMXCCGn1
    SolutionIndex: 501
    SolutionNameMin: Cijk_Ailk_Bjlk_HSS_BH_Bias_SHB_HA_S_SAB_SCD_SAV_UserArgs_MT64x64x16_MI16x16x1_SN_LDSB1_AFC1_AFEM1_AFEM1_ASEM1_CLR1_CADS0_DTLA0_DTLB0_DTVA0_DTVB0_EPS0_FDSI0_GRPM1_GRVWA4_GRVWB1_GSU1_GSUAMB_GSUC0_GSUWGMRR0_GLS0_ISA1200_IU1_K1_LBSPPA1024_LBSPPB1024_LBSPPM0_LPA32_LPB32_LPM0_LRVW8_LWPMn1_MIAV1_MIWT2_2_MO40_NTn1_NTA0_NTB0_NTC0_NTD0_NTM0_NEPBS0_NLCA1_NLCB1_ONLL0_PGR2_PLR1_PKA0_SIA2_SS1_SU32_SUM0_SUS256_SPO0_SRVW0_SSO0_SVW2_SK0_SKXCCM0_TLDS0_ULSGRO0_USL1_UIOFGRO0_USFGROn1_VSn1_VWA2_VWB2_WSGRA0_WSGRB0_WS32_WG32_4_1_WGM8_WGMXCC1_WGMXCCGn1
    SolutionIndex: 502
    SolutionNameMin: Cijk_Ailk_Bjlk_HSS_BH_Bias_SHB_HA_S_SAB_SCD_SAV_UserArgs_MT64x64x16_MI16x16x1_SN_LDSB0_AFC1_AFEM1_AFEM1_ASEM1_CLR0_CADS0_DTLA0_DTLB0_DTVA0_DTVB0_EPS0_FDSI0_GRPM1_GRVWA4_GRVWB4_GSU1_GSUAMB_GSUC0_GSUWGMRR0_GLS0_ISA1200_IU1_K1_LBSPPA1024_LBSPPB1024_LBSPPM0_LPA32_LPB32_LPM0_LRVW8_LWPMn1_MIAV1_MIWT2_2_MO40_NTn1_NTA0_NTB0_NTC0_NTD0_NTM0_NEPBS0_NLCA1_NLCB1_ONLL0_PGR2_PLR0_PKA0_SIA3_SS1_SU32_SUM0_SUS256_SPO0_SRVW0_SSO0_SVW2_SK0_SKXCCM0_TLDS0_ULSGRO1_USL1_UIOFGRO0_USFGROn1_VSn1_VWA2_VWB2_WSGRA0_WSGRB0_WS32_WG32_4_1_WGM8_WGMXCC1_WGMXCCGn1
    SolutionIndex: 503
    SolutionNameMin: Cijk_Ailk_Bjlk_HSS_BH_Bias_SHB_HA_S_SAB_SCD_SAV_UserArgs_MT64x64x64_MI16x16x1_SN_LDSB1_AFC1_AFEM1_AFEM1_ASEM1_CLR1_CADS0_DTLA0_DTLB0_DTVA0_DTVB0_EPS0_FDSI0_GRPM1_GRVWA4_GRVWB8_GSU1_GSUAMB_GSUC0_GSUWGMRR0_GLS0_ISA1200_IU1_K1_LBSPPA1024_LBSPPB1024_LBSPPM0_LPA32_LPB32_LPM0_LRVW8_LWPMn1_MIAV1_MIWT2_2_MO40_NTn1_NTA0_NTB0_NTC0_NTD0_NTM0_NEPBS0_NLCA1_NLCB1_ONLL0_PGR2_PLR1_PKA0_SIA3_SS1_SU32_SUM0_SUS256_SPO0_SRVW0_SSO0_SVW2_SK0_SKXCCM0_TLDS0_ULSGRO1_USL1_UIOFGRO0_USFGROn1_VSn1_VWA2_VWB2_WSGRA0_WSGRB0_WS32_WG32_4_1_WGM8_WGMXCC1_WGMXCCGn1
    SolutionIndex: 504
    SolutionNameMin: Cijk_Ailk_Bjlk_HSS_BH_Bias_SHB_HA_S_SAB_SCD_SAV_UserArgs_MT64x64x64_MI16x16x1_SN_LDSB1_AFC1_AFEM1_AFEM1_ASEM1_CLR1_CADS0_DTLA0_DTLB0_DTVA0_DTVB0_EPS0_FDSI0_GRPM1_GRVWA8_GRVWB4_GSU1_GSUAMB_GSUC0_GSUWGMRR0_GLS0_ISA1200_IU1_K1_LBSPPA1024_LBSPPB1024_LBSPPM0_LPA32_LPB32_LPM0_LRVW8_LWPMn1_MIAV1_MIWT2_2_MO40_NTn1_NTA0_NTB0_NTC0_NTD0_NTM0_NEPBS0_NLCA1_NLCB1_ONLL0_PGR2_PLR1_PKA0_SIA3_SS1_SU32_SUM0_SUS256_SPO0_SRVW0_SSO0_SVW2_SK0_SKXCCM0_TLDS0_ULSGRO0_USL1_UIOFGRO0_USFGROn1_VSn1_VWA2_VWB2_WSGRA0_WSGRB0_WS32_WG32_4_1_WGM8_WGMXCC1_WGMXCCGn1
    SolutionIndex: 505
    SolutionNameMin: Cijk_Ailk_Bjlk_HSS_BH_Bias_SHB_HA_S_SAB_SCD_SAV_UserArgs_MT64x64x32_MI16x16x1_SN_LDSB1_AFC1_AFEM1_AFEM1_ASEM1_CLR1_CADS0_DTLA0_DTLB0_DTVA0_DTVB0_EPS1_FDSI0_GRPM1_GRVWA8_GRVWB8_GSU1_GSUAMB_GSUC0_GSUWGMRR0_GLS0_ISA1200_IU2_K1_LBSPPA1024_LBSPPB1024_LBSPPM0_LPA32_LPB32_LPM0_LRVW8_LWPMn1_MIAV1_MIWT2_2_MO40_NTn1_NTA0_NTB0_NTC0_NTD0_NTM0_NEPBS0_NLCA1_NLCB1_ONLL0_PGR1_PLR1_PKA0_SIA2_SS0_SU32_SUM0_SUS256_SPO0_SRVW0_SSO0_SVW8_SK0_SKXCCM0_TLDS0_ULSGRO0_USL1_UIOFGRO0_USFGROn1_VSn1_VWA2_VWB2_WSGRA0_WSGRB0_WS32_WG32_4_1_WGM8_WGMXCC1_WGMXCCGn1
    SolutionIndex: 506
    SolutionNameMin: Cijk_Ailk_Bjlk_HSS_BH_Bias_SHB_HA_S_SAB_SCD_SAV_UserArgs_MT64x64x64_MI16x16x1_SN_LDSB1_AFC1_AFEM1_AFEM1_ASEM1_CLR1_CADS0_DTLA0_DTLB0_DTVA0_DTVB0_EPS0_FDSI0_GRPM1_GRVWA8_GRVWB4_GSU1_GSUAMB_GSUC0_GSUWGMRR0_GLS0_ISA1200_IU4_K1_LBSPPA1024_LBSPPB1024_LBSPPM0_LPA32_LPB32_LPM0_LRVW8_LWPMn1_MIAV1_MIWT2_2_MO40_NTn1_NTA0_NTB0_NTC0_NTD0_NTM0_NEPBS0_NLCA1_NLCB1_ONLL0_PGR2_PLR1_PKA0_SIA2_SS1_SU32_SUM0_SUS256_SPO0_SRVW0_SSO0_SVW2_SK0_SKXCCM0_TLDS0_ULSGRO1_USL1_UIOFGRO0_USFGROn1_VSn1_VWA2_VWB2_WSGRA0_WSGRB0_WS32_WG32_4_1_WGM8_WGMXCC1_WGMXCCGn1
    SolutionIndex: 507
    SolutionNameMin: Cijk_Ailk_Bjlk_HSS_BH_Bias_SHB_HA_S_SAB_SCD_SAV_UserArgs_MT64x128x16_MI16x16x1_SN_LDSB0_AFC1_AFEM1_AFEM1_ASEM1_CLR0_CADS0_DTLA0_DTLB0_DTVA0_DTVB0_EPS0_FDSI0_GRPM1_GRVWA4_GRVWB4_GSU1_GSUAMB_GSUC0_GSUWGMRR0_GLS0_ISA1200_IU1_K1_LBSPPA1024_LBSPPB2048_LBSPPM0_LPA16_LPB0_LPM0_LRVW8_LWPMn1_MIAV1_MIWT1_8_MO40_NTn1_NTA0_NTB0_NTC0_NTD0_NTM0_NEPBS0_NLCA1_NLCB1_ONLL0_PGR2_PLR0_PKA0_SIA3_SS0_SU32_SUM0_SUS256_SPO0_SRVW0_SSO0_SVW8_SK0_SKXCCM0_TLDS0_ULSGRO1_USL1_UIOFGRO0_USFGROn1_VSn1_VWA1_VWB8_WSGRA0_WSGRB0_WS32_WG64_2_1_WGM8_WGMXCC1_WGMXCCGn1
    SolutionIndex: 508
    SolutionNameMin: Cijk_Ailk_Bjlk_HSS_BH_Bias_SHB_HA_S_SAB_SCD_SAV_UserArgs_MT64x64x32_MI16x16x1_SN_LDSB0_AFC1_AFEM1_AFEM1_ASEM1_CLR1_CADS0_DTLA0_DTLB0_DTVA0_DTVB1_EPS0_FDSI0_GRPM1_GRVWA1_GRVWB8_GSU1_GSUAMB_GSUC0_GSUWGMRR0_GLS0_ISA1200_IU1_K1_LBSPPA1024_LBSPPB0_LBSPPM0_LPA32_LPB0_LPM0_LRVW8_LWPMn1_MIAV1_MIWT2_2_MO40_NTn1_NTA0_NTB0_NTC0_NTD0_NTM0_NEPBS0_NLCA1_NLCB2_ONLL0_PGR2_PLR1_PKA0_SIA3_SS1_SU32_SUM0_SUS256_SPO0_SRVW0_SSO0_SVW2_SK0_SKXCCM0_TLDS0_ULSGRO0_USL1_UIOFGRO0_USFGROn1_VSn1_VWA2_VWB1_WSGRA0_WSGRB0_WS32_WG32_4_1_WGM8_WGMXCC1_WGMXCCGn1
    SolutionIndex: 509
    SolutionNameMin: Cijk_Ailk_Bjlk_HSS_BH_Bias_SHB_HA_S_SAB_SCD_SAV_UserArgs_MT64x64x32_MI16x16x1_SN_LDSB0_AFC1_AFEM1_AFEM1_ASEM1_CLR1_CADS0_DTLA0_DTLB0_DTVA1_DTVB0_EPS0_FDSI0_GRPM1_GRVWA8_GRVWB1_GSU1_GSUAMB_GSUC0_GSUWGMRR0_GLS0_ISA1200_IU1_K1_LBSPPA0_LBSPPB1024_LBSPPM0_LPA0_LPB32_LPM0_LRVW8_LWPMn1_MIAV1_MIWT2_2_MO40_NTn1_NTA0_NTB0_NTC0_NTD0_NTM0_NEPBS0_NLCA2_NLCB1_ONLL0_PGR2_PLR1_PKA0_SIA3_SS0_SU32_SUM0_SUS256_SPO0_SRVW0_SSO0_SVW8_SK0_SKXCCM0_TLDS0_ULSGRO0_USL1_UIOFGRO0_USFGROn1_VSn1_VWA1_VWB2_WSGRA0_WSGRB0_WS32_WG32_4_1_WGM8_WGMXCC1_WGMXCCGn1
    SolutionIndex: 510
    SolutionNameMin: Cijk_Ailk_Bjlk_HSS_BH_Bias_SHB_HA_S_SAB_SCD_SAV_UserArgs_MT64x64x16_MI16x16x1_SN_LDSB1_AFC1_AFEM1_AFEM1_ASEM1_CLR1_CADS0_DTLA0_DTLB0_DTVA0_DTVB0_EPS0_FDSI0_GRPM1_GRVWA4_GRVWB8_GSU1_GSUAMB_GSUC0_GSUWGMRR0_GLS0_ISA1200_IU1_K1_LBSPPA1024_LBSPPB1024_LBSPPM0_LPA32_LPB32_LPM0_LRVW8_LWPMn1_MIAV1_MIWT2_2_MO40_NTn1_NTA0_NTB0_NTC0_NTD0_NTM0_NEPBS0_NLCA1_NLCB1_ONLL0_PGR2_PLR1_PKA0_SIA2_SS1_SU32_SUM0_SUS256_SPO0_SRVW0_SSO0_SVW2_SK0_SKXCCM0_TLDS0_ULSGRO0_USL1_UIOFGRO0_USFGROn1_VSn1_VWA2_VWB2_WSGRA0_WSGRB0_WS32_WG32_4_1_WGM8_WGMXCC1_WGMXCCGn1
    SolutionIndex: 511
    SolutionNameMin: Cijk_Ailk_Bjlk_HSS_BH_Bias_SHB_HA_S_SAB_SCD_SAV_UserArgs_MT128x128x16_MI16x16x1_SN_LDSB0_AFC1_AFEM1_AFEM1_ASEM1_CLR1_CADS0_DTLA0_DTLB0_DTVA1_DTVB1_EPS0_FDSI0_GRPM1_GRVWA8_GRVWB8_GSU1_GSUAMB_GSUC0_GSUWGMRR0_GLS0_ISA1200_IU1_K1_LBSPPA0_LBSPPB0_LBSPPM0_LPA0_LPB0_LPM0_LRVW8_LWPMn1_MIAV1_MIWT8_2_MO40_NTn1_NTA0_NTB0_NTC0_NTD0_NTM0_NEPBS0_NLCA1_NLCB1_ONLL0_PGR1_PLR0_PKA0_SIA3_SS1_SU32_SUM0_SUS256_SPO0_SRVW0_SSO0_SVW1_SK0_SKXCCM0_TLDS0_ULSGRO0_USL1_UIOFGRO0_USFGROn1_VSn1_VWA1_VWB1_WSGRA0_WSGRB0_WS32_WG16_8_1_WGM8_WGMXCC1_WGMXCCGn1
    SolutionIndex: 512
    SolutionNameMin: Cijk_Ailk_Bjlk_HSS_BH_Bias_SHB_HA_S_SAB_SCD_SAV_UserArgs_MT128x32x64_MI16x16x1_SN_LDSB0_AFC1_AFEM1_AFEM1_ASEM1_CLR1_CADS0_DTLA0_DTLB0_DTVA1_DTVB0_EPS0_FDSI0_GRPM1_GRVWA8_GRVWB4_GSU1_GSUAMB_GSUC0_GSUWGMRR0_GLS0_ISA1200_IU1_K1_LBSPPA0_LBSPPB512_LBSPPM0_LPA0_LPB16_LPM0_LRVW8_LWPMn1_MIAV1_MIWT4_1_MO40_NTn1_NTA0_NTB0_NTC0_NTD0_NTM0_NEPBS0_NLCA4_NLCB1_ONLL0_PGR2_PLR1_PKA0_SIA3_SS0_SU32_SUM0_SUS256_SPO0_SRVW0_SSO0_SVW8_SK0_SKXCCM0_TLDS0_ULSGRO0_USL1_UIOFGRO0_USFGROn1_VSn1_VWA1_VWB1_WSGRA0_WSGRB0_WS32_WG32_4_1_WGM8_WGMXCC1_WGMXCCGn1
    SolutionIndex: 515
    SolutionNameMin: Cijk_Ailk_Bjlk_HSS_BH_Bias_SHB_HA_S_SAB_SCD_SAV_UserArgs_MT16x16x32_MI16x16x1_SN_LDSB0_AFC1_AFEM1_AFEM1_ASEM1_CLR1_CADS0_DTLA0_DTLB0_DTVA0_DTVB0_EPS0_FDSI0_GRPM1_GRVWA1_GRVWB1_GSU1_GSUAMB_GSUC0_GSUWGMRR0_GLS0_ISA1200_IU1_K1_LBSPPA256_LBSPPB256_LBSPPM0_LPA16_LPB16_LPM0_LRVW8_LWPMn1_MIAV1_MIWT1_1_MO40_NTn1_NTA0_NTB0_NTC0_NTD0_NTM0_NEPBS0_NLCA1_NLCB1_ONLL0_PGR2_PLR1_PKA0_SIA3_SS1_SU32_SUM0_SUS256_SPO0_SRVW0_SSO0_SVW1_SK0_SKXCCM0_TLDS0_ULSGRO1_USL1_UIOFGRO0_USFGROn1_VSn1_VWA1_VWB1_WSGRA0_WSGRB0_WS32_WG16_2_1_WGM8_WGMXCC1_WGMXCCGn1
    SolutionIndex: 517
    SolutionNameMin: Cijk_Ailk_Bjlk_HSS_BH_Bias_SHB_HA_S_SAB_SCD_SAV_UserArgs_MT128x32x16_MI16x16x1_SN_LDSB1_AFC1_AFEM1_AFEM1_ASEM1_CLR1_CADS0_DTLA0_DTLB0_DTVA0_DTVB0_EPS0_FDSI0_GRPM1_GRVWA8_GRVWB4_GSU1_GSUAMB_GSUC0_GSUWGMRR0_GLS0_ISA1200_IU1_K1_LBSPPA2048_LBSPPB512_LBSPPM0_LPA0_LPB16_LPM0_LRVW8_LWPMn1_MIAV1_MIWT4_1_MO40_NTn1_NTA0_NTB0_NTC0_NTD0_NTM0_NEPBS0_NLCA1_NLCB1_ONLL0_PGR2_PLR1_PKA0_SIA2_SS1_SU32_SUM0_SUS256_SPO0_SRVW0_SSO0_SVW4_SK0_SKXCCM0_TLDS0_ULSGRO0_USL1_UIOFGRO0_USFGROn1_VSn1_VWA4_VWB1_WSGRA0_WSGRB0_WS32_WG32_4_1_WGM8_WGMXCC1_WGMXCCGn1
    SolutionIndex: 523
    SolutionNameMin: Cijk_Ailk_Bjlk_HSS_BH_Bias_SHB_HA_S_SAB_SCD_SAV_UserArgs_MT128x128x16_MI16x16x1_SN_LDSB0_AFC1_AFEM1_AFEM1_ASEM1_CLR0_CADS0_DTLA0_DTLB0_DTVA0_DTVB0_EPS0_FDSI0_GRPM1_GRVWA4_GRVWB4_GSU1_GSUAMB_GSUC0_GSUWGMRR0_GLS0_ISA1200_IU1_K1_LBSPPA2048_LBSPPB2048_LBSPPM0_LPA0_LPB0_LPM0_LRVW8_LWPMn1_MIAV1_MIWT4_4_MO40_NTn1_NTA0_NTB0_NTC0_NTD0_NTM0_NEPBS0_NLCA1_NLCB1_ONLL0_PGR2_PLR0_PKA0_SIA3_SS1_SU32_SUM0_SUS256_SPO0_SRVW0_SSO0_SVW4_SK0_SKXCCM0_TLDS0_ULSGRO0_USL1_UIOFGRO0_USFGROn1_VSn1_VWA4_VWB4_WSGRA0_WSGRB0_WS32_WG32_4_1_WGM8_WGMXCC1_WGMXCCGn1
    SolutionIndex: 525
    SolutionNameMin: Cijk_Ailk_Bjlk_HSS_BH_Bias_SHB_HA_S_SAB_SCD_SAV_UserArgs_MT128x64x16_MI16x16x1_SN_LDSB0_AFC1_AFEM1_AFEM1_ASEM1_CLR0_CADS0_DTLA0_DTLB0_DTVA0_DTVB0_EPS0_FDSI0_GRPM1_GRVWA4_GRVWB4_GSU1_GSUAMB_GSUC0_GSUWGMRR0_GLS0_ISA1200_IU1_K1_LBSPPA2048_LBSPPB1024_LBSPPM0_LPA0_LPB16_LPM0_LRVW8_LWPMn1_MIAV1_MIWT8_1_MO40_NTn1_NTA0_NTB0_NTC0_NTD0_NTM0_NEPBS0_NLCA1_NLCB1_ONLL0_PGR2_PLR0_PKA0_SIA3_SS1_SU32_SUM0_SUS256_SPO0_SRVW0_SSO0_SVW8_SK0_SKXCCM0_TLDS0_ULSGRO1_USL1_UIOFGRO0_USFGROn1_VSn1_VWA8_VWB1_WSGRA0_WSGRB0_WS32_WG16_8_1_WGM8_WGMXCC1_WGMXCCGn1
    SolutionIndex: 528
    SolutionNameMin: Cijk_Ailk_Bjlk_HSS_BH_Bias_SHB_HA_S_SAB_SCD_SAV_UserArgs_MT128x128x16_MI16x16x1_SN_LDSB0_AFC1_AFEM1_AFEM1_ASEM1_CLR0_CADS0_DTLA0_DTLB0_DTVA0_DTVB0_EPS0_FDSI0_GRPM1_GRVWA8_GRVWB4_GSU1_GSUAMB_GSUC0_GSUWGMRR0_GLS0_ISA1200_IU1_K1_LBSPPA2048_LBSPPB2048_LBSPPM0_LPA0_LPB0_LPM0_LRVW8_LWPMn1_MIAV1_MIWT4_4_MO40_NTn1_NTA0_NTB0_NTC0_NTD0_NTM0_NEPBS0_NLCA1_NLCB1_ONLL0_PGR2_PLR0_PKA0_SIA3_SS1_SU32_SUM0_SUS256_SPO0_SRVW0_SSO0_SVW4_SK0_SKXCCM0_TLDS0_ULSGRO0_USL1_UIOFGRO0_USFGROn1_VSn1_VWA4_VWB4_WSGRA0_WSGRB0_WS32_WG32_4_1_WGM8_WGMXCC1_WGMXCCGn1
    SolutionIndex: 529
    SolutionNameMin: Cijk_Ailk_Bjlk_HSS_BH_Bias_SHB_HA_S_SAB_SCD_SAV_UserArgs_MT128x128x16_MI16x16x1_SN_LDSB0_AFC1_AFEM1_AFEM1_ASEM1_CLR0_CADS0_DTLA0_DTLB0_DTVA0_DTVB0_EPS0_FDSI0_GRPM1_GRVWA4_GRVWB8_GSU1_GSUAMB_GSUC0_GSUWGMRR0_GLS0_ISA1200_IU1_K1_LBSPPA2048_LBSPPB2048_LBSPPM0_LPA0_LPB0_LPM0_LRVW8_LWPMn1_MIAV1_MIWT4_4_MO40_NTn1_NTA0_NTB0_NTC0_NTD0_NTM0_NEPBS0_NLCA1_NLCB1_ONLL0_PGR2_PLR0_PKA0_SIA3_SS1_SU32_SUM0_SUS256_SPO0_SRVW0_SSO0_SVW4_SK0_SKXCCM0_TLDS0_ULSGRO0_USL1_UIOFGRO0_USFGROn1_VSn1_VWA4_VWB4_WSGRA0_WSGRB0_WS32_WG32_4_1_WGM8_WGMXCC1_WGMXCCGn1
    SolutionIndex: 533
    SolutionNameMin: Cijk_Ailk_Bjlk_HSS_BH_Bias_SHB_HA_S_SAB_SCD_SAV_UserArgs_MT128x32x16_MI16x16x1_SN_LDSB1_AFC1_AFEM1_AFEM1_ASEM1_CLR1_CADS0_DTLA0_DTLB0_DTVA0_DTVB0_EPS0_FDSI0_GRPM1_GRVWA4_GRVWB4_GSU1_GSUAMB_GSUC0_GSUWGMRR0_GLS0_ISA1200_IU1_K1_LBSPPA2048_LBSPPB512_LBSPPM0_LPA0_LPB16_LPM0_LRVW8_LWPMn1_MIAV1_MIWT4_1_MO40_NTn1_NTA0_NTB0_NTC0_NTD0_NTM0_NEPBS0_NLCA1_NLCB1_ONLL0_PGR2_PLR1_PKA0_SIA2_SS1_SU32_SUM0_SUS256_SPO0_SRVW0_SSO0_SVW4_SK0_SKXCCM0_TLDS0_ULSGRO1_USL1_UIOFGRO0_USFGROn1_VSn1_VWA4_VWB1_WSGRA0_WSGRB0_WS32_WG32_4_1_WGM8_WGMXCC1_WGMXCCGn1
    SolutionIndex: 535
    SolutionNameMin: Cijk_Ailk_Bjlk_HSS_BH_Bias_SHB_HA_S_SAB_SCD_SAV_UserArgs_MT128x32x32_MI16x16x1_SN_LDSB0_AFC1_AFEM1_AFEM1_ASEM1_CLR1_CADS0_DTLA0_DTLB0_DTVA1_DTVB0_EPS1_FDSI0_GRPM1_GRVWA8_GRVWB4_GSU1_GSUAMB_GSUC0_GSUWGMRR0_GLS0_ISA1200_IU1_K1_LBSPPA0_LBSPPB512_LBSPPM0_LPA0_LPB16_LPM0_LRVW8_LWPMn1_MIAV1_MIWT4_1_MO40_NTn1_NTA0_NTB0_NTC0_NTD0_NTM0_NEPBS0_NLCA2_NLCB1_ONLL0_PGR1_PLR1_PKA0_SIA3_SS0_SU32_SUM0_SUS256_SPO0_SRVW0_SSO0_SVW8_SK0_SKXCCM0_TLDS0_ULSGRO0_USL1_UIOFGRO0_USFGROn1_VSn1_VWA1_VWB1_WSGRA0_WSGRB0_WS32_WG32_4_1_WGM8_WGMXCC1_WGMXCCGn1
    SolutionIndex: 540
    SolutionNameMin: Cijk_Ailk_Bjlk_HSS_BH_Bias_SHB_HA_S_SAB_SCD_SAV_UserArgs_MT128x128x16_MI16x16x1_SN_LDSB0_AFC1_AFEM1_AFEM1_ASEM1_CLR0_CADS0_DTLA0_DTLB0_DTVA0_DTVB0_EPS1_FDSI0_GRPM1_GRVWA8_GRVWB1_GSU1_GSUAMB_GSUC0_GSUWGMRR0_GLS0_ISA1200_IU1_K1_LBSPPA2048_LBSPPB2048_LBSPPM0_LPA0_LPB0_LPM0_LRVW8_LWPMn1_MIAV1_MIWT4_4_MO40_NTn1_NTA0_NTB0_NTC0_NTD0_NTM0_NEPBS0_NLCA1_NLCB1_ONLL0_PGR1_PLR0_PKA0_SIA3_SS1_SU32_SUM0_SUS256_SPO0_SRVW0_SSO0_SVW4_SK0_SKXCCM0_TLDS0_ULSGRO0_USL1_UIOFGRO0_USFGROn1_VSn1_VWA4_VWB4_WSGRA0_WSGRB0_WS32_WG32_4_1_WGM8_WGMXCC1_WGMXCCGn1
    SolutionIndex: 544
    SolutionNameMin: Cijk_Ailk_Bjlk_HSS_BH_Bias_SHB_HA_S_SAB_SCD_SAV_UserArgs_MT128x128x16_MI16x16x1_SN_LDSB0_AFC1_AFEM1_AFEM1_ASEM1_CLR0_CADS0_DTLA0_DTLB0_DTVA0_DTVB0_EPS1_FDSI0_GRPM1_GRVWA1_GRVWB1_GSU1_GSUAMB_GSUC0_GSUWGMRR0_GLS0_ISA1200_IU1_K1_LBSPPA2048_LBSPPB2048_LBSPPM0_LPA0_LPB0_LPM0_LRVW8_LWPMn1_MIAV1_MIWT4_4_MO40_NTn1_NTA0_NTB0_NTC0_NTD0_NTM0_NEPBS0_NLCA1_NLCB1_ONLL0_PGR1_PLR0_PKA0_SIA3_SS1_SU32_SUM0_SUS256_SPO0_SRVW0_SSO0_SVW4_SK0_SKXCCM0_TLDS0_ULSGRO0_USL1_UIOFGRO0_USFGROn1_VSn1_VWA4_VWB4_WSGRA0_WSGRB0_WS32_WG32_4_1_WGM8_WGMXCC1_WGMXCCGn1
    SolutionIndex: 548
    SolutionNameMin: Cijk_Ailk_Bjlk_HSS_BH_Bias_SHB_HA_S_SAB_SCD_SAV_UserArgs_MT64x128x16_MI16x16x1_SN_LDSB0_AFC1_AFEM1_AFEM1_ASEM1_CLR0_CADS0_DTLA0_DTLB0_DTVA0_DTVB0_EPS0_FDSI0_GRPM1_GRVWA4_GRVWB4_GSU1_GSUAMB_GSUC0_GSUWGMRR0_GLS0_ISA1200_IU1_K1_LBSPPA1024_LBSPPB2048_LBSPPM0_LPA16_LPB0_LPM0_LRVW8_LWPMn1_MIAV1_MIWT1_8_MO40_NTn1_NTA0_NTB0_NTC0_NTD0_NTM0_NEPBS0_NLCA1_NLCB1_ONLL0_PGR2_PLR0_PKA0_SIA3_SS0_SU32_SUM0_SUS256_SPO0_SRVW0_SSO0_SVW8_SK0_SKXCCM0_TLDS0_ULSGRO0_USL1_UIOFGRO0_USFGROn1_VSn1_VWA1_VWB8_WSGRA0_WSGRB0_WS32_WG64_2_1_WGM8_WGMXCC1_WGMXCCGn1
    SolutionIndex: 552
    SolutionNameMin: Cijk_Ailk_Bjlk_HSS_BH_Bias_SHB_HA_S_SAB_SCD_SAV_UserArgs_MT128x128x16_MI16x16x1_SN_LDSB0_AFC1_AFEM1_AFEM1_ASEM1_CLR0_CADS0_DTLA0_DTLB0_DTVA0_DTVB0_EPS0_FDSI0_GRPM1_GRVWA8_GRVWB4_GSU1_GSUAMB_GSUC0_GSUWGMRR0_GLS0_ISA1200_IU1_K1_LBSPPA2048_LBSPPB2048_LBSPPM0_LPA0_LPB0_LPM0_LRVW8_LWPMn1_MIAV1_MIWT4_4_MO40_NTn1_NTA0_NTB0_NTC0_NTD0_NTM0_NEPBS0_NLCA1_NLCB1_ONLL0_PGR2_PLR0_PKA0_SIA3_SS1_SU32_SUM0_SUS256_SPO0_SRVW0_SSO0_SVW4_SK0_SKXCCM0_TLDS0_ULSGRO1_USL1_UIOFGRO0_USFGROn1_VSn1_VWA4_VWB4_WSGRA0_WSGRB0_WS32_WG32_4_1_WGM8_WGMXCC1_WGMXCCGn1
    SolutionIndex: 553
    SolutionNameMin: Cijk_Ailk_Bjlk_HSS_BH_Bias_SHB_HA_S_SAB_SCD_SAV_UserArgs_MT128x128x16_MI16x16x1_SN_LDSB0_AFC1_AFEM1_AFEM1_ASEM1_CLR0_CADS0_DTLA0_DTLB0_DTVA0_DTVB0_EPS0_FDSI0_GRPM1_GRVWA1_GRVWB4_GSU1_GSUAMB_GSUC0_GSUWGMRR0_GLS0_ISA1200_IU1_K1_LBSPPA2048_LBSPPB2048_LBSPPM0_LPA0_LPB0_LPM0_LRVW8_LWPMn1_MIAV1_MIWT4_4_MO40_NTn1_NTA0_NTB0_NTC0_NTD0_NTM0_NEPBS0_NLCA1_NLCB1_ONLL0_PGR2_PLR0_PKA0_SIA3_SS1_SU32_SUM0_SUS256_SPO0_SRVW0_SSO0_SVW4_SK0_SKXCCM0_TLDS0_ULSGRO0_USL1_UIOFGRO0_USFGROn1_VSn1_VWA4_VWB4_WSGRA0_WSGRB0_WS32_WG32_4_1_WGM8_WGMXCC1_WGMXCCGn1
    SolutionIndex: 554
    SolutionNameMin: Cijk_Ailk_Bjlk_HSS_BH_Bias_SHB_HA_S_SAB_SCD_SAV_UserArgs_MT128x128x16_MI16x16x1_SN_LDSB0_AFC1_AFEM1_AFEM1_ASEM1_CLR0_CADS0_DTLA0_DTLB0_DTVA0_DTVB0_EPS0_FDSI0_GRPM1_GRVWA4_GRVWB8_GSU1_GSUAMB_GSUC0_GSUWGMRR0_GLS0_ISA1200_IU1_K1_LBSPPA2048_LBSPPB2048_LBSPPM0_LPA0_LPB0_LPM0_LRVW8_LWPMn1_MIAV1_MIWT4_4_MO40_NTn1_NTA0_NTB0_NTC0_NTD0_NTM0_NEPBS0_NLCA1_NLCB1_ONLL0_PGR2_PLR0_PKA0_SIA3_SS1_SU32_SUM0_SUS256_SPO0_SRVW0_SSO0_SVW4_SK0_SKXCCM0_TLDS0_ULSGRO1_USL1_UIOFGRO0_USFGROn1_VSn1_VWA4_VWB4_WSGRA0_WSGRB0_WS32_WG32_4_1_WGM8_WGMXCC1_WGMXCCGn1
    SolutionIndex: 555
    SolutionNameMin: Cijk_Ailk_Bjlk_HSS_BH_Bias_SHB_HA_S_SAB_SCD_SAV_UserArgs_MT128x64x16_MI16x16x1_SN_LDSB0_AFC1_AFEM1_AFEM1_ASEM1_CLR0_CADS0_DTLA0_DTLB0_DTVA0_DTVB0_EPS0_FDSI0_GRPM1_GRVWA8_GRVWB8_GSU1_GSUAMB_GSUC0_GSUWGMRR0_GLS0_ISA1200_IU1_K1_LBSPPA2048_LBSPPB1024_LBSPPM0_LPA0_LPB16_LPM0_LRVW8_LWPMn1_MIAV1_MIWT8_1_MO40_NTn1_NTA0_NTB0_NTC0_NTD0_NTM0_NEPBS0_NLCA1_NLCB1_ONLL0_PGR2_PLR0_PKA0_SIA3_SS1_SU32_SUM0_SUS256_SPO0_SRVW0_SSO0_SVW8_SK0_SKXCCM0_TLDS0_ULSGRO1_USL1_UIOFGRO0_USFGROn1_VSn1_VWA8_VWB1_WSGRA0_WSGRB0_WS32_WG16_8_1_WGM8_WGMXCC1_WGMXCCGn1
    SolutionIndex: 556
    SolutionNameMin: Cijk_Ailk_Bjlk_HSS_BH_Bias_SHB_HA_S_SAB_SCD_SAV_UserArgs_MT128x64x16_MI16x16x1_SN_LDSB0_AFC1_AFEM1_AFEM1_ASEM1_CLR0_CADS0_DTLA0_DTLB0_DTVA0_DTVB0_EPS0_FDSI0_GRPM1_GRVWA8_GRVWB8_GSU1_GSUAMB_GSUC0_GSUWGMRR0_GLS0_ISA1200_IU1_K1_LBSPPA2048_LBSPPB1024_LBSPPM0_LPA0_LPB16_LPM0_LRVW8_LWPMn1_MIAV1_MIWT8_1_MO40_NTn1_NTA0_NTB0_NTC0_NTD0_NTM0_NEPBS0_NLCA1_NLCB1_ONLL0_PGR2_PLR0_PKA0_SIA3_SS1_SU32_SUM0_SUS256_SPO0_SRVW0_SSO0_SVW8_SK0_SKXCCM0_TLDS0_ULSGRO0_USL1_UIOFGRO0_USFGROn1_VSn1_VWA8_VWB1_WSGRA0_WSGRB0_WS32_WG16_8_1_WGM8_WGMXCC1_WGMXCCGn1
    SolutionIndex: 557
    SolutionNameMin: Cijk_Ailk_Bjlk_HSS_BH_Bias_SHB_HA_S_SAB_SCD_SAV_UserArgs_MT64x64x32_MI16x16x1_SN_LDSB1_AFC1_AFEM1_AFEM1_ASEM1_CLR1_CADS0_DTLA0_DTLB0_DTVA0_DTVB0_EPS1_FDSI0_GRPM1_GRVWA1_GRVWB4_GSU1_GSUAMB_GSUC0_GSUWGMRR0_GLS0_ISA1200_IU2_K1_LBSPPA1024_LBSPPB1024_LBSPPM0_LPA32_LPB32_LPM0_LRVW8_LWPMn1_MIAV1_MIWT2_2_MO40_NTn1_NTA0_NTB0_NTC0_NTD0_NTM0_NEPBS0_NLCA1_NLCB1_ONLL0_PGR1_PLR1_PKA0_SIA2_SS1_SU32_SUM0_SUS256_SPO0_SRVW0_SSO0_SVW2_SK0_SKXCCM0_TLDS0_ULSGRO0_USL1_UIOFGRO0_USFGROn1_VSn1_VWA2_VWB2_WSGRA0_WSGRB0_WS32_WG32_4_1_WGM8_WGMXCC1_WGMXCCGn1
    SolutionIndex: 558
    SolutionNameMin: Cijk_Ailk_Bjlk_HSS_BH_Bias_SHB_HA_S_SAB_SCD_SAV_UserArgs_MT64x64x32_MI16x16x1_SN_LDSB0_AFC1_AFEM1_AFEM1_ASEM1_CLR1_CADS0_DTLA0_DTLB0_DTVA0_DTVB0_EPS1_FDSI0_GRPM1_GRVWA8_GRVWB8_GSU1_GSUAMB_GSUC0_GSUWGMRR0_GLS0_ISA1200_IU1_K1_LBSPPA1024_LBSPPB1024_LBSPPM0_LPA32_LPB32_LPM0_LRVW8_LWPMn1_MIAV1_MIWT2_2_MO40_NTn1_NTA0_NTB0_NTC0_NTD0_NTM0_NEPBS0_NLCA1_NLCB1_ONLL0_PGR1_PLR1_PKA0_SIA3_SS1_SU32_SUM0_SUS256_SPO0_SRVW0_SSO0_SVW2_SK0_SKXCCM0_TLDS0_ULSGRO0_USL1_UIOFGRO0_USFGROn1_VSn1_VWA2_VWB2_WSGRA0_WSGRB0_WS32_WG32_4_1_WGM8_WGMXCC1_WGMXCCGn1
    SolutionIndex: 559
    SolutionNameMin: Cijk_Ailk_Bjlk_HSS_BH_Bias_SHB_HA_S_SAB_SCD_SAV_UserArgs_MT64x64x16_MI16x16x1_SN_LDSB1_AFC1_AFEM1_AFEM1_ASEM1_CLR1_CADS0_DTLA0_DTLB0_DTVA0_DTVB0_EPS0_FDSI0_GRPM1_GRVWA8_GRVWB1_GSU1_GSUAMB_GSUC0_GSUWGMRR0_GLS0_ISA1200_IU1_K1_LBSPPA1024_LBSPPB1024_LBSPPM0_LPA32_LPB32_LPM0_LRVW8_LWPMn1_MIAV1_MIWT2_2_MO40_NTn1_NTA0_NTB0_NTC0_NTD0_NTM0_NEPBS0_NLCA1_NLCB1_ONLL0_PGR2_PLR1_PKA0_SIA2_SS1_SU32_SUM0_SUS256_SPO0_SRVW0_SSO0_SVW2_SK0_SKXCCM0_TLDS0_ULSGRO1_USL1_UIOFGRO0_USFGROn1_VSn1_VWA2_VWB2_WSGRA0_WSGRB0_WS32_WG32_4_1_WGM8_WGMXCC1_WGMXCCGn1
    SolutionIndex: 560
    SolutionNameMin: Cijk_Ailk_Bjlk_HSS_BH_Bias_SHB_HA_S_SAB_SCD_SAV_UserArgs_MT128x128x16_MI16x16x1_SN_LDSB0_AFC1_AFEM1_AFEM1_ASEM1_CLR0_CADS0_DTLA0_DTLB0_DTVA0_DTVB0_EPS0_FDSI0_GRPM1_GRVWA1_GRVWB1_GSU1_GSUAMB_GSUC0_GSUWGMRR0_GLS0_ISA1200_IU1_K1_LBSPPA2048_LBSPPB2048_LBSPPM0_LPA0_LPB0_LPM0_LRVW8_LWPMn1_MIAV1_MIWT4_4_MO40_NTn1_NTA0_NTB0_NTC0_NTD0_NTM0_NEPBS0_NLCA1_NLCB1_ONLL0_PGR2_PLR0_PKA0_SIA3_SS1_SU32_SUM0_SUS256_SPO0_SRVW0_SSO0_SVW4_SK0_SKXCCM0_TLDS0_ULSGRO0_USL1_UIOFGRO0_USFGROn1_VSn1_VWA4_VWB4_WSGRA0_WSGRB0_WS32_WG32_4_1_WGM8_WGMXCC1_WGMXCCGn1
    SolutionIndex: 561
    SolutionNameMin: Cijk_Ailk_Bjlk_HSS_BH_Bias_SHB_HA_S_SAB_SCD_SAV_UserArgs_MT128x32x32_MI16x16x1_SN_LDSB0_AFC1_AFEM1_AFEM1_ASEM1_CLR1_CADS0_DTLA0_DTLB0_DTVA1_DTVB1_EPS0_FDSI0_GRPM1_GRVWA8_GRVWB8_GSU1_GSUAMB_GSUC0_GSUWGMRR0_GLS0_ISA1200_IU1_K1_LBSPPA0_LBSPPB0_LBSPPM0_LPA0_LPB0_LPM0_LRVW8_LWPMn1_MIAV1_MIWT4_1_MO40_NTn1_NTA0_NTB0_NTC0_NTD0_NTM0_NEPBS0_NLCA2_NLCB1_ONLL0_PGR1_PLR0_PKA0_SIA3_SS0_SU32_SUM0_SUS256_SPO0_SRVW0_SSO0_SVW8_SK0_SKXCCM0_TLDS0_ULSGRO0_USL1_UIOFGRO0_USFGROn1_VSn1_VWA1_VWB1_WSGRA0_WSGRB0_WS32_WG32_4_1_WGM8_WGMXCC1_WGMXCCGn1
    SolutionIndex: 562
    SolutionNameMin: Cijk_Ailk_Bjlk_HSS_BH_Bias_SHB_HA_S_SAB_SCD_SAV_UserArgs_MT128x128x16_MI16x16x1_SN_LDSB0_AFC1_AFEM1_AFEM1_ASEM1_CLR0_CADS0_DTLA0_DTLB0_DTVA0_DTVB0_EPS0_FDSI0_GRPM1_GRVWA8_GRVWB1_GSU1_GSUAMB_GSUC0_GSUWGMRR0_GLS0_ISA1200_IU1_K1_LBSPPA2048_LBSPPB2048_LBSPPM0_LPA0_LPB0_LPM0_LRVW8_LWPMn1_MIAV1_MIWT4_4_MO40_NTn1_NTA0_NTB0_NTC0_NTD0_NTM0_NEPBS0_NLCA1_NLCB1_ONLL0_PGR2_PLR0_PKA0_SIA3_SS1_SU32_SUM0_SUS256_SPO0_SRVW0_SSO0_SVW4_SK0_SKXCCM0_TLDS0_ULSGRO0_USL1_UIOFGRO0_USFGROn1_VSn1_VWA4_VWB4_WSGRA0_WSGRB0_WS32_WG32_4_1_WGM8_WGMXCC1_WGMXCCGn1
    SolutionIndex: 563
    SolutionNameMin: Cijk_Ailk_Bjlk_HSS_BH_Bias_SHB_HA_S_SAB_SCD_SAV_UserArgs_MT16x256x32_MI16x16x1_SN_LDSB0_AFC1_AFEM1_AFEM1_ASEM1_CLR1_CADS0_DTLA0_DTLB0_DTVA0_DTVB1_EPS0_FDSI0_GRPM1_GRVWA1_GRVWB8_GSU1_GSUAMB_GSUC0_GSUWGMRR0_GLS0_ISA1200_IU1_K1_LBSPPA256_LBSPPB0_LBSPPM0_LPA16_LPB0_LPM0_LRVW8_LWPMn1_MIAV1_MIWT1_8_MO40_NTn1_NTA0_NTB0_NTC0_NTD0_NTM0_NEPBS0_NLCA1_NLCB2_ONLL0_PGR2_PLR1_PKA0_SIA3_SS0_SU32_SUM0_SUS256_SPO0_SRVW0_SSO0_SVW8_SK0_SKXCCM0_TLDS0_ULSGRO0_USL1_UIOFGRO0_USFGROn1_VSn1_VWA1_VWB1_WSGRA0_WSGRB0_WS32_WG16_4_1_WGM8_WGMXCC1_WGMXCCGn1
    SolutionIndex: 564
    SolutionNameMin: Cijk_Ailk_Bjlk_HSS_BH_Bias_SHB_HA_S_SAB_SCD_SAV_UserArgs_MT64x64x32_MI16x16x1_SN_LDSB1_AFC1_AFEM1_AFEM1_ASEM1_CLR1_CADS0_DTLA0_DTLB0_DTVA0_DTVB0_EPS1_FDSI0_GRPM1_GRVWA4_GRVWB8_GSU1_GSUAMB_GSUC0_GSUWGMRR0_GLS0_ISA1200_IU2_K1_LBSPPA1024_LBSPPB1024_LBSPPM0_LPA32_LPB32_LPM0_LRVW8_LWPMn1_MIAV1_MIWT2_2_MO40_NTn1_NTA0_NTB0_NTC0_NTD0_NTM0_NEPBS0_NLCA1_NLCB1_ONLL0_PGR1_PLR1_PKA0_SIA2_SS0_SU32_SUM0_SUS256_SPO0_SRVW0_SSO0_SVW8_SK0_SKXCCM0_TLDS0_ULSGRO0_USL1_UIOFGRO0_USFGROn1_VSn1_VWA2_VWB2_WSGRA0_WSGRB0_WS32_WG32_4_1_WGM8_WGMXCC1_WGMXCCGn1
    SolutionIndex: 565
    SolutionNameMin: Cijk_Ailk_Bjlk_HSS_BH_Bias_SHB_HA_S_SAB_SCD_SAV_UserArgs_MT64x64x64_MI16x16x1_SN_LDSB1_AFC1_AFEM1_AFEM1_ASEM1_CLR1_CADS0_DTLA0_DTLB0_DTVA0_DTVB0_EPS0_FDSI0_GRPM1_GRVWA4_GRVWB8_GSU1_GSUAMB_GSUC0_GSUWGMRR0_GLS0_ISA1200_IU4_K1_LBSPPA1024_LBSPPB1024_LBSPPM0_LPA32_LPB32_LPM0_LRVW8_LWPMn1_MIAV1_MIWT2_2_MO40_NTn1_NTA0_NTB0_NTC0_NTD0_NTM0_NEPBS0_NLCA1_NLCB1_ONLL0_PGR2_PLR1_PKA0_SIA2_SS0_SU32_SUM0_SUS256_SPO0_SRVW0_SSO0_SVW8_SK0_SKXCCM0_TLDS0_ULSGRO1_USL1_UIOFGRO0_USFGROn1_VSn1_VWA2_VWB2_WSGRA0_WSGRB0_WS32_WG32_4_1_WGM8_WGMXCC1_WGMXCCGn1
- - - [512, 512, 1, 64]
    - [263, 1.04]
  - - [1024, 512, 1, 64]
    - [254, 1.91]
  - - [1536, 512, 1, 64]
    - [6, 2764.79]
  - - [2048, 512, 1, 64]
    - [15, 3519.82]
  - - [2560, 512, 1, 64]
    - [7, 4377.96]
  - - [3072, 512, 1, 64]
    - [5, 5057.82]
  - - [512, 1024, 1, 64]
    - [246, 1.85]
  - - [1024, 1024, 1, 64]
    - [324, 3.22]
  - - [1536, 1024, 1, 64]
    - [293, 3.86]
  - - [2048, 1024, 1, 64]
    - [540, 4.38]
  - - [2560, 1024, 1, 64]
    - [4, 7148.67]
  - - [3072, 1024, 1, 64]
    - [4, 7922.19]
  - - [512, 1536, 1, 64]
    - [4, 2895.54]
  - - [1024, 1536, 1, 64]
    - [293, 3.83]
  - - [1536, 1536, 1, 64]
    - [302, 4.9]
  - - [2048, 1536, 1, 64]
    - [284, 5.31]
  - - [2560, 1536, 1, 64]
    - [7, 9019.2]
  - - [3072, 1536, 1, 64]
    - [5, 9848.67]
  - - [512, 2048, 1, 64]
    - [4, 3739.91]
  - - [1024, 2048, 1, 64]
    - [293, 4.64]
  - - [1536, 2048, 1, 64]
    - [324, 5.72]
  - - [2048, 2048, 1, 64]
    - [429, 5.84]
  - - [2560, 2048, 1, 64]
    - [2, 10608.8]
  - - [3072, 2048, 1, 64]
    - [4, 12018.4]
  - - [512, 2560, 1, 64]
    - [5, 4229.73]
  - - [1024, 2560, 1, 64]
    - [4, 7224.09]
  - - [1536, 2560, 1, 64]
    - [5, 8998.24]
  - - [2048, 2560, 1, 64]
    - [1, 10791.5]
  - - [2560, 2560, 1, 64]
    - [5, 12205.3]
  - - [3072, 2560, 1, 64]
    - [3, 12526.4]
  - - [512, 3072, 1, 64]
    - [17, 3995.76]
  - - [1024, 3072, 1, 64]
    - [7, 7679.97]
  - - [1536, 3072, 1, 64]
    - [1, 10270.0]
  - - [2048, 3072, 1, 64]
    - [4, 11815.3]
  - - [2560, 3072, 1, 64]
    - [5, 12965.9]
  - - [3072, 3072, 1, 64]
    - [7, 13879.2]
  - - [512, 512, 1, 256]
    - [334, 3.42]
  - - [1024, 512, 1, 256]
    - [288, 5.93]
  - - [1536, 512, 1, 256]
    - [6, 8778.71]
  - - [2048, 512, 1, 256]
    - [4, 10953.9]
  - - [2560, 512, 1, 256]
    - [15, 12527.3]
  - - [3072, 512, 1, 256]
    - [0, 9610.21]
  - - [512, 1024, 1, 256]
    - [258, 5.88]
  - - [1024, 1024, 1, 256]
    - [288, 8.86]
  - - [1536, 1024, 1, 256]
    - [301, 10.3]
  - - [2048, 1024, 1, 256]
    - [263, 11.69]
  - - [2560, 1024, 1, 256]
    - [4, 18361.3]
  - - [3072, 1024, 1, 256]
    - [13, 19686.5]
  - - [512, 1536, 1, 256]
    - [4, 8780.82]
  - - [1024, 1536, 1, 256]
    - [427, 10.44]
  - - [1536, 1536, 1, 256]
    - [286, 13.11]
  - - [2048, 1536, 1, 256]
    - [314, 13.28]
  - - [2560, 1536, 1, 256]
    - [4, 21248.4]
  - - [3072, 1536, 1, 256]
    - [4, 22807.0]
  - - [512, 2048, 1, 256]
    - [14, 7492.55]
  - - [1024, 2048, 1, 256]
    - [293, 12.04]
  - - [1536, 2048, 1, 256]
    - [307, 14.19]
  - - [2048, 2048, 1, 256]
    - [246, 14.48]
  - - [2560, 2048, 1, 256]
    - [4, 23864.7]
  - - [3072, 2048, 1, 256]
    - [4, 25187.5]
  - - [512, 2560, 1, 256]
    - [4, 12600.2]
  - - [1024, 2560, 1, 256]
    - [15, 18341.3]
  - - [1536, 2560, 1, 256]
    - [4, 21642.2]
  - - [2048, 2560, 1, 256]
    - [4, 23746.5]
  - - [2560, 2560, 1, 256]
    - [4, 25374.1]
  - - [3072, 2560, 1, 256]
    - [4, 26900.8]
  - - [512, 3072, 1, 256]
    - [13, 14040.0]
  - - [1024, 3072, 1, 256]
    - [4, 20017.3]
  - - [1536, 3072, 1, 256]
    - [4, 22886.9]
  - - [2048, 3072, 1, 256]
    - [4, 25132.2]
  - - [2560, 3072, 1, 256]
    - [0, 26647.4]
  - - [3072, 3072, 1, 256]
    - [15, 27327.5]
  - - [512, 512, 1, 512]
    - [402, 5.67]
  - - [1024, 512, 1, 512]
    - [263, 9.58]
  - - [1536, 512, 1, 512]
    - [15, 14221.5]
  - - [2048, 512, 1, 512]
    - [13, 17068.4]
  - - [2560, 512, 1, 512]
    - [15, 18650.2]
  - - [3072, 512, 1, 512]
    - [4, 20663.2]
  - - [512, 1024, 1, 512]
    - [245, 9.31]
  - - [1024, 1024, 1, 512]
    - [323, 13.31]
  - - [1536, 1024, 1, 512]
    - [4, 20655.0]
  - - [2048, 1024, 1, 512]
    - [15, 22773.6]
  - - [2560, 1024, 1, 512]
    - [13, 24229.7]
  - - [3072, 1024, 1, 512]
    - [15, 25706.9]
  - - [512, 1536, 1, 512]
    - [4, 14320.4]
  - - [1024, 1536, 1, 512]
    - [4, 20400.7]
  - - [1536, 1536, 1, 512]
    - [4, 23523.4]
  - - [2048, 1536, 1, 512]
    - [13, 26308.4]
  - - [2560, 1536, 1, 512]
    - [15, 27021.9]
  - - [3072, 1536, 1, 512]
    - [4, 29369.5]
  - - [512, 2048, 1, 512]
    - [4, 16680.5]
  - - [1024, 2048, 1, 512]
    - [15, 22463.2]
  - - [1536, 2048, 1, 512]
    - [13, 25764.7]
  - - [2048, 2048, 1, 512]
    - [4, 27882.2]
  - - [2560, 2048, 1, 512]
    - [4, 29294.8]
  - - [3072, 2048, 1, 512]
    - [13, 30521.8]
  - - [512, 2560, 1, 512]
    - [15, 18251.5]
  - - [1024, 2560, 1, 512]
    - [13, 19232.6]
  - - [1536, 2560, 1, 512]
    - [13, 27498.9]
  - - [2048, 2560, 1, 512]
    - [15, 29866.3]
  - - [2560, 2560, 1, 512]
    - [15, 30820.6]
  - - [3072, 2560, 1, 512]
    - [4, 32075.9]
  - - [512, 3072, 1, 512]
    - [17, 15962.5]
  - - [1024, 3072, 1, 512]
    - [13, 25657.7]
  - - [1536, 3072, 1, 512]
    - [13, 28584.3]
  - - [2048, 3072, 1, 512]
    - [4, 30594.4]
  - - [2560, 3072, 1, 512]
    - [0, 30950.8]
  - - [3072, 3072, 1, 512]
    - [13, 32420.7]
  - - [512, 512, 1, 1024]
    - [265, 8.55]
  - - [1024, 512, 1, 1024]
    - [296, 14.57]
  - - [1536, 512, 1, 1024]
    - [4, 20059.7]
  - - [2048, 512, 1, 1024]
    - [15, 22638.7]
  - - [2560, 512, 1, 1024]
    - [16, 23365.2]
  - - [3072, 512, 1, 1024]
    - [4, 26126.8]
  - - [512, 1024, 1, 1024]
    - [459, 14.26]
  - - [1024, 1024, 1, 1024]
    - [461, 17.06]
  - - [1536, 1024, 1, 1024]
    - [452, 19.51]
  - - [2048, 1024, 1, 1024]
    - [480, 19.12]
  - - [2560, 1024, 1, 1024]
    - [4, 29343.0]
  - - [3072, 1024, 1, 1024]
    - [15, 30870.5]
  - - [512, 1536, 1, 1024]
    - [15, 19795.4]
  - - [1024, 1536, 1, 1024]
    - [390, 19.34]
  - - [1536, 1536, 1, 1024]
    - [471, 19.73]
  - - [2048, 1536, 1, 1024]
    - [486, 21.84]
  - - [2560, 1536, 1, 1024]
    - [15, 32041.5]
  - - [3072, 1536, 1, 1024]
    - [4, 32160.4]
  - - [512, 2048, 1, 1024]
    - [15, 23000.9]
  - - [1024, 2048, 1, 1024]
    - [390, 21.19]
  - - [1536, 2048, 1, 1024]
    - [390, 20.59]
  - - [2048, 2048, 1, 1024]
    - [390, 21.84]
  - - [2560, 2048, 1, 1024]
    - [0, 33207.0]
  - - [3072, 2048, 1, 1024]
    - [0, 34410.8]
  - - [512, 2560, 1, 1024]
    - [15, 19293.7]
  - - [1024, 2560, 1, 1024]
    - [16, 28586.9]
  - - [1536, 2560, 1, 1024]
    - [4, 31516.4]
  - - [2048, 2560, 1, 1024]
    - [4, 32695.5]
  - - [2560, 2560, 1, 1024]
    - [13, 33584.5]
  - - [3072, 2560, 1, 1024]
    - [4, 34444.3]
  - - [512, 3072, 1, 1024]
    - [4, 26250.5]
  - - [1024, 3072, 1, 1024]
    - [13, 30288.9]
  - - [1536, 3072, 1, 1024]
    - [15, 32653.5]
  - - [2048, 3072, 1, 1024]
    - [15, 34049.1]
  - - [2560, 3072, 1, 1024]
    - [13, 34721.0]
  - - [3072, 3072, 1, 1024]
    - [4, 34981.8]
  - - [512, 512, 1, 2048]
    - [335, 14.02]
  - - [1024, 512, 1, 2048]
    - [314, 19.1]
  - - [1536, 512, 1, 2048]
    - [15, 24494.7]
  - - [2048, 512, 1, 2048]
    - [4, 27958.6]
  - - [2560, 512, 1, 2048]
    - [13, 28495.7]
  - - [3072, 512, 1, 2048]
    - [15, 29965.7]
  - - [512, 1024, 1, 2048]
    - [460, 18.77]
  - - [1024, 1024, 1, 2048]
    - [480, 21.16]
  - - [1536, 1024, 1, 2048]
    - [15, 30559.4]
  - - [2048, 1024, 1, 2048]
    - [15, 31352.9]
  - - [2560, 1024, 1, 2048]
    - [13, 32903.2]
  - - [3072, 1024, 1, 2048]
    - [15, 34230.3]
  - - [512, 1536, 1, 2048]
    - [15, 24394.2]
  - - [1024, 1536, 1, 2048]
    - [4, 29957.4]
  - - [1536, 1536, 1, 2048]
    - [4, 32132.4]
  - - [2048, 1536, 1, 2048]
    - [4, 32967.6]
  - - [2560, 1536, 1, 2048]
    - [15, 34108.8]
  - - [3072, 1536, 1, 2048]
    - [4, 35303.1]
  - - [512, 2048, 1, 2048]
    - [15, 27543.7]
  - - [1024, 2048, 1, 2048]
    - [15, 31852.7]
  - - [1536, 2048, 1, 2048]
    - [4, 33429.5]
  - - [2048, 2048, 1, 2048]
    - [486, 25.1]
  - - [2560, 2048, 1, 2048]
    - [15, 35012.8]
  - - [3072, 2048, 1, 2048]
    - [4, 34927.5]
  - - [512, 2560, 1, 2048]
    - [15, 28473.1]
  - - [1024, 2560, 1, 2048]
    - [13, 32443.1]
  - - [1536, 2560, 1, 2048]
    - [15, 33703.4]
  - - [2048, 2560, 1, 2048]
    - [15, 34952.8]
  - - [2560, 2560, 1, 2048]
    - [15, 35427.5]
  - - [3072, 2560, 1, 2048]
    - [15, 35568.4]
  - - [512, 3072, 1, 2048]
    - [0, 30643.9]
  - - [1024, 3072, 1, 2048]
    - [4, 33135.0]
  - - [1536, 3072, 1, 2048]
    - [15, 35086.0]
  - - [2048, 3072, 1, 2048]
    - [13, 35286.5]
  - - [2560, 3072, 1, 2048]
    - [4, 35540.8]
  - - [3072, 3072, 1, 2048]
    - [15, 35994.4]
  - - [512, 512, 1, 3072]
    - [9, 17907.8]
  - - [1024, 512, 1, 3072]
    - [13, 25523.4]
  - - [1536, 512, 1, 3072]
    - [15, 26395.7]
  - - [2048, 512, 1, 3072]
    - [13, 29236.7]
  - - [2560, 512, 1, 3072]
    - [4, 30260.9]
  - - [3072, 512, 1, 3072]
    - [15, 31219.3]
  - - [512, 1024, 1, 3072]
    - [2, 24676.9]
  - - [1024, 1024, 1, 3072]
    - [15, 29555.2]
  - - [1536, 1024, 1, 3072]
    - [4, 31553.2]
  - - [2048, 1024, 1, 3072]
    - [4, 32571.0]
  - - [2560, 1024, 1, 3072]
    - [13, 33635.7]
  - - [3072, 1024, 1, 3072]
    - [0, 34003.7]
  - - [512, 1536, 1, 3072]
    - [4, 26965.3]
  - - [1024, 1536, 1, 3072]
    - [13, 31697.3]
  - - [1536, 1536, 1, 3072]
    - [15, 33471.2]
  - - [2048, 1536, 1, 3072]
    - [15, 34142.1]
  - - [2560, 1536, 1, 3072]
    - [4, 34520.7]
  - - [3072, 1536, 1, 3072]
    - [0, 35005.5]
  - - [512, 2048, 1, 3072]
    - [0, 30031.5]
  - - [1024, 2048, 1, 3072]
    - [15, 33287.7]
  - - [1536, 2048, 1, 3072]
    - [13, 34538.9]
  - - [2048, 2048, 1, 3072]
    - [4, 34890.2]
  - - [2560, 2048, 1, 3072]
    - [15, 35540.9]
  - - [3072, 2048, 1, 3072]
    - [15, 35493.7]
  - - [512, 2560, 1, 3072]
    - [15, 30412.2]
  - - [1024, 2560, 1, 3072]
    - [13, 34182.2]
  - - [1536, 2560, 1, 3072]
    - [4, 34612.4]
  - - [2048, 2560, 1, 3072]
    - [4, 34945.9]
  - - [2560, 2560, 1, 3072]
    - [15, 35803.3]
  - - [3072, 2560, 1, 3072]
    - [0, 35815.1]
  - - [512, 3072, 1, 3072]
    - [0, 32031.1]
  - - [1024, 3072, 1, 3072]
    - [15, 33794.0]
  - - [1536, 3072, 1, 3072]
    - [0, 34947.1]
  - - [2048, 3072, 1, 3072]
    - [15, 35799.6]
  - - [2560, 3072, 1, 3072]
    - [0, 35674.7]
  - - [3072, 3072, 1, 3072]
    - [452, 27.05]
  - - [1, 1, 1, 1]
    - [515, 0.0]
  - - [1, 1, 1, 64]
    - [12, 0.004]
  - - [1, 64, 1, 1]
    - [11, 0.00423883]
  - - [64, 1, 1, 1]
    - [11, 0.00425858]
  - - [64, 64, 1, 1]
    - [8, 0.269323]
  - - [64, 1, 1, 64]
    - [10, 0.267914]
  - - [1, 64, 1, 64]
    - [12, 0.266945]
  - - [64, 64, 1, 64]
    - [160, 0.02]
  - - [64, 64, 1, 256]
    - [325, 0.07]
  - - [64, 64, 1, 512]
    - [327, 0.15]
  - - [64, 64, 1, 1024]
    - [333, 0.26]
  - - [64, 64, 1, 2048]
    - [437, 0.44]
  - - [64, 64, 1, 4096]
    - [436, 0.72]
  - - [256, 256, 1, 256]
    - [331, 1.07]
  - - [4096, 4096, 1, 4096]
    - [511, 24.26]
  - - [320, 64, 1, 64]
    - [164, 0.1]
  - - [576, 64, 1, 64]
    - [168, 0.17]
  - - [832, 64, 1, 64]
    - [172, 0.24]
  - - [1088, 64, 1, 64]
    - [489, 0.3]
  - - [1344, 64, 1, 64]
    - [197, 0.37]
  - - [1600, 64, 1, 64]
    - [343, 0.44]
  - - [1856, 64, 1, 64]
    - [198, 0.51]
  - - [2112, 64, 1, 64]
    - [501, 0.57]
  - - [2368, 64, 1, 64]
    - [379, 0.63]
  - - [2624, 64, 1, 64]
    - [321, 0.7]
  - - [2880, 64, 1, 64]
    - [185, 0.77]
  - - [3136, 64, 1, 64]
    - [315, 0.81]
  - - [3392, 64, 1, 64]
    - [257, 0.86]
  - - [3648, 64, 1, 64]
    - [199, 0.94]
  - - [3904, 64, 1, 64]
    - [280, 1.0]
  - - [64, 320, 1, 64]
    - [218, 0.1]
  - - [320, 320, 1, 64]
    - [221, 0.44]
  - - [576, 320, 1, 64]
    - [224, 0.76]
  - - [832, 320, 1, 64]
    - [228, 1.02]
  - - [1088, 320, 1, 64]
    - [216, 1.26]
  - - [1344, 320, 1, 64]
    - [272, 1.51]
  - - [1600, 320, 1, 64]
    - [256, 1.73]
  - - [1856, 320, 1, 64]
    - [230, 1.9]
  - - [2112, 320, 1, 64]
    - [256, 2.08]
  - - [2368, 320, 1, 64]
    - [257, 2.25]
  - - [2624, 320, 1, 64]
    - [230, 2.43]
  - - [2880, 320, 1, 64]
    - [230, 2.59]
  - - [3136, 320, 1, 64]
    - [230, 2.72]
  - - [3392, 320, 1, 64]
    - [198, 2.85]
  - - [3648, 320, 1, 64]
    - [230, 3.0]
  - - [3904, 320, 1, 64]
    - [257, 3.17]
  - - [64, 576, 1, 64]
    - [268, 0.17]
  - - [320, 576, 1, 64]
    - [182, 0.77]
  - - [576, 576, 1, 64]
    - [272, 1.26]
  - - [832, 576, 1, 64]
    - [273, 1.64]
  - - [1088, 576, 1, 64]
    - [312, 2.01]
  - - [1344, 576, 1, 64]
    - [257, 2.26]
  - - [1600, 576, 1, 64]
    - [230, 2.54]
  - - [1856, 576, 1, 64]
    - [230, 2.86]
  - - [2112, 576, 1, 64]
    - [230, 3.06]
  - - [2368, 576, 1, 64]
    - [198, 3.24]
  - - [2624, 576, 1, 64]
    - [230, 3.46]
  - - [2880, 576, 1, 64]
    - [230, 3.67]
  - - [3136, 576, 1, 64]
    - [230, 3.73]
  - - [3392, 576, 1, 64]
    - [230, 4.05]
  - - [3648, 576, 1, 64]
    - [230, 4.16]
  - - [3904, 576, 1, 64]
    - [257, 4.13]
  - - [64, 832, 1, 64]
    - [303, 0.24]
  - - [320, 832, 1, 64]
    - [228, 1.02]
  - - [576, 832, 1, 64]
    - [308, 1.63]
  - - [832, 832, 1, 64]
    - [235, 2.09]
  - - [1088, 832, 1, 64]
    - [299, 2.55]
  - - [1344, 832, 1, 64]
    - [198, 2.9]
  - - [1600, 832, 1, 64]
    - [230, 3.26]
  - - [1856, 832, 1, 64]
    - [230, 3.5]
  - - [2112, 832, 1, 64]
    - [257, 3.83]
  - - [2368, 832, 1, 64]
    - [230, 4.02]
  - - [2624, 832, 1, 64]
    - [230, 4.2]
  - - [2880, 832, 1, 64]
    - [257, 4.39]
  - - [3136, 832, 1, 64]
    - [230, 4.66]
  - - [3392, 832, 1, 64]
    - [257, 4.69]
  - - [3648, 832, 1, 64]
    - [257, 4.85]
  - - [3904, 832, 1, 64]
    - [257, 4.97]
  - - [64, 1088, 1, 64]
    - [273, 0.31]
  - - [320, 1088, 1, 64]
    - [287, 1.27]
  - - [576, 1088, 1, 64]
    - [249, 1.96]
  - - [832, 1088, 1, 64]
    - [257, 2.52]
  - - [1088, 1088, 1, 64]
    - [257, 3.05]
  - - [1344, 1088, 1, 64]
    - [257, 3.4]
  - - [1600, 1088, 1, 64]
    - [257, 3.77]
  - - [1856, 1088, 1, 64]
    - [230, 4.03]
  - - [2112, 1088, 1, 64]
    - [230, 4.22]
  - - [2368, 1088, 1, 64]
    - [230, 4.39]
  - - [2624, 1088, 1, 64]
    - [230, 4.66]
  - - [2880, 1088, 1, 64]
    - [257, 4.9]
  - - [3136, 1088, 1, 64]
    - [319, 4.9]
  - - [3392, 1088, 1, 64]
    - [257, 5.14]
  - - [3648, 1088, 1, 64]
    - [230, 5.32]
  - - [3904, 1088, 1, 64]
    - [230, 5.43]
  - - [64, 1344, 1, 64]
    - [482, 0.37]
  - - [320, 1344, 1, 64]
    - [430, 1.51]
  - - [576, 1344, 1, 64]
    - [257, 2.27]
  - - [832, 1344, 1, 64]
    - [257, 2.88]
  - - [1088, 1344, 1, 64]
    - [230, 3.45]
  - - [1344, 1344, 1, 64]
    - [230, 3.76]
  - - [1600, 1344, 1, 64]
    - [257, 4.17]
  - - [1856, 1344, 1, 64]
    - [230, 4.38]
  - - [2112, 1344, 1, 64]
    - [496, 4.55]
  - - [2368, 1344, 1, 64]
    - [230, 4.91]
  - - [2624, 1344, 1, 64]
    - [257, 5.05]
  - - [2880, 1344, 1, 64]
    - [257, 5.35]
  - - [3136, 1344, 1, 64]
    - [496, 5.31]
  - - [3392, 1344, 1, 64]
    - [314, 5.58]
  - - [3648, 1344, 1, 64]
    - [245, 5.8]
  - - [3904, 1344, 1, 64]
    - [246, 6.05]
  - - [64, 1600, 1, 64]
    - [499, 0.48]
  - - [320, 1600, 1, 64]
    - [272, 1.86]
  - - [576, 1600, 1, 64]
    - [230, 2.73]
  - - [832, 1600, 1, 64]
    - [257, 3.24]
  - - [1088, 1600, 1, 64]
    - [257, 3.88]
  - - [1344, 1600, 1, 64]
    - [230, 4.27]
  - - [1600, 1600, 1, 64]
    - [230, 4.54]
  - - [1856, 1600, 1, 64]
    - [257, 4.68]
  - - [2112, 1600, 1, 64]
    - [230, 5.13]
  - - [2368, 1600, 1, 64]
    - [555, 5.25]
  - - [2624, 1600, 1, 64]
    - [230, 5.5]
  - - [2880, 1600, 1, 64]
    - [528, 5.62]
  - - [3136, 1600, 1, 64]
    - [556, 5.77]
  - - [3392, 1600, 1, 64]
    - [319, 5.87]
  - - [3648, 1600, 1, 64]
    - [257, 6.06]
  - - [3904, 1600, 1, 64]
    - [316, 6.16]
  - - [64, 1856, 1, 64]
    - [500, 0.51]
  - - [320, 1856, 1, 64]
    - [386, 1.96]
  - - [576, 1856, 1, 64]
    - [203, 2.81]
  - - [832, 1856, 1, 64]
    - [230, 3.53]
  - - [1088, 1856, 1, 64]
    - [257, 4.09]
  - - [1344, 1856, 1, 64]
    - [230, 4.58]
  - - [1600, 1856, 1, 64]
    - [257, 5.0]
  - - [1856, 1856, 1, 64]
    - [230, 5.06]
  - - [2112, 1856, 1, 64]
    - [230, 5.46]
  - - [2368, 1856, 1, 64]
    - [230, 5.61]
  - - [2624, 1856, 1, 64]
    - [246, 5.64]
  - - [2880, 1856, 1, 64]
    - [316, 6.02]
  - - [3136, 1856, 1, 64]
    - [246, 6.26]
  - - [3392, 1856, 1, 64]
    - [554, 6.22]
  - - [3648, 1856, 1, 64]
    - [528, 6.43]
  - - [3904, 1856, 1, 64]
    - [246, 6.58]
  - - [64, 2112, 1, 64]
    - [557, 0.57]
  - - [320, 2112, 1, 64]
    - [430, 2.1]
  - - [576, 2112, 1, 64]
    - [257, 3.06]
  - - [832, 2112, 1, 64]
    - [257, 3.71]
  - - [1088, 2112, 1, 64]
    - [230, 4.37]
  - - [1344, 2112, 1, 64]
    - [230, 4.74]
  - - [1600, 2112, 1, 64]
    - [324, 4.81]
  - - [1856, 2112, 1, 64]
    - [230, 5.24]
  - - [2112, 2112, 1, 64]
    - [230, 5.5]
  - - [2368, 2112, 1, 64]
    - [544, 5.8]
  - - [2624, 2112, 1, 64]
    - [246, 6.13]
  - - [2880, 2112, 1, 64]
    - [319, 6.26]
  - - [3136, 2112, 1, 64]
    - [296, 6.44]
  - - [3392, 2112, 1, 64]
    - [319, 6.68]
  - - [3648, 2112, 1, 64]
    - [301, 6.66]
  - - [3904, 2112, 1, 64]
    - [317, 6.79]
  - - [64, 2368, 1, 64]
    - [558, 0.63]
  - - [320, 2368, 1, 64]
    - [559, 2.25]
  - - [576, 2368, 1, 64]
    - [203, 3.14]
  - - [832, 2368, 1, 64]
    - [230, 4.01]
  - - [1088, 2368, 1, 64]
    - [230, 4.54]
  - - [1344, 2368, 1, 64]
    - [230, 4.74]
  - - [1600, 2368, 1, 64]
    - [257, 5.19]
  - - [1856, 2368, 1, 64]
    - [314, 5.53]
  - - [2112, 2368, 1, 64]
    - [314, 5.67]
  - - [2368, 2368, 1, 64]
    - [288, 5.96]
  - - [2624, 2368, 1, 64]
    - [246, 6.23]
  - - [2880, 2368, 1, 64]
    - [316, 6.48]
  - - [3136, 2368, 1, 64]
    - [544, 6.64]
  - - [3392, 2368, 1, 64]
    - [427, 6.63]
  - - [3648, 2368, 1, 64]
    - [288, 6.48]
  - - [3904, 2368, 1, 64]
    - [525, 5.2]
  - - [64, 2624, 1, 64]
    - [273, 0.76]
  - - [320, 2624, 1, 64]
    - [257, 2.52]
  - - [576, 2624, 1, 64]
    - [257, 3.5]
  - - [832, 2624, 1, 64]
    - [257, 4.19]
  - - [1088, 2624, 1, 64]
    - [230, 4.67]
  - - [1344, 2624, 1, 64]
    - [257, 5.02]
  - - [1600, 2624, 1, 64]
    - [230, 5.54]
  - - [1856, 2624, 1, 64]
    - [246, 5.85]
  - - [2112, 2624, 1, 64]
    - [246, 5.82]
  - - [2368, 2624, 1, 64]
    - [319, 6.19]
  - - [2624, 2624, 1, 64]
    - [324, 6.58]
  - - [2880, 2624, 1, 64]
    - [254, 6.56]
  - - [3136, 2624, 1, 64]
    - [267, 6.67]
  - - [3392, 2624, 1, 64]
    - [246, 5.91]
  - - [3648, 2624, 1, 64]
    - [555, 4.5]
  - - [3904, 2624, 1, 64]
    - [257, 3.76]
  - - [64, 2880, 1, 64]
    - [199, 0.8]
  - - [320, 2880, 1, 64]
    - [230, 2.65]
  - - [576, 2880, 1, 64]
    - [257, 3.67]
  - - [832, 2880, 1, 64]
    - [257, 4.34]
  - - [1088, 2880, 1, 64]
    - [230, 4.87]
  - - [1344, 2880, 1, 64]
    - [257, 5.24]
  - - [1600, 2880, 1, 64]
    - [302, 5.57]
  - - [1856, 2880, 1, 64]
    - [319, 5.94]
  - - [2112, 2880, 1, 64]
    - [246, 6.06]
  - - [2368, 2880, 1, 64]
    - [560, 6.46]
  - - [2624, 2880, 1, 64]
    - [307, 6.57]
  - - [2880, 2880, 1, 64]
    - [560, 6.63]
  - - [3136, 2880, 1, 64]
    - [556, 5.56]
  - - [3392, 2880, 1, 64]
    - [257, 4.25]
  - - [3648, 2880, 1, 64]
    - [196, 3.67]
  - - [3904, 2880, 1, 64]
    - [227, 3.16]
  - - [64, 3136, 1, 64]
    - [216, 0.88]
  - - [320, 3136, 1, 64]
    - [257, 2.74]
  - - [576, 3136, 1, 64]
    - [257, 3.86]
  - - [832, 3136, 1, 64]
    - [230, 4.43]
  - - [1088, 3136, 1, 64]
    - [257, 5.01]
  - - [1344, 3136, 1, 64]
    - [230, 5.4]
  - - [1600, 3136, 1, 64]
    - [246, 5.75]
  - - [1856, 3136, 1, 64]
    - [246, 6.19]
  - - [2112, 3136, 1, 64]
    - [552, 6.54]
  - - [2368, 3136, 1, 64]
    - [314, 6.75]
  - - [2624, 3136, 1, 64]
    - [288, 6.67]
  - - [2880, 3136, 1, 64]
    - [263, 5.76]
  - - [3136, 3136, 1, 64]
    - [548, 4.21]
  - - [3392, 3136, 1, 64]
    - [257, 3.52]
  - - [3648, 3136, 1, 64]
    - [227, 3.19]
  - - [3904, 3136, 1, 64]
    - [360, 2.87]
  - - [64, 3392, 1, 64]
    - [223, 0.95]
  - - [320, 3392, 1, 64]
    - [257, 2.86]
  - - [576, 3392, 1, 64]
    - [257, 3.98]
  - - [832, 3392, 1, 64]
    - [230, 4.73]
  - - [1088, 3392, 1, 64]
    - [230, 5.21]
  - - [1344, 3392, 1, 64]
    - [254, 5.56]
  - - [1600, 3392, 1, 64]
    - [230, 5.85]
  - - [1856, 3392, 1, 64]
    - [246, 6.34]
  - - [2112, 3392, 1, 64]
    - [544, 6.58]
  - - [2368, 3392, 1, 64]
    - [528, 6.67]
  - - [2624, 3392, 1, 64]
    - [246, 6.02]
  - - [2880, 3392, 1, 64]
    - [507, 4.36]
  - - [3136, 3392, 1, 64]
    - [507, 3.54]
  - - [3392, 3392, 1, 64]
    - [517, 3.12]
  - - [3648, 3392, 1, 64]
    - [227, 2.94]
  - - [3904, 3392, 1, 64]
    - [360, 2.68]
  - - [64, 3648, 1, 64]
    - [265, 1.0]
  - - [320, 3648, 1, 64]
    - [230, 3.01]
  - - [576, 3648, 1, 64]
    - [257, 4.29]
  - - [832, 3648, 1, 64]
    - [257, 4.9]
  - - [1088, 3648, 1, 64]
    - [230, 5.28]
  - - [1344, 3648, 1, 64]
    - [319, 5.53]
  - - [1600, 3648, 1, 64]
    - [319, 6.09]
  - - [1856, 3648, 1, 64]
    - [246, 6.55]
  - - [2112, 3648, 1, 64]
    - [316, 6.52]
  - - [2368, 3648, 1, 64]
    - [316, 6.39]
  - - [2624, 3648, 1, 64]
    - [494, 4.61]
  - - [2880, 3648, 1, 64]
    - [257, 3.58]
  - - [3136, 3648, 1, 64]
    - [227, 3.16]
  - - [3392, 3648, 1, 64]
    - [360, 2.88]
  - - [3648, 3648, 1, 64]
    - [196, 2.81]
  - - [3904, 3648, 1, 64]
    - [517, 2.61]
  - - [64, 3904, 1, 64]
    - [265, 1.0]
  - - [320, 3904, 1, 64]
    - [203, 3.09]
  - - [576, 3904, 1, 64]
    - [256, 4.19]
  - - [832, 3904, 1, 64]
    - [230, 4.99]
  - - [1088, 3904, 1, 64]
    - [314, 5.25]
  - - [1344, 3904, 1, 64]
    - [314, 5.7]
  - - [1600, 3904, 1, 64]
    - [544, 6.13]
  - - [1856, 3904, 1, 64]
    - [316, 6.52]
  - - [2112, 3904, 1, 64]
    - [245, 6.52]
  - - [2368, 3904, 1, 64]
    - [230, 5.03]
  - - [2624, 3904, 1, 64]
    - [257, 3.72]
  - - [2880, 3904, 1, 64]
    - [227, 3.2]
  - - [3136, 3904, 1, 64]
    - [196, 2.91]
  - - [3392, 3904, 1, 64]
    - [533, 2.73]
  - - [3648, 3904, 1, 64]
    - [535, 2.71]
  - - [3904, 3904, 1, 64]
    - [561, 2.53]
  - - [320, 64, 1, 256]
    - [320, 0.36]
  - - [576, 64, 1, 256]
    - [331, 0.62]
  - - [832, 64, 1, 256]
    - [334, 0.87]
  - - [1088, 64, 1, 256]
    - [331, 1.12]
  - - [1344, 64, 1, 256]
    - [335, 1.39]
  - - [1600, 64, 1, 256]
    - [334, 1.57]
  - - [1856, 64, 1, 256]
    - [249, 1.84]
  - - [2112, 64, 1, 256]
    - [228, 1.98]
  - - [2368, 64, 1, 256]
    - [357, 2.18]
  - - [2624, 64, 1, 256]
    - [379, 2.41]
  - - [2880, 64, 1, 256]
    - [382, 2.64]
  - - [3136, 64, 1, 256]
    - [363, 2.75]
  - - [3392, 64, 1, 256]
    - [275, 2.92]
  - - [3648, 64, 1, 256]
    - [363, 3.1]
  - - [3904, 64, 1, 256]
    - [363, 3.31]
  - - [64, 320, 1, 256]
    - [344, 0.36]
  - - [320, 320, 1, 256]
    - [342, 1.59]
  - - [576, 320, 1, 256]
    - [362, 2.59]
  - - [832, 320, 1, 256]
    - [363, 3.37]
  - - [1088, 320, 1, 256]
    - [382, 3.99]
  - - [1344, 320, 1, 256]
    - [372, 4.71]
  - - [1600, 320, 1, 256]
    - [359, 5.18]
  - - [1856, 320, 1, 256]
    - [228, 5.67]
  - - [2112, 320, 1, 256]
    - [265, 6.17]
  - - [2368, 320, 1, 256]
    - [359, 6.7]
  - - [2624, 320, 1, 256]
    - [228, 7.09]
  - - [2880, 320, 1, 256]
    - [359, 7.31]
  - - [3136, 320, 1, 256]
    - [228, 7.62]
  - - [3392, 320, 1, 256]
    - [228, 7.94]
  - - [3648, 320, 1, 256]
    - [379, 8.37]
  - - [3904, 320, 1, 256]
    - [192, 8.27]
  - - [64, 576, 1, 256]
    - [383, 0.62]
  - - [320, 576, 1, 256]
    - [377, 2.58]
  - - [576, 576, 1, 256]
    - [386, 3.91]
  - - [832, 576, 1, 256]
    - [228, 5.04]
  - - [1088, 576, 1, 256]
    - [359, 5.92]
  - - [1344, 576, 1, 256]
    - [249, 6.88]
  - - [1600, 576, 1, 256]
    - [359, 7.36]
  - - [1856, 576, 1, 256]
    - [228, 7.84]
  - - [2112, 576, 1, 256]
    - [240, 8.32]
  - - [2368, 576, 1, 256]
    - [228, 8.81]
  - - [2624, 576, 1, 256]
    - [228, 8.93]
  - - [2880, 576, 1, 256]
    - [430, 9.45]
  - - [3136, 576, 1, 256]
    - [228, 9.77]
  - - [3392, 576, 1, 256]
    - [455, 9.88]
  - - [3648, 576, 1, 256]
    - [359, 10.49]
  - - [3904, 576, 1, 256]
    - [265, 10.4]
  - - [64, 832, 1, 256]
    - [331, 0.86]
  - - [320, 832, 1, 256]
    - [359, 3.41]
  - - [576, 832, 1, 256]
    - [231, 4.94]
  - - [832, 832, 1, 256]
    - [359, 6.19]
  - - [1088, 832, 1, 256]
    - [228, 7.19]
  - - [1344, 832, 1, 256]
    - [379, 7.93]
  - - [1600, 832, 1, 256]
    - [359, 8.64]
  - - [1856, 832, 1, 256]
    - [228, 9.76]
  - - [2112, 832, 1, 256]
    - [265, 9.92]
  - - [2368, 832, 1, 256]
    - [228, 10.29]
  - - [2624, 832, 1, 256]
    - [378, 10.4]
  - - [2880, 832, 1, 256]
    - [359, 10.86]
  - - [3136, 832, 1, 256]
    - [228, 11.24]
  - - [3392, 832, 1, 256]
    - [359, 11.31]
  - - [3648, 832, 1, 256]
    - [372, 11.34]
  - - [3904, 832, 1, 256]
    - [245, 11.66]
  - - [64, 1088, 1, 256]
    - [249, 1.16]
  - - [320, 1088, 1, 256]
    - [287, 4.18]
  - - [576, 1088, 1, 256]
    - [369, 5.88]
  - - [832, 1088, 1, 256]
    - [373, 7.27]
  - - [1088, 1088, 1, 256]
    - [228, 8.18]
  - - [1344, 1088, 1, 256]
    - [379, 8.96]
  - - [1600, 1088, 1, 256]
    - [359, 9.57]
  - - [1856, 1088, 1, 256]
    - [182, 10.06]
  - - [2112, 1088, 1, 256]
    - [347, 10.89]
  - - [2368, 1088, 1, 256]
    - [286, 11.06]
  - - [2624, 1088, 1, 256]
    - [461, 11.29]
  - - [2880, 1088, 1, 256]
    - [317, 11.95]
  - - [3136, 1088, 1, 256]
    - [319, 12.06]
  - - [3392, 1088, 1, 256]
    - [307, 12.1]
  - - [3648, 1088, 1, 256]
    - [317, 12.52]
  - - [3904, 1088, 1, 256]
    - [307, 12.79]
  - - [64, 1344, 1, 256]
    - [252, 1.33]
  - - [320, 1344, 1, 256]
    - [182, 4.75]
  - - [576, 1344, 1, 256]
    - [359, 6.71]
  - - [832, 1344, 1, 256]
    - [287, 8.16]
  - - [1088, 1344, 1, 256]
    - [315, 8.99]
  - - [1344, 1344, 1, 256]
    - [287, 9.88]
  - - [1600, 1344, 1, 256]
    - [371, 10.26]
  - - [1856, 1344, 1, 256]
    - [228, 11.09]
  - - [2112, 1344, 1, 256]
    - [263, 11.52]
  - - [2368, 1344, 1, 256]
    - [373, 11.61]
  - - [2624, 1344, 1, 256]
    - [317, 12.11]
  - - [2880, 1344, 1, 256]
    - [288, 12.64]
  - - [3136, 1344, 1, 256]
    - [286, 12.63]
  - - [3392, 1344, 1, 256]
    - [263, 13.1]
  - - [3648, 1344, 1, 256]
    - [263, 13.12]
  - - [3904, 1344, 1, 256]
    - [317, 13.54]
  - - [64, 1600, 1, 256]
    - [363, 1.59]
  - - [320, 1600, 1, 256]
    - [315, 5.16]
  - - [576, 1600, 1, 256]
    - [265, 7.27]
  - - [832, 1600, 1, 256]
    - [265, 8.58]
  - - [1088, 1600, 1, 256]
    - [359, 9.55]
  - - [1344, 1600, 1, 256]
    - [379, 10.61]
  - - [1600, 1600, 1, 256]
    - [228, 11.27]
  - - [1856, 1600, 1, 256]
    - [265, 11.14]
  - - [2112, 1600, 1, 256]
    - [347, 11.92]
  - - [2368, 1600, 1, 256]
    - [314, 12.17]
  - - [2624, 1600, 1, 256]
    - [284, 12.75]
  - - [2880, 1600, 1, 256]
    - [288, 13.0]
  - - [3136, 1600, 1, 256]
    - [258, 13.48]
  - - [3392, 1600, 1, 256]
    - [529, 13.68]
  - - [3648, 1600, 1, 256]
    - [258, 13.97]
  - - [3904, 1600, 1, 256]
    - [317, 14.24]
  - - [64, 1856, 1, 256]
    - [363, 1.78]
  - - [320, 1856, 1, 256]
    - [382, 5.69]
  - - [576, 1856, 1, 256]
    - [228, 7.86]
  - - [832, 1856, 1, 256]
    - [265, 9.57]
  - - [1088, 1856, 1, 256]
    - [488, 10.27]
  - - [1344, 1856, 1, 256]
    - [379, 11.22]
  - - [1600, 1856, 1, 256]
    - [373, 11.53]
  - - [1856, 1856, 1, 256]
    - [263, 11.86]
  - - [2112, 1856, 1, 256]
    - [319, 12.41]
  - - [2368, 1856, 1, 256]
    - [296, 12.93]
  - - [2624, 1856, 1, 256]
    - [296, 13.33]
  - - [2880, 1856, 1, 256]
    - [317, 13.71]
  - - [3136, 1856, 1, 256]
    - [302, 13.87]
  - - [3392, 1856, 1, 256]
    - [288, 14.21]
  - - [3648, 1856, 1, 256]
    - [284, 14.33]
  - - [3904, 1856, 1, 256]
    - [263, 14.69]
  - - [64, 2112, 1, 256]
    - [376, 1.97]
  - - [320, 2112, 1, 256]
    - [213, 6.22]
  - - [576, 2112, 1, 256]
    - [357, 8.32]
  - - [832, 2112, 1, 256]
    - [182, 9.63]
  - - [1088, 2112, 1, 256]
    - [382, 10.7]
  - - [1344, 2112, 1, 256]
    - [359, 11.41]
  - - [1600, 2112, 1, 256]
    - [317, 12.1]
  - - [1856, 2112, 1, 256]
    - [319, 12.75]
  - - [2112, 2112, 1, 256]
    - [254, 13.14]
  - - [2368, 2112, 1, 256]
    - [296, 13.63]
  - - [2624, 2112, 1, 256]
    - [461, 13.84]
  - - [2880, 2112, 1, 256]
    - [314, 14.22]
  - - [3136, 2112, 1, 256]
    - [263, 14.68]
  - - [3392, 2112, 1, 256]
    - [254, 14.74]
  - - [3648, 2112, 1, 256]
    - [284, 14.47]
  - - [3904, 2112, 1, 256]
    - [486, 14.26]
  - - [64, 2368, 1, 256]
    - [342, 2.22]
  - - [320, 2368, 1, 256]
    - [359, 6.7]
  - - [576, 2368, 1, 256]
    - [182, 8.8]
  - - [832, 2368, 1, 256]
    - [192, 10.03]
  - - [1088, 2368, 1, 256]
    - [265, 11.16]
  - - [1344, 2368, 1, 256]
    - [286, 11.55]
  - - [1600, 2368, 1, 256]
    - [314, 12.36]
  - - [1856, 2368, 1, 256]
    - [296, 12.75]
  - - [2112, 2368, 1, 256]
    - [288, 13.14]
  - - [2368, 2368, 1, 256]
    - [254, 13.78]
  - - [2624, 2368, 1, 256]
    - [245, 14.39]
  - - [2880, 2368, 1, 256]
    - [245, 14.7]
  - - [3136, 2368, 1, 256]
    - [314, 14.43]
  - - [3392, 2368, 1, 256]
    - [427, 14.03]
  - - [3648, 2368, 1, 256]
    - [284, 13.39]
  - - [3904, 2368, 1, 256]
    - [427, 12.6]
  - - [64, 2624, 1, 256]
    - [172, 2.4]
  - - [320, 2624, 1, 256]
    - [236, 7.01]
  - - [576, 2624, 1, 256]
    - [372, 9.18]
  - - [832, 2624, 1, 256]
    - [299, 10.37]
  - - [1088, 2624, 1, 256]
    - [265, 11.45]
  - - [1344, 2624, 1, 256]
    - [461, 12.16]
  - - [1600, 2624, 1, 256]
    - [263, 12.73]
  - - [1856, 2624, 1, 256]
    - [296, 13.1]
  - - [2112, 2624, 1, 256]
    - [288, 13.57]
  - - [2368, 2624, 1, 256]
    - [317, 14.2]
  - - [2624, 2624, 1, 256]
    - [245, 14.38]
  - - [2880, 2624, 1, 256]
    - [284, 14.56]
  - - [3136, 2624, 1, 256]
    - [317, 14.34]
  - - [3392, 2624, 1, 256]
    - [427, 13.46]
  - - [3648, 2624, 1, 256]
    - [427, 12.26]
  - - [3904, 2624, 1, 256]
    - [560, 11.06]
  - - [64, 2880, 1, 256]
    - [244, 2.62]
  - - [320, 2880, 1, 256]
    - [228, 7.39]
  - - [576, 2880, 1, 256]
    - [265, 9.38]
  - - [832, 2880, 1, 256]
    - [228, 10.6]
  - - [1088, 2880, 1, 256]
    - [359, 11.76]
  - - [1344, 2880, 1, 256]
    - [263, 12.45]
  - - [1600, 2880, 1, 256]
    - [263, 13.1]
  - - [1856, 2880, 1, 256]
    - [324, 13.35]
  - - [2112, 2880, 1, 256]
    - [319, 14.0]
  - - [2368, 2880, 1, 256]
    - [528, 14.45]
  - - [2624, 2880, 1, 256]
    - [427, 14.46]
  - - [2880, 2880, 1, 256]
    - [528, 14.71]
  - - [3136, 2880, 1, 256]
    - [528, 13.46]
  - - [3392, 2880, 1, 256]
    - [427, 11.93]
  - - [3648, 2880, 1, 256]
    - [196, 10.83]
  - - [3904, 2880, 1, 256]
    - [257, 10.29]
  - - [64, 3136, 1, 256]
    - [228, 2.99]
  - - [320, 3136, 1, 256]
    - [379, 8.35]
  - - [576, 3136, 1, 256]
    - [223, 10.0]
  - - [832, 3136, 1, 256]
    - [371, 11.25]
  - - [1088, 3136, 1, 256]
    - [372, 11.9]
  - - [1344, 3136, 1, 256]
    - [528, 12.77]
  - - [1600, 3136, 1, 256]
    - [427, 13.45]
  - - [1856, 3136, 1, 256]
    - [254, 13.88]
  - - [2112, 3136, 1, 256]
    - [263, 14.68]
  - - [2368, 3136, 1, 256]
    - [286, 14.47]
  - - [2624, 3136, 1, 256]
    - [245, 14.36]
  - - [2880, 3136, 1, 256]
    - [528, 13.11]
  - - [3136, 3136, 1, 256]
    - [562, 11.74]
  - - [3392, 3136, 1, 256]
    - [257, 10.76]
  - - [3648, 3136, 1, 256]
    - [227, 10.3]
  - - [3904, 3136, 1, 256]
    - [227, 9.99]
  - - [64, 3392, 1, 256]
    - [214, 3.02]
  - - [320, 3392, 1, 256]
    - [379, 8.21]
  - - [576, 3392, 1, 256]
    - [228, 10.05]
  - - [832, 3392, 1, 256]
    - [235, 11.13]
  - - [1088, 3392, 1, 256]
    - [245, 12.05]
  - - [1344, 3392, 1, 256]
    - [254, 12.76]
  - - [1600, 3392, 1, 256]
    - [263, 13.68]
  - - [1856, 3392, 1, 256]
    - [307, 14.1]
  - - [2112, 3392, 1, 256]
    - [317, 14.58]
  - - [2368, 3392, 1, 256]
    - [245, 14.52]
  - - [2624, 3392, 1, 256]
    - [427, 13.4]
  - - [2880, 3392, 1, 256]
    - [544, 11.85]
  - - [3136, 3392, 1, 256]
    - [553, 10.76]
  - - [3392, 3392, 1, 256]
    - [192, 10.22]
  - - [3648, 3392, 1, 256]
    - [227, 10.14]
  - - [3904, 3392, 1, 256]
    - [227, 9.8]
  - - [64, 3648, 1, 256]
    - [371, 3.17]
  - - [320, 3648, 1, 256]
    - [228, 8.15]
  - - [576, 3648, 1, 256]
    - [291, 10.25]
  - - [832, 3648, 1, 256]
    - [213, 11.3]
  - - [1088, 3648, 1, 256]
    - [529, 12.07]
  - - [1344, 3648, 1, 256]
    - [486, 13.22]
  - - [1600, 3648, 1, 256]
    - [286, 13.88]
  - - [1856, 3648, 1, 256]
    - [317, 14.18]
  - - [2112, 3648, 1, 256]
    - [288, 14.12]
  - - [2368, 3648, 1, 256]
    - [427, 13.72]
  - - [2624, 3648, 1, 256]
    - [523, 12.06]
  - - [2880, 3648, 1, 256]
    - [544, 10.78]
  - - [3136, 3648, 1, 256]
    - [196, 10.3]
  - - [3392, 3648, 1, 256]
    - [227, 9.98]
  - - [3648, 3648, 1, 256]
    - [227, 10.04]
  - - [3904, 3648, 1, 256]
    - [227, 9.82]
  - - [64, 3904, 1, 256]
    - [355, 3.38]
  - - [320, 3904, 1, 256]
    - [228, 8.53]
  - - [576, 3904, 1, 256]
    - [265, 10.69]
  - - [832, 3904, 1, 256]
    - [488, 11.59]
  - - [1088, 3904, 1, 256]
    - [373, 12.65]
  - - [1344, 3904, 1, 256]
    - [488, 13.66]
  - - [1600, 3904, 1, 256]
    - [301, 14.05]
  - - [1856, 3904, 1, 256]
    - [307, 14.5]
  - - [2112, 3904, 1, 256]
    - [523, 14.38]
  - - [2368, 3904, 1, 256]
    - [302, 12.42]
  - - [2624, 3904, 1, 256]
    - [302, 11.01]
  - - [2880, 3904, 1, 256]
    - [356, 10.29]
  - - [3136, 3904, 1, 256]
    - [356, 9.95]
  - - [3392, 3904, 1, 256]
    - [321, 9.76]
  - - [3648, 3904, 1, 256]
    - [227, 10.07]
  - - [3904, 3904, 1, 256]
    - [227, 9.91]
  - - [320, 64, 1, 512]
    - [397, 0.71]
  - - [576, 64, 1, 512]
    - [365, 1.15]
  - - [832, 64, 1, 512]
    - [402, 1.6]
  - - [1088, 64, 1, 512]
    - [335, 1.96]
  - - [1344, 64, 1, 512]
    - [252, 2.47]
  - - [1600, 64, 1, 512]
    - [407, 2.83]
  - - [1856, 64, 1, 512]
    - [199, 3.23]
  - - [2112, 64, 1, 512]
    - [335, 3.57]
  - - [2368, 64, 1, 512]
    - [349, 3.8]
  - - [2624, 64, 1, 512]
    - [331, 4.2]
  - - [2880, 64, 1, 512]
    - [244, 4.63]
  - - [3136, 64, 1, 512]
    - [369, 4.96]
  - - [3392, 64, 1, 512]
    - [377, 4.89]
  - - [3648, 64, 1, 512]
    - [389, 5.38]
  - - [3904, 64, 1, 512]
    - [377, 5.43]
  - - [64, 320, 1, 512]
    - [320, 0.66]
  - - [320, 320, 1, 512]
    - [335, 2.8]
  - - [576, 320, 1, 512]
    - [384, 4.49]
  - - [832, 320, 1, 512]
    - [377, 5.76]
  - - [1088, 320, 1, 512]
    - [382, 6.75]
  - - [1344, 320, 1, 512]
    - [331, 7.48]
  - - [1600, 320, 1, 512]
    - [172, 8.87]
  - - [1856, 320, 1, 512]
    - [389, 9.17]
  - - [2112, 320, 1, 512]
    - [411, 10.09]
  - - [2368, 320, 1, 512]
    - [172, 10.39]
  - - [2624, 320, 1, 512]
    - [373, 10.79]
  - - [2880, 320, 1, 512]
    - [378, 11.1]
  - - [3136, 320, 1, 512]
    - [221, 11.54]
  - - [3392, 320, 1, 512]
    - [315, 11.51]
  - - [3648, 320, 1, 512]
    - [182, 12.23]
  - - [3904, 320, 1, 512]
    - [312, 12.07]
  - - [64, 576, 1, 512]
    - [399, 1.23]
  - - [320, 576, 1, 512]
    - [244, 4.75]
  - - [576, 576, 1, 512]
    - [346, 6.88]
  - - [832, 576, 1, 512]
    - [335, 7.97]
  - - [1088, 576, 1, 512]
    - [389, 9.13]
  - - [1344, 576, 1, 512]
    - [411, 10.51]
  - - [1600, 576, 1, 512]
    - [228, 11.02]
  - - [1856, 576, 1, 512]
    - [265, 12.29]
  - - [2112, 576, 1, 512]
    - [220, 12.69]
  - - [2368, 576, 1, 512]
    - [244, 13.06]
  - - [2624, 576, 1, 512]
    - [389, 12.9]
  - - [2880, 576, 1, 512]
    - [455, 13.29]
  - - [3136, 576, 1, 512]
    - [379, 14.2]
  - - [3392, 576, 1, 512]
    - [473, 13.81]
  - - [3648, 576, 1, 512]
    - [265, 14.63]
  - - [3904, 576, 1, 512]
    - [359, 15.07]
  - - [64, 832, 1, 512]
    - [375, 1.6]
  - - [320, 832, 1, 512]
    - [382, 5.59]
  - - [576, 832, 1, 512]
    - [331, 8.02]
  - - [832, 832, 1, 512]
    - [228, 9.69]
  - - [1088, 832, 1, 512]
    - [244, 11.21]
  - - [1344, 832, 1, 512]
    - [228, 12.51]
  - - [1600, 832, 1, 512]
    - [449, 12.37]
  - - [1856, 832, 1, 512]
    - [228, 14.0]
  - - [2112, 832, 1, 512]
    - [347, 14.54]
  - - [2368, 832, 1, 512]
    - [228, 14.74]
  - - [2624, 832, 1, 512]
    - [228, 15.07]
  - - [2880, 832, 1, 512]
    - [379, 15.51]
  - - [3136, 832, 1, 512]
    - [431, 14.97]
  - - [3392, 832, 1, 512]
    - [390, 15.39]
  - - [3648, 832, 1, 512]
    - [265, 15.78]
  - - [3904, 832, 1, 512]
    - [486, 15.99]
  - - [64, 1088, 1, 512]
    - [199, 1.99]
  - - [320, 1088, 1, 512]
    - [373, 6.87]
  - - [576, 1088, 1, 512]
    - [221, 9.35]
  - - [832, 1088, 1, 512]
    - [373, 11.5]
  - - [1088, 1088, 1, 512]
    - [223, 11.98]
  - - [1344, 1088, 1, 512]
    - [265, 13.32]
  - - [1600, 1088, 1, 512]
    - [379, 14.05]
  - - [1856, 1088, 1, 512]
    - [431, 14.22]
  - - [2112, 1088, 1, 512]
    - [359, 15.13]
  - - [2368, 1088, 1, 512]
    - [228, 15.49]
  - - [2624, 1088, 1, 512]
    - [486, 16.01]
  - - [2880, 1088, 1, 512]
    - [228, 16.19]
  - - [3136, 1088, 1, 512]
    - [486, 15.71]
  - - [3392, 1088, 1, 512]
    - [359, 16.19]
  - - [3648, 1088, 1, 512]
    - [486, 16.66]
  - - [3904, 1088, 1, 512]
    - [245, 16.66]
  - - [64, 1344, 1, 512]
    - [441, 2.42]
  - - [320, 1344, 1, 512]
    - [331, 7.49]
  - - [576, 1344, 1, 512]
    - [488, 10.23]
  - - [832, 1344, 1, 512]
    - [331, 11.96]
  - - [1088, 1344, 1, 512]
    - [420, 12.99]
  - - [1344, 1344, 1, 512]
    - [359, 14.25]
  - - [1600, 1344, 1, 512]
    - [371, 14.44]
  - - [1856, 1344, 1, 512]
    - [373, 15.1]
  - - [2112, 1344, 1, 512]
    - [371, 15.72]
  - - [2368, 1344, 1, 512]
    - [359, 15.83]
  - - [2624, 1344, 1, 512]
    - [511, 16.73]
  - - [2880, 1344, 1, 512]
    - [372, 17.08]
  - - [3136, 1344, 1, 512]
    - [228, 17.02]
  - - [3392, 1344, 1, 512]
    - [390, 17.22]
  - - [3648, 1344, 1, 512]
    - [372, 17.03]
  - - [3904, 1344, 1, 512]
    - [390, 17.86]
  - - [64, 1600, 1, 512]
    - [266, 2.81]
  - - [320, 1600, 1, 512]
    - [362, 8.23]
  - - [576, 1600, 1, 512]
    - [389, 10.93]
  - - [832, 1600, 1, 512]
    - [431, 12.51]
  - - [1088, 1600, 1, 512]
    - [182, 13.4]
  - - [1344, 1600, 1, 512]
    - [420, 14.38]
  - - [1600, 1600, 1, 512]
    - [359, 15.32]
  - - [1856, 1600, 1, 512]
    - [359, 15.88]
  - - [2112, 1600, 1, 512]
    - [265, 16.25]
  - - [2368, 1600, 1, 512]
    - [379, 16.33]
  - - [2624, 1600, 1, 512]
    - [486, 16.87]
  - - [2880, 1600, 1, 512]
    - [486, 17.45]
  - - [3136, 1600, 1, 512]
    - [511, 17.27]
  - - [3392, 1600, 1, 512]
    - [486, 17.9]
  - - [3648, 1600, 1, 512]
    - [296, 17.92]
  - - [3904, 1600, 1, 512]
    - [314, 17.9]
  - - [64, 1856, 1, 512]
    - [311, 3.43]
  - - [320, 1856, 1, 512]
    - [382, 8.92]
  - - [576, 1856, 1, 512]
    - [378, 11.65]
  - - [832, 1856, 1, 512]
    - [379, 13.7]
  - - [1088, 1856, 1, 512]
    - [228, 14.94]
  - - [1344, 1856, 1, 512]
    - [359, 15.38]
  - - [1600, 1856, 1, 512]
    - [228, 15.78]
  - - [1856, 1856, 1, 512]
    - [359, 16.54]
  - - [2112, 1856, 1, 512]
    - [357, 16.84]
  - - [2368, 1856, 1, 512]
    - [486, 17.14]
  - - [2624, 1856, 1, 512]
    - [511, 17.5]
  - - [2880, 1856, 1, 512]
    - [486, 17.77]
  - - [3136, 1856, 1, 512]
    - [511, 18.05]
  - - [3392, 1856, 1, 512]
    - [284, 17.71]
  - - [3648, 1856, 1, 512]
    - [390, 18.79]
  - - [3904, 1856, 1, 512]
    - [486, 18.46]
  - - [64, 2112, 1, 512]
    - [228, 3.68]
  - - [320, 2112, 1, 512]
    - [362, 9.72]
  - - [576, 2112, 1, 512]
    - [228, 12.76]
  - - [832, 2112, 1, 512]
    - [357, 14.33]
  - - [1088, 2112, 1, 512]
    - [379, 14.89]
  - - [1344, 2112, 1, 512]
    - [379, 15.8]
  - - [1600, 2112, 1, 512]
    - [390, 16.39]
  - - [1856, 2112, 1, 512]
    - [390, 17.2]
  - - [2112, 2112, 1, 512]
    - [307, 17.11]
  - - [2368, 2112, 1, 512]
    - [390, 18.25]
  - - [2624, 2112, 1, 512]
    - [486, 18.17]
  - - [2880, 2112, 1, 512]
    - [486, 18.93]
  - - [3136, 2112, 1, 512]
    - [390, 19.62]
  - - [3392, 2112, 1, 512]
    - [390, 19.68]
  - - [3648, 2112, 1, 512]
    - [390, 19.77]
  - - [3904, 2112, 1, 512]
    - [452, 19.54]
  - - [64, 2368, 1, 512]
    - [389, 3.9]
  - - [320, 2368, 1, 512]
    - [244, 10.16]
  - - [576, 2368, 1, 512]
    - [359, 13.53]
  - - [832, 2368, 1, 512]
    - [265, 14.4]
  - - [1088, 2368, 1, 512]
    - [431, 14.88]
  - - [1344, 2368, 1, 512]
    - [265, 16.18]
  - - [1600, 2368, 1, 512]
    - [263, 16.25]
  - - [1856, 2368, 1, 512]
    - [296, 16.66]
  - - [2112, 2368, 1, 512]
    - [288, 17.17]
  - - [2368, 2368, 1, 512]
    - [286, 17.21]
  - - [2624, 2368, 1, 512]
    - [511, 18.21]
  - - [2880, 2368, 1, 512]
    - [486, 18.26]
  - - [3136, 2368, 1, 512]
    - [296, 17.67]
  - - [3392, 2368, 1, 512]
    - [486, 17.61]
  - - [3648, 2368, 1, 512]
    - [390, 17.72]
  - - [3904, 2368, 1, 512]
    - [528, 17.25]
  - - [64, 2624, 1, 512]
    - [402, 4.16]
  - - [320, 2624, 1, 512]
    - [389, 10.95]
  - - [576, 2624, 1, 512]
    - [508, 12.95]
  - - [832, 2624, 1, 512]
    - [357, 14.49]
  - - [1088, 2624, 1, 512]
    - [379, 15.56]
  - - [1344, 2624, 1, 512]
    - [357, 16.34]
  - - [1600, 2624, 1, 512]
    - [371, 16.97]
  - - [1856, 2624, 1, 512]
    - [228, 16.84]
  - - [2112, 2624, 1, 512]
    - [488, 17.57]
  - - [2368, 2624, 1, 512]
    - [245, 17.56]
  - - [2624, 2624, 1, 512]
    - [511, 18.22]
  - - [2880, 2624, 1, 512]
    - [390, 18.25]
  - - [3136, 2624, 1, 512]
    - [390, 17.85]
  - - [3392, 2624, 1, 512]
    - [390, 17.16]
  - - [3648, 2624, 1, 512]
    - [390, 17.13]
  - - [3904, 2624, 1, 512]
    - [390, 17.3]
  - - [64, 2880, 1, 512]
    - [363, 4.49]
  - - [320, 2880, 1, 512]
    - [377, 10.86]
  - - [576, 2880, 1, 512]
    - [420, 13.35]
  - - [832, 2880, 1, 512]
    - [244, 14.53]
  - - [1088, 2880, 1, 512]
    - [486, 16.1]
  - - [1344, 2880, 1, 512]
    - [357, 16.26]
  - - [1600, 2880, 1, 512]
    - [511, 16.87]
  - - [1856, 2880, 1, 512]
    - [359, 17.01]
  - - [2112, 2880, 1, 512]
    - [228, 17.6]
  - - [2368, 2880, 1, 512]
    - [296, 17.61]
  - - [2624, 2880, 1, 512]
    - [511, 18.55]
  - - [2880, 2880, 1, 512]
    - [511, 18.5]
  - - [3136, 2880, 1, 512]
    - [319, 17.72]
  - - [3392, 2880, 1, 512]
    - [390, 17.14]
  - - [3648, 2880, 1, 512]
    - [427, 16.89]
  - - [3904, 2880, 1, 512]
    - [528, 16.96]
  - - [64, 3136, 1, 512]
    - [363, 5.0]
  - - [320, 3136, 1, 512]
    - [287, 11.61]
  - - [576, 3136, 1, 512]
    - [228, 14.4]
  - - [832, 3136, 1, 512]
    - [357, 15.19]
  - - [1088, 3136, 1, 512]
    - [228, 16.14]
  - - [1344, 3136, 1, 512]
    - [390, 16.93]
  - - [1600, 3136, 1, 512]
    - [486, 17.53]
  - - [1856, 3136, 1, 512]
    - [511, 17.86]
  - - [2112, 3136, 1, 512]
    - [452, 18.6]
  - - [2368, 3136, 1, 512]
    - [486, 18.78]
  - - [2624, 3136, 1, 512]
    - [263, 17.94]
  - - [2880, 3136, 1, 512]
    - [486, 17.82]
  - - [3136, 3136, 1, 512]
    - [390, 17.35]
  - - [3392, 3136, 1, 512]
    - [390, 17.05]
  - - [3648, 3136, 1, 512]
    - [528, 16.75]
  - - [3904, 3136, 1, 512]
    - [452, 16.89]
  - - [64, 3392, 1, 512]
    - [372, 5.0]
  - - [320, 3392, 1, 512]
    - [359, 12.58]
  - - [576, 3392, 1, 512]
    - [359, 14.55]
  - - [832, 3392, 1, 512]
    - [331, 15.02]
  - - [1088, 3392, 1, 512]
    - [511, 16.11]
  - - [1344, 3392, 1, 512]
    - [511, 16.97]
  - - [1600, 3392, 1, 512]
    - [263, 17.3]
  - - [1856, 3392, 1, 512]
    - [390, 17.35]
  - - [2112, 3392, 1, 512]
    - [486, 18.35]
  - - [2368, 3392, 1, 512]
    - [296, 17.97]
  - - [2624, 3392, 1, 512]
    - [511, 17.72]
  - - [2880, 3392, 1, 512]
    - [316, 16.92]
  - - [3136, 3392, 1, 512]
    - [319, 16.66]
  - - [3392, 3392, 1, 512]
    - [523, 16.98]
  - - [3648, 3392, 1, 512]
    - [427, 16.65]
  - - [3904, 3392, 1, 512]
    - [523, 17.27]
  - - [64, 3648, 1, 512]
    - [563, 5.2]
  - - [320, 3648, 1, 512]
    - [244, 11.45]
  - - [576, 3648, 1, 512]
    - [265, 14.68]
  - - [832, 3648, 1, 512]
    - [486, 15.84]
  - - [1088, 3648, 1, 512]
    - [228, 16.48]
  - - [1344, 3648, 1, 512]
    - [486, 17.85]
  - - [1600, 3648, 1, 512]
    - [511, 17.93]
  - - [1856, 3648, 1, 512]
    - [390, 18.27]
  - - [2112, 3648, 1, 512]
    - [452, 18.63]
  - - [2368, 3648, 1, 512]
    - [511, 17.58]
  - - [2624, 3648, 1, 512]
    - [390, 17.62]
  - - [2880, 3648, 1, 512]
    - [427, 16.88]
  - - [3136, 3648, 1, 512]
    - [390, 16.8]
  - - [3392, 3648, 1, 512]
    - [529, 16.94]
  - - [3648, 3648, 1, 512]
    - [427, 17.3]
  - - [3904, 3648, 1, 512]
    - [427, 17.53]
  - - [64, 3904, 1, 512]
    - [199, 5.44]
  - - [320, 3904, 1, 512]
    - [373, 13.09]
  - - [576, 3904, 1, 512]
    - [228, 15.01]
  - - [832, 3904, 1, 512]
    - [228, 16.06]
  - - [1088, 3904, 1, 512]
    - [372, 17.33]
  - - [1344, 3904, 1, 512]
    - [373, 17.91]
  - - [1600, 3904, 1, 512]
    - [511, 18.26]
  - - [1856, 3904, 1, 512]
    - [390, 18.47]
  - - [2112, 3904, 1, 512]
    - [390, 18.57]
  - - [2368, 3904, 1, 512]
    - [390, 17.56]
  - - [2624, 3904, 1, 512]
    - [390, 17.24]
  - - [2880, 3904, 1, 512]
    - [529, 16.76]
  - - [3136, 3904, 1, 512]
    - [528, 16.91]
  - - [3392, 3904, 1, 512]
    - [427, 17.32]
  - - [3648, 3904, 1, 512]
    - [427, 17.22]
  - - [3904, 3904, 1, 512]
    - [553, 17.74]
  - - [320, 64, 1, 1024]
    - [438, 1.21]
  - - [576, 64, 1, 1024]
    - [404, 2.06]
  - - [832, 64, 1, 1024]
    - [389, 2.95]
  - - [1088, 64, 1, 1024]
    - [377, 3.55]
  - - [1344, 64, 1, 1024]
    - [362, 4.5]
  - - [1600, 64, 1, 1024]
    - [331, 4.76]
  - - [1856, 64, 1, 1024]
    - [354, 5.37]
  - - [2112, 64, 1, 1024]
    - [349, 5.65]
  - - [2368, 64, 1, 1024]
    - [346, 6.01]
  - - [2624, 64, 1, 1024]
    - [331, 6.54]
  - - [2880, 64, 1, 1024]
    - [334, 6.94]
  - - [3136, 64, 1, 1024]
    - [331, 7.32]
  - - [3392, 64, 1, 1024]
    - [334, 7.41]
  - - [3648, 64, 1, 1024]
    - [331, 7.94]
  - - [3904, 64, 1, 1024]
    - [449, 8.21]
  - - [64, 320, 1, 1024]
    - [365, 1.19]
  - - [320, 320, 1, 1024]
    - [357, 4.75]
  - - [576, 320, 1, 1024]
    - [334, 6.99]
  - - [832, 320, 1, 1024]
    - [426, 8.92]
  - - [1088, 320, 1, 1024]
    - [244, 9.7]
  - - [1344, 320, 1, 1024]
    - [346, 11.62]
  - - [1600, 320, 1, 1024]
    - [287, 12.31]
  - - [1856, 320, 1, 1024]
    - [331, 12.29]
  - - [2112, 320, 1, 1024]
    - [228, 14.14]
  - - [2368, 320, 1, 1024]
    - [373, 14.2]
  - - [2624, 320, 1, 1024]
    - [172, 14.5]
  - - [2880, 320, 1, 1024]
    - [244, 13.98]
  - - [3136, 320, 1, 1024]
    - [182, 14.84]
  - - [3392, 320, 1, 1024]
    - [378, 15.47]
  - - [3648, 320, 1, 1024]
    - [420, 15.73]
  - - [3904, 320, 1, 1024]
    - [372, 15.85]
  - - [64, 576, 1, 1024]
    - [437, 2.0]
  - - [320, 576, 1, 1024]
    - [363, 7.08]
  - - [576, 576, 1, 1024]
    - [363, 9.55]
  - - [832, 576, 1, 1024]
    - [389, 12.25]
  - - [1088, 576, 1, 1024]
    - [265, 12.72]
  - - [1344, 576, 1, 1024]
    - [357, 14.65]
  - - [1600, 576, 1, 1024]
    - [228, 15.32]
  - - [1856, 576, 1, 1024]
    - [228, 16.24]
  - - [2112, 576, 1, 1024]
    - [379, 16.6]
  - - [2368, 576, 1, 1024]
    - [359, 17.35]
  - - [2624, 576, 1, 1024]
    - [228, 17.51]
  - - [2880, 576, 1, 1024]
    - [265, 17.68]
  - - [3136, 576, 1, 1024]
    - [359, 18.11]
  - - [3392, 576, 1, 1024]
    - [228, 18.48]
  - - [3648, 576, 1, 1024]
    - [359, 18.41]
  - - [3904, 576, 1, 1024]
    - [359, 18.42]
  - - [64, 832, 1, 1024]
    - [349, 2.77]
  - - [320, 832, 1, 1024]
    - [382, 8.63]
  - - [576, 832, 1, 1024]
    - [228, 12.28]
  - - [832, 832, 1, 1024]
    - [362, 14.02]
  - - [1088, 832, 1, 1024]
    - [362, 15.53]
  - - [1344, 832, 1, 1024]
    - [347, 16.19]
  - - [1600, 832, 1, 1024]
    - [265, 16.67]
  - - [1856, 832, 1, 1024]
    - [359, 17.45]
  - - [2112, 832, 1, 1024]
    - [347, 17.89]
  - - [2368, 832, 1, 1024]
    - [359, 18.38]
  - - [2624, 832, 1, 1024]
    - [379, 18.21]
  - - [2880, 832, 1, 1024]
    - [359, 19.11]
  - - [3136, 832, 1, 1024]
    - [390, 19.01]
  - - [3392, 832, 1, 1024]
    - [244, 18.81]
  - - [3648, 832, 1, 1024]
    - [452, 18.72]
  - - [3904, 832, 1, 1024]
    - [452, 19.68]
  - - [64, 1088, 1, 1024]
    - [244, 3.4]
  - - [320, 1088, 1, 1024]
    - [334, 10.02]
  - - [576, 1088, 1, 1024]
    - [347, 12.97]
  - - [832, 1088, 1, 1024]
    - [334, 15.43]
  - - [1088, 1088, 1, 1024]
    - [228, 16.41]
  - - [1344, 1088, 1, 1024]
    - [228, 17.35]
  - - [1600, 1088, 1, 1024]
    - [228, 17.94]
  - - [1856, 1088, 1, 1024]
    - [486, 17.57]
  - - [2112, 1088, 1, 1024]
    - [389, 18.6]
  - - [2368, 1088, 1, 1024]
    - [486, 18.69]
  - - [2624, 1088, 1, 1024]
    - [390, 19.35]
  - - [2880, 1088, 1, 1024]
    - [390, 20.01]
  - - [3136, 1088, 1, 1024]
    - [452, 19.23]
  - - [3392, 1088, 1, 1024]
    - [390, 19.9]
  - - [3648, 1088, 1, 1024]
    - [390, 20.16]
  - - [3904, 1088, 1, 1024]
    - [390, 20.48]
  - - [64, 1344, 1, 1024]
    - [349, 4.04]
  - - [320, 1344, 1, 1024]
    - [343, 11.23]
  - - [576, 1344, 1, 1024]
    - [389, 15.03]
  - - [832, 1344, 1, 1024]
    - [357, 16.22]
  - - [1088, 1344, 1, 1024]
    - [228, 17.37]
  - - [1344, 1344, 1, 1024]
    - [228, 18.14]
  - - [1600, 1344, 1, 1024]
    - [228, 18.52]
  - - [1856, 1344, 1, 1024]
    - [359, 18.75]
  - - [2112, 1344, 1, 1024]
    - [347, 18.99]
  - - [2368, 1344, 1, 1024]
    - [244, 19.59]
  - - [2624, 1344, 1, 1024]
    - [244, 19.72]
  - - [2880, 1344, 1, 1024]
    - [390, 20.33]
  - - [3136, 1344, 1, 1024]
    - [390, 20.31]
  - - [3392, 1344, 1, 1024]
    - [359, 20.61]
  - - [3648, 1344, 1, 1024]
    - [486, 20.59]
  - - [3904, 1344, 1, 1024]
    - [486, 21.15]
  - - [64, 1600, 1, 1024]
    - [252, 4.75]
  - - [320, 1600, 1, 1024]
    - [172, 12.46]
  - - [576, 1600, 1, 1024]
    - [228, 15.3]
  - - [832, 1600, 1, 1024]
    - [357, 16.72]
  - - [1088, 1600, 1, 1024]
    - [228, 17.78]
  - - [1344, 1600, 1, 1024]
    - [347, 18.52]
  - - [1600, 1600, 1, 1024]
    - [379, 18.54]
  - - [1856, 1600, 1, 1024]
    - [359, 19.33]
  - - [2112, 1600, 1, 1024]
    - [379, 19.31]
  - - [2368, 1600, 1, 1024]
    - [390, 19.79]
  - - [2624, 1600, 1, 1024]
    - [228, 19.95]
  - - [2880, 1600, 1, 1024]
    - [452, 20.62]
  - - [3136, 1600, 1, 1024]
    - [452, 21.25]
  - - [3392, 1600, 1, 1024]
    - [452, 20.95]
  - - [3648, 1600, 1, 1024]
    - [390, 21.24]
  - - [3904, 1600, 1, 1024]
    - [452, 21.33]
  - - [64, 1856, 1, 1024]
    - [187, 5.32]
  - - [320, 1856, 1, 1024]
    - [287, 12.71]
  - - [576, 1856, 1, 1024]
    - [331, 15.36]
  - - [832, 1856, 1, 1024]
    - [357, 17.11]
  - - [1088, 1856, 1, 1024]
    - [240, 17.23]
  - - [1344, 1856, 1, 1024]
    - [244, 18.76]
  - - [1600, 1856, 1, 1024]
    - [359, 19.24]
  - - [1856, 1856, 1, 1024]
    - [486, 19.13]
  - - [2112, 1856, 1, 1024]
    - [390, 20.91]
  - - [2368, 1856, 1, 1024]
    - [511, 19.94]
  - - [2624, 1856, 1, 1024]
    - [390, 21.22]
  - - [2880, 1856, 1, 1024]
    - [511, 20.89]
  - - [3136, 1856, 1, 1024]
    - [390, 21.52]
  - - [3392, 1856, 1, 1024]
    - [511, 21.59]
  - - [3648, 1856, 1, 1024]
    - [390, 21.46]
  - - [3904, 1856, 1, 1024]
    - [390, 21.44]
  - - [64, 2112, 1, 1024]
    - [362, 5.92]
  - - [320, 2112, 1, 1024]
    - [244, 14.12]
  - - [576, 2112, 1, 1024]
    - [334, 16.81]
  - - [832, 2112, 1, 1024]
    - [228, 18.27]
  - - [1088, 2112, 1, 1024]
    - [450, 18.22]
  - - [1344, 2112, 1, 1024]
    - [359, 19.47]
  - - [1600, 2112, 1, 1024]
    - [228, 19.73]
  - - [1856, 2112, 1, 1024]
    - [390, 20.84]
  - - [2112, 2112, 1, 1024]
    - [390, 20.34]
  - - [2368, 2112, 1, 1024]
    - [390, 21.49]
  - - [2624, 2112, 1, 1024]
    - [511, 20.88]
  - - [2880, 2112, 1, 1024]
    - [511, 21.71]
  - - [3136, 2112, 1, 1024]
    - [486, 22.02]
  - - [3392, 2112, 1, 1024]
    - [486, 22.06]
  - - [3648, 2112, 1, 1024]
    - [390, 22.28]
  - - [3904, 2112, 1, 1024]
    - [390, 21.46]
  - - [64, 2368, 1, 1024]
    - [349, 6.14]
  - - [320, 2368, 1, 1024]
    - [389, 14.1]
  - - [576, 2368, 1, 1024]
    - [362, 16.73]
  - - [832, 2368, 1, 1024]
    - [347, 18.15]
  - - [1088, 2368, 1, 1024]
    - [511, 18.65]
  - - [1344, 2368, 1, 1024]
    - [347, 19.4]
  - - [1600, 2368, 1, 1024]
    - [452, 19.87]
  - - [1856, 2368, 1, 1024]
    - [390, 20.86]
  - - [2112, 2368, 1, 1024]
    - [357, 20.5]
  - - [2368, 2368, 1, 1024]
    - [511, 21.34]
  - - [2624, 2368, 1, 1024]
    - [390, 21.96]
  - - [2880, 2368, 1, 1024]
    - [486, 21.17]
  - - [3136, 2368, 1, 1024]
    - [390, 21.63]
  - - [3392, 2368, 1, 1024]
    - [390, 21.55]
  - - [3648, 2368, 1, 1024]
    - [486, 21.4]
  - - [3904, 2368, 1, 1024]
    - [511, 22.07]
  - - [64, 2624, 1, 1024]
    - [384, 6.82]
  - - [320, 2624, 1, 1024]
    - [287, 15.39]
  - - [576, 2624, 1, 1024]
    - [228, 17.5]
  - - [832, 2624, 1, 1024]
    - [372, 18.95]
  - - [1088, 2624, 1, 1024]
    - [372, 19.42]
  - - [1344, 2624, 1, 1024]
    - [372, 20.38]
  - - [1600, 2624, 1, 1024]
    - [372, 20.81]
  - - [1856, 2624, 1, 1024]
    - [480, 20.75]
  - - [2112, 2624, 1, 1024]
    - [390, 21.32]
  - - [2368, 2624, 1, 1024]
    - [486, 21.53]
  - - [2624, 2624, 1, 1024]
    - [390, 21.81]
  - - [2880, 2624, 1, 1024]
    - [486, 21.68]
  - - [3136, 2624, 1, 1024]
    - [390, 22.06]
  - - [3392, 2624, 1, 1024]
    - [486, 22.26]
  - - [3648, 2624, 1, 1024]
    - [390, 22.18]
  - - [3904, 2624, 1, 1024]
    - [486, 23.11]
  - - [64, 2880, 1, 1024]
    - [343, 7.14]
  - - [320, 2880, 1, 1024]
    - [389, 14.77]
  - - [576, 2880, 1, 1024]
    - [377, 17.15]
  - - [832, 2880, 1, 1024]
    - [357, 18.73]
  - - [1088, 2880, 1, 1024]
    - [486, 19.88]
  - - [1344, 2880, 1, 1024]
    - [452, 20.03]
  - - [1600, 2880, 1, 1024]
    - [390, 20.42]
  - - [1856, 2880, 1, 1024]
    - [486, 21.45]
  - - [2112, 2880, 1, 1024]
    - [452, 21.22]
  - - [2368, 2880, 1, 1024]
    - [511, 21.14]
  - - [2624, 2880, 1, 1024]
    - [486, 21.95]
  - - [2880, 2880, 1, 1024]
    - [390, 21.95]
  - - [3136, 2880, 1, 1024]
    - [390, 22.43]
  - - [3392, 2880, 1, 1024]
    - [390, 22.29]
  - - [3648, 2880, 1, 1024]
    - [511, 23.02]
  - - [3904, 2880, 1, 1024]
    - [511, 23.4]
  - - [64, 3136, 1, 1024]
    - [234, 7.22]
  - - [320, 3136, 1, 1024]
    - [287, 15.29]
  - - [576, 3136, 1, 1024]
    - [419, 17.45]
  - - [832, 3136, 1, 1024]
    - [511, 18.78]
  - - [1088, 3136, 1, 1024]
    - [228, 19.34]
  - - [1344, 3136, 1, 1024]
    - [390, 20.66]
  - - [1600, 3136, 1, 1024]
    - [486, 20.88]
  - - [1856, 3136, 1, 1024]
    - [486, 21.4]
  - - [2112, 3136, 1, 1024]
    - [452, 21.69]
  - - [2368, 3136, 1, 1024]
    - [390, 22.11]
  - - [2624, 3136, 1, 1024]
    - [486, 22.44]
  - - [2880, 3136, 1, 1024]
    - [452, 22.59]
  - - [3136, 3136, 1, 1024]
    - [390, 23.08]
  - - [3392, 3136, 1, 1024]
    - [452, 23.22]
  - - [3648, 3136, 1, 1024]
    - [452, 23.49]
  - - [3904, 3136, 1, 1024]
    - [452, 23.73]
  - - [64, 3392, 1, 1024]
    - [363, 7.74]
  - - [320, 3392, 1, 1024]
    - [244, 15.61]
  - - [576, 3392, 1, 1024]
    - [228, 18.24]
  - - [832, 3392, 1, 1024]
    - [331, 18.74]
  - - [1088, 3392, 1, 1024]
    - [486, 19.5]
  - - [1344, 3392, 1, 1024]
    - [390, 20.96]
  - - [1600, 3392, 1, 1024]
    - [452, 21.37]
  - - [1856, 3392, 1, 1024]
    - [486, 21.24]
  - - [2112, 3392, 1, 1024]
    - [390, 21.83]
  - - [2368, 3392, 1, 1024]
    - [486, 21.92]
  - - [2624, 3392, 1, 1024]
    - [486, 22.36]
  - - [2880, 3392, 1, 1024]
    - [511, 22.3]
  - - [3136, 3392, 1, 1024]
    - [452, 22.98]
  - - [3392, 3392, 1, 1024]
    - [390, 23.44]
  - - [3648, 3392, 1, 1024]
    - [390, 23.65]
  - - [3904, 3392, 1, 1024]
    - [486, 23.52]
  - - [64, 3648, 1, 1024]
    - [228, 8.61]
  - - [320, 3648, 1, 1024]
    - [377, 16.17]
  - - [576, 3648, 1, 1024]
    - [362, 18.38]
  - - [832, 3648, 1, 1024]
    - [359, 19.63]
  - - [1088, 3648, 1, 1024]
    - [228, 20.18]
  - - [1344, 3648, 1, 1024]
    - [511, 20.94]
  - - [1600, 3648, 1, 1024]
    - [390, 21.74]
  - - [1856, 3648, 1, 1024]
    - [452, 21.22]
  - - [2112, 3648, 1, 1024]
    - [390, 21.5]
  - - [2368, 3648, 1, 1024]
    - [486, 22.27]
  - - [2624, 3648, 1, 1024]
    - [511, 22.35]
  - - [2880, 3648, 1, 1024]
    - [486, 23.02]
  - - [3136, 3648, 1, 1024]
    - [452, 23.36]
  - - [3392, 3648, 1, 1024]
    - [452, 23.73]
  - - [3648, 3648, 1, 1024]
    - [452, 23.64]
  - - [3904, 3648, 1, 1024]
    - [452, 24.08]
  - - [64, 3904, 1, 1024]
    - [275, 8.28]
  - - [320, 3904, 1, 1024]
    - [371, 17.04]
  - - [576, 3904, 1, 1024]
    - [372, 18.99]
  - - [832, 3904, 1, 1024]
    - [372, 20.39]
  - - [1088, 3904, 1, 1024]
    - [371, 21.06]
  - - [1344, 3904, 1, 1024]
    - [373, 21.38]
  - - [1600, 3904, 1, 1024]
    - [390, 21.84]
  - - [1856, 3904, 1, 1024]
    - [390, 21.43]
  - - [2112, 3904, 1, 1024]
    - [511, 22.02]
  - - [2368, 3904, 1, 1024]
    - [390, 22.33]
  - - [2624, 3904, 1, 1024]
    - [390, 23.45]
  - - [2880, 3904, 1, 1024]
    - [390, 23.38]
  - - [3136, 3904, 1, 1024]
    - [452, 23.81]
  - - [3392, 3904, 1, 1024]
    - [452, 23.8]
  - - [3648, 3904, 1, 1024]
    - [452, 23.54]
  - - [3904, 3904, 1, 1024]
    - [452, 23.82]
  - - [320, 64, 1, 2048]
    - [400, 2.06]
  - - [576, 64, 1, 2048]
    - [400, 3.34]
  - - [832, 64, 1, 2048]
    - [346, 4.48]
  - - [1088, 64, 1, 2048]
    - [349, 5.43]
  - - [1344, 64, 1, 2048]
    - [346, 6.41]
  - - [1600, 64, 1, 2048]
    - [334, 7.46]
  - - [1856, 64, 1, 2048]
    - [334, 8.17]
  - - [2112, 64, 1, 2048]
    - [442, 8.53]
  - - [2368, 64, 1, 2048]
    - [456, 9.38]
  - - [2624, 64, 1, 2048]
    - [346, 10.75]
  - - [2880, 64, 1, 2048]
    - [347, 10.41]
  - - [3136, 64, 1, 2048]
    - [331, 10.45]
  - - [3392, 64, 1, 2048]
    - [564, 10.78]
  - - [3648, 64, 1, 2048]
    - [182, 11.54]
  - - [3904, 64, 1, 2048]
    - [369, 11.4]
  - - [64, 320, 1, 2048]
    - [437, 2.07]
  - - [320, 320, 1, 2048]
    - [402, 7.17]
  - - [576, 320, 1, 2048]
    - [202, 10.19]
  - - [832, 320, 1, 2048]
    - [228, 12.23]
  - - [1088, 320, 1, 2048]
    - [449, 13.47]
  - - [1344, 320, 1, 2048]
    - [378, 15.48]
  - - [1600, 320, 1, 2048]
    - [373, 15.58]
  - - [1856, 320, 1, 2048]
    - [474, 15.63]
  - - [2112, 320, 1, 2048]
    - [334, 17.29]
  - - [2368, 320, 1, 2048]
    - [480, 16.79]
  - - [2624, 320, 1, 2048]
    - [371, 17.28]
  - - [2880, 320, 1, 2048]
    - [373, 17.46]
  - - [3136, 320, 1, 2048]
    - [432, 17.89]
  - - [3392, 320, 1, 2048]
    - [373, 18.68]
  - - [3648, 320, 1, 2048]
    - [372, 18.58]
  - - [3904, 320, 1, 2048]
    - [434, 19.53]
  - - [64, 576, 1, 2048]
    - [375, 3.44]
  - - [320, 576, 1, 2048]
    - [228, 10.06]
  - - [576, 576, 1, 2048]
    - [379, 13.38]
  - - [832, 576, 1, 2048]
    - [363, 15.94]
  - - [1088, 576, 1, 2048]
    - [389, 16.7]
  - - [1344, 576, 1, 2048]
    - [331, 18.1]
  - - [1600, 576, 1, 2048]
    - [244, 18.49]
  - - [1856, 576, 1, 2048]
    - [228, 19.24]
  - - [2112, 576, 1, 2048]
    - [389, 20.34]
  - - [2368, 576, 1, 2048]
    - [265, 19.56]
  - - [2624, 576, 1, 2048]
    - [434, 20.56]
  - - [2880, 576, 1, 2048]
    - [359, 20.59]
  - - [3136, 576, 1, 2048]
    - [244, 20.48]
  - - [3392, 576, 1, 2048]
    - [377, 20.67]
  - - [3648, 576, 1, 2048]
    - [265, 20.75]
  - - [3904, 576, 1, 2048]
    - [228, 21.71]
  - - [64, 832, 1, 2048]
    - [334, 4.63]
  - - [320, 832, 1, 2048]
    - [389, 12.5]
  - - [576, 832, 1, 2048]
    - [369, 16.24]
  - - [832, 832, 1, 2048]
    - [389, 18.08]
  - - [1088, 832, 1, 2048]
    - [379, 18.64]
  - - [1344, 832, 1, 2048]
    - [389, 19.31]
  - - [1600, 832, 1, 2048]
    - [389, 20.0]
  - - [1856, 832, 1, 2048]
    - [377, 20.33]
  - - [2112, 832, 1, 2048]
    - [362, 21.19]
  - - [2368, 832, 1, 2048]
    - [265, 21.08]
  - - [2624, 832, 1, 2048]
    - [377, 21.23]
  - - [2880, 832, 1, 2048]
    - [244, 22.24]
  - - [3136, 832, 1, 2048]
    - [228, 22.03]
  - - [3392, 832, 1, 2048]
    - [390, 21.93]
  - - [3648, 832, 1, 2048]
    - [244, 22.34]
  - - [3904, 832, 1, 2048]
    - [228, 22.75]
  - - [64, 1088, 1, 2048]
    - [377, 5.34]
  - - [320, 1088, 1, 2048]
    - [480, 14.32]
  - - [576, 1088, 1, 2048]
    - [362, 17.52]
  - - [832, 1088, 1, 2048]
    - [419, 18.44]
  - - [1088, 1088, 1, 2048]
    - [378, 18.86]
  - - [1344, 1088, 1, 2048]
    - [265, 20.02]
  - - [1600, 1088, 1, 2048]
    - [434, 19.87]
  - - [1856, 1088, 1, 2048]
    - [373, 19.84]
  - - [2112, 1088, 1, 2048]
    - [452, 20.84]
  - - [2368, 1088, 1, 2048]
    - [486, 21.92]
  - - [2624, 1088, 1, 2048]
    - [434, 21.76]
  - - [2880, 1088, 1, 2048]
    - [511, 21.9]
  - - [3136, 1088, 1, 2048]
    - [452, 21.72]
  - - [3392, 1088, 1, 2048]
    - [486, 22.4]
  - - [3648, 1088, 1, 2048]
    - [390, 22.5]
  - - [3904, 1088, 1, 2048]
    - [483, 22.92]
  - - [64, 1344, 1, 2048]
    - [402, 6.27]
  - - [320, 1344, 1, 2048]
    - [382, 16.88]
  - - [576, 1344, 1, 2048]
    - [244, 18.6]
  - - [832, 1344, 1, 2048]
    - [228, 19.31]
  - - [1088, 1344, 1, 2048]
    - [377, 20.06]
  - - [1344, 1344, 1, 2048]
    - [379, 20.56]
  - - [1600, 1344, 1, 2048]
    - [362, 21.47]
  - - [1856, 1344, 1, 2048]
    - [373, 20.93]
  - - [2112, 1344, 1, 2048]
    - [357, 21.97]
  - - [2368, 1344, 1, 2048]
    - [228, 21.8]
  - - [2624, 1344, 1, 2048]
    - [244, 22.8]
  - - [2880, 1344, 1, 2048]
    - [486, 22.99]
  - - [3136, 1344, 1, 2048]
    - [486, 22.64]
  - - [3392, 1344, 1, 2048]
    - [390, 22.88]
  - - [3648, 1344, 1, 2048]
    - [486, 23.67]
  - - [3904, 1344, 1, 2048]
    - [486, 23.71]
  - - [64, 1600, 1, 2048]
    - [389, 7.27]
  - - [320, 1600, 1, 2048]
    - [265, 16.01]
  - - [576, 1600, 1, 2048]
    - [228, 17.9]
  - - [832, 1600, 1, 2048]
    - [456, 19.66]
  - - [1088, 1600, 1, 2048]
    - [486, 19.5]
  - - [1344, 1600, 1, 2048]
    - [486, 21.1]
  - - [1600, 1600, 1, 2048]
    - [486, 21.04]
  - - [1856, 1600, 1, 2048]
    - [480, 21.0]
  - - [2112, 1600, 1, 2048]
    - [486, 22.51]
  - - [2368, 1600, 1, 2048]
    - [486, 23.01]
  - - [2624, 1600, 1, 2048]
    - [434, 23.24]
  - - [2880, 1600, 1, 2048]
    - [390, 23.37]
  - - [3136, 1600, 1, 2048]
    - [486, 23.58]
  - - [3392, 1600, 1, 2048]
    - [452, 23.82]
  - - [3648, 1600, 1, 2048]
    - [390, 24.13]
  - - [3904, 1600, 1, 2048]
    - [434, 24.2]
  - - [64, 1856, 1, 2048]
    - [384, 8.14]
  - - [320, 1856, 1, 2048]
    - [331, 16.0]
  - - [576, 1856, 1, 2048]
    - [331, 18.75]
  - - [832, 1856, 1, 2048]
    - [420, 20.05]
  - - [1088, 1856, 1, 2048]
    - [483, 19.38]
  - - [1344, 1856, 1, 2048]
    - [347, 21.27]
  - - [1600, 1856, 1, 2048]
    - [511, 21.59]
  - - [1856, 1856, 1, 2048]
    - [486, 22.16]
  - - [2112, 1856, 1, 2048]
    - [486, 23.44]
  - - [2368, 1856, 1, 2048]
    - [390, 23.87]
  - - [2624, 1856, 1, 2048]
    - [390, 23.65]
  - - [2880, 1856, 1, 2048]
    - [390, 24.17]
  - - [3136, 1856, 1, 2048]
    - [511, 24.0]
  - - [3392, 1856, 1, 2048]
    - [390, 24.6]
  - - [3648, 1856, 1, 2048]
    - [452, 24.64]
  - - [3904, 1856, 1, 2048]
    - [390, 24.75]
  - - [64, 2112, 1, 2048]
    - [389, 8.31]
  - - [320, 2112, 1, 2048]
    - [357, 17.45]
  - - [576, 2112, 1, 2048]
    - [389, 19.92]
  - - [832, 2112, 1, 2048]
    - [389, 21.14]
  - - [1088, 2112, 1, 2048]
    - [389, 21.34]
  - - [1344, 2112, 1, 2048]
    - [390, 22.12]
  - - [1600, 2112, 1, 2048]
    - [452, 22.55]
  - - [1856, 2112, 1, 2048]
    - [390, 23.65]
  - - [2112, 2112, 1, 2048]
    - [486, 23.12]
  - - [2368, 2112, 1, 2048]
    - [486, 23.53]
  - - [2624, 2112, 1, 2048]
    - [434, 23.89]
  - - [2880, 2112, 1, 2048]
    - [390, 24.25]
  - - [3136, 2112, 1, 2048]
    - [452, 25.05]
  - - [3392, 2112, 1, 2048]
    - [452, 24.82]
  - - [3648, 2112, 1, 2048]
    - [486, 25.19]
  - - [3904, 2112, 1, 2048]
    - [390, 25.33]
  - - [64, 2368, 1, 2048]
    - [228, 8.64]
  - - [320, 2368, 1, 2048]
    - [448, 16.49]
  - - [576, 2368, 1, 2048]
    - [449, 19.38]
  - - [832, 2368, 1, 2048]
    - [334, 20.52]
  - - [1088, 2368, 1, 2048]
    - [486, 21.1]
  - - [1344, 2368, 1, 2048]
    - [228, 22.35]
  - - [1600, 2368, 1, 2048]
    - [452, 22.35]
  - - [1856, 2368, 1, 2048]
    - [390, 23.85]
  - - [2112, 2368, 1, 2048]
    - [452, 23.44]
  - - [2368, 2368, 1, 2048]
    - [511, 23.86]
  - - [2624, 2368, 1, 2048]
    - [452, 24.61]
  - - [2880, 2368, 1, 2048]
    - [511, 24.09]
  - - [3136, 2368, 1, 2048]
    - [486, 24.93]
  - - [3392, 2368, 1, 2048]
    - [486, 25.05]
  - - [3648, 2368, 1, 2048]
    - [486, 24.97]
  - - [3904, 2368, 1, 2048]
    - [452, 25.19]
  - - [64, 2624, 1, 2048]
    - [482, 9.67]
  - - [320, 2624, 1, 2048]
    - [449, 17.61]
  - - [576, 2624, 1, 2048]
    - [373, 20.18]
  - - [832, 2624, 1, 2048]
    - [372, 21.36]
  - - [1088, 2624, 1, 2048]
    - [486, 22.18]
  - - [1344, 2624, 1, 2048]
    - [372, 23.08]
  - - [1600, 2624, 1, 2048]
    - [471, 23.71]
  - - [1856, 2624, 1, 2048]
    - [373, 23.27]
  - - [2112, 2624, 1, 2048]
    - [390, 23.91]
  - - [2368, 2624, 1, 2048]
    - [471, 24.53]
  - - [2624, 2624, 1, 2048]
    - [390, 24.97]
  - - [2880, 2624, 1, 2048]
    - [390, 24.74]
  - - [3136, 2624, 1, 2048]
    - [486, 25.08]
  - - [3392, 2624, 1, 2048]
    - [390, 25.5]
  - - [3648, 2624, 1, 2048]
    - [452, 25.32]
  - - [3904, 2624, 1, 2048]
    - [452, 25.36]
  - - [64, 2880, 1, 2048]
    - [565, 10.5]
  - - [320, 2880, 1, 2048]
    - [448, 17.25]
  - - [576, 2880, 1, 2048]
    - [335, 19.61]
  - - [832, 2880, 1, 2048]
    - [347, 20.98]
  - - [1088, 2880, 1, 2048]
    - [511, 22.12]
  - - [1344, 2880, 1, 2048]
    - [486, 22.79]
  - - [1600, 2880, 1, 2048]
    - [452, 23.46]
  - - [1856, 2880, 1, 2048]
    - [390, 23.4]
  - - [2112, 2880, 1, 2048]
    - [390, 23.8]
  - - [2368, 2880, 1, 2048]
    - [486, 24.46]
  - - [2624, 2880, 1, 2048]
    - [390, 25.13]
  - - [2880, 2880, 1, 2048]
    - [486, 24.94]
  - - [3136, 2880, 1, 2048]
    - [452, 25.52]
  - - [3392, 2880, 1, 2048]
    - [511, 24.97]
  - - [3648, 2880, 1, 2048]
    - [452, 25.22]
  - - [3904, 2880, 1, 2048]
    - [511, 25.42]
  - - [64, 3136, 1, 2048]
    - [379, 10.77]
  - - [320, 3136, 1, 2048]
    - [287, 17.94]
  - - [576, 3136, 1, 2048]
    - [362, 20.38]
  - - [832, 3136, 1, 2048]
    - [390, 22.25]
  - - [1088, 3136, 1, 2048]
    - [390, 22.35]
  - - [1344, 3136, 1, 2048]
    - [228, 22.58]
  - - [1600, 3136, 1, 2048]
    - [390, 23.25]
  - - [1856, 3136, 1, 2048]
    - [452, 23.76]
  - - [2112, 3136, 1, 2048]
    - [486, 24.81]
  - - [2368, 3136, 1, 2048]
    - [486, 24.87]
  - - [2624, 3136, 1, 2048]
    - [452, 25.49]
  - - [2880, 3136, 1, 2048]
    - [390, 25.18]
  - - [3136, 3136, 1, 2048]
    - [452, 25.07]
  - - [3392, 3136, 1, 2048]
    - [452, 25.47]
  - - [3648, 3136, 1, 2048]
    - [452, 25.14]
  - - [3904, 3136, 1, 2048]
    - [511, 25.41]
  - - [64, 3392, 1, 2048]
    - [377, 11.34]
  - - [320, 3392, 1, 2048]
    - [389, 17.93]
  - - [576, 3392, 1, 2048]
    - [379, 20.51]
  - - [832, 3392, 1, 2048]
    - [511, 21.61]
  - - [1088, 3392, 1, 2048]
    - [390, 22.42]
  - - [1344, 3392, 1, 2048]
    - [390, 22.95]
  - - [1600, 3392, 1, 2048]
    - [486, 24.39]
  - - [1856, 3392, 1, 2048]
    - [486, 24.3]
  - - [2112, 3392, 1, 2048]
    - [390, 24.9]
  - - [2368, 3392, 1, 2048]
    - [390, 24.59]
  - - [2624, 3392, 1, 2048]
    - [452, 25.13]
  - - [2880, 3392, 1, 2048]
    - [452, 24.94]
  - - [3136, 3392, 1, 2048]
    - [486, 25.0]
  - - [3392, 3392, 1, 2048]
    - [511, 25.18]
  - - [3648, 3392, 1, 2048]
    - [511, 25.1]
  - - [3904, 3392, 1, 2048]
    - [511, 25.55]
  - - [64, 3648, 1, 2048]
    - [359, 11.89]
  - - [320, 3648, 1, 2048]
    - [359, 18.89]
  - - [576, 3648, 1, 2048]
    - [265, 20.75]
  - - [832, 3648, 1, 2048]
    - [359, 21.94]
  - - [1088, 3648, 1, 2048]
    - [452, 22.22]
  - - [1344, 3648, 1, 2048]
    - [390, 23.71]
  - - [1600, 3648, 1, 2048]
    - [390, 24.3]
  - - [1856, 3648, 1, 2048]
    - [390, 24.2]
  - - [2112, 3648, 1, 2048]
    - [486, 24.54]
  - - [2368, 3648, 1, 2048]
    - [486, 24.78]
  - - [2624, 3648, 1, 2048]
    - [511, 25.06]
  - - [2880, 3648, 1, 2048]
    - [452, 25.16]
  - - [3136, 3648, 1, 2048]
    - [511, 25.26]
  - - [3392, 3648, 1, 2048]
    - [511, 25.24]
  - - [3648, 3648, 1, 2048]
    - [511, 25.47]
  - - [3904, 3648, 1, 2048]
    - [511, 25.67]
  - - [64, 3904, 1, 2048]
    - [371, 12.56]
  - - [320, 3904, 1, 2048]
    - [459, 20.03]
  - - [576, 3904, 1, 2048]
    - [372, 21.76]
  - - [832, 3904, 1, 2048]
    - [372, 22.61]
  - - [1088, 3904, 1, 2048]
    - [390, 23.0]
  - - [1344, 3904, 1, 2048]
    - [471, 23.72]
  - - [1600, 3904, 1, 2048]
    - [452, 24.0]
  - - [1856, 3904, 1, 2048]
    - [390, 24.74]
  - - [2112, 3904, 1, 2048]
    - [452, 25.14]
  - - [2368, 3904, 1, 2048]
    - [452, 25.22]
  - - [2624, 3904, 1, 2048]
    - [452, 25.08]
  - - [2880, 3904, 1, 2048]
    - [390, 25.1]
  - - [3136, 3904, 1, 2048]
    - [511, 25.28]
  - - [3392, 3904, 1, 2048]
    - [511, 25.56]
  - - [3648, 3904, 1, 2048]
    - [511, 25.37]
  - - [3904, 3904, 1, 2048]
    - [511, 24.11]
  - - [320, 64, 1, 4096]
    - [436, 3.2]
  - - [576, 64, 1, 4096]
    - [481, 4.83]
  - - [832, 64, 1, 4096]
    - [389, 6.34]
  - - [1088, 64, 1, 4096]
    - [334, 7.43]
  - - [1344, 64, 1, 4096]
    - [334, 8.89]
  - - [1600, 64, 1, 4096]
    - [512, 10.23]
  - - [1856, 64, 1, 4096]
    - [466, 11.31]
  - - [2112, 64, 1, 4096]
    - [362, 11.03]
  - - [2368, 64, 1, 4096]
    - [331, 12.83]
  - - [2624, 64, 1, 4096]
    - [331, 13.98]
  - - [2880, 64, 1, 4096]
    - [346, 14.76]
  - - [3136, 64, 1, 4096]
    - [456, 13.24]
  - - [3392, 64, 1, 4096]
    - [331, 14.88]
  - - [3648, 64, 1, 4096]
    - [389, 15.88]
  - - [3904, 64, 1, 4096]
    - [389, 16.67]
  - - [64, 320, 1, 4096]
    - [327, 3.13]
  - - [320, 320, 1, 4096]
    - [349, 9.9]
  - - [576, 320, 1, 4096]
    - [465, 13.34]
  - - [832, 320, 1, 4096]
    - [228, 15.09]
  - - [1088, 320, 1, 4096]
    - [474, 17.76]
  - - [1344, 320, 1, 4096]
    - [371, 18.04]
  - - [1600, 320, 1, 4096]
    - [411, 17.79]
  - - [1856, 320, 1, 4096]
    - [474, 17.72]
  - - [2112, 320, 1, 4096]
    - [362, 19.7]
  - - [2368, 320, 1, 4096]
    - [372, 19.98]
  - - [2624, 320, 1, 4096]
    - [434, 20.34]
  - - [2880, 320, 1, 4096]
    - [372, 19.15]
  - - [3136, 320, 1, 4096]
    - [315, 19.38]
  - - [3392, 320, 1, 4096]
    - [373, 20.47]
  - - [3648, 320, 1, 4096]
    - [448, 20.19]
  - - [3904, 320, 1, 4096]
    - [432, 21.25]
  - - [64, 576, 1, 4096]
    - [334, 4.52]
  - - [320, 576, 1, 4096]
    - [331, 15.38]
  - - [576, 576, 1, 4096]
    - [361, 15.86]
  - - [832, 576, 1, 4096]
    - [382, 18.37]
  - - [1088, 576, 1, 4096]
    - [362, 18.6]
  - - [1344, 576, 1, 4096]
    - [357, 19.81]
  - - [1600, 576, 1, 4096]
    - [456, 20.22]
  - - [1856, 576, 1, 4096]
    - [377, 20.23]
  - - [2112, 576, 1, 4096]
    - [362, 22.17]
  - - [2368, 576, 1, 4096]
    - [456, 21.25]
  - - [2624, 576, 1, 4096]
    - [432, 22.77]
  - - [2880, 576, 1, 4096]
    - [244, 21.53]
  - - [3136, 576, 1, 4096]
    - [244, 21.85]
  - - [3392, 576, 1, 4096]
    - [456, 21.85]
  - - [3648, 576, 1, 4096]
    - [244, 21.51]
  - - [3904, 576, 1, 4096]
    - [483, 22.75]
  - - [64, 832, 1, 4096]
    - [334, 6.36]
  - - [320, 832, 1, 4096]
    - [362, 15.39]
  - - [576, 832, 1, 4096]
    - [355, 19.08]
  - - [832, 832, 1, 4096]
    - [402, 19.88]
  - - [1088, 832, 1, 4096]
    - [377, 21.4]
  - - [1344, 832, 1, 4096]
    - [402, 21.34]
  - - [1600, 832, 1, 4096]
    - [244, 22.3]
  - - [1856, 832, 1, 4096]
    - [389, 23.21]
  - - [2112, 832, 1, 4096]
    - [228, 23.42]
  - - [2368, 832, 1, 4096]
    - [362, 23.04]
  - - [2624, 832, 1, 4096]
    - [244, 23.02]
  - - [2880, 832, 1, 4096]
    - [390, 22.12]
  - - [3136, 832, 1, 4096]
    - [390, 22.75]
  - - [3392, 832, 1, 4096]
    - [486, 23.29]
  - - [3648, 832, 1, 4096]
    - [486, 22.67]
  - - [3904, 832, 1, 4096]
    - [434, 23.14]
  - - [64, 1088, 1, 4096]
    - [361, 7.6]
  - - [320, 1088, 1, 4096]
    - [484, 16.44]
  - - [576, 1088, 1, 4096]
    - [331, 19.39]
  - - [832, 1088, 1, 4096]
    - [456, 20.83]
  - - [1088, 1088, 1, 4096]
    - [373, 20.72]
  - - [1344, 1088, 1, 4096]
    - [419, 21.85]
  - - [1600, 1088, 1, 4096]
    - [483, 21.67]
  - - [1856, 1088, 1, 4096]
    - [390, 22.07]
  - - [2112, 1088, 1, 4096]
    - [372, 22.95]
  - - [2368, 1088, 1, 4096]
    - [390, 23.32]
  - - [2624, 1088, 1, 4096]
    - [432, 23.85]
  - - [2880, 1088, 1, 4096]
    - [390, 23.69]
  - - [3136, 1088, 1, 4096]
    - [471, 23.01]
  - - [3392, 1088, 1, 4096]
    - [486, 23.18]
  - - [3648, 1088, 1, 4096]
    - [486, 23.31]
  - - [3904, 1088, 1, 4096]
    - [390, 23.61]
  - - [64, 1344, 1, 4096]
    - [375, 9.33]
  - - [320, 1344, 1, 4096]
    - [369, 19.07]
  - - [576, 1344, 1, 4096]
    - [362, 20.98]
  - - [832, 1344, 1, 4096]
    - [362, 21.65]
  - - [1088, 1344, 1, 4096]
    - [244, 23.12]
  - - [1344, 1344, 1, 4096]
    - [362, 23.18]
  - - [1600, 1344, 1, 4096]
    - [362, 23.91]
  - - [1856, 1344, 1, 4096]
    - [244, 23.36]
  - - [2112, 1344, 1, 4096]
    - [390, 23.9]
  - - [2368, 1344, 1, 4096]
    - [486, 23.14]
  - - [2624, 1344, 1, 4096]
    - [434, 24.72]
  - - [2880, 1344, 1, 4096]
    - [390, 24.02]
  - - [3136, 1344, 1, 4096]
    - [486, 23.8]
  - - [3392, 1344, 1, 4096]
    - [452, 24.09]
  - - [3648, 1344, 1, 4096]
    - [452, 24.47]
  - - [3904, 1344, 1, 4096]
    - [452, 24.23]
  - - [64, 1600, 1, 4096]
    - [362, 10.35]
  - - [320, 1600, 1, 4096]
    - [355, 19.64]
  - - [576, 1600, 1, 4096]
    - [335, 20.3]
  - - [832, 1600, 1, 4096]
    - [334, 22.03]
  - - [1088, 1600, 1, 4096]
    - [372, 21.56]
  - - [1344, 1600, 1, 4096]
    - [390, 23.22]
  - - [1600, 1600, 1, 4096]
    - [486, 23.36]
  - - [1856, 1600, 1, 4096]
    - [452, 22.98]
  - - [2112, 1600, 1, 4096]
    - [486, 24.19]
  - - [2368, 1600, 1, 4096]
    - [486, 23.91]
  - - [2624, 1600, 1, 4096]
    - [432, 24.73]
  - - [2880, 1600, 1, 4096]
    - [452, 24.48]
  - - [3136, 1600, 1, 4096]
    - [452, 24.44]
  - - [3392, 1600, 1, 4096]
    - [511, 24.46]
  - - [3648, 1600, 1, 4096]
    - [452, 24.21]
  - - [3904, 1600, 1, 4096]
    - [452, 24.4]
  - - [64, 1856, 1, 4096]
    - [402, 12.25]
  - - [320, 1856, 1, 4096]
    - [372, 18.06]
  - - [576, 1856, 1, 4096]
    - [335, 20.26]
  - - [832, 1856, 1, 4096]
    - [334, 22.34]
  - - [1088, 1856, 1, 4096]
    - [390, 22.06]
  - - [1344, 1856, 1, 4096]
    - [432, 23.4]
  - - [1600, 1856, 1, 4096]
    - [390, 23.43]
  - - [1856, 1856, 1, 4096]
    - [390, 23.55]
  - - [2112, 1856, 1, 4096]
    - [486, 24.95]
  - - [2368, 1856, 1, 4096]
    - [452, 24.52]
  - - [2624, 1856, 1, 4096]
    - [432, 24.84]
  - - [2880, 1856, 1, 4096]
    - [452, 24.57]
  - - [3136, 1856, 1, 4096]
    - [511, 24.78]
  - - [3392, 1856, 1, 4096]
    - [486, 24.51]
  - - [3648, 1856, 1, 4096]
    - [452, 24.46]
  - - [3904, 1856, 1, 4096]
    - [452, 23.83]
  - - [64, 2112, 1, 4096]
    - [331, 10.62]
  - - [320, 2112, 1, 4096]
    - [428, 19.09]
  - - [576, 2112, 1, 4096]
    - [362, 22.08]
  - - [832, 2112, 1, 4096]
    - [244, 23.22]
  - - [1088, 2112, 1, 4096]
    - [335, 22.84]
  - - [1344, 2112, 1, 4096]
    - [390, 24.04]
  - - [1600, 2112, 1, 4096]
    - [486, 24.4]
  - - [1856, 2112, 1, 4096]
    - [511, 24.32]
  - - [2112, 2112, 1, 4096]
    - [486, 23.73]
  - - [2368, 2112, 1, 4096]
    - [511, 24.22]
  - - [2624, 2112, 1, 4096]
    - [452, 24.34]
  - - [2880, 2112, 1, 4096]
    - [511, 24.14]
  - - [3136, 2112, 1, 4096]
    - [511, 24.65]
  - - [3392, 2112, 1, 4096]
    - [511, 23.17]
  - - [3648, 2112, 1, 4096]
    - [486, 23.28]
  - - [3904, 2112, 1, 4096]
    - [511, 23.85]
  - - [64, 2368, 1, 4096]
    - [402, 12.97]
  - - [320, 2368, 1, 4096]
    - [473, 18.57]
  - - [576, 2368, 1, 4096]
    - [362, 21.53]
  - - [832, 2368, 1, 4096]
    - [453, 22.24]
  - - [1088, 2368, 1, 4096]
    - [390, 23.69]
  - - [1344, 2368, 1, 4096]
    - [483, 23.02]
  - - [1600, 2368, 1, 4096]
    - [486, 24.25]
  - - [1856, 2368, 1, 4096]
    - [452, 24.57]
  - - [2112, 2368, 1, 4096]
    - [511, 24.62]
  - - [2368, 2368, 1, 4096]
    - [511, 24.64]
  - - [2624, 2368, 1, 4096]
    - [452, 25.1]
  - - [2880, 2368, 1, 4096]
    - [511, 24.55]
  - - [3136, 2368, 1, 4096]
    - [511, 24.55]
  - - [3392, 2368, 1, 4096]
    - [452, 23.57]
  - - [3648, 2368, 1, 4096]
    - [486, 23.32]
  - - [3904, 2368, 1, 4096]
    - [511, 23.5]
  - - [64, 2624, 1, 4096]
    - [362, 14.09]
  - - [320, 2624, 1, 4096]
    - [488, 20.59]
  - - [576, 2624, 1, 4096]
    - [373, 22.84]
  - - [832, 2624, 1, 4096]
    - [372, 23.8]
  - - [1088, 2624, 1, 4096]
    - [480, 24.38]
  - - [1344, 2624, 1, 4096]
    - [471, 24.38]
  - - [1600, 2624, 1, 4096]
    - [371, 23.92]
  - - [1856, 2624, 1, 4096]
    - [452, 24.91]
  - - [2112, 2624, 1, 4096]
    - [511, 24.65]
  - - [2368, 2624, 1, 4096]
    - [486, 23.7]
  - - [2624, 2624, 1, 4096]
    - [511, 25.44]
  - - [2880, 2624, 1, 4096]
    - [511, 25.15]
  - - [3136, 2624, 1, 4096]
    - [511, 24.85]
  - - [3392, 2624, 1, 4096]
    - [390, 23.46]
  - - [3648, 2624, 1, 4096]
    - [511, 23.54]
  - - [3904, 2624, 1, 4096]
    - [511, 24.08]
  - - [64, 2880, 1, 4096]
    - [377, 15.48]
  - - [320, 2880, 1, 4096]
    - [265, 19.19]
  - - [576, 2880, 1, 4096]
    - [362, 22.03]
  - - [832, 2880, 1, 4096]
    - [511, 21.97]
  - - [1088, 2880, 1, 4096]
    - [452, 24.36]
  - - [1344, 2880, 1, 4096]
    - [452, 24.62]
  - - [1600, 2880, 1, 4096]
    - [511, 24.66]
  - - [1856, 2880, 1, 4096]
    - [511, 24.81]
  - - [2112, 2880, 1, 4096]
    - [452, 24.94]
  - - [2368, 2880, 1, 4096]
    - [486, 24.53]
  - - [2624, 2880, 1, 4096]
    - [511, 25.27]
  - - [2880, 2880, 1, 4096]
    - [511, 25.12]
  - - [3136, 2880, 1, 4096]
    - [263, 22.65]
  - - [3392, 2880, 1, 4096]
    - [486, 23.59]
  - - [3648, 2880, 1, 4096]
    - [511, 23.52]
  - - [3904, 2880, 1, 4096]
    - [511, 24.35]
  - - [64, 3136, 1, 4096]
    - [244, 13.86]
  - - [320, 3136, 1, 4096]
    - [236, 19.05]
  - - [576, 3136, 1, 4096]
    - [362, 22.83]
  - - [832, 3136, 1, 4096]
    - [486, 23.32]
  - - [1088, 3136, 1, 4096]
    - [434, 23.22]
  - - [1344, 3136, 1, 4096]
    - [390, 24.05]
  - - [1600, 3136, 1, 4096]
    - [452, 24.86]
  - - [1856, 3136, 1, 4096]
    - [511, 24.75]
  - - [2112, 3136, 1, 4096]
    - [452, 25.07]
  - - [2368, 3136, 1, 4096]
    - [390, 23.67]
  - - [2624, 3136, 1, 4096]
    - [486, 25.36]
  - - [2880, 3136, 1, 4096]
    - [486, 24.03]
  - - [3136, 3136, 1, 4096]
    - [452, 23.48]
  - - [3392, 3136, 1, 4096]
    - [317, 22.72]
  - - [3648, 3136, 1, 4096]
    - [486, 23.41]
  - - [3904, 3136, 1, 4096]
    - [511, 23.85]
  - - [64, 3392, 1, 4096]
    - [419, 14.42]
  - - [320, 3392, 1, 4096]
    - [228, 19.47]
  - - [576, 3392, 1, 4096]
    - [449, 21.37]
  - - [832, 3392, 1, 4096]
    - [486, 23.02]
  - - [1088, 3392, 1, 4096]
    - [511, 23.62]
  - - [1344, 3392, 1, 4096]
    - [452, 24.73]
  - - [1600, 3392, 1, 4096]
    - [511, 25.6]
  - - [1856, 3392, 1, 4096]
    - [511, 24.96]
  - - [2112, 3392, 1, 4096]
    - [452, 25.08]
  - - [2368, 3392, 1, 4096]
    - [511, 24.56]
  - - [2624, 3392, 1, 4096]
    - [511, 24.34]
  - - [2880, 3392, 1, 4096]
    - [452, 23.04]
  - - [3136, 3392, 1, 4096]
    - [452, 24.64]
  - - [3392, 3392, 1, 4096]
    - [511, 23.7]
  - - [3648, 3392, 1, 4096]
    - [486, 23.3]
  - - [3904, 3392, 1, 4096]
    - [486, 23.99]
  - - [64, 3648, 1, 4096]
    - [442, 15.59]
  - - [320, 3648, 1, 4096]
    - [265, 21.1]
  - - [576, 3648, 1, 4096]
    - [449, 20.94]
  - - [832, 3648, 1, 4096]
    - [390, 22.86]
  - - [1088, 3648, 1, 4096]
    - [511, 23.69]
  - - [1344, 3648, 1, 4096]
    - [511, 25.14]
  - - [1600, 3648, 1, 4096]
    - [511, 24.93]
  - - [1856, 3648, 1, 4096]
    - [511, 24.57]
  - - [2112, 3648, 1, 4096]
    - [390, 23.85]
  - - [2368, 3648, 1, 4096]
    - [452, 23.32]
  - - [2624, 3648, 1, 4096]
    - [452, 24.46]
  - - [2880, 3648, 1, 4096]
    - [390, 23.47]
  - - [3136, 3648, 1, 4096]
    - [486, 23.69]
  - - [3392, 3648, 1, 4096]
    - [486, 23.12]
  - - [3648, 3648, 1, 4096]
    - [486, 23.59]
  - - [3904, 3648, 1, 4096]
    - [486, 23.79]
  - - [64, 3904, 1, 4096]
    - [335, 15.79]
  - - [320, 3904, 1, 4096]
    - [459, 21.68]
  - - [576, 3904, 1, 4096]
    - [373, 22.69]
  - - [832, 3904, 1, 4096]
    - [511, 23.49]
  - - [1088, 3904, 1, 4096]
    - [486, 24.0]
  - - [1344, 3904, 1, 4096]
    - [452, 24.54]
  - - [1600, 3904, 1, 4096]
    - [511, 24.94]
  - - [1856, 3904, 1, 4096]
    - [452, 25.17]
  - - [2112, 3904, 1, 4096]
    - [486, 24.86]
  - - [2368, 3904, 1, 4096]
    - [390, 23.91]
  - - [2624, 3904, 1, 4096]
    - [452, 24.47]
  - - [2880, 3904, 1, 4096]
    - [390, 23.72]
  - - [3136, 3904, 1, 4096]
    - [486, 23.75]
  - - [3392, 3904, 1, 4096]
    - [486, 23.51]
  - - [3648, 3904, 1, 4096]
    - [390, 23.69]
  - - [3904, 3904, 1, 4096]
    - [486, 23.84]
  - - [192, 64, 1, 64]
    - [162, 0.06]
  - - [448, 64, 1, 64]
    - [166, 0.14]
  - - [704, 64, 1, 64]
    - [170, 0.21]
  - - [960, 64, 1, 64]
    - [174, 0.27]
  - - [1216, 64, 1, 64]
    - [490, 0.35]
  - - [1472, 64, 1, 64]
    - [347, 0.42]
  - - [1728, 64, 1, 64]
    - [255, 0.47]
  - - [1984, 64, 1, 64]
    - [198, 0.61]
  - - [64, 192, 1, 64]
    - [189, 0.06]
  - - [192, 192, 1, 64]
    - [191, 0.17]
  - - [320, 192, 1, 64]
    - [193, 0.28]
  - - [448, 192, 1, 64]
    - [195, 0.4]
  - - [576, 192, 1, 64]
    - [197, 0.47]
  - - [704, 192, 1, 64]
    - [199, 0.59]
  - - [832, 192, 1, 64]
    - [198, 0.68]
  - - [960, 192, 1, 64]
    - [202, 0.83]
  - - [1088, 192, 1, 64]
    - [312, 0.91]
  - - [1216, 192, 1, 64]
    - [194, 1.02]
  - - [1344, 192, 1, 64]
    - [264, 1.11]
  - - [1472, 192, 1, 64]
    - [379, 1.18]
  - - [1600, 192, 1, 64]
    - [491, 1.17]
  - - [1728, 192, 1, 64]
    - [203, 1.33]
  - - [1856, 192, 1, 64]
    - [230, 1.42]
  - - [1984, 192, 1, 64]
    - [198, 1.38]
  - - [192, 320, 1, 64]
    - [219, 0.29]
  - - [448, 320, 1, 64]
    - [223, 0.64]
  - - [704, 320, 1, 64]
    - [226, 0.97]
  - - [960, 320, 1, 64]
    - [230, 1.26]
  - - [1216, 320, 1, 64]
    - [253, 1.51]
  - - [1472, 320, 1, 64]
    - [257, 1.62]
  - - [1728, 320, 1, 64]
    - [203, 1.91]
  - - [1984, 320, 1, 64]
    - [291, 2.1]
  - - [64, 448, 1, 64]
    - [247, 0.14]
  - - [192, 448, 1, 64]
    - [249, 0.41]
  - - [320, 448, 1, 64]
    - [216, 0.65]
  - - [448, 448, 1, 64]
    - [235, 0.87]
  - - [576, 448, 1, 64]
    - [251, 1.04]
  - - [704, 448, 1, 64]
    - [253, 1.19]
  - - [832, 448, 1, 64]
    - [255, 1.4]
  - - [960, 448, 1, 64]
    - [257, 1.58]
  - - [1088, 448, 1, 64]
    - [308, 1.66]
  - - [1216, 448, 1, 64]
    - [203, 1.79]
  - - [1344, 448, 1, 64]
    - [257, 1.96]
  - - [1472, 448, 1, 64]
    - [257, 2.18]
  - - [1600, 448, 1, 64]
    - [257, 2.15]
  - - [1728, 448, 1, 64]
    - [291, 2.28]
  - - [1856, 448, 1, 64]
    - [272, 2.52]
  - - [1984, 448, 1, 64]
    - [230, 2.49]
  - - [192, 576, 1, 64]
    - [249, 0.52]
  - - [448, 576, 1, 64]
    - [264, 1.01]
  - - [704, 576, 1, 64]
    - [256, 1.43]
  - - [960, 576, 1, 64]
    - [275, 1.8]
  - - [1216, 576, 1, 64]
    - [230, 2.12]
  - - [1472, 576, 1, 64]
    - [192, 2.43]
  - - [1728, 576, 1, 64]
    - [272, 2.73]
  - - [1984, 576, 1, 64]
    - [257, 3.05]
  - - [64, 704, 1, 64]
    - [289, 0.22]
  - - [192, 704, 1, 64]
    - [236, 0.61]
  - - [320, 704, 1, 64]
    - [257, 0.98]
  - - [448, 704, 1, 64]
    - [168, 1.27]
  - - [576, 704, 1, 64]
    - [230, 1.51]
  - - [704, 704, 1, 64]
    - [265, 1.66]
  - - [832, 704, 1, 64]
    - [294, 1.92]
  - - [960, 704, 1, 64]
    - [198, 2.2]
  - - [1088, 704, 1, 64]
    - [257, 2.3]
  - - [1216, 704, 1, 64]
    - [228, 2.53]
  - - [1344, 704, 1, 64]
    - [430, 2.72]
  - - [1472, 704, 1, 64]
    - [257, 2.91]
  - - [1600, 704, 1, 64]
    - [257, 3.05]
  - - [1728, 704, 1, 64]
    - [230, 3.27]
  - - [1856, 704, 1, 64]
    - [272, 3.09]
  - - [1984, 704, 1, 64]
    - [230, 3.51]
  - - [192, 832, 1, 64]
    - [216, 0.72]
  - - [448, 832, 1, 64]
    - [272, 1.46]
  - - [704, 832, 1, 64]
    - [230, 2.03]
  - - [960, 832, 1, 64]
    - [257, 2.49]
  - - [1216, 832, 1, 64]
    - [256, 2.85]
  - - [1472, 832, 1, 64]
    - [257, 3.2]
  - - [1728, 832, 1, 64]
    - [257, 3.39]
  - - [1984, 832, 1, 64]
    - [257, 3.7]
  - - [64, 960, 1, 64]
    - [280, 0.28]
  - - [192, 960, 1, 64]
    - [311, 0.77]
  - - [320, 960, 1, 64]
    - [272, 1.17]
  - - [448, 960, 1, 64]
    - [203, 1.57]
  - - [576, 960, 1, 64]
    - [198, 1.86]
  - - [704, 960, 1, 64]
    - [192, 2.06]
  - - [832, 960, 1, 64]
    - [230, 2.33]
  - - [960, 960, 1, 64]
    - [203, 2.54]
  - - [1088, 960, 1, 64]
    - [492, 2.75]
  - - [1216, 960, 1, 64]
    - [198, 2.96]
  - - [1344, 960, 1, 64]
    - [257, 3.31]
  - - [1472, 960, 1, 64]
    - [272, 3.28]
  - - [1600, 960, 1, 64]
    - [257, 3.5]
  - - [1728, 960, 1, 64]
    - [230, 3.61]
  - - [1856, 960, 1, 64]
    - [257, 3.73]
  - - [1984, 960, 1, 64]
    - [272, 3.76]
  - - [192, 1088, 1, 64]
    - [198, 0.9]
  - - [448, 1088, 1, 64]
    - [493, 1.77]
  - - [704, 1088, 1, 64]
    - [257, 2.26]
  - - [960, 1088, 1, 64]
    - [256, 2.73]
  - - [1216, 1088, 1, 64]
    - [223, 2.93]
  - - [1472, 1088, 1, 64]
    - [494, 3.55]
  - - [1728, 1088, 1, 64]
    - [253, 3.64]
  - - [1984, 1088, 1, 64]
    - [257, 4.25]
  - - [64, 1216, 1, 64]
    - [236, 0.33]
  - - [192, 1216, 1, 64]
    - [194, 0.93]
  - - [320, 1216, 1, 64]
    - [203, 1.39]
  - - [448, 1216, 1, 64]
    - [198, 1.86]
  - - [576, 1216, 1, 64]
    - [240, 2.13]
  - - [704, 1216, 1, 64]
    - [291, 2.42]
  - - [832, 1216, 1, 64]
    - [256, 2.71]
  - - [960, 1216, 1, 64]
    - [257, 3.06]
  - - [1088, 1216, 1, 64]
    - [257, 3.29]
  - - [1216, 1216, 1, 64]
    - [257, 3.54]
  - - [1344, 1216, 1, 64]
    - [230, 3.76]
  - - [1472, 1216, 1, 64]
    - [257, 3.84]
  - - [1600, 1216, 1, 64]
    - [203, 3.79]
  - - [1728, 1216, 1, 64]
    - [230, 4.11]
  - - [1856, 1216, 1, 64]
    - [308, 4.13]
  - - [1984, 1216, 1, 64]
    - [198, 4.27]
  - - [192, 1344, 1, 64]
    - [495, 1.02]
  - - [448, 1344, 1, 64]
    - [257, 1.93]
  - - [704, 1344, 1, 64]
    - [496, 2.64]
  - - [960, 1344, 1, 64]
    - [221, 3.1]
  - - [1216, 1344, 1, 64]
    - [230, 3.82]
  - - [1472, 1344, 1, 64]
    - [257, 4.09]
  - - [1728, 1344, 1, 64]
    - [313, 4.13]
  - - [1984, 1344, 1, 64]
    - [203, 4.37]
  - - [64, 1472, 1, 64]
    - [497, 0.42]
  - - [192, 1472, 1, 64]
    - [498, 1.1]
  - - [320, 1472, 1, 64]
    - [256, 1.61]
  - - [448, 1472, 1, 64]
    - [257, 2.05]
  - - [576, 1472, 1, 64]
    - [230, 2.46]
  - - [704, 1472, 1, 64]
    - [203, 2.75]
  - - [832, 1472, 1, 64]
    - [256, 3.01]
  - - [960, 1472, 1, 64]
    - [492, 3.26]
  - - [1088, 1472, 1, 64]
    - [257, 3.54]
  - - [1216, 1472, 1, 64]
    - [230, 3.76]
  - - [1344, 1472, 1, 64]
    - [230, 3.95]
  - - [1472, 1472, 1, 64]
    - [230, 4.21]
  - - [1600, 1472, 1, 64]
    - [230, 4.3]
  - - [1728, 1472, 1, 64]
    - [257, 4.38]
  - - [1856, 1472, 1, 64]
    - [230, 4.47]
  - - [1984, 1472, 1, 64]
    - [494, 4.57]
  - - [192, 1600, 1, 64]
    - [256, 1.18]
  - - [448, 1600, 1, 64]
    - [272, 2.19]
  - - [704, 1600, 1, 64]
    - [272, 2.9]
  - - [960, 1600, 1, 64]
    - [257, 3.53]
  - - [1216, 1600, 1, 64]
    - [198, 3.8]
  - - [1472, 1600, 1, 64]
    - [198, 4.18]
  - - [1728, 1600, 1, 64]
    - [230, 4.5]
  - - [1984, 1600, 1, 64]
    - [257, 4.87]
  - - [64, 1728, 1, 64]
    - [221, 0.48]
  - - [192, 1728, 1, 64]
    - [273, 1.23]
  - - [320, 1728, 1, 64]
    - [230, 1.84]
  - - [448, 1728, 1, 64]
    - [230, 2.31]
  - - [576, 1728, 1, 64]
    - [257, 2.73]
  - - [704, 1728, 1, 64]
    - [257, 3.09]
  - - [832, 1728, 1, 64]
    - [257, 3.4]
  - - [960, 1728, 1, 64]
    - [230, 3.62]
  - - [1088, 1728, 1, 64]
    - [257, 3.9]
  - - [1216, 1728, 1, 64]
    - [257, 4.05]
  - - [1344, 1728, 1, 64]
    - [198, 4.14]
  - - [1472, 1728, 1, 64]
    - [230, 4.37]
  - - [1600, 1728, 1, 64]
    - [257, 4.45]
  - - [1728, 1728, 1, 64]
    - [230, 4.72]
  - - [1856, 1728, 1, 64]
    - [257, 4.74]
  - - [1984, 1728, 1, 64]
    - [494, 4.85]
  - - [192, 1856, 1, 64]
    - [299, 1.29]
  - - [448, 1856, 1, 64]
    - [230, 2.42]
  - - [704, 1856, 1, 64]
    - [230, 3.16]
  - - [960, 1856, 1, 64]
    - [257, 3.82]
  - - [1216, 1856, 1, 64]
    - [230, 3.59]
  - - [1472, 1856, 1, 64]
    - [257, 4.46]
  - - [1728, 1856, 1, 64]
    - [494, 4.71]
  - - [1984, 1856, 1, 64]
    - [501, 4.49]
  - - [64, 1984, 1, 64]
    - [272, 0.54]
  - - [192, 1984, 1, 64]
    - [502, 1.39]
  - - [320, 1984, 1, 64]
    - [291, 1.99]
  - - [448, 1984, 1, 64]
    - [257, 2.52]
  - - [576, 1984, 1, 64]
    - [198, 2.94]
  - - [704, 1984, 1, 64]
    - [230, 3.35]
  - - [832, 1984, 1, 64]
    - [257, 3.63]
  - - [960, 1984, 1, 64]
    - [257, 3.8]
  - - [1088, 1984, 1, 64]
    - [257, 4.12]
  - - [1216, 1984, 1, 64]
    - [494, 4.22]
  - - [1344, 1984, 1, 64]
    - [257, 4.46]
  - - [1472, 1984, 1, 64]
    - [257, 4.62]
  - - [1600, 1984, 1, 64]
    - [230, 4.9]
  - - [1728, 1984, 1, 64]
    - [230, 4.88]
  - - [1856, 1984, 1, 64]
    - [230, 5.06]
  - - [1984, 1984, 1, 64]
    - [230, 5.33]
  - - [192, 64, 1, 256]
    - [326, 0.22]
  - - [448, 64, 1, 256]
    - [329, 0.48]
  - - [704, 64, 1, 256]
    - [333, 0.8]
  - - [960, 64, 1, 256]
    - [335, 1.02]
  - - [1216, 64, 1, 256]
    - [402, 1.3]
  - - [1472, 64, 1, 256]
    - [503, 1.51]
  - - [1728, 64, 1, 256]
    - [331, 1.83]
  - - [1984, 64, 1, 256]
    - [202, 1.93]
  - - [64, 192, 1, 256]
    - [344, 0.22]
  - - [192, 192, 1, 256]
    - [218, 0.62]
  - - [320, 192, 1, 256]
    - [347, 0.99]
  - - [448, 192, 1, 256]
    - [349, 1.42]
  - - [576, 192, 1, 256]
    - [331, 1.76]
  - - [704, 192, 1, 256]
    - [311, 2.0]
  - - [832, 192, 1, 256]
    - [195, 2.45]
  - - [960, 192, 1, 256]
    - [350, 2.64]
  - - [1088, 192, 1, 256]
    - [377, 2.77]
  - - [1216, 192, 1, 256]
    - [334, 3.27]
  - - [1344, 192, 1, 256]
    - [355, 3.58]
  - - [1472, 192, 1, 256]
    - [199, 3.68]
  - - [1600, 192, 1, 256]
    - [346, 4.0]
  - - [1728, 192, 1, 256]
    - [363, 4.15]
  - - [1856, 192, 1, 256]
    - [182, 4.3]
  - - [1984, 192, 1, 256]
    - [357, 4.53]
  - - [192, 320, 1, 256]
    - [361, 1.07]
  - - [448, 320, 1, 256]
    - [335, 2.25]
  - - [704, 320, 1, 256]
    - [228, 3.17]
  - - [960, 320, 1, 256]
    - [362, 3.7]
  - - [1216, 320, 1, 256]
    - [194, 4.32]
  - - [1472, 320, 1, 256]
    - [216, 4.88]
  - - [1728, 320, 1, 256]
    - [172, 5.53]
  - - [1984, 320, 1, 256]
    - [228, 5.96]
  - - [64, 448, 1, 256]
    - [374, 0.52]
  - - [192, 448, 1, 256]
    - [375, 1.41]
  - - [320, 448, 1, 256]
    - [376, 2.09]
  - - [448, 448, 1, 256]
    - [377, 2.87]
  - - [576, 448, 1, 256]
    - [220, 3.52]
  - - [704, 448, 1, 256]
    - [379, 4.06]
  - - [832, 448, 1, 256]
    - [287, 4.53]
  - - [960, 448, 1, 256]
    - [221, 4.87]
  - - [1088, 448, 1, 256]
    - [287, 5.08]
  - - [1216, 448, 1, 256]
    - [335, 5.6]
  - - [1344, 448, 1, 256]
    - [379, 5.96]
  - - [1472, 448, 1, 256]
    - [228, 6.16]
  - - [1600, 448, 1, 256]
    - [359, 6.82]
  - - [1728, 448, 1, 256]
    - [378, 6.8]
  - - [1856, 448, 1, 256]
    - [312, 7.38]
  - - [1984, 448, 1, 256]
    - [228, 7.82]
  - - [192, 576, 1, 256]
    - [384, 1.82]
  - - [448, 576, 1, 256]
    - [228, 3.52]
  - - [704, 576, 1, 256]
    - [228, 4.69]
  - - [960, 576, 1, 256]
    - [231, 5.51]
  - - [1216, 576, 1, 256]
    - [359, 6.43]
  - - [1472, 576, 1, 256]
    - [228, 7.05]
  - - [1728, 576, 1, 256]
    - [369, 7.67]
  - - [1984, 576, 1, 256]
    - [265, 8.21]
  - - [64, 704, 1, 256]
    - [174, 0.75]
  - - [192, 704, 1, 256]
    - [280, 2.0]
  - - [320, 704, 1, 256]
    - [363, 3.02]
  - - [448, 704, 1, 256]
    - [372, 3.95]
  - - [576, 704, 1, 256]
    - [228, 4.53]
  - - [704, 704, 1, 256]
    - [379, 5.1]
  - - [832, 704, 1, 256]
    - [228, 5.71]
  - - [960, 704, 1, 256]
    - [228, 6.3]
  - - [1088, 704, 1, 256]
    - [411, 6.78]
  - - [1216, 704, 1, 256]
    - [228, 7.12]
  - - [1344, 704, 1, 256]
    - [228, 7.57]
  - - [1472, 704, 1, 256]
    - [369, 7.82]
  - - [1600, 704, 1, 256]
    - [291, 8.09]
  - - [1728, 704, 1, 256]
    - [235, 8.4]
  - - [1856, 704, 1, 256]
    - [359, 9.33]
  - - [1984, 704, 1, 256]
    - [357, 9.44]
  - - [192, 832, 1, 256]
    - [195, 2.32]
  - - [448, 832, 1, 256]
    - [371, 4.42]
  - - [704, 832, 1, 256]
    - [382, 5.57]
  - - [960, 832, 1, 256]
    - [228, 6.86]
  - - [1216, 832, 1, 256]
    - [228, 7.7]
  - - [1472, 832, 1, 256]
    - [449, 8.51]
  - - [1728, 832, 1, 256]
    - [359, 9.41]
  - - [1984, 832, 1, 256]
    - [347, 9.34]
  - - [64, 960, 1, 256]
    - [187, 1.01]
  - - [192, 960, 1, 256]
    - [334, 2.64]
  - - [320, 960, 1, 256]
    - [371, 3.87]
  - - [448, 960, 1, 256]
    - [287, 4.77]
  - - [576, 960, 1, 256]
    - [228, 5.77]
  - - [704, 960, 1, 256]
    - [331, 6.39]
  - - [832, 960, 1, 256]
    - [359, 6.91]
  - - [960, 960, 1, 256]
    - [228, 7.38]
  - - [1088, 960, 1, 256]
    - [228, 7.9]
  - - [1216, 960, 1, 256]
    - [382, 8.25]
  - - [1344, 960, 1, 256]
    - [294, 8.49]
  - - [1472, 960, 1, 256]
    - [228, 8.88]
  - - [1600, 960, 1, 256]
    - [373, 9.1]
  - - [1728, 960, 1, 256]
    - [228, 9.83]
  - - [1856, 960, 1, 256]
    - [265, 10.07]
  - - [1984, 960, 1, 256]
    - [461, 10.31]
  - - [192, 1088, 1, 256]
    - [335, 3.07]
  - - [448, 1088, 1, 256]
    - [372, 5.49]
  - - [704, 1088, 1, 256]
    - [228, 6.85]
  - - [960, 1088, 1, 256]
    - [504, 7.78]
  - - [1216, 1088, 1, 256]
    - [228, 8.63]
  - - [1472, 1088, 1, 256]
    - [372, 9.29]
  - - [1728, 1088, 1, 256]
    - [228, 10.63]
  - - [1984, 1088, 1, 256]
    - [172, 10.24]
  - - [64, 1216, 1, 256]
    - [505, 1.27]
  - - [192, 1216, 1, 256]
    - [363, 3.26]
  - - [320, 1216, 1, 256]
    - [372, 4.76]
  - - [448, 1216, 1, 256]
    - [315, 5.64]
  - - [576, 1216, 1, 256]
    - [379, 6.69]
  - - [704, 1216, 1, 256]
    - [265, 7.14]
  - - [832, 1216, 1, 256]
    - [373, 7.7]
  - - [960, 1216, 1, 256]
    - [378, 8.28]
  - - [1088, 1216, 1, 256]
    - [371, 8.9]
  - - [1216, 1216, 1, 256]
    - [372, 9.09]
  - - [1344, 1216, 1, 256]
    - [369, 9.77]
  - - [1472, 1216, 1, 256]
    - [372, 9.81]
  - - [1600, 1216, 1, 256]
    - [373, 10.72]
  - - [1728, 1216, 1, 256]
    - [228, 10.91]
  - - [1856, 1216, 1, 256]
    - [235, 10.7]
  - - [1984, 1216, 1, 256]
    - [245, 11.01]
  - - [192, 1344, 1, 256]
    - [331, 3.56]
  - - [448, 1344, 1, 256]
    - [382, 5.96]
  - - [704, 1344, 1, 256]
    - [430, 7.57]
  - - [960, 1344, 1, 256]
    - [392, 8.99]
  - - [1216, 1344, 1, 256]
    - [372, 9.58]
  - - [1472, 1344, 1, 256]
    - [372, 10.17]
  - - [1728, 1344, 1, 256]
    - [379, 10.81]
  - - [1984, 1344, 1, 256]
    - [287, 11.05]
  - - [64, 1472, 1, 256]
    - [350, 1.6]
  - - [192, 1472, 1, 256]
    - [357, 3.81]
  - - [320, 1472, 1, 256]
    - [373, 5.24]
  - - [448, 1472, 1, 256]
    - [359, 6.52]
  - - [576, 1472, 1, 256]
    - [359, 7.84]
  - - [704, 1472, 1, 256]
    - [363, 7.89]
  - - [832, 1472, 1, 256]
    - [265, 8.63]
  - - [960, 1472, 1, 256]
    - [228, 8.83]
  - - [1088, 1472, 1, 256]
    - [228, 9.64]
  - - [1216, 1472, 1, 256]
    - [369, 9.75]
  - - [1344, 1472, 1, 256]
    - [240, 9.97]
  - - [1472, 1472, 1, 256]
    - [488, 10.23]
  - - [1600, 1472, 1, 256]
    - [228, 10.59]
  - - [1728, 1472, 1, 256]
    - [315, 10.74]
  - - [1856, 1472, 1, 256]
    - [296, 11.06]
  - - [1984, 1472, 1, 256]
    - [347, 11.53]
  - - [192, 1600, 1, 256]
    - [278, 3.83]
  - - [448, 1600, 1, 256]
    - [228, 6.47]
  - - [704, 1600, 1, 256]
    - [228, 8.0]
  - - [960, 1600, 1, 256]
    - [265, 9.16]
  - - [1216, 1600, 1, 256]
    - [379, 10.41]
  - - [1472, 1600, 1, 256]
    - [228, 10.57]
  - - [1728, 1600, 1, 256]
    - [359, 11.43]
  - - [1984, 1600, 1, 256]
    - [347, 11.84]
  - - [64, 1728, 1, 256]
    - [506, 1.79]
  - - [192, 1728, 1, 256]
    - [386, 4.17]
  - - [320, 1728, 1, 256]
    - [287, 5.58]
  - - [448, 1728, 1, 256]
    - [420, 7.06]
  - - [576, 1728, 1, 256]
    - [369, 7.77]
  - - [704, 1728, 1, 256]
    - [275, 8.43]
  - - [832, 1728, 1, 256]
    - [228, 9.02]
  - - [960, 1728, 1, 256]
    - [359, 9.66]
  - - [1088, 1728, 1, 256]
    - [265, 9.91]
  - - [1216, 1728, 1, 256]
    - [379, 10.3]
  - - [1344, 1728, 1, 256]
    - [359, 10.8]
  - - [1472, 1728, 1, 256]
    - [265, 11.07]
  - - [1600, 1728, 1, 256]
    - [265, 11.28]
  - - [1728, 1728, 1, 256]
    - [228, 11.62]
  - - [1856, 1728, 1, 256]
    - [359, 11.75]
  - - [1984, 1728, 1, 256]
    - [228, 12.24]
  - - [192, 1856, 1, 256]
    - [373, 4.26]
  - - [448, 1856, 1, 256]
    - [228, 7.02]
  - - [704, 1856, 1, 256]
    - [265, 9.04]
  - - [960, 1856, 1, 256]
    - [235, 9.79]
  - - [1216, 1856, 1, 256]
    - [371, 10.62]
  - - [1472, 1856, 1, 256]
    - [228, 11.47]
  - - [1728, 1856, 1, 256]
    - [265, 11.83]
  - - [1984, 1856, 1, 256]
    - [357, 12.12]
  - - [64, 1984, 1, 256]
    - [373, 2.05]
  - - [192, 1984, 1, 256]
    - [372, 4.49]
  - - [320, 1984, 1, 256]
    - [430, 6.4]
  - - [448, 1984, 1, 256]
    - [507, 7.28]
  - - [576, 1984, 1, 256]
    - [213, 8.53]
  - - [704, 1984, 1, 256]
    - [228, 8.89]
  - - [832, 1984, 1, 256]
    - [357, 9.78]
  - - [960, 1984, 1, 256]
    - [359, 10.21]
  - - [1088, 1984, 1, 256]
    - [488, 10.6]
  - - [1216, 1984, 1, 256]
    - [372, 10.96]
  - - [1344, 1984, 1, 256]
    - [228, 11.42]
  - - [1472, 1984, 1, 256]
    - [265, 11.5]
  - - [1600, 1984, 1, 256]
    - [461, 11.76]
  - - [1728, 1984, 1, 256]
    - [228, 11.98]
  - - [1856, 1984, 1, 256]
    - [265, 12.14]
  - - [1984, 1984, 1, 256]
    - [284, 12.22]
  - - [192, 64, 1, 512]
    - [289, 0.45]
  - - [448, 64, 1, 512]
    - [398, 0.95]
  - - [704, 64, 1, 512]
    - [400, 1.49]
  - - [960, 64, 1, 512]
    - [346, 1.96]
  - - [1216, 64, 1, 512]
    - [331, 2.42]
  - - [1472, 64, 1, 512]
    - [334, 2.86]
  - - [1728, 64, 1, 512]
    - [334, 3.28]
  - - [1984, 64, 1, 512]
    - [182, 3.63]
  - - [64, 192, 1, 512]
    - [408, 0.45]
  - - [192, 192, 1, 512]
    - [334, 1.22]
  - - [320, 192, 1, 512]
    - [402, 1.95]
  - - [448, 192, 1, 512]
    - [334, 2.62]
  - - [576, 192, 1, 512]
    - [331, 3.31]
  - - [704, 192, 1, 512]
    - [357, 3.79]
  - - [832, 192, 1, 512]
    - [334, 4.38]
  - - [960, 192, 1, 512]
    - [347, 4.72]
  - - [1088, 192, 1, 512]
    - [363, 5.19]
  - - [1216, 192, 1, 512]
    - [363, 5.71]
  - - [1344, 192, 1, 512]
    - [502, 6.12]
  - - [1472, 192, 1, 512]
    - [355, 6.1]
  - - [1600, 192, 1, 512]
    - [357, 6.48]
  - - [1728, 192, 1, 512]
    - [369, 6.59]
  - - [1856, 192, 1, 512]
    - [172, 7.1]
  - - [1984, 192, 1, 512]
    - [335, 6.9]
  - - [192, 320, 1, 512]
    - [334, 1.83]
  - - [448, 320, 1, 512]
    - [357, 3.91]
  - - [704, 320, 1, 512]
    - [331, 5.36]
  - - [960, 320, 1, 512]
    - [347, 6.39]
  - - [1216, 320, 1, 512]
    - [449, 7.9]
  - - [1472, 320, 1, 512]
    - [331, 7.84]
  - - [1728, 320, 1, 512]
    - [244, 8.41]
  - - [1984, 320, 1, 512]
    - [357, 10.2]
  - - [64, 448, 1, 512]
    - [332, 1.0]
  - - [192, 448, 1, 512]
    - [331, 2.57]
  - - [320, 448, 1, 512]
    - [357, 3.63]
  - - [448, 448, 1, 512]
    - [202, 4.85]
  - - [576, 448, 1, 512]
    - [363, 5.91]
  - - [704, 448, 1, 512]
    - [419, 6.9]
  - - [832, 448, 1, 512]
    - [334, 7.3]
  - - [960, 448, 1, 512]
    - [420, 7.99]
  - - [1088, 448, 1, 512]
    - [331, 8.19]
  - - [1216, 448, 1, 512]
    - [392, 7.72]
  - - [1344, 448, 1, 512]
    - [470, 8.08]
  - - [1472, 448, 1, 512]
    - [228, 9.17]
  - - [1600, 448, 1, 512]
    - [504, 10.23]
  - - [1728, 448, 1, 512]
    - [315, 10.64]
  - - [1856, 448, 1, 512]
    - [372, 10.2]
  - - [1984, 448, 1, 512]
    - [347, 9.95]
  - - [192, 576, 1, 512]
    - [362, 3.08]
  - - [448, 576, 1, 512]
    - [265, 5.81]
  - - [704, 576, 1, 512]
    - [335, 7.46]
  - - [960, 576, 1, 512]
    - [266, 8.54]
  - - [1216, 576, 1, 512]
    - [228, 9.78]
  - - [1472, 576, 1, 512]
    - [228, 11.44]
  - - [1728, 576, 1, 512]
    - [221, 11.05]
  - - [1984, 576, 1, 512]
    - [369, 12.43]
  - - [64, 704, 1, 512]
    - [365, 1.34]
  - - [192, 704, 1, 512]
    - [357, 3.35]
  - - [320, 704, 1, 512]
    - [425, 4.35]
  - - [448, 704, 1, 512]
    - [426, 6.45]
  - - [576, 704, 1, 512]
    - [335, 7.58]
  - - [704, 704, 1, 512]
    - [389, 8.89]
  - - [832, 704, 1, 512]
    - [331, 9.84]
  - - [960, 704, 1, 512]
    - [379, 10.25]
  - - [1088, 704, 1, 512]
    - [357, 10.81]
  - - [1216, 704, 1, 512]
    - [431, 11.22]
  - - [1344, 704, 1, 512]
    - [228, 12.13]
  - - [1472, 704, 1, 512]
    - [334, 11.91]
  - - [1600, 704, 1, 512]
    - [359, 12.61]
  - - [1728, 704, 1, 512]
    - [359, 13.04]
  - - [1856, 704, 1, 512]
    - [359, 13.52]
  - - [1984, 704, 1, 512]
    - [331, 13.24]
  - - [192, 832, 1, 512]
    - [363, 4.31]
  - - [448, 832, 1, 512]
    - [299, 7.57]
  - - [704, 832, 1, 512]
    - [335, 9.8]
  - - [960, 832, 1, 512]
    - [431, 10.62]
  - - [1216, 832, 1, 512]
    - [359, 12.23]
  - - [1472, 832, 1, 512]
    - [379, 12.73]
  - - [1728, 832, 1, 512]
    - [455, 12.98]
  - - [1984, 832, 1, 512]
    - [392, 13.11]
  - - [64, 960, 1, 512]
    - [361, 1.97]
  - - [192, 960, 1, 512]
    - [435, 4.66]
  - - [320, 960, 1, 512]
    - [373, 6.62]
  - - [448, 960, 1, 512]
    - [312, 8.03]
  - - [576, 960, 1, 512]
    - [213, 8.95]
  - - [704, 960, 1, 512]
    - [357, 10.5]
  - - [832, 960, 1, 512]
    - [379, 11.25]
  - - [960, 960, 1, 512]
    - [378, 11.17]
  - - [1088, 960, 1, 512]
    - [192, 11.72]
  - - [1216, 960, 1, 512]
    - [420, 12.37]
  - - [1344, 960, 1, 512]
    - [244, 12.6]
  - - [1472, 960, 1, 512]
    - [420, 12.91]
  - - [1600, 960, 1, 512]
    - [228, 13.86]
  - - [1728, 960, 1, 512]
    - [372, 13.68]
  - - [1856, 960, 1, 512]
    - [265, 13.7]
  - - [1984, 960, 1, 512]
    - [359, 14.22]
  - - [192, 1088, 1, 512]
    - [426, 4.75]
  - - [448, 1088, 1, 512]
    - [207, 8.11]
  - - [704, 1088, 1, 512]
    - [379, 10.59]
  - - [960, 1088, 1, 512]
    - [508, 11.73]
  - - [1216, 1088, 1, 512]
    - [265, 12.95]
  - - [1472, 1088, 1, 512]
    - [228, 13.87]
  - - [1728, 1088, 1, 512]
    - [379, 14.32]
  - - [1984, 1088, 1, 512]
    - [357, 15.36]
  - - [64, 1216, 1, 512]
    - [342, 2.33]
  - - [192, 1216, 1, 512]
    - [363, 5.6]
  - - [320, 1216, 1, 512]
    - [359, 8.26]
  - - [448, 1216, 1, 512]
    - [228, 9.51]
  - - [576, 1216, 1, 512]
    - [287, 10.53]
  - - [704, 1216, 1, 512]
    - [359, 11.46]
  - - [832, 1216, 1, 512]
    - [379, 12.14]
  - - [960, 1216, 1, 512]
    - [228, 13.17]
  - - [1088, 1216, 1, 512]
    - [389, 12.45]
  - - [1216, 1216, 1, 512]
    - [228, 13.61]
  - - [1344, 1216, 1, 512]
    - [373, 13.93]
  - - [1472, 1216, 1, 512]
    - [372, 14.6]
  - - [1600, 1216, 1, 512]
    - [372, 15.31]
  - - [1728, 1216, 1, 512]
    - [471, 14.26]
  - - [1856, 1216, 1, 512]
    - [228, 15.45]
  - - [1984, 1216, 1, 512]
    - [265, 15.61]
  - - [192, 1344, 1, 512]
    - [195, 5.71]
  - - [448, 1344, 1, 512]
    - [331, 9.13]
  - - [704, 1344, 1, 512]
    - [389, 11.61]
  - - [960, 1344, 1, 512]
    - [265, 13.12]
  - - [1216, 1344, 1, 512]
    - [357, 14.18]
  - - [1472, 1344, 1, 512]
    - [265, 14.54]
  - - [1728, 1344, 1, 512]
    - [378, 14.94]
  - - [1984, 1344, 1, 512]
    - [265, 15.63]
  - - [64, 1472, 1, 512]
    - [252, 2.62]
  - - [192, 1472, 1, 512]
    - [195, 5.9]
  - - [320, 1472, 1, 512]
    - [362, 7.85]
  - - [448, 1472, 1, 512]
    - [265, 9.61]
  - - [576, 1472, 1, 512]
    - [357, 10.87]
  - - [704, 1472, 1, 512]
    - [228, 12.39]
  - - [832, 1472, 1, 512]
    - [359, 12.83]
  - - [960, 1472, 1, 512]
    - [221, 12.7]
  - - [1088, 1472, 1, 512]
    - [265, 13.9]
  - - [1216, 1472, 1, 512]
    - [359, 14.13]
  - - [1344, 1472, 1, 512]
    - [357, 14.58]
  - - [1472, 1472, 1, 512]
    - [228, 14.93]
  - - [1600, 1472, 1, 512]
    - [359, 15.13]
  - - [1728, 1472, 1, 512]
    - [265, 15.5]
  - - [1856, 1472, 1, 512]
    - [228, 15.72]
  - - [1984, 1472, 1, 512]
    - [357, 15.86]
  - - [192, 1600, 1, 512]
    - [334, 6.17]
  - - [448, 1600, 1, 512]
    - [455, 10.25]
  - - [704, 1600, 1, 512]
    - [509, 11.73]
  - - [960, 1600, 1, 512]
    - [379, 13.47]
  - - [1216, 1600, 1, 512]
    - [228, 14.87]
  - - [1472, 1600, 1, 512]
    - [265, 15.28]
  - - [1728, 1600, 1, 512]
    - [486, 15.39]
  - - [1984, 1600, 1, 512]
    - [379, 16.08]
  - - [64, 1728, 1, 512]
    - [354, 3.01]
  - - [192, 1728, 1, 512]
    - [347, 6.73]
  - - [320, 1728, 1, 512]
    - [377, 8.49]
  - - [448, 1728, 1, 512]
    - [420, 10.5]
  - - [576, 1728, 1, 512]
    - [359, 12.27]
  - - [704, 1728, 1, 512]
    - [244, 12.53]
  - - [832, 1728, 1, 512]
    - [508, 13.27]
  - - [960, 1728, 1, 512]
    - [359, 14.34]
  - - [1088, 1728, 1, 512]
    - [228, 14.67]
  - - [1216, 1728, 1, 512]
    - [455, 14.56]
  - - [1344, 1728, 1, 512]
    - [228, 15.38]
  - - [1472, 1728, 1, 512]
    - [228, 15.7]
  - - [1600, 1728, 1, 512]
    - [390, 15.38]
  - - [1728, 1728, 1, 512]
    - [265, 16.44]
  - - [1856, 1728, 1, 512]
    - [265, 16.17]
  - - [1984, 1728, 1, 512]
    - [359, 16.6]
  - - [192, 1856, 1, 512]
    - [362, 6.97]
  - - [448, 1856, 1, 512]
    - [359, 11.72]
  - - [704, 1856, 1, 512]
    - [265, 13.54]
  - - [960, 1856, 1, 512]
    - [379, 13.82]
  - - [1216, 1856, 1, 512]
    - [220, 14.46]
  - - [1472, 1856, 1, 512]
    - [430, 14.81]
  - - [1728, 1856, 1, 512]
    - [265, 16.07]
  - - [1984, 1856, 1, 512]
    - [265, 16.27]
  - - [64, 1984, 1, 512]
    - [252, 3.44]
  - - [192, 1984, 1, 512]
    - [386, 7.27]
  - - [320, 1984, 1, 512]
    - [287, 9.61]
  - - [448, 1984, 1, 512]
    - [357, 10.74]
  - - [576, 1984, 1, 512]
    - [265, 12.51]
  - - [704, 1984, 1, 512]
    - [244, 13.09]
  - - [832, 1984, 1, 512]
    - [357, 14.07]
  - - [960, 1984, 1, 512]
    - [359, 14.36]
  - - [1088, 1984, 1, 512]
    - [379, 15.05]
  - - [1216, 1984, 1, 512]
    - [331, 14.84]
  - - [1344, 1984, 1, 512]
    - [411, 15.2]
  - - [1472, 1984, 1, 512]
    - [265, 16.01]
  - - [1600, 1984, 1, 512]
    - [347, 15.84]
  - - [1728, 1984, 1, 512]
    - [347, 16.47]
  - - [1856, 1984, 1, 512]
    - [390, 16.95]
  - - [1984, 1984, 1, 512]
    - [357, 16.77]
  - - [192, 64, 1, 1024]
    - [400, 0.76]
  - - [448, 64, 1, 1024]
    - [436, 1.66]
  - - [704, 64, 1, 1024]
    - [439, 2.39]
  - - [960, 64, 1, 1024]
    - [402, 3.21]
  - - [1216, 64, 1, 1024]
    - [334, 3.84]
  - - [1472, 64, 1, 1024]
    - [331, 4.5]
  - - [1728, 64, 1, 1024]
    - [349, 5.03]
  - - [1984, 64, 1, 1024]
    - [377, 5.61]
  - - [64, 192, 1, 1024]
    - [443, 0.78]
  - - [192, 192, 1, 1024]
    - [335, 2.02]
  - - [320, 192, 1, 1024]
    - [335, 3.26]
  - - [448, 192, 1, 1024]
    - [349, 4.1]
  - - [576, 192, 1, 1024]
    - [384, 5.06]
  - - [704, 192, 1, 1024]
    - [331, 5.87]
  - - [832, 192, 1, 1024]
    - [346, 6.37]
  - - [960, 192, 1, 1024]
    - [363, 7.05]
  - - [1088, 192, 1, 1024]
    - [363, 7.61]
  - - [1216, 192, 1, 1024]
    - [265, 8.55]
  - - [1344, 192, 1, 1024]
    - [389, 9.67]
  - - [1472, 192, 1, 1024]
    - [195, 8.99]
  - - [1600, 192, 1, 1024]
    - [235, 9.54]
  - - [1728, 192, 1, 1024]
    - [182, 9.58]
  - - [1856, 192, 1, 1024]
    - [508, 10.15]
  - - [1984, 192, 1, 1024]
    - [355, 10.98]
  - - [192, 320, 1, 1024]
    - [335, 3.18]
  - - [448, 320, 1, 1024]
    - [389, 5.82]
  - - [704, 320, 1, 1024]
    - [382, 7.84]
  - - [960, 320, 1, 1024]
    - [287, 9.57]
  - - [1216, 320, 1, 1024]
    - [312, 11.44]
  - - [1472, 320, 1, 1024]
    - [432, 11.79]
  - - [1728, 320, 1, 1024]
    - [315, 12.1]
  - - [1984, 320, 1, 1024]
    - [244, 13.96]
  - - [64, 448, 1, 1024]
    - [320, 1.64]
  - - [192, 448, 1, 1024]
    - [335, 4.06]
  - - [320, 448, 1, 1024]
    - [346, 5.92]
  - - [448, 448, 1, 1024]
    - [363, 7.54]
  - - [576, 448, 1, 1024]
    - [231, 8.66]
  - - [704, 448, 1, 1024]
    - [244, 10.64]
  - - [832, 448, 1, 1024]
    - [220, 11.01]
  - - [960, 448, 1, 1024]
    - [265, 11.64]
  - - [1088, 448, 1, 1024]
    - [465, 11.72]
  - - [1216, 448, 1, 1024]
    - [372, 12.66]
  - - [1344, 448, 1, 1024]
    - [474, 12.83]
  - - [1472, 448, 1, 1024]
    - [377, 12.55]
  - - [1600, 448, 1, 1024]
    - [221, 13.43]
  - - [1728, 448, 1, 1024]
    - [192, 13.91]
  - - [1856, 448, 1, 1024]
    - [202, 14.2]
  - - [1984, 448, 1, 1024]
    - [228, 15.47]
  - - [192, 576, 1, 1024]
    - [347, 5.17]
  - - [448, 576, 1, 1024]
    - [363, 8.98]
  - - [704, 576, 1, 1024]
    - [347, 11.25]
  - - [960, 576, 1, 1024]
    - [448, 12.28]
  - - [1216, 576, 1, 1024]
    - [228, 14.24]
  - - [1472, 576, 1, 1024]
    - [377, 15.1]
  - - [1728, 576, 1, 1024]
    - [216, 14.54]
  - - [1984, 576, 1, 1024]
    - [473, 15.47]
  - - [64, 704, 1, 1024]
    - [399, 2.43]
  - - [192, 704, 1, 1024]
    - [349, 5.74]
  - - [320, 704, 1, 1024]
    - [377, 8.62]
  - - [448, 704, 1, 1024]
    - [347, 10.42]
  - - [576, 704, 1, 1024]
    - [382, 11.51]
  - - [704, 704, 1, 1024]
    - [194, 11.86]
  - - [832, 704, 1, 1024]
    - [228, 13.83]
  - - [960, 704, 1, 1024]
    - [244, 14.0]
  - - [1088, 704, 1, 1024]
    - [359, 14.93]
  - - [1216, 704, 1, 1024]
    - [331, 14.86]
  - - [1344, 704, 1, 1024]
    - [389, 15.56]
  - - [1472, 704, 1, 1024]
    - [244, 16.31]
  - - [1600, 704, 1, 1024]
    - [359, 16.43]
  - - [1728, 704, 1, 1024]
    - [362, 16.5]
  - - [1856, 704, 1, 1024]
    - [228, 17.27]
  - - [1984, 704, 1, 1024]
    - [428, 16.55]
  - - [192, 832, 1, 1024]
    - [349, 6.68]
  - - [448, 832, 1, 1024]
    - [357, 10.75]
  - - [704, 832, 1, 1024]
    - [389, 13.82]
  - - [960, 832, 1, 1024]
    - [379, 14.81]
  - - [1216, 832, 1, 1024]
    - [359, 15.92]
  - - [1472, 832, 1, 1024]
    - [389, 16.69]
  - - [1728, 832, 1, 1024]
    - [359, 17.6]
  - - [1984, 832, 1, 1024]
    - [228, 17.93]
  - - [64, 960, 1, 1024]
    - [187, 3.19]
  - - [192, 960, 1, 1024]
    - [457, 7.45]
  - - [320, 960, 1, 1024]
    - [192, 9.58]
  - - [448, 960, 1, 1024]
    - [362, 11.22]
  - - [576, 960, 1, 1024]
    - [282, 12.91]
  - - [704, 960, 1, 1024]
    - [251, 13.03]
  - - [832, 960, 1, 1024]
    - [346, 14.34]
  - - [960, 960, 1, 1024]
    - [265, 14.79]
  - - [1088, 960, 1, 1024]
    - [510, 15.38]
  - - [1216, 960, 1, 1024]
    - [347, 16.18]
  - - [1344, 960, 1, 1024]
    - [357, 16.93]
  - - [1472, 960, 1, 1024]
    - [228, 16.72]
  - - [1600, 960, 1, 1024]
    - [265, 16.55]
  - - [1728, 960, 1, 1024]
    - [359, 17.35]
  - - [1856, 960, 1, 1024]
    - [486, 17.27]
  - - [1984, 960, 1, 1024]
    - [390, 18.12]
  - - [192, 1088, 1, 1024]
    - [389, 7.72]
  - - [448, 1088, 1, 1024]
    - [480, 12.81]
  - - [704, 1088, 1, 1024]
    - [449, 14.15]
  - - [960, 1088, 1, 1024]
    - [359, 15.66]
  - - [1216, 1088, 1, 1024]
    - [335, 16.68]
  - - [1472, 1088, 1, 1024]
    - [379, 17.24]
  - - [1728, 1088, 1, 1024]
    - [228, 18.23]
  - - [1984, 1088, 1, 1024]
    - [390, 18.91]
  - - [64, 1216, 1, 1024]
    - [349, 3.79]
  - - [192, 1216, 1, 1024]
    - [373, 9.01]
  - - [320, 1216, 1, 1024]
    - [379, 11.71]
  - - [448, 1216, 1, 1024]
    - [331, 12.5]
  - - [576, 1216, 1, 1024]
    - [265, 14.31]
  - - [704, 1216, 1, 1024]
    - [480, 15.16]
  - - [832, 1216, 1, 1024]
    - [265, 15.84]
  - - [960, 1216, 1, 1024]
    - [228, 16.83]
  - - [1088, 1216, 1, 1024]
    - [471, 16.53]
  - - [1216, 1216, 1, 1024]
    - [373, 17.84]
  - - [1344, 1216, 1, 1024]
    - [378, 17.86]
  - - [1472, 1216, 1, 1024]
    - [362, 18.12]
  - - [1600, 1216, 1, 1024]
    - [372, 19.0]
  - - [1728, 1216, 1, 1024]
    - [480, 19.0]
  - - [1856, 1216, 1, 1024]
    - [378, 18.88]
  - - [1984, 1216, 1, 1024]
    - [372, 19.32]
  - - [192, 1344, 1, 1024]
    - [244, 9.55]
  - - [448, 1344, 1, 1024]
    - [244, 13.56]
  - - [704, 1344, 1, 1024]
    - [265, 15.69]
  - - [960, 1344, 1, 1024]
    - [359, 17.26]
  - - [1216, 1344, 1, 1024]
    - [447, 16.27]
  - - [1472, 1344, 1, 1024]
    - [359, 18.12]
  - - [1728, 1344, 1, 1024]
    - [244, 18.84]
  - - [1984, 1344, 1, 1024]
    - [452, 19.04]
  - - [64, 1472, 1, 1024]
    - [375, 4.6]
  - - [192, 1472, 1, 1024]
    - [485, 9.38]
  - - [320, 1472, 1, 1024]
    - [378, 12.3]
  - - [448, 1472, 1, 1024]
    - [228, 13.5]
  - - [576, 1472, 1, 1024]
    - [420, 15.0]
  - - [704, 1472, 1, 1024]
    - [347, 16.5]
  - - [832, 1472, 1, 1024]
    - [448, 16.61]
  - - [960, 1472, 1, 1024]
    - [228, 17.09]
  - - [1088, 1472, 1, 1024]
    - [359, 16.98]
  - - [1216, 1472, 1, 1024]
    - [334, 17.43]
  - - [1344, 1472, 1, 1024]
    - [244, 17.81]
  - - [1472, 1472, 1, 1024]
    - [511, 18.02]
  - - [1600, 1472, 1, 1024]
    - [373, 18.48]
  - - [1728, 1472, 1, 1024]
    - [228, 18.72]
  - - [1856, 1472, 1, 1024]
    - [372, 18.66]
  - - [1984, 1472, 1, 1024]
    - [265, 19.29]
  - - [192, 1600, 1, 1024]
    - [335, 10.4]
  - - [448, 1600, 1, 1024]
    - [228, 15.05]
  - - [704, 1600, 1, 1024]
    - [331, 15.76]
  - - [960, 1600, 1, 1024]
    - [389, 16.69]
  - - [1216, 1600, 1, 1024]
    - [331, 17.69]
  - - [1472, 1600, 1, 1024]
    - [228, 18.83]
  - - [1728, 1600, 1, 1024]
    - [372, 18.26]
  - - [1984, 1600, 1, 1024]
    - [265, 19.66]
  - - [64, 1728, 1, 1024]
    - [172, 4.95]
  - - [192, 1728, 1, 1024]
    - [355, 10.37]
  - - [320, 1728, 1, 1024]
    - [389, 12.56]
  - - [448, 1728, 1, 1024]
    - [359, 14.77]
  - - [576, 1728, 1, 1024]
    - [347, 15.15]
  - - [704, 1728, 1, 1024]
    - [334, 16.43]
  - - [832, 1728, 1, 1024]
    - [357, 17.21]
  - - [960, 1728, 1, 1024]
    - [265, 16.82]
  - - [1088, 1728, 1, 1024]
    - [244, 17.07]
  - - [1216, 1728, 1, 1024]
    - [228, 18.13]
  - - [1344, 1728, 1, 1024]
    - [390, 18.48]
  - - [1472, 1728, 1, 1024]
    - [362, 17.85]
  - - [1600, 1728, 1, 1024]
    - [228, 18.81]
  - - [1728, 1728, 1, 1024]
    - [228, 19.1]
  - - [1856, 1728, 1, 1024]
    - [265, 18.44]
  - - [1984, 1728, 1, 1024]
    - [390, 19.66]
  - - [192, 1856, 1, 1024]
    - [431, 10.44]
  - - [448, 1856, 1, 1024]
    - [228, 15.22]
  - - [704, 1856, 1, 1024]
    - [265, 17.16]
  - - [960, 1856, 1, 1024]
    - [486, 17.02]
  - - [1216, 1856, 1, 1024]
    - [334, 18.03]
  - - [1472, 1856, 1, 1024]
    - [390, 18.81]
  - - [1728, 1856, 1, 1024]
    - [244, 18.9]
  - - [1984, 1856, 1, 1024]
    - [228, 19.91]
  - - [64, 1984, 1, 1024]
    - [402, 5.65]
  - - [192, 1984, 1, 1024]
    - [361, 10.89]
  - - [320, 1984, 1, 1024]
    - [244, 14.02]
  - - [448, 1984, 1, 1024]
    - [244, 15.66]
  - - [576, 1984, 1, 1024]
    - [359, 16.33]
  - - [704, 1984, 1, 1024]
    - [331, 16.95]
  - - [832, 1984, 1, 1024]
    - [347, 17.4]
  - - [960, 1984, 1, 1024]
    - [334, 17.99]
  - - [1088, 1984, 1, 1024]
    - [265, 18.74]
  - - [1216, 1984, 1, 1024]
    - [359, 19.13]
  - - [1344, 1984, 1, 1024]
    - [228, 19.2]
  - - [1472, 1984, 1, 1024]
    - [244, 19.3]
  - - [1600, 1984, 1, 1024]
    - [379, 19.57]
  - - [1728, 1984, 1, 1024]
    - [390, 20.1]
  - - [1856, 1984, 1, 1024]
    - [390, 20.42]
  - - [1984, 1984, 1, 1024]
    - [450, 19.99]
  - - [192, 64, 1, 2048]
    - [333, 1.31]
