projects/hipsparselt/library/src/hcc_detail/rocsparselt/src/spmm/Tensile/Logic/asm_full/aquavanjaram/gfx942/GridBased/aquavanjaram_Cijk_Ailk_Bjlk_B8NSS_BH_Bias_FDMN_SPAML0_A_S_SAV.yaml
- {MinimumRequiredVersion: 5.0.0}
- aquavanjaram
- gfx942
- [Device 0049, Device 0050]
    SolutionIndex: 0
    SolutionNameMin: Cijk_Ailk_Bjlk_B8NSS_BH_Bias_FDMN_SPAML0_A_S_SAV_MT192x320x64_MI16x16x1_SN_LDSB0_AFC1_AG0_AFEM1_AFEM1_ASEM8_CLR0_CADS0_DTLA0_DTLB0_DTVA0_DTVB0_DTVMXSA0_DTVMXSB0_DTVSM0_DPLB0_EPS1_ELFLR0_EMLLn1_FDSI0_GRPM1_GRVWA8_GRVWB16_GSUn1_GSUAMBSK_GSUC1_GSUWGMRR1_GLS0_ISA942_IU1_K1_LDSTI0_LBSPPA3072_LBSPPB5120_LBSPPM0_LPA16_LPB64_LPM0_LRVWn1_LWPMn1_MIAV0_MIWT3_20_MO40_MGRIPM1_NTn1_NTA0_NTB0_NTC0_NTD4_NTM0_NEPBS16_NLCA3_NLCB5_ONLL1_PGR2_PLR0_PKA1_SGROB0_SIA3_SS0_SU16_SUM0_SUS256_SPO0_SRVW0_SSO0_SVW4_SK0_SKFTR0_SKXCCM0_SGRO0_TDMI0_TIN0_TLDS0_TLDSM1_ULSGRO0_USL1_USLMX0_UIOFGRO0_UPLRP0_USFGROn1_USI0_VSn1_VWA1_VWB4_WSGRA0_WSGRB0_WS64_WG64_4_1_WGM1_WGMXCC1_WGMXCCGn1
    SolutionIndex: 1
    SolutionNameMin: Cijk_Ailk_Bjlk_B8NSS_BH_Bias_FDMN_SPAML0_A_S_SAV_MT320x192x64_MI16x16x1_SN_LDSB0_AFC1_AG0_AFEM1_AFEM1_ASEM8_CLR0_CADS0_DTLA0_DTLB0_DTVA0_DTVB0_DTVMXSA0_DTVMXSB0_DTVSM0_DPLB0_EPS1_ELFLR0_EMLLn1_FDSI0_GRPM1_GRVWA8_GRVWB16_GSUn1_GSUAMBSK_GSUC1_GSUWGMRR1_GLS0_ISA942_IU1_K1_LDSTI0_LBSPPA5120_LBSPPB3072_LBSPPM0_LPA16_LPB64_LPM0_LRVWn1_LWPMn1_MIAV0_MIWT5_12_MO40_MGRIPM1_NTn1_NTA0_NTB0_NTC0_NTD4_NTM0_NEPBS16_NLCA5_NLCB3_ONLL1_PGR2_PLR0_PKA1_SGROB0_SIA3_SS0_SU16_SUM0_SUS256_SPO0_SRVW0_SSO0_SVW4_SK0_SKFTR0_SKXCCM0_SGRO0_TDMI0_TIN0_TLDS0_TLDSM1_ULSGRO0_USL1_USLMX0_UIOFGRO0_UPLRP0_USFGROn1_USI0_VSn1_VWA1_VWB4_WSGRA0_WSGRB0_WS64_WG64_4_1_WGM1_WGMXCC1_WGMXCCGn1
    SolutionIndex: 2
    SolutionNameMin: Cijk_Ailk_Bjlk_B8NSS_BH_Bias_FDMN_SPAML0_A_S_SAV_MT192x256x64_MI16x16x1_SN_LDSB0_AFC1_AG0_AFEM1_AFEM1_ASEM8_CLR0_CADS0_DTLA0_DTLB0_DTVA0_DTVB0_DTVMXSA0_DTVMXSB0_DTVSM0_DPLB0_EPS1_ELFLR0_EMLLn1_FDSI0_GRPM1_GRVWA8_GRVWB16_GSUn1_GSUAMBSK_GSUC1_GSUWGMRR1_GLS0_ISA942_IU1_K1_LDSTI0_LBSPPA3072_LBSPPB0_LBSPPM0_LPA16_LPB0_LPM0_LRVWn1_LWPMn1_MIAV0_MIWT3_16_MO40_MGRIPM1_NTn1_NTA0_NTB0_NTC0_NTD4_NTM0_NEPBS16_NLCA3_NLCB1_ONLL1_PGR2_PLR0_PKA1_SGROB0_SIA3_SS0_SU16_SUM0_SUS256_SPO0_SRVW0_SSO0_SVW4_SK0_SKFTR0_SKXCCM0_SGRO0_TDMI0_TIN0_TLDS0_TLDSM1_ULSGRO0_USL1_USLMX0_UIOFGRO0_UPLRP0_USFGROn1_USI0_VSn1_VWA1_VWB16_WSGRA0_WSGRB0_WS64_WG64_4_1_WGM1_WGMXCC1_WGMXCCGn1
    SolutionIndex: 3
    SolutionNameMin: Cijk_Ailk_Bjlk_B8NSS_BH_Bias_FDMN_SPAML0_A_S_SAV_MT192x128x64_MI16x16x1_SN_LDSB0_AFC1_AG0_AFEM1_AFEM1_ASEM8_CLR0_CADS0_DTLA0_DTLB0_DTVA0_DTVB0_DTVMXSA0_DTVMXSB0_DTVSM0_DPLB0_EPS1_ELFLR0_EMLLn1_FDSI0_GRPM1_GRVWA8_GRVWB4_GSUn1_GSUAMBSK_GSUC1_GSUWGMRR1_GLS0_ISA942_IU1_K1_LDSTI0_LBSPPA3072_LBSPPB0_LBSPPM0_LPA16_LPB0_LPM0_LRVWn1_LWPMn1_MIAV0_MIWT3_8_MO40_MGRIPM1_NTn1_NTA0_NTB0_NTC0_NTD4_NTM0_NEPBS16_NLCA3_NLCB1_ONLL1_PGR2_PLR0_PKA1_SGROB0_SIA3_SS0_SU16_SUM0_SUS256_SPO0_SRVW0_SSO0_SVW4_SK0_SKFTR0_SKXCCM0_SGRO0_TDMI0_TIN0_TLDS0_TLDSM1_ULSGRO0_USL1_USLMX0_UIOFGRO0_UPLRP0_USFGROn1_USI0_VSn1_VWA1_VWB8_WSGRA0_WSGRB0_WS64_WG64_4_1_WGM8_WGMXCC8_WGMXCCGn1
    SolutionIndex: 4
    SolutionNameMin: Cijk_Ailk_Bjlk_B8NSS_BH_Bias_FDMN_SPAML0_A_S_SAV_MT192x128x64_MI16x16x1_SN_LDSB0_AFC1_AG0_AFEM1_AFEM1_ASEM8_CLR0_CADS0_DTLA0_DTLB0_DTVA0_DTVB0_DTVMXSA0_DTVMXSB0_DTVSM0_DPLB0_EPS1_ELFLR0_EMLLn1_FDSI0_GRPM1_GRVWA8_GRVWB16_GSUn1_GSUAMBSK_GSUC1_GSUWGMRR1_GLS0_ISA942_IU1_K1_LDSTI0_LBSPPA3072_LBSPPB0_LBSPPM0_LPA16_LPB0_LPM0_LRVWn1_LWPMn1_MIAV0_MIWT3_8_MO40_MGRIPM1_NTn1_NTA0_NTB0_NTC0_NTD4_NTM0_NEPBS16_NLCA3_NLCB1_ONLL1_PGR2_PLR0_PKA1_SGROB0_SIA3_SS0_SU16_SUM0_SUS256_SPO0_SRVW0_SSO0_SVW4_SK0_SKFTR0_SKXCCM0_SGRO0_TDMI0_TIN0_TLDS0_TLDSM1_ULSGRO0_USL1_USLMX0_UIOFGRO0_UPLRP0_USFGROn1_USI0_VSn1_VWA1_VWB8_WSGRA0_WSGRB0_WS64_WG64_4_1_WGM8_WGMXCC8_WGMXCCGn1
    SolutionIndex: 5
    SolutionNameMin: Cijk_Ailk_Bjlk_B8NSS_BH_Bias_FDMN_SPAML0_A_S_SAV_MT320x128x128_MI16x16x1_SN_LDSB1_AFC1_AG0_AFEM1_AFEM1_ASEM8_CLR1_CADS0_DTLA0_DTLB0_DTVA0_DTVB0_DTVMXSA0_DTVMXSB0_DTVSM0_DPLB0_EPS1_ELFLR0_EMLLn1_FDSI0_GRPM1_GRVWA16_GRVWB16_GSUn1_GSUAMBSK_GSUC1_GSUWGMRR1_GLS0_ISA942_IU1_K1_LDSTI0_LBSPPA5120_LBSPPB0_LBSPPM0_LPA16_LPB0_LPM0_LRVWn1_LWPMn1_MIAV0_MIWT5_8_MO40_MGRIPM1_NTn1_NTA0_NTB0_NTC0_NTD4_NTM0_NEPBS16_NLCA5_NLCB1_ONLL1_PGR2_PLR1_PKA1_SGROB0_SIA3_SS0_SU16_SUM0_SUS256_SPO0_SRVW0_SSO0_SVW4_SK0_SKFTR0_SKXCCM0_SGRO0_TDMI0_TIN0_TLDS0_TLDSM1_ULSGRO0_USL1_USLMX0_UIOFGRO0_UPLRP0_USFGROn1_USI0_VSn1_VWA1_VWB8_WSGRA0_WSGRB0_WS64_WG64_4_1_WGM1_WGMXCC1_WGMXCCGn1
    SolutionIndex: 6
    SolutionNameMin: Cijk_Ailk_Bjlk_B8NSS_BH_Bias_FDMN_SPAML0_A_S_SAV_MT192x128x64_MI16x16x1_SN_LDSB0_AFC1_AG0_AFEM1_AFEM1_ASEM8_CLR0_CADS0_DTLA0_DTLB0_DTVA0_DTVB0_DTVMXSA0_DTVMXSB0_DTVSM0_DPLB0_EPS1_ELFLR0_EMLLn1_FDSI0_GRPM1_GRVWA8_GRVWB16_GSUn1_GSUAMBSK_GSUC1_GSUWGMRR1_GLS0_ISA942_IU1_K1_LDSTI0_LBSPPA3072_LBSPPB0_LBSPPM0_LPA16_LPB0_LPM0_LRVWn1_LWPMn1_MIAV0_MIWT3_8_MO40_MGRIPM1_NTn1_NTA0_NTB0_NTC0_NTD4_NTM0_NEPBS16_NLCA3_NLCB1_ONLL1_PGR2_PLR0_PKA1_SGROB0_SIA3_SS0_SU16_SUM0_SUS256_SPO0_SRVW0_SSO0_SVW4_SK0_SKFTR0_SKXCCM0_SGRO0_TDMI0_TIN0_TLDS0_TLDSM1_ULSGRO0_USL1_USLMX0_UIOFGRO0_UPLRP0_USFGROn1_USI0_VSn1_VWA1_VWB8_WSGRA0_WSGRB0_WS64_WG64_4_1_WGM1_WGMXCC1_WGMXCCGn1
    SolutionIndex: 7
    SolutionNameMin: Cijk_Ailk_Bjlk_B8NSS_BH_Bias_FDMN_SPAML0_A_S_SAV_MT128x192x64_MI16x16x1_SN_LDSB1_AFC1_AG0_AFEM1_AFEM1_ASEM8_CLR0_CADS0_DTLA0_DTLB0_DTVA0_DTVB0_DTVMXSA0_DTVMXSB0_DTVSM0_DPLB0_EPS1_ELFLR0_EMLLn1_FDSI0_GRPM1_GRVWA16_GRVWB16_GSUn1_GSUAMBSK_GSUC1_GSUWGMRR1_GLS0_ISA942_IU1_K1_LDSTI0_LBSPPA2048_LBSPPB3072_LBSPPM0_LPA32_LPB32_LPM0_LRVWn1_LWPMn1_MIAV0_MIWT4_6_MO40_MGRIPM1_NTn1_NTA0_NTB0_NTC0_NTD4_NTM0_NEPBS16_NLCA1_NLCB3_ONLL1_PGR2_PLR0_PKA1_SGROB0_SIA3_SS0_SU16_SUM0_SUS256_SPO0_SRVW0_SSO0_SVW4_SK0_SKFTR0_SKXCCM0_SGRO0_TDMI0_TIN0_TLDS0_TLDSM1_ULSGRO0_USL1_USLMX0_UIOFGRO0_UPLRP0_USFGROn1_USI0_VSn1_VWA2_VWB2_WSGRA0_WSGRB0_WS64_WG32_8_1_WGM8_WGMXCC8_WGMXCCGn1
    SolutionIndex: 8
    SolutionNameMin: Cijk_Ailk_Bjlk_B8NSS_BH_Bias_FDMN_SPAML0_A_S_SAV_MT160x256x128_MI16x16x1_SN_LDSB1_AFC1_AG0_AFEM1_AFEM1_ASEM8_CLR1_CADS0_DTLA0_DTLB0_DTVA0_DTVB0_DTVMXSA0_DTVMXSB0_DTVSM0_DPLB0_EPS1_ELFLR0_EMLLn1_FDSI0_GRPM1_GRVWA8_GRVWB16_GSUn1_GSUAMBSK_GSUC1_GSUWGMRR1_GLS0_ISA942_IU1_K1_LDSTI0_LBSPPA2560_LBSPPB4096_LBSPPM0_LPA32_LPB64_LPM0_LRVWn1_LWPMn1_MIAV0_MIWT10_4_MO40_MGRIPM1_NTn1_NTA0_NTB0_NTC0_NTD4_NTM0_NEPBS16_NLCA5_NLCB1_ONLL1_PGR2_PLR1_PKA1_SGROB0_SIA3_SS0_SU16_SUM0_SUS256_SPO0_SRVW0_SSO0_SVW4_SK0_SKFTR0_SKXCCM0_SGRO0_TDMI0_TIN0_TLDS0_TLDSM1_ULSGRO0_USL1_USLMX0_UIOFGRO0_UPLRP0_USFGROn1_USI0_VSn1_VWA2_VWB4_WSGRA0_WSGRB0_WS64_WG16_16_1_WGM8_WGMXCC8_WGMXCCGn1
    SolutionIndex: 9
    SolutionNameMin: Cijk_Ailk_Bjlk_B8NSS_BH_Bias_FDMN_SPAML0_A_S_SAV_MT192x256x64_MI16x16x1_SN_LDSB0_AFC1_AG0_AFEM1_AFEM1_ASEM8_CLR0_CADS0_DTLA0_DTLB0_DTVA0_DTVB0_DTVMXSA0_DTVMXSB0_DTVSM0_DPLB0_EPS1_ELFLR0_EMLLn1_FDSI0_GRPM1_GRVWA8_GRVWB16_GSUn1_GSUAMBSK_GSUC1_GSUWGMRR1_GLS0_ISA942_IU1_K1_LDSTI0_LBSPPA3072_LBSPPB0_LBSPPM0_LPA16_LPB0_LPM0_LRVWn1_LWPMn1_MIAV0_MIWT3_16_MO40_MGRIPM1_NTn1_NTA0_NTB0_NTC0_NTD4_NTM0_NEPBS16_NLCA3_NLCB1_ONLL1_PGR2_PLR0_PKA1_SGROB0_SIA3_SS0_SU16_SUM0_SUS256_SPO0_SRVW0_SSO0_SVW4_SK0_SKFTR0_SKXCCM0_SGRO0_TDMI0_TIN0_TLDS0_TLDSM1_ULSGRO0_USL1_USLMX0_UIOFGRO0_UPLRP0_USFGROn1_USI0_VSn1_VWA1_VWB16_WSGRA0_WSGRB0_WS64_WG64_4_1_WGM8_WGMXCC8_WGMXCCGn1
    SolutionIndex: 10
    SolutionNameMin: Cijk_Ailk_Bjlk_B8NSS_BH_Bias_FDMN_SPAML0_A_S_SAV_MT192x192x64_MI16x16x1_SN_LDSB0_AFC1_AG0_AFEM1_AFEM1_ASEM8_CLR0_CADS0_DTLA0_DTLB0_DTVA0_DTVB0_DTVMXSA0_DTVMXSB0_DTVSM0_DPLB0_EPS1_ELFLR0_EMLLn1_FDSI0_GRPM1_GRVWA8_GRVWB4_GSUn1_GSUAMBSK_GSUC1_GSUWGMRR1_GLS0_ISA942_IU1_K1_LDSTI0_LBSPPA3072_LBSPPB3072_LBSPPM0_LPA16_LPB64_LPM0_LRVWn1_LWPMn1_MIAV0_MIWT3_12_MO40_MGRIPM1_NTn1_NTA0_NTB0_NTC0_NTD4_NTM0_NEPBS16_NLCA3_NLCB3_ONLL1_PGR2_PLR0_PKA1_SGROB0_SIA3_SS0_SU16_SUM0_SUS256_SPO0_SRVW0_SSO0_SVW4_SK0_SKFTR0_SKXCCM0_SGRO0_TDMI0_TIN0_TLDS0_TLDSM1_ULSGRO0_USL1_USLMX0_UIOFGRO0_UPLRP0_USFGROn1_USI0_VSn1_VWA1_VWB4_WSGRA0_WSGRB0_WS64_WG64_4_1_WGM8_WGMXCC8_WGMXCCGn1
    SolutionIndex: 11
    SolutionNameMin: Cijk_Ailk_Bjlk_B8NSS_BH_Bias_FDMN_SPAML0_A_S_SAV_MT128x96x128_MI16x16x1_SN_LDSB1_AFC1_AG0_AFEM1_AFEM1_ASEM8_CLR1_CADS0_DTLA0_DTLB0_DTVA0_DTVB0_DTVMXSA0_DTVMXSB0_DTVSM0_DPLB0_EPS1_ELFLR0_EMLLn1_FDSI0_GRPM1_GRVWA16_GRVWB16_GSUn1_GSUAMBSK_GSUC1_GSUWGMRR1_GLS0_ISA942_IU1_K1_LDSTI0_LBSPPA2048_LBSPPB1536_LBSPPM0_LPA32_LPB16_LPM0_LRVWn1_LWPMn1_MIAV0_MIWT4_3_MO40_MGRIPM1_NTn1_NTA0_NTB0_NTC0_NTD4_NTM0_NEPBS16_NLCA1_NLCB3_ONLL1_PGR2_PLR1_PKA1_SGROB0_SIA3_SS0_SU16_SUM0_SUS256_SPO0_SRVW0_SSO0_SVW4_SK0_SKFTR0_SKXCCM0_SGRO0_TDMI0_TIN0_TLDS0_TLDSM1_ULSGRO0_USL1_USLMX0_UIOFGRO0_UPLRP0_USFGROn1_USI0_VSn1_VWA2_VWB1_WSGRA0_WSGRB0_WS64_WG32_8_1_WGM8_WGMXCC8_WGMXCCGn1
    SolutionIndex: 12
    SolutionNameMin: Cijk_Ailk_Bjlk_B8NSS_BH_Bias_FDMN_SPAML0_A_S_SAV_MT96x128x128_MI16x16x1_SN_LDSB1_AFC1_AG0_AFEM1_AFEM1_ASEM8_CLR1_CADS0_DTLA0_DTLB0_DTVA0_DTVB0_DTVMXSA0_DTVMXSB0_DTVSM0_DPLB0_EPS1_ELFLR0_EMLLn1_FDSI0_GRPM1_GRVWA8_GRVWB16_GSUn1_GSUAMBSK_GSUC1_GSUWGMRR1_GLS0_ISA942_IU1_K1_LDSTI0_LBSPPA1536_LBSPPB2048_LBSPPM0_LPA16_LPB64_LPM0_LRVWn1_LWPMn1_MIAV0_MIWT3_4_MO40_MGRIPM1_NTn1_NTA0_NTB0_NTC0_NTD4_NTM0_NEPBS16_NLCA3_NLCB1_ONLL1_PGR2_PLR1_PKA1_SGROB0_SIA3_SS0_SU16_SUM0_SUS256_SPO0_SRVW0_SSO0_SVW4_SK0_SKFTR0_SKXCCM0_SGRO0_TDMI0_TIN0_TLDS0_TLDSM1_ULSGRO0_USL1_USLMX0_UIOFGRO0_UPLRP0_USFGROn1_USI0_VSn1_VWA1_VWB4_WSGRA0_WSGRB0_WS64_WG32_8_1_WGM8_WGMXCC8_WGMXCCGn1
    SolutionIndex: 13
    SolutionNameMin: Cijk_Ailk_Bjlk_B8NSS_BH_Bias_FDMN_SPAML0_A_S_SAV_MT128x96x64_MI16x16x1_SN_LDSB0_AFC1_AG0_AFEM1_AFEM1_ASEM8_CLR0_CADS0_DTLA0_DTLB0_DTVA0_DTVB0_DTVMXSA0_DTVMXSB0_DTVSM0_DPLB0_EPS1_ELFLR0_EMLLn1_FDSI0_GRPM1_GRVWA16_GRVWB4_GSUn1_GSUAMBSK_GSUC1_GSUWGMRR1_GLS0_ISA942_IU1_K1_LDSTI0_LBSPPA2048_LBSPPB1536_LBSPPM0_LPA32_LPB16_LPM0_LRVWn1_LWPMn1_MIAV0_MIWT4_3_MO40_MGRIPM1_NTn1_NTA0_NTB0_NTC0_NTD4_NTM0_NEPBS16_NLCA1_NLCB3_ONLL1_PGR2_PLR0_PKA1_SGROB0_SIA3_SS0_SU16_SUM0_SUS256_SPO0_SRVW0_SSO0_SVW4_SK0_SKFTR0_SKXCCM0_SGRO0_TDMI0_TIN0_TLDS0_TLDSM1_ULSGRO0_USL1_USLMX0_UIOFGRO0_UPLRP0_USFGROn1_USI0_VSn1_VWA2_VWB1_WSGRA0_WSGRB0_WS64_WG32_8_1_WGM8_WGMXCC8_WGMXCCGn1
    SolutionIndex: 14
    SolutionNameMin: Cijk_Ailk_Bjlk_B8NSS_BH_Bias_FDMN_SPAML0_A_S_SAV_MT16x16x256_MI16x16x1_SN_LDSB0_AFC1_AG0_AFEM1_AFEM1_ASEM8_CLR1_CADS0_DTLA0_DTLB0_DTVA0_DTVB0_DTVMXSA0_DTVMXSB0_DTVSM0_DPLB0_EPS1_ELFLR0_EMLLn1_FDSI0_GRPM1_GRVWA16_GRVWB16_GSUn1_GSUAMBSK_GSUC1_GSUWGMRR1_GLS0_ISA942_IU1_K1_LDSTI0_LBSPPA256_LBSPPB256_LBSPPM0_LPA16_LPB16_LPM0_LRVWn1_LWPMn1_MIAV0_MIWT1_1_MO40_MGRIPM1_NTn1_NTA0_NTB0_NTC0_NTD4_NTM0_NEPBS16_NLCA1_NLCB1_ONLL1_PGR2_PLR1_PKA1_SGROB0_SIA3_SS0_SU16_SUM0_SUS256_SPO0_SRVW0_SSO0_SVW4_SK0_SKFTR0_SKXCCM0_SGRO0_TDMI0_TIN0_TLDS0_TLDSM1_ULSGRO0_USL1_USLMX0_UIOFGRO0_UPLRP0_USFGROn1_USI0_VSn1_VWA1_VWB1_WSGRA0_WSGRB0_WS64_WG16_4_1_WGM1_WGMXCC1_WGMXCCGn1
    SolutionIndex: 15
    SolutionNameMin: Cijk_Ailk_Bjlk_B8NSS_BH_Bias_FDMN_SPAML0_A_S_SAV_MT320x192x64_MI16x16x1_SN_LDSB0_AFC1_AG0_AFEM1_AFEM1_ASEM8_CLR0_CADS0_DTLA0_DTLB0_DTVA0_DTVB0_DTVMXSA0_DTVMXSB0_DTVSM0_DPLB0_EPS1_ELFLR0_EMLLn1_FDSI0_GRPM1_GRVWA8_GRVWB16_GSUn1_GSUAMBSK_GSUC1_GSUWGMRR1_GLS0_ISA942_IU1_K1_LDSTI0_LBSPPA5120_LBSPPB3072_LBSPPM0_LPA16_LPB64_LPM0_LRVWn1_LWPMn1_MIAV0_MIWT5_12_MO40_MGRIPM1_NTn1_NTA0_NTB0_NTC0_NTD4_NTM0_NEPBS16_NLCA5_NLCB3_ONLL1_PGR2_PLR0_PKA1_SGROB0_SIA3_SS0_SU16_SUM0_SUS256_SPO0_SRVW0_SSO0_SVW4_SK0_SKFTR0_SKXCCM0_SGRO0_TDMI0_TIN0_TLDS0_TLDSM1_ULSGRO0_USL1_USLMX0_UIOFGRO0_UPLRP0_USFGROn1_USI0_VSn1_VWA1_VWB4_WSGRA0_WSGRB0_WS64_WG64_4_1_WGM8_WGMXCC8_WGMXCCGn1
    SolutionIndex: 16
    SolutionNameMin: Cijk_Ailk_Bjlk_B8NSS_BH_Bias_FDMN_SPAML0_A_S_SAV_MT320x128x128_MI16x16x1_SN_LDSB1_AFC1_AG0_AFEM1_AFEM1_ASEM8_CLR1_CADS0_DTLA0_DTLB0_DTVA0_DTVB0_DTVMXSA0_DTVMXSB0_DTVSM0_DPLB0_EPS1_ELFLR0_EMLLn1_FDSI0_GRPM1_GRVWA16_GRVWB16_GSUn1_GSUAMBSK_GSUC1_GSUWGMRR1_GLS0_ISA942_IU1_K1_LDSTI0_LBSPPA5120_LBSPPB0_LBSPPM0_LPA16_LPB0_LPM0_LRVWn1_LWPMn1_MIAV0_MIWT5_8_MO40_MGRIPM1_NTn1_NTA0_NTB0_NTC0_NTD4_NTM0_NEPBS16_NLCA5_NLCB1_ONLL1_PGR2_PLR1_PKA1_SGROB0_SIA3_SS0_SU16_SUM0_SUS256_SPO0_SRVW0_SSO0_SVW4_SK0_SKFTR0_SKXCCM0_SGRO0_TDMI0_TIN0_TLDS0_TLDSM1_ULSGRO0_USL1_USLMX0_UIOFGRO0_UPLRP0_USFGROn1_USI0_VSn1_VWA1_VWB8_WSGRA0_WSGRB0_WS64_WG64_4_1_WGM8_WGMXCC8_WGMXCCGn1
    SolutionIndex: 17
    SolutionNameMin: Cijk_Ailk_Bjlk_B8NSS_BH_Bias_FDMN_SPAML0_A_S_SAV_MT128x256x64_MI16x16x1_SN_LDSB1_AFC1_AG0_AFEM1_AFEM1_ASEM8_CLR0_CADS0_DTLA0_DTLB0_DTVA0_DTVB0_DTVMXSA0_DTVMXSB0_DTVSM0_DPLB0_EPS1_ELFLR0_EMLLn1_FDSI0_GRPM1_GRVWA16_GRVWB16_GSUn1_GSUAMBSK_GSUC1_GSUWGMRR1_GLS0_ISA942_IU1_K1_LDSTI0_LBSPPA2048_LBSPPB0_LBSPPM0_LPA32_LPB0_LPM0_LRVWn1_LWPMn1_MIAV0_MIWT4_8_MO40_MGRIPM1_NTn1_NTA0_NTB0_NTC0_NTD4_NTM0_NEPBS16_NLCA1_NLCB1_ONLL1_PGR2_PLR0_PKA1_SGROB0_SIA3_SS0_SU16_SUM0_SUS256_SPO0_SRVW0_SSO0_SVW4_SK0_SKFTR0_SKXCCM0_SGRO0_TDMI0_TIN0_TLDS0_TLDSM1_ULSGRO0_USL1_USLMX0_UIOFGRO0_UPLRP0_USFGROn1_USI0_VSn1_VWA2_VWB8_WSGRA0_WSGRB0_WS64_WG32_8_1_WGM1_WGMXCC1_WGMXCCGn1
    SolutionIndex: 18
    SolutionNameMin: Cijk_Ailk_Bjlk_B8NSS_BH_Bias_FDMN_SPAML0_A_S_SAV_MT192x320x64_MI16x16x1_SN_LDSB0_AFC1_AG0_AFEM1_AFEM1_ASEM8_CLR0_CADS0_DTLA0_DTLB0_DTVA0_DTVB0_DTVMXSA0_DTVMXSB0_DTVSM0_DPLB0_EPS1_ELFLR0_EMLLn1_FDSI0_GRPM1_GRVWA8_GRVWB16_GSUn1_GSUAMBSK_GSUC1_GSUWGMRR1_GLS0_ISA942_IU1_K1_LDSTI0_LBSPPA3072_LBSPPB5120_LBSPPM0_LPA16_LPB64_LPM0_LRVWn1_LWPMn1_MIAV0_MIWT3_20_MO40_MGRIPM1_NTn1_NTA0_NTB0_NTC0_NTD4_NTM0_NEPBS16_NLCA3_NLCB5_ONLL1_PGR2_PLR0_PKA1_SGROB0_SIA3_SS0_SU16_SUM0_SUS256_SPO0_SRVW0_SSO0_SVW4_SK0_SKFTR0_SKXCCM0_SGRO0_TDMI0_TIN0_TLDS0_TLDSM1_ULSGRO0_USL1_USLMX0_UIOFGRO0_UPLRP0_USFGROn1_USI0_VSn1_VWA1_VWB4_WSGRA0_WSGRB0_WS64_WG64_4_1_WGM8_WGMXCC8_WGMXCCGn1
    SolutionIndex: 19
    SolutionNameMin: Cijk_Ailk_Bjlk_B8NSS_BH_Bias_FDMN_SPAML0_A_S_SAV_MT128x256x64_MI16x16x1_SN_LDSB1_AFC1_AG0_AFEM1_AFEM1_ASEM8_CLR0_CADS0_DTLA0_DTLB0_DTVA0_DTVB0_DTVMXSA0_DTVMXSB0_DTVSM0_DPLB0_EPS1_ELFLR0_EMLLn1_FDSI0_GRPM1_GRVWA16_GRVWB16_GSUn1_GSUAMBSK_GSUC1_GSUWGMRR1_GLS0_ISA942_IU1_K1_LDSTI0_LBSPPA2048_LBSPPB0_LBSPPM0_LPA32_LPB0_LPM0_LRVWn1_LWPMn1_MIAV0_MIWT4_8_MO40_MGRIPM1_NTn1_NTA0_NTB0_NTC0_NTD4_NTM0_NEPBS16_NLCA1_NLCB1_ONLL1_PGR2_PLR0_PKA1_SGROB0_SIA3_SS0_SU16_SUM0_SUS256_SPO0_SRVW0_SSO0_SVW4_SK0_SKFTR0_SKXCCM0_SGRO0_TDMI0_TIN0_TLDS0_TLDSM1_ULSGRO0_USL1_USLMX0_UIOFGRO0_UPLRP0_USFGROn1_USI0_VSn1_VWA2_VWB8_WSGRA0_WSGRB0_WS64_WG32_8_1_WGM8_WGMXCC8_WGMXCCGn1
    SolutionIndex: 20
    SolutionNameMin: Cijk_Ailk_Bjlk_B8NSS_BH_Bias_FDMN_SPAML0_A_S_SAV_MT96x256x128_MI16x16x1_SN_LDSB1_AFC1_AG0_AFEM1_AFEM1_ASEM8_CLR1_CADS0_DTLA0_DTLB0_DTVA0_DTVB0_DTVMXSA0_DTVMXSB0_DTVSM0_DPLB0_EPS1_ELFLR0_EMLLn1_FDSI0_GRPM1_GRVWA8_GRVWB16_GSUn1_GSUAMBSK_GSUC1_GSUWGMRR1_GLS0_ISA942_IU1_K1_LDSTI0_LBSPPA1536_LBSPPB0_LBSPPM0_LPA16_LPB0_LPM0_LRVWn1_LWPMn1_MIAV0_MIWT3_8_MO40_MGRIPM1_NTn1_NTA0_NTB0_NTC0_NTD4_NTM0_NEPBS16_NLCA3_NLCB1_ONLL1_PGR2_PLR1_PKA1_SGROB0_SIA3_SS0_SU16_SUM0_SUS256_SPO0_SRVW0_SSO0_SVW4_SK0_SKFTR0_SKXCCM0_SGRO0_TDMI0_TIN0_TLDS0_TLDSM1_ULSGRO0_USL1_USLMX0_UIOFGRO0_UPLRP0_USFGROn1_USI0_VSn1_VWA1_VWB8_WSGRA0_WSGRB0_WS64_WG32_8_1_WGM8_WGMXCC8_WGMXCCGn1
    SolutionIndex: 21
    SolutionNameMin: Cijk_Ailk_Bjlk_B8NSS_BH_Bias_FDMN_SPAML0_A_S_SAV_MT448x128x64_MI16x16x1_SN_LDSB0_AFC1_AG0_AFEM1_AFEM1_ASEM8_CLR0_CADS0_DTLA0_DTLB0_DTVA0_DTVB0_DTVMXSA0_DTVMXSB0_DTVSM0_DPLB0_EPS1_ELFLR0_EMLLn1_FDSI0_GRPM1_GRVWA8_GRVWB16_GSUn1_GSUAMBSK_GSUC1_GSUWGMRR1_GLS0_ISA942_IU1_K1_LDSTI0_LBSPPA7168_LBSPPB0_LBSPPM0_LPA16_LPB0_LPM0_LRVWn1_LWPMn1_MIAV0_MIWT7_8_MO40_MGRIPM1_NTn1_NTA0_NTB0_NTC0_NTD4_NTM0_NEPBS16_NLCA7_NLCB1_ONLL1_PGR2_PLR0_PKA1_SGROB0_SIA3_SS0_SU16_SUM0_SUS256_SPO0_SRVW0_SSO0_SVW4_SK0_SKFTR0_SKXCCM0_SGRO0_TDMI0_TIN0_TLDS0_TLDSM1_ULSGRO0_USL1_USLMX0_UIOFGRO0_UPLRP0_USFGROn1_USI0_VSn1_VWA1_VWB8_WSGRA0_WSGRB0_WS64_WG64_4_1_WGM8_WGMXCC8_WGMXCCGn1
    SolutionIndex: 22
    SolutionNameMin: Cijk_Ailk_Bjlk_B8NSS_BH_Bias_FDMN_SPAML0_A_S_SAV_MT160x128x128_MI16x16x1_SN_LDSB1_AFC1_AG0_AFEM1_AFEM1_ASEM8_CLR1_CADS0_DTLA0_DTLB0_DTVA0_DTVB0_DTVMXSA0_DTVMXSB0_DTVSM0_DPLB0_EPS1_ELFLR0_EMLLn1_FDSI0_GRPM1_GRVWA8_GRVWB16_GSUn1_GSUAMBSK_GSUC1_GSUWGMRR1_GLS0_ISA942_IU1_K1_LDSTI0_LBSPPA2560_LBSPPB2048_LBSPPM0_LPA16_LPB64_LPM0_LRVWn1_LWPMn1_MIAV0_MIWT5_4_MO40_MGRIPM1_NTn1_NTA0_NTB0_NTC0_NTD4_NTM0_NEPBS16_NLCA5_NLCB1_ONLL1_PGR2_PLR1_PKA1_SGROB0_SIA3_SS0_SU16_SUM0_SUS256_SPO0_SRVW0_SSO0_SVW4_SK0_SKFTR0_SKXCCM0_SGRO0_TDMI0_TIN0_TLDS0_TLDSM1_ULSGRO0_USL1_USLMX0_UIOFGRO0_UPLRP0_USFGROn1_USI0_VSn1_VWA1_VWB4_WSGRA0_WSGRB0_WS64_WG32_8_1_WGM8_WGMXCC8_WGMXCCGn1
    SolutionIndex: 23
    SolutionNameMin: Cijk_Ailk_Bjlk_B8NSS_BH_Bias_FDMN_SPAML0_A_S_SAV_MT448x128x64_MI16x16x1_SN_LDSB0_AFC1_AG0_AFEM1_AFEM1_ASEM8_CLR0_CADS0_DTLA0_DTLB0_DTVA0_DTVB0_DTVMXSA0_DTVMXSB0_DTVSM0_DPLB0_EPS1_ELFLR0_EMLLn1_FDSI0_GRPM1_GRVWA8_GRVWB16_GSUn1_GSUAMBSK_GSUC1_GSUWGMRR1_GLS0_ISA942_IU1_K1_LDSTI0_LBSPPA7168_LBSPPB0_LBSPPM0_LPA16_LPB0_LPM0_LRVWn1_LWPMn1_MIAV0_MIWT7_8_MO40_MGRIPM1_NTn1_NTA0_NTB0_NTC0_NTD4_NTM0_NEPBS16_NLCA7_NLCB1_ONLL1_PGR2_PLR0_PKA1_SGROB0_SIA3_SS0_SU16_SUM0_SUS256_SPO0_SRVW0_SSO0_SVW4_SK0_SKFTR0_SKXCCM0_SGRO0_TDMI0_TIN0_TLDS0_TLDSM1_ULSGRO0_USL1_USLMX0_UIOFGRO0_UPLRP0_USFGROn1_USI0_VSn1_VWA1_VWB8_WSGRA0_WSGRB0_WS64_WG64_4_1_WGM1_WGMXCC1_WGMXCCGn1
    SolutionIndex: 24
    SolutionNameMin: Cijk_Ailk_Bjlk_B8NSS_BH_Bias_FDMN_SPAML0_A_S_SAV_MT128x192x64_MI16x16x1_SN_LDSB1_AFC1_AG0_AFEM1_AFEM1_ASEM8_CLR0_CADS0_DTLA0_DTLB0_DTVA0_DTVB0_DTVMXSA0_DTVMXSB0_DTVSM0_DPLB0_EPS1_ELFLR0_EMLLn1_FDSI0_GRPM1_GRVWA16_GRVWB16_GSUn1_GSUAMBSK_GSUC1_GSUWGMRR1_GLS0_ISA942_IU1_K1_LDSTI0_LBSPPA2048_LBSPPB3072_LBSPPM0_LPA32_LPB64_LPM0_LRVWn1_LWPMn1_MIAV0_MIWT2_12_MO40_MGRIPM1_NTn1_NTA0_NTB0_NTC0_NTD4_NTM0_NEPBS16_NLCA1_NLCB3_ONLL1_PGR2_PLR0_PKA1_SGROB0_SIA3_SS0_SU16_SUM0_SUS256_SPO0_SRVW0_SSO0_SVW4_SK0_SKFTR0_SKXCCM0_SGRO0_TDMI0_TIN0_TLDS0_TLDSM1_ULSGRO0_USL1_USLMX0_UIOFGRO0_UPLRP0_USFGROn1_USI0_VSn1_VWA2_VWB4_WSGRA0_WSGRB0_WS64_WG64_4_1_WGM8_WGMXCC8_WGMXCCGn1
    SolutionIndex: 25
    SolutionNameMin: Cijk_Ailk_Bjlk_B8NSS_BH_Bias_FDMN_SPAML0_A_S_SAV_MT128x192x64_MI16x16x1_SN_LDSB1_AFC1_AG0_AFEM1_AFEM1_ASEM8_CLR0_CADS0_DTLA0_DTLB0_DTVA0_DTVB0_DTVMXSA0_DTVMXSB0_DTVSM0_DPLB0_EPS1_ELFLR0_EMLLn1_FDSI0_GRPM1_GRVWA8_GRVWB16_GSUn1_GSUAMBSK_GSUC1_GSUWGMRR1_GLS0_ISA942_IU1_K1_LDSTI0_LBSPPA2048_LBSPPB3072_LBSPPM0_LPA32_LPB32_LPM0_LRVWn1_LWPMn1_MIAV0_MIWT4_6_MO40_MGRIPM1_NTn1_NTA0_NTB0_NTC0_NTD4_NTM0_NEPBS16_NLCA1_NLCB3_ONLL1_PGR2_PLR0_PKA1_SGROB0_SIA3_SS0_SU16_SUM0_SUS256_SPO0_SRVW0_SSO0_SVW4_SK0_SKFTR0_SKXCCM0_SGRO0_TDMI0_TIN0_TLDS0_TLDSM1_ULSGRO0_USL1_USLMX0_UIOFGRO0_UPLRP0_USFGROn1_USI0_VSn1_VWA2_VWB2_WSGRA0_WSGRB0_WS64_WG32_8_1_WGM8_WGMXCC8_WGMXCCGn1
    SolutionIndex: 26
    SolutionNameMin: Cijk_Ailk_Bjlk_B8NSS_BH_Bias_FDMN_SPAML0_A_S_SAV_MT128x384x64_MI16x16x1_SN_LDSB0_AFC1_AG0_AFEM1_AFEM1_ASEM8_CLR0_CADS0_DTLA0_DTLB0_DTVA0_DTVB0_DTVMXSA0_DTVMXSB0_DTVSM0_DPLB0_EPS1_ELFLR0_EMLLn1_FDSI0_GRPM1_GRVWA16_GRVWB16_GSUn1_GSUAMBSK_GSUC1_GSUWGMRR1_GLS0_ISA942_IU1_K1_LDSTI0_LBSPPA2048_LBSPPB6144_LBSPPM0_LPA32_LPB64_LPM0_LRVWn1_LWPMn1_MIAV0_MIWT4_12_MO40_MGRIPM1_NTn1_NTA0_NTB0_NTC0_NTD4_NTM0_NEPBS16_NLCA1_NLCB3_ONLL1_PGR2_PLR0_PKA1_SGROB0_SIA3_SS0_SU16_SUM0_SUS256_SPO0_SRVW0_SSO0_SVW4_SK0_SKFTR0_SKXCCM0_SGRO0_TDMI0_TIN0_TLDS0_TLDSM1_ULSGRO0_USL1_USLMX0_UIOFGRO0_UPLRP0_USFGROn1_USI0_VSn1_VWA2_VWB4_WSGRA0_WSGRB0_WS64_WG32_8_1_WGM1_WGMXCC1_WGMXCCGn1
    SolutionIndex: 27
    SolutionNameMin: Cijk_Ailk_Bjlk_B8NSS_BH_Bias_FDMN_SPAML0_A_S_SAV_MT96x256x128_MI16x16x1_SN_LDSB1_AFC1_AG0_AFEM1_AFEM1_ASEM8_CLR1_CADS0_DTLA0_DTLB0_DTVA0_DTVB0_DTVMXSA0_DTVMXSB0_DTVSM0_DPLB0_EPS1_ELFLR0_EMLLn1_FDSI0_GRPM1_GRVWA8_GRVWB16_GSUn1_GSUAMBSK_GSUC1_GSUWGMRR1_GLS0_ISA942_IU1_K1_LDSTI0_LBSPPA1536_LBSPPB0_LBSPPM0_LPA16_LPB0_LPM0_LRVWn1_LWPMn1_MIAV0_MIWT3_8_MO40_MGRIPM1_NTn1_NTA0_NTB0_NTC0_NTD4_NTM0_NEPBS16_NLCA3_NLCB1_ONLL1_PGR2_PLR1_PKA1_SGROB0_SIA3_SS0_SU16_SUM0_SUS256_SPO0_SRVW0_SSO0_SVW4_SK0_SKFTR0_SKXCCM0_SGRO0_TDMI0_TIN0_TLDS0_TLDSM1_ULSGRO0_USL1_USLMX0_UIOFGRO0_UPLRP0_USFGROn1_USI0_VSn1_VWA1_VWB8_WSGRA0_WSGRB0_WS64_WG32_8_1_WGM1_WGMXCC1_WGMXCCGn1
    SolutionIndex: 28
    SolutionNameMin: Cijk_Ailk_Bjlk_B8NSS_BH_Bias_FDMN_SPAML0_A_S_SAV_MT128x192x64_MI16x16x1_SN_LDSB1_AFC1_AG0_AFEM1_AFEM1_ASEM8_CLR0_CADS0_DTLA0_DTLB0_DTVA0_DTVB0_DTVMXSA0_DTVMXSB0_DTVSM0_DPLB0_EPS1_ELFLR0_EMLLn1_FDSI0_GRPM1_GRVWA8_GRVWB16_GSUn1_GSUAMBSK_GSUC1_GSUWGMRR1_GLS0_ISA942_IU1_K1_LDSTI0_LBSPPA2048_LBSPPB3072_LBSPPM0_LPA32_LPB64_LPM0_LRVWn1_LWPMn1_MIAV0_MIWT2_12_MO40_MGRIPM1_NTn1_NTA0_NTB0_NTC0_NTD4_NTM0_NEPBS16_NLCA1_NLCB3_ONLL1_PGR2_PLR0_PKA1_SGROB0_SIA3_SS0_SU16_SUM0_SUS256_SPO0_SRVW0_SSO0_SVW4_SK0_SKFTR0_SKXCCM0_SGRO0_TDMI0_TIN0_TLDS0_TLDSM1_ULSGRO0_USL1_USLMX0_UIOFGRO0_UPLRP0_USFGROn1_USI0_VSn1_VWA2_VWB4_WSGRA0_WSGRB0_WS64_WG64_4_1_WGM8_WGMXCC8_WGMXCCGn1
    SolutionIndex: 29
    SolutionNameMin: Cijk_Ailk_Bjlk_B8NSS_BH_Bias_FDMN_SPAML0_A_S_SAV_MT128x192x64_MI16x16x1_SN_LDSB1_AFC1_AG0_AFEM1_AFEM1_ASEM8_CLR0_CADS0_DTLA0_DTLB0_DTVA0_DTVB0_DTVMXSA0_DTVMXSB0_DTVSM0_DPLB0_EPS1_ELFLR0_EMLLn1_FDSI0_GRPM1_GRVWA16_GRVWB4_GSUn1_GSUAMBSK_GSUC1_GSUWGMRR1_GLS0_ISA942_IU1_K1_LDSTI0_LBSPPA2048_LBSPPB3072_LBSPPM0_LPA32_LPB32_LPM0_LRVWn1_LWPMn1_MIAV0_MIWT4_6_MO40_MGRIPM1_NTn1_NTA0_NTB0_NTC0_NTD4_NTM0_NEPBS16_NLCA1_NLCB3_ONLL1_PGR2_PLR0_PKA1_SGROB0_SIA3_SS0_SU16_SUM0_SUS256_SPO0_SRVW0_SSO0_SVW4_SK0_SKFTR0_SKXCCM0_SGRO0_TDMI0_TIN0_TLDS0_TLDSM1_ULSGRO0_USL1_USLMX0_UIOFGRO0_UPLRP0_USFGROn1_USI0_VSn1_VWA2_VWB2_WSGRA0_WSGRB0_WS64_WG32_8_1_WGM8_WGMXCC8_WGMXCCGn1
    SolutionIndex: 30
    SolutionNameMin: Cijk_Ailk_Bjlk_B8NSS_BH_Bias_FDMN_SPAML0_A_S_SAV_MT64x64x128_MI16x16x1_SN_LDSB0_AFC1_AG0_AFEM1_AFEM1_ASEM8_CLR1_CADS0_DTLA0_DTLB0_DTVA0_DTVB0_DTVMXSA0_DTVMXSB0_DTVSM0_DPLB0_EPS1_ELFLR0_EMLLn1_FDSI0_GRPM1_GRVWA16_GRVWB16_GSUn1_GSUAMBSK_GSUC1_GSUWGMRR1_GLS0_ISA942_IU1_K1_LDSTI0_LBSPPA1024_LBSPPB1024_LBSPPM0_LPA16_LPB64_LPM0_LRVWn1_LWPMn1_MIAV0_MIWT1_4_MO40_MGRIPM1_NTn1_NTA0_NTB0_NTC0_NTD4_NTM0_NEPBS16_NLCA1_NLCB1_ONLL1_PGR2_PLR1_PKA1_SGROB0_SIA3_SS0_SU16_SUM0_SUS256_SPO0_SRVW0_SSO0_SVW4_SK0_SKFTR0_SKXCCM0_SGRO0_TDMI0_TIN0_TLDS0_TLDSM1_ULSGRO0_USL1_USLMX0_UIOFGRO0_UPLRP0_USFGROn1_USI0_VSn1_VWA1_VWB4_WSGRA0_WSGRB0_WS64_WG64_4_1_WGM8_WGMXCC8_WGMXCCGn1
    SolutionIndex: 31
    SolutionNameMin: Cijk_Ailk_Bjlk_B8NSS_BH_Bias_FDMN_SPAML0_A_S_SAV_MT192x256x128_MI16x16x1_SN_LDSB1_AFC1_AG0_AFEM1_AFEM1_ASEM8_CLR1_CADS0_DTLA0_DTLB0_DTVA0_DTVB0_DTVMXSA0_DTVMXSB0_DTVSM0_DPLB0_EPS1_ELFLR0_EMLLn1_FDSI0_GRPM1_GRVWA16_GRVWB16_GSUn1_GSUAMBSK_GSUC1_GSUWGMRR1_GLS0_ISA942_IU1_K1_LDSTI0_LBSPPA3072_LBSPPB0_LBSPPM0_LPA32_LPB0_LPM0_LRVWn1_LWPMn1_MIAV0_MIWT6_8_MO40_MGRIPM1_NTn1_NTA0_NTB0_NTC0_NTD4_NTM0_NEPBS16_NLCA3_NLCB1_ONLL1_PGR2_PLR1_PKA1_SGROB0_SIA3_SS0_SU16_SUM0_SUS256_SPO0_SRVW0_SSO0_SVW4_SK0_SKFTR0_SKXCCM0_SGRO0_TDMI0_TIN0_TLDS0_TLDSM1_ULSGRO0_USL1_USLMX0_UIOFGRO0_UPLRP0_USFGROn1_USI0_VSn1_VWA2_VWB8_WSGRA0_WSGRB0_WS64_WG32_8_1_WGM8_WGMXCC8_WGMXCCGn1
    SolutionIndex: 32
    SolutionNameMin: Cijk_Ailk_Bjlk_B8NSS_BH_Bias_FDMN_SPAML0_A_S_SAV_MT256x256x64_MI16x16x1_SN_LDSB0_AFC1_AG0_AFEM1_AFEM1_ASEM8_CLR0_CADS0_DTLA0_DTLB0_DTVA0_DTVB0_DTVMXSA0_DTVMXSB0_DTVSM0_DPLB0_EPS1_ELFLR0_EMLLn1_FDSI0_GRPM1_GRVWA16_GRVWB16_GSUn1_GSUAMBSK_GSUC1_GSUWGMRR1_GLS0_ISA942_IU1_K1_LDSTI0_LBSPPA4096_LBSPPB0_LBSPPM0_LPA32_LPB0_LPM0_LRVWn1_LWPMn1_MIAV0_MIWT8_8_MO40_MGRIPM1_NTn1_NTA0_NTB0_NTC0_NTD4_NTM0_NEPBS16_NLCA1_NLCB1_ONLL1_PGR2_PLR0_PKA1_SGROB0_SIA3_SS0_SU16_SUM0_SUS256_SPO0_SRVW0_SSO0_SVW4_SK0_SKFTR0_SKXCCM0_SGRO0_TDMI0_TIN0_TLDS0_TLDSM1_ULSGRO0_USL1_USLMX0_UIOFGRO0_UPLRP0_USFGROn1_USI0_VSn1_VWA2_VWB8_WSGRA0_WSGRB0_WS64_WG32_8_1_WGM8_WGMXCC8_WGMXCCGn1
    SolutionIndex: 33
    SolutionNameMin: Cijk_Ailk_Bjlk_B8NSS_BH_Bias_FDMN_SPAML0_A_S_SAV_MT256x128x64_MI16x16x1_SN_LDSB1_AFC1_AG0_AFEM1_AFEM1_ASEM8_CLR0_CADS0_DTLA0_DTLB0_DTVA0_DTVB0_DTVMXSA0_DTVMXSB0_DTVSM0_DPLB0_EPS1_ELFLR0_EMLLn1_FDSI0_GRPM1_GRVWA16_GRVWB16_GSUn1_GSUAMBSK_GSUC1_GSUWGMRR1_GLS0_ISA942_IU1_K1_LDSTI0_LBSPPA4096_LBSPPB0_LBSPPM0_LPA32_LPB0_LPM0_LRVWn1_LWPMn1_MIAV0_MIWT4_8_MO40_MGRIPM1_NTn1_NTA0_NTB0_NTC0_NTD4_NTM0_NEPBS16_NLCA1_NLCB1_ONLL1_PGR2_PLR0_PKA1_SGROB0_SIA3_SS0_SU16_SUM0_SUS256_SPO0_SRVW0_SSO0_SVW4_SK0_SKFTR0_SKXCCM0_SGRO0_TDMI0_TIN0_TLDS0_TLDSM1_ULSGRO0_USL1_USLMX0_UIOFGRO0_UPLRP0_USFGROn1_USI0_VSn1_VWA2_VWB8_WSGRA0_WSGRB0_WS64_WG64_4_1_WGM8_WGMXCC8_WGMXCCGn1
    SolutionIndex: 34
    SolutionNameMin: Cijk_Ailk_Bjlk_B8NSS_BH_Bias_FDMN_SPAML0_A_S_SAV_MT256x128x64_MI16x16x1_SN_LDSB1_AFC1_AG0_AFEM1_AFEM1_ASEM8_CLR0_CADS0_DTLA0_DTLB0_DTVA0_DTVB0_DTVMXSA0_DTVMXSB0_DTVSM0_DPLB0_EPS1_ELFLR0_EMLLn1_FDSI0_GRPM1_GRVWA16_GRVWB16_GSUn1_GSUAMBSK_GSUC1_GSUWGMRR1_GLS0_ISA942_IU1_K1_LDSTI0_LBSPPA4096_LBSPPB2048_LBSPPM0_LPA32_LPB64_LPM0_LRVWn1_LWPMn1_MIAV0_MIWT8_4_MO40_MGRIPM1_NTn1_NTA0_NTB0_NTC0_NTD4_NTM0_NEPBS16_NLCA1_NLCB1_ONLL1_PGR2_PLR0_PKA1_SGROB0_SIA3_SS0_SU16_SUM0_SUS256_SPO0_SRVW0_SSO0_SVW4_SK0_SKFTR0_SKXCCM0_SGRO0_TDMI0_TIN0_TLDS0_TLDSM1_ULSGRO0_USL1_USLMX0_UIOFGRO0_UPLRP0_USFGROn1_USI0_VSn1_VWA2_VWB4_WSGRA0_WSGRB0_WS64_WG32_8_1_WGM1_WGMXCC1_WGMXCCGn1
    SolutionIndex: 35
    SolutionNameMin: Cijk_Ailk_Bjlk_B8NSS_BH_Bias_FDMN_SPAML0_A_S_SAV_MT192x256x128_MI16x16x1_SN_LDSB1_AFC1_AG0_AFEM1_AFEM1_ASEM8_CLR1_CADS0_DTLA0_DTLB0_DTVA0_DTVB0_DTVMXSA0_DTVMXSB0_DTVSM0_DPLB0_EPS1_ELFLR0_EMLLn1_FDSI0_GRPM1_GRVWA16_GRVWB16_GSUn1_GSUAMBSK_GSUC1_GSUWGMRR1_GLS0_ISA942_IU1_K1_LDSTI0_LBSPPA3072_LBSPPB0_LBSPPM0_LPA32_LPB0_LPM0_LRVWn1_LWPMn1_MIAV0_MIWT6_8_MO40_MGRIPM1_NTn1_NTA0_NTB0_NTC0_NTD4_NTM0_NEPBS16_NLCA3_NLCB1_ONLL1_PGR2_PLR1_PKA1_SGROB0_SIA3_SS0_SU16_SUM0_SUS256_SPO0_SRVW0_SSO0_SVW4_SK0_SKFTR0_SKXCCM0_SGRO0_TDMI0_TIN0_TLDS0_TLDSM1_ULSGRO0_USL1_USLMX0_UIOFGRO0_UPLRP0_USFGROn1_USI0_VSn1_VWA2_VWB8_WSGRA0_WSGRB0_WS64_WG32_8_1_WGM1_WGMXCC1_WGMXCCGn1
    SolutionIndex: 36
    SolutionNameMin: Cijk_Ailk_Bjlk_B8NSS_BH_Bias_FDMN_SPAML0_A_S_SAV_MT128x384x64_MI16x16x1_SN_LDSB0_AFC1_AG0_AFEM1_AFEM1_ASEM8_CLR0_CADS0_DTLA0_DTLB0_DTVA0_DTVB0_DTVMXSA0_DTVMXSB0_DTVSM0_DPLB0_EPS1_ELFLR0_EMLLn1_FDSI0_GRPM1_GRVWA16_GRVWB16_GSUn1_GSUAMBSK_GSUC1_GSUWGMRR1_GLS0_ISA942_IU1_K1_LDSTI0_LBSPPA2048_LBSPPB6144_LBSPPM0_LPA32_LPB32_LPM0_LRVWn1_LWPMn1_MIAV0_MIWT8_6_MO40_MGRIPM1_NTn1_NTA0_NTB0_NTC0_NTD4_NTM0_NEPBS16_NLCA1_NLCB3_ONLL1_PGR2_PLR0_PKA1_SGROB0_SIA3_SS0_SU16_SUM0_SUS256_SPO0_SRVW0_SSO0_SVW4_SK0_SKFTR0_SKXCCM0_SGRO0_TDMI0_TIN0_TLDS0_TLDSM1_ULSGRO0_USL1_USLMX0_UIOFGRO0_UPLRP0_USFGROn1_USI0_VSn1_VWA2_VWB2_WSGRA0_WSGRB0_WS64_WG16_16_1_WGM1_WGMXCC1_WGMXCCGn1
    SolutionIndex: 37
    SolutionNameMin: Cijk_Ailk_Bjlk_B8NSS_BH_Bias_FDMN_SPAML0_A_S_SAV_MT64x256x64_MI16x16x1_SN_LDSB1_AFC1_AG0_AFEM1_AFEM1_ASEM8_CLR0_CADS0_DTLA0_DTLB0_DTVA0_DTVB0_DTVMXSA0_DTVMXSB0_DTVSM0_DPLB0_EPS1_ELFLR0_EMLLn1_FDSI0_GRPM1_GRVWA8_GRVWB16_GSUn1_GSUAMBSK_GSUC1_GSUWGMRR1_GLS0_ISA942_IU1_K1_LDSTI0_LBSPPA1024_LBSPPB4096_LBSPPM0_LPA32_LPB64_LPM0_LRVWn1_LWPMn1_MIAV0_MIWT4_4_MO40_MGRIPM1_NTn1_NTA0_NTB0_NTC0_NTD4_NTM0_NEPBS16_NLCA1_NLCB1_ONLL1_PGR2_PLR0_PKA1_SGROB0_SIA3_SS0_SU16_SUM0_SUS256_SPO0_SRVW0_SSO0_SVW4_SK0_SKFTR0_SKXCCM0_SGRO0_TDMI0_TIN0_TLDS0_TLDSM1_ULSGRO0_USL1_USLMX0_UIOFGRO0_UPLRP0_USFGROn1_USI0_VSn1_VWA2_VWB4_WSGRA0_WSGRB0_WS64_WG16_16_1_WGM8_WGMXCC8_WGMXCCGn1
    SolutionIndex: 38
    SolutionNameMin: Cijk_Ailk_Bjlk_B8NSS_BH_Bias_FDMN_SPAML0_A_S_SAV_MT128x384x64_MI16x16x1_SN_LDSB0_AFC1_AG0_AFEM1_AFEM1_ASEM8_CLR0_CADS0_DTLA0_DTLB0_DTVA0_DTVB0_DTVMXSA0_DTVMXSB0_DTVSM0_DPLB0_EPS1_ELFLR0_EMLLn1_FDSI0_GRPM1_GRVWA16_GRVWB16_GSUn1_GSUAMBSK_GSUC1_GSUWGMRR1_GLS0_ISA942_IU1_K1_LDSTI0_LBSPPA2048_LBSPPB6144_LBSPPM0_LPA32_LPB32_LPM0_LRVWn1_LWPMn1_MIAV0_MIWT8_6_MO40_MGRIPM1_NTn1_NTA0_NTB0_NTC0_NTD4_NTM0_NEPBS16_NLCA1_NLCB3_ONLL1_PGR2_PLR0_PKA1_SGROB0_SIA3_SS0_SU16_SUM0_SUS256_SPO0_SRVW0_SSO0_SVW4_SK0_SKFTR0_SKXCCM0_SGRO0_TDMI0_TIN0_TLDS0_TLDSM1_ULSGRO0_USL1_USLMX0_UIOFGRO0_UPLRP0_USFGROn1_USI0_VSn1_VWA2_VWB2_WSGRA0_WSGRB0_WS64_WG16_16_1_WGM8_WGMXCC8_WGMXCCGn1
    SolutionIndex: 39
    SolutionNameMin: Cijk_Ailk_Bjlk_B8NSS_BH_Bias_FDMN_SPAML0_A_S_SAV_MT128x384x64_MI16x16x1_SN_LDSB0_AFC1_AG0_AFEM1_AFEM1_ASEM8_CLR0_CADS0_DTLA0_DTLB0_DTVA0_DTVB0_DTVMXSA0_DTVMXSB0_DTVSM0_DPLB0_EPS1_ELFLR0_EMLLn1_FDSI0_GRPM1_GRVWA16_GRVWB16_GSUn1_GSUAMBSK_GSUC1_GSUWGMRR1_GLS0_ISA942_IU1_K1_LDSTI0_LBSPPA2048_LBSPPB6144_LBSPPM0_LPA32_LPB64_LPM0_LRVWn1_LWPMn1_MIAV0_MIWT4_12_MO40_MGRIPM1_NTn1_NTA0_NTB0_NTC0_NTD4_NTM0_NEPBS16_NLCA1_NLCB3_ONLL1_PGR2_PLR0_PKA1_SGROB0_SIA3_SS0_SU16_SUM0_SUS256_SPO0_SRVW0_SSO0_SVW4_SK0_SKFTR0_SKXCCM0_SGRO0_TDMI0_TIN0_TLDS0_TLDSM1_ULSGRO0_USL1_USLMX0_UIOFGRO0_UPLRP0_USFGROn1_USI0_VSn1_VWA2_VWB4_WSGRA0_WSGRB0_WS64_WG32_8_1_WGM8_WGMXCC8_WGMXCCGn1
    SolutionIndex: 40
    SolutionNameMin: Cijk_Ailk_Bjlk_B8NSS_BH_Bias_FDMN_SPAML0_A_S_SAV_MT96x128x128_MI16x16x1_SN_LDSB1_AFC1_AG0_AFEM1_AFEM1_ASEM8_CLR1_CADS0_DTLA0_DTLB0_DTVA0_DTVB0_DTVMXSA0_DTVMXSB0_DTVSM0_DPLB0_EPS1_ELFLR0_EMLLn1_FDSI0_GRPM1_GRVWA8_GRVWB16_GSUn1_GSUAMBSK_GSUC1_GSUWGMRR1_GLS0_ISA942_IU1_K1_LDSTI0_LBSPPA1536_LBSPPB2048_LBSPPM0_LPA16_LPB64_LPM0_LRVWn1_LWPMn1_MIAV0_MIWT3_4_MO40_MGRIPM1_NTn1_NTA0_NTB0_NTC0_NTD4_NTM0_NEPBS16_NLCA3_NLCB1_ONLL1_PGR2_PLR1_PKA1_SGROB0_SIA3_SS0_SU16_SUM0_SUS256_SPO0_SRVW0_SSO0_SVW4_SK0_SKFTR0_SKXCCM0_SGRO0_TDMI0_TIN0_TLDS0_TLDSM1_ULSGRO0_USL1_USLMX0_UIOFGRO0_UPLRP0_USFGROn1_USI0_VSn1_VWA1_VWB4_WSGRA0_WSGRB0_WS64_WG32_8_1_WGM1_WGMXCC1_WGMXCCGn1
    SolutionIndex: 41
    SolutionNameMin: Cijk_Ailk_Bjlk_B8NSS_BH_Bias_FDMN_SPAML0_A_S_SAV_MT32x384x128_MI16x16x1_SN_LDSB1_AFC1_AG0_AFEM1_AFEM1_ASEM8_CLR1_CADS0_DTLA0_DTLB0_DTVA0_DTVB0_DTVMXSA0_DTVMXSB0_DTVSM0_DPLB0_EPS1_ELFLR0_EMLLn1_FDSI0_GRPM1_GRVWA8_GRVWB16_GSUn1_GSUAMBSK_GSUC1_GSUWGMRR1_GLS0_ISA942_IU1_K1_LDSTI0_LBSPPA512_LBSPPB6144_LBSPPM0_LPA32_LPB32_LPM0_LRVWn1_LWPMn1_MIAV0_MIWT2_6_MO40_MGRIPM1_NTn1_NTA0_NTB0_NTC0_NTD4_NTM0_NEPBS16_NLCA1_NLCB3_ONLL1_PGR2_PLR1_PKA1_SGROB0_SIA3_SS0_SU16_SUM0_SUS256_SPO0_SRVW0_SSO0_SVW4_SK0_SKFTR0_SKXCCM0_SGRO0_TDMI0_TIN0_TLDS0_TLDSM1_ULSGRO0_USL1_USLMX0_UIOFGRO0_UPLRP0_USFGROn1_USI0_VSn1_VWA2_VWB2_WSGRA0_WSGRB0_WS64_WG16_16_1_WGM1_WGMXCC1_WGMXCCGn1
    SolutionIndex: 42
    SolutionNameMin: Cijk_Ailk_Bjlk_B8NSS_BH_Bias_FDMN_SPAML0_A_S_SAV_MT48x128x256_MI16x16x1_SN_LDSB1_AFC1_AG0_AFEM1_AFEM1_ASEM8_CLR1_CADS0_DTLA0_DTLB0_DTVA0_DTVB0_DTVMXSA0_DTVMXSB0_DTVSM0_DPLB0_EPS1_ELFLR0_EMLLn1_FDSI0_GRPM1_GRVWA8_GRVWB16_GSUn1_GSUAMBSK_GSUC1_GSUWGMRR1_GLS0_ISA942_IU1_K1_LDSTI0_LBSPPA768_LBSPPB2048_LBSPPM0_LPA16_LPB32_LPM0_LRVWn1_LWPMn1_MIAV0_MIWT3_2_MO40_MGRIPM1_NTn1_NTA0_NTB0_NTC0_NTD4_NTM0_NEPBS16_NLCA3_NLCB1_ONLL1_PGR2_PLR1_PKA1_SGROB0_SIA3_SS0_SU16_SUM0_SUS256_SPO0_SRVW0_SSO0_SVW4_SK0_SKFTR0_SKXCCM0_SGRO0_TDMI0_TIN0_TLDS0_TLDSM1_ULSGRO0_USL1_USLMX0_UIOFGRO0_UPLRP0_USFGROn1_USI0_VSn1_VWA1_VWB2_WSGRA0_WSGRB0_WS64_WG16_16_1_WGM1_WGMXCC1_WGMXCCGn1
    SolutionIndex: 43
    SolutionNameMin: Cijk_Ailk_Bjlk_B8NSS_BH_Bias_FDMN_SPAML0_A_S_SAV_MT32x256x128_MI16x16x1_SN_LDSB1_AFC1_AG0_AFEM1_AFEM1_ASEM8_CLR1_CADS0_DTLA0_DTLB0_DTVA0_DTVB0_DTVMXSA0_DTVMXSB0_DTVSM0_DPLB0_EPS1_ELFLR0_EMLLn1_FDSI0_GRPM1_GRVWA8_GRVWB16_GSUn1_GSUAMBSK_GSUC1_GSUWGMRR1_GLS0_ISA942_IU1_K1_LDSTI0_LBSPPA512_LBSPPB0_LBSPPM0_LPA16_LPB0_LPM0_LRVWn1_LWPMn1_MIAV0_MIWT1_8_MO40_MGRIPM1_NTn1_NTA0_NTB0_NTC0_NTD4_NTM0_NEPBS16_NLCA1_NLCB1_ONLL1_PGR2_PLR1_PKA1_SGROB0_SIA3_SS0_SU16_SUM0_SUS256_SPO0_SRVW0_SSO0_SVW4_SK0_SKFTR0_SKXCCM0_SGRO0_TDMI0_TIN0_TLDS0_TLDSM1_ULSGRO0_USL1_USLMX0_UIOFGRO0_UPLRP0_USFGROn1_USI0_VSn1_VWA1_VWB8_WSGRA0_WSGRB0_WS64_WG32_8_1_WGM8_WGMXCC8_WGMXCCGn1
    SolutionIndex: 44
    SolutionNameMin: Cijk_Ailk_Bjlk_B8NSS_BH_Bias_FDMN_SPAML0_A_S_SAV_MT32x256x128_MI16x16x1_SN_LDSB1_AFC1_AG0_AFEM1_AFEM1_ASEM8_CLR1_CADS0_DTLA0_DTLB0_DTVA0_DTVB0_DTVMXSA0_DTVMXSB0_DTVSM0_DPLB0_EPS1_ELFLR0_EMLLn1_FDSI0_GRPM1_GRVWA8_GRVWB16_GSUn1_GSUAMBSK_GSUC1_GSUWGMRR1_GLS0_ISA942_IU1_K1_LDSTI0_LBSPPA512_LBSPPB0_LBSPPM0_LPA16_LPB0_LPM0_LRVWn1_LWPMn1_MIAV0_MIWT1_8_MO40_MGRIPM1_NTn1_NTA0_NTB0_NTC0_NTD4_NTM0_NEPBS16_NLCA1_NLCB1_ONLL1_PGR2_PLR1_PKA1_SGROB0_SIA3_SS0_SU16_SUM0_SUS256_SPO0_SRVW0_SSO0_SVW4_SK0_SKFTR0_SKXCCM0_SGRO0_TDMI0_TIN0_TLDS0_TLDSM1_ULSGRO0_USL1_USLMX0_UIOFGRO0_UPLRP0_USFGROn1_USI0_VSn1_VWA1_VWB8_WSGRA0_WSGRB0_WS64_WG32_8_1_WGM1_WGMXCC1_WGMXCCGn1
    SolutionIndex: 45
    SolutionNameMin: Cijk_Ailk_Bjlk_B8NSS_BH_Bias_FDMN_SPAML0_A_S_SAV_MT32x256x128_MI16x16x1_SN_LDSB1_AFC1_AG0_AFEM1_AFEM1_ASEM8_CLR1_CADS0_DTLA0_DTLB0_DTVA0_DTVB0_DTVMXSA0_DTVMXSB0_DTVSM0_DPLB0_EPS1_ELFLR0_EMLLn1_FDSI0_GRPM1_GRVWA8_GRVWB16_GSUn1_GSUAMBSK_GSUC1_GSUWGMRR1_GLS0_ISA942_IU1_K1_LDSTI0_LBSPPA512_LBSPPB4096_LBSPPM0_LPA32_LPB64_LPM0_LRVWn1_LWPMn1_MIAV0_MIWT2_4_MO40_MGRIPM1_NTn1_NTA0_NTB0_NTC0_NTD4_NTM0_NEPBS16_NLCA1_NLCB1_ONLL1_PGR2_PLR1_PKA1_SGROB0_SIA3_SS0_SU16_SUM0_SUS256_SPO0_SRVW0_SSO0_SVW4_SK0_SKFTR0_SKXCCM0_SGRO0_TDMI0_TIN0_TLDS0_TLDSM1_ULSGRO0_USL1_USLMX0_UIOFGRO0_UPLRP0_USFGROn1_USI0_VSn1_VWA2_VWB4_WSGRA0_WSGRB0_WS64_WG16_16_1_WGM1_WGMXCC1_WGMXCCGn1
    SolutionIndex: 46
    SolutionNameMin: Cijk_Ailk_Bjlk_B8NSS_BH_Bias_FDMN_SPAML0_A_S_SAV_MT32x384x128_MI16x16x1_SN_LDSB1_AFC1_AG0_AFEM1_AFEM1_ASEM8_CLR1_CADS0_DTLA0_DTLB0_DTVA0_DTVB0_DTVMXSA0_DTVMXSB0_DTVSM0_DPLB0_EPS1_ELFLR0_EMLLn1_FDSI0_GRPM1_GRVWA8_GRVWB16_GSUn1_GSUAMBSK_GSUC1_GSUWGMRR1_GLS0_ISA942_IU1_K1_LDSTI0_LBSPPA512_LBSPPB6144_LBSPPM0_LPA32_LPB32_LPM0_LRVWn1_LWPMn1_MIAV0_MIWT2_6_MO40_MGRIPM1_NTn1_NTA0_NTB0_NTC0_NTD4_NTM0_NEPBS16_NLCA1_NLCB3_ONLL1_PGR2_PLR1_PKA1_SGROB0_SIA3_SS0_SU16_SUM0_SUS256_SPO0_SRVW0_SSO0_SVW4_SK0_SKFTR0_SKXCCM0_SGRO0_TDMI0_TIN0_TLDS0_TLDSM1_ULSGRO0_USL1_USLMX0_UIOFGRO0_UPLRP0_USFGROn1_USI0_VSn1_VWA2_VWB2_WSGRA0_WSGRB0_WS64_WG16_16_1_WGM8_WGMXCC8_WGMXCCGn1
    SolutionIndex: 47
    SolutionNameMin: Cijk_Ailk_Bjlk_B8NSS_BH_Bias_FDMN_SPAML0_A_S_SAV_MT256x128x64_MI16x16x1_SN_LDSB1_AFC1_AG0_AFEM1_AFEM1_ASEM8_CLR0_CADS0_DTLA0_DTLB0_DTVA0_DTVB0_DTVMXSA0_DTVMXSB0_DTVSM0_DPLB0_EPS1_ELFLR0_EMLLn1_FDSI0_GRPM1_GRVWA16_GRVWB16_GSUn1_GSUAMBSK_GSUC1_GSUWGMRR1_GLS0_ISA942_IU1_K1_LDSTI0_LBSPPA4096_LBSPPB2048_LBSPPM0_LPA32_LPB64_LPM0_LRVWn1_LWPMn1_MIAV0_MIWT8_4_MO40_MGRIPM1_NTn1_NTA0_NTB0_NTC0_NTD4_NTM0_NEPBS16_NLCA1_NLCB1_ONLL1_PGR2_PLR0_PKA1_SGROB0_SIA3_SS0_SU16_SUM0_SUS256_SPO0_SRVW0_SSO0_SVW4_SK0_SKFTR0_SKXCCM0_SGRO0_TDMI0_TIN0_TLDS0_TLDSM1_ULSGRO0_USL1_USLMX0_UIOFGRO0_UPLRP0_USFGROn1_USI0_VSn1_VWA2_VWB4_WSGRA0_WSGRB0_WS64_WG32_8_1_WGM8_WGMXCC8_WGMXCCGn1
    SolutionIndex: 48
    SolutionNameMin: Cijk_Ailk_Bjlk_B8NSS_BH_Bias_FDMN_SPAML0_A_S_SAV_MT128x128x128_MI16x16x1_SN_LDSB1_AFC1_AG0_AFEM1_AFEM1_ASEM8_CLR1_CADS0_DTLA0_DTLB0_DTVA0_DTVB0_DTVMXSA0_DTVMXSB0_DTVSM0_DPLB0_EPS1_ELFLR0_EMLLn1_FDSI0_GRPM1_GRVWA16_GRVWB16_GSUn1_GSUAMBSK_GSUC1_GSUWGMRR1_GLS0_ISA942_IU1_K1_LDSTI0_LBSPPA2048_LBSPPB2048_LBSPPM0_LPA32_LPB64_LPM0_LRVWn1_LWPMn1_MIAV0_MIWT4_4_MO40_MGRIPM1_NTn1_NTA0_NTB0_NTC0_NTD4_NTM0_NEPBS16_NLCA1_NLCB1_ONLL1_PGR2_PLR1_PKA1_SGROB0_SIA3_SS0_SU16_SUM0_SUS256_SPO0_SRVW0_SSO0_SVW4_SK0_SKFTR0_SKXCCM0_SGRO0_TDMI0_TIN0_TLDS0_TLDSM1_ULSGRO0_USL1_USLMX0_UIOFGRO0_UPLRP0_USFGROn1_USI0_VSn1_VWA2_VWB4_WSGRA0_WSGRB0_WS64_WG32_8_1_WGM8_WGMXCC8_WGMXCCGn1
    SolutionIndex: 49
    SolutionNameMin: Cijk_Ailk_Bjlk_B8NSS_BH_Bias_FDMN_SPAML0_A_S_SAV_MT128x256x64_MI16x16x1_SN_LDSB1_AFC1_AG0_AFEM1_AFEM1_ASEM8_CLR0_CADS0_DTLA0_DTLB0_DTVA0_DTVB0_DTVMXSA0_DTVMXSB0_DTVSM0_DPLB0_EPS1_ELFLR0_EMLLn1_FDSI0_GRPM1_GRVWA16_GRVWB16_GSUn1_GSUAMBSK_GSUC1_GSUWGMRR1_GLS0_ISA942_IU1_K1_LDSTI0_LBSPPA2048_LBSPPB4096_LBSPPM0_LPA32_LPB64_LPM0_LRVWn1_LWPMn1_MIAV0_MIWT8_4_MO40_MGRIPM1_NTn1_NTA0_NTB0_NTC0_NTD4_NTM0_NEPBS16_NLCA1_NLCB1_ONLL1_PGR2_PLR0_PKA1_SGROB0_SIA3_SS0_SU16_SUM0_SUS256_SPO0_SRVW0_SSO0_SVW4_SK0_SKFTR0_SKXCCM0_SGRO0_TDMI0_TIN0_TLDS0_TLDSM1_ULSGRO0_USL1_USLMX0_UIOFGRO0_UPLRP0_USFGROn1_USI0_VSn1_VWA2_VWB4_WSGRA0_WSGRB0_WS64_WG16_16_1_WGM1_WGMXCC1_WGMXCCGn1
    SolutionIndex: 50
    SolutionNameMin: Cijk_Ailk_Bjlk_B8NSS_BH_Bias_FDMN_SPAML0_A_S_SAV_MT512x128x64_MI16x16x1_SN_LDSB0_AFC1_AG0_AFEM1_AFEM1_ASEM8_CLR0_CADS0_DTLA0_DTLB0_DTVA0_DTVB0_DTVMXSA0_DTVMXSB0_DTVSM0_DPLB0_EPS1_ELFLR0_EMLLn1_FDSI0_GRPM1_GRVWA16_GRVWB16_GSUn1_GSUAMBSK_GSUC1_GSUWGMRR1_GLS0_ISA942_IU1_K1_LDSTI0_LBSPPA8192_LBSPPB0_LBSPPM0_LPA32_LPB0_LPM0_LRVWn1_LWPMn1_MIAV0_MIWT8_8_MO40_MGRIPM1_NTn1_NTA0_NTB0_NTC0_NTD4_NTM0_NEPBS16_NLCA1_NLCB1_ONLL1_PGR2_PLR0_PKA1_SGROB0_SIA3_SS0_SU16_SUM0_SUS256_SPO0_SRVW0_SSO0_SVW4_SK0_SKFTR0_SKXCCM0_SGRO0_TDMI0_TIN0_TLDS0_TLDSM1_ULSGRO0_USL1_USLMX0_UIOFGRO0_UPLRP0_USFGROn1_USI0_VSn1_VWA2_VWB8_WSGRA0_WSGRB0_WS64_WG64_4_1_WGM8_WGMXCC8_WGMXCCGn1
    SolutionIndex: 51
    SolutionNameMin: Cijk_Ailk_Bjlk_B8NSS_BH_Bias_FDMN_SPAML0_A_S_SAV_MT256x128x64_MI16x16x1_SN_LDSB1_AFC1_AG0_AFEM1_AFEM1_ASEM8_CLR0_CADS0_DTLA0_DTLB0_DTVA0_DTVB0_DTVMXSA0_DTVMXSB0_DTVSM0_DPLB0_EPS1_ELFLR0_EMLLn1_FDSI0_GRPM1_GRVWA16_GRVWB16_GSUn1_GSUAMBSK_GSUC1_GSUWGMRR1_GLS0_ISA942_IU1_K1_LDSTI0_LBSPPA4096_LBSPPB0_LBSPPM0_LPA32_LPB0_LPM0_LRVWn1_LWPMn1_MIAV0_MIWT4_8_MO40_MGRIPM1_NTn1_NTA0_NTB0_NTC0_NTD4_NTM0_NEPBS16_NLCA1_NLCB1_ONLL1_PGR2_PLR0_PKA1_SGROB0_SIA3_SS0_SU16_SUM0_SUS256_SPO0_SRVW0_SSO0_SVW4_SK0_SKFTR0_SKXCCM0_SGRO0_TDMI0_TIN0_TLDS0_TLDSM1_ULSGRO0_USL1_USLMX0_UIOFGRO0_UPLRP0_USFGROn1_USI0_VSn1_VWA2_VWB8_WSGRA0_WSGRB0_WS64_WG64_4_1_WGM1_WGMXCC1_WGMXCCGn1
    SolutionIndex: 52
    SolutionNameMin: Cijk_Ailk_Bjlk_B8NSS_BH_Bias_FDMN_SPAML0_A_S_SAV_MT256x192x128_MI16x16x1_SN_LDSB1_AFC1_AG0_AFEM1_AFEM1_ASEM8_CLR1_CADS0_DTLA0_DTLB0_DTVA0_DTVB0_DTVMXSA0_DTVMXSB0_DTVSM0_DPLB0_EPS1_ELFLR0_EMLLn1_FDSI0_GRPM1_GRVWA16_GRVWB16_GSUn1_GSUAMBSK_GSUC1_GSUWGMRR1_GLS0_ISA942_IU1_K1_LDSTI0_LBSPPA4096_LBSPPB3072_LBSPPM0_LPA32_LPB64_LPM0_LRVWn1_LWPMn1_MIAV0_MIWT4_12_MO40_MGRIPM1_NTn1_NTA0_NTB0_NTC0_NTD4_NTM0_NEPBS16_NLCA1_NLCB3_ONLL1_PGR2_PLR1_PKA1_SGROB0_SIA3_SS0_SU16_SUM0_SUS256_SPO0_SRVW0_SSO0_SVW4_SK0_SKFTR0_SKXCCM0_SGRO0_TDMI0_TIN0_TLDS0_TLDSM1_ULSGRO0_USL1_USLMX0_UIOFGRO0_UPLRP0_USFGROn1_USI0_VSn1_VWA2_VWB4_WSGRA0_WSGRB0_WS64_WG64_4_1_WGM8_WGMXCC8_WGMXCCGn1
    SolutionIndex: 53
    SolutionNameMin: Cijk_Ailk_Bjlk_B8NSS_BH_Bias_FDMN_SPAML0_A_S_SAV_MT64x384x64_MI16x16x1_SN_LDSB1_AFC1_AG0_AFEM1_AFEM1_ASEM8_CLR0_CADS0_DTLA0_DTLB0_DTVA0_DTVB0_DTVMXSA0_DTVMXSB0_DTVSM0_DPLB0_EPS1_ELFLR0_EMLLn1_FDSI0_GRPM1_GRVWA8_GRVWB16_GSUn1_GSUAMBSK_GSUC1_GSUWGMRR1_GLS0_ISA942_IU1_K1_LDSTI0_LBSPPA1024_LBSPPB6144_LBSPPM0_LPA32_LPB32_LPM0_LRVWn1_LWPMn1_MIAV0_MIWT4_6_MO40_MGRIPM1_NTn1_NTA0_NTB0_NTC0_NTD4_NTM0_NEPBS16_NLCA1_NLCB3_ONLL1_PGR2_PLR0_PKA1_SGROB0_SIA3_SS0_SU16_SUM0_SUS256_SPO0_SRVW0_SSO0_SVW4_SK0_SKFTR0_SKXCCM0_SGRO0_TDMI0_TIN0_TLDS0_TLDSM1_ULSGRO0_USL1_USLMX0_UIOFGRO0_UPLRP0_USFGROn1_USI0_VSn1_VWA2_VWB2_WSGRA0_WSGRB0_WS64_WG16_16_1_WGM1_WGMXCC1_WGMXCCGn1
    SolutionIndex: 54
    SolutionNameMin: Cijk_Ailk_Bjlk_B8NSS_BH_Bias_FDMN_SPAML0_A_S_SAV_MT64x128x128_MI16x16x1_SN_LDSB1_AFC1_AG0_AFEM1_AFEM1_ASEM8_CLR1_CADS0_DTLA0_DTLB0_DTVA0_DTVB0_DTVMXSA0_DTVMXSB0_DTVSM0_DPLB0_EPS1_ELFLR0_EMLLn1_FDSI0_GRPM1_GRVWA16_GRVWB16_GSUn1_GSUAMBSK_GSUC1_GSUWGMRR1_GLS0_ISA942_IU1_K1_LDSTI0_LBSPPA1024_LBSPPB2048_LBSPPM0_LPA32_LPB64_LPM0_LRVWn1_LWPMn1_MIAV0_MIWT2_4_MO40_MGRIPM1_NTn1_NTA0_NTB0_NTC0_NTD4_NTM0_NEPBS16_NLCA1_NLCB1_ONLL1_PGR2_PLR1_PKA1_SGROB0_SIA3_SS0_SU16_SUM0_SUS256_SPO0_SRVW0_SSO0_SVW4_SK0_SKFTR0_SKXCCM0_SGRO0_TDMI0_TIN0_TLDS0_TLDSM1_ULSGRO0_USL1_USLMX0_UIOFGRO0_UPLRP0_USFGROn1_USI0_VSn1_VWA2_VWB4_WSGRA0_WSGRB0_WS64_WG32_8_1_WGM8_WGMXCC8_WGMXCCGn1
    SolutionIndex: 55
    SolutionNameMin: Cijk_Ailk_Bjlk_B8NSS_BH_Bias_FDMN_SPAML0_A_S_SAV_MT32x256x128_MI16x16x1_SN_LDSB1_AFC1_AG0_AFEM1_AFEM1_ASEM8_CLR1_CADS0_DTLA0_DTLB0_DTVA0_DTVB0_DTVMXSA0_DTVMXSB0_DTVSM0_DPLB0_EPS1_ELFLR0_EMLLn1_FDSI0_GRPM1_GRVWA8_GRVWB16_GSUn1_GSUAMBSK_GSUC1_GSUWGMRR1_GLS0_ISA942_IU1_K1_LDSTI0_LBSPPA512_LBSPPB4096_LBSPPM0_LPA32_LPB64_LPM0_LRVWn1_LWPMn1_MIAV0_MIWT2_4_MO40_MGRIPM1_NTn1_NTA0_NTB0_NTC0_NTD4_NTM0_NEPBS16_NLCA1_NLCB1_ONLL1_PGR2_PLR1_PKA1_SGROB0_SIA3_SS0_SU16_SUM0_SUS256_SPO0_SRVW0_SSO0_SVW4_SK0_SKFTR0_SKXCCM0_SGRO0_TDMI0_TIN0_TLDS0_TLDSM1_ULSGRO0_USL1_USLMX0_UIOFGRO0_UPLRP0_USFGROn1_USI0_VSn1_VWA2_VWB4_WSGRA0_WSGRB0_WS64_WG16_16_1_WGM8_WGMXCC8_WGMXCCGn1
    SolutionIndex: 56
    SolutionNameMin: Cijk_Ailk_Bjlk_B8NSS_BH_Bias_FDMN_SPAML0_A_S_SAV_MT192x256x128_MI16x16x1_SN_LDSB1_AFC1_AG0_AFEM1_AFEM1_ASEM8_CLR1_CADS0_DTLA0_DTLB0_DTVA0_DTVB0_DTVMXSA0_DTVMXSB0_DTVSM0_DPLB0_EPS1_ELFLR0_EMLLn1_FDSI0_GRPM1_GRVWA8_GRVWB16_GSUn1_GSUAMBSK_GSUC1_GSUWGMRR1_GLS0_ISA942_IU1_K1_LDSTI0_LBSPPA3072_LBSPPB0_LBSPPM0_LPA32_LPB0_LPM0_LRVWn1_LWPMn1_MIAV0_MIWT6_8_MO40_MGRIPM1_NTn1_NTA0_NTB0_NTC0_NTD4_NTM0_NEPBS16_NLCA3_NLCB1_ONLL1_PGR2_PLR1_PKA1_SGROB0_SIA3_SS0_SU16_SUM0_SUS256_SPO0_SRVW0_SSO0_SVW4_SK0_SKFTR0_SKXCCM0_SGRO0_TDMI0_TIN0_TLDS0_TLDSM1_ULSGRO0_USL1_USLMX0_UIOFGRO0_UPLRP0_USFGROn1_USI0_VSn1_VWA2_VWB8_WSGRA0_WSGRB0_WS64_WG32_8_1_WGM8_WGMXCC8_WGMXCCGn1
    SolutionIndex: 57
    SolutionNameMin: Cijk_Ailk_Bjlk_B8NSS_BH_Bias_FDMN_SPAML0_A_S_SAV_MT384x128x128_MI16x16x1_SN_LDSB1_AFC1_AG0_AFEM1_AFEM1_ASEM8_CLR1_CADS0_DTLA0_DTLB0_DTVA0_DTVB0_DTVMXSA0_DTVMXSB0_DTVSM0_DPLB0_EPS1_ELFLR0_EMLLn1_FDSI0_GRPM1_GRVWA16_GRVWB16_GSUn1_GSUAMBSK_GSUC1_GSUWGMRR1_GLS0_ISA942_IU1_K1_LDSTI0_LBSPPA6144_LBSPPB0_LBSPPM0_LPA32_LPB0_LPM0_LRVWn1_LWPMn1_MIAV0_MIWT6_8_MO40_MGRIPM1_NTn1_NTA0_NTB0_NTC0_NTD4_NTM0_NEPBS16_NLCA3_NLCB1_ONLL1_PGR2_PLR1_PKA1_SGROB0_SIA3_SS0_SU16_SUM0_SUS256_SPO0_SRVW0_SSO0_SVW4_SK0_SKFTR0_SKXCCM0_SGRO0_TDMI0_TIN0_TLDS0_TLDSM1_ULSGRO0_USL1_USLMX0_UIOFGRO0_UPLRP0_USFGROn1_USI0_VSn1_VWA2_VWB8_WSGRA0_WSGRB0_WS64_WG64_4_1_WGM8_WGMXCC8_WGMXCCGn1
    SolutionIndex: 58
    SolutionNameMin: Cijk_Ailk_Bjlk_B8NSS_BH_Bias_FDMN_SPAML0_A_S_SAV_MT256x96x128_MI16x16x1_SN_LDSB1_AFC1_AG0_AFEM1_AFEM1_ASEM8_CLR1_CADS0_DTLA0_DTLB0_DTVA0_DTVB0_DTVMXSA0_DTVMXSB0_DTVSM0_DPLB0_EPS1_ELFLR0_EMLLn1_FDSI0_GRPM1_GRVWA16_GRVWB16_GSUn1_GSUAMBSK_GSUC1_GSUWGMRR1_GLS0_ISA942_IU1_K1_LDSTI0_LBSPPA4096_LBSPPB1536_LBSPPM0_LPA32_LPB32_LPM0_LRVWn1_LWPMn1_MIAV0_MIWT4_6_MO40_MGRIPM1_NTn1_NTA0_NTB0_NTC0_NTD4_NTM0_NEPBS16_NLCA1_NLCB3_ONLL1_PGR2_PLR1_PKA1_SGROB0_SIA3_SS0_SU16_SUM0_SUS256_SPO0_SRVW0_SSO0_SVW4_SK0_SKFTR0_SKXCCM0_SGRO0_TDMI0_TIN0_TLDS0_TLDSM1_ULSGRO0_USL1_USLMX0_UIOFGRO0_UPLRP0_USFGROn1_USI0_VSn1_VWA2_VWB2_WSGRA0_WSGRB0_WS64_WG64_4_1_WGM8_WGMXCC8_WGMXCCGn1
    SolutionIndex: 59
    SolutionNameMin: Cijk_Ailk_Bjlk_B8NSS_BH_Bias_FDMN_SPAML0_A_S_SAV_MT64x512x64_MI16x16x1_SN_LDSB1_AFC1_AG0_AFEM1_AFEM1_ASEM8_CLR0_CADS0_DTLA0_DTLB0_DTVA0_DTVB0_DTVMXSA0_DTVMXSB0_DTVSM0_DPLB0_EPS1_ELFLR0_EMLLn1_FDSI0_GRPM1_GRVWA8_GRVWB16_GSUn1_GSUAMBSK_GSUC1_GSUWGMRR1_GLS0_ISA942_IU1_K1_LDSTI0_LBSPPA1024_LBSPPB0_LBSPPM0_LPA32_LPB0_LPM0_LRVWn1_LWPMn1_MIAV0_MIWT4_8_MO40_MGRIPM1_NTn1_NTA0_NTB0_NTC0_NTD4_NTM0_NEPBS16_NLCA1_NLCB1_ONLL1_PGR2_PLR0_PKA1_SGROB0_SIA3_SS0_SU16_SUM0_SUS256_SPO0_SRVW0_SSO0_SVW4_SK0_SKFTR0_SKXCCM0_SGRO0_TDMI0_TIN0_TLDS0_TLDSM1_ULSGRO0_USL1_USLMX0_UIOFGRO0_UPLRP0_USFGROn1_USI0_VSn1_VWA2_VWB8_WSGRA0_WSGRB0_WS64_WG16_16_1_WGM1_WGMXCC1_WGMXCCGn1
    SolutionIndex: 60
    SolutionNameMin: Cijk_Ailk_Bjlk_B8NSS_BH_Bias_FDMN_SPAML0_A_S_SAV_MT64x512x64_MI16x16x1_SN_LDSB1_AFC1_AG0_AFEM1_AFEM1_ASEM8_CLR0_CADS0_DTLA0_DTLB0_DTVA0_DTVB0_DTVMXSA0_DTVMXSB0_DTVSM0_DPLB0_EPS1_ELFLR0_EMLLn1_FDSI0_GRPM1_GRVWA8_GRVWB4_GSUn1_GSUAMBSK_GSUC1_GSUWGMRR1_GLS0_ISA942_IU1_K1_LDSTI0_LBSPPA1024_LBSPPB0_LBSPPM0_LPA32_LPB0_LPM0_LRVWn1_LWPMn1_MIAV0_MIWT4_8_MO40_MGRIPM1_NTn1_NTA0_NTB0_NTC0_NTD4_NTM0_NEPBS16_NLCA1_NLCB1_ONLL1_PGR2_PLR0_PKA1_SGROB0_SIA3_SS0_SU16_SUM0_SUS256_SPO0_SRVW0_SSO0_SVW4_SK0_SKFTR0_SKXCCM0_SGRO0_TDMI0_TIN0_TLDS0_TLDSM1_ULSGRO0_USL1_USLMX0_UIOFGRO0_UPLRP0_USFGROn1_USI0_VSn1_VWA2_VWB8_WSGRA0_WSGRB0_WS64_WG16_16_1_WGM1_WGMXCC1_WGMXCCGn1
    SolutionIndex: 61
    SolutionNameMin: Cijk_Ailk_Bjlk_B8NSS_BH_Bias_FDMN_SPAML0_A_S_SAV_MT64x512x64_MI16x16x1_SN_LDSB1_AFC1_AG0_AFEM1_AFEM1_ASEM8_CLR0_CADS0_DTLA0_DTLB0_DTVA0_DTVB0_DTVMXSA0_DTVMXSB0_DTVSM0_DPLB0_EPS1_ELFLR0_EMLLn1_FDSI0_GRPM1_GRVWA8_GRVWB16_GSUn1_GSUAMBSK_GSUC1_GSUWGMRR1_GLS0_ISA942_IU1_K1_LDSTI0_LBSPPA1024_LBSPPB0_LBSPPM0_LPA32_LPB0_LPM0_LRVWn1_LWPMn1_MIAV0_MIWT4_8_MO40_MGRIPM1_NTn1_NTA0_NTB0_NTC0_NTD4_NTM0_NEPBS16_NLCA1_NLCB1_ONLL1_PGR2_PLR0_PKA1_SGROB0_SIA3_SS0_SU16_SUM0_SUS256_SPO0_SRVW0_SSO0_SVW4_SK0_SKFTR0_SKXCCM0_SGRO0_TDMI0_TIN0_TLDS0_TLDSM1_ULSGRO0_USL1_USLMX0_UIOFGRO0_UPLRP0_USFGROn1_USI0_VSn1_VWA2_VWB8_WSGRA0_WSGRB0_WS64_WG16_16_1_WGM8_WGMXCC8_WGMXCCGn1
- - - [10752, 10240, 1, 512]
    - [0, 222.09]
  - - [9216, 10752, 1, 512]
    - [2, 213.14]
  - - [10240, 11264, 1, 512]
    - [2, 209.69]
  - - [9216, 17664, 1, 512]
    - [2, 227.09]
  - - [25600, 19968, 1, 512]
    - [1, 242.34]
  - - [25600, 20736, 1, 512]
    - [1, 239.12]
  - - [21504, 5120, 1, 512]
    - [0, 214.72]
  - - [13312, 7168, 1, 512]
    - [2, 201.44]
  - - [21504, 23040, 1, 512]
    - [0, 234.77]
  - - [24576, 4864, 1, 512]
    - [2, 220.94]
  - - [22528, 4352, 1, 512]
    - [3, 224.44]
  - - [90112, 800, 1, 512]
    - [4, 214.09]
  - - [23296, 4096, 1, 512]
    - [4, 227.25]
  - - [25600, 3840, 1, 512]
    - [5, 226.12]
  - - [21504, 4352, 1, 512]
    - [6, 238.94]
  - - [21760, 4352, 1, 512]
    - [4, 225.67]
  - - [53504, 1728, 1, 512]
    - [4, 216.29]
  - - [26624, 3584, 1, 512]
    - [4, 223.03]
  - - [43008, 2304, 1, 512]
    - [6, 233.66]
  - - [37632, 2432, 1, 512]
    - [6, 226.51]
  - - [4096, 131072, 1, 512]
    - [2, 218.44]
  - - [992, 42240, 1, 512]
    - [1, 159.19]
  - - [512, 100352, 1, 512]
    - [7, 149.55]
  - - [480, 119040, 1, 512]
    - [8, 128.54]
  - - [2304, 76032, 1, 512]
    - [9, 223.3]
  - - [2048, 70400, 1, 512]
    - [9, 184.92]
  - - [608, 131072, 1, 512]
    - [9, 164.85]
  - - [432, 126976, 1, 512]
    - [9, 137.87]
  - - [608, 69888, 1, 512]
    - [0, 149.73]
  - - [496, 82432, 1, 512]
    - [10, 117.23]
  - - [272, 100352, 1, 512]
    - [11, 106.25]
  - - [240, 122880, 1, 512]
    - [12, 117.33]
  - - [416, 49152, 1, 512]
    - [4, 145.82]
  - - [240, 126976, 1, 512]
    - [12, 117.88]
  - - [240, 102400, 1, 512]
    - [12, 116.83]
  - - [272, 98304, 1, 512]
    - [11, 104.81]
  - - [400, 93184, 1, 512]
    - [4, 157.92]
  - - [240, 103168, 1, 512]
    - [12, 118.58]
  - - [272, 99840, 1, 512]
    - [13, 104.38]
  - - [400, 92160, 1, 512]
    - [12, 158.38]
  - - [16, 16, 1, 512]
    - [14, 0.03]
  - - [7680, 16896, 1, 2048]
    - [1, 408.36]
  - - [9984, 7936, 1, 2048]
    - [15, 358.3]
  - - [12800, 6144, 1, 2048]
    - [1, 361.43]
  - - [16128, 16128, 1, 2048]
    - [15, 396.55]
  - - [6656, 19968, 1, 2048]
    - [9, 361.94]
  - - [32768, 13824, 1, 2048]
    - [15, 411.18]
  - - [7936, 9984, 1, 2048]
    - [9, 342.5]
  - - [8192, 8960, 1, 2048]
    - [9, 353.66]
  - - [5376, 16640, 1, 2048]
    - [2, 377.53]
  - - [8960, 5632, 1, 2048]
    - [1, 373.03]
  - - [47872, 992, 1, 2048]
    - [16, 385.3]
  - - [83200, 736, 1, 2048]
    - [4, 379.4]
  - - [96768, 608, 1, 2048]
    - [4, 368.85]
  - - [25344, 2816, 1, 2048]
    - [16, 409.15]
  - - [59392, 1152, 1, 2048]
    - [4, 398.1]
  - - [46592, 1536, 1, 2048]
    - [4, 400.36]
  - - [43520, 1792, 1, 2048]
    - [4, 403.37]
  - - [90112, 496, 1, 2048]
    - [4, 355.6]
  - - [47872, 1856, 1, 2048]
    - [4, 385.33]
  - - [61952, 1024, 1, 2048]
    - [4, 396.17]
  - - [3968, 14592, 1, 2048]
    - [17, 345.34]
  - - [2688, 33792, 1, 2048]
    - [0, 360.81]
  - - [768, 69632, 1, 2048]
    - [18, 352.04]
  - - [576, 103168, 1, 2048]
    - [9, 343.5]
  - - [768, 66816, 1, 2048]
    - [18, 345.8]
  - - [768, 76800, 1, 2048]
    - [9, 347.54]
  - - [512, 99840, 1, 2048]
    - [19, 295.13]
  - - [480, 107520, 1, 2048]
    - [8, 257.55]
  - - [4096, 25088, 1, 2048]
    - [19, 352.52]
  - - [1984, 41216, 1, 2048]
    - [15, 333.23]
  - - [69888, 432, 1, 2048]
    - [4, 330.71]
  - - [5120, 4352, 1, 2048]
    - [5, 368.85]
  - - [272, 77824, 1, 2048]
    - [20, 211.67]
  - - [53248, 704, 1, 2048]
    - [4, 354.27]
  - - [14592, 1792, 1, 2048]
    - [4, 358.1]
  - - [26624, 864, 1, 2048]
    - [16, 347.76]
  - - [34048, 1024, 1, 2048]
    - [16, 390.56]
  - - [52224, 512, 1, 2048]
    - [6, 364.66]
  - - [29184, 896, 1, 2048]
    - [6, 360.38]
  - - [1216, 17664, 1, 2048]
    - [4, 290.87]
  - - [50688, 320, 1, 2048]
    - [0, 336.48]
  - - [33792, 448, 1, 2048]
    - [21, 296.78]
  - - [160, 115200, 1, 2048]
    - [22, 246.13]
  - - [1280, 13312, 1, 2048]
    - [15, 366.44]
  - - [16896, 928, 1, 2048]
    - [0, 319.22]
  - - [736, 19712, 1, 2048]
    - [12, 243.41]
  - - [128, 115200, 1, 2048]
    - [17, 236.0]
  - - [60928, 256, 1, 2048]
    - [23, 332.62]
  - - [30720, 464, 1, 2048]
    - [1, 269.61]
  - - [128, 114688, 1, 2048]
    - [17, 238.64]
  - - [128, 103680, 1, 2048]
    - [24, 235.26]
  - - [128, 103936, 1, 2048]
    - [17, 227.23]
  - - [128, 96512, 1, 2048]
    - [24, 227.73]
  - - [128, 103168, 1, 2048]
    - [25, 232.3]
  - - [128, 100352, 1, 2048]
    - [26, 224.98]
  - - [96, 111360, 1, 2048]
    - [12, 209.14]
  - - [96, 115200, 1, 2048]
    - [27, 205.41]
  - - [128, 96000, 1, 2048]
    - [28, 230.98]
  - - [128, 99840, 1, 2048]
    - [29, 224.28]
  - - [128, 102400, 1, 2048]
    - [17, 227.08]
  - - [1024, 1024, 1, 2048]
    - [30, 128.76]
  - - [7424, 7936, 1, 4096]
    - [31, 419.9]
  - - [6144, 11264, 1, 4096]
    - [31, 444.12]
  - - [8960, 8960, 1, 4096]
    - [31, 411.98]
  - - [4608, 15872, 1, 4096]
    - [31, 449.52]
  - - [8960, 6656, 1, 4096]
    - [32, 413.53]
  - - [9984, 7936, 1, 4096]
    - [32, 420.96]
  - - [5376, 14336, 1, 4096]
    - [32, 420.03]
  - - [4608, 19712, 1, 4096]
    - [31, 426.44]
  - - [4608, 16640, 1, 4096]
    - [32, 417.32]
  - - [12288, 4864, 1, 4096]
    - [31, 432.41]
  - - [62208, 1024, 1, 4096]
    - [4, 459.77]
  - - [29696, 2304, 1, 4096]
    - [33, 458.7]
  - - [19200, 2816, 1, 4096]
    - [33, 450.31]
  - - [20736, 2816, 1, 4096]
    - [4, 462.99]
  - - [96512, 496, 1, 4096]
    - [16, 435.66]
  - - [24320, 2304, 1, 4096]
    - [4, 454.75]
  - - [50176, 992, 1, 4096]
    - [4, 438.02]
  - - [45056, 1216, 1, 4096]
    - [33, 433.14]
  - - [28160, 2048, 1, 4096]
    - [33, 449.86]
  - - [17664, 3200, 1, 4096]
    - [4, 457.05]
  - - [3456, 20736, 1, 4096]
    - [31, 442.58]
  - - [1984, 43776, 1, 4096]
    - [19, 386.4]
  - - [768, 66560, 1, 4096]
    - [31, 385.31]
  - - [768, 73728, 1, 4096]
    - [31, 404.81]
  - - [608, 84480, 1, 4096]
    - [19, 315.84]
  - - [2048, 34048, 1, 4096]
    - [19, 417.21]
  - - [768, 94208, 1, 4096]
    - [31, 414.63]
  - - [448, 100352, 1, 4096]
    - [31, 294.8]
  - - [3072, 23808, 1, 4096]
    - [31, 445.64]
  - - [992, 64768, 1, 4096]
    - [31, 358.07]
  - - [19456, 1472, 1, 4096]
    - [4, 376.28]
  - - [96512, 240, 1, 4096]
    - [16, 404.62]
  - - [7936, 3072, 1, 4096]
    - [16, 432.39]
  - - [16128, 1472, 1, 4096]
    - [4, 400.97]
  - - [736, 28672, 1, 4096]
    - [20, 325.07]
  - - [1024, 36864, 1, 4096]
    - [34, 422.95]
  - - [192, 119040, 1, 4096]
    - [35, 307.9]
  - - [31744, 736, 1, 4096]
    - [16, 409.56]
  - - [352, 111104, 1, 4096]
    - [20, 276.58]
  - - [15872, 1472, 1, 4096]
    - [16, 406.87]
  - - [1728, 8448, 1, 4096]
    - [4, 445.44]
  - - [192, 76544, 1, 4096]
    - [3, 328.98]
  - - [256, 70400, 1, 4096]
    - [33, 349.44]
  - - [192, 75264, 1, 4096]
    - [35, 330.68]
  - - [192, 77824, 1, 4096]
    - [35, 334.09]
  - - [128, 107520, 1, 4096]
    - [36, 270.37]
  - - [192, 76800, 1, 4096]
    - [35, 333.87]
  - - [144, 103168, 1, 4096]
    - [37, 201.97]
  - - [192, 73728, 1, 4096]
    - [35, 333.54]
  - - [192, 76032, 1, 4096]
    - [3, 328.84]
  - - [128, 96000, 1, 4096]
    - [26, 266.54]
  - - [128, 103168, 1, 4096]
    - [7, 268.18]
  - - [128, 103680, 1, 4096]
    - [38, 268.04]
  - - [128, 103936, 1, 4096]
    - [38, 268.9]
  - - [5888, 1856, 1, 4096]
    - [16, 382.96]
  - - [128, 96768, 1, 4096]
    - [26, 258.83]
  - - [128, 89856, 1, 4096]
    - [39, 253.05]
  - - [128, 96512, 1, 4096]
    - [24, 259.79]
  - - [128, 100352, 1, 4096]
    - [36, 266.81]
  - - [96, 111360, 1, 4096]
    - [40, 229.83]
  - - [16, 88320, 1, 4096]
    - [41, 52.88]
  - - [32, 90112, 1, 4096]
    - [41, 106.58]
  - - [48, 64768, 1, 4096]
    - [42, 117.35]
  - - [16, 65280, 1, 4096]
    - [43, 49.47]
  - - [16, 70400, 1, 4096]
    - [44, 50.39]
  - - [32, 73728, 1, 4096]
    - [45, 108.72]
  - - [16, 79360, 1, 4096]
    - [46, 49.03]
  - - [16, 81664, 1, 4096]
    - [41, 50.1]
  - - [16, 81920, 1, 4096]
    - [41, 50.72]
  - - [32, 86016, 1, 4096]
    - [41, 105.72]
  - - [4608, 12544, 1, 8192]
    - [31, 518.5]
  - - [4608, 14848, 1, 8192]
    - [31, 509.22]
  - - [7936, 7424, 1, 8192]
    - [32, 504.8]
  - - [12800, 4608, 1, 8192]
    - [31, 515.05]
  - - [5376, 10752, 1, 8192]
    - [31, 519.18]
  - - [6400, 12288, 1, 8192]
    - [32, 510.78]
  - - [4608, 15360, 1, 8192]
    - [31, 517.31]
  - - [12288, 19712, 1, 8192]
    - [31, 532.07]
  - - [9984, 8192, 1, 8192]
    - [31, 505.9]
  - - [4864, 12288, 1, 8192]
    - [32, 508.17]
  - - [32256, 1600, 1, 8192]
    - [33, 503.51]
  - - [38400, 1536, 1, 8192]
    - [33, 526.03]
  - - [46080, 1280, 1, 8192]
    - [47, 532.54]
  - - [24320, 2304, 1, 8192]
    - [33, 539.62]
  - - [42240, 1280, 1, 8192]
    - [33, 531.41]
  - - [23296, 2304, 1, 8192]
    - [33, 534.63]
  - - [53760, 1024, 1, 8192]
    - [33, 528.98]
  - - [44544, 1280, 1, 8192]
    - [47, 527.65]
  - - [33280, 1600, 1, 8192]
    - [33, 505.06]
  - - [32256, 1728, 1, 8192]
    - [33, 509.77]
  - - [2048, 36864, 1, 8192]
    - [32, 500.1]
  - - [768, 71680, 1, 8192]
    - [31, 468.97]
  - - [1280, 44544, 1, 8192]
    - [32, 477.72]
  - - [2304, 25600, 1, 8192]
    - [31, 510.96]
  - - [768, 72960, 1, 8192]
    - [31, 470.1]
  - - [1984, 35328, 1, 8192]
    - [31, 468.44]
  - - [1472, 46080, 1, 8192]
    - [31, 456.88]
  - - [768, 66560, 1, 8192]
    - [31, 447.82]
  - - [768, 76800, 1, 8192]
    - [31, 484.98]
  - - [1536, 38400, 1, 8192]
    - [31, 504.25]
  - - [288, 78848, 1, 8192]
    - [20, 310.25]
  - - [400, 78848, 1, 8192]
    - [48, 302.02]
  - - [320, 89856, 1, 8192]
    - [5, 386.53]
  - - [78848, 480, 1, 8192]
    - [31, 413.93]
  - - [768, 47616, 1, 8192]
    - [33, 484.44]
  - - [34048, 928, 1, 8192]
    - [33, 472.35]
  - - [14080, 2688, 1, 8192]
    - [33, 525.25]
  - - [47872, 704, 1, 8192]
    - [33, 484.38]
  - - [48384, 736, 1, 8192]
    - [16, 487.04]
  - - [37632, 992, 1, 8192]
    - [33, 506.27]
  - - [240, 70656, 1, 8192]
    - [49, 273.6]
  - - [47104, 304, 1, 8192]
    - [50, 382.38]
  - - [384, 50176, 1, 8192]
    - [17, 403.11]
  - - [10240, 1856, 1, 8192]
    - [33, 485.08]
  - - [512, 37632, 1, 8192]
    - [33, 457.69]
  - - [256, 62208, 1, 8192]
    - [51, 377.75]
  - - [256, 64768, 1, 8192]
    - [51, 385.39]
  - - [256, 59136, 1, 8192]
    - [33, 359.1]
  - - [256, 65536, 1, 8192]
    - [51, 390.53]
  - - [8448, 2176, 1, 8192]
    - [33, 485.81]
  - - [256, 39168, 1, 8192]
    - [52, 354.15]
  - - [320, 41472, 1, 8192]
    - [15, 353.78]
  - - [176, 69120, 1, 8192]
    - [20, 258.74]
  - - [51968, 256, 1, 8192]
    - [31, 431.82]
  - - [192, 66816, 1, 8192]
    - [31, 365.46]
  - - [128, 82944, 1, 8192]
    - [26, 274.79]
  - - [192, 56576, 1, 8192]
    - [35, 346.55]
  - - [112, 96768, 1, 8192]
    - [53, 191.92]
  - - [112, 96000, 1, 8192]
    - [54, 189.35]
  - - [512, 19968, 1, 8192]
    - [52, 369.81]
  - - [32, 59136, 1, 8192]
    - [55, 113.6]
  - - [16, 55552, 1, 8192]
    - [45, 54.7]
  - - [16, 52992, 1, 8192]
    - [45, 54.27]
  - - [32, 51968, 1, 8192]
    - [55, 103.97]
  - - [32, 52224, 1, 8192]
    - [45, 110.63]
  - - [32, 46080, 1, 8192]
    - [45, 106.27]
  - - [16, 48384, 1, 8192]
    - [45, 52.77]
  - - [32, 59904, 1, 8192]
    - [45, 112.36]
  - - [32, 59392, 1, 8192]
    - [45, 113.89]
  - - [16, 49152, 1, 8192]
    - [45, 55.14]
  - - [8192, 1792, 1, 32768]
    - [31, 592.01]
  - - [29440, 512, 1, 32768]
    - [32, 437.1]
  - - [6400, 2560, 1, 32768]
    - [50, 509.5]
  - - [5376, 2816, 1, 32768]
    - [50, 498.06]
  - - [3968, 4096, 1, 32768]
    - [32, 509.9]
  - - [3584, 4608, 1, 32768]
    - [32, 518.88]
  - - [28160, 512, 1, 32768]
    - [56, 509.41]
  - - [1792, 9216, 1, 32768]
    - [50, 506.18]
  - - [9216, 1472, 1, 32768]
    - [31, 536.89]
  - - [3840, 4096, 1, 32768]
    - [32, 507.87]
  - - [29696, 416, 1, 32768]
    - [50, 364.31]
  - - [25344, 496, 1, 32768]
    - [31, 488.6]
  - - [7680, 1408, 1, 32768]
    - [31, 470.36]
  - - [19712, 608, 1, 32768]
    - [57, 436.26]
  - - [640, 16128, 1, 32768]
    - [16, 436.34]
  - - [23808, 496, 1, 32768]
    - [31, 472.23]
  - - [30464, 432, 1, 32768]
    - [58, 377.81]
  - - [9216, 1280, 1, 32768]
    - [31, 509.27]
  - - [5376, 2304, 1, 32768]
    - [35, 530.82]
  - - [4352, 2944, 1, 32768]
    - [31, 545.13]
  - - [48, 131072, 1, 32768]
    - [59, 160.14]
  - - [64, 131072, 1, 32768]
    - [60, 213.59]
  - - [48, 126976, 1, 32768]
    - [59, 156.03]
  - - [64, 126976, 1, 32768]
    - [59, 214.83]
  - - [64, 122880, 1, 32768]
    - [59, 213.38]
  - - [48, 122880, 1, 32768]
    - [59, 154.48]
  - - [64, 119040, 1, 32768]
    - [61, 207.5]
  - - [48, 119040, 1, 32768]
    - [59, 152.52]
  - - [32, 131072, 1, 32768]
    - [45, 113.97]
  - - [48, 118784, 1, 32768]
    - [59, 154.32]
- null
- null
- DeviceEfficiency
- GridBased
