projects/hipsparselt/library/src/hcc_detail/rocsparselt/src/spmm/Tensile/Logic/asm_full/aquavanjaram/gfx942/GridBased/aquavanjaram_Cijk_Ailk_Bjlk_I8IS_BH_Bias_S_FDMN_SPB_A_S_SAV.yaml
- {MinimumRequiredVersion: 5.0.0}
- aquavanjaram
- gfx942
- [Device 0049, Device 0050]
    SolutionIndex: 0
    SolutionNameMin: Cijk_Ailk_Bjlk_I8IS_BH_Bias_S_FDMN_SPB_A_S_SAV_MT256x256x64_MI16x16x1_SN_LDSB0_AFC1_AG0_AFEM1_AFEM1_ASEM8_CLR0_CADS0_DTLA0_DTLB0_DTVA0_DTVB0_EPS1_FDSI0_GRPM1_GRVWA16_GRVWB16_GSUn1_GSUAMB_GSUC1_GSUWGMRR1_GLS0_ISA942_IU1_K1_LDSTI0_LBSPPA4096_LBSPPB4096_LBSPPM0_LPA64_LPB64_LPM0_LRVW16_LWPMn1_MIAV0_MIWT4_16_MO40_NTn1_NTA0_NTB0_NTC0_NTD4_NTM0_NEPBS0_NLCA1_NLCB1_ONLL1_PGR2_PLR0_PKA1_SIA3_SS1_SU16_SUM0_SUS256_SPO0_SRVW0_SSO0_SVW4_SK0_SKFTR0_SKXCCM0_TLDS0_ULSGRO0_USL1_UIOFGRO0_USFGROn1_VSn1_VWA4_VWB4_WSGRA0_WSGRB0_WS64_WG64_4_1_WGM8_WGMXCC8_WGMXCCGn1
    SolutionIndex: 1
    SolutionNameMin: Cijk_Ailk_Bjlk_I8IS_BH_Bias_S_FDMN_SPB_A_S_SAV_MT256x256x128_MI16x16x1_SN_LDSB1_AFC1_AG0_AFEM1_AFEM1_ASEM8_CLR1_CADS0_DTLA0_DTLB0_DTVA0_DTVB0_EPS1_FDSI0_GRPM1_GRVWA16_GRVWB16_GSUn1_GSUAMB_GSUC1_GSUWGMRR1_GLS0_ISA942_IU1_K1_LDSTI0_LBSPPA4096_LBSPPB4096_LBSPPM0_LPA64_LPB64_LPM0_LRVW16_LWPMn1_MIAV0_MIWT4_16_MO40_NTn1_NTA0_NTB0_NTC0_NTD4_NTM0_NEPBS0_NLCA1_NLCB1_ONLL1_PGR2_PLR1_PKA1_SIA3_SS1_SU16_SUM0_SUS256_SPO0_SRVW0_SSO0_SVW4_SK0_SKFTR0_SKXCCM0_TLDS0_ULSGRO0_USL1_UIOFGRO0_USFGROn1_VSn1_VWA4_VWB4_WSGRA0_WSGRB0_WS64_WG64_4_1_WGM8_WGMXCC8_WGMXCCGn1
    SolutionIndex: 2
    SolutionNameMin: Cijk_Ailk_Bjlk_I8IS_BH_Bias_S_FDMN_SPB_A_S_SAV_MT128x192x64_MI16x16x1_SN_LDSB0_AFC1_AG0_AFEM1_AFEM1_ASEM8_CLR0_CADS0_DTLA0_DTLB0_DTVA0_DTVB0_EPS1_FDSI0_GRPM1_GRVWA16_GRVWB8_GSUn1_GSUAMB_GSUC1_GSUWGMRR1_GLS0_ISA942_IU1_K1_LDSTI0_LBSPPA2048_LBSPPB3072_LBSPPM0_LPA64_LPB32_LPM0_LRVW16_LWPMn1_MIAV0_MIWT4_6_MO40_NTn1_NTA0_NTB0_NTC0_NTD4_NTM0_NEPBS16_NLCA1_NLCB3_ONLL1_PGR2_PLR0_PKA1_SIA3_SS1_SU16_SUM0_SUS256_SPO0_SRVW0_SSO0_SVW4_SK0_SKFTR0_SKXCCM0_TLDS0_ULSGRO0_USL1_UIOFGRO0_USFGROn1_VSn1_VWA4_VWB2_WSGRA0_WSGRB0_WS64_WG32_8_1_WGM8_WGMXCC8_WGMXCCGn1
    SolutionIndex: 3
    SolutionNameMin: Cijk_Ailk_Bjlk_I8IS_BH_Bias_S_FDMN_SPB_A_S_SAV_MT160x384x64_MI16x16x1_SN_LDSB0_AFC1_AG0_AFEM1_AFEM1_ASEM8_CLR0_CADS0_DTLA0_DTLB0_DTVA0_DTVB0_EPS1_FDSI0_GRPM1_GRVWA4_GRVWB16_GSUn1_GSUAMB_GSUC1_GSUWGMRR1_GLS0_ISA942_IU1_K1_LDSTI0_LBSPPA2560_LBSPPB6144_LBSPPM0_LPA32_LPB32_LPM0_LRVW16_LWPMn1_MIAV0_MIWT10_6_MO40_NTn1_NTA0_NTB0_NTC0_NTD4_NTM0_NEPBS0_NLCA5_NLCB3_ONLL1_PGR2_PLR0_PKA1_SIA3_SS1_SU16_SUM0_SUS256_SPO0_SRVW0_SSO0_SVW2_SK0_SKFTR0_SKXCCM0_TLDS0_ULSGRO0_USL1_UIOFGRO0_USFGROn1_VSn1_VWA2_VWB2_WSGRA0_WSGRB0_WS64_WG16_16_1_WGM8_WGMXCC8_WGMXCCGn1
    SolutionIndex: 4
    SolutionNameMin: Cijk_Ailk_Bjlk_I8IS_BH_Bias_S_FDMN_SPB_A_S_SAV_MT128x192x64_MI16x16x1_SN_LDSB0_AFC1_AG0_AFEM1_AFEM1_ASEM8_CLR0_CADS0_DTLA0_DTLB0_DTVA0_DTVB0_EPS1_FDSI0_GRPM1_GRVWA4_GRVWB8_GSUn1_GSUAMB_GSUC1_GSUWGMRR1_GLS0_ISA942_IU1_K1_LDSTI0_LBSPPA2048_LBSPPB3072_LBSPPM0_LPA64_LPB32_LPM0_LRVW16_LWPMn1_MIAV0_MIWT4_6_MO40_NTn1_NTA0_NTB0_NTC0_NTD4_NTM0_NEPBS16_NLCA1_NLCB3_ONLL1_PGR2_PLR0_PKA1_SIA3_SS1_SU16_SUM0_SUS256_SPO0_SRVW0_SSO0_SVW4_SK0_SKFTR0_SKXCCM0_TLDS0_ULSGRO0_USL1_UIOFGRO0_USFGROn1_VSn1_VWA4_VWB2_WSGRA0_WSGRB0_WS64_WG32_8_1_WGM8_WGMXCC8_WGMXCCGn1
    SolutionIndex: 5
    SolutionNameMin: Cijk_Ailk_Bjlk_I8IS_BH_Bias_S_FDMN_SPB_A_S_SAV_MT128x192x64_MI16x16x1_SN_LDSB0_AFC1_AG0_AFEM1_AFEM1_ASEM8_CLR0_CADS0_DTLA0_DTLB0_DTVA0_DTVB0_EPS1_FDSI0_GRPM1_GRVWA16_GRVWB8_GSUn1_GSUAMB_GSUC1_GSUWGMRR1_GLS0_ISA942_IU1_K1_LDSTI0_LBSPPA2048_LBSPPB3072_LBSPPM0_LPA32_LPB32_LPM0_LRVW16_LWPMn1_MIAV0_MIWT2_12_MO40_NTn1_NTA0_NTB0_NTC0_NTD4_NTM0_NEPBS16_NLCA1_NLCB3_ONLL1_PGR2_PLR0_PKA1_SIA3_SS1_SU16_SUM0_SUS256_SPO0_SRVW0_SSO0_SVW2_SK0_SKFTR0_SKXCCM0_TLDS0_ULSGRO0_USL1_UIOFGRO0_USFGROn1_VSn1_VWA2_VWB2_WSGRA0_WSGRB0_WS64_WG64_4_1_WGM8_WGMXCC8_WGMXCCGn1
    SolutionIndex: 6
    SolutionNameMin: Cijk_Ailk_Bjlk_I8IS_BH_Bias_S_FDMN_SPB_A_S_SAV_MT96x256x64_MI16x16x1_SN_LDSB1_AFC1_AG0_AFEM1_AFEM1_ASEM8_CLR0_CADS0_DTLA0_DTLB0_DTVA0_DTVB0_EPS1_FDSI0_GRPM1_GRVWA4_GRVWB8_GSUn1_GSUAMB_GSUC1_GSUWGMRR1_GLS0_ISA942_IU1_K1_LDSTI0_LBSPPA1536_LBSPPB4096_LBSPPM0_LPA16_LPB32_LPM0_LRVW16_LWPMn1_MIAV0_MIWT3_8_MO40_NTn1_NTA0_NTB0_NTC0_NTD4_NTM0_NEPBS16_NLCA3_NLCB1_ONLL1_PGR2_PLR0_PKA1_SIA3_SS1_SU16_SUM0_SUS256_SPO0_SRVW0_SSO0_SVW1_SK0_SKFTR0_SKXCCM0_TLDS0_ULSGRO0_USL1_UIOFGRO0_USFGROn1_VSn1_VWA1_VWB2_WSGRA0_WSGRB0_WS64_WG32_8_1_WGM8_WGMXCC8_WGMXCCGn1
    SolutionIndex: 7
    SolutionNameMin: Cijk_Ailk_Bjlk_I8IS_BH_Bias_S_FDMN_SPB_A_S_SAV_MT80x256x64_MI16x16x1_SN_LDSB0_AFC1_AG0_AFEM1_AFEM1_ASEM8_CLR0_CADS0_DTLA0_DTLB0_DTVA0_DTVB0_EPS1_FDSI0_GRPM1_GRVWA4_GRVWB16_GSUn1_GSUAMB_GSUC1_GSUWGMRR1_GLS0_ISA942_IU1_K1_LDSTI0_LBSPPA1280_LBSPPB4096_LBSPPM0_LPA16_LPB32_LPM0_LRVW16_LWPMn1_MIAV0_MIWT5_4_MO40_NTn1_NTA0_NTB0_NTC0_NTD4_NTM0_NEPBS16_NLCA5_NLCB1_ONLL1_PGR2_PLR0_PKA1_SIA3_SS1_SU16_SUM0_SUS256_SPO0_SRVW0_SSO0_SVW1_SK0_SKFTR0_SKXCCM0_TLDS0_ULSGRO0_USL1_UIOFGRO0_USFGROn1_VSn1_VWA1_VWB2_WSGRA0_WSGRB0_WS64_WG16_16_1_WGM8_WGMXCC8_WGMXCCGn1
    SolutionIndex: 8
    SolutionNameMin: Cijk_Ailk_Bjlk_I8IS_BH_Bias_S_FDMN_SPB_A_S_SAV_MT160x128x64_MI16x16x1_SN_LDSB0_AFC1_AG0_AFEM1_AFEM1_ASEM8_CLR0_CADS0_DTLA0_DTLB0_DTVA0_DTVB0_EPS1_FDSI0_GRPM1_GRVWA4_GRVWB8_GSUn1_GSUAMB_GSUC1_GSUWGMRR1_GLS0_ISA942_IU1_K1_LDSTI0_LBSPPA2560_LBSPPB2048_LBSPPM0_LPA16_LPB32_LPM0_LRVW16_LWPMn1_MIAV0_MIWT5_4_MO40_NTn1_NTA0_NTB0_NTC0_NTD4_NTM0_NEPBS16_NLCA5_NLCB1_ONLL1_PGR2_PLR0_PKA1_SIA3_SS1_SU16_SUM0_SUS256_SPO0_SRVW0_SSO0_SVW1_SK0_SKFTR0_SKXCCM0_TLDS0_ULSGRO0_USL1_UIOFGRO0_USFGROn1_VSn1_VWA1_VWB2_WSGRA0_WSGRB0_WS64_WG32_8_1_WGM8_WGMXCC8_WGMXCCGn1
    SolutionIndex: 9
    SolutionNameMin: Cijk_Ailk_Bjlk_I8IS_BH_Bias_S_FDMN_SPB_A_S_SAV_MT96x256x64_MI16x16x1_SN_LDSB1_AFC1_AG0_AFEM1_AFEM1_ASEM8_CLR0_CADS0_DTLA0_DTLB0_DTVA0_DTVB0_EPS1_FDSI0_GRPM1_GRVWA4_GRVWB16_GSUn1_GSUAMB_GSUC1_GSUWGMRR1_GLS0_ISA942_IU1_K1_LDSTI0_LBSPPA1536_LBSPPB4096_LBSPPM0_LPA16_LPB32_LPM0_LRVW16_LWPMn1_MIAV0_MIWT3_8_MO40_NTn1_NTA0_NTB0_NTC0_NTD4_NTM0_NEPBS16_NLCA3_NLCB1_ONLL1_PGR2_PLR0_PKA1_SIA3_SS1_SU16_SUM0_SUS256_SPO0_SRVW0_SSO0_SVW1_SK0_SKFTR0_SKXCCM0_TLDS0_ULSGRO0_USL1_UIOFGRO0_USFGROn1_VSn1_VWA1_VWB2_WSGRA0_WSGRB0_WS64_WG32_8_1_WGM8_WGMXCC8_WGMXCCGn1
    SolutionIndex: 10
    SolutionNameMin: Cijk_Ailk_Bjlk_I8IS_BH_Bias_S_FDMN_SPB_A_S_SAV_MT80x256x64_MI16x16x1_SN_LDSB0_AFC1_AG0_AFEM1_AFEM1_ASEM8_CLR0_CADS0_DTLA0_DTLB0_DTVA0_DTVB0_EPS1_FDSI0_GRPM1_GRVWA4_GRVWB8_GSUn1_GSUAMB_GSUC1_GSUWGMRR1_GLS0_ISA942_IU1_K1_LDSTI0_LBSPPA1280_LBSPPB4096_LBSPPM0_LPA16_LPB32_LPM0_LRVW16_LWPMn1_MIAV0_MIWT5_4_MO40_NTn1_NTA0_NTB0_NTC0_NTD4_NTM0_NEPBS16_NLCA5_NLCB1_ONLL1_PGR2_PLR0_PKA1_SIA3_SS1_SU16_SUM0_SUS256_SPO0_SRVW0_SSO0_SVW1_SK0_SKFTR0_SKXCCM0_TLDS0_ULSGRO0_USL1_UIOFGRO0_USFGROn1_VSn1_VWA1_VWB2_WSGRA0_WSGRB0_WS64_WG16_16_1_WGM8_WGMXCC8_WGMXCCGn1
    SolutionIndex: 11
    SolutionNameMin: Cijk_Ailk_Bjlk_I8IS_BH_Bias_S_FDMN_SPB_A_S_SAV_MT16x16x256_MI16x16x1_SN_LDSB0_AFC1_AG0_AFEM1_AFEM1_ASEM8_CLR1_CADS0_DTLA0_DTLB0_DTVA0_DTVB0_EPS1_FDSI0_GRPM1_GRVWA16_GRVWB16_GSUn1_GSUAMBSK_GSUC1_GSUWGMRR1_GLS0_ISA942_IU1_K1_LDSTI0_LBSPPA256_LBSPPB256_LBSPPM0_LPA16_LPB16_LPM0_LRVW16_LWPMn1_MIAV0_MIWT1_1_MO40_NTn1_NTA0_NTB0_NTC0_NTD4_NTM0_NEPBS16_NLCA1_NLCB1_ONLL1_PGR2_PLR1_PKA1_SIA3_SS1_SU16_SUM0_SUS256_SPO0_SRVW0_SSO0_SVW1_SK0_SKFTR0_SKXCCM0_TLDS0_ULSGRO0_USL1_UIOFGRO0_USFGROn1_VSn1_VWA1_VWB1_WSGRA0_WSGRB0_WS64_WG16_4_1_WGM1_WGMXCC1_WGMXCCGn1
    SolutionIndex: 12
    SolutionNameMin: Cijk_Ailk_Bjlk_I8IS_BH_Bias_S_FDMN_SPB_A_S_SAV_MT192x256x64_MI16x16x1_SN_LDSB0_AFC1_AG0_AFEM1_AFEM1_ASEM8_CLR0_CADS0_DTLA0_DTLB0_DTVA0_DTVB0_EPS1_FDSI0_GRPM1_GRVWA16_GRVWB8_GSUn1_GSUAMB_GSUC1_GSUWGMRR1_GLS0_ISA942_IU1_K1_LDSTI0_LBSPPA3072_LBSPPB4096_LBSPPM0_LPA32_LPB32_LPM0_LRVW16_LWPMn1_MIAV0_MIWT6_8_MO40_NTn1_NTA0_NTB0_NTC0_NTD4_NTM0_NEPBS0_NLCA3_NLCB1_ONLL1_PGR2_PLR0_PKA1_SIA3_SS1_SU16_SUM0_SUS256_SPO0_SRVW0_SSO0_SVW2_SK0_SKFTR0_SKXCCM0_TLDS0_ULSGRO0_USL1_UIOFGRO0_USFGROn1_VSn1_VWA2_VWB2_WSGRA0_WSGRB0_WS64_WG32_8_1_WGM8_WGMXCC8_WGMXCCGn1
    SolutionIndex: 13
    SolutionNameMin: Cijk_Ailk_Bjlk_I8IS_BH_Bias_S_FDMN_SPB_A_S_SAV_MT128x320x128_MI16x16x1_SN_LDSB1_AFC1_AG0_AFEM1_AFEM1_ASEM8_CLR1_CADS0_DTLA0_DTLB0_DTVA0_DTVB0_EPS1_FDSI0_GRPM1_GRVWA16_GRVWB16_GSUn1_GSUAMB_GSUC1_GSUWGMRR1_GLS0_ISA942_IU1_K1_LDSTI0_LBSPPA2048_LBSPPB5120_LBSPPM0_LPA64_LPB32_LPM0_LRVW16_LWPMn1_MIAV0_MIWT4_10_MO40_NTn1_NTA0_NTB0_NTC0_NTD4_NTM0_NEPBS0_NLCA1_NLCB5_ONLL1_PGR2_PLR1_PKA1_SIA3_SS1_SU16_SUM0_SUS256_SPO0_SRVW0_SSO0_SVW4_SK0_SKFTR0_SKXCCM0_TLDS0_ULSGRO0_USL1_UIOFGRO0_USFGROn1_VSn1_VWA4_VWB2_WSGRA0_WSGRB0_WS64_WG32_8_1_WGM8_WGMXCC8_WGMXCCGn1
    SolutionIndex: 14
    SolutionNameMin: Cijk_Ailk_Bjlk_I8IS_BH_Bias_S_FDMN_SPB_A_S_SAV_MT96x256x64_MI16x16x1_SN_LDSB1_AFC1_AG0_AFEM1_AFEM1_ASEM8_CLR0_CADS0_DTLA0_DTLB0_DTVA0_DTVB0_EPS1_FDSI0_GRPM1_GRVWA4_GRVWB16_GSUn1_GSUAMB_GSUC1_GSUWGMRR1_GLS0_ISA942_IU1_K1_LDSTI0_LBSPPA1536_LBSPPB4096_LBSPPM0_LPA32_LPB32_LPM0_LRVW16_LWPMn1_MIAV0_MIWT6_4_MO40_NTn1_NTA0_NTB0_NTC0_NTD4_NTM0_NEPBS16_NLCA3_NLCB1_ONLL1_PGR2_PLR0_PKA1_SIA3_SS1_SU16_SUM0_SUS256_SPO0_SRVW0_SSO0_SVW2_SK0_SKFTR0_SKXCCM0_TLDS0_ULSGRO0_USL1_UIOFGRO0_USFGROn1_VSn1_VWA2_VWB2_WSGRA0_WSGRB0_WS64_WG16_16_1_WGM8_WGMXCC8_WGMXCCGn1
    SolutionIndex: 15
    SolutionNameMin: Cijk_Ailk_Bjlk_I8IS_BH_Bias_S_FDMN_SPB_A_S_SAV_MT192x320x64_MI16x16x1_SN_LDSB0_AFC1_AG0_AFEM1_AFEM1_ASEM8_CLR0_CADS0_DTLA0_DTLB0_DTVA0_DTVB0_EPS1_FDSI0_GRPM1_GRVWA4_GRVWB8_GSUn1_GSUAMB_GSUC1_GSUWGMRR1_GLS0_ISA942_IU1_K1_LDSTI0_LBSPPA3072_LBSPPB5120_LBSPPM0_LPA32_LPB32_LPM0_LRVW16_LWPMn1_MIAV0_MIWT6_10_MO40_NTn1_NTA0_NTB0_NTC0_NTD4_NTM0_NEPBS0_NLCA3_NLCB5_ONLL1_PGR2_PLR0_PKA1_SIA3_SS1_SU16_SUM0_SUS256_SPO0_SRVW0_SSO0_SVW2_SK0_SKFTR0_SKXCCM0_TLDS0_ULSGRO0_USL1_UIOFGRO0_USFGROn1_VSn1_VWA2_VWB2_WSGRA0_WSGRB0_WS64_WG32_8_1_WGM8_WGMXCC8_WGMXCCGn1
    SolutionIndex: 16
    SolutionNameMin: Cijk_Ailk_Bjlk_I8IS_BH_Bias_S_FDMN_SPB_A_S_SAV_MT128x512x64_MI16x16x1_SN_LDSB0_AFC1_AG0_AFEM1_AFEM1_ASEM8_CLR0_CADS0_DTLA0_DTLB0_DTVA0_DTVB0_EPS1_FDSI0_GRPM1_GRVWA16_GRVWB16_GSUn1_GSUAMB_GSUC1_GSUWGMRR1_GLS0_ISA942_IU1_K1_LDSTI0_LBSPPA2048_LBSPPB8192_LBSPPM0_LPA64_LPB64_LPM0_LRVW16_LWPMn1_MIAV0_MIWT4_16_MO40_NTn1_NTA0_NTB0_NTC0_NTD4_NTM0_NEPBS0_NLCA1_NLCB1_ONLL1_PGR2_PLR0_PKA1_SIA3_SS1_SU16_SUM0_SUS256_SPO0_SRVW0_SSO0_SVW4_SK0_SKFTR0_SKXCCM0_TLDS0_ULSGRO0_USL1_UIOFGRO0_USFGROn1_VSn1_VWA4_VWB4_WSGRA0_WSGRB0_WS64_WG32_8_1_WGM8_WGMXCC8_WGMXCCGn1
    SolutionIndex: 17
    SolutionNameMin: Cijk_Ailk_Bjlk_I8IS_BH_Bias_S_FDMN_SPB_A_S_SAV_MT128x384x64_MI16x16x1_SN_LDSB0_AFC1_AG0_AFEM1_AFEM1_ASEM8_CLR0_CADS0_DTLA0_DTLB0_DTVA0_DTVB0_EPS1_FDSI0_GRPM1_GRVWA4_GRVWB16_GSUn1_GSUAMB_GSUC1_GSUWGMRR1_GLS0_ISA942_IU1_K1_LDSTI0_LBSPPA2048_LBSPPB6144_LBSPPM0_LPA64_LPB32_LPM0_LRVW16_LWPMn1_MIAV0_MIWT4_12_MO40_NTn1_NTA0_NTB0_NTC0_NTD4_NTM0_NEPBS0_NLCA1_NLCB3_ONLL1_PGR2_PLR0_PKA1_SIA3_SS1_SU16_SUM0_SUS256_SPO0_SRVW0_SSO0_SVW4_SK0_SKFTR0_SKXCCM0_TLDS0_ULSGRO0_USL1_UIOFGRO0_USFGROn1_VSn1_VWA4_VWB2_WSGRA0_WSGRB0_WS64_WG32_8_1_WGM8_WGMXCC8_WGMXCCGn1
    SolutionIndex: 18
    SolutionNameMin: Cijk_Ailk_Bjlk_I8IS_BH_Bias_S_FDMN_SPB_A_S_SAV_MT128x384x128_MI16x16x1_SN_LDSB1_AFC1_AG0_AFEM1_AFEM1_ASEM8_CLR1_CADS0_DTLA0_DTLB0_DTVA0_DTVB0_EPS1_FDSI0_GRPM1_GRVWA16_GRVWB16_GSUn1_GSUAMB_GSUC1_GSUWGMRR1_GLS0_ISA942_IU1_K1_LDSTI0_LBSPPA2048_LBSPPB6144_LBSPPM0_LPA0_LPB32_LPM0_LRVW16_LWPMn1_MIAV0_MIWT8_6_MO40_NTn1_NTA0_NTB0_NTC0_NTD4_NTM0_NEPBS0_NLCA1_NLCB3_ONLL1_PGR2_PLR1_PKA1_SIA3_SS1_SU16_SUM0_SUS256_SPO0_SRVW0_SSO0_SVW8_SK0_SKFTR0_SKXCCM0_TLDS0_ULSGRO0_USL1_UIOFGRO0_USFGROn1_VSn1_VWA8_VWB2_WSGRA0_WSGRB0_WS64_WG16_16_1_WGM8_WGMXCC8_WGMXCCGn1
    SolutionIndex: 19
    SolutionNameMin: Cijk_Ailk_Bjlk_I8IS_BH_Bias_S_FDMN_SPB_A_S_SAV_MT128x320x128_MI16x16x1_SN_LDSB1_AFC1_AG0_AFEM1_AFEM1_ASEM8_CLR1_CADS0_DTLA0_DTLB0_DTVA0_DTVB0_EPS1_FDSI0_GRPM1_GRVWA16_GRVWB8_GSUn1_GSUAMB_GSUC1_GSUWGMRR1_GLS0_ISA942_IU1_K1_LDSTI0_LBSPPA2048_LBSPPB5120_LBSPPM0_LPA64_LPB32_LPM0_LRVW16_LWPMn1_MIAV0_MIWT4_10_MO40_NTn1_NTA0_NTB0_NTC0_NTD4_NTM0_NEPBS0_NLCA1_NLCB5_ONLL1_PGR2_PLR1_PKA1_SIA3_SS1_SU16_SUM0_SUS256_SPO0_SRVW0_SSO0_SVW4_SK0_SKFTR0_SKXCCM0_TLDS0_ULSGRO0_USL1_UIOFGRO0_USFGROn1_VSn1_VWA4_VWB2_WSGRA0_WSGRB0_WS64_WG32_8_1_WGM8_WGMXCC8_WGMXCCGn1
    SolutionIndex: 20
    SolutionNameMin: Cijk_Ailk_Bjlk_I8IS_BH_Bias_S_FDMN_SPB_A_S_SAV_MT128x128x128_MI16x16x1_SN_LDSB1_AFC1_AG0_AFEM1_AFEM1_ASEM8_CLR1_CADS0_DTLA0_DTLB0_DTVA0_DTVB0_EPS1_FDSI0_GRPM1_GRVWA16_GRVWB16_GSUn1_GSUAMB_GSUC1_GSUWGMRR1_GLS0_ISA942_IU1_K1_LDSTI0_LBSPPA2048_LBSPPB2048_LBSPPM0_LPA64_LPB32_LPM0_LRVW16_LWPMn1_MIAV0_MIWT4_4_MO40_NTn1_NTA0_NTB0_NTC0_NTD4_NTM0_NEPBS16_NLCA1_NLCB1_ONLL1_PGR2_PLR1_PKA1_SIA3_SS1_SU16_SUM0_SUS256_SPO0_SRVW0_SSO0_SVW4_SK0_SKFTR0_SKXCCM0_TLDS0_ULSGRO0_USL1_UIOFGRO0_USFGROn1_VSn1_VWA4_VWB2_WSGRA0_WSGRB0_WS64_WG32_8_1_WGM8_WGMXCC8_WGMXCCGn1
    SolutionIndex: 21
    SolutionNameMin: Cijk_Ailk_Bjlk_I8IS_BH_Bias_S_FDMN_SPB_A_S_SAV_MT96x384x64_MI16x16x1_SN_LDSB0_AFC1_AG0_AFEM1_AFEM1_ASEM8_CLR0_CADS0_DTLA0_DTLB0_DTVA0_DTVB0_EPS1_FDSI0_GRPM1_GRVWA4_GRVWB16_GSUn1_GSUAMB_GSUC1_GSUWGMRR1_GLS0_ISA942_IU1_K1_LDSTI0_LBSPPA1536_LBSPPB6144_LBSPPM0_LPA32_LPB32_LPM0_LRVW16_LWPMn1_MIAV0_MIWT6_6_MO40_NTn1_NTA0_NTB0_NTC0_NTD4_NTM0_NEPBS0_NLCA3_NLCB3_ONLL1_PGR2_PLR0_PKA1_SIA3_SS1_SU16_SUM0_SUS256_SPO0_SRVW0_SSO0_SVW2_SK0_SKFTR0_SKXCCM0_TLDS0_ULSGRO0_USL1_UIOFGRO0_USFGROn1_VSn1_VWA2_VWB2_WSGRA0_WSGRB0_WS64_WG16_16_1_WGM8_WGMXCC8_WGMXCCGn1
    SolutionIndex: 22
    SolutionNameMin: Cijk_Ailk_Bjlk_I8IS_BH_Bias_S_FDMN_SPB_A_S_SAV_MT64x32x128_MI16x16x1_SN_LDSB0_AFC1_AG0_AFEM1_AFEM1_ASEM8_CLR1_CADS0_DTLA0_DTLB0_DTVA0_DTVB0_EPS1_FDSI0_GRPM1_GRVWA16_GRVWB8_GSUn1_GSUAMB_GSUC1_GSUWGMRR1_GLS0_ISA942_IU1_K1_LDSTI0_LBSPPA1024_LBSPPB512_LBSPPM0_LPA32_LPB16_LPM0_LRVW16_LWPMn1_MIAV0_MIWT2_1_MO40_NTn1_NTA0_NTB0_NTC0_NTD4_NTM0_NEPBS16_NLCA1_NLCB1_ONLL1_PGR2_PLR1_PKA1_SIA3_SS1_SU16_SUM0_SUS256_SPO0_SRVW0_SSO0_SVW2_SK0_SKFTR0_SKXCCM0_TLDS0_ULSGRO0_USL1_UIOFGRO0_USFGROn1_VSn1_VWA2_VWB1_WSGRA0_WSGRB0_WS64_WG32_8_1_WGM8_WGMXCC8_WGMXCCGn1
    SolutionIndex: 23
    SolutionNameMin: Cijk_Ailk_Bjlk_I8IS_BH_Bias_S_FDMN_SPB_A_S_SAV_MT256x256x64_MI16x16x1_SN_LDSB0_AFC1_AG0_AFEM1_AFEM1_ASEM8_CLR0_CADS0_DTLA0_DTLB0_DTVA0_DTVB0_EPS1_FDSI0_GRPM1_GRVWA16_GRVWB8_GSUn1_GSUAMB_GSUC1_GSUWGMRR1_GLS0_ISA942_IU1_K1_LDSTI0_LBSPPA4096_LBSPPB4096_LBSPPM0_LPA64_LPB64_LPM0_LRVW16_LWPMn1_MIAV0_MIWT4_16_MO40_NTn1_NTA0_NTB0_NTC0_NTD4_NTM0_NEPBS0_NLCA1_NLCB1_ONLL1_PGR2_PLR0_PKA1_SIA3_SS1_SU16_SUM0_SUS256_SPO0_SRVW0_SSO0_SVW4_SK0_SKFTR0_SKXCCM0_TLDS0_ULSGRO0_USL1_UIOFGRO0_USFGROn1_VSn1_VWA4_VWB4_WSGRA0_WSGRB0_WS64_WG64_4_1_WGM8_WGMXCC8_WGMXCCGn1
    SolutionIndex: 24
    SolutionNameMin: Cijk_Ailk_Bjlk_I8IS_BH_Bias_S_FDMN_SPB_A_S_SAV_MT256x256x64_MI16x16x1_SN_LDSB0_AFC1_AG0_AFEM1_AFEM1_ASEM8_CLR0_CADS0_DTLA0_DTLB0_DTVA0_DTVB0_EPS1_FDSI0_GRPM1_GRVWA4_GRVWB16_GSUn1_GSUAMB_GSUC1_GSUWGMRR1_GLS0_ISA942_IU1_K1_LDSTI0_LBSPPA4096_LBSPPB4096_LBSPPM0_LPA64_LPB64_LPM0_LRVW16_LWPMn1_MIAV0_MIWT4_16_MO40_NTn1_NTA0_NTB0_NTC0_NTD4_NTM0_NEPBS0_NLCA1_NLCB1_ONLL1_PGR2_PLR0_PKA1_SIA3_SS1_SU16_SUM0_SUS256_SPO0_SRVW0_SSO0_SVW4_SK0_SKFTR0_SKXCCM0_TLDS0_ULSGRO0_USL1_UIOFGRO0_USFGROn1_VSn1_VWA4_VWB4_WSGRA0_WSGRB0_WS64_WG64_4_1_WGM8_WGMXCC8_WGMXCCGn1
    SolutionIndex: 25
    SolutionNameMin: Cijk_Ailk_Bjlk_I8IS_BH_Bias_S_FDMN_SPB_A_S_SAV_MT128x256x128_MI16x16x1_SN_LDSB1_AFC1_AG0_AFEM1_AFEM1_ASEM8_CLR1_CADS0_DTLA0_DTLB0_DTVA0_DTVB0_EPS1_FDSI0_GRPM1_GRVWA16_GRVWB16_GSUn1_GSUAMB_GSUC1_GSUWGMRR1_GLS0_ISA942_IU1_K1_LDSTI0_LBSPPA2048_LBSPPB4096_LBSPPM0_LPA64_LPB32_LPM0_LRVW16_LWPMn1_MIAV0_MIWT4_8_MO40_NTn1_NTA0_NTB0_NTC0_NTD4_NTM0_NEPBS0_NLCA1_NLCB1_ONLL1_PGR2_PLR1_PKA1_SIA3_SS1_SU16_SUM0_SUS256_SPO0_SRVW0_SSO0_SVW4_SK0_SKFTR0_SKXCCM0_TLDS0_ULSGRO0_USL1_UIOFGRO0_USFGROn1_VSn1_VWA4_VWB2_WSGRA0_WSGRB0_WS64_WG32_8_1_WGM8_WGMXCC8_WGMXCCGn1
    SolutionIndex: 26
    SolutionNameMin: Cijk_Ailk_Bjlk_I8IS_BH_Bias_S_FDMN_SPB_A_S_SAV_MT256x192x128_MI16x16x1_SN_LDSB1_AFC1_AG0_AFEM1_AFEM1_ASEM8_CLR1_CADS0_DTLA0_DTLB0_DTVA0_DTVB0_EPS1_FDSI0_GRPM1_GRVWA16_GRVWB8_GSUn1_GSUAMB_GSUC1_GSUWGMRR1_GLS0_ISA942_IU1_K1_LDSTI0_LBSPPA4096_LBSPPB3072_LBSPPM0_LPA0_LPB32_LPM0_LRVW16_LWPMn1_MIAV0_MIWT8_6_MO40_NTn1_NTA0_NTB0_NTC0_NTD4_NTM0_NEPBS0_NLCA1_NLCB3_ONLL1_PGR2_PLR1_PKA1_SIA3_SS1_SU16_SUM0_SUS256_SPO0_SRVW0_SSO0_SVW8_SK0_SKFTR0_SKXCCM0_TLDS0_ULSGRO0_USL1_UIOFGRO0_USFGROn1_VSn1_VWA8_VWB2_WSGRA0_WSGRB0_WS64_WG32_8_1_WGM8_WGMXCC8_WGMXCCGn1
    SolutionIndex: 27
    SolutionNameMin: Cijk_Ailk_Bjlk_I8IS_BH_Bias_S_FDMN_SPB_A_S_SAV_MT192x256x64_MI16x16x1_SN_LDSB0_AFC1_AG0_AFEM1_AFEM1_ASEM8_CLR0_CADS0_DTLA0_DTLB0_DTVA0_DTVB0_EPS1_FDSI0_GRPM1_GRVWA4_GRVWB16_GSUn1_GSUAMB_GSUC1_GSUWGMRR1_GLS0_ISA942_IU1_K1_LDSTI0_LBSPPA3072_LBSPPB4096_LBSPPM0_LPA64_LPB32_LPM0_LRVW16_LWPMn1_MIAV0_MIWT12_4_MO40_NTn1_NTA0_NTB0_NTC0_NTD4_NTM0_NEPBS0_NLCA3_NLCB1_ONLL1_PGR2_PLR0_PKA1_SIA3_SS1_SU16_SUM0_SUS256_SPO0_SRVW0_SSO0_SVW4_SK0_SKFTR0_SKXCCM0_TLDS0_ULSGRO0_USL1_UIOFGRO0_USFGROn1_VSn1_VWA4_VWB2_WSGRA0_WSGRB0_WS64_WG16_16_1_WGM8_WGMXCC8_WGMXCCGn1
    SolutionIndex: 28
    SolutionNameMin: Cijk_Ailk_Bjlk_I8IS_BH_Bias_S_FDMN_SPB_A_S_SAV_MT256x192x128_MI16x16x1_SN_LDSB1_AFC1_AG0_AFEM1_AFEM1_ASEM8_CLR1_CADS0_DTLA0_DTLB0_DTVA0_DTVB0_EPS1_FDSI0_GRPM1_GRVWA16_GRVWB16_GSUn1_GSUAMB_GSUC1_GSUWGMRR1_GLS0_ISA942_IU1_K1_LDSTI0_LBSPPA4096_LBSPPB3072_LBSPPM0_LPA0_LPB32_LPM0_LRVW16_LWPMn1_MIAV0_MIWT8_6_MO40_NTn1_NTA0_NTB0_NTC0_NTD4_NTM0_NEPBS0_NLCA1_NLCB3_ONLL1_PGR2_PLR1_PKA1_SIA3_SS1_SU16_SUM0_SUS256_SPO0_SRVW0_SSO0_SVW8_SK0_SKFTR0_SKXCCM0_TLDS0_ULSGRO0_USL1_UIOFGRO0_USFGROn1_VSn1_VWA8_VWB2_WSGRA0_WSGRB0_WS64_WG32_8_1_WGM8_WGMXCC8_WGMXCCGn1
    SolutionIndex: 29
    SolutionNameMin: Cijk_Ailk_Bjlk_I8IS_BH_Bias_S_FDMN_SPB_A_S_SAV_MT384x128x64_MI16x16x1_SN_LDSB0_AFC1_AG0_AFEM1_AFEM1_ASEM8_CLR0_CADS0_DTLA0_DTLB0_DTVA0_DTVB0_EPS1_FDSI0_GRPM1_GRVWA16_GRVWB8_GSUn1_GSUAMB_GSUC1_GSUWGMRR1_GLS0_ISA942_IU1_K1_LDSTI0_LBSPPA6144_LBSPPB2048_LBSPPM0_LPA32_LPB32_LPM0_LRVW16_LWPMn1_MIAV0_MIWT6_8_MO40_NTn1_NTA0_NTB0_NTC0_NTD4_NTM0_NEPBS0_NLCA3_NLCB1_ONLL1_PGR2_PLR0_PKA1_SIA3_SS1_SU16_SUM0_SUS256_SPO0_SRVW0_SSO0_SVW2_SK0_SKFTR0_SKXCCM0_TLDS0_ULSGRO0_USL1_UIOFGRO0_USFGROn1_VSn1_VWA2_VWB2_WSGRA0_WSGRB0_WS64_WG64_4_1_WGM8_WGMXCC8_WGMXCCGn1
    SolutionIndex: 30
    SolutionNameMin: Cijk_Ailk_Bjlk_I8IS_BH_Bias_S_FDMN_SPB_A_S_SAV_MT192x256x64_MI16x16x1_SN_LDSB0_AFC1_AG0_AFEM1_AFEM1_ASEM8_CLR0_CADS0_DTLA0_DTLB0_DTVA0_DTVB0_EPS1_FDSI0_GRPM1_GRVWA16_GRVWB8_GSUn1_GSUAMB_GSUC1_GSUWGMRR1_GLS0_ISA942_IU1_K1_LDSTI0_LBSPPA3072_LBSPPB4096_LBSPPM0_LPA64_LPB32_LPM0_LRVW16_LWPMn1_MIAV0_MIWT12_4_MO40_NTn1_NTA0_NTB0_NTC0_NTD4_NTM0_NEPBS0_NLCA3_NLCB1_ONLL1_PGR2_PLR0_PKA1_SIA3_SS1_SU16_SUM0_SUS256_SPO0_SRVW0_SSO0_SVW4_SK0_SKFTR0_SKXCCM0_TLDS0_ULSGRO0_USL1_UIOFGRO0_USFGROn1_VSn1_VWA4_VWB2_WSGRA0_WSGRB0_WS64_WG16_16_1_WGM8_WGMXCC8_WGMXCCGn1
    SolutionIndex: 31
    SolutionNameMin: Cijk_Ailk_Bjlk_I8IS_BH_Bias_S_FDMN_SPB_A_S_SAV_MT192x256x64_MI16x16x1_SN_LDSB0_AFC1_AG0_AFEM1_AFEM1_ASEM8_CLR0_CADS0_DTLA0_DTLB0_DTVA0_DTVB0_EPS1_FDSI0_GRPM1_GRVWA4_GRVWB16_GSUn1_GSUAMB_GSUC1_GSUWGMRR1_GLS0_ISA942_IU1_K1_LDSTI0_LBSPPA3072_LBSPPB4096_LBSPPM0_LPA32_LPB32_LPM0_LRVW16_LWPMn1_MIAV0_MIWT6_8_MO40_NTn1_NTA0_NTB0_NTC0_NTD4_NTM0_NEPBS0_NLCA3_NLCB1_ONLL1_PGR2_PLR0_PKA1_SIA3_SS1_SU16_SUM0_SUS256_SPO0_SRVW0_SSO0_SVW2_SK0_SKFTR0_SKXCCM0_TLDS0_ULSGRO0_USL1_UIOFGRO0_USFGROn1_VSn1_VWA2_VWB2_WSGRA0_WSGRB0_WS64_WG32_8_1_WGM8_WGMXCC8_WGMXCCGn1
    SolutionIndex: 32
    SolutionNameMin: Cijk_Ailk_Bjlk_I8IS_BH_Bias_S_FDMN_SPB_A_S_SAV_MT192x256x64_MI16x16x1_SN_LDSB0_AFC1_AG0_AFEM1_AFEM1_ASEM8_CLR0_CADS0_DTLA0_DTLB0_DTVA0_DTVB0_EPS1_FDSI0_GRPM1_GRVWA16_GRVWB8_GSUn1_GSUAMB_GSUC1_GSUWGMRR1_GLS0_ISA942_IU1_K1_LDSTI0_LBSPPA3072_LBSPPB4096_LBSPPM0_LPA16_LPB64_LPM0_LRVW16_LWPMn1_MIAV0_MIWT3_16_MO40_NTn1_NTA0_NTB0_NTC0_NTD4_NTM0_NEPBS0_NLCA3_NLCB1_ONLL1_PGR2_PLR0_PKA1_SIA3_SS1_SU16_SUM0_SUS256_SPO0_SRVW0_SSO0_SVW1_SK0_SKFTR0_SKXCCM0_TLDS0_ULSGRO0_USL1_UIOFGRO0_USFGROn1_VSn1_VWA1_VWB4_WSGRA0_WSGRB0_WS64_WG64_4_1_WGM8_WGMXCC8_WGMXCCGn1
    SolutionIndex: 33
    SolutionNameMin: Cijk_Ailk_Bjlk_I8IS_BH_Bias_S_FDMN_SPB_A_S_SAV_MT192x256x64_MI16x16x1_SN_LDSB0_AFC1_AG0_AFEM1_AFEM1_ASEM8_CLR0_CADS0_DTLA0_DTLB0_DTVA0_DTVB0_EPS1_FDSI0_GRPM1_GRVWA16_GRVWB16_GSUn1_GSUAMB_GSUC1_GSUWGMRR1_GLS0_ISA942_IU1_K1_LDSTI0_LBSPPA3072_LBSPPB4096_LBSPPM0_LPA64_LPB32_LPM0_LRVW16_LWPMn1_MIAV0_MIWT12_4_MO40_NTn1_NTA0_NTB0_NTC0_NTD4_NTM0_NEPBS0_NLCA3_NLCB1_ONLL1_PGR2_PLR0_PKA1_SIA3_SS1_SU16_SUM0_SUS256_SPO0_SRVW0_SSO0_SVW4_SK0_SKFTR0_SKXCCM0_TLDS0_ULSGRO0_USL1_UIOFGRO0_USFGROn1_VSn1_VWA4_VWB2_WSGRA0_WSGRB0_WS64_WG16_16_1_WGM8_WGMXCC8_WGMXCCGn1
    SolutionIndex: 34
    SolutionNameMin: Cijk_Ailk_Bjlk_I8IS_BH_Bias_S_FDMN_SPB_A_S_SAV_MT192x256x64_MI16x16x1_SN_LDSB0_AFC1_AG0_AFEM1_AFEM1_ASEM8_CLR0_CADS0_DTLA0_DTLB0_DTVA0_DTVB0_EPS1_FDSI0_GRPM1_GRVWA16_GRVWB16_GSUn1_GSUAMB_GSUC1_GSUWGMRR1_GLS0_ISA942_IU1_K1_LDSTI0_LBSPPA3072_LBSPPB4096_LBSPPM0_LPA32_LPB32_LPM0_LRVW16_LWPMn1_MIAV0_MIWT6_8_MO40_NTn1_NTA0_NTB0_NTC0_NTD4_NTM0_NEPBS0_NLCA3_NLCB1_ONLL1_PGR2_PLR0_PKA1_SIA3_SS1_SU16_SUM0_SUS256_SPO0_SRVW0_SSO0_SVW2_SK0_SKFTR0_SKXCCM0_TLDS0_ULSGRO0_USL1_UIOFGRO0_USFGROn1_VSn1_VWA2_VWB2_WSGRA0_WSGRB0_WS64_WG32_8_1_WGM8_WGMXCC8_WGMXCCGn1
    SolutionIndex: 35
    SolutionNameMin: Cijk_Ailk_Bjlk_I8IS_BH_Bias_S_FDMN_SPB_A_S_SAV_MT128x384x128_MI16x16x1_SN_LDSB1_AFC1_AG0_AFEM1_AFEM1_ASEM8_CLR1_CADS0_DTLA0_DTLB0_DTVA0_DTVB0_EPS1_FDSI0_GRPM1_GRVWA16_GRVWB8_GSUn1_GSUAMB_GSUC1_GSUWGMRR1_GLS0_ISA942_IU1_K1_LDSTI0_LBSPPA2048_LBSPPB6144_LBSPPM0_LPA0_LPB32_LPM0_LRVW16_LWPMn1_MIAV0_MIWT8_6_MO40_NTn1_NTA0_NTB0_NTC0_NTD4_NTM0_NEPBS0_NLCA1_NLCB3_ONLL1_PGR2_PLR1_PKA1_SIA3_SS1_SU16_SUM0_SUS256_SPO0_SRVW0_SSO0_SVW8_SK0_SKFTR0_SKXCCM0_TLDS0_ULSGRO0_USL1_UIOFGRO0_USFGROn1_VSn1_VWA8_VWB2_WSGRA0_WSGRB0_WS64_WG16_16_1_WGM8_WGMXCC8_WGMXCCGn1
    SolutionIndex: 36
    SolutionNameMin: Cijk_Ailk_Bjlk_I8IS_BH_Bias_S_FDMN_SPB_A_S_SAV_MT16x384x128_MI16x16x1_SN_LDSB1_AFC1_AG0_AFEM1_AFEM1_ASEM8_CLR1_CADS0_DTLA0_DTLB0_DTVA0_DTVB0_EPS1_FDSI0_GRPM1_GRVWA4_GRVWB16_GSUn1_GSUAMB_GSUC1_GSUWGMRR1_GLS0_ISA942_IU1_K1_LDSTI0_LBSPPA256_LBSPPB6144_LBSPPM0_LPA16_LPB32_LPM0_LRVW16_LWPMn1_MIAV0_MIWT1_6_MO40_NTn1_NTA0_NTB0_NTC0_NTD4_NTM0_NEPBS0_NLCA1_NLCB3_ONLL1_PGR2_PLR1_PKA1_SIA3_SS1_SU16_SUM0_SUS256_SPO0_SRVW0_SSO0_SVW1_SK0_SKFTR0_SKXCCM0_TLDS0_ULSGRO0_USL1_UIOFGRO0_USFGROn1_VSn1_VWA1_VWB2_WSGRA0_WSGRB0_WS64_WG16_16_1_WGM8_WGMXCC8_WGMXCCGn1
    SolutionIndex: 37
    SolutionNameMin: Cijk_Ailk_Bjlk_I8IS_BH_Bias_S_FDMN_SPB_A_S_SAV_MT32x384x128_MI16x16x1_SN_LDSB1_AFC1_AG0_AFEM1_AFEM1_ASEM8_CLR1_CADS0_DTLA0_DTLB0_DTVA0_DTVB0_EPS1_FDSI0_GRPM1_GRVWA4_GRVWB16_GSUn1_GSUAMB_GSUC1_GSUWGMRR1_GLS0_ISA942_IU1_K1_LDSTI0_LBSPPA512_LBSPPB6144_LBSPPM0_LPA32_LPB32_LPM0_LRVW16_LWPMn1_MIAV0_MIWT2_6_MO40_NTn1_NTA0_NTB0_NTC0_NTD4_NTM0_NEPBS0_NLCA1_NLCB3_ONLL1_PGR2_PLR1_PKA1_SIA3_SS1_SU16_SUM0_SUS256_SPO0_SRVW0_SSO0_SVW2_SK0_SKFTR0_SKXCCM0_TLDS0_ULSGRO0_USL1_UIOFGRO0_USFGROn1_VSn1_VWA2_VWB2_WSGRA0_WSGRB0_WS64_WG16_16_1_WGM8_WGMXCC8_WGMXCCGn1
    SolutionIndex: 38
    SolutionNameMin: Cijk_Ailk_Bjlk_I8IS_BH_Bias_S_FDMN_SPB_A_S_SAV_MT48x128x128_MI16x16x1_SN_LDSB1_AFC1_AG0_AFEM1_AFEM1_ASEM8_CLR1_CADS0_DTLA0_DTLB0_DTVA0_DTVB0_EPS1_FDSI0_GRPM1_GRVWA4_GRVWB16_GSUn1_GSUAMB_GSUC1_GSUWGMRR1_GLS0_ISA942_IU1_K1_LDSTI0_LBSPPA768_LBSPPB2048_LBSPPM0_LPA16_LPB32_LPM0_LRVW16_LWPMn1_MIAV0_MIWT3_2_MO40_NTn1_NTA0_NTB0_NTC0_NTD4_NTM0_NEPBS16_NLCA3_NLCB1_ONLL1_PGR2_PLR1_PKA1_SIA3_SS1_SU16_SUM0_SUS256_SPO0_SRVW0_SSO0_SVW1_SK0_SKFTR0_SKXCCM0_TLDS0_ULSGRO0_USL1_UIOFGRO0_USFGROn1_VSn1_VWA1_VWB2_WSGRA0_WSGRB0_WS64_WG16_16_1_WGM8_WGMXCC8_WGMXCCGn1
    SolutionIndex: 39
    SolutionNameMin: Cijk_Ailk_Bjlk_I8IS_BH_Bias_S_FDMN_SPB_A_S_SAV_MT16x256x256_MI16x16x1_SN_LDSB1_AFC1_AG0_AFEM1_AFEM1_ASEM8_CLR1_CADS0_DTLA0_DTLB0_DTVA0_DTVB0_EPS1_FDSI0_GRPM1_GRVWA4_GRVWB16_GSUn1_GSUAMB_GSUC1_GSUWGMRR1_GLS0_ISA942_IU1_K1_LDSTI0_LBSPPA256_LBSPPB4096_LBSPPM0_LPA16_LPB32_LPM0_LRVW16_LWPMn1_MIAV0_MIWT1_4_MO40_NTn1_NTA0_NTB0_NTC0_NTD4_NTM0_NEPBS0_NLCA1_NLCB1_ONLL1_PGR2_PLR1_PKA1_SIA3_SS1_SU16_SUM0_SUS256_SPO0_SRVW0_SSO0_SVW1_SK0_SKFTR0_SKXCCM0_TLDS0_ULSGRO0_USL1_UIOFGRO0_USFGROn1_VSn1_VWA1_VWB2_WSGRA0_WSGRB0_WS64_WG16_16_1_WGM8_WGMXCC8_WGMXCCGn1
    SolutionIndex: 40
    SolutionNameMin: Cijk_Ailk_Bjlk_I8IS_BH_Bias_S_FDMN_SPB_A_S_SAV_MT32x256x256_MI16x16x1_SN_LDSB1_AFC1_AG0_AFEM1_AFEM1_ASEM8_CLR1_CADS0_DTLA0_DTLB0_DTVA0_DTVB0_EPS1_FDSI0_GRPM1_GRVWA4_GRVWB16_GSUn1_GSUAMB_GSUC1_GSUWGMRR1_GLS0_ISA942_IU1_K1_LDSTI0_LBSPPA512_LBSPPB4096_LBSPPM0_LPA32_LPB32_LPM0_LRVW16_LWPMn1_MIAV0_MIWT2_4_MO40_NTn1_NTA0_NTB0_NTC0_NTD4_NTM0_NEPBS0_NLCA1_NLCB1_ONLL1_PGR2_PLR1_PKA1_SIA3_SS1_SU16_SUM0_SUS256_SPO0_SRVW0_SSO0_SVW2_SK0_SKFTR0_SKXCCM0_TLDS0_ULSGRO0_USL1_UIOFGRO0_USFGROn1_VSn1_VWA2_VWB2_WSGRA0_WSGRB0_WS64_WG16_16_1_WGM8_WGMXCC8_WGMXCCGn1
    SolutionIndex: 41
    SolutionNameMin: Cijk_Ailk_Bjlk_I8IS_BH_Bias_S_FDMN_SPB_A_S_SAV_MT256x256x64_MI16x16x1_SN_LDSB0_AFC1_AG0_AFEM1_AFEM1_ASEM8_CLR0_CADS0_DTLA0_DTLB0_DTVA0_DTVB0_EPS1_FDSI0_GRPM1_GRVWA4_GRVWB8_GSUn1_GSUAMB_GSUC1_GSUWGMRR1_GLS0_ISA942_IU1_K1_LDSTI0_LBSPPA4096_LBSPPB4096_LBSPPM0_LPA64_LPB64_LPM0_LRVW16_LWPMn1_MIAV0_MIWT4_16_MO40_NTn1_NTA0_NTB0_NTC0_NTD4_NTM0_NEPBS0_NLCA1_NLCB1_ONLL1_PGR2_PLR0_PKA1_SIA3_SS1_SU16_SUM0_SUS256_SPO0_SRVW0_SSO0_SVW4_SK0_SKFTR0_SKXCCM0_TLDS0_ULSGRO0_USL1_UIOFGRO0_USFGROn1_VSn1_VWA4_VWB4_WSGRA0_WSGRB0_WS64_WG64_4_1_WGM8_WGMXCC8_WGMXCCGn1
    SolutionIndex: 42
    SolutionNameMin: Cijk_Ailk_Bjlk_I8IS_BH_Bias_S_FDMN_SPB_A_S_SAV_MT96x512x64_MI16x16x1_SN_LDSB0_AFC1_AG0_AFEM1_AFEM1_ASEM8_CLR0_CADS0_DTLA0_DTLB0_DTVA0_DTVB0_EPS1_FDSI0_GRPM1_GRVWA4_GRVWB16_GSUn1_GSUAMB_GSUC1_GSUWGMRR1_GLS0_ISA942_IU1_K1_LDSTI0_LBSPPA1536_LBSPPB8192_LBSPPM0_LPA16_LPB64_LPM0_LRVW16_LWPMn1_MIAV0_MIWT3_16_MO40_NTn1_NTA0_NTB0_NTC0_NTD4_NTM0_NEPBS0_NLCA3_NLCB1_ONLL1_PGR2_PLR0_PKA1_SIA3_SS1_SU16_SUM0_SUS256_SPO0_SRVW0_SSO0_SVW1_SK0_SKFTR0_SKXCCM0_TLDS0_ULSGRO0_USL1_UIOFGRO0_USFGROn1_VSn1_VWA1_VWB4_WSGRA0_WSGRB0_WS64_WG32_8_1_WGM8_WGMXCC8_WGMXCCGn1
    SolutionIndex: 43
    SolutionNameMin: Cijk_Ailk_Bjlk_I8IS_BH_Bias_S_FDMN_SPB_A_S_SAV_MT320x192x64_MI16x16x1_SN_LDSB0_AFC1_AG0_AFEM1_AFEM1_ASEM8_CLR0_CADS0_DTLA0_DTLB0_DTVA0_DTVB0_EPS1_FDSI0_GRPM1_GRVWA4_GRVWB8_GSUn1_GSUAMB_GSUC1_GSUWGMRR1_GLS0_ISA942_IU1_K1_LDSTI0_LBSPPA5120_LBSPPB3072_LBSPPM0_LPA32_LPB32_LPM0_LRVW16_LWPMn1_MIAV0_MIWT10_6_MO40_NTn1_NTA0_NTB0_NTC0_NTD4_NTM0_NEPBS0_NLCA5_NLCB3_ONLL1_PGR2_PLR0_PKA1_SIA3_SS1_SU16_SUM0_SUS256_SPO0_SRVW0_SSO0_SVW2_SK0_SKFTR0_SKXCCM0_TLDS0_ULSGRO0_USL1_UIOFGRO0_USFGROn1_VSn1_VWA2_VWB2_WSGRA0_WSGRB0_WS64_WG32_8_1_WGM8_WGMXCC8_WGMXCCGn1
    SolutionIndex: 44
    SolutionNameMin: Cijk_Ailk_Bjlk_I8IS_BH_Bias_S_FDMN_SPB_A_S_SAV_MT512x128x64_MI16x16x1_SN_LDSB1_AFC1_AG0_AFEM1_AFEM1_ASEM8_CLR0_CADS0_DTLA0_DTLB0_DTVA0_DTVB0_EPS1_FDSI0_GRPM1_GRVWA16_GRVWB8_GSUn1_GSUAMB_GSUC1_GSUWGMRR1_GLS0_ISA942_IU1_K1_LDSTI0_LBSPPA8192_LBSPPB2048_LBSPPM0_LPA0_LPB32_LPM0_LRVW16_LWPMn1_MIAV0_MIWT8_8_MO40_NTn1_NTA0_NTB0_NTC0_NTD4_NTM0_NEPBS0_NLCA1_NLCB1_ONLL1_PGR2_PLR0_PKA1_SIA3_SS1_SU16_SUM0_SUS256_SPO0_SRVW0_SSO0_SVW8_SK0_SKFTR0_SKXCCM0_TLDS0_ULSGRO0_USL1_UIOFGRO0_USFGROn1_VSn1_VWA8_VWB2_WSGRA0_WSGRB0_WS64_WG64_4_1_WGM8_WGMXCC8_WGMXCCGn1
    SolutionIndex: 45
    SolutionNameMin: Cijk_Ailk_Bjlk_I8IS_BH_Bias_S_FDMN_SPB_A_S_SAV_MT320x192x64_MI16x16x1_SN_LDSB0_AFC1_AG0_AFEM1_AFEM1_ASEM8_CLR0_CADS0_DTLA0_DTLB0_DTVA0_DTVB0_EPS1_FDSI0_GRPM1_GRVWA16_GRVWB8_GSUn1_GSUAMB_GSUC1_GSUWGMRR1_GLS0_ISA942_IU1_K1_LDSTI0_LBSPPA5120_LBSPPB3072_LBSPPM0_LPA32_LPB32_LPM0_LRVW16_LWPMn1_MIAV0_MIWT10_6_MO40_NTn1_NTA0_NTB0_NTC0_NTD4_NTM0_NEPBS0_NLCA5_NLCB3_ONLL1_PGR2_PLR0_PKA1_SIA3_SS1_SU16_SUM0_SUS256_SPO0_SRVW0_SSO0_SVW2_SK0_SKFTR0_SKXCCM0_TLDS0_ULSGRO0_USL1_UIOFGRO0_USFGROn1_VSn1_VWA2_VWB2_WSGRA0_WSGRB0_WS64_WG32_8_1_WGM8_WGMXCC8_WGMXCCGn1
    SolutionIndex: 46
    SolutionNameMin: Cijk_Ailk_Bjlk_I8IS_BH_Bias_S_FDMN_SPB_A_S_SAV_MT192x256x64_MI16x16x1_SN_LDSB0_AFC1_AG0_AFEM1_AFEM1_ASEM8_CLR0_CADS0_DTLA0_DTLB0_DTVA0_DTVB0_EPS1_FDSI0_GRPM1_GRVWA4_GRVWB8_GSUn1_GSUAMB_GSUC1_GSUWGMRR1_GLS0_ISA942_IU1_K1_LDSTI0_LBSPPA3072_LBSPPB4096_LBSPPM0_LPA64_LPB32_LPM0_LRVW16_LWPMn1_MIAV0_MIWT12_4_MO40_NTn1_NTA0_NTB0_NTC0_NTD4_NTM0_NEPBS0_NLCA3_NLCB1_ONLL1_PGR2_PLR0_PKA1_SIA3_SS1_SU16_SUM0_SUS256_SPO0_SRVW0_SSO0_SVW4_SK0_SKFTR0_SKXCCM0_TLDS0_ULSGRO0_USL1_UIOFGRO0_USFGROn1_VSn1_VWA4_VWB2_WSGRA0_WSGRB0_WS64_WG16_16_1_WGM8_WGMXCC8_WGMXCCGn1
    SolutionIndex: 47
    SolutionNameMin: Cijk_Ailk_Bjlk_I8IS_BH_Bias_S_FDMN_SPB_A_S_SAV_MT192x192x64_MI16x16x1_SN_LDSB0_AFC1_AG0_AFEM1_AFEM1_ASEM8_CLR0_CADS0_DTLA0_DTLB0_DTVA0_DTVB0_EPS1_FDSI0_GRPM1_GRVWA16_GRVWB8_GSUn1_GSUAMB_GSUC1_GSUWGMRR1_GLS0_ISA942_IU1_K1_LDSTI0_LBSPPA3072_LBSPPB3072_LBSPPM0_LPA32_LPB32_LPM0_LRVW16_LWPMn1_MIAV0_MIWT6_6_MO40_NTn1_NTA0_NTB0_NTC0_NTD4_NTM0_NEPBS0_NLCA3_NLCB3_ONLL1_PGR2_PLR0_PKA1_SIA3_SS1_SU16_SUM0_SUS256_SPO0_SRVW0_SSO0_SVW2_SK0_SKFTR0_SKXCCM0_TLDS0_ULSGRO0_USL1_UIOFGRO0_USFGROn1_VSn1_VWA2_VWB2_WSGRA0_WSGRB0_WS64_WG32_8_1_WGM8_WGMXCC8_WGMXCCGn1
    SolutionIndex: 48
    SolutionNameMin: Cijk_Ailk_Bjlk_I8IS_BH_Bias_S_FDMN_SPB_A_S_SAV_MT112x384x64_MI16x16x1_SN_LDSB0_AFC1_AG0_AFEM1_AFEM1_ASEM8_CLR0_CADS0_DTLA0_DTLB0_DTVA0_DTVB0_EPS1_FDSI0_GRPM1_GRVWA4_GRVWB16_GSUn1_GSUAMB_GSUC1_GSUWGMRR1_GLS0_ISA942_IU1_K1_LDSTI0_LBSPPA1792_LBSPPB6144_LBSPPM0_LPA16_LPB32_LPM0_LRVW16_LWPMn1_MIAV0_MIWT7_6_MO40_NTn1_NTA0_NTB0_NTC0_NTD4_NTM0_NEPBS0_NLCA7_NLCB3_ONLL1_PGR2_PLR0_PKA1_SIA3_SS1_SU16_SUM0_SUS256_SPO0_SRVW0_SSO0_SVW1_SK0_SKFTR0_SKXCCM0_TLDS0_ULSGRO0_USL1_UIOFGRO0_USFGROn1_VSn1_VWA1_VWB2_WSGRA0_WSGRB0_WS64_WG16_16_1_WGM8_WGMXCC8_WGMXCCGn1
    SolutionIndex: 49
    SolutionNameMin: Cijk_Ailk_Bjlk_I8IS_BH_Bias_S_FDMN_SPB_A_S_SAV_MT32x128x256_MI16x16x1_SN_LDSB1_AFC1_AG0_AFEM1_AFEM1_ASEM8_CLR1_CADS0_DTLA0_DTLB0_DTVA0_DTVB0_EPS1_FDSI0_GRPM1_GRVWA4_GRVWB16_GSUn1_GSUAMB_GSUC1_GSUWGMRR1_GLS0_ISA942_IU1_K1_LDSTI0_LBSPPA512_LBSPPB2048_LBSPPM0_LPA32_LPB32_LPM0_LRVW16_LWPMn1_MIAV0_MIWT2_2_MO40_NTn1_NTA0_NTB0_NTC0_NTD4_NTM0_NEPBS16_NLCA1_NLCB1_ONLL1_PGR2_PLR1_PKA1_SIA3_SS1_SU16_SUM0_SUS256_SPO0_SRVW0_SSO0_SVW2_SK0_SKFTR0_SKXCCM0_TLDS0_ULSGRO0_USL1_UIOFGRO0_USFGROn1_VSn1_VWA2_VWB2_WSGRA0_WSGRB0_WS64_WG16_16_1_WGM8_WGMXCC8_WGMXCCGn1
    SolutionIndex: 50
    SolutionNameMin: Cijk_Ailk_Bjlk_I8IS_BH_Bias_S_FDMN_SPB_A_S_SAV_MT16x256x256_MI16x16x1_SN_LDSB1_AFC1_AG0_AFEM1_AFEM1_ASEM8_CLR1_CADS0_DTLA0_DTLB0_DTVA0_DTVB0_EPS1_FDSI0_GRPM1_GRVWA16_GRVWB16_GSUn1_GSUAMB_GSUC1_GSUWGMRR1_GLS0_ISA942_IU1_K1_LDSTI0_LBSPPA256_LBSPPB4096_LBSPPM0_LPA16_LPB32_LPM0_LRVW16_LWPMn1_MIAV0_MIWT1_4_MO40_NTn1_NTA0_NTB0_NTC0_NTD4_NTM0_NEPBS0_NLCA1_NLCB1_ONLL1_PGR2_PLR1_PKA1_SIA3_SS1_SU16_SUM0_SUS256_SPO0_SRVW0_SSO0_SVW1_SK0_SKFTR0_SKXCCM0_TLDS0_ULSGRO0_USL1_UIOFGRO0_USFGROn1_VSn1_VWA1_VWB2_WSGRA0_WSGRB0_WS64_WG16_16_1_WGM8_WGMXCC8_WGMXCCGn1
    SolutionIndex: 51
    SolutionNameMin: Cijk_Ailk_Bjlk_I8IS_BH_Bias_S_FDMN_SPB_A_S_SAV_MT32x128x256_MI16x16x1_SN_LDSB1_AFC1_AG0_AFEM1_AFEM1_ASEM8_CLR1_CADS0_DTLA0_DTLB0_DTVA0_DTVB0_EPS1_FDSI0_GRPM1_GRVWA16_GRVWB16_GSUn1_GSUAMB_GSUC1_GSUWGMRR1_GLS0_ISA942_IU1_K1_LDSTI0_LBSPPA512_LBSPPB2048_LBSPPM0_LPA32_LPB32_LPM0_LRVW16_LWPMn1_MIAV0_MIWT2_2_MO40_NTn1_NTA0_NTB0_NTC0_NTD4_NTM0_NEPBS16_NLCA1_NLCB1_ONLL1_PGR2_PLR1_PKA1_SIA3_SS1_SU16_SUM0_SUS256_SPO0_SRVW0_SSO0_SVW2_SK0_SKFTR0_SKXCCM0_TLDS0_ULSGRO0_USL1_UIOFGRO0_USFGROn1_VSn1_VWA2_VWB2_WSGRA0_WSGRB0_WS64_WG16_16_1_WGM8_WGMXCC8_WGMXCCGn1
    SolutionIndex: 52
    SolutionNameMin: Cijk_Ailk_Bjlk_I8IS_BH_Bias_S_FDMN_SPB_A_S_SAV_MT32x128x128_MI16x16x1_SN_LDSB0_AFC1_AG0_AFEM1_AFEM1_ASEM8_CLR1_CADS0_DTLA0_DTLB0_DTVA0_DTVB0_EPS1_FDSI0_GRPM1_GRVWA16_GRVWB16_GSUn1_GSUAMB_GSUC1_GSUWGMRR1_GLS0_ISA942_IU1_K1_LDSTI0_LBSPPA512_LBSPPB2048_LBSPPM0_LPA32_LPB32_LPM0_LRVW16_LWPMn1_MIAV0_MIWT2_2_MO40_NTn1_NTA0_NTB0_NTC0_NTD4_NTM0_NEPBS16_NLCA1_NLCB1_ONLL1_PGR2_PLR1_PKA1_SIA3_SS1_SU16_SUM0_SUS256_SPO0_SRVW0_SSO0_SVW2_SK0_SKFTR0_SKXCCM0_TLDS0_ULSGRO0_USL1_UIOFGRO0_USFGROn1_VSn1_VWA2_VWB2_WSGRA0_WSGRB0_WS64_WG16_16_1_WGM8_WGMXCC8_WGMXCCGn1
    SolutionIndex: 53
    SolutionNameMin: Cijk_Ailk_Bjlk_I8IS_BH_Bias_S_FDMN_SPB_A_S_SAV_MT224x256x64_MI16x16x1_SN_LDSB0_AFC1_AG0_AFEM1_AFEM1_ASEM8_CLR0_CADS0_DTLA0_DTLB0_DTVA0_DTVB0_EPS1_FDSI0_GRPM1_GRVWA4_GRVWB8_GSUn1_GSUAMB_GSUC1_GSUWGMRR1_GLS0_ISA942_IU1_K1_LDSTI0_LBSPPA3584_LBSPPB4096_LBSPPM0_LPA16_LPB32_LPM0_LRVW16_LWPMn1_MIAV0_MIWT7_8_MO40_NTn1_NTA0_NTB0_NTC0_NTD4_NTM0_NEPBS0_NLCA7_NLCB1_ONLL1_PGR2_PLR0_PKA1_SIA3_SS1_SU16_SUM0_SUS256_SPO0_SRVW0_SSO0_SVW1_SK0_SKFTR0_SKXCCM0_TLDS0_ULSGRO0_USL1_UIOFGRO0_USFGROn1_VSn1_VWA1_VWB2_WSGRA0_WSGRB0_WS64_WG32_8_1_WGM8_WGMXCC8_WGMXCCGn1
    SolutionIndex: 54
    SolutionNameMin: Cijk_Ailk_Bjlk_I8IS_BH_Bias_S_FDMN_SPB_A_S_SAV_MT128x256x128_MI16x16x1_SN_LDSB1_AFC1_AG0_AFEM1_AFEM1_ASEM8_CLR1_CADS0_DTLA0_DTLB0_DTVA0_DTVB0_EPS1_FDSI0_GRPM1_GRVWA16_GRVWB16_GSUn1_GSUAMB_GSUC1_GSUWGMRR1_GLS0_ISA942_IU1_K1_LDSTI0_LBSPPA2048_LBSPPB4096_LBSPPM0_LPA0_LPB32_LPM0_LRVW16_LWPMn1_MIAV0_MIWT8_4_MO40_NTn1_NTA0_NTB0_NTC0_NTD4_NTM0_NEPBS0_NLCA1_NLCB1_ONLL1_PGR2_PLR1_PKA1_SIA3_SS1_SU16_SUM0_SUS256_SPO0_SRVW0_SSO0_SVW8_SK0_SKFTR0_SKXCCM0_TLDS0_ULSGRO0_USL1_UIOFGRO0_USFGROn1_VSn1_VWA8_VWB2_WSGRA0_WSGRB0_WS64_WG16_16_1_WGM8_WGMXCC8_WGMXCCGn1
    SolutionIndex: 55
    SolutionNameMin: Cijk_Ailk_Bjlk_I8IS_BH_Bias_S_FDMN_SPB_A_S_SAV_MT256x128x128_MI16x16x1_SN_LDSB1_AFC1_AG0_AFEM1_AFEM1_ASEM8_CLR1_CADS0_DTLA0_DTLB0_DTVA0_DTVB0_EPS1_FDSI0_GRPM1_GRVWA16_GRVWB16_GSUn1_GSUAMB_GSUC1_GSUWGMRR1_GLS0_ISA942_IU1_K1_LDSTI0_LBSPPA4096_LBSPPB2048_LBSPPM0_LPA0_LPB32_LPM0_LRVW16_LWPMn1_MIAV0_MIWT8_4_MO40_NTn1_NTA0_NTB0_NTC0_NTD4_NTM0_NEPBS0_NLCA1_NLCB1_ONLL1_PGR2_PLR1_PKA1_SIA3_SS1_SU16_SUM0_SUS256_SPO0_SRVW0_SSO0_SVW8_SK0_SKFTR0_SKXCCM0_TLDS0_ULSGRO0_USL1_UIOFGRO0_USFGROn1_VSn1_VWA8_VWB2_WSGRA0_WSGRB0_WS64_WG32_8_1_WGM8_WGMXCC8_WGMXCCGn1
    SolutionIndex: 56
    SolutionNameMin: Cijk_Ailk_Bjlk_I8IS_BH_Bias_S_FDMN_SPB_A_S_SAV_MT384x128x64_MI16x16x1_SN_LDSB0_AFC1_AG0_AFEM1_AFEM1_ASEM8_CLR0_CADS0_DTLA0_DTLB0_DTVA0_DTVB0_EPS1_FDSI0_GRPM1_GRVWA16_GRVWB16_GSUn1_GSUAMB_GSUC1_GSUWGMRR1_GLS0_ISA942_IU1_K1_LDSTI0_LBSPPA6144_LBSPPB2048_LBSPPM0_LPA64_LPB32_LPM0_LRVW16_LWPMn1_MIAV0_MIWT12_4_MO40_NTn1_NTA0_NTB0_NTC0_NTD4_NTM0_NEPBS0_NLCA3_NLCB1_ONLL1_PGR2_PLR0_PKA1_SIA3_SS1_SU16_SUM0_SUS256_SPO0_SRVW0_SSO0_SVW4_SK0_SKFTR0_SKXCCM0_TLDS0_ULSGRO0_USL1_UIOFGRO0_USFGROn1_VSn1_VWA4_VWB2_WSGRA0_WSGRB0_WS64_WG32_8_1_WGM8_WGMXCC8_WGMXCCGn1
    SolutionIndex: 57
    SolutionNameMin: Cijk_Ailk_Bjlk_I8IS_BH_Bias_S_FDMN_SPB_A_S_SAV_MT128x512x64_MI16x16x1_SN_LDSB0_AFC1_AG0_AFEM1_AFEM1_ASEM8_CLR0_CADS0_DTLA0_DTLB0_DTVA0_DTVB0_EPS1_FDSI0_GRPM1_GRVWA4_GRVWB16_GSUn1_GSUAMB_GSUC1_GSUWGMRR1_GLS0_ISA942_IU1_K1_LDSTI0_LBSPPA2048_LBSPPB8192_LBSPPM0_LPA0_LPB32_LPM0_LRVW16_LWPMn1_MIAV0_MIWT8_8_MO40_NTn1_NTA0_NTB0_NTC0_NTD4_NTM0_NEPBS0_NLCA1_NLCB1_ONLL1_PGR2_PLR0_PKA1_SIA3_SS1_SU16_SUM0_SUS256_SPO0_SRVW0_SSO0_SVW8_SK0_SKFTR0_SKXCCM0_TLDS0_ULSGRO0_USL1_UIOFGRO0_USFGROn1_VSn1_VWA8_VWB2_WSGRA0_WSGRB0_WS64_WG16_16_1_WGM8_WGMXCC8_WGMXCCGn1
    SolutionIndex: 58
    SolutionNameMin: Cijk_Ailk_Bjlk_I8IS_BH_Bias_S_FDMN_SPB_A_S_SAV_MT384x128x64_MI16x16x1_SN_LDSB0_AFC1_AG0_AFEM1_AFEM1_ASEM8_CLR0_CADS0_DTLA0_DTLB0_DTVA0_DTVB0_EPS1_FDSI0_GRPM1_GRVWA16_GRVWB8_GSUn1_GSUAMB_GSUC1_GSUWGMRR1_GLS0_ISA942_IU1_K1_LDSTI0_LBSPPA6144_LBSPPB2048_LBSPPM0_LPA64_LPB32_LPM0_LRVW16_LWPMn1_MIAV0_MIWT12_4_MO40_NTn1_NTA0_NTB0_NTC0_NTD4_NTM0_NEPBS0_NLCA3_NLCB1_ONLL1_PGR2_PLR0_PKA1_SIA3_SS1_SU16_SUM0_SUS256_SPO0_SRVW0_SSO0_SVW4_SK0_SKFTR0_SKXCCM0_TLDS0_ULSGRO0_USL1_UIOFGRO0_USFGROn1_VSn1_VWA4_VWB2_WSGRA0_WSGRB0_WS64_WG32_8_1_WGM8_WGMXCC8_WGMXCCGn1
    SolutionIndex: 59
    SolutionNameMin: Cijk_Ailk_Bjlk_I8IS_BH_Bias_S_FDMN_SPB_A_S_SAV_MT384x128x64_MI16x16x1_SN_LDSB0_AFC1_AG0_AFEM1_AFEM1_ASEM8_CLR0_CADS0_DTLA0_DTLB0_DTVA0_DTVB0_EPS1_FDSI0_GRPM1_GRVWA16_GRVWB16_GSUn1_GSUAMB_GSUC1_GSUWGMRR1_GLS0_ISA942_IU1_K1_LDSTI0_LBSPPA6144_LBSPPB2048_LBSPPM0_LPA32_LPB32_LPM0_LRVW16_LWPMn1_MIAV0_MIWT6_8_MO40_NTn1_NTA0_NTB0_NTC0_NTD4_NTM0_NEPBS0_NLCA3_NLCB1_ONLL1_PGR2_PLR0_PKA1_SIA3_SS1_SU16_SUM0_SUS256_SPO0_SRVW0_SSO0_SVW2_SK0_SKFTR0_SKXCCM0_TLDS0_ULSGRO0_USL1_UIOFGRO0_USFGROn1_VSn1_VWA2_VWB2_WSGRA0_WSGRB0_WS64_WG64_4_1_WGM8_WGMXCC8_WGMXCCGn1
    SolutionIndex: 60
    SolutionNameMin: Cijk_Ailk_Bjlk_I8IS_BH_Bias_S_FDMN_SPB_A_S_SAV_MT48x256x128_MI16x16x1_SN_LDSB1_AFC1_AG0_AFEM1_AFEM1_ASEM8_CLR1_CADS0_DTLA0_DTLB0_DTVA0_DTVB0_EPS1_FDSI0_GRPM1_GRVWA4_GRVWB16_GSUn1_GSUAMB_GSUC1_GSUWGMRR1_GLS0_ISA942_IU1_K1_LDSTI0_LBSPPA768_LBSPPB4096_LBSPPM0_LPA16_LPB32_LPM0_LRVW16_LWPMn1_MIAV0_MIWT3_4_MO40_NTn1_NTA0_NTB0_NTC0_NTD4_NTM0_NEPBS16_NLCA3_NLCB1_ONLL1_PGR2_PLR1_PKA1_SIA3_SS1_SU16_SUM0_SUS256_SPO0_SRVW0_SSO0_SVW1_SK0_SKFTR0_SKXCCM0_TLDS0_ULSGRO0_USL1_UIOFGRO0_USFGROn1_VSn1_VWA1_VWB2_WSGRA0_WSGRB0_WS64_WG16_16_1_WGM8_WGMXCC8_WGMXCCGn1
    SolutionIndex: 61
    SolutionNameMin: Cijk_Ailk_Bjlk_I8IS_BH_Bias_S_FDMN_SPB_A_S_SAV_MT64x256x128_MI16x16x1_SN_LDSB1_AFC1_AG0_AFEM1_AFEM1_ASEM8_CLR1_CADS0_DTLA0_DTLB0_DTVA0_DTVB0_EPS1_FDSI0_GRPM1_GRVWA16_GRVWB16_GSUn1_GSUAMB_GSUC1_GSUWGMRR1_GLS0_ISA942_IU1_K1_LDSTI0_LBSPPA1024_LBSPPB4096_LBSPPM0_LPA64_LPB32_LPM0_LRVW16_LWPMn1_MIAV0_MIWT4_4_MO40_NTn1_NTA0_NTB0_NTC0_NTD4_NTM0_NEPBS16_NLCA1_NLCB1_ONLL1_PGR2_PLR1_PKA1_SIA3_SS1_SU16_SUM0_SUS256_SPO0_SRVW0_SSO0_SVW4_SK0_SKFTR0_SKXCCM0_TLDS0_ULSGRO0_USL1_UIOFGRO0_USFGROn1_VSn1_VWA4_VWB2_WSGRA0_WSGRB0_WS64_WG16_16_1_WGM8_WGMXCC8_WGMXCCGn1
    SolutionIndex: 62
    SolutionNameMin: Cijk_Ailk_Bjlk_I8IS_BH_Bias_S_FDMN_SPB_A_S_SAV_MT64x256x128_MI16x16x1_SN_LDSB1_AFC1_AG0_AFEM1_AFEM1_ASEM8_CLR1_CADS0_DTLA0_DTLB0_DTVA0_DTVB0_EPS1_FDSI0_GRPM1_GRVWA16_GRVWB16_GSUn1_GSUAMB_GSUC1_GSUWGMRR1_GLS0_ISA942_IU1_K1_LDSTI0_LBSPPA1024_LBSPPB4096_LBSPPM0_LPA64_LPB32_LPM0_LRVW16_LWPMn1_MIAV0_MIWT4_4_MO40_NTn1_NTA0_NTB0_NTC0_NTD4_NTM0_NEPBS16_NLCA1_NLCB1_ONLL1_PGR2_PLR1_PKA1_SIA3_SS1_SU16_SUM0_SUS256_SPO0_SRVW0_SSO0_SVW4_SK0_SKFTR0_SKXCCM0_TLDS0_ULSGRO0_USL1_UIOFGRO0_USFGROn1_VSn1_VWA4_VWB2_WSGRA0_WSGRB0_WS64_WG16_16_1_WGM1_WGMXCC8_WGMXCCGn1
    SolutionIndex: 63
    SolutionNameMin: Cijk_Ailk_Bjlk_I8IS_BH_Bias_S_FDMN_SPB_A_S_SAV_MT32x256x256_MI16x16x1_SN_LDSB1_AFC1_AG0_AFEM1_AFEM1_ASEM8_CLR1_CADS0_DTLA0_DTLB0_DTVA0_DTVB0_EPS1_FDSI0_GRPM1_GRVWA4_GRVWB16_GSUn1_GSUAMB_GSUC1_GSUWGMRR1_GLS0_ISA942_IU1_K1_LDSTI0_LBSPPA512_LBSPPB4096_LBSPPM0_LPA32_LPB32_LPM0_LRVW16_LWPMn1_MIAV0_MIWT2_4_MO40_NTn1_NTA0_NTB0_NTC0_NTD4_NTM0_NEPBS0_NLCA1_NLCB1_ONLL1_PGR2_PLR1_PKA1_SIA3_SS1_SU16_SUM0_SUS256_SPO0_SRVW0_SSO0_SVW2_SK0_SKFTR0_SKXCCM0_TLDS0_ULSGRO0_USL1_UIOFGRO0_USFGROn1_VSn1_VWA2_VWB2_WSGRA0_WSGRB0_WS64_WG16_16_1_WGM1_WGMXCC8_WGMXCCGn1
    SolutionIndex: 64
    SolutionNameMin: Cijk_Ailk_Bjlk_I8IS_BH_Bias_S_FDMN_SPB_A_S_SAV_MT48x256x128_MI16x16x1_SN_LDSB1_AFC1_AG0_AFEM1_AFEM1_ASEM8_CLR1_CADS0_DTLA0_DTLB0_DTVA0_DTVB0_EPS1_FDSI0_GRPM1_GRVWA4_GRVWB16_GSUn1_GSUAMB_GSUC1_GSUWGMRR1_GLS0_ISA942_IU1_K1_LDSTI0_LBSPPA768_LBSPPB4096_LBSPPM0_LPA16_LPB32_LPM0_LRVW16_LWPMn1_MIAV0_MIWT3_4_MO40_NTn1_NTA0_NTB0_NTC0_NTD4_NTM0_NEPBS16_NLCA3_NLCB1_ONLL1_PGR2_PLR1_PKA1_SIA3_SS1_SU16_SUM0_SUS256_SPO0_SRVW0_SSO0_SVW1_SK0_SKFTR0_SKXCCM0_TLDS0_ULSGRO0_USL1_UIOFGRO0_USFGROn1_VSn1_VWA1_VWB2_WSGRA0_WSGRB0_WS64_WG16_16_1_WGM1_WGMXCC8_WGMXCCGn1
- - - [10752, 10240, 1, 512]
    - [1, 268.34]
  - - [9216, 10752, 1, 512]
    - [1, 274.51]
  - - [10240, 11264, 1, 512]
    - [1, 272.5]
  - - [9216, 17664, 1, 512]
    - [1, 271.62]
  - - [25600, 19968, 1, 512]
    - [1, 289.67]
  - - [25600, 20736, 1, 512]
    - [1, 283.93]
  - - [21504, 5120, 1, 512]
    - [1, 271.91]
  - - [13312, 7168, 1, 512]
    - [1, 272.69]
  - - [21504, 23040, 1, 512]
    - [1, 301.33]
  - - [24576, 4864, 1, 512]
    - [0, 266.52]
  - - [22528, 4352, 1, 512]
    - [1, 266.45]
  - - [90112, 800, 1, 512]
    - [1, 223.1]
  - - [23296, 4096, 1, 512]
    - [1, 265.56]
  - - [25600, 3840, 1, 512]
    - [1, 267.16]
  - - [21504, 4352, 1, 512]
    - [1, 266.03]
  - - [21760, 4352, 1, 512]
    - [0, 259.68]
  - - [53504, 1728, 1, 512]
    - [1, 259.05]
  - - [26624, 3584, 1, 512]
    - [1, 269.17]
  - - [43008, 2304, 1, 512]
    - [1, 269.98]
  - - [37632, 2432, 1, 512]
    - [1, 257.2]
  - - [4096, 131072, 1, 512]
    - [1, 279.15]
  - - [992, 42240, 1, 512]
    - [2, 208.86]
  - - [512, 100352, 1, 512]
    - [1, 267.3]
  - - [480, 119040, 1, 512]
    - [3, 208.69]
  - - [2304, 76032, 1, 512]
    - [1, 276.11]
  - - [2048, 70400, 1, 512]
    - [1, 259.42]
  - - [608, 131072, 1, 512]
    - [4, 203.84]
  - - [432, 126976, 1, 512]
    - [2, 191.67]
  - - [608, 69888, 1, 512]
    - [4, 194.57]
  - - [496, 82432, 1, 512]
    - [5, 184.42]
  - - [272, 100352, 1, 512]
    - [6, 180.46]
  - - [240, 122880, 1, 512]
    - [7, 194.81]
  - - [416, 49152, 1, 512]
    - [8, 170.78]
  - - [240, 126976, 1, 512]
    - [7, 192.99]
  - - [240, 102400, 1, 512]
    - [7, 196.06]
  - - [272, 98304, 1, 512]
    - [9, 179.38]
  - - [400, 93184, 1, 512]
    - [10, 202.78]
  - - [240, 103168, 1, 512]
    - [10, 183.8]
  - - [272, 99840, 1, 512]
    - [6, 189.93]
  - - [400, 92160, 1, 512]
    - [10, 199.2]
  - - [16, 16, 1, 512]
    - [11, 0.03]
  - - [7680, 16896, 1, 2048]
    - [1, 483.48]
  - - [9984, 7936, 1, 2048]
    - [1, 496.28]
  - - [12800, 6144, 1, 2048]
    - [1, 487.22]
  - - [16128, 16128, 1, 2048]
    - [1, 504.3]
  - - [6656, 19968, 1, 2048]
    - [0, 448.31]
  - - [32768, 13824, 1, 2048]
    - [1, 469.73]
  - - [7936, 9984, 1, 2048]
    - [1, 482.85]
  - - [8192, 8960, 1, 2048]
    - [1, 458.87]
  - - [5376, 16640, 1, 2048]
    - [1, 480.3]
  - - [8960, 5632, 1, 2048]
    - [1, 452.28]
  - - [47872, 992, 1, 2048]
    - [1, 399.07]
  - - [83200, 736, 1, 2048]
    - [1, 400.8]
  - - [96768, 608, 1, 2048]
    - [1, 346.69]
  - - [25344, 2816, 1, 2048]
    - [1, 455.63]
  - - [59392, 1152, 1, 2048]
    - [1, 417.6]
  - - [46592, 1536, 1, 2048]
    - [1, 446.12]
  - - [43520, 1792, 1, 2048]
    - [1, 487.03]
  - - [90112, 496, 1, 2048]
    - [1, 351.14]
  - - [47872, 1856, 1, 2048]
    - [0, 424.98]
  - - [61952, 1024, 1, 2048]
    - [1, 422.09]
  - - [3968, 14592, 1, 2048]
    - [1, 424.25]
  - - [2688, 33792, 1, 2048]
    - [1, 438.24]
  - - [768, 69632, 1, 2048]
    - [1, 441.25]
  - - [576, 103168, 1, 2048]
    - [12, 400.67]
  - - [768, 66816, 1, 2048]
    - [1, 429.13]
  - - [768, 76800, 1, 2048]
    - [1, 472.01]
  - - [512, 99840, 1, 2048]
    - [1, 420.11]
  - - [480, 107520, 1, 2048]
    - [3, 370.04]
  - - [4096, 25088, 1, 2048]
    - [1, 439.0]
  - - [1984, 41216, 1, 2048]
    - [1, 412.05]
  - - [69888, 432, 1, 2048]
    - [1, 346.54]
  - - [5120, 4352, 1, 2048]
    - [13, 359.36]
  - - [272, 77824, 1, 2048]
    - [14, 281.78]
  - - [53248, 704, 1, 2048]
    - [1, 345.94]
  - - [14592, 1792, 1, 2048]
    - [1, 385.46]
  - - [26624, 864, 1, 2048]
    - [1, 333.54]
  - - [34048, 1024, 1, 2048]
    - [1, 444.76]
  - - [52224, 512, 1, 2048]
    - [1, 365.68]
  - - [29184, 896, 1, 2048]
    - [1, 376.96]
  - - [1216, 17664, 1, 2048]
    - [13, 325.0]
  - - [50688, 320, 1, 2048]
    - [15, 307.97]
  - - [33792, 448, 1, 2048]
    - [1, 358.29]
  - - [160, 115200, 1, 2048]
    - [3, 366.01]
  - - [1280, 13312, 1, 2048]
    - [1, 446.9]
  - - [16896, 928, 1, 2048]
    - [1, 402.78]
  - - [736, 19712, 1, 2048]
    - [1, 309.69]
  - - [128, 115200, 1, 2048]
    - [16, 340.2]
  - - [60928, 256, 1, 2048]
    - [1, 359.43]
  - - [30720, 464, 1, 2048]
    - [1, 363.87]
  - - [128, 114688, 1, 2048]
    - [17, 338.14]
  - - [128, 103680, 1, 2048]
    - [18, 327.37]
  - - [128, 103936, 1, 2048]
    - [18, 335.34]
  - - [128, 96512, 1, 2048]
    - [19, 351.32]
  - - [128, 103168, 1, 2048]
    - [18, 333.51]
  - - [128, 100352, 1, 2048]
    - [20, 325.64]
  - - [96, 111360, 1, 2048]
    - [21, 291.49]
  - - [96, 115200, 1, 2048]
    - [21, 295.41]
  - - [128, 96000, 1, 2048]
    - [13, 354.8]
  - - [128, 99840, 1, 2048]
    - [18, 329.62]
  - - [128, 102400, 1, 2048]
    - [18, 326.53]
  - - [1024, 1024, 1, 2048]
    - [22, 98.89]
  - - [7424, 7936, 1, 4096]
    - [1, 505.46]
  - - [6144, 11264, 1, 4096]
    - [1, 484.71]
  - - [8960, 8960, 1, 4096]
    - [1, 505.43]
  - - [4608, 15872, 1, 4096]
    - [1, 515.52]
  - - [8960, 6656, 1, 4096]
    - [1, 520.27]
  - - [9984, 7936, 1, 4096]
    - [1, 548.39]
  - - [5376, 14336, 1, 4096]
    - [1, 528.45]
  - - [4608, 19712, 1, 4096]
    - [1, 524.3]
  - - [4608, 16640, 1, 4096]
    - [1, 526.43]
  - - [12288, 4864, 1, 4096]
    - [1, 492.56]
  - - [62208, 1024, 1, 4096]
    - [1, 453.67]
  - - [29696, 2304, 1, 4096]
    - [1, 506.53]
  - - [19200, 2816, 1, 4096]
    - [1, 505.07]
  - - [20736, 2816, 1, 4096]
    - [23, 510.57]
  - - [96512, 496, 1, 4096]
    - [24, 416.09]
  - - [24320, 2304, 1, 4096]
    - [1, 495.4]
  - - [50176, 992, 1, 4096]
    - [1, 493.35]
  - - [45056, 1216, 1, 4096]
    - [24, 466.92]
  - - [28160, 2048, 1, 4096]
    - [1, 511.5]
  - - [17664, 3200, 1, 4096]
    - [1, 491.02]
  - - [3456, 20736, 1, 4096]
    - [1, 489.88]
  - - [1984, 43776, 1, 4096]
    - [1, 508.07]
  - - [768, 66560, 1, 4096]
    - [1, 501.63]
  - - [768, 73728, 1, 4096]
    - [1, 502.37]
  - - [608, 84480, 1, 4096]
    - [1, 380.63]
  - - [2048, 34048, 1, 4096]
    - [1, 489.79]
  - - [768, 94208, 1, 4096]
    - [1, 515.75]
  - - [448, 100352, 1, 4096]
    - [1, 380.04]
  - - [3072, 23808, 1, 4096]
    - [1, 512.98]
  - - [992, 64768, 1, 4096]
    - [1, 430.89]
  - - [19456, 1472, 1, 4096]
    - [1, 451.82]
  - - [96512, 240, 1, 4096]
    - [25, 318.87]
  - - [7936, 3072, 1, 4096]
    - [1, 433.98]
  - - [16128, 1472, 1, 4096]
    - [26, 399.6]
  - - [736, 28672, 1, 4096]
    - [13, 348.11]
  - - [1024, 36864, 1, 4096]
    - [1, 533.0]
  - - [192, 119040, 1, 4096]
    - [27, 333.85]
  - - [31744, 736, 1, 4096]
    - [28, 381.33]
  - - [352, 111104, 1, 4096]
    - [29, 352.83]
  - - [15872, 1472, 1, 4096]
    - [26, 397.74]
  - - [1728, 8448, 1, 4096]
    - [30, 429.1]
  - - [192, 76544, 1, 4096]
    - [31, 415.88]
  - - [256, 70400, 1, 4096]
    - [1, 543.77]
  - - [192, 75264, 1, 4096]
    - [27, 416.03]
  - - [192, 77824, 1, 4096]
    - [32, 414.78]
  - - [128, 107520, 1, 4096]
    - [18, 384.92]
  - - [192, 76800, 1, 4096]
    - [33, 430.81]
  - - [144, 103168, 1, 4096]
    - [3, 306.37]
  - - [192, 73728, 1, 4096]
    - [30, 410.45]
  - - [192, 76032, 1, 4096]
    - [34, 421.42]
  - - [128, 96000, 1, 4096]
    - [18, 376.72]
  - - [128, 103168, 1, 4096]
    - [18, 364.36]
  - - [128, 103680, 1, 4096]
    - [18, 367.13]
  - - [128, 103936, 1, 4096]
    - [18, 367.22]
  - - [5888, 1856, 1, 4096]
    - [35, 398.07]
  - - [128, 96768, 1, 4096]
    - [18, 385.34]
  - - [128, 89856, 1, 4096]
    - [13, 363.82]
  - - [128, 96512, 1, 4096]
    - [18, 382.28]
  - - [128, 100352, 1, 4096]
    - [18, 375.1]
  - - [96, 111360, 1, 4096]
    - [21, 287.36]
  - - [16, 88320, 1, 4096]
    - [36, 87.14]
  - - [32, 90112, 1, 4096]
    - [37, 156.3]
  - - [48, 64768, 1, 4096]
    - [38, 158.9]
  - - [16, 65280, 1, 4096]
    - [39, 94.81]
  - - [16, 70400, 1, 4096]
    - [39, 95.71]
  - - [32, 73728, 1, 4096]
    - [40, 174.84]
  - - [16, 79360, 1, 4096]
    - [36, 82.82]
  - - [16, 81664, 1, 4096]
    - [36, 81.9]
  - - [16, 81920, 1, 4096]
    - [36, 82.14]
  - - [32, 86016, 1, 4096]
    - [37, 155.0]
  - - [4608, 12544, 1, 8192]
    - [1, 565.77]
  - - [4608, 14848, 1, 8192]
    - [1, 561.32]
  - - [7936, 7424, 1, 8192]
    - [1, 555.21]
  - - [12800, 4608, 1, 8192]
    - [1, 615.6]
  - - [5376, 10752, 1, 8192]
    - [1, 548.45]
  - - [6400, 12288, 1, 8192]
    - [1, 573.83]
  - - [4608, 15360, 1, 8192]
    - [1, 547.04]
  - - [12288, 19712, 1, 8192]
    - [1, 600.62]
  - - [9984, 8192, 1, 8192]
    - [1, 557.66]
  - - [4864, 12288, 1, 8192]
    - [1, 556.43]
  - - [32256, 1600, 1, 8192]
    - [1, 483.43]
  - - [38400, 1536, 1, 8192]
    - [1, 524.96]
  - - [46080, 1280, 1, 8192]
    - [1, 518.02]
  - - [24320, 2304, 1, 8192]
    - [1, 524.86]
  - - [42240, 1280, 1, 8192]
    - [1, 513.0]
  - - [23296, 2304, 1, 8192]
    - [1, 518.4]
  - - [53760, 1024, 1, 8192]
    - [1, 556.46]
  - - [44544, 1280, 1, 8192]
    - [1, 513.68]
  - - [33280, 1600, 1, 8192]
    - [1, 473.73]
  - - [32256, 1728, 1, 8192]
    - [1, 506.39]
  - - [2048, 36864, 1, 8192]
    - [41, 548.0]
  - - [768, 71680, 1, 8192]
    - [1, 498.7]
  - - [1280, 44544, 1, 8192]
    - [1, 546.69]
  - - [2304, 25600, 1, 8192]
    - [1, 570.13]
  - - [768, 72960, 1, 8192]
    - [1, 502.83]
  - - [1984, 35328, 1, 8192]
    - [1, 520.63]
  - - [1472, 46080, 1, 8192]
    - [1, 522.06]
  - - [768, 66560, 1, 8192]
    - [1, 540.12]
  - - [768, 76800, 1, 8192]
    - [1, 503.99]
  - - [1536, 38400, 1, 8192]
    - [1, 555.76]
  - - [288, 78848, 1, 8192]
    - [42, 325.05]
  - - [400, 78848, 1, 8192]
    - [1, 352.94]
  - - [320, 89856, 1, 8192]
    - [43, 373.69]
  - - [78848, 480, 1, 8192]
    - [1, 419.35]
  - - [768, 47616, 1, 8192]
    - [1, 558.51]
  - - [34048, 928, 1, 8192]
    - [1, 481.12]
  - - [14080, 2688, 1, 8192]
    - [1, 561.7]
  - - [47872, 704, 1, 8192]
    - [1, 536.88]
  - - [48384, 736, 1, 8192]
    - [0, 462.88]
  - - [37632, 992, 1, 8192]
    - [1, 533.91]
  - - [240, 70656, 1, 8192]
    - [1, 377.64]
  - - [47104, 304, 1, 8192]
    - [15, 319.31]
  - - [384, 50176, 1, 8192]
    - [16, 479.9]
  - - [10240, 1856, 1, 8192]
    - [44, 427.76]
  - - [512, 37632, 1, 8192]
    - [1, 563.55]
  - - [256, 62208, 1, 8192]
    - [1, 476.3]
  - - [256, 64768, 1, 8192]
    - [23, 432.21]
  - - [256, 59136, 1, 8192]
    - [1, 442.85]
  - - [256, 65536, 1, 8192]
    - [1, 472.61]
  - - [8448, 2176, 1, 8192]
    - [1, 536.68]
  - - [256, 39168, 1, 8192]
    - [28, 396.39]
  - - [320, 41472, 1, 8192]
    - [45, 376.27]
  - - [176, 69120, 1, 8192]
    - [31, 321.47]
  - - [51968, 256, 1, 8192]
    - [1, 374.45]
  - - [192, 66816, 1, 8192]
    - [46, 364.0]
  - - [128, 82944, 1, 8192]
    - [18, 330.03]
  - - [192, 56576, 1, 8192]
    - [47, 365.76]
  - - [112, 96768, 1, 8192]
    - [48, 260.25]
  - - [112, 96000, 1, 8192]
    - [13, 259.33]
  - - [512, 19968, 1, 8192]
    - [26, 414.8]
  - - [32, 59136, 1, 8192]
    - [49, 123.32]
  - - [16, 55552, 1, 8192]
    - [39, 79.5]
  - - [16, 52992, 1, 8192]
    - [50, 78.88]
  - - [32, 51968, 1, 8192]
    - [51, 137.2]
  - - [32, 52224, 1, 8192]
    - [52, 127.05]
  - - [32, 46080, 1, 8192]
    - [52, 127.21]
  - - [16, 48384, 1, 8192]
    - [39, 76.05]
  - - [32, 59904, 1, 8192]
    - [51, 120.41]
  - - [32, 59392, 1, 8192]
    - [49, 126.59]
  - - [16, 49152, 1, 8192]
    - [39, 78.05]
  - - [8192, 1792, 1, 32768]
    - [27, 440.5]
  - - [29440, 512, 1, 32768]
    - [53, 392.39]
  - - [6400, 2560, 1, 32768]
    - [54, 462.87]
  - - [5376, 2816, 1, 32768]
    - [55, 430.49]
  - - [3968, 4096, 1, 32768]
    - [54, 449.42]
  - - [3584, 4608, 1, 32768]
    - [55, 469.49]
  - - [28160, 512, 1, 32768]
    - [56, 411.41]
  - - [1792, 9216, 1, 32768]
    - [25, 452.4]
  - - [9216, 1472, 1, 32768]
    - [28, 480.62]
  - - [3840, 4096, 1, 32768]
    - [55, 444.03]
  - - [29696, 416, 1, 32768]
    - [57, 357.59]
  - - [25344, 496, 1, 32768]
    - [58, 422.19]
  - - [7680, 1408, 1, 32768]
    - [26, 437.15]
  - - [19712, 608, 1, 32768]
    - [59, 370.78]
  - - [640, 16128, 1, 32768]
    - [18, 410.99]
  - - [23808, 496, 1, 32768]
    - [26, 398.51]
  - - [30464, 432, 1, 32768]
    - [16, 361.84]
  - - [9216, 1280, 1, 32768]
    - [28, 437.55]
  - - [5376, 2304, 1, 32768]
    - [26, 474.29]
  - - [4352, 2944, 1, 32768]
    - [26, 482.48]
  - - [48, 131072, 1, 32768]
    - [60, 167.56]
  - - [64, 131072, 1, 32768]
    - [61, 217.19]
  - - [48, 126976, 1, 32768]
    - [60, 164.49]
  - - [64, 126976, 1, 32768]
    - [62, 216.42]
  - - [64, 122880, 1, 32768]
    - [61, 218.12]
  - - [48, 122880, 1, 32768]
    - [60, 163.12]
  - - [64, 119040, 1, 32768]
    - [61, 220.17]
  - - [48, 119040, 1, 32768]
    - [62, 161.88]
  - - [32, 131072, 1, 32768]
    - [63, 137.16]
  - - [48, 118784, 1, 32768]
    - [64, 163.48]
- null
- null
- DeviceEfficiency
- GridBased
