projects/hipsparselt/library/src/hcc_detail/rocsparselt/src/spmm/Tensile/Logic/asm_full/aquavanjaram/gfx942/GridBased/aquavanjaram_Cijk_Ailk_Bjlk_HHS_BH_Bias_FDMN_SPA_AS_SAV.yaml
- {MinimumRequiredVersion: 4.33.0}
- aquavanjaram
- gfx942
- [Device 0049, Device 0050]
    SolutionIndex: 0
    SolutionNameMin: Cijk_Ailk_Bjlk_HHS_BH_Bias_FDMN_SPA_AS_SAV_MT16x16x64_MI16x16x1_SN_GRVWA8_GRVWB8_GSU16_GSUC0_GSUWGMRR0_K1_LBSPPA256_LBSPPB256_MIWT1_1_NLCA1_NLCB1_SU0_SUM0_SUS0_WG16_4_1_WGM1_WGMXCC1_WGMXCCGn1
    SolutionIndex: 1
    SolutionNameMin: Cijk_Ailk_Bjlk_HHS_BH_Bias_FDMN_SPA_AS_SAV_MT16x16x128_MI16x16x1_SN_GRVWA4_GRVWB2_GSU16_GSUC0_GSUWGMRR0_K1_LBSPPA256_LBSPPB256_MIWT1_1_NLCA1_NLCB1_SU0_SUM0_SUS0_WG16_4_1_WGM1_WGMXCC1_WGMXCCGn1
    SolutionIndex: 2
    SolutionNameMin: Cijk_Ailk_Bjlk_HHS_BH_Bias_FDMN_SPA_AS_SAV_MT16x16x128_MI16x16x1_SN_GRVWA4_GRVWB8_GSU16_GSUC0_GSUWGMRR0_K1_LBSPPA256_LBSPPB256_MIWT1_1_NLCA1_NLCB1_SU0_SUM0_SUS0_WG16_4_1_WGM1_WGMXCC1_WGMXCCGn1
    SolutionIndex: 3
    SolutionNameMin: Cijk_Ailk_Bjlk_HHS_BH_Bias_FDMN_SPA_AS_SAV_MT16x16x128_MI16x16x1_SN_GRVWA8_GRVWB8_GSU16_GSUC0_GSUWGMRR0_K1_LBSPPA256_LBSPPB256_MIWT1_1_NLCA1_NLCB1_SU0_SUM0_SUS0_WG16_4_1_WGM1_WGMXCC1_WGMXCCGn1
    SolutionIndex: 4
    SolutionNameMin: Cijk_Ailk_Bjlk_HHS_BH_Bias_FDMN_SPA_AS_SAV_MT16x16x128_MI16x16x1_SN_GRVWA4_GRVWB2_GSU16_GSUC0_GSUWGMRR0_K1_LBSPPA256_LBSPPB256_MIWT1_1_NLCA1_NLCB1_SU0_SUM0_SUS0_WG16_4_1_WGM8_WGMXCC1_WGMXCCGn1
    SolutionIndex: 5
    SolutionNameMin: Cijk_Ailk_Bjlk_HHS_BH_Bias_FDMN_SPA_AS_SAV_MT16x16x128_MI16x16x1_SN_GRVWA4_GRVWB8_GSU16_GSUC0_GSUWGMRR0_K1_LBSPPA256_LBSPPB256_MIWT1_1_NLCA1_NLCB1_SU0_SUM0_SUS0_WG16_4_1_WGM8_WGMXCC1_WGMXCCGn1
    SolutionIndex: 6
    SolutionNameMin: Cijk_Ailk_Bjlk_HHS_BH_Bias_FDMN_SPA_AS_SAV_MT16x16x128_MI16x16x1_SN_GRVWA8_GRVWB8_GSU16_GSUC0_GSUWGMRR0_K1_LBSPPA256_LBSPPB256_MIWT1_1_NLCA1_NLCB1_SU0_SUM0_SUS0_WG16_4_1_WGM8_WGMXCC1_WGMXCCGn1
    SolutionIndex: 7
    SolutionNameMin: Cijk_Ailk_Bjlk_HHS_BH_Bias_FDMN_SPA_AS_SAV_MT16x16x128_MI16x16x1_SN_GRVWA8_GRVWB8_GSU15_GSUC0_GSUWGMRR0_K1_LBSPPA256_LBSPPB256_MIWT1_1_NLCA1_NLCB1_SU0_SUM0_SUS0_WG16_4_1_WGM1_WGMXCC1_WGMXCCGn1
    SolutionIndex: 8
    SolutionNameMin: Cijk_Ailk_Bjlk_HHS_BH_Bias_FDMN_SPA_AS_SAV_MT16x16x128_MI16x16x1_SN_GRVWA4_GRVWB2_GSU14_GSUC0_GSUWGMRR0_K1_LBSPPA256_LBSPPB256_MIWT1_1_NLCA1_NLCB1_SU0_SUM0_SUS0_WG16_4_1_WGM1_WGMXCC1_WGMXCCGn1
    SolutionIndex: 9
    SolutionNameMin: Cijk_Ailk_Bjlk_HHS_BH_Bias_FDMN_SPA_AS_SAV_MT16x16x128_MI16x16x1_SN_GRVWA4_GRVWB8_GSU14_GSUC0_GSUWGMRR0_K1_LBSPPA256_LBSPPB256_MIWT1_1_NLCA1_NLCB1_SU0_SUM0_SUS0_WG16_4_1_WGM1_WGMXCC1_WGMXCCGn1
    SolutionIndex: 10
    SolutionNameMin: Cijk_Ailk_Bjlk_HHS_BH_Bias_FDMN_SPA_AS_SAV_MT16x16x128_MI16x16x1_SN_GRVWA4_GRVWB8_GSU13_GSUC0_GSUWGMRR0_K1_LBSPPA256_LBSPPB256_MIWT1_1_NLCA1_NLCB1_SU0_SUM0_SUS0_WG16_4_1_WGM1_WGMXCC1_WGMXCCGn1
    SolutionIndex: 11
    SolutionNameMin: Cijk_Ailk_Bjlk_HHS_BH_Bias_FDMN_SPA_AS_SAV_MT16x16x128_MI16x16x1_SN_GRVWA8_GRVWB8_GSU12_GSUC0_GSUWGMRR0_K1_LBSPPA256_LBSPPB256_MIWT1_1_NLCA1_NLCB1_SU0_SUM0_SUS0_WG16_4_1_WGM8_WGMXCC1_WGMXCCGn1
    SolutionIndex: 12
    SolutionNameMin: Cijk_Ailk_Bjlk_HHS_BH_Bias_FDMN_SPA_AS_SAV_MT16x16x64_MI16x16x1_SN_GRVWA8_GRVWB2_GSU11_GSUC0_GSUWGMRR0_K1_LBSPPA256_LBSPPB256_MIWT1_1_NLCA1_NLCB1_SU0_SUM0_SUS0_WG16_4_1_WGM1_WGMXCC1_WGMXCCGn1
    SolutionIndex: 13
    SolutionNameMin: Cijk_Ailk_Bjlk_HHS_BH_Bias_FDMN_SPA_AS_SAV_MT16x16x128_MI16x16x1_SN_GRVWA4_GRVWB8_GSU11_GSUC0_GSUWGMRR0_K1_LBSPPA256_LBSPPB256_MIWT1_1_NLCA1_NLCB1_SU0_SUM0_SUS0_WG16_4_1_WGM1_WGMXCC1_WGMXCCGn1
    SolutionIndex: 14
    SolutionNameMin: Cijk_Ailk_Bjlk_HHS_BH_Bias_FDMN_SPA_AS_SAV_MT16x16x128_MI16x16x1_SN_GRVWA8_GRVWB8_GSU11_GSUC0_GSUWGMRR0_K1_LBSPPA256_LBSPPB256_MIWT1_1_NLCA1_NLCB1_SU0_SUM0_SUS0_WG16_4_1_WGM8_WGMXCC1_WGMXCCGn1
    SolutionIndex: 15
    SolutionNameMin: Cijk_Ailk_Bjlk_HHS_BH_Bias_FDMN_SPA_AS_SAV_MT16x16x64_MI16x16x1_SN_GRVWA8_GRVWB2_GSU9_GSUC0_GSUWGMRR0_K1_LBSPPA256_LBSPPB256_MIWT1_1_NLCA1_NLCB1_SU0_SUM0_SUS0_WG16_4_1_WGM8_WGMXCC1_WGMXCCGn1
    SolutionIndex: 16
    SolutionNameMin: Cijk_Ailk_Bjlk_HHS_BH_Bias_FDMN_SPA_AS_SAV_MT16x16x128_MI16x16x1_SN_GRVWA8_GRVWB2_GSU9_GSUC0_GSUWGMRR0_K1_LBSPPA256_LBSPPB256_MIWT1_1_NLCA1_NLCB1_SU0_SUM0_SUS0_WG16_4_1_WGM8_WGMXCC1_WGMXCCGn1
    SolutionIndex: 17
    SolutionNameMin: Cijk_Ailk_Bjlk_HHS_BH_Bias_FDMN_SPA_AS_SAV_MT16x16x64_MI16x16x1_SN_GRVWA4_GRVWB8_GSU10_GSUC0_GSUWGMRR0_K1_LBSPPA256_LBSPPB256_MIWT1_1_NLCA1_NLCB1_SU0_SUM0_SUS0_WG16_4_1_WGM1_WGMXCC1_WGMXCCGn1
    SolutionIndex: 18
    SolutionNameMin: Cijk_Ailk_Bjlk_HHS_BH_Bias_FDMN_SPA_AS_SAV_MT32x16x64_MI16x16x1_SN_GRVWA4_GRVWB2_GSU16_GSUC0_GSUWGMRR0_K1_LBSPPA512_LBSPPB256_MIWT1_1_NLCA1_NLCB1_SU0_SUM0_SUS0_WG32_4_1_WGM1_WGMXCC1_WGMXCCGn1
    SolutionIndex: 19
    SolutionNameMin: Cijk_Ailk_Bjlk_HHS_BH_Bias_FDMN_SPA_AS_SAV_MT32x16x64_MI16x16x1_SN_GRVWA8_GRVWB2_GSU16_GSUC0_GSUWGMRR0_K1_LBSPPA512_LBSPPB256_MIWT1_1_NLCA1_NLCB1_SU0_SUM0_SUS0_WG32_4_1_WGM1_WGMXCC1_WGMXCCGn1
    SolutionIndex: 20
    SolutionNameMin: Cijk_Ailk_Bjlk_HHS_BH_Bias_FDMN_SPA_AS_SAV_MT32x16x64_MI16x16x1_SN_GRVWA8_GRVWB2_GSU16_GSUC0_GSUWGMRR0_K1_LBSPPA512_LBSPPB256_MIWT1_1_NLCA1_NLCB1_SU0_SUM0_SUS0_WG32_4_1_WGM8_WGMXCC1_WGMXCCGn1
    SolutionIndex: 21
    SolutionNameMin: Cijk_Ailk_Bjlk_HHS_BH_Bias_FDMN_SPA_AS_SAV_MT32x16x64_MI16x16x1_SN_GRVWA8_GRVWB8_GSU16_GSUC0_GSUWGMRR0_K1_LBSPPA512_LBSPPB256_MIWT1_1_NLCA1_NLCB1_SU0_SUM0_SUS0_WG32_4_1_WGM8_WGMXCC1_WGMXCCGn1
    SolutionIndex: 22
    SolutionNameMin: Cijk_Ailk_Bjlk_HHS_BH_Bias_FDMN_SPA_AS_SAV_MT32x16x128_MI16x16x1_SN_GRVWA4_GRVWB2_GSU16_GSUC0_GSUWGMRR0_K1_LBSPPA512_LBSPPB256_MIWT1_1_NLCA1_NLCB1_SU0_SUM0_SUS0_WG32_4_1_WGM1_WGMXCC1_WGMXCCGn1
    SolutionIndex: 23
    SolutionNameMin: Cijk_Ailk_Bjlk_HHS_BH_Bias_FDMN_SPA_AS_SAV_MT32x16x128_MI16x16x1_SN_GRVWA8_GRVWB2_GSU16_GSUC0_GSUWGMRR0_K1_LBSPPA512_LBSPPB256_MIWT1_1_NLCA1_NLCB1_SU0_SUM0_SUS0_WG32_4_1_WGM8_WGMXCC1_WGMXCCGn1
    SolutionIndex: 24
    SolutionNameMin: Cijk_Ailk_Bjlk_HHS_BH_Bias_FDMN_SPA_AS_SAV_MT16x16x64_MI16x16x1_SN_GRVWA4_GRVWB2_GSU8_GSUC0_GSUWGMRR0_K1_LBSPPA256_LBSPPB256_MIWT1_1_NLCA1_NLCB1_SU0_SUM0_SUS0_WG16_4_1_WGM1_WGMXCC1_WGMXCCGn1
    SolutionIndex: 25
    SolutionNameMin: Cijk_Ailk_Bjlk_HHS_BH_Bias_FDMN_SPA_AS_SAV_MT16x16x64_MI16x16x1_SN_GRVWA8_GRVWB2_GSU8_GSUC0_GSUWGMRR0_K1_LBSPPA256_LBSPPB256_MIWT1_1_NLCA1_NLCB1_SU0_SUM0_SUS0_WG16_4_1_WGM1_WGMXCC1_WGMXCCGn1
    SolutionIndex: 26
    SolutionNameMin: Cijk_Ailk_Bjlk_HHS_BH_Bias_FDMN_SPA_AS_SAV_MT16x16x64_MI16x16x1_SN_GRVWA4_GRVWB2_GSU8_GSUC0_GSUWGMRR0_K1_LBSPPA256_LBSPPB256_MIWT1_1_NLCA1_NLCB1_SU0_SUM0_SUS0_WG16_4_1_WGM8_WGMXCC1_WGMXCCGn1
    SolutionIndex: 27
    SolutionNameMin: Cijk_Ailk_Bjlk_HHS_BH_Bias_FDMN_SPA_AS_SAV_MT16x16x64_MI16x16x1_SN_GRVWA8_GRVWB2_GSU8_GSUC0_GSUWGMRR0_K1_LBSPPA256_LBSPPB256_MIWT1_1_NLCA1_NLCB1_SU0_SUM0_SUS0_WG16_4_1_WGM8_WGMXCC1_WGMXCCGn1
    SolutionIndex: 28
    SolutionNameMin: Cijk_Ailk_Bjlk_HHS_BH_Bias_FDMN_SPA_AS_SAV_MT32x16x128_MI16x16x1_SN_GRVWA8_GRVWB8_GSU14_GSUC0_GSUWGMRR0_K1_LBSPPA512_LBSPPB256_MIWT1_1_NLCA1_NLCB1_SU0_SUM0_SUS0_WG32_4_1_WGM1_WGMXCC1_WGMXCCGn1
    SolutionIndex: 29
    SolutionNameMin: Cijk_Ailk_Bjlk_HHS_BH_Bias_FDMN_SPA_AS_SAV_MT32x16x128_MI16x16x1_SN_GRVWA4_GRVWB8_GSU14_GSUC0_GSUWGMRR0_K1_LBSPPA512_LBSPPB256_MIWT1_1_NLCA1_NLCB1_SU0_SUM0_SUS0_WG32_4_1_WGM8_WGMXCC1_WGMXCCGn1
    SolutionIndex: 30
    SolutionNameMin: Cijk_Ailk_Bjlk_HHS_BH_Bias_FDMN_SPA_AS_SAV_MT16x16x64_MI16x16x1_SN_GRVWA4_GRVWB8_GSU7_GSUC0_GSUWGMRR0_K1_LBSPPA256_LBSPPB256_MIWT1_1_NLCA1_NLCB1_SU0_SUM0_SUS0_WG16_4_1_WGM1_WGMXCC1_WGMXCCGn1
    SolutionIndex: 31
    SolutionNameMin: Cijk_Ailk_Bjlk_HHS_BH_Bias_FDMN_SPA_AS_SAV_MT16x16x128_MI16x16x1_SN_GRVWA4_GRVWB2_GSU7_GSUC0_GSUWGMRR0_K1_LBSPPA256_LBSPPB256_MIWT1_1_NLCA1_NLCB1_SU0_SUM0_SUS0_WG16_4_1_WGM1_WGMXCC1_WGMXCCGn1
    SolutionIndex: 32
    SolutionNameMin: Cijk_Ailk_Bjlk_HHS_BH_Bias_FDMN_SPA_AS_SAV_MT16x16x128_MI16x16x1_SN_GRVWA8_GRVWB2_GSU7_GSUC0_GSUWGMRR0_K1_LBSPPA256_LBSPPB256_MIWT1_1_NLCA1_NLCB1_SU0_SUM0_SUS0_WG16_4_1_WGM1_WGMXCC1_WGMXCCGn1
    SolutionIndex: 33
    SolutionNameMin: Cijk_Ailk_Bjlk_HHS_BH_Bias_FDMN_SPA_AS_SAV_MT16x16x128_MI16x16x1_SN_GRVWA4_GRVWB8_GSU7_GSUC0_GSUWGMRR0_K1_LBSPPA256_LBSPPB256_MIWT1_1_NLCA1_NLCB1_SU0_SUM0_SUS0_WG16_4_1_WGM1_WGMXCC1_WGMXCCGn1
    SolutionIndex: 34
    SolutionNameMin: Cijk_Ailk_Bjlk_HHS_BH_Bias_FDMN_SPA_AS_SAV_MT32x16x64_MI16x16x1_SN_GRVWA4_GRVWB2_GSU15_GSUC0_GSUWGMRR0_K1_LBSPPA512_LBSPPB256_MIWT1_1_NLCA1_NLCB1_SU0_SUM0_SUS0_WG32_4_1_WGM1_WGMXCC1_WGMXCCGn1
    SolutionIndex: 35
    SolutionNameMin: Cijk_Ailk_Bjlk_HHS_BH_Bias_FDMN_SPA_AS_SAV_MT32x16x64_MI16x16x1_SN_GRVWA4_GRVWB2_GSU15_GSUC0_GSUWGMRR0_K1_LBSPPA512_LBSPPB256_MIWT1_1_NLCA1_NLCB1_SU0_SUM0_SUS0_WG32_4_1_WGM8_WGMXCC1_WGMXCCGn1
    SolutionIndex: 36
    SolutionNameMin: Cijk_Ailk_Bjlk_HHS_BH_Bias_FDMN_SPA_AS_SAV_MT32x16x64_MI16x16x1_SN_GRVWA8_GRVWB2_GSU15_GSUC0_GSUWGMRR0_K1_LBSPPA512_LBSPPB256_MIWT1_1_NLCA1_NLCB1_SU0_SUM0_SUS0_WG32_4_1_WGM8_WGMXCC1_WGMXCCGn1
    SolutionIndex: 37
    SolutionNameMin: Cijk_Ailk_Bjlk_HHS_BH_Bias_FDMN_SPA_AS_SAV_MT32x16x128_MI16x16x1_SN_GRVWA4_GRVWB2_GSU15_GSUC0_GSUWGMRR0_K1_LBSPPA512_LBSPPB256_MIWT1_1_NLCA1_NLCB1_SU0_SUM0_SUS0_WG32_4_1_WGM1_WGMXCC1_WGMXCCGn1
    SolutionIndex: 38
    SolutionNameMin: Cijk_Ailk_Bjlk_HHS_BH_Bias_FDMN_SPA_AS_SAV_MT32x16x128_MI16x16x1_SN_GRVWA4_GRVWB8_GSU15_GSUC0_GSUWGMRR0_K1_LBSPPA512_LBSPPB256_MIWT1_1_NLCA1_NLCB1_SU0_SUM0_SUS0_WG32_4_1_WGM1_WGMXCC1_WGMXCCGn1
    SolutionIndex: 39
    SolutionNameMin: Cijk_Ailk_Bjlk_HHS_BH_Bias_FDMN_SPA_AS_SAV_MT32x16x128_MI16x16x1_SN_GRVWA8_GRVWB2_GSU15_GSUC0_GSUWGMRR0_K1_LBSPPA512_LBSPPB256_MIWT1_1_NLCA1_NLCB1_SU0_SUM0_SUS0_WG32_4_1_WGM8_WGMXCC1_WGMXCCGn1
    SolutionIndex: 40
    SolutionNameMin: Cijk_Ailk_Bjlk_HHS_BH_Bias_FDMN_SPA_AS_SAV_MT32x16x64_MI16x16x1_SN_GRVWA8_GRVWB2_GSU11_GSUC0_GSUWGMRR0_K1_LBSPPA512_LBSPPB256_MIWT1_1_NLCA1_NLCB1_SU0_SUM0_SUS0_WG32_4_1_WGM1_WGMXCC1_WGMXCCGn1
    SolutionIndex: 41
    SolutionNameMin: Cijk_Ailk_Bjlk_HHS_BH_Bias_FDMN_SPA_AS_SAV_MT32x16x64_MI16x16x1_SN_GRVWA4_GRVWB2_GSU11_GSUC0_GSUWGMRR0_K1_LBSPPA512_LBSPPB256_MIWT1_1_NLCA1_NLCB1_SU0_SUM0_SUS0_WG32_4_1_WGM8_WGMXCC1_WGMXCCGn1
    SolutionIndex: 42
    SolutionNameMin: Cijk_Ailk_Bjlk_HHS_BH_Bias_FDMN_SPA_AS_SAV_MT32x16x128_MI16x16x1_SN_GRVWA4_GRVWB8_GSU11_GSUC0_GSUWGMRR0_K1_LBSPPA512_LBSPPB256_MIWT1_1_NLCA1_NLCB1_SU0_SUM0_SUS0_WG32_4_1_WGM1_WGMXCC1_WGMXCCGn1
    SolutionIndex: 43
    SolutionNameMin: Cijk_Ailk_Bjlk_HHS_BH_Bias_FDMN_SPA_AS_SAV_MT32x16x64_MI16x16x1_SN_GRVWA4_GRVWB8_GSU12_GSUC0_GSUWGMRR0_K1_LBSPPA512_LBSPPB256_MIWT1_1_NLCA1_NLCB1_SU0_SUM0_SUS0_WG32_4_1_WGM1_WGMXCC1_WGMXCCGn1
    SolutionIndex: 44
    SolutionNameMin: Cijk_Ailk_Bjlk_HHS_BH_Bias_FDMN_SPA_AS_SAV_MT32x16x64_MI16x16x1_SN_GRVWA8_GRVWB8_GSU12_GSUC0_GSUWGMRR0_K1_LBSPPA512_LBSPPB256_MIWT1_1_NLCA1_NLCB1_SU0_SUM0_SUS0_WG32_4_1_WGM1_WGMXCC1_WGMXCCGn1
    SolutionIndex: 45
    SolutionNameMin: Cijk_Ailk_Bjlk_HHS_BH_Bias_FDMN_SPA_AS_SAV_MT32x16x64_MI16x16x1_SN_GRVWA8_GRVWB2_GSU12_GSUC0_GSUWGMRR0_K1_LBSPPA512_LBSPPB256_MIWT1_1_NLCA1_NLCB1_SU0_SUM0_SUS0_WG32_4_1_WGM8_WGMXCC1_WGMXCCGn1
    SolutionIndex: 46
    SolutionNameMin: Cijk_Ailk_Bjlk_HHS_BH_Bias_FDMN_SPA_AS_SAV_MT32x16x128_MI16x16x1_SN_GRVWA4_GRVWB8_GSU12_GSUC0_GSUWGMRR0_K1_LBSPPA512_LBSPPB256_MIWT1_1_NLCA1_NLCB1_SU0_SUM0_SUS0_WG32_4_1_WGM1_WGMXCC1_WGMXCCGn1
    SolutionIndex: 47
    SolutionNameMin: Cijk_Ailk_Bjlk_HHS_BH_Bias_FDMN_SPA_AS_SAV_MT16x16x128_MI16x16x1_SN_GRVWA4_GRVWB2_GSU6_GSUC0_GSUWGMRR0_K1_LBSPPA256_LBSPPB256_MIWT1_1_NLCA1_NLCB1_SU0_SUM0_SUS0_WG16_4_1_WGM8_WGMXCC1_WGMXCCGn1
    SolutionIndex: 48
    SolutionNameMin: Cijk_Ailk_Bjlk_HHS_BH_Bias_FDMN_SPA_AS_SAV_MT32x16x64_MI16x16x1_SN_GRVWA8_GRVWB2_GSU13_GSUC0_GSUWGMRR0_K1_LBSPPA512_LBSPPB256_MIWT1_1_NLCA1_NLCB1_SU0_SUM0_SUS0_WG32_4_1_WGM1_WGMXCC1_WGMXCCGn1
    SolutionIndex: 49
    SolutionNameMin: Cijk_Ailk_Bjlk_HHS_BH_Bias_FDMN_SPA_AS_SAV_MT32x16x64_MI16x16x1_SN_GRVWA8_GRVWB2_GSU9_GSUC0_GSUWGMRR0_K1_LBSPPA512_LBSPPB256_MIWT1_1_NLCA1_NLCB1_SU0_SUM0_SUS0_WG32_4_1_WGM1_WGMXCC1_WGMXCCGn1
    SolutionIndex: 50
    SolutionNameMin: Cijk_Ailk_Bjlk_HHS_BH_Bias_FDMN_SPA_AS_SAV_MT32x16x64_MI16x16x1_SN_GRVWA8_GRVWB8_GSU9_GSUC0_GSUWGMRR0_K1_LBSPPA512_LBSPPB256_MIWT1_1_NLCA1_NLCB1_SU0_SUM0_SUS0_WG32_4_1_WGM8_WGMXCC1_WGMXCCGn1
    SolutionIndex: 51
    SolutionNameMin: Cijk_Ailk_Bjlk_HHS_BH_Bias_FDMN_SPA_AS_SAV_MT32x16x128_MI16x16x1_SN_GRVWA4_GRVWB8_GSU9_GSUC0_GSUWGMRR0_K1_LBSPPA512_LBSPPB256_MIWT1_1_NLCA1_NLCB1_SU0_SUM0_SUS0_WG32_4_1_WGM8_WGMXCC1_WGMXCCGn1
    SolutionIndex: 52
    SolutionNameMin: Cijk_Ailk_Bjlk_HHS_BH_Bias_FDMN_SPA_AS_SAV_MT32x16x128_MI16x16x1_SN_GRVWA4_GRVWB2_GSU10_GSUC0_GSUWGMRR0_K1_LBSPPA512_LBSPPB256_MIWT1_1_NLCA1_NLCB1_SU0_SUM0_SUS0_WG32_4_1_WGM1_WGMXCC1_WGMXCCGn1
    SolutionIndex: 53
    SolutionNameMin: Cijk_Ailk_Bjlk_HHS_BH_Bias_FDMN_SPA_AS_SAV_MT32x16x128_MI16x16x1_SN_GRVWA8_GRVWB2_GSU10_GSUC0_GSUWGMRR0_K1_LBSPPA512_LBSPPB256_MIWT1_1_NLCA1_NLCB1_SU0_SUM0_SUS0_WG32_4_1_WGM1_WGMXCC1_WGMXCCGn1
    SolutionIndex: 54
    SolutionNameMin: Cijk_Ailk_Bjlk_HHS_BH_Bias_FDMN_SPA_AS_SAV_MT32x16x128_MI16x16x1_SN_GRVWA8_GRVWB8_GSU10_GSUC0_GSUWGMRR0_K1_LBSPPA512_LBSPPB256_MIWT1_1_NLCA1_NLCB1_SU0_SUM0_SUS0_WG32_4_1_WGM1_WGMXCC1_WGMXCCGn1
    SolutionIndex: 55
    SolutionNameMin: Cijk_Ailk_Bjlk_HHS_BH_Bias_FDMN_SPA_AS_SAV_MT32x16x128_MI16x16x1_SN_GRVWA4_GRVWB2_GSU10_GSUC0_GSUWGMRR0_K1_LBSPPA512_LBSPPB256_MIWT1_1_NLCA1_NLCB1_SU0_SUM0_SUS0_WG32_4_1_WGM8_WGMXCC1_WGMXCCGn1
    SolutionIndex: 56
    SolutionNameMin: Cijk_Ailk_Bjlk_HHS_BH_Bias_FDMN_SPA_AS_SAV_MT64x16x128_MI16x16x1_SN_GRVWA4_GRVWB2_GSU14_GSUC0_GSUWGMRR0_K1_LBSPPA1024_LBSPPB256_MIWT1_1_NLCA1_NLCB1_SU0_SUM0_SUS0_WG64_4_1_WGM1_WGMXCC1_WGMXCCGn1
    SolutionIndex: 57
    SolutionNameMin: Cijk_Ailk_Bjlk_HHS_BH_Bias_FDMN_SPA_AS_SAV_MT64x16x128_MI16x16x1_SN_GRVWA8_GRVWB8_GSU14_GSUC0_GSUWGMRR0_K1_LBSPPA1024_LBSPPB256_MIWT1_1_NLCA1_NLCB1_SU0_SUM0_SUS0_WG64_4_1_WGM8_WGMXCC1_WGMXCCGn1
    SolutionIndex: 58
    SolutionNameMin: Cijk_Ailk_Bjlk_HHS_BH_Bias_FDMN_SPA_AS_SAV_MT32x16x64_MI16x16x1_SN_GRVWA8_GRVWB8_GSU7_GSUC0_GSUWGMRR0_K1_LBSPPA512_LBSPPB256_MIWT1_1_NLCA1_NLCB1_SU0_SUM0_SUS0_WG32_4_1_WGM1_WGMXCC1_WGMXCCGn1
    SolutionIndex: 59
    SolutionNameMin: Cijk_Ailk_Bjlk_HHS_BH_Bias_FDMN_SPA_AS_SAV_MT32x16x128_MI16x16x1_SN_GRVWA4_GRVWB8_GSU7_GSUC0_GSUWGMRR0_K1_LBSPPA512_LBSPPB256_MIWT1_1_NLCA1_NLCB1_SU0_SUM0_SUS0_WG32_4_1_WGM1_WGMXCC1_WGMXCCGn1
    SolutionIndex: 60
    SolutionNameMin: Cijk_Ailk_Bjlk_HHS_BH_Bias_FDMN_SPA_AS_SAV_MT32x16x128_MI16x16x1_SN_GRVWA4_GRVWB2_GSU7_GSUC0_GSUWGMRR0_K1_LBSPPA512_LBSPPB256_MIWT1_1_NLCA1_NLCB1_SU0_SUM0_SUS0_WG32_4_1_WGM8_WGMXCC1_WGMXCCGn1
    SolutionIndex: 61
    SolutionNameMin: Cijk_Ailk_Bjlk_HHS_BH_Bias_FDMN_SPA_AS_SAV_MT64x16x64_MI16x16x1_SN_GRVWA4_GRVWB2_GSU15_GSUC0_GSUWGMRR0_K1_LBSPPA1024_LBSPPB256_MIWT1_1_NLCA1_NLCB1_SU0_SUM0_SUS0_WG64_4_1_WGM1_WGMXCC1_WGMXCCGn1
    SolutionIndex: 62
    SolutionNameMin: Cijk_Ailk_Bjlk_HHS_BH_Bias_FDMN_SPA_AS_SAV_MT64x16x128_MI16x16x1_SN_GRVWA4_GRVWB8_GSU15_GSUC0_GSUWGMRR0_K1_LBSPPA1024_LBSPPB256_MIWT1_1_NLCA1_NLCB1_SU0_SUM0_SUS0_WG64_4_1_WGM8_WGMXCC1_WGMXCCGn1
    SolutionIndex: 63
    SolutionNameMin: Cijk_Ailk_Bjlk_HHS_BH_Bias_FDMN_SPA_AS_SAV_MT64x16x128_MI16x16x1_SN_GRVWA4_GRVWB8_GSU16_GSUC0_GSUWGMRR0_K1_LBSPPA1024_LBSPPB256_MIWT1_1_NLCA1_NLCB1_SU0_SUM0_SUS0_WG64_4_1_WGM1_WGMXCC1_WGMXCCGn1
    SolutionIndex: 64
    SolutionNameMin: Cijk_Ailk_Bjlk_HHS_BH_Bias_FDMN_SPA_AS_SAV_MT64x16x128_MI16x16x1_SN_GRVWA4_GRVWB8_GSU16_GSUC0_GSUWGMRR0_K1_LBSPPA1024_LBSPPB256_MIWT1_1_NLCA1_NLCB1_SU0_SUM0_SUS0_WG64_4_1_WGM8_WGMXCC1_WGMXCCGn1
    SolutionIndex: 65
    SolutionNameMin: Cijk_Ailk_Bjlk_HHS_BH_Bias_FDMN_SPA_AS_SAV_MT32x16x64_MI16x16x1_SN_GRVWA4_GRVWB2_GSU8_GSUC0_GSUWGMRR0_K1_LBSPPA512_LBSPPB256_MIWT1_1_NLCA1_NLCB1_SU0_SUM0_SUS0_WG32_4_1_WGM1_WGMXCC1_WGMXCCGn1
    SolutionIndex: 66
    SolutionNameMin: Cijk_Ailk_Bjlk_HHS_BH_Bias_FDMN_SPA_AS_SAV_MT32x16x64_MI16x16x1_SN_GRVWA4_GRVWB2_GSU8_GSUC0_GSUWGMRR0_K1_LBSPPA512_LBSPPB256_MIWT1_1_NLCA1_NLCB1_SU0_SUM0_SUS0_WG32_4_1_WGM8_WGMXCC1_WGMXCCGn1
    SolutionIndex: 67
    SolutionNameMin: Cijk_Ailk_Bjlk_HHS_BH_Bias_FDMN_SPA_AS_SAV_MT32x16x64_MI16x16x1_SN_GRVWA8_GRVWB8_GSU8_GSUC0_GSUWGMRR0_K1_LBSPPA512_LBSPPB256_MIWT1_1_NLCA1_NLCB1_SU0_SUM0_SUS0_WG32_4_1_WGM8_WGMXCC1_WGMXCCGn1
    SolutionIndex: 68
    SolutionNameMin: Cijk_Ailk_Bjlk_HHS_BH_Bias_FDMN_SPA_AS_SAV_MT32x16x128_MI16x16x1_SN_GRVWA4_GRVWB2_GSU8_GSUC0_GSUWGMRR0_K1_LBSPPA512_LBSPPB256_MIWT1_1_NLCA1_NLCB1_SU0_SUM0_SUS0_WG32_4_1_WGM1_WGMXCC1_WGMXCCGn1
    SolutionIndex: 69
    SolutionNameMin: Cijk_Ailk_Bjlk_HHS_BH_Bias_FDMN_SPA_AS_SAV_MT32x16x128_MI16x16x1_SN_GRVWA8_GRVWB2_GSU8_GSUC0_GSUWGMRR0_K1_LBSPPA512_LBSPPB256_MIWT1_1_NLCA1_NLCB1_SU0_SUM0_SUS0_WG32_4_1_WGM1_WGMXCC1_WGMXCCGn1
    SolutionIndex: 70
    SolutionNameMin: Cijk_Ailk_Bjlk_HHS_BH_Bias_FDMN_SPA_AS_SAV_MT32x16x128_MI16x16x1_SN_GRVWA4_GRVWB8_GSU8_GSUC0_GSUWGMRR0_K1_LBSPPA512_LBSPPB256_MIWT1_1_NLCA1_NLCB1_SU0_SUM0_SUS0_WG32_4_1_WGM1_WGMXCC1_WGMXCCGn1
    SolutionIndex: 71
    SolutionNameMin: Cijk_Ailk_Bjlk_HHS_BH_Bias_FDMN_SPA_AS_SAV_MT32x16x128_MI16x16x1_SN_GRVWA8_GRVWB8_GSU8_GSUC0_GSUWGMRR0_K1_LBSPPA512_LBSPPB256_MIWT1_1_NLCA1_NLCB1_SU0_SUM0_SUS0_WG32_4_1_WGM1_WGMXCC1_WGMXCCGn1
    SolutionIndex: 72
    SolutionNameMin: Cijk_Ailk_Bjlk_HHS_BH_Bias_FDMN_SPA_AS_SAV_MT32x16x128_MI16x16x1_SN_GRVWA8_GRVWB2_GSU8_GSUC0_GSUWGMRR0_K1_LBSPPA512_LBSPPB256_MIWT1_1_NLCA1_NLCB1_SU0_SUM0_SUS0_WG32_4_1_WGM8_WGMXCC1_WGMXCCGn1
    SolutionIndex: 73
    SolutionNameMin: Cijk_Ailk_Bjlk_HHS_BH_Bias_FDMN_SPA_AS_SAV_MT64x16x64_MI16x16x1_SN_GRVWA4_GRVWB2_GSU11_GSUC0_GSUWGMRR0_K1_LBSPPA1024_LBSPPB256_MIWT1_1_NLCA1_NLCB1_SU0_SUM0_SUS0_WG64_4_1_WGM1_WGMXCC1_WGMXCCGn1
    SolutionIndex: 74
    SolutionNameMin: Cijk_Ailk_Bjlk_HHS_BH_Bias_FDMN_SPA_AS_SAV_MT64x16x64_MI16x16x1_SN_GRVWA8_GRVWB2_GSU11_GSUC0_GSUWGMRR0_K1_LBSPPA1024_LBSPPB256_MIWT1_1_NLCA1_NLCB1_SU0_SUM0_SUS0_WG64_4_1_WGM1_WGMXCC1_WGMXCCGn1
    SolutionIndex: 75
    SolutionNameMin: Cijk_Ailk_Bjlk_HHS_BH_Bias_FDMN_SPA_AS_SAV_MT64x16x64_MI16x16x1_SN_GRVWA4_GRVWB2_GSU11_GSUC0_GSUWGMRR0_K1_LBSPPA1024_LBSPPB256_MIWT1_1_NLCA1_NLCB1_SU0_SUM0_SUS0_WG64_4_1_WGM8_WGMXCC1_WGMXCCGn1
    SolutionIndex: 76
    SolutionNameMin: Cijk_Ailk_Bjlk_HHS_BH_Bias_FDMN_SPA_AS_SAV_MT64x16x128_MI16x16x1_SN_GRVWA4_GRVWB2_GSU11_GSUC0_GSUWGMRR0_K1_LBSPPA1024_LBSPPB256_MIWT1_1_NLCA1_NLCB1_SU0_SUM0_SUS0_WG64_4_1_WGM8_WGMXCC1_WGMXCCGn1
    SolutionIndex: 77
    SolutionNameMin: Cijk_Ailk_Bjlk_HHS_BH_Bias_FDMN_SPA_AS_SAV_MT64x16x128_MI16x16x1_SN_GRVWA4_GRVWB2_GSU12_GSUC0_GSUWGMRR0_K1_LBSPPA1024_LBSPPB256_MIWT1_1_NLCA1_NLCB1_SU0_SUM0_SUS0_WG64_4_1_WGM1_WGMXCC1_WGMXCCGn1
    SolutionIndex: 78
    SolutionNameMin: Cijk_Ailk_Bjlk_HHS_BH_Bias_FDMN_SPA_AS_SAV_MT64x16x128_MI16x16x1_SN_GRVWA8_GRVWB2_GSU12_GSUC0_GSUWGMRR0_K1_LBSPPA1024_LBSPPB256_MIWT1_1_NLCA1_NLCB1_SU0_SUM0_SUS0_WG64_4_1_WGM1_WGMXCC1_WGMXCCGn1
    SolutionIndex: 79
    SolutionNameMin: Cijk_Ailk_Bjlk_HHS_BH_Bias_FDMN_SPA_AS_SAV_MT64x16x128_MI16x16x1_SN_GRVWA4_GRVWB2_GSU12_GSUC0_GSUWGMRR0_K1_LBSPPA1024_LBSPPB256_MIWT1_1_NLCA1_NLCB1_SU0_SUM0_SUS0_WG64_4_1_WGM8_WGMXCC1_WGMXCCGn1
    SolutionIndex: 80
    SolutionNameMin: Cijk_Ailk_Bjlk_HHS_BH_Bias_FDMN_SPA_AS_SAV_MT32x16x64_MI16x16x1_SN_GRVWA4_GRVWB2_GSU6_GSUC0_GSUWGMRR0_K1_LBSPPA512_LBSPPB256_MIWT1_1_NLCA1_NLCB1_SU0_SUM0_SUS0_WG32_4_1_WGM1_WGMXCC1_WGMXCCGn1
    SolutionIndex: 81
    SolutionNameMin: Cijk_Ailk_Bjlk_HHS_BH_Bias_FDMN_SPA_AS_SAV_MT32x16x128_MI16x16x1_SN_GRVWA4_GRVWB8_GSU6_GSUC0_GSUWGMRR0_K1_LBSPPA512_LBSPPB256_MIWT1_1_NLCA1_NLCB1_SU0_SUM0_SUS0_WG32_4_1_WGM1_WGMXCC1_WGMXCCGn1
    SolutionIndex: 82
    SolutionNameMin: Cijk_Ailk_Bjlk_HHS_BH_Bias_FDMN_SPA_AS_SAV_MT32x16x128_MI16x16x1_SN_GRVWA8_GRVWB8_GSU6_GSUC0_GSUWGMRR0_K1_LBSPPA512_LBSPPB256_MIWT1_1_NLCA1_NLCB1_SU0_SUM0_SUS0_WG32_4_1_WGM1_WGMXCC1_WGMXCCGn1
    SolutionIndex: 83
    SolutionNameMin: Cijk_Ailk_Bjlk_HHS_BH_Bias_FDMN_SPA_AS_SAV_MT32x16x128_MI16x16x1_SN_GRVWA8_GRVWB8_GSU6_GSUC0_GSUWGMRR0_K1_LBSPPA512_LBSPPB256_MIWT1_1_NLCA1_NLCB1_SU0_SUM0_SUS0_WG32_4_1_WGM8_WGMXCC1_WGMXCCGn1
    SolutionIndex: 84
    SolutionNameMin: Cijk_Ailk_Bjlk_HHS_BH_Bias_FDMN_SPA_AS_SAV_MT64x16x64_MI16x16x1_SN_GRVWA4_GRVWB2_GSU9_GSUC0_GSUWGMRR0_K1_LBSPPA1024_LBSPPB256_MIWT1_1_NLCA1_NLCB1_SU0_SUM0_SUS0_WG64_4_1_WGM1_WGMXCC1_WGMXCCGn1
    SolutionIndex: 85
    SolutionNameMin: Cijk_Ailk_Bjlk_HHS_BH_Bias_FDMN_SPA_AS_SAV_MT64x16x128_MI16x16x1_SN_GRVWA8_GRVWB2_GSU10_GSUC0_GSUWGMRR0_K1_LBSPPA1024_LBSPPB256_MIWT1_1_NLCA1_NLCB1_SU0_SUM0_SUS0_WG64_4_1_WGM1_WGMXCC1_WGMXCCGn1
    SolutionIndex: 86
    SolutionNameMin: Cijk_Ailk_Bjlk_HHS_BH_Bias_FDMN_SPA_AS_SAV_MT32x16x128_MI16x16x1_SN_GRVWA4_GRVWB2_GSU5_GSUC0_GSUWGMRR0_K1_LBSPPA512_LBSPPB256_MIWT1_1_NLCA1_NLCB1_SU0_SUM0_SUS0_WG32_4_1_WGM8_WGMXCC1_WGMXCCGn1
    SolutionIndex: 87
    SolutionNameMin: Cijk_Ailk_Bjlk_HHS_BH_Bias_FDMN_SPA_AS_SAV_MT64x16x64_MI16x16x1_SN_GRVWA4_GRVWB2_GSU7_GSUC0_GSUWGMRR0_K1_LBSPPA1024_LBSPPB256_MIWT1_1_NLCA1_NLCB1_SU0_SUM0_SUS0_WG64_4_1_WGM1_WGMXCC1_WGMXCCGn1
    SolutionIndex: 88
    SolutionNameMin: Cijk_Ailk_Bjlk_HHS_BH_Bias_FDMN_SPA_AS_SAV_MT64x16x128_MI16x16x1_SN_GRVWA4_GRVWB2_GSU8_GSUC0_GSUWGMRR0_K1_LBSPPA1024_LBSPPB256_MIWT1_1_NLCA1_NLCB1_SU0_SUM0_SUS0_WG64_4_1_WGM1_WGMXCC1_WGMXCCGn1
    SolutionIndex: 89
    SolutionNameMin: Cijk_Ailk_Bjlk_HHS_BH_Bias_FDMN_SPA_AS_SAV_MT64x16x128_MI16x16x1_SN_GRVWA8_GRVWB2_GSU8_GSUC0_GSUWGMRR0_K1_LBSPPA1024_LBSPPB256_MIWT1_1_NLCA1_NLCB1_SU0_SUM0_SUS0_WG64_4_1_WGM1_WGMXCC1_WGMXCCGn1
    SolutionIndex: 90
    SolutionNameMin: Cijk_Ailk_Bjlk_HHS_BH_Bias_FDMN_SPA_AS_SAV_MT64x16x128_MI16x16x1_SN_GRVWA4_GRVWB8_GSU8_GSUC0_GSUWGMRR0_K1_LBSPPA1024_LBSPPB256_MIWT1_1_NLCA1_NLCB1_SU0_SUM0_SUS0_WG64_4_1_WGM8_WGMXCC1_WGMXCCGn1
    SolutionIndex: 91
    SolutionNameMin: Cijk_Ailk_Bjlk_HHS_BH_Bias_FDMN_SPA_AS_SAV_MT128x16x64_MI16x16x1_SN_GRVWA8_GRVWB2_GSU16_GSUC0_GSUWGMRR0_K1_LBSPPA2048_LBSPPB256_MIWT2_1_NLCA1_NLCB1_SU0_SUM0_SUS0_WG64_4_1_WGM1_WGMXCC1_WGMXCCGn1
    SolutionIndex: 92
    SolutionNameMin: Cijk_Ailk_Bjlk_HHS_BH_Bias_FDMN_SPA_AS_SAV_MT128x16x64_MI16x16x1_SN_GRVWA8_GRVWB2_GSU16_GSUC0_GSUWGMRR0_K1_LBSPPA2048_LBSPPB256_MIWT2_1_NLCA1_NLCB1_SU0_SUM0_SUS0_WG64_4_1_WGM8_WGMXCC1_WGMXCCGn1
    SolutionIndex: 93
    SolutionNameMin: Cijk_Ailk_Bjlk_HHS_BH_Bias_FDMN_SPA_AS_SAV_MT128x16x128_MI16x16x1_SN_GRVWA4_GRVWB8_GSU16_GSUC0_GSUWGMRR0_K1_LBSPPA2048_LBSPPB256_MIWT2_1_NLCA1_NLCB1_SU0_SUM0_SUS0_WG64_4_1_WGM1_WGMXCC1_WGMXCCGn1
    SolutionIndex: 94
    SolutionNameMin: Cijk_Ailk_Bjlk_HHS_BH_Bias_FDMN_SPA_AS_SAV_MT32x16x128_MI16x16x1_SN_GRVWA4_GRVWB2_GSU4_GSUC0_GSUWGMRR0_K1_LBSPPA512_LBSPPB256_MIWT1_1_NLCA1_NLCB1_SU0_SUM0_SUS0_WG32_4_1_WGM1_WGMXCC1_WGMXCCGn1
    SolutionIndex: 95
    SolutionNameMin: Cijk_Ailk_Bjlk_HHS_BH_Bias_FDMN_SPA_AS_SAV_MT32x16x128_MI16x16x1_SN_GRVWA4_GRVWB8_GSU4_GSUC0_GSUWGMRR0_K1_LBSPPA512_LBSPPB256_MIWT1_1_NLCA1_NLCB1_SU0_SUM0_SUS0_WG32_4_1_WGM1_WGMXCC1_WGMXCCGn1
    SolutionIndex: 96
    SolutionNameMin: Cijk_Ailk_Bjlk_HHS_BH_Bias_FDMN_SPA_AS_SAV_MT32x16x128_MI16x16x1_SN_GRVWA8_GRVWB8_GSU4_GSUC0_GSUWGMRR0_K1_LBSPPA512_LBSPPB256_MIWT1_1_NLCA1_NLCB1_SU0_SUM0_SUS0_WG32_4_1_WGM1_WGMXCC1_WGMXCCGn1
    SolutionIndex: 97
    SolutionNameMin: Cijk_Ailk_Bjlk_HHS_BH_Bias_FDMN_SPA_AS_SAV_MT64x16x128_MI16x16x1_SN_GRVWA8_GRVWB2_GSU6_GSUC0_GSUWGMRR0_K1_LBSPPA1024_LBSPPB256_MIWT1_1_NLCA1_NLCB1_SU0_SUM0_SUS0_WG64_4_1_WGM1_WGMXCC1_WGMXCCGn1
    SolutionIndex: 98
    SolutionNameMin: Cijk_Ailk_Bjlk_HHS_BH_Bias_FDMN_SPA_AS_SAV_MT64x16x128_MI16x16x1_SN_GRVWA8_GRVWB8_GSU6_GSUC0_GSUWGMRR0_K1_LBSPPA1024_LBSPPB256_MIWT1_1_NLCA1_NLCB1_SU0_SUM0_SUS0_WG64_4_1_WGM1_WGMXCC1_WGMXCCGn1
    SolutionIndex: 99
    SolutionNameMin: Cijk_Ailk_Bjlk_HHS_BH_Bias_FDMN_SPA_AS_SAV_MT128x16x64_MI16x16x1_SN_GRVWA8_GRVWB2_GSU12_GSUC0_GSUWGMRR0_K1_LBSPPA2048_LBSPPB256_MIWT2_1_NLCA1_NLCB1_SU0_SUM0_SUS0_WG64_4_1_WGM8_WGMXCC1_WGMXCCGn1
    SolutionIndex: 100
    SolutionNameMin: Cijk_Ailk_Bjlk_HHS_BH_Bias_FDMN_SPA_AS_SAV_MT64x16x128_MI16x16x1_SN_GRVWA8_GRVWB2_GSU4_GSUC0_GSUWGMRR0_K1_LBSPPA1024_LBSPPB256_MIWT1_1_NLCA1_NLCB1_SU0_SUM0_SUS0_WG64_4_1_WGM1_WGMXCC1_WGMXCCGn1
    SolutionIndex: 101
    SolutionNameMin: Cijk_Ailk_Bjlk_HHS_BH_Bias_FDMN_SPA_AS_SAV_MT64x16x128_MI16x16x1_SN_GRVWA4_GRVWB8_GSU4_GSUC0_GSUWGMRR0_K1_LBSPPA1024_LBSPPB256_MIWT1_1_NLCA1_NLCB1_SU0_SUM0_SUS0_WG64_4_1_WGM1_WGMXCC1_WGMXCCGn1
    SolutionIndex: 102
    SolutionNameMin: Cijk_Ailk_Bjlk_HHS_BH_Bias_FDMN_SPA_AS_SAV_MT64x16x128_MI16x16x1_SN_GRVWA8_GRVWB8_GSU4_GSUC0_GSUWGMRR0_K1_LBSPPA1024_LBSPPB256_MIWT1_1_NLCA1_NLCB1_SU0_SUM0_SUS0_WG64_4_1_WGM1_WGMXCC1_WGMXCCGn1
    SolutionIndex: 103
    SolutionNameMin: Cijk_Ailk_Bjlk_HHS_BH_Bias_FDMN_SPA_AS_SAV_MT64x16x128_MI16x16x1_SN_GRVWA4_GRVWB8_GSU4_GSUC0_GSUWGMRR0_K1_LBSPPA1024_LBSPPB256_MIWT1_1_NLCA1_NLCB1_SU0_SUM0_SUS0_WG64_4_1_WGM8_WGMXCC1_WGMXCCGn1
    SolutionIndex: 104
    SolutionNameMin: Cijk_Ailk_Bjlk_HHS_BH_Bias_FDMN_SPA_AS_SAV_MT128x16x128_MI16x16x1_SN_GRVWA8_GRVWB2_GSU8_GSUC0_GSUWGMRR0_K1_LBSPPA2048_LBSPPB256_MIWT2_1_NLCA1_NLCB1_SU0_SUM0_SUS0_WG64_4_1_WGM1_WGMXCC1_WGMXCCGn1
    SolutionIndex: 105
    SolutionNameMin: Cijk_Ailk_Bjlk_HHS_BH_Bias_FDMN_SPA_AS_SAV_MT16x32x64_MI16x16x1_SN_GRVWA4_GRVWB8_GSU16_GSUC0_GSUWGMRR0_K1_LBSPPA256_LBSPPB512_MIWT1_1_NLCA1_NLCB1_SU0_SUM0_SUS0_WG16_8_1_WGM8_WGMXCC1_WGMXCCGn1
    SolutionIndex: 106
    SolutionNameMin: Cijk_Ailk_Bjlk_HHS_BH_Bias_FDMN_SPA_AS_SAV_MT16x32x128_MI16x16x1_SN_GRVWA4_GRVWB8_GSU16_GSUC0_GSUWGMRR0_K1_LBSPPA256_LBSPPB512_MIWT1_1_NLCA1_NLCB1_SU0_SUM0_SUS0_WG16_8_1_WGM1_WGMXCC1_WGMXCCGn1
    SolutionIndex: 107
    SolutionNameMin: Cijk_Ailk_Bjlk_HHS_BH_Bias_FDMN_SPA_AS_SAV_MT16x32x128_MI16x16x1_SN_GRVWA8_GRVWB2_GSU16_GSUC0_GSUWGMRR0_K1_LBSPPA256_LBSPPB512_MIWT1_1_NLCA1_NLCB1_SU0_SUM0_SUS0_WG16_8_1_WGM8_WGMXCC1_WGMXCCGn1
    SolutionIndex: 108
    SolutionNameMin: Cijk_Ailk_Bjlk_HHS_BH_Bias_FDMN_SPA_AS_SAV_MT16x32x64_MI16x16x1_SN_GRVWA4_GRVWB2_GSU14_GSUC0_GSUWGMRR0_K1_LBSPPA256_LBSPPB512_MIWT1_1_NLCA1_NLCB1_SU0_SUM0_SUS0_WG16_8_1_WGM1_WGMXCC1_WGMXCCGn1
    SolutionIndex: 109
    SolutionNameMin: Cijk_Ailk_Bjlk_HHS_BH_Bias_FDMN_SPA_AS_SAV_MT16x32x128_MI16x16x1_SN_GRVWA8_GRVWB2_GSU14_GSUC0_GSUWGMRR0_K1_LBSPPA256_LBSPPB512_MIWT1_1_NLCA1_NLCB1_SU0_SUM0_SUS0_WG16_8_1_WGM1_WGMXCC1_WGMXCCGn1
    SolutionIndex: 110
    SolutionNameMin: Cijk_Ailk_Bjlk_HHS_BH_Bias_FDMN_SPA_AS_SAV_MT16x32x128_MI16x16x1_SN_GRVWA8_GRVWB2_GSU11_GSUC0_GSUWGMRR0_K1_LBSPPA256_LBSPPB512_MIWT1_1_NLCA1_NLCB1_SU0_SUM0_SUS0_WG16_8_1_WGM1_WGMXCC1_WGMXCCGn1
    SolutionIndex: 111
    SolutionNameMin: Cijk_Ailk_Bjlk_HHS_BH_Bias_FDMN_SPA_AS_SAV_MT16x32x64_MI16x16x1_SN_GRVWA4_GRVWB8_GSU12_GSUC0_GSUWGMRR0_K1_LBSPPA256_LBSPPB512_MIWT1_1_NLCA1_NLCB1_SU0_SUM0_SUS0_WG16_8_1_WGM8_WGMXCC1_WGMXCCGn1
    SolutionIndex: 112
    SolutionNameMin: Cijk_Ailk_Bjlk_HHS_BH_Bias_FDMN_SPA_AS_SAV_MT16x32x128_MI16x16x1_SN_GRVWA4_GRVWB8_GSU12_GSUC0_GSUWGMRR0_K1_LBSPPA256_LBSPPB512_MIWT1_1_NLCA1_NLCB1_SU0_SUM0_SUS0_WG16_8_1_WGM1_WGMXCC1_WGMXCCGn1
    SolutionIndex: 113
    SolutionNameMin: Cijk_Ailk_Bjlk_HHS_BH_Bias_FDMN_SPA_AS_SAV_MT16x32x128_MI16x16x1_SN_GRVWA8_GRVWB8_GSU12_GSUC0_GSUWGMRR0_K1_LBSPPA256_LBSPPB512_MIWT1_1_NLCA1_NLCB1_SU0_SUM0_SUS0_WG16_8_1_WGM1_WGMXCC1_WGMXCCGn1
    SolutionIndex: 114
    SolutionNameMin: Cijk_Ailk_Bjlk_HHS_BH_Bias_FDMN_SPA_AS_SAV_MT16x32x128_MI16x16x1_SN_GRVWA8_GRVWB8_GSU12_GSUC0_GSUWGMRR0_K1_LBSPPA256_LBSPPB512_MIWT1_1_NLCA1_NLCB1_SU0_SUM0_SUS0_WG16_8_1_WGM8_WGMXCC1_WGMXCCGn1
    SolutionIndex: 115
    SolutionNameMin: Cijk_Ailk_Bjlk_HHS_BH_Bias_FDMN_SPA_AS_SAV_MT16x32x128_MI16x16x1_SN_GRVWA8_GRVWB2_GSU13_GSUC0_GSUWGMRR0_K1_LBSPPA256_LBSPPB512_MIWT1_1_NLCA1_NLCB1_SU0_SUM0_SUS0_WG16_8_1_WGM8_WGMXCC1_WGMXCCGn1
    SolutionIndex: 116
    SolutionNameMin: Cijk_Ailk_Bjlk_HHS_BH_Bias_FDMN_SPA_AS_SAV_MT16x32x64_MI16x16x1_SN_GRVWA4_GRVWB2_GSU9_GSUC0_GSUWGMRR0_K1_LBSPPA256_LBSPPB512_MIWT1_1_NLCA1_NLCB1_SU0_SUM0_SUS0_WG16_8_1_WGM8_WGMXCC1_WGMXCCGn1
    SolutionIndex: 117
    SolutionNameMin: Cijk_Ailk_Bjlk_HHS_BH_Bias_FDMN_SPA_AS_SAV_MT16x32x128_MI16x16x1_SN_GRVWA8_GRVWB8_GSU9_GSUC0_GSUWGMRR0_K1_LBSPPA256_LBSPPB512_MIWT1_1_NLCA1_NLCB1_SU0_SUM0_SUS0_WG16_8_1_WGM8_WGMXCC1_WGMXCCGn1
    SolutionIndex: 118
    SolutionNameMin: Cijk_Ailk_Bjlk_HHS_BH_Bias_FDMN_SPA_AS_SAV_MT16x32x128_MI16x16x1_SN_GRVWA8_GRVWB2_GSU10_GSUC0_GSUWGMRR0_K1_LBSPPA256_LBSPPB512_MIWT1_1_NLCA1_NLCB1_SU0_SUM0_SUS0_WG16_8_1_WGM8_WGMXCC1_WGMXCCGn1
    SolutionIndex: 119
    SolutionNameMin: Cijk_Ailk_Bjlk_HHS_BH_Bias_FDMN_SPA_AS_SAV_MT32x32x64_MI16x16x1_SN_GRVWA4_GRVWB2_GSU16_GSUC0_GSUWGMRR0_K1_LBSPPA512_LBSPPB512_MIWT1_1_NLCA1_NLCB1_SU0_SUM0_SUS0_WG32_8_1_WGM1_WGMXCC1_WGMXCCGn1
    SolutionIndex: 120
    SolutionNameMin: Cijk_Ailk_Bjlk_HHS_BH_Bias_FDMN_SPA_AS_SAV_MT32x32x64_MI16x16x1_SN_GRVWA4_GRVWB8_GSU16_GSUC0_GSUWGMRR0_K1_LBSPPA512_LBSPPB512_MIWT1_1_NLCA1_NLCB1_SU0_SUM0_SUS0_WG32_8_1_WGM1_WGMXCC1_WGMXCCGn1
    SolutionIndex: 121
    SolutionNameMin: Cijk_Ailk_Bjlk_HHS_BH_Bias_FDMN_SPA_AS_SAV_MT32x32x64_MI16x16x1_SN_GRVWA4_GRVWB2_GSU16_GSUC0_GSUWGMRR0_K1_LBSPPA512_LBSPPB512_MIWT1_1_NLCA1_NLCB1_SU0_SUM0_SUS0_WG32_8_1_WGM8_WGMXCC1_WGMXCCGn1
    SolutionIndex: 122
    SolutionNameMin: Cijk_Ailk_Bjlk_HHS_BH_Bias_FDMN_SPA_AS_SAV_MT32x32x128_MI16x16x1_SN_GRVWA4_GRVWB2_GSU16_GSUC0_GSUWGMRR0_K1_LBSPPA512_LBSPPB512_MIWT1_1_NLCA1_NLCB1_SU0_SUM0_SUS0_WG32_8_1_WGM1_WGMXCC1_WGMXCCGn1
    SolutionIndex: 123
    SolutionNameMin: Cijk_Ailk_Bjlk_HHS_BH_Bias_FDMN_SPA_AS_SAV_MT16x32x64_MI16x16x1_SN_GRVWA4_GRVWB2_GSU8_GSUC0_GSUWGMRR0_K1_LBSPPA256_LBSPPB512_MIWT1_1_NLCA1_NLCB1_SU0_SUM0_SUS0_WG16_8_1_WGM1_WGMXCC1_WGMXCCGn1
    SolutionIndex: 124
    SolutionNameMin: Cijk_Ailk_Bjlk_HHS_BH_Bias_FDMN_SPA_AS_SAV_MT16x32x64_MI16x16x1_SN_GRVWA4_GRVWB2_GSU8_GSUC0_GSUWGMRR0_K1_LBSPPA256_LBSPPB512_MIWT1_1_NLCA1_NLCB1_SU0_SUM0_SUS0_WG16_8_1_WGM8_WGMXCC1_WGMXCCGn1
    SolutionIndex: 125
    SolutionNameMin: Cijk_Ailk_Bjlk_HHS_BH_Bias_FDMN_SPA_AS_SAV_MT16x32x64_MI16x16x1_SN_GRVWA4_GRVWB8_GSU8_GSUC0_GSUWGMRR0_K1_LBSPPA256_LBSPPB512_MIWT1_1_NLCA1_NLCB1_SU0_SUM0_SUS0_WG16_8_1_WGM8_WGMXCC1_WGMXCCGn1
    SolutionIndex: 126
    SolutionNameMin: Cijk_Ailk_Bjlk_HHS_BH_Bias_FDMN_SPA_AS_SAV_MT16x32x128_MI16x16x1_SN_GRVWA8_GRVWB2_GSU8_GSUC0_GSUWGMRR0_K1_LBSPPA256_LBSPPB512_MIWT1_1_NLCA1_NLCB1_SU0_SUM0_SUS0_WG16_8_1_WGM1_WGMXCC1_WGMXCCGn1
    SolutionIndex: 127
    SolutionNameMin: Cijk_Ailk_Bjlk_HHS_BH_Bias_FDMN_SPA_AS_SAV_MT32x32x64_MI16x16x1_SN_GRVWA4_GRVWB2_GSU14_GSUC0_GSUWGMRR0_K1_LBSPPA512_LBSPPB512_MIWT1_1_NLCA1_NLCB1_SU0_SUM0_SUS0_WG32_8_1_WGM1_WGMXCC1_WGMXCCGn1
    SolutionIndex: 128
    SolutionNameMin: Cijk_Ailk_Bjlk_HHS_BH_Bias_FDMN_SPA_AS_SAV_MT32x32x128_MI16x16x1_SN_GRVWA8_GRVWB2_GSU14_GSUC0_GSUWGMRR0_K1_LBSPPA512_LBSPPB512_MIWT1_1_NLCA1_NLCB1_SU0_SUM0_SUS0_WG32_8_1_WGM1_WGMXCC1_WGMXCCGn1
    SolutionIndex: 129
    SolutionNameMin: Cijk_Ailk_Bjlk_HHS_BH_Bias_FDMN_SPA_AS_SAV_MT32x32x128_MI16x16x1_SN_GRVWA4_GRVWB8_GSU14_GSUC0_GSUWGMRR0_K1_LBSPPA512_LBSPPB512_MIWT1_1_NLCA1_NLCB1_SU0_SUM0_SUS0_WG32_8_1_WGM8_WGMXCC1_WGMXCCGn1
    SolutionIndex: 130
    SolutionNameMin: Cijk_Ailk_Bjlk_HHS_BH_Bias_FDMN_SPA_AS_SAV_MT16x32x64_MI16x16x1_SN_GRVWA4_GRVWB8_GSU7_GSUC0_GSUWGMRR0_K1_LBSPPA256_LBSPPB512_MIWT1_1_NLCA1_NLCB1_SU0_SUM0_SUS0_WG16_8_1_WGM1_WGMXCC1_WGMXCCGn1
    SolutionIndex: 131
    SolutionNameMin: Cijk_Ailk_Bjlk_HHS_BH_Bias_FDMN_SPA_AS_SAV_MT16x32x128_MI16x16x1_SN_GRVWA8_GRVWB2_GSU7_GSUC0_GSUWGMRR0_K1_LBSPPA256_LBSPPB512_MIWT1_1_NLCA1_NLCB1_SU0_SUM0_SUS0_WG16_8_1_WGM1_WGMXCC1_WGMXCCGn1
    SolutionIndex: 132
    SolutionNameMin: Cijk_Ailk_Bjlk_HHS_BH_Bias_FDMN_SPA_AS_SAV_MT16x32x128_MI16x16x1_SN_GRVWA4_GRVWB8_GSU7_GSUC0_GSUWGMRR0_K1_LBSPPA256_LBSPPB512_MIWT1_1_NLCA1_NLCB1_SU0_SUM0_SUS0_WG16_8_1_WGM1_WGMXCC1_WGMXCCGn1
    SolutionIndex: 133
    SolutionNameMin: Cijk_Ailk_Bjlk_HHS_BH_Bias_FDMN_SPA_AS_SAV_MT32x32x64_MI16x16x1_SN_GRVWA4_GRVWB8_GSU11_GSUC0_GSUWGMRR0_K1_LBSPPA512_LBSPPB512_MIWT1_1_NLCA1_NLCB1_SU0_SUM0_SUS0_WG32_8_1_WGM1_WGMXCC1_WGMXCCGn1
    SolutionIndex: 134
    SolutionNameMin: Cijk_Ailk_Bjlk_HHS_BH_Bias_FDMN_SPA_AS_SAV_MT32x32x64_MI16x16x1_SN_GRVWA4_GRVWB8_GSU11_GSUC0_GSUWGMRR0_K1_LBSPPA512_LBSPPB512_MIWT1_1_NLCA1_NLCB1_SU0_SUM0_SUS0_WG32_8_1_WGM8_WGMXCC1_WGMXCCGn1
    SolutionIndex: 135
    SolutionNameMin: Cijk_Ailk_Bjlk_HHS_BH_Bias_FDMN_SPA_AS_SAV_MT32x32x128_MI16x16x1_SN_GRVWA8_GRVWB8_GSU11_GSUC0_GSUWGMRR0_K1_LBSPPA512_LBSPPB512_MIWT1_1_NLCA1_NLCB1_SU0_SUM0_SUS0_WG32_8_1_WGM1_WGMXCC1_WGMXCCGn1
    SolutionIndex: 136
    SolutionNameMin: Cijk_Ailk_Bjlk_HHS_BH_Bias_FDMN_SPA_AS_SAV_MT32x32x128_MI16x16x1_SN_GRVWA8_GRVWB8_GSU11_GSUC0_GSUWGMRR0_K1_LBSPPA512_LBSPPB512_MIWT1_1_NLCA1_NLCB1_SU0_SUM0_SUS0_WG32_8_1_WGM8_WGMXCC1_WGMXCCGn1
    SolutionIndex: 137
    SolutionNameMin: Cijk_Ailk_Bjlk_HHS_BH_Bias_FDMN_SPA_AS_SAV_MT32x32x64_MI16x16x1_SN_GRVWA4_GRVWB8_GSU12_GSUC0_GSUWGMRR0_K1_LBSPPA512_LBSPPB512_MIWT1_1_NLCA1_NLCB1_SU0_SUM0_SUS0_WG32_8_1_WGM8_WGMXCC1_WGMXCCGn1
    SolutionIndex: 138
    SolutionNameMin: Cijk_Ailk_Bjlk_HHS_BH_Bias_FDMN_SPA_AS_SAV_MT32x32x128_MI16x16x1_SN_GRVWA4_GRVWB2_GSU12_GSUC0_GSUWGMRR0_K1_LBSPPA512_LBSPPB512_MIWT1_1_NLCA1_NLCB1_SU0_SUM0_SUS0_WG32_8_1_WGM8_WGMXCC1_WGMXCCGn1
    SolutionIndex: 139
    SolutionNameMin: Cijk_Ailk_Bjlk_HHS_BH_Bias_FDMN_SPA_AS_SAV_MT32x32x128_MI16x16x1_SN_GRVWA8_GRVWB8_GSU12_GSUC0_GSUWGMRR0_K1_LBSPPA512_LBSPPB512_MIWT1_1_NLCA1_NLCB1_SU0_SUM0_SUS0_WG32_8_1_WGM8_WGMXCC1_WGMXCCGn1
    SolutionIndex: 140
    SolutionNameMin: Cijk_Ailk_Bjlk_HHS_BH_Bias_FDMN_SPA_AS_SAV_MT16x32x128_MI16x16x1_SN_GRVWA8_GRVWB8_GSU6_GSUC0_GSUWGMRR0_K1_LBSPPA256_LBSPPB512_MIWT1_1_NLCA1_NLCB1_SU0_SUM0_SUS0_WG16_8_1_WGM1_WGMXCC1_WGMXCCGn1
    SolutionIndex: 141
    SolutionNameMin: Cijk_Ailk_Bjlk_HHS_BH_Bias_FDMN_SPA_AS_SAV_MT32x32x64_MI16x16x1_SN_GRVWA4_GRVWB2_GSU9_GSUC0_GSUWGMRR0_K1_LBSPPA512_LBSPPB512_MIWT1_1_NLCA1_NLCB1_SU0_SUM0_SUS0_WG32_8_1_WGM1_WGMXCC1_WGMXCCGn1
    SolutionIndex: 142
    SolutionNameMin: Cijk_Ailk_Bjlk_HHS_BH_Bias_FDMN_SPA_AS_SAV_MT32x32x64_MI16x16x1_SN_GRVWA4_GRVWB8_GSU9_GSUC0_GSUWGMRR0_K1_LBSPPA512_LBSPPB512_MIWT1_1_NLCA1_NLCB1_SU0_SUM0_SUS0_WG32_8_1_WGM1_WGMXCC1_WGMXCCGn1
    SolutionIndex: 143
    SolutionNameMin: Cijk_Ailk_Bjlk_HHS_BH_Bias_FDMN_SPA_AS_SAV_MT32x32x64_MI16x16x1_SN_GRVWA4_GRVWB2_GSU9_GSUC0_GSUWGMRR0_K1_LBSPPA512_LBSPPB512_MIWT1_1_NLCA1_NLCB1_SU0_SUM0_SUS0_WG32_8_1_WGM8_WGMXCC1_WGMXCCGn1
    SolutionIndex: 144
    SolutionNameMin: Cijk_Ailk_Bjlk_HHS_BH_Bias_FDMN_SPA_AS_SAV_MT32x32x128_MI16x16x1_SN_GRVWA8_GRVWB2_GSU9_GSUC0_GSUWGMRR0_K1_LBSPPA512_LBSPPB512_MIWT1_1_NLCA1_NLCB1_SU0_SUM0_SUS0_WG32_8_1_WGM1_WGMXCC1_WGMXCCGn1
    SolutionIndex: 145
    SolutionNameMin: Cijk_Ailk_Bjlk_HHS_BH_Bias_FDMN_SPA_AS_SAV_MT32x32x128_MI16x16x1_SN_GRVWA4_GRVWB8_GSU9_GSUC0_GSUWGMRR0_K1_LBSPPA512_LBSPPB512_MIWT1_1_NLCA1_NLCB1_SU0_SUM0_SUS0_WG32_8_1_WGM1_WGMXCC1_WGMXCCGn1
    SolutionIndex: 146
    SolutionNameMin: Cijk_Ailk_Bjlk_HHS_BH_Bias_FDMN_SPA_AS_SAV_MT32x32x128_MI16x16x1_SN_GRVWA8_GRVWB8_GSU9_GSUC0_GSUWGMRR0_K1_LBSPPA512_LBSPPB512_MIWT1_1_NLCA1_NLCB1_SU0_SUM0_SUS0_WG32_8_1_WGM1_WGMXCC1_WGMXCCGn1
    SolutionIndex: 147
    SolutionNameMin: Cijk_Ailk_Bjlk_HHS_BH_Bias_FDMN_SPA_AS_SAV_MT32x32x128_MI16x16x1_SN_GRVWA8_GRVWB8_GSU9_GSUC0_GSUWGMRR0_K1_LBSPPA512_LBSPPB512_MIWT1_1_NLCA1_NLCB1_SU0_SUM0_SUS0_WG32_8_1_WGM8_WGMXCC1_WGMXCCGn1
    SolutionIndex: 148
    SolutionNameMin: Cijk_Ailk_Bjlk_HHS_BH_Bias_FDMN_SPA_AS_SAV_MT32x32x128_MI16x16x1_SN_GRVWA8_GRVWB8_GSU10_GSUC0_GSUWGMRR0_K1_LBSPPA512_LBSPPB512_MIWT1_1_NLCA1_NLCB1_SU0_SUM0_SUS0_WG32_8_1_WGM8_WGMXCC1_WGMXCCGn1
    SolutionIndex: 149
    SolutionNameMin: Cijk_Ailk_Bjlk_HHS_BH_Bias_FDMN_SPA_AS_SAV_MT32x32x128_MI16x16x1_SN_GRVWA4_GRVWB2_GSU7_GSUC0_GSUWGMRR0_K1_LBSPPA512_LBSPPB512_MIWT1_1_NLCA1_NLCB1_SU0_SUM0_SUS0_WG32_8_1_WGM1_WGMXCC1_WGMXCCGn1
    SolutionIndex: 150
    SolutionNameMin: Cijk_Ailk_Bjlk_HHS_BH_Bias_FDMN_SPA_AS_SAV_MT64x32x64_MI16x16x1_SN_GRVWA8_GRVWB2_GSU14_GSUC0_GSUWGMRR0_K1_LBSPPA1024_LBSPPB512_MIWT2_1_NLCA1_NLCB1_SU0_SUM0_SUS0_WG32_8_1_WGM1_WGMXCC1_WGMXCCGn1
    SolutionIndex: 151
    SolutionNameMin: Cijk_Ailk_Bjlk_HHS_BH_Bias_FDMN_SPA_AS_SAV_MT64x32x128_MI16x16x1_SN_GRVWA8_GRVWB8_GSU11_GSUC0_GSUWGMRR0_K1_LBSPPA1024_LBSPPB512_MIWT1_2_NLCA1_NLCB1_SU0_SUM0_SUS0_WG64_4_1_WGM8_WGMXCC1_WGMXCCGn1
    SolutionIndex: 152
    SolutionNameMin: Cijk_Ailk_Bjlk_HHS_BH_Bias_FDMN_SPA_AS_SAV_MT64x32x64_MI16x16x1_SN_GRVWA8_GRVWB2_GSU11_GSUC0_GSUWGMRR0_K1_LBSPPA1024_LBSPPB512_MIWT2_1_NLCA1_NLCB1_SU0_SUM0_SUS0_WG32_8_1_WGM1_WGMXCC1_WGMXCCGn1
    SolutionIndex: 153
    SolutionNameMin: Cijk_Ailk_Bjlk_HHS_BH_Bias_FDMN_SPA_AS_SAV_MT64x32x64_MI16x16x1_SN_GRVWA4_GRVWB8_GSU11_GSUC0_GSUWGMRR0_K1_LBSPPA1024_LBSPPB512_MIWT2_1_NLCA1_NLCB1_SU0_SUM0_SUS0_WG32_8_1_WGM1_WGMXCC1_WGMXCCGn1
    SolutionIndex: 154
    SolutionNameMin: Cijk_Ailk_Bjlk_HHS_BH_Bias_FDMN_SPA_AS_SAV_MT96x32x64_MI16x16x1_SN_GRVWA4_GRVWB2_GSU16_GSUC0_GSUWGMRR0_K1_LBSPPA1536_LBSPPB512_MIWT3_1_NLCA3_NLCB1_SU0_SUM0_SUS0_WG32_8_1_WGM1_WGMXCC1_WGMXCCGn1
    SolutionIndex: 155
    SolutionNameMin: Cijk_Ailk_Bjlk_HHS_BH_Bias_FDMN_SPA_AS_SAV_MT64x32x128_MI16x16x1_SN_GRVWA4_GRVWB8_GSU9_GSUC0_GSUWGMRR0_K1_LBSPPA1024_LBSPPB512_MIWT1_2_NLCA1_NLCB1_SU0_SUM0_SUS0_WG64_4_1_WGM1_WGMXCC1_WGMXCCGn1
    SolutionIndex: 156
    SolutionNameMin: Cijk_Ailk_Bjlk_HHS_BH_Bias_FDMN_SPA_AS_SAV_MT64x32x128_MI16x16x1_SN_GRVWA8_GRVWB8_GSU9_GSUC0_GSUWGMRR0_K1_LBSPPA1024_LBSPPB512_MIWT2_1_NLCA1_NLCB1_SU0_SUM0_SUS0_WG32_8_1_WGM1_WGMXCC1_WGMXCCGn1
    SolutionIndex: 157
    SolutionNameMin: Cijk_Ailk_Bjlk_HHS_BH_Bias_FDMN_SPA_AS_SAV_MT64x32x64_MI16x16x1_SN_GRVWA4_GRVWB8_GSU16_GSUC0_GSUWGMRR0_K1_LBSPPA1024_LBSPPB512_MIWT1_2_NLCA1_NLCB1_SU0_SUM0_SUS0_WG64_4_1_WGM8_WGMXCC1_WGMXCCGn1
    SolutionIndex: 158
    SolutionNameMin: Cijk_Ailk_Bjlk_HHS_BH_Bias_FDMN_SPA_AS_SAV_MT32x32x64_MI16x16x1_SN_GRVWA4_GRVWB2_GSU8_GSUC0_GSUWGMRR0_K1_LBSPPA512_LBSPPB512_MIWT1_1_NLCA1_NLCB1_SU0_SUM0_SUS0_WG32_8_1_WGM1_WGMXCC1_WGMXCCGn1
    SolutionIndex: 159
    SolutionNameMin: Cijk_Ailk_Bjlk_HHS_BH_Bias_FDMN_SPA_AS_SAV_MT32x32x64_MI16x16x1_SN_GRVWA4_GRVWB8_GSU8_GSUC0_GSUWGMRR0_K1_LBSPPA512_LBSPPB512_MIWT1_1_NLCA1_NLCB1_SU0_SUM0_SUS0_WG32_8_1_WGM1_WGMXCC1_WGMXCCGn1
    SolutionIndex: 160
    SolutionNameMin: Cijk_Ailk_Bjlk_HHS_BH_Bias_FDMN_SPA_AS_SAV_MT32x32x64_MI16x16x1_SN_GRVWA4_GRVWB8_GSU8_GSUC0_GSUWGMRR0_K1_LBSPPA512_LBSPPB512_MIWT1_1_NLCA1_NLCB1_SU0_SUM0_SUS0_WG32_8_1_WGM8_WGMXCC1_WGMXCCGn1
    SolutionIndex: 161
    SolutionNameMin: Cijk_Ailk_Bjlk_HHS_BH_Bias_FDMN_SPA_AS_SAV_MT32x32x128_MI16x16x1_SN_GRVWA4_GRVWB2_GSU8_GSUC0_GSUWGMRR0_K1_LBSPPA512_LBSPPB512_MIWT1_1_NLCA1_NLCB1_SU0_SUM0_SUS0_WG32_8_1_WGM1_WGMXCC1_WGMXCCGn1
    SolutionIndex: 162
    SolutionNameMin: Cijk_Ailk_Bjlk_HHS_BH_Bias_FDMN_SPA_AS_SAV_MT32x32x128_MI16x16x1_SN_GRVWA8_GRVWB2_GSU8_GSUC0_GSUWGMRR0_K1_LBSPPA512_LBSPPB512_MIWT1_1_NLCA1_NLCB1_SU0_SUM0_SUS0_WG32_8_1_WGM1_WGMXCC1_WGMXCCGn1
    SolutionIndex: 163
    SolutionNameMin: Cijk_Ailk_Bjlk_HHS_BH_Bias_FDMN_SPA_AS_SAV_MT32x32x128_MI16x16x1_SN_GRVWA4_GRVWB8_GSU8_GSUC0_GSUWGMRR0_K1_LBSPPA512_LBSPPB512_MIWT1_1_NLCA1_NLCB1_SU0_SUM0_SUS0_WG32_8_1_WGM1_WGMXCC1_WGMXCCGn1
    SolutionIndex: 164
    SolutionNameMin: Cijk_Ailk_Bjlk_HHS_BH_Bias_FDMN_SPA_AS_SAV_MT32x32x128_MI16x16x1_SN_GRVWA8_GRVWB8_GSU8_GSUC0_GSUWGMRR0_K1_LBSPPA512_LBSPPB512_MIWT1_1_NLCA1_NLCB1_SU0_SUM0_SUS0_WG32_8_1_WGM1_WGMXCC1_WGMXCCGn1
    SolutionIndex: 165
    SolutionNameMin: Cijk_Ailk_Bjlk_HHS_BH_Bias_FDMN_SPA_AS_SAV_MT32x32x128_MI16x16x1_SN_GRVWA8_GRVWB8_GSU8_GSUC0_GSUWGMRR0_K1_LBSPPA512_LBSPPB512_MIWT1_1_NLCA1_NLCB1_SU0_SUM0_SUS0_WG32_8_1_WGM8_WGMXCC1_WGMXCCGn1
    SolutionIndex: 166
    SolutionNameMin: Cijk_Ailk_Bjlk_HHS_BH_Bias_FDMN_SPA_AS_SAV_MT64x32x64_MI16x16x1_SN_GRVWA4_GRVWB2_GSU16_GSUC0_GSUWGMRR0_K1_LBSPPA1024_LBSPPB512_MIWT2_1_NLCA1_NLCB1_SU0_SUM0_SUS0_WG32_8_1_WGM8_WGMXCC1_WGMXCCGn1
    SolutionIndex: 167
    SolutionNameMin: Cijk_Ailk_Bjlk_HHS_BH_Bias_FDMN_SPA_AS_SAV_MT64x32x64_MI16x16x1_SN_GRVWA8_GRVWB2_GSU16_GSUC0_GSUWGMRR0_K1_LBSPPA1024_LBSPPB512_MIWT2_1_NLCA1_NLCB1_SU0_SUM0_SUS0_WG32_8_1_WGM8_WGMXCC1_WGMXCCGn1
    SolutionIndex: 168
    SolutionNameMin: Cijk_Ailk_Bjlk_HHS_BH_Bias_FDMN_SPA_AS_SAV_MT64x32x128_MI16x16x1_SN_GRVWA4_GRVWB2_GSU16_GSUC0_GSUWGMRR0_K1_LBSPPA1024_LBSPPB512_MIWT2_1_NLCA1_NLCB1_SU0_SUM0_SUS0_WG32_8_1_WGM1_WGMXCC1_WGMXCCGn1
    SolutionIndex: 169
    SolutionNameMin: Cijk_Ailk_Bjlk_HHS_BH_Bias_FDMN_SPA_AS_SAV_MT64x32x128_MI16x16x1_SN_GRVWA8_GRVWB2_GSU16_GSUC0_GSUWGMRR0_K1_LBSPPA1024_LBSPPB512_MIWT2_1_NLCA1_NLCB1_SU0_SUM0_SUS0_WG32_8_1_WGM1_WGMXCC1_WGMXCCGn1
    SolutionIndex: 170
    SolutionNameMin: Cijk_Ailk_Bjlk_HHS_BH_Bias_FDMN_SPA_AS_SAV_MT64x32x128_MI16x16x1_SN_GRVWA8_GRVWB8_GSU16_GSUC0_GSUWGMRR0_K1_LBSPPA1024_LBSPPB512_MIWT2_1_NLCA1_NLCB1_SU0_SUM0_SUS0_WG32_8_1_WGM1_WGMXCC1_WGMXCCGn1
    SolutionIndex: 171
    SolutionNameMin: Cijk_Ailk_Bjlk_HHS_BH_Bias_FDMN_SPA_AS_SAV_MT16x32x128_MI16x16x1_SN_GRVWA8_GRVWB2_GSU4_GSUC0_GSUWGMRR0_K1_LBSPPA256_LBSPPB512_MIWT1_1_NLCA1_NLCB1_SU0_SUM0_SUS0_WG16_8_1_WGM1_WGMXCC1_WGMXCCGn1
    SolutionIndex: 172
    SolutionNameMin: Cijk_Ailk_Bjlk_HHS_BH_Bias_FDMN_SPA_AS_SAV_MT16x32x128_MI16x16x1_SN_GRVWA4_GRVWB8_GSU4_GSUC0_GSUWGMRR0_K1_LBSPPA256_LBSPPB512_MIWT1_1_NLCA1_NLCB1_SU0_SUM0_SUS0_WG16_8_1_WGM1_WGMXCC1_WGMXCCGn1
    SolutionIndex: 173
    SolutionNameMin: Cijk_Ailk_Bjlk_HHS_BH_Bias_FDMN_SPA_AS_SAV_MT16x32x128_MI16x16x1_SN_GRVWA8_GRVWB8_GSU4_GSUC0_GSUWGMRR0_K1_LBSPPA256_LBSPPB512_MIWT1_1_NLCA1_NLCB1_SU0_SUM0_SUS0_WG16_8_1_WGM1_WGMXCC1_WGMXCCGn1
    SolutionIndex: 174
    SolutionNameMin: Cijk_Ailk_Bjlk_HHS_BH_Bias_FDMN_SPA_AS_SAV_MT16x64x128_MI16x16x1_SN_GRVWA4_GRVWB2_GSU16_GSUC0_GSUWGMRR0_K1_LBSPPA256_LBSPPB1024_MIWT1_1_NLCA1_NLCB1_SU0_SUM0_SUS0_WG16_16_1_WGM1_WGMXCC1_WGMXCCGn1
    SolutionIndex: 175
    SolutionNameMin: Cijk_Ailk_Bjlk_HHS_BH_Bias_FDMN_SPA_AS_SAV_MT16x64x128_MI16x16x1_SN_GRVWA4_GRVWB8_GSU10_GSUC0_GSUWGMRR0_K1_LBSPPA256_LBSPPB1024_MIWT1_1_NLCA1_NLCB1_SU0_SUM0_SUS0_WG16_16_1_WGM1_WGMXCC1_WGMXCCGn1
    SolutionIndex: 176
    SolutionNameMin: Cijk_Ailk_Bjlk_HHS_BH_Bias_FDMN_SPA_AS_SAV_MT16x64x128_MI16x16x1_SN_GRVWA4_GRVWB8_GSU10_GSUC0_GSUWGMRR0_K1_LBSPPA256_LBSPPB1024_MIWT1_1_NLCA1_NLCB1_SU0_SUM0_SUS0_WG16_16_1_WGM8_WGMXCC1_WGMXCCGn1
    SolutionIndex: 177
    SolutionNameMin: Cijk_Ailk_Bjlk_HHS_BH_Bias_FDMN_SPA_AS_SAV_MT32x64x64_MI16x16x1_SN_GRVWA4_GRVWB2_GSU16_GSUC0_GSUWGMRR0_K1_LBSPPA512_LBSPPB1024_MIWT1_2_NLCA1_NLCB1_SU0_SUM0_SUS0_WG32_8_1_WGM1_WGMXCC1_WGMXCCGn1
    SolutionIndex: 178
    SolutionNameMin: Cijk_Ailk_Bjlk_HHS_BH_Bias_FDMN_SPA_AS_SAV_MT32x64x64_MI16x16x1_SN_GRVWA4_GRVWB2_GSU16_GSUC0_GSUWGMRR0_K1_LBSPPA512_LBSPPB1024_MIWT1_2_NLCA1_NLCB1_SU0_SUM0_SUS0_WG32_8_1_WGM8_WGMXCC1_WGMXCCGn1
    SolutionIndex: 179
    SolutionNameMin: Cijk_Ailk_Bjlk_HHS_BH_Bias_FDMN_SPA_AS_SAV_MT32x64x64_MI16x16x1_SN_GRVWA4_GRVWB8_GSU14_GSUC0_GSUWGMRR0_K1_LBSPPA512_LBSPPB1024_MIWT1_2_NLCA1_NLCB1_SU0_SUM0_SUS0_WG32_8_1_WGM1_WGMXCC1_WGMXCCGn1
    SolutionIndex: 180
    SolutionNameMin: Cijk_Ailk_Bjlk_HHS_BH_Bias_FDMN_SPA_AS_SAV_MT32x64x64_MI16x16x1_SN_GRVWA4_GRVWB8_GSU11_GSUC0_GSUWGMRR0_K1_LBSPPA512_LBSPPB1024_MIWT1_2_NLCA1_NLCB1_SU0_SUM0_SUS0_WG32_8_1_WGM1_WGMXCC1_WGMXCCGn1
    SolutionIndex: 181
    SolutionNameMin: Cijk_Ailk_Bjlk_HHS_BH_Bias_FDMN_SPA_AS_SAV_MT32x64x128_MI16x16x1_SN_GRVWA8_GRVWB8_GSU11_GSUC0_GSUWGMRR0_K1_LBSPPA512_LBSPPB1024_MIWT1_2_NLCA1_NLCB1_SU0_SUM0_SUS0_WG32_8_1_WGM1_WGMXCC1_WGMXCCGn1
    SolutionIndex: 182
    SolutionNameMin: Cijk_Ailk_Bjlk_HHS_BH_Bias_FDMN_SPA_AS_SAV_MT32x64x64_MI16x16x1_SN_GRVWA4_GRVWB2_GSU11_GSUC0_GSUWGMRR0_K1_LBSPPA512_LBSPPB1024_MIWT2_1_NLCA1_NLCB1_SU0_SUM0_SUS0_WG16_16_1_WGM1_WGMXCC1_WGMXCCGn1
    SolutionIndex: 183
    SolutionNameMin: Cijk_Ailk_Bjlk_HHS_BH_Bias_FDMN_SPA_AS_SAV_MT32x64x64_MI16x16x1_SN_GRVWA4_GRVWB8_GSU11_GSUC0_GSUWGMRR0_K1_LBSPPA512_LBSPPB1024_MIWT2_1_NLCA1_NLCB1_SU0_SUM0_SUS0_WG16_16_1_WGM1_WGMXCC1_WGMXCCGn1
    SolutionIndex: 184
    SolutionNameMin: Cijk_Ailk_Bjlk_HHS_BH_Bias_FDMN_SPA_AS_SAV_MT32x64x64_MI16x16x1_SN_GRVWA4_GRVWB2_GSU11_GSUC0_GSUWGMRR0_K1_LBSPPA512_LBSPPB1024_MIWT2_1_NLCA1_NLCB1_SU0_SUM0_SUS0_WG16_16_1_WGM8_WGMXCC1_WGMXCCGn1
    SolutionIndex: 185
    SolutionNameMin: Cijk_Ailk_Bjlk_HHS_BH_Bias_FDMN_SPA_AS_SAV_MT32x64x64_MI16x16x1_SN_GRVWA4_GRVWB8_GSU9_GSUC0_GSUWGMRR0_K1_LBSPPA512_LBSPPB1024_MIWT1_2_NLCA1_NLCB1_SU0_SUM0_SUS0_WG32_8_1_WGM8_WGMXCC1_WGMXCCGn1
    SolutionIndex: 186
    SolutionNameMin: Cijk_Ailk_Bjlk_HHS_BH_Bias_FDMN_SPA_AS_SAV_MT32x64x128_MI16x16x1_SN_GRVWA8_GRVWB2_GSU9_GSUC0_GSUWGMRR0_K1_LBSPPA512_LBSPPB1024_MIWT2_1_NLCA1_NLCB1_SU0_SUM0_SUS0_WG16_16_1_WGM8_WGMXCC1_WGMXCCGn1
    SolutionIndex: 187
    SolutionNameMin: Cijk_Ailk_Bjlk_HHS_BH_Bias_FDMN_SPA_AS_SAV_MT32x64x128_MI16x16x1_SN_GRVWA4_GRVWB2_GSU16_GSUC0_GSUWGMRR0_K1_LBSPPA512_LBSPPB1024_MIWT2_1_NLCA1_NLCB1_SU0_SUM0_SUS0_WG16_16_1_WGM1_WGMXCC1_WGMXCCGn1
    SolutionIndex: 188
    SolutionNameMin: Cijk_Ailk_Bjlk_HHS_BH_Bias_FDMN_SPA_AS_SAV_MT32x64x128_MI16x16x1_SN_GRVWA4_GRVWB8_GSU16_GSUC0_GSUWGMRR0_K1_LBSPPA512_LBSPPB1024_MIWT2_1_NLCA1_NLCB1_SU0_SUM0_SUS0_WG16_16_1_WGM1_WGMXCC1_WGMXCCGn1
    SolutionIndex: 189
    SolutionNameMin: Cijk_Ailk_Bjlk_HHS_BH_Bias_FDMN_SPA_AS_SAV_MT32x64x128_MI16x16x1_SN_GRVWA8_GRVWB8_GSU16_GSUC0_GSUWGMRR0_K1_LBSPPA512_LBSPPB1024_MIWT2_1_NLCA1_NLCB1_SU0_SUM0_SUS0_WG16_16_1_WGM8_WGMXCC1_WGMXCCGn1
    SolutionIndex: 190
    SolutionNameMin: Cijk_Ailk_Bjlk_HHS_BH_Bias_FDMN_SPA_AS_SAV_MT16x64x128_MI16x16x1_SN_GRVWA4_GRVWB8_GSU7_GSUC0_GSUWGMRR0_K1_LBSPPA256_LBSPPB1024_MIWT1_1_NLCA1_NLCB1_SU0_SUM0_SUS0_WG16_16_1_WGM8_WGMXCC1_WGMXCCGn1
    SolutionIndex: 191
    SolutionNameMin: Cijk_Ailk_Bjlk_HHS_BH_Bias_FDMN_SPA_AS_SAV_MT32x64x64_MI16x16x1_SN_GRVWA4_GRVWB8_GSU14_GSUC0_GSUWGMRR0_K1_LBSPPA512_LBSPPB1024_MIWT2_1_NLCA1_NLCB1_SU0_SUM0_SUS0_WG16_16_1_WGM1_WGMXCC1_WGMXCCGn1
    SolutionIndex: 192
    SolutionNameMin: Cijk_Ailk_Bjlk_HHS_BH_Bias_FDMN_SPA_AS_SAV_MT32x64x128_MI16x16x1_SN_GRVWA8_GRVWB2_GSU14_GSUC0_GSUWGMRR0_K1_LBSPPA512_LBSPPB1024_MIWT2_1_NLCA1_NLCB1_SU0_SUM0_SUS0_WG16_16_1_WGM1_WGMXCC1_WGMXCCGn1
    SolutionIndex: 193
    SolutionNameMin: Cijk_Ailk_Bjlk_HHS_BH_Bias_FDMN_SPA_AS_SAV_MT64x32x64_MI16x16x1_SN_GRVWA4_GRVWB2_GSU12_GSUC0_GSUWGMRR0_K1_LBSPPA1024_LBSPPB512_MIWT1_2_NLCA1_NLCB1_SU0_SUM0_SUS0_WG64_4_1_WGM1_WGMXCC1_WGMXCCGn1
    SolutionIndex: 194
    SolutionNameMin: Cijk_Ailk_Bjlk_HHS_BH_Bias_FDMN_SPA_AS_SAV_MT32x32x128_MI16x16x1_SN_GRVWA4_GRVWB8_GSU6_GSUC0_GSUWGMRR0_K1_LBSPPA512_LBSPPB512_MIWT1_1_NLCA1_NLCB1_SU0_SUM0_SUS0_WG32_8_1_WGM1_WGMXCC1_WGMXCCGn1
    SolutionIndex: 195
    SolutionNameMin: Cijk_Ailk_Bjlk_HHS_BH_Bias_FDMN_SPA_AS_SAV_MT32x32x128_MI16x16x1_SN_GRVWA8_GRVWB8_GSU6_GSUC0_GSUWGMRR0_K1_LBSPPA512_LBSPPB512_MIWT1_1_NLCA1_NLCB1_SU0_SUM0_SUS0_WG32_8_1_WGM1_WGMXCC1_WGMXCCGn1
    SolutionIndex: 196
    SolutionNameMin: Cijk_Ailk_Bjlk_HHS_BH_Bias_FDMN_SPA_AS_SAV_MT32x32x128_MI16x16x1_SN_GRVWA8_GRVWB2_GSU6_GSUC0_GSUWGMRR0_K1_LBSPPA512_LBSPPB512_MIWT1_1_NLCA1_NLCB1_SU0_SUM0_SUS0_WG32_8_1_WGM8_WGMXCC1_WGMXCCGn1
    SolutionIndex: 197
    SolutionNameMin: Cijk_Ailk_Bjlk_HHS_BH_Bias_FDMN_SPA_AS_SAV_MT64x32x64_MI16x16x1_SN_GRVWA8_GRVWB2_GSU12_GSUC0_GSUWGMRR0_K1_LBSPPA1024_LBSPPB512_MIWT2_1_NLCA1_NLCB1_SU0_SUM0_SUS0_WG32_8_1_WGM1_WGMXCC1_WGMXCCGn1
    SolutionIndex: 198
    SolutionNameMin: Cijk_Ailk_Bjlk_HHS_BH_Bias_FDMN_SPA_AS_SAV_MT32x64x64_MI16x16x1_SN_GRVWA4_GRVWB8_GSU8_GSUC0_GSUWGMRR0_K1_LBSPPA512_LBSPPB1024_MIWT1_2_NLCA1_NLCB1_SU0_SUM0_SUS0_WG32_8_1_WGM1_WGMXCC1_WGMXCCGn1
    SolutionIndex: 199
    SolutionNameMin: Cijk_Ailk_Bjlk_HHS_BH_Bias_FDMN_SPA_AS_SAV_MT32x64x128_MI16x16x1_SN_GRVWA8_GRVWB8_GSU8_GSUC0_GSUWGMRR0_K1_LBSPPA512_LBSPPB1024_MIWT1_2_NLCA1_NLCB1_SU0_SUM0_SUS0_WG32_8_1_WGM1_WGMXCC1_WGMXCCGn1
    SolutionIndex: 200
    SolutionNameMin: Cijk_Ailk_Bjlk_HHS_BH_Bias_FDMN_SPA_AS_SAV_MT64x32x64_MI16x16x1_SN_GRVWA4_GRVWB2_GSU15_GSUC0_GSUWGMRR0_K1_LBSPPA1024_LBSPPB512_MIWT2_1_NLCA1_NLCB1_SU0_SUM0_SUS0_WG32_8_1_WGM1_WGMXCC1_WGMXCCGn1
    SolutionIndex: 201
    SolutionNameMin: Cijk_Ailk_Bjlk_HHS_BH_Bias_FDMN_SPA_AS_SAV_MT64x32x64_MI16x16x1_SN_GRVWA8_GRVWB2_GSU15_GSUC0_GSUWGMRR0_K1_LBSPPA1024_LBSPPB512_MIWT2_1_NLCA1_NLCB1_SU0_SUM0_SUS0_WG32_8_1_WGM8_WGMXCC1_WGMXCCGn1
    SolutionIndex: 202
    SolutionNameMin: Cijk_Ailk_Bjlk_HHS_BH_Bias_FDMN_SPA_AS_SAV_MT64x32x64_MI16x16x1_SN_GRVWA4_GRVWB8_GSU8_GSUC0_GSUWGMRR0_K1_LBSPPA1024_LBSPPB512_MIWT1_2_NLCA1_NLCB1_SU0_SUM0_SUS0_WG64_4_1_WGM1_WGMXCC1_WGMXCCGn1
    SolutionIndex: 203
    SolutionNameMin: Cijk_Ailk_Bjlk_HHS_BH_Bias_FDMN_SPA_AS_SAV_MT64x32x128_MI16x16x1_SN_GRVWA4_GRVWB8_GSU8_GSUC0_GSUWGMRR0_K1_LBSPPA1024_LBSPPB512_MIWT1_2_NLCA1_NLCB1_SU0_SUM0_SUS0_WG64_4_1_WGM1_WGMXCC1_WGMXCCGn1
    SolutionIndex: 204
    SolutionNameMin: Cijk_Ailk_Bjlk_HHS_BH_Bias_FDMN_SPA_AS_SAV_MT16x128x128_MI16x16x1_SN_GRVWA4_GRVWB8_GSU16_GSUC0_GSUWGMRR0_K1_LBSPPA256_LBSPPB2048_MIWT1_2_NLCA1_NLCB1_SU0_SUM0_SUS0_WG16_16_1_WGM1_WGMXCC1_WGMXCCGn1
    SolutionIndex: 205
    SolutionNameMin: Cijk_Ailk_Bjlk_HHS_BH_Bias_FDMN_SPA_AS_SAV_MT16x128x128_MI16x16x1_SN_GRVWA4_GRVWB8_GSU11_GSUC0_GSUWGMRR0_K1_LBSPPA256_LBSPPB2048_MIWT1_2_NLCA1_NLCB1_SU0_SUM0_SUS0_WG16_16_1_WGM1_WGMXCC1_WGMXCCGn1
    SolutionIndex: 206
    SolutionNameMin: Cijk_Ailk_Bjlk_HHS_BH_Bias_FDMN_SPA_AS_SAV_MT16x128x128_MI16x16x1_SN_GRVWA4_GRVWB8_GSU9_GSUC0_GSUWGMRR0_K1_LBSPPA256_LBSPPB2048_MIWT1_2_NLCA1_NLCB1_SU0_SUM0_SUS0_WG16_16_1_WGM8_WGMXCC1_WGMXCCGn1
    SolutionIndex: 207
    SolutionNameMin: Cijk_Ailk_Bjlk_HHS_BH_Bias_FDMN_SPA_AS_SAV_MT16x64x128_MI16x16x1_SN_GRVWA4_GRVWB8_GSU13_GSUC0_GSUWGMRR0_K1_LBSPPA256_LBSPPB1024_MIWT1_1_NLCA1_NLCB1_SU0_SUM0_SUS0_WG16_16_1_WGM1_WGMXCC1_WGMXCCGn1
    SolutionIndex: 208
    SolutionNameMin: Cijk_Ailk_Bjlk_HHS_BH_Bias_FDMN_SPA_AS_SAV_MT32x64x64_MI16x16x1_SN_GRVWA4_GRVWB2_GSU12_GSUC0_GSUWGMRR0_K1_LBSPPA512_LBSPPB1024_MIWT1_2_NLCA1_NLCB1_SU0_SUM0_SUS0_WG32_8_1_WGM1_WGMXCC1_WGMXCCGn1
    SolutionIndex: 209
    SolutionNameMin: Cijk_Ailk_Bjlk_HHS_BH_Bias_FDMN_SPA_AS_SAV_MT64x64x64_MI16x16x1_SN_GRVWA8_GRVWB2_GSU12_GSUC0_GSUWGMRR0_K1_LBSPPA1024_LBSPPB1024_MIWT2_2_NLCA1_NLCB1_SU0_SUM0_SUS0_WG32_8_1_WGM1_WGMXCC1_WGMXCCGn1
    SolutionIndex: 210
    SolutionNameMin: Cijk_Ailk_Bjlk_HHS_BH_Bias_FDMN_SPA_AS_SAV_MT32x32x128_MI16x16x1_SN_GRVWA4_GRVWB2_GSU4_GSUC0_GSUWGMRR0_K1_LBSPPA512_LBSPPB512_MIWT1_1_NLCA1_NLCB1_SU0_SUM0_SUS0_WG32_8_1_WGM1_WGMXCC1_WGMXCCGn1
    SolutionIndex: 211
    SolutionNameMin: Cijk_Ailk_Bjlk_HHS_BH_Bias_FDMN_SPA_AS_SAV_MT32x32x128_MI16x16x1_SN_GRVWA4_GRVWB8_GSU4_GSUC0_GSUWGMRR0_K1_LBSPPA512_LBSPPB512_MIWT1_1_NLCA1_NLCB1_SU0_SUM0_SUS0_WG32_8_1_WGM1_WGMXCC1_WGMXCCGn1
    SolutionIndex: 212
    SolutionNameMin: Cijk_Ailk_Bjlk_HHS_BH_Bias_FDMN_SPA_AS_SAV_MT16x128x128_MI16x16x1_SN_GRVWA4_GRVWB8_GSU12_GSUC0_GSUWGMRR0_K1_LBSPPA256_LBSPPB2048_MIWT1_2_NLCA1_NLCB1_SU0_SUM0_SUS0_WG16_16_1_WGM1_WGMXCC1_WGMXCCGn1
    SolutionIndex: 213
    SolutionNameMin: Cijk_Ailk_Bjlk_HHS_BH_Bias_FDMN_SPA_AS_SAV_MT16x128x128_MI16x16x1_SN_GRVWA4_GRVWB8_GSU6_GSUC0_GSUWGMRR0_K1_LBSPPA256_LBSPPB2048_MIWT1_2_NLCA1_NLCB1_SU0_SUM0_SUS0_WG16_16_1_WGM8_WGMXCC1_WGMXCCGn1
    SolutionIndex: 214
    SolutionNameMin: Cijk_Ailk_Bjlk_HHS_BH_Bias_FDMN_SPA_AS_SAV_MT16x64x128_MI16x16x1_SN_GRVWA4_GRVWB8_GSU4_GSUC0_GSUWGMRR0_K1_LBSPPA256_LBSPPB1024_MIWT1_1_NLCA1_NLCB1_SU0_SUM0_SUS0_WG16_16_1_WGM1_WGMXCC1_WGMXCCGn1
    SolutionIndex: 215
    SolutionNameMin: Cijk_Ailk_Bjlk_HHS_BH_Bias_FDMN_SPA_AS_SAV_MT16x128x128_MI16x16x1_SN_GRVWA4_GRVWB8_GSU8_GSUC0_GSUWGMRR0_K1_LBSPPA256_LBSPPB2048_MIWT1_2_NLCA1_NLCB1_SU0_SUM0_SUS0_WG16_16_1_WGM1_WGMXCC1_WGMXCCGn1
    SolutionIndex: 216
    SolutionNameMin: Cijk_Ailk_Bjlk_HHS_BH_Bias_FDMN_SPA_AS_SAV_MT32x96x128_MI16x16x1_SN_GRVWA8_GRVWB8_GSU8_GSUC0_GSUWGMRR0_K1_LBSPPA512_LBSPPB1536_MIWT1_3_NLCA1_NLCB3_SU0_SUM0_SUS0_WG32_8_1_WGM1_WGMXCC1_WGMXCCGn1
    SolutionIndex: 217
    SolutionNameMin: Cijk_Ailk_Bjlk_HHS_BH_Bias_FDMN_SPA_AS_SAV_MT16x16x128_MI16x16x1_SN_GRVWA8_GRVWB8_GSU14_GSUC0_GSUWGMRR0_K1_LBSPPA256_LBSPPB256_MIWT1_1_NLCA1_NLCB1_SU0_SUM0_SUS0_WG16_4_1_WGM1_WGMXCC1_WGMXCCGn1
    SolutionIndex: 218
    SolutionNameMin: Cijk_Ailk_Bjlk_HHS_BH_Bias_FDMN_SPA_AS_SAV_MT32x16x128_MI16x16x1_SN_GRVWA8_GRVWB8_GSU16_GSUC0_GSUWGMRR0_K1_LBSPPA512_LBSPPB256_MIWT1_1_NLCA1_NLCB1_SU0_SUM0_SUS0_WG32_4_1_WGM8_WGMXCC1_WGMXCCGn1
    SolutionIndex: 219
    SolutionNameMin: Cijk_Ailk_Bjlk_HHS_BH_Bias_FDMN_SPA_AS_SAV_MT16x16x128_MI16x16x1_SN_GRVWA8_GRVWB2_GSU16_GSUC0_GSUWGMRR0_K1_LBSPPA256_LBSPPB256_MIWT1_1_NLCA1_NLCB1_SU0_SUM0_SUS0_WG16_4_1_WGM1_WGMXCC1_WGMXCCGn1
    SolutionIndex: 220
    SolutionNameMin: Cijk_Ailk_Bjlk_HHS_BH_Bias_FDMN_SPA_AS_SAV_MT32x16x128_MI16x16x1_SN_GRVWA8_GRVWB2_GSU16_GSUC0_GSUWGMRR0_K1_LBSPPA512_LBSPPB256_MIWT1_1_NLCA1_NLCB1_SU0_SUM0_SUS0_WG32_4_1_WGM1_WGMXCC1_WGMXCCGn1
    SolutionIndex: 221
    SolutionNameMin: Cijk_Ailk_Bjlk_HHS_BH_Bias_FDMN_SPA_AS_SAV_MT16x32x128_MI16x16x1_SN_GRVWA4_GRVWB2_GSU16_GSUC0_GSUWGMRR0_K1_LBSPPA256_LBSPPB512_MIWT1_1_NLCA1_NLCB1_SU0_SUM0_SUS0_WG16_8_1_WGM1_WGMXCC1_WGMXCCGn1
    SolutionIndex: 222
    SolutionNameMin: Cijk_Ailk_Bjlk_HHS_BH_Bias_FDMN_SPA_AS_SAV_MT32x16x128_MI16x16x1_SN_GRVWA8_GRVWB8_GSU16_GSUC0_GSUWGMRR0_K1_LBSPPA512_LBSPPB256_MIWT1_1_NLCA1_NLCB1_SU0_SUM0_SUS0_WG32_4_1_WGM1_WGMXCC1_WGMXCCGn1
    SolutionIndex: 223
    SolutionNameMin: Cijk_Ailk_Bjlk_HHS_BH_Bias_FDMN_SPA_AS_SAV_MT32x16x128_MI16x16x1_SN_GRVWA8_GRVWB8_GSU13_GSUC0_GSUWGMRR0_K1_LBSPPA512_LBSPPB256_MIWT1_1_NLCA1_NLCB1_SU0_SUM0_SUS0_WG32_4_1_WGM1_WGMXCC1_WGMXCCGn1
    SolutionIndex: 224
    SolutionNameMin: Cijk_Ailk_Bjlk_HHS_BH_Bias_FDMN_SPA_AS_SAV_MT32x16x128_MI16x16x1_SN_GRVWA8_GRVWB8_GSU15_GSUC0_GSUWGMRR0_K1_LBSPPA512_LBSPPB256_MIWT1_1_NLCA1_NLCB1_SU0_SUM0_SUS0_WG32_4_1_WGM1_WGMXCC1_WGMXCCGn1
    SolutionIndex: 225
    SolutionNameMin: Cijk_Ailk_Bjlk_HHS_BH_Bias_FDMN_SPA_AS_SAV_MT64x16x128_MI16x16x1_SN_GRVWA8_GRVWB8_GSU16_GSUC0_GSUWGMRR0_K1_LBSPPA1024_LBSPPB256_MIWT1_1_NLCA1_NLCB1_SU0_SUM0_SUS0_WG64_4_1_WGM1_WGMXCC1_WGMXCCGn1
    SolutionIndex: 226
    SolutionNameMin: Cijk_Ailk_Bjlk_HHS_BH_Bias_FDMN_SPA_AS_SAV_MT64x16x128_MI16x16x1_SN_GRVWA8_GRVWB8_GSU15_GSUC0_GSUWGMRR0_K1_LBSPPA1024_LBSPPB256_MIWT1_1_NLCA1_NLCB1_SU0_SUM0_SUS0_WG64_4_1_WGM1_WGMXCC1_WGMXCCGn1
    SolutionIndex: 227
    SolutionNameMin: Cijk_Ailk_Bjlk_HHS_BH_Bias_FDMN_SPA_AS_SAV_MT128x16x128_MI16x16x1_SN_GRVWA8_GRVWB8_GSU16_GSUC0_GSUWGMRR0_K1_LBSPPA2048_LBSPPB256_MIWT2_1_NLCA1_NLCB1_SU0_SUM0_SUS0_WG64_4_1_WGM1_WGMXCC1_WGMXCCGn1
    SolutionIndex: 228
    SolutionNameMin: Cijk_Ailk_Bjlk_HHS_BH_Bias_FDMN_SPA_AS_SAV_MT128x16x128_MI16x16x1_SN_GRVWA8_GRVWB8_GSU14_GSUC0_GSUWGMRR0_K1_LBSPPA2048_LBSPPB256_MIWT2_1_NLCA1_NLCB1_SU0_SUM0_SUS0_WG64_4_1_WGM1_WGMXCC1_WGMXCCGn1
    SolutionIndex: 229
    SolutionNameMin: Cijk_Ailk_Bjlk_HHS_BH_Bias_FDMN_SPA_AS_SAV_MT128x16x128_MI16x16x1_SN_GRVWA8_GRVWB8_GSU10_GSUC0_GSUWGMRR0_K1_LBSPPA2048_LBSPPB256_MIWT2_1_NLCA1_NLCB1_SU0_SUM0_SUS0_WG64_4_1_WGM8_WGMXCC1_WGMXCCGn1
    SolutionIndex: 230
    SolutionNameMin: Cijk_Ailk_Bjlk_HHS_BH_Bias_FDMN_SPA_AS_SAV_MT128x16x128_MI16x16x1_SN_GRVWA8_GRVWB8_GSU8_GSUC0_GSUWGMRR0_K1_LBSPPA2048_LBSPPB256_MIWT2_1_NLCA1_NLCB1_SU0_SUM0_SUS0_WG64_4_1_WGM8_WGMXCC1_WGMXCCGn1
    SolutionIndex: 231
    SolutionNameMin: Cijk_Ailk_Bjlk_HHS_BH_Bias_FDMN_SPA_AS_SAV_MT16x32x128_MI16x16x1_SN_GRVWA8_GRVWB8_GSU14_GSUC0_GSUWGMRR0_K1_LBSPPA256_LBSPPB512_MIWT1_1_NLCA1_NLCB1_SU0_SUM0_SUS0_WG16_8_1_WGM1_WGMXCC1_WGMXCCGn1
    SolutionIndex: 232
    SolutionNameMin: Cijk_Ailk_Bjlk_HHS_BH_Bias_FDMN_SPA_AS_SAV_MT32x16x128_MI16x16x1_SN_GRVWA4_GRVWB8_GSU16_GSUC0_GSUWGMRR0_K1_LBSPPA512_LBSPPB256_MIWT1_1_NLCA1_NLCB1_SU0_SUM0_SUS0_WG32_4_1_WGM1_WGMXCC1_WGMXCCGn1
    SolutionIndex: 233
    SolutionNameMin: Cijk_Ailk_Bjlk_HHS_BH_Bias_FDMN_SPA_AS_SAV_MT32x16x128_MI16x16x1_SN_GRVWA4_GRVWB8_GSU16_GSUC0_GSUWGMRR0_K1_LBSPPA512_LBSPPB256_MIWT1_1_NLCA1_NLCB1_SU0_SUM0_SUS0_WG32_4_1_WGM8_WGMXCC1_WGMXCCGn1
    SolutionIndex: 234
    SolutionNameMin: Cijk_Ailk_Bjlk_HHS_BH_Bias_FDMN_SPA_AS_SAV_MT16x32x128_MI16x16x1_SN_GRVWA4_GRVWB8_GSU13_GSUC0_GSUWGMRR0_K1_LBSPPA256_LBSPPB512_MIWT1_1_NLCA1_NLCB1_SU0_SUM0_SUS0_WG16_8_1_WGM1_WGMXCC1_WGMXCCGn1
    SolutionIndex: 235
    SolutionNameMin: Cijk_Ailk_Bjlk_HHS_BH_Bias_FDMN_SPA_AS_SAV_MT32x32x128_MI16x16x1_SN_GRVWA8_GRVWB8_GSU16_GSUC0_GSUWGMRR0_K1_LBSPPA512_LBSPPB512_MIWT1_1_NLCA1_NLCB1_SU0_SUM0_SUS0_WG32_8_1_WGM1_WGMXCC1_WGMXCCGn1
    SolutionIndex: 236
    SolutionNameMin: Cijk_Ailk_Bjlk_HHS_BH_Bias_FDMN_SPA_AS_SAV_MT32x32x128_MI16x16x1_SN_GRVWA4_GRVWB8_GSU16_GSUC0_GSUWGMRR0_K1_LBSPPA512_LBSPPB512_MIWT1_1_NLCA1_NLCB1_SU0_SUM0_SUS0_WG32_8_1_WGM1_WGMXCC1_WGMXCCGn1
    SolutionIndex: 237
    SolutionNameMin: Cijk_Ailk_Bjlk_HHS_BH_Bias_FDMN_SPA_AS_SAV_MT64x32x64_MI16x16x1_SN_GRVWA4_GRVWB2_GSU16_GSUC0_GSUWGMRR0_K1_LBSPPA1024_LBSPPB512_MIWT2_1_NLCA1_NLCB1_SU0_SUM0_SUS0_WG32_8_1_WGM1_WGMXCC1_WGMXCCGn1
    SolutionIndex: 238
    SolutionNameMin: Cijk_Ailk_Bjlk_HHS_BH_Bias_FDMN_SPA_AS_SAV_MT64x32x128_MI16x16x1_SN_GRVWA4_GRVWB8_GSU12_GSUC0_GSUWGMRR0_K1_LBSPPA1024_LBSPPB512_MIWT2_1_NLCA1_NLCB1_SU0_SUM0_SUS0_WG32_8_1_WGM1_WGMXCC1_WGMXCCGn1
    SolutionIndex: 239
    SolutionNameMin: Cijk_Ailk_Bjlk_HHS_BH_Bias_FDMN_SPA_AS_SAV_MT32x16x128_MI16x16x1_SN_GRVWA4_GRVWB2_GSU13_GSUC0_GSUWGMRR0_K1_LBSPPA512_LBSPPB256_MIWT1_1_NLCA1_NLCB1_SU0_SUM0_SUS0_WG32_4_1_WGM1_WGMXCC1_WGMXCCGn1
    SolutionIndex: 240
    SolutionNameMin: Cijk_Ailk_Bjlk_HHS_BH_Bias_FDMN_SPA_AS_SAV_MT32x16x64_MI16x16x1_SN_GRVWA4_GRVWB8_GSU16_GSUC0_GSUWGMRR0_K1_LBSPPA512_LBSPPB256_MIWT1_1_NLCA1_NLCB1_SU0_SUM0_SUS0_WG32_4_1_WGM1_WGMXCC1_WGMXCCGn1
    SolutionIndex: 241
    SolutionNameMin: Cijk_Ailk_Bjlk_HHS_BH_Bias_FDMN_SPA_AS_SAV_MT64x32x128_MI16x16x1_SN_GRVWA8_GRVWB8_GSU16_GSUC0_GSUWGMRR0_K1_LBSPPA1024_LBSPPB512_MIWT1_2_NLCA1_NLCB1_SU0_SUM0_SUS0_WG64_4_1_WGM1_WGMXCC1_WGMXCCGn1
    SolutionIndex: 242
    SolutionNameMin: Cijk_Ailk_Bjlk_HHS_BH_Bias_FDMN_SPA_AS_SAV_MT64x16x128_MI16x16x1_SN_GRVWA8_GRVWB8_GSU12_GSUC0_GSUWGMRR0_K1_LBSPPA1024_LBSPPB256_MIWT1_1_NLCA1_NLCB1_SU0_SUM0_SUS0_WG64_4_1_WGM1_WGMXCC1_WGMXCCGn1
    SolutionIndex: 243
    SolutionNameMin: Cijk_Ailk_Bjlk_HHS_BH_Bias_FDMN_SPA_AS_SAV_MT128x16x128_MI16x16x1_SN_GRVWA8_GRVWB2_GSU16_GSUC0_GSUWGMRR0_K1_LBSPPA2048_LBSPPB256_MIWT2_1_NLCA1_NLCB1_SU0_SUM0_SUS0_WG64_4_1_WGM1_WGMXCC1_WGMXCCGn1
    SolutionIndex: 244
    SolutionNameMin: Cijk_Ailk_Bjlk_HHS_BH_Bias_FDMN_SPA_AS_SAV_MT64x48x128_MI16x16x1_SN_GRVWA4_GRVWB8_GSU16_GSUC0_GSUWGMRR0_K1_LBSPPA1024_LBSPPB768_MIWT1_3_NLCA1_NLCB3_SU0_SUM0_SUS0_WG64_4_1_WGM8_WGMXCC1_WGMXCCGn1
    SolutionIndex: 245
    SolutionNameMin: Cijk_Ailk_Bjlk_HHS_BH_Bias_FDMN_SPA_AS_SAV_MT64x64x64_MI16x16x1_SN_GRVWA4_GRVWB8_GSU16_GSUC0_GSUWGMRR0_K1_LBSPPA1024_LBSPPB1024_MIWT2_2_NLCA1_NLCB1_SU0_SUM0_SUS0_WG32_8_1_WGM1_WGMXCC1_WGMXCCGn1
    SolutionIndex: 246
    SolutionNameMin: Cijk_Ailk_Bjlk_HHS_BH_Bias_FDMN_SPA_AS_SAV_MT64x48x128_MI16x16x1_SN_GRVWA4_GRVWB8_GSU11_GSUC0_GSUWGMRR0_K1_LBSPPA1024_LBSPPB768_MIWT1_3_NLCA1_NLCB3_SU0_SUM0_SUS0_WG64_4_1_WGM8_WGMXCC1_WGMXCCGn1
    SolutionIndex: 247
    SolutionNameMin: Cijk_Ailk_Bjlk_HHS_BH_Bias_FDMN_SPA_AS_SAV_MT16x16x128_MI16x16x1_SN_GRVWA8_GRVWB2_GSU16_GSUC0_GSUWGMRR0_K1_LBSPPA256_LBSPPB256_MIWT1_1_NLCA1_NLCB1_SU0_SUM0_SUS0_WG16_4_1_WGM8_WGMXCC1_WGMXCCGn1
    SolutionIndex: 248
    SolutionNameMin: Cijk_Ailk_Bjlk_HHS_BH_Bias_FDMN_SPA_AS_SAV_MT16x32x128_MI16x16x1_SN_GRVWA8_GRVWB8_GSU16_GSUC0_GSUWGMRR0_K1_LBSPPA256_LBSPPB512_MIWT1_1_NLCA1_NLCB1_SU0_SUM0_SUS0_WG16_8_1_WGM1_WGMXCC1_WGMXCCGn1
    SolutionIndex: 249
    SolutionNameMin: Cijk_Ailk_Bjlk_HHS_BH_Bias_FDMN_SPA_AS_SAV_MT16x64x128_MI16x16x1_SN_GRVWA4_GRVWB8_GSU16_GSUC0_GSUWGMRR0_K1_LBSPPA256_LBSPPB1024_MIWT1_1_NLCA1_NLCB1_SU0_SUM0_SUS0_WG16_16_1_WGM1_WGMXCC1_WGMXCCGn1
    SolutionIndex: 250
    SolutionNameMin: Cijk_Ailk_Bjlk_HHS_BH_Bias_FDMN_SPA_AS_SAV_MT64x16x128_MI16x16x1_SN_GRVWA8_GRVWB8_GSU16_GSUC0_GSUWGMRR0_K1_LBSPPA1024_LBSPPB256_MIWT1_1_NLCA1_NLCB1_SU0_SUM0_SUS0_WG64_4_1_WGM8_WGMXCC1_WGMXCCGn1
    SolutionIndex: 251
    SolutionNameMin: Cijk_Ailk_Bjlk_HHS_BH_Bias_FDMN_SPA_AS_SAV_MT16x32x128_MI16x16x1_SN_GRVWA4_GRVWB2_GSU14_GSUC0_GSUWGMRR0_K1_LBSPPA256_LBSPPB512_MIWT1_1_NLCA1_NLCB1_SU0_SUM0_SUS0_WG16_8_1_WGM1_WGMXCC1_WGMXCCGn1
    SolutionIndex: 252
    SolutionNameMin: Cijk_Ailk_Bjlk_HHS_BH_Bias_FDMN_SPA_AS_SAV_MT64x32x128_MI16x16x1_SN_GRVWA8_GRVWB8_GSU12_GSUC0_GSUWGMRR0_K1_LBSPPA1024_LBSPPB512_MIWT1_2_NLCA1_NLCB1_SU0_SUM0_SUS0_WG64_4_1_WGM1_WGMXCC1_WGMXCCGn1
    SolutionIndex: 253
    SolutionNameMin: Cijk_Ailk_Bjlk_HHS_BH_Bias_FDMN_SPA_AS_SAV_MT32x64x64_MI16x16x1_SN_GRVWA4_GRVWB2_GSU12_GSUC0_GSUWGMRR0_K1_LBSPPA512_LBSPPB1024_MIWT2_1_NLCA1_NLCB1_SU0_SUM0_SUS0_WG16_16_1_WGM1_WGMXCC1_WGMXCCGn1
    SolutionIndex: 254
    SolutionNameMin: Cijk_Ailk_Bjlk_HHS_BH_Bias_FDMN_SPA_AS_SAV_MT64x16x128_MI16x16x1_SN_GRVWA8_GRVWB2_GSU16_GSUC0_GSUWGMRR0_K1_LBSPPA1024_LBSPPB256_MIWT1_1_NLCA1_NLCB1_SU0_SUM0_SUS0_WG64_4_1_WGM1_WGMXCC1_WGMXCCGn1
    SolutionIndex: 255
    SolutionNameMin: Cijk_Ailk_Bjlk_HHS_BH_Bias_FDMN_SPA_AS_SAV_MT64x16x128_MI16x16x1_SN_GRVWA4_GRVWB8_GSU14_GSUC0_GSUWGMRR0_K1_LBSPPA1024_LBSPPB256_MIWT1_1_NLCA1_NLCB1_SU0_SUM0_SUS0_WG64_4_1_WGM1_WGMXCC1_WGMXCCGn1
    SolutionIndex: 256
    SolutionNameMin: Cijk_Ailk_Bjlk_HHS_BH_Bias_FDMN_SPA_AS_SAV_MT64x32x128_MI16x16x1_SN_GRVWA4_GRVWB8_GSU16_GSUC0_GSUWGMRR0_K1_LBSPPA1024_LBSPPB512_MIWT2_1_NLCA1_NLCB1_SU0_SUM0_SUS0_WG32_8_1_WGM1_WGMXCC1_WGMXCCGn1
    SolutionIndex: 257
    SolutionNameMin: Cijk_Ailk_Bjlk_HHS_BH_Bias_FDMN_SPA_AS_SAV_MT64x16x128_MI16x16x1_SN_GRVWA4_GRVWB8_GSU8_GSUC0_GSUWGMRR0_K1_LBSPPA1024_LBSPPB256_MIWT1_1_NLCA1_NLCB1_SU0_SUM0_SUS0_WG64_4_1_WGM1_WGMXCC1_WGMXCCGn1
    SolutionIndex: 258
    SolutionNameMin: Cijk_Ailk_Bjlk_HHS_BH_Bias_FDMN_SPA_AS_SAV_MT64x48x128_MI16x16x1_SN_GRVWA8_GRVWB8_GSU16_GSUC0_GSUWGMRR0_K1_LBSPPA1024_LBSPPB768_MIWT1_3_NLCA1_NLCB3_SU0_SUM0_SUS0_WG64_4_1_WGM1_WGMXCC1_WGMXCCGn1
    SolutionIndex: 259
    SolutionNameMin: Cijk_Ailk_Bjlk_HHS_BH_Bias_FDMN_SPA_AS_SAV_MT32x96x64_MI16x16x1_SN_GRVWA4_GRVWB8_GSU11_GSUC0_GSUWGMRR0_K1_LBSPPA512_LBSPPB1536_MIWT1_3_NLCA1_NLCB3_SU0_SUM0_SUS0_WG32_8_1_WGM1_WGMXCC1_WGMXCCGn1
    SolutionIndex: 260
    SolutionNameMin: Cijk_Ailk_Bjlk_HHS_BH_Bias_FDMN_SPA_AS_SAV_MT32x16x128_MI16x16x1_SN_GRVWA8_GRVWB8_GSU12_GSUC0_GSUWGMRR0_K1_LBSPPA512_LBSPPB256_MIWT1_1_NLCA1_NLCB1_SU0_SUM0_SUS0_WG32_4_1_WGM1_WGMXCC1_WGMXCCGn1
    SolutionIndex: 261
    SolutionNameMin: Cijk_Ailk_Bjlk_HHS_BH_Bias_FDMN_SPA_AS_SAV_MT32x16x128_MI16x16x1_SN_GRVWA4_GRVWB2_GSU14_GSUC0_GSUWGMRR0_K1_LBSPPA512_LBSPPB256_MIWT1_1_NLCA1_NLCB1_SU0_SUM0_SUS0_WG32_4_1_WGM1_WGMXCC1_WGMXCCGn1
    SolutionIndex: 262
    SolutionNameMin: Cijk_Ailk_Bjlk_HHS_BH_Bias_FDMN_SPA_AS_SAV_MT64x32x128_MI16x16x1_SN_GRVWA4_GRVWB8_GSU11_GSUC0_GSUWGMRR0_K1_LBSPPA1024_LBSPPB512_MIWT2_1_NLCA1_NLCB1_SU0_SUM0_SUS0_WG32_8_1_WGM1_WGMXCC1_WGMXCCGn1
    SolutionIndex: 263
    SolutionNameMin: Cijk_Ailk_Bjlk_HHS_BH_Bias_FDMN_SPA_AS_SAV_MT128x32x128_MI16x16x1_SN_GRVWA4_GRVWB8_GSU11_GSUC0_GSUWGMRR0_K1_LBSPPA2048_LBSPPB512_MIWT2_2_NLCA1_NLCB1_SU0_SUM0_SUS0_WG64_4_1_WGM1_WGMXCC1_WGMXCCGn1
    SolutionIndex: 264
    SolutionNameMin: Cijk_Ailk_Bjlk_HHS_BH_Bias_FDMN_SPA_AS_SAV_MT16x32x128_MI16x16x1_SN_GRVWA4_GRVWB8_GSU16_GSUC0_GSUWGMRR0_K1_LBSPPA256_LBSPPB512_MIWT1_1_NLCA1_NLCB1_SU0_SUM0_SUS0_WG16_8_1_WGM8_WGMXCC1_WGMXCCGn1
    SolutionIndex: 265
    SolutionNameMin: Cijk_Ailk_Bjlk_HHS_BH_Bias_FDMN_SPA_AS_SAV_MT32x32x128_MI16x16x1_SN_GRVWA4_GRVWB8_GSU12_GSUC0_GSUWGMRR0_K1_LBSPPA512_LBSPPB512_MIWT1_1_NLCA1_NLCB1_SU0_SUM0_SUS0_WG32_8_1_WGM1_WGMXCC1_WGMXCCGn1
    SolutionIndex: 266
    SolutionNameMin: Cijk_Ailk_Bjlk_HHS_BH_Bias_FDMN_SPA_AS_SAV_MT64x32x128_MI16x16x1_SN_GRVWA8_GRVWB8_GSU14_GSUC0_GSUWGMRR0_K1_LBSPPA1024_LBSPPB512_MIWT2_1_NLCA1_NLCB1_SU0_SUM0_SUS0_WG32_8_1_WGM1_WGMXCC1_WGMXCCGn1
    SolutionIndex: 267
    SolutionNameMin: Cijk_Ailk_Bjlk_HHS_BH_Bias_FDMN_SPA_AS_SAV_MT64x32x128_MI16x16x1_SN_GRVWA4_GRVWB8_GSU16_GSUC0_GSUWGMRR0_K1_LBSPPA1024_LBSPPB512_MIWT2_1_NLCA1_NLCB1_SU0_SUM0_SUS0_WG32_8_1_WGM8_WGMXCC1_WGMXCCGn1
    SolutionIndex: 268
    SolutionNameMin: Cijk_Ailk_Bjlk_HHS_BH_Bias_FDMN_SPA_AS_SAV_MT96x32x128_MI16x16x1_SN_GRVWA8_GRVWB8_GSU14_GSUC0_GSUWGMRR0_K1_LBSPPA1536_LBSPPB512_MIWT3_1_NLCA3_NLCB1_SU0_SUM0_SUS0_WG32_8_1_WGM1_WGMXCC1_WGMXCCGn1
    SolutionIndex: 269
    SolutionNameMin: Cijk_Ailk_Bjlk_HHS_BH_Bias_FDMN_SPA_AS_SAV_MT64x32x128_MI16x16x1_SN_GRVWA8_GRVWB8_GSU12_GSUC0_GSUWGMRR0_K1_LBSPPA1024_LBSPPB512_MIWT2_1_NLCA1_NLCB1_SU0_SUM0_SUS0_WG32_8_1_WGM1_WGMXCC1_WGMXCCGn1
    SolutionIndex: 270
    SolutionNameMin: Cijk_Ailk_Bjlk_HHS_BH_Bias_FDMN_SPA_AS_SAV_MT64x64x128_MI16x16x1_SN_GRVWA8_GRVWB8_GSU12_GSUC0_GSUWGMRR0_K1_LBSPPA1024_LBSPPB1024_MIWT2_2_NLCA1_NLCB1_SU0_SUM0_SUS0_WG32_8_1_WGM1_WGMXCC1_WGMXCCGn1
    SolutionIndex: 271
    SolutionNameMin: Cijk_Ailk_Bjlk_HHS_BH_Bias_FDMN_SPA_AS_SAV_MT64x64x64_MI16x16x1_SN_GRVWA8_GRVWB2_GSU16_GSUC0_GSUWGMRR0_K1_LBSPPA1024_LBSPPB1024_MIWT2_2_NLCA1_NLCB1_SU0_SUM0_SUS0_WG32_8_1_WGM1_WGMXCC1_WGMXCCGn1
    SolutionIndex: 272
    SolutionNameMin: Cijk_Ailk_Bjlk_HHS_BH_Bias_FDMN_SPA_AS_SAV_MT64x16x128_MI16x16x1_SN_GRVWA8_GRVWB8_GSU14_GSUC0_GSUWGMRR0_K1_LBSPPA1024_LBSPPB256_MIWT1_1_NLCA1_NLCB1_SU0_SUM0_SUS0_WG64_4_1_WGM1_WGMXCC1_WGMXCCGn1
    SolutionIndex: 273
    SolutionNameMin: Cijk_Ailk_Bjlk_HHS_BH_Bias_FDMN_SPA_AS_SAV_MT16x32x128_MI16x16x1_SN_GRVWA4_GRVWB8_GSU8_GSUC0_GSUWGMRR0_K1_LBSPPA256_LBSPPB512_MIWT1_1_NLCA1_NLCB1_SU0_SUM0_SUS0_WG16_8_1_WGM1_WGMXCC1_WGMXCCGn1
    SolutionIndex: 274
    SolutionNameMin: Cijk_Ailk_Bjlk_HHS_BH_Bias_FDMN_SPA_AS_SAV_MT64x32x128_MI16x16x1_SN_GRVWA8_GRVWB2_GSU11_GSUC0_GSUWGMRR0_K1_LBSPPA1024_LBSPPB512_MIWT2_1_NLCA1_NLCB1_SU0_SUM0_SUS0_WG32_8_1_WGM1_WGMXCC1_WGMXCCGn1
    SolutionIndex: 275
    SolutionNameMin: Cijk_Ailk_Bjlk_HHS_BH_Bias_FDMN_SPA_AS_SAV_MT64x32x128_MI16x16x1_SN_GRVWA8_GRVWB8_GSU11_GSUC0_GSUWGMRR0_K1_LBSPPA1024_LBSPPB512_MIWT2_1_NLCA1_NLCB1_SU0_SUM0_SUS0_WG32_8_1_WGM8_WGMXCC1_WGMXCCGn1
    SolutionIndex: 276
    SolutionNameMin: Cijk_Ailk_Bjlk_HHS_BH_Bias_FDMN_SPA_AS_SAV_MT64x32x128_MI16x16x1_SN_GRVWA8_GRVWB8_GSU8_GSUC0_GSUWGMRR0_K1_LBSPPA1024_LBSPPB512_MIWT1_2_NLCA1_NLCB1_SU0_SUM0_SUS0_WG64_4_1_WGM1_WGMXCC1_WGMXCCGn1
    SolutionIndex: 277
    SolutionNameMin: Cijk_Ailk_Bjlk_HHS_BH_Bias_FDMN_SPA_AS_SAV_MT32x32x128_MI16x16x1_SN_GRVWA4_GRVWB8_GSU14_GSUC0_GSUWGMRR0_K1_LBSPPA512_LBSPPB512_MIWT1_1_NLCA1_NLCB1_SU0_SUM0_SUS0_WG32_8_1_WGM1_WGMXCC1_WGMXCCGn1
    SolutionIndex: 278
    SolutionNameMin: Cijk_Ailk_Bjlk_HHS_BH_Bias_FDMN_SPA_AS_SAV_MT64x32x128_MI16x16x1_SN_GRVWA4_GRVWB8_GSU16_GSUC0_GSUWGMRR0_K1_LBSPPA1024_LBSPPB512_MIWT1_2_NLCA1_NLCB1_SU0_SUM0_SUS0_WG64_4_1_WGM1_WGMXCC1_WGMXCCGn1
    SolutionIndex: 279
    SolutionNameMin: Cijk_Ailk_Bjlk_HHS_BH_Bias_FDMN_SPA_AS_SAV_MT64x32x128_MI16x16x1_SN_GRVWA4_GRVWB8_GSU14_GSUC0_GSUWGMRR0_K1_LBSPPA1024_LBSPPB512_MIWT2_1_NLCA1_NLCB1_SU0_SUM0_SUS0_WG32_8_1_WGM1_WGMXCC1_WGMXCCGn1
    SolutionIndex: 280
    SolutionNameMin: Cijk_Ailk_Bjlk_HHS_BH_Bias_FDMN_SPA_AS_SAV_MT96x32x128_MI16x16x1_SN_GRVWA8_GRVWB8_GSU11_GSUC0_GSUWGMRR0_K1_LBSPPA1536_LBSPPB512_MIWT3_1_NLCA3_NLCB1_SU0_SUM0_SUS0_WG32_8_1_WGM1_WGMXCC1_WGMXCCGn1
    SolutionIndex: 281
    SolutionNameMin: Cijk_Ailk_Bjlk_HHS_BH_Bias_FDMN_SPA_AS_SAV_MT64x32x128_MI16x16x1_SN_GRVWA4_GRVWB8_GSU8_GSUC0_GSUWGMRR0_K1_LBSPPA1024_LBSPPB512_MIWT1_2_NLCA1_NLCB1_SU0_SUM0_SUS0_WG64_4_1_WGM8_WGMXCC1_WGMXCCGn1
    SolutionIndex: 282
    SolutionNameMin: Cijk_Ailk_Bjlk_HHS_BH_Bias_FDMN_SPA_AS_SAV_MT16x32x128_MI16x16x1_SN_GRVWA8_GRVWB2_GSU16_GSUC0_GSUWGMRR0_K1_LBSPPA256_LBSPPB512_MIWT1_1_NLCA1_NLCB1_SU0_SUM0_SUS0_WG16_8_1_WGM1_WGMXCC1_WGMXCCGn1
    SolutionIndex: 283
    SolutionNameMin: Cijk_Ailk_Bjlk_HHS_BH_Bias_FDMN_SPA_AS_SAV_MT16x32x128_MI16x16x1_SN_GRVWA8_GRVWB8_GSU16_GSUC0_GSUWGMRR0_K1_LBSPPA256_LBSPPB512_MIWT1_1_NLCA1_NLCB1_SU0_SUM0_SUS0_WG16_8_1_WGM8_WGMXCC1_WGMXCCGn1
    SolutionIndex: 284
    SolutionNameMin: Cijk_Ailk_Bjlk_HHS_BH_Bias_FDMN_SPA_AS_SAV_MT32x16x128_MI16x16x1_SN_GRVWA8_GRVWB2_GSU12_GSUC0_GSUWGMRR0_K1_LBSPPA512_LBSPPB256_MIWT1_1_NLCA1_NLCB1_SU0_SUM0_SUS0_WG32_4_1_WGM1_WGMXCC1_WGMXCCGn1
    SolutionIndex: 285
    SolutionNameMin: Cijk_Ailk_Bjlk_HHS_BH_Bias_FDMN_SPA_AS_SAV_MT32x32x128_MI16x16x1_SN_GRVWA8_GRVWB2_GSU16_GSUC0_GSUWGMRR0_K1_LBSPPA512_LBSPPB512_MIWT1_1_NLCA1_NLCB1_SU0_SUM0_SUS0_WG32_8_1_WGM1_WGMXCC1_WGMXCCGn1
    SolutionIndex: 286
    SolutionNameMin: Cijk_Ailk_Bjlk_HHS_BH_Bias_FDMN_SPA_AS_SAV_MT32x32x128_MI16x16x1_SN_GRVWA4_GRVWB8_GSU16_GSUC0_GSUWGMRR0_K1_LBSPPA512_LBSPPB512_MIWT1_1_NLCA1_NLCB1_SU0_SUM0_SUS0_WG32_8_1_WGM8_WGMXCC1_WGMXCCGn1
    SolutionIndex: 287
    SolutionNameMin: Cijk_Ailk_Bjlk_HHS_BH_Bias_FDMN_SPA_AS_SAV_MT32x64x128_MI16x16x1_SN_GRVWA8_GRVWB8_GSU16_GSUC0_GSUWGMRR0_K1_LBSPPA512_LBSPPB1024_MIWT2_1_NLCA1_NLCB1_SU0_SUM0_SUS0_WG16_16_1_WGM1_WGMXCC1_WGMXCCGn1
    SolutionIndex: 288
    SolutionNameMin: Cijk_Ailk_Bjlk_HHS_BH_Bias_FDMN_SPA_AS_SAV_MT128x16x128_MI16x16x1_SN_GRVWA8_GRVWB8_GSU16_GSUC0_GSUWGMRR0_K1_LBSPPA2048_LBSPPB256_MIWT2_1_NLCA1_NLCB1_SU0_SUM0_SUS0_WG64_4_1_WGM8_WGMXCC1_WGMXCCGn1
    SolutionIndex: 289
    SolutionNameMin: Cijk_Ailk_Bjlk_HHS_BH_Bias_FDMN_SPA_AS_SAV_MT32x64x64_MI16x16x1_SN_GRVWA4_GRVWB8_GSU12_GSUC0_GSUWGMRR0_K1_LBSPPA512_LBSPPB1024_MIWT2_1_NLCA1_NLCB1_SU0_SUM0_SUS0_WG16_16_1_WGM1_WGMXCC1_WGMXCCGn1
    SolutionIndex: 290
    SolutionNameMin: Cijk_Ailk_Bjlk_HHS_BH_Bias_FDMN_SPA_AS_SAV_MT64x64x128_MI16x16x1_SN_GRVWA4_GRVWB8_GSU16_GSUC0_GSUWGMRR0_K1_LBSPPA1024_LBSPPB1024_MIWT2_2_NLCA1_NLCB1_SU0_SUM0_SUS0_WG32_8_1_WGM8_WGMXCC1_WGMXCCGn1
    SolutionIndex: 291
    SolutionNameMin: Cijk_Ailk_Bjlk_HHS_BH_Bias_FDMN_SPA_AS_SAV_MT32x32x128_MI16x16x1_SN_GRVWA8_GRVWB8_GSU16_GSUC0_GSUWGMRR0_K1_LBSPPA512_LBSPPB512_MIWT1_1_NLCA1_NLCB1_SU0_SUM0_SUS0_WG32_8_1_WGM8_WGMXCC1_WGMXCCGn1
    SolutionIndex: 292
    SolutionNameMin: Cijk_Ailk_Bjlk_HHS_BH_Bias_FDMN_SPA_AS_SAV_MT96x32x128_MI16x16x1_SN_GRVWA8_GRVWB8_GSU16_GSUC0_GSUWGMRR0_K1_LBSPPA1536_LBSPPB512_MIWT3_1_NLCA3_NLCB1_SU0_SUM0_SUS0_WG32_8_1_WGM1_WGMXCC1_WGMXCCGn1
    SolutionIndex: 293
    SolutionNameMin: Cijk_Ailk_Bjlk_HHS_BH_Bias_FDMN_SPA_AS_SAV_MT32x64x128_MI16x16x1_SN_GRVWA8_GRVWB8_GSU16_GSUC0_GSUWGMRR0_K1_LBSPPA512_LBSPPB1024_MIWT1_2_NLCA1_NLCB1_SU0_SUM0_SUS0_WG32_8_1_WGM1_WGMXCC1_WGMXCCGn1
    SolutionIndex: 294
    SolutionNameMin: Cijk_Ailk_Bjlk_HHS_BH_Bias_FDMN_SPA_AS_SAV_MT32x64x64_MI16x16x1_SN_GRVWA4_GRVWB8_GSU15_GSUC0_GSUWGMRR0_K1_LBSPPA512_LBSPPB1024_MIWT2_1_NLCA1_NLCB1_SU0_SUM0_SUS0_WG16_16_1_WGM1_WGMXCC1_WGMXCCGn1
    SolutionIndex: 295
    SolutionNameMin: Cijk_Ailk_Bjlk_HHS_BH_Bias_FDMN_SPA_AS_SAV_MT32x64x128_MI16x16x1_SN_GRVWA4_GRVWB8_GSU11_GSUC0_GSUWGMRR0_K1_LBSPPA512_LBSPPB1024_MIWT2_1_NLCA1_NLCB1_SU0_SUM0_SUS0_WG16_16_1_WGM8_WGMXCC1_WGMXCCGn1
    SolutionIndex: 296
    SolutionNameMin: Cijk_Ailk_Bjlk_HHS_BH_Bias_FDMN_SPA_AS_SAV_MT128x32x128_MI16x16x1_SN_GRVWA4_GRVWB8_GSU16_GSUC0_GSUWGMRR0_K1_LBSPPA2048_LBSPPB512_MIWT2_2_NLCA1_NLCB1_SU0_SUM0_SUS0_WG64_4_1_WGM1_WGMXCC1_WGMXCCGn1
    SolutionIndex: 297
    SolutionNameMin: Cijk_Ailk_Bjlk_HHS_BH_Bias_FDMN_SPA_AS_SAV_MT32x32x128_MI16x16x1_SN_GRVWA8_GRVWB8_GSU12_GSUC0_GSUWGMRR0_K1_LBSPPA512_LBSPPB512_MIWT1_1_NLCA1_NLCB1_SU0_SUM0_SUS0_WG32_8_1_WGM1_WGMXCC1_WGMXCCGn1
    SolutionIndex: 298
    SolutionNameMin: Cijk_Ailk_Bjlk_HHS_BH_Bias_FDMN_SPA_AS_SAV_MT32x32x128_MI16x16x1_SN_GRVWA4_GRVWB8_GSU8_GSUC0_GSUWGMRR0_K1_LBSPPA512_LBSPPB512_MIWT1_1_NLCA1_NLCB1_SU0_SUM0_SUS0_WG32_8_1_WGM8_WGMXCC1_WGMXCCGn1
    SolutionIndex: 299
    SolutionNameMin: Cijk_Ailk_Bjlk_HHS_BH_Bias_FDMN_SPA_AS_SAV_MT64x32x128_MI16x16x1_SN_GRVWA8_GRVWB8_GSU12_GSUC0_GSUWGMRR0_K1_LBSPPA1024_LBSPPB512_MIWT2_1_NLCA1_NLCB1_SU0_SUM0_SUS0_WG32_8_1_WGM8_WGMXCC1_WGMXCCGn1
    SolutionIndex: 300
    SolutionNameMin: Cijk_Ailk_Bjlk_HHS_BH_Bias_FDMN_SPA_AS_SAV_MT32x64x128_MI16x16x1_SN_GRVWA4_GRVWB8_GSU8_GSUC0_GSUWGMRR0_K1_LBSPPA512_LBSPPB1024_MIWT1_2_NLCA1_NLCB1_SU0_SUM0_SUS0_WG32_8_1_WGM1_WGMXCC1_WGMXCCGn1
    SolutionIndex: 301
    SolutionNameMin: Cijk_Ailk_Bjlk_HHS_BH_Bias_FDMN_SPA_AS_SAV_MT16x64x128_MI16x16x1_SN_GRVWA4_GRVWB8_GSU16_GSUC0_GSUWGMRR0_K1_LBSPPA256_LBSPPB1024_MIWT1_1_NLCA1_NLCB1_SU0_SUM0_SUS0_WG16_16_1_WGM8_WGMXCC1_WGMXCCGn1
    SolutionIndex: 302
    SolutionNameMin: Cijk_Ailk_Bjlk_HHS_BH_Bias_FDMN_SPA_AS_SAV_MT64x32x128_MI16x16x1_SN_GRVWA4_GRVWB8_GSU16_GSUC0_GSUWGMRR0_K1_LBSPPA1024_LBSPPB512_MIWT1_2_NLCA1_NLCB1_SU0_SUM0_SUS0_WG64_4_1_WGM8_WGMXCC1_WGMXCCGn1
    SolutionIndex: 303
    SolutionNameMin: Cijk_Ailk_Bjlk_HHS_BH_Bias_FDMN_SPA_AS_SAV_MT32x64x128_MI16x16x1_SN_GRVWA4_GRVWB2_GSU16_GSUC0_GSUWGMRR0_K1_LBSPPA512_LBSPPB1024_MIWT1_2_NLCA1_NLCB1_SU0_SUM0_SUS0_WG32_8_1_WGM8_WGMXCC1_WGMXCCGn1
    SolutionIndex: 304
    SolutionNameMin: Cijk_Ailk_Bjlk_HHS_BH_Bias_FDMN_SPA_AS_SAV_MT64x48x128_MI16x16x1_SN_GRVWA4_GRVWB8_GSU16_GSUC0_GSUWGMRR0_K1_LBSPPA1024_LBSPPB768_MIWT1_3_NLCA1_NLCB3_SU0_SUM0_SUS0_WG64_4_1_WGM1_WGMXCC1_WGMXCCGn1
    SolutionIndex: 305
    SolutionNameMin: Cijk_Ailk_Bjlk_HHS_BH_Bias_FDMN_SPA_AS_SAV_MT64x32x128_MI16x16x1_SN_GRVWA4_GRVWB2_GSU11_GSUC0_GSUWGMRR0_K1_LBSPPA1024_LBSPPB512_MIWT1_2_NLCA1_NLCB1_SU0_SUM0_SUS0_WG64_4_1_WGM1_WGMXCC1_WGMXCCGn1
    SolutionIndex: 306
    SolutionNameMin: Cijk_Ailk_Bjlk_HHS_BH_Bias_FDMN_SPA_AS_SAV_MT32x64x64_MI16x16x1_SN_GRVWA4_GRVWB8_GSU9_GSUC0_GSUWGMRR0_K1_LBSPPA512_LBSPPB1024_MIWT2_1_NLCA1_NLCB1_SU0_SUM0_SUS0_WG16_16_1_WGM8_WGMXCC1_WGMXCCGn1
    SolutionIndex: 307
    SolutionNameMin: Cijk_Ailk_Bjlk_HHS_BH_Bias_FDMN_SPA_AS_SAV_MT48x64x128_MI16x16x1_SN_GRVWA4_GRVWB8_GSU16_GSUC0_GSUWGMRR0_K1_LBSPPA768_LBSPPB1024_MIWT3_1_NLCA3_NLCB1_SU0_SUM0_SUS0_WG16_16_1_WGM1_WGMXCC1_WGMXCCGn1
    SolutionIndex: 308
    SolutionNameMin: Cijk_Ailk_Bjlk_HHS_BH_Bias_FDMN_SPA_AS_SAV_MT64x64x64_MI16x16x1_SN_GRVWA8_GRVWB8_GSU16_GSUC0_GSUWGMRR0_K1_LBSPPA1024_LBSPPB1024_MIWT2_2_NLCA1_NLCB1_SU0_SUM0_SUS0_WG32_8_1_WGM1_WGMXCC1_WGMXCCGn1
    SolutionIndex: 309
    SolutionNameMin: Cijk_Ailk_Bjlk_HHS_BH_Bias_FDMN_SPA_AS_SAV_MT64x64x128_MI16x16x1_SN_GRVWA8_GRVWB8_GSU16_GSUC0_GSUWGMRR0_K1_LBSPPA1024_LBSPPB1024_MIWT1_4_NLCA1_NLCB1_SU0_SUM0_SUS0_WG64_4_1_WGM1_WGMXCC1_WGMXCCGn1
    SolutionIndex: 310
    SolutionNameMin: Cijk_Ailk_Bjlk_HHS_BH_Bias_FDMN_SPA_AS_SAV_MT32x64x128_MI16x16x1_SN_GRVWA8_GRVWB8_GSU8_GSUC0_GSUWGMRR0_K1_LBSPPA512_LBSPPB1024_MIWT1_2_NLCA1_NLCB1_SU0_SUM0_SUS0_WG32_8_1_WGM8_WGMXCC1_WGMXCCGn1
    SolutionIndex: 311
    SolutionNameMin: Cijk_Ailk_Bjlk_HHS_BH_Bias_FDMN_SPA_AS_SAV_MT32x32x128_MI16x16x1_SN_GRVWA8_GRVWB8_GSU14_GSUC0_GSUWGMRR0_K1_LBSPPA512_LBSPPB512_MIWT1_1_NLCA1_NLCB1_SU0_SUM0_SUS0_WG32_8_1_WGM1_WGMXCC1_WGMXCCGn1
    SolutionIndex: 312
    SolutionNameMin: Cijk_Ailk_Bjlk_HHS_BH_Bias_FDMN_SPA_AS_SAV_MT32x64x64_MI16x16x1_SN_GRVWA4_GRVWB8_GSU16_GSUC0_GSUWGMRR0_K1_LBSPPA512_LBSPPB1024_MIWT2_1_NLCA1_NLCB1_SU0_SUM0_SUS0_WG16_16_1_WGM1_WGMXCC1_WGMXCCGn1
    SolutionIndex: 313
    SolutionNameMin: Cijk_Ailk_Bjlk_HHS_BH_Bias_FDMN_SPA_AS_SAV_MT32x64x64_MI16x16x1_SN_GRVWA4_GRVWB8_GSU12_GSUC0_GSUWGMRR0_K1_LBSPPA512_LBSPPB1024_MIWT1_2_NLCA1_NLCB1_SU0_SUM0_SUS0_WG32_8_1_WGM1_WGMXCC1_WGMXCCGn1
    SolutionIndex: 314
    SolutionNameMin: Cijk_Ailk_Bjlk_HHS_BH_Bias_FDMN_SPA_AS_SAV_MT32x64x128_MI16x16x1_SN_GRVWA4_GRVWB8_GSU16_GSUC0_GSUWGMRR0_K1_LBSPPA512_LBSPPB1024_MIWT1_2_NLCA1_NLCB1_SU0_SUM0_SUS0_WG32_8_1_WGM1_WGMXCC1_WGMXCCGn1
    SolutionIndex: 315
    SolutionNameMin: Cijk_Ailk_Bjlk_HHS_BH_Bias_FDMN_SPA_AS_SAV_MT48x64x128_MI16x16x1_SN_GRVWA4_GRVWB8_GSU16_GSUC0_GSUWGMRR0_K1_LBSPPA768_LBSPPB1024_MIWT3_1_NLCA3_NLCB1_SU0_SUM0_SUS0_WG16_16_1_WGM8_WGMXCC1_WGMXCCGn1
    SolutionIndex: 316
    SolutionNameMin: Cijk_Ailk_Bjlk_HHS_BH_Bias_FDMN_SPA_AS_SAV_MT32x64x128_MI16x16x1_SN_GRVWA8_GRVWB8_GSU12_GSUC0_GSUWGMRR0_K1_LBSPPA512_LBSPPB1024_MIWT2_1_NLCA1_NLCB1_SU0_SUM0_SUS0_WG16_16_1_WGM8_WGMXCC1_WGMXCCGn1
    SolutionIndex: 317
    SolutionNameMin: Cijk_Ailk_Bjlk_HHS_BH_Bias_FDMN_SPA_AS_SAV_MT48x64x128_MI16x16x1_SN_GRVWA4_GRVWB8_GSU14_GSUC0_GSUWGMRR0_K1_LBSPPA768_LBSPPB1024_MIWT3_1_NLCA3_NLCB1_SU0_SUM0_SUS0_WG16_16_1_WGM1_WGMXCC1_WGMXCCGn1
    SolutionIndex: 318
    SolutionNameMin: Cijk_Ailk_Bjlk_HHS_BH_Bias_FDMN_SPA_AS_SAV_MT32x64x128_MI16x16x1_SN_GRVWA8_GRVWB2_GSU16_GSUC0_GSUWGMRR0_K1_LBSPPA512_LBSPPB1024_MIWT1_2_NLCA1_NLCB1_SU0_SUM0_SUS0_WG32_8_1_WGM1_WGMXCC1_WGMXCCGn1
    SolutionIndex: 319
    SolutionNameMin: Cijk_Ailk_Bjlk_HHS_BH_Bias_FDMN_SPA_AS_SAV_MT64x32x128_MI16x16x1_SN_GRVWA8_GRVWB8_GSU11_GSUC0_GSUWGMRR0_K1_LBSPPA1024_LBSPPB512_MIWT2_1_NLCA1_NLCB1_SU0_SUM0_SUS0_WG32_8_1_WGM1_WGMXCC1_WGMXCCGn1
    SolutionIndex: 320
    SolutionNameMin: Cijk_Ailk_Bjlk_HHS_BH_Bias_FDMN_SPA_AS_SAV_MT48x64x128_MI16x16x1_SN_GRVWA4_GRVWB8_GSU11_GSUC0_GSUWGMRR0_K1_LBSPPA768_LBSPPB1024_MIWT3_1_NLCA3_NLCB1_SU0_SUM0_SUS0_WG16_16_1_WGM1_WGMXCC1_WGMXCCGn1
    SolutionIndex: 321
    SolutionNameMin: Cijk_Ailk_Bjlk_HHS_BH_Bias_FDMN_SPA_AS_SAV_MT48x64x128_MI16x16x1_SN_GRVWA4_GRVWB8_GSU14_GSUC0_GSUWGMRR0_K1_LBSPPA768_LBSPPB1024_MIWT3_1_NLCA3_NLCB1_SU0_SUM0_SUS0_WG16_16_1_WGM8_WGMXCC1_WGMXCCGn1
    SolutionIndex: 322
    SolutionNameMin: Cijk_Ailk_Bjlk_HHS_BH_Bias_FDMN_SPA_AS_SAV_MT16x64x128_MI16x16x1_SN_GRVWA4_GRVWB8_GSU11_GSUC0_GSUWGMRR0_K1_LBSPPA256_LBSPPB1024_MIWT1_1_NLCA1_NLCB1_SU0_SUM0_SUS0_WG16_16_1_WGM1_WGMXCC1_WGMXCCGn1
    SolutionIndex: 323
    SolutionNameMin: Cijk_Ailk_Bjlk_HHS_BH_Bias_FDMN_SPA_AS_SAV_MT32x64x128_MI16x16x1_SN_GRVWA8_GRVWB2_GSU11_GSUC0_GSUWGMRR0_K1_LBSPPA512_LBSPPB1024_MIWT2_1_NLCA1_NLCB1_SU0_SUM0_SUS0_WG16_16_1_WGM1_WGMXCC1_WGMXCCGn1
    SolutionIndex: 324
    SolutionNameMin: Cijk_Ailk_Bjlk_HHS_BH_Bias_FDMN_SPA_AS_SAV_MT16x128x128_MI16x16x1_SN_GRVWA4_GRVWB8_GSU8_GSUC0_GSUWGMRR0_K1_LBSPPA256_LBSPPB2048_MIWT1_2_NLCA1_NLCB1_SU0_SUM0_SUS0_WG16_16_1_WGM8_WGMXCC1_WGMXCCGn1
    SolutionIndex: 325
    SolutionNameMin: Cijk_Ailk_Bjlk_HHS_BH_Bias_FDMN_SPA_AS_SAV_MT16x128x128_MI16x16x1_SN_GRVWA4_GRVWB8_GSU9_GSUC0_GSUWGMRR0_K1_LBSPPA256_LBSPPB2048_MIWT1_2_NLCA1_NLCB1_SU0_SUM0_SUS0_WG16_16_1_WGM1_WGMXCC1_WGMXCCGn1
    SolutionIndex: 326
    SolutionNameMin: Cijk_Ailk_Bjlk_HHS_BH_Bias_FDMN_SPA_AS_SAV_MT16x16x128_MI16x16x1_SN_GSU16_GSUC0_GSUWGMRR0_K1_LBSPPA256_LBSPPB256_MIWT1_1_NLCA1_NLCB1_SU0_SUM0_SUS0_WG16_4_1_WGM8_WGMXCC1_WGMXCCGn1
    SolutionIndex: 327
    SolutionNameMin: Cijk_Ailk_Bjlk_HHS_BH_Bias_FDMN_SPA_AS_SAV_MT64x48x128_MI16x16x1_SN_GSU12_GSUC0_GSUWGMRR0_K1_LBSPPA1024_LBSPPB768_MIWT1_3_NLCA1_NLCB3_SU0_SUM0_SUS0_WG64_4_1_WGM8_WGMXCC1_WGMXCCGn1
    SolutionIndex: 328
    SolutionNameMin: Cijk_Ailk_Bjlk_HHS_BH_Bias_FDMN_SPA_AS_SAV_MT16x16x128_MI16x16x1_SN_GSU12_GSUC0_GSUWGMRR0_K1_LBSPPA256_LBSPPB256_MIWT1_1_NLCA1_NLCB1_SU0_SUM0_SUS0_WG16_4_1_WGM8_WGMXCC1_WGMXCCGn1
    SolutionIndex: 329
    SolutionNameMin: Cijk_Ailk_Bjlk_HHS_BH_Bias_FDMN_SPA_AS_SAV_MT32x32x128_MI16x16x1_SN_GSU16_GSUC0_GSUWGMRR0_K1_LBSPPA512_LBSPPB512_MIWT1_1_NLCA1_NLCB1_SU0_SUM0_SUS0_WG32_8_1_WGM8_WGMXCC1_WGMXCCGn1
    SolutionIndex: 330
    SolutionNameMin: Cijk_Ailk_Bjlk_HHS_BH_Bias_FDMN_SPA_AS_SAV_MT32x32x128_MI16x16x1_SN_GSU8_GSUC0_GSUWGMRR0_K1_LBSPPA512_LBSPPB512_MIWT1_1_NLCA1_NLCB1_SU0_SUM0_SUS0_WG32_8_1_WGM8_WGMXCC1_WGMXCCGn1
    SolutionIndex: 331
    SolutionNameMin: Cijk_Ailk_Bjlk_HHS_BH_Bias_FDMN_SPA_AS_SAV_MT64x16x128_MI16x16x1_SN_GSU16_GSUC0_GSUWGMRR0_K1_LBSPPA1024_LBSPPB256_MIWT1_1_NLCA1_NLCB1_SU0_SUM0_SUS0_WG64_4_1_WGM8_WGMXCC1_WGMXCCGn1
    SolutionIndex: 332
    SolutionNameMin: Cijk_Ailk_Bjlk_HHS_BH_Bias_FDMN_SPA_AS_SAV_MT96x32x128_MI16x16x1_SN_GSU12_GSUC0_GSUWGMRR0_K1_LBSPPA1536_LBSPPB512_MIWT3_1_NLCA3_NLCB1_SU0_SUM0_SUS0_WG32_8_1_WGM8_WGMXCC1_WGMXCCGn1
    SolutionIndex: 333
    SolutionNameMin: Cijk_Ailk_Bjlk_HHS_BH_Bias_FDMN_SPA_AS_SAV_MT64x16x128_MI16x16x1_SN_GSU8_GSUC0_GSUWGMRR0_K1_LBSPPA1024_LBSPPB256_MIWT1_1_NLCA1_NLCB1_SU0_SUM0_SUS0_WG64_4_1_WGM8_WGMXCC1_WGMXCCGn1
    SolutionIndex: 334
    SolutionNameMin: Cijk_Ailk_Bjlk_HHS_BH_Bias_FDMN_SPA_AS_SAV_MT64x16x128_MI16x16x1_SN_GSU12_GSUC0_GSUWGMRR0_K1_LBSPPA1024_LBSPPB256_MIWT1_1_NLCA1_NLCB1_SU0_SUM0_SUS0_WG64_4_1_WGM8_WGMXCC1_WGMXCCGn1
    SolutionIndex: 335
    SolutionNameMin: Cijk_Ailk_Bjlk_HHS_BH_Bias_FDMN_SPA_AS_SAV_MT128x16x128_MI16x16x1_SN_GSU16_GSUC0_GSUWGMRR0_K1_LBSPPA2048_LBSPPB256_MIWT2_1_NLCA1_NLCB1_SU0_SUM0_SUS0_WG64_4_1_WGM8_WGMXCC1_WGMXCCGn1
    SolutionIndex: 336
    SolutionNameMin: Cijk_Ailk_Bjlk_HHS_BH_Bias_FDMN_SPA_AS_SAV_MT128x16x128_MI16x16x1_SN_GSU12_GSUC0_GSUWGMRR0_K1_LBSPPA2048_LBSPPB256_MIWT2_1_NLCA1_NLCB1_SU0_SUM0_SUS0_WG64_4_1_WGM8_WGMXCC1_WGMXCCGn1
    SolutionIndex: 337
    SolutionNameMin: Cijk_Ailk_Bjlk_HHS_BH_Bias_FDMN_SPA_AS_SAV_MT96x32x128_MI16x16x1_SN_GSU16_GSUC0_GSUWGMRR0_K1_LBSPPA1536_LBSPPB512_MIWT3_1_NLCA3_NLCB1_SU0_SUM0_SUS0_WG32_8_1_WGM8_WGMXCC1_WGMXCCGn1
    SolutionIndex: 338
    SolutionNameMin: Cijk_Ailk_Bjlk_HHS_BH_Bias_FDMN_SPA_AS_SAV_MT192x16x128_MI16x16x1_SN_GSU12_GSUC0_GSUWGMRR0_K1_LBSPPA3072_LBSPPB256_MIWT3_1_NLCA3_NLCB1_SU0_SUM0_SUS0_WG64_4_1_WGM8_WGMXCC1_WGMXCCGn1
    SolutionIndex: 339
    SolutionNameMin: Cijk_Ailk_Bjlk_HHS_BH_Bias_FDMN_SPA_AS_SAV_MT64x32x128_MI16x16x1_SN_GSU16_GSUC0_GSUWGMRR0_K1_LBSPPA1024_LBSPPB512_MIWT1_2_NLCA1_NLCB1_SU0_SUM0_SUS0_WG64_4_1_WGM8_WGMXCC1_WGMXCCGn1
    SolutionIndex: 340
    SolutionNameMin: Cijk_Ailk_Bjlk_HHS_BH_Bias_FDMN_SPA_AS_SAV_MT64x48x128_MI16x16x1_SN_GSU16_GSUC0_GSUWGMRR0_K1_LBSPPA1024_LBSPPB768_MIWT1_3_NLCA1_NLCB3_SU0_SUM0_SUS0_WG64_4_1_WGM8_WGMXCC1_WGMXCCGn1
    SolutionIndex: 341
    SolutionNameMin: Cijk_Ailk_Bjlk_HHS_BH_Bias_FDMN_SPA_AS_SAV_MT128x16x128_MI16x16x1_SN_GSU8_GSUC0_GSUWGMRR0_K1_LBSPPA2048_LBSPPB256_MIWT2_1_NLCA1_NLCB1_SU0_SUM0_SUS0_WG64_4_1_WGM8_WGMXCC1_WGMXCCGn1
    SolutionIndex: 342
    SolutionNameMin: Cijk_Ailk_Bjlk_HHS_BH_Bias_FDMN_SPA_AS_SAV_MT64x32x128_MI16x16x1_SN_GSU8_GSUC0_GSUWGMRR0_K1_LBSPPA1024_LBSPPB512_MIWT1_2_NLCA1_NLCB1_SU0_SUM0_SUS0_WG64_4_1_WGM8_WGMXCC1_WGMXCCGn1
    SolutionIndex: 343
    SolutionNameMin: Cijk_Ailk_Bjlk_HHS_BH_Bias_FDMN_SPA_AS_SAV_MT32x64x128_MI16x16x1_SN_GSU16_GSUC0_GSUWGMRR0_K1_LBSPPA512_LBSPPB1024_MIWT1_2_NLCA1_NLCB1_SU0_SUM0_SUS0_WG32_8_1_WGM8_WGMXCC1_WGMXCCGn1
    SolutionIndex: 344
    SolutionNameMin: Cijk_Ailk_Bjlk_HHS_BH_Bias_FDMN_SPA_AS_SAV_MT32x64x128_MI16x16x1_SN_GSU12_GSUC0_GSUWGMRR0_K1_LBSPPA512_LBSPPB1024_MIWT1_2_NLCA1_NLCB1_SU0_SUM0_SUS0_WG32_8_1_WGM8_WGMXCC1_WGMXCCGn1
    SolutionIndex: 345
    SolutionNameMin: Cijk_Ailk_Bjlk_HHS_BH_Bias_FDMN_SPA_AS_SAV_MT32x32x128_MI16x16x1_SN_GSU12_GSUC0_GSUWGMRR0_K1_LBSPPA512_LBSPPB512_MIWT1_1_NLCA1_NLCB1_SU0_SUM0_SUS0_WG32_8_1_WGM8_WGMXCC1_WGMXCCGn1
    SolutionIndex: 346
    SolutionNameMin: Cijk_Ailk_Bjlk_HHS_BH_Bias_FDMN_SPA_AS_SAV_MT64x32x128_MI16x16x1_SN_GSU12_GSUC0_GSUWGMRR0_K1_LBSPPA1024_LBSPPB512_MIWT1_2_NLCA1_NLCB1_SU0_SUM0_SUS0_WG64_4_1_WGM8_WGMXCC1_WGMXCCGn1
    SolutionIndex: 347
    SolutionNameMin: Cijk_Ailk_Bjlk_HHS_BH_Bias_FDMN_SPA_AS_SAV_MT32x96x128_MI16x16x1_SN_GSU12_GSUC0_GSUWGMRR0_K1_LBSPPA512_LBSPPB1536_MIWT1_3_NLCA1_NLCB3_SU0_SUM0_SUS0_WG32_8_1_WGM8_WGMXCC1_WGMXCCGn1
    SolutionIndex: 348
    SolutionNameMin: Cijk_Ailk_Bjlk_HHS_BH_Bias_FDMN_SPA_AS_SAV_MT16x16x128_MI16x16x1_SN_GSU8_GSUC0_GSUWGMRR0_K1_LBSPPA256_LBSPPB256_MIWT1_1_NLCA1_NLCB1_SU0_SUM0_SUS0_WG16_4_1_WGM8_WGMXCC1_WGMXCCGn1
    SolutionIndex: 349
    SolutionNameMin: Cijk_Ailk_Bjlk_HHS_BH_Bias_FDMN_SPA_AS_SAV_MT64x80x128_MI16x16x1_SN_GSU4_GSUC0_GSUWGMRR0_K1_LBSPPA1024_LBSPPB1280_MIWT1_5_NLCA1_NLCB5_SU0_SUM0_SUS0_WG64_4_1_WGM8_WGMXCC1_WGMXCCGn1
    SolutionIndex: 350
    SolutionNameMin: Cijk_Ailk_Bjlk_HHS_BH_Bias_FDMN_SPA_AS_SAV_MT160x32x128_MI16x16x1_SN_GSU4_GSUC0_GSUWGMRR0_K1_LBSPPA2560_LBSPPB512_MIWT5_1_NLCA5_NLCB1_SU0_SUM0_SUS0_WG32_8_1_WGM8_WGMXCC1_WGMXCCGn1
    SolutionIndex: 351
    SolutionNameMin: Cijk_Ailk_Bjlk_HHS_BH_Bias_FDMN_SPA_AS_SAV_MT192x32x128_MI16x16x1_SN_GSU4_GSUC0_GSUWGMRR0_K1_LBSPPA3072_LBSPPB512_MIWT3_2_NLCA3_NLCB1_SU0_SUM0_SUS0_WG64_4_1_WGM8_WGMXCC1_WGMXCCGn1
    SolutionIndex: 352
    SolutionNameMin: Cijk_Ailk_Bjlk_HHS_BH_Bias_FDMN_SPA_AS_SAV_MT128x16x128_MI16x16x1_SN_GSU4_GSUC0_GSUWGMRR0_K1_LBSPPA2048_LBSPPB256_MIWT2_1_NLCA1_NLCB1_SU0_SUM0_SUS0_WG64_4_1_WGM8_WGMXCC1_WGMXCCGn1
    SolutionIndex: 353
    SolutionNameMin: Cijk_Ailk_Bjlk_HHS_BH_Bias_FDMN_SPA_AS_SAV_MT192x16x128_MI16x16x1_SN_GSU4_GSUC0_GSUWGMRR0_K1_LBSPPA3072_LBSPPB256_MIWT3_1_NLCA3_NLCB1_SU0_SUM0_SUS0_WG64_4_1_WGM8_WGMXCC1_WGMXCCGn1
    SolutionIndex: 354
    SolutionNameMin: Cijk_Ailk_Bjlk_HHS_BH_Bias_FDMN_SPA_AS_SAV_MT96x64x128_MI16x16x1_SN_GSU4_GSUC0_GSUWGMRR0_K1_LBSPPA1536_LBSPPB1024_MIWT3_2_NLCA3_NLCB1_SU0_SUM0_SUS0_WG32_8_1_WGM8_WGMXCC1_WGMXCCGn1
    SolutionIndex: 355
    SolutionNameMin: Cijk_Ailk_Bjlk_HHS_BH_Bias_FDMN_SPA_AS_SAV_MT224x32x128_MI16x16x1_SN_GSU4_GSUC0_GSUWGMRR0_K1_LBSPPA3584_LBSPPB512_MIWT7_1_NLCA7_NLCB1_SU0_SUM0_SUS0_WG32_8_1_WGM8_WGMXCC1_WGMXCCGn1
    SolutionIndex: 356
    SolutionNameMin: Cijk_Ailk_Bjlk_HHS_BH_Bias_FDMN_SPA_AS_SAV_MT32x32x128_MI16x16x1_SN_GSU1_GSUC0_GSUWGMRR0_K1_LBSPPA512_LBSPPB512_MIWT1_1_NLCA1_NLCB1_SU0_SUM0_SUS0_WG32_8_1_WGM8_WGMXCC1_WGMXCCGn1
    SolutionIndex: 357
    SolutionNameMin: Cijk_Ailk_Bjlk_HHS_BH_Bias_FDMN_SPA_AS_SAV_MT320x16x128_MI16x16x1_SN_GSU4_GSUC0_GSUWGMRR0_K1_LBSPPA5120_LBSPPB256_MIWT5_1_NLCA5_NLCB1_SU0_SUM0_SUS0_WG64_4_1_WGM8_WGMXCC1_WGMXCCGn1
    SolutionIndex: 358
    SolutionNameMin: Cijk_Ailk_Bjlk_HHS_BH_Bias_FDMN_SPA_AS_SAV_MT64x16x128_MI16x16x1_SN_GSU1_GSUC0_GSUWGMRR0_K1_LBSPPA1024_LBSPPB256_MIWT1_1_NLCA1_NLCB1_SU0_SUM0_SUS0_WG64_4_1_WGM8_WGMXCC1_WGMXCCGn1
    SolutionIndex: 359
    SolutionNameMin: Cijk_Ailk_Bjlk_HHS_BH_Bias_FDMN_SPA_AS_SAV_MT32x64x128_MI16x16x1_SN_GSU4_GSUC0_GSUWGMRR0_K1_LBSPPA512_LBSPPB1024_MIWT1_2_NLCA1_NLCB1_SU0_SUM0_SUS0_WG32_8_1_WGM8_WGMXCC1_WGMXCCGn1
    SolutionIndex: 360
    SolutionNameMin: Cijk_Ailk_Bjlk_HHS_BH_Bias_FDMN_SPA_AS_SAV_MT128x32x128_MI16x16x1_SN_GSU4_GSUC0_GSUWGMRR0_K1_LBSPPA2048_LBSPPB512_MIWT2_2_NLCA1_NLCB1_SU0_SUM0_SUS0_WG64_4_1_WGM8_WGMXCC1_WGMXCCGn1
    SolutionIndex: 361
    SolutionNameMin: Cijk_Ailk_Bjlk_HHS_BH_Bias_FDMN_SPA_AS_SAV_MT128x48x128_MI16x16x1_SN_GSU4_GSUC0_GSUWGMRR0_K1_LBSPPA2048_LBSPPB768_MIWT2_3_NLCA1_NLCB3_SU0_SUM0_SUS0_WG64_4_1_WGM8_WGMXCC1_WGMXCCGn1
    SolutionIndex: 362
    SolutionNameMin: Cijk_Ailk_Bjlk_HHS_BH_Bias_FDMN_SPA_AS_SAV_MT32x128x128_MI16x16x1_SN_GSU4_GSUC0_GSUWGMRR0_K1_LBSPPA512_LBSPPB2048_MIWT1_4_NLCA1_NLCB1_SU0_SUM0_SUS0_WG32_8_1_WGM8_WGMXCC1_WGMXCCGn1
    SolutionIndex: 363
    SolutionNameMin: Cijk_Ailk_Bjlk_HHS_BH_Bias_FDMN_SPA_AS_SAV_MT96x32x128_MI16x16x1_SN_GSU4_GSUC0_GSUWGMRR0_K1_LBSPPA1536_LBSPPB512_MIWT3_1_NLCA3_NLCB1_SU0_SUM0_SUS0_WG32_8_1_WGM8_WGMXCC1_WGMXCCGn1
    SolutionIndex: 364
    SolutionNameMin: Cijk_Ailk_Bjlk_HHS_BH_Bias_FDMN_SPA_AS_SAV_MT32x32x128_MI16x16x1_SN_GSU4_GSUC0_GSUWGMRR0_K1_LBSPPA512_LBSPPB512_MIWT1_1_NLCA1_NLCB1_SU0_SUM0_SUS0_WG32_8_1_WGM8_WGMXCC1_WGMXCCGn1
    SolutionIndex: 365
    SolutionNameMin: Cijk_Ailk_Bjlk_HHS_BH_Bias_FDMN_SPA_AS_SAV_MT64x48x128_MI16x16x1_SN_GSU4_GSUC0_GSUWGMRR0_K1_LBSPPA1024_LBSPPB768_MIWT1_3_NLCA1_NLCB3_SU0_SUM0_SUS0_WG64_4_1_WGM8_WGMXCC1_WGMXCCGn1
    SolutionIndex: 366
    SolutionNameMin: Cijk_Ailk_Bjlk_HHS_BH_Bias_FDMN_SPA_AS_SAV_MT96x96x128_MI16x16x1_SN_GSU4_GSUC0_GSUWGMRR0_K1_LBSPPA1536_LBSPPB1536_MIWT3_3_NLCA3_NLCB3_SU0_SUM0_SUS0_WG32_8_1_WGM8_WGMXCC1_WGMXCCGn1
    SolutionIndex: 367
    SolutionNameMin: Cijk_Ailk_Bjlk_HHS_BH_Bias_FDMN_SPA_AS_SAV_MT256x16x128_MI16x16x1_SN_GSU4_GSUC0_GSUWGMRR0_K1_LBSPPA4096_LBSPPB256_MIWT4_1_NLCA1_NLCB1_SU0_SUM0_SUS0_WG64_4_1_WGM8_WGMXCC1_WGMXCCGn1
    SolutionIndex: 368
    SolutionNameMin: Cijk_Ailk_Bjlk_HHS_BH_Bias_FDMN_SPA_AS_SAV_MT64x64x128_MI16x16x1_SN_GSU4_GSUC0_GSUWGMRR0_K1_LBSPPA1024_LBSPPB1024_MIWT1_4_NLCA1_NLCB1_SU0_SUM0_SUS0_WG64_4_1_WGM8_WGMXCC1_WGMXCCGn1
    SolutionIndex: 369
    SolutionNameMin: Cijk_Ailk_Bjlk_HHS_BH_Bias_FDMN_SPA_AS_SAV_MT32x96x128_MI16x16x1_SN_GSU4_GSUC0_GSUWGMRR0_K1_LBSPPA512_LBSPPB1536_MIWT1_3_NLCA1_NLCB3_SU0_SUM0_SUS0_WG32_8_1_WGM8_WGMXCC1_WGMXCCGn1
    SolutionIndex: 370
    SolutionNameMin: Cijk_Ailk_Bjlk_HHS_BH_Bias_FDMN_SPA_AS_SAV_MT64x32x128_MI16x16x1_SN_GSU4_GSUC0_GSUWGMRR0_K1_LBSPPA1024_LBSPPB512_MIWT1_2_NLCA1_NLCB1_SU0_SUM0_SUS0_WG64_4_1_WGM8_WGMXCC1_WGMXCCGn1
    SolutionIndex: 371
    SolutionNameMin: Cijk_Ailk_Bjlk_HHS_BH_Bias_FDMN_SPA_AS_SAV_MT192x48x128_MI16x16x1_SN_GSU4_GSUC0_GSUWGMRR0_K1_LBSPPA3072_LBSPPB768_MIWT3_3_NLCA3_NLCB3_SU0_SUM0_SUS0_WG64_4_1_WGM8_WGMXCC1_WGMXCCGn1
    SolutionIndex: 372
    SolutionNameMin: Cijk_Ailk_Bjlk_HHS_BH_Bias_FDMN_SPA_AS_SAV_MT64x16x128_MI16x16x1_SN_GSU4_GSUC0_GSUWGMRR0_K1_LBSPPA1024_LBSPPB256_MIWT1_1_NLCA1_NLCB1_SU0_SUM0_SUS0_WG64_4_1_WGM8_WGMXCC1_WGMXCCGn1
    SolutionIndex: 373
    SolutionNameMin: Cijk_Ailk_Bjlk_HHS_BH_Bias_FDMN_SPA_AS_SAV_MT32x160x128_MI16x16x1_SN_GSU4_GSUC0_GSUWGMRR0_K1_LBSPPA512_LBSPPB2560_MIWT1_5_NLCA1_NLCB5_SU0_SUM0_SUS0_WG32_8_1_WGM8_WGMXCC1_WGMXCCGn1
    SolutionIndex: 374
    SolutionNameMin: Cijk_Ailk_Bjlk_HHS_BH_Bias_FDMN_SPA_AS_SAV_MT128x80x128_MI16x16x1_SN_GSU4_GSUC0_GSUWGMRR0_K1_LBSPPA2048_LBSPPB1280_MIWT2_5_NLCA1_NLCB5_SU0_SUM0_SUS0_WG64_4_1_WGM8_WGMXCC1_WGMXCCGn1
    SolutionIndex: 375
    SolutionNameMin: Cijk_Ailk_Bjlk_HHS_BH_Bias_FDMN_SPA_AS_SAV_MT192x16x128_MI16x16x1_SN_GSU8_GSUC0_GSUWGMRR0_K1_LBSPPA3072_LBSPPB256_MIWT3_1_NLCA3_NLCB1_SU0_SUM0_SUS0_WG64_4_1_WGM8_WGMXCC1_WGMXCCGn1
    SolutionIndex: 376
    SolutionNameMin: Cijk_Ailk_Bjlk_HHS_BH_Bias_FDMN_SPA_AS_SAV_MT384x16x128_MI16x16x1_SN_GSU4_GSUC0_GSUWGMRR0_K1_LBSPPA6144_LBSPPB256_MIWT6_1_NLCA3_NLCB1_SU0_SUM0_SUS0_WG64_4_1_WGM8_WGMXCC1_WGMXCCGn1
    SolutionIndex: 377
    SolutionNameMin: Cijk_Ailk_Bjlk_HHS_BH_Bias_FDMN_SPA_AS_SAV_MT128x16x128_MI16x16x1_SN_GSU1_GSUC0_GSUWGMRR0_K1_LBSPPA2048_LBSPPB256_MIWT2_1_NLCA1_NLCB1_SU0_SUM0_SUS0_WG64_4_1_WGM8_WGMXCC1_WGMXCCGn1
    SolutionIndex: 378
    SolutionNameMin: Cijk_Ailk_Bjlk_HHS_BH_Bias_FDMN_SPA_AS_SAV_MT192x16x128_MI16x16x1_SN_GSU1_GSUC0_GSUWGMRR0_K1_LBSPPA3072_LBSPPB256_MIWT3_1_NLCA3_NLCB1_SU0_SUM0_SUS0_WG64_4_1_WGM8_WGMXCC1_WGMXCCGn1
    SolutionIndex: 379
    SolutionNameMin: Cijk_Ailk_Bjlk_HHS_BH_Bias_FDMN_SPA_AS_SAV_MT256x16x128_MI16x16x1_SN_GSU1_GSUC0_GSUWGMRR0_K1_LBSPPA4096_LBSPPB256_MIWT4_1_NLCA1_NLCB1_SU0_SUM0_SUS0_WG64_4_1_WGM8_WGMXCC1_WGMXCCGn1
    SolutionIndex: 380
    SolutionNameMin: Cijk_Ailk_Bjlk_HHS_BH_Bias_FDMN_SPA_AS_SAV_MT128x32x128_MI16x16x1_SN_GSU12_GSUC0_GSUWGMRR0_K1_LBSPPA2048_LBSPPB512_MIWT2_2_NLCA1_NLCB1_SU0_SUM0_SUS0_WG64_4_1_WGM8_WGMXCC1_WGMXCCGn1
    SolutionIndex: 381
    SolutionNameMin: Cijk_Ailk_Bjlk_HHS_BH_Bias_FDMN_SPA_AS_SAV_MT192x32x128_MI16x16x1_SN_GSU12_GSUC0_GSUWGMRR0_K1_LBSPPA3072_LBSPPB512_MIWT3_2_NLCA3_NLCB1_SU0_SUM0_SUS0_WG64_4_1_WGM8_WGMXCC1_WGMXCCGn1
    SolutionIndex: 382
    SolutionNameMin: Cijk_Ailk_Bjlk_HHS_BH_Bias_FDMN_SPA_AS_SAV_MT96x32x128_MI16x16x1_SN_GSU8_GSUC0_GSUWGMRR0_K1_LBSPPA1536_LBSPPB512_MIWT3_1_NLCA3_NLCB1_SU0_SUM0_SUS0_WG32_8_1_WGM8_WGMXCC1_WGMXCCGn1
    SolutionIndex: 383
    SolutionNameMin: Cijk_Ailk_Bjlk_HHS_BH_Bias_FDMN_SPA_AS_SAV_MT192x32x128_MI16x16x1_SN_GSU8_GSUC0_GSUWGMRR0_K1_LBSPPA3072_LBSPPB512_MIWT3_2_NLCA3_NLCB1_SU0_SUM0_SUS0_WG64_4_1_WGM8_WGMXCC1_WGMXCCGn1
    SolutionIndex: 384
    SolutionNameMin: Cijk_Ailk_Bjlk_HHS_BH_Bias_FDMN_SPA_AS_SAV_MT160x32x128_MI16x16x1_SN_GSU8_GSUC0_GSUWGMRR0_K1_LBSPPA2560_LBSPPB512_MIWT5_1_NLCA5_NLCB1_SU0_SUM0_SUS0_WG32_8_1_WGM8_WGMXCC1_WGMXCCGn1
    SolutionIndex: 385
    SolutionNameMin: Cijk_Ailk_Bjlk_HHS_BH_Bias_FDMN_SPA_AS_SAV_MT320x32x128_MI16x16x1_SN_GSU4_GSUC0_GSUWGMRR0_K1_LBSPPA5120_LBSPPB512_MIWT5_2_NLCA5_NLCB1_SU0_SUM0_SUS0_WG64_4_1_WGM8_WGMXCC1_WGMXCCGn1
    SolutionIndex: 386
    SolutionNameMin: Cijk_Ailk_Bjlk_HHS_BH_Bias_FDMN_SPA_AS_SAV_MT128x32x128_MI16x16x1_SN_GSU1_GSUC0_GSUWGMRR0_K1_LBSPPA2048_LBSPPB512_MIWT2_2_NLCA1_NLCB1_SU0_SUM0_SUS0_WG64_4_1_WGM8_WGMXCC1_WGMXCCGn1
    SolutionIndex: 387
    SolutionNameMin: Cijk_Ailk_Bjlk_HHS_BH_Bias_FDMN_SPA_AS_SAV_MT192x32x128_MI16x16x1_SN_GSU1_GSUC0_GSUWGMRR0_K1_LBSPPA3072_LBSPPB512_MIWT3_2_NLCA3_NLCB1_SU0_SUM0_SUS0_WG64_4_1_WGM8_WGMXCC1_WGMXCCGn1
    SolutionIndex: 388
    SolutionNameMin: Cijk_Ailk_Bjlk_HHS_BH_Bias_FDMN_SPA_AS_SAV_MT64x48x128_MI16x16x1_SN_GSU8_GSUC0_GSUWGMRR0_K1_LBSPPA1024_LBSPPB768_MIWT1_3_NLCA1_NLCB3_SU0_SUM0_SUS0_WG64_4_1_WGM8_WGMXCC1_WGMXCCGn1
    SolutionIndex: 389
    SolutionNameMin: Cijk_Ailk_Bjlk_HHS_BH_Bias_FDMN_SPA_AS_SAV_MT128x48x128_MI16x16x1_SN_GSU12_GSUC0_GSUWGMRR0_K1_LBSPPA2048_LBSPPB768_MIWT2_3_NLCA1_NLCB3_SU0_SUM0_SUS0_WG64_4_1_WGM8_WGMXCC1_WGMXCCGn1
    SolutionIndex: 390
    SolutionNameMin: Cijk_Ailk_Bjlk_HHS_BH_Bias_FDMN_SPA_AS_SAV_MT128x48x128_MI16x16x1_SN_GSU8_GSUC0_GSUWGMRR0_K1_LBSPPA2048_LBSPPB768_MIWT2_3_NLCA1_NLCB3_SU0_SUM0_SUS0_WG64_4_1_WGM8_WGMXCC1_WGMXCCGn1
    SolutionIndex: 391
    SolutionNameMin: Cijk_Ailk_Bjlk_HHS_BH_Bias_FDMN_SPA_AS_SAV_MT256x48x128_MI16x16x1_SN_GSU12_GSUC0_GSUWGMRR0_K1_LBSPPA4096_LBSPPB768_MIWT4_3_NLCA1_NLCB3_SU0_SUM0_SUS0_WG64_4_1_WGM8_WGMXCC1_WGMXCCGn1
    SolutionIndex: 392
    SolutionNameMin: Cijk_Ailk_Bjlk_HHS_BH_Bias_FDMN_SPA_AS_SAV_MT160x64x128_MI16x16x1_SN_GSU4_GSUC0_GSUWGMRR0_K1_LBSPPA2560_LBSPPB1024_MIWT5_2_NLCA5_NLCB1_SU0_SUM0_SUS0_WG32_8_1_WGM8_WGMXCC1_WGMXCCGn1
    SolutionIndex: 393
    SolutionNameMin: Cijk_Ailk_Bjlk_HHS_BH_Bias_FDMN_SPA_AS_SAV_MT128x48x128_MI16x16x1_SN_GSU1_GSUC0_GSUWGMRR0_K1_LBSPPA2048_LBSPPB768_MIWT2_3_NLCA1_NLCB3_SU0_SUM0_SUS0_WG64_4_1_WGM8_WGMXCC1_WGMXCCGn1
    SolutionIndex: 394
    SolutionNameMin: Cijk_Ailk_Bjlk_HHS_BH_Bias_FDMN_SPA_AS_SAV_MT64x64x128_MI16x16x1_SN_GSU12_GSUC0_GSUWGMRR0_K1_LBSPPA1024_LBSPPB1024_MIWT1_4_NLCA1_NLCB1_SU0_SUM0_SUS0_WG64_4_1_WGM8_WGMXCC1_WGMXCCGn1
    SolutionIndex: 395
    SolutionNameMin: Cijk_Ailk_Bjlk_HHS_BH_Bias_FDMN_SPA_AS_SAV_MT96x64x128_MI16x16x1_SN_GSU12_GSUC0_GSUWGMRR0_K1_LBSPPA1536_LBSPPB1024_MIWT3_2_NLCA3_NLCB1_SU0_SUM0_SUS0_WG32_8_1_WGM8_WGMXCC1_WGMXCCGn1
    SolutionIndex: 396
    SolutionNameMin: Cijk_Ailk_Bjlk_HHS_BH_Bias_FDMN_SPA_AS_SAV_MT96x64x128_MI16x16x1_SN_GSU8_GSUC0_GSUWGMRR0_K1_LBSPPA1536_LBSPPB1024_MIWT3_2_NLCA3_NLCB1_SU0_SUM0_SUS0_WG32_8_1_WGM8_WGMXCC1_WGMXCCGn1
    SolutionIndex: 397
    SolutionNameMin: Cijk_Ailk_Bjlk_HHS_BH_Bias_FDMN_SPA_AS_SAV_MT64x80x128_MI16x16x1_SN_GSU12_GSUC0_GSUWGMRR0_K1_LBSPPA1024_LBSPPB1280_MIWT1_5_NLCA1_NLCB5_SU0_SUM0_SUS0_WG64_4_1_WGM8_WGMXCC1_WGMXCCGn1
    SolutionIndex: 398
    SolutionNameMin: Cijk_Ailk_Bjlk_HHS_BH_Bias_FDMN_SPA_AS_SAV_MT64x80x128_MI16x16x1_SN_GSU8_GSUC0_GSUWGMRR0_K1_LBSPPA1024_LBSPPB1280_MIWT1_5_NLCA1_NLCB5_SU0_SUM0_SUS0_WG64_4_1_WGM8_WGMXCC1_WGMXCCGn1
    SolutionIndex: 399
    SolutionNameMin: Cijk_Ailk_Bjlk_HHS_BH_Bias_FDMN_SPA_AS_SAV_MT32x160x128_MI16x16x1_SN_GSU12_GSUC0_GSUWGMRR0_K1_LBSPPA512_LBSPPB2560_MIWT1_5_NLCA1_NLCB5_SU0_SUM0_SUS0_WG32_8_1_WGM8_WGMXCC1_WGMXCCGn1
    SolutionIndex: 400
    SolutionNameMin: Cijk_Ailk_Bjlk_HHS_BH_Bias_FDMN_SPA_AS_SAV_MT192x64x128_MI16x16x1_SN_GSU12_GSUC0_GSUWGMRR0_K1_LBSPPA3072_LBSPPB1024_MIWT3_4_NLCA3_NLCB1_SU0_SUM0_SUS0_WG64_4_1_WGM8_WGMXCC1_WGMXCCGn1
    SolutionIndex: 401
    SolutionNameMin: Cijk_Ailk_Bjlk_HHS_BH_Bias_FDMN_SPA_AS_SAV_MT32x96x128_MI16x16x1_SN_GSU8_GSUC0_GSUWGMRR0_K1_LBSPPA512_LBSPPB1536_MIWT1_3_NLCA1_NLCB3_SU0_SUM0_SUS0_WG32_8_1_WGM8_WGMXCC1_WGMXCCGn1
    SolutionIndex: 402
    SolutionNameMin: Cijk_Ailk_Bjlk_HHS_BH_Bias_FDMN_SPA_AS_SAV_MT32x128x128_MI16x16x1_SN_GSU12_GSUC0_GSUWGMRR0_K1_LBSPPA512_LBSPPB2048_MIWT1_4_NLCA1_NLCB1_SU0_SUM0_SUS0_WG32_8_1_WGM8_WGMXCC1_WGMXCCGn1
    SolutionIndex: 403
    SolutionNameMin: Cijk_Ailk_Bjlk_HHS_BH_Bias_FDMN_SPA_AS_SAV_MT32x160x128_MI16x16x1_SN_GSU8_GSUC0_GSUWGMRR0_K1_LBSPPA512_LBSPPB2560_MIWT1_5_NLCA1_NLCB5_SU0_SUM0_SUS0_WG32_8_1_WGM8_WGMXCC1_WGMXCCGn1
    SolutionIndex: 404
    SolutionNameMin: Cijk_Ailk_Bjlk_HHS_BH_Bias_FDMN_SPA_AS_SAV_MT32x128x128_MI16x16x1_SN_GSU1_GSUC0_GSUWGMRR0_K1_LBSPPA512_LBSPPB2048_MIWT1_4_NLCA1_NLCB1_SU0_SUM0_SUS0_WG32_8_1_WGM8_WGMXCC1_WGMXCCGn1
    SolutionIndex: 405
    SolutionNameMin: Cijk_Ailk_Bjlk_HHS_BH_Bias_FDMN_SPA_AS_SAV_MT256x16x128_MI16x16x1_SN_GSU12_GSUC0_GSUWGMRR0_K1_LBSPPA4096_LBSPPB256_MIWT4_1_NLCA1_NLCB1_SU0_SUM0_SUS0_WG64_4_1_WGM8_WGMXCC1_WGMXCCGn1
    SolutionIndex: 406
    SolutionNameMin: Cijk_Ailk_Bjlk_HHS_BH_Bias_FDMN_SPA_AS_SAV_MT64x80x128_MI16x16x1_SN_GSU16_GSUC0_GSUWGMRR0_K1_LBSPPA1024_LBSPPB1280_MIWT1_5_NLCA1_NLCB5_SU0_SUM0_SUS0_WG64_4_1_WGM8_WGMXCC1_WGMXCCGn1
    SolutionIndex: 407
    SolutionNameMin: Cijk_Ailk_Bjlk_HHS_BH_Bias_FDMN_SPA_AS_SAV_MT160x32x128_MI16x16x1_SN_GSU16_GSUC0_GSUWGMRR0_K1_LBSPPA2560_LBSPPB512_MIWT5_1_NLCA5_NLCB1_SU0_SUM0_SUS0_WG32_8_1_WGM8_WGMXCC1_WGMXCCGn1
    SolutionIndex: 408
    SolutionNameMin: Cijk_Ailk_Bjlk_HHS_BH_Bias_FDMN_SPA_AS_SAV_MT160x32x128_MI16x16x1_SN_GSU12_GSUC0_GSUWGMRR0_K1_LBSPPA2560_LBSPPB512_MIWT5_1_NLCA5_NLCB1_SU0_SUM0_SUS0_WG32_8_1_WGM8_WGMXCC1_WGMXCCGn1
    SolutionIndex: 409
    SolutionNameMin: Cijk_Ailk_Bjlk_HHS_BH_Bias_FDMN_SPA_AS_SAV_MT64x32x128_MI16x16x1_SN_GSU1_GSUC0_GSUWGMRR0_K1_LBSPPA1024_LBSPPB512_MIWT1_2_NLCA1_NLCB1_SU0_SUM0_SUS0_WG64_4_1_WGM8_WGMXCC1_WGMXCCGn1
    SolutionIndex: 410
    SolutionNameMin: Cijk_Ailk_Bjlk_HHS_BH_Bias_FDMN_SPA_AS_SAV_MT192x48x128_MI16x16x1_SN_GSU1_GSUC0_GSUWGMRR0_K1_LBSPPA3072_LBSPPB768_MIWT3_3_NLCA3_NLCB3_SU0_SUM0_SUS0_WG64_4_1_WGM8_WGMXCC1_WGMXCCGn1
    SolutionIndex: 411
    SolutionNameMin: Cijk_Ailk_Bjlk_HHS_BH_Bias_FDMN_SPA_AS_SAV_MT64x48x128_MI16x16x1_SN_GSU1_GSUC0_GSUWGMRR0_K1_LBSPPA1024_LBSPPB768_MIWT1_3_NLCA1_NLCB3_SU0_SUM0_SUS0_WG64_4_1_WGM8_WGMXCC1_WGMXCCGn1
    SolutionIndex: 412
    SolutionNameMin: Cijk_Ailk_Bjlk_HHS_BH_Bias_FDMN_SPA_AS_SAV_MT256x48x128_MI16x16x1_SN_GSU1_GSUC0_GSUWGMRR0_K1_LBSPPA4096_LBSPPB768_MIWT4_3_NLCA1_NLCB3_SU0_SUM0_SUS0_WG64_4_1_WGM8_WGMXCC1_WGMXCCGn1
    SolutionIndex: 413
    SolutionNameMin: Cijk_Ailk_Bjlk_HHS_BH_Bias_FDMN_SPA_AS_SAV_MT32x64x128_MI16x16x1_SN_GSU1_GSUC0_GSUWGMRR0_K1_LBSPPA512_LBSPPB1024_MIWT1_2_NLCA1_NLCB1_SU0_SUM0_SUS0_WG32_8_1_WGM8_WGMXCC1_WGMXCCGn1
    SolutionIndex: 414
    SolutionNameMin: Cijk_Ailk_Bjlk_HHS_BH_Bias_FDMN_SPA_AS_SAV_MT64x64x128_MI16x16x1_SN_GSU1_GSUC0_GSUWGMRR0_K1_LBSPPA1024_LBSPPB1024_MIWT1_4_NLCA1_NLCB1_SU0_SUM0_SUS0_WG64_4_1_WGM8_WGMXCC1_WGMXCCGn1
    SolutionIndex: 415
    SolutionNameMin: Cijk_Ailk_Bjlk_HHS_BH_Bias_FDMN_SPA_AS_SAV_MT96x64x128_MI16x16x1_SN_GSU1_GSUC0_GSUWGMRR0_K1_LBSPPA1536_LBSPPB1024_MIWT3_2_NLCA3_NLCB1_SU0_SUM0_SUS0_WG32_8_1_WGM8_WGMXCC1_WGMXCCGn1
    SolutionIndex: 416
    SolutionNameMin: Cijk_Ailk_Bjlk_HHS_BH_Bias_FDMN_SPA_AS_SAV_MT192x64x128_MI16x16x1_SN_GSU1_GSUC0_GSUWGMRR0_K1_LBSPPA3072_LBSPPB1024_MIWT3_4_NLCA3_NLCB1_SU0_SUM0_SUS0_WG64_4_1_WGM8_WGMXCC1_WGMXCCGn1
    SolutionIndex: 417
    SolutionNameMin: Cijk_Ailk_Bjlk_HHS_BH_Bias_FDMN_SPA_AS_SAV_MT128x80x128_MI16x16x1_SN_GSU1_GSUC0_GSUWGMRR0_K1_LBSPPA2048_LBSPPB1280_MIWT2_5_NLCA1_NLCB5_SU0_SUM0_SUS0_WG64_4_1_WGM8_WGMXCC1_WGMXCCGn1
    SolutionIndex: 418
    SolutionNameMin: Cijk_Ailk_Bjlk_HHS_BH_Bias_FDMN_SPA_AS_SAV_MT320x32x128_MI16x16x1_SN_GSU1_GSUC0_GSUWGMRR0_K1_LBSPPA5120_LBSPPB512_MIWT5_2_NLCA5_NLCB1_SU0_SUM0_SUS0_WG64_4_1_WGM8_WGMXCC1_WGMXCCGn1
    SolutionIndex: 419
    SolutionNameMin: Cijk_Ailk_Bjlk_HHS_BH_Bias_FDMN_SPA_AS_SAV_MT128x64x128_MI16x16x1_SN_GSU1_GSUC0_GSUWGMRR0_K1_LBSPPA2048_LBSPPB1024_MIWT2_4_NLCA1_NLCB1_SU0_SUM0_SUS0_WG64_4_1_WGM8_WGMXCC1_WGMXCCGn1
    SolutionIndex: 420
    SolutionNameMin: Cijk_Ailk_Bjlk_HHS_BH_Bias_FDMN_SPA_AS_SAV_MT96x32x128_MI16x16x1_SN_GSU1_GSUC0_GSUWGMRR0_K1_LBSPPA1536_LBSPPB512_MIWT3_1_NLCA3_NLCB1_SU0_SUM0_SUS0_WG32_8_1_WGM8_WGMXCC1_WGMXCCGn1
    SolutionIndex: 421
    SolutionNameMin: Cijk_Ailk_Bjlk_HHS_BH_Bias_FDMN_SPA_AS_SAV_MT64x80x128_MI16x16x1_SN_GSU1_GSUC0_GSUWGMRR0_K1_LBSPPA1024_LBSPPB1280_MIWT1_5_NLCA1_NLCB5_SU0_SUM0_SUS0_WG64_4_1_WGM8_WGMXCC1_WGMXCCGn1
    SolutionIndex: 422
    SolutionNameMin: Cijk_Ailk_Bjlk_HHS_BH_Bias_FDMN_SPA_AS_SAV_MT96x96x128_MI16x16x1_SN_GSU1_GSUC0_GSUWGMRR0_K1_LBSPPA1536_LBSPPB1536_MIWT3_3_NLCA3_NLCB3_SU0_SUM0_SUS0_WG32_8_1_WGM8_WGMXCC1_WGMXCCGn1
    SolutionIndex: 423
    SolutionNameMin: Cijk_Ailk_Bjlk_HHS_BH_Bias_FDMN_SPA_AS_SAV_MT160x64x128_MI16x16x1_SN_GSU1_GSUC0_GSUWGMRR0_K1_LBSPPA2560_LBSPPB1024_MIWT5_2_NLCA5_NLCB1_SU0_SUM0_SUS0_WG32_8_1_WGM8_WGMXCC1_WGMXCCGn1
    SolutionIndex: 424
    SolutionNameMin: Cijk_Ailk_Bjlk_HHS_BH_Bias_FDMN_SPA_AS_SAV_MT32x96x128_MI16x16x1_SN_GSU1_GSUC0_GSUWGMRR0_K1_LBSPPA512_LBSPPB1536_MIWT1_3_NLCA1_NLCB3_SU0_SUM0_SUS0_WG32_8_1_WGM8_WGMXCC1_WGMXCCGn1
    SolutionIndex: 425
    SolutionNameMin: Cijk_Ailk_Bjlk_HHS_BH_Bias_FDMN_SPA_AS_SAV_MT160x32x128_MI16x16x1_SN_GSU1_GSUC0_GSUWGMRR0_K1_LBSPPA2560_LBSPPB512_MIWT5_1_NLCA5_NLCB1_SU0_SUM0_SUS0_WG32_8_1_WGM8_WGMXCC1_WGMXCCGn1
    SolutionIndex: 426
    SolutionNameMin: Cijk_Ailk_Bjlk_HHS_BH_Bias_FDMN_SPA_AS_SAV_MT32x160x128_MI16x16x1_SN_GSU1_GSUC0_GSUWGMRR0_K1_LBSPPA512_LBSPPB2560_MIWT1_5_NLCA1_NLCB5_SU0_SUM0_SUS0_WG32_8_1_WGM8_WGMXCC1_WGMXCCGn1
    SolutionIndex: 427
    SolutionNameMin: Cijk_Ailk_Bjlk_HHS_BH_Bias_FDMN_SPA_AS_SAV_MT224x32x128_MI16x16x1_SN_GSU1_GSUC0_GSUWGMRR0_K1_LBSPPA3584_LBSPPB512_MIWT7_1_NLCA7_NLCB1_SU0_SUM0_SUS0_WG32_8_1_WGM8_WGMXCC1_WGMXCCGn1
- - - [16, 16, 1, 2048]
    - [39, 0.08]
  - - [32, 16, 1, 2048]
    - [8, 0.15]
  - - [48, 16, 1, 2048]
    - [167, 0.2]
  - - [64, 16, 1, 2048]
    - [107, 0.29]
  - - [80, 16, 1, 2048]
    - [110, 0.31]
  - - [96, 16, 1, 2048]
    - [208, 0.37]
  - - [112, 16, 1, 2048]
    - [28, 0.45]
  - - [128, 16, 1, 2048]
    - [0, 0.56]
  - - [160, 16, 1, 2048]
    - [37, 0.64]
  - - [192, 16, 1, 2048]
    - [200, 0.7]
  - - [224, 16, 1, 2048]
    - [11, 0.83]
  - - [256, 16, 1, 2048]
    - [57, 0.9]
  - - [320, 16, 1, 2048]
    - [72, 1.21]
  - - [384, 16, 1, 2048]
    - [14, 1.42]
  - - [448, 16, 1, 2048]
    - [189, 1.65]
  - - [512, 16, 1, 2048]
    - [178, 1.85]
  - - [640, 16, 1, 2048]
    - [147, 2.31]
  - - [768, 16, 1, 2048]
    - [51, 2.7]
  - - [1024, 16, 1, 2048]
    - [75, 3.61]
  - - [1280, 16, 1, 2048]
    - [88, 4.33]
  - - [1536, 16, 1, 2048]
    - [94, 5.08]
  - - [2048, 16, 1, 2048]
    - [81, 6.47]
  - - [2560, 16, 1, 2048]
    - [100, 7.89]
  - - [3072, 16, 1, 2048]
    - [101, 9.26]
  - - [3584, 16, 1, 2048]
    - [104, 10.25]
  - - [16, 32, 1, 2048]
    - [91, 0.12]
  - - [32, 32, 1, 2048]
    - [41, 0.27]
  - - [48, 32, 1, 2048]
    - [32, 0.36]
  - - [64, 32, 1, 2048]
    - [132, 0.48]
  - - [80, 32, 1, 2048]
    - [24, 0.59]
  - - [96, 32, 1, 2048]
    - [207, 0.72]
  - - [112, 32, 1, 2048]
    - [84, 0.76]
  - - [128, 32, 1, 2048]
    - [92, 0.95]
  - - [160, 32, 1, 2048]
    - [64, 1.17]
  - - [192, 32, 1, 2048]
    - [179, 1.38]
  - - [224, 32, 1, 2048]
    - [106, 1.59]
  - - [256, 32, 1, 2048]
    - [127, 1.77]
  - - [320, 32, 1, 2048]
    - [40, 2.35]
  - - [384, 32, 1, 2048]
    - [171, 2.64]
  - - [448, 32, 1, 2048]
    - [117, 3.25]
  - - [512, 32, 1, 2048]
    - [49, 3.48]
  - - [640, 32, 1, 2048]
    - [59, 4.38]
  - - [768, 32, 1, 2048]
    - [58, 5.16]
  - - [1024, 32, 1, 2048]
    - [166, 6.59]
  - - [1280, 32, 1, 2048]
    - [42, 7.94]
  - - [1536, 32, 1, 2048]
    - [100, 9.49]
  - - [16, 48, 1, 2048]
    - [67, 0.18]
  - - [32, 48, 1, 2048]
    - [13, 0.4]
  - - [48, 48, 1, 2048]
    - [123, 0.52]
  - - [64, 48, 1, 2048]
    - [3, 0.68]
  - - [80, 48, 1, 2048]
    - [151, 0.78]
  - - [96, 48, 1, 2048]
    - [79, 0.98]
  - - [112, 48, 1, 2048]
    - [176, 1.2]
  - - [128, 48, 1, 2048]
    - [46, 1.46]
  - - [160, 48, 1, 2048]
    - [9, 1.74]
  - - [192, 48, 1, 2048]
    - [163, 2.02]
  - - [224, 48, 1, 2048]
    - [63, 2.52]
  - - [256, 48, 1, 2048]
    - [10, 2.7]
  - - [320, 48, 1, 2048]
    - [131, 3.21]
  - - [384, 48, 1, 2048]
    - [215, 3.88]
  - - [448, 48, 1, 2048]
    - [77, 4.62]
  - - [512, 48, 1, 2048]
    - [130, 5.11]
  - - [640, 48, 1, 2048]
    - [158, 6.4]
  - - [768, 48, 1, 2048]
    - [180, 7.08]
  - - [1024, 48, 1, 2048]
    - [153, 9.45]
  - - [1280, 48, 1, 2048]
    - [102, 10.96]
  - - [16, 64, 1, 2048]
    - [5, 0.25]
  - - [32, 64, 1, 2048]
    - [137, 0.49]
  - - [48, 64, 1, 2048]
    - [175, 0.69]
  - - [64, 64, 1, 2048]
    - [4, 1.03]
  - - [80, 64, 1, 2048]
    - [129, 1.15]
  - - [96, 64, 1, 2048]
    - [7, 1.38]
  - - [112, 64, 1, 2048]
    - [128, 1.62]
  - - [128, 64, 1, 2048]
    - [119, 1.9]
  - - [160, 64, 1, 2048]
    - [1, 2.37]
  - - [192, 64, 1, 2048]
    - [91, 2.65]
  - - [224, 64, 1, 2048]
    - [44, 3.27]
  - - [256, 64, 1, 2048]
    - [15, 3.43]
  - - [320, 64, 1, 2048]
    - [83, 4.39]
  - - [384, 64, 1, 2048]
    - [86, 4.99]
  - - [448, 64, 1, 2048]
    - [56, 5.59]
  - - [512, 64, 1, 2048]
    - [93, 6.71]
  - - [640, 64, 1, 2048]
    - [171, 8.06]
  - - [768, 64, 1, 2048]
    - [133, 9.3]
  - - [16, 80, 1, 2048]
    - [99, 0.3]
  - - [32, 80, 1, 2048]
    - [112, 0.59]
  - - [48, 80, 1, 2048]
    - [9, 0.85]
  - - [64, 80, 1, 2048]
    - [16, 1.17]
  - - [80, 80, 1, 2048]
    - [61, 1.45]
  - - [96, 80, 1, 2048]
    - [170, 1.66]
  - - [112, 80, 1, 2048]
    - [37, 1.95]
  - - [128, 80, 1, 2048]
    - [109, 2.18]
  - - [160, 80, 1, 2048]
    - [62, 2.71]
  - - [192, 80, 1, 2048]
    - [36, 3.29]
  - - [224, 80, 1, 2048]
    - [19, 3.96]
  - - [256, 80, 1, 2048]
    - [33, 4.17]
  - - [320, 80, 1, 2048]
    - [90, 5.54]
  - - [384, 80, 1, 2048]
    - [52, 6.48]
  - - [448, 80, 1, 2048]
    - [43, 7.33]
  - - [512, 80, 1, 2048]
    - [42, 7.92]
  - - [640, 80, 1, 2048]
    - [97, 9.75]
  - - [768, 80, 1, 2048]
    - [96, 11.13]
  - - [16, 96, 1, 2048]
    - [135, 0.36]
  - - [32, 96, 1, 2048]
    - [114, 0.71]
  - - [48, 96, 1, 2048]
    - [105, 1.13]
  - - [64, 96, 1, 2048]
    - [142, 1.37]
  - - [80, 96, 1, 2048]
    - [30, 1.65]
  - - [96, 96, 1, 2048]
    - [57, 2.02]
  - - [112, 96, 1, 2048]
    - [145, 2.37]
  - - [128, 96, 1, 2048]
    - [47, 2.64]
  - - [160, 96, 1, 2048]
    - [68, 3.48]
  - - [192, 96, 1, 2048]
    - [38, 3.95]
  - - [224, 96, 1, 2048]
    - [12, 4.56]
  - - [256, 96, 1, 2048]
    - [164, 4.95]
  - - [320, 96, 1, 2048]
    - [87, 6.19]
  - - [384, 96, 1, 2048]
    - [150, 7.15]
  - - [448, 96, 1, 2048]
    - [194, 8.96]
  - - [512, 96, 1, 2048]
    - [98, 9.34]
  - - [640, 96, 1, 2048]
    - [163, 11.41]
  - - [16, 112, 1, 2048]
    - [138, 0.41]
  - - [32, 112, 1, 2048]
    - [192, 0.74]
  - - [48, 112, 1, 2048]
    - [66, 1.17]
  - - [64, 112, 1, 2048]
    - [201, 1.57]
  - - [80, 112, 1, 2048]
    - [76, 1.91]
  - - [96, 112, 1, 2048]
    - [48, 2.42]
  - - [112, 112, 1, 2048]
    - [35, 2.67]
  - - [128, 112, 1, 2048]
    - [31, 3.01]
  - - [160, 112, 1, 2048]
    - [136, 3.77]
  - - [192, 112, 1, 2048]
    - [20, 4.41]
  - - [224, 112, 1, 2048]
    - [82, 5.4]
  - - [256, 112, 1, 2048]
    - [188, 5.58]
  - - [320, 112, 1, 2048]
    - [88, 7.22]
  - - [384, 112, 1, 2048]
    - [80, 8.16]
  - - [448, 112, 1, 2048]
    - [88, 9.5]
  - - [512, 112, 1, 2048]
    - [155, 10.56]
  - - [16, 128, 1, 2048]
    - [35, 0.49]
  - - [32, 128, 1, 2048]
    - [122, 1.0]
  - - [48, 128, 1, 2048]
    - [29, 1.37]
  - - [64, 128, 1, 2048]
    - [123, 1.82]
  - - [80, 128, 1, 2048]
    - [122, 2.2]
  - - [96, 128, 1, 2048]
    - [120, 2.73]
  - - [112, 128, 1, 2048]
    - [17, 3.11]
  - - [128, 128, 1, 2048]
    - [193, 3.48]
  - - [160, 128, 1, 2048]
    - [71, 4.14]
  - - [192, 128, 1, 2048]
    - [173, 5.08]
  - - [224, 128, 1, 2048]
    - [177, 5.72]
  - - [256, 128, 1, 2048]
    - [157, 6.32]
  - - [320, 128, 1, 2048]
    - [172, 7.7]
  - - [384, 128, 1, 2048]
    - [103, 9.16]
  - - [448, 128, 1, 2048]
    - [89, 10.62]
  - - [16, 160, 1, 2048]
    - [81, 0.55]
  - - [32, 160, 1, 2048]
    - [74, 1.14]
  - - [48, 160, 1, 2048]
    - [121, 1.74]
  - - [64, 160, 1, 2048]
    - [115, 2.18]
  - - [80, 160, 1, 2048]
    - [0, 2.73]
  - - [96, 160, 1, 2048]
    - [40, 3.35]
  - - [112, 160, 1, 2048]
    - [18, 4.01]
  - - [128, 160, 1, 2048]
    - [60, 4.26]
  - - [160, 160, 1, 2048]
    - [148, 5.16]
  - - [192, 160, 1, 2048]
    - [48, 6.13]
  - - [224, 160, 1, 2048]
    - [146, 7.36]
  - - [256, 160, 1, 2048]
    - [111, 7.54]
  - - [320, 160, 1, 2048]
    - [140, 9.49]
  - - [384, 160, 1, 2048]
    - [95, 11.07]
  - - [16, 192, 1, 2048]
    - [118, 0.69]
  - - [32, 192, 1, 2048]
    - [34, 1.35]
  - - [48, 192, 1, 2048]
    - [4, 2.03]
  - - [64, 192, 1, 2048]
    - [139, 2.63]
  - - [80, 192, 1, 2048]
    - [85, 3.36]
  - - [96, 192, 1, 2048]
    - [21, 3.85]
  - - [112, 192, 1, 2048]
    - [40, 4.67]
  - - [128, 192, 1, 2048]
    - [22, 5.0]
  - - [160, 192, 1, 2048]
    - [50, 6.25]
  - - [192, 192, 1, 2048]
    - [169, 7.16]
  - - [224, 192, 1, 2048]
    - [98, 8.74]
  - - [256, 192, 1, 2048]
    - [211, 9.03]
  - - [320, 192, 1, 2048]
    - [211, 11.03]
  - - [16, 224, 1, 2048]
    - [35, 0.8]
  - - [32, 224, 1, 2048]
    - [20, 1.58]
  - - [48, 224, 1, 2048]
    - [126, 2.4]
  - - [64, 224, 1, 2048]
    - [48, 3.13]
  - - [80, 224, 1, 2048]
    - [71, 3.99]
  - - [96, 224, 1, 2048]
    - [27, 4.47]
  - - [112, 224, 1, 2048]
    - [78, 5.23]
  - - [128, 224, 1, 2048]
    - [96, 5.82]
  - - [160, 224, 1, 2048]
    - [60, 7.07]
  - - [192, 224, 1, 2048]
    - [96, 8.68]
  - - [224, 224, 1, 2048]
    - [164, 9.54]
  - - [256, 224, 1, 2048]
    - [160, 10.1]
  - - [16, 256, 1, 2048]
    - [154, 0.88]
  - - [32, 256, 1, 2048]
    - [26, 1.69]
  - - [48, 256, 1, 2048]
    - [53, 2.57]
  - - [64, 256, 1, 2048]
    - [45, 3.48]
  - - [80, 256, 1, 2048]
    - [125, 4.16]
  - - [96, 256, 1, 2048]
    - [69, 4.95]
  - - [112, 256, 1, 2048]
    - [124, 5.35]
  - - [128, 256, 1, 2048]
    - [108, 6.38]
  - - [160, 256, 1, 2048]
    - [183, 7.67]
  - - [192, 256, 1, 2048]
    - [74, 8.78]
  - - [224, 256, 1, 2048]
    - [185, 10.37]
  - - [16, 320, 1, 2048]
    - [204, 1.11]
  - - [32, 320, 1, 2048]
    - [162, 2.33]
  - - [48, 320, 1, 2048]
    - [144, 3.33]
  - - [64, 320, 1, 2048]
    - [199, 4.22]
  - - [80, 320, 1, 2048]
    - [141, 5.24]
  - - [96, 320, 1, 2048]
    - [197, 6.33]
  - - [112, 320, 1, 2048]
    - [195, 7.31]
  - - [128, 320, 1, 2048]
    - [54, 7.67]
  - - [160, 320, 1, 2048]
    - [164, 9.43]
  - - [192, 320, 1, 2048]
    - [202, 11.01]
  - - [16, 384, 1, 2048]
    - [2, 1.32]
  - - [32, 384, 1, 2048]
    - [65, 2.61]
  - - [48, 384, 1, 2048]
    - [182, 3.83]
  - - [64, 384, 1, 2048]
    - [210, 4.89]
  - - [80, 384, 1, 2048]
    - [176, 6.02]
  - - [96, 384, 1, 2048]
    - [98, 7.11]
  - - [112, 384, 1, 2048]
    - [70, 7.99]
  - - [128, 384, 1, 2048]
    - [134, 8.93]
  - - [160, 384, 1, 2048]
    - [186, 10.8]
  - - [16, 448, 1, 2048]
    - [168, 1.6]
  - - [32, 448, 1, 2048]
    - [55, 3.01]
  - - [48, 448, 1, 2048]
    - [23, 4.35]
  - - [64, 448, 1, 2048]
    - [187, 5.68]
  - - [80, 448, 1, 2048]
    - [165, 7.05]
  - - [96, 448, 1, 2048]
    - [196, 8.38]
  - - [112, 448, 1, 2048]
    - [203, 9.73]
  - - [128, 448, 1, 2048]
    - [102, 10.65]
  - - [16, 512, 1, 2048]
    - [23, 1.73]
  - - [32, 512, 1, 2048]
    - [116, 3.31]
  - - [48, 512, 1, 2048]
    - [149, 4.75]
  - - [64, 512, 1, 2048]
    - [119, 6.38]
  - - [80, 512, 1, 2048]
    - [209, 7.48]
  - - [96, 512, 1, 2048]
    - [206, 8.64]
  - - [112, 512, 1, 2048]
    - [156, 10.3]
  - - [16, 640, 1, 2048]
    - [6, 2.27]
  - - [32, 640, 1, 2048]
    - [164, 4.36]
  - - [48, 640, 1, 2048]
    - [191, 6.04]
  - - [64, 640, 1, 2048]
    - [214, 7.81]
  - - [80, 640, 1, 2048]
    - [143, 9.06]
  - - [96, 640, 1, 2048]
    - [198, 11.45]
  - - [16, 768, 1, 2048]
    - [152, 2.43]
  - - [32, 768, 1, 2048]
    - [68, 4.87]
  - - [48, 768, 1, 2048]
    - [174, 6.82]
  - - [64, 768, 1, 2048]
    - [73, 8.62]
  - - [80, 768, 1, 2048]
    - [161, 10.47]
  - - [16, 1024, 1, 2048]
    - [113, 3.19]
  - - [32, 1024, 1, 2048]
    - [191, 6.35]
  - - [48, 1024, 1, 2048]
    - [159, 8.73]
  - - [16, 1280, 1, 2048]
    - [25, 3.78]
  - - [32, 1280, 1, 2048]
    - [181, 7.26]
  - - [48, 1280, 1, 2048]
    - [216, 10.43]
  - - [16, 1536, 1, 2048]
    - [204, 4.51]
  - - [32, 1536, 1, 2048]
    - [184, 8.79]
  - - [16, 2048, 1, 2048]
    - [212, 5.63]
  - - [16, 2560, 1, 2048]
    - [190, 6.79]
  - - [16, 3072, 1, 2048]
    - [205, 7.91]
  - - [16, 3584, 1, 2048]
    - [213, 8.85]
  - - [16, 16, 1, 8192]
    - [217, 0.26]
  - - [32, 16, 1, 8192]
    - [218, 0.52]
  - - [48, 16, 1, 8192]
    - [3, 0.78]
  - - [64, 16, 1, 8192]
    - [219, 1.0]
  - - [80, 16, 1, 8192]
    - [3, 1.27]
  - - [96, 16, 1, 8192]
    - [220, 1.49]
  - - [112, 16, 1, 8192]
    - [221, 1.71]
  - - [128, 16, 1, 8192]
    - [3, 1.95]
  - - [160, 16, 1, 8192]
    - [222, 2.35]
  - - [192, 16, 1, 8192]
    - [3, 2.72]
  - - [224, 16, 1, 8192]
    - [220, 3.14]
  - - [256, 16, 1, 8192]
    - [22, 3.47]
  - - [320, 16, 1, 8192]
    - [23, 4.28]
  - - [384, 16, 1, 8192]
    - [222, 5.17]
  - - [448, 16, 1, 8192]
    - [223, 5.86]
  - - [512, 16, 1, 8192]
    - [224, 6.47]
  - - [640, 16, 1, 8192]
    - [225, 7.68]
  - - [768, 16, 1, 8192]
    - [52, 8.48]
  - - [1024, 16, 1, 8192]
    - [225, 11.57]
  - - [1280, 16, 1, 8192]
    - [226, 12.9]
  - - [1536, 16, 1, 8192]
    - [93, 15.1]
  - - [2048, 16, 1, 8192]
    - [227, 19.21]
  - - [2560, 16, 1, 8192]
    - [228, 21.3]
  - - [3072, 16, 1, 8192]
    - [229, 23.46]
  - - [3584, 16, 1, 8192]
    - [230, 24.22]
  - - [16, 32, 1, 8192]
    - [1, 0.52]
  - - [32, 32, 1, 8192]
    - [1, 1.02]
  - - [48, 32, 1, 8192]
    - [231, 1.45]
  - - [64, 32, 1, 8192]
    - [1, 1.99]
  - - [80, 32, 1, 8192]
    - [232, 2.33]
  - - [96, 32, 1, 8192]
    - [233, 2.71]
  - - [112, 32, 1, 8192]
    - [3, 3.2]
  - - [128, 32, 1, 8192]
    - [218, 3.53]
  - - [160, 32, 1, 8192]
    - [106, 4.36]
  - - [192, 32, 1, 8192]
    - [232, 5.34]
  - - [224, 32, 1, 8192]
    - [234, 5.83]
  - - [256, 32, 1, 8192]
    - [38, 6.47]
  - - [320, 32, 1, 8192]
    - [235, 8.14]
  - - [384, 32, 1, 8192]
    - [28, 9.22]
  - - [448, 32, 1, 8192]
    - [236, 11.12]
  - - [512, 32, 1, 8192]
    - [225, 11.96]
  - - [640, 32, 1, 8192]
    - [52, 13.27]
  - - [768, 32, 1, 8192]
    - [170, 16.13]
  - - [1024, 32, 1, 8192]
    - [237, 20.69]
  - - [1280, 32, 1, 8192]
    - [238, 23.39]
  - - [1536, 32, 1, 8192]
    - [197, 26.74]
  - - [16, 48, 1, 8192]
    - [234, 0.73]
  - - [32, 48, 1, 8192]
    - [22, 1.5]
  - - [48, 48, 1, 8192]
    - [3, 2.13]
  - - [64, 48, 1, 8192]
    - [2, 2.8]
  - - [80, 48, 1, 8192]
    - [235, 3.29]
  - - [96, 48, 1, 8192]
    - [219, 3.96]
  - - [112, 48, 1, 8192]
    - [220, 4.66]
  - - [128, 48, 1, 8192]
    - [222, 5.33]
  - - [160, 48, 1, 8192]
    - [220, 6.32]
  - - [192, 48, 1, 8192]
    - [236, 7.56]
  - - [224, 48, 1, 8192]
    - [122, 8.34]
  - - [256, 48, 1, 8192]
    - [239, 8.88]
  - - [320, 48, 1, 8192]
    - [240, 11.03]
  - - [384, 48, 1, 8192]
    - [222, 13.26]
  - - [448, 48, 1, 8192]
    - [241, 15.01]
  - - [512, 48, 1, 8192]
    - [242, 16.36]
  - - [640, 48, 1, 8192]
    - [243, 18.62]
  - - [768, 48, 1, 8192]
    - [244, 21.81]
  - - [1024, 48, 1, 8192]
    - [245, 27.23]
  - - [1280, 48, 1, 8192]
    - [246, 30.37]
  - - [16, 64, 1, 8192]
    - [22, 0.99]
  - - [32, 64, 1, 8192]
    - [247, 1.94]
  - - [48, 64, 1, 8192]
    - [3, 2.79]
  - - [64, 64, 1, 8192]
    - [5, 3.49]
  - - [80, 64, 1, 8192]
    - [248, 4.41]
  - - [96, 64, 1, 8192]
    - [249, 4.99]
  - - [112, 64, 1, 8192]
    - [236, 5.77]
  - - [128, 64, 1, 8192]
    - [222, 6.96]
  - - [160, 64, 1, 8192]
    - [250, 7.9]
  - - [192, 64, 1, 8192]
    - [251, 8.84]
  - - [224, 64, 1, 8192]
    - [235, 11.13]
  - - [256, 64, 1, 8192]
    - [225, 11.59]
  - - [320, 64, 1, 8192]
    - [69, 13.08]
  - - [384, 64, 1, 8192]
    - [188, 16.03]
  - - [448, 64, 1, 8192]
    - [241, 17.82]
  - - [512, 64, 1, 8192]
    - [170, 21.87]
  - - [640, 64, 1, 8192]
    - [252, 24.03]
  - - [768, 64, 1, 8192]
    - [253, 28.7]
  - - [16, 80, 1, 8192]
    - [1, 1.26]
  - - [32, 80, 1, 8192]
    - [1, 2.28]
  - - [48, 80, 1, 8192]
    - [22, 3.34]
  - - [64, 80, 1, 8192]
    - [1, 4.3]
  - - [80, 80, 1, 8192]
    - [225, 5.23]
  - - [96, 80, 1, 8192]
    - [218, 6.26]
  - - [112, 80, 1, 8192]
    - [235, 7.2]
  - - [128, 80, 1, 8192]
    - [222, 8.26]
  - - [160, 80, 1, 8192]
    - [225, 10.0]
  - - [192, 80, 1, 8192]
    - [254, 11.7]
  - - [224, 80, 1, 8192]
    - [255, 12.9]
  - - [256, 80, 1, 8192]
    - [42, 12.88]
  - - [320, 80, 1, 8192]
    - [170, 17.33]
  - - [384, 80, 1, 8192]
    - [256, 19.89]
  - - [448, 80, 1, 8192]
    - [257, 21.09]
  - - [512, 80, 1, 8192]
    - [258, 24.04]
  - - [640, 80, 1, 8192]
    - [203, 26.23]
  - - [768, 80, 1, 8192]
    - [259, 30.88]
  - - [16, 96, 1, 8192]
    - [232, 1.49]
  - - [32, 96, 1, 8192]
    - [22, 2.7]
  - - [48, 96, 1, 8192]
    - [222, 4.09]
  - - [64, 96, 1, 8192]
    - [232, 5.25]
  - - [80, 96, 1, 8192]
    - [232, 6.51]
  - - [96, 96, 1, 8192]
    - [222, 7.5]
  - - [112, 96, 1, 8192]
    - [260, 8.33]
  - - [128, 96, 1, 8192]
    - [261, 9.14]
  - - [160, 96, 1, 8192]
    - [225, 11.88]
  - - [192, 96, 1, 8192]
    - [254, 13.8]
  - - [224, 96, 1, 8192]
    - [77, 14.64]
  - - [256, 96, 1, 8192]
    - [188, 15.43]
  - - [320, 96, 1, 8192]
    - [256, 19.84]
  - - [384, 96, 1, 8192]
    - [241, 22.48]
  - - [448, 96, 1, 8192]
    - [252, 23.79]
  - - [512, 96, 1, 8192]
    - [262, 28.37]
  - - [640, 96, 1, 8192]
    - [263, 29.9]
  - - [16, 112, 1, 8192]
    - [221, 1.72]
  - - [32, 112, 1, 8192]
    - [106, 3.15]
  - - [48, 112, 1, 8192]
    - [232, 4.58]
  - - [64, 112, 1, 8192]
    - [264, 5.89]
  - - [80, 112, 1, 8192]
    - [122, 7.07]
  - - [96, 112, 1, 8192]
    - [22, 8.21]
  - - [112, 112, 1, 8192]
    - [22, 9.47]
  - - [128, 112, 1, 8192]
    - [236, 11.09]
  - - [160, 112, 1, 8192]
    - [232, 12.71]
  - - [192, 112, 1, 8192]
    - [265, 14.84]
  - - [224, 112, 1, 8192]
    - [266, 16.41]
  - - [256, 112, 1, 8192]
    - [267, 17.29]
  - - [320, 112, 1, 8192]
    - [268, 20.62]
  - - [384, 112, 1, 8192]
    - [269, 24.72]
  - - [448, 112, 1, 8192]
    - [270, 25.88]
  - - [512, 112, 1, 8192]
    - [271, 29.76]
  - - [16, 128, 1, 8192]
    - [248, 1.92]
  - - [32, 128, 1, 8192]
    - [236, 3.46]
  - - [48, 128, 1, 8192]
    - [221, 5.14]
  - - [64, 128, 1, 8192]
    - [220, 6.71]
  - - [80, 128, 1, 8192]
    - [248, 7.96]
  - - [96, 128, 1, 8192]
    - [242, 8.65]
  - - [112, 128, 1, 8192]
    - [122, 11.0]
  - - [128, 128, 1, 8192]
    - [272, 11.71]
  - - [160, 128, 1, 8192]
    - [273, 12.75]
  - - [192, 128, 1, 8192]
    - [241, 16.4]
  - - [224, 128, 1, 8192]
    - [170, 17.9]
  - - [256, 128, 1, 8192]
    - [170, 21.74]
  - - [320, 128, 1, 8192]
    - [274, 23.42]
  - - [384, 128, 1, 8192]
    - [275, 27.53]
  - - [448, 128, 1, 8192]
    - [276, 29.82]
  - - [16, 160, 1, 8192]
    - [3, 2.32]
  - - [32, 160, 1, 8192]
    - [221, 4.37]
  - - [48, 160, 1, 8192]
    - [106, 6.35]
  - - [64, 160, 1, 8192]
    - [220, 8.16]
  - - [80, 160, 1, 8192]
    - [222, 9.82]
  - - [96, 160, 1, 8192]
    - [236, 11.97]
  - - [112, 160, 1, 8192]
    - [277, 13.14]
  - - [128, 160, 1, 8192]
    - [227, 12.96]
  - - [160, 160, 1, 8192]
    - [278, 17.21]
  - - [192, 160, 1, 8192]
    - [188, 19.26]
  - - [224, 160, 1, 8192]
    - [279, 21.85]
  - - [256, 160, 1, 8192]
    - [252, 23.35]
  - - [320, 160, 1, 8192]
    - [280, 26.97]
  - - [384, 160, 1, 8192]
    - [281, 30.64]
  - - [16, 192, 1, 8192]
    - [5, 2.62]
  - - [32, 192, 1, 8192]
    - [282, 5.25]
  - - [48, 192, 1, 8192]
    - [283, 7.59]
  - - [64, 192, 1, 8192]
    - [284, 8.84]
  - - [80, 192, 1, 8192]
    - [285, 11.76]
  - - [96, 192, 1, 8192]
    - [286, 14.03]
  - - [112, 192, 1, 8192]
    - [287, 14.75]
  - - [128, 192, 1, 8192]
    - [288, 16.05]
  - - [160, 192, 1, 8192]
    - [168, 19.69]
  - - [192, 192, 1, 8192]
    - [278, 22.74]
  - - [224, 192, 1, 8192]
    - [252, 25.2]
  - - [256, 192, 1, 8192]
    - [289, 27.6]
  - - [320, 192, 1, 8192]
    - [290, 30.72]
  - - [16, 224, 1, 8192]
    - [3, 3.14]
  - - [32, 224, 1, 8192]
    - [1, 5.8]
  - - [48, 224, 1, 8192]
    - [291, 8.31]
  - - [64, 224, 1, 8192]
    - [285, 11.14]
  - - [80, 224, 1, 8192]
    - [241, 12.87]
  - - [96, 224, 1, 8192]
    - [169, 14.6]
  - - [112, 224, 1, 8192]
    - [241, 16.88]
  - - [128, 224, 1, 8192]
    - [278, 17.49]
  - - [160, 224, 1, 8192]
    - [292, 21.43]
  - - [192, 224, 1, 8192]
    - [262, 24.09]
  - - [224, 224, 1, 8192]
    - [270, 25.84]
  - - [256, 224, 1, 8192]
    - [199, 28.67]
  - - [16, 256, 1, 8192]
    - [106, 3.15]
  - - [32, 256, 1, 8192]
    - [232, 6.03]
  - - [48, 256, 1, 8192]
    - [120, 8.41]
  - - [64, 256, 1, 8192]
    - [225, 11.37]
  - - [80, 256, 1, 8192]
    - [256, 12.74]
  - - [96, 256, 1, 8192]
    - [168, 15.98]
  - - [112, 256, 1, 8192]
    - [170, 18.42]
  - - [128, 256, 1, 8192]
    - [293, 19.95]
  - - [160, 256, 1, 8192]
    - [294, 23.48]
  - - [192, 256, 1, 8192]
    - [295, 26.58]
  - - [224, 256, 1, 8192]
    - [296, 29.48]
  - - [16, 320, 1, 8192]
    - [282, 4.31]
  - - [32, 320, 1, 8192]
    - [232, 8.26]
  - - [48, 320, 1, 8192]
    - [297, 11.06]
  - - [64, 320, 1, 8192]
    - [71, 13.24]
  - - [80, 320, 1, 8192]
    - [293, 16.49]
  - - [96, 320, 1, 8192]
    - [298, 19.32]
  - - [112, 320, 1, 8192]
    - [238, 21.28]
  - - [128, 320, 1, 8192]
    - [299, 23.6]
  - - [160, 320, 1, 8192]
    - [300, 27.5]
  - - [192, 320, 1, 8192]
    - [281, 30.74]
  - - [16, 384, 1, 8192]
    - [122, 4.79]
  - - [32, 384, 1, 8192]
    - [112, 8.76]
  - - [48, 384, 1, 8192]
    - [301, 13.86]
  - - [64, 384, 1, 8192]
    - [302, 15.97]
  - - [80, 384, 1, 8192]
    - [189, 19.24]
  - - [96, 384, 1, 8192]
    - [303, 22.17]
  - - [112, 384, 1, 8192]
    - [304, 25.13]
  - - [128, 384, 1, 8192]
    - [305, 27.14]
  - - [160, 384, 1, 8192]
    - [306, 30.54]
  - - [16, 448, 1, 8192]
    - [221, 5.91]
  - - [32, 448, 1, 8192]
    - [236, 11.37]
  - - [48, 448, 1, 8192]
    - [188, 14.68]
  - - [64, 448, 1, 8192]
    - [241, 17.9]
  - - [80, 448, 1, 8192]
    - [307, 21.54]
  - - [96, 448, 1, 8192]
    - [308, 23.92]
  - - [112, 448, 1, 8192]
    - [309, 26.55]
  - - [128, 448, 1, 8192]
    - [310, 28.7]
  - - [16, 512, 1, 8192]
    - [282, 5.94]
  - - [32, 512, 1, 8192]
    - [311, 10.84]
  - - [48, 512, 1, 8192]
    - [293, 15.84]
  - - [64, 512, 1, 8192]
    - [312, 20.95]
  - - [80, 512, 1, 8192]
    - [271, 22.78]
  - - [96, 512, 1, 8192]
    - [313, 26.4]
  - - [112, 512, 1, 8192]
    - [306, 28.03]
  - - [16, 640, 1, 8192]
    - [2, 7.43]
  - - [32, 640, 1, 8192]
    - [314, 12.61]
  - - [48, 640, 1, 8192]
    - [315, 18.71]
  - - [64, 640, 1, 8192]
    - [316, 23.28]
  - - [80, 640, 1, 8192]
    - [317, 25.73]
  - - [96, 640, 1, 8192]
    - [300, 30.81]
  - - [16, 768, 1, 8192]
    - [249, 7.97]
  - - [32, 768, 1, 8192]
    - [318, 15.21]
  - - [48, 768, 1, 8192]
    - [307, 21.37]
  - - [64, 768, 1, 8192]
    - [319, 25.89]
  - - [80, 768, 1, 8192]
    - [320, 28.81]
  - - [16, 1024, 1, 8192]
    - [301, 10.06]
  - - [32, 1024, 1, 8192]
    - [312, 19.43]
  - - [48, 1024, 1, 8192]
    - [321, 23.89]
  - - [16, 1280, 1, 8192]
    - [322, 11.44]
  - - [32, 1280, 1, 8192]
    - [323, 20.86]
  - - [48, 1280, 1, 8192]
    - [320, 27.88]
  - - [16, 1536, 1, 8192]
    - [212, 13.22]
  - - [32, 1536, 1, 8192]
    - [183, 24.51]
  - - [16, 2048, 1, 8192]
    - [204, 15.91]
  - - [16, 2560, 1, 8192]
    - [324, 17.46]
  - - [16, 3072, 1, 8192]
    - [205, 19.09]
  - - [16, 3584, 1, 8192]
    - [325, 20.01]
  - - [16, 16, 1, 32768]
    - [326, 0.58]
  - - [32, 16, 1, 32768]
    - [327, 0.61]
  - - [48, 16, 1, 32768]
    - [328, 1.42]
  - - [64, 16, 1, 32768]
    - [329, 1.99]
  - - [80, 16, 1, 32768]
    - [326, 2.69]
  - - [96, 16, 1, 32768]
    - [330, 1.95]
  - - [112, 16, 1, 32768]
    - [326, 3.44]
  - - [128, 16, 1, 32768]
    - [327, 1.79]
  - - [160, 16, 1, 32768]
    - [331, 1.92]
  - - [192, 16, 1, 32768]
    - [326, 2.19]
  - - [224, 16, 1, 32768]
    - [331, 4.0]
  - - [256, 16, 1, 32768]
    - [331, 6.06]
  - - [320, 16, 1, 32768]
    - [329, 8.89]
  - - [384, 16, 1, 32768]
    - [329, 9.75]
  - - [448, 16, 1, 32768]
    - [331, 11.78]
  - - [512, 16, 1, 32768]
    - [329, 12.85]
  - - [640, 16, 1, 32768]
    - [331, 16.43]
  - - [768, 16, 1, 32768]
    - [331, 18.74]
  - - [1024, 16, 1, 32768]
    - [332, 14.3]
  - - [1280, 16, 1, 32768]
    - [333, 12.26]
  - - [1536, 16, 1, 32768]
    - [334, 17.8]
  - - [2048, 16, 1, 32768]
    - [335, 32.99]
  - - [2560, 16, 1, 32768]
    - [336, 35.39]
  - - [3072, 16, 1, 32768]
    - [337, 15.1]
  - - [3584, 16, 1, 32768]
    - [338, 32.19]
  - - [16, 32, 1, 32768]
    - [328, 0.99]
  - - [32, 32, 1, 32768]
    - [326, 2.09]
  - - [48, 32, 1, 32768]
    - [329, 2.78]
  - - [64, 32, 1, 32768]
    - [331, 3.55]
  - - [80, 32, 1, 32768]
    - [336, 3.06]
  - - [96, 32, 1, 32768]
    - [329, 2.24]
  - - [112, 32, 1, 32768]
    - [339, 4.75]
  - - [128, 32, 1, 32768]
    - [333, 3.69]
  - - [160, 32, 1, 32768]
    - [340, 4.53]
  - - [192, 32, 1, 32768]
    - [341, 5.42]
  - - [224, 32, 1, 32768]
    - [331, 5.85]
  - - [256, 32, 1, 32768]
    - [329, 13.1]
  - - [320, 32, 1, 32768]
    - [329, 16.86]
  - - [384, 32, 1, 32768]
    - [331, 16.77]
  - - [448, 32, 1, 32768]
    - [329, 21.16]
  - - [512, 32, 1, 32768]
    - [329, 24.74]
  - - [640, 32, 1, 32768]
    - [339, 28.69]
  - - [768, 32, 1, 32768]
    - [339, 33.15]
  - - [1024, 32, 1, 32768]
    - [339, 39.93]
  - - [1280, 32, 1, 32768]
    - [332, 35.62]
  - - [1536, 32, 1, 32768]
    - [342, 41.67]
  - - [16, 48, 1, 32768]
    - [326, 1.51]
  - - [32, 48, 1, 32768]
    - [328, 2.87]
  - - [48, 48, 1, 32768]
    - [339, 3.41]
  - - [64, 48, 1, 32768]
    - [329, 5.51]
  - - [80, 48, 1, 32768]
    - [331, 7.12]
  - - [96, 48, 1, 32768]
    - [329, 7.62]
  - - [112, 48, 1, 32768]
    - [328, 8.89]
  - - [128, 48, 1, 32768]
    - [331, 10.19]
  - - [160, 48, 1, 32768]
    - [329, 13.23]
  - - [192, 48, 1, 32768]
    - [343, 13.89]
  - - [224, 48, 1, 32768]
    - [343, 15.92]
  - - [256, 48, 1, 32768]
    - [331, 19.63]
  - - [320, 48, 1, 32768]
    - [343, 22.61]
  - - [384, 48, 1, 32768]
    - [343, 25.67]
  - - [448, 48, 1, 32768]
    - [335, 27.34]
  - - [512, 48, 1, 32768]
    - [340, 28.69]
  - - [640, 48, 1, 32768]
    - [337, 31.99]
  - - [768, 48, 1, 32768]
    - [344, 37.25]
  - - [1024, 48, 1, 32768]
    - [327, 47.89]
  - - [1280, 48, 1, 32768]
    - [327, 54.17]
  - - [16, 64, 1, 32768]
    - [326, 2.17]
  - - [32, 64, 1, 32768]
    - [326, 4.39]
  - - [48, 64, 1, 32768]
    - [326, 6.26]
  - - [64, 64, 1, 32768]
    - [328, 7.13]
  - - [80, 64, 1, 32768]
    - [326, 9.98]
  - - [96, 64, 1, 32768]
    - [326, 11.26]
  - - [112, 64, 1, 32768]
    - [326, 11.93]
  - - [128, 64, 1, 32768]
    - [329, 14.82]
  - - [160, 64, 1, 32768]
    - [343, 15.1]
  - - [192, 64, 1, 32768]
    - [331, 20.01]
  - - [224, 64, 1, 32768]
    - [329, 22.46]
  - - [256, 64, 1, 32768]
    - [331, 24.43]
  - - [320, 64, 1, 32768]
    - [343, 29.14]
  - - [384, 64, 1, 32768]
    - [343, 34.34]
  - - [448, 64, 1, 32768]
    - [343, 36.66]
  - - [512, 64, 1, 32768]
    - [339, 38.98]
  - - [640, 64, 1, 32768]
    - [337, 42.96]
  - - [768, 64, 1, 32768]
    - [344, 49.62]
  - - [16, 80, 1, 32768]
    - [326, 2.72]
  - - [32, 80, 1, 32768]
    - [326, 5.21]
  - - [48, 80, 1, 32768]
    - [331, 6.31]
  - - [64, 80, 1, 32768]
    - [329, 8.49]
  - - [80, 80, 1, 32768]
    - [339, 9.94]
  - - [96, 80, 1, 32768]
    - [331, 13.15]
  - - [112, 80, 1, 32768]
    - [343, 13.33]
  - - [128, 80, 1, 32768]
    - [345, 14.93]
  - - [160, 80, 1, 32768]
    - [339, 18.5]
  - - [192, 80, 1, 32768]
    - [331, 24.1]
  - - [224, 80, 1, 32768]
    - [340, 23.12]
  - - [256, 80, 1, 32768]
    - [335, 27.54]
  - - [320, 80, 1, 32768]
    - [335, 32.74]
  - - [384, 80, 1, 32768]
    - [337, 35.76]
  - - [448, 80, 1, 32768]
    - [340, 38.41]
  - - [512, 80, 1, 32768]
    - [340, 42.01]
  - - [640, 80, 1, 32768]
    - [327, 43.85]
  - - [768, 80, 1, 32768]
    - [327, 48.52]
  - - [16, 96, 1, 32768]
    - [326, 3.14]
  - - [32, 96, 1, 32768]
    - [326, 6.26]
  - - [48, 96, 1, 32768]
    - [331, 7.58]
  - - [64, 96, 1, 32768]
    - [329, 10.12]
  - - [80, 96, 1, 32768]
    - [328, 11.42]
  - - [96, 96, 1, 32768]
    - [326, 14.66]
  - - [112, 96, 1, 32768]
    - [329, 18.35]
  - - [128, 96, 1, 32768]
    - [331, 20.16]
  - - [160, 96, 1, 32768]
    - [329, 23.41]
  - - [192, 96, 1, 32768]
    - [339, 26.19]
  - - [224, 96, 1, 32768]
    - [345, 25.9]
  - - [256, 96, 1, 32768]
    - [335, 32.52]
  - - [320, 96, 1, 32768]
    - [339, 37.5]
  - - [384, 96, 1, 32768]
    - [335, 42.96]
  - - [448, 96, 1, 32768]
    - [340, 44.97]
  - - [512, 96, 1, 32768]
    - [327, 45.72]
  - - [640, 96, 1, 32768]
    - [332, 48.95]
  - - [16, 112, 1, 32768]
    - [339, 2.93]
  - - [32, 112, 1, 32768]
    - [326, 7.12]
  - - [48, 112, 1, 32768]
    - [329, 9.19]
  - - [64, 112, 1, 32768]
    - [343, 10.52]
  - - [80, 112, 1, 32768]
    - [329, 14.69]
  - - [96, 112, 1, 32768]
    - [331, 18.32]
  - - [112, 112, 1, 32768]
    - [329, 20.72]
  - - [128, 112, 1, 32768]
    - [329, 23.88]
  - - [160, 112, 1, 32768]
    - [335, 25.58]
  - - [192, 112, 1, 32768]
    - [331, 26.75]
  - - [224, 112, 1, 32768]
    - [337, 31.31]
  - - [256, 112, 1, 32768]
    - [335, 36.78]
  - - [320, 112, 1, 32768]
    - [340, 38.94]
  - - [384, 112, 1, 32768]
    - [340, 42.05]
  - - [448, 112, 1, 32768]
    - [332, 41.14]
  - - [512, 112, 1, 32768]
    - [332, 42.12]
  - - [16, 128, 1, 32768]
    - [326, 4.05]
  - - [32, 128, 1, 32768]
    - [331, 7.1]
  - - [48, 128, 1, 32768]
    - [329, 10.83]
  - - [64, 128, 1, 32768]
    - [326, 13.48]
  - - [80, 128, 1, 32768]
    - [331, 17.98]
  - - [96, 128, 1, 32768]
    - [331, 20.9]
  - - [112, 128, 1, 32768]
    - [329, 24.45]
  - - [128, 128, 1, 32768]
    - [343, 24.76]
  - - [160, 128, 1, 32768]
    - [339, 29.59]
  - - [192, 128, 1, 32768]
    - [343, 34.82]
  - - [224, 128, 1, 32768]
    - [340, 34.8]
  - - [256, 128, 1, 32768]
    - [343, 42.7]
  - - [320, 128, 1, 32768]
    - [340, 46.01]
  - - [384, 128, 1, 32768]
    - [337, 55.06]
  - - [448, 128, 1, 32768]
    - [332, 48.32]
  - - [16, 160, 1, 32768]
    - [326, 5.09]
  - - [32, 160, 1, 32768]
    - [326, 10.06]
  - - [48, 160, 1, 32768]
    - [326, 13.79]
  - - [64, 160, 1, 32768]
    - [329, 17.46]
  - - [80, 160, 1, 32768]
    - [329, 21.71]
  - - [96, 160, 1, 32768]
    - [343, 22.54]
  - - [112, 160, 1, 32768]
    - [343, 25.12]
  - - [128, 160, 1, 32768]
    - [343, 28.47]
  - - [160, 160, 1, 32768]
    - [339, 34.22]
  - - [192, 160, 1, 32768]
    - [339, 40.37]
  - - [224, 160, 1, 32768]
    - [337, 42.63]
  - - [256, 160, 1, 32768]
    - [340, 45.73]
  - - [320, 160, 1, 32768]
    - [346, 45.87]
  - - [384, 160, 1, 32768]
    - [332, 53.94]
  - - [16, 192, 1, 32768]
    - [326, 6.12]
  - - [32, 192, 1, 32768]
    - [326, 11.78]
  - - [48, 192, 1, 32768]
    - [331, 15.29]
  - - [64, 192, 1, 32768]
    - [329, 20.27]
  - - [80, 192, 1, 32768]
    - [329, 25.89]
  - - [96, 192, 1, 32768]
    - [329, 27.44]
  - - [112, 192, 1, 32768]
    - [343, 29.42]
  - - [128, 192, 1, 32768]
    - [343, 33.02]
  - - [160, 192, 1, 32768]
    - [337, 38.12]
  - - [192, 192, 1, 32768]
    - [337, 46.31]
  - - [224, 192, 1, 32768]
    - [346, 44.49]
  - - [256, 192, 1, 32768]
    - [340, 53.89]
  - - [320, 192, 1, 32768]
    - [332, 51.89]
  - - [16, 224, 1, 32768]
    - [326, 6.92]
  - - [32, 224, 1, 32768]
    - [331, 12.76]
  - - [48, 224, 1, 32768]
    - [343, 15.83]
  - - [64, 224, 1, 32768]
    - [329, 24.24]
  - - [80, 224, 1, 32768]
    - [339, 26.08]
  - - [96, 224, 1, 32768]
    - [339, 29.67]
  - - [112, 224, 1, 32768]
    - [339, 33.87]
  - - [128, 224, 1, 32768]
    - [335, 38.54]
  - - [160, 224, 1, 32768]
    - [337, 42.69]
  - - [192, 224, 1, 32768]
    - [337, 50.87]
  - - [224, 224, 1, 32768]
    - [327, 44.37]
  - - [256, 224, 1, 32768]
    - [335, 47.49]
  - - [16, 256, 1, 32768]
    - [329, 6.12]
  - - [32, 256, 1, 32768]
    - [329, 12.24]
  - - [48, 256, 1, 32768]
    - [329, 18.52]
  - - [64, 256, 1, 32768]
    - [331, 23.11]
  - - [80, 256, 1, 32768]
    - [343, 27.28]
  - - [96, 256, 1, 32768]
    - [343, 32.12]
  - - [112, 256, 1, 32768]
    - [343, 37.2]
  - - [128, 256, 1, 32768]
    - [343, 42.08]
  - - [160, 256, 1, 32768]
    - [344, 39.62]
  - - [192, 256, 1, 32768]
    - [344, 48.89]
  - - [224, 256, 1, 32768]
    - [332, 45.13]
  - - [16, 320, 1, 32768]
    - [326, 9.87]
  - - [32, 320, 1, 32768]
    - [329, 17.83]
  - - [48, 320, 1, 32768]
    - [345, 22.06]
  - - [64, 320, 1, 32768]
    - [339, 29.36]
  - - [80, 320, 1, 32768]
    - [343, 32.43]
  - - [96, 320, 1, 32768]
    - [343, 39.05]
  - - [112, 320, 1, 32768]
    - [346, 39.21]
  - - [128, 320, 1, 32768]
    - [346, 45.42]
  - - [160, 320, 1, 32768]
    - [332, 49.53]
  - - [192, 320, 1, 32768]
    - [332, 57.96]
  - - [16, 384, 1, 32768]
    - [328, 9.71]
  - - [32, 384, 1, 32768]
    - [340, 16.02]
  - - [48, 384, 1, 32768]
    - [330, 19.55]
  - - [64, 384, 1, 32768]
    - [340, 27.62]
  - - [80, 384, 1, 32768]
    - [343, 39.28]
  - - [96, 384, 1, 32768]
    - [344, 36.4]
  - - [112, 384, 1, 32768]
    - [344, 42.69]
  - - [128, 384, 1, 32768]
    - [336, 48.65]
  - - [160, 384, 1, 32768]
    - [338, 47.85]
  - - [16, 448, 1, 32768]
    - [343, 8.47]
  - - [32, 448, 1, 32768]
    - [339, 16.77]
  - - [48, 448, 1, 32768]
    - [337, 25.3]
  - - [64, 448, 1, 32768]
    - [329, 30.4]
  - - [80, 448, 1, 32768]
    - [327, 34.61]
  - - [96, 448, 1, 32768]
    - [327, 39.22]
  - - [112, 448, 1, 32768]
    - [331, 36.88]
  - - [128, 448, 1, 32768]
    - [347, 45.32]
  - - [16, 512, 1, 32768]
    - [348, 7.74]
  - - [32, 512, 1, 32768]
    - [345, 19.48]
  - - [48, 512, 1, 32768]
    - [346, 25.95]
  - - [64, 512, 1, 32768]
    - [332, 29.67]
  - - [80, 512, 1, 32768]
    - [335, 34.16]
  - - [96, 512, 1, 32768]
    - [329, 34.4]
  - - [112, 512, 1, 32768]
    - [339, 44.11]
  - - [16, 640, 1, 32768]
    - [345, 10.81]
  - - [32, 640, 1, 32768]
    - [340, 23.95]
  - - [48, 640, 1, 32768]
    - [332, 27.73]
  - - [64, 640, 1, 32768]
    - [347, 36.05]
  - - [80, 640, 1, 32768]
    - [343, 37.49]
  - - [96, 640, 1, 32768]
    - [347, 44.61]
  - - [16, 768, 1, 32768]
    - [346, 11.66]
  - - [32, 768, 1, 32768]
    - [343, 27.54]
  - - [48, 768, 1, 32768]
    - [342, 29.48]
  - - [64, 768, 1, 32768]
    - [340, 44.12]
  - - [80, 768, 1, 32768]
    - [346, 37.53]
  - - [16, 1024, 1, 32768]
    - [343, 18.77]
  - - [32, 1024, 1, 32768]
    - [329, 26.21]
  - - [48, 1024, 1, 32768]
    - [337, 32.07]
  - - [16, 1280, 1, 32768]
    - [329, 14.62]
  - - [32, 1280, 1, 32768]
    - [347, 27.6]
  - - [48, 1280, 1, 32768]
    - [346, 34.87]
  - - [16, 1536, 1, 32768]
    - [344, 20.54]
  - - [32, 1536, 1, 32768]
    - [347, 34.53]
  - - [16, 2048, 1, 32768]
    - [344, 17.05]
  - - [16, 2560, 1, 32768]
    - [344, 20.79]
  - - [16, 3072, 1, 32768]
    - [329, 19.04]
  - - [16, 3584, 1, 32768]
    - [343, 22.66]
  - - [4096, 16, 1, 2048]
    - [349, 9.01]
  - - [5120, 16, 1, 2048]
    - [350, 9.79]
  - - [6144, 16, 1, 2048]
    - [351, 8.17]
  - - [7168, 16, 1, 2048]
    - [352, 12.59]
  - - [8192, 16, 1, 2048]
    - [353, 6.43]
  - - [10240, 16, 1, 2048]
    - [354, 14.15]
  - - [12288, 16, 1, 2048]
    - [355, 11.95]
  - - [16384, 16, 1, 2048]
    - [356, 19.79]
  - - [20480, 16, 1, 2048]
    - [357, 29.17]
  - - [24576, 16, 1, 2048]
    - [358, 29.25]
  - - [2048, 32, 1, 2048]
    - [359, 6.05]
  - - [2560, 32, 1, 2048]
    - [360, 5.26]
  - - [3072, 32, 1, 2048]
    - [361, 6.77]
  - - [3584, 32, 1, 2048]
    - [350, 7.29]
  - - [4096, 32, 1, 2048]
    - [362, 11.44]
  - - [5120, 32, 1, 2048]
    - [358, 12.34]
  - - [6144, 32, 1, 2048]
    - [363, 26.86]
  - - [7168, 32, 1, 2048]
    - [359, 20.87]
  - - [8192, 32, 1, 2048]
    - [364, 23.73]
  - - [10240, 32, 1, 2048]
    - [350, 33.99]
  - - [12288, 32, 1, 2048]
    - [351, 41.17]
  - - [1536, 48, 1, 2048]
    - [359, 11.45]
  - - [2048, 48, 1, 2048]
    - [359, 16.04]
  - - [2560, 48, 1, 2048]
    - [365, 18.95]
  - - [3072, 48, 1, 2048]
    - [365, 21.85]
  - - [3584, 48, 1, 2048]
    - [349, 22.04]
  - - [4096, 48, 1, 2048]
    - [352, 12.97]
  - - [5120, 48, 1, 2048]
    - [366, 20.39]
  - - [6144, 48, 1, 2048]
    - [350, 22.67]
  - - [7168, 48, 1, 2048]
    - [354, 34.08]
  - - [8192, 48, 1, 2048]
    - [352, 24.86]
  - - [10240, 48, 1, 2048]
    - [366, 30.09]
  - - [1024, 64, 1, 2048]
    - [354, 8.19]
  - - [1280, 64, 1, 2048]
    - [361, 11.94]
  - - [1536, 64, 1, 2048]
    - [367, 13.15]
  - - [2048, 64, 1, 2048]
    - [361, 15.18]
  - - [2560, 64, 1, 2048]
    - [368, 22.33]
  - - [3072, 64, 1, 2048]
    - [368, 26.52]
  - - [3584, 64, 1, 2048]
    - [356, 30.27]
  - - [4096, 64, 1, 2048]
    - [368, 35.97]
  - - [5120, 64, 1, 2048]
    - [369, 26.67]
  - - [6144, 64, 1, 2048]
    - [351, 35.18]
  - - [7168, 64, 1, 2048]
    - [354, 43.66]
  - - [1024, 80, 1, 2048]
    - [358, 4.33]
  - - [1280, 80, 1, 2048]
    - [360, 8.02]
  - - [1536, 80, 1, 2048]
    - [349, 8.9]
  - - [2048, 80, 1, 2048]
    - [357, 10.14]
  - - [2560, 80, 1, 2048]
    - [366, 14.44]
  - - [3072, 80, 1, 2048]
    - [360, 18.36]
  - - [3584, 80, 1, 2048]
    - [358, 30.64]
  - - [4096, 80, 1, 2048]
    - [366, 30.42]
  - - [5120, 80, 1, 2048]
    - [358, 27.07]
  - - [6144, 80, 1, 2048]
    - [349, 28.33]
  - - [768, 96, 1, 2048]
    - [356, 8.78]
  - - [1024, 96, 1, 2048]
    - [350, 12.0]
  - - [1280, 96, 1, 2048]
    - [349, 11.8]
  - - [1536, 96, 1, 2048]
    - [359, 16.59]
  - - [2048, 96, 1, 2048]
    - [358, 25.06]
  - - [2560, 96, 1, 2048]
    - [356, 18.99]
  - - [3072, 96, 1, 2048]
    - [356, 33.29]
  - - [3584, 96, 1, 2048]
    - [354, 37.45]
  - - [4096, 96, 1, 2048]
    - [351, 39.38]
  - - [5120, 96, 1, 2048]
    - [366, 44.56]
  - - [640, 112, 1, 2048]
    - [369, 11.3]
  - - [768, 112, 1, 2048]
    - [370, 13.66]
  - - [1024, 112, 1, 2048]
    - [368, 16.2]
  - - [1280, 112, 1, 2048]
    - [352, 20.32]
  - - [1536, 112, 1, 2048]
    - [358, 21.51]
  - - [2048, 112, 1, 2048]
    - [360, 29.93]
  - - [2560, 112, 1, 2048]
    - [361, 33.83]
  - - [3072, 112, 1, 2048]
    - [361, 37.36]
  - - [3584, 112, 1, 2048]
    - [354, 42.14]
  - - [4096, 112, 1, 2048]
    - [371, 40.7]
  - - [512, 128, 1, 2048]
    - [372, 11.25]
  - - [640, 128, 1, 2048]
    - [363, 12.09]
  - - [768, 128, 1, 2048]
    - [352, 15.35]
  - - [1024, 128, 1, 2048]
    - [370, 21.3]
  - - [1280, 128, 1, 2048]
    - [368, 21.79]
  - - [1536, 128, 1, 2048]
    - [365, 25.42]
  - - [2048, 128, 1, 2048]
    - [356, 34.24]
  - - [2560, 128, 1, 2048]
    - [351, 37.06]
  - - [3072, 128, 1, 2048]
    - [361, 43.83]
  - - [3584, 128, 1, 2048]
    - [368, 44.56]
  - - [448, 160, 1, 2048]
    - [369, 11.12]
  - - [512, 160, 1, 2048]
    - [364, 12.78]
  - - [640, 160, 1, 2048]
    - [370, 16.62]
  - - [768, 160, 1, 2048]
    - [364, 18.51]
  - - [1024, 160, 1, 2048]
    - [367, 20.01]
  - - [1280, 160, 1, 2048]
    - [356, 26.45]
  - - [1536, 160, 1, 2048]
    - [356, 31.38]
  - - [2048, 160, 1, 2048]
    - [357, 32.68]
  - - [2560, 160, 1, 2048]
    - [370, 36.66]
  - - [3072, 160, 1, 2048]
    - [371, 45.88]
  - - [384, 192, 1, 2048]
    - [364, 12.73]
  - - [448, 192, 1, 2048]
    - [370, 13.9]
  - - [512, 192, 1, 2048]
    - [373, 12.43]
  - - [640, 192, 1, 2048]
    - [364, 19.19]
  - - [768, 192, 1, 2048]
    - [352, 21.79]
  - - [1024, 192, 1, 2048]
    - [369, 24.44]
  - - [1280, 192, 1, 2048]
    - [356, 31.98]
  - - [1536, 192, 1, 2048]
    - [356, 36.81]
  - - [2048, 192, 1, 2048]
    - [351, 39.36]
  - - [2560, 192, 1, 2048]
    - [371, 47.44]
  - - [320, 224, 1, 2048]
    - [364, 12.99]
  - - [384, 224, 1, 2048]
    - [370, 13.55]
  - - [448, 224, 1, 2048]
    - [370, 16.63]
  - - [512, 224, 1, 2048]
    - [356, 14.99]
  - - [640, 224, 1, 2048]
    - [370, 21.45]
  - - [768, 224, 1, 2048]
    - [356, 22.14]
  - - [1024, 224, 1, 2048]
    - [358, 29.25]
  - - [1280, 224, 1, 2048]
    - [356, 35.39]
  - - [1536, 224, 1, 2048]
    - [361, 38.49]
  - - [2048, 224, 1, 2048]
    - [360, 41.03]
  - - [256, 256, 1, 2048]
    - [364, 11.57]
  - - [320, 256, 1, 2048]
    - [352, 12.41]
  - - [384, 256, 1, 2048]
    - [370, 14.84]
  - - [448, 256, 1, 2048]
    - [370, 17.35]
  - - [512, 256, 1, 2048]
    - [365, 18.41]
  - - [640, 256, 1, 2048]
    - [368, 21.36]
  - - [768, 256, 1, 2048]
    - [356, 24.82]
  - - [1024, 256, 1, 2048]
    - [358, 32.14]
  - - [1280, 256, 1, 2048]
    - [354, 33.32]
  - - [1536, 256, 1, 2048]
    - [351, 43.08]
  - - [224, 320, 1, 2048]
    - [353, 10.96]
  - - [256, 320, 1, 2048]
    - [352, 13.18]
  - - [320, 320, 1, 2048]
    - [352, 16.12]
  - - [384, 320, 1, 2048]
    - [358, 17.19]
  - - [448, 320, 1, 2048]
    - [359, 21.38]
  - - [512, 320, 1, 2048]
    - [363, 21.01]
  - - [640, 320, 1, 2048]
    - [358, 28.13]
  - - [768, 320, 1, 2048]
    - [358, 31.47]
  - - [1024, 320, 1, 2048]
    - [350, 32.54]
  - - [1280, 320, 1, 2048]
    - [351, 40.95]
  - - [1536, 320, 1, 2048]
    - [371, 49.15]
  - - [192, 384, 1, 2048]
    - [370, 11.65]
  - - [224, 384, 1, 2048]
    - [363, 12.07]
  - - [256, 384, 1, 2048]
    - [352, 15.95]
  - - [320, 384, 1, 2048]
    - [359, 19.83]
  - - [384, 384, 1, 2048]
    - [370, 22.29]
  - - [448, 384, 1, 2048]
    - [356, 24.28]
  - - [512, 384, 1, 2048]
    - [356, 27.61]
  - - [640, 384, 1, 2048]
    - [358, 34.3]
  - - [768, 384, 1, 2048]
    - [351, 33.17]
  - - [1024, 384, 1, 2048]
    - [354, 40.27]
  - - [1280, 384, 1, 2048]
    - [358, 45.09]
  - - [160, 448, 1, 2048]
    - [360, 11.58]
  - - [192, 448, 1, 2048]
    - [372, 8.74]
  - - [224, 448, 1, 2048]
    - [364, 15.93]
  - - [256, 448, 1, 2048]
    - [364, 17.62]
  - - [320, 448, 1, 2048]
    - [369, 21.33]
  - - [384, 448, 1, 2048]
    - [358, 23.85]
  - - [448, 448, 1, 2048]
    - [356, 29.57]
  - - [512, 448, 1, 2048]
    - [358, 29.41]
  - - [640, 448, 1, 2048]
    - [360, 33.81]
  - - [768, 448, 1, 2048]
    - [361, 36.53]
  - - [1024, 448, 1, 2048]
    - [356, 44.65]
  - - [128, 512, 1, 2048]
    - [368, 9.45]
  - - [160, 512, 1, 2048]
    - [352, 13.0]
  - - [192, 512, 1, 2048]
    - [359, 14.11]
  - - [224, 512, 1, 2048]
    - [365, 15.23]
  - - [256, 512, 1, 2048]
    - [370, 20.53]
  - - [320, 512, 1, 2048]
    - [353, 20.34]
  - - [384, 512, 1, 2048]
    - [356, 24.58]
  - - [448, 512, 1, 2048]
    - [356, 28.01]
  - - [512, 512, 1, 2048]
    - [356, 32.5]
  - - [640, 512, 1, 2048]
    - [361, 34.84]
  - - [768, 512, 1, 2048]
    - [356, 38.91]
  - - [112, 640, 1, 2048]
    - [359, 11.98]
  - - [128, 640, 1, 2048]
    - [364, 13.06]
  - - [160, 640, 1, 2048]
    - [370, 15.2]
  - - [192, 640, 1, 2048]
    - [358, 17.48]
  - - [224, 640, 1, 2048]
    - [359, 19.97]
  - - [256, 640, 1, 2048]
    - [356, 23.14]
  - - [320, 640, 1, 2048]
    - [358, 28.92]
  - - [384, 640, 1, 2048]
    - [356, 34.99]
  - - [448, 640, 1, 2048]
    - [362, 32.55]
  - - [512, 640, 1, 2048]
    - [349, 33.96]
  - - [640, 640, 1, 2048]
    - [360, 40.97]
  - - [768, 640, 1, 2048]
    - [356, 46.61]
  - - [96, 768, 1, 2048]
    - [363, 10.34]
  - - [112, 768, 1, 2048]
    - [364, 13.3]
  - - [128, 768, 1, 2048]
    - [359, 15.31]
  - - [160, 768, 1, 2048]
    - [370, 16.9]
  - - [192, 768, 1, 2048]
    - [360, 19.02]
  - - [224, 768, 1, 2048]
    - [363, 21.58]
  - - [256, 768, 1, 2048]
    - [356, 24.12]
  - - [320, 768, 1, 2048]
    - [356, 29.85]
  - - [384, 768, 1, 2048]
    - [356, 36.56]
  - - [448, 768, 1, 2048]
    - [358, 35.51]
  - - [512, 768, 1, 2048]
    - [361, 40.13]
  - - [640, 768, 1, 2048]
    - [356, 45.97]
  - - [64, 1024, 1, 2048]
    - [365, 8.95]
  - - [80, 1024, 1, 2048]
    - [353, 11.31]
  - - [96, 1024, 1, 2048]
    - [372, 14.26]
  - - [112, 1024, 1, 2048]
    - [352, 16.68]
  - - [128, 1024, 1, 2048]
    - [364, 19.57]
  - - [160, 1024, 1, 2048]
    - [369, 21.21]
  - - [192, 1024, 1, 2048]
    - [363, 24.47]
  - - [224, 1024, 1, 2048]
    - [362, 27.38]
  - - [256, 1024, 1, 2048]
    - [356, 32.51]
  - - [320, 1024, 1, 2048]
    - [354, 34.35]
  - - [384, 1024, 1, 2048]
    - [360, 38.52]
  - - [448, 1024, 1, 2048]
    - [356, 43.51]
  - - [64, 1280, 1, 2048]
    - [364, 8.98]
  - - [80, 1280, 1, 2048]
    - [359, 14.83]
  - - [96, 1280, 1, 2048]
    - [369, 17.29]
  - - [112, 1280, 1, 2048]
    - [369, 18.84]
  - - [128, 1280, 1, 2048]
    - [370, 20.54]
  - - [160, 1280, 1, 2048]
    - [362, 24.96]
  - - [192, 1280, 1, 2048]
    - [362, 31.44]
  - - [224, 1280, 1, 2048]
    - [362, 32.27]
  - - [256, 1280, 1, 2048]
    - [358, 32.78]
  - - [320, 1280, 1, 2048]
    - [356, 39.61]
  - - [384, 1280, 1, 2048]
    - [360, 45.7]
  - - [48, 1536, 1, 2048]
    - [362, 9.19]
  - - [64, 1536, 1, 2048]
    - [359, 14.36]
  - - [80, 1536, 1, 2048]
    - [368, 16.77]
  - - [96, 1536, 1, 2048]
    - [359, 20.43]
  - - [112, 1536, 1, 2048]
    - [356, 19.89]
  - - [128, 1536, 1, 2048]
    - [360, 24.16]
  - - [160, 1536, 1, 2048]
    - [368, 27.84]
  - - [192, 1536, 1, 2048]
    - [371, 29.18]
  - - [224, 1536, 1, 2048]
    - [354, 35.17]
  - - [256, 1536, 1, 2048]
    - [358, 37.28]
  - - [320, 1536, 1, 2048]
    - [356, 45.3]
  - - [32, 2048, 1, 2048]
    - [364, 10.41]
  - - [48, 2048, 1, 2048]
    - [370, 14.1]
  - - [64, 2048, 1, 2048]
    - [359, 19.27]
  - - [80, 2048, 1, 2048]
    - [369, 21.23]
  - - [96, 2048, 1, 2048]
    - [363, 23.86]
  - - [112, 2048, 1, 2048]
    - [362, 26.51]
  - - [128, 2048, 1, 2048]
    - [356, 31.4]
  - - [160, 2048, 1, 2048]
    - [373, 32.87]
  - - [192, 2048, 1, 2048]
    - [354, 40.64]
  - - [224, 2048, 1, 2048]
    - [356, 42.4]
  - - [32, 2560, 1, 2048]
    - [359, 12.13]
  - - [48, 2560, 1, 2048]
    - [369, 16.09]
  - - [64, 2560, 1, 2048]
    - [368, 20.89]
  - - [80, 2560, 1, 2048]
    - [359, 19.93]
  - - [96, 2560, 1, 2048]
    - [362, 30.45]
  - - [112, 2560, 1, 2048]
    - [356, 27.93]
  - - [128, 2560, 1, 2048]
    - [356, 33.11]
  - - [160, 2560, 1, 2048]
    - [356, 37.78]
  - - [192, 2560, 1, 2048]
    - [354, 39.39]
  - - [32, 3072, 1, 2048]
    - [359, 13.86]
  - - [48, 3072, 1, 2048]
    - [369, 18.35]
  - - [64, 3072, 1, 2048]
    - [369, 23.68]
  - - [80, 3072, 1, 2048]
    - [372, 19.6]
  - - [96, 3072, 1, 2048]
    - [356, 33.33]
  - - [112, 3072, 1, 2048]
    - [366, 31.13]
  - - [128, 3072, 1, 2048]
    - [358, 33.58]
  - - [160, 3072, 1, 2048]
    - [356, 42.63]
  - - [32, 3584, 1, 2048]
    - [364, 15.45]
  - - [48, 3584, 1, 2048]
    - [362, 20.73]
  - - [64, 3584, 1, 2048]
    - [369, 27.29]
  - - [80, 3584, 1, 2048]
    - [356, 25.82]
  - - [96, 3584, 1, 2048]
    - [354, 34.96]
  - - [112, 3584, 1, 2048]
    - [356, 33.66]
  - - [128, 3584, 1, 2048]
    - [365, 39.66]
  - - [16, 4096, 1, 2048]
    - [359, 8.83]
  - - [32, 4096, 1, 2048]
    - [369, 18.0]
  - - [48, 4096, 1, 2048]
    - [358, 19.72]
  - - [64, 4096, 1, 2048]
    - [370, 28.75]
  - - [80, 4096, 1, 2048]
    - [354, 30.77]
  - - [96, 4096, 1, 2048]
    - [354, 40.14]
  - - [112, 4096, 1, 2048]
    - [356, 36.71]
  - - [16, 5120, 1, 2048]
    - [356, 9.13]
  - - [32, 5120, 1, 2048]
    - [362, 22.1]
  - - [48, 5120, 1, 2048]
    - [373, 22.84]
  - - [64, 5120, 1, 2048]
    - [373, 30.21]
  - - [80, 5120, 1, 2048]
    - [366, 31.95]
  - - [96, 5120, 1, 2048]
    - [365, 32.04]
  - - [16, 6144, 1, 2048]
    - [362, 11.86]
  - - [32, 6144, 1, 2048]
    - [369, 23.38]
  - - [48, 6144, 1, 2048]
    - [354, 20.01]
  - - [64, 6144, 1, 2048]
    - [369, 29.85]
  - - [80, 6144, 1, 2048]
    - [366, 33.61]
  - - [16, 7168, 1, 2048]
    - [365, 8.45]
  - - [32, 7168, 1, 2048]
    - [369, 24.63]
  - - [48, 7168, 1, 2048]
    - [365, 25.43]
  - - [64, 7168, 1, 2048]
    - [359, 34.94]
  - - [16, 8192, 1, 2048]
    - [364, 11.01]
  - - [32, 8192, 1, 2048]
    - [359, 26.14]
  - - [48, 8192, 1, 2048]
    - [368, 27.3]
  - - [16, 10240, 1, 2048]
    - [370, 10.63]
  - - [32, 10240, 1, 2048]
    - [373, 26.89]
  - - [48, 10240, 1, 2048]
    - [349, 27.74]
  - - [16, 12288, 1, 2048]
    - [356, 12.21]
  - - [32, 12288, 1, 2048]
    - [369, 27.89]
  - - [16, 16384, 1, 2048]
    - [356, 15.51]
  - - [16, 20480, 1, 2048]
    - [369, 16.31]
  - - [16, 24576, 1, 2048]
    - [356, 15.32]
  - - [4096, 16, 1, 8192]
    - [370, 12.41]
  - - [5120, 16, 1, 8192]
    - [352, 26.43]
  - - [6144, 16, 1, 8192]
    - [374, 18.08]
  - - [7168, 16, 1, 8192]
    - [375, 29.45]
  - - [8192, 16, 1, 8192]
    - [361, 27.92]
  - - [10240, 16, 1, 8192]
    - [351, 28.53]
  - - [12288, 16, 1, 8192]
    - [353, 36.85]
  - - [16384, 16, 1, 8192]
    - [352, 39.75]
  - - [20480, 16, 1, 8192]
    - [357, 39.94]
  - - [24576, 16, 1, 8192]
    - [376, 39.75]
  - - [32768, 16, 1, 8192]
    - [377, 50.33]
  - - [40960, 16, 1, 8192]
    - [357, 40.1]
  - - [49152, 16, 1, 8192]
    - [378, 42.9]
  - - [65536, 16, 1, 8192]
    - [379, 43.93]
  - - [2048, 32, 1, 8192]
    - [380, 29.59]
  - - [2560, 32, 1, 8192]
    - [380, 36.56]
  - - [3072, 32, 1, 8192]
    - [381, 37.65]
  - - [3584, 32, 1, 8192]
    - [382, 40.1]
  - - [4096, 32, 1, 8192]
    - [383, 42.82]
  - - [5120, 32, 1, 8192]
    - [384, 46.27]
  - - [6144, 32, 1, 8192]
    - [383, 53.76]
  - - [7168, 32, 1, 8192]
    - [383, 51.85]
  - - [8192, 32, 1, 8192]
    - [350, 44.68]
  - - [10240, 32, 1, 8192]
    - [350, 51.49]
  - - [12288, 32, 1, 8192]
    - [351, 64.76]
  - - [16384, 32, 1, 8192]
    - [385, 57.59]
  - - [20480, 32, 1, 8192]
    - [386, 59.32]
  - - [24576, 32, 1, 8192]
    - [386, 64.17]
  - - [32768, 32, 1, 8192]
    - [386, 80.04]
  - - [40960, 32, 1, 8192]
    - [387, 68.74]
  - - [49152, 32, 1, 8192]
    - [387, 75.61]
  - - [1536, 48, 1, 8192]
    - [327, 34.05]
  - - [2048, 48, 1, 8192]
    - [388, 38.22]
  - - [2560, 48, 1, 8192]
    - [389, 45.91]
  - - [3072, 48, 1, 8192]
    - [390, 49.94]
  - - [3584, 48, 1, 8192]
    - [391, 50.5]
  - - [4096, 48, 1, 8192]
    - [361, 51.37]
  - - [5120, 48, 1, 8192]
    - [361, 62.94]
  - - [6144, 48, 1, 8192]
    - [391, 61.11]
  - - [7168, 48, 1, 8192]
    - [361, 69.97]
  - - [8192, 48, 1, 8192]
    - [390, 68.67]
  - - [10240, 48, 1, 8192]
    - [392, 67.2]
  - - [12288, 48, 1, 8192]
    - [391, 71.22]
  - - [16384, 48, 1, 8192]
    - [386, 55.38]
  - - [20480, 48, 1, 8192]
    - [390, 53.95]
  - - [24576, 48, 1, 8192]
    - [361, 59.29]
  - - [32768, 48, 1, 8192]
    - [393, 101.18]
  - - [40960, 48, 1, 8192]
    - [361, 85.09]
  - - [1024, 64, 1, 8192]
    - [380, 30.74]
  - - [1280, 64, 1, 8192]
    - [394, 36.05]
  - - [1536, 64, 1, 8192]
    - [395, 39.2]
  - - [2048, 64, 1, 8192]
    - [395, 48.61]
  - - [2560, 64, 1, 8192]
    - [396, 52.8]
  - - [3072, 64, 1, 8192]
    - [396, 63.49]
  - - [3584, 64, 1, 8192]
    - [396, 67.09]
  - - [4096, 64, 1, 8192]
    - [354, 58.46]
  - - [5120, 64, 1, 8192]
    - [354, 69.07]
  - - [6144, 64, 1, 8192]
    - [354, 76.91]
  - - [7168, 64, 1, 8192]
    - [354, 77.21]
  - - [8192, 64, 1, 8192]
    - [374, 74.87]
  - - [10240, 64, 1, 8192]
    - [392, 87.19]
  - - [12288, 64, 1, 8192]
    - [354, 82.88]
  - - [16384, 64, 1, 8192]
    - [374, 78.02]
  - - [20480, 64, 1, 8192]
    - [354, 85.73]
  - - [24576, 64, 1, 8192]
    - [354, 86.92]
  - - [1024, 80, 1, 8192]
    - [382, 30.91]
  - - [1280, 80, 1, 8192]
    - [397, 39.29]
  - - [1536, 80, 1, 8192]
    - [397, 45.25]
  - - [2048, 80, 1, 8192]
    - [398, 50.19]
  - - [2560, 80, 1, 8192]
    - [397, 53.58]
  - - [3072, 80, 1, 8192]
    - [361, 59.71]
  - - [3584, 80, 1, 8192]
    - [398, 59.03]
  - - [4096, 80, 1, 8192]
    - [361, 65.55]
  - - [5120, 80, 1, 8192]
    - [374, 69.88]
  - - [6144, 80, 1, 8192]
    - [374, 78.13]
  - - [7168, 80, 1, 8192]
    - [374, 84.49]
  - - [8192, 80, 1, 8192]
    - [374, 92.32]
  - - [10240, 80, 1, 8192]
    - [398, 72.23]
  - - [12288, 80, 1, 8192]
    - [349, 76.25]
  - - [16384, 80, 1, 8192]
    - [374, 96.78]
  - - [20480, 80, 1, 8192]
    - [349, 80.5]
  - - [24576, 80, 1, 8192]
    - [374, 96.95]
  - - [768, 96, 1, 8192]
    - [332, 32.06]
  - - [1024, 96, 1, 8192]
    - [388, 40.19]
  - - [1280, 96, 1, 8192]
    - [389, 45.44]
  - - [1536, 96, 1, 8192]
    - [390, 51.63]
  - - [2048, 96, 1, 8192]
    - [390, 60.31]
  - - [2560, 96, 1, 8192]
    - [361, 60.83]
  - - [3072, 96, 1, 8192]
    - [361, 68.87]
  - - [3584, 96, 1, 8192]
    - [361, 74.05]
  - - [4096, 96, 1, 8192]
    - [361, 78.36]
  - - [5120, 96, 1, 8192]
    - [391, 67.17]
  - - [6144, 96, 1, 8192]
    - [391, 76.25]
  - - [7168, 96, 1, 8192]
    - [390, 79.38]
  - - [8192, 96, 1, 8192]
    - [361, 83.22]
  - - [10240, 96, 1, 8192]
    - [386, 80.16]
  - - [12288, 96, 1, 8192]
    - [361, 86.91]
  - - [16384, 96, 1, 8192]
    - [393, 98.55]
  - - [20480, 96, 1, 8192]
    - [361, 91.91]
  - - [640, 112, 1, 8192]
    - [394, 31.96]
  - - [768, 112, 1, 8192]
    - [389, 36.1]
  - - [1024, 112, 1, 8192]
    - [390, 42.09]
  - - [1280, 112, 1, 8192]
    - [391, 43.92]
  - - [1536, 112, 1, 8192]
    - [396, 53.13]
  - - [2048, 112, 1, 8192]
    - [361, 54.0]
  - - [2560, 112, 1, 8192]
    - [361, 59.4]
  - - [3072, 112, 1, 8192]
    - [361, 67.28]
  - - [3584, 112, 1, 8192]
    - [354, 70.7]
  - - [4096, 112, 1, 8192]
    - [374, 67.97]
  - - [5120, 112, 1, 8192]
    - [361, 67.79]
  - - [6144, 112, 1, 8192]
    - [354, 75.71]
  - - [7168, 112, 1, 8192]
    - [354, 78.27]
  - - [8192, 112, 1, 8192]
    - [393, 73.21]
  - - [10240, 112, 1, 8192]
    - [393, 83.21]
  - - [12288, 112, 1, 8192]
    - [393, 83.7]
  - - [16384, 112, 1, 8192]
    - [354, 82.31]
  - - [512, 128, 1, 8192]
    - [327, 31.74]
  - - [640, 128, 1, 8192]
    - [380, 36.36]
  - - [768, 128, 1, 8192]
    - [389, 42.18]
  - - [1024, 128, 1, 8192]
    - [359, 45.73]
  - - [1280, 128, 1, 8192]
    - [390, 54.62]
  - - [1536, 128, 1, 8192]
    - [396, 63.17]
  - - [2048, 128, 1, 8192]
    - [391, 61.11]
  - - [2560, 128, 1, 8192]
    - [361, 69.29]
  - - [3072, 128, 1, 8192]
    - [354, 80.02]
  - - [3584, 128, 1, 8192]
    - [354, 84.65]
  - - [4096, 128, 1, 8192]
    - [374, 79.64]
  - - [5120, 128, 1, 8192]
    - [392, 88.34]
  - - [6144, 128, 1, 8192]
    - [354, 92.49]
  - - [7168, 128, 1, 8192]
    - [354, 94.44]
  - - [8192, 128, 1, 8192]
    - [393, 86.19]
  - - [10240, 128, 1, 8192]
    - [393, 95.18]
  - - [12288, 128, 1, 8192]
    - [393, 100.33]
  - - [448, 160, 1, 8192]
    - [380, 32.94]
  - - [512, 160, 1, 8192]
    - [390, 33.4]
  - - [640, 160, 1, 8192]
    - [390, 41.0]
  - - [768, 160, 1, 8192]
    - [399, 42.88]
  - - [1024, 160, 1, 8192]
    - [398, 51.28]
  - - [1280, 160, 1, 8192]
    - [383, 54.61]
  - - [1536, 160, 1, 8192]
    - [400, 60.8]
  - - [2048, 160, 1, 8192]
    - [349, 63.7]
  - - [2560, 160, 1, 8192]
    - [351, 70.24]
  - - [3072, 160, 1, 8192]
    - [374, 69.4]
  - - [3584, 160, 1, 8192]
    - [374, 87.97]
  - - [4096, 160, 1, 8192]
    - [374, 94.19]
  - - [5120, 160, 1, 8192]
    - [386, 74.63]
  - - [6144, 160, 1, 8192]
    - [386, 80.68]
  - - [7168, 160, 1, 8192]
    - [374, 91.25]
  - - [8192, 160, 1, 8192]
    - [374, 99.67]
  - - [10240, 160, 1, 8192]
    - [374, 86.34]
  - - [12288, 160, 1, 8192]
    - [374, 100.04]
  - - [384, 192, 1, 8192]
    - [347, 34.11]
  - - [448, 192, 1, 8192]
    - [394, 37.83]
  - - [512, 192, 1, 8192]
    - [389, 41.47]
  - - [640, 192, 1, 8192]
    - [384, 44.04]
  - - [768, 192, 1, 8192]
    - [381, 52.1]
  - - [1024, 192, 1, 8192]
    - [390, 61.77]
  - - [1280, 192, 1, 8192]
    - [361, 62.89]
  - - [1536, 192, 1, 8192]
    - [391, 65.2]
  - - [2048, 192, 1, 8192]
    - [354, 75.62]
  - - [2560, 192, 1, 8192]
    - [374, 74.91]
  - - [3072, 192, 1, 8192]
    - [374, 84.7]
  - - [3584, 192, 1, 8192]
    - [392, 87.23]
  - - [4096, 192, 1, 8192]
    - [361, 91.43]
  - - [5120, 192, 1, 8192]
    - [393, 86.71]
  - - [6144, 192, 1, 8192]
    - [393, 93.71]
  - - [7168, 192, 1, 8192]
    - [393, 99.67]
  - - [8192, 192, 1, 8192]
    - [393, 102.64]
  - - [10240, 192, 1, 8192]
    - [361, 96.38]
  - - [320, 224, 1, 8192]
    - [327, 32.72]
  - - [384, 224, 1, 8192]
    - [382, 37.96]
  - - [448, 224, 1, 8192]
    - [390, 39.76]
  - - [512, 224, 1, 8192]
    - [389, 43.51]
  - - [640, 224, 1, 8192]
    - [390, 54.04]
  - - [768, 224, 1, 8192]
    - [390, 56.11]
  - - [1024, 224, 1, 8192]
    - [391, 60.49]
  - - [1280, 224, 1, 8192]
    - [361, 63.71]
  - - [1536, 224, 1, 8192]
    - [361, 73.15]
  - - [2048, 224, 1, 8192]
    - [374, 74.07]
  - - [2560, 224, 1, 8192]
    - [374, 85.22]
  - - [3072, 224, 1, 8192]
    - [374, 94.51]
  - - [3584, 224, 1, 8192]
    - [361, 84.62]
  - - [4096, 224, 1, 8192]
    - [386, 81.44]
  - - [5120, 224, 1, 8192]
    - [393, 92.9]
  - - [6144, 224, 1, 8192]
    - [393, 100.1]
  - - [7168, 224, 1, 8192]
    - [393, 103.63]
  - - [8192, 224, 1, 8192]
    - [374, 95.11]
  - - [256, 256, 1, 8192]
    - [380, 28.05]
  - - [320, 256, 1, 8192]
    - [380, 34.05]
  - - [384, 256, 1, 8192]
    - [380, 39.67]
  - - [448, 256, 1, 8192]
    - [395, 43.79]
  - - [512, 256, 1, 8192]
    - [395, 46.37]
  - - [640, 256, 1, 8192]
    - [384, 54.23]
  - - [768, 256, 1, 8192]
    - [396, 64.39]
  - - [1024, 256, 1, 8192]
    - [391, 63.82]
  - - [1280, 256, 1, 8192]
    - [354, 70.12]
  - - [1536, 256, 1, 8192]
    - [354, 79.89]
  - - [2048, 256, 1, 8192]
    - [392, 73.02]
  - - [2560, 256, 1, 8192]
    - [392, 89.83]
  - - [3072, 256, 1, 8192]
    - [354, 94.08]
  - - [3584, 256, 1, 8192]
    - [354, 101.44]
  - - [4096, 256, 1, 8192]
    - [396, 85.1]
  - - [5120, 256, 1, 8192]
    - [354, 99.99]
  - - [6144, 256, 1, 8192]
    - [354, 98.47]
  - - [7168, 256, 1, 8192]
    - [354, 104.69]
  - - [224, 320, 1, 8192]
    - [381, 29.54]
  - - [256, 320, 1, 8192]
    - [380, 35.69]
  - - [320, 320, 1, 8192]
    - [388, 42.34]
  - - [384, 320, 1, 8192]
    - [398, 42.93]
  - - [448, 320, 1, 8192]
    - [390, 49.11]
  - - [512, 320, 1, 8192]
    - [398, 52.47]
  - - [640, 320, 1, 8192]
    - [390, 63.78]
  - - [768, 320, 1, 8192]
    - [400, 67.0]
  - - [1024, 320, 1, 8192]
    - [361, 68.61]
  - - [1280, 320, 1, 8192]
    - [361, 83.23]
  - - [1536, 320, 1, 8192]
    - [374, 81.5]
  - - [2048, 320, 1, 8192]
    - [374, 95.26]
  - - [2560, 320, 1, 8192]
    - [354, 91.98]
  - - [3072, 320, 1, 8192]
    - [386, 89.46]
  - - [3584, 320, 1, 8192]
    - [386, 98.32]
  - - [4096, 320, 1, 8192]
    - [393, 102.28]
  - - [5120, 320, 1, 8192]
    - [393, 111.98]
  - - [6144, 320, 1, 8192]
    - [374, 103.22]
  - - [192, 384, 1, 8192]
    - [382, 32.1]
  - - [224, 384, 1, 8192]
    - [388, 35.31]
  - - [256, 384, 1, 8192]
    - [394, 40.5]
  - - [320, 384, 1, 8192]
    - [397, 44.01]
  - - [384, 384, 1, 8192]
    - [390, 54.56]
  - - [448, 384, 1, 8192]
    - [384, 53.4]
  - - [512, 384, 1, 8192]
    - [396, 62.68]
  - - [640, 384, 1, 8192]
    - [361, 62.28]
  - - [768, 384, 1, 8192]
    - [400, 76.71]
  - - [1024, 384, 1, 8192]
    - [354, 77.28]
  - - [1280, 384, 1, 8192]
    - [374, 83.44]
  - - [1536, 384, 1, 8192]
    - [374, 90.69]
  - - [2048, 384, 1, 8192]
    - [361, 97.18]
  - - [2560, 384, 1, 8192]
    - [386, 92.25]
  - - [3072, 384, 1, 8192]
    - [386, 104.39]
  - - [3584, 384, 1, 8192]
    - [354, 105.12]
  - - [4096, 384, 1, 8192]
    - [393, 111.66]
  - - [5120, 384, 1, 8192]
    - [374, 102.52]
  - - [160, 448, 1, 8192]
    - [347, 31.52]
  - - [192, 448, 1, 8192]
    - [370, 31.19]
  - - [224, 448, 1, 8192]
    - [397, 36.97]
  - - [256, 448, 1, 8192]
    - [397, 42.52]
  - - [320, 448, 1, 8192]
    - [384, 46.99]
  - - [384, 448, 1, 8192]
    - [398, 54.82]
  - - [448, 448, 1, 8192]
    - [363, 53.06]
  - - [512, 448, 1, 8192]
    - [361, 63.08]
  - - [640, 448, 1, 8192]
    - [361, 68.49]
  - - [768, 448, 1, 8192]
    - [351, 74.83]
  - - [1024, 448, 1, 8192]
    - [374, 76.72]
  - - [1280, 448, 1, 8192]
    - [374, 87.87]
  - - [1536, 448, 1, 8192]
    - [374, 98.39]
  - - [2048, 448, 1, 8192]
    - [386, 89.13]
  - - [2560, 448, 1, 8192]
    - [386, 101.25]
  - - [3072, 448, 1, 8192]
    - [393, 109.81]
  - - [3584, 448, 1, 8192]
    - [393, 117.01]
  - - [4096, 448, 1, 8192]
    - [354, 100.61]
  - - [128, 512, 1, 8192]
    - [347, 28.98]
  - - [160, 512, 1, 8192]
    - [388, 32.55]
  - - [192, 512, 1, 8192]
    - [401, 37.87]
  - - [224, 512, 1, 8192]
    - [396, 42.78]
  - - [256, 512, 1, 8192]
    - [389, 48.28]
  - - [320, 512, 1, 8192]
    - [396, 54.26]
  - - [384, 512, 1, 8192]
    - [390, 64.44]
  - - [448, 512, 1, 8192]
    - [400, 60.12]
  - - [512, 512, 1, 8192]
    - [389, 63.33]
  - - [640, 512, 1, 8192]
    - [351, 73.65]
  - - [768, 512, 1, 8192]
    - [354, 83.21]
  - - [1024, 512, 1, 8192]
    - [392, 76.78]
  - - [1280, 512, 1, 8192]
    - [392, 93.17]
  - - [1536, 512, 1, 8192]
    - [354, 99.87]
  - - [2048, 512, 1, 8192]
    - [386, 92.92]
  - - [2560, 512, 1, 8192]
    - [354, 104.09]
  - - [3072, 512, 1, 8192]
    - [387, 109.81]
  - - [3584, 512, 1, 8192]
    - [387, 115.58]
  - - [112, 640, 1, 8192]
    - [380, 29.93]
  - - [128, 640, 1, 8192]
    - [402, 33.59]
  - - [160, 640, 1, 8192]
    - [398, 36.46]
  - - [192, 640, 1, 8192]
    - [395, 44.36]
  - - [224, 640, 1, 8192]
    - [396, 50.14]
  - - [256, 640, 1, 8192]
    - [390, 55.5]
  - - [320, 640, 1, 8192]
    - [361, 53.8]
  - - [384, 640, 1, 8192]
    - [361, 63.81]
  - - [448, 640, 1, 8192]
    - [361, 70.95]
  - - [512, 640, 1, 8192]
    - [361, 80.75]
  - - [640, 640, 1, 8192]
    - [361, 83.47]
  - - [768, 640, 1, 8192]
    - [374, 84.69]
  - - [1024, 640, 1, 8192]
    - [392, 89.79]
  - - [1280, 640, 1, 8192]
    - [361, 95.52]
  - - [1536, 640, 1, 8192]
    - [386, 97.72]
  - - [2048, 640, 1, 8192]
    - [393, 109.3]
  - - [2560, 640, 1, 8192]
    - [393, 124.97]
  - - [3072, 640, 1, 8192]
    - [374, 108.0]
  - - [96, 768, 1, 8192]
    - [383, 25.89]
  - - [112, 768, 1, 8192]
    - [383, 28.32]
  - - [128, 768, 1, 8192]
    - [380, 40.34]
  - - [160, 768, 1, 8192]
    - [399, 40.64]
  - - [192, 768, 1, 8192]
    - [398, 44.83]
  - - [224, 768, 1, 8192]
    - [396, 57.15]
  - - [256, 768, 1, 8192]
    - [390, 63.03]
  - - [320, 768, 1, 8192]
    - [399, 46.72]
  - - [384, 768, 1, 8192]
    - [382, 58.17]
  - - [448, 768, 1, 8192]
    - [332, 48.02]
  - - [512, 768, 1, 8192]
    - [392, 62.11]
  - - [640, 768, 1, 8192]
    - [392, 88.47]
  - - [768, 768, 1, 8192]
    - [400, 87.2]
  - - [1024, 768, 1, 8192]
    - [361, 94.31]
  - - [1280, 768, 1, 8192]
    - [386, 91.38]
  - - [1536, 768, 1, 8192]
    - [386, 102.04]
  - - [2048, 768, 1, 8192]
    - [393, 109.26]
  - - [2560, 768, 1, 8192]
    - [354, 101.87]
  - - [64, 1024, 1, 8192]
    - [327, 28.76]
  - - [80, 1024, 1, 8192]
    - [382, 30.75]
  - - [96, 1024, 1, 8192]
    - [395, 37.81]
  - - [112, 1024, 1, 8192]
    - [396, 38.52]
  - - [128, 1024, 1, 8192]
    - [389, 46.86]
  - - [160, 1024, 1, 8192]
    - [396, 50.96]
  - - [192, 1024, 1, 8192]
    - [396, 62.78]
  - - [224, 1024, 1, 8192]
    - [395, 54.65]
  - - [256, 1024, 1, 8192]
    - [391, 69.22]
  - - [320, 1024, 1, 8192]
    - [354, 70.11]
  - - [384, 1024, 1, 8192]
    - [396, 78.43]
  - - [448, 1024, 1, 8192]
    - [392, 76.4]
  - - [512, 1024, 1, 8192]
    - [374, 81.16]
  - - [640, 1024, 1, 8192]
    - [392, 104.89]
  - - [768, 1024, 1, 8192]
    - [354, 100.03]
  - - [1024, 1024, 1, 8192]
    - [386, 93.76]
  - - [1280, 1024, 1, 8192]
    - [354, 104.25]
  - - [1536, 1024, 1, 8192]
    - [393, 111.68]
  - - [64, 1280, 1, 8192]
    - [402, 34.43]
  - - [80, 1280, 1, 8192]
    - [396, 33.18]
  - - [96, 1280, 1, 8192]
    - [363, 36.07]
  - - [112, 1280, 1, 8192]
    - [390, 41.97]
  - - [128, 1280, 1, 8192]
    - [390, 50.24]
  - - [160, 1280, 1, 8192]
    - [354, 48.26]
  - - [192, 1280, 1, 8192]
    - [400, 59.24]
  - - [224, 1280, 1, 8192]
    - [354, 62.71]
  - - [256, 1280, 1, 8192]
    - [361, 70.26]
  - - [320, 1280, 1, 8192]
    - [385, 64.84]
  - - [384, 1280, 1, 8192]
    - [392, 80.88]
  - - [448, 1280, 1, 8192]
    - [392, 89.34]
  - - [512, 1280, 1, 8192]
    - [374, 95.92]
  - - [640, 1280, 1, 8192]
    - [354, 92.7]
  - - [768, 1280, 1, 8192]
    - [386, 89.4]
  - - [1024, 1280, 1, 8192]
    - [354, 99.51]
  - - [1280, 1280, 1, 8192]
    - [393, 115.85]
  - - [1536, 1280, 1, 8192]
    - [354, 107.09]
  - - [48, 1536, 1, 8192]
    - [396, 26.29]
  - - [64, 1536, 1, 8192]
    - [402, 35.15]
  - - [80, 1536, 1, 8192]
    - [396, 38.17]
  - - [96, 1536, 1, 8192]
    - [395, 44.91]
  - - [112, 1536, 1, 8192]
    - [390, 45.86]
  - - [128, 1536, 1, 8192]
    - [380, 53.47]
  - - [160, 1536, 1, 8192]
    - [354, 59.5]
  - - [192, 1536, 1, 8192]
    - [400, 75.65]
  - - [224, 1536, 1, 8192]
    - [396, 68.15]
  - - [256, 1536, 1, 8192]
    - [361, 74.06]
  - - [320, 1536, 1, 8192]
    - [392, 87.85]
  - - [384, 1536, 1, 8192]
    - [392, 87.73]
  - - [448, 1536, 1, 8192]
    - [392, 97.11]
  - - [512, 1536, 1, 8192]
    - [354, 95.9]
  - - [640, 1536, 1, 8192]
    - [392, 88.59]
  - - [768, 1536, 1, 8192]
    - [386, 103.4]
  - - [1024, 1536, 1, 8192]
    - [393, 113.57]
  - - [1280, 1536, 1, 8192]
    - [392, 104.65]
  - - [32, 2048, 1, 8192]
    - [401, 26.17]
  - - [48, 2048, 1, 8192]
    - [403, 27.56]
  - - [64, 2048, 1, 8192]
    - [396, 38.77]
  - - [80, 2048, 1, 8192]
    - [396, 48.71]
  - - [96, 2048, 1, 8192]
    - [396, 64.31]
  - - [112, 2048, 1, 8192]
    - [351, 48.81]
  - - [128, 2048, 1, 8192]
    - [354, 59.14]
  - - [160, 2048, 1, 8192]
    - [354, 70.73]
  - - [192, 2048, 1, 8192]
    - [354, 85.46]
  - - [224, 2048, 1, 8192]
    - [392, 76.57]
  - - [256, 2048, 1, 8192]
    - [374, 81.36]
  - - [320, 2048, 1, 8192]
    - [392, 105.15]
  - - [384, 2048, 1, 8192]
    - [354, 105.01]
  - - [448, 2048, 1, 8192]
    - [386, 81.5]
  - - [512, 2048, 1, 8192]
    - [386, 93.37]
  - - [640, 2048, 1, 8192]
    - [392, 114.58]
  - - [768, 2048, 1, 8192]
    - [393, 113.25]
  - - [32, 2560, 1, 8192]
    - [402, 27.88]
  - - [48, 2560, 1, 8192]
    - [398, 32.4]
  - - [64, 2560, 1, 8192]
    - [394, 43.49]
  - - [80, 2560, 1, 8192]
    - [354, 50.07]
  - - [96, 2560, 1, 8192]
    - [354, 61.05]
  - - [112, 2560, 1, 8192]
    - [361, 54.35]
  - - [128, 2560, 1, 8192]
    - [390, 63.27]
  - - [160, 2560, 1, 8192]
    - [374, 62.1]
  - - [192, 2560, 1, 8192]
    - [400, 78.6]
  - - [224, 2560, 1, 8192]
    - [390, 71.5]
  - - [256, 2560, 1, 8192]
    - [374, 92.78]
  - - [320, 2560, 1, 8192]
    - [396, 80.29]
  - - [384, 2560, 1, 8192]
    - [354, 88.56]
  - - [448, 2560, 1, 8192]
    - [392, 95.32]
  - - [512, 2560, 1, 8192]
    - [361, 104.49]
  - - [640, 2560, 1, 8192]
    - [393, 112.99]
  - - [768, 2560, 1, 8192]
    - [354, 110.29]
  - - [32, 3072, 1, 8192]
    - [401, 32.32]
  - - [48, 3072, 1, 8192]
    - [394, 34.84]
  - - [64, 3072, 1, 8192]
    - [394, 48.48]
  - - [80, 3072, 1, 8192]
    - [395, 48.8]
  - - [96, 3072, 1, 8192]
    - [354, 66.12]
  - - [112, 3072, 1, 8192]
    - [392, 58.44]
  - - [128, 3072, 1, 8192]
    - [390, 66.48]
  - - [160, 3072, 1, 8192]
    - [392, 84.76]
  - - [192, 3072, 1, 8192]
    - [396, 84.13]
  - - [224, 3072, 1, 8192]
    - [354, 81.86]
  - - [256, 3072, 1, 8192]
    - [361, 89.37]
  - - [320, 3072, 1, 8192]
    - [354, 92.39]
  - - [384, 3072, 1, 8192]
    - [354, 108.17]
  - - [448, 3072, 1, 8192]
    - [392, 105.39]
  - - [512, 3072, 1, 8192]
    - [393, 110.59]
  - - [640, 3072, 1, 8192]
    - [392, 117.23]
  - - [32, 3584, 1, 8192]
    - [359, 34.2]
  - - [48, 3584, 1, 8192]
    - [354, 37.24]
  - - [64, 3584, 1, 8192]
    - [354, 49.38]
  - - [80, 3584, 1, 8192]
    - [354, 61.03]
  - - [96, 3584, 1, 8192]
    - [396, 66.8]
  - - [112, 3584, 1, 8192]
    - [361, 66.01]
  - - [128, 3584, 1, 8192]
    - [390, 79.63]
  - - [160, 3584, 1, 8192]
    - [392, 93.33]
  - - [192, 3584, 1, 8192]
    - [396, 93.65]
  - - [224, 3584, 1, 8192]
    - [361, 82.62]
  - - [256, 3584, 1, 8192]
    - [361, 96.92]
  - - [320, 3584, 1, 8192]
    - [392, 102.3]
  - - [384, 3584, 1, 8192]
    - [354, 120.35]
  - - [448, 3584, 1, 8192]
    - [393, 108.16]
  - - [512, 3584, 1, 8192]
    - [393, 118.99]
  - - [16, 4096, 1, 8192]
    - [403, 16.8]
  - - [32, 4096, 1, 8192]
    - [359, 35.76]
  - - [48, 4096, 1, 8192]
    - [354, 40.78]
  - - [64, 4096, 1, 8192]
    - [354, 52.0]
  - - [80, 4096, 1, 8192]
    - [354, 63.06]
  - - [96, 4096, 1, 8192]
    - [354, 78.08]
  - - [112, 4096, 1, 8192]
    - [392, 70.01]
  - - [128, 4096, 1, 8192]
    - [374, 75.56]
  - - [160, 4096, 1, 8192]
    - [392, 98.84]
  - - [192, 4096, 1, 8192]
    - [396, 88.05]
  - - [224, 4096, 1, 8192]
    - [392, 81.97]
  - - [256, 4096, 1, 8192]
    - [386, 91.89]
  - - [320, 4096, 1, 8192]
    - [392, 112.79]
  - - [384, 4096, 1, 8192]
    - [387, 113.97]
  - - [448, 4096, 1, 8192]
    - [392, 103.56]
  - - [16, 5120, 1, 8192]
    - [401, 16.22]
  - - [32, 5120, 1, 8192]
    - [403, 37.09]
  - - [48, 5120, 1, 8192]
    - [349, 38.35]
  - - [64, 5120, 1, 8192]
    - [349, 51.49]
  - - [80, 5120, 1, 8192]
    - [374, 53.36]
  - - [96, 5120, 1, 8192]
    - [396, 63.55]
  - - [112, 5120, 1, 8192]
    - [374, 71.47]
  - - [128, 5120, 1, 8192]
    - [390, 77.75]
  - - [160, 5120, 1, 8192]
    - [396, 75.47]
  - - [192, 5120, 1, 8192]
    - [396, 91.25]
  - - [224, 5120, 1, 8192]
    - [404, 85.29]
  - - [256, 5120, 1, 8192]
    - [374, 99.07]
  - - [320, 5120, 1, 8192]
    - [354, 98.05]
  - - [384, 5120, 1, 8192]
    - [354, 115.1]
  - - [16, 6144, 1, 8192]
    - [369, 18.99]
  - - [32, 6144, 1, 8192]
    - [369, 38.04]
  - - [48, 6144, 1, 8192]
    - [394, 39.55]
  - - [64, 6144, 1, 8192]
    - [394, 55.1]
  - - [80, 6144, 1, 8192]
    - [354, 52.96]
  - - [96, 6144, 1, 8192]
    - [396, 77.16]
  - - [112, 6144, 1, 8192]
    - [361, 66.08]
  - - [128, 6144, 1, 8192]
    - [361, 78.54]
  - - [160, 6144, 1, 8192]
    - [354, 82.59]
  - - [192, 6144, 1, 8192]
    - [354, 91.87]
  - - [224, 6144, 1, 8192]
    - [393, 90.25]
  - - [256, 6144, 1, 8192]
    - [361, 96.94]
  - - [320, 6144, 1, 8192]
    - [392, 114.75]
  - - [16, 7168, 1, 8192]
    - [401, 19.58]
  - - [32, 7168, 1, 8192]
    - [401, 38.77]
  - - [48, 7168, 1, 8192]
    - [369, 42.55]
  - - [64, 7168, 1, 8192]
    - [396, 55.92]
  - - [80, 7168, 1, 8192]
    - [396, 64.52]
  - - [96, 7168, 1, 8192]
    - [354, 78.03]
  - - [112, 7168, 1, 8192]
    - [361, 71.09]
  - - [128, 7168, 1, 8192]
    - [361, 82.85]
  - - [160, 7168, 1, 8192]
    - [392, 96.69]
  - - [192, 7168, 1, 8192]
    - [354, 113.41]
  - - [224, 7168, 1, 8192]
    - [393, 93.23]
  - - [256, 7168, 1, 8192]
    - [393, 110.43]
  - - [16, 8192, 1, 8192]
    - [373, 18.83]
  - - [32, 8192, 1, 8192]
    - [359, 41.04]
  - - [48, 8192, 1, 8192]
    - [354, 44.02]
  - - [64, 8192, 1, 8192]
    - [394, 55.48]
  - - [80, 8192, 1, 8192]
    - [396, 59.18]
  - - [96, 8192, 1, 8192]
    - [354, 85.44]
  - - [112, 8192, 1, 8192]
    - [386, 71.45]
  - - [128, 8192, 1, 8192]
    - [386, 81.84]
  - - [160, 8192, 1, 8192]
    - [392, 104.29]
  - - [192, 8192, 1, 8192]
    - [354, 104.34]
  - - [224, 8192, 1, 8192]
    - [386, 91.17]
  - - [16, 10240, 1, 8192]
    - [373, 20.7]
  - - [32, 10240, 1, 8192]
    - [373, 41.13]
  - - [48, 10240, 1, 8192]
    - [369, 41.53]
  - - [64, 10240, 1, 8192]
    - [394, 59.14]
  - - [80, 10240, 1, 8192]
    - [396, 63.58]
  - - [96, 10240, 1, 8192]
    - [396, 82.53]
  - - [112, 10240, 1, 8192]
    - [374, 72.56]
  - - [128, 10240, 1, 8192]
    - [361, 82.47]
  - - [160, 10240, 1, 8192]
    - [354, 89.56]
  - - [192, 10240, 1, 8192]
    - [354, 104.51]
  - - [16, 12288, 1, 8192]
    - [369, 20.19]
  - - [32, 12288, 1, 8192]
    - [359, 40.72]
  - - [48, 12288, 1, 8192]
    - [354, 47.35]
  - - [64, 12288, 1, 8192]
    - [354, 60.64]
  - - [80, 12288, 1, 8192]
    - [354, 72.5]
  - - [96, 12288, 1, 8192]
    - [354, 87.81]
  - - [112, 12288, 1, 8192]
    - [393, 75.76]
  - - [128, 12288, 1, 8192]
    - [393, 87.16]
  - - [160, 12288, 1, 8192]
    - [392, 107.42]
  - - [16, 16384, 1, 8192]
    - [359, 21.26]
  - - [32, 16384, 1, 8192]
    - [359, 42.13]
  - - [48, 16384, 1, 8192]
    - [404, 52.06]
  - - [64, 16384, 1, 8192]
    - [404, 68.35]
  - - [80, 16384, 1, 8192]
    - [354, 71.95]
  - - [96, 16384, 1, 8192]
    - [354, 87.3]
  - - [112, 16384, 1, 8192]
    - [374, 78.71]
  - - [16, 20480, 1, 8192]
    - [369, 21.47]
  - - [32, 20480, 1, 8192]
    - [404, 42.78]
  - - [48, 20480, 1, 8192]
    - [396, 47.01]
  - - [64, 20480, 1, 8192]
    - [354, 62.67]
  - - [80, 20480, 1, 8192]
    - [354, 70.81]
  - - [96, 20480, 1, 8192]
    - [354, 93.44]
  - - [16, 24576, 1, 8192]
    - [404, 22.45]
  - - [32, 24576, 1, 8192]
    - [404, 44.63]
  - - [48, 24576, 1, 8192]
    - [354, 49.47]
  - - [64, 24576, 1, 8192]
    - [354, 60.71]
  - - [80, 24576, 1, 8192]
    - [354, 76.65]
  - - [16, 32768, 1, 8192]
    - [404, 26.24]
  - - [32, 32768, 1, 8192]
    - [404, 52.11]
  - - [48, 32768, 1, 8192]
    - [354, 51.55]
  - - [16, 40960, 1, 8192]
    - [359, 23.16]
  - - [32, 40960, 1, 8192]
    - [359, 45.41]
  - - [48, 40960, 1, 8192]
    - [354, 51.03]
  - - [16, 49152, 1, 8192]
    - [359, 23.25]
  - - [32, 49152, 1, 8192]
    - [359, 45.36]
  - - [16, 65536, 1, 8192]
    - [404, 25.38]
  - - [4096, 16, 1, 32768]
    - [372, 33.14]
  - - [5120, 16, 1, 32768]
    - [352, 32.44]
  - - [6144, 16, 1, 32768]
    - [375, 37.9]
  - - [7168, 16, 1, 32768]
    - [375, 39.48]
  - - [8192, 16, 1, 32768]
    - [352, 45.98]
  - - [10240, 16, 1, 32768]
    - [405, 43.4]
  - - [12288, 16, 1, 32768]
    - [405, 45.68]
  - - [16384, 16, 1, 32768]
    - [352, 42.9]
  - - [20480, 16, 1, 32768]
    - [357, 43.38]
  - - [24576, 16, 1, 32768]
    - [376, 44.8]
  - - [32768, 16, 1, 32768]
    - [377, 38.83]
  - - [40960, 16, 1, 32768]
    - [357, 39.76]
  - - [49152, 16, 1, 32768]
    - [376, 40.89]
  - - [2048, 32, 1, 32768]
    - [380, 54.4]
  - - [2560, 32, 1, 32768]
    - [380, 64.64]
  - - [3072, 32, 1, 32768]
    - [380, 66.91]
  - - [3584, 32, 1, 32768]
    - [390, 57.12]
  - - [4096, 32, 1, 32768]
    - [381, 68.9]
  - - [5120, 32, 1, 32768]
    - [380, 67.04]
  - - [6144, 32, 1, 32768]
    - [380, 72.17]
  - - [7168, 32, 1, 32768]
    - [383, 71.92]
  - - [8192, 32, 1, 32768]
    - [351, 63.47]
  - - [10240, 32, 1, 32768]
    - [351, 62.5]
  - - [12288, 32, 1, 32768]
    - [380, 76.66]
  - - [16384, 32, 1, 32768]
    - [380, 70.38]
  - - [20480, 32, 1, 32768]
    - [385, 74.74]
  - - [24576, 32, 1, 32768]
    - [351, 72.48]
  - - [1536, 48, 1, 32768]
    - [389, 62.67]
  - - [2048, 48, 1, 32768]
    - [389, 73.13]
  - - [2560, 48, 1, 32768]
    - [389, 82.95]
  - - [3072, 48, 1, 32768]
    - [389, 88.39]
  - - [3584, 48, 1, 32768]
    - [391, 79.38]
  - - [4096, 48, 1, 32768]
    - [390, 92.3]
  - - [5120, 48, 1, 32768]
    - [391, 96.02]
  - - [6144, 48, 1, 32768]
    - [391, 102.65]
  - - [7168, 48, 1, 32768]
    - [361, 90.67]
  - - [8192, 48, 1, 32768]
    - [361, 96.55]
  - - [10240, 48, 1, 32768]
    - [391, 99.66]
  - - [12288, 48, 1, 32768]
    - [391, 109.81]
  - - [16384, 48, 1, 32768]
    - [361, 97.52]
  - - [1024, 64, 1, 32768]
    - [380, 55.4]
  - - [1280, 64, 1, 32768]
    - [394, 62.37]
  - - [1536, 64, 1, 32768]
    - [394, 69.73]
  - - [2048, 64, 1, 32768]
    - [395, 78.27]
  - - [2560, 64, 1, 32768]
    - [400, 77.68]
  - - [3072, 64, 1, 32768]
    - [400, 85.62]
  - - [3584, 64, 1, 32768]
    - [396, 88.73]
  - - [4096, 64, 1, 32768]
    - [400, 97.85]
  - - [5120, 64, 1, 32768]
    - [396, 80.18]
  - - [6144, 64, 1, 32768]
    - [396, 92.65]
  - - [7168, 64, 1, 32768]
    - [396, 92.28]
  - - [8192, 64, 1, 32768]
    - [400, 97.42]
  - - [10240, 64, 1, 32768]
    - [392, 95.43]
  - - [12288, 64, 1, 32768]
    - [354, 96.46]
  - - [1024, 80, 1, 32768]
    - [389, 62.15]
  - - [1280, 80, 1, 32768]
    - [389, 66.32]
  - - [1536, 80, 1, 32768]
    - [389, 74.27]
  - - [2048, 80, 1, 32768]
    - [390, 77.64]
  - - [2560, 80, 1, 32768]
    - [391, 81.29]
  - - [3072, 80, 1, 32768]
    - [391, 91.83]
  - - [3584, 80, 1, 32768]
    - [406, 83.29]
  - - [4096, 80, 1, 32768]
    - [398, 87.71]
  - - [5120, 80, 1, 32768]
    - [391, 88.42]
  - - [6144, 80, 1, 32768]
    - [391, 96.59]
  - - [7168, 80, 1, 32768]
    - [374, 102.6]
  - - [8192, 80, 1, 32768]
    - [374, 112.75]
  - - [10240, 80, 1, 32768]
    - [398, 87.93]
  - - [768, 96, 1, 32768]
    - [389, 58.24]
  - - [1024, 96, 1, 32768]
    - [389, 73.88]
  - - [1280, 96, 1, 32768]
    - [389, 78.55]
  - - [1536, 96, 1, 32768]
    - [389, 87.11]
  - - [2048, 96, 1, 32768]
    - [390, 91.22]
  - - [2560, 96, 1, 32768]
    - [391, 95.24]
  - - [3072, 96, 1, 32768]
    - [391, 108.17]
  - - [3584, 96, 1, 32768]
    - [361, 93.44]
  - - [4096, 96, 1, 32768]
    - [361, 103.97]
  - - [5120, 96, 1, 32768]
    - [391, 103.97]
  - - [6144, 96, 1, 32768]
    - [391, 113.31]
  - - [7168, 96, 1, 32768]
    - [390, 104.17]
  - - [8192, 96, 1, 32768]
    - [361, 103.49]
  - - [640, 112, 1, 32768]
    - [394, 54.92]
  - - [768, 112, 1, 32768]
    - [389, 60.83]
  - - [1024, 112, 1, 32768]
    - [389, 69.36]
  - - [1280, 112, 1, 32768]
    - [390, 70.12]
  - - [1536, 112, 1, 32768]
    - [400, 76.53]
  - - [2048, 112, 1, 32768]
    - [400, 83.42]
  - - [2560, 112, 1, 32768]
    - [361, 77.62]
  - - [3072, 112, 1, 32768]
    - [361, 85.38]
  - - [3584, 112, 1, 32768]
    - [396, 85.41]
  - - [4096, 112, 1, 32768]
    - [391, 94.25]
  - - [5120, 112, 1, 32768]
    - [392, 88.66]
  - - [6144, 112, 1, 32768]
    - [400, 96.4]
  - - [7168, 112, 1, 32768]
    - [354, 91.26]
  - - [512, 128, 1, 32768]
    - [380, 57.78]
  - - [640, 128, 1, 32768]
    - [394, 67.17]
  - - [768, 128, 1, 32768]
    - [389, 71.81]
  - - [1024, 128, 1, 32768]
    - [389, 82.84]
  - - [1280, 128, 1, 32768]
    - [391, 82.17]
  - - [1536, 128, 1, 32768]
    - [400, 90.8]
  - - [2048, 128, 1, 32768]
    - [391, 102.17]
  - - [2560, 128, 1, 32768]
    - [361, 86.02]
  - - [3072, 128, 1, 32768]
    - [396, 101.25]
  - - [3584, 128, 1, 32768]
    - [396, 103.68]
  - - [4096, 128, 1, 32768]
    - [400, 106.1]
  - - [5120, 128, 1, 32768]
    - [392, 102.3]
  - - [6144, 128, 1, 32768]
    - [354, 106.36]
  - - [448, 160, 1, 32768]
    - [407, 58.63]
  - - [512, 160, 1, 32768]
    - [380, 65.51]
  - - [640, 160, 1, 32768]
    - [380, 70.38]
  - - [768, 160, 1, 32768]
    - [389, 75.03]
  - - [1024, 160, 1, 32768]
    - [391, 79.99]
  - - [1280, 160, 1, 32768]
    - [391, 87.48]
  - - [1536, 160, 1, 32768]
    - [391, 94.53]
  - - [2048, 160, 1, 32768]
    - [361, 87.43]
  - - [2560, 160, 1, 32768]
    - [391, 88.36]
  - - [3072, 160, 1, 32768]
    - [400, 96.37]
  - - [3584, 160, 1, 32768]
    - [374, 105.94]
  - - [4096, 160, 1, 32768]
    - [391, 71.11]
  - - [5120, 160, 1, 32768]
    - [398, 88.46]
  - - [384, 192, 1, 32768]
    - [332, 62.85]
  - - [448, 192, 1, 32768]
    - [389, 65.46]
  - - [512, 192, 1, 32768]
    - [380, 75.76]
  - - [640, 192, 1, 32768]
    - [389, 77.96]
  - - [768, 192, 1, 32768]
    - [389, 88.47]
  - - [1024, 192, 1, 32768]
    - [391, 95.28]
  - - [1280, 192, 1, 32768]
    - [391, 103.27]
  - - [1536, 192, 1, 32768]
    - [391, 110.84]
  - - [2048, 192, 1, 32768]
    - [361, 103.29]
  - - [2560, 192, 1, 32768]
    - [391, 102.21]
  - - [3072, 192, 1, 32768]
    - [391, 114.65]
  - - [3584, 192, 1, 32768]
    - [392, 102.21]
  - - [4096, 192, 1, 32768]
    - [361, 110.99]
  - - [320, 224, 1, 32768]
    - [407, 63.02]
  - - [384, 224, 1, 32768]
    - [380, 66.39]
  - - [448, 224, 1, 32768]
    - [389, 68.2]
  - - [512, 224, 1, 32768]
    - [389, 79.95]
  - - [640, 224, 1, 32768]
    - [389, 88.2]
  - - [768, 224, 1, 32768]
    - [390, 84.69]
  - - [1024, 224, 1, 32768]
    - [391, 100.54]
  - - [1280, 224, 1, 32768]
    - [391, 110.57]
  - - [1536, 224, 1, 32768]
    - [361, 95.47]
  - - [2048, 224, 1, 32768]
    - [391, 95.18]
  - - [2560, 224, 1, 32768]
    - [391, 113.09]
  - - [3072, 224, 1, 32768]
    - [374, 116.84]
  - - [3584, 224, 1, 32768]
    - [354, 95.96]
  - - [256, 256, 1, 32768]
    - [380, 58.12]
  - - [320, 256, 1, 32768]
    - [407, 66.11]
  - - [384, 256, 1, 32768]
    - [395, 73.53]
  - - [448, 256, 1, 32768]
    - [395, 74.86]
  - - [512, 256, 1, 32768]
    - [395, 81.01]
  - - [640, 256, 1, 32768]
    - [400, 83.39]
  - - [768, 256, 1, 32768]
    - [400, 93.29]
  - - [1024, 256, 1, 32768]
    - [391, 107.49]
  - - [1280, 256, 1, 32768]
    - [396, 89.65]
  - - [1536, 256, 1, 32768]
    - [396, 103.99]
  - - [2048, 256, 1, 32768]
    - [400, 107.92]
  - - [2560, 256, 1, 32768]
    - [396, 106.12]
  - - [3072, 256, 1, 32768]
    - [354, 110.49]
  - - [224, 320, 1, 32768]
    - [380, 62.02]
  - - [256, 320, 1, 32768]
    - [380, 72.05]
  - - [320, 320, 1, 32768]
    - [381, 73.42]
  - - [384, 320, 1, 32768]
    - [381, 85.1]
  - - [448, 320, 1, 32768]
    - [395, 86.12]
  - - [512, 320, 1, 32768]
    - [391, 90.68]
  - - [640, 320, 1, 32768]
    - [390, 100.29]
  - - [768, 320, 1, 32768]
    - [391, 105.2]
  - - [1024, 320, 1, 32768]
    - [361, 92.1]
  - - [1280, 320, 1, 32768]
    - [361, 105.71]
  - - [1536, 320, 1, 32768]
    - [391, 107.97]
  - - [2048, 320, 1, 32768]
    - [374, 119.98]
  - - [2560, 320, 1, 32768]
    - [354, 105.08]
  - - [192, 384, 1, 32768]
    - [332, 64.93]
  - - [224, 384, 1, 32768]
    - [380, 68.56]
  - - [256, 384, 1, 32768]
    - [380, 80.19]
  - - [320, 384, 1, 32768]
    - [408, 81.46]
  - - [384, 384, 1, 32768]
    - [395, 95.56]
  - - [448, 384, 1, 32768]
    - [390, 93.59]
  - - [512, 384, 1, 32768]
    - [390, 104.9]
  - - [640, 384, 1, 32768]
    - [400, 106.41]
  - - [768, 384, 1, 32768]
    - [400, 120.84]
  - - [1024, 384, 1, 32768]
    - [354, 96.64]
  - - [1280, 384, 1, 32768]
    - [391, 109.36]
  - - [1536, 384, 1, 32768]
    - [391, 118.47]
  - - [2048, 384, 1, 32768]
    - [354, 110.8]
  - - [160, 448, 1, 32768]
    - [407, 64.57]
  - - [192, 448, 1, 32768]
    - [406, 67.52]
  - - [224, 448, 1, 32768]
    - [389, 70.71]
  - - [256, 448, 1, 32768]
    - [389, 84.11]
  - - [320, 448, 1, 32768]
    - [390, 78.46]
  - - [384, 448, 1, 32768]
    - [390, 93.92]
  - - [448, 448, 1, 32768]
    - [391, 98.6]
  - - [512, 448, 1, 32768]
    - [391, 112.84]
  - - [640, 448, 1, 32768]
    - [395, 95.68]
  - - [768, 448, 1, 32768]
    - [361, 100.38]
  - - [1024, 448, 1, 32768]
    - [391, 112.64]
  - - [1280, 448, 1, 32768]
    - [391, 111.92]
  - - [1536, 448, 1, 32768]
    - [374, 121.27]
  - - [128, 512, 1, 32768]
    - [380, 54.77]
  - - [160, 512, 1, 32768]
    - [407, 66.19]
  - - [192, 512, 1, 32768]
    - [395, 74.3]
  - - [224, 512, 1, 32768]
    - [395, 72.86]
  - - [256, 512, 1, 32768]
    - [389, 84.11]
  - - [320, 512, 1, 32768]
    - [396, 85.18]
  - - [384, 512, 1, 32768]
    - [400, 103.17]
  - - [448, 512, 1, 32768]
    - [391, 101.71]
  - - [512, 512, 1, 32768]
    - [391, 119.5]
  - - [640, 512, 1, 32768]
    - [351, 94.45]
  - - [768, 512, 1, 32768]
    - [396, 108.35]
  - - [1024, 512, 1, 32768]
    - [391, 119.28]
  - - [1280, 512, 1, 32768]
    - [392, 111.59]
  - - [1536, 512, 1, 32768]
    - [354, 119.84]
  - - [112, 640, 1, 32768]
    - [394, 58.33]
  - - [128, 640, 1, 32768]
    - [394, 67.77]
  - - [160, 640, 1, 32768]
    - [395, 74.46]
  - - [192, 640, 1, 32768]
    - [381, 82.21]
  - - [224, 640, 1, 32768]
    - [390, 80.44]
  - - [256, 640, 1, 32768]
    - [390, 90.85]
  - - [320, 640, 1, 32768]
    - [400, 98.18]
  - - [384, 640, 1, 32768]
    - [400, 117.55]
  - - [448, 640, 1, 32768]
    - [395, 99.19]
  - - [512, 640, 1, 32768]
    - [361, 104.72]
  - - [640, 640, 1, 32768]
    - [361, 106.27]
  - - [768, 640, 1, 32768]
    - [400, 117.43]
  - - [1024, 640, 1, 32768]
    - [374, 123.89]
  - - [1280, 640, 1, 32768]
    - [354, 116.07]
  - - [96, 768, 1, 32768]
    - [394, 56.42]
  - - [112, 768, 1, 32768]
    - [394, 62.51]
  - - [128, 768, 1, 32768]
    - [380, 72.34]
  - - [160, 768, 1, 32768]
    - [395, 81.04]
  - - [192, 768, 1, 32768]
    - [395, 97.55]
  - - [224, 768, 1, 32768]
    - [396, 83.64]
  - - [256, 768, 1, 32768]
    - [391, 98.11]
  - - [320, 768, 1, 32768]
    - [400, 109.01]
  - - [384, 768, 1, 32768]
    - [400, 132.67]
  - - [448, 768, 1, 32768]
    - [396, 95.97]
  - - [512, 768, 1, 32768]
    - [396, 100.74]
  - - [640, 768, 1, 32768]
    - [400, 114.41]
  - - [768, 768, 1, 32768]
    - [400, 129.29]
  - - [1024, 768, 1, 32768]
    - [354, 108.16]
  - - [64, 1024, 1, 32768]
    - [394, 53.84]
  - - [80, 1024, 1, 32768]
    - [395, 59.31]
  - - [96, 1024, 1, 32768]
    - [395, 71.99]
  - - [112, 1024, 1, 32768]
    - [389, 65.5]
  - - [128, 1024, 1, 32768]
    - [389, 77.67]
  - - [160, 1024, 1, 32768]
    - [396, 85.77]
  - - [192, 1024, 1, 32768]
    - [396, 100.99]
  - - [224, 1024, 1, 32768]
    - [391, 97.35]
  - - [256, 1024, 1, 32768]
    - [391, 113.08]
  - - [320, 1024, 1, 32768]
    - [396, 99.76]
  - - [384, 1024, 1, 32768]
    - [396, 114.4]
  - - [448, 1024, 1, 32768]
    - [391, 109.32]
  - - [512, 1024, 1, 32768]
    - [391, 125.38]
  - - [640, 1024, 1, 32768]
    - [392, 131.99]
  - - [768, 1024, 1, 32768]
    - [354, 120.28]
  - - [64, 1280, 1, 32768]
    - [394, 61.28]
  - - [80, 1280, 1, 32768]
    - [395, 68.67]
  - - [96, 1280, 1, 32768]
    - [395, 81.99]
  - - [112, 1280, 1, 32768]
    - [400, 70.57]
  - - [128, 1280, 1, 32768]
    - [390, 78.36]
  - - [160, 1280, 1, 32768]
    - [400, 92.45]
  - - [192, 1280, 1, 32768]
    - [400, 115.04]
  - - [224, 1280, 1, 32768]
    - [396, 83.14]
  - - [256, 1280, 1, 32768]
    - [396, 91.79]
  - - [320, 1280, 1, 32768]
    - [400, 104.35]
  - - [384, 1280, 1, 32768]
    - [400, 124.72]
  - - [448, 1280, 1, 32768]
    - [392, 113.27]
  - - [512, 1280, 1, 32768]
    - [374, 114.4]
  - - [640, 1280, 1, 32768]
    - [354, 114.19]
  - - [48, 1536, 1, 32768]
    - [402, 46.74]
  - - [64, 1536, 1, 32768]
    - [394, 66.67]
  - - [80, 1536, 1, 32768]
    - [395, 75.02]
  - - [96, 1536, 1, 32768]
    - [395, 90.56]
  - - [112, 1536, 1, 32768]
    - [390, 73.73]
  - - [128, 1536, 1, 32768]
    - [390, 85.39]
  - - [160, 1536, 1, 32768]
    - [400, 100.38]
  - - [192, 1536, 1, 32768]
    - [400, 128.01]
  - - [224, 1536, 1, 32768]
    - [396, 91.83]
  - - [256, 1536, 1, 32768]
    - [390, 98.7]
  - - [320, 1536, 1, 32768]
    - [400, 117.94]
  - - [384, 1536, 1, 32768]
    - [400, 140.63]
  - - [448, 1536, 1, 32768]
    - [392, 125.97]
  - - [512, 1536, 1, 32768]
    - [361, 103.55]
  - - [32, 2048, 1, 32768]
    - [402, 43.59]
  - - [48, 2048, 1, 32768]
    - [396, 49.0]
  - - [64, 2048, 1, 32768]
    - [396, 64.43]
  - - [80, 2048, 1, 32768]
    - [396, 78.6]
  - - [96, 2048, 1, 32768]
    - [396, 91.58]
  - - [112, 2048, 1, 32768]
    - [389, 72.56]
  - - [128, 2048, 1, 32768]
    - [389, 84.79]
  - - [160, 2048, 1, 32768]
    - [354, 93.06]
  - - [192, 2048, 1, 32768]
    - [396, 112.42]
  - - [224, 2048, 1, 32768]
    - [391, 100.42]
  - - [256, 2048, 1, 32768]
    - [391, 120.78]
  - - [320, 2048, 1, 32768]
    - [392, 130.36]
  - - [384, 2048, 1, 32768]
    - [354, 129.75]
  - - [32, 2560, 1, 32768]
    - [402, 47.86]
  - - [48, 2560, 1, 32768]
    - [394, 49.32]
  - - [64, 2560, 1, 32768]
    - [394, 67.02]
  - - [80, 2560, 1, 32768]
    - [395, 73.13]
  - - [96, 2560, 1, 32768]
    - [395, 92.24]
  - - [112, 2560, 1, 32768]
    - [390, 73.08]
  - - [128, 2560, 1, 32768]
    - [390, 85.79]
  - - [160, 2560, 1, 32768]
    - [400, 95.77]
  - - [192, 2560, 1, 32768]
    - [400, 119.98]
  - - [224, 2560, 1, 32768]
    - [374, 97.12]
  - - [256, 2560, 1, 32768]
    - [374, 111.55]
  - - [320, 2560, 1, 32768]
    - [396, 102.3]
  - - [32, 3072, 1, 32768]
    - [402, 50.63]
  - - [48, 3072, 1, 32768]
    - [394, 54.27]
  - - [64, 3072, 1, 32768]
    - [394, 72.55]
  - - [80, 3072, 1, 32768]
    - [395, 80.99]
  - - [96, 3072, 1, 32768]
    - [395, 102.5]
  - - [112, 3072, 1, 32768]
    - [390, 80.93]
  - - [128, 3072, 1, 32768]
    - [390, 96.47]
  - - [160, 3072, 1, 32768]
    - [400, 107.19]
  - - [192, 3072, 1, 32768]
    - [400, 130.85]
  - - [224, 3072, 1, 32768]
    - [391, 101.28]
  - - [256, 3072, 1, 32768]
    - [354, 105.8]
  - - [32, 3584, 1, 32768]
    - [401, 46.57]
  - - [48, 3584, 1, 32768]
    - [354, 50.4]
  - - [64, 3584, 1, 32768]
    - [354, 66.62]
  - - [80, 3584, 1, 32768]
    - [354, 79.84]
  - - [96, 3584, 1, 32768]
    - [396, 93.84]
  - - [112, 3584, 1, 32768]
    - [390, 88.51]
  - - [128, 3584, 1, 32768]
    - [390, 98.51]
  - - [160, 3584, 1, 32768]
    - [392, 112.64]
  - - [192, 3584, 1, 32768]
    - [396, 126.71]
  - - [224, 3584, 1, 32768]
    - [361, 95.0]
  - - [16, 4096, 1, 32768]
    - [359, 23.13]
  - - [32, 4096, 1, 32768]
    - [359, 46.0]
  - - [48, 4096, 1, 32768]
    - [396, 53.86]
  - - [64, 4096, 1, 32768]
    - [354, 70.88]
  - - [80, 4096, 1, 32768]
    - [354, 86.67]
  - - [96, 4096, 1, 32768]
    - [396, 99.58]
  - - [112, 4096, 1, 32768]
    - [392, 87.12]
  - - [128, 4096, 1, 32768]
    - [392, 98.17]
  - - [160, 4096, 1, 32768]
    - [392, 120.71]
  - - [192, 4096, 1, 32768]
    - [354, 124.48]
  - - [16, 5120, 1, 32768]
    - [402, 23.85]
  - - [32, 5120, 1, 32768]
    - [402, 47.18]
  - - [48, 5120, 1, 32768]
    - [394, 51.76]
  - - [64, 5120, 1, 32768]
    - [394, 71.12]
  - - [80, 5120, 1, 32768]
    - [395, 76.87]
  - - [96, 5120, 1, 32768]
    - [395, 96.55]
  - - [112, 5120, 1, 32768]
    - [374, 88.39]
  - - [128, 5120, 1, 32768]
    - [374, 101.68]
  - - [160, 5120, 1, 32768]
    - [396, 96.83]
  - - [16, 6144, 1, 32768]
    - [402, 25.18]
  - - [32, 6144, 1, 32768]
    - [402, 49.96]
  - - [48, 6144, 1, 32768]
    - [394, 54.43]
  - - [64, 6144, 1, 32768]
    - [394, 74.65]
  - - [80, 6144, 1, 32768]
    - [396, 85.33]
  - - [96, 6144, 1, 32768]
    - [395, 99.47]
  - - [112, 6144, 1, 32768]
    - [390, 83.54]
  - - [128, 6144, 1, 32768]
    - [390, 96.19]
  - - [16, 7168, 1, 32768]
    - [369, 24.08]
  - - [32, 7168, 1, 32768]
    - [369, 48.16]
  - - [48, 7168, 1, 32768]
    - [396, 55.1]
  - - [64, 7168, 1, 32768]
    - [396, 73.76]
  - - [80, 7168, 1, 32768]
    - [396, 90.38]
  - - [96, 7168, 1, 32768]
    - [396, 109.0]
  - - [112, 7168, 1, 32768]
    - [390, 87.21]
  - - [16, 8192, 1, 32768]
    - [359, 24.57]
  - - [32, 8192, 1, 32768]
    - [359, 48.38]
  - - [48, 8192, 1, 32768]
    - [396, 54.74]
  - - [64, 8192, 1, 32768]
    - [354, 73.0]
  - - [80, 8192, 1, 32768]
    - [354, 84.97]
  - - [96, 8192, 1, 32768]
    - [354, 108.05]
  - - [16, 10240, 1, 32768]
    - [401, 23.75]
  - - [32, 10240, 1, 32768]
    - [401, 46.68]
  - - [48, 10240, 1, 32768]
    - [395, 54.19]
  - - [64, 10240, 1, 32768]
    - [394, 72.86]
  - - [80, 10240, 1, 32768]
    - [396, 82.97]
  - - [16, 12288, 1, 32768]
    - [359, 23.94]
  - - [32, 12288, 1, 32768]
    - [402, 49.98]
  - - [48, 12288, 1, 32768]
    - [394, 56.2]
  - - [64, 12288, 1, 32768]
    - [354, 72.83]
  - - [16, 16384, 1, 32768]
    - [359, 24.86]
  - - [32, 16384, 1, 32768]
    - [359, 49.06]
  - - [48, 16384, 1, 32768]
    - [396, 56.69]
  - - [16, 20480, 1, 32768]
    - [402, 24.65]
  - - [32, 20480, 1, 32768]
    - [402, 48.73]
  - - [16, 24576, 1, 32768]
    - [402, 25.21]
  - - [32, 24576, 1, 32768]
    - [359, 48.32]
  - - [16, 32768, 1, 32768]
    - [359, 26.16]
  - - [16, 40960, 1, 32768]
    - [359, 25.7]
  - - [16, 49152, 1, 32768]
    - [359, 25.67]
  - - [32768, 16, 1, 2048]
    - [386, 33.62]
  - - [40960, 16, 1, 2048]
    - [379, 40.01]
  - - [49152, 16, 1, 2048]
    - [379, 38.38]
  - - [65536, 16, 1, 2048]
    - [379, 45.49]
  - - [131072, 16, 1, 2048]
    - [379, 48.23]
  - - [16384, 32, 1, 2048]
    - [409, 47.83]
  - - [20480, 32, 1, 2048]
    - [386, 54.91]
  - - [24576, 32, 1, 2048]
    - [386, 60.53]
  - - [32768, 32, 1, 2048]
    - [386, 67.86]
  - - [40960, 32, 1, 2048]
    - [387, 69.76]
  - - [49152, 32, 1, 2048]
    - [410, 64.21]
  - - [65536, 32, 1, 2048]
    - [386, 74.88]
  - - [131072, 32, 1, 2048]
    - [386, 78.81]
  - - [12288, 48, 1, 2048]
    - [411, 51.33]
  - - [16384, 48, 1, 2048]
    - [393, 62.7]
  - - [20480, 48, 1, 2048]
    - [393, 71.03]
  - - [24576, 48, 1, 2048]
    - [393, 79.89]
  - - [32768, 48, 1, 2048]
    - [393, 88.52]
  - - [40960, 48, 1, 2048]
    - [410, 90.43]
  - - [49152, 48, 1, 2048]
    - [410, 94.36]
  - - [65536, 48, 1, 2048]
    - [412, 103.79]
  - - [131072, 48, 1, 2048]
    - [412, 106.04]
  - - [8192, 64, 1, 2048]
    - [413, 51.72]
  - - [10240, 64, 1, 2048]
    - [414, 55.35]
  - - [12288, 64, 1, 2048]
    - [414, 63.46]
  - - [16384, 64, 1, 2048]
    - [414, 74.95]
  - - [20480, 64, 1, 2048]
    - [415, 75.55]
  - - [24576, 64, 1, 2048]
    - [416, 74.18]
  - - [32768, 64, 1, 2048]
    - [417, 84.55]
  - - [40960, 64, 1, 2048]
    - [418, 85.87]
  - - [49152, 64, 1, 2048]
    - [416, 89.32]
  - - [65536, 64, 1, 2048]
    - [419, 102.3]
  - - [131072, 64, 1, 2048]
    - [416, 96.44]
  - - [7168, 80, 1, 2048]
    - [393, 46.36]
  - - [8192, 80, 1, 2048]
    - [420, 43.31]
  - - [10240, 80, 1, 2048]
    - [386, 41.58]
  - - [12288, 80, 1, 2048]
    - [421, 60.9]
  - - [16384, 80, 1, 2048]
    - [421, 70.9]
  - - [20480, 80, 1, 2048]
    - [417, 80.84]
  - - [24576, 80, 1, 2048]
    - [417, 91.4]
  - - [32768, 80, 1, 2048]
    - [417, 105.69]
  - - [40960, 80, 1, 2048]
    - [422, 76.63]
  - - [49152, 80, 1, 2048]
    - [410, 85.69]
  - - [65536, 80, 1, 2048]
    - [417, 107.28]
  - - [131072, 80, 1, 2048]
    - [417, 108.3]
  - - [6144, 96, 1, 2048]
    - [411, 51.23]
  - - [7168, 96, 1, 2048]
    - [411, 56.95]
  - - [8192, 96, 1, 2048]
    - [393, 62.69]
  - - [10240, 96, 1, 2048]
    - [393, 71.28]
  - - [12288, 96, 1, 2048]
    - [393, 79.47]
  - - [16384, 96, 1, 2048]
    - [393, 92.45]
  - - [20480, 96, 1, 2048]
    - [422, 94.68]
  - - [24576, 96, 1, 2048]
    - [422, 104.56]
  - - [32768, 96, 1, 2048]
    - [412, 108.12]
  - - [40960, 96, 1, 2048]
    - [422, 91.68]
  - - [49152, 96, 1, 2048]
    - [410, 102.97]
  - - [65536, 96, 1, 2048]
    - [412, 113.33]
  - - [131072, 96, 1, 2048]
    - [412, 109.13]
  - - [5120, 112, 1, 2048]
    - [386, 47.86]
  - - [6144, 112, 1, 2048]
    - [414, 52.81]
  - - [7168, 112, 1, 2048]
    - [414, 57.52]
  - - [8192, 112, 1, 2048]
    - [393, 62.67]
  - - [10240, 112, 1, 2048]
    - [393, 69.36]
  - - [12288, 112, 1, 2048]
    - [419, 75.91]
  - - [16384, 112, 1, 2048]
    - [419, 89.03]
  - - [20480, 112, 1, 2048]
    - [412, 88.28]
  - - [24576, 112, 1, 2048]
    - [416, 97.55]
  - - [32768, 112, 1, 2048]
    - [419, 91.04]
  - - [40960, 112, 1, 2048]
    - [416, 90.31]
  - - [49152, 112, 1, 2048]
    - [416, 101.31]
  - - [65536, 112, 1, 2048]
    - [416, 95.84]
  - - [131072, 112, 1, 2048]
    - [416, 109.43]
  - - [4096, 128, 1, 2048]
    - [409, 53.53]
  - - [5120, 128, 1, 2048]
    - [386, 58.35]
  - - [6144, 128, 1, 2048]
    - [386, 64.98]
  - - [7168, 128, 1, 2048]
    - [414, 72.67]
  - - [8192, 128, 1, 2048]
    - [386, 76.85]
  - - [10240, 128, 1, 2048]
    - [419, 82.09]
  - - [12288, 128, 1, 2048]
    - [393, 94.14]
  - - [16384, 128, 1, 2048]
    - [419, 108.8]
  - - [20480, 128, 1, 2048]
    - [412, 106.03]
  - - [24576, 128, 1, 2048]
    - [416, 120.39]
  - - [32768, 128, 1, 2048]
    - [419, 109.02]
  - - [40960, 128, 1, 2048]
    - [415, 107.79]
  - - [49152, 128, 1, 2048]
    - [416, 118.75]
  - - [65536, 128, 1, 2048]
    - [416, 110.79]
  - - [131072, 128, 1, 2048]
    - [416, 125.69]
  - - [3584, 160, 1, 2048]
    - [409, 51.78]
  - - [4096, 160, 1, 2048]
    - [386, 54.9]
  - - [5120, 160, 1, 2048]
    - [386, 63.59]
  - - [6144, 160, 1, 2048]
    - [386, 68.71]
  - - [7168, 160, 1, 2048]
    - [386, 74.94]
  - - [8192, 160, 1, 2048]
    - [393, 79.15]
  - - [10240, 160, 1, 2048]
    - [419, 83.28]
  - - [12288, 160, 1, 2048]
    - [419, 94.24]
  - - [16384, 160, 1, 2048]
    - [417, 110.5]
  - - [20480, 160, 1, 2048]
    - [419, 85.99]
  - - [24576, 160, 1, 2048]
    - [419, 95.46]
  - - [32768, 160, 1, 2048]
    - [417, 110.6]
  - - [40960, 160, 1, 2048]
    - [422, 94.52]
  - - [49152, 160, 1, 2048]
    - [417, 112.48]
  - - [65536, 160, 1, 2048]
    - [417, 113.96]
  - - [131072, 160, 1, 2048]
    - [417, 115.89]
  - - [3072, 192, 1, 2048]
    - [413, 55.8]
  - - [3584, 192, 1, 2048]
    - [411, 58.21]
  - - [4096, 192, 1, 2048]
    - [411, 63.58]
  - - [5120, 192, 1, 2048]
    - [414, 73.81]
  - - [6144, 192, 1, 2048]
    - [393, 82.43]
  - - [7168, 192, 1, 2048]
    - [393, 89.07]
  - - [8192, 192, 1, 2048]
    - [393, 94.19]
  - - [10240, 192, 1, 2048]
    - [419, 101.12]
  - - [12288, 192, 1, 2048]
    - [419, 114.23]
  - - [16384, 192, 1, 2048]
    - [412, 119.56]
  - - [20480, 192, 1, 2048]
    - [419, 104.66]
  - - [24576, 192, 1, 2048]
    - [419, 115.79]
  - - [32768, 192, 1, 2048]
    - [416, 118.78]
  - - [40960, 192, 1, 2048]
    - [422, 115.73]
  - - [49152, 192, 1, 2048]
    - [416, 120.9]
  - - [65536, 192, 1, 2048]
    - [416, 123.22]
  - - [131072, 192, 1, 2048]
    - [416, 126.94]
  - - [2560, 224, 1, 2048]
    - [409, 53.74]
  - - [3072, 224, 1, 2048]
    - [393, 56.8]
  - - [3584, 224, 1, 2048]
    - [386, 63.48]
  - - [4096, 224, 1, 2048]
    - [386, 69.55]
  - - [5120, 224, 1, 2048]
    - [393, 78.0]
  - - [6144, 224, 1, 2048]
    - [393, 86.3]
  - - [7168, 224, 1, 2048]
    - [393, 88.45]
  - - [8192, 224, 1, 2048]
    - [412, 86.69]
  - - [10240, 224, 1, 2048]
    - [410, 98.72]
  - - [12288, 224, 1, 2048]
    - [417, 109.49]
  - - [16384, 224, 1, 2048]
    - [419, 95.92]
  - - [20480, 224, 1, 2048]
    - [417, 101.68]
  - - [24576, 224, 1, 2048]
    - [417, 112.16]
  - - [32768, 224, 1, 2048]
    - [417, 106.57]
  - - [40960, 224, 1, 2048]
    - [412, 115.87]
  - - [49152, 224, 1, 2048]
    - [417, 113.03]
  - - [65536, 224, 1, 2048]
    - [412, 114.51]
  - - [131072, 224, 1, 2048]
    - [412, 117.54]
  - - [2048, 256, 1, 2048]
    - [413, 50.62]
  - - [2560, 256, 1, 2048]
    - [414, 55.99]
  - - [3072, 256, 1, 2048]
    - [414, 64.77]
  - - [3584, 256, 1, 2048]
    - [386, 68.65]
  - - [4096, 256, 1, 2048]
    - [414, 79.36]
  - - [5120, 256, 1, 2048]
    - [419, 84.42]
  - - [6144, 256, 1, 2048]
    - [419, 94.35]
  - - [7168, 256, 1, 2048]
    - [419, 103.2]
  - - [8192, 256, 1, 2048]
    - [419, 113.15]
  - - [10240, 256, 1, 2048]
    - [416, 111.95]
  - - [12288, 256, 1, 2048]
    - [416, 125.69]
  - - [16384, 256, 1, 2048]
    - [419, 113.89]
  - - [20480, 256, 1, 2048]
    - [415, 114.22]
  - - [24576, 256, 1, 2048]
    - [416, 128.92]
  - - [32768, 256, 1, 2048]
    - [419, 115.55]
  - - [40960, 256, 1, 2048]
    - [416, 133.67]
  - - [49152, 256, 1, 2048]
    - [416, 127.43]
  - - [65536, 256, 1, 2048]
    - [416, 131.71]
  - - [131072, 256, 1, 2048]
    - [416, 131.29]
  - - [2048, 320, 1, 2048]
    - [386, 58.3]
  - - [2560, 320, 1, 2048]
    - [386, 68.26]
  - - [3072, 320, 1, 2048]
    - [386, 76.16]
  - - [3584, 320, 1, 2048]
    - [393, 81.58]
  - - [4096, 320, 1, 2048]
    - [393, 88.66]
  - - [5120, 320, 1, 2048]
    - [393, 98.92]
  - - [6144, 320, 1, 2048]
    - [419, 103.86]
  - - [7168, 320, 1, 2048]
    - [419, 113.08]
  - - [8192, 320, 1, 2048]
    - [417, 113.08]
  - - [10240, 320, 1, 2048]
    - [412, 122.48]
  - - [12288, 320, 1, 2048]
    - [419, 106.1]
  - - [16384, 320, 1, 2048]
    - [417, 117.34]
  - - [20480, 320, 1, 2048]
    - [416, 123.53]
  - - [24576, 320, 1, 2048]
    - [417, 118.49]
  - - [32768, 320, 1, 2048]
    - [416, 130.0]
  - - [40960, 320, 1, 2048]
    - [416, 126.13]
  - - [49152, 320, 1, 2048]
    - [416, 123.92]
  - - [65536, 320, 1, 2048]
    - [416, 132.91]
  - - [131072, 320, 1, 2048]
    - [416, 130.63]
  - - [1536, 384, 1, 2048]
    - [409, 58.06]
  - - [2048, 384, 1, 2048]
    - [386, 67.71]
  - - [2560, 384, 1, 2048]
    - [386, 81.04]
  - - [3072, 384, 1, 2048]
    - [386, 89.08]
  - - [3584, 384, 1, 2048]
    - [393, 91.2]
  - - [4096, 384, 1, 2048]
    - [393, 98.84]
  - - [5120, 384, 1, 2048]
    - [419, 107.01]
  - - [6144, 384, 1, 2048]
    - [419, 120.02]
  - - [7168, 384, 1, 2048]
    - [412, 119.66]
  - - [8192, 384, 1, 2048]
    - [412, 126.9]
  - - [10240, 384, 1, 2048]
    - [419, 109.65]
  - - [12288, 384, 1, 2048]
    - [419, 123.17]
  - - [16384, 384, 1, 2048]
    - [416, 128.88]
  - - [20480, 384, 1, 2048]
    - [422, 122.65]
  - - [24576, 384, 1, 2048]
    - [416, 130.3]
  - - [32768, 384, 1, 2048]
    - [416, 127.92]
  - - [40960, 384, 1, 2048]
    - [416, 129.04]
  - - [49152, 384, 1, 2048]
    - [416, 129.78]
  - - [65536, 384, 1, 2048]
    - [416, 138.07]
  - - [131072, 384, 1, 2048]
    - [416, 133.53]
  - - [1280, 448, 1, 2048]
    - [409, 57.09]
  - - [1536, 448, 1, 2048]
    - [386, 61.26]
  - - [2048, 448, 1, 2048]
    - [393, 71.24]
  - - [2560, 448, 1, 2048]
    - [386, 87.76]
  - - [3072, 448, 1, 2048]
    - [393, 93.13]
  - - [3584, 448, 1, 2048]
    - [393, 99.81]
  - - [4096, 448, 1, 2048]
    - [419, 102.79]
  - - [5120, 448, 1, 2048]
    - [419, 114.23]
  - - [6144, 448, 1, 2048]
    - [412, 117.83]
  - - [7168, 448, 1, 2048]
    - [412, 130.27]
  - - [8192, 448, 1, 2048]
    - [416, 128.85]
  - - [10240, 448, 1, 2048]
    - [419, 118.0]
  - - [12288, 448, 1, 2048]
    - [415, 118.88]
  - - [16384, 448, 1, 2048]
    - [416, 135.45]
  - - [20480, 448, 1, 2048]
    - [412, 123.09]
  - - [24576, 448, 1, 2048]
    - [416, 136.45]
  - - [32768, 448, 1, 2048]
    - [416, 134.96]
  - - [40960, 448, 1, 2048]
    - [416, 136.0]
  - - [49152, 448, 1, 2048]
    - [416, 136.4]
  - - [65536, 448, 1, 2048]
    - [416, 138.17]
  - - [131072, 448, 1, 2048]
    - [416, 131.99]
  - - [1024, 512, 1, 2048]
    - [409, 50.53]
  - - [1280, 512, 1, 2048]
    - [386, 54.46]
  - - [1536, 512, 1, 2048]
    - [386, 66.3]
  - - [2048, 512, 1, 2048]
    - [386, 81.38]
  - - [2560, 512, 1, 2048]
    - [393, 85.14]
  - - [3072, 512, 1, 2048]
    - [419, 97.41]
  - - [3584, 512, 1, 2048]
    - [419, 104.44]
  - - [4096, 512, 1, 2048]
    - [419, 113.09]
  - - [5120, 512, 1, 2048]
    - [412, 118.83]
  - - [6144, 512, 1, 2048]
    - [412, 131.11]
  - - [7168, 512, 1, 2048]
    - [416, 138.1]
  - - [8192, 512, 1, 2048]
    - [419, 114.85]
  - - [10240, 512, 1, 2048]
    - [415, 120.73]
  - - [12288, 512, 1, 2048]
    - [416, 131.07]
  - - [16384, 512, 1, 2048]
    - [415, 123.0]
  - - [20480, 512, 1, 2048]
    - [416, 136.56]
  - - [24576, 512, 1, 2048]
    - [416, 136.51]
  - - [32768, 512, 1, 2048]
    - [416, 134.33]
  - - [40960, 512, 1, 2048]
    - [416, 137.45]
  - - [49152, 512, 1, 2048]
    - [416, 140.25]
  - - [65536, 512, 1, 2048]
    - [416, 142.18]
  - - [1024, 640, 1, 2048]
    - [414, 56.61]
  - - [1280, 640, 1, 2048]
    - [386, 72.13]
  - - [1536, 640, 1, 2048]
    - [386, 81.81]
  - - [2048, 640, 1, 2048]
    - [393, 93.04]
  - - [2560, 640, 1, 2048]
    - [393, 107.43]
  - - [3072, 640, 1, 2048]
    - [419, 111.03]
  - - [3584, 640, 1, 2048]
    - [419, 122.68]
  - - [4096, 640, 1, 2048]
    - [412, 126.36]
  - - [5120, 640, 1, 2048]
    - [412, 141.81]
  - - [6144, 640, 1, 2048]
    - [419, 111.56]
  - - [7168, 640, 1, 2048]
    - [419, 123.42]
  - - [8192, 640, 1, 2048]
    - [422, 122.18]
  - - [10240, 640, 1, 2048]
    - [416, 135.09]
  - - [12288, 640, 1, 2048]
    - [422, 125.18]
  - - [16384, 640, 1, 2048]
    - [416, 141.55]
  - - [20480, 640, 1, 2048]
    - [416, 136.45]
  - - [24576, 640, 1, 2048]
    - [416, 137.15]
  - - [32768, 640, 1, 2048]
    - [416, 142.5]
  - - [40960, 640, 1, 2048]
    - [416, 136.74]
  - - [49152, 640, 1, 2048]
    - [416, 146.05]
  - - [65536, 640, 1, 2048]
    - [416, 142.36]
  - - [768, 768, 1, 2048]
    - [413, 58.63]
  - - [1024, 768, 1, 2048]
    - [386, 66.57]
  - - [1280, 768, 1, 2048]
    - [414, 76.62]
  - - [1536, 768, 1, 2048]
    - [414, 86.16]
  - - [2048, 768, 1, 2048]
    - [419, 98.79]
  - - [2560, 768, 1, 2048]
    - [419, 113.24]
  - - [3072, 768, 1, 2048]
    - [419, 127.89]
  - - [3584, 768, 1, 2048]
    - [412, 128.95]
  - - [4096, 768, 1, 2048]
    - [412, 133.65]
  - - [5120, 768, 1, 2048]
    - [419, 111.29]
  - - [6144, 768, 1, 2048]
    - [419, 126.37]
  - - [7168, 768, 1, 2048]
    - [422, 126.13]
  - - [8192, 768, 1, 2048]
    - [416, 127.47]
  - - [10240, 768, 1, 2048]
    - [422, 126.74]
  - - [12288, 768, 1, 2048]
    - [416, 137.28]
  - - [16384, 768, 1, 2048]
    - [416, 135.56]
  - - [20480, 768, 1, 2048]
    - [416, 134.93]
  - - [24576, 768, 1, 2048]
    - [416, 138.28]
  - - [32768, 768, 1, 2048]
    - [416, 144.23]
  - - [40960, 768, 1, 2048]
    - [416, 141.75]
  - - [49152, 768, 1, 2048]
    - [416, 145.4]
  - - [65536, 768, 1, 2048]
    - [416, 143.6]
  - - [512, 1024, 1, 2048]
    - [413, 53.15]
  - - [640, 1024, 1, 2048]
    - [420, 55.34]
  - - [768, 1024, 1, 2048]
    - [414, 64.41]
  - - [1024, 1024, 1, 2048]
    - [386, 81.07]
  - - [1280, 1024, 1, 2048]
    - [393, 88.65]
  - - [1536, 1024, 1, 2048]
    - [415, 100.53]
  - - [2048, 1024, 1, 2048]
    - [419, 120.82]
  - - [2560, 1024, 1, 2048]
    - [412, 126.61]
  - - [3072, 1024, 1, 2048]
    - [412, 140.87]
  - - [3584, 1024, 1, 2048]
    - [416, 140.39]
  - - [4096, 1024, 1, 2048]
    - [419, 123.26]
  - - [5120, 1024, 1, 2048]
    - [415, 125.71]
  - - [6144, 1024, 1, 2048]
    - [416, 138.22]
  - - [7168, 1024, 1, 2048]
    - [416, 144.03]
  - - [8192, 1024, 1, 2048]
    - [415, 123.56]
  - - [10240, 1024, 1, 2048]
    - [416, 141.49]
  - - [12288, 1024, 1, 2048]
    - [416, 138.05]
  - - [16384, 1024, 1, 2048]
    - [416, 142.64]
  - - [20480, 1024, 1, 2048]
    - [416, 146.44]
  - - [24576, 1024, 1, 2048]
    - [416, 147.26]
  - - [32768, 1024, 1, 2048]
    - [416, 147.79]
  - - [40960, 1024, 1, 2048]
    - [416, 143.86]
  - - [49152, 1024, 1, 2048]
    - [416, 147.32]
  - - [448, 1280, 1, 2048]
    - [409, 57.32]
  - - [512, 1280, 1, 2048]
    - [386, 56.52]
  - - [640, 1280, 1, 2048]
    - [411, 66.11]
  - - [768, 1280, 1, 2048]
    - [386, 78.53]
  - - [1024, 1280, 1, 2048]
    - [393, 89.49]
  - - [1280, 1280, 1, 2048]
    - [393, 104.17]
  - - [1536, 1280, 1, 2048]
    - [419, 117.16]
  - - [2048, 1280, 1, 2048]
    - [412, 128.74]
  - - [2560, 1280, 1, 2048]
    - [412, 147.09]
  - - [3072, 1280, 1, 2048]
    - [419, 121.69]
  - - [3584, 1280, 1, 2048]
    - [419, 129.87]
  - - [4096, 1280, 1, 2048]
    - [412, 125.37]
  - - [5120, 1280, 1, 2048]
    - [412, 140.31]
  - - [6144, 1280, 1, 2048]
    - [422, 126.19]
  - - [7168, 1280, 1, 2048]
    - [416, 133.34]
  - - [8192, 1280, 1, 2048]
    - [416, 143.12]
  - - [10240, 1280, 1, 2048]
    - [416, 139.26]
  - - [12288, 1280, 1, 2048]
    - [416, 138.72]
  - - [16384, 1280, 1, 2048]
    - [416, 144.97]
  - - [20480, 1280, 1, 2048]
    - [416, 142.63]
  - - [24576, 1280, 1, 2048]
    - [416, 145.77]
  - - [32768, 1280, 1, 2048]
    - [416, 145.49]
  - - [40960, 1280, 1, 2048]
    - [416, 148.07]
  - - [49152, 1280, 1, 2048]
    - [416, 148.42]
  - - [384, 1536, 1, 2048]
    - [420, 52.83]
  - - [448, 1536, 1, 2048]
    - [414, 58.73]
  - - [512, 1536, 1, 2048]
    - [386, 66.21]
  - - [640, 1536, 1, 2048]
    - [415, 73.3]
  - - [768, 1536, 1, 2048]
    - [386, 89.83]
  - - [1024, 1536, 1, 2048]
    - [415, 93.78]
  - - [1280, 1536, 1, 2048]
    - [419, 118.03]
  - - [1536, 1536, 1, 2048]
    - [419, 130.71]
  - - [2048, 1536, 1, 2048]
    - [412, 143.34]
  - - [2560, 1536, 1, 2048]
    - [419, 121.6]
  - - [3072, 1536, 1, 2048]
    - [419, 132.74]
  - - [3584, 1536, 1, 2048]
    - [412, 131.22]
  - - [4096, 1536, 1, 2048]
    - [412, 142.5]
  - - [5120, 1536, 1, 2048]
    - [422, 128.39]
  - - [6144, 1536, 1, 2048]
    - [416, 140.9]
  - - [7168, 1536, 1, 2048]
    - [416, 144.99]
  - - [8192, 1536, 1, 2048]
    - [416, 135.78]
  - - [10240, 1536, 1, 2048]
    - [416, 137.08]
  - - [12288, 1536, 1, 2048]
    - [416, 140.66]
  - - [16384, 1536, 1, 2048]
    - [416, 147.92]
  - - [20480, 1536, 1, 2048]
    - [416, 146.69]
  - - [24576, 1536, 1, 2048]
    - [416, 147.68]
  - - [32768, 1536, 1, 2048]
    - [416, 148.08]
  - - [40960, 1536, 1, 2048]
    - [416, 149.55]
  - - [256, 2048, 1, 2048]
    - [413, 52.1]
  - - [320, 2048, 1, 2048]
    - [414, 55.9]
  - - [384, 2048, 1, 2048]
    - [414, 65.04]
  - - [448, 2048, 1, 2048]
    - [414, 73.68]
  - - [512, 2048, 1, 2048]
    - [386, 82.0]
  - - [640, 2048, 1, 2048]
    - [419, 93.56]
  - - [768, 2048, 1, 2048]
    - [415, 101.91]
  - - [1024, 2048, 1, 2048]
    - [419, 121.51]
  - - [1280, 2048, 1, 2048]
    - [412, 128.69]
  - - [1536, 2048, 1, 2048]
    - [412, 145.2]
  - - [2048, 2048, 1, 2048]
    - [419, 128.51]
  - - [2560, 2048, 1, 2048]
    - [412, 128.43]
  - - [3072, 2048, 1, 2048]
    - [416, 145.83]
  - - [3584, 2048, 1, 2048]
    - [412, 155.76]
  - - [4096, 2048, 1, 2048]
    - [416, 134.13]
  - - [5120, 2048, 1, 2048]
    - [416, 149.13]
  - - [6144, 2048, 1, 2048]
    - [416, 143.52]
  - - [7168, 2048, 1, 2048]
    - [416, 147.19]
  - - [8192, 2048, 1, 2048]
    - [416, 142.7]
  - - [10240, 2048, 1, 2048]
    - [416, 146.11]
  - - [12288, 2048, 1, 2048]
    - [416, 150.74]
  - - [16384, 2048, 1, 2048]
    - [416, 146.51]
  - - [20480, 2048, 1, 2048]
    - [416, 149.92]
  - - [24576, 2048, 1, 2048]
    - [416, 150.61]
  - - [224, 2560, 1, 2048]
    - [413, 56.15]
  - - [256, 2560, 1, 2048]
    - [386, 56.08]
  - - [320, 2560, 1, 2048]
    - [386, 65.37]
  - - [384, 2560, 1, 2048]
    - [414, 77.11]
  - - [448, 2560, 1, 2048]
    - [414, 86.35]
  - - [512, 2560, 1, 2048]
    - [419, 79.98]
  - - [640, 2560, 1, 2048]
    - [419, 109.51]
  - - [768, 2560, 1, 2048]
    - [419, 116.25]
  - - [1024, 2560, 1, 2048]
    - [412, 127.68]
  - - [1280, 2560, 1, 2048]
    - [412, 146.61]
  - - [1536, 2560, 1, 2048]
    - [419, 124.26]
  - - [2048, 2560, 1, 2048]
    - [415, 133.54]
  - - [2560, 2560, 1, 2048]
    - [412, 153.03]
  - - [3072, 2560, 1, 2048]
    - [410, 134.14]
  - - [3584, 2560, 1, 2048]
    - [412, 142.85]
  - - [4096, 2560, 1, 2048]
    - [416, 152.4]
  - - [5120, 2560, 1, 2048]
    - [412, 144.1]
  - - [6144, 2560, 1, 2048]
    - [416, 143.49]
  - - [7168, 2560, 1, 2048]
    - [416, 148.17]
  - - [8192, 2560, 1, 2048]
    - [416, 146.21]
  - - [10240, 2560, 1, 2048]
    - [416, 144.19]
  - - [12288, 2560, 1, 2048]
    - [416, 149.33]
  - - [16384, 2560, 1, 2048]
    - [416, 149.33]
  - - [20480, 2560, 1, 2048]
    - [416, 150.37]
  - - [24576, 2560, 1, 2048]
    - [416, 152.3]
  - - [192, 3072, 1, 2048]
    - [413, 56.27]
  - - [224, 3072, 1, 2048]
    - [420, 55.71]
  - - [256, 3072, 1, 2048]
    - [414, 63.52]
  - - [320, 3072, 1, 2048]
    - [414, 76.09]
  - - [384, 3072, 1, 2048]
    - [415, 88.36]
  - - [448, 3072, 1, 2048]
    - [415, 93.38]
  - - [512, 3072, 1, 2048]
    - [419, 100.55]
  - - [640, 3072, 1, 2048]
    - [423, 103.61]
  - - [768, 3072, 1, 2048]
    - [419, 131.96]
  - - [1024, 3072, 1, 2048]
    - [412, 143.38]
  - - [1280, 3072, 1, 2048]
    - [419, 125.78]
  - - [1536, 3072, 1, 2048]
    - [419, 141.77]
  - - [2048, 3072, 1, 2048]
    - [412, 147.0]
  - - [2560, 3072, 1, 2048]
    - [410, 130.49]
  - - [3072, 3072, 1, 2048]
    - [416, 149.15]
  - - [3584, 3072, 1, 2048]
    - [412, 158.93]
  - - [4096, 3072, 1, 2048]
    - [416, 145.38]
  - - [5120, 3072, 1, 2048]
    - [412, 144.14]
  - - [6144, 3072, 1, 2048]
    - [416, 144.85]
  - - [7168, 3072, 1, 2048]
    - [416, 147.5]
  - - [8192, 3072, 1, 2048]
    - [416, 148.23]
  - - [10240, 3072, 1, 2048]
    - [416, 147.75]
  - - [12288, 3072, 1, 2048]
    - [416, 149.47]
  - - [16384, 3072, 1, 2048]
    - [416, 152.63]
  - - [20480, 3072, 1, 2048]
    - [416, 151.92]
  - - [160, 3584, 1, 2048]
    - [413, 46.98]
  - - [192, 3584, 1, 2048]
    - [414, 57.8]
  - - [224, 3584, 1, 2048]
    - [386, 60.39]
  - - [256, 3584, 1, 2048]
    - [414, 70.78]
  - - [320, 3584, 1, 2048]
    - [415, 81.23]
  - - [384, 3584, 1, 2048]
    - [415, 99.64]
  - - [448, 3584, 1, 2048]
    - [415, 101.56]
  - - [512, 3584, 1, 2048]
    - [419, 111.58]
  - - [640, 3584, 1, 2048]
    - [419, 136.07]
  - - [768, 3584, 1, 2048]
    - [412, 132.34]
  - - [1024, 3584, 1, 2048]
    - [412, 156.77]
  - - [1280, 3584, 1, 2048]
    - [419, 139.89]
  - - [1536, 3584, 1, 2048]
    - [415, 142.78]
  - - [2048, 3584, 1, 2048]
    - [412, 160.69]
  - - [2560, 3584, 1, 2048]
    - [412, 148.19]
  - - [3072, 3584, 1, 2048]
    - [416, 163.41]
  - - [3584, 3584, 1, 2048]
    - [412, 149.92]
  - - [4096, 3584, 1, 2048]
    - [412, 157.88]
  - - [5120, 3584, 1, 2048]
    - [416, 158.28]
  - - [6144, 3584, 1, 2048]
    - [416, 157.76]
  - - [7168, 3584, 1, 2048]
    - [416, 147.97]
  - - [8192, 3584, 1, 2048]
    - [416, 149.38]
  - - [10240, 3584, 1, 2048]
    - [416, 150.62]
  - - [12288, 3584, 1, 2048]
    - [416, 153.6]
  - - [16384, 3584, 1, 2048]
    - [416, 153.52]
  - - [128, 4096, 1, 2048]
    - [413, 51.16]
  - - [160, 4096, 1, 2048]
    - [424, 49.18]
  - - [192, 4096, 1, 2048]
    - [415, 63.74]
  - - [224, 4096, 1, 2048]
    - [386, 67.27]
  - - [256, 4096, 1, 2048]
    - [386, 80.5]
  - - [320, 4096, 1, 2048]
    - [415, 89.4]
  - - [384, 4096, 1, 2048]
    - [415, 108.75]
  - - [448, 4096, 1, 2048]
    - [416, 95.27]
  - - [512, 4096, 1, 2048]
    - [419, 122.58]
  - - [640, 4096, 1, 2048]
    - [423, 128.26]
  - - [768, 4096, 1, 2048]
    - [416, 140.13]
  - - [1024, 4096, 1, 2048]
    - [419, 130.99]
  - - [1280, 4096, 1, 2048]
    - [415, 135.49]
  - - [1536, 4096, 1, 2048]
    - [412, 151.01]
  - - [2048, 4096, 1, 2048]
    - [415, 136.72]
  - - [2560, 4096, 1, 2048]
    - [412, 159.88]
  - - [3072, 4096, 1, 2048]
    - [412, 151.16]
  - - [3584, 4096, 1, 2048]
    - [412, 163.97]
  - - [4096, 4096, 1, 2048]
    - [416, 155.52]
  - - [5120, 4096, 1, 2048]
    - [416, 153.98]
  - - [6144, 4096, 1, 2048]
    - [416, 154.19]
  - - [7168, 4096, 1, 2048]
    - [416, 148.06]
  - - [8192, 4096, 1, 2048]
    - [416, 145.76]
  - - [10240, 4096, 1, 2048]
    - [416, 148.97]
  - - [12288, 4096, 1, 2048]
    - [416, 152.67]
  - - [112, 5120, 1, 2048]
    - [414, 44.47]
  - - [128, 5120, 1, 2048]
    - [386, 52.27]
  - - [160, 5120, 1, 2048]
    - [425, 57.08]
  - - [192, 5120, 1, 2048]
    - [415, 75.82]
  - - [224, 5120, 1, 2048]
    - [415, 79.68]
  - - [256, 5120, 1, 2048]
    - [393, 81.29]
  - - [320, 5120, 1, 2048]
    - [423, 90.29]
  - - [384, 5120, 1, 2048]
    - [419, 121.79]
  - - [448, 5120, 1, 2048]
    - [416, 110.65]
  - - [512, 5120, 1, 2048]
    - [412, 123.77]
  - - [640, 5120, 1, 2048]
    - [415, 120.45]
  - - [768, 5120, 1, 2048]
    - [419, 122.82]
  - - [1024, 5120, 1, 2048]
    - [415, 131.43]
  - - [1280, 5120, 1, 2048]
    - [412, 152.45]
  - - [1536, 5120, 1, 2048]
    - [410, 136.46]
  - - [2048, 5120, 1, 2048]
    - [412, 156.42]
  - - [2560, 5120, 1, 2048]
    - [412, 157.18]
  - - [3072, 5120, 1, 2048]
    - [416, 152.79]
  - - [3584, 5120, 1, 2048]
    - [416, 159.78]
  - - [4096, 5120, 1, 2048]
    - [416, 159.82]
  - - [5120, 5120, 1, 2048]
    - [416, 148.09]
  - - [6144, 5120, 1, 2048]
    - [416, 153.16]
  - - [7168, 5120, 1, 2048]
    - [416, 148.02]
  - - [8192, 5120, 1, 2048]
    - [416, 148.81]
  - - [10240, 5120, 1, 2048]
    - [416, 149.9]
  - - [12288, 5120, 1, 2048]
    - [416, 154.88]
  - - [96, 6144, 1, 2048]
    - [415, 47.8]
  - - [112, 6144, 1, 2048]
    - [414, 51.09]
  - - [128, 6144, 1, 2048]
    - [386, 59.63]
  - - [160, 6144, 1, 2048]
    - [415, 68.19]
  - - [192, 6144, 1, 2048]
    - [414, 85.2]
  - - [224, 6144, 1, 2048]
    - [419, 84.34]
  - - [256, 6144, 1, 2048]
    - [415, 89.25]
  - - [320, 6144, 1, 2048]
    - [419, 104.53]
  - - [384, 6144, 1, 2048]
    - [419, 131.66]
  - - [448, 6144, 1, 2048]
    - [412, 114.11]
  - - [512, 6144, 1, 2048]
    - [412, 136.9]
  - - [640, 6144, 1, 2048]
    - [419, 111.92]
  - - [768, 6144, 1, 2048]
    - [415, 128.04]
  - - [1024, 6144, 1, 2048]
    - [412, 148.39]
  - - [1280, 6144, 1, 2048]
    - [422, 133.3]
  - - [1536, 6144, 1, 2048]
    - [412, 154.36]
  - - [2048, 6144, 1, 2048]
    - [412, 151.81]
  - - [2560, 6144, 1, 2048]
    - [412, 154.13]
  - - [3072, 6144, 1, 2048]
    - [416, 152.63]
  - - [3584, 6144, 1, 2048]
    - [412, 158.87]
  - - [4096, 6144, 1, 2048]
    - [416, 163.24]
  - - [5120, 6144, 1, 2048]
    - [412, 153.9]
  - - [6144, 6144, 1, 2048]
    - [416, 151.84]
  - - [7168, 6144, 1, 2048]
    - [416, 147.18]
  - - [8192, 6144, 1, 2048]
    - [416, 150.96]
  - - [10240, 6144, 1, 2048]
    - [416, 149.87]
  - - [80, 7168, 1, 2048]
    - [420, 43.79]
  - - [96, 7168, 1, 2048]
    - [415, 54.75]
  - - [112, 7168, 1, 2048]
    - [415, 55.49]
  - - [128, 7168, 1, 2048]
    - [414, 68.97]
  - - [160, 7168, 1, 2048]
    - [419, 70.26]
  - - [192, 7168, 1, 2048]
    - [415, 94.95]
  - - [224, 7168, 1, 2048]
    - [419, 88.62]
  - - [256, 7168, 1, 2048]
    - [393, 100.33]
  - - [320, 7168, 1, 2048]
    - [423, 114.66]
  - - [384, 7168, 1, 2048]
    - [416, 132.74]
  - - [448, 7168, 1, 2048]
    - [412, 121.28]
  - - [512, 7168, 1, 2048]
    - [412, 148.27]
  - - [640, 7168, 1, 2048]
    - [419, 143.44]
  - - [768, 7168, 1, 2048]
    - [415, 141.94]
  - - [1024, 7168, 1, 2048]
    - [412, 159.06]
  - - [1280, 7168, 1, 2048]
    - [412, 149.45]
  - - [1536, 7168, 1, 2048]
    - [416, 167.85]
  - - [2048, 7168, 1, 2048]
    - [412, 166.05]
  - - [2560, 7168, 1, 2048]
    - [412, 168.52]
  - - [3072, 7168, 1, 2048]
    - [416, 167.28]
  - - [3584, 7168, 1, 2048]
    - [416, 162.69]
  - - [4096, 7168, 1, 2048]
    - [412, 162.87]
  - - [5120, 7168, 1, 2048]
    - [416, 159.36]
  - - [6144, 7168, 1, 2048]
    - [416, 156.59]
  - - [7168, 7168, 1, 2048]
    - [416, 148.93]
  - - [8192, 7168, 1, 2048]
    - [416, 152.53]
  - - [64, 8192, 1, 2048]
    - [415, 38.85]
  - - [80, 8192, 1, 2048]
    - [386, 46.8]
  - - [96, 8192, 1, 2048]
    - [424, 53.91]
  - - [112, 8192, 1, 2048]
    - [386, 60.65]
  - - [128, 8192, 1, 2048]
    - [419, 73.27]
  - - [160, 8192, 1, 2048]
    - [425, 79.63]
  - - [192, 8192, 1, 2048]
    - [387, 89.58]
  - - [224, 8192, 1, 2048]
    - [419, 98.11]
  - - [256, 8192, 1, 2048]
    - [419, 106.35]
  - - [320, 8192, 1, 2048]
    - [423, 125.12]
  - - [384, 8192, 1, 2048]
    - [416, 145.57]
  - - [448, 8192, 1, 2048]
    - [419, 109.52]
  - - [512, 8192, 1, 2048]
    - [415, 112.09]
  - - [640, 8192, 1, 2048]
    - [423, 135.03]
  - - [768, 8192, 1, 2048]
    - [416, 150.11]
  - - [1024, 8192, 1, 2048]
    - [415, 138.92]
  - - [1280, 8192, 1, 2048]
    - [412, 164.02]
  - - [1536, 8192, 1, 2048]
    - [412, 154.87]
  - - [2048, 8192, 1, 2048]
    - [412, 160.21]
  - - [2560, 8192, 1, 2048]
    - [412, 166.01]
  - - [3072, 8192, 1, 2048]
    - [416, 165.87]
  - - [3584, 8192, 1, 2048]
    - [412, 167.83]
  - - [4096, 8192, 1, 2048]
    - [412, 166.16]
  - - [5120, 8192, 1, 2048]
    - [412, 155.24]
  - - [6144, 8192, 1, 2048]
    - [416, 156.03]
  - - [7168, 8192, 1, 2048]
    - [416, 148.7]
  - - [64, 10240, 1, 2048]
    - [414, 50.4]
  - - [80, 10240, 1, 2048]
    - [404, 51.36]
  - - [96, 10240, 1, 2048]
    - [419, 59.87]
  - - [112, 10240, 1, 2048]
    - [423, 59.7]
  - - [128, 10240, 1, 2048]
    - [419, 85.59]
  - - [160, 10240, 1, 2048]
    - [423, 87.65]
  - - [192, 10240, 1, 2048]
    - [416, 100.37]
  - - [224, 10240, 1, 2048]
    - [412, 91.44]
  - - [256, 10240, 1, 2048]
    - [417, 104.32]
  - - [320, 10240, 1, 2048]
    - [419, 100.88]
  - - [384, 10240, 1, 2048]
    - [415, 108.56]
  - - [448, 10240, 1, 2048]
    - [415, 119.62]
  - - [512, 10240, 1, 2048]
    - [416, 122.38]
  - - [640, 10240, 1, 2048]
    - [419, 140.03]
  - - [768, 10240, 1, 2048]
    - [422, 135.22]
  - - [1024, 10240, 1, 2048]
    - [412, 160.45]
  - - [1280, 10240, 1, 2048]
    - [412, 158.58]
  - - [1536, 10240, 1, 2048]
    - [416, 155.73]
  - - [2048, 10240, 1, 2048]
    - [412, 162.67]
  - - [2560, 10240, 1, 2048]
    - [412, 159.33]
  - - [3072, 10240, 1, 2048]
    - [416, 163.63]
  - - [3584, 10240, 1, 2048]
    - [412, 167.14]
  - - [4096, 10240, 1, 2048]
    - [416, 162.55]
  - - [5120, 10240, 1, 2048]
    - [416, 157.66]
  - - [6144, 10240, 1, 2048]
    - [416, 158.22]
  - - [48, 12288, 1, 2048]
    - [415, 38.73]
  - - [64, 12288, 1, 2048]
    - [415, 50.6]
  - - [80, 12288, 1, 2048]
    - [419, 57.14]
  - - [96, 12288, 1, 2048]
    - [415, 80.48]
  - - [112, 12288, 1, 2048]
    - [419, 75.4]
  - - [128, 12288, 1, 2048]
    - [393, 80.97]
  - - [160, 12288, 1, 2048]
    - [423, 100.74]
  - - [192, 12288, 1, 2048]
    - [416, 114.33]
  - - [224, 12288, 1, 2048]
    - [412, 100.49]
  - - [256, 12288, 1, 2048]
    - [412, 122.43]
  - - [320, 12288, 1, 2048]
    - [415, 102.16]
  - - [384, 12288, 1, 2048]
    - [422, 121.48]
  - - [448, 12288, 1, 2048]
    - [416, 130.08]
  - - [512, 12288, 1, 2048]
    - [412, 143.24]
  - - [640, 12288, 1, 2048]
    - [423, 137.41]
  - - [768, 12288, 1, 2048]
    - [416, 153.06]
  - - [1024, 12288, 1, 2048]
    - [412, 152.37]
  - - [1280, 12288, 1, 2048]
    - [412, 155.21]
  - - [1536, 12288, 1, 2048]
    - [416, 157.45]
  - - [2048, 12288, 1, 2048]
    - [416, 163.12]
  - - [2560, 12288, 1, 2048]
    - [416, 163.0]
  - - [3072, 12288, 1, 2048]
    - [416, 163.3]
  - - [3584, 12288, 1, 2048]
    - [416, 160.76]
  - - [4096, 12288, 1, 2048]
    - [416, 165.2]
  - - [5120, 12288, 1, 2048]
    - [416, 159.2]
  - - [32, 16384, 1, 2048]
    - [413, 40.93]
  - - [48, 16384, 1, 2048]
    - [415, 47.35]
  - - [64, 16384, 1, 2048]
    - [414, 68.16]
  - - [80, 16384, 1, 2048]
    - [423, 59.95]
  - - [96, 16384, 1, 2048]
    - [415, 92.66]
  - - [112, 16384, 1, 2048]
    - [423, 82.97]
  - - [128, 16384, 1, 2048]
    - [414, 84.92]
  - - [160, 16384, 1, 2048]
    - [416, 56.4]
  - - [192, 16384, 1, 2048]
    - [422, 67.97]
  - - [224, 16384, 1, 2048]
    - [415, 69.66]
  - - [256, 16384, 1, 2048]
    - [417, 80.38]
  - - [320, 16384, 1, 2048]
    - [423, 80.42]
  - - [384, 16384, 1, 2048]
    - [420, 94.78]
  - - [448, 16384, 1, 2048]
    - [423, 92.78]
  - - [512, 16384, 1, 2048]
    - [393, 118.65]
  - - [640, 16384, 1, 2048]
    - [415, 106.83]
  - - [768, 16384, 1, 2048]
    - [416, 128.42]
  - - [1024, 16384, 1, 2048]
    - [412, 159.62]
  - - [1280, 16384, 1, 2048]
    - [412, 166.56]
  - - [1536, 16384, 1, 2048]
    - [416, 168.85]
  - - [2048, 16384, 1, 2048]
    - [412, 167.96]
  - - [2560, 16384, 1, 2048]
    - [412, 166.24]
  - - [3072, 16384, 1, 2048]
    - [416, 166.57]
  - - [3584, 16384, 1, 2048]
    - [412, 167.33]
  - - [32, 20480, 1, 2048]
    - [426, 30.51]
  - - [48, 20480, 1, 2048]
    - [422, 43.34]
  - - [64, 20480, 1, 2048]
    - [421, 57.08]
  - - [80, 20480, 1, 2048]
    - [422, 69.35]
  - - [96, 20480, 1, 2048]
    - [422, 89.03]
  - - [112, 20480, 1, 2048]
    - [417, 65.88]
  - - [128, 20480, 1, 2048]
    - [417, 95.09]
  - - [160, 20480, 1, 2048]
    - [423, 78.05]
  - - [192, 20480, 1, 2048]
    - [415, 96.94]
  - - [224, 20480, 1, 2048]
    - [393, 94.21]
  - - [256, 20480, 1, 2048]
    - [412, 112.02]
  - - [320, 20480, 1, 2048]
    - [415, 108.31]
  - - [384, 20480, 1, 2048]
    - [415, 131.65]
  - - [448, 20480, 1, 2048]
    - [415, 127.1]
  - - [512, 20480, 1, 2048]
    - [412, 153.35]
  - - [640, 20480, 1, 2048]
    - [419, 141.45]
  - - [768, 20480, 1, 2048]
    - [416, 154.64]
  - - [1024, 20480, 1, 2048]
    - [412, 160.61]
  - - [1280, 20480, 1, 2048]
    - [416, 159.87]
  - - [1536, 20480, 1, 2048]
    - [416, 167.5]
  - - [2048, 20480, 1, 2048]
    - [412, 163.73]
  - - [2560, 20480, 1, 2048]
    - [412, 165.63]
  - - [3072, 20480, 1, 2048]
    - [416, 169.36]
  - - [32, 24576, 1, 2048]
    - [404, 43.39]
  - - [48, 24576, 1, 2048]
    - [422, 47.28]
  - - [64, 24576, 1, 2048]
    - [422, 61.83]
  - - [80, 24576, 1, 2048]
    - [422, 78.54]
  - - [96, 24576, 1, 2048]
    - [422, 96.01]
  - - [112, 24576, 1, 2048]
    - [393, 71.6]
  - - [128, 24576, 1, 2048]
    - [414, 88.32]
  - - [160, 24576, 1, 2048]
    - [423, 94.04]
  - - [192, 24576, 1, 2048]
    - [415, 117.34]
  - - [224, 24576, 1, 2048]
    - [415, 104.94]
  - - [256, 24576, 1, 2048]
    - [412, 126.97]
  - - [320, 24576, 1, 2048]
    - [423, 133.84]
  - - [384, 24576, 1, 2048]
    - [416, 153.12]
  - - [448, 24576, 1, 2048]
    - [423, 131.78]
  - - [512, 24576, 1, 2048]
    - [412, 146.43]
  - - [640, 24576, 1, 2048]
    - [419, 143.9]
  - - [768, 24576, 1, 2048]
    - [416, 156.27]
  - - [1024, 24576, 1, 2048]
    - [412, 164.9]
  - - [1280, 24576, 1, 2048]
    - [412, 166.13]
  - - [1536, 24576, 1, 2048]
    - [416, 165.61]
  - - [2048, 24576, 1, 2048]
    - [412, 166.75]
  - - [2560, 24576, 1, 2048]
    - [412, 170.93]
  - - [16, 32768, 1, 2048]
    - [404, 23.4]
  - - [32, 32768, 1, 2048]
    - [413, 44.15]
  - - [48, 32768, 1, 2048]
    - [415, 49.53]
  - - [64, 32768, 1, 2048]
    - [414, 72.59]
  - - [80, 32768, 1, 2048]
    - [415, 75.42]
  - - [96, 32768, 1, 2048]
    - [415, 91.44]
  - - [112, 32768, 1, 2048]
    - [423, 82.26]
  - - [128, 32768, 1, 2048]
    - [419, 107.84]
  - - [160, 32768, 1, 2048]
    - [423, 123.4]
  - - [192, 32768, 1, 2048]
    - [416, 139.2]
  - - [224, 32768, 1, 2048]
    - [415, 101.2]
  - - [256, 32768, 1, 2048]
    - [419, 126.79]
  - - [320, 32768, 1, 2048]
    - [423, 135.76]
  - - [384, 32768, 1, 2048]
    - [416, 154.19]
  - - [448, 32768, 1, 2048]
    - [415, 133.32]
  - - [512, 32768, 1, 2048]
    - [412, 151.69]
  - - [640, 32768, 1, 2048]
    - [423, 153.72]
  - - [768, 32768, 1, 2048]
    - [416, 170.68]
  - - [1024, 32768, 1, 2048]
    - [412, 166.63]
  - - [1280, 32768, 1, 2048]
    - [412, 165.53]
  - - [1536, 32768, 1, 2048]
    - [416, 170.69]
  - - [16, 40960, 1, 2048]
    - [426, 21.27]
  - - [32, 40960, 1, 2048]
    - [413, 39.32]
  - - [48, 40960, 1, 2048]
    - [414, 45.44]
  - - [64, 40960, 1, 2048]
    - [414, 61.8]
  - - [80, 40960, 1, 2048]
    - [415, 64.75]
  - - [96, 40960, 1, 2048]
    - [415, 87.3]
  - - [112, 40960, 1, 2048]
    - [417, 78.82]
  - - [128, 40960, 1, 2048]
    - [417, 98.83]
  - - [160, 40960, 1, 2048]
    - [423, 99.82]
  - - [192, 40960, 1, 2048]
    - [422, 123.72]
  - - [224, 40960, 1, 2048]
    - [412, 108.64]
  - - [256, 40960, 1, 2048]
    - [412, 132.99]
  - - [320, 40960, 1, 2048]
    - [418, 119.35]
  - - [384, 40960, 1, 2048]
    - [416, 155.44]
  - - [448, 40960, 1, 2048]
    - [415, 135.11]
  - - [512, 40960, 1, 2048]
    - [419, 143.24]
  - - [640, 40960, 1, 2048]
    - [423, 151.75]
  - - [768, 40960, 1, 2048]
    - [416, 168.36]
  - - [1024, 40960, 1, 2048]
    - [412, 160.31]
  - - [1280, 40960, 1, 2048]
    - [412, 165.11]
  - - [1536, 40960, 1, 2048]
    - [416, 173.64]
  - - [16, 49152, 1, 2048]
    - [413, 21.38]
  - - [32, 49152, 1, 2048]
    - [413, 43.21]
  - - [48, 49152, 1, 2048]
    - [414, 52.74]
  - - [64, 49152, 1, 2048]
    - [414, 69.2]
  - - [80, 49152, 1, 2048]
    - [415, 76.19]
  - - [96, 49152, 1, 2048]
    - [422, 94.74]
  - - [112, 49152, 1, 2048]
    - [419, 85.03]
  - - [128, 49152, 1, 2048]
    - [419, 106.73]
  - - [160, 49152, 1, 2048]
    - [423, 124.83]
  - - [192, 49152, 1, 2048]
    - [416, 140.62]
  - - [224, 49152, 1, 2048]
    - [415, 106.32]
  - - [256, 49152, 1, 2048]
    - [412, 129.32]
  - - [320, 49152, 1, 2048]
    - [423, 133.61]
  - - [384, 49152, 1, 2048]
    - [416, 154.19]
  - - [448, 49152, 1, 2048]
    - [423, 134.87]
  - - [512, 49152, 1, 2048]
    - [412, 156.38]
  - - [640, 49152, 1, 2048]
    - [419, 148.72]
  - - [768, 49152, 1, 2048]
    - [416, 164.5]
  - - [1024, 49152, 1, 2048]
    - [412, 162.15]
  - - [1280, 49152, 1, 2048]
    - [412, 167.82]
  - - [16, 65536, 1, 2048]
    - [404, 22.21]
  - - [32, 65536, 1, 2048]
    - [404, 45.95]
  - - [48, 65536, 1, 2048]
    - [414, 50.62]
  - - [64, 65536, 1, 2048]
    - [414, 69.18]
  - - [80, 65536, 1, 2048]
    - [415, 77.15]
  - - [96, 65536, 1, 2048]
    - [422, 88.64]
  - - [112, 65536, 1, 2048]
    - [419, 85.28]
  - - [128, 65536, 1, 2048]
    - [419, 106.71]
  - - [160, 65536, 1, 2048]
    - [423, 126.92]
  - - [192, 65536, 1, 2048]
    - [416, 142.31]
  - - [224, 65536, 1, 2048]
    - [415, 104.37]
  - - [256, 65536, 1, 2048]
    - [419, 138.41]
  - - [320, 65536, 1, 2048]
    - [423, 146.88]
  - - [384, 65536, 1, 2048]
    - [416, 166.36]
  - - [448, 65536, 1, 2048]
    - [415, 134.39]
  - - [512, 65536, 1, 2048]
    - [412, 154.6]
  - - [640, 65536, 1, 2048]
    - [423, 152.59]
  - - [768, 65536, 1, 2048]
    - [416, 168.8]
  - - [16, 131072, 1, 2048]
    - [404, 21.32]
  - - [32, 131072, 1, 2048]
    - [404, 42.97]
  - - [48, 131072, 1, 2048]
    - [415, 51.43]
  - - [64, 131072, 1, 2048]
    - [414, 67.31]
  - - [80, 131072, 1, 2048]
    - [415, 75.84]
  - - [96, 131072, 1, 2048]
    - [415, 99.33]
  - - [112, 131072, 1, 2048]
    - [419, 94.13]
  - - [128, 131072, 1, 2048]
    - [419, 107.13]
  - - [160, 131072, 1, 2048]
    - [423, 135.38]
  - - [192, 131072, 1, 2048]
    - [416, 151.78]
  - - [224, 131072, 1, 2048]
    - [419, 109.88]
  - - [256, 131072, 1, 2048]
    - [419, 135.08]
  - - [320, 131072, 1, 2048]
    - [423, 145.9]
  - - [384, 131072, 1, 2048]
    - [416, 164.7]
  - - [448, 131072, 1, 2048]
    - [423, 133.53]
  - - [65536, 16, 1, 512]
    - [379, 33.43]
  - - [131072, 16, 1, 512]
    - [379, 33.7]
  - - [32768, 32, 1, 512]
    - [386, 46.42]
  - - [40960, 32, 1, 512]
    - [387, 46.69]
  - - [49152, 32, 1, 512]
    - [420, 44.9]
  - - [65536, 32, 1, 512]
    - [386, 52.3]
  - - [131072, 32, 1, 512]
    - [386, 55.62]
  - - [20480, 48, 1, 512]
    - [419, 38.38]
  - - [24576, 48, 1, 512]
    - [393, 51.88]
  - - [32768, 48, 1, 512]
    - [416, 43.66]
  - - [40960, 48, 1, 512]
    - [414, 37.43]
  - - [49152, 48, 1, 512]
    - [393, 52.53]
  - - [65536, 48, 1, 512]
    - [412, 77.53]
  - - [131072, 48, 1, 512]
    - [412, 76.98]
  - - [16384, 64, 1, 512]
    - [393, 42.48]
  - - [20480, 64, 1, 512]
    - [425, 46.15]
  - - [24576, 64, 1, 512]
    - [419, 59.91]
  - - [32768, 64, 1, 512]
    - [417, 62.51]
  - - [40960, 64, 1, 512]
    - [423, 72.91]
  - - [49152, 64, 1, 512]
    - [415, 74.35]
  - - [65536, 64, 1, 512]
    - [419, 75.86]
  - - [131072, 64, 1, 512]
    - [415, 77.02]
  - - [12288, 80, 1, 512]
    - [419, 37.96]
  - - [16384, 80, 1, 512]
    - [393, 43.94]
  - - [20480, 80, 1, 512]
    - [417, 58.12]
  - - [24576, 80, 1, 512]
    - [410, 57.73]
  - - [32768, 80, 1, 512]
    - [412, 65.04]
  - - [40960, 80, 1, 512]
    - [421, 56.63]
  - - [49152, 80, 1, 512]
    - [417, 66.13]
  - - [65536, 80, 1, 512]
    - [417, 81.88]
  - - [131072, 80, 1, 512]
    - [417, 81.75]
  - - [10240, 96, 1, 512]
    - [419, 39.95]
  - - [12288, 96, 1, 512]
    - [410, 46.82]
  - - [16384, 96, 1, 512]
    - [393, 63.31]
  - - [20480, 96, 1, 512]
    - [422, 63.38]
  - - [24576, 96, 1, 512]
    - [422, 75.67]
  - - [32768, 96, 1, 512]
    - [412, 78.4]
  - - [40960, 96, 1, 512]
    - [393, 67.03]
  - - [49152, 96, 1, 512]
    - [422, 80.43]
  - - [65536, 96, 1, 512]
    - [393, 74.89]
  - - [131072, 96, 1, 512]
    - [393, 84.76]
  - - [8192, 112, 1, 512]
    - [419, 37.31]
  - - [10240, 112, 1, 512]
    - [419, 45.03]
  - - [12288, 112, 1, 512]
    - [393, 50.84]
  - - [16384, 112, 1, 512]
    - [419, 61.21]
  - - [20480, 112, 1, 512]
    - [412, 60.04]
  - - [24576, 112, 1, 512]
    - [416, 71.62]
  - - [32768, 112, 1, 512]
    - [419, 65.22]
  - - [40960, 112, 1, 512]
    - [415, 66.4]
  - - [49152, 112, 1, 512]
    - [416, 76.22]
  - - [65536, 112, 1, 512]
    - [415, 70.45]
  - - [131072, 112, 1, 512]
    - [415, 76.39]
  - - [7168, 128, 1, 512]
    - [404, 40.78]
  - - [8192, 128, 1, 512]
    - [386, 49.51]
  - - [10240, 128, 1, 512]
    - [387, 45.4]
  - - [12288, 128, 1, 512]
    - [393, 62.86]
  - - [16384, 128, 1, 512]
    - [419, 76.05]
  - - [20480, 128, 1, 512]
    - [418, 66.11]
  - - [24576, 128, 1, 512]
    - [416, 87.31]
  - - [32768, 128, 1, 512]
    - [419, 80.43]
  - - [40960, 128, 1, 512]
    - [415, 81.52]
  - - [49152, 128, 1, 512]
    - [393, 80.91]
  - - [65536, 128, 1, 512]
    - [419, 81.92]
  - - [131072, 128, 1, 512]
    - [416, 91.28]
  - - [6144, 160, 1, 512]
    - [393, 44.61]
  - - [7168, 160, 1, 512]
    - [393, 48.73]
  - - [8192, 160, 1, 512]
    - [421, 52.81]
  - - [10240, 160, 1, 512]
    - [417, 58.8]
  - - [12288, 160, 1, 512]
    - [417, 66.52]
  - - [16384, 160, 1, 512]
    - [412, 55.19]
  - - [20480, 160, 1, 512]
    - [419, 62.42]
  - - [24576, 160, 1, 512]
    - [422, 67.61]
  - - [32768, 160, 1, 512]
    - [417, 83.59]
  - - [40960, 160, 1, 512]
    - [421, 72.09]
  - - [49152, 160, 1, 512]
    - [417, 85.2]
  - - [65536, 160, 1, 512]
    - [417, 86.23]
  - - [131072, 160, 1, 512]
    - [417, 93.14]
  - - [5120, 192, 1, 512]
    - [386, 46.97]
  - - [6144, 192, 1, 512]
    - [393, 52.21]
  - - [7168, 192, 1, 512]
    - [411, 47.46]
  - - [8192, 192, 1, 512]
    - [419, 61.0]
  - - [10240, 192, 1, 512]
    - [419, 70.77]
  - - [12288, 192, 1, 512]
    - [422, 78.83]
  - - [16384, 192, 1, 512]
    - [416, 78.84]
  - - [20480, 192, 1, 512]
    - [419, 74.81]
  - - [24576, 192, 1, 512]
    - [419, 83.24]
  - - [32768, 192, 1, 512]
    - [412, 85.48]
  - - [40960, 192, 1, 512]
    - [422, 86.25]
  - - [49152, 192, 1, 512]
    - [416, 92.04]
  - - [65536, 192, 1, 512]
    - [393, 94.88]
  - - [131072, 192, 1, 512]
    - [416, 97.5]
  - - [4096, 224, 1, 512]
    - [379, 40.08]
  - - [5120, 224, 1, 512]
    - [393, 50.26]
  - - [6144, 224, 1, 512]
    - [415, 52.9]
  - - [7168, 224, 1, 512]
    - [417, 54.64]
  - - [8192, 224, 1, 512]
    - [417, 59.8]
  - - [10240, 224, 1, 512]
    - [417, 70.08]
  - - [12288, 224, 1, 512]
    - [386, 58.93]
  - - [16384, 224, 1, 512]
    - [419, 67.62]
  - - [20480, 224, 1, 512]
    - [415, 72.22]
  - - [24576, 224, 1, 512]
    - [417, 83.2]
  - - [32768, 224, 1, 512]
    - [393, 79.99]
  - - [40960, 224, 1, 512]
    - [393, 84.04]
  - - [49152, 224, 1, 512]
    - [393, 87.61]
  - - [65536, 224, 1, 512]
    - [393, 91.98]
  - - [131072, 224, 1, 512]
    - [393, 90.71]
  - - [3584, 256, 1, 512]
    - [414, 45.08]
  - - [4096, 256, 1, 512]
    - [404, 46.85]
  - - [5120, 256, 1, 512]
    - [393, 52.36]
  - - [6144, 256, 1, 512]
    - [419, 62.81]
  - - [7168, 256, 1, 512]
    - [419, 70.55]
  - - [8192, 256, 1, 512]
    - [419, 76.11]
  - - [10240, 256, 1, 512]
    - [416, 70.83]
  - - [12288, 256, 1, 512]
    - [412, 78.08]
  - - [16384, 256, 1, 512]
    - [415, 71.19]
  - - [20480, 256, 1, 512]
    - [423, 79.24]
  - - [24576, 256, 1, 512]
    - [415, 84.46]
  - - [32768, 256, 1, 512]
    - [415, 88.96]
  - - [40960, 256, 1, 512]
    - [416, 96.84]
  - - [49152, 256, 1, 512]
    - [415, 98.68]
  - - [65536, 256, 1, 512]
    - [415, 99.79]
  - - [131072, 256, 1, 512]
    - [416, 102.67]
  - - [3072, 320, 1, 512]
    - [386, 50.25]
  - - [3584, 320, 1, 512]
    - [386, 54.93]
  - - [4096, 320, 1, 512]
    - [421, 54.13]
  - - [5120, 320, 1, 512]
    - [393, 64.95]
  - - [6144, 320, 1, 512]
    - [417, 67.7]
  - - [7168, 320, 1, 512]
    - [419, 78.5]
  - - [8192, 320, 1, 512]
    - [423, 73.64]
  - - [10240, 320, 1, 512]
    - [412, 83.3]
  - - [12288, 320, 1, 512]
    - [419, 77.65]
  - - [16384, 320, 1, 512]
    - [393, 81.75]
  - - [20480, 320, 1, 512]
    - [412, 86.65]
  - - [24576, 320, 1, 512]
    - [417, 88.18]
  - - [32768, 320, 1, 512]
    - [393, 95.24]
  - - [40960, 320, 1, 512]
    - [415, 93.82]
  - - [49152, 320, 1, 512]
    - [415, 100.59]
  - - [65536, 320, 1, 512]
    - [415, 100.83]
  - - [131072, 320, 1, 512]
    - [416, 101.84]
  - - [2560, 384, 1, 512]
    - [393, 45.9]
  - - [3072, 384, 1, 512]
    - [379, 50.5]
  - - [3584, 384, 1, 512]
    - [393, 60.01]
  - - [4096, 384, 1, 512]
    - [393, 65.56]
  - - [5120, 384, 1, 512]
    - [412, 65.22]
  - - [6144, 384, 1, 512]
    - [410, 77.27]
  - - [7168, 384, 1, 512]
    - [417, 81.88]
  - - [8192, 384, 1, 512]
    - [416, 74.31]
  - - [10240, 384, 1, 512]
    - [419, 78.41]
  - - [12288, 384, 1, 512]
    - [419, 87.69]
  - - [16384, 384, 1, 512]
    - [416, 86.62]
  - - [20480, 384, 1, 512]
    - [393, 91.81]
  - - [24576, 384, 1, 512]
    - [416, 96.15]
  - - [32768, 384, 1, 512]
    - [393, 103.42]
  - - [40960, 384, 1, 512]
    - [393, 102.06]
  - - [49152, 384, 1, 512]
    - [393, 103.28]
  - - [65536, 384, 1, 512]
    - [393, 105.9]
  - - [131072, 384, 1, 512]
    - [416, 106.18]
  - - [2048, 448, 1, 512]
    - [393, 44.05]
  - - [2560, 448, 1, 512]
    - [414, 53.41]
  - - [3072, 448, 1, 512]
    - [393, 60.4]
  - - [3584, 448, 1, 512]
    - [415, 58.6]
  - - [4096, 448, 1, 512]
    - [419, 68.33]
  - - [5120, 448, 1, 512]
    - [419, 79.14]
  - - [6144, 448, 1, 512]
    - [412, 81.29]
  - - [7168, 448, 1, 512]
    - [416, 80.81]
  - - [8192, 448, 1, 512]
    - [415, 72.52]
  - - [10240, 448, 1, 512]
    - [419, 84.16]
  - - [12288, 448, 1, 512]
    - [416, 85.99]
  - - [16384, 448, 1, 512]
    - [416, 91.12]
  - - [20480, 448, 1, 512]
    - [415, 95.62]
  - - [24576, 448, 1, 512]
    - [416, 102.32]
  - - [32768, 448, 1, 512]
    - [415, 101.41]
  - - [40960, 448, 1, 512]
    - [415, 102.65]
  - - [49152, 448, 1, 512]
    - [415, 106.09]
  - - [65536, 448, 1, 512]
    - [415, 105.73]
  - - [131072, 448, 1, 512]
    - [416, 105.54]
  - - [2048, 512, 1, 512]
    - [379, 47.08]
  - - [2560, 512, 1, 512]
    - [393, 54.96]
  - - [3072, 512, 1, 512]
    - [415, 65.0]
  - - [3584, 512, 1, 512]
    - [386, 60.64]
  - - [4096, 512, 1, 512]
    - [419, 77.16]
  - - [5120, 512, 1, 512]
    - [423, 77.16]
  - - [6144, 512, 1, 512]
    - [414, 69.08]
  - - [7168, 512, 1, 512]
    - [416, 85.62]
  - - [8192, 512, 1, 512]
    - [393, 75.29]
  - - [10240, 512, 1, 512]
    - [415, 85.02]
  - - [12288, 512, 1, 512]
    - [416, 94.52]
  - - [16384, 512, 1, 512]
    - [393, 89.81]
  - - [20480, 512, 1, 512]
    - [415, 98.32]
  - - [24576, 512, 1, 512]
    - [415, 103.26]
  - - [32768, 512, 1, 512]
    - [415, 107.06]
  - - [40960, 512, 1, 512]
    - [415, 105.09]
  - - [49152, 512, 1, 512]
    - [415, 109.06]
  - - [65536, 512, 1, 512]
    - [415, 110.07]
  - - [1536, 640, 1, 512]
    - [411, 40.51]
  - - [2048, 640, 1, 512]
    - [386, 51.22]
  - - [2560, 640, 1, 512]
    - [393, 71.0]
  - - [3072, 640, 1, 512]
    - [410, 72.06]
  - - [3584, 640, 1, 512]
    - [417, 77.02]
  - - [4096, 640, 1, 512]
    - [417, 82.9]
  - - [5120, 640, 1, 512]
    - [415, 82.87]
  - - [6144, 640, 1, 512]
    - [419, 80.34]
  - - [7168, 640, 1, 512]
    - [419, 88.51]
  - - [8192, 640, 1, 512]
    - [415, 87.61]
  - - [10240, 640, 1, 512]
    - [416, 93.89]
  - - [12288, 640, 1, 512]
    - [415, 93.44]
  - - [16384, 640, 1, 512]
    - [416, 98.32]
  - - [20480, 640, 1, 512]
    - [415, 101.21]
  - - [24576, 640, 1, 512]
    - [415, 104.8]
  - - [32768, 640, 1, 512]
    - [415, 106.69]
  - - [40960, 640, 1, 512]
    - [415, 106.03]
  - - [49152, 640, 1, 512]
    - [415, 110.1]
  - - [65536, 640, 1, 512]
    - [416, 110.78]
  - - [1280, 768, 1, 512]
    - [386, 50.63]
  - - [1536, 768, 1, 512]
    - [414, 55.32]
  - - [2048, 768, 1, 512]
    - [419, 64.29]
  - - [2560, 768, 1, 512]
    - [419, 75.78]
  - - [3072, 768, 1, 512]
    - [386, 76.04]
  - - [3584, 768, 1, 512]
    - [393, 77.11]
  - - [4096, 768, 1, 512]
    - [412, 92.04]
  - - [5120, 768, 1, 512]
    - [419, 81.8]
  - - [6144, 768, 1, 512]
    - [419, 92.03]
  - - [7168, 768, 1, 512]
    - [393, 93.61]
  - - [8192, 768, 1, 512]
    - [411, 67.28]
  - - [10240, 768, 1, 512]
    - [424, 69.88]
  - - [12288, 768, 1, 512]
    - [417, 67.06]
  - - [16384, 768, 1, 512]
    - [423, 61.85]
  - - [20480, 768, 1, 512]
    - [410, 87.38]
  - - [24576, 768, 1, 512]
    - [386, 86.16]
  - - [32768, 768, 1, 512]
    - [422, 101.31]
  - - [40960, 768, 1, 512]
    - [416, 83.08]
  - - [49152, 768, 1, 512]
    - [416, 111.4]
  - - [65536, 768, 1, 512]
    - [416, 112.19]
  - - [1024, 1024, 1, 512]
    - [379, 46.54]
  - - [1280, 1024, 1, 512]
    - [424, 41.89]
  - - [1536, 1024, 1, 512]
    - [424, 51.93]
  - - [2048, 1024, 1, 512]
    - [386, 69.3]
  - - [2560, 1024, 1, 512]
    - [422, 69.53]
  - - [3072, 1024, 1, 512]
    - [419, 73.72]
  - - [3584, 1024, 1, 512]
    - [422, 66.71]
  - - [4096, 1024, 1, 512]
    - [425, 47.2]
  - - [5120, 1024, 1, 512]
    - [386, 83.22]
  - - [6144, 1024, 1, 512]
    - [411, 68.56]
  - - [7168, 1024, 1, 512]
    - [393, 64.94]
  - - [8192, 1024, 1, 512]
    - [414, 83.65]
  - - [10240, 1024, 1, 512]
    - [393, 95.82]
  - - [12288, 1024, 1, 512]
    - [422, 91.99]
  - - [16384, 1024, 1, 512]
    - [417, 66.89]
  - - [20480, 1024, 1, 512]
    - [393, 79.52]
  - - [24576, 1024, 1, 512]
    - [415, 109.89]
  - - [32768, 1024, 1, 512]
    - [415, 112.28]
  - - [40960, 1024, 1, 512]
    - [416, 111.58]
  - - [49152, 1024, 1, 512]
    - [419, 102.85]
  - - [768, 1280, 1, 512]
    - [386, 50.75]
  - - [1024, 1280, 1, 512]
    - [425, 30.18]
  - - [1280, 1280, 1, 512]
    - [423, 48.78]
  - - [1536, 1280, 1, 512]
    - [410, 72.05]
  - - [2048, 1280, 1, 512]
    - [423, 46.37]
  - - [2560, 1280, 1, 512]
    - [414, 69.8]
  - - [3072, 1280, 1, 512]
    - [419, 82.68]
  - - [3584, 1280, 1, 512]
    - [411, 59.55]
  - - [4096, 1280, 1, 512]
    - [425, 47.93]
  - - [5120, 1280, 1, 512]
    - [393, 63.18]
  - - [6144, 1280, 1, 512]
    - [386, 90.52]
  - - [7168, 1280, 1, 512]
    - [422, 82.92]
  - - [8192, 1280, 1, 512]
    - [416, 54.81]
  - - [10240, 1280, 1, 512]
    - [426, 64.04]
  - - [12288, 1280, 1, 512]
    - [423, 85.56]
  - - [16384, 1280, 1, 512]
    - [415, 106.97]
  - - [20480, 1280, 1, 512]
    - [415, 105.34]
  - - [24576, 1280, 1, 512]
    - [417, 95.37]
  - - [32768, 1280, 1, 512]
    - [416, 91.14]
  - - [40960, 1280, 1, 512]
    - [422, 101.39]
  - - [49152, 1280, 1, 512]
    - [417, 103.29]
  - - [640, 1536, 1, 512]
    - [393, 44.48]
  - - [768, 1536, 1, 512]
    - [419, 51.72]
  - - [1024, 1536, 1, 512]
    - [378, 43.69]
  - - [1280, 1536, 1, 512]
    - [423, 66.22]
  - - [1536, 1536, 1, 512]
    - [419, 36.65]
  - - [2048, 1536, 1, 512]
    - [378, 26.25]
  - - [2560, 1536, 1, 512]
    - [419, 85.21]
  - - [3072, 1536, 1, 512]
    - [415, 95.92]
  - - [3584, 1536, 1, 512]
    - [393, 100.65]
  - - [4096, 1536, 1, 512]
    - [416, 97.46]
  - - [5120, 1536, 1, 512]
    - [393, 98.55]
  - - [6144, 1536, 1, 512]
    - [416, 110.15]
  - - [7168, 1536, 1, 512]
    - [393, 105.74]
  - - [8192, 1536, 1, 512]
    - [415, 103.27]
  - - [10240, 1536, 1, 512]
    - [393, 104.08]
  - - [12288, 1536, 1, 512]
    - [393, 104.54]
  - - [16384, 1536, 1, 512]
    - [415, 110.48]
  - - [20480, 1536, 1, 512]
    - [415, 111.84]
  - - [24576, 1536, 1, 512]
    - [416, 112.92]
  - - [32768, 1536, 1, 512]
    - [415, 114.7]
  - - [40960, 1536, 1, 512]
    - [416, 117.42]
  - - [448, 2048, 1, 512]
    - [414, 44.74]
  - - [512, 2048, 1, 512]
    - [386, 48.25]
  - - [640, 2048, 1, 512]
    - [393, 57.26]
  - - [768, 2048, 1, 512]
    - [410, 59.26]
  - - [1024, 2048, 1, 512]
    - [386, 68.99]
  - - [1280, 2048, 1, 512]
    - [410, 70.9]
  - - [1536, 2048, 1, 512]
    - [387, 67.26]
  - - [2048, 2048, 1, 512]
    - [419, 89.01]
  - - [2560, 2048, 1, 512]
    - [423, 92.51]
  - - [3072, 2048, 1, 512]
    - [416, 107.61]
  - - [3584, 2048, 1, 512]
    - [412, 110.52]
  - - [4096, 2048, 1, 512]
    - [415, 100.32]
  - - [5120, 2048, 1, 512]
    - [412, 108.82]
  - - [6144, 2048, 1, 512]
    - [416, 113.84]
  - - [7168, 2048, 1, 512]
    - [393, 110.44]
  - - [8192, 2048, 1, 512]
    - [393, 104.3]
  - - [10240, 2048, 1, 512]
    - [415, 110.61]
  - - [12288, 2048, 1, 512]
    - [416, 111.26]
  - - [16384, 2048, 1, 512]
    - [415, 113.04]
  - - [20480, 2048, 1, 512]
    - [416, 113.9]
  - - [24576, 2048, 1, 512]
    - [416, 116.12]
  - - [384, 2560, 1, 512]
    - [415, 45.29]
  - - [448, 2560, 1, 512]
    - [410, 38.82]
  - - [512, 2560, 1, 512]
    - [386, 48.78]
  - - [640, 2560, 1, 512]
    - [386, 60.42]
  - - [768, 2560, 1, 512]
    - [411, 50.46]
  - - [1024, 2560, 1, 512]
    - [416, 72.2]
  - - [1280, 2560, 1, 512]
    - [393, 86.93]
  - - [1536, 2560, 1, 512]
    - [419, 83.34]
  - - [2048, 2560, 1, 512]
    - [422, 88.51]
  - - [2560, 2560, 1, 512]
    - [416, 102.07]
  - - [3072, 2560, 1, 512]
    - [415, 104.47]
  - - [3584, 2560, 1, 512]
    - [393, 107.96]
  - - [4096, 2560, 1, 512]
    - [416, 111.64]
  - - [5120, 2560, 1, 512]
    - [416, 108.82]
  - - [6144, 2560, 1, 512]
    - [415, 116.08]
  - - [7168, 2560, 1, 512]
    - [393, 112.29]
  - - [8192, 2560, 1, 512]
    - [415, 109.68]
  - - [10240, 2560, 1, 512]
    - [415, 111.39]
  - - [12288, 2560, 1, 512]
    - [415, 117.13]
  - - [16384, 2560, 1, 512]
    - [415, 115.3]
  - - [20480, 2560, 1, 512]
    - [416, 116.31]
  - - [24576, 2560, 1, 512]
    - [415, 119.68]
  - - [320, 3072, 1, 512]
    - [386, 44.1]
  - - [384, 3072, 1, 512]
    - [404, 50.81]
  - - [448, 3072, 1, 512]
    - [421, 52.38]
  - - [512, 3072, 1, 512]
    - [386, 55.54]
  - - [640, 3072, 1, 512]
    - [414, 65.04]
  - - [768, 3072, 1, 512]
    - [419, 87.85]
  - - [1024, 3072, 1, 512]
    - [416, 83.53]
  - - [1280, 3072, 1, 512]
    - [419, 83.14]
  - - [1536, 3072, 1, 512]
    - [393, 92.7]
  - - [2048, 3072, 1, 512]
    - [412, 101.73]
  - - [2560, 3072, 1, 512]
    - [393, 102.2]
  - - [3072, 3072, 1, 512]
    - [416, 114.4]
  - - [3584, 3072, 1, 512]
    - [412, 115.93]
  - - [4096, 3072, 1, 512]
    - [412, 111.14]
  - - [5120, 3072, 1, 512]
    - [415, 116.18]
  - - [6144, 3072, 1, 512]
    - [416, 116.52]
  - - [7168, 3072, 1, 512]
    - [393, 113.47]
  - - [8192, 3072, 1, 512]
    - [415, 110.66]
  - - [10240, 3072, 1, 512]
    - [416, 111.53]
  - - [12288, 3072, 1, 512]
    - [415, 116.59]
  - - [16384, 3072, 1, 512]
    - [415, 116.19]
  - - [20480, 3072, 1, 512]
    - [415, 118.7]
  - - [256, 3584, 1, 512]
    - [386, 46.06]
  - - [320, 3584, 1, 512]
    - [404, 51.76]
  - - [384, 3584, 1, 512]
    - [419, 58.74]
  - - [448, 3584, 1, 512]
    - [393, 60.35]
  - - [512, 3584, 1, 512]
    - [386, 63.13]
  - - [640, 3584, 1, 512]
    - [419, 90.03]
  - - [768, 3584, 1, 512]
    - [416, 90.83]
  - - [1024, 3584, 1, 512]
    - [393, 90.69]
  - - [1280, 3584, 1, 512]
    - [393, 88.57]
  - - [1536, 3584, 1, 512]
    - [393, 99.49]
  - - [2048, 3584, 1, 512]
    - [386, 96.91]
  - - [2560, 3584, 1, 512]
    - [393, 110.09]
  - - [3072, 3584, 1, 512]
    - [416, 124.79]
  - - [3584, 3584, 1, 512]
    - [393, 116.41]
  - - [4096, 3584, 1, 512]
    - [393, 119.42]
  - - [5120, 3584, 1, 512]
    - [393, 120.83]
  - - [6144, 3584, 1, 512]
    - [416, 125.11]
  - - [7168, 3584, 1, 512]
    - [415, 115.71]
  - - [8192, 3584, 1, 512]
    - [415, 113.4]
  - - [10240, 3584, 1, 512]
    - [415, 115.29]
  - - [12288, 3584, 1, 512]
    - [415, 118.15]
  - - [16384, 3584, 1, 512]
    - [415, 117.33]
  - - [224, 4096, 1, 512]
    - [424, 43.31]
  - - [256, 4096, 1, 512]
    - [404, 47.36]
  - - [320, 4096, 1, 512]
    - [421, 50.99]
  - - [384, 4096, 1, 512]
    - [419, 66.36]
  - - [448, 4096, 1, 512]
    - [419, 63.38]
  - - [512, 4096, 1, 512]
    - [386, 69.99]
  - - [640, 4096, 1, 512]
    - [423, 86.48]
  - - [768, 4096, 1, 512]
    - [393, 82.73]
  - - [1024, 4096, 1, 512]
    - [419, 87.87]
  - - [1280, 4096, 1, 512]
    - [393, 97.08]
  - - [1536, 4096, 1, 512]
    - [416, 108.26]
  - - [2048, 4096, 1, 512]
    - [393, 105.56]
  - - [2560, 4096, 1, 512]
    - [412, 113.89]
  - - [3072, 4096, 1, 512]
    - [415, 119.43]
  - - [3584, 4096, 1, 512]
    - [412, 118.1]
  - - [4096, 4096, 1, 512]
    - [393, 119.6]
  - - [5120, 4096, 1, 512]
    - [415, 121.79]
  - - [6144, 4096, 1, 512]
    - [416, 125.24]
  - - [7168, 4096, 1, 512]
    - [415, 117.49]
  - - [8192, 4096, 1, 512]
    - [415, 112.89]
  - - [10240, 4096, 1, 512]
    - [415, 115.79]
  - - [12288, 4096, 1, 512]
    - [415, 118.62]
  - - [192, 5120, 1, 512]
    - [404, 45.03]
  - - [224, 5120, 1, 512]
    - [427, 42.34]
  - - [256, 5120, 1, 512]
    - [419, 54.51]
  - - [320, 5120, 1, 512]
    - [422, 54.6]
  - - [384, 5120, 1, 512]
    - [416, 70.44]
  - - [448, 5120, 1, 512]
    - [422, 66.19]
  - - [512, 5120, 1, 512]
    - [417, 74.47]
  - - [640, 5120, 1, 512]
    - [415, 82.22]
  - - [768, 5120, 1, 512]
    - [419, 85.55]
  - - [1024, 5120, 1, 512]
    - [412, 86.27]
  - - [1280, 5120, 1, 512]
    - [412, 105.39]
  - - [1536, 5120, 1, 512]
    - [415, 103.65]
  - - [2048, 5120, 1, 512]
    - [412, 113.73]
  - - [2560, 5120, 1, 512]
    - [393, 112.34]
  - - [3072, 5120, 1, 512]
    - [415, 121.79]
  - - [3584, 5120, 1, 512]
    - [412, 119.47]
  - - [4096, 5120, 1, 512]
    - [393, 123.11]
  - - [5120, 5120, 1, 512]
    - [393, 123.57]
  - - [6144, 5120, 1, 512]
    - [415, 125.77]
  - - [7168, 5120, 1, 512]
    - [415, 119.69]
  - - [8192, 5120, 1, 512]
    - [415, 116.32]
  - - [10240, 5120, 1, 512]
    - [416, 116.93]
  - - [12288, 5120, 1, 512]
    - [416, 121.09]
  - - [160, 6144, 1, 512]
    - [404, 44.52]
  - - [192, 6144, 1, 512]
    - [414, 55.17]
  - - [224, 6144, 1, 512]
    - [426, 48.74]
  - - [256, 6144, 1, 512]
    - [419, 63.2]
  - - [320, 6144, 1, 512]
    - [419, 66.61]
  - - [384, 6144, 1, 512]
    - [422, 83.53]
  - - [448, 6144, 1, 512]
    - [416, 74.35]
  - - [512, 6144, 1, 512]
    - [412, 90.44]
  - - [640, 6144, 1, 512]
    - [419, 84.81]
  - - [768, 6144, 1, 512]
    - [419, 95.03]
  - - [1024, 6144, 1, 512]
    - [415, 92.05]
  - - [1280, 6144, 1, 512]
    - [393, 100.16]
  - - [1536, 6144, 1, 512]
    - [416, 111.74]
  - - [2048, 6144, 1, 512]
    - [393, 115.28]
  - - [2560, 6144, 1, 512]
    - [416, 111.03]
  - - [3072, 6144, 1, 512]
    - [415, 124.27]
  - - [3584, 6144, 1, 512]
    - [393, 126.14]
  - - [4096, 6144, 1, 512]
    - [393, 126.34]
  - - [5120, 6144, 1, 512]
    - [393, 126.83]
  - - [6144, 6144, 1, 512]
    - [416, 127.06]
  - - [7168, 6144, 1, 512]
    - [393, 119.48]
  - - [8192, 6144, 1, 512]
    - [415, 116.32]
  - - [10240, 6144, 1, 512]
    - [416, 118.8]
  - - [128, 7168, 1, 512]
    - [386, 43.8]
  - - [160, 7168, 1, 512]
    - [404, 50.62]
  - - [192, 7168, 1, 512]
    - [415, 57.42]
  - - [224, 7168, 1, 512]
    - [427, 55.78]
  - - [256, 7168, 1, 512]
    - [414, 59.22]
  - - [320, 7168, 1, 512]
    - [423, 79.42]
  - - [384, 7168, 1, 512]
    - [393, 72.93]
  - - [448, 7168, 1, 512]
    - [393, 72.84]
  - - [512, 7168, 1, 512]
    - [412, 91.44]
  - - [640, 7168, 1, 512]
    - [423, 85.47]
  - - [768, 7168, 1, 512]
    - [422, 98.21]
  - - [1024, 7168, 1, 512]
    - [393, 102.54]
  - - [1280, 7168, 1, 512]
    - [393, 108.3]
  - - [1536, 7168, 1, 512]
    - [416, 124.15]
  - - [2048, 7168, 1, 512]
    - [393, 117.79]
  - - [2560, 7168, 1, 512]
    - [412, 122.54]
  - - [3072, 7168, 1, 512]
    - [416, 132.3]
  - - [3584, 7168, 1, 512]
    - [393, 127.42]
  - - [4096, 7168, 1, 512]
    - [393, 129.0]
  - - [5120, 7168, 1, 512]
    - [415, 128.96]
  - - [6144, 7168, 1, 512]
    - [416, 129.06]
  - - [7168, 7168, 1, 512]
    - [412, 117.12]
  - - [8192, 7168, 1, 512]
    - [415, 117.84]
  - - [112, 8192, 1, 512]
    - [386, 38.03]
  - - [128, 8192, 1, 512]
    - [404, 45.71]
  - - [160, 8192, 1, 512]
    - [423, 52.14]
  - - [192, 8192, 1, 512]
    - [415, 67.28]
  - - [224, 8192, 1, 512]
    - [419, 58.7]
  - - [256, 8192, 1, 512]
    - [417, 68.49]
  - - [320, 8192, 1, 512]
    - [423, 87.31]
  - - [384, 8192, 1, 512]
    - [416, 99.53]
  - - [448, 8192, 1, 512]
    - [415, 68.71]
  - - [512, 8192, 1, 512]
    - [419, 88.35]
  - - [640, 8192, 1, 512]
    - [423, 94.74]
  - - [768, 8192, 1, 512]
    - [412, 98.3]
  - - [1024, 8192, 1, 512]
    - [393, 102.3]
  - - [1280, 8192, 1, 512]
    - [393, 110.01]
  - - [1536, 8192, 1, 512]
    - [393, 113.77]
  - - [2048, 8192, 1, 512]
    - [393, 120.04]
  - - [2560, 8192, 1, 512]
    - [393, 123.13]
  - - [3072, 8192, 1, 512]
    - [416, 132.92]
  - - [3584, 8192, 1, 512]
    - [393, 128.42]
  - - [4096, 8192, 1, 512]
    - [393, 129.86]
  - - [5120, 8192, 1, 512]
    - [393, 129.19]
  - - [6144, 8192, 1, 512]
    - [415, 128.99]
  - - [7168, 8192, 1, 512]
    - [412, 118.43]
  - - [96, 10240, 1, 512]
    - [404, 44.54]
  - - [112, 10240, 1, 512]
    - [419, 36.51]
  - - [128, 10240, 1, 512]
    - [421, 47.7]
  - - [160, 10240, 1, 512]
    - [423, 62.21]
  - - [192, 10240, 1, 512]
    - [410, 64.03]
  - - [224, 10240, 1, 512]
    - [393, 50.7]
  - - [256, 10240, 1, 512]
    - [421, 61.95]
  - - [320, 10240, 1, 512]
    - [414, 70.64]
  - - [384, 10240, 1, 512]
    - [415, 81.12]
  - - [448, 10240, 1, 512]
    - [415, 81.44]
  - - [512, 10240, 1, 512]
    - [393, 92.36]
  - - [640, 10240, 1, 512]
    - [415, 93.24]
  - - [768, 10240, 1, 512]
    - [422, 98.65]
  - - [1024, 10240, 1, 512]
    - [412, 111.27]
  - - [1280, 10240, 1, 512]
    - [393, 111.11]
  - - [1536, 10240, 1, 512]
    - [415, 121.52]
  - - [2048, 10240, 1, 512]
    - [393, 122.49]
  - - [2560, 10240, 1, 512]
    - [393, 125.06]
  - - [3072, 10240, 1, 512]
    - [393, 129.32]
  - - [3584, 10240, 1, 512]
    - [415, 125.99]
  - - [4096, 10240, 1, 512]
    - [393, 130.57]
  - - [5120, 10240, 1, 512]
    - [415, 131.24]
  - - [6144, 10240, 1, 512]
    - [416, 131.66]
  - - [80, 12288, 1, 512]
    - [386, 28.92]
  - - [96, 12288, 1, 512]
    - [422, 45.98]
  - - [112, 12288, 1, 512]
    - [419, 42.76]
  - - [128, 12288, 1, 512]
    - [417, 50.7]
  - - [160, 12288, 1, 512]
    - [422, 55.39]
  - - [192, 12288, 1, 512]
    - [415, 64.42]
  - - [224, 12288, 1, 512]
    - [415, 68.23]
  - - [256, 12288, 1, 512]
    - [415, 71.78]
  - - [320, 12288, 1, 512]
    - [414, 71.56]
  - - [384, 12288, 1, 512]
    - [419, 92.55]
  - - [448, 12288, 1, 512]
    - [415, 83.19]
  - - [512, 12288, 1, 512]
    - [412, 98.22]
  - - [640, 12288, 1, 512]
    - [393, 97.82]
  - - [768, 12288, 1, 512]
    - [416, 108.95]
  - - [1024, 12288, 1, 512]
    - [393, 113.31]
  - - [1280, 12288, 1, 512]
    - [393, 116.05]
  - - [1536, 12288, 1, 512]
    - [393, 120.5]
  - - [2048, 12288, 1, 512]
    - [393, 124.83]
  - - [2560, 12288, 1, 512]
    - [415, 127.34]
  - - [3072, 12288, 1, 512]
    - [416, 132.6]
  - - [3584, 12288, 1, 512]
    - [393, 131.0]
  - - [4096, 12288, 1, 512]
    - [393, 131.89]
  - - [5120, 12288, 1, 512]
    - [415, 131.29]
  - - [64, 16384, 1, 512]
    - [414, 43.72]
  - - [80, 16384, 1, 512]
    - [424, 38.39]
  - - [96, 16384, 1, 512]
    - [386, 40.4]
  - - [112, 16384, 1, 512]
    - [414, 48.62]
  - - [128, 16384, 1, 512]
    - [423, 54.17]
  - - [160, 16384, 1, 512]
    - [425, 64.1]
  - - [192, 16384, 1, 512]
    - [415, 80.91]
  - - [224, 16384, 1, 512]
    - [427, 65.57]
  - - [256, 16384, 1, 512]
    - [393, 75.16]
  - - [320, 16384, 1, 512]
    - [423, 74.94]
  - - [384, 16384, 1, 512]
    - [419, 89.81]
  - - [448, 16384, 1, 512]
    - [415, 89.05]
  - - [512, 16384, 1, 512]
    - [419, 92.21]
  - - [640, 16384, 1, 512]
    - [419, 96.65]
  - - [768, 16384, 1, 512]
    - [393, 112.67]
  - - [1024, 16384, 1, 512]
    - [393, 115.86]
  - - [1280, 16384, 1, 512]
    - [393, 121.26]
  - - [1536, 16384, 1, 512]
    - [416, 129.62]
  - - [2048, 16384, 1, 512]
    - [393, 128.58]
  - - [2560, 16384, 1, 512]
    - [415, 130.3]
  - - [3072, 16384, 1, 512]
    - [416, 137.16]
  - - [3584, 16384, 1, 512]
    - [393, 133.49]
  - - [48, 20480, 1, 512]
    - [421, 27.73]
  - - [64, 20480, 1, 512]
    - [421, 41.49]
  - - [80, 20480, 1, 512]
    - [426, 29.26]
  - - [96, 20480, 1, 512]
    - [422, 65.31]
  - - [112, 20480, 1, 512]
    - [393, 44.76]
  - - [128, 20480, 1, 512]
    - [393, 58.84]
  - - [160, 20480, 1, 512]
    - [425, 61.25]
  - - [192, 20480, 1, 512]
    - [415, 72.58]
  - - [224, 20480, 1, 512]
    - [415, 69.46]
  - - [256, 20480, 1, 512]
    - [417, 82.42]
  - - [320, 20480, 1, 512]
    - [415, 79.34]
  - - [384, 20480, 1, 512]
    - [422, 96.45]
  - - [448, 20480, 1, 512]
    - [414, 86.88]
  - - [512, 20480, 1, 512]
    - [412, 108.25]
  - - [640, 20480, 1, 512]
    - [393, 107.47]
  - - [768, 20480, 1, 512]
    - [415, 117.26]
  - - [1024, 20480, 1, 512]
    - [393, 119.12]
  - - [1280, 20480, 1, 512]
    - [393, 121.38]
  - - [1536, 20480, 1, 512]
    - [415, 131.12]
  - - [2048, 20480, 1, 512]
    - [393, 129.25]
  - - [2560, 20480, 1, 512]
    - [415, 131.54]
  - - [3072, 20480, 1, 512]
    - [416, 138.12]
  - - [48, 24576, 1, 512]
    - [422, 31.53]
  - - [64, 24576, 1, 512]
    - [422, 35.43]
  - - [80, 24576, 1, 512]
    - [422, 42.24]
  - - [96, 24576, 1, 512]
    - [422, 67.3]
  - - [112, 24576, 1, 512]
    - [393, 50.95]
  - - [128, 24576, 1, 512]
    - [393, 65.97]
  - - [160, 24576, 1, 512]
    - [425, 68.75]
  - - [192, 24576, 1, 512]
    - [415, 85.57]
  - - [224, 24576, 1, 512]
    - [424, 66.24]
  - - [256, 24576, 1, 512]
    - [412, 89.03]
  - - [320, 24576, 1, 512]
    - [414, 82.95]
  - - [384, 24576, 1, 512]
    - [416, 104.02]
  - - [448, 24576, 1, 512]
    - [415, 97.06]
  - - [512, 24576, 1, 512]
    - [415, 98.86]
  - - [640, 24576, 1, 512]
    - [415, 107.65]
  - - [768, 24576, 1, 512]
    - [416, 116.55]
  - - [1024, 24576, 1, 512]
    - [393, 122.41]
  - - [1280, 24576, 1, 512]
    - [393, 125.55]
  - - [1536, 24576, 1, 512]
    - [415, 131.8]
  - - [2048, 24576, 1, 512]
    - [393, 130.75]
  - - [2560, 24576, 1, 512]
    - [393, 132.87]
  - - [32, 32768, 1, 512]
    - [404, 34.26]
  - - [48, 32768, 1, 512]
    - [414, 33.89]
  - - [64, 32768, 1, 512]
    - [414, 44.59]
  - - [80, 32768, 1, 512]
    - [424, 41.79]
  - - [96, 32768, 1, 512]
    - [415, 74.02]
  - - [112, 32768, 1, 512]
    - [415, 51.7]
  - - [128, 32768, 1, 512]
    - [419, 77.39]
  - - [160, 32768, 1, 512]
    - [423, 87.46]
  - - [192, 32768, 1, 512]
    - [415, 88.77]
  - - [224, 32768, 1, 512]
    - [414, 69.64]
  - - [256, 32768, 1, 512]
    - [393, 90.43]
  - - [320, 32768, 1, 512]
    - [423, 95.48]
  - - [384, 32768, 1, 512]
    - [415, 113.14]
  - - [448, 32768, 1, 512]
    - [415, 100.47]
  - - [512, 32768, 1, 512]
    - [393, 110.43]
  - - [640, 32768, 1, 512]
    - [393, 115.42]
