projects/hipsparselt/library/src/hcc_detail/rocsparselt/src/spmm/Tensile/Logic/asm_full/aquavanjaram/gfx942/GridBased/aquavanjaram_Cijk_Ailk_Bljk_B8NSS_BH_Bias_FDMN_SPBML0_A_S_SAV.yaml
- {MinimumRequiredVersion: 5.0.0}
- aquavanjaram
- gfx942
- [Device 0049, Device 0050]
    SolutionIndex: 0
    SolutionNameMin: Cijk_Ailk_Bljk_B8NSS_BH_Bias_FDMN_SPBML0_A_S_SAV_MT256x256x64_MI16x16x1_SN_LDSB0_AFC1_AG0_AFEM1_AFEM1_ASEM8_CLR0_CADS0_DTLA0_DTLB0_DTVA0_DTVB0_DTVMXSA0_DTVMXSB0_DTVSM0_DPLB0_EPS1_ELFLR0_EMLLn1_FDSI0_GRPM1_GRVWA16_GRVWB16_GSUn1_GSUAMBSK_GSUC1_GSUWGMRR1_GLS0_ISA942_IU1_K1_LDSTI0_LBSPPA4096_LBSPPB128_LBSPPM0_LPA64_LPB16_LPM0_LRVWn1_LWPMn1_MIAV0_MIWT4_16_MO40_MGRIPM1_NTn1_NTA0_NTB0_NTC0_NTD4_NTM0_NEPBS16_NLCA1_NLCB1_ONLL1_PGR2_PLR0_PKA1_SGROB0_SIA3_SS1_SU16_SUM0_SUS256_SPO0_SRVW0_SSO0_SVW4_SK0_SKFTR0_SKXCCM0_SGRO0_TDMI0_TIN0_TLDS1_TLDSM1_ULSGRO0_USL1_USLMX0_UIOFGRO0_UPLRP0_USFGROn1_USI0_VSn1_VWA4_VWB4_WSGRA0_WSGRB0_WS64_WG64_4_1_WGM1_WGMXCC1_WGMXCCGn1
    SolutionIndex: 1
    SolutionNameMin: Cijk_Ailk_Bljk_B8NSS_BH_Bias_FDMN_SPBML0_A_S_SAV_MT256x256x64_MI16x16x1_SN_LDSB0_AFC1_AG0_AFEM1_AFEM1_ASEM8_CLR0_CADS0_DTLA0_DTLB0_DTVA0_DTVB0_DTVMXSA0_DTVMXSB0_DTVSM0_DPLB0_EPS1_ELFLR0_EMLLn1_FDSI0_GRPM1_GRVWA16_GRVWB8_GSUn1_GSUAMBSK_GSUC1_GSUWGMRR1_GLS0_ISA942_IU1_K1_LDSTI0_LBSPPA4096_LBSPPB128_LBSPPM0_LPA64_LPB8_LPM0_LRVWn1_LWPMn1_MIAV0_MIWT4_16_MO40_MGRIPM1_NTn1_NTA0_NTB0_NTC0_NTD4_NTM0_NEPBS16_NLCA1_NLCB1_ONLL1_PGR2_PLR0_PKA1_SGROB0_SIA3_SS1_SU16_SUM0_SUS256_SPO0_SRVW0_SSO0_SVW4_SK0_SKFTR0_SKXCCM0_SGRO0_TDMI0_TIN0_TLDS1_TLDSM1_ULSGRO0_USL1_USLMX0_UIOFGRO0_UPLRP0_USFGROn1_USI0_VSn1_VWA4_VWB4_WSGRA0_WSGRB0_WS64_WG64_4_1_WGM8_WGMXCC8_WGMXCCGn1
    SolutionIndex: 2
    SolutionNameMin: Cijk_Ailk_Bljk_B8NSS_BH_Bias_FDMN_SPBML0_A_S_SAV_MT256x256x64_MI16x16x1_SN_LDSB0_AFC1_AG0_AFEM1_AFEM1_ASEM8_CLR0_CADS0_DTLA0_DTLB0_DTVA0_DTVB0_DTVMXSA0_DTVMXSB0_DTVSM0_DPLB0_EPS1_ELFLR0_EMLLn1_FDSI0_GRPM1_GRVWA16_GRVWB16_GSUn1_GSUAMBSK_GSUC1_GSUWGMRR1_GLS0_ISA942_IU1_K1_LDSTI0_LBSPPA4096_LBSPPB128_LBSPPM0_LPA64_LPB16_LPM0_LRVWn1_LWPMn1_MIAV0_MIWT4_16_MO40_MGRIPM1_NTn1_NTA0_NTB0_NTC0_NTD4_NTM0_NEPBS16_NLCA1_NLCB1_ONLL1_PGR2_PLR0_PKA1_SGROB0_SIA3_SS1_SU16_SUM0_SUS256_SPO0_SRVW0_SSO0_SVW4_SK0_SKFTR0_SKXCCM0_SGRO0_TDMI0_TIN0_TLDS1_TLDSM1_ULSGRO0_USL1_USLMX0_UIOFGRO0_UPLRP0_USFGROn1_USI0_VSn1_VWA4_VWB4_WSGRA0_WSGRB0_WS64_WG64_4_1_WGM8_WGMXCC8_WGMXCCGn1
    SolutionIndex: 3
    SolutionNameMin: Cijk_Ailk_Bljk_B8NSS_BH_Bias_FDMN_SPBML0_A_S_SAV_MT256x128x64_MI16x16x1_SN_LDSB1_AFC1_AG0_AFEM1_AFEM1_ASEM8_CLR0_CADS0_DTLA0_DTLB0_DTVA0_DTVB0_DTVMXSA0_DTVMXSB0_DTVSM0_DPLB0_EPS1_ELFLR0_EMLLn1_FDSI0_GRPM1_GRVWA16_GRVWB8_GSUn1_GSUAMBSK_GSUC1_GSUWGMRR1_GLS0_ISA942_IU1_K1_LDSTI0_LBSPPA4096_LBSPPB128_LBSPPM0_LPA64_LPB8_LPM0_LRVWn1_LWPMn1_MIAV0_MIWT4_8_MO40_MGRIPM1_NTn1_NTA0_NTB0_NTC0_NTD4_NTM0_NEPBS16_NLCA1_NLCB1_ONLL1_PGR2_PLR0_PKA1_SGROB0_SIA3_SS1_SU16_SUM0_SUS256_SPO0_SRVW0_SSO0_SVW4_SK0_SKFTR0_SKXCCM0_SGRO0_TDMI0_TIN0_TLDS1_TLDSM1_ULSGRO0_USL1_USLMX0_UIOFGRO0_UPLRP0_USFGROn1_USI0_VSn1_VWA4_VWB2_WSGRA0_WSGRB0_WS64_WG64_4_1_WGM8_WGMXCC8_WGMXCCGn1
    SolutionIndex: 4
    SolutionNameMin: Cijk_Ailk_Bljk_B8NSS_BH_Bias_FDMN_SPBML0_A_S_SAV_MT256x128x64_MI16x16x1_SN_LDSB1_AFC1_AG0_AFEM1_AFEM1_ASEM8_CLR0_CADS0_DTLA0_DTLB0_DTVA0_DTVB0_DTVMXSA0_DTVMXSB0_DTVSM0_DPLB0_EPS1_ELFLR0_EMLLn1_FDSI0_GRPM1_GRVWA16_GRVWB16_GSUn1_GSUAMBSK_GSUC1_GSUWGMRR1_GLS0_ISA942_IU1_K1_LDSTI0_LBSPPA4096_LBSPPB128_LBSPPM0_LPA64_LPB16_LPM0_LRVWn1_LWPMn1_MIAV0_MIWT4_8_MO40_MGRIPM1_NTn1_NTA0_NTB0_NTC0_NTD4_NTM0_NEPBS16_NLCA1_NLCB1_ONLL1_PGR2_PLR0_PKA1_SGROB0_SIA3_SS1_SU16_SUM0_SUS256_SPO0_SRVW0_SSO0_SVW4_SK0_SKFTR0_SKXCCM0_SGRO0_TDMI0_TIN0_TLDS1_TLDSM1_ULSGRO0_USL1_USLMX0_UIOFGRO0_UPLRP0_USFGROn1_USI0_VSn1_VWA4_VWB2_WSGRA0_WSGRB0_WS64_WG64_4_1_WGM8_WGMXCC8_WGMXCCGn1
    SolutionIndex: 5
    SolutionNameMin: Cijk_Ailk_Bljk_B8NSS_BH_Bias_FDMN_SPBML0_A_S_SAV_MT128x256x64_MI16x16x1_SN_LDSB1_AFC1_AG0_AFEM1_AFEM1_ASEM8_CLR0_CADS0_DTLA0_DTLB0_DTVA0_DTVB0_DTVMXSA0_DTVMXSB0_DTVSM0_DPLB0_EPS1_ELFLR0_EMLLn1_FDSI0_GRPM1_GRVWA16_GRVWB16_GSUn1_GSUAMBSK_GSUC1_GSUWGMRR1_GLS0_ISA942_IU1_K1_LDSTI0_LBSPPA2048_LBSPPB128_LBSPPM0_LPA64_LPB16_LPM0_LRVWn1_LWPMn1_MIAV0_MIWT4_8_MO40_MGRIPM1_NTn1_NTA0_NTB0_NTC0_NTD4_NTM0_NEPBS16_NLCA1_NLCB1_ONLL1_PGR2_PLR0_PKA1_SGROB0_SIA3_SS1_SU16_SUM0_SUS256_SPO0_SRVW0_SSO0_SVW4_SK0_SKFTR0_SKXCCM0_SGRO0_TDMI0_TIN0_TLDS1_TLDSM1_ULSGRO0_USL1_USLMX0_UIOFGRO0_UPLRP0_USFGROn1_USI0_VSn1_VWA4_VWB2_WSGRA0_WSGRB0_WS64_WG32_8_1_WGM1_WGMXCC1_WGMXCCGn1
    SolutionIndex: 6
    SolutionNameMin: Cijk_Ailk_Bljk_B8NSS_BH_Bias_FDMN_SPBML0_A_S_SAV_MT128x192x64_MI16x16x1_SN_LDSB1_AFC1_AG0_AFEM1_AFEM1_ASEM8_CLR0_CADS0_DTLA0_DTLB0_DTVA0_DTVB0_DTVMXSA0_DTVMXSB0_DTVSM0_DPLB0_EPS1_ELFLR0_EMLLn1_FDSI0_GRPM1_GRVWA16_GRVWB8_GSUn1_GSUAMBSK_GSUC1_GSUWGMRR1_GLS0_ISA942_IU1_K1_LDSTI0_LBSPPA2048_LBSPPB128_LBSPPM0_LPA32_LPB8_LPM0_LRVWn1_LWPMn1_MIAV0_MIWT2_12_MO40_MGRIPM1_NTn1_NTA0_NTB0_NTC0_NTD4_NTM0_NEPBS16_NLCA1_NLCB1_ONLL1_PGR2_PLR0_PKA1_SGROB0_SIA3_SS1_SU16_SUM0_SUS256_SPO0_SRVW0_SSO0_SVW2_SK0_SKFTR0_SKXCCM0_SGRO0_TDMI0_TIN0_TLDS1_TLDSM1_ULSGRO0_USL1_USLMX0_UIOFGRO0_UPLRP0_USFGROn1_USI0_VSn1_VWA2_VWB2_WSGRA0_WSGRB0_WS64_WG64_4_1_WGM8_WGMXCC8_WGMXCCGn1
    SolutionIndex: 7
    SolutionNameMin: Cijk_Ailk_Bljk_B8NSS_BH_Bias_FDMN_SPBML0_A_S_SAV_MT128x256x64_MI16x16x1_SN_LDSB1_AFC1_AG0_AFEM1_AFEM1_ASEM8_CLR0_CADS0_DTLA0_DTLB0_DTVA0_DTVB0_DTVMXSA0_DTVMXSB0_DTVSM0_DPLB0_EPS1_ELFLR0_EMLLn1_FDSI0_GRPM1_GRVWA16_GRVWB8_GSUn1_GSUAMBSK_GSUC1_GSUWGMRR1_GLS0_ISA942_IU1_K1_LDSTI0_LBSPPA2048_LBSPPB128_LBSPPM0_LPA64_LPB8_LPM0_LRVWn1_LWPMn1_MIAV0_MIWT4_8_MO40_MGRIPM1_NTn1_NTA0_NTB0_NTC0_NTD4_NTM0_NEPBS16_NLCA1_NLCB1_ONLL1_PGR2_PLR0_PKA1_SGROB0_SIA3_SS1_SU16_SUM0_SUS256_SPO0_SRVW0_SSO0_SVW4_SK0_SKFTR0_SKXCCM0_SGRO0_TDMI0_TIN0_TLDS1_TLDSM1_ULSGRO0_USL1_USLMX0_UIOFGRO0_UPLRP0_USFGROn1_USI0_VSn1_VWA4_VWB2_WSGRA0_WSGRB0_WS64_WG32_8_1_WGM1_WGMXCC1_WGMXCCGn1
    SolutionIndex: 8
    SolutionNameMin: Cijk_Ailk_Bljk_B8NSS_BH_Bias_FDMN_SPBML0_A_S_SAV_MT128x256x64_MI16x16x1_SN_LDSB1_AFC1_AG0_AFEM1_AFEM1_ASEM8_CLR0_CADS0_DTLA0_DTLB0_DTVA0_DTVB0_DTVMXSA0_DTVMXSB0_DTVSM0_DPLB0_EPS1_ELFLR0_EMLLn1_FDSI0_GRPM1_GRVWA16_GRVWB8_GSUn1_GSUAMBSK_GSUC1_GSUWGMRR1_GLS0_ISA942_IU1_K1_LDSTI0_LBSPPA2048_LBSPPB128_LBSPPM0_LPA32_LPB8_LPM0_LRVWn1_LWPMn1_MIAV0_MIWT2_16_MO40_MGRIPM1_NTn1_NTA0_NTB0_NTC0_NTD4_NTM0_NEPBS16_NLCA1_NLCB1_ONLL1_PGR2_PLR0_PKA1_SGROB0_SIA3_SS1_SU16_SUM0_SUS256_SPO0_SRVW0_SSO0_SVW2_SK0_SKFTR0_SKXCCM0_SGRO0_TDMI0_TIN0_TLDS1_TLDSM1_ULSGRO0_USL1_USLMX0_UIOFGRO0_UPLRP0_USFGROn1_USI0_VSn1_VWA2_VWB4_WSGRA0_WSGRB0_WS64_WG64_4_1_WGM8_WGMXCC8_WGMXCCGn1
    SolutionIndex: 9
    SolutionNameMin: Cijk_Ailk_Bljk_B8NSS_BH_Bias_FDMN_SPBML0_A_S_SAV_MT128x256x64_MI16x16x1_SN_LDSB1_AFC1_AG0_AFEM1_AFEM1_ASEM8_CLR0_CADS0_DTLA0_DTLB0_DTVA0_DTVB0_DTVMXSA0_DTVMXSB0_DTVSM0_DPLB0_EPS1_ELFLR0_EMLLn1_FDSI0_GRPM1_GRVWA16_GRVWB8_GSUn1_GSUAMBSK_GSUC1_GSUWGMRR1_GLS0_ISA942_IU1_K1_LDSTI0_LBSPPA2048_LBSPPB128_LBSPPM0_LPA64_LPB8_LPM0_LRVWn1_LWPMn1_MIAV0_MIWT4_8_MO40_MGRIPM1_NTn1_NTA0_NTB0_NTC0_NTD4_NTM0_NEPBS16_NLCA1_NLCB1_ONLL1_PGR2_PLR0_PKA1_SGROB0_SIA3_SS1_SU16_SUM0_SUS256_SPO0_SRVW0_SSO0_SVW4_SK0_SKFTR0_SKXCCM0_SGRO0_TDMI0_TIN0_TLDS1_TLDSM1_ULSGRO0_USL1_USLMX0_UIOFGRO0_UPLRP0_USFGROn1_USI0_VSn1_VWA4_VWB2_WSGRA0_WSGRB0_WS64_WG32_8_1_WGM8_WGMXCC8_WGMXCCGn1
    SolutionIndex: 10
    SolutionNameMin: Cijk_Ailk_Bljk_B8NSS_BH_Bias_FDMN_SPBML0_A_S_SAV_MT96x256x64_MI16x16x1_SN_LDSB1_AFC1_AG0_AFEM1_AFEM1_ASEM8_CLR0_CADS0_DTLA0_DTLB0_DTVA0_DTVB0_DTVMXSA0_DTVMXSB0_DTVSM0_DPLB0_EPS1_ELFLR0_EMLLn1_FDSI0_GRPM1_GRVWA4_GRVWB8_GSUn1_GSUAMBSK_GSUC1_GSUWGMRR1_GLS0_ISA942_IU1_K1_LDSTI0_LBSPPA1536_LBSPPB128_LBSPPM0_LPA16_LPB8_LPM0_LRVWn1_LWPMn1_MIAV0_MIWT3_8_MO40_MGRIPM1_NTn1_NTA0_NTB0_NTC0_NTD4_NTM0_NEPBS16_NLCA3_NLCB1_ONLL1_PGR2_PLR0_PKA1_SGROB0_SIA3_SS1_SU16_SUM0_SUS256_SPO0_SRVW0_SSO0_SVW1_SK0_SKFTR0_SKXCCM0_SGRO0_TDMI0_TIN0_TLDS1_TLDSM1_ULSGRO0_USL1_USLMX0_UIOFGRO0_UPLRP0_USFGROn1_USI0_VSn1_VWA1_VWB2_WSGRA0_WSGRB0_WS64_WG32_8_1_WGM8_WGMXCC8_WGMXCCGn1
    SolutionIndex: 11
    SolutionNameMin: Cijk_Ailk_Bljk_B8NSS_BH_Bias_FDMN_SPBML0_A_S_SAV_MT80x320x64_MI16x16x1_SN_LDSB1_AFC1_AG0_AFEM1_AFEM1_ASEM8_CLR0_CADS0_DTLA0_DTLB0_DTVA0_DTVB0_DTVMXSA0_DTVMXSB0_DTVSM0_DPLB0_EPS1_ELFLR0_EMLLn1_FDSI0_GRPM1_GRVWA4_GRVWB8_GSUn1_GSUAMBSK_GSUC1_GSUWGMRR1_GLS0_ISA942_IU1_K1_LDSTI0_LBSPPA1280_LBSPPB128_LBSPPM0_LPA16_LPB8_LPM0_LRVWn1_LWPMn1_MIAV0_MIWT5_5_MO40_MGRIPM1_NTn1_NTA0_NTB0_NTC0_NTD4_NTM0_NEPBS16_NLCA5_NLCB1_ONLL1_PGR2_PLR0_PKA1_SGROB0_SIA3_SS1_SU16_SUM0_SUS256_SPO0_SRVW0_SSO0_SVW1_SK0_SKFTR0_SKXCCM0_SGRO0_TDMI0_TIN0_TLDS1_TLDSM1_ULSGRO0_USL1_USLMX0_UIOFGRO0_UPLRP0_USFGROn1_USI0_VSn1_VWA1_VWB1_WSGRA0_WSGRB0_WS64_WG16_16_1_WGM8_WGMXCC8_WGMXCCGn1
    SolutionIndex: 12
    SolutionNameMin: Cijk_Ailk_Bljk_B8NSS_BH_Bias_FDMN_SPBML0_A_S_SAV_MT160x128x64_MI16x16x1_SN_LDSB0_AFC1_AG0_AFEM1_AFEM1_ASEM8_CLR0_CADS0_DTLA0_DTLB0_DTVA0_DTVB0_DTVMXSA0_DTVMXSB0_DTVSM0_DPLB0_EPS1_ELFLR0_EMLLn1_FDSI0_GRPM1_GRVWA4_GRVWB8_GSUn1_GSUAMBSK_GSUC1_GSUWGMRR1_GLS0_ISA942_IU1_K1_LDSTI0_LBSPPA2560_LBSPPB128_LBSPPM0_LPA16_LPB8_LPM0_LRVWn1_LWPMn1_MIAV0_MIWT5_4_MO40_MGRIPM1_NTn1_NTA0_NTB0_NTC0_NTD4_NTM0_NEPBS16_NLCA5_NLCB1_ONLL1_PGR2_PLR0_PKA1_SGROB0_SIA3_SS1_SU16_SUM0_SUS256_SPO0_SRVW0_SSO0_SVW1_SK0_SKFTR0_SKXCCM0_SGRO0_TDMI0_TIN0_TLDS1_TLDSM1_ULSGRO0_USL1_USLMX0_UIOFGRO0_UPLRP0_USFGROn1_USI0_VSn1_VWA1_VWB2_WSGRA0_WSGRB0_WS64_WG32_8_1_WGM8_WGMXCC8_WGMXCCGn1
    SolutionIndex: 13
    SolutionNameMin: Cijk_Ailk_Bljk_B8NSS_BH_Bias_FDMN_SPBML0_A_S_SAV_MT80x256x64_MI16x16x1_SN_LDSB0_AFC1_AG0_AFEM1_AFEM1_ASEM8_CLR0_CADS0_DTLA0_DTLB0_DTVA0_DTVB0_DTVMXSA0_DTVMXSB0_DTVSM0_DPLB0_EPS1_ELFLR0_EMLLn1_FDSI0_GRPM1_GRVWA4_GRVWB8_GSUn1_GSUAMBSK_GSUC1_GSUWGMRR1_GLS0_ISA942_IU1_K1_LDSTI0_LBSPPA1280_LBSPPB128_LBSPPM0_LPA16_LPB8_LPM0_LRVWn1_LWPMn1_MIAV0_MIWT5_4_MO40_MGRIPM1_NTn1_NTA0_NTB0_NTC0_NTD4_NTM0_NEPBS16_NLCA5_NLCB1_ONLL1_PGR2_PLR0_PKA1_SGROB0_SIA3_SS1_SU16_SUM0_SUS256_SPO0_SRVW0_SSO0_SVW1_SK0_SKFTR0_SKXCCM0_SGRO0_TDMI0_TIN0_TLDS1_TLDSM1_ULSGRO0_USL1_USLMX0_UIOFGRO0_UPLRP0_USFGROn1_USI0_VSn1_VWA1_VWB2_WSGRA0_WSGRB0_WS64_WG16_16_1_WGM8_WGMXCC8_WGMXCCGn1
    SolutionIndex: 14
    SolutionNameMin: Cijk_Ailk_Bljk_B8NSS_BH_Bias_FDMN_SPBML0_A_S_SAV_MT80x256x64_MI16x16x1_SN_LDSB1_AFC1_AG0_AFEM1_AFEM1_ASEM8_CLR0_CADS0_DTLA0_DTLB0_DTVA0_DTVB0_DTVMXSA0_DTVMXSB0_DTVSM0_DPLB0_EPS1_ELFLR0_EMLLn1_FDSI0_GRPM1_GRVWA4_GRVWB16_GSUn1_GSUAMBSK_GSUC1_GSUWGMRR1_GLS0_ISA942_IU1_K1_LDSTI0_LBSPPA1280_LBSPPB128_LBSPPM0_LPA16_LPB16_LPM0_LRVWn1_LWPMn1_MIAV0_MIWT5_4_MO40_MGRIPM1_NTn1_NTA0_NTB0_NTC0_NTD4_NTM0_NEPBS16_NLCA5_NLCB1_ONLL1_PGR2_PLR0_PKA1_SGROB0_SIA3_SS1_SU16_SUM0_SUS256_SPO0_SRVW0_SSO0_SVW1_SK0_SKFTR0_SKXCCM0_SGRO0_TDMI0_TIN0_TLDS1_TLDSM1_ULSGRO0_USL1_USLMX0_UIOFGRO0_UPLRP0_USFGROn1_USI0_VSn1_VWA1_VWB2_WSGRA0_WSGRB0_WS64_WG16_16_1_WGM8_WGMXCC8_WGMXCCGn1
    SolutionIndex: 15
    SolutionNameMin: Cijk_Ailk_Bljk_B8NSS_BH_Bias_FDMN_SPBML0_A_S_SAV_MT128x256x64_MI16x16x1_SN_LDSB1_AFC1_AG0_AFEM1_AFEM1_ASEM8_CLR0_CADS0_DTLA0_DTLB0_DTVA0_DTVB0_DTVMXSA0_DTVMXSB0_DTVSM0_DPLB0_EPS1_ELFLR0_EMLLn1_FDSI0_GRPM1_GRVWA16_GRVWB16_GSUn1_GSUAMBSK_GSUC1_GSUWGMRR1_GLS0_ISA942_IU1_K1_LDSTI0_LBSPPA2048_LBSPPB128_LBSPPM0_LPA64_LPB16_LPM0_LRVWn1_LWPMn1_MIAV0_MIWT4_8_MO40_MGRIPM1_NTn1_NTA0_NTB0_NTC0_NTD4_NTM0_NEPBS16_NLCA1_NLCB1_ONLL1_PGR2_PLR0_PKA1_SGROB0_SIA3_SS1_SU16_SUM0_SUS256_SPO0_SRVW0_SSO0_SVW4_SK0_SKFTR0_SKXCCM0_SGRO0_TDMI0_TIN0_TLDS1_TLDSM1_ULSGRO0_USL1_USLMX0_UIOFGRO0_UPLRP0_USFGROn1_USI0_VSn1_VWA4_VWB2_WSGRA0_WSGRB0_WS64_WG32_8_1_WGM8_WGMXCC8_WGMXCCGn1
    SolutionIndex: 16
    SolutionNameMin: Cijk_Ailk_Bljk_B8NSS_BH_Bias_FDMN_SPBML0_A_S_SAV_MT16x16x128_MI16x16x1_SN_LDSB0_AFC1_AG0_AFEM1_AFEM1_ASEM8_CLR1_CADS0_DTLA0_DTLB0_DTVA0_DTVB0_DTVMXSA0_DTVMXSB0_DTVSM0_DPLB0_EPS1_ELFLR0_EMLLn1_FDSI0_GRPM1_GRVWA4_GRVWB16_GSUn1_GSUAMBSK_GSUC1_GSUWGMRR1_GLS0_ISA942_IU1_K1_LDSTI0_LBSPPA256_LBSPPB128_LBSPPM0_LPA16_LPB16_LPM0_LRVWn1_LWPMn1_MIAV0_MIWT1_1_MO40_MGRIPM1_NTn1_NTA0_NTB0_NTC0_NTD4_NTM0_NEPBS16_NLCA1_NLCB1_ONLL1_PGR2_PLR1_PKA1_SGROB0_SIA3_SS1_SU16_SUM0_SUS256_SPO0_SRVW0_SSO0_SVW1_SK0_SKFTR0_SKXCCM0_SGRO0_TDMI0_TIN0_TLDS1_TLDSM1_ULSGRO0_USL1_USLMX0_UIOFGRO0_UPLRP0_USFGROn1_USI0_VSn1_VWA1_VWB1_WSGRA0_WSGRB0_WS64_WG16_4_1_WGM1_WGMXCC1_WGMXCCGn1
    SolutionIndex: 17
    SolutionNameMin: Cijk_Ailk_Bljk_B8NSS_BH_Bias_FDMN_SPBML0_A_S_SAV_MT256x256x64_MI16x16x1_SN_LDSB0_AFC1_AG0_AFEM1_AFEM1_ASEM8_CLR0_CADS0_DTLA0_DTLB0_DTVA0_DTVB0_DTVMXSA0_DTVMXSB0_DTVSM0_DPLB0_EPS1_ELFLR0_EMLLn1_FDSI0_GRPM1_GRVWA4_GRVWB16_GSUn1_GSUAMBSK_GSUC1_GSUWGMRR1_GLS0_ISA942_IU1_K1_LDSTI0_LBSPPA4096_LBSPPB128_LBSPPM0_LPA64_LPB16_LPM0_LRVWn1_LWPMn1_MIAV0_MIWT4_16_MO40_MGRIPM1_NTn1_NTA0_NTB0_NTC0_NTD4_NTM0_NEPBS16_NLCA1_NLCB1_ONLL1_PGR2_PLR0_PKA1_SGROB0_SIA3_SS1_SU16_SUM0_SUS256_SPO0_SRVW0_SSO0_SVW4_SK0_SKFTR0_SKXCCM0_SGRO0_TDMI0_TIN0_TLDS1_TLDSM1_ULSGRO0_USL1_USLMX0_UIOFGRO0_UPLRP0_USFGROn1_USI0_VSn1_VWA4_VWB4_WSGRA0_WSGRB0_WS64_WG64_4_1_WGM8_WGMXCC8_WGMXCCGn1
    SolutionIndex: 18
    SolutionNameMin: Cijk_Ailk_Bljk_B8NSS_BH_Bias_FDMN_SPBML0_A_S_SAV_MT256x256x64_MI16x16x1_SN_LDSB0_AFC1_AG0_AFEM1_AFEM1_ASEM8_CLR0_CADS0_DTLA0_DTLB0_DTVA0_DTVB0_DTVMXSA0_DTVMXSB0_DTVSM0_DPLB0_EPS1_ELFLR0_EMLLn1_FDSI0_GRPM1_GRVWA4_GRVWB8_GSUn1_GSUAMBSK_GSUC1_GSUWGMRR1_GLS0_ISA942_IU1_K1_LDSTI0_LBSPPA4096_LBSPPB128_LBSPPM0_LPA64_LPB8_LPM0_LRVWn1_LWPMn1_MIAV0_MIWT4_16_MO40_MGRIPM1_NTn1_NTA0_NTB0_NTC0_NTD4_NTM0_NEPBS16_NLCA1_NLCB1_ONLL1_PGR2_PLR0_PKA1_SGROB0_SIA3_SS1_SU16_SUM0_SUS256_SPO0_SRVW0_SSO0_SVW4_SK0_SKFTR0_SKXCCM0_SGRO0_TDMI0_TIN0_TLDS1_TLDSM1_ULSGRO0_USL1_USLMX0_UIOFGRO0_UPLRP0_USFGROn1_USI0_VSn1_VWA4_VWB4_WSGRA0_WSGRB0_WS64_WG64_4_1_WGM8_WGMXCC8_WGMXCCGn1
    SolutionIndex: 19
    SolutionNameMin: Cijk_Ailk_Bljk_B8NSS_BH_Bias_FDMN_SPBML0_A_S_SAV_MT192x256x128_MI16x16x1_SN_LDSB1_AFC1_AG0_AFEM1_AFEM1_ASEM8_CLR1_CADS0_DTLA0_DTLB0_DTVA0_DTVB0_DTVMXSA0_DTVMXSB0_DTVSM0_DPLB0_EPS1_ELFLR0_EMLLn1_FDSI0_GRPM1_GRVWA16_GRVWB16_GSUn1_GSUAMBSK_GSUC1_GSUWGMRR1_GLS0_ISA942_IU1_K1_LDSTI0_LBSPPA3072_LBSPPB128_LBSPPM0_LPA32_LPB16_LPM0_LRVWn1_LWPMn1_MIAV0_MIWT6_8_MO40_MGRIPM1_NTn1_NTA0_NTB0_NTC0_NTD4_NTM0_NEPBS16_NLCA3_NLCB1_ONLL1_PGR2_PLR1_PKA1_SGROB0_SIA3_SS1_SU16_SUM0_SUS256_SPO0_SRVW0_SSO0_SVW2_SK0_SKFTR0_SKXCCM0_SGRO0_TDMI0_TIN0_TLDS1_TLDSM1_ULSGRO0_USL1_USLMX0_UIOFGRO0_UPLRP0_USFGROn1_USI0_VSn1_VWA2_VWB2_WSGRA0_WSGRB0_WS64_WG32_8_1_WGM8_WGMXCC8_WGMXCCGn1
    SolutionIndex: 20
    SolutionNameMin: Cijk_Ailk_Bljk_B8NSS_BH_Bias_FDMN_SPBML0_A_S_SAV_MT256x224x128_MI16x16x1_SN_LDSB1_AFC1_AG0_AFEM1_AFEM1_ASEM8_CLR1_CADS0_DTLA0_DTLB0_DTVA0_DTVB0_DTVMXSA0_DTVMXSB0_DTVSM0_DPLB0_EPS1_ELFLR0_EMLLn1_FDSI0_GRPM1_GRVWA4_GRVWB8_GSUn1_GSUAMBSK_GSUC1_GSUWGMRR1_GLS0_ISA942_IU1_K1_LDSTI0_LBSPPA4096_LBSPPB128_LBSPPM0_LPA64_LPB8_LPM0_LRVWn1_LWPMn1_MIAV0_MIWT4_14_MO40_MGRIPM1_NTn1_NTA0_NTB0_NTC0_NTD4_NTM0_NEPBS16_NLCA1_NLCB1_ONLL1_PGR2_PLR1_PKA1_SGROB0_SIA3_SS1_SU16_SUM0_SUS256_SPO0_SRVW0_SSO0_SVW4_SK0_SKFTR0_SKXCCM0_SGRO0_TDMI0_TIN0_TLDS1_TLDSM1_ULSGRO0_USL1_USLMX0_UIOFGRO0_UPLRP0_USFGROn1_USI0_VSn1_VWA4_VWB2_WSGRA0_WSGRB0_WS64_WG64_4_1_WGM8_WGMXCC8_WGMXCCGn1
    SolutionIndex: 21
    SolutionNameMin: Cijk_Ailk_Bljk_B8NSS_BH_Bias_FDMN_SPBML0_A_S_SAV_MT128x256x128_MI16x16x1_SN_LDSB1_AFC1_AG0_AFEM1_AFEM1_ASEM8_CLR1_CADS0_DTLA0_DTLB0_DTVA0_DTVB0_DTVMXSA0_DTVMXSB0_DTVSM0_DPLB0_EPS1_ELFLR0_EMLLn1_FDSI0_GRPM1_GRVWA16_GRVWB16_GSUn1_GSUAMBSK_GSUC1_GSUWGMRR1_GLS0_ISA942_IU1_K1_LDSTI0_LBSPPA2048_LBSPPB128_LBSPPM0_LPA64_LPB16_LPM0_LRVWn1_LWPMn1_MIAV0_MIWT4_8_MO40_MGRIPM1_NTn1_NTA0_NTB0_NTC0_NTD4_NTM0_NEPBS16_NLCA1_NLCB1_ONLL1_PGR2_PLR1_PKA1_SGROB0_SIA3_SS1_SU16_SUM0_SUS256_SPO0_SRVW0_SSO0_SVW4_SK0_SKFTR0_SKXCCM0_SGRO0_TDMI0_TIN0_TLDS1_TLDSM1_ULSGRO0_USL1_USLMX0_UIOFGRO0_UPLRP0_USFGROn1_USI0_VSn1_VWA4_VWB2_WSGRA0_WSGRB0_WS64_WG32_8_1_WGM8_WGMXCC8_WGMXCCGn1
    SolutionIndex: 22
    SolutionNameMin: Cijk_Ailk_Bljk_B8NSS_BH_Bias_FDMN_SPBML0_A_S_SAV_MT320x128x64_MI16x16x1_SN_LDSB0_AFC1_AG0_AFEM1_AFEM1_ASEM8_CLR0_CADS0_DTLA0_DTLB0_DTVA0_DTVB0_DTVMXSA0_DTVMXSB0_DTVSM0_DPLB0_EPS1_ELFLR0_EMLLn1_FDSI0_GRPM1_GRVWA16_GRVWB8_GSUn1_GSUAMBSK_GSUC1_GSUWGMRR1_GLS0_ISA942_IU1_K1_LDSTI0_LBSPPA5120_LBSPPB128_LBSPPM0_LPA16_LPB8_LPM0_LRVWn1_LWPMn1_MIAV0_MIWT5_8_MO40_MGRIPM1_NTn1_NTA0_NTB0_NTC0_NTD4_NTM0_NEPBS16_NLCA5_NLCB1_ONLL1_PGR2_PLR0_PKA1_SGROB0_SIA3_SS1_SU16_SUM0_SUS256_SPO0_SRVW0_SSO0_SVW1_SK0_SKFTR0_SKXCCM0_SGRO0_TDMI0_TIN0_TLDS1_TLDSM1_ULSGRO0_USL1_USLMX0_UIOFGRO0_UPLRP0_USFGROn1_USI0_VSn1_VWA1_VWB2_WSGRA0_WSGRB0_WS64_WG64_4_1_WGM8_WGMXCC8_WGMXCCGn1
    SolutionIndex: 23
    SolutionNameMin: Cijk_Ailk_Bljk_B8NSS_BH_Bias_FDMN_SPBML0_A_S_SAV_MT256x192x128_MI16x16x1_SN_LDSB1_AFC1_AG0_AFEM1_AFEM1_ASEM8_CLR1_CADS0_DTLA0_DTLB0_DTVA0_DTVB0_DTVMXSA0_DTVMXSB0_DTVSM0_DPLB0_EPS1_ELFLR0_EMLLn1_FDSI0_GRPM1_GRVWA16_GRVWB8_GSUn1_GSUAMBSK_GSUC1_GSUWGMRR1_GLS0_ISA942_IU1_K1_LDSTI0_LBSPPA4096_LBSPPB128_LBSPPM0_LPA64_LPB8_LPM0_LRVWn1_LWPMn1_MIAV0_MIWT4_12_MO40_MGRIPM1_NTn1_NTA0_NTB0_NTC0_NTD4_NTM0_NEPBS16_NLCA1_NLCB1_ONLL1_PGR2_PLR1_PKA1_SGROB0_SIA3_SS1_SU16_SUM0_SUS256_SPO0_SRVW0_SSO0_SVW4_SK0_SKFTR0_SKXCCM0_SGRO0_TDMI0_TIN0_TLDS1_TLDSM1_ULSGRO0_USL1_USLMX0_UIOFGRO0_UPLRP0_USFGROn1_USI0_VSn1_VWA4_VWB2_WSGRA0_WSGRB0_WS64_WG64_4_1_WGM8_WGMXCC8_WGMXCCGn1
    SolutionIndex: 24
    SolutionNameMin: Cijk_Ailk_Bljk_B8NSS_BH_Bias_FDMN_SPBML0_A_S_SAV_MT384x128x64_MI16x16x1_SN_LDSB0_AFC1_AG0_AFEM1_AFEM1_ASEM8_CLR0_CADS0_DTLA0_DTLB0_DTVA0_DTVB0_DTVMXSA0_DTVMXSB0_DTVSM0_DPLB0_EPS1_ELFLR0_EMLLn1_FDSI0_GRPM1_GRVWA16_GRVWB16_GSUn1_GSUAMBSK_GSUC1_GSUWGMRR1_GLS0_ISA942_IU1_K1_LDSTI0_LBSPPA6144_LBSPPB128_LBSPPM0_LPA32_LPB16_LPM0_LRVWn1_LWPMn1_MIAV0_MIWT6_8_MO40_MGRIPM1_NTn1_NTA0_NTB0_NTC0_NTD4_NTM0_NEPBS16_NLCA3_NLCB1_ONLL1_PGR2_PLR0_PKA1_SGROB0_SIA3_SS1_SU16_SUM0_SUS256_SPO0_SRVW0_SSO0_SVW2_SK0_SKFTR0_SKXCCM0_SGRO0_TDMI0_TIN0_TLDS1_TLDSM1_ULSGRO0_USL1_USLMX0_UIOFGRO0_UPLRP0_USFGROn1_USI0_VSn1_VWA2_VWB2_WSGRA0_WSGRB0_WS64_WG64_4_1_WGM1_WGMXCC1_WGMXCCGn1
    SolutionIndex: 25
    SolutionNameMin: Cijk_Ailk_Bljk_B8NSS_BH_Bias_FDMN_SPBML0_A_S_SAV_MT256x128x64_MI16x16x1_SN_LDSB1_AFC1_AG0_AFEM1_AFEM1_ASEM8_CLR0_CADS0_DTLA0_DTLB0_DTVA0_DTVB0_DTVMXSA0_DTVMXSB0_DTVSM0_DPLB0_EPS1_ELFLR0_EMLLn1_FDSI0_GRPM1_GRVWA4_GRVWB8_GSUn1_GSUAMBSK_GSUC1_GSUWGMRR1_GLS0_ISA942_IU1_K1_LDSTI0_LBSPPA4096_LBSPPB128_LBSPPM0_LPA64_LPB8_LPM0_LRVWn1_LWPMn1_MIAV0_MIWT4_8_MO40_MGRIPM1_NTn1_NTA0_NTB0_NTC0_NTD4_NTM0_NEPBS16_NLCA1_NLCB1_ONLL1_PGR2_PLR0_PKA1_SGROB0_SIA3_SS1_SU16_SUM0_SUS256_SPO0_SRVW0_SSO0_SVW4_SK0_SKFTR0_SKXCCM0_SGRO0_TDMI0_TIN0_TLDS1_TLDSM1_ULSGRO0_USL1_USLMX0_UIOFGRO0_UPLRP0_USFGROn1_USI0_VSn1_VWA4_VWB2_WSGRA0_WSGRB0_WS64_WG64_4_1_WGM8_WGMXCC8_WGMXCCGn1
    SolutionIndex: 26
    SolutionNameMin: Cijk_Ailk_Bljk_B8NSS_BH_Bias_FDMN_SPBML0_A_S_SAV_MT128x160x128_MI16x16x1_SN_LDSB1_AFC1_AG0_AFEM1_AFEM1_ASEM8_CLR1_CADS0_DTLA0_DTLB0_DTVA0_DTVB0_DTVMXSA0_DTVMXSB0_DTVSM0_DPLB0_EPS1_ELFLR0_EMLLn1_FDSI0_GRPM1_GRVWA16_GRVWB8_GSUn1_GSUAMBSK_GSUC1_GSUWGMRR1_GLS0_ISA942_IU1_K1_LDSTI0_LBSPPA2048_LBSPPB128_LBSPPM0_LPA64_LPB8_LPM0_LRVWn1_LWPMn1_MIAV0_MIWT4_5_MO40_MGRIPM1_NTn1_NTA0_NTB0_NTC0_NTD4_NTM0_NEPBS16_NLCA1_NLCB1_ONLL1_PGR2_PLR1_PKA1_SGROB0_SIA3_SS1_SU16_SUM0_SUS256_SPO0_SRVW0_SSO0_SVW4_SK0_SKFTR0_SKXCCM0_SGRO0_TDMI0_TIN0_TLDS1_TLDSM1_ULSGRO0_USL1_USLMX0_UIOFGRO0_UPLRP0_USFGROn1_USI0_VSn1_VWA4_VWB1_WSGRA0_WSGRB0_WS64_WG32_8_1_WGM8_WGMXCC8_WGMXCCGn1
    SolutionIndex: 27
    SolutionNameMin: Cijk_Ailk_Bljk_B8NSS_BH_Bias_FDMN_SPBML0_A_S_SAV_MT192x320x128_MI16x16x1_SN_LDSB1_AFC1_AG0_AFEM1_AFEM1_ASEM8_CLR1_CADS0_DTLA0_DTLB0_DTVA0_DTVB0_DTVMXSA0_DTVMXSB0_DTVSM0_DPLB0_EPS1_ELFLR0_EMLLn1_FDSI0_GRPM1_GRVWA16_GRVWB16_GSUn1_GSUAMBSK_GSUC1_GSUWGMRR1_GLS0_ISA942_IU1_K1_LDSTI0_LBSPPA3072_LBSPPB128_LBSPPM0_LPA64_LPB16_LPM0_LRVWn1_LWPMn1_MIAV0_MIWT12_5_MO40_MGRIPM1_NTn1_NTA0_NTB0_NTC0_NTD4_NTM0_NEPBS16_NLCA3_NLCB1_ONLL1_PGR2_PLR1_PKA1_SGROB0_SIA3_SS1_SU16_SUM0_SUS256_SPO0_SRVW0_SSO0_SVW4_SK0_SKFTR0_SKXCCM0_SGRO0_TDMI0_TIN0_TLDS1_TLDSM1_ULSGRO0_USL1_USLMX0_UIOFGRO0_UPLRP0_USFGROn1_USI0_VSn1_VWA4_VWB1_WSGRA0_WSGRB0_WS64_WG16_16_1_WGM8_WGMXCC8_WGMXCCGn1
    SolutionIndex: 28
    SolutionNameMin: Cijk_Ailk_Bljk_B8NSS_BH_Bias_FDMN_SPBML0_A_S_SAV_MT160x192x128_MI16x16x1_SN_LDSB1_AFC1_AG0_AFEM1_AFEM1_ASEM8_CLR1_CADS0_DTLA0_DTLB0_DTVA0_DTVB0_DTVMXSA0_DTVMXSB0_DTVSM0_DPLB0_EPS1_ELFLR0_EMLLn1_FDSI0_GRPM1_GRVWA16_GRVWB16_GSUn1_GSUAMBSK_GSUC1_GSUWGMRR1_GLS0_ISA942_IU1_K1_LDSTI0_LBSPPA2560_LBSPPB128_LBSPPM0_LPA16_LPB16_LPM0_LRVWn1_LWPMn1_MIAV0_MIWT5_6_MO40_MGRIPM1_NTn1_NTA0_NTB0_NTC0_NTD4_NTM0_NEPBS16_NLCA5_NLCB1_ONLL1_PGR2_PLR1_PKA1_SGROB0_SIA3_SS1_SU16_SUM0_SUS256_SPO0_SRVW0_SSO0_SVW1_SK0_SKFTR0_SKXCCM0_SGRO0_TDMI0_TIN0_TLDS1_TLDSM1_ULSGRO0_USL1_USLMX0_UIOFGRO0_UPLRP0_USFGROn1_USI0_VSn1_VWA1_VWB2_WSGRA0_WSGRB0_WS64_WG32_8_1_WGM1_WGMXCC1_WGMXCCGn1
    SolutionIndex: 29
    SolutionNameMin: Cijk_Ailk_Bljk_B8NSS_BH_Bias_FDMN_SPBML0_A_S_SAV_MT192x320x128_MI16x16x1_SN_LDSB1_AFC1_AG0_AFEM1_AFEM1_ASEM8_CLR1_CADS0_DTLA0_DTLB0_DTVA0_DTVB0_DTVMXSA0_DTVMXSB0_DTVSM0_DPLB0_EPS1_ELFLR0_EMLLn1_FDSI0_GRPM1_GRVWA16_GRVWB16_GSUn1_GSUAMBSK_GSUC1_GSUWGMRR1_GLS0_ISA942_IU1_K1_LDSTI0_LBSPPA3072_LBSPPB128_LBSPPM0_LPA32_LPB16_LPM0_LRVWn1_LWPMn1_MIAV0_MIWT6_10_MO40_MGRIPM1_NTn1_NTA0_NTB0_NTC0_NTD4_NTM0_NEPBS16_NLCA3_NLCB1_ONLL1_PGR2_PLR1_PKA1_SGROB0_SIA3_SS1_SU16_SUM0_SUS256_SPO0_SRVW0_SSO0_SVW2_SK0_SKFTR0_SKXCCM0_SGRO0_TDMI0_TIN0_TLDS1_TLDSM1_ULSGRO0_USL1_USLMX0_UIOFGRO0_UPLRP0_USFGROn1_USI0_VSn1_VWA2_VWB2_WSGRA0_WSGRB0_WS64_WG32_8_1_WGM8_WGMXCC8_WGMXCCGn1
    SolutionIndex: 30
    SolutionNameMin: Cijk_Ailk_Bljk_B8NSS_BH_Bias_FDMN_SPBML0_A_S_SAV_MT128x128x128_MI16x16x1_SN_LDSB1_AFC1_AG0_AFEM1_AFEM1_ASEM8_CLR1_CADS0_DTLA0_DTLB0_DTVA0_DTVB0_DTVMXSA0_DTVMXSB0_DTVSM0_DPLB0_EPS1_ELFLR0_EMLLn1_FDSI0_GRPM1_GRVWA16_GRVWB16_GSUn1_GSUAMBSK_GSUC1_GSUWGMRR1_GLS0_ISA942_IU1_K1_LDSTI0_LBSPPA2048_LBSPPB128_LBSPPM0_LPA64_LPB16_LPM0_LRVWn1_LWPMn1_MIAV0_MIWT4_4_MO40_MGRIPM1_NTn1_NTA0_NTB0_NTC0_NTD4_NTM0_NEPBS16_NLCA1_NLCB1_ONLL1_PGR2_PLR1_PKA1_SGROB0_SIA3_SS1_SU16_SUM0_SUS256_SPO0_SRVW0_SSO0_SVW4_SK0_SKFTR0_SKXCCM0_SGRO0_TDMI0_TIN0_TLDS1_TLDSM1_ULSGRO0_USL1_USLMX0_UIOFGRO0_UPLRP0_USFGROn1_USI0_VSn1_VWA4_VWB2_WSGRA0_WSGRB0_WS64_WG32_8_1_WGM8_WGMXCC8_WGMXCCGn1
    SolutionIndex: 31
    SolutionNameMin: Cijk_Ailk_Bljk_B8NSS_BH_Bias_FDMN_SPBML0_A_S_SAV_MT128x128x128_MI16x16x1_SN_LDSB1_AFC1_AG0_AFEM1_AFEM1_ASEM8_CLR1_CADS0_DTLA0_DTLB0_DTVA0_DTVB0_DTVMXSA0_DTVMXSB0_DTVSM0_DPLB0_EPS1_ELFLR0_EMLLn1_FDSI0_GRPM1_GRVWA16_GRVWB8_GSUn1_GSUAMBSK_GSUC1_GSUWGMRR1_GLS0_ISA942_IU1_K1_LDSTI0_LBSPPA2048_LBSPPB128_LBSPPM0_LPA64_LPB8_LPM0_LRVWn1_LWPMn1_MIAV0_MIWT4_4_MO40_MGRIPM1_NTn1_NTA0_NTB0_NTC0_NTD4_NTM0_NEPBS16_NLCA1_NLCB1_ONLL1_PGR2_PLR1_PKA1_SGROB0_SIA3_SS1_SU16_SUM0_SUS256_SPO0_SRVW0_SSO0_SVW4_SK0_SKFTR0_SKXCCM0_SGRO0_TDMI0_TIN0_TLDS1_TLDSM1_ULSGRO0_USL1_USLMX0_UIOFGRO0_UPLRP0_USFGROn1_USI0_VSn1_VWA4_VWB2_WSGRA0_WSGRB0_WS64_WG32_8_1_WGM8_WGMXCC8_WGMXCCGn1
    SolutionIndex: 32
    SolutionNameMin: Cijk_Ailk_Bljk_B8NSS_BH_Bias_FDMN_SPBML0_A_S_SAV_MT128x160x128_MI16x16x1_SN_LDSB1_AFC1_AG0_AFEM1_AFEM1_ASEM8_CLR1_CADS0_DTLA0_DTLB0_DTVA0_DTVB0_DTVMXSA0_DTVMXSB0_DTVSM0_DPLB0_EPS1_ELFLR0_EMLLn1_FDSI0_GRPM1_GRVWA4_GRVWB8_GSUn1_GSUAMBSK_GSUC1_GSUWGMRR1_GLS0_ISA942_IU1_K1_LDSTI0_LBSPPA2048_LBSPPB128_LBSPPM0_LPA64_LPB8_LPM0_LRVWn1_LWPMn1_MIAV0_MIWT4_5_MO40_MGRIPM1_NTn1_NTA0_NTB0_NTC0_NTD4_NTM0_NEPBS16_NLCA1_NLCB1_ONLL1_PGR2_PLR1_PKA1_SGROB0_SIA3_SS1_SU16_SUM0_SUS256_SPO0_SRVW0_SSO0_SVW4_SK0_SKFTR0_SKXCCM0_SGRO0_TDMI0_TIN0_TLDS1_TLDSM1_ULSGRO0_USL1_USLMX0_UIOFGRO0_UPLRP0_USFGROn1_USI0_VSn1_VWA4_VWB1_WSGRA0_WSGRB0_WS64_WG32_8_1_WGM8_WGMXCC8_WGMXCCGn1
    SolutionIndex: 33
    SolutionNameMin: Cijk_Ailk_Bljk_B8NSS_BH_Bias_FDMN_SPBML0_A_S_SAV_MT96x192x128_MI16x16x1_SN_LDSB1_AFC1_AG0_AFEM1_AFEM1_ASEM8_CLR1_CADS0_DTLA0_DTLB0_DTVA0_DTVB0_DTVMXSA0_DTVMXSB0_DTVSM0_DPLB0_EPS1_ELFLR0_EMLLn1_FDSI0_GRPM1_GRVWA16_GRVWB16_GSUn1_GSUAMBSK_GSUC1_GSUWGMRR1_GLS0_ISA942_IU1_K1_LDSTI0_LBSPPA1536_LBSPPB128_LBSPPM0_LPA32_LPB16_LPM0_LRVWn1_LWPMn1_MIAV0_MIWT6_3_MO40_MGRIPM1_NTn1_NTA0_NTB0_NTC0_NTD4_NTM0_NEPBS16_NLCA3_NLCB1_ONLL1_PGR2_PLR1_PKA1_SGROB0_SIA3_SS1_SU16_SUM0_SUS256_SPO0_SRVW0_SSO0_SVW2_SK0_SKFTR0_SKXCCM0_SGRO0_TDMI0_TIN0_TLDS1_TLDSM1_ULSGRO0_USL1_USLMX0_UIOFGRO0_UPLRP0_USFGROn1_USI0_VSn1_VWA2_VWB1_WSGRA0_WSGRB0_WS64_WG16_16_1_WGM8_WGMXCC8_WGMXCCGn1
    SolutionIndex: 34
    SolutionNameMin: Cijk_Ailk_Bljk_B8NSS_BH_Bias_FDMN_SPBML0_A_S_SAV_MT96x192x128_MI16x16x1_SN_LDSB1_AFC1_AG0_AFEM1_AFEM1_ASEM8_CLR1_CADS0_DTLA0_DTLB0_DTVA0_DTVB0_DTVMXSA0_DTVMXSB0_DTVSM0_DPLB0_EPS1_ELFLR0_EMLLn1_FDSI0_GRPM1_GRVWA16_GRVWB16_GSUn1_GSUAMBSK_GSUC1_GSUWGMRR1_GLS0_ISA942_IU1_K1_LDSTI0_LBSPPA1536_LBSPPB128_LBSPPM0_LPA32_LPB16_LPM0_LRVWn1_LWPMn1_MIAV0_MIWT6_3_MO40_MGRIPM1_NTn1_NTA0_NTB0_NTC0_NTD4_NTM0_NEPBS16_NLCA3_NLCB1_ONLL1_PGR2_PLR1_PKA1_SGROB0_SIA3_SS1_SU16_SUM0_SUS256_SPO0_SRVW0_SSO0_SVW2_SK0_SKFTR0_SKXCCM0_SGRO0_TDMI0_TIN0_TLDS1_TLDSM1_ULSGRO0_USL1_USLMX0_UIOFGRO0_UPLRP0_USFGROn1_USI0_VSn1_VWA2_VWB1_WSGRA0_WSGRB0_WS64_WG16_16_1_WGM1_WGMXCC1_WGMXCCGn1
    SolutionIndex: 35
    SolutionNameMin: Cijk_Ailk_Bljk_B8NSS_BH_Bias_FDMN_SPBML0_A_S_SAV_MT128x160x128_MI16x16x1_SN_LDSB1_AFC1_AG0_AFEM1_AFEM1_ASEM8_CLR1_CADS0_DTLA0_DTLB0_DTVA0_DTVB0_DTVMXSA0_DTVMXSB0_DTVSM0_DPLB0_EPS1_ELFLR0_EMLLn1_FDSI0_GRPM1_GRVWA16_GRVWB8_GSUn1_GSUAMBSK_GSUC1_GSUWGMRR1_GLS0_ISA942_IU1_K1_LDSTI0_LBSPPA2048_LBSPPB128_LBSPPM0_LPA64_LPB8_LPM0_LRVWn1_LWPMn1_MIAV0_MIWT4_5_MO40_MGRIPM1_NTn1_NTA0_NTB0_NTC0_NTD4_NTM0_NEPBS16_NLCA1_NLCB1_ONLL1_PGR2_PLR1_PKA1_SGROB0_SIA3_SS1_SU16_SUM0_SUS256_SPO0_SRVW0_SSO0_SVW4_SK0_SKFTR0_SKXCCM0_SGRO0_TDMI0_TIN0_TLDS1_TLDSM1_ULSGRO0_USL1_USLMX0_UIOFGRO0_UPLRP0_USFGROn1_USI0_VSn1_VWA4_VWB1_WSGRA0_WSGRB0_WS64_WG32_8_1_WGM1_WGMXCC1_WGMXCCGn1
    SolutionIndex: 36
    SolutionNameMin: Cijk_Ailk_Bljk_B8NSS_BH_Bias_FDMN_SPBML0_A_S_SAV_MT128x128x128_MI16x16x1_SN_LDSB1_AFC1_AG0_AFEM1_AFEM1_ASEM8_CLR1_CADS0_DTLA0_DTLB0_DTVA0_DTVB0_DTVMXSA0_DTVMXSB0_DTVSM0_DPLB0_EPS1_ELFLR0_EMLLn1_FDSI0_GRPM1_GRVWA16_GRVWB8_GSUn1_GSUAMBSK_GSUC1_GSUWGMRR1_GLS0_ISA942_IU1_K1_LDSTI0_LBSPPA2048_LBSPPB128_LBSPPM0_LPA64_LPB8_LPM0_LRVWn1_LWPMn1_MIAV0_MIWT4_4_MO40_MGRIPM1_NTn1_NTA0_NTB0_NTC0_NTD4_NTM0_NEPBS16_NLCA1_NLCB1_ONLL1_PGR2_PLR1_PKA1_SGROB0_SIA3_SS1_SU16_SUM0_SUS256_SPO0_SRVW0_SSO0_SVW4_SK0_SKFTR0_SKXCCM0_SGRO0_TDMI0_TIN0_TLDS1_TLDSM1_ULSGRO0_USL1_USLMX0_UIOFGRO0_UPLRP0_USFGROn1_USI0_VSn1_VWA4_VWB2_WSGRA0_WSGRB0_WS64_WG32_8_1_WGM1_WGMXCC1_WGMXCCGn1
    SolutionIndex: 37
    SolutionNameMin: Cijk_Ailk_Bljk_B8NSS_BH_Bias_FDMN_SPBML0_A_S_SAV_MT64x64x128_MI16x16x1_SN_LDSB0_AFC1_AG0_AFEM1_AFEM1_ASEM8_CLR1_CADS0_DTLA0_DTLB0_DTVA0_DTVB0_DTVMXSA0_DTVMXSB0_DTVSM0_DPLB0_EPS1_ELFLR0_EMLLn1_FDSI0_GRPM1_GRVWA16_GRVWB8_GSUn1_GSUAMBSK_GSUC1_GSUWGMRR1_GLS0_ISA942_IU1_K1_LDSTI0_LBSPPA1024_LBSPPB128_LBSPPM0_LPA32_LPB8_LPM0_LRVWn1_LWPMn1_MIAV0_MIWT2_2_MO40_MGRIPM1_NTn1_NTA0_NTB0_NTC0_NTD4_NTM0_NEPBS16_NLCA1_NLCB1_ONLL1_PGR2_PLR1_PKA1_SGROB0_SIA3_SS1_SU16_SUM0_SUS256_SPO0_SRVW0_SSO0_SVW2_SK0_SKFTR0_SKXCCM0_SGRO0_TDMI0_TIN0_TLDS1_TLDSM1_ULSGRO0_USL1_USLMX0_UIOFGRO0_UPLRP0_USFGROn1_USI0_VSn1_VWA2_VWB2_WSGRA0_WSGRB0_WS64_WG32_8_1_WGM8_WGMXCC8_WGMXCCGn1
    SolutionIndex: 38
    SolutionNameMin: Cijk_Ailk_Bljk_B8NSS_BH_Bias_FDMN_SPBML0_A_S_SAV_MT256x224x128_MI16x16x1_SN_LDSB1_AFC1_AG0_AFEM1_AFEM1_ASEM8_CLR1_CADS0_DTLA0_DTLB0_DTVA0_DTVB0_DTVMXSA0_DTVMXSB0_DTVSM0_DPLB0_EPS1_ELFLR0_EMLLn1_FDSI0_GRPM1_GRVWA16_GRVWB8_GSUn1_GSUAMBSK_GSUC1_GSUWGMRR1_GLS0_ISA942_IU1_K1_LDSTI0_LBSPPA4096_LBSPPB128_LBSPPM0_LPA64_LPB8_LPM0_LRVWn1_LWPMn1_MIAV0_MIWT4_14_MO40_MGRIPM1_NTn1_NTA0_NTB0_NTC0_NTD4_NTM0_NEPBS16_NLCA1_NLCB1_ONLL1_PGR2_PLR1_PKA1_SGROB0_SIA3_SS1_SU16_SUM0_SUS256_SPO0_SRVW0_SSO0_SVW4_SK0_SKFTR0_SKXCCM0_SGRO0_TDMI0_TIN0_TLDS1_TLDSM1_ULSGRO0_USL1_USLMX0_UIOFGRO0_UPLRP0_USFGROn1_USI0_VSn1_VWA4_VWB2_WSGRA0_WSGRB0_WS64_WG64_4_1_WGM8_WGMXCC8_WGMXCCGn1
    SolutionIndex: 39
    SolutionNameMin: Cijk_Ailk_Bljk_B8NSS_BH_Bias_FDMN_SPBML0_A_S_SAV_MT320x192x64_MI16x16x1_SN_LDSB0_AFC1_AG0_AFEM1_AFEM1_ASEM8_CLR0_CADS0_DTLA0_DTLB0_DTVA0_DTVB0_DTVMXSA0_DTVMXSB0_DTVSM0_DPLB0_EPS1_ELFLR0_EMLLn1_FDSI0_GRPM1_GRVWA4_GRVWB8_GSUn1_GSUAMBSK_GSUC1_GSUWGMRR1_GLS0_ISA942_IU1_K1_LDSTI0_LBSPPA5120_LBSPPB128_LBSPPM0_LPA16_LPB8_LPM0_LRVWn1_LWPMn1_MIAV0_MIWT5_12_MO40_MGRIPM1_NTn1_NTA0_NTB0_NTC0_NTD4_NTM0_NEPBS16_NLCA5_NLCB1_ONLL1_PGR2_PLR0_PKA1_SGROB0_SIA3_SS1_SU16_SUM0_SUS256_SPO0_SRVW0_SSO0_SVW1_SK0_SKFTR0_SKXCCM0_SGRO0_TDMI0_TIN0_TLDS1_TLDSM1_ULSGRO0_USL1_USLMX0_UIOFGRO0_UPLRP0_USFGROn1_USI0_VSn1_VWA1_VWB2_WSGRA0_WSGRB0_WS64_WG64_4_1_WGM8_WGMXCC8_WGMXCCGn1
    SolutionIndex: 40
    SolutionNameMin: Cijk_Ailk_Bljk_B8NSS_BH_Bias_FDMN_SPBML0_A_S_SAV_MT256x192x128_MI16x16x1_SN_LDSB1_AFC1_AG0_AFEM1_AFEM1_ASEM8_CLR1_CADS0_DTLA0_DTLB0_DTVA0_DTVB0_DTVMXSA0_DTVMXSB0_DTVSM0_DPLB0_EPS1_ELFLR0_EMLLn1_FDSI0_GRPM1_GRVWA16_GRVWB16_GSUn1_GSUAMBSK_GSUC1_GSUWGMRR1_GLS0_ISA942_IU1_K1_LDSTI0_LBSPPA4096_LBSPPB128_LBSPPM0_LPA64_LPB16_LPM0_LRVWn1_LWPMn1_MIAV0_MIWT4_12_MO40_MGRIPM1_NTn1_NTA0_NTB0_NTC0_NTD4_NTM0_NEPBS16_NLCA1_NLCB1_ONLL1_PGR2_PLR1_PKA1_SGROB0_SIA3_SS1_SU16_SUM0_SUS256_SPO0_SRVW0_SSO0_SVW4_SK0_SKFTR0_SKXCCM0_SGRO0_TDMI0_TIN0_TLDS1_TLDSM1_ULSGRO0_USL1_USLMX0_UIOFGRO0_UPLRP0_USFGROn1_USI0_VSn1_VWA4_VWB2_WSGRA0_WSGRB0_WS64_WG64_4_1_WGM8_WGMXCC8_WGMXCCGn1
    SolutionIndex: 41
    SolutionNameMin: Cijk_Ailk_Bljk_B8NSS_BH_Bias_FDMN_SPBML0_A_S_SAV_MT192x192x128_MI16x16x1_SN_LDSB1_AFC1_AG0_AFEM1_AFEM1_ASEM8_CLR1_CADS0_DTLA0_DTLB0_DTVA0_DTVB0_DTVMXSA0_DTVMXSB0_DTVSM0_DPLB0_EPS1_ELFLR0_EMLLn1_FDSI0_GRPM1_GRVWA16_GRVWB16_GSUn1_GSUAMBSK_GSUC1_GSUWGMRR1_GLS0_ISA942_IU1_K1_LDSTI0_LBSPPA3072_LBSPPB128_LBSPPM0_LPA32_LPB16_LPM0_LRVWn1_LWPMn1_MIAV0_MIWT6_6_MO40_MGRIPM1_NTn1_NTA0_NTB0_NTC0_NTD4_NTM0_NEPBS16_NLCA3_NLCB1_ONLL1_PGR2_PLR1_PKA1_SGROB0_SIA3_SS1_SU16_SUM0_SUS256_SPO0_SRVW0_SSO0_SVW2_SK0_SKFTR0_SKXCCM0_SGRO0_TDMI0_TIN0_TLDS1_TLDSM1_ULSGRO0_USL1_USLMX0_UIOFGRO0_UPLRP0_USFGROn1_USI0_VSn1_VWA2_VWB2_WSGRA0_WSGRB0_WS64_WG32_8_1_WGM8_WGMXCC8_WGMXCCGn1
    SolutionIndex: 42
    SolutionNameMin: Cijk_Ailk_Bljk_B8NSS_BH_Bias_FDMN_SPBML0_A_S_SAV_MT192x256x128_MI16x16x1_SN_LDSB1_AFC1_AG0_AFEM1_AFEM1_ASEM8_CLR1_CADS0_DTLA0_DTLB0_DTVA0_DTVB0_DTVMXSA0_DTVMXSB0_DTVSM0_DPLB0_EPS1_ELFLR0_EMLLn1_FDSI0_GRPM1_GRVWA16_GRVWB16_GSUn1_GSUAMBSK_GSUC1_GSUWGMRR1_GLS0_ISA942_IU1_K1_LDSTI0_LBSPPA3072_LBSPPB128_LBSPPM0_LPA32_LPB16_LPM0_LRVWn1_LWPMn1_MIAV0_MIWT6_8_MO40_MGRIPM1_NTn1_NTA0_NTB0_NTC0_NTD4_NTM0_NEPBS16_NLCA3_NLCB1_ONLL1_PGR2_PLR1_PKA1_SGROB0_SIA3_SS1_SU16_SUM0_SUS256_SPO0_SRVW0_SSO0_SVW2_SK0_SKFTR0_SKXCCM0_SGRO0_TDMI0_TIN0_TLDS1_TLDSM1_ULSGRO0_USL1_USLMX0_UIOFGRO0_UPLRP0_USFGROn1_USI0_VSn1_VWA2_VWB2_WSGRA0_WSGRB0_WS64_WG32_8_1_WGM1_WGMXCC1_WGMXCCGn1
    SolutionIndex: 43
    SolutionNameMin: Cijk_Ailk_Bljk_B8NSS_BH_Bias_FDMN_SPBML0_A_S_SAV_MT384x128x128_MI16x16x1_SN_LDSB1_AFC1_AG0_AFEM1_AFEM1_ASEM8_CLR1_CADS0_DTLA0_DTLB0_DTVA0_DTVB0_DTVMXSA0_DTVMXSB0_DTVSM0_DPLB0_EPS1_ELFLR0_EMLLn1_FDSI0_GRPM1_GRVWA16_GRVWB8_GSUn1_GSUAMBSK_GSUC1_GSUWGMRR1_GLS0_ISA942_IU1_K1_LDSTI0_LBSPPA6144_LBSPPB128_LBSPPM0_LPA32_LPB8_LPM0_LRVWn1_LWPMn1_MIAV0_MIWT6_8_MO40_MGRIPM1_NTn1_NTA0_NTB0_NTC0_NTD4_NTM0_NEPBS16_NLCA3_NLCB1_ONLL1_PGR2_PLR1_PKA1_SGROB0_SIA3_SS1_SU16_SUM0_SUS256_SPO0_SRVW0_SSO0_SVW2_SK0_SKFTR0_SKXCCM0_SGRO0_TDMI0_TIN0_TLDS1_TLDSM1_ULSGRO0_USL1_USLMX0_UIOFGRO0_UPLRP0_USFGROn1_USI0_VSn1_VWA2_VWB2_WSGRA0_WSGRB0_WS64_WG64_4_1_WGM8_WGMXCC8_WGMXCCGn1
    SolutionIndex: 44
    SolutionNameMin: Cijk_Ailk_Bljk_B8NSS_BH_Bias_FDMN_SPBML0_A_S_SAV_MT192x256x128_MI16x16x1_SN_LDSB1_AFC1_AG0_AFEM1_AFEM1_ASEM8_CLR1_CADS0_DTLA0_DTLB0_DTVA0_DTVB0_DTVMXSA0_DTVMXSB0_DTVSM0_DPLB0_EPS1_ELFLR0_EMLLn1_FDSI0_GRPM1_GRVWA4_GRVWB16_GSUn1_GSUAMBSK_GSUC1_GSUWGMRR1_GLS0_ISA942_IU1_K1_LDSTI0_LBSPPA3072_LBSPPB128_LBSPPM0_LPA32_LPB16_LPM0_LRVWn1_LWPMn1_MIAV0_MIWT6_8_MO40_MGRIPM1_NTn1_NTA0_NTB0_NTC0_NTD4_NTM0_NEPBS16_NLCA3_NLCB1_ONLL1_PGR2_PLR1_PKA1_SGROB0_SIA3_SS1_SU16_SUM0_SUS256_SPO0_SRVW0_SSO0_SVW2_SK0_SKFTR0_SKXCCM0_SGRO0_TDMI0_TIN0_TLDS1_TLDSM1_ULSGRO0_USL1_USLMX0_UIOFGRO0_UPLRP0_USFGROn1_USI0_VSn1_VWA2_VWB2_WSGRA0_WSGRB0_WS64_WG32_8_1_WGM8_WGMXCC8_WGMXCCGn1
    SolutionIndex: 45
    SolutionNameMin: Cijk_Ailk_Bljk_B8NSS_BH_Bias_FDMN_SPBML0_A_S_SAV_MT256x256x128_MI16x16x1_SN_LDSB1_AFC1_AG0_AFEM1_AFEM1_ASEM8_CLR1_CADS0_DTLA0_DTLB0_DTVA0_DTVB0_DTVMXSA0_DTVMXSB0_DTVSM0_DPLB0_EPS1_ELFLR0_EMLLn1_FDSI0_GRPM1_GRVWA16_GRVWB16_GSUn1_GSUAMBSK_GSUC1_GSUWGMRR1_GLS0_ISA942_IU1_K1_LDSTI0_LBSPPA4096_LBSPPB256_LBSPPM0_LPA64_LPB16_LPM0_LRVWn1_LWPMn1_MIAV0_MIWT4_16_MO40_MGRIPM1_NTn1_NTA0_NTB0_NTC0_NTD4_NTM0_NEPBS16_NLCA1_NLCB1_ONLL1_PGR2_PLR1_PKA1_SGROB0_SIA3_SS1_SU16_SUM0_SUS256_SPO0_SRVW0_SSO0_SVW4_SK0_SKFTR0_SKXCCM0_SGRO0_TDMI0_TIN0_TLDS1_TLDSM1_ULSGRO0_USL1_USLMX0_UIOFGRO0_UPLRP0_USFGROn1_USI0_VSn1_VWA4_VWB4_WSGRA0_WSGRB0_WS64_WG64_4_1_WGM1_WGMXCC1_WGMXCCGn1
    SolutionIndex: 46
    SolutionNameMin: Cijk_Ailk_Bljk_B8NSS_BH_Bias_FDMN_SPBML0_A_S_SAV_MT128x128x128_MI16x16x1_SN_LDSB1_AFC1_AG0_AFEM1_AFEM1_ASEM8_CLR1_CADS0_DTLA0_DTLB0_DTVA0_DTVB0_DTVMXSA0_DTVMXSB0_DTVSM0_DPLB0_EPS1_ELFLR0_EMLLn1_FDSI0_GRPM1_GRVWA4_GRVWB16_GSUn1_GSUAMBSK_GSUC1_GSUWGMRR1_GLS0_ISA942_IU1_K1_LDSTI0_LBSPPA2048_LBSPPB128_LBSPPM0_LPA64_LPB16_LPM0_LRVWn1_LWPMn1_MIAV0_MIWT4_4_MO40_MGRIPM1_NTn1_NTA0_NTB0_NTC0_NTD4_NTM0_NEPBS16_NLCA1_NLCB1_ONLL1_PGR2_PLR1_PKA1_SGROB0_SIA3_SS1_SU16_SUM0_SUS256_SPO0_SRVW0_SSO0_SVW4_SK0_SKFTR0_SKXCCM0_SGRO0_TDMI0_TIN0_TLDS1_TLDSM1_ULSGRO0_USL1_USLMX0_UIOFGRO0_UPLRP0_USFGROn1_USI0_VSn1_VWA4_VWB2_WSGRA0_WSGRB0_WS64_WG32_8_1_WGM8_WGMXCC8_WGMXCCGn1
    SolutionIndex: 47
    SolutionNameMin: Cijk_Ailk_Bljk_B8NSS_BH_Bias_FDMN_SPBML0_A_S_SAV_MT128x160x256_MI16x16x1_SN_LDSB1_AFC1_AG0_AFEM1_AFEM1_ASEM8_CLR1_CADS0_DTLA0_DTLB0_DTVA0_DTVB0_DTVMXSA0_DTVMXSB0_DTVSM0_DPLB0_EPS1_ELFLR0_EMLLn1_FDSI0_GRPM1_GRVWA16_GRVWB16_GSUn1_GSUAMBSK_GSUC1_GSUWGMRR1_GLS0_ISA942_IU1_K1_LDSTI0_LBSPPA2048_LBSPPB128_LBSPPM0_LPA64_LPB16_LPM0_LRVWn1_LWPMn1_MIAV0_MIWT4_5_MO40_MGRIPM1_NTn1_NTA0_NTB0_NTC0_NTD4_NTM0_NEPBS16_NLCA1_NLCB1_ONLL1_PGR2_PLR1_PKA1_SGROB0_SIA3_SS1_SU16_SUM0_SUS256_SPO0_SRVW0_SSO0_SVW4_SK0_SKFTR0_SKXCCM0_SGRO0_TDMI0_TIN0_TLDS1_TLDSM1_ULSGRO0_USL1_USLMX0_UIOFGRO0_UPLRP0_USFGROn1_USI0_VSn1_VWA4_VWB1_WSGRA0_WSGRB0_WS64_WG32_8_1_WGM8_WGMXCC8_WGMXCCGn1
    SolutionIndex: 48
    SolutionNameMin: Cijk_Ailk_Bljk_B8NSS_BH_Bias_FDMN_SPBML0_A_S_SAV_MT128x384x128_MI16x16x1_SN_LDSB1_AFC1_AG0_AFEM1_AFEM1_ASEM8_CLR1_CADS0_DTLA0_DTLB0_DTVA0_DTVB0_DTVMXSA0_DTVMXSB0_DTVSM0_DPLB0_EPS1_ELFLR0_EMLLn1_FDSI0_GRPM1_GRVWA16_GRVWB16_GSUn1_GSUAMBSK_GSUC1_GSUWGMRR1_GLS0_ISA942_IU1_K1_LDSTI0_LBSPPA2048_LBSPPB128_LBSPPM0_LPA64_LPB16_LPM0_LRVWn1_LWPMn1_MIAV0_MIWT4_12_MO40_MGRIPM1_NTn1_NTA0_NTB0_NTC0_NTD4_NTM0_NEPBS16_NLCA1_NLCB1_ONLL1_PGR2_PLR1_PKA1_SGROB0_SIA3_SS1_SU16_SUM0_SUS256_SPO0_SRVW0_SSO0_SVW4_SK0_SKFTR0_SKXCCM0_SGRO0_TDMI0_TIN0_TLDS1_TLDSM1_ULSGRO0_USL1_USLMX0_UIOFGRO0_UPLRP0_USFGROn1_USI0_VSn1_VWA4_VWB2_WSGRA0_WSGRB0_WS64_WG32_8_1_WGM8_WGMXCC8_WGMXCCGn1
    SolutionIndex: 49
    SolutionNameMin: Cijk_Ailk_Bljk_B8NSS_BH_Bias_FDMN_SPBML0_A_S_SAV_MT128x352x128_MI16x16x1_SN_LDSB1_AFC1_AG0_AFEM1_AFEM1_ASEM8_CLR1_CADS0_DTLA0_DTLB0_DTVA0_DTVB0_DTVMXSA0_DTVMXSB0_DTVSM0_DPLB0_EPS1_ELFLR0_EMLLn1_FDSI0_GRPM1_GRVWA16_GRVWB8_GSUn1_GSUAMBSK_GSUC1_GSUWGMRR1_GLS0_ISA942_IU1_K1_LDSTI0_LBSPPA2048_LBSPPB128_LBSPPM0_LPA64_LPB8_LPM0_LRVWn1_LWPMn1_MIAV0_MIWT4_11_MO40_MGRIPM1_NTn1_NTA0_NTB0_NTC0_NTD4_NTM0_NEPBS16_NLCA1_NLCB1_ONLL1_PGR2_PLR1_PKA1_SGROB0_SIA3_SS1_SU16_SUM0_SUS256_SPO0_SRVW0_SSO0_SVW4_SK0_SKFTR0_SKXCCM0_SGRO0_TDMI0_TIN0_TLDS1_TLDSM1_ULSGRO0_USL1_USLMX0_UIOFGRO0_UPLRP0_USFGROn1_USI0_VSn1_VWA4_VWB1_WSGRA0_WSGRB0_WS64_WG32_8_1_WGM8_WGMXCC8_WGMXCCGn1
    SolutionIndex: 50
    SolutionNameMin: Cijk_Ailk_Bljk_B8NSS_BH_Bias_FDMN_SPBML0_A_S_SAV_MT128x352x128_MI16x16x1_SN_LDSB1_AFC1_AG0_AFEM1_AFEM1_ASEM8_CLR1_CADS0_DTLA0_DTLB0_DTVA0_DTVB0_DTVMXSA0_DTVMXSB0_DTVSM0_DPLB0_EPS1_ELFLR0_EMLLn1_FDSI0_GRPM1_GRVWA4_GRVWB8_GSUn1_GSUAMBSK_GSUC1_GSUWGMRR1_GLS0_ISA942_IU1_K1_LDSTI0_LBSPPA2048_LBSPPB128_LBSPPM0_LPA64_LPB8_LPM0_LRVWn1_LWPMn1_MIAV0_MIWT4_11_MO40_MGRIPM1_NTn1_NTA0_NTB0_NTC0_NTD4_NTM0_NEPBS16_NLCA1_NLCB1_ONLL1_PGR2_PLR1_PKA1_SGROB0_SIA3_SS1_SU16_SUM0_SUS256_SPO0_SRVW0_SSO0_SVW4_SK0_SKFTR0_SKXCCM0_SGRO0_TDMI0_TIN0_TLDS1_TLDSM1_ULSGRO0_USL1_USLMX0_UIOFGRO0_UPLRP0_USFGROn1_USI0_VSn1_VWA4_VWB1_WSGRA0_WSGRB0_WS64_WG32_8_1_WGM8_WGMXCC8_WGMXCCGn1
    SolutionIndex: 51
    SolutionNameMin: Cijk_Ailk_Bljk_B8NSS_BH_Bias_FDMN_SPBML0_A_S_SAV_MT256x160x128_MI16x16x1_SN_LDSB1_AFC1_AG0_AFEM1_AFEM1_ASEM8_CLR1_CADS0_DTLA0_DTLB0_DTVA0_DTVB0_DTVMXSA0_DTVMXSB0_DTVSM0_DPLB0_EPS1_ELFLR0_EMLLn1_FDSI0_GRPM1_GRVWA16_GRVWB8_GSUn1_GSUAMBSK_GSUC1_GSUWGMRR1_GLS0_ISA942_IU1_K1_LDSTI0_LBSPPA4096_LBSPPB128_LBSPPM0_LPA64_LPB8_LPM0_LRVWn1_LWPMn1_MIAV0_MIWT4_10_MO40_MGRIPM1_NTn1_NTA0_NTB0_NTC0_NTD4_NTM0_NEPBS16_NLCA1_NLCB1_ONLL1_PGR2_PLR1_PKA1_SGROB0_SIA3_SS1_SU16_SUM0_SUS256_SPO0_SRVW0_SSO0_SVW4_SK0_SKFTR0_SKXCCM0_SGRO0_TDMI0_TIN0_TLDS1_TLDSM1_ULSGRO0_USL1_USLMX0_UIOFGRO0_UPLRP0_USFGROn1_USI0_VSn1_VWA4_VWB2_WSGRA0_WSGRB0_WS64_WG64_4_1_WGM8_WGMXCC8_WGMXCCGn1
    SolutionIndex: 52
    SolutionNameMin: Cijk_Ailk_Bljk_B8NSS_BH_Bias_FDMN_SPBML0_A_S_SAV_MT128x160x256_MI16x16x1_SN_LDSB1_AFC1_AG0_AFEM1_AFEM1_ASEM8_CLR1_CADS0_DTLA0_DTLB0_DTVA0_DTVB0_DTVMXSA0_DTVMXSB0_DTVSM0_DPLB0_EPS1_ELFLR0_EMLLn1_FDSI0_GRPM1_GRVWA16_GRVWB16_GSUn1_GSUAMBSK_GSUC1_GSUWGMRR1_GLS0_ISA942_IU1_K1_LDSTI0_LBSPPA2048_LBSPPB128_LBSPPM0_LPA64_LPB16_LPM0_LRVWn1_LWPMn1_MIAV0_MIWT4_5_MO40_MGRIPM1_NTn1_NTA0_NTB0_NTC0_NTD4_NTM0_NEPBS16_NLCA1_NLCB1_ONLL1_PGR2_PLR1_PKA1_SGROB0_SIA3_SS1_SU16_SUM0_SUS256_SPO0_SRVW0_SSO0_SVW4_SK0_SKFTR0_SKXCCM0_SGRO0_TDMI0_TIN0_TLDS1_TLDSM1_ULSGRO0_USL1_USLMX0_UIOFGRO0_UPLRP0_USFGROn1_USI0_VSn1_VWA4_VWB1_WSGRA0_WSGRB0_WS64_WG32_8_1_WGM1_WGMXCC1_WGMXCCGn1
    SolutionIndex: 53
    SolutionNameMin: Cijk_Ailk_Bljk_B8NSS_BH_Bias_FDMN_SPBML0_A_S_SAV_MT128x352x128_MI16x16x1_SN_LDSB1_AFC1_AG0_AFEM1_AFEM1_ASEM8_CLR1_CADS0_DTLA0_DTLB0_DTVA0_DTVB0_DTVMXSA0_DTVMXSB0_DTVSM0_DPLB0_EPS1_ELFLR0_EMLLn1_FDSI0_GRPM1_GRVWA4_GRVWB8_GSUn1_GSUAMBSK_GSUC1_GSUWGMRR1_GLS0_ISA942_IU1_K1_LDSTI0_LBSPPA2048_LBSPPB128_LBSPPM0_LPA64_LPB8_LPM0_LRVWn1_LWPMn1_MIAV0_MIWT4_11_MO40_MGRIPM1_NTn1_NTA0_NTB0_NTC0_NTD4_NTM0_NEPBS16_NLCA1_NLCB1_ONLL1_PGR2_PLR1_PKA1_SGROB0_SIA3_SS1_SU16_SUM0_SUS256_SPO0_SRVW0_SSO0_SVW4_SK0_SKFTR0_SKXCCM0_SGRO0_TDMI0_TIN0_TLDS1_TLDSM1_ULSGRO0_USL1_USLMX0_UIOFGRO0_UPLRP0_USFGROn1_USI0_VSn1_VWA4_VWB1_WSGRA0_WSGRB0_WS64_WG32_8_1_WGM1_WGMXCC1_WGMXCCGn1
    SolutionIndex: 54
    SolutionNameMin: Cijk_Ailk_Bljk_B8NSS_BH_Bias_FDMN_SPBML0_A_S_SAV_MT96x384x128_MI16x16x1_SN_LDSB1_AFC1_AG0_AFEM1_AFEM1_ASEM8_CLR1_CADS0_DTLA0_DTLB0_DTVA0_DTVB0_DTVMXSA0_DTVMXSB0_DTVSM0_DPLB0_EPS1_ELFLR0_EMLLn1_FDSI0_GRPM1_GRVWA16_GRVWB16_GSUn1_GSUAMBSK_GSUC1_GSUWGMRR1_GLS0_ISA942_IU1_K1_LDSTI0_LBSPPA1536_LBSPPB128_LBSPPM0_LPA32_LPB16_LPM0_LRVWn1_LWPMn1_MIAV0_MIWT6_6_MO40_MGRIPM1_NTn1_NTA0_NTB0_NTC0_NTD4_NTM0_NEPBS16_NLCA3_NLCB1_ONLL1_PGR2_PLR1_PKA1_SGROB0_SIA3_SS1_SU16_SUM0_SUS256_SPO0_SRVW0_SSO0_SVW2_SK0_SKFTR0_SKXCCM0_SGRO0_TDMI0_TIN0_TLDS1_TLDSM1_ULSGRO0_USL1_USLMX0_UIOFGRO0_UPLRP0_USFGROn1_USI0_VSn1_VWA2_VWB2_WSGRA0_WSGRB0_WS64_WG16_16_1_WGM8_WGMXCC8_WGMXCCGn1
    SolutionIndex: 55
    SolutionNameMin: Cijk_Ailk_Bljk_B8NSS_BH_Bias_FDMN_SPBML0_A_S_SAV_MT16x320x256_MI16x16x1_SN_LDSB1_AFC1_AG0_AFEM1_AFEM1_ASEM8_CLR1_CADS0_DTLA0_DTLB0_DTVA0_DTVB0_DTVMXSA0_DTVMXSB0_DTVSM0_DPLB0_EPS1_ELFLR0_EMLLn1_FDSI0_GRPM1_GRVWA4_GRVWB16_GSUn1_GSUAMBSK_GSUC1_GSUWGMRR1_GLS0_ISA942_IU1_K1_LDSTI0_LBSPPA256_LBSPPB128_LBSPPM0_LPA16_LPB16_LPM0_LRVWn1_LWPMn1_MIAV0_MIWT1_5_MO40_MGRIPM1_NTn1_NTA0_NTB0_NTC0_NTD4_NTM0_NEPBS16_NLCA1_NLCB1_ONLL1_PGR2_PLR1_PKA1_SGROB0_SIA3_SS1_SU16_SUM0_SUS256_SPO0_SRVW0_SSO0_SVW1_SK0_SKFTR0_SKXCCM0_SGRO0_TDMI0_TIN0_TLDS1_TLDSM1_ULSGRO0_USL1_USLMX0_UIOFGRO0_UPLRP0_USFGROn1_USI0_VSn1_VWA1_VWB1_WSGRA0_WSGRB0_WS64_WG16_16_1_WGM8_WGMXCC8_WGMXCCGn1
    SolutionIndex: 56
    SolutionNameMin: Cijk_Ailk_Bljk_B8NSS_BH_Bias_FDMN_SPBML0_A_S_SAV_MT32x320x256_MI16x16x1_SN_LDSB1_AFC1_AG0_AFEM1_AFEM1_ASEM8_CLR1_CADS0_DTLA0_DTLB0_DTVA0_DTVB0_DTVMXSA0_DTVMXSB0_DTVSM0_DPLB0_EPS1_ELFLR0_EMLLn1_FDSI0_GRPM1_GRVWA16_GRVWB16_GSUn1_GSUAMBSK_GSUC1_GSUWGMRR1_GLS0_ISA942_IU1_K1_LDSTI0_LBSPPA512_LBSPPB128_LBSPPM0_LPA32_LPB16_LPM0_LRVWn1_LWPMn1_MIAV0_MIWT2_5_MO40_MGRIPM1_NTn1_NTA0_NTB0_NTC0_NTD4_NTM0_NEPBS16_NLCA1_NLCB1_ONLL1_PGR2_PLR1_PKA1_SGROB0_SIA3_SS1_SU16_SUM0_SUS256_SPO0_SRVW0_SSO0_SVW2_SK0_SKFTR0_SKXCCM0_SGRO0_TDMI0_TIN0_TLDS1_TLDSM1_ULSGRO0_USL1_USLMX0_UIOFGRO0_UPLRP0_USFGROn1_USI0_VSn1_VWA2_VWB1_WSGRA0_WSGRB0_WS64_WG16_16_1_WGM1_WGMXCC1_WGMXCCGn1
    SolutionIndex: 57
    SolutionNameMin: Cijk_Ailk_Bljk_B8NSS_BH_Bias_FDMN_SPBML0_A_S_SAV_MT64x224x256_MI16x16x1_SN_LDSB1_AFC1_AG0_AFEM1_AFEM1_ASEM8_CLR1_CADS0_DTLA0_DTLB0_DTVA0_DTVB0_DTVMXSA0_DTVMXSB0_DTVSM0_DPLB0_EPS1_ELFLR0_EMLLn1_FDSI0_GRPM1_GRVWA16_GRVWB16_GSUn1_GSUAMBSK_GSUC1_GSUWGMRR1_GLS0_ISA942_IU1_K1_LDSTI0_LBSPPA1024_LBSPPB128_LBSPPM0_LPA32_LPB16_LPM0_LRVWn1_LWPMn1_MIAV0_MIWT2_7_MO40_MGRIPM1_NTn1_NTA0_NTB0_NTC0_NTD4_NTM0_NEPBS16_NLCA1_NLCB1_ONLL1_PGR2_PLR1_PKA1_SGROB0_SIA3_SS1_SU16_SUM0_SUS256_SPO0_SRVW0_SSO0_SVW2_SK0_SKFTR0_SKXCCM0_SGRO0_TDMI0_TIN0_TLDS1_TLDSM1_ULSGRO0_USL1_USLMX0_UIOFGRO0_UPLRP0_USFGROn1_USI0_VSn1_VWA2_VWB1_WSGRA0_WSGRB0_WS64_WG32_8_1_WGM1_WGMXCC1_WGMXCCGn1
    SolutionIndex: 58
    SolutionNameMin: Cijk_Ailk_Bljk_B8NSS_BH_Bias_FDMN_SPBML0_A_S_SAV_MT16x256x256_MI16x16x1_SN_LDSB1_AFC1_AG0_AFEM1_AFEM1_ASEM8_CLR1_CADS0_DTLA0_DTLB0_DTVA0_DTVB0_DTVMXSA0_DTVMXSB0_DTVSM0_DPLB0_EPS1_ELFLR0_EMLLn1_FDSI0_GRPM1_GRVWA4_GRVWB16_GSUn1_GSUAMBSK_GSUC1_GSUWGMRR1_GLS0_ISA942_IU1_K1_LDSTI0_LBSPPA256_LBSPPB256_LBSPPM0_LPA16_LPB16_LPM0_LRVWn1_LWPMn1_MIAV0_MIWT1_4_MO40_MGRIPM1_NTn1_NTA0_NTB0_NTC0_NTD4_NTM0_NEPBS16_NLCA1_NLCB1_ONLL1_PGR2_PLR1_PKA1_SGROB0_SIA3_SS1_SU16_SUM0_SUS256_SPO0_SRVW0_SSO0_SVW1_SK0_SKFTR0_SKXCCM0_SGRO0_TDMI0_TIN0_TLDS1_TLDSM1_ULSGRO0_USL1_USLMX0_UIOFGRO0_UPLRP0_USFGROn1_USI0_VSn1_VWA1_VWB2_WSGRA0_WSGRB0_WS64_WG16_16_1_WGM8_WGMXCC8_WGMXCCGn1
    SolutionIndex: 59
    SolutionNameMin: Cijk_Ailk_Bljk_B8NSS_BH_Bias_FDMN_SPBML0_A_S_SAV_MT16x128x256_MI16x16x1_SN_LDSB1_AFC1_AG0_AFEM1_AFEM1_ASEM8_CLR1_CADS0_DTLA0_DTLB0_DTVA0_DTVB0_DTVMXSA0_DTVMXSB0_DTVSM0_DPLB0_EPS1_ELFLR0_EMLLn1_FDSI0_GRPM1_GRVWA16_GRVWB16_GSUn1_GSUAMBSK_GSUC1_GSUWGMRR1_GLS0_ISA942_IU1_K1_LDSTI0_LBSPPA256_LBSPPB256_LBSPPM0_LPA16_LPB16_LPM0_LRVWn1_LWPMn1_MIAV0_MIWT1_2_MO40_MGRIPM1_NTn1_NTA0_NTB0_NTC0_NTD4_NTM0_NEPBS16_NLCA1_NLCB1_ONLL1_PGR2_PLR1_PKA1_SGROB0_SIA3_SS1_SU16_SUM0_SUS256_SPO0_SRVW0_SSO0_SVW1_SK0_SKFTR0_SKXCCM0_SGRO0_TDMI0_TIN0_TLDS1_TLDSM1_ULSGRO0_USL1_USLMX0_UIOFGRO0_UPLRP0_USFGROn1_USI0_VSn1_VWA1_VWB2_WSGRA0_WSGRB0_WS64_WG16_16_1_WGM8_WGMXCC8_WGMXCCGn1
    SolutionIndex: 60
    SolutionNameMin: Cijk_Ailk_Bljk_B8NSS_BH_Bias_FDMN_SPBML0_A_S_SAV_MT32x256x256_MI16x16x1_SN_LDSB1_AFC1_AG0_AFEM1_AFEM1_ASEM8_CLR1_CADS0_DTLA0_DTLB0_DTVA0_DTVB0_DTVMXSA0_DTVMXSB0_DTVSM0_DPLB0_EPS1_ELFLR0_EMLLn1_FDSI0_GRPM1_GRVWA16_GRVWB16_GSUn1_GSUAMBSK_GSUC1_GSUWGMRR1_GLS0_ISA942_IU1_K1_LDSTI0_LBSPPA512_LBSPPB256_LBSPPM0_LPA32_LPB16_LPM0_LRVWn1_LWPMn1_MIAV0_MIWT2_4_MO40_MGRIPM1_NTn1_NTA0_NTB0_NTC0_NTD4_NTM0_NEPBS16_NLCA1_NLCB1_ONLL1_PGR2_PLR1_PKA1_SGROB0_SIA3_SS1_SU16_SUM0_SUS256_SPO0_SRVW0_SSO0_SVW2_SK0_SKFTR0_SKXCCM0_SGRO0_TDMI0_TIN0_TLDS1_TLDSM1_ULSGRO0_USL1_USLMX0_UIOFGRO0_UPLRP0_USFGROn1_USI0_VSn1_VWA2_VWB2_WSGRA0_WSGRB0_WS64_WG16_16_1_WGM8_WGMXCC8_WGMXCCGn1
    SolutionIndex: 61
    SolutionNameMin: Cijk_Ailk_Bljk_B8NSS_BH_Bias_FDMN_SPBML0_A_S_SAV_MT16x320x256_MI16x16x1_SN_LDSB1_AFC1_AG0_AFEM1_AFEM1_ASEM8_CLR1_CADS0_DTLA0_DTLB0_DTVA0_DTVB0_DTVMXSA0_DTVMXSB0_DTVSM0_DPLB0_EPS1_ELFLR0_EMLLn1_FDSI0_GRPM1_GRVWA4_GRVWB16_GSUn1_GSUAMBSK_GSUC1_GSUWGMRR1_GLS0_ISA942_IU1_K1_LDSTI0_LBSPPA256_LBSPPB128_LBSPPM0_LPA16_LPB16_LPM0_LRVWn1_LWPMn1_MIAV0_MIWT1_5_MO40_MGRIPM1_NTn1_NTA0_NTB0_NTC0_NTD4_NTM0_NEPBS16_NLCA1_NLCB1_ONLL1_PGR2_PLR1_PKA1_SGROB0_SIA3_SS1_SU16_SUM0_SUS256_SPO0_SRVW0_SSO0_SVW1_SK0_SKFTR0_SKXCCM0_SGRO0_TDMI0_TIN0_TLDS1_TLDSM1_ULSGRO0_USL1_USLMX0_UIOFGRO0_UPLRP0_USFGROn1_USI0_VSn1_VWA1_VWB1_WSGRA0_WSGRB0_WS64_WG16_16_1_WGM1_WGMXCC1_WGMXCCGn1
    SolutionIndex: 62
    SolutionNameMin: Cijk_Ailk_Bljk_B8NSS_BH_Bias_FDMN_SPBML0_A_S_SAV_MT32x320x256_MI16x16x1_SN_LDSB1_AFC1_AG0_AFEM1_AFEM1_ASEM8_CLR1_CADS0_DTLA0_DTLB0_DTVA0_DTVB0_DTVMXSA0_DTVMXSB0_DTVSM0_DPLB0_EPS1_ELFLR0_EMLLn1_FDSI0_GRPM1_GRVWA4_GRVWB16_GSUn1_GSUAMBSK_GSUC1_GSUWGMRR1_GLS0_ISA942_IU1_K1_LDSTI0_LBSPPA512_LBSPPB128_LBSPPM0_LPA32_LPB16_LPM0_LRVWn1_LWPMn1_MIAV0_MIWT2_5_MO40_MGRIPM1_NTn1_NTA0_NTB0_NTC0_NTD4_NTM0_NEPBS16_NLCA1_NLCB1_ONLL1_PGR2_PLR1_PKA1_SGROB0_SIA3_SS1_SU16_SUM0_SUS256_SPO0_SRVW0_SSO0_SVW2_SK0_SKFTR0_SKXCCM0_SGRO0_TDMI0_TIN0_TLDS1_TLDSM1_ULSGRO0_USL1_USLMX0_UIOFGRO0_UPLRP0_USFGROn1_USI0_VSn1_VWA2_VWB1_WSGRA0_WSGRB0_WS64_WG16_16_1_WGM1_WGMXCC1_WGMXCCGn1
    SolutionIndex: 63
    SolutionNameMin: Cijk_Ailk_Bljk_B8NSS_BH_Bias_FDMN_SPBML0_A_S_SAV_MT256x256x128_MI16x16x1_SN_LDSB1_AFC1_AG0_AFEM1_AFEM1_ASEM8_CLR1_CADS0_DTLA0_DTLB0_DTVA0_DTVB0_DTVMXSA0_DTVMXSB0_DTVSM0_DPLB0_EPS1_ELFLR0_EMLLn1_FDSI0_GRPM1_GRVWA16_GRVWB16_GSUn1_GSUAMBSK_GSUC1_GSUWGMRR1_GLS0_ISA942_IU1_K1_LDSTI0_LBSPPA0_LBSPPB128_LBSPPM0_LPA0_LPB16_LPM0_LRVWn1_LWPMn1_MIAV0_MIWT8_8_MO40_MGRIPM1_NTn1_NTA0_NTB0_NTC0_NTD4_NTM0_NEPBS8_NLCA1_NLCB1_ONLL1_PGR2_PLR1_PKA1_SGROB0_SIA3_SS1_SU16_SUM0_SUS256_SPO0_SRVW0_SSO0_SVW8_SK0_SKFTR0_SKXCCM0_SGRO0_TDMI0_TIN0_TLDS1_TLDSM1_ULSGRO0_USL1_USLMX0_UIOFGRO0_UPLRP0_USFGROn1_USI0_VSn1_VWA8_VWB2_WSGRA0_WSGRB0_WS64_WG32_8_1_WGM8_WGMXCC8_WGMXCCGn1
    SolutionIndex: 64
    SolutionNameMin: Cijk_Ailk_Bljk_B8NSS_BH_Bias_FDMN_SPBML0_A_S_SAV_MT256x256x128_MI16x16x1_SN_LDSB1_AFC1_AG0_AFEM1_AFEM1_ASEM8_CLR1_CADS0_DTLA0_DTLB0_DTVA0_DTVB0_DTVMXSA0_DTVMXSB0_DTVSM0_DPLB0_EPS1_ELFLR0_EMLLn1_FDSI0_GRPM1_GRVWA16_GRVWB16_GSUn1_GSUAMBSK_GSUC1_GSUWGMRR1_GLS0_ISA942_IU1_K1_LDSTI0_LBSPPA0_LBSPPB128_LBSPPM0_LPA0_LPB16_LPM0_LRVWn1_LWPMn1_MIAV0_MIWT8_8_MO40_MGRIPM1_NTn1_NTA0_NTB0_NTC0_NTD4_NTM0_NEPBS8_NLCA1_NLCB1_ONLL1_PGR2_PLR1_PKA1_SGROB0_SIA3_SS1_SU16_SUM0_SUS256_SPO0_SRVW0_SSO0_SVW8_SK0_SKFTR0_SKXCCM0_SGRO0_TDMI0_TIN0_TLDS1_TLDSM1_ULSGRO0_USL1_USLMX0_UIOFGRO0_UPLRP0_USFGROn1_USI0_VSn1_VWA8_VWB2_WSGRA0_WSGRB0_WS64_WG32_8_1_WGM1_WGMXCC1_WGMXCCGn1
    SolutionIndex: 65
    SolutionNameMin: Cijk_Ailk_Bljk_B8NSS_BH_Bias_FDMN_SPBML0_A_S_SAV_MT256x256x128_MI16x16x1_SN_LDSB1_AFC1_AG0_AFEM1_AFEM1_ASEM8_CLR1_CADS0_DTLA0_DTLB0_DTVA0_DTVB0_DTVMXSA0_DTVMXSB0_DTVSM0_DPLB0_EPS1_ELFLR0_EMLLn1_FDSI0_GRPM1_GRVWA4_GRVWB16_GSUn1_GSUAMBSK_GSUC1_GSUWGMRR1_GLS0_ISA942_IU1_K1_LDSTI0_LBSPPA0_LBSPPB128_LBSPPM0_LPA0_LPB16_LPM0_LRVWn1_LWPMn1_MIAV0_MIWT8_8_MO40_MGRIPM1_NTn1_NTA0_NTB0_NTC0_NTD4_NTM0_NEPBS8_NLCA1_NLCB1_ONLL1_PGR2_PLR1_PKA1_SGROB0_SIA3_SS1_SU16_SUM0_SUS256_SPO0_SRVW0_SSO0_SVW8_SK0_SKFTR0_SKXCCM0_SGRO0_TDMI0_TIN0_TLDS1_TLDSM1_ULSGRO0_USL1_USLMX0_UIOFGRO0_UPLRP0_USFGROn1_USI0_VSn1_VWA8_VWB2_WSGRA0_WSGRB0_WS64_WG32_8_1_WGM8_WGMXCC8_WGMXCCGn1
    SolutionIndex: 66
    SolutionNameMin: Cijk_Ailk_Bljk_B8NSS_BH_Bias_FDMN_SPBML0_A_S_SAV_MT384x128x64_MI16x16x1_SN_LDSB0_AFC1_AG0_AFEM1_AFEM1_ASEM8_CLR0_CADS0_DTLA0_DTLB0_DTVA0_DTVB0_DTVMXSA0_DTVMXSB0_DTVSM0_DPLB0_EPS1_ELFLR0_EMLLn1_FDSI0_GRPM1_GRVWA4_GRVWB16_GSUn1_GSUAMBSK_GSUC1_GSUWGMRR1_GLS0_ISA942_IU1_K1_LDSTI0_LBSPPA6144_LBSPPB128_LBSPPM0_LPA32_LPB16_LPM0_LRVWn1_LWPMn1_MIAV0_MIWT6_8_MO40_MGRIPM1_NTn1_NTA0_NTB0_NTC0_NTD4_NTM0_NEPBS16_NLCA3_NLCB1_ONLL1_PGR2_PLR0_PKA1_SGROB0_SIA3_SS1_SU16_SUM0_SUS256_SPO0_SRVW0_SSO0_SVW2_SK0_SKFTR0_SKXCCM0_SGRO0_TDMI0_TIN0_TLDS1_TLDSM1_ULSGRO0_USL1_USLMX0_UIOFGRO0_UPLRP0_USFGROn1_USI0_VSn1_VWA2_VWB2_WSGRA0_WSGRB0_WS64_WG64_4_1_WGM8_WGMXCC8_WGMXCCGn1
    SolutionIndex: 67
    SolutionNameMin: Cijk_Ailk_Bljk_B8NSS_BH_Bias_FDMN_SPBML0_A_S_SAV_MT256x256x128_MI16x16x1_SN_LDSB1_AFC1_AG0_AFEM1_AFEM1_ASEM8_CLR1_CADS0_DTLA0_DTLB0_DTVA0_DTVB0_DTVMXSA0_DTVMXSB0_DTVSM0_DPLB0_EPS1_ELFLR0_EMLLn1_FDSI0_GRPM1_GRVWA16_GRVWB16_GSUn1_GSUAMBSK_GSUC1_GSUWGMRR1_GLS0_ISA942_IU1_K1_LDSTI0_LBSPPA4096_LBSPPB256_LBSPPM0_LPA64_LPB16_LPM0_LRVWn1_LWPMn1_MIAV0_MIWT4_16_MO40_MGRIPM1_NTn1_NTA0_NTB0_NTC0_NTD4_NTM0_NEPBS16_NLCA1_NLCB1_ONLL1_PGR2_PLR1_PKA1_SGROB0_SIA3_SS1_SU16_SUM0_SUS256_SPO0_SRVW0_SSO0_SVW4_SK0_SKFTR0_SKXCCM0_SGRO0_TDMI0_TIN0_TLDS1_TLDSM1_ULSGRO0_USL1_USLMX0_UIOFGRO0_UPLRP0_USFGROn1_USI0_VSn1_VWA4_VWB4_WSGRA0_WSGRB0_WS64_WG64_4_1_WGM8_WGMXCC8_WGMXCCGn1
    SolutionIndex: 68
    SolutionNameMin: Cijk_Ailk_Bljk_B8NSS_BH_Bias_FDMN_SPBML0_A_S_SAV_MT512x128x64_MI16x16x1_SN_LDSB1_AFC1_AG0_AFEM1_AFEM1_ASEM8_CLR0_CADS0_DTLA0_DTLB0_DTVA0_DTVB0_DTVMXSA0_DTVMXSB0_DTVSM0_DPLB0_EPS1_ELFLR0_EMLLn1_FDSI0_GRPM1_GRVWA4_GRVWB16_GSUn1_GSUAMBSK_GSUC1_GSUWGMRR1_GLS0_ISA942_IU1_K1_LDSTI0_LBSPPA0_LBSPPB128_LBSPPM0_LPA0_LPB16_LPM0_LRVWn1_LWPMn1_MIAV0_MIWT8_8_MO40_MGRIPM1_NTn1_NTA0_NTB0_NTC0_NTD4_NTM0_NEPBS8_NLCA1_NLCB1_ONLL1_PGR2_PLR0_PKA1_SGROB0_SIA3_SS1_SU16_SUM0_SUS256_SPO0_SRVW0_SSO0_SVW8_SK0_SKFTR0_SKXCCM0_SGRO0_TDMI0_TIN0_TLDS1_TLDSM1_ULSGRO0_USL1_USLMX0_UIOFGRO0_UPLRP0_USFGROn1_USI0_VSn1_VWA8_VWB2_WSGRA0_WSGRB0_WS64_WG64_4_1_WGM8_WGMXCC8_WGMXCCGn1
    SolutionIndex: 69
    SolutionNameMin: Cijk_Ailk_Bljk_B8NSS_BH_Bias_FDMN_SPBML0_A_S_SAV_MT512x128x64_MI16x16x1_SN_LDSB1_AFC1_AG0_AFEM1_AFEM1_ASEM8_CLR0_CADS0_DTLA0_DTLB0_DTVA0_DTVB0_DTVMXSA0_DTVMXSB0_DTVSM0_DPLB0_EPS1_ELFLR0_EMLLn1_FDSI0_GRPM1_GRVWA16_GRVWB16_GSUn1_GSUAMBSK_GSUC1_GSUWGMRR1_GLS0_ISA942_IU1_K1_LDSTI0_LBSPPA0_LBSPPB128_LBSPPM0_LPA0_LPB16_LPM0_LRVWn1_LWPMn1_MIAV0_MIWT8_8_MO40_MGRIPM1_NTn1_NTA0_NTB0_NTC0_NTD4_NTM0_NEPBS8_NLCA1_NLCB1_ONLL1_PGR2_PLR0_PKA1_SGROB0_SIA3_SS1_SU16_SUM0_SUS256_SPO0_SRVW0_SSO0_SVW8_SK0_SKFTR0_SKXCCM0_SGRO0_TDMI0_TIN0_TLDS1_TLDSM1_ULSGRO0_USL1_USLMX0_UIOFGRO0_UPLRP0_USFGROn1_USI0_VSn1_VWA8_VWB2_WSGRA0_WSGRB0_WS64_WG64_4_1_WGM8_WGMXCC8_WGMXCCGn1
    SolutionIndex: 70
    SolutionNameMin: Cijk_Ailk_Bljk_B8NSS_BH_Bias_FDMN_SPBML0_A_S_SAV_MT256x256x128_MI16x16x1_SN_LDSB1_AFC1_AG0_AFEM1_AFEM1_ASEM8_CLR1_CADS0_DTLA0_DTLB0_DTVA0_DTVB0_DTVMXSA0_DTVMXSB0_DTVSM0_DPLB0_EPS1_ELFLR0_EMLLn1_FDSI0_GRPM1_GRVWA16_GRVWB8_GSUn1_GSUAMBSK_GSUC1_GSUWGMRR1_GLS0_ISA942_IU1_K1_LDSTI0_LBSPPA0_LBSPPB128_LBSPPM0_LPA0_LPB8_LPM0_LRVWn1_LWPMn1_MIAV0_MIWT8_8_MO40_MGRIPM1_NTn1_NTA0_NTB0_NTC0_NTD4_NTM0_NEPBS8_NLCA1_NLCB1_ONLL1_PGR2_PLR1_PKA1_SGROB0_SIA3_SS1_SU16_SUM0_SUS256_SPO0_SRVW0_SSO0_SVW8_SK0_SKFTR0_SKXCCM0_SGRO0_TDMI0_TIN0_TLDS1_TLDSM1_ULSGRO0_USL1_USLMX0_UIOFGRO0_UPLRP0_USFGROn1_USI0_VSn1_VWA8_VWB2_WSGRA0_WSGRB0_WS64_WG32_8_1_WGM8_WGMXCC8_WGMXCCGn1
    SolutionIndex: 71
    SolutionNameMin: Cijk_Ailk_Bljk_B8NSS_BH_Bias_FDMN_SPBML0_A_S_SAV_MT192x256x128_MI16x16x1_SN_LDSB1_AFC1_AG0_AFEM1_AFEM1_ASEM8_CLR1_CADS0_DTLA0_DTLB0_DTVA0_DTVB0_DTVMXSA0_DTVMXSB0_DTVSM0_DPLB0_EPS1_ELFLR0_EMLLn1_FDSI0_GRPM1_GRVWA4_GRVWB16_GSUn1_GSUAMBSK_GSUC1_GSUWGMRR1_GLS0_ISA942_IU1_K1_LDSTI0_LBSPPA3072_LBSPPB128_LBSPPM0_LPA32_LPB16_LPM0_LRVWn1_LWPMn1_MIAV0_MIWT6_8_MO40_MGRIPM1_NTn1_NTA0_NTB0_NTC0_NTD4_NTM0_NEPBS16_NLCA3_NLCB1_ONLL1_PGR2_PLR1_PKA1_SGROB0_SIA3_SS1_SU16_SUM0_SUS256_SPO0_SRVW0_SSO0_SVW2_SK0_SKFTR0_SKXCCM0_SGRO0_TDMI0_TIN0_TLDS1_TLDSM1_ULSGRO0_USL1_USLMX0_UIOFGRO0_UPLRP0_USFGROn1_USI0_VSn1_VWA2_VWB2_WSGRA0_WSGRB0_WS64_WG32_8_1_WGM1_WGMXCC1_WGMXCCGn1
    SolutionIndex: 72
    SolutionNameMin: Cijk_Ailk_Bljk_B8NSS_BH_Bias_FDMN_SPBML0_A_S_SAV_MT256x160x128_MI16x16x1_SN_LDSB1_AFC1_AG0_AFEM1_AFEM1_ASEM8_CLR1_CADS0_DTLA0_DTLB0_DTVA0_DTVB0_DTVMXSA0_DTVMXSB0_DTVSM0_DPLB0_EPS1_ELFLR0_EMLLn1_FDSI0_GRPM1_GRVWA4_GRVWB8_GSUn1_GSUAMBSK_GSUC1_GSUWGMRR1_GLS0_ISA942_IU1_K1_LDSTI0_LBSPPA0_LBSPPB128_LBSPPM0_LPA0_LPB8_LPM0_LRVWn1_LWPMn1_MIAV0_MIWT8_5_MO40_MGRIPM1_NTn1_NTA0_NTB0_NTC0_NTD4_NTM0_NEPBS8_NLCA1_NLCB1_ONLL1_PGR2_PLR1_PKA1_SGROB0_SIA3_SS1_SU16_SUM0_SUS256_SPO0_SRVW0_SSO0_SVW8_SK0_SKFTR0_SKXCCM0_SGRO0_TDMI0_TIN0_TLDS1_TLDSM1_ULSGRO0_USL1_USLMX0_UIOFGRO0_UPLRP0_USFGROn1_USI0_VSn1_VWA8_VWB1_WSGRA0_WSGRB0_WS64_WG32_8_1_WGM8_WGMXCC8_WGMXCCGn1
    SolutionIndex: 73
    SolutionNameMin: Cijk_Ailk_Bljk_B8NSS_BH_Bias_FDMN_SPBML0_A_S_SAV_MT32x128x256_MI16x16x1_SN_LDSB1_AFC1_AG0_AFEM1_AFEM1_ASEM8_CLR1_CADS0_DTLA0_DTLB0_DTVA0_DTVB0_DTVMXSA0_DTVMXSB0_DTVSM0_DPLB0_EPS1_ELFLR0_EMLLn1_FDSI0_GRPM1_GRVWA16_GRVWB16_GSUn1_GSUAMBSK_GSUC1_GSUWGMRR1_GLS0_ISA942_IU1_K1_LDSTI0_LBSPPA512_LBSPPB256_LBSPPM0_LPA32_LPB16_LPM0_LRVWn1_LWPMn1_MIAV0_MIWT2_2_MO40_MGRIPM1_NTn1_NTA0_NTB0_NTC0_NTD4_NTM0_NEPBS16_NLCA1_NLCB1_ONLL1_PGR2_PLR1_PKA1_SGROB0_SIA3_SS1_SU16_SUM0_SUS256_SPO0_SRVW0_SSO0_SVW2_SK0_SKFTR0_SKXCCM0_SGRO0_TDMI0_TIN0_TLDS1_TLDSM1_ULSGRO0_USL1_USLMX0_UIOFGRO0_UPLRP0_USFGROn1_USI0_VSn1_VWA2_VWB2_WSGRA0_WSGRB0_WS64_WG16_16_1_WGM8_WGMXCC8_WGMXCCGn1
    SolutionIndex: 74
    SolutionNameMin: Cijk_Ailk_Bljk_B8NSS_BH_Bias_FDMN_SPBML0_A_S_SAV_MT16x64x256_MI16x16x1_SN_LDSB0_AFC1_AG0_AFEM1_AFEM1_ASEM8_CLR1_CADS0_DTLA0_DTLB0_DTVA0_DTVB0_DTVMXSA0_DTVMXSB0_DTVSM0_DPLB0_EPS1_ELFLR0_EMLLn1_FDSI0_GRPM1_GRVWA16_GRVWB16_GSUn1_GSUAMBSK_GSUC1_GSUWGMRR1_GLS0_ISA942_IU1_K1_LDSTI0_LBSPPA256_LBSPPB128_LBSPPM0_LPA16_LPB16_LPM0_LRVWn1_LWPMn1_MIAV0_MIWT1_1_MO40_MGRIPM1_NTn1_NTA0_NTB0_NTC0_NTD4_NTM0_NEPBS16_NLCA1_NLCB1_ONLL1_PGR2_PLR1_PKA1_SGROB0_SIA3_SS1_SU16_SUM0_SUS256_SPO0_SRVW0_SSO0_SVW1_SK0_SKFTR0_SKXCCM0_SGRO0_TDMI0_TIN0_TLDS1_TLDSM1_ULSGRO0_USL1_USLMX0_UIOFGRO0_UPLRP0_USFGROn1_USI0_VSn1_VWA1_VWB1_WSGRA0_WSGRB0_WS64_WG16_16_1_WGM8_WGMXCC8_WGMXCCGn1
    SolutionIndex: 75
    SolutionNameMin: Cijk_Ailk_Bljk_B8NSS_BH_Bias_FDMN_SPBML0_A_S_SAV_MT16x192x256_MI16x16x1_SN_LDSB1_AFC1_AG0_AFEM1_AFEM1_ASEM8_CLR1_CADS0_DTLA0_DTLB0_DTVA0_DTVB0_DTVMXSA0_DTVMXSB0_DTVSM0_DPLB0_EPS1_ELFLR0_EMLLn1_FDSI0_GRPM1_GRVWA16_GRVWB16_GSUn1_GSUAMBSK_GSUC1_GSUWGMRR1_GLS0_ISA942_IU1_K1_LDSTI0_LBSPPA256_LBSPPB128_LBSPPM0_LPA16_LPB16_LPM0_LRVWn1_LWPMn1_MIAV0_MIWT1_3_MO40_MGRIPM1_NTn1_NTA0_NTB0_NTC0_NTD4_NTM0_NEPBS16_NLCA1_NLCB1_ONLL1_PGR2_PLR1_PKA1_SGROB0_SIA3_SS1_SU16_SUM0_SUS256_SPO0_SRVW0_SSO0_SVW1_SK0_SKFTR0_SKXCCM0_SGRO0_TDMI0_TIN0_TLDS1_TLDSM1_ULSGRO0_USL1_USLMX0_UIOFGRO0_UPLRP0_USFGROn1_USI0_VSn1_VWA1_VWB1_WSGRA0_WSGRB0_WS64_WG16_16_1_WGM8_WGMXCC8_WGMXCCGn1
    SolutionIndex: 76
    SolutionNameMin: Cijk_Ailk_Bljk_B8NSS_BH_Bias_FDMN_SPBML0_A_S_SAV_MT32x192x256_MI16x16x1_SN_LDSB1_AFC1_AG0_AFEM1_AFEM1_ASEM8_CLR1_CADS0_DTLA0_DTLB0_DTVA0_DTVB0_DTVMXSA0_DTVMXSB0_DTVSM0_DPLB0_EPS1_ELFLR0_EMLLn1_FDSI0_GRPM1_GRVWA4_GRVWB16_GSUn1_GSUAMBSK_GSUC1_GSUWGMRR1_GLS0_ISA942_IU1_K1_LDSTI0_LBSPPA512_LBSPPB128_LBSPPM0_LPA32_LPB16_LPM0_LRVWn1_LWPMn1_MIAV0_MIWT2_3_MO40_MGRIPM1_NTn1_NTA0_NTB0_NTC0_NTD4_NTM0_NEPBS16_NLCA1_NLCB1_ONLL1_PGR2_PLR1_PKA1_SGROB0_SIA3_SS1_SU16_SUM0_SUS256_SPO0_SRVW0_SSO0_SVW2_SK0_SKFTR0_SKXCCM0_SGRO0_TDMI0_TIN0_TLDS1_TLDSM1_ULSGRO0_USL1_USLMX0_UIOFGRO0_UPLRP0_USFGROn1_USI0_VSn1_VWA2_VWB1_WSGRA0_WSGRB0_WS64_WG16_16_1_WGM8_WGMXCC8_WGMXCCGn1
    SolutionIndex: 77
    SolutionNameMin: Cijk_Ailk_Bljk_B8NSS_BH_Bias_FDMN_SPBML0_A_S_SAV_MT32x192x256_MI16x16x1_SN_LDSB1_AFC1_AG0_AFEM1_AFEM1_ASEM8_CLR1_CADS0_DTLA0_DTLB0_DTVA0_DTVB0_DTVMXSA0_DTVMXSB0_DTVSM0_DPLB0_EPS1_ELFLR0_EMLLn1_FDSI0_GRPM1_GRVWA16_GRVWB16_GSUn1_GSUAMBSK_GSUC1_GSUWGMRR1_GLS0_ISA942_IU1_K1_LDSTI0_LBSPPA512_LBSPPB128_LBSPPM0_LPA32_LPB16_LPM0_LRVWn1_LWPMn1_MIAV0_MIWT2_3_MO40_MGRIPM1_NTn1_NTA0_NTB0_NTC0_NTD4_NTM0_NEPBS16_NLCA1_NLCB1_ONLL1_PGR2_PLR1_PKA1_SGROB0_SIA3_SS1_SU16_SUM0_SUS256_SPO0_SRVW0_SSO0_SVW2_SK0_SKFTR0_SKXCCM0_SGRO0_TDMI0_TIN0_TLDS1_TLDSM1_ULSGRO0_USL1_USLMX0_UIOFGRO0_UPLRP0_USFGROn1_USI0_VSn1_VWA2_VWB1_WSGRA0_WSGRB0_WS64_WG16_16_1_WGM8_WGMXCC8_WGMXCCGn1
    SolutionIndex: 78
    SolutionNameMin: Cijk_Ailk_Bljk_B8NSS_BH_Bias_FDMN_SPBML0_A_S_SAV_MT16x192x256_MI16x16x1_SN_LDSB1_AFC1_AG0_AFEM1_AFEM1_ASEM8_CLR1_CADS0_DTLA0_DTLB0_DTVA0_DTVB0_DTVMXSA0_DTVMXSB0_DTVSM0_DPLB0_EPS1_ELFLR0_EMLLn1_FDSI0_GRPM1_GRVWA4_GRVWB16_GSUn1_GSUAMBSK_GSUC1_GSUWGMRR1_GLS0_ISA942_IU1_K1_LDSTI0_LBSPPA256_LBSPPB128_LBSPPM0_LPA16_LPB16_LPM0_LRVWn1_LWPMn1_MIAV0_MIWT1_3_MO40_MGRIPM1_NTn1_NTA0_NTB0_NTC0_NTD4_NTM0_NEPBS16_NLCA1_NLCB1_ONLL1_PGR2_PLR1_PKA1_SGROB0_SIA3_SS1_SU16_SUM0_SUS256_SPO0_SRVW0_SSO0_SVW1_SK0_SKFTR0_SKXCCM0_SGRO0_TDMI0_TIN0_TLDS1_TLDSM1_ULSGRO0_USL1_USLMX0_UIOFGRO0_UPLRP0_USFGROn1_USI0_VSn1_VWA1_VWB1_WSGRA0_WSGRB0_WS64_WG16_16_1_WGM1_WGMXCC1_WGMXCCGn1
    SolutionIndex: 79
    SolutionNameMin: Cijk_Ailk_Bljk_B8NSS_BH_Bias_FDMN_SPBML0_A_S_SAV_MT256x192x128_MI16x16x1_SN_LDSB1_AFC1_AG0_AFEM1_AFEM1_ASEM8_CLR1_CADS0_DTLA0_DTLB0_DTVA0_DTVB0_DTVMXSA0_DTVMXSB0_DTVSM0_DPLB0_EPS1_ELFLR0_EMLLn1_FDSI0_GRPM1_GRVWA4_GRVWB16_GSUn1_GSUAMBSK_GSUC1_GSUWGMRR1_GLS0_ISA942_IU1_K1_LDSTI0_LBSPPA0_LBSPPB128_LBSPPM0_LPA0_LPB16_LPM0_LRVWn1_LWPMn1_MIAV0_MIWT8_6_MO40_MGRIPM1_NTn1_NTA0_NTB0_NTC0_NTD4_NTM0_NEPBS8_NLCA1_NLCB1_ONLL1_PGR2_PLR1_PKA1_SGROB0_SIA3_SS1_SU16_SUM0_SUS256_SPO0_SRVW0_SSO0_SVW8_SK0_SKFTR0_SKXCCM0_SGRO0_TDMI0_TIN0_TLDS1_TLDSM1_ULSGRO0_USL1_USLMX0_UIOFGRO0_UPLRP0_USFGROn1_USI0_VSn1_VWA8_VWB2_WSGRA0_WSGRB0_WS64_WG32_8_1_WGM8_WGMXCC8_WGMXCCGn1
    SolutionIndex: 80
    SolutionNameMin: Cijk_Ailk_Bljk_B8NSS_BH_Bias_FDMN_SPBML0_A_S_SAV_MT256x192x128_MI16x16x1_SN_LDSB1_AFC1_AG0_AFEM1_AFEM1_ASEM8_CLR1_CADS0_DTLA0_DTLB0_DTVA0_DTVB0_DTVMXSA0_DTVMXSB0_DTVSM0_DPLB0_EPS1_ELFLR0_EMLLn1_FDSI0_GRPM1_GRVWA16_GRVWB16_GSUn1_GSUAMBSK_GSUC1_GSUWGMRR1_GLS0_ISA942_IU1_K1_LDSTI0_LBSPPA0_LBSPPB128_LBSPPM0_LPA0_LPB16_LPM0_LRVWn1_LWPMn1_MIAV0_MIWT8_6_MO40_MGRIPM1_NTn1_NTA0_NTB0_NTC0_NTD4_NTM0_NEPBS8_NLCA1_NLCB1_ONLL1_PGR2_PLR1_PKA1_SGROB0_SIA3_SS1_SU16_SUM0_SUS256_SPO0_SRVW0_SSO0_SVW8_SK0_SKFTR0_SKXCCM0_SGRO0_TDMI0_TIN0_TLDS1_TLDSM1_ULSGRO0_USL1_USLMX0_UIOFGRO0_UPLRP0_USFGROn1_USI0_VSn1_VWA8_VWB2_WSGRA0_WSGRB0_WS64_WG32_8_1_WGM8_WGMXCC8_WGMXCCGn1
    SolutionIndex: 81
    SolutionNameMin: Cijk_Ailk_Bljk_B8NSS_BH_Bias_FDMN_SPBML0_A_S_SAV_MT64x256x256_MI16x16x1_SN_LDSB1_AFC1_AG0_AFEM1_AFEM1_ASEM8_CLR1_CADS0_DTLA0_DTLB0_DTVA0_DTVB0_DTVMXSA0_DTVMXSB0_DTVSM0_DPLB0_EPS1_ELFLR0_EMLLn1_FDSI0_GRPM1_GRVWA16_GRVWB16_GSUn1_GSUAMBSK_GSUC1_GSUWGMRR1_GLS0_ISA942_IU1_K1_LDSTI0_LBSPPA1024_LBSPPB256_LBSPPM0_LPA64_LPB16_LPM0_LRVWn1_LWPMn1_MIAV0_MIWT4_4_MO40_MGRIPM1_NTn1_NTA0_NTB0_NTC0_NTD4_NTM0_NEPBS16_NLCA1_NLCB1_ONLL1_PGR2_PLR1_PKA1_SGROB0_SIA3_SS1_SU16_SUM0_SUS256_SPO0_SRVW0_SSO0_SVW4_SK0_SKFTR0_SKXCCM0_SGRO0_TDMI0_TIN0_TLDS1_TLDSM1_ULSGRO0_USL1_USLMX0_UIOFGRO0_UPLRP0_USFGROn1_USI0_VSn1_VWA4_VWB2_WSGRA0_WSGRB0_WS64_WG16_16_1_WGM1_WGMXCC1_WGMXCCGn1
    SolutionIndex: 82
    SolutionNameMin: Cijk_Ailk_Bljk_B8NSS_BH_Bias_FDMN_SPBML0_A_S_SAV_MT64x256x256_MI16x16x1_SN_LDSB1_AFC1_AG0_AFEM1_AFEM1_ASEM8_CLR1_CADS0_DTLA0_DTLB0_DTVA0_DTVB0_DTVMXSA0_DTVMXSB0_DTVSM0_DPLB0_EPS1_ELFLR0_EMLLn1_FDSI0_GRPM1_GRVWA4_GRVWB16_GSUn1_GSUAMBSK_GSUC1_GSUWGMRR1_GLS0_ISA942_IU1_K1_LDSTI0_LBSPPA1024_LBSPPB256_LBSPPM0_LPA64_LPB16_LPM0_LRVWn1_LWPMn1_MIAV0_MIWT4_4_MO40_MGRIPM1_NTn1_NTA0_NTB0_NTC0_NTD4_NTM0_NEPBS16_NLCA1_NLCB1_ONLL1_PGR2_PLR1_PKA1_SGROB0_SIA3_SS1_SU16_SUM0_SUS256_SPO0_SRVW0_SSO0_SVW4_SK0_SKFTR0_SKXCCM0_SGRO0_TDMI0_TIN0_TLDS1_TLDSM1_ULSGRO0_USL1_USLMX0_UIOFGRO0_UPLRP0_USFGROn1_USI0_VSn1_VWA4_VWB2_WSGRA0_WSGRB0_WS64_WG16_16_1_WGM1_WGMXCC1_WGMXCCGn1
    SolutionIndex: 83
    SolutionNameMin: Cijk_Ailk_Bljk_B8NSS_BH_Bias_FDMN_SPBML0_A_S_SAV_MT32x128x256_MI16x16x1_SN_LDSB1_AFC1_AG0_AFEM1_AFEM1_ASEM8_CLR1_CADS0_DTLA0_DTLB0_DTVA0_DTVB0_DTVMXSA0_DTVMXSB0_DTVSM0_DPLB0_EPS1_ELFLR0_EMLLn1_FDSI0_GRPM1_GRVWA16_GRVWB16_GSUn1_GSUAMBSK_GSUC1_GSUWGMRR1_GLS0_ISA942_IU1_K1_LDSTI0_LBSPPA512_LBSPPB256_LBSPPM0_LPA32_LPB16_LPM0_LRVWn1_LWPMn1_MIAV0_MIWT2_2_MO40_MGRIPM1_NTn1_NTA0_NTB0_NTC0_NTD4_NTM0_NEPBS16_NLCA1_NLCB1_ONLL1_PGR2_PLR1_PKA1_SGROB0_SIA3_SS1_SU16_SUM0_SUS256_SPO0_SRVW0_SSO0_SVW2_SK0_SKFTR0_SKXCCM0_SGRO0_TDMI0_TIN0_TLDS1_TLDSM1_ULSGRO0_USL1_USLMX0_UIOFGRO0_UPLRP0_USFGROn1_USI0_VSn1_VWA2_VWB2_WSGRA0_WSGRB0_WS64_WG16_16_1_WGM1_WGMXCC1_WGMXCCGn1
- - - [10752, 10240, 1, 512]
    - [2, 306.41]
  - - [9216, 10752, 1, 512]
    - [1, 316.29]
  - - [10240, 11264, 1, 512]
    - [0, 312.64]
  - - [9216, 17664, 1, 512]
    - [1, 317.4]
  - - [25600, 19968, 1, 512]
    - [1, 325.97]
  - - [25600, 20736, 1, 512]
    - [2, 322.33]
  - - [21504, 5120, 1, 512]
    - [0, 305.87]
  - - [13312, 7168, 1, 512]
    - [1, 306.9]
  - - [21504, 23040, 1, 512]
    - [2, 327.0]
  - - [24576, 4864, 1, 512]
    - [1, 312.29]
  - - [22528, 4352, 1, 512]
    - [3, 326.46]
  - - [90112, 800, 1, 512]
    - [3, 283.6]
  - - [23296, 4096, 1, 512]
    - [4, 322.22]
  - - [25600, 3840, 1, 512]
    - [4, 326.53]
  - - [21504, 4352, 1, 512]
    - [3, 313.14]
  - - [21760, 4352, 1, 512]
    - [4, 326.14]
  - - [53504, 1728, 1, 512]
    - [4, 319.08]
  - - [26624, 3584, 1, 512]
    - [4, 328.22]
  - - [43008, 2304, 1, 512]
    - [4, 331.91]
  - - [37632, 2432, 1, 512]
    - [3, 319.02]
  - - [4096, 131072, 1, 512]
    - [5, 348.83]
  - - [992, 42240, 1, 512]
    - [6, 237.23]
  - - [512, 100352, 1, 512]
    - [1, 290.42]
  - - [480, 119040, 1, 512]
    - [6, 234.08]
  - - [2304, 76032, 1, 512]
    - [7, 332.29]
  - - [2048, 70400, 1, 512]
    - [7, 317.41]
  - - [608, 131072, 1, 512]
    - [8, 252.85]
  - - [432, 126976, 1, 512]
    - [9, 226.5]
  - - [608, 69888, 1, 512]
    - [6, 237.36]
  - - [496, 82432, 1, 512]
    - [6, 222.6]
  - - [272, 100352, 1, 512]
    - [10, 201.82]
  - - [240, 122880, 1, 512]
    - [11, 194.97]
  - - [416, 49152, 1, 512]
    - [12, 196.58]
  - - [240, 126976, 1, 512]
    - [13, 197.11]
  - - [240, 102400, 1, 512]
    - [14, 199.06]
  - - [272, 98304, 1, 512]
    - [10, 199.18]
  - - [400, 93184, 1, 512]
    - [15, 209.89]
  - - [240, 103168, 1, 512]
    - [14, 195.36]
  - - [272, 99840, 1, 512]
    - [10, 197.53]
  - - [400, 92160, 1, 512]
    - [9, 210.6]
  - - [16, 16, 1, 512]
    - [16, 0.03]
  - - [7680, 16896, 1, 2048]
    - [1, 592.75]
  - - [9984, 7936, 1, 2048]
    - [1, 576.64]
  - - [12800, 6144, 1, 2048]
    - [1, 582.69]
  - - [16128, 16128, 1, 2048]
    - [2, 580.3]
  - - [6656, 19968, 1, 2048]
    - [2, 578.14]
  - - [32768, 13824, 1, 2048]
    - [17, 630.58]
  - - [7936, 9984, 1, 2048]
    - [1, 570.42]
  - - [8192, 8960, 1, 2048]
    - [2, 563.07]
  - - [5376, 16640, 1, 2048]
    - [1, 568.41]
  - - [8960, 5632, 1, 2048]
    - [2, 549.03]
  - - [47872, 992, 1, 2048]
    - [2, 526.94]
  - - [83200, 736, 1, 2048]
    - [18, 460.25]
  - - [96768, 608, 1, 2048]
    - [2, 448.37]
  - - [25344, 2816, 1, 2048]
    - [2, 568.06]
  - - [59392, 1152, 1, 2048]
    - [2, 547.85]
  - - [46592, 1536, 1, 2048]
    - [2, 559.14]
  - - [43520, 1792, 1, 2048]
    - [2, 574.2]
  - - [90112, 496, 1, 2048]
    - [18, 423.01]
  - - [47872, 1856, 1, 2048]
    - [2, 566.45]
  - - [61952, 1024, 1, 2048]
    - [4, 520.65]
  - - [3968, 14592, 1, 2048]
    - [18, 528.68]
  - - [2688, 33792, 1, 2048]
    - [2, 514.5]
  - - [768, 69632, 1, 2048]
    - [2, 539.17]
  - - [576, 103168, 1, 2048]
    - [19, 489.17]
  - - [768, 66816, 1, 2048]
    - [18, 530.17]
  - - [768, 76800, 1, 2048]
    - [1, 547.59]
  - - [512, 99840, 1, 2048]
    - [20, 510.15]
  - - [480, 107520, 1, 2048]
    - [21, 388.8]
  - - [4096, 25088, 1, 2048]
    - [20, 536.06]
  - - [1984, 41216, 1, 2048]
    - [1, 501.61]
  - - [69888, 432, 1, 2048]
    - [2, 410.74]
  - - [5120, 4352, 1, 2048]
    - [4, 445.93]
  - - [272, 77824, 1, 2048]
    - [22, 342.54]
  - - [53248, 704, 1, 2048]
    - [23, 402.86]
  - - [14592, 1792, 1, 2048]
    - [4, 483.7]
  - - [26624, 864, 1, 2048]
    - [4, 444.12]
  - - [34048, 1024, 1, 2048]
    - [1, 534.26]
  - - [52224, 512, 1, 2048]
    - [24, 421.76]
  - - [29184, 896, 1, 2048]
    - [25, 472.84]
  - - [1216, 17664, 1, 2048]
    - [26, 379.91]
  - - [50688, 320, 1, 2048]
    - [27, 373.38]
  - - [33792, 448, 1, 2048]
    - [2, 429.09]
  - - [160, 115200, 1, 2048]
    - [28, 333.83]
  - - [1280, 13312, 1, 2048]
    - [1, 511.47]
  - - [16896, 928, 1, 2048]
    - [2, 473.2]
  - - [736, 19712, 1, 2048]
    - [29, 362.13]
  - - [128, 115200, 1, 2048]
    - [30, 391.29]
  - - [60928, 256, 1, 2048]
    - [1, 399.57]
  - - [30720, 464, 1, 2048]
    - [0, 399.85]
  - - [128, 114688, 1, 2048]
    - [30, 390.5]
  - - [128, 103680, 1, 2048]
    - [30, 380.5]
  - - [128, 103936, 1, 2048]
    - [31, 372.29]
  - - [128, 96512, 1, 2048]
    - [32, 375.57]
  - - [128, 103168, 1, 2048]
    - [30, 371.62]
  - - [128, 100352, 1, 2048]
    - [30, 363.27]
  - - [96, 111360, 1, 2048]
    - [33, 300.91]
  - - [96, 115200, 1, 2048]
    - [34, 302.04]
  - - [128, 96000, 1, 2048]
    - [35, 379.61]
  - - [128, 99840, 1, 2048]
    - [36, 356.74]
  - - [128, 102400, 1, 2048]
    - [30, 368.73]
  - - [1024, 1024, 1, 2048]
    - [37, 149.2]
  - - [7424, 7936, 1, 4096]
    - [2, 646.28]
  - - [6144, 11264, 1, 4096]
    - [2, 623.95]
  - - [8960, 8960, 1, 4096]
    - [38, 614.76]
  - - [4608, 15872, 1, 4096]
    - [2, 600.63]
  - - [8960, 6656, 1, 4096]
    - [1, 616.12]
  - - [9984, 7936, 1, 4096]
    - [1, 633.85]
  - - [5376, 14336, 1, 4096]
    - [2, 629.63]
  - - [4608, 19712, 1, 4096]
    - [2, 610.2]
  - - [4608, 16640, 1, 4096]
    - [2, 610.53]
  - - [12288, 4864, 1, 4096]
    - [0, 627.21]
  - - [62208, 1024, 1, 4096]
    - [17, 559.51]
  - - [29696, 2304, 1, 4096]
    - [0, 597.08]
  - - [19200, 2816, 1, 4096]
    - [1, 613.85]
  - - [20736, 2816, 1, 4096]
    - [2, 623.67]
  - - [96512, 496, 1, 4096]
    - [1, 518.46]
  - - [24320, 2304, 1, 4096]
    - [2, 622.9]
  - - [50176, 992, 1, 4096]
    - [17, 558.22]
  - - [45056, 1216, 1, 4096]
    - [18, 582.79]
  - - [28160, 2048, 1, 4096]
    - [2, 632.87]
  - - [17664, 3200, 1, 4096]
    - [2, 612.14]
  - - [3456, 20736, 1, 4096]
    - [2, 610.27]
  - - [1984, 43776, 1, 4096]
    - [2, 576.46]
  - - [768, 66560, 1, 4096]
    - [20, 585.3]
  - - [768, 73728, 1, 4096]
    - [2, 588.1]
  - - [608, 84480, 1, 4096]
    - [39, 460.25]
  - - [2048, 34048, 1, 4096]
    - [38, 612.02]
  - - [768, 94208, 1, 4096]
    - [2, 589.21]
  - - [448, 100352, 1, 4096]
    - [38, 439.51]
  - - [3072, 23808, 1, 4096]
    - [2, 624.41]
  - - [992, 64768, 1, 4096]
    - [38, 526.12]
  - - [19456, 1472, 1, 4096]
    - [40, 564.59]
  - - [96512, 240, 1, 4096]
    - [4, 379.57]
  - - [7936, 3072, 1, 4096]
    - [23, 547.68]
  - - [16128, 1472, 1, 4096]
    - [23, 509.53]
  - - [736, 28672, 1, 4096]
    - [41, 456.02]
  - - [1024, 36864, 1, 4096]
    - [2, 576.52]
  - - [192, 119040, 1, 4096]
    - [42, 404.19]
  - - [31744, 736, 1, 4096]
    - [4, 453.13]
  - - [352, 111104, 1, 4096]
    - [43, 456.55]
  - - [15872, 1472, 1, 4096]
    - [4, 499.94]
  - - [1728, 8448, 1, 4096]
    - [19, 567.01]
  - - [192, 76544, 1, 4096]
    - [44, 509.23]
  - - [256, 70400, 1, 4096]
    - [45, 545.43]
  - - [192, 75264, 1, 4096]
    - [19, 513.99]
  - - [192, 77824, 1, 4096]
    - [44, 514.63]
  - - [128, 107520, 1, 4096]
    - [46, 383.14]
  - - [192, 76800, 1, 4096]
    - [44, 511.9]
  - - [144, 103168, 1, 4096]
    - [41, 294.48]
  - - [192, 73728, 1, 4096]
    - [19, 505.22]
  - - [192, 76032, 1, 4096]
    - [19, 517.78]
  - - [128, 96000, 1, 4096]
    - [47, 408.43]
  - - [128, 103168, 1, 4096]
    - [48, 368.82]
  - - [128, 103680, 1, 4096]
    - [49, 370.74]
  - - [128, 103936, 1, 4096]
    - [50, 373.71]
  - - [5888, 1856, 1, 4096]
    - [51, 503.69]
  - - [128, 96768, 1, 4096]
    - [52, 402.88]
  - - [128, 89856, 1, 4096]
    - [52, 403.76]
  - - [128, 96512, 1, 4096]
    - [52, 405.62]
  - - [128, 100352, 1, 4096]
    - [53, 370.31]
  - - [96, 111360, 1, 4096]
    - [54, 286.92]
  - - [16, 88320, 1, 4096]
    - [55, 95.52]
  - - [32, 90112, 1, 4096]
    - [56, 177.72]
  - - [48, 64768, 1, 4096]
    - [57, 207.15]
  - - [16, 65280, 1, 4096]
    - [58, 96.11]
  - - [16, 70400, 1, 4096]
    - [59, 99.73]
  - - [32, 73728, 1, 4096]
    - [60, 191.79]
  - - [16, 79360, 1, 4096]
    - [61, 91.77]
  - - [16, 81664, 1, 4096]
    - [61, 91.97]
  - - [16, 81920, 1, 4096]
    - [61, 92.49]
  - - [32, 86016, 1, 4096]
    - [62, 175.34]
  - - [4608, 12544, 1, 8192]
    - [63, 706.16]
  - - [4608, 14848, 1, 8192]
    - [63, 664.95]
  - - [7936, 7424, 1, 8192]
    - [63, 689.89]
  - - [12800, 4608, 1, 8192]
    - [63, 719.6]
  - - [5376, 10752, 1, 8192]
    - [63, 681.51]
  - - [6400, 12288, 1, 8192]
    - [63, 720.06]
  - - [4608, 15360, 1, 8192]
    - [63, 669.35]
  - - [12288, 19712, 1, 8192]
    - [64, 695.29]
  - - [9984, 8192, 1, 8192]
    - [20, 651.54]
  - - [4864, 12288, 1, 8192]
    - [63, 683.0]
  - - [32256, 1600, 1, 8192]
    - [65, 650.76]
  - - [38400, 1536, 1, 8192]
    - [65, 687.5]
  - - [46080, 1280, 1, 8192]
    - [65, 679.72]
  - - [24320, 2304, 1, 8192]
    - [63, 662.94]
  - - [42240, 1280, 1, 8192]
    - [63, 677.57]
  - - [23296, 2304, 1, 8192]
    - [63, 621.23]
  - - [53760, 1024, 1, 8192]
    - [65, 654.8]
  - - [44544, 1280, 1, 8192]
    - [65, 671.33]
  - - [33280, 1600, 1, 8192]
    - [65, 640.78]
  - - [32256, 1728, 1, 8192]
    - [63, 627.58]
  - - [2048, 36864, 1, 8192]
    - [63, 693.76]
  - - [768, 71680, 1, 8192]
    - [63, 614.27]
  - - [1280, 44544, 1, 8192]
    - [63, 672.6]
  - - [2304, 25600, 1, 8192]
    - [65, 688.44]
  - - [768, 72960, 1, 8192]
    - [63, 654.53]
  - - [1984, 35328, 1, 8192]
    - [40, 626.87]
  - - [1472, 46080, 1, 8192]
    - [40, 607.73]
  - - [768, 66560, 1, 8192]
    - [63, 596.44]
  - - [768, 76800, 1, 8192]
    - [63, 653.54]
  - - [1536, 38400, 1, 8192]
    - [63, 716.3]
  - - [288, 78848, 1, 8192]
    - [41, 337.28]
  - - [400, 78848, 1, 8192]
    - [40, 408.87]
  - - [320, 89856, 1, 8192]
    - [39, 398.03]
  - - [78848, 480, 1, 8192]
    - [66, 499.1]
  - - [768, 47616, 1, 8192]
    - [63, 641.35]
  - - [34048, 928, 1, 8192]
    - [63, 620.22]
  - - [14080, 2688, 1, 8192]
    - [63, 663.09]
  - - [47872, 704, 1, 8192]
    - [63, 616.67]
  - - [48384, 736, 1, 8192]
    - [63, 652.49]
  - - [37632, 992, 1, 8192]
    - [63, 671.4]
  - - [240, 70656, 1, 8192]
    - [67, 381.52]
  - - [47104, 304, 1, 8192]
    - [68, 438.73]
  - - [384, 50176, 1, 8192]
    - [21, 497.89]
  - - [10240, 1856, 1, 8192]
    - [69, 601.75]
  - - [512, 37632, 1, 8192]
    - [63, 637.09]
  - - [256, 62208, 1, 8192]
    - [70, 483.46]
  - - [256, 64768, 1, 8192]
    - [63, 497.24]
  - - [256, 59136, 1, 8192]
    - [63, 507.75]
  - - [256, 65536, 1, 8192]
    - [63, 500.49]
  - - [8448, 2176, 1, 8192]
    - [63, 610.91]
  - - [256, 39168, 1, 8192]
    - [40, 514.41]
  - - [320, 41472, 1, 8192]
    - [39, 437.76]
  - - [176, 69120, 1, 8192]
    - [71, 365.82]
  - - [51968, 256, 1, 8192]
    - [24, 458.35]
  - - [192, 66816, 1, 8192]
    - [44, 411.05]
  - - [128, 82944, 1, 8192]
    - [47, 334.41]
  - - [192, 56576, 1, 8192]
    - [41, 440.58]
  - - [112, 96768, 1, 8192]
    - [52, 278.18]
  - - [112, 96000, 1, 8192]
    - [47, 277.47]
  - - [512, 19968, 1, 8192]
    - [72, 498.78]
  - - [32, 59136, 1, 8192]
    - [73, 136.63]
  - - [16, 55552, 1, 8192]
    - [74, 84.02]
  - - [16, 52992, 1, 8192]
    - [75, 91.95]
  - - [32, 51968, 1, 8192]
    - [76, 170.7]
  - - [32, 52224, 1, 8192]
    - [77, 171.36]
  - - [32, 46080, 1, 8192]
    - [77, 168.65]
  - - [16, 48384, 1, 8192]
    - [75, 91.5]
  - - [32, 59904, 1, 8192]
    - [73, 135.02]
  - - [32, 59392, 1, 8192]
    - [73, 135.13]
  - - [16, 49152, 1, 8192]
    - [78, 92.24]
  - - [8192, 1792, 1, 32768]
    - [65, 669.61]
  - - [29440, 512, 1, 32768]
    - [63, 648.7]
  - - [6400, 2560, 1, 32768]
    - [63, 666.71]
  - - [5376, 2816, 1, 32768]
    - [63, 658.55]
  - - [3968, 4096, 1, 32768]
    - [63, 674.29]
  - - [3584, 4608, 1, 32768]
    - [63, 690.81]
  - - [28160, 512, 1, 32768]
    - [65, 609.63]
  - - [1792, 9216, 1, 32768]
    - [38, 684.95]
  - - [9216, 1472, 1, 32768]
    - [65, 633.54]
  - - [3840, 4096, 1, 32768]
    - [63, 681.71]
  - - [29696, 416, 1, 32768]
    - [63, 539.64]
  - - [25344, 496, 1, 32768]
    - [63, 580.56]
  - - [7680, 1408, 1, 32768]
    - [79, 546.86]
  - - [19712, 608, 1, 32768]
    - [63, 571.24]
  - - [640, 16128, 1, 32768]
    - [43, 477.5]
  - - [23808, 496, 1, 32768]
    - [63, 556.5]
  - - [30464, 432, 1, 32768]
    - [63, 584.99]
  - - [9216, 1280, 1, 32768]
    - [65, 574.81]
  - - [5376, 2304, 1, 32768]
    - [80, 610.34]
  - - [4352, 2944, 1, 32768]
    - [80, 619.7]
  - - [48, 131072, 1, 32768]
    - [81, 181.8]
  - - [64, 131072, 1, 32768]
    - [81, 247.7]
  - - [48, 126976, 1, 32768]
    - [81, 178.39]
  - - [64, 126976, 1, 32768]
    - [81, 243.9]
  - - [64, 122880, 1, 32768]
    - [81, 236.93]
  - - [48, 122880, 1, 32768]
    - [81, 174.33]
  - - [64, 119040, 1, 32768]
    - [82, 230.88]
  - - [48, 119040, 1, 32768]
    - [81, 170.18]
  - - [32, 131072, 1, 32768]
    - [83, 136.73]
  - - [48, 118784, 1, 32768]
    - [81, 169.75]
- null
- null
- DeviceEfficiency
- GridBased
