projects/hipsparselt/library/src/hcc_detail/rocsparselt/src/spmm/Tensile/Logic/asm_full/aquavanjaram/gfx942/GridBased/aquavanjaram_Cijk_Alik_Bjlk_I8IS_BH_Bias_S_FDMN_SPB_A_S_SAV.yaml
- {MinimumRequiredVersion: 5.0.0}
- aquavanjaram
- gfx942
- [Device 0049, Device 0050]
    SolutionIndex: 0
    SolutionNameMin: Cijk_Alik_Bjlk_I8IS_BH_Bias_S_FDMN_SPB_A_S_SAV_MT256x256x128_MI16x16x1_SN_LDSB1_AFC1_AG0_AFEM1_AFEM1_ASEM8_CLR1_CADS0_DTLA0_DTLB0_DTVA0_DTVB0_EPS1_FDSI0_GRPM1_GRVWA16_GRVWB8_GSUn1_GSUAMB_GSUC1_GSUWGMRR1_GLS0_ISA942_IU1_K1_LDSTI0_LBSPPA512_LBSPPB4096_LBSPPM0_LPA32_LPB64_LPM0_LRVW16_LWPMn1_MIAV0_MIWT4_16_MO40_NTn1_NTA0_NTB0_NTC0_NTD4_NTM0_NEPBS0_NLCA1_NLCB1_ONLL1_PGR2_PLR1_PKA1_SIA3_SS1_SU16_SUM0_SUS256_SPO0_SRVW0_SSO0_SVW4_SK0_SKFTR0_SKXCCM0_TLDS1_ULSGRO0_USL1_UIOFGRO0_USFGROn1_VSn1_VWA4_VWB4_WSGRA0_WSGRB0_WS64_WG64_4_1_WGM8_WGMXCC8_WGMXCCGn1
    SolutionIndex: 1
    SolutionNameMin: Cijk_Alik_Bjlk_I8IS_BH_Bias_S_FDMN_SPB_A_S_SAV_MT256x256x128_MI16x16x1_SN_LDSB1_AFC1_AG0_AFEM1_AFEM1_ASEM8_CLR1_CADS0_DTLA0_DTLB0_DTVA0_DTVB0_EPS1_FDSI0_GRPM1_GRVWA16_GRVWB16_GSUn1_GSUAMB_GSUC1_GSUWGMRR1_GLS0_ISA942_IU1_K1_LDSTI0_LBSPPA512_LBSPPB4096_LBSPPM0_LPA32_LPB64_LPM0_LRVW16_LWPMn1_MIAV0_MIWT4_16_MO40_NTn1_NTA0_NTB0_NTC0_NTD4_NTM0_NEPBS0_NLCA1_NLCB1_ONLL1_PGR2_PLR1_PKA1_SIA3_SS1_SU16_SUM0_SUS256_SPO0_SRVW0_SSO0_SVW4_SK0_SKFTR0_SKXCCM0_TLDS1_ULSGRO0_USL1_UIOFGRO0_USFGROn1_VSn1_VWA4_VWB4_WSGRA0_WSGRB0_WS64_WG64_4_1_WGM8_WGMXCC8_WGMXCCGn1
    SolutionIndex: 2
    SolutionNameMin: Cijk_Alik_Bjlk_I8IS_BH_Bias_S_FDMN_SPB_A_S_SAV_MT224x256x128_MI16x16x1_SN_LDSB1_AFC1_AG0_AFEM1_AFEM1_ASEM8_CLR1_CADS0_DTLA0_DTLB0_DTVA0_DTVB0_EPS1_FDSI0_GRPM1_GRVWA16_GRVWB16_GSUn1_GSUAMB_GSUC1_GSUWGMRR1_GLS0_ISA942_IU1_K1_LDSTI0_LBSPPA256_LBSPPB4096_LBSPPM0_LPA32_LPB32_LPM0_LRVW16_LWPMn1_MIAV0_MIWT14_4_MO40_NTn1_NTA0_NTB0_NTC0_NTD4_NTM0_NEPBS0_NLCA1_NLCB1_ONLL1_PGR2_PLR1_PKA1_SIA3_SS1_SU16_SUM0_SUS256_SPO0_SRVW0_SSO0_SVW2_SK0_SKFTR0_SKXCCM0_TLDS1_ULSGRO0_USL1_UIOFGRO0_USFGROn1_VSn1_VWA2_VWB2_WSGRA0_WSGRB0_WS64_WG16_16_1_WGM8_WGMXCC8_WGMXCCGn1
    SolutionIndex: 3
    SolutionNameMin: Cijk_Alik_Bjlk_I8IS_BH_Bias_S_FDMN_SPB_A_S_SAV_MT192x256x128_MI16x16x1_SN_LDSB1_AFC1_AG0_AFEM1_AFEM1_ASEM8_CLR1_CADS0_DTLA0_DTLB0_DTVA0_DTVB0_EPS1_FDSI0_GRPM1_GRVWA16_GRVWB16_GSUn1_GSUAMB_GSUC1_GSUWGMRR1_GLS0_ISA942_IU1_K1_LDSTI0_LBSPPA512_LBSPPB4096_LBSPPM0_LPA32_LPB32_LPM0_LRVW16_LWPMn1_MIAV0_MIWT12_4_MO40_NTn1_NTA0_NTB0_NTC0_NTD4_NTM0_NEPBS0_NLCA1_NLCB1_ONLL1_PGR2_PLR1_PKA1_SIA3_SS1_SU16_SUM0_SUS256_SPO0_SRVW0_SSO0_SVW4_SK0_SKFTR0_SKXCCM0_TLDS1_ULSGRO0_USL1_UIOFGRO0_USFGROn1_VSn1_VWA4_VWB2_WSGRA0_WSGRB0_WS64_WG16_16_1_WGM8_WGMXCC8_WGMXCCGn1
    SolutionIndex: 4
    SolutionNameMin: Cijk_Alik_Bjlk_I8IS_BH_Bias_S_FDMN_SPB_A_S_SAV_MT256x128x64_MI16x16x1_SN_LDSB1_AFC1_AG0_AFEM1_AFEM1_ASEM8_CLR0_CADS0_DTLA0_DTLB0_DTVA0_DTVB0_EPS1_FDSI0_GRPM1_GRVWA16_GRVWB8_GSUn1_GSUAMB_GSUC1_GSUWGMRR1_GLS0_ISA942_IU1_K1_LDSTI0_LBSPPA256_LBSPPB2048_LBSPPM0_LPA32_LPB32_LPM0_LRVW16_LWPMn1_MIAV0_MIWT4_8_MO40_NTn1_NTA0_NTB0_NTC0_NTD4_NTM0_NEPBS16_NLCA1_NLCB1_ONLL1_PGR2_PLR0_PKA1_SIA3_SS1_SU16_SUM0_SUS256_SPO0_SRVW0_SSO0_SVW4_SK0_SKFTR0_SKXCCM0_TLDS1_ULSGRO0_USL1_UIOFGRO0_USFGROn1_VSn1_VWA4_VWB2_WSGRA0_WSGRB0_WS64_WG64_4_1_WGM8_WGMXCC8_WGMXCCGn1
    SolutionIndex: 5
    SolutionNameMin: Cijk_Alik_Bjlk_I8IS_BH_Bias_S_FDMN_SPB_A_S_SAV_MT256x128x64_MI16x16x1_SN_LDSB1_AFC1_AG0_AFEM1_AFEM1_ASEM8_CLR0_CADS0_DTLA0_DTLB0_DTVA0_DTVB0_EPS1_FDSI0_GRPM1_GRVWA16_GRVWB16_GSUn1_GSUAMB_GSUC1_GSUWGMRR1_GLS0_ISA942_IU1_K1_LDSTI0_LBSPPA256_LBSPPB2048_LBSPPM0_LPA32_LPB32_LPM0_LRVW16_LWPMn1_MIAV0_MIWT4_8_MO40_NTn1_NTA0_NTB0_NTC0_NTD4_NTM0_NEPBS16_NLCA1_NLCB1_ONLL1_PGR2_PLR0_PKA1_SIA3_SS1_SU16_SUM0_SUS256_SPO0_SRVW0_SSO0_SVW4_SK0_SKFTR0_SKXCCM0_TLDS1_ULSGRO0_USL1_UIOFGRO0_USFGROn1_VSn1_VWA4_VWB2_WSGRA0_WSGRB0_WS64_WG64_4_1_WGM8_WGMXCC8_WGMXCCGn1
    SolutionIndex: 6
    SolutionNameMin: Cijk_Alik_Bjlk_I8IS_BH_Bias_S_FDMN_SPB_A_S_SAV_MT224x128x64_MI16x16x1_SN_LDSB1_AFC1_AG0_AFEM1_AFEM1_ASEM8_CLR0_CADS0_DTLA0_DTLB0_DTVA0_DTVB0_EPS1_FDSI0_GRPM1_GRVWA4_GRVWB8_GSUn1_GSUAMB_GSUC1_GSUWGMRR1_GLS0_ISA942_IU1_K1_LDSTI0_LBSPPA128_LBSPPB2048_LBSPPM0_LPA32_LPB32_LPM0_LRVW16_LWPMn1_MIAV0_MIWT14_2_MO40_NTn1_NTA0_NTB0_NTC0_NTD4_NTM0_NEPBS16_NLCA1_NLCB1_ONLL1_PGR2_PLR0_PKA1_SIA3_SS1_SU16_SUM0_SUS256_SPO0_SRVW0_SSO0_SVW2_SK0_SKFTR0_SKXCCM0_TLDS1_ULSGRO0_USL1_UIOFGRO0_USFGROn1_VSn1_VWA2_VWB2_WSGRA0_WSGRB0_WS64_WG16_16_1_WGM8_WGMXCC8_WGMXCCGn1
    SolutionIndex: 7
    SolutionNameMin: Cijk_Alik_Bjlk_I8IS_BH_Bias_S_FDMN_SPB_A_S_SAV_MT224x128x64_MI16x16x1_SN_LDSB1_AFC1_AG0_AFEM1_AFEM1_ASEM8_CLR0_CADS0_DTLA0_DTLB0_DTVA0_DTVB0_EPS1_FDSI0_GRPM1_GRVWA4_GRVWB16_GSUn1_GSUAMB_GSUC1_GSUWGMRR1_GLS0_ISA942_IU1_K1_LDSTI0_LBSPPA128_LBSPPB2048_LBSPPM0_LPA32_LPB32_LPM0_LRVW16_LWPMn1_MIAV0_MIWT14_2_MO40_NTn1_NTA0_NTB0_NTC0_NTD4_NTM0_NEPBS16_NLCA1_NLCB1_ONLL1_PGR2_PLR0_PKA1_SIA3_SS1_SU16_SUM0_SUS256_SPO0_SRVW0_SSO0_SVW2_SK0_SKFTR0_SKXCCM0_TLDS1_ULSGRO0_USL1_UIOFGRO0_USFGROn1_VSn1_VWA2_VWB2_WSGRA0_WSGRB0_WS64_WG16_16_1_WGM8_WGMXCC8_WGMXCCGn1
    SolutionIndex: 8
    SolutionNameMin: Cijk_Alik_Bjlk_I8IS_BH_Bias_S_FDMN_SPB_A_S_SAV_MT192x128x64_MI16x16x1_SN_LDSB1_AFC1_AG0_AFEM1_AFEM1_ASEM8_CLR0_CADS0_DTLA0_DTLB0_DTVA0_DTVB0_EPS1_FDSI0_GRPM1_GRVWA16_GRVWB16_GSUn1_GSUAMB_GSUC1_GSUWGMRR1_GLS0_ISA942_IU1_K1_LDSTI0_LBSPPA256_LBSPPB2048_LBSPPM0_LPA32_LPB32_LPM0_LRVW16_LWPMn1_MIAV0_MIWT12_2_MO40_NTn1_NTA0_NTB0_NTC0_NTD4_NTM0_NEPBS16_NLCA1_NLCB1_ONLL1_PGR2_PLR0_PKA1_SIA3_SS1_SU16_SUM0_SUS256_SPO0_SRVW0_SSO0_SVW4_SK0_SKFTR0_SKXCCM0_TLDS1_ULSGRO0_USL1_UIOFGRO0_USFGROn1_VSn1_VWA4_VWB2_WSGRA0_WSGRB0_WS64_WG16_16_1_WGM8_WGMXCC8_WGMXCCGn1
    SolutionIndex: 9
    SolutionNameMin: Cijk_Alik_Bjlk_I8IS_BH_Bias_S_FDMN_SPB_A_S_SAV_MT128x256x64_MI16x16x1_SN_LDSB1_AFC1_AG0_AFEM1_AFEM1_ASEM8_CLR0_CADS0_DTLA0_DTLB0_DTVA0_DTVB0_EPS1_FDSI0_GRPM1_GRVWA4_GRVWB16_GSUn1_GSUAMB_GSUC1_GSUWGMRR1_GLS0_ISA942_IU1_K1_LDSTI0_LBSPPA256_LBSPPB4096_LBSPPM0_LPA32_LPB32_LPM0_LRVW16_LWPMn1_MIAV0_MIWT4_8_MO40_NTn1_NTA0_NTB0_NTC0_NTD4_NTM0_NEPBS16_NLCA1_NLCB1_ONLL1_PGR2_PLR0_PKA1_SIA3_SS1_SU16_SUM0_SUS256_SPO0_SRVW0_SSO0_SVW4_SK0_SKFTR0_SKXCCM0_TLDS1_ULSGRO0_USL1_UIOFGRO0_USFGROn1_VSn1_VWA4_VWB2_WSGRA0_WSGRB0_WS64_WG32_8_1_WGM8_WGMXCC8_WGMXCCGn1
    SolutionIndex: 10
    SolutionNameMin: Cijk_Alik_Bjlk_I8IS_BH_Bias_S_FDMN_SPB_A_S_SAV_MT160x384x128_MI16x16x1_SN_LDSB1_AFC1_AG0_AFEM1_AFEM1_ASEM8_CLR1_CADS0_DTLA0_DTLB0_DTVA0_DTVB0_EPS1_FDSI0_GRPM1_GRVWA16_GRVWB16_GSUn1_GSUAMB_GSUC1_GSUWGMRR1_GLS0_ISA942_IU1_K1_LDSTI0_LBSPPA256_LBSPPB6144_LBSPPM0_LPA32_LPB32_LPM0_LRVW16_LWPMn1_MIAV0_MIWT10_6_MO40_NTn1_NTA0_NTB0_NTC0_NTD4_NTM0_NEPBS0_NLCA1_NLCB3_ONLL1_PGR2_PLR1_PKA1_SIA3_SS1_SU16_SUM0_SUS256_SPO0_SRVW0_SSO0_SVW2_SK0_SKFTR0_SKXCCM0_TLDS1_ULSGRO0_USL1_UIOFGRO0_USFGROn1_VSn1_VWA2_VWB2_WSGRA0_WSGRB0_WS64_WG16_16_1_WGM8_WGMXCC8_WGMXCCGn1
    SolutionIndex: 11
    SolutionNameMin: Cijk_Alik_Bjlk_I8IS_BH_Bias_S_FDMN_SPB_A_S_SAV_MT160x256x128_MI16x16x1_SN_LDSB1_AFC1_AG0_AFEM1_AFEM1_ASEM8_CLR1_CADS0_DTLA0_DTLB0_DTVA0_DTVB0_EPS1_FDSI0_GRPM1_GRVWA16_GRVWB16_GSUn1_GSUAMB_GSUC1_GSUWGMRR1_GLS0_ISA942_IU1_K1_LDSTI0_LBSPPA256_LBSPPB4096_LBSPPM0_LPA32_LPB32_LPM0_LRVW16_LWPMn1_MIAV0_MIWT10_4_MO40_NTn1_NTA0_NTB0_NTC0_NTD4_NTM0_NEPBS0_NLCA1_NLCB1_ONLL1_PGR2_PLR1_PKA1_SIA3_SS1_SU16_SUM0_SUS256_SPO0_SRVW0_SSO0_SVW2_SK0_SKFTR0_SKXCCM0_TLDS1_ULSGRO0_USL1_UIOFGRO0_USFGROn1_VSn1_VWA2_VWB2_WSGRA0_WSGRB0_WS64_WG16_16_1_WGM8_WGMXCC8_WGMXCCGn1
    SolutionIndex: 12
    SolutionNameMin: Cijk_Alik_Bjlk_I8IS_BH_Bias_S_FDMN_SPB_A_S_SAV_MT128x256x64_MI16x16x1_SN_LDSB1_AFC1_AG0_AFEM1_AFEM1_ASEM8_CLR0_CADS0_DTLA0_DTLB0_DTVA0_DTVB0_EPS1_FDSI0_GRPM1_GRVWA16_GRVWB16_GSUn1_GSUAMB_GSUC1_GSUWGMRR1_GLS0_ISA942_IU1_K1_LDSTI0_LBSPPA256_LBSPPB4096_LBSPPM0_LPA32_LPB32_LPM0_LRVW16_LWPMn1_MIAV0_MIWT4_8_MO40_NTn1_NTA0_NTB0_NTC0_NTD4_NTM0_NEPBS16_NLCA1_NLCB1_ONLL1_PGR2_PLR0_PKA1_SIA3_SS1_SU16_SUM0_SUS256_SPO0_SRVW0_SSO0_SVW4_SK0_SKFTR0_SKXCCM0_TLDS1_ULSGRO0_USL1_UIOFGRO0_USFGROn1_VSn1_VWA4_VWB2_WSGRA0_WSGRB0_WS64_WG32_8_1_WGM8_WGMXCC8_WGMXCCGn1
    SolutionIndex: 13
    SolutionNameMin: Cijk_Alik_Bjlk_I8IS_BH_Bias_S_FDMN_SPB_A_S_SAV_MT160x192x64_MI16x16x1_SN_LDSB1_AFC1_AG0_AFEM1_AFEM1_ASEM8_CLR0_CADS0_DTLA0_DTLB0_DTVA0_DTVB0_EPS1_FDSI0_GRPM1_GRVWA4_GRVWB8_GSUn1_GSUAMB_GSUC1_GSUWGMRR1_GLS0_ISA942_IU1_K1_LDSTI0_LBSPPA128_LBSPPB3072_LBSPPM0_LPA32_LPB32_LPM0_LRVW16_LWPMn1_MIAV0_MIWT5_6_MO40_NTn1_NTA0_NTB0_NTC0_NTD4_NTM0_NEPBS16_NLCA1_NLCB3_ONLL1_PGR2_PLR0_PKA1_SIA3_SS1_SU16_SUM0_SUS256_SPO0_SRVW0_SSO0_SVW1_SK0_SKFTR0_SKXCCM0_TLDS1_ULSGRO0_USL1_UIOFGRO0_USFGROn1_VSn1_VWA1_VWB2_WSGRA0_WSGRB0_WS64_WG32_8_1_WGM8_WGMXCC8_WGMXCCGn1
    SolutionIndex: 14
    SolutionNameMin: Cijk_Alik_Bjlk_I8IS_BH_Bias_S_FDMN_SPB_A_S_SAV_MT144x192x64_MI16x16x1_SN_LDSB1_AFC1_AG0_AFEM1_AFEM1_ASEM8_CLR0_CADS0_DTLA0_DTLB0_DTVA0_DTVB0_EPS1_FDSI0_GRPM1_GRVWA4_GRVWB8_GSUn1_GSUAMB_GSUC1_GSUWGMRR1_GLS0_ISA942_IU1_K1_LDSTI0_LBSPPA128_LBSPPB3072_LBSPPM0_LPA32_LPB16_LPM0_LRVW16_LWPMn1_MIAV0_MIWT9_3_MO40_NTn1_NTA0_NTB0_NTC0_NTD4_NTM0_NEPBS16_NLCA1_NLCB3_ONLL1_PGR2_PLR0_PKA1_SIA3_SS1_SU16_SUM0_SUS256_SPO0_SRVW0_SSO0_SVW1_SK0_SKFTR0_SKXCCM0_TLDS1_ULSGRO0_USL1_UIOFGRO0_USFGROn1_VSn1_VWA1_VWB1_WSGRA0_WSGRB0_WS64_WG16_16_1_WGM8_WGMXCC8_WGMXCCGn1
    SolutionIndex: 15
    SolutionNameMin: Cijk_Alik_Bjlk_I8IS_BH_Bias_S_FDMN_SPB_A_S_SAV_MT144x128x64_MI16x16x1_SN_LDSB1_AFC1_AG0_AFEM1_AFEM1_ASEM8_CLR0_CADS0_DTLA0_DTLB0_DTVA0_DTVB0_EPS1_FDSI0_GRPM1_GRVWA4_GRVWB16_GSUn1_GSUAMB_GSUC1_GSUWGMRR1_GLS0_ISA942_IU1_K1_LDSTI0_LBSPPA128_LBSPPB2048_LBSPPM0_LPA32_LPB32_LPM0_LRVW16_LWPMn1_MIAV0_MIWT9_2_MO40_NTn1_NTA0_NTB0_NTC0_NTD4_NTM0_NEPBS16_NLCA1_NLCB1_ONLL1_PGR2_PLR0_PKA1_SIA3_SS1_SU16_SUM0_SUS256_SPO0_SRVW0_SSO0_SVW1_SK0_SKFTR0_SKXCCM0_TLDS1_ULSGRO0_USL1_UIOFGRO0_USFGROn1_VSn1_VWA1_VWB2_WSGRA0_WSGRB0_WS64_WG16_16_1_WGM8_WGMXCC8_WGMXCCGn1
    SolutionIndex: 16
    SolutionNameMin: Cijk_Alik_Bjlk_I8IS_BH_Bias_S_FDMN_SPB_A_S_SAV_MT80x256x64_MI16x16x1_SN_LDSB1_AFC1_AG0_AFEM1_AFEM1_ASEM8_CLR0_CADS0_DTLA0_DTLB0_DTVA0_DTVB0_EPS1_FDSI0_GRPM1_GRVWA4_GRVWB16_GSUn1_GSUAMB_GSUC1_GSUWGMRR1_GLS0_ISA942_IU1_K1_LDSTI0_LBSPPA128_LBSPPB4096_LBSPPM0_LPA32_LPB32_LPM0_LRVW16_LWPMn1_MIAV0_MIWT5_4_MO40_NTn1_NTA0_NTB0_NTC0_NTD4_NTM0_NEPBS16_NLCA1_NLCB1_ONLL1_PGR2_PLR0_PKA1_SIA3_SS1_SU16_SUM0_SUS256_SPO0_SRVW0_SSO0_SVW1_SK0_SKFTR0_SKXCCM0_TLDS1_ULSGRO0_USL1_UIOFGRO0_USFGROn1_VSn1_VWA1_VWB2_WSGRA0_WSGRB0_WS64_WG16_16_1_WGM8_WGMXCC8_WGMXCCGn1
    SolutionIndex: 17
    SolutionNameMin: Cijk_Alik_Bjlk_I8IS_BH_Bias_S_FDMN_SPB_A_S_SAV_MT144x128x64_MI16x16x1_SN_LDSB1_AFC1_AG0_AFEM1_AFEM1_ASEM8_CLR0_CADS0_DTLA0_DTLB0_DTVA0_DTVB0_EPS1_FDSI0_GRPM1_GRVWA4_GRVWB8_GSUn1_GSUAMB_GSUC1_GSUWGMRR1_GLS0_ISA942_IU1_K1_LDSTI0_LBSPPA128_LBSPPB2048_LBSPPM0_LPA32_LPB32_LPM0_LRVW16_LWPMn1_MIAV0_MIWT9_2_MO40_NTn1_NTA0_NTB0_NTC0_NTD4_NTM0_NEPBS16_NLCA1_NLCB1_ONLL1_PGR2_PLR0_PKA1_SIA3_SS1_SU16_SUM0_SUS256_SPO0_SRVW0_SSO0_SVW1_SK0_SKFTR0_SKXCCM0_TLDS1_ULSGRO0_USL1_UIOFGRO0_USFGROn1_VSn1_VWA1_VWB2_WSGRA0_WSGRB0_WS64_WG16_16_1_WGM8_WGMXCC8_WGMXCCGn1
    SolutionIndex: 18
    SolutionNameMin: Cijk_Alik_Bjlk_I8IS_BH_Bias_S_FDMN_SPB_A_S_SAV_MT80x256x64_MI16x16x1_SN_LDSB1_AFC1_AG0_AFEM1_AFEM1_ASEM8_CLR0_CADS0_DTLA0_DTLB0_DTVA0_DTVB0_EPS1_FDSI0_GRPM1_GRVWA4_GRVWB8_GSUn1_GSUAMB_GSUC1_GSUWGMRR1_GLS0_ISA942_IU1_K1_LDSTI0_LBSPPA128_LBSPPB4096_LBSPPM0_LPA32_LPB32_LPM0_LRVW16_LWPMn1_MIAV0_MIWT5_4_MO40_NTn1_NTA0_NTB0_NTC0_NTD4_NTM0_NEPBS16_NLCA1_NLCB1_ONLL1_PGR2_PLR0_PKA1_SIA3_SS1_SU16_SUM0_SUS256_SPO0_SRVW0_SSO0_SVW1_SK0_SKFTR0_SKXCCM0_TLDS1_ULSGRO0_USL1_UIOFGRO0_USFGROn1_VSn1_VWA1_VWB2_WSGRA0_WSGRB0_WS64_WG16_16_1_WGM8_WGMXCC8_WGMXCCGn1
    SolutionIndex: 19
    SolutionNameMin: Cijk_Alik_Bjlk_I8IS_BH_Bias_S_FDMN_SPB_A_S_SAV_MT16x16x256_MI16x16x1_SN_LDSB0_AFC1_AG0_AFEM1_AFEM1_ASEM8_CLR1_CADS0_DTLA0_DTLB0_DTVA0_DTVB0_EPS1_FDSI0_GRPM1_GRVWA16_GRVWB16_GSUn1_GSUAMB_GSUC1_GSUWGMRR1_GLS0_ISA942_IU1_K1_LDSTI0_LBSPPA256_LBSPPB256_LBSPPM0_LPA32_LPB16_LPM0_LRVW16_LWPMn1_MIAV0_MIWT1_1_MO40_NTn1_NTA0_NTB0_NTC0_NTD4_NTM0_NEPBS16_NLCA1_NLCB1_ONLL1_PGR2_PLR1_PKA1_SIA3_SS1_SU16_SUM0_SUS256_SPO0_SRVW0_SSO0_SVW1_SK0_SKFTR0_SKXCCM0_TLDS1_ULSGRO0_USL1_UIOFGRO0_USFGROn1_VSn1_VWA1_VWB1_WSGRA0_WSGRB0_WS64_WG16_4_1_WGM1_WGMXCC1_WGMXCCGn1
    SolutionIndex: 20
    SolutionNameMin: Cijk_Alik_Bjlk_I8IS_BH_Bias_S_FDMN_SPB_A_S_SAV_MT192x256x128_MI16x16x1_SN_LDSB1_AFC1_AG0_AFEM1_AFEM1_ASEM8_CLR1_CADS0_DTLA0_DTLB0_DTVA0_DTVB0_EPS1_FDSI0_GRPM1_GRVWA4_GRVWB16_GSUn1_GSUAMB_GSUC1_GSUWGMRR1_GLS0_ISA942_IU1_K1_LDSTI0_LBSPPA512_LBSPPB4096_LBSPPM0_LPA32_LPB32_LPM0_LRVW16_LWPMn1_MIAV0_MIWT12_4_MO40_NTn1_NTA0_NTB0_NTC0_NTD4_NTM0_NEPBS0_NLCA1_NLCB1_ONLL1_PGR2_PLR1_PKA1_SIA3_SS1_SU16_SUM0_SUS256_SPO0_SRVW0_SSO0_SVW4_SK0_SKFTR0_SKXCCM0_TLDS1_ULSGRO0_USL1_UIOFGRO0_USFGROn1_VSn1_VWA4_VWB2_WSGRA0_WSGRB0_WS64_WG16_16_1_WGM8_WGMXCC8_WGMXCCGn1
    SolutionIndex: 21
    SolutionNameMin: Cijk_Alik_Bjlk_I8IS_BH_Bias_S_FDMN_SPB_A_S_SAV_MT224x256x128_MI16x16x1_SN_LDSB1_AFC1_AG0_AFEM1_AFEM1_ASEM8_CLR1_CADS0_DTLA0_DTLB0_DTVA0_DTVB0_EPS1_FDSI0_GRPM1_GRVWA16_GRVWB8_GSUn1_GSUAMB_GSUC1_GSUWGMRR1_GLS0_ISA942_IU1_K1_LDSTI0_LBSPPA256_LBSPPB4096_LBSPPM0_LPA32_LPB32_LPM0_LRVW16_LWPMn1_MIAV0_MIWT14_4_MO40_NTn1_NTA0_NTB0_NTC0_NTD4_NTM0_NEPBS0_NLCA1_NLCB1_ONLL1_PGR2_PLR1_PKA1_SIA3_SS1_SU16_SUM0_SUS256_SPO0_SRVW0_SSO0_SVW2_SK0_SKFTR0_SKXCCM0_TLDS1_ULSGRO0_USL1_UIOFGRO0_USFGROn1_VSn1_VWA2_VWB2_WSGRA0_WSGRB0_WS64_WG16_16_1_WGM8_WGMXCC8_WGMXCCGn1
    SolutionIndex: 22
    SolutionNameMin: Cijk_Alik_Bjlk_I8IS_BH_Bias_S_FDMN_SPB_A_S_SAV_MT320x192x128_MI16x16x1_SN_LDSB1_AFC1_AG0_AFEM1_AFEM1_ASEM8_CLR1_CADS0_DTLA0_DTLB0_DTVA0_DTVB0_EPS1_FDSI0_GRPM1_GRVWA16_GRVWB16_GSUn1_GSUAMB_GSUC1_GSUWGMRR1_GLS0_ISA942_IU1_K1_LDSTI0_LBSPPA256_LBSPPB3072_LBSPPM0_LPA32_LPB32_LPM0_LRVW16_LWPMn1_MIAV0_MIWT10_6_MO40_NTn1_NTA0_NTB0_NTC0_NTD4_NTM0_NEPBS0_NLCA1_NLCB3_ONLL1_PGR2_PLR1_PKA1_SIA3_SS1_SU16_SUM0_SUS256_SPO0_SRVW0_SSO0_SVW2_SK0_SKFTR0_SKXCCM0_TLDS1_ULSGRO0_USL1_UIOFGRO0_USFGROn1_VSn1_VWA2_VWB2_WSGRA0_WSGRB0_WS64_WG32_8_1_WGM8_WGMXCC8_WGMXCCGn1
    SolutionIndex: 23
    SolutionNameMin: Cijk_Alik_Bjlk_I8IS_BH_Bias_S_FDMN_SPB_A_S_SAV_MT128x512x128_MI16x16x1_SN_LDSB1_AFC1_AG0_AFEM1_AFEM1_ASEM8_CLR1_CADS0_DTLA0_DTLB0_DTVA0_DTVB0_EPS1_FDSI0_GRPM1_GRVWA16_GRVWB16_GSUn1_GSUAMB_GSUC1_GSUWGMRR1_GLS0_ISA942_IU1_K1_LDSTI0_LBSPPA512_LBSPPB8192_LBSPPM0_LPA32_LPB64_LPM0_LRVW16_LWPMn1_MIAV0_MIWT4_16_MO40_NTn1_NTA0_NTB0_NTC0_NTD4_NTM0_NEPBS0_NLCA1_NLCB1_ONLL1_PGR2_PLR1_PKA1_SIA3_SS1_SU16_SUM0_SUS256_SPO0_SRVW0_SSO0_SVW4_SK0_SKFTR0_SKXCCM0_TLDS1_ULSGRO0_USL1_UIOFGRO0_USFGROn1_VSn1_VWA4_VWB4_WSGRA0_WSGRB0_WS64_WG32_8_1_WGM8_WGMXCC8_WGMXCCGn1
    SolutionIndex: 24
    SolutionNameMin: Cijk_Alik_Bjlk_I8IS_BH_Bias_S_FDMN_SPB_A_S_SAV_MT160x384x128_MI16x16x1_SN_LDSB1_AFC1_AG0_AFEM1_AFEM1_ASEM8_CLR1_CADS0_DTLA0_DTLB0_DTVA0_DTVB0_EPS1_FDSI0_GRPM1_GRVWA4_GRVWB16_GSUn1_GSUAMB_GSUC1_GSUWGMRR1_GLS0_ISA942_IU1_K1_LDSTI0_LBSPPA256_LBSPPB6144_LBSPPM0_LPA32_LPB32_LPM0_LRVW16_LWPMn1_MIAV0_MIWT10_6_MO40_NTn1_NTA0_NTB0_NTC0_NTD4_NTM0_NEPBS0_NLCA1_NLCB3_ONLL1_PGR2_PLR1_PKA1_SIA3_SS1_SU16_SUM0_SUS256_SPO0_SRVW0_SSO0_SVW2_SK0_SKFTR0_SKXCCM0_TLDS1_ULSGRO0_USL1_UIOFGRO0_USFGROn1_VSn1_VWA2_VWB2_WSGRA0_WSGRB0_WS64_WG16_16_1_WGM8_WGMXCC8_WGMXCCGn1
    SolutionIndex: 25
    SolutionNameMin: Cijk_Alik_Bjlk_I8IS_BH_Bias_S_FDMN_SPB_A_S_SAV_MT160x256x128_MI16x16x1_SN_LDSB1_AFC1_AG0_AFEM1_AFEM1_ASEM8_CLR1_CADS0_DTLA0_DTLB0_DTVA0_DTVB0_EPS1_FDSI0_GRPM1_GRVWA4_GRVWB16_GSUn1_GSUAMB_GSUC1_GSUWGMRR1_GLS0_ISA942_IU1_K1_LDSTI0_LBSPPA256_LBSPPB4096_LBSPPM0_LPA32_LPB32_LPM0_LRVW16_LWPMn1_MIAV0_MIWT10_4_MO40_NTn1_NTA0_NTB0_NTC0_NTD4_NTM0_NEPBS0_NLCA1_NLCB1_ONLL1_PGR2_PLR1_PKA1_SIA3_SS1_SU16_SUM0_SUS256_SPO0_SRVW0_SSO0_SVW2_SK0_SKFTR0_SKXCCM0_TLDS1_ULSGRO0_USL1_UIOFGRO0_USFGROn1_VSn1_VWA2_VWB2_WSGRA0_WSGRB0_WS64_WG16_16_1_WGM8_WGMXCC8_WGMXCCGn1
    SolutionIndex: 26
    SolutionNameMin: Cijk_Alik_Bjlk_I8IS_BH_Bias_S_FDMN_SPB_A_S_SAV_MT272x128x128_MI16x16x1_SN_LDSB1_AFC1_AG0_AFEM1_AFEM1_ASEM8_CLR1_CADS0_DTLA0_DTLB0_DTVA0_DTVB0_EPS1_FDSI0_GRPM1_GRVWA4_GRVWB8_GSUn1_GSUAMB_GSUC1_GSUWGMRR1_GLS0_ISA942_IU1_K1_LDSTI0_LBSPPA128_LBSPPB2048_LBSPPM0_LPA32_LPB32_LPM0_LRVW16_LWPMn1_MIAV0_MIWT17_2_MO40_NTn1_NTA0_NTB0_NTC0_NTD4_NTM0_NEPBS0_NLCA1_NLCB1_ONLL1_PGR2_PLR1_PKA1_SIA3_SS1_SU16_SUM0_SUS256_SPO0_SRVW0_SSO0_SVW1_SK0_SKFTR0_SKXCCM0_TLDS1_ULSGRO0_USL1_UIOFGRO0_USFGROn1_VSn1_VWA1_VWB2_WSGRA0_WSGRB0_WS64_WG16_16_1_WGM8_WGMXCC8_WGMXCCGn1
    SolutionIndex: 27
    SolutionNameMin: Cijk_Alik_Bjlk_I8IS_BH_Bias_S_FDMN_SPB_A_S_SAV_MT320x128x128_MI16x16x1_SN_LDSB1_AFC1_AG0_AFEM1_AFEM1_ASEM8_CLR1_CADS0_DTLA0_DTLB0_DTVA0_DTVB0_EPS1_FDSI0_GRPM1_GRVWA16_GRVWB16_GSUn1_GSUAMB_GSUC1_GSUWGMRR1_GLS0_ISA942_IU1_K1_LDSTI0_LBSPPA256_LBSPPB2048_LBSPPM0_LPA32_LPB32_LPM0_LRVW16_LWPMn1_MIAV0_MIWT10_4_MO40_NTn1_NTA0_NTB0_NTC0_NTD4_NTM0_NEPBS0_NLCA1_NLCB1_ONLL1_PGR2_PLR1_PKA1_SIA3_SS1_SU16_SUM0_SUS256_SPO0_SRVW0_SSO0_SVW2_SK0_SKFTR0_SKXCCM0_TLDS1_ULSGRO0_USL1_UIOFGRO0_USFGROn1_VSn1_VWA2_VWB2_WSGRA0_WSGRB0_WS64_WG32_8_1_WGM8_WGMXCC8_WGMXCCGn1
    SolutionIndex: 28
    SolutionNameMin: Cijk_Alik_Bjlk_I8IS_BH_Bias_S_FDMN_SPB_A_S_SAV_MT96x384x128_MI16x16x1_SN_LDSB1_AFC1_AG0_AFEM1_AFEM1_ASEM8_CLR1_CADS0_DTLA0_DTLB0_DTVA0_DTVB0_EPS1_FDSI0_GRPM1_GRVWA4_GRVWB16_GSUn1_GSUAMB_GSUC1_GSUWGMRR1_GLS0_ISA942_IU1_K1_LDSTI0_LBSPPA256_LBSPPB6144_LBSPPM0_LPA32_LPB32_LPM0_LRVW16_LWPMn1_MIAV0_MIWT6_6_MO40_NTn1_NTA0_NTB0_NTC0_NTD4_NTM0_NEPBS0_NLCA1_NLCB3_ONLL1_PGR2_PLR1_PKA1_SIA3_SS1_SU16_SUM0_SUS256_SPO0_SRVW0_SSO0_SVW2_SK0_SKFTR0_SKXCCM0_TLDS1_ULSGRO0_USL1_UIOFGRO0_USFGROn1_VSn1_VWA2_VWB2_WSGRA0_WSGRB0_WS64_WG16_16_1_WGM8_WGMXCC8_WGMXCCGn1
    SolutionIndex: 29
    SolutionNameMin: Cijk_Alik_Bjlk_I8IS_BH_Bias_S_FDMN_SPB_A_S_SAV_MT128x128x128_MI16x16x1_SN_LDSB1_AFC1_AG0_AFEM1_AFEM1_ASEM8_CLR1_CADS0_DTLA0_DTLB0_DTVA0_DTVB0_EPS1_FDSI0_GRPM1_GRVWA16_GRVWB16_GSUn1_GSUAMB_GSUC1_GSUWGMRR1_GLS0_ISA942_IU1_K1_LDSTI0_LBSPPA512_LBSPPB2048_LBSPPM0_LPA32_LPB32_LPM0_LRVW16_LWPMn1_MIAV0_MIWT4_4_MO40_NTn1_NTA0_NTB0_NTC0_NTD4_NTM0_NEPBS16_NLCA1_NLCB1_ONLL1_PGR2_PLR1_PKA1_SIA3_SS1_SU16_SUM0_SUS256_SPO0_SRVW0_SSO0_SVW4_SK0_SKFTR0_SKXCCM0_TLDS1_ULSGRO0_USL1_UIOFGRO0_USFGROn1_VSn1_VWA4_VWB2_WSGRA0_WSGRB0_WS64_WG32_8_1_WGM8_WGMXCC8_WGMXCCGn1
    SolutionIndex: 30
    SolutionNameMin: Cijk_Alik_Bjlk_I8IS_BH_Bias_S_FDMN_SPB_A_S_SAV_MT128x384x128_MI16x16x1_SN_LDSB1_AFC1_AG0_AFEM1_AFEM1_ASEM8_CLR1_CADS0_DTLA0_DTLB0_DTVA0_DTVB0_EPS1_FDSI0_GRPM1_GRVWA4_GRVWB16_GSUn1_GSUAMB_GSUC1_GSUWGMRR1_GLS0_ISA942_IU1_K1_LDSTI0_LBSPPA1024_LBSPPB6144_LBSPPM0_LPA32_LPB32_LPM0_LRVW16_LWPMn1_MIAV0_MIWT8_6_MO40_NTn1_NTA0_NTB0_NTC0_NTD4_NTM0_NEPBS0_NLCA1_NLCB3_ONLL1_PGR2_PLR1_PKA1_SIA3_SS1_SU16_SUM0_SUS256_SPO0_SRVW0_SSO0_SVW8_SK0_SKFTR0_SKXCCM0_TLDS1_ULSGRO0_USL1_UIOFGRO0_USFGROn1_VSn1_VWA8_VWB2_WSGRA0_WSGRB0_WS64_WG16_16_1_WGM8_WGMXCC8_WGMXCCGn1
    SolutionIndex: 31
    SolutionNameMin: Cijk_Alik_Bjlk_I8IS_BH_Bias_S_FDMN_SPB_A_S_SAV_MT128x320x128_MI16x16x1_SN_LDSB1_AFC1_AG0_AFEM1_AFEM1_ASEM8_CLR1_CADS0_DTLA0_DTLB0_DTVA0_DTVB0_EPS1_FDSI0_GRPM1_GRVWA16_GRVWB8_GSUn1_GSUAMB_GSUC1_GSUWGMRR1_GLS0_ISA942_IU1_K1_LDSTI0_LBSPPA512_LBSPPB5120_LBSPPM0_LPA32_LPB32_LPM0_LRVW16_LWPMn1_MIAV0_MIWT4_10_MO40_NTn1_NTA0_NTB0_NTC0_NTD4_NTM0_NEPBS0_NLCA1_NLCB5_ONLL1_PGR2_PLR1_PKA1_SIA3_SS1_SU16_SUM0_SUS256_SPO0_SRVW0_SSO0_SVW4_SK0_SKFTR0_SKXCCM0_TLDS1_ULSGRO0_USL1_UIOFGRO0_USFGROn1_VSn1_VWA4_VWB2_WSGRA0_WSGRB0_WS64_WG32_8_1_WGM8_WGMXCC8_WGMXCCGn1
    SolutionIndex: 32
    SolutionNameMin: Cijk_Alik_Bjlk_I8IS_BH_Bias_S_FDMN_SPB_A_S_SAV_MT128x384x128_MI16x16x1_SN_LDSB1_AFC1_AG0_AFEM1_AFEM1_ASEM8_CLR1_CADS0_DTLA0_DTLB0_DTVA0_DTVB0_EPS1_FDSI0_GRPM1_GRVWA16_GRVWB16_GSUn1_GSUAMB_GSUC1_GSUWGMRR1_GLS0_ISA942_IU1_K1_LDSTI0_LBSPPA1024_LBSPPB6144_LBSPPM0_LPA32_LPB32_LPM0_LRVW16_LWPMn1_MIAV0_MIWT8_6_MO40_NTn1_NTA0_NTB0_NTC0_NTD4_NTM0_NEPBS0_NLCA1_NLCB3_ONLL1_PGR2_PLR1_PKA1_SIA3_SS1_SU16_SUM0_SUS256_SPO0_SRVW0_SSO0_SVW8_SK0_SKFTR0_SKXCCM0_TLDS1_ULSGRO0_USL1_UIOFGRO0_USFGROn1_VSn1_VWA8_VWB2_WSGRA0_WSGRB0_WS64_WG16_16_1_WGM8_WGMXCC8_WGMXCCGn1
    SolutionIndex: 33
    SolutionNameMin: Cijk_Alik_Bjlk_I8IS_BH_Bias_S_FDMN_SPB_A_S_SAV_MT96x384x128_MI16x16x1_SN_LDSB1_AFC1_AG0_AFEM1_AFEM1_ASEM8_CLR1_CADS0_DTLA0_DTLB0_DTVA0_DTVB0_EPS1_FDSI0_GRPM1_GRVWA16_GRVWB16_GSUn1_GSUAMB_GSUC1_GSUWGMRR1_GLS0_ISA942_IU1_K1_LDSTI0_LBSPPA256_LBSPPB6144_LBSPPM0_LPA32_LPB32_LPM0_LRVW16_LWPMn1_MIAV0_MIWT6_6_MO40_NTn1_NTA0_NTB0_NTC0_NTD4_NTM0_NEPBS0_NLCA1_NLCB3_ONLL1_PGR2_PLR1_PKA1_SIA3_SS1_SU16_SUM0_SUS256_SPO0_SRVW0_SSO0_SVW2_SK0_SKFTR0_SKXCCM0_TLDS1_ULSGRO0_USL1_UIOFGRO0_USFGROn1_VSn1_VWA2_VWB2_WSGRA0_WSGRB0_WS64_WG16_16_1_WGM8_WGMXCC8_WGMXCCGn1
    SolutionIndex: 34
    SolutionNameMin: Cijk_Alik_Bjlk_I8IS_BH_Bias_S_FDMN_SPB_A_S_SAV_MT128x320x128_MI16x16x1_SN_LDSB1_AFC1_AG0_AFEM1_AFEM1_ASEM8_CLR1_CADS0_DTLA0_DTLB0_DTVA0_DTVB0_EPS1_FDSI0_GRPM1_GRVWA4_GRVWB16_GSUn1_GSUAMB_GSUC1_GSUWGMRR1_GLS0_ISA942_IU1_K1_LDSTI0_LBSPPA512_LBSPPB5120_LBSPPM0_LPA32_LPB32_LPM0_LRVW16_LWPMn1_MIAV0_MIWT4_10_MO40_NTn1_NTA0_NTB0_NTC0_NTD4_NTM0_NEPBS0_NLCA1_NLCB5_ONLL1_PGR2_PLR1_PKA1_SIA3_SS1_SU16_SUM0_SUS256_SPO0_SRVW0_SSO0_SVW4_SK0_SKFTR0_SKXCCM0_TLDS1_ULSGRO0_USL1_UIOFGRO0_USFGROn1_VSn1_VWA4_VWB2_WSGRA0_WSGRB0_WS64_WG32_8_1_WGM8_WGMXCC8_WGMXCCGn1
    SolutionIndex: 35
    SolutionNameMin: Cijk_Alik_Bjlk_I8IS_BH_Bias_S_FDMN_SPB_A_S_SAV_MT64x32x128_MI16x16x1_SN_LDSB0_AFC1_AG0_AFEM1_AFEM1_ASEM8_CLR1_CADS0_DTLA0_DTLB0_DTVA0_DTVB0_EPS1_FDSI0_GRPM1_GRVWA16_GRVWB8_GSUn1_GSUAMB_GSUC1_GSUWGMRR1_GLS0_ISA942_IU1_K1_LDSTI0_LBSPPA128_LBSPPB512_LBSPPM0_LPA32_LPB32_LPM0_LRVW16_LWPMn1_MIAV0_MIWT1_2_MO40_NTn1_NTA0_NTB0_NTC0_NTD4_NTM0_NEPBS16_NLCA1_NLCB1_ONLL1_PGR2_PLR1_PKA1_SIA3_SS1_SU16_SUM0_SUS256_SPO0_SRVW0_SSO0_SVW1_SK0_SKFTR0_SKXCCM0_TLDS1_ULSGRO0_USL1_UIOFGRO0_USFGROn1_VSn1_VWA1_VWB2_WSGRA0_WSGRB0_WS64_WG64_4_1_WGM8_WGMXCC8_WGMXCCGn1
    SolutionIndex: 36
    SolutionNameMin: Cijk_Alik_Bjlk_I8IS_BH_Bias_S_FDMN_SPB_A_S_SAV_MT256x256x128_MI16x16x1_SN_LDSB1_AFC1_AG0_AFEM1_AFEM1_ASEM8_CLR1_CADS0_DTLA0_DTLB0_DTVA0_DTVB0_EPS1_FDSI0_GRPM1_GRVWA16_GRVWB16_GSUn1_GSUAMB_GSUC1_GSUWGMRR1_GLS0_ISA942_IU1_K1_LDSTI0_LBSPPA1024_LBSPPB4096_LBSPPM0_LPA32_LPB32_LPM0_LRVW16_LWPMn1_MIAV0_MIWT8_8_MO40_NTn1_NTA0_NTB0_NTC0_NTD4_NTM0_NEPBS0_NLCA1_NLCB1_ONLL1_PGR2_PLR1_PKA1_SIA3_SS1_SU16_SUM0_SUS256_SPO0_SRVW0_SSO0_SVW8_SK0_SKFTR0_SKXCCM0_TLDS1_ULSGRO0_USL1_UIOFGRO0_USFGROn1_VSn1_VWA8_VWB2_WSGRA0_WSGRB0_WS64_WG32_8_1_WGM8_WGMXCC8_WGMXCCGn1
    SolutionIndex: 37
    SolutionNameMin: Cijk_Alik_Bjlk_I8IS_BH_Bias_S_FDMN_SPB_A_S_SAV_MT192x256x128_MI16x16x1_SN_LDSB1_AFC1_AG0_AFEM1_AFEM1_ASEM8_CLR1_CADS0_DTLA0_DTLB0_DTVA0_DTVB0_EPS1_FDSI0_GRPM1_GRVWA4_GRVWB16_GSUn1_GSUAMB_GSUC1_GSUWGMRR1_GLS0_ISA942_IU1_K1_LDSTI0_LBSPPA256_LBSPPB4096_LBSPPM0_LPA32_LPB32_LPM0_LRVW16_LWPMn1_MIAV0_MIWT6_8_MO40_NTn1_NTA0_NTB0_NTC0_NTD4_NTM0_NEPBS0_NLCA1_NLCB1_ONLL1_PGR2_PLR1_PKA1_SIA3_SS1_SU16_SUM0_SUS256_SPO0_SRVW0_SSO0_SVW2_SK0_SKFTR0_SKXCCM0_TLDS1_ULSGRO0_USL1_UIOFGRO0_USFGROn1_VSn1_VWA2_VWB2_WSGRA0_WSGRB0_WS64_WG32_8_1_WGM8_WGMXCC8_WGMXCCGn1
    SolutionIndex: 38
    SolutionNameMin: Cijk_Alik_Bjlk_I8IS_BH_Bias_S_FDMN_SPB_A_S_SAV_MT160x256x128_MI16x16x1_SN_LDSB1_AFC1_AG0_AFEM1_AFEM1_ASEM8_CLR1_CADS0_DTLA0_DTLB0_DTVA0_DTVB0_EPS1_FDSI0_GRPM1_GRVWA16_GRVWB8_GSUn1_GSUAMB_GSUC1_GSUWGMRR1_GLS0_ISA942_IU1_K1_LDSTI0_LBSPPA256_LBSPPB4096_LBSPPM0_LPA32_LPB32_LPM0_LRVW16_LWPMn1_MIAV0_MIWT10_4_MO40_NTn1_NTA0_NTB0_NTC0_NTD4_NTM0_NEPBS0_NLCA1_NLCB1_ONLL1_PGR2_PLR1_PKA1_SIA3_SS1_SU16_SUM0_SUS256_SPO0_SRVW0_SSO0_SVW2_SK0_SKFTR0_SKXCCM0_TLDS1_ULSGRO0_USL1_UIOFGRO0_USFGROn1_VSn1_VWA2_VWB2_WSGRA0_WSGRB0_WS64_WG16_16_1_WGM8_WGMXCC8_WGMXCCGn1
    SolutionIndex: 39
    SolutionNameMin: Cijk_Alik_Bjlk_I8IS_BH_Bias_S_FDMN_SPB_A_S_SAV_MT256x256x128_MI16x16x1_SN_LDSB1_AFC1_AG0_AFEM1_AFEM1_ASEM8_CLR1_CADS0_DTLA0_DTLB0_DTVA0_DTVB0_EPS1_FDSI0_GRPM1_GRVWA16_GRVWB8_GSUn1_GSUAMB_GSUC1_GSUWGMRR1_GLS0_ISA942_IU1_K1_LDSTI0_LBSPPA1024_LBSPPB4096_LBSPPM0_LPA32_LPB32_LPM0_LRVW16_LWPMn1_MIAV0_MIWT8_8_MO40_NTn1_NTA0_NTB0_NTC0_NTD4_NTM0_NEPBS0_NLCA1_NLCB1_ONLL1_PGR2_PLR1_PKA1_SIA3_SS1_SU16_SUM0_SUS256_SPO0_SRVW0_SSO0_SVW8_SK0_SKFTR0_SKXCCM0_TLDS1_ULSGRO0_USL1_UIOFGRO0_USFGROn1_VSn1_VWA8_VWB2_WSGRA0_WSGRB0_WS64_WG32_8_1_WGM8_WGMXCC8_WGMXCCGn1
    SolutionIndex: 40
    SolutionNameMin: Cijk_Alik_Bjlk_I8IS_BH_Bias_S_FDMN_SPB_A_S_SAV_MT176x256x128_MI16x16x1_SN_LDSB1_AFC1_AG0_AFEM1_AFEM1_ASEM8_CLR1_CADS0_DTLA0_DTLB0_DTVA0_DTVB0_EPS1_FDSI0_GRPM1_GRVWA4_GRVWB16_GSUn1_GSUAMB_GSUC1_GSUWGMRR1_GLS0_ISA942_IU1_K1_LDSTI0_LBSPPA128_LBSPPB4096_LBSPPM0_LPA32_LPB32_LPM0_LRVW16_LWPMn1_MIAV0_MIWT11_4_MO40_NTn1_NTA0_NTB0_NTC0_NTD4_NTM0_NEPBS0_NLCA1_NLCB1_ONLL1_PGR2_PLR1_PKA1_SIA3_SS1_SU16_SUM0_SUS256_SPO0_SRVW0_SSO0_SVW1_SK0_SKFTR0_SKXCCM0_TLDS1_ULSGRO0_USL1_UIOFGRO0_USFGROn1_VSn1_VWA1_VWB2_WSGRA0_WSGRB0_WS64_WG16_16_1_WGM8_WGMXCC8_WGMXCCGn1
    SolutionIndex: 41
    SolutionNameMin: Cijk_Alik_Bjlk_I8IS_BH_Bias_S_FDMN_SPB_A_S_SAV_MT192x256x128_MI16x16x1_SN_LDSB1_AFC1_AG0_AFEM1_AFEM1_ASEM8_CLR1_CADS0_DTLA0_DTLB0_DTVA0_DTVB0_EPS1_FDSI0_GRPM1_GRVWA4_GRVWB8_GSUn1_GSUAMB_GSUC1_GSUWGMRR1_GLS0_ISA942_IU1_K1_LDSTI0_LBSPPA512_LBSPPB4096_LBSPPM0_LPA32_LPB32_LPM0_LRVW16_LWPMn1_MIAV0_MIWT12_4_MO40_NTn1_NTA0_NTB0_NTC0_NTD4_NTM0_NEPBS0_NLCA1_NLCB1_ONLL1_PGR2_PLR1_PKA1_SIA3_SS1_SU16_SUM0_SUS256_SPO0_SRVW0_SSO0_SVW4_SK0_SKFTR0_SKXCCM0_TLDS1_ULSGRO0_USL1_UIOFGRO0_USFGROn1_VSn1_VWA4_VWB2_WSGRA0_WSGRB0_WS64_WG16_16_1_WGM8_WGMXCC8_WGMXCCGn1
    SolutionIndex: 42
    SolutionNameMin: Cijk_Alik_Bjlk_I8IS_BH_Bias_S_FDMN_SPB_A_S_SAV_MT16x384x128_MI16x16x1_SN_LDSB1_AFC1_AG0_AFEM1_AFEM1_ASEM8_CLR1_CADS0_DTLA0_DTLB0_DTVA0_DTVB0_EPS1_FDSI0_GRPM1_GRVWA4_GRVWB16_GSUn1_GSUAMB_GSUC1_GSUWGMRR1_GLS0_ISA942_IU1_K1_LDSTI0_LBSPPA128_LBSPPB6144_LBSPPM0_LPA32_LPB32_LPM0_LRVW16_LWPMn1_MIAV0_MIWT1_6_MO40_NTn1_NTA0_NTB0_NTC0_NTD4_NTM0_NEPBS0_NLCA1_NLCB3_ONLL1_PGR2_PLR1_PKA1_SIA3_SS1_SU16_SUM0_SUS256_SPO0_SRVW0_SSO0_SVW1_SK0_SKFTR0_SKXCCM0_TLDS1_ULSGRO0_USL1_UIOFGRO0_USFGROn1_VSn1_VWA1_VWB2_WSGRA0_WSGRB0_WS64_WG16_16_1_WGM8_WGMXCC8_WGMXCCGn1
    SolutionIndex: 43
    SolutionNameMin: Cijk_Alik_Bjlk_I8IS_BH_Bias_S_FDMN_SPB_A_S_SAV_MT32x384x128_MI16x16x1_SN_LDSB1_AFC1_AG0_AFEM1_AFEM1_ASEM8_CLR1_CADS0_DTLA0_DTLB0_DTVA0_DTVB0_EPS1_FDSI0_GRPM1_GRVWA16_GRVWB16_GSUn1_GSUAMB_GSUC1_GSUWGMRR1_GLS0_ISA942_IU1_K1_LDSTI0_LBSPPA256_LBSPPB6144_LBSPPM0_LPA32_LPB32_LPM0_LRVW16_LWPMn1_MIAV0_MIWT2_6_MO40_NTn1_NTA0_NTB0_NTC0_NTD4_NTM0_NEPBS0_NLCA1_NLCB3_ONLL1_PGR2_PLR1_PKA1_SIA3_SS1_SU16_SUM0_SUS256_SPO0_SRVW0_SSO0_SVW2_SK0_SKFTR0_SKXCCM0_TLDS1_ULSGRO0_USL1_UIOFGRO0_USFGROn1_VSn1_VWA2_VWB2_WSGRA0_WSGRB0_WS64_WG16_16_1_WGM8_WGMXCC8_WGMXCCGn1
    SolutionIndex: 44
    SolutionNameMin: Cijk_Alik_Bjlk_I8IS_BH_Bias_S_FDMN_SPB_A_S_SAV_MT48x128x128_MI16x16x1_SN_LDSB1_AFC1_AG0_AFEM1_AFEM1_ASEM8_CLR1_CADS0_DTLA0_DTLB0_DTVA0_DTVB0_EPS1_FDSI0_GRPM1_GRVWA4_GRVWB16_GSUn1_GSUAMB_GSUC1_GSUWGMRR1_GLS0_ISA942_IU1_K1_LDSTI0_LBSPPA128_LBSPPB2048_LBSPPM0_LPA32_LPB32_LPM0_LRVW16_LWPMn1_MIAV0_MIWT3_2_MO40_NTn1_NTA0_NTB0_NTC0_NTD4_NTM0_NEPBS16_NLCA1_NLCB1_ONLL1_PGR2_PLR1_PKA1_SIA3_SS1_SU16_SUM0_SUS256_SPO0_SRVW0_SSO0_SVW1_SK0_SKFTR0_SKXCCM0_TLDS1_ULSGRO0_USL1_UIOFGRO0_USFGROn1_VSn1_VWA1_VWB2_WSGRA0_WSGRB0_WS64_WG16_16_1_WGM8_WGMXCC8_WGMXCCGn1
    SolutionIndex: 45
    SolutionNameMin: Cijk_Alik_Bjlk_I8IS_BH_Bias_S_FDMN_SPB_A_S_SAV_MT16x256x128_MI16x16x1_SN_LDSB1_AFC1_AG0_AFEM1_AFEM1_ASEM8_CLR1_CADS0_DTLA0_DTLB0_DTVA0_DTVB0_EPS1_FDSI0_GRPM1_GRVWA4_GRVWB16_GSUn1_GSUAMB_GSUC1_GSUWGMRR1_GLS0_ISA942_IU1_K1_LDSTI0_LBSPPA128_LBSPPB4096_LBSPPM0_LPA32_LPB32_LPM0_LRVW16_LWPMn1_MIAV0_MIWT1_4_MO40_NTn1_NTA0_NTB0_NTC0_NTD4_NTM0_NEPBS16_NLCA1_NLCB1_ONLL1_PGR2_PLR1_PKA1_SIA3_SS1_SU16_SUM0_SUS256_SPO0_SRVW0_SSO0_SVW1_SK0_SKFTR0_SKXCCM0_TLDS1_ULSGRO0_USL1_UIOFGRO0_USFGROn1_VSn1_VWA1_VWB2_WSGRA0_WSGRB0_WS64_WG16_16_1_WGM8_WGMXCC8_WGMXCCGn1
    SolutionIndex: 46
    SolutionNameMin: Cijk_Alik_Bjlk_I8IS_BH_Bias_S_FDMN_SPB_A_S_SAV_MT16x256x256_MI16x16x1_SN_LDSB1_AFC1_AG0_AFEM1_AFEM1_ASEM8_CLR1_CADS0_DTLA0_DTLB0_DTVA0_DTVB0_EPS1_FDSI0_GRPM1_GRVWA16_GRVWB16_GSUn1_GSUAMB_GSUC1_GSUWGMRR1_GLS0_ISA942_IU1_K1_LDSTI0_LBSPPA256_LBSPPB4096_LBSPPM0_LPA32_LPB32_LPM0_LRVW16_LWPMn1_MIAV0_MIWT1_4_MO40_NTn1_NTA0_NTB0_NTC0_NTD4_NTM0_NEPBS0_NLCA1_NLCB1_ONLL1_PGR2_PLR1_PKA1_SIA3_SS1_SU16_SUM0_SUS256_SPO0_SRVW0_SSO0_SVW1_SK0_SKFTR0_SKXCCM0_TLDS1_ULSGRO0_USL1_UIOFGRO0_USFGROn1_VSn1_VWA1_VWB2_WSGRA0_WSGRB0_WS64_WG16_16_1_WGM8_WGMXCC8_WGMXCCGn1
    SolutionIndex: 47
    SolutionNameMin: Cijk_Alik_Bjlk_I8IS_BH_Bias_S_FDMN_SPB_A_S_SAV_MT32x256x256_MI16x16x1_SN_LDSB1_AFC1_AG0_AFEM1_AFEM1_ASEM8_CLR1_CADS0_DTLA0_DTLB0_DTVA0_DTVB0_EPS1_FDSI0_GRPM1_GRVWA4_GRVWB16_GSUn1_GSUAMB_GSUC1_GSUWGMRR1_GLS0_ISA942_IU1_K1_LDSTI0_LBSPPA512_LBSPPB4096_LBSPPM0_LPA32_LPB32_LPM0_LRVW16_LWPMn1_MIAV0_MIWT2_4_MO40_NTn1_NTA0_NTB0_NTC0_NTD4_NTM0_NEPBS0_NLCA1_NLCB1_ONLL1_PGR2_PLR1_PKA1_SIA3_SS1_SU16_SUM0_SUS256_SPO0_SRVW0_SSO0_SVW2_SK0_SKFTR0_SKXCCM0_TLDS1_ULSGRO0_USL1_UIOFGRO0_USFGROn1_VSn1_VWA2_VWB2_WSGRA0_WSGRB0_WS64_WG16_16_1_WGM8_WGMXCC8_WGMXCCGn1
    SolutionIndex: 48
    SolutionNameMin: Cijk_Alik_Bjlk_I8IS_BH_Bias_S_FDMN_SPB_A_S_SAV_MT288x128x128_MI16x16x1_SN_LDSB1_AFC1_AG0_AFEM1_AFEM1_ASEM8_CLR1_CADS0_DTLA0_DTLB0_DTVA0_DTVB0_EPS1_FDSI0_GRPM1_GRVWA16_GRVWB16_GSUn1_GSUAMB_GSUC1_GSUWGMRR1_GLS0_ISA942_IU1_K1_LDSTI0_LBSPPA128_LBSPPB2048_LBSPPM0_LPA32_LPB32_LPM0_LRVW16_LWPMn1_MIAV0_MIWT9_4_MO40_NTn1_NTA0_NTB0_NTC0_NTD4_NTM0_NEPBS0_NLCA1_NLCB1_ONLL1_PGR2_PLR1_PKA1_SIA3_SS1_SU16_SUM0_SUS256_SPO0_SRVW0_SSO0_SVW1_SK0_SKFTR0_SKXCCM0_TLDS1_ULSGRO0_USL1_UIOFGRO0_USFGROn1_VSn1_VWA1_VWB2_WSGRA0_WSGRB0_WS64_WG32_8_1_WGM8_WGMXCC8_WGMXCCGn1
    SolutionIndex: 49
    SolutionNameMin: Cijk_Alik_Bjlk_I8IS_BH_Bias_S_FDMN_SPB_A_S_SAV_MT208x256x128_MI16x16x1_SN_LDSB1_AFC1_AG0_AFEM1_AFEM1_ASEM8_CLR1_CADS0_DTLA0_DTLB0_DTVA0_DTVB0_EPS1_FDSI0_GRPM1_GRVWA4_GRVWB16_GSUn1_GSUAMB_GSUC1_GSUWGMRR1_GLS0_ISA942_IU1_K1_LDSTI0_LBSPPA128_LBSPPB4096_LBSPPM0_LPA32_LPB32_LPM0_LRVW16_LWPMn1_MIAV0_MIWT13_4_MO40_NTn1_NTA0_NTB0_NTC0_NTD4_NTM0_NEPBS0_NLCA1_NLCB1_ONLL1_PGR2_PLR1_PKA1_SIA3_SS1_SU16_SUM0_SUS256_SPO0_SRVW0_SSO0_SVW1_SK0_SKFTR0_SKXCCM0_TLDS1_ULSGRO0_USL1_UIOFGRO0_USFGROn1_VSn1_VWA1_VWB2_WSGRA0_WSGRB0_WS64_WG16_16_1_WGM8_WGMXCC8_WGMXCCGn1
    SolutionIndex: 50
    SolutionNameMin: Cijk_Alik_Bjlk_I8IS_BH_Bias_S_FDMN_SPB_A_S_SAV_MT128x512x128_MI16x16x1_SN_LDSB1_AFC1_AG0_AFEM1_AFEM1_ASEM8_CLR1_CADS0_DTLA0_DTLB0_DTVA0_DTVB0_EPS1_FDSI0_GRPM1_GRVWA16_GRVWB16_GSUn1_GSUAMB_GSUC1_GSUWGMRR1_GLS0_ISA942_IU1_K1_LDSTI0_LBSPPA1024_LBSPPB8192_LBSPPM0_LPA32_LPB32_LPM0_LRVW16_LWPMn1_MIAV0_MIWT8_8_MO40_NTn1_NTA0_NTB0_NTC0_NTD4_NTM0_NEPBS0_NLCA1_NLCB1_ONLL1_PGR2_PLR1_PKA1_SIA3_SS1_SU16_SUM0_SUS256_SPO0_SRVW0_SSO0_SVW8_SK0_SKFTR0_SKXCCM0_TLDS1_ULSGRO0_USL1_UIOFGRO0_USFGROn1_VSn1_VWA8_VWB2_WSGRA0_WSGRB0_WS64_WG16_16_1_WGM8_WGMXCC8_WGMXCCGn1
    SolutionIndex: 51
    SolutionNameMin: Cijk_Alik_Bjlk_I8IS_BH_Bias_S_FDMN_SPB_A_S_SAV_MT240x256x64_MI16x16x1_SN_LDSB0_AFC1_AG0_AFEM1_AFEM1_ASEM8_CLR0_CADS0_DTLA0_DTLB0_DTVA0_DTVB0_EPS1_FDSI0_GRPM1_GRVWA4_GRVWB16_GSUn1_GSUAMB_GSUC1_GSUWGMRR1_GLS0_ISA942_IU1_K1_LDSTI0_LBSPPA128_LBSPPB4096_LBSPPM0_LPA32_LPB32_LPM0_LRVW16_LWPMn1_MIAV0_MIWT15_4_MO40_NTn1_NTA0_NTB0_NTC0_NTD4_NTM0_NEPBS0_NLCA1_NLCB1_ONLL1_PGR2_PLR0_PKA1_SIA3_SS1_SU16_SUM0_SUS256_SPO0_SRVW0_SSO0_SVW1_SK0_SKFTR0_SKXCCM0_TLDS1_ULSGRO0_USL1_UIOFGRO0_USFGROn1_VSn1_VWA1_VWB2_WSGRA0_WSGRB0_WS64_WG16_16_1_WGM8_WGMXCC8_WGMXCCGn1
    SolutionIndex: 52
    SolutionNameMin: Cijk_Alik_Bjlk_I8IS_BH_Bias_S_FDMN_SPB_A_S_SAV_MT160x384x128_MI16x16x1_SN_LDSB1_AFC1_AG0_AFEM1_AFEM1_ASEM8_CLR1_CADS0_DTLA0_DTLB0_DTVA0_DTVB0_EPS1_FDSI0_GRPM1_GRVWA16_GRVWB8_GSUn1_GSUAMB_GSUC1_GSUWGMRR1_GLS0_ISA942_IU1_K1_LDSTI0_LBSPPA256_LBSPPB6144_LBSPPM0_LPA32_LPB32_LPM0_LRVW16_LWPMn1_MIAV0_MIWT10_6_MO40_NTn1_NTA0_NTB0_NTC0_NTD4_NTM0_NEPBS0_NLCA1_NLCB3_ONLL1_PGR2_PLR1_PKA1_SIA3_SS1_SU16_SUM0_SUS256_SPO0_SRVW0_SSO0_SVW2_SK0_SKFTR0_SKXCCM0_TLDS1_ULSGRO0_USL1_UIOFGRO0_USFGROn1_VSn1_VWA2_VWB2_WSGRA0_WSGRB0_WS64_WG16_16_1_WGM8_WGMXCC8_WGMXCCGn1
    SolutionIndex: 53
    SolutionNameMin: Cijk_Alik_Bjlk_I8IS_BH_Bias_S_FDMN_SPB_A_S_SAV_MT112x384x128_MI16x16x1_SN_LDSB1_AFC1_AG0_AFEM1_AFEM1_ASEM8_CLR1_CADS0_DTLA0_DTLB0_DTVA0_DTVB0_EPS1_FDSI0_GRPM1_GRVWA4_GRVWB16_GSUn1_GSUAMB_GSUC1_GSUWGMRR1_GLS0_ISA942_IU1_K1_LDSTI0_LBSPPA128_LBSPPB6144_LBSPPM0_LPA32_LPB32_LPM0_LRVW16_LWPMn1_MIAV0_MIWT7_6_MO40_NTn1_NTA0_NTB0_NTC0_NTD4_NTM0_NEPBS0_NLCA1_NLCB3_ONLL1_PGR2_PLR1_PKA1_SIA3_SS1_SU16_SUM0_SUS256_SPO0_SRVW0_SSO0_SVW1_SK0_SKFTR0_SKXCCM0_TLDS1_ULSGRO0_USL1_UIOFGRO0_USFGROn1_VSn1_VWA1_VWB2_WSGRA0_WSGRB0_WS64_WG16_16_1_WGM8_WGMXCC8_WGMXCCGn1
    SolutionIndex: 54
    SolutionNameMin: Cijk_Alik_Bjlk_I8IS_BH_Bias_S_FDMN_SPB_A_S_SAV_MT32x128x256_MI16x16x1_SN_LDSB1_AFC1_AG0_AFEM1_AFEM1_ASEM8_CLR1_CADS0_DTLA0_DTLB0_DTVA0_DTVB0_EPS1_FDSI0_GRPM1_GRVWA4_GRVWB16_GSUn1_GSUAMB_GSUC1_GSUWGMRR1_GLS0_ISA942_IU1_K1_LDSTI0_LBSPPA512_LBSPPB2048_LBSPPM0_LPA32_LPB32_LPM0_LRVW16_LWPMn1_MIAV0_MIWT2_2_MO40_NTn1_NTA0_NTB0_NTC0_NTD4_NTM0_NEPBS16_NLCA1_NLCB1_ONLL1_PGR2_PLR1_PKA1_SIA3_SS1_SU16_SUM0_SUS256_SPO0_SRVW0_SSO0_SVW2_SK0_SKFTR0_SKXCCM0_TLDS1_ULSGRO0_USL1_UIOFGRO0_USFGROn1_VSn1_VWA2_VWB2_WSGRA0_WSGRB0_WS64_WG16_16_1_WGM8_WGMXCC8_WGMXCCGn1
    SolutionIndex: 55
    SolutionNameMin: Cijk_Alik_Bjlk_I8IS_BH_Bias_S_FDMN_SPB_A_S_SAV_MT32x128x256_MI16x16x1_SN_LDSB1_AFC1_AG0_AFEM1_AFEM1_ASEM8_CLR1_CADS0_DTLA0_DTLB0_DTVA0_DTVB0_EPS1_FDSI0_GRPM1_GRVWA16_GRVWB16_GSUn1_GSUAMB_GSUC1_GSUWGMRR1_GLS0_ISA942_IU1_K1_LDSTI0_LBSPPA512_LBSPPB2048_LBSPPM0_LPA32_LPB32_LPM0_LRVW16_LWPMn1_MIAV0_MIWT2_2_MO40_NTn1_NTA0_NTB0_NTC0_NTD4_NTM0_NEPBS16_NLCA1_NLCB1_ONLL1_PGR2_PLR1_PKA1_SIA3_SS1_SU16_SUM0_SUS256_SPO0_SRVW0_SSO0_SVW2_SK0_SKFTR0_SKXCCM0_TLDS1_ULSGRO0_USL1_UIOFGRO0_USFGROn1_VSn1_VWA2_VWB2_WSGRA0_WSGRB0_WS64_WG16_16_1_WGM8_WGMXCC8_WGMXCCGn1
    SolutionIndex: 56
    SolutionNameMin: Cijk_Alik_Bjlk_I8IS_BH_Bias_S_FDMN_SPB_A_S_SAV_MT32x128x256_MI16x16x1_SN_LDSB1_AFC1_AG0_AFEM1_AFEM1_ASEM8_CLR1_CADS0_DTLA0_DTLB0_DTVA0_DTVB0_EPS1_FDSI0_GRPM1_GRVWA16_GRVWB8_GSUn1_GSUAMB_GSUC1_GSUWGMRR1_GLS0_ISA942_IU1_K1_LDSTI0_LBSPPA512_LBSPPB2048_LBSPPM0_LPA32_LPB32_LPM0_LRVW16_LWPMn1_MIAV0_MIWT2_2_MO40_NTn1_NTA0_NTB0_NTC0_NTD4_NTM0_NEPBS16_NLCA1_NLCB1_ONLL1_PGR2_PLR1_PKA1_SIA3_SS1_SU16_SUM0_SUS256_SPO0_SRVW0_SSO0_SVW2_SK0_SKFTR0_SKXCCM0_TLDS1_ULSGRO0_USL1_UIOFGRO0_USFGROn1_VSn1_VWA2_VWB2_WSGRA0_WSGRB0_WS64_WG16_16_1_WGM8_WGMXCC8_WGMXCCGn1
    SolutionIndex: 57
    SolutionNameMin: Cijk_Alik_Bjlk_I8IS_BH_Bias_S_FDMN_SPB_A_S_SAV_MT192x256x128_MI16x16x1_SN_LDSB1_AFC1_AG0_AFEM1_AFEM1_ASEM8_CLR1_CADS0_DTLA0_DTLB0_DTVA0_DTVB0_EPS1_FDSI0_GRPM1_GRVWA16_GRVWB16_GSUn1_GSUAMB_GSUC1_GSUWGMRR1_GLS0_ISA942_IU1_K1_LDSTI0_LBSPPA256_LBSPPB4096_LBSPPM0_LPA32_LPB32_LPM0_LRVW16_LWPMn1_MIAV0_MIWT6_8_MO40_NTn1_NTA0_NTB0_NTC0_NTD4_NTM0_NEPBS0_NLCA1_NLCB1_ONLL1_PGR2_PLR1_PKA1_SIA3_SS1_SU16_SUM0_SUS256_SPO0_SRVW0_SSO0_SVW2_SK0_SKFTR0_SKXCCM0_TLDS1_ULSGRO0_USL1_UIOFGRO0_USFGROn1_VSn1_VWA2_VWB2_WSGRA0_WSGRB0_WS64_WG32_8_1_WGM8_WGMXCC8_WGMXCCGn1
    SolutionIndex: 58
    SolutionNameMin: Cijk_Alik_Bjlk_I8IS_BH_Bias_S_FDMN_SPB_A_S_SAV_MT48x256x256_MI16x16x1_SN_LDSB1_AFC1_AG0_AFEM1_AFEM1_ASEM8_CLR1_CADS0_DTLA0_DTLB0_DTVA0_DTVB0_EPS1_FDSI0_GRPM1_GRVWA16_GRVWB16_GSUn1_GSUAMB_GSUC1_GSUWGMRR1_GLS0_ISA942_IU1_K1_LDSTI0_LBSPPA256_LBSPPB4096_LBSPPM0_LPA32_LPB32_LPM0_LRVW16_LWPMn1_MIAV0_MIWT3_4_MO40_NTn1_NTA0_NTB0_NTC0_NTD4_NTM0_NEPBS0_NLCA1_NLCB1_ONLL1_PGR2_PLR1_PKA1_SIA3_SS1_SU16_SUM0_SUS256_SPO0_SRVW0_SSO0_SVW1_SK0_SKFTR0_SKXCCM0_TLDS1_ULSGRO0_USL1_UIOFGRO0_USFGROn1_VSn1_VWA1_VWB2_WSGRA0_WSGRB0_WS64_WG16_16_1_WGM1_WGMXCC8_WGMXCCGn1
    SolutionIndex: 59
    SolutionNameMin: Cijk_Alik_Bjlk_I8IS_BH_Bias_S_FDMN_SPB_A_S_SAV_MT64x256x256_MI16x16x1_SN_LDSB1_AFC1_AG0_AFEM1_AFEM1_ASEM8_CLR1_CADS0_DTLA0_DTLB0_DTVA0_DTVB0_EPS1_FDSI0_GRPM1_GRVWA16_GRVWB16_GSUn1_GSUAMB_GSUC1_GSUWGMRR1_GLS0_ISA942_IU1_K1_LDSTI0_LBSPPA1024_LBSPPB4096_LBSPPM0_LPA32_LPB32_LPM0_LRVW16_LWPMn1_MIAV0_MIWT4_4_MO40_NTn1_NTA0_NTB0_NTC0_NTD4_NTM0_NEPBS0_NLCA1_NLCB1_ONLL1_PGR2_PLR1_PKA1_SIA3_SS1_SU16_SUM0_SUS256_SPO0_SRVW0_SSO0_SVW4_SK0_SKFTR0_SKXCCM0_TLDS1_ULSGRO0_USL1_UIOFGRO0_USFGROn1_VSn1_VWA4_VWB2_WSGRA0_WSGRB0_WS64_WG16_16_1_WGM8_WGMXCC8_WGMXCCGn1
    SolutionIndex: 60
    SolutionNameMin: Cijk_Alik_Bjlk_I8IS_BH_Bias_S_FDMN_SPB_A_S_SAV_MT48x256x256_MI16x16x1_SN_LDSB1_AFC1_AG0_AFEM1_AFEM1_ASEM8_CLR1_CADS0_DTLA0_DTLB0_DTVA0_DTVB0_EPS1_FDSI0_GRPM1_GRVWA16_GRVWB16_GSUn1_GSUAMB_GSUC1_GSUWGMRR1_GLS0_ISA942_IU1_K1_LDSTI0_LBSPPA256_LBSPPB4096_LBSPPM0_LPA32_LPB32_LPM0_LRVW16_LWPMn1_MIAV0_MIWT3_4_MO40_NTn1_NTA0_NTB0_NTC0_NTD4_NTM0_NEPBS0_NLCA1_NLCB1_ONLL1_PGR2_PLR1_PKA1_SIA3_SS1_SU16_SUM0_SUS256_SPO0_SRVW0_SSO0_SVW1_SK0_SKFTR0_SKXCCM0_TLDS1_ULSGRO0_USL1_UIOFGRO0_USFGROn1_VSn1_VWA1_VWB2_WSGRA0_WSGRB0_WS64_WG16_16_1_WGM8_WGMXCC8_WGMXCCGn1
    SolutionIndex: 61
    SolutionNameMin: Cijk_Alik_Bjlk_I8IS_BH_Bias_S_FDMN_SPB_A_S_SAV_MT64x256x256_MI16x16x1_SN_LDSB1_AFC1_AG0_AFEM1_AFEM1_ASEM8_CLR1_CADS0_DTLA0_DTLB0_DTVA0_DTVB0_EPS1_FDSI0_GRPM1_GRVWA16_GRVWB16_GSUn1_GSUAMB_GSUC1_GSUWGMRR1_GLS0_ISA942_IU1_K1_LDSTI0_LBSPPA1024_LBSPPB4096_LBSPPM0_LPA32_LPB32_LPM0_LRVW16_LWPMn1_MIAV0_MIWT4_4_MO40_NTn1_NTA0_NTB0_NTC0_NTD4_NTM0_NEPBS0_NLCA1_NLCB1_ONLL1_PGR2_PLR1_PKA1_SIA3_SS1_SU16_SUM0_SUS256_SPO0_SRVW0_SSO0_SVW4_SK0_SKFTR0_SKXCCM0_TLDS1_ULSGRO0_USL1_UIOFGRO0_USFGROn1_VSn1_VWA4_VWB2_WSGRA0_WSGRB0_WS64_WG16_16_1_WGM1_WGMXCC8_WGMXCCGn1
    SolutionIndex: 62
    SolutionNameMin: Cijk_Alik_Bjlk_I8IS_BH_Bias_S_FDMN_SPB_A_S_SAV_MT64x256x256_MI16x16x1_SN_LDSB1_AFC1_AG0_AFEM1_AFEM1_ASEM8_CLR1_CADS0_DTLA0_DTLB0_DTVA0_DTVB0_EPS1_FDSI0_GRPM1_GRVWA4_GRVWB16_GSUn1_GSUAMB_GSUC1_GSUWGMRR1_GLS0_ISA942_IU1_K1_LDSTI0_LBSPPA1024_LBSPPB4096_LBSPPM0_LPA32_LPB32_LPM0_LRVW16_LWPMn1_MIAV0_MIWT4_4_MO40_NTn1_NTA0_NTB0_NTC0_NTD4_NTM0_NEPBS0_NLCA1_NLCB1_ONLL1_PGR2_PLR1_PKA1_SIA3_SS1_SU16_SUM0_SUS256_SPO0_SRVW0_SSO0_SVW4_SK0_SKFTR0_SKXCCM0_TLDS1_ULSGRO0_USL1_UIOFGRO0_USFGROn1_VSn1_VWA4_VWB2_WSGRA0_WSGRB0_WS64_WG16_16_1_WGM1_WGMXCC1_WGMXCCGn1
    SolutionIndex: 63
    SolutionNameMin: Cijk_Alik_Bjlk_I8IS_BH_Bias_S_FDMN_SPB_A_S_SAV_MT48x256x256_MI16x16x1_SN_LDSB1_AFC1_AG0_AFEM1_AFEM1_ASEM8_CLR1_CADS0_DTLA0_DTLB0_DTVA0_DTVB0_EPS1_FDSI0_GRPM1_GRVWA4_GRVWB16_GSUn1_GSUAMB_GSUC1_GSUWGMRR1_GLS0_ISA942_IU1_K1_LDSTI0_LBSPPA256_LBSPPB4096_LBSPPM0_LPA32_LPB32_LPM0_LRVW16_LWPMn1_MIAV0_MIWT3_4_MO40_NTn1_NTA0_NTB0_NTC0_NTD4_NTM0_NEPBS0_NLCA1_NLCB1_ONLL1_PGR2_PLR1_PKA1_SIA3_SS1_SU16_SUM0_SUS256_SPO0_SRVW0_SSO0_SVW1_SK0_SKFTR0_SKXCCM0_TLDS1_ULSGRO0_USL1_UIOFGRO0_USFGROn1_VSn1_VWA1_VWB2_WSGRA0_WSGRB0_WS64_WG16_16_1_WGM1_WGMXCC1_WGMXCCGn1
    SolutionIndex: 64
    SolutionNameMin: Cijk_Alik_Bjlk_I8IS_BH_Bias_S_FDMN_SPB_A_S_SAV_MT64x256x256_MI16x16x1_SN_LDSB1_AFC1_AG0_AFEM1_AFEM1_ASEM8_CLR1_CADS0_DTLA0_DTLB0_DTVA0_DTVB0_EPS1_FDSI0_GRPM1_GRVWA4_GRVWB16_GSUn1_GSUAMB_GSUC1_GSUWGMRR1_GLS0_ISA942_IU1_K1_LDSTI0_LBSPPA1024_LBSPPB4096_LBSPPM0_LPA32_LPB32_LPM0_LRVW16_LWPMn1_MIAV0_MIWT4_4_MO40_NTn1_NTA0_NTB0_NTC0_NTD4_NTM0_NEPBS0_NLCA1_NLCB1_ONLL1_PGR2_PLR1_PKA1_SIA3_SS1_SU16_SUM0_SUS256_SPO0_SRVW0_SSO0_SVW4_SK0_SKFTR0_SKXCCM0_TLDS1_ULSGRO0_USL1_UIOFGRO0_USFGROn1_VSn1_VWA4_VWB2_WSGRA0_WSGRB0_WS64_WG16_16_1_WGM1_WGMXCC8_WGMXCCGn1
    SolutionIndex: 65
    SolutionNameMin: Cijk_Alik_Bjlk_I8IS_BH_Bias_S_FDMN_SPB_A_S_SAV_MT48x128x256_MI16x16x1_SN_LDSB1_AFC1_AG0_AFEM1_AFEM1_ASEM8_CLR1_CADS0_DTLA0_DTLB0_DTVA0_DTVB0_EPS1_FDSI0_GRPM1_GRVWA16_GRVWB16_GSUn1_GSUAMB_GSUC1_GSUWGMRR1_GLS0_ISA942_IU1_K1_LDSTI0_LBSPPA256_LBSPPB2048_LBSPPM0_LPA32_LPB32_LPM0_LRVW16_LWPMn1_MIAV0_MIWT3_2_MO40_NTn1_NTA0_NTB0_NTC0_NTD4_NTM0_NEPBS0_NLCA1_NLCB1_ONLL1_PGR2_PLR1_PKA1_SIA3_SS1_SU16_SUM0_SUS256_SPO0_SRVW0_SSO0_SVW1_SK0_SKFTR0_SKXCCM0_TLDS1_ULSGRO0_USL1_UIOFGRO0_USFGROn1_VSn1_VWA1_VWB2_WSGRA0_WSGRB0_WS64_WG16_16_1_WGM1_WGMXCC1_WGMXCCGn1
    SolutionIndex: 66
    SolutionNameMin: Cijk_Alik_Bjlk_I8IS_BH_Bias_S_FDMN_SPB_A_S_SAV_MT32x256x256_MI16x16x1_SN_LDSB1_AFC1_AG0_AFEM1_AFEM1_ASEM8_CLR1_CADS0_DTLA0_DTLB0_DTVA0_DTVB0_EPS1_FDSI0_GRPM1_GRVWA16_GRVWB16_GSUn1_GSUAMB_GSUC1_GSUWGMRR1_GLS0_ISA942_IU1_K1_LDSTI0_LBSPPA512_LBSPPB4096_LBSPPM0_LPA32_LPB32_LPM0_LRVW16_LWPMn1_MIAV0_MIWT2_4_MO40_NTn1_NTA0_NTB0_NTC0_NTD4_NTM0_NEPBS0_NLCA1_NLCB1_ONLL1_PGR2_PLR1_PKA1_SIA3_SS1_SU16_SUM0_SUS256_SPO0_SRVW0_SSO0_SVW2_SK0_SKFTR0_SKXCCM0_TLDS1_ULSGRO0_USL1_UIOFGRO0_USFGROn1_VSn1_VWA2_VWB2_WSGRA0_WSGRB0_WS64_WG16_16_1_WGM1_WGMXCC8_WGMXCCGn1
    SolutionIndex: 67
    SolutionNameMin: Cijk_Alik_Bjlk_I8IS_BH_Bias_S_FDMN_SPB_A_S_SAV_MT48x256x256_MI16x16x1_SN_LDSB1_AFC1_AG0_AFEM1_AFEM1_ASEM8_CLR1_CADS0_DTLA0_DTLB0_DTVA0_DTVB0_EPS1_FDSI0_GRPM1_GRVWA4_GRVWB16_GSUn1_GSUAMB_GSUC1_GSUWGMRR1_GLS0_ISA942_IU1_K1_LDSTI0_LBSPPA256_LBSPPB4096_LBSPPM0_LPA32_LPB32_LPM0_LRVW16_LWPMn1_MIAV0_MIWT3_4_MO40_NTn1_NTA0_NTB0_NTC0_NTD4_NTM0_NEPBS0_NLCA1_NLCB1_ONLL1_PGR2_PLR1_PKA1_SIA3_SS1_SU16_SUM0_SUS256_SPO0_SRVW0_SSO0_SVW1_SK0_SKFTR0_SKXCCM0_TLDS1_ULSGRO0_USL1_UIOFGRO0_USFGROn1_VSn1_VWA1_VWB2_WSGRA0_WSGRB0_WS64_WG16_16_1_WGM8_WGMXCC8_WGMXCCGn1
- - - [10752, 10240, 1, 512]
    - [0, 283.07]
  - - [9216, 10752, 1, 512]
    - [1, 288.81]
  - - [10240, 11264, 1, 512]
    - [1, 288.91]
  - - [9216, 17664, 1, 512]
    - [3, 294.25]
  - - [25600, 19968, 1, 512]
    - [3, 301.31]
  - - [25600, 20736, 1, 512]
    - [3, 303.17]
  - - [21504, 5120, 1, 512]
    - [2, 286.76]
  - - [13312, 7168, 1, 512]
    - [0, 280.89]
  - - [21504, 23040, 1, 512]
    - [3, 306.35]
  - - [24576, 4864, 1, 512]
    - [3, 296.05]
  - - [22528, 4352, 1, 512]
    - [4, 285.54]
  - - [90112, 800, 1, 512]
    - [5, 250.44]
  - - [23296, 4096, 1, 512]
    - [1, 279.61]
  - - [25600, 3840, 1, 512]
    - [0, 283.46]
  - - [21504, 4352, 1, 512]
    - [6, 280.54]
  - - [21760, 4352, 1, 512]
    - [7, 278.79]
  - - [53504, 1728, 1, 512]
    - [8, 277.35]
  - - [26624, 3584, 1, 512]
    - [1, 285.28]
  - - [43008, 2304, 1, 512]
    - [0, 284.76]
  - - [37632, 2432, 1, 512]
    - [6, 271.46]
  - - [4096, 131072, 1, 512]
    - [9, 304.14]
  - - [992, 42240, 1, 512]
    - [10, 229.6]
  - - [512, 100352, 1, 512]
    - [1, 272.64]
  - - [480, 119040, 1, 512]
    - [11, 264.01]
  - - [2304, 76032, 1, 512]
    - [12, 308.19]
  - - [2048, 70400, 1, 512]
    - [9, 287.31]
  - - [608, 131072, 1, 512]
    - [13, 245.12]
  - - [432, 126976, 1, 512]
    - [14, 233.04]
  - - [608, 69888, 1, 512]
    - [13, 231.98]
  - - [496, 82432, 1, 512]
    - [14, 208.5]
  - - [272, 100352, 1, 512]
    - [15, 213.56]
  - - [240, 122880, 1, 512]
    - [16, 236.97]
  - - [416, 49152, 1, 512]
    - [17, 207.78]
  - - [240, 126976, 1, 512]
    - [16, 243.47]
  - - [240, 102400, 1, 512]
    - [16, 235.51]
  - - [272, 98304, 1, 512]
    - [15, 218.84]
  - - [400, 93184, 1, 512]
    - [18, 235.67]
  - - [240, 103168, 1, 512]
    - [16, 234.16]
  - - [272, 99840, 1, 512]
    - [15, 219.44]
  - - [400, 92160, 1, 512]
    - [16, 239.44]
  - - [16, 16, 1, 512]
    - [19, 0.03]
  - - [7680, 16896, 1, 2048]
    - [20, 538.07]
  - - [9984, 7936, 1, 2048]
    - [1, 527.02]
  - - [12800, 6144, 1, 2048]
    - [1, 513.59]
  - - [16128, 16128, 1, 2048]
    - [2, 549.46]
  - - [6656, 19968, 1, 2048]
    - [3, 528.19]
  - - [32768, 13824, 1, 2048]
    - [2, 548.73]
  - - [7936, 9984, 1, 2048]
    - [2, 522.2]
  - - [8192, 8960, 1, 2048]
    - [2, 495.91]
  - - [5376, 16640, 1, 2048]
    - [20, 550.59]
  - - [8960, 5632, 1, 2048]
    - [2, 550.49]
  - - [47872, 992, 1, 2048]
    - [2, 451.74]
  - - [83200, 736, 1, 2048]
    - [21, 421.75]
  - - [96768, 608, 1, 2048]
    - [20, 372.67]
  - - [25344, 2816, 1, 2048]
    - [3, 509.07]
  - - [59392, 1152, 1, 2048]
    - [22, 467.59]
  - - [46592, 1536, 1, 2048]
    - [20, 512.31]
  - - [43520, 1792, 1, 2048]
    - [1, 505.8]
  - - [90112, 496, 1, 2048]
    - [20, 380.58]
  - - [47872, 1856, 1, 2048]
    - [2, 485.48]
  - - [61952, 1024, 1, 2048]
    - [2, 474.87]
  - - [3968, 14592, 1, 2048]
    - [23, 494.85]
  - - [2688, 33792, 1, 2048]
    - [21, 518.1]
  - - [768, 69632, 1, 2048]
    - [3, 494.03]
  - - [576, 103168, 1, 2048]
    - [3, 509.08]
  - - [768, 66816, 1, 2048]
    - [20, 478.19]
  - - [768, 76800, 1, 2048]
    - [0, 521.79]
  - - [512, 99840, 1, 2048]
    - [1, 469.59]
  - - [480, 107520, 1, 2048]
    - [24, 485.83]
  - - [4096, 25088, 1, 2048]
    - [24, 502.76]
  - - [1984, 41216, 1, 2048]
    - [21, 482.25]
  - - [69888, 432, 1, 2048]
    - [1, 339.53]
  - - [5120, 4352, 1, 2048]
    - [25, 466.93]
  - - [272, 77824, 1, 2048]
    - [26, 419.49]
  - - [53248, 704, 1, 2048]
    - [20, 409.29]
  - - [14592, 1792, 1, 2048]
    - [20, 504.25]
  - - [26624, 864, 1, 2048]
    - [27, 392.63]
  - - [34048, 1024, 1, 2048]
    - [2, 484.01]
  - - [52224, 512, 1, 2048]
    - [20, 436.73]
  - - [29184, 896, 1, 2048]
    - [20, 458.41]
  - - [1216, 17664, 1, 2048]
    - [11, 444.81]
  - - [50688, 320, 1, 2048]
    - [28, 298.25]
  - - [33792, 448, 1, 2048]
    - [23, 354.56]
  - - [160, 115200, 1, 2048]
    - [24, 484.36]
  - - [1280, 13312, 1, 2048]
    - [10, 496.93]
  - - [16896, 928, 1, 2048]
    - [2, 424.07]
  - - [736, 19712, 1, 2048]
    - [10, 393.58]
  - - [128, 115200, 1, 2048]
    - [23, 393.57]
  - - [60928, 256, 1, 2048]
    - [2, 386.65]
  - - [30720, 464, 1, 2048]
    - [2, 352.37]
  - - [128, 114688, 1, 2048]
    - [23, 387.57]
  - - [128, 103680, 1, 2048]
    - [29, 370.83]
  - - [128, 103936, 1, 2048]
    - [30, 369.44]
  - - [128, 96512, 1, 2048]
    - [31, 370.61]
  - - [128, 103168, 1, 2048]
    - [32, 369.1]
  - - [128, 100352, 1, 2048]
    - [29, 372.67]
  - - [96, 111360, 1, 2048]
    - [33, 380.17]
  - - [96, 115200, 1, 2048]
    - [33, 383.05]
  - - [128, 96000, 1, 2048]
    - [34, 382.2]
  - - [128, 99840, 1, 2048]
    - [30, 366.08]
  - - [128, 102400, 1, 2048]
    - [29, 367.07]
  - - [1024, 1024, 1, 2048]
    - [35, 131.22]
  - - [7424, 7936, 1, 4096]
    - [36, 565.71]
  - - [6144, 11264, 1, 4096]
    - [3, 582.5]
  - - [8960, 8960, 1, 4096]
    - [2, 576.86]
  - - [4608, 15872, 1, 4096]
    - [3, 575.35]
  - - [8960, 6656, 1, 4096]
    - [36, 585.21]
  - - [9984, 7936, 1, 4096]
    - [20, 570.6]
  - - [5376, 14336, 1, 4096]
    - [2, 576.9]
  - - [4608, 19712, 1, 4096]
    - [24, 575.91]
  - - [4608, 16640, 1, 4096]
    - [3, 567.91]
  - - [12288, 4864, 1, 4096]
    - [3, 585.95]
  - - [62208, 1024, 1, 4096]
    - [2, 532.22]
  - - [29696, 2304, 1, 4096]
    - [2, 580.72]
  - - [19200, 2816, 1, 4096]
    - [3, 579.74]
  - - [20736, 2816, 1, 4096]
    - [2, 574.66]
  - - [96512, 496, 1, 4096]
    - [2, 454.78]
  - - [24320, 2304, 1, 4096]
    - [3, 603.69]
  - - [50176, 992, 1, 4096]
    - [2, 507.77]
  - - [45056, 1216, 1, 4096]
    - [36, 507.61]
  - - [28160, 2048, 1, 4096]
    - [3, 578.45]
  - - [17664, 3200, 1, 4096]
    - [20, 577.94]
  - - [3456, 20736, 1, 4096]
    - [10, 568.8]
  - - [1984, 43776, 1, 4096]
    - [2, 557.79]
  - - [768, 66560, 1, 4096]
    - [20, 536.99]
  - - [768, 73728, 1, 4096]
    - [3, 562.47]
  - - [608, 84480, 1, 4096]
    - [24, 510.17]
  - - [2048, 34048, 1, 4096]
    - [24, 547.77]
  - - [768, 94208, 1, 4096]
    - [37, 587.7]
  - - [448, 100352, 1, 4096]
    - [2, 551.16]
  - - [3072, 23808, 1, 4096]
    - [20, 571.57]
  - - [992, 64768, 1, 4096]
    - [10, 548.8]
  - - [19456, 1472, 1, 4096]
    - [24, 504.82]
  - - [96512, 240, 1, 4096]
    - [38, 372.15]
  - - [7936, 3072, 1, 4096]
    - [25, 555.99]
  - - [16128, 1472, 1, 4096]
    - [11, 506.66]
  - - [736, 28672, 1, 4096]
    - [25, 497.94]
  - - [1024, 36864, 1, 4096]
    - [39, 549.85]
  - - [192, 119040, 1, 4096]
    - [20, 468.99]
  - - [31744, 736, 1, 4096]
    - [20, 459.04]
  - - [352, 111104, 1, 4096]
    - [40, 486.99]
  - - [15872, 1472, 1, 4096]
    - [11, 497.44]
  - - [1728, 8448, 1, 4096]
    - [3, 594.17]
  - - [192, 76544, 1, 4096]
    - [20, 558.33]
  - - [256, 70400, 1, 4096]
    - [36, 531.11]
  - - [192, 75264, 1, 4096]
    - [41, 542.73]
  - - [192, 77824, 1, 4096]
    - [41, 566.07]
  - - [128, 107520, 1, 4096]
    - [30, 451.45]
  - - [192, 76800, 1, 4096]
    - [41, 559.33]
  - - [144, 103168, 1, 4096]
    - [24, 399.05]
  - - [192, 73728, 1, 4096]
    - [3, 571.95]
  - - [192, 76032, 1, 4096]
    - [20, 568.38]
  - - [128, 96000, 1, 4096]
    - [32, 429.36]
  - - [128, 103168, 1, 4096]
    - [32, 439.37]
  - - [128, 103680, 1, 4096]
    - [32, 433.91]
  - - [128, 103936, 1, 4096]
    - [32, 432.24]
  - - [5888, 1856, 1, 4096]
    - [11, 496.45]
  - - [128, 96768, 1, 4096]
    - [32, 430.88]
  - - [128, 89856, 1, 4096]
    - [32, 423.15]
  - - [128, 96512, 1, 4096]
    - [30, 429.18]
  - - [128, 100352, 1, 4096]
    - [30, 439.89]
  - - [96, 111360, 1, 4096]
    - [33, 420.95]
  - - [16, 88320, 1, 4096]
    - [42, 94.77]
  - - [32, 90112, 1, 4096]
    - [43, 176.34]
  - - [48, 64768, 1, 4096]
    - [44, 227.74]
  - - [16, 65280, 1, 4096]
    - [45, 95.68]
  - - [16, 70400, 1, 4096]
    - [46, 102.97]
  - - [32, 73728, 1, 4096]
    - [47, 203.04]
  - - [16, 79360, 1, 4096]
    - [42, 92.88]
  - - [16, 81664, 1, 4096]
    - [42, 91.08]
  - - [16, 81920, 1, 4096]
    - [42, 90.95]
  - - [32, 86016, 1, 4096]
    - [43, 171.94]
  - - [4608, 12544, 1, 8192]
    - [3, 667.73]
  - - [4608, 14848, 1, 8192]
    - [20, 617.17]
  - - [7936, 7424, 1, 8192]
    - [25, 645.92]
  - - [12800, 4608, 1, 8192]
    - [39, 659.36]
  - - [5376, 10752, 1, 8192]
    - [20, 675.19]
  - - [6400, 12288, 1, 8192]
    - [2, 633.12]
  - - [4608, 15360, 1, 8192]
    - [20, 666.76]
  - - [12288, 19712, 1, 8192]
    - [2, 682.96]
  - - [9984, 8192, 1, 8192]
    - [2, 638.4]
  - - [4864, 12288, 1, 8192]
    - [36, 631.62]
  - - [32256, 1600, 1, 8192]
    - [3, 528.81]
  - - [38400, 1536, 1, 8192]
    - [20, 592.4]
  - - [46080, 1280, 1, 8192]
    - [3, 579.56]
  - - [24320, 2304, 1, 8192]
    - [36, 587.8]
  - - [42240, 1280, 1, 8192]
    - [20, 565.77]
  - - [23296, 2304, 1, 8192]
    - [20, 575.42]
  - - [53760, 1024, 1, 8192]
    - [3, 540.99]
  - - [44544, 1280, 1, 8192]
    - [20, 574.33]
  - - [33280, 1600, 1, 8192]
    - [36, 525.13]
  - - [32256, 1728, 1, 8192]
    - [36, 566.67]
  - - [2048, 36864, 1, 8192]
    - [36, 602.6]
  - - [768, 71680, 1, 8192]
    - [3, 599.09]
  - - [1280, 44544, 1, 8192]
    - [36, 618.4]
  - - [2304, 25600, 1, 8192]
    - [36, 623.06]
  - - [768, 72960, 1, 8192]
    - [23, 603.09]
  - - [1984, 35328, 1, 8192]
    - [24, 590.43]
  - - [1472, 46080, 1, 8192]
    - [3, 590.55]
  - - [768, 66560, 1, 8192]
    - [1, 585.06]
  - - [768, 76800, 1, 8192]
    - [39, 627.17]
  - - [1536, 38400, 1, 8192]
    - [39, 650.31]
  - - [288, 78848, 1, 8192]
    - [48, 441.68]
  - - [400, 78848, 1, 8192]
    - [49, 465.99]
  - - [320, 89856, 1, 8192]
    - [10, 498.2]
  - - [78848, 480, 1, 8192]
    - [20, 477.24]
  - - [768, 47616, 1, 8192]
    - [36, 598.29]
  - - [34048, 928, 1, 8192]
    - [21, 519.6]
  - - [14080, 2688, 1, 8192]
    - [36, 610.75]
  - - [47872, 704, 1, 8192]
    - [10, 516.13]
  - - [48384, 736, 1, 8192]
    - [24, 537.77]
  - - [37632, 992, 1, 8192]
    - [50, 536.51]
  - - [240, 70656, 1, 8192]
    - [51, 458.01]
  - - [47104, 304, 1, 8192]
    - [52, 417.78]
  - - [384, 50176, 1, 8192]
    - [50, 566.9]
  - - [10240, 1856, 1, 8192]
    - [25, 486.64]
  - - [512, 37632, 1, 8192]
    - [36, 615.29]
  - - [256, 62208, 1, 8192]
    - [36, 492.79]
  - - [256, 64768, 1, 8192]
    - [36, 503.29]
  - - [256, 59136, 1, 8192]
    - [1, 479.86]
  - - [256, 65536, 1, 8192]
    - [36, 513.84]
  - - [8448, 2176, 1, 8192]
    - [39, 555.07]
  - - [256, 39168, 1, 8192]
    - [30, 503.83]
  - - [320, 41472, 1, 8192]
    - [10, 535.55]
  - - [176, 69120, 1, 8192]
    - [40, 499.58]
  - - [51968, 256, 1, 8192]
    - [40, 442.38]
  - - [192, 66816, 1, 8192]
    - [3, 495.41]
  - - [128, 82944, 1, 8192]
    - [32, 387.13]
  - - [192, 56576, 1, 8192]
    - [3, 484.83]
  - - [112, 96768, 1, 8192]
    - [53, 336.72]
  - - [112, 96000, 1, 8192]
    - [53, 343.06]
  - - [512, 19968, 1, 8192]
    - [40, 521.35]
  - - [32, 59136, 1, 8192]
    - [54, 155.7]
  - - [16, 55552, 1, 8192]
    - [46, 94.94]
  - - [16, 52992, 1, 8192]
    - [46, 93.19]
  - - [32, 51968, 1, 8192]
    - [54, 159.51]
  - - [32, 52224, 1, 8192]
    - [55, 152.2]
  - - [32, 46080, 1, 8192]
    - [54, 146.91]
  - - [16, 48384, 1, 8192]
    - [46, 96.77]
  - - [32, 59904, 1, 8192]
    - [56, 142.13]
  - - [32, 59392, 1, 8192]
    - [54, 141.3]
  - - [16, 49152, 1, 8192]
    - [46, 93.83]
  - - [8192, 1792, 1, 32768]
    - [3, 612.55]
  - - [29440, 512, 1, 32768]
    - [2, 538.43]
  - - [6400, 2560, 1, 32768]
    - [24, 614.93]
  - - [5376, 2816, 1, 32768]
    - [2, 607.42]
  - - [3968, 4096, 1, 32768]
    - [21, 649.79]
  - - [3584, 4608, 1, 32768]
    - [2, 634.07]
  - - [28160, 512, 1, 32768]
    - [57, 539.85]
  - - [1792, 9216, 1, 32768]
    - [2, 647.54]
  - - [9216, 1472, 1, 32768]
    - [3, 559.1]
  - - [3840, 4096, 1, 32768]
    - [49, 623.36]
  - - [29696, 416, 1, 32768]
    - [49, 479.75]
  - - [25344, 496, 1, 32768]
    - [20, 515.02]
  - - [7680, 1408, 1, 32768]
    - [40, 560.77]
  - - [19712, 608, 1, 32768]
    - [49, 460.73]
  - - [640, 16128, 1, 32768]
    - [25, 540.33]
  - - [23808, 496, 1, 32768]
    - [3, 503.19]
  - - [30464, 432, 1, 32768]
    - [49, 474.57]
  - - [9216, 1280, 1, 32768]
    - [25, 569.42]
  - - [5376, 2304, 1, 32768]
    - [40, 569.05]
  - - [4352, 2944, 1, 32768]
    - [3, 566.48]
  - - [48, 131072, 1, 32768]
    - [58, 208.04]
  - - [64, 131072, 1, 32768]
    - [59, 265.29]
  - - [48, 126976, 1, 32768]
    - [60, 203.7]
  - - [64, 126976, 1, 32768]
    - [61, 262.32]
  - - [64, 122880, 1, 32768]
    - [62, 264.96]
  - - [48, 122880, 1, 32768]
    - [63, 203.41]
  - - [64, 119040, 1, 32768]
    - [64, 254.11]
  - - [48, 119040, 1, 32768]
    - [65, 201.69]
  - - [32, 131072, 1, 32768]
    - [66, 145.89]
  - - [48, 118784, 1, 32768]
    - [67, 200.94]
- null
- null
- DeviceEfficiency
- GridBased
