projects/hipsparselt/library/src/hcc_detail/rocsparselt/src/spmm/Tensile/Logic/asm_full/aquavanjaram/gfx942/GridBased/aquavanjaram_Cijk_Alik_Bljk_F8NSS_BH_Bias_FDMN_SPAML0_A_S_SAV.yaml
- {MinimumRequiredVersion: 5.0.0}
- aquavanjaram
- gfx942
- [Device 0049, Device 0050]
    SolutionIndex: 0
    SolutionNameMin: Cijk_Alik_Bljk_F8NSS_BH_Bias_FDMN_SPAML0_A_S_SAV_MT320x192x128_MI16x16x1_SN_LDSB1_AFC1_AG0_AFEM1_AFEM1_ASEM8_CLR1_CADS0_DTLA0_DTLB0_DTVA0_DTVB0_DTVMXSA0_DTVMXSB0_DTVSM0_DPLB0_EPS1_ELFLR0_EMLLn1_FDSI0_GRPM1_GRVWA16_GRVWB4_GSUn1_GSUAMBSK_GSUC1_GSUWGMRR1_GLS0_ISA942_IU1_K1_LDSTI0_LBSPPA128_LBSPPB512_LBSPPM0_LPA16_LPB32_LPM0_LRVWn1_LWPMn1_MIAV0_MIWT5_12_MO40_MGRIPM1_NTn1_NTA0_NTB0_NTC0_NTD4_NTM0_NEPBS16_NLCA1_NLCB1_ONLL1_PGR2_PLR1_PKA1_SGROB0_SIA3_SS0_SU16_SUM0_SUS256_SPO0_SRVW0_SSO0_SVW4_SK0_SKFTR0_SKXCCM0_SGRO0_TDMI0_TIN0_TLDS1_TLDSM1_ULSGRO0_USL1_USLMX0_UIOFGRO0_UPLRP0_USFGROn1_USI0_VSn1_VWA1_VWB4_WSGRA0_WSGRB0_WS64_WG64_4_1_WGM1_WGMXCC1_WGMXCCGn1
    SolutionIndex: 1
    SolutionNameMin: Cijk_Alik_Bljk_F8NSS_BH_Bias_FDMN_SPAML0_A_S_SAV_MT320x192x128_MI16x16x1_SN_LDSB1_AFC1_AG0_AFEM1_AFEM1_ASEM8_CLR1_CADS0_DTLA0_DTLB0_DTVA0_DTVB0_DTVMXSA0_DTVMXSB0_DTVSM0_DPLB0_EPS1_ELFLR0_EMLLn1_FDSI0_GRPM1_GRVWA16_GRVWB16_GSUn1_GSUAMBSK_GSUC1_GSUWGMRR1_GLS0_ISA942_IU1_K1_LDSTI0_LBSPPA128_LBSPPB512_LBSPPM0_LPA16_LPB32_LPM0_LRVWn1_LWPMn1_MIAV0_MIWT5_12_MO40_MGRIPM1_NTn1_NTA0_NTB0_NTC0_NTD4_NTM0_NEPBS16_NLCA1_NLCB1_ONLL1_PGR2_PLR1_PKA1_SGROB0_SIA3_SS0_SU16_SUM0_SUS256_SPO0_SRVW0_SSO0_SVW4_SK0_SKFTR0_SKXCCM0_SGRO0_TDMI0_TIN0_TLDS1_TLDSM1_ULSGRO0_USL1_USLMX0_UIOFGRO0_UPLRP0_USFGROn1_USI0_VSn1_VWA1_VWB4_WSGRA0_WSGRB0_WS64_WG64_4_1_WGM1_WGMXCC1_WGMXCCGn1
    SolutionIndex: 2
    SolutionNameMin: Cijk_Alik_Bljk_F8NSS_BH_Bias_FDMN_SPAML0_A_S_SAV_MT224x256x128_MI16x16x1_SN_LDSB1_AFC1_AG0_AFEM1_AFEM1_ASEM8_CLR1_CADS0_DTLA0_DTLB0_DTVA0_DTVB0_DTVMXSA0_DTVMXSB0_DTVSM0_DPLB0_EPS1_ELFLR0_EMLLn1_FDSI0_GRPM1_GRVWA8_GRVWB16_GSUn1_GSUAMBSK_GSUC1_GSUWGMRR1_GLS0_ISA942_IU1_K1_LDSTI0_LBSPPA128_LBSPPB1024_LBSPPM0_LPA8_LPB32_LPM0_LRVWn1_LWPMn1_MIAV0_MIWT7_8_MO40_MGRIPM1_NTn1_NTA0_NTB0_NTC0_NTD4_NTM0_NEPBS16_NLCA1_NLCB1_ONLL1_PGR2_PLR1_PKA1_SGROB0_SIA3_SS0_SU16_SUM0_SUS256_SPO0_SRVW0_SSO0_SVW4_SK0_SKFTR0_SKXCCM0_SGRO0_TDMI0_TIN0_TLDS1_TLDSM1_ULSGRO0_USL1_USLMX0_UIOFGRO0_UPLRP0_USFGROn1_USI0_VSn1_VWA1_VWB8_WSGRA0_WSGRB0_WS64_WG32_8_1_WGM1_WGMXCC1_WGMXCCGn1
    SolutionIndex: 3
    SolutionNameMin: Cijk_Alik_Bljk_F8NSS_BH_Bias_FDMN_SPAML0_A_S_SAV_MT288x192x128_MI16x16x1_SN_LDSB1_AFC1_AG0_AFEM1_AFEM1_ASEM8_CLR1_CADS0_DTLA0_DTLB0_DTVA0_DTVB0_DTVMXSA0_DTVMXSB0_DTVSM0_DPLB0_EPS1_ELFLR0_EMLLn1_FDSI0_GRPM1_GRVWA8_GRVWB16_GSUn1_GSUAMBSK_GSUC1_GSUWGMRR1_GLS0_ISA942_IU1_K1_LDSTI0_LBSPPA128_LBSPPB256_LBSPPM0_LPA8_LPB32_LPM0_LRVWn1_LWPMn1_MIAV0_MIWT9_6_MO40_MGRIPM1_NTn1_NTA0_NTB0_NTC0_NTD4_NTM0_NEPBS16_NLCA1_NLCB1_ONLL1_PGR2_PLR1_PKA1_SGROB0_SIA3_SS0_SU16_SUM0_SUS256_SPO0_SRVW0_SSO0_SVW4_SK0_SKFTR0_SKXCCM0_SGRO0_TDMI0_TIN0_TLDS1_TLDSM1_ULSGRO0_USL1_USLMX0_UIOFGRO0_UPLRP0_USFGROn1_USI0_VSn1_VWA1_VWB2_WSGRA0_WSGRB0_WS64_WG32_8_1_WGM1_WGMXCC1_WGMXCCGn1
    SolutionIndex: 4
    SolutionNameMin: Cijk_Alik_Bljk_F8NSS_BH_Bias_FDMN_SPAML0_A_S_SAV_MT192x256x128_MI16x16x1_SN_LDSB1_AFC1_AG0_AFEM1_AFEM1_ASEM8_CLR1_CADS0_DTLA0_DTLB0_DTVA0_DTVB0_DTVMXSA0_DTVMXSB0_DTVSM0_DPLB0_EPS1_ELFLR0_EMLLn1_FDSI0_GRPM1_GRVWA16_GRVWB16_GSUn1_GSUAMBSK_GSUC1_GSUWGMRR1_GLS0_ISA942_IU1_K1_LDSTI0_LBSPPA128_LBSPPB2048_LBSPPM0_LPA16_LPB32_LPM0_LRVWn1_LWPMn1_MIAV0_MIWT3_16_MO40_MGRIPM1_NTn1_NTA0_NTB0_NTC0_NTD4_NTM0_NEPBS16_NLCA1_NLCB1_ONLL1_PGR2_PLR1_PKA1_SGROB0_SIA3_SS0_SU16_SUM0_SUS256_SPO0_SRVW0_SSO0_SVW4_SK0_SKFTR0_SKXCCM0_SGRO0_TDMI0_TIN0_TLDS1_TLDSM1_ULSGRO0_USL1_USLMX0_UIOFGRO0_UPLRP0_USFGROn1_USI0_VSn1_VWA1_VWB16_WSGRA0_WSGRB0_WS64_WG64_4_1_WGM1_WGMXCC1_WGMXCCGn1
    SolutionIndex: 5
    SolutionNameMin: Cijk_Alik_Bljk_F8NSS_BH_Bias_FDMN_SPAML0_A_S_SAV_MT160x256x128_MI16x16x1_SN_LDSB1_AFC1_AG0_AFEM1_AFEM1_ASEM8_CLR1_CADS0_DTLA0_DTLB0_DTVA0_DTVB0_DTVMXSA0_DTVMXSB0_DTVSM0_DPLB0_EPS1_ELFLR0_EMLLn1_FDSI0_GRPM1_GRVWA8_GRVWB16_GSUn1_GSUAMBSK_GSUC1_GSUWGMRR1_GLS0_ISA942_IU1_K1_LDSTI0_LBSPPA128_LBSPPB1024_LBSPPM0_LPA8_LPB32_LPM0_LRVWn1_LWPMn1_MIAV0_MIWT5_8_MO40_MGRIPM1_NTn1_NTA0_NTB0_NTC0_NTD4_NTM0_NEPBS16_NLCA1_NLCB1_ONLL1_PGR2_PLR1_PKA1_SGROB0_SIA3_SS0_SU16_SUM0_SUS256_SPO0_SRVW0_SSO0_SVW4_SK0_SKFTR0_SKXCCM0_SGRO0_TDMI0_TIN0_TLDS1_TLDSM1_ULSGRO0_USL1_USLMX0_UIOFGRO0_UPLRP0_USFGROn1_USI0_VSn1_VWA1_VWB8_WSGRA0_WSGRB0_WS64_WG32_8_1_WGM1_WGMXCC1_WGMXCCGn1
    SolutionIndex: 6
    SolutionNameMin: Cijk_Alik_Bljk_F8NSS_BH_Bias_FDMN_SPAML0_A_S_SAV_MT192x160x64_MI16x16x1_SN_LDSB1_AFC1_AG0_AFEM1_AFEM1_ASEM8_CLR0_CADS0_DTLA0_DTLB0_DTVA0_DTVB0_DTVMXSA0_DTVMXSB0_DTVSM0_DPLB0_EPS1_ELFLR0_EMLLn1_FDSI0_GRPM1_GRVWA8_GRVWB4_GSUn1_GSUAMBSK_GSUC1_GSUWGMRR1_GLS0_ISA942_IU1_K1_LDSTI0_LBSPPA128_LBSPPB128_LBSPPM0_LPA8_LPB32_LPM0_LRVWn1_LWPMn1_MIAV0_MIWT3_10_MO40_MGRIPM1_NTn1_NTA0_NTB0_NTC0_NTD4_NTM0_NEPBS16_NLCA1_NLCB1_ONLL1_PGR2_PLR0_PKA1_SGROB0_SIA3_SS0_SU16_SUM0_SUS256_SPO0_SRVW0_SSO0_SVW4_SK0_SKFTR0_SKXCCM0_SGRO0_TDMI0_TIN0_TLDS1_TLDSM1_ULSGRO0_USL1_USLMX0_UIOFGRO0_UPLRP0_USFGROn1_USI0_VSn1_VWA1_VWB2_WSGRA0_WSGRB0_WS64_WG64_4_1_WGM1_WGMXCC1_WGMXCCGn1
    SolutionIndex: 7
    SolutionNameMin: Cijk_Alik_Bljk_F8NSS_BH_Bias_FDMN_SPAML0_A_S_SAV_MT352x160x128_MI16x16x1_SN_LDSB1_AFC1_AG0_AFEM1_AFEM1_ASEM8_CLR1_CADS0_DTLA0_DTLB0_DTVA0_DTVB0_DTVMXSA0_DTVMXSB0_DTVSM0_DPLB0_EPS1_ELFLR0_EMLLn1_FDSI0_GRPM1_GRVWA8_GRVWB16_GSUn1_GSUAMBSK_GSUC1_GSUWGMRR1_GLS0_ISA942_IU1_K1_LDSTI0_LBSPPA128_LBSPPB128_LBSPPM0_LPA8_LPB32_LPM0_LRVWn1_LWPMn1_MIAV0_MIWT11_5_MO40_MGRIPM1_NTn1_NTA0_NTB0_NTC0_NTD4_NTM0_NEPBS16_NLCA1_NLCB1_ONLL1_PGR2_PLR1_PKA1_SGROB0_SIA3_SS0_SU16_SUM0_SUS256_SPO0_SRVW0_SSO0_SVW4_SK0_SKFTR0_SKXCCM0_SGRO0_TDMI0_TIN0_TLDS1_TLDSM1_ULSGRO0_USL1_USLMX0_UIOFGRO0_UPLRP0_USFGROn1_USI0_VSn1_VWA1_VWB1_WSGRA0_WSGRB0_WS64_WG32_8_1_WGM1_WGMXCC1_WGMXCCGn1
    SolutionIndex: 8
    SolutionNameMin: Cijk_Alik_Bljk_F8NSS_BH_Bias_FDMN_SPAML0_A_S_SAV_MT320x128x128_MI16x16x1_SN_LDSB1_AFC1_AG0_AFEM1_AFEM1_ASEM8_CLR1_CADS0_DTLA0_DTLB0_DTVA0_DTVB0_DTVMXSA0_DTVMXSB0_DTVSM0_DPLB0_EPS1_ELFLR0_EMLLn1_FDSI0_GRPM1_GRVWA16_GRVWB16_GSUn1_GSUAMBSK_GSUC1_GSUWGMRR1_GLS0_ISA942_IU1_K1_LDSTI0_LBSPPA128_LBSPPB1024_LBSPPM0_LPA16_LPB32_LPM0_LRVWn1_LWPMn1_MIAV0_MIWT5_8_MO40_MGRIPM1_NTn1_NTA0_NTB0_NTC0_NTD4_NTM0_NEPBS16_NLCA1_NLCB1_ONLL1_PGR2_PLR1_PKA1_SGROB0_SIA3_SS0_SU16_SUM0_SUS256_SPO0_SRVW0_SSO0_SVW4_SK0_SKFTR0_SKXCCM0_SGRO0_TDMI0_TIN0_TLDS1_TLDSM1_ULSGRO0_USL1_USLMX0_UIOFGRO0_UPLRP0_USFGROn1_USI0_VSn1_VWA1_VWB8_WSGRA0_WSGRB0_WS64_WG64_4_1_WGM1_WGMXCC1_WGMXCCGn1
    SolutionIndex: 9
    SolutionNameMin: Cijk_Alik_Bljk_F8NSS_BH_Bias_FDMN_SPAML0_A_S_SAV_MT224x288x128_MI16x16x1_SN_LDSB1_AFC1_AG0_AFEM1_AFEM1_ASEM8_CLR1_CADS0_DTLA0_DTLB0_DTVA0_DTVB0_DTVMXSA0_DTVMXSB0_DTVSM0_DPLB0_EPS1_ELFLR0_EMLLn1_FDSI0_GRPM1_GRVWA8_GRVWB16_GSUn1_GSUAMBSK_GSUC1_GSUWGMRR1_GLS0_ISA942_IU1_K1_LDSTI0_LBSPPA128_LBSPPB128_LBSPPM0_LPA8_LPB32_LPM0_LRVWn1_LWPMn1_MIAV0_MIWT7_9_MO40_MGRIPM1_NTn1_NTA0_NTB0_NTC0_NTD4_NTM0_NEPBS16_NLCA1_NLCB1_ONLL1_PGR2_PLR1_PKA1_SGROB0_SIA3_SS0_SU16_SUM0_SUS256_SPO0_SRVW0_SSO0_SVW4_SK0_SKFTR0_SKXCCM0_SGRO0_TDMI0_TIN0_TLDS1_TLDSM1_ULSGRO0_USL1_USLMX0_UIOFGRO0_UPLRP0_USFGROn1_USI0_VSn1_VWA1_VWB1_WSGRA0_WSGRB0_WS64_WG32_8_1_WGM1_WGMXCC1_WGMXCCGn1
    SolutionIndex: 10
    SolutionNameMin: Cijk_Alik_Bljk_F8NSS_BH_Bias_FDMN_SPAML0_A_S_SAV_MT192x176x128_MI16x16x1_SN_LDSB1_AFC1_AG0_AFEM1_AFEM1_ASEM8_CLR1_CADS0_DTLA0_DTLB0_DTVA0_DTVB0_DTVMXSA0_DTVMXSB0_DTVSM0_DPLB0_EPS1_ELFLR0_EMLLn1_FDSI0_GRPM1_GRVWA16_GRVWB4_GSUn1_GSUAMBSK_GSUC1_GSUWGMRR1_GLS0_ISA942_IU1_K1_LDSTI0_LBSPPA128_LBSPPB128_LBSPPM0_LPA16_LPB32_LPM0_LRVWn1_LWPMn1_MIAV0_MIWT3_11_MO40_MGRIPM1_NTn1_NTA0_NTB0_NTC0_NTD4_NTM0_NEPBS16_NLCA1_NLCB1_ONLL1_PGR2_PLR1_PKA1_SGROB0_SIA3_SS0_SU16_SUM0_SUS256_SPO0_SRVW0_SSO0_SVW4_SK0_SKFTR0_SKXCCM0_SGRO0_TDMI0_TIN0_TLDS1_TLDSM1_ULSGRO0_USL1_USLMX0_UIOFGRO0_UPLRP0_USFGROn1_USI0_VSn1_VWA1_VWB1_WSGRA0_WSGRB0_WS64_WG64_4_1_WGM1_WGMXCC1_WGMXCCGn1
    SolutionIndex: 11
    SolutionNameMin: Cijk_Alik_Bljk_F8NSS_BH_Bias_FDMN_SPAML0_A_S_SAV_MT160x192x128_MI16x16x1_SN_LDSB1_AFC1_AG0_AFEM1_AFEM1_ASEM8_CLR1_CADS0_DTLA0_DTLB0_DTVA0_DTVB0_DTVMXSA0_DTVMXSB0_DTVSM0_DPLB0_EPS1_ELFLR0_EMLLn1_FDSI0_GRPM1_GRVWA8_GRVWB16_GSUn1_GSUAMBSK_GSUC1_GSUWGMRR1_GLS0_ISA942_IU1_K1_LDSTI0_LBSPPA128_LBSPPB256_LBSPPM0_LPA8_LPB32_LPM0_LRVWn1_LWPMn1_MIAV0_MIWT5_6_MO40_MGRIPM1_NTn1_NTA0_NTB0_NTC0_NTD4_NTM0_NEPBS16_NLCA1_NLCB1_ONLL1_PGR2_PLR1_PKA1_SGROB0_SIA3_SS0_SU16_SUM0_SUS256_SPO0_SRVW0_SSO0_SVW4_SK0_SKFTR0_SKXCCM0_SGRO0_TDMI0_TIN0_TLDS1_TLDSM1_ULSGRO0_USL1_USLMX0_UIOFGRO0_UPLRP0_USFGROn1_USI0_VSn1_VWA1_VWB2_WSGRA0_WSGRB0_WS64_WG32_8_1_WGM8_WGMXCC8_WGMXCCGn1
    SolutionIndex: 12
    SolutionNameMin: Cijk_Alik_Bljk_F8NSS_BH_Bias_FDMN_SPAML0_A_S_SAV_MT160x256x128_MI16x16x1_SN_LDSB1_AFC1_AG0_AFEM1_AFEM1_ASEM8_CLR1_CADS0_DTLA0_DTLB0_DTVA0_DTVB0_DTVMXSA0_DTVMXSB0_DTVSM0_DPLB0_EPS1_ELFLR0_EMLLn1_FDSI0_GRPM1_GRVWA8_GRVWB16_GSUn1_GSUAMBSK_GSUC1_GSUWGMRR1_GLS0_ISA942_IU1_K1_LDSTI0_LBSPPA128_LBSPPB1024_LBSPPM0_LPA8_LPB32_LPM0_LRVWn1_LWPMn1_MIAV0_MIWT5_8_MO40_MGRIPM1_NTn1_NTA0_NTB0_NTC0_NTD4_NTM0_NEPBS16_NLCA1_NLCB1_ONLL1_PGR2_PLR1_PKA1_SGROB0_SIA3_SS0_SU16_SUM0_SUS256_SPO0_SRVW0_SSO0_SVW4_SK0_SKFTR0_SKXCCM0_SGRO0_TDMI0_TIN0_TLDS1_TLDSM1_ULSGRO0_USL1_USLMX0_UIOFGRO0_UPLRP0_USFGROn1_USI0_VSn1_VWA1_VWB8_WSGRA0_WSGRB0_WS64_WG32_8_1_WGM8_WGMXCC8_WGMXCCGn1
    SolutionIndex: 13
    SolutionNameMin: Cijk_Alik_Bljk_F8NSS_BH_Bias_FDMN_SPAML0_A_S_SAV_MT288x224x128_MI16x16x1_SN_LDSB1_AFC1_AG0_AFEM1_AFEM1_ASEM8_CLR1_CADS0_DTLA0_DTLB0_DTVA0_DTVB0_DTVMXSA0_DTVMXSB0_DTVSM0_DPLB0_EPS1_ELFLR0_EMLLn1_FDSI0_GRPM1_GRVWA8_GRVWB4_GSUn1_GSUAMBSK_GSUC1_GSUWGMRR1_GLS0_ISA942_IU1_K1_LDSTI0_LBSPPA128_LBSPPB128_LBSPPM0_LPA8_LPB32_LPM0_LRVWn1_LWPMn1_MIAV0_MIWT9_7_MO40_MGRIPM1_NTn1_NTA0_NTB0_NTC0_NTD4_NTM0_NEPBS16_NLCA1_NLCB1_ONLL1_PGR2_PLR1_PKA1_SGROB0_SIA3_SS0_SU16_SUM0_SUS256_SPO0_SRVW0_SSO0_SVW4_SK0_SKFTR0_SKXCCM0_SGRO0_TDMI0_TIN0_TLDS1_TLDSM1_ULSGRO0_USL1_USLMX0_UIOFGRO0_UPLRP0_USFGROn1_USI0_VSn1_VWA1_VWB1_WSGRA0_WSGRB0_WS64_WG32_8_1_WGM8_WGMXCC8_WGMXCCGn1
    SolutionIndex: 14
    SolutionNameMin: Cijk_Alik_Bljk_F8NSS_BH_Bias_FDMN_SPAML0_A_S_SAV_MT288x192x128_MI16x16x1_SN_LDSB1_AFC1_AG0_AFEM1_AFEM1_ASEM8_CLR1_CADS0_DTLA0_DTLB0_DTVA0_DTVB0_DTVMXSA0_DTVMXSB0_DTVSM0_DPLB0_EPS1_ELFLR0_EMLLn1_FDSI0_GRPM1_GRVWA8_GRVWB16_GSUn1_GSUAMBSK_GSUC1_GSUWGMRR1_GLS0_ISA942_IU1_K1_LDSTI0_LBSPPA128_LBSPPB256_LBSPPM0_LPA8_LPB32_LPM0_LRVWn1_LWPMn1_MIAV0_MIWT9_6_MO40_MGRIPM1_NTn1_NTA0_NTB0_NTC0_NTD4_NTM0_NEPBS16_NLCA1_NLCB1_ONLL1_PGR2_PLR1_PKA1_SGROB0_SIA3_SS0_SU16_SUM0_SUS256_SPO0_SRVW0_SSO0_SVW4_SK0_SKFTR0_SKXCCM0_SGRO0_TDMI0_TIN0_TLDS1_TLDSM1_ULSGRO0_USL1_USLMX0_UIOFGRO0_UPLRP0_USFGROn1_USI0_VSn1_VWA1_VWB2_WSGRA0_WSGRB0_WS64_WG32_8_1_WGM8_WGMXCC8_WGMXCCGn1
    SolutionIndex: 15
    SolutionNameMin: Cijk_Alik_Bljk_F8NSS_BH_Bias_FDMN_SPAML0_A_S_SAV_MT192x256x128_MI16x16x1_SN_LDSB1_AFC1_AG0_AFEM1_AFEM1_ASEM8_CLR1_CADS0_DTLA0_DTLB0_DTVA0_DTVB0_DTVMXSA0_DTVMXSB0_DTVSM0_DPLB0_EPS1_ELFLR0_EMLLn1_FDSI0_GRPM1_GRVWA16_GRVWB16_GSUn1_GSUAMBSK_GSUC1_GSUWGMRR1_GLS0_ISA942_IU1_K1_LDSTI0_LBSPPA128_LBSPPB2048_LBSPPM0_LPA16_LPB32_LPM0_LRVWn1_LWPMn1_MIAV0_MIWT3_16_MO40_MGRIPM1_NTn1_NTA0_NTB0_NTC0_NTD4_NTM0_NEPBS16_NLCA1_NLCB1_ONLL1_PGR2_PLR1_PKA1_SGROB0_SIA3_SS0_SU16_SUM0_SUS256_SPO0_SRVW0_SSO0_SVW4_SK0_SKFTR0_SKXCCM0_SGRO0_TDMI0_TIN0_TLDS1_TLDSM1_ULSGRO0_USL1_USLMX0_UIOFGRO0_UPLRP0_USFGROn1_USI0_VSn1_VWA1_VWB16_WSGRA0_WSGRB0_WS64_WG64_4_1_WGM8_WGMXCC8_WGMXCCGn1
    SolutionIndex: 16
    SolutionNameMin: Cijk_Alik_Bljk_F8NSS_BH_Bias_FDMN_SPAML0_A_S_SAV_MT192x176x128_MI16x16x1_SN_LDSB1_AFC1_AG0_AFEM1_AFEM1_ASEM8_CLR1_CADS0_DTLA0_DTLB0_DTVA0_DTVB0_DTVMXSA0_DTVMXSB0_DTVSM0_DPLB0_EPS1_ELFLR0_EMLLn1_FDSI0_GRPM1_GRVWA16_GRVWB4_GSUn1_GSUAMBSK_GSUC1_GSUWGMRR1_GLS0_ISA942_IU1_K1_LDSTI0_LBSPPA128_LBSPPB128_LBSPPM0_LPA16_LPB32_LPM0_LRVWn1_LWPMn1_MIAV0_MIWT3_11_MO40_MGRIPM1_NTn1_NTA0_NTB0_NTC0_NTD4_NTM0_NEPBS16_NLCA1_NLCB1_ONLL1_PGR2_PLR1_PKA1_SGROB0_SIA3_SS0_SU16_SUM0_SUS256_SPO0_SRVW0_SSO0_SVW4_SK0_SKFTR0_SKXCCM0_SGRO0_TDMI0_TIN0_TLDS1_TLDSM1_ULSGRO0_USL1_USLMX0_UIOFGRO0_UPLRP0_USFGROn1_USI0_VSn1_VWA1_VWB1_WSGRA0_WSGRB0_WS64_WG64_4_1_WGM8_WGMXCC8_WGMXCCGn1
    SolutionIndex: 17
    SolutionNameMin: Cijk_Alik_Bljk_F8NSS_BH_Bias_FDMN_SPAML0_A_S_SAV_MT160x224x128_MI16x16x1_SN_LDSB1_AFC1_AG0_AFEM1_AFEM1_ASEM8_CLR1_CADS0_DTLA0_DTLB0_DTVA0_DTVB0_DTVMXSA0_DTVMXSB0_DTVSM0_DPLB0_EPS1_ELFLR0_EMLLn1_FDSI0_GRPM1_GRVWA8_GRVWB16_GSUn1_GSUAMBSK_GSUC1_GSUWGMRR1_GLS0_ISA942_IU1_K1_LDSTI0_LBSPPA128_LBSPPB128_LBSPPM0_LPA8_LPB32_LPM0_LRVWn1_LWPMn1_MIAV0_MIWT5_7_MO40_MGRIPM1_NTn1_NTA0_NTB0_NTC0_NTD4_NTM0_NEPBS16_NLCA1_NLCB1_ONLL1_PGR2_PLR1_PKA1_SGROB0_SIA3_SS0_SU16_SUM0_SUS256_SPO0_SRVW0_SSO0_SVW4_SK0_SKFTR0_SKXCCM0_SGRO0_TDMI0_TIN0_TLDS1_TLDSM1_ULSGRO0_USL1_USLMX0_UIOFGRO0_UPLRP0_USFGROn1_USI0_VSn1_VWA1_VWB1_WSGRA0_WSGRB0_WS64_WG32_8_1_WGM8_WGMXCC8_WGMXCCGn1
    SolutionIndex: 18
    SolutionNameMin: Cijk_Alik_Bljk_F8NSS_BH_Bias_FDMN_SPAML0_A_S_SAV_MT224x224x128_MI16x16x1_SN_LDSB1_AFC1_AG0_AFEM1_AFEM1_ASEM8_CLR1_CADS0_DTLA0_DTLB0_DTVA0_DTVB0_DTVMXSA0_DTVMXSB0_DTVSM0_DPLB0_EPS1_ELFLR0_EMLLn1_FDSI0_GRPM1_GRVWA8_GRVWB16_GSUn1_GSUAMBSK_GSUC1_GSUWGMRR1_GLS0_ISA942_IU1_K1_LDSTI0_LBSPPA128_LBSPPB128_LBSPPM0_LPA8_LPB32_LPM0_LRVWn1_LWPMn1_MIAV0_MIWT7_7_MO40_MGRIPM1_NTn1_NTA0_NTB0_NTC0_NTD4_NTM0_NEPBS16_NLCA1_NLCB1_ONLL1_PGR2_PLR1_PKA1_SGROB0_SIA3_SS0_SU16_SUM0_SUS256_SPO0_SRVW0_SSO0_SVW4_SK0_SKFTR0_SKXCCM0_SGRO0_TDMI0_TIN0_TLDS1_TLDSM1_ULSGRO0_USL1_USLMX0_UIOFGRO0_UPLRP0_USFGROn1_USI0_VSn1_VWA1_VWB1_WSGRA0_WSGRB0_WS64_WG32_8_1_WGM1_WGMXCC1_WGMXCCGn1
    SolutionIndex: 19
    SolutionNameMin: Cijk_Alik_Bljk_F8NSS_BH_Bias_FDMN_SPAML0_A_S_SAV_MT80x128x256_MI16x16x1_SN_LDSB1_AFC1_AG0_AFEM1_AFEM1_ASEM8_CLR1_CADS0_DTLA0_DTLB0_DTVA0_DTVB0_DTVMXSA0_DTVMXSB0_DTVSM0_DPLB0_EPS1_ELFLR0_EMLLn1_FDSI0_GRPM1_GRVWA8_GRVWB16_GSUn1_GSUAMBSK_GSUC1_GSUWGMRR1_GLS0_ISA942_IU1_K1_LDSTI0_LBSPPA128_LBSPPB512_LBSPPM0_LPA8_LPB32_LPM0_LRVWn1_LWPMn1_MIAV0_MIWT5_2_MO40_MGRIPM1_NTn1_NTA0_NTB0_NTC0_NTD4_NTM0_NEPBS16_NLCA1_NLCB1_ONLL1_PGR2_PLR1_PKA1_SGROB0_SIA3_SS0_SU16_SUM0_SUS256_SPO0_SRVW0_SSO0_SVW4_SK0_SKFTR0_SKXCCM0_SGRO0_TDMI0_TIN0_TLDS1_TLDSM1_ULSGRO0_USL1_USLMX0_UIOFGRO0_UPLRP0_USFGROn1_USI0_VSn1_VWA1_VWB2_WSGRA0_WSGRB0_WS64_WG16_16_1_WGM8_WGMXCC8_WGMXCCGn1
    SolutionIndex: 20
    SolutionNameMin: Cijk_Alik_Bljk_F8NSS_BH_Bias_FDMN_SPAML0_A_S_SAV_MT416x96x128_MI16x16x1_SN_LDSB1_AFC1_AG0_AFEM1_AFEM1_ASEM8_CLR1_CADS0_DTLA0_DTLB0_DTVA0_DTVB0_DTVMXSA0_DTVMXSB0_DTVSM0_DPLB0_EPS1_ELFLR0_EMLLn1_FDSI0_GRPM1_GRVWA8_GRVWB16_GSUn1_GSUAMBSK_GSUC1_GSUWGMRR1_GLS0_ISA942_IU1_K1_LDSTI0_LBSPPA128_LBSPPB128_LBSPPM0_LPA8_LPB32_LPM0_LRVWn1_LWPMn1_MIAV0_MIWT13_3_MO40_MGRIPM1_NTn1_NTA0_NTB0_NTC0_NTD4_NTM0_NEPBS16_NLCA1_NLCB1_ONLL1_PGR2_PLR1_PKA1_SGROB0_SIA3_SS0_SU16_SUM0_SUS256_SPO0_SRVW0_SSO0_SVW4_SK0_SKFTR0_SKXCCM0_SGRO0_TDMI0_TIN0_TLDS1_TLDSM1_ULSGRO0_USL1_USLMX0_UIOFGRO0_UPLRP0_USFGROn1_USI0_VSn1_VWA1_VWB1_WSGRA0_WSGRB0_WS64_WG32_8_1_WGM1_WGMXCC1_WGMXCCGn1
    SolutionIndex: 21
    SolutionNameMin: Cijk_Alik_Bljk_F8NSS_BH_Bias_FDMN_SPAML0_A_S_SAV_MT192x96x128_MI16x16x1_SN_LDSB1_AFC1_AG0_AFEM1_AFEM1_ASEM8_CLR1_CADS0_DTLA0_DTLB0_DTVA0_DTVB0_DTVMXSA0_DTVMXSB0_DTVSM0_DPLB0_EPS1_ELFLR0_EMLLn1_FDSI0_GRPM1_GRVWA16_GRVWB16_GSUn1_GSUAMBSK_GSUC1_GSUWGMRR1_GLS0_ISA942_IU1_K1_LDSTI0_LBSPPA128_LBSPPB256_LBSPPM0_LPA16_LPB32_LPM0_LRVWn1_LWPMn1_MIAV0_MIWT3_6_MO40_MGRIPM1_NTn1_NTA0_NTB0_NTC0_NTD4_NTM0_NEPBS16_NLCA1_NLCB1_ONLL1_PGR2_PLR1_PKA1_SGROB0_SIA3_SS0_SU16_SUM0_SUS256_SPO0_SRVW0_SSO0_SVW4_SK0_SKFTR0_SKXCCM0_SGRO0_TDMI0_TIN0_TLDS1_TLDSM1_ULSGRO0_USL1_USLMX0_UIOFGRO0_UPLRP0_USFGROn1_USI0_VSn1_VWA1_VWB2_WSGRA0_WSGRB0_WS64_WG64_4_1_WGM8_WGMXCC8_WGMXCCGn1
    SolutionIndex: 22
    SolutionNameMin: Cijk_Alik_Bljk_F8NSS_BH_Bias_FDMN_SPAML0_A_S_SAV_MT224x192x128_MI16x16x1_SN_LDSB1_AFC1_AG0_AFEM1_AFEM1_ASEM8_CLR1_CADS0_DTLA0_DTLB0_DTVA0_DTVB0_DTVMXSA0_DTVMXSB0_DTVSM0_DPLB0_EPS1_ELFLR0_EMLLn1_FDSI0_GRPM1_GRVWA8_GRVWB16_GSUn1_GSUAMBSK_GSUC1_GSUWGMRR1_GLS0_ISA942_IU1_K1_LDSTI0_LBSPPA128_LBSPPB256_LBSPPM0_LPA8_LPB32_LPM0_LRVWn1_LWPMn1_MIAV0_MIWT7_6_MO40_MGRIPM1_NTn1_NTA0_NTB0_NTC0_NTD4_NTM0_NEPBS16_NLCA1_NLCB1_ONLL1_PGR2_PLR1_PKA1_SGROB0_SIA3_SS0_SU16_SUM0_SUS256_SPO0_SRVW0_SSO0_SVW4_SK0_SKFTR0_SKXCCM0_SGRO0_TDMI0_TIN0_TLDS1_TLDSM1_ULSGRO0_USL1_USLMX0_UIOFGRO0_UPLRP0_USFGROn1_USI0_VSn1_VWA1_VWB2_WSGRA0_WSGRB0_WS64_WG32_8_1_WGM1_WGMXCC1_WGMXCCGn1
    SolutionIndex: 23
    SolutionNameMin: Cijk_Alik_Bljk_F8NSS_BH_Bias_FDMN_SPAML0_A_S_SAV_MT16x16x256_MI16x16x1_SN_LDSB0_AFC1_AG0_AFEM1_AFEM1_ASEM8_CLR1_CADS0_DTLA0_DTLB0_DTVA0_DTVB0_DTVMXSA0_DTVMXSB0_DTVSM0_DPLB0_EPS1_ELFLR0_EMLLn1_FDSI0_GRPM1_GRVWA8_GRVWB16_GSUn1_GSUAMBSK_GSUC1_GSUWGMRR1_GLS0_ISA942_IU1_K1_LDSTI0_LBSPPA128_LBSPPB256_LBSPPM0_LPA8_LPB32_LPM0_LRVWn1_LWPMn1_MIAV0_MIWT1_1_MO40_MGRIPM1_NTn1_NTA0_NTB0_NTC0_NTD4_NTM0_NEPBS16_NLCA1_NLCB1_ONLL1_PGR2_PLR1_PKA1_SGROB0_SIA3_SS0_SU16_SUM0_SUS256_SPO0_SRVW0_SSO0_SVW4_SK0_SKFTR0_SKXCCM0_SGRO0_TDMI0_TIN0_TLDS1_TLDSM1_ULSGRO0_USL1_USLMX0_UIOFGRO0_UPLRP0_USFGROn1_USI0_VSn1_VWA1_VWB1_WSGRA0_WSGRB0_WS64_WG16_4_1_WGM1_WGMXCC1_WGMXCCGn1
    SolutionIndex: 24
    SolutionNameMin: Cijk_Alik_Bljk_F8NSS_BH_Bias_FDMN_SPAML0_A_S_SAV_MT192x288x128_MI16x16x1_SN_LDSB1_AFC1_AG0_AFEM1_AFEM1_ASEM8_CLR1_CADS0_DTLA0_DTLB0_DTVA0_DTVB0_DTVMXSA0_DTVMXSB0_DTVSM0_DPLB0_EPS1_ELFLR0_EMLLn1_FDSI0_GRPM1_GRVWA16_GRVWB16_GSUn1_GSUAMBSK_GSUC1_GSUWGMRR1_GLS0_ISA942_IU1_K1_LDSTI0_LBSPPA128_LBSPPB256_LBSPPM0_LPA16_LPB32_LPM0_LRVWn1_LWPMn1_MIAV0_MIWT3_18_MO40_MGRIPM1_NTn1_NTA0_NTB0_NTC0_NTD4_NTM0_NEPBS16_NLCA1_NLCB1_ONLL1_PGR2_PLR1_PKA1_SGROB0_SIA3_SS0_SU16_SUM0_SUS256_SPO0_SRVW0_SSO0_SVW4_SK0_SKFTR0_SKXCCM0_SGRO0_TDMI0_TIN0_TLDS1_TLDSM1_ULSGRO0_USL1_USLMX0_UIOFGRO0_UPLRP0_USFGROn1_USI0_VSn1_VWA1_VWB2_WSGRA0_WSGRB0_WS64_WG64_4_1_WGM1_WGMXCC1_WGMXCCGn1
    SolutionIndex: 25
    SolutionNameMin: Cijk_Alik_Bljk_F8NSS_BH_Bias_FDMN_SPAML0_A_S_SAV_MT320x192x128_MI16x16x1_SN_LDSB1_AFC1_AG0_AFEM1_AFEM1_ASEM8_CLR1_CADS0_DTLA0_DTLB0_DTVA0_DTVB0_DTVMXSA0_DTVMXSB0_DTVSM0_DPLB0_EPS1_ELFLR0_EMLLn1_FDSI0_GRPM1_GRVWA8_GRVWB16_GSUn1_GSUAMBSK_GSUC1_GSUWGMRR1_GLS0_ISA942_IU1_K1_LDSTI0_LBSPPA128_LBSPPB512_LBSPPM0_LPA8_LPB32_LPM0_LRVWn1_LWPMn1_MIAV0_MIWT5_12_MO40_MGRIPM1_NTn1_NTA0_NTB0_NTC0_NTD4_NTM0_NEPBS16_NLCA1_NLCB1_ONLL1_PGR2_PLR1_PKA1_SGROB0_SIA3_SS0_SU16_SUM0_SUS256_SPO0_SRVW0_SSO0_SVW4_SK0_SKFTR0_SKXCCM0_SGRO0_TDMI0_TIN0_TLDS1_TLDSM1_ULSGRO0_USL1_USLMX0_UIOFGRO0_UPLRP0_USFGROn1_USI0_VSn1_VWA1_VWB4_WSGRA0_WSGRB0_WS64_WG64_4_1_WGM8_WGMXCC8_WGMXCCGn1
    SolutionIndex: 26
    SolutionNameMin: Cijk_Alik_Bljk_F8NSS_BH_Bias_FDMN_SPAML0_A_S_SAV_MT288x224x128_MI16x16x1_SN_LDSB1_AFC1_AG0_AFEM1_AFEM1_ASEM8_CLR1_CADS0_DTLA0_DTLB0_DTVA0_DTVB0_DTVMXSA0_DTVMXSB0_DTVSM0_DPLB0_EPS1_ELFLR0_EMLLn1_FDSI0_GRPM1_GRVWA8_GRVWB16_GSUn1_GSUAMBSK_GSUC1_GSUWGMRR1_GLS0_ISA942_IU1_K1_LDSTI0_LBSPPA128_LBSPPB128_LBSPPM0_LPA8_LPB32_LPM0_LRVWn1_LWPMn1_MIAV0_MIWT9_7_MO40_MGRIPM1_NTn1_NTA0_NTB0_NTC0_NTD4_NTM0_NEPBS16_NLCA1_NLCB1_ONLL1_PGR2_PLR1_PKA1_SGROB0_SIA3_SS0_SU16_SUM0_SUS256_SPO0_SRVW0_SSO0_SVW4_SK0_SKFTR0_SKXCCM0_SGRO0_TDMI0_TIN0_TLDS1_TLDSM1_ULSGRO0_USL1_USLMX0_UIOFGRO0_UPLRP0_USFGROn1_USI0_VSn1_VWA1_VWB1_WSGRA0_WSGRB0_WS64_WG32_8_1_WGM8_WGMXCC8_WGMXCCGn1
    SolutionIndex: 27
    SolutionNameMin: Cijk_Alik_Bljk_F8NSS_BH_Bias_FDMN_SPAML0_A_S_SAV_MT224x256x128_MI16x16x1_SN_LDSB1_AFC1_AG0_AFEM1_AFEM1_ASEM8_CLR1_CADS0_DTLA0_DTLB0_DTVA0_DTVB0_DTVMXSA0_DTVMXSB0_DTVSM0_DPLB0_EPS1_ELFLR0_EMLLn1_FDSI0_GRPM1_GRVWA8_GRVWB16_GSUn1_GSUAMBSK_GSUC1_GSUWGMRR1_GLS0_ISA942_IU1_K1_LDSTI0_LBSPPA128_LBSPPB1024_LBSPPM0_LPA8_LPB32_LPM0_LRVWn1_LWPMn1_MIAV0_MIWT7_8_MO40_MGRIPM1_NTn1_NTA0_NTB0_NTC0_NTD4_NTM0_NEPBS16_NLCA1_NLCB1_ONLL1_PGR2_PLR1_PKA1_SGROB0_SIA3_SS0_SU16_SUM0_SUS256_SPO0_SRVW0_SSO0_SVW4_SK0_SKFTR0_SKXCCM0_SGRO0_TDMI0_TIN0_TLDS1_TLDSM1_ULSGRO0_USL1_USLMX0_UIOFGRO0_UPLRP0_USFGROn1_USI0_VSn1_VWA1_VWB8_WSGRA0_WSGRB0_WS64_WG32_8_1_WGM8_WGMXCC8_WGMXCCGn1
    SolutionIndex: 28
    SolutionNameMin: Cijk_Alik_Bljk_F8NSS_BH_Bias_FDMN_SPAML0_A_S_SAV_MT192x208x128_MI16x16x1_SN_LDSB1_AFC1_AG0_AFEM1_AFEM1_ASEM8_CLR1_CADS0_DTLA0_DTLB0_DTVA0_DTVB0_DTVMXSA0_DTVMXSB0_DTVSM0_DPLB0_EPS1_ELFLR0_EMLLn1_FDSI0_GRPM1_GRVWA16_GRVWB4_GSUn1_GSUAMBSK_GSUC1_GSUWGMRR1_GLS0_ISA942_IU1_K1_LDSTI0_LBSPPA128_LBSPPB128_LBSPPM0_LPA16_LPB32_LPM0_LRVWn1_LWPMn1_MIAV0_MIWT3_13_MO40_MGRIPM1_NTn1_NTA0_NTB0_NTC0_NTD4_NTM0_NEPBS16_NLCA1_NLCB1_ONLL1_PGR2_PLR1_PKA1_SGROB0_SIA3_SS0_SU16_SUM0_SUS256_SPO0_SRVW0_SSO0_SVW4_SK0_SKFTR0_SKXCCM0_SGRO0_TDMI0_TIN0_TLDS1_TLDSM1_ULSGRO0_USL1_USLMX0_UIOFGRO0_UPLRP0_USFGROn1_USI0_VSn1_VWA1_VWB1_WSGRA0_WSGRB0_WS64_WG64_4_1_WGM8_WGMXCC8_WGMXCCGn1
    SolutionIndex: 29
    SolutionNameMin: Cijk_Alik_Bljk_F8NSS_BH_Bias_FDMN_SPAML0_A_S_SAV_MT288x224x128_MI16x16x1_SN_LDSB1_AFC1_AG0_AFEM1_AFEM1_ASEM8_CLR1_CADS0_DTLA0_DTLB0_DTVA0_DTVB0_DTVMXSA0_DTVMXSB0_DTVSM0_DPLB0_EPS1_ELFLR0_EMLLn1_FDSI0_GRPM1_GRVWA8_GRVWB16_GSUn1_GSUAMBSK_GSUC1_GSUWGMRR1_GLS0_ISA942_IU1_K1_LDSTI0_LBSPPA128_LBSPPB128_LBSPPM0_LPA8_LPB32_LPM0_LRVWn1_LWPMn1_MIAV0_MIWT9_7_MO40_MGRIPM1_NTn1_NTA0_NTB0_NTC0_NTD4_NTM0_NEPBS16_NLCA1_NLCB1_ONLL1_PGR2_PLR1_PKA1_SGROB0_SIA3_SS0_SU16_SUM0_SUS256_SPO0_SRVW0_SSO0_SVW4_SK0_SKFTR0_SKXCCM0_SGRO0_TDMI0_TIN0_TLDS1_TLDSM1_ULSGRO0_USL1_USLMX0_UIOFGRO0_UPLRP0_USFGROn1_USI0_VSn1_VWA1_VWB1_WSGRA0_WSGRB0_WS64_WG32_8_1_WGM1_WGMXCC1_WGMXCCGn1
    SolutionIndex: 30
    SolutionNameMin: Cijk_Alik_Bljk_F8NSS_BH_Bias_FDMN_SPAML0_A_S_SAV_MT224x288x128_MI16x16x1_SN_LDSB1_AFC1_AG0_AFEM1_AFEM1_ASEM8_CLR1_CADS0_DTLA0_DTLB0_DTVA0_DTVB0_DTVMXSA0_DTVMXSB0_DTVSM0_DPLB0_EPS1_ELFLR0_EMLLn1_FDSI0_GRPM1_GRVWA8_GRVWB16_GSUn1_GSUAMBSK_GSUC1_GSUWGMRR1_GLS0_ISA942_IU1_K1_LDSTI0_LBSPPA128_LBSPPB128_LBSPPM0_LPA8_LPB32_LPM0_LRVWn1_LWPMn1_MIAV0_MIWT7_9_MO40_MGRIPM1_NTn1_NTA0_NTB0_NTC0_NTD4_NTM0_NEPBS16_NLCA1_NLCB1_ONLL1_PGR2_PLR1_PKA1_SGROB0_SIA3_SS0_SU16_SUM0_SUS256_SPO0_SRVW0_SSO0_SVW4_SK0_SKFTR0_SKXCCM0_SGRO0_TDMI0_TIN0_TLDS1_TLDSM1_ULSGRO0_USL1_USLMX0_UIOFGRO0_UPLRP0_USFGROn1_USI0_VSn1_VWA1_VWB1_WSGRA0_WSGRB0_WS64_WG32_8_1_WGM8_WGMXCC8_WGMXCCGn1
    SolutionIndex: 31
    SolutionNameMin: Cijk_Alik_Bljk_F8NSS_BH_Bias_FDMN_SPAML0_A_S_SAV_MT224x224x128_MI16x16x1_SN_LDSB1_AFC1_AG0_AFEM1_AFEM1_ASEM8_CLR1_CADS0_DTLA0_DTLB0_DTVA0_DTVB0_DTVMXSA0_DTVMXSB0_DTVSM0_DPLB0_EPS1_ELFLR0_EMLLn1_FDSI0_GRPM1_GRVWA8_GRVWB16_GSUn1_GSUAMBSK_GSUC1_GSUWGMRR1_GLS0_ISA942_IU1_K1_LDSTI0_LBSPPA128_LBSPPB128_LBSPPM0_LPA8_LPB32_LPM0_LRVWn1_LWPMn1_MIAV0_MIWT7_7_MO40_MGRIPM1_NTn1_NTA0_NTB0_NTC0_NTD4_NTM0_NEPBS16_NLCA1_NLCB1_ONLL1_PGR2_PLR1_PKA1_SGROB0_SIA3_SS0_SU16_SUM0_SUS256_SPO0_SRVW0_SSO0_SVW4_SK0_SKFTR0_SKXCCM0_SGRO0_TDMI0_TIN0_TLDS1_TLDSM1_ULSGRO0_USL1_USLMX0_UIOFGRO0_UPLRP0_USFGROn1_USI0_VSn1_VWA1_VWB1_WSGRA0_WSGRB0_WS64_WG32_8_1_WGM8_WGMXCC8_WGMXCCGn1
    SolutionIndex: 32
    SolutionNameMin: Cijk_Alik_Bljk_F8NSS_BH_Bias_FDMN_SPAML0_A_S_SAV_MT192x320x128_MI16x16x1_SN_LDSB1_AFC1_AG0_AFEM1_AFEM1_ASEM8_CLR1_CADS0_DTLA0_DTLB0_DTVA0_DTVB0_DTVMXSA0_DTVMXSB0_DTVSM0_DPLB0_EPS1_ELFLR0_EMLLn1_FDSI0_GRPM1_GRVWA16_GRVWB16_GSUn1_GSUAMBSK_GSUC1_GSUWGMRR1_GLS0_ISA942_IU1_K1_LDSTI0_LBSPPA128_LBSPPB512_LBSPPM0_LPA16_LPB32_LPM0_LRVWn1_LWPMn1_MIAV0_MIWT3_20_MO40_MGRIPM1_NTn1_NTA0_NTB0_NTC0_NTD4_NTM0_NEPBS16_NLCA1_NLCB1_ONLL1_PGR2_PLR1_PKA1_SGROB0_SIA3_SS0_SU16_SUM0_SUS256_SPO0_SRVW0_SSO0_SVW4_SK0_SKFTR0_SKXCCM0_SGRO0_TDMI0_TIN0_TLDS1_TLDSM1_ULSGRO0_USL1_USLMX0_UIOFGRO0_UPLRP0_USFGROn1_USI0_VSn1_VWA1_VWB4_WSGRA0_WSGRB0_WS64_WG64_4_1_WGM8_WGMXCC8_WGMXCCGn1
    SolutionIndex: 33
    SolutionNameMin: Cijk_Alik_Bljk_F8NSS_BH_Bias_FDMN_SPAML0_A_S_SAV_MT192x224x128_MI16x16x1_SN_LDSB1_AFC1_AG0_AFEM1_AFEM1_ASEM8_CLR1_CADS0_DTLA0_DTLB0_DTVA0_DTVB0_DTVMXSA0_DTVMXSB0_DTVSM0_DPLB0_EPS1_ELFLR0_EMLLn1_FDSI0_GRPM1_GRVWA8_GRVWB16_GSUn1_GSUAMBSK_GSUC1_GSUWGMRR1_GLS0_ISA942_IU1_K1_LDSTI0_LBSPPA128_LBSPPB256_LBSPPM0_LPA8_LPB32_LPM0_LRVWn1_LWPMn1_MIAV0_MIWT3_14_MO40_MGRIPM1_NTn1_NTA0_NTB0_NTC0_NTD4_NTM0_NEPBS16_NLCA1_NLCB1_ONLL1_PGR2_PLR1_PKA1_SGROB0_SIA3_SS0_SU16_SUM0_SUS256_SPO0_SRVW0_SSO0_SVW4_SK0_SKFTR0_SKXCCM0_SGRO0_TDMI0_TIN0_TLDS1_TLDSM1_ULSGRO0_USL1_USLMX0_UIOFGRO0_UPLRP0_USFGROn1_USI0_VSn1_VWA1_VWB2_WSGRA0_WSGRB0_WS64_WG64_4_1_WGM8_WGMXCC8_WGMXCCGn1
    SolutionIndex: 34
    SolutionNameMin: Cijk_Alik_Bljk_F8NSS_BH_Bias_FDMN_SPAML0_A_S_SAV_MT192x256x128_MI16x16x1_SN_LDSB1_AFC1_AG0_AFEM1_AFEM1_ASEM8_CLR1_CADS0_DTLA0_DTLB0_DTVA0_DTVB0_DTVMXSA0_DTVMXSB0_DTVSM0_DPLB0_EPS1_ELFLR0_EMLLn1_FDSI0_GRPM1_GRVWA8_GRVWB16_GSUn1_GSUAMBSK_GSUC1_GSUWGMRR1_GLS0_ISA942_IU1_K1_LDSTI0_LBSPPA128_LBSPPB2048_LBSPPM0_LPA8_LPB32_LPM0_LRVWn1_LWPMn1_MIAV0_MIWT3_16_MO40_MGRIPM1_NTn1_NTA0_NTB0_NTC0_NTD4_NTM0_NEPBS16_NLCA1_NLCB1_ONLL1_PGR2_PLR1_PKA1_SGROB0_SIA3_SS0_SU16_SUM0_SUS256_SPO0_SRVW0_SSO0_SVW4_SK0_SKFTR0_SKXCCM0_SGRO0_TDMI0_TIN0_TLDS1_TLDSM1_ULSGRO0_USL1_USLMX0_UIOFGRO0_UPLRP0_USFGROn1_USI0_VSn1_VWA1_VWB16_WSGRA0_WSGRB0_WS64_WG64_4_1_WGM8_WGMXCC8_WGMXCCGn1
    SolutionIndex: 35
    SolutionNameMin: Cijk_Alik_Bljk_F8NSS_BH_Bias_FDMN_SPAML0_A_S_SAV_MT256x224x128_MI16x16x1_SN_LDSB1_AFC1_AG0_AFEM1_AFEM1_ASEM8_CLR1_CADS0_DTLA0_DTLB0_DTVA0_DTVB0_DTVMXSA0_DTVMXSB0_DTVSM0_DPLB0_EPS1_ELFLR0_EMLLn1_FDSI0_GRPM1_GRVWA8_GRVWB16_GSUn1_GSUAMBSK_GSUC1_GSUWGMRR1_GLS0_ISA942_IU1_K1_LDSTI0_LBSPPA128_LBSPPB256_LBSPPM0_LPA8_LPB32_LPM0_LRVWn1_LWPMn1_MIAV0_MIWT4_14_MO40_MGRIPM1_NTn1_NTA0_NTB0_NTC0_NTD4_NTM0_NEPBS16_NLCA1_NLCB1_ONLL1_PGR2_PLR1_PKA1_SGROB0_SIA3_SS0_SU16_SUM0_SUS256_SPO0_SRVW0_SSO0_SVW4_SK0_SKFTR0_SKXCCM0_SGRO0_TDMI0_TIN0_TLDS1_TLDSM1_ULSGRO0_USL1_USLMX0_UIOFGRO0_UPLRP0_USFGROn1_USI0_VSn1_VWA2_VWB2_WSGRA0_WSGRB0_WS64_WG64_4_1_WGM8_WGMXCC8_WGMXCCGn1
    SolutionIndex: 36
    SolutionNameMin: Cijk_Alik_Bljk_F8NSS_BH_Bias_FDMN_SPAML0_A_S_SAV_MT192x320x128_MI16x16x1_SN_LDSB1_AFC1_AG0_AFEM1_AFEM1_ASEM8_CLR1_CADS0_DTLA0_DTLB0_DTVA0_DTVB0_DTVMXSA0_DTVMXSB0_DTVSM0_DPLB0_EPS1_ELFLR0_EMLLn1_FDSI0_GRPM1_GRVWA16_GRVWB16_GSUn1_GSUAMBSK_GSUC1_GSUWGMRR1_GLS0_ISA942_IU1_K1_LDSTI0_LBSPPA128_LBSPPB512_LBSPPM0_LPA16_LPB32_LPM0_LRVWn1_LWPMn1_MIAV0_MIWT3_20_MO40_MGRIPM1_NTn1_NTA0_NTB0_NTC0_NTD4_NTM0_NEPBS16_NLCA1_NLCB1_ONLL1_PGR2_PLR1_PKA1_SGROB0_SIA3_SS0_SU16_SUM0_SUS256_SPO0_SRVW0_SSO0_SVW4_SK0_SKFTR0_SKXCCM0_SGRO0_TDMI0_TIN0_TLDS1_TLDSM1_ULSGRO0_USL1_USLMX0_UIOFGRO0_UPLRP0_USFGROn1_USI0_VSn1_VWA1_VWB4_WSGRA0_WSGRB0_WS64_WG64_4_1_WGM1_WGMXCC1_WGMXCCGn1
    SolutionIndex: 37
    SolutionNameMin: Cijk_Alik_Bljk_F8NSS_BH_Bias_FDMN_SPAML0_A_S_SAV_MT192x240x128_MI16x16x1_SN_LDSB1_AFC1_AG0_AFEM1_AFEM1_ASEM8_CLR1_CADS0_DTLA0_DTLB0_DTVA0_DTVB0_DTVMXSA0_DTVMXSB0_DTVSM0_DPLB0_EPS1_ELFLR0_EMLLn1_FDSI0_GRPM1_GRVWA16_GRVWB4_GSUn1_GSUAMBSK_GSUC1_GSUWGMRR1_GLS0_ISA942_IU1_K1_LDSTI0_LBSPPA128_LBSPPB128_LBSPPM0_LPA16_LPB32_LPM0_LRVWn1_LWPMn1_MIAV0_MIWT3_15_MO40_MGRIPM1_NTn1_NTA0_NTB0_NTC0_NTD4_NTM0_NEPBS16_NLCA1_NLCB1_ONLL1_PGR2_PLR1_PKA1_SGROB0_SIA3_SS0_SU16_SUM0_SUS256_SPO0_SRVW0_SSO0_SVW4_SK0_SKFTR0_SKXCCM0_SGRO0_TDMI0_TIN0_TLDS1_TLDSM1_ULSGRO0_USL1_USLMX0_UIOFGRO0_UPLRP0_USFGROn1_USI0_VSn1_VWA1_VWB1_WSGRA0_WSGRB0_WS64_WG64_4_1_WGM8_WGMXCC8_WGMXCCGn1
    SolutionIndex: 38
    SolutionNameMin: Cijk_Alik_Bljk_F8NSS_BH_Bias_FDMN_SPAML0_A_S_SAV_MT160x128x128_MI16x16x1_SN_LDSB1_AFC1_AG0_AFEM1_AFEM1_ASEM8_CLR1_CADS0_DTLA0_DTLB0_DTVA0_DTVB0_DTVMXSA0_DTVMXSB0_DTVSM0_DPLB0_EPS1_ELFLR0_EMLLn1_FDSI0_GRPM1_GRVWA8_GRVWB16_GSUn1_GSUAMBSK_GSUC1_GSUWGMRR1_GLS0_ISA942_IU1_K1_LDSTI0_LBSPPA128_LBSPPB512_LBSPPM0_LPA8_LPB32_LPM0_LRVWn1_LWPMn1_MIAV0_MIWT5_4_MO40_MGRIPM1_NTn1_NTA0_NTB0_NTC0_NTD4_NTM0_NEPBS16_NLCA1_NLCB1_ONLL1_PGR2_PLR1_PKA1_SGROB0_SIA3_SS0_SU16_SUM0_SUS256_SPO0_SRVW0_SSO0_SVW4_SK0_SKFTR0_SKXCCM0_SGRO0_TDMI0_TIN0_TLDS1_TLDSM1_ULSGRO0_USL1_USLMX0_UIOFGRO0_UPLRP0_USFGROn1_USI0_VSn1_VWA1_VWB4_WSGRA0_WSGRB0_WS64_WG32_8_1_WGM8_WGMXCC8_WGMXCCGn1
    SolutionIndex: 39
    SolutionNameMin: Cijk_Alik_Bljk_F8NSS_BH_Bias_FDMN_SPAML0_A_S_SAV_MT192x224x128_MI16x16x1_SN_LDSB1_AFC1_AG0_AFEM1_AFEM1_ASEM8_CLR1_CADS0_DTLA0_DTLB0_DTVA0_DTVB0_DTVMXSA0_DTVMXSB0_DTVSM0_DPLB0_EPS1_ELFLR0_EMLLn1_FDSI0_GRPM1_GRVWA16_GRVWB16_GSUn1_GSUAMBSK_GSUC1_GSUWGMRR1_GLS0_ISA942_IU1_K1_LDSTI0_LBSPPA128_LBSPPB256_LBSPPM0_LPA16_LPB32_LPM0_LRVWn1_LWPMn1_MIAV0_MIWT3_14_MO40_MGRIPM1_NTn1_NTA0_NTB0_NTC0_NTD4_NTM0_NEPBS16_NLCA1_NLCB1_ONLL1_PGR2_PLR1_PKA1_SGROB0_SIA3_SS0_SU16_SUM0_SUS256_SPO0_SRVW0_SSO0_SVW4_SK0_SKFTR0_SKXCCM0_SGRO0_TDMI0_TIN0_TLDS1_TLDSM1_ULSGRO0_USL1_USLMX0_UIOFGRO0_UPLRP0_USFGROn1_USI0_VSn1_VWA1_VWB2_WSGRA0_WSGRB0_WS64_WG64_4_1_WGM1_WGMXCC1_WGMXCCGn1
    SolutionIndex: 40
    SolutionNameMin: Cijk_Alik_Bljk_F8NSS_BH_Bias_FDMN_SPAML0_A_S_SAV_MT192x224x128_MI16x16x1_SN_LDSB1_AFC1_AG0_AFEM1_AFEM1_ASEM8_CLR1_CADS0_DTLA0_DTLB0_DTVA0_DTVB0_DTVMXSA0_DTVMXSB0_DTVSM0_DPLB0_EPS1_ELFLR0_EMLLn1_FDSI0_GRPM1_GRVWA16_GRVWB16_GSUn1_GSUAMBSK_GSUC1_GSUWGMRR1_GLS0_ISA942_IU1_K1_LDSTI0_LBSPPA128_LBSPPB256_LBSPPM0_LPA16_LPB32_LPM0_LRVWn1_LWPMn1_MIAV0_MIWT3_14_MO40_MGRIPM1_NTn1_NTA0_NTB0_NTC0_NTD4_NTM0_NEPBS16_NLCA1_NLCB1_ONLL1_PGR2_PLR1_PKA1_SGROB0_SIA3_SS0_SU16_SUM0_SUS256_SPO0_SRVW0_SSO0_SVW4_SK0_SKFTR0_SKXCCM0_SGRO0_TDMI0_TIN0_TLDS1_TLDSM1_ULSGRO0_USL1_USLMX0_UIOFGRO0_UPLRP0_USFGROn1_USI0_VSn1_VWA1_VWB2_WSGRA0_WSGRB0_WS64_WG64_4_1_WGM8_WGMXCC8_WGMXCCGn1
    SolutionIndex: 41
    SolutionNameMin: Cijk_Alik_Bljk_F8NSS_BH_Bias_FDMN_SPAML0_A_S_SAV_MT160x192x128_MI16x16x1_SN_LDSB1_AFC1_AG0_AFEM1_AFEM1_ASEM8_CLR1_CADS0_DTLA0_DTLB0_DTVA0_DTVB0_DTVMXSA0_DTVMXSB0_DTVSM0_DPLB0_EPS1_ELFLR0_EMLLn1_FDSI0_GRPM1_GRVWA8_GRVWB16_GSUn1_GSUAMBSK_GSUC1_GSUWGMRR1_GLS0_ISA942_IU1_K1_LDSTI0_LBSPPA128_LBSPPB256_LBSPPM0_LPA8_LPB32_LPM0_LRVWn1_LWPMn1_MIAV0_MIWT5_6_MO40_MGRIPM1_NTn1_NTA0_NTB0_NTC0_NTD4_NTM0_NEPBS16_NLCA1_NLCB1_ONLL1_PGR2_PLR1_PKA1_SGROB0_SIA3_SS0_SU16_SUM0_SUS256_SPO0_SRVW0_SSO0_SVW4_SK0_SKFTR0_SKXCCM0_SGRO0_TDMI0_TIN0_TLDS1_TLDSM1_ULSGRO0_USL1_USLMX0_UIOFGRO0_UPLRP0_USFGROn1_USI0_VSn1_VWA1_VWB2_WSGRA0_WSGRB0_WS64_WG32_8_1_WGM1_WGMXCC1_WGMXCCGn1
    SolutionIndex: 42
    SolutionNameMin: Cijk_Alik_Bljk_F8NSS_BH_Bias_FDMN_SPAML0_A_S_SAV_MT128x384x128_MI16x16x1_SN_LDSB1_AFC1_AG0_AFEM1_AFEM1_ASEM8_CLR1_CADS0_DTLA0_DTLB0_DTVA0_DTVB0_DTVMXSA0_DTVMXSB0_DTVSM0_DPLB0_EPS1_ELFLR0_EMLLn1_FDSI0_GRPM1_GRVWA8_GRVWB16_GSUn1_GSUAMBSK_GSUC1_GSUWGMRR1_GLS0_ISA942_IU1_K1_LDSTI0_LBSPPA128_LBSPPB512_LBSPPM0_LPA8_LPB32_LPM0_LRVWn1_LWPMn1_MIAV0_MIWT4_12_MO40_MGRIPM1_NTn1_NTA0_NTB0_NTC0_NTD4_NTM0_NEPBS16_NLCA1_NLCB1_ONLL1_PGR2_PLR1_PKA1_SGROB0_SIA3_SS0_SU16_SUM0_SUS256_SPO0_SRVW0_SSO0_SVW4_SK0_SKFTR0_SKXCCM0_SGRO0_TDMI0_TIN0_TLDS1_TLDSM1_ULSGRO0_USL1_USLMX0_UIOFGRO0_UPLRP0_USFGROn1_USI0_VSn1_VWA2_VWB4_WSGRA0_WSGRB0_WS64_WG32_8_1_WGM1_WGMXCC1_WGMXCCGn1
    SolutionIndex: 43
    SolutionNameMin: Cijk_Alik_Bljk_F8NSS_BH_Bias_FDMN_SPAML0_A_S_SAV_MT320x160x128_MI16x16x1_SN_LDSB1_AFC1_AG0_AFEM1_AFEM1_ASEM8_CLR1_CADS0_DTLA0_DTLB0_DTVA0_DTVB0_DTVMXSA0_DTVMXSB0_DTVSM0_DPLB0_EPS1_ELFLR0_EMLLn1_FDSI0_GRPM1_GRVWA8_GRVWB16_GSUn1_GSUAMBSK_GSUC1_GSUWGMRR1_GLS0_ISA942_IU1_K1_LDSTI0_LBSPPA128_LBSPPB256_LBSPPM0_LPA8_LPB32_LPM0_LRVWn1_LWPMn1_MIAV0_MIWT5_10_MO40_MGRIPM1_NTn1_NTA0_NTB0_NTC0_NTD4_NTM0_NEPBS16_NLCA1_NLCB1_ONLL1_PGR2_PLR1_PKA1_SGROB0_SIA3_SS0_SU16_SUM0_SUS256_SPO0_SRVW0_SSO0_SVW4_SK0_SKFTR0_SKXCCM0_SGRO0_TDMI0_TIN0_TLDS1_TLDSM1_ULSGRO0_USL1_USLMX0_UIOFGRO0_UPLRP0_USFGROn1_USI0_VSn1_VWA1_VWB2_WSGRA0_WSGRB0_WS64_WG64_4_1_WGM8_WGMXCC8_WGMXCCGn1
    SolutionIndex: 44
    SolutionNameMin: Cijk_Alik_Bljk_F8NSS_BH_Bias_FDMN_SPAML0_A_S_SAV_MT128x128x128_MI16x16x1_SN_LDSB1_AFC1_AG0_AFEM1_AFEM1_ASEM8_CLR1_CADS0_DTLA0_DTLB0_DTVA0_DTVB0_DTVMXSA0_DTVMXSB0_DTVSM0_DPLB0_EPS1_ELFLR0_EMLLn1_FDSI0_GRPM1_GRVWA16_GRVWB16_GSUn1_GSUAMBSK_GSUC1_GSUWGMRR1_GLS0_ISA942_IU1_K1_LDSTI0_LBSPPA128_LBSPPB1024_LBSPPM0_LPA16_LPB32_LPM0_LRVWn1_LWPMn1_MIAV0_MIWT2_8_MO40_MGRIPM1_NTn1_NTA0_NTB0_NTC0_NTD4_NTM0_NEPBS16_NLCA1_NLCB1_ONLL1_PGR2_PLR1_PKA1_SGROB0_SIA3_SS0_SU16_SUM0_SUS256_SPO0_SRVW0_SSO0_SVW4_SK0_SKFTR0_SKXCCM0_SGRO0_TDMI0_TIN0_TLDS1_TLDSM1_ULSGRO0_USL1_USLMX0_UIOFGRO0_UPLRP0_USFGROn1_USI0_VSn1_VWA2_VWB8_WSGRA0_WSGRB0_WS64_WG64_4_1_WGM8_WGMXCC8_WGMXCCGn1
    SolutionIndex: 45
    SolutionNameMin: Cijk_Alik_Bljk_F8NSS_BH_Bias_FDMN_SPAML0_A_S_SAV_MT128x384x128_MI16x16x1_SN_LDSB1_AFC1_AG0_AFEM1_AFEM1_ASEM8_CLR1_CADS0_DTLA0_DTLB0_DTVA0_DTVB0_DTVMXSA0_DTVMXSB0_DTVSM0_DPLB0_EPS1_ELFLR0_EMLLn1_FDSI0_GRPM1_GRVWA16_GRVWB16_GSUn1_GSUAMBSK_GSUC1_GSUWGMRR1_GLS0_ISA942_IU1_K1_LDSTI0_LBSPPA128_LBSPPB512_LBSPPM0_LPA16_LPB32_LPM0_LRVWn1_LWPMn1_MIAV0_MIWT4_12_MO40_MGRIPM1_NTn1_NTA0_NTB0_NTC0_NTD4_NTM0_NEPBS16_NLCA1_NLCB1_ONLL1_PGR2_PLR1_PKA1_SGROB0_SIA3_SS0_SU16_SUM0_SUS256_SPO0_SRVW0_SSO0_SVW4_SK0_SKFTR0_SKXCCM0_SGRO0_TDMI0_TIN0_TLDS1_TLDSM1_ULSGRO0_USL1_USLMX0_UIOFGRO0_UPLRP0_USFGROn1_USI0_VSn1_VWA2_VWB4_WSGRA0_WSGRB0_WS64_WG32_8_1_WGM8_WGMXCC8_WGMXCCGn1
    SolutionIndex: 46
    SolutionNameMin: Cijk_Alik_Bljk_F8NSS_BH_Bias_FDMN_SPAML0_A_S_SAV_MT128x320x128_MI16x16x1_SN_LDSB1_AFC1_AG0_AFEM1_AFEM1_ASEM8_CLR1_CADS0_DTLA0_DTLB0_DTVA0_DTVB0_DTVMXSA0_DTVMXSB0_DTVSM0_DPLB0_EPS1_ELFLR0_EMLLn1_FDSI0_GRPM1_GRVWA16_GRVWB16_GSUn1_GSUAMBSK_GSUC1_GSUWGMRR1_GLS0_ISA942_IU1_K1_LDSTI0_LBSPPA128_LBSPPB512_LBSPPM0_LPA16_LPB32_LPM0_LRVWn1_LWPMn1_MIAV0_MIWT2_20_MO40_MGRIPM1_NTn1_NTA0_NTB0_NTC0_NTD4_NTM0_NEPBS16_NLCA1_NLCB1_ONLL1_PGR2_PLR1_PKA1_SGROB0_SIA3_SS0_SU16_SUM0_SUS256_SPO0_SRVW0_SSO0_SVW4_SK0_SKFTR0_SKXCCM0_SGRO0_TDMI0_TIN0_TLDS1_TLDSM1_ULSGRO0_USL1_USLMX0_UIOFGRO0_UPLRP0_USFGROn1_USI0_VSn1_VWA2_VWB4_WSGRA0_WSGRB0_WS64_WG64_4_1_WGM1_WGMXCC1_WGMXCCGn1
    SolutionIndex: 47
    SolutionNameMin: Cijk_Alik_Bljk_F8NSS_BH_Bias_FDMN_SPAML0_A_S_SAV_MT128x384x128_MI16x16x1_SN_LDSB1_AFC1_AG0_AFEM1_AFEM1_ASEM8_CLR1_CADS0_DTLA0_DTLB0_DTVA0_DTVB0_DTVMXSA0_DTVMXSB0_DTVSM0_DPLB0_EPS1_ELFLR0_EMLLn1_FDSI0_GRPM1_GRVWA16_GRVWB16_GSUn1_GSUAMBSK_GSUC1_GSUWGMRR1_GLS0_ISA942_IU1_K1_LDSTI0_LBSPPA128_LBSPPB512_LBSPPM0_LPA16_LPB32_LPM0_LRVWn1_LWPMn1_MIAV0_MIWT4_12_MO40_MGRIPM1_NTn1_NTA0_NTB0_NTC0_NTD4_NTM0_NEPBS16_NLCA1_NLCB1_ONLL1_PGR2_PLR1_PKA1_SGROB0_SIA3_SS0_SU16_SUM0_SUS256_SPO0_SRVW0_SSO0_SVW4_SK0_SKFTR0_SKXCCM0_SGRO0_TDMI0_TIN0_TLDS1_TLDSM1_ULSGRO0_USL1_USLMX0_UIOFGRO0_UPLRP0_USFGROn1_USI0_VSn1_VWA2_VWB4_WSGRA0_WSGRB0_WS64_WG32_8_1_WGM1_WGMXCC1_WGMXCCGn1
    SolutionIndex: 48
    SolutionNameMin: Cijk_Alik_Bljk_F8NSS_BH_Bias_FDMN_SPAML0_A_S_SAV_MT96x384x128_MI16x16x1_SN_LDSB1_AFC1_AG0_AFEM1_AFEM1_ASEM8_CLR1_CADS0_DTLA0_DTLB0_DTVA0_DTVB0_DTVMXSA0_DTVMXSB0_DTVSM0_DPLB0_EPS1_ELFLR0_EMLLn1_FDSI0_GRPM1_GRVWA8_GRVWB16_GSUn1_GSUAMBSK_GSUC1_GSUWGMRR1_GLS0_ISA942_IU1_K1_LDSTI0_LBSPPA128_LBSPPB512_LBSPPM0_LPA8_LPB32_LPM0_LRVWn1_LWPMn1_MIAV0_MIWT3_12_MO40_MGRIPM1_NTn1_NTA0_NTB0_NTC0_NTD4_NTM0_NEPBS16_NLCA1_NLCB1_ONLL1_PGR2_PLR1_PKA1_SGROB0_SIA3_SS0_SU16_SUM0_SUS256_SPO0_SRVW0_SSO0_SVW4_SK0_SKFTR0_SKXCCM0_SGRO0_TDMI0_TIN0_TLDS1_TLDSM1_ULSGRO0_USL1_USLMX0_UIOFGRO0_UPLRP0_USFGROn1_USI0_VSn1_VWA1_VWB4_WSGRA0_WSGRB0_WS64_WG32_8_1_WGM1_WGMXCC1_WGMXCCGn1
    SolutionIndex: 49
    SolutionNameMin: Cijk_Alik_Bljk_F8NSS_BH_Bias_FDMN_SPAML0_A_S_SAV_MT96x384x128_MI16x16x1_SN_LDSB1_AFC1_AG0_AFEM1_AFEM1_ASEM8_CLR1_CADS0_DTLA0_DTLB0_DTVA0_DTVB0_DTVMXSA0_DTVMXSB0_DTVSM0_DPLB0_EPS1_ELFLR0_EMLLn1_FDSI0_GRPM1_GRVWA8_GRVWB4_GSUn1_GSUAMBSK_GSUC1_GSUWGMRR1_GLS0_ISA942_IU1_K1_LDSTI0_LBSPPA128_LBSPPB512_LBSPPM0_LPA8_LPB32_LPM0_LRVWn1_LWPMn1_MIAV0_MIWT3_12_MO40_MGRIPM1_NTn1_NTA0_NTB0_NTC0_NTD4_NTM0_NEPBS16_NLCA1_NLCB1_ONLL1_PGR2_PLR1_PKA1_SGROB0_SIA3_SS0_SU16_SUM0_SUS256_SPO0_SRVW0_SSO0_SVW4_SK0_SKFTR0_SKXCCM0_SGRO0_TDMI0_TIN0_TLDS1_TLDSM1_ULSGRO0_USL1_USLMX0_UIOFGRO0_UPLRP0_USFGROn1_USI0_VSn1_VWA1_VWB4_WSGRA0_WSGRB0_WS64_WG32_8_1_WGM1_WGMXCC1_WGMXCCGn1
    SolutionIndex: 50
    SolutionNameMin: Cijk_Alik_Bljk_F8NSS_BH_Bias_FDMN_SPAML0_A_S_SAV_MT128x320x128_MI16x16x1_SN_LDSB1_AFC1_AG0_AFEM1_AFEM1_ASEM8_CLR1_CADS0_DTLA0_DTLB0_DTVA0_DTVB0_DTVMXSA0_DTVMXSB0_DTVSM0_DPLB0_EPS1_ELFLR0_EMLLn1_FDSI0_GRPM1_GRVWA16_GRVWB16_GSUn1_GSUAMBSK_GSUC1_GSUWGMRR1_GLS0_ISA942_IU1_K1_LDSTI0_LBSPPA128_LBSPPB128_LBSPPM0_LPA16_LPB32_LPM0_LRVWn1_LWPMn1_MIAV0_MIWT8_5_MO40_MGRIPM1_NTn1_NTA0_NTB0_NTC0_NTD4_NTM0_NEPBS16_NLCA1_NLCB1_ONLL1_PGR2_PLR1_PKA1_SGROB0_SIA3_SS0_SU16_SUM0_SUS256_SPO0_SRVW0_SSO0_SVW4_SK0_SKFTR0_SKXCCM0_SGRO0_TDMI0_TIN0_TLDS1_TLDSM1_ULSGRO0_USL1_USLMX0_UIOFGRO0_UPLRP0_USFGROn1_USI0_VSn1_VWA2_VWB1_WSGRA0_WSGRB0_WS64_WG16_16_1_WGM1_WGMXCC1_WGMXCCGn1
    SolutionIndex: 51
    SolutionNameMin: Cijk_Alik_Bljk_F8NSS_BH_Bias_FDMN_SPAML0_A_S_SAV_MT128x112x128_MI16x16x1_SN_LDSB1_AFC1_AG0_AFEM1_AFEM1_ASEM8_CLR1_CADS0_DTLA0_DTLB0_DTVA0_DTVB0_DTVMXSA0_DTVMXSB0_DTVSM0_DPLB0_EPS1_ELFLR0_EMLLn1_FDSI0_GRPM1_GRVWA16_GRVWB4_GSUn1_GSUAMBSK_GSUC1_GSUWGMRR1_GLS0_ISA942_IU1_K1_LDSTI0_LBSPPA128_LBSPPB128_LBSPPM0_LPA16_LPB32_LPM0_LRVWn1_LWPMn1_MIAV0_MIWT2_7_MO40_MGRIPM1_NTn1_NTA0_NTB0_NTC0_NTD4_NTM0_NEPBS16_NLCA1_NLCB1_ONLL1_PGR2_PLR1_PKA1_SGROB0_SIA3_SS0_SU16_SUM0_SUS256_SPO0_SRVW0_SSO0_SVW4_SK0_SKFTR0_SKXCCM0_SGRO0_TDMI0_TIN0_TLDS1_TLDSM1_ULSGRO0_USL1_USLMX0_UIOFGRO0_UPLRP0_USFGROn1_USI0_VSn1_VWA2_VWB1_WSGRA0_WSGRB0_WS64_WG64_4_1_WGM1_WGMXCC1_WGMXCCGn1
    SolutionIndex: 52
    SolutionNameMin: Cijk_Alik_Bljk_F8NSS_BH_Bias_FDMN_SPAML0_A_S_SAV_MT64x64x256_MI16x16x1_SN_LDSB1_AFC1_AG0_AFEM1_AFEM1_ASEM8_CLR1_CADS0_DTLA0_DTLB0_DTVA0_DTVB0_DTVMXSA0_DTVMXSB0_DTVSM0_DPLB0_EPS1_ELFLR0_EMLLn1_FDSI0_GRPM1_GRVWA16_GRVWB16_GSUn1_GSUAMBSK_GSUC1_GSUWGMRR1_GLS0_ISA942_IU1_K1_LDSTI0_LBSPPA128_LBSPPB1024_LBSPPM0_LPA16_LPB32_LPM0_LRVWn1_LWPMn1_MIAV0_MIWT1_4_MO40_MGRIPM1_NTn1_NTA0_NTB0_NTC0_NTD4_NTM0_NEPBS16_NLCA1_NLCB1_ONLL1_PGR2_PLR1_PKA1_SGROB0_SIA3_SS0_SU16_SUM0_SUS256_SPO0_SRVW0_SSO0_SVW4_SK0_SKFTR0_SKXCCM0_SGRO0_TDMI0_TIN0_TLDS1_TLDSM1_ULSGRO0_USL1_USLMX0_UIOFGRO0_UPLRP0_USFGROn1_USI0_VSn1_VWA1_VWB4_WSGRA0_WSGRB0_WS64_WG64_4_1_WGM8_WGMXCC8_WGMXCCGn1
    SolutionIndex: 53
    SolutionNameMin: Cijk_Alik_Bljk_F8NSS_BH_Bias_FDMN_SPAML0_A_S_SAV_MT320x192x128_MI16x16x1_SN_LDSB1_AFC1_AG0_AFEM1_AFEM1_ASEM8_CLR1_CADS0_DTLA0_DTLB0_DTVA0_DTVB0_DTVMXSA0_DTVMXSB0_DTVSM0_DPLB0_EPS1_ELFLR0_EMLLn1_FDSI0_GRPM1_GRVWA8_GRVWB16_GSUn1_GSUAMBSK_GSUC1_GSUWGMRR1_GLS0_ISA942_IU1_K1_LDSTI0_LBSPPA128_LBSPPB512_LBSPPM0_LPA8_LPB32_LPM0_LRVWn1_LWPMn1_MIAV0_MIWT5_12_MO40_MGRIPM1_NTn1_NTA0_NTB0_NTC0_NTD4_NTM0_NEPBS16_NLCA1_NLCB1_ONLL1_PGR2_PLR1_PKA1_SGROB0_SIA3_SS0_SU16_SUM0_SUS256_SPO0_SRVW0_SSO0_SVW4_SK0_SKFTR0_SKXCCM0_SGRO0_TDMI0_TIN0_TLDS1_TLDSM1_ULSGRO0_USL1_USLMX0_UIOFGRO0_UPLRP0_USFGROn1_USI0_VSn1_VWA1_VWB4_WSGRA0_WSGRB0_WS64_WG64_4_1_WGM1_WGMXCC1_WGMXCCGn1
    SolutionIndex: 54
    SolutionNameMin: Cijk_Alik_Bljk_F8NSS_BH_Bias_FDMN_SPAML0_A_S_SAV_MT320x160x128_MI16x16x1_SN_LDSB1_AFC1_AG0_AFEM1_AFEM1_ASEM8_CLR1_CADS0_DTLA0_DTLB0_DTVA0_DTVB0_DTVMXSA0_DTVMXSB0_DTVSM0_DPLB0_EPS1_ELFLR0_EMLLn1_FDSI0_GRPM1_GRVWA8_GRVWB16_GSUn1_GSUAMBSK_GSUC1_GSUWGMRR1_GLS0_ISA942_IU1_K1_LDSTI0_LBSPPA128_LBSPPB256_LBSPPM0_LPA8_LPB32_LPM0_LRVWn1_LWPMn1_MIAV0_MIWT5_10_MO40_MGRIPM1_NTn1_NTA0_NTB0_NTC0_NTD4_NTM0_NEPBS16_NLCA1_NLCB1_ONLL1_PGR2_PLR1_PKA1_SGROB0_SIA3_SS0_SU16_SUM0_SUS256_SPO0_SRVW0_SSO0_SVW4_SK0_SKFTR0_SKXCCM0_SGRO0_TDMI0_TIN0_TLDS1_TLDSM1_ULSGRO0_USL1_USLMX0_UIOFGRO0_UPLRP0_USFGROn1_USI0_VSn1_VWA1_VWB2_WSGRA0_WSGRB0_WS64_WG64_4_1_WGM1_WGMXCC1_WGMXCCGn1
    SolutionIndex: 55
    SolutionNameMin: Cijk_Alik_Bljk_F8NSS_BH_Bias_FDMN_SPAML0_A_S_SAV_MT192x192x128_MI16x16x1_SN_LDSB1_AFC1_AG0_AFEM1_AFEM1_ASEM8_CLR1_CADS0_DTLA0_DTLB0_DTVA0_DTVB0_DTVMXSA0_DTVMXSB0_DTVSM0_DPLB0_EPS1_ELFLR0_EMLLn1_FDSI0_GRPM1_GRVWA16_GRVWB16_GSUn1_GSUAMBSK_GSUC1_GSUWGMRR1_GLS0_ISA942_IU1_K1_LDSTI0_LBSPPA128_LBSPPB512_LBSPPM0_LPA16_LPB32_LPM0_LRVWn1_LWPMn1_MIAV0_MIWT3_12_MO40_MGRIPM1_NTn1_NTA0_NTB0_NTC0_NTD4_NTM0_NEPBS16_NLCA1_NLCB1_ONLL1_PGR2_PLR1_PKA1_SGROB0_SIA3_SS0_SU16_SUM0_SUS256_SPO0_SRVW0_SSO0_SVW4_SK0_SKFTR0_SKXCCM0_SGRO0_TDMI0_TIN0_TLDS1_TLDSM1_ULSGRO0_USL1_USLMX0_UIOFGRO0_UPLRP0_USFGROn1_USI0_VSn1_VWA1_VWB4_WSGRA0_WSGRB0_WS64_WG64_4_1_WGM8_WGMXCC8_WGMXCCGn1
    SolutionIndex: 56
    SolutionNameMin: Cijk_Alik_Bljk_F8NSS_BH_Bias_FDMN_SPAML0_A_S_SAV_MT224x192x128_MI16x16x1_SN_LDSB1_AFC1_AG0_AFEM1_AFEM1_ASEM8_CLR1_CADS0_DTLA0_DTLB0_DTVA0_DTVB0_DTVMXSA0_DTVMXSB0_DTVSM0_DPLB0_EPS1_ELFLR0_EMLLn1_FDSI0_GRPM1_GRVWA8_GRVWB16_GSUn1_GSUAMBSK_GSUC1_GSUWGMRR1_GLS0_ISA942_IU1_K1_LDSTI0_LBSPPA128_LBSPPB256_LBSPPM0_LPA8_LPB32_LPM0_LRVWn1_LWPMn1_MIAV0_MIWT7_6_MO40_MGRIPM1_NTn1_NTA0_NTB0_NTC0_NTD4_NTM0_NEPBS16_NLCA1_NLCB1_ONLL1_PGR2_PLR1_PKA1_SGROB0_SIA3_SS0_SU16_SUM0_SUS256_SPO0_SRVW0_SSO0_SVW4_SK0_SKFTR0_SKXCCM0_SGRO0_TDMI0_TIN0_TLDS1_TLDSM1_ULSGRO0_USL1_USLMX0_UIOFGRO0_UPLRP0_USFGROn1_USI0_VSn1_VWA1_VWB2_WSGRA0_WSGRB0_WS64_WG32_8_1_WGM8_WGMXCC8_WGMXCCGn1
    SolutionIndex: 57
    SolutionNameMin: Cijk_Alik_Bljk_F8NSS_BH_Bias_FDMN_SPAML0_A_S_SAV_MT256x256x128_MI16x16x1_SN_LDSB1_AFC1_AG0_AFEM1_AFEM1_ASEM8_CLR1_CADS0_DTLA0_DTLB0_DTVA0_DTVB0_DTVMXSA0_DTVMXSB0_DTVSM0_DPLB0_EPS1_ELFLR0_EMLLn1_FDSI0_GRPM1_GRVWA16_GRVWB16_GSUn1_GSUAMBSK_GSUC1_GSUWGMRR1_GLS0_ISA942_IU1_K1_LDSTI0_LBSPPA128_LBSPPB2048_LBSPPM0_LPA16_LPB32_LPM0_LRVWn1_LWPMn1_MIAV0_MIWT4_16_MO40_MGRIPM1_NTn1_NTA0_NTB0_NTC0_NTD4_NTM0_NEPBS16_NLCA1_NLCB1_ONLL1_PGR2_PLR1_PKA1_SGROB0_SIA3_SS0_SU16_SUM0_SUS256_SPO0_SRVW0_SSO0_SVW4_SK0_SKFTR0_SKXCCM0_SGRO0_TDMI0_TIN0_TLDS1_TLDSM1_ULSGRO0_USL1_USLMX0_UIOFGRO0_UPLRP0_USFGROn1_USI0_VSn1_VWA2_VWB16_WSGRA0_WSGRB0_WS64_WG64_4_1_WGM8_WGMXCC8_WGMXCCGn1
    SolutionIndex: 58
    SolutionNameMin: Cijk_Alik_Bljk_F8NSS_BH_Bias_FDMN_SPAML0_A_S_SAV_MT352x128x128_MI16x16x1_SN_LDSB1_AFC1_AG0_AFEM1_AFEM1_ASEM8_CLR1_CADS0_DTLA0_DTLB0_DTVA0_DTVB0_DTVMXSA0_DTVMXSB0_DTVSM0_DPLB0_EPS1_ELFLR0_EMLLn1_FDSI0_GRPM1_GRVWA8_GRVWB16_GSUn1_GSUAMBSK_GSUC1_GSUWGMRR1_GLS0_ISA942_IU1_K1_LDSTI0_LBSPPA128_LBSPPB512_LBSPPM0_LPA8_LPB32_LPM0_LRVWn1_LWPMn1_MIAV0_MIWT11_4_MO40_MGRIPM1_NTn1_NTA0_NTB0_NTC0_NTD4_NTM0_NEPBS16_NLCA1_NLCB1_ONLL1_PGR2_PLR1_PKA1_SGROB0_SIA3_SS0_SU16_SUM0_SUS256_SPO0_SRVW0_SSO0_SVW4_SK0_SKFTR0_SKXCCM0_SGRO0_TDMI0_TIN0_TLDS1_TLDSM1_ULSGRO0_USL1_USLMX0_UIOFGRO0_UPLRP0_USFGROn1_USI0_VSn1_VWA1_VWB4_WSGRA0_WSGRB0_WS64_WG32_8_1_WGM1_WGMXCC1_WGMXCCGn1
    SolutionIndex: 59
    SolutionNameMin: Cijk_Alik_Bljk_F8NSS_BH_Bias_FDMN_SPAML0_A_S_SAV_MT192x256x128_MI16x16x1_SN_LDSB1_AFC1_AG0_AFEM1_AFEM1_ASEM8_CLR1_CADS0_DTLA0_DTLB0_DTVA0_DTVB0_DTVMXSA0_DTVMXSB0_DTVSM0_DPLB0_EPS1_ELFLR0_EMLLn1_FDSI0_GRPM1_GRVWA8_GRVWB4_GSUn1_GSUAMBSK_GSUC1_GSUWGMRR1_GLS0_ISA942_IU1_K1_LDSTI0_LBSPPA128_LBSPPB2048_LBSPPM0_LPA8_LPB32_LPM0_LRVWn1_LWPMn1_MIAV0_MIWT3_16_MO40_MGRIPM1_NTn1_NTA0_NTB0_NTC0_NTD4_NTM0_NEPBS16_NLCA1_NLCB1_ONLL1_PGR2_PLR1_PKA1_SGROB0_SIA3_SS0_SU16_SUM0_SUS256_SPO0_SRVW0_SSO0_SVW4_SK0_SKFTR0_SKXCCM0_SGRO0_TDMI0_TIN0_TLDS1_TLDSM1_ULSGRO0_USL1_USLMX0_UIOFGRO0_UPLRP0_USFGROn1_USI0_VSn1_VWA1_VWB16_WSGRA0_WSGRB0_WS64_WG64_4_1_WGM1_WGMXCC1_WGMXCCGn1
    SolutionIndex: 60
    SolutionNameMin: Cijk_Alik_Bljk_F8NSS_BH_Bias_FDMN_SPAML0_A_S_SAV_MT256x240x128_MI16x16x1_SN_LDSB1_AFC1_AG0_AFEM1_AFEM1_ASEM8_CLR1_CADS0_DTLA0_DTLB0_DTVA0_DTVB0_DTVMXSA0_DTVMXSB0_DTVSM0_DPLB0_EPS1_ELFLR0_EMLLn1_FDSI0_GRPM1_GRVWA16_GRVWB4_GSUn1_GSUAMBSK_GSUC1_GSUWGMRR1_GLS0_ISA942_IU1_K1_LDSTI0_LBSPPA128_LBSPPB128_LBSPPM0_LPA16_LPB32_LPM0_LRVWn1_LWPMn1_MIAV0_MIWT4_15_MO40_MGRIPM1_NTn1_NTA0_NTB0_NTC0_NTD4_NTM0_NEPBS16_NLCA1_NLCB1_ONLL1_PGR2_PLR1_PKA1_SGROB0_SIA3_SS0_SU16_SUM0_SUS256_SPO0_SRVW0_SSO0_SVW4_SK0_SKFTR0_SKXCCM0_SGRO0_TDMI0_TIN0_TLDS1_TLDSM1_ULSGRO0_USL1_USLMX0_UIOFGRO0_UPLRP0_USFGROn1_USI0_VSn1_VWA2_VWB1_WSGRA0_WSGRB0_WS64_WG64_4_1_WGM1_WGMXCC1_WGMXCCGn1
    SolutionIndex: 61
    SolutionNameMin: Cijk_Alik_Bljk_F8NSS_BH_Bias_FDMN_SPAML0_A_S_SAV_MT192x256x128_MI16x16x1_SN_LDSB1_AFC1_AG0_AFEM1_AFEM1_ASEM8_CLR1_CADS0_DTLA0_DTLB0_DTVA0_DTVB0_DTVMXSA0_DTVMXSB0_DTVSM0_DPLB0_EPS1_ELFLR0_EMLLn1_FDSI0_GRPM1_GRVWA16_GRVWB4_GSUn1_GSUAMBSK_GSUC1_GSUWGMRR1_GLS0_ISA942_IU1_K1_LDSTI0_LBSPPA128_LBSPPB2048_LBSPPM0_LPA16_LPB32_LPM0_LRVWn1_LWPMn1_MIAV0_MIWT3_16_MO40_MGRIPM1_NTn1_NTA0_NTB0_NTC0_NTD4_NTM0_NEPBS16_NLCA1_NLCB1_ONLL1_PGR2_PLR1_PKA1_SGROB0_SIA3_SS0_SU16_SUM0_SUS256_SPO0_SRVW0_SSO0_SVW4_SK0_SKFTR0_SKXCCM0_SGRO0_TDMI0_TIN0_TLDS1_TLDSM1_ULSGRO0_USL1_USLMX0_UIOFGRO0_UPLRP0_USFGROn1_USI0_VSn1_VWA1_VWB16_WSGRA0_WSGRB0_WS64_WG64_4_1_WGM1_WGMXCC1_WGMXCCGn1
    SolutionIndex: 62
    SolutionNameMin: Cijk_Alik_Bljk_F8NSS_BH_Bias_FDMN_SPAML0_A_S_SAV_MT144x128x256_MI16x16x1_SN_LDSB1_AFC1_AG0_AFEM1_AFEM1_ASEM8_CLR1_CADS0_DTLA0_DTLB0_DTVA0_DTVB0_DTVMXSA0_DTVMXSB0_DTVSM0_DPLB0_EPS1_ELFLR0_EMLLn1_FDSI0_GRPM1_GRVWA8_GRVWB16_GSUn1_GSUAMBSK_GSUC1_GSUWGMRR1_GLS0_ISA942_IU1_K1_LDSTI0_LBSPPA128_LBSPPB512_LBSPPM0_LPA8_LPB32_LPM0_LRVWn1_LWPMn1_MIAV0_MIWT9_2_MO40_MGRIPM1_NTn1_NTA0_NTB0_NTC0_NTD4_NTM0_NEPBS16_NLCA1_NLCB1_ONLL1_PGR2_PLR1_PKA1_SGROB0_SIA3_SS0_SU16_SUM0_SUS256_SPO0_SRVW0_SSO0_SVW4_SK0_SKFTR0_SKXCCM0_SGRO0_TDMI0_TIN0_TLDS1_TLDSM1_ULSGRO0_USL1_USLMX0_UIOFGRO0_UPLRP0_USFGROn1_USI0_VSn1_VWA1_VWB2_WSGRA0_WSGRB0_WS64_WG16_16_1_WGM8_WGMXCC8_WGMXCCGn1
    SolutionIndex: 63
    SolutionNameMin: Cijk_Alik_Bljk_F8NSS_BH_Bias_FDMN_SPAML0_A_S_SAV_MT128x320x128_MI16x16x1_SN_LDSB1_AFC1_AG0_AFEM1_AFEM1_ASEM8_CLR1_CADS0_DTLA0_DTLB0_DTVA0_DTVB0_DTVMXSA0_DTVMXSB0_DTVSM0_DPLB0_EPS1_ELFLR0_EMLLn1_FDSI0_GRPM1_GRVWA8_GRVWB16_GSUn1_GSUAMBSK_GSUC1_GSUWGMRR1_GLS0_ISA942_IU1_K1_LDSTI0_LBSPPA128_LBSPPB512_LBSPPM0_LPA8_LPB32_LPM0_LRVWn1_LWPMn1_MIAV0_MIWT2_20_MO40_MGRIPM1_NTn1_NTA0_NTB0_NTC0_NTD4_NTM0_NEPBS16_NLCA1_NLCB1_ONLL1_PGR2_PLR1_PKA1_SGROB0_SIA3_SS0_SU16_SUM0_SUS256_SPO0_SRVW0_SSO0_SVW4_SK0_SKFTR0_SKXCCM0_SGRO0_TDMI0_TIN0_TLDS1_TLDSM1_ULSGRO0_USL1_USLMX0_UIOFGRO0_UPLRP0_USFGROn1_USI0_VSn1_VWA2_VWB4_WSGRA0_WSGRB0_WS64_WG64_4_1_WGM1_WGMXCC1_WGMXCCGn1
    SolutionIndex: 64
    SolutionNameMin: Cijk_Alik_Bljk_F8NSS_BH_Bias_FDMN_SPAML0_A_S_SAV_MT96x384x128_MI16x16x1_SN_LDSB1_AFC1_AG0_AFEM1_AFEM1_ASEM8_CLR1_CADS0_DTLA0_DTLB0_DTVA0_DTVB0_DTVMXSA0_DTVMXSB0_DTVSM0_DPLB0_EPS1_ELFLR0_EMLLn1_FDSI0_GRPM1_GRVWA8_GRVWB16_GSUn1_GSUAMBSK_GSUC1_GSUWGMRR1_GLS0_ISA942_IU1_K1_LDSTI0_LBSPPA128_LBSPPB512_LBSPPM0_LPA8_LPB32_LPM0_LRVWn1_LWPMn1_MIAV0_MIWT3_12_MO40_MGRIPM1_NTn1_NTA0_NTB0_NTC0_NTD4_NTM0_NEPBS16_NLCA1_NLCB1_ONLL1_PGR2_PLR1_PKA1_SGROB0_SIA3_SS0_SU16_SUM0_SUS256_SPO0_SRVW0_SSO0_SVW4_SK0_SKFTR0_SKXCCM0_SGRO0_TDMI0_TIN0_TLDS1_TLDSM1_ULSGRO0_USL1_USLMX0_UIOFGRO0_UPLRP0_USFGROn1_USI0_VSn1_VWA1_VWB4_WSGRA0_WSGRB0_WS64_WG32_8_1_WGM8_WGMXCC8_WGMXCCGn1
    SolutionIndex: 65
    SolutionNameMin: Cijk_Alik_Bljk_F8NSS_BH_Bias_FDMN_SPAML0_A_S_SAV_MT16x64x256_MI16x16x1_SN_LDSB1_AFC1_AG0_AFEM1_AFEM1_ASEM8_CLR1_CADS0_DTLA0_DTLB0_DTVA0_DTVB0_DTVMXSA0_DTVMXSB0_DTVSM0_DPLB0_EPS1_ELFLR0_EMLLn1_FDSI0_GRPM1_GRVWA8_GRVWB4_GSUn1_GSUAMBSK_GSUC1_GSUWGMRR1_GLS0_ISA942_IU1_K1_LDSTI0_LBSPPA128_LBSPPB256_LBSPPM0_LPA8_LPB32_LPM0_LRVWn1_LWPMn1_MIAV0_MIWT1_1_MO40_MGRIPM1_NTn1_NTA0_NTB0_NTC0_NTD4_NTM0_NEPBS16_NLCA1_NLCB1_ONLL1_PGR2_PLR1_PKA1_SGROB0_SIA3_SS0_SU16_SUM0_SUS256_SPO0_SRVW0_SSO0_SVW4_SK0_SKFTR0_SKXCCM0_SGRO0_TDMI0_TIN0_TLDS1_TLDSM1_ULSGRO0_USL1_USLMX0_UIOFGRO0_UPLRP0_USFGROn1_USI0_VSn1_VWA1_VWB1_WSGRA0_WSGRB0_WS64_WG16_16_1_WGM1_WGMXCC1_WGMXCCGn1
    SolutionIndex: 66
    SolutionNameMin: Cijk_Alik_Bljk_F8NSS_BH_Bias_FDMN_SPAML0_A_S_SAV_MT32x64x256_MI16x16x1_SN_LDSB1_AFC1_AG0_AFEM1_AFEM1_ASEM8_CLR1_CADS0_DTLA0_DTLB0_DTVA0_DTVB0_DTVMXSA0_DTVMXSB0_DTVSM0_DPLB0_EPS1_ELFLR0_EMLLn1_FDSI0_GRPM1_GRVWA16_GRVWB4_GSUn1_GSUAMBSK_GSUC1_GSUWGMRR1_GLS0_ISA942_IU1_K1_LDSTI0_LBSPPA128_LBSPPB512_LBSPPM0_LPA16_LPB32_LPM0_LRVWn1_LWPMn1_MIAV0_MIWT1_2_MO40_MGRIPM1_NTn1_NTA0_NTB0_NTC0_NTD4_NTM0_NEPBS16_NLCA1_NLCB1_ONLL1_PGR2_PLR1_PKA1_SGROB0_SIA3_SS0_SU16_SUM0_SUS256_SPO0_SRVW0_SSO0_SVW4_SK0_SKFTR0_SKXCCM0_SGRO0_TDMI0_TIN0_TLDS1_TLDSM1_ULSGRO0_USL1_USLMX0_UIOFGRO0_UPLRP0_USFGROn1_USI0_VSn1_VWA1_VWB2_WSGRA0_WSGRB0_WS64_WG32_8_1_WGM1_WGMXCC1_WGMXCCGn1
    SolutionIndex: 67
    SolutionNameMin: Cijk_Alik_Bljk_F8NSS_BH_Bias_FDMN_SPAML0_A_S_SAV_MT48x64x256_MI16x16x1_SN_LDSB1_AFC1_AG0_AFEM1_AFEM1_ASEM8_CLR1_CADS0_DTLA0_DTLB0_DTVA0_DTVB0_DTVMXSA0_DTVMXSB0_DTVSM0_DPLB0_EPS1_ELFLR0_EMLLn1_FDSI0_GRPM1_GRVWA8_GRVWB4_GSUn1_GSUAMBSK_GSUC1_GSUWGMRR1_GLS0_ISA942_IU1_K1_LDSTI0_LBSPPA128_LBSPPB256_LBSPPM0_LPA8_LPB32_LPM0_LRVWn1_LWPMn1_MIAV0_MIWT3_1_MO40_MGRIPM1_NTn1_NTA0_NTB0_NTC0_NTD4_NTM0_NEPBS16_NLCA1_NLCB1_ONLL1_PGR2_PLR1_PKA1_SGROB0_SIA3_SS0_SU16_SUM0_SUS256_SPO0_SRVW0_SSO0_SVW4_SK0_SKFTR0_SKXCCM0_SGRO0_TDMI0_TIN0_TLDS1_TLDSM1_ULSGRO0_USL1_USLMX0_UIOFGRO0_UPLRP0_USFGROn1_USI0_VSn1_VWA1_VWB1_WSGRA0_WSGRB0_WS64_WG16_16_1_WGM1_WGMXCC1_WGMXCCGn1
    SolutionIndex: 68
    SolutionNameMin: Cijk_Alik_Bljk_F8NSS_BH_Bias_FDMN_SPAML0_A_S_SAV_MT160x320x128_MI16x16x1_SN_LDSB1_AFC1_AG0_AFEM1_AFEM1_ASEM8_CLR1_CADS0_DTLA0_DTLB0_DTVA0_DTVB0_DTVMXSA0_DTVMXSB0_DTVSM0_DPLB0_EPS1_ELFLR0_EMLLn1_FDSI0_GRPM1_GRVWA8_GRVWB16_GSUn1_GSUAMBSK_GSUC1_GSUWGMRR1_GLS0_ISA942_IU1_K1_LDSTI0_LBSPPA128_LBSPPB256_LBSPPM0_LPA8_LPB32_LPM0_LRVWn1_LWPMn1_MIAV0_MIWT5_10_MO40_MGRIPM1_NTn1_NTA0_NTB0_NTC0_NTD4_NTM0_NEPBS16_NLCA1_NLCB1_ONLL1_PGR2_PLR1_PKA1_SGROB0_SIA3_SS0_SU16_SUM0_SUS256_SPO0_SRVW0_SSO0_SVW4_SK0_SKFTR0_SKXCCM0_SGRO0_TDMI0_TIN0_TLDS1_TLDSM1_ULSGRO0_USL1_USLMX0_UIOFGRO0_UPLRP0_USFGROn1_USI0_VSn1_VWA1_VWB2_WSGRA0_WSGRB0_WS64_WG32_8_1_WGM1_WGMXCC1_WGMXCCGn1
    SolutionIndex: 69
    SolutionNameMin: Cijk_Alik_Bljk_F8NSS_BH_Bias_FDMN_SPAML0_A_S_SAV_MT256x256x128_MI16x16x1_SN_LDSB1_AFC1_AG0_AFEM1_AFEM1_ASEM8_CLR1_CADS0_DTLA0_DTLB0_DTVA0_DTVB0_DTVMXSA0_DTVMXSB0_DTVSM0_DPLB0_EPS1_ELFLR0_EMLLn1_FDSI0_GRPM1_GRVWA8_GRVWB16_GSUn1_GSUAMBSK_GSUC1_GSUWGMRR1_GLS0_ISA942_IU1_K1_LDSTI0_LBSPPA128_LBSPPB2048_LBSPPM0_LPA8_LPB32_LPM0_LRVWn1_LWPMn1_MIAV0_MIWT4_16_MO40_MGRIPM1_NTn1_NTA0_NTB0_NTC0_NTD4_NTM0_NEPBS16_NLCA1_NLCB1_ONLL1_PGR2_PLR1_PKA1_SGROB0_SIA3_SS0_SU16_SUM0_SUS256_SPO0_SRVW0_SSO0_SVW4_SK0_SKFTR0_SKXCCM0_SGRO0_TDMI0_TIN0_TLDS1_TLDSM1_ULSGRO0_USL1_USLMX0_UIOFGRO0_UPLRP0_USFGROn1_USI0_VSn1_VWA2_VWB16_WSGRA0_WSGRB0_WS64_WG64_4_1_WGM8_WGMXCC8_WGMXCCGn1
    SolutionIndex: 70
    SolutionNameMin: Cijk_Alik_Bljk_F8NSS_BH_Bias_FDMN_SPAML0_A_S_SAV_MT320x192x128_MI16x16x1_SN_LDSB1_AFC1_AG0_AFEM1_AFEM1_ASEM8_CLR1_CADS0_DTLA0_DTLB0_DTVA0_DTVB0_DTVMXSA0_DTVMXSB0_DTVSM0_DPLB0_EPS1_ELFLR0_EMLLn1_FDSI0_GRPM1_GRVWA16_GRVWB16_GSUn1_GSUAMBSK_GSUC1_GSUWGMRR1_GLS0_ISA942_IU1_K1_LDSTI0_LBSPPA128_LBSPPB512_LBSPPM0_LPA16_LPB32_LPM0_LRVWn1_LWPMn1_MIAV0_MIWT5_12_MO40_MGRIPM1_NTn1_NTA0_NTB0_NTC0_NTD4_NTM0_NEPBS16_NLCA1_NLCB1_ONLL1_PGR2_PLR1_PKA1_SGROB0_SIA3_SS0_SU16_SUM0_SUS256_SPO0_SRVW0_SSO0_SVW4_SK0_SKFTR0_SKXCCM0_SGRO0_TDMI0_TIN0_TLDS1_TLDSM1_ULSGRO0_USL1_USLMX0_UIOFGRO0_UPLRP0_USFGROn1_USI0_VSn1_VWA1_VWB4_WSGRA0_WSGRB0_WS64_WG64_4_1_WGM8_WGMXCC8_WGMXCCGn1
    SolutionIndex: 71
    SolutionNameMin: Cijk_Alik_Bljk_F8NSS_BH_Bias_FDMN_SPAML0_A_S_SAV_MT256x256x128_MI16x16x1_SN_LDSB1_AFC1_AG0_AFEM1_AFEM1_ASEM8_CLR1_CADS0_DTLA0_DTLB0_DTVA0_DTVB0_DTVMXSA0_DTVMXSB0_DTVSM0_DPLB0_EPS1_ELFLR0_EMLLn1_FDSI0_GRPM1_GRVWA8_GRVWB16_GSUn1_GSUAMBSK_GSUC1_GSUWGMRR1_GLS0_ISA942_IU1_K1_LDSTI0_LBSPPA128_LBSPPB1024_LBSPPM0_LPA8_LPB32_LPM0_LRVWn1_LWPMn1_MIAV0_MIWT8_8_MO40_MGRIPM1_NTn1_NTA0_NTB0_NTC0_NTD4_NTM0_NEPBS16_NLCA1_NLCB1_ONLL1_PGR2_PLR1_PKA1_SGROB0_SIA3_SS0_SU16_SUM0_SUS256_SPO0_SRVW0_SSO0_SVW4_SK0_SKFTR0_SKXCCM0_SGRO0_TDMI0_TIN0_TLDS1_TLDSM1_ULSGRO0_USL1_USLMX0_UIOFGRO0_UPLRP0_USFGROn1_USI0_VSn1_VWA2_VWB8_WSGRA0_WSGRB0_WS64_WG32_8_1_WGM8_WGMXCC8_WGMXCCGn1
    SolutionIndex: 72
    SolutionNameMin: Cijk_Alik_Bljk_F8NSS_BH_Bias_FDMN_SPAML0_A_S_SAV_MT288x160x128_MI16x16x1_SN_LDSB1_AFC1_AG0_AFEM1_AFEM1_ASEM8_CLR1_CADS0_DTLA0_DTLB0_DTVA0_DTVB0_DTVMXSA0_DTVMXSB0_DTVSM0_DPLB0_EPS1_ELFLR0_EMLLn1_FDSI0_GRPM1_GRVWA8_GRVWB16_GSUn1_GSUAMBSK_GSUC1_GSUWGMRR1_GLS0_ISA942_IU1_K1_LDSTI0_LBSPPA128_LBSPPB128_LBSPPM0_LPA8_LPB32_LPM0_LRVWn1_LWPMn1_MIAV0_MIWT9_5_MO40_MGRIPM1_NTn1_NTA0_NTB0_NTC0_NTD4_NTM0_NEPBS16_NLCA1_NLCB1_ONLL1_PGR2_PLR1_PKA1_SGROB0_SIA3_SS0_SU16_SUM0_SUS256_SPO0_SRVW0_SSO0_SVW4_SK0_SKFTR0_SKXCCM0_SGRO0_TDMI0_TIN0_TLDS1_TLDSM1_ULSGRO0_USL1_USLMX0_UIOFGRO0_UPLRP0_USFGROn1_USI0_VSn1_VWA1_VWB1_WSGRA0_WSGRB0_WS64_WG32_8_1_WGM1_WGMXCC1_WGMXCCGn1
    SolutionIndex: 73
    SolutionNameMin: Cijk_Alik_Bljk_F8NSS_BH_Bias_FDMN_SPAML0_A_S_SAV_MT320x160x128_MI16x16x1_SN_LDSB1_AFC1_AG0_AFEM1_AFEM1_ASEM8_CLR1_CADS0_DTLA0_DTLB0_DTVA0_DTVB0_DTVMXSA0_DTVMXSB0_DTVSM0_DPLB0_EPS1_ELFLR0_EMLLn1_FDSI0_GRPM1_GRVWA16_GRVWB16_GSUn1_GSUAMBSK_GSUC1_GSUWGMRR1_GLS0_ISA942_IU1_K1_LDSTI0_LBSPPA128_LBSPPB256_LBSPPM0_LPA16_LPB32_LPM0_LRVWn1_LWPMn1_MIAV0_MIWT5_10_MO40_MGRIPM1_NTn1_NTA0_NTB0_NTC0_NTD4_NTM0_NEPBS16_NLCA1_NLCB1_ONLL1_PGR2_PLR1_PKA1_SGROB0_SIA3_SS0_SU16_SUM0_SUS256_SPO0_SRVW0_SSO0_SVW4_SK0_SKFTR0_SKXCCM0_SGRO0_TDMI0_TIN0_TLDS1_TLDSM1_ULSGRO0_USL1_USLMX0_UIOFGRO0_UPLRP0_USFGROn1_USI0_VSn1_VWA1_VWB2_WSGRA0_WSGRB0_WS64_WG64_4_1_WGM1_WGMXCC1_WGMXCCGn1
    SolutionIndex: 74
    SolutionNameMin: Cijk_Alik_Bljk_F8NSS_BH_Bias_FDMN_SPAML0_A_S_SAV_MT192x160x128_MI16x16x1_SN_LDSB1_AFC1_AG0_AFEM1_AFEM1_ASEM8_CLR1_CADS0_DTLA0_DTLB0_DTVA0_DTVB0_DTVMXSA0_DTVMXSB0_DTVSM0_DPLB0_EPS1_ELFLR0_EMLLn1_FDSI0_GRPM1_GRVWA16_GRVWB16_GSUn1_GSUAMBSK_GSUC1_GSUWGMRR1_GLS0_ISA942_IU1_K1_LDSTI0_LBSPPA128_LBSPPB256_LBSPPM0_LPA16_LPB32_LPM0_LRVWn1_LWPMn1_MIAV0_MIWT3_10_MO40_MGRIPM1_NTn1_NTA0_NTB0_NTC0_NTD4_NTM0_NEPBS16_NLCA1_NLCB1_ONLL1_PGR2_PLR1_PKA1_SGROB0_SIA3_SS0_SU16_SUM0_SUS256_SPO0_SRVW0_SSO0_SVW4_SK0_SKFTR0_SKXCCM0_SGRO0_TDMI0_TIN0_TLDS1_TLDSM1_ULSGRO0_USL1_USLMX0_UIOFGRO0_UPLRP0_USFGROn1_USI0_VSn1_VWA1_VWB2_WSGRA0_WSGRB0_WS64_WG64_4_1_WGM8_WGMXCC8_WGMXCCGn1
    SolutionIndex: 75
    SolutionNameMin: Cijk_Alik_Bljk_F8NSS_BH_Bias_FDMN_SPAML0_A_S_SAV_MT160x320x128_MI16x16x1_SN_LDSB1_AFC1_AG0_AFEM1_AFEM1_ASEM8_CLR1_CADS0_DTLA0_DTLB0_DTVA0_DTVB0_DTVMXSA0_DTVMXSB0_DTVSM0_DPLB0_EPS1_ELFLR0_EMLLn1_FDSI0_GRPM1_GRVWA8_GRVWB16_GSUn1_GSUAMBSK_GSUC1_GSUWGMRR1_GLS0_ISA942_IU1_K1_LDSTI0_LBSPPA128_LBSPPB256_LBSPPM0_LPA8_LPB32_LPM0_LRVWn1_LWPMn1_MIAV0_MIWT5_10_MO40_MGRIPM1_NTn1_NTA0_NTB0_NTC0_NTD4_NTM0_NEPBS16_NLCA1_NLCB1_ONLL1_PGR2_PLR1_PKA1_SGROB0_SIA3_SS0_SU16_SUM0_SUS256_SPO0_SRVW0_SSO0_SVW4_SK0_SKFTR0_SKXCCM0_SGRO0_TDMI0_TIN0_TLDS1_TLDSM1_ULSGRO0_USL1_USLMX0_UIOFGRO0_UPLRP0_USFGROn1_USI0_VSn1_VWA1_VWB2_WSGRA0_WSGRB0_WS64_WG32_8_1_WGM8_WGMXCC8_WGMXCCGn1
    SolutionIndex: 76
    SolutionNameMin: Cijk_Alik_Bljk_F8NSS_BH_Bias_FDMN_SPAML0_A_S_SAV_MT160x224x128_MI16x16x1_SN_LDSB1_AFC1_AG0_AFEM1_AFEM1_ASEM8_CLR1_CADS0_DTLA0_DTLB0_DTVA0_DTVB0_DTVMXSA0_DTVMXSB0_DTVSM0_DPLB0_EPS1_ELFLR0_EMLLn1_FDSI0_GRPM1_GRVWA8_GRVWB16_GSUn1_GSUAMBSK_GSUC1_GSUWGMRR1_GLS0_ISA942_IU1_K1_LDSTI0_LBSPPA128_LBSPPB128_LBSPPM0_LPA8_LPB32_LPM0_LRVWn1_LWPMn1_MIAV0_MIWT5_7_MO40_MGRIPM1_NTn1_NTA0_NTB0_NTC0_NTD4_NTM0_NEPBS16_NLCA1_NLCB1_ONLL1_PGR2_PLR1_PKA1_SGROB0_SIA3_SS0_SU16_SUM0_SUS256_SPO0_SRVW0_SSO0_SVW4_SK0_SKFTR0_SKXCCM0_SGRO0_TDMI0_TIN0_TLDS1_TLDSM1_ULSGRO0_USL1_USLMX0_UIOFGRO0_UPLRP0_USFGROn1_USI0_VSn1_VWA1_VWB1_WSGRA0_WSGRB0_WS64_WG32_8_1_WGM1_WGMXCC1_WGMXCCGn1
    SolutionIndex: 77
    SolutionNameMin: Cijk_Alik_Bljk_F8NSS_BH_Bias_FDMN_SPAML0_A_S_SAV_MT256x208x128_MI16x16x1_SN_LDSB1_AFC1_AG0_AFEM1_AFEM1_ASEM8_CLR1_CADS0_DTLA0_DTLB0_DTVA0_DTVB0_DTVMXSA0_DTVMXSB0_DTVSM0_DPLB0_EPS1_ELFLR0_EMLLn1_FDSI0_GRPM1_GRVWA16_GRVWB4_GSUn1_GSUAMBSK_GSUC1_GSUWGMRR1_GLS0_ISA942_IU1_K1_LDSTI0_LBSPPA128_LBSPPB128_LBSPPM0_LPA16_LPB32_LPM0_LRVWn1_LWPMn1_MIAV0_MIWT4_13_MO40_MGRIPM1_NTn1_NTA0_NTB0_NTC0_NTD4_NTM0_NEPBS16_NLCA1_NLCB1_ONLL1_PGR2_PLR1_PKA1_SGROB0_SIA3_SS0_SU16_SUM0_SUS256_SPO0_SRVW0_SSO0_SVW4_SK0_SKFTR0_SKXCCM0_SGRO0_TDMI0_TIN0_TLDS1_TLDSM1_ULSGRO0_USL1_USLMX0_UIOFGRO0_UPLRP0_USFGROn1_USI0_VSn1_VWA2_VWB1_WSGRA0_WSGRB0_WS64_WG64_4_1_WGM1_WGMXCC1_WGMXCCGn1
    SolutionIndex: 78
    SolutionNameMin: Cijk_Alik_Bljk_F8NSS_BH_Bias_FDMN_SPAML0_A_S_SAV_MT256x224x128_MI16x16x1_SN_LDSB1_AFC1_AG0_AFEM1_AFEM1_ASEM8_CLR1_CADS0_DTLA0_DTLB0_DTVA0_DTVB0_DTVMXSA0_DTVMXSB0_DTVSM0_DPLB0_EPS1_ELFLR0_EMLLn1_FDSI0_GRPM1_GRVWA16_GRVWB16_GSUn1_GSUAMBSK_GSUC1_GSUWGMRR1_GLS0_ISA942_IU1_K1_LDSTI0_LBSPPA128_LBSPPB256_LBSPPM0_LPA16_LPB32_LPM0_LRVWn1_LWPMn1_MIAV0_MIWT4_14_MO40_MGRIPM1_NTn1_NTA0_NTB0_NTC0_NTD4_NTM0_NEPBS16_NLCA1_NLCB1_ONLL1_PGR2_PLR1_PKA1_SGROB0_SIA3_SS0_SU16_SUM0_SUS256_SPO0_SRVW0_SSO0_SVW4_SK0_SKFTR0_SKXCCM0_SGRO0_TDMI0_TIN0_TLDS1_TLDSM1_ULSGRO0_USL1_USLMX0_UIOFGRO0_UPLRP0_USFGROn1_USI0_VSn1_VWA2_VWB2_WSGRA0_WSGRB0_WS64_WG64_4_1_WGM1_WGMXCC1_WGMXCCGn1
    SolutionIndex: 79
    SolutionNameMin: Cijk_Alik_Bljk_F8NSS_BH_Bias_FDMN_SPAML0_A_S_SAV_MT256x224x128_MI16x16x1_SN_LDSB1_AFC1_AG0_AFEM1_AFEM1_ASEM8_CLR1_CADS0_DTLA0_DTLB0_DTVA0_DTVB0_DTVMXSA0_DTVMXSB0_DTVSM0_DPLB0_EPS1_ELFLR0_EMLLn1_FDSI0_GRPM1_GRVWA16_GRVWB16_GSUn1_GSUAMBSK_GSUC1_GSUWGMRR1_GLS0_ISA942_IU1_K1_LDSTI0_LBSPPA128_LBSPPB128_LBSPPM0_LPA16_LPB32_LPM0_LRVWn1_LWPMn1_MIAV0_MIWT8_7_MO40_MGRIPM1_NTn1_NTA0_NTB0_NTC0_NTD4_NTM0_NEPBS16_NLCA1_NLCB1_ONLL1_PGR2_PLR1_PKA1_SGROB0_SIA3_SS0_SU16_SUM0_SUS256_SPO0_SRVW0_SSO0_SVW4_SK0_SKFTR0_SKXCCM0_SGRO0_TDMI0_TIN0_TLDS1_TLDSM1_ULSGRO0_USL1_USLMX0_UIOFGRO0_UPLRP0_USFGROn1_USI0_VSn1_VWA2_VWB1_WSGRA0_WSGRB0_WS64_WG32_8_1_WGM1_WGMXCC1_WGMXCCGn1
    SolutionIndex: 80
    SolutionNameMin: Cijk_Alik_Bljk_F8NSS_BH_Bias_FDMN_SPAML0_A_S_SAV_MT256x160x128_MI16x16x1_SN_LDSB1_AFC1_AG0_AFEM1_AFEM1_ASEM8_CLR1_CADS0_DTLA0_DTLB0_DTVA0_DTVB0_DTVMXSA0_DTVMXSB0_DTVSM0_DPLB0_EPS1_ELFLR0_EMLLn1_FDSI0_GRPM1_GRVWA16_GRVWB16_GSUn1_GSUAMBSK_GSUC1_GSUWGMRR1_GLS0_ISA942_IU1_K1_LDSTI0_LBSPPA128_LBSPPB256_LBSPPM0_LPA16_LPB32_LPM0_LRVWn1_LWPMn1_MIAV0_MIWT4_10_MO40_MGRIPM1_NTn1_NTA0_NTB0_NTC0_NTD4_NTM0_NEPBS16_NLCA1_NLCB1_ONLL1_PGR2_PLR1_PKA1_SGROB0_SIA3_SS0_SU16_SUM0_SUS256_SPO0_SRVW0_SSO0_SVW4_SK0_SKFTR0_SKXCCM0_SGRO0_TDMI0_TIN0_TLDS1_TLDSM1_ULSGRO0_USL1_USLMX0_UIOFGRO0_UPLRP0_USFGROn1_USI0_VSn1_VWA2_VWB2_WSGRA0_WSGRB0_WS64_WG64_4_1_WGM1_WGMXCC1_WGMXCCGn1
    SolutionIndex: 81
    SolutionNameMin: Cijk_Alik_Bljk_F8NSS_BH_Bias_FDMN_SPAML0_A_S_SAV_MT320x160x128_MI16x16x1_SN_LDSB1_AFC1_AG0_AFEM1_AFEM1_ASEM8_CLR1_CADS0_DTLA0_DTLB0_DTVA0_DTVB0_DTVMXSA0_DTVMXSB0_DTVSM0_DPLB0_EPS1_ELFLR0_EMLLn1_FDSI0_GRPM1_GRVWA16_GRVWB16_GSUn1_GSUAMBSK_GSUC1_GSUWGMRR1_GLS0_ISA942_IU1_K1_LDSTI0_LBSPPA128_LBSPPB256_LBSPPM0_LPA16_LPB32_LPM0_LRVWn1_LWPMn1_MIAV0_MIWT5_10_MO40_MGRIPM1_NTn1_NTA0_NTB0_NTC0_NTD4_NTM0_NEPBS16_NLCA1_NLCB1_ONLL1_PGR2_PLR1_PKA1_SGROB0_SIA3_SS0_SU16_SUM0_SUS256_SPO0_SRVW0_SSO0_SVW4_SK0_SKFTR0_SKXCCM0_SGRO0_TDMI0_TIN0_TLDS1_TLDSM1_ULSGRO0_USL1_USLMX0_UIOFGRO0_UPLRP0_USFGROn1_USI0_VSn1_VWA1_VWB2_WSGRA0_WSGRB0_WS64_WG64_4_1_WGM8_WGMXCC8_WGMXCCGn1
    SolutionIndex: 82
    SolutionNameMin: Cijk_Alik_Bljk_F8NSS_BH_Bias_FDMN_SPAML0_A_S_SAV_MT96x160x256_MI16x16x1_SN_LDSB1_AFC1_AG0_AFEM1_AFEM1_ASEM8_CLR1_CADS0_DTLA0_DTLB0_DTVA0_DTVB0_DTVMXSA0_DTVMXSB0_DTVSM0_DPLB0_EPS1_ELFLR0_EMLLn1_FDSI0_GRPM1_GRVWA8_GRVWB16_GSUn1_GSUAMBSK_GSUC1_GSUWGMRR1_GLS0_ISA942_IU1_K1_LDSTI0_LBSPPA128_LBSPPB256_LBSPPM0_LPA8_LPB32_LPM0_LRVWn1_LWPMn1_MIAV0_MIWT3_5_MO40_MGRIPM1_NTn1_NTA0_NTB0_NTC0_NTD4_NTM0_NEPBS16_NLCA1_NLCB1_ONLL1_PGR2_PLR1_PKA1_SGROB0_SIA3_SS0_SU16_SUM0_SUS256_SPO0_SRVW0_SSO0_SVW4_SK0_SKFTR0_SKXCCM0_SGRO0_TDMI0_TIN0_TLDS1_TLDSM1_ULSGRO0_USL1_USLMX0_UIOFGRO0_UPLRP0_USFGROn1_USI0_VSn1_VWA1_VWB1_WSGRA0_WSGRB0_WS64_WG32_8_1_WGM8_WGMXCC8_WGMXCCGn1
    SolutionIndex: 83
    SolutionNameMin: Cijk_Alik_Bljk_F8NSS_BH_Bias_FDMN_SPAML0_A_S_SAV_MT128x288x128_MI16x16x1_SN_LDSB1_AFC1_AG0_AFEM1_AFEM1_ASEM8_CLR1_CADS0_DTLA0_DTLB0_DTVA0_DTVB0_DTVMXSA0_DTVMXSB0_DTVSM0_DPLB0_EPS1_ELFLR0_EMLLn1_FDSI0_GRPM1_GRVWA16_GRVWB16_GSUn1_GSUAMBSK_GSUC1_GSUWGMRR1_GLS0_ISA942_IU1_K1_LDSTI0_LBSPPA128_LBSPPB128_LBSPPM0_LPA16_LPB32_LPM0_LRVWn1_LWPMn1_MIAV0_MIWT4_9_MO40_MGRIPM1_NTn1_NTA0_NTB0_NTC0_NTD4_NTM0_NEPBS16_NLCA1_NLCB1_ONLL1_PGR2_PLR1_PKA1_SGROB0_SIA3_SS0_SU16_SUM0_SUS256_SPO0_SRVW0_SSO0_SVW4_SK0_SKFTR0_SKXCCM0_SGRO0_TDMI0_TIN0_TLDS1_TLDSM1_ULSGRO0_USL1_USLMX0_UIOFGRO0_UPLRP0_USFGROn1_USI0_VSn1_VWA2_VWB1_WSGRA0_WSGRB0_WS64_WG32_8_1_WGM8_WGMXCC8_WGMXCCGn1
    SolutionIndex: 84
    SolutionNameMin: Cijk_Alik_Bljk_F8NSS_BH_Bias_FDMN_SPAML0_A_S_SAV_MT192x192x128_MI16x16x1_SN_LDSB1_AFC1_AG0_AFEM1_AFEM1_ASEM8_CLR1_CADS0_DTLA0_DTLB0_DTVA0_DTVB0_DTVMXSA0_DTVMXSB0_DTVSM0_DPLB0_EPS1_ELFLR0_EMLLn1_FDSI0_GRPM1_GRVWA16_GRVWB16_GSUn1_GSUAMBSK_GSUC1_GSUWGMRR1_GLS0_ISA942_IU1_K1_LDSTI0_LBSPPA128_LBSPPB512_LBSPPM0_LPA16_LPB32_LPM0_LRVWn1_LWPMn1_MIAV0_MIWT3_12_MO40_MGRIPM1_NTn1_NTA0_NTB0_NTC0_NTD4_NTM0_NEPBS16_NLCA1_NLCB1_ONLL1_PGR2_PLR1_PKA1_SGROB0_SIA3_SS0_SU16_SUM0_SUS256_SPO0_SRVW0_SSO0_SVW4_SK0_SKFTR0_SKXCCM0_SGRO0_TDMI0_TIN0_TLDS1_TLDSM1_ULSGRO0_USL1_USLMX0_UIOFGRO0_UPLRP0_USFGROn1_USI0_VSn1_VWA1_VWB4_WSGRA0_WSGRB0_WS64_WG64_4_1_WGM1_WGMXCC1_WGMXCCGn1
    SolutionIndex: 85
    SolutionNameMin: Cijk_Alik_Bljk_F8NSS_BH_Bias_FDMN_SPAML0_A_S_SAV_MT112x128x256_MI16x16x1_SN_LDSB1_AFC1_AG0_AFEM1_AFEM1_ASEM8_CLR1_CADS0_DTLA0_DTLB0_DTVA0_DTVB0_DTVMXSA0_DTVMXSB0_DTVSM0_DPLB0_EPS1_ELFLR0_EMLLn1_FDSI0_GRPM1_GRVWA8_GRVWB16_GSUn1_GSUAMBSK_GSUC1_GSUWGMRR1_GLS0_ISA942_IU1_K1_LDSTI0_LBSPPA128_LBSPPB512_LBSPPM0_LPA8_LPB32_LPM0_LRVWn1_LWPMn1_MIAV0_MIWT7_2_MO40_MGRIPM1_NTn1_NTA0_NTB0_NTC0_NTD4_NTM0_NEPBS16_NLCA1_NLCB1_ONLL1_PGR2_PLR1_PKA1_SGROB0_SIA3_SS0_SU16_SUM0_SUS256_SPO0_SRVW0_SSO0_SVW4_SK0_SKFTR0_SKXCCM0_SGRO0_TDMI0_TIN0_TLDS1_TLDSM1_ULSGRO0_USL1_USLMX0_UIOFGRO0_UPLRP0_USFGROn1_USI0_VSn1_VWA1_VWB2_WSGRA0_WSGRB0_WS64_WG16_16_1_WGM8_WGMXCC8_WGMXCCGn1
    SolutionIndex: 86
    SolutionNameMin: Cijk_Alik_Bljk_F8NSS_BH_Bias_FDMN_SPAML0_A_S_SAV_MT256x160x128_MI16x16x1_SN_LDSB1_AFC1_AG0_AFEM1_AFEM1_ASEM8_CLR1_CADS0_DTLA0_DTLB0_DTVA0_DTVB0_DTVMXSA0_DTVMXSB0_DTVSM0_DPLB0_EPS1_ELFLR0_EMLLn1_FDSI0_GRPM1_GRVWA16_GRVWB16_GSUn1_GSUAMBSK_GSUC1_GSUWGMRR1_GLS0_ISA942_IU1_K1_LDSTI0_LBSPPA128_LBSPPB256_LBSPPM0_LPA16_LPB32_LPM0_LRVWn1_LWPMn1_MIAV0_MIWT4_10_MO40_MGRIPM1_NTn1_NTA0_NTB0_NTC0_NTD4_NTM0_NEPBS16_NLCA1_NLCB1_ONLL1_PGR2_PLR1_PKA1_SGROB0_SIA3_SS0_SU16_SUM0_SUS256_SPO0_SRVW0_SSO0_SVW4_SK0_SKFTR0_SKXCCM0_SGRO0_TDMI0_TIN0_TLDS1_TLDSM1_ULSGRO0_USL1_USLMX0_UIOFGRO0_UPLRP0_USFGROn1_USI0_VSn1_VWA2_VWB2_WSGRA0_WSGRB0_WS64_WG64_4_1_WGM8_WGMXCC8_WGMXCCGn1
    SolutionIndex: 87
    SolutionNameMin: Cijk_Alik_Bljk_F8NSS_BH_Bias_FDMN_SPAML0_A_S_SAV_MT32x32x256_MI16x16x1_SN_LDSB0_AFC1_AG0_AFEM1_AFEM1_ASEM8_CLR1_CADS0_DTLA0_DTLB0_DTVA0_DTVB0_DTVMXSA0_DTVMXSB0_DTVSM0_DPLB0_EPS1_ELFLR0_EMLLn1_FDSI0_GRPM1_GRVWA8_GRVWB4_GSUn1_GSUAMBSK_GSUC1_GSUWGMRR1_GLS0_ISA942_IU1_K1_LDSTI0_LBSPPA128_LBSPPB256_LBSPPM0_LPA8_LPB32_LPM0_LRVWn1_LWPMn1_MIAV0_MIWT1_1_MO40_MGRIPM1_NTn1_NTA0_NTB0_NTC0_NTD4_NTM0_NEPBS16_NLCA1_NLCB1_ONLL1_PGR2_PLR1_PKA1_SGROB0_SIA3_SS0_SU16_SUM0_SUS256_SPO0_SRVW0_SSO0_SVW4_SK0_SKFTR0_SKXCCM0_SGRO0_TDMI0_TIN0_TLDS1_TLDSM1_ULSGRO0_USL1_USLMX0_UIOFGRO0_UPLRP0_USFGROn1_USI0_VSn1_VWA1_VWB1_WSGRA0_WSGRB0_WS64_WG32_8_1_WGM8_WGMXCC8_WGMXCCGn1
    SolutionIndex: 88
    SolutionNameMin: Cijk_Alik_Bljk_F8NSS_BH_Bias_FDMN_SPAML0_A_S_SAV_MT16x64x256_MI16x16x1_SN_LDSB1_AFC1_AG0_AFEM1_AFEM1_ASEM8_CLR1_CADS0_DTLA0_DTLB0_DTVA0_DTVB0_DTVMXSA0_DTVMXSB0_DTVSM0_DPLB0_EPS1_ELFLR0_EMLLn1_FDSI0_GRPM1_GRVWA8_GRVWB16_GSUn1_GSUAMBSK_GSUC1_GSUWGMRR1_GLS0_ISA942_IU1_K1_LDSTI0_LBSPPA128_LBSPPB256_LBSPPM0_LPA8_LPB32_LPM0_LRVWn1_LWPMn1_MIAV0_MIWT1_1_MO40_MGRIPM1_NTn1_NTA0_NTB0_NTC0_NTD4_NTM0_NEPBS16_NLCA1_NLCB1_ONLL1_PGR2_PLR1_PKA1_SGROB0_SIA3_SS0_SU16_SUM0_SUS256_SPO0_SRVW0_SSO0_SVW4_SK0_SKFTR0_SKXCCM0_SGRO0_TDMI0_TIN0_TLDS1_TLDSM1_ULSGRO0_USL1_USLMX0_UIOFGRO0_UPLRP0_USFGROn1_USI0_VSn1_VWA1_VWB1_WSGRA0_WSGRB0_WS64_WG16_16_1_WGM1_WGMXCC1_WGMXCCGn1
    SolutionIndex: 89
    SolutionNameMin: Cijk_Alik_Bljk_F8NSS_BH_Bias_FDMN_SPAML0_A_S_SAV_MT32x96x128_MI16x16x1_SN_LDSB1_AFC1_AG0_AFEM1_AFEM1_ASEM8_CLR1_CADS0_DTLA0_DTLB0_DTVA0_DTVB0_DTVMXSA0_DTVMXSB0_DTVSM0_DPLB0_EPS1_ELFLR0_EMLLn1_FDSI0_GRPM1_GRVWA8_GRVWB16_GSUn1_GSUAMBSK_GSUC1_GSUWGMRR1_GLS0_ISA942_IU1_K1_LDSTI0_LBSPPA128_LBSPPB128_LBSPPM0_LPA8_LPB32_LPM0_LRVWn1_LWPMn1_MIAV0_MIWT1_3_MO40_MGRIPM1_NTn1_NTA0_NTB0_NTC0_NTD4_NTM0_NEPBS16_NLCA1_NLCB1_ONLL1_PGR2_PLR1_PKA1_SGROB0_SIA3_SS0_SU16_SUM0_SUS256_SPO0_SRVW0_SSO0_SVW4_SK0_SKFTR0_SKXCCM0_SGRO0_TDMI0_TIN0_TLDS1_TLDSM1_ULSGRO0_USL1_USLMX0_UIOFGRO0_UPLRP0_USFGROn1_USI0_VSn1_VWA1_VWB1_WSGRA0_WSGRB0_WS64_WG32_8_1_WGM8_WGMXCC8_WGMXCCGn1
    SolutionIndex: 90
    SolutionNameMin: Cijk_Alik_Bljk_F8NSS_BH_Bias_FDMN_SPAML0_A_S_SAV_MT32x96x128_MI16x16x1_SN_LDSB1_AFC1_AG0_AFEM1_AFEM1_ASEM8_CLR1_CADS0_DTLA0_DTLB0_DTVA0_DTVB0_DTVMXSA0_DTVMXSB0_DTVSM0_DPLB0_EPS1_ELFLR0_EMLLn1_FDSI0_GRPM1_GRVWA8_GRVWB16_GSUn1_GSUAMBSK_GSUC1_GSUWGMRR1_GLS0_ISA942_IU1_K1_LDSTI0_LBSPPA128_LBSPPB128_LBSPPM0_LPA8_LPB32_LPM0_LRVWn1_LWPMn1_MIAV0_MIWT1_3_MO40_MGRIPM1_NTn1_NTA0_NTB0_NTC0_NTD4_NTM0_NEPBS16_NLCA1_NLCB1_ONLL1_PGR2_PLR1_PKA1_SGROB0_SIA3_SS0_SU16_SUM0_SUS256_SPO0_SRVW0_SSO0_SVW4_SK0_SKFTR0_SKXCCM0_SGRO0_TDMI0_TIN0_TLDS1_TLDSM1_ULSGRO0_USL1_USLMX0_UIOFGRO0_UPLRP0_USFGROn1_USI0_VSn1_VWA1_VWB1_WSGRA0_WSGRB0_WS64_WG32_8_1_WGM1_WGMXCC1_WGMXCCGn1
    SolutionIndex: 91
    SolutionNameMin: Cijk_Alik_Bljk_F8NSS_BH_Bias_FDMN_SPAML0_A_S_SAV_MT256x224x128_MI16x16x1_SN_LDSB1_AFC1_AG0_AFEM1_AFEM1_ASEM8_CLR1_CADS0_DTLA0_DTLB0_DTVA0_DTVB0_DTVMXSA0_DTVMXSB0_DTVSM0_DPLB0_EPS1_ELFLR0_EMLLn1_FDSI0_GRPM1_GRVWA16_GRVWB16_GSUn1_GSUAMBSK_GSUC1_GSUWGMRR1_GLS0_ISA942_IU1_K1_LDSTI0_LBSPPA128_LBSPPB256_LBSPPM0_LPA16_LPB32_LPM0_LRVWn1_LWPMn1_MIAV0_MIWT4_14_MO40_MGRIPM1_NTn1_NTA0_NTB0_NTC0_NTD4_NTM0_NEPBS16_NLCA1_NLCB1_ONLL1_PGR2_PLR1_PKA1_SGROB0_SIA3_SS0_SU16_SUM0_SUS256_SPO0_SRVW0_SSO0_SVW4_SK0_SKFTR0_SKXCCM0_SGRO0_TDMI0_TIN0_TLDS1_TLDSM1_ULSGRO0_USL1_USLMX0_UIOFGRO0_UPLRP0_USFGROn1_USI0_VSn1_VWA2_VWB2_WSGRA0_WSGRB0_WS64_WG64_4_1_WGM8_WGMXCC8_WGMXCCGn1
    SolutionIndex: 92
    SolutionNameMin: Cijk_Alik_Bljk_F8NSS_BH_Bias_FDMN_SPAML0_A_S_SAV_MT256x192x128_MI16x16x1_SN_LDSB1_AFC1_AG0_AFEM1_AFEM1_ASEM8_CLR1_CADS0_DTLA0_DTLB0_DTVA0_DTVB0_DTVMXSA0_DTVMXSB0_DTVSM0_DPLB0_EPS1_ELFLR0_EMLLn1_FDSI0_GRPM1_GRVWA8_GRVWB16_GSUn1_GSUAMBSK_GSUC1_GSUWGMRR1_GLS0_ISA942_IU1_K1_LDSTI0_LBSPPA128_LBSPPB512_LBSPPM0_LPA8_LPB32_LPM0_LRVWn1_LWPMn1_MIAV0_MIWT4_12_MO40_MGRIPM1_NTn1_NTA0_NTB0_NTC0_NTD4_NTM0_NEPBS16_NLCA1_NLCB1_ONLL1_PGR2_PLR1_PKA1_SGROB0_SIA3_SS0_SU16_SUM0_SUS256_SPO0_SRVW0_SSO0_SVW4_SK0_SKFTR0_SKXCCM0_SGRO0_TDMI0_TIN0_TLDS1_TLDSM1_ULSGRO0_USL1_USLMX0_UIOFGRO0_UPLRP0_USFGROn1_USI0_VSn1_VWA2_VWB4_WSGRA0_WSGRB0_WS64_WG64_4_1_WGM8_WGMXCC8_WGMXCCGn1
    SolutionIndex: 93
    SolutionNameMin: Cijk_Alik_Bljk_F8NSS_BH_Bias_FDMN_SPAML0_A_S_SAV_MT256x192x128_MI16x16x1_SN_LDSB1_AFC1_AG0_AFEM1_AFEM1_ASEM8_CLR1_CADS0_DTLA0_DTLB0_DTVA0_DTVB0_DTVMXSA0_DTVMXSB0_DTVSM0_DPLB0_EPS1_ELFLR0_EMLLn1_FDSI0_GRPM1_GRVWA8_GRVWB16_GSUn1_GSUAMBSK_GSUC1_GSUWGMRR1_GLS0_ISA942_IU1_K1_LDSTI0_LBSPPA128_LBSPPB256_LBSPPM0_LPA8_LPB32_LPM0_LRVWn1_LWPMn1_MIAV0_MIWT8_6_MO40_MGRIPM1_NTn1_NTA0_NTB0_NTC0_NTD4_NTM0_NEPBS16_NLCA1_NLCB1_ONLL1_PGR2_PLR1_PKA1_SGROB0_SIA3_SS0_SU16_SUM0_SUS256_SPO0_SRVW0_SSO0_SVW4_SK0_SKFTR0_SKXCCM0_SGRO0_TDMI0_TIN0_TLDS1_TLDSM1_ULSGRO0_USL1_USLMX0_UIOFGRO0_UPLRP0_USFGROn1_USI0_VSn1_VWA2_VWB2_WSGRA0_WSGRB0_WS64_WG32_8_1_WGM8_WGMXCC8_WGMXCCGn1
    SolutionIndex: 94
    SolutionNameMin: Cijk_Alik_Bljk_F8NSS_BH_Bias_FDMN_SPAML0_A_S_SAV_MT64x144x256_MI16x16x1_SN_LDSB1_AFC1_AG0_AFEM1_AFEM1_ASEM8_CLR1_CADS0_DTLA0_DTLB0_DTVA0_DTVB0_DTVMXSA0_DTVMXSB0_DTVSM0_DPLB0_EPS1_ELFLR0_EMLLn1_FDSI0_GRPM1_GRVWA16_GRVWB4_GSUn1_GSUAMBSK_GSUC1_GSUWGMRR1_GLS0_ISA942_IU1_K1_LDSTI0_LBSPPA128_LBSPPB256_LBSPPM0_LPA16_LPB32_LPM0_LRVWn1_LWPMn1_MIAV0_MIWT1_9_MO40_MGRIPM1_NTn1_NTA0_NTB0_NTC0_NTD4_NTM0_NEPBS16_NLCA1_NLCB1_ONLL1_PGR2_PLR1_PKA1_SGROB0_SIA3_SS0_SU16_SUM0_SUS256_SPO0_SRVW0_SSO0_SVW4_SK0_SKFTR0_SKXCCM0_SGRO0_TDMI0_TIN0_TLDS1_TLDSM1_ULSGRO0_USL1_USLMX0_UIOFGRO0_UPLRP0_USFGROn1_USI0_VSn1_VWA1_VWB1_WSGRA0_WSGRB0_WS64_WG64_4_1_WGM1_WGMXCC1_WGMXCCGn1
    SolutionIndex: 95
    SolutionNameMin: Cijk_Alik_Bljk_F8NSS_BH_Bias_FDMN_SPAML0_A_S_SAV_MT64x224x128_MI16x16x1_SN_LDSB1_AFC1_AG0_AFEM1_AFEM1_ASEM8_CLR1_CADS0_DTLA0_DTLB0_DTVA0_DTVB0_DTVMXSA0_DTVMXSB0_DTVSM0_DPLB0_EPS1_ELFLR0_EMLLn1_FDSI0_GRPM1_GRVWA16_GRVWB16_GSUn1_GSUAMBSK_GSUC1_GSUWGMRR1_GLS0_ISA942_IU1_K1_LDSTI0_LBSPPA128_LBSPPB128_LBSPPM0_LPA16_LPB32_LPM0_LRVWn1_LWPMn1_MIAV0_MIWT2_7_MO40_MGRIPM1_NTn1_NTA0_NTB0_NTC0_NTD4_NTM0_NEPBS16_NLCA1_NLCB1_ONLL1_PGR2_PLR1_PKA1_SGROB0_SIA3_SS0_SU16_SUM0_SUS256_SPO0_SRVW0_SSO0_SVW4_SK0_SKFTR0_SKXCCM0_SGRO0_TDMI0_TIN0_TLDS1_TLDSM1_ULSGRO0_USL1_USLMX0_UIOFGRO0_UPLRP0_USFGROn1_USI0_VSn1_VWA2_VWB1_WSGRA0_WSGRB0_WS64_WG32_8_1_WGM8_WGMXCC8_WGMXCCGn1
    SolutionIndex: 96
    SolutionNameMin: Cijk_Alik_Bljk_F8NSS_BH_Bias_FDMN_SPAML0_A_S_SAV_MT64x144x256_MI16x16x1_SN_LDSB1_AFC1_AG0_AFEM1_AFEM1_ASEM8_CLR1_CADS0_DTLA0_DTLB0_DTVA0_DTVB0_DTVMXSA0_DTVMXSB0_DTVSM0_DPLB0_EPS1_ELFLR0_EMLLn1_FDSI0_GRPM1_GRVWA16_GRVWB16_GSUn1_GSUAMBSK_GSUC1_GSUWGMRR1_GLS0_ISA942_IU1_K1_LDSTI0_LBSPPA128_LBSPPB256_LBSPPM0_LPA16_LPB32_LPM0_LRVWn1_LWPMn1_MIAV0_MIWT1_9_MO40_MGRIPM1_NTn1_NTA0_NTB0_NTC0_NTD4_NTM0_NEPBS16_NLCA1_NLCB1_ONLL1_PGR2_PLR1_PKA1_SGROB0_SIA3_SS0_SU16_SUM0_SUS256_SPO0_SRVW0_SSO0_SVW4_SK0_SKFTR0_SKXCCM0_SGRO0_TDMI0_TIN0_TLDS1_TLDSM1_ULSGRO0_USL1_USLMX0_UIOFGRO0_UPLRP0_USFGROn1_USI0_VSn1_VWA1_VWB1_WSGRA0_WSGRB0_WS64_WG64_4_1_WGM1_WGMXCC1_WGMXCCGn1
    SolutionIndex: 97
    SolutionNameMin: Cijk_Alik_Bljk_F8NSS_BH_Bias_FDMN_SPAML0_A_S_SAV_MT64x144x256_MI16x16x1_SN_LDSB1_AFC1_AG0_AFEM1_AFEM1_ASEM8_CLR1_CADS0_DTLA0_DTLB0_DTVA0_DTVB0_DTVMXSA0_DTVMXSB0_DTVSM0_DPLB0_EPS1_ELFLR0_EMLLn1_FDSI0_GRPM1_GRVWA16_GRVWB16_GSUn1_GSUAMBSK_GSUC1_GSUWGMRR1_GLS0_ISA942_IU1_K1_LDSTI0_LBSPPA128_LBSPPB256_LBSPPM0_LPA16_LPB32_LPM0_LRVWn1_LWPMn1_MIAV0_MIWT1_9_MO40_MGRIPM1_NTn1_NTA0_NTB0_NTC0_NTD4_NTM0_NEPBS16_NLCA1_NLCB1_ONLL1_PGR2_PLR1_PKA1_SGROB0_SIA3_SS0_SU16_SUM0_SUS256_SPO0_SRVW0_SSO0_SVW4_SK0_SKFTR0_SKXCCM0_SGRO0_TDMI0_TIN0_TLDS1_TLDSM1_ULSGRO0_USL1_USLMX0_UIOFGRO0_UPLRP0_USFGROn1_USI0_VSn1_VWA1_VWB1_WSGRA0_WSGRB0_WS64_WG64_4_1_WGM8_WGMXCC8_WGMXCCGn1
    SolutionIndex: 98
    SolutionNameMin: Cijk_Alik_Bljk_F8NSS_BH_Bias_FDMN_SPAML0_A_S_SAV_MT32x160x256_MI16x16x1_SN_LDSB1_AFC1_AG0_AFEM1_AFEM1_ASEM8_CLR1_CADS0_DTLA0_DTLB0_DTVA0_DTVB0_DTVMXSA0_DTVMXSB0_DTVSM0_DPLB0_EPS1_ELFLR0_EMLLn1_FDSI0_GRPM1_GRVWA16_GRVWB16_GSUn1_GSUAMBSK_GSUC1_GSUWGMRR1_GLS0_ISA942_IU1_K1_LDSTI0_LBSPPA128_LBSPPB256_LBSPPM0_LPA16_LPB32_LPM0_LRVWn1_LWPMn1_MIAV0_MIWT1_5_MO40_MGRIPM1_NTn1_NTA0_NTB0_NTC0_NTD4_NTM0_NEPBS16_NLCA1_NLCB1_ONLL1_PGR2_PLR1_PKA1_SGROB0_SIA3_SS0_SU16_SUM0_SUS256_SPO0_SRVW0_SSO0_SVW4_SK0_SKFTR0_SKXCCM0_SGRO0_TDMI0_TIN0_TLDS1_TLDSM1_ULSGRO0_USL1_USLMX0_UIOFGRO0_UPLRP0_USFGROn1_USI0_VSn1_VWA1_VWB1_WSGRA0_WSGRB0_WS64_WG32_8_1_WGM1_WGMXCC1_WGMXCCGn1
- - - [10752, 10240, 1, 512]
    - [2, 267.42]
  - - [9216, 10752, 1, 512]
    - [3, 263.96]
  - - [10240, 11264, 1, 512]
    - [5, 262.34]
  - - [9216, 17664, 1, 512]
    - [4, 278.09]
  - - [25600, 19968, 1, 512]
    - [1, 286.24]
  - - [25600, 20736, 1, 512]
    - [0, 281.93]
  - - [21504, 5120, 1, 512]
    - [2, 265.18]
  - - [13312, 7168, 1, 512]
    - [6, 252.97]
  - - [21504, 23040, 1, 512]
    - [2, 288.99]
  - - [24576, 4864, 1, 512]
    - [4, 269.01]
  - - [22528, 4352, 1, 512]
    - [7, 255.79]
  - - [90112, 800, 1, 512]
    - [7, 234.58]
  - - [23296, 4096, 1, 512]
    - [2, 258.13]
  - - [25600, 3840, 1, 512]
    - [8, 253.18]
  - - [21504, 4352, 1, 512]
    - [2, 258.63]
  - - [21760, 4352, 1, 512]
    - [8, 250.87]
  - - [53504, 1728, 1, 512]
    - [1, 249.87]
  - - [26624, 3584, 1, 512]
    - [8, 246.45]
  - - [43008, 2304, 1, 512]
    - [2, 261.53]
  - - [37632, 2432, 1, 512]
    - [9, 253.4]
  - - [4096, 131072, 1, 512]
    - [4, 261.44]
  - - [992, 42240, 1, 512]
    - [10, 198.5]
  - - [512, 100352, 1, 512]
    - [11, 172.87]
  - - [480, 119040, 1, 512]
    - [12, 232.2]
  - - [2304, 76032, 1, 512]
    - [13, 270.91]
  - - [2048, 70400, 1, 512]
    - [14, 239.01]
  - - [608, 131072, 1, 512]
    - [15, 202.71]
  - - [432, 126976, 1, 512]
    - [16, 168.9]
  - - [608, 69888, 1, 512]
    - [15, 178.36]
  - - [496, 82432, 1, 512]
    - [17, 183.14]
  - - [272, 100352, 1, 512]
    - [18, 125.17]
  - - [240, 122880, 1, 512]
    - [19, 155.09]
  - - [416, 49152, 1, 512]
    - [20, 208.96]
  - - [240, 126976, 1, 512]
    - [19, 157.48]
  - - [240, 102400, 1, 512]
    - [19, 158.68]
  - - [272, 98304, 1, 512]
    - [19, 124.28]
  - - [400, 93184, 1, 512]
    - [21, 194.7]
  - - [240, 103168, 1, 512]
    - [19, 156.2]
  - - [272, 99840, 1, 512]
    - [22, 125.14]
  - - [400, 92160, 1, 512]
    - [21, 196.6]
  - - [16, 16, 1, 512]
    - [23, 0.03]
  - - [7680, 16896, 1, 2048]
    - [1, 536.8]
  - - [9984, 7936, 1, 2048]
    - [24, 495.93]
  - - [12800, 6144, 1, 2048]
    - [2, 499.79]
  - - [16128, 16128, 1, 2048]
    - [2, 548.87]
  - - [6656, 19968, 1, 2048]
    - [2, 512.05]
  - - [32768, 13824, 1, 2048]
    - [25, 539.09]
  - - [7936, 9984, 1, 2048]
    - [2, 493.38]
  - - [8192, 8960, 1, 2048]
    - [26, 496.36]
  - - [5376, 16640, 1, 2048]
    - [4, 514.35]
  - - [8960, 5632, 1, 2048]
    - [2, 515.09]
  - - [47872, 992, 1, 2048]
    - [27, 481.2]
  - - [83200, 736, 1, 2048]
    - [27, 485.63]
  - - [96768, 608, 1, 2048]
    - [28, 460.92]
  - - [25344, 2816, 1, 2048]
    - [29, 509.95]
  - - [59392, 1152, 1, 2048]
    - [30, 515.63]
  - - [46592, 1536, 1, 2048]
    - [31, 503.4]
  - - [43520, 1792, 1, 2048]
    - [29, 517.8]
  - - [90112, 496, 1, 2048]
    - [27, 466.09]
  - - [47872, 1856, 1, 2048]
    - [32, 489.4]
  - - [61952, 1024, 1, 2048]
    - [27, 495.85]
  - - [3968, 14592, 1, 2048]
    - [18, 448.92]
  - - [2688, 33792, 1, 2048]
    - [31, 501.42]
  - - [768, 69632, 1, 2048]
    - [32, 451.02]
  - - [576, 103168, 1, 2048]
    - [15, 432.52]
  - - [768, 66816, 1, 2048]
    - [33, 466.02]
  - - [768, 76800, 1, 2048]
    - [34, 446.75]
  - - [512, 99840, 1, 2048]
    - [35, 340.62]
  - - [480, 107520, 1, 2048]
    - [17, 400.51]
  - - [4096, 25088, 1, 2048]
    - [36, 482.4]
  - - [1984, 41216, 1, 2048]
    - [17, 441.11]
  - - [69888, 432, 1, 2048]
    - [17, 425.56]
  - - [5120, 4352, 1, 2048]
    - [5, 459.72]
  - - [272, 77824, 1, 2048]
    - [2, 263.19]
  - - [53248, 704, 1, 2048]
    - [37, 449.35]
  - - [14592, 1792, 1, 2048]
    - [33, 473.75]
  - - [26624, 864, 1, 2048]
    - [38, 417.05]
  - - [34048, 1024, 1, 2048]
    - [27, 522.06]
  - - [52224, 512, 1, 2048]
    - [15, 468.87]
  - - [29184, 896, 1, 2048]
    - [39, 479.89]
  - - [1216, 17664, 1, 2048]
    - [40, 380.83]
  - - [50688, 320, 1, 2048]
    - [32, 468.74]
  - - [33792, 448, 1, 2048]
    - [7, 435.46]
  - - [160, 115200, 1, 2048]
    - [41, 298.49]
  - - [1280, 13312, 1, 2048]
    - [25, 471.52]
  - - [16896, 928, 1, 2048]
    - [7, 444.87]
  - - [736, 19712, 1, 2048]
    - [9, 360.26]
  - - [128, 115200, 1, 2048]
    - [42, 239.03]
  - - [60928, 256, 1, 2048]
    - [27, 469.3]
  - - [30720, 464, 1, 2048]
    - [43, 372.46]
  - - [128, 114688, 1, 2048]
    - [42, 239.72]
  - - [128, 103680, 1, 2048]
    - [44, 233.61]
  - - [128, 103936, 1, 2048]
    - [45, 231.89]
  - - [128, 96512, 1, 2048]
    - [46, 233.16]
  - - [128, 103168, 1, 2048]
    - [47, 232.24]
  - - [128, 100352, 1, 2048]
    - [47, 230.23]
  - - [96, 111360, 1, 2048]
    - [48, 225.82]
  - - [96, 115200, 1, 2048]
    - [49, 227.92]
  - - [128, 96000, 1, 2048]
    - [50, 233.46]
  - - [128, 99840, 1, 2048]
    - [51, 230.81]
  - - [128, 102400, 1, 2048]
    - [47, 230.5]
  - - [1024, 1024, 1, 2048]
    - [52, 192.15]
  - - [7424, 7936, 1, 4096]
    - [2, 559.27]
  - - [6144, 11264, 1, 4096]
    - [25, 567.49]
  - - [8960, 8960, 1, 4096]
    - [2, 578.86]
  - - [4608, 15872, 1, 4096]
    - [26, 578.11]
  - - [8960, 6656, 1, 4096]
    - [18, 582.84]
  - - [9984, 7936, 1, 4096]
    - [24, 570.53]
  - - [5376, 14336, 1, 4096]
    - [9, 582.07]
  - - [4608, 19712, 1, 4096]
    - [26, 581.0]
  - - [4608, 16640, 1, 4096]
    - [26, 587.36]
  - - [12288, 4864, 1, 4096]
    - [4, 584.97]
  - - [62208, 1024, 1, 4096]
    - [27, 607.48]
  - - [29696, 2304, 1, 4096]
    - [2, 577.36]
  - - [19200, 2816, 1, 4096]
    - [53, 586.78]
  - - [20736, 2816, 1, 4096]
    - [4, 576.9]
  - - [96512, 496, 1, 4096]
    - [27, 585.58]
  - - [24320, 2304, 1, 4096]
    - [1, 598.22]
  - - [50176, 992, 1, 4096]
    - [27, 605.27]
  - - [45056, 1216, 1, 4096]
    - [27, 563.51]
  - - [28160, 2048, 1, 4096]
    - [54, 546.1]
  - - [17664, 3200, 1, 4096]
    - [4, 565.74]
  - - [3456, 20736, 1, 4096]
    - [26, 584.1]
  - - [1984, 43776, 1, 4096]
    - [31, 505.85]
  - - [768, 66560, 1, 4096]
    - [40, 503.45]
  - - [768, 73728, 1, 4096]
    - [15, 493.73]
  - - [608, 84480, 1, 4096]
    - [40, 443.27]
  - - [2048, 34048, 1, 4096]
    - [26, 543.9]
  - - [768, 94208, 1, 4096]
    - [32, 511.99]
  - - [448, 100352, 1, 4096]
    - [27, 464.02]
  - - [3072, 23808, 1, 4096]
    - [55, 550.1]
  - - [992, 64768, 1, 4096]
    - [40, 467.94]
  - - [19456, 1472, 1, 4096]
    - [14, 535.49]
  - - [96512, 240, 1, 4096]
    - [12, 546.38]
  - - [7936, 3072, 1, 4096]
    - [5, 548.25]
  - - [16128, 1472, 1, 4096]
    - [22, 548.88]
  - - [736, 28672, 1, 4096]
    - [56, 424.87]
  - - [1024, 36864, 1, 4096]
    - [57, 476.21]
  - - [192, 119040, 1, 4096]
    - [15, 368.69]
  - - [31744, 736, 1, 4096]
    - [12, 530.19]
  - - [352, 111104, 1, 4096]
    - [58, 412.89]
  - - [15872, 1472, 1, 4096]
    - [12, 537.67]
  - - [1728, 8448, 1, 4096]
    - [14, 541.6]
  - - [192, 76544, 1, 4096]
    - [59, 347.24]
  - - [256, 70400, 1, 4096]
    - [60, 366.55]
  - - [192, 75264, 1, 4096]
    - [59, 342.04]
  - - [192, 77824, 1, 4096]
    - [15, 348.11]
  - - [128, 107520, 1, 4096]
    - [47, 275.19]
  - - [192, 76800, 1, 4096]
    - [61, 344.75]
  - - [144, 103168, 1, 4096]
    - [62, 260.27]
  - - [192, 73728, 1, 4096]
    - [15, 336.92]
  - - [192, 76032, 1, 4096]
    - [59, 344.2]
  - - [128, 96000, 1, 4096]
    - [46, 247.43]
  - - [128, 103168, 1, 4096]
    - [47, 248.66]
  - - [128, 103680, 1, 4096]
    - [47, 248.18]
  - - [128, 103936, 1, 4096]
    - [47, 249.32]
  - - [5888, 1856, 1, 4096]
    - [56, 490.25]
  - - [128, 96768, 1, 4096]
    - [46, 247.17]
  - - [128, 89856, 1, 4096]
    - [46, 243.41]
  - - [128, 96512, 1, 4096]
    - [63, 247.57]
  - - [128, 100352, 1, 4096]
    - [47, 246.48]
  - - [96, 111360, 1, 4096]
    - [64, 203.62]
  - - [16, 88320, 1, 4096]
    - [65, 46.91]
  - - [32, 90112, 1, 4096]
    - [66, 86.56]
  - - [48, 64768, 1, 4096]
    - [67, 112.06]
  - - [16, 65280, 1, 4096]
    - [65, 43.51]
  - - [16, 70400, 1, 4096]
    - [65, 45.04]
  - - [32, 73728, 1, 4096]
    - [66, 83.97]
  - - [16, 79360, 1, 4096]
    - [65, 45.22]
  - - [16, 81664, 1, 4096]
    - [65, 45.73]
  - - [16, 81920, 1, 4096]
    - [65, 45.81]
  - - [32, 86016, 1, 4096]
    - [66, 85.38]
  - - [4608, 12544, 1, 8192]
    - [26, 663.3]
  - - [4608, 14848, 1, 8192]
    - [36, 622.27]
  - - [7936, 7424, 1, 8192]
    - [68, 626.28]
  - - [12800, 4608, 1, 8192]
    - [68, 649.34]
  - - [5376, 10752, 1, 8192]
    - [9, 664.22]
  - - [6400, 12288, 1, 8192]
    - [69, 635.3]
  - - [4608, 15360, 1, 8192]
    - [36, 629.71]
  - - [12288, 19712, 1, 8192]
    - [27, 659.74]
  - - [9984, 8192, 1, 8192]
    - [24, 648.92]
  - - [4864, 12288, 1, 8192]
    - [31, 635.68]
  - - [32256, 1600, 1, 8192]
    - [32, 659.1]
  - - [38400, 1536, 1, 8192]
    - [15, 665.33]
  - - [46080, 1280, 1, 8192]
    - [15, 674.9]
  - - [24320, 2304, 1, 8192]
    - [70, 650.54]
  - - [42240, 1280, 1, 8192]
    - [32, 677.36]
  - - [23296, 2304, 1, 8192]
    - [9, 635.74]
  - - [53760, 1024, 1, 8192]
    - [15, 619.88]
  - - [44544, 1280, 1, 8192]
    - [15, 661.03]
  - - [33280, 1600, 1, 8192]
    - [32, 668.72]
  - - [32256, 1728, 1, 8192]
    - [30, 674.87]
  - - [2048, 36864, 1, 8192]
    - [71, 627.8]
  - - [768, 71680, 1, 8192]
    - [32, 568.76]
  - - [1280, 44544, 1, 8192]
    - [71, 595.05]
  - - [2304, 25600, 1, 8192]
    - [71, 606.76]
  - - [768, 72960, 1, 8192]
    - [32, 584.18]
  - - [1984, 35328, 1, 8192]
    - [31, 586.7]
  - - [1472, 46080, 1, 8192]
    - [70, 580.54]
  - - [768, 66560, 1, 8192]
    - [40, 555.71]
  - - [768, 76800, 1, 8192]
    - [71, 574.57]
  - - [1536, 38400, 1, 8192]
    - [69, 620.9]
  - - [288, 78848, 1, 8192]
    - [72, 434.06]
  - - [400, 78848, 1, 8192]
    - [30, 410.94]
  - - [320, 89856, 1, 8192]
    - [73, 464.42]
  - - [78848, 480, 1, 8192]
    - [15, 529.29]
  - - [768, 47616, 1, 8192]
    - [32, 575.23]
  - - [34048, 928, 1, 8192]
    - [27, 636.79]
  - - [14080, 2688, 1, 8192]
    - [40, 624.5]
  - - [47872, 704, 1, 8192]
    - [70, 619.69]
  - - [48384, 736, 1, 8192]
    - [70, 647.98]
  - - [37632, 992, 1, 8192]
    - [57, 607.61]
  - - [240, 70656, 1, 8192]
    - [74, 332.66]
  - - [47104, 304, 1, 8192]
    - [75, 569.22]
  - - [384, 50176, 1, 8192]
    - [55, 453.61]
  - - [10240, 1856, 1, 8192]
    - [76, 553.5]
  - - [512, 37632, 1, 8192]
    - [57, 495.41]
  - - [256, 62208, 1, 8192]
    - [77, 448.51]
  - - [256, 64768, 1, 8192]
    - [78, 456.87]
  - - [256, 59136, 1, 8192]
    - [79, 427.25]
  - - [256, 65536, 1, 8192]
    - [60, 446.74]
  - - [8448, 2176, 1, 8192]
    - [29, 624.21]
  - - [256, 39168, 1, 8192]
    - [80, 414.71]
  - - [320, 41472, 1, 8192]
    - [81, 454.09]
  - - [176, 69120, 1, 8192]
    - [82, 299.43]
  - - [51968, 256, 1, 8192]
    - [34, 534.97]
  - - [192, 66816, 1, 8192]
    - [39, 422.03]
  - - [128, 82944, 1, 8192]
    - [83, 336.96]
  - - [192, 56576, 1, 8192]
    - [84, 414.94]
  - - [112, 96768, 1, 8192]
    - [85, 255.15]
  - - [112, 96000, 1, 8192]
    - [85, 255.42]
  - - [512, 19968, 1, 8192]
    - [86, 441.57]
  - - [32, 59136, 1, 8192]
    - [87, 89.45]
  - - [16, 55552, 1, 8192]
    - [88, 48.67]
  - - [16, 52992, 1, 8192]
    - [88, 49.03]
  - - [32, 51968, 1, 8192]
    - [89, 89.63]
  - - [32, 52224, 1, 8192]
    - [90, 90.17]
  - - [32, 46080, 1, 8192]
    - [90, 88.44]
  - - [16, 48384, 1, 8192]
    - [88, 47.07]
  - - [32, 59904, 1, 8192]
    - [87, 88.71]
  - - [32, 59392, 1, 8192]
    - [87, 88.5]
  - - [16, 49152, 1, 8192]
    - [88, 47.86]
  - - [8192, 1792, 1, 32768]
    - [15, 706.84]
  - - [29440, 512, 1, 32768]
    - [27, 584.95]
  - - [6400, 2560, 1, 32768]
    - [27, 709.75]
  - - [5376, 2816, 1, 32768]
    - [27, 676.61]
  - - [3968, 4096, 1, 32768]
    - [27, 698.84]
  - - [3584, 4608, 1, 32768]
    - [27, 697.08]
  - - [28160, 512, 1, 32768]
    - [15, 603.0]
  - - [1792, 9216, 1, 32768]
    - [91, 659.85]
  - - [9216, 1472, 1, 32768]
    - [15, 653.31]
  - - [3840, 4096, 1, 32768]
    - [27, 679.44]
  - - [29696, 416, 1, 32768]
    - [31, 531.27]
  - - [25344, 496, 1, 32768]
    - [92, 534.12]
  - - [7680, 1408, 1, 32768]
    - [12, 642.7]
  - - [19712, 608, 1, 32768]
    - [75, 533.92]
  - - [640, 16128, 1, 32768]
    - [17, 537.12]
  - - [23808, 496, 1, 32768]
    - [5, 529.08]
  - - [30464, 432, 1, 32768]
    - [31, 533.1]
  - - [9216, 1280, 1, 32768]
    - [12, 666.02]
  - - [5376, 2304, 1, 32768]
    - [56, 705.17]
  - - [4352, 2944, 1, 32768]
    - [93, 659.2]
  - - [48, 131072, 1, 32768]
    - [94, 163.43]
  - - [64, 131072, 1, 32768]
    - [95, 220.6]
  - - [48, 126976, 1, 32768]
    - [96, 163.43]
  - - [64, 126976, 1, 32768]
    - [95, 217.72]
  - - [64, 122880, 1, 32768]
    - [97, 216.11]
  - - [48, 122880, 1, 32768]
    - [96, 162.61]
  - - [64, 119040, 1, 32768]
    - [96, 214.63]
  - - [48, 119040, 1, 32768]
    - [96, 161.07]
  - - [32, 131072, 1, 32768]
    - [98, 115.35]
  - - [48, 118784, 1, 32768]
    - [96, 161.11]
- null
- null
- DeviceEfficiency
- GridBased
