projects/hipsparselt/library/src/hcc_detail/rocsparselt/src/spmm/Tensile/Logic/asm_full/aquavanjaram/gfx942/GridBased/aquavanjaram_Cijk_Ailk_Bljk_F8NSS_BH_Bias_FDMN_SPAML0_A_S_SAV.yaml
- {MinimumRequiredVersion: 5.0.0}
- aquavanjaram
- gfx942
- [Device 0049, Device 0050]
    SolutionIndex: 0
    SolutionNameMin: Cijk_Ailk_Bljk_F8NSS_BH_Bias_FDMN_SPAML0_A_S_SAV_MT192x320x64_MI16x16x1_SN_LDSB0_AFC1_AG0_AFEM1_AFEM1_ASEM8_CLR0_CADS0_DTLA0_DTLB0_DTVA0_DTVB0_DTVMXSA0_DTVMXSB0_DTVSM0_DPLB0_EPS1_ELFLR0_EMLLn1_FDSI0_GRPM1_GRVWA8_GRVWB16_GSUn1_GSUAMBSK_GSUC1_GSUWGMRR1_GLS0_ISA942_IU1_K1_LDSTI0_LBSPPA3072_LBSPPB256_LBSPPM0_LPA16_LPB32_LPM0_LRVWn1_LWPMn1_MIAV0_MIWT3_20_MO40_MGRIPM1_NTn1_NTA0_NTB0_NTC0_NTD4_NTM0_NEPBS16_NLCA3_NLCB1_ONLL1_PGR2_PLR0_PKA1_SGROB0_SIA3_SS0_SU16_SUM0_SUS256_SPO0_SRVW0_SSO0_SVW4_SK0_SKFTR0_SKXCCM0_SGRO0_TDMI0_TIN0_TLDS1_TLDSM1_ULSGRO0_USL1_USLMX0_UIOFGRO0_UPLRP0_USFGROn1_USI0_VSn1_VWA1_VWB4_WSGRA0_WSGRB0_WS64_WG64_4_1_WGM1_WGMXCC1_WGMXCCGn1
    SolutionIndex: 1
    SolutionNameMin: Cijk_Ailk_Bljk_F8NSS_BH_Bias_FDMN_SPAML0_A_S_SAV_MT320x160x128_MI16x16x1_SN_LDSB1_AFC1_AG0_AFEM1_AFEM1_ASEM8_CLR1_CADS0_DTLA0_DTLB0_DTVA0_DTVB0_DTVMXSA0_DTVMXSB0_DTVSM0_DPLB0_EPS1_ELFLR0_EMLLn1_FDSI0_GRPM1_GRVWA16_GRVWB16_GSUn1_GSUAMBSK_GSUC1_GSUWGMRR1_GLS0_ISA942_IU1_K1_LDSTI0_LBSPPA5120_LBSPPB256_LBSPPM0_LPA16_LPB32_LPM0_LRVWn1_LWPMn1_MIAV0_MIWT5_10_MO40_MGRIPM1_NTn1_NTA0_NTB0_NTC0_NTD4_NTM0_NEPBS16_NLCA5_NLCB1_ONLL1_PGR2_PLR1_PKA1_SGROB0_SIA3_SS0_SU16_SUM0_SUS256_SPO0_SRVW0_SSO0_SVW4_SK0_SKFTR0_SKXCCM0_SGRO0_TDMI0_TIN0_TLDS1_TLDSM1_ULSGRO0_USL1_USLMX0_UIOFGRO0_UPLRP0_USFGROn1_USI0_VSn1_VWA1_VWB2_WSGRA0_WSGRB0_WS64_WG64_4_1_WGM1_WGMXCC1_WGMXCCGn1
    SolutionIndex: 2
    SolutionNameMin: Cijk_Ailk_Bljk_F8NSS_BH_Bias_FDMN_SPAML0_A_S_SAV_MT192x256x128_MI16x16x1_SN_LDSB1_AFC1_AG0_AFEM1_AFEM1_ASEM8_CLR1_CADS0_DTLA0_DTLB0_DTVA0_DTVB0_DTVMXSA0_DTVMXSB0_DTVSM0_DPLB0_EPS1_ELFLR0_EMLLn1_FDSI0_GRPM1_GRVWA16_GRVWB16_GSUn1_GSUAMBSK_GSUC1_GSUWGMRR1_GLS0_ISA942_IU1_K1_LDSTI0_LBSPPA3072_LBSPPB2048_LBSPPM0_LPA16_LPB32_LPM0_LRVWn1_LWPMn1_MIAV0_MIWT3_16_MO40_MGRIPM1_NTn1_NTA0_NTB0_NTC0_NTD4_NTM0_NEPBS16_NLCA3_NLCB1_ONLL1_PGR2_PLR1_PKA1_SGROB0_SIA3_SS0_SU16_SUM0_SUS256_SPO0_SRVW0_SSO0_SVW4_SK0_SKFTR0_SKXCCM0_SGRO0_TDMI0_TIN0_TLDS1_TLDSM1_ULSGRO0_USL1_USLMX0_UIOFGRO0_UPLRP0_USFGROn1_USI0_VSn1_VWA1_VWB16_WSGRA0_WSGRB0_WS64_WG64_4_1_WGM1_WGMXCC1_WGMXCCGn1
    SolutionIndex: 3
    SolutionNameMin: Cijk_Ailk_Bljk_F8NSS_BH_Bias_FDMN_SPAML0_A_S_SAV_MT192x160x64_MI16x16x1_SN_LDSB1_AFC1_AG0_AFEM1_AFEM1_ASEM8_CLR0_CADS0_DTLA0_DTLB0_DTVA0_DTVB0_DTVMXSA0_DTVMXSB0_DTVSM0_DPLB0_EPS1_ELFLR0_EMLLn1_FDSI0_GRPM1_GRVWA8_GRVWB4_GSUn1_GSUAMBSK_GSUC1_GSUWGMRR1_GLS0_ISA942_IU1_K1_LDSTI0_LBSPPA3072_LBSPPB128_LBSPPM0_LPA16_LPB32_LPM0_LRVWn1_LWPMn1_MIAV0_MIWT3_10_MO40_MGRIPM1_NTn1_NTA0_NTB0_NTC0_NTD4_NTM0_NEPBS16_NLCA3_NLCB1_ONLL1_PGR2_PLR0_PKA1_SGROB0_SIA3_SS0_SU16_SUM0_SUS256_SPO0_SRVW0_SSO0_SVW4_SK0_SKFTR0_SKXCCM0_SGRO0_TDMI0_TIN0_TLDS1_TLDSM1_ULSGRO0_USL1_USLMX0_UIOFGRO0_UPLRP0_USFGROn1_USI0_VSn1_VWA1_VWB2_WSGRA0_WSGRB0_WS64_WG64_4_1_WGM1_WGMXCC1_WGMXCCGn1
    SolutionIndex: 4
    SolutionNameMin: Cijk_Ailk_Bljk_F8NSS_BH_Bias_FDMN_SPAML0_A_S_SAV_MT192x160x64_MI16x16x1_SN_LDSB1_AFC1_AG0_AFEM1_AFEM1_ASEM8_CLR0_CADS0_DTLA0_DTLB0_DTVA0_DTVB0_DTVMXSA0_DTVMXSB0_DTVSM0_DPLB0_EPS1_ELFLR0_EMLLn1_FDSI0_GRPM1_GRVWA8_GRVWB4_GSUn1_GSUAMBSK_GSUC1_GSUWGMRR1_GLS0_ISA942_IU1_K1_LDSTI0_LBSPPA3072_LBSPPB128_LBSPPM0_LPA16_LPB32_LPM0_LRVWn1_LWPMn1_MIAV0_MIWT3_10_MO40_MGRIPM1_NTn1_NTA0_NTB0_NTC0_NTD4_NTM0_NEPBS16_NLCA3_NLCB1_ONLL1_PGR2_PLR0_PKA1_SGROB0_SIA3_SS0_SU16_SUM0_SUS256_SPO0_SRVW0_SSO0_SVW4_SK0_SKFTR0_SKXCCM0_SGRO0_TDMI0_TIN0_TLDS1_TLDSM1_ULSGRO0_USL1_USLMX0_UIOFGRO0_UPLRP0_USFGROn1_USI0_VSn1_VWA1_VWB2_WSGRA0_WSGRB0_WS64_WG64_4_1_WGM8_WGMXCC8_WGMXCCGn1
    SolutionIndex: 5
    SolutionNameMin: Cijk_Ailk_Bljk_F8NSS_BH_Bias_FDMN_SPAML0_A_S_SAV_MT192x128x64_MI16x16x1_SN_LDSB1_AFC1_AG0_AFEM1_AFEM1_ASEM8_CLR0_CADS0_DTLA0_DTLB0_DTVA0_DTVB0_DTVMXSA0_DTVMXSB0_DTVSM0_DPLB0_EPS1_ELFLR0_EMLLn1_FDSI0_GRPM1_GRVWA8_GRVWB16_GSUn1_GSUAMBSK_GSUC1_GSUWGMRR1_GLS0_ISA942_IU1_K1_LDSTI0_LBSPPA3072_LBSPPB512_LBSPPM0_LPA16_LPB32_LPM0_LRVWn1_LWPMn1_MIAV0_MIWT3_8_MO40_MGRIPM1_NTn1_NTA0_NTB0_NTC0_NTD4_NTM0_NEPBS16_NLCA3_NLCB1_ONLL1_PGR2_PLR0_PKA1_SGROB0_SIA3_SS0_SU16_SUM0_SUS256_SPO0_SRVW0_SSO0_SVW4_SK0_SKFTR0_SKXCCM0_SGRO0_TDMI0_TIN0_TLDS1_TLDSM1_ULSGRO0_USL1_USLMX0_UIOFGRO0_UPLRP0_USFGROn1_USI0_VSn1_VWA1_VWB8_WSGRA0_WSGRB0_WS64_WG64_4_1_WGM8_WGMXCC8_WGMXCCGn1
    SolutionIndex: 6
    SolutionNameMin: Cijk_Ailk_Bljk_F8NSS_BH_Bias_FDMN_SPAML0_A_S_SAV_MT192x128x64_MI16x16x1_SN_LDSB1_AFC1_AG0_AFEM1_AFEM1_ASEM8_CLR0_CADS0_DTLA0_DTLB0_DTVA0_DTVB0_DTVMXSA0_DTVMXSB0_DTVSM0_DPLB0_EPS1_ELFLR0_EMLLn1_FDSI0_GRPM1_GRVWA8_GRVWB16_GSUn1_GSUAMBSK_GSUC1_GSUWGMRR1_GLS0_ISA942_IU1_K1_LDSTI0_LBSPPA3072_LBSPPB512_LBSPPM0_LPA16_LPB32_LPM0_LRVWn1_LWPMn1_MIAV0_MIWT3_8_MO40_MGRIPM1_NTn1_NTA0_NTB0_NTC0_NTD4_NTM0_NEPBS16_NLCA3_NLCB1_ONLL1_PGR2_PLR0_PKA1_SGROB0_SIA3_SS0_SU16_SUM0_SUS256_SPO0_SRVW0_SSO0_SVW4_SK0_SKFTR0_SKXCCM0_SGRO0_TDMI0_TIN0_TLDS1_TLDSM1_ULSGRO0_USL1_USLMX0_UIOFGRO0_UPLRP0_USFGROn1_USI0_VSn1_VWA1_VWB8_WSGRA0_WSGRB0_WS64_WG64_4_1_WGM1_WGMXCC1_WGMXCCGn1
    SolutionIndex: 7
    SolutionNameMin: Cijk_Ailk_Bljk_F8NSS_BH_Bias_FDMN_SPAML0_A_S_SAV_MT192x144x64_MI16x16x1_SN_LDSB1_AFC1_AG0_AFEM1_AFEM1_ASEM8_CLR0_CADS0_DTLA0_DTLB0_DTVA0_DTVB0_DTVMXSA0_DTVMXSB0_DTVSM0_DPLB0_EPS1_ELFLR0_EMLLn1_FDSI0_GRPM1_GRVWA8_GRVWB4_GSUn1_GSUAMBSK_GSUC1_GSUWGMRR1_GLS0_ISA942_IU1_K1_LDSTI0_LBSPPA3072_LBSPPB128_LBSPPM0_LPA16_LPB32_LPM0_LRVWn1_LWPMn1_MIAV0_MIWT3_9_MO40_MGRIPM1_NTn1_NTA0_NTB0_NTC0_NTD4_NTM0_NEPBS16_NLCA3_NLCB1_ONLL1_PGR2_PLR0_PKA1_SGROB0_SIA3_SS0_SU16_SUM0_SUS256_SPO0_SRVW0_SSO0_SVW4_SK0_SKFTR0_SKXCCM0_SGRO0_TDMI0_TIN0_TLDS1_TLDSM1_ULSGRO0_USL1_USLMX0_UIOFGRO0_UPLRP0_USFGROn1_USI0_VSn1_VWA1_VWB1_WSGRA0_WSGRB0_WS64_WG64_4_1_WGM8_WGMXCC8_WGMXCCGn1
    SolutionIndex: 8
    SolutionNameMin: Cijk_Ailk_Bljk_F8NSS_BH_Bias_FDMN_SPAML0_A_S_SAV_MT192x224x128_MI16x16x1_SN_LDSB1_AFC1_AG0_AFEM1_AFEM1_ASEM8_CLR1_CADS0_DTLA0_DTLB0_DTVA0_DTVB0_DTVMXSA0_DTVMXSB0_DTVSM0_DPLB0_EPS1_ELFLR0_EMLLn1_FDSI0_GRPM1_GRVWA16_GRVWB16_GSUn1_GSUAMBSK_GSUC1_GSUWGMRR1_GLS0_ISA942_IU1_K1_LDSTI0_LBSPPA3072_LBSPPB256_LBSPPM0_LPA16_LPB32_LPM0_LRVWn1_LWPMn1_MIAV0_MIWT3_14_MO40_MGRIPM1_NTn1_NTA0_NTB0_NTC0_NTD4_NTM0_NEPBS16_NLCA3_NLCB1_ONLL1_PGR2_PLR1_PKA1_SGROB0_SIA3_SS0_SU16_SUM0_SUS256_SPO0_SRVW0_SSO0_SVW4_SK0_SKFTR0_SKXCCM0_SGRO0_TDMI0_TIN0_TLDS1_TLDSM1_ULSGRO0_USL1_USLMX0_UIOFGRO0_UPLRP0_USFGROn1_USI0_VSn1_VWA1_VWB2_WSGRA0_WSGRB0_WS64_WG64_4_1_WGM1_WGMXCC1_WGMXCCGn1
    SolutionIndex: 9
    SolutionNameMin: Cijk_Ailk_Bljk_F8NSS_BH_Bias_FDMN_SPAML0_A_S_SAV_MT160x256x128_MI16x16x1_SN_LDSB1_AFC1_AG0_AFEM1_AFEM1_ASEM8_CLR1_CADS0_DTLA0_DTLB0_DTVA0_DTVB0_DTVMXSA0_DTVMXSB0_DTVSM0_DPLB0_EPS1_ELFLR0_EMLLn1_FDSI0_GRPM1_GRVWA8_GRVWB16_GSUn1_GSUAMBSK_GSUC1_GSUWGMRR1_GLS0_ISA942_IU1_K1_LDSTI0_LBSPPA2560_LBSPPB1024_LBSPPM0_LPA16_LPB32_LPM0_LRVWn1_LWPMn1_MIAV0_MIWT5_8_MO40_MGRIPM1_NTn1_NTA0_NTB0_NTC0_NTD4_NTM0_NEPBS16_NLCA5_NLCB1_ONLL1_PGR2_PLR1_PKA1_SGROB0_SIA3_SS0_SU16_SUM0_SUS256_SPO0_SRVW0_SSO0_SVW4_SK0_SKFTR0_SKXCCM0_SGRO0_TDMI0_TIN0_TLDS1_TLDSM1_ULSGRO0_USL1_USLMX0_UIOFGRO0_UPLRP0_USFGROn1_USI0_VSn1_VWA1_VWB8_WSGRA0_WSGRB0_WS64_WG32_8_1_WGM8_WGMXCC8_WGMXCCGn1
    SolutionIndex: 10
    SolutionNameMin: Cijk_Ailk_Bljk_F8NSS_BH_Bias_FDMN_SPAML0_A_S_SAV_MT192x256x128_MI16x16x1_SN_LDSB1_AFC1_AG0_AFEM1_AFEM1_ASEM8_CLR1_CADS0_DTLA0_DTLB0_DTVA0_DTVB0_DTVMXSA0_DTVMXSB0_DTVSM0_DPLB0_EPS1_ELFLR0_EMLLn1_FDSI0_GRPM1_GRVWA16_GRVWB16_GSUn1_GSUAMBSK_GSUC1_GSUWGMRR1_GLS0_ISA942_IU1_K1_LDSTI0_LBSPPA3072_LBSPPB2048_LBSPPM0_LPA16_LPB32_LPM0_LRVWn1_LWPMn1_MIAV0_MIWT3_16_MO40_MGRIPM1_NTn1_NTA0_NTB0_NTC0_NTD4_NTM0_NEPBS16_NLCA3_NLCB1_ONLL1_PGR2_PLR1_PKA1_SGROB0_SIA3_SS0_SU16_SUM0_SUS256_SPO0_SRVW0_SSO0_SVW4_SK0_SKFTR0_SKXCCM0_SGRO0_TDMI0_TIN0_TLDS1_TLDSM1_ULSGRO0_USL1_USLMX0_UIOFGRO0_UPLRP0_USFGROn1_USI0_VSn1_VWA1_VWB16_WSGRA0_WSGRB0_WS64_WG64_4_1_WGM8_WGMXCC8_WGMXCCGn1
    SolutionIndex: 11
    SolutionNameMin: Cijk_Ailk_Bljk_F8NSS_BH_Bias_FDMN_SPAML0_A_S_SAV_MT224x192x128_MI16x16x1_SN_LDSB1_AFC1_AG0_AFEM1_AFEM1_ASEM8_CLR1_CADS0_DTLA0_DTLB0_DTVA0_DTVB0_DTVMXSA0_DTVMXSB0_DTVSM0_DPLB0_EPS1_ELFLR0_EMLLn1_FDSI0_GRPM1_GRVWA8_GRVWB16_GSUn1_GSUAMBSK_GSUC1_GSUWGMRR1_GLS0_ISA942_IU1_K1_LDSTI0_LBSPPA3584_LBSPPB256_LBSPPM0_LPA16_LPB32_LPM0_LRVWn1_LWPMn1_MIAV0_MIWT7_6_MO40_MGRIPM1_NTn1_NTA0_NTB0_NTC0_NTD4_NTM0_NEPBS16_NLCA7_NLCB1_ONLL1_PGR2_PLR1_PKA1_SGROB0_SIA3_SS0_SU16_SUM0_SUS256_SPO0_SRVW0_SSO0_SVW4_SK0_SKFTR0_SKXCCM0_SGRO0_TDMI0_TIN0_TLDS1_TLDSM1_ULSGRO0_USL1_USLMX0_UIOFGRO0_UPLRP0_USFGROn1_USI0_VSn1_VWA1_VWB2_WSGRA0_WSGRB0_WS64_WG32_8_1_WGM8_WGMXCC8_WGMXCCGn1
    SolutionIndex: 12
    SolutionNameMin: Cijk_Ailk_Bljk_F8NSS_BH_Bias_FDMN_SPAML0_A_S_SAV_MT192x208x128_MI16x16x1_SN_LDSB1_AFC1_AG0_AFEM1_AFEM1_ASEM8_CLR1_CADS0_DTLA0_DTLB0_DTVA0_DTVB0_DTVMXSA0_DTVMXSB0_DTVSM0_DPLB0_EPS1_ELFLR0_EMLLn1_FDSI0_GRPM1_GRVWA16_GRVWB4_GSUn1_GSUAMBSK_GSUC1_GSUWGMRR1_GLS0_ISA942_IU1_K1_LDSTI0_LBSPPA3072_LBSPPB128_LBSPPM0_LPA16_LPB32_LPM0_LRVWn1_LWPMn1_MIAV0_MIWT3_13_MO40_MGRIPM1_NTn1_NTA0_NTB0_NTC0_NTD4_NTM0_NEPBS16_NLCA3_NLCB1_ONLL1_PGR2_PLR1_PKA1_SGROB0_SIA3_SS0_SU16_SUM0_SUS256_SPO0_SRVW0_SSO0_SVW4_SK0_SKFTR0_SKXCCM0_SGRO0_TDMI0_TIN0_TLDS1_TLDSM1_ULSGRO0_USL1_USLMX0_UIOFGRO0_UPLRP0_USFGROn1_USI0_VSn1_VWA1_VWB1_WSGRA0_WSGRB0_WS64_WG64_4_1_WGM8_WGMXCC8_WGMXCCGn1
    SolutionIndex: 13
    SolutionNameMin: Cijk_Ailk_Bljk_F8NSS_BH_Bias_FDMN_SPAML0_A_S_SAV_MT160x288x128_MI16x16x1_SN_LDSB1_AFC1_AG0_AFEM1_AFEM1_ASEM8_CLR1_CADS0_DTLA0_DTLB0_DTVA0_DTVB0_DTVMXSA0_DTVMXSB0_DTVSM0_DPLB0_EPS1_ELFLR0_EMLLn1_FDSI0_GRPM1_GRVWA8_GRVWB16_GSUn1_GSUAMBSK_GSUC1_GSUWGMRR1_GLS0_ISA942_IU1_K1_LDSTI0_LBSPPA2560_LBSPPB128_LBSPPM0_LPA16_LPB32_LPM0_LRVWn1_LWPMn1_MIAV0_MIWT5_9_MO40_MGRIPM1_NTn1_NTA0_NTB0_NTC0_NTD4_NTM0_NEPBS16_NLCA5_NLCB1_ONLL1_PGR2_PLR1_PKA1_SGROB0_SIA3_SS0_SU16_SUM0_SUS256_SPO0_SRVW0_SSO0_SVW4_SK0_SKFTR0_SKXCCM0_SGRO0_TDMI0_TIN0_TLDS1_TLDSM1_ULSGRO0_USL1_USLMX0_UIOFGRO0_UPLRP0_USFGROn1_USI0_VSn1_VWA1_VWB1_WSGRA0_WSGRB0_WS64_WG32_8_1_WGM8_WGMXCC8_WGMXCCGn1
    SolutionIndex: 14
    SolutionNameMin: Cijk_Ailk_Bljk_F8NSS_BH_Bias_FDMN_SPAML0_A_S_SAV_MT128x80x128_MI16x16x1_SN_LDSB1_AFC1_AG0_AFEM1_AFEM1_ASEM8_CLR1_CADS0_DTLA0_DTLB0_DTVA0_DTVB0_DTVMXSA0_DTVMXSB0_DTVSM0_DPLB0_EPS1_ELFLR0_EMLLn1_FDSI0_GRPM1_GRVWA16_GRVWB4_GSUn1_GSUAMBSK_GSUC1_GSUWGMRR1_GLS0_ISA942_IU1_K1_LDSTI0_LBSPPA2048_LBSPPB128_LBSPPM0_LPA32_LPB32_LPM0_LRVWn1_LWPMn1_MIAV0_MIWT2_5_MO40_MGRIPM1_NTn1_NTA0_NTB0_NTC0_NTD4_NTM0_NEPBS16_NLCA1_NLCB1_ONLL1_PGR2_PLR1_PKA1_SGROB0_SIA3_SS0_SU16_SUM0_SUS256_SPO0_SRVW0_SSO0_SVW4_SK0_SKFTR0_SKXCCM0_SGRO0_TDMI0_TIN0_TLDS1_TLDSM1_ULSGRO0_USL1_USLMX0_UIOFGRO0_UPLRP0_USFGROn1_USI0_VSn1_VWA2_VWB1_WSGRA0_WSGRB0_WS64_WG64_4_1_WGM8_WGMXCC8_WGMXCCGn1
    SolutionIndex: 15
    SolutionNameMin: Cijk_Ailk_Bljk_F8NSS_BH_Bias_FDMN_SPAML0_A_S_SAV_MT192x96x128_MI16x16x1_SN_LDSB1_AFC1_AG0_AFEM1_AFEM1_ASEM8_CLR1_CADS0_DTLA0_DTLB0_DTVA0_DTVB0_DTVMXSA0_DTVMXSB0_DTVSM0_DPLB0_EPS1_ELFLR0_EMLLn1_FDSI0_GRPM1_GRVWA16_GRVWB16_GSUn1_GSUAMBSK_GSUC1_GSUWGMRR1_GLS0_ISA942_IU1_K1_LDSTI0_LBSPPA3072_LBSPPB256_LBSPPM0_LPA16_LPB32_LPM0_LRVWn1_LWPMn1_MIAV0_MIWT3_6_MO40_MGRIPM1_NTn1_NTA0_NTB0_NTC0_NTD4_NTM0_NEPBS16_NLCA3_NLCB1_ONLL1_PGR2_PLR1_PKA1_SGROB0_SIA3_SS0_SU16_SUM0_SUS256_SPO0_SRVW0_SSO0_SVW4_SK0_SKFTR0_SKXCCM0_SGRO0_TDMI0_TIN0_TLDS1_TLDSM1_ULSGRO0_USL1_USLMX0_UIOFGRO0_UPLRP0_USFGROn1_USI0_VSn1_VWA1_VWB2_WSGRA0_WSGRB0_WS64_WG64_4_1_WGM1_WGMXCC1_WGMXCCGn1
    SolutionIndex: 16
    SolutionNameMin: Cijk_Ailk_Bljk_F8NSS_BH_Bias_FDMN_SPAML0_A_S_SAV_MT192x96x128_MI16x16x1_SN_LDSB1_AFC1_AG0_AFEM1_AFEM1_ASEM8_CLR1_CADS0_DTLA0_DTLB0_DTVA0_DTVB0_DTVMXSA0_DTVMXSB0_DTVSM0_DPLB0_EPS1_ELFLR0_EMLLn1_FDSI0_GRPM1_GRVWA8_GRVWB16_GSUn1_GSUAMBSK_GSUC1_GSUWGMRR1_GLS0_ISA942_IU1_K1_LDSTI0_LBSPPA3072_LBSPPB256_LBSPPM0_LPA16_LPB32_LPM0_LRVWn1_LWPMn1_MIAV0_MIWT3_6_MO40_MGRIPM1_NTn1_NTA0_NTB0_NTC0_NTD4_NTM0_NEPBS16_NLCA3_NLCB1_ONLL1_PGR2_PLR1_PKA1_SGROB0_SIA3_SS0_SU16_SUM0_SUS256_SPO0_SRVW0_SSO0_SVW4_SK0_SKFTR0_SKXCCM0_SGRO0_TDMI0_TIN0_TLDS1_TLDSM1_ULSGRO0_USL1_USLMX0_UIOFGRO0_UPLRP0_USFGROn1_USI0_VSn1_VWA1_VWB2_WSGRA0_WSGRB0_WS64_WG64_4_1_WGM8_WGMXCC8_WGMXCCGn1
    SolutionIndex: 17
    SolutionNameMin: Cijk_Ailk_Bljk_F8NSS_BH_Bias_FDMN_SPAML0_A_S_SAV_MT128x80x128_MI16x16x1_SN_LDSB1_AFC1_AG0_AFEM1_AFEM1_ASEM8_CLR1_CADS0_DTLA0_DTLB0_DTVA0_DTVB0_DTVMXSA0_DTVMXSB0_DTVSM0_DPLB0_EPS1_ELFLR0_EMLLn1_FDSI0_GRPM1_GRVWA8_GRVWB4_GSUn1_GSUAMBSK_GSUC1_GSUWGMRR1_GLS0_ISA942_IU1_K1_LDSTI0_LBSPPA2048_LBSPPB128_LBSPPM0_LPA32_LPB32_LPM0_LRVWn1_LWPMn1_MIAV0_MIWT2_5_MO40_MGRIPM1_NTn1_NTA0_NTB0_NTC0_NTD4_NTM0_NEPBS16_NLCA1_NLCB1_ONLL1_PGR2_PLR1_PKA1_SGROB0_SIA3_SS0_SU16_SUM0_SUS256_SPO0_SRVW0_SSO0_SVW4_SK0_SKFTR0_SKXCCM0_SGRO0_TDMI0_TIN0_TLDS1_TLDSM1_ULSGRO0_USL1_USLMX0_UIOFGRO0_UPLRP0_USFGROn1_USI0_VSn1_VWA2_VWB1_WSGRA0_WSGRB0_WS64_WG64_4_1_WGM8_WGMXCC8_WGMXCCGn1
    SolutionIndex: 18
    SolutionNameMin: Cijk_Ailk_Bljk_F8NSS_BH_Bias_FDMN_SPAML0_A_S_SAV_MT192x96x128_MI16x16x1_SN_LDSB1_AFC1_AG0_AFEM1_AFEM1_ASEM8_CLR1_CADS0_DTLA0_DTLB0_DTVA0_DTVB0_DTVMXSA0_DTVMXSB0_DTVSM0_DPLB0_EPS1_ELFLR0_EMLLn1_FDSI0_GRPM1_GRVWA8_GRVWB16_GSUn1_GSUAMBSK_GSUC1_GSUWGMRR1_GLS0_ISA942_IU1_K1_LDSTI0_LBSPPA3072_LBSPPB256_LBSPPM0_LPA16_LPB32_LPM0_LRVWn1_LWPMn1_MIAV0_MIWT3_6_MO40_MGRIPM1_NTn1_NTA0_NTB0_NTC0_NTD4_NTM0_NEPBS16_NLCA3_NLCB1_ONLL1_PGR2_PLR1_PKA1_SGROB0_SIA3_SS0_SU16_SUM0_SUS256_SPO0_SRVW0_SSO0_SVW4_SK0_SKFTR0_SKXCCM0_SGRO0_TDMI0_TIN0_TLDS1_TLDSM1_ULSGRO0_USL1_USLMX0_UIOFGRO0_UPLRP0_USFGROn1_USI0_VSn1_VWA1_VWB2_WSGRA0_WSGRB0_WS64_WG64_4_1_WGM1_WGMXCC1_WGMXCCGn1
    SolutionIndex: 19
    SolutionNameMin: Cijk_Ailk_Bljk_F8NSS_BH_Bias_FDMN_SPAML0_A_S_SAV_MT192x112x64_MI16x16x1_SN_LDSB1_AFC1_AG0_AFEM1_AFEM1_ASEM8_CLR0_CADS0_DTLA0_DTLB0_DTVA0_DTVB0_DTVMXSA0_DTVMXSB0_DTVSM0_DPLB0_EPS1_ELFLR0_EMLLn1_FDSI0_GRPM1_GRVWA8_GRVWB4_GSUn1_GSUAMBSK_GSUC1_GSUWGMRR1_GLS0_ISA942_IU1_K1_LDSTI0_LBSPPA3072_LBSPPB128_LBSPPM0_LPA16_LPB32_LPM0_LRVWn1_LWPMn1_MIAV0_MIWT3_7_MO40_MGRIPM1_NTn1_NTA0_NTB0_NTC0_NTD4_NTM0_NEPBS16_NLCA3_NLCB1_ONLL1_PGR2_PLR0_PKA1_SGROB0_SIA3_SS0_SU16_SUM0_SUS256_SPO0_SRVW0_SSO0_SVW4_SK0_SKFTR0_SKXCCM0_SGRO0_TDMI0_TIN0_TLDS1_TLDSM1_ULSGRO0_USL1_USLMX0_UIOFGRO0_UPLRP0_USFGROn1_USI0_VSn1_VWA1_VWB1_WSGRA0_WSGRB0_WS64_WG64_4_1_WGM8_WGMXCC8_WGMXCCGn1
    SolutionIndex: 20
    SolutionNameMin: Cijk_Ailk_Bljk_F8NSS_BH_Bias_FDMN_SPAML0_A_S_SAV_MT16x16x256_MI16x16x1_SN_LDSB0_AFC1_AG0_AFEM1_AFEM1_ASEM8_CLR1_CADS0_DTLA0_DTLB0_DTVA0_DTVB0_DTVMXSA0_DTVMXSB0_DTVSM0_DPLB0_EPS1_ELFLR0_EMLLn1_FDSI0_GRPM1_GRVWA16_GRVWB16_GSUn1_GSUAMBSK_GSUC1_GSUWGMRR1_GLS0_ISA942_IU1_K1_LDSTI0_LBSPPA256_LBSPPB256_LBSPPM0_LPA16_LPB32_LPM0_LRVWn1_LWPMn1_MIAV0_MIWT1_1_MO40_MGRIPM1_NTn1_NTA0_NTB0_NTC0_NTD4_NTM0_NEPBS16_NLCA1_NLCB1_ONLL1_PGR2_PLR1_PKA1_SGROB0_SIA3_SS0_SU16_SUM0_SUS256_SPO0_SRVW0_SSO0_SVW4_SK0_SKFTR0_SKXCCM0_SGRO0_TDMI0_TIN0_TLDS1_TLDSM1_ULSGRO0_USL1_USLMX0_UIOFGRO0_UPLRP0_USFGROn1_USI0_VSn1_VWA1_VWB1_WSGRA0_WSGRB0_WS64_WG16_4_1_WGM1_WGMXCC1_WGMXCCGn1
    SolutionIndex: 21
    SolutionNameMin: Cijk_Ailk_Bljk_F8NSS_BH_Bias_FDMN_SPAML0_A_S_SAV_MT192x256x128_MI16x16x1_SN_LDSB1_AFC1_AG0_AFEM1_AFEM1_ASEM8_CLR1_CADS0_DTLA0_DTLB0_DTVA0_DTVB0_DTVMXSA0_DTVMXSB0_DTVSM0_DPLB0_EPS1_ELFLR0_EMLLn1_FDSI0_GRPM1_GRVWA8_GRVWB16_GSUn1_GSUAMBSK_GSUC1_GSUWGMRR1_GLS0_ISA942_IU1_K1_LDSTI0_LBSPPA3072_LBSPPB2048_LBSPPM0_LPA16_LPB32_LPM0_LRVWn1_LWPMn1_MIAV0_MIWT3_16_MO40_MGRIPM1_NTn1_NTA0_NTB0_NTC0_NTD4_NTM0_NEPBS16_NLCA3_NLCB1_ONLL1_PGR2_PLR1_PKA1_SGROB0_SIA3_SS0_SU16_SUM0_SUS256_SPO0_SRVW0_SSO0_SVW4_SK0_SKFTR0_SKXCCM0_SGRO0_TDMI0_TIN0_TLDS1_TLDSM1_ULSGRO0_USL1_USLMX0_UIOFGRO0_UPLRP0_USFGROn1_USI0_VSn1_VWA1_VWB16_WSGRA0_WSGRB0_WS64_WG64_4_1_WGM1_WGMXCC1_WGMXCCGn1
    SolutionIndex: 22
    SolutionNameMin: Cijk_Ailk_Bljk_F8NSS_BH_Bias_FDMN_SPAML0_A_S_SAV_MT320x160x128_MI16x16x1_SN_LDSB1_AFC1_AG0_AFEM1_AFEM1_ASEM8_CLR1_CADS0_DTLA0_DTLB0_DTVA0_DTVB0_DTVMXSA0_DTVMXSB0_DTVSM0_DPLB0_EPS1_ELFLR0_EMLLn1_FDSI0_GRPM1_GRVWA8_GRVWB16_GSUn1_GSUAMBSK_GSUC1_GSUWGMRR1_GLS0_ISA942_IU1_K1_LDSTI0_LBSPPA5120_LBSPPB256_LBSPPM0_LPA16_LPB32_LPM0_LRVWn1_LWPMn1_MIAV0_MIWT5_10_MO40_MGRIPM1_NTn1_NTA0_NTB0_NTC0_NTD4_NTM0_NEPBS16_NLCA5_NLCB1_ONLL1_PGR2_PLR1_PKA1_SGROB0_SIA3_SS0_SU16_SUM0_SUS256_SPO0_SRVW0_SSO0_SVW4_SK0_SKFTR0_SKXCCM0_SGRO0_TDMI0_TIN0_TLDS1_TLDSM1_ULSGRO0_USL1_USLMX0_UIOFGRO0_UPLRP0_USFGROn1_USI0_VSn1_VWA1_VWB2_WSGRA0_WSGRB0_WS64_WG64_4_1_WGM8_WGMXCC8_WGMXCCGn1
    SolutionIndex: 23
    SolutionNameMin: Cijk_Ailk_Bljk_F8NSS_BH_Bias_FDMN_SPAML0_A_S_SAV_MT320x160x128_MI16x16x1_SN_LDSB1_AFC1_AG0_AFEM1_AFEM1_ASEM8_CLR1_CADS0_DTLA0_DTLB0_DTVA0_DTVB0_DTVMXSA0_DTVMXSB0_DTVSM0_DPLB0_EPS1_ELFLR0_EMLLn1_FDSI0_GRPM1_GRVWA16_GRVWB16_GSUn1_GSUAMBSK_GSUC1_GSUWGMRR1_GLS0_ISA942_IU1_K1_LDSTI0_LBSPPA5120_LBSPPB256_LBSPPM0_LPA16_LPB32_LPM0_LRVWn1_LWPMn1_MIAV0_MIWT5_10_MO40_MGRIPM1_NTn1_NTA0_NTB0_NTC0_NTD4_NTM0_NEPBS16_NLCA5_NLCB1_ONLL1_PGR2_PLR1_PKA1_SGROB0_SIA3_SS0_SU16_SUM0_SUS256_SPO0_SRVW0_SSO0_SVW4_SK0_SKFTR0_SKXCCM0_SGRO0_TDMI0_TIN0_TLDS1_TLDSM1_ULSGRO0_USL1_USLMX0_UIOFGRO0_UPLRP0_USFGROn1_USI0_VSn1_VWA1_VWB2_WSGRA0_WSGRB0_WS64_WG64_4_1_WGM8_WGMXCC8_WGMXCCGn1
    SolutionIndex: 24
    SolutionNameMin: Cijk_Ailk_Bljk_F8NSS_BH_Bias_FDMN_SPAML0_A_S_SAV_MT192x224x128_MI16x16x1_SN_LDSB1_AFC1_AG0_AFEM1_AFEM1_ASEM8_CLR1_CADS0_DTLA0_DTLB0_DTVA0_DTVB0_DTVMXSA0_DTVMXSB0_DTVSM0_DPLB0_EPS1_ELFLR0_EMLLn1_FDSI0_GRPM1_GRVWA16_GRVWB16_GSUn1_GSUAMBSK_GSUC1_GSUWGMRR1_GLS0_ISA942_IU1_K1_LDSTI0_LBSPPA3072_LBSPPB256_LBSPPM0_LPA16_LPB32_LPM0_LRVWn1_LWPMn1_MIAV0_MIWT3_14_MO40_MGRIPM1_NTn1_NTA0_NTB0_NTC0_NTD4_NTM0_NEPBS16_NLCA3_NLCB1_ONLL1_PGR2_PLR1_PKA1_SGROB0_SIA3_SS0_SU16_SUM0_SUS256_SPO0_SRVW0_SSO0_SVW4_SK0_SKFTR0_SKXCCM0_SGRO0_TDMI0_TIN0_TLDS1_TLDSM1_ULSGRO0_USL1_USLMX0_UIOFGRO0_UPLRP0_USFGROn1_USI0_VSn1_VWA1_VWB2_WSGRA0_WSGRB0_WS64_WG64_4_1_WGM8_WGMXCC8_WGMXCCGn1
    SolutionIndex: 25
    SolutionNameMin: Cijk_Ailk_Bljk_F8NSS_BH_Bias_FDMN_SPAML0_A_S_SAV_MT320x192x64_MI16x16x1_SN_LDSB0_AFC1_AG0_AFEM1_AFEM1_ASEM8_CLR0_CADS0_DTLA0_DTLB0_DTVA0_DTVB0_DTVMXSA0_DTVMXSB0_DTVSM0_DPLB0_EPS1_ELFLR0_EMLLn1_FDSI0_GRPM1_GRVWA8_GRVWB16_GSUn1_GSUAMBSK_GSUC1_GSUWGMRR1_GLS0_ISA942_IU1_K1_LDSTI0_LBSPPA5120_LBSPPB256_LBSPPM0_LPA16_LPB32_LPM0_LRVWn1_LWPMn1_MIAV0_MIWT5_12_MO40_MGRIPM1_NTn1_NTA0_NTB0_NTC0_NTD4_NTM0_NEPBS16_NLCA5_NLCB1_ONLL1_PGR2_PLR0_PKA1_SGROB0_SIA3_SS0_SU16_SUM0_SUS256_SPO0_SRVW0_SSO0_SVW4_SK0_SKFTR0_SKXCCM0_SGRO0_TDMI0_TIN0_TLDS1_TLDSM1_ULSGRO0_USL1_USLMX0_UIOFGRO0_UPLRP0_USFGROn1_USI0_VSn1_VWA1_VWB4_WSGRA0_WSGRB0_WS64_WG64_4_1_WGM1_WGMXCC1_WGMXCCGn1
    SolutionIndex: 26
    SolutionNameMin: Cijk_Ailk_Bljk_F8NSS_BH_Bias_FDMN_SPAML0_A_S_SAV_MT320x128x128_MI16x16x1_SN_LDSB1_AFC1_AG0_AFEM1_AFEM1_ASEM8_CLR1_CADS0_DTLA0_DTLB0_DTVA0_DTVB0_DTVMXSA0_DTVMXSB0_DTVSM0_DPLB0_EPS1_ELFLR0_EMLLn1_FDSI0_GRPM1_GRVWA8_GRVWB16_GSUn1_GSUAMBSK_GSUC1_GSUWGMRR1_GLS0_ISA942_IU1_K1_LDSTI0_LBSPPA5120_LBSPPB1024_LBSPPM0_LPA16_LPB32_LPM0_LRVWn1_LWPMn1_MIAV0_MIWT5_8_MO40_MGRIPM1_NTn1_NTA0_NTB0_NTC0_NTD4_NTM0_NEPBS16_NLCA5_NLCB1_ONLL1_PGR2_PLR1_PKA1_SGROB0_SIA3_SS0_SU16_SUM0_SUS256_SPO0_SRVW0_SSO0_SVW4_SK0_SKFTR0_SKXCCM0_SGRO0_TDMI0_TIN0_TLDS1_TLDSM1_ULSGRO0_USL1_USLMX0_UIOFGRO0_UPLRP0_USFGROn1_USI0_VSn1_VWA1_VWB8_WSGRA0_WSGRB0_WS64_WG64_4_1_WGM8_WGMXCC8_WGMXCCGn1
    SolutionIndex: 27
    SolutionNameMin: Cijk_Ailk_Bljk_F8NSS_BH_Bias_FDMN_SPAML0_A_S_SAV_MT256x224x128_MI16x16x1_SN_LDSB1_AFC1_AG0_AFEM1_AFEM1_ASEM8_CLR1_CADS0_DTLA0_DTLB0_DTVA0_DTVB0_DTVMXSA0_DTVMXSB0_DTVSM0_DPLB0_EPS1_ELFLR0_EMLLn1_FDSI0_GRPM1_GRVWA16_GRVWB16_GSUn1_GSUAMBSK_GSUC1_GSUWGMRR1_GLS0_ISA942_IU1_K1_LDSTI0_LBSPPA4096_LBSPPB256_LBSPPM0_LPA32_LPB32_LPM0_LRVWn1_LWPMn1_MIAV0_MIWT4_14_MO40_MGRIPM1_NTn1_NTA0_NTB0_NTC0_NTD4_NTM0_NEPBS16_NLCA1_NLCB1_ONLL1_PGR2_PLR1_PKA1_SGROB0_SIA3_SS0_SU16_SUM0_SUS256_SPO0_SRVW0_SSO0_SVW4_SK0_SKFTR0_SKXCCM0_SGRO0_TDMI0_TIN0_TLDS1_TLDSM1_ULSGRO0_USL1_USLMX0_UIOFGRO0_UPLRP0_USFGROn1_USI0_VSn1_VWA2_VWB2_WSGRA0_WSGRB0_WS64_WG64_4_1_WGM8_WGMXCC8_WGMXCCGn1
    SolutionIndex: 28
    SolutionNameMin: Cijk_Ailk_Bljk_F8NSS_BH_Bias_FDMN_SPAML0_A_S_SAV_MT320x128x128_MI16x16x1_SN_LDSB1_AFC1_AG0_AFEM1_AFEM1_ASEM8_CLR1_CADS0_DTLA0_DTLB0_DTVA0_DTVB0_DTVMXSA0_DTVMXSB0_DTVSM0_DPLB0_EPS1_ELFLR0_EMLLn1_FDSI0_GRPM1_GRVWA16_GRVWB16_GSUn1_GSUAMBSK_GSUC1_GSUWGMRR1_GLS0_ISA942_IU1_K1_LDSTI0_LBSPPA5120_LBSPPB1024_LBSPPM0_LPA16_LPB32_LPM0_LRVWn1_LWPMn1_MIAV0_MIWT5_8_MO40_MGRIPM1_NTn1_NTA0_NTB0_NTC0_NTD4_NTM0_NEPBS16_NLCA5_NLCB1_ONLL1_PGR2_PLR1_PKA1_SGROB0_SIA3_SS0_SU16_SUM0_SUS256_SPO0_SRVW0_SSO0_SVW4_SK0_SKFTR0_SKXCCM0_SGRO0_TDMI0_TIN0_TLDS1_TLDSM1_ULSGRO0_USL1_USLMX0_UIOFGRO0_UPLRP0_USFGROn1_USI0_VSn1_VWA1_VWB8_WSGRA0_WSGRB0_WS64_WG64_4_1_WGM8_WGMXCC8_WGMXCCGn1
    SolutionIndex: 29
    SolutionNameMin: Cijk_Ailk_Bljk_F8NSS_BH_Bias_FDMN_SPAML0_A_S_SAV_MT192x320x64_MI16x16x1_SN_LDSB0_AFC1_AG0_AFEM1_AFEM1_ASEM8_CLR0_CADS0_DTLA0_DTLB0_DTVA0_DTVB0_DTVMXSA0_DTVMXSB0_DTVSM0_DPLB0_EPS1_ELFLR0_EMLLn1_FDSI0_GRPM1_GRVWA8_GRVWB16_GSUn1_GSUAMBSK_GSUC1_GSUWGMRR1_GLS0_ISA942_IU1_K1_LDSTI0_LBSPPA3072_LBSPPB256_LBSPPM0_LPA16_LPB32_LPM0_LRVWn1_LWPMn1_MIAV0_MIWT3_20_MO40_MGRIPM1_NTn1_NTA0_NTB0_NTC0_NTD4_NTM0_NEPBS16_NLCA3_NLCB1_ONLL1_PGR2_PLR0_PKA1_SGROB0_SIA3_SS0_SU16_SUM0_SUS256_SPO0_SRVW0_SSO0_SVW4_SK0_SKFTR0_SKXCCM0_SGRO0_TDMI0_TIN0_TLDS1_TLDSM1_ULSGRO0_USL1_USLMX0_UIOFGRO0_UPLRP0_USFGROn1_USI0_VSn1_VWA1_VWB4_WSGRA0_WSGRB0_WS64_WG64_4_1_WGM8_WGMXCC8_WGMXCCGn1
    SolutionIndex: 30
    SolutionNameMin: Cijk_Ailk_Bljk_F8NSS_BH_Bias_FDMN_SPAML0_A_S_SAV_MT160x192x128_MI16x16x1_SN_LDSB1_AFC1_AG0_AFEM1_AFEM1_ASEM8_CLR1_CADS0_DTLA0_DTLB0_DTVA0_DTVB0_DTVMXSA0_DTVMXSB0_DTVSM0_DPLB0_EPS1_ELFLR0_EMLLn1_FDSI0_GRPM1_GRVWA8_GRVWB16_GSUn1_GSUAMBSK_GSUC1_GSUWGMRR1_GLS0_ISA942_IU1_K1_LDSTI0_LBSPPA2560_LBSPPB256_LBSPPM0_LPA16_LPB32_LPM0_LRVWn1_LWPMn1_MIAV0_MIWT5_6_MO40_MGRIPM1_NTn1_NTA0_NTB0_NTC0_NTD4_NTM0_NEPBS16_NLCA5_NLCB1_ONLL1_PGR2_PLR1_PKA1_SGROB0_SIA3_SS0_SU16_SUM0_SUS256_SPO0_SRVW0_SSO0_SVW4_SK0_SKFTR0_SKXCCM0_SGRO0_TDMI0_TIN0_TLDS1_TLDSM1_ULSGRO0_USL1_USLMX0_UIOFGRO0_UPLRP0_USFGROn1_USI0_VSn1_VWA1_VWB2_WSGRA0_WSGRB0_WS64_WG32_8_1_WGM8_WGMXCC8_WGMXCCGn1
    SolutionIndex: 31
    SolutionNameMin: Cijk_Ailk_Bljk_F8NSS_BH_Bias_FDMN_SPAML0_A_S_SAV_MT320x192x64_MI16x16x1_SN_LDSB0_AFC1_AG0_AFEM1_AFEM1_ASEM8_CLR0_CADS0_DTLA0_DTLB0_DTVA0_DTVB0_DTVMXSA0_DTVMXSB0_DTVSM0_DPLB0_EPS1_ELFLR0_EMLLn1_FDSI0_GRPM1_GRVWA8_GRVWB16_GSUn1_GSUAMBSK_GSUC1_GSUWGMRR1_GLS0_ISA942_IU1_K1_LDSTI0_LBSPPA5120_LBSPPB256_LBSPPM0_LPA16_LPB32_LPM0_LRVWn1_LWPMn1_MIAV0_MIWT5_12_MO40_MGRIPM1_NTn1_NTA0_NTB0_NTC0_NTD4_NTM0_NEPBS16_NLCA5_NLCB1_ONLL1_PGR2_PLR0_PKA1_SGROB0_SIA3_SS0_SU16_SUM0_SUS256_SPO0_SRVW0_SSO0_SVW4_SK0_SKFTR0_SKXCCM0_SGRO0_TDMI0_TIN0_TLDS1_TLDSM1_ULSGRO0_USL1_USLMX0_UIOFGRO0_UPLRP0_USFGROn1_USI0_VSn1_VWA1_VWB4_WSGRA0_WSGRB0_WS64_WG64_4_1_WGM8_WGMXCC8_WGMXCCGn1
    SolutionIndex: 32
    SolutionNameMin: Cijk_Ailk_Bljk_F8NSS_BH_Bias_FDMN_SPAML0_A_S_SAV_MT64x160x128_MI16x16x1_SN_LDSB1_AFC1_AG0_AFEM1_AFEM1_ASEM8_CLR1_CADS0_DTLA0_DTLB0_DTVA0_DTVB0_DTVMXSA0_DTVMXSB0_DTVSM0_DPLB0_EPS1_ELFLR0_EMLLn1_FDSI0_GRPM1_GRVWA16_GRVWB16_GSUn1_GSUAMBSK_GSUC1_GSUWGMRR1_GLS0_ISA942_IU1_K1_LDSTI0_LBSPPA1024_LBSPPB256_LBSPPM0_LPA16_LPB32_LPM0_LRVWn1_LWPMn1_MIAV0_MIWT1_10_MO40_MGRIPM1_NTn1_NTA0_NTB0_NTC0_NTD4_NTM0_NEPBS16_NLCA1_NLCB1_ONLL1_PGR2_PLR1_PKA1_SGROB0_SIA3_SS0_SU16_SUM0_SUS256_SPO0_SRVW0_SSO0_SVW4_SK0_SKFTR0_SKXCCM0_SGRO0_TDMI0_TIN0_TLDS1_TLDSM1_ULSGRO0_USL1_USLMX0_UIOFGRO0_UPLRP0_USFGROn1_USI0_VSn1_VWA1_VWB2_WSGRA0_WSGRB0_WS64_WG64_4_1_WGM8_WGMXCC8_WGMXCCGn1
    SolutionIndex: 33
    SolutionNameMin: Cijk_Ailk_Bljk_F8NSS_BH_Bias_FDMN_SPAML0_A_S_SAV_MT128x128x128_MI16x16x1_SN_LDSB1_AFC1_AG0_AFEM1_AFEM1_ASEM8_CLR1_CADS0_DTLA0_DTLB0_DTVA0_DTVB0_DTVMXSA0_DTVMXSB0_DTVSM0_DPLB0_EPS1_ELFLR0_EMLLn1_FDSI0_GRPM1_GRVWA16_GRVWB16_GSUn1_GSUAMBSK_GSUC1_GSUWGMRR1_GLS0_ISA942_IU1_K1_LDSTI0_LBSPPA2048_LBSPPB1024_LBSPPM0_LPA32_LPB32_LPM0_LRVWn1_LWPMn1_MIAV0_MIWT2_8_MO40_MGRIPM1_NTn1_NTA0_NTB0_NTC0_NTD4_NTM0_NEPBS16_NLCA1_NLCB1_ONLL1_PGR2_PLR1_PKA1_SGROB0_SIA3_SS0_SU16_SUM0_SUS256_SPO0_SRVW0_SSO0_SVW4_SK0_SKFTR0_SKXCCM0_SGRO0_TDMI0_TIN0_TLDS1_TLDSM1_ULSGRO0_USL1_USLMX0_UIOFGRO0_UPLRP0_USFGROn1_USI0_VSn1_VWA2_VWB8_WSGRA0_WSGRB0_WS64_WG64_4_1_WGM1_WGMXCC1_WGMXCCGn1
    SolutionIndex: 34
    SolutionNameMin: Cijk_Ailk_Bljk_F8NSS_BH_Bias_FDMN_SPAML0_A_S_SAV_MT448x128x64_MI16x16x1_SN_LDSB0_AFC1_AG0_AFEM1_AFEM1_ASEM8_CLR0_CADS0_DTLA0_DTLB0_DTVA0_DTVB0_DTVMXSA0_DTVMXSB0_DTVSM0_DPLB0_EPS1_ELFLR0_EMLLn1_FDSI0_GRPM1_GRVWA8_GRVWB16_GSUn1_GSUAMBSK_GSUC1_GSUWGMRR1_GLS0_ISA942_IU1_K1_LDSTI0_LBSPPA7168_LBSPPB512_LBSPPM0_LPA16_LPB32_LPM0_LRVWn1_LWPMn1_MIAV0_MIWT7_8_MO40_MGRIPM1_NTn1_NTA0_NTB0_NTC0_NTD4_NTM0_NEPBS16_NLCA7_NLCB1_ONLL1_PGR2_PLR0_PKA1_SGROB0_SIA3_SS0_SU16_SUM0_SUS256_SPO0_SRVW0_SSO0_SVW4_SK0_SKFTR0_SKXCCM0_SGRO0_TDMI0_TIN0_TLDS1_TLDSM1_ULSGRO0_USL1_USLMX0_UIOFGRO0_UPLRP0_USFGROn1_USI0_VSn1_VWA1_VWB8_WSGRA0_WSGRB0_WS64_WG64_4_1_WGM8_WGMXCC8_WGMXCCGn1
    SolutionIndex: 35
    SolutionNameMin: Cijk_Ailk_Bljk_F8NSS_BH_Bias_FDMN_SPAML0_A_S_SAV_MT128x128x128_MI16x16x1_SN_LDSB1_AFC1_AG0_AFEM1_AFEM1_ASEM8_CLR1_CADS0_DTLA0_DTLB0_DTVA0_DTVB0_DTVMXSA0_DTVMXSB0_DTVSM0_DPLB0_EPS1_ELFLR0_EMLLn1_FDSI0_GRPM1_GRVWA16_GRVWB16_GSUn1_GSUAMBSK_GSUC1_GSUWGMRR1_GLS0_ISA942_IU1_K1_LDSTI0_LBSPPA2048_LBSPPB1024_LBSPPM0_LPA32_LPB32_LPM0_LRVWn1_LWPMn1_MIAV0_MIWT2_8_MO40_MGRIPM1_NTn1_NTA0_NTB0_NTC0_NTD4_NTM0_NEPBS16_NLCA1_NLCB1_ONLL1_PGR2_PLR1_PKA1_SGROB0_SIA3_SS0_SU16_SUM0_SUS256_SPO0_SRVW0_SSO0_SVW4_SK0_SKFTR0_SKXCCM0_SGRO0_TDMI0_TIN0_TLDS1_TLDSM1_ULSGRO0_USL1_USLMX0_UIOFGRO0_UPLRP0_USFGROn1_USI0_VSn1_VWA2_VWB8_WSGRA0_WSGRB0_WS64_WG64_4_1_WGM8_WGMXCC8_WGMXCCGn1
    SolutionIndex: 36
    SolutionNameMin: Cijk_Ailk_Bljk_F8NSS_BH_Bias_FDMN_SPAML0_A_S_SAV_MT128x320x128_MI16x16x1_SN_LDSB1_AFC1_AG0_AFEM1_AFEM1_ASEM8_CLR1_CADS0_DTLA0_DTLB0_DTVA0_DTVB0_DTVMXSA0_DTVMXSB0_DTVSM0_DPLB0_EPS1_ELFLR0_EMLLn1_FDSI0_GRPM1_GRVWA16_GRVWB16_GSUn1_GSUAMBSK_GSUC1_GSUWGMRR1_GLS0_ISA942_IU1_K1_LDSTI0_LBSPPA2048_LBSPPB256_LBSPPM0_LPA32_LPB32_LPM0_LRVWn1_LWPMn1_MIAV0_MIWT4_10_MO40_MGRIPM1_NTn1_NTA0_NTB0_NTC0_NTD4_NTM0_NEPBS16_NLCA1_NLCB1_ONLL1_PGR2_PLR1_PKA1_SGROB0_SIA3_SS0_SU16_SUM0_SUS256_SPO0_SRVW0_SSO0_SVW4_SK0_SKFTR0_SKXCCM0_SGRO0_TDMI0_TIN0_TLDS1_TLDSM1_ULSGRO0_USL1_USLMX0_UIOFGRO0_UPLRP0_USFGROn1_USI0_VSn1_VWA2_VWB2_WSGRA0_WSGRB0_WS64_WG32_8_1_WGM1_WGMXCC1_WGMXCCGn1
    SolutionIndex: 37
    SolutionNameMin: Cijk_Ailk_Bljk_F8NSS_BH_Bias_FDMN_SPAML0_A_S_SAV_MT128x384x128_MI16x16x1_SN_LDSB1_AFC1_AG0_AFEM1_AFEM1_ASEM8_CLR1_CADS0_DTLA0_DTLB0_DTVA0_DTVB0_DTVMXSA0_DTVMXSB0_DTVSM0_DPLB0_EPS1_ELFLR0_EMLLn1_FDSI0_GRPM1_GRVWA16_GRVWB16_GSUn1_GSUAMBSK_GSUC1_GSUWGMRR1_GLS0_ISA942_IU1_K1_LDSTI0_LBSPPA2048_LBSPPB512_LBSPPM0_LPA32_LPB32_LPM0_LRVWn1_LWPMn1_MIAV0_MIWT4_12_MO40_MGRIPM1_NTn1_NTA0_NTB0_NTC0_NTD4_NTM0_NEPBS16_NLCA1_NLCB1_ONLL1_PGR2_PLR1_PKA1_SGROB0_SIA3_SS0_SU16_SUM0_SUS256_SPO0_SRVW0_SSO0_SVW4_SK0_SKFTR0_SKXCCM0_SGRO0_TDMI0_TIN0_TLDS1_TLDSM1_ULSGRO0_USL1_USLMX0_UIOFGRO0_UPLRP0_USFGROn1_USI0_VSn1_VWA2_VWB4_WSGRA0_WSGRB0_WS64_WG32_8_1_WGM8_WGMXCC8_WGMXCCGn1
    SolutionIndex: 38
    SolutionNameMin: Cijk_Ailk_Bljk_F8NSS_BH_Bias_FDMN_SPAML0_A_S_SAV_MT96x384x128_MI16x16x1_SN_LDSB1_AFC1_AG0_AFEM1_AFEM1_ASEM8_CLR1_CADS0_DTLA0_DTLB0_DTVA0_DTVB0_DTVMXSA0_DTVMXSB0_DTVSM0_DPLB0_EPS1_ELFLR0_EMLLn1_FDSI0_GRPM1_GRVWA8_GRVWB16_GSUn1_GSUAMBSK_GSUC1_GSUWGMRR1_GLS0_ISA942_IU1_K1_LDSTI0_LBSPPA1536_LBSPPB512_LBSPPM0_LPA16_LPB32_LPM0_LRVWn1_LWPMn1_MIAV0_MIWT3_12_MO40_MGRIPM1_NTn1_NTA0_NTB0_NTC0_NTD4_NTM0_NEPBS16_NLCA3_NLCB1_ONLL1_PGR2_PLR1_PKA1_SGROB0_SIA3_SS0_SU16_SUM0_SUS256_SPO0_SRVW0_SSO0_SVW4_SK0_SKFTR0_SKXCCM0_SGRO0_TDMI0_TIN0_TLDS1_TLDSM1_ULSGRO0_USL1_USLMX0_UIOFGRO0_UPLRP0_USFGROn1_USI0_VSn1_VWA1_VWB4_WSGRA0_WSGRB0_WS64_WG32_8_1_WGM8_WGMXCC8_WGMXCCGn1
    SolutionIndex: 39
    SolutionNameMin: Cijk_Ailk_Bljk_F8NSS_BH_Bias_FDMN_SPAML0_A_S_SAV_MT96x384x128_MI16x16x1_SN_LDSB1_AFC1_AG0_AFEM1_AFEM1_ASEM8_CLR1_CADS0_DTLA0_DTLB0_DTVA0_DTVB0_DTVMXSA0_DTVMXSB0_DTVSM0_DPLB0_EPS1_ELFLR0_EMLLn1_FDSI0_GRPM1_GRVWA8_GRVWB16_GSUn1_GSUAMBSK_GSUC1_GSUWGMRR1_GLS0_ISA942_IU1_K1_LDSTI0_LBSPPA1536_LBSPPB512_LBSPPM0_LPA16_LPB32_LPM0_LRVWn1_LWPMn1_MIAV0_MIWT3_12_MO40_MGRIPM1_NTn1_NTA0_NTB0_NTC0_NTD4_NTM0_NEPBS16_NLCA3_NLCB1_ONLL1_PGR2_PLR1_PKA1_SGROB0_SIA3_SS0_SU16_SUM0_SUS256_SPO0_SRVW0_SSO0_SVW4_SK0_SKFTR0_SKXCCM0_SGRO0_TDMI0_TIN0_TLDS1_TLDSM1_ULSGRO0_USL1_USLMX0_UIOFGRO0_UPLRP0_USFGROn1_USI0_VSn1_VWA1_VWB4_WSGRA0_WSGRB0_WS64_WG32_8_1_WGM1_WGMXCC1_WGMXCCGn1
    SolutionIndex: 40
    SolutionNameMin: Cijk_Ailk_Bljk_F8NSS_BH_Bias_FDMN_SPAML0_A_S_SAV_MT128x112x128_MI16x16x1_SN_LDSB1_AFC1_AG0_AFEM1_AFEM1_ASEM8_CLR1_CADS0_DTLA0_DTLB0_DTVA0_DTVB0_DTVMXSA0_DTVMXSB0_DTVSM0_DPLB0_EPS1_ELFLR0_EMLLn1_FDSI0_GRPM1_GRVWA16_GRVWB4_GSUn1_GSUAMBSK_GSUC1_GSUWGMRR1_GLS0_ISA942_IU1_K1_LDSTI0_LBSPPA2048_LBSPPB128_LBSPPM0_LPA32_LPB32_LPM0_LRVWn1_LWPMn1_MIAV0_MIWT2_7_MO40_MGRIPM1_NTn1_NTA0_NTB0_NTC0_NTD4_NTM0_NEPBS16_NLCA1_NLCB1_ONLL1_PGR2_PLR1_PKA1_SGROB0_SIA3_SS0_SU16_SUM0_SUS256_SPO0_SRVW0_SSO0_SVW4_SK0_SKFTR0_SKXCCM0_SGRO0_TDMI0_TIN0_TLDS1_TLDSM1_ULSGRO0_USL1_USLMX0_UIOFGRO0_UPLRP0_USFGROn1_USI0_VSn1_VWA2_VWB1_WSGRA0_WSGRB0_WS64_WG64_4_1_WGM8_WGMXCC8_WGMXCCGn1
    SolutionIndex: 41
    SolutionNameMin: Cijk_Ailk_Bljk_F8NSS_BH_Bias_FDMN_SPAML0_A_S_SAV_MT64x64x256_MI16x16x1_SN_LDSB1_AFC1_AG0_AFEM1_AFEM1_ASEM8_CLR1_CADS0_DTLA0_DTLB0_DTVA0_DTVB0_DTVMXSA0_DTVMXSB0_DTVSM0_DPLB0_EPS1_ELFLR0_EMLLn1_FDSI0_GRPM1_GRVWA16_GRVWB16_GSUn1_GSUAMBSK_GSUC1_GSUWGMRR1_GLS0_ISA942_IU1_K1_LDSTI0_LBSPPA1024_LBSPPB1024_LBSPPM0_LPA16_LPB32_LPM0_LRVWn1_LWPMn1_MIAV0_MIWT1_4_MO40_MGRIPM1_NTn1_NTA0_NTB0_NTC0_NTD4_NTM0_NEPBS16_NLCA1_NLCB1_ONLL1_PGR2_PLR1_PKA1_SGROB0_SIA3_SS0_SU16_SUM0_SUS256_SPO0_SRVW0_SSO0_SVW4_SK0_SKFTR0_SKXCCM0_SGRO0_TDMI0_TIN0_TLDS1_TLDSM1_ULSGRO0_USL1_USLMX0_UIOFGRO0_UPLRP0_USFGROn1_USI0_VSn1_VWA1_VWB4_WSGRA0_WSGRB0_WS64_WG64_4_1_WGM8_WGMXCC8_WGMXCCGn1
    SolutionIndex: 42
    SolutionNameMin: Cijk_Ailk_Bljk_F8NSS_BH_Bias_FDMN_SPAML0_A_S_SAV_MT320x160x128_MI16x16x1_SN_LDSB1_AFC1_AG0_AFEM1_AFEM1_ASEM8_CLR1_CADS0_DTLA0_DTLB0_DTVA0_DTVB0_DTVMXSA0_DTVMXSB0_DTVSM0_DPLB0_EPS1_ELFLR0_EMLLn1_FDSI0_GRPM1_GRVWA8_GRVWB16_GSUn1_GSUAMBSK_GSUC1_GSUWGMRR1_GLS0_ISA942_IU1_K1_LDSTI0_LBSPPA5120_LBSPPB256_LBSPPM0_LPA16_LPB32_LPM0_LRVWn1_LWPMn1_MIAV0_MIWT5_10_MO40_MGRIPM1_NTn1_NTA0_NTB0_NTC0_NTD4_NTM0_NEPBS16_NLCA5_NLCB1_ONLL1_PGR2_PLR1_PKA1_SGROB0_SIA3_SS0_SU16_SUM0_SUS256_SPO0_SRVW0_SSO0_SVW4_SK0_SKFTR0_SKXCCM0_SGRO0_TDMI0_TIN0_TLDS1_TLDSM1_ULSGRO0_USL1_USLMX0_UIOFGRO0_UPLRP0_USFGROn1_USI0_VSn1_VWA1_VWB2_WSGRA0_WSGRB0_WS64_WG64_4_1_WGM1_WGMXCC1_WGMXCCGn1
    SolutionIndex: 43
    SolutionNameMin: Cijk_Ailk_Bljk_F8NSS_BH_Bias_FDMN_SPAML0_A_S_SAV_MT224x192x128_MI16x16x1_SN_LDSB1_AFC1_AG0_AFEM1_AFEM1_ASEM8_CLR1_CADS0_DTLA0_DTLB0_DTVA0_DTVB0_DTVMXSA0_DTVMXSB0_DTVSM0_DPLB0_EPS1_ELFLR0_EMLLn1_FDSI0_GRPM1_GRVWA8_GRVWB16_GSUn1_GSUAMBSK_GSUC1_GSUWGMRR1_GLS0_ISA942_IU1_K1_LDSTI0_LBSPPA3584_LBSPPB256_LBSPPM0_LPA16_LPB32_LPM0_LRVWn1_LWPMn1_MIAV0_MIWT7_6_MO40_MGRIPM1_NTn1_NTA0_NTB0_NTC0_NTD4_NTM0_NEPBS16_NLCA7_NLCB1_ONLL1_PGR2_PLR1_PKA1_SGROB0_SIA3_SS0_SU16_SUM0_SUS256_SPO0_SRVW0_SSO0_SVW4_SK0_SKFTR0_SKXCCM0_SGRO0_TDMI0_TIN0_TLDS1_TLDSM1_ULSGRO0_USL1_USLMX0_UIOFGRO0_UPLRP0_USFGROn1_USI0_VSn1_VWA1_VWB2_WSGRA0_WSGRB0_WS64_WG32_8_1_WGM1_WGMXCC1_WGMXCCGn1
    SolutionIndex: 44
    SolutionNameMin: Cijk_Ailk_Bljk_F8NSS_BH_Bias_FDMN_SPAML0_A_S_SAV_MT192x192x128_MI16x16x1_SN_LDSB1_AFC1_AG0_AFEM1_AFEM1_ASEM8_CLR1_CADS0_DTLA0_DTLB0_DTVA0_DTVB0_DTVMXSA0_DTVMXSB0_DTVSM0_DPLB0_EPS1_ELFLR0_EMLLn1_FDSI0_GRPM1_GRVWA16_GRVWB16_GSUn1_GSUAMBSK_GSUC1_GSUWGMRR1_GLS0_ISA942_IU1_K1_LDSTI0_LBSPPA3072_LBSPPB512_LBSPPM0_LPA16_LPB32_LPM0_LRVWn1_LWPMn1_MIAV0_MIWT3_12_MO40_MGRIPM1_NTn1_NTA0_NTB0_NTC0_NTD4_NTM0_NEPBS16_NLCA3_NLCB1_ONLL1_PGR2_PLR1_PKA1_SGROB0_SIA3_SS0_SU16_SUM0_SUS256_SPO0_SRVW0_SSO0_SVW4_SK0_SKFTR0_SKXCCM0_SGRO0_TDMI0_TIN0_TLDS1_TLDSM1_ULSGRO0_USL1_USLMX0_UIOFGRO0_UPLRP0_USFGROn1_USI0_VSn1_VWA1_VWB4_WSGRA0_WSGRB0_WS64_WG64_4_1_WGM8_WGMXCC8_WGMXCCGn1
    SolutionIndex: 45
    SolutionNameMin: Cijk_Ailk_Bljk_F8NSS_BH_Bias_FDMN_SPAML0_A_S_SAV_MT192x192x128_MI16x16x1_SN_LDSB1_AFC1_AG0_AFEM1_AFEM1_ASEM8_CLR1_CADS0_DTLA0_DTLB0_DTVA0_DTVB0_DTVMXSA0_DTVMXSB0_DTVSM0_DPLB0_EPS1_ELFLR0_EMLLn1_FDSI0_GRPM1_GRVWA16_GRVWB16_GSUn1_GSUAMBSK_GSUC1_GSUWGMRR1_GLS0_ISA942_IU1_K1_LDSTI0_LBSPPA3072_LBSPPB512_LBSPPM0_LPA16_LPB32_LPM0_LRVWn1_LWPMn1_MIAV0_MIWT3_12_MO40_MGRIPM1_NTn1_NTA0_NTB0_NTC0_NTD4_NTM0_NEPBS16_NLCA3_NLCB1_ONLL1_PGR2_PLR1_PKA1_SGROB0_SIA3_SS0_SU16_SUM0_SUS256_SPO0_SRVW0_SSO0_SVW4_SK0_SKFTR0_SKXCCM0_SGRO0_TDMI0_TIN0_TLDS1_TLDSM1_ULSGRO0_USL1_USLMX0_UIOFGRO0_UPLRP0_USFGROn1_USI0_VSn1_VWA1_VWB4_WSGRA0_WSGRB0_WS64_WG64_4_1_WGM1_WGMXCC1_WGMXCCGn1
    SolutionIndex: 46
    SolutionNameMin: Cijk_Ailk_Bljk_F8NSS_BH_Bias_FDMN_SPAML0_A_S_SAV_MT256x256x128_MI16x16x1_SN_LDSB1_AFC1_AG0_AFEM1_AFEM1_ASEM8_CLR1_CADS0_DTLA0_DTLB0_DTVA0_DTVB0_DTVMXSA0_DTVMXSB0_DTVSM0_DPLB0_EPS1_ELFLR0_EMLLn1_FDSI0_GRPM1_GRVWA16_GRVWB16_GSUn1_GSUAMBSK_GSUC1_GSUWGMRR1_GLS0_ISA942_IU1_K1_LDSTI0_LBSPPA4096_LBSPPB2048_LBSPPM0_LPA32_LPB32_LPM0_LRVWn1_LWPMn1_MIAV0_MIWT4_16_MO40_MGRIPM1_NTn1_NTA0_NTB0_NTC0_NTD4_NTM0_NEPBS16_NLCA1_NLCB1_ONLL1_PGR2_PLR1_PKA1_SGROB0_SIA3_SS0_SU16_SUM0_SUS256_SPO0_SRVW0_SSO0_SVW4_SK0_SKFTR0_SKXCCM0_SGRO0_TDMI0_TIN0_TLDS1_TLDSM1_ULSGRO0_USL1_USLMX0_UIOFGRO0_UPLRP0_USFGROn1_USI0_VSn1_VWA2_VWB16_WSGRA0_WSGRB0_WS64_WG64_4_1_WGM8_WGMXCC8_WGMXCCGn1
    SolutionIndex: 47
    SolutionNameMin: Cijk_Ailk_Bljk_F8NSS_BH_Bias_FDMN_SPAML0_A_S_SAV_MT192x256x128_MI16x16x1_SN_LDSB1_AFC1_AG0_AFEM1_AFEM1_ASEM8_CLR1_CADS0_DTLA0_DTLB0_DTVA0_DTVB0_DTVMXSA0_DTVMXSB0_DTVSM0_DPLB0_EPS1_ELFLR0_EMLLn1_FDSI0_GRPM1_GRVWA8_GRVWB16_GSUn1_GSUAMBSK_GSUC1_GSUWGMRR1_GLS0_ISA942_IU1_K1_LDSTI0_LBSPPA3072_LBSPPB2048_LBSPPM0_LPA16_LPB32_LPM0_LRVWn1_LWPMn1_MIAV0_MIWT3_16_MO40_MGRIPM1_NTn1_NTA0_NTB0_NTC0_NTD4_NTM0_NEPBS16_NLCA3_NLCB1_ONLL1_PGR2_PLR1_PKA1_SGROB0_SIA3_SS0_SU16_SUM0_SUS256_SPO0_SRVW0_SSO0_SVW4_SK0_SKFTR0_SKXCCM0_SGRO0_TDMI0_TIN0_TLDS1_TLDSM1_ULSGRO0_USL1_USLMX0_UIOFGRO0_UPLRP0_USFGROn1_USI0_VSn1_VWA1_VWB16_WSGRA0_WSGRB0_WS64_WG64_4_1_WGM8_WGMXCC8_WGMXCCGn1
    SolutionIndex: 48
    SolutionNameMin: Cijk_Ailk_Bljk_F8NSS_BH_Bias_FDMN_SPAML0_A_S_SAV_MT96x352x128_MI16x16x1_SN_LDSB1_AFC1_AG0_AFEM1_AFEM1_ASEM8_CLR1_CADS0_DTLA0_DTLB0_DTVA0_DTVB0_DTVMXSA0_DTVMXSB0_DTVSM0_DPLB0_EPS1_ELFLR0_EMLLn1_FDSI0_GRPM1_GRVWA8_GRVWB16_GSUn1_GSUAMBSK_GSUC1_GSUWGMRR1_GLS0_ISA942_IU1_K1_LDSTI0_LBSPPA1536_LBSPPB128_LBSPPM0_LPA16_LPB32_LPM0_LRVWn1_LWPMn1_MIAV0_MIWT3_11_MO40_MGRIPM1_NTn1_NTA0_NTB0_NTC0_NTD4_NTM0_NEPBS16_NLCA3_NLCB1_ONLL1_PGR2_PLR1_PKA1_SGROB0_SIA3_SS0_SU16_SUM0_SUS256_SPO0_SRVW0_SSO0_SVW4_SK0_SKFTR0_SKXCCM0_SGRO0_TDMI0_TIN0_TLDS1_TLDSM1_ULSGRO0_USL1_USLMX0_UIOFGRO0_UPLRP0_USFGROn1_USI0_VSn1_VWA1_VWB1_WSGRA0_WSGRB0_WS64_WG32_8_1_WGM8_WGMXCC8_WGMXCCGn1
    SolutionIndex: 49
    SolutionNameMin: Cijk_Ailk_Bljk_F8NSS_BH_Bias_FDMN_SPAML0_A_S_SAV_MT128x320x128_MI16x16x1_SN_LDSB1_AFC1_AG0_AFEM1_AFEM1_ASEM8_CLR1_CADS0_DTLA0_DTLB0_DTVA0_DTVB0_DTVMXSA0_DTVMXSB0_DTVSM0_DPLB0_EPS1_ELFLR0_EMLLn1_FDSI0_GRPM1_GRVWA16_GRVWB16_GSUn1_GSUAMBSK_GSUC1_GSUWGMRR1_GLS0_ISA942_IU1_K1_LDSTI0_LBSPPA2048_LBSPPB512_LBSPPM0_LPA32_LPB32_LPM0_LRVWn1_LWPMn1_MIAV0_MIWT2_20_MO40_MGRIPM1_NTn1_NTA0_NTB0_NTC0_NTD4_NTM0_NEPBS16_NLCA1_NLCB1_ONLL1_PGR2_PLR1_PKA1_SGROB0_SIA3_SS0_SU16_SUM0_SUS256_SPO0_SRVW0_SSO0_SVW4_SK0_SKFTR0_SKXCCM0_SGRO0_TDMI0_TIN0_TLDS1_TLDSM1_ULSGRO0_USL1_USLMX0_UIOFGRO0_UPLRP0_USFGROn1_USI0_VSn1_VWA2_VWB4_WSGRA0_WSGRB0_WS64_WG64_4_1_WGM1_WGMXCC1_WGMXCCGn1
    SolutionIndex: 50
    SolutionNameMin: Cijk_Ailk_Bljk_F8NSS_BH_Bias_FDMN_SPAML0_A_S_SAV_MT128x384x128_MI16x16x1_SN_LDSB1_AFC1_AG0_AFEM1_AFEM1_ASEM8_CLR1_CADS0_DTLA0_DTLB0_DTVA0_DTVB0_DTVMXSA0_DTVMXSB0_DTVSM0_DPLB0_EPS1_ELFLR0_EMLLn1_FDSI0_GRPM1_GRVWA16_GRVWB16_GSUn1_GSUAMBSK_GSUC1_GSUWGMRR1_GLS0_ISA942_IU1_K1_LDSTI0_LBSPPA2048_LBSPPB512_LBSPPM0_LPA32_LPB32_LPM0_LRVWn1_LWPMn1_MIAV0_MIWT4_12_MO40_MGRIPM1_NTn1_NTA0_NTB0_NTC0_NTD4_NTM0_NEPBS16_NLCA1_NLCB1_ONLL1_PGR2_PLR1_PKA1_SGROB0_SIA3_SS0_SU16_SUM0_SUS256_SPO0_SRVW0_SSO0_SVW4_SK0_SKFTR0_SKXCCM0_SGRO0_TDMI0_TIN0_TLDS1_TLDSM1_ULSGRO0_USL1_USLMX0_UIOFGRO0_UPLRP0_USFGROn1_USI0_VSn1_VWA2_VWB4_WSGRA0_WSGRB0_WS64_WG32_8_1_WGM1_WGMXCC1_WGMXCCGn1
    SolutionIndex: 51
    SolutionNameMin: Cijk_Ailk_Bljk_F8NSS_BH_Bias_FDMN_SPAML0_A_S_SAV_MT16x64x256_MI16x16x1_SN_LDSB1_AFC1_AG0_AFEM1_AFEM1_ASEM8_CLR1_CADS0_DTLA0_DTLB0_DTVA0_DTVB0_DTVMXSA0_DTVMXSB0_DTVSM0_DPLB0_EPS1_ELFLR0_EMLLn1_FDSI0_GRPM1_GRVWA8_GRVWB4_GSUn1_GSUAMBSK_GSUC1_GSUWGMRR1_GLS0_ISA942_IU1_K1_LDSTI0_LBSPPA256_LBSPPB256_LBSPPM0_LPA16_LPB32_LPM0_LRVWn1_LWPMn1_MIAV0_MIWT1_1_MO40_MGRIPM1_NTn1_NTA0_NTB0_NTC0_NTD4_NTM0_NEPBS16_NLCA1_NLCB1_ONLL1_PGR2_PLR1_PKA1_SGROB0_SIA3_SS0_SU16_SUM0_SUS256_SPO0_SRVW0_SSO0_SVW4_SK0_SKFTR0_SKXCCM0_SGRO0_TDMI0_TIN0_TLDS1_TLDSM1_ULSGRO0_USL1_USLMX0_UIOFGRO0_UPLRP0_USFGROn1_USI0_VSn1_VWA1_VWB1_WSGRA0_WSGRB0_WS64_WG16_16_1_WGM1_WGMXCC1_WGMXCCGn1
    SolutionIndex: 52
    SolutionNameMin: Cijk_Ailk_Bljk_F8NSS_BH_Bias_FDMN_SPAML0_A_S_SAV_MT32x320x128_MI16x16x1_SN_LDSB1_AFC1_AG0_AFEM1_AFEM1_ASEM8_CLR1_CADS0_DTLA0_DTLB0_DTVA0_DTVB0_DTVMXSA0_DTVMXSB0_DTVSM0_DPLB0_EPS1_ELFLR0_EMLLn1_FDSI0_GRPM1_GRVWA8_GRVWB4_GSUn1_GSUAMBSK_GSUC1_GSUWGMRR1_GLS0_ISA942_IU1_K1_LDSTI0_LBSPPA512_LBSPPB256_LBSPPM0_LPA16_LPB32_LPM0_LRVWn1_LWPMn1_MIAV0_MIWT1_10_MO40_MGRIPM1_NTn1_NTA0_NTB0_NTC0_NTD4_NTM0_NEPBS16_NLCA1_NLCB1_ONLL1_PGR2_PLR1_PKA1_SGROB0_SIA3_SS0_SU16_SUM0_SUS256_SPO0_SRVW0_SSO0_SVW4_SK0_SKFTR0_SKXCCM0_SGRO0_TDMI0_TIN0_TLDS1_TLDSM1_ULSGRO0_USL1_USLMX0_UIOFGRO0_UPLRP0_USFGROn1_USI0_VSn1_VWA1_VWB2_WSGRA0_WSGRB0_WS64_WG32_8_1_WGM1_WGMXCC1_WGMXCCGn1
    SolutionIndex: 53
    SolutionNameMin: Cijk_Ailk_Bljk_F8NSS_BH_Bias_FDMN_SPAML0_A_S_SAV_MT48x64x256_MI16x16x1_SN_LDSB1_AFC1_AG0_AFEM1_AFEM1_ASEM8_CLR1_CADS0_DTLA0_DTLB0_DTVA0_DTVB0_DTVMXSA0_DTVMXSB0_DTVSM0_DPLB0_EPS1_ELFLR0_EMLLn1_FDSI0_GRPM1_GRVWA8_GRVWB16_GSUn1_GSUAMBSK_GSUC1_GSUWGMRR1_GLS0_ISA942_IU1_K1_LDSTI0_LBSPPA768_LBSPPB256_LBSPPM0_LPA16_LPB32_LPM0_LRVWn1_LWPMn1_MIAV0_MIWT3_1_MO40_MGRIPM1_NTn1_NTA0_NTB0_NTC0_NTD4_NTM0_NEPBS16_NLCA3_NLCB1_ONLL1_PGR2_PLR1_PKA1_SGROB0_SIA3_SS0_SU16_SUM0_SUS256_SPO0_SRVW0_SSO0_SVW4_SK0_SKFTR0_SKXCCM0_SGRO0_TDMI0_TIN0_TLDS1_TLDSM1_ULSGRO0_USL1_USLMX0_UIOFGRO0_UPLRP0_USFGROn1_USI0_VSn1_VWA1_VWB1_WSGRA0_WSGRB0_WS64_WG16_16_1_WGM1_WGMXCC1_WGMXCCGn1
    SolutionIndex: 54
    SolutionNameMin: Cijk_Ailk_Bljk_F8NSS_BH_Bias_FDMN_SPAML0_A_S_SAV_MT32x64x256_MI16x16x1_SN_LDSB1_AFC1_AG0_AFEM1_AFEM1_ASEM8_CLR1_CADS0_DTLA0_DTLB0_DTVA0_DTVB0_DTVMXSA0_DTVMXSB0_DTVSM0_DPLB0_EPS1_ELFLR0_EMLLn1_FDSI0_GRPM1_GRVWA8_GRVWB4_GSUn1_GSUAMBSK_GSUC1_GSUWGMRR1_GLS0_ISA942_IU1_K1_LDSTI0_LBSPPA512_LBSPPB512_LBSPPM0_LPA16_LPB32_LPM0_LRVWn1_LWPMn1_MIAV0_MIWT1_2_MO40_MGRIPM1_NTn1_NTA0_NTB0_NTC0_NTD4_NTM0_NEPBS16_NLCA1_NLCB1_ONLL1_PGR2_PLR1_PKA1_SGROB0_SIA3_SS0_SU16_SUM0_SUS256_SPO0_SRVW0_SSO0_SVW4_SK0_SKFTR0_SKXCCM0_SGRO0_TDMI0_TIN0_TLDS1_TLDSM1_ULSGRO0_USL1_USLMX0_UIOFGRO0_UPLRP0_USFGROn1_USI0_VSn1_VWA1_VWB2_WSGRA0_WSGRB0_WS64_WG32_8_1_WGM1_WGMXCC1_WGMXCCGn1
    SolutionIndex: 55
    SolutionNameMin: Cijk_Ailk_Bljk_F8NSS_BH_Bias_FDMN_SPAML0_A_S_SAV_MT32x288x128_MI16x16x1_SN_LDSB1_AFC1_AG0_AFEM1_AFEM1_ASEM8_CLR1_CADS0_DTLA0_DTLB0_DTVA0_DTVB0_DTVMXSA0_DTVMXSB0_DTVSM0_DPLB0_EPS1_ELFLR0_EMLLn1_FDSI0_GRPM1_GRVWA8_GRVWB16_GSUn1_GSUAMBSK_GSUC1_GSUWGMRR1_GLS0_ISA942_IU1_K1_LDSTI0_LBSPPA512_LBSPPB128_LBSPPM0_LPA16_LPB32_LPM0_LRVWn1_LWPMn1_MIAV0_MIWT1_9_MO40_MGRIPM1_NTn1_NTA0_NTB0_NTC0_NTD4_NTM0_NEPBS16_NLCA1_NLCB1_ONLL1_PGR2_PLR1_PKA1_SGROB0_SIA3_SS0_SU16_SUM0_SUS256_SPO0_SRVW0_SSO0_SVW4_SK0_SKFTR0_SKXCCM0_SGRO0_TDMI0_TIN0_TLDS1_TLDSM1_ULSGRO0_USL1_USLMX0_UIOFGRO0_UPLRP0_USFGROn1_USI0_VSn1_VWA1_VWB1_WSGRA0_WSGRB0_WS64_WG32_8_1_WGM1_WGMXCC1_WGMXCCGn1
    SolutionIndex: 56
    SolutionNameMin: Cijk_Ailk_Bljk_F8NSS_BH_Bias_FDMN_SPAML0_A_S_SAV_MT96x288x128_MI16x16x1_SN_LDSB1_AFC1_AG0_AFEM1_AFEM1_ASEM8_CLR1_CADS0_DTLA0_DTLB0_DTVA0_DTVB0_DTVMXSA0_DTVMXSB0_DTVSM0_DPLB0_EPS1_ELFLR0_EMLLn1_FDSI0_GRPM1_GRVWA8_GRVWB16_GSUn1_GSUAMBSK_GSUC1_GSUWGMRR1_GLS0_ISA942_IU1_K1_LDSTI0_LBSPPA1536_LBSPPB128_LBSPPM0_LPA16_LPB32_LPM0_LRVWn1_LWPMn1_MIAV0_MIWT3_9_MO40_MGRIPM1_NTn1_NTA0_NTB0_NTC0_NTD4_NTM0_NEPBS16_NLCA3_NLCB1_ONLL1_PGR2_PLR1_PKA1_SGROB0_SIA3_SS0_SU16_SUM0_SUS256_SPO0_SRVW0_SSO0_SVW4_SK0_SKFTR0_SKXCCM0_SGRO0_TDMI0_TIN0_TLDS1_TLDSM1_ULSGRO0_USL1_USLMX0_UIOFGRO0_UPLRP0_USFGROn1_USI0_VSn1_VWA1_VWB1_WSGRA0_WSGRB0_WS64_WG32_8_1_WGM8_WGMXCC8_WGMXCCGn1
    SolutionIndex: 57
    SolutionNameMin: Cijk_Ailk_Bljk_F8NSS_BH_Bias_FDMN_SPAML0_A_S_SAV_MT512x128x128_MI16x16x1_SN_LDSB1_AFC1_AG0_AFEM1_AFEM1_ASEM8_CLR1_CADS0_DTLA0_DTLB0_DTVA0_DTVB0_DTVMXSA0_DTVMXSB0_DTVSM0_DPLB0_EPS1_ELFLR0_EMLLn1_FDSI0_GRPM1_GRVWA16_GRVWB16_GSUn1_GSUAMBSK_GSUC1_GSUWGMRR1_GLS0_ISA942_IU1_K1_LDSTI0_LBSPPA8192_LBSPPB1024_LBSPPM0_LPA32_LPB32_LPM0_LRVWn1_LWPMn1_MIAV0_MIWT8_8_MO40_MGRIPM1_NTn1_NTA0_NTB0_NTC0_NTD4_NTM0_NEPBS16_NLCA1_NLCB1_ONLL1_PGR2_PLR1_PKA1_SGROB0_SIA3_SS0_SU16_SUM0_SUS256_SPO0_SRVW0_SSO0_SVW4_SK0_SKFTR0_SKXCCM0_SGRO0_TDMI0_TIN0_TLDS1_TLDSM1_ULSGRO0_USL1_USLMX0_UIOFGRO0_UPLRP0_USFGROn1_USI0_VSn1_VWA2_VWB8_WSGRA0_WSGRB0_WS64_WG64_4_1_WGM8_WGMXCC8_WGMXCCGn1
    SolutionIndex: 58
    SolutionNameMin: Cijk_Ailk_Bljk_F8NSS_BH_Bias_FDMN_SPAML0_A_S_SAV_MT256x224x128_MI16x16x1_SN_LDSB1_AFC1_AG0_AFEM1_AFEM1_ASEM8_CLR1_CADS0_DTLA0_DTLB0_DTVA0_DTVB0_DTVMXSA0_DTVMXSB0_DTVSM0_DPLB0_EPS1_ELFLR0_EMLLn1_FDSI0_GRPM1_GRVWA16_GRVWB16_GSUn1_GSUAMBSK_GSUC1_GSUWGMRR1_GLS0_ISA942_IU1_K1_LDSTI0_LBSPPA4096_LBSPPB256_LBSPPM0_LPA32_LPB32_LPM0_LRVWn1_LWPMn1_MIAV0_MIWT4_14_MO40_MGRIPM1_NTn1_NTA0_NTB0_NTC0_NTD4_NTM0_NEPBS16_NLCA1_NLCB1_ONLL1_PGR2_PLR1_PKA1_SGROB0_SIA3_SS0_SU16_SUM0_SUS256_SPO0_SRVW0_SSO0_SVW4_SK0_SKFTR0_SKXCCM0_SGRO0_TDMI0_TIN0_TLDS1_TLDSM1_ULSGRO0_USL1_USLMX0_UIOFGRO0_UPLRP0_USFGROn1_USI0_VSn1_VWA2_VWB2_WSGRA0_WSGRB0_WS64_WG64_4_1_WGM1_WGMXCC1_WGMXCCGn1
    SolutionIndex: 59
    SolutionNameMin: Cijk_Ailk_Bljk_F8NSS_BH_Bias_FDMN_SPAML0_A_S_SAV_MT256x208x128_MI16x16x1_SN_LDSB1_AFC1_AG0_AFEM1_AFEM1_ASEM8_CLR1_CADS0_DTLA0_DTLB0_DTVA0_DTVB0_DTVMXSA0_DTVMXSB0_DTVSM0_DPLB0_EPS1_ELFLR0_EMLLn1_FDSI0_GRPM1_GRVWA16_GRVWB4_GSUn1_GSUAMBSK_GSUC1_GSUWGMRR1_GLS0_ISA942_IU1_K1_LDSTI0_LBSPPA4096_LBSPPB128_LBSPPM0_LPA32_LPB32_LPM0_LRVWn1_LWPMn1_MIAV0_MIWT4_13_MO40_MGRIPM1_NTn1_NTA0_NTB0_NTC0_NTD4_NTM0_NEPBS16_NLCA1_NLCB1_ONLL1_PGR2_PLR1_PKA1_SGROB0_SIA3_SS0_SU16_SUM0_SUS256_SPO0_SRVW0_SSO0_SVW4_SK0_SKFTR0_SKXCCM0_SGRO0_TDMI0_TIN0_TLDS1_TLDSM1_ULSGRO0_USL1_USLMX0_UIOFGRO0_UPLRP0_USFGROn1_USI0_VSn1_VWA2_VWB1_WSGRA0_WSGRB0_WS64_WG64_4_1_WGM1_WGMXCC1_WGMXCCGn1
    SolutionIndex: 60
    SolutionNameMin: Cijk_Ailk_Bljk_F8NSS_BH_Bias_FDMN_SPAML0_A_S_SAV_MT256x160x128_MI16x16x1_SN_LDSB1_AFC1_AG0_AFEM1_AFEM1_ASEM8_CLR1_CADS0_DTLA0_DTLB0_DTVA0_DTVB0_DTVMXSA0_DTVMXSB0_DTVSM0_DPLB0_EPS1_ELFLR0_EMLLn1_FDSI0_GRPM1_GRVWA16_GRVWB16_GSUn1_GSUAMBSK_GSUC1_GSUWGMRR1_GLS0_ISA942_IU1_K1_LDSTI0_LBSPPA4096_LBSPPB256_LBSPPM0_LPA32_LPB32_LPM0_LRVWn1_LWPMn1_MIAV0_MIWT4_10_MO40_MGRIPM1_NTn1_NTA0_NTB0_NTC0_NTD4_NTM0_NEPBS16_NLCA1_NLCB1_ONLL1_PGR2_PLR1_PKA1_SGROB0_SIA3_SS0_SU16_SUM0_SUS256_SPO0_SRVW0_SSO0_SVW4_SK0_SKFTR0_SKXCCM0_SGRO0_TDMI0_TIN0_TLDS1_TLDSM1_ULSGRO0_USL1_USLMX0_UIOFGRO0_UPLRP0_USFGROn1_USI0_VSn1_VWA2_VWB2_WSGRA0_WSGRB0_WS64_WG64_4_1_WGM1_WGMXCC1_WGMXCCGn1
    SolutionIndex: 61
    SolutionNameMin: Cijk_Ailk_Bljk_F8NSS_BH_Bias_FDMN_SPAML0_A_S_SAV_MT128x288x128_MI16x16x1_SN_LDSB1_AFC1_AG0_AFEM1_AFEM1_ASEM8_CLR1_CADS0_DTLA0_DTLB0_DTVA0_DTVB0_DTVMXSA0_DTVMXSB0_DTVSM0_DPLB0_EPS1_ELFLR0_EMLLn1_FDSI0_GRPM1_GRVWA16_GRVWB16_GSUn1_GSUAMBSK_GSUC1_GSUWGMRR1_GLS0_ISA942_IU1_K1_LDSTI0_LBSPPA2048_LBSPPB128_LBSPPM0_LPA32_LPB32_LPM0_LRVWn1_LWPMn1_MIAV0_MIWT4_9_MO40_MGRIPM1_NTn1_NTA0_NTB0_NTC0_NTD4_NTM0_NEPBS16_NLCA1_NLCB1_ONLL1_PGR2_PLR1_PKA1_SGROB0_SIA3_SS0_SU16_SUM0_SUS256_SPO0_SRVW0_SSO0_SVW4_SK0_SKFTR0_SKXCCM0_SGRO0_TDMI0_TIN0_TLDS1_TLDSM1_ULSGRO0_USL1_USLMX0_UIOFGRO0_UPLRP0_USFGROn1_USI0_VSn1_VWA2_VWB1_WSGRA0_WSGRB0_WS64_WG32_8_1_WGM8_WGMXCC8_WGMXCCGn1
    SolutionIndex: 62
    SolutionNameMin: Cijk_Ailk_Bljk_F8NSS_BH_Bias_FDMN_SPAML0_A_S_SAV_MT160x320x128_MI16x16x1_SN_LDSB1_AFC1_AG0_AFEM1_AFEM1_ASEM8_CLR1_CADS0_DTLA0_DTLB0_DTVA0_DTVB0_DTVMXSA0_DTVMXSB0_DTVSM0_DPLB0_EPS1_ELFLR0_EMLLn1_FDSI0_GRPM1_GRVWA8_GRVWB16_GSUn1_GSUAMBSK_GSUC1_GSUWGMRR1_GLS0_ISA942_IU1_K1_LDSTI0_LBSPPA2560_LBSPPB256_LBSPPM0_LPA16_LPB32_LPM0_LRVWn1_LWPMn1_MIAV0_MIWT5_10_MO40_MGRIPM1_NTn1_NTA0_NTB0_NTC0_NTD4_NTM0_NEPBS16_NLCA5_NLCB1_ONLL1_PGR2_PLR1_PKA1_SGROB0_SIA3_SS0_SU16_SUM0_SUS256_SPO0_SRVW0_SSO0_SVW4_SK0_SKFTR0_SKXCCM0_SGRO0_TDMI0_TIN0_TLDS1_TLDSM1_ULSGRO0_USL1_USLMX0_UIOFGRO0_UPLRP0_USFGROn1_USI0_VSn1_VWA1_VWB2_WSGRA0_WSGRB0_WS64_WG32_8_1_WGM1_WGMXCC1_WGMXCCGn1
    SolutionIndex: 63
    SolutionNameMin: Cijk_Ailk_Bljk_F8NSS_BH_Bias_FDMN_SPAML0_A_S_SAV_MT160x320x128_MI16x16x1_SN_LDSB1_AFC1_AG0_AFEM1_AFEM1_ASEM8_CLR1_CADS0_DTLA0_DTLB0_DTVA0_DTVB0_DTVMXSA0_DTVMXSB0_DTVSM0_DPLB0_EPS1_ELFLR0_EMLLn1_FDSI0_GRPM1_GRVWA8_GRVWB16_GSUn1_GSUAMBSK_GSUC1_GSUWGMRR1_GLS0_ISA942_IU1_K1_LDSTI0_LBSPPA2560_LBSPPB256_LBSPPM0_LPA16_LPB32_LPM0_LRVWn1_LWPMn1_MIAV0_MIWT5_10_MO40_MGRIPM1_NTn1_NTA0_NTB0_NTC0_NTD4_NTM0_NEPBS16_NLCA5_NLCB1_ONLL1_PGR2_PLR1_PKA1_SGROB0_SIA3_SS0_SU16_SUM0_SUS256_SPO0_SRVW0_SSO0_SVW4_SK0_SKFTR0_SKXCCM0_SGRO0_TDMI0_TIN0_TLDS1_TLDSM1_ULSGRO0_USL1_USLMX0_UIOFGRO0_UPLRP0_USFGROn1_USI0_VSn1_VWA1_VWB2_WSGRA0_WSGRB0_WS64_WG32_8_1_WGM8_WGMXCC8_WGMXCCGn1
    SolutionIndex: 64
    SolutionNameMin: Cijk_Ailk_Bljk_F8NSS_BH_Bias_FDMN_SPAML0_A_S_SAV_MT256x160x128_MI16x16x1_SN_LDSB1_AFC1_AG0_AFEM1_AFEM1_ASEM8_CLR1_CADS0_DTLA0_DTLB0_DTVA0_DTVB0_DTVMXSA0_DTVMXSB0_DTVSM0_DPLB0_EPS1_ELFLR0_EMLLn1_FDSI0_GRPM1_GRVWA16_GRVWB16_GSUn1_GSUAMBSK_GSUC1_GSUWGMRR1_GLS0_ISA942_IU1_K1_LDSTI0_LBSPPA4096_LBSPPB256_LBSPPM0_LPA32_LPB32_LPM0_LRVWn1_LWPMn1_MIAV0_MIWT4_10_MO40_MGRIPM1_NTn1_NTA0_NTB0_NTC0_NTD4_NTM0_NEPBS16_NLCA1_NLCB1_ONLL1_PGR2_PLR1_PKA1_SGROB0_SIA3_SS0_SU16_SUM0_SUS256_SPO0_SRVW0_SSO0_SVW4_SK0_SKFTR0_SKXCCM0_SGRO0_TDMI0_TIN0_TLDS1_TLDSM1_ULSGRO0_USL1_USLMX0_UIOFGRO0_UPLRP0_USFGROn1_USI0_VSn1_VWA2_VWB2_WSGRA0_WSGRB0_WS64_WG64_4_1_WGM8_WGMXCC8_WGMXCCGn1
    SolutionIndex: 65
    SolutionNameMin: Cijk_Ailk_Bljk_F8NSS_BH_Bias_FDMN_SPAML0_A_S_SAV_MT32x224x128_MI16x16x1_SN_LDSB1_AFC1_AG0_AFEM1_AFEM1_ASEM8_CLR1_CADS0_DTLA0_DTLB0_DTVA0_DTVB0_DTVMXSA0_DTVMXSB0_DTVSM0_DPLB0_EPS1_ELFLR0_EMLLn1_FDSI0_GRPM1_GRVWA8_GRVWB4_GSUn1_GSUAMBSK_GSUC1_GSUWGMRR1_GLS0_ISA942_IU1_K1_LDSTI0_LBSPPA512_LBSPPB128_LBSPPM0_LPA16_LPB32_LPM0_LRVWn1_LWPMn1_MIAV0_MIWT1_7_MO40_MGRIPM1_NTn1_NTA0_NTB0_NTC0_NTD4_NTM0_NEPBS16_NLCA1_NLCB1_ONLL1_PGR2_PLR1_PKA1_SGROB0_SIA3_SS0_SU16_SUM0_SUS256_SPO0_SRVW0_SSO0_SVW4_SK0_SKFTR0_SKXCCM0_SGRO0_TDMI0_TIN0_TLDS1_TLDSM1_ULSGRO0_USL1_USLMX0_UIOFGRO0_UPLRP0_USFGROn1_USI0_VSn1_VWA1_VWB1_WSGRA0_WSGRB0_WS64_WG32_8_1_WGM1_WGMXCC1_WGMXCCGn1
    SolutionIndex: 66
    SolutionNameMin: Cijk_Ailk_Bljk_F8NSS_BH_Bias_FDMN_SPAML0_A_S_SAV_MT16x64x256_MI16x16x1_SN_LDSB1_AFC1_AG0_AFEM1_AFEM1_ASEM8_CLR1_CADS0_DTLA0_DTLB0_DTVA0_DTVB0_DTVMXSA0_DTVMXSB0_DTVSM0_DPLB0_EPS1_ELFLR0_EMLLn1_FDSI0_GRPM1_GRVWA8_GRVWB16_GSUn1_GSUAMBSK_GSUC1_GSUWGMRR1_GLS0_ISA942_IU1_K1_LDSTI0_LBSPPA256_LBSPPB256_LBSPPM0_LPA16_LPB32_LPM0_LRVWn1_LWPMn1_MIAV0_MIWT1_1_MO40_MGRIPM1_NTn1_NTA0_NTB0_NTC0_NTD4_NTM0_NEPBS16_NLCA1_NLCB1_ONLL1_PGR2_PLR1_PKA1_SGROB0_SIA3_SS0_SU16_SUM0_SUS256_SPO0_SRVW0_SSO0_SVW4_SK0_SKFTR0_SKXCCM0_SGRO0_TDMI0_TIN0_TLDS1_TLDSM1_ULSGRO0_USL1_USLMX0_UIOFGRO0_UPLRP0_USFGROn1_USI0_VSn1_VWA1_VWB1_WSGRA0_WSGRB0_WS64_WG16_16_1_WGM1_WGMXCC1_WGMXCCGn1
    SolutionIndex: 67
    SolutionNameMin: Cijk_Ailk_Bljk_F8NSS_BH_Bias_FDMN_SPAML0_A_S_SAV_MT32x96x128_MI16x16x1_SN_LDSB1_AFC1_AG0_AFEM1_AFEM1_ASEM8_CLR1_CADS0_DTLA0_DTLB0_DTVA0_DTVB0_DTVMXSA0_DTVMXSB0_DTVSM0_DPLB0_EPS1_ELFLR0_EMLLn1_FDSI0_GRPM1_GRVWA8_GRVWB16_GSUn1_GSUAMBSK_GSUC1_GSUWGMRR1_GLS0_ISA942_IU1_K1_LDSTI0_LBSPPA512_LBSPPB128_LBSPPM0_LPA16_LPB32_LPM0_LRVWn1_LWPMn1_MIAV0_MIWT1_3_MO40_MGRIPM1_NTn1_NTA0_NTB0_NTC0_NTD4_NTM0_NEPBS16_NLCA1_NLCB1_ONLL1_PGR2_PLR1_PKA1_SGROB0_SIA3_SS0_SU16_SUM0_SUS256_SPO0_SRVW0_SSO0_SVW4_SK0_SKFTR0_SKXCCM0_SGRO0_TDMI0_TIN0_TLDS1_TLDSM1_ULSGRO0_USL1_USLMX0_UIOFGRO0_UPLRP0_USFGROn1_USI0_VSn1_VWA1_VWB1_WSGRA0_WSGRB0_WS64_WG32_8_1_WGM8_WGMXCC8_WGMXCCGn1
    SolutionIndex: 68
    SolutionNameMin: Cijk_Ailk_Bljk_F8NSS_BH_Bias_FDMN_SPAML0_A_S_SAV_MT32x96x128_MI16x16x1_SN_LDSB1_AFC1_AG0_AFEM1_AFEM1_ASEM8_CLR1_CADS0_DTLA0_DTLB0_DTVA0_DTVB0_DTVMXSA0_DTVMXSB0_DTVSM0_DPLB0_EPS1_ELFLR0_EMLLn1_FDSI0_GRPM1_GRVWA8_GRVWB16_GSUn1_GSUAMBSK_GSUC1_GSUWGMRR1_GLS0_ISA942_IU1_K1_LDSTI0_LBSPPA512_LBSPPB128_LBSPPM0_LPA16_LPB32_LPM0_LRVWn1_LWPMn1_MIAV0_MIWT1_3_MO40_MGRIPM1_NTn1_NTA0_NTB0_NTC0_NTD4_NTM0_NEPBS16_NLCA1_NLCB1_ONLL1_PGR2_PLR1_PKA1_SGROB0_SIA3_SS0_SU16_SUM0_SUS256_SPO0_SRVW0_SSO0_SVW4_SK0_SKFTR0_SKXCCM0_SGRO0_TDMI0_TIN0_TLDS1_TLDSM1_ULSGRO0_USL1_USLMX0_UIOFGRO0_UPLRP0_USFGROn1_USI0_VSn1_VWA1_VWB1_WSGRA0_WSGRB0_WS64_WG32_8_1_WGM1_WGMXCC1_WGMXCCGn1
    SolutionIndex: 69
    SolutionNameMin: Cijk_Ailk_Bljk_F8NSS_BH_Bias_FDMN_SPAML0_A_S_SAV_MT256x192x128_MI16x16x1_SN_LDSB1_AFC1_AG0_AFEM1_AFEM1_ASEM8_CLR1_CADS0_DTLA0_DTLB0_DTVA0_DTVB0_DTVMXSA0_DTVMXSB0_DTVSM0_DPLB0_EPS1_ELFLR0_EMLLn1_FDSI0_GRPM1_GRVWA16_GRVWB16_GSUn1_GSUAMBSK_GSUC1_GSUWGMRR1_GLS0_ISA942_IU1_K1_LDSTI0_LBSPPA4096_LBSPPB512_LBSPPM0_LPA32_LPB32_LPM0_LRVWn1_LWPMn1_MIAV0_MIWT4_12_MO40_MGRIPM1_NTn1_NTA0_NTB0_NTC0_NTD4_NTM0_NEPBS16_NLCA1_NLCB1_ONLL1_PGR2_PLR1_PKA1_SGROB0_SIA3_SS0_SU16_SUM0_SUS256_SPO0_SRVW0_SSO0_SVW4_SK0_SKFTR0_SKXCCM0_SGRO0_TDMI0_TIN0_TLDS1_TLDSM1_ULSGRO0_USL1_USLMX0_UIOFGRO0_UPLRP0_USFGROn1_USI0_VSn1_VWA2_VWB4_WSGRA0_WSGRB0_WS64_WG64_4_1_WGM8_WGMXCC8_WGMXCCGn1
    SolutionIndex: 70
    SolutionNameMin: Cijk_Ailk_Bljk_F8NSS_BH_Bias_FDMN_SPAML0_A_S_SAV_MT64x224x128_MI16x16x1_SN_LDSB1_AFC1_AG0_AFEM1_AFEM1_ASEM8_CLR1_CADS0_DTLA0_DTLB0_DTVA0_DTVB0_DTVMXSA0_DTVMXSB0_DTVSM0_DPLB0_EPS1_ELFLR0_EMLLn1_FDSI0_GRPM1_GRVWA16_GRVWB16_GSUn1_GSUAMBSK_GSUC1_GSUWGMRR1_GLS0_ISA942_IU1_K1_LDSTI0_LBSPPA1024_LBSPPB256_LBSPPM0_LPA16_LPB32_LPM0_LRVWn1_LWPMn1_MIAV0_MIWT1_14_MO40_MGRIPM1_NTn1_NTA0_NTB0_NTC0_NTD4_NTM0_NEPBS16_NLCA1_NLCB1_ONLL1_PGR2_PLR1_PKA1_SGROB0_SIA3_SS0_SU16_SUM0_SUS256_SPO0_SRVW0_SSO0_SVW4_SK0_SKFTR0_SKXCCM0_SGRO0_TDMI0_TIN0_TLDS1_TLDSM1_ULSGRO0_USL1_USLMX0_UIOFGRO0_UPLRP0_USFGROn1_USI0_VSn1_VWA1_VWB2_WSGRA0_WSGRB0_WS64_WG64_4_1_WGM8_WGMXCC8_WGMXCCGn1
    SolutionIndex: 71
    SolutionNameMin: Cijk_Ailk_Bljk_F8NSS_BH_Bias_FDMN_SPAML0_A_S_SAV_MT64x224x128_MI16x16x1_SN_LDSB1_AFC1_AG0_AFEM1_AFEM1_ASEM8_CLR1_CADS0_DTLA0_DTLB0_DTVA0_DTVB0_DTVMXSA0_DTVMXSB0_DTVSM0_DPLB0_EPS1_ELFLR0_EMLLn1_FDSI0_GRPM1_GRVWA16_GRVWB16_GSUn1_GSUAMBSK_GSUC1_GSUWGMRR1_GLS0_ISA942_IU1_K1_LDSTI0_LBSPPA1024_LBSPPB128_LBSPPM0_LPA32_LPB32_LPM0_LRVWn1_LWPMn1_MIAV0_MIWT2_7_MO40_MGRIPM1_NTn1_NTA0_NTB0_NTC0_NTD4_NTM0_NEPBS16_NLCA1_NLCB1_ONLL1_PGR2_PLR1_PKA1_SGROB0_SIA3_SS0_SU16_SUM0_SUS256_SPO0_SRVW0_SSO0_SVW4_SK0_SKFTR0_SKXCCM0_SGRO0_TDMI0_TIN0_TLDS1_TLDSM1_ULSGRO0_USL1_USLMX0_UIOFGRO0_UPLRP0_USFGROn1_USI0_VSn1_VWA2_VWB1_WSGRA0_WSGRB0_WS64_WG32_8_1_WGM8_WGMXCC8_WGMXCCGn1
    SolutionIndex: 72
    SolutionNameMin: Cijk_Ailk_Bljk_F8NSS_BH_Bias_FDMN_SPAML0_A_S_SAV_MT64x144x256_MI16x16x1_SN_LDSB1_AFC1_AG0_AFEM1_AFEM1_ASEM8_CLR1_CADS0_DTLA0_DTLB0_DTVA0_DTVB0_DTVMXSA0_DTVMXSB0_DTVSM0_DPLB0_EPS1_ELFLR0_EMLLn1_FDSI0_GRPM1_GRVWA16_GRVWB16_GSUn1_GSUAMBSK_GSUC1_GSUWGMRR1_GLS0_ISA942_IU1_K1_LDSTI0_LBSPPA1024_LBSPPB256_LBSPPM0_LPA16_LPB32_LPM0_LRVWn1_LWPMn1_MIAV0_MIWT1_9_MO40_MGRIPM1_NTn1_NTA0_NTB0_NTC0_NTD4_NTM0_NEPBS16_NLCA1_NLCB1_ONLL1_PGR2_PLR1_PKA1_SGROB0_SIA3_SS0_SU16_SUM0_SUS256_SPO0_SRVW0_SSO0_SVW4_SK0_SKFTR0_SKXCCM0_SGRO0_TDMI0_TIN0_TLDS1_TLDSM1_ULSGRO0_USL1_USLMX0_UIOFGRO0_UPLRP0_USFGROn1_USI0_VSn1_VWA1_VWB1_WSGRA0_WSGRB0_WS64_WG64_4_1_WGM1_WGMXCC1_WGMXCCGn1
    SolutionIndex: 73
    SolutionNameMin: Cijk_Ailk_Bljk_F8NSS_BH_Bias_FDMN_SPAML0_A_S_SAV_MT64x224x128_MI16x16x1_SN_LDSB1_AFC1_AG0_AFEM1_AFEM1_ASEM8_CLR1_CADS0_DTLA0_DTLB0_DTVA0_DTVB0_DTVMXSA0_DTVMXSB0_DTVSM0_DPLB0_EPS1_ELFLR0_EMLLn1_FDSI0_GRPM1_GRVWA16_GRVWB16_GSUn1_GSUAMBSK_GSUC1_GSUWGMRR1_GLS0_ISA942_IU1_K1_LDSTI0_LBSPPA1024_LBSPPB128_LBSPPM0_LPA32_LPB32_LPM0_LRVWn1_LWPMn1_MIAV0_MIWT2_7_MO40_MGRIPM1_NTn1_NTA0_NTB0_NTC0_NTD4_NTM0_NEPBS16_NLCA1_NLCB1_ONLL1_PGR2_PLR1_PKA1_SGROB0_SIA3_SS0_SU16_SUM0_SUS256_SPO0_SRVW0_SSO0_SVW4_SK0_SKFTR0_SKXCCM0_SGRO0_TDMI0_TIN0_TLDS1_TLDSM1_ULSGRO0_USL1_USLMX0_UIOFGRO0_UPLRP0_USFGROn1_USI0_VSn1_VWA2_VWB1_WSGRA0_WSGRB0_WS64_WG32_8_1_WGM1_WGMXCC1_WGMXCCGn1
    SolutionIndex: 74
    SolutionNameMin: Cijk_Ailk_Bljk_F8NSS_BH_Bias_FDMN_SPAML0_A_S_SAV_MT32x160x256_MI16x16x1_SN_LDSB1_AFC1_AG0_AFEM1_AFEM1_ASEM8_CLR1_CADS0_DTLA0_DTLB0_DTVA0_DTVB0_DTVMXSA0_DTVMXSB0_DTVSM0_DPLB0_EPS1_ELFLR0_EMLLn1_FDSI0_GRPM1_GRVWA16_GRVWB16_GSUn1_GSUAMBSK_GSUC1_GSUWGMRR1_GLS0_ISA942_IU1_K1_LDSTI0_LBSPPA512_LBSPPB256_LBSPPM0_LPA16_LPB32_LPM0_LRVWn1_LWPMn1_MIAV0_MIWT1_5_MO40_MGRIPM1_NTn1_NTA0_NTB0_NTC0_NTD4_NTM0_NEPBS16_NLCA1_NLCB1_ONLL1_PGR2_PLR1_PKA1_SGROB0_SIA3_SS0_SU16_SUM0_SUS256_SPO0_SRVW0_SSO0_SVW4_SK0_SKFTR0_SKXCCM0_SGRO0_TDMI0_TIN0_TLDS1_TLDSM1_ULSGRO0_USL1_USLMX0_UIOFGRO0_UPLRP0_USFGROn1_USI0_VSn1_VWA1_VWB1_WSGRA0_WSGRB0_WS64_WG32_8_1_WGM1_WGMXCC1_WGMXCCGn1
- - - [10752, 10240, 1, 512]
    - [3, 268.79]
  - - [9216, 10752, 1, 512]
    - [3, 259.59]
  - - [10240, 11264, 1, 512]
    - [3, 247.37]
  - - [9216, 17664, 1, 512]
    - [2, 267.45]
  - - [25600, 19968, 1, 512]
    - [1, 274.46]
  - - [25600, 20736, 1, 512]
    - [1, 272.49]
  - - [21504, 5120, 1, 512]
    - [3, 260.7]
  - - [13312, 7168, 1, 512]
    - [3, 244.92]
  - - [21504, 23040, 1, 512]
    - [0, 273.82]
  - - [24576, 4864, 1, 512]
    - [2, 260.94]
  - - [22528, 4352, 1, 512]
    - [4, 241.23]
  - - [90112, 800, 1, 512]
    - [5, 228.18]
  - - [23296, 4096, 1, 512]
    - [5, 240.93]
  - - [25600, 3840, 1, 512]
    - [4, 242.83]
  - - [21504, 4352, 1, 512]
    - [6, 251.47]
  - - [21760, 4352, 1, 512]
    - [4, 238.72]
  - - [53504, 1728, 1, 512]
    - [5, 233.11]
  - - [26624, 3584, 1, 512]
    - [7, 235.5]
  - - [43008, 2304, 1, 512]
    - [4, 246.57]
  - - [37632, 2432, 1, 512]
    - [7, 240.41]
  - - [4096, 131072, 1, 512]
    - [2, 252.9]
  - - [992, 42240, 1, 512]
    - [8, 191.95]
  - - [512, 100352, 1, 512]
    - [9, 159.42]
  - - [480, 119040, 1, 512]
    - [9, 212.88]
  - - [2304, 76032, 1, 512]
    - [10, 255.48]
  - - [2048, 70400, 1, 512]
    - [11, 213.03]
  - - [608, 131072, 1, 512]
    - [10, 193.46]
  - - [432, 126976, 1, 512]
    - [12, 157.7]
  - - [608, 69888, 1, 512]
    - [10, 170.02]
  - - [496, 82432, 1, 512]
    - [13, 166.7]
  - - [272, 100352, 1, 512]
    - [14, 119.84]
  - - [240, 122880, 1, 512]
    - [15, 128.43]
  - - [416, 49152, 1, 512]
    - [16, 159.89]
  - - [240, 126976, 1, 512]
    - [15, 131.45]
  - - [240, 102400, 1, 512]
    - [15, 127.22]
  - - [272, 98304, 1, 512]
    - [17, 118.93]
  - - [400, 93184, 1, 512]
    - [4, 177.85]
  - - [240, 103168, 1, 512]
    - [18, 125.5]
  - - [272, 99840, 1, 512]
    - [17, 119.63]
  - - [400, 92160, 1, 512]
    - [19, 175.69]
  - - [16, 16, 1, 512]
    - [20, 0.03]
  - - [7680, 16896, 1, 2048]
    - [21, 493.43]
  - - [9984, 7936, 1, 2048]
    - [2, 464.94]
  - - [12800, 6144, 1, 2048]
    - [22, 441.37]
  - - [16128, 16128, 1, 2048]
    - [23, 502.11]
  - - [6656, 19968, 1, 2048]
    - [10, 465.31]
  - - [32768, 13824, 1, 2048]
    - [22, 494.3]
  - - [7936, 9984, 1, 2048]
    - [2, 448.41]
  - - [8192, 8960, 1, 2048]
    - [24, 452.24]
  - - [5376, 16640, 1, 2048]
    - [2, 492.78]
  - - [8960, 5632, 1, 2048]
    - [25, 449.41]
  - - [47872, 992, 1, 2048]
    - [10, 439.69]
  - - [83200, 736, 1, 2048]
    - [10, 433.97]
  - - [96768, 608, 1, 2048]
    - [22, 428.49]
  - - [25344, 2816, 1, 2048]
    - [10, 476.68]
  - - [59392, 1152, 1, 2048]
    - [22, 429.27]
  - - [46592, 1536, 1, 2048]
    - [10, 455.9]
  - - [43520, 1792, 1, 2048]
    - [24, 451.89]
  - - [90112, 496, 1, 2048]
    - [26, 396.21]
  - - [47872, 1856, 1, 2048]
    - [23, 466.16]
  - - [61952, 1024, 1, 2048]
    - [10, 438.64]
  - - [3968, 14592, 1, 2048]
    - [10, 431.48]
  - - [2688, 33792, 1, 2048]
    - [24, 476.59]
  - - [768, 69632, 1, 2048]
    - [10, 435.21]
  - - [576, 103168, 1, 2048]
    - [10, 429.86]
  - - [768, 66816, 1, 2048]
    - [24, 457.68]
  - - [768, 76800, 1, 2048]
    - [10, 446.11]
  - - [512, 99840, 1, 2048]
    - [27, 343.94]
  - - [480, 107520, 1, 2048]
    - [13, 365.95]
  - - [4096, 25088, 1, 2048]
    - [10, 436.88]
  - - [1984, 41216, 1, 2048]
    - [24, 419.21]
  - - [69888, 432, 1, 2048]
    - [24, 393.7]
  - - [5120, 4352, 1, 2048]
    - [28, 394.54]
  - - [272, 77824, 1, 2048]
    - [2, 240.31]
  - - [53248, 704, 1, 2048]
    - [10, 422.07]
  - - [14592, 1792, 1, 2048]
    - [24, 459.11]
  - - [26624, 864, 1, 2048]
    - [28, 392.54]
  - - [34048, 1024, 1, 2048]
    - [10, 428.76]
  - - [52224, 512, 1, 2048]
    - [10, 440.37]
  - - [29184, 896, 1, 2048]
    - [24, 456.09]
  - - [1216, 17664, 1, 2048]
    - [24, 355.37]
  - - [50688, 320, 1, 2048]
    - [29, 421.01]
  - - [33792, 448, 1, 2048]
    - [4, 357.87]
  - - [160, 115200, 1, 2048]
    - [30, 291.98]
  - - [1280, 13312, 1, 2048]
    - [31, 433.84]
  - - [16896, 928, 1, 2048]
    - [29, 399.85]
  - - [736, 19712, 1, 2048]
    - [32, 283.36]
  - - [128, 115200, 1, 2048]
    - [33, 237.81]
  - - [60928, 256, 1, 2048]
    - [34, 358.62]
  - - [30720, 464, 1, 2048]
    - [23, 353.74]
  - - [128, 114688, 1, 2048]
    - [35, 236.42]
  - - [128, 103680, 1, 2048]
    - [35, 235.17]
  - - [128, 103936, 1, 2048]
    - [35, 233.87]
  - - [128, 96512, 1, 2048]
    - [36, 229.81]
  - - [128, 103168, 1, 2048]
    - [33, 232.06]
  - - [128, 100352, 1, 2048]
    - [37, 231.08]
  - - [96, 111360, 1, 2048]
    - [38, 226.97]
  - - [96, 115200, 1, 2048]
    - [39, 228.65]
  - - [128, 96000, 1, 2048]
    - [40, 235.25]
  - - [128, 99840, 1, 2048]
    - [33, 233.06]
  - - [128, 102400, 1, 2048]
    - [33, 233.54]
  - - [1024, 1024, 1, 2048]
    - [41, 164.06]
  - - [7424, 7936, 1, 4096]
    - [23, 541.57]
  - - [6144, 11264, 1, 4096]
    - [10, 521.66]
  - - [8960, 8960, 1, 4096]
    - [23, 526.32]
  - - [4608, 15872, 1, 4096]
    - [10, 533.45]
  - - [8960, 6656, 1, 4096]
    - [1, 547.89]
  - - [9984, 7936, 1, 4096]
    - [2, 534.32]
  - - [5376, 14336, 1, 4096]
    - [24, 549.58]
  - - [4608, 19712, 1, 4096]
    - [24, 541.32]
  - - [4608, 16640, 1, 4096]
    - [24, 537.65]
  - - [12288, 4864, 1, 4096]
    - [2, 558.58]
  - - [62208, 1024, 1, 4096]
    - [10, 556.08]
  - - [29696, 2304, 1, 4096]
    - [2, 506.18]
  - - [19200, 2816, 1, 4096]
    - [2, 539.58]
  - - [20736, 2816, 1, 4096]
    - [2, 558.87]
  - - [96512, 496, 1, 4096]
    - [10, 489.15]
  - - [24320, 2304, 1, 4096]
    - [23, 531.95]
  - - [50176, 992, 1, 4096]
    - [10, 519.35]
  - - [45056, 1216, 1, 4096]
    - [10, 526.71]
  - - [28160, 2048, 1, 4096]
    - [42, 524.83]
  - - [17664, 3200, 1, 4096]
    - [2, 547.29]
  - - [3456, 20736, 1, 4096]
    - [2, 534.05]
  - - [1984, 43776, 1, 4096]
    - [24, 466.46]
  - - [768, 66560, 1, 4096]
    - [24, 493.45]
  - - [768, 73728, 1, 4096]
    - [10, 488.07]
  - - [608, 84480, 1, 4096]
    - [24, 412.32]
  - - [2048, 34048, 1, 4096]
    - [27, 515.61]
  - - [768, 94208, 1, 4096]
    - [10, 501.83]
  - - [448, 100352, 1, 4096]
    - [43, 391.45]
  - - [3072, 23808, 1, 4096]
    - [10, 532.02]
  - - [992, 64768, 1, 4096]
    - [10, 446.06]
  - - [19456, 1472, 1, 4096]
    - [44, 480.07]
  - - [96512, 240, 1, 4096]
    - [10, 455.5]
  - - [7936, 3072, 1, 4096]
    - [24, 507.56]
  - - [16128, 1472, 1, 4096]
    - [24, 507.54]
  - - [736, 28672, 1, 4096]
    - [45, 381.53]
  - - [1024, 36864, 1, 4096]
    - [46, 494.31]
  - - [192, 119040, 1, 4096]
    - [24, 376.19]
  - - [31744, 736, 1, 4096]
    - [10, 470.41]
  - - [352, 111104, 1, 4096]
    - [10, 314.69]
  - - [15872, 1472, 1, 4096]
    - [24, 484.53]
  - - [1728, 8448, 1, 4096]
    - [10, 531.37]
  - - [192, 76544, 1, 4096]
    - [47, 354.77]
  - - [256, 70400, 1, 4096]
    - [46, 371.64]
  - - [192, 75264, 1, 4096]
    - [47, 351.74]
  - - [192, 77824, 1, 4096]
    - [47, 357.55]
  - - [128, 107520, 1, 4096]
    - [37, 278.11]
  - - [192, 76800, 1, 4096]
    - [21, 352.18]
  - - [144, 103168, 1, 4096]
    - [48, 198.79]
  - - [192, 73728, 1, 4096]
    - [47, 346.22]
  - - [192, 76032, 1, 4096]
    - [47, 352.5]
  - - [128, 96000, 1, 4096]
    - [49, 280.99]
  - - [128, 103168, 1, 4096]
    - [37, 277.39]
  - - [128, 103680, 1, 4096]
    - [37, 279.41]
  - - [128, 103936, 1, 4096]
    - [50, 279.83]
  - - [5888, 1856, 1, 4096]
    - [24, 442.82]
  - - [128, 96768, 1, 4096]
    - [36, 272.82]
  - - [128, 89856, 1, 4096]
    - [49, 268.58]
  - - [128, 96512, 1, 4096]
    - [49, 273.81]
  - - [128, 100352, 1, 4096]
    - [37, 277.34]
  - - [96, 111360, 1, 4096]
    - [38, 236.97]
  - - [16, 88320, 1, 4096]
    - [51, 45.26]
  - - [32, 90112, 1, 4096]
    - [52, 85.12]
  - - [48, 64768, 1, 4096]
    - [53, 96.92]
  - - [16, 65280, 1, 4096]
    - [51, 42.17]
  - - [16, 70400, 1, 4096]
    - [51, 43.91]
  - - [32, 73728, 1, 4096]
    - [54, 82.64]
  - - [16, 79360, 1, 4096]
    - [51, 43.39]
  - - [16, 81664, 1, 4096]
    - [51, 43.53]
  - - [16, 81920, 1, 4096]
    - [51, 43.84]
  - - [32, 86016, 1, 4096]
    - [55, 83.77]
  - - [4608, 12544, 1, 8192]
    - [46, 650.42]
  - - [4608, 14848, 1, 8192]
    - [27, 626.12]
  - - [7936, 7424, 1, 8192]
    - [46, 638.65]
  - - [12800, 4608, 1, 8192]
    - [46, 636.53]
  - - [5376, 10752, 1, 8192]
    - [46, 641.79]
  - - [6400, 12288, 1, 8192]
    - [46, 654.42]
  - - [4608, 15360, 1, 8192]
    - [46, 624.95]
  - - [12288, 19712, 1, 8192]
    - [27, 680.05]
  - - [9984, 8192, 1, 8192]
    - [27, 634.68]
  - - [4864, 12288, 1, 8192]
    - [46, 646.68]
  - - [32256, 1600, 1, 8192]
    - [46, 607.45]
  - - [38400, 1536, 1, 8192]
    - [46, 653.25]
  - - [46080, 1280, 1, 8192]
    - [46, 649.69]
  - - [24320, 2304, 1, 8192]
    - [46, 624.81]
  - - [42240, 1280, 1, 8192]
    - [46, 636.31]
  - - [23296, 2304, 1, 8192]
    - [46, 605.49]
  - - [53760, 1024, 1, 8192]
    - [46, 626.79]
  - - [44544, 1280, 1, 8192]
    - [46, 649.75]
  - - [33280, 1600, 1, 8192]
    - [46, 593.09]
  - - [32256, 1728, 1, 8192]
    - [46, 631.33]
  - - [2048, 36864, 1, 8192]
    - [46, 649.43]
  - - [768, 71680, 1, 8192]
    - [46, 559.8]
  - - [1280, 44544, 1, 8192]
    - [46, 613.2]
  - - [2304, 25600, 1, 8192]
    - [46, 625.38]
  - - [768, 72960, 1, 8192]
    - [46, 563.9]
  - - [1984, 35328, 1, 8192]
    - [10, 565.18]
  - - [1472, 46080, 1, 8192]
    - [10, 542.9]
  - - [768, 66560, 1, 8192]
    - [27, 579.13]
  - - [768, 76800, 1, 8192]
    - [46, 572.05]
  - - [1536, 38400, 1, 8192]
    - [46, 641.89]
  - - [288, 78848, 1, 8192]
    - [56, 351.86]
  - - [400, 78848, 1, 8192]
    - [13, 362.07]
  - - [320, 89856, 1, 8192]
    - [1, 474.45]
  - - [78848, 480, 1, 8192]
    - [47, 487.19]
  - - [768, 47616, 1, 8192]
    - [46, 565.88]
  - - [34048, 928, 1, 8192]
    - [46, 572.29]
  - - [14080, 2688, 1, 8192]
    - [46, 602.26]
  - - [47872, 704, 1, 8192]
    - [46, 589.49]
  - - [48384, 736, 1, 8192]
    - [46, 604.59]
  - - [37632, 992, 1, 8192]
    - [46, 630.88]
  - - [240, 70656, 1, 8192]
    - [21, 300.87]
  - - [47104, 304, 1, 8192]
    - [22, 520.44]
  - - [384, 50176, 1, 8192]
    - [44, 430.77]
  - - [10240, 1856, 1, 8192]
    - [57, 526.1]
  - - [512, 37632, 1, 8192]
    - [46, 534.93]
  - - [256, 62208, 1, 8192]
    - [58, 464.72]
  - - [256, 64768, 1, 8192]
    - [27, 470.65]
  - - [256, 59136, 1, 8192]
    - [59, 448.03]
  - - [256, 65536, 1, 8192]
    - [58, 470.81]
  - - [8448, 2176, 1, 8192]
    - [46, 578.88]
  - - [256, 39168, 1, 8192]
    - [60, 406.52]
  - - [320, 41472, 1, 8192]
    - [23, 453.96]
  - - [176, 69120, 1, 8192]
    - [10, 279.21]
  - - [51968, 256, 1, 8192]
    - [10, 505.4]
  - - [192, 66816, 1, 8192]
    - [8, 424.81]
  - - [128, 82944, 1, 8192]
    - [61, 335.37]
  - - [192, 56576, 1, 8192]
    - [45, 395.85]
  - - [112, 96768, 1, 8192]
    - [62, 229.5]
  - - [112, 96000, 1, 8192]
    - [63, 227.53]
  - - [512, 19968, 1, 8192]
    - [64, 457.03]
  - - [32, 59136, 1, 8192]
    - [65, 91.98]
  - - [16, 55552, 1, 8192]
    - [66, 48.17]
  - - [16, 52992, 1, 8192]
    - [66, 47.99]
  - - [32, 51968, 1, 8192]
    - [67, 90.59]
  - - [32, 52224, 1, 8192]
    - [68, 90.93]
  - - [32, 46080, 1, 8192]
    - [68, 89.51]
  - - [16, 48384, 1, 8192]
    - [66, 46.41]
  - - [32, 59904, 1, 8192]
    - [65, 92.54]
  - - [32, 59392, 1, 8192]
    - [65, 91.96]
  - - [16, 49152, 1, 8192]
    - [66, 46.78]
  - - [8192, 1792, 1, 32768]
    - [27, 692.78]
  - - [29440, 512, 1, 32768]
    - [46, 585.39]
  - - [6400, 2560, 1, 32768]
    - [27, 699.11]
  - - [5376, 2816, 1, 32768]
    - [27, 673.73]
  - - [3968, 4096, 1, 32768]
    - [27, 689.9]
  - - [3584, 4608, 1, 32768]
    - [27, 689.24]
  - - [28160, 512, 1, 32768]
    - [47, 570.3]
  - - [1792, 9216, 1, 32768]
    - [27, 695.72]
  - - [9216, 1472, 1, 32768]
    - [69, 673.77]
  - - [3840, 4096, 1, 32768]
    - [27, 682.57]
  - - [29696, 416, 1, 32768]
    - [27, 511.89]
  - - [25344, 496, 1, 32768]
    - [69, 567.58]
  - - [7680, 1408, 1, 32768]
    - [61, 593.79]
  - - [19712, 608, 1, 32768]
    - [27, 533.33]
  - - [640, 16128, 1, 32768]
    - [61, 489.56]
  - - [23808, 496, 1, 32768]
    - [69, 548.52]
  - - [30464, 432, 1, 32768]
    - [27, 543.69]
  - - [9216, 1280, 1, 32768]
    - [64, 652.6]
  - - [5376, 2304, 1, 32768]
    - [69, 643.04]
  - - [4352, 2944, 1, 32768]
    - [69, 664.56]
  - - [48, 131072, 1, 32768]
    - [70, 161.78]
  - - [64, 131072, 1, 32768]
    - [71, 218.74]
  - - [48, 126976, 1, 32768]
    - [70, 160.93]
  - - [64, 126976, 1, 32768]
    - [71, 216.49]
  - - [64, 122880, 1, 32768]
    - [71, 212.46]
  - - [48, 122880, 1, 32768]
    - [72, 158.82]
  - - [64, 119040, 1, 32768]
    - [73, 208.78]
  - - [48, 119040, 1, 32768]
    - [70, 156.38]
  - - [32, 131072, 1, 32768]
    - [74, 114.67]
  - - [48, 118784, 1, 32768]
    - [72, 156.61]
- null
- null
- DeviceEfficiency
- GridBased
