projects/hipblaslt/library/src/amd_detail/rocblaslt/src/Tensile/Logic/asm_full/gfx950/Equality/gfx950_Cijk_Ailk_Bljk_HHS_BH_BiasSH_HAS_SAV_UserArgs.yaml
- {MinimumRequiredVersion: 5.0.0}
- gfx950
- gfx950
- [Device 75a0]
    SolutionIndex: 0
    SolutionNameMin: Cijk_Ailk_Bljk_HHS_BH_Bias_HA_S_SAV_UserArgs_MT16x320x32_MI16x16x1_CMS_SN_LDSB1_AFC0_AFEM1_AFEM1_ASEM1_CLR0_CADS0_DTLA0_DTLB0_DTVA0_DTVB0_EPS1_FDSI0_GRPM1_GRVWA1_GRVWB4_GSU0_GSUAMB_GSUC0_GSUWGMRR0_GLS0_ISA950_IU1_K1_LDSTI0_LBSPPA128_LBSPPB128_LBSPPM0_LPA16_LPB16_LPM0_LRVW8_LWPMn1_MIAV1_MIWT1_5_MO40_NTn1_NTA2_NTB0_NTC0_NTD6_NTM0_NEPBS8_NLCA1_NLCB1_ONLL1_PGR1_PLR0_PKA1_SIA3_SS0_SU0_SUM0_SUS0_SPO0_SRVW0_SSO1_SVW4_SK3_SKFTR0_SKXCCM0_TLDS2_ULSGRO0_USL1_UIOFGRO0_USFGROn1_VSn1_VWA1_VWB1_WSGRA0_WSGRB0_WS64_WG16_16_1_WGM1_WGMXCC8_WGMXCCGn1
    SolutionIndex: 1
    SolutionNameMin: Cijk_Ailk_Bljk_HHS_BH_Bias_HA_S_SAV_UserArgs_MT16x32x32_MI16x16x1_CMS_SN_LDSB1_AFC0_AFEM1_AFEM1_ASEM1_CLR0_CADS0_DTLA0_DTLB0_DTVA0_DTVB0_EPS0_FDSI0_GRPM1_GRVWA1_GRVWB8_GSU0_GSUAMB_GSUC0_GSUWGMRR0_GLS0_ISA950_IU1_K1_LDSTI0_LBSPPA128_LBSPPB128_LBSPPM0_LPA16_LPB16_LPM0_LRVW8_LWPMn1_MIAV0_MIWT1_1_MO40_NTn1_NTA0_NTB1_NTC1_NTD1_NTM0_NEPBS12_NLCA1_NLCB1_ONLL1_PGR2_PLR0_PKA1_SIA3_SS1_SU0_SUM0_SUS0_SPO1_SRVW0_SSO0_SVW1_SK3_SKFTR0_SKXCCM0_TLDS2_ULSGRO0_USL1_UIOFGRO0_USFGRO1_VSn1_VWA1_VWB1_WSGRA0_WSGRB0_WS64_WG16_8_1_WGM1_WGMXCC8_WGMXCCGn1
    SolutionIndex: 2
    SolutionNameMin: Cijk_Ailk_Bljk_HHS_BH_Bias_HA_S_SAV_UserArgs_MT16x32x32_MI16x16x1_CMS_SN_LDSB1_AFC0_AFEM1_AFEM1_ASEM1_CLR0_CADS0_DTLA0_DTLB0_DTVA0_DTVB0_EPS0_FDSI0_GRPM1_GRVWA1_GRVWB8_GSU0_GSUAMB_GSUC0_GSUWGMRR0_GLS0_ISA950_IU1_K1_LDSTI1_LBSPPA256_LBSPPB128_LBSPPM0_LPA16_LPB16_LPM0_LRVW8_LWPMn1_MIAV0_MIWT1_1_MO40_NTn1_NTA0_NTB0_NTC1_NTD1_NTM0_NEPBS0_NLCA1_NLCB1_ONLL1_PGR2_PLR1_PKA1_SIA3_SS1_SU0_SUM0_SUS0_SPO1_SRVW0_SSO0_SVW1_SK3_SKFTR0_SKXCCM0_TLDS1_ULSGRO0_USL1_UIOFGRO0_USFGROn1_VSn1_VWA1_VWB1_WSGRA0_WSGRB0_WS64_WG16_8_1_WGM1_WGMXCC8_WGMXCCGn1
    SolutionIndex: 3
    SolutionNameMin: Cijk_Ailk_Bljk_HHS_BH_Bias_HA_S_SAV_UserArgs_MT32x16x256_MI16x16x1_CMS_SN_LDSB0_AFC0_AFEM1_AFEM1_ASEM1_CLR0_CADS0_DTLA0_DTLB0_DTVA0_DTVB0_EPS0_FDSI0_GRPM1_GRVWA8_GRVWB8_GSU0_GSUAMB_GSUC0_GSUWGMRR0_GLS0_ISA950_IU1_K1_LDSTI1_LBSPPA512_LBSPPB512_LBSPPM0_LPA16_LPB16_LPM0_LRVW8_LWPMn1_MIAV1_MIWT1_1_MO40_NTn1_NTA3_NTB7_NTC0_NTD5_NTM0_NEPBS4_NLCA1_NLCB1_ONLL1_PGR2_PLR1_PKA1_SIA3_SS1_SU0_SUM0_SUS0_SPO0_SRVW0_SSO0_SVW1_SK3_SKFTR0_SKXCCM0_TLDS1_ULSGRO0_USL1_UIOFGRO0_USFGROn1_VSn1_VWA1_VWB1_WSGRA0_WSGRB0_WS64_WG32_4_1_WGM1_WGMXCC8_WGMXCCGn1
    SolutionIndex: 4
    SolutionNameMin: Cijk_Ailk_Bljk_HHS_BH_Bias_HA_S_SAV_UserArgs_MT16x64x32_MI16x16x1_CMS_SN_LDSB0_AFC0_AFEM1_AFEM1_ASEM1_CLR0_CADS0_DTLA0_DTLB0_DTVA0_DTVB0_EPS0_FDSI0_GRPM1_GRVWA1_GRVWB8_GSU0_GSUAMB_GSUC0_GSUWGMRR0_GLS0_ISA950_IU1_K1_LDSTI0_LBSPPA128_LBSPPB128_LBSPPM0_LPA16_LPB16_LPM0_LRVW8_LWPMn1_MIAV0_MIWT1_1_MO40_NTn1_NTA3_NTB1_NTC1_NTD1_NTM0_NEPBS16_NLCA1_NLCB1_ONLL1_PGR2_PLR0_PKA1_SIA3_SS1_SU0_SUM0_SUS0_SPO0_SRVW0_SSO0_SVW1_SK3_SKFTR0_SKXCCM0_TLDS2_ULSGRO0_USL1_UIOFGRO0_USFGROn1_VSn1_VWA1_VWB1_WSGRA0_WSGRB0_WS64_WG16_16_1_WGM1_WGMXCC8_WGMXCCGn1
    SolutionIndex: 5
    SolutionNameMin: Cijk_Ailk_Bljk_HHS_BH_Bias_HA_S_SAV_UserArgs_MT16x64x32_MI16x16x1_CMS_SN_LDSB1_AFC0_AFEM1_AFEM1_ASEM1_CLR0_CADS0_DTLA0_DTLB0_DTVA0_DTVB0_EPS0_FDSI0_GRPM1_GRVWA1_GRVWB8_GSU0_GSUAMB_GSUC0_GSUWGMRR0_GLS0_ISA950_IU1_K1_LDSTI1_LBSPPA128_LBSPPB128_LBSPPM0_LPA16_LPB16_LPM0_LRVW8_LWPMn1_MIAV0_MIWT1_1_MO40_NTn1_NTA2_NTB1_NTC0_NTD4_NTM0_NEPBS12_NLCA1_NLCB1_ONLL1_PGR1_PLR1_PKA1_SIA3_SS1_SU0_SUM0_SUS0_SPO0_SRVW0_SSO0_SVW1_SK3_SKFTR0_SKXCCM8_TLDS2_ULSGRO0_USL1_UIOFGRO0_USFGROn1_VSn1_VWA1_VWB1_WSGRA0_WSGRB0_WS64_WG16_16_1_WGM1_WGMXCC1_WGMXCCGn1
    SolutionIndex: 6
    SolutionNameMin: Cijk_Ailk_Bljk_HHS_BH_Bias_HA_S_SAV_UserArgs_MT32x16x256_MI16x16x1_CMS_SN_LDSB0_AFC0_AFEM1_AFEM1_ASEM1_CLR0_CADS0_DTLA0_DTLB0_DTVA0_DTVB0_EPS0_FDSI0_GRPM1_GRVWA8_GRVWB8_GSU0_GSUAMB_GSUC0_GSUWGMRR0_GLS0_ISA950_IU1_K1_LDSTI1_LBSPPA512_LBSPPB512_LBSPPM0_LPA16_LPB16_LPM0_LRVW8_LWPMn1_MIAV1_MIWT1_1_MO40_NTn1_NTA1_NTB6_NTC0_NTD1_NTM0_NEPBS12_NLCA1_NLCB1_ONLL1_PGR2_PLR1_PKA1_SIA3_SS1_SU0_SUM0_SUS0_SPO0_SRVW0_SSO0_SVW1_SK3_SKFTR0_SKXCCM0_TLDS1_ULSGRO0_USL1_UIOFGRO0_USFGRO1_VSn1_VWA1_VWB1_WSGRA0_WSGRB0_WS64_WG32_4_1_WGM1_WGMXCC8_WGMXCCGn1
    SolutionIndex: 7
    SolutionNameMin: Cijk_Ailk_Bljk_HHS_BH_Bias_HA_S_SAV_UserArgs_MT80x384x32_MI16x16x1_CMS_SN_LDSB1_AFC0_AFEM1_AFEM1_ASEM1_CLR0_CADS0_DTLA0_DTLB0_DTVA0_DTVB0_EPS0_FDSI0_GRPM1_GRVWA2_GRVWB8_GSU0_GSUAMB_GSUC0_GSUWGMRR0_GLS0_ISA950_IU1_K1_LDSTI1_LBSPPA1280_LBSPPB6144_LBSPPM0_LPA16_LPB16_LPM0_LRVW8_LWPMn1_MIAV0_MIWT5_6_MO40_NTn1_NTA0_NTB1_NTC0_NTD5_NTM0_NEPBS0_NLCA5_NLCB1_ONLL1_PGR2_PLR1_PKA1_SIA3_SS1_SU0_SUM0_SUS0_SPO0_SRVW0_SSO1_SVW1_SK3_SKFTR0_SKXCCM0_TLDS0_ULSGRO0_USL1_UIOFGRO0_USFGRO1_VSn1_VWA1_VWB1_WSGRA0_WSGRB0_WS64_WG16_16_1_WGM24_WGMXCC8_WGMXCCGn1
    SolutionIndex: 8
    SolutionNameMin: Cijk_Ailk_Bljk_HHS_BH_Bias_HA_S_SAV_UserArgs_MT32x32x256_MI16x16x1_CMS_SN_LDSB0_AFC0_AFEM1_AFEM1_ASEM1_CLR0_CADS0_DTLA0_DTLB0_DTVA0_DTVB0_EPS0_FDSI0_GRPM1_GRVWA8_GRVWB8_GSU0_GSUAMB_GSUC0_GSUWGMRR0_GLS0_ISA950_IU1_K1_LDSTI1_LBSPPA512_LBSPPB1024_LBSPPM0_LPA16_LPB16_LPM0_LRVW8_LWPMn1_MIAV1_MIWT2_2_MO40_NTn1_NTA0_NTB1_NTC6_NTD0_NTM0_NEPBS0_NLCA1_NLCB1_ONLL1_PGR2_PLR1_PKA1_SIA3_SS1_SU0_SUM0_SUS0_SPO1_SRVW0_SSO0_SVW1_SK3_SKFTR0_SKXCCM6_TLDS1_ULSGRO0_USL1_UIOFGRO0_USFGRO0_VSn1_VWA1_VWB2_WSGRA0_WSGRB0_WS64_WG16_4_4_WGM8_WGMXCC16_WGMXCCGn1
    SolutionIndex: 9
    SolutionNameMin: Cijk_Ailk_Bljk_HHS_BH_Bias_HA_S_SAV_UserArgs_MT112x512x32_MI16x16x1_CMS_SN_LDSB0_AFC0_AFEM1_AFEM1_ASEM1_CLR0_CADS0_DTLA0_DTLB0_DTVA0_DTVB0_EPS0_FDSI0_GRPM1_GRVWA2_GRVWB8_GSU0_GSUAMB_GSUC0_GSUWGMRR0_GLS0_ISA950_IU1_K1_LDSTI1_LBSPPA1792_LBSPPB512_LBSPPM0_LPA16_LPB16_LPM0_LRVW8_LWPMn1_MIAV0_MIWT7_8_MO40_NTn1_NTA0_NTB0_NTC1_NTD5_NTM0_NEPBS0_NLCA7_NLCB1_ONLL1_PGR2_PLR1_PKA1_SIA3_SS1_SU16_SUM0_SUS64_SPO1_SRVW0_SSO1_SVW1_SK3_SKFTR0_SKXCCM8_TLDS1_ULSGRO0_USL1_UIOFGRO0_USFGRO0_VSn1_VWA1_VWB8_WSGRA0_WSGRB0_WS64_WG16_16_1_WGM1_WGMXCC1_WGMXCCGn1
    SolutionIndex: 10
    SolutionNameMin: Cijk_Ailk_Bljk_HHS_BH_Bias_HA_S_SAV_UserArgs_MT96x32x256_MI16x16x1_CMS_SN_LDSB0_AFC0_AFEM1_AFEM1_ASEM1_CLR0_CADS0_DTLA0_DTLB0_DTVA0_DTVB0_EPS0_FDSI0_GRPM1_GRVWA8_GRVWB8_GSU0_GSUAMB_GSUC0_GSUWGMRR0_GLS0_ISA950_IU1_K1_LDSTI1_LBSPPA1536_LBSPPB512_LBSPPM0_LPA16_LPB16_LPM0_LRVW8_LWPMn1_MIAV0_MIWT3_1_MO40_NTn1_NTA1_NTB6_NTC1_NTD0_NTM0_NEPBS16_NLCA3_NLCB1_ONLL1_PGR2_PLR1_PKA1_SIA3_SS1_SU0_SUM0_SUS0_SPO1_SRVW0_SSO0_SVW1_SK3_SKFTR0_SKXCCM0_TLDS1_ULSGRO0_USL1_UIOFGRO0_USFGRO0_VSn1_VWA1_VWB1_WSGRA0_WSGRB0_WS64_WG32_8_1_WGM1_WGMXCC8_WGMXCCGn1
    SolutionIndex: 11
    SolutionNameMin: Cijk_Ailk_Bljk_HHS_BH_Bias_HA_S_SAV_UserArgs_MT32x64x128_MI16x16x1_CMS_SN_LDSB0_AFC0_AFEM1_AFEM1_ASEM1_CLR0_CADS0_DTLA0_DTLB0_DTVA0_DTVB0_EPS0_FDSI0_GRPM1_GRVWA8_GRVWB8_GSU0_GSUAMB_GSUC0_GSUWGMRR0_GLS0_ISA950_IU1_K1_LDSTI1_LBSPPA512_LBSPPB512_LBSPPM0_LPA16_LPB16_LPM0_LRVW8_LWPMn1_MIAV0_MIWT1_2_MO40_NTn1_NTA1_NTB6_NTC1_NTD1_NTM0_NEPBS0_NLCA1_NLCB1_ONLL1_PGR2_PLR1_PKA1_SIA3_SS1_SU0_SUM0_SUS0_SPO1_SRVW0_SSO0_SVW1_SK3_SKFTR0_SKXCCM0_TLDS1_ULSGRO0_USL1_UIOFGRO0_USFGRO0_VSn1_VWA1_VWB2_WSGRA0_WSGRB0_WS64_WG32_8_1_WGM32_WGMXCC1_WGMXCCGn1
    SolutionIndex: 12
    SolutionNameMin: Cijk_Ailk_Bljk_HHS_BH_Bias_HA_S_SAV_UserArgs_MT96x32x256_MI16x16x1_CMS_SN_LDSB0_AFC0_AFEM1_AFEM1_ASEM1_CLR0_CADS0_DTLA0_DTLB0_DTVA0_DTVB0_EPS0_FDSI0_GRPM1_GRVWA8_GRVWB8_GSU0_GSUAMB_GSUC0_GSUWGMRR0_GLS0_ISA950_IU1_K1_LDSTI1_LBSPPA1536_LBSPPB512_LBSPPM0_LPA16_LPB16_LPM0_LRVW8_LWPMn1_MIAV0_MIWT3_1_MO40_NTn1_NTA1_NTB5_NTC1_NTD4_NTM0_NEPBS0_NLCA3_NLCB1_ONLL1_PGR2_PLR1_PKA1_SIA3_SS1_SU0_SUM0_SUS0_SPO1_SRVW0_SSO0_SVW1_SK3_SKFTR0_SKXCCM0_TLDS1_ULSGRO0_USL1_UIOFGRO0_USFGROn1_VSn1_VWA1_VWB1_WSGRA0_WSGRB0_WS64_WG32_8_1_WGM1_WGMXCC8_WGMXCCGn1
    SolutionIndex: 13
    SolutionNameMin: Cijk_Ailk_Bljk_HHS_BH_Bias_HA_S_SAV_UserArgs_MT32x32x128_MI16x16x1_CMS_SN_LDSB0_AFC0_AFEM1_AFEM1_ASEM1_CLR0_CADS0_DTLA0_DTLB0_DTVA0_DTVB0_EPS0_FDSI0_GRPM1_GRVWA8_GRVWB8_GSU0_GSUAMB_GSUC0_GSUWGMRR0_GLS0_ISA950_IU1_K1_LDSTI1_LBSPPA512_LBSPPB256_LBSPPM0_LPA16_LPB16_LPM0_LRVW8_LWPMn1_MIAV1_MIWT2_1_MO40_NTn1_NTA3_NTB3_NTC0_NTD0_NTM0_NEPBS10_NLCA1_NLCB1_ONLL1_PGR2_PLR1_PKA1_SIA3_SS0_SU0_SUM0_SUS0_SPO0_SRVW0_SSO0_SVW4_SK3_SKFTR0_SKXCCM5_TLDS1_ULSGRO0_USL1_UIOFGRO0_USFGROn1_VSn1_VWA1_VWB1_WSGRA0_WSGRB0_WS64_WG16_8_1_WGM1_WGMXCC16_WGMXCCGn1
    SolutionIndex: 14
    SolutionNameMin: Cijk_Ailk_Bljk_HHS_BH_Bias_HA_S_SAV_UserArgs_MT128x96x128_MI16x16x1_CMS_SN_LDSB0_AFC0_AFEM1_AFEM1_ASEM1_CLR0_CADS0_DTLA0_DTLB0_DTVA0_DTVB0_EPS0_FDSI0_GRPM1_GRVWA8_GRVWB8_GSU0_GSUAMB_GSUC0_GSUWGMRR0_GLS0_ISA950_IU1_K1_LDSTI1_LBSPPA2048_LBSPPB512_LBSPPM0_LPA16_LPB16_LPM0_LRVW8_LWPMn1_MIAV0_MIWT2_6_MO40_NTn1_NTA2_NTB0_NTC1_NTD5_NTM0_NEPBS0_NLCA1_NLCB1_ONLL1_PGR2_PLR1_PKA1_SIA3_SS1_SU8_SUM0_SUS256_SPO1_SRVW0_SSO1_SVW1_SK3_SKFTR0_SKXCCM4_TLDS1_ULSGRO0_USL1_UIOFGRO0_USFGROn1_VSn1_VWA1_VWB2_WSGRA0_WSGRB0_WS64_WG64_4_1_WGM1_WGMXCC8_WGMXCCGn1
    SolutionIndex: 15
    SolutionNameMin: Cijk_Ailk_Bljk_HHS_BH_Bias_HA_S_SAV_UserArgs_MT128x96x128_MI16x16x1_CMS_SN_LDSB0_AFC0_AFEM1_AFEM1_ASEM1_CLR0_CADS0_DTLA0_DTLB0_DTVA0_DTVB0_EPS0_FDSI0_GRPM1_GRVWA8_GRVWB8_GSU0_GSUAMB_GSUC0_GSUWGMRR0_GLS0_ISA950_IU1_K1_LDSTI1_LBSPPA2048_LBSPPB512_LBSPPM0_LPA16_LPB16_LPM0_LRVW8_LWPMn1_MIAV1_MIWT2_6_MO40_NTn1_NTA0_NTB1_NTC0_NTD4_NTM0_NEPBS0_NLCA1_NLCB1_ONLL1_PGR2_PLR1_PKA1_SIA3_SS1_SU8_SUM0_SUS256_SPO0_SRVW0_SSO1_SVW1_SK3_SKFTR0_SKXCCM8_TLDS1_ULSGRO0_USL1_UIOFGRO0_USFGRO1_VSn1_VWA1_VWB2_WSGRA0_WSGRB0_WS64_WG64_4_1_WGM1_WGMXCC4_WGMXCCGn1
    SolutionIndex: 16
    SolutionNameMin: Cijk_Ailk_Bljk_HHS_BH_Bias_HA_S_SAV_UserArgs_MT32x16x128_MI16x16x1_CMS_SN_LDSB0_AFC0_AFEM1_AFEM1_ASEM1_CLR0_CADS0_DTLA0_DTLB0_DTVA0_DTVB0_EPS0_FDSI0_GRPM1_GRVWA2_GRVWB8_GSU0_GSUAMB_GSUC0_GSUWGMRR0_GLS0_ISA950_IU1_K1_LDSTI1_LBSPPA512_LBSPPB256_LBSPPM0_LPA16_LPB16_LPM0_LRVW8_LWPMn1_MIAV1_MIWT1_1_MO40_NTn1_NTA2_NTB3_NTC5_NTD0_NTM0_NEPBS14_NLCA1_NLCB1_ONLL1_PGR2_PLR1_PKA1_SIA3_SS0_SU8_SUM0_SUS256_SPO1_SRVW0_SSO0_SVW4_SK3_SKFTR0_SKXCCM0_TLDS1_ULSGRO0_USL1_UIOFGRO0_USFGRO0_VSn1_VWA1_VWB1_WSGRA0_WSGRB0_WS64_WG32_4_1_WGM1_WGMXCC8_WGMXCCGn1
    SolutionIndex: 17
    SolutionNameMin: Cijk_Ailk_Bljk_HHS_BH_Bias_HA_S_SAV_UserArgs_MT32x32x128_MI16x16x1_CMS_SN_LDSB0_AFC0_AFEM1_AFEM1_ASEM1_CLR0_CADS0_DTLA0_DTLB0_DTVA0_DTVB0_EPS0_FDSI0_GRPM1_GRVWA2_GRVWB8_GSU0_GSUAMB_GSUC0_GSUWGMRR0_GLS0_ISA950_IU1_K1_LDSTI1_LBSPPA512_LBSPPB256_LBSPPM0_LPA16_LPB16_LPM0_LRVW8_LWPMn1_MIAV1_MIWT2_1_MO40_NTn1_NTA7_NTB1_NTC0_NTD0_NTM0_NEPBS12_NLCA1_NLCB1_ONLL1_PGR2_PLR1_PKA1_SIA3_SS0_SU8_SUM0_SUS256_SPO1_SRVW0_SSO0_SVW4_SK3_SKFTR0_SKXCCM8_TLDS1_ULSGRO0_USL1_UIOFGRO0_USFGRO1_VSn1_VWA1_VWB1_WSGRA0_WSGRB0_WS64_WG16_8_1_WGM1_WGMXCC32_WGMXCCGn1
    SolutionIndex: 18
    SolutionNameMin: Cijk_Ailk_Bljk_HHS_BH_Bias_HA_S_SAV_UserArgs_MT128x64x32_MI16x16x1_CMS_SN_LDSB0_AFC0_AFEM1_AFEM1_ASEM1_CLR0_CADS0_DTLA0_DTLB0_DTVA0_DTVB0_EPS1_FDSI0_GRPM1_GRVWA4_GRVWB4_GSU0_GSUAMB_GSUC0_GSUWGMRR0_GLS0_ISA950_IU1_K1_LDSTI0_LBSPPA2048_LBSPPB128_LBSPPM0_LPA0_LPB16_LPM0_LRVW8_LWPMn1_MIAV0_MIWT4_2_MO40_NTn1_NTA1_NTB0_NTC4_NTD4_NTM0_NEPBS10_NLCA1_NLCB1_ONLL1_PGR1_PLR0_PKA1_SIA3_SS1_SU0_SUM0_SUS0_SPO0_SRVW0_SSO0_SVW4_SK3_SKFTR0_SKXCCM0_TLDS1_ULSGRO0_USL1_UIOFGRO0_USFGRO1_VSn1_VWA4_VWB2_WSGRA0_WSGRB0_WS64_WG32_8_1_WGM1_WGMXCC4_WGMXCCGn1
    SolutionIndex: 19
    SolutionNameMin: Cijk_Ailk_Bljk_HHS_BH_Bias_HA_S_SAV_UserArgs_MT128x64x32_MI16x16x1_CMS_SN_LDSB0_AFC0_AFEM1_AFEM1_ASEM1_CLR0_CADS0_DTLA0_DTLB0_DTVA0_DTVB0_EPS0_FDSI0_GRPM1_GRVWA4_GRVWB8_GSU0_GSUAMB_GSUC0_GSUWGMRR0_GLS0_ISA950_IU1_K1_LDSTI0_LBSPPA2048_LBSPPB128_LBSPPM0_LPA0_LPB16_LPM0_LRVW8_LWPMn1_MIAV0_MIWT4_2_MO40_NTn1_NTA1_NTB2_NTC5_NTD4_NTM0_NEPBS12_NLCA1_NLCB1_ONLL1_PGR2_PLR0_PKA1_SIA3_SS1_SU0_SUM0_SUS0_SPO0_SRVW0_SSO0_SVW4_SK3_SKFTR0_SKXCCM0_TLDS1_ULSGRO0_USL1_UIOFGRO0_USFGRO0_VSn1_VWA4_VWB2_WSGRA0_WSGRB0_WS64_WG32_8_1_WGM1_WGMXCC4_WGMXCCGn1
    SolutionIndex: 20
    SolutionNameMin: Cijk_Ailk_Bljk_HHS_BH_Bias_HA_S_SAV_UserArgs_MT128x128x32_MI32x32x1_CMS_SN_LDSB0_AFC0_AFEM1_AFEM1_ASEM1_CLR1_CADS0_DTLA0_DTLB0_DTVA0_DTVB0_EPS0_FDSI0_GRPM1_GRVWA8_GRVWB4_GSU0_GSUAMB_GSUC0_GSUWGMRR0_GLS0_ISA950_IU1_K1_LDSTI0_LBSPPA0_LBSPPB128_LBSPPM0_LPA0_LPB8_LPM0_LRVW8_LWPMn1_MIAV0_MIWT2_2_MO40_NTn1_NTA0_NTB0_NTC7_NTD7_NTM0_NEPBS16_NLCA1_NLCB1_ONLL1_PGR2_PLR1_PKA1_SIA3_SS1_SU0_SUM0_SUS0_SPO1_SRVW0_SSO0_SVW2_SK3_SKFTR0_SKXCCM4_TLDS1_ULSGRO0_USL1_UIOFGRO0_USFGROn1_VSn1_VWA2_VWB2_WSGRA0_WSGRB0_WS64_WG64_4_1_WGM1_WGMXCC1_WGMXCCGn1
    SolutionIndex: 21
    SolutionNameMin: Cijk_Ailk_Bljk_HHS_BH_Bias_HA_S_SAV_UserArgs_MT192x288x64_MI16x16x1_CMS_SN_LDSB0_AFC0_AFEM1_AFEM1_ASEM1_CLR0_CADS0_DTLA0_DTLB0_DTVA0_DTVB0_EPS0_FDSI0_GRPM1_GRVWA8_GRVWB8_GSU0_GSUAMB_GSUC0_GSUWGMRR0_GLS0_ISA950_IU1_K1_LDSTI1_LBSPPA3072_LBSPPB128_LBSPPM0_LPA16_LPB16_LPM0_LRVW8_LWPMn1_MIAV0_MIWT6_9_MO40_NTn1_NTA0_NTB2_NTC1_NTD0_NTM0_NEPBS0_NLCA3_NLCB1_ONLL1_PGR2_PLR1_PKA1_SIA3_SS1_SU8_SUM0_SUS128_SPO1_SRVW0_SSO1_SVW1_SK3_SKFTR0_SKXCCM4_TLDS1_ULSGRO0_USL1_UIOFGRO0_USFGRO1_VSn1_VWA1_VWB1_WSGRA0_WSGRB0_WS64_WG32_8_1_WGM6_WGMXCC2_WGMXCCGn1
    SolutionIndex: 22
    SolutionNameMin: Cijk_Ailk_Bljk_HHS_BH_Bias_HA_S_SAV_UserArgs_MT64x64x32_MI32x32x1_CMS_SN_LDSB0_AFC0_AFEM1_AFEM1_ASEM1_CLR0_CADS0_DTLA0_DTLB0_DTVA0_DTVB0_EPS0_FDSI0_GRPM1_GRVWA2_GRVWB2_GSU0_GSUAMB_GSUC0_GSUWGMRR0_GLS0_ISA950_IU1_K1_LDSTI1_LBSPPA0_LBSPPB128_LBSPPM0_LPA0_LPB8_LPM0_LRVW8_LWPMn1_MIAV0_MIWT1_1_MO40_NTn1_NTA0_NTB1_NTC4_NTD4_NTM0_NEPBS0_NLCA1_NLCB1_ONLL1_PGR2_PLR1_PKA1_SIA3_SS1_SU8_SUM0_SUS64_SPO0_SRVW0_SSO0_SVW1_SK3_SKFTR0_SKXCCM0_TLDS1_ULSGRO0_USL1_UIOFGRO0_USFGROn1_VSn1_VWA1_VWB1_WSGRA0_WSGRB0_WS64_WG64_4_1_WGM1_WGMXCC4_WGMXCCGn1
    SolutionIndex: 23
    SolutionNameMin: Cijk_Ailk_Bljk_HHS_BH_Bias_HA_S_SAV_UserArgs_MT64x64x32_MI32x32x1_CMS_SN_LDSB0_AFC0_AFEM1_AFEM1_ASEM1_CLR0_CADS0_DTLA0_DTLB0_DTVA0_DTVB0_EPS0_FDSI0_GRPM1_GRVWA2_GRVWB2_GSU0_GSUAMB_GSUC0_GSUWGMRR0_GLS0_ISA950_IU1_K1_LDSTI1_LBSPPA0_LBSPPB128_LBSPPM0_LPA0_LPB8_LPM0_LRVW8_LWPMn1_MIAV0_MIWT1_1_MO40_NTn1_NTA3_NTB1_NTC4_NTD5_NTM0_NEPBS0_NLCA1_NLCB1_ONLL1_PGR2_PLR1_PKA1_SIA3_SS1_SU8_SUM0_SUS64_SPO0_SRVW0_SSO1_SVW1_SK3_SKFTR0_SKXCCM0_TLDS1_ULSGRO0_USL1_UIOFGRO0_USFGROn1_VSn1_VWA1_VWB1_WSGRA0_WSGRB0_WS64_WG64_4_1_WGM1_WGMXCC4_WGMXCCGn1
    SolutionIndex: 24
    SolutionNameMin: Cijk_Ailk_Bljk_HHS_BH_Bias_HA_S_SAV_UserArgs_MT128x128x32_MI16x16x1_CMS_SN_LDSB0_AFC0_AFEM1_AFEM1_ASEM1_CLR0_CADS0_DTLA0_DTLB0_DTVA0_DTVB0_EPS1_FDSI0_GRPM1_GRVWA4_GRVWB8_GSU0_GSUAMB_GSUC0_GSUWGMRR0_GLS0_ISA950_IU1_K1_LDSTI0_LBSPPA2048_LBSPPB128_LBSPPM0_LPA0_LPB16_LPM0_LRVW8_LWPMn1_MIAV0_MIWT8_2_MO40_NTn1_NTA0_NTB0_NTC6_NTD4_NTM0_NEPBS8_NLCA1_NLCB1_ONLL1_PGR1_PLR0_PKA1_SIA3_SS1_SU0_SUM0_SUS0_SPO0_SRVW0_SSO0_SVW8_SK3_SKFTR0_SKXCCM8_TLDS1_ULSGRO0_USL1_UIOFGRO0_USFGRO1_VSn1_VWA8_VWB2_WSGRA0_WSGRB0_WS64_WG16_16_1_WGM32_WGMXCC1_WGMXCCGn1
    SolutionIndex: 25
    SolutionNameMin: Cijk_Ailk_Bljk_HHS_BH_Bias_HA_S_SAV_UserArgs_MT256x64x32_MI16x16x1_CMS_SN_LDSB0_AFC0_AFEM1_AFEM1_ASEM1_CLR0_CADS0_DTLA0_DTLB0_DTVA0_DTVB0_EPS1_FDSI0_GRPM1_GRVWA4_GRVWB8_GSU0_GSUAMB_GSUC0_GSUWGMRR0_GLS0_ISA950_IU1_K1_LDSTI0_LBSPPA4096_LBSPPB256_LBSPPM0_LPA0_LPB16_LPM0_LRVW8_LWPMn1_MIAV0_MIWT4_4_MO40_NTn1_NTA1_NTB7_NTC4_NTD5_NTM0_NEPBS10_NLCA1_NLCB1_ONLL1_PGR1_PLR0_PKA1_SIA3_SS1_SU16_SUM0_SUS256_SPO0_SRVW0_SSO1_SVW4_SK3_SKFTR0_SKXCCM0_TLDS1_ULSGRO0_USL1_UIOFGRO0_USFGROn1_VSn1_VWA4_VWB4_WSGRA0_WSGRB0_WS64_WG64_4_1_WGM1_WGMXCC8_WGMXCCGn1
    SolutionIndex: 26
    SolutionNameMin: Cijk_Ailk_Bljk_HHS_BH_Bias_HA_S_SAV_UserArgs_MT32x384x32_MI32x32x1_CMS_SN_LDSB1_AFC0_AFEM1_AFEM1_ASEM1_CLR0_CADS0_DTLA0_DTLB0_DTVA0_DTVB0_EPS0_FDSI0_GRPM1_GRVWA1_GRVWB4_GSU0_GSUAMB_GSUC0_GSUWGMRR0_GLS0_ISA950_IU1_K1_LDSTI1_LBSPPA0_LBSPPB128_LBSPPM0_LPA0_LPB8_LPM0_LRVW8_LWPMn1_MIAV0_MIWT1_3_MO40_NTn1_NTA1_NTB0_NTC1_NTD5_NTM0_NEPBS12_NLCA1_NLCB1_ONLL1_PGR2_PLR1_PKA1_SIA3_SS1_SU0_SUM0_SUS0_SPO0_SRVW0_SSO1_SVW1_SK3_SKFTR0_SKXCCM0_TLDS1_ULSGRO0_USL1_UIOFGRO0_USFGRO0_VSn1_VWA1_VWB1_WSGRA0_WSGRB0_WS64_WG32_8_1_WGM1_WGMXCC8_WGMXCCGn1
    SolutionIndex: 27
    SolutionNameMin: Cijk_Ailk_Bljk_HHS_BH_Bias_HA_S_SAV_UserArgs_MT48x320x32_MI16x16x1_CMS_SN_LDSB1_AFC0_AFEM1_AFEM1_ASEM1_CLR0_CADS0_DTLA0_DTLB0_DTVA0_DTVB0_EPS1_FDSI0_GRPM1_GRVWA2_GRVWB8_GSU0_GSUAMB_GSUC0_GSUWGMRR0_GLS0_ISA950_IU1_K1_LDSTI0_LBSPPA768_LBSPPB128_LBSPPM0_LPA16_LPB16_LPM0_LRVW8_LWPMn1_MIAV1_MIWT3_5_MO40_NTn1_NTA0_NTB0_NTC1_NTD1_NTM0_NEPBS0_NLCA3_NLCB1_ONLL1_PGR1_PLR0_PKA1_SIA3_SS1_SU0_SUM0_SUS0_SPO0_SRVW0_SSO0_SVW1_SK3_SKFTR0_SKXCCM0_TLDS1_ULSGRO0_USL1_UIOFGRO0_USFGROn1_VSn1_VWA1_VWB1_WSGRA0_WSGRB0_WS64_WG16_16_1_WGM4_WGMXCC8_WGMXCCGn1
    SolutionIndex: 28
    SolutionNameMin: Cijk_Ailk_Bljk_HHS_BH_Bias_HA_S_SAV_UserArgs_MT112x512x32_MI16x16x1_CMS_SN_LDSB0_AFC0_AFEM1_AFEM1_ASEM1_CLR0_CADS0_DTLA0_DTLB0_DTVA0_DTVB0_EPS0_FDSI0_GRPM1_GRVWA2_GRVWB4_GSU0_GSUAMB_GSUC0_GSUWGMRR0_GLS0_ISA950_IU1_K1_LDSTI1_LBSPPA1792_LBSPPB512_LBSPPM0_LPA16_LPB16_LPM0_LRVW8_LWPMn1_MIAV0_MIWT7_8_MO40_NTn1_NTA1_NTB1_NTC0_NTD1_NTM0_NEPBS0_NLCA7_NLCB1_ONLL1_PGR1_PLR1_PKA1_SIA3_SS1_SU8_SUM0_SUS64_SPO1_SRVW0_SSO1_SVW1_SK3_SKFTR0_SKXCCM6_TLDS1_ULSGRO0_USL1_UIOFGRO0_USFGROn1_VSn1_VWA1_VWB8_WSGRA0_WSGRB0_WS64_WG16_16_1_WGM1_WGMXCC16_WGMXCCGn1
    SolutionIndex: 29
    SolutionNameMin: Cijk_Ailk_Bljk_HHS_BH_Bias_HA_S_SAV_UserArgs_MT32x48x32_MI16x16x1_CMS_SN_LDSB1_AFC0_AFEM1_AFEM1_ASEM1_CLR0_CADS0_DTLA0_DTLB0_DTVA0_DTVB0_EPS0_FDSI0_GRPM1_GRVWA4_GRVWB2_GSU0_GSUAMB_GSUC0_GSUWGMRR0_GLS0_ISA950_IU1_K1_LDSTI1_LBSPPA512_LBSPPB128_LBSPPM0_LPA16_LPB16_LPM0_LRVW8_LWPMn1_MIAV0_MIWT1_3_MO40_NTn1_NTA3_NTB1_NTC1_NTD5_NTM0_NEPBS4_NLCA1_NLCB1_ONLL1_PGR1_PLR1_PKA1_SIA3_SS0_SU0_SUM0_SUS0_SPO0_SRVW0_SSO1_SVW4_SK3_SKFTR0_SKXCCM0_TLDS1_ULSGRO0_USL1_UIOFGRO0_USFGROn1_VSn1_VWA1_VWB1_WSGRA0_WSGRB0_WS64_WG32_4_1_WGM1_WGMXCC1_WGMXCCGn1
    SolutionIndex: 30
    SolutionNameMin: Cijk_Ailk_Bljk_HHS_BH_Bias_HA_S_SAV_UserArgs_MT32x48x32_MI16x16x1_CMS_SN_LDSB1_AFC0_AFEM1_AFEM1_ASEM1_CLR0_CADS0_DTLA0_DTLB0_DTVA0_DTVB0_EPS0_FDSI0_GRPM1_GRVWA2_GRVWB2_GSU0_GSUAMB_GSUC0_GSUWGMRR0_GLS0_ISA950_IU1_K1_LDSTI1_LBSPPA512_LBSPPB128_LBSPPM0_LPA16_LPB16_LPM0_LRVW8_LWPMn1_MIAV1_MIWT1_3_MO40_NTn1_NTA4_NTB0_NTC4_NTD5_NTM0_NEPBS0_NLCA1_NLCB1_ONLL1_PGR1_PLR1_PKA1_SIA3_SS0_SU0_SUM0_SUS0_SPO0_SRVW0_SSO1_SVW4_SK3_SKFTR0_SKXCCM0_TLDS1_ULSGRO0_USL1_UIOFGRO0_USFGRO1_VSn1_VWA1_VWB1_WSGRA0_WSGRB0_WS64_WG32_4_1_WGM1_WGMXCC1_WGMXCCGn1
    SolutionIndex: 31
    SolutionNameMin: Cijk_Ailk_Bljk_HHS_BH_Bias_HA_S_SAV_UserArgs_MT32x48x32_MI16x16x1_CMS_SN_LDSB1_AFC0_AFEM1_AFEM1_ASEM1_CLR0_CADS0_DTLA0_DTLB0_DTVA0_DTVB0_EPS0_FDSI0_GRPM1_GRVWA2_GRVWB4_GSU0_GSUAMB_GSUC0_GSUWGMRR0_GLS0_ISA950_IU1_K1_LDSTI1_LBSPPA512_LBSPPB128_LBSPPM0_LPA16_LPB16_LPM0_LRVW8_LWPMn1_MIAV0_MIWT1_3_MO40_NTn1_NTA4_NTB1_NTC1_NTD5_NTM0_NEPBS16_NLCA1_NLCB1_ONLL1_PGR2_PLR1_PKA1_SIA3_SS0_SU0_SUM0_SUS0_SPO0_SRVW0_SSO1_SVW4_SK3_SKFTR0_SKXCCM0_TLDS1_ULSGRO0_USL1_UIOFGRO0_USFGRO1_VSn1_VWA1_VWB1_WSGRA0_WSGRB0_WS64_WG32_4_1_WGM1_WGMXCC32_WGMXCCGn1
    SolutionIndex: 32
    SolutionNameMin: Cijk_Ailk_Bljk_HHS_BH_Bias_HA_S_SAV_UserArgs_MT16x48x32_MI16x16x1_CMS_SN_LDSB1_AFC0_AFEM1_AFEM1_ASEM1_CLR0_CADS0_DTLA0_DTLB0_DTVA0_DTVB0_EPS0_FDSI0_GRPM1_GRVWA1_GRVWB8_GSU0_GSUAMB_GSUC0_GSUWGMRR0_GLS0_ISA950_IU1_K1_LDSTI1_LBSPPA128_LBSPPB128_LBSPPM0_LPA16_LPB16_LPM0_LRVW8_LWPMn1_MIAV0_MIWT1_3_MO40_NTn1_NTA4_NTB3_NTC5_NTD4_NTM0_NEPBS12_NLCA1_NLCB1_ONLL1_PGR2_PLR1_PKA1_SIA3_SS0_SU0_SUM0_SUS0_SPO0_SRVW0_SSO1_SVW4_SK3_SKFTR0_SKXCCM8_TLDS2_ULSGRO0_USL1_UIOFGRO0_USFGROn1_VSn1_VWA1_VWB1_WSGRA0_WSGRB0_WS64_WG16_4_1_WGM1_WGMXCC1_WGMXCCGn1
    SolutionIndex: 33
    SolutionNameMin: Cijk_Ailk_Bljk_HHS_BH_Bias_HA_S_SAV_UserArgs_MT16x96x32_MI16x16x1_CMS_SN_LDSB1_AFC0_AFEM1_AFEM1_ASEM1_CLR0_CADS0_DTLA0_DTLB0_DTVA0_DTVB0_EPS0_FDSI0_GRPM1_GRVWA1_GRVWB4_GSU0_GSUAMB_GSUC0_GSUWGMRR0_GLS0_ISA950_IU1_K1_LDSTI0_LBSPPA128_LBSPPB128_LBSPPM0_LPA16_LPB16_LPM0_LRVW8_LWPMn1_MIAV1_MIWT1_3_MO40_NTn1_NTA5_NTB0_NTC1_NTD6_NTM0_NEPBS8_NLCA1_NLCB1_ONLL1_PGR2_PLR0_PKA1_SIA3_SS0_SU0_SUM0_SUS0_SPO0_SRVW0_SSO0_SVW4_SK3_SKFTR0_SKXCCM0_TLDS2_ULSGRO0_USL1_UIOFGRO0_USFGRO1_VSn1_VWA1_VWB1_WSGRA0_WSGRB0_WS64_WG16_8_1_WGM1_WGMXCC2_WGMXCCGn1
    SolutionIndex: 34
    SolutionNameMin: Cijk_Ailk_Bljk_HHS_BH_Bias_HA_S_SAV_UserArgs_MT16x96x32_MI16x16x1_CMS_SN_LDSB1_AFC0_AFEM1_AFEM1_ASEM1_CLR0_CADS0_DTLA0_DTLB0_DTVA0_DTVB0_EPS0_FDSI0_GRPM1_GRVWA1_GRVWB2_GSU0_GSUAMB_GSUC0_GSUWGMRR0_GLS0_ISA950_IU1_K1_LDSTI0_LBSPPA256_LBSPPB128_LBSPPM0_LPA16_LPB16_LPM0_LRVW8_LWPMn1_MIAV0_MIWT1_3_MO40_NTn1_NTA7_NTB1_NTC5_NTD6_NTM0_NEPBS10_NLCA1_NLCB1_ONLL1_PGR2_PLR0_PKA1_SIA3_SS0_SU0_SUM0_SUS0_SPO0_SRVW0_SSO0_SVW4_SK3_SKFTR0_SKXCCM0_TLDS1_ULSGRO0_USL1_UIOFGRO0_USFGRO0_VSn1_VWA1_VWB1_WSGRA0_WSGRB0_WS64_WG16_8_1_WGM1_WGMXCC8_WGMXCCGn1
    SolutionIndex: 35
    SolutionNameMin: Cijk_Ailk_Bljk_HHS_BH_Bias_HA_S_SAV_UserArgs_MT16x128x32_MI16x16x1_CMS_SN_LDSB1_AFC0_AFEM1_AFEM1_ASEM1_CLR0_CADS0_DTLA0_DTLB0_DTVA0_DTVB0_EPS0_FDSI0_GRPM1_GRVWA1_GRVWB8_GSU0_GSUAMB_GSUC0_GSUWGMRR0_GLS0_ISA950_IU1_K1_LDSTI1_LBSPPA256_LBSPPB2048_LBSPPM0_LPA16_LPB16_LPM0_LRVW8_LWPMn1_MIAV1_MIWT1_2_MO40_NTn1_NTA5_NTB2_NTC4_NTD4_NTM0_NEPBS8_NLCA1_NLCB1_ONLL1_PGR2_PLR1_PKA1_SIA3_SS0_SU0_SUM0_SUS0_SPO0_SRVW0_SSO0_SVW4_SK3_SKFTR0_SKXCCM0_TLDS0_ULSGRO0_USL1_UIOFGRO0_USFGRO0_VSn1_VWA1_VWB1_WSGRA0_WSGRB0_WS64_WG16_16_1_WGM1_WGMXCC16_WGMXCCGn1
    SolutionIndex: 36
    SolutionNameMin: Cijk_Ailk_Bljk_HHS_BH_Bias_HA_S_SAV_UserArgs_MT16x128x32_MI16x16x1_CMS_SN_LDSB1_AFC0_AFEM1_AFEM1_ASEM1_CLR0_CADS0_DTLA0_DTLB0_DTVA0_DTVB0_EPS0_FDSI0_GRPM1_GRVWA1_GRVWB8_GSU0_GSUAMB_GSUC0_GSUWGMRR0_GLS0_ISA950_IU1_K1_LDSTI1_LBSPPA256_LBSPPB2048_LBSPPM0_LPA16_LPB16_LPM0_LRVW8_LWPMn1_MIAV0_MIWT1_2_MO40_NTn1_NTA4_NTB1_NTC4_NTD7_NTM0_NEPBS8_NLCA1_NLCB1_ONLL1_PGR2_PLR1_PKA1_SIA3_SS0_SU0_SUM0_SUS0_SPO0_SRVW0_SSO0_SVW4_SK3_SKFTR0_SKXCCM0_TLDS0_ULSGRO0_USL1_UIOFGRO0_USFGRO0_VSn1_VWA1_VWB1_WSGRA0_WSGRB0_WS64_WG16_16_1_WGM1_WGMXCC2_WGMXCCGn1
    SolutionIndex: 37
    SolutionNameMin: Cijk_Ailk_Bljk_HHS_BH_Bias_HA_S_SAV_UserArgs_MT32x96x32_MI16x16x1_CMS_SN_LDSB1_AFC0_AFEM1_AFEM1_ASEM1_CLR0_CADS0_DTLA0_DTLB0_DTVA0_DTVB0_EPS0_FDSI0_GRPM1_GRVWA8_GRVWB8_GSU0_GSUAMB_GSUC0_GSUWGMRR0_GLS0_ISA950_IU1_K1_LDSTI0_LBSPPA128_LBSPPB128_LBSPPM0_LPA16_LPB16_LPM0_LRVW8_LWPMn1_MIAV0_MIWT2_3_MO40_NTn1_NTA5_NTB2_NTC7_NTD6_NTM0_NEPBS8_NLCA1_NLCB1_ONLL1_PGR2_PLR0_PKA1_SIA3_SS0_SU0_SUM0_SUS0_SPO0_SRVW0_SSO0_SVW8_SK3_SKFTR0_SKXCCM0_TLDS2_ULSGRO0_USL1_UIOFGRO0_USFGRO0_VSn1_VWA2_VWB1_WSGRA0_WSGRB0_WS64_WG16_8_1_WGM1_WGMXCC2_WGMXCCGn1
    SolutionIndex: 38
    SolutionNameMin: Cijk_Ailk_Bljk_HHS_BH_Bias_HA_S_SAV_UserArgs_MT64x96x32_MI16x16x1_CMS_SN_LDSB1_AFC0_AFEM1_AFEM1_ASEM1_CLR0_CADS0_DTLA0_DTLB0_DTVA0_DTVB0_EPS0_FDSI0_GRPM1_GRVWA4_GRVWB4_GSU0_GSUAMB_GSUC0_GSUWGMRR0_GLS0_ISA950_IU1_K1_LDSTI0_LBSPPA1024_LBSPPB128_LBSPPM0_LPA16_LPB16_LPM0_LRVW8_LWPMn1_MIAV0_MIWT1_6_MO40_NTn1_NTA0_NTB0_NTC0_NTD5_NTM0_NEPBS12_NLCA1_NLCB1_ONLL1_PGR2_PLR0_PKA1_SIA3_SS1_SU0_SUM0_SUS0_SPO0_SRVW0_SSO1_SVW1_SK3_SKFTR0_SKXCCM0_TLDS1_ULSGRO0_USL1_UIOFGRO0_USFGROn1_VSn1_VWA1_VWB2_WSGRA0_WSGRB0_WS64_WG64_4_1_WGM1_WGMXCC1_WGMXCCGn1
    SolutionIndex: 39
    SolutionNameMin: Cijk_Ailk_Bljk_HHS_BH_Bias_HA_S_SAV_UserArgs_MT128x96x32_MI32x32x1_CMS_SN_LDSB0_AFC0_AFEM1_AFEM1_ASEM1_CLR0_CADS0_DTLA0_DTLB0_DTVA0_DTVB0_EPS0_FDSI0_GRPM1_GRVWA2_GRVWB4_GSU0_GSUAMB_GSUC0_GSUWGMRR0_GLS0_ISA950_IU1_K1_LDSTI1_LBSPPA0_LBSPPB128_LBSPPM0_LPA0_LPB8_LPM0_LRVW8_LWPMn1_MIAV0_MIWT1_3_MO40_NTn1_NTA1_NTB0_NTC5_NTD4_NTM0_NEPBS0_NLCA1_NLCB1_ONLL1_PGR1_PLR1_PKA1_SIA3_SS1_SU0_SUM0_SUS0_SPO0_SRVW0_SSO1_SVW1_SK3_SKFTR0_SKXCCM0_TLDS1_ULSGRO0_USL1_UIOFGRO0_USFGRO1_VSn1_VWA1_VWB1_WSGRA0_WSGRB0_WS64_WG128_2_1_WGM1_WGMXCC2_WGMXCCGn1
    SolutionIndex: 40
    SolutionNameMin: Cijk_Ailk_Bljk_HHS_BH_Bias_HA_S_SAV_UserArgs_MT32x448x32_MI16x16x1_CMS_SN_LDSB1_AFC0_AFEM1_AFEM1_ASEM1_CLR0_CADS0_DTLA0_DTLB0_DTVA0_DTVB0_EPS0_FDSI0_GRPM1_GRVWA4_GRVWB8_GSU0_GSUAMB_GSUC0_GSUWGMRR0_GLS0_ISA950_IU1_K1_LDSTI1_LBSPPA128_LBSPPB128_LBSPPM0_LPA16_LPB16_LPM0_LRVW8_LWPMn1_MIAV0_MIWT2_7_MO40_NTn1_NTA3_NTB0_NTC4_NTD6_NTM0_NEPBS16_NLCA1_NLCB1_ONLL1_PGR1_PLR1_PKA1_SIA3_SS0_SU0_SUM0_SUS0_SPO1_SRVW0_SSO1_SVW8_SK3_SKFTR0_SKXCCM0_TLDS2_ULSGRO0_USL1_UIOFGRO0_USFGRO0_VSn1_VWA2_VWB1_WSGRA0_WSGRB0_WS64_WG16_16_1_WGM1_WGMXCC4_WGMXCCGn1
    SolutionIndex: 41
    SolutionNameMin: Cijk_Ailk_Bljk_HHS_BH_Bias_HA_S_SAV_UserArgs_MT160x256x32_MI16x16x1_CMS_SN_LDSB0_AFC0_AFEM1_AFEM1_ASEM1_CLR0_CADS0_DTLA0_DTLB0_DTVA0_DTVB0_EPS0_FDSI0_GRPM1_GRVWA2_GRVWB8_GSU0_GSUAMB_GSUC0_GSUWGMRR0_GLS0_ISA950_IU1_K1_LDSTI0_LBSPPA128_LBSPPB256_LBSPPM0_LPA16_LPB16_LPM0_LRVW8_LWPMn1_MIAV0_MIWT10_4_MO40_NTn1_NTA0_NTB2_NTC0_NTD5_NTM0_NEPBS0_NLCA5_NLCB1_ONLL1_PGR2_PLR0_PKA1_SIA3_SS1_SU8_SUM0_SUS64_SPO1_SRVW0_SSO0_SVW2_SK3_SKFTR0_SKXCCM0_TLDS2_ULSGRO0_USL1_UIOFGRO0_USFGRO0_VSn1_VWA2_VWB4_WSGRA0_WSGRB0_WS64_WG16_16_1_WGM1_WGMXCC16_WGMXCCGn1
    SolutionIndex: 42
    SolutionNameMin: Cijk_Ailk_Bljk_HHS_BH_Bias_HA_S_SAV_UserArgs_MT16x16x32_MI16x16x1_CMS_SN_LDSB0_AFC0_AFEM1_AFEM1_ASEM1_CLR1_CADS0_DTLA0_DTLB0_DTVA0_DTVB0_EPS0_FDSI0_GRPM1_GRVWA1_GRVWB4_GSU1_GSUAMB_GSUC0_GSUWGMRR0_GLS0_ISA950_IU1_LDSTI0_LBSPPA128_LBSPPB128_LBSPPM0_LPA16_LPB4_LPM0_LRVW4_LWPMn1_MIAV0_MIWT1_1_MO40_NTn1_NTA4_NTB4_NTC0_NTD0_NTM0_NEPBS0_NLCA1_NLCB1_ONLL1_PGR2_PLR1_PKA1_SIA3_SS0_SU0_SUM0_SUS0_SPO0_SRVW0_SSO0_SVW4_SK0_SKFTR0_SKXCCM0_TLDS1_ULSGRO0_USL1_UIOFGRO0_USFGROn1_VSn1_VWA1_VWB1_WSGRA0_WSGRB0_WS64_WG16_4_1_WGM1_WGMXCC1_WGMXCCG0
    SolutionIndex: 43
    SolutionNameMin: Cijk_Ailk_Bljk_HHS_BH_Bias_HA_S_SAV_UserArgs_MT32x128x64_MI32x32x1_CMS_SN_LDSB1_AFC0_AFEM1_AFEM1_ASEM1_CLR1_CADS0_DTLA0_DTLB0_DTVA0_DTVB0_EPS0_FDSI0_GRPM1_GRVWA8_GRVWB8_GSU0_GSUAMB_GSUC0_GSUWGMRR0_GLS0_ISA950_IU1_K1_LDSTI0_LBSPPA0_LBSPPB128_LBSPPM0_LPA0_LPB8_LPM0_LRVW8_LWPMn1_MIAV1_MIWT1_1_MO40_NTn1_NTA7_NTB2_NTC0_NTD4_NTM0_NEPBS0_NLCA1_NLCB1_ONLL1_PGR2_PLR1_PKA1_SIA3_SS1_SU0_SUM0_SUS0_SPO0_SRVW0_SSO0_SVW1_SK3_SKFTR0_SKXCCM0_TLDS1_ULSGRO0_USL1_UIOFGRO0_USFGRO1_VSn1_VWA1_VWB1_WSGRA0_WSGRB0_WS64_WG32_8_1_WGM1_WGMXCC2_WGMXCCGn1
    SolutionIndex: 44
    SolutionNameMin: Cijk_Ailk_Bljk_HHS_BH_Bias_HA_S_SAV_UserArgs_MT64x128x32_MI32x32x1_CMS_SN_LDSB0_AFC0_AFEM1_AFEM1_ASEM1_CLR0_CADS0_DTLA1_DTLB1_DTVA0_DTVB0_EPS0_FDSI0_GRPM1_GRVWA8_GRVWB8_GSU0_GSUAMB_GSUC0_GSUWGMRR0_GLS0_ISA950_IU1_K1_LDSTI1_LBSPPA0_LBSPPB1024_LBSPPM0_LPA0_LPB8_LPM0_LRVW8_LWPMn1_MIAV1_MIWT2_1_MO40_NTn1_NTA6_NTB0_NTC0_NTD4_NTM0_NEPBS16_NLCA1_NLCB1_ONLL1_PGR2_PLR1_PKA1_SIA3_SS1_SU0_SUM0_SUS0_SPO0_SRVW0_SSO0_SVW1_SK3_SKFTR0_SKXCCM0_TLDS1_ULSGRO0_USL1_UIOFGRO0_USFGRO0_VSn1_VWA1_VWB1_WSGRA0_WSGRB0_WS64_WG32_8_1_WGM1_WGMXCC1_WGMXCCGn1
    SolutionIndex: 45
    SolutionNameMin: Cijk_Ailk_Bljk_HHS_BH_Bias_HA_S_SAV_UserArgs_MT96x128x64_MI16x16x1_CMS_SN_LDSB1_AFC0_AFEM1_AFEM1_ASEM1_CLR0_CADS0_DTLA0_DTLB0_DTVA0_DTVB0_EPS0_FDSI0_GRPM1_GRVWA8_GRVWB8_GSU0_GSUAMB_GSUC0_GSUWGMRR0_GLS0_ISA950_IU1_K1_LDSTI1_LBSPPA256_LBSPPB256_LBSPPM0_LPA16_LPB16_LPM0_LRVW8_LWPMn1_MIAV1_MIWT6_2_MO40_NTn1_NTA1_NTB6_NTC5_NTD7_NTM0_NEPBS0_NLCA3_NLCB1_ONLL1_PGR2_PLR1_PKA1_SIA3_SS1_SU0_SUM0_SUS0_SPO0_SRVW0_SSO0_SVW2_SK3_SKFTR0_SKXCCM0_TLDS2_ULSGRO0_USL1_UIOFGRO0_USFGRO1_VSn1_VWA2_VWB2_WSGRA0_WSGRB0_WS64_WG16_16_1_WGM1_WGMXCC2_WGMXCCGn1
    SolutionIndex: 46
    SolutionNameMin: Cijk_Ailk_Bljk_HHS_BH_Bias_HA_S_SAV_UserArgs_MT32x192x32_MI16x16x1_CMS_SN_LDSB1_AFC0_AFEM1_AFEM1_ASEM1_CLR0_CADS0_DTLA0_DTLB0_DTVA0_DTVB0_EPS0_FDSI0_GRPM1_GRVWA4_GRVWB8_GSU0_GSUAMB_GSUC0_GSUWGMRR0_GLS0_ISA950_IU1_K1_LDSTI1_LBSPPA512_LBSPPB128_LBSPPM0_LPA16_LPB16_LPM0_LRVW8_LWPMn1_MIAV1_MIWT2_3_MO40_NTn1_NTA6_NTB2_NTC0_NTD1_NTM0_NEPBS0_NLCA1_NLCB1_ONLL1_PGR2_PLR1_PKA1_SIA3_SS1_SU0_SUM0_SUS0_SPO1_SRVW0_SSO0_SVW1_SK3_SKFTR0_SKXCCM0_TLDS1_ULSGRO0_USL1_UIOFGRO0_USFGRO0_VSn1_VWA1_VWB1_WSGRA0_WSGRB0_WS64_WG16_16_1_WGM1_WGMXCC1_WGMXCCGn1
    SolutionIndex: 47
    SolutionNameMin: Cijk_Ailk_Bljk_HHS_BH_Bias_HA_S_SAV_UserArgs_MT192x96x32_MI16x16x1_CMS_SN_LDSB1_AFC0_AFEM1_AFEM1_ASEM1_CLR0_CADS0_DTLA0_DTLB0_DTVA0_DTVB0_EPS0_FDSI0_GRPM1_GRVWA8_GRVWB4_GSU0_GSUAMB_GSUC0_GSUWGMRR0_GLS0_ISA950_IU1_K1_LDSTI0_LBSPPA3072_LBSPPB128_LBSPPM0_LPA16_LPB16_LPM0_LRVW8_LWPMn1_MIAV0_MIWT3_6_MO40_NTn1_NTA1_NTB0_NTC1_NTD0_NTM0_NEPBS0_NLCA3_NLCB1_ONLL1_PGR2_PLR0_PKA1_SIA3_SS1_SU8_SUM0_SUS64_SPO1_SRVW0_SSO4_SVW1_SK3_SKFTR0_SKXCCM0_TLDS1_ULSGRO0_USL1_UIOFGRO0_USFGROn1_VSn1_VWA1_VWB2_WSGRA0_WSGRB0_WS64_WG64_4_1_WGM1_WGMXCC8_WGMXCCGn1
    SolutionIndex: 48
    SolutionNameMin: Cijk_Ailk_Bljk_HHS_BH_Bias_HA_S_SAV_UserArgs_MT32x256x32_MI32x32x1_CMS_SN_LDSB1_AFC0_AFEM1_AFEM1_ASEM1_CLR1_CADS0_DTLA0_DTLB0_DTVA0_DTVB0_EPS1_FDSI0_GRPM1_GRVWA4_GRVWB8_GSU0_GSUAMB_GSUC0_GSUWGMRR0_GLS0_ISA950_IU1_K1_LDSTI0_LBSPPA0_LBSPPB128_LBSPPM0_LPA0_LPB8_LPM0_LRVW8_LWPMn1_MIAV0_MIWT1_2_MO40_NTn1_NTA6_NTB2_NTC1_NTD5_NTM0_NEPBS16_NLCA1_NLCB1_ONLL1_PGR1_PLR1_PKA1_SIA3_SS1_SU0_SUM0_SUS0_SPO0_SRVW0_SSO0_SVW1_SK3_SKFTR0_SKXCCM0_TLDS1_ULSGRO0_USL1_UIOFGRO0_USFGROn1_VSn1_VWA1_VWB2_WSGRA0_WSGRB0_WS64_WG32_8_1_WGM1_WGMXCC1_WGMXCCGn1
    SolutionIndex: 49
    SolutionNameMin: Cijk_Ailk_Bljk_HHS_BH_Bias_HA_S_SAV_UserArgs_MT256x96x32_MI32x32x1_CMS_SN_LDSB0_AFC0_AFEM1_AFEM1_ASEM1_CLR0_CADS0_DTLA0_DTLB0_DTVA0_DTVB0_EPS0_FDSI0_GRPM1_GRVWA8_GRVWB4_GSU0_GSUAMB_GSUC0_GSUWGMRR0_GLS0_ISA950_IU1_K1_LDSTI1_LBSPPA0_LBSPPB128_LBSPPM0_LPA0_LPB8_LPM0_LRVW8_LWPMn1_MIAV0_MIWT2_3_MO40_NTn1_NTA4_NTB4_NTC0_NTD1_NTM0_NEPBS0_NLCA1_NLCB1_ONLL1_PGR2_PLR1_PKA1_SIA3_SS1_SU0_SUM0_SUS0_SPO0_SRVW0_SSO0_SVW1_SK3_SKFTR0_SKXCCM4_TLDS1_ULSGRO0_USL1_UIOFGRO0_USFGROn1_VSn1_VWA1_VWB1_WSGRA0_WSGRB0_WS64_WG128_2_1_WGM1_WGMXCC2_WGMXCCGn1
    SolutionIndex: 50
    SolutionNameMin: Cijk_Ailk_Bljk_HHS_BH_Bias_HA_S_SAV_UserArgs_MT192x96x32_MI16x16x1_CMS_SN_LDSB0_AFC0_AFEM1_AFEM1_ASEM1_CLR0_CADS0_DTLA0_DTLB0_DTVA0_DTVB0_EPS1_FDSI0_GRPM1_GRVWA8_GRVWB4_GSU0_GSUAMB_GSUC0_GSUWGMRR0_GLS0_ISA950_IU1_K1_LDSTI0_LBSPPA3072_LBSPPB128_LBSPPM0_LPA16_LPB16_LPM0_LRVW8_LWPMn1_MIAV0_MIWT3_6_MO40_NTn1_NTA1_NTB1_NTC0_NTD0_NTM0_NEPBS0_NLCA3_NLCB1_ONLL1_PGR1_PLR0_PKA1_SIA3_SS1_SU0_SUM0_SUS0_SPO0_SRVW0_SSO4_SVW1_SK3_SKFTR0_SKXCCM0_TLDS1_ULSGRO0_USL1_UIOFGRO0_USFGROn1_VSn1_VWA1_VWB2_WSGRA0_WSGRB0_WS64_WG64_4_1_WGM1_WGMXCC2_WGMXCCGn1
    SolutionIndex: 51
    SolutionNameMin: Cijk_Ailk_Bljk_HHS_BH_Bias_HA_S_SAV_UserArgs_MT32x224x32_MI16x16x1_CMS_SN_LDSB0_AFC0_AFEM1_AFEM1_ASEM1_CLR0_CADS0_DTLA1_DTLB1_DTVA0_DTVB0_EPS0_FDSI0_GRPM1_GRVWA2_GRVWB8_GSU0_GSUAMB_GSUC0_GSUWGMRR0_GLS0_ISA950_IU1_K1_LDSTI0_LBSPPA512_LBSPPB1024_LBSPPM0_LPA0_LPB16_LPM0_LRVW8_LWPMn1_MIAV0_MIWT2_7_MO40_NTn1_NTA6_NTB0_NTC5_NTD7_NTM0_NEPBS0_NLCA1_NLCB1_ONLL1_PGR2_PLR0_PKA1_SIA3_SS0_SU0_SUM0_SUS0_SPO1_SRVW0_SSO1_SVW8_SK3_SKFTR0_SKXCCM0_TLDS1_ULSGRO0_USL1_UIOFGRO0_USFGRO0_VSn1_VWA2_VWB1_WSGRA0_WSGRB0_WS64_WG16_8_1_WGM1_WGMXCC16_WGMXCCGn1
    SolutionIndex: 52
    SolutionNameMin: Cijk_Ailk_Bljk_HHS_BH_Bias_HA_S_SAV_UserArgs_MT48x96x64_MI16x16x1_CMS_SN_LDSB1_AFC0_AFEM1_AFEM1_ASEM1_CLR1_CADS0_DTLA0_DTLB0_DTVA0_DTVB0_EPS0_FDSI0_GRPM1_GRVWA8_GRVWB8_GSU0_GSUAMB_GSUC0_GSUWGMRR0_GLS0_ISA950_IU1_K1_LDSTI0_LBSPPA128_LBSPPB128_LBSPPM0_LPA16_LPB16_LPM0_LRVW8_LWPMn1_MIAV0_MIWT3_3_MO40_NTn1_NTA0_NTB3_NTC1_NTD0_NTM0_NEPBS10_NLCA3_NLCB1_ONLL1_PGR2_PLR1_PKA1_SIA3_SS0_SU0_SUM0_SUS0_SPO1_SRVW0_SSO0_SVW4_SK3_SKFTR0_SKXCCM0_TLDS2_ULSGRO0_USL1_UIOFGRO0_USFGROn1_VSn1_VWA1_VWB1_WSGRA0_WSGRB0_WS64_WG16_8_1_WGM1_WGMXCC8_WGMXCCGn1
    SolutionIndex: 53
    SolutionNameMin: Cijk_Ailk_Bljk_HHS_BH_Bias_HA_S_SAV_UserArgs_MT32x256x32_MI32x32x1_CMS_SN_LDSB1_AFC0_AFEM1_AFEM1_ASEM1_CLR0_CADS0_DTLA0_DTLB0_DTVA0_DTVB0_EPS0_FDSI0_GRPM1_GRVWA4_GRVWB8_GSU0_GSUAMB_GSUC0_GSUWGMRR0_GLS0_ISA950_IU1_K1_LDSTI1_LBSPPA0_LBSPPB128_LBSPPM0_LPA0_LPB8_LPM0_LRVW8_LWPMn1_MIAV1_MIWT1_2_MO40_NTn1_NTA7_NTB0_NTC0_NTD4_NTM0_NEPBS16_NLCA1_NLCB1_ONLL1_PGR2_PLR1_PKA1_SIA3_SS1_SU0_SUM0_SUS0_SPO1_SRVW0_SSO0_SVW1_SK3_SKFTR0_SKXCCM0_TLDS1_ULSGRO0_USL1_UIOFGRO0_USFGRO1_VSn1_VWA1_VWB2_WSGRA0_WSGRB0_WS64_WG32_8_1_WGM1_WGMXCC1_WGMXCCGn1
    SolutionIndex: 54
    SolutionNameMin: Cijk_Ailk_Bljk_HHS_BH_Bias_HA_S_SAV_UserArgs_MT32x192x32_MI32x32x1_CMS_SN_LDSB1_AFC0_AFEM1_AFEM1_ASEM1_CLR1_CADS0_DTLA0_DTLB0_DTVA0_DTVB0_EPS1_FDSI0_GRPM1_GRVWA8_GRVWB8_GSU0_GSUAMB_GSUC0_GSUWGMRR0_GLS0_ISA950_IU1_K1_LDSTI0_LBSPPA0_LBSPPB128_LBSPPM0_LPA0_LPB8_LPM0_LRVW8_LWPMn1_MIAV1_MIWT1_3_MO40_NTn1_NTA7_NTB2_NTC0_NTD4_NTM0_NEPBS0_NLCA1_NLCB1_ONLL1_PGR1_PLR1_PKA1_SIA3_SS1_SU0_SUM0_SUS0_SPO0_SRVW0_SSO0_SVW1_SK3_SKFTR0_SKXCCM0_TLDS1_ULSGRO0_USL1_UIOFGRO0_USFGROn1_VSn1_VWA1_VWB1_WSGRA0_WSGRB0_WS64_WG32_4_1_WGM1_WGMXCC8_WGMXCCGn1
    SolutionIndex: 55
    SolutionNameMin: Cijk_Ailk_Bljk_HHS_BH_Bias_HA_S_SAV_UserArgs_MT32x224x32_MI16x16x1_CMS_SN_LDSB0_AFC0_AFEM1_AFEM1_ASEM1_CLR0_CADS0_DTLA1_DTLB1_DTVA0_DTVB0_EPS0_FDSI0_GRPM1_GRVWA2_GRVWB8_GSU0_GSUAMB_GSUC0_GSUWGMRR0_GLS0_ISA950_IU1_K1_LDSTI0_LBSPPA512_LBSPPB1024_LBSPPM0_LPA0_LPB16_LPM0_LRVW8_LWPMn1_MIAV1_MIWT2_7_MO40_NTn1_NTA6_NTB1_NTC6_NTD7_NTM0_NEPBS12_NLCA1_NLCB1_ONLL1_PGR2_PLR0_PKA1_SIA3_SS0_SU0_SUM0_SUS0_SPO1_SRVW0_SSO1_SVW8_SK3_SKFTR0_SKXCCM0_TLDS1_ULSGRO0_USL1_UIOFGRO0_USFGROn1_VSn1_VWA2_VWB1_WSGRA0_WSGRB0_WS64_WG16_8_1_WGM1_WGMXCC8_WGMXCCGn1
    SolutionIndex: 56
    SolutionNameMin: Cijk_Ailk_Bljk_HHS_BH_Bias_HA_S_SAV_UserArgs_MT32x128x64_MI32x32x1_CMS_SN_LDSB1_AFC0_AFEM1_AFEM1_ASEM1_CLR1_CADS0_DTLA0_DTLB0_DTVA0_DTVB0_EPS0_FDSI0_GRPM1_GRVWA8_GRVWB8_GSU0_GSUAMB_GSUC0_GSUWGMRR0_GLS0_ISA950_IU1_K1_LDSTI0_LBSPPA0_LBSPPB128_LBSPPM0_LPA0_LPB8_LPM0_LRVW8_LWPMn1_MIAV1_MIWT1_1_MO40_NTn1_NTA5_NTB2_NTC1_NTD5_NTM0_NEPBS0_NLCA1_NLCB1_ONLL1_PGR2_PLR1_PKA1_SIA3_SS1_SU8_SUM0_SUS256_SPO0_SRVW0_SSO0_SVW1_SK3_SKFTR0_SKXCCM0_TLDS1_ULSGRO0_USL1_UIOFGRO0_USFGRO0_VSn1_VWA1_VWB1_WSGRA0_WSGRB0_WS64_WG32_8_1_WGM1_WGMXCC1_WGMXCCGn1
    SolutionIndex: 57
    SolutionNameMin: Cijk_Ailk_Bljk_HHS_BH_Bias_HA_S_SAV_UserArgs_MT96x256x32_MI16x16x1_CMS_SN_LDSB1_AFC0_AFEM1_AFEM1_ASEM1_CLR0_CADS0_DTLA0_DTLB0_DTVA0_DTVB0_EPS0_FDSI0_GRPM1_GRVWA4_GRVWB8_GSU0_GSUAMB_GSUC0_GSUWGMRR0_GLS0_ISA950_IU1_K1_LDSTI0_LBSPPA128_LBSPPB256_LBSPPM0_LPA16_LPB16_LPM0_LRVW8_LWPMn1_MIAV0_MIWT6_4_MO40_NTn1_NTA0_NTB1_NTC1_NTD7_NTM0_NEPBS16_NLCA3_NLCB1_ONLL1_PGR2_PLR0_PKA1_SIA3_SS0_SU0_SUM0_SUS0_SPO0_SRVW0_SSO0_SVW8_SK3_SKFTR0_SKXCCM0_TLDS2_ULSGRO0_USL1_UIOFGRO0_USFGRO1_VSn1_VWA2_VWB4_WSGRA0_WSGRB0_WS64_WG16_16_1_WGM1_WGMXCC8_WGMXCCGn1
    SolutionIndex: 58
    SolutionNameMin: Cijk_Ailk_Bljk_HHS_BH_Bias_HA_S_SAV_UserArgs_MT32x448x64_MI16x16x1_CMS_SN_LDSB1_AFC0_AFEM1_AFEM1_ASEM1_CLR1_CADS0_DTLA0_DTLB0_DTVA0_DTVB0_EPS0_FDSI0_GRPM1_GRVWA8_GRVWB8_GSU0_GSUAMB_GSUC0_GSUWGMRR0_GLS0_ISA950_IU1_K1_LDSTI0_LBSPPA256_LBSPPB128_LBSPPM0_LPA16_LPB16_LPM0_LRVW8_LWPMn1_MIAV0_MIWT2_7_MO40_NTn1_NTA2_NTB1_NTC4_NTD7_NTM0_NEPBS4_NLCA1_NLCB1_ONLL1_PGR2_PLR1_PKA1_SIA3_SS0_SU0_SUM0_SUS0_SPO1_SRVW0_SSO1_SVW8_SK3_SKFTR0_SKXCCM0_TLDS2_ULSGRO0_USL1_UIOFGRO0_USFGROn1_VSn1_VWA2_VWB1_WSGRA0_WSGRB0_WS64_WG16_16_1_WGM1_WGMXCC32_WGMXCCGn1
    SolutionIndex: 59
    SolutionNameMin: Cijk_Ailk_Bljk_HHS_BH_Bias_HA_S_SAV_UserArgs_MT48x256x32_MI16x16x1_CMS_SN_LDSB1_AFC0_AFEM1_AFEM1_ASEM1_CLR0_CADS0_DTLA0_DTLB0_DTVA0_DTVB0_EPS0_FDSI0_GRPM1_GRVWA2_GRVWB8_GSU0_GSUAMB_GSUC0_GSUWGMRR0_GLS0_ISA950_IU1_K1_LDSTI1_LBSPPA768_LBSPPB4096_LBSPPM0_LPA16_LPB16_LPM0_LRVW8_LWPMn1_MIAV1_MIWT3_4_MO40_NTn1_NTA1_NTB0_NTC0_NTD0_NTM0_NEPBS16_NLCA3_NLCB1_ONLL1_PGR2_PLR1_PKA1_SIA3_SS0_SU0_SUM0_SUS0_SPO0_SRVW0_SSO0_SVW4_SK3_SKFTR0_SKXCCM0_TLDS0_ULSGRO0_USL1_UIOFGRO0_USFGROn1_VSn1_VWA1_VWB1_WSGRA0_WSGRB0_WS64_WG16_16_1_WGM1_WGMXCC16_WGMXCCGn1
    SolutionIndex: 60
    SolutionNameMin: Cijk_Ailk_Bljk_HHS_BH_Bias_HA_S_SAV_UserArgs_MT96x64x32_MI16x16x1_CMS_SN_LDSB0_AFC0_AFEM1_AFEM1_ASEM1_CLR0_CADS0_DTLA0_DTLB0_DTVA0_DTVB0_EPS0_FDSI0_GRPM1_GRVWA2_GRVWB8_GSU0_GSUAMB_GSUC0_GSUWGMRR0_GLS0_ISA950_IU1_K1_LDSTI0_LBSPPA128_LBSPPB128_LBSPPM0_LPA16_LPB16_LPM0_LRVW8_LWPMn1_MIAV1_MIWT6_1_MO40_NTn1_NTA0_NTB2_NTC0_NTD6_NTM0_NEPBS14_NLCA3_NLCB1_ONLL1_PGR2_PLR0_PKA1_SIA3_SS1_SU8_SUM0_SUS128_SPO0_SRVW0_SSO0_SVW2_SK3_SKFTR0_SKXCCM0_TLDS2_ULSGRO0_USL1_UIOFGRO0_USFGROn1_VSn1_VWA2_VWB1_WSGRA0_WSGRB0_WS64_WG16_16_1_WGM1_WGMXCC4_WGMXCCGn1
    SolutionIndex: 61
    SolutionNameMin: Cijk_Ailk_Bljk_HHS_BH_Bias_HA_S_SAV_UserArgs_MT96x128x32_MI16x16x1_CMS_SN_LDSB0_AFC0_AFEM1_AFEM1_ASEM1_CLR0_CADS0_DTLA0_DTLB0_DTVA0_DTVB0_EPS0_FDSI0_GRPM1_GRVWA2_GRVWB8_GSU0_GSUAMB_GSUC0_GSUWGMRR0_GLS0_ISA950_IU1_K1_LDSTI0_LBSPPA128_LBSPPB128_LBSPPM0_LPA16_LPB16_LPM0_LRVW8_LWPMn1_MIAV0_MIWT6_2_MO40_NTn1_NTA0_NTB2_NTC1_NTD7_NTM0_NEPBS0_NLCA3_NLCB1_ONLL1_PGR2_PLR0_PKA1_SIA3_SS1_SU0_SUM0_SUS0_SPO1_SRVW0_SSO1_SVW2_SK3_SKFTR0_SKXCCM0_TLDS2_ULSGRO0_USL1_UIOFGRO0_USFGRO1_VSn1_VWA2_VWB2_WSGRA0_WSGRB0_WS64_WG16_16_1_WGM1_WGMXCC32_WGMXCCGn1
    SolutionIndex: 62
    SolutionNameMin: Cijk_Ailk_Bljk_HHS_BH_Bias_HA_S_SAV_UserArgs_MT64x48x128_MI16x16x1_CMS_SN_LDSB0_AFC0_AFEM1_AFEM1_ASEM1_CLR0_CADS0_DTLA0_DTLB0_DTVA0_DTVB0_EPS0_FDSI0_GRPM1_GRVWA8_GRVWB8_GSU0_GSUAMB_GSUC0_GSUWGMRR0_GLS0_ISA950_IU1_K1_LDSTI1_LBSPPA1024_LBSPPB256_LBSPPM0_LPA16_LPB16_LPM0_LRVW8_LWPMn1_MIAV0_MIWT1_3_MO40_NTn1_NTA1_NTB1_NTC2_NTD4_NTM0_NEPBS12_NLCA1_NLCB1_ONLL1_PGR2_PLR1_PKA1_SIA3_SS1_SU0_SUM0_SUS0_SPO0_SRVW0_SSO1_SVW1_SK3_SKFTR0_SKXCCM8_TLDS1_ULSGRO0_USL1_UIOFGRO0_USFGRO1_VSn1_VWA1_VWB1_WSGRA0_WSGRB0_WS64_WG64_4_1_WGM1_WGMXCC1_WGMXCCGn1
    SolutionIndex: 63
    SolutionNameMin: Cijk_Ailk_Bljk_HHS_BH_Bias_HA_S_SAV_UserArgs_MT208x256x64_MI16x16x1_CMS_SN_LDSB0_AFC0_AFEM1_AFEM1_ASEM1_CLR0_CADS0_DTLA0_DTLB0_DTVA0_DTVB0_EPS0_FDSI0_GRPM1_GRVWA2_GRVWB8_GSU0_GSUAMB_GSUC0_GSUWGMRR0_GLS0_ISA950_IU1_K1_LDSTI1_LBSPPA3328_LBSPPB512_LBSPPM0_LPA16_LPB16_LPM0_LRVW8_LWPMn1_MIAV0_MIWT13_4_MO40_NTn1_NTA0_NTB4_NTC0_NTD5_NTM0_NEPBS0_NLCA13_NLCB1_ONLL1_PGR2_PLR1_PKA1_SIA3_SS1_SU0_SUM0_SUS0_SPO1_SRVW0_SSO0_SVW1_SK3_SKFTR0_SKXCCM6_TLDS1_ULSGRO0_USL1_UIOFGRO0_USFGRO0_VSn1_VWA1_VWB4_WSGRA0_WSGRB0_WS64_WG16_16_1_WGM6_WGMXCC2_WGMXCCGn1
    SolutionIndex: 64
    SolutionNameMin: Cijk_Ailk_Bljk_HHS_BH_Bias_HA_S_SAV_UserArgs_MT256x128x64_MI16x16x1_CMS_SN_LDSB0_AFC0_AFEM1_AFEM1_ASEM1_CLR0_CADS0_DTLA0_DTLB0_DTVA0_DTVB0_EPS0_FDSI0_GRPM1_GRVWA8_GRVWB8_GSU0_GSUAMB_GSUC0_GSUWGMRR0_GLS0_ISA950_IU1_K1_LDSTI1_LBSPPA4096_LBSPPB1024_LBSPPM0_LPA16_LPB16_LPM0_LRVW8_LWPMn1_MIAV0_MIWT4_8_MO40_NTn1_NTA4_NTB7_NTC0_NTD0_NTM0_NEPBS4_NLCA1_NLCB1_ONLL1_PGR2_PLR1_PKA1_SIA3_SS1_SU16_SUM0_SUS128_SPO1_SRVW0_SSO0_SVW1_SK3_SKFTR0_SKXCCM4_TLDS1_ULSGRO0_USL1_UIOFGRO0_USFGRO0_VSn1_VWA1_VWB8_WSGRA0_WSGRB0_WS64_WG64_4_1_WGM2_WGMXCC32_WGMXCCGn1
    SolutionIndex: 65
    SolutionNameMin: Cijk_Ailk_Bljk_HHS_BH_Bias_HA_S_SAV_UserArgs_MT96x384x32_MI16x16x1_CMS_SN_LDSB1_AFC0_AFEM1_AFEM1_ASEM1_CLR0_CADS0_DTLA0_DTLB0_DTVA0_DTVB0_EPS0_FDSI0_GRPM1_GRVWA2_GRVWB8_GSU0_GSUAMB_GSUC0_GSUWGMRR0_GLS0_ISA950_IU1_K1_LDSTI0_LBSPPA128_LBSPPB128_LBSPPM0_LPA16_LPB16_LPM0_LRVW8_LWPMn1_MIAV0_MIWT6_6_MO40_NTn1_NTA0_NTB2_NTC1_NTD5_NTM0_NEPBS0_NLCA3_NLCB1_ONLL1_PGR2_PLR0_PKA1_SIA3_SS1_SU0_SUM0_SUS0_SPO0_SRVW0_SSO4_SVW2_SK3_SKFTR0_SKXCCM0_TLDS2_ULSGRO0_USL1_UIOFGRO0_USFGRO1_VSn1_VWA2_VWB2_WSGRA0_WSGRB0_WS64_WG16_16_1_WGM1_WGMXCC8_WGMXCCGn1
    SolutionIndex: 66
    SolutionNameMin: Cijk_Ailk_Bljk_HHS_BH_Bias_HA_S_SAV_UserArgs_MT32x96x64_MI16x16x1_CMS_SN_LDSB0_AFC0_AFEM1_AFEM1_ASEM1_CLR0_CADS0_DTLA0_DTLB0_DTVA0_DTVB0_EPS0_FDSI0_GRPM1_GRVWA2_GRVWB8_GSU0_GSUAMB_GSUC0_GSUWGMRR0_GLS0_ISA950_IU1_K1_LDSTI1_LBSPPA512_LBSPPB128_LBSPPM0_LPA16_LPB16_LPM0_LRVW8_LWPMn1_MIAV0_MIWT1_3_MO40_NTn1_NTA0_NTB0_NTC6_NTD4_NTM0_NEPBS0_NLCA1_NLCB1_ONLL1_PGR2_PLR1_PKA1_SIA3_SS1_SU0_SUM0_SUS0_SPO0_SRVW0_SSO1_SVW1_SK3_SKFTR0_SKXCCM0_TLDS1_ULSGRO0_USL1_UIOFGRO0_USFGRO1_VSn1_VWA1_VWB1_WSGRA0_WSGRB0_WS64_WG32_8_1_WGM1_WGMXCC16_WGMXCCGn1
    SolutionIndex: 67
    SolutionNameMin: Cijk_Ailk_Bljk_HHS_BH_Bias_HA_S_SAV_UserArgs_MT224x256x64_MI16x16x1_CMS_SN_LDSB0_AFC0_AFEM1_AFEM1_ASEM1_CLR0_CADS0_DTLA0_DTLB0_DTVA0_DTVB0_EPS0_FDSI0_GRPM1_GRVWA8_GRVWB8_GSU0_GSUAMB_GSUC0_GSUWGMRR0_GLS0_ISA950_IU1_K1_LDSTI1_LBSPPA3584_LBSPPB1024_LBSPPM0_LPA16_LPB16_LPM0_LRVW8_LWPMn1_MIAV0_MIWT7_8_MO40_NTn1_NTA0_NTB2_NTC0_NTD0_NTM0_NEPBS0_NLCA7_NLCB1_ONLL1_PGR2_PLR1_PKA1_SIA3_SS1_SU8_SUM0_SUS128_SPO1_SRVW0_SSO1_SVW1_SK3_SKFTR0_SKXCCM6_TLDS1_ULSGRO0_USL1_UIOFGRO0_USFGROn1_VSn1_VWA1_VWB8_WSGRA0_WSGRB0_WS64_WG32_8_1_WGM2_WGMXCC2_WGMXCCGn1
    SolutionIndex: 68
    SolutionNameMin: Cijk_Ailk_Bljk_HHS_BH_Bias_HA_S_SAV_UserArgs_MT224x256x32_MI16x16x1_CMS_SN_LDSB0_AFC0_AFEM1_AFEM1_ASEM1_CLR0_CADS0_DTLA0_DTLB0_DTVA0_DTVB0_EPS0_FDSI0_GRPM1_GRVWA2_GRVWB8_GSU0_GSUAMB_GSUC0_GSUWGMRR0_GLS0_ISA950_IU1_K1_LDSTI0_LBSPPA128_LBSPPB256_LBSPPM0_LPA16_LPB16_LPM0_LRVW8_LWPMn1_MIAV0_MIWT14_4_MO40_NTn1_NTA0_NTB0_NTC0_NTD6_NTM0_NEPBS0_NLCA7_NLCB1_ONLL1_PGR2_PLR0_PKA1_SIA3_SS1_SU8_SUM0_SUS128_SPO1_SRVW0_SSO0_SVW2_SK3_SKFTR0_SKXCCM0_TLDS2_ULSGRO0_USL1_UIOFGRO0_USFGRO0_VSn1_VWA2_VWB4_WSGRA0_WSGRB0_WS64_WG16_16_1_WGM1_WGMXCC16_WGMXCCGn1
    SolutionIndex: 69
    SolutionNameMin: Cijk_Ailk_Bljk_HHS_BH_Bias_HA_S_SAV_UserArgs_MT32x256x64_MI32x32x1_CMS_SN_LDSB1_AFC0_AFEM1_AFEM1_ASEM1_CLR1_CADS0_DTLA0_DTLB0_DTVA0_DTVB0_EPS0_FDSI0_GRPM1_GRVWA8_GRVWB8_GSU0_GSUAMB_GSUC0_GSUWGMRR0_GLS0_ISA950_IU1_K1_LDSTI0_LBSPPA128_LBSPPB256_LBSPPM0_LPA8_LPB8_LPM0_LRVW8_LWPMn1_MIAV0_MIWT1_2_MO40_NTn1_NTA1_NTB0_NTC0_NTD4_NTM0_NEPBS0_NLCA1_NLCB1_ONLL1_PGR2_PLR1_PKA1_SIA3_SS1_SU0_SUM0_SUS0_SPO1_SRVW0_SSO1_SVW1_SK3_SKFTR0_SKXCCM0_TLDS2_ULSGRO0_USL1_UIOFGRO0_USFGROn1_VSn1_VWA1_VWB2_WSGRA0_WSGRB0_WS64_WG32_8_1_WGM1_WGMXCC8_WGMXCCGn1
    SolutionIndex: 70
    SolutionNameMin: Cijk_Ailk_Bljk_HHS_BH_Bias_HA_S_SAV_UserArgs_MT192x192x32_MI32x32x1_CMS_SN_LDSB1_AFC0_AFEM1_AFEM1_ASEM1_CLR0_CADS0_DTLA0_DTLB0_DTVA0_DTVB0_EPS0_FDSI0_GRPM1_GRVWA8_GRVWB8_GSU0_GSUAMB_GSUC0_GSUWGMRR0_GLS0_ISA950_IU1_K1_LDSTI1_LBSPPA0_LBSPPB128_LBSPPM0_LPA0_LPB8_LPM0_LRVW8_LWPMn1_MIAV0_MIWT3_3_MO40_NTn1_NTA0_NTB0_NTC1_NTD0_NTM0_NEPBS0_NLCA3_NLCB1_ONLL1_PGR2_PLR1_PKA1_SIA3_SS1_SU16_SUM0_SUS512_SPO1_SRVW0_SSO1_SVW1_SK3_SKFTR0_SKXCCM0_TLDS1_ULSGRO0_USL1_UIOFGRO0_USFGRO1_VSn1_VWA1_VWB1_WSGRA0_WSGRB0_WS64_WG64_4_1_WGM1_WGMXCC16_WGMXCCGn1
    SolutionIndex: 71
    SolutionNameMin: Cijk_Ailk_Bljk_HHS_BH_Bias_HA_S_SAV_UserArgs_MT192x192x32_MI32x32x1_CMS_SN_LDSB1_AFC0_AFEM1_AFEM1_ASEM1_CLR0_CADS0_DTLA0_DTLB0_DTVA0_DTVB0_EPS0_FDSI0_GRPM1_GRVWA8_GRVWB8_GSU0_GSUAMB_GSUC0_GSUWGMRR0_GLS0_ISA950_IU1_K1_LDSTI1_LBSPPA0_LBSPPB128_LBSPPM0_LPA0_LPB8_LPM0_LRVW8_LWPMn1_MIAV0_MIWT3_3_MO40_NTn1_NTA0_NTB0_NTC0_NTD1_NTM0_NEPBS0_NLCA3_NLCB1_ONLL1_PGR2_PLR1_PKA1_SIA3_SS1_SU0_SUM0_SUS0_SPO0_SRVW0_SSO1_SVW1_SK3_SKFTR0_SKXCCM0_TLDS1_ULSGRO0_USL1_UIOFGRO0_USFGROn1_VSn1_VWA1_VWB1_WSGRA0_WSGRB0_WS64_WG64_4_1_WGM1_WGMXCC4_WGMXCCGn1
    SolutionIndex: 72
    SolutionNameMin: Cijk_Ailk_Bljk_HHS_BH_Bias_HA_S_SAV_UserArgs_MT224x256x32_MI16x16x1_CMS_SN_LDSB0_AFC0_AFEM1_AFEM1_ASEM1_CLR0_CADS0_DTLA0_DTLB0_DTVA0_DTVB0_EPS0_FDSI0_GRPM1_GRVWA4_GRVWB8_GSU0_GSUAMB_GSUC0_GSUWGMRR0_GLS0_ISA950_IU1_K1_LDSTI1_LBSPPA3584_LBSPPB256_LBSPPM0_LPA16_LPB16_LPM0_LRVW8_LWPMn1_MIAV0_MIWT14_4_MO40_NTn1_NTA1_NTB0_NTC1_NTD4_NTM0_NEPBS0_NLCA7_NLCB1_ONLL1_PGR2_PLR1_PKA1_SIA3_SS1_SU8_SUM0_SUS64_SPO1_SRVW0_SSO0_SVW1_SK3_SKFTR0_SKXCCM4_TLDS1_ULSGRO0_USL1_UIOFGRO0_USFGRO0_VSn1_VWA1_VWB4_WSGRA0_WSGRB0_WS64_WG16_16_1_WGM8_WGMXCC2_WGMXCCGn1
    SolutionIndex: 73
    SolutionNameMin: Cijk_Ailk_Bljk_HHS_BH_Bias_HA_S_SAV_UserArgs_MT256x192x64_MI16x16x1_CMS_SN_LDSB1_AFC0_AFEM1_AFEM1_ASEM1_CLR1_CADS0_DTLA0_DTLB0_DTVA0_DTVB0_EPS0_FDSI0_GRPM1_GRVWA8_GRVWB8_GSU0_GSUAMB_GSUC0_GSUWGMRR0_GLS0_ISA950_IU1_K1_LDSTI0_LBSPPA4096_LBSPPB512_LBSPPM0_LPA0_LPB16_LPM0_LRVW8_LWPMn1_MIAV0_MIWT4_12_MO40_NTn1_NTA3_NTB0_NTC5_NTD6_NTM0_NEPBS16_NLCA1_NLCB1_ONLL1_PGR2_PLR1_PKA1_SIA3_SS1_SU0_SUM0_SUS0_SPO0_SRVW0_SSO1_SVW4_SK3_SKFTR0_SKXCCM0_TLDS1_ULSGRO0_USL1_UIOFGRO0_USFGROn1_VSn1_VWA4_VWB4_WSGRA0_WSGRB0_WS64_WG64_4_1_WGM32_WGMXCC32_WGMXCCGn1
    SolutionIndex: 74
    SolutionNameMin: Cijk_Ailk_Bljk_HHS_BH_Bias_HA_S_SAV_UserArgs_MT192x192x32_MI32x32x1_CMS_SN_LDSB0_AFC0_AFEM1_AFEM1_ASEM1_CLR1_CADS0_DTLA0_DTLB0_DTVA0_DTVB0_EPS0_FDSI0_GRPM1_GRVWA8_GRVWB8_GSU0_GSUAMB_GSUC0_GSUWGMRR0_GLS0_ISA950_IU1_K1_LDSTI0_LBSPPA0_LBSPPB128_LBSPPM0_LPA0_LPB8_LPM0_LRVW8_LWPMn1_MIAV0_MIWT3_3_MO40_NTn1_NTA1_NTB1_NTC1_NTD0_NTM0_NEPBS0_NLCA3_NLCB1_ONLL1_PGR2_PLR1_PKA1_SIA3_SS1_SU0_SUM0_SUS0_SPO0_SRVW0_SSO1_SVW1_SK3_SKFTR0_SKXCCM0_TLDS1_ULSGRO0_USL1_UIOFGRO0_USFGRO0_VSn1_VWA1_VWB1_WSGRA0_WSGRB0_WS64_WG64_4_1_WGM1_WGMXCC16_WGMXCCGn1
    SolutionIndex: 75
    SolutionNameMin: Cijk_Ailk_Bljk_HHS_BH_Bias_HA_S_SAV_UserArgs_MT224x256x32_MI32x32x1_CMS_SN_LDSB0_AFC0_AFEM1_AFEM1_ASEM1_CLR0_CADS0_DTLA0_DTLB0_DTVA0_DTVB0_EPS0_FDSI0_GRPM1_GRVWA2_GRVWB8_GSU0_GSUAMB_GSUC0_GSUWGMRR0_GLS0_ISA950_IU1_K1_LDSTI1_LBSPPA0_LBSPPB128_LBSPPM0_LPA0_LPB8_LPM0_LRVW8_LWPMn1_MIAV0_MIWT7_2_MO40_NTn1_NTA0_NTB1_NTC4_NTD5_NTM0_NEPBS0_NLCA7_NLCB1_ONLL1_PGR2_PLR1_PKA1_SIA3_SS1_SU0_SUM0_SUS0_SPO1_SRVW0_SSO0_SVW1_SK3_SKFTR0_SKXCCM6_TLDS1_ULSGRO0_USL1_UIOFGRO0_USFGRO1_VSn1_VWA1_VWB2_WSGRA0_WSGRB0_WS64_WG32_8_1_WGM1_WGMXCC32_WGMXCCGn1
    SolutionIndex: 76
    SolutionNameMin: Cijk_Ailk_Bljk_HHS_BH_Bias_HA_S_SAV_UserArgs_MT128x224x64_MI16x16x1_CMS_SN_LDSB0_AFC0_AFEM1_AFEM1_ASEM1_CLR1_CADS0_DTLA1_DTLB1_DTVA0_DTVB0_EPS0_FDSI0_GRPM1_GRVWA8_GRVWB8_GSU0_GSUAMB_GSUC0_GSUWGMRR0_GLS0_ISA950_IU1_K1_LDSTI0_LBSPPA2048_LBSPPB1024_LBSPPM0_LPA0_LPB16_LPM0_LRVW8_LWPMn1_MIAV0_MIWT4_7_MO40_NTn1_NTA1_NTB3_NTC4_NTD2_NTM0_NEPBS0_NLCA1_NLCB1_ONLL1_PGR2_PLR1_PKA1_SIA3_SS1_SU0_SUM0_SUS0_SPO0_SRVW0_SSO0_SVW4_SK3_SKFTR0_SKXCCM4_TLDS1_ULSGRO0_USL1_UIOFGRO0_USFGRO1_VSn1_VWA4_VWB1_WSGRA0_WSGRB0_WS64_WG32_8_1_WGM48_WGMXCC8_WGMXCCGn1
    SolutionIndex: 77
    SolutionNameMin: Cijk_Ailk_Bljk_HHS_BH_Bias_HA_S_SAV_UserArgs_MT64x384x64_MI16x16x1_CMS_SN_LDSB0_AFC0_AFEM1_AFEM1_ASEM1_CLR1_CADS0_DTLA0_DTLB0_DTVA0_DTVB0_EPS0_FDSI0_GRPM1_GRVWA2_GRVWB8_GSU0_GSUAMB_GSUC0_GSUWGMRR0_GLS0_ISA950_IU1_K1_LDSTI0_LBSPPA1024_LBSPPB256_LBSPPM0_LPA0_LPB16_LPM0_LRVW8_LWPMn1_MIAV0_MIWT4_6_MO40_NTn1_NTA3_NTB3_NTC5_NTD7_NTM0_NEPBS0_NLCA1_NLCB1_ONLL1_PGR2_PLR1_PKA1_SIA3_SS1_SU0_SUM0_SUS0_SPO0_SRVW0_SSO1_SVW4_SK3_SKFTR0_SKXCCM4_TLDS1_ULSGRO0_USL1_UIOFGRO0_USFGRO1_VSn1_VWA4_VWB2_WSGRA0_WSGRB0_WS64_WG16_16_1_WGM1_WGMXCC2_WGMXCCGn1
    SolutionIndex: 78
    SolutionNameMin: Cijk_Ailk_Bljk_HHS_BH_Bias_HA_S_SAV_UserArgs_MT320x192x64_MI16x16x1_CMS_SN_LDSB0_AFC0_AFEM1_AFEM1_ASEM1_CLR0_CADS0_DTLA0_DTLB0_DTVA0_DTVB0_EPS0_FDSI0_GRPM1_GRVWA8_GRVWB8_GSU0_GSUAMB_GSUC0_GSUWGMRR0_GLS0_ISA950_IU1_K1_LDSTI1_LBSPPA5120_LBSPPB512_LBSPPM0_LPA16_LPB16_LPM0_LRVW8_LWPMn1_MIAV0_MIWT5_12_MO40_NTn1_NTA0_NTB2_NTC0_NTD4_NTM0_NEPBS0_NLCA5_NLCB1_ONLL1_PGR2_PLR1_PKA1_SIA3_SS1_SU8_SUM0_SUS128_SPO0_SRVW0_SSO0_SVW1_SK3_SKFTR0_SKXCCM0_TLDS1_ULSGRO0_USL1_UIOFGRO0_USFGROn1_VSn1_VWA1_VWB4_WSGRA0_WSGRB0_WS64_WG64_4_1_WGM8_WGMXCC8_WGMXCCGn1
    SolutionIndex: 79
    SolutionNameMin: Cijk_Ailk_Bljk_HHS_BH_Bias_HA_S_SAV_UserArgs_MT192x128x64_MI16x16x1_CMS_SN_LDSB1_AFC0_AFEM1_AFEM1_ASEM1_CLR0_CADS0_DTLA0_DTLB0_DTVA0_DTVB0_EPS0_FDSI0_GRPM1_GRVWA8_GRVWB8_GSU0_GSUAMB_GSUC0_GSUWGMRR0_GLS0_ISA950_IU1_K1_LDSTI1_LBSPPA3072_LBSPPB1024_LBSPPM0_LPA16_LPB16_LPM0_LRVW8_LWPMn1_MIAV0_MIWT3_8_MO40_NTn1_NTA1_NTB7_NTC5_NTD0_NTM0_NEPBS8_NLCA3_NLCB1_ONLL1_PGR2_PLR1_PKA1_SIA3_SS1_SU8_SUM0_SUS128_SPO0_SRVW0_SSO0_SVW1_SK3_SKFTR0_SKXCCM4_TLDS1_ULSGRO0_USL1_UIOFGRO0_USFGRO1_VSn1_VWA1_VWB8_WSGRA0_WSGRB0_WS64_WG64_4_1_WGM6_WGMXCC32_WGMXCCGn1
    SolutionIndex: 80
    SolutionNameMin: Cijk_Ailk_Bljk_HHS_BH_Bias_HA_S_SAV_UserArgs_MT192x192x32_MI32x32x1_CMS_SN_LDSB0_AFC0_AFEM1_AFEM1_ASEM1_CLR0_CADS0_DTLA0_DTLB0_DTVA0_DTVB0_EPS0_FDSI0_GRPM1_GRVWA2_GRVWB8_GSU0_GSUAMB_GSUC0_GSUWGMRR0_GLS0_ISA950_IU1_K1_LDSTI1_LBSPPA0_LBSPPB128_LBSPPM0_LPA0_LPB8_LPM0_LRVW8_LWPMn1_MIAV0_MIWT3_3_MO40_NTn1_NTA0_NTB0_NTC1_NTD1_NTM0_NEPBS0_NLCA3_NLCB1_ONLL1_PGR2_PLR1_PKA1_SIA3_SS1_SU0_SUM0_SUS0_SPO0_SRVW0_SSO4_SVW1_SK3_SKFTR0_SKXCCM0_TLDS1_ULSGRO0_USL1_UIOFGRO0_USFGRO0_VSn1_VWA1_VWB1_WSGRA0_WSGRB0_WS64_WG64_4_1_WGM2_WGMXCC16_WGMXCCGn1
    SolutionIndex: 81
    SolutionNameMin: Cijk_Ailk_Bljk_HHS_BH_Bias_HA_S_SAV_UserArgs_MT128x64x64_MI16x16x1_CMS_SN_LDSB0_AFC0_AFEM1_AFEM1_ASEM1_CLR1_CADS0_DTLA1_DTLB1_DTVA0_DTVB0_EPS1_FDSI0_GRPM1_GRVWA8_GRVWB8_GSU0_GSUAMB_GSUC0_GSUWGMRR0_GLS0_ISA950_IU1_K1_LDSTI0_LBSPPA2048_LBSPPB1024_LBSPPM0_LPA0_LPB16_LPM0_LRVW8_LWPMn1_MIAV0_MIWT8_1_MO40_NTn1_NTA3_NTB4_NTC4_NTD1_NTM0_NEPBS14_NLCA1_NLCB1_ONLL1_PGR1_PLR1_PKA1_SIA3_SS1_SU0_SUM0_SUS0_SPO0_SRVW0_SSO0_SVW8_SK3_SKFTR0_SKXCCM0_TLDS1_ULSGRO0_USL1_UIOFGRO0_USFGRO0_VSn1_VWA8_VWB1_WSGRA0_WSGRB0_WS64_WG16_16_1_WGM1_WGMXCC8_WGMXCCGn1
    SolutionIndex: 82
    SolutionNameMin: Cijk_Ailk_Bljk_HHS_BH_Bias_HA_S_SAV_UserArgs_MT128x48x32_MI16x16x1_CMS_SN_LDSB0_AFC0_AFEM1_AFEM1_ASEM1_CLR0_CADS0_DTLA0_DTLB0_DTVA0_DTVB0_EPS0_FDSI0_GRPM1_GRVWA8_GRVWB2_GSU0_GSUAMB_GSUC0_GSUWGMRR0_GLS0_ISA950_IU1_K1_LDSTI0_LBSPPA2048_LBSPPB128_LBSPPM0_LPA32_LPB16_LPM0_LRVW8_LWPMn1_MIAV0_MIWT2_3_MO40_NTn1_NTA0_NTB1_NTC5_NTD5_NTM0_NEPBS16_NLCA1_NLCB1_ONLL1_PGR2_PLR0_PKA1_SIA3_SS1_SU8_SUM0_SUS64_SPO1_SRVW0_SSO1_SVW2_SK3_SKFTR0_SKXCCM0_TLDS1_ULSGRO0_USL1_UIOFGRO0_USFGRO0_VSn1_VWA2_VWB1_WSGRA0_WSGRB0_WS64_WG64_4_1_WGM1_WGMXCC8_WGMXCCGn1
    SolutionIndex: 83
    SolutionNameMin: Cijk_Ailk_Bljk_HHS_BH_Bias_HA_S_SAV_UserArgs_MT224x256x64_MI16x16x1_CMS_SN_LDSB0_AFC0_AFEM1_AFEM1_ASEM1_CLR0_CADS0_DTLA0_DTLB0_DTVA0_DTVB0_EPS0_FDSI0_GRPM1_GRVWA8_GRVWB8_GSU0_GSUAMB_GSUC0_GSUWGMRR0_GLS0_ISA950_IU1_K1_LDSTI1_LBSPPA3584_LBSPPB1024_LBSPPM0_LPA16_LPB16_LPM0_LRVW8_LWPMn1_MIAV0_MIWT7_8_MO40_NTn1_NTA0_NTB2_NTC0_NTD1_NTM0_NEPBS0_NLCA7_NLCB1_ONLL1_PGR2_PLR1_PKA1_SIA3_SS1_SU0_SUM0_SUS0_SPO0_SRVW0_SSO1_SVW1_SK3_SKFTR0_SKXCCM4_TLDS1_ULSGRO0_USL1_UIOFGRO0_USFGRO0_VSn1_VWA1_VWB8_WSGRA0_WSGRB0_WS64_WG32_8_1_WGM1_WGMXCC8_WGMXCCGn1
    SolutionIndex: 84
    SolutionNameMin: Cijk_Ailk_Bljk_HHS_BH_Bias_HA_S_SAV_UserArgs_MT320x160x64_MI16x16x1_CMS_SN_LDSB0_AFC0_AFEM1_AFEM1_ASEM1_CLR0_CADS0_DTLA0_DTLB0_DTVA0_DTVB0_EPS0_FDSI0_GRPM1_GRVWA8_GRVWB8_GSU0_GSUAMB_GSUC0_GSUWGMRR0_GLS0_ISA950_IU1_K1_LDSTI1_LBSPPA5120_LBSPPB256_LBSPPM0_LPA16_LPB16_LPM0_LRVW8_LWPMn1_MIAV0_MIWT5_10_MO40_NTn1_NTA0_NTB2_NTC4_NTD2_NTM0_NEPBS16_NLCA5_NLCB1_ONLL1_PGR2_PLR1_PKA1_SIA3_SS1_SU8_SUM0_SUS128_SPO0_SRVW0_SSO4_SVW1_SK3_SKFTR0_SKXCCM5_TLDS1_ULSGRO0_USL1_UIOFGRO0_USFGRO0_VSn1_VWA1_VWB2_WSGRA0_WSGRB0_WS64_WG64_4_1_WGM16_WGMXCC16_WGMXCCGn1
    SolutionIndex: 85
    SolutionNameMin: Cijk_Ailk_Bljk_HHS_BH_Bias_HA_S_SAV_UserArgs_MT320x192x32_MI32x32x1_CMS_SN_LDSB0_AFC0_AFEM1_AFEM1_ASEM1_CLR0_CADS0_DTLA0_DTLB0_DTVA0_DTVB0_EPS0_FDSI0_GRPM1_GRVWA8_GRVWB8_GSU0_GSUAMB_GSUC0_GSUWGMRR0_GLS0_ISA950_IU1_K1_LDSTI1_LBSPPA0_LBSPPB128_LBSPPM0_LPA0_LPB8_LPM0_LRVW8_LWPMn1_MIAV0_MIWT5_3_MO40_NTn1_NTA0_NTB1_NTC0_NTD6_NTM0_NEPBS0_NLCA5_NLCB1_ONLL1_PGR2_PLR1_PKA1_SIA3_SS1_SU8_SUM0_SUS64_SPO1_SRVW0_SSO1_SVW1_SK3_SKFTR0_SKXCCM4_TLDS1_ULSGRO0_USL1_UIOFGRO0_USFGRO0_VSn1_VWA1_VWB1_WSGRA0_WSGRB0_WS64_WG64_4_1_WGM1_WGMXCC4_WGMXCCGn1
    SolutionIndex: 86
    SolutionNameMin: Cijk_Ailk_Bljk_HHS_BH_Bias_HA_S_SAV_UserArgs_MT320x192x32_MI32x32x1_CMS_SN_LDSB0_AFC0_AFEM1_AFEM1_ASEM1_CLR0_CADS0_DTLA0_DTLB0_DTVA0_DTVB0_EPS0_FDSI0_GRPM1_GRVWA8_GRVWB8_GSU0_GSUAMB_GSUC0_GSUWGMRR0_GLS0_ISA950_IU1_K1_LDSTI1_LBSPPA0_LBSPPB128_LBSPPM0_LPA0_LPB8_LPM0_LRVW8_LWPMn1_MIAV0_MIWT5_3_MO40_NTn1_NTA1_NTB1_NTC0_NTD7_NTM0_NEPBS0_NLCA5_NLCB1_ONLL1_PGR2_PLR1_PKA1_SIA3_SS1_SU16_SUM0_SUS256_SPO1_SRVW0_SSO1_SVW1_SK3_SKFTR0_SKXCCM8_TLDS1_ULSGRO0_USL1_UIOFGRO0_USFGRO1_VSn1_VWA1_VWB1_WSGRA0_WSGRB0_WS64_WG64_4_1_WGM32_WGMXCC16_WGMXCCGn1
    SolutionIndex: 87
    SolutionNameMin: Cijk_Ailk_Bljk_HHS_BH_Bias_HA_S_SAV_UserArgs_MT224x192x32_MI16x16x1_CMS_SN_LDSB0_AFC0_AFEM1_AFEM1_ASEM1_CLR0_CADS0_DTLA0_DTLB1_DTVA0_DTVB0_EPS0_FDSI0_GRPM1_GRVWA4_GRVWB8_GSU0_GSUAMB_GSUC0_GSUWGMRR0_GLS0_ISA950_IU1_K1_LDSTI0_LBSPPA128_LBSPPB1024_LBSPPM0_LPA16_LPB16_LPM0_LRVW8_LWPMn1_MIAV0_MIWT7_6_MO40_NTn1_NTA0_NTB1_NTC1_NTD0_NTM0_NEPBS0_NLCA7_NLCB1_ONLL1_PGR2_PLR0_PKA1_SIA3_SS1_SU16_SUM0_SUS128_SPO0_SRVW0_SSO1_SVW1_SK3_SKFTR0_SKXCCM4_TLDS2_ULSGRO0_USL1_UIOFGRO0_USFGRO1_VSn1_VWA1_VWB2_WSGRA0_WSGRB0_WS64_WG32_8_1_WGM1_WGMXCC1_WGMXCCGn1
    SolutionIndex: 88
    SolutionNameMin: Cijk_Ailk_Bljk_HHS_BH_Bias_HA_S_SAV_UserArgs_MT128x48x128_MI16x16x1_CMS_SN_LDSB0_AFC0_AFEM1_AFEM1_ASEM1_CLR0_CADS0_DTLA0_DTLB0_DTVA0_DTVB0_EPS0_FDSI0_GRPM1_GRVWA8_GRVWB8_GSU0_GSUAMB_GSUC0_GSUWGMRR0_GLS0_ISA950_IU1_K1_LDSTI1_LBSPPA2048_LBSPPB256_LBSPPM0_LPA16_LPB16_LPM0_LRVW8_LWPMn1_MIAV0_MIWT2_3_MO40_NTn1_NTA0_NTB5_NTC1_NTD5_NTM0_NEPBS0_NLCA1_NLCB1_ONLL1_PGR2_PLR1_PKA1_SIA3_SS1_SU8_SUM0_SUS256_SPO0_SRVW0_SSO1_SVW1_SK3_SKFTR0_SKXCCM4_TLDS1_ULSGRO0_USL1_UIOFGRO0_USFGROn1_VSn1_VWA1_VWB1_WSGRA0_WSGRB0_WS64_WG64_4_1_WGM1_WGMXCC32_WGMXCCGn1
    SolutionIndex: 89
    SolutionNameMin: Cijk_Ailk_Bljk_HHS_BH_Bias_HA_S_SAV_UserArgs_MT256x128x32_MI32x32x1_CMS_SN_LDSB1_AFC0_AFEM1_AFEM1_ASEM1_CLR1_CADS0_DTLA0_DTLB0_DTVA0_DTVB0_EPS0_FDSI0_GRPM1_GRVWA8_GRVWB8_GSU0_GSUAMB_GSUC0_GSUWGMRR0_GLS0_ISA950_IU1_K1_LDSTI0_LBSPPA0_LBSPPB256_LBSPPM0_LPA0_LPB8_LPM0_LRVW8_LWPMn1_MIAV0_MIWT2_4_MO40_NTn1_NTA2_NTB1_NTC5_NTD7_NTM0_NEPBS0_NLCA1_NLCB1_ONLL1_PGR2_PLR1_PKA1_SIA3_SS1_SU0_SUM0_SUS0_SPO1_SRVW0_SSO1_SVW2_SK3_SKFTR0_SKXCCM0_TLDS1_ULSGRO0_USL1_UIOFGRO0_USFGRO0_VSn1_VWA2_VWB4_WSGRA0_WSGRB0_WS64_WG128_2_1_WGM1_WGMXCC8_WGMXCCGn1
    SolutionIndex: 90
    SolutionNameMin: Cijk_Ailk_Bljk_HHS_BH_Bias_HA_S_SAV_UserArgs_MT96x320x32_MI16x16x1_SN_LDSB0_AFC0_AFEM1_AFEM1_ASEM1_CLR0_CADS0_DTLA0_DTLB1_DTVA0_DTVB0_EPS0_FDSI0_GRPM1_GRVWA2_GRVWB8_GSU0_GSUAMB_GSUC0_GSUWGMRR0_GLS0_ISA950_IU1_K1_LDSTI0_LBSPPA128_LBSPPB1024_LBSPPM0_LPA16_LPB16_LPM0_LRVW8_LWPMn1_MIAV0_MIWT6_5_MO40_NTn1_NTA3_NTB2_NTC0_NTD0_NTM0_NEPBS0_NLCA3_NLCB1_ONLL1_PGR2_PLR0_PKA1_SIA3_SS1_SU8_SUM0_SUS256_SPO1_SRVW0_SSO0_SVW2_SK3_SKFTR0_SKXCCM0_TLDS2_ULSGRO0_USL1_UIOFGRO0_USFGRO1_VSn1_VWA2_VWB1_WSGRA0_WSGRB0_WS64_WG16_16_1_WGM1_WGMXCC8_WGMXCCGn1
    SolutionIndex: 91
    SolutionNameMin: Cijk_Ailk_Bljk_HHS_BH_Bias_HA_S_SAV_UserArgs_MT96x320x32_MI16x16x1_SN_LDSB0_AFC0_AFEM1_AFEM1_ASEM1_CLR0_CADS0_DTLA0_DTLB0_DTVA0_DTVB0_EPS1_FDSI0_GRPM1_GRVWA2_GRVWB8_GSU0_GSUAMB_GSUC0_GSUWGMRR0_GLS0_ISA950_IU1_K1_LDSTI0_LBSPPA1536_LBSPPB128_LBSPPM0_LPA32_LPB16_LPM0_LRVW8_LWPMn1_MIAV0_MIWT6_5_MO40_NTn1_NTA0_NTB2_NTC0_NTD0_NTM0_NEPBS0_NLCA3_NLCB1_ONLL1_PGR1_PLR0_PKA1_SIA3_SS1_SU0_SUM0_SUS0_SPO0_SRVW0_SSO4_SVW2_SK3_SKFTR0_SKXCCM0_TLDS1_ULSGRO0_USL1_UIOFGRO0_USFGRO0_VSn1_VWA2_VWB1_WSGRA0_WSGRB0_WS64_WG16_16_1_WGM1_WGMXCC8_WGMXCCGn1
    SolutionIndex: 92
    SolutionNameMin: Cijk_Ailk_Bljk_HHS_BH_Bias_HA_S_SAV_UserArgs_MT32x96x64_MI16x16x1_SN_LDSB1_AFC0_AFEM1_AFEM1_ASEM1_CLR1_CADS0_DTLA0_DTLB0_DTVA0_DTVB0_EPS0_FDSI0_GRPM1_GRVWA8_GRVWB8_GSU0_GSUAMB_GSUC0_GSUWGMRR0_GLS0_ISA950_IU1_K1_LDSTI0_LBSPPA512_LBSPPB128_LBSPPM0_LPA32_LPB16_LPM0_LRVW8_LWPMn1_MIAV1_MIWT2_3_MO40_NTn1_NTA6_NTB2_NTC4_NTD7_NTM0_NEPBS14_NLCA1_NLCB1_ONLL1_PGR2_PLR1_PKA1_SIA3_SS0_SU0_SUM0_SUS0_SPO0_SRVW0_SSO0_SVW8_SK3_SKFTR0_SKXCCM0_TLDS1_ULSGRO0_USL1_UIOFGRO0_USFGRO1_VSn1_VWA2_VWB1_WSGRA0_WSGRB0_WS64_WG16_8_1_WGM1_WGMXCC8_WGMXCCGn1
    SolutionIndex: 93
    SolutionNameMin: Cijk_Ailk_Bljk_HHS_BH_Bias_HA_S_SAV_UserArgs_MT48x128x32_MI16x16x1_SN_LDSB0_AFC0_AFEM1_AFEM1_ASEM1_CLR0_CADS0_DTLA0_DTLB0_DTVA0_DTVB0_EPS0_FDSI0_GRPM1_GRVWA2_GRVWB8_GSU0_GSUAMB_GSUC0_GSUWGMRR0_GLS0_ISA950_IU1_K1_LDSTI1_LBSPPA768_LBSPPB2048_LBSPPM0_LPA16_LPB16_LPM0_LRVW8_LWPMn1_MIAV0_MIWT3_2_MO40_NTn1_NTA1_NTB1_NTC1_NTD0_NTM0_NEPBS12_NLCA3_NLCB1_ONLL1_PGR2_PLR1_PKA1_SIA3_SS0_SU0_SUM0_SUS0_SPO0_SRVW0_SSO0_SVW4_SK3_SKFTR0_SKXCCM0_TLDS0_ULSGRO0_USL1_UIOFGRO0_USFGROn1_VSn1_VWA1_VWB1_WSGRA0_WSGRB0_WS64_WG16_16_1_WGM1_WGMXCC1_WGMXCCGn1
    SolutionIndex: 94
    SolutionNameMin: Cijk_Ailk_Bljk_HHS_BH_Bias_HA_S_SAV_UserArgs_MT64x32x128_MI16x16x1_SN_LDSB0_AFC1_AFEM1_AFEM1_ASEM1_CLR0_CADS0_DTLA0_DTLB0_DTVA0_DTVB0_EPS0_FDSI0_GRPM1_GRVWA8_GRVWB8_GSU0_GSUAMB_GSUC0_GSUWGMRR0_GLS0_ISA950_IU1_K1_LDSTI1_LBSPPA1024_LBSPPB512_LBSPPM0_LPA16_LPB16_LPM0_LRVW8_LWPMn1_MIAV0_MIWT1_2_MO40_NTn1_NTA0_NTB0_NTC3_NTD0_NTM0_NEPBS0_NLCA1_NLCB1_ONLL1_PGR2_PLR1_PKA1_SIA3_SS1_SU8_SUM0_SUS256_SPO1_SRVW0_SSO0_SVW1_SK3_SKFTR0_SKXCCM4_TLDS1_ULSGRO0_USL1_UIOFGRO0_USFGROn1_VSn1_VWA1_VWB2_WSGRA0_WSGRB0_WS64_WG64_4_1_WGM1_WGMXCC1_WGMXCCGn1
    SolutionIndex: 95
    SolutionNameMin: Cijk_Ailk_Bljk_HHS_BH_Bias_HA_S_SAV_UserArgs_MT256x128x32_MI16x16x1_SN_LDSB0_AFC1_AFEM1_AFEM1_ASEM1_CLR0_CADS0_DTLA1_DTLB1_DTVA0_DTVB0_EPS1_FDSI0_GRPM1_GRVWA8_GRVWB8_GSU0_GSUAMB_GSUC0_GSUWGMRR0_GLS0_ISA950_IU1_K1_LDSTI0_LBSPPA4096_LBSPPB1024_LBSPPM0_LPA0_LPB16_LPM0_LRVW8_LWPMn1_MIAV0_MIWT8_4_MO40_NTn1_NTA5_NTB1_NTC6_NTD2_NTM0_NEPBS14_NLCA1_NLCB1_ONLL1_PGR1_PLR0_PKA1_SIA3_SS1_SU16_SUM0_SUS256_SPO1_SRVW0_SSO1_SVW8_SK3_SKFTR0_SKXCCM0_TLDS1_ULSGRO0_USL1_UIOFGRO0_USFGROn1_VSn1_VWA8_VWB4_WSGRA0_WSGRB0_WS64_WG32_8_1_WGM1_WGMXCC32_WGMXCCGn1
    SolutionIndex: 96
    SolutionNameMin: Cijk_Ailk_Bljk_HHS_BH_Bias_HA_S_SAV_UserArgs_MT256x128x64_MI16x16x1_SN_LDSB0_AFC1_AFEM1_AFEM1_ASEM1_CLR1_CADS0_DTLA1_DTLB1_DTVA0_DTVB0_EPS0_FDSI0_GRPM1_GRVWA8_GRVWB8_GSU0_GSUAMB_GSUC0_GSUWGMRR0_GLS0_ISA950_IU1_K1_LDSTI0_LBSPPA4096_LBSPPB1024_LBSPPM0_LPA0_LPB16_LPM0_LRVW8_LWPMn1_MIAV0_MIWT8_4_MO40_NTn1_NTA6_NTB3_NTC1_NTD6_NTM0_NEPBS0_NLCA1_NLCB1_ONLL1_PGR2_PLR1_PKA1_SIA3_SS1_SU0_SUM0_SUS0_SPO0_SRVW0_SSO0_SVW8_SK3_SKFTR0_SKXCCM8_TLDS1_ULSGRO0_USL1_UIOFGRO0_USFGRO1_VSn1_VWA8_VWB4_WSGRA0_WSGRB0_WS64_WG32_8_1_WGM0_WGMXCC2_WGMXCCGn1
    SolutionIndex: 97
    SolutionNameMin: Cijk_Ailk_Bljk_HHS_BH_Bias_HA_S_SAV_UserArgs_MT64x32x128_MI16x16x1_SN_LDSB0_AFC1_AFEM1_AFEM1_ASEM1_CLR0_CADS0_DTLA0_DTLB0_DTVA0_DTVB0_EPS0_FDSI0_GRPM1_GRVWA8_GRVWB8_GSU0_GSUAMB_GSUC0_GSUWGMRR0_GLS0_ISA950_IU1_K1_LDSTI1_LBSPPA1024_LBSPPB512_LBSPPM0_LPA16_LPB16_LPM0_LRVW8_LWPMn1_MIAV0_MIWT1_2_MO40_NTn1_NTA2_NTB0_NTC1_NTD4_NTM0_NEPBS10_NLCA1_NLCB1_ONLL1_PGR2_PLR1_PKA1_SIA3_SS1_SU8_SUM0_SUS256_SPO1_SRVW0_SSO1_SVW1_SK3_SKFTR0_SKXCCM4_TLDS1_ULSGRO0_USL1_UIOFGRO0_USFGRO1_VSn1_VWA1_VWB2_WSGRA0_WSGRB0_WS64_WG64_4_1_WGM1_WGMXCC1_WGMXCCGn1
    SolutionIndex: 98
    SolutionNameMin: Cijk_Ailk_Bljk_HHS_BH_Bias_HA_S_SAV_UserArgs_MT192x128x32_MI16x16x1_SN_LDSB1_AFC1_AFEM1_AFEM1_ASEM1_CLR0_CADS0_DTLA0_DTLB0_DTVA0_DTVB0_EPS0_FDSI0_GRPM1_GRVWA8_GRVWB8_GSU0_GSUAMB_GSUC0_GSUWGMRR0_GLS0_ISA950_IU1_K1_LDSTI0_LBSPPA3072_LBSPPB128_LBSPPM0_LPA0_LPB16_LPM0_LRVW8_LWPMn1_MIAV0_MIWT12_2_MO40_NTn1_NTA4_NTB1_NTC4_NTD3_NTM0_NEPBS0_NLCA3_NLCB1_ONLL1_PGR2_PLR0_PKA1_SIA3_SS1_SU16_SUM0_SUS256_SPO1_SRVW0_SSO1_SVW4_SK3_SKFTR0_SKXCCM6_TLDS1_ULSGRO0_USL1_UIOFGRO0_USFGROn1_VSn1_VWA4_VWB2_WSGRA0_WSGRB0_WS64_WG16_16_1_WGM6_WGMXCC2_WGMXCCGn1
    SolutionIndex: 99
    SolutionNameMin: Cijk_Ailk_Bljk_HHS_BH_Bias_HA_S_SAV_UserArgs_MT320x128x32_MI16x16x1_SN_LDSB0_AFC1_AFEM1_AFEM1_ASEM1_CLR0_CADS0_DTLA0_DTLB0_DTVA0_DTVB0_EPS0_FDSI0_GRPM1_GRVWA8_GRVWB8_GSU0_GSUAMB_GSUC0_GSUWGMRR0_GLS0_ISA950_IU1_K1_LDSTI1_LBSPPA5120_LBSPPB512_LBSPPM0_LPA16_LPB16_LPM0_LRVW8_LWPMn1_MIAV0_MIWT5_8_MO40_NTn1_NTA6_NTB3_NTC0_NTD4_NTM0_NEPBS0_NLCA5_NLCB1_ONLL1_PGR2_PLR1_PKA1_SIA3_SS1_SU0_SUM0_SUS0_SPO0_SRVW0_SSO1_SVW1_SK3_SKFTR0_SKXCCM0_TLDS1_ULSGRO0_USL1_UIOFGRO0_USFGRO1_VSn1_VWA1_VWB8_WSGRA0_WSGRB0_WS64_WG64_4_1_WGM0_WGMXCC16_WGMXCCGn1
    SolutionIndex: 100
    SolutionNameMin: Cijk_Ailk_Bljk_HHS_BH_Bias_HA_S_SAV_UserArgs_MT256x256x64_MI16x16x1_SN_LDSB1_AFC1_AFEM1_AFEM1_ASEM1_CLR1_CADS0_DTLA0_DTLB0_DTVA0_DTVB0_EPS0_FDSI0_GRPM1_GRVWA8_GRVWB8_GSU0_GSUAMB_GSUC0_GSUWGMRR0_GLS0_ISA950_IU1_K1_LDSTI0_LBSPPA4096_LBSPPB1024_LBSPPM0_LPA0_LPB16_LPM0_LRVW8_LWPMn1_MIAV0_MIWT8_8_MO40_NTn1_NTA5_NTB0_NTC6_NTD2_NTM0_NEPBS12_NLCA1_NLCB1_ONLL1_PGR2_PLR1_PKA1_SIA3_SS1_SU0_SUM0_SUS0_SPO0_SRVW0_SSO1_SVW8_SK3_SKFTR0_SKXCCM0_TLDS1_ULSGRO0_USL1_UIOFGRO0_USFGROn1_VSn1_VWA8_VWB8_WSGRA0_WSGRB0_WS64_WG32_8_1_WGM1_WGMXCC1_WGMXCCGn1
    SolutionIndex: 101
    SolutionNameMin: Cijk_Ailk_Bljk_HHS_BH_Bias_HA_S_SAV_UserArgs_MT128x256x64_MI16x16x1_SN_LDSB0_AFC1_AFEM1_AFEM1_ASEM1_CLR1_CADS0_DTLA0_DTLB0_DTVA0_DTVB0_EPS0_FDSI0_GRPM1_GRVWA8_GRVWB8_GSU0_GSUAMB_GSUC0_GSUWGMRR0_GLS0_ISA950_IU1_K1_LDSTI0_LBSPPA2048_LBSPPB1024_LBSPPM0_LPA0_LPB16_LPM0_LRVW8_LWPMn1_MIAV0_MIWT4_8_MO40_NTn1_NTA0_NTB2_NTC2_NTD2_NTM0_NEPBS14_NLCA1_NLCB1_ONLL1_PGR2_PLR1_PKA1_SIA3_SS1_SU8_SUM0_SUS256_SPO0_SRVW0_SSO0_SVW4_SK3_SKFTR0_SKXCCM4_TLDS1_ULSGRO0_USL1_UIOFGRO0_USFGRO0_VSn1_VWA4_VWB8_WSGRA0_WSGRB0_WS64_WG32_8_1_WGM0_WGMXCC32_WGMXCCGn1
    SolutionIndex: 102
    SolutionNameMin: Cijk_Ailk_Bljk_HHS_BH_Bias_HA_S_SAV_UserArgs_MT384x128x32_MI32x32x1_SN_LDSB1_AFC1_AFEM1_AFEM1_ASEM1_CLR1_CADS0_DTLA0_DTLB0_DTVA0_DTVB0_EPS0_FDSI0_GRPM1_GRVWA8_GRVWB8_GSU0_GSUAMB_GSUC0_GSUWGMRR0_GLS0_ISA950_IU1_K1_LDSTI0_LBSPPA0_LBSPPB128_LBSPPM0_LPA0_LPB8_LPM0_LRVW8_LWPMn1_MIAV0_MIWT6_2_MO40_NTn1_NTA4_NTB3_NTC4_NTD2_NTM0_NEPBS0_NLCA3_NLCB1_ONLL1_PGR2_PLR1_PKA1_SIA3_SS1_SU0_SUM0_SUS0_SPO1_SRVW0_SSO1_SVW2_SK3_SKFTR0_SKXCCM8_TLDS1_ULSGRO0_USL1_UIOFGRO0_USFGRO1_VSn1_VWA2_VWB2_WSGRA0_WSGRB0_WS64_WG64_4_1_WGM16_WGMXCC32_WGMXCCGn1
    SolutionIndex: 103
    SolutionNameMin: Cijk_Ailk_Bljk_HHS_BH_Bias_HA_S_SAV_UserArgs_MT320x128x32_MI32x32x1_SN_LDSB0_AFC1_AFEM1_AFEM1_ASEM1_CLR0_CADS0_DTLA0_DTLB0_DTVA0_DTVB0_EPS0_FDSI0_GRPM1_GRVWA8_GRVWB8_GSU0_GSUAMB_GSUC0_GSUWGMRR0_GLS0_ISA950_IU1_K1_LDSTI1_LBSPPA0_LBSPPB128_LBSPPM0_LPA0_LPB8_LPM0_LRVW8_LWPMn1_MIAV0_MIWT5_2_MO40_NTn1_NTA0_NTB0_NTC1_NTD6_NTM0_NEPBS0_NLCA5_NLCB1_ONLL1_PGR2_PLR1_PKA1_SIA3_SS1_SU8_SUM0_SUS64_SPO0_SRVW0_SSO1_SVW1_SK3_SKFTR0_SKXCCM4_TLDS1_ULSGRO0_USL1_UIOFGRO0_USFGROn1_VSn1_VWA1_VWB2_WSGRA0_WSGRB0_WS64_WG64_4_1_WGM1_WGMXCC4_WGMXCCGn1
    SolutionIndex: 104
    SolutionNameMin: Cijk_Ailk_Bljk_HHS_BH_Bias_HA_S_SAV_UserArgs_MT512x128x32_MI32x32x1_SN_LDSB0_AFC1_AFEM1_AFEM1_ASEM1_CLR1_CADS0_DTLA0_DTLB0_DTVA0_DTVB0_EPS0_FDSI0_GRPM1_GRVWA8_GRVWB8_GSU0_GSUAMB_GSUC0_GSUWGMRR0_GLS0_ISA950_IU1_K1_LDSTI0_LBSPPA0_LBSPPB256_LBSPPM0_LPA0_LPB8_LPM0_LRVW8_LWPMn1_MIAV0_MIWT4_4_MO40_NTn1_NTA7_NTB0_NTC6_NTD2_NTM0_NEPBS16_NLCA1_NLCB1_ONLL1_PGR2_PLR1_PKA1_SIA3_SS1_SU0_SUM0_SUS0_SPO1_SRVW0_SSO0_SVW4_SK3_SKFTR0_SKXCCM0_TLDS1_ULSGRO0_USL1_UIOFGRO0_USFGRO1_VSn1_VWA4_VWB4_WSGRA0_WSGRB0_WS64_WG128_2_1_WGM1_WGMXCC1_WGMXCCGn1
    SolutionIndex: 105
    SolutionNameMin: Cijk_Ailk_Bljk_HHS_BH_Bias_HA_S_SAV_UserArgs_MT256x128x32_MI32x32x1_SN_LDSB0_AFC1_AFEM1_AFEM1_ASEM1_CLR1_CADS0_DTLA0_DTLB0_DTVA0_DTVB0_EPS0_FDSI0_GRPM1_GRVWA8_GRVWB8_GSU0_GSUAMB_GSUC0_GSUWGMRR0_GLS0_ISA950_IU1_K1_LDSTI0_LBSPPA0_LBSPPB128_LBSPPM0_LPA0_LPB8_LPM0_LRVW8_LWPMn1_MIAV0_MIWT4_2_MO40_NTn1_NTA4_NTB0_NTC4_NTD3_NTM0_NEPBS0_NLCA1_NLCB1_ONLL1_PGR2_PLR1_PKA1_SIA3_SS1_SU0_SUM0_SUS0_SPO1_SRVW0_SSO0_SVW4_SK3_SKFTR0_SKXCCM8_TLDS1_ULSGRO0_USL1_UIOFGRO0_USFGRO1_VSn1_VWA4_VWB2_WSGRA0_WSGRB0_WS64_WG64_4_1_WGM0_WGMXCC8_WGMXCCGn1
    SolutionIndex: 106
    SolutionNameMin: Cijk_Ailk_Bljk_HHS_BH_Bias_HA_S_SAV_UserArgs_MT160x256x32_MI16x16x1_SN_LDSB1_AFC1_AFEM1_AFEM1_ASEM1_CLR0_CADS0_DTLA0_DTLB0_DTVA0_DTVB0_EPS0_FDSI0_GRPM1_GRVWA4_GRVWB8_GSU0_GSUAMB_GSUC0_GSUWGMRR0_GLS0_ISA950_IU1_K1_LDSTI0_LBSPPA128_LBSPPB256_LBSPPM0_LPA16_LPB16_LPM0_LRVW8_LWPMn1_MIAV0_MIWT10_4_MO40_NTn1_NTA0_NTB2_NTC1_NTD2_NTM0_NEPBS0_NLCA5_NLCB1_ONLL1_PGR2_PLR0_PKA1_SIA3_SS1_SU16_SUM0_SUS128_SPO1_SRVW0_SSO1_SVW2_SK3_SKFTR0_SKXCCM5_TLDS2_ULSGRO0_USL1_UIOFGRO0_USFGRO0_VSn1_VWA2_VWB4_WSGRA0_WSGRB0_WS64_WG16_16_1_WGM0_WGMXCC8_WGMXCCGn1
    SolutionIndex: 107
    SolutionNameMin: Cijk_Ailk_Bljk_HHS_BH_Bias_HA_S_SAV_UserArgs_MT160x128x64_MI16x16x1_SN_LDSB0_AFC1_AFEM1_AFEM1_ASEM1_CLR0_CADS0_DTLA0_DTLB0_DTVA0_DTVB0_EPS0_FDSI0_GRPM1_GRVWA8_GRVWB8_GSU0_GSUAMB_GSUC0_GSUWGMRR0_GLS0_ISA950_IU1_K1_LDSTI1_LBSPPA2560_LBSPPB512_LBSPPM0_LPA16_LPB16_LPM0_LRVW8_LWPMn1_MIAV1_MIWT5_4_MO40_NTn1_NTA0_NTB3_NTC2_NTD3_NTM0_NEPBS2_NLCA5_NLCB1_ONLL1_PGR2_PLR1_PKA1_SIA3_SS1_SU0_SUM0_SUS0_SPO0_SRVW0_SSO0_SVW1_SK3_SKFTR0_SKXCCM0_TLDS1_ULSGRO0_USL1_UIOFGRO0_USFGRO1_VSn1_VWA1_VWB4_WSGRA0_WSGRB0_WS64_WG32_8_1_WGM1_WGMXCC1_WGMXCCGn1
    SolutionIndex: 108
    SolutionNameMin: Cijk_Ailk_Bljk_HHS_BH_Bias_HA_S_SAV_UserArgs_MT32x16x64_MI16x16x1_SN_LDSB1_AFC1_AFEM1_AFEM1_ASEM1_CLR0_CADS0_DTLA0_DTLB0_DTVA0_DTVB0_EPS0_FDSI0_GRPM1_GRVWA2_GRVWB8_GSU0_GSUAMB_GSUC0_GSUWGMRR0_GLS0_ISA950_IU1_K1_LDSTI0_LBSPPA512_LBSPPB128_LBSPPM0_LPA32_LPB16_LPM0_LRVW8_LWPMn1_MIAV1_MIWT2_1_MO40_NTn1_NTA3_NTB1_NTC2_NTD3_NTM0_NEPBS14_NLCA1_NLCB1_ONLL1_PGR2_PLR0_PKA1_SIA3_SS1_SU0_SUM0_SUS0_SPO1_SRVW0_SSO0_SVW2_SK3_SKFTR0_SKXCCM0_TLDS1_ULSGRO0_USL1_UIOFGRO0_USFGRO1_VSn1_VWA2_VWB1_WSGRA0_WSGRB0_WS64_WG16_4_2_WGM0_WGMXCC16_WGMXCCGn1
    SolutionIndex: 109
    SolutionNameMin: Cijk_Ailk_Bljk_HHS_BH_Bias_HA_S_SAV_UserArgs_MT192x256x64_MI32x32x1_SN_LDSB0_AFC1_AFEM1_AFEM1_ASEM1_CLR0_CADS0_DTLA0_DTLB0_DTVA0_DTVB0_EPS0_FDSI0_GRPM1_GRVWA8_GRVWB8_GSU0_GSUAMB_GSUC0_GSUWGMRR0_GLS0_ISA950_IU1_K1_LDSTI1_LBSPPA0_LBSPPB512_LBSPPM0_LPA0_LPB8_LPM0_LRVW8_LWPMn1_MIAV0_MIWT3_4_MO40_NTn1_NTA5_NTB1_NTC0_NTD7_NTM0_NEPBS0_NLCA3_NLCB1_ONLL1_PGR2_PLR1_PKA1_SIA3_SS1_SU0_SUM0_SUS0_SPO1_SRVW0_SSO1_SVW1_SK3_SKFTR0_SKXCCM8_TLDS1_ULSGRO0_USL1_UIOFGRO0_USFGRO0_VSn1_VWA1_VWB4_WSGRA0_WSGRB0_WS64_WG64_4_1_WGM16_WGMXCC16_WGMXCCGn1
    SolutionIndex: 110
    SolutionNameMin: Cijk_Ailk_Bljk_HHS_BH_Bias_HA_S_SAV_UserArgs_MT16x16x64_MI16x16x1_SN_LDSB0_AFC1_AFEM1_AFEM1_ASEM1_CLR0_CADS0_DTLA0_DTLB0_DTVA0_DTVB0_EPS0_FDSI0_GRPM1_GRVWA1_GRVWB8_GSU0_GSUAMB_GSUC0_GSUWGMRR0_GLS0_ISA950_IU1_K1_LDSTI1_LBSPPA256_LBSPPB128_LBSPPM0_LPA16_LPB16_LPM0_LRVW8_LWPMn1_MIAV1_MIWT1_1_MO40_NTn1_NTA2_NTB3_NTC2_NTD1_NTM0_NEPBS8_NLCA1_NLCB1_ONLL1_PGR2_PLR1_PKA1_SIA3_SS1_SU0_SUM0_SUS0_SPO1_SRVW0_SSO0_SVW1_SK3_SKFTR0_SKXCCM0_TLDS1_ULSGRO0_USL1_UIOFGRO0_USFGROn1_VSn1_VWA1_VWB1_WSGRA0_WSGRB0_WS64_WG16_4_2_WGM1_WGMXCC8_WGMXCCGn1
    SolutionIndex: 111
    SolutionNameMin: Cijk_Ailk_Bljk_HHS_BH_Bias_HA_S_SAV_UserArgs_MT512x128x32_MI32x32x1_SN_LDSB0_AFC1_AFEM1_AFEM1_ASEM1_CLR1_CADS0_DTLA0_DTLB0_DTVA0_DTVB0_EPS0_FDSI0_GRPM1_GRVWA8_GRVWB8_GSU0_GSUAMB_GSUC0_GSUWGMRR0_GLS0_ISA950_IU1_K1_LDSTI0_LBSPPA0_LBSPPB256_LBSPPM0_LPA0_LPB8_LPM0_LRVW8_LWPMn1_MIAV0_MIWT4_4_MO40_NTn1_NTA7_NTB0_NTC5_NTD3_NTM0_NEPBS0_NLCA1_NLCB1_ONLL1_PGR2_PLR1_PKA1_SIA3_SS1_SU8_SUM0_SUS256_SPO1_SRVW0_SSO1_SVW4_SK3_SKFTR0_SKXCCM4_TLDS1_ULSGRO0_USL1_UIOFGRO0_USFGRO0_VSn1_VWA4_VWB4_WSGRA0_WSGRB0_WS64_WG128_2_1_WGM0_WGMXCC1_WGMXCCGn1
    SolutionIndex: 112
    SolutionNameMin: Cijk_Ailk_Bljk_HHS_BH_Bias_HA_S_SAV_UserArgs_MT512x128x32_MI32x32x1_SN_LDSB1_AFC1_AFEM1_AFEM1_ASEM1_CLR1_CADS0_DTLA0_DTLB0_DTVA0_DTVB0_EPS0_FDSI0_GRPM1_GRVWA8_GRVWB8_GSU0_GSUAMB_GSUC0_GSUWGMRR0_GLS0_ISA950_IU1_K1_LDSTI0_LBSPPA0_LBSPPB256_LBSPPM0_LPA0_LPB8_LPM0_LRVW8_LWPMn1_MIAV0_MIWT4_4_MO40_NTn1_NTA7_NTB2_NTC7_NTD3_NTM0_NEPBS0_NLCA1_NLCB1_ONLL1_PGR2_PLR1_PKA1_SIA3_SS1_SU8_SUM0_SUS128_SPO1_SRVW0_SSO1_SVW4_SK3_SKFTR0_SKXCCM7_TLDS1_ULSGRO0_USL1_UIOFGRO0_USFGROn1_VSn1_VWA4_VWB4_WSGRA0_WSGRB0_WS64_WG128_2_1_WGM0_WGMXCC32_WGMXCCGn1
    SolutionIndex: 113
    SolutionNameMin: Cijk_Ailk_Bljk_HHS_BH_Bias_HA_S_SAV_UserArgs_MT256x256x64_MI16x16x1_CMS_SN_LDSB0_AFC1_AFEM1_AFEM1_ASEM1_CLR1_CADS0_DTLA1_DTLB1_DTVA0_DTVB0_EPS0_FDSI0_GRPM1_GRVWA8_GRVWB8_GSU0_GSUAMB_GSUC0_GSUWGMRR0_GLS0_ISA950_IU1_K1_LDSTI0_LBSPPA4096_LBSPPB1024_LBSPPM0_LPA0_LPB16_LPM0_LRVW8_LWPMn1_MIAV0_MIWT8_8_MO40_NTn1_NTA5_NTB1_NTC4_NTD3_NTM0_NEPBS0_NLCA1_NLCB1_ONLL1_PGR2_PLR1_PKA1_SIA3_SS1_SU0_SUM0_SUS0_SPO1_SRVW0_SSO1_SVW8_SK3_SKFTR0_SKXCCM5_TLDS1_ULSGRO0_USL1_UIOFGRO0_USFGROn1_VSn1_VWA8_VWB8_WSGRA0_WSGRB0_WS64_WG32_8_1_WGM0_WGMXCC1_WGMXCCGn1
    SolutionIndex: 114
    SolutionNameMin: Cijk_Ailk_Bljk_HHS_BH_Bias_HA_S_SAV_UserArgs_MT256x128x64_MI16x16x1_SN_LDSB0_AFC1_AFEM1_AFEM1_ASEM1_CLR1_CADS0_DTLA1_DTLB1_DTVA0_DTVB0_EPS0_FDSI0_GRPM1_GRVWA8_GRVWB8_GSU0_GSUAMB_GSUC0_GSUWGMRR0_GLS0_ISA950_IU1_K1_LDSTI0_LBSPPA4096_LBSPPB1024_LBSPPM0_LPA0_LPB16_LPM0_LRVW8_LWPMn1_MIAV0_MIWT8_4_MO40_NTn1_NTA4_NTB2_NTC6_NTD2_NTM0_NEPBS0_NLCA1_NLCB1_ONLL1_PGR2_PLR1_PKA1_SIA3_SS1_SU0_SUM0_SUS0_SPO1_SRVW0_SSO1_SVW8_SK3_SKFTR0_SKXCCM4_TLDS1_ULSGRO0_USL1_UIOFGRO0_USFGRO1_VSn1_VWA8_VWB4_WSGRA0_WSGRB0_WS64_WG32_8_1_WGM0_WGMXCC16_WGMXCCGn1
    SolutionIndex: 115
    SolutionNameMin: Cijk_Ailk_Bljk_HHS_BH_Bias_HA_S_SAV_UserArgs_MT64x96x128_MI16x16x1_SN_LDSB0_AFC1_AFEM1_AFEM1_ASEM1_CLR0_CADS0_DTLA0_DTLB0_DTVA0_DTVB0_EPS0_FDSI0_GRPM1_GRVWA8_GRVWB8_GSU0_GSUAMB_GSUC0_GSUWGMRR0_GLS0_ISA950_IU1_K1_LDSTI1_LBSPPA1024_LBSPPB256_LBSPPM0_LPA16_LPB16_LPM0_LRVW8_LWPMn1_MIAV0_MIWT2_3_MO40_NTn1_NTA0_NTB0_NTC0_NTD4_NTM0_NEPBS0_NLCA1_NLCB1_ONLL1_PGR2_PLR1_PKA1_SIA3_SS1_SU8_SUM0_SUS256_SPO0_SRVW0_SSO1_SVW1_SK3_SKFTR0_SKXCCM0_TLDS1_ULSGRO0_USL1_UIOFGRO0_USFGROn1_VSn1_VWA1_VWB1_WSGRA0_WSGRB0_WS64_WG32_8_1_WGM0_WGMXCC1_WGMXCCGn1
    SolutionIndex: 116
    SolutionNameMin: Cijk_Ailk_Bljk_HHS_BH_Bias_HA_S_SAV_UserArgs_MT128x256x64_MI16x16x1_SN_LDSB0_AFC1_AFEM1_AFEM1_ASEM1_CLR0_CADS0_DTLA0_DTLB0_DTVA0_DTVB0_EPS0_FDSI0_GRPM1_GRVWA8_GRVWB8_GSU0_GSUAMB_GSUC0_GSUWGMRR0_GLS0_ISA950_IU1_K1_LDSTI1_LBSPPA2048_LBSPPB1024_LBSPPM0_LPA16_LPB16_LPM0_LRVW8_LWPMn1_MIAV0_MIWT2_16_MO40_NTn1_NTA3_NTB3_NTC7_NTD3_NTM0_NEPBS16_NLCA1_NLCB1_ONLL1_PGR2_PLR1_PKA1_SIA3_SS1_SU16_SUM0_SUS128_SPO1_SRVW0_SSO1_SVW1_SK3_SKFTR0_SKXCCM0_TLDS1_ULSGRO0_USL1_UIOFGRO0_USFGRO1_VSn1_VWA1_VWB8_WSGRA0_WSGRB0_WS64_WG64_4_1_WGM32_WGMXCC1_WGMXCCGn1
    SolutionIndex: 117
    SolutionNameMin: Cijk_Ailk_Bljk_HHS_BH_Bias_HA_S_SAV_UserArgs_MT64x64x128_MI32x32x1_SN_LDSB0_AFC1_AFEM1_AFEM1_ASEM1_CLR0_CADS0_DTLA0_DTLB0_DTVA0_DTVB0_EPS0_FDSI0_GRPM1_GRVWA8_GRVWB8_GSU0_GSUAMB_GSUC0_GSUWGMRR0_GLS0_ISA950_IU1_K1_LDSTI1_LBSPPA0_LBSPPB256_LBSPPM0_LPA0_LPB8_LPM0_LRVW8_LWPMn1_MIAV0_MIWT1_1_MO40_NTn1_NTA3_NTB3_NTC0_NTD4_NTM0_NEPBS0_NLCA1_NLCB1_ONLL1_PGR2_PLR1_PKA1_SIA3_SS1_SU8_SUM0_SUS256_SPO1_SRVW0_SSO1_SVW1_SK3_SKFTR0_SKXCCM0_TLDS1_ULSGRO0_USL1_UIOFGRO0_USFGRO0_VSn1_VWA1_VWB1_WSGRA0_WSGRB0_WS64_WG64_4_1_WGM0_WGMXCC2_WGMXCCGn1
    SolutionIndex: 118
    SolutionNameMin: Cijk_Ailk_Bljk_HHS_BH_Bias_HA_S_SAV_UserArgs_MT64x64x128_MI32x32x1_SN_LDSB0_AFC1_AFEM1_AFEM1_ASEM1_CLR0_CADS0_DTLA0_DTLB0_DTVA0_DTVB0_EPS0_FDSI0_GRPM1_GRVWA8_GRVWB8_GSU0_GSUAMB_GSUC0_GSUWGMRR0_GLS0_ISA950_IU1_K1_LDSTI1_LBSPPA0_LBSPPB256_LBSPPM0_LPA0_LPB8_LPM0_LRVW8_LWPMn1_MIAV0_MIWT1_1_MO40_NTn1_NTA3_NTB0_NTC0_NTD5_NTM0_NEPBS16_NLCA1_NLCB1_ONLL1_PGR2_PLR1_PKA1_SIA3_SS1_SU8_SUM0_SUS256_SPO1_SRVW0_SSO0_SVW1_SK3_SKFTR0_SKXCCM4_TLDS1_ULSGRO0_USL1_UIOFGRO0_USFGROn1_VSn1_VWA1_VWB1_WSGRA0_WSGRB0_WS64_WG64_4_1_WGM24_WGMXCC1_WGMXCCGn1
    SolutionIndex: 119
    SolutionNameMin: Cijk_Ailk_Bljk_HHS_BH_Bias_HA_S_SAV_UserArgs_MT128x64x64_MI16x16x1_SN_LDSB0_AFC1_AFEM1_AFEM1_ASEM1_CLR1_CADS0_DTLA0_DTLB0_DTVA0_DTVB0_EPS0_FDSI0_GRPM1_GRVWA8_GRVWB8_GSU0_GSUAMB_GSUC0_GSUWGMRR0_GLS0_ISA950_IU1_K1_LDSTI0_LBSPPA2048_LBSPPB256_LBSPPM0_LPA0_LPB16_LPM0_LRVW8_LWPMn1_MIAV0_MIWT4_2_MO40_NTn1_NTA0_NTB1_NTC7_NTD5_NTM0_NEPBS0_NLCA1_NLCB1_ONLL1_PGR2_PLR1_PKA1_SIA3_SS1_SU8_SUM0_SUS128_SPO0_SRVW0_SSO0_SVW4_SK3_SKFTR0_SKXCCM0_TLDS1_ULSGRO0_USL1_UIOFGRO0_USFGRO1_VSn1_VWA4_VWB2_WSGRA0_WSGRB0_WS64_WG32_8_1_WGM0_WGMXCC1_WGMXCCGn1
    SolutionIndex: 120
    SolutionNameMin: Cijk_Ailk_Bljk_HHS_BH_Bias_HA_S_SAV_UserArgs_MT192x128x64_MI16x16x1_SN_LDSB0_AFC1_AFEM1_AFEM1_ASEM1_CLR0_CADS0_DTLA0_DTLB0_DTVA0_DTVB0_EPS0_FDSI0_GRPM1_GRVWA8_GRVWB8_GSU0_GSUAMB_GSUC0_GSUWGMRR0_GLS0_ISA950_IU1_K1_LDSTI1_LBSPPA3072_LBSPPB1024_LBSPPM0_LPA16_LPB16_LPM0_LRVW8_LWPMn1_MIAV0_MIWT3_8_MO40_NTn1_NTA0_NTB1_NTC5_NTD2_NTM0_NEPBS2_NLCA3_NLCB1_ONLL1_PGR2_PLR1_PKA1_SIA3_SS1_SU8_SUM0_SUS256_SPO0_SRVW0_SSO1_SVW1_SK3_SKFTR0_SKXCCM0_TLDS1_ULSGRO0_USL1_UIOFGRO0_USFGROn1_VSn1_VWA1_VWB8_WSGRA0_WSGRB0_WS64_WG64_4_1_WGM0_WGMXCC1_WGMXCCGn1
    SolutionIndex: 121
    SolutionNameMin: Cijk_Ailk_Bljk_HHS_BH_Bias_HA_S_SAV_UserArgs_MT256x256x32_MI32x32x1_SN_LDSB0_AFC1_AFEM1_AFEM1_ASEM1_CLR1_CADS0_DTLA1_DTLB1_DTVA0_DTVB0_EPS0_FDSI0_GRPM1_GRVWA8_GRVWB8_GSU0_GSUAMB_GSUC0_GSUWGMRR0_GLS0_ISA950_IU1_K1_LDSTI0_LBSPPA0_LBSPPB1024_LBSPPM0_LPA0_LPB8_LPM0_LRVW8_LWPMn1_MIAV0_MIWT4_4_MO40_NTn1_NTA7_NTB3_NTC5_NTD3_NTM0_NEPBS16_NLCA1_NLCB1_ONLL1_PGR2_PLR1_PKA1_SIA3_SS1_SU0_SUM0_SUS0_SPO0_SRVW0_SSO1_SVW4_SK3_SKFTR0_SKXCCM0_TLDS1_ULSGRO0_USL1_UIOFGRO0_USFGRO0_VSn1_VWA4_VWB4_WSGRA0_WSGRB0_WS64_WG64_4_1_WGM1_WGMXCC2_WGMXCCGn1
    SolutionIndex: 122
    SolutionNameMin: Cijk_Ailk_Bljk_HHS_BH_Bias_HA_S_SAV_UserArgs_MT384x128x32_MI32x32x1_SN_LDSB0_AFC1_AFEM1_AFEM1_ASEM1_CLR1_CADS0_DTLA0_DTLB0_DTVA0_DTVB0_EPS0_FDSI0_GRPM1_GRVWA8_GRVWB8_GSU0_GSUAMB_GSUC0_GSUWGMRR0_GLS0_ISA950_IU1_K1_LDSTI0_LBSPPA0_LBSPPB128_LBSPPM0_LPA0_LPB8_LPM0_LRVW8_LWPMn1_MIAV0_MIWT6_2_MO40_NTn1_NTA6_NTB2_NTC6_NTD2_NTM0_NEPBS0_NLCA3_NLCB1_ONLL1_PGR2_PLR1_PKA1_SIA3_SS1_SU0_SUM0_SUS0_SPO1_SRVW0_SSO1_SVW2_SK3_SKFTR0_SKXCCM8_TLDS1_ULSGRO0_USL1_UIOFGRO0_USFGRO1_VSn1_VWA2_VWB2_WSGRA0_WSGRB0_WS64_WG64_4_1_WGM0_WGMXCC2_WGMXCCGn1
    SolutionIndex: 123
    SolutionNameMin: Cijk_Ailk_Bljk_HHS_BH_Bias_HA_S_SAV_UserArgs_MT112x128x64_MI16x16x1_SN_LDSB0_AFC1_AFEM1_AFEM1_ASEM1_CLR0_CADS0_DTLA0_DTLB0_DTVA0_DTVB0_EPS0_FDSI0_GRPM1_GRVWA2_GRVWB8_GSU0_GSUAMB_GSUC0_GSUWGMRR0_GLS0_ISA950_IU1_K1_LDSTI1_LBSPPA1792_LBSPPB256_LBSPPM0_LPA16_LPB16_LPM0_LRVW8_LWPMn1_MIAV0_MIWT7_2_MO40_NTn1_NTA1_NTB2_NTC2_NTD2_NTM0_NEPBS2_NLCA7_NLCB1_ONLL1_PGR2_PLR1_PKA1_SIA3_SS1_SU16_SUM0_SUS128_SPO1_SRVW0_SSO0_SVW1_SK3_SKFTR0_SKXCCM4_TLDS1_ULSGRO0_USL1_UIOFGRO0_USFGROn1_VSn1_VWA1_VWB2_WSGRA0_WSGRB0_WS64_WG16_16_1_WGM0_WGMXCC32_WGMXCCGn1
    SolutionIndex: 124
    SolutionNameMin: Cijk_Ailk_Bljk_HHS_BH_Bias_HA_S_SAV_UserArgs_MT512x128x32_MI16x16x1_SN_LDSB0_AFC1_AFEM1_AFEM1_ASEM1_CLR0_CADS0_DTLA1_DTLB1_DTVA0_DTVB0_EPS0_FDSI0_GRPM1_GRVWA8_GRVWB8_GSU0_GSUAMB_GSUC0_GSUWGMRR0_GLS0_ISA950_IU1_K1_LDSTI0_LBSPPA8192_LBSPPB1024_LBSPPM0_LPA0_LPB16_LPM0_LRVW8_LWPMn1_MIAV0_MIWT8_8_MO40_NTn1_NTA5_NTB2_NTC1_NTD7_NTM0_NEPBS0_NLCA1_NLCB1_ONLL1_PGR2_PLR0_PKA1_SIA3_SS1_SU0_SUM0_SUS0_SPO1_SRVW0_SSO1_SVW8_SK3_SKFTR0_SKXCCM4_TLDS1_ULSGRO0_USL1_UIOFGRO0_USFGRO1_VSn1_VWA8_VWB8_WSGRA0_WSGRB0_WS64_WG64_4_1_WGM4_WGMXCC32_WGMXCCGn1
    SolutionIndex: 125
    SolutionNameMin: Cijk_Ailk_Bljk_HHS_BH_Bias_HA_S_SAV_UserArgs_MT192x256x64_MI16x16x1_SN_LDSB0_AFC1_AFEM1_AFEM1_ASEM1_CLR1_CADS0_DTLA0_DTLB0_DTVA0_DTVB0_EPS0_FDSI0_GRPM1_GRVWA8_GRVWB8_GSU0_GSUAMB_GSUC0_GSUWGMRR0_GLS0_ISA950_IU1_K1_LDSTI0_LBSPPA3072_LBSPPB512_LBSPPM0_LPA0_LPB16_LPM0_LRVW8_LWPMn1_MIAV0_MIWT12_4_MO40_NTn1_NTA4_NTB3_NTC6_NTD3_NTM0_NEPBS0_NLCA3_NLCB1_ONLL1_PGR2_PLR1_PKA1_SIA3_SS1_SU16_SUM0_SUS256_SPO1_SRVW0_SSO4_SVW4_SK3_SKFTR0_SKXCCM8_TLDS1_ULSGRO0_USL1_UIOFGRO0_USFGRO1_VSn1_VWA4_VWB4_WSGRA0_WSGRB0_WS64_WG16_16_1_WGM1_WGMXCC1_WGMXCCGn1
    SolutionIndex: 126
    SolutionNameMin: Cijk_Ailk_Bljk_HHS_BH_Bias_HA_S_SAV_UserArgs_MT192x128x64_MI16x16x1_SN_LDSB0_AFC1_AFEM1_AFEM1_ASEM1_CLR0_CADS0_DTLA0_DTLB0_DTVA0_DTVB0_EPS0_FDSI0_GRPM1_GRVWA8_GRVWB8_GSU0_GSUAMB_GSUC0_GSUWGMRR0_GLS0_ISA950_IU1_K1_LDSTI1_LBSPPA3072_LBSPPB1024_LBSPPM0_LPA16_LPB16_LPM0_LRVW8_LWPMn1_MIAV0_MIWT3_8_MO40_NTn1_NTA3_NTB2_NTC7_NTD2_NTM0_NEPBS8_NLCA3_NLCB1_ONLL1_PGR2_PLR1_PKA1_SIA3_SS1_SU8_SUM0_SUS128_SPO1_SRVW0_SSO0_SVW1_SK3_SKFTR0_SKXCCM4_TLDS1_ULSGRO0_USL1_UIOFGRO0_USFGROn1_VSn1_VWA1_VWB8_WSGRA0_WSGRB0_WS64_WG64_4_1_WGM1_WGMXCC32_WGMXCCGn1
    SolutionIndex: 127
    SolutionNameMin: Cijk_Ailk_Bljk_HHS_BH_Bias_HA_S_SAV_UserArgs_MT16x16x64_MI16x16x1_SN_LDSB1_AFC1_AFEM1_AFEM1_ASEM1_CLR0_CADS0_DTLA0_DTLB0_DTVA0_DTVB0_EPS0_FDSI0_GRPM1_GRVWA1_GRVWB8_GSU0_GSUAMB_GSUC0_GSUWGMRR0_GLS0_ISA950_IU1_K1_LDSTI0_LBSPPA128_LBSPPB128_LBSPPM0_LPA16_LPB16_LPM0_LRVW8_LWPMn1_MIAV1_MIWT1_1_MO40_NTn1_NTA3_NTB2_NTC0_NTD1_NTM0_NEPBS10_NLCA1_NLCB1_ONLL1_PGR2_PLR0_PKA1_SIA3_SS1_SU0_SUM0_SUS0_SPO0_SRVW0_SSO0_SVW1_SK3_SKFTR0_SKXCCM0_TLDS2_ULSGRO0_USL1_UIOFGRO0_USFGROn1_VSn1_VWA1_VWB1_WSGRA0_WSGRB0_WS64_WG16_4_2_WGM1_WGMXCC8_WGMXCCGn1
    SolutionIndex: 128
    SolutionNameMin: Cijk_Ailk_Bljk_HHS_BH_Bias_HA_S_SAV_UserArgs_MT32x32x128_MI16x16x1_SN_LDSB0_AFC1_AFEM1_AFEM1_ASEM1_CLR0_CADS0_DTLA0_DTLB0_DTVA0_DTVB0_EPS0_FDSI0_GRPM1_GRVWA8_GRVWB8_GSU0_GSUAMB_GSUC0_GSUWGMRR0_GLS0_ISA950_IU1_K1_LDSTI1_LBSPPA512_LBSPPB256_LBSPPM0_LPA16_LPB16_LPM0_LRVW8_LWPMn1_MIAV0_MIWT1_1_MO40_NTn1_NTA1_NTB0_NTC2_NTD1_NTM0_NEPBS0_NLCA1_NLCB1_ONLL1_PGR2_PLR1_PKA1_SIA3_SS1_SU8_SUM0_SUS256_SPO1_SRVW0_SSO0_SVW1_SK3_SKFTR0_SKXCCM8_TLDS1_ULSGRO0_USL1_UIOFGRO0_USFGRO0_VSn1_VWA1_VWB1_WSGRA0_WSGRB0_WS64_WG32_8_1_WGM1_WGMXCC4_WGMXCCGn1
    SolutionIndex: 129
    SolutionNameMin: Cijk_Ailk_Bljk_HHS_BH_Bias_HA_S_SAV_UserArgs_MT128x256x64_MI32x32x1_SN_LDSB0_AFC1_AFEM1_AFEM1_ASEM1_CLR1_CADS0_DTLA0_DTLB0_DTVA0_DTVB0_EPS0_FDSI0_GRPM1_GRVWA8_GRVWB8_GSU0_GSUAMB_GSUC0_GSUWGMRR0_GLS0_ISA950_IU1_K1_LDSTI0_LBSPPA0_LBSPPB256_LBSPPM0_LPA0_LPB8_LPM0_LRVW8_LWPMn1_MIAV0_MIWT4_2_MO40_NTn1_NTA7_NTB1_NTC1_NTD7_NTM0_NEPBS16_NLCA1_NLCB1_ONLL1_PGR2_PLR1_PKA1_SIA3_SS1_SU8_SUM0_SUS256_SPO0_SRVW0_SSO0_SVW4_SK3_SKFTR0_SKXCCM0_TLDS1_ULSGRO0_USL1_UIOFGRO0_USFGRO1_VSn1_VWA4_VWB2_WSGRA0_WSGRB0_WS64_WG32_8_1_WGM0_WGMXCC4_WGMXCCGn1
    SolutionIndex: 130
    SolutionNameMin: Cijk_Ailk_Bljk_HHS_BH_Bias_HA_S_SAV_UserArgs_MT192x256x32_MI32x32x1_SN_LDSB0_AFC1_AFEM1_AFEM1_ASEM1_CLR1_CADS0_DTLA0_DTLB0_DTVA0_DTVB0_EPS0_FDSI0_GRPM1_GRVWA8_GRVWB8_GSU0_GSUAMB_GSUC0_GSUWGMRR0_GLS0_ISA950_IU1_K1_LDSTI0_LBSPPA0_LBSPPB128_LBSPPM0_LPA0_LPB8_LPM0_LRVW8_LWPMn1_MIAV0_MIWT6_2_MO40_NTn1_NTA5_NTB1_NTC5_NTD2_NTM0_NEPBS0_NLCA3_NLCB1_ONLL1_PGR2_PLR1_PKA1_SIA3_SS1_SU16_SUM0_SUS64_SPO1_SRVW0_SSO1_SVW2_SK3_SKFTR0_SKXCCM0_TLDS1_ULSGRO0_USL1_UIOFGRO0_USFGROn1_VSn1_VWA2_VWB2_WSGRA0_WSGRB0_WS64_WG32_8_1_WGM1_WGMXCC2_WGMXCCGn1
    SolutionIndex: 131
    SolutionNameMin: Cijk_Ailk_Bljk_HHS_BH_Bias_HA_S_SAV_UserArgs_MT64x32x128_MI16x16x1_SN_LDSB0_AFC1_AFEM1_AFEM1_ASEM1_CLR0_CADS0_DTLA0_DTLB0_DTVA0_DTVB0_EPS0_FDSI0_GRPM1_GRVWA8_GRVWB8_GSU0_GSUAMB_GSUC0_GSUWGMRR0_GLS0_ISA950_IU1_K1_LDSTI1_LBSPPA1024_LBSPPB256_LBSPPM0_LPA16_LPB16_LPM0_LRVW8_LWPMn1_MIAV0_MIWT2_1_MO40_NTn1_NTA1_NTB0_NTC0_NTD1_NTM0_NEPBS8_NLCA1_NLCB1_ONLL1_PGR2_PLR1_PKA1_SIA3_SS1_SU0_SUM0_SUS0_SPO0_SRVW0_SSO0_SVW1_SK3_SKFTR0_SKXCCM8_TLDS1_ULSGRO0_USL1_UIOFGRO0_USFGRO1_VSn1_VWA1_VWB1_WSGRA0_WSGRB0_WS64_WG32_8_1_WGM0_WGMXCC4_WGMXCCGn1
    SolutionIndex: 132
    SolutionNameMin: Cijk_Ailk_Bljk_HHS_BH_Bias_HA_S_SAV_UserArgs_MT512x128x32_MI16x16x1_SN_LDSB0_AFC1_AFEM1_AFEM1_ASEM1_CLR0_CADS0_DTLA1_DTLB1_DTVA0_DTVB0_EPS0_FDSI0_GRPM1_GRVWA8_GRVWB8_GSU0_GSUAMB_GSUC0_GSUWGMRR0_GLS0_ISA950_IU1_K1_LDSTI0_LBSPPA8192_LBSPPB1024_LBSPPM0_LPA0_LPB16_LPM0_LRVW8_LWPMn1_MIAV0_MIWT8_8_MO40_NTn1_NTA7_NTB0_NTC7_NTD3_NTM0_NEPBS16_NLCA1_NLCB1_ONLL1_PGR2_PLR0_PKA1_SIA3_SS1_SU0_SUM0_SUS0_SPO0_SRVW0_SSO1_SVW8_SK3_SKFTR0_SKXCCM0_TLDS1_ULSGRO0_USL1_UIOFGRO0_USFGROn1_VSn1_VWA8_VWB8_WSGRA0_WSGRB0_WS64_WG64_4_1_WGM2_WGMXCC1_WGMXCCGn1
    SolutionIndex: 133
    SolutionNameMin: Cijk_Ailk_Bljk_HHS_BH_Bias_HA_S_SAV_UserArgs_MT256x128x64_MI16x16x1_SN_LDSB0_AFC1_AFEM1_AFEM1_ASEM1_CLR1_CADS0_DTLA1_DTLB1_DTVA0_DTVB0_EPS0_FDSI0_GRPM1_GRVWA8_GRVWB8_GSU0_GSUAMB_GSUC0_GSUWGMRR0_GLS0_ISA950_IU1_K1_LDSTI0_LBSPPA4096_LBSPPB1024_LBSPPM0_LPA0_LPB16_LPM0_LRVW8_LWPMn1_MIAV0_MIWT8_4_MO40_NTn1_NTA4_NTB3_NTC7_NTD2_NTM0_NEPBS16_NLCA1_NLCB1_ONLL1_PGR2_PLR1_PKA1_SIA3_SS1_SU0_SUM0_SUS0_SPO0_SRVW0_SSO0_SVW8_SK3_SKFTR0_SKXCCM4_TLDS1_ULSGRO0_USL1_UIOFGRO0_USFGROn1_VSn1_VWA8_VWB4_WSGRA0_WSGRB0_WS64_WG32_8_1_WGM0_WGMXCC16_WGMXCCGn1
    SolutionIndex: 134
    SolutionNameMin: Cijk_Ailk_Bljk_HHS_BH_Bias_HA_S_SAV_UserArgs_MT128x256x64_MI16x16x1_SN_LDSB0_AFC1_AFEM1_AFEM1_ASEM1_CLR1_CADS0_DTLA1_DTLB1_DTVA0_DTVB0_EPS0_FDSI0_GRPM1_GRVWA8_GRVWB8_GSU0_GSUAMB_GSUC0_GSUWGMRR0_GLS0_ISA950_IU1_K1_LDSTI0_LBSPPA2048_LBSPPB1024_LBSPPM0_LPA0_LPB16_LPM0_LRVW8_LWPMn1_MIAV0_MIWT8_4_MO40_NTn1_NTA5_NTB0_NTC2_NTD5_NTM0_NEPBS0_NLCA1_NLCB1_ONLL1_PGR2_PLR1_PKA1_SIA3_SS1_SU8_SUM0_SUS128_SPO0_SRVW0_SSO1_SVW8_SK3_SKFTR0_SKXCCM4_TLDS1_ULSGRO0_USL1_UIOFGRO0_USFGRO0_VSn1_VWA8_VWB4_WSGRA0_WSGRB0_WS64_WG16_16_1_WGM0_WGMXCC32_WGMXCCGn1
    SolutionIndex: 135
    SolutionNameMin: Cijk_Ailk_Bljk_HHS_BH_Bias_HA_S_SAV_UserArgs_MT64x48x128_MI16x16x1_SN_LDSB0_AFC1_AFEM1_AFEM1_ASEM1_CLR0_CADS0_DTLA0_DTLB0_DTVA0_DTVB0_EPS0_FDSI0_GRPM1_GRVWA8_GRVWB8_GSU0_GSUAMB_GSUC0_GSUWGMRR0_GLS0_ISA950_IU1_K1_LDSTI1_LBSPPA1024_LBSPPB256_LBSPPM0_LPA16_LPB16_LPM0_LRVW8_LWPMn1_MIAV0_MIWT1_3_MO40_NTn1_NTA0_NTB3_NTC1_NTD4_NTM0_NEPBS16_NLCA1_NLCB1_ONLL1_PGR2_PLR1_PKA1_SIA3_SS1_SU8_SUM0_SUS256_SPO0_SRVW0_SSO1_SVW1_SK3_SKFTR0_SKXCCM8_TLDS1_ULSGRO0_USL1_UIOFGRO0_USFGRO1_VSn1_VWA1_VWB1_WSGRA0_WSGRB0_WS64_WG64_4_1_WGM8_WGMXCC1_WGMXCCGn1
    SolutionIndex: 136
    SolutionNameMin: Cijk_Ailk_Bljk_HHS_BH_Bias_HA_S_SAV_UserArgs_MT192x128x64_MI16x16x1_SN_LDSB0_AFC1_AFEM1_AFEM1_ASEM1_CLR0_CADS0_DTLA0_DTLB0_DTVA0_DTVB0_EPS0_FDSI0_GRPM1_GRVWA8_GRVWB8_GSU0_GSUAMB_GSUC0_GSUWGMRR0_GLS0_ISA950_IU1_K1_LDSTI1_LBSPPA3072_LBSPPB512_LBSPPM0_LPA16_LPB16_LPM0_LRVW8_LWPMn1_MIAV0_MIWT6_4_MO40_NTn1_NTA0_NTB1_NTC6_NTD3_NTM0_NEPBS4_NLCA3_NLCB1_ONLL1_PGR2_PLR1_PKA1_SIA3_SS1_SU16_SUM0_SUS128_SPO0_SRVW0_SSO0_SVW1_SK3_SKFTR0_SKXCCM8_TLDS1_ULSGRO0_USL1_UIOFGRO0_USFGROn1_VSn1_VWA1_VWB4_WSGRA0_WSGRB0_WS64_WG32_8_1_WGM1_WGMXCC32_WGMXCCGn1
- - - [16, 393216, 1, 40]
    - [0, 0.0]
  - - [20, 4096, 1, 1]
    - [1, 0.0]
  - - [24, 4096, 1, 1]
    - [2, 0.0]
  - - [24, 4096, 1, 1024]
    - [3, 0.0]
  - - [20, 8192, 1, 1]
    - [4, 0.0]
  - - [24, 8192, 1, 1]
    - [5, 0.0]
  - - [24, 8192, 1, 1024]
    - [6, 0.0]
  - - [64, 589824, 1, 1456]
    - [77, 0.0]
  - - [80, 393216, 1, 112]
    - [7, 0.0]
  - - [96, 589824, 1, 200]
    - [65, 0.0]
  - - [112, 80, 1, 393216]
    - [8, 0.0]
  - - [112, 393216, 1, 80]
    - [9, 0.0]
  - - [128, 6144, 1, 88]
    - [66, 0.0]
  - - [128, 6144, 1, 928]
    - [62, 0.0]
  - - [130, 4096, 1, 1024]
    - [10, 0.0]
  - - [136, 4096, 1, 256]
    - [11, 0.0]
  - - [136, 4096, 1, 1024]
    - [12, 0.0]
  - - [184, 224, 1, 589824]
    - [79, 0.0]
  - - [200, 256, 1, 589824]
    - [64, 0.0]
  - - [224, 589824, 1, 184]
    - [68, 0.0]
  - - [1568, 589824, 1, 289]
    - [86, 0.0]
  - - [1568, 589824, 1, 296]
    - [85, 0.0]
  - - [256, 136, 1, 4096]
    - [13, 0.0]
  - - [256, 6144, 1, 88]
    - [82, 0.0]
  - - [256, 6144, 1, 928]
    - [88, 0.0]
  - - [256, 589824, 1, 200]
    - [89, 0.0]
  - - [1452, 589824, 1, 64]
    - [90, 0.0]
  - - [1456, 589824, 1, 64]
    - [91, 0.0]
  - - [296, 589824, 1, 1568]
    - [78, 0.0]
  - - [512, 6144, 1, 64]
    - [81, 0.0]
  - - [512, 6144, 1, 4271]
    - [14, 0.0]
  - - [512, 6144, 1, 4272]
    - [15, 0.0]
  - - [1024, 24, 1, 4096]
    - [16, 0.0]
  - - [1024, 24, 1, 8192]
    - [17, 0.0]
  - - [1024, 4096, 1, 20]
    - [18, 0.0]
  - - [1024, 4096, 1, 24]
    - [19, 0.0]
  - - [1024, 4096, 1, 136]
    - [20, 0.0]
  - - [1568, 296, 1, 589824]
    - [84, 0.0]
  - - [4271, 6144, 1, 2048]
    - [21, 0.0]
  - - [4272, 6144, 1, 512]
    - [67, 0.0]
  - - [4272, 6144, 1, 2048]
    - [83, 0.0]
  - - [256, 4096, 1, 130]
    - [22, 0.0]
  - - [256, 4096, 1, 136]
    - [23, 0.0]
  - - [512, 4272, 1, 6144]
    - [76, 0.0]
  - - [1024, 8192, 1, 20]
    - [24, 0.0]
  - - [1024, 8192, 1, 24]
    - [25, 0.0]
  - - [24, 393216, 1, 40]
    - [26, 0.0]
  - - [33, 393216, 1, 16]
    - [27, 0.0]
  - - [24, 589824, 1, 168]
    - [69, 0.0]
  - - [105, 393216, 1, 73]
    - [28, 0.0]
  - - [161, 589824, 1, 24]
    - [71, 0.0]
  - - [168, 589824, 1, 24]
    - [74, 0.0]
  - - [177, 589824, 1, 217]
    - [70, 0.0]
  - - [184, 589824, 1, 224]
    - [80, 0.0]
  - - [193, 589824, 1, 96]
    - [87, 0.0]
  - - [193, 589824, 1, 249]
    - [72, 0.0]
  - - [200, 589824, 1, 96]
    - [75, 0.0]
  - - [200, 589824, 1, 256]
    - [63, 0.0]
  - - [32, 38, 8192, 48]
    - [29, 0.0]
  - - [32, 40, 8192, 48]
    - [30, 0.0]
  - - [32, 48, 8192, 40]
    - [31, 0.0]
  - - [16, 40, 4096, 96]
    - [32, 0.0]
  - - [16, 96, 4096, 40]
    - [33, 0.0]
  - - [16, 96, 4096, 112]
    - [34, 0.0]
  - - [24, 96, 6144, 168]
    - [43, 0.0]
  - - [24, 96, 6144, 184]
    - [56, 0.0]
  - - [16, 105, 4096, 96]
    - [35, 0.0]
  - - [16, 112, 4096, 96]
    - [36, 0.0]
  - - [32, 88, 4096, 160]
    - [37, 0.0]
  - - [32, 96, 6144, 200]
    - [92, 0.0]
  - - [40, 96, 4096, 16]
    - [38, 0.0]
  - - [112, 96, 4096, 16]
    - [39, 0.0]
  - - [32, 1219, 4096, 160]
    - [40, 0.0]
  - - [32, 1568, 6144, 96]
    - [58, 0.0]
  - - [160, 4096, 144, 64]
    - [41, 0.0]
  - - [24, 161, 6144, 96]
    - [46, 0.0]
  - - [24, 168, 6144, 96]
    - [54, 0.0]
  - - [24, 177, 6144, 96]
    - [48, 0.0]
  - - [24, 184, 6144, 96]
    - [53, 0.0]
  - - [32, 193, 6144, 96]
    - [51, 0.0]
  - - [32, 200, 6144, 96]
    - [55, 0.0]
  - - [48, 96, 6144, 120]
    - [52, 0.0]
  - - [48, 216, 6144, 96]
    - [59, 0.0]
  - - [96, 48, 6144, 120]
    - [60, 0.0]
  - - [96, 216, 6144, 48]
    - [57, 0.0]
  - - [168, 96, 6144, 24]
    - [47, 0.0]
  - - [184, 96, 6144, 24]
    - [50, 0.0]
  - - [200, 96, 6144, 32]
    - [49, 0.0]
  - - [1, 1, 1, 1]
    - [42, 0.0]
  - - [48, 120, 6144, 96]
    - [44, 0.0]
  - - [96, 120, 6144, 48]
    - [45, 0.0]
  - - [48, 116, 6144, 96]
    - [93, 0.0]
  - - [96, 116, 6144, 48]
    - [61, 0.0]
  - - [2048, 6144, 1, 4272]
    - [73, 0.0]
  - - [256, 1280, 1, 588]
    - [94, 0.0]
  - - [221184, 128, 1, 256]
    - [95, 0.0]
  - - [30720, 256, 1, 512]
    - [96, 0.0]
  - - [1152, 512, 1, 432]
    - [97, 0.0]
  - - [294912, 128, 1, 256]
    - [98, 0.0]
  - - [40960, 256, 1, 512]
    - [99, 0.0]
  - - [61440, 256, 1, 512]
    - [100, 0.0]
  - - [2304, 512, 1, 13824]
    - [101, 0.0]
  - - [589824, 128, 1, 256]
    - [102, 0.0]
  - - [73728, 256, 1, 512]
    - [103, 0.0]
  - - [557056, 128, 1, 256]
    - [104, 0.0]
  - - [417792, 128, 1, 256]
    - [105, 0.0]
  - - [81920, 256, 1, 512]
    - [106, 0.0]
  - - [1152, 512, 1, 13824]
    - [107, 0.0]
  - - [5120, 16, 1, 16]
    - [108, 0.0]
  - - [147456, 256, 1, 512]
    - [109, 0.0]
  - - [3840, 16, 1, 16]
    - [110, 0.0]
  - - [1114112, 128, 1, 256]
    - [111, 0.0]
  - - [835584, 128, 1, 256]
    - [112, 0.0]
  - - [110592, 256, 1, 512]
    - [113, 0.0]
  - - [442368, 128, 1, 256]
    - [114, 0.0]
  - - [2560, 512, 1, 432]
    - [115, 0.0]
  - - [1920, 512, 1, 13824]
    - [116, 0.0]
  - - [1536, 512, 1, 432]
    - [117, 0.0]
  - - [1920, 512, 1, 432]
    - [118, 0.0]
  - - [3072, 512, 1, 432]
    - [119, 0.0]
  - - [1536, 512, 1, 13824]
    - [120, 0.0]
  - - [55296, 256, 1, 512]
    - [121, 0.0]
  - - [165888, 128, 1, 256]
    - [122, 0.0]
  - - [864, 512, 1, 13824]
    - [123, 0.0]
  - - [331776, 128, 1, 256]
    - [124, 0.0]
  - - [46080, 256, 1, 512]
    - [125, 0.0]
  - - [1728, 512, 1, 13824]
    - [126, 0.0]
  - - [2880, 16, 1, 16]
    - [127, 0.0]
  - - [864, 512, 1, 432]
    - [128, 0.0]
  - - [23040, 256, 1, 512]
    - [129, 0.0]
  - - [41472, 256, 1, 512]
    - [130, 0.0]
  - - [1728, 512, 1, 432]
    - [131, 0.0]
  - - [626688, 128, 1, 256]
    - [132, 0.0]
  - - [313344, 128, 1, 256]
    - [133, 0.0]
  - - [82944, 256, 1, 512]
    - [134, 0.0]
  - - [1440, 512, 1, 432]
    - [135, 0.0]
  - - [1440, 512, 1, 13824]
    - [136, 0.0]
- null
- null
- DeviceEfficiency
- Equality
