projects/hipblaslt/library/src/amd_detail/rocblaslt/src/Tensile/Logic/asm_full/gfx950/Equality/gfx950_Cijk_Ailk_Bljk_S_MX_B_Bias_HAS_SAV_UserArgs.yaml
- {MinimumRequiredVersion: 5.0.0}
- gfx950
- gfx950
- [Device 75a0]
    SolutionIndex: 0
    SolutionNameMin: Cijk_Ailk_Bljk_S_MX_B_Bias_HA_S_SAV_UserArgs_MT16x32x32_MI16x16x1_SN_LDSB1_AFC1_AFEM1_AFEM1_ASEM1_CLR0_CADS0_DTVA0_DTVB0_EPS0_FDSI0_GRPM1_GRVWA4_GRVWB4_GSU0_GSUAMB_GSUC0_GSUWGMRR0_GLS0_ISA950_IU1_K1_LBSPPA128_LBSPPB256_LBSPPM0_LPA8_LPB8_LPM0_LRVW4_LWPMn1_MIAV1_MIWT1_2_MO40_NTn1_NTA2_NTB4_NTC1_NTD0_NTM0_NEPBS4_NLCA1_NLCB1_ONLL1_PGR2_PLR0_PKA1_SIA3_SS0_SU0_SUM0_SUS0_SPO0_SRVW0_SSO0_SVW4_SK3_SKXCCM8_TLDS2_ULSGRO0_USL1_UIOFGRO0_USFGRO0_VSn1_VWA1_VWB2_WSGRA0_WSGRB0_WS64_WG16_4_1_WGM0_WGMXCC1_WGMXCCGn1
    SolutionIndex: 1
    SolutionNameMin: Cijk_Ailk_Bljk_S_MX_B_Bias_HA_S_SAV_UserArgs_MT16x64x32_MI16x16x1_SN_LDSB1_AFC1_AFEM1_AFEM1_ASEM1_CLR0_CADS0_DTVA0_DTVB0_EPS0_FDSI0_GRPM1_GRVWA1_GRVWB4_GSU0_GSUAMB_GSUC0_GSUWGMRR0_GLS0_ISA950_IU1_K1_LBSPPA256_LBSPPB256_LBSPPM0_LPA16_LPB8_LPM0_LRVW4_LWPMn1_MIAV1_MIWT1_2_MO40_NTn1_NTA6_NTB7_NTC3_NTD2_NTM0_NEPBS14_NLCA1_NLCB1_ONLL1_PGR2_PLR0_PKA1_SIA3_SS0_SU0_SUM0_SUS0_SPO0_SRVW0_SSO0_SVW4_SK3_SKXCCM0_TLDS1_ULSGRO0_USL1_UIOFGRO0_USFGRO0_VSn1_VWA1_VWB2_WSGRA0_WSGRB0_WS64_WG16_8_1_WGM0_WGMXCC32_WGMXCCGn1
    SolutionIndex: 2
    SolutionNameMin: Cijk_Ailk_Bljk_S_MX_B_Bias_HA_S_SAV_UserArgs_MT64x64x32_MI32x32x1_SN_LDSB1_AFC1_AFEM1_AFEM1_ASEM1_CLR0_CADS0_DTVA0_DTVB0_EPS0_FDSI0_GRPM1_GRVWA4_GRVWB4_GSU0_GSUAMB_GSUC0_GSUWGMRR0_GLS0_ISA950_IU1_K1_LBSPPA0_LBSPPB0_LBSPPM0_LPA0_LPB0_LPM0_LRVW4_LWPMn1_MIAV0_MIWT1_2_MO40_NTn1_NTA4_NTB4_NTC1_NTD4_NTM0_NEPBS0_NLCA1_NLCB1_ONLL1_PGR2_PLR1_PKA1_SIA3_SS1_SU16_SUM0_SUS128_SPO0_SRVW0_SSO1_SVW1_SK3_SKXCCM0_TLDS0_ULSGRO0_USL1_UIOFGRO0_USFGRO0_VSn1_VWA1_VWB2_WSGRA0_WSGRB0_WS64_WG64_2_1_WGM0_WGMXCC8_WGMXCCGn1
    SolutionIndex: 3
    SolutionNameMin: Cijk_Ailk_Bljk_S_MX_B_Bias_HA_S_SAV_UserArgs_MT128x80x64_MI16x16x1_SN_LDSB1_AFC1_AFEM1_AFEM1_ASEM1_CLR0_CADS0_DTVA0_DTVB0_EPS0_FDSI0_GRPM1_GRVWA4_GRVWB4_GSU0_GSUAMB_GSUC0_GSUWGMRR0_GLS0_ISA950_IU1_K1_LBSPPA2048_LBSPPB256_LBSPPM0_LPA0_LPB8_LPM0_LRVW4_LWPMn1_MIAV0_MIWT2_5_MO40_NTn1_NTA3_NTB5_NTC2_NTD4_NTM0_NEPBS14_NLCA1_NLCB1_ONLL1_PGR2_PLR1_PKA1_SIA3_SS1_SU8_SUM0_SUS256_SPO0_SRVW0_SSO1_SVW2_SK3_SKXCCM8_TLDS1_ULSGRO0_USL1_UIOFGRO0_USFGRO0_VSn1_VWA2_VWB1_WSGRA0_WSGRB0_WS64_WG64_4_1_WGM1_WGMXCC16_WGMXCCGn1
    SolutionIndex: 4
    SolutionNameMin: Cijk_Ailk_Bljk_S_MX_B_Bias_HA_S_SAV_UserArgs_MT128x256x32_MI32x32x1_SN_LDSB0_AFC1_AFEM1_AFEM1_ASEM1_CLR0_CADS0_DTVA0_DTVB0_EPS0_FDSI0_GRPM1_GRVWA2_GRVWB4_GSU0_GSUAMB_GSUC0_GSUWGMRR0_GLS0_ISA950_IU1_K1_LBSPPA512_LBSPPB256_LBSPPM0_LPA4_LPB4_LPM0_LRVW4_LWPMn1_MIAV0_MIWT4_2_MO40_NTn1_NTA3_NTB1_NTC5_NTD3_NTM0_NEPBS16_NLCA1_NLCB1_ONLL1_PGR2_PLR1_PKA1_SIA3_SS1_SU16_SUM0_SUS128_SPO0_SRVW0_SSO0_SVW4_SK3_SKXCCM0_TLDS2_ULSGRO0_USL1_UIOFGRO0_USFGRO0_VSn1_VWA4_VWB2_WSGRA0_WSGRB0_WS64_WG32_8_1_WGM32_WGMXCC2_WGMXCCGn1
    SolutionIndex: 5
    SolutionNameMin: Cijk_Ailk_Bljk_S_MX_B_Bias_HA_S_SAV_UserArgs_MT128x96x32_MI32x32x1_SN_LDSB0_AFC1_AFEM1_AFEM1_ASEM1_CLR1_CADS0_DTVA0_DTVB0_EPS0_FDSI0_GRPM1_GRVWA4_GRVWB4_GSU0_GSUAMB_GSUC0_GSUWGMRR0_GLS0_ISA950_IU1_K1_LBSPPA0_LBSPPB1024_LBSPPM0_LPA0_LPB4_LPM0_LRVW4_LWPMn1_MIAV0_MIWT1_3_MO40_NTn1_NTA2_NTB1_NTC1_NTD4_NTM0_NEPBS0_NLCA1_NLCB1_ONLL1_PGR2_PLR1_PKA1_SIA3_SS1_SU16_SUM0_SUS128_SPO0_SRVW0_SSO1_SVW1_SK3_SKXCCM0_TLDS1_ULSGRO0_USL1_UIOFGRO0_USFGRO0_VSn1_VWA1_VWB1_WSGRA0_WSGRB0_WS64_WG128_2_1_WGM1_WGMXCC16_WGMXCCGn1
    SolutionIndex: 6
    SolutionNameMin: Cijk_Ailk_Bljk_S_MX_B_Bias_HA_S_SAV_UserArgs_MT128x48x32_MI16x16x1_SN_LDSB1_AFC1_AFEM1_AFEM1_ASEM1_CLR0_CADS0_DTVA0_DTVB0_EPS0_FDSI0_GRPM1_GRVWA4_GRVWB2_GSU0_GSUAMB_GSUC0_GSUWGMRR0_GLS0_ISA950_IU1_K1_LBSPPA2048_LBSPPB128_LBSPPM0_LPA0_LPB8_LPM0_LRVW4_LWPMn1_MIAV0_MIWT2_3_MO40_NTn1_NTA0_NTB1_NTC5_NTD5_NTM0_NEPBS16_NLCA1_NLCB1_ONLL1_PGR2_PLR0_PKA1_SIA3_SS1_SU8_SUM0_SUS128_SPO1_SRVW0_SSO0_SVW2_SK3_SKXCCM0_TLDS1_ULSGRO0_USL1_UIOFGRO0_USFGRO0_VSn1_VWA2_VWB1_WSGRA0_WSGRB0_WS64_WG64_4_1_WGM1_WGMXCC16_WGMXCCGn1
    SolutionIndex: 7
    SolutionNameMin: Cijk_Ailk_Bljk_S_MX_B_Bias_HA_S_SAV_UserArgs_MT64x64x64_MI32x32x1_SN_LDSB0_AFC1_AFEM1_AFEM1_ASEM1_CLR1_CADS0_DTVA0_DTVB0_EPS0_FDSI0_GRPM1_GRVWA4_GRVWB4_GSU0_GSUAMB_GSUC0_GSUWGMRR0_GLS0_ISA950_IU1_K1_LBSPPA0_LBSPPB512_LBSPPM0_LPA0_LPB4_LPM0_LRVW4_LWPMn1_MIAV0_MIWT1_2_MO40_NTn1_NTA3_NTB1_NTC0_NTD1_NTM0_NEPBS0_NLCA1_NLCB1_ONLL1_PGR2_PLR1_PKA1_SIA3_SS1_SU16_SUM0_SUS256_SPO1_SRVW0_SSO0_SVW1_SK3_SKXCCM0_TLDS1_ULSGRO0_USL1_UIOFGRO0_USFGRO0_VSn1_VWA1_VWB2_WSGRA0_WSGRB0_WS64_WG64_2_2_WGM0_WGMXCC1_WGMXCCGn1
    SolutionIndex: 8
    SolutionNameMin: Cijk_Ailk_Bljk_S_MX_B_Bias_HA_S_SAV_UserArgs_MT96x96x32_MI16x16x1_SN_LDSB0_AFC1_AFEM1_AFEM1_ASEM1_CLR0_CADS0_DTVA0_DTVB0_EPS0_FDSI0_GRPM1_GRVWA4_GRVWB4_GSU0_GSUAMB_GSUC0_GSUWGMRR0_GLS0_ISA950_IU1_K1_LBSPPA1536_LBSPPB128_LBSPPM0_LPA16_LPB8_LPM0_LRVW4_LWPMn1_MIAV0_MIWT3_3_MO40_NTn1_NTA0_NTB1_NTC0_NTD3_NTM0_NEPBS12_NLCA3_NLCB1_ONLL1_PGR2_PLR0_PKA1_SIA3_SS0_SU16_SUM0_SUS256_SPO0_SRVW0_SSO0_SVW4_SK3_SKXCCM0_TLDS1_ULSGRO0_USL1_UIOFGRO0_USFGRO0_VSn1_VWA1_VWB1_WSGRA0_WSGRB0_WS64_WG32_8_1_WGM1_WGMXCC1_WGMXCCGn1
    SolutionIndex: 9
    SolutionNameMin: Cijk_Ailk_Bljk_S_MX_B_Bias_HA_S_SAV_UserArgs_MT128x96x32_MI32x32x1_SN_LDSB1_AFC1_AFEM1_AFEM1_ASEM1_CLR1_CADS0_DTVA0_DTVB0_EPS0_FDSI0_GRPM1_GRVWA4_GRVWB4_GSU0_GSUAMB_GSUC0_GSUWGMRR0_GLS0_ISA950_IU1_K1_LBSPPA0_LBSPPB128_LBSPPM0_LPA0_LPB4_LPM0_LRVW4_LWPMn1_MIAV0_MIWT1_3_MO40_NTn1_NTA0_NTB1_NTC4_NTD6_NTM0_NEPBS16_NLCA1_NLCB1_ONLL1_PGR2_PLR1_PKA1_SIA3_SS1_SU0_SUM0_SUS0_SPO0_SRVW0_SSO1_SVW1_SK3_SKXCCM0_TLDS1_ULSGRO0_USL1_UIOFGRO0_USFGRO0_VSn1_VWA1_VWB1_WSGRA0_WSGRB0_WS64_WG128_2_1_WGM1_WGMXCC16_WGMXCCGn1
    SolutionIndex: 10
    SolutionNameMin: Cijk_Ailk_Bljk_S_MX_B_Bias_HA_S_SAV_UserArgs_MT256x96x32_MI32x32x1_SN_LDSB1_AFC1_AFEM1_AFEM1_ASEM1_CLR1_CADS0_DTVA0_DTVB0_EPS0_FDSI0_GRPM1_GRVWA4_GRVWB4_GSU0_GSUAMB_GSUC0_GSUWGMRR0_GLS0_ISA950_IU1_K1_LBSPPA0_LBSPPB128_LBSPPM0_LPA0_LPB4_LPM0_LRVW4_LWPMn1_MIAV0_MIWT2_3_MO40_NTn1_NTA2_NTB3_NTC4_NTD4_NTM0_NEPBS16_NLCA1_NLCB1_ONLL1_PGR2_PLR1_PKA1_SIA3_SS1_SU0_SUM0_SUS0_SPO1_SRVW0_SSO1_SVW2_SK3_SKXCCM8_TLDS1_ULSGRO0_USL1_UIOFGRO0_USFGRO0_VSn1_VWA2_VWB1_WSGRA0_WSGRB0_WS64_WG128_2_1_WGM8_WGMXCC1_WGMXCCGn1
    SolutionIndex: 11
    SolutionNameMin: Cijk_Ailk_Bljk_S_MX_B_Bias_HA_S_SAV_UserArgs_MT16x128x32_MI16x16x1_SN_LDSB1_AFC1_AFEM1_AFEM1_ASEM1_CLR0_CADS0_DTVA0_DTVB0_EPS0_FDSI0_GRPM1_GRVWA1_GRVWB4_GSU0_GSUAMB_GSUC0_GSUWGMRR0_GLS0_ISA950_IU1_K1_LBSPPA128_LBSPPB256_LBSPPM0_LPA8_LPB8_LPM0_LRVW4_LWPMn1_MIAV1_MIWT1_2_MO40_NTn1_NTA0_NTB0_NTC0_NTD0_NTM0_NEPBS10_NLCA1_NLCB1_ONLL1_PGR2_PLR0_PKA1_SIA3_SS1_SU16_SUM0_SUS256_SPO0_SRVW0_SSO0_SVW1_SK3_SKXCCM0_TLDS2_ULSGRO0_USL1_UIOFGRO0_USFGRO0_VSn1_VWA1_VWB2_WSGRA0_WSGRB0_WS64_WG16_16_1_WGM1_WGMXCC1_WGMXCCGn1
    SolutionIndex: 12
    SolutionNameMin: Cijk_Ailk_Bljk_S_MX_B_Bias_HA_S_SAV_UserArgs_MT32x128x32_MI32x32x1_SN_LDSB1_AFC1_AFEM1_AFEM1_ASEM1_CLR1_CADS0_DTVA0_DTVB0_EPS0_FDSI0_GRPM1_GRVWA4_GRVWB4_GSU0_GSUAMB_GSUC0_GSUWGMRR0_GLS0_ISA950_IU1_K1_LBSPPA0_LBSPPB128_LBSPPM0_LPA0_LPB4_LPM0_LRVW4_LWPMn1_MIAV0_MIWT1_1_MO40_NTn1_NTA3_NTB2_NTC0_NTD5_NTM0_NEPBS16_NLCA1_NLCB1_ONLL1_PGR2_PLR1_PKA1_SIA3_SS1_SU0_SUM0_SUS0_SPO0_SRVW0_SSO0_SVW1_SK3_SKXCCM0_TLDS1_ULSGRO0_USL1_UIOFGRO0_USFGRO0_VSn1_VWA1_VWB1_WSGRA0_WSGRB0_WS64_WG32_8_1_WGM0_WGMXCC1_WGMXCCGn1
    SolutionIndex: 13
    SolutionNameMin: Cijk_Ailk_Bljk_S_MX_B_Bias_HA_S_SAV_UserArgs_MT64x16x32_MI16x16x1_SN_LDSB1_AFC1_AFEM1_AFEM1_ASEM1_CLR0_CADS0_DTVA0_DTVB0_EPS0_FDSI0_GRPM1_GRVWA4_GRVWB4_GSU0_GSUAMB_GSUC0_GSUWGMRR0_GLS0_ISA950_IU1_K1_LBSPPA1024_LBSPPB128_LBSPPM0_LPA0_LPB8_LPM0_LRVW4_LWPMn1_MIAV1_MIWT2_1_MO40_NTn1_NTA6_NTB1_NTC1_NTD4_NTM0_NEPBS12_NLCA1_NLCB1_ONLL1_PGR2_PLR0_PKA1_SIA3_SS1_SU16_SUM0_SUS128_SPO0_SRVW0_SSO1_SVW2_SK3_SKXCCM0_TLDS1_ULSGRO0_USL1_UIOFGRO0_USFGRO0_VSn1_VWA2_VWB1_WSGRA0_WSGRB0_WS64_WG32_4_1_WGM1_WGMXCC8_WGMXCCGn1
    SolutionIndex: 14
    SolutionNameMin: Cijk_Ailk_Bljk_S_MX_B_Bias_HA_S_SAV_UserArgs_MT256x256x32_MI32x32x1_SN_LDSB0_AFC1_AFEM1_AFEM1_ASEM1_CLR1_CADS0_DTVA0_DTVB0_EPS0_FDSI0_GRPM1_GRVWA4_GRVWB4_GSU0_GSUAMB_GSUC0_GSUWGMRR0_GLS0_ISA950_IU1_K1_LBSPPA512_LBSPPB512_LBSPPM0_LPA4_LPB4_LPM0_LRVW4_LWPMn1_MIAV0_MIWT4_4_MO40_NTn1_NTA7_NTB3_NTC3_NTD2_NTM0_NEPBS16_NLCA1_NLCB1_ONLL1_PGR2_PLR1_PKA1_SIA3_SS1_SU8_SUM0_SUS256_SPO0_SRVW0_SSO0_SVW4_SK3_SKXCCM0_TLDS2_ULSGRO0_USL1_UIOFGRO0_USFGRO0_VSn1_VWA4_VWB4_WSGRA0_WSGRB0_WS64_WG64_4_1_WGM0_WGMXCC1_WGMXCCGn1
    SolutionIndex: 15
    SolutionNameMin: Cijk_Ailk_Bljk_S_MX_B_Bias_HA_S_SAV_UserArgs_MT16x16x128_MI16x16x1_SN_LDSB1_AFC1_AFEM1_AFEM1_ASEM1_CLR0_CADS0_DTVA0_DTVB0_EPS0_FDSI0_GRPM1_GRVWA1_GRVWB4_GSU0_GSUAMB_GSUC0_GSUWGMRR0_GLS0_ISA950_IU1_K1_LBSPPA256_LBSPPB512_LBSPPM0_LPA16_LPB8_LPM0_LRVW4_LWPMn1_MIAV1_MIWT1_1_MO40_NTn1_NTA2_NTB2_NTC2_NTD0_NTM0_NEPBS12_NLCA1_NLCB1_ONLL1_PGR2_PLR0_PKA1_SIA3_SS1_SU16_SUM0_SUS512_SPO1_SRVW0_SSO0_SVW1_SK3_SKXCCM8_TLDS1_ULSGRO0_USL1_UIOFGRO0_USFGRO0_VSn1_VWA1_VWB1_WSGRA0_WSGRB0_WS64_WG16_4_4_WGM0_WGMXCC2_WGMXCCGn1
    SolutionIndex: 16
    SolutionNameMin: Cijk_Ailk_Bljk_S_MX_B_Bias_HA_S_SAV_UserArgs_MT16x32x256_MI16x16x1_SN_LDSB0_AFC1_AFEM1_AFEM1_ASEM1_CLR1_CADS0_DTVA0_DTVB0_EPS0_FDSI0_GRPM1_GRVWA1_GRVWB4_GSU0_GSUAMB_GSUC0_GSUWGMRR0_GLS0_ISA950_IU1_K1_LBSPPA256_LBSPPB1024_LBSPPM0_LPA0_LPB8_LPM0_LRVW4_LWPMn1_MIAV0_MIWT1_1_MO40_NTn1_NTA1_NTB7_NTC1_NTD0_NTM0_NEPBS14_NLCA1_NLCB1_ONLL1_PGR2_PLR1_PKA1_SIA3_SS0_SU0_SUM0_SUS0_SPO1_SRVW0_SSO0_SVW1_SK3_SKXCCM0_TLDS1_ULSGRO0_USL1_UIOFGRO0_USFGRO0_VSn1_VWA1_VWB1_WSGRA0_WSGRB0_WS64_WG16_8_2_WGM1_WGMXCC8_WGMXCCGn1
    SolutionIndex: 17
    SolutionNameMin: Cijk_Ailk_Bljk_S_MX_B_Bias_HA_S_SAV_UserArgs_MT16x32x128_MI16x16x1_SN_LDSB0_AFC1_AFEM1_AFEM1_ASEM1_CLR1_CADS0_DTVA0_DTVB0_EPS0_FDSI0_GRPM1_GRVWA1_GRVWB4_GSU0_GSUAMB_GSUC0_GSUWGMRR0_GLS0_ISA950_IU1_K1_LBSPPA256_LBSPPB1024_LBSPPM0_LPA0_LPB8_LPM0_LRVW4_LWPMn1_MIAV0_MIWT1_1_MO40_NTn1_NTA1_NTB7_NTC1_NTD1_NTM0_NEPBS10_NLCA1_NLCB1_ONLL1_PGR2_PLR1_PKA1_SIA3_SS0_SU0_SUM0_SUS0_SPO1_SRVW0_SSO0_SVW1_SK3_SKXCCM0_TLDS1_ULSGRO0_USL1_UIOFGRO0_USFGRO0_VSn1_VWA1_VWB1_WSGRA0_WSGRB0_WS64_WG16_8_2_WGM1_WGMXCC8_WGMXCCGn1
    SolutionIndex: 18
    SolutionNameMin: Cijk_Ailk_Bljk_S_MX_B_Bias_HA_S_SAV_UserArgs_MT16x32x128_MI16x16x1_SN_LDSB0_AFC1_AFEM1_AFEM1_ASEM1_CLR1_CADS0_DTVA0_DTVB0_EPS0_FDSI0_GRPM1_GRVWA4_GRVWB4_GSU0_GSUAMB_GSUC0_GSUWGMRR0_GLS0_ISA950_IU1_K1_LBSPPA1024_LBSPPB1024_LBSPPM0_LPA0_LPB8_LPM0_LRVW4_LWPMn1_MIAV1_MIWT1_1_MO40_NTn1_NTA3_NTB4_NTC1_NTD0_NTM0_NEPBS0_NLCA1_NLCB1_ONLL1_PGR2_PLR1_PKA1_SIA3_SS1_SU0_SUM0_SUS0_SPO1_SRVW0_SSO0_SVW1_SK3_SKXCCM0_TLDS1_ULSGRO0_USL1_UIOFGRO0_USFGRO0_VSn1_VWA1_VWB1_WSGRA0_WSGRB0_WS64_WG16_8_1_WGM0_WGMXCC16_WGMXCCGn1
    SolutionIndex: 19
    SolutionNameMin: Cijk_Ailk_Bljk_S_MX_B_Bias_HA_S_SAV_UserArgs_MT32x16x64_MI16x16x1_SN_LDSB0_AFC1_AFEM1_AFEM1_ASEM1_CLR1_CADS0_DTVA0_DTVB0_EPS0_FDSI0_GRPM1_GRVWA4_GRVWB4_GSU0_GSUAMB_GSUC0_GSUWGMRR0_GLS0_ISA950_IU1_K1_LBSPPA1024_LBSPPB1024_LBSPPM0_LPA0_LPB8_LPM0_LRVW4_LWPMn1_MIAV0_MIWT1_1_MO40_NTn1_NTA0_NTB4_NTC2_NTD4_NTM0_NEPBS10_NLCA1_NLCB1_ONLL1_PGR2_PLR1_PKA1_SIA3_SS1_SU0_SUM0_SUS0_SPO1_SRVW0_SSO0_SVW1_SK3_SKXCCM0_TLDS1_ULSGRO0_USL1_UIOFGRO0_USFGRO0_VSn1_VWA1_VWB1_WSGRA0_WSGRB0_WS64_WG32_4_1_WGM0_WGMXCC8_WGMXCCGn1
    SolutionIndex: 20
    SolutionNameMin: Cijk_Ailk_Bljk_S_MX_B_Bias_HA_S_SAV_UserArgs_MT64x64x32_MI32x32x1_SN_LDSB1_AFC1_AFEM1_AFEM1_ASEM1_CLR1_CADS0_DTVA0_DTVB0_EPS1_FDSI0_GRPM1_GRVWA4_GRVWB4_GSU0_GSUAMB_GSUC0_GSUWGMRR0_GLS0_ISA950_IU1_K1_LBSPPA0_LBSPPB128_LBSPPM0_LPA0_LPB4_LPM0_LRVW4_LWPMn1_MIAV1_MIWT1_1_MO40_NTn1_NTA0_NTB2_NTC1_NTD0_NTM0_NEPBS16_NLCA1_NLCB1_ONLL1_PGR1_PLR1_PKA1_SIA3_SS1_SU0_SUM0_SUS0_SPO0_SRVW0_SSO1_SVW1_SK3_SKXCCM0_TLDS1_ULSGRO0_USL1_UIOFGRO0_USFGRO0_VSn1_VWA1_VWB1_WSGRA0_WSGRB0_WS64_WG64_4_1_WGM1_WGMXCC8_WGMXCCGn1
    SolutionIndex: 21
    SolutionNameMin: Cijk_Ailk_Bljk_S_MX_B_Bias_HA_S_SAV_UserArgs_MT64x112x32_MI16x16x1_SN_LDSB1_AFC1_AFEM1_AFEM1_ASEM1_CLR0_CADS0_DTVA0_DTVB0_EPS0_FDSI0_GRPM1_GRVWA4_GRVWB4_GSU0_GSUAMB_GSUC0_GSUWGMRR0_GLS0_ISA950_IU1_K1_LBSPPA1024_LBSPPB128_LBSPPM0_LPA0_LPB8_LPM0_LRVW4_LWPMn1_MIAV0_MIWT2_7_MO40_NTn1_NTA0_NTB5_NTC1_NTD7_NTM0_NEPBS16_NLCA1_NLCB1_ONLL1_PGR2_PLR0_PKA1_SIA3_SS1_SU0_SUM0_SUS0_SPO0_SRVW0_SSO1_SVW2_SK3_SKXCCM0_TLDS1_ULSGRO0_USL1_UIOFGRO0_USFGRO0_VSn1_VWA2_VWB1_WSGRA0_WSGRB0_WS64_WG32_4_1_WGM1_WGMXCC16_WGMXCCGn1
    SolutionIndex: 22
    SolutionNameMin: Cijk_Ailk_Bljk_S_MX_B_Bias_HA_S_SAV_UserArgs_MT64x128x32_MI16x16x1_SN_LDSB1_AFC1_AFEM1_AFEM1_ASEM1_CLR0_CADS0_DTVA0_DTVB0_EPS1_FDSI0_GRPM1_GRVWA1_GRVWB4_GSU0_GSUAMB_GSUC0_GSUWGMRR0_GLS0_ISA950_IU1_K1_LBSPPA1024_LBSPPB256_LBSPPM0_LPA0_LPB8_LPM0_LRVW4_LWPMn1_MIAV0_MIWT4_2_MO40_NTn1_NTA2_NTB4_NTC5_NTD3_NTM0_NEPBS16_NLCA1_NLCB1_ONLL1_PGR1_PLR0_PKA1_SIA3_SS1_SU0_SUM0_SUS0_SPO1_SRVW0_SSO1_SVW4_SK3_SKXCCM0_TLDS1_ULSGRO0_USL1_UIOFGRO0_USFGRO0_VSn1_VWA4_VWB2_WSGRA0_WSGRB0_WS64_WG16_16_1_WGM0_WGMXCC8_WGMXCCGn1
    SolutionIndex: 23
    SolutionNameMin: Cijk_Ailk_Bljk_S_MX_B_Bias_HA_S_SAV_UserArgs_MT64x128x32_MI16x16x1_SN_LDSB0_AFC1_AFEM1_AFEM1_ASEM1_CLR0_CADS0_DTVA0_DTVB0_EPS1_FDSI0_GRPM1_GRVWA4_GRVWB4_GSU0_GSUAMB_GSUC0_GSUWGMRR0_GLS0_ISA950_IU1_K1_LBSPPA512_LBSPPB256_LBSPPM0_LPA8_LPB8_LPM0_LRVW4_LWPMn1_MIAV0_MIWT4_2_MO40_NTn1_NTA0_NTB7_NTC5_NTD2_NTM0_NEPBS16_NLCA1_NLCB1_ONLL1_PGR1_PLR0_PKA1_SIA3_SS1_SU0_SUM0_SUS0_SPO1_SRVW0_SSO0_SVW4_SK3_SKXCCM0_TLDS2_ULSGRO0_USL1_UIOFGRO0_USFGRO0_VSn1_VWA4_VWB2_WSGRA0_WSGRB0_WS64_WG16_16_1_WGM0_WGMXCC8_WGMXCCGn1
    SolutionIndex: 24
    SolutionNameMin: Cijk_Ailk_Bljk_S_MX_B_Bias_HA_S_SAV_UserArgs_MT64x64x32_MI16x16x1_SN_LDSB1_AFC1_AFEM1_AFEM1_ASEM1_CLR0_CADS0_DTVA0_DTVB0_EPS0_FDSI0_GRPM1_GRVWA4_GRVWB4_GSU0_GSUAMB_GSUC0_GSUWGMRR0_GLS0_ISA950_IU1_K1_LBSPPA1024_LBSPPB256_LBSPPM0_LPA0_LPB8_LPM0_LRVW4_LWPMn1_MIAV1_MIWT4_2_MO40_NTn1_NTA1_NTB4_NTC6_NTD6_NTM0_NEPBS4_NLCA1_NLCB1_ONLL1_PGR2_PLR0_PKA1_SIA3_SS1_SU0_SUM0_SUS0_SPO0_SRVW0_SSO1_SVW4_SK3_SKXCCM0_TLDS1_ULSGRO0_USL1_UIOFGRO0_USFGRO0_VSn1_VWA4_VWB2_WSGRA0_WSGRB0_WS64_WG16_8_1_WGM0_WGMXCC4_WGMXCCGn1
    SolutionIndex: 25
    SolutionNameMin: Cijk_Ailk_Bljk_S_MX_B_Bias_HA_S_SAV_UserArgs_MT64x32x128_MI16x16x1_SN_LDSB0_AFC1_AFEM1_AFEM1_ASEM1_CLR1_CADS0_DTVA0_DTVB0_EPS0_FDSI0_GRPM1_GRVWA4_GRVWB4_GSU0_GSUAMB_GSUC0_GSUWGMRR0_GLS0_ISA950_IU1_K1_LBSPPA1024_LBSPPB1024_LBSPPM0_LPA0_LPB8_LPM0_LRVW4_LWPMn1_MIAV0_MIWT1_2_MO40_NTn1_NTA1_NTB5_NTC1_NTD4_NTM0_NEPBS14_NLCA1_NLCB1_ONLL1_PGR2_PLR1_PKA1_SIA3_SS1_SU0_SUM0_SUS0_SPO1_SRVW0_SSO1_SVW1_SK3_SKXCCM0_TLDS1_ULSGRO0_USL1_UIOFGRO0_USFGRO0_VSn1_VWA1_VWB2_WSGRA0_WSGRB0_WS64_WG64_4_1_WGM1_WGMXCC16_WGMXCCGn1
    SolutionIndex: 26
    SolutionNameMin: Cijk_Ailk_Bljk_S_MX_B_Bias_HA_S_SAV_UserArgs_MT64x32x64_MI16x16x1_SN_LDSB0_AFC1_AFEM1_AFEM1_ASEM1_CLR1_CADS0_DTVA0_DTVB0_EPS0_FDSI0_GRPM1_GRVWA4_GRVWB4_GSU0_GSUAMB_GSUC0_GSUWGMRR0_GLS0_ISA950_IU1_K1_LBSPPA1024_LBSPPB1024_LBSPPM0_LPA0_LPB8_LPM0_LRVW4_LWPMn1_MIAV0_MIWT1_2_MO40_NTn1_NTA3_NTB4_NTC1_NTD4_NTM0_NEPBS0_NLCA1_NLCB1_ONLL1_PGR2_PLR1_PKA1_SIA3_SS1_SU0_SUM0_SUS0_SPO1_SRVW0_SSO1_SVW1_SK3_SKXCCM0_TLDS1_ULSGRO0_USL1_UIOFGRO0_USFGRO0_VSn1_VWA1_VWB2_WSGRA0_WSGRB0_WS64_WG64_4_1_WGM1_WGMXCC16_WGMXCCGn1
    SolutionIndex: 27
    SolutionNameMin: Cijk_Ailk_Bljk_S_MX_B_Bias_HA_S_SAV_UserArgs_MT96x128x32_MI32x32x1_SN_LDSB0_AFC1_AFEM1_AFEM1_ASEM1_CLR1_CADS0_DTVA0_DTVB0_EPS1_FDSI0_GRPM1_GRVWA1_GRVWB4_GSU0_GSUAMB_GSUC0_GSUWGMRR0_GLS0_ISA950_IU1_K1_LBSPPA0_LBSPPB128_LBSPPM0_LPA0_LPB4_LPM0_LRVW4_LWPMn1_MIAV0_MIWT3_1_MO40_NTn1_NTA0_NTB5_NTC1_NTD4_NTM0_NEPBS0_NLCA3_NLCB1_ONLL1_PGR1_PLR1_PKA1_SIA3_SS1_SU0_SUM0_SUS0_SPO0_SRVW0_SSO0_SVW1_SK3_SKXCCM0_TLDS1_ULSGRO0_USL1_UIOFGRO0_USFGRO0_VSn1_VWA1_VWB1_WSGRA0_WSGRB0_WS64_WG32_8_1_WGM0_WGMXCC16_WGMXCCGn1
    SolutionIndex: 28
    SolutionNameMin: Cijk_Ailk_Bljk_S_MX_B_Bias_HA_S_SAV_UserArgs_MT32x64x64_MI16x16x1_SN_LDSB0_AFC1_AFEM1_AFEM1_ASEM1_CLR1_CADS0_DTVA0_DTVB0_EPS0_FDSI0_GRPM1_GRVWA1_GRVWB4_GSU0_GSUAMB_GSUC0_GSUWGMRR0_GLS0_ISA950_IU1_K1_LBSPPA512_LBSPPB1024_LBSPPM0_LPA0_LPB8_LPM0_LRVW4_LWPMn1_MIAV0_MIWT1_2_MO40_NTn1_NTA3_NTB5_NTC7_NTD1_NTM0_NEPBS16_NLCA1_NLCB1_ONLL1_PGR2_PLR1_PKA1_SIA3_SS1_SU8_SUM0_SUS256_SPO1_SRVW0_SSO0_SVW1_SK3_SKXCCM0_TLDS1_ULSGRO0_USL1_UIOFGRO0_USFGRO0_VSn1_VWA1_VWB2_WSGRA0_WSGRB0_WS64_WG32_8_1_WGM0_WGMXCC32_WGMXCCGn1
    SolutionIndex: 29
    SolutionNameMin: Cijk_Ailk_Bljk_S_MX_B_Bias_HA_S_SAV_UserArgs_MT32x64x64_MI16x16x1_SN_LDSB0_AFC1_AFEM1_AFEM1_ASEM1_CLR1_CADS0_DTVA0_DTVB0_EPS0_FDSI0_GRPM1_GRVWA1_GRVWB4_GSU0_GSUAMB_GSUC0_GSUWGMRR0_GLS0_ISA950_IU1_K1_LBSPPA512_LBSPPB1024_LBSPPM0_LPA0_LPB8_LPM0_LRVW4_LWPMn1_MIAV0_MIWT1_2_MO40_NTn1_NTA3_NTB5_NTC6_NTD1_NTM0_NEPBS8_NLCA1_NLCB1_ONLL1_PGR2_PLR1_PKA1_SIA3_SS1_SU0_SUM0_SUS0_SPO1_SRVW0_SSO0_SVW1_SK3_SKXCCM0_TLDS1_ULSGRO0_USL1_UIOFGRO0_USFGRO0_VSn1_VWA1_VWB2_WSGRA0_WSGRB0_WS64_WG32_8_1_WGM1_WGMXCC16_WGMXCCGn1
    SolutionIndex: 30
    SolutionNameMin: Cijk_Ailk_Bljk_S_MX_B_Bias_HA_S_SAV_UserArgs_MT64x64x128_MI16x16x1_SN_LDSB0_AFC1_AFEM1_AFEM1_ASEM1_CLR1_CADS0_DTVA0_DTVB0_EPS0_FDSI0_GRPM1_GRVWA1_GRVWB4_GSU0_GSUAMB_GSUC0_GSUWGMRR0_GLS0_ISA950_IU1_K1_LBSPPA1024_LBSPPB2048_LBSPPM0_LPA0_LPB8_LPM0_LRVW4_LWPMn1_MIAV0_MIWT2_4_MO40_NTn1_NTA3_NTB7_NTC2_NTD2_NTM0_NEPBS10_NLCA1_NLCB1_ONLL1_PGR2_PLR1_PKA1_SIA3_SS1_SU0_SUM0_SUS0_SPO1_SRVW0_SSO0_SVW2_SK3_SKXCCM0_TLDS1_ULSGRO0_USL1_UIOFGRO0_USFGRO0_VSn1_VWA2_VWB4_WSGRA0_WSGRB0_WS64_WG32_4_2_WGM0_WGMXCC16_WGMXCCGn1
    SolutionIndex: 31
    SolutionNameMin: Cijk_Ailk_Bljk_S_MX_B_Bias_HA_S_SAV_UserArgs_MT128x64x32_MI16x16x1_SN_LDSB1_AFC1_AFEM1_AFEM1_ASEM1_CLR0_CADS0_DTVA0_DTVB0_EPS0_FDSI0_GRPM1_GRVWA4_GRVWB4_GSU0_GSUAMB_GSUC0_GSUWGMRR0_GLS0_ISA950_IU1_K1_LBSPPA2048_LBSPPB256_LBSPPM0_LPA0_LPB8_LPM0_LRVW4_LWPMn1_MIAV0_MIWT4_2_MO40_NTn1_NTA0_NTB3_NTC7_NTD7_NTM0_NEPBS4_NLCA1_NLCB1_ONLL1_PGR2_PLR0_PKA1_SIA3_SS1_SU0_SUM0_SUS0_SPO1_SRVW0_SSO1_SVW4_SK3_SKXCCM0_TLDS1_ULSGRO0_USL1_UIOFGRO0_USFGRO0_VSn1_VWA4_VWB2_WSGRA0_WSGRB0_WS64_WG32_8_1_WGM1_WGMXCC2_WGMXCCGn1
    SolutionIndex: 32
    SolutionNameMin: Cijk_Ailk_Bljk_S_MX_B_Bias_HA_S_SAV_UserArgs_MT32x128x32_MI32x32x1_SN_LDSB1_AFC1_AFEM1_AFEM1_ASEM1_CLR1_CADS0_DTVA0_DTVB0_EPS1_FDSI0_GRPM1_GRVWA1_GRVWB4_GSU0_GSUAMB_GSUC0_GSUWGMRR0_GLS0_ISA950_IU1_K1_LBSPPA128_LBSPPB128_LBSPPM0_LPA4_LPB4_LPM0_LRVW4_LWPMn1_MIAV1_MIWT1_1_MO40_NTn1_NTA0_NTB1_NTC6_NTD7_NTM0_NEPBS8_NLCA1_NLCB1_ONLL1_PGR1_PLR1_PKA1_SIA3_SS1_SU0_SUM0_SUS0_SPO0_SRVW0_SSO4_SVW1_SK3_SKXCCM0_TLDS2_ULSGRO0_USL1_UIOFGRO0_USFGRO0_VSn1_VWA1_VWB1_WSGRA0_WSGRB0_WS64_WG32_8_1_WGM1_WGMXCC32_WGMXCCGn1
    SolutionIndex: 33
    SolutionNameMin: Cijk_Ailk_Bljk_S_MX_B_Bias_HA_S_SAV_UserArgs_MT48x64x64_MI16x16x1_SN_LDSB1_AFC1_AFEM1_AFEM1_ASEM1_CLR0_CADS0_DTVA0_DTVB0_EPS0_FDSI0_GRPM1_GRVWA4_GRVWB4_GSU0_GSUAMB_GSUC0_GSUWGMRR0_GLS0_ISA950_IU1_K1_LBSPPA768_LBSPPB256_LBSPPM0_LPA16_LPB8_LPM0_LRVW4_LWPMn1_MIAV0_MIWT3_1_MO40_NTn1_NTA0_NTB2_NTC0_NTD1_NTM0_NEPBS12_NLCA3_NLCB1_ONLL1_PGR2_PLR1_PKA1_SIA3_SS1_SU0_SUM0_SUS0_SPO0_SRVW0_SSO0_SVW1_SK3_SKXCCM0_TLDS1_ULSGRO0_USL1_UIOFGRO0_USFGRO0_VSn1_VWA1_VWB1_WSGRA0_WSGRB0_WS64_WG16_16_1_WGM1_WGMXCC32_WGMXCCGn1
    SolutionIndex: 34
    SolutionNameMin: Cijk_Ailk_Bljk_S_MX_B_Bias_HA_S_SAV_UserArgs_MT48x64x64_MI16x16x1_SN_LDSB0_AFC1_AFEM1_AFEM1_ASEM1_CLR1_CADS0_DTVA0_DTVB0_EPS0_FDSI0_GRPM1_GRVWA4_GRVWB4_GSU0_GSUAMB_GSUC0_GSUWGMRR0_GLS0_ISA950_IU1_K1_LBSPPA768_LBSPPB1024_LBSPPM0_LPA16_LPB8_LPM0_LRVW4_LWPMn1_MIAV0_MIWT3_1_MO40_NTn1_NTA0_NTB3_NTC0_NTD0_NTM0_NEPBS16_NLCA3_NLCB1_ONLL1_PGR2_PLR1_PKA1_SIA3_SS1_SU0_SUM0_SUS0_SPO0_SRVW0_SSO0_SVW1_SK3_SKXCCM0_TLDS1_ULSGRO0_USL1_UIOFGRO0_USFGRO0_VSn1_VWA1_VWB1_WSGRA0_WSGRB0_WS64_WG16_16_1_WGM1_WGMXCC16_WGMXCCGn1
    SolutionIndex: 35
    SolutionNameMin: Cijk_Ailk_Bljk_S_MX_B_Bias_HA_S_SAV_UserArgs_MT192x128x32_MI32x32x1_SN_LDSB1_AFC1_AFEM1_AFEM1_ASEM1_CLR1_CADS0_DTVA0_DTVB0_EPS0_FDSI0_GRPM1_GRVWA4_GRVWB4_GSU0_GSUAMB_GSUC0_GSUWGMRR0_GLS0_ISA950_IU1_K1_LBSPPA0_LBSPPB256_LBSPPM0_LPA0_LPB4_LPM0_LRVW4_LWPMn1_MIAV0_MIWT3_2_MO40_NTn1_NTA1_NTB0_NTC7_NTD7_NTM0_NEPBS0_NLCA3_NLCB1_ONLL1_PGR2_PLR1_PKA1_SIA3_SS1_SU0_SUM0_SUS0_SPO1_SRVW0_SSO4_SVW1_SK3_SKXCCM0_TLDS1_ULSGRO0_USL1_UIOFGRO0_USFGRO0_VSn1_VWA1_VWB2_WSGRA0_WSGRB0_WS64_WG64_4_1_WGM0_WGMXCC8_WGMXCCGn1
    SolutionIndex: 36
    SolutionNameMin: Cijk_Ailk_Bljk_S_MX_B_Bias_HA_S_SAV_UserArgs_MT192x128x32_MI32x32x1_SN_LDSB1_AFC1_AFEM1_AFEM1_ASEM1_CLR1_CADS0_DTVA0_DTVB0_EPS1_FDSI0_GRPM1_GRVWA4_GRVWB4_GSU0_GSUAMB_GSUC0_GSUWGMRR0_GLS0_ISA950_IU1_K1_LBSPPA0_LBSPPB256_LBSPPM0_LPA0_LPB4_LPM0_LRVW4_LWPMn1_MIAV0_MIWT3_2_MO40_NTn1_NTA0_NTB1_NTC4_NTD4_NTM0_NEPBS0_NLCA3_NLCB1_ONLL1_PGR1_PLR1_PKA1_SIA3_SS1_SU0_SUM0_SUS0_SPO1_SRVW0_SSO0_SVW1_SK3_SKXCCM0_TLDS1_ULSGRO0_USL1_UIOFGRO0_USFGRO0_VSn1_VWA1_VWB2_WSGRA0_WSGRB0_WS64_WG64_4_1_WGM1_WGMXCC4_WGMXCCGn1
    SolutionIndex: 37
    SolutionNameMin: Cijk_Ailk_Bljk_S_MX_B_Bias_HA_S_SAV_UserArgs_MT128x160x32_MI32x32x1_SN_LDSB1_AFC1_AFEM1_AFEM1_ASEM1_CLR1_CADS0_DTVA0_DTVB0_EPS1_FDSI0_GRPM1_GRVWA4_GRVWB4_GSU0_GSUAMB_GSUC0_GSUWGMRR0_GLS0_ISA950_IU1_K1_LBSPPA0_LBSPPB128_LBSPPM0_LPA0_LPB4_LPM0_LRVW4_LWPMn1_MIAV1_MIWT1_5_MO40_NTn1_NTA2_NTB0_NTC6_NTD5_NTM0_NEPBS0_NLCA1_NLCB1_ONLL1_PGR1_PLR1_PKA1_SIA3_SS1_SU0_SUM0_SUS0_SPO0_SRVW0_SSO0_SVW1_SK3_SKXCCM0_TLDS1_ULSGRO0_USL1_UIOFGRO0_USFGRO0_VSn1_VWA1_VWB1_WSGRA0_WSGRB0_WS64_WG128_2_1_WGM32_WGMXCC1_WGMXCCGn1
    SolutionIndex: 38
    SolutionNameMin: Cijk_Ailk_Bljk_S_MX_B_Bias_HA_S_SAV_UserArgs_MT64x128x32_MI32x32x1_SN_LDSB1_AFC1_AFEM1_AFEM1_ASEM1_CLR1_CADS0_DTVA0_DTVB0_EPS0_FDSI0_GRPM1_GRVWA4_GRVWB4_GSU0_GSUAMB_GSUC0_GSUWGMRR0_GLS0_ISA950_IU1_K1_LBSPPA0_LBSPPB256_LBSPPM0_LPA0_LPB4_LPM0_LRVW4_LWPMn1_MIAV1_MIWT1_2_MO40_NTn1_NTA1_NTB0_NTC4_NTD7_NTM0_NEPBS16_NLCA1_NLCB1_ONLL1_PGR2_PLR1_PKA1_SIA3_SS1_SU16_SUM0_SUS128_SPO0_SRVW0_SSO0_SVW1_SK3_SKXCCM0_TLDS1_ULSGRO0_USL1_UIOFGRO0_USFGRO0_VSn1_VWA1_VWB2_WSGRA0_WSGRB0_WS64_WG64_4_1_WGM0_WGMXCC32_WGMXCCGn1
    SolutionIndex: 39
    SolutionNameMin: Cijk_Ailk_Bljk_S_MX_B_Bias_HA_S_SAV_UserArgs_MT16x16x128_MI16x16x1_SN_LDSB0_AFC1_AFEM1_AFEM1_ASEM1_CLR1_CADS0_DTVA0_DTVB0_EPS0_FDSI0_GRPM1_GRVWA4_GRVWB4_GSU0_GSUAMB_GSUC0_GSUWGMRR0_GLS0_ISA950_IU1_K1_LBSPPA1024_LBSPPB1024_LBSPPM0_LPA0_LPB8_LPM0_LRVW4_LWPMn1_MIAV1_MIWT1_1_MO40_NTn1_NTA4_NTB3_NTC3_NTD0_NTM0_NEPBS16_NLCA1_NLCB1_ONLL1_PGR2_PLR1_PKA1_SIA3_SS1_SU8_SUM0_SUS512_SPO1_SRVW0_SSO0_SVW1_SK3_SKXCCM0_TLDS1_ULSGRO0_USL1_UIOFGRO0_USFGRO0_VSn1_VWA1_VWB1_WSGRA0_WSGRB0_WS64_WG16_4_2_WGM1_WGMXCC8_WGMXCCGn1
    SolutionIndex: 40
    SolutionNameMin: Cijk_Ailk_Bljk_S_MX_B_Bias_HA_S_SAV_UserArgs_MT64x64x32_MI16x16x1_SN_LDSB0_AFC1_AFEM1_AFEM1_ASEM1_CLR1_CADS0_DTVA0_DTVB0_EPS0_FDSI0_GRPM1_GRVWA1_GRVWB4_GSU0_GSUAMB_GSUC0_GSUWGMRR0_GLS0_ISA950_IU1_K1_LBSPPA1024_LBSPPB1024_LBSPPM0_LPA0_LPB8_LPM0_LRVW4_LWPMn1_MIAV0_MIWT2_2_MO40_NTn1_NTA3_NTB3_NTC6_NTD5_NTM0_NEPBS0_NLCA1_NLCB1_ONLL1_PGR2_PLR0_PKA1_SIA3_SS1_SU0_SUM0_SUS0_SPO1_SRVW0_SSO0_SVW2_SK3_SKXCCM0_TLDS1_ULSGRO0_USL1_UIOFGRO0_USFGRO0_VSn1_VWA2_VWB2_WSGRA0_WSGRB0_WS64_WG32_8_1_WGM1_WGMXCC8_WGMXCCGn1
    SolutionIndex: 41
    SolutionNameMin: Cijk_Ailk_Bljk_S_MX_B_Bias_HA_S_SAV_UserArgs_MT64x64x32_MI32x32x1_SN_LDSB0_AFC1_AFEM1_AFEM1_ASEM1_CLR1_CADS0_DTVA0_DTVB0_EPS0_FDSI0_GRPM1_GRVWA1_GRVWB4_GSU0_GSUAMB_GSUC0_GSUWGMRR0_GLS0_ISA950_IU1_K1_LBSPPA0_LBSPPB1024_LBSPPM0_LPA0_LPB4_LPM0_LRVW4_LWPMn1_MIAV0_MIWT1_1_MO40_NTn1_NTA2_NTB0_NTC6_NTD5_NTM0_NEPBS0_NLCA1_NLCB1_ONLL1_PGR2_PLR1_PKA1_SIA3_SS1_SU0_SUM0_SUS0_SPO1_SRVW0_SSO0_SVW1_SK3_SKXCCM0_TLDS1_ULSGRO0_USL1_UIOFGRO0_USFGRO0_VSn1_VWA1_VWB1_WSGRA0_WSGRB0_WS64_WG64_4_1_WGM1_WGMXCC8_WGMXCCGn1
    SolutionIndex: 42
    SolutionNameMin: Cijk_Ailk_Bljk_S_MX_B_Bias_HA_S_SAV_UserArgs_MT64x64x32_MI32x32x1_SN_LDSB0_AFC1_AFEM1_AFEM1_ASEM1_CLR1_CADS0_DTVA0_DTVB0_EPS0_FDSI0_GRPM1_GRVWA4_GRVWB4_GSU0_GSUAMB_GSUC0_GSUWGMRR0_GLS0_ISA950_IU1_K1_LBSPPA0_LBSPPB1024_LBSPPM0_LPA0_LPB4_LPM0_LRVW4_LWPMn1_MIAV0_MIWT1_1_MO40_NTn1_NTA2_NTB0_NTC7_NTD5_NTM0_NEPBS16_NLCA1_NLCB1_ONLL1_PGR2_PLR1_PKA1_SIA3_SS1_SU0_SUM0_SUS0_SPO1_SRVW0_SSO0_SVW1_SK3_SKXCCM0_TLDS1_ULSGRO0_USL1_UIOFGRO0_USFGRO0_VSn1_VWA1_VWB1_WSGRA0_WSGRB0_WS64_WG64_4_1_WGM0_WGMXCC8_WGMXCCGn1
    SolutionIndex: 43
    SolutionNameMin: Cijk_Ailk_Bljk_S_MX_B_Bias_HA_S_SAV_UserArgs_MT64x64x32_MI32x32x1_SN_LDSB0_AFC1_AFEM1_AFEM1_ASEM1_CLR1_CADS0_DTVA0_DTVB0_EPS0_FDSI0_GRPM1_GRVWA1_GRVWB4_GSU0_GSUAMB_GSUC0_GSUWGMRR0_GLS0_ISA950_IU1_K1_LBSPPA0_LBSPPB1024_LBSPPM0_LPA0_LPB4_LPM0_LRVW4_LWPMn1_MIAV0_MIWT1_1_MO40_NTn1_NTA2_NTB0_NTC5_NTD4_NTM0_NEPBS16_NLCA1_NLCB1_ONLL1_PGR2_PLR1_PKA1_SIA3_SS1_SU8_SUM0_SUS128_SPO1_SRVW0_SSO0_SVW1_SK3_SKXCCM0_TLDS1_ULSGRO0_USL1_UIOFGRO0_USFGRO0_VSn1_VWA1_VWB1_WSGRA0_WSGRB0_WS64_WG64_4_1_WGM1_WGMXCC4_WGMXCCGn1
    SolutionIndex: 44
    SolutionNameMin: Cijk_Ailk_Bljk_S_MX_B_Bias_HA_S_SAV_UserArgs_MT64x64x64_MI32x32x1_SN_LDSB0_AFC1_AFEM1_AFEM1_ASEM1_CLR1_CADS0_DTVA0_DTVB0_EPS0_FDSI0_GRPM1_GRVWA1_GRVWB4_GSU0_GSUAMB_GSUC0_GSUWGMRR0_GLS0_ISA950_IU1_K1_LBSPPA0_LBSPPB1024_LBSPPM0_LPA0_LPB4_LPM0_LRVW4_LWPMn1_MIAV0_MIWT1_1_MO40_NTn1_NTA0_NTB7_NTC7_NTD0_NTM0_NEPBS16_NLCA1_NLCB1_ONLL1_PGR2_PLR1_PKA1_SIA3_SS1_SU0_SUM0_SUS0_SPO1_SRVW0_SSO0_SVW1_SK3_SKXCCM0_TLDS1_ULSGRO0_USL1_UIOFGRO0_USFGRO0_VSn1_VWA1_VWB1_WSGRA0_WSGRB0_WS64_WG64_4_1_WGM0_WGMXCC16_WGMXCCGn1
    SolutionIndex: 45
    SolutionNameMin: Cijk_Ailk_Bljk_S_MX_B_Bias_HA_S_SAV_UserArgs_MT128x128x64_MI32x32x1_SN_LDSB0_AFC1_AFEM1_AFEM1_ASEM1_CLR0_CADS0_DTVA0_DTVB0_EPS0_FDSI0_GRPM1_GRVWA1_GRVWB4_GSU0_GSUAMB_GSUC0_GSUWGMRR0_GLS0_ISA950_IU1_K1_LBSPPA512_LBSPPB512_LBSPPM0_LPA4_LPB4_LPM0_LRVW4_LWPMn1_MIAV1_MIWT2_2_MO40_NTn1_NTA3_NTB7_NTC2_NTD3_NTM0_NEPBS0_NLCA1_NLCB1_ONLL1_PGR2_PLR1_PKA1_SIA3_SS1_SU8_SUM0_SUS256_SPO1_SRVW0_SSO1_SVW2_SK3_SKXCCM8_TLDS2_ULSGRO0_USL1_UIOFGRO0_USFGRO0_VSn1_VWA2_VWB2_WSGRA0_WSGRB0_WS64_WG64_4_1_WGM48_WGMXCC16_WGMXCCGn1
    SolutionIndex: 46
    SolutionNameMin: Cijk_Ailk_Bljk_S_MX_B_Bias_HA_S_SAV_UserArgs_MT96x128x32_MI32x32x1_SN_LDSB1_AFC1_AFEM1_AFEM1_ASEM1_CLR1_CADS0_DTVA0_DTVB0_EPS1_FDSI0_GRPM1_GRVWA4_GRVWB4_GSU0_GSUAMB_GSUC0_GSUWGMRR0_GLS0_ISA950_IU1_K1_LBSPPA128_LBSPPB128_LBSPPM0_LPA4_LPB4_LPM0_LRVW4_LWPMn1_MIAV0_MIWT3_1_MO40_NTn1_NTA0_NTB1_NTC6_NTD7_NTM0_NEPBS0_NLCA3_NLCB1_ONLL1_PGR1_PLR1_PKA1_SIA3_SS1_SU8_SUM0_SUS512_SPO0_SRVW0_SSO1_SVW1_SK3_SKXCCM0_TLDS2_ULSGRO0_USL1_UIOFGRO0_USFGRO0_VSn1_VWA1_VWB1_WSGRA0_WSGRB0_WS64_WG32_8_1_WGM4_WGMXCC2_WGMXCCGn1
    SolutionIndex: 47
    SolutionNameMin: Cijk_Ailk_Bljk_S_MX_B_Bias_HA_S_SAV_UserArgs_MT16x16x128_MI16x16x1_SN_LDSB0_AFC1_AFEM1_AFEM1_ASEM1_CLR1_CADS0_DTVA0_DTVB0_EPS0_FDSI0_GRPM1_GRVWA4_GRVWB4_GSU0_GSUAMB_GSUC0_GSUWGMRR0_GLS0_ISA950_IU1_K1_LBSPPA1024_LBSPPB1024_LBSPPM0_LPA0_LPB8_LPM0_LRVW4_LWPMn1_MIAV0_MIWT1_1_MO40_NTn1_NTA6_NTB1_NTC0_NTD1_NTM0_NEPBS2_NLCA1_NLCB1_ONLL1_PGR2_PLR1_PKA1_SIA3_SS1_SU8_SUM0_SUS512_SPO1_SRVW0_SSO0_SVW1_SK3_SKXCCM0_TLDS1_ULSGRO0_USL1_UIOFGRO0_USFGRO0_VSn1_VWA1_VWB1_WSGRA0_WSGRB0_WS64_WG16_4_2_WGM0_WGMXCC16_WGMXCCGn1
    SolutionIndex: 48
    SolutionNameMin: Cijk_Ailk_Bljk_S_MX_B_Bias_HA_S_SAV_UserArgs_MT64x128x32_MI32x32x1_SN_LDSB0_AFC1_AFEM1_AFEM1_ASEM1_CLR1_CADS0_DTVA0_DTVB0_EPS0_FDSI0_GRPM1_GRVWA1_GRVWB4_GSU0_GSUAMB_GSUC0_GSUWGMRR0_GLS0_ISA950_IU1_K1_LBSPPA0_LBSPPB256_LBSPPM0_LPA0_LPB4_LPM0_LRVW4_LWPMn1_MIAV0_MIWT1_2_MO40_NTn1_NTA1_NTB2_NTC5_NTD0_NTM0_NEPBS0_NLCA1_NLCB1_ONLL1_PGR2_PLR1_PKA1_SIA3_SS1_SU0_SUM0_SUS0_SPO1_SRVW0_SSO0_SVW1_SK3_SKXCCM0_TLDS1_ULSGRO0_USL1_UIOFGRO0_USFGRO0_VSn1_VWA1_VWB2_WSGRA0_WSGRB0_WS64_WG64_4_1_WGM0_WGMXCC4_WGMXCCGn1
    SolutionIndex: 49
    SolutionNameMin: Cijk_Ailk_Bljk_S_MX_B_Bias_HA_S_SAV_UserArgs_MT128x64x32_MI32x32x1_SN_LDSB0_AFC1_AFEM1_AFEM1_ASEM1_CLR1_CADS0_DTVA0_DTVB0_EPS0_FDSI0_GRPM1_GRVWA4_GRVWB4_GSU0_GSUAMB_GSUC0_GSUWGMRR0_GLS0_ISA950_IU1_K1_LBSPPA0_LBSPPB256_LBSPPM0_LPA0_LPB4_LPM0_LRVW4_LWPMn1_MIAV0_MIWT1_2_MO40_NTn1_NTA0_NTB2_NTC5_NTD4_NTM0_NEPBS0_NLCA1_NLCB1_ONLL1_PGR2_PLR1_PKA1_SIA3_SS1_SU0_SUM0_SUS0_SPO0_SRVW0_SSO0_SVW1_SK3_SKXCCM0_TLDS1_ULSGRO0_USL1_UIOFGRO0_USFGRO0_VSn1_VWA1_VWB2_WSGRA0_WSGRB0_WS64_WG128_2_1_WGM0_WGMXCC32_WGMXCCGn1
    SolutionIndex: 50
    SolutionNameMin: Cijk_Ailk_Bljk_S_MX_B_Bias_HA_S_SAV_UserArgs_MT128x64x64_MI32x32x1_SN_LDSB0_AFC1_AFEM1_AFEM1_ASEM1_CLR1_CADS0_DTVA0_DTVB0_EPS0_FDSI0_GRPM1_GRVWA4_GRVWB4_GSU0_GSUAMB_GSUC0_GSUWGMRR0_GLS0_ISA950_IU1_K1_LBSPPA0_LBSPPB1024_LBSPPM0_LPA0_LPB4_LPM0_LRVW4_LWPMn1_MIAV0_MIWT1_2_MO40_NTn1_NTA2_NTB6_NTC4_NTD6_NTM0_NEPBS0_NLCA1_NLCB1_ONLL1_PGR2_PLR1_PKA1_SIA3_SS1_SU0_SUM0_SUS0_SPO1_SRVW0_SSO0_SVW1_SK3_SKXCCM8_TLDS1_ULSGRO0_USL1_UIOFGRO0_USFGRO0_VSn1_VWA1_VWB2_WSGRA0_WSGRB0_WS64_WG128_2_1_WGM0_WGMXCC4_WGMXCCGn1
    SolutionIndex: 51
    SolutionNameMin: Cijk_Ailk_Bljk_S_MX_B_Bias_HA_S_SAV_UserArgs_MT128x128x64_MI32x32x1_SN_LDSB0_AFC1_AFEM1_AFEM1_ASEM1_CLR1_CADS0_DTVA0_DTVB0_EPS0_FDSI0_GRPM1_GRVWA4_GRVWB4_GSU0_GSUAMB_GSUC0_GSUWGMRR0_GLS0_ISA950_IU1_K1_LBSPPA0_LBSPPB1024_LBSPPM0_LPA0_LPB4_LPM0_LRVW4_LWPMn1_MIAV0_MIWT1_4_MO40_NTn1_NTA0_NTB3_NTC7_NTD2_NTM0_NEPBS0_NLCA1_NLCB1_ONLL1_PGR2_PLR1_PKA1_SIA3_SS1_SU16_SUM0_SUS256_SPO1_SRVW0_SSO0_SVW1_SK3_SKXCCM0_TLDS1_ULSGRO0_USL1_UIOFGRO0_USFGRO0_VSn1_VWA1_VWB4_WSGRA0_WSGRB0_WS64_WG128_2_1_WGM1_WGMXCC16_WGMXCCGn1
    SolutionIndex: 52
    SolutionNameMin: Cijk_Ailk_Bljk_S_MX_B_Bias_HA_S_SAV_UserArgs_MT128x256x32_MI32x32x1_SN_LDSB1_AFC1_AFEM1_AFEM1_ASEM1_CLR1_CADS0_DTVA0_DTVB0_EPS0_FDSI0_GRPM1_GRVWA2_GRVWB4_GSU0_GSUAMB_GSUC0_GSUWGMRR0_GLS0_ISA950_IU1_K1_LBSPPA512_LBSPPB256_LBSPPM0_LPA4_LPB4_LPM0_LRVW4_LWPMn1_MIAV0_MIWT4_2_MO40_NTn1_NTA2_NTB4_NTC3_NTD0_NTM0_NEPBS16_NLCA1_NLCB1_ONLL1_PGR2_PLR1_PKA1_SIA3_SS1_SU8_SUM0_SUS256_SPO1_SRVW0_SSO0_SVW4_SK3_SKXCCM8_TLDS2_ULSGRO0_USL1_UIOFGRO0_USFGRO0_VSn1_VWA4_VWB2_WSGRA0_WSGRB0_WS64_WG32_8_1_WGM32_WGMXCC16_WGMXCCGn1
    SolutionIndex: 53
    SolutionNameMin: Cijk_Ailk_Bljk_S_MX_B_Bias_HA_S_SAV_UserArgs_MT256x256x32_MI16x16x1_SN_LDSB0_AFC1_AFEM1_AFEM1_ASEM1_CLR0_CADS0_DTVA0_DTVB0_EPS0_FDSI0_GRPM1_GRVWA1_GRVWB4_GSU0_GSUAMB_GSUC0_GSUWGMRR0_GLS0_ISA950_IU1_K1_LBSPPA512_LBSPPB512_LBSPPM0_LPA8_LPB8_LPM0_LRVW4_LWPMn1_MIAV0_MIWT8_8_MO40_NTn1_NTA3_NTB4_NTC1_NTD2_NTM0_NEPBS0_NLCA1_NLCB1_ONLL1_PGR2_PLR0_PKA1_SIA3_SS1_SU8_SUM0_SUS256_SPO0_SRVW0_SSO0_SVW4_SK3_SKXCCM8_TLDS2_ULSGRO0_USL1_UIOFGRO0_USFGRO0_VSn1_VWA4_VWB4_WSGRA0_WSGRB0_WS64_WG32_8_1_WGM48_WGMXCC2_WGMXCCGn1
    SolutionIndex: 54
    SolutionNameMin: Cijk_Ailk_Bljk_S_MX_B_Bias_HA_S_SAV_UserArgs_MT128x128x32_MI32x32x1_SN_LDSB1_AFC1_AFEM1_AFEM1_ASEM1_CLR0_CADS0_DTVA0_DTVB0_EPS0_FDSI0_GRPM1_GRVWA4_GRVWB4_GSU0_GSUAMB_GSUC0_GSUWGMRR0_GLS0_ISA950_IU1_K1_LBSPPA0_LBSPPB512_LBSPPM0_LPA0_LPB4_LPM0_LRVW4_LWPMn1_MIAV0_MIWT1_4_MO40_NTn1_NTA3_NTB1_NTC5_NTD7_NTM0_NEPBS0_NLCA1_NLCB1_ONLL1_PGR2_PLR1_PKA1_SIA3_SS1_SU0_SUM0_SUS0_SPO1_SRVW0_SSO0_SVW1_SK3_SKXCCM0_TLDS1_ULSGRO0_USL1_UIOFGRO0_USFGRO0_VSn1_VWA1_VWB4_WSGRA0_WSGRB0_WS64_WG128_2_1_WGM0_WGMXCC4_WGMXCCGn1
    SolutionIndex: 55
    SolutionNameMin: Cijk_Ailk_Bljk_S_MX_B_Bias_HA_S_SAV_UserArgs_MT96x320x32_MI16x16x1_SN_LDSB0_AFC1_AFEM1_AFEM1_ASEM1_CLR0_CADS0_DTVA0_DTVB0_EPS0_FDSI0_GRPM1_GRVWA1_GRVWB4_GSU0_GSUAMB_GSUC0_GSUWGMRR0_GLS0_ISA950_IU1_K1_LBSPPA256_LBSPPB128_LBSPPM0_LPA8_LPB8_LPM0_LRVW4_LWPMn1_MIAV0_MIWT6_5_MO40_NTn1_NTA0_NTB0_NTC6_NTD3_NTM0_NEPBS16_NLCA3_NLCB1_ONLL1_PGR2_PLR0_PKA1_SIA3_SS1_SU8_SUM0_SUS128_SPO1_SRVW0_SSO1_SVW2_SK3_SKXCCM8_TLDS2_ULSGRO0_USL1_UIOFGRO0_USFGRO0_VSn1_VWA2_VWB1_WSGRA0_WSGRB0_WS64_WG16_16_1_WGM2_WGMXCC2_WGMXCCGn1
    SolutionIndex: 56
    SolutionNameMin: Cijk_Ailk_Bljk_S_MX_B_Bias_HA_S_SAV_UserArgs_MT128x128x32_MI32x32x1_SN_LDSB1_AFC1_AFEM1_AFEM1_ASEM1_CLR1_CADS0_DTVA0_DTVB0_EPS1_FDSI0_GRPM1_GRVWA4_GRVWB4_GSU0_GSUAMB_GSUC0_GSUWGMRR0_GLS0_ISA950_IU1_K1_LBSPPA0_LBSPPB512_LBSPPM0_LPA0_LPB4_LPM0_LRVW4_LWPMn1_MIAV0_MIWT1_4_MO40_NTn1_NTA2_NTB1_NTC4_NTD5_NTM0_NEPBS0_NLCA1_NLCB1_ONLL1_PGR1_PLR1_PKA1_SIA3_SS1_SU0_SUM0_SUS0_SPO1_SRVW0_SSO1_SVW1_SK3_SKXCCM0_TLDS1_ULSGRO0_USL1_UIOFGRO0_USFGRO0_VSn1_VWA1_VWB4_WSGRA0_WSGRB0_WS64_WG128_2_1_WGM1_WGMXCC4_WGMXCCGn1
    SolutionIndex: 57
    SolutionNameMin: Cijk_Ailk_Bljk_S_MX_B_Bias_HA_S_SAV_UserArgs_MT128x64x32_MI16x16x1_SN_LDSB1_AFC1_AFEM1_AFEM1_ASEM1_CLR0_CADS0_DTVA0_DTVB0_EPS1_FDSI0_GRPM1_GRVWA4_GRVWB4_GSU0_GSUAMB_GSUC0_GSUWGMRR0_GLS0_ISA950_IU1_K1_LBSPPA2048_LBSPPB512_LBSPPM0_LPA0_LPB8_LPM0_LRVW4_LWPMn1_MIAV0_MIWT2_4_MO40_NTn1_NTA1_NTB1_NTC5_NTD7_NTM0_NEPBS16_NLCA1_NLCB1_ONLL1_PGR1_PLR0_PKA1_SIA3_SS1_SU0_SUM0_SUS0_SPO1_SRVW0_SSO1_SVW2_SK3_SKXCCM0_TLDS1_ULSGRO0_USL1_UIOFGRO0_USFGRO0_VSn1_VWA2_VWB4_WSGRA0_WSGRB0_WS64_WG64_4_1_WGM0_WGMXCC2_WGMXCCGn1
    SolutionIndex: 58
    SolutionNameMin: Cijk_Ailk_Bljk_S_MX_B_Bias_HA_S_SAV_UserArgs_MT128x64x32_MI32x32x1_SN_LDSB1_AFC1_AFEM1_AFEM1_ASEM1_CLR0_CADS0_DTVA0_DTVB0_EPS0_FDSI0_GRPM1_GRVWA4_GRVWB4_GSU0_GSUAMB_GSUC0_GSUWGMRR0_GLS0_ISA950_IU1_K1_LBSPPA0_LBSPPB256_LBSPPM0_LPA0_LPB4_LPM0_LRVW4_LWPMn1_MIAV0_MIWT1_2_MO40_NTn1_NTA1_NTB0_NTC6_NTD7_NTM0_NEPBS16_NLCA1_NLCB1_ONLL1_PGR2_PLR1_PKA1_SIA3_SS1_SU0_SUM0_SUS0_SPO0_SRVW0_SSO4_SVW1_SK3_SKXCCM0_TLDS1_ULSGRO0_USL1_UIOFGRO0_USFGRO0_VSn1_VWA1_VWB2_WSGRA0_WSGRB0_WS64_WG128_2_1_WGM0_WGMXCC2_WGMXCCGn1
    SolutionIndex: 59
    SolutionNameMin: Cijk_Ailk_Bljk_S_MX_B_Bias_HA_S_SAV_UserArgs_MT128x128x32_MI32x32x1_SN_LDSB1_AFC1_AFEM1_AFEM1_ASEM1_CLR1_CADS0_DTVA0_DTVB0_EPS0_FDSI0_GRPM1_GRVWA4_GRVWB4_GSU0_GSUAMB_GSUC0_GSUWGMRR0_GLS0_ISA950_IU1_K1_LBSPPA0_LBSPPB256_LBSPPM0_LPA0_LPB4_LPM0_LRVW4_LWPMn1_MIAV0_MIWT2_2_MO40_NTn1_NTA2_NTB1_NTC5_NTD6_NTM0_NEPBS12_NLCA1_NLCB1_ONLL1_PGR2_PLR1_PKA1_SIA3_SS1_SU0_SUM0_SUS0_SPO0_SRVW0_SSO0_SVW2_SK3_SKXCCM8_TLDS1_ULSGRO0_USL1_UIOFGRO0_USFGRO0_VSn1_VWA2_VWB2_WSGRA0_WSGRB0_WS64_WG64_4_1_WGM16_WGMXCC8_WGMXCCGn1
    SolutionIndex: 60
    SolutionNameMin: Cijk_Ailk_Bljk_S_MX_B_Bias_HA_S_SAV_UserArgs_MT256x256x32_MI16x16x1_SN_LDSB0_AFC1_AFEM1_AFEM1_ASEM1_CLR0_CADS0_DTVA0_DTVB0_EPS0_FDSI0_GRPM1_GRVWA1_GRVWB4_GSU0_GSUAMB_GSUC0_GSUWGMRR0_GLS0_ISA950_IU1_K1_LBSPPA512_LBSPPB512_LBSPPM0_LPA8_LPB8_LPM0_LRVW4_LWPMn1_MIAV0_MIWT8_8_MO40_NTn1_NTA2_NTB1_NTC6_NTD2_NTM0_NEPBS16_NLCA1_NLCB1_ONLL1_PGR2_PLR0_PKA1_SIA3_SS1_SU8_SUM0_SUS256_SPO0_SRVW0_SSO1_SVW4_SK3_SKXCCM0_TLDS2_ULSGRO0_USL1_UIOFGRO0_USFGRO0_VSn1_VWA4_VWB4_WSGRA0_WSGRB0_WS64_WG32_8_1_WGM32_WGMXCC32_WGMXCCGn1
    SolutionIndex: 61
    SolutionNameMin: Cijk_Ailk_Bljk_S_MX_B_Bias_HA_S_SAV_UserArgs_MT144x256x32_MI16x16x1_SN_LDSB0_AFC1_AFEM1_AFEM1_ASEM1_CLR0_CADS0_DTVA0_DTVB0_EPS0_FDSI0_GRPM1_GRVWA1_GRVWB1_GSU0_GSUAMB_GSUC0_GSUWGMRR0_GLS0_ISA950_IU1_K1_LBSPPA128_LBSPPB512_LBSPPM0_LPA8_LPB8_LPM0_LRVW4_LWPMn1_MIAV0_MIWT9_4_MO40_NTn1_NTA1_NTB1_NTC0_NTD0_NTM0_NEPBS0_NLCA9_NLCB1_ONLL1_PGR2_PLR0_PKA1_SIA3_SS1_SU0_SUM0_SUS0_SPO0_SRVW0_SSO1_SVW1_SK3_SKXCCM8_TLDS2_ULSGRO0_USL1_UIOFGRO0_USFGRO0_VSn1_VWA1_VWB4_WSGRA0_WSGRB0_WS64_WG16_16_1_WGM0_WGMXCC4_WGMXCCGn1
    SolutionIndex: 62
    SolutionNameMin: Cijk_Ailk_Bljk_S_MX_B_Bias_HA_S_SAV_UserArgs_MT160x256x32_MI32x32x1_SN_LDSB1_AFC1_AFEM1_AFEM1_ASEM1_CLR1_CADS0_DTVA0_DTVB0_EPS0_FDSI0_GRPM1_GRVWA2_GRVWB4_GSU0_GSUAMB_GSUC0_GSUWGMRR0_GLS0_ISA950_IU1_K1_LBSPPA128_LBSPPB256_LBSPPM0_LPA4_LPB4_LPM0_LRVW4_LWPMn1_MIAV0_MIWT5_2_MO40_NTn1_NTA2_NTB2_NTC1_NTD2_NTM0_NEPBS0_NLCA5_NLCB1_ONLL1_PGR2_PLR1_PKA1_SIA3_SS1_SU0_SUM0_SUS0_SPO0_SRVW0_SSO4_SVW1_SK3_SKXCCM8_TLDS2_ULSGRO0_USL1_UIOFGRO0_USFGRO0_VSn1_VWA1_VWB2_WSGRA0_WSGRB0_WS64_WG32_8_1_WGM32_WGMXCC8_WGMXCCGn1
    SolutionIndex: 63
    SolutionNameMin: Cijk_Ailk_Bljk_S_MX_B_Bias_HA_S_SAV_UserArgs_MT192x256x32_MI32x32x1_SN_LDSB0_AFC1_AFEM1_AFEM1_ASEM1_CLR0_CADS0_DTVA0_DTVB0_EPS0_FDSI0_GRPM1_GRVWA1_GRVWB4_GSU0_GSUAMB_GSUC0_GSUWGMRR0_GLS0_ISA950_IU1_K1_LBSPPA128_LBSPPB512_LBSPPM0_LPA4_LPB4_LPM0_LRVW4_LWPMn1_MIAV0_MIWT3_4_MO40_NTn1_NTA2_NTB2_NTC4_NTD7_NTM0_NEPBS0_NLCA3_NLCB1_ONLL1_PGR2_PLR1_PKA1_SIA3_SS1_SU0_SUM0_SUS0_SPO1_SRVW0_SSO0_SVW1_SK3_SKXCCM0_TLDS2_ULSGRO0_USL1_UIOFGRO0_USFGRO0_VSn1_VWA1_VWB4_WSGRA0_WSGRB0_WS64_WG64_4_1_WGM4_WGMXCC2_WGMXCCGn1
    SolutionIndex: 64
    SolutionNameMin: Cijk_Ailk_Bljk_S_MX_B_Bias_HA_S_SAV_UserArgs_MT32x32x32_MI16x16x1_SN_LDSB1_AFC1_AFEM1_AFEM1_ASEM1_CLR0_CADS0_DTVA0_DTVB0_EPS1_FDSI0_GRPM1_GRVWA4_GRVWB1_GSU0_GSUAMB_GSUC0_GSUWGMRR0_GLS0_ISA950_IU1_K1_LBSPPA512_LBSPPB256_LBSPPM0_LPA16_LPB8_LPM0_LRVW4_LWPMn1_MIAV0_MIWT1_2_MO40_NTn1_NTA5_NTB6_NTC1_NTD4_NTM0_NEPBS0_NLCA1_NLCB1_ONLL1_PGR1_PLR0_PKA1_SIA3_SS1_SU0_SUM0_SUS0_SPO0_SRVW0_SSO1_SVW1_SK3_SKXCCM0_TLDS1_ULSGRO0_USL1_UIOFGRO0_USFGRO0_VSn1_VWA1_VWB2_WSGRA0_WSGRB0_WS64_WG32_4_1_WGM1_WGMXCC1_WGMXCCGn1
    SolutionIndex: 65
    SolutionNameMin: Cijk_Ailk_Bljk_S_MX_B_Bias_HA_S_SAV_UserArgs_MT32x32x32_MI16x16x1_SN_LDSB1_AFC1_AFEM1_AFEM1_ASEM1_CLR0_CADS0_DTVA0_DTVB0_EPS0_FDSI0_GRPM1_GRVWA4_GRVWB4_GSU0_GSUAMB_GSUC0_GSUWGMRR0_GLS0_ISA950_IU1_K1_LBSPPA512_LBSPPB256_LBSPPM0_LPA0_LPB8_LPM0_LRVW4_LWPMn1_MIAV0_MIWT2_2_MO40_NTn1_NTA7_NTB0_NTC4_NTD6_NTM0_NEPBS0_NLCA1_NLCB1_ONLL1_PGR2_PLR1_PKA1_SIA3_SS1_SU0_SUM0_SUS0_SPO1_SRVW0_SSO0_SVW2_SK3_SKXCCM0_TLDS1_ULSGRO0_USL1_UIOFGRO0_USFGRO0_VSn1_VWA2_VWB2_WSGRA0_WSGRB0_WS64_WG16_4_1_WGM1_WGMXCC32_WGMXCCGn1
    SolutionIndex: 66
    SolutionNameMin: Cijk_Ailk_Bljk_S_MX_B_Bias_HA_S_SAV_UserArgs_MT32x32x32_MI16x16x1_SN_LDSB1_AFC1_AFEM1_AFEM1_ASEM1_CLR0_CADS0_DTVA0_DTVB0_EPS0_FDSI0_GRPM1_GRVWA1_GRVWB2_GSU0_GSUAMB_GSUC0_GSUWGMRR0_GLS0_ISA950_IU1_K1_LBSPPA512_LBSPPB128_LBSPPM0_LPA0_LPB8_LPM0_LRVW4_LWPMn1_MIAV1_MIWT2_1_MO40_NTn1_NTA0_NTB7_NTC7_NTD7_NTM0_NEPBS0_NLCA1_NLCB1_ONLL1_PGR2_PLR0_PKA1_SIA3_SS1_SU0_SUM0_SUS0_SPO0_SRVW0_SSO1_SVW2_SK3_SKXCCM0_TLDS1_ULSGRO0_USL1_UIOFGRO0_USFGRO0_VSn1_VWA2_VWB1_WSGRA0_WSGRB0_WS64_WG16_8_1_WGM1_WGMXCC32_WGMXCCGn1
    SolutionIndex: 67
    SolutionNameMin: Cijk_Ailk_Bljk_S_MX_B_Bias_HA_S_SAV_UserArgs_MT32x96x32_MI16x16x1_SN_LDSB1_AFC1_AFEM1_AFEM1_ASEM1_CLR0_CADS0_DTVA0_DTVB0_EPS0_FDSI0_GRPM1_GRVWA1_GRVWB4_GSU0_GSUAMB_GSUC0_GSUWGMRR0_GLS0_ISA950_IU1_K1_LBSPPA512_LBSPPB128_LBSPPM0_LPA0_LPB8_LPM0_LRVW4_LWPMn1_MIAV1_MIWT2_3_MO40_NTn1_NTA0_NTB7_NTC5_NTD6_NTM0_NEPBS14_NLCA1_NLCB1_ONLL1_PGR2_PLR0_PKA1_SIA3_SS1_SU0_SUM0_SUS0_SPO0_SRVW0_SSO0_SVW2_SK3_SKXCCM0_TLDS1_ULSGRO0_USL1_UIOFGRO0_USFGRO0_VSn1_VWA2_VWB1_WSGRA0_WSGRB0_WS64_WG16_8_1_WGM0_WGMXCC16_WGMXCCGn1
    SolutionIndex: 68
    SolutionNameMin: Cijk_Ailk_Bljk_S_MX_B_Bias_HA_S_SAV_UserArgs_MT48x96x32_MI16x16x1_SN_LDSB1_AFC1_AFEM1_AFEM1_ASEM1_CLR0_CADS0_DTVA0_DTVB0_EPS0_FDSI0_GRPM1_GRVWA1_GRVWB4_GSU0_GSUAMB_GSUC0_GSUWGMRR0_GLS0_ISA950_IU1_K1_LBSPPA768_LBSPPB1536_LBSPPM0_LPA16_LPB16_LPM0_LRVW4_LWPMn1_MIAV1_MIWT3_3_MO40_NTn1_NTA0_NTB7_NTC5_NTD6_NTM0_NEPBS12_NLCA3_NLCB1_ONLL1_PGR2_PLR0_PKA1_SIA3_SS1_SU0_SUM0_SUS0_SPO0_SRVW0_SSO0_SVW1_SK3_SKXCCM0_TLDS0_ULSGRO0_USL1_UIOFGRO0_USFGRO0_VSn1_VWA1_VWB1_WSGRA0_WSGRB0_WS64_WG16_8_1_WGM8_WGMXCC32_WGMXCCGn1
    SolutionIndex: 69
    SolutionNameMin: Cijk_Ailk_Bljk_S_MX_B_Bias_HA_S_SAV_UserArgs_MT48x64x32_MI16x16x1_SN_LDSB1_AFC1_AFEM1_AFEM1_ASEM1_CLR0_CADS0_DTVA0_DTVB0_EPS0_FDSI0_GRPM1_GRVWA1_GRVWB4_GSU0_GSUAMB_GSUC0_GSUWGMRR0_GLS0_ISA950_IU1_K1_LBSPPA128_LBSPPB256_LBSPPM0_LPA8_LPB8_LPM0_LRVW4_LWPMn1_MIAV0_MIWT3_2_MO40_NTn1_NTA0_NTB7_NTC1_NTD6_NTM0_NEPBS0_NLCA3_NLCB1_ONLL1_PGR2_PLR1_PKA1_SIA3_SS1_SU8_SUM0_SUS512_SPO1_SRVW0_SSO1_SVW1_SK3_SKXCCM0_TLDS2_ULSGRO0_USL1_UIOFGRO0_USFGRO0_VSn1_VWA1_VWB2_WSGRA0_WSGRB0_WS64_WG16_8_1_WGM0_WGMXCC32_WGMXCCGn1
    SolutionIndex: 70
    SolutionNameMin: Cijk_Ailk_Bljk_S_MX_B_Bias_HA_S_SAV_UserArgs_MT64x32x32_MI32x32x1_SN_LDSB1_AFC1_AFEM1_AFEM1_ASEM1_CLR0_CADS0_DTVA0_DTVB0_EPS0_FDSI0_GRPM1_GRVWA2_GRVWB4_GSU0_GSUAMB_GSUC0_GSUWGMRR0_GLS0_ISA950_IU1_K1_LBSPPA128_LBSPPB128_LBSPPM0_LPA4_LPB4_LPM0_LRVW4_LWPMn1_MIAV0_MIWT1_1_MO40_NTn1_NTA7_NTB3_NTC4_NTD7_NTM0_NEPBS16_NLCA1_NLCB1_ONLL1_PGR2_PLR1_PKA1_SIA3_SS1_SU8_SUM0_SUS512_SPO0_SRVW0_SSO0_SVW1_SK3_SKXCCM0_TLDS2_ULSGRO0_USL1_UIOFGRO0_USFGRO0_VSn1_VWA1_VWB1_WSGRA0_WSGRB0_WS64_WG64_2_2_WGM6_WGMXCC16_WGMXCCGn1
    SolutionIndex: 71
    SolutionNameMin: Cijk_Ailk_Bljk_S_MX_B_Bias_HA_S_SAV_UserArgs_MT128x32x32_MI32x32x1_SN_LDSB0_AFC1_AFEM1_AFEM1_ASEM1_CLR1_CADS0_DTVA0_DTVB0_EPS0_FDSI0_GRPM1_GRVWA4_GRVWB4_GSU0_GSUAMB_GSUC0_GSUWGMRR0_GLS0_ISA950_IU1_K1_LBSPPA0_LBSPPB1024_LBSPPM0_LPA0_LPB4_LPM0_LRVW4_LWPMn1_MIAV1_MIWT1_1_MO40_NTn1_NTA6_NTB5_NTC0_NTD4_NTM0_NEPBS16_NLCA1_NLCB1_ONLL1_PGR2_PLR1_PKA1_SIA3_SS1_SU0_SUM0_SUS0_SPO0_SRVW0_SSO1_SVW1_SK3_SKXCCM0_TLDS1_ULSGRO0_USL1_UIOFGRO0_USFGRO0_VSn1_VWA1_VWB1_WSGRA0_WSGRB0_WS64_WG128_2_1_WGM0_WGMXCC32_WGMXCCGn1
    SolutionIndex: 72
    SolutionNameMin: Cijk_Ailk_Bljk_S_MX_B_Bias_HA_S_SAV_UserArgs_MT32x64x64_MI16x16x1_SN_LDSB0_AFC1_AFEM1_AFEM1_ASEM1_CLR1_CADS0_DTVA0_DTVB0_EPS0_FDSI0_GRPM1_GRVWA1_GRVWB4_GSU0_GSUAMB_GSUC0_GSUWGMRR0_GLS0_ISA950_IU1_K1_LBSPPA512_LBSPPB1024_LBSPPM0_LPA0_LPB8_LPM0_LRVW4_LWPMn1_MIAV0_MIWT1_2_MO40_NTn1_NTA2_NTB2_NTC5_NTD4_NTM0_NEPBS0_NLCA1_NLCB1_ONLL1_PGR2_PLR1_PKA1_SIA3_SS1_SU0_SUM0_SUS0_SPO1_SRVW0_SSO1_SVW1_SK3_SKXCCM0_TLDS1_ULSGRO0_USL1_UIOFGRO0_USFGRO0_VSn1_VWA1_VWB2_WSGRA0_WSGRB0_WS64_WG32_8_1_WGM0_WGMXCC4_WGMXCCGn1
    SolutionIndex: 73
    SolutionNameMin: Cijk_Ailk_Bljk_S_MX_B_Bias_HA_S_SAV_UserArgs_MT128x256x32_MI32x32x1_SN_LDSB1_AFC1_AFEM1_AFEM1_ASEM1_CLR0_CADS0_DTVA0_DTVB0_EPS0_FDSI0_GRPM1_GRVWA2_GRVWB4_GSU0_GSUAMB_GSUC0_GSUWGMRR0_GLS0_ISA950_IU1_K1_LBSPPA512_LBSPPB256_LBSPPM0_LPA4_LPB4_LPM0_LRVW4_LWPMn1_MIAV0_MIWT4_2_MO40_NTn1_NTA2_NTB7_NTC0_NTD2_NTM0_NEPBS16_NLCA1_NLCB1_ONLL1_PGR2_PLR1_PKA1_SIA3_SS1_SU8_SUM0_SUS256_SPO0_SRVW0_SSO0_SVW4_SK3_SKXCCM0_TLDS2_ULSGRO0_USL1_UIOFGRO0_USFGRO0_VSn1_VWA4_VWB2_WSGRA0_WSGRB0_WS64_WG32_8_1_WGM1_WGMXCC2_WGMXCCGn1
    SolutionIndex: 74
    SolutionNameMin: Cijk_Ailk_Bljk_S_MX_B_Bias_HA_S_SAV_UserArgs_MT128x64x32_MI32x32x1_SN_LDSB0_AFC1_AFEM1_AFEM1_ASEM1_CLR0_CADS0_DTVA0_DTVB0_EPS0_FDSI0_GRPM1_GRVWA4_GRVWB4_GSU0_GSUAMB_GSUC0_GSUWGMRR0_GLS0_ISA950_IU1_K1_LBSPPA0_LBSPPB256_LBSPPM0_LPA0_LPB4_LPM0_LRVW4_LWPMn1_MIAV0_MIWT1_2_MO40_NTn1_NTA0_NTB0_NTC7_NTD7_NTM0_NEPBS0_NLCA1_NLCB1_ONLL1_PGR2_PLR1_PKA1_SIA3_SS1_SU0_SUM0_SUS0_SPO0_SRVW0_SSO1_SVW1_SK3_SKXCCM0_TLDS1_ULSGRO0_USL1_UIOFGRO0_USFGRO0_VSn1_VWA1_VWB2_WSGRA0_WSGRB0_WS64_WG128_2_1_WGM0_WGMXCC8_WGMXCCGn1
    SolutionIndex: 75
    SolutionNameMin: Cijk_Ailk_Bljk_S_MX_B_Bias_HA_S_SAV_UserArgs_MT256x256x32_MI16x16x1_SN_LDSB0_AFC1_AFEM1_AFEM1_ASEM1_CLR0_CADS0_DTVA0_DTVB0_EPS0_FDSI0_GRPM1_GRVWA1_GRVWB4_GSU0_GSUAMB_GSUC0_GSUWGMRR0_GLS0_ISA950_IU1_K1_LBSPPA512_LBSPPB512_LBSPPM0_LPA8_LPB8_LPM0_LRVW4_LWPMn1_MIAV0_MIWT8_8_MO40_NTn1_NTA2_NTB3_NTC3_NTD2_NTM0_NEPBS16_NLCA1_NLCB1_ONLL1_PGR2_PLR0_PKA1_SIA3_SS1_SU8_SUM0_SUS512_SPO0_SRVW0_SSO0_SVW4_SK3_SKXCCM8_TLDS2_ULSGRO0_USL1_UIOFGRO0_USFGRO0_VSn1_VWA4_VWB4_WSGRA0_WSGRB0_WS64_WG32_8_1_WGM32_WGMXCC16_WGMXCCGn1
- - - [4, 30, 8192, 128]
    - [0, 0.0]
  - - [16, 33, 8192, 128]
    - [1, 0.0]
  - - [40, 61, 8192, 128]
    - [2, 0.0]
  - - [128, 17711, 1, 960]
    - [3, 0.0]
  - - [128, 17711, 1, 2480]
    - [4, 0.0]
  - - [252, 17711, 1, 128]
    - [5, 0.0]
  - - [256, 17711, 1, 128]
    - [6, 0.0]
  - - [384, 246, 1, 17711]
    - [7, 0.0]
  - - [384, 768, 1, 17711]
    - [8, 0.0]
  - - [928, 17711, 1, 128]
    - [9, 0.0]
  - - [2732, 17711, 1, 384]
    - [10, 0.0]
  - - [6, 128, 17711, 41]
    - [11, 0.0]
  - - [20, 124, 17711, 48]
    - [12, 0.0]
  - - [41, 6, 17711, 128]
    - [13, 0.0]
  - - [256, 256, 41, 17711]
    - [14, 0.0]
  - - [1, 1, 1, 4096]
    - [15, 0.0]
  - - [1, 4096, 1, 256]
    - [16, 0.0]
  - - [1, 4096, 1, 512]
    - [17, 0.0]
  - - [28, 4096, 1, 256]
    - [18, 0.0]
  - - [28, 4096, 1, 320]
    - [19, 0.0]
  - - [57, 262144, 1, 32]
    - [20, 0.0]
  - - [64, 102400, 1, 64]
    - [21, 0.0]
  - - [64, 131072, 1, 64]
    - [22, 0.0]
  - - [64, 131072, 1, 128]
    - [23, 0.0]
  - - [64, 819200, 1, 64]
    - [24, 0.0]
  - - [72, 4096, 1, 256]
    - [25, 0.0]
  - - [72, 4096, 1, 320]
    - [26, 0.0]
  - - [82, 262144, 1, 32]
    - [27, 0.0]
  - - [116, 4096, 1, 256]
    - [28, 0.0]
  - - [116, 4096, 1, 320]
    - [29, 0.0]
  - - [128, 4096, 1, 2048]
    - [30, 0.0]
  - - [128, 131072, 1, 64]
    - [31, 0.0]
  - - [160, 655360, 1, 10]
    - [32, 0.0]
  - - [180, 4096, 1, 256]
    - [33, 0.0]
  - - [180, 4096, 1, 320]
    - [34, 0.0]
  - - [192, 655360, 1, 48]
    - [35, 0.0]
  - - [192, 655360, 1, 112]
    - [36, 0.0]
  - - [224, 527553, 1, 64]
    - [37, 0.0]
  - - [224, 752863, 1, 64]
    - [38, 0.0]
  - - [256, 1, 1, 4096]
    - [39, 0.0]
  - - [256, 4096, 1, 28]
    - [40, 0.0]
  - - [256, 4096, 1, 72]
    - [41, 0.0]
  - - [256, 4096, 1, 116]
    - [42, 0.0]
  - - [256, 4096, 1, 180]
    - [43, 0.0]
  - - [256, 4096, 1, 256]
    - [44, 0.0]
  - - [256, 4096, 1, 7680]
    - [45, 0.0]
  - - [288, 806154, 1, 64]
    - [46, 0.0]
  - - [512, 1, 1, 4096]
    - [47, 0.0]
  - - [512, 4096, 1, 1]
    - [48, 0.0]
  - - [512, 4096, 1, 160]
    - [49, 0.0]
  - - [512, 4096, 1, 512]
    - [50, 0.0]
  - - [512, 4096, 1, 2246]
    - [51, 0.0]
  - - [512, 4096, 1, 9216]
    - [52, 0.0]
  - - [512, 4096, 1, 30816]
    - [53, 0.0]
  - - [1600, 4096, 1, 128]
    - [54, 0.0]
  - - [1824, 4096, 1, 2048]
    - [55, 0.0]
  - - [2048, 4096, 1, 57]
    - [56, 0.0]
  - - [2048, 4096, 1, 64]
    - [57, 0.0]
  - - [2048, 4096, 1, 82]
    - [58, 0.0]
  - - [2048, 4096, 1, 160]
    - [59, 0.0]
  - - [2048, 4096, 1, 2048]
    - [60, 0.0]
  - - [2246, 4096, 1, 2048]
    - [61, 0.0]
  - - [2560, 4096, 1, 4096]
    - [62, 0.0]
  - - [2624, 4096, 1, 2048]
    - [63, 0.0]
  - - [25, 25, 8192, 32]
    - [64, 0.0]
  - - [32, 25, 8192, 25]
    - [65, 0.0]
  - - [32, 57, 4096, 64]
    - [66, 0.0]
  - - [32, 82, 4096, 64]
    - [67, 0.0]
  - - [48, 192, 4096, 160]
    - [68, 0.0]
  - - [48, 642, 4096, 160]
    - [69, 0.0]
  - - [64, 32, 4096, 200]
    - [70, 0.0]
  - - [200, 32, 4096, 64]
    - [71, 0.0]
  - - [256, 2048, 1, 128]
    - [72, 0.0]
  - - [512, 2048, 1, 14336]
    - [73, 0.0]
  - - [1024, 2048, 1, 128]
    - [74, 0.0]
  - - [1024, 2048, 1, 14336]
    - [75, 0.0]
- null
- null
- DeviceEfficiency
- Equality
