projects/hipblaslt/library/src/amd_detail/rocblaslt/src/Tensile/Logic/asm_full/gfx950/Equality/gfx950_Cijk_Alik_Bljk_BBS_BH_Bias_HAS_SAV_UserArgs.yaml
- {MinimumRequiredVersion: 5.0.0}
- gfx950
- gfx950
- [Device 75a0]
    SolutionIndex: 0
    SolutionNameMin: Cijk_Alik_Bljk_BBS_BH_Bias_HA_S_SAV_UserArgs_MT16x32x256_MI16x16x1_SN_LDSB0_AFC1_AFEM1_AFEM1_ASEM1_CLR1_CADS0_DTLA1_DTLB1_DTVA0_DTVB0_EPS0_FDSI0_GRPM1_GRVWA8_GRVWB8_GSU0_GSUAMB_GSUC0_GSUWGMRR0_GLS0_ISA950_IU1_K1_LBSPPA1024_LBSPPB1024_LBSPPM0_LPA16_LPB16_LPM0_LRVW8_LWPMn1_MIAV1_MIWT1_1_MO40_NTn1_NTA1_NTB5_NTC3_NTD5_NTM0_NEPBS8_NLCA1_NLCB1_ONLL1_PGR2_PLR1_PKA1_SIA3_SS0_SU0_SUM0_SUS0_SPO0_SRVW0_SSO0_SVW4_SK3_SKXCCM0_TLDS2_ULSGRO0_USL1_UIOFGRO0_USFGROn1_VSn1_VWA1_VWB1_WSGRA0_WSGRB0_WS64_WG16_8_1_WGM0_WGMXCC32_WGMXCCGn1
    SolutionIndex: 1
    SolutionNameMin: Cijk_Alik_Bljk_BBS_BH_Bias_HA_S_SAV_UserArgs_MT256x256x64_MI16x16x1_SN_LDSB0_AFC1_AFEM1_AFEM1_ASEM1_CLR0_CADS0_DTLA1_DTLB1_DTVA0_DTVB0_EPS0_FDSI0_GRPM1_GRVWA8_GRVWB8_GSU0_GSUAMB_GSUC0_GSUWGMRR0_GLS0_ISA950_IU1_K1_LBSPPA1024_LBSPPB1024_LBSPPM0_LPA16_LPB16_LPM0_LRVW8_LWPMn1_MIAV0_MIWT8_8_MO40_NTn1_NTA2_NTB2_NTC2_NTD5_NTM0_NEPBS16_NLCA1_NLCB1_ONLL1_PGR2_PLR1_PKA1_SIA3_SS1_SU0_SUM0_SUS0_SPO0_SRVW0_SSO4_SVW8_SK3_SKXCCM0_TLDS1_ULSGRO0_USL1_UIOFGRO0_USFGRO0_VSn1_VWA8_VWB8_WSGRA0_WSGRB0_WS64_WG32_8_1_WGM48_WGMXCC1_WGMXCCGn1
    SolutionIndex: 2
    SolutionNameMin: Cijk_Alik_Bljk_BBS_BH_Bias_HA_S_SAV_UserArgs_MT256x128x32_MI32x32x1_SN_LDSB1_AFC1_AFEM1_AFEM1_ASEM1_CLR1_CADS0_DTLA0_DTLB0_DTVA0_DTVB0_EPS0_FDSI0_GRPM1_GRVWA8_GRVWB4_GSU0_GSUAMB_GSUC0_GSUWGMRR0_GLS0_ISA950_IU1_K1_LBSPPA128_LBSPPB256_LBSPPM0_LPA8_LPB8_LPM0_LRVW8_LWPMn1_MIAV0_MIWT2_4_MO40_NTn1_NTA0_NTB1_NTC6_NTD4_NTM0_NEPBS0_NLCA1_NLCB1_ONLL1_PGR2_PLR1_PKA1_SIA3_SS1_SU0_SUM0_SUS0_SPO0_SRVW0_SSO1_SVW2_SK3_SKXCCM0_TLDS1_ULSGRO0_USL1_UIOFGRO0_USFGRO0_VSn1_VWA2_VWB4_WSGRA0_WSGRB0_WS64_WG128_2_1_WGM0_WGMXCC2_WGMXCCGn1
    SolutionIndex: 3
    SolutionNameMin: Cijk_Alik_Bljk_BBS_BH_Bias_HA_S_SAV_UserArgs_MT256x128x32_MI32x32x1_SN_LDSB1_AFC1_AFEM1_AFEM1_ASEM1_CLR1_CADS0_DTLA0_DTLB0_DTVA0_DTVB0_EPS1_FDSI0_GRPM1_GRVWA8_GRVWB8_GSU0_GSUAMB_GSUC0_GSUWGMRR0_GLS0_ISA950_IU1_K1_LBSPPA128_LBSPPB256_LBSPPM0_LPA8_LPB8_LPM0_LRVW8_LWPMn1_MIAV0_MIWT2_4_MO40_NTn1_NTA0_NTB1_NTC7_NTD5_NTM0_NEPBS0_NLCA1_NLCB1_ONLL1_PGR1_PLR1_PKA1_SIA3_SS1_SU0_SUM0_SUS0_SPO0_SRVW0_SSO1_SVW2_SK3_SKXCCM0_TLDS1_ULSGRO0_USL1_UIOFGRO0_USFGRO0_VSn1_VWA2_VWB4_WSGRA0_WSGRB0_WS64_WG128_2_1_WGM1_WGMXCC2_WGMXCCGn1
    SolutionIndex: 4
    SolutionNameMin: Cijk_Alik_Bljk_BBS_BH_Bias_HAS_SAV_UserArgs_MT16x16x64_MI16x16x1_SN_LDSB0_AFC0_AFEM1_AFEM1_ASEM1_CLR0_CADS0_DTLA1_DTLB1_DTVA0_DTVB0_EPS0_FDSI0_GRPM1_GRVWA8_GRVWB8_GSU0_GSUAMB_GSUC0_GSUWGMRR0_GLS0_ISA950_IU1_K1_LBSPPA1024_LBSPPB1024_LBSPPM0_LPA16_LPB16_LPM0_LRVW8_LWPMn1_MIAV0_MIWT1_1_MO40_NTn1_NTA3_NTB0_NTC0_NTD3_NTM0_NEPBS2_NLCA1_NLCB1_ONLL1_PGR2_PLR1_PKA1_SIA3_SS1_SU0_SUM0_SUS128_SPO1_SRVW0_SSO0_SVW1_SK3_SKXCCM0_TLDS2_ULSGRO0_USL1_UIOFGRO0_USFGRO0_VSn1_VWA1_VWB1_WSGRA0_WSGRB0_WS64_WG16_4_2_WGM0_WGMXCC2_WGMXCCGn1
    SolutionIndex: 5
    SolutionNameMin: Cijk_Alik_Bljk_BBS_BH_Bias_HAS_SAV_UserArgs_MT16x32x64_MI16x16x1_SN_LDSB0_AFC0_AFEM1_AFEM1_ASEM1_CLR0_CADS0_DTLA1_DTLB1_DTVA0_DTVB0_EPS0_FDSI0_GRPM1_GRVWA8_GRVWB8_GSU0_GSUAMB_GSUC0_GSUWGMRR0_GLS0_ISA950_IU1_K1_LBSPPA1024_LBSPPB1024_LBSPPM0_LPA16_LPB16_LPM0_LRVW8_LWPMn1_MIAV1_MIWT1_2_MO40_NTn1_NTA2_NTB1_NTC0_NTD3_NTM0_NEPBS10_NLCA1_NLCB1_ONLL1_PGR2_PLR1_PKA1_SIA3_SS1_SU0_SUM0_SUS128_SPO0_SRVW0_SSO0_SVW1_SK3_SKXCCM0_TLDS1_ULSGRO0_USL1_UIOFGRO0_USFGROn1_VSn1_VWA1_VWB2_WSGRA0_WSGRB0_WS64_WG16_4_2_WGM1_WGMXCC4_WGMXCCGn1
    SolutionIndex: 6
    SolutionNameMin: Cijk_Alik_Bljk_BBS_BH_Bias_HAS_SAV_UserArgs_MT16x32x64_MI16x16x1_SN_LDSB0_AFC0_AFEM1_AFEM1_ASEM1_CLR1_CADS0_DTLA1_DTLB1_DTVA0_DTVB0_EPS0_FDSI0_GRPM1_GRVWA8_GRVWB8_GSU0_GSUAMB_GSUC0_GSUWGMRR0_GLS0_ISA950_IU1_K1_LBSPPA1024_LBSPPB1024_LBSPPM0_LPA16_LPB16_LPM0_LRVW8_LWPMn1_MIAV1_MIWT1_2_MO40_NTn1_NTA0_NTB0_NTC1_NTD2_NTM0_NEPBS8_NLCA1_NLCB1_ONLL1_PGR2_PLR1_PKA1_SIA3_SS0_SU0_SUM0_SUS128_SPO0_SRVW0_SSO0_SVW4_SK3_SKXCCM0_TLDS2_ULSGRO0_USL1_UIOFGRO0_USFGRO1_VSn1_VWA1_VWB2_WSGRA0_WSGRB0_WS64_WG16_4_1_WGM1_WGMXCC32_WGMXCCGn1
    SolutionIndex: 7
    SolutionNameMin: Cijk_Alik_Bljk_BBS_BH_Bias_HAS_SAV_UserArgs_MT16x64x64_MI16x16x1_SN_LDSB0_AFC0_AFEM1_AFEM1_ASEM1_CLR0_CADS0_DTLA1_DTLB1_DTVA0_DTVB0_EPS0_FDSI0_GRPM1_GRVWA8_GRVWB8_GSU0_GSUAMB_GSUC0_GSUWGMRR0_GLS0_ISA950_IU1_K1_LBSPPA1024_LBSPPB1024_LBSPPM0_LPA16_LPB16_LPM0_LRVW8_LWPMn1_MIAV0_MIWT1_2_MO40_NTn1_NTA1_NTB2_NTC3_NTD2_NTM0_NEPBS8_NLCA1_NLCB1_ONLL1_PGR2_PLR1_PKA1_SIA3_SS0_SU8_SUM0_SUS128_SPO1_SRVW0_SSO0_SVW4_SK3_SKXCCM0_TLDS2_ULSGRO0_USL1_UIOFGRO0_USFGROn1_VSn1_VWA1_VWB2_WSGRA0_WSGRB0_WS64_WG16_8_1_WGM0_WGMXCC2_WGMXCCGn1
    SolutionIndex: 8
    SolutionNameMin: Cijk_Alik_Bljk_BBS_BH_Bias_HAS_SAV_UserArgs_MT32x32x64_MI16x16x1_SN_LDSB0_AFC0_AFEM1_AFEM1_ASEM1_CLR1_CADS0_DTLA1_DTLB1_DTVA0_DTVB0_EPS0_FDSI0_GRPM1_GRVWA8_GRVWB8_GSU0_GSUAMB_GSUC0_GSUWGMRR0_GLS0_ISA950_IU1_K1_LBSPPA1024_LBSPPB1024_LBSPPM0_LPA16_LPB16_LPM0_LRVW8_LWPMn1_MIAV1_MIWT1_1_MO40_NTn1_NTA0_NTB7_NTC3_NTD0_NTM0_NEPBS10_NLCA1_NLCB1_ONLL1_PGR2_PLR1_PKA1_SIA3_SS1_SU0_SUM0_SUS128_SPO0_SRVW0_SSO0_SVW1_SK3_SKXCCM8_TLDS2_ULSGRO0_USL1_UIOFGRO0_USFGROn1_VSn1_VWA1_VWB1_WSGRA0_WSGRB0_WS64_WG32_8_1_WGM24_WGMXCC4_WGMXCCGn1
    SolutionIndex: 9
    SolutionNameMin: Cijk_Alik_Bljk_BBS_BH_Bias_HAS_SAV_UserArgs_MT32x64x64_MI16x16x1_SN_LDSB0_AFC0_AFEM1_AFEM1_ASEM1_CLR1_CADS0_DTLA1_DTLB1_DTVA0_DTVB0_EPS0_FDSI0_GRPM1_GRVWA8_GRVWB2_GSU0_GSUAMB_GSUC0_GSUWGMRR0_GLS0_ISA950_IU1_K1_LBSPPA1024_LBSPPB256_LBSPPM0_LPA16_LPB16_LPM0_LRVW8_LWPMn1_MIAV0_MIWT1_2_MO40_NTn1_NTA3_NTB3_NTC0_NTD1_NTM0_NEPBS16_NLCA1_NLCB1_ONLL1_PGR2_PLR1_PKA1_SIA3_SS0_SU0_SUM0_SUS128_SPO1_SRVW0_SSO0_SVW4_SK3_SKXCCM7_TLDS1_ULSGRO0_USL1_UIOFGRO0_USFGRO0_VSn1_VWA1_VWB2_WSGRA0_WSGRB0_WS64_WG32_8_1_WGM0_WGMXCC2_WGMXCCGn1
    SolutionIndex: 10
    SolutionNameMin: Cijk_Alik_Bljk_BBS_BH_Bias_HAS_SAV_UserArgs_MT32x64x64_MI16x16x1_SN_LDSB0_AFC0_AFEM1_AFEM1_ASEM1_CLR1_CADS0_DTLA1_DTLB1_DTVA0_DTVB0_EPS0_FDSI0_GRPM1_GRVWA8_GRVWB2_GSU0_GSUAMB_GSUC0_GSUWGMRR0_GLS0_ISA950_IU1_K1_LBSPPA1024_LBSPPB256_LBSPPM0_LPA16_LPB16_LPM0_LRVW8_LWPMn1_MIAV1_MIWT1_2_MO40_NTn1_NTA0_NTB0_NTC3_NTD0_NTM0_NEPBS16_NLCA1_NLCB1_ONLL1_PGR2_PLR1_PKA1_SIA3_SS0_SU0_SUM0_SUS128_SPO1_SRVW0_SSO0_SVW4_SK3_SKXCCM0_TLDS1_ULSGRO0_USL1_UIOFGRO0_USFGRO1_VSn1_VWA1_VWB2_WSGRA0_WSGRB0_WS64_WG32_8_1_WGM1_WGMXCC2_WGMXCCGn1
    SolutionIndex: 11
    SolutionNameMin: Cijk_Alik_Bljk_BBS_BH_Bias_HAS_SAV_UserArgs_MT64x32x64_MI16x16x1_SN_LDSB0_AFC0_AFEM1_AFEM1_ASEM1_CLR0_CADS0_DTLA1_DTLB1_DTVA0_DTVB0_EPS0_FDSI0_GRPM1_GRVWA8_GRVWB2_GSU0_GSUAMB_GSUC0_GSUWGMRR0_GLS0_ISA950_IU1_K1_LBSPPA1024_LBSPPB256_LBSPPM0_LPA16_LPB16_LPM0_LRVW8_LWPMn1_MIAV1_MIWT1_2_MO40_NTn1_NTA0_NTB6_NTC0_NTD1_NTM0_NEPBS14_NLCA1_NLCB1_ONLL1_PGR2_PLR1_PKA1_SIA3_SS0_SU8_SUM0_SUS128_SPO0_SRVW0_SSO0_SVW4_SK3_SKXCCM0_TLDS2_ULSGRO0_USL1_UIOFGRO0_USFGRO1_VSn1_VWA1_VWB2_WSGRA0_WSGRB0_WS64_WG64_4_1_WGM1_WGMXCC32_WGMXCCGn1
    SolutionIndex: 12
    SolutionNameMin: Cijk_Alik_Bljk_BBS_BH_Bias_HAS_SAV_UserArgs_MT128x80x64_MI16x16x1_SN_LDSB0_AFC0_AFEM1_AFEM1_ASEM1_CLR1_CADS0_DTLA1_DTLB1_DTVA0_DTVB0_EPS0_FDSI0_GRPM1_GRVWA8_GRVWB2_GSU0_GSUAMB_GSUC0_GSUWGMRR0_GLS0_ISA950_IU1_K1_LBSPPA1024_LBSPPB256_LBSPPM0_LPA16_LPB16_LPM0_LRVW8_LWPMn1_MIAV1_MIWT2_5_MO40_NTn1_NTA0_NTB5_NTC0_NTD3_NTM0_NEPBS0_NLCA1_NLCB1_ONLL1_PGR2_PLR1_PKA1_SIA3_SS1_SU0_SUM0_SUS128_SPO0_SRVW0_SSO0_SVW2_SK3_SKXCCM6_TLDS2_ULSGRO0_USL1_UIOFGRO0_USFGRO1_VSn1_VWA2_VWB1_WSGRA0_WSGRB0_WS64_WG64_4_1_WGM0_WGMXCC4_WGMXCCGn1
    SolutionIndex: 13
    SolutionNameMin: Cijk_Alik_Bljk_BBS_BH_Bias_HAS_SAV_UserArgs_MT16x16x64_MI16x16x1_SN_LDSB0_AFC0_AFEM1_AFEM1_ASEM1_CLR0_CADS0_DTLA1_DTLB1_DTVA0_DTVB0_EPS0_FDSI0_GRPM1_GRVWA8_GRVWB8_GSU0_GSUAMB_GSUC0_GSUWGMRR0_GLS0_ISA950_IU1_K1_LBSPPA1024_LBSPPB1024_LBSPPM0_LPA16_LPB16_LPM0_LRVW8_LWPMn1_MIAV0_MIWT1_1_MO40_NTn1_NTA7_NTB2_NTC2_NTD3_NTM0_NEPBS2_NLCA1_NLCB1_ONLL1_PGR2_PLR1_PKA1_SIA3_SS1_SU0_SUM0_SUS128_SPO1_SRVW0_SSO0_SVW1_SK3_SKXCCM0_TLDS2_ULSGRO0_USL1_UIOFGRO0_USFGRO1_VSn1_VWA1_VWB1_WSGRA0_WSGRB0_WS64_WG16_4_2_WGM1_WGMXCC2_WGMXCCGn1
    SolutionIndex: 14
    SolutionNameMin: Cijk_Alik_Bljk_BBS_BH_Bias_HAS_SAV_UserArgs_MT16x32x64_MI16x16x1_SN_LDSB0_AFC0_AFEM1_AFEM1_ASEM1_CLR1_CADS0_DTLA1_DTLB1_DTVA0_DTVB0_EPS0_FDSI0_GRPM1_GRVWA8_GRVWB8_GSU0_GSUAMB_GSUC0_GSUWGMRR0_GLS0_ISA950_IU1_K1_LBSPPA1024_LBSPPB1024_LBSPPM0_LPA16_LPB16_LPM0_LRVW8_LWPMn1_MIAV0_MIWT1_1_MO40_NTn1_NTA5_NTB2_NTC1_NTD3_NTM0_NEPBS14_NLCA1_NLCB1_ONLL1_PGR2_PLR1_PKA1_SIA3_SS0_SU0_SUM0_SUS128_SPO0_SRVW0_SSO0_SVW4_SK3_SKXCCM8_TLDS2_ULSGRO0_USL1_UIOFGRO0_USFGROn1_VSn1_VWA1_VWB1_WSGRA0_WSGRB0_WS64_WG16_8_1_WGM1_WGMXCC2_WGMXCCGn1
    SolutionIndex: 15
    SolutionNameMin: Cijk_Alik_Bljk_BBS_BH_Bias_HAS_SAV_UserArgs_MT16x32x64_MI16x16x1_SN_LDSB0_AFC0_AFEM1_AFEM1_ASEM1_CLR1_CADS0_DTLA1_DTLB1_DTVA0_DTVB0_EPS0_FDSI0_GRPM1_GRVWA8_GRVWB8_GSU0_GSUAMB_GSUC0_GSUWGMRR0_GLS0_ISA950_IU1_K1_LBSPPA1024_LBSPPB1024_LBSPPM0_LPA16_LPB16_LPM0_LRVW8_LWPMn1_MIAV1_MIWT1_1_MO40_NTn1_NTA5_NTB3_NTC3_NTD2_NTM0_NEPBS4_NLCA1_NLCB1_ONLL1_PGR2_PLR1_PKA1_SIA3_SS1_SU0_SUM0_SUS128_SPO0_SRVW0_SSO0_SVW1_SK3_SKXCCM0_TLDS1_ULSGRO0_USL1_UIOFGRO0_USFGROn1_VSn1_VWA1_VWB1_WSGRA0_WSGRB0_WS64_WG16_8_1_WGM0_WGMXCC16_WGMXCCGn1
    SolutionIndex: 16
    SolutionNameMin: Cijk_Alik_Bljk_BBS_BH_Bias_HAS_SAV_UserArgs_MT64x32x64_MI16x16x1_SN_LDSB0_AFC0_AFEM1_AFEM1_ASEM1_CLR1_CADS0_DTLA1_DTLB1_DTVA0_DTVB0_EPS0_FDSI0_GRPM1_GRVWA8_GRVWB2_GSU0_GSUAMB_GSUC0_GSUWGMRR0_GLS0_ISA950_IU1_K1_LBSPPA1024_LBSPPB256_LBSPPM0_LPA16_LPB16_LPM0_LRVW8_LWPMn1_MIAV1_MIWT1_2_MO40_NTn1_NTA0_NTB3_NTC1_NTD0_NTM0_NEPBS12_NLCA1_NLCB1_ONLL1_PGR2_PLR1_PKA1_SIA3_SS0_SU0_SUM0_SUS128_SPO0_SRVW0_SSO0_SVW4_SK3_SKXCCM8_TLDS2_ULSGRO0_USL1_UIOFGRO0_USFGRO1_VSn1_VWA1_VWB2_WSGRA0_WSGRB0_WS64_WG64_4_1_WGM1_WGMXCC2_WGMXCCGn1
    SolutionIndex: 17
    SolutionNameMin: Cijk_Alik_Bljk_BBS_BH_Bias_HAS_SAV_UserArgs_MT32x96x64_MI16x16x1_SN_LDSB0_AFC0_AFEM1_AFEM1_ASEM1_CLR0_CADS0_DTLA1_DTLB1_DTVA0_DTVB0_EPS0_FDSI0_GRPM1_GRVWA8_GRVWB8_GSU0_GSUAMB_GSUC0_GSUWGMRR0_GLS0_ISA950_IU1_K1_LBSPPA1024_LBSPPB1024_LBSPPM0_LPA16_LPB16_LPM0_LRVW8_LWPMn1_MIAV0_MIWT1_3_MO40_NTn1_NTA1_NTB3_NTC0_NTD1_NTM0_NEPBS14_NLCA1_NLCB1_ONLL1_PGR2_PLR1_PKA1_SIA3_SS1_SU0_SUM0_SUS128_SPO0_SRVW0_SSO0_SVW1_SK3_SKXCCM0_TLDS2_ULSGRO0_USL1_UIOFGRO0_USFGRO1_VSn1_VWA1_VWB1_WSGRA0_WSGRB0_WS64_WG32_8_1_WGM1_WGMXCC2_WGMXCCGn1
    SolutionIndex: 18
    SolutionNameMin: Cijk_Alik_Bljk_BBS_BH_Bias_HAS_SAV_UserArgs_MT32x96x64_MI16x16x1_SN_LDSB0_AFC0_AFEM1_AFEM1_ASEM1_CLR1_CADS0_DTLA1_DTLB1_DTVA0_DTVB0_EPS0_FDSI0_GRPM1_GRVWA2_GRVWB8_GSU0_GSUAMB_GSUC0_GSUWGMRR0_GLS0_ISA950_IU1_K1_LBSPPA256_LBSPPB1024_LBSPPM0_LPA16_LPB16_LPM0_LRVW8_LWPMn1_MIAV1_MIWT1_3_MO40_NTn1_NTA0_NTB0_NTC1_NTD1_NTM0_NEPBS0_NLCA1_NLCB1_ONLL1_PGR2_PLR1_PKA1_SIA3_SS1_SU0_SUM0_SUS128_SPO0_SRVW0_SSO0_SVW1_SK3_SKXCCM0_TLDS2_ULSGRO0_USL1_UIOFGRO0_USFGRO0_VSn1_VWA1_VWB1_WSGRA0_WSGRB0_WS64_WG32_8_1_WGM0_WGMXCC16_WGMXCCGn1
    SolutionIndex: 19
    SolutionNameMin: Cijk_Alik_Bljk_BBS_BH_Bias_HAS_SAV_UserArgs_MT64x64x64_MI16x16x1_SN_LDSB0_AFC0_AFEM1_AFEM1_ASEM1_CLR0_CADS0_DTLA1_DTLB1_DTVA0_DTVB0_EPS0_FDSI0_GRPM1_GRVWA2_GRVWB2_GSU0_GSUAMB_GSUC0_GSUWGMRR0_GLS0_ISA950_IU1_K1_LBSPPA512_LBSPPB256_LBSPPM0_LPA16_LPB16_LPM0_LRVW8_LWPMn1_MIAV1_MIWT4_1_MO40_NTn1_NTA2_NTB3_NTC7_NTD0_NTM0_NEPBS16_NLCA1_NLCB1_ONLL1_PGR2_PLR1_PKA1_SIA3_SS1_SU0_SUM0_SUS128_SPO0_SRVW0_SSO0_SVW4_SK3_SKXCCM8_TLDS2_ULSGRO0_USL1_UIOFGRO0_USFGRO0_VSn1_VWA4_VWB1_WSGRA0_WSGRB0_WS64_WG16_16_1_WGM0_WGMXCC4_WGMXCCGn1
    SolutionIndex: 20
    SolutionNameMin: Cijk_Alik_Bljk_BBS_BH_Bias_HAS_SAV_UserArgs_MT64x96x64_MI16x16x1_SN_LDSB0_AFC0_AFEM1_AFEM1_ASEM1_CLR1_CADS0_DTLA1_DTLB1_DTVA0_DTVB0_EPS0_FDSI0_GRPM1_GRVWA2_GRVWB8_GSU0_GSUAMB_GSUC0_GSUWGMRR0_GLS0_ISA950_IU1_K1_LBSPPA256_LBSPPB1024_LBSPPM0_LPA16_LPB16_LPM0_LRVW8_LWPMn1_MIAV1_MIWT2_3_MO40_NTn1_NTA0_NTB2_NTC0_NTD1_NTM0_NEPBS12_NLCA1_NLCB1_ONLL1_PGR2_PLR1_PKA1_SIA3_SS1_SU16_SUM0_SUS128_SPO0_SRVW0_SSO0_SVW2_SK3_SKXCCM5_TLDS1_ULSGRO0_USL1_UIOFGRO0_USFGRO0_VSn1_VWA2_VWB1_WSGRA0_WSGRB0_WS64_WG32_8_1_WGM8_WGMXCC8_WGMXCCGn1
    SolutionIndex: 21
    SolutionNameMin: Cijk_Alik_Bljk_BBS_BH_Bias_HAS_SAV_UserArgs_MT64x96x64_MI16x16x1_SN_LDSB0_AFC0_AFEM1_AFEM1_ASEM1_CLR0_CADS0_DTLA1_DTLB1_DTVA0_DTVB0_EPS0_FDSI0_GRPM1_GRVWA2_GRVWB8_GSU0_GSUAMB_GSUC0_GSUWGMRR0_GLS0_ISA950_IU1_K1_LBSPPA256_LBSPPB1024_LBSPPM0_LPA16_LPB16_LPM0_LRVW8_LWPMn1_MIAV1_MIWT2_3_MO40_NTn1_NTA1_NTB2_NTC0_NTD1_NTM0_NEPBS14_NLCA1_NLCB1_ONLL1_PGR2_PLR1_PKA1_SIA3_SS1_SU0_SUM0_SUS128_SPO0_SRVW0_SSO0_SVW2_SK3_SKXCCM4_TLDS1_ULSGRO0_USL1_UIOFGRO0_USFGRO0_VSn1_VWA2_VWB1_WSGRA0_WSGRB0_WS64_WG32_8_1_WGM1_WGMXCC8_WGMXCCGn1
    SolutionIndex: 22
    SolutionNameMin: Cijk_Alik_Bljk_BBS_BH_Bias_HAS_SAV_UserArgs_MT64x128x64_MI16x16x1_SN_LDSB0_AFC0_AFEM1_AFEM1_ASEM1_CLR1_CADS0_DTLA1_DTLB1_DTVA0_DTVB0_EPS0_FDSI0_GRPM1_GRVWA2_GRVWB2_GSU0_GSUAMB_GSUC0_GSUWGMRR0_GLS0_ISA950_IU1_K1_LBSPPA512_LBSPPB256_LBSPPM0_LPA16_LPB16_LPM0_LRVW8_LWPMn1_MIAV1_MIWT4_2_MO40_NTn1_NTA1_NTB1_NTC4_NTD1_NTM0_NEPBS0_NLCA1_NLCB1_ONLL1_PGR2_PLR1_PKA1_SIA3_SS1_SU8_SUM0_SUS128_SPO0_SRVW0_SSO0_SVW4_SK3_SKXCCM5_TLDS2_ULSGRO0_USL1_UIOFGRO0_USFGRO0_VSn1_VWA4_VWB2_WSGRA0_WSGRB0_WS64_WG16_16_1_WGM24_WGMXCC8_WGMXCCGn1
    SolutionIndex: 23
    SolutionNameMin: Cijk_Alik_Bljk_BBS_BH_Bias_HAS_SAV_UserArgs_MT128x96x64_MI16x16x1_SN_LDSB0_AFC0_AFEM1_AFEM1_ASEM1_CLR1_CADS0_DTLA1_DTLB1_DTVA0_DTVB0_EPS0_FDSI0_GRPM1_GRVWA8_GRVWB8_GSU0_GSUAMB_GSUC0_GSUWGMRR0_GLS0_ISA950_IU1_K1_LBSPPA1024_LBSPPB1024_LBSPPM0_LPA16_LPB16_LPM0_LRVW8_LWPMn1_MIAV1_MIWT4_3_MO40_NTn1_NTA0_NTB0_NTC4_NTD3_NTM0_NEPBS14_NLCA1_NLCB1_ONLL1_PGR2_PLR1_PKA1_SIA3_SS1_SU0_SUM0_SUS128_SPO0_SRVW0_SSO0_SVW4_SK3_SKXCCM8_TLDS2_ULSGRO0_USL1_UIOFGRO0_USFGRO1_VSn1_VWA4_VWB1_WSGRA0_WSGRB0_WS64_WG32_8_1_WGM1_WGMXCC32_WGMXCCGn1
    SolutionIndex: 24
    SolutionNameMin: Cijk_Alik_Bljk_BBS_BH_Bias_HAS_SAV_UserArgs_MT128x128x64_MI16x16x1_SN_LDSB0_AFC0_AFEM1_AFEM1_ASEM1_CLR1_CADS0_DTLA1_DTLB1_DTVA0_DTVB0_EPS0_FDSI0_GRPM1_GRVWA8_GRVWB8_GSU0_GSUAMB_GSUC0_GSUWGMRR0_GLS0_ISA950_IU1_K1_LBSPPA1024_LBSPPB1024_LBSPPM0_LPA16_LPB16_LPM0_LRVW8_LWPMn1_MIAV1_MIWT8_2_MO40_NTn1_NTA3_NTB6_NTC0_NTD7_NTM0_NEPBS0_NLCA1_NLCB1_ONLL1_PGR2_PLR1_PKA1_SIA3_SS1_SU0_SUM0_SUS128_SPO0_SRVW0_SSO0_SVW8_SK3_SKXCCM0_TLDS2_ULSGRO0_USL1_UIOFGRO0_USFGRO0_VSn1_VWA8_VWB2_WSGRA0_WSGRB0_WS64_WG16_16_1_WGM24_WGMXCC1_WGMXCCGn1
    SolutionIndex: 25
    SolutionNameMin: Cijk_Alik_Bljk_BBS_BH_Bias_HAS_SAV_UserArgs_MT16x16x512_MI16x16x1_SN_LDSB0_AFC0_AFEM1_AFEM1_ASEM1_CLR1_CADS0_DTLA1_DTLB1_DTVA0_DTVB0_EPS0_FDSI0_GRPM1_GRVWA8_GRVWB8_GSU0_GSUAMB_GSUC0_GSUWGMRR0_GLS0_ISA950_IU1_K1_LBSPPA1024_LBSPPB1024_LBSPPM0_LPA16_LPB16_LPM0_LRVW8_LWPMn1_MIAV0_MIWT1_1_MO40_NTn1_NTA7_NTB2_NTC2_NTD0_NTM0_NEPBS4_NLCA1_NLCB1_ONLL1_PGR2_PLR1_PKA1_SIA3_SS0_SU8_SUM0_SUS1024_SPO1_SRVW0_SSO0_SVW1_SK3_SKXCCM0_TLDS1_ULSGRO0_USL1_UIOFGRO0_USFGRO1_VSn1_VWA1_VWB1_WSGRA0_WSGRB0_WS64_WG16_4_4_WGM0_WGMXCC8_WGMXCCGn1
    SolutionIndex: 26
    SolutionNameMin: Cijk_Alik_Bljk_BBS_BH_Bias_HAS_SAV_UserArgs_MT32x16x256_MI16x16x1_SN_LDSB0_AFC0_AFEM1_AFEM1_ASEM1_CLR1_CADS0_DTLA1_DTLB1_DTVA0_DTVB0_EPS0_FDSI0_GRPM1_GRVWA8_GRVWB8_GSU0_GSUAMB_GSUC0_GSUWGMRR0_GLS0_ISA950_IU1_K1_LBSPPA1024_LBSPPB1024_LBSPPM0_LPA16_LPB16_LPM0_LRVW8_LWPMn1_MIAV1_MIWT1_1_MO40_NTn1_NTA1_NTB2_NTC1_NTD4_NTM0_NEPBS8_NLCA1_NLCB1_ONLL1_PGR2_PLR1_PKA1_SIA3_SS1_SU0_SUM0_SUS512_SPO1_SRVW0_SSO1_SVW1_SK3_SKXCCM8_TLDS1_ULSGRO0_USL1_UIOFGRO0_USFGRO1_VSn1_VWA1_VWB1_WSGRA0_WSGRB0_WS64_WG32_4_1_WGM16_WGMXCC1_WGMXCCGn1
    SolutionIndex: 27
    SolutionNameMin: Cijk_Alik_Bljk_BBS_BH_Bias_HAS_SAV_UserArgs_MT64x48x256_MI16x16x1_SN_LDSB0_AFC0_AFEM1_AFEM1_ASEM1_CLR0_CADS0_DTLA0_DTLB0_DTVA0_DTVB0_EPS0_FDSI0_GRPM1_GRVWA8_GRVWB8_GSU0_GSUAMB_GSUC0_GSUWGMRR0_GLS0_ISA950_IU1_K1_LBSPPA512_LBSPPB512_LBSPPM0_LPA16_LPB16_LPM0_LRVW8_LWPMn1_MIAV0_MIWT1_3_MO40_NTn1_NTA7_NTB2_NTC1_NTD3_NTM0_NEPBS0_NLCA1_NLCB1_ONLL1_PGR2_PLR1_PKA1_SIA3_SS0_SU0_SUM0_SUS512_SPO0_SRVW0_SSO0_SVW4_SK3_SKXCCM4_TLDS2_ULSGRO0_USL1_UIOFGRO0_USFGRO0_VSn1_VWA1_VWB1_WSGRA0_WSGRB0_WS64_WG64_4_1_WGM0_WGMXCC4_WGMXCCGn1
    SolutionIndex: 28
    SolutionNameMin: Cijk_Alik_Bljk_BBS_BH_Bias_HAS_SAV_UserArgs_MT48x64x256_MI16x16x1_SN_LDSB0_AFC0_AFEM1_AFEM1_ASEM1_CLR0_CADS0_DTLA0_DTLB0_DTVA0_DTVB0_EPS0_FDSI0_GRPM1_GRVWA8_GRVWB8_GSU0_GSUAMB_GSUC0_GSUWGMRR0_GLS0_ISA950_IU1_K1_LBSPPA512_LBSPPB512_LBSPPM0_LPA16_LPB16_LPM0_LRVW8_LWPMn1_MIAV1_MIWT3_1_MO40_NTn1_NTA4_NTB2_NTC3_NTD2_NTM0_NEPBS0_NLCA1_NLCB1_ONLL1_PGR2_PLR1_PKA1_SIA3_SS0_SU0_SUM0_SUS512_SPO0_SRVW0_SSO0_SVW4_SK3_SKXCCM0_TLDS1_ULSGRO0_USL1_UIOFGRO0_USFGRO0_VSn1_VWA1_VWB1_WSGRA0_WSGRB0_WS64_WG16_16_1_WGM0_WGMXCC16_WGMXCCGn1
    SolutionIndex: 29
    SolutionNameMin: Cijk_Alik_Bljk_BBS_BH_Bias_HAS_SAV_UserArgs_MT64x32x256_MI16x16x1_SN_LDSB0_AFC0_AFEM1_AFEM1_ASEM1_CLR1_CADS0_DTLA1_DTLB1_DTVA0_DTVB0_EPS0_FDSI0_GRPM1_GRVWA8_GRVWB8_GSU0_GSUAMB_GSUC0_GSUWGMRR0_GLS0_ISA950_IU1_K1_LBSPPA1024_LBSPPB1024_LBSPPM0_LPA16_LPB16_LPM0_LRVW8_LWPMn1_MIAV0_MIWT2_1_MO40_NTn1_NTA7_NTB1_NTC0_NTD6_NTM0_NEPBS12_NLCA1_NLCB1_ONLL1_PGR2_PLR1_PKA1_SIA3_SS1_SU0_SUM0_SUS512_SPO0_SRVW0_SSO0_SVW2_SK3_SKXCCM8_TLDS2_ULSGRO0_USL1_UIOFGRO0_USFGRO1_VSn1_VWA2_VWB1_WSGRA0_WSGRB0_WS64_WG32_8_1_WGM24_WGMXCC1_WGMXCCGn1
    SolutionIndex: 30
    SolutionNameMin: Cijk_Alik_Bljk_BBS_BH_Bias_HAS_SAV_UserArgs_MT32x32x128_MI16x16x1_SN_LDSB0_AFC0_AFEM1_AFEM1_ASEM1_CLR1_CADS0_DTLA0_DTLB0_DTVA0_DTVB0_EPS0_FDSI0_GRPM1_GRVWA8_GRVWB8_GSU0_GSUAMB_GSUC0_GSUWGMRR0_GLS0_ISA950_IU1_K1_LBSPPA256_LBSPPB256_LBSPPM0_LPA16_LPB16_LPM0_LRVW8_LWPMn1_MIAV1_MIWT1_1_MO40_NTn1_NTA2_NTB1_NTC1_NTD0_NTM0_NEPBS0_NLCA1_NLCB1_ONLL1_PGR2_PLR1_PKA1_SIA3_SS1_SU8_SUM0_SUS256_SPO1_SRVW0_SSO1_SVW1_SK3_SKXCCM4_TLDS1_ULSGRO0_USL1_UIOFGRO0_USFGRO1_VSn1_VWA1_VWB1_WSGRA0_WSGRB0_WS64_WG32_8_1_WGM1_WGMXCC1_WGMXCCGn1
    SolutionIndex: 31
    SolutionNameMin: Cijk_Alik_Bljk_BBS_BH_Bias_HAS_SAV_UserArgs_MT48x64x256_MI16x16x1_SN_LDSB0_AFC0_AFEM1_AFEM1_ASEM1_CLR1_CADS0_DTLA0_DTLB0_DTVA0_DTVB0_EPS0_FDSI0_GRPM1_GRVWA8_GRVWB8_GSU0_GSUAMB_GSUC0_GSUWGMRR0_GLS0_ISA950_IU1_K1_LBSPPA512_LBSPPB512_LBSPPM0_LPA16_LPB16_LPM0_LRVW8_LWPMn1_MIAV0_MIWT3_1_MO40_NTn1_NTA7_NTB2_NTC1_NTD0_NTM0_NEPBS16_NLCA1_NLCB1_ONLL1_PGR2_PLR1_PKA1_SIA3_SS1_SU0_SUM0_SUS512_SPO1_SRVW0_SSO0_SVW1_SK3_SKXCCM4_TLDS1_ULSGRO0_USL1_UIOFGRO0_USFGRO0_VSn1_VWA1_VWB1_WSGRA0_WSGRB0_WS64_WG16_16_1_WGM0_WGMXCC8_WGMXCCGn1
    SolutionIndex: 32
    SolutionNameMin: Cijk_Alik_Bljk_BBS_BH_Bias_HAS_SAV_UserArgs_MT64x64x128_MI16x16x1_SN_LDSB0_AFC0_AFEM1_AFEM1_ASEM1_CLR0_CADS0_DTLA0_DTLB0_DTVA0_DTVB0_EPS0_FDSI0_GRPM1_GRVWA8_GRVWB8_GSU0_GSUAMB_GSUC0_GSUWGMRR0_GLS0_ISA950_IU1_K1_LBSPPA512_LBSPPB512_LBSPPM0_LPA16_LPB16_LPM0_LRVW8_LWPMn1_MIAV0_MIWT2_2_MO40_NTn1_NTA3_NTB3_NTC3_NTD5_NTM0_NEPBS16_NLCA1_NLCB1_ONLL1_PGR2_PLR1_PKA1_SIA3_SS1_SU8_SUM0_SUS256_SPO1_SRVW0_SSO1_SVW2_SK3_SKXCCM4_TLDS1_ULSGRO0_USL1_UIOFGRO0_USFGRO1_VSn1_VWA2_VWB2_WSGRA0_WSGRB0_WS64_WG32_8_1_WGM0_WGMXCC4_WGMXCCGn1
    SolutionIndex: 33
    SolutionNameMin: Cijk_Alik_Bljk_BBS_BH_Bias_HAS_SAV_UserArgs_MT64x64x256_MI16x16x1_SN_LDSB0_AFC0_AFEM1_AFEM1_ASEM1_CLR0_CADS0_DTLA1_DTLB1_DTVA0_DTVB0_EPS0_FDSI0_GRPM1_GRVWA8_GRVWB8_GSU0_GSUAMB_GSUC0_GSUWGMRR0_GLS0_ISA950_IU1_K1_LBSPPA1024_LBSPPB1024_LBSPPM0_LPA16_LPB16_LPM0_LRVW8_LWPMn1_MIAV0_MIWT2_2_MO40_NTn1_NTA3_NTB3_NTC2_NTD6_NTM0_NEPBS8_NLCA1_NLCB1_ONLL1_PGR2_PLR1_PKA1_SIA3_SS1_SU0_SUM0_SUS512_SPO1_SRVW0_SSO0_SVW2_SK3_SKXCCM0_TLDS2_ULSGRO0_USL1_UIOFGRO0_USFGRO0_VSn1_VWA2_VWB2_WSGRA0_WSGRB0_WS64_WG32_8_1_WGM16_WGMXCC16_WGMXCCGn1
    SolutionIndex: 34
    SolutionNameMin: Cijk_Alik_Bljk_BBS_BH_Bias_HAS_SAV_UserArgs_MT64x32x128_MI16x16x1_SN_LDSB0_AFC0_AFEM1_AFEM1_ASEM1_CLR1_CADS0_DTLA0_DTLB0_DTVA0_DTVB0_EPS0_FDSI0_GRPM1_GRVWA8_GRVWB8_GSU0_GSUAMB_GSUC0_GSUWGMRR0_GLS0_ISA950_IU1_K1_LBSPPA512_LBSPPB256_LBSPPM0_LPA16_LPB16_LPM0_LRVW8_LWPMn1_MIAV0_MIWT2_1_MO40_NTn1_NTA0_NTB0_NTC5_NTD4_NTM0_NEPBS10_NLCA1_NLCB1_ONLL1_PGR2_PLR1_PKA1_SIA3_SS1_SU8_SUM0_SUS512_SPO1_SRVW0_SSO1_SVW2_SK3_SKXCCM8_TLDS1_ULSGRO0_USL1_UIOFGRO0_USFGROn1_VSn1_VWA2_VWB1_WSGRA0_WSGRB0_WS64_WG32_8_1_WGM6_WGMXCC1_WGMXCCGn1
    SolutionIndex: 35
    SolutionNameMin: Cijk_Alik_Bljk_BBS_BH_Bias_HAS_SAV_UserArgs_MT64x80x128_MI16x16x1_SN_LDSB0_AFC0_AFEM1_AFEM1_ASEM1_CLR1_CADS0_DTLA0_DTLB0_DTVA0_DTVB0_EPS0_FDSI0_GRPM1_GRVWA8_GRVWB8_GSU0_GSUAMB_GSUC0_GSUWGMRR0_GLS0_ISA950_IU1_K1_LBSPPA256_LBSPPB256_LBSPPM0_LPA16_LPB16_LPM0_LRVW8_LWPMn1_MIAV0_MIWT1_5_MO40_NTn1_NTA3_NTB0_NTC1_NTD4_NTM0_NEPBS0_NLCA1_NLCB1_ONLL1_PGR2_PLR1_PKA1_SIA3_SS1_SU8_SUM0_SUS256_SPO1_SRVW0_SSO0_SVW1_SK3_SKXCCM5_TLDS1_ULSGRO0_USL1_UIOFGRO0_USFGROn1_VSn1_VWA1_VWB1_WSGRA0_WSGRB0_WS64_WG64_4_1_WGM0_WGMXCC8_WGMXCCGn1
    SolutionIndex: 36
    SolutionNameMin: Cijk_Alik_Bljk_BBS_BH_Bias_HAS_SAV_UserArgs_MT96x128x128_MI16x16x1_SN_LDSB0_AFC0_AFEM1_AFEM1_ASEM1_CLR0_CADS0_DTLA0_DTLB0_DTVA0_DTVB0_EPS0_FDSI0_GRPM1_GRVWA8_GRVWB8_GSU0_GSUAMB_GSUC0_GSUWGMRR0_GLS0_ISA950_IU1_K1_LBSPPA512_LBSPPB512_LBSPPM0_LPA16_LPB16_LPM0_LRVW8_LWPMn1_MIAV0_MIWT6_2_MO40_NTn1_NTA7_NTB0_NTC4_NTD1_NTM0_NEPBS0_NLCA1_NLCB1_ONLL1_PGR2_PLR1_PKA1_SIA3_SS1_SU8_SUM0_SUS256_SPO0_SRVW0_SSO0_SVW2_SK3_SKXCCM4_TLDS2_ULSGRO0_USL1_UIOFGRO0_USFGRO0_VSn1_VWA2_VWB2_WSGRA0_WSGRB0_WS64_WG16_16_1_WGM1_WGMXCC8_WGMXCCGn1
    SolutionIndex: 37
    SolutionNameMin: Cijk_Alik_Bljk_BBS_BH_Bias_HAS_SAV_UserArgs_MT128x48x128_MI16x16x1_SN_LDSB0_AFC0_AFEM1_AFEM1_ASEM1_CLR1_CADS0_DTLA0_DTLB0_DTVA0_DTVB0_EPS0_FDSI0_GRPM1_GRVWA8_GRVWB8_GSU0_GSUAMB_GSUC0_GSUWGMRR0_GLS0_ISA950_IU1_K1_LBSPPA512_LBSPPB256_LBSPPM0_LPA16_LPB16_LPM0_LRVW8_LWPMn1_MIAV0_MIWT2_3_MO40_NTn1_NTA0_NTB2_NTC6_NTD4_NTM0_NEPBS0_NLCA1_NLCB1_ONLL1_PGR2_PLR1_PKA1_SIA3_SS1_SU16_SUM0_SUS512_SPO0_SRVW0_SSO0_SVW2_SK3_SKXCCM0_TLDS2_ULSGRO0_USL1_UIOFGRO0_USFGRO0_VSn1_VWA2_VWB1_WSGRA0_WSGRB0_WS64_WG64_4_1_WGM6_WGMXCC8_WGMXCCGn1
    SolutionIndex: 38
    SolutionNameMin: Cijk_Alik_Bljk_BBS_BH_Bias_HAS_SAV_UserArgs_MT64x128x128_MI16x16x1_SN_LDSB0_AFC0_AFEM1_AFEM1_ASEM1_CLR0_CADS0_DTLA1_DTLB1_DTVA0_DTVB0_EPS0_FDSI0_GRPM1_GRVWA8_GRVWB8_GSU0_GSUAMB_GSUC0_GSUWGMRR0_GLS0_ISA950_IU1_K1_LBSPPA1024_LBSPPB1024_LBSPPM0_LPA16_LPB16_LPM0_LRVW8_LWPMn1_MIAV0_MIWT4_2_MO40_NTn1_NTA0_NTB0_NTC7_NTD5_NTM0_NEPBS12_NLCA1_NLCB1_ONLL1_PGR2_PLR1_PKA1_SIA3_SS1_SU8_SUM0_SUS256_SPO1_SRVW0_SSO0_SVW4_SK3_SKXCCM5_TLDS2_ULSGRO0_USL1_UIOFGRO0_USFGRO1_VSn1_VWA4_VWB2_WSGRA0_WSGRB0_WS64_WG16_16_1_WGM1_WGMXCC8_WGMXCCGn1
    SolutionIndex: 39
    SolutionNameMin: Cijk_Alik_Bljk_BBS_BH_Bias_HAS_SAV_UserArgs_MT128x64x128_MI16x16x1_SN_LDSB0_AFC0_AFEM1_AFEM1_ASEM1_CLR0_CADS0_DTLA0_DTLB0_DTVA0_DTVB0_EPS0_FDSI0_GRPM1_GRVWA8_GRVWB8_GSU0_GSUAMB_GSUC0_GSUWGMRR0_GLS0_ISA950_IU1_K1_LBSPPA1024_LBSPPB512_LBSPPM0_LPA16_LPB16_LPM0_LRVW8_LWPMn1_MIAV1_MIWT4_2_MO40_NTn1_NTA2_NTB2_NTC6_NTD5_NTM0_NEPBS0_NLCA1_NLCB1_ONLL1_PGR2_PLR1_PKA1_SIA3_SS1_SU16_SUM0_SUS256_SPO0_SRVW0_SSO4_SVW4_SK3_SKXCCM4_TLDS1_ULSGRO0_USL1_UIOFGRO0_USFGRO0_VSn1_VWA4_VWB2_WSGRA0_WSGRB0_WS64_WG32_8_1_WGM6_WGMXCC2_WGMXCCGn1
    SolutionIndex: 40
    SolutionNameMin: Cijk_Alik_Bljk_BBS_BH_Bias_HAS_SAV_UserArgs_MT128x80x128_MI16x16x1_SN_LDSB0_AFC0_AFEM1_AFEM1_ASEM1_CLR0_CADS0_DTLA0_DTLB0_DTVA0_DTVB0_EPS0_FDSI0_GRPM1_GRVWA8_GRVWB8_GSU0_GSUAMB_GSUC0_GSUWGMRR0_GLS0_ISA950_IU1_K1_LBSPPA512_LBSPPB256_LBSPPM0_LPA16_LPB16_LPM0_LRVW8_LWPMn1_MIAV0_MIWT2_5_MO40_NTn1_NTA1_NTB1_NTC0_NTD4_NTM0_NEPBS0_NLCA1_NLCB1_ONLL1_PGR2_PLR1_PKA1_SIA3_SS1_SU16_SUM0_SUS512_SPO0_SRVW0_SSO0_SVW2_SK3_SKXCCM8_TLDS1_ULSGRO0_USL1_UIOFGRO0_USFGRO0_VSn1_VWA2_VWB1_WSGRA0_WSGRB0_WS64_WG64_4_1_WGM32_WGMXCC1_WGMXCCGn1
    SolutionIndex: 41
    SolutionNameMin: Cijk_Alik_Bljk_BBS_BH_Bias_HAS_SAV_UserArgs_MT128x80x128_MI16x16x1_SN_LDSB0_AFC0_AFEM1_AFEM1_ASEM1_CLR1_CADS0_DTLA0_DTLB0_DTVA0_DTVB0_EPS0_FDSI0_GRPM1_GRVWA8_GRVWB8_GSU0_GSUAMB_GSUC0_GSUWGMRR0_GLS0_ISA950_IU1_K1_LBSPPA512_LBSPPB256_LBSPPM0_LPA16_LPB16_LPM0_LRVW8_LWPMn1_MIAV1_MIWT2_5_MO40_NTn1_NTA2_NTB2_NTC1_NTD4_NTM0_NEPBS0_NLCA1_NLCB1_ONLL1_PGR2_PLR1_PKA1_SIA3_SS1_SU16_SUM0_SUS512_SPO0_SRVW0_SSO0_SVW2_SK3_SKXCCM4_TLDS1_ULSGRO0_USL1_UIOFGRO0_USFGROn1_VSn1_VWA2_VWB1_WSGRA0_WSGRB0_WS64_WG64_4_1_WGM16_WGMXCC2_WGMXCCGn1
    SolutionIndex: 42
    SolutionNameMin: Cijk_Alik_Bljk_BBS_BH_Bias_HAS_SAV_UserArgs_MT64x96x64_MI16x16x1_SN_LDSB0_AFC0_AFEM1_AFEM1_ASEM1_CLR0_CADS0_DTLA0_DTLB0_DTVA0_DTVB0_EPS0_FDSI0_GRPM1_GRVWA8_GRVWB8_GSU0_GSUAMB_GSUC0_GSUWGMRR0_GLS0_ISA950_IU1_K1_LBSPPA256_LBSPPB128_LBSPPM0_LPA16_LPB16_LPM0_LRVW8_LWPMn1_MIAV0_MIWT2_3_MO40_NTn1_NTA2_NTB3_NTC0_NTD0_NTM0_NEPBS12_NLCA1_NLCB1_ONLL1_PGR2_PLR1_PKA1_SIA3_SS1_SU8_SUM0_SUS256_SPO1_SRVW0_SSO0_SVW2_SK3_SKXCCM0_TLDS1_ULSGRO0_USL1_UIOFGRO0_USFGROn1_VSn1_VWA2_VWB1_WSGRA0_WSGRB0_WS64_WG32_8_1_WGM1_WGMXCC4_WGMXCCGn1
    SolutionIndex: 43
    SolutionNameMin: Cijk_Alik_Bljk_BBS_BH_Bias_HAS_SAV_UserArgs_MT96x128x128_MI16x16x1_SN_LDSB0_AFC0_AFEM1_AFEM1_ASEM1_CLR1_CADS0_DTLA1_DTLB1_DTVA0_DTVB0_EPS0_FDSI0_GRPM1_GRVWA2_GRVWB8_GSU0_GSUAMB_GSUC0_GSUWGMRR0_GLS0_ISA950_IU1_K1_LBSPPA512_LBSPPB1024_LBSPPM0_LPA16_LPB16_LPM0_LRVW8_LWPMn1_MIAV1_MIWT6_2_MO40_NTn1_NTA0_NTB2_NTC1_NTD0_NTM0_NEPBS0_NLCA1_NLCB1_ONLL1_PGR2_PLR1_PKA1_SIA3_SS1_SU0_SUM0_SUS256_SPO0_SRVW0_SSO4_SVW2_SK3_SKXCCM0_TLDS1_ULSGRO0_USL1_UIOFGRO0_USFGRO0_VSn1_VWA2_VWB2_WSGRA0_WSGRB0_WS64_WG16_16_1_WGM16_WGMXCC4_WGMXCCGn1
    SolutionIndex: 44
    SolutionNameMin: Cijk_Alik_Bljk_BBS_BH_Bias_HAS_SAV_UserArgs_MT96x128x128_MI16x16x1_SN_LDSB0_AFC0_AFEM1_AFEM1_ASEM1_CLR0_CADS0_DTLA0_DTLB0_DTVA0_DTVB0_EPS0_FDSI0_GRPM1_GRVWA8_GRVWB8_GSU0_GSUAMB_GSUC0_GSUWGMRR0_GLS0_ISA950_IU1_K1_LBSPPA512_LBSPPB512_LBSPPM0_LPA16_LPB16_LPM0_LRVW8_LWPMn1_MIAV1_MIWT6_2_MO40_NTn1_NTA0_NTB1_NTC3_NTD0_NTM0_NEPBS0_NLCA1_NLCB1_ONLL1_PGR2_PLR1_PKA1_SIA3_SS1_SU0_SUM0_SUS256_SPO0_SRVW0_SSO0_SVW2_SK3_SKXCCM0_TLDS1_ULSGRO0_USL1_UIOFGRO0_USFGRO0_VSn1_VWA2_VWB2_WSGRA0_WSGRB0_WS64_WG16_16_1_WGM16_WGMXCC4_WGMXCCGn1
    SolutionIndex: 45
    SolutionNameMin: Cijk_Alik_Bljk_BBS_BH_Bias_HAS_SAV_UserArgs_MT64x128x64_MI32x32x1_SN_LDSB0_AFC0_AFEM1_AFEM1_ASEM1_CLR1_CADS0_DTLA0_DTLB0_DTVA0_DTVB0_EPS0_FDSI0_GRPM1_GRVWA8_GRVWB8_GSU0_GSUAMB_GSUC0_GSUWGMRR0_GLS0_ISA950_IU1_K1_LBSPPA256_LBSPPB128_LBSPPM0_LPA8_LPB8_LPM0_LRVW8_LWPMn1_MIAV0_MIWT2_1_MO40_NTn1_NTA3_NTB1_NTC7_NTD6_NTM0_NEPBS0_NLCA1_NLCB1_ONLL1_PGR2_PLR1_PKA1_SIA3_SS1_SU8_SUM0_SUS128_SPO1_SRVW0_SSO1_SVW2_SK3_SKXCCM0_TLDS2_ULSGRO0_USL1_UIOFGRO0_USFGROn1_VSn1_VWA2_VWB1_WSGRA0_WSGRB0_WS64_WG32_8_1_WGM16_WGMXCC8_WGMXCCGn1
    SolutionIndex: 46
    SolutionNameMin: Cijk_Alik_Bljk_BBS_BH_Bias_HAS_SAV_UserArgs_MT192x128x64_MI16x16x1_SN_LDSB1_AFC0_AFEM1_AFEM1_ASEM1_CLR0_CADS0_DTLA0_DTLB0_DTVA0_DTVB0_EPS0_FDSI0_GRPM1_GRVWA8_GRVWB8_GSU0_GSUAMB_GSUC0_GSUWGMRR0_GLS0_ISA950_IU1_K1_LBSPPA512_LBSPPB256_LBSPPM0_LPA16_LPB16_LPM0_LRVW8_LWPMn1_MIAV0_MIWT12_2_MO40_NTn1_NTA1_NTB3_NTC5_NTD5_NTM0_NEPBS14_NLCA1_NLCB1_ONLL1_PGR2_PLR1_PKA1_SIA3_SS1_SU8_SUM0_SUS128_SPO0_SRVW0_SSO1_SVW4_SK3_SKXCCM0_TLDS1_ULSGRO0_USL1_UIOFGRO0_USFGROn1_VSn1_VWA4_VWB2_WSGRA0_WSGRB0_WS64_WG16_16_1_WGM1_WGMXCC8_WGMXCCGn1
    SolutionIndex: 47
    SolutionNameMin: Cijk_Alik_Bljk_BBS_BH_Bias_HAS_SAV_UserArgs_MT192x320x64_MI16x16x1_SN_LDSB0_AFC0_AFEM1_AFEM1_ASEM1_CLR0_CADS0_DTLA1_DTLB1_DTVA0_DTVB0_EPS0_FDSI0_GRPM1_GRVWA2_GRVWB8_GSU0_GSUAMB_GSUC0_GSUWGMRR0_GLS0_ISA950_IU1_K1_LBSPPA512_LBSPPB1024_LBSPPM0_LPA16_LPB16_LPM0_LRVW8_LWPMn1_MIAV0_MIWT12_5_MO40_NTn1_NTA3_NTB1_NTC4_NTD2_NTM0_NEPBS0_NLCA1_NLCB1_ONLL1_PGR2_PLR1_PKA1_SIA3_SS1_SU16_SUM0_SUS128_SPO1_SRVW0_SSO4_SVW4_SK3_SKXCCM0_TLDS1_ULSGRO0_USL1_UIOFGRO0_USFGRO0_VSn1_VWA4_VWB1_WSGRA0_WSGRB0_WS64_WG16_16_1_WGM2_WGMXCC2_WGMXCCGn1
    SolutionIndex: 48
    SolutionNameMin: Cijk_Alik_Bljk_BBS_BH_Bias_HAS_SAV_UserArgs_MT64x16x64_MI16x16x1_SN_LDSB0_AFC0_AFEM1_AFEM1_ASEM1_CLR0_CADS0_DTLA1_DTLB1_DTVA0_DTVB0_EPS0_FDSI0_GRPM1_GRVWA8_GRVWB2_GSU0_GSUAMB_GSUC0_GSUWGMRR0_GLS0_ISA950_IU1_K1_LBSPPA1024_LBSPPB256_LBSPPM0_LPA16_LPB16_LPM0_LRVW8_LWPMn1_MIAV1_MIWT4_1_MO40_NTn1_NTA4_NTB1_NTC1_NTD0_NTM0_NEPBS0_NLCA1_NLCB1_ONLL1_PGR2_PLR1_PKA1_SIA3_SS0_SU0_SUM0_SUS128_SPO0_SRVW0_SSO0_SVW4_SK3_SKXCCM0_TLDS1_ULSGRO0_USL1_UIOFGRO0_USFGROn1_VSn1_VWA4_VWB1_WSGRA0_WSGRB0_WS64_WG16_4_2_WGM1_WGMXCC16_WGMXCCGn1
    SolutionIndex: 49
    SolutionNameMin: Cijk_Alik_Bljk_BBS_BH_Bias_HAS_SAV_UserArgs_MT64x96x64_MI16x16x1_SN_LDSB0_AFC0_AFEM1_AFEM1_ASEM1_CLR0_CADS0_DTLA1_DTLB1_DTVA0_DTVB0_EPS0_FDSI0_GRPM1_GRVWA2_GRVWB8_GSU0_GSUAMB_GSUC0_GSUWGMRR0_GLS0_ISA950_IU1_K1_LBSPPA256_LBSPPB1024_LBSPPM0_LPA16_LPB16_LPM0_LRVW8_LWPMn1_MIAV1_MIWT2_3_MO40_NTn1_NTA4_NTB2_NTC3_NTD2_NTM0_NEPBS16_NLCA1_NLCB1_ONLL1_PGR2_PLR1_PKA1_SIA3_SS1_SU0_SUM0_SUS128_SPO0_SRVW0_SSO0_SVW2_SK3_SKXCCM6_TLDS1_ULSGRO0_USL1_UIOFGRO0_USFGRO0_VSn1_VWA2_VWB1_WSGRA0_WSGRB0_WS64_WG32_8_1_WGM0_WGMXCC4_WGMXCCGn1
    SolutionIndex: 50
    SolutionNameMin: Cijk_Alik_Bljk_BBS_BH_Bias_HAS_SAV_UserArgs_MT64x128x64_MI16x16x1_SN_LDSB0_AFC0_AFEM1_AFEM1_ASEM1_CLR1_CADS0_DTLA1_DTLB1_DTVA0_DTVB0_EPS0_FDSI0_GRPM1_GRVWA2_GRVWB2_GSU0_GSUAMB_GSUC0_GSUWGMRR0_GLS0_ISA950_IU1_K1_LBSPPA512_LBSPPB256_LBSPPM0_LPA16_LPB16_LPM0_LRVW8_LWPMn1_MIAV1_MIWT4_2_MO40_NTn1_NTA4_NTB1_NTC0_NTD2_NTM0_NEPBS0_NLCA1_NLCB1_ONLL1_PGR2_PLR1_PKA1_SIA3_SS1_SU0_SUM0_SUS128_SPO0_SRVW0_SSO0_SVW4_SK3_SKXCCM6_TLDS1_ULSGRO0_USL1_UIOFGRO0_USFGRO0_VSn1_VWA4_VWB2_WSGRA0_WSGRB0_WS64_WG16_16_1_WGM0_WGMXCC4_WGMXCCGn1
    SolutionIndex: 51
    SolutionNameMin: Cijk_Alik_Bljk_BBS_BH_Bias_HAS_SAV_UserArgs_MT128x96x64_MI16x16x1_SN_LDSB0_AFC0_AFEM1_AFEM1_ASEM1_CLR0_CADS0_DTLA1_DTLB1_DTVA0_DTVB0_EPS0_FDSI0_GRPM1_GRVWA8_GRVWB8_GSU0_GSUAMB_GSUC0_GSUWGMRR0_GLS0_ISA950_IU1_K1_LBSPPA1024_LBSPPB1024_LBSPPM0_LPA16_LPB16_LPM0_LRVW8_LWPMn1_MIAV1_MIWT4_3_MO40_NTn1_NTA4_NTB2_NTC0_NTD3_NTM0_NEPBS0_NLCA1_NLCB1_ONLL1_PGR2_PLR1_PKA1_SIA3_SS1_SU8_SUM0_SUS128_SPO0_SRVW0_SSO0_SVW4_SK3_SKXCCM5_TLDS1_ULSGRO0_USL1_UIOFGRO0_USFGRO1_VSn1_VWA4_VWB1_WSGRA0_WSGRB0_WS64_WG32_8_1_WGM1_WGMXCC16_WGMXCCGn1
    SolutionIndex: 52
    SolutionNameMin: Cijk_Alik_Bljk_BBS_BH_Bias_HAS_SAV_UserArgs_MT128x128x64_MI16x16x1_SN_LDSB0_AFC0_AFEM1_AFEM1_ASEM1_CLR0_CADS0_DTLA1_DTLB1_DTVA0_DTVB0_EPS0_FDSI0_GRPM1_GRVWA8_GRVWB8_GSU0_GSUAMB_GSUC0_GSUWGMRR0_GLS0_ISA950_IU1_K1_LBSPPA1024_LBSPPB1024_LBSPPM0_LPA16_LPB16_LPM0_LRVW8_LWPMn1_MIAV1_MIWT4_4_MO40_NTn1_NTA4_NTB1_NTC1_NTD2_NTM0_NEPBS0_NLCA1_NLCB1_ONLL1_PGR2_PLR1_PKA1_SIA3_SS1_SU0_SUM0_SUS128_SPO0_SRVW0_SSO0_SVW4_SK3_SKXCCM5_TLDS1_ULSGRO0_USL1_UIOFGRO0_USFGRO1_VSn1_VWA4_VWB4_WSGRA0_WSGRB0_WS64_WG32_8_1_WGM0_WGMXCC16_WGMXCCGn1
    SolutionIndex: 53
    SolutionNameMin: Cijk_Alik_Bljk_BBS_BH_Bias_HAS_SAV_UserArgs_MT128x192x64_MI16x16x1_SN_LDSB0_AFC0_AFEM1_AFEM1_ASEM1_CLR1_CADS0_DTLA0_DTLB0_DTVA0_DTVB0_EPS0_FDSI0_GRPM1_GRVWA8_GRVWB8_GSU0_GSUAMB_GSUC0_GSUWGMRR0_GLS0_ISA950_IU1_K1_LBSPPA512_LBSPPB256_LBSPPM0_LPA16_LPB16_LPM0_LRVW8_LWPMn1_MIAV0_MIWT4_6_MO40_NTn1_NTA7_NTB0_NTC7_NTD0_NTM0_NEPBS0_NLCA1_NLCB1_ONLL1_PGR2_PLR1_PKA1_SIA3_SS1_SU0_SUM0_SUS128_SPO0_SRVW0_SSO0_SVW4_SK3_SKXCCM5_TLDS1_ULSGRO0_USL1_UIOFGRO0_USFGRO0_VSn1_VWA4_VWB2_WSGRA0_WSGRB0_WS64_WG32_8_1_WGM0_WGMXCC16_WGMXCCGn1
    SolutionIndex: 54
    SolutionNameMin: Cijk_Alik_Bljk_BBS_BH_Bias_HAS_SAV_UserArgs_MT64x192x64_MI16x16x1_SN_LDSB0_AFC0_AFEM1_AFEM1_ASEM1_CLR1_CADS0_DTLA1_DTLB1_DTVA0_DTVB0_EPS0_FDSI0_GRPM1_GRVWA2_GRVWB8_GSU0_GSUAMB_GSUC0_GSUWGMRR0_GLS0_ISA950_IU1_K1_LBSPPA512_LBSPPB1024_LBSPPM0_LPA16_LPB16_LPM0_LRVW8_LWPMn1_MIAV0_MIWT4_3_MO40_NTn1_NTA7_NTB3_NTC0_NTD5_NTM0_NEPBS0_NLCA1_NLCB1_ONLL1_PGR2_PLR1_PKA1_SIA3_SS1_SU0_SUM0_SUS128_SPO0_SRVW0_SSO0_SVW4_SK3_SKXCCM4_TLDS1_ULSGRO0_USL1_UIOFGRO0_USFGRO0_VSn1_VWA4_VWB1_WSGRA0_WSGRB0_WS64_WG16_16_1_WGM32_WGMXCC4_WGMXCCGn1
    SolutionIndex: 55
    SolutionNameMin: Cijk_Alik_Bljk_BBS_BH_Bias_HAS_SAV_UserArgs_MT128x128x64_MI32x32x1_SN_LDSB0_AFC0_AFEM1_AFEM1_ASEM1_CLR1_CADS0_DTLA0_DTLB0_DTVA0_DTVB0_EPS0_FDSI0_GRPM1_GRVWA8_GRVWB8_GSU0_GSUAMB_GSUC0_GSUWGMRR0_GLS0_ISA950_IU1_K1_LBSPPA256_LBSPPB256_LBSPPM0_LPA8_LPB8_LPM0_LRVW8_LWPMn1_MIAV0_MIWT2_2_MO40_NTn1_NTA2_NTB2_NTC1_NTD7_NTM0_NEPBS0_NLCA1_NLCB1_ONLL1_PGR2_PLR1_PKA1_SIA3_SS1_SU8_SUM0_SUS512_SPO0_SRVW0_SSO0_SVW2_SK3_SKXCCM0_TLDS1_ULSGRO0_USL1_UIOFGRO0_USFGRO1_VSn1_VWA2_VWB2_WSGRA0_WSGRB0_WS64_WG64_4_1_WGM24_WGMXCC8_WGMXCCGn1
    SolutionIndex: 56
    SolutionNameMin: Cijk_Alik_Bljk_BBS_BH_Bias_HAS_SAV_UserArgs_MT128x192x64_MI16x16x1_SN_LDSB0_AFC0_AFEM1_AFEM1_ASEM1_CLR0_CADS0_DTLA1_DTLB1_DTVA0_DTVB0_EPS0_FDSI0_GRPM1_GRVWA2_GRVWB8_GSU0_GSUAMB_GSUC0_GSUWGMRR0_GLS0_ISA950_IU1_K1_LBSPPA1024_LBSPPB1024_LBSPPM0_LPA16_LPB16_LPM0_LRVW8_LWPMn1_MIAV0_MIWT8_3_MO40_NTn1_NTA5_NTB3_NTC6_NTD5_NTM0_NEPBS0_NLCA1_NLCB1_ONLL1_PGR2_PLR1_PKA1_SIA3_SS1_SU0_SUM0_SUS128_SPO1_SRVW0_SSO1_SVW8_SK3_SKXCCM4_TLDS2_ULSGRO0_USL1_UIOFGRO0_USFGRO0_VSn1_VWA8_VWB1_WSGRA0_WSGRB0_WS64_WG16_16_1_WGM48_WGMXCC2_WGMXCCGn1
    SolutionIndex: 57
    SolutionNameMin: Cijk_Alik_Bljk_BBS_BH_Bias_HAS_SAV_UserArgs_MT128x160x64_MI16x16x1_SN_LDSB0_AFC0_AFEM1_AFEM1_ASEM1_CLR1_CADS0_DTLA1_DTLB1_DTVA0_DTVB0_EPS0_FDSI0_GRPM1_GRVWA2_GRVWB8_GSU0_GSUAMB_GSUC0_GSUWGMRR0_GLS0_ISA950_IU1_K1_LBSPPA512_LBSPPB1024_LBSPPM0_LPA16_LPB16_LPM0_LRVW8_LWPMn1_MIAV0_MIWT4_5_MO40_NTn1_NTA2_NTB1_NTC0_NTD4_NTM0_NEPBS0_NLCA1_NLCB1_ONLL1_PGR2_PLR1_PKA1_SIA3_SS1_SU0_SUM0_SUS128_SPO0_SRVW0_SSO0_SVW4_SK3_SKXCCM4_TLDS2_ULSGRO0_USL1_UIOFGRO0_USFGRO0_VSn1_VWA4_VWB1_WSGRA0_WSGRB0_WS64_WG32_8_1_WGM24_WGMXCC1_WGMXCCGn1
    SolutionIndex: 58
    SolutionNameMin: Cijk_Alik_Bljk_BBS_BH_Bias_HAS_SAV_UserArgs_MT160x160x64_MI16x16x1_SN_LDSB0_AFC0_AFEM1_AFEM1_ASEM1_CLR0_CADS0_DTLA0_DTLB0_DTVA0_DTVB0_EPS0_FDSI0_GRPM1_GRVWA8_GRVWB8_GSU0_GSUAMB_GSUC0_GSUWGMRR0_GLS0_ISA950_IU1_K1_LBSPPA128_LBSPPB128_LBSPPM0_LPA16_LPB16_LPM0_LRVW8_LWPMn1_MIAV0_MIWT5_5_MO40_NTn1_NTA0_NTB2_NTC1_NTD5_NTM0_NEPBS0_NLCA1_NLCB1_ONLL1_PGR2_PLR1_PKA1_SIA3_SS1_SU0_SUM0_SUS128_SPO0_SRVW0_SSO0_SVW1_SK3_SKXCCM0_TLDS2_ULSGRO0_USL1_UIOFGRO0_USFGRO1_VSn1_VWA1_VWB1_WSGRA0_WSGRB0_WS64_WG32_8_1_WGM48_WGMXCC4_WGMXCCGn1
    SolutionIndex: 59
    SolutionNameMin: Cijk_Alik_Bljk_BBS_BH_Bias_HAS_SAV_UserArgs_MT256x192x64_MI16x16x1_SN_LDSB0_AFC0_AFEM1_AFEM1_ASEM1_CLR1_CADS0_DTLA1_DTLB1_DTVA0_DTVB0_EPS0_FDSI0_GRPM1_GRVWA8_GRVWB8_GSU0_GSUAMB_GSUC0_GSUWGMRR0_GLS0_ISA950_IU1_K1_LBSPPA1024_LBSPPB1024_LBSPPM0_LPA16_LPB16_LPM0_LRVW8_LWPMn1_MIAV0_MIWT16_3_MO40_NTn1_NTA3_NTB3_NTC5_NTD6_NTM0_NEPBS0_NLCA1_NLCB1_ONLL1_PGR2_PLR1_PKA1_SIA3_SS1_SU8_SUM0_SUS128_SPO0_SRVW0_SSO4_SVW8_SK3_SKXCCM0_TLDS2_ULSGRO0_USL1_UIOFGRO0_USFGRO0_VSn1_VWA8_VWB1_WSGRA0_WSGRB0_WS64_WG16_16_1_WGM2_WGMXCC1_WGMXCCGn1
    SolutionIndex: 60
    SolutionNameMin: Cijk_Alik_Bljk_BBS_BH_Bias_HAS_SAV_UserArgs_MT112x16x64_MI16x16x1_SN_LDSB0_AFC0_AFEM1_AFEM1_ASEM1_CLR1_CADS0_DTLA1_DTLB1_DTVA0_DTVB0_EPS0_FDSI0_GRPM1_GRVWA8_GRVWB8_GSU0_GSUAMB_GSUC0_GSUWGMRR0_GLS0_ISA950_IU1_K1_LBSPPA1024_LBSPPB1024_LBSPPM0_LPA16_LPB16_LPM0_LRVW8_LWPMn1_MIAV0_MIWT7_1_MO40_NTn1_NTA5_NTB2_NTC2_NTD1_NTM0_NEPBS10_NLCA1_NLCB1_ONLL1_PGR2_PLR1_PKA1_SIA3_SS0_SU16_SUM0_SUS256_SPO0_SRVW0_SSO0_SVW4_SK3_SKXCCM4_TLDS1_ULSGRO0_USL1_UIOFGRO0_USFGRO0_VSn1_VWA1_VWB1_WSGRA0_WSGRB0_WS64_WG16_4_1_WGM0_WGMXCC4_WGMXCCGn1
    SolutionIndex: 61
    SolutionNameMin: Cijk_Alik_Bljk_BBS_BH_Bias_HAS_SAV_UserArgs_MT128x16x64_MI16x16x1_SN_LDSB0_AFC0_AFEM1_AFEM1_ASEM1_CLR1_CADS0_DTLA1_DTLB1_DTVA0_DTVB0_EPS0_FDSI0_GRPM1_GRVWA8_GRVWB2_GSU0_GSUAMB_GSUC0_GSUWGMRR0_GLS0_ISA950_IU1_K1_LBSPPA1024_LBSPPB256_LBSPPM0_LPA16_LPB16_LPM0_LRVW8_LWPMn1_MIAV1_MIWT4_1_MO40_NTn1_NTA1_NTB0_NTC1_NTD5_NTM0_NEPBS12_NLCA1_NLCB1_ONLL1_PGR2_PLR1_PKA1_SIA3_SS1_SU16_SUM0_SUS128_SPO0_SRVW0_SSO0_SVW4_SK3_SKXCCM0_TLDS2_ULSGRO0_USL1_UIOFGRO0_USFGRO1_VSn1_VWA4_VWB1_WSGRA0_WSGRB0_WS64_WG32_4_1_WGM0_WGMXCC8_WGMXCCGn1
    SolutionIndex: 62
    SolutionNameMin: Cijk_Alik_Bljk_BBS_BH_Bias_HAS_SAV_UserArgs_MT112x32x64_MI16x16x1_SN_LDSB0_AFC0_AFEM1_AFEM1_ASEM1_CLR1_CADS0_DTLA1_DTLB1_DTVA0_DTVB0_EPS0_FDSI0_GRPM1_GRVWA8_GRVWB8_GSU0_GSUAMB_GSUC0_GSUWGMRR0_GLS0_ISA950_IU1_K1_LBSPPA1024_LBSPPB1024_LBSPPM0_LPA16_LPB16_LPM0_LRVW8_LWPMn1_MIAV0_MIWT7_1_MO40_NTn1_NTA6_NTB2_NTC2_NTD0_NTM0_NEPBS0_NLCA1_NLCB1_ONLL1_PGR2_PLR1_PKA1_SIA3_SS0_SU16_SUM0_SUS128_SPO0_SRVW0_SSO0_SVW4_SK3_SKXCCM4_TLDS1_ULSGRO0_USL1_UIOFGRO0_USFGROn1_VSn1_VWA1_VWB1_WSGRA0_WSGRB0_WS64_WG16_8_1_WGM0_WGMXCC4_WGMXCCGn1
    SolutionIndex: 63
    SolutionNameMin: Cijk_Alik_Bljk_BBS_BH_Bias_HAS_SAV_UserArgs_MT128x48x64_MI16x16x1_SN_LDSB0_AFC0_AFEM1_AFEM1_ASEM1_CLR1_CADS0_DTLA1_DTLB1_DTVA0_DTVB0_EPS0_FDSI0_GRPM1_GRVWA8_GRVWB2_GSU0_GSUAMB_GSUC0_GSUWGMRR0_GLS0_ISA950_IU1_K1_LBSPPA1024_LBSPPB256_LBSPPM0_LPA16_LPB16_LPM0_LRVW8_LWPMn1_MIAV1_MIWT2_3_MO40_NTn1_NTA4_NTB0_NTC3_NTD0_NTM0_NEPBS10_NLCA1_NLCB1_ONLL1_PGR2_PLR1_PKA1_SIA3_SS0_SU8_SUM0_SUS128_SPO0_SRVW0_SSO0_SVW8_SK3_SKXCCM0_TLDS1_ULSGRO0_USL1_UIOFGRO0_USFGRO1_VSn1_VWA2_VWB1_WSGRA0_WSGRB0_WS64_WG64_4_1_WGM1_WGMXCC16_WGMXCCGn1
    SolutionIndex: 64
    SolutionNameMin: Cijk_Alik_Bljk_BBS_BH_Bias_HAS_SAV_UserArgs_MT128x64x64_MI16x16x1_SN_LDSB0_AFC0_AFEM1_AFEM1_ASEM1_CLR1_CADS0_DTLA1_DTLB1_DTVA0_DTVB0_EPS0_FDSI0_GRPM1_GRVWA8_GRVWB2_GSU0_GSUAMB_GSUC0_GSUWGMRR0_GLS0_ISA950_IU1_K1_LBSPPA1024_LBSPPB256_LBSPPM0_LPA16_LPB16_LPM0_LRVW8_LWPMn1_MIAV0_MIWT4_2_MO40_NTn1_NTA6_NTB2_NTC1_NTD1_NTM0_NEPBS0_NLCA1_NLCB1_ONLL1_PGR2_PLR1_PKA1_SIA3_SS1_SU8_SUM0_SUS512_SPO1_SRVW0_SSO1_SVW4_SK3_SKXCCM0_TLDS1_ULSGRO0_USL1_UIOFGRO0_USFGROn1_VSn1_VWA4_VWB2_WSGRA0_WSGRB0_WS64_WG32_8_1_WGM1_WGMXCC16_WGMXCCGn1
    SolutionIndex: 65
    SolutionNameMin: Cijk_Alik_Bljk_BBS_BH_Bias_HAS_SAV_UserArgs_MT128x96x64_MI16x16x1_SN_LDSB0_AFC0_AFEM1_AFEM1_ASEM1_CLR1_CADS0_DTLA1_DTLB1_DTVA0_DTVB0_EPS0_FDSI0_GRPM1_GRVWA8_GRVWB8_GSU0_GSUAMB_GSUC0_GSUWGMRR0_GLS0_ISA950_IU1_K1_LBSPPA1024_LBSPPB1024_LBSPPM0_LPA16_LPB16_LPM0_LRVW8_LWPMn1_MIAV1_MIWT4_3_MO40_NTn1_NTA2_NTB3_NTC1_NTD5_NTM0_NEPBS16_NLCA1_NLCB1_ONLL1_PGR2_PLR1_PKA1_SIA3_SS1_SU16_SUM0_SUS128_SPO0_SRVW0_SSO0_SVW4_SK3_SKXCCM0_TLDS1_ULSGRO0_USL1_UIOFGRO0_USFGROn1_VSn1_VWA4_VWB1_WSGRA0_WSGRB0_WS64_WG32_8_1_WGM0_WGMXCC8_WGMXCCGn1
    SolutionIndex: 66
    SolutionNameMin: Cijk_Alik_Bljk_BBS_BH_Bias_HAS_SAV_UserArgs_MT416x16x64_MI16x16x1_SN_LDSB1_AFC0_AFEM1_AFEM1_ASEM1_CLR1_CADS0_DTLA0_DTLB0_DTVA0_DTVB0_EPS1_FDSI0_GRPM1_GRVWA8_GRVWB4_GSU0_GSUAMB_GSUC0_GSUWGMRR0_GLS0_ISA950_IU1_K1_LBSPPA128_LBSPPB128_LBSPPM0_LPA16_LPB16_LPM0_LRVW8_LWPMn1_MIAV0_MIWT13_1_MO40_NTn1_NTA5_NTB1_NTC0_NTD1_NTM0_NEPBS0_NLCA1_NLCB1_ONLL1_PGR1_PLR1_PKA1_SIA3_SS0_SU0_SUM0_SUS128_SPO0_SRVW0_SSO1_SVW4_SK3_SKXCCM8_TLDS1_ULSGRO0_USL1_UIOFGRO0_USFGRO0_VSn1_VWA1_VWB1_WSGRA0_WSGRB0_WS64_WG32_4_1_WGM4_WGMXCC32_WGMXCCGn1
    SolutionIndex: 67
    SolutionNameMin: Cijk_Alik_Bljk_BBS_BH_Bias_HAS_SAV_UserArgs_MT448x32x64_MI16x16x1_SN_LDSB1_AFC0_AFEM1_AFEM1_ASEM1_CLR0_CADS0_DTLA0_DTLB0_DTVA0_DTVB0_EPS0_FDSI0_GRPM1_GRVWA8_GRVWB8_GSU0_GSUAMB_GSUC0_GSUWGMRR0_GLS0_ISA950_IU1_K1_LBSPPA256_LBSPPB128_LBSPPM0_LPA16_LPB16_LPM0_LRVW8_LWPMn1_MIAV0_MIWT14_1_MO40_NTn1_NTA5_NTB0_NTC4_NTD1_NTM0_NEPBS8_NLCA1_NLCB1_ONLL1_PGR2_PLR1_PKA1_SIA3_SS0_SU0_SUM0_SUS128_SPO1_SRVW0_SSO0_SVW8_SK3_SKXCCM0_TLDS1_ULSGRO0_USL1_UIOFGRO0_USFGROn1_VSn1_VWA2_VWB1_WSGRA0_WSGRB0_WS64_WG32_8_1_WGM1_WGMXCC2_WGMXCCGn1
    SolutionIndex: 68
    SolutionNameMin: Cijk_Alik_Bljk_BBS_BH_Bias_HAS_SAV_UserArgs_MT160x64x64_MI16x16x1_SN_LDSB1_AFC0_AFEM1_AFEM1_ASEM1_CLR1_CADS0_DTLA0_DTLB0_DTVA0_DTVB0_EPS0_FDSI0_GRPM1_GRVWA8_GRVWB8_GSU0_GSUAMB_GSUC0_GSUWGMRR0_GLS0_ISA950_IU1_K1_LBSPPA256_LBSPPB128_LBSPPM0_LPA16_LPB16_LPM0_LRVW8_LWPMn1_MIAV1_MIWT10_1_MO40_NTn1_NTA6_NTB0_NTC0_NTD3_NTM0_NEPBS10_NLCA1_NLCB1_ONLL1_PGR2_PLR1_PKA1_SIA3_SS0_SU8_SUM0_SUS128_SPO0_SRVW0_SSO0_SVW8_SK3_SKXCCM8_TLDS1_ULSGRO0_USL1_UIOFGRO0_USFGRO0_VSn1_VWA2_VWB1_WSGRA0_WSGRB0_WS64_WG16_16_1_WGM4_WGMXCC4_WGMXCCGn1
    SolutionIndex: 69
    SolutionNameMin: Cijk_Alik_Bljk_BBS_BH_Bias_HAS_SAV_UserArgs_MT512x80x64_MI16x16x1_SN_LDSB0_AFC0_AFEM1_AFEM1_ASEM1_CLR0_CADS0_DTLA0_DTLB0_DTVA0_DTVB0_EPS0_FDSI0_GRPM1_GRVWA8_GRVWB4_GSU0_GSUAMB_GSUC0_GSUWGMRR0_GLS0_ISA950_IU1_K1_LBSPPA1024_LBSPPB128_LBSPPM0_LPA16_LPB16_LPM0_LRVW8_LWPMn1_MIAV0_MIWT8_5_MO40_NTn1_NTA6_NTB0_NTC3_NTD3_NTM0_NEPBS12_NLCA1_NLCB1_ONLL1_PGR2_PLR1_PKA1_SIA3_SS1_SU8_SUM0_SUS128_SPO0_SRVW0_SSO1_SVW8_SK3_SKXCCM0_TLDS1_ULSGRO0_USL1_UIOFGRO0_USFGRO0_VSn1_VWA8_VWB1_WSGRA0_WSGRB0_WS64_WG64_4_1_WGM1_WGMXCC1_WGMXCCGn1
    SolutionIndex: 70
    SolutionNameMin: Cijk_Alik_Bljk_BBS_BH_Bias_HAS_SAV_UserArgs_MT16x16x64_MI16x16x1_SN_LDSB0_AFC0_AFEM1_AFEM1_ASEM1_CLR0_CADS0_DTLA1_DTLB1_DTVA0_DTVB0_EPS0_FDSI0_GRPM1_GRVWA8_GRVWB8_GSU0_GSUAMB_GSUC0_GSUWGMRR0_GLS0_ISA950_IU1_K1_LBSPPA1024_LBSPPB1024_LBSPPM0_LPA16_LPB16_LPM0_LRVW8_LWPMn1_MIAV0_MIWT1_1_MO40_NTn1_NTA2_NTB0_NTC3_NTD3_NTM0_NEPBS8_NLCA1_NLCB1_ONLL1_PGR2_PLR0_PKA1_SIA3_SS1_SU0_SUM0_SUS128_SPO0_SRVW0_SSO0_SVW1_SK3_SKXCCM0_TLDS1_ULSGRO0_USL1_UIOFGRO0_USFGRO0_VSn1_VWA1_VWB1_WSGRA0_WSGRB0_WS64_WG16_4_2_WGM0_WGMXCC2_WGMXCCGn1
    SolutionIndex: 71
    SolutionNameMin: Cijk_Alik_Bljk_BBS_BH_Bias_HAS_SAV_UserArgs_MT16x32x64_MI16x16x1_SN_LDSB0_AFC0_AFEM1_AFEM1_ASEM1_CLR0_CADS0_DTLA1_DTLB1_DTVA0_DTVB0_EPS0_FDSI0_GRPM1_GRVWA8_GRVWB8_GSU0_GSUAMB_GSUC0_GSUWGMRR0_GLS0_ISA950_IU1_K1_LBSPPA1024_LBSPPB1024_LBSPPM0_LPA16_LPB16_LPM0_LRVW8_LWPMn1_MIAV0_MIWT1_2_MO40_NTn1_NTA2_NTB0_NTC1_NTD3_NTM0_NEPBS10_NLCA1_NLCB1_ONLL1_PGR2_PLR0_PKA1_SIA3_SS1_SU0_SUM0_SUS128_SPO0_SRVW0_SSO0_SVW1_SK3_SKXCCM4_TLDS2_ULSGRO0_USL1_UIOFGRO0_USFGRO1_VSn1_VWA1_VWB2_WSGRA0_WSGRB0_WS64_WG16_4_2_WGM1_WGMXCC1_WGMXCCGn1
    SolutionIndex: 72
    SolutionNameMin: Cijk_Alik_Bljk_BBS_BH_Bias_HAS_SAV_UserArgs_MT32x16x64_MI16x16x1_SN_LDSB0_AFC0_AFEM1_AFEM1_ASEM1_CLR0_CADS0_DTLA1_DTLB1_DTVA0_DTVB0_EPS0_FDSI0_GRPM1_GRVWA8_GRVWB8_GSU0_GSUAMB_GSUC0_GSUWGMRR0_GLS0_ISA950_IU1_K1_LBSPPA1024_LBSPPB1024_LBSPPM0_LPA16_LPB16_LPM0_LRVW8_LWPMn1_MIAV1_MIWT2_1_MO40_NTn1_NTA0_NTB3_NTC1_NTD3_NTM0_NEPBS0_NLCA1_NLCB1_ONLL1_PGR2_PLR1_PKA1_SIA3_SS1_SU0_SUM0_SUS128_SPO0_SRVW0_SSO0_SVW2_SK3_SKXCCM0_TLDS2_ULSGRO0_USL1_UIOFGRO0_USFGROn1_VSn1_VWA2_VWB1_WSGRA0_WSGRB0_WS64_WG16_4_1_WGM0_WGMXCC8_WGMXCCGn1
    SolutionIndex: 73
    SolutionNameMin: Cijk_Alik_Bljk_BBS_BH_Bias_HAS_SAV_UserArgs_MT16x32x64_MI16x16x1_SN_LDSB0_AFC0_AFEM1_AFEM1_ASEM1_CLR1_CADS0_DTLA1_DTLB1_DTVA0_DTVB0_EPS0_FDSI0_GRPM1_GRVWA8_GRVWB8_GSU0_GSUAMB_GSUC0_GSUWGMRR0_GLS0_ISA950_IU1_K1_LBSPPA1024_LBSPPB1024_LBSPPM0_LPA16_LPB16_LPM0_LRVW8_LWPMn1_MIAV1_MIWT1_1_MO40_NTn1_NTA0_NTB3_NTC0_NTD0_NTM0_NEPBS16_NLCA1_NLCB1_ONLL1_PGR2_PLR1_PKA1_SIA3_SS1_SU0_SUM0_SUS128_SPO1_SRVW0_SSO0_SVW1_SK3_SKXCCM4_TLDS1_ULSGRO0_USL1_UIOFGRO0_USFGROn1_VSn1_VWA1_VWB1_WSGRA0_WSGRB0_WS64_WG16_8_1_WGM0_WGMXCC2_WGMXCCGn1
    SolutionIndex: 74
    SolutionNameMin: Cijk_Alik_Bljk_BBS_BH_Bias_HAS_SAV_UserArgs_MT16x48x64_MI16x16x1_SN_LDSB0_AFC0_AFEM1_AFEM1_ASEM1_CLR0_CADS0_DTLA1_DTLB1_DTVA0_DTVB0_EPS0_FDSI0_GRPM1_GRVWA8_GRVWB8_GSU0_GSUAMB_GSUC0_GSUWGMRR0_GLS0_ISA950_IU1_K1_LBSPPA1024_LBSPPB1024_LBSPPM0_LPA16_LPB16_LPM0_LRVW8_LWPMn1_MIAV1_MIWT1_3_MO40_NTn1_NTA3_NTB2_NTC1_NTD0_NTM0_NEPBS8_NLCA1_NLCB1_ONLL1_PGR2_PLR1_PKA1_SIA3_SS0_SU0_SUM0_SUS128_SPO0_SRVW0_SSO0_SVW4_SK3_SKXCCM6_TLDS2_ULSGRO0_USL1_UIOFGRO0_USFGROn1_VSn1_VWA1_VWB1_WSGRA0_WSGRB0_WS64_WG16_4_1_WGM1_WGMXCC1_WGMXCCGn1
    SolutionIndex: 75
    SolutionNameMin: Cijk_Alik_Bljk_BBS_BH_Bias_HAS_SAV_UserArgs_MT16x64x64_MI16x16x1_SN_LDSB0_AFC0_AFEM1_AFEM1_ASEM1_CLR0_CADS0_DTLA1_DTLB1_DTVA0_DTVB0_EPS0_FDSI0_GRPM1_GRVWA8_GRVWB8_GSU0_GSUAMB_GSUC0_GSUWGMRR0_GLS0_ISA950_IU1_K1_LBSPPA1024_LBSPPB1024_LBSPPM0_LPA16_LPB16_LPM0_LRVW8_LWPMn1_MIAV1_MIWT1_2_MO40_NTn1_NTA3_NTB0_NTC1_NTD2_NTM0_NEPBS12_NLCA1_NLCB1_ONLL1_PGR2_PLR1_PKA1_SIA3_SS0_SU0_SUM0_SUS128_SPO0_SRVW0_SSO0_SVW4_SK3_SKXCCM0_TLDS1_ULSGRO0_USL1_UIOFGRO0_USFGROn1_VSn1_VWA1_VWB2_WSGRA0_WSGRB0_WS64_WG16_8_1_WGM1_WGMXCC2_WGMXCCGn1
    SolutionIndex: 76
    SolutionNameMin: Cijk_Alik_Bljk_BBS_BH_Bias_HAS_SAV_UserArgs_MT64x16x64_MI16x16x1_SN_LDSB0_AFC0_AFEM1_AFEM1_ASEM1_CLR0_CADS0_DTLA1_DTLB1_DTVA0_DTVB0_EPS0_FDSI0_GRPM1_GRVWA8_GRVWB2_GSU0_GSUAMB_GSUC0_GSUWGMRR0_GLS0_ISA950_IU1_K1_LBSPPA1024_LBSPPB256_LBSPPM0_LPA16_LPB16_LPM0_LRVW8_LWPMn1_MIAV0_MIWT1_1_MO40_NTn1_NTA3_NTB5_NTC1_NTD1_NTM0_NEPBS12_NLCA1_NLCB1_ONLL1_PGR2_PLR1_PKA1_SIA3_SS1_SU8_SUM0_SUS128_SPO1_SRVW0_SSO0_SVW1_SK3_SKXCCM0_TLDS1_ULSGRO0_USL1_UIOFGRO0_USFGROn1_VSn1_VWA1_VWB1_WSGRA0_WSGRB0_WS64_WG64_4_1_WGM1_WGMXCC16_WGMXCCGn1
    SolutionIndex: 77
    SolutionNameMin: Cijk_Alik_Bljk_BBS_BH_Bias_HAS_SAV_UserArgs_MT64x16x64_MI16x16x1_SN_LDSB0_AFC0_AFEM1_AFEM1_ASEM1_CLR0_CADS0_DTLA1_DTLB1_DTVA0_DTVB0_EPS0_FDSI0_GRPM1_GRVWA8_GRVWB2_GSU0_GSUAMB_GSUC0_GSUWGMRR0_GLS0_ISA950_IU1_K1_LBSPPA1024_LBSPPB256_LBSPPM0_LPA16_LPB16_LPM0_LRVW8_LWPMn1_MIAV0_MIWT1_1_MO40_NTn1_NTA2_NTB4_NTC0_NTD0_NTM0_NEPBS12_NLCA1_NLCB1_ONLL1_PGR2_PLR1_PKA1_SIA3_SS1_SU0_SUM0_SUS128_SPO1_SRVW0_SSO0_SVW1_SK3_SKXCCM0_TLDS1_ULSGRO0_USL1_UIOFGRO0_USFGRO1_VSn1_VWA1_VWB1_WSGRA0_WSGRB0_WS64_WG64_4_1_WGM1_WGMXCC32_WGMXCCGn1
    SolutionIndex: 78
    SolutionNameMin: Cijk_Alik_Bljk_BBS_BH_Bias_HAS_SAV_UserArgs_MT32x64x64_MI16x16x1_SN_LDSB0_AFC0_AFEM1_AFEM1_ASEM1_CLR1_CADS0_DTLA1_DTLB1_DTVA0_DTVB0_EPS0_FDSI0_GRPM1_GRVWA8_GRVWB2_GSU0_GSUAMB_GSUC0_GSUWGMRR0_GLS0_ISA950_IU1_K1_LBSPPA1024_LBSPPB256_LBSPPM0_LPA16_LPB16_LPM0_LRVW8_LWPMn1_MIAV1_MIWT1_2_MO40_NTn1_NTA3_NTB2_NTC3_NTD1_NTM0_NEPBS12_NLCA1_NLCB1_ONLL1_PGR2_PLR1_PKA1_SIA3_SS0_SU0_SUM0_SUS128_SPO0_SRVW0_SSO0_SVW4_SK3_SKXCCM0_TLDS1_ULSGRO0_USL1_UIOFGRO0_USFGROn1_VSn1_VWA1_VWB2_WSGRA0_WSGRB0_WS64_WG32_8_1_WGM1_WGMXCC4_WGMXCCGn1
    SolutionIndex: 79
    SolutionNameMin: Cijk_Alik_Bljk_BBS_BH_Bias_HAS_SAV_UserArgs_MT32x64x64_MI16x16x1_SN_LDSB0_AFC0_AFEM1_AFEM1_ASEM1_CLR0_CADS0_DTLA1_DTLB1_DTVA0_DTVB0_EPS0_FDSI0_GRPM1_GRVWA8_GRVWB2_GSU0_GSUAMB_GSUC0_GSUWGMRR0_GLS0_ISA950_IU1_K1_LBSPPA1024_LBSPPB256_LBSPPM0_LPA16_LPB16_LPM0_LRVW8_LWPMn1_MIAV0_MIWT1_2_MO40_NTn1_NTA0_NTB0_NTC0_NTD0_NTM0_NEPBS0_NLCA1_NLCB1_ONLL1_PGR2_PLR1_PKA1_SIA3_SS0_SU0_SUM0_SUS128_SPO1_SRVW0_SSO0_SVW4_SK3_SKXCCM8_TLDS1_ULSGRO0_USL1_UIOFGRO0_USFGRO0_VSn1_VWA1_VWB2_WSGRA0_WSGRB0_WS64_WG32_8_1_WGM16_WGMXCC4_WGMXCCGn1
    SolutionIndex: 80
    SolutionNameMin: Cijk_Alik_Bljk_BBS_BH_Bias_HAS_SAV_UserArgs_MT32x64x64_MI16x16x1_SN_LDSB0_AFC0_AFEM1_AFEM1_ASEM1_CLR0_CADS0_DTLA1_DTLB1_DTVA0_DTVB0_EPS0_FDSI0_GRPM1_GRVWA8_GRVWB2_GSU0_GSUAMB_GSUC0_GSUWGMRR0_GLS0_ISA950_IU1_K1_LBSPPA1024_LBSPPB256_LBSPPM0_LPA16_LPB16_LPM0_LRVW8_LWPMn1_MIAV1_MIWT1_2_MO40_NTn1_NTA0_NTB2_NTC1_NTD0_NTM0_NEPBS16_NLCA1_NLCB1_ONLL1_PGR2_PLR1_PKA1_SIA3_SS0_SU0_SUM0_SUS128_SPO1_SRVW0_SSO0_SVW4_SK3_SKXCCM8_TLDS1_ULSGRO0_USL1_UIOFGRO0_USFGROn1_VSn1_VWA1_VWB2_WSGRA0_WSGRB0_WS64_WG32_8_1_WGM1_WGMXCC2_WGMXCCGn1
    SolutionIndex: 81
    SolutionNameMin: Cijk_Alik_Bljk_BBS_BH_Bias_HAS_SAV_UserArgs_MT32x64x64_MI16x16x1_SN_LDSB0_AFC0_AFEM1_AFEM1_ASEM1_CLR1_CADS0_DTLA1_DTLB1_DTVA0_DTVB0_EPS0_FDSI0_GRPM1_GRVWA2_GRVWB8_GSU0_GSUAMB_GSUC0_GSUWGMRR0_GLS0_ISA950_IU1_K1_LBSPPA256_LBSPPB1024_LBSPPM0_LPA16_LPB16_LPM0_LRVW8_LWPMn1_MIAV0_MIWT2_1_MO40_NTn1_NTA1_NTB1_NTC0_NTD3_NTM0_NEPBS8_NLCA1_NLCB1_ONLL1_PGR2_PLR1_PKA1_SIA3_SS1_SU0_SUM0_SUS128_SPO1_SRVW0_SSO0_SVW2_SK3_SKXCCM4_TLDS1_ULSGRO0_USL1_UIOFGRO0_USFGRO0_VSn1_VWA2_VWB1_WSGRA0_WSGRB0_WS64_WG16_16_1_WGM24_WGMXCC8_WGMXCCGn1
    SolutionIndex: 82
    SolutionNameMin: Cijk_Alik_Bljk_BBS_BH_Bias_HAS_SAV_UserArgs_MT128x32x64_MI16x16x1_SN_LDSB0_AFC0_AFEM1_AFEM1_ASEM1_CLR0_CADS0_DTLA1_DTLB1_DTVA0_DTVB0_EPS0_FDSI0_GRPM1_GRVWA2_GRVWB2_GSU0_GSUAMB_GSUC0_GSUWGMRR0_GLS0_ISA950_IU1_K1_LBSPPA512_LBSPPB256_LBSPPM0_LPA16_LPB16_LPM0_LRVW8_LWPMn1_MIAV1_MIWT4_1_MO40_NTn1_NTA2_NTB7_NTC0_NTD3_NTM0_NEPBS12_NLCA1_NLCB1_ONLL1_PGR2_PLR1_PKA1_SIA3_SS1_SU0_SUM0_SUS128_SPO0_SRVW0_SSO0_SVW4_SK3_SKXCCM4_TLDS2_ULSGRO0_USL1_UIOFGRO0_USFGRO0_VSn1_VWA4_VWB1_WSGRA0_WSGRB0_WS64_WG32_8_1_WGM0_WGMXCC8_WGMXCCGn1
    SolutionIndex: 83
    SolutionNameMin: Cijk_Alik_Bljk_BBS_BH_Bias_HAS_SAV_UserArgs_MT128x112x64_MI16x16x1_SN_LDSB0_AFC0_AFEM1_AFEM1_ASEM1_CLR1_CADS0_DTLA1_DTLB1_DTVA0_DTVB0_EPS0_FDSI0_GRPM1_GRVWA8_GRVWB2_GSU0_GSUAMB_GSUC0_GSUWGMRR0_GLS0_ISA950_IU1_K1_LBSPPA1024_LBSPPB256_LBSPPM0_LPA16_LPB16_LPM0_LRVW8_LWPMn1_MIAV1_MIWT2_7_MO40_NTn1_NTA2_NTB6_NTC1_NTD2_NTM0_NEPBS0_NLCA1_NLCB1_ONLL1_PGR2_PLR1_PKA1_SIA3_SS1_SU16_SUM0_SUS128_SPO0_SRVW0_SSO0_SVW2_SK3_SKXCCM8_TLDS2_ULSGRO0_USL1_UIOFGRO0_USFGRO0_VSn1_VWA2_VWB1_WSGRA0_WSGRB0_WS64_WG64_4_1_WGM0_WGMXCC4_WGMXCCGn1
    SolutionIndex: 84
    SolutionNameMin: Cijk_Alik_Bljk_BBS_BH_Bias_HAS_SAV_UserArgs_MT32x32x64_MI16x16x1_SN_LDSB0_AFC0_AFEM1_AFEM1_ASEM1_CLR0_CADS0_DTLA1_DTLB1_DTVA0_DTVB0_EPS0_FDSI0_GRPM1_GRVWA8_GRVWB8_GSU0_GSUAMB_GSUC0_GSUWGMRR0_GLS0_ISA950_IU1_K1_LBSPPA1024_LBSPPB1024_LBSPPM0_LPA16_LPB16_LPM0_LRVW8_LWPMn1_MIAV0_MIWT2_1_MO40_NTn1_NTA2_NTB1_NTC3_NTD3_NTM0_NEPBS12_NLCA1_NLCB1_ONLL1_PGR2_PLR1_PKA1_SIA3_SS1_SU0_SUM0_SUS128_SPO1_SRVW0_SSO0_SVW2_SK3_SKXCCM6_TLDS2_ULSGRO0_USL1_UIOFGRO0_USFGRO1_VSn1_VWA2_VWB1_WSGRA0_WSGRB0_WS64_WG16_8_1_WGM1_WGMXCC2_WGMXCCGn1
    SolutionIndex: 85
    SolutionNameMin: Cijk_Alik_Bljk_BBS_BH_Bias_HAS_SAV_UserArgs_MT32x64x64_MI16x16x1_SN_LDSB0_AFC0_AFEM1_AFEM1_ASEM1_CLR0_CADS0_DTLA1_DTLB1_DTVA0_DTVB0_EPS0_FDSI0_GRPM1_GRVWA8_GRVWB2_GSU0_GSUAMB_GSUC0_GSUWGMRR0_GLS0_ISA950_IU1_K1_LBSPPA1024_LBSPPB256_LBSPPM0_LPA16_LPB16_LPM0_LRVW8_LWPMn1_MIAV0_MIWT1_2_MO40_NTn1_NTA3_NTB1_NTC3_NTD1_NTM0_NEPBS0_NLCA1_NLCB1_ONLL1_PGR2_PLR1_PKA1_SIA3_SS0_SU0_SUM0_SUS128_SPO0_SRVW0_SSO0_SVW4_SK3_SKXCCM0_TLDS1_ULSGRO0_USL1_UIOFGRO0_USFGROn1_VSn1_VWA1_VWB2_WSGRA0_WSGRB0_WS64_WG32_8_1_WGM0_WGMXCC2_WGMXCCGn1
    SolutionIndex: 86
    SolutionNameMin: Cijk_Alik_Bljk_BBS_BH_Bias_HAS_SAV_UserArgs_MT32x64x64_MI16x16x1_SN_LDSB0_AFC0_AFEM1_AFEM1_ASEM1_CLR0_CADS0_DTLA1_DTLB1_DTVA0_DTVB0_EPS0_FDSI0_GRPM1_GRVWA2_GRVWB8_GSU0_GSUAMB_GSUC0_GSUWGMRR0_GLS0_ISA950_IU1_K1_LBSPPA256_LBSPPB1024_LBSPPM0_LPA16_LPB16_LPM0_LRVW8_LWPMn1_MIAV0_MIWT2_1_MO40_NTn1_NTA7_NTB1_NTC1_NTD0_NTM0_NEPBS8_NLCA1_NLCB1_ONLL1_PGR2_PLR1_PKA1_SIA3_SS1_SU0_SUM0_SUS128_SPO1_SRVW0_SSO0_SVW2_SK3_SKXCCM8_TLDS1_ULSGRO0_USL1_UIOFGRO0_USFGRO0_VSn1_VWA2_VWB1_WSGRA0_WSGRB0_WS64_WG16_16_1_WGM1_WGMXCC4_WGMXCCGn1
    SolutionIndex: 87
    SolutionNameMin: Cijk_Alik_Bljk_BBS_BH_Bias_HAS_SAV_UserArgs_MT32x96x64_MI16x16x1_SN_LDSB0_AFC0_AFEM1_AFEM1_ASEM1_CLR0_CADS0_DTLA1_DTLB1_DTVA0_DTVB0_EPS0_FDSI0_GRPM1_GRVWA8_GRVWB8_GSU0_GSUAMB_GSUC0_GSUWGMRR0_GLS0_ISA950_IU1_K1_LBSPPA1024_LBSPPB1024_LBSPPM0_LPA16_LPB16_LPM0_LRVW8_LWPMn1_MIAV1_MIWT1_3_MO40_NTn1_NTA0_NTB0_NTC0_NTD0_NTM0_NEPBS4_NLCA1_NLCB1_ONLL1_PGR2_PLR1_PKA1_SIA3_SS0_SU0_SUM0_SUS128_SPO0_SRVW0_SSO0_SVW4_SK3_SKXCCM0_TLDS1_ULSGRO0_USL1_UIOFGRO0_USFGROn1_VSn1_VWA1_VWB1_WSGRA0_WSGRB0_WS64_WG32_8_1_WGM1_WGMXCC2_WGMXCCGn1
    SolutionIndex: 88
    SolutionNameMin: Cijk_Alik_Bljk_BBS_BH_Bias_HAS_SAV_UserArgs_MT64x48x64_MI16x16x1_SN_LDSB0_AFC0_AFEM1_AFEM1_ASEM1_CLR0_CADS0_DTLA1_DTLB1_DTVA0_DTVB0_EPS0_FDSI0_GRPM1_GRVWA8_GRVWB2_GSU0_GSUAMB_GSUC0_GSUWGMRR0_GLS0_ISA950_IU1_K1_LBSPPA1024_LBSPPB256_LBSPPM0_LPA16_LPB16_LPM0_LRVW8_LWPMn1_MIAV1_MIWT1_3_MO40_NTn1_NTA1_NTB2_NTC1_NTD1_NTM0_NEPBS0_NLCA1_NLCB1_ONLL1_PGR2_PLR1_PKA1_SIA3_SS1_SU0_SUM0_SUS128_SPO0_SRVW0_SSO0_SVW1_SK3_SKXCCM4_TLDS1_ULSGRO0_USL1_UIOFGRO0_USFGRO0_VSn1_VWA1_VWB1_WSGRA0_WSGRB0_WS64_WG64_4_1_WGM0_WGMXCC8_WGMXCCGn1
    SolutionIndex: 89
    SolutionNameMin: Cijk_Alik_Bljk_BBS_BH_Bias_HAS_SAV_UserArgs_MT32x96x64_MI16x16x1_SN_LDSB0_AFC0_AFEM1_AFEM1_ASEM1_CLR1_CADS0_DTLA1_DTLB1_DTVA0_DTVB0_EPS0_FDSI0_GRPM1_GRVWA2_GRVWB2_GSU0_GSUAMB_GSUC0_GSUWGMRR0_GLS0_ISA950_IU1_K1_LBSPPA256_LBSPPB256_LBSPPM0_LPA16_LPB16_LPM0_LRVW8_LWPMn1_MIAV0_MIWT1_3_MO40_NTn1_NTA7_NTB1_NTC0_NTD1_NTM0_NEPBS0_NLCA1_NLCB1_ONLL1_PGR2_PLR1_PKA1_SIA3_SS1_SU0_SUM0_SUS128_SPO0_SRVW0_SSO0_SVW1_SK3_SKXCCM8_TLDS1_ULSGRO0_USL1_UIOFGRO0_USFGRO0_VSn1_VWA1_VWB1_WSGRA0_WSGRB0_WS64_WG32_8_1_WGM1_WGMXCC4_WGMXCCGn1
    SolutionIndex: 90
    SolutionNameMin: Cijk_Alik_Bljk_BBS_BH_Bias_HAS_SAV_UserArgs_MT128x32x64_MI16x16x1_SN_LDSB0_AFC0_AFEM1_AFEM1_ASEM1_CLR0_CADS0_DTLA1_DTLB1_DTVA0_DTVB0_EPS0_FDSI0_GRPM1_GRVWA8_GRVWB2_GSU0_GSUAMB_GSUC0_GSUWGMRR0_GLS0_ISA950_IU1_K1_LBSPPA1024_LBSPPB256_LBSPPM0_LPA16_LPB16_LPM0_LRVW8_LWPMn1_MIAV0_MIWT4_1_MO40_NTn1_NTA3_NTB3_NTC5_NTD0_NTM0_NEPBS12_NLCA1_NLCB1_ONLL1_PGR2_PLR1_PKA1_SIA3_SS1_SU8_SUM0_SUS128_SPO1_SRVW0_SSO0_SVW4_SK3_SKXCCM0_TLDS1_ULSGRO0_USL1_UIOFGRO0_USFGRO1_VSn1_VWA4_VWB1_WSGRA0_WSGRB0_WS64_WG32_8_1_WGM0_WGMXCC16_WGMXCCGn1
    SolutionIndex: 91
    SolutionNameMin: Cijk_Alik_Bljk_BBS_BH_Bias_HAS_SAV_UserArgs_MT64x80x64_MI16x16x1_SN_LDSB0_AFC0_AFEM1_AFEM1_ASEM1_CLR1_CADS0_DTLA1_DTLB1_DTVA0_DTVB0_EPS0_FDSI0_GRPM1_GRVWA8_GRVWB2_GSU0_GSUAMB_GSUC0_GSUWGMRR0_GLS0_ISA950_IU1_K1_LBSPPA1024_LBSPPB256_LBSPPM0_LPA16_LPB16_LPM0_LRVW8_LWPMn1_MIAV1_MIWT1_5_MO40_NTn1_NTA0_NTB0_NTC0_NTD0_NTM0_NEPBS0_NLCA1_NLCB1_ONLL1_PGR2_PLR1_PKA1_SIA3_SS1_SU0_SUM0_SUS128_SPO0_SRVW0_SSO0_SVW1_SK3_SKXCCM4_TLDS1_ULSGRO0_USL1_UIOFGRO0_USFGRO0_VSn1_VWA1_VWB1_WSGRA0_WSGRB0_WS64_WG64_4_1_WGM0_WGMXCC8_WGMXCCGn1
    SolutionIndex: 92
    SolutionNameMin: Cijk_Alik_Bljk_BBS_BH_Bias_HAS_SAV_UserArgs_MT64x96x64_MI16x16x1_SN_LDSB0_AFC0_AFEM1_AFEM1_ASEM1_CLR1_CADS0_DTLA1_DTLB1_DTVA0_DTVB0_EPS0_FDSI0_GRPM1_GRVWA2_GRVWB8_GSU0_GSUAMB_GSUC0_GSUWGMRR0_GLS0_ISA950_IU1_K1_LBSPPA256_LBSPPB1024_LBSPPM0_LPA16_LPB16_LPM0_LRVW8_LWPMn1_MIAV1_MIWT2_3_MO40_NTn1_NTA0_NTB3_NTC1_NTD1_NTM0_NEPBS0_NLCA1_NLCB1_ONLL1_PGR2_PLR1_PKA1_SIA3_SS1_SU0_SUM0_SUS128_SPO0_SRVW0_SSO0_SVW2_SK3_SKXCCM4_TLDS1_ULSGRO0_USL1_UIOFGRO0_USFGRO0_VSn1_VWA2_VWB1_WSGRA0_WSGRB0_WS64_WG32_8_1_WGM1_WGMXCC8_WGMXCCGn1
    SolutionIndex: 93
    SolutionNameMin: Cijk_Alik_Bljk_BBS_BH_Bias_HAS_SAV_UserArgs_MT128x64x64_MI16x16x1_SN_LDSB0_AFC0_AFEM1_AFEM1_ASEM1_CLR0_CADS0_DTLA1_DTLB1_DTVA0_DTVB0_EPS0_FDSI0_GRPM1_GRVWA8_GRVWB2_GSU0_GSUAMB_GSUC0_GSUWGMRR0_GLS0_ISA950_IU1_K1_LBSPPA1024_LBSPPB256_LBSPPM0_LPA16_LPB16_LPM0_LRVW8_LWPMn1_MIAV0_MIWT4_2_MO40_NTn1_NTA3_NTB0_NTC4_NTD1_NTM0_NEPBS16_NLCA1_NLCB1_ONLL1_PGR2_PLR1_PKA1_SIA3_SS1_SU0_SUM0_SUS128_SPO0_SRVW0_SSO0_SVW4_SK3_SKXCCM7_TLDS1_ULSGRO0_USL1_UIOFGRO0_USFGRO1_VSn1_VWA4_VWB2_WSGRA0_WSGRB0_WS64_WG32_8_1_WGM1_WGMXCC8_WGMXCCGn1
    SolutionIndex: 94
    SolutionNameMin: Cijk_Alik_Bljk_BBS_BH_Bias_HAS_SAV_UserArgs_MT128x64x64_MI16x16x1_SN_LDSB0_AFC0_AFEM1_AFEM1_ASEM1_CLR1_CADS0_DTLA1_DTLB1_DTVA0_DTVB0_EPS0_FDSI0_GRPM1_GRVWA8_GRVWB2_GSU0_GSUAMB_GSUC0_GSUWGMRR0_GLS0_ISA950_IU1_K1_LBSPPA1024_LBSPPB256_LBSPPM0_LPA16_LPB16_LPM0_LRVW8_LWPMn1_MIAV1_MIWT4_2_MO40_NTn1_NTA1_NTB1_NTC6_NTD1_NTM0_NEPBS10_NLCA1_NLCB1_ONLL1_PGR2_PLR1_PKA1_SIA3_SS1_SU8_SUM0_SUS128_SPO0_SRVW0_SSO0_SVW4_SK3_SKXCCM8_TLDS1_ULSGRO0_USL1_UIOFGRO0_USFGRO1_VSn1_VWA4_VWB2_WSGRA0_WSGRB0_WS64_WG32_8_1_WGM1_WGMXCC8_WGMXCCGn1
    SolutionIndex: 95
    SolutionNameMin: Cijk_Alik_Bljk_BBS_BH_Bias_HAS_SAV_UserArgs_MT160x128x64_MI16x16x1_SN_LDSB0_AFC0_AFEM1_AFEM1_ASEM1_CLR0_CADS0_DTLA1_DTLB1_DTVA0_DTVB0_EPS0_FDSI0_GRPM1_GRVWA2_GRVWB8_GSU0_GSUAMB_GSUC0_GSUWGMRR0_GLS0_ISA950_IU1_K1_LBSPPA256_LBSPPB1024_LBSPPM0_LPA16_LPB16_LPM0_LRVW8_LWPMn1_MIAV0_MIWT10_2_MO40_NTn1_NTA1_NTB7_NTC3_NTD6_NTM0_NEPBS0_NLCA1_NLCB1_ONLL1_PGR2_PLR1_PKA1_SIA3_SS1_SU0_SUM0_SUS128_SPO1_SRVW0_SSO1_SVW2_SK3_SKXCCM8_TLDS1_ULSGRO0_USL1_UIOFGRO0_USFGRO0_VSn1_VWA2_VWB2_WSGRA0_WSGRB0_WS64_WG16_16_1_WGM1_WGMXCC2_WGMXCCGn1
    SolutionIndex: 96
    SolutionNameMin: Cijk_Alik_Bljk_BBS_BH_Bias_HAS_SAV_UserArgs_MT32x16x256_MI16x16x1_SN_LDSB0_AFC0_AFEM1_AFEM1_ASEM1_CLR1_CADS0_DTLA1_DTLB1_DTVA0_DTVB0_EPS0_FDSI0_GRPM1_GRVWA8_GRVWB8_GSU0_GSUAMB_GSUC0_GSUWGMRR0_GLS0_ISA950_IU1_K1_LBSPPA1024_LBSPPB1024_LBSPPM0_LPA16_LPB16_LPM0_LRVW8_LWPMn1_MIAV1_MIWT2_1_MO40_NTn1_NTA7_NTB1_NTC0_NTD2_NTM0_NEPBS8_NLCA1_NLCB1_ONLL1_PGR2_PLR1_PKA1_SIA3_SS1_SU8_SUM0_SUS512_SPO0_SRVW0_SSO0_SVW2_SK3_SKXCCM4_TLDS2_ULSGRO0_USL1_UIOFGRO0_USFGRO1_VSn1_VWA2_VWB1_WSGRA0_WSGRB0_WS64_WG16_4_2_WGM0_WGMXCC4_WGMXCCGn1
    SolutionIndex: 97
    SolutionNameMin: Cijk_Alik_Bljk_BBS_BH_Bias_HAS_SAV_UserArgs_MT32x32x256_MI16x16x1_SN_LDSB0_AFC0_AFEM1_AFEM1_ASEM1_CLR1_CADS0_DTLA1_DTLB1_DTVA0_DTVB0_EPS0_FDSI0_GRPM1_GRVWA8_GRVWB8_GSU0_GSUAMB_GSUC0_GSUWGMRR0_GLS0_ISA950_IU1_K1_LBSPPA1024_LBSPPB1024_LBSPPM0_LPA16_LPB16_LPM0_LRVW8_LWPMn1_MIAV1_MIWT1_1_MO40_NTn1_NTA4_NTB0_NTC0_NTD2_NTM0_NEPBS10_NLCA1_NLCB1_ONLL1_PGR2_PLR1_PKA1_SIA3_SS0_SU0_SUM0_SUS512_SPO1_SRVW0_SSO0_SVW4_SK3_SKXCCM4_TLDS1_ULSGRO0_USL1_UIOFGRO0_USFGRO1_VSn1_VWA1_VWB1_WSGRA0_WSGRB0_WS64_WG32_8_1_WGM1_WGMXCC4_WGMXCCGn1
    SolutionIndex: 98
    SolutionNameMin: Cijk_Alik_Bljk_BBS_BH_Bias_HAS_SAV_UserArgs_MT32x64x256_MI16x16x1_SN_LDSB0_AFC0_AFEM1_AFEM1_ASEM1_CLR0_CADS0_DTLA1_DTLB1_DTVA0_DTVB0_EPS0_FDSI0_GRPM1_GRVWA8_GRVWB8_GSU0_GSUAMB_GSUC0_GSUWGMRR0_GLS0_ISA950_IU1_K1_LBSPPA1024_LBSPPB1024_LBSPPM0_LPA16_LPB16_LPM0_LRVW8_LWPMn1_MIAV1_MIWT2_1_MO40_NTn1_NTA5_NTB1_NTC0_NTD7_NTM0_NEPBS4_NLCA1_NLCB1_ONLL1_PGR2_PLR1_PKA1_SIA3_SS1_SU0_SUM0_SUS512_SPO0_SRVW0_SSO0_SVW2_SK3_SKXCCM4_TLDS1_ULSGRO0_USL1_UIOFGRO0_USFGRO1_VSn1_VWA2_VWB1_WSGRA0_WSGRB0_WS64_WG16_16_1_WGM1_WGMXCC4_WGMXCCGn1
    SolutionIndex: 99
    SolutionNameMin: Cijk_Alik_Bljk_BBS_BH_Bias_HAS_SAV_UserArgs_MT48x64x256_MI16x16x1_SN_LDSB0_AFC0_AFEM1_AFEM1_ASEM1_CLR1_CADS0_DTLA0_DTLB0_DTVA0_DTVB0_EPS0_FDSI0_GRPM1_GRVWA8_GRVWB8_GSU0_GSUAMB_GSUC0_GSUWGMRR0_GLS0_ISA950_IU1_K1_LBSPPA512_LBSPPB512_LBSPPM0_LPA16_LPB16_LPM0_LRVW8_LWPMn1_MIAV0_MIWT3_1_MO40_NTn1_NTA5_NTB3_NTC1_NTD2_NTM0_NEPBS0_NLCA1_NLCB1_ONLL1_PGR2_PLR1_PKA1_SIA3_SS0_SU0_SUM0_SUS512_SPO0_SRVW0_SSO0_SVW4_SK3_SKXCCM0_TLDS2_ULSGRO0_USL1_UIOFGRO0_USFGRO0_VSn1_VWA1_VWB1_WSGRA0_WSGRB0_WS64_WG16_16_1_WGM1_WGMXCC16_WGMXCCGn1
    SolutionIndex: 100
    SolutionNameMin: Cijk_Alik_Bljk_BBS_BH_Bias_HAS_SAV_UserArgs_MT64x32x256_MI16x16x1_SN_LDSB0_AFC0_AFEM1_AFEM1_ASEM1_CLR1_CADS0_DTLA1_DTLB1_DTVA0_DTVB0_EPS0_FDSI0_GRPM1_GRVWA8_GRVWB8_GSU0_GSUAMB_GSUC0_GSUWGMRR0_GLS0_ISA950_IU1_K1_LBSPPA1024_LBSPPB1024_LBSPPM0_LPA16_LPB16_LPM0_LRVW8_LWPMn1_MIAV0_MIWT2_1_MO40_NTn1_NTA0_NTB3_NTC5_NTD4_NTM0_NEPBS12_NLCA1_NLCB1_ONLL1_PGR2_PLR1_PKA1_SIA3_SS1_SU8_SUM0_SUS512_SPO1_SRVW0_SSO0_SVW2_SK3_SKXCCM5_TLDS2_ULSGRO0_USL1_UIOFGRO0_USFGRO1_VSn1_VWA2_VWB1_WSGRA0_WSGRB0_WS64_WG32_8_1_WGM1_WGMXCC8_WGMXCCGn1
    SolutionIndex: 101
    SolutionNameMin: Cijk_Alik_Bljk_BBS_BH_Bias_HAS_SAV_UserArgs_MT64x96x128_MI16x16x1_SN_LDSB0_AFC0_AFEM1_AFEM1_ASEM1_CLR0_CADS0_DTLA0_DTLB0_DTVA0_DTVB0_EPS0_FDSI0_GRPM1_GRVWA8_GRVWB8_GSU0_GSUAMB_GSUC0_GSUWGMRR0_GLS0_ISA950_IU1_K1_LBSPPA512_LBSPPB256_LBSPPM0_LPA16_LPB16_LPM0_LRVW8_LWPMn1_MIAV0_MIWT2_3_MO40_NTn1_NTA5_NTB2_NTC3_NTD3_NTM0_NEPBS16_NLCA1_NLCB1_ONLL1_PGR2_PLR1_PKA1_SIA3_SS1_SU8_SUM0_SUS512_SPO1_SRVW0_SSO0_SVW2_SK3_SKXCCM4_TLDS2_ULSGRO0_USL1_UIOFGRO0_USFGRO0_VSn1_VWA2_VWB1_WSGRA0_WSGRB0_WS64_WG32_8_1_WGM1_WGMXCC4_WGMXCCGn1
    SolutionIndex: 102
    SolutionNameMin: Cijk_Alik_Bljk_BBS_BH_Bias_HAS_SAV_UserArgs_MT64x64x128_MI16x16x1_SN_LDSB0_AFC0_AFEM1_AFEM1_ASEM1_CLR0_CADS0_DTLA1_DTLB1_DTVA0_DTVB0_EPS0_FDSI0_GRPM1_GRVWA8_GRVWB8_GSU0_GSUAMB_GSUC0_GSUWGMRR0_GLS0_ISA950_IU1_K1_LBSPPA1024_LBSPPB1024_LBSPPM0_LPA16_LPB16_LPM0_LRVW8_LWPMn1_MIAV1_MIWT2_2_MO40_NTn1_NTA2_NTB3_NTC5_NTD7_NTM0_NEPBS16_NLCA1_NLCB1_ONLL1_PGR2_PLR1_PKA1_SIA3_SS1_SU0_SUM0_SUS256_SPO0_SRVW0_SSO0_SVW2_SK3_SKXCCM4_TLDS2_ULSGRO0_USL1_UIOFGRO0_USFGRO1_VSn1_VWA2_VWB2_WSGRA0_WSGRB0_WS64_WG32_8_1_WGM0_WGMXCC4_WGMXCCGn1
    SolutionIndex: 103
    SolutionNameMin: Cijk_Alik_Bljk_BBS_BH_Bias_HAS_SAV_UserArgs_MT64x64x128_MI16x16x1_SN_LDSB0_AFC0_AFEM1_AFEM1_ASEM1_CLR1_CADS0_DTLA1_DTLB1_DTVA0_DTVB0_EPS0_FDSI0_GRPM1_GRVWA8_GRVWB8_GSU0_GSUAMB_GSUC0_GSUWGMRR0_GLS0_ISA950_IU1_K1_LBSPPA1024_LBSPPB1024_LBSPPM0_LPA16_LPB16_LPM0_LRVW8_LWPMn1_MIAV1_MIWT4_1_MO40_NTn1_NTA1_NTB0_NTC3_NTD6_NTM0_NEPBS0_NLCA1_NLCB1_ONLL1_PGR2_PLR1_PKA1_SIA3_SS1_SU0_SUM0_SUS256_SPO0_SRVW0_SSO0_SVW4_SK3_SKXCCM4_TLDS2_ULSGRO0_USL1_UIOFGRO0_USFGROn1_VSn1_VWA4_VWB1_WSGRA0_WSGRB0_WS64_WG16_16_1_WGM1_WGMXCC4_WGMXCCGn1
    SolutionIndex: 104
    SolutionNameMin: Cijk_Alik_Bljk_BBS_BH_Bias_HAS_SAV_UserArgs_MT64x64x256_MI32x32x1_SN_LDSB0_AFC0_AFEM1_AFEM1_ASEM1_CLR1_CADS0_DTLA0_DTLB0_DTVA0_DTVB0_EPS0_FDSI0_GRPM1_GRVWA8_GRVWB8_GSU0_GSUAMB_GSUC0_GSUWGMRR0_GLS0_ISA950_IU1_K1_LBSPPA512_LBSPPB512_LBSPPM0_LPA8_LPB8_LPM0_LRVW8_LWPMn1_MIAV0_MIWT1_1_MO40_NTn1_NTA0_NTB0_NTC3_NTD5_NTM0_NEPBS0_NLCA1_NLCB1_ONLL1_PGR2_PLR1_PKA1_SIA3_SS1_SU0_SUM0_SUS512_SPO0_SRVW0_SSO1_SVW1_SK3_SKXCCM0_TLDS1_ULSGRO0_USL1_UIOFGRO0_USFGRO0_VSn1_VWA1_VWB1_WSGRA0_WSGRB0_WS64_WG64_4_1_WGM8_WGMXCC8_WGMXCCGn1
    SolutionIndex: 105
    SolutionNameMin: Cijk_Alik_Bljk_BBS_BH_Bias_HAS_SAV_UserArgs_MT96x96x128_MI16x16x1_SN_LDSB0_AFC0_AFEM1_AFEM1_ASEM1_CLR1_CADS0_DTLA0_DTLB0_DTVA0_DTVB0_EPS0_FDSI0_GRPM1_GRVWA8_GRVWB8_GSU0_GSUAMB_GSUC0_GSUWGMRR0_GLS0_ISA950_IU1_K1_LBSPPA256_LBSPPB256_LBSPPM0_LPA16_LPB16_LPM0_LRVW8_LWPMn1_MIAV0_MIWT3_3_MO40_NTn1_NTA2_NTB1_NTC1_NTD1_NTM0_NEPBS0_NLCA1_NLCB1_ONLL1_PGR2_PLR1_PKA1_SIA3_SS1_SU0_SUM0_SUS256_SPO0_SRVW0_SSO0_SVW1_SK3_SKXCCM4_TLDS1_ULSGRO0_USL1_UIOFGRO0_USFGRO0_VSn1_VWA1_VWB1_WSGRA0_WSGRB0_WS64_WG32_8_1_WGM4_WGMXCC1_WGMXCCGn1
    SolutionIndex: 106
    SolutionNameMin: Cijk_Alik_Bljk_BBS_BH_Bias_HAS_SAV_UserArgs_MT64x96x128_MI16x16x1_SN_LDSB1_AFC0_AFEM1_AFEM1_ASEM1_CLR1_CADS0_DTLA0_DTLB0_DTVA0_DTVB0_EPS0_FDSI0_GRPM1_GRVWA8_GRVWB8_GSU0_GSUAMB_GSUC0_GSUWGMRR0_GLS0_ISA950_IU1_K1_LBSPPA512_LBSPPB256_LBSPPM0_LPA16_LPB16_LPM0_LRVW8_LWPMn1_MIAV1_MIWT2_3_MO40_NTn1_NTA1_NTB2_NTC1_NTD5_NTM0_NEPBS0_NLCA1_NLCB1_ONLL1_PGR2_PLR1_PKA1_SIA3_SS1_SU0_SUM0_SUS256_SPO0_SRVW0_SSO0_SVW2_SK3_SKXCCM0_TLDS1_ULSGRO0_USL1_UIOFGRO0_USFGROn1_VSn1_VWA2_VWB1_WSGRA0_WSGRB0_WS64_WG32_8_1_WGM32_WGMXCC8_WGMXCCGn1
    SolutionIndex: 107
    SolutionNameMin: Cijk_Alik_Bljk_BBS_BH_Bias_HAS_SAV_UserArgs_MT96x64x128_MI16x16x1_SN_LDSB0_AFC0_AFEM1_AFEM1_ASEM1_CLR1_CADS0_DTLA0_DTLB0_DTVA0_DTVB0_EPS0_FDSI0_GRPM1_GRVWA8_GRVWB8_GSU0_GSUAMB_GSUC0_GSUWGMRR0_GLS0_ISA950_IU1_K1_LBSPPA512_LBSPPB256_LBSPPM0_LPA16_LPB16_LPM0_LRVW8_LWPMn1_MIAV0_MIWT6_1_MO40_NTn1_NTA1_NTB2_NTC1_NTD5_NTM0_NEPBS0_NLCA1_NLCB1_ONLL1_PGR2_PLR1_PKA1_SIA3_SS1_SU8_SUM0_SUS256_SPO0_SRVW0_SSO0_SVW2_SK3_SKXCCM0_TLDS1_ULSGRO0_USL1_UIOFGRO0_USFGROn1_VSn1_VWA2_VWB1_WSGRA0_WSGRB0_WS64_WG16_16_1_WGM0_WGMXCC16_WGMXCCGn1
    SolutionIndex: 108
    SolutionNameMin: Cijk_Alik_Bljk_BBS_BH_Bias_HAS_SAV_UserArgs_MT128x112x128_MI16x16x1_SN_LDSB0_AFC0_AFEM1_AFEM1_ASEM1_CLR1_CADS0_DTLA0_DTLB0_DTVA0_DTVB0_EPS0_FDSI0_GRPM1_GRVWA8_GRVWB8_GSU0_GSUAMB_GSUC0_GSUWGMRR0_GLS0_ISA950_IU1_K1_LBSPPA512_LBSPPB256_LBSPPM0_LPA16_LPB16_LPM0_LRVW8_LWPMn1_MIAV0_MIWT2_7_MO40_NTn1_NTA1_NTB1_NTC1_NTD0_NTM0_NEPBS0_NLCA1_NLCB1_ONLL1_PGR2_PLR1_PKA1_SIA3_SS1_SU0_SUM0_SUS256_SPO1_SRVW0_SSO1_SVW2_SK3_SKXCCM5_TLDS2_ULSGRO0_USL1_UIOFGRO0_USFGRO0_VSn1_VWA2_VWB1_WSGRA0_WSGRB0_WS64_WG64_4_1_WGM0_WGMXCC16_WGMXCCGn1
    SolutionIndex: 109
    SolutionNameMin: Cijk_Alik_Bljk_BBS_BH_Bias_HAS_SAV_UserArgs_MT64x128x128_MI16x16x1_SN_LDSB0_AFC0_AFEM1_AFEM1_ASEM1_CLR0_CADS0_DTLA1_DTLB1_DTVA0_DTVB0_EPS0_FDSI0_GRPM1_GRVWA8_GRVWB8_GSU0_GSUAMB_GSUC0_GSUWGMRR0_GLS0_ISA950_IU1_K1_LBSPPA1024_LBSPPB1024_LBSPPM0_LPA16_LPB16_LPM0_LRVW8_LWPMn1_MIAV0_MIWT4_2_MO40_NTn1_NTA2_NTB2_NTC4_NTD5_NTM0_NEPBS16_NLCA1_NLCB1_ONLL1_PGR2_PLR1_PKA1_SIA3_SS1_SU8_SUM0_SUS256_SPO0_SRVW0_SSO0_SVW4_SK3_SKXCCM5_TLDS1_ULSGRO0_USL1_UIOFGRO0_USFGRO1_VSn1_VWA4_VWB2_WSGRA0_WSGRB0_WS64_WG16_16_1_WGM1_WGMXCC8_WGMXCCGn1
    SolutionIndex: 110
    SolutionNameMin: Cijk_Alik_Bljk_BBS_BH_Bias_HAS_SAV_UserArgs_MT96x96x128_MI16x16x1_SN_LDSB0_AFC0_AFEM1_AFEM1_ASEM1_CLR1_CADS0_DTLA0_DTLB0_DTVA0_DTVB0_EPS0_FDSI0_GRPM1_GRVWA8_GRVWB8_GSU0_GSUAMB_GSUC0_GSUWGMRR0_GLS0_ISA950_IU1_K1_LBSPPA256_LBSPPB256_LBSPPM0_LPA16_LPB16_LPM0_LRVW8_LWPMn1_MIAV1_MIWT3_3_MO40_NTn1_NTA1_NTB3_NTC1_NTD5_NTM0_NEPBS0_NLCA1_NLCB1_ONLL1_PGR2_PLR1_PKA1_SIA3_SS1_SU0_SUM0_SUS256_SPO1_SRVW0_SSO0_SVW1_SK3_SKXCCM4_TLDS2_ULSGRO0_USL1_UIOFGRO0_USFGRO0_VSn1_VWA1_VWB1_WSGRA0_WSGRB0_WS64_WG32_8_1_WGM1_WGMXCC8_WGMXCCGn1
    SolutionIndex: 111
    SolutionNameMin: Cijk_Alik_Bljk_BBS_BH_Bias_HAS_SAV_UserArgs_MT160x64x128_MI16x16x1_SN_LDSB0_AFC0_AFEM1_AFEM1_ASEM1_CLR0_CADS0_DTLA0_DTLB0_DTVA0_DTVB0_EPS0_FDSI0_GRPM1_GRVWA8_GRVWB8_GSU0_GSUAMB_GSUC0_GSUWGMRR0_GLS0_ISA950_IU1_K1_LBSPPA512_LBSPPB256_LBSPPM0_LPA16_LPB16_LPM0_LRVW8_LWPMn1_MIAV0_MIWT10_1_MO40_NTn1_NTA0_NTB3_NTC0_NTD4_NTM0_NEPBS0_NLCA1_NLCB1_ONLL1_PGR2_PLR1_PKA1_SIA3_SS1_SU0_SUM0_SUS256_SPO0_SRVW0_SSO1_SVW2_SK3_SKXCCM0_TLDS1_ULSGRO0_USL1_UIOFGRO0_USFGRO1_VSn1_VWA2_VWB1_WSGRA0_WSGRB0_WS64_WG16_16_1_WGM0_WGMXCC4_WGMXCCGn1
    SolutionIndex: 112
    SolutionNameMin: Cijk_Alik_Bljk_BBS_BH_Bias_HAS_SAV_UserArgs_MT80x128x128_MI16x16x1_SN_LDSB0_AFC0_AFEM1_AFEM1_ASEM1_CLR0_CADS0_DTLA0_DTLB0_DTVA0_DTVB0_EPS0_FDSI0_GRPM1_GRVWA8_GRVWB8_GSU0_GSUAMB_GSUC0_GSUWGMRR0_GLS0_ISA950_IU1_K1_LBSPPA256_LBSPPB512_LBSPPM0_LPA16_LPB16_LPM0_LRVW8_LWPMn1_MIAV0_MIWT5_2_MO40_NTn1_NTA0_NTB1_NTC0_NTD1_NTM0_NEPBS0_NLCA1_NLCB1_ONLL1_PGR2_PLR1_PKA1_SIA3_SS1_SU0_SUM0_SUS256_SPO0_SRVW0_SSO0_SVW1_SK3_SKXCCM8_TLDS2_ULSGRO0_USL1_UIOFGRO0_USFGRO0_VSn1_VWA1_VWB2_WSGRA0_WSGRB0_WS64_WG16_16_1_WGM4_WGMXCC1_WGMXCCGn1
    SolutionIndex: 113
    SolutionNameMin: Cijk_Alik_Bljk_BBS_BH_Bias_HAS_SAV_UserArgs_MT64x192x128_MI16x16x1_SN_LDSB0_AFC0_AFEM1_AFEM1_ASEM1_CLR0_CADS0_DTLA0_DTLB0_DTVA0_DTVB0_EPS0_FDSI0_GRPM1_GRVWA8_GRVWB8_GSU0_GSUAMB_GSUC0_GSUWGMRR0_GLS0_ISA950_IU1_K1_LBSPPA1024_LBSPPB256_LBSPPM0_LPA16_LPB16_LPM0_LRVW8_LWPMn1_MIAV0_MIWT4_3_MO40_NTn1_NTA1_NTB2_NTC6_NTD6_NTM0_NEPBS16_NLCA1_NLCB1_ONLL1_PGR2_PLR1_PKA1_SIA3_SS1_SU8_SUM0_SUS256_SPO0_SRVW0_SSO0_SVW4_SK3_SKXCCM5_TLDS1_ULSGRO0_USL1_UIOFGRO0_USFGRO1_VSn1_VWA4_VWB1_WSGRA0_WSGRB0_WS64_WG16_16_1_WGM0_WGMXCC16_WGMXCCGn1
    SolutionIndex: 114
    SolutionNameMin: Cijk_Alik_Bljk_BBS_BH_Bias_HAS_SAV_UserArgs_MT64x192x128_MI16x16x1_SN_LDSB0_AFC0_AFEM1_AFEM1_ASEM1_CLR0_CADS0_DTLA0_DTLB0_DTVA0_DTVB0_EPS0_FDSI0_GRPM1_GRVWA8_GRVWB8_GSU0_GSUAMB_GSUC0_GSUWGMRR0_GLS0_ISA950_IU1_K1_LBSPPA1024_LBSPPB256_LBSPPM0_LPA16_LPB16_LPM0_LRVW8_LWPMn1_MIAV1_MIWT4_3_MO40_NTn1_NTA3_NTB3_NTC5_NTD6_NTM0_NEPBS0_NLCA1_NLCB1_ONLL1_PGR2_PLR1_PKA1_SIA3_SS1_SU8_SUM0_SUS256_SPO0_SRVW0_SSO0_SVW4_SK3_SKXCCM4_TLDS2_ULSGRO0_USL1_UIOFGRO0_USFGROn1_VSn1_VWA4_VWB1_WSGRA0_WSGRB0_WS64_WG16_16_1_WGM0_WGMXCC1_WGMXCCGn1
    SolutionIndex: 115
    SolutionNameMin: Cijk_Alik_Bljk_BBS_BH_Bias_HAS_SAV_UserArgs_MT128x96x128_MI16x16x1_SN_LDSB0_AFC0_AFEM1_AFEM1_ASEM1_CLR0_CADS0_DTLA0_DTLB0_DTVA0_DTVB0_EPS0_FDSI0_GRPM1_GRVWA8_GRVWB8_GSU0_GSUAMB_GSUC0_GSUWGMRR0_GLS0_ISA950_IU1_K1_LBSPPA1024_LBSPPB256_LBSPPM0_LPA16_LPB16_LPM0_LRVW8_LWPMn1_MIAV1_MIWT4_3_MO40_NTn1_NTA2_NTB3_NTC2_NTD4_NTM0_NEPBS0_NLCA1_NLCB1_ONLL1_PGR2_PLR1_PKA1_SIA3_SS1_SU16_SUM0_SUS256_SPO0_SRVW0_SSO0_SVW4_SK3_SKXCCM4_TLDS2_ULSGRO0_USL1_UIOFGRO0_USFGRO0_VSn1_VWA4_VWB1_WSGRA0_WSGRB0_WS64_WG32_8_1_WGM4_WGMXCC2_WGMXCCGn1
    SolutionIndex: 116
    SolutionNameMin: Cijk_Alik_Bljk_BBS_BH_Bias_HAS_SAV_UserArgs_MT192x128x64_MI16x16x1_SN_LDSB1_AFC0_AFEM1_AFEM1_ASEM1_CLR0_CADS0_DTLA0_DTLB0_DTVA0_DTVB0_EPS0_FDSI0_GRPM1_GRVWA8_GRVWB8_GSU0_GSUAMB_GSUC0_GSUWGMRR0_GLS0_ISA950_IU1_K1_LBSPPA512_LBSPPB256_LBSPPM0_LPA16_LPB16_LPM0_LRVW8_LWPMn1_MIAV0_MIWT12_2_MO40_NTn1_NTA0_NTB3_NTC7_NTD6_NTM0_NEPBS16_NLCA1_NLCB1_ONLL1_PGR2_PLR1_PKA1_SIA3_SS1_SU0_SUM0_SUS128_SPO1_SRVW0_SSO1_SVW4_SK3_SKXCCM0_TLDS1_ULSGRO0_USL1_UIOFGRO0_USFGROn1_VSn1_VWA4_VWB2_WSGRA0_WSGRB0_WS64_WG16_16_1_WGM8_WGMXCC4_WGMXCCGn1
    SolutionIndex: 117
    SolutionNameMin: Cijk_Alik_Bljk_BBS_BH_Bias_HAS_SAV_UserArgs_MT192x224x32_MI16x16x1_SN_LDSB0_AFC0_AFEM1_AFEM1_ASEM1_CLR0_CADS0_DTLA1_DTLB1_DTVA0_DTVB0_EPS0_FDSI0_GRPM1_GRVWA8_GRVWB2_GSU0_GSUAMB_GSUC0_GSUWGMRR0_GLS0_ISA950_IU1_K1_LBSPPA1024_LBSPPB256_LBSPPM0_LPA16_LPB16_LPM0_LRVW8_LWPMn1_MIAV0_MIWT6_7_MO40_NTn1_NTA1_NTB3_NTC0_NTD4_NTM0_NEPBS0_NLCA1_NLCB1_ONLL1_PGR2_PLR0_PKA1_SIA3_SS1_SU8_SUM0_SUS256_SPO0_SRVW0_SSO4_SVW2_SK3_SKXCCM0_TLDS2_ULSGRO0_USL1_UIOFGRO0_USFGRO0_VSn1_VWA2_VWB1_WSGRA0_WSGRB0_WS64_WG32_8_1_WGM16_WGMXCC2_WGMXCCGn1
    SolutionIndex: 118
    SolutionNameMin: Cijk_Alik_Bljk_BBS_BH_Bias_HAS_SAV_UserArgs_MT192x256x64_MI16x16x1_SN_LDSB1_AFC0_AFEM1_AFEM1_ASEM1_CLR1_CADS0_DTLA0_DTLB0_DTVA0_DTVB0_EPS0_FDSI0_GRPM1_GRVWA8_GRVWB8_GSU0_GSUAMB_GSUC0_GSUWGMRR0_GLS0_ISA950_IU1_K1_LBSPPA512_LBSPPB512_LBSPPM0_LPA16_LPB16_LPM0_LRVW8_LWPMn1_MIAV0_MIWT12_4_MO40_NTn1_NTA1_NTB1_NTC4_NTD2_NTM0_NEPBS0_NLCA1_NLCB1_ONLL1_PGR2_PLR1_PKA1_SIA3_SS1_SU0_SUM0_SUS128_SPO0_SRVW0_SSO1_SVW4_SK3_SKXCCM0_TLDS1_ULSGRO0_USL1_UIOFGRO0_USFGRO0_VSn1_VWA4_VWB4_WSGRA0_WSGRB0_WS64_WG16_16_1_WGM16_WGMXCC2_WGMXCCGn1
    SolutionIndex: 119
    SolutionNameMin: Cijk_Alik_Bljk_BBS_BH_Bias_HAS_SAV_UserArgs_MT64x32x64_MI16x16x1_SN_LDSB0_AFC0_AFEM1_AFEM1_ASEM1_CLR1_CADS0_DTLA1_DTLB1_DTVA0_DTVB0_EPS0_FDSI0_GRPM1_GRVWA8_GRVWB8_GSU0_GSUAMB_GSUC0_GSUWGMRR0_GLS0_ISA950_IU1_K1_LBSPPA1024_LBSPPB1024_LBSPPM0_LPA16_LPB16_LPM0_LRVW8_LWPMn1_MIAV1_MIWT4_1_MO40_NTn1_NTA4_NTB0_NTC0_NTD3_NTM0_NEPBS0_NLCA1_NLCB1_ONLL1_PGR2_PLR1_PKA1_SIA3_SS1_SU0_SUM0_SUS128_SPO0_SRVW0_SSO0_SVW4_SK3_SKXCCM0_TLDS1_ULSGRO0_USL1_UIOFGRO0_USFGRO1_VSn1_VWA4_VWB1_WSGRA0_WSGRB0_WS64_WG16_8_1_WGM1_WGMXCC16_WGMXCCGn1
    SolutionIndex: 120
    SolutionNameMin: Cijk_Alik_Bljk_BBS_BH_Bias_HAS_SAV_UserArgs_MT64x96x64_MI16x16x1_SN_LDSB0_AFC0_AFEM1_AFEM1_ASEM1_CLR1_CADS0_DTLA1_DTLB1_DTVA0_DTVB0_EPS0_FDSI0_GRPM1_GRVWA2_GRVWB8_GSU0_GSUAMB_GSUC0_GSUWGMRR0_GLS0_ISA950_IU1_K1_LBSPPA256_LBSPPB1024_LBSPPM0_LPA16_LPB16_LPM0_LRVW8_LWPMn1_MIAV1_MIWT2_3_MO40_NTn1_NTA4_NTB0_NTC0_NTD1_NTM0_NEPBS0_NLCA1_NLCB1_ONLL1_PGR2_PLR1_PKA1_SIA3_SS1_SU0_SUM0_SUS128_SPO0_SRVW0_SSO0_SVW2_SK3_SKXCCM5_TLDS1_ULSGRO0_USL1_UIOFGRO0_USFGRO0_VSn1_VWA2_VWB1_WSGRA0_WSGRB0_WS64_WG32_8_1_WGM0_WGMXCC8_WGMXCCGn1
    SolutionIndex: 121
    SolutionNameMin: Cijk_Alik_Bljk_BBS_BH_Bias_HAS_SAV_UserArgs_MT128x96x64_MI16x16x1_SN_LDSB0_AFC0_AFEM1_AFEM1_ASEM1_CLR0_CADS0_DTLA1_DTLB1_DTVA0_DTVB0_EPS0_FDSI0_GRPM1_GRVWA8_GRVWB8_GSU0_GSUAMB_GSUC0_GSUWGMRR0_GLS0_ISA950_IU1_K1_LBSPPA1024_LBSPPB1024_LBSPPM0_LPA16_LPB16_LPM0_LRVW8_LWPMn1_MIAV1_MIWT4_3_MO40_NTn1_NTA5_NTB1_NTC1_NTD2_NTM0_NEPBS0_NLCA1_NLCB1_ONLL1_PGR2_PLR1_PKA1_SIA3_SS1_SU0_SUM0_SUS128_SPO0_SRVW0_SSO0_SVW4_SK3_SKXCCM5_TLDS1_ULSGRO0_USL1_UIOFGRO0_USFGRO1_VSn1_VWA4_VWB1_WSGRA0_WSGRB0_WS64_WG32_8_1_WGM1_WGMXCC16_WGMXCCGn1
    SolutionIndex: 122
    SolutionNameMin: Cijk_Alik_Bljk_BBS_BH_Bias_HAS_SAV_UserArgs_MT128x128x64_MI32x32x1_SN_LDSB0_AFC0_AFEM1_AFEM1_ASEM1_CLR1_CADS0_DTLA1_DTLB1_DTVA0_DTVB0_EPS0_FDSI0_GRPM1_GRVWA2_GRVWB8_GSU0_GSUAMB_GSUC0_GSUWGMRR0_GLS0_ISA950_IU1_K1_LBSPPA512_LBSPPB1024_LBSPPM0_LPA8_LPB8_LPM0_LRVW8_LWPMn1_MIAV0_MIWT4_1_MO40_NTn1_NTA7_NTB3_NTC0_NTD3_NTM0_NEPBS16_NLCA1_NLCB1_ONLL1_PGR2_PLR1_PKA1_SIA3_SS1_SU8_SUM0_SUS128_SPO1_SRVW0_SSO0_SVW4_SK3_SKXCCM5_TLDS2_ULSGRO0_USL1_UIOFGRO0_USFGRO0_VSn1_VWA4_VWB1_WSGRA0_WSGRB0_WS64_WG32_8_1_WGM0_WGMXCC16_WGMXCCGn1
    SolutionIndex: 123
    SolutionNameMin: Cijk_Alik_Bljk_BBS_BH_Bias_HAS_SAV_UserArgs_MT128x160x64_MI16x16x1_SN_LDSB0_AFC0_AFEM1_AFEM1_ASEM1_CLR0_CADS0_DTLA0_DTLB0_DTVA0_DTVB0_EPS0_FDSI0_GRPM1_GRVWA8_GRVWB8_GSU0_GSUAMB_GSUC0_GSUWGMRR0_GLS0_ISA950_IU1_K1_LBSPPA512_LBSPPB128_LBSPPM0_LPA16_LPB16_LPM0_LRVW8_LWPMn1_MIAV0_MIWT4_5_MO40_NTn1_NTA6_NTB0_NTC3_NTD2_NTM0_NEPBS0_NLCA1_NLCB1_ONLL1_PGR2_PLR1_PKA1_SIA3_SS1_SU8_SUM0_SUS128_SPO0_SRVW0_SSO0_SVW4_SK3_SKXCCM5_TLDS2_ULSGRO0_USL1_UIOFGRO0_USFGRO0_VSn1_VWA4_VWB1_WSGRA0_WSGRB0_WS64_WG32_8_1_WGM0_WGMXCC16_WGMXCCGn1
    SolutionIndex: 124
    SolutionNameMin: Cijk_Alik_Bljk_BBS_BH_Bias_HAS_SAV_UserArgs_MT64x160x64_MI16x16x1_SN_LDSB0_AFC0_AFEM1_AFEM1_ASEM1_CLR1_CADS0_DTLA1_DTLB1_DTVA0_DTVB0_EPS0_FDSI0_GRPM1_GRVWA2_GRVWB2_GSU0_GSUAMB_GSUC0_GSUWGMRR0_GLS0_ISA950_IU1_K1_LBSPPA256_LBSPPB256_LBSPPM0_LPA16_LPB16_LPM0_LRVW8_LWPMn1_MIAV0_MIWT2_5_MO40_NTn1_NTA6_NTB2_NTC1_NTD4_NTM0_NEPBS0_NLCA1_NLCB1_ONLL1_PGR2_PLR1_PKA1_SIA3_SS1_SU0_SUM0_SUS128_SPO0_SRVW0_SSO1_SVW2_SK3_SKXCCM4_TLDS2_ULSGRO0_USL1_UIOFGRO0_USFGRO0_VSn1_VWA2_VWB1_WSGRA0_WSGRB0_WS64_WG32_8_1_WGM32_WGMXCC4_WGMXCCGn1
    SolutionIndex: 125
    SolutionNameMin: Cijk_Alik_Bljk_BBS_BH_Bias_HAS_SAV_UserArgs_MT128x96x64_MI16x16x1_SN_LDSB0_AFC0_AFEM1_AFEM1_ASEM1_CLR0_CADS0_DTLA0_DTLB0_DTVA0_DTVB0_EPS0_FDSI0_GRPM1_GRVWA8_GRVWB8_GSU0_GSUAMB_GSUC0_GSUWGMRR0_GLS0_ISA950_IU1_K1_LBSPPA256_LBSPPB256_LBSPPM0_LPA16_LPB16_LPM0_LRVW8_LWPMn1_MIAV0_MIWT2_6_MO40_NTn1_NTA2_NTB3_NTC0_NTD4_NTM0_NEPBS0_NLCA1_NLCB1_ONLL1_PGR2_PLR1_PKA1_SIA3_SS1_SU16_SUM0_SUS512_SPO0_SRVW0_SSO1_SVW2_SK3_SKXCCM0_TLDS2_ULSGRO0_USL1_UIOFGRO0_USFGRO1_VSn1_VWA2_VWB2_WSGRA0_WSGRB0_WS64_WG64_4_1_WGM0_WGMXCC1_WGMXCCGn1
    SolutionIndex: 126
    SolutionNameMin: Cijk_Alik_Bljk_BBS_BH_Bias_HAS_SAV_UserArgs_MT128x128x64_MI16x16x1_SN_LDSB0_AFC0_AFEM1_AFEM1_ASEM1_CLR1_CADS0_DTLA1_DTLB1_DTVA0_DTVB0_EPS0_FDSI0_GRPM1_GRVWA8_GRVWB8_GSU0_GSUAMB_GSUC0_GSUWGMRR0_GLS0_ISA950_IU1_K1_LBSPPA1024_LBSPPB1024_LBSPPM0_LPA16_LPB16_LPM0_LRVW8_LWPMn1_MIAV0_MIWT8_2_MO40_NTn1_NTA6_NTB2_NTC7_NTD1_NTM0_NEPBS0_NLCA1_NLCB1_ONLL1_PGR2_PLR1_PKA1_SIA3_SS1_SU0_SUM0_SUS128_SPO1_SRVW0_SSO0_SVW8_SK3_SKXCCM0_TLDS1_ULSGRO0_USL1_UIOFGRO0_USFGROn1_VSn1_VWA8_VWB2_WSGRA0_WSGRB0_WS64_WG16_16_1_WGM24_WGMXCC8_WGMXCCGn1
    SolutionIndex: 127
    SolutionNameMin: Cijk_Alik_Bljk_BBS_BH_Bias_HAS_SAV_UserArgs_MT128x160x64_MI16x16x1_SN_LDSB0_AFC0_AFEM1_AFEM1_ASEM1_CLR0_CADS0_DTLA0_DTLB0_DTVA0_DTVB0_EPS0_FDSI0_GRPM1_GRVWA8_GRVWB8_GSU0_GSUAMB_GSUC0_GSUWGMRR0_GLS0_ISA950_IU1_K1_LBSPPA512_LBSPPB128_LBSPPM0_LPA16_LPB16_LPM0_LRVW8_LWPMn1_MIAV1_MIWT4_5_MO40_NTn1_NTA5_NTB0_NTC0_NTD4_NTM0_NEPBS0_NLCA1_NLCB1_ONLL1_PGR2_PLR1_PKA1_SIA3_SS1_SU0_SUM0_SUS128_SPO0_SRVW0_SSO0_SVW4_SK3_SKXCCM8_TLDS1_ULSGRO0_USL1_UIOFGRO0_USFGRO0_VSn1_VWA4_VWB1_WSGRA0_WSGRB0_WS64_WG32_8_1_WGM8_WGMXCC1_WGMXCCGn1
    SolutionIndex: 128
    SolutionNameMin: Cijk_Alik_Bljk_BBS_BH_Bias_HAS_SAV_UserArgs_MT128x160x64_MI16x16x1_SN_LDSB0_AFC0_AFEM1_AFEM1_ASEM1_CLR0_CADS0_DTLA0_DTLB0_DTVA0_DTVB0_EPS0_FDSI0_GRPM1_GRVWA8_GRVWB8_GSU0_GSUAMB_GSUC0_GSUWGMRR0_GLS0_ISA950_IU1_K1_LBSPPA512_LBSPPB128_LBSPPM0_LPA16_LPB16_LPM0_LRVW8_LWPMn1_MIAV0_MIWT4_5_MO40_NTn1_NTA6_NTB2_NTC5_NTD6_NTM0_NEPBS0_NLCA1_NLCB1_ONLL1_PGR2_PLR1_PKA1_SIA3_SS1_SU0_SUM0_SUS128_SPO1_SRVW0_SSO1_SVW4_SK3_SKXCCM0_TLDS1_ULSGRO0_USL1_UIOFGRO0_USFGRO0_VSn1_VWA4_VWB1_WSGRA0_WSGRB0_WS64_WG32_8_1_WGM0_WGMXCC1_WGMXCCGn1
    SolutionIndex: 129
    SolutionNameMin: Cijk_Alik_Bljk_BBS_BH_Bias_HAS_SAV_UserArgs_MT256x192x64_MI16x16x1_SN_LDSB0_AFC0_AFEM1_AFEM1_ASEM1_CLR1_CADS0_DTLA1_DTLB1_DTVA0_DTVB0_EPS0_FDSI0_GRPM1_GRVWA2_GRVWB2_GSU0_GSUAMB_GSUC0_GSUWGMRR0_GLS0_ISA950_IU1_K1_LBSPPA1024_LBSPPB256_LBSPPM0_LPA16_LPB16_LPM0_LRVW8_LWPMn1_MIAV0_MIWT8_6_MO40_NTn1_NTA2_NTB1_NTC6_NTD7_NTM0_NEPBS12_NLCA1_NLCB1_ONLL1_PGR2_PLR1_PKA1_SIA3_SS1_SU8_SUM0_SUS128_SPO0_SRVW0_SSO0_SVW8_SK3_SKXCCM0_TLDS2_ULSGRO0_USL1_UIOFGRO0_USFGRO0_VSn1_VWA8_VWB2_WSGRA0_WSGRB0_WS64_WG32_8_1_WGM2_WGMXCC1_WGMXCCGn1
    SolutionIndex: 130
    SolutionNameMin: Cijk_Alik_Bljk_BBS_BH_Bias_HAS_SAV_UserArgs_MT256x224x64_MI16x16x1_SN_LDSB0_AFC0_AFEM1_AFEM1_ASEM1_CLR1_CADS0_DTLA1_DTLB1_DTVA0_DTVB0_EPS0_FDSI0_GRPM1_GRVWA8_GRVWB8_GSU0_GSUAMB_GSUC0_GSUWGMRR0_GLS0_ISA950_IU1_K1_LBSPPA1024_LBSPPB1024_LBSPPM0_LPA16_LPB16_LPM0_LRVW8_LWPMn1_MIAV0_MIWT8_7_MO40_NTn1_NTA2_NTB3_NTC7_NTD5_NTM0_NEPBS16_NLCA1_NLCB1_ONLL1_PGR2_PLR1_PKA1_SIA3_SS1_SU8_SUM0_SUS128_SPO1_SRVW0_SSO4_SVW8_SK3_SKXCCM0_TLDS1_ULSGRO0_USL1_UIOFGRO0_USFGRO0_VSn1_VWA8_VWB1_WSGRA0_WSGRB0_WS64_WG32_8_1_WGM0_WGMXCC2_WGMXCCGn1
    SolutionIndex: 131
    SolutionNameMin: Cijk_Alik_Bljk_BBS_BH_Bias_HAS_SAV_UserArgs_MT128x16x64_MI16x16x1_SN_LDSB0_AFC0_AFEM1_AFEM1_ASEM1_CLR0_CADS0_DTLA1_DTLB1_DTVA0_DTVB0_EPS0_FDSI0_GRPM1_GRVWA8_GRVWB2_GSU0_GSUAMB_GSUC0_GSUWGMRR0_GLS0_ISA950_IU1_K1_LBSPPA1024_LBSPPB256_LBSPPM0_LPA16_LPB16_LPM0_LRVW8_LWPMn1_MIAV1_MIWT8_1_MO40_NTn1_NTA6_NTB1_NTC0_NTD0_NTM0_NEPBS4_NLCA1_NLCB1_ONLL1_PGR2_PLR0_PKA1_SIA3_SS1_SU0_SUM0_SUS128_SPO0_SRVW0_SSO0_SVW8_SK3_SKXCCM0_TLDS1_ULSGRO0_USL1_UIOFGRO0_USFGROn1_VSn1_VWA8_VWB1_WSGRA0_WSGRB0_WS64_WG16_4_2_WGM0_WGMXCC8_WGMXCCGn1
    SolutionIndex: 132
    SolutionNameMin: Cijk_Alik_Bljk_BBS_BH_Bias_HAS_SAV_UserArgs_MT128x32x64_MI16x16x1_SN_LDSB0_AFC0_AFEM1_AFEM1_ASEM1_CLR0_CADS0_DTLA1_DTLB1_DTVA0_DTVB0_EPS0_FDSI0_GRPM1_GRVWA8_GRVWB2_GSU0_GSUAMB_GSUC0_GSUWGMRR0_GLS0_ISA950_IU1_K1_LBSPPA1024_LBSPPB256_LBSPPM0_LPA16_LPB16_LPM0_LRVW8_LWPMn1_MIAV0_MIWT8_1_MO40_NTn1_NTA6_NTB1_NTC2_NTD3_NTM0_NEPBS14_NLCA1_NLCB1_ONLL1_PGR2_PLR1_PKA1_SIA3_SS1_SU16_SUM0_SUS128_SPO0_SRVW0_SSO0_SVW8_SK3_SKXCCM0_TLDS1_ULSGRO0_USL1_UIOFGRO0_USFGROn1_VSn1_VWA8_VWB1_WSGRA0_WSGRB0_WS64_WG16_8_2_WGM1_WGMXCC1_WGMXCCGn1
    SolutionIndex: 133
    SolutionNameMin: Cijk_Alik_Bljk_BBS_BH_Bias_HAS_SAV_UserArgs_MT128x48x64_MI16x16x1_SN_LDSB0_AFC0_AFEM1_AFEM1_ASEM1_CLR1_CADS0_DTLA1_DTLB1_DTVA0_DTVB0_EPS0_FDSI0_GRPM1_GRVWA8_GRVWB8_GSU0_GSUAMB_GSUC0_GSUWGMRR0_GLS0_ISA950_IU1_K1_LBSPPA1024_LBSPPB1024_LBSPPM0_LPA16_LPB16_LPM0_LRVW8_LWPMn1_MIAV0_MIWT4_3_MO40_NTn1_NTA3_NTB3_NTC0_NTD5_NTM0_NEPBS12_NLCA1_NLCB1_ONLL1_PGR2_PLR1_PKA1_SIA3_SS1_SU16_SUM0_SUS128_SPO0_SRVW0_SSO0_SVW4_SK3_SKXCCM4_TLDS2_ULSGRO0_USL1_UIOFGRO0_USFGROn1_VSn1_VWA4_VWB1_WSGRA0_WSGRB0_WS64_WG32_4_1_WGM1_WGMXCC2_WGMXCCGn1
    SolutionIndex: 134
    SolutionNameMin: Cijk_Alik_Bljk_BBS_BH_Bias_HAS_SAV_UserArgs_MT128x64x64_MI16x16x1_SN_LDSB0_AFC0_AFEM1_AFEM1_ASEM1_CLR1_CADS0_DTLA1_DTLB1_DTVA0_DTVB0_EPS0_FDSI0_GRPM1_GRVWA8_GRVWB2_GSU0_GSUAMB_GSUC0_GSUWGMRR0_GLS0_ISA950_IU1_K1_LBSPPA1024_LBSPPB256_LBSPPM0_LPA16_LPB16_LPM0_LRVW8_LWPMn1_MIAV0_MIWT8_1_MO40_NTn1_NTA4_NTB1_NTC1_NTD0_NTM0_NEPBS0_NLCA1_NLCB1_ONLL1_PGR2_PLR1_PKA1_SIA3_SS1_SU0_SUM0_SUS128_SPO0_SRVW0_SSO0_SVW8_SK3_SKXCCM0_TLDS2_ULSGRO0_USL1_UIOFGRO0_USFGRO1_VSn1_VWA8_VWB1_WSGRA0_WSGRB0_WS64_WG16_16_1_WGM0_WGMXCC8_WGMXCCGn1
    SolutionIndex: 135
    SolutionNameMin: Cijk_Alik_Bljk_BBS_BH_Bias_HAS_SAV_UserArgs_MT128x96x64_MI16x16x1_SN_LDSB0_AFC0_AFEM1_AFEM1_ASEM1_CLR0_CADS0_DTLA1_DTLB1_DTVA0_DTVB0_EPS0_FDSI0_GRPM1_GRVWA8_GRVWB8_GSU0_GSUAMB_GSUC0_GSUWGMRR0_GLS0_ISA950_IU1_K1_LBSPPA1024_LBSPPB1024_LBSPPM0_LPA16_LPB16_LPM0_LRVW8_LWPMn1_MIAV0_MIWT4_3_MO40_NTn1_NTA6_NTB3_NTC3_NTD3_NTM0_NEPBS0_NLCA1_NLCB1_ONLL1_PGR2_PLR1_PKA1_SIA3_SS1_SU8_SUM0_SUS128_SPO0_SRVW0_SSO0_SVW4_SK3_SKXCCM0_TLDS1_ULSGRO0_USL1_UIOFGRO0_USFGROn1_VSn1_VWA4_VWB1_WSGRA0_WSGRB0_WS64_WG32_8_1_WGM1_WGMXCC1_WGMXCCGn1
    SolutionIndex: 136
    SolutionNameMin: Cijk_Alik_Bljk_BBS_BH_Bias_HAS_SAV_UserArgs_MT448x16x64_MI16x16x1_SN_LDSB1_AFC0_AFEM1_AFEM1_ASEM1_CLR0_CADS0_DTLA0_DTLB0_DTVA0_DTVB0_EPS0_FDSI0_GRPM1_GRVWA8_GRVWB4_GSU0_GSUAMB_GSUC0_GSUWGMRR0_GLS0_ISA950_IU1_K1_LBSPPA128_LBSPPB128_LBSPPM0_LPA16_LPB16_LPM0_LRVW8_LWPMn1_MIAV0_MIWT7_1_MO40_NTn1_NTA4_NTB0_NTC0_NTD0_NTM0_NEPBS14_NLCA1_NLCB1_ONLL1_PGR2_PLR1_PKA1_SIA3_SS0_SU0_SUM0_SUS128_SPO1_SRVW0_SSO0_SVW4_SK3_SKXCCM0_TLDS1_ULSGRO0_USL1_UIOFGRO0_USFGRO1_VSn1_VWA1_VWB1_WSGRA0_WSGRB0_WS64_WG64_4_1_WGM0_WGMXCC1_WGMXCCGn1
    SolutionIndex: 137
    SolutionNameMin: Cijk_Alik_Bljk_BBS_BH_Bias_HAS_SAV_UserArgs_MT448x32x64_MI16x16x1_SN_LDSB0_AFC0_AFEM1_AFEM1_ASEM1_CLR0_CADS0_DTLA0_DTLB0_DTVA0_DTVB0_EPS0_FDSI0_GRPM1_GRVWA8_GRVWB8_GSU0_GSUAMB_GSUC0_GSUWGMRR0_GLS0_ISA950_IU1_K1_LBSPPA256_LBSPPB128_LBSPPM0_LPA16_LPB16_LPM0_LRVW8_LWPMn1_MIAV0_MIWT14_1_MO40_NTn1_NTA6_NTB0_NTC0_NTD5_NTM0_NEPBS0_NLCA1_NLCB1_ONLL1_PGR2_PLR1_PKA1_SIA3_SS1_SU0_SUM0_SUS128_SPO1_SRVW0_SSO0_SVW2_SK3_SKXCCM8_TLDS1_ULSGRO0_USL1_UIOFGRO0_USFGROn1_VSn1_VWA2_VWB1_WSGRA0_WSGRB0_WS64_WG32_8_1_WGM1_WGMXCC2_WGMXCCGn1
    SolutionIndex: 138
    SolutionNameMin: Cijk_Alik_Bljk_BBS_BH_Bias_HAS_SAV_UserArgs_MT416x64x64_MI16x16x1_SN_LDSB0_AFC0_AFEM1_AFEM1_ASEM1_CLR0_CADS0_DTLA0_DTLB0_DTVA0_DTVB0_EPS0_FDSI0_GRPM1_GRVWA8_GRVWB8_GSU0_GSUAMB_GSUC0_GSUWGMRR0_GLS0_ISA950_IU1_K1_LBSPPA128_LBSPPB256_LBSPPM0_LPA16_LPB16_LPM0_LRVW8_LWPMn1_MIAV0_MIWT13_2_MO40_NTn1_NTA6_NTB2_NTC1_NTD5_NTM0_NEPBS0_NLCA1_NLCB1_ONLL1_PGR2_PLR1_PKA1_SIA3_SS1_SU8_SUM0_SUS128_SPO0_SRVW0_SSO0_SVW1_SK3_SKXCCM0_TLDS1_ULSGRO0_USL1_UIOFGRO0_USFGRO1_VSn1_VWA1_VWB2_WSGRA0_WSGRB0_WS64_WG32_8_1_WGM1_WGMXCC4_WGMXCCGn1
    SolutionIndex: 139
    SolutionNameMin: Cijk_Alik_Bljk_BBS_BH_Bias_HAS_SAV_UserArgs_MT416x96x64_MI16x16x1_SN_LDSB1_AFC0_AFEM1_AFEM1_ASEM1_CLR0_CADS0_DTLA0_DTLB0_DTVA0_DTVB0_EPS0_FDSI0_GRPM1_GRVWA8_GRVWB8_GSU0_GSUAMB_GSUC0_GSUWGMRR0_GLS0_ISA950_IU1_K1_LBSPPA128_LBSPPB128_LBSPPM0_LPA16_LPB16_LPM0_LRVW8_LWPMn1_MIAV0_MIWT13_3_MO40_NTn1_NTA4_NTB2_NTC3_NTD4_NTM0_NEPBS0_NLCA1_NLCB1_ONLL1_PGR2_PLR1_PKA1_SIA3_SS1_SU8_SUM0_SUS128_SPO1_SRVW0_SSO0_SVW1_SK3_SKXCCM0_TLDS1_ULSGRO0_USL1_UIOFGRO0_USFGROn1_VSn1_VWA1_VWB1_WSGRA0_WSGRB0_WS64_WG32_8_1_WGM16_WGMXCC32_WGMXCCGn1
    SolutionIndex: 140
    SolutionNameMin: Cijk_Alik_Bljk_BBS_BH_Bias_HAS_SAV_UserArgs_MT16x16x64_MI16x16x1_SN_LDSB0_AFC0_AFEM1_AFEM1_ASEM1_CLR0_CADS0_DTLA1_DTLB1_DTVA0_DTVB0_EPS0_FDSI0_GRPM1_GRVWA8_GRVWB8_GSU0_GSUAMB_GSUC0_GSUWGMRR0_GLS0_ISA950_IU1_K1_LBSPPA1024_LBSPPB1024_LBSPPM0_LPA16_LPB16_LPM0_LRVW8_LWPMn1_MIAV1_MIWT1_1_MO40_NTn1_NTA1_NTB3_NTC3_NTD0_NTM0_NEPBS4_NLCA1_NLCB1_ONLL1_PGR2_PLR1_PKA1_SIA3_SS0_SU0_SUM0_SUS128_SPO0_SRVW0_SSO0_SVW1_SK3_SKXCCM8_TLDS2_ULSGRO0_USL1_UIOFGRO0_USFGRO1_VSn1_VWA1_VWB1_WSGRA0_WSGRB0_WS64_WG16_4_2_WGM1_WGMXCC32_WGMXCCGn1
    SolutionIndex: 141
    SolutionNameMin: Cijk_Alik_Bljk_BBS_BH_Bias_HAS_SAV_UserArgs_MT16x16x64_MI16x16x1_SN_LDSB0_AFC0_AFEM1_AFEM1_ASEM1_CLR0_CADS0_DTLA1_DTLB1_DTVA0_DTVB0_EPS0_FDSI0_GRPM1_GRVWA8_GRVWB8_GSU0_GSUAMB_GSUC0_GSUWGMRR0_GLS0_ISA950_IU1_K1_LBSPPA1024_LBSPPB1024_LBSPPM0_LPA16_LPB16_LPM0_LRVW8_LWPMn1_MIAV1_MIWT1_1_MO40_NTn1_NTA2_NTB1_NTC1_NTD0_NTM0_NEPBS10_NLCA1_NLCB1_ONLL1_PGR2_PLR1_PKA1_SIA3_SS1_SU0_SUM0_SUS128_SPO0_SRVW0_SSO0_SVW1_SK3_SKXCCM0_TLDS1_ULSGRO0_USL1_UIOFGRO0_USFGRO0_VSn1_VWA1_VWB1_WSGRA0_WSGRB0_WS64_WG16_4_2_WGM0_WGMXCC32_WGMXCCGn1
    SolutionIndex: 142
    SolutionNameMin: Cijk_Alik_Bljk_BBS_BH_Bias_HAS_SAV_UserArgs_MT16x32x64_MI16x16x1_SN_LDSB0_AFC0_AFEM1_AFEM1_ASEM1_CLR1_CADS0_DTLA1_DTLB1_DTVA0_DTVB0_EPS0_FDSI0_GRPM1_GRVWA8_GRVWB8_GSU0_GSUAMB_GSUC0_GSUWGMRR0_GLS0_ISA950_IU1_K1_LBSPPA1024_LBSPPB1024_LBSPPM0_LPA16_LPB16_LPM0_LRVW8_LWPMn1_MIAV1_MIWT1_1_MO40_NTn1_NTA3_NTB1_NTC2_NTD0_NTM0_NEPBS4_NLCA1_NLCB1_ONLL1_PGR2_PLR1_PKA1_SIA3_SS1_SU0_SUM0_SUS128_SPO0_SRVW0_SSO0_SVW1_SK3_SKXCCM0_TLDS1_ULSGRO0_USL1_UIOFGRO0_USFGRO1_VSn1_VWA1_VWB1_WSGRA0_WSGRB0_WS64_WG16_8_1_WGM0_WGMXCC2_WGMXCCGn1
    SolutionIndex: 143
    SolutionNameMin: Cijk_Alik_Bljk_BBS_BH_Bias_HAS_SAV_UserArgs_MT16x32x64_MI16x16x1_SN_LDSB0_AFC0_AFEM1_AFEM1_ASEM1_CLR0_CADS0_DTLA1_DTLB1_DTVA0_DTVB0_EPS0_FDSI0_GRPM1_GRVWA8_GRVWB8_GSU0_GSUAMB_GSUC0_GSUWGMRR0_GLS0_ISA950_IU1_K1_LBSPPA1024_LBSPPB1024_LBSPPM0_LPA16_LPB16_LPM0_LRVW8_LWPMn1_MIAV1_MIWT1_2_MO40_NTn1_NTA1_NTB1_NTC2_NTD3_NTM0_NEPBS14_NLCA1_NLCB1_ONLL1_PGR2_PLR1_PKA1_SIA3_SS0_SU0_SUM0_SUS128_SPO0_SRVW0_SSO0_SVW4_SK3_SKXCCM4_TLDS2_ULSGRO0_USL1_UIOFGRO0_USFGRO1_VSn1_VWA1_VWB2_WSGRA0_WSGRB0_WS64_WG16_4_1_WGM1_WGMXCC4_WGMXCCGn1
    SolutionIndex: 144
    SolutionNameMin: Cijk_Alik_Bljk_BBS_BH_Bias_HAS_SAV_UserArgs_MT16x48x64_MI16x16x1_SN_LDSB0_AFC0_AFEM1_AFEM1_ASEM1_CLR0_CADS0_DTLA1_DTLB1_DTVA0_DTVB0_EPS0_FDSI0_GRPM1_GRVWA8_GRVWB8_GSU0_GSUAMB_GSUC0_GSUWGMRR0_GLS0_ISA950_IU1_K1_LBSPPA1024_LBSPPB1024_LBSPPM0_LPA16_LPB16_LPM0_LRVW8_LWPMn1_MIAV1_MIWT1_3_MO40_NTn1_NTA0_NTB3_NTC3_NTD1_NTM0_NEPBS14_NLCA1_NLCB1_ONLL1_PGR2_PLR1_PKA1_SIA3_SS1_SU0_SUM0_SUS128_SPO0_SRVW0_SSO0_SVW1_SK3_SKXCCM5_TLDS1_ULSGRO0_USL1_UIOFGRO0_USFGROn1_VSn1_VWA1_VWB1_WSGRA0_WSGRB0_WS64_WG16_4_2_WGM1_WGMXCC8_WGMXCCGn1
    SolutionIndex: 145
    SolutionNameMin: Cijk_Alik_Bljk_BBS_BH_Bias_HAS_SAV_UserArgs_MT32x32x64_MI16x16x1_SN_LDSB0_AFC0_AFEM1_AFEM1_ASEM1_CLR1_CADS0_DTLA1_DTLB1_DTVA0_DTVB0_EPS0_FDSI0_GRPM1_GRVWA8_GRVWB2_GSU0_GSUAMB_GSUC0_GSUWGMRR0_GLS0_ISA950_IU1_K1_LBSPPA1024_LBSPPB256_LBSPPM0_LPA16_LPB16_LPM0_LRVW8_LWPMn1_MIAV1_MIWT1_1_MO40_NTn1_NTA1_NTB4_NTC2_NTD0_NTM0_NEPBS10_NLCA1_NLCB1_ONLL1_PGR2_PLR1_PKA1_SIA3_SS1_SU8_SUM0_SUS128_SPO1_SRVW0_SSO0_SVW1_SK3_SKXCCM4_TLDS1_ULSGRO0_USL1_UIOFGRO0_USFGROn1_VSn1_VWA1_VWB1_WSGRA0_WSGRB0_WS64_WG32_8_1_WGM48_WGMXCC8_WGMXCCGn1
    SolutionIndex: 146
    SolutionNameMin: Cijk_Alik_Bljk_BBS_BH_Bias_HAS_SAV_UserArgs_MT64x16x64_MI16x16x1_SN_LDSB0_AFC0_AFEM1_AFEM1_ASEM1_CLR1_CADS0_DTLA1_DTLB1_DTVA0_DTVB0_EPS0_FDSI0_GRPM1_GRVWA8_GRVWB2_GSU0_GSUAMB_GSUC0_GSUWGMRR0_GLS0_ISA950_IU1_K1_LBSPPA1024_LBSPPB256_LBSPPM0_LPA16_LPB16_LPM0_LRVW8_LWPMn1_MIAV1_MIWT1_1_MO40_NTn1_NTA2_NTB5_NTC1_NTD2_NTM0_NEPBS12_NLCA1_NLCB1_ONLL1_PGR2_PLR1_PKA1_SIA3_SS0_SU0_SUM0_SUS128_SPO0_SRVW0_SSO0_SVW4_SK3_SKXCCM4_TLDS1_ULSGRO0_USL1_UIOFGRO0_USFGROn1_VSn1_VWA1_VWB1_WSGRA0_WSGRB0_WS64_WG64_4_1_WGM1_WGMXCC8_WGMXCCGn1
    SolutionIndex: 147
    SolutionNameMin: Cijk_Alik_Bljk_BBS_BH_Bias_HAS_SAV_UserArgs_MT32x64x64_MI16x16x1_SN_LDSB0_AFC0_AFEM1_AFEM1_ASEM1_CLR0_CADS0_DTLA1_DTLB1_DTVA0_DTVB0_EPS0_FDSI0_GRPM1_GRVWA2_GRVWB8_GSU0_GSUAMB_GSUC0_GSUWGMRR0_GLS0_ISA950_IU1_K1_LBSPPA256_LBSPPB1024_LBSPPM0_LPA16_LPB16_LPM0_LRVW8_LWPMn1_MIAV1_MIWT2_1_MO40_NTn1_NTA1_NTB2_NTC2_NTD0_NTM0_NEPBS16_NLCA1_NLCB1_ONLL1_PGR2_PLR1_PKA1_SIA3_SS1_SU0_SUM0_SUS128_SPO1_SRVW0_SSO0_SVW2_SK3_SKXCCM0_TLDS1_ULSGRO0_USL1_UIOFGRO0_USFGRO0_VSn1_VWA2_VWB1_WSGRA0_WSGRB0_WS64_WG16_16_1_WGM1_WGMXCC8_WGMXCCGn1
    SolutionIndex: 148
    SolutionNameMin: Cijk_Alik_Bljk_BBS_BH_Bias_HAS_SAV_UserArgs_MT32x64x64_MI16x16x1_SN_LDSB0_AFC0_AFEM1_AFEM1_ASEM1_CLR0_CADS0_DTLA1_DTLB1_DTVA0_DTVB0_EPS0_FDSI0_GRPM1_GRVWA8_GRVWB2_GSU0_GSUAMB_GSUC0_GSUWGMRR0_GLS0_ISA950_IU1_K1_LBSPPA1024_LBSPPB256_LBSPPM0_LPA16_LPB16_LPM0_LRVW8_LWPMn1_MIAV0_MIWT1_2_MO40_NTn1_NTA0_NTB3_NTC3_NTD0_NTM0_NEPBS10_NLCA1_NLCB1_ONLL1_PGR2_PLR1_PKA1_SIA3_SS0_SU0_SUM0_SUS128_SPO1_SRVW0_SSO0_SVW4_SK3_SKXCCM4_TLDS2_ULSGRO0_USL1_UIOFGRO0_USFGROn1_VSn1_VWA1_VWB2_WSGRA0_WSGRB0_WS64_WG32_8_1_WGM1_WGMXCC4_WGMXCCGn1
    SolutionIndex: 149
    SolutionNameMin: Cijk_Alik_Bljk_BBS_BH_Bias_HAS_SAV_UserArgs_MT64x48x64_MI16x16x1_SN_LDSB0_AFC0_AFEM1_AFEM1_ASEM1_CLR0_CADS0_DTLA1_DTLB1_DTVA0_DTVB0_EPS0_FDSI0_GRPM1_GRVWA8_GRVWB2_GSU0_GSUAMB_GSUC0_GSUWGMRR0_GLS0_ISA950_IU1_K1_LBSPPA1024_LBSPPB256_LBSPPM0_LPA16_LPB16_LPM0_LRVW8_LWPMn1_MIAV0_MIWT1_3_MO40_NTn1_NTA2_NTB6_NTC1_NTD0_NTM0_NEPBS16_NLCA1_NLCB1_ONLL1_PGR2_PLR1_PKA1_SIA3_SS1_SU0_SUM0_SUS128_SPO1_SRVW0_SSO0_SVW1_SK3_SKXCCM6_TLDS2_ULSGRO0_USL1_UIOFGRO0_USFGRO1_VSn1_VWA1_VWB1_WSGRA0_WSGRB0_WS64_WG64_4_1_WGM0_WGMXCC4_WGMXCCGn1
    SolutionIndex: 150
    SolutionNameMin: Cijk_Alik_Bljk_BBS_BH_Bias_HAS_SAV_UserArgs_MT128x112x64_MI16x16x1_SN_LDSB0_AFC0_AFEM1_AFEM1_ASEM1_CLR1_CADS0_DTLA1_DTLB1_DTVA0_DTVB0_EPS0_FDSI0_GRPM1_GRVWA8_GRVWB2_GSU0_GSUAMB_GSUC0_GSUWGMRR0_GLS0_ISA950_IU1_K1_LBSPPA1024_LBSPPB256_LBSPPM0_LPA16_LPB16_LPM0_LRVW8_LWPMn1_MIAV1_MIWT2_7_MO40_NTn1_NTA0_NTB4_NTC1_NTD3_NTM0_NEPBS0_NLCA1_NLCB1_ONLL1_PGR2_PLR1_PKA1_SIA3_SS1_SU8_SUM0_SUS128_SPO0_SRVW0_SSO0_SVW2_SK3_SKXCCM0_TLDS1_ULSGRO0_USL1_UIOFGRO0_USFGRO0_VSn1_VWA2_VWB1_WSGRA0_WSGRB0_WS64_WG64_4_1_WGM0_WGMXCC32_WGMXCCGn1
    SolutionIndex: 151
    SolutionNameMin: Cijk_Alik_Bljk_BBS_BH_Bias_HAS_SAV_UserArgs_MT16x16x64_MI16x16x1_SN_LDSB0_AFC0_AFEM1_AFEM1_ASEM1_CLR0_CADS0_DTLA1_DTLB1_DTVA0_DTVB0_EPS0_FDSI0_GRPM1_GRVWA8_GRVWB8_GSU0_GSUAMB_GSUC0_GSUWGMRR0_GLS0_ISA950_IU1_K1_LBSPPA1024_LBSPPB1024_LBSPPM0_LPA16_LPB16_LPM0_LRVW8_LWPMn1_MIAV0_MIWT1_1_MO40_NTn1_NTA6_NTB2_NTC2_NTD1_NTM0_NEPBS14_NLCA1_NLCB1_ONLL1_PGR2_PLR1_PKA1_SIA3_SS0_SU0_SUM0_SUS128_SPO1_SRVW0_SSO0_SVW1_SK3_SKXCCM0_TLDS2_ULSGRO0_USL1_UIOFGRO0_USFGRO1_VSn1_VWA1_VWB1_WSGRA0_WSGRB0_WS64_WG16_4_2_WGM0_WGMXCC2_WGMXCCGn1
    SolutionIndex: 152
    SolutionNameMin: Cijk_Alik_Bljk_BBS_BH_Bias_HAS_SAV_UserArgs_MT16x16x64_MI16x16x1_SN_LDSB0_AFC0_AFEM1_AFEM1_ASEM1_CLR0_CADS0_DTLA1_DTLB1_DTVA0_DTVB0_EPS0_FDSI0_GRPM1_GRVWA8_GRVWB8_GSU0_GSUAMB_GSUC0_GSUWGMRR0_GLS0_ISA950_IU1_K1_LBSPPA1024_LBSPPB1024_LBSPPM0_LPA16_LPB16_LPM0_LRVW8_LWPMn1_MIAV0_MIWT1_1_MO40_NTn1_NTA4_NTB1_NTC0_NTD2_NTM0_NEPBS0_NLCA1_NLCB1_ONLL1_PGR2_PLR0_PKA1_SIA3_SS1_SU0_SUM0_SUS128_SPO0_SRVW0_SSO0_SVW1_SK3_SKXCCM0_TLDS1_ULSGRO0_USL1_UIOFGRO0_USFGROn1_VSn1_VWA1_VWB1_WSGRA0_WSGRB0_WS64_WG16_4_2_WGM0_WGMXCC16_WGMXCCGn1
    SolutionIndex: 153
    SolutionNameMin: Cijk_Alik_Bljk_BBS_BH_Bias_HAS_SAV_UserArgs_MT16x64x64_MI16x16x1_SN_LDSB0_AFC0_AFEM1_AFEM1_ASEM1_CLR1_CADS0_DTLA1_DTLB1_DTVA0_DTVB0_EPS0_FDSI0_GRPM1_GRVWA2_GRVWB8_GSU0_GSUAMB_GSUC0_GSUWGMRR0_GLS0_ISA950_IU1_K1_LBSPPA256_LBSPPB1024_LBSPPM0_LPA16_LPB16_LPM0_LRVW8_LWPMn1_MIAV1_MIWT1_1_MO40_NTn1_NTA5_NTB2_NTC2_NTD3_NTM0_NEPBS10_NLCA1_NLCB1_ONLL1_PGR2_PLR1_PKA1_SIA3_SS1_SU8_SUM0_SUS128_SPO0_SRVW0_SSO0_SVW1_SK3_SKXCCM0_TLDS2_ULSGRO0_USL1_UIOFGRO0_USFGRO0_VSn1_VWA1_VWB1_WSGRA0_WSGRB0_WS64_WG16_16_1_WGM0_WGMXCC16_WGMXCCGn1
    SolutionIndex: 154
    SolutionNameMin: Cijk_Alik_Bljk_BBS_BH_Bias_HAS_SAV_UserArgs_MT32x64x64_MI16x16x1_SN_LDSB0_AFC0_AFEM1_AFEM1_ASEM1_CLR0_CADS0_DTLA1_DTLB1_DTVA0_DTVB0_EPS0_FDSI0_GRPM1_GRVWA8_GRVWB2_GSU0_GSUAMB_GSUC0_GSUWGMRR0_GLS0_ISA950_IU1_K1_LBSPPA1024_LBSPPB256_LBSPPM0_LPA16_LPB16_LPM0_LRVW8_LWPMn1_MIAV0_MIWT1_2_MO40_NTn1_NTA1_NTB3_NTC3_NTD1_NTM0_NEPBS0_NLCA1_NLCB1_ONLL1_PGR2_PLR1_PKA1_SIA3_SS0_SU0_SUM0_SUS128_SPO1_SRVW0_SSO0_SVW4_SK3_SKXCCM0_TLDS2_ULSGRO0_USL1_UIOFGRO0_USFGRO1_VSn1_VWA1_VWB2_WSGRA0_WSGRB0_WS64_WG32_8_1_WGM1_WGMXCC2_WGMXCCGn1
    SolutionIndex: 155
    SolutionNameMin: Cijk_Alik_Bljk_BBS_BH_Bias_HAS_SAV_UserArgs_MT64x32x64_MI16x16x1_SN_LDSB0_AFC0_AFEM1_AFEM1_ASEM1_CLR0_CADS0_DTLA1_DTLB1_DTVA0_DTVB0_EPS0_FDSI0_GRPM1_GRVWA8_GRVWB2_GSU0_GSUAMB_GSUC0_GSUWGMRR0_GLS0_ISA950_IU1_K1_LBSPPA1024_LBSPPB256_LBSPPM0_LPA16_LPB16_LPM0_LRVW8_LWPMn1_MIAV0_MIWT1_2_MO40_NTn1_NTA3_NTB0_NTC0_NTD0_NTM0_NEPBS0_NLCA1_NLCB1_ONLL1_PGR2_PLR1_PKA1_SIA3_SS1_SU0_SUM0_SUS128_SPO1_SRVW0_SSO0_SVW1_SK3_SKXCCM8_TLDS1_ULSGRO0_USL1_UIOFGRO0_USFGROn1_VSn1_VWA1_VWB2_WSGRA0_WSGRB0_WS64_WG64_4_1_WGM1_WGMXCC4_WGMXCCGn1
    SolutionIndex: 156
    SolutionNameMin: Cijk_Alik_Bljk_BBS_BH_Bias_HAS_SAV_UserArgs_MT32x96x64_MI16x16x1_SN_LDSB0_AFC0_AFEM1_AFEM1_ASEM1_CLR1_CADS0_DTLA1_DTLB1_DTVA0_DTVB0_EPS0_FDSI0_GRPM1_GRVWA2_GRVWB2_GSU0_GSUAMB_GSUC0_GSUWGMRR0_GLS0_ISA950_IU1_K1_LBSPPA256_LBSPPB256_LBSPPM0_LPA16_LPB16_LPM0_LRVW8_LWPMn1_MIAV0_MIWT1_3_MO40_NTn1_NTA4_NTB2_NTC0_NTD1_NTM0_NEPBS4_NLCA1_NLCB1_ONLL1_PGR2_PLR1_PKA1_SIA3_SS0_SU8_SUM0_SUS128_SPO0_SRVW0_SSO0_SVW4_SK3_SKXCCM8_TLDS1_ULSGRO0_USL1_UIOFGRO0_USFGRO0_VSn1_VWA1_VWB1_WSGRA0_WSGRB0_WS64_WG32_8_1_WGM0_WGMXCC4_WGMXCCGn1
    SolutionIndex: 157
    SolutionNameMin: Cijk_Alik_Bljk_BBS_BH_Bias_HAS_SAV_UserArgs_MT32x32x64_MI16x16x1_SN_LDSB0_AFC0_AFEM1_AFEM1_ASEM1_CLR1_CADS0_DTLA1_DTLB1_DTVA0_DTVB0_EPS0_FDSI0_GRPM1_GRVWA8_GRVWB8_GSU0_GSUAMB_GSUC0_GSUWGMRR0_GLS0_ISA950_IU1_K1_LBSPPA1024_LBSPPB1024_LBSPPM0_LPA16_LPB16_LPM0_LRVW8_LWPMn1_MIAV0_MIWT1_1_MO40_NTn1_NTA0_NTB2_NTC0_NTD1_NTM0_NEPBS12_NLCA1_NLCB1_ONLL1_PGR2_PLR1_PKA1_SIA3_SS1_SU8_SUM0_SUS128_SPO1_SRVW0_SSO0_SVW1_SK3_SKXCCM4_TLDS1_ULSGRO0_USL1_UIOFGRO0_USFGRO1_VSn1_VWA1_VWB1_WSGRA0_WSGRB0_WS64_WG32_8_1_WGM0_WGMXCC4_WGMXCCGn1
    SolutionIndex: 158
    SolutionNameMin: Cijk_Alik_Bljk_BBS_BH_Bias_HAS_SAV_UserArgs_MT64x64x64_MI16x16x1_SN_LDSB0_AFC0_AFEM1_AFEM1_ASEM1_CLR1_CADS0_DTLA1_DTLB1_DTVA0_DTVB0_EPS0_FDSI0_GRPM1_GRVWA2_GRVWB8_GSU0_GSUAMB_GSUC0_GSUWGMRR0_GLS0_ISA950_IU1_K1_LBSPPA512_LBSPPB1024_LBSPPM0_LPA16_LPB16_LPM0_LRVW8_LWPMn1_MIAV0_MIWT4_1_MO40_NTn1_NTA1_NTB0_NTC6_NTD1_NTM0_NEPBS16_NLCA1_NLCB1_ONLL1_PGR2_PLR1_PKA1_SIA3_SS1_SU0_SUM0_SUS128_SPO1_SRVW0_SSO0_SVW4_SK3_SKXCCM4_TLDS1_ULSGRO0_USL1_UIOFGRO0_USFGRO0_VSn1_VWA4_VWB1_WSGRA0_WSGRB0_WS64_WG16_16_1_WGM0_WGMXCC8_WGMXCCGn1
    SolutionIndex: 159
    SolutionNameMin: Cijk_Alik_Bljk_BBS_BH_Bias_HAS_SAV_UserArgs_MT64x96x64_MI16x16x1_SN_LDSB0_AFC0_AFEM1_AFEM1_ASEM1_CLR1_CADS0_DTLA1_DTLB1_DTVA0_DTVB0_EPS0_FDSI0_GRPM1_GRVWA2_GRVWB8_GSU0_GSUAMB_GSUC0_GSUWGMRR0_GLS0_ISA950_IU1_K1_LBSPPA256_LBSPPB1024_LBSPPM0_LPA16_LPB16_LPM0_LRVW8_LWPMn1_MIAV1_MIWT2_3_MO40_NTn1_NTA2_NTB1_NTC1_NTD1_NTM0_NEPBS12_NLCA1_NLCB1_ONLL1_PGR2_PLR1_PKA1_SIA3_SS1_SU8_SUM0_SUS128_SPO0_SRVW0_SSO0_SVW2_SK3_SKXCCM7_TLDS1_ULSGRO0_USL1_UIOFGRO0_USFGRO0_VSn1_VWA2_VWB1_WSGRA0_WSGRB0_WS64_WG32_8_1_WGM1_WGMXCC8_WGMXCCGn1
    SolutionIndex: 160
    SolutionNameMin: Cijk_Alik_Bljk_BBS_BH_Bias_HAS_SAV_UserArgs_MT128x64x64_MI16x16x1_SN_LDSB0_AFC0_AFEM1_AFEM1_ASEM1_CLR0_CADS0_DTLA1_DTLB1_DTVA0_DTVB0_EPS0_FDSI0_GRPM1_GRVWA8_GRVWB2_GSU0_GSUAMB_GSUC0_GSUWGMRR0_GLS0_ISA950_IU1_K1_LBSPPA1024_LBSPPB256_LBSPPM0_LPA16_LPB16_LPM0_LRVW8_LWPMn1_MIAV1_MIWT4_2_MO40_NTn1_NTA3_NTB0_NTC4_NTD3_NTM0_NEPBS14_NLCA1_NLCB1_ONLL1_PGR2_PLR1_PKA1_SIA3_SS1_SU0_SUM0_SUS128_SPO0_SRVW0_SSO0_SVW4_SK3_SKXCCM8_TLDS2_ULSGRO0_USL1_UIOFGRO0_USFGRO1_VSn1_VWA4_VWB2_WSGRA0_WSGRB0_WS64_WG32_8_1_WGM1_WGMXCC32_WGMXCCGn1
    SolutionIndex: 161
    SolutionNameMin: Cijk_Alik_Bljk_BBS_BH_Bias_HAS_SAV_UserArgs_MT128x64x64_MI16x16x1_SN_LDSB0_AFC0_AFEM1_AFEM1_ASEM1_CLR1_CADS0_DTLA1_DTLB1_DTVA0_DTVB0_EPS0_FDSI0_GRPM1_GRVWA8_GRVWB2_GSU0_GSUAMB_GSUC0_GSUWGMRR0_GLS0_ISA950_IU1_K1_LBSPPA1024_LBSPPB256_LBSPPM0_LPA16_LPB16_LPM0_LRVW8_LWPMn1_MIAV1_MIWT4_2_MO40_NTn1_NTA1_NTB3_NTC4_NTD1_NTM0_NEPBS14_NLCA1_NLCB1_ONLL1_PGR2_PLR1_PKA1_SIA3_SS1_SU0_SUM0_SUS128_SPO0_SRVW0_SSO0_SVW4_SK3_SKXCCM7_TLDS2_ULSGRO0_USL1_UIOFGRO0_USFGRO1_VSn1_VWA4_VWB2_WSGRA0_WSGRB0_WS64_WG32_8_1_WGM0_WGMXCC8_WGMXCCGn1
    SolutionIndex: 162
    SolutionNameMin: Cijk_Alik_Bljk_BBS_BH_Bias_HAS_SAV_UserArgs_MT128x64x64_MI16x16x1_SN_LDSB0_AFC0_AFEM1_AFEM1_ASEM1_CLR0_CADS0_DTLA1_DTLB1_DTVA0_DTVB0_EPS0_FDSI0_GRPM1_GRVWA8_GRVWB2_GSU0_GSUAMB_GSUC0_GSUWGMRR0_GLS0_ISA950_IU1_K1_LBSPPA1024_LBSPPB256_LBSPPM0_LPA16_LPB16_LPM0_LRVW8_LWPMn1_MIAV1_MIWT4_2_MO40_NTn1_NTA2_NTB1_NTC7_NTD1_NTM0_NEPBS12_NLCA1_NLCB1_ONLL1_PGR2_PLR1_PKA1_SIA3_SS1_SU0_SUM0_SUS128_SPO0_SRVW0_SSO0_SVW4_SK3_SKXCCM8_TLDS1_ULSGRO0_USL1_UIOFGRO0_USFGROn1_VSn1_VWA4_VWB2_WSGRA0_WSGRB0_WS64_WG32_8_1_WGM0_WGMXCC8_WGMXCCGn1
    SolutionIndex: 163
    SolutionNameMin: Cijk_Alik_Bljk_BBS_BH_Bias_HAS_SAV_UserArgs_MT128x160x64_MI16x16x1_SN_LDSB0_AFC0_AFEM1_AFEM1_ASEM1_CLR0_CADS0_DTLA0_DTLB0_DTVA0_DTVB0_EPS0_FDSI0_GRPM1_GRVWA8_GRVWB8_GSU0_GSUAMB_GSUC0_GSUWGMRR0_GLS0_ISA950_IU1_K1_LBSPPA512_LBSPPB128_LBSPPM0_LPA16_LPB16_LPM0_LRVW8_LWPMn1_MIAV0_MIWT4_5_MO40_NTn1_NTA2_NTB3_NTC6_NTD6_NTM0_NEPBS10_NLCA1_NLCB1_ONLL1_PGR2_PLR1_PKA1_SIA3_SS1_SU16_SUM0_SUS128_SPO0_SRVW0_SSO0_SVW4_SK3_SKXCCM0_TLDS2_ULSGRO0_USL1_UIOFGRO0_USFGRO1_VSn1_VWA4_VWB1_WSGRA0_WSGRB0_WS64_WG32_8_1_WGM0_WGMXCC8_WGMXCCGn1
    SolutionIndex: 164
    SolutionNameMin: Cijk_Alik_Bljk_BBS_BH_Bias_HAS_SAV_UserArgs_MT16x16x256_MI16x16x1_SN_LDSB0_AFC0_AFEM1_AFEM1_ASEM1_CLR1_CADS0_DTLA1_DTLB1_DTVA0_DTVB0_EPS0_FDSI0_GRPM1_GRVWA8_GRVWB8_GSU0_GSUAMB_GSUC0_GSUWGMRR0_GLS0_ISA950_IU1_K1_LBSPPA1024_LBSPPB1024_LBSPPM0_LPA16_LPB16_LPM0_LRVW8_LWPMn1_MIAV0_MIWT1_1_MO40_NTn1_NTA7_NTB1_NTC3_NTD0_NTM0_NEPBS14_NLCA1_NLCB1_ONLL1_PGR2_PLR1_PKA1_SIA3_SS1_SU0_SUM0_SUS512_SPO1_SRVW0_SSO0_SVW1_SK3_SKXCCM0_TLDS2_ULSGRO0_USL1_UIOFGRO0_USFGRO1_VSn1_VWA1_VWB1_WSGRA0_WSGRB0_WS64_WG16_4_2_WGM0_WGMXCC8_WGMXCCGn1
    SolutionIndex: 165
    SolutionNameMin: Cijk_Alik_Bljk_BBS_BH_Bias_HAS_SAV_UserArgs_MT32x48x256_MI16x16x1_SN_LDSB0_AFC0_AFEM1_AFEM1_ASEM1_CLR1_CADS0_DTLA1_DTLB1_DTVA0_DTVB0_EPS0_FDSI0_GRPM1_GRVWA8_GRVWB8_GSU0_GSUAMB_GSUC0_GSUWGMRR0_GLS0_ISA950_IU1_K1_LBSPPA1024_LBSPPB1024_LBSPPM0_LPA16_LPB16_LPM0_LRVW8_LWPMn1_MIAV1_MIWT2_3_MO40_NTn1_NTA7_NTB1_NTC3_NTD2_NTM0_NEPBS8_NLCA1_NLCB1_ONLL1_PGR2_PLR1_PKA1_SIA3_SS1_SU8_SUM0_SUS512_SPO0_SRVW0_SSO0_SVW2_SK3_SKXCCM0_TLDS1_ULSGRO0_USL1_UIOFGRO0_USFGRO0_VSn1_VWA2_VWB1_WSGRA0_WSGRB0_WS64_WG16_4_2_WGM0_WGMXCC4_WGMXCCGn1
    SolutionIndex: 166
    SolutionNameMin: Cijk_Alik_Bljk_BBS_BH_Bias_HAS_SAV_UserArgs_MT64x80x128_MI16x16x1_SN_LDSB0_AFC0_AFEM1_AFEM1_ASEM1_CLR0_CADS0_DTLA0_DTLB0_DTVA0_DTVB0_EPS0_FDSI0_GRPM1_GRVWA8_GRVWB8_GSU0_GSUAMB_GSUC0_GSUWGMRR0_GLS0_ISA950_IU1_K1_LBSPPA256_LBSPPB256_LBSPPM0_LPA16_LPB16_LPM0_LRVW8_LWPMn1_MIAV1_MIWT1_5_MO40_NTn1_NTA4_NTB0_NTC0_NTD0_NTM0_NEPBS0_NLCA1_NLCB1_ONLL1_PGR2_PLR1_PKA1_SIA3_SS1_SU0_SUM0_SUS256_SPO0_SRVW0_SSO0_SVW1_SK3_SKXCCM4_TLDS2_ULSGRO0_USL1_UIOFGRO0_USFGRO0_VSn1_VWA1_VWB1_WSGRA0_WSGRB0_WS64_WG64_4_1_WGM1_WGMXCC4_WGMXCCGn1
    SolutionIndex: 167
    SolutionNameMin: Cijk_Alik_Bljk_BBS_BH_Bias_HAS_SAV_UserArgs_MT32x64x256_MI16x16x1_SN_LDSB0_AFC0_AFEM1_AFEM1_ASEM1_CLR1_CADS0_DTLA1_DTLB1_DTVA0_DTVB0_EPS0_FDSI0_GRPM1_GRVWA8_GRVWB8_GSU0_GSUAMB_GSUC0_GSUWGMRR0_GLS0_ISA950_IU1_K1_LBSPPA1024_LBSPPB1024_LBSPPM0_LPA16_LPB16_LPM0_LRVW8_LWPMn1_MIAV0_MIWT2_1_MO40_NTn1_NTA6_NTB3_NTC3_NTD7_NTM0_NEPBS10_NLCA1_NLCB1_ONLL1_PGR2_PLR1_PKA1_SIA3_SS1_SU0_SUM0_SUS512_SPO0_SRVW0_SSO0_SVW2_SK3_SKXCCM4_TLDS1_ULSGRO0_USL1_UIOFGRO0_USFGROn1_VSn1_VWA2_VWB1_WSGRA0_WSGRB0_WS64_WG16_16_1_WGM0_WGMXCC4_WGMXCCGn1
    SolutionIndex: 168
    SolutionNameMin: Cijk_Alik_Bljk_BBS_BH_Bias_HAS_SAV_UserArgs_MT64x32x256_MI16x16x1_SN_LDSB0_AFC0_AFEM1_AFEM1_ASEM1_CLR1_CADS0_DTLA0_DTLB0_DTVA0_DTVB0_EPS0_FDSI0_GRPM1_GRVWA8_GRVWB8_GSU0_GSUAMB_GSUC0_GSUWGMRR0_GLS0_ISA950_IU1_K1_LBSPPA1024_LBSPPB512_LBSPPM0_LPA16_LPB16_LPM0_LRVW8_LWPMn1_MIAV0_MIWT2_1_MO40_NTn1_NTA3_NTB1_NTC2_NTD7_NTM0_NEPBS0_NLCA1_NLCB1_ONLL1_PGR2_PLR1_PKA1_SIA3_SS1_SU8_SUM0_SUS512_SPO1_SRVW0_SSO0_SVW2_SK3_SKXCCM0_TLDS1_ULSGRO0_USL1_UIOFGRO0_USFGRO0_VSn1_VWA2_VWB1_WSGRA0_WSGRB0_WS64_WG32_8_1_WGM8_WGMXCC8_WGMXCCGn1
    SolutionIndex: 169
    SolutionNameMin: Cijk_Alik_Bljk_BBS_BH_Bias_HAS_SAV_UserArgs_MT64x48x256_MI16x16x1_SN_LDSB0_AFC0_AFEM1_AFEM1_ASEM1_CLR1_CADS0_DTLA0_DTLB0_DTVA0_DTVB0_EPS0_FDSI0_GRPM1_GRVWA8_GRVWB8_GSU0_GSUAMB_GSUC0_GSUWGMRR0_GLS0_ISA950_IU1_K1_LBSPPA512_LBSPPB512_LBSPPM0_LPA16_LPB16_LPM0_LRVW8_LWPMn1_MIAV0_MIWT1_3_MO40_NTn1_NTA3_NTB1_NTC1_NTD5_NTM0_NEPBS16_NLCA1_NLCB1_ONLL1_PGR2_PLR1_PKA1_SIA3_SS1_SU8_SUM0_SUS512_SPO0_SRVW0_SSO0_SVW1_SK3_SKXCCM4_TLDS2_ULSGRO0_USL1_UIOFGRO0_USFGRO0_VSn1_VWA1_VWB1_WSGRA0_WSGRB0_WS64_WG64_4_1_WGM0_WGMXCC16_WGMXCCGn1
    SolutionIndex: 170
    SolutionNameMin: Cijk_Alik_Bljk_BBS_BH_Bias_HAS_SAV_UserArgs_MT64x64x128_MI16x16x1_SN_LDSB0_AFC0_AFEM1_AFEM1_ASEM1_CLR1_CADS0_DTLA1_DTLB1_DTVA0_DTVB0_EPS0_FDSI0_GRPM1_GRVWA8_GRVWB8_GSU0_GSUAMB_GSUC0_GSUWGMRR0_GLS0_ISA950_IU1_K1_LBSPPA1024_LBSPPB1024_LBSPPM0_LPA16_LPB16_LPM0_LRVW8_LWPMn1_MIAV1_MIWT2_2_MO40_NTn1_NTA2_NTB1_NTC6_NTD6_NTM0_NEPBS14_NLCA1_NLCB1_ONLL1_PGR2_PLR1_PKA1_SIA3_SS1_SU0_SUM0_SUS256_SPO0_SRVW0_SSO0_SVW2_SK3_SKXCCM4_TLDS1_ULSGRO0_USL1_UIOFGRO0_USFGRO1_VSn1_VWA2_VWB2_WSGRA0_WSGRB0_WS64_WG32_8_1_WGM0_WGMXCC4_WGMXCCGn1
    SolutionIndex: 171
    SolutionNameMin: Cijk_Alik_Bljk_BBS_BH_Bias_HAS_SAV_UserArgs_MT48x64x256_MI16x16x1_SN_LDSB0_AFC0_AFEM1_AFEM1_ASEM1_CLR0_CADS0_DTLA0_DTLB0_DTVA0_DTVB0_EPS0_FDSI0_GRPM1_GRVWA8_GRVWB8_GSU0_GSUAMB_GSUC0_GSUWGMRR0_GLS0_ISA950_IU1_K1_LBSPPA512_LBSPPB512_LBSPPM0_LPA16_LPB16_LPM0_LRVW8_LWPMn1_MIAV0_MIWT3_1_MO40_NTn1_NTA7_NTB1_NTC0_NTD1_NTM0_NEPBS14_NLCA1_NLCB1_ONLL1_PGR2_PLR1_PKA1_SIA3_SS1_SU0_SUM0_SUS512_SPO1_SRVW0_SSO1_SVW1_SK3_SKXCCM4_TLDS1_ULSGRO0_USL1_UIOFGRO0_USFGRO0_VSn1_VWA1_VWB1_WSGRA0_WSGRB0_WS64_WG16_16_1_WGM1_WGMXCC8_WGMXCCGn1
    SolutionIndex: 172
    SolutionNameMin: Cijk_Alik_Bljk_BBS_BH_Bias_HAS_SAV_UserArgs_MT64x64x256_MI16x16x1_SN_LDSB0_AFC0_AFEM1_AFEM1_ASEM1_CLR0_CADS0_DTLA0_DTLB0_DTVA0_DTVB0_EPS0_FDSI0_GRPM1_GRVWA8_GRVWB8_GSU0_GSUAMB_GSUC0_GSUWGMRR0_GLS0_ISA950_IU1_K1_LBSPPA512_LBSPPB2048_LBSPPM0_LPA16_LPB16_LPM0_LRVW8_LWPMn1_MIAV1_MIWT1_4_MO40_NTn1_NTA3_NTB2_NTC5_NTD1_NTM0_NEPBS0_NLCA1_NLCB1_ONLL1_PGR2_PLR1_PKA1_SIA3_SS1_SU16_SUM0_SUS512_SPO1_SRVW0_SSO0_SVW1_SK3_SKXCCM8_TLDS2_ULSGRO0_USL1_UIOFGRO0_USFGRO0_VSn1_VWA1_VWB4_WSGRA0_WSGRB0_WS64_WG64_4_1_WGM24_WGMXCC2_WGMXCCGn1
    SolutionIndex: 173
    SolutionNameMin: Cijk_Alik_Bljk_BBS_BH_Bias_HAS_SAV_UserArgs_MT96x96x128_MI16x16x1_SN_LDSB0_AFC0_AFEM1_AFEM1_ASEM1_CLR0_CADS0_DTLA0_DTLB0_DTVA0_DTVB0_EPS0_FDSI0_GRPM1_GRVWA8_GRVWB8_GSU0_GSUAMB_GSUC0_GSUWGMRR0_GLS0_ISA950_IU1_K1_LBSPPA256_LBSPPB256_LBSPPM0_LPA16_LPB16_LPM0_LRVW8_LWPMn1_MIAV1_MIWT3_3_MO40_NTn1_NTA0_NTB1_NTC0_NTD0_NTM0_NEPBS0_NLCA1_NLCB1_ONLL1_PGR2_PLR1_PKA1_SIA3_SS1_SU16_SUM0_SUS256_SPO0_SRVW0_SSO0_SVW1_SK3_SKXCCM0_TLDS1_ULSGRO0_USL1_UIOFGRO0_USFGRO0_VSn1_VWA1_VWB1_WSGRA0_WSGRB0_WS64_WG32_8_1_WGM24_WGMXCC4_WGMXCCGn1
    SolutionIndex: 174
    SolutionNameMin: Cijk_Alik_Bljk_BBS_BH_Bias_HAS_SAV_UserArgs_MT96x128x128_MI16x16x1_SN_LDSB0_AFC0_AFEM1_AFEM1_ASEM1_CLR1_CADS0_DTLA0_DTLB0_DTVA0_DTVB0_EPS0_FDSI0_GRPM1_GRVWA8_GRVWB8_GSU0_GSUAMB_GSUC0_GSUWGMRR0_GLS0_ISA950_IU1_K1_LBSPPA512_LBSPPB512_LBSPPM0_LPA16_LPB16_LPM0_LRVW8_LWPMn1_MIAV0_MIWT6_2_MO40_NTn1_NTA0_NTB0_NTC0_NTD3_NTM0_NEPBS0_NLCA1_NLCB1_ONLL1_PGR2_PLR1_PKA1_SIA3_SS1_SU8_SUM0_SUS256_SPO0_SRVW0_SSO0_SVW2_SK3_SKXCCM4_TLDS2_ULSGRO0_USL1_UIOFGRO0_USFGRO0_VSn1_VWA2_VWB2_WSGRA0_WSGRB0_WS64_WG16_16_1_WGM48_WGMXCC1_WGMXCCGn1
    SolutionIndex: 175
    SolutionNameMin: Cijk_Alik_Bljk_BBS_BH_Bias_HAS_SAV_UserArgs_MT96x128x128_MI16x16x1_SN_LDSB0_AFC0_AFEM1_AFEM1_ASEM1_CLR0_CADS0_DTLA0_DTLB0_DTVA0_DTVB0_EPS0_FDSI0_GRPM1_GRVWA8_GRVWB8_GSU0_GSUAMB_GSUC0_GSUWGMRR0_GLS0_ISA950_IU1_K1_LBSPPA512_LBSPPB512_LBSPPM0_LPA16_LPB16_LPM0_LRVW8_LWPMn1_MIAV1_MIWT6_2_MO40_NTn1_NTA5_NTB0_NTC7_NTD1_NTM0_NEPBS0_NLCA1_NLCB1_ONLL1_PGR2_PLR1_PKA1_SIA3_SS1_SU0_SUM0_SUS256_SPO0_SRVW0_SSO0_SVW2_SK3_SKXCCM8_TLDS1_ULSGRO0_USL1_UIOFGRO0_USFGRO0_VSn1_VWA2_VWB2_WSGRA0_WSGRB0_WS64_WG16_16_1_WGM1_WGMXCC4_WGMXCCGn1
    SolutionIndex: 176
    SolutionNameMin: Cijk_Alik_Bljk_BBS_BH_Bias_HAS_SAV_UserArgs_MT64x128x128_MI16x16x1_SN_LDSB0_AFC0_AFEM1_AFEM1_ASEM1_CLR0_CADS0_DTLA1_DTLB1_DTVA0_DTVB0_EPS0_FDSI0_GRPM1_GRVWA8_GRVWB8_GSU0_GSUAMB_GSUC0_GSUWGMRR0_GLS0_ISA950_IU1_K1_LBSPPA1024_LBSPPB1024_LBSPPM0_LPA16_LPB16_LPM0_LRVW8_LWPMn1_MIAV0_MIWT4_2_MO40_NTn1_NTA1_NTB0_NTC6_NTD5_NTM0_NEPBS12_NLCA1_NLCB1_ONLL1_PGR2_PLR1_PKA1_SIA3_SS1_SU0_SUM0_SUS256_SPO1_SRVW0_SSO0_SVW4_SK3_SKXCCM8_TLDS2_ULSGRO0_USL1_UIOFGRO0_USFGRO1_VSn1_VWA4_VWB2_WSGRA0_WSGRB0_WS64_WG16_16_1_WGM16_WGMXCC1_WGMXCCGn1
    SolutionIndex: 177
    SolutionNameMin: Cijk_Alik_Bljk_BBS_BH_Bias_HAS_SAV_UserArgs_MT128x64x128_MI16x16x1_SN_LDSB0_AFC0_AFEM1_AFEM1_ASEM1_CLR1_CADS0_DTLA0_DTLB0_DTVA0_DTVB0_EPS0_FDSI0_GRPM1_GRVWA8_GRVWB8_GSU0_GSUAMB_GSUC0_GSUWGMRR0_GLS0_ISA950_IU1_K1_LBSPPA1024_LBSPPB512_LBSPPM0_LPA16_LPB16_LPM0_LRVW8_LWPMn1_MIAV0_MIWT4_2_MO40_NTn1_NTA1_NTB2_NTC1_NTD4_NTM0_NEPBS0_NLCA1_NLCB1_ONLL1_PGR2_PLR1_PKA1_SIA3_SS1_SU16_SUM0_SUS512_SPO0_SRVW0_SSO1_SVW4_SK3_SKXCCM4_TLDS1_ULSGRO0_USL1_UIOFGRO0_USFGRO0_VSn1_VWA4_VWB2_WSGRA0_WSGRB0_WS64_WG32_8_1_WGM16_WGMXCC4_WGMXCCGn1
    SolutionIndex: 178
    SolutionNameMin: Cijk_Alik_Bljk_BBS_BH_Bias_HAS_SAV_UserArgs_MT64x64x64_MI16x16x1_SN_LDSB0_AFC0_AFEM1_AFEM1_ASEM1_CLR0_CADS0_DTLA1_DTLB1_DTVA0_DTVB0_EPS0_FDSI0_GRPM1_GRVWA8_GRVWB8_GSU0_GSUAMB_GSUC0_GSUWGMRR0_GLS0_ISA950_IU1_K1_LBSPPA1024_LBSPPB1024_LBSPPM0_LPA16_LPB16_LPM0_LRVW8_LWPMn1_MIAV0_MIWT4_1_MO40_NTn1_NTA1_NTB2_NTC2_NTD4_NTM0_NEPBS8_NLCA1_NLCB1_ONLL1_PGR2_PLR1_PKA1_SIA3_SS1_SU8_SUM0_SUS128_SPO1_SRVW0_SSO1_SVW4_SK3_SKXCCM8_TLDS1_ULSGRO0_USL1_UIOFGRO0_USFGROn1_VSn1_VWA4_VWB1_WSGRA0_WSGRB0_WS64_WG16_16_1_WGM4_WGMXCC1_WGMXCCGn1
    SolutionIndex: 179
    SolutionNameMin: Cijk_Alik_Bljk_BBS_BH_Bias_HAS_SAV_UserArgs_MT96x96x128_MI16x16x1_SN_LDSB0_AFC0_AFEM1_AFEM1_ASEM1_CLR1_CADS0_DTLA0_DTLB0_DTVA0_DTVB0_EPS0_FDSI0_GRPM1_GRVWA8_GRVWB8_GSU0_GSUAMB_GSUC0_GSUWGMRR0_GLS0_ISA950_IU1_K1_LBSPPA256_LBSPPB256_LBSPPM0_LPA16_LPB16_LPM0_LRVW8_LWPMn1_MIAV0_MIWT3_3_MO40_NTn1_NTA0_NTB3_NTC0_NTD5_NTM0_NEPBS0_NLCA1_NLCB1_ONLL1_PGR2_PLR1_PKA1_SIA3_SS1_SU0_SUM0_SUS256_SPO0_SRVW0_SSO1_SVW1_SK3_SKXCCM4_TLDS1_ULSGRO0_USL1_UIOFGRO0_USFGRO0_VSn1_VWA1_VWB1_WSGRA0_WSGRB0_WS64_WG32_8_1_WGM48_WGMXCC1_WGMXCCGn1
    SolutionIndex: 180
    SolutionNameMin: Cijk_Alik_Bljk_BBS_BH_Bias_HAS_SAV_UserArgs_MT64x160x128_MI16x16x1_SN_LDSB0_AFC0_AFEM1_AFEM1_ASEM1_CLR0_CADS0_DTLA0_DTLB0_DTVA0_DTVB0_EPS0_FDSI0_GRPM1_GRVWA8_GRVWB8_GSU0_GSUAMB_GSUC0_GSUWGMRR0_GLS0_ISA950_IU1_K1_LBSPPA512_LBSPPB256_LBSPPM0_LPA16_LPB16_LPM0_LRVW8_LWPMn1_MIAV0_MIWT2_5_MO40_NTn1_NTA1_NTB0_NTC0_NTD4_NTM0_NEPBS0_NLCA1_NLCB1_ONLL1_PGR2_PLR1_PKA1_SIA3_SS1_SU0_SUM0_SUS256_SPO0_SRVW0_SSO1_SVW2_SK3_SKXCCM0_TLDS1_ULSGRO0_USL1_UIOFGRO0_USFGRO1_VSn1_VWA2_VWB1_WSGRA0_WSGRB0_WS64_WG32_8_1_WGM4_WGMXCC8_WGMXCCGn1
    SolutionIndex: 181
    SolutionNameMin: Cijk_Alik_Bljk_BBS_BH_Bias_HAS_SAV_UserArgs_MT64x192x128_MI16x16x1_SN_LDSB0_AFC0_AFEM1_AFEM1_ASEM1_CLR0_CADS0_DTLA0_DTLB0_DTVA0_DTVB0_EPS0_FDSI0_GRPM1_GRVWA8_GRVWB8_GSU0_GSUAMB_GSUC0_GSUWGMRR0_GLS0_ISA950_IU1_K1_LBSPPA1024_LBSPPB256_LBSPPM0_LPA16_LPB16_LPM0_LRVW8_LWPMn1_MIAV1_MIWT4_3_MO40_NTn1_NTA2_NTB0_NTC5_NTD7_NTM0_NEPBS12_NLCA1_NLCB1_ONLL1_PGR2_PLR1_PKA1_SIA3_SS1_SU8_SUM0_SUS256_SPO0_SRVW0_SSO0_SVW4_SK3_SKXCCM5_TLDS1_ULSGRO0_USL1_UIOFGRO0_USFGROn1_VSn1_VWA4_VWB1_WSGRA0_WSGRB0_WS64_WG16_16_1_WGM1_WGMXCC8_WGMXCCGn1
    SolutionIndex: 182
    SolutionNameMin: Cijk_Alik_Bljk_BBS_BH_Bias_HAS_SAV_UserArgs_MT96x128x128_MI16x16x1_SN_LDSB0_AFC0_AFEM1_AFEM1_ASEM1_CLR1_CADS0_DTLA0_DTLB0_DTVA0_DTVB0_EPS0_FDSI0_GRPM1_GRVWA8_GRVWB8_GSU0_GSUAMB_GSUC0_GSUWGMRR0_GLS0_ISA950_IU1_K1_LBSPPA512_LBSPPB512_LBSPPM0_LPA16_LPB16_LPM0_LRVW8_LWPMn1_MIAV0_MIWT6_2_MO40_NTn1_NTA3_NTB0_NTC0_NTD4_NTM0_NEPBS0_NLCA1_NLCB1_ONLL1_PGR2_PLR1_PKA1_SIA3_SS1_SU8_SUM0_SUS256_SPO0_SRVW0_SSO1_SVW2_SK3_SKXCCM4_TLDS1_ULSGRO0_USL1_UIOFGRO0_USFGROn1_VSn1_VWA2_VWB2_WSGRA0_WSGRB0_WS64_WG16_16_1_WGM1_WGMXCC4_WGMXCCGn1
    SolutionIndex: 183
    SolutionNameMin: Cijk_Alik_Bljk_BBS_BH_Bias_HAS_SAV_UserArgs_MT96x128x128_MI16x16x1_SN_LDSB0_AFC0_AFEM1_AFEM1_ASEM1_CLR1_CADS0_DTLA0_DTLB0_DTVA0_DTVB0_EPS0_FDSI0_GRPM1_GRVWA8_GRVWB8_GSU0_GSUAMB_GSUC0_GSUWGMRR0_GLS0_ISA950_IU1_K1_LBSPPA512_LBSPPB512_LBSPPM0_LPA16_LPB16_LPM0_LRVW8_LWPMn1_MIAV1_MIWT6_2_MO40_NTn1_NTA3_NTB2_NTC1_NTD4_NTM0_NEPBS0_NLCA1_NLCB1_ONLL1_PGR2_PLR1_PKA1_SIA3_SS1_SU8_SUM0_SUS256_SPO0_SRVW0_SSO0_SVW2_SK3_SKXCCM0_TLDS2_ULSGRO0_USL1_UIOFGRO0_USFGROn1_VSn1_VWA2_VWB2_WSGRA0_WSGRB0_WS64_WG16_16_1_WGM0_WGMXCC16_WGMXCCGn1
    SolutionIndex: 184
    SolutionNameMin: Cijk_Alik_Bljk_BBS_BH_Bias_HAS_SAV_UserArgs_MT192x128x64_MI16x16x1_SN_LDSB0_AFC0_AFEM1_AFEM1_ASEM1_CLR0_CADS0_DTLA0_DTLB0_DTVA0_DTVB0_EPS0_FDSI0_GRPM1_GRVWA8_GRVWB8_GSU0_GSUAMB_GSUC0_GSUWGMRR0_GLS0_ISA950_IU1_K1_LBSPPA512_LBSPPB256_LBSPPM0_LPA16_LPB16_LPM0_LRVW8_LWPMn1_MIAV0_MIWT12_2_MO40_NTn1_NTA3_NTB1_NTC5_NTD5_NTM0_NEPBS0_NLCA1_NLCB1_ONLL1_PGR2_PLR1_PKA1_SIA3_SS1_SU0_SUM0_SUS128_SPO0_SRVW0_SSO0_SVW4_SK3_SKXCCM0_TLDS2_ULSGRO0_USL1_UIOFGRO0_USFGRO1_VSn1_VWA4_VWB2_WSGRA0_WSGRB0_WS64_WG16_16_1_WGM16_WGMXCC4_WGMXCCGn1
    SolutionIndex: 185
    SolutionNameMin: Cijk_Alik_Bljk_BBS_BH_Bias_HAS_SAV_UserArgs_MT192x288x64_MI16x16x1_SN_LDSB1_AFC0_AFEM1_AFEM1_ASEM1_CLR0_CADS0_DTLA0_DTLB0_DTVA0_DTVB0_EPS0_FDSI0_GRPM1_GRVWA8_GRVWB8_GSU0_GSUAMB_GSUC0_GSUWGMRR0_GLS0_ISA950_IU1_K1_LBSPPA256_LBSPPB128_LBSPPM0_LPA16_LPB16_LPM0_LRVW8_LWPMn1_MIAV0_MIWT6_9_MO40_NTn1_NTA1_NTB1_NTC0_NTD0_NTM0_NEPBS0_NLCA1_NLCB1_ONLL1_PGR2_PLR1_PKA1_SIA3_SS1_SU16_SUM0_SUS128_SPO0_SRVW0_SSO1_SVW2_SK3_SKXCCM4_TLDS1_ULSGRO0_USL1_UIOFGRO0_USFGRO0_VSn1_VWA2_VWB1_WSGRA0_WSGRB0_WS64_WG32_8_1_WGM0_WGMXCC1_WGMXCCGn1
    SolutionIndex: 186
    SolutionNameMin: Cijk_Alik_Bljk_BBS_BH_Bias_HAS_SAV_UserArgs_MT192x256x64_MI16x16x1_SN_LDSB0_AFC0_AFEM1_AFEM1_ASEM1_CLR0_CADS0_DTLA0_DTLB0_DTVA0_DTVB0_EPS0_FDSI0_GRPM1_GRVWA8_GRVWB8_GSU0_GSUAMB_GSUC0_GSUWGMRR0_GLS0_ISA950_IU1_K1_LBSPPA256_LBSPPB1024_LBSPPM0_LPA16_LPB16_LPM0_LRVW8_LWPMn1_MIAV0_MIWT6_8_MO40_NTn1_NTA3_NTB3_NTC0_NTD4_NTM0_NEPBS0_NLCA1_NLCB1_ONLL1_PGR2_PLR1_PKA1_SIA3_SS1_SU8_SUM0_SUS128_SPO0_SRVW0_SSO1_SVW2_SK3_SKXCCM0_TLDS1_ULSGRO0_USL1_UIOFGRO0_USFGROn1_VSn1_VWA2_VWB8_WSGRA0_WSGRB0_WS64_WG32_8_1_WGM16_WGMXCC2_WGMXCCGn1
    SolutionIndex: 187
    SolutionNameMin: Cijk_Alik_Bljk_BBS_BH_Bias_HAS_SAV_UserArgs_MT64x16x64_MI16x16x1_SN_LDSB0_AFC0_AFEM1_AFEM1_ASEM1_CLR1_CADS0_DTLA1_DTLB1_DTVA0_DTVB0_EPS0_FDSI0_GRPM1_GRVWA8_GRVWB2_GSU0_GSUAMB_GSUC0_GSUWGMRR0_GLS0_ISA950_IU1_K1_LBSPPA1024_LBSPPB256_LBSPPM0_LPA16_LPB16_LPM0_LRVW8_LWPMn1_MIAV0_MIWT2_1_MO40_NTn1_NTA5_NTB0_NTC1_NTD2_NTM0_NEPBS12_NLCA1_NLCB1_ONLL1_PGR2_PLR1_PKA1_SIA3_SS1_SU8_SUM0_SUS128_SPO0_SRVW0_SSO0_SVW2_SK3_SKXCCM8_TLDS2_ULSGRO0_USL1_UIOFGRO0_USFGROn1_VSn1_VWA2_VWB1_WSGRA0_WSGRB0_WS64_WG32_4_1_WGM1_WGMXCC4_WGMXCCGn1
    SolutionIndex: 188
    SolutionNameMin: Cijk_Alik_Bljk_BBS_BH_Bias_HAS_SAV_UserArgs_MT64x80x64_MI16x16x1_SN_LDSB0_AFC0_AFEM1_AFEM1_ASEM1_CLR0_CADS0_DTLA1_DTLB1_DTVA0_DTVB0_EPS0_FDSI0_GRPM1_GRVWA8_GRVWB2_GSU0_GSUAMB_GSUC0_GSUWGMRR0_GLS0_ISA950_IU1_K1_LBSPPA1024_LBSPPB256_LBSPPM0_LPA16_LPB16_LPM0_LRVW8_LWPMn1_MIAV1_MIWT1_5_MO40_NTn1_NTA4_NTB0_NTC0_NTD0_NTM0_NEPBS0_NLCA1_NLCB1_ONLL1_PGR2_PLR1_PKA1_SIA3_SS1_SU8_SUM0_SUS128_SPO0_SRVW0_SSO0_SVW1_SK3_SKXCCM4_TLDS1_ULSGRO0_USL1_UIOFGRO0_USFGRO1_VSn1_VWA1_VWB1_WSGRA0_WSGRB0_WS64_WG64_4_1_WGM1_WGMXCC16_WGMXCCGn1
    SolutionIndex: 189
    SolutionNameMin: Cijk_Alik_Bljk_BBS_BH_Bias_HAS_SAV_UserArgs_MT64x192x64_MI16x16x1_SN_LDSB0_AFC0_AFEM1_AFEM1_ASEM1_CLR0_CADS0_DTLA1_DTLB1_DTVA0_DTVB0_EPS0_FDSI0_GRPM1_GRVWA2_GRVWB8_GSU0_GSUAMB_GSUC0_GSUWGMRR0_GLS0_ISA950_IU1_K1_LBSPPA512_LBSPPB1024_LBSPPM0_LPA16_LPB16_LPM0_LRVW8_LWPMn1_MIAV1_MIWT4_3_MO40_NTn1_NTA6_NTB1_NTC2_NTD3_NTM0_NEPBS0_NLCA1_NLCB1_ONLL1_PGR2_PLR1_PKA1_SIA3_SS1_SU8_SUM0_SUS128_SPO0_SRVW0_SSO0_SVW4_SK3_SKXCCM4_TLDS1_ULSGRO0_USL1_UIOFGRO0_USFGRO0_VSn1_VWA4_VWB1_WSGRA0_WSGRB0_WS64_WG16_16_1_WGM1_WGMXCC8_WGMXCCGn1
    SolutionIndex: 190
    SolutionNameMin: Cijk_Alik_Bljk_BBS_BH_Bias_HAS_SAV_UserArgs_MT128x128x64_MI16x16x1_SN_LDSB0_AFC0_AFEM1_AFEM1_ASEM1_CLR1_CADS0_DTLA1_DTLB1_DTVA0_DTVB0_EPS0_FDSI0_GRPM1_GRVWA8_GRVWB8_GSU0_GSUAMB_GSUC0_GSUWGMRR0_GLS0_ISA950_IU1_K1_LBSPPA1024_LBSPPB1024_LBSPPM0_LPA16_LPB16_LPM0_LRVW8_LWPMn1_MIAV1_MIWT4_4_MO40_NTn1_NTA5_NTB2_NTC0_NTD3_NTM0_NEPBS0_NLCA1_NLCB1_ONLL1_PGR2_PLR1_PKA1_SIA3_SS1_SU0_SUM0_SUS128_SPO0_SRVW0_SSO0_SVW4_SK3_SKXCCM5_TLDS1_ULSGRO0_USL1_UIOFGRO0_USFGRO1_VSn1_VWA4_VWB4_WSGRA0_WSGRB0_WS64_WG32_8_1_WGM1_WGMXCC16_WGMXCCGn1
    SolutionIndex: 191
    SolutionNameMin: Cijk_Alik_Bljk_BBS_BH_Bias_HAS_SAV_UserArgs_MT128x160x64_MI16x16x1_SN_LDSB0_AFC0_AFEM1_AFEM1_ASEM1_CLR0_CADS0_DTLA1_DTLB1_DTVA0_DTVB0_EPS0_FDSI0_GRPM1_GRVWA8_GRVWB8_GSU0_GSUAMB_GSUC0_GSUWGMRR0_GLS0_ISA950_IU1_K1_LBSPPA1024_LBSPPB1024_LBSPPM0_LPA16_LPB16_LPM0_LRVW8_LWPMn1_MIAV0_MIWT4_5_MO40_NTn1_NTA4_NTB0_NTC1_NTD3_NTM0_NEPBS0_NLCA1_NLCB1_ONLL1_PGR2_PLR1_PKA1_SIA3_SS1_SU0_SUM0_SUS128_SPO0_SRVW0_SSO0_SVW4_SK3_SKXCCM5_TLDS1_ULSGRO0_USL1_UIOFGRO0_USFGROn1_VSn1_VWA4_VWB1_WSGRA0_WSGRB0_WS64_WG32_8_1_WGM1_WGMXCC16_WGMXCCGn1
    SolutionIndex: 192
    SolutionNameMin: Cijk_Alik_Bljk_BBS_BH_Bias_HAS_SAV_UserArgs_MT128x80x64_MI16x16x1_SN_LDSB0_AFC0_AFEM1_AFEM1_ASEM1_CLR1_CADS0_DTLA1_DTLB1_DTVA0_DTVB0_EPS0_FDSI0_GRPM1_GRVWA2_GRVWB2_GSU0_GSUAMB_GSUC0_GSUWGMRR0_GLS0_ISA950_IU1_K1_LBSPPA256_LBSPPB256_LBSPPM0_LPA16_LPB16_LPM0_LRVW8_LWPMn1_MIAV0_MIWT2_5_MO40_NTn1_NTA5_NTB1_NTC1_NTD6_NTM0_NEPBS0_NLCA1_NLCB1_ONLL1_PGR2_PLR1_PKA1_SIA3_SS1_SU0_SUM0_SUS128_SPO0_SRVW0_SSO0_SVW2_SK3_SKXCCM0_TLDS2_ULSGRO0_USL1_UIOFGRO0_USFGRO0_VSn1_VWA2_VWB1_WSGRA0_WSGRB0_WS64_WG64_4_1_WGM0_WGMXCC1_WGMXCCGn1
    SolutionIndex: 193
    SolutionNameMin: Cijk_Alik_Bljk_BBS_BH_Bias_HAS_SAV_UserArgs_MT128x96x64_MI16x16x1_SN_LDSB0_AFC0_AFEM1_AFEM1_ASEM1_CLR1_CADS0_DTLA1_DTLB1_DTVA0_DTVB0_EPS0_FDSI0_GRPM1_GRVWA2_GRVWB8_GSU0_GSUAMB_GSUC0_GSUWGMRR0_GLS0_ISA950_IU1_K1_LBSPPA512_LBSPPB1024_LBSPPM0_LPA16_LPB16_LPM0_LRVW8_LWPMn1_MIAV0_MIWT4_3_MO40_NTn1_NTA7_NTB3_NTC2_NTD4_NTM0_NEPBS0_NLCA1_NLCB1_ONLL1_PGR2_PLR1_PKA1_SIA3_SS1_SU0_SUM0_SUS128_SPO0_SRVW0_SSO1_SVW4_SK3_SKXCCM0_TLDS1_ULSGRO0_USL1_UIOFGRO0_USFGRO0_VSn1_VWA4_VWB1_WSGRA0_WSGRB0_WS64_WG32_8_1_WGM6_WGMXCC8_WGMXCCGn1
    SolutionIndex: 194
    SolutionNameMin: Cijk_Alik_Bljk_BBS_BH_Bias_HAS_SAV_UserArgs_MT128x128x64_MI16x16x1_SN_LDSB0_AFC0_AFEM1_AFEM1_ASEM1_CLR1_CADS0_DTLA1_DTLB1_DTVA0_DTVB0_EPS0_FDSI0_GRPM1_GRVWA2_GRVWB8_GSU0_GSUAMB_GSUC0_GSUWGMRR0_GLS0_ISA950_IU1_K1_LBSPPA512_LBSPPB1024_LBSPPM0_LPA16_LPB16_LPM0_LRVW8_LWPMn1_MIAV0_MIWT4_4_MO40_NTn1_NTA7_NTB0_NTC3_NTD6_NTM0_NEPBS0_NLCA1_NLCB1_ONLL1_PGR2_PLR1_PKA1_SIA3_SS1_SU0_SUM0_SUS128_SPO0_SRVW0_SSO0_SVW4_SK3_SKXCCM0_TLDS1_ULSGRO0_USL1_UIOFGRO0_USFGRO0_VSn1_VWA4_VWB4_WSGRA0_WSGRB0_WS64_WG32_8_1_WGM48_WGMXCC8_WGMXCCGn1
    SolutionIndex: 195
    SolutionNameMin: Cijk_Alik_Bljk_BBS_BH_Bias_HAS_SAV_UserArgs_MT128x160x64_MI16x16x1_SN_LDSB0_AFC0_AFEM1_AFEM1_ASEM1_CLR0_CADS0_DTLA1_DTLB1_DTVA0_DTVB0_EPS0_FDSI0_GRPM1_GRVWA2_GRVWB8_GSU0_GSUAMB_GSUC0_GSUWGMRR0_GLS0_ISA950_IU1_K1_LBSPPA512_LBSPPB1024_LBSPPM0_LPA16_LPB16_LPM0_LRVW8_LWPMn1_MIAV0_MIWT4_5_MO40_NTn1_NTA7_NTB2_NTC2_NTD6_NTM0_NEPBS0_NLCA1_NLCB1_ONLL1_PGR2_PLR1_PKA1_SIA3_SS1_SU0_SUM0_SUS128_SPO1_SRVW0_SSO0_SVW4_SK3_SKXCCM8_TLDS2_ULSGRO0_USL1_UIOFGRO0_USFGRO0_VSn1_VWA4_VWB1_WSGRA0_WSGRB0_WS64_WG32_8_1_WGM6_WGMXCC1_WGMXCCGn1
    SolutionIndex: 196
    SolutionNameMin: Cijk_Alik_Bljk_BBS_BH_Bias_HAS_SAV_UserArgs_MT128x160x64_MI16x16x1_SN_LDSB0_AFC0_AFEM1_AFEM1_ASEM1_CLR0_CADS0_DTLA0_DTLB0_DTVA0_DTVB0_EPS0_FDSI0_GRPM1_GRVWA8_GRVWB8_GSU0_GSUAMB_GSUC0_GSUWGMRR0_GLS0_ISA950_IU1_K1_LBSPPA512_LBSPPB128_LBSPPM0_LPA16_LPB16_LPM0_LRVW8_LWPMn1_MIAV0_MIWT4_5_MO40_NTn1_NTA6_NTB3_NTC1_NTD7_NTM0_NEPBS0_NLCA1_NLCB1_ONLL1_PGR2_PLR1_PKA1_SIA3_SS1_SU0_SUM0_SUS128_SPO0_SRVW0_SSO1_SVW4_SK3_SKXCCM6_TLDS1_ULSGRO0_USL1_UIOFGRO0_USFGRO0_VSn1_VWA4_VWB1_WSGRA0_WSGRB0_WS64_WG32_8_1_WGM0_WGMXCC8_WGMXCCGn1
    SolutionIndex: 197
    SolutionNameMin: Cijk_Alik_Bljk_BBS_BH_Bias_HAS_SAV_UserArgs_MT256x192x64_MI16x16x1_SN_LDSB0_AFC0_AFEM1_AFEM1_ASEM1_CLR0_CADS0_DTLA0_DTLB0_DTVA0_DTVB0_EPS0_FDSI0_GRPM1_GRVWA8_GRVWB8_GSU0_GSUAMB_GSUC0_GSUWGMRR0_GLS0_ISA950_IU1_K1_LBSPPA1024_LBSPPB256_LBSPPM0_LPA16_LPB16_LPM0_LRVW8_LWPMn1_MIAV0_MIWT8_6_MO40_NTn1_NTA3_NTB2_NTC6_NTD6_NTM0_NEPBS0_NLCA1_NLCB1_ONLL1_PGR2_PLR1_PKA1_SIA3_SS1_SU8_SUM0_SUS128_SPO0_SRVW0_SSO0_SVW8_SK3_SKXCCM0_TLDS2_ULSGRO0_USL1_UIOFGRO0_USFGRO0_VSn1_VWA8_VWB2_WSGRA0_WSGRB0_WS64_WG32_8_1_WGM0_WGMXCC2_WGMXCCGn1
    SolutionIndex: 198
    SolutionNameMin: Cijk_Alik_Bljk_BBS_BH_Bias_HAS_SAV_UserArgs_MT256x224x64_MI16x16x1_SN_LDSB0_AFC0_AFEM1_AFEM1_ASEM1_CLR1_CADS0_DTLA1_DTLB1_DTVA0_DTVB0_EPS0_FDSI0_GRPM1_GRVWA8_GRVWB8_GSU0_GSUAMB_GSUC0_GSUWGMRR0_GLS0_ISA950_IU1_K1_LBSPPA1024_LBSPPB1024_LBSPPM0_LPA16_LPB16_LPM0_LRVW8_LWPMn1_MIAV0_MIWT8_7_MO40_NTn1_NTA2_NTB3_NTC6_NTD5_NTM0_NEPBS16_NLCA1_NLCB1_ONLL1_PGR2_PLR1_PKA1_SIA3_SS1_SU16_SUM0_SUS128_SPO0_SRVW0_SSO0_SVW8_SK3_SKXCCM4_TLDS1_ULSGRO0_USL1_UIOFGRO0_USFGRO0_VSn1_VWA8_VWB1_WSGRA0_WSGRB0_WS64_WG32_8_1_WGM48_WGMXCC8_WGMXCCGn1
    SolutionIndex: 199
    SolutionNameMin: Cijk_Alik_Bljk_BBS_BH_Bias_HAS_SAV_UserArgs_MT112x16x64_MI16x16x1_SN_LDSB0_AFC0_AFEM1_AFEM1_ASEM1_CLR1_CADS0_DTLA1_DTLB1_DTVA0_DTVB0_EPS0_FDSI0_GRPM1_GRVWA8_GRVWB8_GSU0_GSUAMB_GSUC0_GSUWGMRR0_GLS0_ISA950_IU1_K1_LBSPPA1024_LBSPPB1024_LBSPPM0_LPA16_LPB16_LPM0_LRVW8_LWPMn1_MIAV0_MIWT7_1_MO40_NTn1_NTA2_NTB3_NTC3_NTD4_NTM0_NEPBS12_NLCA1_NLCB1_ONLL1_PGR2_PLR1_PKA1_SIA3_SS0_SU0_SUM0_SUS128_SPO0_SRVW0_SSO1_SVW4_SK3_SKXCCM4_TLDS1_ULSGRO0_USL1_UIOFGRO0_USFGRO0_VSn1_VWA1_VWB1_WSGRA0_WSGRB0_WS64_WG16_4_1_WGM0_WGMXCC2_WGMXCCGn1
    SolutionIndex: 200
    SolutionNameMin: Cijk_Alik_Bljk_BBS_BH_Bias_HAS_SAV_UserArgs_MT112x32x64_MI16x16x1_SN_LDSB0_AFC0_AFEM1_AFEM1_ASEM1_CLR1_CADS0_DTLA1_DTLB1_DTVA0_DTVB0_EPS0_FDSI0_GRPM1_GRVWA8_GRVWB8_GSU0_GSUAMB_GSUC0_GSUWGMRR0_GLS0_ISA950_IU1_K1_LBSPPA1024_LBSPPB1024_LBSPPM0_LPA16_LPB16_LPM0_LRVW8_LWPMn1_MIAV1_MIWT7_1_MO40_NTn1_NTA1_NTB3_NTC2_NTD5_NTM0_NEPBS10_NLCA1_NLCB1_ONLL1_PGR2_PLR1_PKA1_SIA3_SS0_SU8_SUM0_SUS256_SPO0_SRVW0_SSO0_SVW4_SK3_SKXCCM8_TLDS1_ULSGRO0_USL1_UIOFGRO0_USFGROn1_VSn1_VWA1_VWB1_WSGRA0_WSGRB0_WS64_WG16_8_1_WGM0_WGMXCC1_WGMXCCGn1
    SolutionIndex: 201
    SolutionNameMin: Cijk_Alik_Bljk_BBS_BH_Bias_HAS_SAV_UserArgs_MT128x48x64_MI16x16x1_SN_LDSB0_AFC0_AFEM1_AFEM1_ASEM1_CLR0_CADS0_DTLA1_DTLB1_DTVA0_DTVB0_EPS0_FDSI0_GRPM1_GRVWA8_GRVWB2_GSU0_GSUAMB_GSUC0_GSUWGMRR0_GLS0_ISA950_IU1_K1_LBSPPA1024_LBSPPB256_LBSPPM0_LPA16_LPB16_LPM0_LRVW8_LWPMn1_MIAV1_MIWT4_3_MO40_NTn1_NTA7_NTB3_NTC1_NTD2_NTM0_NEPBS10_NLCA1_NLCB1_ONLL1_PGR2_PLR1_PKA1_SIA3_SS1_SU0_SUM0_SUS128_SPO0_SRVW0_SSO0_SVW4_SK3_SKXCCM0_TLDS1_ULSGRO0_USL1_UIOFGRO0_USFGRO1_VSn1_VWA4_VWB1_WSGRA0_WSGRB0_WS64_WG32_4_2_WGM1_WGMXCC1_WGMXCCGn1
    SolutionIndex: 202
    SolutionNameMin: Cijk_Alik_Bljk_BBS_BH_Bias_HAS_SAV_UserArgs_MT128x64x64_MI16x16x1_SN_LDSB0_AFC0_AFEM1_AFEM1_ASEM1_CLR0_CADS0_DTLA1_DTLB1_DTVA0_DTVB0_EPS0_FDSI0_GRPM1_GRVWA8_GRVWB2_GSU0_GSUAMB_GSUC0_GSUWGMRR0_GLS0_ISA950_IU1_K1_LBSPPA1024_LBSPPB256_LBSPPM0_LPA16_LPB16_LPM0_LRVW8_LWPMn1_MIAV0_MIWT8_1_MO40_NTn1_NTA7_NTB0_NTC1_NTD3_NTM0_NEPBS16_NLCA1_NLCB1_ONLL1_PGR2_PLR1_PKA1_SIA3_SS1_SU16_SUM0_SUS128_SPO1_SRVW0_SSO0_SVW8_SK3_SKXCCM0_TLDS2_ULSGRO0_USL1_UIOFGRO0_USFGROn1_VSn1_VWA8_VWB1_WSGRA0_WSGRB0_WS64_WG16_16_1_WGM1_WGMXCC1_WGMXCCGn1
    SolutionIndex: 203
    SolutionNameMin: Cijk_Alik_Bljk_BBS_BH_Bias_HAS_SAV_UserArgs_MT128x96x64_MI16x16x1_SN_LDSB0_AFC0_AFEM1_AFEM1_ASEM1_CLR0_CADS0_DTLA1_DTLB1_DTVA0_DTVB0_EPS0_FDSI0_GRPM1_GRVWA8_GRVWB8_GSU0_GSUAMB_GSUC0_GSUWGMRR0_GLS0_ISA950_IU1_K1_LBSPPA1024_LBSPPB1024_LBSPPM0_LPA16_LPB16_LPM0_LRVW8_LWPMn1_MIAV0_MIWT4_3_MO40_NTn1_NTA1_NTB3_NTC0_NTD4_NTM0_NEPBS0_NLCA1_NLCB1_ONLL1_PGR2_PLR1_PKA1_SIA3_SS1_SU0_SUM0_SUS128_SPO1_SRVW0_SSO1_SVW4_SK3_SKXCCM8_TLDS1_ULSGRO0_USL1_UIOFGRO0_USFGRO0_VSn1_VWA4_VWB1_WSGRA0_WSGRB0_WS64_WG32_8_1_WGM1_WGMXCC1_WGMXCCGn1
    SolutionIndex: 204
    SolutionNameMin: Cijk_Alik_Bljk_BBS_BH_Bias_HAS_SAV_UserArgs_MT448x16x64_MI16x16x1_SN_LDSB1_AFC0_AFEM1_AFEM1_ASEM1_CLR1_CADS0_DTLA0_DTLB0_DTVA0_DTVB0_EPS0_FDSI0_GRPM1_GRVWA8_GRVWB4_GSU0_GSUAMB_GSUC0_GSUWGMRR0_GLS0_ISA950_IU1_K1_LBSPPA128_LBSPPB128_LBSPPM0_LPA16_LPB16_LPM0_LRVW8_LWPMn1_MIAV0_MIWT7_1_MO40_NTn1_NTA4_NTB0_NTC0_NTD1_NTM0_NEPBS16_NLCA1_NLCB1_ONLL1_PGR2_PLR1_PKA1_SIA3_SS0_SU16_SUM0_SUS128_SPO1_SRVW0_SSO0_SVW4_SK3_SKXCCM8_TLDS2_ULSGRO0_USL1_UIOFGRO0_USFGROn1_VSn1_VWA1_VWB1_WSGRA0_WSGRB0_WS64_WG64_4_1_WGM1_WGMXCC16_WGMXCCGn1
    SolutionIndex: 205
    SolutionNameMin: Cijk_Alik_Bljk_BBS_BH_Bias_HAS_SAV_UserArgs_MT416x16x64_MI16x16x1_SN_LDSB1_AFC0_AFEM1_AFEM1_ASEM1_CLR1_CADS0_DTLA0_DTLB0_DTVA0_DTVB0_EPS1_FDSI0_GRPM1_GRVWA8_GRVWB8_GSU0_GSUAMB_GSUC0_GSUWGMRR0_GLS0_ISA950_IU1_K1_LBSPPA128_LBSPPB128_LBSPPM0_LPA16_LPB16_LPM0_LRVW8_LWPMn1_MIAV0_MIWT13_1_MO40_NTn1_NTA7_NTB3_NTC3_NTD0_NTM0_NEPBS0_NLCA1_NLCB1_ONLL1_PGR1_PLR1_PKA1_SIA3_SS1_SU16_SUM0_SUS256_SPO0_SRVW0_SSO1_SVW1_SK3_SKXCCM0_TLDS1_ULSGRO0_USL1_UIOFGRO0_USFGRO0_VSn1_VWA1_VWB1_WSGRA0_WSGRB0_WS64_WG32_4_1_WGM0_WGMXCC16_WGMXCCGn1
    SolutionIndex: 206
    SolutionNameMin: Cijk_Alik_Bljk_BBS_BH_Bias_HAS_SAV_UserArgs_MT448x64x64_MI16x16x1_SN_LDSB1_AFC0_AFEM1_AFEM1_ASEM1_CLR1_CADS0_DTLA0_DTLB0_DTVA0_DTVB0_EPS0_FDSI0_GRPM1_GRVWA8_GRVWB8_GSU0_GSUAMB_GSUC0_GSUWGMRR0_GLS0_ISA950_IU1_K1_LBSPPA256_LBSPPB256_LBSPPM0_LPA16_LPB16_LPM0_LRVW8_LWPMn1_MIAV0_MIWT14_2_MO40_NTn1_NTA4_NTB1_NTC1_NTD4_NTM0_NEPBS0_NLCA1_NLCB1_ONLL1_PGR2_PLR1_PKA1_SIA3_SS1_SU16_SUM0_SUS128_SPO0_SRVW0_SSO1_SVW2_SK3_SKXCCM8_TLDS1_ULSGRO0_USL1_UIOFGRO0_USFGRO1_VSn1_VWA2_VWB2_WSGRA0_WSGRB0_WS64_WG32_8_1_WGM24_WGMXCC32_WGMXCCGn1
    SolutionIndex: 207
    SolutionNameMin: Cijk_Alik_Bljk_BBS_BH_Bias_HAS_SAV_UserArgs_MT448x96x64_MI16x16x1_SN_LDSB1_AFC0_AFEM1_AFEM1_ASEM1_CLR1_CADS0_DTLA0_DTLB0_DTVA0_DTVB0_EPS0_FDSI0_GRPM1_GRVWA8_GRVWB8_GSU0_GSUAMB_GSUC0_GSUWGMRR0_GLS0_ISA950_IU1_K1_LBSPPA256_LBSPPB128_LBSPPM0_LPA16_LPB16_LPM0_LRVW8_LWPMn1_MIAV0_MIWT14_3_MO40_NTn1_NTA5_NTB3_NTC0_NTD5_NTM0_NEPBS0_NLCA1_NLCB1_ONLL1_PGR2_PLR1_PKA1_SIA3_SS1_SU16_SUM0_SUS256_SPO1_SRVW0_SSO0_SVW2_SK3_SKXCCM8_TLDS1_ULSGRO0_USL1_UIOFGRO0_USFGRO0_VSn1_VWA2_VWB1_WSGRA0_WSGRB0_WS64_WG32_8_1_WGM2_WGMXCC1_WGMXCCGn1
    SolutionIndex: 208
    SolutionNameMin: Cijk_Alik_Bljk_BBS_BH_Bias_HAS_SAV_UserArgs_MT16x16x64_MI16x16x1_SN_LDSB0_AFC0_AFEM1_AFEM1_ASEM1_CLR0_CADS0_DTLA1_DTLB1_DTVA0_DTVB0_EPS0_FDSI0_GRPM1_GRVWA8_GRVWB8_GSU0_GSUAMB_GSUC0_GSUWGMRR0_GLS0_ISA950_IU1_K1_LBSPPA1024_LBSPPB1024_LBSPPM0_LPA16_LPB16_LPM0_LRVW8_LWPMn1_MIAV0_MIWT1_1_MO40_NTn1_NTA0_NTB3_NTC0_NTD2_NTM0_NEPBS4_NLCA1_NLCB1_ONLL1_PGR2_PLR0_PKA1_SIA3_SS1_SU0_SUM0_SUS128_SPO1_SRVW0_SSO0_SVW1_SK3_SKXCCM0_TLDS1_ULSGRO0_USL1_UIOFGRO0_USFGRO0_VSn1_VWA1_VWB1_WSGRA0_WSGRB0_WS64_WG16_4_2_WGM1_WGMXCC2_WGMXCCGn1
    SolutionIndex: 209
    SolutionNameMin: Cijk_Alik_Bljk_BBS_BH_Bias_HAS_SAV_UserArgs_MT16x32x64_MI16x16x1_SN_LDSB0_AFC0_AFEM1_AFEM1_ASEM1_CLR0_CADS0_DTLA1_DTLB1_DTVA0_DTVB0_EPS0_FDSI0_GRPM1_GRVWA8_GRVWB8_GSU0_GSUAMB_GSUC0_GSUWGMRR0_GLS0_ISA950_IU1_K1_LBSPPA1024_LBSPPB1024_LBSPPM0_LPA16_LPB16_LPM0_LRVW8_LWPMn1_MIAV1_MIWT1_2_MO40_NTn1_NTA3_NTB3_NTC1_NTD2_NTM0_NEPBS4_NLCA1_NLCB1_ONLL1_PGR2_PLR0_PKA1_SIA3_SS1_SU0_SUM0_SUS128_SPO0_SRVW0_SSO0_SVW1_SK3_SKXCCM0_TLDS1_ULSGRO0_USL1_UIOFGRO0_USFGRO1_VSn1_VWA1_VWB2_WSGRA0_WSGRB0_WS64_WG16_4_2_WGM0_WGMXCC4_WGMXCCGn1
    SolutionIndex: 210
    SolutionNameMin: Cijk_Alik_Bljk_BBS_BH_Bias_HAS_SAV_UserArgs_MT16x64x64_MI16x16x1_SN_LDSB0_AFC0_AFEM1_AFEM1_ASEM1_CLR0_CADS0_DTLA1_DTLB1_DTVA0_DTVB0_EPS0_FDSI0_GRPM1_GRVWA2_GRVWB8_GSU0_GSUAMB_GSUC0_GSUWGMRR0_GLS0_ISA950_IU1_K1_LBSPPA256_LBSPPB1024_LBSPPM0_LPA16_LPB16_LPM0_LRVW8_LWPMn1_MIAV1_MIWT1_1_MO40_NTn1_NTA1_NTB2_NTC2_NTD3_NTM0_NEPBS12_NLCA1_NLCB1_ONLL1_PGR2_PLR1_PKA1_SIA3_SS0_SU0_SUM0_SUS128_SPO0_SRVW0_SSO0_SVW4_SK3_SKXCCM4_TLDS1_ULSGRO0_USL1_UIOFGRO0_USFGROn1_VSn1_VWA1_VWB1_WSGRA0_WSGRB0_WS64_WG16_16_1_WGM0_WGMXCC4_WGMXCCGn1
    SolutionIndex: 211
    SolutionNameMin: Cijk_Alik_Bljk_BBS_BH_Bias_HAS_SAV_UserArgs_MT32x64x64_MI16x16x1_SN_LDSB0_AFC0_AFEM1_AFEM1_ASEM1_CLR0_CADS0_DTLA1_DTLB1_DTVA0_DTVB0_EPS0_FDSI0_GRPM1_GRVWA2_GRVWB8_GSU0_GSUAMB_GSUC0_GSUWGMRR0_GLS0_ISA950_IU1_K1_LBSPPA256_LBSPPB1024_LBSPPM0_LPA16_LPB16_LPM0_LRVW8_LWPMn1_MIAV1_MIWT2_1_MO40_NTn1_NTA3_NTB1_NTC3_NTD1_NTM0_NEPBS14_NLCA1_NLCB1_ONLL1_PGR2_PLR1_PKA1_SIA3_SS1_SU0_SUM0_SUS128_SPO1_SRVW0_SSO0_SVW2_SK3_SKXCCM0_TLDS1_ULSGRO0_USL1_UIOFGRO0_USFGRO0_VSn1_VWA2_VWB1_WSGRA0_WSGRB0_WS64_WG16_16_1_WGM6_WGMXCC2_WGMXCCGn1
    SolutionIndex: 212
    SolutionNameMin: Cijk_Alik_Bljk_BBS_BH_Bias_HAS_SAV_UserArgs_MT32x64x64_MI16x16x1_SN_LDSB0_AFC0_AFEM1_AFEM1_ASEM1_CLR1_CADS0_DTLA1_DTLB1_DTVA0_DTVB0_EPS0_FDSI0_GRPM1_GRVWA2_GRVWB8_GSU0_GSUAMB_GSUC0_GSUWGMRR0_GLS0_ISA950_IU1_K1_LBSPPA256_LBSPPB1024_LBSPPM0_LPA16_LPB16_LPM0_LRVW8_LWPMn1_MIAV1_MIWT2_1_MO40_NTn1_NTA1_NTB2_NTC6_NTD3_NTM0_NEPBS8_NLCA1_NLCB1_ONLL1_PGR2_PLR1_PKA1_SIA3_SS1_SU0_SUM0_SUS128_SPO0_SRVW0_SSO0_SVW2_SK3_SKXCCM0_TLDS2_ULSGRO0_USL1_UIOFGRO0_USFGRO0_VSn1_VWA2_VWB1_WSGRA0_WSGRB0_WS64_WG16_16_1_WGM1_WGMXCC2_WGMXCCGn1
    SolutionIndex: 213
    SolutionNameMin: Cijk_Alik_Bljk_BBS_BH_Bias_HAS_SAV_UserArgs_MT32x64x64_MI16x16x1_SN_LDSB0_AFC0_AFEM1_AFEM1_ASEM1_CLR0_CADS0_DTLA1_DTLB1_DTVA0_DTVB0_EPS0_FDSI0_GRPM1_GRVWA8_GRVWB2_GSU0_GSUAMB_GSUC0_GSUWGMRR0_GLS0_ISA950_IU1_K1_LBSPPA1024_LBSPPB256_LBSPPM0_LPA16_LPB16_LPM0_LRVW8_LWPMn1_MIAV0_MIWT1_2_MO40_NTn1_NTA1_NTB3_NTC3_NTD0_NTM0_NEPBS2_NLCA1_NLCB1_ONLL1_PGR2_PLR1_PKA1_SIA3_SS0_SU0_SUM0_SUS128_SPO0_SRVW0_SSO0_SVW4_SK3_SKXCCM0_TLDS1_ULSGRO0_USL1_UIOFGRO0_USFGRO0_VSn1_VWA1_VWB2_WSGRA0_WSGRB0_WS64_WG32_8_1_WGM0_WGMXCC4_WGMXCCGn1
    SolutionIndex: 214
    SolutionNameMin: Cijk_Alik_Bljk_BBS_BH_Bias_HAS_SAV_UserArgs_MT32x64x64_MI16x16x1_SN_LDSB0_AFC0_AFEM1_AFEM1_ASEM1_CLR1_CADS0_DTLA1_DTLB1_DTVA0_DTVB0_EPS0_FDSI0_GRPM1_GRVWA8_GRVWB2_GSU0_GSUAMB_GSUC0_GSUWGMRR0_GLS0_ISA950_IU1_K1_LBSPPA1024_LBSPPB256_LBSPPM0_LPA16_LPB16_LPM0_LRVW8_LWPMn1_MIAV0_MIWT1_2_MO40_NTn1_NTA1_NTB3_NTC0_NTD0_NTM0_NEPBS10_NLCA1_NLCB1_ONLL1_PGR2_PLR1_PKA1_SIA3_SS0_SU0_SUM0_SUS128_SPO1_SRVW0_SSO0_SVW4_SK3_SKXCCM4_TLDS1_ULSGRO0_USL1_UIOFGRO0_USFGRO0_VSn1_VWA1_VWB2_WSGRA0_WSGRB0_WS64_WG32_8_1_WGM0_WGMXCC4_WGMXCCGn1
    SolutionIndex: 215
    SolutionNameMin: Cijk_Alik_Bljk_BBS_BH_Bias_HAS_SAV_UserArgs_MT32x64x64_MI16x16x1_SN_LDSB0_AFC0_AFEM1_AFEM1_ASEM1_CLR1_CADS0_DTLA1_DTLB1_DTVA0_DTVB0_EPS0_FDSI0_GRPM1_GRVWA8_GRVWB2_GSU0_GSUAMB_GSUC0_GSUWGMRR0_GLS0_ISA950_IU1_K1_LBSPPA1024_LBSPPB256_LBSPPM0_LPA16_LPB16_LPM0_LRVW8_LWPMn1_MIAV0_MIWT1_2_MO40_NTn1_NTA3_NTB0_NTC0_NTD0_NTM0_NEPBS0_NLCA1_NLCB1_ONLL1_PGR2_PLR1_PKA1_SIA3_SS0_SU0_SUM0_SUS128_SPO1_SRVW0_SSO0_SVW4_SK3_SKXCCM8_TLDS1_ULSGRO0_USL1_UIOFGRO0_USFGRO0_VSn1_VWA1_VWB2_WSGRA0_WSGRB0_WS64_WG32_8_1_WGM24_WGMXCC4_WGMXCCGn1
    SolutionIndex: 216
    SolutionNameMin: Cijk_Alik_Bljk_BBS_BH_Bias_HAS_SAV_UserArgs_MT64x64x64_MI16x16x1_SN_LDSB0_AFC0_AFEM1_AFEM1_ASEM1_CLR1_CADS0_DTLA1_DTLB1_DTVA0_DTVB0_EPS0_FDSI0_GRPM1_GRVWA2_GRVWB8_GSU0_GSUAMB_GSUC0_GSUWGMRR0_GLS0_ISA950_IU1_K1_LBSPPA512_LBSPPB1024_LBSPPM0_LPA16_LPB16_LPM0_LRVW8_LWPMn1_MIAV1_MIWT4_1_MO40_NTn1_NTA1_NTB7_NTC3_NTD2_NTM0_NEPBS12_NLCA1_NLCB1_ONLL1_PGR2_PLR1_PKA1_SIA3_SS1_SU0_SUM0_SUS128_SPO0_SRVW0_SSO0_SVW4_SK3_SKXCCM0_TLDS1_ULSGRO0_USL1_UIOFGRO0_USFGRO0_VSn1_VWA4_VWB1_WSGRA0_WSGRB0_WS64_WG16_16_1_WGM1_WGMXCC32_WGMXCCGn1
    SolutionIndex: 217
    SolutionNameMin: Cijk_Alik_Bljk_BBS_BH_Bias_HAS_SAV_UserArgs_MT128x80x64_MI16x16x1_SN_LDSB0_AFC0_AFEM1_AFEM1_ASEM1_CLR0_CADS0_DTLA1_DTLB1_DTVA0_DTVB0_EPS0_FDSI0_GRPM1_GRVWA8_GRVWB2_GSU0_GSUAMB_GSUC0_GSUWGMRR0_GLS0_ISA950_IU1_K1_LBSPPA1024_LBSPPB256_LBSPPM0_LPA16_LPB16_LPM0_LRVW8_LWPMn1_MIAV1_MIWT2_5_MO40_NTn1_NTA0_NTB7_NTC0_NTD2_NTM0_NEPBS0_NLCA1_NLCB1_ONLL1_PGR2_PLR1_PKA1_SIA3_SS1_SU8_SUM0_SUS128_SPO0_SRVW0_SSO0_SVW2_SK3_SKXCCM4_TLDS2_ULSGRO0_USL1_UIOFGRO0_USFGROn1_VSn1_VWA2_VWB1_WSGRA0_WSGRB0_WS64_WG64_4_1_WGM0_WGMXCC8_WGMXCCGn1
    SolutionIndex: 218
    SolutionNameMin: Cijk_Alik_Bljk_BBS_BH_Bias_HAS_SAV_UserArgs_MT128x96x64_MI16x16x1_SN_LDSB0_AFC0_AFEM1_AFEM1_ASEM1_CLR0_CADS0_DTLA1_DTLB1_DTVA0_DTVB0_EPS0_FDSI0_GRPM1_GRVWA8_GRVWB8_GSU0_GSUAMB_GSUC0_GSUWGMRR0_GLS0_ISA950_IU1_K1_LBSPPA1024_LBSPPB1024_LBSPPM0_LPA16_LPB16_LPM0_LRVW8_LWPMn1_MIAV1_MIWT4_3_MO40_NTn1_NTA1_NTB5_NTC3_NTD3_NTM0_NEPBS14_NLCA1_NLCB1_ONLL1_PGR2_PLR1_PKA1_SIA3_SS1_SU0_SUM0_SUS128_SPO0_SRVW0_SSO0_SVW4_SK3_SKXCCM8_TLDS2_ULSGRO0_USL1_UIOFGRO0_USFGROn1_VSn1_VWA4_VWB1_WSGRA0_WSGRB0_WS64_WG32_8_1_WGM1_WGMXCC4_WGMXCCGn1
    SolutionIndex: 219
    SolutionNameMin: Cijk_Alik_Bljk_BBS_BH_Bias_HAS_SAV_UserArgs_MT128x96x64_MI16x16x1_SN_LDSB0_AFC0_AFEM1_AFEM1_ASEM1_CLR0_CADS0_DTLA1_DTLB1_DTVA0_DTVB0_EPS0_FDSI0_GRPM1_GRVWA8_GRVWB8_GSU0_GSUAMB_GSUC0_GSUWGMRR0_GLS0_ISA950_IU1_K1_LBSPPA1024_LBSPPB1024_LBSPPM0_LPA16_LPB16_LPM0_LRVW8_LWPMn1_MIAV1_MIWT4_3_MO40_NTn1_NTA3_NTB6_NTC3_NTD3_NTM0_NEPBS14_NLCA1_NLCB1_ONLL1_PGR2_PLR1_PKA1_SIA3_SS1_SU8_SUM0_SUS128_SPO0_SRVW0_SSO0_SVW4_SK3_SKXCCM0_TLDS1_ULSGRO0_USL1_UIOFGRO0_USFGRO1_VSn1_VWA4_VWB1_WSGRA0_WSGRB0_WS64_WG32_8_1_WGM1_WGMXCC32_WGMXCCGn1
    SolutionIndex: 220
    SolutionNameMin: Cijk_Alik_Bljk_BBS_BH_Bias_HAS_SAV_UserArgs_MT128x112x64_MI16x16x1_SN_LDSB0_AFC0_AFEM1_AFEM1_ASEM1_CLR0_CADS0_DTLA1_DTLB1_DTVA0_DTVB0_EPS0_FDSI0_GRPM1_GRVWA8_GRVWB2_GSU0_GSUAMB_GSUC0_GSUWGMRR0_GLS0_ISA950_IU1_K1_LBSPPA1024_LBSPPB256_LBSPPM0_LPA16_LPB16_LPM0_LRVW8_LWPMn1_MIAV1_MIWT2_7_MO40_NTn1_NTA0_NTB5_NTC1_NTD3_NTM0_NEPBS0_NLCA1_NLCB1_ONLL1_PGR2_PLR1_PKA1_SIA3_SS1_SU0_SUM0_SUS128_SPO0_SRVW0_SSO0_SVW2_SK3_SKXCCM8_TLDS1_ULSGRO0_USL1_UIOFGRO0_USFGRO0_VSn1_VWA2_VWB1_WSGRA0_WSGRB0_WS64_WG64_4_1_WGM1_WGMXCC4_WGMXCCGn1
    SolutionIndex: 221
    SolutionNameMin: Cijk_Alik_Bljk_BBS_BH_Bias_HAS_SAV_UserArgs_MT16x16x256_MI16x16x1_SN_LDSB0_AFC0_AFEM1_AFEM1_ASEM1_CLR0_CADS0_DTLA1_DTLB1_DTVA0_DTVB0_EPS0_FDSI0_GRPM1_GRVWA8_GRVWB8_GSU0_GSUAMB_GSUC0_GSUWGMRR0_GLS0_ISA950_IU1_K1_LBSPPA1024_LBSPPB1024_LBSPPM0_LPA16_LPB16_LPM0_LRVW8_LWPMn1_MIAV0_MIWT1_1_MO40_NTn1_NTA0_NTB1_NTC1_NTD1_NTM0_NEPBS4_NLCA1_NLCB1_ONLL1_PGR2_PLR1_PKA1_SIA3_SS0_SU8_SUM0_SUS512_SPO0_SRVW0_SSO0_SVW1_SK3_SKXCCM0_TLDS1_ULSGRO0_USL1_UIOFGRO0_USFGRO0_VSn1_VWA1_VWB1_WSGRA0_WSGRB0_WS64_WG16_4_4_WGM0_WGMXCC16_WGMXCCGn1
    SolutionIndex: 222
    SolutionNameMin: Cijk_Alik_Bljk_BBS_BH_Bias_HAS_SAV_UserArgs_MT32x32x64_MI16x16x1_SN_LDSB0_AFC0_AFEM1_AFEM1_ASEM1_CLR0_CADS0_DTLA1_DTLB1_DTVA0_DTVB0_EPS0_FDSI0_GRPM1_GRVWA8_GRVWB2_GSU0_GSUAMB_GSUC0_GSUWGMRR0_GLS0_ISA950_IU1_K1_LBSPPA1024_LBSPPB256_LBSPPM0_LPA16_LPB16_LPM0_LRVW8_LWPMn1_MIAV0_MIWT1_1_MO40_NTn1_NTA5_NTB3_NTC3_NTD1_NTM0_NEPBS2_NLCA1_NLCB1_ONLL1_PGR2_PLR1_PKA1_SIA3_SS0_SU8_SUM0_SUS128_SPO0_SRVW0_SSO0_SVW4_SK3_SKXCCM8_TLDS2_ULSGRO0_USL1_UIOFGRO0_USFGRO1_VSn1_VWA1_VWB1_WSGRA0_WSGRB0_WS64_WG32_8_1_WGM0_WGMXCC4_WGMXCCGn1
    SolutionIndex: 223
    SolutionNameMin: Cijk_Alik_Bljk_BBS_BH_Bias_HAS_SAV_UserArgs_MT64x32x64_MI16x16x1_SN_LDSB0_AFC0_AFEM1_AFEM1_ASEM1_CLR0_CADS0_DTLA1_DTLB1_DTVA0_DTVB0_EPS0_FDSI0_GRPM1_GRVWA8_GRVWB2_GSU0_GSUAMB_GSUC0_GSUWGMRR0_GLS0_ISA950_IU1_K1_LBSPPA1024_LBSPPB256_LBSPPM0_LPA16_LPB16_LPM0_LRVW8_LWPMn1_MIAV1_MIWT1_2_MO40_NTn1_NTA0_NTB0_NTC6_NTD1_NTM0_NEPBS12_NLCA1_NLCB1_ONLL1_PGR2_PLR1_PKA1_SIA3_SS0_SU0_SUM0_SUS128_SPO0_SRVW0_SSO0_SVW4_SK3_SKXCCM4_TLDS1_ULSGRO0_USL1_UIOFGRO0_USFGROn1_VSn1_VWA1_VWB2_WSGRA0_WSGRB0_WS64_WG64_4_1_WGM0_WGMXCC4_WGMXCCGn1
    SolutionIndex: 224
    SolutionNameMin: Cijk_Alik_Bljk_BBS_BH_Bias_HAS_SAV_UserArgs_MT32x64x64_MI16x16x1_SN_LDSB0_AFC0_AFEM1_AFEM1_ASEM1_CLR1_CADS0_DTLA1_DTLB1_DTVA0_DTVB0_EPS0_FDSI0_GRPM1_GRVWA2_GRVWB8_GSU0_GSUAMB_GSUC0_GSUWGMRR0_GLS0_ISA950_IU1_K1_LBSPPA256_LBSPPB1024_LBSPPM0_LPA16_LPB16_LPM0_LRVW8_LWPMn1_MIAV1_MIWT2_1_MO40_NTn1_NTA6_NTB2_NTC3_NTD1_NTM0_NEPBS16_NLCA1_NLCB1_ONLL1_PGR2_PLR1_PKA1_SIA3_SS1_SU0_SUM0_SUS128_SPO0_SRVW0_SSO0_SVW2_SK3_SKXCCM8_TLDS2_ULSGRO0_USL1_UIOFGRO0_USFGRO0_VSn1_VWA2_VWB1_WSGRA0_WSGRB0_WS64_WG16_16_1_WGM1_WGMXCC4_WGMXCCGn1
    SolutionIndex: 225
    SolutionNameMin: Cijk_Alik_Bljk_BBS_BH_Bias_HAS_SAV_UserArgs_MT32x64x64_MI16x16x1_SN_LDSB0_AFC0_AFEM1_AFEM1_ASEM1_CLR0_CADS0_DTLA1_DTLB1_DTVA0_DTVB0_EPS0_FDSI0_GRPM1_GRVWA2_GRVWB8_GSU0_GSUAMB_GSUC0_GSUWGMRR0_GLS0_ISA950_IU1_K1_LBSPPA256_LBSPPB1024_LBSPPM0_LPA16_LPB16_LPM0_LRVW8_LWPMn1_MIAV0_MIWT2_1_MO40_NTn1_NTA0_NTB1_NTC0_NTD1_NTM0_NEPBS10_NLCA1_NLCB1_ONLL1_PGR2_PLR1_PKA1_SIA3_SS1_SU0_SUM0_SUS128_SPO1_SRVW0_SSO0_SVW2_SK3_SKXCCM8_TLDS1_ULSGRO0_USL1_UIOFGRO0_USFGRO0_VSn1_VWA2_VWB1_WSGRA0_WSGRB0_WS64_WG16_16_1_WGM1_WGMXCC8_WGMXCCGn1
    SolutionIndex: 226
    SolutionNameMin: Cijk_Alik_Bljk_BBS_BH_Bias_HAS_SAV_UserArgs_MT64x64x64_MI16x16x1_SN_LDSB0_AFC0_AFEM1_AFEM1_ASEM1_CLR0_CADS0_DTLA1_DTLB1_DTVA0_DTVB0_EPS0_FDSI0_GRPM1_GRVWA2_GRVWB8_GSU0_GSUAMB_GSUC0_GSUWGMRR0_GLS0_ISA950_IU1_K1_LBSPPA512_LBSPPB1024_LBSPPM0_LPA16_LPB16_LPM0_LRVW8_LWPMn1_MIAV1_MIWT4_1_MO40_NTn1_NTA4_NTB0_NTC7_NTD1_NTM0_NEPBS16_NLCA1_NLCB1_ONLL1_PGR2_PLR1_PKA1_SIA3_SS1_SU0_SUM0_SUS128_SPO0_SRVW0_SSO0_SVW4_SK3_SKXCCM7_TLDS1_ULSGRO0_USL1_UIOFGRO0_USFGRO0_VSn1_VWA4_VWB1_WSGRA0_WSGRB0_WS64_WG16_16_1_WGM0_WGMXCC8_WGMXCCGn1
    SolutionIndex: 227
    SolutionNameMin: Cijk_Alik_Bljk_BBS_BH_Bias_HAS_SAV_UserArgs_MT32x32x64_MI16x16x1_SN_LDSB0_AFC0_AFEM1_AFEM1_ASEM1_CLR0_CADS0_DTLA1_DTLB1_DTVA0_DTVB0_EPS0_FDSI0_GRPM1_GRVWA8_GRVWB8_GSU0_GSUAMB_GSUC0_GSUWGMRR0_GLS0_ISA950_IU1_K1_LBSPPA1024_LBSPPB1024_LBSPPM0_LPA16_LPB16_LPM0_LRVW8_LWPMn1_MIAV1_MIWT1_1_MO40_NTn1_NTA2_NTB3_NTC3_NTD1_NTM0_NEPBS16_NLCA1_NLCB1_ONLL1_PGR2_PLR1_PKA1_SIA3_SS1_SU0_SUM0_SUS128_SPO0_SRVW0_SSO0_SVW1_SK3_SKXCCM8_TLDS1_ULSGRO0_USL1_UIOFGRO0_USFGRO1_VSn1_VWA1_VWB1_WSGRA0_WSGRB0_WS64_WG32_8_1_WGM0_WGMXCC1_WGMXCCGn1
    SolutionIndex: 228
    SolutionNameMin: Cijk_Alik_Bljk_BBS_BH_Bias_HAS_SAV_UserArgs_MT64x96x64_MI16x16x1_SN_LDSB0_AFC0_AFEM1_AFEM1_ASEM1_CLR1_CADS0_DTLA1_DTLB1_DTVA0_DTVB0_EPS0_FDSI0_GRPM1_GRVWA2_GRVWB8_GSU0_GSUAMB_GSUC0_GSUWGMRR0_GLS0_ISA950_IU1_K1_LBSPPA256_LBSPPB1024_LBSPPM0_LPA16_LPB16_LPM0_LRVW8_LWPMn1_MIAV1_MIWT2_3_MO40_NTn1_NTA0_NTB1_NTC0_NTD1_NTM0_NEPBS12_NLCA1_NLCB1_ONLL1_PGR2_PLR1_PKA1_SIA3_SS1_SU0_SUM0_SUS128_SPO0_SRVW0_SSO0_SVW2_SK3_SKXCCM8_TLDS2_ULSGRO0_USL1_UIOFGRO0_USFGRO0_VSn1_VWA2_VWB1_WSGRA0_WSGRB0_WS64_WG32_8_1_WGM1_WGMXCC4_WGMXCCGn1
    SolutionIndex: 229
    SolutionNameMin: Cijk_Alik_Bljk_BBS_BH_Bias_HAS_SAV_UserArgs_MT128x64x64_MI16x16x1_SN_LDSB0_AFC0_AFEM1_AFEM1_ASEM1_CLR0_CADS0_DTLA1_DTLB1_DTVA0_DTVB0_EPS0_FDSI0_GRPM1_GRVWA8_GRVWB2_GSU0_GSUAMB_GSUC0_GSUWGMRR0_GLS0_ISA950_IU1_K1_LBSPPA1024_LBSPPB256_LBSPPM0_LPA16_LPB16_LPM0_LRVW8_LWPMn1_MIAV1_MIWT4_2_MO40_NTn1_NTA3_NTB1_NTC4_NTD1_NTM0_NEPBS0_NLCA1_NLCB1_ONLL1_PGR2_PLR1_PKA1_SIA3_SS1_SU16_SUM0_SUS128_SPO0_SRVW0_SSO0_SVW4_SK3_SKXCCM0_TLDS1_ULSGRO0_USL1_UIOFGRO0_USFGROn1_VSn1_VWA4_VWB2_WSGRA0_WSGRB0_WS64_WG32_8_1_WGM8_WGMXCC16_WGMXCCGn1
    SolutionIndex: 230
    SolutionNameMin: Cijk_Alik_Bljk_BBS_BH_Bias_HAS_SAV_UserArgs_MT64x128x64_MI16x16x1_SN_LDSB0_AFC0_AFEM1_AFEM1_ASEM1_CLR0_CADS0_DTLA1_DTLB1_DTVA0_DTVB0_EPS0_FDSI0_GRPM1_GRVWA2_GRVWB2_GSU0_GSUAMB_GSUC0_GSUWGMRR0_GLS0_ISA950_IU1_K1_LBSPPA512_LBSPPB256_LBSPPM0_LPA16_LPB16_LPM0_LRVW8_LWPMn1_MIAV1_MIWT4_2_MO40_NTn1_NTA1_NTB3_NTC6_NTD0_NTM0_NEPBS14_NLCA1_NLCB1_ONLL1_PGR2_PLR1_PKA1_SIA3_SS1_SU0_SUM0_SUS128_SPO0_SRVW0_SSO0_SVW4_SK3_SKXCCM5_TLDS1_ULSGRO0_USL1_UIOFGRO0_USFGRO0_VSn1_VWA4_VWB2_WSGRA0_WSGRB0_WS64_WG16_16_1_WGM48_WGMXCC8_WGMXCCGn1
    SolutionIndex: 231
    SolutionNameMin: Cijk_Alik_Bljk_BBS_BH_Bias_HAS_SAV_UserArgs_MT128x128x64_MI32x32x1_SN_LDSB0_AFC0_AFEM1_AFEM1_ASEM1_CLR1_CADS0_DTLA0_DTLB0_DTVA0_DTVB0_EPS0_FDSI0_GRPM1_GRVWA8_GRVWB8_GSU0_GSUAMB_GSUC0_GSUWGMRR0_GLS0_ISA950_IU1_K1_LBSPPA512_LBSPPB128_LBSPPM0_LPA8_LPB8_LPM0_LRVW8_LWPMn1_MIAV1_MIWT4_1_MO40_NTn1_NTA2_NTB0_NTC5_NTD0_NTM0_NEPBS0_NLCA1_NLCB1_ONLL1_PGR2_PLR1_PKA1_SIA3_SS1_SU0_SUM0_SUS128_SPO0_SRVW0_SSO0_SVW4_SK3_SKXCCM5_TLDS2_ULSGRO0_USL1_UIOFGRO0_USFGROn1_VSn1_VWA4_VWB1_WSGRA0_WSGRB0_WS64_WG32_8_1_WGM1_WGMXCC8_WGMXCCGn1
    SolutionIndex: 232
    SolutionNameMin: Cijk_Alik_Bljk_BBS_BH_Bias_HAS_SAV_UserArgs_MT160x128x64_MI16x16x1_SN_LDSB0_AFC0_AFEM1_AFEM1_ASEM1_CLR0_CADS0_DTLA1_DTLB1_DTVA0_DTVB0_EPS0_FDSI0_GRPM1_GRVWA8_GRVWB8_GSU0_GSUAMB_GSUC0_GSUWGMRR0_GLS0_ISA950_IU1_K1_LBSPPA1024_LBSPPB1024_LBSPPM0_LPA16_LPB16_LPM0_LRVW8_LWPMn1_MIAV0_MIWT5_4_MO40_NTn1_NTA0_NTB4_NTC1_NTD4_NTM0_NEPBS0_NLCA1_NLCB1_ONLL1_PGR2_PLR1_PKA1_SIA3_SS1_SU0_SUM0_SUS128_SPO1_SRVW0_SSO0_SVW1_SK3_SKXCCM0_TLDS2_ULSGRO0_USL1_UIOFGRO0_USFGRO0_VSn1_VWA1_VWB4_WSGRA0_WSGRB0_WS64_WG32_8_1_WGM1_WGMXCC8_WGMXCCGn1
    SolutionIndex: 233
    SolutionNameMin: Cijk_Alik_Bljk_BBS_BH_Bias_HAS_SAV_UserArgs_MT16x16x512_MI16x16x1_SN_LDSB0_AFC0_AFEM1_AFEM1_ASEM1_CLR1_CADS0_DTLA1_DTLB1_DTVA0_DTVB0_EPS0_FDSI0_GRPM1_GRVWA8_GRVWB8_GSU0_GSUAMB_GSUC0_GSUWGMRR0_GLS0_ISA950_IU1_K1_LBSPPA1024_LBSPPB1024_LBSPPM0_LPA16_LPB16_LPM0_LRVW8_LWPMn1_MIAV0_MIWT1_1_MO40_NTn1_NTA6_NTB1_NTC3_NTD0_NTM0_NEPBS14_NLCA1_NLCB1_ONLL1_PGR2_PLR1_PKA1_SIA3_SS1_SU0_SUM0_SUS1024_SPO1_SRVW0_SSO0_SVW1_SK3_SKXCCM0_TLDS1_ULSGRO0_USL1_UIOFGRO0_USFGRO1_VSn1_VWA1_VWB1_WSGRA0_WSGRB0_WS64_WG16_4_4_WGM1_WGMXCC8_WGMXCCGn1
    SolutionIndex: 234
    SolutionNameMin: Cijk_Alik_Bljk_BBS_BH_Bias_HAS_SAV_UserArgs_MT32x32x256_MI16x16x1_SN_LDSB0_AFC0_AFEM1_AFEM1_ASEM1_CLR1_CADS0_DTLA1_DTLB1_DTVA0_DTVB0_EPS0_FDSI0_GRPM1_GRVWA8_GRVWB8_GSU0_GSUAMB_GSUC0_GSUWGMRR0_GLS0_ISA950_IU1_K1_LBSPPA1024_LBSPPB1024_LBSPPM0_LPA16_LPB16_LPM0_LRVW8_LWPMn1_MIAV1_MIWT1_1_MO40_NTn1_NTA7_NTB1_NTC0_NTD3_NTM0_NEPBS14_NLCA1_NLCB1_ONLL1_PGR2_PLR1_PKA1_SIA3_SS0_SU0_SUM0_SUS512_SPO1_SRVW0_SSO0_SVW4_SK3_SKXCCM4_TLDS2_ULSGRO0_USL1_UIOFGRO0_USFGROn1_VSn1_VWA1_VWB1_WSGRA0_WSGRB0_WS64_WG32_8_1_WGM1_WGMXCC4_WGMXCCGn1
    SolutionIndex: 235
    SolutionNameMin: Cijk_Alik_Bljk_BBS_BH_Bias_HAS_SAV_UserArgs_MT64x16x256_MI16x16x1_SN_LDSB0_AFC0_AFEM1_AFEM1_ASEM1_CLR1_CADS0_DTLA1_DTLB1_DTVA0_DTVB0_EPS0_FDSI0_GRPM1_GRVWA8_GRVWB8_GSU0_GSUAMB_GSUC0_GSUWGMRR0_GLS0_ISA950_IU1_K1_LBSPPA1024_LBSPPB1024_LBSPPM0_LPA16_LPB16_LPM0_LRVW8_LWPMn1_MIAV0_MIWT1_1_MO40_NTn1_NTA2_NTB2_NTC6_NTD1_NTM0_NEPBS16_NLCA1_NLCB1_ONLL1_PGR2_PLR1_PKA1_SIA3_SS1_SU8_SUM0_SUS512_SPO1_SRVW0_SSO0_SVW1_SK3_SKXCCM5_TLDS1_ULSGRO0_USL1_UIOFGRO0_USFGRO1_VSn1_VWA1_VWB1_WSGRA0_WSGRB0_WS64_WG64_4_1_WGM1_WGMXCC8_WGMXCCGn1
    SolutionIndex: 236
    SolutionNameMin: Cijk_Alik_Bljk_BBS_BH_Bias_HAS_SAV_UserArgs_MT32x64x256_MI16x16x1_SN_LDSB0_AFC0_AFEM1_AFEM1_ASEM1_CLR1_CADS0_DTLA1_DTLB1_DTVA0_DTVB0_EPS0_FDSI0_GRPM1_GRVWA8_GRVWB8_GSU0_GSUAMB_GSUC0_GSUWGMRR0_GLS0_ISA950_IU1_K1_LBSPPA1024_LBSPPB1024_LBSPPM0_LPA16_LPB16_LPM0_LRVW8_LWPMn1_MIAV0_MIWT2_1_MO40_NTn1_NTA6_NTB2_NTC2_NTD6_NTM0_NEPBS10_NLCA1_NLCB1_ONLL1_PGR2_PLR1_PKA1_SIA3_SS1_SU0_SUM0_SUS512_SPO1_SRVW0_SSO0_SVW2_SK3_SKXCCM4_TLDS2_ULSGRO0_USL1_UIOFGRO0_USFGRO1_VSn1_VWA2_VWB1_WSGRA0_WSGRB0_WS64_WG16_16_1_WGM0_WGMXCC4_WGMXCCGn1
    SolutionIndex: 237
    SolutionNameMin: Cijk_Alik_Bljk_BBS_BH_Bias_HAS_SAV_UserArgs_MT64x32x256_MI16x16x1_SN_LDSB0_AFC0_AFEM1_AFEM1_ASEM1_CLR1_CADS0_DTLA0_DTLB0_DTVA0_DTVB0_EPS0_FDSI0_GRPM1_GRVWA8_GRVWB8_GSU0_GSUAMB_GSUC0_GSUWGMRR0_GLS0_ISA950_IU1_K1_LBSPPA1024_LBSPPB512_LBSPPM0_LPA16_LPB16_LPM0_LRVW8_LWPMn1_MIAV0_MIWT2_1_MO40_NTn1_NTA3_NTB0_NTC2_NTD2_NTM0_NEPBS12_NLCA1_NLCB1_ONLL1_PGR2_PLR1_PKA1_SIA3_SS1_SU8_SUM0_SUS512_SPO1_SRVW0_SSO0_SVW2_SK3_SKXCCM0_TLDS1_ULSGRO0_USL1_UIOFGRO0_USFGRO0_VSn1_VWA2_VWB1_WSGRA0_WSGRB0_WS64_WG32_8_1_WGM8_WGMXCC8_WGMXCCGn1
    SolutionIndex: 238
    SolutionNameMin: Cijk_Alik_Bljk_BBS_BH_Bias_HAS_SAV_UserArgs_MT64x16x128_MI16x16x1_SN_LDSB0_AFC0_AFEM1_AFEM1_ASEM1_CLR1_CADS0_DTLA0_DTLB0_DTVA0_DTVB0_EPS0_FDSI0_GRPM1_GRVWA8_GRVWB8_GSU0_GSUAMB_GSUC0_GSUWGMRR0_GLS0_ISA950_IU1_K1_LBSPPA256_LBSPPB256_LBSPPM0_LPA16_LPB16_LPM0_LRVW8_LWPMn1_MIAV0_MIWT1_1_MO40_NTn1_NTA0_NTB1_NTC0_NTD0_NTM0_NEPBS10_NLCA1_NLCB1_ONLL1_PGR2_PLR1_PKA1_SIA3_SS1_SU8_SUM0_SUS256_SPO1_SRVW0_SSO0_SVW1_SK3_SKXCCM4_TLDS1_ULSGRO0_USL1_UIOFGRO0_USFGROn1_VSn1_VWA1_VWB1_WSGRA0_WSGRB0_WS64_WG64_4_1_WGM16_WGMXCC2_WGMXCCGn1
    SolutionIndex: 239
    SolutionNameMin: Cijk_Alik_Bljk_BBS_BH_Bias_HAS_SAV_UserArgs_MT64x48x256_MI16x16x1_SN_LDSB0_AFC0_AFEM1_AFEM1_ASEM1_CLR0_CADS0_DTLA0_DTLB0_DTVA0_DTVB0_EPS0_FDSI0_GRPM1_GRVWA8_GRVWB8_GSU0_GSUAMB_GSUC0_GSUWGMRR0_GLS0_ISA950_IU1_K1_LBSPPA512_LBSPPB512_LBSPPM0_LPA16_LPB16_LPM0_LRVW8_LWPMn1_MIAV0_MIWT1_3_MO40_NTn1_NTA1_NTB2_NTC0_NTD4_NTM0_NEPBS16_NLCA1_NLCB1_ONLL1_PGR2_PLR1_PKA1_SIA3_SS1_SU8_SUM0_SUS512_SPO0_SRVW0_SSO0_SVW1_SK3_SKXCCM5_TLDS2_ULSGRO0_USL1_UIOFGRO0_USFGRO0_VSn1_VWA1_VWB1_WSGRA0_WSGRB0_WS64_WG64_4_1_WGM0_WGMXCC8_WGMXCCGn1
    SolutionIndex: 240
    SolutionNameMin: Cijk_Alik_Bljk_BBS_BH_Bias_HAS_SAV_UserArgs_MT48x64x256_MI16x16x1_SN_LDSB0_AFC0_AFEM1_AFEM1_ASEM1_CLR0_CADS0_DTLA0_DTLB0_DTVA0_DTVB0_EPS0_FDSI0_GRPM1_GRVWA8_GRVWB8_GSU0_GSUAMB_GSUC0_GSUWGMRR0_GLS0_ISA950_IU1_K1_LBSPPA512_LBSPPB512_LBSPPM0_LPA16_LPB16_LPM0_LRVW8_LWPMn1_MIAV0_MIWT3_1_MO40_NTn1_NTA5_NTB1_NTC0_NTD3_NTM0_NEPBS0_NLCA1_NLCB1_ONLL1_PGR2_PLR1_PKA1_SIA3_SS1_SU0_SUM0_SUS512_SPO1_SRVW0_SSO0_SVW1_SK3_SKXCCM8_TLDS1_ULSGRO0_USL1_UIOFGRO0_USFGRO0_VSn1_VWA1_VWB1_WSGRA0_WSGRB0_WS64_WG16_16_1_WGM0_WGMXCC4_WGMXCCGn1
    SolutionIndex: 241
    SolutionNameMin: Cijk_Alik_Bljk_BBS_BH_Bias_HAS_SAV_UserArgs_MT64x64x128_MI16x16x1_SN_LDSB0_AFC0_AFEM1_AFEM1_ASEM1_CLR1_CADS0_DTLA1_DTLB1_DTVA0_DTVB0_EPS0_FDSI0_GRPM1_GRVWA8_GRVWB8_GSU0_GSUAMB_GSUC0_GSUWGMRR0_GLS0_ISA950_IU1_K1_LBSPPA1024_LBSPPB1024_LBSPPM0_LPA16_LPB16_LPM0_LRVW8_LWPMn1_MIAV0_MIWT4_1_MO40_NTn1_NTA2_NTB2_NTC5_NTD5_NTM0_NEPBS14_NLCA1_NLCB1_ONLL1_PGR2_PLR1_PKA1_SIA3_SS1_SU0_SUM0_SUS256_SPO0_SRVW0_SSO0_SVW4_SK3_SKXCCM0_TLDS1_ULSGRO0_USL1_UIOFGRO0_USFGRO1_VSn1_VWA4_VWB1_WSGRA0_WSGRB0_WS64_WG16_16_1_WGM24_WGMXCC8_WGMXCCGn1
    SolutionIndex: 242
    SolutionNameMin: Cijk_Alik_Bljk_BBS_BH_Bias_HAS_SAV_UserArgs_MT64x96x128_MI16x16x1_SN_LDSB0_AFC0_AFEM1_AFEM1_ASEM1_CLR1_CADS0_DTLA0_DTLB0_DTVA0_DTVB0_EPS0_FDSI0_GRPM1_GRVWA8_GRVWB8_GSU0_GSUAMB_GSUC0_GSUWGMRR0_GLS0_ISA950_IU1_K1_LBSPPA512_LBSPPB256_LBSPPM0_LPA16_LPB16_LPM0_LRVW8_LWPMn1_MIAV0_MIWT2_3_MO40_NTn1_NTA0_NTB2_NTC0_NTD4_NTM0_NEPBS0_NLCA1_NLCB1_ONLL1_PGR2_PLR1_PKA1_SIA3_SS1_SU8_SUM0_SUS256_SPO0_SRVW0_SSO0_SVW2_SK3_SKXCCM4_TLDS1_ULSGRO0_USL1_UIOFGRO0_USFGRO1_VSn1_VWA2_VWB1_WSGRA0_WSGRB0_WS64_WG32_8_1_WGM0_WGMXCC4_WGMXCCGn1
    SolutionIndex: 243
    SolutionNameMin: Cijk_Alik_Bljk_BBS_BH_Bias_HAS_SAV_UserArgs_MT96x128x128_MI16x16x1_SN_LDSB0_AFC0_AFEM1_AFEM1_ASEM1_CLR0_CADS0_DTLA0_DTLB0_DTVA0_DTVB0_EPS0_FDSI0_GRPM1_GRVWA8_GRVWB8_GSU0_GSUAMB_GSUC0_GSUWGMRR0_GLS0_ISA950_IU1_K1_LBSPPA512_LBSPPB512_LBSPPM0_LPA16_LPB16_LPM0_LRVW8_LWPMn1_MIAV1_MIWT6_2_MO40_NTn1_NTA3_NTB1_NTC1_NTD3_NTM0_NEPBS0_NLCA1_NLCB1_ONLL1_PGR2_PLR1_PKA1_SIA3_SS1_SU0_SUM0_SUS256_SPO0_SRVW0_SSO0_SVW2_SK3_SKXCCM0_TLDS1_ULSGRO0_USL1_UIOFGRO0_USFGRO0_VSn1_VWA2_VWB2_WSGRA0_WSGRB0_WS64_WG16_16_1_WGM6_WGMXCC4_WGMXCCGn1
    SolutionIndex: 244
    SolutionNameMin: Cijk_Alik_Bljk_BBS_BH_Bias_HAS_SAV_UserArgs_MT64x96x128_MI16x16x1_SN_LDSB0_AFC0_AFEM1_AFEM1_ASEM1_CLR0_CADS0_DTLA0_DTLB0_DTVA0_DTVB0_EPS0_FDSI0_GRPM1_GRVWA8_GRVWB8_GSU0_GSUAMB_GSUC0_GSUWGMRR0_GLS0_ISA950_IU1_K1_LBSPPA512_LBSPPB256_LBSPPM0_LPA16_LPB16_LPM0_LRVW8_LWPMn1_MIAV0_MIWT2_3_MO40_NTn1_NTA3_NTB3_NTC0_NTD5_NTM0_NEPBS0_NLCA1_NLCB1_ONLL1_PGR2_PLR1_PKA1_SIA3_SS1_SU0_SUM0_SUS256_SPO1_SRVW0_SSO1_SVW2_SK3_SKXCCM5_TLDS2_ULSGRO0_USL1_UIOFGRO0_USFGRO0_VSn1_VWA2_VWB1_WSGRA0_WSGRB0_WS64_WG32_8_1_WGM1_WGMXCC16_WGMXCCGn1
    SolutionIndex: 245
    SolutionNameMin: Cijk_Alik_Bljk_BBS_BH_Bias_HAS_SAV_UserArgs_MT64x128x128_MI32x32x1_SN_LDSB0_AFC0_AFEM1_AFEM1_ASEM1_CLR1_CADS0_DTLA0_DTLB0_DTVA0_DTVB0_EPS0_FDSI0_GRPM1_GRVWA8_GRVWB8_GSU0_GSUAMB_GSUC0_GSUWGMRR0_GLS0_ISA950_IU1_K1_LBSPPA512_LBSPPB256_LBSPPM0_LPA8_LPB8_LPM0_LRVW8_LWPMn1_MIAV0_MIWT2_1_MO40_NTn1_NTA1_NTB0_NTC5_NTD5_NTM0_NEPBS16_NLCA1_NLCB1_ONLL1_PGR2_PLR1_PKA1_SIA3_SS1_SU0_SUM0_SUS256_SPO1_SRVW0_SSO0_SVW2_SK3_SKXCCM5_TLDS2_ULSGRO0_USL1_UIOFGRO0_USFGROn1_VSn1_VWA2_VWB1_WSGRA0_WSGRB0_WS64_WG32_8_1_WGM1_WGMXCC8_WGMXCCGn1
    SolutionIndex: 246
    SolutionNameMin: Cijk_Alik_Bljk_BBS_BH_Bias_HAS_SAV_UserArgs_MT128x128x128_MI16x16x1_SN_LDSB0_AFC0_AFEM1_AFEM1_ASEM1_CLR0_CADS0_DTLA0_DTLB0_DTVA0_DTVB0_EPS0_FDSI0_GRPM1_GRVWA8_GRVWB8_GSU0_GSUAMB_GSUC0_GSUWGMRR0_GLS0_ISA950_IU1_K1_LBSPPA1024_LBSPPB1024_LBSPPM0_LPA16_LPB16_LPM0_LRVW8_LWPMn1_MIAV0_MIWT4_4_MO40_NTn1_NTA1_NTB3_NTC5_NTD1_NTM0_NEPBS0_NLCA1_NLCB1_ONLL1_PGR2_PLR1_PKA1_SIA3_SS1_SU0_SUM0_SUS256_SPO0_SRVW0_SSO0_SVW4_SK3_SKXCCM5_TLDS2_ULSGRO0_USL1_UIOFGRO0_USFGRO0_VSn1_VWA4_VWB4_WSGRA0_WSGRB0_WS64_WG32_8_1_WGM1_WGMXCC8_WGMXCCGn1
    SolutionIndex: 247
    SolutionNameMin: Cijk_Alik_Bljk_BBS_BH_Bias_HAS_SAV_UserArgs_MT64x64x64_MI16x16x1_SN_LDSB0_AFC0_AFEM1_AFEM1_ASEM1_CLR0_CADS0_DTLA1_DTLB1_DTVA0_DTVB0_EPS0_FDSI0_GRPM1_GRVWA2_GRVWB8_GSU0_GSUAMB_GSUC0_GSUWGMRR0_GLS0_ISA950_IU1_K1_LBSPPA512_LBSPPB1024_LBSPPM0_LPA16_LPB16_LPM0_LRVW8_LWPMn1_MIAV0_MIWT4_1_MO40_NTn1_NTA3_NTB0_NTC7_NTD5_NTM0_NEPBS8_NLCA1_NLCB1_ONLL1_PGR2_PLR1_PKA1_SIA3_SS1_SU8_SUM0_SUS128_SPO1_SRVW0_SSO1_SVW4_SK3_SKXCCM8_TLDS1_ULSGRO0_USL1_UIOFGRO0_USFGRO0_VSn1_VWA4_VWB1_WSGRA0_WSGRB0_WS64_WG16_16_1_WGM24_WGMXCC1_WGMXCCGn1
    SolutionIndex: 248
    SolutionNameMin: Cijk_Alik_Bljk_BBS_BH_Bias_HAS_SAV_UserArgs_MT64x160x128_MI16x16x1_SN_LDSB0_AFC0_AFEM1_AFEM1_ASEM1_CLR0_CADS0_DTLA0_DTLB0_DTVA0_DTVB0_EPS0_FDSI0_GRPM1_GRVWA8_GRVWB8_GSU0_GSUAMB_GSUC0_GSUWGMRR0_GLS0_ISA950_IU1_K1_LBSPPA512_LBSPPB256_LBSPPM0_LPA16_LPB16_LPM0_LRVW8_LWPMn1_MIAV0_MIWT2_5_MO40_NTn1_NTA2_NTB0_NTC0_NTD5_NTM0_NEPBS0_NLCA1_NLCB1_ONLL1_PGR2_PLR1_PKA1_SIA3_SS1_SU0_SUM0_SUS256_SPO0_SRVW0_SSO0_SVW2_SK3_SKXCCM5_TLDS2_ULSGRO0_USL1_UIOFGRO0_USFGRO1_VSn1_VWA2_VWB1_WSGRA0_WSGRB0_WS64_WG32_8_1_WGM0_WGMXCC8_WGMXCCGn1
    SolutionIndex: 249
    SolutionNameMin: Cijk_Alik_Bljk_BBS_BH_Bias_HAS_SAV_UserArgs_MT64x160x128_MI16x16x1_SN_LDSB0_AFC0_AFEM1_AFEM1_ASEM1_CLR1_CADS0_DTLA0_DTLB0_DTVA0_DTVB0_EPS0_FDSI0_GRPM1_GRVWA8_GRVWB8_GSU0_GSUAMB_GSUC0_GSUWGMRR0_GLS0_ISA950_IU1_K1_LBSPPA512_LBSPPB256_LBSPPM0_LPA16_LPB16_LPM0_LRVW8_LWPMn1_MIAV0_MIWT2_5_MO40_NTn1_NTA3_NTB1_NTC0_NTD5_NTM0_NEPBS0_NLCA1_NLCB1_ONLL1_PGR2_PLR1_PKA1_SIA3_SS1_SU8_SUM0_SUS256_SPO0_SRVW0_SSO0_SVW2_SK3_SKXCCM5_TLDS1_ULSGRO0_USL1_UIOFGRO0_USFGRO1_VSn1_VWA2_VWB1_WSGRA0_WSGRB0_WS64_WG32_8_1_WGM1_WGMXCC8_WGMXCCGn1
    SolutionIndex: 250
    SolutionNameMin: Cijk_Alik_Bljk_BBS_BH_Bias_HAS_SAV_UserArgs_MT64x192x128_MI16x16x1_SN_LDSB0_AFC0_AFEM1_AFEM1_ASEM1_CLR0_CADS0_DTLA0_DTLB0_DTVA0_DTVB0_EPS0_FDSI0_GRPM1_GRVWA8_GRVWB8_GSU0_GSUAMB_GSUC0_GSUWGMRR0_GLS0_ISA950_IU1_K1_LBSPPA1024_LBSPPB256_LBSPPM0_LPA16_LPB16_LPM0_LRVW8_LWPMn1_MIAV0_MIWT4_3_MO40_NTn1_NTA0_NTB0_NTC5_NTD7_NTM0_NEPBS16_NLCA1_NLCB1_ONLL1_PGR2_PLR1_PKA1_SIA3_SS1_SU8_SUM0_SUS256_SPO0_SRVW0_SSO0_SVW4_SK3_SKXCCM5_TLDS2_ULSGRO0_USL1_UIOFGRO0_USFGROn1_VSn1_VWA4_VWB1_WSGRA0_WSGRB0_WS64_WG16_16_1_WGM1_WGMXCC8_WGMXCCGn1
    SolutionIndex: 251
    SolutionNameMin: Cijk_Alik_Bljk_BBS_BH_Bias_HAS_SAV_UserArgs_MT64x192x128_MI16x16x1_SN_LDSB0_AFC0_AFEM1_AFEM1_ASEM1_CLR0_CADS0_DTLA0_DTLB0_DTVA0_DTVB0_EPS0_FDSI0_GRPM1_GRVWA8_GRVWB8_GSU0_GSUAMB_GSUC0_GSUWGMRR0_GLS0_ISA950_IU1_K1_LBSPPA1024_LBSPPB256_LBSPPM0_LPA16_LPB16_LPM0_LRVW8_LWPMn1_MIAV0_MIWT4_3_MO40_NTn1_NTA1_NTB2_NTC5_NTD7_NTM0_NEPBS16_NLCA1_NLCB1_ONLL1_PGR2_PLR1_PKA1_SIA3_SS1_SU8_SUM0_SUS256_SPO0_SRVW0_SSO0_SVW4_SK3_SKXCCM0_TLDS1_ULSGRO0_USL1_UIOFGRO0_USFGROn1_VSn1_VWA4_VWB1_WSGRA0_WSGRB0_WS64_WG16_16_1_WGM48_WGMXCC8_WGMXCCGn1
    SolutionIndex: 252
    SolutionNameMin: Cijk_Alik_Bljk_BBS_BH_Bias_HAS_SAV_UserArgs_MT96x128x128_MI16x16x1_SN_LDSB0_AFC0_AFEM1_AFEM1_ASEM1_CLR1_CADS0_DTLA0_DTLB0_DTVA0_DTVB0_EPS0_FDSI0_GRPM1_GRVWA8_GRVWB8_GSU1_GSUAMB_GSUC0_GSUWGMRR0_GLS0_ISA950_IU1_K1_LBSPPA512_LBSPPB512_LBSPPM0_LPA16_LPB16_LPM0_LRVW8_LWPMn1_MIAV0_MIWT6_2_MO40_NTn1_NTA1_NTB1_NTC1_NTD5_NTM0_NEPBS0_NLCA1_NLCB1_ONLL1_PGR2_PLR1_PKA1_SIA3_SS1_SU8_SUM0_SUS256_SPO0_SRVW0_SSO0_SVW2_SK0_SKXCCM0_TLDS1_ULSGRO0_USL1_UIOFGRO0_USFGROn1_VSn1_VWA2_VWB2_WSGRA0_WSGRB0_WS64_WG16_16_1_WGM1_WGMXCC16_WGMXCCGn1
    SolutionIndex: 253
    SolutionNameMin: Cijk_Alik_Bljk_BBS_BH_Bias_HAS_SAV_UserArgs_MT128x112x128_MI16x16x1_SN_LDSB0_AFC0_AFEM1_AFEM1_ASEM1_CLR1_CADS0_DTLA0_DTLB0_DTVA0_DTVB0_EPS0_FDSI0_GRPM1_GRVWA8_GRVWB8_GSU0_GSUAMB_GSUC0_GSUWGMRR0_GLS0_ISA950_IU1_K1_LBSPPA512_LBSPPB256_LBSPPM0_LPA16_LPB16_LPM0_LRVW8_LWPMn1_MIAV0_MIWT2_7_MO40_NTn1_NTA0_NTB3_NTC0_NTD4_NTM0_NEPBS0_NLCA1_NLCB1_ONLL1_PGR2_PLR1_PKA1_SIA3_SS1_SU16_SUM0_SUS256_SPO0_SRVW0_SSO0_SVW2_SK3_SKXCCM8_TLDS1_ULSGRO0_USL1_UIOFGRO0_USFGRO0_VSn1_VWA2_VWB1_WSGRA0_WSGRB0_WS64_WG64_4_1_WGM8_WGMXCC1_WGMXCCGn1
    SolutionIndex: 254
    SolutionNameMin: Cijk_Alik_Bljk_BBS_BH_Bias_HAS_SAV_UserArgs_MT192x256x64_MI16x16x1_SN_LDSB0_AFC0_AFEM1_AFEM1_ASEM1_CLR0_CADS0_DTLA1_DTLB1_DTVA0_DTVB0_EPS0_FDSI0_GRPM1_GRVWA2_GRVWB8_GSU0_GSUAMB_GSUC0_GSUWGMRR0_GLS0_ISA950_IU1_K1_LBSPPA512_LBSPPB1024_LBSPPM0_LPA16_LPB16_LPM0_LRVW8_LWPMn1_MIAV0_MIWT12_4_MO40_NTn1_NTA0_NTB2_NTC6_NTD7_NTM0_NEPBS0_NLCA1_NLCB1_ONLL1_PGR2_PLR1_PKA1_SIA3_SS1_SU8_SUM0_SUS128_SPO0_SRVW0_SSO1_SVW4_SK3_SKXCCM0_TLDS1_ULSGRO0_USL1_UIOFGRO0_USFGRO0_VSn1_VWA4_VWB4_WSGRA0_WSGRB0_WS64_WG16_16_1_WGM8_WGMXCC4_WGMXCCGn1
    SolutionIndex: 255
    SolutionNameMin: Cijk_Alik_Bljk_BBS_BH_Bias_HAS_SAV_UserArgs_MT192x320x64_MI16x16x1_SN_LDSB0_AFC0_AFEM1_AFEM1_ASEM1_CLR1_CADS0_DTLA1_DTLB1_DTVA0_DTVB0_EPS0_FDSI0_GRPM1_GRVWA2_GRVWB8_GSU0_GSUAMB_GSUC0_GSUWGMRR0_GLS0_ISA950_IU1_K1_LBSPPA512_LBSPPB1024_LBSPPM0_LPA16_LPB16_LPM0_LRVW8_LWPMn1_MIAV0_MIWT12_5_MO40_NTn1_NTA3_NTB0_NTC5_NTD2_NTM0_NEPBS16_NLCA1_NLCB1_ONLL1_PGR2_PLR1_PKA1_SIA3_SS1_SU16_SUM0_SUS128_SPO0_SRVW0_SSO0_SVW4_SK3_SKXCCM4_TLDS1_ULSGRO0_USL1_UIOFGRO0_USFGRO0_VSn1_VWA4_VWB1_WSGRA0_WSGRB0_WS64_WG16_16_1_WGM1_WGMXCC1_WGMXCCGn1
    SolutionIndex: 256
    SolutionNameMin: Cijk_Alik_Bljk_BBS_BH_Bias_HAS_SAV_UserArgs_MT192x128x64_MI16x16x1_SN_LDSB1_AFC0_AFEM1_AFEM1_ASEM1_CLR1_CADS0_DTLA0_DTLB0_DTVA0_DTVB0_EPS0_FDSI0_GRPM1_GRVWA8_GRVWB8_GSU0_GSUAMB_GSUC0_GSUWGMRR0_GLS0_ISA950_IU1_K1_LBSPPA512_LBSPPB256_LBSPPM0_LPA16_LPB16_LPM0_LRVW8_LWPMn1_MIAV0_MIWT12_2_MO40_NTn1_NTA2_NTB0_NTC5_NTD6_NTM0_NEPBS14_NLCA1_NLCB1_ONLL1_PGR2_PLR1_PKA1_SIA3_SS1_SU16_SUM0_SUS128_SPO0_SRVW0_SSO4_SVW4_SK3_SKXCCM0_TLDS1_ULSGRO0_USL1_UIOFGRO0_USFGRO1_VSn1_VWA4_VWB2_WSGRA0_WSGRB0_WS64_WG16_16_1_WGM0_WGMXCC8_WGMXCCGn1
    SolutionIndex: 257
    SolutionNameMin: Cijk_Alik_Bljk_BBS_BH_Bias_HAS_SAV_UserArgs_MT64x64x64_MI16x16x1_SN_LDSB0_AFC0_AFEM1_AFEM1_ASEM1_CLR0_CADS0_DTLA1_DTLB1_DTVA0_DTVB0_EPS0_FDSI0_GRPM1_GRVWA8_GRVWB8_GSU0_GSUAMB_GSUC0_GSUWGMRR0_GLS0_ISA950_IU1_K1_LBSPPA1024_LBSPPB1024_LBSPPM0_LPA16_LPB16_LPM0_LRVW8_LWPMn1_MIAV1_MIWT4_2_MO40_NTn1_NTA4_NTB0_NTC2_NTD2_NTM0_NEPBS14_NLCA1_NLCB1_ONLL1_PGR2_PLR1_PKA1_SIA3_SS1_SU0_SUM0_SUS128_SPO0_SRVW0_SSO0_SVW4_SK3_SKXCCM0_TLDS2_ULSGRO0_USL1_UIOFGRO0_USFGROn1_VSn1_VWA4_VWB2_WSGRA0_WSGRB0_WS64_WG16_8_1_WGM0_WGMXCC16_WGMXCCGn1
    SolutionIndex: 258
    SolutionNameMin: Cijk_Alik_Bljk_BBS_BH_Bias_HAS_SAV_UserArgs_MT64x128x64_MI16x16x1_SN_LDSB0_AFC0_AFEM1_AFEM1_ASEM1_CLR1_CADS0_DTLA1_DTLB1_DTVA0_DTVB0_EPS0_FDSI0_GRPM1_GRVWA2_GRVWB2_GSU0_GSUAMB_GSUC0_GSUWGMRR0_GLS0_ISA950_IU1_K1_LBSPPA512_LBSPPB256_LBSPPM0_LPA16_LPB16_LPM0_LRVW8_LWPMn1_MIAV1_MIWT4_2_MO40_NTn1_NTA4_NTB2_NTC2_NTD2_NTM0_NEPBS0_NLCA1_NLCB1_ONLL1_PGR2_PLR1_PKA1_SIA3_SS1_SU8_SUM0_SUS128_SPO0_SRVW0_SSO0_SVW4_SK3_SKXCCM5_TLDS2_ULSGRO0_USL1_UIOFGRO0_USFGRO0_VSn1_VWA4_VWB2_WSGRA0_WSGRB0_WS64_WG16_16_1_WGM0_WGMXCC8_WGMXCCGn1
    SolutionIndex: 259
    SolutionNameMin: Cijk_Alik_Bljk_BBS_BH_Bias_HAS_SAV_UserArgs_MT128x96x64_MI16x16x1_SN_LDSB0_AFC0_AFEM1_AFEM1_ASEM1_CLR0_CADS0_DTLA1_DTLB1_DTVA0_DTVB0_EPS0_FDSI0_GRPM1_GRVWA8_GRVWB8_GSU0_GSUAMB_GSUC0_GSUWGMRR0_GLS0_ISA950_IU1_K1_LBSPPA1024_LBSPPB1024_LBSPPM0_LPA16_LPB16_LPM0_LRVW8_LWPMn1_MIAV1_MIWT4_3_MO40_NTn1_NTA7_NTB2_NTC1_NTD3_NTM0_NEPBS16_NLCA1_NLCB1_ONLL1_PGR2_PLR1_PKA1_SIA3_SS1_SU0_SUM0_SUS128_SPO0_SRVW0_SSO0_SVW4_SK3_SKXCCM5_TLDS2_ULSGRO0_USL1_UIOFGRO0_USFGROn1_VSn1_VWA4_VWB1_WSGRA0_WSGRB0_WS64_WG32_8_1_WGM0_WGMXCC16_WGMXCCGn1
    SolutionIndex: 260
    SolutionNameMin: Cijk_Alik_Bljk_BBS_BH_Bias_HAS_SAV_UserArgs_MT128x128x64_MI16x16x1_SN_LDSB0_AFC0_AFEM1_AFEM1_ASEM1_CLR1_CADS0_DTLA1_DTLB1_DTVA0_DTVB0_EPS0_FDSI0_GRPM1_GRVWA8_GRVWB8_GSU0_GSUAMB_GSUC0_GSUWGMRR0_GLS0_ISA950_IU1_K1_LBSPPA1024_LBSPPB1024_LBSPPM0_LPA16_LPB16_LPM0_LRVW8_LWPMn1_MIAV1_MIWT4_4_MO40_NTn1_NTA4_NTB2_NTC0_NTD3_NTM0_NEPBS0_NLCA1_NLCB1_ONLL1_PGR2_PLR1_PKA1_SIA3_SS1_SU0_SUM0_SUS128_SPO0_SRVW0_SSO0_SVW4_SK3_SKXCCM5_TLDS1_ULSGRO0_USL1_UIOFGRO0_USFGRO1_VSn1_VWA4_VWB4_WSGRA0_WSGRB0_WS64_WG32_8_1_WGM0_WGMXCC16_WGMXCCGn1
    SolutionIndex: 261
    SolutionNameMin: Cijk_Alik_Bljk_BBS_BH_Bias_HAS_SAV_UserArgs_MT128x192x64_MI16x16x1_SN_LDSB0_AFC0_AFEM1_AFEM1_ASEM1_CLR0_CADS0_DTLA0_DTLB0_DTVA0_DTVB0_EPS0_FDSI0_GRPM1_GRVWA8_GRVWB8_GSU0_GSUAMB_GSUC0_GSUWGMRR0_GLS0_ISA950_IU1_K1_LBSPPA512_LBSPPB256_LBSPPM0_LPA16_LPB16_LPM0_LRVW8_LWPMn1_MIAV0_MIWT4_6_MO40_NTn1_NTA5_NTB3_NTC6_NTD0_NTM0_NEPBS0_NLCA1_NLCB1_ONLL1_PGR2_PLR1_PKA1_SIA3_SS1_SU0_SUM0_SUS128_SPO0_SRVW0_SSO0_SVW4_SK3_SKXCCM5_TLDS2_ULSGRO0_USL1_UIOFGRO0_USFGRO0_VSn1_VWA4_VWB2_WSGRA0_WSGRB0_WS64_WG32_8_1_WGM1_WGMXCC16_WGMXCCGn1
    SolutionIndex: 262
    SolutionNameMin: Cijk_Alik_Bljk_BBS_BH_Bias_HAS_SAV_UserArgs_MT64x192x64_MI16x16x1_SN_LDSB0_AFC0_AFEM1_AFEM1_ASEM1_CLR0_CADS0_DTLA1_DTLB1_DTVA0_DTVB0_EPS0_FDSI0_GRPM1_GRVWA2_GRVWB8_GSU0_GSUAMB_GSUC0_GSUWGMRR0_GLS0_ISA950_IU1_K1_LBSPPA512_LBSPPB1024_LBSPPM0_LPA16_LPB16_LPM0_LRVW8_LWPMn1_MIAV1_MIWT4_3_MO40_NTn1_NTA6_NTB3_NTC0_NTD6_NTM0_NEPBS0_NLCA1_NLCB1_ONLL1_PGR2_PLR1_PKA1_SIA3_SS1_SU0_SUM0_SUS128_SPO0_SRVW0_SSO0_SVW4_SK3_SKXCCM0_TLDS2_ULSGRO0_USL1_UIOFGRO0_USFGRO0_VSn1_VWA4_VWB1_WSGRA0_WSGRB0_WS64_WG16_16_1_WGM32_WGMXCC8_WGMXCCGn1
    SolutionIndex: 263
    SolutionNameMin: Cijk_Alik_Bljk_BBS_BH_Bias_HAS_SAV_UserArgs_MT128x128x64_MI32x32x1_SN_LDSB0_AFC0_AFEM1_AFEM1_ASEM1_CLR1_CADS0_DTLA0_DTLB0_DTVA0_DTVB0_EPS0_FDSI0_GRPM1_GRVWA8_GRVWB8_GSU0_GSUAMB_GSUC0_GSUWGMRR0_GLS0_ISA950_IU1_K1_LBSPPA256_LBSPPB256_LBSPPM0_LPA8_LPB8_LPM0_LRVW8_LWPMn1_MIAV0_MIWT2_2_MO40_NTn1_NTA2_NTB1_NTC3_NTD5_NTM0_NEPBS0_NLCA1_NLCB1_ONLL1_PGR2_PLR1_PKA1_SIA3_SS1_SU8_SUM0_SUS512_SPO1_SRVW0_SSO1_SVW2_SK3_SKXCCM0_TLDS1_ULSGRO0_USL1_UIOFGRO0_USFGRO1_VSn1_VWA2_VWB2_WSGRA0_WSGRB0_WS64_WG64_4_1_WGM6_WGMXCC8_WGMXCCGn1
    SolutionIndex: 264
    SolutionNameMin: Cijk_Alik_Bljk_BBS_BH_Bias_HAS_SAV_UserArgs_MT128x128x64_MI16x16x1_SN_LDSB0_AFC0_AFEM1_AFEM1_ASEM1_CLR0_CADS0_DTLA1_DTLB1_DTVA0_DTVB0_EPS0_FDSI0_GRPM1_GRVWA2_GRVWB8_GSU0_GSUAMB_GSUC0_GSUWGMRR0_GLS0_ISA950_IU1_K1_LBSPPA512_LBSPPB1024_LBSPPM0_LPA16_LPB16_LPM0_LRVW8_LWPMn1_MIAV0_MIWT4_4_MO40_NTn1_NTA2_NTB2_NTC6_NTD6_NTM0_NEPBS16_NLCA1_NLCB1_ONLL1_PGR2_PLR1_PKA1_SIA3_SS1_SU8_SUM0_SUS512_SPO1_SRVW0_SSO1_SVW4_SK3_SKXCCM0_TLDS1_ULSGRO0_USL1_UIOFGRO0_USFGRO0_VSn1_VWA4_VWB4_WSGRA0_WSGRB0_WS64_WG32_8_1_WGM8_WGMXCC8_WGMXCCGn1
    SolutionIndex: 265
    SolutionNameMin: Cijk_Alik_Bljk_BBS_BH_Bias_HAS_SAV_UserArgs_MT128x160x64_MI16x16x1_SN_LDSB0_AFC0_AFEM1_AFEM1_ASEM1_CLR0_CADS0_DTLA0_DTLB0_DTVA0_DTVB0_EPS0_FDSI0_GRPM1_GRVWA8_GRVWB8_GSU0_GSUAMB_GSUC0_GSUWGMRR0_GLS0_ISA950_IU1_K1_LBSPPA256_LBSPPB256_LBSPPM0_LPA16_LPB16_LPM0_LRVW8_LWPMn1_MIAV0_MIWT2_10_MO40_NTn1_NTA4_NTB2_NTC1_NTD4_NTM0_NEPBS0_NLCA1_NLCB1_ONLL1_PGR2_PLR1_PKA1_SIA3_SS1_SU0_SUM0_SUS128_SPO1_SRVW0_SSO4_SVW2_SK3_SKXCCM0_TLDS1_ULSGRO0_USL1_UIOFGRO0_USFGRO0_VSn1_VWA2_VWB2_WSGRA0_WSGRB0_WS64_WG64_4_1_WGM8_WGMXCC8_WGMXCCGn1
    SolutionIndex: 266
    SolutionNameMin: Cijk_Alik_Bljk_BBS_BH_Bias_HAS_SAV_UserArgs_MT128x192x64_MI16x16x1_SN_LDSB0_AFC0_AFEM1_AFEM1_ASEM1_CLR0_CADS0_DTLA1_DTLB1_DTVA0_DTVB0_EPS0_FDSI0_GRPM1_GRVWA8_GRVWB8_GSU0_GSUAMB_GSUC0_GSUWGMRR0_GLS0_ISA950_IU1_K1_LBSPPA1024_LBSPPB1024_LBSPPM0_LPA16_LPB16_LPM0_LRVW8_LWPMn1_MIAV0_MIWT8_3_MO40_NTn1_NTA7_NTB3_NTC4_NTD6_NTM0_NEPBS8_NLCA1_NLCB1_ONLL1_PGR2_PLR1_PKA1_SIA3_SS1_SU0_SUM0_SUS128_SPO0_SRVW0_SSO1_SVW8_SK3_SKXCCM0_TLDS2_ULSGRO0_USL1_UIOFGRO0_USFGROn1_VSn1_VWA8_VWB1_WSGRA0_WSGRB0_WS64_WG16_16_1_WGM8_WGMXCC8_WGMXCCGn1
    SolutionIndex: 267
    SolutionNameMin: Cijk_Alik_Bljk_BBS_BH_Bias_HAS_SAV_UserArgs_MT256x224x64_MI16x16x1_SN_LDSB1_AFC0_AFEM1_AFEM1_ASEM1_CLR0_CADS0_DTLA0_DTLB0_DTVA0_DTVB0_EPS0_FDSI0_GRPM1_GRVWA8_GRVWB8_GSU0_GSUAMB_GSUC0_GSUWGMRR0_GLS0_ISA950_IU1_K1_LBSPPA512_LBSPPB256_LBSPPM0_LPA16_LPB16_LPM0_LRVW8_LWPMn1_MIAV0_MIWT4_14_MO40_NTn1_NTA0_NTB3_NTC7_NTD6_NTM0_NEPBS16_NLCA1_NLCB1_ONLL1_PGR2_PLR1_PKA1_SIA3_SS1_SU8_SUM0_SUS128_SPO0_SRVW0_SSO4_SVW4_SK3_SKXCCM0_TLDS1_ULSGRO0_USL1_UIOFGRO0_USFGRO1_VSn1_VWA4_VWB2_WSGRA0_WSGRB0_WS64_WG64_4_1_WGM1_WGMXCC2_WGMXCCGn1
    SolutionIndex: 268
    SolutionNameMin: Cijk_Alik_Bljk_BBS_BH_Bias_HAS_SAV_UserArgs_MT128x16x64_MI16x16x1_SN_LDSB0_AFC0_AFEM1_AFEM1_ASEM1_CLR0_CADS0_DTLA1_DTLB1_DTVA0_DTVB0_EPS0_FDSI0_GRPM1_GRVWA8_GRVWB2_GSU0_GSUAMB_GSUC0_GSUWGMRR0_GLS0_ISA950_IU1_K1_LBSPPA1024_LBSPPB256_LBSPPM0_LPA16_LPB16_LPM0_LRVW8_LWPMn1_MIAV0_MIWT4_1_MO40_NTn1_NTA7_NTB0_NTC0_NTD0_NTM0_NEPBS4_NLCA1_NLCB1_ONLL1_PGR2_PLR1_PKA1_SIA3_SS1_SU8_SUM0_SUS128_SPO1_SRVW0_SSO0_SVW4_SK3_SKXCCM0_TLDS2_ULSGRO0_USL1_UIOFGRO0_USFGROn1_VSn1_VWA4_VWB1_WSGRA0_WSGRB0_WS64_WG32_4_1_WGM1_WGMXCC16_WGMXCCGn1
    SolutionIndex: 269
    SolutionNameMin: Cijk_Alik_Bljk_BBS_BH_Bias_HAS_SAV_UserArgs_MT112x32x64_MI16x16x1_SN_LDSB0_AFC0_AFEM1_AFEM1_ASEM1_CLR0_CADS0_DTLA1_DTLB1_DTVA0_DTVB0_EPS0_FDSI0_GRPM1_GRVWA8_GRVWB8_GSU0_GSUAMB_GSUC0_GSUWGMRR0_GLS0_ISA950_IU1_K1_LBSPPA1024_LBSPPB1024_LBSPPM0_LPA16_LPB16_LPM0_LRVW8_LWPMn1_MIAV1_MIWT7_1_MO40_NTn1_NTA1_NTB3_NTC3_NTD5_NTM0_NEPBS10_NLCA1_NLCB1_ONLL1_PGR2_PLR1_PKA1_SIA3_SS0_SU0_SUM0_SUS128_SPO0_SRVW0_SSO0_SVW4_SK3_SKXCCM0_TLDS2_ULSGRO0_USL1_UIOFGRO0_USFGROn1_VSn1_VWA1_VWB1_WSGRA0_WSGRB0_WS64_WG16_8_1_WGM1_WGMXCC8_WGMXCCGn1
    SolutionIndex: 270
    SolutionNameMin: Cijk_Alik_Bljk_BBS_BH_Bias_HAS_SAV_UserArgs_MT128x64x64_MI16x16x1_SN_LDSB0_AFC0_AFEM1_AFEM1_ASEM1_CLR0_CADS0_DTLA1_DTLB1_DTVA0_DTVB0_EPS0_FDSI0_GRPM1_GRVWA8_GRVWB2_GSU0_GSUAMB_GSUC0_GSUWGMRR0_GLS0_ISA950_IU1_K1_LBSPPA1024_LBSPPB256_LBSPPM0_LPA16_LPB16_LPM0_LRVW8_LWPMn1_MIAV1_MIWT8_1_MO40_NTn1_NTA6_NTB1_NTC1_NTD3_NTM0_NEPBS16_NLCA1_NLCB1_ONLL1_PGR2_PLR1_PKA1_SIA3_SS1_SU8_SUM0_SUS512_SPO1_SRVW0_SSO0_SVW8_SK3_SKXCCM8_TLDS1_ULSGRO0_USL1_UIOFGRO0_USFGROn1_VSn1_VWA8_VWB1_WSGRA0_WSGRB0_WS64_WG16_16_1_WGM0_WGMXCC32_WGMXCCGn1
    SolutionIndex: 271
    SolutionNameMin: Cijk_Alik_Bljk_BBS_BH_Bias_HAS_SAV_UserArgs_MT128x80x64_MI16x16x1_SN_LDSB0_AFC0_AFEM1_AFEM1_ASEM1_CLR1_CADS0_DTLA1_DTLB1_DTVA0_DTVB0_EPS0_FDSI0_GRPM1_GRVWA2_GRVWB2_GSU0_GSUAMB_GSUC0_GSUWGMRR0_GLS0_ISA950_IU1_K1_LBSPPA256_LBSPPB256_LBSPPM0_LPA16_LPB16_LPM0_LRVW8_LWPMn1_MIAV0_MIWT2_5_MO40_NTn1_NTA1_NTB3_NTC0_NTD4_NTM0_NEPBS0_NLCA1_NLCB1_ONLL1_PGR2_PLR1_PKA1_SIA3_SS1_SU16_SUM0_SUS256_SPO0_SRVW0_SSO0_SVW2_SK3_SKXCCM0_TLDS1_ULSGRO0_USL1_UIOFGRO0_USFGRO0_VSn1_VWA2_VWB1_WSGRA0_WSGRB0_WS64_WG64_4_1_WGM0_WGMXCC1_WGMXCCGn1
    SolutionIndex: 272
    SolutionNameMin: Cijk_Alik_Bljk_BBS_BH_Bias_HAS_SAV_UserArgs_MT112x128x64_MI16x16x1_SN_LDSB0_AFC0_AFEM1_AFEM1_ASEM1_CLR0_CADS0_DTLA1_DTLB1_DTVA0_DTVB0_EPS0_FDSI0_GRPM1_GRVWA2_GRVWB8_GSU0_GSUAMB_GSUC0_GSUWGMRR0_GLS0_ISA950_IU1_K1_LBSPPA256_LBSPPB1024_LBSPPM0_LPA16_LPB16_LPM0_LRVW8_LWPMn1_MIAV0_MIWT7_2_MO40_NTn1_NTA1_NTB2_NTC1_NTD5_NTM0_NEPBS0_NLCA1_NLCB1_ONLL1_PGR2_PLR1_PKA1_SIA3_SS1_SU8_SUM0_SUS128_SPO1_SRVW0_SSO0_SVW1_SK3_SKXCCM8_TLDS2_ULSGRO0_USL1_UIOFGRO0_USFGRO0_VSn1_VWA1_VWB2_WSGRA0_WSGRB0_WS64_WG16_16_1_WGM0_WGMXCC1_WGMXCCGn1
    SolutionIndex: 273
    SolutionNameMin: Cijk_Alik_Bljk_BBS_BH_Bias_HAS_SAV_UserArgs_MT448x16x64_MI16x16x1_SN_LDSB1_AFC0_AFEM1_AFEM1_ASEM1_CLR1_CADS0_DTLA0_DTLB0_DTVA0_DTVB0_EPS0_FDSI0_GRPM1_GRVWA8_GRVWB4_GSU0_GSUAMB_GSUC0_GSUWGMRR0_GLS0_ISA950_IU1_K1_LBSPPA128_LBSPPB128_LBSPPM0_LPA16_LPB16_LPM0_LRVW8_LWPMn1_MIAV0_MIWT7_1_MO40_NTn1_NTA6_NTB2_NTC0_NTD1_NTM0_NEPBS0_NLCA1_NLCB1_ONLL1_PGR2_PLR1_PKA1_SIA3_SS1_SU8_SUM0_SUS512_SPO1_SRVW0_SSO0_SVW1_SK3_SKXCCM0_TLDS1_ULSGRO0_USL1_UIOFGRO0_USFGRO1_VSn1_VWA1_VWB1_WSGRA0_WSGRB0_WS64_WG64_4_1_WGM1_WGMXCC2_WGMXCCGn1
    SolutionIndex: 274
    SolutionNameMin: Cijk_Alik_Bljk_BBS_BH_Bias_HAS_SAV_UserArgs_MT416x32x64_MI16x16x1_SN_LDSB0_AFC0_AFEM1_AFEM1_ASEM1_CLR1_CADS0_DTLA1_DTLB1_DTVA0_DTVB0_EPS0_FDSI0_GRPM1_GRVWA8_GRVWB8_GSU0_GSUAMB_GSUC0_GSUWGMRR0_GLS0_ISA950_IU1_K1_LBSPPA1024_LBSPPB1024_LBSPPM0_LPA16_LPB16_LPM0_LRVW8_LWPMn1_MIAV1_MIWT13_1_MO40_NTn1_NTA6_NTB0_NTC0_NTD5_NTM0_NEPBS0_NLCA1_NLCB1_ONLL1_PGR2_PLR1_PKA1_SIA3_SS1_SU16_SUM0_SUS128_SPO0_SRVW0_SSO4_SVW1_SK3_SKXCCM0_TLDS1_ULSGRO0_USL1_UIOFGRO0_USFGROn1_VSn1_VWA1_VWB1_WSGRA0_WSGRB0_WS64_WG32_8_1_WGM24_WGMXCC32_WGMXCCGn1
    SolutionIndex: 275
    SolutionNameMin: Cijk_Alik_Bljk_BBS_BH_Bias_HAS_SAV_UserArgs_MT448x80x64_MI16x16x1_SN_LDSB1_AFC0_AFEM1_AFEM1_ASEM1_CLR0_CADS0_DTLA0_DTLB0_DTVA0_DTVB0_EPS0_FDSI0_GRPM1_GRVWA8_GRVWB4_GSU0_GSUAMB_GSUC0_GSUWGMRR0_GLS0_ISA950_IU1_K1_LBSPPA128_LBSPPB128_LBSPPM0_LPA16_LPB16_LPM0_LRVW8_LWPMn1_MIAV0_MIWT7_5_MO40_NTn1_NTA5_NTB2_NTC1_NTD4_NTM0_NEPBS0_NLCA1_NLCB1_ONLL1_PGR2_PLR1_PKA1_SIA3_SS1_SU0_SUM0_SUS128_SPO1_SRVW0_SSO1_SVW1_SK3_SKXCCM8_TLDS1_ULSGRO0_USL1_UIOFGRO0_USFGRO0_VSn1_VWA1_VWB1_WSGRA0_WSGRB0_WS64_WG64_4_1_WGM2_WGMXCC8_WGMXCCGn1
    SolutionIndex: 276
    SolutionNameMin: Cijk_Alik_Bljk_BBS_BH_Bias_HAS_SAV_UserArgs_MT16x16x64_MI16x16x1_SN_LDSB0_AFC0_AFEM1_AFEM1_ASEM1_CLR0_CADS0_DTLA1_DTLB1_DTVA0_DTVB0_EPS0_FDSI0_GRPM1_GRVWA8_GRVWB8_GSU0_GSUAMB_GSUC0_GSUWGMRR0_GLS0_ISA950_IU1_K1_LBSPPA1024_LBSPPB1024_LBSPPM0_LPA16_LPB16_LPM0_LRVW8_LWPMn1_MIAV1_MIWT1_1_MO40_NTn1_NTA2_NTB2_NTC0_NTD3_NTM0_NEPBS14_NLCA1_NLCB1_ONLL1_PGR2_PLR0_PKA1_SIA3_SS1_SU0_SUM0_SUS128_SPO0_SRVW0_SSO0_SVW1_SK3_SKXCCM0_TLDS1_ULSGRO0_USL1_UIOFGRO0_USFGROn1_VSn1_VWA1_VWB1_WSGRA0_WSGRB0_WS64_WG16_4_2_WGM1_WGMXCC2_WGMXCCGn1
    SolutionIndex: 277
    SolutionNameMin: Cijk_Alik_Bljk_BBS_BH_Bias_HAS_SAV_UserArgs_MT16x16x64_MI16x16x1_SN_LDSB0_AFC0_AFEM1_AFEM1_ASEM1_CLR1_CADS0_DTLA1_DTLB1_DTVA0_DTVB0_EPS0_FDSI0_GRPM1_GRVWA8_GRVWB8_GSU0_GSUAMB_GSUC0_GSUWGMRR0_GLS0_ISA950_IU1_K1_LBSPPA1024_LBSPPB1024_LBSPPM0_LPA16_LPB16_LPM0_LRVW8_LWPMn1_MIAV0_MIWT1_1_MO40_NTn1_NTA0_NTB2_NTC0_NTD3_NTM0_NEPBS12_NLCA1_NLCB1_ONLL1_PGR2_PLR1_PKA1_SIA3_SS0_SU0_SUM0_SUS128_SPO0_SRVW0_SSO0_SVW4_SK3_SKXCCM0_TLDS1_ULSGRO0_USL1_UIOFGRO0_USFGROn1_VSn1_VWA1_VWB1_WSGRA0_WSGRB0_WS64_WG16_4_1_WGM1_WGMXCC16_WGMXCCGn1
    SolutionIndex: 278
    SolutionNameMin: Cijk_Alik_Bljk_BBS_BH_Bias_HAS_SAV_UserArgs_MT16x32x64_MI16x16x1_SN_LDSB0_AFC0_AFEM1_AFEM1_ASEM1_CLR0_CADS0_DTLA1_DTLB1_DTVA0_DTVB0_EPS0_FDSI0_GRPM1_GRVWA8_GRVWB8_GSU0_GSUAMB_GSUC0_GSUWGMRR0_GLS0_ISA950_IU1_K1_LBSPPA1024_LBSPPB1024_LBSPPM0_LPA16_LPB16_LPM0_LRVW8_LWPMn1_MIAV1_MIWT1_2_MO40_NTn1_NTA3_NTB2_NTC2_NTD3_NTM0_NEPBS8_NLCA1_NLCB1_ONLL1_PGR2_PLR1_PKA1_SIA3_SS1_SU0_SUM0_SUS128_SPO0_SRVW0_SSO0_SVW1_SK3_SKXCCM0_TLDS1_ULSGRO0_USL1_UIOFGRO0_USFGROn1_VSn1_VWA1_VWB2_WSGRA0_WSGRB0_WS64_WG16_4_2_WGM0_WGMXCC4_WGMXCCGn1
    SolutionIndex: 279
    SolutionNameMin: Cijk_Alik_Bljk_BBS_BH_Bias_HAS_SAV_UserArgs_MT16x32x64_MI16x16x1_SN_LDSB0_AFC0_AFEM1_AFEM1_ASEM1_CLR1_CADS0_DTLA1_DTLB1_DTVA0_DTVB0_EPS0_FDSI0_GRPM1_GRVWA8_GRVWB8_GSU0_GSUAMB_GSUC0_GSUWGMRR0_GLS0_ISA950_IU1_K1_LBSPPA1024_LBSPPB1024_LBSPPM0_LPA16_LPB16_LPM0_LRVW8_LWPMn1_MIAV0_MIWT1_1_MO40_NTn1_NTA2_NTB3_NTC2_NTD3_NTM0_NEPBS10_NLCA1_NLCB1_ONLL1_PGR2_PLR1_PKA1_SIA3_SS1_SU0_SUM0_SUS128_SPO0_SRVW0_SSO0_SVW1_SK3_SKXCCM7_TLDS1_ULSGRO0_USL1_UIOFGRO0_USFGROn1_VSn1_VWA1_VWB1_WSGRA0_WSGRB0_WS64_WG16_8_1_WGM1_WGMXCC2_WGMXCCGn1
    SolutionIndex: 280
    SolutionNameMin: Cijk_Alik_Bljk_BBS_BH_Bias_HAS_SAV_UserArgs_MT32x16x64_MI16x16x1_SN_LDSB0_AFC0_AFEM1_AFEM1_ASEM1_CLR0_CADS0_DTLA1_DTLB1_DTVA0_DTVB0_EPS0_FDSI0_GRPM1_GRVWA8_GRVWB8_GSU0_GSUAMB_GSUC0_GSUWGMRR0_GLS0_ISA950_IU1_K1_LBSPPA1024_LBSPPB1024_LBSPPM0_LPA16_LPB16_LPM0_LRVW8_LWPMn1_MIAV0_MIWT1_1_MO40_NTn1_NTA2_NTB1_NTC3_NTD0_NTM0_NEPBS16_NLCA1_NLCB1_ONLL1_PGR2_PLR1_PKA1_SIA3_SS1_SU0_SUM0_SUS128_SPO0_SRVW0_SSO0_SVW1_SK3_SKXCCM8_TLDS1_ULSGRO0_USL1_UIOFGRO0_USFGROn1_VSn1_VWA1_VWB1_WSGRA0_WSGRB0_WS64_WG32_4_1_WGM1_WGMXCC2_WGMXCCGn1
    SolutionIndex: 281
    SolutionNameMin: Cijk_Alik_Bljk_BBS_BH_Bias_HAS_SAV_UserArgs_MT16x48x64_MI16x16x1_SN_LDSB0_AFC0_AFEM1_AFEM1_ASEM1_CLR0_CADS0_DTLA1_DTLB1_DTVA0_DTVB0_EPS0_FDSI0_GRPM1_GRVWA8_GRVWB8_GSU0_GSUAMB_GSUC0_GSUWGMRR0_GLS0_ISA950_IU1_K1_LBSPPA1024_LBSPPB1024_LBSPPM0_LPA16_LPB16_LPM0_LRVW8_LWPMn1_MIAV1_MIWT1_3_MO40_NTn1_NTA1_NTB3_NTC3_NTD0_NTM0_NEPBS10_NLCA1_NLCB1_ONLL1_PGR2_PLR1_PKA1_SIA3_SS1_SU8_SUM0_SUS128_SPO0_SRVW0_SSO0_SVW1_SK3_SKXCCM0_TLDS1_ULSGRO0_USL1_UIOFGRO0_USFGRO0_VSn1_VWA1_VWB1_WSGRA0_WSGRB0_WS64_WG16_4_2_WGM0_WGMXCC32_WGMXCCGn1
    SolutionIndex: 282
    SolutionNameMin: Cijk_Alik_Bljk_BBS_BH_Bias_HAS_SAV_UserArgs_MT16x64x64_MI16x16x1_SN_LDSB0_AFC0_AFEM1_AFEM1_ASEM1_CLR1_CADS0_DTLA1_DTLB1_DTVA0_DTVB0_EPS0_FDSI0_GRPM1_GRVWA8_GRVWB8_GSU0_GSUAMB_GSUC0_GSUWGMRR0_GLS0_ISA950_IU1_K1_LBSPPA1024_LBSPPB1024_LBSPPM0_LPA16_LPB16_LPM0_LRVW8_LWPMn1_MIAV1_MIWT1_2_MO40_NTn1_NTA3_NTB0_NTC1_NTD2_NTM0_NEPBS16_NLCA1_NLCB1_ONLL1_PGR2_PLR1_PKA1_SIA3_SS0_SU0_SUM0_SUS128_SPO0_SRVW0_SSO0_SVW4_SK3_SKXCCM0_TLDS1_ULSGRO0_USL1_UIOFGRO0_USFGROn1_VSn1_VWA1_VWB2_WSGRA0_WSGRB0_WS64_WG16_8_1_WGM1_WGMXCC2_WGMXCCGn1
    SolutionIndex: 283
    SolutionNameMin: Cijk_Alik_Bljk_BBS_BH_Bias_HAS_SAV_UserArgs_MT32x32x64_MI16x16x1_SN_LDSB0_AFC0_AFEM1_AFEM1_ASEM1_CLR0_CADS0_DTLA1_DTLB1_DTVA0_DTVB0_EPS0_FDSI0_GRPM1_GRVWA8_GRVWB2_GSU0_GSUAMB_GSUC0_GSUWGMRR0_GLS0_ISA950_IU1_K1_LBSPPA1024_LBSPPB256_LBSPPM0_LPA16_LPB16_LPM0_LRVW8_LWPMn1_MIAV1_MIWT1_1_MO40_NTn1_NTA0_NTB5_NTC2_NTD1_NTM0_NEPBS16_NLCA1_NLCB1_ONLL1_PGR2_PLR1_PKA1_SIA3_SS1_SU8_SUM0_SUS128_SPO1_SRVW0_SSO0_SVW1_SK3_SKXCCM8_TLDS1_ULSGRO0_USL1_UIOFGRO0_USFGROn1_VSn1_VWA1_VWB1_WSGRA0_WSGRB0_WS64_WG32_8_1_WGM32_WGMXCC4_WGMXCCGn1
    SolutionIndex: 284
    SolutionNameMin: Cijk_Alik_Bljk_BBS_BH_Bias_HAS_SAV_UserArgs_MT32x32x64_MI16x16x1_SN_LDSB0_AFC0_AFEM1_AFEM1_ASEM1_CLR0_CADS0_DTLA1_DTLB1_DTVA0_DTVB0_EPS0_FDSI0_GRPM1_GRVWA2_GRVWB8_GSU0_GSUAMB_GSUC0_GSUWGMRR0_GLS0_ISA950_IU1_K1_LBSPPA256_LBSPPB1024_LBSPPM0_LPA16_LPB16_LPM0_LRVW8_LWPMn1_MIAV1_MIWT1_1_MO40_NTn1_NTA2_NTB4_NTC1_NTD1_NTM0_NEPBS0_NLCA1_NLCB1_ONLL1_PGR2_PLR1_PKA1_SIA3_SS1_SU0_SUM0_SUS128_SPO1_SRVW0_SSO0_SVW1_SK3_SKXCCM4_TLDS1_ULSGRO0_USL1_UIOFGRO0_USFGRO0_VSn1_VWA1_VWB1_WSGRA0_WSGRB0_WS64_WG32_8_1_WGM24_WGMXCC8_WGMXCCGn1
    SolutionIndex: 285
    SolutionNameMin: Cijk_Alik_Bljk_BBS_BH_Bias_HAS_SAV_UserArgs_MT32x32x64_MI16x16x1_SN_LDSB0_AFC0_AFEM1_AFEM1_ASEM1_CLR0_CADS0_DTLA1_DTLB1_DTVA0_DTVB0_EPS0_FDSI0_GRPM1_GRVWA8_GRVWB8_GSU0_GSUAMB_GSUC0_GSUWGMRR0_GLS0_ISA950_IU1_K1_LBSPPA1024_LBSPPB1024_LBSPPM0_LPA16_LPB16_LPM0_LRVW8_LWPMn1_MIAV1_MIWT1_1_MO40_NTn1_NTA0_NTB5_NTC2_NTD0_NTM0_NEPBS10_NLCA1_NLCB1_ONLL1_PGR2_PLR1_PKA1_SIA3_SS1_SU0_SUM0_SUS128_SPO0_SRVW0_SSO0_SVW1_SK3_SKXCCM4_TLDS1_ULSGRO0_USL1_UIOFGRO0_USFGRO1_VSn1_VWA1_VWB1_WSGRA0_WSGRB0_WS64_WG32_8_1_WGM32_WGMXCC8_WGMXCCGn1
    SolutionIndex: 286
    SolutionNameMin: Cijk_Alik_Bljk_BBS_BH_Bias_HAS_SAV_UserArgs_MT32x64x64_MI16x16x1_SN_LDSB0_AFC0_AFEM1_AFEM1_ASEM1_CLR1_CADS0_DTLA1_DTLB1_DTVA0_DTVB0_EPS0_FDSI0_GRPM1_GRVWA2_GRVWB8_GSU0_GSUAMB_GSUC0_GSUWGMRR0_GLS0_ISA950_IU1_K1_LBSPPA256_LBSPPB1024_LBSPPM0_LPA16_LPB16_LPM0_LRVW8_LWPMn1_MIAV0_MIWT2_1_MO40_NTn1_NTA0_NTB1_NTC2_NTD0_NTM0_NEPBS14_NLCA1_NLCB1_ONLL1_PGR2_PLR1_PKA1_SIA3_SS1_SU0_SUM0_SUS128_SPO1_SRVW0_SSO0_SVW2_SK3_SKXCCM4_TLDS1_ULSGRO0_USL1_UIOFGRO0_USFGRO0_VSn1_VWA2_VWB1_WSGRA0_WSGRB0_WS64_WG16_16_1_WGM32_WGMXCC8_WGMXCCGn1
    SolutionIndex: 287
    SolutionNameMin: Cijk_Alik_Bljk_BBS_BH_Bias_HAS_SAV_UserArgs_MT64x80x64_MI16x16x1_SN_LDSB0_AFC0_AFEM1_AFEM1_ASEM1_CLR1_CADS0_DTLA1_DTLB1_DTVA0_DTVB0_EPS0_FDSI0_GRPM1_GRVWA8_GRVWB2_GSU0_GSUAMB_GSUC0_GSUWGMRR0_GLS0_ISA950_IU1_K1_LBSPPA1024_LBSPPB256_LBSPPM0_LPA16_LPB16_LPM0_LRVW8_LWPMn1_MIAV0_MIWT1_5_MO40_NTn1_NTA3_NTB5_NTC1_NTD1_NTM0_NEPBS0_NLCA1_NLCB1_ONLL1_PGR2_PLR1_PKA1_SIA3_SS1_SU0_SUM0_SUS128_SPO0_SRVW0_SSO0_SVW1_SK3_SKXCCM6_TLDS1_ULSGRO0_USL1_UIOFGRO0_USFGRO1_VSn1_VWA1_VWB1_WSGRA0_WSGRB0_WS64_WG64_4_1_WGM1_WGMXCC4_WGMXCCGn1
    SolutionIndex: 288
    SolutionNameMin: Cijk_Alik_Bljk_BBS_BH_Bias_HAS_SAV_UserArgs_MT128x96x64_MI16x16x1_SN_LDSB0_AFC0_AFEM1_AFEM1_ASEM1_CLR0_CADS0_DTLA1_DTLB1_DTVA0_DTVB0_EPS0_FDSI0_GRPM1_GRVWA8_GRVWB8_GSU0_GSUAMB_GSUC0_GSUWGMRR0_GLS0_ISA950_IU1_K1_LBSPPA1024_LBSPPB1024_LBSPPM0_LPA16_LPB16_LPM0_LRVW8_LWPMn1_MIAV1_MIWT4_3_MO40_NTn1_NTA3_NTB6_NTC0_NTD3_NTM0_NEPBS0_NLCA1_NLCB1_ONLL1_PGR2_PLR1_PKA1_SIA3_SS1_SU8_SUM0_SUS128_SPO0_SRVW0_SSO0_SVW4_SK3_SKXCCM4_TLDS1_ULSGRO0_USL1_UIOFGRO0_USFGRO1_VSn1_VWA4_VWB1_WSGRA0_WSGRB0_WS64_WG32_8_1_WGM0_WGMXCC8_WGMXCCGn1
    SolutionIndex: 289
    SolutionNameMin: Cijk_Alik_Bljk_BBS_BH_Bias_HAS_SAV_UserArgs_MT128x96x64_MI16x16x1_SN_LDSB0_AFC0_AFEM1_AFEM1_ASEM1_CLR1_CADS0_DTLA1_DTLB1_DTVA0_DTVB0_EPS0_FDSI0_GRPM1_GRVWA8_GRVWB8_GSU0_GSUAMB_GSUC0_GSUWGMRR0_GLS0_ISA950_IU1_K1_LBSPPA1024_LBSPPB1024_LBSPPM0_LPA16_LPB16_LPM0_LRVW8_LWPMn1_MIAV1_MIWT4_3_MO40_NTn1_NTA2_NTB5_NTC3_NTD2_NTM0_NEPBS12_NLCA1_NLCB1_ONLL1_PGR2_PLR1_PKA1_SIA3_SS1_SU0_SUM0_SUS128_SPO0_SRVW0_SSO0_SVW4_SK3_SKXCCM6_TLDS2_ULSGRO0_USL1_UIOFGRO0_USFGRO1_VSn1_VWA4_VWB1_WSGRA0_WSGRB0_WS64_WG32_8_1_WGM0_WGMXCC4_WGMXCCGn1
    SolutionIndex: 290
    SolutionNameMin: Cijk_Alik_Bljk_BBS_BH_Bias_HAS_SAV_UserArgs_MT128x112x64_MI16x16x1_SN_LDSB0_AFC0_AFEM1_AFEM1_ASEM1_CLR0_CADS0_DTLA1_DTLB1_DTVA0_DTVB0_EPS0_FDSI0_GRPM1_GRVWA8_GRVWB2_GSU0_GSUAMB_GSUC0_GSUWGMRR0_GLS0_ISA950_IU1_K1_LBSPPA1024_LBSPPB256_LBSPPM0_LPA16_LPB16_LPM0_LRVW8_LWPMn1_MIAV1_MIWT2_7_MO40_NTn1_NTA0_NTB6_NTC1_NTD3_NTM0_NEPBS0_NLCA1_NLCB1_ONLL1_PGR2_PLR1_PKA1_SIA3_SS1_SU0_SUM0_SUS128_SPO0_SRVW0_SSO0_SVW2_SK3_SKXCCM0_TLDS1_ULSGRO0_USL1_UIOFGRO0_USFGRO0_VSn1_VWA2_VWB1_WSGRA0_WSGRB0_WS64_WG64_4_1_WGM0_WGMXCC32_WGMXCCGn1
    SolutionIndex: 291
    SolutionNameMin: Cijk_Alik_Bljk_BBS_BH_Bias_HAS_SAV_UserArgs_MT16x48x64_MI16x16x1_SN_LDSB0_AFC0_AFEM1_AFEM1_ASEM1_CLR0_CADS0_DTLA1_DTLB1_DTVA0_DTVB0_EPS0_FDSI0_GRPM1_GRVWA8_GRVWB8_GSU0_GSUAMB_GSUC0_GSUWGMRR0_GLS0_ISA950_IU1_K1_LBSPPA1024_LBSPPB1024_LBSPPM0_LPA16_LPB16_LPM0_LRVW8_LWPMn1_MIAV0_MIWT1_3_MO40_NTn1_NTA5_NTB3_NTC3_NTD2_NTM0_NEPBS10_NLCA1_NLCB1_ONLL1_PGR2_PLR1_PKA1_SIA3_SS1_SU0_SUM0_SUS128_SPO0_SRVW0_SSO0_SVW1_SK3_SKXCCM0_TLDS2_ULSGRO0_USL1_UIOFGRO0_USFGRO1_VSn1_VWA1_VWB1_WSGRA0_WSGRB0_WS64_WG16_4_2_WGM0_WGMXCC16_WGMXCCGn1
    SolutionIndex: 292
    SolutionNameMin: Cijk_Alik_Bljk_BBS_BH_Bias_HAS_SAV_UserArgs_MT16x48x64_MI16x16x1_SN_LDSB0_AFC0_AFEM1_AFEM1_ASEM1_CLR0_CADS0_DTLA1_DTLB1_DTVA0_DTVB0_EPS0_FDSI0_GRPM1_GRVWA8_GRVWB8_GSU0_GSUAMB_GSUC0_GSUWGMRR0_GLS0_ISA950_IU1_K1_LBSPPA1024_LBSPPB1024_LBSPPM0_LPA16_LPB16_LPM0_LRVW8_LWPMn1_MIAV0_MIWT1_3_MO40_NTn1_NTA5_NTB0_NTC0_NTD2_NTM0_NEPBS0_NLCA1_NLCB1_ONLL1_PGR2_PLR0_PKA1_SIA3_SS1_SU8_SUM0_SUS128_SPO0_SRVW0_SSO0_SVW1_SK3_SKXCCM4_TLDS2_ULSGRO0_USL1_UIOFGRO0_USFGROn1_VSn1_VWA1_VWB1_WSGRA0_WSGRB0_WS64_WG16_4_2_WGM1_WGMXCC4_WGMXCCGn1
    SolutionIndex: 293
    SolutionNameMin: Cijk_Alik_Bljk_BBS_BH_Bias_HAS_SAV_UserArgs_MT64x32x64_MI16x16x1_SN_LDSB0_AFC0_AFEM1_AFEM1_ASEM1_CLR0_CADS0_DTLA1_DTLB1_DTVA0_DTVB0_EPS0_FDSI0_GRPM1_GRVWA8_GRVWB2_GSU0_GSUAMB_GSUC0_GSUWGMRR0_GLS0_ISA950_IU1_K1_LBSPPA1024_LBSPPB256_LBSPPM0_LPA16_LPB16_LPM0_LRVW8_LWPMn1_MIAV1_MIWT1_2_MO40_NTn1_NTA0_NTB2_NTC4_NTD1_NTM0_NEPBS4_NLCA1_NLCB1_ONLL1_PGR2_PLR1_PKA1_SIA3_SS0_SU0_SUM0_SUS128_SPO1_SRVW0_SSO0_SVW4_SK3_SKXCCM4_TLDS2_ULSGRO0_USL1_UIOFGRO0_USFGRO0_VSn1_VWA1_VWB2_WSGRA0_WSGRB0_WS64_WG64_4_1_WGM0_WGMXCC4_WGMXCCGn1
    SolutionIndex: 294
    SolutionNameMin: Cijk_Alik_Bljk_BBS_BH_Bias_HAS_SAV_UserArgs_MT32x64x64_MI16x16x1_SN_LDSB0_AFC0_AFEM1_AFEM1_ASEM1_CLR1_CADS0_DTLA1_DTLB1_DTVA0_DTVB0_EPS0_FDSI0_GRPM1_GRVWA2_GRVWB8_GSU0_GSUAMB_GSUC0_GSUWGMRR0_GLS0_ISA950_IU1_K1_LBSPPA256_LBSPPB1024_LBSPPM0_LPA16_LPB16_LPM0_LRVW8_LWPMn1_MIAV0_MIWT2_1_MO40_NTn1_NTA7_NTB1_NTC1_NTD0_NTM0_NEPBS16_NLCA1_NLCB1_ONLL1_PGR2_PLR1_PKA1_SIA3_SS1_SU0_SUM0_SUS128_SPO1_SRVW0_SSO0_SVW2_SK3_SKXCCM4_TLDS1_ULSGRO0_USL1_UIOFGRO0_USFGRO0_VSn1_VWA2_VWB1_WSGRA0_WSGRB0_WS64_WG16_16_1_WGM1_WGMXCC8_WGMXCCGn1
    SolutionIndex: 295
    SolutionNameMin: Cijk_Alik_Bljk_BBS_BH_Bias_HAS_SAV_UserArgs_MT64x64x64_MI16x16x1_SN_LDSB0_AFC0_AFEM1_AFEM1_ASEM1_CLR1_CADS0_DTLA1_DTLB1_DTVA0_DTVB0_EPS0_FDSI0_GRPM1_GRVWA2_GRVWB8_GSU0_GSUAMB_GSUC0_GSUWGMRR0_GLS0_ISA950_IU1_K1_LBSPPA512_LBSPPB1024_LBSPPM0_LPA16_LPB16_LPM0_LRVW8_LWPMn1_MIAV0_MIWT4_1_MO40_NTn1_NTA1_NTB3_NTC6_NTD0_NTM0_NEPBS8_NLCA1_NLCB1_ONLL1_PGR2_PLR1_PKA1_SIA3_SS1_SU0_SUM0_SUS128_SPO1_SRVW0_SSO0_SVW4_SK3_SKXCCM6_TLDS2_ULSGRO0_USL1_UIOFGRO0_USFGRO0_VSn1_VWA4_VWB1_WSGRA0_WSGRB0_WS64_WG16_16_1_WGM6_WGMXCC4_WGMXCCGn1
    SolutionIndex: 296
    SolutionNameMin: Cijk_Alik_Bljk_BBS_BH_Bias_HAS_SAV_UserArgs_MT128x32x64_MI16x16x1_SN_LDSB0_AFC0_AFEM1_AFEM1_ASEM1_CLR1_CADS0_DTLA1_DTLB1_DTVA0_DTVB0_EPS0_FDSI0_GRPM1_GRVWA2_GRVWB2_GSU0_GSUAMB_GSUC0_GSUWGMRR0_GLS0_ISA950_IU1_K1_LBSPPA512_LBSPPB256_LBSPPM0_LPA16_LPB16_LPM0_LRVW8_LWPMn1_MIAV1_MIWT4_1_MO40_NTn1_NTA3_NTB2_NTC4_NTD1_NTM0_NEPBS16_NLCA1_NLCB1_ONLL1_PGR2_PLR1_PKA1_SIA3_SS1_SU0_SUM0_SUS128_SPO0_SRVW0_SSO0_SVW4_SK3_SKXCCM6_TLDS1_ULSGRO0_USL1_UIOFGRO0_USFGRO0_VSn1_VWA4_VWB1_WSGRA0_WSGRB0_WS64_WG32_8_1_WGM6_WGMXCC4_WGMXCCGn1
    SolutionIndex: 297
    SolutionNameMin: Cijk_Alik_Bljk_BBS_BH_Bias_HAS_SAV_UserArgs_MT64x96x64_MI16x16x1_SN_LDSB0_AFC0_AFEM1_AFEM1_ASEM1_CLR0_CADS0_DTLA1_DTLB1_DTVA0_DTVB0_EPS0_FDSI0_GRPM1_GRVWA2_GRVWB8_GSU0_GSUAMB_GSUC0_GSUWGMRR0_GLS0_ISA950_IU1_K1_LBSPPA256_LBSPPB1024_LBSPPM0_LPA16_LPB16_LPM0_LRVW8_LWPMn1_MIAV1_MIWT2_3_MO40_NTn1_NTA3_NTB2_NTC1_NTD0_NTM0_NEPBS16_NLCA1_NLCB1_ONLL1_PGR2_PLR1_PKA1_SIA3_SS1_SU0_SUM0_SUS128_SPO0_SRVW0_SSO0_SVW2_SK3_SKXCCM5_TLDS1_ULSGRO0_USL1_UIOFGRO0_USFGRO0_VSn1_VWA2_VWB1_WSGRA0_WSGRB0_WS64_WG32_8_1_WGM24_WGMXCC8_WGMXCCGn1
    SolutionIndex: 298
    SolutionNameMin: Cijk_Alik_Bljk_BBS_BH_Bias_HAS_SAV_UserArgs_MT64x128x64_MI16x16x1_SN_LDSB0_AFC0_AFEM1_AFEM1_ASEM1_CLR1_CADS0_DTLA1_DTLB1_DTVA0_DTVB0_EPS0_FDSI0_GRPM1_GRVWA2_GRVWB2_GSU0_GSUAMB_GSUC0_GSUWGMRR0_GLS0_ISA950_IU1_K1_LBSPPA512_LBSPPB256_LBSPPM0_LPA16_LPB16_LPM0_LRVW8_LWPMn1_MIAV1_MIWT4_2_MO40_NTn1_NTA2_NTB1_NTC6_NTD1_NTM0_NEPBS8_NLCA1_NLCB1_ONLL1_PGR2_PLR1_PKA1_SIA3_SS1_SU0_SUM0_SUS128_SPO0_SRVW0_SSO0_SVW4_SK3_SKXCCM5_TLDS1_ULSGRO0_USL1_UIOFGRO0_USFGRO0_VSn1_VWA4_VWB2_WSGRA0_WSGRB0_WS64_WG16_16_1_WGM8_WGMXCC8_WGMXCCGn1
    SolutionIndex: 299
    SolutionNameMin: Cijk_Alik_Bljk_BBS_BH_Bias_HAS_SAV_UserArgs_MT64x128x64_MI16x16x1_SN_LDSB0_AFC0_AFEM1_AFEM1_ASEM1_CLR1_CADS0_DTLA1_DTLB1_DTVA0_DTVB0_EPS0_FDSI0_GRPM1_GRVWA2_GRVWB2_GSU0_GSUAMB_GSUC0_GSUWGMRR0_GLS0_ISA950_IU1_K1_LBSPPA512_LBSPPB256_LBSPPM0_LPA16_LPB16_LPM0_LRVW8_LWPMn1_MIAV1_MIWT4_2_MO40_NTn1_NTA2_NTB1_NTC7_NTD1_NTM0_NEPBS14_NLCA1_NLCB1_ONLL1_PGR2_PLR1_PKA1_SIA3_SS1_SU0_SUM0_SUS128_SPO0_SRVW0_SSO0_SVW4_SK3_SKXCCM5_TLDS1_ULSGRO0_USL1_UIOFGRO0_USFGRO0_VSn1_VWA4_VWB2_WSGRA0_WSGRB0_WS64_WG16_16_1_WGM8_WGMXCC8_WGMXCCGn1
    SolutionIndex: 300
    SolutionNameMin: Cijk_Alik_Bljk_BBS_BH_Bias_HAS_SAV_UserArgs_MT128x128x64_MI16x16x1_SN_LDSB0_AFC0_AFEM1_AFEM1_ASEM1_CLR1_CADS0_DTLA1_DTLB1_DTVA0_DTVB0_EPS0_FDSI0_GRPM1_GRVWA2_GRVWB8_GSU0_GSUAMB_GSUC0_GSUWGMRR0_GLS0_ISA950_IU1_K1_LBSPPA512_LBSPPB1024_LBSPPM0_LPA16_LPB16_LPM0_LRVW8_LWPMn1_MIAV1_MIWT4_4_MO40_NTn1_NTA2_NTB0_NTC6_NTD0_NTM0_NEPBS16_NLCA1_NLCB1_ONLL1_PGR2_PLR1_PKA1_SIA3_SS1_SU0_SUM0_SUS128_SPO0_SRVW0_SSO0_SVW4_SK3_SKXCCM0_TLDS1_ULSGRO0_USL1_UIOFGRO0_USFGRO0_VSn1_VWA4_VWB4_WSGRA0_WSGRB0_WS64_WG32_8_1_WGM16_WGMXCC2_WGMXCCGn1
    SolutionIndex: 301
    SolutionNameMin: Cijk_Alik_Bljk_BBS_BH_Bias_HAS_SAV_UserArgs_MT128x128x64_MI16x16x1_SN_LDSB0_AFC0_AFEM1_AFEM1_ASEM1_CLR0_CADS0_DTLA1_DTLB1_DTVA0_DTVB0_EPS0_FDSI0_GRPM1_GRVWA8_GRVWB8_GSU0_GSUAMB_GSUC0_GSUWGMRR0_GLS0_ISA950_IU1_K1_LBSPPA1024_LBSPPB1024_LBSPPM0_LPA16_LPB16_LPM0_LRVW8_LWPMn1_MIAV0_MIWT8_2_MO40_NTn1_NTA3_NTB2_NTC3_NTD4_NTM0_NEPBS14_NLCA1_NLCB1_ONLL1_PGR2_PLR1_PKA1_SIA3_SS1_SU0_SUM0_SUS128_SPO0_SRVW0_SSO1_SVW8_SK3_SKXCCM0_TLDS2_ULSGRO0_USL1_UIOFGRO0_USFGROn1_VSn1_VWA8_VWB2_WSGRA0_WSGRB0_WS64_WG16_16_1_WGM16_WGMXCC2_WGMXCCGn1
    SolutionIndex: 302
    SolutionNameMin: Cijk_Alik_Bljk_BBS_BH_Bias_HAS_SAV_UserArgs_MT160x128x64_MI16x16x1_SN_LDSB0_AFC0_AFEM1_AFEM1_ASEM1_CLR1_CADS0_DTLA1_DTLB1_DTVA0_DTVB0_EPS0_FDSI0_GRPM1_GRVWA2_GRVWB8_GSU0_GSUAMB_GSUC0_GSUWGMRR0_GLS0_ISA950_IU1_K1_LBSPPA256_LBSPPB1024_LBSPPM0_LPA16_LPB16_LPM0_LRVW8_LWPMn1_MIAV1_MIWT10_2_MO40_NTn1_NTA0_NTB7_NTC2_NTD5_NTM0_NEPBS0_NLCA1_NLCB1_ONLL1_PGR2_PLR1_PKA1_SIA3_SS1_SU0_SUM0_SUS128_SPO0_SRVW0_SSO0_SVW2_SK3_SKXCCM4_TLDS1_ULSGRO0_USL1_UIOFGRO0_USFGRO0_VSn1_VWA2_VWB2_WSGRA0_WSGRB0_WS64_WG16_16_1_WGM1_WGMXCC4_WGMXCCGn1
    SolutionIndex: 303
    SolutionNameMin: Cijk_Alik_Bljk_BBS_BH_Bias_HAS_SAV_UserArgs_MT16x32x512_MI16x16x1_SN_LDSB0_AFC0_AFEM1_AFEM1_ASEM1_CLR0_CADS0_DTLA1_DTLB1_DTVA0_DTVB0_EPS0_FDSI0_GRPM1_GRVWA8_GRVWB8_GSU0_GSUAMB_GSUC0_GSUWGMRR0_GLS0_ISA950_IU1_K1_LBSPPA1024_LBSPPB2048_LBSPPM0_LPA16_LPB16_LPM0_LRVW8_LWPMn1_MIAV0_MIWT1_2_MO40_NTn1_NTA4_NTB2_NTC3_NTD2_NTM0_NEPBS10_NLCA1_NLCB1_ONLL1_PGR2_PLR1_PKA1_SIA3_SS1_SU0_SUM0_SUS1024_SPO0_SRVW0_SSO0_SVW1_SK3_SKXCCM4_TLDS1_ULSGRO0_USL1_UIOFGRO0_USFGRO1_VSn1_VWA1_VWB2_WSGRA0_WSGRB0_WS64_WG16_4_4_WGM1_WGMXCC4_WGMXCCGn1
    SolutionIndex: 304
    SolutionNameMin: Cijk_Alik_Bljk_BBS_BH_Bias_HAS_SAV_UserArgs_MT48x32x256_MI16x16x1_SN_LDSB0_AFC0_AFEM1_AFEM1_ASEM1_CLR1_CADS0_DTLA1_DTLB1_DTVA0_DTVB0_EPS0_FDSI0_GRPM1_GRVWA8_GRVWB8_GSU0_GSUAMB_GSUC0_GSUWGMRR0_GLS0_ISA950_IU1_K1_LBSPPA1024_LBSPPB1024_LBSPPM0_LPA16_LPB16_LPM0_LRVW8_LWPMn1_MIAV0_MIWT3_1_MO40_NTn1_NTA4_NTB3_NTC2_NTD2_NTM0_NEPBS0_NLCA1_NLCB1_ONLL1_PGR2_PLR1_PKA1_SIA3_SS0_SU8_SUM0_SUS512_SPO1_SRVW0_SSO0_SVW4_SK3_SKXCCM0_TLDS2_ULSGRO0_USL1_UIOFGRO0_USFGRO0_VSn1_VWA1_VWB1_WSGRA0_WSGRB0_WS64_WG16_8_1_WGM0_WGMXCC16_WGMXCCGn1
    SolutionIndex: 305
    SolutionNameMin: Cijk_Alik_Bljk_BBS_BH_Bias_HAS_SAV_UserArgs_MT64x48x256_MI16x16x1_SN_LDSB0_AFC0_AFEM1_AFEM1_ASEM1_CLR0_CADS0_DTLA0_DTLB0_DTVA0_DTVB0_EPS0_FDSI0_GRPM1_GRVWA8_GRVWB8_GSU0_GSUAMB_GSUC0_GSUWGMRR0_GLS0_ISA950_IU1_K1_LBSPPA512_LBSPPB512_LBSPPM0_LPA16_LPB16_LPM0_LRVW8_LWPMn1_MIAV0_MIWT1_3_MO40_NTn1_NTA6_NTB0_NTC1_NTD3_NTM0_NEPBS16_NLCA1_NLCB1_ONLL1_PGR2_PLR1_PKA1_SIA3_SS0_SU0_SUM0_SUS512_SPO1_SRVW0_SSO0_SVW4_SK3_SKXCCM4_TLDS1_ULSGRO0_USL1_UIOFGRO0_USFGRO0_VSn1_VWA1_VWB1_WSGRA0_WSGRB0_WS64_WG64_4_1_WGM1_WGMXCC4_WGMXCCGn1
    SolutionIndex: 306
    SolutionNameMin: Cijk_Alik_Bljk_BBS_BH_Bias_HAS_SAV_UserArgs_MT48x64x256_MI16x16x1_SN_LDSB0_AFC0_AFEM1_AFEM1_ASEM1_CLR1_CADS0_DTLA0_DTLB0_DTVA0_DTVB0_EPS0_FDSI0_GRPM1_GRVWA8_GRVWB8_GSU0_GSUAMB_GSUC0_GSUWGMRR0_GLS0_ISA950_IU1_K1_LBSPPA512_LBSPPB512_LBSPPM0_LPA16_LPB16_LPM0_LRVW8_LWPMn1_MIAV0_MIWT3_1_MO40_NTn1_NTA4_NTB0_NTC1_NTD2_NTM0_NEPBS0_NLCA1_NLCB1_ONLL1_PGR2_PLR1_PKA1_SIA3_SS1_SU0_SUM0_SUS512_SPO1_SRVW0_SSO0_SVW1_SK3_SKXCCM4_TLDS2_ULSGRO0_USL1_UIOFGRO0_USFGRO0_VSn1_VWA1_VWB1_WSGRA0_WSGRB0_WS64_WG16_16_1_WGM2_WGMXCC1_WGMXCCGn1
    SolutionIndex: 307
    SolutionNameMin: Cijk_Alik_Bljk_BBS_BH_Bias_HAS_SAV_UserArgs_MT80x64x256_MI16x16x1_SN_LDSB0_AFC0_AFEM1_AFEM1_ASEM1_CLR0_CADS0_DTLA0_DTLB0_DTVA0_DTVB0_EPS0_FDSI0_GRPM1_GRVWA8_GRVWB8_GSU0_GSUAMB_GSUC0_GSUWGMRR0_GLS0_ISA950_IU1_K1_LBSPPA512_LBSPPB512_LBSPPM0_LPA16_LPB16_LPM0_LRVW8_LWPMn1_MIAV0_MIWT5_1_MO40_NTn1_NTA5_NTB2_NTC1_NTD3_NTM0_NEPBS16_NLCA1_NLCB1_ONLL1_PGR2_PLR1_PKA1_SIA3_SS0_SU8_SUM0_SUS512_SPO1_SRVW0_SSO0_SVW4_SK3_SKXCCM0_TLDS2_ULSGRO0_USL1_UIOFGRO0_USFGRO0_VSn1_VWA1_VWB1_WSGRA0_WSGRB0_WS64_WG16_16_1_WGM0_WGMXCC1_WGMXCCGn1
    SolutionIndex: 308
    SolutionNameMin: Cijk_Alik_Bljk_BBS_BH_Bias_HAS_SAV_UserArgs_MT96x96x128_MI16x16x1_SN_LDSB0_AFC0_AFEM1_AFEM1_ASEM1_CLR0_CADS0_DTLA0_DTLB0_DTVA0_DTVB0_EPS0_FDSI0_GRPM1_GRVWA8_GRVWB8_GSU0_GSUAMB_GSUC0_GSUWGMRR0_GLS0_ISA950_IU1_K1_LBSPPA256_LBSPPB256_LBSPPM0_LPA16_LPB16_LPM0_LRVW8_LWPMn1_MIAV0_MIWT3_3_MO40_NTn1_NTA4_NTB0_NTC1_NTD2_NTM0_NEPBS0_NLCA1_NLCB1_ONLL1_PGR2_PLR1_PKA1_SIA3_SS0_SU0_SUM0_SUS256_SPO1_SRVW0_SSO0_SVW4_SK3_SKXCCM8_TLDS1_ULSGRO0_USL1_UIOFGRO0_USFGRO0_VSn1_VWA1_VWB1_WSGRA0_WSGRB0_WS64_WG32_8_1_WGM0_WGMXCC2_WGMXCCGn1
    SolutionIndex: 309
    SolutionNameMin: Cijk_Alik_Bljk_BBS_BH_Bias_HAS_SAV_UserArgs_MT64x48x256_MI16x16x1_SN_LDSB0_AFC0_AFEM1_AFEM1_ASEM1_CLR1_CADS0_DTLA0_DTLB0_DTVA0_DTVB0_EPS0_FDSI0_GRPM1_GRVWA8_GRVWB8_GSU0_GSUAMB_GSUC0_GSUWGMRR0_GLS0_ISA950_IU1_K1_LBSPPA512_LBSPPB512_LBSPPM0_LPA16_LPB16_LPM0_LRVW8_LWPMn1_MIAV0_MIWT1_3_MO40_NTn1_NTA1_NTB1_NTC7_NTD4_NTM0_NEPBS12_NLCA1_NLCB1_ONLL1_PGR2_PLR1_PKA1_SIA3_SS1_SU8_SUM0_SUS512_SPO1_SRVW0_SSO1_SVW1_SK3_SKXCCM0_TLDS2_ULSGRO0_USL1_UIOFGRO0_USFGRO0_VSn1_VWA1_VWB1_WSGRA0_WSGRB0_WS64_WG64_4_1_WGM24_WGMXCC8_WGMXCCGn1
    SolutionIndex: 310
    SolutionNameMin: Cijk_Alik_Bljk_BBS_BH_Bias_HAS_SAV_UserArgs_MT96x64x128_MI16x16x1_SN_LDSB0_AFC0_AFEM1_AFEM1_ASEM1_CLR1_CADS0_DTLA0_DTLB0_DTVA0_DTVB0_EPS0_FDSI0_GRPM1_GRVWA8_GRVWB8_GSU0_GSUAMB_GSUC0_GSUWGMRR0_GLS0_ISA950_IU1_K1_LBSPPA512_LBSPPB256_LBSPPM0_LPA16_LPB16_LPM0_LRVW8_LWPMn1_MIAV1_MIWT6_1_MO40_NTn1_NTA0_NTB2_NTC0_NTD2_NTM0_NEPBS0_NLCA1_NLCB1_ONLL1_PGR2_PLR1_PKA1_SIA3_SS1_SU8_SUM0_SUS256_SPO0_SRVW0_SSO0_SVW2_SK3_SKXCCM4_TLDS2_ULSGRO0_USL1_UIOFGRO0_USFGRO0_VSn1_VWA2_VWB1_WSGRA0_WSGRB0_WS64_WG16_16_1_WGM24_WGMXCC1_WGMXCCGn1
    SolutionIndex: 311
    SolutionNameMin: Cijk_Alik_Bljk_BBS_BH_Bias_HAS_SAV_UserArgs_MT64x64x256_MI32x32x1_SN_LDSB0_AFC0_AFEM1_AFEM1_ASEM1_CLR1_CADS0_DTLA0_DTLB0_DTVA0_DTVB0_EPS0_FDSI0_GRPM1_GRVWA8_GRVWB8_GSU0_GSUAMB_GSUC0_GSUWGMRR0_GLS0_ISA950_IU1_K1_LBSPPA512_LBSPPB512_LBSPPM0_LPA8_LPB8_LPM0_LRVW8_LWPMn1_MIAV0_MIWT1_1_MO40_NTn1_NTA2_NTB3_NTC0_NTD7_NTM0_NEPBS16_NLCA1_NLCB1_ONLL1_PGR2_PLR1_PKA1_SIA3_SS1_SU8_SUM0_SUS512_SPO1_SRVW0_SSO1_SVW1_SK3_SKXCCM0_TLDS1_ULSGRO0_USL1_UIOFGRO0_USFGRO0_VSn1_VWA1_VWB1_WSGRA0_WSGRB0_WS64_WG64_4_1_WGM24_WGMXCC8_WGMXCCGn1
    SolutionIndex: 312
    SolutionNameMin: Cijk_Alik_Bljk_BBS_BH_Bias_HAS_SAV_UserArgs_MT96x96x128_MI16x16x1_SN_LDSB0_AFC0_AFEM1_AFEM1_ASEM1_CLR0_CADS0_DTLA0_DTLB0_DTVA0_DTVB0_EPS0_FDSI0_GRPM1_GRVWA8_GRVWB8_GSU0_GSUAMB_GSUC0_GSUWGMRR0_GLS0_ISA950_IU1_K1_LBSPPA256_LBSPPB256_LBSPPM0_LPA16_LPB16_LPM0_LRVW8_LWPMn1_MIAV1_MIWT3_3_MO40_NTn1_NTA4_NTB3_NTC3_NTD1_NTM0_NEPBS0_NLCA1_NLCB1_ONLL1_PGR2_PLR1_PKA1_SIA3_SS1_SU0_SUM0_SUS256_SPO0_SRVW0_SSO0_SVW1_SK3_SKXCCM8_TLDS2_ULSGRO0_USL1_UIOFGRO0_USFGRO0_VSn1_VWA1_VWB1_WSGRA0_WSGRB0_WS64_WG32_8_1_WGM0_WGMXCC4_WGMXCCGn1
    SolutionIndex: 313
    SolutionNameMin: Cijk_Alik_Bljk_BBS_BH_Bias_HAS_SAV_UserArgs_MT64x96x128_MI16x16x1_SN_LDSB0_AFC0_AFEM1_AFEM1_ASEM1_CLR1_CADS0_DTLA0_DTLB0_DTVA0_DTVB0_EPS0_FDSI0_GRPM1_GRVWA8_GRVWB8_GSU0_GSUAMB_GSUC0_GSUWGMRR0_GLS0_ISA950_IU1_K1_LBSPPA512_LBSPPB256_LBSPPM0_LPA16_LPB16_LPM0_LRVW8_LWPMn1_MIAV1_MIWT2_3_MO40_NTn1_NTA3_NTB0_NTC0_NTD5_NTM0_NEPBS0_NLCA1_NLCB1_ONLL1_PGR2_PLR1_PKA1_SIA3_SS1_SU8_SUM0_SUS512_SPO0_SRVW0_SSO0_SVW2_SK3_SKXCCM8_TLDS1_ULSGRO0_USL1_UIOFGRO0_USFGRO0_VSn1_VWA2_VWB1_WSGRA0_WSGRB0_WS64_WG32_8_1_WGM8_WGMXCC1_WGMXCCGn1
    SolutionIndex: 314
    SolutionNameMin: Cijk_Alik_Bljk_BBS_BH_Bias_HAS_SAV_UserArgs_MT96x64x128_MI16x16x1_SN_LDSB0_AFC0_AFEM1_AFEM1_ASEM1_CLR0_CADS0_DTLA0_DTLB0_DTVA0_DTVB0_EPS0_FDSI0_GRPM1_GRVWA8_GRVWB8_GSU0_GSUAMB_GSUC0_GSUWGMRR0_GLS0_ISA950_IU1_K1_LBSPPA512_LBSPPB256_LBSPPM0_LPA16_LPB16_LPM0_LRVW8_LWPMn1_MIAV0_MIWT6_1_MO40_NTn1_NTA2_NTB1_NTC1_NTD4_NTM0_NEPBS16_NLCA1_NLCB1_ONLL1_PGR2_PLR1_PKA1_SIA3_SS1_SU0_SUM0_SUS256_SPO0_SRVW0_SSO0_SVW2_SK3_SKXCCM8_TLDS1_ULSGRO0_USL1_UIOFGRO0_USFGRO1_VSn1_VWA2_VWB1_WSGRA0_WSGRB0_WS64_WG16_16_1_WGM0_WGMXCC4_WGMXCCGn1
    SolutionIndex: 315
    SolutionNameMin: Cijk_Alik_Bljk_BBS_BH_Bias_HAS_SAV_UserArgs_MT128x112x128_MI16x16x1_SN_LDSB0_AFC0_AFEM1_AFEM1_ASEM1_CLR0_CADS0_DTLA0_DTLB0_DTVA0_DTVB0_EPS0_FDSI0_GRPM1_GRVWA8_GRVWB8_GSU0_GSUAMB_GSUC0_GSUWGMRR0_GLS0_ISA950_IU1_K1_LBSPPA512_LBSPPB256_LBSPPM0_LPA16_LPB16_LPM0_LRVW8_LWPMn1_MIAV1_MIWT2_7_MO40_NTn1_NTA2_NTB1_NTC0_NTD2_NTM0_NEPBS0_NLCA1_NLCB1_ONLL1_PGR2_PLR1_PKA1_SIA3_SS1_SU16_SUM0_SUS256_SPO0_SRVW0_SSO0_SVW2_SK3_SKXCCM4_TLDS1_ULSGRO0_USL1_UIOFGRO0_USFGRO0_VSn1_VWA2_VWB1_WSGRA0_WSGRB0_WS64_WG64_4_1_WGM8_WGMXCC1_WGMXCCGn1
    SolutionIndex: 316
    SolutionNameMin: Cijk_Alik_Bljk_BBS_BH_Bias_HAS_SAV_UserArgs_MT128x128x128_MI16x16x1_SN_LDSB0_AFC0_AFEM1_AFEM1_ASEM1_CLR0_CADS0_DTLA0_DTLB0_DTVA0_DTVB0_EPS0_FDSI0_GRPM1_GRVWA8_GRVWB8_GSU0_GSUAMB_GSUC0_GSUWGMRR0_GLS0_ISA950_IU1_K1_LBSPPA1024_LBSPPB1024_LBSPPM0_LPA16_LPB16_LPM0_LRVW8_LWPMn1_MIAV0_MIWT4_4_MO40_NTn1_NTA0_NTB3_NTC7_NTD1_NTM0_NEPBS0_NLCA1_NLCB1_ONLL1_PGR2_PLR1_PKA1_SIA3_SS1_SU8_SUM0_SUS512_SPO0_SRVW0_SSO0_SVW4_SK3_SKXCCM5_TLDS2_ULSGRO0_USL1_UIOFGRO0_USFGRO0_VSn1_VWA4_VWB4_WSGRA0_WSGRB0_WS64_WG32_8_1_WGM0_WGMXCC8_WGMXCCGn1
    SolutionIndex: 317
    SolutionNameMin: Cijk_Alik_Bljk_BBS_BH_Bias_HAS_SAV_UserArgs_MT128x64x128_MI16x16x1_SN_LDSB0_AFC0_AFEM1_AFEM1_ASEM1_CLR0_CADS0_DTLA0_DTLB0_DTVA0_DTVB0_EPS0_FDSI0_GRPM1_GRVWA8_GRVWB8_GSU0_GSUAMB_GSUC0_GSUWGMRR0_GLS0_ISA950_IU1_K1_LBSPPA1024_LBSPPB512_LBSPPM0_LPA16_LPB16_LPM0_LRVW8_LWPMn1_MIAV0_MIWT4_2_MO40_NTn1_NTA3_NTB2_NTC6_NTD4_NTM0_NEPBS0_NLCA1_NLCB1_ONLL1_PGR2_PLR1_PKA1_SIA3_SS1_SU16_SUM0_SUS256_SPO0_SRVW0_SSO0_SVW4_SK3_SKXCCM8_TLDS1_ULSGRO0_USL1_UIOFGRO0_USFGRO0_VSn1_VWA4_VWB2_WSGRA0_WSGRB0_WS64_WG32_8_1_WGM6_WGMXCC1_WGMXCCGn1
    SolutionIndex: 318
    SolutionNameMin: Cijk_Alik_Bljk_BBS_BH_Bias_HAS_SAV_UserArgs_MT64x160x128_MI16x16x1_SN_LDSB0_AFC0_AFEM1_AFEM1_ASEM1_CLR0_CADS0_DTLA0_DTLB0_DTVA0_DTVB0_EPS0_FDSI0_GRPM1_GRVWA8_GRVWB8_GSU0_GSUAMB_GSUC0_GSUWGMRR0_GLS0_ISA950_IU1_K1_LBSPPA512_LBSPPB256_LBSPPM0_LPA16_LPB16_LPM0_LRVW8_LWPMn1_MIAV0_MIWT2_5_MO40_NTn1_NTA2_NTB1_NTC0_NTD4_NTM0_NEPBS0_NLCA1_NLCB1_ONLL1_PGR2_PLR1_PKA1_SIA3_SS1_SU8_SUM0_SUS256_SPO0_SRVW0_SSO0_SVW2_SK3_SKXCCM5_TLDS1_ULSGRO0_USL1_UIOFGRO0_USFGROn1_VSn1_VWA2_VWB1_WSGRA0_WSGRB0_WS64_WG32_8_1_WGM1_WGMXCC16_WGMXCCGn1
    SolutionIndex: 319
    SolutionNameMin: Cijk_Alik_Bljk_BBS_BH_Bias_HAS_SAV_UserArgs_MT128x80x128_MI16x16x1_SN_LDSB0_AFC0_AFEM1_AFEM1_ASEM1_CLR0_CADS0_DTLA0_DTLB0_DTVA0_DTVB0_EPS0_FDSI0_GRPM1_GRVWA8_GRVWB8_GSU0_GSUAMB_GSUC0_GSUWGMRR0_GLS0_ISA950_IU1_K1_LBSPPA512_LBSPPB256_LBSPPM0_LPA16_LPB16_LPM0_LRVW8_LWPMn1_MIAV0_MIWT2_5_MO40_NTn1_NTA2_NTB3_NTC3_NTD5_NTM0_NEPBS0_NLCA1_NLCB1_ONLL1_PGR2_PLR1_PKA1_SIA3_SS1_SU16_SUM0_SUS512_SPO1_SRVW0_SSO1_SVW2_SK3_SKXCCM8_TLDS1_ULSGRO0_USL1_UIOFGRO0_USFGRO0_VSn1_VWA2_VWB1_WSGRA0_WSGRB0_WS64_WG64_4_1_WGM24_WGMXCC1_WGMXCCGn1
    SolutionIndex: 320
    SolutionNameMin: Cijk_Alik_Bljk_BBS_BH_Bias_HAS_SAV_UserArgs_MT128x80x128_MI16x16x1_SN_LDSB0_AFC0_AFEM1_AFEM1_ASEM1_CLR0_CADS0_DTLA0_DTLB0_DTVA0_DTVB0_EPS0_FDSI0_GRPM1_GRVWA8_GRVWB8_GSU0_GSUAMB_GSUC0_GSUWGMRR0_GLS0_ISA950_IU1_K1_LBSPPA512_LBSPPB256_LBSPPM0_LPA16_LPB16_LPM0_LRVW8_LWPMn1_MIAV0_MIWT2_5_MO40_NTn1_NTA3_NTB3_NTC7_NTD4_NTM0_NEPBS0_NLCA1_NLCB1_ONLL1_PGR2_PLR1_PKA1_SIA3_SS1_SU16_SUM0_SUS512_SPO0_SRVW0_SSO1_SVW2_SK3_SKXCCM4_TLDS2_ULSGRO0_USL1_UIOFGRO0_USFGRO0_VSn1_VWA2_VWB1_WSGRA0_WSGRB0_WS64_WG64_4_1_WGM6_WGMXCC2_WGMXCCGn1
    SolutionIndex: 321
    SolutionNameMin: Cijk_Alik_Bljk_BBS_BH_Bias_HAS_SAV_UserArgs_MT96x128x128_MI16x16x1_SN_LDSB0_AFC0_AFEM1_AFEM1_ASEM1_CLR0_CADS0_DTLA0_DTLB0_DTVA0_DTVB0_EPS0_FDSI0_GRPM1_GRVWA8_GRVWB8_GSU0_GSUAMB_GSUC0_GSUWGMRR0_GLS0_ISA950_IU1_K1_LBSPPA512_LBSPPB512_LBSPPM0_LPA16_LPB16_LPM0_LRVW8_LWPMn1_MIAV0_MIWT6_2_MO40_NTn1_NTA2_NTB2_NTC1_NTD1_NTM0_NEPBS0_NLCA1_NLCB1_ONLL1_PGR2_PLR1_PKA1_SIA3_SS1_SU0_SUM0_SUS256_SPO0_SRVW0_SSO1_SVW2_SK3_SKXCCM8_TLDS2_ULSGRO0_USL1_UIOFGRO0_USFGRO0_VSn1_VWA2_VWB2_WSGRA0_WSGRB0_WS64_WG16_16_1_WGM4_WGMXCC1_WGMXCCGn1
    SolutionIndex: 322
    SolutionNameMin: Cijk_Alik_Bljk_BBS_BH_Bias_HAS_SAV_UserArgs_MT96x128x128_MI16x16x1_SN_LDSB0_AFC0_AFEM1_AFEM1_ASEM1_CLR0_CADS0_DTLA0_DTLB0_DTVA0_DTVB0_EPS0_FDSI0_GRPM1_GRVWA8_GRVWB8_GSU0_GSUAMB_GSUC0_GSUWGMRR0_GLS0_ISA950_IU1_K1_LBSPPA512_LBSPPB512_LBSPPM0_LPA16_LPB16_LPM0_LRVW8_LWPMn1_MIAV0_MIWT6_2_MO40_NTn1_NTA3_NTB1_NTC0_NTD5_NTM0_NEPBS0_NLCA1_NLCB1_ONLL1_PGR2_PLR1_PKA1_SIA3_SS1_SU0_SUM0_SUS256_SPO0_SRVW0_SSO0_SVW2_SK3_SKXCCM4_TLDS1_ULSGRO0_USL1_UIOFGRO0_USFGRO0_VSn1_VWA2_VWB2_WSGRA0_WSGRB0_WS64_WG16_16_1_WGM0_WGMXCC8_WGMXCCGn1
    SolutionIndex: 323
    SolutionNameMin: Cijk_Alik_Bljk_BBS_BH_Bias_HAS_SAV_UserArgs_MT192x128x64_MI16x16x1_SN_LDSB0_AFC0_AFEM1_AFEM1_ASEM1_CLR0_CADS0_DTLA0_DTLB0_DTVA0_DTVB0_EPS0_FDSI0_GRPM1_GRVWA8_GRVWB8_GSU1_GSUAMB_GSUC0_GSUWGMRR0_GLS0_ISA950_IU1_K1_LBSPPA512_LBSPPB256_LBSPPM0_LPA16_LPB16_LPM0_LRVW8_LWPMn1_MIAV0_MIWT12_2_MO40_NTn1_NTA3_NTB3_NTC6_NTD4_NTM0_NEPBS0_NLCA1_NLCB1_ONLL1_PGR2_PLR1_PKA1_SIA3_SS1_SU0_SUM0_SUS128_SPO0_SRVW0_SSO0_SVW4_SK0_SKXCCM0_TLDS2_ULSGRO0_USL1_UIOFGRO0_USFGROn1_VSn1_VWA4_VWB2_WSGRA0_WSGRB0_WS64_WG16_16_1_WGM1_WGMXCC8_WGMXCCGn1
    SolutionIndex: 324
    SolutionNameMin: Cijk_Alik_Bljk_BBS_BH_Bias_HAS_SAV_UserArgs_MT192x192x32_MI16x16x1_SN_LDSB1_AFC0_AFEM1_AFEM1_ASEM1_CLR0_CADS0_DTLA0_DTLB0_DTVA0_DTVB0_EPS0_FDSI0_GRPM1_GRVWA8_GRVWB8_GSU0_GSUAMB_GSUC0_GSUWGMRR0_GLS0_ISA950_IU1_K1_LBSPPA256_LBSPPB128_LBSPPM0_LPA16_LPB16_LPM0_LRVW8_LWPMn1_MIAV0_MIWT12_3_MO40_NTn1_NTA0_NTB1_NTC7_NTD7_NTM0_NEPBS12_NLCA1_NLCB1_ONLL1_PGR2_PLR0_PKA1_SIA3_SS1_SU0_SUM0_SUS64_SPO0_SRVW0_SSO1_SVW4_SK3_SKXCCM0_TLDS2_ULSGRO0_USL1_UIOFGRO0_USFGRO0_VSn1_VWA4_VWB1_WSGRA0_WSGRB0_WS64_WG16_16_1_WGM0_WGMXCC8_WGMXCCGn1
    SolutionIndex: 325
    SolutionNameMin: Cijk_Alik_Bljk_BBS_BH_Bias_HAS_SAV_UserArgs_MT192x256x64_MI16x16x1_SN_LDSB0_AFC0_AFEM1_AFEM1_ASEM1_CLR1_CADS0_DTLA1_DTLB1_DTVA0_DTVB0_EPS0_FDSI0_GRPM1_GRVWA2_GRVWB8_GSU0_GSUAMB_GSUC0_GSUWGMRR0_GLS0_ISA950_IU1_K1_LBSPPA512_LBSPPB1024_LBSPPM0_LPA16_LPB16_LPM0_LRVW8_LWPMn1_MIAV0_MIWT12_4_MO40_NTn1_NTA2_NTB3_NTC7_NTD4_NTM0_NEPBS0_NLCA1_NLCB1_ONLL1_PGR2_PLR1_PKA1_SIA3_SS1_SU0_SUM0_SUS128_SPO1_SRVW0_SSO0_SVW4_SK3_SKXCCM4_TLDS1_ULSGRO0_USL1_UIOFGRO0_USFGRO0_VSn1_VWA4_VWB4_WSGRA0_WSGRB0_WS64_WG16_16_1_WGM1_WGMXCC8_WGMXCCGn1
    SolutionIndex: 326
    SolutionNameMin: Cijk_Alik_Bljk_BBS_BH_Bias_HAS_SAV_UserArgs_MT64x16x64_MI16x16x1_SN_LDSB0_AFC0_AFEM1_AFEM1_ASEM1_CLR1_CADS0_DTLA1_DTLB1_DTVA0_DTVB0_EPS0_FDSI0_GRPM1_GRVWA8_GRVWB2_GSU0_GSUAMB_GSUC0_GSUWGMRR0_GLS0_ISA950_IU1_K1_LBSPPA1024_LBSPPB256_LBSPPM0_LPA16_LPB16_LPM0_LRVW8_LWPMn1_MIAV1_MIWT2_1_MO40_NTn1_NTA4_NTB3_NTC0_NTD1_NTM0_NEPBS4_NLCA1_NLCB1_ONLL1_PGR2_PLR1_PKA1_SIA3_SS1_SU0_SUM0_SUS128_SPO0_SRVW0_SSO0_SVW2_SK3_SKXCCM0_TLDS2_ULSGRO0_USL1_UIOFGRO0_USFGROn1_VSn1_VWA2_VWB1_WSGRA0_WSGRB0_WS64_WG32_4_1_WGM1_WGMXCC16_WGMXCCGn1
    SolutionIndex: 327
    SolutionNameMin: Cijk_Alik_Bljk_BBS_BH_Bias_HAS_SAV_UserArgs_MT64x48x64_MI16x16x1_SN_LDSB0_AFC0_AFEM1_AFEM1_ASEM1_CLR0_CADS0_DTLA1_DTLB1_DTVA0_DTVB0_EPS0_FDSI0_GRPM1_GRVWA8_GRVWB8_GSU0_GSUAMB_GSUC0_GSUWGMRR0_GLS0_ISA950_IU1_K1_LBSPPA1024_LBSPPB1024_LBSPPM0_LPA16_LPB16_LPM0_LRVW8_LWPMn1_MIAV0_MIWT4_3_MO40_NTn1_NTA7_NTB1_NTC3_NTD3_NTM0_NEPBS8_NLCA1_NLCB1_ONLL1_PGR2_PLR0_PKA1_SIA3_SS1_SU0_SUM0_SUS128_SPO0_SRVW0_SSO0_SVW4_SK3_SKXCCM0_TLDS1_ULSGRO0_USL1_UIOFGRO0_USFGRO1_VSn1_VWA4_VWB1_WSGRA0_WSGRB0_WS64_WG16_4_2_WGM1_WGMXCC16_WGMXCCGn1
    SolutionIndex: 328
    SolutionNameMin: Cijk_Alik_Bljk_BBS_BH_Bias_HAS_SAV_UserArgs_MT64x144x64_MI16x16x1_SN_LDSB0_AFC0_AFEM1_AFEM1_ASEM1_CLR1_CADS0_DTLA1_DTLB1_DTVA0_DTVB0_EPS0_FDSI0_GRPM1_GRVWA8_GRVWB2_GSU0_GSUAMB_GSUC0_GSUWGMRR0_GLS0_ISA950_IU1_K1_LBSPPA1024_LBSPPB256_LBSPPM0_LPA16_LPB16_LPM0_LRVW8_LWPMn1_MIAV1_MIWT1_9_MO40_NTn1_NTA7_NTB1_NTC1_NTD1_NTM0_NEPBS0_NLCA1_NLCB1_ONLL1_PGR2_PLR1_PKA1_SIA3_SS1_SU16_SUM0_SUS128_SPO0_SRVW0_SSO0_SVW1_SK3_SKXCCM5_TLDS2_ULSGRO0_USL1_UIOFGRO0_USFGRO0_VSn1_VWA1_VWB1_WSGRA0_WSGRB0_WS64_WG64_4_1_WGM0_WGMXCC16_WGMXCCGn1
    SolutionIndex: 329
    SolutionNameMin: Cijk_Alik_Bljk_BBS_BH_Bias_HAS_SAV_UserArgs_MT128x128x64_MI32x32x1_SN_LDSB0_AFC0_AFEM1_AFEM1_ASEM1_CLR1_CADS0_DTLA0_DTLB0_DTVA0_DTVB0_EPS0_FDSI0_GRPM1_GRVWA8_GRVWB8_GSU0_GSUAMB_GSUC0_GSUWGMRR0_GLS0_ISA950_IU1_K1_LBSPPA512_LBSPPB128_LBSPPM0_LPA8_LPB8_LPM0_LRVW8_LWPMn1_MIAV0_MIWT4_1_MO40_NTn1_NTA6_NTB2_NTC1_NTD2_NTM0_NEPBS0_NLCA1_NLCB1_ONLL1_PGR2_PLR1_PKA1_SIA3_SS1_SU16_SUM0_SUS128_SPO0_SRVW0_SSO0_SVW4_SK3_SKXCCM5_TLDS1_ULSGRO0_USL1_UIOFGRO0_USFGROn1_VSn1_VWA4_VWB1_WSGRA0_WSGRB0_WS64_WG32_8_1_WGM1_WGMXCC16_WGMXCCGn1
    SolutionIndex: 330
    SolutionNameMin: Cijk_Alik_Bljk_BBS_BH_Bias_HAS_SAV_UserArgs_MT128x160x64_MI16x16x1_SN_LDSB0_AFC0_AFEM1_AFEM1_ASEM1_CLR1_CADS0_DTLA1_DTLB1_DTVA0_DTVB0_EPS0_FDSI0_GRPM1_GRVWA8_GRVWB8_GSU0_GSUAMB_GSUC0_GSUWGMRR0_GLS0_ISA950_IU1_K1_LBSPPA1024_LBSPPB1024_LBSPPM0_LPA16_LPB16_LPM0_LRVW8_LWPMn1_MIAV0_MIWT4_5_MO40_NTn1_NTA7_NTB3_NTC1_NTD2_NTM0_NEPBS0_NLCA1_NLCB1_ONLL1_PGR2_PLR1_PKA1_SIA3_SS1_SU0_SUM0_SUS128_SPO1_SRVW0_SSO0_SVW4_SK3_SKXCCM5_TLDS2_ULSGRO0_USL1_UIOFGRO0_USFGRO1_VSn1_VWA4_VWB1_WSGRA0_WSGRB0_WS64_WG32_8_1_WGM8_WGMXCC8_WGMXCCGn1
    SolutionIndex: 331
    SolutionNameMin: Cijk_Alik_Bljk_BBS_BH_Bias_HAS_SAV_UserArgs_MT128x96x64_MI16x16x1_SN_LDSB0_AFC0_AFEM1_AFEM1_ASEM1_CLR0_CADS0_DTLA1_DTLB1_DTVA0_DTVB0_EPS0_FDSI0_GRPM1_GRVWA2_GRVWB8_GSU0_GSUAMB_GSUC0_GSUWGMRR0_GLS0_ISA950_IU1_K1_LBSPPA512_LBSPPB1024_LBSPPM0_LPA16_LPB16_LPM0_LRVW8_LWPMn1_MIAV0_MIWT4_3_MO40_NTn1_NTA5_NTB1_NTC0_NTD7_NTM0_NEPBS0_NLCA1_NLCB1_ONLL1_PGR2_PLR1_PKA1_SIA3_SS1_SU0_SUM0_SUS128_SPO0_SRVW0_SSO0_SVW4_SK3_SKXCCM4_TLDS1_ULSGRO0_USL1_UIOFGRO0_USFGRO0_VSn1_VWA4_VWB1_WSGRA0_WSGRB0_WS64_WG32_8_1_WGM6_WGMXCC2_WGMXCCGn1
    SolutionIndex: 334
    SolutionNameMin: Cijk_Alik_Bljk_BBS_BH_Bias_HAS_SAV_UserArgs_MT128x128x64_MI16x16x1_SN_LDSB0_AFC0_AFEM1_AFEM1_ASEM1_CLR1_CADS0_DTLA0_DTLB0_DTVA0_DTVB0_EPS0_FDSI0_GRPM1_GRVWA8_GRVWB8_GSU0_GSUAMB_GSUC0_GSUWGMRR0_GLS0_ISA950_IU1_K1_LBSPPA256_LBSPPB1024_LBSPPM0_LPA16_LPB16_LPM0_LRVW8_LWPMn1_MIAV0_MIWT2_8_MO40_NTn1_NTA7_NTB2_NTC0_NTD4_NTM0_NEPBS0_NLCA1_NLCB1_ONLL1_PGR2_PLR1_PKA1_SIA3_SS1_SU0_SUM0_SUS128_SPO1_SRVW0_SSO1_SVW2_SK3_SKXCCM8_TLDS1_ULSGRO0_USL1_UIOFGRO0_USFGRO0_VSn1_VWA2_VWB8_WSGRA0_WSGRB0_WS64_WG64_4_1_WGM8_WGMXCC1_WGMXCCGn1
    SolutionIndex: 337
    SolutionNameMin: Cijk_Alik_Bljk_BBS_BH_Bias_HAS_SAV_UserArgs_MT256x192x64_MI16x16x1_SN_LDSB0_AFC0_AFEM1_AFEM1_ASEM1_CLR1_CADS0_DTLA1_DTLB1_DTVA0_DTVB0_EPS0_FDSI0_GRPM1_GRVWA8_GRVWB8_GSU0_GSUAMB_GSUC0_GSUWGMRR0_GLS0_ISA950_IU1_K1_LBSPPA1024_LBSPPB1024_LBSPPM0_LPA16_LPB16_LPM0_LRVW8_LWPMn1_MIAV0_MIWT16_3_MO40_NTn1_NTA2_NTB0_NTC7_NTD7_NTM0_NEPBS16_NLCA1_NLCB1_ONLL1_PGR2_PLR1_PKA1_SIA3_SS1_SU16_SUM0_SUS128_SPO0_SRVW0_SSO1_SVW8_SK3_SKXCCM0_TLDS1_ULSGRO0_USL1_UIOFGRO0_USFGROn1_VSn1_VWA8_VWB1_WSGRA0_WSGRB0_WS64_WG16_16_1_WGM1_WGMXCC4_WGMXCCGn1
    SolutionIndex: 346
    SolutionNameMin: Cijk_Alik_Bljk_BBS_BH_Bias_HAS_SAV_UserArgs_MT160x64x64_MI16x16x1_SN_LDSB1_AFC0_AFEM1_AFEM1_ASEM1_CLR0_CADS0_DTLA0_DTLB0_DTVA0_DTVB0_EPS0_FDSI0_GRPM1_GRVWA8_GRVWB8_GSU0_GSUAMB_GSUC0_GSUWGMRR0_GLS0_ISA950_IU1_K1_LBSPPA256_LBSPPB128_LBSPPM0_LPA16_LPB16_LPM0_LRVW8_LWPMn1_MIAV0_MIWT10_1_MO40_NTn1_NTA7_NTB2_NTC1_NTD2_NTM0_NEPBS0_NLCA1_NLCB1_ONLL1_PGR2_PLR1_PKA1_SIA3_SS0_SU0_SUM0_SUS128_SPO0_SRVW0_SSO4_SVW8_SK3_SKXCCM7_TLDS1_ULSGRO0_USL1_UIOFGRO0_USFGRO0_VSn1_VWA2_VWB1_WSGRA0_WSGRB0_WS64_WG16_16_1_WGM2_WGMXCC8_WGMXCCGn1
    SolutionIndex: 353
    SolutionNameMin: Cijk_Alik_Bljk_BBS_BH_Bias_HAS_SAV_UserArgs_MT16x64x64_MI16x16x1_SN_LDSB0_AFC0_AFEM1_AFEM1_ASEM1_CLR1_CADS0_DTLA1_DTLB1_DTVA0_DTVB0_EPS0_FDSI0_GRPM1_GRVWA8_GRVWB8_GSU0_GSUAMB_GSUC0_GSUWGMRR0_GLS0_ISA950_IU1_K1_LBSPPA1024_LBSPPB1024_LBSPPM0_LPA16_LPB16_LPM0_LRVW8_LWPMn1_MIAV1_MIWT1_2_MO40_NTn1_NTA0_NTB3_NTC3_NTD3_NTM0_NEPBS0_NLCA1_NLCB1_ONLL1_PGR2_PLR1_PKA1_SIA3_SS0_SU0_SUM0_SUS128_SPO0_SRVW0_SSO0_SVW4_SK3_SKXCCM0_TLDS1_ULSGRO0_USL1_UIOFGRO0_USFGRO1_VSn1_VWA1_VWB2_WSGRA0_WSGRB0_WS64_WG16_8_1_WGM0_WGMXCC2_WGMXCCGn1
    SolutionIndex: 355
    SolutionNameMin: Cijk_Alik_Bljk_BBS_BH_Bias_HAS_SAV_UserArgs_MT32x64x64_MI16x16x1_SN_LDSB0_AFC0_AFEM1_AFEM1_ASEM1_CLR0_CADS0_DTLA1_DTLB1_DTVA0_DTVB0_EPS0_FDSI0_GRPM1_GRVWA8_GRVWB2_GSU0_GSUAMB_GSUC0_GSUWGMRR0_GLS0_ISA950_IU1_K1_LBSPPA1024_LBSPPB256_LBSPPM0_LPA16_LPB16_LPM0_LRVW8_LWPMn1_MIAV1_MIWT1_2_MO40_NTn1_NTA3_NTB3_NTC0_NTD1_NTM0_NEPBS14_NLCA1_NLCB1_ONLL1_PGR2_PLR1_PKA1_SIA3_SS0_SU0_SUM0_SUS128_SPO1_SRVW0_SSO0_SVW4_SK3_SKXCCM0_TLDS1_ULSGRO0_USL1_UIOFGRO0_USFGROn1_VSn1_VWA1_VWB2_WSGRA0_WSGRB0_WS64_WG32_8_1_WGM2_WGMXCC2_WGMXCCGn1
    SolutionIndex: 356
    SolutionNameMin: Cijk_Alik_Bljk_BBS_BH_Bias_HAS_SAV_UserArgs_MT32x64x64_MI16x16x1_SN_LDSB0_AFC0_AFEM1_AFEM1_ASEM1_CLR0_CADS0_DTLA1_DTLB1_DTVA0_DTVB0_EPS0_FDSI0_GRPM1_GRVWA2_GRVWB8_GSU0_GSUAMB_GSUC0_GSUWGMRR0_GLS0_ISA950_IU1_K1_LBSPPA256_LBSPPB1024_LBSPPM0_LPA16_LPB16_LPM0_LRVW8_LWPMn1_MIAV0_MIWT2_1_MO40_NTn1_NTA0_NTB0_NTC2_NTD1_NTM0_NEPBS14_NLCA1_NLCB1_ONLL1_PGR2_PLR1_PKA1_SIA3_SS1_SU0_SUM0_SUS128_SPO0_SRVW0_SSO0_SVW2_SK3_SKXCCM0_TLDS2_ULSGRO0_USL1_UIOFGRO0_USFGRO0_VSn1_VWA2_VWB1_WSGRA0_WSGRB0_WS64_WG16_16_1_WGM0_WGMXCC2_WGMXCCGn1
    SolutionIndex: 358
    SolutionNameMin: Cijk_Alik_Bljk_BBS_BH_Bias_HAS_SAV_UserArgs_MT128x96x64_MI16x16x1_SN_LDSB0_AFC0_AFEM1_AFEM1_ASEM1_CLR1_CADS0_DTLA1_DTLB1_DTVA0_DTVB0_EPS0_FDSI0_GRPM1_GRVWA8_GRVWB8_GSU0_GSUAMB_GSUC0_GSUWGMRR0_GLS0_ISA950_IU1_K1_LBSPPA1024_LBSPPB1024_LBSPPM0_LPA16_LPB16_LPM0_LRVW8_LWPMn1_MIAV0_MIWT4_3_MO40_NTn1_NTA3_NTB4_NTC0_NTD3_NTM0_NEPBS0_NLCA1_NLCB1_ONLL1_PGR2_PLR1_PKA1_SIA3_SS1_SU8_SUM0_SUS128_SPO1_SRVW0_SSO0_SVW4_SK3_SKXCCM4_TLDS2_ULSGRO0_USL1_UIOFGRO0_USFGRO1_VSn1_VWA4_VWB1_WSGRA0_WSGRB0_WS64_WG32_8_1_WGM1_WGMXCC8_WGMXCCGn1
    SolutionIndex: 359
    SolutionNameMin: Cijk_Alik_Bljk_BBS_BH_Bias_HAS_SAV_UserArgs_MT16x16x64_MI16x16x1_SN_LDSB0_AFC0_AFEM1_AFEM1_ASEM1_CLR0_CADS0_DTLA1_DTLB1_DTVA0_DTVB0_EPS0_FDSI0_GRPM1_GRVWA8_GRVWB8_GSU0_GSUAMB_GSUC0_GSUWGMRR0_GLS0_ISA950_IU1_K1_LBSPPA1024_LBSPPB1024_LBSPPM0_LPA16_LPB16_LPM0_LRVW8_LWPMn1_MIAV1_MIWT1_1_MO40_NTn1_NTA6_NTB0_NTC2_NTD2_NTM0_NEPBS2_NLCA1_NLCB1_ONLL1_PGR2_PLR0_PKA1_SIA3_SS1_SU0_SUM0_SUS128_SPO0_SRVW0_SSO0_SVW1_SK3_SKXCCM4_TLDS1_ULSGRO0_USL1_UIOFGRO0_USFGRO1_VSn1_VWA1_VWB1_WSGRA0_WSGRB0_WS64_WG16_4_2_WGM0_WGMXCC4_WGMXCCGn1
    SolutionIndex: 361
    SolutionNameMin: Cijk_Alik_Bljk_BBS_BH_Bias_HAS_SAV_UserArgs_MT32x64x64_MI16x16x1_SN_LDSB0_AFC0_AFEM1_AFEM1_ASEM1_CLR1_CADS0_DTLA1_DTLB1_DTVA0_DTVB0_EPS0_FDSI0_GRPM1_GRVWA8_GRVWB2_GSU0_GSUAMB_GSUC0_GSUWGMRR0_GLS0_ISA950_IU1_K1_LBSPPA1024_LBSPPB256_LBSPPM0_LPA16_LPB16_LPM0_LRVW8_LWPMn1_MIAV1_MIWT1_2_MO40_NTn1_NTA0_NTB3_NTC0_NTD0_NTM0_NEPBS8_NLCA1_NLCB1_ONLL1_PGR2_PLR1_PKA1_SIA3_SS0_SU0_SUM0_SUS128_SPO1_SRVW0_SSO0_SVW4_SK3_SKXCCM0_TLDS1_ULSGRO0_USL1_UIOFGRO0_USFGROn1_VSn1_VWA1_VWB2_WSGRA0_WSGRB0_WS64_WG32_8_1_WGM1_WGMXCC2_WGMXCCGn1
    SolutionIndex: 362
    SolutionNameMin: Cijk_Alik_Bljk_BBS_BH_Bias_HAS_SAV_UserArgs_MT64x32x64_MI16x16x1_SN_LDSB0_AFC0_AFEM1_AFEM1_ASEM1_CLR0_CADS0_DTLA1_DTLB1_DTVA0_DTVB0_EPS0_FDSI0_GRPM1_GRVWA8_GRVWB2_GSU0_GSUAMB_GSUC0_GSUWGMRR0_GLS0_ISA950_IU1_K1_LBSPPA1024_LBSPPB256_LBSPPM0_LPA16_LPB16_LPM0_LRVW8_LWPMn1_MIAV1_MIWT1_2_MO40_NTn1_NTA0_NTB2_NTC3_NTD1_NTM0_NEPBS10_NLCA1_NLCB1_ONLL1_PGR2_PLR1_PKA1_SIA3_SS0_SU0_SUM0_SUS128_SPO0_SRVW0_SSO0_SVW4_SK3_SKXCCM4_TLDS1_ULSGRO0_USL1_UIOFGRO0_USFGRO1_VSn1_VWA1_VWB2_WSGRA0_WSGRB0_WS64_WG64_4_1_WGM1_WGMXCC4_WGMXCCGn1
    SolutionIndex: 364
    SolutionNameMin: Cijk_Alik_Bljk_BBS_BH_Bias_HAS_SAV_UserArgs_MT80x64x64_MI16x16x1_SN_LDSB0_AFC0_AFEM1_AFEM1_ASEM1_CLR0_CADS0_DTLA1_DTLB1_DTVA0_DTVB0_EPS0_FDSI0_GRPM1_GRVWA2_GRVWB2_GSU0_GSUAMB_GSUC0_GSUWGMRR0_GLS0_ISA950_IU1_K1_LBSPPA256_LBSPPB256_LBSPPM0_LPA16_LPB16_LPM0_LRVW8_LWPMn1_MIAV1_MIWT5_1_MO40_NTn1_NTA1_NTB2_NTC0_NTD1_NTM0_NEPBS0_NLCA1_NLCB1_ONLL1_PGR2_PLR1_PKA1_SIA3_SS1_SU0_SUM0_SUS128_SPO0_SRVW0_SSO0_SVW1_SK3_SKXCCM5_TLDS1_ULSGRO0_USL1_UIOFGRO0_USFGRO0_VSn1_VWA1_VWB1_WSGRA0_WSGRB0_WS64_WG16_16_1_WGM1_WGMXCC8_WGMXCCGn1
    SolutionIndex: 365
    SolutionNameMin: Cijk_Alik_Bljk_BBS_BH_Bias_HAS_SAV_UserArgs_MT64x96x64_MI16x16x1_SN_LDSB0_AFC0_AFEM1_AFEM1_ASEM1_CLR0_CADS0_DTLA1_DTLB1_DTVA0_DTVB0_EPS0_FDSI0_GRPM1_GRVWA2_GRVWB8_GSU0_GSUAMB_GSUC0_GSUWGMRR0_GLS0_ISA950_IU1_K1_LBSPPA256_LBSPPB1024_LBSPPM0_LPA16_LPB16_LPM0_LRVW8_LWPMn1_MIAV1_MIWT2_3_MO40_NTn1_NTA0_NTB0_NTC0_NTD0_NTM0_NEPBS12_NLCA1_NLCB1_ONLL1_PGR2_PLR1_PKA1_SIA3_SS1_SU0_SUM0_SUS128_SPO0_SRVW0_SSO0_SVW2_SK3_SKXCCM4_TLDS1_ULSGRO0_USL1_UIOFGRO0_USFGRO0_VSn1_VWA2_VWB1_WSGRA0_WSGRB0_WS64_WG32_8_1_WGM0_WGMXCC8_WGMXCCGn1
    SolutionIndex: 369
    SolutionNameMin: Cijk_Alik_Bljk_BBS_BH_Bias_HAS_SAV_UserArgs_MT16x16x256_MI16x16x1_SN_LDSB0_AFC0_AFEM1_AFEM1_ASEM1_CLR1_CADS0_DTLA1_DTLB1_DTVA0_DTVB0_EPS0_FDSI0_GRPM1_GRVWA8_GRVWB8_GSU0_GSUAMB_GSUC0_GSUWGMRR0_GLS0_ISA950_IU1_K1_LBSPPA1024_LBSPPB1024_LBSPPM0_LPA16_LPB16_LPM0_LRVW8_LWPMn1_MIAV1_MIWT1_1_MO40_NTn1_NTA4_NTB2_NTC3_NTD0_NTM0_NEPBS14_NLCA1_NLCB1_ONLL1_PGR2_PLR1_PKA1_SIA3_SS1_SU0_SUM0_SUS512_SPO0_SRVW0_SSO0_SVW1_SK3_SKXCCM0_TLDS2_ULSGRO0_USL1_UIOFGRO0_USFGROn1_VSn1_VWA1_VWB1_WSGRA0_WSGRB0_WS64_WG16_4_2_WGM0_WGMXCC8_WGMXCCGn1
    SolutionIndex: 372
    SolutionNameMin: Cijk_Alik_Bljk_BBS_BH_Bias_HAS_SAV_UserArgs_MT64x96x128_MI16x16x1_SN_LDSB0_AFC0_AFEM1_AFEM1_ASEM1_CLR1_CADS0_DTLA0_DTLB0_DTVA0_DTVB0_EPS0_FDSI0_GRPM1_GRVWA8_GRVWB8_GSU0_GSUAMB_GSUC0_GSUWGMRR0_GLS0_ISA950_IU1_K1_LBSPPA512_LBSPPB256_LBSPPM0_LPA16_LPB16_LPM0_LRVW8_LWPMn1_MIAV1_MIWT2_3_MO40_NTn1_NTA7_NTB1_NTC1_NTD3_NTM0_NEPBS16_NLCA1_NLCB1_ONLL1_PGR2_PLR1_PKA1_SIA3_SS1_SU0_SUM0_SUS256_SPO0_SRVW0_SSO0_SVW2_SK3_SKXCCM8_TLDS1_ULSGRO0_USL1_UIOFGRO0_USFGRO0_VSn1_VWA2_VWB1_WSGRA0_WSGRB0_WS64_WG32_8_1_WGM0_WGMXCC2_WGMXCCGn1
    SolutionIndex: 375
    SolutionNameMin: Cijk_Alik_Bljk_BBS_BH_Bias_HAS_SAV_UserArgs_MT96x96x128_MI16x16x1_SN_LDSB1_AFC0_AFEM1_AFEM1_ASEM1_CLR1_CADS0_DTLA0_DTLB0_DTVA0_DTVB0_EPS0_FDSI0_GRPM1_GRVWA8_GRVWB8_GSU0_GSUAMB_GSUC0_GSUWGMRR0_GLS0_ISA950_IU1_K1_LBSPPA256_LBSPPB256_LBSPPM0_LPA16_LPB16_LPM0_LRVW8_LWPMn1_MIAV0_MIWT3_3_MO40_NTn1_NTA7_NTB0_NTC1_NTD1_NTM0_NEPBS0_NLCA1_NLCB1_ONLL1_PGR2_PLR1_PKA1_SIA3_SS1_SU0_SUM0_SUS256_SPO1_SRVW0_SSO0_SVW1_SK3_SKXCCM4_TLDS1_ULSGRO0_USL1_UIOFGRO0_USFGRO0_VSn1_VWA1_VWB1_WSGRA0_WSGRB0_WS64_WG32_8_1_WGM1_WGMXCC4_WGMXCCGn1
    SolutionIndex: 390
    SolutionNameMin: Cijk_Alik_Bljk_BBS_BH_Bias_HAS_SAV_UserArgs_MT192x192x64_MI16x16x1_SN_LDSB1_AFC0_AFEM1_AFEM1_ASEM1_CLR0_CADS0_DTLA0_DTLB0_DTVA0_DTVB0_EPS0_FDSI0_GRPM1_GRVWA8_GRVWB8_GSU0_GSUAMB_GSUC0_GSUWGMRR0_GLS0_ISA950_IU1_K1_LBSPPA512_LBSPPB128_LBSPPM0_LPA16_LPB16_LPM0_LRVW8_LWPMn1_MIAV0_MIWT12_3_MO40_NTn1_NTA2_NTB3_NTC5_NTD6_NTM0_NEPBS0_NLCA1_NLCB1_ONLL1_PGR2_PLR1_PKA1_SIA3_SS1_SU0_SUM0_SUS128_SPO0_SRVW0_SSO1_SVW4_SK3_SKXCCM0_TLDS1_ULSGRO0_USL1_UIOFGRO0_USFGRO1_VSn1_VWA4_VWB1_WSGRA0_WSGRB0_WS64_WG16_16_1_WGM16_WGMXCC4_WGMXCCGn1
    SolutionIndex: 391
    SolutionNameMin: Cijk_Alik_Bljk_BBS_BH_Bias_HAS_SAV_UserArgs_MT192x224x64_MI16x16x1_SN_LDSB1_AFC0_AFEM1_AFEM1_ASEM1_CLR0_CADS0_DTLA0_DTLB0_DTVA0_DTVB0_EPS0_FDSI0_GRPM1_GRVWA8_GRVWB8_GSU0_GSUAMB_GSUC0_GSUWGMRR0_GLS0_ISA950_IU1_K1_LBSPPA256_LBSPPB128_LBSPPM0_LPA16_LPB16_LPM0_LRVW8_LWPMn1_MIAV0_MIWT6_7_MO40_NTn1_NTA2_NTB2_NTC1_NTD4_NTM0_NEPBS0_NLCA1_NLCB1_ONLL1_PGR2_PLR1_PKA1_SIA3_SS1_SU16_SUM0_SUS256_SPO1_SRVW0_SSO4_SVW2_SK3_SKXCCM4_TLDS2_ULSGRO0_USL1_UIOFGRO0_USFGROn1_VSn1_VWA2_VWB1_WSGRA0_WSGRB0_WS64_WG32_8_1_WGM4_WGMXCC2_WGMXCCGn1
    SolutionIndex: 392
    SolutionNameMin: Cijk_Alik_Bljk_BBS_BH_Bias_HAS_SAV_UserArgs_MT192x256x64_MI16x16x1_SN_LDSB0_AFC0_AFEM1_AFEM1_ASEM1_CLR1_CADS0_DTLA1_DTLB1_DTVA0_DTVB0_EPS0_FDSI0_GRPM1_GRVWA2_GRVWB8_GSU0_GSUAMB_GSUC0_GSUWGMRR0_GLS0_ISA950_IU1_K1_LBSPPA512_LBSPPB1024_LBSPPM0_LPA16_LPB16_LPM0_LRVW8_LWPMn1_MIAV0_MIWT12_4_MO40_NTn1_NTA0_NTB0_NTC6_NTD7_NTM0_NEPBS0_NLCA1_NLCB1_ONLL1_PGR2_PLR1_PKA1_SIA3_SS1_SU8_SUM0_SUS128_SPO0_SRVW0_SSO0_SVW4_SK3_SKXCCM8_TLDS1_ULSGRO0_USL1_UIOFGRO0_USFGRO0_VSn1_VWA4_VWB4_WSGRA0_WSGRB0_WS64_WG16_16_1_WGM2_WGMXCC4_WGMXCCGn1
    SolutionIndex: 395
    SolutionNameMin: Cijk_Alik_Bljk_BBS_BH_Bias_HAS_SAV_UserArgs_MT64x192x64_MI16x16x1_SN_LDSB0_AFC0_AFEM1_AFEM1_ASEM1_CLR0_CADS0_DTLA1_DTLB1_DTVA0_DTVB0_EPS0_FDSI0_GRPM1_GRVWA2_GRVWB8_GSU0_GSUAMB_GSUC0_GSUWGMRR0_GLS0_ISA950_IU1_K1_LBSPPA512_LBSPPB1024_LBSPPM0_LPA16_LPB16_LPM0_LRVW8_LWPMn1_MIAV1_MIWT4_3_MO40_NTn1_NTA4_NTB3_NTC2_NTD2_NTM0_NEPBS0_NLCA1_NLCB1_ONLL1_PGR2_PLR1_PKA1_SIA3_SS1_SU8_SUM0_SUS128_SPO0_SRVW0_SSO0_SVW4_SK3_SKXCCM6_TLDS1_ULSGRO0_USL1_UIOFGRO0_USFGRO0_VSn1_VWA4_VWB1_WSGRA0_WSGRB0_WS64_WG16_16_1_WGM1_WGMXCC4_WGMXCCGn1
    SolutionIndex: 397
    SolutionNameMin: Cijk_Alik_Bljk_BBS_BH_Bias_HAS_SAV_UserArgs_MT128x192x64_MI16x16x1_SN_LDSB0_AFC0_AFEM1_AFEM1_ASEM1_CLR1_CADS0_DTLA0_DTLB0_DTVA0_DTVB0_EPS0_FDSI0_GRPM1_GRVWA8_GRVWB8_GSU0_GSUAMB_GSUC0_GSUWGMRR0_GLS0_ISA950_IU1_K1_LBSPPA512_LBSPPB256_LBSPPM0_LPA16_LPB16_LPM0_LRVW8_LWPMn1_MIAV0_MIWT4_6_MO40_NTn1_NTA7_NTB0_NTC4_NTD1_NTM0_NEPBS0_NLCA1_NLCB1_ONLL1_PGR2_PLR1_PKA1_SIA3_SS1_SU0_SUM0_SUS128_SPO0_SRVW0_SSO0_SVW4_SK3_SKXCCM5_TLDS2_ULSGRO0_USL1_UIOFGRO0_USFGRO0_VSn1_VWA4_VWB2_WSGRA0_WSGRB0_WS64_WG32_8_1_WGM0_WGMXCC16_WGMXCCGn1
    SolutionIndex: 398
    SolutionNameMin: Cijk_Alik_Bljk_BBS_BH_Bias_HAS_SAV_UserArgs_MT64x160x64_MI16x16x1_SN_LDSB0_AFC0_AFEM1_AFEM1_ASEM1_CLR1_CADS0_DTLA1_DTLB1_DTVA0_DTVB0_EPS0_FDSI0_GRPM1_GRVWA2_GRVWB2_GSU0_GSUAMB_GSUC0_GSUWGMRR0_GLS0_ISA950_IU1_K1_LBSPPA256_LBSPPB256_LBSPPM0_LPA16_LPB16_LPM0_LRVW8_LWPMn1_MIAV0_MIWT2_5_MO40_NTn1_NTA4_NTB2_NTC0_NTD4_NTM0_NEPBS0_NLCA1_NLCB1_ONLL1_PGR2_PLR1_PKA1_SIA3_SS1_SU0_SUM0_SUS128_SPO0_SRVW0_SSO0_SVW2_SK3_SKXCCM4_TLDS1_ULSGRO0_USL1_UIOFGRO0_USFGRO0_VSn1_VWA2_VWB1_WSGRA0_WSGRB0_WS64_WG32_8_1_WGM8_WGMXCC2_WGMXCCGn1
    SolutionIndex: 399
    SolutionNameMin: Cijk_Alik_Bljk_BBS_BH_Bias_HAS_SAV_UserArgs_MT128x128x64_MI16x16x1_SN_LDSB0_AFC0_AFEM1_AFEM1_ASEM1_CLR1_CADS0_DTLA1_DTLB1_DTVA0_DTVB0_EPS0_FDSI0_GRPM1_GRVWA8_GRVWB8_GSU0_GSUAMB_GSUC0_GSUWGMRR0_GLS0_ISA950_IU1_K1_LBSPPA1024_LBSPPB1024_LBSPPM0_LPA16_LPB16_LPM0_LRVW8_LWPMn1_MIAV0_MIWT8_2_MO40_NTn1_NTA2_NTB3_NTC6_NTD5_NTM0_NEPBS12_NLCA1_NLCB1_ONLL1_PGR2_PLR1_PKA1_SIA3_SS1_SU8_SUM0_SUS128_SPO0_SRVW0_SSO0_SVW8_SK3_SKXCCM0_TLDS1_ULSGRO0_USL1_UIOFGRO0_USFGRO0_VSn1_VWA8_VWB2_WSGRA0_WSGRB0_WS64_WG16_16_1_WGM8_WGMXCC8_WGMXCCGn1
    SolutionIndex: 401
    SolutionNameMin: Cijk_Alik_Bljk_BBS_BH_Bias_HAS_SAV_UserArgs_MT128x160x64_MI16x16x1_SN_LDSB0_AFC0_AFEM1_AFEM1_ASEM1_CLR1_CADS0_DTLA1_DTLB1_DTVA0_DTVB0_EPS0_FDSI0_GRPM1_GRVWA2_GRVWB8_GSU0_GSUAMB_GSUC0_GSUWGMRR0_GLS0_ISA950_IU1_K1_LBSPPA512_LBSPPB1024_LBSPPM0_LPA16_LPB16_LPM0_LRVW8_LWPMn1_MIAV0_MIWT4_5_MO40_NTn1_NTA4_NTB3_NTC7_NTD7_NTM0_NEPBS0_NLCA1_NLCB1_ONLL1_PGR2_PLR1_PKA1_SIA3_SS1_SU0_SUM0_SUS128_SPO1_SRVW0_SSO0_SVW4_SK3_SKXCCM8_TLDS1_ULSGRO0_USL1_UIOFGRO0_USFGRO0_VSn1_VWA4_VWB1_WSGRA0_WSGRB0_WS64_WG32_8_1_WGM16_WGMXCC1_WGMXCCGn1
    SolutionIndex: 402
    SolutionNameMin: Cijk_Alik_Bljk_BBS_BH_Bias_HAS_SAV_UserArgs_MT160x128x64_MI16x16x1_SN_LDSB0_AFC0_AFEM1_AFEM1_ASEM1_CLR1_CADS0_DTLA1_DTLB1_DTVA0_DTVB0_EPS0_FDSI0_GRPM1_GRVWA2_GRVWB8_GSU0_GSUAMB_GSUC0_GSUWGMRR0_GLS0_ISA950_IU1_K1_LBSPPA256_LBSPPB1024_LBSPPM0_LPA16_LPB16_LPM0_LRVW8_LWPMn1_MIAV0_MIWT10_2_MO40_NTn1_NTA2_NTB1_NTC1_NTD5_NTM0_NEPBS0_NLCA1_NLCB1_ONLL1_PGR2_PLR1_PKA1_SIA3_SS1_SU0_SUM0_SUS128_SPO1_SRVW0_SSO1_SVW2_SK3_SKXCCM4_TLDS1_ULSGRO0_USL1_UIOFGRO0_USFGRO0_VSn1_VWA2_VWB2_WSGRA0_WSGRB0_WS64_WG16_16_1_WGM0_WGMXCC8_WGMXCCGn1
    SolutionIndex: 403
    SolutionNameMin: Cijk_Alik_Bljk_BBS_BH_Bias_HAS_SAV_UserArgs_MT256x160x64_MI16x16x1_SN_LDSB0_AFC0_AFEM1_AFEM1_ASEM1_CLR0_CADS0_DTLA1_DTLB1_DTVA0_DTVB0_EPS0_FDSI0_GRPM1_GRVWA8_GRVWB8_GSU0_GSUAMB_GSUC0_GSUWGMRR0_GLS0_ISA950_IU1_K1_LBSPPA1024_LBSPPB1024_LBSPPM0_LPA16_LPB16_LPM0_LRVW8_LWPMn1_MIAV0_MIWT8_5_MO40_NTn1_NTA2_NTB3_NTC4_NTD6_NTM0_NEPBS16_NLCA1_NLCB1_ONLL1_PGR2_PLR1_PKA1_SIA3_SS1_SU16_SUM0_SUS256_SPO0_SRVW0_SSO0_SVW8_SK3_SKXCCM0_TLDS2_ULSGRO0_USL1_UIOFGRO0_USFGROn1_VSn1_VWA8_VWB1_WSGRA0_WSGRB0_WS64_WG32_8_1_WGM24_WGMXCC8_WGMXCCGn1
    SolutionIndex: 404
    SolutionNameMin: Cijk_Alik_Bljk_BBS_BH_Bias_HAS_SAV_UserArgs_MT256x224x64_MI16x16x1_SN_LDSB0_AFC0_AFEM1_AFEM1_ASEM1_CLR1_CADS0_DTLA1_DTLB1_DTVA0_DTVB0_EPS0_FDSI0_GRPM1_GRVWA8_GRVWB8_GSU0_GSUAMB_GSUC0_GSUWGMRR0_GLS0_ISA950_IU1_K1_LBSPPA1024_LBSPPB1024_LBSPPM0_LPA16_LPB16_LPM0_LRVW8_LWPMn1_MIAV0_MIWT8_7_MO40_NTn1_NTA2_NTB2_NTC5_NTD5_NTM0_NEPBS0_NLCA1_NLCB1_ONLL1_PGR2_PLR1_PKA1_SIA3_SS1_SU16_SUM0_SUS128_SPO0_SRVW0_SSO1_SVW8_SK3_SKXCCM0_TLDS1_ULSGRO0_USL1_UIOFGRO0_USFGRO0_VSn1_VWA8_VWB1_WSGRA0_WSGRB0_WS64_WG32_8_1_WGM1_WGMXCC2_WGMXCCGn1
    SolutionIndex: 409
    SolutionNameMin: Cijk_Alik_Bljk_BBS_BH_Bias_HAS_SAV_UserArgs_MT128x80x64_MI16x16x1_SN_LDSB0_AFC0_AFEM1_AFEM1_ASEM1_CLR0_CADS0_DTLA1_DTLB1_DTVA0_DTVB0_EPS0_FDSI0_GRPM1_GRVWA8_GRVWB2_GSU0_GSUAMB_GSUC0_GSUWGMRR0_GLS0_ISA950_IU1_K1_LBSPPA1024_LBSPPB256_LBSPPM0_LPA16_LPB16_LPM0_LRVW8_LWPMn1_MIAV1_MIWT2_5_MO40_NTn1_NTA7_NTB3_NTC0_NTD0_NTM0_NEPBS0_NLCA1_NLCB1_ONLL1_PGR2_PLR1_PKA1_SIA3_SS0_SU8_SUM0_SUS128_SPO0_SRVW0_SSO0_SVW8_SK3_SKXCCM0_TLDS1_ULSGRO0_USL1_UIOFGRO0_USFGROn1_VSn1_VWA2_VWB1_WSGRA0_WSGRB0_WS64_WG64_4_1_WGM0_WGMXCC1_WGMXCCGn1
    SolutionIndex: 411
    SolutionNameMin: Cijk_Alik_Bljk_BBS_BH_Bias_HAS_SAV_UserArgs_MT448x32x64_MI16x16x1_SN_LDSB0_AFC0_AFEM1_AFEM1_ASEM1_CLR1_CADS0_DTLA0_DTLB0_DTVA0_DTVB0_EPS0_FDSI0_GRPM1_GRVWA8_GRVWB8_GSU0_GSUAMB_GSUC0_GSUWGMRR0_GLS0_ISA950_IU1_K1_LBSPPA256_LBSPPB128_LBSPPM0_LPA16_LPB16_LPM0_LRVW8_LWPMn1_MIAV0_MIWT14_1_MO40_NTn1_NTA5_NTB1_NTC3_NTD4_NTM0_NEPBS0_NLCA1_NLCB1_ONLL1_PGR2_PLR1_PKA1_SIA3_SS1_SU16_SUM0_SUS256_SPO0_SRVW0_SSO1_SVW2_SK3_SKXCCM8_TLDS1_ULSGRO0_USL1_UIOFGRO0_USFGRO1_VSn1_VWA2_VWB1_WSGRA0_WSGRB0_WS64_WG32_8_1_WGM1_WGMXCC1_WGMXCCGn1
    SolutionIndex: 413
    SolutionNameMin: Cijk_Alik_Bljk_BBS_BH_Bias_HAS_SAV_UserArgs_MT448x96x64_MI16x16x1_SN_LDSB0_AFC0_AFEM1_AFEM1_ASEM1_CLR0_CADS0_DTLA0_DTLB0_DTVA0_DTVB0_EPS0_FDSI0_GRPM1_GRVWA8_GRVWB8_GSU0_GSUAMB_GSUC0_GSUWGMRR0_GLS0_ISA950_IU1_K1_LBSPPA256_LBSPPB128_LBSPPM0_LPA16_LPB16_LPM0_LRVW8_LWPMn1_MIAV0_MIWT14_3_MO40_NTn1_NTA7_NTB2_NTC0_NTD5_NTM0_NEPBS0_NLCA1_NLCB1_ONLL1_PGR2_PLR1_PKA1_SIA3_SS1_SU0_SUM0_SUS128_SPO1_SRVW0_SSO0_SVW2_SK3_SKXCCM8_TLDS1_ULSGRO0_USL1_UIOFGRO0_USFGRO0_VSn1_VWA2_VWB1_WSGRA0_WSGRB0_WS64_WG32_8_1_WGM24_WGMXCC8_WGMXCCGn1
    SolutionIndex: 419
    SolutionNameMin: Cijk_Alik_Bljk_BBS_BH_Bias_HAS_SAV_UserArgs_MT32x32x64_MI16x16x1_SN_LDSB0_AFC0_AFEM1_AFEM1_ASEM1_CLR1_CADS0_DTLA1_DTLB1_DTVA0_DTVB0_EPS0_FDSI0_GRPM1_GRVWA2_GRVWB8_GSU0_GSUAMB_GSUC0_GSUWGMRR0_GLS0_ISA950_IU1_K1_LBSPPA256_LBSPPB1024_LBSPPM0_LPA16_LPB16_LPM0_LRVW8_LWPMn1_MIAV0_MIWT1_1_MO40_NTn1_NTA3_NTB5_NTC1_NTD1_NTM0_NEPBS12_NLCA1_NLCB1_ONLL1_PGR2_PLR1_PKA1_SIA3_SS1_SU0_SUM0_SUS128_SPO0_SRVW0_SSO0_SVW1_SK3_SKXCCM4_TLDS2_ULSGRO0_USL1_UIOFGRO0_USFGRO0_VSn1_VWA1_VWB1_WSGRA0_WSGRB0_WS64_WG32_8_1_WGM32_WGMXCC8_WGMXCCGn1
    SolutionIndex: 425
    SolutionNameMin: Cijk_Alik_Bljk_BBS_BH_Bias_HAS_SAV_UserArgs_MT32x96x64_MI16x16x1_SN_LDSB0_AFC0_AFEM1_AFEM1_ASEM1_CLR0_CADS0_DTLA1_DTLB1_DTVA0_DTVB0_EPS0_FDSI0_GRPM1_GRVWA2_GRVWB2_GSU0_GSUAMB_GSUC0_GSUWGMRR0_GLS0_ISA950_IU1_K1_LBSPPA256_LBSPPB256_LBSPPM0_LPA16_LPB16_LPM0_LRVW8_LWPMn1_MIAV1_MIWT1_3_MO40_NTn1_NTA0_NTB3_NTC1_NTD0_NTM0_NEPBS16_NLCA1_NLCB1_ONLL1_PGR2_PLR1_PKA1_SIA3_SS1_SU0_SUM0_SUS128_SPO0_SRVW0_SSO0_SVW1_SK3_SKXCCM5_TLDS1_ULSGRO0_USL1_UIOFGRO0_USFGRO0_VSn1_VWA1_VWB1_WSGRA0_WSGRB0_WS64_WG32_8_1_WGM24_WGMXCC8_WGMXCCGn1
    SolutionIndex: 426
    SolutionNameMin: Cijk_Alik_Bljk_BBS_BH_Bias_HAS_SAV_UserArgs_MT64x64x64_MI16x16x1_SN_LDSB0_AFC0_AFEM1_AFEM1_ASEM1_CLR0_CADS0_DTLA1_DTLB1_DTVA0_DTVB0_EPS0_FDSI0_GRPM1_GRVWA8_GRVWB8_GSU0_GSUAMB_GSUC0_GSUWGMRR0_GLS0_ISA950_IU1_K1_LBSPPA1024_LBSPPB1024_LBSPPM0_LPA16_LPB16_LPM0_LRVW8_LWPMn1_MIAV1_MIWT4_1_MO40_NTn1_NTA1_NTB3_NTC3_NTD2_NTM0_NEPBS0_NLCA1_NLCB1_ONLL1_PGR2_PLR1_PKA1_SIA3_SS1_SU0_SUM0_SUS128_SPO0_SRVW0_SSO0_SVW4_SK3_SKXCCM8_TLDS1_ULSGRO0_USL1_UIOFGRO0_USFGRO1_VSn1_VWA4_VWB1_WSGRA0_WSGRB0_WS64_WG16_16_1_WGM0_WGMXCC2_WGMXCCGn1
    SolutionIndex: 431
    SolutionNameMin: Cijk_Alik_Bljk_BBS_BH_Bias_HAS_SAV_UserArgs_MT128x64x64_MI16x16x1_SN_LDSB0_AFC0_AFEM1_AFEM1_ASEM1_CLR0_CADS0_DTLA1_DTLB1_DTVA0_DTVB0_EPS0_FDSI0_GRPM1_GRVWA8_GRVWB2_GSU0_GSUAMB_GSUC0_GSUWGMRR0_GLS0_ISA950_IU1_K1_LBSPPA1024_LBSPPB256_LBSPPM0_LPA16_LPB16_LPM0_LRVW8_LWPMn1_MIAV1_MIWT4_2_MO40_NTn1_NTA2_NTB3_NTC7_NTD1_NTM0_NEPBS14_NLCA1_NLCB1_ONLL1_PGR2_PLR1_PKA1_SIA3_SS1_SU8_SUM0_SUS128_SPO0_SRVW0_SSO0_SVW4_SK3_SKXCCM4_TLDS1_ULSGRO0_USL1_UIOFGRO0_USFGROn1_VSn1_VWA4_VWB2_WSGRA0_WSGRB0_WS64_WG32_8_1_WGM0_WGMXCC16_WGMXCCGn1
    SolutionIndex: 432
    SolutionNameMin: Cijk_Alik_Bljk_BBS_BH_Bias_HAS_SAV_UserArgs_MT128x96x64_MI16x16x1_SN_LDSB0_AFC0_AFEM1_AFEM1_ASEM1_CLR1_CADS0_DTLA1_DTLB1_DTVA0_DTVB0_EPS0_FDSI0_GRPM1_GRVWA2_GRVWB8_GSU0_GSUAMB_GSUC0_GSUWGMRR0_GLS0_ISA950_IU1_K1_LBSPPA512_LBSPPB1024_LBSPPM0_LPA16_LPB16_LPM0_LRVW8_LWPMn1_MIAV1_MIWT4_3_MO40_NTn1_NTA0_NTB0_NTC6_NTD0_NTM0_NEPBS0_NLCA1_NLCB1_ONLL1_PGR2_PLR1_PKA1_SIA3_SS1_SU0_SUM0_SUS128_SPO0_SRVW0_SSO0_SVW4_SK3_SKXCCM4_TLDS1_ULSGRO0_USL1_UIOFGRO0_USFGRO0_VSn1_VWA4_VWB1_WSGRA0_WSGRB0_WS64_WG32_8_1_WGM1_WGMXCC2_WGMXCCGn1
    SolutionIndex: 435
    SolutionNameMin: Cijk_Alik_Bljk_BBS_BH_Bias_HAS_SAV_UserArgs_MT64x16x256_MI16x16x1_SN_LDSB0_AFC0_AFEM1_AFEM1_ASEM1_CLR1_CADS0_DTLA1_DTLB1_DTVA0_DTVB0_EPS0_FDSI0_GRPM1_GRVWA8_GRVWB8_GSU0_GSUAMB_GSUC0_GSUWGMRR0_GLS0_ISA950_IU1_K1_LBSPPA1024_LBSPPB1024_LBSPPM0_LPA16_LPB16_LPM0_LRVW8_LWPMn1_MIAV0_MIWT1_1_MO40_NTn1_NTA1_NTB0_NTC6_NTD4_NTM0_NEPBS12_NLCA1_NLCB1_ONLL1_PGR2_PLR1_PKA1_SIA3_SS1_SU8_SUM0_SUS512_SPO1_SRVW0_SSO1_SVW1_SK3_SKXCCM8_TLDS1_ULSGRO0_USL1_UIOFGRO0_USFGRO1_VSn1_VWA1_VWB1_WSGRA0_WSGRB0_WS64_WG64_4_1_WGM24_WGMXCC1_WGMXCCGn1
    SolutionIndex: 436
    SolutionNameMin: Cijk_Alik_Bljk_BBS_BH_Bias_HAS_SAV_UserArgs_MT32x64x256_MI16x16x1_SN_LDSB0_AFC0_AFEM1_AFEM1_ASEM1_CLR1_CADS0_DTLA1_DTLB1_DTVA0_DTVB0_EPS0_FDSI0_GRPM1_GRVWA8_GRVWB8_GSU0_GSUAMB_GSUC0_GSUWGMRR0_GLS0_ISA950_IU1_K1_LBSPPA1024_LBSPPB1024_LBSPPM0_LPA16_LPB16_LPM0_LRVW8_LWPMn1_MIAV0_MIWT2_1_MO40_NTn1_NTA6_NTB1_NTC0_NTD7_NTM0_NEPBS10_NLCA1_NLCB1_ONLL1_PGR2_PLR1_PKA1_SIA3_SS1_SU0_SUM0_SUS512_SPO0_SRVW0_SSO0_SVW2_SK3_SKXCCM4_TLDS1_ULSGRO0_USL1_UIOFGRO0_USFGROn1_VSn1_VWA2_VWB1_WSGRA0_WSGRB0_WS64_WG16_16_1_WGM0_WGMXCC4_WGMXCCGn1
    SolutionIndex: 438
    SolutionNameMin: Cijk_Alik_Bljk_BBS_BH_Bias_HAS_SAV_UserArgs_MT64x16x128_MI16x16x1_SN_LDSB0_AFC0_AFEM1_AFEM1_ASEM1_CLR1_CADS0_DTLA0_DTLB0_DTVA0_DTVB0_EPS0_FDSI0_GRPM1_GRVWA8_GRVWB8_GSU0_GSUAMB_GSUC0_GSUWGMRR0_GLS0_ISA950_IU1_K1_LBSPPA256_LBSPPB256_LBSPPM0_LPA16_LPB16_LPM0_LRVW8_LWPMn1_MIAV0_MIWT1_1_MO40_NTn1_NTA0_NTB1_NTC2_NTD0_NTM0_NEPBS0_NLCA1_NLCB1_ONLL1_PGR2_PLR1_PKA1_SIA3_SS1_SU8_SUM0_SUS256_SPO1_SRVW0_SSO0_SVW1_SK3_SKXCCM0_TLDS1_ULSGRO0_USL1_UIOFGRO0_USFGRO1_VSn1_VWA1_VWB1_WSGRA0_WSGRB0_WS64_WG64_4_1_WGM48_WGMXCC8_WGMXCCGn1
    SolutionIndex: 440
    SolutionNameMin: Cijk_Alik_Bljk_BBS_BH_Bias_HAS_SAV_UserArgs_MT64x64x128_MI16x16x1_SN_LDSB0_AFC0_AFEM1_AFEM1_ASEM1_CLR1_CADS0_DTLA1_DTLB1_DTVA0_DTVB0_EPS0_FDSI0_GRPM1_GRVWA8_GRVWB8_GSU0_GSUAMB_GSUC0_GSUWGMRR0_GLS0_ISA950_IU1_K1_LBSPPA1024_LBSPPB1024_LBSPPM0_LPA16_LPB16_LPM0_LRVW8_LWPMn1_MIAV0_MIWT4_1_MO40_NTn1_NTA0_NTB1_NTC2_NTD6_NTM0_NEPBS16_NLCA1_NLCB1_ONLL1_PGR2_PLR1_PKA1_SIA3_SS1_SU0_SUM0_SUS256_SPO0_SRVW0_SSO0_SVW4_SK3_SKXCCM4_TLDS1_ULSGRO0_USL1_UIOFGRO0_USFGRO1_VSn1_VWA4_VWB1_WSGRA0_WSGRB0_WS64_WG16_16_1_WGM1_WGMXCC4_WGMXCCGn1
    SolutionIndex: 443
    SolutionNameMin: Cijk_Alik_Bljk_BBS_BH_Bias_HAS_SAV_UserArgs_MT128x96x128_MI16x16x1_SN_LDSB0_AFC0_AFEM1_AFEM1_ASEM1_CLR0_CADS0_DTLA0_DTLB0_DTVA0_DTVB0_EPS0_FDSI0_GRPM1_GRVWA8_GRVWB8_GSU0_GSUAMB_GSUC0_GSUWGMRR0_GLS0_ISA950_IU1_K1_LBSPPA1024_LBSPPB256_LBSPPM0_LPA16_LPB16_LPM0_LRVW8_LWPMn1_MIAV0_MIWT4_3_MO40_NTn1_NTA3_NTB1_NTC6_NTD3_NTM0_NEPBS0_NLCA1_NLCB1_ONLL1_PGR2_PLR1_PKA1_SIA3_SS1_SU8_SUM0_SUS256_SPO0_SRVW0_SSO0_SVW4_SK3_SKXCCM0_TLDS1_ULSGRO0_USL1_UIOFGRO0_USFGRO0_VSn1_VWA4_VWB1_WSGRA0_WSGRB0_WS64_WG32_8_1_WGM8_WGMXCC16_WGMXCCGn1
    SolutionIndex: 446
    SolutionNameMin: Cijk_Alik_Bljk_BBS_BH_Bias_HAS_SAV_UserArgs_MT64x128x128_MI16x16x1_SN_LDSB0_AFC0_AFEM1_AFEM1_ASEM1_CLR1_CADS0_DTLA0_DTLB0_DTVA0_DTVB0_EPS0_FDSI0_GRPM1_GRVWA8_GRVWB8_GSU1_GSUAMB_GSUC0_GSUWGMRR0_GLS0_ISA950_IU1_K1_LBSPPA1024_LBSPPB512_LBSPPM0_LPA16_LPB16_LPM0_LRVW8_LWPMn1_MIAV1_MIWT4_2_MO40_NTn1_NTA2_NTB2_NTC4_NTD5_NTM0_NEPBS12_NLCA1_NLCB1_ONLL1_PGR2_PLR1_PKA1_SIA3_SS1_SU8_SUM0_SUS256_SPO0_SRVW0_SSO0_SVW4_SK0_SKXCCM0_TLDS2_ULSGRO0_USL1_UIOFGRO0_USFGROn1_VSn1_VWA4_VWB2_WSGRA0_WSGRB0_WS64_WG16_16_1_WGM6_WGMXCC16_WGMXCCGn1
    SolutionIndex: 448
    SolutionNameMin: Cijk_Alik_Bljk_BBS_BH_Bias_HAS_SAV_UserArgs_MT64x160x128_MI16x16x1_SN_LDSB0_AFC0_AFEM1_AFEM1_ASEM1_CLR0_CADS0_DTLA0_DTLB0_DTVA0_DTVB0_EPS0_FDSI0_GRPM1_GRVWA8_GRVWB8_GSU1_GSUAMB_GSUC0_GSUWGMRR0_GLS0_ISA950_IU1_K1_LBSPPA512_LBSPPB256_LBSPPM0_LPA16_LPB16_LPM0_LRVW8_LWPMn1_MIAV0_MIWT2_5_MO40_NTn1_NTA3_NTB1_NTC1_NTD5_NTM0_NEPBS0_NLCA1_NLCB1_ONLL1_PGR2_PLR1_PKA1_SIA3_SS1_SU8_SUM0_SUS256_SPO0_SRVW0_SSO0_SVW2_SK0_SKXCCM0_TLDS1_ULSGRO0_USL1_UIOFGRO0_USFGROn1_VSn1_VWA2_VWB1_WSGRA0_WSGRB0_WS64_WG32_8_1_WGM24_WGMXCC16_WGMXCCGn1
    SolutionIndex: 449
    SolutionNameMin: Cijk_Alik_Bljk_BBS_BH_Bias_HAS_SAV_UserArgs_MT64x192x128_MI16x16x1_SN_LDSB0_AFC0_AFEM1_AFEM1_ASEM1_CLR0_CADS0_DTLA0_DTLB0_DTVA0_DTVB0_EPS0_FDSI0_GRPM1_GRVWA8_GRVWB8_GSU0_GSUAMB_GSUC0_GSUWGMRR0_GLS0_ISA950_IU1_K1_LBSPPA1024_LBSPPB256_LBSPPM0_LPA16_LPB16_LPM0_LRVW8_LWPMn1_MIAV1_MIWT4_3_MO40_NTn1_NTA3_NTB2_NTC4_NTD6_NTM0_NEPBS14_NLCA1_NLCB1_ONLL1_PGR2_PLR1_PKA1_SIA3_SS1_SU0_SUM0_SUS256_SPO0_SRVW0_SSO0_SVW4_SK3_SKXCCM5_TLDS2_ULSGRO0_USL1_UIOFGRO0_USFGRO1_VSn1_VWA4_VWB1_WSGRA0_WSGRB0_WS64_WG16_16_1_WGM0_WGMXCC8_WGMXCCGn1
    SolutionIndex: 450
    SolutionNameMin: Cijk_Alik_Bljk_BBS_BH_Bias_HAS_SAV_UserArgs_MT128x80x128_MI16x16x1_SN_LDSB0_AFC0_AFEM1_AFEM1_ASEM1_CLR0_CADS0_DTLA0_DTLB0_DTVA0_DTVB0_EPS0_FDSI0_GRPM1_GRVWA8_GRVWB8_GSU0_GSUAMB_GSUC0_GSUWGMRR0_GLS0_ISA950_IU1_K1_LBSPPA512_LBSPPB256_LBSPPM0_LPA16_LPB16_LPM0_LRVW8_LWPMn1_MIAV0_MIWT2_5_MO40_NTn1_NTA1_NTB2_NTC0_NTD5_NTM0_NEPBS0_NLCA1_NLCB1_ONLL1_PGR2_PLR1_PKA1_SIA3_SS1_SU16_SUM0_SUS256_SPO0_SRVW0_SSO1_SVW2_SK3_SKXCCM8_TLDS1_ULSGRO0_USL1_UIOFGRO0_USFGRO0_VSn1_VWA2_VWB1_WSGRA0_WSGRB0_WS64_WG64_4_1_WGM6_WGMXCC1_WGMXCCGn1
    SolutionIndex: 453
    SolutionNameMin: Cijk_Alik_Bljk_BBS_BH_Bias_HAS_SAV_UserArgs_MT256x96x64_MI16x16x1_SN_LDSB0_AFC0_AFEM1_AFEM1_ASEM1_CLR1_CADS0_DTLA1_DTLB1_DTVA0_DTVB0_EPS0_FDSI0_GRPM1_GRVWA8_GRVWB8_GSU0_GSUAMB_GSUC0_GSUWGMRR0_GLS0_ISA950_IU1_K1_LBSPPA1024_LBSPPB1024_LBSPPM0_LPA16_LPB16_LPM0_LRVW8_LWPMn1_MIAV0_MIWT8_3_MO40_NTn1_NTA3_NTB2_NTC5_NTD5_NTM0_NEPBS0_NLCA1_NLCB1_ONLL1_PGR2_PLR1_PKA1_SIA3_SS1_SU8_SUM0_SUS128_SPO1_SRVW0_SSO0_SVW8_SK3_SKXCCM4_TLDS1_ULSGRO0_USL1_UIOFGRO0_USFGRO0_VSn1_VWA8_VWB1_WSGRA0_WSGRB0_WS64_WG32_8_1_WGM48_WGMXCC1_WGMXCCGn1
    SolutionIndex: 454
    SolutionNameMin: Cijk_Alik_Bljk_BBS_BH_Bias_HAS_SAV_UserArgs_MT192x192x32_MI16x16x1_SN_LDSB0_AFC0_AFEM1_AFEM1_ASEM1_CLR0_CADS0_DTLA0_DTLB0_DTVA0_DTVB0_EPS0_FDSI0_GRPM1_GRVWA8_GRVWB8_GSU0_GSUAMB_GSUC0_GSUWGMRR0_GLS0_ISA950_IU1_K1_LBSPPA128_LBSPPB128_LBSPPM0_LPA16_LPB16_LPM0_LRVW8_LWPMn1_MIAV0_MIWT6_6_MO40_NTn1_NTA0_NTB2_NTC0_NTD5_NTM0_NEPBS0_NLCA1_NLCB1_ONLL1_PGR2_PLR0_PKA1_SIA3_SS1_SU8_SUM0_SUS64_SPO0_SRVW0_SSO4_SVW2_SK3_SKXCCM0_TLDS1_ULSGRO0_USL1_UIOFGRO0_USFGROn1_VSn1_VWA2_VWB2_WSGRA0_WSGRB0_WS64_WG32_8_1_WGM8_WGMXCC4_WGMXCCGn1
    SolutionIndex: 456
    SolutionNameMin: Cijk_Alik_Bljk_BBS_BH_Bias_HAS_SAV_UserArgs_MT192x256x64_MI16x16x1_SN_LDSB0_AFC0_AFEM1_AFEM1_ASEM1_CLR1_CADS0_DTLA1_DTLB1_DTVA0_DTVB0_EPS0_FDSI0_GRPM1_GRVWA2_GRVWB8_GSU0_GSUAMB_GSUC0_GSUWGMRR0_GLS0_ISA950_IU1_K1_LBSPPA512_LBSPPB1024_LBSPPM0_LPA16_LPB16_LPM0_LRVW8_LWPMn1_MIAV0_MIWT12_4_MO40_NTn1_NTA2_NTB2_NTC1_NTD7_NTM0_NEPBS16_NLCA1_NLCB1_ONLL1_PGR2_PLR1_PKA1_SIA3_SS1_SU16_SUM0_SUS128_SPO0_SRVW0_SSO1_SVW4_SK3_SKXCCM4_TLDS2_ULSGRO0_USL1_UIOFGRO0_USFGRO0_VSn1_VWA4_VWB4_WSGRA0_WSGRB0_WS64_WG16_16_1_WGM4_WGMXCC4_WGMXCCGn1
    SolutionIndex: 459
    SolutionNameMin: Cijk_Alik_Bljk_BBS_BH_Bias_HAS_SAV_UserArgs_MT128x96x64_MI16x16x1_SN_LDSB0_AFC0_AFEM1_AFEM1_ASEM1_CLR0_CADS0_DTLA1_DTLB1_DTVA0_DTVB0_EPS0_FDSI0_GRPM1_GRVWA8_GRVWB8_GSU0_GSUAMB_GSUC0_GSUWGMRR0_GLS0_ISA950_IU1_K1_LBSPPA1024_LBSPPB1024_LBSPPM0_LPA16_LPB16_LPM0_LRVW8_LWPMn1_MIAV1_MIWT4_3_MO40_NTn1_NTA6_NTB1_NTC0_NTD2_NTM0_NEPBS12_NLCA1_NLCB1_ONLL1_PGR2_PLR1_PKA1_SIA3_SS1_SU0_SUM0_SUS128_SPO0_SRVW0_SSO0_SVW4_SK3_SKXCCM5_TLDS1_ULSGRO0_USL1_UIOFGRO0_USFGRO1_VSn1_VWA4_VWB1_WSGRA0_WSGRB0_WS64_WG32_8_1_WGM1_WGMXCC16_WGMXCCGn1
    SolutionIndex: 462
    SolutionNameMin: Cijk_Alik_Bljk_BBS_BH_Bias_HAS_SAV_UserArgs_MT64x192x64_MI16x16x1_SN_LDSB0_AFC0_AFEM1_AFEM1_ASEM1_CLR1_CADS0_DTLA1_DTLB1_DTVA0_DTVB0_EPS0_FDSI0_GRPM1_GRVWA2_GRVWB8_GSU0_GSUAMB_GSUC0_GSUWGMRR0_GLS0_ISA950_IU1_K1_LBSPPA512_LBSPPB1024_LBSPPM0_LPA16_LPB16_LPM0_LRVW8_LWPMn1_MIAV0_MIWT4_3_MO40_NTn1_NTA4_NTB3_NTC0_NTD6_NTM0_NEPBS16_NLCA1_NLCB1_ONLL1_PGR2_PLR1_PKA1_SIA3_SS1_SU0_SUM0_SUS128_SPO0_SRVW0_SSO0_SVW4_SK3_SKXCCM0_TLDS1_ULSGRO0_USL1_UIOFGRO0_USFGRO0_VSn1_VWA4_VWB1_WSGRA0_WSGRB0_WS64_WG16_16_1_WGM48_WGMXCC16_WGMXCCGn1
    SolutionIndex: 463
    SolutionNameMin: Cijk_Alik_Bljk_BBS_BH_Bias_HAS_SAV_UserArgs_MT128x128x64_MI16x16x1_SN_LDSB0_AFC0_AFEM1_AFEM1_ASEM1_CLR0_CADS0_DTLA1_DTLB1_DTVA0_DTVB0_EPS0_FDSI0_GRPM1_GRVWA2_GRVWB8_GSU0_GSUAMB_GSUC0_GSUWGMRR0_GLS0_ISA950_IU1_K1_LBSPPA512_LBSPPB1024_LBSPPM0_LPA16_LPB16_LPM0_LRVW8_LWPMn1_MIAV0_MIWT4_4_MO40_NTn1_NTA6_NTB3_NTC1_NTD6_NTM0_NEPBS16_NLCA1_NLCB1_ONLL1_PGR2_PLR1_PKA1_SIA3_SS1_SU0_SUM0_SUS128_SPO1_SRVW0_SSO1_SVW4_SK3_SKXCCM8_TLDS2_ULSGRO0_USL1_UIOFGRO0_USFGRO0_VSn1_VWA4_VWB4_WSGRA0_WSGRB0_WS64_WG32_8_1_WGM8_WGMXCC1_WGMXCCGn1
    SolutionIndex: 465
    SolutionNameMin: Cijk_Alik_Bljk_BBS_BH_Bias_HAS_SAV_UserArgs_MT128x160x64_MI16x16x1_SN_LDSB0_AFC0_AFEM1_AFEM1_ASEM1_CLR1_CADS0_DTLA1_DTLB1_DTVA0_DTVB0_EPS0_FDSI0_GRPM1_GRVWA2_GRVWB8_GSU0_GSUAMB_GSUC0_GSUWGMRR0_GLS0_ISA950_IU1_K1_LBSPPA512_LBSPPB1024_LBSPPM0_LPA16_LPB16_LPM0_LRVW8_LWPMn1_MIAV1_MIWT4_5_MO40_NTn1_NTA4_NTB0_NTC4_NTD6_NTM0_NEPBS0_NLCA1_NLCB1_ONLL1_PGR2_PLR1_PKA1_SIA3_SS1_SU0_SUM0_SUS128_SPO0_SRVW0_SSO0_SVW4_SK3_SKXCCM4_TLDS2_ULSGRO0_USL1_UIOFGRO0_USFGRO0_VSn1_VWA4_VWB1_WSGRA0_WSGRB0_WS64_WG32_8_1_WGM32_WGMXCC2_WGMXCCGn1
    SolutionIndex: 466
    SolutionNameMin: Cijk_Alik_Bljk_BBS_BH_Bias_HAS_SAV_UserArgs_MT128x192x64_MI16x16x1_SN_LDSB0_AFC0_AFEM1_AFEM1_ASEM1_CLR1_CADS0_DTLA1_DTLB1_DTVA0_DTVB0_EPS0_FDSI0_GRPM1_GRVWA8_GRVWB8_GSU0_GSUAMB_GSUC0_GSUWGMRR0_GLS0_ISA950_IU1_K1_LBSPPA1024_LBSPPB1024_LBSPPM0_LPA16_LPB16_LPM0_LRVW8_LWPMn1_MIAV0_MIWT8_3_MO40_NTn1_NTA6_NTB2_NTC6_NTD7_NTM0_NEPBS0_NLCA1_NLCB1_ONLL1_PGR2_PLR1_PKA1_SIA3_SS1_SU0_SUM0_SUS128_SPO0_SRVW0_SSO0_SVW8_SK3_SKXCCM0_TLDS1_ULSGRO0_USL1_UIOFGRO0_USFGROn1_VSn1_VWA8_VWB1_WSGRA0_WSGRB0_WS64_WG16_16_1_WGM8_WGMXCC8_WGMXCCGn1
    SolutionIndex: 467
    SolutionNameMin: Cijk_Alik_Bljk_BBS_BH_Bias_HAS_SAV_UserArgs_MT256x192x64_MI16x16x1_SN_LDSB0_AFC0_AFEM1_AFEM1_ASEM1_CLR1_CADS0_DTLA1_DTLB1_DTVA0_DTVB0_EPS0_FDSI0_GRPM1_GRVWA8_GRVWB8_GSU0_GSUAMB_GSUC0_GSUWGMRR0_GLS0_ISA950_IU1_K1_LBSPPA1024_LBSPPB1024_LBSPPM0_LPA16_LPB16_LPM0_LRVW8_LWPMn1_MIAV0_MIWT16_3_MO40_NTn1_NTA1_NTB1_NTC5_NTD6_NTM0_NEPBS16_NLCA1_NLCB1_ONLL1_PGR2_PLR1_PKA1_SIA3_SS1_SU16_SUM0_SUS128_SPO0_SRVW0_SSO0_SVW8_SK3_SKXCCM0_TLDS2_ULSGRO0_USL1_UIOFGRO0_USFGRO0_VSn1_VWA8_VWB1_WSGRA0_WSGRB0_WS64_WG16_16_1_WGM0_WGMXCC2_WGMXCCGn1
    SolutionIndex: 473
    SolutionNameMin: Cijk_Alik_Bljk_BBS_BH_Bias_HAS_SAV_UserArgs_MT112x128x64_MI16x16x1_SN_LDSB0_AFC0_AFEM1_AFEM1_ASEM1_CLR1_CADS0_DTLA1_DTLB1_DTVA0_DTVB0_EPS0_FDSI0_GRPM1_GRVWA2_GRVWB8_GSU1_GSUAMB_GSUC0_GSUWGMRR0_GLS0_ISA950_IU1_K1_LBSPPA256_LBSPPB1024_LBSPPM0_LPA16_LPB16_LPM0_LRVW8_LWPMn1_MIAV1_MIWT7_2_MO40_NTn1_NTA4_NTB3_NTC1_NTD0_NTM0_NEPBS0_NLCA1_NLCB1_ONLL1_PGR2_PLR1_PKA1_SIA3_SS1_SU16_SUM0_SUS128_SPO0_SRVW0_SSO0_SVW1_SK0_SKXCCM0_TLDS1_ULSGRO0_USL1_UIOFGRO0_USFGROn1_VSn1_VWA1_VWB2_WSGRA0_WSGRB0_WS64_WG16_16_1_WGM1_WGMXCC32_WGMXCCGn1
    SolutionIndex: 476
    SolutionNameMin: Cijk_Alik_Bljk_BBS_BH_Bias_HAS_SAV_UserArgs_MT160x64x64_MI16x16x1_SN_LDSB1_AFC0_AFEM1_AFEM1_ASEM1_CLR0_CADS0_DTLA0_DTLB0_DTVA0_DTVB0_EPS0_FDSI0_GRPM1_GRVWA8_GRVWB8_GSU0_GSUAMB_GSUC0_GSUWGMRR0_GLS0_ISA950_IU1_K1_LBSPPA256_LBSPPB128_LBSPPM0_LPA16_LPB16_LPM0_LRVW8_LWPMn1_MIAV0_MIWT10_1_MO40_NTn1_NTA5_NTB2_NTC0_NTD3_NTM0_NEPBS16_NLCA1_NLCB1_ONLL1_PGR2_PLR1_PKA1_SIA3_SS0_SU16_SUM0_SUS128_SPO0_SRVW0_SSO0_SVW8_SK3_SKXCCM0_TLDS1_ULSGRO0_USL1_UIOFGRO0_USFGRO0_VSn1_VWA2_VWB1_WSGRA0_WSGRB0_WS64_WG16_16_1_WGM1_WGMXCC2_WGMXCCGn1
    SolutionIndex: 477
    SolutionNameMin: Cijk_Alik_Bljk_BBS_BH_Bias_HAS_SAV_UserArgs_MT448x128x64_MI16x16x1_SN_LDSB0_AFC0_AFEM1_AFEM1_ASEM1_CLR0_CADS0_DTLA0_DTLB0_DTVA0_DTVB0_EPS0_FDSI0_GRPM1_GRVWA8_GRVWB8_GSU0_GSUAMB_GSUC0_GSUWGMRR0_GLS0_ISA950_IU1_K1_LBSPPA256_LBSPPB512_LBSPPM0_LPA16_LPB16_LPM0_LRVW8_LWPMn1_MIAV0_MIWT14_4_MO40_NTn1_NTA6_NTB0_NTC0_NTD5_NTM0_NEPBS0_NLCA1_NLCB1_ONLL1_PGR2_PLR1_PKA1_SIA3_SS1_SU8_SUM0_SUS512_SPO1_SRVW0_SSO0_SVW2_SK3_SKXCCM0_TLDS1_ULSGRO0_USL1_UIOFGRO0_USFGRO0_VSn1_VWA2_VWB4_WSGRA0_WSGRB0_WS64_WG32_8_1_WGM16_WGMXCC2_WGMXCCGn1
    SolutionIndex: 478
    SolutionNameMin: Cijk_Alik_Bljk_BBS_BH_Bias_HAS_SAV_UserArgs_MT16x16x64_MI16x16x1_SN_LDSB0_AFC0_AFEM1_AFEM1_ASEM1_CLR0_CADS0_DTLA1_DTLB1_DTVA0_DTVB0_EPS0_FDSI0_GRPM1_GRVWA8_GRVWB8_GSU0_GSUAMB_GSUC0_GSUWGMRR0_GLS0_ISA950_IU1_K1_LBSPPA1024_LBSPPB1024_LBSPPM0_LPA16_LPB16_LPM0_LRVW8_LWPMn1_MIAV0_MIWT1_1_MO40_NTn1_NTA2_NTB3_NTC2_NTD3_NTM0_NEPBS14_NLCA1_NLCB1_ONLL1_PGR2_PLR1_PKA1_SIA3_SS1_SU0_SUM0_SUS128_SPO1_SRVW0_SSO0_SVW1_SK3_SKXCCM0_TLDS2_ULSGRO0_USL1_UIOFGRO0_USFGRO0_VSn1_VWA1_VWB1_WSGRA0_WSGRB0_WS64_WG16_4_2_WGM0_WGMXCC4_WGMXCCGn1
    SolutionIndex: 481
    SolutionNameMin: Cijk_Alik_Bljk_BBS_BH_Bias_HAS_SAV_UserArgs_MT16x32x64_MI16x16x1_SN_LDSB0_AFC0_AFEM1_AFEM1_ASEM1_CLR0_CADS0_DTLA1_DTLB1_DTVA0_DTVB0_EPS0_FDSI0_GRPM1_GRVWA8_GRVWB8_GSU0_GSUAMB_GSUC0_GSUWGMRR0_GLS0_ISA950_IU1_K1_LBSPPA1024_LBSPPB1024_LBSPPM0_LPA16_LPB16_LPM0_LRVW8_LWPMn1_MIAV0_MIWT1_1_MO40_NTn1_NTA3_NTB0_NTC3_NTD3_NTM0_NEPBS2_NLCA1_NLCB1_ONLL1_PGR2_PLR1_PKA1_SIA3_SS0_SU0_SUM0_SUS128_SPO0_SRVW0_SSO0_SVW4_SK3_SKXCCM7_TLDS1_ULSGRO0_USL1_UIOFGRO0_USFGROn1_VSn1_VWA1_VWB1_WSGRA0_WSGRB0_WS64_WG16_8_1_WGM0_WGMXCC2_WGMXCCGn1
    SolutionIndex: 482
    SolutionNameMin: Cijk_Alik_Bljk_BBS_BH_Bias_HAS_SAV_UserArgs_MT16x32x64_MI16x16x1_SN_LDSB0_AFC0_AFEM1_AFEM1_ASEM1_CLR0_CADS0_DTLA1_DTLB1_DTVA0_DTVB0_EPS0_FDSI0_GRPM1_GRVWA8_GRVWB8_GSU0_GSUAMB_GSUC0_GSUWGMRR0_GLS0_ISA950_IU1_K1_LBSPPA1024_LBSPPB1024_LBSPPM0_LPA16_LPB16_LPM0_LRVW8_LWPMn1_MIAV1_MIWT1_1_MO40_NTn1_NTA3_NTB1_NTC0_NTD0_NTM0_NEPBS10_NLCA1_NLCB1_ONLL1_PGR2_PLR1_PKA1_SIA3_SS1_SU16_SUM0_SUS128_SPO0_SRVW0_SSO0_SVW1_SK3_SKXCCM0_TLDS2_ULSGRO0_USL1_UIOFGRO0_USFGRO0_VSn1_VWA1_VWB1_WSGRA0_WSGRB0_WS64_WG16_8_1_WGM0_WGMXCC32_WGMXCCGn1
    SolutionIndex: 485
    SolutionNameMin: Cijk_Alik_Bljk_BBS_BH_Bias_HAS_SAV_UserArgs_MT32x64x64_MI16x16x1_SN_LDSB0_AFC0_AFEM1_AFEM1_ASEM1_CLR0_CADS0_DTLA1_DTLB1_DTVA0_DTVB0_EPS0_FDSI0_GRPM1_GRVWA8_GRVWB2_GSU0_GSUAMB_GSUC0_GSUWGMRR0_GLS0_ISA950_IU1_K1_LBSPPA1024_LBSPPB256_LBSPPM0_LPA16_LPB16_LPM0_LRVW8_LWPMn1_MIAV1_MIWT1_2_MO40_NTn1_NTA0_NTB1_NTC0_NTD0_NTM0_NEPBS4_NLCA1_NLCB1_ONLL1_PGR2_PLR1_PKA1_SIA3_SS0_SU0_SUM0_SUS128_SPO0_SRVW0_SSO0_SVW4_SK3_SKXCCM0_TLDS2_ULSGRO0_USL1_UIOFGRO0_USFGROn1_VSn1_VWA1_VWB2_WSGRA0_WSGRB0_WS64_WG32_8_1_WGM1_WGMXCC2_WGMXCCGn1
    SolutionIndex: 486
    SolutionNameMin: Cijk_Alik_Bljk_BBS_BH_Bias_HAS_SAV_UserArgs_MT32x64x64_MI16x16x1_SN_LDSB0_AFC0_AFEM1_AFEM1_ASEM1_CLR0_CADS0_DTLA1_DTLB1_DTVA0_DTVB0_EPS0_FDSI0_GRPM1_GRVWA8_GRVWB2_GSU0_GSUAMB_GSUC0_GSUWGMRR0_GLS0_ISA950_IU1_K1_LBSPPA1024_LBSPPB256_LBSPPM0_LPA16_LPB16_LPM0_LRVW8_LWPMn1_MIAV1_MIWT1_2_MO40_NTn1_NTA2_NTB0_NTC2_NTD1_NTM0_NEPBS2_NLCA1_NLCB1_ONLL1_PGR2_PLR1_PKA1_SIA3_SS0_SU0_SUM0_SUS128_SPO0_SRVW0_SSO0_SVW4_SK3_SKXCCM0_TLDS1_ULSGRO0_USL1_UIOFGRO0_USFGROn1_VSn1_VWA1_VWB2_WSGRA0_WSGRB0_WS64_WG32_8_1_WGM1_WGMXCC2_WGMXCCGn1
    SolutionIndex: 487
    SolutionNameMin: Cijk_Alik_Bljk_BBS_BH_Bias_HAS_SAV_UserArgs_MT32x64x64_MI16x16x1_SN_LDSB0_AFC0_AFEM1_AFEM1_ASEM1_CLR1_CADS0_DTLA1_DTLB1_DTVA0_DTVB0_EPS0_FDSI0_GRPM1_GRVWA8_GRVWB2_GSU0_GSUAMB_GSUC0_GSUWGMRR0_GLS0_ISA950_IU1_K1_LBSPPA1024_LBSPPB256_LBSPPM0_LPA16_LPB16_LPM0_LRVW8_LWPMn1_MIAV0_MIWT1_2_MO40_NTn1_NTA0_NTB3_NTC1_NTD0_NTM0_NEPBS16_NLCA1_NLCB1_ONLL1_PGR2_PLR1_PKA1_SIA3_SS0_SU0_SUM0_SUS128_SPO1_SRVW0_SSO0_SVW4_SK3_SKXCCM8_TLDS2_ULSGRO0_USL1_UIOFGRO0_USFGRO0_VSn1_VWA1_VWB2_WSGRA0_WSGRB0_WS64_WG32_8_1_WGM24_WGMXCC4_WGMXCCGn1
    SolutionIndex: 488
    SolutionNameMin: Cijk_Alik_Bljk_BBS_BH_Bias_HAS_SAV_UserArgs_MT64x32x64_MI16x16x1_SN_LDSB0_AFC0_AFEM1_AFEM1_ASEM1_CLR1_CADS0_DTLA1_DTLB1_DTVA0_DTVB0_EPS0_FDSI0_GRPM1_GRVWA8_GRVWB2_GSU0_GSUAMB_GSUC0_GSUWGMRR0_GLS0_ISA950_IU1_K1_LBSPPA1024_LBSPPB256_LBSPPM0_LPA16_LPB16_LPM0_LRVW8_LWPMn1_MIAV1_MIWT1_2_MO40_NTn1_NTA2_NTB6_NTC1_NTD0_NTM0_NEPBS16_NLCA1_NLCB1_ONLL1_PGR2_PLR1_PKA1_SIA3_SS1_SU0_SUM0_SUS128_SPO0_SRVW0_SSO0_SVW1_SK3_SKXCCM6_TLDS1_ULSGRO0_USL1_UIOFGRO0_USFGRO1_VSn1_VWA1_VWB2_WSGRA0_WSGRB0_WS64_WG64_4_1_WGM1_WGMXCC4_WGMXCCGn1
    SolutionIndex: 492
    SolutionNameMin: Cijk_Alik_Bljk_BBS_BH_Bias_HAS_SAV_UserArgs_MT32x32x64_MI16x16x1_SN_LDSB0_AFC0_AFEM1_AFEM1_ASEM1_CLR0_CADS0_DTLA1_DTLB1_DTVA0_DTVB0_EPS0_FDSI0_GRPM1_GRVWA8_GRVWB2_GSU0_GSUAMB_GSUC0_GSUWGMRR0_GLS0_ISA950_IU1_K1_LBSPPA1024_LBSPPB256_LBSPPM0_LPA16_LPB16_LPM0_LRVW8_LWPMn1_MIAV1_MIWT1_1_MO40_NTn1_NTA6_NTB2_NTC3_NTD1_NTM0_NEPBS0_NLCA1_NLCB1_ONLL1_PGR2_PLR1_PKA1_SIA3_SS0_SU0_SUM0_SUS128_SPO1_SRVW0_SSO0_SVW4_SK3_SKXCCM4_TLDS1_ULSGRO0_USL1_UIOFGRO0_USFGROn1_VSn1_VWA1_VWB1_WSGRA0_WSGRB0_WS64_WG32_8_1_WGM0_WGMXCC8_WGMXCCGn1
    SolutionIndex: 493
    SolutionNameMin: Cijk_Alik_Bljk_BBS_BH_Bias_HAS_SAV_UserArgs_MT32x64x64_MI16x16x1_SN_LDSB0_AFC0_AFEM1_AFEM1_ASEM1_CLR0_CADS0_DTLA1_DTLB1_DTVA0_DTVB0_EPS0_FDSI0_GRPM1_GRVWA2_GRVWB8_GSU0_GSUAMB_GSUC0_GSUWGMRR0_GLS0_ISA950_IU1_K1_LBSPPA256_LBSPPB1024_LBSPPM0_LPA16_LPB16_LPM0_LRVW8_LWPMn1_MIAV0_MIWT2_1_MO40_NTn1_NTA6_NTB3_NTC3_NTD1_NTM0_NEPBS8_NLCA1_NLCB1_ONLL1_PGR2_PLR1_PKA1_SIA3_SS1_SU0_SUM0_SUS128_SPO1_SRVW0_SSO0_SVW2_SK3_SKXCCM8_TLDS1_ULSGRO0_USL1_UIOFGRO0_USFGRO0_VSn1_VWA2_VWB1_WSGRA0_WSGRB0_WS64_WG16_16_1_WGM1_WGMXCC4_WGMXCCGn1
    SolutionIndex: 494
    SolutionNameMin: Cijk_Alik_Bljk_BBS_BH_Bias_HAS_SAV_UserArgs_MT32x64x64_MI16x16x1_SN_LDSB0_AFC0_AFEM1_AFEM1_ASEM1_CLR1_CADS0_DTLA1_DTLB1_DTVA0_DTVB0_EPS0_FDSI0_GRPM1_GRVWA2_GRVWB8_GSU0_GSUAMB_GSUC0_GSUWGMRR0_GLS0_ISA950_IU1_K1_LBSPPA256_LBSPPB1024_LBSPPM0_LPA16_LPB16_LPM0_LRVW8_LWPMn1_MIAV0_MIWT2_1_MO40_NTn1_NTA0_NTB3_NTC2_NTD1_NTM0_NEPBS0_NLCA1_NLCB1_ONLL1_PGR2_PLR1_PKA1_SIA3_SS1_SU0_SUM0_SUS128_SPO1_SRVW0_SSO0_SVW2_SK3_SKXCCM8_TLDS1_ULSGRO0_USL1_UIOFGRO0_USFGRO0_VSn1_VWA2_VWB1_WSGRA0_WSGRB0_WS64_WG16_16_1_WGM0_WGMXCC4_WGMXCCGn1
    SolutionIndex: 495
    SolutionNameMin: Cijk_Alik_Bljk_BBS_BH_Bias_HAS_SAV_UserArgs_MT64x64x64_MI16x16x1_SN_LDSB0_AFC0_AFEM1_AFEM1_ASEM1_CLR1_CADS0_DTLA1_DTLB1_DTVA0_DTVB0_EPS0_FDSI0_GRPM1_GRVWA2_GRVWB2_GSU0_GSUAMB_GSUC0_GSUWGMRR0_GLS0_ISA950_IU1_K1_LBSPPA512_LBSPPB256_LBSPPM0_LPA16_LPB16_LPM0_LRVW8_LWPMn1_MIAV1_MIWT4_1_MO40_NTn1_NTA3_NTB2_NTC7_NTD0_NTM0_NEPBS4_NLCA1_NLCB1_ONLL1_PGR2_PLR1_PKA1_SIA3_SS1_SU0_SUM0_SUS128_SPO0_SRVW0_SSO0_SVW4_SK3_SKXCCM4_TLDS1_ULSGRO0_USL1_UIOFGRO0_USFGRO0_VSn1_VWA4_VWB1_WSGRA0_WSGRB0_WS64_WG16_16_1_WGM0_WGMXCC8_WGMXCCGn1
    SolutionIndex: 498
    SolutionNameMin: Cijk_Alik_Bljk_BBS_BH_Bias_HAS_SAV_UserArgs_MT64x128x64_MI16x16x1_SN_LDSB0_AFC0_AFEM1_AFEM1_ASEM1_CLR0_CADS0_DTLA1_DTLB1_DTVA0_DTVB0_EPS0_FDSI0_GRPM1_GRVWA2_GRVWB2_GSU0_GSUAMB_GSUC0_GSUWGMRR0_GLS0_ISA950_IU1_K1_LBSPPA512_LBSPPB256_LBSPPM0_LPA16_LPB16_LPM0_LRVW8_LWPMn1_MIAV0_MIWT4_2_MO40_NTn1_NTA3_NTB2_NTC7_NTD0_NTM0_NEPBS16_NLCA1_NLCB1_ONLL1_PGR2_PLR1_PKA1_SIA3_SS1_SU0_SUM0_SUS128_SPO0_SRVW0_SSO0_SVW4_SK3_SKXCCM5_TLDS1_ULSGRO0_USL1_UIOFGRO0_USFGRO0_VSn1_VWA4_VWB2_WSGRA0_WSGRB0_WS64_WG16_16_1_WGM16_WGMXCC8_WGMXCCGn1
    SolutionIndex: 500
    SolutionNameMin: Cijk_Alik_Bljk_BBS_BH_Bias_HAS_SAV_UserArgs_MT128x128x64_MI16x16x1_SN_LDSB0_AFC0_AFEM1_AFEM1_ASEM1_CLR0_CADS0_DTLA1_DTLB1_DTVA0_DTVB0_EPS0_FDSI0_GRPM1_GRVWA8_GRVWB8_GSU0_GSUAMB_GSUC0_GSUWGMRR0_GLS0_ISA950_IU1_K1_LBSPPA1024_LBSPPB1024_LBSPPM0_LPA16_LPB16_LPM0_LRVW8_LWPMn1_MIAV1_MIWT4_4_MO40_NTn1_NTA2_NTB1_NTC6_NTD3_NTM0_NEPBS16_NLCA1_NLCB1_ONLL1_PGR2_PLR1_PKA1_SIA3_SS1_SU0_SUM0_SUS128_SPO0_SRVW0_SSO0_SVW4_SK3_SKXCCM4_TLDS1_ULSGRO0_USL1_UIOFGRO0_USFGROn1_VSn1_VWA4_VWB4_WSGRA0_WSGRB0_WS64_WG32_8_1_WGM6_WGMXCC1_WGMXCCGn1
    SolutionIndex: 501
    SolutionNameMin: Cijk_Alik_Bljk_BBS_BH_Bias_HAS_SAV_UserArgs_MT160x128x64_MI16x16x1_SN_LDSB0_AFC0_AFEM1_AFEM1_ASEM1_CLR1_CADS0_DTLA0_DTLB0_DTVA0_DTVB0_EPS0_FDSI0_GRPM1_GRVWA8_GRVWB8_GSU0_GSUAMB_GSUC0_GSUWGMRR0_GLS0_ISA950_IU1_K1_LBSPPA256_LBSPPB256_LBSPPM0_LPA16_LPB16_LPM0_LRVW8_LWPMn1_MIAV0_MIWT10_2_MO40_NTn1_NTA2_NTB4_NTC2_NTD7_NTM0_NEPBS0_NLCA1_NLCB1_ONLL1_PGR2_PLR1_PKA1_SIA3_SS1_SU8_SUM0_SUS256_SPO1_SRVW0_SSO1_SVW2_SK3_SKXCCM0_TLDS2_ULSGRO0_USL1_UIOFGRO0_USFGRO0_VSn1_VWA2_VWB2_WSGRA0_WSGRB0_WS64_WG16_16_1_WGM16_WGMXCC1_WGMXCCGn1
    SolutionIndex: 502
    SolutionNameMin: Cijk_Alik_Bljk_BBS_BH_Bias_HAS_SAV_UserArgs_MT16x32x256_MI16x16x1_SN_LDSB0_AFC0_AFEM1_AFEM1_ASEM1_CLR1_CADS0_DTLA1_DTLB1_DTVA0_DTVB0_EPS0_FDSI0_GRPM1_GRVWA8_GRVWB8_GSU1_GSUAMB_GSUC0_GSUWGMRR0_GLS0_ISA950_IU1_K1_LBSPPA1024_LBSPPB1024_LBSPPM0_LPA16_LPB16_LPM0_LRVW8_LWPMn1_MIAV1_MIWT1_1_MO40_NTn1_NTA7_NTB1_NTC3_NTD0_NTM0_NEPBS12_NLCA1_NLCB1_ONLL1_PGR2_PLR1_PKA1_SIA3_SS1_SU0_SUM0_SUS512_SPO0_SRVW0_SSO0_SVW1_SK0_SKXCCM0_TLDS2_ULSGRO0_USL1_UIOFGRO0_USFGRO1_VSn1_VWA1_VWB1_WSGRA0_WSGRB0_WS64_WG16_8_1_WGM1_WGMXCC8_WGMXCCGn1
    SolutionIndex: 505
    SolutionNameMin: Cijk_Alik_Bljk_BBS_BH_Bias_HAS_SAV_UserArgs_MT32x64x256_MI16x16x1_SN_LDSB0_AFC0_AFEM1_AFEM1_ASEM1_CLR1_CADS0_DTLA1_DTLB1_DTVA0_DTVB0_EPS0_FDSI0_GRPM1_GRVWA8_GRVWB8_GSU0_GSUAMB_GSUC0_GSUWGMRR0_GLS0_ISA950_IU1_K1_LBSPPA1024_LBSPPB1024_LBSPPM0_LPA16_LPB16_LPM0_LRVW8_LWPMn1_MIAV0_MIWT2_1_MO40_NTn1_NTA7_NTB2_NTC2_NTD6_NTM0_NEPBS14_NLCA1_NLCB1_ONLL1_PGR2_PLR1_PKA1_SIA3_SS1_SU0_SUM0_SUS512_SPO0_SRVW0_SSO0_SVW2_SK3_SKXCCM4_TLDS1_ULSGRO0_USL1_UIOFGRO0_USFGRO1_VSn1_VWA2_VWB1_WSGRA0_WSGRB0_WS64_WG16_16_1_WGM1_WGMXCC4_WGMXCCGn1
    SolutionIndex: 508
    SolutionNameMin: Cijk_Alik_Bljk_BBS_BH_Bias_HAS_SAV_UserArgs_MT64x64x128_MI16x16x1_SN_LDSB0_AFC0_AFEM1_AFEM1_ASEM1_CLR0_CADS0_DTLA1_DTLB1_DTVA0_DTVB0_EPS0_FDSI0_GRPM1_GRVWA8_GRVWB8_GSU0_GSUAMB_GSUC0_GSUWGMRR0_GLS0_ISA950_IU1_K1_LBSPPA1024_LBSPPB1024_LBSPPM0_LPA16_LPB16_LPM0_LRVW8_LWPMn1_MIAV0_MIWT4_1_MO40_NTn1_NTA3_NTB3_NTC2_NTD6_NTM0_NEPBS16_NLCA1_NLCB1_ONLL1_PGR2_PLR1_PKA1_SIA3_SS1_SU0_SUM0_SUS256_SPO0_SRVW0_SSO0_SVW4_SK3_SKXCCM4_TLDS1_ULSGRO0_USL1_UIOFGRO0_USFGROn1_VSn1_VWA4_VWB1_WSGRA0_WSGRB0_WS64_WG16_16_1_WGM0_WGMXCC4_WGMXCCGn1
    SolutionIndex: 517
    SolutionNameMin: Cijk_Alik_Bljk_BBS_BH_Bias_HAS_SAV_UserArgs_MT128x80x128_MI16x16x1_SN_LDSB0_AFC0_AFEM1_AFEM1_ASEM1_CLR0_CADS0_DTLA0_DTLB0_DTVA0_DTVB0_EPS0_FDSI0_GRPM1_GRVWA8_GRVWB8_GSU0_GSUAMB_GSUC0_GSUWGMRR0_GLS0_ISA950_IU1_K1_LBSPPA512_LBSPPB256_LBSPPM0_LPA16_LPB16_LPM0_LRVW8_LWPMn1_MIAV0_MIWT2_5_MO40_NTn1_NTA3_NTB2_NTC0_NTD4_NTM0_NEPBS0_NLCA1_NLCB1_ONLL1_PGR2_PLR1_PKA1_SIA3_SS1_SU16_SUM0_SUS256_SPO0_SRVW0_SSO1_SVW2_SK3_SKXCCM4_TLDS1_ULSGRO0_USL1_UIOFGRO0_USFGRO0_VSn1_VWA2_VWB1_WSGRA0_WSGRB0_WS64_WG64_4_1_WGM48_WGMXCC2_WGMXCCGn1
    SolutionIndex: 519
    SolutionNameMin: Cijk_Alik_Bljk_BBS_BH_Bias_HAS_SAV_UserArgs_MT128x80x128_MI16x16x1_SN_LDSB0_AFC0_AFEM1_AFEM1_ASEM1_CLR1_CADS0_DTLA0_DTLB0_DTVA0_DTVB0_EPS0_FDSI0_GRPM1_GRVWA8_GRVWB8_GSU0_GSUAMB_GSUC0_GSUWGMRR0_GLS0_ISA950_IU1_K1_LBSPPA512_LBSPPB256_LBSPPM0_LPA16_LPB16_LPM0_LRVW8_LWPMn1_MIAV1_MIWT2_5_MO40_NTn1_NTA0_NTB3_NTC1_NTD3_NTM0_NEPBS0_NLCA1_NLCB1_ONLL1_PGR2_PLR1_PKA1_SIA3_SS1_SU16_SUM0_SUS256_SPO0_SRVW0_SSO0_SVW2_SK3_SKXCCM8_TLDS1_ULSGRO0_USL1_UIOFGRO0_USFGRO0_VSn1_VWA2_VWB1_WSGRA0_WSGRB0_WS64_WG64_4_1_WGM4_WGMXCC1_WGMXCCGn1
    SolutionIndex: 520
    SolutionNameMin: Cijk_Alik_Bljk_BBS_BH_Bias_HAS_SAV_UserArgs_MT96x128x128_MI16x16x1_SN_LDSB0_AFC0_AFEM1_AFEM1_ASEM1_CLR0_CADS0_DTLA0_DTLB0_DTVA0_DTVB0_EPS0_FDSI0_GRPM1_GRVWA8_GRVWB8_GSU0_GSUAMB_GSUC0_GSUWGMRR0_GLS0_ISA950_IU1_K1_LBSPPA512_LBSPPB512_LBSPPM0_LPA16_LPB16_LPM0_LRVW8_LWPMn1_MIAV0_MIWT6_2_MO40_NTn1_NTA2_NTB2_NTC1_NTD0_NTM0_NEPBS12_NLCA1_NLCB1_ONLL1_PGR2_PLR1_PKA1_SIA3_SS1_SU0_SUM0_SUS256_SPO1_SRVW0_SSO0_SVW2_SK3_SKXCCM4_TLDS2_ULSGRO0_USL1_UIOFGRO0_USFGRO0_VSn1_VWA2_VWB2_WSGRA0_WSGRB0_WS64_WG16_16_1_WGM0_WGMXCC8_WGMXCCGn1
    SolutionIndex: 521
    SolutionNameMin: Cijk_Alik_Bljk_BBS_BH_Bias_HAS_SAV_UserArgs_MT128x96x128_MI16x16x1_SN_LDSB0_AFC0_AFEM1_AFEM1_ASEM1_CLR1_CADS0_DTLA0_DTLB0_DTVA0_DTVB0_EPS0_FDSI0_GRPM1_GRVWA8_GRVWB8_GSU0_GSUAMB_GSUC0_GSUWGMRR0_GLS0_ISA950_IU1_K1_LBSPPA512_LBSPPB512_LBSPPM0_LPA16_LPB16_LPM0_LRVW8_LWPMn1_MIAV0_MIWT2_6_MO40_NTn1_NTA3_NTB1_NTC1_NTD3_NTM0_NEPBS0_NLCA1_NLCB1_ONLL1_PGR2_PLR1_PKA1_SIA3_SS1_SU16_SUM0_SUS256_SPO0_SRVW0_SSO1_SVW2_SK3_SKXCCM4_TLDS1_ULSGRO0_USL1_UIOFGRO0_USFGRO0_VSn1_VWA2_VWB2_WSGRA0_WSGRB0_WS64_WG64_4_1_WGM6_WGMXCC2_WGMXCCGn1
    SolutionIndex: 522
    SolutionNameMin: Cijk_Alik_Bljk_BBS_BH_Bias_HAS_SAV_UserArgs_MT192x128x64_MI16x16x1_SN_LDSB0_AFC0_AFEM1_AFEM1_ASEM1_CLR0_CADS0_DTLA0_DTLB0_DTVA0_DTVB0_EPS0_FDSI0_GRPM1_GRVWA8_GRVWB8_GSU0_GSUAMB_GSUC0_GSUWGMRR0_GLS0_ISA950_IU1_K1_LBSPPA256_LBSPPB512_LBSPPM0_LPA16_LPB16_LPM0_LRVW8_LWPMn1_MIAV0_MIWT6_4_MO40_NTn1_NTA3_NTB3_NTC1_NTD4_NTM0_NEPBS0_NLCA1_NLCB1_ONLL1_PGR2_PLR1_PKA1_SIA3_SS1_SU0_SUM0_SUS128_SPO0_SRVW0_SSO0_SVW2_SK3_SKXCCM4_TLDS1_ULSGRO0_USL1_UIOFGRO0_USFGRO0_VSn1_VWA2_VWB4_WSGRA0_WSGRB0_WS64_WG32_8_1_WGM8_WGMXCC2_WGMXCCGn1
    SolutionIndex: 524
    SolutionNameMin: Cijk_Alik_Bljk_BBS_BH_Bias_HAS_SAV_UserArgs_MT192x128x64_MI16x16x1_SN_LDSB1_AFC0_AFEM1_AFEM1_ASEM1_CLR0_CADS0_DTLA0_DTLB0_DTVA0_DTVB0_EPS0_FDSI0_GRPM1_GRVWA8_GRVWB8_GSU0_GSUAMB_GSUC0_GSUWGMRR0_GLS0_ISA950_IU1_K1_LBSPPA512_LBSPPB256_LBSPPM0_LPA16_LPB16_LPM0_LRVW8_LWPMn1_MIAV0_MIWT12_2_MO40_NTn1_NTA1_NTB0_NTC5_NTD7_NTM0_NEPBS14_NLCA1_NLCB1_ONLL1_PGR2_PLR1_PKA1_SIA3_SS1_SU0_SUM0_SUS128_SPO0_SRVW0_SSO0_SVW4_SK3_SKXCCM0_TLDS1_ULSGRO0_USL1_UIOFGRO0_USFGRO1_VSn1_VWA4_VWB2_WSGRA0_WSGRB0_WS64_WG16_16_1_WGM1_WGMXCC8_WGMXCCGn1
    SolutionIndex: 525
    SolutionNameMin: Cijk_Alik_Bljk_BBS_BH_Bias_HAS_SAV_UserArgs_MT64x32x64_MI16x16x1_SN_LDSB0_AFC0_AFEM1_AFEM1_ASEM1_CLR1_CADS0_DTLA1_DTLB1_DTVA0_DTVB0_EPS0_FDSI0_GRPM1_GRVWA8_GRVWB2_GSU0_GSUAMB_GSUC0_GSUWGMRR0_GLS0_ISA950_IU1_K1_LBSPPA1024_LBSPPB256_LBSPPM0_LPA16_LPB16_LPM0_LRVW8_LWPMn1_MIAV1_MIWT4_1_MO40_NTn1_NTA5_NTB0_NTC1_NTD2_NTM0_NEPBS0_NLCA1_NLCB1_ONLL1_PGR2_PLR1_PKA1_SIA3_SS1_SU0_SUM0_SUS128_SPO0_SRVW0_SSO0_SVW4_SK3_SKXCCM4_TLDS2_ULSGRO0_USL1_UIOFGRO0_USFGROn1_VSn1_VWA4_VWB1_WSGRA0_WSGRB0_WS64_WG16_8_1_WGM0_WGMXCC4_WGMXCCGn1
    SolutionIndex: 528
    SolutionNameMin: Cijk_Alik_Bljk_BBS_BH_Bias_HAS_SAV_UserArgs_MT128x128x64_MI32x32x1_SN_LDSB0_AFC0_AFEM1_AFEM1_ASEM1_CLR1_CADS0_DTLA1_DTLB1_DTVA0_DTVB0_EPS0_FDSI0_GRPM1_GRVWA2_GRVWB8_GSU0_GSUAMB_GSUC0_GSUWGMRR0_GLS0_ISA950_IU1_K1_LBSPPA512_LBSPPB1024_LBSPPM0_LPA8_LPB8_LPM0_LRVW8_LWPMn1_MIAV0_MIWT4_1_MO40_NTn1_NTA6_NTB1_NTC0_NTD3_NTM0_NEPBS16_NLCA1_NLCB1_ONLL1_PGR2_PLR1_PKA1_SIA3_SS1_SU8_SUM0_SUS128_SPO1_SRVW0_SSO0_SVW4_SK3_SKXCCM5_TLDS1_ULSGRO0_USL1_UIOFGRO0_USFGRO0_VSn1_VWA4_VWB1_WSGRA0_WSGRB0_WS64_WG32_8_1_WGM16_WGMXCC8_WGMXCCGn1
    SolutionIndex: 532
    SolutionNameMin: Cijk_Alik_Bljk_BBS_BH_Bias_HAS_SAV_UserArgs_MT128x128x64_MI16x16x1_SN_LDSB0_AFC0_AFEM1_AFEM1_ASEM1_CLR1_CADS0_DTLA1_DTLB1_DTVA0_DTVB0_EPS0_FDSI0_GRPM1_GRVWA2_GRVWB8_GSU0_GSUAMB_GSUC0_GSUWGMRR0_GLS0_ISA950_IU1_K1_LBSPPA512_LBSPPB1024_LBSPPM0_LPA16_LPB16_LPM0_LRVW8_LWPMn1_MIAV0_MIWT4_4_MO40_NTn1_NTA6_NTB0_NTC4_NTD2_NTM0_NEPBS0_NLCA1_NLCB1_ONLL1_PGR2_PLR1_PKA1_SIA3_SS1_SU0_SUM0_SUS128_SPO0_SRVW0_SSO0_SVW4_SK3_SKXCCM0_TLDS1_ULSGRO0_USL1_UIOFGRO0_USFGRO0_VSn1_VWA4_VWB4_WSGRA0_WSGRB0_WS64_WG32_8_1_WGM48_WGMXCC8_WGMXCCGn1
    SolutionIndex: 533
    SolutionNameMin: Cijk_Alik_Bljk_BBS_BH_Bias_HAS_SAV_UserArgs_MT128x160x64_MI16x16x1_SN_LDSB0_AFC0_AFEM1_AFEM1_ASEM1_CLR1_CADS0_DTLA1_DTLB1_DTVA0_DTVB0_EPS0_FDSI0_GRPM1_GRVWA8_GRVWB8_GSU1_GSUAMB_GSUC0_GSUWGMRR0_GLS0_ISA950_IU1_K1_LBSPPA1024_LBSPPB1024_LBSPPM0_LPA16_LPB16_LPM0_LRVW8_LWPMn1_MIAV0_MIWT4_5_MO40_NTn1_NTA7_NTB0_NTC1_NTD5_NTM0_NEPBS0_NLCA1_NLCB1_ONLL1_PGR2_PLR1_PKA1_SIA3_SS1_SU0_SUM0_SUS128_SPO0_SRVW0_SSO0_SVW4_SK0_SKXCCM0_TLDS2_ULSGRO0_USL1_UIOFGRO0_USFGRO0_VSn1_VWA4_VWB1_WSGRA0_WSGRB0_WS64_WG32_8_1_WGM24_WGMXCC8_WGMXCCGn1
    SolutionIndex: 534
    SolutionNameMin: Cijk_Alik_Bljk_BBS_BH_Bias_HAS_SAV_UserArgs_MT160x128x64_MI16x16x1_SN_LDSB0_AFC0_AFEM1_AFEM1_ASEM1_CLR0_CADS0_DTLA1_DTLB1_DTVA0_DTVB0_EPS0_FDSI0_GRPM1_GRVWA2_GRVWB8_GSU0_GSUAMB_GSUC0_GSUWGMRR0_GLS0_ISA950_IU1_K1_LBSPPA256_LBSPPB1024_LBSPPM0_LPA16_LPB16_LPM0_LRVW8_LWPMn1_MIAV0_MIWT10_2_MO40_NTn1_NTA1_NTB1_NTC0_NTD4_NTM0_NEPBS0_NLCA1_NLCB1_ONLL1_PGR2_PLR1_PKA1_SIA3_SS1_SU0_SUM0_SUS128_SPO0_SRVW0_SSO0_SVW2_SK3_SKXCCM4_TLDS1_ULSGRO0_USL1_UIOFGRO0_USFGRO0_VSn1_VWA2_VWB2_WSGRA0_WSGRB0_WS64_WG16_16_1_WGM0_WGMXCC8_WGMXCCGn1
    SolutionIndex: 535
    SolutionNameMin: Cijk_Alik_Bljk_BBS_BH_Bias_HAS_SAV_UserArgs_MT128x384x64_MI16x16x1_SN_LDSB0_AFC0_AFEM1_AFEM1_ASEM1_CLR0_CADS0_DTLA1_DTLB1_DTVA0_DTVB0_EPS0_FDSI0_GRPM1_GRVWA8_GRVWB8_GSU0_GSUAMB_GSUC0_GSUWGMRR0_GLS0_ISA950_IU1_K1_LBSPPA1024_LBSPPB1024_LBSPPM0_LPA16_LPB16_LPM0_LRVW8_LWPMn1_MIAV0_MIWT8_6_MO40_NTn1_NTA2_NTB2_NTC7_NTD6_NTM0_NEPBS12_NLCA1_NLCB1_ONLL1_PGR2_PLR1_PKA1_SIA3_SS1_SU16_SUM0_SUS128_SPO1_SRVW0_SSO0_SVW8_SK3_SKXCCM8_TLDS2_ULSGRO0_USL1_UIOFGRO0_USFGRO0_VSn1_VWA8_VWB2_WSGRA0_WSGRB0_WS64_WG16_16_1_WGM4_WGMXCC1_WGMXCCGn1
    SolutionIndex: 536
    SolutionNameMin: Cijk_Alik_Bljk_BBS_BH_Bias_HAS_SAV_UserArgs_MT256x224x64_MI16x16x1_SN_LDSB0_AFC0_AFEM1_AFEM1_ASEM1_CLR1_CADS0_DTLA1_DTLB1_DTVA0_DTVB0_EPS0_FDSI0_GRPM1_GRVWA8_GRVWB8_GSU0_GSUAMB_GSUC0_GSUWGMRR0_GLS0_ISA950_IU1_K1_LBSPPA1024_LBSPPB1024_LBSPPM0_LPA16_LPB16_LPM0_LRVW8_LWPMn1_MIAV0_MIWT8_7_MO40_NTn1_NTA1_NTB3_NTC5_NTD5_NTM0_NEPBS14_NLCA1_NLCB1_ONLL1_PGR2_PLR1_PKA1_SIA3_SS1_SU8_SUM0_SUS128_SPO0_SRVW0_SSO1_SVW8_SK3_SKXCCM0_TLDS1_ULSGRO0_USL1_UIOFGRO0_USFGRO0_VSn1_VWA8_VWB1_WSGRA0_WSGRB0_WS64_WG32_8_1_WGM0_WGMXCC2_WGMXCCGn1
    SolutionIndex: 537
    SolutionNameMin: Cijk_Alik_Bljk_BBS_BH_Bias_HAS_SAV_UserArgs_MT128x16x64_MI16x16x1_SN_LDSB0_AFC0_AFEM1_AFEM1_ASEM1_CLR0_CADS0_DTLA1_DTLB1_DTVA0_DTVB0_EPS0_FDSI0_GRPM1_GRVWA8_GRVWB2_GSU0_GSUAMB_GSUC0_GSUWGMRR0_GLS0_ISA950_IU1_K1_LBSPPA1024_LBSPPB256_LBSPPM0_LPA16_LPB16_LPM0_LRVW8_LWPMn1_MIAV1_MIWT8_1_MO40_NTn1_NTA5_NTB0_NTC0_NTD3_NTM0_NEPBS14_NLCA1_NLCB1_ONLL1_PGR2_PLR0_PKA1_SIA3_SS1_SU0_SUM0_SUS128_SPO0_SRVW0_SSO0_SVW8_SK3_SKXCCM4_TLDS1_ULSGRO0_USL1_UIOFGRO0_USFGRO1_VSn1_VWA8_VWB1_WSGRA0_WSGRB0_WS64_WG16_4_2_WGM0_WGMXCC4_WGMXCCGn1
    SolutionIndex: 538
    SolutionNameMin: Cijk_Alik_Bljk_BBS_BH_Bias_HAS_SAV_UserArgs_MT32x32x64_MI16x16x1_SN_LDSB0_AFC0_AFEM1_AFEM1_ASEM1_CLR0_CADS0_DTLA1_DTLB1_DTVA0_DTVB0_EPS0_FDSI0_GRPM1_GRVWA8_GRVWB8_GSU0_GSUAMB_GSUC0_GSUWGMRR0_GLS0_ISA950_IU1_K1_LBSPPA1024_LBSPPB1024_LBSPPM0_LPA16_LPB16_LPM0_LRVW8_LWPMn1_MIAV0_MIWT2_2_MO40_NTn1_NTA7_NTB0_NTC0_NTD0_NTM0_NEPBS10_NLCA1_NLCB1_ONLL1_PGR2_PLR1_PKA1_SIA3_SS0_SU16_SUM0_SUS128_SPO1_SRVW0_SSO1_SVW8_SK3_SKXCCM8_TLDS2_ULSGRO0_USL1_UIOFGRO0_USFGRO1_VSn1_VWA2_VWB2_WSGRA0_WSGRB0_WS64_WG16_4_1_WGM1_WGMXCC1_WGMXCCGn1
    SolutionIndex: 540
    SolutionNameMin: Cijk_Alik_Bljk_BBS_BH_Bias_HAS_SAV_UserArgs_MT112x64x64_MI16x16x1_SN_LDSB0_AFC0_AFEM1_AFEM1_ASEM1_CLR0_CADS0_DTLA1_DTLB1_DTVA0_DTVB0_EPS0_FDSI0_GRPM1_GRVWA2_GRVWB2_GSU0_GSUAMB_GSUC0_GSUWGMRR0_GLS0_ISA950_IU1_K1_LBSPPA256_LBSPPB256_LBSPPM0_LPA16_LPB16_LPM0_LRVW8_LWPMn1_MIAV0_MIWT7_1_MO40_NTn1_NTA2_NTB0_NTC1_NTD4_NTM0_NEPBS0_NLCA1_NLCB1_ONLL1_PGR2_PLR1_PKA1_SIA3_SS1_SU8_SUM0_SUS256_SPO1_SRVW0_SSO1_SVW1_SK3_SKXCCM0_TLDS1_ULSGRO0_USL1_UIOFGRO0_USFGRO0_VSn1_VWA1_VWB1_WSGRA0_WSGRB0_WS64_WG16_16_1_WGM0_WGMXCC4_WGMXCCGn1
- - - [128, 40, 1, 2880]
    - [4, 0.0]
  - - [5120, 8192, 1, 2880]
    - [536, 0.0]
  - - [128, 72, 1, 2880]
    - [208, 0.0]
  - - [2880, 8192, 1, 4096]
    - [456, 0.0]
  - - [128, 96, 1, 2880]
    - [478, 0.0]
  - - [2880, 8192, 1, 512]
    - [256, 0.0]
  - - [128, 120, 1, 2880]
    - [277, 0.0]
  - - [640, 8192, 1, 2880]
    - [302, 0.0]
  - - [128, 144, 1, 2880]
    - [141, 0.0]
  - - [5120, 8183, 1, 2880]
    - [404, 0.0]
  - - [128, 168, 1, 2880]
    - [278, 0.0]
  - - [2880, 8183, 1, 4096]
    - [186, 0.0]
  - - [128, 192, 1, 2880]
    - [209, 0.0]
  - - [201088, 12, 1, 2880]
    - [273, 0.0]
  - - [128, 216, 1, 2880]
    - [481, 0.0]
  - - [2880, 8183, 1, 512]
    - [325, 0.0]
  - - [128, 240, 1, 2880]
    - [143, 0.0]
  - - [128, 8183, 1, 2880]
    - [150, 0.0]
  - - [128, 272, 1, 2880]
    - [482, 0.0]
  - - [640, 8183, 1, 2880]
    - [95, 0.0]
  - - [128, 304, 1, 2880]
    - [73, 0.0]
  - - [5120, 8189, 1, 2880]
    - [198, 0.0]
  - - [128, 336, 1, 2880]
    - [280, 0.0]
  - - [5120, 8184, 1, 2880]
    - [130, 0.0]
  - - [128, 368, 1, 2880]
    - [74, 0.0]
  - - [5120, 7821, 1, 2880]
    - [267, 0.0]
  - - [128, 400, 1, 2880]
    - [353, 0.0]
  - - [25136, 12, 1, 2880]
    - [537, 0.0]
  - - [128, 432, 1, 2880]
    - [281, 0.0]
  - - [5120, 7177, 1, 2880]
    - [337, 0.0]
  - - [128, 464, 1, 2880]
    - [282, 0.0]
  - - [5120, 7217, 1, 2880]
    - [59, 0.0]
  - - [128, 496, 1, 2880]
    - [75, 0.0]
  - - [5120, 7209, 1, 2880]
    - [467, 0.0]
  - - [128, 528, 1, 2880]
    - [76, 0.0]
  - - [5120, 7169, 1, 2880]
    - [535, 0.0]
  - - [128, 560, 1, 2880]
    - [283, 0.0]
  - - [2880, 7821, 1, 4096]
    - [255, 0.0]
  - - [128, 592, 1, 2880]
    - [77, 0.0]
  - - [2880, 8189, 1, 4096]
    - [392, 0.0]
  - - [128, 624, 1, 2880]
    - [145, 0.0]
  - - [2880, 8184, 1, 4096]
    - [118, 0.0]
  - - [128, 656, 1, 2880]
    - [419, 0.0]
  - - [128, 688, 1, 2880]
    - [211, 0.0]
  - - [128, 720, 1, 2880]
    - [355, 0.0]
  - - [128, 752, 1, 2880]
    - [78, 0.0]
  - - [128, 784, 1, 2880]
    - [485, 0.0]
  - - [128, 816, 1, 2880]
    - [486, 0.0]
  - - [128, 848, 1, 2880]
    - [356, 0.0]
  - - [128, 880, 1, 2880]
    - [10, 0.0]
  - - [128, 912, 1, 2880]
    - [148, 0.0]
  - - [128, 944, 1, 2880]
    - [80, 0.0]
  - - [128, 976, 1, 2880]
    - [487, 0.0]
  - - [128, 1008, 1, 2880]
    - [81, 0.0]
  - - [128, 1202, 1, 2880]
    - [488, 0.0]
  - - [128, 1881, 1, 2880]
    - [149, 0.0]
  - - [128, 2049, 1, 2880]
    - [216, 0.0]
  - - [128, 3073, 1, 2880]
    - [287, 0.0]
  - - [128, 5790, 1, 2880]
    - [217, 0.0]
  - - [128, 6146, 1, 2880]
    - [12, 0.0]
  - - [128, 7169, 1, 2880]
    - [358, 0.0]
  - - [128, 7204, 1, 2880]
    - [218, 0.0]
  - - [128, 7821, 1, 2880]
    - [289, 0.0]
  - - [128, 8184, 1, 2880]
    - [220, 0.0]
  - - [640, 4, 1, 2880]
    - [221, 0.0]
  - - [640, 24, 1, 2880]
    - [359, 0.0]
  - - [640, 48, 1, 2880]
    - [14, 0.0]
  - - [640, 72, 1, 2880]
    - [291, 0.0]
  - - [640, 96, 1, 2880]
    - [84, 0.0]
  - - [640, 120, 1, 2880]
    - [492, 0.0]
  - - [640, 144, 1, 2880]
    - [361, 0.0]
  - - [640, 168, 1, 2880]
    - [362, 0.0]
  - - [640, 192, 1, 2880]
    - [223, 0.0]
  - - [640, 216, 1, 2880]
    - [493, 0.0]
  - - [640, 240, 1, 2880]
    - [494, 0.0]
  - - [640, 272, 1, 2880]
    - [87, 0.0]
  - - [640, 304, 1, 2880]
    - [425, 0.0]
  - - [640, 336, 1, 2880]
    - [426, 0.0]
  - - [640, 368, 1, 2880]
    - [156, 0.0]
  - - [640, 400, 1, 2880]
    - [157, 0.0]
  - - [640, 432, 1, 2880]
    - [295, 0.0]
  - - [640, 464, 1, 2880]
    - [495, 0.0]
  - - [640, 496, 1, 2880]
    - [158, 0.0]
  - - [640, 528, 1, 2880]
    - [90, 0.0]
  - - [640, 560, 1, 2880]
    - [227, 0.0]
  - - [640, 592, 1, 2880]
    - [364, 0.0]
  - - [640, 624, 1, 2880]
    - [91, 0.0]
  - - [640, 656, 1, 2880]
    - [159, 0.0]
  - - [640, 688, 1, 2880]
    - [228, 0.0]
  - - [640, 720, 1, 2880]
    - [365, 0.0]
  - - [640, 752, 1, 2880]
    - [92, 0.0]
  - - [640, 784, 1, 2880]
    - [160, 0.0]
  - - [640, 816, 1, 2880]
    - [298, 0.0]
  - - [640, 848, 1, 2880]
    - [498, 0.0]
  - - [640, 880, 1, 2880]
    - [93, 0.0]
  - - [640, 912, 1, 2880]
    - [22, 0.0]
  - - [640, 944, 1, 2880]
    - [299, 0.0]
  - - [640, 976, 1, 2880]
    - [431, 0.0]
  - - [640, 1008, 1, 2880]
    - [94, 0.0]
  - - [640, 1206, 1, 2880]
    - [23, 0.0]
  - - [640, 1881, 1, 2880]
    - [231, 0.0]
  - - [640, 2049, 1, 2880]
    - [300, 0.0]
  - - [640, 3073, 1, 2880]
    - [500, 0.0]
  - - [640, 4096, 1, 2880]
    - [432, 0.0]
  - - [640, 5790, 1, 2880]
    - [301, 0.0]
  - - [640, 6146, 1, 2880]
    - [24, 0.0]
  - - [640, 7169, 1, 2880]
    - [163, 0.0]
  - - [640, 7204, 1, 2880]
    - [232, 0.0]
  - - [640, 8184, 1, 2880]
    - [501, 0.0]
  - - [2880, 8, 1, 512]
    - [369, 0.0]
  - - [2880, 32, 1, 512]
    - [502, 0.0]
  - - [2880, 56, 1, 512]
    - [97, 0.0]
  - - [2880, 80, 1, 512]
    - [435, 0.0]
  - - [2880, 104, 1, 512]
    - [436, 0.0]
  - - [2880, 128, 1, 512]
    - [505, 0.0]
  - - [2880, 152, 1, 512]
    - [29, 0.0]
  - - [2880, 176, 1, 512]
    - [438, 0.0]
  - - [2880, 200, 1, 512]
    - [102, 0.0]
  - - [2880, 224, 1, 512]
    - [508, 0.0]
  - - [2880, 248, 1, 512]
    - [440, 0.0]
  - - [2880, 272, 1, 512]
    - [33, 0.0]
  - - [2880, 304, 1, 512]
    - [241, 0.0]
  - - [2880, 336, 1, 512]
    - [34, 0.0]
  - - [2880, 368, 1, 512]
    - [242, 0.0]
  - - [2880, 400, 1, 512]
    - [35, 0.0]
  - - [2880, 432, 1, 512]
    - [313, 0.0]
  - - [2880, 464, 1, 512]
    - [314, 0.0]
  - - [2880, 496, 1, 512]
    - [107, 0.0]
  - - [2880, 528, 1, 512]
    - [245, 0.0]
  - - [2880, 560, 1, 512]
    - [176, 0.0]
  - - [2880, 592, 1, 512]
    - [446, 0.0]
  - - [2880, 624, 1, 512]
    - [109, 0.0]
  - - [2880, 656, 1, 512]
    - [247, 0.0]
  - - [2880, 688, 1, 512]
    - [178, 0.0]
  - - [2880, 720, 1, 512]
    - [248, 0.0]
  - - [2880, 752, 1, 512]
    - [448, 0.0]
  - - [2880, 784, 1, 512]
    - [249, 0.0]
  - - [2880, 816, 1, 512]
    - [449, 0.0]
  - - [2880, 848, 1, 512]
    - [250, 0.0]
  - - [2880, 880, 1, 512]
    - [181, 0.0]
  - - [2880, 912, 1, 512]
    - [251, 0.0]
  - - [2880, 944, 1, 512]
    - [182, 0.0]
  - - [2880, 976, 1, 512]
    - [252, 0.0]
  - - [2880, 1008, 1, 512]
    - [183, 0.0]
  - - [2880, 1206, 1, 512]
    - [45, 0.0]
  - - [2880, 1881, 1, 512]
    - [323, 0.0]
  - - [2880, 2049, 1, 512]
    - [184, 0.0]
  - - [2880, 3073, 1, 512]
    - [390, 0.0]
  - - [2880, 4096, 1, 512]
    - [116, 0.0]
  - - [2880, 5790, 1, 512]
    - [454, 0.0]
  - - [2880, 6146, 1, 512]
    - [324, 0.0]
  - - [2880, 7169, 1, 512]
    - [46, 0.0]
  - - [2880, 7204, 1, 512]
    - [117, 0.0]
  - - [2880, 8184, 1, 512]
    - [524, 0.0]
  - - [2880, 4, 1, 4096]
    - [25, 0.0]
  - - [2880, 24, 1, 4096]
    - [303, 0.0]
  - - [2880, 48, 1, 4096]
    - [165, 0.0]
  - - [2880, 72, 1, 4096]
    - [27, 0.0]
  - - [2880, 96, 1, 4096]
    - [372, 0.0]
  - - [2880, 120, 1, 4096]
    - [306, 0.0]
  - - [2880, 144, 1, 4096]
    - [237, 0.0]
  - - [2880, 168, 1, 4096]
    - [169, 0.0]
  - - [2880, 192, 1, 4096]
    - [375, 0.0]
  - - [2880, 216, 1, 4096]
    - [309, 0.0]
  - - [2880, 240, 1, 4096]
    - [240, 0.0]
  - - [2880, 272, 1, 4096]
    - [104, 0.0]
  - - [2880, 304, 1, 4096]
    - [311, 0.0]
  - - [2880, 336, 1, 4096]
    - [173, 0.0]
  - - [2880, 368, 1, 4096]
    - [312, 0.0]
  - - [2880, 400, 1, 4096]
    - [174, 0.0]
  - - [2880, 432, 1, 4096]
    - [443, 0.0]
  - - [2880, 464, 1, 4096]
    - [36, 0.0]
  - - [2880, 496, 1, 4096]
    - [175, 0.0]
  - - [2880, 528, 1, 4096]
    - [37, 0.0]
  - - [2880, 560, 1, 4096]
    - [108, 0.0]
  - - [2880, 592, 1, 4096]
    - [246, 0.0]
  - - [2880, 624, 1, 4096]
    - [177, 0.0]
  - - [2880, 656, 1, 4096]
    - [39, 0.0]
  - - [2880, 688, 1, 4096]
    - [110, 0.0]
  - - [2880, 720, 1, 4096]
    - [40, 0.0]
  - - [2880, 752, 1, 4096]
    - [517, 0.0]
  - - [2880, 784, 1, 4096]
    - [41, 0.0]
  - - [2880, 816, 1, 4096]
    - [112, 0.0]
  - - [2880, 848, 1, 4096]
    - [450, 0.0]
  - - [2880, 880, 1, 4096]
    - [519, 0.0]
  - - [2880, 912, 1, 4096]
    - [43, 0.0]
  - - [2880, 944, 1, 4096]
    - [520, 0.0]
  - - [2880, 976, 1, 4096]
    - [44, 0.0]
  - - [2880, 1008, 1, 4096]
    - [521, 0.0]
  - - [2880, 1202, 1, 4096]
    - [253, 0.0]
  - - [2880, 1881, 1, 4096]
    - [453, 0.0]
  - - [2880, 2050, 1, 4096]
    - [522, 0.0]
  - - [2880, 4096, 1, 4096]
    - [254, 0.0]
  - - [2880, 7169, 1, 4096]
    - [185, 0.0]
  - - [2880, 7209, 1, 4096]
    - [391, 0.0]
  - - [5120, 4, 1, 2880]
    - [48, 0.0]
  - - [5120, 24, 1, 2880]
    - [525, 0.0]
  - - [5120, 48, 1, 2880]
    - [327, 0.0]
  - - [5120, 72, 1, 2880]
    - [49, 0.0]
  - - [5120, 96, 1, 2880]
    - [120, 0.0]
  - - [5120, 120, 1, 2880]
    - [50, 0.0]
  - - [5120, 144, 1, 2880]
    - [328, 0.0]
  - - [5120, 168, 1, 2880]
    - [395, 0.0]
  - - [5120, 192, 1, 2880]
    - [459, 0.0]
  - - [5120, 216, 1, 2880]
    - [528, 0.0]
  - - [5120, 240, 1, 2880]
    - [52, 0.0]
  - - [5120, 272, 1, 2880]
    - [330, 0.0]
  - - [5120, 304, 1, 2880]
    - [123, 0.0]
  - - [5120, 336, 1, 2880]
    - [397, 0.0]
  - - [5120, 368, 1, 2880]
    - [53, 0.0]
  - - [5120, 400, 1, 2880]
    - [331, 0.0]
  - - [5120, 432, 1, 2880]
    - [124, 0.0]
  - - [5120, 464, 1, 2880]
    - [398, 0.0]
  - - [5120, 496, 1, 2880]
    - [54, 0.0]
  - - [5120, 528, 1, 2880]
    - [462, 0.0]
  - - [5120, 560, 1, 2880]
    - [125, 0.0]
  - - [5120, 592, 1, 2880]
    - [399, 0.0]
  - - [5120, 624, 1, 2880]
    - [55, 0.0]
  - - [5120, 656, 1, 2880]
    - [463, 0.0]
  - - [5120, 688, 1, 2880]
    - [126, 0.0]
  - - [5120, 720, 1, 2880]
    - [532, 0.0]
  - - [5120, 752, 1, 2880]
    - [334, 0.0]
  - - [5120, 784, 1, 2880]
    - [56, 0.0]
  - - [5120, 816, 1, 2880]
    - [401, 0.0]
  - - [5120, 848, 1, 2880]
    - [533, 0.0]
  - - [5120, 880, 1, 2880]
    - [465, 0.0]
  - - [5120, 912, 1, 2880]
    - [57, 0.0]
  - - [5120, 944, 1, 2880]
    - [534, 0.0]
  - - [5120, 976, 1, 2880]
    - [402, 0.0]
  - - [5120, 1008, 1, 2880]
    - [466, 0.0]
  - - [5120, 1202, 1, 2880]
    - [58, 0.0]
  - - [5120, 1881, 1, 2880]
    - [403, 0.0]
  - - [5120, 2050, 1, 2880]
    - [197, 0.0]
  - - [5120, 4096, 1, 2880]
    - [129, 0.0]
  - - [25136, 5, 1, 2880]
    - [60, 0.0]
  - - [25136, 22, 1, 2880]
    - [538, 0.0]
  - - [25136, 40, 1, 2880]
    - [201, 0.0]
  - - [25136, 57, 1, 2880]
    - [540, 0.0]
  - - [25136, 74, 1, 2880]
    - [409, 0.0]
  - - [25136, 128, 1, 2880]
    - [473, 0.0]
  - - [201088, 5, 1, 2880]
    - [136, 0.0]
  - - [201088, 23, 1, 2880]
    - [411, 0.0]
  - - [201088, 40, 1, 2880]
    - [346, 0.0]
  - - [201088, 58, 1, 2880]
    - [476, 0.0]
  - - [201088, 79, 1, 2880]
    - [413, 0.0]
  - - [201088, 128, 1, 2880]
    - [477, 0.0]
  - - [16, 8192, 1, 8192]
    - [0, 0.0]
  - - [32000, 8192, 1, 8192]
    - [1, 0.0]
  - - [10240, 8192, 1, 16]
    - [2, 0.0]
  - - [8192, 8192, 1, 16]
    - [3, 0.0]
  - - [128, 184, 1, 2880]
    - [5, 0.0]
  - - [128, 232, 1, 2880]
    - [6, 0.0]
  - - [128, 416, 1, 2880]
    - [7, 0.0]
  - - [128, 576, 1, 2880]
    - [8, 0.0]
  - - [128, 768, 1, 2880]
    - [9, 0.0]
  - - [128, 1206, 1, 2880]
    - [11, 0.0]
  - - [640, 16, 1, 2880]
    - [13, 0.0]
  - - [640, 64, 1, 2880]
    - [15, 0.0]
  - - [640, 176, 1, 2880]
    - [16, 0.0]
  - - [640, 288, 1, 2880]
    - [17, 0.0]
  - - [640, 320, 1, 2880]
    - [18, 0.0]
  - - [640, 512, 1, 2880]
    - [19, 0.0]
  - - [640, 640, 1, 2880]
    - [20, 0.0]
  - - [640, 768, 1, 2880]
    - [21, 0.0]
  - - [2880, 1, 1, 4096]
    - [25, 0.0]
  - - [2880, 2, 1, 4096]
    - [25, 0.0]
  - - [2880, 48, 1, 512]
    - [26, 0.0]
  - - [2880, 112, 1, 4096]
    - [28, 0.0]
  - - [2880, 184, 1, 512]
    - [30, 0.0]
  - - [2880, 208, 1, 4096]
    - [31, 0.0]
  - - [2880, 232, 1, 512]
    - [32, 0.0]
  - - [2880, 608, 1, 512]
    - [38, 0.0]
  - - [2880, 864, 1, 512]
    - [42, 0.0]
  - - [2880, 7217, 1, 4096]
    - [47, 0.0]
  - - [5120, 1, 1, 2880]
    - [48, 0.0]
  - - [5120, 2, 1, 2880]
    - [48, 0.0]
  - - [5120, 176, 1, 2880]
    - [51, 0.0]
  - - [25136, 15, 1, 2880]
    - [61, 0.0]
  - - [25136, 30, 1, 2880]
    - [62, 0.0]
  - - [25136, 46, 1, 2880]
    - [63, 0.0]
  - - [25136, 62, 1, 2880]
    - [64, 0.0]
  - - [25136, 85, 1, 2880]
    - [65, 0.0]
  - - [201088, 8, 1, 2880]
    - [66, 0.0]
  - - [201088, 17, 1, 2880]
    - [67, 0.0]
  - - [201088, 33, 1, 2880]
    - [68, 0.0]
  - - [201088, 64, 1, 2880]
    - [69, 0.0]
  - - [128, 48, 1, 2880]
    - [70, 0.0]
  - - [128, 176, 1, 2880]
    - [71, 0.0]
  - - [128, 248, 1, 2880]
    - [72, 0.0]
  - - [128, 896, 1, 2880]
    - [79, 0.0]
  - - [128, 2050, 1, 2880]
    - [82, 0.0]
  - - [128, 8192, 1, 2880]
    - [83, 0.0]
  - - [640, 136, 1, 2880]
    - [85, 0.0]
  - - [640, 224, 1, 2880]
    - [86, 0.0]
  - - [640, 352, 1, 2880]
    - [88, 0.0]
  - - [640, 384, 1, 2880]
    - [89, 0.0]
  - - [2880, 24, 1, 512]
    - [96, 0.0]
  - - [2880, 88, 1, 512]
    - [98, 0.0]
  - - [2880, 104, 1, 4096]
    - [99, 0.0]
  - - [2880, 136, 1, 512]
    - [100, 0.0]
  - - [2880, 176, 1, 4096]
    - [101, 0.0]
  - - [2880, 240, 1, 512]
    - [103, 0.0]
  - - [2880, 352, 1, 4096]
    - [105, 0.0]
  - - [2880, 416, 1, 512]
    - [106, 0.0]
  - - [2880, 768, 1, 512]
    - [111, 0.0]
  - - [2880, 896, 1, 512]
    - [113, 0.0]
  - - [2880, 960, 1, 512]
    - [114, 0.0]
  - - [2880, 1024, 1, 4096]
    - [115, 0.0]
  - - [5120, 32, 1, 2880]
    - [119, 0.0]
  - - [5120, 160, 1, 2880]
    - [121, 0.0]
  - - [5120, 224, 1, 2880]
    - [122, 0.0]
  - - [5120, 800, 1, 2880]
    - [127, 0.0]
  - - [5120, 960, 1, 2880]
    - [128, 0.0]
  - - [25136, 10, 1, 2880]
    - [131, 0.0]
  - - [25136, 24, 1, 2880]
    - [132, 0.0]
  - - [25136, 35, 1, 2880]
    - [133, 0.0]
  - - [25136, 52, 1, 2880]
    - [134, 0.0]
  - - [25136, 80, 1, 2880]
    - [135, 0.0]
  - - [201088, 25, 1, 2880]
    - [137, 0.0]
  - - [201088, 50, 1, 2880]
    - [138, 0.0]
  - - [201088, 65, 1, 2880]
    - [139, 0.0]
  - - [128, 56, 1, 2880]
    - [140, 0.0]
  - - [128, 208, 1, 2880]
    - [142, 0.0]
  - - [128, 480, 1, 2880]
    - [144, 0.0]
  - - [128, 672, 1, 2880]
    - [146, 0.0]
  - - [128, 736, 1, 2880]
    - [147, 0.0]
  - - [640, 8, 1, 2880]
    - [151, 0.0]
  - - [640, 32, 1, 2880]
    - [152, 0.0]
  - - [640, 128, 1, 2880]
    - [153, 0.0]
  - - [640, 160, 1, 2880]
    - [154, 0.0]
  - - [640, 256, 1, 2880]
    - [155, 0.0]
  - - [640, 896, 1, 2880]
    - [161, 0.0]
  - - [640, 1024, 1, 2880]
    - [162, 0.0]
  - - [2880, 16, 1, 512]
    - [164, 0.0]
  - - [2880, 80, 1, 4096]
    - [166, 0.0]
  - - [2880, 112, 1, 512]
    - [167, 0.0]
  - - [2880, 136, 1, 4096]
    - [168, 0.0]
  - - [2880, 208, 1, 512]
    - [170, 0.0]
  - - [2880, 232, 1, 4096]
    - [171, 0.0]
  - - [2880, 288, 1, 4096]
    - [172, 0.0]
  - - [2880, 736, 1, 4096]
    - [179, 0.0]
  - - [2880, 800, 1, 512]
    - [180, 0.0]
  - - [5120, 16, 1, 2880]
    - [187, 0.0]
  - - [5120, 80, 1, 2880]
    - [188, 0.0]
  - - [5120, 136, 1, 2880]
    - [189, 0.0]
  - - [5120, 208, 1, 2880]
    - [190, 0.0]
  - - [5120, 288, 1, 2880]
    - [191, 0.0]
  - - [5120, 416, 1, 2880]
    - [192, 0.0]
  - - [5120, 544, 1, 2880]
    - [193, 0.0]
  - - [5120, 672, 1, 2880]
    - [194, 0.0]
  - - [5120, 832, 1, 2880]
    - [195, 0.0]
  - - [5120, 928, 1, 2880]
    - [196, 0.0]
  - - [25136, 11, 1, 2880]
    - [199, 0.0]
  - - [25136, 25, 1, 2880]
    - [200, 0.0]
  - - [25136, 56, 1, 2880]
    - [202, 0.0]
  - - [25136, 77, 1, 2880]
    - [203, 0.0]
  - - [201088, 6, 1, 2880]
    - [204, 0.0]
  - - [201088, 16, 1, 2880]
    - [205, 0.0]
  - - [201088, 56, 1, 2880]
    - [206, 0.0]
  - - [201088, 80, 1, 2880]
    - [207, 0.0]
  - - [128, 352, 1, 2880]
    - [210, 0.0]
  - - [128, 800, 1, 2880]
    - [212, 0.0]
  - - [128, 832, 1, 2880]
    - [213, 0.0]
  - - [128, 864, 1, 2880]
    - [214, 0.0]
  - - [128, 1024, 1, 2880]
    - [215, 0.0]
  - - [128, 7217, 1, 2880]
    - [219, 0.0]
  - - [640, 1, 1, 2880]
    - [221, 0.0]
  - - [640, 2, 1, 2880]
    - [221, 0.0]
  - - [640, 104, 1, 2880]
    - [222, 0.0]
  - - [640, 208, 1, 2880]
    - [224, 0.0]
  - - [640, 232, 1, 2880]
    - [225, 0.0]
  - - [640, 416, 1, 2880]
    - [226, 0.0]
  - - [640, 800, 1, 2880]
    - [229, 0.0]
  - - [640, 928, 1, 2880]
    - [230, 0.0]
  - - [2880, 16, 1, 4096]
    - [233, 0.0]
  - - [2880, 40, 1, 512]
    - [234, 0.0]
  - - [2880, 72, 1, 512]
    - [235, 0.0]
  - - [2880, 120, 1, 512]
    - [236, 0.0]
  - - [2880, 168, 1, 512]
    - [238, 0.0]
  - - [2880, 200, 1, 4096]
    - [239, 0.0]
  - - [2880, 416, 1, 4096]
    - [243, 0.0]
  - - [2880, 480, 1, 512]
    - [244, 0.0]
  - - [5120, 56, 1, 2880]
    - [257, 0.0]
  - - [5120, 112, 1, 2880]
    - [258, 0.0]
  - - [5120, 184, 1, 2880]
    - [259, 0.0]
  - - [5120, 256, 1, 2880]
    - [260, 0.0]
  - - [5120, 352, 1, 2880]
    - [261, 0.0]
  - - [5120, 480, 1, 2880]
    - [262, 0.0]
  - - [5120, 608, 1, 2880]
    - [263, 0.0]
  - - [5120, 736, 1, 2880]
    - [264, 0.0]
  - - [5120, 864, 1, 2880]
    - [265, 0.0]
  - - [5120, 1024, 1, 2880]
    - [266, 0.0]
  - - [25136, 8, 1, 2880]
    - [268, 0.0]
  - - [25136, 16, 1, 2880]
    - [268, 0.0]
  - - [25136, 31, 1, 2880]
    - [269, 0.0]
  - - [25136, 48, 1, 2880]
    - [270, 0.0]
  - - [25136, 63, 1, 2880]
    - [271, 0.0]
  - - [25136, 89, 1, 2880]
    - [272, 0.0]
  - - [201088, 32, 1, 2880]
    - [274, 0.0]
  - - [201088, 63, 1, 2880]
    - [275, 0.0]
  - - [128, 80, 1, 2880]
    - [276, 0.0]
  - - [128, 224, 1, 2880]
    - [279, 0.0]
  - - [128, 608, 1, 2880]
    - [284, 0.0]
  - - [128, 640, 1, 2880]
    - [285, 0.0]
  - - [128, 960, 1, 2880]
    - [286, 0.0]
  - - [128, 7177, 1, 2880]
    - [288, 0.0]
  - - [128, 8189, 1, 2880]
    - [290, 0.0]
  - - [640, 80, 1, 2880]
    - [292, 0.0]
  - - [640, 184, 1, 2880]
    - [293, 0.0]
  - - [640, 200, 1, 2880]
    - [294, 0.0]
  - - [640, 544, 1, 2880]
    - [296, 0.0]
  - - [640, 672, 1, 2880]
    - [297, 0.0]
  - - [2880, 56, 1, 4096]
    - [304, 0.0]
  - - [2880, 88, 1, 4096]
    - [305, 0.0]
  - - [2880, 152, 1, 4096]
    - [307, 0.0]
  - - [2880, 184, 1, 4096]
    - [308, 0.0]
  - - [2880, 248, 1, 4096]
    - [310, 0.0]
  - - [2880, 544, 1, 4096]
    - [315, 0.0]
  - - [2880, 608, 1, 4096]
    - [316, 0.0]
  - - [2880, 672, 1, 4096]
    - [317, 0.0]
  - - [2880, 736, 1, 512]
    - [318, 0.0]
  - - [2880, 800, 1, 4096]
    - [319, 0.0]
  - - [2880, 864, 1, 4096]
    - [320, 0.0]
  - - [2880, 928, 1, 4096]
    - [321, 0.0]
  - - [2880, 992, 1, 4096]
    - [322, 0.0]
  - - [5120, 8, 1, 2880]
    - [326, 0.0]
  - - [5120, 200, 1, 2880]
    - [329, 0.0]
