projects/hipblaslt/library/src/amd_detail/rocblaslt/src/Tensile/Logic/asm_full/gfx950/Equality/gfx950_Cijk_Alik_Bjlk_BBS_BH_BiasSB_HAS_SAV_UserArgs.yaml
- {MinimumRequiredVersion: 5.0.0}
- gfx950
- gfx950
- [Device 75a0]
    SolutionIndex: 0
    SolutionNameMin: Cijk_Alik_Bjlk_BBS_BH_Bias_HA_S_SAV_UserArgs_MT128x128x64_MI32x32x1_SN_LDSB0_AFC1_AFEM1_AFEM1_ASEM1_CLR0_CADS0_DTLA0_DTLB0_DTVA0_DTVB0_EPS0_FDSI0_GRPM1_GRVWA8_GRVWB8_GSU0_GSUAMB_GSUC0_GSUWGMRR0_GLS0_ISA950_IU1_K1_LBSPPA512_LBSPPB0_LBSPPM0_LPA8_LPB0_LPM0_LRVW8_LWPMn1_MIAV1_MIWT4_1_MO40_NTn1_NTA0_NTB2_NTC4_NTD0_NTM0_NEPBS16_NLCA1_NLCB1_ONLL1_PGR2_PLR1_PKA1_SIA3_SS1_SU8_SUM0_SUS128_SPO0_SRVW0_SSO0_SVW4_SK3_SKXCCM8_TLDS1_ULSGRO0_USL1_UIOFGRO0_USFGRO0_VSn1_VWA4_VWB1_WSGRA0_WSGRB0_WS64_WG32_8_1_WGM48_WGMXCC2_WGMXCCGn1
    SolutionIndex: 1
    SolutionNameMin: Cijk_Alik_Bjlk_BBS_BH_Bias_HA_S_SAV_UserArgs_MT96x128x128_MI16x16x1_SN_LDSB0_AFC1_AFEM1_AFEM1_ASEM1_CLR0_CADS0_DTLA0_DTLB0_DTVA0_DTVB0_EPS0_FDSI0_GRPM1_GRVWA8_GRVWB8_GSU0_GSUAMB_GSUC0_GSUWGMRR0_GLS0_ISA950_IU1_K1_LBSPPA512_LBSPPB2048_LBSPPM0_LPA16_LPB16_LPM0_LRVW8_LWPMn1_MIAV0_MIWT6_2_MO40_NTn1_NTA2_NTB3_NTC1_NTD4_NTM0_NEPBS0_NLCA1_NLCB1_ONLL1_PGR2_PLR1_PKA1_SIA3_SS1_SU0_SUM0_SUS0_SPO0_SRVW0_SSO0_SVW2_SK3_SKXCCM4_TLDS1_ULSGRO0_USL1_UIOFGRO0_USFGRO0_VSn1_VWA2_VWB1_WSGRA0_WSGRB0_WS64_WG16_16_1_WGM1_WGMXCC8_WGMXCCGn1
    SolutionIndex: 2
    SolutionNameMin: Cijk_Alik_Bjlk_BBS_BH_Bias_HA_S_SAV_UserArgs_MT96x128x32_MI32x32x1_CMS_SN_LDSB1_AFC1_AFEM1_AFEM1_ASEM1_CLR1_CADS0_DTLA0_DTLB0_DTVA0_DTVB0_EPS0_FDSI0_GRPM1_GRVWA2_GRVWB8_GSU0_GSUAMB_GSUC0_GSUWGMRR0_GLS0_ISA950_IU1_K1_LBSPPA128_LBSPPB0_LBSPPM0_LPA8_LPB0_LPM0_LRVW8_LWPMn1_MIAV0_MIWT3_1_MO40_NTn1_NTA1_NTB2_NTC1_NTD4_NTM0_NEPBS12_NLCA1_NLCB1_ONLL1_PGR2_PLR1_PKA1_SIA3_SS1_SU0_SUM0_SUS0_SPO1_SRVW0_SSO0_SVW1_SK3_SKXCCM0_TLDS1_ULSGRO0_USL1_UIOFGRO0_USFGRO0_VSn1_VWA1_VWB1_WSGRA0_WSGRB0_WS64_WG32_8_1_WGM0_WGMXCC32_WGMXCCGn1
    SolutionIndex: 3
    SolutionNameMin: Cijk_Alik_Bjlk_BBS_BH_Bias_HA_S_SAV_UserArgs_MT16x128x32_MI16x16x1_CMS_SN_LDSB0_AFC1_AFEM1_AFEM1_ASEM1_CLR0_CADS0_DTLA0_DTLB0_DTVA0_DTVB0_EPS0_FDSI0_GRPM1_GRVWA2_GRVWB8_GSU0_GSUAMB_GSUC0_GSUWGMRR0_GLS0_ISA950_IU1_K1_LBSPPA128_LBSPPB2048_LBSPPM0_LPA16_LPB16_LPM0_LRVW8_LWPMn1_MIAV0_MIWT1_2_MO40_NTn1_NTA0_NTB6_NTC1_NTD4_NTM0_NEPBS0_NLCA1_NLCB1_ONLL1_PGR2_PLR1_PKA1_SIA3_SS0_SU0_SUM0_SUS0_SPO1_SRVW0_SSO0_SVW4_SK3_SKXCCM0_TLDS1_ULSGRO0_USL1_UIOFGRO0_USFGRO0_VSn1_VWA1_VWB1_WSGRA0_WSGRB0_WS64_WG16_16_1_WGM1_WGMXCC32_WGMXCCGn1
    SolutionIndex: 4
    SolutionNameMin: Cijk_Alik_Bjlk_BBS_BH_Bias_HA_S_SAV_UserArgs_MT64x16x64_MI16x16x1_CMS_SN_LDSB1_AFC1_AFEM1_AFEM1_ASEM1_CLR1_CADS0_DTLA0_DTLB0_DTVA0_DTVB0_EPS0_FDSI0_GRPM1_GRVWA8_GRVWB8_GSU0_GSUAMB_GSUC0_GSUWGMRR0_GLS0_ISA950_IU1_K1_LBSPPA256_LBSPPB256_LBSPPM0_LPA16_LPB16_LPM0_LRVW8_LWPMn1_MIAV0_MIWT2_1_MO40_NTn1_NTA3_NTB4_NTC0_NTD4_NTM0_NEPBS16_NLCA1_NLCB1_ONLL1_PGR2_PLR1_PKA1_SIA3_SS1_SU0_SUM0_SUS0_SPO1_SRVW0_SSO1_SVW2_SK3_SKXCCM0_TLDS1_ULSGRO0_USL1_UIOFGRO0_USFGRO0_VSn1_VWA2_VWB1_WSGRA0_WSGRB0_WS64_WG32_4_1_WGM1_WGMXCC8_WGMXCCGn1
    SolutionIndex: 5
    SolutionNameMin: Cijk_Alik_Bjlk_BBS_BH_Bias_HA_S_SAV_UserArgs_MT128x64x128_MI16x16x1_CMS_SN_LDSB0_AFC1_AFEM1_AFEM1_ASEM1_CLR0_CADS0_DTLA1_DTLB1_DTVA0_DTVB0_EPS0_FDSI0_GRPM1_GRVWA8_GRVWB8_GSU0_GSUAMB_GSUC0_GSUWGMRR0_GLS0_ISA950_IU1_K1_LBSPPA1024_LBSPPB1024_LBSPPM0_LPA16_LPB0_LPM0_LRVW8_LWPMn1_MIAV0_MIWT4_2_MO40_NTn1_NTA0_NTB1_NTC5_NTD4_NTM0_NEPBS0_NLCA1_NLCB1_ONLL1_PGR2_PLR1_PKA1_SIA3_SS1_SU8_SUM0_SUS512_SPO1_SRVW0_SSO0_SVW4_SK3_SKXCCM0_TLDS1_ULSGRO0_USL1_UIOFGRO0_USFGROn1_VSn1_VWA4_VWB1_WSGRA0_WSGRB0_WS64_WG32_8_1_WGM0_WGMXCC4_WGMXCCGn1
    SolutionIndex: 6
    SolutionNameMin: Cijk_Alik_Bjlk_BBS_BH_Bias_HA_S_SAV_UserArgs_MT128x128x128_MI32x32x1_CMS_SN_LDSB0_AFC1_AFEM1_AFEM1_ASEM1_CLR0_CADS0_DTLA0_DTLB0_DTVA0_DTVB0_EPS0_FDSI0_GRPM1_GRVWA8_GRVWB8_GSU0_GSUAMB_GSUC0_GSUWGMRR0_GLS0_ISA950_IU1_K1_LBSPPA1024_LBSPPB0_LBSPPM0_LPA8_LPB0_LPM0_LRVW8_LWPMn1_MIAV0_MIWT4_1_MO40_NTn1_NTA0_NTB3_NTC0_NTD5_NTM0_NEPBS0_NLCA1_NLCB1_ONLL1_PGR2_PLR1_PKA1_SIA3_SS1_SU0_SUM0_SUS0_SPO0_SRVW0_SSO0_SVW4_SK3_SKXCCM4_TLDS1_ULSGRO0_USL1_UIOFGRO0_USFGRO0_VSn1_VWA4_VWB1_WSGRA0_WSGRB0_WS64_WG32_8_1_WGM1_WGMXCC16_WGMXCCGn1
    SolutionIndex: 7
    SolutionNameMin: Cijk_Alik_Bjlk_BBS_BH_Bias_HA_S_SAV_UserArgs_MT96x128x128_MI32x32x1_CMS_SN_LDSB0_AFC1_AFEM1_AFEM1_ASEM1_CLR0_CADS0_DTLA0_DTLB0_DTVA0_DTVB0_EPS0_FDSI0_GRPM1_GRVWA8_GRVWB8_GSU0_GSUAMB_GSUC0_GSUWGMRR0_GLS0_ISA950_IU1_K1_LBSPPA256_LBSPPB0_LBSPPM0_LPA8_LPB0_LPM0_LRVW8_LWPMn1_MIAV1_MIWT3_1_MO40_NTn1_NTA2_NTB1_NTC1_NTD7_NTM0_NEPBS0_NLCA1_NLCB1_ONLL1_PGR2_PLR1_PKA1_SIA3_SS1_SU8_SUM0_SUS512_SPO0_SRVW0_SSO0_SVW1_SK3_SKXCCM5_TLDS1_ULSGRO0_USL1_UIOFGRO0_USFGROn1_VSn1_VWA1_VWB1_WSGRA0_WSGRB0_WS64_WG32_8_1_WGM1_WGMXCC8_WGMXCCGn1
    SolutionIndex: 8
    SolutionNameMin: Cijk_Alik_Bjlk_BBS_BH_Bias_HA_S_SAV_UserArgs_MT64x64x128_MI32x32x1_CMS_SN_LDSB0_AFC1_AFEM1_AFEM1_ASEM1_CLR0_CADS0_DTLA0_DTLB0_DTVA0_DTVB0_EPS0_FDSI0_GRPM1_GRVWA8_GRVWB8_GSU0_GSUAMB_GSUC0_GSUWGMRR0_GLS0_ISA950_IU1_K1_LBSPPA256_LBSPPB0_LBSPPM0_LPA8_LPB0_LPM0_LRVW8_LWPMn1_MIAV0_MIWT1_1_MO40_NTn1_NTA0_NTB2_NTC6_NTD7_NTM0_NEPBS0_NLCA1_NLCB1_ONLL1_PGR2_PLR1_PKA1_SIA3_SS1_SU0_SUM0_SUS0_SPO0_SRVW0_SSO1_SVW1_SK3_SKXCCM4_TLDS1_ULSGRO0_USL1_UIOFGRO0_USFGRO0_VSn1_VWA1_VWB1_WSGRA0_WSGRB0_WS64_WG64_4_1_WGM1_WGMXCC1_WGMXCCGn1
    SolutionIndex: 9
    SolutionNameMin: Cijk_Alik_Bjlk_BBS_BH_Bias_HA_S_SAV_UserArgs_MT256x96x64_MI16x16x1_CMS_SN_LDSB0_AFC1_AFEM1_AFEM1_ASEM1_CLR0_CADS0_DTLA0_DTLB0_DTVA0_DTVB0_EPS0_FDSI0_GRPM1_GRVWA8_GRVWB8_GSU0_GSUAMB_GSUC0_GSUWGMRR0_GLS0_ISA950_IU1_K1_LBSPPA1024_LBSPPB1536_LBSPPM0_LPA16_LPB16_LPM0_LRVW8_LWPMn1_MIAV0_MIWT8_3_MO40_NTn1_NTA3_NTB0_NTC6_NTD4_NTM0_NEPBS0_NLCA1_NLCB3_ONLL1_PGR2_PLR1_PKA1_SIA3_SS1_SU8_SUM0_SUS512_SPO0_SRVW0_SSO1_SVW8_SK3_SKXCCM0_TLDS1_ULSGRO0_USL1_UIOFGRO0_USFGRO1_VSn1_VWA8_VWB1_WSGRA0_WSGRB0_WS64_WG32_8_1_WGM0_WGMXCC4_WGMXCCGn1
    SolutionIndex: 10
    SolutionNameMin: Cijk_Alik_Bjlk_BBS_BH_Bias_HA_S_SAV_UserArgs_MT256x96x64_MI16x16x1_CMS_SN_LDSB0_AFC1_AFEM1_AFEM1_ASEM1_CLR0_CADS0_DTLA0_DTLB0_DTVA0_DTVB0_EPS0_FDSI0_GRPM1_GRVWA8_GRVWB8_GSU0_GSUAMB_GSUC0_GSUWGMRR0_GLS0_ISA950_IU1_K1_LBSPPA1024_LBSPPB1536_LBSPPM0_LPA16_LPB16_LPM0_LRVW8_LWPMn1_MIAV0_MIWT8_3_MO40_NTn1_NTA0_NTB1_NTC2_NTD7_NTM0_NEPBS16_NLCA1_NLCB3_ONLL1_PGR2_PLR1_PKA1_SIA3_SS1_SU16_SUM0_SUS256_SPO1_SRVW0_SSO1_SVW8_SK3_SKXCCM8_TLDS1_ULSGRO0_USL1_UIOFGRO0_USFGRO0_VSn1_VWA8_VWB1_WSGRA0_WSGRB0_WS64_WG32_8_1_WGM1_WGMXCC2_WGMXCCGn1
    SolutionIndex: 11
    SolutionNameMin: Cijk_Alik_Bjlk_BBS_BH_Bias_HA_S_SAV_UserArgs_MT128x128x128_MI32x32x1_CMS_SN_LDSB0_AFC1_AFEM1_AFEM1_ASEM1_CLR0_CADS0_DTLA0_DTLB0_DTVA0_DTVB0_EPS0_FDSI0_GRPM1_GRVWA2_GRVWB8_GSU0_GSUAMB_GSUC0_GSUWGMRR0_GLS0_ISA950_IU1_K1_LBSPPA512_LBSPPB0_LBSPPM0_LPA8_LPB0_LPM0_LRVW8_LWPMn1_MIAV0_MIWT2_2_MO40_NTn1_NTA3_NTB0_NTC7_NTD6_NTM0_NEPBS0_NLCA1_NLCB1_ONLL1_PGR2_PLR1_PKA1_SIA3_SS1_SU16_SUM0_SUS256_SPO0_SRVW0_SSO0_SVW2_SK3_SKXCCM4_TLDS1_ULSGRO0_USL1_UIOFGRO0_USFGRO1_VSn1_VWA2_VWB1_WSGRA0_WSGRB0_WS64_WG64_4_1_WGM24_WGMXCC16_WGMXCCGn1
    SolutionIndex: 12
    SolutionNameMin: Cijk_Alik_Bjlk_BBS_BH_Bias_HA_S_SAV_UserArgs_MT96x64x128_MI16x16x1_CMS_SN_LDSB0_AFC1_AFEM1_AFEM1_ASEM1_CLR0_CADS0_DTLA0_DTLB0_DTVA0_DTVB0_EPS0_FDSI0_GRPM1_GRVWA8_GRVWB8_GSU0_GSUAMB_GSUC0_GSUWGMRR0_GLS0_ISA950_IU1_K1_LBSPPA256_LBSPPB1024_LBSPPM0_LPA16_LPB16_LPM0_LRVW8_LWPMn1_MIAV0_MIWT3_2_MO40_NTn1_NTA2_NTB3_NTC1_NTD5_NTM0_NEPBS0_NLCA1_NLCB1_ONLL1_PGR2_PLR1_PKA1_SIA3_SS1_SU0_SUM0_SUS0_SPO0_SRVW0_SSO0_SVW1_SK3_SKXCCM4_TLDS1_ULSGRO0_USL1_UIOFGRO0_USFGROn1_VSn1_VWA1_VWB1_WSGRA0_WSGRB0_WS64_WG32_8_1_WGM1_WGMXCC8_WGMXCCGn1
    SolutionIndex: 13
    SolutionNameMin: Cijk_Alik_Bjlk_BBS_BH_Bias_HA_S_SAV_UserArgs_MT192x128x64_MI32x32x1_CMS_SN_LDSB0_AFC1_AFEM1_AFEM1_ASEM1_CLR0_CADS0_DTLA0_DTLB0_DTVA0_DTVB0_EPS0_FDSI0_GRPM1_GRVWA8_GRVWB8_GSU0_GSUAMB_GSUC0_GSUWGMRR0_GLS0_ISA950_IU1_K1_LBSPPA256_LBSPPB0_LBSPPM0_LPA8_LPB0_LPM0_LRVW8_LWPMn1_MIAV0_MIWT6_1_MO40_NTn1_NTA3_NTB0_NTC1_NTD5_NTM0_NEPBS0_NLCA1_NLCB1_ONLL1_PGR2_PLR1_PKA1_SIA3_SS1_SU0_SUM0_SUS0_SPO1_SRVW0_SSO1_SVW2_SK3_SKXCCM0_TLDS1_ULSGRO0_USL1_UIOFGRO0_USFGRO0_VSn1_VWA2_VWB1_WSGRA0_WSGRB0_WS64_WG32_8_1_WGM8_WGMXCC8_WGMXCCGn1
    SolutionIndex: 14
    SolutionNameMin: Cijk_Alik_Bjlk_BBS_BH_Bias_HA_S_SAV_UserArgs_MT64x64x128_MI16x16x1_CMS_SN_LDSB0_AFC1_AFEM1_AFEM1_ASEM1_CLR0_CADS0_DTLA0_DTLB0_DTVA0_DTVB0_EPS0_FDSI0_GRPM1_GRVWA2_GRVWB8_GSU0_GSUAMB_GSUC0_GSUWGMRR0_GLS0_ISA950_IU1_K1_LBSPPA1024_LBSPPB1024_LBSPPM0_LPA16_LPB16_LPM0_LRVW8_LWPMn1_MIAV0_MIWT4_1_MO40_NTn1_NTA0_NTB2_NTC7_NTD5_NTM0_NEPBS16_NLCA1_NLCB1_ONLL1_PGR2_PLR1_PKA1_SIA3_SS1_SU0_SUM0_SUS0_SPO0_SRVW0_SSO0_SVW4_SK3_SKXCCM4_TLDS1_ULSGRO0_USL1_UIOFGRO0_USFGRO0_VSn1_VWA4_VWB1_WSGRA0_WSGRB0_WS64_WG16_16_1_WGM0_WGMXCC1_WGMXCCGn1
    SolutionIndex: 15
    SolutionNameMin: Cijk_Alik_Bjlk_BBS_BH_Bias_HA_S_SAV_UserArgs_MT128x64x128_MI32x32x1_CMS_SN_LDSB0_AFC1_AFEM1_AFEM1_ASEM1_CLR0_CADS0_DTLA0_DTLB0_DTVA0_DTVB0_EPS0_FDSI0_GRPM1_GRVWA8_GRVWB8_GSU0_GSUAMB_GSUC0_GSUWGMRR0_GLS0_ISA950_IU1_K1_LBSPPA512_LBSPPB0_LBSPPM0_LPA8_LPB0_LPM0_LRVW8_LWPMn1_MIAV0_MIWT2_1_MO40_NTn1_NTA2_NTB0_NTC1_NTD1_NTM0_NEPBS0_NLCA1_NLCB1_ONLL1_PGR2_PLR1_PKA1_SIA3_SS1_SU8_SUM0_SUS256_SPO1_SRVW0_SSO0_SVW2_SK3_SKXCCM8_TLDS1_ULSGRO0_USL1_UIOFGRO0_USFGRO1_VSn1_VWA2_VWB1_WSGRA0_WSGRB0_WS64_WG64_4_1_WGM0_WGMXCC2_WGMXCCGn1
    SolutionIndex: 16
    SolutionNameMin: Cijk_Alik_Bjlk_BBS_BH_Bias_HA_S_SAV_UserArgs_MT32x64x256_MI16x16x1_SN_LDSB0_AFC1_AFEM1_AFEM1_ASEM1_CLR0_CADS0_DTLA0_DTLB0_DTVA0_DTVB0_EPS0_FDSI0_GRPM1_GRVWA8_GRVWB8_GSU0_GSUAMB_GSUC0_GSUWGMRR0_GLS0_ISA950_IU1_K1_LBSPPA1024_LBSPPB1024_LBSPPM0_LPA16_LPB16_LPM0_LRVW8_LWPMn1_MIAV0_MIWT2_1_MO40_NTn1_NTA0_NTB1_NTC0_NTD1_NTM0_NEPBS10_NLCA1_NLCB1_ONLL1_PGR2_PLR1_PKA1_SIA3_SS1_SU0_SUM0_SUS0_SPO0_SRVW0_SSO1_SVW2_SK3_SKXCCM4_TLDS1_ULSGRO0_USL1_UIOFGRO0_USFGROn1_VSn1_VWA2_VWB1_WSGRA0_WSGRB0_WS64_WG16_16_1_WGM0_WGMXCC1_WGMXCCGn1
    SolutionIndex: 17
    SolutionNameMin: Cijk_Alik_Bjlk_BBS_BH_Bias_HA_S_SAV_UserArgs_MT96x32x128_MI16x16x1_SN_LDSB0_AFC1_AFEM1_AFEM1_ASEM1_CLR0_CADS0_DTLA0_DTLB0_DTVA0_DTVB0_EPS0_FDSI0_GRPM1_GRVWA8_GRVWB8_GSU0_GSUAMB_GSUC0_GSUWGMRR0_GLS0_ISA950_IU1_K1_LBSPPA256_LBSPPB512_LBSPPM0_LPA16_LPB16_LPM0_LRVW8_LWPMn1_MIAV0_MIWT3_1_MO40_NTn1_NTA0_NTB3_NTC1_NTD0_NTM0_NEPBS14_NLCA1_NLCB1_ONLL1_PGR2_PLR1_PKA1_SIA3_SS1_SU8_SUM0_SUS512_SPO1_SRVW0_SSO1_SVW1_SK3_SKXCCM4_TLDS1_ULSGRO0_USL1_UIOFGRO0_USFGRO1_VSn1_VWA1_VWB1_WSGRA0_WSGRB0_WS64_WG32_8_1_WGM0_WGMXCC1_WGMXCCGn1
    SolutionIndex: 18
    SolutionNameMin: Cijk_Alik_Bjlk_BBS_BH_Bias_HA_S_SAV_UserArgs_MT64x64x128_MI16x16x1_SN_LDSB0_AFC1_AFEM1_AFEM1_ASEM1_CLR0_CADS0_DTLA0_DTLB0_DTVA0_DTVB0_EPS0_FDSI0_GRPM1_GRVWA8_GRVWB8_GSU0_GSUAMB_GSUC0_GSUWGMRR0_GLS0_ISA950_IU1_K1_LBSPPA512_LBSPPB1024_LBSPPM0_LPA16_LPB16_LPM0_LRVW8_LWPMn1_MIAV0_MIWT2_2_MO40_NTn1_NTA3_NTB0_NTC0_NTD5_NTM0_NEPBS0_NLCA1_NLCB1_ONLL1_PGR2_PLR1_PKA1_SIA3_SS1_SU0_SUM0_SUS0_SPO0_SRVW0_SSO0_SVW2_SK3_SKXCCM0_TLDS1_ULSGRO0_USL1_UIOFGRO0_USFGRO1_VSn1_VWA2_VWB1_WSGRA0_WSGRB0_WS64_WG32_8_1_WGM0_WGMXCC4_WGMXCCGn1
    SolutionIndex: 19
    SolutionNameMin: Cijk_Alik_Bjlk_BBS_BH_Bias_HA_S_SAV_UserArgs_MT64x64x128_MI16x16x1_SN_LDSB0_AFC1_AFEM1_AFEM1_ASEM1_CLR0_CADS0_DTLA0_DTLB0_DTVA0_DTVB0_EPS0_FDSI0_GRPM1_GRVWA8_GRVWB8_GSU0_GSUAMB_GSUC0_GSUWGMRR0_GLS0_ISA950_IU1_K1_LBSPPA512_LBSPPB1024_LBSPPM0_LPA16_LPB16_LPM0_LRVW8_LWPMn1_MIAV0_MIWT2_2_MO40_NTn1_NTA0_NTB1_NTC5_NTD5_NTM0_NEPBS16_NLCA1_NLCB1_ONLL1_PGR2_PLR1_PKA1_SIA3_SS1_SU0_SUM0_SUS0_SPO0_SRVW0_SSO1_SVW2_SK3_SKXCCM4_TLDS1_ULSGRO0_USL1_UIOFGRO0_USFGRO0_VSn1_VWA2_VWB1_WSGRA0_WSGRB0_WS64_WG32_8_1_WGM0_WGMXCC1_WGMXCCGn1
    SolutionIndex: 20
    SolutionNameMin: Cijk_Alik_Bjlk_BBS_BH_Bias_HA_S_SAV_UserArgs_MT96x64x128_MI16x16x1_SN_LDSB0_AFC1_AFEM1_AFEM1_ASEM1_CLR0_CADS0_DTLA0_DTLB0_DTVA0_DTVB0_EPS0_FDSI0_GRPM1_GRVWA8_GRVWB8_GSU0_GSUAMB_GSUC0_GSUWGMRR0_GLS0_ISA950_IU1_K1_LBSPPA256_LBSPPB1024_LBSPPM0_LPA16_LPB16_LPM0_LRVW8_LWPMn1_MIAV0_MIWT3_2_MO40_NTn1_NTA2_NTB0_NTC1_NTD0_NTM0_NEPBS0_NLCA1_NLCB1_ONLL1_PGR2_PLR1_PKA1_SIA3_SS1_SU0_SUM0_SUS0_SPO0_SRVW0_SSO1_SVW1_SK3_SKXCCM4_TLDS1_ULSGRO0_USL1_UIOFGRO0_USFGROn1_VSn1_VWA1_VWB1_WSGRA0_WSGRB0_WS64_WG32_8_1_WGM48_WGMXCC1_WGMXCCGn1
    SolutionIndex: 21
    SolutionNameMin: Cijk_Alik_Bjlk_BBS_BH_Bias_HA_S_SAV_UserArgs_MT48x64x256_MI16x16x1_SN_LDSB0_AFC1_AFEM1_AFEM1_ASEM1_CLR0_CADS0_DTLA0_DTLB0_DTVA0_DTVB0_EPS0_FDSI0_GRPM1_GRVWA8_GRVWB8_GSU0_GSUAMB_GSUC0_GSUWGMRR0_GLS0_ISA950_IU1_K1_LBSPPA512_LBSPPB1024_LBSPPM0_LPA16_LPB16_LPM0_LRVW8_LWPMn1_MIAV1_MIWT3_1_MO40_NTn1_NTA3_NTB1_NTC1_NTD0_NTM0_NEPBS16_NLCA1_NLCB1_ONLL1_PGR2_PLR1_PKA1_SIA3_SS1_SU8_SUM0_SUS512_SPO0_SRVW0_SSO0_SVW1_SK3_SKXCCM6_TLDS1_ULSGRO0_USL1_UIOFGRO0_USFGRO1_VSn1_VWA1_VWB1_WSGRA0_WSGRB0_WS64_WG16_16_1_WGM0_WGMXCC4_WGMXCCGn1
    SolutionIndex: 22
    SolutionNameMin: Cijk_Alik_Bjlk_BBS_BH_Bias_HA_S_SAV_UserArgs_MT64x64x128_MI32x32x1_SN_LDSB0_AFC1_AFEM1_AFEM1_ASEM1_CLR0_CADS0_DTLA0_DTLB0_DTVA0_DTVB0_EPS0_FDSI0_GRPM1_GRVWA8_GRVWB8_GSU0_GSUAMB_GSUC0_GSUWGMRR0_GLS0_ISA950_IU1_K1_LBSPPA256_LBSPPB0_LBSPPM0_LPA8_LPB0_LPM0_LRVW8_LWPMn1_MIAV0_MIWT1_1_MO40_NTn1_NTA3_NTB1_NTC1_NTD0_NTM0_NEPBS0_NLCA1_NLCB1_ONLL1_PGR2_PLR1_PKA1_SIA3_SS1_SU0_SUM0_SUS0_SPO0_SRVW0_SSO0_SVW1_SK3_SKXCCM8_TLDS1_ULSGRO0_USL1_UIOFGRO0_USFGROn1_VSn1_VWA1_VWB1_WSGRA0_WSGRB0_WS64_WG64_4_1_WGM0_WGMXCC4_WGMXCCGn1
    SolutionIndex: 23
    SolutionNameMin: Cijk_Alik_Bjlk_BBS_BH_Bias_HA_S_SAV_UserArgs_MT64x64x256_MI16x16x1_SN_LDSB0_AFC1_AFEM1_AFEM1_ASEM1_CLR0_CADS0_DTLA0_DTLB0_DTVA0_DTVB0_EPS0_FDSI0_GRPM1_GRVWA8_GRVWB8_GSU0_GSUAMB_GSUC0_GSUWGMRR0_GLS0_ISA950_IU1_K1_LBSPPA1024_LBSPPB1024_LBSPPM0_LPA16_LPB16_LPM0_LRVW8_LWPMn1_MIAV1_MIWT2_2_MO40_NTn1_NTA0_NTB1_NTC1_NTD1_NTM0_NEPBS0_NLCA1_NLCB1_ONLL1_PGR2_PLR1_PKA1_SIA3_SS1_SU8_SUM0_SUS512_SPO0_SRVW0_SSO0_SVW2_SK3_SKXCCM4_TLDS1_ULSGRO0_USL1_UIOFGRO0_USFGRO0_VSn1_VWA2_VWB1_WSGRA0_WSGRB0_WS64_WG32_8_1_WGM16_WGMXCC1_WGMXCCGn1
    SolutionIndex: 24
    SolutionNameMin: Cijk_Alik_Bjlk_BBS_BH_Bias_HA_S_SAV_UserArgs_MT80x64x128_MI16x16x1_SN_LDSB0_AFC1_AFEM1_AFEM1_ASEM1_CLR0_CADS0_DTLA0_DTLB0_DTVA0_DTVB0_EPS0_FDSI0_GRPM1_GRVWA8_GRVWB8_GSU0_GSUAMB_GSUC0_GSUWGMRR0_GLS0_ISA950_IU1_K1_LBSPPA256_LBSPPB1024_LBSPPM0_LPA16_LPB16_LPM0_LRVW8_LWPMn1_MIAV1_MIWT5_1_MO40_NTn1_NTA1_NTB0_NTC0_NTD5_NTM0_NEPBS0_NLCA1_NLCB1_ONLL1_PGR2_PLR1_PKA1_SIA3_SS1_SU0_SUM0_SUS0_SPO0_SRVW0_SSO0_SVW1_SK3_SKXCCM6_TLDS1_ULSGRO0_USL1_UIOFGRO0_USFGRO0_VSn1_VWA1_VWB1_WSGRA0_WSGRB0_WS64_WG16_16_1_WGM1_WGMXCC8_WGMXCCGn1
    SolutionIndex: 25
    SolutionNameMin: Cijk_Alik_Bjlk_BBS_BH_Bias_HA_S_SAV_UserArgs_MT128x64x128_MI32x32x1_SN_LDSB0_AFC1_AFEM1_AFEM1_ASEM1_CLR0_CADS0_DTLA0_DTLB0_DTVA0_DTVB0_EPS0_FDSI0_GRPM1_GRVWA8_GRVWB8_GSU0_GSUAMB_GSUC0_GSUWGMRR0_GLS0_ISA950_IU1_K1_LBSPPA512_LBSPPB0_LBSPPM0_LPA8_LPB0_LPM0_LRVW8_LWPMn1_MIAV0_MIWT2_1_MO40_NTn1_NTA1_NTB0_NTC0_NTD1_NTM0_NEPBS0_NLCA1_NLCB1_ONLL1_PGR2_PLR1_PKA1_SIA3_SS1_SU8_SUM0_SUS256_SPO1_SRVW0_SSO0_SVW2_SK3_SKXCCM8_TLDS1_ULSGRO0_USL1_UIOFGRO0_USFGRO0_VSn1_VWA2_VWB1_WSGRA0_WSGRB0_WS64_WG64_4_1_WGM1_WGMXCC8_WGMXCCGn1
    SolutionIndex: 26
    SolutionNameMin: Cijk_Alik_Bjlk_BBS_BH_Bias_HA_S_SAV_UserArgs_MT96x128x128_MI16x16x1_SN_LDSB0_AFC1_AFEM1_AFEM1_ASEM1_CLR0_CADS0_DTLA0_DTLB0_DTVA0_DTVB0_EPS0_FDSI0_GRPM1_GRVWA8_GRVWB8_GSU0_GSUAMB_GSUC0_GSUWGMRR0_GLS0_ISA950_IU1_K1_LBSPPA512_LBSPPB2048_LBSPPM0_LPA16_LPB16_LPM0_LRVW8_LWPMn1_MIAV1_MIWT6_2_MO40_NTn1_NTA3_NTB1_NTC1_NTD4_NTM0_NEPBS0_NLCA1_NLCB1_ONLL1_PGR2_PLR1_PKA1_SIA3_SS1_SU8_SUM0_SUS512_SPO0_SRVW0_SSO0_SVW2_SK3_SKXCCM4_TLDS1_ULSGRO0_USL1_UIOFGRO0_USFGRO1_VSn1_VWA2_VWB1_WSGRA0_WSGRB0_WS64_WG16_16_1_WGM8_WGMXCC2_WGMXCCGn1
    SolutionIndex: 27
    SolutionNameMin: Cijk_Alik_Bjlk_BBS_BH_Bias_HA_S_SAV_UserArgs_MT96x128x128_MI16x16x1_SN_LDSB0_AFC1_AFEM1_AFEM1_ASEM1_CLR0_CADS0_DTLA0_DTLB0_DTVA0_DTVB0_EPS0_FDSI0_GRPM1_GRVWA8_GRVWB8_GSU0_GSUAMB_GSUC0_GSUWGMRR0_GLS0_ISA950_IU1_K1_LBSPPA512_LBSPPB2048_LBSPPM0_LPA16_LPB16_LPM0_LRVW8_LWPMn1_MIAV0_MIWT6_2_MO40_NTn1_NTA2_NTB3_NTC1_NTD5_NTM0_NEPBS0_NLCA1_NLCB1_ONLL1_PGR2_PLR1_PKA1_SIA3_SS1_SU0_SUM0_SUS0_SPO0_SRVW0_SSO0_SVW2_SK3_SKXCCM8_TLDS1_ULSGRO0_USL1_UIOFGRO0_USFGRO0_VSn1_VWA2_VWB1_WSGRA0_WSGRB0_WS64_WG16_16_1_WGM4_WGMXCC1_WGMXCCGn1
    SolutionIndex: 28
    SolutionNameMin: Cijk_Alik_Bjlk_BBS_BH_Bias_HA_S_SAV_UserArgs_MT96x96x128_MI16x16x1_SN_LDSB0_AFC1_AFEM1_AFEM1_ASEM1_CLR0_CADS0_DTLA0_DTLB0_DTVA0_DTVB0_EPS0_FDSI0_GRPM1_GRVWA8_GRVWB8_GSU0_GSUAMB_GSUC0_GSUWGMRR0_GLS0_ISA950_IU1_K1_LBSPPA256_LBSPPB1536_LBSPPM0_LPA16_LPB16_LPM0_LRVW8_LWPMn1_MIAV0_MIWT3_3_MO40_NTn1_NTA3_NTB1_NTC0_NTD5_NTM0_NEPBS0_NLCA1_NLCB3_ONLL1_PGR2_PLR1_PKA1_SIA3_SS1_SU8_SUM0_SUS256_SPO1_SRVW0_SSO1_SVW1_SK3_SKXCCM4_TLDS1_ULSGRO0_USL1_UIOFGRO0_USFGROn1_VSn1_VWA1_VWB1_WSGRA0_WSGRB0_WS64_WG32_8_1_WGM1_WGMXCC1_WGMXCCGn1
    SolutionIndex: 29
    SolutionNameMin: Cijk_Alik_Bjlk_BBS_BH_Bias_HA_S_SAV_UserArgs_MT80x128x128_MI16x16x1_SN_LDSB0_AFC1_AFEM1_AFEM1_ASEM1_CLR0_CADS0_DTLA0_DTLB0_DTVA0_DTVB0_EPS0_FDSI0_GRPM1_GRVWA8_GRVWB8_GSU0_GSUAMB_GSUC0_GSUWGMRR0_GLS0_ISA950_IU1_K1_LBSPPA256_LBSPPB2048_LBSPPM0_LPA16_LPB16_LPM0_LRVW8_LWPMn1_MIAV0_MIWT5_2_MO40_NTn1_NTA0_NTB0_NTC1_NTD5_NTM0_NEPBS0_NLCA1_NLCB1_ONLL1_PGR2_PLR1_PKA1_SIA3_SS1_SU16_SUM0_SUS512_SPO1_SRVW0_SSO1_SVW1_SK3_SKXCCM4_TLDS1_ULSGRO0_USL1_UIOFGRO0_USFGRO1_VSn1_VWA1_VWB1_WSGRA0_WSGRB0_WS64_WG16_16_1_WGM32_WGMXCC1_WGMXCCGn1
    SolutionIndex: 30
    SolutionNameMin: Cijk_Alik_Bjlk_BBS_BH_Bias_HA_S_SAV_UserArgs_MT128x64x128_MI16x16x1_CMS_SN_LDSB0_AFC1_AFEM1_AFEM1_ASEM1_CLR0_CADS0_DTLA0_DTLB0_DTVA0_DTVB0_EPS0_FDSI0_GRPM1_GRVWA8_GRVWB8_GSU0_GSUAMB_GSUC0_GSUWGMRR0_GLS0_ISA950_IU1_K1_LBSPPA1024_LBSPPB1024_LBSPPM0_LPA16_LPB16_LPM0_LRVW8_LWPMn1_MIAV0_MIWT4_2_MO40_NTn1_NTA0_NTB2_NTC7_NTD6_NTM0_NEPBS8_NLCA1_NLCB1_ONLL1_PGR2_PLR1_PKA1_SIA3_SS1_SU16_SUM0_SUS256_SPO1_SRVW0_SSO0_SVW4_SK3_SKXCCM0_TLDS1_ULSGRO0_USL1_UIOFGRO0_USFGRO1_VSn1_VWA4_VWB1_WSGRA0_WSGRB0_WS64_WG32_8_1_WGM1_WGMXCC4_WGMXCCGn1
    SolutionIndex: 31
    SolutionNameMin: Cijk_Alik_Bjlk_BBS_BH_Bias_HA_S_SAV_UserArgs_MT256x256x32_MI32x32x1_SN_LDSB0_AFC1_AFEM1_AFEM1_ASEM1_CLR0_CADS0_DTLA0_DTLB0_DTVA0_DTVB0_EPS0_FDSI0_GRPM1_GRVWA8_GRVWB8_GSU1_GSUAMB_GSUC0_GSUWGMRR0_GLS0_ISA950_IU1_K1_LBSPPA512_LBSPPB0_LBSPPM0_LPA8_LPB0_LPM0_LRVW8_LWPMn1_MIAV0_MIWT8_2_MO40_NTn1_NTA1_NTB3_NTC5_NTD5_NTM0_NEPBS16_NLCA1_NLCB1_ONLL1_PGR2_PLR1_PKA1_SIA3_SS1_SU8_SUM0_SUS64_SPO1_SRVW0_SSO1_SVW8_SK0_SKXCCM0_TLDS1_ULSGRO0_USL1_UIOFGRO0_USFGROn1_VSn1_VWA8_VWB1_WSGRA0_WSGRB0_WS64_WG32_8_1_WGM2_WGMXCC32_WGMXCCGn1
    SolutionIndex: 32
    SolutionNameMin: Cijk_Alik_Bjlk_BBS_BH_Bias_HA_S_SAV_UserArgs_MT256x256x32_MI32x32x1_SN_LDSB0_AFC1_AFEM1_AFEM1_ASEM1_CLR0_CADS0_DTLA0_DTLB0_DTVA0_DTVB0_EPS0_FDSI0_GRPM1_GRVWA8_GRVWB8_GSU1_GSUAMB_GSUC0_GSUWGMRR0_GLS0_ISA950_IU1_K1_LBSPPA512_LBSPPB0_LBSPPM0_LPA8_LPB0_LPM0_LRVW8_LWPMn1_MIAV0_MIWT8_2_MO40_NTn1_NTA0_NTB1_NTC5_NTD4_NTM0_NEPBS16_NLCA1_NLCB1_ONLL1_PGR2_PLR1_PKA1_SIA3_SS1_SU0_SUM0_SUS0_SPO1_SRVW0_SSO1_SVW8_SK0_SKXCCM0_TLDS1_ULSGRO0_USL1_UIOFGRO0_USFGROn1_VSn1_VWA8_VWB1_WSGRA0_WSGRB0_WS64_WG32_8_1_WGM48_WGMXCC16_WGMXCCGn1
    SolutionIndex: 33
    SolutionNameMin: Cijk_Alik_Bjlk_BBS_BH_Bias_HA_S_SAV_UserArgs_MT224x128x64_MI16x16x1_CMS_SN_LDSB0_AFC1_AFEM1_AFEM1_ASEM1_CLR1_CADS0_DTLA1_DTLB1_DTVA0_DTVB0_EPS0_FDSI0_GRPM1_GRVWA2_GRVWB8_GSU0_GSUAMB_GSUC0_GSUWGMRR0_GLS0_ISA950_IU1_K1_LBSPPA256_LBSPPB2048_LBSPPM0_LPA16_LPB0_LPM0_LRVW8_LWPMn1_MIAV0_MIWT14_2_MO40_NTn1_NTA1_NTB0_NTC1_NTD4_NTM0_NEPBS0_NLCA1_NLCB1_ONLL1_PGR2_PLR1_PKA1_SIA3_SS1_SU16_SUM0_SUS128_SPO0_SRVW0_SSO1_SVW2_SK3_SKXCCM8_TLDS1_ULSGRO0_USL1_UIOFGRO0_USFGROn1_VSn1_VWA2_VWB2_WSGRA0_WSGRB0_WS64_WG16_16_1_WGM0_WGMXCC1_WGMXCCGn1
    SolutionIndex: 34
    SolutionNameMin: Cijk_Alik_Bjlk_BBS_BH_Bias_HA_S_SAV_UserArgs_MT256x128x64_MI16x16x1_CMS_SN_LDSB0_AFC1_AFEM1_AFEM1_ASEM1_CLR1_CADS0_DTLA1_DTLB1_DTVA0_DTVB0_EPS0_FDSI0_GRPM1_GRVWA8_GRVWB8_GSU0_GSUAMB_GSUC0_GSUWGMRR0_GLS0_ISA950_IU1_K1_LBSPPA1024_LBSPPB2048_LBSPPM0_LPA16_LPB0_LPM0_LRVW8_LWPMn1_MIAV0_MIWT8_4_MO40_NTn1_NTA6_NTB1_NTC2_NTD4_NTM0_NEPBS0_NLCA1_NLCB1_ONLL1_PGR2_PLR1_PKA1_SIA3_SS1_SU8_SUM0_SUS256_SPO0_SRVW0_SSO1_SVW8_SK3_SKXCCM0_TLDS1_ULSGRO0_USL1_UIOFGRO0_USFGROn1_VSn1_VWA8_VWB4_WSGRA0_WSGRB0_WS64_WG32_8_1_WGM0_WGMXCC16_WGMXCCGn1
    SolutionIndex: 35
    SolutionNameMin: Cijk_Alik_Bjlk_BBS_BH_Bias_HA_S_SAV_UserArgs_MT32x64x128_MI16x16x1_CMS_SN_LDSB0_AFC1_AFEM1_AFEM1_ASEM1_CLR0_CADS0_DTLA1_DTLB1_DTVA0_DTVB0_EPS0_FDSI0_GRPM1_GRVWA8_GRVWB8_GSU0_GSUAMB_GSUC0_GSUWGMRR0_GLS0_ISA950_IU1_K1_LBSPPA1024_LBSPPB1024_LBSPPM0_LPA16_LPB0_LPM0_LRVW8_LWPMn1_MIAV0_MIWT2_1_MO40_NTn1_NTA5_NTB2_NTC2_NTD6_NTM0_NEPBS16_NLCA1_NLCB1_ONLL1_PGR2_PLR1_PKA1_SIA3_SS1_SU0_SUM0_SUS0_SPO1_SRVW0_SSO0_SVW2_SK3_SKXCCM4_TLDS1_ULSGRO0_USL1_UIOFGRO0_USFGRO1_VSn1_VWA2_VWB1_WSGRA0_WSGRB0_WS64_WG16_16_1_WGM1_WGMXCC8_WGMXCCGn1
    SolutionIndex: 36
    SolutionNameMin: Cijk_Alik_Bjlk_BBS_BH_Bias_HA_S_SAV_UserArgs_MT32x64x256_MI16x16x1_CMS_SN_LDSB0_AFC1_AFEM1_AFEM1_ASEM1_CLR0_CADS0_DTLA1_DTLB1_DTVA0_DTVB0_EPS0_FDSI0_GRPM1_GRVWA8_GRVWB8_GSU0_GSUAMB_GSUC0_GSUWGMRR0_GLS0_ISA950_IU1_K1_LBSPPA1024_LBSPPB1024_LBSPPM0_LPA16_LPB0_LPM0_LRVW8_LWPMn1_MIAV1_MIWT2_1_MO40_NTn1_NTA7_NTB3_NTC1_NTD7_NTM0_NEPBS8_NLCA1_NLCB1_ONLL1_PGR2_PLR1_PKA1_SIA3_SS1_SU8_SUM0_SUS512_SPO0_SRVW0_SSO0_SVW2_SK3_SKXCCM0_TLDS1_ULSGRO0_USL1_UIOFGRO0_USFGROn1_VSn1_VWA2_VWB1_WSGRA0_WSGRB0_WS64_WG16_16_1_WGM1_WGMXCC8_WGMXCCGn1
    SolutionIndex: 37
    SolutionNameMin: Cijk_Alik_Bjlk_BBS_BH_Bias_HA_S_SAV_UserArgs_MT256x256x64_MI16x16x1_CMS_SN_LDSB0_AFC1_AFEM1_AFEM1_ASEM1_CLR1_CADS0_DTLA1_DTLB1_DTVA0_DTVB0_EPS0_FDSI0_GRPM1_GRVWA8_GRVWB8_GSU0_GSUAMB_GSUC0_GSUWGMRR0_GLS0_ISA950_IU1_K1_LBSPPA1024_LBSPPB4096_LBSPPM0_LPA16_LPB0_LPM0_LRVW8_LWPMn1_MIAV0_MIWT8_8_MO40_NTn1_NTA2_NTB2_NTC6_NTD3_NTM0_NEPBS16_NLCA1_NLCB1_ONLL1_PGR2_PLR1_PKA1_SIA3_SS1_SU16_SUM0_SUS512_SPO1_SRVW0_SSO1_SVW8_SK3_SKXCCM4_TLDS1_ULSGRO0_USL1_UIOFGRO0_USFGRO0_VSn1_VWA8_VWB8_WSGRA0_WSGRB0_WS64_WG32_8_1_WGM8_WGMXCC1_WGMXCCGn1
    SolutionIndex: 38
    SolutionNameMin: Cijk_Alik_Bjlk_BBS_BH_Bias_HA_S_SAV_UserArgs_MT128x256x32_MI32x32x1_CMS_SN_LDSB0_AFC1_AFEM1_AFEM1_ASEM1_CLR1_CADS0_DTLA1_DTLB1_DTVA0_DTVB0_EPS0_FDSI0_GRPM1_GRVWA8_GRVWB8_GSU0_GSUAMB_GSUC0_GSUWGMRR0_GLS0_ISA950_IU1_K1_LBSPPA1024_LBSPPB0_LBSPPM0_LPA8_LPB0_LPM0_LRVW8_LWPMn1_MIAV0_MIWT2_4_MO40_NTn1_NTA0_NTB2_NTC7_NTD7_NTM0_NEPBS0_NLCA1_NLCB1_ONLL1_PGR2_PLR1_PKA1_SIA3_SS1_SU16_SUM0_SUS64_SPO0_SRVW0_SSO1_SVW2_SK3_SKXCCM0_TLDS1_ULSGRO0_USL1_UIOFGRO0_USFGRO0_VSn1_VWA2_VWB4_WSGRA0_WSGRB0_WS64_WG64_4_1_WGM1_WGMXCC4_WGMXCCGn1
- - - [1024, 1792, 1, 2895]
    - [0, 0.0]
  - - [2895, 1024, 1, 1792]
    - [1, 0.0]
  - - [72, 120, 3072, 7]
    - [2, 0.0]
  - - [10, 120, 3072, 40]
    - [3, 0.0]
  - - [40, 10, 3072, 120]
    - [4, 0.0]
  - - [1280, 1562, 1, 512]
    - [5, 0.0]
  - - [1562, 2048, 1, 1280]
    - [6, 0.0]
  - - [2048, 1280, 1, 1562]
    - [7, 0.0]
  - - [512, 1792, 1, 2895]
    - [8, 0.0]
  - - [1792, 2895, 1, 512]
    - [9, 0.0]
  - - [1792, 2895, 1, 2048]
    - [10, 0.0]
  - - [2048, 1792, 1, 2895]
    - [11, 0.0]
  - - [2895, 512, 1, 1792]
    - [12, 0.0]
  - - [2895, 2048, 1, 1792]
    - [13, 0.0]
  - - [1024, 1024, 1, 1562]
    - [14, 0.0]
  - - [1562, 1024, 1, 1024]
    - [15, 0.0]
  - - [384, 1280, 1, 1562]
    - [16, 0.0]
  - - [512, 1280, 1, 1562]
    - [17, 0.0]
  - - [640, 1280, 1, 1562]
    - [18, 0.0]
  - - [768, 1280, 1, 1562]
    - [19, 0.0]
  - - [1024, 1280, 1, 1562]
    - [20, 0.0]
  - - [1562, 384, 1, 1280]
    - [21, 0.0]
  - - [1562, 512, 1, 1280]
    - [22, 0.0]
  - - [1562, 640, 1, 1280]
    - [23, 0.0]
  - - [1562, 768, 1, 1280]
    - [24, 0.0]
  - - [1562, 1024, 1, 1280]
    - [25, 0.0]
  - - [1562, 1664, 1, 1280]
    - [26, 0.0]
  - - [1562, 1920, 1, 1280]
    - [27, 0.0]
  - - [1664, 1280, 1, 1562]
    - [28, 0.0]
  - - [1920, 1280, 1, 1562]
    - [29, 0.0]
  - - [1280, 1562, 1, 2048]
    - [30, 429260.0]
  - - [114688, 1024, 1, 128]
    - [31, 0.0]
  - - [114688, 1536, 1, 192]
    - [32, 0.0]
  - - [1024, 128, 48, 1360]
    - [33, 0.0]
  - - [1024, 128, 48, 1024]
    - [34, 0.0]
  - - [256, 64, 64, 256]
    - [35, 0.0]
  - - [1024, 64, 6, 1024]
    - [36, 0.0]
  - - [512, 65536, 1, 512]
    - [37, 0.0]
  - - [3840, 3840, 1, 256]
    - [38, 0.0]
- null
- null
- DeviceEfficiency
- Equality
