projects/hipblaslt/library/src/amd_detail/rocblaslt/src/Tensile/Logic/asm_full/gfx950/Equality/gfx950_Cijk_Alik_Bljk_BBS_BH_Bias_HAS_SAV_UserArgs.yaml
- {MinimumRequiredVersion: 5.0.0}
- gfx950
- gfx950
- [Device 75a0]
    SolutionIndex: 0
    SolutionNameMin: Cijk_Alik_Bljk_BBS_BH_Bias_HA_S_SAV_UserArgs_MT16x16x256_MI16x16x1_SN_LDSB0_AFC1_AFEM1_AFEM1_ASEM1_CLR1_CADS0_DTLA1_DTLB1_DTVA0_DTVB0_EPS0_FDSI0_GRPM1_GRVWA8_GRVWB8_GSU1_GSUAMB_GSUC0_GSUWGMRR0_GLS0_ISA950_IU1_K1_LBSPPA1024_LBSPPB1024_LBSPPM0_LPA16_LPB16_LPM0_LRVW8_LWPMn1_MIAV1_MIWT1_1_MO40_NTn1_NTA4_NTB0_NTC2_NTD2_NTM0_NEPBS16_NLCA1_NLCB1_ONLL1_PGR2_PLR1_PKA1_SIA3_SS1_SU8_SUM0_SUS512_SPO1_SRVW0_SSO0_SVW1_SK0_SKXCCM0_TLDS1_ULSGRO0_USL1_UIOFGRO0_USFGRO1_VSn1_VWA1_VWB1_WSGRA0_WSGRB0_WS64_WG16_4_4_WGM0_WGMXCC1_WGMXCCGn1
    SolutionIndex: 1
    SolutionNameMin: Cijk_Alik_Bljk_BBS_BH_Bias_HA_S_SAV_UserArgs_MT256x224x64_MI16x16x1_SN_LDSB0_AFC1_AFEM1_AFEM1_ASEM1_CLR0_CADS0_DTLA1_DTLB1_DTVA0_DTVB0_EPS0_FDSI0_GRPM1_GRVWA8_GRVWB8_GSU1_GSUAMB_GSUC0_GSUWGMRR0_GLS0_ISA950_IU1_K1_LBSPPA1024_LBSPPB1024_LBSPPM0_LPA16_LPB16_LPM0_LRVW8_LWPMn1_MIAV0_MIWT8_7_MO40_NTn1_NTA0_NTB3_NTC4_NTD4_NTM0_NEPBS14_NLCA1_NLCB1_ONLL1_PGR2_PLR1_PKA1_SIA3_SS1_SU8_SUM0_SUS128_SPO0_SRVW0_SSO4_SVW8_SK0_SKXCCM0_TLDS1_ULSGRO0_USL1_UIOFGRO0_USFGROn1_VSn1_VWA8_VWB1_WSGRA0_WSGRB0_WS64_WG32_8_1_WGM0_WGMXCC2_WGMXCCGn1
    SolutionIndex: 2
    SolutionNameMin: Cijk_Alik_Bljk_BBS_BH_Bias_HA_S_SAV_UserArgs_MT16x16x256_MI16x16x1_SN_LDSB0_AFC1_AFEM1_AFEM1_ASEM1_CLR0_CADS0_DTLA1_DTLB1_DTVA0_DTVB0_EPS0_FDSI0_GRPM1_GRVWA8_GRVWB8_GSU1_GSUAMB_GSUC0_GSUWGMRR0_GLS0_ISA950_IU1_K1_LBSPPA1024_LBSPPB1024_LBSPPM0_LPA16_LPB16_LPM0_LRVW8_LWPMn1_MIAV0_MIWT1_1_MO40_NTn1_NTA4_NTB1_NTC2_NTD2_NTM0_NEPBS10_NLCA1_NLCB1_ONLL1_PGR2_PLR1_PKA1_SIA3_SS1_SU8_SUM0_SUS512_SPO0_SRVW0_SSO0_SVW1_SK0_SKXCCM0_TLDS1_ULSGRO0_USL1_UIOFGRO0_USFGRO1_VSn1_VWA1_VWB1_WSGRA0_WSGRB0_WS64_WG16_4_4_WGM1_WGMXCC1_WGMXCCGn1
    SolutionIndex: 3
    SolutionNameMin: Cijk_Alik_Bljk_BBS_BH_Bias_HA_S_SAV_UserArgs_MT192x256x64_MI16x16x1_SN_LDSB0_AFC1_AFEM1_AFEM1_ASEM1_CLR0_CADS0_DTLA1_DTLB1_DTVA0_DTVB0_EPS0_FDSI0_GRPM1_GRVWA2_GRVWB8_GSU1_GSUAMB_GSUC0_GSUWGMRR0_GLS0_ISA950_IU1_K1_LBSPPA512_LBSPPB1024_LBSPPM0_LPA16_LPB16_LPM0_LRVW8_LWPMn1_MIAV0_MIWT12_4_MO40_NTn1_NTA3_NTB1_NTC6_NTD3_NTM0_NEPBS0_NLCA1_NLCB1_ONLL1_PGR2_PLR1_PKA1_SIA3_SS1_SU8_SUM0_SUS128_SPO1_SRVW0_SSO4_SVW4_SK0_SKXCCM0_TLDS2_ULSGRO0_USL1_UIOFGRO0_USFGRO0_VSn1_VWA4_VWB4_WSGRA0_WSGRB0_WS64_WG16_16_1_WGM16_WGMXCC4_WGMXCCGn1
    SolutionIndex: 4
    SolutionNameMin: Cijk_Alik_Bljk_BBS_BH_Bias_HA_S_SAV_UserArgs_MT16x16x256_MI16x16x1_SN_LDSB0_AFC1_AFEM1_AFEM1_ASEM1_CLR1_CADS0_DTLA1_DTLB1_DTVA0_DTVB0_EPS0_FDSI0_GRPM1_GRVWA8_GRVWB8_GSU1_GSUAMB_GSUC0_GSUWGMRR0_GLS0_ISA950_IU1_K1_LBSPPA1024_LBSPPB1024_LBSPPM0_LPA16_LPB16_LPM0_LRVW8_LWPMn1_MIAV0_MIWT1_1_MO40_NTn1_NTA4_NTB1_NTC3_NTD3_NTM0_NEPBS2_NLCA1_NLCB1_ONLL1_PGR2_PLR1_PKA1_SIA3_SS1_SU8_SUM0_SUS512_SPO0_SRVW0_SSO0_SVW1_SK0_SKXCCM0_TLDS1_ULSGRO0_USL1_UIOFGRO0_USFGRO1_VSn1_VWA1_VWB1_WSGRA0_WSGRB0_WS64_WG16_4_4_WGM0_WGMXCC1_WGMXCCGn1
    SolutionIndex: 5
    SolutionNameMin: Cijk_Alik_Bljk_BBS_BH_Bias_HA_S_SAV_UserArgs_MT192x256x64_MI16x16x1_SN_LDSB1_AFC1_AFEM1_AFEM1_ASEM1_CLR1_CADS0_DTLA0_DTLB0_DTVA0_DTVB0_EPS0_FDSI0_GRPM1_GRVWA8_GRVWB8_GSU1_GSUAMB_GSUC0_GSUWGMRR0_GLS0_ISA950_IU1_K1_LBSPPA512_LBSPPB512_LBSPPM0_LPA16_LPB16_LPM0_LRVW8_LWPMn1_MIAV0_MIWT12_4_MO40_NTn1_NTA1_NTB1_NTC4_NTD7_NTM0_NEPBS0_NLCA1_NLCB1_ONLL1_PGR2_PLR1_PKA1_SIA3_SS1_SU0_SUM0_SUS0_SPO0_SRVW0_SSO1_SVW4_SK0_SKXCCM0_TLDS2_ULSGRO0_USL1_UIOFGRO0_USFGRO1_VSn1_VWA4_VWB4_WSGRA0_WSGRB0_WS64_WG16_16_1_WGM0_WGMXCC8_WGMXCCGn1
    SolutionIndex: 6
    SolutionNameMin: Cijk_Alik_Bljk_BBS_BH_Bias_HA_S_SAV_UserArgs_MT16x16x256_MI16x16x1_SN_LDSB0_AFC1_AFEM1_AFEM1_ASEM1_CLR0_CADS0_DTLA1_DTLB1_DTVA0_DTVB0_EPS0_FDSI0_GRPM1_GRVWA8_GRVWB8_GSU1_GSUAMB_GSUC0_GSUWGMRR0_GLS0_ISA950_IU1_K1_LBSPPA1024_LBSPPB1024_LBSPPM0_LPA16_LPB16_LPM0_LRVW8_LWPMn1_MIAV0_MIWT1_1_MO40_NTn1_NTA0_NTB1_NTC2_NTD0_NTM0_NEPBS2_NLCA1_NLCB1_ONLL1_PGR2_PLR1_PKA1_SIA3_SS1_SU8_SUM0_SUS512_SPO0_SRVW0_SSO0_SVW1_SK0_SKXCCM0_TLDS1_ULSGRO0_USL1_UIOFGRO0_USFGRO1_VSn1_VWA1_VWB1_WSGRA0_WSGRB0_WS64_WG16_4_4_WGM1_WGMXCC16_WGMXCCGn1
    SolutionIndex: 7
    SolutionNameMin: Cijk_Alik_Bljk_BBS_BH_Bias_HA_S_SAV_UserArgs_MT160x128x64_MI16x16x1_SN_LDSB1_AFC1_AFEM1_AFEM1_ASEM1_CLR0_CADS0_DTLA0_DTLB0_DTVA0_DTVB0_EPS0_FDSI0_GRPM1_GRVWA8_GRVWB8_GSU1_GSUAMB_GSUC0_GSUWGMRR0_GLS0_ISA950_IU1_K1_LBSPPA256_LBSPPB256_LBSPPM0_LPA16_LPB16_LPM0_LRVW8_LWPMn1_MIAV0_MIWT10_2_MO40_NTn1_NTA2_NTB7_NTC2_NTD5_NTM0_NEPBS0_NLCA1_NLCB1_ONLL1_PGR2_PLR1_PKA1_SIA3_SS1_SU16_SUM0_SUS128_SPO1_SRVW0_SSO1_SVW2_SK0_SKXCCM0_TLDS2_ULSGRO0_USL1_UIOFGRO0_USFGROn1_VSn1_VWA2_VWB2_WSGRA0_WSGRB0_WS64_WG16_16_1_WGM0_WGMXCC16_WGMXCCGn1
    SolutionIndex: 8
    SolutionNameMin: Cijk_Alik_Bljk_BBS_BH_Bias_HA_S_SAV_UserArgs_MT16x16x256_MI16x16x1_SN_LDSB0_AFC1_AFEM1_AFEM1_ASEM1_CLR1_CADS0_DTLA1_DTLB1_DTVA0_DTVB0_EPS0_FDSI0_GRPM1_GRVWA8_GRVWB8_GSU1_GSUAMB_GSUC0_GSUWGMRR0_GLS0_ISA950_IU1_K1_LBSPPA1024_LBSPPB1024_LBSPPM0_LPA16_LPB16_LPM0_LRVW8_LWPMn1_MIAV1_MIWT1_1_MO40_NTn1_NTA0_NTB0_NTC2_NTD3_NTM0_NEPBS2_NLCA1_NLCB1_ONLL1_PGR2_PLR1_PKA1_SIA3_SS1_SU8_SUM0_SUS512_SPO1_SRVW0_SSO0_SVW1_SK0_SKXCCM0_TLDS1_ULSGRO0_USL1_UIOFGRO0_USFGROn1_VSn1_VWA1_VWB1_WSGRA0_WSGRB0_WS64_WG16_4_4_WGM1_WGMXCC4_WGMXCCGn1
    SolutionIndex: 9
    SolutionNameMin: Cijk_Alik_Bljk_BBS_BH_Bias_HA_S_SAV_UserArgs_MT256x224x64_MI16x16x1_SN_LDSB0_AFC1_AFEM1_AFEM1_ASEM1_CLR0_CADS0_DTLA1_DTLB1_DTVA0_DTVB0_EPS0_FDSI0_GRPM1_GRVWA8_GRVWB8_GSU1_GSUAMB_GSUC0_GSUWGMRR0_GLS0_ISA950_IU1_K1_LBSPPA1024_LBSPPB1024_LBSPPM0_LPA16_LPB16_LPM0_LRVW8_LWPMn1_MIAV0_MIWT8_7_MO40_NTn1_NTA0_NTB0_NTC6_NTD6_NTM0_NEPBS14_NLCA1_NLCB1_ONLL1_PGR2_PLR1_PKA1_SIA3_SS1_SU8_SUM0_SUS128_SPO0_SRVW0_SSO0_SVW8_SK0_SKXCCM0_TLDS2_ULSGRO0_USL1_UIOFGRO0_USFGRO0_VSn1_VWA8_VWB1_WSGRA0_WSGRB0_WS64_WG32_8_1_WGM1_WGMXCC2_WGMXCCGn1
    SolutionIndex: 10
    SolutionNameMin: Cijk_Alik_Bljk_BBS_BH_Bias_HA_S_SAV_UserArgs_MT16x16x256_MI16x16x1_SN_LDSB0_AFC1_AFEM1_AFEM1_ASEM1_CLR0_CADS0_DTLA1_DTLB1_DTVA0_DTVB0_EPS0_FDSI0_GRPM1_GRVWA8_GRVWB8_GSU1_GSUAMB_GSUC0_GSUWGMRR0_GLS0_ISA950_IU1_K1_LBSPPA1024_LBSPPB1024_LBSPPM0_LPA16_LPB16_LPM0_LRVW8_LWPMn1_MIAV0_MIWT1_1_MO40_NTn1_NTA0_NTB1_NTC3_NTD2_NTM0_NEPBS10_NLCA1_NLCB1_ONLL1_PGR2_PLR1_PKA1_SIA3_SS1_SU8_SUM0_SUS512_SPO0_SRVW0_SSO0_SVW1_SK0_SKXCCM0_TLDS1_ULSGRO0_USL1_UIOFGRO0_USFGRO1_VSn1_VWA1_VWB1_WSGRA0_WSGRB0_WS64_WG16_4_4_WGM1_WGMXCC4_WGMXCCGn1
    SolutionIndex: 11
    SolutionNameMin: Cijk_Alik_Bljk_BBS_BH_Bias_HA_S_SAV_UserArgs_MT192x256x64_MI16x16x1_SN_LDSB0_AFC1_AFEM1_AFEM1_ASEM1_CLR1_CADS0_DTLA1_DTLB1_DTVA0_DTVB0_EPS0_FDSI0_GRPM1_GRVWA2_GRVWB8_GSU1_GSUAMB_GSUC0_GSUWGMRR0_GLS0_ISA950_IU1_K1_LBSPPA256_LBSPPB1024_LBSPPM0_LPA16_LPB16_LPM0_LRVW8_LWPMn1_MIAV0_MIWT6_8_MO40_NTn1_NTA1_NTB3_NTC1_NTD7_NTM0_NEPBS0_NLCA1_NLCB1_ONLL1_PGR2_PLR1_PKA1_SIA3_SS1_SU8_SUM0_SUS128_SPO0_SRVW0_SSO1_SVW2_SK0_SKXCCM0_TLDS1_ULSGRO0_USL1_UIOFGRO0_USFGRO0_VSn1_VWA2_VWB8_WSGRA0_WSGRB0_WS64_WG32_8_1_WGM16_WGMXCC4_WGMXCCGn1
    SolutionIndex: 12
    SolutionNameMin: Cijk_Alik_Bljk_BBS_BH_Bias_HA_S_SAV_UserArgs_MT16x16x256_MI16x16x1_SN_LDSB0_AFC1_AFEM1_AFEM1_ASEM1_CLR0_CADS0_DTLA1_DTLB1_DTVA0_DTVB0_EPS0_FDSI0_GRPM1_GRVWA8_GRVWB8_GSU1_GSUAMB_GSUC0_GSUWGMRR0_GLS0_ISA950_IU1_K1_LBSPPA1024_LBSPPB1024_LBSPPM0_LPA16_LPB16_LPM0_LRVW8_LWPMn1_MIAV0_MIWT1_1_MO40_NTn1_NTA1_NTB1_NTC2_NTD0_NTM0_NEPBS8_NLCA1_NLCB1_ONLL1_PGR2_PLR1_PKA1_SIA3_SS1_SU8_SUM0_SUS512_SPO0_SRVW0_SSO1_SVW1_SK0_SKXCCM0_TLDS2_ULSGRO0_USL1_UIOFGRO0_USFGRO1_VSn1_VWA1_VWB1_WSGRA0_WSGRB0_WS64_WG16_4_4_WGM0_WGMXCC16_WGMXCCGn1
    SolutionIndex: 13
    SolutionNameMin: Cijk_Alik_Bljk_BBS_BH_Bias_HA_S_SAV_UserArgs_MT448x16x64_MI16x16x1_SN_LDSB1_AFC1_AFEM1_AFEM1_ASEM1_CLR0_CADS0_DTLA0_DTLB0_DTVA0_DTVB0_EPS1_FDSI0_GRPM1_GRVWA8_GRVWB8_GSU1_GSUAMB_GSUC0_GSUWGMRR0_GLS0_ISA950_IU1_K1_LBSPPA256_LBSPPB128_LBSPPM0_LPA16_LPB16_LPM0_LRVW8_LWPMn1_MIAV0_MIWT14_1_MO40_NTn1_NTA6_NTB2_NTC1_NTD1_NTM0_NEPBS16_NLCA1_NLCB1_ONLL1_PGR1_PLR1_PKA1_SIA3_SS0_SU8_SUM0_SUS128_SPO1_SRVW0_SSO1_SVW8_SK0_SKXCCM0_TLDS2_ULSGRO0_USL1_UIOFGRO0_USFGRO1_VSn1_VWA2_VWB1_WSGRA0_WSGRB0_WS64_WG32_4_1_WGM0_WGMXCC2_WGMXCCGn1
    SolutionIndex: 14
    SolutionNameMin: Cijk_Alik_Bljk_BBS_BH_Bias_HA_S_SAV_UserArgs_MT16x16x256_MI16x16x1_SN_LDSB0_AFC1_AFEM1_AFEM1_ASEM1_CLR1_CADS0_DTLA1_DTLB1_DTVA0_DTVB0_EPS0_FDSI0_GRPM1_GRVWA8_GRVWB8_GSU1_GSUAMB_GSUC0_GSUWGMRR0_GLS0_ISA950_IU1_K1_LBSPPA1024_LBSPPB1024_LBSPPM0_LPA16_LPB16_LPM0_LRVW8_LWPMn1_MIAV0_MIWT1_1_MO40_NTn1_NTA1_NTB0_NTC3_NTD1_NTM0_NEPBS2_NLCA1_NLCB1_ONLL1_PGR2_PLR1_PKA1_SIA3_SS1_SU8_SUM0_SUS512_SPO0_SRVW0_SSO0_SVW1_SK0_SKXCCM0_TLDS2_ULSGRO0_USL1_UIOFGRO0_USFGROn1_VSn1_VWA1_VWB1_WSGRA0_WSGRB0_WS64_WG16_4_4_WGM1_WGMXCC8_WGMXCCGn1
    SolutionIndex: 15
    SolutionNameMin: Cijk_Alik_Bljk_BBS_BH_Bias_HA_S_SAV_UserArgs_MT192x256x64_MI16x16x1_SN_LDSB1_AFC1_AFEM1_AFEM1_ASEM1_CLR0_CADS0_DTLA0_DTLB0_DTVA0_DTVB0_EPS0_FDSI0_GRPM1_GRVWA8_GRVWB8_GSU1_GSUAMB_GSUC0_GSUWGMRR0_GLS0_ISA950_IU1_K1_LBSPPA512_LBSPPB512_LBSPPM0_LPA16_LPB16_LPM0_LRVW8_LWPMn1_MIAV0_MIWT12_4_MO40_NTn1_NTA3_NTB2_NTC7_NTD6_NTM0_NEPBS0_NLCA1_NLCB1_ONLL1_PGR2_PLR1_PKA1_SIA3_SS1_SU0_SUM0_SUS0_SPO0_SRVW0_SSO1_SVW4_SK0_SKXCCM0_TLDS2_ULSGRO0_USL1_UIOFGRO0_USFGROn1_VSn1_VWA4_VWB4_WSGRA0_WSGRB0_WS64_WG16_16_1_WGM0_WGMXCC8_WGMXCCGn1
    SolutionIndex: 16
    SolutionNameMin: Cijk_Alik_Bljk_BBS_BH_Bias_HA_S_SAV_UserArgs_MT16x16x256_MI16x16x1_SN_LDSB0_AFC1_AFEM1_AFEM1_ASEM1_CLR1_CADS0_DTLA1_DTLB1_DTVA0_DTVB0_EPS0_FDSI0_GRPM1_GRVWA8_GRVWB8_GSU1_GSUAMB_GSUC0_GSUWGMRR0_GLS0_ISA950_IU1_K1_LBSPPA1024_LBSPPB1024_LBSPPM0_LPA16_LPB16_LPM0_LRVW8_LWPMn1_MIAV1_MIWT1_1_MO40_NTn1_NTA1_NTB0_NTC2_NTD3_NTM0_NEPBS14_NLCA1_NLCB1_ONLL1_PGR2_PLR1_PKA1_SIA3_SS1_SU8_SUM0_SUS512_SPO0_SRVW0_SSO0_SVW1_SK0_SKXCCM0_TLDS2_ULSGRO0_USL1_UIOFGRO0_USFGROn1_VSn1_VWA1_VWB1_WSGRA0_WSGRB0_WS64_WG16_4_4_WGM1_WGMXCC4_WGMXCCGn1
    SolutionIndex: 17
    SolutionNameMin: Cijk_Alik_Bljk_BBS_BH_Bias_HA_S_SAV_UserArgs_MT64x64x64_MI32x32x1_SN_LDSB0_AFC1_AFEM1_AFEM1_ASEM1_CLR1_CADS0_DTLA1_DTLB1_DTVA0_DTVB0_EPS0_FDSI0_GRPM1_GRVWA2_GRVWB2_GSU1_GSUAMB_GSUC0_GSUWGMRR0_GLS0_ISA950_IU1_K1_LBSPPA256_LBSPPB256_LBSPPM0_LPA8_LPB8_LPM0_LRVW8_LWPMn1_MIAV0_MIWT1_1_MO40_NTn1_NTA1_NTB5_NTC3_NTD4_NTM0_NEPBS0_NLCA1_NLCB1_ONLL1_PGR2_PLR1_PKA1_SIA3_SS1_SU0_SUM0_SUS0_SPO1_SRVW0_SSO0_SVW1_SK0_SKXCCM0_TLDS1_ULSGRO0_USL1_UIOFGRO0_USFGRO0_VSn1_VWA1_VWB1_WSGRA0_WSGRB0_WS64_WG64_4_1_WGM0_WGMXCC8_WGMXCCGn1
    SolutionIndex: 18
    SolutionNameMin: Cijk_Alik_Bljk_BBS_BH_Bias_HA_S_SAV_UserArgs_MT32x16x256_MI16x16x1_SN_LDSB0_AFC1_AFEM1_AFEM1_ASEM1_CLR0_CADS0_DTLA1_DTLB1_DTVA0_DTVB0_EPS0_FDSI0_GRPM1_GRVWA8_GRVWB8_GSU1_GSUAMB_GSUC0_GSUWGMRR0_GLS0_ISA950_IU1_K1_LBSPPA1024_LBSPPB1024_LBSPPM0_LPA16_LPB16_LPM0_LRVW8_LWPMn1_MIAV0_MIWT2_1_MO40_NTn1_NTA0_NTB0_NTC2_NTD2_NTM0_NEPBS8_NLCA1_NLCB1_ONLL1_PGR2_PLR1_PKA1_SIA3_SS1_SU8_SUM0_SUS512_SPO0_SRVW0_SSO1_SVW2_SK0_SKXCCM0_TLDS1_ULSGRO0_USL1_UIOFGRO0_USFGROn1_VSn1_VWA2_VWB1_WSGRA0_WSGRB0_WS64_WG16_4_4_WGM0_WGMXCC4_WGMXCCGn1
    SolutionIndex: 19
    SolutionNameMin: Cijk_Alik_Bljk_BBS_BH_Bias_HA_S_SAV_UserArgs_MT160x128x64_MI16x16x1_SN_LDSB0_AFC1_AFEM1_AFEM1_ASEM1_CLR1_CADS0_DTLA0_DTLB0_DTVA0_DTVB0_EPS0_FDSI0_GRPM1_GRVWA8_GRVWB8_GSU1_GSUAMB_GSUC0_GSUWGMRR0_GLS0_ISA950_IU1_K1_LBSPPA256_LBSPPB256_LBSPPM0_LPA16_LPB16_LPM0_LRVW8_LWPMn1_MIAV0_MIWT10_2_MO40_NTn1_NTA1_NTB4_NTC0_NTD5_NTM0_NEPBS0_NLCA1_NLCB1_ONLL1_PGR2_PLR1_PKA1_SIA3_SS1_SU8_SUM0_SUS128_SPO0_SRVW0_SSO0_SVW2_SK0_SKXCCM0_TLDS2_ULSGRO0_USL1_UIOFGRO0_USFGROn1_VSn1_VWA2_VWB2_WSGRA0_WSGRB0_WS64_WG16_16_1_WGM4_WGMXCC2_WGMXCCGn1
    SolutionIndex: 20
    SolutionNameMin: Cijk_Alik_Bljk_BBS_BH_Bias_HA_S_SAV_UserArgs_MT16x16x256_MI16x16x1_SN_LDSB0_AFC1_AFEM1_AFEM1_ASEM1_CLR1_CADS0_DTLA1_DTLB1_DTVA0_DTVB0_EPS0_FDSI0_GRPM1_GRVWA8_GRVWB8_GSU1_GSUAMB_GSUC0_GSUWGMRR0_GLS0_ISA950_IU1_K1_LBSPPA1024_LBSPPB1024_LBSPPM0_LPA16_LPB16_LPM0_LRVW8_LWPMn1_MIAV0_MIWT1_1_MO40_NTn1_NTA1_NTB0_NTC2_NTD3_NTM0_NEPBS16_NLCA1_NLCB1_ONLL1_PGR2_PLR1_PKA1_SIA3_SS1_SU8_SUM0_SUS512_SPO0_SRVW0_SSO0_SVW1_SK0_SKXCCM0_TLDS1_ULSGRO0_USL1_UIOFGRO0_USFGRO1_VSn1_VWA1_VWB1_WSGRA0_WSGRB0_WS64_WG16_4_2_WGM0_WGMXCC4_WGMXCCGn1
    SolutionIndex: 21
    SolutionNameMin: Cijk_Alik_Bljk_BBS_BH_Bias_HA_S_SAV_UserArgs_MT256x224x64_MI16x16x1_SN_LDSB0_AFC1_AFEM1_AFEM1_ASEM1_CLR0_CADS0_DTLA1_DTLB1_DTVA0_DTVB0_EPS0_FDSI0_GRPM1_GRVWA8_GRVWB8_GSU1_GSUAMB_GSUC0_GSUWGMRR0_GLS0_ISA950_IU1_K1_LBSPPA1024_LBSPPB1024_LBSPPM0_LPA16_LPB16_LPM0_LRVW8_LWPMn1_MIAV0_MIWT8_7_MO40_NTn1_NTA1_NTB2_NTC5_NTD6_NTM0_NEPBS14_NLCA1_NLCB1_ONLL1_PGR2_PLR1_PKA1_SIA3_SS1_SU8_SUM0_SUS128_SPO0_SRVW0_SSO1_SVW8_SK0_SKXCCM0_TLDS1_ULSGRO0_USL1_UIOFGRO0_USFGRO1_VSn1_VWA8_VWB1_WSGRA0_WSGRB0_WS64_WG32_8_1_WGM1_WGMXCC2_WGMXCCGn1
    SolutionIndex: 22
    SolutionNameMin: Cijk_Alik_Bljk_BBS_BH_Bias_HA_S_SAV_UserArgs_MT16x16x128_MI16x16x1_SN_LDSB0_AFC1_AFEM1_AFEM1_ASEM1_CLR1_CADS0_DTLA1_DTLB1_DTVA0_DTVB0_EPS0_FDSI0_GRPM1_GRVWA8_GRVWB8_GSU1_GSUAMB_GSUC0_GSUWGMRR0_GLS0_ISA950_IU1_K1_LBSPPA1024_LBSPPB1024_LBSPPM0_LPA16_LPB16_LPM0_LRVW8_LWPMn1_MIAV1_MIWT1_1_MO40_NTn1_NTA0_NTB1_NTC3_NTD2_NTM0_NEPBS8_NLCA1_NLCB1_ONLL1_PGR2_PLR1_PKA1_SIA3_SS1_SU8_SUM0_SUS256_SPO1_SRVW0_SSO0_SVW1_SK0_SKXCCM0_TLDS1_ULSGRO0_USL1_UIOFGRO0_USFGRO1_VSn1_VWA1_VWB1_WSGRA0_WSGRB0_WS64_WG16_4_2_WGM0_WGMXCC4_WGMXCCGn1
    SolutionIndex: 23
    SolutionNameMin: Cijk_Alik_Bljk_BBS_BH_Bias_HA_S_SAV_UserArgs_MT256x224x64_MI16x16x1_SN_LDSB0_AFC1_AFEM1_AFEM1_ASEM1_CLR0_CADS0_DTLA1_DTLB1_DTVA0_DTVB0_EPS0_FDSI0_GRPM1_GRVWA8_GRVWB8_GSU1_GSUAMB_GSUC0_GSUWGMRR0_GLS0_ISA950_IU1_K1_LBSPPA1024_LBSPPB1024_LBSPPM0_LPA16_LPB16_LPM0_LRVW8_LWPMn1_MIAV0_MIWT8_7_MO40_NTn1_NTA1_NTB0_NTC5_NTD6_NTM0_NEPBS14_NLCA1_NLCB1_ONLL1_PGR2_PLR1_PKA1_SIA3_SS1_SU8_SUM0_SUS128_SPO0_SRVW0_SSO0_SVW8_SK0_SKXCCM0_TLDS2_ULSGRO0_USL1_UIOFGRO0_USFGRO0_VSn1_VWA8_VWB1_WSGRA0_WSGRB0_WS64_WG32_8_1_WGM2_WGMXCC1_WGMXCCGn1
    SolutionIndex: 24
    SolutionNameMin: Cijk_Alik_Bljk_BBS_BH_Bias_HA_S_SAV_UserArgs_MT32x16x256_MI16x16x1_SN_LDSB0_AFC1_AFEM1_AFEM1_ASEM1_CLR0_CADS0_DTLA1_DTLB1_DTVA0_DTVB0_EPS0_FDSI0_GRPM1_GRVWA8_GRVWB8_GSU1_GSUAMB_GSUC0_GSUWGMRR0_GLS0_ISA950_IU1_K1_LBSPPA1024_LBSPPB1024_LBSPPM0_LPA16_LPB16_LPM0_LRVW8_LWPMn1_MIAV0_MIWT2_1_MO40_NTn1_NTA1_NTB0_NTC3_NTD2_NTM0_NEPBS14_NLCA1_NLCB1_ONLL1_PGR2_PLR1_PKA1_SIA3_SS1_SU8_SUM0_SUS512_SPO1_SRVW0_SSO0_SVW2_SK0_SKXCCM0_TLDS1_ULSGRO0_USL1_UIOFGRO0_USFGROn1_VSn1_VWA2_VWB1_WSGRA0_WSGRB0_WS64_WG16_4_4_WGM0_WGMXCC4_WGMXCCGn1
    SolutionIndex: 25
    SolutionNameMin: Cijk_Alik_Bljk_BBS_BH_Bias_HA_S_SAV_UserArgs_MT256x224x64_MI16x16x1_SN_LDSB0_AFC1_AFEM1_AFEM1_ASEM1_CLR1_CADS0_DTLA1_DTLB1_DTVA0_DTVB0_EPS0_FDSI0_GRPM1_GRVWA8_GRVWB8_GSU1_GSUAMB_GSUC0_GSUWGMRR0_GLS0_ISA950_IU1_K1_LBSPPA1024_LBSPPB1024_LBSPPM0_LPA16_LPB16_LPM0_LRVW8_LWPMn1_MIAV0_MIWT8_7_MO40_NTn1_NTA1_NTB2_NTC7_NTD4_NTM0_NEPBS14_NLCA1_NLCB1_ONLL1_PGR2_PLR1_PKA1_SIA3_SS1_SU8_SUM0_SUS128_SPO0_SRVW0_SSO1_SVW8_SK0_SKXCCM0_TLDS1_ULSGRO0_USL1_UIOFGRO0_USFGRO0_VSn1_VWA8_VWB1_WSGRA0_WSGRB0_WS64_WG32_8_1_WGM1_WGMXCC2_WGMXCCGn1
    SolutionIndex: 26
    SolutionNameMin: Cijk_Alik_Bljk_BBS_BH_Bias_HA_S_SAV_UserArgs_MT16x16x128_MI16x16x1_SN_LDSB0_AFC1_AFEM1_AFEM1_ASEM1_CLR0_CADS0_DTLA1_DTLB1_DTVA0_DTVB0_EPS0_FDSI0_GRPM1_GRVWA8_GRVWB8_GSU1_GSUAMB_GSUC0_GSUWGMRR0_GLS0_ISA950_IU1_K1_LBSPPA1024_LBSPPB1024_LBSPPM0_LPA16_LPB16_LPM0_LRVW8_LWPMn1_MIAV1_MIWT1_1_MO40_NTn1_NTA1_NTB1_NTC3_NTD2_NTM0_NEPBS12_NLCA1_NLCB1_ONLL1_PGR2_PLR1_PKA1_SIA3_SS1_SU8_SUM0_SUS256_SPO1_SRVW0_SSO0_SVW1_SK0_SKXCCM0_TLDS1_ULSGRO0_USL1_UIOFGRO0_USFGROn1_VSn1_VWA1_VWB1_WSGRA0_WSGRB0_WS64_WG16_4_2_WGM1_WGMXCC4_WGMXCCGn1
    SolutionIndex: 27
    SolutionNameMin: Cijk_Alik_Bljk_BBS_BH_Bias_HA_S_SAV_UserArgs_MT112x16x64_MI16x16x1_SN_LDSB0_AFC1_AFEM1_AFEM1_ASEM1_CLR1_CADS0_DTLA1_DTLB1_DTVA0_DTVB0_EPS0_FDSI0_GRPM1_GRVWA8_GRVWB2_GSU1_GSUAMB_GSUC0_GSUWGMRR0_GLS0_ISA950_IU1_K1_LBSPPA1024_LBSPPB256_LBSPPM0_LPA16_LPB16_LPM0_LRVW8_LWPMn1_MIAV0_MIWT7_1_MO40_NTn1_NTA5_NTB3_NTC1_NTD0_NTM0_NEPBS0_NLCA1_NLCB1_ONLL1_PGR2_PLR1_PKA1_SIA3_SS0_SU0_SUM0_SUS0_SPO1_SRVW0_SSO0_SVW4_SK0_SKXCCM0_TLDS2_ULSGRO0_USL1_UIOFGRO0_USFGRO1_VSn1_VWA1_VWB1_WSGRA0_WSGRB0_WS64_WG16_4_1_WGM0_WGMXCC16_WGMXCCGn1
    SolutionIndex: 28
    SolutionNameMin: Cijk_Alik_Bljk_BBS_BH_Bias_HA_S_SAV_UserArgs_MT16x16x128_MI16x16x1_SN_LDSB0_AFC1_AFEM1_AFEM1_ASEM1_CLR0_CADS0_DTLA1_DTLB1_DTVA0_DTVB0_EPS0_FDSI0_GRPM1_GRVWA8_GRVWB8_GSU1_GSUAMB_GSUC0_GSUWGMRR0_GLS0_ISA950_IU1_K1_LBSPPA1024_LBSPPB1024_LBSPPM0_LPA16_LPB16_LPM0_LRVW8_LWPMn1_MIAV1_MIWT1_1_MO40_NTn1_NTA0_NTB1_NTC1_NTD0_NTM0_NEPBS14_NLCA1_NLCB1_ONLL1_PGR2_PLR1_PKA1_SIA3_SS1_SU16_SUM0_SUS256_SPO1_SRVW0_SSO0_SVW1_SK0_SKXCCM0_TLDS1_ULSGRO0_USL1_UIOFGRO0_USFGROn1_VSn1_VWA1_VWB1_WSGRA0_WSGRB0_WS64_WG16_4_2_WGM0_WGMXCC4_WGMXCCGn1
    SolutionIndex: 29
    SolutionNameMin: Cijk_Alik_Bljk_BBS_BH_Bias_HA_S_SAV_UserArgs_MT256x192x64_MI16x16x1_SN_LDSB0_AFC1_AFEM1_AFEM1_ASEM1_CLR0_CADS0_DTLA1_DTLB1_DTVA0_DTVB0_EPS0_FDSI0_GRPM1_GRVWA8_GRVWB8_GSU1_GSUAMB_GSUC0_GSUWGMRR0_GLS0_ISA950_IU1_K1_LBSPPA1024_LBSPPB1024_LBSPPM0_LPA16_LPB16_LPM0_LRVW8_LWPMn1_MIAV0_MIWT16_3_MO40_NTn1_NTA0_NTB2_NTC5_NTD5_NTM0_NEPBS12_NLCA1_NLCB1_ONLL1_PGR2_PLR1_PKA1_SIA3_SS1_SU16_SUM0_SUS128_SPO0_SRVW0_SSO1_SVW8_SK0_SKXCCM0_TLDS1_ULSGRO0_USL1_UIOFGRO0_USFGRO1_VSn1_VWA8_VWB1_WSGRA0_WSGRB0_WS64_WG16_16_1_WGM0_WGMXCC2_WGMXCCGn1
    SolutionIndex: 30
    SolutionNameMin: Cijk_Alik_Bljk_BBS_BH_Bias_HA_S_SAV_UserArgs_MT16x16x256_MI16x16x1_SN_LDSB0_AFC1_AFEM1_AFEM1_ASEM1_CLR1_CADS0_DTLA1_DTLB1_DTVA0_DTVB0_EPS0_FDSI0_GRPM1_GRVWA8_GRVWB8_GSU1_GSUAMB_GSUC0_GSUWGMRR0_GLS0_ISA950_IU1_K1_LBSPPA1024_LBSPPB1024_LBSPPM0_LPA16_LPB16_LPM0_LRVW8_LWPMn1_MIAV0_MIWT1_1_MO40_NTn1_NTA1_NTB1_NTC1_NTD5_NTM0_NEPBS16_NLCA1_NLCB1_ONLL1_PGR2_PLR1_PKA1_SIA3_SS1_SU16_SUM0_SUS512_SPO0_SRVW0_SSO0_SVW1_SK0_SKXCCM0_TLDS1_ULSGRO0_USL1_UIOFGRO0_USFGROn1_VSn1_VWA1_VWB1_WSGRA0_WSGRB0_WS64_WG16_4_2_WGM1_WGMXCC16_WGMXCCGn1
    SolutionIndex: 31
    SolutionNameMin: Cijk_Alik_Bljk_BBS_BH_Bias_HA_S_SAV_UserArgs_MT256x192x64_MI16x16x1_SN_LDSB0_AFC1_AFEM1_AFEM1_ASEM1_CLR1_CADS0_DTLA1_DTLB1_DTVA0_DTVB0_EPS0_FDSI0_GRPM1_GRVWA8_GRVWB8_GSU1_GSUAMB_GSUC0_GSUWGMRR0_GLS0_ISA950_IU1_K1_LBSPPA1024_LBSPPB1024_LBSPPM0_LPA16_LPB16_LPM0_LRVW8_LWPMn1_MIAV0_MIWT16_3_MO40_NTn1_NTA2_NTB3_NTC6_NTD5_NTM0_NEPBS16_NLCA1_NLCB1_ONLL1_PGR2_PLR1_PKA1_SIA3_SS1_SU8_SUM0_SUS128_SPO0_SRVW0_SSO1_SVW8_SK0_SKXCCM0_TLDS2_ULSGRO0_USL1_UIOFGRO0_USFGROn1_VSn1_VWA8_VWB1_WSGRA0_WSGRB0_WS64_WG16_16_1_WGM0_WGMXCC2_WGMXCCGn1
    SolutionIndex: 32
    SolutionNameMin: Cijk_Alik_Bljk_BBS_BH_Bias_HA_S_SAV_UserArgs_MT16x16x128_MI16x16x1_SN_LDSB0_AFC1_AFEM1_AFEM1_ASEM1_CLR1_CADS0_DTLA1_DTLB1_DTVA0_DTVB0_EPS0_FDSI0_GRPM1_GRVWA8_GRVWB8_GSU1_GSUAMB_GSUC0_GSUWGMRR0_GLS0_ISA950_IU1_K1_LBSPPA1024_LBSPPB1024_LBSPPM0_LPA16_LPB16_LPM0_LRVW8_LWPMn1_MIAV1_MIWT1_1_MO40_NTn1_NTA0_NTB1_NTC1_NTD3_NTM0_NEPBS10_NLCA1_NLCB1_ONLL1_PGR2_PLR1_PKA1_SIA3_SS1_SU16_SUM0_SUS256_SPO1_SRVW0_SSO1_SVW1_SK0_SKXCCM0_TLDS1_ULSGRO0_USL1_UIOFGRO0_USFGROn1_VSn1_VWA1_VWB1_WSGRA0_WSGRB0_WS64_WG16_4_2_WGM1_WGMXCC4_WGMXCCGn1
    SolutionIndex: 33
    SolutionNameMin: Cijk_Alik_Bljk_BBS_BH_Bias_HA_S_SAV_UserArgs_MT256x192x64_MI16x16x1_SN_LDSB0_AFC1_AFEM1_AFEM1_ASEM1_CLR0_CADS0_DTLA1_DTLB1_DTVA0_DTVB0_EPS0_FDSI0_GRPM1_GRVWA8_GRVWB8_GSU1_GSUAMB_GSUC0_GSUWGMRR0_GLS0_ISA950_IU1_K1_LBSPPA1024_LBSPPB1024_LBSPPM0_LPA16_LPB16_LPM0_LRVW8_LWPMn1_MIAV0_MIWT16_3_MO40_NTn1_NTA0_NTB1_NTC7_NTD5_NTM0_NEPBS16_NLCA1_NLCB1_ONLL1_PGR2_PLR1_PKA1_SIA3_SS1_SU16_SUM0_SUS128_SPO0_SRVW0_SSO1_SVW8_SK0_SKXCCM0_TLDS1_ULSGRO0_USL1_UIOFGRO0_USFGRO1_VSn1_VWA8_VWB1_WSGRA0_WSGRB0_WS64_WG16_16_1_WGM0_WGMXCC2_WGMXCCGn1
    SolutionIndex: 34
    SolutionNameMin: Cijk_Alik_Bljk_BBS_BH_Bias_HA_S_SAV_UserArgs_MT32x32x256_MI16x16x1_SN_LDSB0_AFC1_AFEM1_AFEM1_ASEM1_CLR0_CADS0_DTLA0_DTLB0_DTVA0_DTVB0_EPS0_FDSI0_GRPM1_GRVWA8_GRVWB8_GSU1_GSUAMB_GSUC0_GSUWGMRR0_GLS0_ISA950_IU1_K1_LBSPPA512_LBSPPB512_LBSPPM0_LPA16_LPB16_LPM0_LRVW8_LWPMn1_MIAV1_MIWT1_1_MO40_NTn1_NTA1_NTB0_NTC3_NTD1_NTM0_NEPBS10_NLCA1_NLCB1_ONLL1_PGR2_PLR1_PKA1_SIA3_SS1_SU8_SUM0_SUS512_SPO0_SRVW0_SSO0_SVW1_SK0_SKXCCM0_TLDS1_ULSGRO0_USL1_UIOFGRO0_USFGROn1_VSn1_VWA1_VWB1_WSGRA0_WSGRB0_WS64_WG32_8_1_WGM1_WGMXCC4_WGMXCCGn1
    SolutionIndex: 35
    SolutionNameMin: Cijk_Alik_Bljk_BBS_BH_Bias_HA_S_SAV_UserArgs_MT256x192x64_MI16x16x1_SN_LDSB1_AFC1_AFEM1_AFEM1_ASEM1_CLR0_CADS0_DTLA0_DTLB0_DTVA0_DTVB0_EPS0_FDSI0_GRPM1_GRVWA8_GRVWB8_GSU1_GSUAMB_GSUC0_GSUWGMRR0_GLS0_ISA950_IU1_K1_LBSPPA1024_LBSPPB256_LBSPPM0_LPA16_LPB16_LPM0_LRVW8_LWPMn1_MIAV0_MIWT8_6_MO40_NTn1_NTA2_NTB3_NTC7_NTD5_NTM0_NEPBS12_NLCA1_NLCB1_ONLL1_PGR2_PLR1_PKA1_SIA3_SS1_SU8_SUM0_SUS128_SPO0_SRVW0_SSO1_SVW8_SK0_SKXCCM0_TLDS1_ULSGRO0_USL1_UIOFGRO0_USFGRO1_VSn1_VWA8_VWB2_WSGRA0_WSGRB0_WS64_WG32_8_1_WGM0_WGMXCC2_WGMXCCGn1
    SolutionIndex: 36
    SolutionNameMin: Cijk_Alik_Bljk_BBS_BH_Bias_HA_S_SAV_UserArgs_MT32x32x256_MI16x16x1_SN_LDSB0_AFC1_AFEM1_AFEM1_ASEM1_CLR1_CADS0_DTLA0_DTLB0_DTVA0_DTVB0_EPS0_FDSI0_GRPM1_GRVWA8_GRVWB8_GSU1_GSUAMB_GSUC0_GSUWGMRR0_GLS0_ISA950_IU1_K1_LBSPPA512_LBSPPB512_LBSPPM0_LPA16_LPB16_LPM0_LRVW8_LWPMn1_MIAV1_MIWT1_1_MO40_NTn1_NTA1_NTB0_NTC0_NTD0_NTM0_NEPBS16_NLCA1_NLCB1_ONLL1_PGR2_PLR1_PKA1_SIA3_SS1_SU8_SUM0_SUS512_SPO0_SRVW0_SSO0_SVW1_SK0_SKXCCM0_TLDS2_ULSGRO0_USL1_UIOFGRO0_USFGRO1_VSn1_VWA1_VWB1_WSGRA0_WSGRB0_WS64_WG32_8_1_WGM1_WGMXCC4_WGMXCCGn1
    SolutionIndex: 37
    SolutionNameMin: Cijk_Alik_Bljk_BBS_BH_Bias_HA_S_SAV_UserArgs_MT192x256x64_MI16x16x1_SN_LDSB0_AFC1_AFEM1_AFEM1_ASEM1_CLR1_CADS0_DTLA1_DTLB1_DTVA0_DTVB0_EPS0_FDSI0_GRPM1_GRVWA2_GRVWB8_GSU1_GSUAMB_GSUC0_GSUWGMRR0_GLS0_ISA950_IU1_K1_LBSPPA512_LBSPPB1024_LBSPPM0_LPA16_LPB16_LPM0_LRVW8_LWPMn1_MIAV0_MIWT12_4_MO40_NTn1_NTA3_NTB0_NTC1_NTD6_NTM0_NEPBS0_NLCA1_NLCB1_ONLL1_PGR2_PLR1_PKA1_SIA3_SS1_SU16_SUM0_SUS128_SPO1_SRVW0_SSO0_SVW4_SK0_SKXCCM0_TLDS2_ULSGRO0_USL1_UIOFGRO0_USFGRO0_VSn1_VWA4_VWB4_WSGRA0_WSGRB0_WS64_WG16_16_1_WGM4_WGMXCC8_WGMXCCGn1
    SolutionIndex: 38
    SolutionNameMin: Cijk_Alik_Bljk_BBS_BH_Bias_HA_S_SAV_UserArgs_MT32x32x256_MI16x16x1_SN_LDSB0_AFC1_AFEM1_AFEM1_ASEM1_CLR0_CADS0_DTLA0_DTLB0_DTVA0_DTVB0_EPS0_FDSI0_GRPM1_GRVWA8_GRVWB8_GSU1_GSUAMB_GSUC0_GSUWGMRR0_GLS0_ISA950_IU1_K1_LBSPPA512_LBSPPB512_LBSPPM0_LPA16_LPB16_LPM0_LRVW8_LWPMn1_MIAV0_MIWT1_1_MO40_NTn1_NTA0_NTB0_NTC2_NTD1_NTM0_NEPBS4_NLCA1_NLCB1_ONLL1_PGR2_PLR1_PKA1_SIA3_SS1_SU8_SUM0_SUS512_SPO0_SRVW0_SSO0_SVW1_SK0_SKXCCM0_TLDS1_ULSGRO0_USL1_UIOFGRO0_USFGRO1_VSn1_VWA1_VWB1_WSGRA0_WSGRB0_WS64_WG32_8_1_WGM0_WGMXCC4_WGMXCCGn1
    SolutionIndex: 39
    SolutionNameMin: Cijk_Alik_Bljk_BBS_BH_Bias_HA_S_SAV_UserArgs_MT192x256x64_MI16x16x1_SN_LDSB0_AFC1_AFEM1_AFEM1_ASEM1_CLR1_CADS0_DTLA1_DTLB1_DTVA0_DTVB0_EPS0_FDSI0_GRPM1_GRVWA2_GRVWB8_GSU1_GSUAMB_GSUC0_GSUWGMRR0_GLS0_ISA950_IU1_K1_LBSPPA512_LBSPPB1024_LBSPPM0_LPA16_LPB16_LPM0_LRVW8_LWPMn1_MIAV0_MIWT12_4_MO40_NTn1_NTA3_NTB0_NTC6_NTD6_NTM0_NEPBS0_NLCA1_NLCB1_ONLL1_PGR2_PLR1_PKA1_SIA3_SS1_SU8_SUM0_SUS128_SPO1_SRVW0_SSO1_SVW4_SK0_SKXCCM0_TLDS2_ULSGRO0_USL1_UIOFGRO0_USFGRO0_VSn1_VWA4_VWB4_WSGRA0_WSGRB0_WS64_WG16_16_1_WGM4_WGMXCC8_WGMXCCGn1
    SolutionIndex: 40
    SolutionNameMin: Cijk_Alik_Bljk_BBS_BH_Bias_HA_S_SAV_UserArgs_MT32x32x256_MI16x16x1_SN_LDSB0_AFC1_AFEM1_AFEM1_ASEM1_CLR0_CADS0_DTLA0_DTLB0_DTVA0_DTVB0_EPS0_FDSI0_GRPM1_GRVWA8_GRVWB8_GSU1_GSUAMB_GSUC0_GSUWGMRR0_GLS0_ISA950_IU1_K1_LBSPPA512_LBSPPB512_LBSPPM0_LPA16_LPB16_LPM0_LRVW8_LWPMn1_MIAV0_MIWT1_1_MO40_NTn1_NTA0_NTB0_NTC3_NTD0_NTM0_NEPBS4_NLCA1_NLCB1_ONLL1_PGR2_PLR1_PKA1_SIA3_SS1_SU8_SUM0_SUS512_SPO0_SRVW0_SSO0_SVW1_SK0_SKXCCM0_TLDS1_ULSGRO0_USL1_UIOFGRO0_USFGRO1_VSn1_VWA1_VWB1_WSGRA0_WSGRB0_WS64_WG32_8_1_WGM0_WGMXCC4_WGMXCCGn1
    SolutionIndex: 41
    SolutionNameMin: Cijk_Alik_Bljk_BBS_BH_Bias_HA_S_SAV_UserArgs_MT32x32x256_MI16x16x1_SN_LDSB0_AFC1_AFEM1_AFEM1_ASEM1_CLR1_CADS0_DTLA0_DTLB0_DTVA0_DTVB0_EPS0_FDSI0_GRPM1_GRVWA8_GRVWB8_GSU1_GSUAMB_GSUC0_GSUWGMRR0_GLS0_ISA950_IU1_K1_LBSPPA512_LBSPPB512_LBSPPM0_LPA16_LPB16_LPM0_LRVW8_LWPMn1_MIAV0_MIWT1_1_MO40_NTn1_NTA1_NTB0_NTC0_NTD1_NTM0_NEPBS8_NLCA1_NLCB1_ONLL1_PGR2_PLR1_PKA1_SIA3_SS1_SU8_SUM0_SUS512_SPO0_SRVW0_SSO0_SVW1_SK0_SKXCCM0_TLDS1_ULSGRO0_USL1_UIOFGRO0_USFGROn1_VSn1_VWA1_VWB1_WSGRA0_WSGRB0_WS64_WG32_8_1_WGM1_WGMXCC4_WGMXCCGn1
    SolutionIndex: 42
    SolutionNameMin: Cijk_Alik_Bljk_BBS_BH_Bias_HA_S_SAV_UserArgs_MT32x32x256_MI16x16x1_SN_LDSB0_AFC1_AFEM1_AFEM1_ASEM1_CLR1_CADS0_DTLA0_DTLB0_DTVA0_DTVB0_EPS0_FDSI0_GRPM1_GRVWA8_GRVWB8_GSU1_GSUAMB_GSUC0_GSUWGMRR0_GLS0_ISA950_IU1_K1_LBSPPA512_LBSPPB512_LBSPPM0_LPA16_LPB16_LPM0_LRVW8_LWPMn1_MIAV0_MIWT1_1_MO40_NTn1_NTA0_NTB1_NTC2_NTD1_NTM0_NEPBS16_NLCA1_NLCB1_ONLL1_PGR2_PLR1_PKA1_SIA3_SS1_SU8_SUM0_SUS512_SPO0_SRVW0_SSO0_SVW1_SK0_SKXCCM0_TLDS1_ULSGRO0_USL1_UIOFGRO0_USFGROn1_VSn1_VWA1_VWB1_WSGRA0_WSGRB0_WS64_WG32_8_1_WGM0_WGMXCC4_WGMXCCGn1
    SolutionIndex: 43
    SolutionNameMin: Cijk_Alik_Bljk_BBS_BH_Bias_HA_S_SAV_UserArgs_MT32x32x256_MI16x16x1_SN_LDSB0_AFC1_AFEM1_AFEM1_ASEM1_CLR1_CADS0_DTLA0_DTLB0_DTVA0_DTVB0_EPS0_FDSI0_GRPM1_GRVWA8_GRVWB8_GSU1_GSUAMB_GSUC0_GSUWGMRR0_GLS0_ISA950_IU1_K1_LBSPPA512_LBSPPB512_LBSPPM0_LPA16_LPB16_LPM0_LRVW8_LWPMn1_MIAV1_MIWT1_1_MO40_NTn1_NTA1_NTB0_NTC1_NTD0_NTM0_NEPBS8_NLCA1_NLCB1_ONLL1_PGR2_PLR1_PKA1_SIA3_SS1_SU8_SUM0_SUS512_SPO0_SRVW0_SSO0_SVW1_SK0_SKXCCM0_TLDS2_ULSGRO0_USL1_UIOFGRO0_USFGROn1_VSn1_VWA1_VWB1_WSGRA0_WSGRB0_WS64_WG32_8_1_WGM0_WGMXCC4_WGMXCCGn1
    SolutionIndex: 44
    SolutionNameMin: Cijk_Alik_Bljk_BBS_BH_Bias_HA_S_SAV_UserArgs_MT32x32x256_MI16x16x1_SN_LDSB0_AFC1_AFEM1_AFEM1_ASEM1_CLR0_CADS0_DTLA0_DTLB0_DTVA0_DTVB0_EPS0_FDSI0_GRPM1_GRVWA8_GRVWB8_GSU1_GSUAMB_GSUC0_GSUWGMRR0_GLS0_ISA950_IU1_K1_LBSPPA512_LBSPPB512_LBSPPM0_LPA16_LPB16_LPM0_LRVW8_LWPMn1_MIAV0_MIWT1_1_MO40_NTn1_NTA1_NTB0_NTC0_NTD0_NTM0_NEPBS10_NLCA1_NLCB1_ONLL1_PGR2_PLR1_PKA1_SIA3_SS1_SU8_SUM0_SUS512_SPO0_SRVW0_SSO0_SVW1_SK0_SKXCCM0_TLDS2_ULSGRO0_USL1_UIOFGRO0_USFGRO1_VSn1_VWA1_VWB1_WSGRA0_WSGRB0_WS64_WG32_8_1_WGM0_WGMXCC4_WGMXCCGn1
    SolutionIndex: 45
    SolutionNameMin: Cijk_Alik_Bljk_BBS_BH_Bias_HA_S_SAV_UserArgs_MT32x32x256_MI16x16x1_SN_LDSB0_AFC1_AFEM1_AFEM1_ASEM1_CLR0_CADS0_DTLA0_DTLB0_DTVA0_DTVB0_EPS0_FDSI0_GRPM1_GRVWA8_GRVWB8_GSU1_GSUAMB_GSUC0_GSUWGMRR0_GLS0_ISA950_IU1_K1_LBSPPA512_LBSPPB512_LBSPPM0_LPA16_LPB16_LPM0_LRVW8_LWPMn1_MIAV1_MIWT1_1_MO40_NTn1_NTA0_NTB1_NTC3_NTD0_NTM0_NEPBS4_NLCA1_NLCB1_ONLL1_PGR2_PLR1_PKA1_SIA3_SS1_SU8_SUM0_SUS512_SPO0_SRVW0_SSO0_SVW1_SK0_SKXCCM0_TLDS1_ULSGRO0_USL1_UIOFGRO0_USFGROn1_VSn1_VWA1_VWB1_WSGRA0_WSGRB0_WS64_WG32_8_1_WGM1_WGMXCC4_WGMXCCGn1
    SolutionIndex: 46
    SolutionNameMin: Cijk_Alik_Bljk_BBS_BH_Bias_HA_S_SAV_UserArgs_MT32x32x256_MI16x16x1_SN_LDSB0_AFC1_AFEM1_AFEM1_ASEM1_CLR1_CADS0_DTLA0_DTLB0_DTVA0_DTVB0_EPS0_FDSI0_GRPM1_GRVWA8_GRVWB8_GSU1_GSUAMB_GSUC0_GSUWGMRR0_GLS0_ISA950_IU1_K1_LBSPPA512_LBSPPB512_LBSPPM0_LPA16_LPB16_LPM0_LRVW8_LWPMn1_MIAV0_MIWT1_1_MO40_NTn1_NTA0_NTB1_NTC2_NTD0_NTM0_NEPBS8_NLCA1_NLCB1_ONLL1_PGR2_PLR1_PKA1_SIA3_SS1_SU16_SUM0_SUS512_SPO0_SRVW0_SSO0_SVW1_SK0_SKXCCM0_TLDS1_ULSGRO0_USL1_UIOFGRO0_USFGROn1_VSn1_VWA1_VWB1_WSGRA0_WSGRB0_WS64_WG32_8_1_WGM1_WGMXCC4_WGMXCCGn1
    SolutionIndex: 47
    SolutionNameMin: Cijk_Alik_Bljk_BBS_BH_Bias_HA_S_SAV_UserArgs_MT32x32x256_MI16x16x1_SN_LDSB0_AFC1_AFEM1_AFEM1_ASEM1_CLR0_CADS0_DTLA0_DTLB0_DTVA0_DTVB0_EPS0_FDSI0_GRPM1_GRVWA8_GRVWB8_GSU1_GSUAMB_GSUC0_GSUWGMRR0_GLS0_ISA950_IU1_K1_LBSPPA512_LBSPPB512_LBSPPM0_LPA16_LPB16_LPM0_LRVW8_LWPMn1_MIAV0_MIWT1_1_MO40_NTn1_NTA0_NTB1_NTC0_NTD0_NTM0_NEPBS4_NLCA1_NLCB1_ONLL1_PGR2_PLR1_PKA1_SIA3_SS1_SU8_SUM0_SUS512_SPO0_SRVW0_SSO0_SVW1_SK0_SKXCCM0_TLDS1_ULSGRO0_USL1_UIOFGRO0_USFGRO1_VSn1_VWA1_VWB1_WSGRA0_WSGRB0_WS64_WG32_8_1_WGM0_WGMXCC4_WGMXCCGn1
    SolutionIndex: 48
    SolutionNameMin: Cijk_Alik_Bljk_BBS_BH_Bias_HA_S_SAV_UserArgs_MT32x32x256_MI16x16x1_SN_LDSB0_AFC1_AFEM1_AFEM1_ASEM1_CLR1_CADS0_DTLA0_DTLB0_DTVA0_DTVB0_EPS0_FDSI0_GRPM1_GRVWA8_GRVWB8_GSU1_GSUAMB_GSUC0_GSUWGMRR0_GLS0_ISA950_IU1_K1_LBSPPA512_LBSPPB512_LBSPPM0_LPA16_LPB16_LPM0_LRVW8_LWPMn1_MIAV0_MIWT1_1_MO40_NTn1_NTA0_NTB0_NTC2_NTD1_NTM0_NEPBS4_NLCA1_NLCB1_ONLL1_PGR2_PLR1_PKA1_SIA3_SS1_SU8_SUM0_SUS512_SPO0_SRVW0_SSO0_SVW1_SK0_SKXCCM0_TLDS2_ULSGRO0_USL1_UIOFGRO0_USFGROn1_VSn1_VWA1_VWB1_WSGRA0_WSGRB0_WS64_WG32_8_1_WGM0_WGMXCC4_WGMXCCGn1
    SolutionIndex: 49
    SolutionNameMin: Cijk_Alik_Bljk_BBS_BH_Bias_HA_S_SAV_UserArgs_MT32x32x256_MI16x16x1_SN_LDSB0_AFC1_AFEM1_AFEM1_ASEM1_CLR1_CADS0_DTLA0_DTLB0_DTVA0_DTVB0_EPS0_FDSI0_GRPM1_GRVWA8_GRVWB8_GSU1_GSUAMB_GSUC0_GSUWGMRR0_GLS0_ISA950_IU1_K1_LBSPPA512_LBSPPB512_LBSPPM0_LPA16_LPB16_LPM0_LRVW8_LWPMn1_MIAV0_MIWT1_1_MO40_NTn1_NTA1_NTB1_NTC3_NTD1_NTM0_NEPBS10_NLCA1_NLCB1_ONLL1_PGR2_PLR1_PKA1_SIA3_SS1_SU8_SUM0_SUS512_SPO0_SRVW0_SSO0_SVW1_SK0_SKXCCM0_TLDS1_ULSGRO0_USL1_UIOFGRO0_USFGROn1_VSn1_VWA1_VWB1_WSGRA0_WSGRB0_WS64_WG32_8_1_WGM0_WGMXCC4_WGMXCCGn1
    SolutionIndex: 50
    SolutionNameMin: Cijk_Alik_Bljk_BBS_BH_Bias_HA_S_SAV_UserArgs_MT32x32x256_MI16x16x1_SN_LDSB0_AFC1_AFEM1_AFEM1_ASEM1_CLR0_CADS0_DTLA0_DTLB0_DTVA0_DTVB0_EPS0_FDSI0_GRPM1_GRVWA8_GRVWB8_GSU1_GSUAMB_GSUC0_GSUWGMRR0_GLS0_ISA950_IU1_K1_LBSPPA512_LBSPPB512_LBSPPM0_LPA16_LPB16_LPM0_LRVW8_LWPMn1_MIAV1_MIWT1_1_MO40_NTn1_NTA0_NTB0_NTC0_NTD0_NTM0_NEPBS4_NLCA1_NLCB1_ONLL1_PGR2_PLR1_PKA1_SIA3_SS1_SU8_SUM0_SUS512_SPO0_SRVW0_SSO0_SVW1_SK0_SKXCCM0_TLDS2_ULSGRO0_USL1_UIOFGRO0_USFGROn1_VSn1_VWA1_VWB1_WSGRA0_WSGRB0_WS64_WG32_8_1_WGM1_WGMXCC4_WGMXCCGn1
    SolutionIndex: 51
    SolutionNameMin: Cijk_Alik_Bljk_BBS_BH_Bias_HA_S_SAV_UserArgs_MT32x32x256_MI16x16x1_SN_LDSB0_AFC1_AFEM1_AFEM1_ASEM1_CLR0_CADS0_DTLA0_DTLB0_DTVA0_DTVB0_EPS0_FDSI0_GRPM1_GRVWA8_GRVWB8_GSU1_GSUAMB_GSUC0_GSUWGMRR0_GLS0_ISA950_IU1_K1_LBSPPA512_LBSPPB512_LBSPPM0_LPA16_LPB16_LPM0_LRVW8_LWPMn1_MIAV0_MIWT1_1_MO40_NTn1_NTA1_NTB1_NTC1_NTD1_NTM0_NEPBS4_NLCA1_NLCB1_ONLL1_PGR2_PLR1_PKA1_SIA3_SS1_SU8_SUM0_SUS512_SPO0_SRVW0_SSO0_SVW1_SK0_SKXCCM0_TLDS2_ULSGRO0_USL1_UIOFGRO0_USFGRO1_VSn1_VWA1_VWB1_WSGRA0_WSGRB0_WS64_WG32_8_1_WGM1_WGMXCC4_WGMXCCGn1
    SolutionIndex: 52
    SolutionNameMin: Cijk_Alik_Bljk_BBS_BH_Bias_HA_S_SAV_UserArgs_MT32x32x256_MI16x16x1_SN_LDSB0_AFC1_AFEM1_AFEM1_ASEM1_CLR0_CADS0_DTLA0_DTLB0_DTVA0_DTVB0_EPS0_FDSI0_GRPM1_GRVWA8_GRVWB8_GSU1_GSUAMB_GSUC0_GSUWGMRR0_GLS0_ISA950_IU1_K1_LBSPPA512_LBSPPB512_LBSPPM0_LPA16_LPB16_LPM0_LRVW8_LWPMn1_MIAV1_MIWT1_1_MO40_NTn1_NTA1_NTB0_NTC0_NTD0_NTM0_NEPBS14_NLCA1_NLCB1_ONLL1_PGR2_PLR1_PKA1_SIA3_SS1_SU8_SUM0_SUS512_SPO0_SRVW0_SSO0_SVW1_SK0_SKXCCM0_TLDS1_ULSGRO0_USL1_UIOFGRO0_USFGROn1_VSn1_VWA1_VWB1_WSGRA0_WSGRB0_WS64_WG32_8_1_WGM0_WGMXCC4_WGMXCCGn1
    SolutionIndex: 53
    SolutionNameMin: Cijk_Alik_Bljk_BBS_BH_Bias_HA_S_SAV_UserArgs_MT32x32x256_MI16x16x1_SN_LDSB0_AFC1_AFEM1_AFEM1_ASEM1_CLR1_CADS0_DTLA0_DTLB0_DTVA0_DTVB0_EPS0_FDSI0_GRPM1_GRVWA8_GRVWB8_GSU1_GSUAMB_GSUC0_GSUWGMRR0_GLS0_ISA950_IU1_K1_LBSPPA512_LBSPPB512_LBSPPM0_LPA16_LPB16_LPM0_LRVW8_LWPMn1_MIAV0_MIWT1_1_MO40_NTn1_NTA1_NTB0_NTC2_NTD1_NTM0_NEPBS0_NLCA1_NLCB1_ONLL1_PGR2_PLR1_PKA1_SIA3_SS1_SU8_SUM0_SUS512_SPO0_SRVW0_SSO1_SVW1_SK0_SKXCCM0_TLDS1_ULSGRO0_USL1_UIOFGRO0_USFGROn1_VSn1_VWA1_VWB1_WSGRA0_WSGRB0_WS64_WG32_8_1_WGM0_WGMXCC4_WGMXCCGn1
    SolutionIndex: 54
    SolutionNameMin: Cijk_Alik_Bljk_BBS_BH_Bias_HA_S_SAV_UserArgs_MT32x32x256_MI16x16x1_SN_LDSB0_AFC1_AFEM1_AFEM1_ASEM1_CLR0_CADS0_DTLA0_DTLB0_DTVA0_DTVB0_EPS0_FDSI0_GRPM1_GRVWA8_GRVWB8_GSU1_GSUAMB_GSUC0_GSUWGMRR0_GLS0_ISA950_IU1_K1_LBSPPA512_LBSPPB512_LBSPPM0_LPA16_LPB16_LPM0_LRVW8_LWPMn1_MIAV0_MIWT1_1_MO40_NTn1_NTA1_NTB0_NTC0_NTD1_NTM0_NEPBS4_NLCA1_NLCB1_ONLL1_PGR2_PLR1_PKA1_SIA3_SS1_SU8_SUM0_SUS512_SPO0_SRVW0_SSO0_SVW1_SK0_SKXCCM0_TLDS2_ULSGRO0_USL1_UIOFGRO0_USFGROn1_VSn1_VWA1_VWB1_WSGRA0_WSGRB0_WS64_WG32_8_1_WGM0_WGMXCC4_WGMXCCGn1
    SolutionIndex: 55
    SolutionNameMin: Cijk_Alik_Bljk_BBS_BH_Bias_HA_S_SAV_UserArgs_MT32x32x128_MI16x16x1_SN_LDSB0_AFC1_AFEM1_AFEM1_ASEM1_CLR1_CADS0_DTLA1_DTLB1_DTVA0_DTVB0_EPS0_FDSI0_GRPM1_GRVWA2_GRVWB8_GSU1_GSUAMB_GSUC0_GSUWGMRR0_GLS0_ISA950_IU1_K1_LBSPPA256_LBSPPB1024_LBSPPM0_LPA16_LPB16_LPM0_LRVW8_LWPMn1_MIAV0_MIWT1_1_MO40_NTn1_NTA1_NTB4_NTC1_NTD2_NTM0_NEPBS12_NLCA1_NLCB1_ONLL1_PGR2_PLR1_PKA1_SIA3_SS1_SU0_SUM0_SUS0_SPO0_SRVW0_SSO0_SVW1_SK0_SKXCCM0_TLDS1_ULSGRO0_USL1_UIOFGRO0_USFGRO0_VSn1_VWA1_VWB1_WSGRA0_WSGRB0_WS64_WG32_8_1_WGM0_WGMXCC16_WGMXCCGn1
    SolutionIndex: 56
    SolutionNameMin: Cijk_Alik_Bljk_BBS_BH_Bias_HA_S_SAV_UserArgs_MT64x32x128_MI16x16x1_SN_LDSB0_AFC1_AFEM1_AFEM1_ASEM1_CLR1_CADS0_DTLA1_DTLB1_DTVA0_DTVB0_EPS0_FDSI0_GRPM1_GRVWA8_GRVWB8_GSU1_GSUAMB_GSUC0_GSUWGMRR0_GLS0_ISA950_IU1_K1_LBSPPA1024_LBSPPB1024_LBSPPM0_LPA16_LPB16_LPM0_LRVW8_LWPMn1_MIAV1_MIWT1_2_MO40_NTn1_NTA1_NTB1_NTC5_NTD0_NTM0_NEPBS12_NLCA1_NLCB1_ONLL1_PGR2_PLR1_PKA1_SIA3_SS1_SU8_SUM0_SUS256_SPO0_SRVW0_SSO0_SVW1_SK0_SKXCCM0_TLDS2_ULSGRO0_USL1_UIOFGRO0_USFGROn1_VSn1_VWA1_VWB2_WSGRA0_WSGRB0_WS64_WG64_4_1_WGM0_WGMXCC2_WGMXCCGn1
    SolutionIndex: 57
    SolutionNameMin: Cijk_Alik_Bljk_BBS_BH_Bias_HA_S_SAV_UserArgs_MT64x48x64_MI16x16x1_SN_LDSB0_AFC1_AFEM1_AFEM1_ASEM1_CLR0_CADS0_DTLA1_DTLB1_DTVA0_DTVB0_EPS0_FDSI0_GRPM1_GRVWA2_GRVWB2_GSU1_GSUAMB_GSUC0_GSUWGMRR0_GLS0_ISA950_IU1_K1_LBSPPA256_LBSPPB256_LBSPPM0_LPA16_LPB16_LPM0_LRVW8_LWPMn1_MIAV0_MIWT1_3_MO40_NTn1_NTA1_NTB5_NTC0_NTD4_NTM0_NEPBS14_NLCA1_NLCB1_ONLL1_PGR2_PLR1_PKA1_SIA3_SS1_SU0_SUM0_SUS0_SPO0_SRVW0_SSO0_SVW1_SK0_SKXCCM0_TLDS2_ULSGRO0_USL1_UIOFGRO0_USFGRO0_VSn1_VWA1_VWB1_WSGRA0_WSGRB0_WS64_WG64_4_1_WGM0_WGMXCC8_WGMXCCGn1
    SolutionIndex: 58
    SolutionNameMin: Cijk_Alik_Bljk_BBS_BH_Bias_HA_S_SAV_UserArgs_MT64x64x64_MI32x32x1_SN_LDSB0_AFC1_AFEM1_AFEM1_ASEM1_CLR1_CADS0_DTLA1_DTLB1_DTVA0_DTVB0_EPS0_FDSI0_GRPM1_GRVWA2_GRVWB2_GSU1_GSUAMB_GSUC0_GSUWGMRR0_GLS0_ISA950_IU1_K1_LBSPPA256_LBSPPB256_LBSPPM0_LPA8_LPB8_LPM0_LRVW8_LWPMn1_MIAV0_MIWT1_1_MO40_NTn1_NTA3_NTB5_NTC1_NTD4_NTM0_NEPBS0_NLCA1_NLCB1_ONLL1_PGR2_PLR1_PKA1_SIA3_SS1_SU0_SUM0_SUS0_SPO1_SRVW0_SSO0_SVW1_SK0_SKXCCM0_TLDS1_ULSGRO0_USL1_UIOFGRO0_USFGRO0_VSn1_VWA1_VWB1_WSGRA0_WSGRB0_WS64_WG64_4_1_WGM1_WGMXCC32_WGMXCCGn1
    SolutionIndex: 59
    SolutionNameMin: Cijk_Alik_Bljk_BBS_BH_Bias_HA_S_SAV_UserArgs_MT64x64x64_MI16x16x1_SN_LDSB0_AFC1_AFEM1_AFEM1_ASEM1_CLR0_CADS0_DTLA1_DTLB1_DTVA0_DTVB0_EPS0_FDSI0_GRPM1_GRVWA2_GRVWB2_GSU1_GSUAMB_GSUC0_GSUWGMRR0_GLS0_ISA950_IU1_K1_LBSPPA256_LBSPPB256_LBSPPM0_LPA16_LPB16_LPM0_LRVW8_LWPMn1_MIAV0_MIWT2_2_MO40_NTn1_NTA0_NTB5_NTC1_NTD6_NTM0_NEPBS0_NLCA1_NLCB1_ONLL1_PGR2_PLR1_PKA1_SIA3_SS1_SU0_SUM0_SUS0_SPO1_SRVW0_SSO0_SVW2_SK0_SKXCCM0_TLDS1_ULSGRO0_USL1_UIOFGRO0_USFGRO0_VSn1_VWA2_VWB2_WSGRA0_WSGRB0_WS64_WG32_8_1_WGM0_WGMXCC16_WGMXCCGn1
    SolutionIndex: 60
    SolutionNameMin: Cijk_Alik_Bljk_BBS_BH_Bias_HA_S_SAV_UserArgs_MT64x64x64_MI16x16x1_SN_LDSB0_AFC1_AFEM1_AFEM1_ASEM1_CLR0_CADS0_DTLA1_DTLB1_DTVA0_DTVB0_EPS0_FDSI0_GRPM1_GRVWA2_GRVWB2_GSU1_GSUAMB_GSUC0_GSUWGMRR0_GLS0_ISA950_IU1_K1_LBSPPA256_LBSPPB256_LBSPPM0_LPA16_LPB16_LPM0_LRVW8_LWPMn1_MIAV0_MIWT2_2_MO40_NTn1_NTA2_NTB4_NTC3_NTD4_NTM0_NEPBS8_NLCA1_NLCB1_ONLL1_PGR2_PLR1_PKA1_SIA3_SS1_SU0_SUM0_SUS0_SPO1_SRVW0_SSO1_SVW2_SK0_SKXCCM0_TLDS2_ULSGRO0_USL1_UIOFGRO0_USFGRO0_VSn1_VWA2_VWB2_WSGRA0_WSGRB0_WS64_WG32_8_1_WGM1_WGMXCC16_WGMXCCGn1
    SolutionIndex: 61
    SolutionNameMin: Cijk_Alik_Bljk_BBS_BH_Bias_HA_S_SAV_UserArgs_MT64x64x64_MI32x32x1_SN_LDSB0_AFC1_AFEM1_AFEM1_ASEM1_CLR1_CADS0_DTLA1_DTLB1_DTVA0_DTVB0_EPS0_FDSI0_GRPM1_GRVWA2_GRVWB2_GSU1_GSUAMB_GSUC0_GSUWGMRR0_GLS0_ISA950_IU1_K1_LBSPPA256_LBSPPB256_LBSPPM0_LPA8_LPB8_LPM0_LRVW8_LWPMn1_MIAV0_MIWT1_1_MO40_NTn1_NTA0_NTB7_NTC2_NTD4_NTM0_NEPBS16_NLCA1_NLCB1_ONLL1_PGR2_PLR1_PKA1_SIA3_SS1_SU0_SUM0_SUS0_SPO1_SRVW0_SSO0_SVW1_SK0_SKXCCM0_TLDS1_ULSGRO0_USL1_UIOFGRO0_USFGRO0_VSn1_VWA1_VWB1_WSGRA0_WSGRB0_WS64_WG64_4_1_WGM1_WGMXCC8_WGMXCCGn1
    SolutionIndex: 62
    SolutionNameMin: Cijk_Alik_Bljk_BBS_BH_Bias_HA_S_SAV_UserArgs_MT64x64x64_MI16x16x1_SN_LDSB0_AFC1_AFEM1_AFEM1_ASEM1_CLR0_CADS0_DTLA1_DTLB1_DTVA0_DTVB0_EPS0_FDSI0_GRPM1_GRVWA2_GRVWB2_GSU1_GSUAMB_GSUC0_GSUWGMRR0_GLS0_ISA950_IU1_K1_LBSPPA256_LBSPPB256_LBSPPM0_LPA16_LPB16_LPM0_LRVW8_LWPMn1_MIAV0_MIWT2_2_MO40_NTn1_NTA2_NTB7_NTC2_NTD3_NTM0_NEPBS10_NLCA1_NLCB1_ONLL1_PGR2_PLR1_PKA1_SIA3_SS1_SU0_SUM0_SUS0_SPO1_SRVW0_SSO1_SVW2_SK0_SKXCCM0_TLDS1_ULSGRO0_USL1_UIOFGRO0_USFGRO0_VSn1_VWA2_VWB2_WSGRA0_WSGRB0_WS64_WG32_8_1_WGM0_WGMXCC16_WGMXCCGn1
    SolutionIndex: 63
    SolutionNameMin: Cijk_Alik_Bljk_BBS_BH_Bias_HA_S_SAV_UserArgs_MT16x16x256_MI16x16x1_SN_LDSB0_AFC1_AFEM1_AFEM1_ASEM1_CLR1_CADS0_DTLA1_DTLB1_DTVA0_DTVB0_EPS0_FDSI0_GRPM1_GRVWA8_GRVWB8_GSU1_GSUAMB_GSUC0_GSUWGMRR0_GLS0_ISA950_IU1_K1_LBSPPA1024_LBSPPB1024_LBSPPM0_LPA16_LPB16_LPM0_LRVW8_LWPMn1_MIAV1_MIWT1_1_MO40_NTn1_NTA1_NTB1_NTC1_NTD0_NTM0_NEPBS0_NLCA1_NLCB1_ONLL1_PGR2_PLR1_PKA1_SIA3_SS0_SU8_SUM0_SUS512_SPO1_SRVW0_SSO0_SVW1_SK0_SKXCCM0_TLDS1_ULSGRO0_USL1_UIOFGRO0_USFGROn1_VSn1_VWA1_VWB1_WSGRA0_WSGRB0_WS64_WG16_4_4_WGM1_WGMXCC16_WGMXCCGn1
    SolutionIndex: 64
    SolutionNameMin: Cijk_Alik_Bljk_BBS_BH_Bias_HA_S_SAV_UserArgs_MT16x16x256_MI16x16x1_SN_LDSB0_AFC1_AFEM1_AFEM1_ASEM1_CLR1_CADS0_DTLA1_DTLB1_DTVA0_DTVB0_EPS0_FDSI0_GRPM1_GRVWA8_GRVWB8_GSU1_GSUAMB_GSUC0_GSUWGMRR0_GLS0_ISA950_IU1_K1_LBSPPA1024_LBSPPB1024_LBSPPM0_LPA16_LPB16_LPM0_LRVW8_LWPMn1_MIAV1_MIWT1_1_MO40_NTn1_NTA4_NTB0_NTC3_NTD2_NTM0_NEPBS0_NLCA1_NLCB1_ONLL1_PGR2_PLR1_PKA1_SIA3_SS1_SU8_SUM0_SUS512_SPO1_SRVW0_SSO0_SVW1_SK0_SKXCCM0_TLDS1_ULSGRO0_USL1_UIOFGRO0_USFGRO1_VSn1_VWA1_VWB1_WSGRA0_WSGRB0_WS64_WG16_4_4_WGM0_WGMXCC16_WGMXCCGn1
    SolutionIndex: 65
    SolutionNameMin: Cijk_Alik_Bljk_BBS_BH_Bias_HA_S_SAV_UserArgs_MT16x16x256_MI16x16x1_SN_LDSB0_AFC1_AFEM1_AFEM1_ASEM1_CLR0_CADS0_DTLA1_DTLB1_DTVA0_DTVB0_EPS0_FDSI0_GRPM1_GRVWA8_GRVWB8_GSU1_GSUAMB_GSUC0_GSUWGMRR0_GLS0_ISA950_IU1_K1_LBSPPA1024_LBSPPB1024_LBSPPM0_LPA16_LPB16_LPM0_LRVW8_LWPMn1_MIAV1_MIWT1_1_MO40_NTn1_NTA6_NTB1_NTC3_NTD1_NTM0_NEPBS0_NLCA1_NLCB1_ONLL1_PGR2_PLR1_PKA1_SIA3_SS1_SU8_SUM0_SUS512_SPO0_SRVW0_SSO0_SVW1_SK0_SKXCCM0_TLDS1_ULSGRO0_USL1_UIOFGRO0_USFGRO1_VSn1_VWA1_VWB1_WSGRA0_WSGRB0_WS64_WG16_4_4_WGM1_WGMXCC1_WGMXCCGn1
    SolutionIndex: 66
    SolutionNameMin: Cijk_Alik_Bljk_BBS_BH_Bias_HA_S_SAV_UserArgs_MT16x32x256_MI16x16x1_SN_LDSB0_AFC1_AFEM1_AFEM1_ASEM1_CLR1_CADS0_DTLA1_DTLB1_DTVA0_DTVB0_EPS0_FDSI0_GRPM1_GRVWA8_GRVWB8_GSU1_GSUAMB_GSUC0_GSUWGMRR0_GLS0_ISA950_IU1_K1_LBSPPA1024_LBSPPB1024_LBSPPM0_LPA16_LPB16_LPM0_LRVW8_LWPMn1_MIAV0_MIWT1_2_MO40_NTn1_NTA4_NTB1_NTC0_NTD2_NTM0_NEPBS16_NLCA1_NLCB1_ONLL1_PGR2_PLR1_PKA1_SIA3_SS1_SU8_SUM0_SUS512_SPO1_SRVW0_SSO0_SVW1_SK0_SKXCCM0_TLDS1_ULSGRO0_USL1_UIOFGRO0_USFGRO1_VSn1_VWA1_VWB2_WSGRA0_WSGRB0_WS64_WG16_4_4_WGM1_WGMXCC1_WGMXCCGn1
    SolutionIndex: 67
    SolutionNameMin: Cijk_Alik_Bljk_BBS_BH_Bias_HA_S_SAV_UserArgs_MT16x32x256_MI16x16x1_SN_LDSB0_AFC1_AFEM1_AFEM1_ASEM1_CLR1_CADS0_DTLA1_DTLB1_DTVA0_DTVB0_EPS0_FDSI0_GRPM1_GRVWA8_GRVWB8_GSU1_GSUAMB_GSUC0_GSUWGMRR0_GLS0_ISA950_IU1_K1_LBSPPA1024_LBSPPB1024_LBSPPM0_LPA16_LPB16_LPM0_LRVW8_LWPMn1_MIAV0_MIWT1_2_MO40_NTn1_NTA4_NTB1_NTC0_NTD1_NTM0_NEPBS2_NLCA1_NLCB1_ONLL1_PGR2_PLR1_PKA1_SIA3_SS1_SU8_SUM0_SUS512_SPO1_SRVW0_SSO0_SVW1_SK0_SKXCCM0_TLDS1_ULSGRO0_USL1_UIOFGRO0_USFGROn1_VSn1_VWA1_VWB2_WSGRA0_WSGRB0_WS64_WG16_4_4_WGM0_WGMXCC1_WGMXCCGn1
    SolutionIndex: 68
    SolutionNameMin: Cijk_Alik_Bljk_BBS_BH_Bias_HA_S_SAV_UserArgs_MT32x32x256_MI16x16x1_SN_LDSB0_AFC1_AFEM1_AFEM1_ASEM1_CLR1_CADS0_DTLA0_DTLB0_DTVA0_DTVB0_EPS0_FDSI0_GRPM1_GRVWA8_GRVWB8_GSU1_GSUAMB_GSUC0_GSUWGMRR0_GLS0_ISA950_IU1_K1_LBSPPA512_LBSPPB512_LBSPPM0_LPA16_LPB16_LPM0_LRVW8_LWPMn1_MIAV0_MIWT1_1_MO40_NTn1_NTA7_NTB1_NTC0_NTD1_NTM0_NEPBS14_NLCA1_NLCB1_ONLL1_PGR2_PLR1_PKA1_SIA3_SS1_SU8_SUM0_SUS512_SPO1_SRVW0_SSO1_SVW1_SK0_SKXCCM0_TLDS2_ULSGRO0_USL1_UIOFGRO0_USFGRO1_VSn1_VWA1_VWB1_WSGRA0_WSGRB0_WS64_WG32_8_1_WGM24_WGMXCC8_WGMXCCGn1
    SolutionIndex: 69
    SolutionNameMin: Cijk_Alik_Bljk_BBS_BH_Bias_HA_S_SAV_UserArgs_MT32x32x256_MI16x16x1_SN_LDSB0_AFC1_AFEM1_AFEM1_ASEM1_CLR1_CADS0_DTLA0_DTLB0_DTVA0_DTVB0_EPS0_FDSI0_GRPM1_GRVWA8_GRVWB8_GSU1_GSUAMB_GSUC0_GSUWGMRR0_GLS0_ISA950_IU1_K1_LBSPPA512_LBSPPB512_LBSPPM0_LPA16_LPB16_LPM0_LRVW8_LWPMn1_MIAV0_MIWT1_1_MO40_NTn1_NTA1_NTB0_NTC3_NTD1_NTM0_NEPBS0_NLCA1_NLCB1_ONLL1_PGR2_PLR1_PKA1_SIA3_SS1_SU8_SUM0_SUS512_SPO0_SRVW0_SSO1_SVW1_SK0_SKXCCM0_TLDS1_ULSGRO0_USL1_UIOFGRO0_USFGROn1_VSn1_VWA1_VWB1_WSGRA0_WSGRB0_WS64_WG32_8_1_WGM0_WGMXCC4_WGMXCCGn1
    SolutionIndex: 70
    SolutionNameMin: Cijk_Alik_Bljk_BBS_BH_Bias_HA_S_SAV_UserArgs_MT32x32x256_MI16x16x1_SN_LDSB0_AFC1_AFEM1_AFEM1_ASEM1_CLR0_CADS0_DTLA0_DTLB0_DTVA0_DTVB0_EPS0_FDSI0_GRPM1_GRVWA8_GRVWB8_GSU1_GSUAMB_GSUC0_GSUWGMRR0_GLS0_ISA950_IU1_K1_LBSPPA512_LBSPPB512_LBSPPM0_LPA16_LPB16_LPM0_LRVW8_LWPMn1_MIAV1_MIWT1_1_MO40_NTn1_NTA1_NTB0_NTC1_NTD1_NTM0_NEPBS8_NLCA1_NLCB1_ONLL1_PGR2_PLR1_PKA1_SIA3_SS1_SU8_SUM0_SUS512_SPO0_SRVW0_SSO0_SVW1_SK0_SKXCCM0_TLDS2_ULSGRO0_USL1_UIOFGRO0_USFGRO1_VSn1_VWA1_VWB1_WSGRA0_WSGRB0_WS64_WG32_8_1_WGM1_WGMXCC4_WGMXCCGn1
    SolutionIndex: 71
    SolutionNameMin: Cijk_Alik_Bljk_BBS_BH_Bias_HA_S_SAV_UserArgs_MT32x32x256_MI16x16x1_SN_LDSB0_AFC1_AFEM1_AFEM1_ASEM1_CLR1_CADS0_DTLA0_DTLB0_DTVA0_DTVB0_EPS0_FDSI0_GRPM1_GRVWA8_GRVWB8_GSU1_GSUAMB_GSUC0_GSUWGMRR0_GLS0_ISA950_IU1_K1_LBSPPA512_LBSPPB512_LBSPPM0_LPA16_LPB16_LPM0_LRVW8_LWPMn1_MIAV0_MIWT1_1_MO40_NTn1_NTA1_NTB0_NTC0_NTD1_NTM0_NEPBS14_NLCA1_NLCB1_ONLL1_PGR2_PLR1_PKA1_SIA3_SS1_SU8_SUM0_SUS512_SPO0_SRVW0_SSO0_SVW1_SK0_SKXCCM0_TLDS2_ULSGRO0_USL1_UIOFGRO0_USFGRO1_VSn1_VWA1_VWB1_WSGRA0_WSGRB0_WS64_WG32_8_1_WGM0_WGMXCC4_WGMXCCGn1
    SolutionIndex: 72
    SolutionNameMin: Cijk_Alik_Bljk_BBS_BH_Bias_HA_S_SAV_UserArgs_MT32x32x256_MI16x16x1_SN_LDSB0_AFC1_AFEM1_AFEM1_ASEM1_CLR1_CADS0_DTLA0_DTLB0_DTVA0_DTVB0_EPS0_FDSI0_GRPM1_GRVWA8_GRVWB8_GSU1_GSUAMB_GSUC0_GSUWGMRR0_GLS0_ISA950_IU1_K1_LBSPPA512_LBSPPB512_LBSPPM0_LPA16_LPB16_LPM0_LRVW8_LWPMn1_MIAV0_MIWT1_1_MO40_NTn1_NTA1_NTB0_NTC2_NTD1_NTM0_NEPBS8_NLCA1_NLCB1_ONLL1_PGR2_PLR1_PKA1_SIA3_SS1_SU8_SUM0_SUS512_SPO0_SRVW0_SSO0_SVW1_SK0_SKXCCM0_TLDS1_ULSGRO0_USL1_UIOFGRO0_USFGRO1_VSn1_VWA1_VWB1_WSGRA0_WSGRB0_WS64_WG32_8_1_WGM1_WGMXCC4_WGMXCCGn1
    SolutionIndex: 73
    SolutionNameMin: Cijk_Alik_Bljk_BBS_BH_Bias_HA_S_SAV_UserArgs_MT32x32x256_MI16x16x1_SN_LDSB0_AFC1_AFEM1_AFEM1_ASEM1_CLR1_CADS0_DTLA0_DTLB0_DTVA0_DTVB0_EPS0_FDSI0_GRPM1_GRVWA8_GRVWB8_GSU1_GSUAMB_GSUC0_GSUWGMRR0_GLS0_ISA950_IU1_K1_LBSPPA512_LBSPPB512_LBSPPM0_LPA16_LPB16_LPM0_LRVW8_LWPMn1_MIAV1_MIWT1_1_MO40_NTn1_NTA0_NTB1_NTC0_NTD1_NTM0_NEPBS8_NLCA1_NLCB1_ONLL1_PGR2_PLR1_PKA1_SIA3_SS1_SU8_SUM0_SUS512_SPO0_SRVW0_SSO0_SVW1_SK0_SKXCCM0_TLDS2_ULSGRO0_USL1_UIOFGRO0_USFGRO1_VSn1_VWA1_VWB1_WSGRA0_WSGRB0_WS64_WG32_8_1_WGM0_WGMXCC4_WGMXCCGn1
    SolutionIndex: 74
    SolutionNameMin: Cijk_Alik_Bljk_BBS_BH_Bias_HA_S_SAV_UserArgs_MT32x32x256_MI16x16x1_SN_LDSB0_AFC1_AFEM1_AFEM1_ASEM1_CLR1_CADS0_DTLA0_DTLB0_DTVA0_DTVB0_EPS0_FDSI0_GRPM1_GRVWA8_GRVWB8_GSU1_GSUAMB_GSUC0_GSUWGMRR0_GLS0_ISA950_IU1_K1_LBSPPA512_LBSPPB512_LBSPPM0_LPA16_LPB16_LPM0_LRVW8_LWPMn1_MIAV0_MIWT1_1_MO40_NTn1_NTA0_NTB0_NTC1_NTD1_NTM0_NEPBS0_NLCA1_NLCB1_ONLL1_PGR2_PLR1_PKA1_SIA3_SS1_SU8_SUM0_SUS512_SPO0_SRVW0_SSO0_SVW1_SK0_SKXCCM0_TLDS1_ULSGRO0_USL1_UIOFGRO0_USFGRO1_VSn1_VWA1_VWB1_WSGRA0_WSGRB0_WS64_WG32_8_1_WGM1_WGMXCC4_WGMXCCGn1
    SolutionIndex: 75
    SolutionNameMin: Cijk_Alik_Bljk_BBS_BH_Bias_HA_S_SAV_UserArgs_MT32x32x256_MI16x16x1_SN_LDSB0_AFC1_AFEM1_AFEM1_ASEM1_CLR0_CADS0_DTLA0_DTLB0_DTVA0_DTVB0_EPS0_FDSI0_GRPM1_GRVWA8_GRVWB8_GSU1_GSUAMB_GSUC0_GSUWGMRR0_GLS0_ISA950_IU1_K1_LBSPPA512_LBSPPB512_LBSPPM0_LPA16_LPB16_LPM0_LRVW8_LWPMn1_MIAV1_MIWT1_1_MO40_NTn1_NTA0_NTB1_NTC3_NTD1_NTM0_NEPBS16_NLCA1_NLCB1_ONLL1_PGR2_PLR1_PKA1_SIA3_SS1_SU8_SUM0_SUS512_SPO0_SRVW0_SSO0_SVW1_SK0_SKXCCM0_TLDS1_ULSGRO0_USL1_UIOFGRO0_USFGRO1_VSn1_VWA1_VWB1_WSGRA0_WSGRB0_WS64_WG32_8_1_WGM1_WGMXCC4_WGMXCCGn1
    SolutionIndex: 76
    SolutionNameMin: Cijk_Alik_Bljk_BBS_BH_Bias_HA_S_SAV_UserArgs_MT32x32x256_MI16x16x1_SN_LDSB0_AFC1_AFEM1_AFEM1_ASEM1_CLR0_CADS0_DTLA0_DTLB0_DTVA0_DTVB0_EPS0_FDSI0_GRPM1_GRVWA8_GRVWB8_GSU1_GSUAMB_GSUC0_GSUWGMRR0_GLS0_ISA950_IU1_K1_LBSPPA512_LBSPPB512_LBSPPM0_LPA16_LPB16_LPM0_LRVW8_LWPMn1_MIAV1_MIWT1_1_MO40_NTn1_NTA1_NTB1_NTC0_NTD0_NTM0_NEPBS4_NLCA1_NLCB1_ONLL1_PGR2_PLR1_PKA1_SIA3_SS1_SU8_SUM0_SUS512_SPO0_SRVW0_SSO0_SVW1_SK0_SKXCCM0_TLDS2_ULSGRO0_USL1_UIOFGRO0_USFGRO1_VSn1_VWA1_VWB1_WSGRA0_WSGRB0_WS64_WG32_8_1_WGM0_WGMXCC4_WGMXCCGn1
    SolutionIndex: 77
    SolutionNameMin: Cijk_Alik_Bljk_BBS_BH_Bias_HA_S_SAV_UserArgs_MT32x32x256_MI16x16x1_SN_LDSB0_AFC1_AFEM1_AFEM1_ASEM1_CLR1_CADS0_DTLA0_DTLB0_DTVA0_DTVB0_EPS0_FDSI0_GRPM1_GRVWA8_GRVWB8_GSU1_GSUAMB_GSUC0_GSUWGMRR0_GLS0_ISA950_IU1_K1_LBSPPA512_LBSPPB512_LBSPPM0_LPA16_LPB16_LPM0_LRVW8_LWPMn1_MIAV1_MIWT1_1_MO40_NTn1_NTA1_NTB0_NTC2_NTD0_NTM0_NEPBS0_NLCA1_NLCB1_ONLL1_PGR2_PLR1_PKA1_SIA3_SS1_SU8_SUM0_SUS512_SPO0_SRVW0_SSO0_SVW1_SK0_SKXCCM0_TLDS1_ULSGRO0_USL1_UIOFGRO0_USFGRO1_VSn1_VWA1_VWB1_WSGRA0_WSGRB0_WS64_WG32_8_1_WGM1_WGMXCC4_WGMXCCGn1
    SolutionIndex: 78
    SolutionNameMin: Cijk_Alik_Bljk_BBS_BH_Bias_HA_S_SAV_UserArgs_MT32x32x128_MI16x16x1_SN_LDSB0_AFC1_AFEM1_AFEM1_ASEM1_CLR1_CADS0_DTLA0_DTLB0_DTVA0_DTVB0_EPS0_FDSI0_GRPM1_GRVWA8_GRVWB4_GSU1_GSUAMB_GSUC0_GSUWGMRR0_GLS0_ISA950_IU1_K1_LBSPPA256_LBSPPB256_LBSPPM0_LPA16_LPB16_LPM0_LRVW8_LWPMn1_MIAV1_MIWT1_1_MO40_NTn1_NTA1_NTB0_NTC3_NTD1_NTM0_NEPBS8_NLCA1_NLCB1_ONLL1_PGR2_PLR1_PKA1_SIA3_SS1_SU8_SUM0_SUS256_SPO0_SRVW0_SSO0_SVW1_SK0_SKXCCM0_TLDS2_ULSGRO0_USL1_UIOFGRO0_USFGRO1_VSn1_VWA1_VWB1_WSGRA0_WSGRB0_WS64_WG32_8_1_WGM0_WGMXCC4_WGMXCCGn1
    SolutionIndex: 79
    SolutionNameMin: Cijk_Alik_Bljk_BBS_BH_Bias_HA_S_SAV_UserArgs_MT32x32x128_MI16x16x1_SN_LDSB0_AFC1_AFEM1_AFEM1_ASEM1_CLR0_CADS0_DTLA0_DTLB0_DTVA0_DTVB0_EPS0_FDSI0_GRPM1_GRVWA8_GRVWB4_GSU1_GSUAMB_GSUC0_GSUWGMRR0_GLS0_ISA950_IU1_K1_LBSPPA256_LBSPPB256_LBSPPM0_LPA16_LPB16_LPM0_LRVW8_LWPMn1_MIAV1_MIWT1_1_MO40_NTn1_NTA1_NTB1_NTC2_NTD1_NTM0_NEPBS12_NLCA1_NLCB1_ONLL1_PGR2_PLR1_PKA1_SIA3_SS1_SU16_SUM0_SUS256_SPO0_SRVW0_SSO0_SVW1_SK0_SKXCCM0_TLDS1_ULSGRO0_USL1_UIOFGRO0_USFGRO0_VSn1_VWA1_VWB1_WSGRA0_WSGRB0_WS64_WG32_8_1_WGM4_WGMXCC1_WGMXCCGn1
    SolutionIndex: 80
    SolutionNameMin: Cijk_Alik_Bljk_BBS_BH_Bias_HA_S_SAV_UserArgs_MT32x32x128_MI16x16x1_SN_LDSB0_AFC1_AFEM1_AFEM1_ASEM1_CLR0_CADS0_DTLA0_DTLB0_DTVA0_DTVB0_EPS0_FDSI0_GRPM1_GRVWA8_GRVWB4_GSU1_GSUAMB_GSUC0_GSUWGMRR0_GLS0_ISA950_IU1_K1_LBSPPA256_LBSPPB256_LBSPPM0_LPA16_LPB16_LPM0_LRVW8_LWPMn1_MIAV1_MIWT1_1_MO40_NTn1_NTA1_NTB1_NTC0_NTD0_NTM0_NEPBS12_NLCA1_NLCB1_ONLL1_PGR2_PLR1_PKA1_SIA3_SS1_SU8_SUM0_SUS256_SPO0_SRVW0_SSO0_SVW1_SK0_SKXCCM0_TLDS1_ULSGRO0_USL1_UIOFGRO0_USFGRO1_VSn1_VWA1_VWB1_WSGRA0_WSGRB0_WS64_WG32_8_1_WGM4_WGMXCC1_WGMXCCGn1
    SolutionIndex: 81
    SolutionNameMin: Cijk_Alik_Bljk_BBS_BH_Bias_HA_S_SAV_UserArgs_MT32x32x128_MI16x16x1_SN_LDSB0_AFC1_AFEM1_AFEM1_ASEM1_CLR1_CADS0_DTLA0_DTLB0_DTVA0_DTVB0_EPS0_FDSI0_GRPM1_GRVWA8_GRVWB4_GSU1_GSUAMB_GSUC0_GSUWGMRR0_GLS0_ISA950_IU1_K1_LBSPPA256_LBSPPB256_LBSPPM0_LPA16_LPB16_LPM0_LRVW8_LWPMn1_MIAV0_MIWT1_1_MO40_NTn1_NTA1_NTB0_NTC2_NTD0_NTM0_NEPBS0_NLCA1_NLCB1_ONLL1_PGR2_PLR1_PKA1_SIA3_SS1_SU8_SUM0_SUS256_SPO0_SRVW0_SSO0_SVW1_SK0_SKXCCM0_TLDS2_ULSGRO0_USL1_UIOFGRO0_USFGRO0_VSn1_VWA1_VWB1_WSGRA0_WSGRB0_WS64_WG32_8_1_WGM4_WGMXCC1_WGMXCCGn1
    SolutionIndex: 82
    SolutionNameMin: Cijk_Alik_Bljk_BBS_BH_Bias_HA_S_SAV_UserArgs_MT32x32x64_MI16x16x1_SN_LDSB0_AFC1_AFEM1_AFEM1_ASEM1_CLR1_CADS0_DTLA1_DTLB1_DTVA0_DTVB0_EPS0_FDSI0_GRPM1_GRVWA8_GRVWB8_GSU1_GSUAMB_GSUC0_GSUWGMRR0_GLS0_ISA950_IU1_K1_LBSPPA1024_LBSPPB1024_LBSPPM0_LPA16_LPB16_LPM0_LRVW8_LWPMn1_MIAV0_MIWT1_1_MO40_NTn1_NTA2_NTB2_NTC2_NTD4_NTM0_NEPBS0_NLCA1_NLCB1_ONLL1_PGR2_PLR1_PKA1_SIA3_SS1_SU8_SUM0_SUS128_SPO1_SRVW0_SSO1_SVW1_SK0_SKXCCM0_TLDS1_ULSGRO0_USL1_UIOFGRO0_USFGRO1_VSn1_VWA1_VWB1_WSGRA0_WSGRB0_WS64_WG32_8_1_WGM4_WGMXCC1_WGMXCCGn1
    SolutionIndex: 83
    SolutionNameMin: Cijk_Alik_Bljk_BBS_BH_Bias_HA_S_SAV_UserArgs_MT32x32x128_MI16x16x1_SN_LDSB0_AFC1_AFEM1_AFEM1_ASEM1_CLR1_CADS0_DTLA0_DTLB0_DTVA0_DTVB0_EPS0_FDSI0_GRPM1_GRVWA8_GRVWB4_GSU1_GSUAMB_GSUC0_GSUWGMRR0_GLS0_ISA950_IU1_K1_LBSPPA256_LBSPPB256_LBSPPM0_LPA16_LPB16_LPM0_LRVW8_LWPMn1_MIAV0_MIWT1_1_MO40_NTn1_NTA1_NTB1_NTC2_NTD5_NTM0_NEPBS12_NLCA1_NLCB1_ONLL1_PGR2_PLR1_PKA1_SIA3_SS1_SU16_SUM0_SUS256_SPO0_SRVW0_SSO1_SVW1_SK0_SKXCCM0_TLDS2_ULSGRO0_USL1_UIOFGRO0_USFGRO0_VSn1_VWA1_VWB1_WSGRA0_WSGRB0_WS64_WG32_8_1_WGM24_WGMXCC4_WGMXCCGn1
    SolutionIndex: 84
    SolutionNameMin: Cijk_Alik_Bljk_BBS_BH_Bias_HA_S_SAV_UserArgs_MT32x32x64_MI16x16x1_SN_LDSB0_AFC1_AFEM1_AFEM1_ASEM1_CLR0_CADS0_DTLA1_DTLB1_DTVA0_DTVB0_EPS0_FDSI0_GRPM1_GRVWA8_GRVWB8_GSU1_GSUAMB_GSUC0_GSUWGMRR0_GLS0_ISA950_IU1_K1_LBSPPA1024_LBSPPB1024_LBSPPM0_LPA16_LPB16_LPM0_LRVW8_LWPMn1_MIAV1_MIWT1_1_MO40_NTn1_NTA3_NTB2_NTC3_NTD0_NTM0_NEPBS12_NLCA1_NLCB1_ONLL1_PGR2_PLR1_PKA1_SIA3_SS1_SU8_SUM0_SUS128_SPO1_SRVW0_SSO0_SVW1_SK0_SKXCCM0_TLDS1_ULSGRO0_USL1_UIOFGRO0_USFGRO1_VSn1_VWA1_VWB1_WSGRA0_WSGRB0_WS64_WG32_8_1_WGM1_WGMXCC4_WGMXCCGn1
    SolutionIndex: 85
    SolutionNameMin: Cijk_Alik_Bljk_BBS_BH_Bias_HA_S_SAV_UserArgs_MT32x32x128_MI16x16x1_SN_LDSB0_AFC1_AFEM1_AFEM1_ASEM1_CLR1_CADS0_DTLA0_DTLB0_DTVA0_DTVB0_EPS0_FDSI0_GRPM1_GRVWA8_GRVWB4_GSU1_GSUAMB_GSUC0_GSUWGMRR0_GLS0_ISA950_IU1_K1_LBSPPA256_LBSPPB256_LBSPPM0_LPA16_LPB16_LPM0_LRVW8_LWPMn1_MIAV1_MIWT1_1_MO40_NTn1_NTA0_NTB0_NTC0_NTD0_NTM0_NEPBS14_NLCA1_NLCB1_ONLL1_PGR2_PLR1_PKA1_SIA3_SS1_SU16_SUM0_SUS256_SPO0_SRVW0_SSO0_SVW1_SK0_SKXCCM0_TLDS1_ULSGRO0_USL1_UIOFGRO0_USFGRO1_VSn1_VWA1_VWB1_WSGRA0_WSGRB0_WS64_WG32_8_1_WGM48_WGMXCC1_WGMXCCGn1
    SolutionIndex: 86
    SolutionNameMin: Cijk_Alik_Bljk_BBS_BH_Bias_HA_S_SAV_UserArgs_MT32x32x64_MI16x16x1_SN_LDSB0_AFC1_AFEM1_AFEM1_ASEM1_CLR1_CADS0_DTLA1_DTLB1_DTVA0_DTVB0_EPS0_FDSI0_GRPM1_GRVWA8_GRVWB8_GSU1_GSUAMB_GSUC0_GSUWGMRR0_GLS0_ISA950_IU1_K1_LBSPPA1024_LBSPPB1024_LBSPPM0_LPA16_LPB16_LPM0_LRVW8_LWPMn1_MIAV0_MIWT1_1_MO40_NTn1_NTA3_NTB3_NTC3_NTD0_NTM0_NEPBS0_NLCA1_NLCB1_ONLL1_PGR2_PLR1_PKA1_SIA3_SS1_SU8_SUM0_SUS128_SPO1_SRVW0_SSO1_SVW1_SK0_SKXCCM0_TLDS1_ULSGRO0_USL1_UIOFGRO0_USFGRO1_VSn1_VWA1_VWB1_WSGRA0_WSGRB0_WS64_WG32_8_1_WGM1_WGMXCC4_WGMXCCGn1
    SolutionIndex: 87
    SolutionNameMin: Cijk_Alik_Bljk_BBS_BH_Bias_HA_S_SAV_UserArgs_MT32x32x64_MI16x16x1_SN_LDSB0_AFC1_AFEM1_AFEM1_ASEM1_CLR0_CADS0_DTLA1_DTLB1_DTVA0_DTVB0_EPS0_FDSI0_GRPM1_GRVWA8_GRVWB8_GSU1_GSUAMB_GSUC0_GSUWGMRR0_GLS0_ISA950_IU1_K1_LBSPPA1024_LBSPPB1024_LBSPPM0_LPA16_LPB16_LPM0_LRVW8_LWPMn1_MIAV0_MIWT1_1_MO40_NTn1_NTA1_NTB0_NTC0_NTD1_NTM0_NEPBS10_NLCA1_NLCB1_ONLL1_PGR2_PLR1_PKA1_SIA3_SS1_SU8_SUM0_SUS128_SPO1_SRVW0_SSO0_SVW1_SK0_SKXCCM0_TLDS1_ULSGRO0_USL1_UIOFGRO0_USFGRO1_VSn1_VWA1_VWB1_WSGRA0_WSGRB0_WS64_WG32_8_1_WGM1_WGMXCC4_WGMXCCGn1
    SolutionIndex: 88
    SolutionNameMin: Cijk_Alik_Bljk_BBS_BH_Bias_HA_S_SAV_UserArgs_MT32x32x64_MI16x16x1_SN_LDSB0_AFC1_AFEM1_AFEM1_ASEM1_CLR1_CADS0_DTLA1_DTLB1_DTVA0_DTVB0_EPS0_FDSI0_GRPM1_GRVWA8_GRVWB8_GSU1_GSUAMB_GSUC0_GSUWGMRR0_GLS0_ISA950_IU1_K1_LBSPPA1024_LBSPPB1024_LBSPPM0_LPA16_LPB16_LPM0_LRVW8_LWPMn1_MIAV0_MIWT1_1_MO40_NTn1_NTA3_NTB1_NTC1_NTD0_NTM0_NEPBS12_NLCA1_NLCB1_ONLL1_PGR2_PLR1_PKA1_SIA3_SS1_SU0_SUM0_SUS0_SPO1_SRVW0_SSO0_SVW1_SK0_SKXCCM0_TLDS1_ULSGRO0_USL1_UIOFGRO0_USFGRO0_VSn1_VWA1_VWB1_WSGRA0_WSGRB0_WS64_WG32_8_1_WGM1_WGMXCC4_WGMXCCGn1
    SolutionIndex: 89
    SolutionNameMin: Cijk_Alik_Bljk_BBS_BH_Bias_HA_S_SAV_UserArgs_MT32x32x64_MI16x16x1_SN_LDSB0_AFC1_AFEM1_AFEM1_ASEM1_CLR1_CADS0_DTLA1_DTLB1_DTVA0_DTVB0_EPS0_FDSI0_GRPM1_GRVWA8_GRVWB8_GSU1_GSUAMB_GSUC0_GSUWGMRR0_GLS0_ISA950_IU1_K1_LBSPPA1024_LBSPPB1024_LBSPPM0_LPA16_LPB16_LPM0_LRVW8_LWPMn1_MIAV0_MIWT1_1_MO40_NTn1_NTA2_NTB1_NTC1_NTD1_NTM0_NEPBS16_NLCA1_NLCB1_ONLL1_PGR2_PLR1_PKA1_SIA3_SS1_SU8_SUM0_SUS128_SPO1_SRVW0_SSO0_SVW1_SK0_SKXCCM0_TLDS1_ULSGRO0_USL1_UIOFGRO0_USFGRO1_VSn1_VWA1_VWB1_WSGRA0_WSGRB0_WS64_WG32_8_1_WGM0_WGMXCC4_WGMXCCGn1
    SolutionIndex: 90
    SolutionNameMin: Cijk_Alik_Bljk_BBS_BH_Bias_HA_S_SAV_UserArgs_MT32x32x64_MI16x16x1_SN_LDSB0_AFC1_AFEM1_AFEM1_ASEM1_CLR1_CADS0_DTLA1_DTLB1_DTVA0_DTVB0_EPS0_FDSI0_GRPM1_GRVWA8_GRVWB8_GSU1_GSUAMB_GSUC0_GSUWGMRR0_GLS0_ISA950_IU1_K1_LBSPPA1024_LBSPPB1024_LBSPPM0_LPA16_LPB16_LPM0_LRVW8_LWPMn1_MIAV0_MIWT1_1_MO40_NTn1_NTA3_NTB3_NTC3_NTD0_NTM0_NEPBS4_NLCA1_NLCB1_ONLL1_PGR2_PLR1_PKA1_SIA3_SS1_SU0_SUM0_SUS0_SPO1_SRVW0_SSO0_SVW1_SK0_SKXCCM0_TLDS1_ULSGRO0_USL1_UIOFGRO0_USFGROn1_VSn1_VWA1_VWB1_WSGRA0_WSGRB0_WS64_WG32_8_1_WGM0_WGMXCC4_WGMXCCGn1
    SolutionIndex: 91
    SolutionNameMin: Cijk_Alik_Bljk_BBS_BH_Bias_HA_S_SAV_UserArgs_MT64x16x64_MI16x16x1_SN_LDSB0_AFC1_AFEM1_AFEM1_ASEM1_CLR0_CADS0_DTLA1_DTLB1_DTVA0_DTVB0_EPS0_FDSI0_GRPM1_GRVWA8_GRVWB2_GSU1_GSUAMB_GSUC0_GSUWGMRR0_GLS0_ISA950_IU1_K1_LBSPPA1024_LBSPPB256_LBSPPM0_LPA16_LPB16_LPM0_LRVW8_LWPMn1_MIAV1_MIWT1_1_MO40_NTn1_NTA1_NTB1_NTC6_NTD0_NTM0_NEPBS4_NLCA1_NLCB1_ONLL1_PGR2_PLR1_PKA1_SIA3_SS1_SU16_SUM0_SUS256_SPO0_SRVW0_SSO0_SVW1_SK0_SKXCCM0_TLDS1_ULSGRO0_USL1_UIOFGRO0_USFGRO0_VSn1_VWA1_VWB1_WSGRA0_WSGRB0_WS64_WG64_4_1_WGM1_WGMXCC4_WGMXCCGn1
    SolutionIndex: 92
    SolutionNameMin: Cijk_Alik_Bljk_BBS_BH_Bias_HA_S_SAV_UserArgs_MT32x64x64_MI16x16x1_SN_LDSB0_AFC1_AFEM1_AFEM1_ASEM1_CLR1_CADS0_DTLA1_DTLB1_DTVA0_DTVB0_EPS0_FDSI0_GRPM1_GRVWA2_GRVWB8_GSU1_GSUAMB_GSUC0_GSUWGMRR0_GLS0_ISA950_IU1_K1_LBSPPA256_LBSPPB1024_LBSPPM0_LPA16_LPB16_LPM0_LRVW8_LWPMn1_MIAV0_MIWT2_1_MO40_NTn1_NTA0_NTB0_NTC1_NTD4_NTM0_NEPBS14_NLCA1_NLCB1_ONLL1_PGR2_PLR1_PKA1_SIA3_SS0_SU16_SUM0_SUS128_SPO1_SRVW0_SSO1_SVW8_SK0_SKXCCM0_TLDS1_ULSGRO0_USL1_UIOFGRO0_USFGRO0_VSn1_VWA2_VWB1_WSGRA0_WSGRB0_WS64_WG16_16_1_WGM0_WGMXCC4_WGMXCCGn1
    SolutionIndex: 93
    SolutionNameMin: Cijk_Alik_Bljk_BBS_BH_Bias_HA_S_SAV_UserArgs_MT64x32x64_MI16x16x1_SN_LDSB0_AFC1_AFEM1_AFEM1_ASEM1_CLR1_CADS0_DTLA1_DTLB1_DTVA0_DTVB0_EPS0_FDSI0_GRPM1_GRVWA8_GRVWB2_GSU1_GSUAMB_GSUC0_GSUWGMRR0_GLS0_ISA950_IU1_K1_LBSPPA1024_LBSPPB256_LBSPPM0_LPA16_LPB16_LPM0_LRVW8_LWPMn1_MIAV0_MIWT1_2_MO40_NTn1_NTA3_NTB1_NTC0_NTD1_NTM0_NEPBS10_NLCA1_NLCB1_ONLL1_PGR2_PLR1_PKA1_SIA3_SS1_SU8_SUM0_SUS128_SPO1_SRVW0_SSO0_SVW1_SK0_SKXCCM0_TLDS1_ULSGRO0_USL1_UIOFGRO0_USFGRO0_VSn1_VWA1_VWB2_WSGRA0_WSGRB0_WS64_WG64_4_1_WGM4_WGMXCC1_WGMXCCGn1
    SolutionIndex: 94
    SolutionNameMin: Cijk_Alik_Bljk_BBS_BH_Bias_HA_S_SAV_UserArgs_MT32x64x64_MI16x16x1_SN_LDSB0_AFC1_AFEM1_AFEM1_ASEM1_CLR0_CADS0_DTLA1_DTLB1_DTVA0_DTVB0_EPS0_FDSI0_GRPM1_GRVWA2_GRVWB8_GSU1_GSUAMB_GSUC0_GSUWGMRR0_GLS0_ISA950_IU1_K1_LBSPPA256_LBSPPB1024_LBSPPM0_LPA16_LPB16_LPM0_LRVW8_LWPMn1_MIAV0_MIWT2_1_MO40_NTn1_NTA1_NTB1_NTC1_NTD4_NTM0_NEPBS14_NLCA1_NLCB1_ONLL1_PGR2_PLR1_PKA1_SIA3_SS1_SU0_SUM0_SUS0_SPO1_SRVW0_SSO1_SVW2_SK0_SKXCCM0_TLDS1_ULSGRO0_USL1_UIOFGRO0_USFGRO0_VSn1_VWA2_VWB1_WSGRA0_WSGRB0_WS64_WG16_16_1_WGM8_WGMXCC4_WGMXCCGn1
    SolutionIndex: 95
    SolutionNameMin: Cijk_Alik_Bljk_BBS_BH_Bias_HA_S_SAV_UserArgs_MT64x32x64_MI16x16x1_SN_LDSB0_AFC1_AFEM1_AFEM1_ASEM1_CLR1_CADS0_DTLA1_DTLB1_DTVA0_DTVB0_EPS0_FDSI0_GRPM1_GRVWA8_GRVWB2_GSU1_GSUAMB_GSUC0_GSUWGMRR0_GLS0_ISA950_IU1_K1_LBSPPA1024_LBSPPB256_LBSPPM0_LPA16_LPB16_LPM0_LRVW8_LWPMn1_MIAV0_MIWT1_2_MO40_NTn1_NTA1_NTB2_NTC1_NTD5_NTM0_NEPBS12_NLCA1_NLCB1_ONLL1_PGR2_PLR1_PKA1_SIA3_SS1_SU16_SUM0_SUS128_SPO1_SRVW0_SSO0_SVW1_SK0_SKXCCM0_TLDS1_ULSGRO0_USL1_UIOFGRO0_USFGRO0_VSn1_VWA1_VWB2_WSGRA0_WSGRB0_WS64_WG64_4_1_WGM4_WGMXCC1_WGMXCCGn1
    SolutionIndex: 96
    SolutionNameMin: Cijk_Alik_Bljk_BBS_BH_Bias_HA_S_SAV_UserArgs_MT32x64x64_MI16x16x1_SN_LDSB0_AFC1_AFEM1_AFEM1_ASEM1_CLR0_CADS0_DTLA1_DTLB1_DTVA0_DTVB0_EPS0_FDSI0_GRPM1_GRVWA2_GRVWB8_GSU1_GSUAMB_GSUC0_GSUWGMRR0_GLS0_ISA950_IU1_K1_LBSPPA256_LBSPPB1024_LBSPPM0_LPA16_LPB16_LPM0_LRVW8_LWPMn1_MIAV0_MIWT2_1_MO40_NTn1_NTA3_NTB2_NTC3_NTD1_NTM0_NEPBS10_NLCA1_NLCB1_ONLL1_PGR2_PLR1_PKA1_SIA3_SS1_SU8_SUM0_SUS128_SPO1_SRVW0_SSO1_SVW2_SK0_SKXCCM0_TLDS1_ULSGRO0_USL1_UIOFGRO0_USFGRO0_VSn1_VWA2_VWB1_WSGRA0_WSGRB0_WS64_WG16_16_1_WGM4_WGMXCC1_WGMXCCGn1
    SolutionIndex: 97
    SolutionNameMin: Cijk_Alik_Bljk_BBS_BH_Bias_HA_S_SAV_UserArgs_MT32x64x64_MI16x16x1_SN_LDSB0_AFC1_AFEM1_AFEM1_ASEM1_CLR1_CADS0_DTLA1_DTLB1_DTVA0_DTVB0_EPS0_FDSI0_GRPM1_GRVWA2_GRVWB8_GSU1_GSUAMB_GSUC0_GSUWGMRR0_GLS0_ISA950_IU1_K1_LBSPPA256_LBSPPB1024_LBSPPM0_LPA16_LPB16_LPM0_LRVW8_LWPMn1_MIAV0_MIWT2_1_MO40_NTn1_NTA2_NTB3_NTC1_NTD0_NTM0_NEPBS0_NLCA1_NLCB1_ONLL1_PGR2_PLR1_PKA1_SIA3_SS1_SU8_SUM0_SUS128_SPO1_SRVW0_SSO1_SVW2_SK0_SKXCCM0_TLDS1_ULSGRO0_USL1_UIOFGRO0_USFGRO0_VSn1_VWA2_VWB1_WSGRA0_WSGRB0_WS64_WG16_16_1_WGM16_WGMXCC4_WGMXCCGn1
    SolutionIndex: 98
    SolutionNameMin: Cijk_Alik_Bljk_BBS_BH_Bias_HA_S_SAV_UserArgs_MT64x32x64_MI16x16x1_SN_LDSB0_AFC1_AFEM1_AFEM1_ASEM1_CLR0_CADS0_DTLA1_DTLB1_DTVA0_DTVB0_EPS0_FDSI0_GRPM1_GRVWA8_GRVWB2_GSU1_GSUAMB_GSUC0_GSUWGMRR0_GLS0_ISA950_IU1_K1_LBSPPA1024_LBSPPB256_LBSPPM0_LPA16_LPB16_LPM0_LRVW8_LWPMn1_MIAV0_MIWT1_2_MO40_NTn1_NTA1_NTB0_NTC1_NTD1_NTM0_NEPBS16_NLCA1_NLCB1_ONLL1_PGR2_PLR1_PKA1_SIA3_SS1_SU8_SUM0_SUS128_SPO1_SRVW0_SSO0_SVW1_SK0_SKXCCM0_TLDS1_ULSGRO0_USL1_UIOFGRO0_USFGRO0_VSn1_VWA1_VWB2_WSGRA0_WSGRB0_WS64_WG64_4_1_WGM24_WGMXCC4_WGMXCCGn1
    SolutionIndex: 99
    SolutionNameMin: Cijk_Alik_Bljk_BBS_BH_Bias_HA_S_SAV_UserArgs_MT64x80x64_MI16x16x1_SN_LDSB0_AFC1_AFEM1_AFEM1_ASEM1_CLR1_CADS0_DTLA1_DTLB1_DTVA0_DTVB0_EPS0_FDSI0_GRPM1_GRVWA2_GRVWB2_GSU1_GSUAMB_GSUC0_GSUWGMRR0_GLS0_ISA950_IU1_K1_LBSPPA256_LBSPPB256_LBSPPM0_LPA16_LPB16_LPM0_LRVW8_LWPMn1_MIAV1_MIWT1_5_MO40_NTn1_NTA3_NTB1_NTC1_NTD1_NTM0_NEPBS0_NLCA1_NLCB1_ONLL1_PGR2_PLR1_PKA1_SIA3_SS1_SU0_SUM0_SUS0_SPO0_SRVW0_SSO0_SVW1_SK0_SKXCCM0_TLDS1_ULSGRO0_USL1_UIOFGRO0_USFGRO0_VSn1_VWA1_VWB1_WSGRA0_WSGRB0_WS64_WG64_4_1_WGM0_WGMXCC4_WGMXCCGn1
    SolutionIndex: 100
    SolutionNameMin: Cijk_Alik_Bljk_BBS_BH_Bias_HA_S_SAV_UserArgs_MT32x96x64_MI16x16x1_SN_LDSB0_AFC1_AFEM1_AFEM1_ASEM1_CLR1_CADS0_DTLA1_DTLB1_DTVA0_DTVB0_EPS0_FDSI0_GRPM1_GRVWA8_GRVWB8_GSU1_GSUAMB_GSUC0_GSUWGMRR0_GLS0_ISA950_IU1_K1_LBSPPA1024_LBSPPB1024_LBSPPM0_LPA16_LPB16_LPM0_LRVW8_LWPMn1_MIAV0_MIWT1_3_MO40_NTn1_NTA1_NTB3_NTC1_NTD0_NTM0_NEPBS12_NLCA1_NLCB1_ONLL1_PGR2_PLR1_PKA1_SIA3_SS1_SU0_SUM0_SUS0_SPO1_SRVW0_SSO1_SVW1_SK0_SKXCCM0_TLDS1_ULSGRO0_USL1_UIOFGRO0_USFGRO0_VSn1_VWA1_VWB1_WSGRA0_WSGRB0_WS64_WG32_8_1_WGM24_WGMXCC4_WGMXCCGn1
    SolutionIndex: 101
    SolutionNameMin: Cijk_Alik_Bljk_BBS_BH_Bias_HA_S_SAV_UserArgs_MT128x64x64_MI16x16x1_SN_LDSB0_AFC1_AFEM1_AFEM1_ASEM1_CLR0_CADS0_DTLA1_DTLB1_DTVA0_DTVB0_EPS0_FDSI0_GRPM1_GRVWA8_GRVWB8_GSU1_GSUAMB_GSUC0_GSUWGMRR0_GLS0_ISA950_IU1_K1_LBSPPA1024_LBSPPB1024_LBSPPM0_LPA16_LPB16_LPM0_LRVW8_LWPMn1_MIAV0_MIWT8_1_MO40_NTn1_NTA0_NTB6_NTC2_NTD6_NTM0_NEPBS14_NLCA1_NLCB1_ONLL1_PGR2_PLR1_PKA1_SIA3_SS1_SU0_SUM0_SUS0_SPO0_SRVW0_SSO1_SVW8_SK0_SKXCCM0_TLDS1_ULSGRO0_USL1_UIOFGRO0_USFGROn1_VSn1_VWA8_VWB1_WSGRA0_WSGRB0_WS64_WG16_16_1_WGM0_WGMXCC8_WGMXCCGn1
    SolutionIndex: 102
    SolutionNameMin: Cijk_Alik_Bljk_BBS_BH_Bias_HA_S_SAV_UserArgs_MT160x64x64_MI16x16x1_SN_LDSB0_AFC1_AFEM1_AFEM1_ASEM1_CLR1_CADS0_DTLA1_DTLB1_DTVA0_DTVB0_EPS0_FDSI0_GRPM1_GRVWA8_GRVWB2_GSU1_GSUAMB_GSUC0_GSUWGMRR0_GLS0_ISA950_IU1_K1_LBSPPA1024_LBSPPB256_LBSPPM0_LPA16_LPB16_LPM0_LRVW8_LWPMn1_MIAV1_MIWT5_2_MO40_NTn1_NTA3_NTB5_NTC1_NTD5_NTM0_NEPBS0_NLCA1_NLCB1_ONLL1_PGR2_PLR1_PKA1_SIA3_SS1_SU8_SUM0_SUS128_SPO0_SRVW0_SSO0_SVW1_SK0_SKXCCM0_TLDS1_ULSGRO0_USL1_UIOFGRO0_USFGRO0_VSn1_VWA1_VWB2_WSGRA0_WSGRB0_WS64_WG32_8_1_WGM24_WGMXCC1_WGMXCCGn1
    SolutionIndex: 103
    SolutionNameMin: Cijk_Alik_Bljk_BBS_BH_Bias_HA_S_SAV_UserArgs_MT128x128x64_MI16x16x1_SN_LDSB0_AFC1_AFEM1_AFEM1_ASEM1_CLR0_CADS0_DTLA1_DTLB1_DTVA0_DTVB0_EPS0_FDSI0_GRPM1_GRVWA8_GRVWB8_GSU1_GSUAMB_GSUC0_GSUWGMRR0_GLS0_ISA950_IU1_K1_LBSPPA1024_LBSPPB1024_LBSPPM0_LPA16_LPB16_LPM0_LRVW8_LWPMn1_MIAV1_MIWT8_2_MO40_NTn1_NTA1_NTB3_NTC0_NTD4_NTM0_NEPBS0_NLCA1_NLCB1_ONLL1_PGR2_PLR1_PKA1_SIA3_SS1_SU0_SUM0_SUS0_SPO0_SRVW0_SSO0_SVW8_SK0_SKXCCM0_TLDS1_ULSGRO0_USL1_UIOFGRO0_USFGRO0_VSn1_VWA8_VWB2_WSGRA0_WSGRB0_WS64_WG16_16_1_WGM16_WGMXCC2_WGMXCCGn1
    SolutionIndex: 104
    SolutionNameMin: Cijk_Alik_Bljk_BBS_BH_Bias_HA_S_SAV_UserArgs_MT128x128x64_MI16x16x1_SN_LDSB0_AFC1_AFEM1_AFEM1_ASEM1_CLR1_CADS0_DTLA1_DTLB1_DTVA0_DTVB0_EPS0_FDSI0_GRPM1_GRVWA8_GRVWB8_GSU1_GSUAMB_GSUC0_GSUWGMRR0_GLS0_ISA950_IU1_K1_LBSPPA1024_LBSPPB1024_LBSPPM0_LPA16_LPB16_LPM0_LRVW8_LWPMn1_MIAV0_MIWT8_2_MO40_NTn1_NTA0_NTB6_NTC0_NTD6_NTM0_NEPBS10_NLCA1_NLCB1_ONLL1_PGR2_PLR1_PKA1_SIA3_SS1_SU0_SUM0_SUS0_SPO0_SRVW0_SSO1_SVW8_SK0_SKXCCM0_TLDS1_ULSGRO0_USL1_UIOFGRO0_USFGRO0_VSn1_VWA8_VWB2_WSGRA0_WSGRB0_WS64_WG16_16_1_WGM0_WGMXCC8_WGMXCCGn1
    SolutionIndex: 105
    SolutionNameMin: Cijk_Alik_Bljk_BBS_BH_Bias_HA_S_SAV_UserArgs_MT160x128x64_MI16x16x1_SN_LDSB0_AFC1_AFEM1_AFEM1_ASEM1_CLR1_CADS0_DTLA0_DTLB0_DTVA0_DTVB0_EPS0_FDSI0_GRPM1_GRVWA8_GRVWB8_GSU1_GSUAMB_GSUC0_GSUWGMRR0_GLS0_ISA950_IU1_K1_LBSPPA256_LBSPPB256_LBSPPM0_LPA16_LPB16_LPM0_LRVW8_LWPMn1_MIAV1_MIWT10_2_MO40_NTn1_NTA0_NTB4_NTC1_NTD5_NTM0_NEPBS0_NLCA1_NLCB1_ONLL1_PGR2_PLR1_PKA1_SIA3_SS1_SU0_SUM0_SUS0_SPO0_SRVW0_SSO0_SVW2_SK0_SKXCCM0_TLDS1_ULSGRO0_USL1_UIOFGRO0_USFGRO1_VSn1_VWA2_VWB2_WSGRA0_WSGRB0_WS64_WG16_16_1_WGM0_WGMXCC8_WGMXCCGn1
    SolutionIndex: 106
    SolutionNameMin: Cijk_Alik_Bljk_BBS_BH_Bias_HA_S_SAV_UserArgs_MT160x128x64_MI16x16x1_SN_LDSB0_AFC1_AFEM1_AFEM1_ASEM1_CLR0_CADS0_DTLA0_DTLB0_DTVA0_DTVB0_EPS0_FDSI0_GRPM1_GRVWA8_GRVWB8_GSU1_GSUAMB_GSUC0_GSUWGMRR0_GLS0_ISA950_IU1_K1_LBSPPA256_LBSPPB256_LBSPPM0_LPA16_LPB16_LPM0_LRVW8_LWPMn1_MIAV0_MIWT10_2_MO40_NTn1_NTA0_NTB5_NTC1_NTD5_NTM0_NEPBS0_NLCA1_NLCB1_ONLL1_PGR2_PLR1_PKA1_SIA3_SS1_SU0_SUM0_SUS0_SPO0_SRVW0_SSO0_SVW2_SK0_SKXCCM0_TLDS1_ULSGRO0_USL1_UIOFGRO0_USFGRO1_VSn1_VWA2_VWB2_WSGRA0_WSGRB0_WS64_WG16_16_1_WGM0_WGMXCC8_WGMXCCGn1
    SolutionIndex: 107
    SolutionNameMin: Cijk_Alik_Bljk_BBS_BH_Bias_HA_S_SAV_UserArgs_MT160x128x64_MI16x16x1_SN_LDSB0_AFC1_AFEM1_AFEM1_ASEM1_CLR0_CADS0_DTLA0_DTLB0_DTVA0_DTVB0_EPS0_FDSI0_GRPM1_GRVWA8_GRVWB8_GSU1_GSUAMB_GSUC0_GSUWGMRR0_GLS0_ISA950_IU1_K1_LBSPPA256_LBSPPB256_LBSPPM0_LPA16_LPB16_LPM0_LRVW8_LWPMn1_MIAV1_MIWT10_2_MO40_NTn1_NTA0_NTB4_NTC2_NTD7_NTM0_NEPBS0_NLCA1_NLCB1_ONLL1_PGR2_PLR1_PKA1_SIA3_SS1_SU0_SUM0_SUS0_SPO0_SRVW0_SSO0_SVW2_SK0_SKXCCM0_TLDS1_ULSGRO0_USL1_UIOFGRO0_USFGRO1_VSn1_VWA2_VWB2_WSGRA0_WSGRB0_WS64_WG16_16_1_WGM0_WGMXCC16_WGMXCCGn1
    SolutionIndex: 108
    SolutionNameMin: Cijk_Alik_Bljk_BBS_BH_Bias_HA_S_SAV_UserArgs_MT16x16x256_MI16x16x1_SN_LDSB0_AFC1_AFEM1_AFEM1_ASEM1_CLR1_CADS0_DTLA1_DTLB1_DTVA0_DTVB0_EPS0_FDSI0_GRPM1_GRVWA8_GRVWB8_GSU1_GSUAMB_GSUC0_GSUWGMRR0_GLS0_ISA950_IU1_K1_LBSPPA1024_LBSPPB1024_LBSPPM0_LPA16_LPB16_LPM0_LRVW8_LWPMn1_MIAV0_MIWT1_1_MO40_NTn1_NTA4_NTB0_NTC2_NTD1_NTM0_NEPBS0_NLCA1_NLCB1_ONLL1_PGR2_PLR1_PKA1_SIA3_SS0_SU0_SUM0_SUS0_SPO0_SRVW0_SSO1_SVW4_SK0_SKXCCM0_TLDS1_ULSGRO0_USL1_UIOFGRO0_USFGRO1_VSn1_VWA1_VWB1_WSGRA0_WSGRB0_WS64_WG16_4_1_WGM0_WGMXCC8_WGMXCCGn1
    SolutionIndex: 109
    SolutionNameMin: Cijk_Alik_Bljk_BBS_BH_Bias_HA_S_SAV_UserArgs_MT16x32x256_MI16x16x1_SN_LDSB0_AFC1_AFEM1_AFEM1_ASEM1_CLR1_CADS0_DTLA1_DTLB1_DTVA0_DTVB0_EPS0_FDSI0_GRPM1_GRVWA8_GRVWB8_GSU1_GSUAMB_GSUC0_GSUWGMRR0_GLS0_ISA950_IU1_K1_LBSPPA1024_LBSPPB1024_LBSPPM0_LPA16_LPB16_LPM0_LRVW8_LWPMn1_MIAV1_MIWT1_1_MO40_NTn1_NTA7_NTB1_NTC3_NTD0_NTM0_NEPBS12_NLCA1_NLCB1_ONLL1_PGR2_PLR1_PKA1_SIA3_SS1_SU0_SUM0_SUS0_SPO0_SRVW0_SSO0_SVW1_SK0_SKXCCM0_TLDS2_ULSGRO0_USL1_UIOFGRO0_USFGRO1_VSn1_VWA1_VWB1_WSGRA0_WSGRB0_WS64_WG16_8_1_WGM1_WGMXCC8_WGMXCCGn1
    SolutionIndex: 110
    SolutionNameMin: Cijk_Alik_Bljk_BBS_BH_Bias_HA_S_SAV_UserArgs_MT32x32x256_MI16x16x1_SN_LDSB1_AFC1_AFEM1_AFEM1_ASEM1_CLR1_CADS0_DTLA0_DTLB0_DTVA0_DTVB0_EPS0_FDSI0_GRPM1_GRVWA8_GRVWB8_GSU1_GSUAMB_GSUC0_GSUWGMRR0_GLS0_ISA950_IU1_K1_LBSPPA512_LBSPPB512_LBSPPM0_LPA16_LPB16_LPM0_LRVW8_LWPMn1_MIAV0_MIWT1_1_MO40_NTn1_NTA7_NTB2_NTC3_NTD1_NTM0_NEPBS0_NLCA1_NLCB1_ONLL1_PGR2_PLR1_PKA1_SIA3_SS1_SU8_SUM0_SUS512_SPO0_SRVW0_SSO0_SVW1_SK0_SKXCCM0_TLDS1_ULSGRO0_USL1_UIOFGRO0_USFGROn1_VSn1_VWA1_VWB1_WSGRA0_WSGRB0_WS64_WG32_8_1_WGM0_WGMXCC16_WGMXCCGn1
    SolutionIndex: 111
    SolutionNameMin: Cijk_Alik_Bljk_BBS_BH_Bias_HA_S_SAV_UserArgs_MT64x16x256_MI16x16x1_SN_LDSB0_AFC1_AFEM1_AFEM1_ASEM1_CLR0_CADS0_DTLA0_DTLB0_DTVA0_DTVB0_EPS0_FDSI0_GRPM1_GRVWA8_GRVWB8_GSU1_GSUAMB_GSUC0_GSUWGMRR0_GLS0_ISA950_IU1_K1_LBSPPA512_LBSPPB512_LBSPPM0_LPA16_LPB16_LPM0_LRVW8_LWPMn1_MIAV1_MIWT1_1_MO40_NTn1_NTA3_NTB2_NTC4_NTD1_NTM0_NEPBS10_NLCA1_NLCB1_ONLL1_PGR2_PLR1_PKA1_SIA3_SS1_SU8_SUM0_SUS512_SPO0_SRVW0_SSO0_SVW1_SK0_SKXCCM0_TLDS1_ULSGRO0_USL1_UIOFGRO0_USFGROn1_VSn1_VWA1_VWB1_WSGRA0_WSGRB0_WS64_WG64_4_1_WGM32_WGMXCC8_WGMXCCGn1
    SolutionIndex: 112
    SolutionNameMin: Cijk_Alik_Bljk_BBS_BH_Bias_HA_S_SAV_UserArgs_MT32x64x256_MI16x16x1_SN_LDSB1_AFC1_AFEM1_AFEM1_ASEM1_CLR1_CADS0_DTLA0_DTLB0_DTVA0_DTVB0_EPS0_FDSI0_GRPM1_GRVWA8_GRVWB8_GSU1_GSUAMB_GSUC0_GSUWGMRR0_GLS0_ISA950_IU1_K1_LBSPPA1024_LBSPPB512_LBSPPM0_LPA16_LPB16_LPM0_LRVW8_LWPMn1_MIAV0_MIWT2_1_MO40_NTn1_NTA0_NTB3_NTC3_NTD6_NTM0_NEPBS10_NLCA1_NLCB1_ONLL1_PGR2_PLR1_PKA1_SIA3_SS1_SU0_SUM0_SUS0_SPO1_SRVW0_SSO0_SVW2_SK0_SKXCCM0_TLDS2_ULSGRO0_USL1_UIOFGRO0_USFGRO1_VSn1_VWA2_VWB1_WSGRA0_WSGRB0_WS64_WG16_16_1_WGM1_WGMXCC1_WGMXCCGn1
    SolutionIndex: 113
    SolutionNameMin: Cijk_Alik_Bljk_BBS_BH_Bias_HA_S_SAV_UserArgs_MT32x64x256_MI16x16x1_SN_LDSB0_AFC1_AFEM1_AFEM1_ASEM1_CLR0_CADS0_DTLA1_DTLB1_DTVA0_DTVB0_EPS0_FDSI0_GRPM1_GRVWA8_GRVWB8_GSU1_GSUAMB_GSUC0_GSUWGMRR0_GLS0_ISA950_IU1_K1_LBSPPA1024_LBSPPB1024_LBSPPM0_LPA16_LPB16_LPM0_LRVW8_LWPMn1_MIAV0_MIWT2_1_MO40_NTn1_NTA7_NTB2_NTC0_NTD7_NTM0_NEPBS10_NLCA1_NLCB1_ONLL1_PGR2_PLR1_PKA1_SIA3_SS1_SU0_SUM0_SUS0_SPO1_SRVW0_SSO0_SVW2_SK0_SKXCCM0_TLDS2_ULSGRO0_USL1_UIOFGRO0_USFGROn1_VSn1_VWA2_VWB1_WSGRA0_WSGRB0_WS64_WG16_16_1_WGM0_WGMXCC16_WGMXCCGn1
    SolutionIndex: 114
    SolutionNameMin: Cijk_Alik_Bljk_BBS_BH_Bias_HA_S_SAV_UserArgs_MT64x32x256_MI16x16x1_SN_LDSB1_AFC1_AFEM1_AFEM1_ASEM1_CLR1_CADS0_DTLA0_DTLB0_DTVA0_DTVB0_EPS0_FDSI0_GRPM1_GRVWA8_GRVWB8_GSU1_GSUAMB_GSUC0_GSUWGMRR0_GLS0_ISA950_IU1_K1_LBSPPA1024_LBSPPB512_LBSPPM0_LPA16_LPB16_LPM0_LRVW8_LWPMn1_MIAV0_MIWT2_1_MO40_NTn1_NTA7_NTB0_NTC1_NTD7_NTM0_NEPBS12_NLCA1_NLCB1_ONLL1_PGR2_PLR1_PKA1_SIA3_SS1_SU0_SUM0_SUS0_SPO1_SRVW0_SSO0_SVW2_SK0_SKXCCM0_TLDS1_ULSGRO0_USL1_UIOFGRO0_USFGRO1_VSn1_VWA2_VWB1_WSGRA0_WSGRB0_WS64_WG32_8_1_WGM32_WGMXCC8_WGMXCCGn1
    SolutionIndex: 115
    SolutionNameMin: Cijk_Alik_Bljk_BBS_BH_Bias_HA_S_SAV_UserArgs_MT64x16x128_MI16x16x1_SN_LDSB0_AFC1_AFEM1_AFEM1_ASEM1_CLR1_CADS0_DTLA0_DTLB0_DTVA0_DTVB0_EPS0_FDSI0_GRPM1_GRVWA8_GRVWB8_GSU1_GSUAMB_GSUC0_GSUWGMRR0_GLS0_ISA950_IU1_K1_LBSPPA256_LBSPPB256_LBSPPM0_LPA16_LPB16_LPM0_LRVW8_LWPMn1_MIAV0_MIWT1_1_MO40_NTn1_NTA1_NTB3_NTC7_NTD4_NTM0_NEPBS4_NLCA1_NLCB1_ONLL1_PGR2_PLR1_PKA1_SIA3_SS1_SU8_SUM0_SUS256_SPO1_SRVW0_SSO1_SVW1_SK0_SKXCCM0_TLDS1_ULSGRO0_USL1_UIOFGRO0_USFGRO1_VSn1_VWA1_VWB1_WSGRA0_WSGRB0_WS64_WG64_4_1_WGM48_WGMXCC8_WGMXCCGn1
    SolutionIndex: 116
    SolutionNameMin: Cijk_Alik_Bljk_BBS_BH_Bias_HA_S_SAV_UserArgs_MT64x64x128_MI16x16x1_SN_LDSB0_AFC1_AFEM1_AFEM1_ASEM1_CLR0_CADS0_DTLA0_DTLB0_DTVA0_DTVB0_EPS0_FDSI0_GRPM1_GRVWA8_GRVWB8_GSU1_GSUAMB_GSUC0_GSUWGMRR0_GLS0_ISA950_IU1_K1_LBSPPA512_LBSPPB512_LBSPPM0_LPA16_LPB16_LPM0_LRVW8_LWPMn1_MIAV0_MIWT2_2_MO40_NTn1_NTA2_NTB0_NTC6_NTD6_NTM0_NEPBS12_NLCA1_NLCB1_ONLL1_PGR2_PLR1_PKA1_SIA3_SS1_SU8_SUM0_SUS256_SPO0_SRVW0_SSO0_SVW2_SK0_SKXCCM0_TLDS1_ULSGRO0_USL1_UIOFGRO0_USFGROn1_VSn1_VWA2_VWB2_WSGRA0_WSGRB0_WS64_WG32_8_1_WGM0_WGMXCC16_WGMXCCGn1
    SolutionIndex: 117
    SolutionNameMin: Cijk_Alik_Bljk_BBS_BH_Bias_HA_S_SAV_UserArgs_MT64x64x128_MI16x16x1_SN_LDSB0_AFC1_AFEM1_AFEM1_ASEM1_CLR0_CADS0_DTLA0_DTLB0_DTVA0_DTVB0_EPS0_FDSI0_GRPM1_GRVWA8_GRVWB8_GSU1_GSUAMB_GSUC0_GSUWGMRR0_GLS0_ISA950_IU1_K1_LBSPPA512_LBSPPB512_LBSPPM0_LPA16_LPB16_LPM0_LRVW8_LWPMn1_MIAV1_MIWT2_2_MO40_NTn1_NTA0_NTB2_NTC1_NTD5_NTM0_NEPBS0_NLCA1_NLCB1_ONLL1_PGR2_PLR1_PKA1_SIA3_SS1_SU8_SUM0_SUS256_SPO0_SRVW0_SSO0_SVW2_SK0_SKXCCM0_TLDS1_ULSGRO0_USL1_UIOFGRO0_USFGRO1_VSn1_VWA2_VWB2_WSGRA0_WSGRB0_WS64_WG32_8_1_WGM0_WGMXCC16_WGMXCCGn1
    SolutionIndex: 118
    SolutionNameMin: Cijk_Alik_Bljk_BBS_BH_Bias_HA_S_SAV_UserArgs_MT64x64x128_MI16x16x1_SN_LDSB0_AFC1_AFEM1_AFEM1_ASEM1_CLR1_CADS0_DTLA0_DTLB0_DTVA0_DTVB0_EPS0_FDSI0_GRPM1_GRVWA8_GRVWB8_GSU1_GSUAMB_GSUC0_GSUWGMRR0_GLS0_ISA950_IU1_K1_LBSPPA1024_LBSPPB256_LBSPPM0_LPA16_LPB16_LPM0_LRVW8_LWPMn1_MIAV0_MIWT4_1_MO40_NTn1_NTA1_NTB0_NTC2_NTD5_NTM0_NEPBS14_NLCA1_NLCB1_ONLL1_PGR2_PLR1_PKA1_SIA3_SS1_SU8_SUM0_SUS256_SPO0_SRVW0_SSO0_SVW4_SK0_SKXCCM0_TLDS1_ULSGRO0_USL1_UIOFGRO0_USFGROn1_VSn1_VWA4_VWB1_WSGRA0_WSGRB0_WS64_WG16_16_1_WGM1_WGMXCC16_WGMXCCGn1
    SolutionIndex: 119
    SolutionNameMin: Cijk_Alik_Bljk_BBS_BH_Bias_HA_S_SAV_UserArgs_MT64x64x128_MI16x16x1_SN_LDSB0_AFC1_AFEM1_AFEM1_ASEM1_CLR0_CADS0_DTLA0_DTLB0_DTVA0_DTVB0_EPS0_FDSI0_GRPM1_GRVWA8_GRVWB8_GSU1_GSUAMB_GSUC0_GSUWGMRR0_GLS0_ISA950_IU1_K1_LBSPPA512_LBSPPB512_LBSPPM0_LPA16_LPB16_LPM0_LRVW8_LWPMn1_MIAV0_MIWT2_2_MO40_NTn1_NTA1_NTB3_NTC2_NTD4_NTM0_NEPBS14_NLCA1_NLCB1_ONLL1_PGR2_PLR1_PKA1_SIA3_SS1_SU8_SUM0_SUS256_SPO0_SRVW0_SSO0_SVW2_SK0_SKXCCM0_TLDS1_ULSGRO0_USL1_UIOFGRO0_USFGRO1_VSn1_VWA2_VWB2_WSGRA0_WSGRB0_WS64_WG32_8_1_WGM24_WGMXCC8_WGMXCCGn1
    SolutionIndex: 120
    SolutionNameMin: Cijk_Alik_Bljk_BBS_BH_Bias_HA_S_SAV_UserArgs_MT64x64x128_MI16x16x1_SN_LDSB0_AFC1_AFEM1_AFEM1_ASEM1_CLR1_CADS0_DTLA0_DTLB0_DTVA0_DTVB0_EPS0_FDSI0_GRPM1_GRVWA8_GRVWB8_GSU1_GSUAMB_GSUC0_GSUWGMRR0_GLS0_ISA950_IU1_K1_LBSPPA1024_LBSPPB256_LBSPPM0_LPA16_LPB16_LPM0_LRVW8_LWPMn1_MIAV0_MIWT4_1_MO40_NTn1_NTA1_NTB0_NTC5_NTD5_NTM0_NEPBS10_NLCA1_NLCB1_ONLL1_PGR2_PLR1_PKA1_SIA3_SS1_SU8_SUM0_SUS256_SPO0_SRVW0_SSO0_SVW4_SK0_SKXCCM0_TLDS1_ULSGRO0_USL1_UIOFGRO0_USFGROn1_VSn1_VWA4_VWB1_WSGRA0_WSGRB0_WS64_WG16_16_1_WGM24_WGMXCC8_WGMXCCGn1
    SolutionIndex: 121
    SolutionNameMin: Cijk_Alik_Bljk_BBS_BH_Bias_HA_S_SAV_UserArgs_MT64x32x128_MI16x16x1_SN_LDSB0_AFC1_AFEM1_AFEM1_ASEM1_CLR1_CADS0_DTLA0_DTLB0_DTVA0_DTVB0_EPS0_FDSI0_GRPM1_GRVWA8_GRVWB8_GSU1_GSUAMB_GSUC0_GSUWGMRR0_GLS0_ISA950_IU1_K1_LBSPPA512_LBSPPB256_LBSPPM0_LPA16_LPB16_LPM0_LRVW8_LWPMn1_MIAV0_MIWT2_1_MO40_NTn1_NTA1_NTB0_NTC6_NTD5_NTM0_NEPBS8_NLCA1_NLCB1_ONLL1_PGR2_PLR1_PKA1_SIA3_SS1_SU8_SUM0_SUS512_SPO1_SRVW0_SSO1_SVW2_SK0_SKXCCM0_TLDS1_ULSGRO0_USL1_UIOFGRO0_USFGROn1_VSn1_VWA2_VWB1_WSGRA0_WSGRB0_WS64_WG32_8_1_WGM6_WGMXCC8_WGMXCCGn1
    SolutionIndex: 122
    SolutionNameMin: Cijk_Alik_Bljk_BBS_BH_Bias_HA_S_SAV_UserArgs_MT64x96x128_MI16x16x1_SN_LDSB0_AFC1_AFEM1_AFEM1_ASEM1_CLR1_CADS0_DTLA0_DTLB0_DTVA0_DTVB0_EPS0_FDSI0_GRPM1_GRVWA8_GRVWB8_GSU1_GSUAMB_GSUC0_GSUWGMRR0_GLS0_ISA950_IU1_K1_LBSPPA512_LBSPPB256_LBSPPM0_LPA16_LPB16_LPM0_LRVW8_LWPMn1_MIAV0_MIWT2_3_MO40_NTn1_NTA0_NTB0_NTC1_NTD5_NTM0_NEPBS14_NLCA1_NLCB1_ONLL1_PGR2_PLR1_PKA1_SIA3_SS1_SU8_SUM0_SUS256_SPO0_SRVW0_SSO0_SVW2_SK0_SKXCCM0_TLDS2_ULSGRO0_USL1_UIOFGRO0_USFGRO1_VSn1_VWA2_VWB1_WSGRA0_WSGRB0_WS64_WG32_8_1_WGM0_WGMXCC16_WGMXCCGn1
    SolutionIndex: 123
    SolutionNameMin: Cijk_Alik_Bljk_BBS_BH_Bias_HA_S_SAV_UserArgs_MT64x96x128_MI16x16x1_SN_LDSB0_AFC1_AFEM1_AFEM1_ASEM1_CLR1_CADS0_DTLA0_DTLB0_DTVA0_DTVB0_EPS0_FDSI0_GRPM1_GRVWA8_GRVWB8_GSU1_GSUAMB_GSUC0_GSUWGMRR0_GLS0_ISA950_IU1_K1_LBSPPA512_LBSPPB256_LBSPPM0_LPA16_LPB16_LPM0_LRVW8_LWPMn1_MIAV0_MIWT2_3_MO40_NTn1_NTA3_NTB3_NTC0_NTD4_NTM0_NEPBS16_NLCA1_NLCB1_ONLL1_PGR2_PLR1_PKA1_SIA3_SS1_SU0_SUM0_SUS0_SPO0_SRVW0_SSO0_SVW2_SK0_SKXCCM0_TLDS1_ULSGRO0_USL1_UIOFGRO0_USFGRO1_VSn1_VWA2_VWB1_WSGRA0_WSGRB0_WS64_WG32_8_1_WGM8_WGMXCC8_WGMXCCGn1
    SolutionIndex: 124
    SolutionNameMin: Cijk_Alik_Bljk_BBS_BH_Bias_HA_S_SAV_UserArgs_MT64x96x128_MI16x16x1_SN_LDSB0_AFC1_AFEM1_AFEM1_ASEM1_CLR0_CADS0_DTLA0_DTLB0_DTVA0_DTVB0_EPS0_FDSI0_GRPM1_GRVWA8_GRVWB8_GSU1_GSUAMB_GSUC0_GSUWGMRR0_GLS0_ISA950_IU1_K1_LBSPPA512_LBSPPB256_LBSPPM0_LPA16_LPB16_LPM0_LRVW8_LWPMn1_MIAV0_MIWT2_3_MO40_NTn1_NTA0_NTB1_NTC1_NTD5_NTM0_NEPBS12_NLCA1_NLCB1_ONLL1_PGR2_PLR1_PKA1_SIA3_SS1_SU8_SUM0_SUS256_SPO0_SRVW0_SSO0_SVW2_SK0_SKXCCM0_TLDS1_ULSGRO0_USL1_UIOFGRO0_USFGRO1_VSn1_VWA2_VWB1_WSGRA0_WSGRB0_WS64_WG32_8_1_WGM32_WGMXCC8_WGMXCCGn1
    SolutionIndex: 125
    SolutionNameMin: Cijk_Alik_Bljk_BBS_BH_Bias_HA_S_SAV_UserArgs_MT96x64x128_MI16x16x1_SN_LDSB0_AFC1_AFEM1_AFEM1_ASEM1_CLR1_CADS0_DTLA0_DTLB0_DTVA0_DTVB0_EPS0_FDSI0_GRPM1_GRVWA8_GRVWB8_GSU1_GSUAMB_GSUC0_GSUWGMRR0_GLS0_ISA950_IU1_K1_LBSPPA512_LBSPPB256_LBSPPM0_LPA16_LPB16_LPM0_LRVW8_LWPMn1_MIAV0_MIWT6_1_MO40_NTn1_NTA0_NTB0_NTC1_NTD4_NTM0_NEPBS14_NLCA1_NLCB1_ONLL1_PGR2_PLR1_PKA1_SIA3_SS1_SU8_SUM0_SUS256_SPO0_SRVW0_SSO0_SVW2_SK0_SKXCCM0_TLDS1_ULSGRO0_USL1_UIOFGRO0_USFGRO1_VSn1_VWA2_VWB1_WSGRA0_WSGRB0_WS64_WG16_16_1_WGM0_WGMXCC16_WGMXCCGn1
    SolutionIndex: 126
    SolutionNameMin: Cijk_Alik_Bljk_BBS_BH_Bias_HA_S_SAV_UserArgs_MT96x64x128_MI16x16x1_SN_LDSB0_AFC1_AFEM1_AFEM1_ASEM1_CLR1_CADS0_DTLA0_DTLB0_DTVA0_DTVB0_EPS0_FDSI0_GRPM1_GRVWA8_GRVWB8_GSU1_GSUAMB_GSUC0_GSUWGMRR0_GLS0_ISA950_IU1_K1_LBSPPA512_LBSPPB256_LBSPPM0_LPA16_LPB16_LPM0_LRVW8_LWPMn1_MIAV0_MIWT6_1_MO40_NTn1_NTA1_NTB2_NTC0_NTD5_NTM0_NEPBS0_NLCA1_NLCB1_ONLL1_PGR2_PLR1_PKA1_SIA3_SS1_SU8_SUM0_SUS256_SPO1_SRVW0_SSO0_SVW2_SK0_SKXCCM0_TLDS1_ULSGRO0_USL1_UIOFGRO0_USFGRO1_VSn1_VWA2_VWB1_WSGRA0_WSGRB0_WS64_WG16_16_1_WGM1_WGMXCC16_WGMXCCGn1
    SolutionIndex: 127
    SolutionNameMin: Cijk_Alik_Bljk_BBS_BH_Bias_HA_S_SAV_UserArgs_MT64x128x128_MI32x32x1_SN_LDSB1_AFC1_AFEM1_AFEM1_ASEM1_CLR1_CADS0_DTLA0_DTLB0_DTVA0_DTVB0_EPS0_FDSI0_GRPM1_GRVWA8_GRVWB8_GSU1_GSUAMB_GSUC0_GSUWGMRR0_GLS0_ISA950_IU1_K1_LBSPPA512_LBSPPB256_LBSPPM0_LPA8_LPB8_LPM0_LRVW8_LWPMn1_MIAV0_MIWT2_1_MO40_NTn1_NTA2_NTB0_NTC5_NTD4_NTM0_NEPBS0_NLCA1_NLCB1_ONLL1_PGR2_PLR1_PKA1_SIA3_SS1_SU0_SUM0_SUS0_SPO1_SRVW0_SSO0_SVW2_SK0_SKXCCM0_TLDS1_ULSGRO0_USL1_UIOFGRO0_USFGROn1_VSn1_VWA2_VWB1_WSGRA0_WSGRB0_WS64_WG32_8_1_WGM24_WGMXCC16_WGMXCCGn1
    SolutionIndex: 128
    SolutionNameMin: Cijk_Alik_Bljk_BBS_BH_Bias_HA_S_SAV_UserArgs_MT64x128x128_MI16x16x1_SN_LDSB1_AFC1_AFEM1_AFEM1_ASEM1_CLR1_CADS0_DTLA0_DTLB0_DTVA0_DTVB0_EPS0_FDSI0_GRPM1_GRVWA8_GRVWB8_GSU1_GSUAMB_GSUC0_GSUWGMRR0_GLS0_ISA950_IU1_K1_LBSPPA1024_LBSPPB512_LBSPPM0_LPA16_LPB16_LPM0_LRVW8_LWPMn1_MIAV0_MIWT4_2_MO40_NTn1_NTA2_NTB2_NTC7_NTD5_NTM0_NEPBS14_NLCA1_NLCB1_ONLL1_PGR2_PLR1_PKA1_SIA3_SS1_SU0_SUM0_SUS0_SPO1_SRVW0_SSO0_SVW4_SK0_SKXCCM0_TLDS1_ULSGRO0_USL1_UIOFGRO0_USFGROn1_VSn1_VWA4_VWB2_WSGRA0_WSGRB0_WS64_WG16_16_1_WGM8_WGMXCC8_WGMXCCGn1
    SolutionIndex: 129
    SolutionNameMin: Cijk_Alik_Bljk_BBS_BH_Bias_HA_S_SAV_UserArgs_MT64x128x128_MI16x16x1_SN_LDSB0_AFC1_AFEM1_AFEM1_ASEM1_CLR1_CADS0_DTLA0_DTLB0_DTVA0_DTVB0_EPS0_FDSI0_GRPM1_GRVWA8_GRVWB8_GSU1_GSUAMB_GSUC0_GSUWGMRR0_GLS0_ISA950_IU1_K1_LBSPPA1024_LBSPPB512_LBSPPM0_LPA16_LPB16_LPM0_LRVW8_LWPMn1_MIAV1_MIWT4_2_MO40_NTn1_NTA2_NTB2_NTC4_NTD5_NTM0_NEPBS12_NLCA1_NLCB1_ONLL1_PGR2_PLR1_PKA1_SIA3_SS1_SU8_SUM0_SUS256_SPO0_SRVW0_SSO0_SVW4_SK0_SKXCCM0_TLDS2_ULSGRO0_USL1_UIOFGRO0_USFGROn1_VSn1_VWA4_VWB2_WSGRA0_WSGRB0_WS64_WG16_16_1_WGM6_WGMXCC16_WGMXCCGn1
    SolutionIndex: 130
    SolutionNameMin: Cijk_Alik_Bljk_BBS_BH_Bias_HA_S_SAV_UserArgs_MT64x128x128_MI16x16x1_SN_LDSB0_AFC1_AFEM1_AFEM1_ASEM1_CLR1_CADS0_DTLA0_DTLB0_DTVA0_DTVB0_EPS0_FDSI0_GRPM1_GRVWA8_GRVWB8_GSU1_GSUAMB_GSUC0_GSUWGMRR0_GLS0_ISA950_IU1_K1_LBSPPA1024_LBSPPB512_LBSPPM0_LPA16_LPB16_LPM0_LRVW8_LWPMn1_MIAV1_MIWT4_2_MO40_NTn1_NTA0_NTB1_NTC7_NTD5_NTM0_NEPBS8_NLCA1_NLCB1_ONLL1_PGR2_PLR1_PKA1_SIA3_SS1_SU8_SUM0_SUS256_SPO0_SRVW0_SSO0_SVW4_SK0_SKXCCM0_TLDS1_ULSGRO0_USL1_UIOFGRO0_USFGROn1_VSn1_VWA4_VWB2_WSGRA0_WSGRB0_WS64_WG16_16_1_WGM32_WGMXCC8_WGMXCCGn1
    SolutionIndex: 131
    SolutionNameMin: Cijk_Alik_Bljk_BBS_BH_Bias_HA_S_SAV_UserArgs_MT64x160x128_MI16x16x1_SN_LDSB0_AFC1_AFEM1_AFEM1_ASEM1_CLR1_CADS0_DTLA0_DTLB0_DTVA0_DTVB0_EPS0_FDSI0_GRPM1_GRVWA8_GRVWB8_GSU1_GSUAMB_GSUC0_GSUWGMRR0_GLS0_ISA950_IU1_K1_LBSPPA512_LBSPPB256_LBSPPM0_LPA16_LPB16_LPM0_LRVW8_LWPMn1_MIAV0_MIWT2_5_MO40_NTn1_NTA3_NTB2_NTC0_NTD5_NTM0_NEPBS0_NLCA1_NLCB1_ONLL1_PGR2_PLR1_PKA1_SIA3_SS1_SU0_SUM0_SUS0_SPO0_SRVW0_SSO0_SVW2_SK0_SKXCCM0_TLDS1_ULSGRO0_USL1_UIOFGRO0_USFGRO1_VSn1_VWA2_VWB1_WSGRA0_WSGRB0_WS64_WG32_8_1_WGM48_WGMXCC16_WGMXCCGn1
    SolutionIndex: 132
    SolutionNameMin: Cijk_Alik_Bljk_BBS_BH_Bias_HA_S_SAV_UserArgs_MT64x160x128_MI16x16x1_SN_LDSB0_AFC1_AFEM1_AFEM1_ASEM1_CLR1_CADS0_DTLA0_DTLB0_DTVA0_DTVB0_EPS0_FDSI0_GRPM1_GRVWA8_GRVWB8_GSU1_GSUAMB_GSUC0_GSUWGMRR0_GLS0_ISA950_IU1_K1_LBSPPA512_LBSPPB256_LBSPPM0_LPA16_LPB16_LPM0_LRVW8_LWPMn1_MIAV0_MIWT2_5_MO40_NTn1_NTA3_NTB1_NTC1_NTD5_NTM0_NEPBS0_NLCA1_NLCB1_ONLL1_PGR2_PLR1_PKA1_SIA3_SS1_SU8_SUM0_SUS256_SPO0_SRVW0_SSO0_SVW2_SK0_SKXCCM0_TLDS2_ULSGRO0_USL1_UIOFGRO0_USFGRO1_VSn1_VWA2_VWB1_WSGRA0_WSGRB0_WS64_WG32_8_1_WGM48_WGMXCC8_WGMXCCGn1
    SolutionIndex: 133
    SolutionNameMin: Cijk_Alik_Bljk_BBS_BH_Bias_HA_S_SAV_UserArgs_MT96x96x128_MI16x16x1_SN_LDSB1_AFC1_AFEM1_AFEM1_ASEM1_CLR1_CADS0_DTLA0_DTLB0_DTVA0_DTVB0_EPS0_FDSI0_GRPM1_GRVWA8_GRVWB8_GSU1_GSUAMB_GSUC0_GSUWGMRR0_GLS0_ISA950_IU1_K1_LBSPPA256_LBSPPB256_LBSPPM0_LPA16_LPB16_LPM0_LRVW8_LWPMn1_MIAV1_MIWT3_3_MO40_NTn1_NTA0_NTB1_NTC0_NTD5_NTM0_NEPBS0_NLCA1_NLCB1_ONLL1_PGR2_PLR1_PKA1_SIA3_SS1_SU8_SUM0_SUS256_SPO0_SRVW0_SSO0_SVW1_SK0_SKXCCM0_TLDS1_ULSGRO0_USL1_UIOFGRO0_USFGRO1_VSn1_VWA1_VWB1_WSGRA0_WSGRB0_WS64_WG32_8_1_WGM0_WGMXCC16_WGMXCCGn1
    SolutionIndex: 134
    SolutionNameMin: Cijk_Alik_Bljk_BBS_BH_Bias_HA_S_SAV_UserArgs_MT64x160x128_MI16x16x1_SN_LDSB0_AFC1_AFEM1_AFEM1_ASEM1_CLR0_CADS0_DTLA0_DTLB0_DTVA0_DTVB0_EPS0_FDSI0_GRPM1_GRVWA8_GRVWB8_GSU1_GSUAMB_GSUC0_GSUWGMRR0_GLS0_ISA950_IU1_K1_LBSPPA512_LBSPPB256_LBSPPM0_LPA16_LPB16_LPM0_LRVW8_LWPMn1_MIAV0_MIWT2_5_MO40_NTn1_NTA3_NTB1_NTC1_NTD5_NTM0_NEPBS0_NLCA1_NLCB1_ONLL1_PGR2_PLR1_PKA1_SIA3_SS1_SU8_SUM0_SUS256_SPO0_SRVW0_SSO0_SVW2_SK0_SKXCCM0_TLDS1_ULSGRO0_USL1_UIOFGRO0_USFGROn1_VSn1_VWA2_VWB1_WSGRA0_WSGRB0_WS64_WG32_8_1_WGM24_WGMXCC16_WGMXCCGn1
    SolutionIndex: 135
    SolutionNameMin: Cijk_Alik_Bljk_BBS_BH_Bias_HA_S_SAV_UserArgs_MT64x160x128_MI16x16x1_SN_LDSB0_AFC1_AFEM1_AFEM1_ASEM1_CLR0_CADS0_DTLA0_DTLB0_DTVA0_DTVB0_EPS0_FDSI0_GRPM1_GRVWA8_GRVWB8_GSU1_GSUAMB_GSUC0_GSUWGMRR0_GLS0_ISA950_IU1_K1_LBSPPA512_LBSPPB256_LBSPPM0_LPA16_LPB16_LPM0_LRVW8_LWPMn1_MIAV0_MIWT2_5_MO40_NTn1_NTA0_NTB1_NTC1_NTD4_NTM0_NEPBS0_NLCA1_NLCB1_ONLL1_PGR2_PLR1_PKA1_SIA3_SS1_SU8_SUM0_SUS256_SPO0_SRVW0_SSO0_SVW2_SK0_SKXCCM0_TLDS1_ULSGRO0_USL1_UIOFGRO0_USFGRO1_VSn1_VWA2_VWB1_WSGRA0_WSGRB0_WS64_WG32_8_1_WGM0_WGMXCC8_WGMXCCGn1
    SolutionIndex: 136
    SolutionNameMin: Cijk_Alik_Bljk_BBS_BH_Bias_HA_S_SAV_UserArgs_MT64x192x128_MI16x16x1_SN_LDSB0_AFC1_AFEM1_AFEM1_ASEM1_CLR0_CADS0_DTLA0_DTLB0_DTVA0_DTVB0_EPS0_FDSI0_GRPM1_GRVWA8_GRVWB8_GSU1_GSUAMB_GSUC0_GSUWGMRR0_GLS0_ISA950_IU1_K1_LBSPPA1024_LBSPPB256_LBSPPM0_LPA16_LPB16_LPM0_LRVW8_LWPMn1_MIAV0_MIWT4_3_MO40_NTn1_NTA1_NTB3_NTC4_NTD6_NTM0_NEPBS12_NLCA1_NLCB1_ONLL1_PGR2_PLR1_PKA1_SIA3_SS1_SU0_SUM0_SUS0_SPO0_SRVW0_SSO0_SVW4_SK0_SKXCCM0_TLDS2_ULSGRO0_USL1_UIOFGRO0_USFGROn1_VSn1_VWA4_VWB1_WSGRA0_WSGRB0_WS64_WG16_16_1_WGM32_WGMXCC8_WGMXCCGn1
    SolutionIndex: 137
    SolutionNameMin: Cijk_Alik_Bljk_BBS_BH_Bias_HA_S_SAV_UserArgs_MT64x192x128_MI16x16x1_SN_LDSB0_AFC1_AFEM1_AFEM1_ASEM1_CLR1_CADS0_DTLA0_DTLB0_DTVA0_DTVB0_EPS0_FDSI0_GRPM1_GRVWA8_GRVWB8_GSU1_GSUAMB_GSUC0_GSUWGMRR0_GLS0_ISA950_IU1_K1_LBSPPA1024_LBSPPB256_LBSPPM0_LPA16_LPB16_LPM0_LRVW8_LWPMn1_MIAV0_MIWT4_3_MO40_NTn1_NTA0_NTB2_NTC5_NTD6_NTM0_NEPBS12_NLCA1_NLCB1_ONLL1_PGR2_PLR1_PKA1_SIA3_SS1_SU8_SUM0_SUS256_SPO0_SRVW0_SSO0_SVW4_SK0_SKXCCM0_TLDS1_ULSGRO0_USL1_UIOFGRO0_USFGRO1_VSn1_VWA4_VWB1_WSGRA0_WSGRB0_WS64_WG16_16_1_WGM8_WGMXCC8_WGMXCCGn1
    SolutionIndex: 138
    SolutionNameMin: Cijk_Alik_Bljk_BBS_BH_Bias_HA_S_SAV_UserArgs_MT160x64x128_MI16x16x1_SN_LDSB0_AFC1_AFEM1_AFEM1_ASEM1_CLR1_CADS0_DTLA0_DTLB0_DTVA0_DTVB0_EPS0_FDSI0_GRPM1_GRVWA8_GRVWB8_GSU1_GSUAMB_GSUC0_GSUWGMRR0_GLS0_ISA950_IU1_K1_LBSPPA512_LBSPPB256_LBSPPM0_LPA16_LPB16_LPM0_LRVW8_LWPMn1_MIAV0_MIWT10_1_MO40_NTn1_NTA0_NTB2_NTC1_NTD5_NTM0_NEPBS0_NLCA1_NLCB1_ONLL1_PGR2_PLR1_PKA1_SIA3_SS1_SU0_SUM0_SUS0_SPO0_SRVW0_SSO0_SVW2_SK0_SKXCCM0_TLDS2_ULSGRO0_USL1_UIOFGRO0_USFGROn1_VSn1_VWA2_VWB1_WSGRA0_WSGRB0_WS64_WG16_16_1_WGM16_WGMXCC4_WGMXCCGn1
    SolutionIndex: 139
    SolutionNameMin: Cijk_Alik_Bljk_BBS_BH_Bias_HA_S_SAV_UserArgs_MT96x128x128_MI16x16x1_SN_LDSB0_AFC1_AFEM1_AFEM1_ASEM1_CLR1_CADS0_DTLA0_DTLB0_DTVA0_DTVB0_EPS0_FDSI0_GRPM1_GRVWA8_GRVWB8_GSU1_GSUAMB_GSUC0_GSUWGMRR0_GLS0_ISA950_IU1_K1_LBSPPA512_LBSPPB512_LBSPPM0_LPA16_LPB16_LPM0_LRVW8_LWPMn1_MIAV0_MIWT6_2_MO40_NTn1_NTA0_NTB1_NTC0_NTD5_NTM0_NEPBS0_NLCA1_NLCB1_ONLL1_PGR2_PLR1_PKA1_SIA3_SS1_SU8_SUM0_SUS256_SPO0_SRVW0_SSO1_SVW2_SK0_SKXCCM0_TLDS2_ULSGRO0_USL1_UIOFGRO0_USFGROn1_VSn1_VWA2_VWB2_WSGRA0_WSGRB0_WS64_WG16_16_1_WGM0_WGMXCC16_WGMXCCGn1
    SolutionIndex: 140
    SolutionNameMin: Cijk_Alik_Bljk_BBS_BH_Bias_HA_S_SAV_UserArgs_MT96x128x128_MI16x16x1_SN_LDSB0_AFC1_AFEM1_AFEM1_ASEM1_CLR1_CADS0_DTLA0_DTLB0_DTVA0_DTVB0_EPS0_FDSI0_GRPM1_GRVWA8_GRVWB8_GSU1_GSUAMB_GSUC0_GSUWGMRR0_GLS0_ISA950_IU1_K1_LBSPPA512_LBSPPB512_LBSPPM0_LPA16_LPB16_LPM0_LRVW8_LWPMn1_MIAV0_MIWT6_2_MO40_NTn1_NTA2_NTB0_NTC0_NTD5_NTM0_NEPBS0_NLCA1_NLCB1_ONLL1_PGR2_PLR1_PKA1_SIA3_SS1_SU8_SUM0_SUS256_SPO0_SRVW0_SSO1_SVW2_SK0_SKXCCM0_TLDS2_ULSGRO0_USL1_UIOFGRO0_USFGRO1_VSn1_VWA2_VWB2_WSGRA0_WSGRB0_WS64_WG16_16_1_WGM0_WGMXCC16_WGMXCCGn1
    SolutionIndex: 141
    SolutionNameMin: Cijk_Alik_Bljk_BBS_BH_Bias_HA_S_SAV_UserArgs_MT96x128x128_MI16x16x1_SN_LDSB0_AFC1_AFEM1_AFEM1_ASEM1_CLR1_CADS0_DTLA0_DTLB0_DTVA0_DTVB0_EPS0_FDSI0_GRPM1_GRVWA8_GRVWB8_GSU1_GSUAMB_GSUC0_GSUWGMRR0_GLS0_ISA950_IU1_K1_LBSPPA512_LBSPPB512_LBSPPM0_LPA16_LPB16_LPM0_LRVW8_LWPMn1_MIAV0_MIWT6_2_MO40_NTn1_NTA1_NTB1_NTC1_NTD5_NTM0_NEPBS0_NLCA1_NLCB1_ONLL1_PGR2_PLR1_PKA1_SIA3_SS1_SU8_SUM0_SUS256_SPO0_SRVW0_SSO0_SVW2_SK0_SKXCCM0_TLDS1_ULSGRO0_USL1_UIOFGRO0_USFGROn1_VSn1_VWA2_VWB2_WSGRA0_WSGRB0_WS64_WG16_16_1_WGM1_WGMXCC16_WGMXCCGn1
    SolutionIndex: 142
    SolutionNameMin: Cijk_Alik_Bljk_BBS_BH_Bias_HA_S_SAV_UserArgs_MT96x128x128_MI16x16x1_SN_LDSB0_AFC1_AFEM1_AFEM1_ASEM1_CLR1_CADS0_DTLA0_DTLB0_DTVA0_DTVB0_EPS0_FDSI0_GRPM1_GRVWA8_GRVWB8_GSU1_GSUAMB_GSUC0_GSUWGMRR0_GLS0_ISA950_IU1_K1_LBSPPA512_LBSPPB512_LBSPPM0_LPA16_LPB16_LPM0_LRVW8_LWPMn1_MIAV0_MIWT6_2_MO40_NTn1_NTA1_NTB2_NTC0_NTD4_NTM0_NEPBS0_NLCA1_NLCB1_ONLL1_PGR2_PLR1_PKA1_SIA3_SS1_SU16_SUM0_SUS256_SPO0_SRVW0_SSO1_SVW2_SK0_SKXCCM0_TLDS1_ULSGRO0_USL1_UIOFGRO0_USFGRO1_VSn1_VWA2_VWB2_WSGRA0_WSGRB0_WS64_WG16_16_1_WGM0_WGMXCC16_WGMXCCGn1
    SolutionIndex: 143
    SolutionNameMin: Cijk_Alik_Bljk_BBS_BH_Bias_HA_S_SAV_UserArgs_MT64x256x64_MI16x16x1_SN_LDSB0_AFC1_AFEM1_AFEM1_ASEM1_CLR1_CADS0_DTLA0_DTLB0_DTVA0_DTVB0_EPS0_FDSI0_GRPM1_GRVWA8_GRVWB8_GSU1_GSUAMB_GSUC0_GSUWGMRR0_GLS0_ISA950_IU1_K1_LBSPPA512_LBSPPB512_LBSPPM0_LPA16_LPB16_LPM0_LRVW8_LWPMn1_MIAV0_MIWT4_4_MO40_NTn1_NTA2_NTB0_NTC4_NTD5_NTM0_NEPBS16_NLCA1_NLCB1_ONLL1_PGR2_PLR1_PKA1_SIA3_SS1_SU8_SUM0_SUS256_SPO1_SRVW0_SSO0_SVW4_SK0_SKXCCM0_TLDS1_ULSGRO0_USL1_UIOFGRO0_USFGROn1_VSn1_VWA4_VWB4_WSGRA0_WSGRB0_WS64_WG16_16_1_WGM8_WGMXCC16_WGMXCCGn1
    SolutionIndex: 144
    SolutionNameMin: Cijk_Alik_Bljk_BBS_BH_Bias_HA_S_SAV_UserArgs_MT192x128x64_MI16x16x1_SN_LDSB0_AFC1_AFEM1_AFEM1_ASEM1_CLR0_CADS0_DTLA0_DTLB0_DTVA0_DTVB0_EPS0_FDSI0_GRPM1_GRVWA8_GRVWB8_GSU1_GSUAMB_GSUC0_GSUWGMRR0_GLS0_ISA950_IU1_K1_LBSPPA512_LBSPPB256_LBSPPM0_LPA16_LPB16_LPM0_LRVW8_LWPMn1_MIAV0_MIWT12_2_MO40_NTn1_NTA3_NTB3_NTC6_NTD4_NTM0_NEPBS0_NLCA1_NLCB1_ONLL1_PGR2_PLR1_PKA1_SIA3_SS1_SU0_SUM0_SUS0_SPO0_SRVW0_SSO0_SVW4_SK0_SKXCCM0_TLDS2_ULSGRO0_USL1_UIOFGRO0_USFGROn1_VSn1_VWA4_VWB2_WSGRA0_WSGRB0_WS64_WG16_16_1_WGM1_WGMXCC8_WGMXCCGn1
    SolutionIndex: 145
    SolutionNameMin: Cijk_Alik_Bljk_BBS_BH_Bias_HA_S_SAV_UserArgs_MT192x128x64_MI16x16x1_SN_LDSB0_AFC1_AFEM1_AFEM1_ASEM1_CLR0_CADS0_DTLA0_DTLB0_DTVA0_DTVB0_EPS0_FDSI0_GRPM1_GRVWA8_GRVWB8_GSU1_GSUAMB_GSUC0_GSUWGMRR0_GLS0_ISA950_IU1_K1_LBSPPA512_LBSPPB256_LBSPPM0_LPA16_LPB16_LPM0_LRVW8_LWPMn1_MIAV0_MIWT12_2_MO40_NTn1_NTA0_NTB3_NTC4_NTD5_NTM0_NEPBS0_NLCA1_NLCB1_ONLL1_PGR2_PLR1_PKA1_SIA3_SS1_SU0_SUM0_SUS0_SPO1_SRVW0_SSO1_SVW4_SK0_SKXCCM0_TLDS1_ULSGRO0_USL1_UIOFGRO0_USFGROn1_VSn1_VWA4_VWB2_WSGRA0_WSGRB0_WS64_WG16_16_1_WGM0_WGMXCC16_WGMXCCGn1
    SolutionIndex: 146
    SolutionNameMin: Cijk_Alik_Bljk_BBS_BH_Bias_HA_S_SAV_UserArgs_MT192x192x64_MI16x16x1_SN_LDSB1_AFC1_AFEM1_AFEM1_ASEM1_CLR0_CADS0_DTLA0_DTLB0_DTVA0_DTVB0_EPS0_FDSI0_GRPM1_GRVWA8_GRVWB8_GSU1_GSUAMB_GSUC0_GSUWGMRR0_GLS0_ISA950_IU1_K1_LBSPPA512_LBSPPB128_LBSPPM0_LPA16_LPB16_LPM0_LRVW8_LWPMn1_MIAV0_MIWT12_3_MO40_NTn1_NTA3_NTB1_NTC6_NTD4_NTM0_NEPBS0_NLCA1_NLCB1_ONLL1_PGR2_PLR1_PKA1_SIA3_SS1_SU0_SUM0_SUS0_SPO0_SRVW0_SSO0_SVW4_SK0_SKXCCM0_TLDS2_ULSGRO0_USL1_UIOFGRO0_USFGROn1_VSn1_VWA4_VWB1_WSGRA0_WSGRB0_WS64_WG16_16_1_WGM1_WGMXCC16_WGMXCCGn1
    SolutionIndex: 147
    SolutionNameMin: Cijk_Alik_Bljk_BBS_BH_Bias_HA_S_SAV_UserArgs_MT192x256x64_MI16x16x1_SN_LDSB1_AFC1_AFEM1_AFEM1_ASEM1_CLR1_CADS0_DTLA0_DTLB0_DTVA0_DTVB0_EPS0_FDSI0_GRPM1_GRVWA8_GRVWB8_GSU1_GSUAMB_GSUC0_GSUWGMRR0_GLS0_ISA950_IU1_K1_LBSPPA512_LBSPPB512_LBSPPM0_LPA16_LPB16_LPM0_LRVW8_LWPMn1_MIAV0_MIWT12_4_MO40_NTn1_NTA2_NTB0_NTC6_NTD6_NTM0_NEPBS0_NLCA1_NLCB1_ONLL1_PGR2_PLR1_PKA1_SIA3_SS1_SU0_SUM0_SUS0_SPO1_SRVW0_SSO1_SVW4_SK0_SKXCCM0_TLDS1_ULSGRO0_USL1_UIOFGRO0_USFGRO1_VSn1_VWA4_VWB4_WSGRA0_WSGRB0_WS64_WG16_16_1_WGM1_WGMXCC8_WGMXCCGn1
    SolutionIndex: 148
    SolutionNameMin: Cijk_Alik_Bljk_BBS_BH_Bias_HA_S_SAV_UserArgs_MT192x192x64_MI32x32x1_SN_LDSB1_AFC1_AFEM1_AFEM1_ASEM1_CLR0_CADS0_DTLA0_DTLB0_DTVA0_DTVB0_EPS0_FDSI0_GRPM1_GRVWA8_GRVWB8_GSU1_GSUAMB_GSUC0_GSUWGMRR0_GLS0_ISA950_IU1_K1_LBSPPA128_LBSPPB128_LBSPPM0_LPA8_LPB8_LPM0_LRVW8_LWPMn1_MIAV0_MIWT3_3_MO40_NTn1_NTA0_NTB2_NTC1_NTD7_NTM0_NEPBS0_NLCA1_NLCB1_ONLL1_PGR2_PLR1_PKA1_SIA3_SS1_SU0_SUM0_SUS0_SPO1_SRVW0_SSO1_SVW1_SK0_SKXCCM0_TLDS1_ULSGRO0_USL1_UIOFGRO0_USFGROn1_VSn1_VWA1_VWB1_WSGRA0_WSGRB0_WS64_WG64_4_1_WGM0_WGMXCC4_WGMXCCGn1
    SolutionIndex: 149
    SolutionNameMin: Cijk_Alik_Bljk_BBS_BH_Bias_HA_S_SAV_UserArgs_MT192x192x32_MI16x16x1_SN_LDSB0_AFC1_AFEM1_AFEM1_ASEM1_CLR0_CADS0_DTLA0_DTLB0_DTVA0_DTVB0_EPS0_FDSI0_GRPM1_GRVWA8_GRVWB8_GSU1_GSUAMB_GSUC0_GSUWGMRR0_GLS0_ISA950_IU1_K1_LBSPPA256_LBSPPB128_LBSPPM0_LPA16_LPB16_LPM0_LRVW8_LWPMn1_MIAV0_MIWT12_3_MO40_NTn1_NTA0_NTB0_NTC5_NTD5_NTM0_NEPBS10_NLCA1_NLCB1_ONLL1_PGR2_PLR0_PKA1_SIA3_SS1_SU0_SUM0_SUS0_SPO0_SRVW0_SSO4_SVW4_SK0_SKXCCM0_TLDS2_ULSGRO0_USL1_UIOFGRO0_USFGROn1_VSn1_VWA4_VWB1_WSGRA0_WSGRB0_WS64_WG16_16_1_WGM8_WGMXCC1_WGMXCCGn1
    SolutionIndex: 150
    SolutionNameMin: Cijk_Alik_Bljk_BBS_BH_Bias_HA_S_SAV_UserArgs_MT192x224x32_MI16x16x1_SN_LDSB1_AFC1_AFEM1_AFEM1_ASEM1_CLR0_CADS0_DTLA0_DTLB0_DTVA0_DTVB0_EPS0_FDSI0_GRPM1_GRVWA8_GRVWB4_GSU1_GSUAMB_GSUC0_GSUWGMRR0_GLS0_ISA950_IU1_K1_LBSPPA128_LBSPPB128_LBSPPM0_LPA16_LPB16_LPM0_LRVW8_LWPMn1_MIAV0_MIWT6_7_MO40_NTn1_NTA1_NTB2_NTC1_NTD5_NTM0_NEPBS0_NLCA1_NLCB1_ONLL1_PGR2_PLR0_PKA1_SIA3_SS1_SU8_SUM0_SUS128_SPO0_SRVW0_SSO4_SVW2_SK0_SKXCCM0_TLDS2_ULSGRO0_USL1_UIOFGRO0_USFGROn1_VSn1_VWA2_VWB1_WSGRA0_WSGRB0_WS64_WG32_8_1_WGM8_WGMXCC1_WGMXCCGn1
    SolutionIndex: 151
    SolutionNameMin: Cijk_Alik_Bljk_BBS_BH_Bias_HA_S_SAV_UserArgs_MT192x224x32_MI16x16x1_SN_LDSB1_AFC1_AFEM1_AFEM1_ASEM1_CLR0_CADS0_DTLA0_DTLB0_DTVA0_DTVB0_EPS0_FDSI0_GRPM1_GRVWA8_GRVWB4_GSU1_GSUAMB_GSUC0_GSUWGMRR0_GLS0_ISA950_IU1_K1_LBSPPA128_LBSPPB128_LBSPPM0_LPA16_LPB16_LPM0_LRVW8_LWPMn1_MIAV0_MIWT6_7_MO40_NTn1_NTA0_NTB0_NTC1_NTD5_NTM0_NEPBS0_NLCA1_NLCB1_ONLL1_PGR2_PLR0_PKA1_SIA3_SS1_SU8_SUM0_SUS128_SPO0_SRVW0_SSO4_SVW2_SK0_SKXCCM0_TLDS2_ULSGRO0_USL1_UIOFGRO0_USFGROn1_VSn1_VWA2_VWB1_WSGRA0_WSGRB0_WS64_WG32_8_1_WGM4_WGMXCC1_WGMXCCGn1
    SolutionIndex: 152
    SolutionNameMin: Cijk_Alik_Bljk_BBS_BH_Bias_HA_S_SAV_UserArgs_MT192x256x64_MI16x16x1_SN_LDSB1_AFC1_AFEM1_AFEM1_ASEM1_CLR1_CADS0_DTLA0_DTLB0_DTVA0_DTVB0_EPS0_FDSI0_GRPM1_GRVWA8_GRVWB8_GSU1_GSUAMB_GSUC0_GSUWGMRR0_GLS0_ISA950_IU1_K1_LBSPPA512_LBSPPB512_LBSPPM0_LPA16_LPB16_LPM0_LRVW8_LWPMn1_MIAV0_MIWT12_4_MO40_NTn1_NTA2_NTB1_NTC4_NTD7_NTM0_NEPBS0_NLCA1_NLCB1_ONLL1_PGR2_PLR1_PKA1_SIA3_SS1_SU0_SUM0_SUS0_SPO0_SRVW0_SSO0_SVW4_SK0_SKXCCM0_TLDS2_ULSGRO0_USL1_UIOFGRO0_USFGROn1_VSn1_VWA4_VWB4_WSGRA0_WSGRB0_WS64_WG16_16_1_WGM0_WGMXCC8_WGMXCCGn1
    SolutionIndex: 153
    SolutionNameMin: Cijk_Alik_Bljk_BBS_BH_Bias_HA_S_SAV_UserArgs_MT16x16x512_MI16x16x1_SN_LDSB0_AFC1_AFEM1_AFEM1_ASEM1_CLR1_CADS0_DTLA1_DTLB1_DTVA0_DTVB0_EPS0_FDSI0_GRPM1_GRVWA8_GRVWB8_GSU1_GSUAMB_GSUC0_GSUWGMRR0_GLS0_ISA950_IU1_K1_LBSPPA1024_LBSPPB1024_LBSPPM0_LPA16_LPB16_LPM0_LRVW8_LWPMn1_MIAV1_MIWT1_1_MO40_NTn1_NTA5_NTB3_NTC1_NTD1_NTM0_NEPBS14_NLCA1_NLCB1_ONLL1_PGR2_PLR1_PKA1_SIA3_SS0_SU8_SUM0_SUS1024_SPO0_SRVW0_SSO0_SVW1_SK0_SKXCCM0_TLDS1_ULSGRO0_USL1_UIOFGRO0_USFGROn1_VSn1_VWA1_VWB1_WSGRA0_WSGRB0_WS64_WG16_4_2_WGM0_WGMXCC8_WGMXCCGn1
    SolutionIndex: 154
    SolutionNameMin: Cijk_Alik_Bljk_BBS_BH_Bias_HA_S_SAV_UserArgs_MT16x32x512_MI16x16x1_SN_LDSB0_AFC1_AFEM1_AFEM1_ASEM1_CLR1_CADS0_DTLA0_DTLB0_DTVA0_DTVB0_EPS0_FDSI0_GRPM1_GRVWA8_GRVWB8_GSU1_GSUAMB_GSUC0_GSUWGMRR0_GLS0_ISA950_IU1_K1_LBSPPA1024_LBSPPB1024_LBSPPM0_LPA16_LPB16_LPM0_LRVW8_LWPMn1_MIAV1_MIWT1_1_MO40_NTn1_NTA6_NTB1_NTC1_NTD2_NTM0_NEPBS10_NLCA1_NLCB1_ONLL1_PGR2_PLR1_PKA1_SIA3_SS1_SU0_SUM0_SUS0_SPO0_SRVW0_SSO0_SVW1_SK0_SKXCCM0_TLDS2_ULSGRO0_USL1_UIOFGRO0_USFGROn1_VSn1_VWA1_VWB1_WSGRA0_WSGRB0_WS64_WG16_8_2_WGM0_WGMXCC8_WGMXCCGn1
    SolutionIndex: 155
    SolutionNameMin: Cijk_Alik_Bljk_BBS_BH_Bias_HA_S_SAV_UserArgs_MT32x32x512_MI16x16x1_SN_LDSB0_AFC1_AFEM1_AFEM1_ASEM1_CLR1_CADS0_DTLA0_DTLB0_DTVA0_DTVB0_EPS0_FDSI0_GRPM1_GRVWA8_GRVWB8_GSU1_GSUAMB_GSUC0_GSUWGMRR0_GLS0_ISA950_IU1_K1_LBSPPA1024_LBSPPB1024_LBSPPM0_LPA16_LPB16_LPM0_LRVW8_LWPMn1_MIAV0_MIWT1_1_MO40_NTn1_NTA1_NTB0_NTC1_NTD4_NTM0_NEPBS4_NLCA1_NLCB1_ONLL1_PGR2_PLR1_PKA1_SIA3_SS1_SU8_SUM0_SUS1024_SPO0_SRVW0_SSO0_SVW1_SK0_SKXCCM0_TLDS2_ULSGRO0_USL1_UIOFGRO0_USFGROn1_VSn1_VWA1_VWB1_WSGRA0_WSGRB0_WS64_WG32_8_1_WGM0_WGMXCC16_WGMXCCGn1
    SolutionIndex: 156
    SolutionNameMin: Cijk_Alik_Bljk_BBS_BH_Bias_HA_S_SAV_UserArgs_MT64x16x512_MI16x16x1_SN_LDSB1_AFC1_AFEM1_AFEM1_ASEM1_CLR1_CADS0_DTLA0_DTLB0_DTVA0_DTVB0_EPS0_FDSI0_GRPM1_GRVWA8_GRVWB8_GSU1_GSUAMB_GSUC0_GSUWGMRR0_GLS0_ISA950_IU1_K1_LBSPPA1024_LBSPPB1024_LBSPPM0_LPA16_LPB16_LPM0_LRVW8_LWPMn1_MIAV0_MIWT1_1_MO40_NTn1_NTA1_NTB2_NTC7_NTD5_NTM0_NEPBS10_NLCA1_NLCB1_ONLL1_PGR2_PLR1_PKA1_SIA3_SS0_SU8_SUM0_SUS1024_SPO0_SRVW0_SSO0_SVW4_SK0_SKXCCM0_TLDS1_ULSGRO0_USL1_UIOFGRO0_USFGROn1_VSn1_VWA1_VWB1_WSGRA0_WSGRB0_WS64_WG64_4_1_WGM16_WGMXCC8_WGMXCCGn1
    SolutionIndex: 157
    SolutionNameMin: Cijk_Alik_Bljk_BBS_BH_Bias_HA_S_SAV_UserArgs_MT32x64x256_MI16x16x1_SN_LDSB0_AFC1_AFEM1_AFEM1_ASEM1_CLR1_CADS0_DTLA0_DTLB0_DTVA0_DTVB0_EPS0_FDSI0_GRPM1_GRVWA8_GRVWB8_GSU1_GSUAMB_GSUC0_GSUWGMRR0_GLS0_ISA950_IU1_K1_LBSPPA1024_LBSPPB512_LBSPPM0_LPA16_LPB16_LPM0_LRVW8_LWPMn1_MIAV1_MIWT2_1_MO40_NTn1_NTA1_NTB3_NTC1_NTD2_NTM0_NEPBS12_NLCA1_NLCB1_ONLL1_PGR2_PLR1_PKA1_SIA3_SS1_SU0_SUM0_SUS0_SPO0_SRVW0_SSO0_SVW2_SK0_SKXCCM0_TLDS2_ULSGRO0_USL1_UIOFGRO0_USFGROn1_VSn1_VWA2_VWB1_WSGRA0_WSGRB0_WS64_WG16_16_1_WGM1_WGMXCC16_WGMXCCGn1
    SolutionIndex: 158
    SolutionNameMin: Cijk_Alik_Bljk_BBS_BH_Bias_HA_S_SAV_UserArgs_MT32x64x256_MI16x16x1_SN_LDSB0_AFC1_AFEM1_AFEM1_ASEM1_CLR0_CADS0_DTLA0_DTLB0_DTVA0_DTVB0_EPS0_FDSI0_GRPM1_GRVWA8_GRVWB8_GSU1_GSUAMB_GSUC0_GSUWGMRR0_GLS0_ISA950_IU1_K1_LBSPPA1024_LBSPPB512_LBSPPM0_LPA16_LPB16_LPM0_LRVW8_LWPMn1_MIAV1_MIWT2_1_MO40_NTn1_NTA2_NTB1_NTC2_NTD3_NTM0_NEPBS0_NLCA1_NLCB1_ONLL1_PGR2_PLR1_PKA1_SIA3_SS1_SU16_SUM0_SUS512_SPO0_SRVW0_SSO0_SVW2_SK0_SKXCCM0_TLDS1_ULSGRO0_USL1_UIOFGRO0_USFGRO1_VSn1_VWA2_VWB1_WSGRA0_WSGRB0_WS64_WG16_16_1_WGM0_WGMXCC16_WGMXCCGn1
    SolutionIndex: 159
    SolutionNameMin: Cijk_Alik_Bljk_BBS_BH_Bias_HA_S_SAV_UserArgs_MT64x32x256_MI16x16x1_SN_LDSB0_AFC1_AFEM1_AFEM1_ASEM1_CLR0_CADS0_DTLA0_DTLB0_DTVA0_DTVB0_EPS0_FDSI0_GRPM1_GRVWA8_GRVWB8_GSU1_GSUAMB_GSUC0_GSUWGMRR0_GLS0_ISA950_IU1_K1_LBSPPA1024_LBSPPB512_LBSPPM0_LPA16_LPB16_LPM0_LRVW8_LWPMn1_MIAV0_MIWT2_1_MO40_NTn1_NTA3_NTB1_NTC6_NTD3_NTM0_NEPBS16_NLCA1_NLCB1_ONLL1_PGR2_PLR1_PKA1_SIA3_SS1_SU8_SUM0_SUS512_SPO0_SRVW0_SSO0_SVW2_SK0_SKXCCM0_TLDS2_ULSGRO0_USL1_UIOFGRO0_USFGROn1_VSn1_VWA2_VWB1_WSGRA0_WSGRB0_WS64_WG32_8_1_WGM32_WGMXCC8_WGMXCCGn1
    SolutionIndex: 160
    SolutionNameMin: Cijk_Alik_Bljk_BBS_BH_Bias_HA_S_SAV_UserArgs_MT128x16x256_MI16x16x1_SN_LDSB0_AFC1_AFEM1_AFEM1_ASEM1_CLR0_CADS0_DTLA0_DTLB0_DTVA0_DTVB0_EPS0_FDSI0_GRPM1_GRVWA8_GRVWB8_GSU1_GSUAMB_GSUC0_GSUWGMRR0_GLS0_ISA950_IU1_K1_LBSPPA1024_LBSPPB512_LBSPPM0_LPA16_LPB16_LPM0_LRVW8_LWPMn1_MIAV0_MIWT2_1_MO40_NTn1_NTA3_NTB1_NTC5_NTD3_NTM0_NEPBS8_NLCA1_NLCB1_ONLL1_PGR2_PLR1_PKA1_SIA3_SS0_SU16_SUM0_SUS512_SPO1_SRVW0_SSO0_SVW8_SK0_SKXCCM0_TLDS1_ULSGRO0_USL1_UIOFGRO0_USFGRO0_VSn1_VWA2_VWB1_WSGRA0_WSGRB0_WS64_WG64_4_1_WGM48_WGMXCC8_WGMXCCGn1
    SolutionIndex: 161
    SolutionNameMin: Cijk_Alik_Bljk_BBS_BH_Bias_HA_S_SAV_UserArgs_MT48x64x256_MI16x16x1_SN_LDSB0_AFC1_AFEM1_AFEM1_ASEM1_CLR0_CADS0_DTLA0_DTLB0_DTVA0_DTVB0_EPS0_FDSI0_GRPM1_GRVWA8_GRVWB8_GSU1_GSUAMB_GSUC0_GSUWGMRR0_GLS0_ISA950_IU1_K1_LBSPPA512_LBSPPB512_LBSPPM0_LPA16_LPB16_LPM0_LRVW8_LWPMn1_MIAV0_MIWT3_1_MO40_NTn1_NTA1_NTB0_NTC1_NTD1_NTM0_NEPBS12_NLCA1_NLCB1_ONLL1_PGR2_PLR1_PKA1_SIA3_SS1_SU0_SUM0_SUS0_SPO0_SRVW0_SSO1_SVW1_SK0_SKXCCM0_TLDS2_ULSGRO0_USL1_UIOFGRO0_USFGRO0_VSn1_VWA1_VWB1_WSGRA0_WSGRB0_WS64_WG16_16_1_WGM6_WGMXCC8_WGMXCCGn1
    SolutionIndex: 162
    SolutionNameMin: Cijk_Alik_Bljk_BBS_BH_Bias_HA_S_SAV_UserArgs_MT64x48x256_MI16x16x1_SN_LDSB0_AFC1_AFEM1_AFEM1_ASEM1_CLR1_CADS0_DTLA0_DTLB0_DTVA0_DTVB0_EPS0_FDSI0_GRPM1_GRVWA8_GRVWB8_GSU1_GSUAMB_GSUC0_GSUWGMRR0_GLS0_ISA950_IU1_K1_LBSPPA512_LBSPPB512_LBSPPM0_LPA16_LPB16_LPM0_LRVW8_LWPMn1_MIAV0_MIWT1_3_MO40_NTn1_NTA1_NTB1_NTC5_NTD5_NTM0_NEPBS0_NLCA1_NLCB1_ONLL1_PGR2_PLR1_PKA1_SIA3_SS1_SU16_SUM0_SUS512_SPO0_SRVW0_SSO0_SVW1_SK0_SKXCCM0_TLDS1_ULSGRO0_USL1_UIOFGRO0_USFGRO1_VSn1_VWA1_VWB1_WSGRA0_WSGRB0_WS64_WG64_4_1_WGM16_WGMXCC8_WGMXCCGn1
    SolutionIndex: 163
    SolutionNameMin: Cijk_Alik_Bljk_BBS_BH_Bias_HA_S_SAV_UserArgs_MT48x64x256_MI16x16x1_SN_LDSB0_AFC1_AFEM1_AFEM1_ASEM1_CLR1_CADS0_DTLA0_DTLB0_DTVA0_DTVB0_EPS0_FDSI0_GRPM1_GRVWA8_GRVWB8_GSU1_GSUAMB_GSUC0_GSUWGMRR0_GLS0_ISA950_IU1_K1_LBSPPA512_LBSPPB512_LBSPPM0_LPA16_LPB16_LPM0_LRVW8_LWPMn1_MIAV0_MIWT3_1_MO40_NTn1_NTA7_NTB1_NTC0_NTD2_NTM0_NEPBS14_NLCA1_NLCB1_ONLL1_PGR2_PLR1_PKA1_SIA3_SS1_SU0_SUM0_SUS0_SPO1_SRVW0_SSO0_SVW1_SK0_SKXCCM0_TLDS1_ULSGRO0_USL1_UIOFGRO0_USFGRO0_VSn1_VWA1_VWB1_WSGRA0_WSGRB0_WS64_WG16_16_1_WGM4_WGMXCC8_WGMXCCGn1
    SolutionIndex: 164
    SolutionNameMin: Cijk_Alik_Bljk_BBS_BH_Bias_HA_S_SAV_UserArgs_MT64x64x256_MI32x32x1_SN_LDSB0_AFC1_AFEM1_AFEM1_ASEM1_CLR0_CADS0_DTLA0_DTLB0_DTVA0_DTVB0_EPS0_FDSI0_GRPM1_GRVWA8_GRVWB8_GSU1_GSUAMB_GSUC0_GSUWGMRR0_GLS0_ISA950_IU1_K1_LBSPPA512_LBSPPB512_LBSPPM0_LPA8_LPB8_LPM0_LRVW8_LWPMn1_MIAV0_MIWT1_1_MO40_NTn1_NTA0_NTB3_NTC2_NTD4_NTM0_NEPBS0_NLCA1_NLCB1_ONLL1_PGR2_PLR1_PKA1_SIA3_SS1_SU0_SUM0_SUS0_SPO1_SRVW0_SSO0_SVW1_SK0_SKXCCM0_TLDS1_ULSGRO0_USL1_UIOFGRO0_USFGRO1_VSn1_VWA1_VWB1_WSGRA0_WSGRB0_WS64_WG64_4_1_WGM6_WGMXCC8_WGMXCCGn1
    SolutionIndex: 165
    SolutionNameMin: Cijk_Alik_Bljk_BBS_BH_Bias_HA_S_SAV_UserArgs_MT64x64x256_MI16x16x1_SN_LDSB0_AFC1_AFEM1_AFEM1_ASEM1_CLR1_CADS0_DTLA0_DTLB0_DTVA0_DTVB0_EPS0_FDSI0_GRPM1_GRVWA8_GRVWB8_GSU1_GSUAMB_GSUC0_GSUWGMRR0_GLS0_ISA950_IU1_K1_LBSPPA1024_LBSPPB1024_LBSPPM0_LPA16_LPB16_LPM0_LRVW8_LWPMn1_MIAV0_MIWT2_2_MO40_NTn1_NTA0_NTB1_NTC2_NTD6_NTM0_NEPBS0_NLCA1_NLCB1_ONLL1_PGR2_PLR1_PKA1_SIA3_SS1_SU8_SUM0_SUS512_SPO0_SRVW0_SSO1_SVW2_SK0_SKXCCM0_TLDS1_ULSGRO0_USL1_UIOFGRO0_USFGROn1_VSn1_VWA2_VWB2_WSGRA0_WSGRB0_WS64_WG32_8_1_WGM16_WGMXCC8_WGMXCCGn1
    SolutionIndex: 166
    SolutionNameMin: Cijk_Alik_Bljk_BBS_BH_Bias_HA_S_SAV_UserArgs_MT80x64x256_MI16x16x1_SN_LDSB0_AFC1_AFEM1_AFEM1_ASEM1_CLR0_CADS0_DTLA0_DTLB0_DTVA0_DTVB0_EPS0_FDSI0_GRPM1_GRVWA8_GRVWB8_GSU1_GSUAMB_GSUC0_GSUWGMRR0_GLS0_ISA950_IU1_K1_LBSPPA512_LBSPPB512_LBSPPM0_LPA16_LPB16_LPM0_LRVW8_LWPMn1_MIAV0_MIWT5_1_MO40_NTn1_NTA2_NTB3_NTC1_NTD0_NTM0_NEPBS0_NLCA1_NLCB1_ONLL1_PGR2_PLR1_PKA1_SIA3_SS1_SU16_SUM0_SUS512_SPO0_SRVW0_SSO0_SVW1_SK0_SKXCCM0_TLDS2_ULSGRO0_USL1_UIOFGRO0_USFGRO0_VSn1_VWA1_VWB1_WSGRA0_WSGRB0_WS64_WG16_16_1_WGM8_WGMXCC8_WGMXCCGn1
    SolutionIndex: 167
    SolutionNameMin: Cijk_Alik_Bljk_BBS_BH_Bias_HA_S_SAV_UserArgs_MT64x80x256_MI16x16x1_SN_LDSB0_AFC1_AFEM1_AFEM1_ASEM1_CLR0_CADS0_DTLA0_DTLB0_DTVA0_DTVB0_EPS0_FDSI0_GRPM1_GRVWA8_GRVWB8_GSU1_GSUAMB_GSUC0_GSUWGMRR0_GLS0_ISA950_IU1_K1_LBSPPA512_LBSPPB512_LBSPPM0_LPA16_LPB16_LPM0_LRVW8_LWPMn1_MIAV1_MIWT1_5_MO40_NTn1_NTA2_NTB0_NTC1_NTD4_NTM0_NEPBS0_NLCA1_NLCB1_ONLL1_PGR2_PLR1_PKA1_SIA3_SS1_SU8_SUM0_SUS512_SPO0_SRVW0_SSO0_SVW1_SK0_SKXCCM0_TLDS1_ULSGRO0_USL1_UIOFGRO0_USFGROn1_VSn1_VWA1_VWB1_WSGRA0_WSGRB0_WS64_WG64_4_1_WGM16_WGMXCC8_WGMXCCGn1
    SolutionIndex: 168
    SolutionNameMin: Cijk_Alik_Bljk_BBS_BH_Bias_HA_S_SAV_UserArgs_MT80x64x256_MI16x16x1_SN_LDSB0_AFC1_AFEM1_AFEM1_ASEM1_CLR0_CADS0_DTLA0_DTLB0_DTVA0_DTVB0_EPS0_FDSI0_GRPM1_GRVWA8_GRVWB8_GSU1_GSUAMB_GSUC0_GSUWGMRR0_GLS0_ISA950_IU1_K1_LBSPPA512_LBSPPB512_LBSPPM0_LPA16_LPB16_LPM0_LRVW8_LWPMn1_MIAV0_MIWT5_1_MO40_NTn1_NTA3_NTB3_NTC1_NTD1_NTM0_NEPBS10_NLCA1_NLCB1_ONLL1_PGR2_PLR1_PKA1_SIA3_SS0_SU16_SUM0_SUS512_SPO0_SRVW0_SSO1_SVW4_SK0_SKXCCM0_TLDS2_ULSGRO0_USL1_UIOFGRO0_USFGRO1_VSn1_VWA1_VWB1_WSGRA0_WSGRB0_WS64_WG16_16_1_WGM8_WGMXCC8_WGMXCCGn1
    SolutionIndex: 169
    SolutionNameMin: Cijk_Alik_Bljk_BBS_BH_Bias_HA_S_SAV_UserArgs_MT80x64x256_MI16x16x1_SN_LDSB0_AFC1_AFEM1_AFEM1_ASEM1_CLR0_CADS0_DTLA0_DTLB0_DTVA0_DTVB0_EPS0_FDSI0_GRPM1_GRVWA8_GRVWB8_GSU1_GSUAMB_GSUC0_GSUWGMRR0_GLS0_ISA950_IU1_K1_LBSPPA512_LBSPPB512_LBSPPM0_LPA16_LPB16_LPM0_LRVW8_LWPMn1_MIAV0_MIWT5_1_MO40_NTn1_NTA0_NTB3_NTC1_NTD5_NTM0_NEPBS0_NLCA1_NLCB1_ONLL1_PGR2_PLR1_PKA1_SIA3_SS1_SU8_SUM0_SUS512_SPO0_SRVW0_SSO0_SVW1_SK0_SKXCCM0_TLDS1_ULSGRO0_USL1_UIOFGRO0_USFGRO0_VSn1_VWA1_VWB1_WSGRA0_WSGRB0_WS64_WG16_16_1_WGM16_WGMXCC8_WGMXCCGn1
    SolutionIndex: 170
    SolutionNameMin: Cijk_Alik_Bljk_BBS_BH_Bias_HA_S_SAV_UserArgs_MT96x64x128_MI16x16x1_SN_LDSB0_AFC1_AFEM1_AFEM1_ASEM1_CLR1_CADS0_DTLA0_DTLB0_DTVA0_DTVB0_EPS0_FDSI0_GRPM1_GRVWA8_GRVWB8_GSU1_GSUAMB_GSUC0_GSUWGMRR0_GLS0_ISA950_IU1_K1_LBSPPA512_LBSPPB256_LBSPPM0_LPA16_LPB16_LPM0_LRVW8_LWPMn1_MIAV0_MIWT6_1_MO40_NTn1_NTA1_NTB1_NTC0_NTD5_NTM0_NEPBS0_NLCA1_NLCB1_ONLL1_PGR2_PLR1_PKA1_SIA3_SS1_SU0_SUM0_SUS0_SPO0_SRVW0_SSO1_SVW2_SK0_SKXCCM0_TLDS1_ULSGRO0_USL1_UIOFGRO0_USFGRO0_VSn1_VWA2_VWB1_WSGRA0_WSGRB0_WS64_WG16_16_1_WGM4_WGMXCC8_WGMXCCGn1
    SolutionIndex: 171
    SolutionNameMin: Cijk_Alik_Bljk_BBS_BH_Bias_HA_S_SAV_UserArgs_MT96x64x128_MI16x16x1_SN_LDSB0_AFC1_AFEM1_AFEM1_ASEM1_CLR1_CADS0_DTLA0_DTLB0_DTVA0_DTVB0_EPS0_FDSI0_GRPM1_GRVWA8_GRVWB8_GSU1_GSUAMB_GSUC0_GSUWGMRR0_GLS0_ISA950_IU1_K1_LBSPPA512_LBSPPB256_LBSPPM0_LPA16_LPB16_LPM0_LRVW8_LWPMn1_MIAV0_MIWT6_1_MO40_NTn1_NTA2_NTB0_NTC0_NTD4_NTM0_NEPBS0_NLCA1_NLCB1_ONLL1_PGR2_PLR1_PKA1_SIA3_SS1_SU0_SUM0_SUS0_SPO0_SRVW0_SSO0_SVW2_SK0_SKXCCM0_TLDS1_ULSGRO0_USL1_UIOFGRO0_USFGRO0_VSn1_VWA2_VWB1_WSGRA0_WSGRB0_WS64_WG16_16_1_WGM4_WGMXCC8_WGMXCCGn1
    SolutionIndex: 172
    SolutionNameMin: Cijk_Alik_Bljk_BBS_BH_Bias_HA_S_SAV_UserArgs_MT128x48x128_MI16x16x1_SN_LDSB0_AFC1_AFEM1_AFEM1_ASEM1_CLR1_CADS0_DTLA0_DTLB0_DTVA0_DTVB0_EPS0_FDSI0_GRPM1_GRVWA8_GRVWB8_GSU1_GSUAMB_GSUC0_GSUWGMRR0_GLS0_ISA950_IU1_K1_LBSPPA512_LBSPPB256_LBSPPM0_LPA16_LPB16_LPM0_LRVW8_LWPMn1_MIAV0_MIWT2_3_MO40_NTn1_NTA1_NTB0_NTC0_NTD4_NTM0_NEPBS0_NLCA1_NLCB1_ONLL1_PGR2_PLR1_PKA1_SIA3_SS1_SU16_SUM0_SUS512_SPO0_SRVW0_SSO0_SVW2_SK0_SKXCCM0_TLDS1_ULSGRO0_USL1_UIOFGRO0_USFGRO0_VSn1_VWA2_VWB1_WSGRA0_WSGRB0_WS64_WG64_4_1_WGM6_WGMXCC8_WGMXCCGn1
    SolutionIndex: 173
    SolutionNameMin: Cijk_Alik_Bljk_BBS_BH_Bias_HA_S_SAV_UserArgs_MT128x64x128_MI16x16x1_SN_LDSB0_AFC1_AFEM1_AFEM1_ASEM1_CLR1_CADS0_DTLA0_DTLB0_DTVA0_DTVB0_EPS0_FDSI0_GRPM1_GRVWA8_GRVWB8_GSU1_GSUAMB_GSUC0_GSUWGMRR0_GLS0_ISA950_IU1_K1_LBSPPA1024_LBSPPB512_LBSPPM0_LPA16_LPB16_LPM0_LRVW8_LWPMn1_MIAV0_MIWT4_2_MO40_NTn1_NTA0_NTB0_NTC2_NTD5_NTM0_NEPBS0_NLCA1_NLCB1_ONLL1_PGR2_PLR1_PKA1_SIA3_SS1_SU16_SUM0_SUS512_SPO1_SRVW0_SSO0_SVW4_SK0_SKXCCM0_TLDS1_ULSGRO0_USL1_UIOFGRO0_USFGRO0_VSn1_VWA4_VWB2_WSGRA0_WSGRB0_WS64_WG32_8_1_WGM16_WGMXCC8_WGMXCCGn1
    SolutionIndex: 174
    SolutionNameMin: Cijk_Alik_Bljk_BBS_BH_Bias_HA_S_SAV_UserArgs_MT128x64x128_MI32x32x1_SN_LDSB0_AFC1_AFEM1_AFEM1_ASEM1_CLR1_CADS0_DTLA0_DTLB0_DTVA0_DTVB0_EPS0_FDSI0_GRPM1_GRVWA8_GRVWB8_GSU1_GSUAMB_GSUC0_GSUWGMRR0_GLS0_ISA950_IU1_K1_LBSPPA512_LBSPPB256_LBSPPM0_LPA8_LPB8_LPM0_LRVW8_LWPMn1_MIAV0_MIWT2_1_MO40_NTn1_NTA3_NTB1_NTC4_NTD4_NTM0_NEPBS0_NLCA1_NLCB1_ONLL1_PGR2_PLR1_PKA1_SIA3_SS1_SU16_SUM0_SUS256_SPO0_SRVW0_SSO0_SVW2_SK0_SKXCCM0_TLDS2_ULSGRO0_USL1_UIOFGRO0_USFGRO0_VSn1_VWA2_VWB1_WSGRA0_WSGRB0_WS64_WG64_4_1_WGM6_WGMXCC8_WGMXCCGn1
    SolutionIndex: 175
    SolutionNameMin: Cijk_Alik_Bljk_BBS_BH_Bias_HA_S_SAV_UserArgs_MT128x64x128_MI16x16x1_SN_LDSB0_AFC1_AFEM1_AFEM1_ASEM1_CLR1_CADS0_DTLA0_DTLB0_DTVA0_DTVB0_EPS0_FDSI0_GRPM1_GRVWA8_GRVWB8_GSU1_GSUAMB_GSUC0_GSUWGMRR0_GLS0_ISA950_IU1_K1_LBSPPA1024_LBSPPB512_LBSPPM0_LPA16_LPB16_LPM0_LRVW8_LWPMn1_MIAV0_MIWT4_2_MO40_NTn1_NTA0_NTB1_NTC5_NTD5_NTM0_NEPBS0_NLCA1_NLCB1_ONLL1_PGR2_PLR1_PKA1_SIA3_SS1_SU16_SUM0_SUS512_SPO0_SRVW0_SSO0_SVW4_SK0_SKXCCM0_TLDS1_ULSGRO0_USL1_UIOFGRO0_USFGRO1_VSn1_VWA4_VWB2_WSGRA0_WSGRB0_WS64_WG32_8_1_WGM32_WGMXCC16_WGMXCCGn1
    SolutionIndex: 176
    SolutionNameMin: Cijk_Alik_Bljk_BBS_BH_Bias_HA_S_SAV_UserArgs_MT128x64x128_MI16x16x1_SN_LDSB0_AFC1_AFEM1_AFEM1_ASEM1_CLR1_CADS0_DTLA0_DTLB0_DTVA0_DTVB0_EPS0_FDSI0_GRPM1_GRVWA8_GRVWB8_GSU1_GSUAMB_GSUC0_GSUWGMRR0_GLS0_ISA950_IU1_K1_LBSPPA1024_LBSPPB512_LBSPPM0_LPA16_LPB16_LPM0_LRVW8_LWPMn1_MIAV0_MIWT4_2_MO40_NTn1_NTA2_NTB1_NTC3_NTD4_NTM0_NEPBS0_NLCA1_NLCB1_ONLL1_PGR2_PLR1_PKA1_SIA3_SS1_SU16_SUM0_SUS256_SPO1_SRVW0_SSO1_SVW4_SK0_SKXCCM0_TLDS1_ULSGRO0_USL1_UIOFGRO0_USFGRO0_VSn1_VWA4_VWB2_WSGRA0_WSGRB0_WS64_WG32_8_1_WGM8_WGMXCC16_WGMXCCGn1
    SolutionIndex: 177
    SolutionNameMin: Cijk_Alik_Bljk_BBS_BH_Bias_HA_S_SAV_UserArgs_MT128x64x128_MI16x16x1_SN_LDSB0_AFC1_AFEM1_AFEM1_ASEM1_CLR1_CADS0_DTLA0_DTLB0_DTVA0_DTVB0_EPS0_FDSI0_GRPM1_GRVWA8_GRVWB8_GSU1_GSUAMB_GSUC0_GSUWGMRR0_GLS0_ISA950_IU1_K1_LBSPPA1024_LBSPPB512_LBSPPM0_LPA16_LPB16_LPM0_LRVW8_LWPMn1_MIAV0_MIWT4_2_MO40_NTn1_NTA3_NTB2_NTC4_NTD2_NTM0_NEPBS0_NLCA1_NLCB1_ONLL1_PGR2_PLR1_PKA1_SIA3_SS1_SU16_SUM0_SUS256_SPO1_SRVW0_SSO1_SVW4_SK0_SKXCCM0_TLDS2_ULSGRO0_USL1_UIOFGRO0_USFGRO0_VSn1_VWA4_VWB2_WSGRA0_WSGRB0_WS64_WG32_8_1_WGM6_WGMXCC8_WGMXCCGn1
    SolutionIndex: 178
    SolutionNameMin: Cijk_Alik_Bljk_BBS_BH_Bias_HA_S_SAV_UserArgs_MT96x96x128_MI16x16x1_SN_LDSB0_AFC1_AFEM1_AFEM1_ASEM1_CLR0_CADS0_DTLA0_DTLB0_DTVA0_DTVB0_EPS0_FDSI0_GRPM1_GRVWA8_GRVWB8_GSU1_GSUAMB_GSUC0_GSUWGMRR0_GLS0_ISA950_IU1_K1_LBSPPA256_LBSPPB256_LBSPPM0_LPA16_LPB16_LPM0_LRVW8_LWPMn1_MIAV0_MIWT3_3_MO40_NTn1_NTA1_NTB2_NTC0_NTD5_NTM0_NEPBS0_NLCA1_NLCB1_ONLL1_PGR2_PLR1_PKA1_SIA3_SS1_SU0_SUM0_SUS0_SPO0_SRVW0_SSO1_SVW1_SK0_SKXCCM0_TLDS2_ULSGRO0_USL1_UIOFGRO0_USFGRO0_VSn1_VWA1_VWB1_WSGRA0_WSGRB0_WS64_WG32_8_1_WGM8_WGMXCC4_WGMXCCGn1
    SolutionIndex: 179
    SolutionNameMin: Cijk_Alik_Bljk_BBS_BH_Bias_HA_S_SAV_UserArgs_MT96x96x128_MI16x16x1_SN_LDSB0_AFC1_AFEM1_AFEM1_ASEM1_CLR0_CADS0_DTLA0_DTLB0_DTVA0_DTVB0_EPS0_FDSI0_GRPM1_GRVWA8_GRVWB8_GSU1_GSUAMB_GSUC0_GSUWGMRR0_GLS0_ISA950_IU1_K1_LBSPPA256_LBSPPB256_LBSPPM0_LPA16_LPB16_LPM0_LRVW8_LWPMn1_MIAV0_MIWT3_3_MO40_NTn1_NTA0_NTB3_NTC1_NTD4_NTM0_NEPBS0_NLCA1_NLCB1_ONLL1_PGR2_PLR1_PKA1_SIA3_SS1_SU0_SUM0_SUS0_SPO0_SRVW0_SSO0_SVW1_SK0_SKXCCM0_TLDS1_ULSGRO0_USL1_UIOFGRO0_USFGRO0_VSn1_VWA1_VWB1_WSGRA0_WSGRB0_WS64_WG32_8_1_WGM4_WGMXCC8_WGMXCCGn1
    SolutionIndex: 180
    SolutionNameMin: Cijk_Alik_Bljk_BBS_BH_Bias_HA_S_SAV_UserArgs_MT128x80x128_MI16x16x1_SN_LDSB0_AFC1_AFEM1_AFEM1_ASEM1_CLR1_CADS0_DTLA0_DTLB0_DTVA0_DTVB0_EPS0_FDSI0_GRPM1_GRVWA8_GRVWB8_GSU1_GSUAMB_GSUC0_GSUWGMRR0_GLS0_ISA950_IU1_K1_LBSPPA512_LBSPPB256_LBSPPM0_LPA16_LPB16_LPM0_LRVW8_LWPMn1_MIAV0_MIWT2_5_MO40_NTn1_NTA3_NTB0_NTC0_NTD5_NTM0_NEPBS0_NLCA1_NLCB1_ONLL1_PGR2_PLR1_PKA1_SIA3_SS1_SU16_SUM0_SUS512_SPO0_SRVW0_SSO0_SVW2_SK0_SKXCCM0_TLDS1_ULSGRO0_USL1_UIOFGRO0_USFGRO0_VSn1_VWA2_VWB1_WSGRA0_WSGRB0_WS64_WG64_4_1_WGM48_WGMXCC16_WGMXCCGn1
    SolutionIndex: 181
    SolutionNameMin: Cijk_Alik_Bljk_BBS_BH_Bias_HA_S_SAV_UserArgs_MT128x80x128_MI16x16x1_SN_LDSB0_AFC1_AFEM1_AFEM1_ASEM1_CLR0_CADS0_DTLA0_DTLB0_DTVA0_DTVB0_EPS0_FDSI0_GRPM1_GRVWA8_GRVWB8_GSU1_GSUAMB_GSUC0_GSUWGMRR0_GLS0_ISA950_IU1_K1_LBSPPA512_LBSPPB256_LBSPPM0_LPA16_LPB16_LPM0_LRVW8_LWPMn1_MIAV0_MIWT2_5_MO40_NTn1_NTA0_NTB3_NTC1_NTD4_NTM0_NEPBS0_NLCA1_NLCB1_ONLL1_PGR2_PLR1_PKA1_SIA3_SS1_SU16_SUM0_SUS256_SPO0_SRVW0_SSO0_SVW2_SK0_SKXCCM0_TLDS1_ULSGRO0_USL1_UIOFGRO0_USFGRO0_VSn1_VWA2_VWB1_WSGRA0_WSGRB0_WS64_WG64_4_1_WGM32_WGMXCC16_WGMXCCGn1
    SolutionIndex: 182
    SolutionNameMin: Cijk_Alik_Bljk_BBS_BH_Bias_HA_S_SAV_UserArgs_MT128x80x128_MI16x16x1_SN_LDSB0_AFC1_AFEM1_AFEM1_ASEM1_CLR0_CADS0_DTLA0_DTLB0_DTVA0_DTVB0_EPS0_FDSI0_GRPM1_GRVWA8_GRVWB8_GSU1_GSUAMB_GSUC0_GSUWGMRR0_GLS0_ISA950_IU1_K1_LBSPPA512_LBSPPB256_LBSPPM0_LPA16_LPB16_LPM0_LRVW8_LWPMn1_MIAV0_MIWT2_5_MO40_NTn1_NTA2_NTB2_NTC0_NTD5_NTM0_NEPBS0_NLCA1_NLCB1_ONLL1_PGR2_PLR1_PKA1_SIA3_SS1_SU16_SUM0_SUS256_SPO0_SRVW0_SSO0_SVW2_SK0_SKXCCM0_TLDS1_ULSGRO0_USL1_UIOFGRO0_USFGRO0_VSn1_VWA2_VWB1_WSGRA0_WSGRB0_WS64_WG64_4_1_WGM6_WGMXCC8_WGMXCCGn1
    SolutionIndex: 183
    SolutionNameMin: Cijk_Alik_Bljk_BBS_BH_Bias_HA_S_SAV_UserArgs_MT128x80x128_MI16x16x1_SN_LDSB0_AFC1_AFEM1_AFEM1_ASEM1_CLR0_CADS0_DTLA0_DTLB0_DTVA0_DTVB0_EPS0_FDSI0_GRPM1_GRVWA8_GRVWB8_GSU1_GSUAMB_GSUC0_GSUWGMRR0_GLS0_ISA950_IU1_K1_LBSPPA512_LBSPPB256_LBSPPM0_LPA16_LPB16_LPM0_LRVW8_LWPMn1_MIAV0_MIWT2_5_MO40_NTn1_NTA1_NTB2_NTC0_NTD5_NTM0_NEPBS0_NLCA1_NLCB1_ONLL1_PGR2_PLR1_PKA1_SIA3_SS1_SU16_SUM0_SUS512_SPO0_SRVW0_SSO0_SVW2_SK0_SKXCCM0_TLDS1_ULSGRO0_USL1_UIOFGRO0_USFGRO0_VSn1_VWA2_VWB1_WSGRA0_WSGRB0_WS64_WG64_4_1_WGM6_WGMXCC8_WGMXCCGn1
    SolutionIndex: 184
    SolutionNameMin: Cijk_Alik_Bljk_BBS_BH_Bias_HA_S_SAV_UserArgs_MT128x96x128_MI16x16x1_SN_LDSB0_AFC1_AFEM1_AFEM1_ASEM1_CLR1_CADS0_DTLA0_DTLB0_DTVA0_DTVB0_EPS0_FDSI0_GRPM1_GRVWA8_GRVWB8_GSU1_GSUAMB_GSUC0_GSUWGMRR0_GLS0_ISA950_IU1_K1_LBSPPA1024_LBSPPB256_LBSPPM0_LPA16_LPB16_LPM0_LRVW8_LWPMn1_MIAV0_MIWT4_3_MO40_NTn1_NTA2_NTB3_NTC5_NTD4_NTM0_NEPBS0_NLCA1_NLCB1_ONLL1_PGR2_PLR1_PKA1_SIA3_SS1_SU0_SUM0_SUS0_SPO0_SRVW0_SSO0_SVW4_SK0_SKXCCM0_TLDS2_ULSGRO0_USL1_UIOFGRO0_USFGRO0_VSn1_VWA4_VWB1_WSGRA0_WSGRB0_WS64_WG32_8_1_WGM32_WGMXCC4_WGMXCCGn1
    SolutionIndex: 185
    SolutionNameMin: Cijk_Alik_Bljk_BBS_BH_Bias_HA_S_SAV_UserArgs_MT96x128x128_MI16x16x1_SN_LDSB0_AFC1_AFEM1_AFEM1_ASEM1_CLR0_CADS0_DTLA0_DTLB0_DTVA0_DTVB0_EPS0_FDSI0_GRPM1_GRVWA8_GRVWB8_GSU1_GSUAMB_GSUC0_GSUWGMRR0_GLS0_ISA950_IU1_K1_LBSPPA512_LBSPPB512_LBSPPM0_LPA16_LPB16_LPM0_LRVW8_LWPMn1_MIAV0_MIWT6_2_MO40_NTn1_NTA2_NTB2_NTC0_NTD4_NTM0_NEPBS0_NLCA1_NLCB1_ONLL1_PGR2_PLR1_PKA1_SIA3_SS1_SU0_SUM0_SUS0_SPO0_SRVW0_SSO0_SVW2_SK0_SKXCCM0_TLDS1_ULSGRO0_USL1_UIOFGRO0_USFGRO0_VSn1_VWA2_VWB2_WSGRA0_WSGRB0_WS64_WG16_16_1_WGM16_WGMXCC4_WGMXCCGn1
    SolutionIndex: 186
    SolutionNameMin: Cijk_Alik_Bljk_BBS_BH_Bias_HA_S_SAV_UserArgs_MT96x128x128_MI16x16x1_SN_LDSB0_AFC1_AFEM1_AFEM1_ASEM1_CLR0_CADS0_DTLA0_DTLB0_DTVA0_DTVB0_EPS0_FDSI0_GRPM1_GRVWA8_GRVWB8_GSU1_GSUAMB_GSUC0_GSUWGMRR0_GLS0_ISA950_IU1_K1_LBSPPA512_LBSPPB512_LBSPPM0_LPA16_LPB16_LPM0_LRVW8_LWPMn1_MIAV0_MIWT6_2_MO40_NTn1_NTA2_NTB1_NTC0_NTD5_NTM0_NEPBS0_NLCA1_NLCB1_ONLL1_PGR2_PLR1_PKA1_SIA3_SS1_SU0_SUM0_SUS0_SPO1_SRVW0_SSO0_SVW2_SK0_SKXCCM0_TLDS2_ULSGRO0_USL1_UIOFGRO0_USFGRO0_VSn1_VWA2_VWB2_WSGRA0_WSGRB0_WS64_WG16_16_1_WGM4_WGMXCC8_WGMXCCGn1
    SolutionIndex: 187
    SolutionNameMin: Cijk_Alik_Bljk_BBS_BH_Bias_HA_S_SAV_UserArgs_MT128x96x128_MI16x16x1_SN_LDSB0_AFC1_AFEM1_AFEM1_ASEM1_CLR0_CADS0_DTLA0_DTLB0_DTVA0_DTVB0_EPS0_FDSI0_GRPM1_GRVWA8_GRVWB8_GSU1_GSUAMB_GSUC0_GSUWGMRR0_GLS0_ISA950_IU1_K1_LBSPPA1024_LBSPPB256_LBSPPM0_LPA16_LPB16_LPM0_LRVW8_LWPMn1_MIAV1_MIWT4_3_MO40_NTn1_NTA3_NTB0_NTC7_NTD4_NTM0_NEPBS0_NLCA1_NLCB1_ONLL1_PGR2_PLR1_PKA1_SIA3_SS1_SU16_SUM0_SUS256_SPO0_SRVW0_SSO0_SVW4_SK0_SKXCCM0_TLDS1_ULSGRO0_USL1_UIOFGRO0_USFGRO0_VSn1_VWA4_VWB1_WSGRA0_WSGRB0_WS64_WG32_8_1_WGM24_WGMXCC8_WGMXCCGn1
    SolutionIndex: 188
    SolutionNameMin: Cijk_Alik_Bljk_BBS_BH_Bias_HA_S_SAV_UserArgs_MT128x112x128_MI16x16x1_SN_LDSB0_AFC1_AFEM1_AFEM1_ASEM1_CLR0_CADS0_DTLA0_DTLB0_DTVA0_DTVB0_EPS0_FDSI0_GRPM1_GRVWA8_GRVWB8_GSU1_GSUAMB_GSUC0_GSUWGMRR0_GLS0_ISA950_IU1_K1_LBSPPA512_LBSPPB256_LBSPPM0_LPA16_LPB16_LPM0_LRVW8_LWPMn1_MIAV0_MIWT2_7_MO40_NTn1_NTA1_NTB0_NTC1_NTD4_NTM0_NEPBS0_NLCA1_NLCB1_ONLL1_PGR2_PLR1_PKA1_SIA3_SS1_SU16_SUM0_SUS512_SPO0_SRVW0_SSO1_SVW2_SK0_SKXCCM0_TLDS2_ULSGRO0_USL1_UIOFGRO0_USFGRO0_VSn1_VWA2_VWB1_WSGRA0_WSGRB0_WS64_WG64_4_1_WGM4_WGMXCC8_WGMXCCGn1
    SolutionIndex: 189
    SolutionNameMin: Cijk_Alik_Bljk_BBS_BH_Bias_HA_S_SAV_UserArgs_MT192x128x64_MI16x16x1_SN_LDSB0_AFC1_AFEM1_AFEM1_ASEM1_CLR1_CADS0_DTLA0_DTLB0_DTVA0_DTVB0_EPS0_FDSI0_GRPM1_GRVWA8_GRVWB8_GSU1_GSUAMB_GSUC0_GSUWGMRR0_GLS0_ISA950_IU1_K1_LBSPPA256_LBSPPB512_LBSPPM0_LPA16_LPB16_LPM0_LRVW8_LWPMn1_MIAV0_MIWT6_4_MO40_NTn1_NTA2_NTB0_NTC0_NTD4_NTM0_NEPBS0_NLCA1_NLCB1_ONLL1_PGR2_PLR1_PKA1_SIA3_SS1_SU16_SUM0_SUS256_SPO0_SRVW0_SSO0_SVW2_SK0_SKXCCM0_TLDS1_ULSGRO0_USL1_UIOFGRO0_USFGRO0_VSn1_VWA2_VWB4_WSGRA0_WSGRB0_WS64_WG32_8_1_WGM8_WGMXCC8_WGMXCCGn1
    SolutionIndex: 190
    SolutionNameMin: Cijk_Alik_Bljk_BBS_BH_Bias_HA_S_SAV_UserArgs_MT192x128x64_MI16x16x1_SN_LDSB0_AFC1_AFEM1_AFEM1_ASEM1_CLR0_CADS0_DTLA0_DTLB0_DTVA0_DTVB0_EPS0_FDSI0_GRPM1_GRVWA8_GRVWB8_GSU1_GSUAMB_GSUC0_GSUWGMRR0_GLS0_ISA950_IU1_K1_LBSPPA256_LBSPPB512_LBSPPM0_LPA16_LPB16_LPM0_LRVW8_LWPMn1_MIAV0_MIWT6_4_MO40_NTn1_NTA2_NTB3_NTC0_NTD5_NTM0_NEPBS0_NLCA1_NLCB1_ONLL1_PGR2_PLR1_PKA1_SIA3_SS1_SU0_SUM0_SUS0_SPO0_SRVW0_SSO4_SVW2_SK0_SKXCCM0_TLDS2_ULSGRO0_USL1_UIOFGRO0_USFGRO0_VSn1_VWA2_VWB4_WSGRA0_WSGRB0_WS64_WG32_8_1_WGM4_WGMXCC16_WGMXCCGn1
    SolutionIndex: 191
    SolutionNameMin: Cijk_Alik_Bljk_BBS_BH_Bias_HA_S_SAV_UserArgs_MT192x256x64_MI16x16x1_SN_LDSB1_AFC1_AFEM1_AFEM1_ASEM1_CLR1_CADS0_DTLA0_DTLB0_DTVA0_DTVB0_EPS0_FDSI0_GRPM1_GRVWA8_GRVWB8_GSU1_GSUAMB_GSUC0_GSUWGMRR0_GLS0_ISA950_IU1_K1_LBSPPA512_LBSPPB512_LBSPPM0_LPA16_LPB16_LPM0_LRVW8_LWPMn1_MIAV0_MIWT12_4_MO40_NTn1_NTA2_NTB2_NTC4_NTD2_NTM0_NEPBS14_NLCA1_NLCB1_ONLL1_PGR2_PLR1_PKA1_SIA3_SS1_SU8_SUM0_SUS128_SPO0_SRVW0_SSO1_SVW4_SK0_SKXCCM0_TLDS1_ULSGRO0_USL1_UIOFGRO0_USFGROn1_VSn1_VWA4_VWB4_WSGRA0_WSGRB0_WS64_WG16_16_1_WGM4_WGMXCC8_WGMXCCGn1
    SolutionIndex: 192
    SolutionNameMin: Cijk_Alik_Bljk_BBS_BH_Bias_HA_S_SAV_UserArgs_MT192x224x64_MI16x16x1_SN_LDSB1_AFC1_AFEM1_AFEM1_ASEM1_CLR0_CADS0_DTLA0_DTLB0_DTVA0_DTVB0_EPS0_FDSI0_GRPM1_GRVWA8_GRVWB8_GSU1_GSUAMB_GSUC0_GSUWGMRR0_GLS0_ISA950_IU1_K1_LBSPPA256_LBSPPB128_LBSPPM0_LPA16_LPB16_LPM0_LRVW8_LWPMn1_MIAV0_MIWT6_7_MO40_NTn1_NTA3_NTB3_NTC0_NTD5_NTM0_NEPBS0_NLCA1_NLCB1_ONLL1_PGR2_PLR1_PKA1_SIA3_SS1_SU8_SUM0_SUS128_SPO0_SRVW0_SSO1_SVW2_SK0_SKXCCM0_TLDS2_ULSGRO0_USL1_UIOFGRO0_USFGRO0_VSn1_VWA2_VWB1_WSGRA0_WSGRB0_WS64_WG32_8_1_WGM8_WGMXCC8_WGMXCCGn1
    SolutionIndex: 193
    SolutionNameMin: Cijk_Alik_Bljk_BBS_BH_Bias_HA_S_SAV_UserArgs_MT192x224x64_MI16x16x1_SN_LDSB1_AFC1_AFEM1_AFEM1_ASEM1_CLR0_CADS0_DTLA0_DTLB0_DTVA0_DTVB0_EPS0_FDSI0_GRPM1_GRVWA8_GRVWB8_GSU1_GSUAMB_GSUC0_GSUWGMRR0_GLS0_ISA950_IU1_K1_LBSPPA256_LBSPPB128_LBSPPM0_LPA16_LPB16_LPM0_LRVW8_LWPMn1_MIAV0_MIWT6_7_MO40_NTn1_NTA1_NTB3_NTC1_NTD4_NTM0_NEPBS0_NLCA1_NLCB1_ONLL1_PGR2_PLR1_PKA1_SIA3_SS1_SU8_SUM0_SUS128_SPO0_SRVW0_SSO1_SVW2_SK0_SKXCCM0_TLDS1_ULSGRO0_USL1_UIOFGRO0_USFGRO0_VSn1_VWA2_VWB1_WSGRA0_WSGRB0_WS64_WG32_8_1_WGM16_WGMXCC2_WGMXCCGn1
    SolutionIndex: 194
    SolutionNameMin: Cijk_Alik_Bljk_BBS_BH_Bias_HA_S_SAV_UserArgs_MT192x256x64_MI16x16x1_SN_LDSB0_AFC1_AFEM1_AFEM1_ASEM1_CLR0_CADS0_DTLA1_DTLB1_DTVA0_DTVB0_EPS0_FDSI0_GRPM1_GRVWA2_GRVWB8_GSU1_GSUAMB_GSUC0_GSUWGMRR0_GLS0_ISA950_IU1_K1_LBSPPA512_LBSPPB1024_LBSPPM0_LPA16_LPB16_LPM0_LRVW8_LWPMn1_MIAV0_MIWT12_4_MO40_NTn1_NTA3_NTB3_NTC4_NTD7_NTM0_NEPBS14_NLCA1_NLCB1_ONLL1_PGR2_PLR1_PKA1_SIA3_SS1_SU8_SUM0_SUS128_SPO0_SRVW0_SSO0_SVW4_SK0_SKXCCM0_TLDS1_ULSGRO0_USL1_UIOFGRO0_USFGRO0_VSn1_VWA4_VWB4_WSGRA0_WSGRB0_WS64_WG16_16_1_WGM16_WGMXCC2_WGMXCCGn1
    SolutionIndex: 195
    SolutionNameMin: Cijk_Alik_Bljk_BBS_BH_Bias_HA_S_SAV_UserArgs_MT32x16x256_MI16x16x1_SN_LDSB0_AFC1_AFEM1_AFEM1_ASEM1_CLR1_CADS0_DTLA1_DTLB1_DTVA0_DTVB0_EPS0_FDSI0_GRPM1_GRVWA8_GRVWB2_GSU1_GSUAMB_GSUC0_GSUWGMRR0_GLS0_ISA950_IU1_K1_LBSPPA1024_LBSPPB512_LBSPPM0_LPA16_LPB16_LPM0_LRVW8_LWPMn1_MIAV1_MIWT1_1_MO40_NTn1_NTA1_NTB3_NTC0_NTD0_NTM0_NEPBS12_NLCA1_NLCB1_ONLL1_PGR2_PLR1_PKA1_SIA3_SS0_SU8_SUM0_SUS512_SPO1_SRVW0_SSO0_SVW1_SK0_SKXCCM0_TLDS2_ULSGRO0_USL1_UIOFGRO0_USFGRO1_VSn1_VWA1_VWB1_WSGRA0_WSGRB0_WS64_WG32_4_2_WGM0_WGMXCC8_WGMXCCGn1
    SolutionIndex: 196
    SolutionNameMin: Cijk_Alik_Bljk_BBS_BH_Bias_HA_S_SAV_UserArgs_MT32x32x256_MI16x16x1_SN_LDSB0_AFC1_AFEM1_AFEM1_ASEM1_CLR1_CADS0_DTLA0_DTLB0_DTVA0_DTVB0_EPS0_FDSI0_GRPM1_GRVWA8_GRVWB8_GSU1_GSUAMB_GSUC0_GSUWGMRR0_GLS0_ISA950_IU1_K1_LBSPPA512_LBSPPB512_LBSPPM0_LPA16_LPB16_LPM0_LRVW8_LWPMn1_MIAV0_MIWT1_1_MO40_NTn1_NTA0_NTB1_NTC3_NTD4_NTM0_NEPBS16_NLCA1_NLCB1_ONLL1_PGR2_PLR1_PKA1_SIA3_SS1_SU0_SUM0_SUS0_SPO0_SRVW0_SSO0_SVW1_SK0_SKXCCM0_TLDS1_ULSGRO0_USL1_UIOFGRO0_USFGRO1_VSn1_VWA1_VWB1_WSGRA0_WSGRB0_WS64_WG32_8_1_WGM1_WGMXCC1_WGMXCCGn1
    SolutionIndex: 197
    SolutionNameMin: Cijk_Alik_Bljk_BBS_BH_Bias_HA_S_SAV_UserArgs_MT32x16x128_MI16x16x1_SN_LDSB0_AFC1_AFEM1_AFEM1_ASEM1_CLR1_CADS0_DTLA1_DTLB1_DTVA0_DTVB0_EPS0_FDSI0_GRPM1_GRVWA8_GRVWB8_GSU1_GSUAMB_GSUC0_GSUWGMRR0_GLS0_ISA950_IU1_K1_LBSPPA1024_LBSPPB1024_LBSPPM0_LPA16_LPB16_LPM0_LRVW8_LWPMn1_MIAV0_MIWT1_1_MO40_NTn1_NTA1_NTB1_NTC1_NTD5_NTM0_NEPBS8_NLCA1_NLCB1_ONLL1_PGR2_PLR1_PKA1_SIA3_SS1_SU8_SUM0_SUS512_SPO1_SRVW0_SSO0_SVW1_SK0_SKXCCM0_TLDS1_ULSGRO0_USL1_UIOFGRO0_USFGRO1_VSn1_VWA1_VWB1_WSGRA0_WSGRB0_WS64_WG32_4_1_WGM8_WGMXCC8_WGMXCCGn1
    SolutionIndex: 198
    SolutionNameMin: Cijk_Alik_Bljk_BBS_BH_Bias_HA_S_SAV_UserArgs_MT32x32x64_MI16x16x1_SN_LDSB0_AFC1_AFEM1_AFEM1_ASEM1_CLR1_CADS0_DTLA1_DTLB1_DTVA0_DTVB0_EPS0_FDSI0_GRPM1_GRVWA8_GRVWB8_GSU1_GSUAMB_GSUC0_GSUWGMRR0_GLS0_ISA950_IU1_K1_LBSPPA1024_LBSPPB1024_LBSPPM0_LPA16_LPB16_LPM0_LRVW8_LWPMn1_MIAV0_MIWT1_1_MO40_NTn1_NTA3_NTB3_NTC2_NTD5_NTM0_NEPBS16_NLCA1_NLCB1_ONLL1_PGR2_PLR1_PKA1_SIA3_SS1_SU8_SUM0_SUS512_SPO1_SRVW0_SSO0_SVW1_SK0_SKXCCM0_TLDS1_ULSGRO0_USL1_UIOFGRO0_USFGRO0_VSn1_VWA1_VWB1_WSGRA0_WSGRB0_WS64_WG32_8_1_WGM0_WGMXCC1_WGMXCCGn1
    SolutionIndex: 199
    SolutionNameMin: Cijk_Alik_Bljk_BBS_BH_Bias_HA_S_SAV_UserArgs_MT32x32x64_MI16x16x1_SN_LDSB0_AFC1_AFEM1_AFEM1_ASEM1_CLR0_CADS0_DTLA1_DTLB1_DTVA0_DTVB0_EPS0_FDSI0_GRPM1_GRVWA8_GRVWB8_GSU1_GSUAMB_GSUC0_GSUWGMRR0_GLS0_ISA950_IU1_K1_LBSPPA1024_LBSPPB1024_LBSPPM0_LPA16_LPB16_LPM0_LRVW8_LWPMn1_MIAV0_MIWT1_1_MO40_NTn1_NTA1_NTB2_NTC1_NTD5_NTM0_NEPBS16_NLCA1_NLCB1_ONLL1_PGR2_PLR1_PKA1_SIA3_SS1_SU8_SUM0_SUS512_SPO1_SRVW0_SSO1_SVW1_SK0_SKXCCM0_TLDS1_ULSGRO0_USL1_UIOFGRO0_USFGRO1_VSn1_VWA1_VWB1_WSGRA0_WSGRB0_WS64_WG32_8_1_WGM32_WGMXCC8_WGMXCCGn1
    SolutionIndex: 200
    SolutionNameMin: Cijk_Alik_Bljk_BBS_BH_Bias_HA_S_SAV_UserArgs_MT32x64x64_MI16x16x1_SN_LDSB0_AFC1_AFEM1_AFEM1_ASEM1_CLR1_CADS0_DTLA1_DTLB1_DTVA0_DTVB0_EPS0_FDSI0_GRPM1_GRVWA2_GRVWB8_GSU1_GSUAMB_GSUC0_GSUWGMRR0_GLS0_ISA950_IU1_K1_LBSPPA256_LBSPPB1024_LBSPPM0_LPA16_LPB16_LPM0_LRVW8_LWPMn1_MIAV0_MIWT2_1_MO40_NTn1_NTA1_NTB0_NTC1_NTD5_NTM0_NEPBS0_NLCA1_NLCB1_ONLL1_PGR2_PLR1_PKA1_SIA3_SS0_SU16_SUM0_SUS128_SPO1_SRVW0_SSO1_SVW8_SK0_SKXCCM0_TLDS2_ULSGRO0_USL1_UIOFGRO0_USFGRO0_VSn1_VWA2_VWB1_WSGRA0_WSGRB0_WS64_WG16_16_1_WGM0_WGMXCC1_WGMXCCGn1
    SolutionIndex: 201
    SolutionNameMin: Cijk_Alik_Bljk_BBS_BH_Bias_HA_S_SAV_UserArgs_MT32x64x64_MI16x16x1_SN_LDSB0_AFC1_AFEM1_AFEM1_ASEM1_CLR1_CADS0_DTLA1_DTLB1_DTVA0_DTVB0_EPS0_FDSI0_GRPM1_GRVWA2_GRVWB8_GSU1_GSUAMB_GSUC0_GSUWGMRR0_GLS0_ISA950_IU1_K1_LBSPPA256_LBSPPB1024_LBSPPM0_LPA16_LPB16_LPM0_LRVW8_LWPMn1_MIAV1_MIWT2_1_MO40_NTn1_NTA1_NTB1_NTC1_NTD0_NTM0_NEPBS12_NLCA1_NLCB1_ONLL1_PGR2_PLR1_PKA1_SIA3_SS0_SU16_SUM0_SUS128_SPO1_SRVW0_SSO0_SVW8_SK0_SKXCCM0_TLDS1_ULSGRO0_USL1_UIOFGRO0_USFGRO0_VSn1_VWA2_VWB1_WSGRA0_WSGRB0_WS64_WG16_16_1_WGM0_WGMXCC1_WGMXCCGn1
    SolutionIndex: 202
    SolutionNameMin: Cijk_Alik_Bljk_BBS_BH_Bias_HA_S_SAV_UserArgs_MT32x64x64_MI16x16x1_SN_LDSB0_AFC1_AFEM1_AFEM1_ASEM1_CLR1_CADS0_DTLA1_DTLB1_DTVA0_DTVB0_EPS0_FDSI0_GRPM1_GRVWA2_GRVWB8_GSU1_GSUAMB_GSUC0_GSUWGMRR0_GLS0_ISA950_IU1_K1_LBSPPA256_LBSPPB1024_LBSPPM0_LPA16_LPB16_LPM0_LRVW8_LWPMn1_MIAV0_MIWT2_1_MO40_NTn1_NTA2_NTB0_NTC3_NTD7_NTM0_NEPBS4_NLCA1_NLCB1_ONLL1_PGR2_PLR1_PKA1_SIA3_SS1_SU8_SUM0_SUS128_SPO1_SRVW0_SSO1_SVW2_SK0_SKXCCM0_TLDS1_ULSGRO0_USL1_UIOFGRO0_USFGRO0_VSn1_VWA2_VWB1_WSGRA0_WSGRB0_WS64_WG16_16_1_WGM4_WGMXCC8_WGMXCCGn1
    SolutionIndex: 203
    SolutionNameMin: Cijk_Alik_Bljk_BBS_BH_Bias_HA_S_SAV_UserArgs_MT32x64x64_MI16x16x1_SN_LDSB0_AFC1_AFEM1_AFEM1_ASEM1_CLR1_CADS0_DTLA1_DTLB1_DTVA0_DTVB0_EPS0_FDSI0_GRPM1_GRVWA2_GRVWB8_GSU1_GSUAMB_GSUC0_GSUWGMRR0_GLS0_ISA950_IU1_K1_LBSPPA256_LBSPPB1024_LBSPPM0_LPA16_LPB16_LPM0_LRVW8_LWPMn1_MIAV0_MIWT2_1_MO40_NTn1_NTA2_NTB1_NTC0_NTD7_NTM0_NEPBS14_NLCA1_NLCB1_ONLL1_PGR2_PLR1_PKA1_SIA3_SS1_SU8_SUM0_SUS512_SPO1_SRVW0_SSO0_SVW2_SK0_SKXCCM0_TLDS2_ULSGRO0_USL1_UIOFGRO0_USFGRO0_VSn1_VWA2_VWB1_WSGRA0_WSGRB0_WS64_WG16_16_1_WGM24_WGMXCC16_WGMXCCGn1
    SolutionIndex: 204
    SolutionNameMin: Cijk_Alik_Bljk_BBS_BH_Bias_HA_S_SAV_UserArgs_MT64x96x64_MI16x16x1_SN_LDSB0_AFC1_AFEM1_AFEM1_ASEM1_CLR0_CADS0_DTLA1_DTLB1_DTVA0_DTVB0_EPS0_FDSI0_GRPM1_GRVWA2_GRVWB2_GSU1_GSUAMB_GSUC0_GSUWGMRR0_GLS0_ISA950_IU1_K1_LBSPPA256_LBSPPB256_LBSPPM0_LPA16_LPB16_LPM0_LRVW8_LWPMn1_MIAV0_MIWT2_3_MO40_NTn1_NTA5_NTB1_NTC3_NTD4_NTM0_NEPBS14_NLCA1_NLCB1_ONLL1_PGR2_PLR1_PKA1_SIA3_SS1_SU0_SUM0_SUS0_SPO0_SRVW0_SSO0_SVW2_SK0_SKXCCM0_TLDS1_ULSGRO0_USL1_UIOFGRO0_USFGRO0_VSn1_VWA2_VWB1_WSGRA0_WSGRB0_WS64_WG32_8_1_WGM16_WGMXCC16_WGMXCCGn1
    SolutionIndex: 205
    SolutionNameMin: Cijk_Alik_Bljk_BBS_BH_Bias_HA_S_SAV_UserArgs_MT64x80x64_MI16x16x1_SN_LDSB0_AFC1_AFEM1_AFEM1_ASEM1_CLR0_CADS0_DTLA1_DTLB1_DTVA0_DTVB0_EPS0_FDSI0_GRPM1_GRVWA8_GRVWB2_GSU1_GSUAMB_GSUC0_GSUWGMRR0_GLS0_ISA950_IU1_K1_LBSPPA1024_LBSPPB256_LBSPPM0_LPA16_LPB16_LPM0_LRVW8_LWPMn1_MIAV1_MIWT1_5_MO40_NTn1_NTA6_NTB1_NTC0_NTD5_NTM0_NEPBS0_NLCA1_NLCB1_ONLL1_PGR2_PLR1_PKA1_SIA3_SS1_SU0_SUM0_SUS0_SPO0_SRVW0_SSO0_SVW1_SK0_SKXCCM0_TLDS1_ULSGRO0_USL1_UIOFGRO0_USFGRO1_VSn1_VWA1_VWB1_WSGRA0_WSGRB0_WS64_WG64_4_1_WGM32_WGMXCC16_WGMXCCGn1
    SolutionIndex: 206
    SolutionNameMin: Cijk_Alik_Bljk_BBS_BH_Bias_HA_S_SAV_UserArgs_MT64x96x64_MI16x16x1_SN_LDSB0_AFC1_AFEM1_AFEM1_ASEM1_CLR1_CADS0_DTLA1_DTLB1_DTVA0_DTVB0_EPS0_FDSI0_GRPM1_GRVWA2_GRVWB2_GSU1_GSUAMB_GSUC0_GSUWGMRR0_GLS0_ISA950_IU1_K1_LBSPPA256_LBSPPB256_LBSPPM0_LPA16_LPB16_LPM0_LRVW8_LWPMn1_MIAV0_MIWT2_3_MO40_NTn1_NTA5_NTB2_NTC0_NTD6_NTM0_NEPBS0_NLCA1_NLCB1_ONLL1_PGR2_PLR1_PKA1_SIA3_SS1_SU0_SUM0_SUS0_SPO0_SRVW0_SSO0_SVW2_SK0_SKXCCM0_TLDS1_ULSGRO0_USL1_UIOFGRO0_USFGRO0_VSn1_VWA2_VWB1_WSGRA0_WSGRB0_WS64_WG32_8_1_WGM24_WGMXCC8_WGMXCCGn1
    SolutionIndex: 207
    SolutionNameMin: Cijk_Alik_Bljk_BBS_BH_Bias_HA_S_SAV_UserArgs_MT64x128x64_MI16x16x1_SN_LDSB0_AFC1_AFEM1_AFEM1_ASEM1_CLR1_CADS0_DTLA1_DTLB1_DTVA0_DTVB0_EPS0_FDSI0_GRPM1_GRVWA2_GRVWB2_GSU1_GSUAMB_GSUC0_GSUWGMRR0_GLS0_ISA950_IU1_K1_LBSPPA512_LBSPPB256_LBSPPM0_LPA16_LPB16_LPM0_LRVW8_LWPMn1_MIAV1_MIWT4_2_MO40_NTn1_NTA6_NTB3_NTC3_NTD6_NTM0_NEPBS0_NLCA1_NLCB1_ONLL1_PGR2_PLR1_PKA1_SIA3_SS1_SU0_SUM0_SUS0_SPO0_SRVW0_SSO0_SVW4_SK0_SKXCCM0_TLDS1_ULSGRO0_USL1_UIOFGRO0_USFGRO0_VSn1_VWA4_VWB2_WSGRA0_WSGRB0_WS64_WG16_16_1_WGM0_WGMXCC1_WGMXCCGn1
    SolutionIndex: 208
    SolutionNameMin: Cijk_Alik_Bljk_BBS_BH_Bias_HA_S_SAV_UserArgs_MT64x128x64_MI16x16x1_SN_LDSB0_AFC1_AFEM1_AFEM1_ASEM1_CLR1_CADS0_DTLA1_DTLB1_DTVA0_DTVB0_EPS0_FDSI0_GRPM1_GRVWA2_GRVWB2_GSU1_GSUAMB_GSUC0_GSUWGMRR0_GLS0_ISA950_IU1_K1_LBSPPA512_LBSPPB256_LBSPPM0_LPA16_LPB16_LPM0_LRVW8_LWPMn1_MIAV1_MIWT4_2_MO40_NTn1_NTA7_NTB1_NTC0_NTD7_NTM0_NEPBS0_NLCA1_NLCB1_ONLL1_PGR2_PLR1_PKA1_SIA3_SS1_SU0_SUM0_SUS0_SPO0_SRVW0_SSO0_SVW4_SK0_SKXCCM0_TLDS1_ULSGRO0_USL1_UIOFGRO0_USFGRO0_VSn1_VWA4_VWB2_WSGRA0_WSGRB0_WS64_WG16_16_1_WGM16_WGMXCC16_WGMXCCGn1
    SolutionIndex: 209
    SolutionNameMin: Cijk_Alik_Bljk_BBS_BH_Bias_HA_S_SAV_UserArgs_MT128x64x64_MI16x16x1_SN_LDSB0_AFC1_AFEM1_AFEM1_ASEM1_CLR1_CADS0_DTLA1_DTLB1_DTVA0_DTVB0_EPS0_FDSI0_GRPM1_GRVWA8_GRVWB8_GSU1_GSUAMB_GSUC0_GSUWGMRR0_GLS0_ISA950_IU1_K1_LBSPPA1024_LBSPPB1024_LBSPPM0_LPA16_LPB16_LPM0_LRVW8_LWPMn1_MIAV0_MIWT8_1_MO40_NTn1_NTA0_NTB0_NTC6_NTD4_NTM0_NEPBS14_NLCA1_NLCB1_ONLL1_PGR2_PLR1_PKA1_SIA3_SS1_SU8_SUM0_SUS512_SPO0_SRVW0_SSO0_SVW8_SK0_SKXCCM0_TLDS2_ULSGRO0_USL1_UIOFGRO0_USFGRO1_VSn1_VWA8_VWB1_WSGRA0_WSGRB0_WS64_WG16_16_1_WGM1_WGMXCC1_WGMXCCGn1
    SolutionIndex: 210
    SolutionNameMin: Cijk_Alik_Bljk_BBS_BH_Bias_HA_S_SAV_UserArgs_MT64x160x64_MI16x16x1_SN_LDSB0_AFC1_AFEM1_AFEM1_ASEM1_CLR1_CADS0_DTLA1_DTLB1_DTVA0_DTVB0_EPS0_FDSI0_GRPM1_GRVWA2_GRVWB8_GSU1_GSUAMB_GSUC0_GSUWGMRR0_GLS0_ISA950_IU1_K1_LBSPPA256_LBSPPB1024_LBSPPM0_LPA16_LPB16_LPM0_LRVW8_LWPMn1_MIAV0_MIWT2_5_MO40_NTn1_NTA6_NTB2_NTC0_NTD5_NTM0_NEPBS0_NLCA1_NLCB1_ONLL1_PGR2_PLR1_PKA1_SIA3_SS1_SU0_SUM0_SUS0_SPO0_SRVW0_SSO0_SVW2_SK0_SKXCCM0_TLDS1_ULSGRO0_USL1_UIOFGRO0_USFGRO0_VSn1_VWA2_VWB1_WSGRA0_WSGRB0_WS64_WG32_8_1_WGM0_WGMXCC1_WGMXCCGn1
    SolutionIndex: 211
    SolutionNameMin: Cijk_Alik_Bljk_BBS_BH_Bias_HA_S_SAV_UserArgs_MT64x192x64_MI16x16x1_SN_LDSB0_AFC1_AFEM1_AFEM1_ASEM1_CLR1_CADS0_DTLA1_DTLB1_DTVA0_DTVB0_EPS0_FDSI0_GRPM1_GRVWA2_GRVWB8_GSU1_GSUAMB_GSUC0_GSUWGMRR0_GLS0_ISA950_IU1_K1_LBSPPA512_LBSPPB1024_LBSPPM0_LPA16_LPB16_LPM0_LRVW8_LWPMn1_MIAV1_MIWT4_3_MO40_NTn1_NTA7_NTB1_NTC1_NTD6_NTM0_NEPBS0_NLCA1_NLCB1_ONLL1_PGR2_PLR1_PKA1_SIA3_SS1_SU0_SUM0_SUS0_SPO0_SRVW0_SSO0_SVW4_SK0_SKXCCM0_TLDS1_ULSGRO0_USL1_UIOFGRO0_USFGRO0_VSn1_VWA4_VWB1_WSGRA0_WSGRB0_WS64_WG16_16_1_WGM6_WGMXCC16_WGMXCCGn1
    SolutionIndex: 212
    SolutionNameMin: Cijk_Alik_Bljk_BBS_BH_Bias_HA_S_SAV_UserArgs_MT64x192x64_MI16x16x1_SN_LDSB0_AFC1_AFEM1_AFEM1_ASEM1_CLR0_CADS0_DTLA1_DTLB1_DTVA0_DTVB0_EPS0_FDSI0_GRPM1_GRVWA2_GRVWB8_GSU1_GSUAMB_GSUC0_GSUWGMRR0_GLS0_ISA950_IU1_K1_LBSPPA512_LBSPPB1024_LBSPPM0_LPA16_LPB16_LPM0_LRVW8_LWPMn1_MIAV0_MIWT4_3_MO40_NTn1_NTA4_NTB0_NTC1_NTD6_NTM0_NEPBS0_NLCA1_NLCB1_ONLL1_PGR2_PLR1_PKA1_SIA3_SS1_SU0_SUM0_SUS0_SPO0_SRVW0_SSO4_SVW4_SK0_SKXCCM0_TLDS2_ULSGRO0_USL1_UIOFGRO0_USFGRO0_VSn1_VWA4_VWB1_WSGRA0_WSGRB0_WS64_WG16_16_1_WGM48_WGMXCC8_WGMXCCGn1
    SolutionIndex: 213
    SolutionNameMin: Cijk_Alik_Bljk_BBS_BH_Bias_HA_S_SAV_UserArgs_MT128x96x64_MI16x16x1_SN_LDSB0_AFC1_AFEM1_AFEM1_ASEM1_CLR1_CADS0_DTLA1_DTLB1_DTVA0_DTVB0_EPS0_FDSI0_GRPM1_GRVWA8_GRVWB2_GSU1_GSUAMB_GSUC0_GSUWGMRR0_GLS0_ISA950_IU1_K1_LBSPPA1024_LBSPPB256_LBSPPM0_LPA16_LPB16_LPM0_LRVW8_LWPMn1_MIAV0_MIWT4_3_MO40_NTn1_NTA6_NTB1_NTC0_NTD6_NTM0_NEPBS0_NLCA1_NLCB1_ONLL1_PGR2_PLR1_PKA1_SIA3_SS1_SU0_SUM0_SUS0_SPO1_SRVW0_SSO0_SVW4_SK0_SKXCCM0_TLDS1_ULSGRO0_USL1_UIOFGRO0_USFGRO0_VSn1_VWA4_VWB1_WSGRA0_WSGRB0_WS64_WG32_8_1_WGM32_WGMXCC8_WGMXCCGn1
    SolutionIndex: 214
    SolutionNameMin: Cijk_Alik_Bljk_BBS_BH_Bias_HA_S_SAV_UserArgs_MT128x96x64_MI16x16x1_SN_LDSB0_AFC1_AFEM1_AFEM1_ASEM1_CLR1_CADS0_DTLA1_DTLB1_DTVA0_DTVB0_EPS0_FDSI0_GRPM1_GRVWA8_GRVWB2_GSU1_GSUAMB_GSUC0_GSUWGMRR0_GLS0_ISA950_IU1_K1_LBSPPA1024_LBSPPB256_LBSPPM0_LPA16_LPB16_LPM0_LRVW8_LWPMn1_MIAV0_MIWT4_3_MO40_NTn1_NTA7_NTB3_NTC0_NTD7_NTM0_NEPBS16_NLCA1_NLCB1_ONLL1_PGR2_PLR1_PKA1_SIA3_SS1_SU0_SUM0_SUS0_SPO0_SRVW0_SSO1_SVW4_SK0_SKXCCM0_TLDS1_ULSGRO0_USL1_UIOFGRO0_USFGRO0_VSn1_VWA4_VWB1_WSGRA0_WSGRB0_WS64_WG32_8_1_WGM24_WGMXCC8_WGMXCCGn1
    SolutionIndex: 215
    SolutionNameMin: Cijk_Alik_Bljk_BBS_BH_Bias_HA_S_SAV_UserArgs_MT128x96x64_MI16x16x1_SN_LDSB0_AFC1_AFEM1_AFEM1_ASEM1_CLR1_CADS0_DTLA1_DTLB1_DTVA0_DTVB0_EPS0_FDSI0_GRPM1_GRVWA8_GRVWB8_GSU1_GSUAMB_GSUC0_GSUWGMRR0_GLS0_ISA950_IU1_K1_LBSPPA1024_LBSPPB1024_LBSPPM0_LPA16_LPB16_LPM0_LRVW8_LWPMn1_MIAV0_MIWT4_3_MO40_NTn1_NTA2_NTB0_NTC0_NTD4_NTM0_NEPBS16_NLCA1_NLCB1_ONLL1_PGR2_PLR1_PKA1_SIA3_SS1_SU0_SUM0_SUS0_SPO0_SRVW0_SSO0_SVW4_SK0_SKXCCM0_TLDS2_ULSGRO0_USL1_UIOFGRO0_USFGRO1_VSn1_VWA4_VWB1_WSGRA0_WSGRB0_WS64_WG32_8_1_WGM24_WGMXCC4_WGMXCCGn1
    SolutionIndex: 216
    SolutionNameMin: Cijk_Alik_Bljk_BBS_BH_Bias_HA_S_SAV_UserArgs_MT128x128x64_MI16x16x1_SN_LDSB0_AFC1_AFEM1_AFEM1_ASEM1_CLR0_CADS0_DTLA1_DTLB1_DTVA0_DTVB0_EPS0_FDSI0_GRPM1_GRVWA8_GRVWB8_GSU1_GSUAMB_GSUC0_GSUWGMRR0_GLS0_ISA950_IU1_K1_LBSPPA1024_LBSPPB1024_LBSPPM0_LPA16_LPB16_LPM0_LRVW8_LWPMn1_MIAV0_MIWT8_2_MO40_NTn1_NTA7_NTB2_NTC0_NTD6_NTM0_NEPBS16_NLCA1_NLCB1_ONLL1_PGR2_PLR1_PKA1_SIA3_SS1_SU0_SUM0_SUS0_SPO1_SRVW0_SSO0_SVW8_SK0_SKXCCM0_TLDS1_ULSGRO0_USL1_UIOFGRO0_USFGRO1_VSn1_VWA8_VWB2_WSGRA0_WSGRB0_WS64_WG16_16_1_WGM48_WGMXCC8_WGMXCCGn1
    SolutionIndex: 217
    SolutionNameMin: Cijk_Alik_Bljk_BBS_BH_Bias_HA_S_SAV_UserArgs_MT128x128x64_MI32x32x1_SN_LDSB0_AFC1_AFEM1_AFEM1_ASEM1_CLR1_CADS0_DTLA0_DTLB0_DTVA0_DTVB0_EPS0_FDSI0_GRPM1_GRVWA8_GRVWB8_GSU1_GSUAMB_GSUC0_GSUWGMRR0_GLS0_ISA950_IU1_K1_LBSPPA512_LBSPPB128_LBSPPM0_LPA8_LPB8_LPM0_LRVW8_LWPMn1_MIAV0_MIWT4_1_MO40_NTn1_NTA3_NTB1_NTC6_NTD4_NTM0_NEPBS16_NLCA1_NLCB1_ONLL1_PGR2_PLR1_PKA1_SIA3_SS1_SU8_SUM0_SUS512_SPO0_SRVW0_SSO0_SVW4_SK0_SKXCCM0_TLDS2_ULSGRO0_USL1_UIOFGRO0_USFGRO1_VSn1_VWA4_VWB1_WSGRA0_WSGRB0_WS64_WG32_8_1_WGM1_WGMXCC1_WGMXCCGn1
    SolutionIndex: 218
    SolutionNameMin: Cijk_Alik_Bljk_BBS_BH_Bias_HA_S_SAV_UserArgs_MT128x128x64_MI16x16x1_SN_LDSB0_AFC1_AFEM1_AFEM1_ASEM1_CLR0_CADS0_DTLA1_DTLB1_DTVA0_DTVB0_EPS0_FDSI0_GRPM1_GRVWA8_GRVWB2_GSU1_GSUAMB_GSUC0_GSUWGMRR0_GLS0_ISA950_IU1_K1_LBSPPA1024_LBSPPB256_LBSPPM0_LPA16_LPB16_LPM0_LRVW8_LWPMn1_MIAV0_MIWT8_2_MO40_NTn1_NTA7_NTB0_NTC2_NTD5_NTM0_NEPBS12_NLCA1_NLCB1_ONLL1_PGR2_PLR1_PKA1_SIA3_SS1_SU0_SUM0_SUS0_SPO0_SRVW0_SSO0_SVW8_SK0_SKXCCM0_TLDS2_ULSGRO0_USL1_UIOFGRO0_USFGRO0_VSn1_VWA8_VWB2_WSGRA0_WSGRB0_WS64_WG16_16_1_WGM0_WGMXCC1_WGMXCCGn1
    SolutionIndex: 219
    SolutionNameMin: Cijk_Alik_Bljk_BBS_BH_Bias_HA_S_SAV_UserArgs_MT128x128x64_MI16x16x1_SN_LDSB0_AFC1_AFEM1_AFEM1_ASEM1_CLR1_CADS0_DTLA1_DTLB1_DTVA0_DTVB0_EPS0_FDSI0_GRPM1_GRVWA8_GRVWB8_GSU1_GSUAMB_GSUC0_GSUWGMRR0_GLS0_ISA950_IU1_K1_LBSPPA1024_LBSPPB1024_LBSPPM0_LPA16_LPB16_LPM0_LRVW8_LWPMn1_MIAV1_MIWT8_2_MO40_NTn1_NTA6_NTB0_NTC4_NTD0_NTM0_NEPBS10_NLCA1_NLCB1_ONLL1_PGR2_PLR1_PKA1_SIA3_SS1_SU0_SUM0_SUS0_SPO0_SRVW0_SSO0_SVW8_SK0_SKXCCM0_TLDS1_ULSGRO0_USL1_UIOFGRO0_USFGROn1_VSn1_VWA8_VWB2_WSGRA0_WSGRB0_WS64_WG16_16_1_WGM32_WGMXCC8_WGMXCCGn1
    SolutionIndex: 220
    SolutionNameMin: Cijk_Alik_Bljk_BBS_BH_Bias_HA_S_SAV_UserArgs_MT128x128x64_MI16x16x1_SN_LDSB0_AFC1_AFEM1_AFEM1_ASEM1_CLR0_CADS0_DTLA1_DTLB1_DTVA0_DTVB0_EPS0_FDSI0_GRPM1_GRVWA8_GRVWB8_GSU1_GSUAMB_GSUC0_GSUWGMRR0_GLS0_ISA950_IU1_K1_LBSPPA1024_LBSPPB1024_LBSPPM0_LPA16_LPB16_LPM0_LRVW8_LWPMn1_MIAV0_MIWT8_2_MO40_NTn1_NTA4_NTB2_NTC4_NTD3_NTM0_NEPBS10_NLCA1_NLCB1_ONLL1_PGR2_PLR1_PKA1_SIA3_SS1_SU0_SUM0_SUS0_SPO0_SRVW0_SSO0_SVW8_SK0_SKXCCM0_TLDS1_ULSGRO0_USL1_UIOFGRO0_USFGROn1_VSn1_VWA8_VWB2_WSGRA0_WSGRB0_WS64_WG16_16_1_WGM0_WGMXCC1_WGMXCCGn1
    SolutionIndex: 221
    SolutionNameMin: Cijk_Alik_Bljk_BBS_BH_Bias_HA_S_SAV_UserArgs_MT128x128x64_MI16x16x1_SN_LDSB0_AFC1_AFEM1_AFEM1_ASEM1_CLR1_CADS0_DTLA0_DTLB0_DTVA0_DTVB0_EPS0_FDSI0_GRPM1_GRVWA8_GRVWB8_GSU1_GSUAMB_GSUC0_GSUWGMRR0_GLS0_ISA950_IU1_K1_LBSPPA1024_LBSPPB256_LBSPPM0_LPA16_LPB16_LPM0_LRVW8_LWPMn1_MIAV0_MIWT8_2_MO40_NTn1_NTA5_NTB3_NTC1_NTD7_NTM0_NEPBS14_NLCA1_NLCB1_ONLL1_PGR2_PLR1_PKA1_SIA3_SS1_SU0_SUM0_SUS0_SPO0_SRVW0_SSO0_SVW8_SK0_SKXCCM0_TLDS1_ULSGRO0_USL1_UIOFGRO0_USFGRO1_VSn1_VWA8_VWB2_WSGRA0_WSGRB0_WS64_WG16_16_1_WGM1_WGMXCC1_WGMXCCGn1
    SolutionIndex: 222
    SolutionNameMin: Cijk_Alik_Bljk_BBS_BH_Bias_HA_S_SAV_UserArgs_MT160x128x64_MI16x16x1_SN_LDSB0_AFC1_AFEM1_AFEM1_ASEM1_CLR0_CADS0_DTLA0_DTLB0_DTVA0_DTVB0_EPS0_FDSI0_GRPM1_GRVWA8_GRVWB8_GSU1_GSUAMB_GSUC0_GSUWGMRR0_GLS0_ISA950_IU1_K1_LBSPPA256_LBSPPB256_LBSPPM0_LPA16_LPB16_LPM0_LRVW8_LWPMn1_MIAV0_MIWT10_2_MO40_NTn1_NTA7_NTB0_NTC0_NTD5_NTM0_NEPBS0_NLCA1_NLCB1_ONLL1_PGR2_PLR1_PKA1_SIA3_SS1_SU0_SUM0_SUS0_SPO1_SRVW0_SSO1_SVW2_SK0_SKXCCM0_TLDS2_ULSGRO0_USL1_UIOFGRO0_USFGROn1_VSn1_VWA2_VWB2_WSGRA0_WSGRB0_WS64_WG16_16_1_WGM48_WGMXCC8_WGMXCCGn1
    SolutionIndex: 223
    SolutionNameMin: Cijk_Alik_Bljk_BBS_BH_Bias_HA_S_SAV_UserArgs_MT128x160x64_MI16x16x1_SN_LDSB0_AFC1_AFEM1_AFEM1_ASEM1_CLR1_CADS0_DTLA1_DTLB1_DTVA0_DTVB0_EPS0_FDSI0_GRPM1_GRVWA8_GRVWB8_GSU1_GSUAMB_GSUC0_GSUWGMRR0_GLS0_ISA950_IU1_K1_LBSPPA1024_LBSPPB1024_LBSPPM0_LPA16_LPB16_LPM0_LRVW8_LWPMn1_MIAV0_MIWT4_5_MO40_NTn1_NTA4_NTB0_NTC5_NTD6_NTM0_NEPBS0_NLCA1_NLCB1_ONLL1_PGR2_PLR1_PKA1_SIA3_SS1_SU0_SUM0_SUS0_SPO1_SRVW0_SSO1_SVW4_SK0_SKXCCM0_TLDS2_ULSGRO0_USL1_UIOFGRO0_USFGRO1_VSn1_VWA4_VWB1_WSGRA0_WSGRB0_WS64_WG32_8_1_WGM1_WGMXCC1_WGMXCCGn1
    SolutionIndex: 224
    SolutionNameMin: Cijk_Alik_Bljk_BBS_BH_Bias_HA_S_SAV_UserArgs_MT128x160x64_MI16x16x1_SN_LDSB0_AFC1_AFEM1_AFEM1_ASEM1_CLR1_CADS0_DTLA1_DTLB1_DTVA0_DTVB0_EPS0_FDSI0_GRPM1_GRVWA8_GRVWB8_GSU1_GSUAMB_GSUC0_GSUWGMRR0_GLS0_ISA950_IU1_K1_LBSPPA1024_LBSPPB1024_LBSPPM0_LPA16_LPB16_LPM0_LRVW8_LWPMn1_MIAV0_MIWT4_5_MO40_NTn1_NTA7_NTB0_NTC1_NTD5_NTM0_NEPBS0_NLCA1_NLCB1_ONLL1_PGR2_PLR1_PKA1_SIA3_SS1_SU0_SUM0_SUS0_SPO0_SRVW0_SSO0_SVW4_SK0_SKXCCM0_TLDS2_ULSGRO0_USL1_UIOFGRO0_USFGRO0_VSn1_VWA4_VWB1_WSGRA0_WSGRB0_WS64_WG32_8_1_WGM24_WGMXCC8_WGMXCCGn1
    SolutionIndex: 225
    SolutionNameMin: Cijk_Alik_Bljk_BBS_BH_Bias_HA_S_SAV_UserArgs_MT128x160x64_MI16x16x1_SN_LDSB0_AFC1_AFEM1_AFEM1_ASEM1_CLR1_CADS0_DTLA1_DTLB1_DTVA0_DTVB0_EPS0_FDSI0_GRPM1_GRVWA8_GRVWB8_GSU1_GSUAMB_GSUC0_GSUWGMRR0_GLS0_ISA950_IU1_K1_LBSPPA1024_LBSPPB1024_LBSPPM0_LPA16_LPB16_LPM0_LRVW8_LWPMn1_MIAV0_MIWT4_5_MO40_NTn1_NTA5_NTB0_NTC7_NTD7_NTM0_NEPBS0_NLCA1_NLCB1_ONLL1_PGR2_PLR1_PKA1_SIA3_SS1_SU0_SUM0_SUS0_SPO0_SRVW0_SSO1_SVW4_SK0_SKXCCM0_TLDS1_ULSGRO0_USL1_UIOFGRO0_USFGRO1_VSn1_VWA4_VWB1_WSGRA0_WSGRB0_WS64_WG32_8_1_WGM32_WGMXCC8_WGMXCCGn1
    SolutionIndex: 226
    SolutionNameMin: Cijk_Alik_Bljk_BBS_BH_Bias_HA_S_SAV_UserArgs_MT128x160x64_MI16x16x1_SN_LDSB0_AFC1_AFEM1_AFEM1_ASEM1_CLR0_CADS0_DTLA0_DTLB0_DTVA0_DTVB0_EPS0_FDSI0_GRPM1_GRVWA8_GRVWB8_GSU1_GSUAMB_GSUC0_GSUWGMRR0_GLS0_ISA950_IU1_K1_LBSPPA512_LBSPPB128_LBSPPM0_LPA16_LPB16_LPM0_LRVW8_LWPMn1_MIAV0_MIWT4_5_MO40_NTn1_NTA7_NTB2_NTC5_NTD1_NTM0_NEPBS0_NLCA1_NLCB1_ONLL1_PGR2_PLR1_PKA1_SIA3_SS1_SU0_SUM0_SUS0_SPO0_SRVW0_SSO0_SVW4_SK0_SKXCCM0_TLDS1_ULSGRO0_USL1_UIOFGRO0_USFGROn1_VSn1_VWA4_VWB1_WSGRA0_WSGRB0_WS64_WG32_8_1_WGM0_WGMXCC1_WGMXCCGn1
    SolutionIndex: 227
    SolutionNameMin: Cijk_Alik_Bljk_BBS_BH_Bias_HA_S_SAV_UserArgs_MT128x160x64_MI16x16x1_SN_LDSB0_AFC1_AFEM1_AFEM1_ASEM1_CLR1_CADS0_DTLA0_DTLB0_DTVA0_DTVB0_EPS0_FDSI0_GRPM1_GRVWA8_GRVWB8_GSU1_GSUAMB_GSUC0_GSUWGMRR0_GLS0_ISA950_IU1_K1_LBSPPA512_LBSPPB128_LBSPPM0_LPA16_LPB16_LPM0_LRVW8_LWPMn1_MIAV0_MIWT4_5_MO40_NTn1_NTA4_NTB3_NTC3_NTD6_NTM0_NEPBS0_NLCA1_NLCB1_ONLL1_PGR2_PLR1_PKA1_SIA3_SS1_SU0_SUM0_SUS0_SPO0_SRVW0_SSO0_SVW4_SK0_SKXCCM0_TLDS2_ULSGRO0_USL1_UIOFGRO0_USFGROn1_VSn1_VWA4_VWB1_WSGRA0_WSGRB0_WS64_WG32_8_1_WGM0_WGMXCC1_WGMXCCGn1
    SolutionIndex: 228
    SolutionNameMin: Cijk_Alik_Bljk_BBS_BH_Bias_HA_S_SAV_UserArgs_MT160x128x64_MI16x16x1_SN_LDSB0_AFC1_AFEM1_AFEM1_ASEM1_CLR0_CADS0_DTLA0_DTLB0_DTVA0_DTVB0_EPS0_FDSI0_GRPM1_GRVWA8_GRVWB8_GSU1_GSUAMB_GSUC0_GSUWGMRR0_GLS0_ISA950_IU1_K1_LBSPPA256_LBSPPB256_LBSPPM0_LPA16_LPB16_LPM0_LRVW8_LWPMn1_MIAV0_MIWT10_2_MO40_NTn1_NTA0_NTB0_NTC1_NTD4_NTM0_NEPBS0_NLCA1_NLCB1_ONLL1_PGR2_PLR1_PKA1_SIA3_SS1_SU0_SUM0_SUS0_SPO0_SRVW0_SSO1_SVW2_SK0_SKXCCM0_TLDS2_ULSGRO0_USL1_UIOFGRO0_USFGRO1_VSn1_VWA2_VWB2_WSGRA0_WSGRB0_WS64_WG16_16_1_WGM0_WGMXCC32_WGMXCCGn1
    SolutionIndex: 229
    SolutionNameMin: Cijk_Alik_Bljk_BBS_BH_Bias_HA_S_SAV_UserArgs_MT160x128x64_MI16x16x1_SN_LDSB0_AFC1_AFEM1_AFEM1_ASEM1_CLR1_CADS0_DTLA0_DTLB0_DTVA0_DTVB0_EPS0_FDSI0_GRPM1_GRVWA8_GRVWB8_GSU1_GSUAMB_GSUC0_GSUWGMRR0_GLS0_ISA950_IU1_K1_LBSPPA256_LBSPPB256_LBSPPM0_LPA16_LPB16_LPM0_LRVW8_LWPMn1_MIAV0_MIWT10_2_MO40_NTn1_NTA1_NTB0_NTC1_NTD5_NTM0_NEPBS0_NLCA1_NLCB1_ONLL1_PGR2_PLR1_PKA1_SIA3_SS1_SU0_SUM0_SUS0_SPO0_SRVW0_SSO1_SVW2_SK0_SKXCCM0_TLDS2_ULSGRO0_USL1_UIOFGRO0_USFGRO1_VSn1_VWA2_VWB2_WSGRA0_WSGRB0_WS64_WG16_16_1_WGM48_WGMXCC4_WGMXCCGn1
    SolutionIndex: 230
    SolutionNameMin: Cijk_Alik_Bljk_BBS_BH_Bias_HA_S_SAV_UserArgs_MT128x224x64_MI16x16x1_SN_LDSB0_AFC1_AFEM1_AFEM1_ASEM1_CLR0_CADS0_DTLA0_DTLB0_DTVA0_DTVB0_EPS0_FDSI0_GRPM1_GRVWA8_GRVWB8_GSU1_GSUAMB_GSUC0_GSUWGMRR0_GLS0_ISA950_IU1_K1_LBSPPA512_LBSPPB128_LBSPPM0_LPA16_LPB16_LPM0_LRVW8_LWPMn1_MIAV0_MIWT4_7_MO40_NTn1_NTA5_NTB2_NTC4_NTD6_NTM0_NEPBS16_NLCA1_NLCB1_ONLL1_PGR2_PLR1_PKA1_SIA3_SS1_SU0_SUM0_SUS0_SPO0_SRVW0_SSO1_SVW4_SK0_SKXCCM0_TLDS1_ULSGRO0_USL1_UIOFGRO0_USFGRO1_VSn1_VWA4_VWB1_WSGRA0_WSGRB0_WS64_WG32_8_1_WGM48_WGMXCC8_WGMXCCGn1
    SolutionIndex: 231
    SolutionNameMin: Cijk_Alik_Bljk_BBS_BH_Bias_HA_S_SAV_UserArgs_MT256x160x64_MI16x16x1_SN_LDSB0_AFC1_AFEM1_AFEM1_ASEM1_CLR0_CADS0_DTLA1_DTLB1_DTVA0_DTVB0_EPS0_FDSI0_GRPM1_GRVWA8_GRVWB8_GSU1_GSUAMB_GSUC0_GSUWGMRR0_GLS0_ISA950_IU1_K1_LBSPPA1024_LBSPPB1024_LBSPPM0_LPA16_LPB16_LPM0_LRVW8_LWPMn1_MIAV0_MIWT8_5_MO40_NTn1_NTA0_NTB3_NTC4_NTD7_NTM0_NEPBS16_NLCA1_NLCB1_ONLL1_PGR2_PLR1_PKA1_SIA3_SS1_SU16_SUM0_SUS256_SPO0_SRVW0_SSO0_SVW8_SK0_SKXCCM0_TLDS1_ULSGRO0_USL1_UIOFGRO0_USFGRO0_VSn1_VWA8_VWB1_WSGRA0_WSGRB0_WS64_WG32_8_1_WGM6_WGMXCC8_WGMXCCGn1
    SolutionIndex: 232
    SolutionNameMin: Cijk_Alik_Bljk_BBS_BH_Bias_HA_S_SAV_UserArgs_MT256x192x64_MI16x16x1_SN_LDSB0_AFC1_AFEM1_AFEM1_ASEM1_CLR0_CADS0_DTLA0_DTLB0_DTVA0_DTVB0_EPS0_FDSI0_GRPM1_GRVWA8_GRVWB8_GSU1_GSUAMB_GSUC0_GSUWGMRR0_GLS0_ISA950_IU1_K1_LBSPPA1024_LBSPPB256_LBSPPM0_LPA16_LPB16_LPM0_LRVW8_LWPMn1_MIAV0_MIWT8_6_MO40_NTn1_NTA0_NTB0_NTC7_NTD6_NTM0_NEPBS12_NLCA1_NLCB1_ONLL1_PGR2_PLR1_PKA1_SIA3_SS1_SU16_SUM0_SUS128_SPO0_SRVW0_SSO4_SVW8_SK0_SKXCCM0_TLDS1_ULSGRO0_USL1_UIOFGRO0_USFGROn1_VSn1_VWA8_VWB2_WSGRA0_WSGRB0_WS64_WG32_8_1_WGM1_WGMXCC2_WGMXCCGn1
    SolutionIndex: 233
    SolutionNameMin: Cijk_Alik_Bljk_BBS_BH_Bias_HA_S_SAV_UserArgs_MT160x256x64_MI16x16x1_SN_LDSB1_AFC1_AFEM1_AFEM1_ASEM1_CLR1_CADS0_DTLA0_DTLB0_DTVA0_DTVB0_EPS0_FDSI0_GRPM1_GRVWA8_GRVWB8_GSU1_GSUAMB_GSUC0_GSUWGMRR0_GLS0_ISA950_IU1_K1_LBSPPA256_LBSPPB512_LBSPPM0_LPA16_LPB16_LPM0_LRVW8_LWPMn1_MIAV0_MIWT10_4_MO40_NTn1_NTA3_NTB0_NTC1_NTD4_NTM0_NEPBS0_NLCA1_NLCB1_ONLL1_PGR2_PLR1_PKA1_SIA3_SS1_SU16_SUM0_SUS128_SPO0_SRVW0_SSO1_SVW2_SK0_SKXCCM0_TLDS2_ULSGRO0_USL1_UIOFGRO0_USFGRO1_VSn1_VWA2_VWB4_WSGRA0_WSGRB0_WS64_WG16_16_1_WGM0_WGMXCC2_WGMXCCGn1
    SolutionIndex: 234
    SolutionNameMin: Cijk_Alik_Bljk_BBS_BH_Bias_HA_S_SAV_UserArgs_MT112x16x64_MI16x16x1_SN_LDSB0_AFC1_AFEM1_AFEM1_ASEM1_CLR0_CADS0_DTLA1_DTLB1_DTVA0_DTVB0_EPS0_FDSI0_GRPM1_GRVWA8_GRVWB8_GSU1_GSUAMB_GSUC0_GSUWGMRR0_GLS0_ISA950_IU1_K1_LBSPPA1024_LBSPPB1024_LBSPPM0_LPA16_LPB16_LPM0_LRVW8_LWPMn1_MIAV0_MIWT7_1_MO40_NTn1_NTA4_NTB1_NTC2_NTD0_NTM0_NEPBS12_NLCA1_NLCB1_ONLL1_PGR2_PLR1_PKA1_SIA3_SS0_SU8_SUM0_SUS128_SPO0_SRVW0_SSO0_SVW4_SK0_SKXCCM0_TLDS1_ULSGRO0_USL1_UIOFGRO0_USFGROn1_VSn1_VWA1_VWB1_WSGRA0_WSGRB0_WS64_WG16_4_1_WGM1_WGMXCC1_WGMXCCGn1
    SolutionIndex: 235
    SolutionNameMin: Cijk_Alik_Bljk_BBS_BH_Bias_HA_S_SAV_UserArgs_MT112x32x64_MI16x16x1_SN_LDSB0_AFC1_AFEM1_AFEM1_ASEM1_CLR1_CADS0_DTLA1_DTLB1_DTVA0_DTVB0_EPS0_FDSI0_GRPM1_GRVWA8_GRVWB2_GSU1_GSUAMB_GSUC0_GSUWGMRR0_GLS0_ISA950_IU1_K1_LBSPPA1024_LBSPPB256_LBSPPM0_LPA16_LPB16_LPM0_LRVW8_LWPMn1_MIAV0_MIWT7_1_MO40_NTn1_NTA5_NTB0_NTC3_NTD0_NTM0_NEPBS16_NLCA1_NLCB1_ONLL1_PGR2_PLR1_PKA1_SIA3_SS0_SU0_SUM0_SUS0_SPO0_SRVW0_SSO0_SVW4_SK0_SKXCCM0_TLDS2_ULSGRO0_USL1_UIOFGRO0_USFGRO1_VSn1_VWA1_VWB1_WSGRA0_WSGRB0_WS64_WG16_8_1_WGM0_WGMXCC16_WGMXCCGn1
    SolutionIndex: 236
    SolutionNameMin: Cijk_Alik_Bljk_BBS_BH_Bias_HA_S_SAV_UserArgs_MT128x48x64_MI16x16x1_SN_LDSB0_AFC1_AFEM1_AFEM1_ASEM1_CLR1_CADS0_DTLA1_DTLB1_DTVA0_DTVB0_EPS0_FDSI0_GRPM1_GRVWA2_GRVWB2_GSU1_GSUAMB_GSUC0_GSUWGMRR0_GLS0_ISA950_IU1_K1_LBSPPA256_LBSPPB256_LBSPPM0_LPA16_LPB16_LPM0_LRVW8_LWPMn1_MIAV0_MIWT2_3_MO40_NTn1_NTA7_NTB1_NTC2_NTD1_NTM0_NEPBS12_NLCA1_NLCB1_ONLL1_PGR2_PLR1_PKA1_SIA3_SS0_SU8_SUM0_SUS128_SPO1_SRVW0_SSO0_SVW8_SK0_SKXCCM0_TLDS1_ULSGRO0_USL1_UIOFGRO0_USFGROn1_VSn1_VWA2_VWB1_WSGRA0_WSGRB0_WS64_WG64_4_1_WGM0_WGMXCC1_WGMXCCGn1
    SolutionIndex: 237
    SolutionNameMin: Cijk_Alik_Bljk_BBS_BH_Bias_HA_S_SAV_UserArgs_MT112x64x64_MI16x16x1_SN_LDSB0_AFC1_AFEM1_AFEM1_ASEM1_CLR1_CADS0_DTLA1_DTLB1_DTVA0_DTVB0_EPS0_FDSI0_GRPM1_GRVWA2_GRVWB8_GSU1_GSUAMB_GSUC0_GSUWGMRR0_GLS0_ISA950_IU1_K1_LBSPPA256_LBSPPB1024_LBSPPM0_LPA16_LPB16_LPM0_LRVW8_LWPMn1_MIAV0_MIWT7_1_MO40_NTn1_NTA0_NTB1_NTC1_NTD5_NTM0_NEPBS0_NLCA1_NLCB1_ONLL1_PGR2_PLR1_PKA1_SIA3_SS1_SU0_SUM0_SUS0_SPO0_SRVW0_SSO1_SVW1_SK0_SKXCCM0_TLDS1_ULSGRO0_USL1_UIOFGRO0_USFGRO0_VSn1_VWA1_VWB1_WSGRA0_WSGRB0_WS64_WG16_16_1_WGM1_WGMXCC8_WGMXCCGn1
    SolutionIndex: 238
    SolutionNameMin: Cijk_Alik_Bljk_BBS_BH_Bias_HA_S_SAV_UserArgs_MT128x80x64_MI16x16x1_SN_LDSB0_AFC1_AFEM1_AFEM1_ASEM1_CLR0_CADS0_DTLA1_DTLB1_DTVA0_DTVB0_EPS0_FDSI0_GRPM1_GRVWA8_GRVWB2_GSU1_GSUAMB_GSUC0_GSUWGMRR0_GLS0_ISA950_IU1_K1_LBSPPA1024_LBSPPB256_LBSPPM0_LPA16_LPB16_LPM0_LRVW8_LWPMn1_MIAV0_MIWT2_5_MO40_NTn1_NTA4_NTB2_NTC1_NTD1_NTM0_NEPBS0_NLCA1_NLCB1_ONLL1_PGR2_PLR1_PKA1_SIA3_SS0_SU16_SUM0_SUS256_SPO0_SRVW0_SSO1_SVW8_SK0_SKXCCM0_TLDS1_ULSGRO0_USL1_UIOFGRO0_USFGRO1_VSn1_VWA2_VWB1_WSGRA0_WSGRB0_WS64_WG64_4_1_WGM0_WGMXCC1_WGMXCCGn1
    SolutionIndex: 239
    SolutionNameMin: Cijk_Alik_Bljk_BBS_BH_Bias_HA_S_SAV_UserArgs_MT112x128x64_MI16x16x1_SN_LDSB0_AFC1_AFEM1_AFEM1_ASEM1_CLR1_CADS0_DTLA1_DTLB1_DTVA0_DTVB0_EPS0_FDSI0_GRPM1_GRVWA2_GRVWB8_GSU1_GSUAMB_GSUC0_GSUWGMRR0_GLS0_ISA950_IU1_K1_LBSPPA256_LBSPPB1024_LBSPPM0_LPA16_LPB16_LPM0_LRVW8_LWPMn1_MIAV1_MIWT7_2_MO40_NTn1_NTA4_NTB3_NTC1_NTD0_NTM0_NEPBS0_NLCA1_NLCB1_ONLL1_PGR2_PLR1_PKA1_SIA3_SS1_SU16_SUM0_SUS128_SPO0_SRVW0_SSO0_SVW1_SK0_SKXCCM0_TLDS1_ULSGRO0_USL1_UIOFGRO0_USFGROn1_VSn1_VWA1_VWB2_WSGRA0_WSGRB0_WS64_WG16_16_1_WGM1_WGMXCC32_WGMXCCGn1
    SolutionIndex: 240
    SolutionNameMin: Cijk_Alik_Bljk_BBS_BH_Bias_HA_S_SAV_UserArgs_MT448x16x64_MI16x16x1_SN_LDSB1_AFC1_AFEM1_AFEM1_ASEM1_CLR1_CADS0_DTLA0_DTLB0_DTVA0_DTVB0_EPS1_FDSI0_GRPM1_GRVWA8_GRVWB4_GSU1_GSUAMB_GSUC0_GSUWGMRR0_GLS0_ISA950_IU1_K1_LBSPPA256_LBSPPB128_LBSPPM0_LPA16_LPB16_LPM0_LRVW8_LWPMn1_MIAV0_MIWT14_1_MO40_NTn1_NTA6_NTB1_NTC2_NTD0_NTM0_NEPBS10_NLCA1_NLCB1_ONLL1_PGR1_PLR1_PKA1_SIA3_SS0_SU8_SUM0_SUS128_SPO0_SRVW0_SSO0_SVW8_SK0_SKXCCM0_TLDS2_ULSGRO0_USL1_UIOFGRO0_USFGRO1_VSn1_VWA2_VWB1_WSGRA0_WSGRB0_WS64_WG32_4_1_WGM0_WGMXCC2_WGMXCCGn1
    SolutionIndex: 241
    SolutionNameMin: Cijk_Alik_Bljk_BBS_BH_Bias_HA_S_SAV_UserArgs_MT416x32x64_MI16x16x1_SN_LDSB0_AFC1_AFEM1_AFEM1_ASEM1_CLR0_CADS0_DTLA0_DTLB0_DTVA0_DTVB0_EPS0_FDSI0_GRPM1_GRVWA8_GRVWB8_GSU1_GSUAMB_GSUC0_GSUWGMRR0_GLS0_ISA950_IU1_K1_LBSPPA128_LBSPPB128_LBSPPM0_LPA16_LPB16_LPM0_LRVW8_LWPMn1_MIAV1_MIWT13_1_MO40_NTn1_NTA7_NTB3_NTC0_NTD5_NTM0_NEPBS0_NLCA1_NLCB1_ONLL1_PGR2_PLR1_PKA1_SIA3_SS1_SU0_SUM0_SUS0_SPO0_SRVW0_SSO0_SVW1_SK0_SKXCCM0_TLDS1_ULSGRO0_USL1_UIOFGRO0_USFGROn1_VSn1_VWA1_VWB1_WSGRA0_WSGRB0_WS64_WG32_8_1_WGM0_WGMXCC1_WGMXCCGn1
    SolutionIndex: 242
    SolutionNameMin: Cijk_Alik_Bljk_BBS_BH_Bias_HA_S_SAV_UserArgs_MT448x48x64_MI16x16x1_SN_LDSB0_AFC1_AFEM1_AFEM1_ASEM1_CLR1_CADS0_DTLA0_DTLB0_DTVA0_DTVB0_EPS0_FDSI0_GRPM1_GRVWA8_GRVWB4_GSU1_GSUAMB_GSUC0_GSUWGMRR0_GLS0_ISA950_IU1_K1_LBSPPA128_LBSPPB128_LBSPPM0_LPA16_LPB16_LPM0_LRVW8_LWPMn1_MIAV0_MIWT7_3_MO40_NTn1_NTA4_NTB1_NTC3_NTD5_NTM0_NEPBS0_NLCA1_NLCB1_ONLL1_PGR2_PLR1_PKA1_SIA3_SS1_SU8_SUM0_SUS128_SPO0_SRVW0_SSO0_SVW1_SK0_SKXCCM0_TLDS2_ULSGRO0_USL1_UIOFGRO0_USFGROn1_VSn1_VWA1_VWB1_WSGRA0_WSGRB0_WS64_WG64_4_1_WGM1_WGMXCC8_WGMXCCGn1
    SolutionIndex: 243
    SolutionNameMin: Cijk_Alik_Bljk_BBS_BH_Bias_HA_S_SAV_UserArgs_MT448x64x64_MI16x16x1_SN_LDSB0_AFC1_AFEM1_AFEM1_ASEM1_CLR0_CADS0_DTLA0_DTLB0_DTVA0_DTVB0_EPS0_FDSI0_GRPM1_GRVWA8_GRVWB8_GSU1_GSUAMB_GSUC0_GSUWGMRR0_GLS0_ISA950_IU1_K1_LBSPPA256_LBSPPB256_LBSPPM0_LPA16_LPB16_LPM0_LRVW8_LWPMn1_MIAV0_MIWT14_2_MO40_NTn1_NTA6_NTB2_NTC2_NTD2_NTM0_NEPBS0_NLCA1_NLCB1_ONLL1_PGR2_PLR1_PKA1_SIA3_SS1_SU0_SUM0_SUS0_SPO0_SRVW0_SSO0_SVW2_SK0_SKXCCM0_TLDS1_ULSGRO0_USL1_UIOFGRO0_USFGRO1_VSn1_VWA2_VWB2_WSGRA0_WSGRB0_WS64_WG32_8_1_WGM1_WGMXCC32_WGMXCCGn1
    SolutionIndex: 244
    SolutionNameMin: Cijk_Alik_Bljk_BBS_BH_Bias_HA_S_SAV_UserArgs_MT448x96x64_MI16x16x1_SN_LDSB1_AFC1_AFEM1_AFEM1_ASEM1_CLR1_CADS0_DTLA0_DTLB0_DTVA0_DTVB0_EPS0_FDSI0_GRPM1_GRVWA8_GRVWB8_GSU1_GSUAMB_GSUC0_GSUWGMRR0_GLS0_ISA950_IU1_K1_LBSPPA256_LBSPPB128_LBSPPM0_LPA16_LPB16_LPM0_LRVW8_LWPMn1_MIAV0_MIWT14_3_MO40_NTn1_NTA7_NTB0_NTC2_NTD4_NTM0_NEPBS0_NLCA1_NLCB1_ONLL1_PGR2_PLR1_PKA1_SIA3_SS1_SU16_SUM0_SUS256_SPO1_SRVW0_SSO1_SVW2_SK0_SKXCCM0_TLDS1_ULSGRO0_USL1_UIOFGRO0_USFGROn1_VSn1_VWA2_VWB1_WSGRA0_WSGRB0_WS64_WG32_8_1_WGM1_WGMXCC16_WGMXCCGn1
    SolutionIndex: 245
    SolutionNameMin: Cijk_Alik_Bljk_BBS_BH_Bias_HA_S_SAV_UserArgs_MT416x128x64_MI16x16x1_SN_LDSB1_AFC1_AFEM1_AFEM1_ASEM1_CLR1_CADS0_DTLA0_DTLB0_DTVA0_DTVB0_EPS0_FDSI0_GRPM1_GRVWA8_GRVWB8_GSU1_GSUAMB_GSUC0_GSUWGMRR0_GLS0_ISA950_IU1_K1_LBSPPA128_LBSPPB512_LBSPPM0_LPA16_LPB16_LPM0_LRVW8_LWPMn1_MIAV0_MIWT13_4_MO40_NTn1_NTA7_NTB2_NTC0_NTD5_NTM0_NEPBS0_NLCA1_NLCB1_ONLL1_PGR2_PLR1_PKA1_SIA3_SS1_SU0_SUM0_SUS0_SPO1_SRVW0_SSO1_SVW1_SK0_SKXCCM0_TLDS2_ULSGRO0_USL1_UIOFGRO0_USFGRO0_VSn1_VWA1_VWB4_WSGRA0_WSGRB0_WS64_WG32_8_1_WGM0_WGMXCC8_WGMXCCGn1
    SolutionIndex: 246
    SolutionNameMin: Cijk_Alik_Bljk_BBS_BH_Bias_HA_S_SAV_UserArgs_MT16x32x256_MI16x16x1_SN_LDSB0_AFC1_AFEM1_AFEM1_ASEM1_CLR1_CADS0_DTLA1_DTLB1_DTVA0_DTVB0_EPS0_FDSI0_GRPM1_GRVWA8_GRVWB8_GSU0_GSUAMB_GSUC0_GSUWGMRR0_GLS0_ISA950_IU1_K1_LBSPPA1024_LBSPPB1024_LBSPPM0_LPA16_LPB16_LPM0_LRVW8_LWPMn1_MIAV1_MIWT1_1_MO40_NTn1_NTA1_NTB5_NTC3_NTD5_NTM0_NEPBS8_NLCA1_NLCB1_ONLL1_PGR2_PLR1_PKA1_SIA3_SS0_SU0_SUM0_SUS0_SPO0_SRVW0_SSO0_SVW4_SK3_SKXCCM0_TLDS2_ULSGRO0_USL1_UIOFGRO0_USFGROn1_VSn1_VWA1_VWB1_WSGRA0_WSGRB0_WS64_WG16_8_1_WGM0_WGMXCC32_WGMXCCGn1
    SolutionIndex: 247
    SolutionNameMin: Cijk_Alik_Bljk_BBS_BH_Bias_HA_S_SAV_UserArgs_MT256x256x64_MI16x16x1_SN_LDSB0_AFC1_AFEM1_AFEM1_ASEM1_CLR0_CADS0_DTLA1_DTLB1_DTVA0_DTVB0_EPS0_FDSI0_GRPM1_GRVWA8_GRVWB8_GSU0_GSUAMB_GSUC0_GSUWGMRR0_GLS0_ISA950_IU1_K1_LBSPPA1024_LBSPPB1024_LBSPPM0_LPA16_LPB16_LPM0_LRVW8_LWPMn1_MIAV0_MIWT8_8_MO40_NTn1_NTA2_NTB2_NTC2_NTD5_NTM0_NEPBS16_NLCA1_NLCB1_ONLL1_PGR2_PLR1_PKA1_SIA3_SS1_SU0_SUM0_SUS0_SPO0_SRVW0_SSO4_SVW8_SK3_SKXCCM0_TLDS1_ULSGRO0_USL1_UIOFGRO0_USFGRO0_VSn1_VWA8_VWB8_WSGRA0_WSGRB0_WS64_WG32_8_1_WGM48_WGMXCC1_WGMXCCGn1
    SolutionIndex: 248
    SolutionNameMin: Cijk_Alik_Bljk_BBS_BH_Bias_HA_S_SAV_UserArgs_MT256x128x32_MI32x32x1_SN_LDSB1_AFC1_AFEM1_AFEM1_ASEM1_CLR1_CADS0_DTLA0_DTLB0_DTVA0_DTVB0_EPS0_FDSI0_GRPM1_GRVWA8_GRVWB4_GSU0_GSUAMB_GSUC0_GSUWGMRR0_GLS0_ISA950_IU1_K1_LBSPPA128_LBSPPB256_LBSPPM0_LPA8_LPB8_LPM0_LRVW8_LWPMn1_MIAV0_MIWT2_4_MO40_NTn1_NTA0_NTB1_NTC6_NTD4_NTM0_NEPBS0_NLCA1_NLCB1_ONLL1_PGR2_PLR1_PKA1_SIA3_SS1_SU0_SUM0_SUS0_SPO0_SRVW0_SSO1_SVW2_SK3_SKXCCM0_TLDS1_ULSGRO0_USL1_UIOFGRO0_USFGRO0_VSn1_VWA2_VWB4_WSGRA0_WSGRB0_WS64_WG128_2_1_WGM0_WGMXCC2_WGMXCCGn1
    SolutionIndex: 249
    SolutionNameMin: Cijk_Alik_Bljk_BBS_BH_Bias_HA_S_SAV_UserArgs_MT256x128x32_MI32x32x1_SN_LDSB1_AFC1_AFEM1_AFEM1_ASEM1_CLR1_CADS0_DTLA0_DTLB0_DTVA0_DTVB0_EPS1_FDSI0_GRPM1_GRVWA8_GRVWB8_GSU0_GSUAMB_GSUC0_GSUWGMRR0_GLS0_ISA950_IU1_K1_LBSPPA128_LBSPPB256_LBSPPM0_LPA8_LPB8_LPM0_LRVW8_LWPMn1_MIAV0_MIWT2_4_MO40_NTn1_NTA0_NTB1_NTC7_NTD5_NTM0_NEPBS0_NLCA1_NLCB1_ONLL1_PGR1_PLR1_PKA1_SIA3_SS1_SU0_SUM0_SUS0_SPO0_SRVW0_SSO1_SVW2_SK3_SKXCCM0_TLDS1_ULSGRO0_USL1_UIOFGRO0_USFGRO0_VSn1_VWA2_VWB4_WSGRA0_WSGRB0_WS64_WG128_2_1_WGM1_WGMXCC2_WGMXCCGn1
- - - [128, 40, 1, 2880]
    - [0, 0.0]
  - - [5120, 8192, 1, 2880]
    - [1, 0.0]
  - - [128, 72, 1, 2880]
    - [2, 0.0]
  - - [2880, 8192, 1, 4096]
    - [3, 0.0]
  - - [128, 96, 1, 2880]
    - [4, 0.0]
  - - [2880, 8192, 1, 512]
    - [5, 0.0]
  - - [128, 120, 1, 2880]
    - [6, 0.0]
  - - [640, 8192, 1, 2880]
    - [7, 0.0]
  - - [128, 144, 1, 2880]
    - [8, 0.0]
  - - [5120, 8183, 1, 2880]
    - [9, 0.0]
  - - [128, 168, 1, 2880]
    - [10, 0.0]
  - - [2880, 8183, 1, 4096]
    - [11, 0.0]
  - - [128, 192, 1, 2880]
    - [12, 0.0]
  - - [201088, 12, 1, 2880]
    - [13, 0.0]
  - - [128, 216, 1, 2880]
    - [14, 0.0]
  - - [2880, 8183, 1, 512]
    - [15, 0.0]
  - - [128, 240, 1, 2880]
    - [16, 0.0]
  - - [128, 8183, 1, 2880]
    - [17, 0.0]
  - - [128, 272, 1, 2880]
    - [18, 0.0]
  - - [640, 8183, 1, 2880]
    - [19, 0.0]
  - - [128, 304, 1, 2880]
    - [20, 0.0]
  - - [5120, 8189, 1, 2880]
    - [21, 0.0]
  - - [128, 336, 1, 2880]
    - [22, 0.0]
  - - [5120, 8184, 1, 2880]
    - [23, 0.0]
  - - [128, 368, 1, 2880]
    - [24, 0.0]
  - - [5120, 7821, 1, 2880]
    - [25, 0.0]
  - - [128, 400, 1, 2880]
    - [26, 0.0]
  - - [25136, 12, 1, 2880]
    - [27, 0.0]
  - - [128, 432, 1, 2880]
    - [28, 0.0]
  - - [5120, 7177, 1, 2880]
    - [29, 0.0]
  - - [128, 464, 1, 2880]
    - [30, 0.0]
  - - [5120, 7217, 1, 2880]
    - [31, 0.0]
  - - [128, 496, 1, 2880]
    - [32, 0.0]
  - - [5120, 7209, 1, 2880]
    - [33, 0.0]
  - - [128, 528, 1, 2880]
    - [34, 0.0]
  - - [5120, 7169, 1, 2880]
    - [35, 0.0]
  - - [128, 560, 1, 2880]
    - [36, 0.0]
  - - [2880, 7821, 1, 4096]
    - [37, 0.0]
  - - [128, 592, 1, 2880]
    - [38, 0.0]
  - - [2880, 8189, 1, 4096]
    - [39, 0.0]
  - - [128, 624, 1, 2880]
    - [40, 0.0]
  - - [2880, 8184, 1, 4096]
    - [194, 0.0]
  - - [128, 656, 1, 2880]
    - [41, 0.0]
  - - [128, 688, 1, 2880]
    - [42, 0.0]
  - - [128, 720, 1, 2880]
    - [43, 0.0]
  - - [128, 752, 1, 2880]
    - [44, 0.0]
  - - [128, 784, 1, 2880]
    - [45, 0.0]
  - - [128, 816, 1, 2880]
    - [46, 0.0]
  - - [128, 848, 1, 2880]
    - [47, 0.0]
  - - [128, 880, 1, 2880]
    - [48, 0.0]
  - - [128, 912, 1, 2880]
    - [49, 0.0]
  - - [128, 944, 1, 2880]
    - [50, 0.0]
  - - [128, 976, 1, 2880]
    - [51, 0.0]
  - - [128, 1008, 1, 2880]
    - [52, 0.0]
  - - [128, 1202, 1, 2880]
    - [53, 0.0]
  - - [128, 1881, 1, 2880]
    - [54, 0.0]
  - - [128, 2049, 1, 2880]
    - [55, 0.0]
  - - [128, 3073, 1, 2880]
    - [56, 0.0]
  - - [128, 5790, 1, 2880]
    - [57, 0.0]
  - - [128, 6146, 1, 2880]
    - [58, 0.0]
  - - [128, 7169, 1, 2880]
    - [59, 0.0]
  - - [128, 7204, 1, 2880]
    - [60, 0.0]
  - - [128, 7821, 1, 2880]
    - [61, 0.0]
  - - [128, 8184, 1, 2880]
    - [62, 0.0]
  - - [640, 4, 1, 2880]
    - [63, 0.0]
  - - [640, 24, 1, 2880]
    - [64, 0.0]
  - - [640, 48, 1, 2880]
    - [65, 0.0]
  - - [640, 72, 1, 2880]
    - [66, 0.0]
  - - [640, 96, 1, 2880]
    - [67, 0.0]
  - - [640, 120, 1, 2880]
    - [68, 0.0]
  - - [640, 144, 1, 2880]
    - [69, 0.0]
  - - [640, 168, 1, 2880]
    - [70, 0.0]
  - - [640, 192, 1, 2880]
    - [71, 0.0]
  - - [640, 216, 1, 2880]
    - [72, 0.0]
  - - [640, 240, 1, 2880]
    - [73, 0.0]
  - - [640, 272, 1, 2880]
    - [74, 0.0]
  - - [640, 304, 1, 2880]
    - [75, 0.0]
  - - [640, 336, 1, 2880]
    - [76, 0.0]
  - - [640, 368, 1, 2880]
    - [77, 0.0]
  - - [640, 400, 1, 2880]
    - [78, 0.0]
  - - [640, 432, 1, 2880]
    - [79, 0.0]
  - - [640, 464, 1, 2880]
    - [80, 0.0]
  - - [640, 496, 1, 2880]
    - [81, 0.0]
  - - [640, 528, 1, 2880]
    - [82, 0.0]
  - - [640, 560, 1, 2880]
    - [83, 0.0]
  - - [640, 592, 1, 2880]
    - [84, 0.0]
  - - [640, 624, 1, 2880]
    - [85, 0.0]
  - - [640, 656, 1, 2880]
    - [86, 0.0]
  - - [640, 688, 1, 2880]
    - [87, 0.0]
  - - [640, 720, 1, 2880]
    - [88, 0.0]
  - - [640, 752, 1, 2880]
    - [89, 0.0]
  - - [640, 784, 1, 2880]
    - [90, 0.0]
  - - [640, 816, 1, 2880]
    - [91, 0.0]
  - - [640, 848, 1, 2880]
    - [92, 0.0]
  - - [640, 880, 1, 2880]
    - [93, 0.0]
  - - [640, 912, 1, 2880]
    - [94, 0.0]
  - - [640, 944, 1, 2880]
    - [95, 0.0]
  - - [640, 976, 1, 2880]
    - [96, 0.0]
  - - [640, 1008, 1, 2880]
    - [97, 0.0]
  - - [640, 1206, 1, 2880]
    - [98, 0.0]
  - - [640, 1881, 1, 2880]
    - [99, 0.0]
  - - [640, 2049, 1, 2880]
    - [100, 0.0]
  - - [640, 3073, 1, 2880]
    - [101, 0.0]
  - - [640, 4096, 1, 2880]
    - [102, 0.0]
  - - [640, 5790, 1, 2880]
    - [103, 0.0]
  - - [640, 6146, 1, 2880]
    - [104, 0.0]
  - - [640, 7169, 1, 2880]
    - [105, 0.0]
  - - [640, 7204, 1, 2880]
    - [106, 0.0]
  - - [640, 8184, 1, 2880]
    - [107, 0.0]
  - - [2880, 8, 1, 512]
    - [108, 0.0]
  - - [2880, 32, 1, 512]
    - [109, 0.0]
  - - [2880, 56, 1, 512]
    - [110, 0.0]
  - - [2880, 80, 1, 512]
    - [111, 0.0]
  - - [2880, 104, 1, 512]
    - [112, 0.0]
  - - [2880, 128, 1, 512]
    - [113, 0.0]
  - - [2880, 152, 1, 512]
    - [114, 0.0]
  - - [2880, 176, 1, 512]
    - [115, 0.0]
  - - [2880, 200, 1, 512]
    - [116, 0.0]
  - - [2880, 224, 1, 512]
    - [117, 0.0]
  - - [2880, 248, 1, 512]
    - [118, 0.0]
  - - [2880, 272, 1, 512]
    - [119, 0.0]
  - - [2880, 304, 1, 512]
    - [120, 0.0]
  - - [2880, 336, 1, 512]
    - [121, 0.0]
  - - [2880, 368, 1, 512]
    - [122, 0.0]
  - - [2880, 400, 1, 512]
    - [123, 0.0]
  - - [2880, 432, 1, 512]
    - [124, 0.0]
  - - [2880, 464, 1, 512]
    - [125, 0.0]
  - - [2880, 496, 1, 512]
    - [126, 0.0]
  - - [2880, 528, 1, 512]
    - [127, 0.0]
  - - [2880, 560, 1, 512]
    - [128, 0.0]
  - - [2880, 592, 1, 512]
    - [129, 0.0]
  - - [2880, 624, 1, 512]
    - [130, 0.0]
  - - [2880, 656, 1, 512]
    - [131, 0.0]
  - - [2880, 688, 1, 512]
    - [132, 0.0]
  - - [2880, 720, 1, 512]
    - [133, 0.0]
  - - [2880, 752, 1, 512]
    - [134, 0.0]
  - - [2880, 784, 1, 512]
    - [135, 0.0]
  - - [2880, 816, 1, 512]
    - [136, 0.0]
  - - [2880, 848, 1, 512]
    - [137, 0.0]
  - - [2880, 880, 1, 512]
    - [138, 0.0]
  - - [2880, 912, 1, 512]
    - [139, 0.0]
  - - [2880, 944, 1, 512]
    - [140, 0.0]
  - - [2880, 976, 1, 512]
    - [141, 0.0]
  - - [2880, 1008, 1, 512]
    - [142, 0.0]
  - - [2880, 1206, 1, 512]
    - [143, 0.0]
  - - [2880, 1881, 1, 512]
    - [144, 0.0]
  - - [2880, 2049, 1, 512]
    - [145, 0.0]
  - - [2880, 3073, 1, 512]
    - [146, 0.0]
  - - [2880, 4096, 1, 512]
    - [147, 0.0]
  - - [2880, 5790, 1, 512]
    - [148, 0.0]
  - - [2880, 6146, 1, 512]
    - [149, 0.0]
  - - [2880, 7169, 1, 512]
    - [150, 0.0]
  - - [2880, 7204, 1, 512]
    - [151, 0.0]
  - - [2880, 8184, 1, 512]
    - [152, 0.0]
  - - [2880, 4, 1, 4096]
    - [153, 0.0]
  - - [2880, 24, 1, 4096]
    - [154, 0.0]
  - - [2880, 48, 1, 4096]
    - [155, 0.0]
  - - [2880, 72, 1, 4096]
    - [156, 0.0]
  - - [2880, 96, 1, 4096]
    - [157, 0.0]
  - - [2880, 120, 1, 4096]
    - [158, 0.0]
  - - [2880, 144, 1, 4096]
    - [159, 0.0]
  - - [2880, 168, 1, 4096]
    - [160, 0.0]
  - - [2880, 192, 1, 4096]
    - [161, 0.0]
  - - [2880, 216, 1, 4096]
    - [162, 0.0]
  - - [2880, 240, 1, 4096]
    - [163, 0.0]
  - - [2880, 272, 1, 4096]
    - [164, 0.0]
  - - [2880, 304, 1, 4096]
    - [165, 0.0]
  - - [2880, 336, 1, 4096]
    - [166, 0.0]
  - - [2880, 368, 1, 4096]
    - [167, 0.0]
  - - [2880, 400, 1, 4096]
    - [168, 0.0]
  - - [2880, 432, 1, 4096]
    - [169, 0.0]
  - - [2880, 464, 1, 4096]
    - [170, 0.0]
  - - [2880, 496, 1, 4096]
    - [171, 0.0]
  - - [2880, 528, 1, 4096]
    - [172, 0.0]
  - - [2880, 560, 1, 4096]
    - [173, 0.0]
  - - [2880, 592, 1, 4096]
    - [174, 0.0]
  - - [2880, 624, 1, 4096]
    - [175, 0.0]
  - - [2880, 656, 1, 4096]
    - [176, 0.0]
  - - [2880, 688, 1, 4096]
    - [177, 0.0]
  - - [2880, 720, 1, 4096]
    - [178, 0.0]
  - - [2880, 752, 1, 4096]
    - [179, 0.0]
  - - [2880, 784, 1, 4096]
    - [180, 0.0]
  - - [2880, 816, 1, 4096]
    - [181, 0.0]
  - - [2880, 848, 1, 4096]
    - [182, 0.0]
  - - [2880, 880, 1, 4096]
    - [183, 0.0]
  - - [2880, 912, 1, 4096]
    - [184, 0.0]
  - - [2880, 944, 1, 4096]
    - [185, 0.0]
  - - [2880, 976, 1, 4096]
    - [186, 0.0]
  - - [2880, 1008, 1, 4096]
    - [187, 0.0]
  - - [2880, 1202, 1, 4096]
    - [188, 0.0]
  - - [2880, 1881, 1, 4096]
    - [189, 0.0]
  - - [2880, 2050, 1, 4096]
    - [190, 0.0]
  - - [2880, 4096, 1, 4096]
    - [191, 0.0]
  - - [2880, 7169, 1, 4096]
    - [192, 0.0]
  - - [2880, 7209, 1, 4096]
    - [193, 0.0]
  - - [5120, 4, 1, 2880]
    - [195, 0.0]
  - - [5120, 24, 1, 2880]
    - [196, 0.0]
  - - [5120, 48, 1, 2880]
    - [197, 0.0]
  - - [5120, 72, 1, 2880]
    - [198, 0.0]
  - - [5120, 96, 1, 2880]
    - [199, 0.0]
  - - [5120, 120, 1, 2880]
    - [200, 0.0]
  - - [5120, 144, 1, 2880]
    - [201, 0.0]
  - - [5120, 168, 1, 2880]
    - [202, 0.0]
  - - [5120, 192, 1, 2880]
    - [203, 0.0]
  - - [5120, 216, 1, 2880]
    - [204, 0.0]
  - - [5120, 240, 1, 2880]
    - [205, 0.0]
  - - [5120, 272, 1, 2880]
    - [206, 0.0]
  - - [5120, 304, 1, 2880]
    - [207, 0.0]
  - - [5120, 336, 1, 2880]
    - [208, 0.0]
  - - [5120, 368, 1, 2880]
    - [209, 0.0]
  - - [5120, 400, 1, 2880]
    - [210, 0.0]
  - - [5120, 432, 1, 2880]
    - [211, 0.0]
  - - [5120, 464, 1, 2880]
    - [212, 0.0]
  - - [5120, 496, 1, 2880]
    - [213, 0.0]
  - - [5120, 528, 1, 2880]
    - [214, 0.0]
  - - [5120, 560, 1, 2880]
    - [215, 0.0]
  - - [5120, 592, 1, 2880]
    - [216, 0.0]
  - - [5120, 624, 1, 2880]
    - [217, 0.0]
  - - [5120, 656, 1, 2880]
    - [218, 0.0]
  - - [5120, 688, 1, 2880]
    - [219, 0.0]
  - - [5120, 720, 1, 2880]
    - [220, 0.0]
  - - [5120, 752, 1, 2880]
    - [221, 0.0]
  - - [5120, 784, 1, 2880]
    - [222, 0.0]
  - - [5120, 816, 1, 2880]
    - [223, 0.0]
  - - [5120, 848, 1, 2880]
    - [224, 0.0]
  - - [5120, 880, 1, 2880]
    - [225, 0.0]
  - - [5120, 912, 1, 2880]
    - [226, 0.0]
  - - [5120, 944, 1, 2880]
    - [227, 0.0]
  - - [5120, 976, 1, 2880]
    - [228, 0.0]
  - - [5120, 1008, 1, 2880]
    - [229, 0.0]
  - - [5120, 1202, 1, 2880]
    - [230, 0.0]
  - - [5120, 1881, 1, 2880]
    - [231, 0.0]
  - - [5120, 2050, 1, 2880]
    - [232, 0.0]
  - - [5120, 4096, 1, 2880]
    - [233, 0.0]
  - - [25136, 5, 1, 2880]
    - [234, 0.0]
  - - [25136, 22, 1, 2880]
    - [235, 0.0]
  - - [25136, 40, 1, 2880]
    - [236, 0.0]
  - - [25136, 57, 1, 2880]
    - [237, 0.0]
  - - [25136, 74, 1, 2880]
    - [238, 0.0]
  - - [25136, 128, 1, 2880]
    - [239, 0.0]
  - - [201088, 5, 1, 2880]
    - [240, 0.0]
  - - [201088, 23, 1, 2880]
    - [241, 0.0]
  - - [201088, 40, 1, 2880]
    - [242, 0.0]
  - - [201088, 58, 1, 2880]
    - [243, 0.0]
  - - [201088, 79, 1, 2880]
    - [244, 0.0]
  - - [201088, 128, 1, 2880]
    - [245, 0.0]
  - - [16, 8192, 1, 8192]
    - [246, 0.0]
  - - [32000, 8192, 1, 8192]
    - [247, 0.0]
  - - [10240, 8192, 1, 16]
    - [248, 0.0]
  - - [8192, 8192, 1, 16]
    - [249, 0.0]
- null
- null
- DeviceEfficiency
- Equality
