projects/hipblaslt/library/src/amd_detail/rocblaslt/src/Tensile/Logic/asm_full/gfx1151/GridBased/gfx1151_Cijk_Alik_Bljk_HHS_BH_Bias_HAS_SAV_UserArgs.yaml
- {MinimumRequiredVersion: 5.0.0}
- gfx1151
- gfx1151
- [Device 1536]
    SolutionIndex: 0
    SolutionNameMin: Cijk_Alik_Bljk_HHS_BH_Bias_HA_S_SAV_UserArgs_MT128x96x64_MI16x16x1_SN_LDSB0_AFC1_AG0_AFEM1_AFEM1_ASEM1_CLR0_CADS0_DTLA0_DTLB0_DTVA0_DTVB0_EPS0_ELFLR0_EMLLn1_FDSI0_GRPM1_GRVWA8_GRVWB8_GSU1_GSUAMB_GSUC0_GSUWGMRR0_GLS0_ISA1151_IU1_K1_LDSTI0_LBSPPA128_LBSPPB128_LBSPPM0_LPA8_LPB8_LPM0_LRVW16_LWPMn1_MIAV1_MIWT2_6_MO40_NTn1_NTA0_NTB0_NTC0_NTD0_NTM0_NEPBS0_NLCA1_NLCB1_ONLL1_PGR2_PLR0_PKA0_SIA1_SS1_SU32_SUM0_SUS256_SPO0_SRVW0_SSO0_SVW1_SK0_SKFTR0_SKXCCM0_SGRO0_TIN0_TLDS1_ULSGRO0_USL1_UIOFGRO0_USFGROn1_VSn1_VWA1_VWB1_WSGRA0_WSGRB0_WS32_WG64_2_1_WGM8_WGMXCC1_WGMXCCGn1
    SolutionIndex: 1
    SolutionNameMin: Cijk_Alik_Bljk_HHS_BH_Bias_HA_S_SAV_UserArgs_MT128x80x64_MI16x16x1_SN_LDSB0_AFC1_AG0_AFEM1_AFEM1_ASEM1_CLR0_CADS0_DTLA0_DTLB0_DTVA0_DTVB0_EPS0_ELFLR0_EMLLn1_FDSI0_GRPM1_GRVWA8_GRVWB8_GSU1_GSUAMB_GSUC0_GSUWGMRR0_GLS0_ISA1151_IU1_K1_LDSTI0_LBSPPA128_LBSPPB128_LBSPPM0_LPA8_LPB8_LPM0_LRVW16_LWPMn1_MIAV1_MIWT2_5_MO40_NTn1_NTA0_NTB0_NTC0_NTD0_NTM0_NEPBS0_NLCA1_NLCB1_ONLL1_PGR2_PLR0_PKA0_SIA1_SS1_SU32_SUM0_SUS256_SPO0_SRVW0_SSO0_SVW1_SK0_SKFTR0_SKXCCM0_SGRO0_TIN0_TLDS1_ULSGRO0_USL1_UIOFGRO0_USFGROn1_VSn1_VWA1_VWB1_WSGRA0_WSGRB0_WS32_WG64_2_1_WGM8_WGMXCC1_WGMXCCGn1
    SolutionIndex: 2
    SolutionNameMin: Cijk_Alik_Bljk_HHS_BH_Bias_HA_S_SAV_UserArgs_MT96x128x64_MI16x16x1_SN_LDSB0_AFC1_AG0_AFEM1_AFEM1_ASEM1_CLR0_CADS0_DTLA0_DTLB0_DTVA0_DTVB0_EPS0_ELFLR0_EMLLn1_FDSI0_GRPM1_GRVWA8_GRVWB8_GSU1_GSUAMB_GSUC0_GSUWGMRR0_GLS0_ISA1151_IU1_K1_LDSTI0_LBSPPA128_LBSPPB128_LBSPPM0_LPA8_LPB8_LPM0_LRVW16_LWPMn1_MIAV1_MIWT6_2_MO40_NTn1_NTA0_NTB0_NTC0_NTD0_NTM0_NEPBS0_NLCA1_NLCB1_ONLL1_PGR2_PLR0_PKA0_SIA1_SS1_SU32_SUM0_SUS256_SPO0_SRVW0_SSO0_SVW1_SK0_SKFTR0_SKXCCM0_SGRO0_TIN0_TLDS1_ULSGRO0_USL1_UIOFGRO0_USFGROn1_VSn1_VWA1_VWB1_WSGRA0_WSGRB0_WS32_WG16_8_1_WGM8_WGMXCC1_WGMXCCGn1
    SolutionIndex: 3
    SolutionNameMin: Cijk_Alik_Bljk_HHS_BH_Bias_HA_S_SAV_UserArgs_MT96x128x64_MI16x16x1_SN_LDSB0_AFC1_AG0_AFEM1_AFEM1_ASEM1_CLR0_CADS0_DTLA0_DTLB0_DTVA0_DTVB0_EPS0_ELFLR0_EMLLn1_FDSI0_GRPM1_GRVWA8_GRVWB8_GSU1_GSUAMB_GSUC0_GSUWGMRR0_GLS0_ISA1151_IU1_K1_LDSTI0_LBSPPA128_LBSPPB128_LBSPPM0_LPA8_LPB8_LPM0_LRVW16_LWPMn1_MIAV1_MIWT3_4_MO40_NTn1_NTA0_NTB0_NTC0_NTD0_NTM0_NEPBS0_NLCA1_NLCB1_ONLL1_PGR0_PLR0_PKA0_SIA1_SS1_SU32_SUM0_SUS256_SPO0_SRVW0_SSO0_SVW1_SK0_SKFTR0_SKXCCM0_SGRO0_TIN0_TLDS1_ULSGRO0_USL1_UIOFGRO0_USFGROn1_VSn1_VWA1_VWB1_WSGRA0_WSGRB0_WS32_WG32_4_1_WGM8_WGMXCC1_WGMXCCGn1
    SolutionIndex: 4
    SolutionNameMin: Cijk_Alik_Bljk_HHS_BH_Bias_HA_S_SAV_UserArgs_MT96x128x64_MI16x16x1_SN_LDSB0_AFC1_AG0_AFEM1_AFEM1_ASEM1_CLR0_CADS0_DTLA0_DTLB0_DTVA0_DTVB0_EPS0_ELFLR0_EMLLn1_FDSI0_GRPM1_GRVWA8_GRVWB8_GSU1_GSUAMB_GSUC0_GSUWGMRR0_GLS0_ISA1151_IU1_K1_LDSTI0_LBSPPA128_LBSPPB128_LBSPPM0_LPA8_LPB8_LPM0_LRVW16_LWPMn1_MIAV1_MIWT3_4_MO40_NTn1_NTA0_NTB0_NTC0_NTD0_NTM0_NEPBS0_NLCA1_NLCB1_ONLL1_PGR2_PLR0_PKA0_SIA1_SS1_SU32_SUM0_SUS256_SPO0_SRVW0_SSO0_SVW1_SK0_SKFTR0_SKXCCM0_SGRO0_TIN0_TLDS1_ULSGRO0_USL1_UIOFGRO0_USFGROn1_VSn1_VWA1_VWB1_WSGRA0_WSGRB0_WS32_WG32_4_1_WGM8_WGMXCC1_WGMXCCGn1
    SolutionIndex: 5
    SolutionNameMin: Cijk_Alik_Bljk_HHS_BH_Bias_HA_S_SAV_UserArgs_MT96x96x64_MI16x16x1_SN_LDSB0_AFC1_AG0_AFEM1_AFEM1_ASEM1_CLR0_CADS0_DTLA0_DTLB0_DTVA0_DTVB0_EPS0_ELFLR0_EMLLn1_FDSI0_GRPM1_GRVWA8_GRVWB8_GSU1_GSUAMB_GSUC0_GSUWGMRR0_GLS0_ISA1151_IU1_K1_LDSTI0_LBSPPA128_LBSPPB128_LBSPPM0_LPA8_LPB8_LPM0_LRVW16_LWPMn1_MIAV1_MIWT3_3_MO40_NTn1_NTA0_NTB0_NTC0_NTD0_NTM0_NEPBS0_NLCA1_NLCB1_ONLL1_PGR2_PLR0_PKA0_SIA1_SS1_SU32_SUM0_SUS256_SPO0_SRVW0_SSO0_SVW1_SK0_SKFTR0_SKXCCM0_SGRO0_TIN0_TLDS1_ULSGRO0_USL1_UIOFGRO0_USFGROn1_VSn1_VWA1_VWB1_WSGRA0_WSGRB0_WS32_WG32_4_1_WGM8_WGMXCC1_WGMXCCGn1
    SolutionIndex: 6
    SolutionNameMin: Cijk_Alik_Bljk_HHS_BH_Bias_HA_S_SAV_UserArgs_MT128x96x64_MI16x16x1_SN_LDSB0_AFC1_AG0_AFEM1_AFEM1_ASEM1_CLR0_CADS0_DTLA0_DTLB0_DTVA0_DTVB0_EPS0_ELFLR0_EMLLn1_FDSI0_GRPM1_GRVWA8_GRVWB8_GSU1_GSUAMB_GSUC0_GSUWGMRR0_GLS0_ISA1151_IU1_K1_LDSTI0_LBSPPA128_LBSPPB128_LBSPPM0_LPA8_LPB8_LPM0_LRVW16_LWPMn1_MIAV1_MIWT4_3_MO40_NTn1_NTA0_NTB0_NTC0_NTD0_NTM0_NEPBS0_NLCA1_NLCB1_ONLL1_PGR2_PLR0_PKA0_SIA1_SS1_SU32_SUM0_SUS256_SPO0_SRVW0_SSO0_SVW1_SK0_SKFTR0_SKXCCM0_SGRO0_TIN0_TLDS1_ULSGRO0_USL1_UIOFGRO0_USFGROn1_VSn1_VWA1_VWB1_WSGRA0_WSGRB0_WS32_WG32_4_1_WGM8_WGMXCC1_WGMXCCGn1
    SolutionIndex: 7
    SolutionNameMin: Cijk_Alik_Bljk_HHS_BH_Bias_HA_S_SAV_UserArgs_MT64x128x32_MI16x16x1_SN_LDSB0_AFC1_AG0_AFEM1_AFEM1_ASEM1_CLR0_CADS0_DTLA0_DTLB0_DTVA0_DTVB0_EPS0_ELFLR0_EMLLn1_FDSI0_GRPM1_GRVWA8_GRVWB8_GSU1_GSUAMB_GSUC0_GSUWGMRR0_GLS0_ISA1151_IU1_K1_LDSTI0_LBSPPA128_LBSPPB128_LBSPPM0_LPA8_LPB8_LPM0_LRVW16_LWPMn1_MIAV1_MIWT4_2_MO40_NTn1_NTA0_NTB0_NTC0_NTD0_NTM0_NEPBS0_NLCA1_NLCB1_ONLL1_PGR2_PLR1_PKA0_SIA1_SS1_SU32_SUM0_SUS256_SPO0_SRVW0_SSO0_SVW1_SK0_SKFTR0_SKXCCM0_SGRO0_TIN0_TLDS1_ULSGRO0_USL1_UIOFGRO0_USFGROn1_VSn1_VWA1_VWB1_WSGRA0_WSGRB0_WS32_WG16_8_1_WGM8_WGMXCC1_WGMXCCGn1
    SolutionIndex: 8
    SolutionNameMin: Cijk_Alik_Bljk_HHS_BH_Bias_HA_S_SAV_UserArgs_MT64x64x32_MI16x16x1_SN_LDSB0_AFC1_AG0_AFEM1_AFEM1_ASEM1_CLR0_CADS0_DTLA0_DTLB0_DTVA0_DTVB0_EPS0_ELFLR0_EMLLn1_FDSI0_GRPM1_GRVWA8_GRVWB8_GSU1_GSUAMB_GSUC0_GSUWGMRR0_GLS0_ISA1151_IU1_K1_LDSTI0_LBSPPA128_LBSPPB128_LBSPPM0_LPA8_LPB8_LPM0_LRVW16_LWPMn1_MIAV1_MIWT2_2_MO40_NTn1_NTA0_NTB0_NTC0_NTD0_NTM0_NEPBS0_NLCA1_NLCB1_ONLL1_PGR1_PLR1_PKA0_SIA1_SS1_SU32_SUM0_SUS256_SPO0_SRVW0_SSO0_SVW1_SK0_SKFTR0_SKXCCM0_SGRO0_TIN0_TLDS1_ULSGRO0_USL1_UIOFGRO0_USFGROn1_VSn1_VWA1_VWB1_WSGRA0_WSGRB0_WS32_WG32_4_1_WGM8_WGMXCC1_WGMXCCGn1
    SolutionIndex: 9
    SolutionNameMin: Cijk_Alik_Bljk_HHS_BH_Bias_HA_S_SAV_UserArgs_MT64x128x32_MI16x16x1_SN_LDSB0_AFC1_AG0_AFEM1_AFEM1_ASEM1_CLR0_CADS0_DTLA0_DTLB0_DTVA0_DTVB0_EPS0_ELFLR0_EMLLn1_FDSI0_GRPM1_GRVWA8_GRVWB8_GSU1_GSUAMB_GSUC0_GSUWGMRR0_GLS0_ISA1151_IU1_K1_LDSTI0_LBSPPA128_LBSPPB128_LBSPPM0_LPA8_LPB8_LPM0_LRVW16_LWPMn1_MIAV1_MIWT2_4_MO40_NTn1_NTA0_NTB0_NTC0_NTD0_NTM0_NEPBS0_NLCA1_NLCB1_ONLL1_PGR0_PLR0_PKA0_SIA3_SS1_SU32_SUM0_SUS256_SPO0_SRVW0_SSO0_SVW1_SK0_SKFTR0_SKXCCM0_SGRO0_TIN0_TLDS1_ULSGRO0_USL1_UIOFGRO0_USFGROn1_VSn1_VWA1_VWB1_WSGRA0_WSGRB0_WS32_WG32_4_1_WGM8_WGMXCC1_WGMXCCGn1
    SolutionIndex: 10
    SolutionNameMin: Cijk_Alik_Bljk_HHS_BH_Bias_HA_S_SAV_UserArgs_MT64x64x32_MI16x16x1_SN_LDSB0_AFC1_AG0_AFEM1_AFEM1_ASEM1_CLR0_CADS0_DTLA0_DTLB0_DTVA0_DTVB0_EPS0_ELFLR0_EMLLn1_FDSI0_GRPM1_GRVWA8_GRVWB8_GSU1_GSUAMB_GSUC0_GSUWGMRR0_GLS0_ISA1151_IU1_K1_LDSTI0_LBSPPA128_LBSPPB128_LBSPPM0_LPA8_LPB8_LPM0_LRVW16_LWPMn1_MIAV1_MIWT2_2_MO40_NTn1_NTA0_NTB0_NTC0_NTD0_NTM0_NEPBS0_NLCA1_NLCB1_ONLL1_PGR2_PLR0_PKA0_SIA3_SS1_SU32_SUM0_SUS256_SPO0_SRVW0_SSO0_SVW1_SK0_SKFTR0_SKXCCM0_SGRO0_TIN0_TLDS1_ULSGRO0_USL1_UIOFGRO0_USFGROn1_VSn1_VWA1_VWB1_WSGRA0_WSGRB0_WS32_WG32_4_1_WGM8_WGMXCC1_WGMXCCGn1
    SolutionIndex: 11
    SolutionNameMin: Cijk_Alik_Bljk_HHS_BH_Bias_HA_S_SAV_UserArgs_MT64x64x32_MI16x16x1_SN_LDSB0_AFC1_AG0_AFEM1_AFEM1_ASEM1_CLR0_CADS0_DTLA0_DTLB0_DTVA0_DTVB0_EPS0_ELFLR0_EMLLn1_FDSI0_GRPM1_GRVWA8_GRVWB8_GSU1_GSUAMB_GSUC0_GSUWGMRR0_GLS0_ISA1151_IU1_K1_LDSTI0_LBSPPA128_LBSPPB128_LBSPPM0_LPA8_LPB8_LPM0_LRVW16_LWPMn1_MIAV1_MIWT2_2_MO40_NTn1_NTA0_NTB0_NTC0_NTD0_NTM0_NEPBS0_NLCA1_NLCB1_ONLL1_PGR2_PLR1_PKA0_SIA3_SS1_SU32_SUM0_SUS256_SPO0_SRVW0_SSO0_SVW1_SK0_SKFTR0_SKXCCM0_SGRO0_TIN0_TLDS1_ULSGRO0_USL1_UIOFGRO0_USFGROn1_VSn1_VWA1_VWB1_WSGRA0_WSGRB0_WS32_WG32_4_1_WGM8_WGMXCC1_WGMXCCGn1
    SolutionIndex: 12
    SolutionNameMin: Cijk_Alik_Bljk_HHS_BH_Bias_HA_S_SAV_UserArgs_MT64x128x32_MI16x16x1_SN_LDSB0_AFC1_AG0_AFEM1_AFEM1_ASEM1_CLR0_CADS0_DTLA0_DTLB0_DTVA0_DTVB0_EPS0_ELFLR0_EMLLn1_FDSI0_GRPM1_GRVWA8_GRVWB8_GSU1_GSUAMB_GSUC0_GSUWGMRR0_GLS0_ISA1151_IU1_K1_LDSTI0_LBSPPA128_LBSPPB128_LBSPPM0_LPA8_LPB8_LPM0_LRVW16_LWPMn1_MIAV1_MIWT2_4_MO40_NTn1_NTA0_NTB0_NTC0_NTD0_NTM0_NEPBS0_NLCA1_NLCB1_ONLL1_PGR2_PLR0_PKA0_SIA3_SS1_SU32_SUM0_SUS256_SPO0_SRVW0_SSO0_SVW1_SK0_SKFTR0_SKXCCM0_SGRO0_TIN0_TLDS1_ULSGRO0_USL1_UIOFGRO0_USFGROn1_VSn1_VWA1_VWB1_WSGRA0_WSGRB0_WS32_WG32_4_1_WGM8_WGMXCC1_WGMXCCGn1
    SolutionIndex: 13
    SolutionNameMin: Cijk_Alik_Bljk_HHS_BH_Bias_HA_S_SAV_UserArgs_MT64x128x32_MI16x16x1_SN_LDSB0_AFC1_AG0_AFEM1_AFEM1_ASEM1_CLR0_CADS0_DTLA0_DTLB0_DTVA0_DTVB0_EPS0_ELFLR0_EMLLn1_FDSI0_GRPM1_GRVWA8_GRVWB8_GSU1_GSUAMB_GSUC0_GSUWGMRR0_GLS0_ISA1151_IU1_K1_LDSTI0_LBSPPA128_LBSPPB128_LBSPPM0_LPA8_LPB8_LPM0_LRVW16_LWPMn1_MIAV1_MIWT4_2_MO40_NTn1_NTA0_NTB0_NTC0_NTD0_NTM0_NEPBS0_NLCA1_NLCB1_ONLL1_PGR0_PLR1_PKA0_SIA1_SS1_SU32_SUM0_SUS256_SPO0_SRVW0_SSO0_SVW1_SK0_SKFTR0_SKXCCM0_SGRO0_TIN0_TLDS1_ULSGRO0_USL1_UIOFGRO0_USFGROn1_VSn1_VWA1_VWB1_WSGRA0_WSGRB0_WS32_WG16_8_1_WGM8_WGMXCC1_WGMXCCGn1
    SolutionIndex: 14
    SolutionNameMin: Cijk_Alik_Bljk_HHS_BH_Bias_HA_S_SAV_UserArgs_MT128x64x32_MI16x16x1_SN_LDSB1_AFC1_AG0_AFEM1_AFEM1_ASEM1_CLR0_CADS0_DTLA0_DTLB0_DTVA0_DTVB0_EPS0_ELFLR0_EMLLn1_FDSI0_GRPM1_GRVWA8_GRVWB8_GSU1_GSUAMB_GSUC0_GSUWGMRR0_GLS0_ISA1151_IU1_K1_LDSTI0_LBSPPA128_LBSPPB128_LBSPPM0_LPA8_LPB8_LPM0_LRVW16_LWPMn1_MIAV1_MIWT2_4_MO40_NTn1_NTA0_NTB0_NTC0_NTD0_NTM0_NEPBS0_NLCA1_NLCB1_ONLL1_PGR2_PLR1_PKA0_SIA3_SS1_SU32_SUM0_SUS256_SPO0_SRVW0_SSO0_SVW1_SK0_SKFTR0_SKXCCM0_SGRO0_TIN0_TLDS1_ULSGRO0_USL1_UIOFGRO0_USFGROn1_VSn1_VWA1_VWB1_WSGRA0_WSGRB0_WS32_WG64_2_1_WGM8_WGMXCC1_WGMXCCGn1
    SolutionIndex: 15
    SolutionNameMin: Cijk_Alik_Bljk_HHS_BH_Bias_HA_S_SAV_UserArgs_MT64x128x32_MI16x16x1_SN_LDSB1_AFC1_AG0_AFEM1_AFEM1_ASEM1_CLR0_CADS0_DTLA0_DTLB0_DTVA0_DTVB0_EPS0_ELFLR0_EMLLn1_FDSI0_GRPM1_GRVWA8_GRVWB8_GSU1_GSUAMB_GSUC0_GSUWGMRR0_GLS0_ISA1151_IU1_K1_LDSTI0_LBSPPA128_LBSPPB128_LBSPPM0_LPA8_LPB8_LPM0_LRVW16_LWPMn1_MIAV1_MIWT2_4_MO40_NTn1_NTA0_NTB0_NTC0_NTD0_NTM0_NEPBS0_NLCA1_NLCB1_ONLL1_PGR2_PLR1_PKA0_SIA3_SS1_SU32_SUM0_SUS256_SPO0_SRVW0_SSO0_SVW1_SK0_SKFTR0_SKXCCM0_SGRO0_TIN0_TLDS1_ULSGRO0_USL1_UIOFGRO0_USFGROn1_VSn1_VWA1_VWB1_WSGRA0_WSGRB0_WS32_WG32_4_1_WGM8_WGMXCC1_WGMXCCGn1
    SolutionIndex: 16
    SolutionNameMin: Cijk_Alik_Bljk_HHS_BH_Bias_HA_S_SAV_UserArgs_MT64x128x32_MI16x16x1_SN_LDSB0_AFC1_AG0_AFEM1_AFEM1_ASEM1_CLR0_CADS0_DTLA0_DTLB0_DTVA0_DTVB0_EPS0_ELFLR0_EMLLn1_FDSI0_GRPM1_GRVWA8_GRVWB8_GSU1_GSUAMB_GSUC0_GSUWGMRR0_GLS0_ISA1151_IU1_K1_LDSTI0_LBSPPA128_LBSPPB128_LBSPPM0_LPA8_LPB8_LPM0_LRVW16_LWPMn1_MIAV1_MIWT4_2_MO40_NTn1_NTA0_NTB0_NTC0_NTD0_NTM0_NEPBS0_NLCA1_NLCB1_ONLL1_PGR0_PLR0_PKA0_SIA3_SS1_SU32_SUM0_SUS256_SPO0_SRVW0_SSO0_SVW1_SK0_SKFTR0_SKXCCM0_SGRO0_TIN0_TLDS1_ULSGRO0_USL1_UIOFGRO0_USFGROn1_VSn1_VWA1_VWB1_WSGRA0_WSGRB0_WS32_WG16_8_1_WGM8_WGMXCC1_WGMXCCGn1
    SolutionIndex: 17
    SolutionNameMin: Cijk_Alik_Bljk_HHS_BH_Bias_HA_S_SAV_UserArgs_MT64x128x32_MI16x16x1_SN_LDSB0_AFC1_AG0_AFEM1_AFEM1_ASEM1_CLR0_CADS0_DTLA0_DTLB0_DTVA0_DTVB0_EPS0_ELFLR0_EMLLn1_FDSI0_GRPM1_GRVWA8_GRVWB8_GSU1_GSUAMB_GSUC0_GSUWGMRR0_GLS0_ISA1151_IU1_K1_LDSTI0_LBSPPA128_LBSPPB128_LBSPPM0_LPA8_LPB8_LPM0_LRVW16_LWPMn1_MIAV1_MIWT2_4_MO40_NTn1_NTA0_NTB0_NTC0_NTD0_NTM0_NEPBS0_NLCA1_NLCB1_ONLL1_PGR0_PLR0_PKA0_SIA1_SS1_SU32_SUM0_SUS256_SPO0_SRVW0_SSO0_SVW1_SK0_SKFTR0_SKXCCM0_SGRO0_TIN0_TLDS1_ULSGRO0_USL1_UIOFGRO0_USFGROn1_VSn1_VWA1_VWB1_WSGRA0_WSGRB0_WS32_WG32_4_1_WGM8_WGMXCC1_WGMXCCGn1
    SolutionIndex: 18
    SolutionNameMin: Cijk_Alik_Bljk_HHS_BH_Bias_HA_S_SAV_UserArgs_MT128x128x32_MI16x16x1_SN_LDSB0_AFC1_AG0_AFEM1_AFEM1_ASEM1_CLR0_CADS0_DTLA0_DTLB0_DTVA0_DTVB0_EPS0_ELFLR0_EMLLn1_FDSI0_GRPM1_GRVWA8_GRVWB8_GSU1_GSUAMB_GSUC0_GSUWGMRR0_GLS0_ISA1151_IU1_K1_LDSTI0_LBSPPA128_LBSPPB128_LBSPPM0_LPA8_LPB8_LPM0_LRVW16_LWPMn1_MIAV1_MIWT4_4_MO40_NTn1_NTA0_NTB0_NTC0_NTD0_NTM0_NEPBS0_NLCA1_NLCB1_ONLL1_PGR0_PLR0_PKA0_SIA1_SS1_SU32_SUM0_SUS256_SPO0_SRVW0_SSO0_SVW1_SK0_SKFTR0_SKXCCM0_SGRO0_TIN0_TLDS1_ULSGRO0_USL1_UIOFGRO0_USFGROn1_VSn1_VWA1_VWB1_WSGRA0_WSGRB0_WS32_WG32_4_1_WGM8_WGMXCC1_WGMXCCGn1
    SolutionIndex: 19
    SolutionNameMin: Cijk_Alik_Bljk_HHS_BH_Bias_HA_S_SAV_UserArgs_MT128x128x32_MI16x16x1_SN_LDSB0_AFC1_AG0_AFEM1_AFEM1_ASEM1_CLR0_CADS0_DTLA0_DTLB0_DTVA0_DTVB0_EPS0_ELFLR0_EMLLn1_FDSI0_GRPM1_GRVWA8_GRVWB8_GSU1_GSUAMB_GSUC0_GSUWGMRR0_GLS0_ISA1151_IU1_K1_LDSTI0_LBSPPA128_LBSPPB128_LBSPPM0_LPA8_LPB8_LPM0_LRVW16_LWPMn1_MIAV1_MIWT4_4_MO40_NTn1_NTA0_NTB0_NTC0_NTD0_NTM0_NEPBS0_NLCA1_NLCB1_ONLL1_PGR0_PLR0_PKA0_SIA3_SS1_SU32_SUM0_SUS256_SPO0_SRVW0_SSO0_SVW1_SK0_SKFTR0_SKXCCM0_SGRO0_TIN0_TLDS1_ULSGRO0_USL1_UIOFGRO0_USFGROn1_VSn1_VWA1_VWB1_WSGRA0_WSGRB0_WS32_WG32_4_1_WGM8_WGMXCC1_WGMXCCGn1
    SolutionIndex: 20
    SolutionNameMin: Cijk_Alik_Bljk_HHS_BH_Bias_HA_S_SAV_UserArgs_MT128x128x32_MI16x16x1_SN_LDSB0_AFC1_AG0_AFEM1_AFEM1_ASEM1_CLR0_CADS0_DTLA0_DTLB0_DTVA0_DTVB0_EPS0_ELFLR0_EMLLn1_FDSI0_GRPM1_GRVWA8_GRVWB8_GSU1_GSUAMB_GSUC0_GSUWGMRR0_GLS0_ISA1151_IU1_K1_LDSTI0_LBSPPA128_LBSPPB128_LBSPPM0_LPA8_LPB8_LPM0_LRVW16_LWPMn1_MIAV1_MIWT2_8_MO40_NTn1_NTA0_NTB0_NTC0_NTD0_NTM0_NEPBS0_NLCA1_NLCB1_ONLL1_PGR0_PLR0_PKA0_SIA3_SS1_SU32_SUM0_SUS256_SPO0_SRVW0_SSO0_SVW1_SK0_SKFTR0_SKXCCM0_SGRO0_TIN0_TLDS1_ULSGRO0_USL1_UIOFGRO0_USFGROn1_VSn1_VWA1_VWB1_WSGRA0_WSGRB0_WS32_WG64_2_1_WGM8_WGMXCC1_WGMXCCGn1
    SolutionIndex: 21
    SolutionNameMin: Cijk_Alik_Bljk_HHS_BH_Bias_HA_S_SAV_UserArgs_MT128x128x32_MI16x16x1_SN_LDSB0_AFC1_AG0_AFEM1_AFEM1_ASEM1_CLR0_CADS0_DTLA0_DTLB0_DTVA0_DTVB0_EPS0_ELFLR0_EMLLn1_FDSI0_GRPM1_GRVWA8_GRVWB8_GSU1_GSUAMB_GSUC0_GSUWGMRR0_GLS0_ISA1151_IU1_K1_LDSTI0_LBSPPA128_LBSPPB128_LBSPPM0_LPA8_LPB8_LPM0_LRVW16_LWPMn1_MIAV1_MIWT2_8_MO40_NTn1_NTA0_NTB0_NTC0_NTD0_NTM0_NEPBS0_NLCA1_NLCB1_ONLL1_PGR0_PLR0_PKA0_SIA1_SS1_SU32_SUM0_SUS256_SPO0_SRVW0_SSO0_SVW1_SK0_SKFTR0_SKXCCM0_SGRO0_TIN0_TLDS1_ULSGRO0_USL1_UIOFGRO0_USFGROn1_VSn1_VWA1_VWB1_WSGRA0_WSGRB0_WS32_WG64_2_1_WGM8_WGMXCC1_WGMXCCGn1
    SolutionIndex: 22
    SolutionNameMin: Cijk_Alik_Bljk_HHS_BH_Bias_HA_S_SAV_UserArgs_MT64x64x32_MI16x16x1_SN_LDSB0_AFC1_AG0_AFEM1_AFEM1_ASEM1_CLR0_CADS0_DTLA0_DTLB0_DTVA0_DTVB0_EPS0_ELFLR0_EMLLn1_FDSI0_GRPM1_GRVWA8_GRVWB8_GSU1_GSUAMB_GSUC0_GSUWGMRR0_GLS0_ISA1151_IU1_K1_LDSTI0_LBSPPA128_LBSPPB128_LBSPPM0_LPA8_LPB8_LPM0_LRVW16_LWPMn1_MIAV1_MIWT4_4_MO40_NTn1_NTA0_NTB0_NTC0_NTD0_NTM0_NEPBS0_NLCA1_NLCB1_ONLL1_PGR0_PLR0_PKA0_SIA3_SS1_SU32_SUM0_SUS256_SPO0_SRVW0_SSO0_SVW1_SK0_SKFTR0_SKXCCM0_SGRO0_TIN0_TLDS1_ULSGRO0_USL1_UIOFGRO0_USFGROn1_VSn1_VWA1_VWB1_WSGRA0_WSGRB0_WS32_WG16_2_1_WGM8_WGMXCC1_WGMXCCGn1
    SolutionIndex: 23
    SolutionNameMin: Cijk_Alik_Bljk_HHS_BH_Bias_HA_S_SAV_UserArgs_MT64x64x32_MI16x16x1_SN_LDSB0_AFC1_AG0_AFEM1_AFEM1_ASEM1_CLR0_CADS0_DTLA0_DTLB0_DTVA0_DTVB0_EPS0_ELFLR0_EMLLn1_FDSI0_GRPM1_GRVWA8_GRVWB8_GSU1_GSUAMB_GSUC0_GSUWGMRR0_GLS0_ISA1151_IU1_K1_LDSTI0_LBSPPA128_LBSPPB128_LBSPPM0_LPA8_LPB8_LPM0_LRVW16_LWPMn1_MIAV1_MIWT2_2_MO40_NTn1_NTA0_NTB0_NTC0_NTD0_NTM0_NEPBS0_NLCA1_NLCB1_ONLL1_PGR1_PLR0_PKA0_SIA3_SS1_SU32_SUM0_SUS256_SPO0_SRVW0_SSO0_SVW1_SK0_SKFTR0_SKXCCM0_SGRO0_TIN0_TLDS1_ULSGRO0_USL1_UIOFGRO0_USFGROn1_VSn1_VWA1_VWB1_WSGRA0_WSGRB0_WS32_WG32_4_1_WGM8_WGMXCC1_WGMXCCGn1
    SolutionIndex: 24
    SolutionNameMin: Cijk_Alik_Bljk_HHS_BH_Bias_HA_S_SAV_UserArgs_MT128x64x32_MI16x16x1_SN_LDSB1_AFC1_AG0_AFEM1_AFEM1_ASEM1_CLR0_CADS0_DTLA0_DTLB0_DTVA0_DTVB0_EPS0_ELFLR0_EMLLn1_FDSI0_GRPM1_GRVWA8_GRVWB8_GSU1_GSUAMB_GSUC0_GSUWGMRR0_GLS0_ISA1151_IU1_K1_LDSTI0_LBSPPA128_LBSPPB128_LBSPPM0_LPA8_LPB8_LPM0_LRVW16_LWPMn1_MIAV1_MIWT2_4_MO40_NTn1_NTA0_NTB0_NTC0_NTD0_NTM0_NEPBS0_NLCA1_NLCB1_ONLL1_PGR1_PLR1_PKA0_SIA3_SS1_SU32_SUM0_SUS256_SPO0_SRVW0_SSO0_SVW1_SK0_SKFTR0_SKXCCM0_SGRO0_TIN0_TLDS1_ULSGRO0_USL1_UIOFGRO0_USFGROn1_VSn1_VWA1_VWB1_WSGRA0_WSGRB0_WS32_WG64_2_1_WGM8_WGMXCC1_WGMXCCGn1
    SolutionIndex: 25
    SolutionNameMin: Cijk_Alik_Bljk_HHS_BH_Bias_HA_S_SAV_UserArgs_MT128x48x32_MI16x16x1_SN_LDSB0_AFC1_AG0_AFEM1_AFEM1_ASEM1_CLR0_CADS0_DTLA0_DTLB0_DTVA0_DTVB0_EPS0_ELFLR0_EMLLn1_FDSI0_GRPM1_GRVWA8_GRVWB4_GSU1_GSUAMB_GSUC0_GSUWGMRR0_GLS0_ISA1151_IU1_K1_LDSTI0_LBSPPA128_LBSPPB128_LBSPPM0_LPA8_LPB8_LPM0_LRVW16_LWPMn1_MIAV1_MIWT2_3_MO40_NTn1_NTA0_NTB0_NTC0_NTD0_NTM0_NEPBS0_NLCA1_NLCB1_ONLL1_PGR2_PLR0_PKA0_SIA1_SS1_SU32_SUM0_SUS256_SPO0_SRVW0_SSO0_SVW1_SK0_SKFTR0_SKXCCM0_SGRO0_TIN0_TLDS1_ULSGRO0_USL1_UIOFGRO0_USFGROn1_VSn1_VWA1_VWB1_WSGRA0_WSGRB0_WS32_WG64_2_1_WGM8_WGMXCC1_WGMXCCGn1
    SolutionIndex: 26
    SolutionNameMin: Cijk_Alik_Bljk_HHS_BH_Bias_HA_S_SAV_UserArgs_MT64x64x32_MI16x16x1_SN_LDSB0_AFC1_AG0_AFEM1_AFEM1_ASEM1_CLR0_CADS0_DTLA0_DTLB0_DTVA0_DTVB0_EPS0_ELFLR0_EMLLn1_FDSI0_GRPM1_GRVWA8_GRVWB8_GSU1_GSUAMB_GSUC0_GSUWGMRR0_GLS0_ISA1151_IU1_K1_LDSTI0_LBSPPA128_LBSPPB128_LBSPPM0_LPA8_LPB8_LPM0_LRVW16_LWPMn1_MIAV1_MIWT2_2_MO40_NTn1_NTA0_NTB0_NTC0_NTD0_NTM0_NEPBS0_NLCA1_NLCB1_ONLL1_PGR2_PLR0_PKA0_SIA1_SS1_SU32_SUM0_SUS256_SPO0_SRVW0_SSO0_SVW1_SK0_SKFTR0_SKXCCM0_SGRO0_TIN0_TLDS1_ULSGRO0_USL1_UIOFGRO0_USFGROn1_VSn1_VWA1_VWB1_WSGRA0_WSGRB0_WS32_WG32_4_1_WGM8_WGMXCC1_WGMXCCGn1
    SolutionIndex: 27
    SolutionNameMin: Cijk_Alik_Bljk_HHS_BH_Bias_HA_S_SAV_UserArgs_MT64x64x32_MI16x16x1_SN_LDSB0_AFC1_AG0_AFEM1_AFEM1_ASEM1_CLR0_CADS0_DTLA0_DTLB0_DTVA0_DTVB0_EPS0_ELFLR0_EMLLn1_FDSI0_GRPM1_GRVWA8_GRVWB8_GSU1_GSUAMB_GSUC0_GSUWGMRR0_GLS0_ISA1151_IU1_K1_LDSTI0_LBSPPA128_LBSPPB128_LBSPPM0_LPA8_LPB8_LPM0_LRVW16_LWPMn1_MIAV1_MIWT2_2_MO40_NTn1_NTA0_NTB0_NTC0_NTD0_NTM0_NEPBS0_NLCA1_NLCB1_ONLL1_PGR2_PLR1_PKA0_SIA1_SS1_SU32_SUM0_SUS256_SPO0_SRVW0_SSO0_SVW1_SK0_SKFTR0_SKXCCM0_SGRO0_TIN0_TLDS1_ULSGRO0_USL1_UIOFGRO0_USFGROn1_VSn1_VWA1_VWB1_WSGRA0_WSGRB0_WS32_WG32_4_1_WGM8_WGMXCC1_WGMXCCGn1
    SolutionIndex: 28
    SolutionNameMin: Cijk_Alik_Bljk_HHS_BH_Bias_HA_S_SAV_UserArgs_MT64x128x32_MI16x16x1_SN_LDSB0_AFC1_AG0_AFEM1_AFEM1_ASEM1_CLR0_CADS0_DTLA0_DTLB0_DTVA0_DTVB0_EPS0_ELFLR0_EMLLn1_FDSI0_GRPM1_GRVWA8_GRVWB8_GSU1_GSUAMB_GSUC0_GSUWGMRR0_GLS0_ISA1151_IU1_K1_LDSTI0_LBSPPA128_LBSPPB128_LBSPPM0_LPA8_LPB8_LPM0_LRVW16_LWPMn1_MIAV1_MIWT4_2_MO40_NTn1_NTA0_NTB0_NTC0_NTD0_NTM0_NEPBS0_NLCA1_NLCB1_ONLL1_PGR0_PLR0_PKA0_SIA1_SS1_SU32_SUM0_SUS256_SPO0_SRVW0_SSO0_SVW1_SK0_SKFTR0_SKXCCM0_SGRO0_TIN0_TLDS1_ULSGRO0_USL1_UIOFGRO0_USFGROn1_VSn1_VWA1_VWB1_WSGRA0_WSGRB0_WS32_WG16_8_1_WGM8_WGMXCC1_WGMXCCGn1
    SolutionIndex: 29
    SolutionNameMin: Cijk_Alik_Bljk_HHS_BH_Bias_HA_S_SAV_UserArgs_MT64x128x32_MI16x16x1_SN_LDSB1_AFC1_AG0_AFEM1_AFEM1_ASEM1_CLR0_CADS0_DTLA0_DTLB0_DTVA0_DTVB0_EPS0_ELFLR0_EMLLn1_FDSI0_GRPM1_GRVWA8_GRVWB8_GSU1_GSUAMB_GSUC0_GSUWGMRR0_GLS0_ISA1151_IU1_K1_LDSTI0_LBSPPA128_LBSPPB128_LBSPPM0_LPA8_LPB8_LPM0_LRVW16_LWPMn1_MIAV1_MIWT4_2_MO40_NTn1_NTA0_NTB0_NTC0_NTD0_NTM0_NEPBS0_NLCA1_NLCB1_ONLL1_PGR2_PLR1_PKA0_SIA3_SS1_SU32_SUM0_SUS256_SPO0_SRVW0_SSO0_SVW1_SK0_SKFTR0_SKXCCM0_SGRO0_TIN0_TLDS1_ULSGRO0_USL1_UIOFGRO0_USFGROn1_VSn1_VWA1_VWB1_WSGRA0_WSGRB0_WS32_WG16_8_1_WGM8_WGMXCC1_WGMXCCGn1
    SolutionIndex: 30
    SolutionNameMin: Cijk_Alik_Bljk_HHS_BH_Bias_HA_S_SAV_UserArgs_MT96x128x32_MI16x16x1_SN_LDSB1_AFC1_AG0_AFEM1_AFEM1_ASEM1_CLR0_CADS0_DTLA0_DTLB0_DTVA0_DTVB0_EPS0_ELFLR0_EMLLn1_FDSI0_GRPM1_GRVWA8_GRVWB8_GSU1_GSUAMB_GSUC0_GSUWGMRR0_GLS0_ISA1151_IU1_K1_LDSTI0_LBSPPA128_LBSPPB128_LBSPPM0_LPA8_LPB8_LPM0_LRVW16_LWPMn1_MIAV1_MIWT3_4_MO40_NTn1_NTA0_NTB0_NTC0_NTD0_NTM0_NEPBS0_NLCA1_NLCB1_ONLL1_PGR2_PLR1_PKA0_SIA3_SS1_SU32_SUM0_SUS256_SPO0_SRVW0_SSO0_SVW1_SK0_SKFTR0_SKXCCM0_SGRO0_TIN0_TLDS1_ULSGRO0_USL1_UIOFGRO0_USFGROn1_VSn1_VWA1_VWB1_WSGRA0_WSGRB0_WS32_WG32_4_1_WGM8_WGMXCC1_WGMXCCGn1
    SolutionIndex: 31
    SolutionNameMin: Cijk_Alik_Bljk_HHS_BH_Bias_HA_S_SAV_UserArgs_MT96x128x32_MI16x16x1_SN_LDSB1_AFC1_AG0_AFEM1_AFEM1_ASEM1_CLR0_CADS0_DTLA0_DTLB0_DTVA0_DTVB0_EPS0_ELFLR0_EMLLn1_FDSI0_GRPM1_GRVWA8_GRVWB8_GSU1_GSUAMB_GSUC0_GSUWGMRR0_GLS0_ISA1151_IU1_K1_LDSTI0_LBSPPA128_LBSPPB128_LBSPPM0_LPA8_LPB8_LPM0_LRVW16_LWPMn1_MIAV1_MIWT3_4_MO40_NTn1_NTA0_NTB0_NTC0_NTD0_NTM0_NEPBS0_NLCA1_NLCB1_ONLL1_PGR1_PLR1_PKA0_SIA3_SS1_SU32_SUM0_SUS256_SPO0_SRVW0_SSO0_SVW1_SK0_SKFTR0_SKXCCM0_SGRO0_TIN0_TLDS1_ULSGRO0_USL1_UIOFGRO0_USFGROn1_VSn1_VWA1_VWB1_WSGRA0_WSGRB0_WS32_WG32_4_1_WGM8_WGMXCC1_WGMXCCGn1
    SolutionIndex: 32
    SolutionNameMin: Cijk_Alik_Bljk_HHS_BH_Bias_HA_S_SAV_UserArgs_MT64x128x32_MI16x16x1_SN_LDSB0_AFC1_AG0_AFEM1_AFEM1_ASEM1_CLR0_CADS0_DTLA0_DTLB0_DTVA0_DTVB0_EPS0_ELFLR0_EMLLn1_FDSI0_GRPM1_GRVWA8_GRVWB8_GSU1_GSUAMB_GSUC0_GSUWGMRR0_GLS0_ISA1151_IU1_K1_LDSTI0_LBSPPA128_LBSPPB128_LBSPPM0_LPA8_LPB8_LPM0_LRVW16_LWPMn1_MIAV1_MIWT4_2_MO40_NTn1_NTA0_NTB0_NTC0_NTD0_NTM0_NEPBS0_NLCA1_NLCB1_ONLL1_PGR0_PLR1_PKA0_SIA3_SS1_SU32_SUM0_SUS256_SPO0_SRVW0_SSO0_SVW1_SK0_SKFTR0_SKXCCM0_SGRO0_TIN0_TLDS1_ULSGRO0_USL1_UIOFGRO0_USFGROn1_VSn1_VWA1_VWB1_WSGRA0_WSGRB0_WS32_WG16_8_1_WGM8_WGMXCC1_WGMXCCGn1
    SolutionIndex: 33
    SolutionNameMin: Cijk_Alik_Bljk_HHS_BH_Bias_HA_S_SAV_UserArgs_MT80x128x32_MI16x16x1_SN_LDSB1_AFC1_AG0_AFEM1_AFEM1_ASEM1_CLR0_CADS0_DTLA0_DTLB0_DTVA0_DTVB0_EPS0_ELFLR0_EMLLn1_FDSI0_GRPM1_GRVWA4_GRVWB8_GSU1_GSUAMB_GSUC0_GSUWGMRR0_GLS0_ISA1151_IU1_K1_LDSTI0_LBSPPA128_LBSPPB128_LBSPPM0_LPA8_LPB8_LPM0_LRVW16_LWPMn1_MIAV1_MIWT5_2_MO40_NTn1_NTA0_NTB0_NTC0_NTD0_NTM0_NEPBS0_NLCA1_NLCB1_ONLL1_PGR2_PLR1_PKA0_SIA3_SS1_SU32_SUM0_SUS256_SPO0_SRVW0_SSO0_SVW1_SK0_SKFTR0_SKXCCM0_SGRO0_TIN0_TLDS1_ULSGRO0_USL1_UIOFGRO0_USFGROn1_VSn1_VWA1_VWB1_WSGRA0_WSGRB0_WS32_WG16_8_1_WGM8_WGMXCC1_WGMXCCGn1
    SolutionIndex: 35
    SolutionNameMin: Cijk_Alik_Bljk_HHS_BH_Bias_HA_S_SAV_UserArgs_MT96x128x32_MI16x16x1_SN_LDSB0_AFC1_AG0_AFEM1_AFEM1_ASEM1_CLR0_CADS0_DTLA0_DTLB0_DTVA0_DTVB0_EPS0_ELFLR0_EMLLn1_FDSI0_GRPM1_GRVWA8_GRVWB8_GSU1_GSUAMB_GSUC0_GSUWGMRR0_GLS0_ISA1151_IU1_K1_LDSTI0_LBSPPA128_LBSPPB128_LBSPPM0_LPA8_LPB8_LPM0_LRVW16_LWPMn1_MIAV1_MIWT3_4_MO40_NTn1_NTA0_NTB0_NTC0_NTD0_NTM0_NEPBS0_NLCA1_NLCB1_ONLL1_PGR0_PLR0_PKA0_SIA3_SS1_SU32_SUM0_SUS256_SPO0_SRVW0_SSO0_SVW1_SK0_SKFTR0_SKXCCM0_SGRO0_TIN0_TLDS1_ULSGRO0_USL1_UIOFGRO0_USFGROn1_VSn1_VWA1_VWB1_WSGRA0_WSGRB0_WS32_WG32_4_1_WGM8_WGMXCC1_WGMXCCGn1
    SolutionIndex: 36
    SolutionNameMin: Cijk_Alik_Bljk_HHS_BH_Bias_HA_S_SAV_UserArgs_MT128x80x32_MI16x16x1_SN_LDSB0_AFC1_AG0_AFEM1_AFEM1_ASEM1_CLR0_CADS0_DTLA0_DTLB0_DTVA0_DTVB0_EPS0_ELFLR0_EMLLn1_FDSI0_GRPM1_GRVWA8_GRVWB4_GSU1_GSUAMB_GSUC0_GSUWGMRR0_GLS0_ISA1151_IU1_K1_LDSTI0_LBSPPA128_LBSPPB128_LBSPPM0_LPA8_LPB8_LPM0_LRVW16_LWPMn1_MIAV1_MIWT2_5_MO40_NTn1_NTA0_NTB0_NTC0_NTD0_NTM0_NEPBS0_NLCA1_NLCB1_ONLL1_PGR0_PLR0_PKA0_SIA3_SS1_SU32_SUM0_SUS256_SPO0_SRVW0_SSO0_SVW1_SK0_SKFTR0_SKXCCM0_SGRO0_TIN0_TLDS1_ULSGRO0_USL1_UIOFGRO0_USFGROn1_VSn1_VWA1_VWB1_WSGRA0_WSGRB0_WS32_WG64_2_1_WGM8_WGMXCC1_WGMXCCGn1
    SolutionIndex: 37
    SolutionNameMin: Cijk_Alik_Bljk_HHS_BH_Bias_HA_S_SAV_UserArgs_MT128x80x64_MI16x16x1_SN_LDSB1_AFC1_AG0_AFEM1_AFEM1_ASEM1_CLR0_CADS0_DTLA0_DTLB0_DTVA0_DTVB0_EPS0_ELFLR0_EMLLn1_FDSI0_GRPM1_GRVWA8_GRVWB8_GSU1_GSUAMB_GSUC0_GSUWGMRR0_GLS0_ISA1151_IU1_K1_LDSTI0_LBSPPA128_LBSPPB128_LBSPPM0_LPA8_LPB8_LPM0_LRVW16_LWPMn1_MIAV1_MIWT2_5_MO40_NTn1_NTA0_NTB0_NTC0_NTD0_NTM0_NEPBS0_NLCA1_NLCB1_ONLL1_PGR2_PLR1_PKA0_SIA3_SS1_SU32_SUM0_SUS256_SPO0_SRVW0_SSO0_SVW1_SK0_SKFTR0_SKXCCM0_SGRO0_TIN0_TLDS1_ULSGRO0_USL1_UIOFGRO0_USFGROn1_VSn1_VWA1_VWB1_WSGRA0_WSGRB0_WS32_WG64_2_1_WGM8_WGMXCC1_WGMXCCGn1
    SolutionIndex: 38
    SolutionNameMin: Cijk_Alik_Bljk_HHS_BH_Bias_HA_S_SAV_UserArgs_MT128x64x32_MI16x16x1_SN_LDSB0_AFC1_AG0_AFEM1_AFEM1_ASEM1_CLR0_CADS0_DTLA0_DTLB0_DTVA0_DTVB0_EPS0_ELFLR0_EMLLn1_FDSI0_GRPM1_GRVWA8_GRVWB8_GSU1_GSUAMB_GSUC0_GSUWGMRR0_GLS0_ISA1151_IU1_K1_LDSTI0_LBSPPA128_LBSPPB128_LBSPPM0_LPA8_LPB8_LPM0_LRVW16_LWPMn1_MIAV1_MIWT2_4_MO40_NTn1_NTA0_NTB0_NTC0_NTD0_NTM0_NEPBS0_NLCA1_NLCB1_ONLL1_PGR0_PLR0_PKA0_SIA1_SS1_SU32_SUM0_SUS256_SPO0_SRVW0_SSO0_SVW1_SK0_SKFTR0_SKXCCM0_SGRO0_TIN0_TLDS1_ULSGRO0_USL1_UIOFGRO0_USFGROn1_VSn1_VWA1_VWB1_WSGRA0_WSGRB0_WS32_WG64_2_1_WGM8_WGMXCC1_WGMXCCGn1
    SolutionIndex: 39
    SolutionNameMin: Cijk_Alik_Bljk_HHS_BH_Bias_HA_S_SAV_UserArgs_MT128x64x32_MI16x16x1_SN_LDSB0_AFC1_AG0_AFEM1_AFEM1_ASEM1_CLR0_CADS0_DTLA0_DTLB0_DTVA0_DTVB0_EPS0_ELFLR0_EMLLn1_FDSI0_GRPM1_GRVWA8_GRVWB8_GSU1_GSUAMB_GSUC0_GSUWGMRR0_GLS0_ISA1151_IU1_K1_LDSTI0_LBSPPA128_LBSPPB128_LBSPPM0_LPA8_LPB8_LPM0_LRVW16_LWPMn1_MIAV1_MIWT2_4_MO40_NTn1_NTA0_NTB0_NTC0_NTD0_NTM0_NEPBS0_NLCA1_NLCB1_ONLL1_PGR0_PLR0_PKA0_SIA3_SS1_SU32_SUM0_SUS256_SPO0_SRVW0_SSO0_SVW1_SK0_SKFTR0_SKXCCM0_SGRO0_TIN0_TLDS1_ULSGRO0_USL1_UIOFGRO0_USFGROn1_VSn1_VWA1_VWB1_WSGRA0_WSGRB0_WS32_WG64_2_1_WGM8_WGMXCC1_WGMXCCGn1
    SolutionIndex: 40
    SolutionNameMin: Cijk_Alik_Bljk_HHS_BH_Bias_HA_S_SAV_UserArgs_MT128x80x32_MI16x16x1_SN_LDSB1_AFC1_AG0_AFEM1_AFEM1_ASEM1_CLR0_CADS0_DTLA0_DTLB0_DTVA0_DTVB0_EPS0_ELFLR0_EMLLn1_FDSI0_GRPM1_GRVWA8_GRVWB4_GSU1_GSUAMB_GSUC0_GSUWGMRR0_GLS0_ISA1151_IU1_K1_LDSTI0_LBSPPA128_LBSPPB128_LBSPPM0_LPA8_LPB8_LPM0_LRVW16_LWPMn1_MIAV1_MIWT2_5_MO40_NTn1_NTA0_NTB0_NTC0_NTD0_NTM0_NEPBS0_NLCA1_NLCB1_ONLL1_PGR2_PLR1_PKA0_SIA3_SS1_SU32_SUM0_SUS256_SPO0_SRVW0_SSO0_SVW1_SK0_SKFTR0_SKXCCM0_SGRO0_TIN0_TLDS1_ULSGRO0_USL1_UIOFGRO0_USFGROn1_VSn1_VWA1_VWB1_WSGRA0_WSGRB0_WS32_WG64_2_1_WGM8_WGMXCC1_WGMXCCGn1
    SolutionIndex: 42
    SolutionNameMin: Cijk_Alik_Bljk_HHS_BH_Bias_HA_S_SAV_UserArgs_MT64x128x32_MI16x16x1_SN_LDSB0_AFC1_AG0_AFEM1_AFEM1_ASEM1_CLR0_CADS0_DTLA0_DTLB0_DTVA0_DTVB0_EPS0_ELFLR0_EMLLn1_FDSI0_GRPM1_GRVWA8_GRVWB8_GSU1_GSUAMB_GSUC0_GSUWGMRR0_GLS0_ISA1151_IU1_K1_LDSTI0_LBSPPA128_LBSPPB128_LBSPPM0_LPA8_LPB8_LPM0_LRVW16_LWPMn1_MIAV1_MIWT4_2_MO40_NTn1_NTA0_NTB0_NTC0_NTD0_NTM0_NEPBS0_NLCA1_NLCB1_ONLL1_PGR1_PLR1_PKA0_SIA1_SS1_SU32_SUM0_SUS256_SPO0_SRVW0_SSO0_SVW1_SK0_SKFTR0_SKXCCM0_SGRO0_TIN0_TLDS1_ULSGRO0_USL1_UIOFGRO0_USFGROn1_VSn1_VWA1_VWB1_WSGRA0_WSGRB0_WS32_WG16_8_1_WGM8_WGMXCC1_WGMXCCGn1
    SolutionIndex: 43
    SolutionNameMin: Cijk_Alik_Bljk_HHS_BH_Bias_HA_S_SAV_UserArgs_MT64x128x64_MI16x16x1_SN_LDSB0_AFC1_AG0_AFEM1_AFEM1_ASEM1_CLR0_CADS0_DTLA0_DTLB0_DTVA0_DTVB0_EPS0_ELFLR0_EMLLn1_FDSI0_GRPM1_GRVWA8_GRVWB8_GSU1_GSUAMB_GSUC0_GSUWGMRR0_GLS0_ISA1151_IU1_K1_LDSTI0_LBSPPA128_LBSPPB128_LBSPPM0_LPA8_LPB8_LPM0_LRVW16_LWPMn1_MIAV1_MIWT4_2_MO40_NTn1_NTA0_NTB0_NTC0_NTD0_NTM0_NEPBS0_NLCA1_NLCB1_ONLL1_PGR2_PLR0_PKA0_SIA1_SS1_SU32_SUM0_SUS256_SPO0_SRVW0_SSO0_SVW1_SK0_SKFTR0_SKXCCM0_SGRO0_TIN0_TLDS1_ULSGRO0_USL1_UIOFGRO0_USFGROn1_VSn1_VWA1_VWB1_WSGRA0_WSGRB0_WS32_WG16_8_1_WGM8_WGMXCC1_WGMXCCGn1
    SolutionIndex: 44
    SolutionNameMin: Cijk_Alik_Bljk_HHS_BH_Bias_HA_S_SAV_UserArgs_MT64x128x64_MI16x16x1_SN_LDSB0_AFC1_AG0_AFEM1_AFEM1_ASEM1_CLR0_CADS0_DTLA0_DTLB0_DTVA0_DTVB0_EPS0_ELFLR0_EMLLn1_FDSI0_GRPM1_GRVWA8_GRVWB8_GSU1_GSUAMB_GSUC0_GSUWGMRR0_GLS0_ISA1151_IU1_K1_LDSTI0_LBSPPA128_LBSPPB128_LBSPPM0_LPA8_LPB8_LPM0_LRVW16_LWPMn1_MIAV1_MIWT4_2_MO40_NTn1_NTA0_NTB0_NTC0_NTD0_NTM0_NEPBS0_NLCA1_NLCB1_ONLL1_PGR1_PLR1_PKA0_SIA3_SS1_SU32_SUM0_SUS256_SPO0_SRVW0_SSO0_SVW1_SK0_SKFTR0_SKXCCM0_SGRO0_TIN0_TLDS1_ULSGRO0_USL1_UIOFGRO0_USFGROn1_VSn1_VWA1_VWB1_WSGRA0_WSGRB0_WS32_WG16_8_1_WGM8_WGMXCC1_WGMXCCGn1
    SolutionIndex: 45
    SolutionNameMin: Cijk_Alik_Bljk_HHS_BH_Bias_HA_S_SAV_UserArgs_MT64x64x32_MI16x16x1_SN_LDSB0_AFC1_AG0_AFEM1_AFEM1_ASEM1_CLR0_CADS0_DTLA0_DTLB0_DTVA0_DTVB0_EPS0_ELFLR0_EMLLn1_FDSI0_GRPM1_GRVWA8_GRVWB8_GSU1_GSUAMB_GSUC0_GSUWGMRR0_GLS0_ISA1151_IU1_K1_LDSTI0_LBSPPA128_LBSPPB128_LBSPPM0_LPA8_LPB8_LPM0_LRVW16_LWPMn1_MIAV1_MIWT2_2_MO40_NTn1_NTA0_NTB0_NTC0_NTD0_NTM0_NEPBS0_NLCA1_NLCB1_ONLL1_PGR1_PLR0_PKA0_SIA1_SS1_SU32_SUM0_SUS256_SPO0_SRVW0_SSO0_SVW1_SK0_SKFTR0_SKXCCM0_SGRO0_TIN0_TLDS1_ULSGRO0_USL1_UIOFGRO0_USFGROn1_VSn1_VWA1_VWB1_WSGRA0_WSGRB0_WS32_WG32_4_1_WGM8_WGMXCC1_WGMXCCGn1
    SolutionIndex: 46
    SolutionNameMin: Cijk_Alik_Bljk_HHS_BH_Bias_HA_S_SAV_UserArgs_MT64x64x64_MI16x16x1_SN_LDSB1_AFC1_AG0_AFEM1_AFEM1_ASEM1_CLR0_CADS0_DTLA0_DTLB0_DTVA0_DTVB0_EPS0_ELFLR0_EMLLn1_FDSI0_GRPM1_GRVWA8_GRVWB8_GSU1_GSUAMB_GSUC0_GSUWGMRR0_GLS0_ISA1151_IU1_K1_LDSTI0_LBSPPA128_LBSPPB128_LBSPPM0_LPA8_LPB8_LPM0_LRVW16_LWPMn1_MIAV1_MIWT2_2_MO40_NTn1_NTA0_NTB0_NTC0_NTD0_NTM0_NEPBS0_NLCA1_NLCB1_ONLL1_PGR2_PLR1_PKA0_SIA3_SS1_SU32_SUM0_SUS256_SPO0_SRVW0_SSO0_SVW1_SK0_SKFTR0_SKXCCM0_SGRO0_TIN0_TLDS1_ULSGRO0_USL1_UIOFGRO0_USFGROn1_VSn1_VWA1_VWB1_WSGRA0_WSGRB0_WS32_WG32_4_1_WGM8_WGMXCC1_WGMXCCGn1
    SolutionIndex: 47
    SolutionNameMin: Cijk_Alik_Bljk_HHS_BH_Bias_HA_S_SAV_UserArgs_MT160x64x32_MI16x16x1_SN_LDSB0_AFC1_AG0_AFEM1_AFEM1_ASEM1_CLR0_CADS0_DTLA0_DTLB0_DTVA0_DTVB0_EPS0_ELFLR0_EMLLn1_FDSI0_GRPM1_GRVWA8_GRVWB8_GSU1_GSUAMB_GSUC0_GSUWGMRR0_GLS0_ISA1151_IU1_K1_LDSTI0_LBSPPA128_LBSPPB128_LBSPPM0_LPA8_LPB8_LPM0_LRVW16_LWPMn1_MIAV1_MIWT5_2_MO40_NTn1_NTA0_NTB0_NTC0_NTD0_NTM0_NEPBS0_NLCA1_NLCB1_ONLL1_PGR2_PLR1_PKA0_SIA1_SS1_SU32_SUM0_SUS256_SPO0_SRVW0_SSO0_SVW1_SK0_SKFTR0_SKXCCM0_SGRO0_TIN0_TLDS1_ULSGRO0_USL1_UIOFGRO0_USFGROn1_VSn1_VWA1_VWB1_WSGRA0_WSGRB0_WS32_WG32_4_1_WGM8_WGMXCC1_WGMXCCGn1
    SolutionIndex: 50
    SolutionNameMin: Cijk_Alik_Bljk_HHS_BH_Bias_HA_S_SAV_UserArgs_MT80x128x64_MI16x16x1_SN_LDSB0_AFC1_AG0_AFEM1_AFEM1_ASEM1_CLR0_CADS0_DTLA0_DTLB0_DTVA0_DTVB0_EPS0_ELFLR0_EMLLn1_FDSI0_GRPM1_GRVWA8_GRVWB8_GSU1_GSUAMB_GSUC0_GSUWGMRR0_GLS0_ISA1151_IU1_K1_LDSTI0_LBSPPA128_LBSPPB128_LBSPPM0_LPA8_LPB8_LPM0_LRVW16_LWPMn1_MIAV1_MIWT5_2_MO40_NTn1_NTA0_NTB0_NTC0_NTD0_NTM0_NEPBS0_NLCA1_NLCB1_ONLL1_PGR2_PLR0_PKA0_SIA1_SS1_SU32_SUM0_SUS256_SPO0_SRVW0_SSO0_SVW1_SK0_SKFTR0_SKXCCM0_SGRO0_TIN0_TLDS1_ULSGRO0_USL1_UIOFGRO0_USFGROn1_VSn1_VWA1_VWB1_WSGRA0_WSGRB0_WS32_WG16_8_1_WGM8_WGMXCC1_WGMXCCGn1
    SolutionIndex: 51
    SolutionNameMin: Cijk_Alik_Bljk_HHS_BH_Bias_HA_S_SAV_UserArgs_MT80x128x32_MI16x16x1_SN_LDSB0_AFC1_AG0_AFEM1_AFEM1_ASEM1_CLR0_CADS0_DTLA0_DTLB0_DTVA0_DTVB0_EPS0_ELFLR0_EMLLn1_FDSI0_GRPM1_GRVWA4_GRVWB8_GSU1_GSUAMB_GSUC0_GSUWGMRR0_GLS0_ISA1151_IU1_K1_LDSTI0_LBSPPA128_LBSPPB128_LBSPPM0_LPA8_LPB8_LPM0_LRVW16_LWPMn1_MIAV1_MIWT5_2_MO40_NTn1_NTA0_NTB0_NTC0_NTD0_NTM0_NEPBS0_NLCA1_NLCB1_ONLL1_PGR2_PLR1_PKA0_SIA3_SS1_SU32_SUM0_SUS256_SPO0_SRVW0_SSO0_SVW1_SK0_SKFTR0_SKXCCM0_SGRO0_TIN0_TLDS1_ULSGRO0_USL1_UIOFGRO0_USFGROn1_VSn1_VWA1_VWB1_WSGRA0_WSGRB0_WS32_WG16_8_1_WGM8_WGMXCC1_WGMXCCGn1
    SolutionIndex: 54
    SolutionNameMin: Cijk_Alik_Bljk_HHS_BH_Bias_HA_S_SAV_UserArgs_MT32x16x128_MI16x16x1_SN_LDSB0_AFC1_AG0_AFEM1_AFEM1_ASEM1_CLR0_CADS0_DTLA0_DTLB0_DTVA0_DTVB0_EPS0_ELFLR0_EMLLn1_FDSI0_GRPM1_GRVWA8_GRVWB8_GSU1_GSUAMB_GSUC0_GSUWGMRR0_GLS0_ISA1151_IU1_K1_LDSTI0_LBSPPA256_LBSPPB256_LBSPPM0_LPA8_LPB8_LPM0_LRVW16_LWPMn1_MIAV1_MIWT1_1_MO40_NTn1_NTA0_NTB0_NTC0_NTD0_NTM0_NEPBS0_NLCA1_NLCB1_ONLL1_PGR1_PLR1_PKA0_SIA1_SS1_SU32_SUM0_SUS256_SPO0_SRVW0_SSO0_SVW1_SK0_SKFTR0_SKXCCM0_SGRO0_TIN0_TLDS1_ULSGRO0_USL1_UIOFGRO0_USFGROn1_VSn1_VWA1_VWB1_WSGRA0_WSGRB0_WS32_WG32_2_1_WGM8_WGMXCC1_WGMXCCGn1
    SolutionIndex: 55
    SolutionNameMin: Cijk_Alik_Bljk_HHS_BH_Bias_HA_S_SAV_UserArgs_MT32x16x64_MI16x16x1_SN_LDSB0_AFC1_AG0_AFEM1_AFEM1_ASEM1_CLR0_CADS0_DTLA0_DTLB0_DTVA0_DTVB0_EPS0_ELFLR0_EMLLn1_FDSI0_GRPM1_GRVWA8_GRVWB8_GSU1_GSUAMB_GSUC0_GSUWGMRR0_GLS0_ISA1151_IU1_K1_LDSTI0_LBSPPA128_LBSPPB128_LBSPPM0_LPA8_LPB8_LPM0_LRVW16_LWPMn1_MIAV1_MIWT1_1_MO40_NTn1_NTA0_NTB0_NTC0_NTD0_NTM0_NEPBS0_NLCA1_NLCB1_ONLL1_PGR2_PLR1_PKA0_SIA1_SS1_SU32_SUM0_SUS256_SPO0_SRVW0_SSO0_SVW1_SK0_SKFTR0_SKXCCM0_SGRO0_TIN0_TLDS1_ULSGRO0_USL1_UIOFGRO0_USFGROn1_VSn1_VWA1_VWB1_WSGRA0_WSGRB0_WS32_WG32_2_1_WGM8_WGMXCC1_WGMXCCGn1
    SolutionIndex: 57
    SolutionNameMin: Cijk_Alik_Bljk_HHS_BH_Bias_HA_S_SAV_UserArgs_MT32x16x32_MI16x16x1_SN_LDSB0_AFC1_AG0_AFEM1_AFEM1_ASEM1_CLR0_CADS0_DTLA0_DTLB0_DTVA0_DTVB0_EPS0_ELFLR0_EMLLn1_FDSI0_GRPM1_GRVWA8_GRVWB8_GSU1_GSUAMB_GSUC0_GSUWGMRR0_GLS0_ISA1151_IU1_K1_LDSTI0_LBSPPA128_LBSPPB128_LBSPPM0_LPA8_LPB8_LPM0_LRVW16_LWPMn1_MIAV1_MIWT1_1_MO40_NTn1_NTA0_NTB0_NTC0_NTD0_NTM0_NEPBS0_NLCA1_NLCB1_ONLL1_PGR2_PLR1_PKA0_SIA1_SS1_SU32_SUM0_SUS256_SPO0_SRVW0_SSO0_SVW1_SK0_SKFTR0_SKXCCM0_SGRO0_TIN0_TLDS1_ULSGRO0_USL1_UIOFGRO0_USFGROn1_VSn1_VWA1_VWB1_WSGRA0_WSGRB0_WS32_WG32_2_1_WGM8_WGMXCC1_WGMXCCGn1
    SolutionIndex: 58
    SolutionNameMin: Cijk_Alik_Bljk_HHS_BH_Bias_HA_S_SAV_UserArgs_MT32x32x64_MI16x16x1_SN_LDSB0_AFC1_AG0_AFEM1_AFEM1_ASEM1_CLR0_CADS0_DTLA0_DTLB0_DTVA0_DTVB0_EPS0_ELFLR0_EMLLn1_FDSI0_GRPM1_GRVWA8_GRVWB8_GSU1_GSUAMB_GSUC0_GSUWGMRR0_GLS0_ISA1151_IU1_K1_LDSTI0_LBSPPA128_LBSPPB128_LBSPPM0_LPA8_LPB8_LPM0_LRVW16_LWPMn1_MIAV1_MIWT1_1_MO40_NTn1_NTA0_NTB0_NTC0_NTD0_NTM0_NEPBS0_NLCA1_NLCB1_ONLL1_PGR2_PLR1_PKA0_SIA1_SS1_SU32_SUM0_SUS256_SPO0_SRVW0_SSO0_SVW1_SK0_SKFTR0_SKXCCM0_SGRO0_TIN0_TLDS1_ULSGRO0_USL1_UIOFGRO0_USFGROn1_VSn1_VWA1_VWB1_WSGRA0_WSGRB0_WS32_WG32_4_1_WGM8_WGMXCC1_WGMXCCGn1
    SolutionIndex: 59
    SolutionNameMin: Cijk_Alik_Bljk_HHS_BH_Bias_HA_S_SAV_UserArgs_MT64x32x32_MI16x16x1_SN_LDSB0_AFC1_AG0_AFEM1_AFEM1_ASEM1_CLR0_CADS0_DTLA0_DTLB0_DTVA0_DTVB0_EPS0_ELFLR0_EMLLn1_FDSI0_GRPM1_GRVWA8_GRVWB8_GSU1_GSUAMB_GSUC0_GSUWGMRR0_GLS0_ISA1151_IU1_K1_LDSTI0_LBSPPA128_LBSPPB128_LBSPPM0_LPA8_LPB8_LPM0_LRVW16_LWPMn1_MIAV1_MIWT1_2_MO40_NTn1_NTA0_NTB0_NTC0_NTD0_NTM0_NEPBS0_NLCA1_NLCB1_ONLL1_PGR2_PLR0_PKA0_SIA1_SS1_SU32_SUM0_SUS256_SPO0_SRVW0_SSO0_SVW1_SK0_SKFTR0_SKXCCM0_SGRO0_TIN0_TLDS1_ULSGRO0_USL1_UIOFGRO0_USFGROn1_VSn1_VWA1_VWB1_WSGRA0_WSGRB0_WS32_WG64_2_1_WGM8_WGMXCC1_WGMXCCGn1
    SolutionIndex: 61
    SolutionNameMin: Cijk_Alik_Bljk_HHS_BH_Bias_HA_S_SAV_UserArgs_MT32x64x32_MI16x16x1_SN_LDSB0_AFC1_AG0_AFEM1_AFEM1_ASEM1_CLR0_CADS0_DTLA0_DTLB0_DTVA0_DTVB0_EPS0_ELFLR0_EMLLn1_FDSI0_GRPM1_GRVWA8_GRVWB8_GSU1_GSUAMB_GSUC0_GSUWGMRR0_GLS0_ISA1151_IU1_K1_LDSTI0_LBSPPA128_LBSPPB128_LBSPPM0_LPA8_LPB8_LPM0_LRVW16_LWPMn1_MIAV1_MIWT2_1_MO40_NTn1_NTA0_NTB0_NTC0_NTD0_NTM0_NEPBS0_NLCA1_NLCB1_ONLL1_PGR2_PLR0_PKA0_SIA1_SS1_SU32_SUM0_SUS256_SPO0_SRVW0_SSO0_SVW1_SK0_SKFTR0_SKXCCM0_SGRO0_TIN0_TLDS1_ULSGRO0_USL1_UIOFGRO0_USFGROn1_VSn1_VWA1_VWB1_WSGRA0_WSGRB0_WS32_WG16_8_1_WGM8_WGMXCC1_WGMXCCGn1
    SolutionIndex: 62
    SolutionNameMin: Cijk_Alik_Bljk_HHS_BH_Bias_HA_S_SAV_UserArgs_MT64x64x64_MI16x16x1_SN_LDSB0_AFC1_AG0_AFEM1_AFEM1_ASEM1_CLR0_CADS0_DTLA0_DTLB0_DTVA0_DTVB0_EPS0_ELFLR0_EMLLn1_FDSI0_GRPM1_GRVWA8_GRVWB8_GSU1_GSUAMB_GSUC0_GSUWGMRR0_GLS0_ISA1151_IU1_K1_LDSTI0_LBSPPA128_LBSPPB128_LBSPPM0_LPA8_LPB8_LPM0_LRVW16_LWPMn1_MIAV1_MIWT2_2_MO40_NTn1_NTA0_NTB0_NTC0_NTD0_NTM0_NEPBS0_NLCA1_NLCB1_ONLL1_PGR2_PLR1_PKA0_SIA1_SS1_SU32_SUM0_SUS256_SPO0_SRVW0_SSO0_SVW1_SK0_SKFTR0_SKXCCM0_SGRO0_TIN0_TLDS1_ULSGRO0_USL1_UIOFGRO0_USFGROn1_VSn1_VWA1_VWB1_WSGRA0_WSGRB0_WS32_WG32_4_1_WGM8_WGMXCC1_WGMXCCGn1
    SolutionIndex: 63
    SolutionNameMin: Cijk_Alik_Bljk_HHS_BH_Bias_HA_S_SAV_UserArgs_MT64x16x128_MI16x16x1_SN_LDSB0_AFC1_AG0_AFEM1_AFEM1_ASEM1_CLR0_CADS0_DTLA0_DTLB0_DTVA0_DTVB0_EPS0_ELFLR0_EMLLn1_FDSI0_GRPM1_GRVWA8_GRVWB8_GSU1_GSUAMB_GSUC0_GSUWGMRR0_GLS0_ISA1151_IU1_K1_LDSTI0_LBSPPA256_LBSPPB256_LBSPPM0_LPA8_LPB8_LPM0_LRVW16_LWPMn1_MIAV1_MIWT1_1_MO40_NTn1_NTA0_NTB0_NTC0_NTD0_NTM0_NEPBS0_NLCA1_NLCB1_ONLL1_PGR2_PLR1_PKA0_SIA1_SS1_SU32_SUM0_SUS256_SPO0_SRVW0_SSO0_SVW1_SK0_SKFTR0_SKXCCM0_SGRO0_TIN0_TLDS1_ULSGRO0_USL1_UIOFGRO0_USFGROn1_VSn1_VWA1_VWB1_WSGRA0_WSGRB0_WS32_WG64_2_1_WGM8_WGMXCC1_WGMXCCGn1
    SolutionIndex: 67
    SolutionNameMin: Cijk_Alik_Bljk_HHS_BH_Bias_HA_S_SAV_UserArgs_MT64x32x128_MI16x16x1_SN_LDSB0_AFC1_AG0_AFEM1_AFEM1_ASEM1_CLR0_CADS0_DTLA0_DTLB0_DTVA0_DTVB0_EPS0_ELFLR0_EMLLn1_FDSI0_GRPM1_GRVWA8_GRVWB8_GSU1_GSUAMB_GSUC0_GSUWGMRR0_GLS0_ISA1151_IU1_K1_LDSTI0_LBSPPA256_LBSPPB256_LBSPPM0_LPA8_LPB8_LPM0_LRVW16_LWPMn1_MIAV1_MIWT1_2_MO40_NTn1_NTA0_NTB0_NTC0_NTD0_NTM0_NEPBS0_NLCA1_NLCB1_ONLL1_PGR1_PLR1_PKA0_SIA1_SS1_SU32_SUM0_SUS256_SPO0_SRVW0_SSO0_SVW1_SK0_SKFTR0_SKXCCM0_SGRO0_TIN0_TLDS1_ULSGRO0_USL1_UIOFGRO0_USFGROn1_VSn1_VWA1_VWB1_WSGRA0_WSGRB0_WS32_WG64_2_1_WGM8_WGMXCC1_WGMXCCGn1
    SolutionIndex: 68
    SolutionNameMin: Cijk_Alik_Bljk_HHS_BH_Bias_HA_S_SAV_UserArgs_MT32x64x128_MI16x16x1_SN_LDSB0_AFC1_AG0_AFEM1_AFEM1_ASEM1_CLR0_CADS0_DTLA0_DTLB0_DTVA0_DTVB0_EPS0_ELFLR0_EMLLn1_FDSI0_GRPM1_GRVWA8_GRVWB8_GSU1_GSUAMB_GSUC0_GSUWGMRR0_GLS0_ISA1151_IU1_K1_LDSTI0_LBSPPA256_LBSPPB256_LBSPPM0_LPA8_LPB8_LPM0_LRVW16_LWPMn1_MIAV1_MIWT1_2_MO40_NTn1_NTA0_NTB0_NTC0_NTD0_NTM0_NEPBS0_NLCA1_NLCB1_ONLL1_PGR1_PLR0_PKA0_SIA1_SS1_SU32_SUM0_SUS256_SPO0_SRVW0_SSO0_SVW1_SK0_SKFTR0_SKXCCM0_SGRO0_TIN0_TLDS1_ULSGRO0_USL1_UIOFGRO0_USFGROn1_VSn1_VWA1_VWB1_WSGRA0_WSGRB0_WS32_WG32_4_1_WGM8_WGMXCC1_WGMXCCGn1
    SolutionIndex: 77
    SolutionNameMin: Cijk_Alik_Bljk_HHS_BH_Bias_HA_S_SAV_UserArgs_MT64x64x64_MI16x16x1_SN_LDSB0_AFC1_AG0_AFEM1_AFEM1_ASEM1_CLR0_CADS0_DTLA0_DTLB0_DTVA0_DTVB0_EPS0_ELFLR0_EMLLn1_FDSI0_GRPM1_GRVWA8_GRVWB8_GSU1_GSUAMB_GSUC0_GSUWGMRR0_GLS0_ISA1151_IU1_K1_LDSTI0_LBSPPA128_LBSPPB128_LBSPPM0_LPA8_LPB8_LPM0_LRVW16_LWPMn1_MIAV1_MIWT2_2_MO40_NTn1_NTA0_NTB0_NTC0_NTD0_NTM0_NEPBS0_NLCA1_NLCB1_ONLL1_PGR2_PLR0_PKA0_SIA1_SS1_SU32_SUM0_SUS256_SPO0_SRVW0_SSO0_SVW1_SK0_SKFTR0_SKXCCM0_SGRO0_TIN0_TLDS1_ULSGRO0_USL1_UIOFGRO0_USFGROn1_VSn1_VWA1_VWB1_WSGRA0_WSGRB0_WS32_WG32_4_1_WGM8_WGMXCC1_WGMXCCGn1
    SolutionIndex: 79
    SolutionNameMin: Cijk_Alik_Bljk_HHS_BH_Bias_HA_S_SAV_UserArgs_MT128x64x32_MI16x16x1_SN_LDSB0_AFC1_AG0_AFEM1_AFEM1_ASEM1_CLR0_CADS0_DTLA0_DTLB0_DTVA0_DTVB0_EPS0_ELFLR0_EMLLn1_FDSI0_GRPM1_GRVWA8_GRVWB8_GSU1_GSUAMB_GSUC0_GSUWGMRR0_GLS0_ISA1151_IU1_K1_LDSTI0_LBSPPA128_LBSPPB128_LBSPPM0_LPA8_LPB8_LPM0_LRVW16_LWPMn1_MIAV1_MIWT2_4_MO40_NTn1_NTA0_NTB0_NTC0_NTD0_NTM0_NEPBS0_NLCA1_NLCB1_ONLL1_PGR2_PLR0_PKA0_SIA1_SS1_SU32_SUM0_SUS256_SPO0_SRVW0_SSO0_SVW1_SK0_SKFTR0_SKXCCM0_SGRO0_TIN0_TLDS1_ULSGRO0_USL1_UIOFGRO0_USFGROn1_VSn1_VWA1_VWB1_WSGRA0_WSGRB0_WS32_WG64_2_1_WGM8_WGMXCC1_WGMXCCGn1
    SolutionIndex: 80
    SolutionNameMin: Cijk_Alik_Bljk_HHS_BH_Bias_HA_S_SAV_UserArgs_MT64x128x32_MI16x16x1_SN_LDSB0_AFC1_AG0_AFEM1_AFEM1_ASEM1_CLR0_CADS0_DTLA0_DTLB0_DTVA0_DTVB0_EPS0_ELFLR0_EMLLn1_FDSI0_GRPM1_GRVWA8_GRVWB8_GSU1_GSUAMB_GSUC0_GSUWGMRR0_GLS0_ISA1151_IU1_K1_LDSTI0_LBSPPA128_LBSPPB128_LBSPPM0_LPA8_LPB8_LPM0_LRVW16_LWPMn1_MIAV1_MIWT4_2_MO40_NTn1_NTA0_NTB0_NTC0_NTD0_NTM0_NEPBS0_NLCA1_NLCB1_ONLL1_PGR2_PLR0_PKA0_SIA1_SS1_SU32_SUM0_SUS256_SPO0_SRVW0_SSO0_SVW1_SK0_SKFTR0_SKXCCM0_SGRO0_TIN0_TLDS1_ULSGRO0_USL1_UIOFGRO0_USFGROn1_VSn1_VWA1_VWB1_WSGRA0_WSGRB0_WS32_WG16_8_1_WGM8_WGMXCC1_WGMXCCGn1
    SolutionIndex: 82
    SolutionNameMin: Cijk_Alik_Bljk_HHS_BH_Bias_HA_S_SAV_UserArgs_MT48x64x64_MI16x16x1_SN_LDSB0_AFC1_AG0_AFEM1_AFEM1_ASEM1_CLR0_CADS0_DTLA0_DTLB0_DTVA0_DTVB0_EPS0_ELFLR0_EMLLn1_FDSI0_GRPM1_GRVWA8_GRVWB8_GSU1_GSUAMB_GSUC0_GSUWGMRR0_GLS0_ISA1151_IU1_K1_LDSTI0_LBSPPA128_LBSPPB128_LBSPPM0_LPA8_LPB8_LPM0_LRVW16_LWPMn1_MIAV1_MIWT3_1_MO40_NTn1_NTA0_NTB0_NTC0_NTD0_NTM0_NEPBS0_NLCA1_NLCB1_ONLL1_PGR2_PLR1_PKA0_SIA1_SS1_SU32_SUM0_SUS256_SPO0_SRVW0_SSO0_SVW1_SK0_SKFTR0_SKXCCM0_SGRO0_TIN0_TLDS1_ULSGRO0_USL1_UIOFGRO0_USFGROn1_VSn1_VWA1_VWB1_WSGRA0_WSGRB0_WS32_WG16_8_1_WGM8_WGMXCC1_WGMXCCGn1
    SolutionIndex: 86
    SolutionNameMin: Cijk_Alik_Bljk_HHS_BH_Bias_HA_S_SAV_UserArgs_MT80x64x64_MI16x16x1_SN_LDSB0_AFC1_AG0_AFEM1_AFEM1_ASEM1_CLR0_CADS0_DTLA0_DTLB0_DTVA0_DTVB0_EPS0_ELFLR0_EMLLn1_FDSI0_GRPM1_GRVWA8_GRVWB8_GSU1_GSUAMB_GSUC0_GSUWGMRR0_GLS0_ISA1151_IU1_K1_LDSTI0_LBSPPA128_LBSPPB128_LBSPPM0_LPA8_LPB8_LPM0_LRVW16_LWPMn1_MIAV1_MIWT5_1_MO40_NTn1_NTA0_NTB0_NTC0_NTD0_NTM0_NEPBS0_NLCA1_NLCB1_ONLL1_PGR2_PLR1_PKA0_SIA1_SS1_SU32_SUM0_SUS256_SPO0_SRVW0_SSO0_SVW1_SK0_SKFTR0_SKXCCM0_SGRO0_TIN0_TLDS1_ULSGRO0_USL1_UIOFGRO0_USFGROn1_VSn1_VWA1_VWB1_WSGRA0_WSGRB0_WS32_WG16_8_1_WGM8_WGMXCC1_WGMXCCGn1
    SolutionIndex: 87
    SolutionNameMin: Cijk_Alik_Bljk_HHS_BH_Bias_HA_S_SAV_UserArgs_MT96x64x32_MI16x16x1_SN_LDSB0_AFC1_AG0_AFEM1_AFEM1_ASEM1_CLR0_CADS0_DTLA0_DTLB0_DTVA0_DTVB0_EPS0_ELFLR0_EMLLn1_FDSI0_GRPM1_GRVWA8_GRVWB8_GSU1_GSUAMB_GSUC0_GSUWGMRR0_GLS0_ISA1151_IU1_K1_LDSTI0_LBSPPA128_LBSPPB128_LBSPPM0_LPA8_LPB8_LPM0_LRVW16_LWPMn1_MIAV1_MIWT3_2_MO40_NTn1_NTA0_NTB0_NTC0_NTD0_NTM0_NEPBS0_NLCA1_NLCB1_ONLL1_PGR2_PLR0_PKA0_SIA1_SS1_SU32_SUM0_SUS256_SPO0_SRVW0_SSO0_SVW1_SK0_SKFTR0_SKXCCM0_SGRO0_TIN0_TLDS1_ULSGRO0_USL1_UIOFGRO0_USFGROn1_VSn1_VWA1_VWB1_WSGRA0_WSGRB0_WS32_WG32_4_1_WGM8_WGMXCC1_WGMXCCGn1
    SolutionIndex: 90
    SolutionNameMin: Cijk_Alik_Bljk_HHS_BH_Bias_HA_S_SAV_UserArgs_MT48x64x64_MI16x16x1_SN_LDSB0_AFC1_AG0_AFEM1_AFEM1_ASEM1_CLR0_CADS0_DTLA0_DTLB0_DTVA0_DTVB0_EPS0_ELFLR0_EMLLn1_FDSI0_GRPM1_GRVWA8_GRVWB8_GSU1_GSUAMB_GSUC0_GSUWGMRR0_GLS0_ISA1151_IU1_K1_LDSTI0_LBSPPA128_LBSPPB128_LBSPPM0_LPA8_LPB8_LPM0_LRVW16_LWPMn1_MIAV1_MIWT3_1_MO40_NTn1_NTA0_NTB0_NTC0_NTD0_NTM0_NEPBS0_NLCA1_NLCB1_ONLL1_PGR1_PLR1_PKA0_SIA1_SS1_SU32_SUM0_SUS256_SPO0_SRVW0_SSO0_SVW1_SK0_SKFTR0_SKXCCM0_SGRO0_TIN0_TLDS1_ULSGRO0_USL1_UIOFGRO0_USFGROn1_VSn1_VWA1_VWB1_WSGRA0_WSGRB0_WS32_WG16_8_1_WGM8_WGMXCC1_WGMXCCGn1
    SolutionIndex: 92
    SolutionNameMin: Cijk_Alik_Bljk_HHS_BH_Bias_HA_S_SAV_UserArgs_MT96x64x32_MI16x16x1_SN_LDSB0_AFC1_AG0_AFEM1_AFEM1_ASEM1_CLR0_CADS0_DTLA0_DTLB0_DTVA0_DTVB0_EPS0_ELFLR0_EMLLn1_FDSI0_GRPM1_GRVWA8_GRVWB8_GSU1_GSUAMB_GSUC0_GSUWGMRR0_GLS0_ISA1151_IU1_K1_LDSTI0_LBSPPA128_LBSPPB128_LBSPPM0_LPA8_LPB8_LPM0_LRVW16_LWPMn1_MIAV1_MIWT3_2_MO40_NTn1_NTA0_NTB0_NTC0_NTD0_NTM0_NEPBS0_NLCA1_NLCB1_ONLL1_PGR2_PLR1_PKA0_SIA1_SS1_SU32_SUM0_SUS256_SPO0_SRVW0_SSO0_SVW1_SK0_SKFTR0_SKXCCM0_SGRO0_TIN0_TLDS1_ULSGRO0_USL1_UIOFGRO0_USFGROn1_VSn1_VWA1_VWB1_WSGRA0_WSGRB0_WS32_WG32_4_1_WGM8_WGMXCC1_WGMXCCGn1
    SolutionIndex: 97
    SolutionNameMin: Cijk_Alik_Bljk_HHS_BH_Bias_HA_S_SAV_UserArgs_MT64x64x16_MI16x16x1_SN_LDSB0_AFC1_AG0_AFEM1_AFEM1_ASEM1_CLR0_CADS0_DTLA0_DTLB0_DTVA0_DTVB0_EPS0_ELFLR0_EMLLn1_FDSI0_GRPM1_GRVWA8_GRVWB8_GSU1_GSUAMB_GSUC0_GSUWGMRR0_GLS0_ISA1151_IU1_K1_LDSTI0_LBSPPA128_LBSPPB128_LBSPPM0_LPA8_LPB8_LPM0_LRVW16_LWPMn1_MIAV1_MIWT2_2_MO40_NTn1_NTA0_NTB0_NTC0_NTD0_NTM0_NEPBS0_NLCA1_NLCB1_ONLL1_PGR2_PLR1_PKA0_SIA1_SS1_SU32_SUM0_SUS256_SPO0_SRVW0_SSO0_SVW1_SK0_SKFTR0_SKXCCM0_SGRO0_TIN0_TLDS1_ULSGRO0_USL1_UIOFGRO0_USFGROn1_VSn1_VWA1_VWB1_WSGRA0_WSGRB0_WS32_WG32_4_1_WGM8_WGMXCC1_WGMXCCGn1
    SolutionIndex: 98
    SolutionNameMin: Cijk_Alik_Bljk_HHS_BH_Bias_HA_S_SAV_UserArgs_MT64x128x16_MI16x16x1_SN_LDSB0_AFC1_AG0_AFEM1_AFEM1_ASEM1_CLR0_CADS0_DTLA0_DTLB0_DTVA0_DTVB0_EPS0_ELFLR0_EMLLn1_FDSI0_GRPM1_GRVWA8_GRVWB8_GSU1_GSUAMB_GSUC0_GSUWGMRR0_GLS0_ISA1151_IU1_K1_LDSTI0_LBSPPA128_LBSPPB128_LBSPPM0_LPA8_LPB8_LPM0_LRVW16_LWPMn1_MIAV1_MIWT2_4_MO40_NTn1_NTA0_NTB0_NTC0_NTD0_NTM0_NEPBS0_NLCA1_NLCB1_ONLL1_PGR0_PLR0_PKA0_SIA1_SS1_SU32_SUM0_SUS256_SPO0_SRVW0_SSO0_SVW1_SK0_SKFTR0_SKXCCM0_SGRO0_TIN0_TLDS1_ULSGRO0_USL1_UIOFGRO0_USFGROn1_VSn1_VWA1_VWB1_WSGRA0_WSGRB0_WS32_WG32_4_1_WGM8_WGMXCC1_WGMXCCGn1
    SolutionIndex: 101
    SolutionNameMin: Cijk_Alik_Bljk_HHS_BH_Bias_HA_S_SAV_UserArgs_MT128x64x32_MI16x16x1_SN_LDSB0_AFC1_AG0_AFEM1_AFEM1_ASEM1_CLR0_CADS0_DTLA0_DTLB0_DTVA0_DTVB0_EPS0_ELFLR0_EMLLn1_FDSI0_GRPM1_GRVWA8_GRVWB8_GSU1_GSUAMB_GSUC0_GSUWGMRR0_GLS0_ISA1151_IU1_K1_LDSTI0_LBSPPA128_LBSPPB128_LBSPPM0_LPA8_LPB8_LPM0_LRVW16_LWPMn1_MIAV1_MIWT4_2_MO40_NTn1_NTA0_NTB0_NTC0_NTD0_NTM0_NEPBS0_NLCA1_NLCB1_ONLL1_PGR2_PLR1_PKA0_SIA1_SS1_SU32_SUM0_SUS256_SPO0_SRVW0_SSO0_SVW1_SK0_SKFTR0_SKXCCM0_SGRO0_TIN0_TLDS1_ULSGRO0_USL1_UIOFGRO0_USFGROn1_VSn1_VWA1_VWB1_WSGRA0_WSGRB0_WS32_WG32_4_1_WGM8_WGMXCC1_WGMXCCGn1
    SolutionIndex: 103
    SolutionNameMin: Cijk_Alik_Bljk_HHS_BH_Bias_HA_S_SAV_UserArgs_MT128x128x32_MI16x16x1_SN_LDSB0_AFC1_AG0_AFEM1_AFEM1_ASEM1_CLR0_CADS0_DTLA0_DTLB0_DTVA0_DTVB0_EPS0_ELFLR0_EMLLn1_FDSI0_GRPM1_GRVWA8_GRVWB8_GSU1_GSUAMB_GSUC0_GSUWGMRR0_GLS0_ISA1151_IU1_K1_LDSTI0_LBSPPA128_LBSPPB128_LBSPPM0_LPA8_LPB8_LPM0_LRVW16_LWPMn1_MIAV1_MIWT2_8_MO40_NTn1_NTA0_NTB0_NTC0_NTD0_NTM0_NEPBS0_NLCA1_NLCB1_ONLL1_PGR2_PLR0_PKA0_SIA1_SS1_SU32_SUM0_SUS256_SPO0_SRVW0_SSO0_SVW1_SK0_SKFTR0_SKXCCM0_SGRO0_TIN0_TLDS1_ULSGRO0_USL1_UIOFGRO0_USFGROn1_VSn1_VWA1_VWB1_WSGRA0_WSGRB0_WS32_WG64_2_1_WGM8_WGMXCC1_WGMXCCGn1
    SolutionIndex: 104
    SolutionNameMin: Cijk_Alik_Bljk_HHS_BH_Bias_HA_S_SAV_UserArgs_MT64x32x128_MI16x16x1_SN_LDSB0_AFC1_AG0_AFEM1_AFEM1_ASEM1_CLR0_CADS0_DTLA0_DTLB0_DTVA0_DTVB0_EPS0_ELFLR0_EMLLn1_FDSI0_GRPM1_GRVWA8_GRVWB8_GSU1_GSUAMB_GSUC0_GSUWGMRR0_GLS0_ISA1151_IU1_K1_LDSTI0_LBSPPA256_LBSPPB256_LBSPPM0_LPA8_LPB8_LPM0_LRVW16_LWPMn1_MIAV1_MIWT2_1_MO40_NTn1_NTA0_NTB0_NTC0_NTD0_NTM0_NEPBS0_NLCA1_NLCB1_ONLL1_PGR2_PLR1_PKA0_SIA1_SS1_SU32_SUM0_SUS256_SPO0_SRVW0_SSO0_SVW1_SK0_SKFTR0_SKXCCM0_SGRO0_TIN0_TLDS1_ULSGRO0_USL1_UIOFGRO0_USFGROn1_VSn1_VWA1_VWB1_WSGRA0_WSGRB0_WS32_WG32_4_1_WGM8_WGMXCC1_WGMXCCGn1
    SolutionIndex: 105
    SolutionNameMin: Cijk_Alik_Bljk_HHS_BH_Bias_HA_S_SAV_UserArgs_MT64x128x32_MI16x16x1_SN_LDSB0_AFC1_AG0_AFEM1_AFEM1_ASEM1_CLR0_CADS0_DTLA0_DTLB0_DTVA0_DTVB0_EPS0_ELFLR0_EMLLn1_FDSI0_GRPM1_GRVWA8_GRVWB8_GSU1_GSUAMB_GSUC0_GSUWGMRR0_GLS0_ISA1151_IU1_K1_LDSTI0_LBSPPA128_LBSPPB128_LBSPPM0_LPA8_LPB8_LPM0_LRVW16_LWPMn1_MIAV1_MIWT2_4_MO40_NTn1_NTA0_NTB0_NTC0_NTD0_NTM0_NEPBS0_NLCA1_NLCB1_ONLL1_PGR2_PLR0_PKA0_SIA1_SS1_SU32_SUM0_SUS256_SPO0_SRVW0_SSO0_SVW1_SK0_SKFTR0_SKXCCM0_SGRO0_TIN0_TLDS1_ULSGRO0_USL1_UIOFGRO0_USFGROn1_VSn1_VWA1_VWB1_WSGRA0_WSGRB0_WS32_WG32_4_1_WGM8_WGMXCC1_WGMXCCGn1
    SolutionIndex: 106
    SolutionNameMin: Cijk_Alik_Bljk_HHS_BH_Bias_HA_S_SAV_UserArgs_MT64x96x32_MI16x16x1_SN_LDSB0_AFC1_AG0_AFEM1_AFEM1_ASEM1_CLR0_CADS0_DTLA0_DTLB0_DTVA0_DTVB0_EPS0_ELFLR0_EMLLn1_FDSI0_GRPM1_GRVWA8_GRVWB8_GSU1_GSUAMB_GSUC0_GSUWGMRR0_GLS0_ISA1151_IU1_K1_LDSTI0_LBSPPA128_LBSPPB128_LBSPPM0_LPA8_LPB8_LPM0_LRVW16_LWPMn1_MIAV1_MIWT2_3_MO40_NTn1_NTA0_NTB0_NTC0_NTD0_NTM0_NEPBS0_NLCA1_NLCB1_ONLL1_PGR0_PLR0_PKA0_SIA1_SS1_SU32_SUM0_SUS256_SPO0_SRVW0_SSO0_SVW1_SK0_SKFTR0_SKXCCM0_SGRO0_TIN0_TLDS1_ULSGRO0_USL1_UIOFGRO0_USFGROn1_VSn1_VWA1_VWB1_WSGRA0_WSGRB0_WS32_WG32_4_1_WGM8_WGMXCC1_WGMXCCGn1
    SolutionIndex: 107
    SolutionNameMin: Cijk_Alik_Bljk_HHS_BH_Bias_HA_S_SAV_UserArgs_MT64x224x32_MI16x16x1_SN_LDSB0_AFC1_AG0_AFEM1_AFEM1_ASEM1_CLR0_CADS0_DTLA0_DTLB0_DTVA0_DTVB0_EPS0_ELFLR0_EMLLn1_FDSI0_GRPM1_GRVWA8_GRVWB8_GSU1_GSUAMB_GSUC0_GSUWGMRR0_GLS0_ISA1151_IU1_K1_LDSTI0_LBSPPA128_LBSPPB128_LBSPPM0_LPA8_LPB8_LPM0_LRVW16_LWPMn1_MIAV1_MIWT2_7_MO40_NTn1_NTA0_NTB0_NTC0_NTD0_NTM0_NEPBS0_NLCA1_NLCB1_ONLL1_PGR2_PLR0_PKA0_SIA1_SS1_SU32_SUM0_SUS256_SPO0_SRVW0_SSO0_SVW1_SK0_SKFTR0_SKXCCM0_SGRO0_TIN0_TLDS1_ULSGRO0_USL1_UIOFGRO0_USFGROn1_VSn1_VWA1_VWB1_WSGRA0_WSGRB0_WS32_WG32_4_1_WGM8_WGMXCC1_WGMXCCGn1
    SolutionIndex: 108
    SolutionNameMin: Cijk_Alik_Bljk_HHS_BH_Bias_HA_S_SAV_UserArgs_MT64x64x32_MI16x16x1_SN_LDSB0_AFC1_AG0_AFEM1_AFEM1_ASEM1_CLR0_CADS0_DTLA0_DTLB0_DTVA0_DTVB0_EPS0_ELFLR0_EMLLn1_FDSI0_GRPM1_GRVWA8_GRVWB8_GSU1_GSUAMB_GSUC0_GSUWGMRR0_GLS0_ISA1151_IU1_K1_LDSTI0_LBSPPA128_LBSPPB128_LBSPPM0_LPA8_LPB8_LPM0_LRVW16_LWPMn1_MIAV1_MIWT2_2_MO40_NTn1_NTA0_NTB0_NTC0_NTD0_NTM0_NEPBS0_NLCA1_NLCB1_ONLL1_PGR0_PLR0_PKA0_SIA1_SS1_SU32_SUM0_SUS256_SPO0_SRVW0_SSO0_SVW1_SK0_SKFTR0_SKXCCM0_SGRO0_TIN0_TLDS1_ULSGRO0_USL1_UIOFGRO0_USFGROn1_VSn1_VWA1_VWB1_WSGRA0_WSGRB0_WS32_WG32_4_1_WGM8_WGMXCC1_WGMXCCGn1
    SolutionIndex: 110
    SolutionNameMin: Cijk_Alik_Bljk_HHS_BH_Bias_HA_S_SAV_UserArgs_MT128x80x32_MI16x16x1_SN_LDSB0_AFC1_AG0_AFEM1_AFEM1_ASEM1_CLR0_CADS0_DTLA0_DTLB0_DTVA0_DTVB0_EPS0_ELFLR0_EMLLn1_FDSI0_GRPM1_GRVWA8_GRVWB4_GSU1_GSUAMB_GSUC0_GSUWGMRR0_GLS0_ISA1151_IU1_K1_LDSTI0_LBSPPA128_LBSPPB128_LBSPPM0_LPA8_LPB8_LPM0_LRVW16_LWPMn1_MIAV1_MIWT2_5_MO40_NTn1_NTA0_NTB0_NTC0_NTD0_NTM0_NEPBS0_NLCA1_NLCB1_ONLL1_PGR0_PLR1_PKA0_SIA1_SS1_SU32_SUM0_SUS256_SPO0_SRVW0_SSO0_SVW1_SK0_SKFTR0_SKXCCM0_SGRO0_TIN0_TLDS1_ULSGRO0_USL1_UIOFGRO0_USFGROn1_VSn1_VWA1_VWB1_WSGRA0_WSGRB0_WS32_WG64_2_1_WGM8_WGMXCC1_WGMXCCGn1
    SolutionIndex: 111
    SolutionNameMin: Cijk_Alik_Bljk_HHS_BH_Bias_HA_S_SAV_UserArgs_MT128x112x32_MI16x16x1_SN_LDSB0_AFC1_AG0_AFEM1_AFEM1_ASEM1_CLR0_CADS0_DTLA0_DTLB0_DTVA0_DTVB0_EPS0_ELFLR0_EMLLn1_FDSI0_GRPM1_GRVWA8_GRVWB4_GSU1_GSUAMB_GSUC0_GSUWGMRR0_GLS0_ISA1151_IU1_K1_LDSTI0_LBSPPA128_LBSPPB128_LBSPPM0_LPA8_LPB8_LPM0_LRVW16_LWPMn1_MIAV1_MIWT2_7_MO40_NTn1_NTA0_NTB0_NTC0_NTD0_NTM0_NEPBS0_NLCA1_NLCB1_ONLL1_PGR2_PLR0_PKA0_SIA1_SS1_SU32_SUM0_SUS256_SPO0_SRVW0_SSO0_SVW1_SK0_SKFTR0_SKXCCM0_SGRO0_TIN0_TLDS1_ULSGRO0_USL1_UIOFGRO0_USFGROn1_VSn1_VWA1_VWB1_WSGRA0_WSGRB0_WS32_WG64_2_1_WGM8_WGMXCC1_WGMXCCGn1
    SolutionIndex: 112
    SolutionNameMin: Cijk_Alik_Bljk_HHS_BH_Bias_HA_S_SAV_UserArgs_MT128x64x64_MI16x16x1_SN_LDSB0_AFC1_AG0_AFEM1_AFEM1_ASEM1_CLR0_CADS0_DTLA0_DTLB0_DTVA0_DTVB0_EPS0_ELFLR0_EMLLn1_FDSI0_GRPM1_GRVWA8_GRVWB8_GSU1_GSUAMB_GSUC0_GSUWGMRR0_GLS0_ISA1151_IU1_K1_LDSTI0_LBSPPA128_LBSPPB128_LBSPPM0_LPA8_LPB8_LPM0_LRVW16_LWPMn1_MIAV1_MIWT2_4_MO40_NTn1_NTA0_NTB0_NTC0_NTD0_NTM0_NEPBS0_NLCA1_NLCB1_ONLL1_PGR2_PLR0_PKA0_SIA1_SS1_SU32_SUM0_SUS256_SPO0_SRVW0_SSO0_SVW1_SK0_SKFTR0_SKXCCM0_SGRO0_TIN0_TLDS1_ULSGRO0_USL1_UIOFGRO0_USFGROn1_VSn1_VWA1_VWB1_WSGRA0_WSGRB0_WS32_WG64_2_1_WGM8_WGMXCC1_WGMXCCGn1
    SolutionIndex: 113
    SolutionNameMin: Cijk_Alik_Bljk_HHS_BH_Bias_HA_S_SAV_UserArgs_MT128x64x32_MI16x16x1_SN_LDSB0_AFC1_AG0_AFEM1_AFEM1_ASEM1_CLR0_CADS0_DTLA0_DTLB0_DTVA0_DTVB0_EPS0_ELFLR0_EMLLn1_FDSI0_GRPM1_GRVWA8_GRVWB8_GSU1_GSUAMB_GSUC0_GSUWGMRR0_GLS0_ISA1151_IU1_K1_LDSTI0_LBSPPA128_LBSPPB128_LBSPPM0_LPA8_LPB8_LPM0_LRVW16_LWPMn1_MIAV1_MIWT4_2_MO40_NTn1_NTA0_NTB0_NTC0_NTD0_NTM0_NEPBS0_NLCA1_NLCB1_ONLL1_PGR0_PLR0_PKA0_SIA1_SS1_SU32_SUM0_SUS256_SPO0_SRVW0_SSO0_SVW1_SK0_SKFTR0_SKXCCM0_SGRO0_TIN0_TLDS1_ULSGRO0_USL1_UIOFGRO0_USFGROn1_VSn1_VWA1_VWB1_WSGRA0_WSGRB0_WS32_WG32_4_1_WGM8_WGMXCC1_WGMXCCGn1
    SolutionIndex: 114
    SolutionNameMin: Cijk_Alik_Bljk_HHS_BH_Bias_HA_S_SAV_UserArgs_MT128x128x32_MI16x16x1_SN_LDSB0_AFC1_AG0_AFEM1_AFEM1_ASEM1_CLR0_CADS0_DTLA0_DTLB0_DTVA0_DTVB0_EPS0_ELFLR0_EMLLn1_FDSI0_GRPM1_GRVWA8_GRVWB8_GSU1_GSUAMB_GSUC0_GSUWGMRR0_GLS0_ISA1151_IU1_K1_LDSTI0_LBSPPA128_LBSPPB128_LBSPPM0_LPA8_LPB8_LPM0_LRVW16_LWPMn1_MIAV1_MIWT4_4_MO40_NTn1_NTA0_NTB0_NTC0_NTD0_NTM0_NEPBS0_NLCA1_NLCB1_ONLL1_PGR2_PLR0_PKA0_SIA1_SS1_SU32_SUM0_SUS256_SPO0_SRVW0_SSO0_SVW1_SK0_SKFTR0_SKXCCM0_SGRO0_TIN0_TLDS1_ULSGRO0_USL1_UIOFGRO0_USFGROn1_VSn1_VWA1_VWB1_WSGRA0_WSGRB0_WS32_WG32_4_1_WGM8_WGMXCC1_WGMXCCGn1
    SolutionIndex: 115
    SolutionNameMin: Cijk_Alik_Bljk_HHS_BH_Bias_HA_S_SAV_UserArgs_MT128x64x32_MI16x16x1_SN_LDSB0_AFC1_AG0_AFEM1_AFEM1_ASEM1_CLR0_CADS0_DTLA0_DTLB0_DTVA0_DTVB0_EPS0_ELFLR0_EMLLn1_FDSI0_GRPM1_GRVWA8_GRVWB8_GSU1_GSUAMB_GSUC0_GSUWGMRR0_GLS0_ISA1151_IU1_K1_LDSTI0_LBSPPA128_LBSPPB128_LBSPPM0_LPA8_LPB8_LPM0_LRVW16_LWPMn1_MIAV1_MIWT4_2_MO40_NTn1_NTA0_NTB0_NTC0_NTD0_NTM0_NEPBS0_NLCA1_NLCB1_ONLL1_PGR2_PLR0_PKA0_SIA1_SS1_SU32_SUM0_SUS256_SPO0_SRVW0_SSO0_SVW1_SK0_SKFTR0_SKXCCM0_SGRO0_TIN0_TLDS1_ULSGRO0_USL1_UIOFGRO0_USFGROn1_VSn1_VWA1_VWB1_WSGRA0_WSGRB0_WS32_WG32_4_1_WGM8_WGMXCC1_WGMXCCGn1
    SolutionIndex: 116
    SolutionNameMin: Cijk_Alik_Bljk_HHS_BH_Bias_HA_S_SAV_UserArgs_MT128x144x32_MI16x16x1_SN_LDSB0_AFC1_AG0_AFEM1_AFEM1_ASEM1_CLR0_CADS0_DTLA0_DTLB0_DTVA0_DTVB0_EPS0_ELFLR0_EMLLn1_FDSI0_GRPM1_GRVWA8_GRVWB4_GSU1_GSUAMB_GSUC0_GSUWGMRR0_GLS0_ISA1151_IU1_K1_LDSTI0_LBSPPA128_LBSPPB128_LBSPPM0_LPA8_LPB8_LPM0_LRVW16_LWPMn1_MIAV1_MIWT2_9_MO40_NTn1_NTA0_NTB0_NTC0_NTD0_NTM0_NEPBS0_NLCA1_NLCB1_ONLL1_PGR0_PLR0_PKA0_SIA1_SS1_SU32_SUM0_SUS256_SPO0_SRVW0_SSO0_SVW1_SK0_SKFTR0_SKXCCM0_SGRO0_TIN0_TLDS1_ULSGRO0_USL1_UIOFGRO0_USFGROn1_VSn1_VWA1_VWB1_WSGRA0_WSGRB0_WS32_WG64_2_1_WGM8_WGMXCC1_WGMXCCGn1
    SolutionIndex: 117
    SolutionNameMin: Cijk_Alik_Bljk_HHS_BH_Bias_HA_S_SAV_UserArgs_MT256x48x32_MI16x16x1_SN_LDSB0_AFC1_AG0_AFEM1_AFEM1_ASEM1_CLR0_CADS0_DTLA0_DTLB0_DTVA0_DTVB0_EPS0_ELFLR0_EMLLn1_FDSI0_GRPM1_GRVWA8_GRVWB4_GSU1_GSUAMB_GSUC0_GSUWGMRR0_GLS0_ISA1151_IU1_K1_LDSTI0_LBSPPA128_LBSPPB128_LBSPPM0_LPA8_LPB8_LPM0_LRVW16_LWPMn1_MIAV1_MIWT4_3_MO40_NTn1_NTA0_NTB0_NTC0_NTD0_NTM0_NEPBS0_NLCA1_NLCB1_ONLL1_PGR0_PLR0_PKA0_SIA1_SS1_SU32_SUM0_SUS256_SPO0_SRVW0_SSO0_SVW1_SK0_SKFTR0_SKXCCM0_SGRO0_TIN0_TLDS1_ULSGRO0_USL1_UIOFGRO0_USFGROn1_VSn1_VWA1_VWB1_WSGRA0_WSGRB0_WS32_WG64_2_1_WGM8_WGMXCC1_WGMXCCGn1
    SolutionIndex: 119
    SolutionNameMin: Cijk_Alik_Bljk_HHS_BH_Bias_HA_S_SAV_UserArgs_MT128x64x64_MI16x16x1_SN_LDSB0_AFC1_AG0_AFEM1_AFEM1_ASEM1_CLR0_CADS0_DTLA0_DTLB0_DTVA0_DTVB0_EPS0_ELFLR0_EMLLn1_FDSI0_GRPM1_GRVWA8_GRVWB8_GSU1_GSUAMB_GSUC0_GSUWGMRR0_GLS0_ISA1151_IU1_K1_LDSTI0_LBSPPA128_LBSPPB128_LBSPPM0_LPA8_LPB8_LPM0_LRVW16_LWPMn1_MIAV1_MIWT4_2_MO40_NTn1_NTA0_NTB0_NTC0_NTD0_NTM0_NEPBS0_NLCA1_NLCB1_ONLL1_PGR2_PLR0_PKA0_SIA1_SS1_SU32_SUM0_SUS256_SPO0_SRVW0_SSO0_SVW1_SK0_SKFTR0_SKXCCM0_SGRO0_TIN0_TLDS1_ULSGRO0_USL1_UIOFGRO0_USFGROn1_VSn1_VWA1_VWB1_WSGRA0_WSGRB0_WS32_WG32_4_1_WGM8_WGMXCC1_WGMXCCGn1
    SolutionIndex: 120
    SolutionNameMin: Cijk_Alik_Bljk_HHS_BH_Bias_HA_S_SAV_UserArgs_MT128x64x64_MI16x16x1_SN_LDSB0_AFC1_AG0_AFEM1_AFEM1_ASEM1_CLR0_CADS0_DTLA0_DTLB0_DTVA0_DTVB0_EPS0_ELFLR0_EMLLn1_FDSI0_GRPM1_GRVWA8_GRVWB8_GSU1_GSUAMB_GSUC0_GSUWGMRR0_GLS0_ISA1151_IU1_K1_LDSTI0_LBSPPA128_LBSPPB128_LBSPPM0_LPA8_LPB8_LPM0_LRVW16_LWPMn1_MIAV1_MIWT2_4_MO40_NTn1_NTA0_NTB0_NTC0_NTD0_NTM0_NEPBS0_NLCA1_NLCB1_ONLL1_PGR2_PLR1_PKA0_SIA1_SS1_SU32_SUM0_SUS256_SPO0_SRVW0_SSO0_SVW1_SK0_SKFTR0_SKXCCM0_SGRO0_TIN0_TLDS1_ULSGRO0_USL1_UIOFGRO0_USFGROn1_VSn1_VWA1_VWB1_WSGRA0_WSGRB0_WS32_WG64_2_1_WGM8_WGMXCC1_WGMXCCGn1
    SolutionIndex: 121
    SolutionNameMin: Cijk_Alik_Bljk_HHS_BH_Bias_HA_S_SAV_UserArgs_MT48x64x128_MI16x16x1_SN_LDSB0_AFC1_AG0_AFEM1_AFEM1_ASEM1_CLR0_CADS0_DTLA0_DTLB0_DTVA0_DTVB0_EPS0_ELFLR0_EMLLn1_FDSI0_GRPM1_GRVWA8_GRVWB8_GSU1_GSUAMB_GSUC0_GSUWGMRR0_GLS0_ISA1151_IU1_K1_LDSTI0_LBSPPA256_LBSPPB256_LBSPPM0_LPA8_LPB8_LPM0_LRVW16_LWPMn1_MIAV1_MIWT3_1_MO40_NTn1_NTA0_NTB0_NTC0_NTD0_NTM0_NEPBS0_NLCA1_NLCB1_ONLL1_PGR2_PLR1_PKA0_SIA1_SS1_SU32_SUM0_SUS256_SPO0_SRVW0_SSO0_SVW1_SK0_SKFTR0_SKXCCM0_SGRO0_TIN0_TLDS1_ULSGRO0_USL1_UIOFGRO0_USFGROn1_VSn1_VWA1_VWB1_WSGRA0_WSGRB0_WS32_WG16_8_1_WGM8_WGMXCC1_WGMXCCGn1
    SolutionIndex: 122
    SolutionNameMin: Cijk_Alik_Bljk_HHS_BH_Bias_HA_S_SAV_UserArgs_MT80x128x32_MI16x16x1_SN_LDSB0_AFC1_AG0_AFEM1_AFEM1_ASEM1_CLR0_CADS0_DTLA0_DTLB0_DTVA0_DTVB0_EPS0_ELFLR0_EMLLn1_FDSI0_GRPM1_GRVWA4_GRVWB8_GSU1_GSUAMB_GSUC0_GSUWGMRR0_GLS0_ISA1151_IU1_K1_LDSTI0_LBSPPA128_LBSPPB128_LBSPPM0_LPA8_LPB8_LPM0_LRVW16_LWPMn1_MIAV1_MIWT5_2_MO40_NTn1_NTA0_NTB0_NTC0_NTD0_NTM0_NEPBS0_NLCA1_NLCB1_ONLL1_PGR2_PLR1_PKA0_SIA1_SS1_SU32_SUM0_SUS256_SPO0_SRVW0_SSO0_SVW1_SK0_SKFTR0_SKXCCM0_SGRO0_TIN0_TLDS1_ULSGRO0_USL1_UIOFGRO0_USFGROn1_VSn1_VWA1_VWB1_WSGRA0_WSGRB0_WS32_WG16_8_1_WGM8_WGMXCC1_WGMXCCGn1
    SolutionIndex: 123
    SolutionNameMin: Cijk_Alik_Bljk_HHS_BH_Bias_HA_S_SAV_UserArgs_MT64x160x32_MI16x16x1_SN_LDSB0_AFC1_AG0_AFEM1_AFEM1_ASEM1_CLR0_CADS0_DTLA0_DTLB0_DTVA0_DTVB0_EPS0_ELFLR0_EMLLn1_FDSI0_GRPM1_GRVWA8_GRVWB8_GSU1_GSUAMB_GSUC0_GSUWGMRR0_GLS0_ISA1151_IU1_K1_LDSTI0_LBSPPA128_LBSPPB128_LBSPPM0_LPA8_LPB8_LPM0_LRVW16_LWPMn1_MIAV1_MIWT2_5_MO40_NTn1_NTA0_NTB0_NTC0_NTD0_NTM0_NEPBS0_NLCA1_NLCB1_ONLL1_PGR0_PLR0_PKA0_SIA1_SS1_SU32_SUM0_SUS256_SPO0_SRVW0_SSO0_SVW1_SK0_SKFTR0_SKXCCM0_SGRO0_TIN0_TLDS1_ULSGRO0_USL1_UIOFGRO0_USFGROn1_VSn1_VWA1_VWB1_WSGRA0_WSGRB0_WS32_WG32_4_1_WGM8_WGMXCC1_WGMXCCGn1
    SolutionIndex: 124
    SolutionNameMin: Cijk_Alik_Bljk_HHS_BH_Bias_HA_S_SAV_UserArgs_MT64x160x64_MI16x16x1_SN_LDSB0_AFC1_AG0_AFEM1_AFEM1_ASEM1_CLR0_CADS0_DTLA0_DTLB0_DTVA0_DTVB0_EPS0_ELFLR0_EMLLn1_FDSI0_GRPM1_GRVWA8_GRVWB8_GSU1_GSUAMB_GSUC0_GSUWGMRR0_GLS0_ISA1151_IU1_K1_LDSTI0_LBSPPA128_LBSPPB128_LBSPPM0_LPA8_LPB8_LPM0_LRVW16_LWPMn1_MIAV1_MIWT2_5_MO40_NTn1_NTA0_NTB0_NTC0_NTD0_NTM0_NEPBS0_NLCA1_NLCB1_ONLL1_PGR2_PLR0_PKA0_SIA1_SS1_SU32_SUM0_SUS256_SPO0_SRVW0_SSO0_SVW1_SK0_SKFTR0_SKXCCM0_SGRO0_TIN0_TLDS1_ULSGRO0_USL1_UIOFGRO0_USFGROn1_VSn1_VWA1_VWB1_WSGRA0_WSGRB0_WS32_WG32_4_1_WGM8_WGMXCC1_WGMXCCGn1
    SolutionIndex: 125
    SolutionNameMin: Cijk_Alik_Bljk_HHS_BH_Bias_HA_S_SAV_UserArgs_MT128x160x32_MI16x16x1_SN_LDSB0_AFC1_AG0_AFEM1_AFEM1_ASEM1_CLR0_CADS0_DTLA0_DTLB0_DTVA0_DTVB0_EPS0_ELFLR0_EMLLn1_FDSI0_GRPM1_GRVWA8_GRVWB8_GSU1_GSUAMB_GSUC0_GSUWGMRR0_GLS0_ISA1151_IU1_K1_LDSTI0_LBSPPA128_LBSPPB128_LBSPPM0_LPA8_LPB8_LPM0_LRVW16_LWPMn1_MIAV1_MIWT4_5_MO40_NTn1_NTA0_NTB0_NTC0_NTD0_NTM0_NEPBS0_NLCA1_NLCB1_ONLL1_PGR0_PLR0_PKA0_SIA1_SS1_SU32_SUM0_SUS256_SPO0_SRVW0_SSO0_SVW1_SK0_SKFTR0_SKXCCM0_SGRO0_TIN0_TLDS1_ULSGRO0_USL1_UIOFGRO0_USFGROn1_VSn1_VWA1_VWB1_WSGRA0_WSGRB0_WS32_WG32_4_1_WGM8_WGMXCC1_WGMXCCGn1
    SolutionIndex: 126
    SolutionNameMin: Cijk_Alik_Bljk_HHS_BH_Bias_HA_S_SAV_UserArgs_MT128x128x32_MI16x16x1_SN_LDSB0_AFC1_AG0_AFEM1_AFEM1_ASEM1_CLR0_CADS0_DTLA0_DTLB0_DTVA0_DTVB0_EPS0_ELFLR0_EMLLn1_FDSI0_GRPM1_GRVWA8_GRVWB8_GSU1_GSUAMB_GSUC0_GSUWGMRR0_GLS0_ISA1151_IU1_K1_LDSTI0_LBSPPA128_LBSPPB128_LBSPPM0_LPA8_LPB8_LPM0_LRVW16_LWPMn1_MIAV1_MIWT8_2_MO40_NTn1_NTA0_NTB0_NTC0_NTD0_NTM0_NEPBS0_NLCA1_NLCB1_ONLL1_PGR0_PLR0_PKA0_SIA1_SS1_SU32_SUM0_SUS256_SPO0_SRVW0_SSO0_SVW1_SK0_SKFTR0_SKXCCM0_SGRO0_TIN0_TLDS1_ULSGRO0_USL1_UIOFGRO0_USFGROn1_VSn1_VWA1_VWB1_WSGRA0_WSGRB0_WS32_WG16_8_1_WGM8_WGMXCC1_WGMXCCGn1
    SolutionIndex: 127
    SolutionNameMin: Cijk_Alik_Bljk_HHS_BH_Bias_HA_S_SAV_UserArgs_MT256x64x32_MI16x16x1_SN_LDSB0_AFC1_AG0_AFEM1_AFEM1_ASEM1_CLR0_CADS0_DTLA0_DTLB0_DTVA0_DTVB0_EPS0_ELFLR0_EMLLn1_FDSI0_GRPM1_GRVWA8_GRVWB8_GSU1_GSUAMB_GSUC0_GSUWGMRR0_GLS0_ISA1151_IU1_K1_LDSTI0_LBSPPA128_LBSPPB128_LBSPPM0_LPA8_LPB8_LPM0_LRVW16_LWPMn1_MIAV1_MIWT4_4_MO40_NTn1_NTA0_NTB0_NTC0_NTD0_NTM0_NEPBS0_NLCA1_NLCB1_ONLL1_PGR0_PLR0_PKA0_SIA1_SS1_SU32_SUM0_SUS256_SPO0_SRVW0_SSO0_SVW1_SK0_SKFTR0_SKXCCM0_SGRO0_TIN0_TLDS1_ULSGRO0_USL1_UIOFGRO0_USFGROn1_VSn1_VWA1_VWB1_WSGRA0_WSGRB0_WS32_WG64_2_1_WGM8_WGMXCC1_WGMXCCGn1
    SolutionIndex: 128
    SolutionNameMin: Cijk_Alik_Bljk_HHS_BH_Bias_HA_S_SAV_UserArgs_MT256x80x32_MI16x16x1_SN_LDSB0_AFC1_AG0_AFEM1_AFEM1_ASEM1_CLR0_CADS0_DTLA0_DTLB0_DTVA0_DTVB0_EPS0_ELFLR0_EMLLn1_FDSI0_GRPM1_GRVWA8_GRVWB4_GSU1_GSUAMB_GSUC0_GSUWGMRR0_GLS0_ISA1151_IU1_K1_LDSTI0_LBSPPA128_LBSPPB128_LBSPPM0_LPA8_LPB8_LPM0_LRVW16_LWPMn1_MIAV1_MIWT4_5_MO40_NTn1_NTA0_NTB0_NTC0_NTD0_NTM0_NEPBS0_NLCA1_NLCB1_ONLL1_PGR0_PLR0_PKA0_SIA1_SS1_SU32_SUM0_SUS256_SPO0_SRVW0_SSO0_SVW1_SK0_SKFTR0_SKXCCM0_SGRO0_TIN0_TLDS1_ULSGRO0_USL1_UIOFGRO0_USFGROn1_VSn1_VWA1_VWB1_WSGRA0_WSGRB0_WS32_WG64_2_1_WGM8_WGMXCC1_WGMXCCGn1
    SolutionIndex: 129
    SolutionNameMin: Cijk_Alik_Bljk_HHS_BH_Bias_HA_S_SAV_UserArgs_MT80x256x32_MI16x16x1_SN_LDSB0_AFC1_AG0_AFEM1_AFEM1_ASEM1_CLR0_CADS0_DTLA0_DTLB0_DTVA0_DTVB0_EPS0_ELFLR0_EMLLn1_FDSI0_GRPM1_GRVWA4_GRVWB8_GSU1_GSUAMB_GSUC0_GSUWGMRR0_GLS0_ISA1151_IU1_K1_LDSTI0_LBSPPA128_LBSPPB128_LBSPPM0_LPA8_LPB8_LPM0_LRVW16_LWPMn1_MIAV1_MIWT5_4_MO40_NTn1_NTA0_NTB0_NTC0_NTD0_NTM0_NEPBS0_NLCA1_NLCB1_ONLL1_PGR0_PLR0_PKA0_SIA1_SS1_SU32_SUM0_SUS256_SPO0_SRVW0_SSO0_SVW1_SK0_SKFTR0_SKXCCM0_SGRO0_TIN0_TLDS1_ULSGRO0_USL1_UIOFGRO0_USFGROn1_VSn1_VWA1_VWB1_WSGRA0_WSGRB0_WS32_WG16_8_1_WGM8_WGMXCC1_WGMXCCGn1
    SolutionIndex: 130
    SolutionNameMin: Cijk_Alik_Bljk_HHS_BH_Bias_HA_S_SAV_UserArgs_MT64x32x64_MI16x16x1_SN_LDSB0_AFC1_AG0_AFEM1_AFEM1_ASEM1_CLR0_CADS0_DTLA0_DTLB0_DTVA0_DTVB0_EPS0_ELFLR0_EMLLn1_FDSI0_GRPM1_GRVWA8_GRVWB8_GSU1_GSUAMB_GSUC0_GSUWGMRR0_GLS0_ISA1151_IU1_K1_LDSTI0_LBSPPA128_LBSPPB128_LBSPPM0_LPA8_LPB8_LPM0_LRVW16_LWPMn1_MIAV1_MIWT1_2_MO40_NTn1_NTA0_NTB0_NTC0_NTD0_NTM0_NEPBS0_NLCA1_NLCB1_ONLL1_PGR0_PLR1_PKA0_SIA1_SS1_SU32_SUM0_SUS256_SPO0_SRVW0_SSO0_SVW1_SK0_SKFTR0_SKXCCM0_SGRO0_TIN0_TLDS1_ULSGRO0_USL1_UIOFGRO0_USFGROn1_VSn1_VWA1_VWB1_WSGRA0_WSGRB0_WS32_WG64_2_1_WGM8_WGMXCC1_WGMXCCGn1
    SolutionIndex: 132
    SolutionNameMin: Cijk_Alik_Bljk_HHS_BH_Bias_HA_S_SAV_UserArgs_MT48x64x32_MI16x16x1_SN_LDSB0_AFC1_AG0_AFEM1_AFEM1_ASEM1_CLR0_CADS0_DTLA0_DTLB0_DTVA0_DTVB0_EPS0_ELFLR0_EMLLn1_FDSI0_GRPM1_GRVWA4_GRVWB8_GSU1_GSUAMB_GSUC0_GSUWGMRR0_GLS0_ISA1151_IU1_K1_LDSTI0_LBSPPA128_LBSPPB128_LBSPPM0_LPA8_LPB8_LPM0_LRVW16_LWPMn1_MIAV1_MIWT3_1_MO40_NTn1_NTA0_NTB0_NTC0_NTD0_NTM0_NEPBS0_NLCA1_NLCB1_ONLL1_PGR2_PLR0_PKA0_SIA1_SS1_SU32_SUM0_SUS256_SPO0_SRVW0_SSO0_SVW1_SK0_SKFTR0_SKXCCM0_SGRO0_TIN0_TLDS1_ULSGRO0_USL1_UIOFGRO0_USFGROn1_VSn1_VWA1_VWB1_WSGRA0_WSGRB0_WS32_WG16_8_1_WGM8_WGMXCC1_WGMXCCGn1
    SolutionIndex: 133
    SolutionNameMin: Cijk_Alik_Bljk_HHS_BH_Bias_HA_S_SAV_UserArgs_MT48x64x64_MI16x16x1_SN_LDSB0_AFC1_AG0_AFEM1_AFEM1_ASEM1_CLR0_CADS0_DTLA0_DTLB0_DTVA0_DTVB0_EPS0_ELFLR0_EMLLn1_FDSI0_GRPM1_GRVWA8_GRVWB8_GSU1_GSUAMB_GSUC0_GSUWGMRR0_GLS0_ISA1151_IU1_K1_LDSTI0_LBSPPA128_LBSPPB128_LBSPPM0_LPA8_LPB8_LPM0_LRVW16_LWPMn1_MIAV1_MIWT3_1_MO40_NTn1_NTA0_NTB0_NTC0_NTD0_NTM0_NEPBS0_NLCA1_NLCB1_ONLL1_PGR2_PLR0_PKA0_SIA1_SS1_SU32_SUM0_SUS256_SPO0_SRVW0_SSO0_SVW1_SK0_SKFTR0_SKXCCM0_SGRO0_TIN0_TLDS1_ULSGRO0_USL1_UIOFGRO0_USFGROn1_VSn1_VWA1_VWB1_WSGRA0_WSGRB0_WS32_WG16_8_1_WGM8_WGMXCC1_WGMXCCGn1
    SolutionIndex: 135
    SolutionNameMin: Cijk_Alik_Bljk_HHS_BH_Bias_HA_S_SAV_UserArgs_MT64x96x64_MI16x16x1_SN_LDSB0_AFC1_AG0_AFEM1_AFEM1_ASEM1_CLR0_CADS0_DTLA0_DTLB0_DTVA0_DTVB0_EPS0_ELFLR0_EMLLn1_FDSI0_GRPM1_GRVWA8_GRVWB8_GSU1_GSUAMB_GSUC0_GSUWGMRR0_GLS0_ISA1151_IU1_K1_LDSTI0_LBSPPA128_LBSPPB128_LBSPPM0_LPA8_LPB8_LPM0_LRVW16_LWPMn1_MIAV1_MIWT2_3_MO40_NTn1_NTA0_NTB0_NTC0_NTD0_NTM0_NEPBS0_NLCA1_NLCB1_ONLL1_PGR2_PLR1_PKA0_SIA1_SS1_SU32_SUM0_SUS256_SPO0_SRVW0_SSO0_SVW1_SK0_SKFTR0_SKXCCM0_SGRO0_TIN0_TLDS1_ULSGRO0_USL1_UIOFGRO0_USFGROn1_VSn1_VWA1_VWB1_WSGRA0_WSGRB0_WS32_WG32_4_1_WGM8_WGMXCC1_WGMXCCGn1
    SolutionIndex: 136
    SolutionNameMin: Cijk_Alik_Bljk_HHS_BH_Bias_HA_S_SAV_UserArgs_MT64x96x32_MI16x16x1_SN_LDSB0_AFC1_AG0_AFEM1_AFEM1_ASEM1_CLR0_CADS0_DTLA0_DTLB0_DTVA0_DTVB0_EPS0_ELFLR0_EMLLn1_FDSI0_GRPM1_GRVWA8_GRVWB8_GSU1_GSUAMB_GSUC0_GSUWGMRR0_GLS0_ISA1151_IU1_K1_LDSTI0_LBSPPA128_LBSPPB128_LBSPPM0_LPA8_LPB8_LPM0_LRVW16_LWPMn1_MIAV1_MIWT2_3_MO40_NTn1_NTA0_NTB0_NTC0_NTD0_NTM0_NEPBS0_NLCA1_NLCB1_ONLL1_PGR2_PLR1_PKA0_SIA1_SS1_SU32_SUM0_SUS256_SPO0_SRVW0_SSO0_SVW1_SK0_SKFTR0_SKXCCM0_SGRO0_TIN0_TLDS1_ULSGRO0_USL1_UIOFGRO0_USFGROn1_VSn1_VWA1_VWB1_WSGRA0_WSGRB0_WS32_WG32_4_1_WGM8_WGMXCC1_WGMXCCGn1
    SolutionIndex: 137
    SolutionNameMin: Cijk_Alik_Bljk_HHS_BH_Bias_HA_S_SAV_UserArgs_MT128x48x64_MI16x16x1_SN_LDSB0_AFC1_AG0_AFEM1_AFEM1_ASEM1_CLR0_CADS0_DTLA0_DTLB0_DTVA0_DTVB0_EPS0_ELFLR0_EMLLn1_FDSI0_GRPM1_GRVWA8_GRVWB8_GSU1_GSUAMB_GSUC0_GSUWGMRR0_GLS0_ISA1151_IU1_K1_LDSTI0_LBSPPA128_LBSPPB128_LBSPPM0_LPA8_LPB8_LPM0_LRVW16_LWPMn1_MIAV1_MIWT2_3_MO40_NTn1_NTA0_NTB0_NTC0_NTD0_NTM0_NEPBS0_NLCA1_NLCB1_ONLL1_PGR2_PLR1_PKA0_SIA1_SS1_SU32_SUM0_SUS256_SPO0_SRVW0_SSO0_SVW1_SK0_SKFTR0_SKXCCM0_SGRO0_TIN0_TLDS1_ULSGRO0_USL1_UIOFGRO0_USFGROn1_VSn1_VWA1_VWB1_WSGRA0_WSGRB0_WS32_WG64_2_1_WGM8_WGMXCC1_WGMXCCGn1
    SolutionIndex: 138
    SolutionNameMin: Cijk_Alik_Bljk_HHS_BH_Bias_HA_S_SAV_UserArgs_MT96x128x64_MI16x16x1_SN_LDSB0_AFC1_AG0_AFEM1_AFEM1_ASEM1_CLR0_CADS0_DTLA0_DTLB0_DTVA0_DTVB0_EPS0_ELFLR0_EMLLn1_FDSI0_GRPM1_GRVWA8_GRVWB8_GSU1_GSUAMB_GSUC0_GSUWGMRR0_GLS0_ISA1151_IU1_K1_LDSTI0_LBSPPA128_LBSPPB128_LBSPPM0_LPA8_LPB8_LPM0_LRVW16_LWPMn1_MIAV1_MIWT6_2_MO40_NTn1_NTA0_NTB0_NTC0_NTD0_NTM0_NEPBS0_NLCA1_NLCB1_ONLL1_PGR0_PLR0_PKA0_SIA3_SS1_SU32_SUM0_SUS256_SPO0_SRVW0_SSO0_SVW1_SK0_SKFTR0_SKXCCM0_SGRO0_TIN0_TLDS1_ULSGRO0_USL1_UIOFGRO0_USFGROn1_VSn1_VWA1_VWB1_WSGRA0_WSGRB0_WS32_WG16_8_1_WGM8_WGMXCC1_WGMXCCGn1
    SolutionIndex: 139
    SolutionNameMin: Cijk_Alik_Bljk_HHS_BH_Bias_HA_S_SAV_UserArgs_MT128x96x64_MI16x16x1_SN_LDSB0_AFC1_AG0_AFEM1_AFEM1_ASEM1_CLR0_CADS0_DTLA0_DTLB0_DTVA0_DTVB0_EPS0_ELFLR0_EMLLn1_FDSI0_GRPM1_GRVWA8_GRVWB8_GSU1_GSUAMB_GSUC0_GSUWGMRR0_GLS0_ISA1151_IU1_K1_LDSTI0_LBSPPA128_LBSPPB128_LBSPPM0_LPA8_LPB8_LPM0_LRVW16_LWPMn1_MIAV1_MIWT4_3_MO40_NTn1_NTA0_NTB0_NTC0_NTD0_NTM0_NEPBS0_NLCA1_NLCB1_ONLL1_PGR0_PLR0_PKA0_SIA3_SS1_SU32_SUM0_SUS256_SPO0_SRVW0_SSO0_SVW1_SK0_SKFTR0_SKXCCM0_SGRO0_TIN0_TLDS1_ULSGRO0_USL1_UIOFGRO0_USFGROn1_VSn1_VWA1_VWB1_WSGRA0_WSGRB0_WS32_WG32_4_1_WGM8_WGMXCC1_WGMXCCGn1
    SolutionIndex: 140
    SolutionNameMin: Cijk_Alik_Bljk_HHS_BH_Bias_HA_S_SAV_UserArgs_MT128x80x64_MI16x16x1_SN_LDSB0_AFC1_AG0_AFEM1_AFEM1_ASEM1_CLR0_CADS0_DTLA0_DTLB0_DTVA0_DTVB0_EPS0_ELFLR0_EMLLn1_FDSI0_GRPM1_GRVWA8_GRVWB8_GSU1_GSUAMB_GSUC0_GSUWGMRR0_GLS0_ISA1151_IU1_K1_LDSTI0_LBSPPA128_LBSPPB128_LBSPPM0_LPA8_LPB8_LPM0_LRVW16_LWPMn1_MIAV1_MIWT2_5_MO40_NTn1_NTA0_NTB0_NTC0_NTD0_NTM0_NEPBS0_NLCA1_NLCB1_ONLL1_PGR1_PLR1_PKA0_SIA3_SS1_SU32_SUM0_SUS256_SPO0_SRVW0_SSO0_SVW1_SK0_SKFTR0_SKXCCM0_SGRO0_TIN0_TLDS1_ULSGRO0_USL1_UIOFGRO0_USFGROn1_VSn1_VWA1_VWB1_WSGRA0_WSGRB0_WS32_WG64_2_1_WGM8_WGMXCC1_WGMXCCGn1
    SolutionIndex: 141
    SolutionNameMin: Cijk_Alik_Bljk_HHS_BH_Bias_HA_S_SAV_UserArgs_MT96x96x64_MI16x16x1_SN_LDSB0_AFC1_AG0_AFEM1_AFEM1_ASEM1_CLR0_CADS0_DTLA0_DTLB0_DTVA0_DTVB0_EPS0_ELFLR0_EMLLn1_FDSI0_GRPM1_GRVWA8_GRVWB8_GSU1_GSUAMB_GSUC0_GSUWGMRR0_GLS0_ISA1151_IU1_K1_LDSTI0_LBSPPA128_LBSPPB128_LBSPPM0_LPA8_LPB8_LPM0_LRVW16_LWPMn1_MIAV1_MIWT3_3_MO40_NTn1_NTA0_NTB0_NTC0_NTD0_NTM0_NEPBS0_NLCA1_NLCB1_ONLL1_PGR1_PLR1_PKA0_SIA3_SS1_SU32_SUM0_SUS256_SPO0_SRVW0_SSO0_SVW1_SK0_SKFTR0_SKXCCM0_SGRO0_TIN0_TLDS1_ULSGRO0_USL1_UIOFGRO0_USFGROn1_VSn1_VWA1_VWB1_WSGRA0_WSGRB0_WS32_WG32_4_1_WGM8_WGMXCC1_WGMXCCGn1
    SolutionIndex: 142
    SolutionNameMin: Cijk_Alik_Bljk_HHS_BH_Bias_HA_S_SAV_UserArgs_MT96x96x64_MI16x16x1_SN_LDSB0_AFC1_AG0_AFEM1_AFEM1_ASEM1_CLR0_CADS0_DTLA0_DTLB0_DTVA0_DTVB0_EPS0_ELFLR0_EMLLn1_FDSI0_GRPM1_GRVWA8_GRVWB8_GSU1_GSUAMB_GSUC0_GSUWGMRR0_GLS0_ISA1151_IU1_K1_LDSTI0_LBSPPA128_LBSPPB128_LBSPPM0_LPA8_LPB8_LPM0_LRVW16_LWPMn1_MIAV1_MIWT3_3_MO40_NTn1_NTA0_NTB0_NTC0_NTD0_NTM0_NEPBS0_NLCA1_NLCB1_ONLL1_PGR2_PLR1_PKA0_SIA3_SS1_SU32_SUM0_SUS256_SPO0_SRVW0_SSO0_SVW1_SK0_SKFTR0_SKXCCM0_SGRO0_TIN0_TLDS1_ULSGRO0_USL1_UIOFGRO0_USFGROn1_VSn1_VWA1_VWB1_WSGRA0_WSGRB0_WS32_WG32_4_1_WGM8_WGMXCC1_WGMXCCGn1
    SolutionIndex: 143
    SolutionNameMin: Cijk_Alik_Bljk_HHS_BH_Bias_HA_S_SAV_UserArgs_MT80x128x64_MI16x16x1_SN_LDSB0_AFC1_AG0_AFEM1_AFEM1_ASEM1_CLR0_CADS0_DTLA0_DTLB0_DTVA0_DTVB0_EPS0_ELFLR0_EMLLn1_FDSI0_GRPM1_GRVWA8_GRVWB8_GSU1_GSUAMB_GSUC0_GSUWGMRR0_GLS0_ISA1151_IU1_K1_LDSTI0_LBSPPA128_LBSPPB128_LBSPPM0_LPA8_LPB8_LPM0_LRVW16_LWPMn1_MIAV1_MIWT5_2_MO40_NTn1_NTA0_NTB0_NTC0_NTD0_NTM0_NEPBS0_NLCA1_NLCB1_ONLL1_PGR1_PLR1_PKA0_SIA3_SS1_SU32_SUM0_SUS256_SPO0_SRVW0_SSO0_SVW1_SK0_SKFTR0_SKXCCM0_SGRO0_TIN0_TLDS1_ULSGRO0_USL1_UIOFGRO0_USFGROn1_VSn1_VWA1_VWB1_WSGRA0_WSGRB0_WS32_WG16_8_1_WGM8_WGMXCC1_WGMXCCGn1
    SolutionIndex: 144
    SolutionNameMin: Cijk_Alik_Bljk_HHS_BH_Bias_HA_S_SAV_UserArgs_MT128x160x64_MI16x16x1_SN_LDSB0_AFC1_AG0_AFEM1_AFEM1_ASEM1_CLR0_CADS0_DTLA0_DTLB0_DTVA0_DTVB0_EPS0_ELFLR0_EMLLn1_FDSI0_GRPM1_GRVWA8_GRVWB8_GSU1_GSUAMB_GSUC0_GSUWGMRR0_GLS0_ISA1151_IU1_K1_LDSTI0_LBSPPA128_LBSPPB128_LBSPPM0_LPA8_LPB8_LPM0_LRVW16_LWPMn1_MIAV1_MIWT4_5_MO40_NTn1_NTA0_NTB0_NTC0_NTD0_NTM0_NEPBS0_NLCA1_NLCB1_ONLL1_PGR0_PLR0_PKA0_SIA3_SS1_SU32_SUM0_SUS256_SPO0_SRVW0_SSO0_SVW1_SK0_SKFTR0_SKXCCM0_SGRO0_TIN0_TLDS1_ULSGRO0_USL1_UIOFGRO0_USFGROn1_VSn1_VWA1_VWB1_WSGRA0_WSGRB0_WS32_WG32_4_1_WGM8_WGMXCC1_WGMXCCGn1
    SolutionIndex: 145
    SolutionNameMin: Cijk_Alik_Bljk_HHS_BH_Bias_HA_S_SAV_UserArgs_MT128x160x64_MI16x16x1_SN_LDSB0_AFC1_AG0_AFEM1_AFEM1_ASEM1_CLR0_CADS0_DTLA0_DTLB0_DTVA0_DTVB0_EPS0_ELFLR0_EMLLn1_FDSI0_GRPM1_GRVWA8_GRVWB8_GSU1_GSUAMB_GSUC0_GSUWGMRR0_GLS0_ISA1151_IU1_K1_LDSTI0_LBSPPA128_LBSPPB128_LBSPPM0_LPA8_LPB8_LPM0_LRVW16_LWPMn1_MIAV1_MIWT4_5_MO40_NTn1_NTA0_NTB0_NTC0_NTD0_NTM0_NEPBS0_NLCA1_NLCB1_ONLL1_PGR0_PLR0_PKA0_SIA1_SS1_SU32_SUM0_SUS256_SPO0_SRVW0_SSO0_SVW1_SK0_SKFTR0_SKXCCM0_SGRO0_TIN0_TLDS1_ULSGRO0_USL1_UIOFGRO0_USFGROn1_VSn1_VWA1_VWB1_WSGRA0_WSGRB0_WS32_WG32_4_1_WGM8_WGMXCC1_WGMXCCGn1
    SolutionIndex: 146
    SolutionNameMin: Cijk_Alik_Bljk_HHS_BH_Bias_HA_S_SAV_UserArgs_MT80x128x64_MI16x16x1_SN_LDSB1_AFC1_AG0_AFEM1_AFEM1_ASEM1_CLR0_CADS0_DTLA0_DTLB0_DTVA0_DTVB0_EPS0_ELFLR0_EMLLn1_FDSI0_GRPM1_GRVWA8_GRVWB8_GSU1_GSUAMB_GSUC0_GSUWGMRR0_GLS0_ISA1151_IU1_K1_LDSTI0_LBSPPA128_LBSPPB128_LBSPPM0_LPA8_LPB8_LPM0_LRVW16_LWPMn1_MIAV1_MIWT5_2_MO40_NTn1_NTA0_NTB0_NTC0_NTD0_NTM0_NEPBS0_NLCA1_NLCB1_ONLL1_PGR2_PLR1_PKA0_SIA3_SS1_SU32_SUM0_SUS256_SPO0_SRVW0_SSO0_SVW1_SK0_SKFTR0_SKXCCM0_SGRO0_TIN0_TLDS1_ULSGRO0_USL1_UIOFGRO0_USFGROn1_VSn1_VWA1_VWB1_WSGRA0_WSGRB0_WS32_WG16_8_1_WGM8_WGMXCC1_WGMXCCGn1
    SolutionIndex: 147
    SolutionNameMin: Cijk_Alik_Bljk_HHS_BH_Bias_HA_S_SAV_UserArgs_MT64x48x128_MI16x16x1_SN_LDSB0_AFC1_AG0_AFEM1_AFEM1_ASEM1_CLR0_CADS0_DTLA0_DTLB0_DTVA0_DTVB0_EPS0_ELFLR0_EMLLn1_FDSI0_GRPM1_GRVWA8_GRVWB8_GSU1_GSUAMB_GSUC0_GSUWGMRR0_GLS0_ISA1151_IU1_K1_LDSTI0_LBSPPA256_LBSPPB256_LBSPPM0_LPA8_LPB8_LPM0_LRVW16_LWPMn1_MIAV1_MIWT1_3_MO40_NTn1_NTA0_NTB0_NTC0_NTD0_NTM0_NEPBS0_NLCA1_NLCB1_ONLL1_PGR2_PLR1_PKA0_SIA3_SS1_SU32_SUM0_SUS256_SPO0_SRVW0_SSO0_SVW1_SK0_SKFTR0_SKXCCM0_SGRO0_TIN0_TLDS1_ULSGRO0_USL1_UIOFGRO0_USFGROn1_VSn1_VWA1_VWB1_WSGRA0_WSGRB0_WS32_WG64_2_1_WGM8_WGMXCC1_WGMXCCGn1
    SolutionIndex: 148
    SolutionNameMin: Cijk_Alik_Bljk_HHS_BH_Bias_HA_S_SAV_UserArgs_MT64x128x32_MI16x16x1_SN_LDSB0_AFC1_AG0_AFEM1_AFEM1_ASEM1_CLR0_CADS0_DTLA0_DTLB0_DTVA0_DTVB0_EPS0_ELFLR0_EMLLn1_FDSI0_GRPM1_GRVWA8_GRVWB8_GSU1_GSUAMB_GSUC0_GSUWGMRR0_GLS0_ISA1151_IU1_K1_LDSTI0_LBSPPA128_LBSPPB128_LBSPPM0_LPA8_LPB8_LPM0_LRVW16_LWPMn1_MIAV1_MIWT2_4_MO40_NTn1_NTA0_NTB0_NTC0_NTD0_NTM0_NEPBS0_NLCA1_NLCB1_ONLL1_PGR2_PLR1_PKA0_SIA1_SS1_SU32_SUM0_SUS256_SPO0_SRVW0_SSO0_SVW1_SK0_SKFTR0_SKXCCM0_SGRO0_TIN0_TLDS1_ULSGRO0_USL1_UIOFGRO0_USFGROn1_VSn1_VWA1_VWB1_WSGRA0_WSGRB0_WS32_WG32_4_1_WGM8_WGMXCC1_WGMXCCGn1
    SolutionIndex: 149
    SolutionNameMin: Cijk_Alik_Bljk_HHS_BH_Bias_HA_S_SAV_UserArgs_MT32x64x32_MI16x16x1_SN_LDSB0_AFC1_AG0_AFEM1_AFEM1_ASEM1_CLR0_CADS0_DTLA0_DTLB0_DTVA0_DTVB0_EPS0_ELFLR0_EMLLn1_FDSI0_GRPM1_GRVWA8_GRVWB8_GSU1_GSUAMB_GSUC0_GSUWGMRR0_GLS0_ISA1151_IU1_K1_LDSTI0_LBSPPA128_LBSPPB128_LBSPPM0_LPA8_LPB8_LPM0_LRVW16_LWPMn1_MIAV1_MIWT1_2_MO40_NTn1_NTA0_NTB0_NTC0_NTD0_NTM0_NEPBS0_NLCA1_NLCB1_ONLL1_PGR2_PLR1_PKA0_SIA1_SS1_SU32_SUM0_SUS256_SPO0_SRVW0_SSO0_SVW1_SK0_SKFTR0_SKXCCM0_SGRO0_TIN0_TLDS1_ULSGRO0_USL1_UIOFGRO0_USFGROn1_VSn1_VWA1_VWB1_WSGRA0_WSGRB0_WS32_WG32_4_1_WGM8_WGMXCC1_WGMXCCGn1
    SolutionIndex: 150
    SolutionNameMin: Cijk_Alik_Bljk_HHS_BH_Bias_HA_S_SAV_UserArgs_MT32x16x64_MI16x16x1_SN_LDSB0_AFC1_AG0_AFEM1_AFEM1_ASEM1_CLR0_CADS0_DTLA0_DTLB0_DTVA0_DTVB0_EPS0_ELFLR0_EMLLn1_FDSI0_GRPM1_GRVWA8_GRVWB8_GSU1_GSUAMB_GSUC0_GSUWGMRR0_GLS0_ISA1151_IU1_K1_LDSTI0_LBSPPA128_LBSPPB128_LBSPPM0_LPA8_LPB8_LPM0_LRVW16_LWPMn1_MIAV1_MIWT1_1_MO40_NTn1_NTA0_NTB0_NTC0_NTD0_NTM0_NEPBS0_NLCA1_NLCB1_ONLL1_PGR2_PLR1_PKA0_SIA3_SS1_SU32_SUM0_SUS256_SPO0_SRVW0_SSO0_SVW1_SK0_SKFTR0_SKXCCM0_SGRO0_TIN0_TLDS1_ULSGRO0_USL1_UIOFGRO0_USFGROn1_VSn1_VWA1_VWB1_WSGRA0_WSGRB0_WS32_WG32_2_1_WGM8_WGMXCC1_WGMXCCGn1
    SolutionIndex: 151
    SolutionNameMin: Cijk_Alik_Bljk_HHS_BH_Bias_HA_S_SAV_UserArgs_MT32x64x128_MI16x16x1_SN_LDSB0_AFC1_AG0_AFEM1_AFEM1_ASEM1_CLR0_CADS0_DTLA0_DTLB0_DTVA0_DTVB0_EPS0_ELFLR0_EMLLn1_FDSI0_GRPM1_GRVWA8_GRVWB8_GSU1_GSUAMB_GSUC0_GSUWGMRR0_GLS0_ISA1151_IU1_K1_LDSTI0_LBSPPA256_LBSPPB256_LBSPPM0_LPA8_LPB8_LPM0_LRVW16_LWPMn1_MIAV1_MIWT2_1_MO40_NTn1_NTA0_NTB0_NTC0_NTD0_NTM0_NEPBS0_NLCA1_NLCB1_ONLL1_PGR2_PLR1_PKA0_SIA1_SS1_SU32_SUM0_SUS256_SPO0_SRVW0_SSO0_SVW1_SK0_SKFTR0_SKXCCM0_SGRO0_TIN0_TLDS1_ULSGRO0_USL1_UIOFGRO0_USFGROn1_VSn1_VWA1_VWB1_WSGRA0_WSGRB0_WS32_WG16_8_1_WGM8_WGMXCC1_WGMXCCGn1
    SolutionIndex: 152
    SolutionNameMin: Cijk_Alik_Bljk_HHS_BH_Bias_HA_S_SAV_UserArgs_MT32x64x128_MI16x16x1_SN_LDSB0_AFC1_AG0_AFEM1_AFEM1_ASEM1_CLR0_CADS0_DTLA0_DTLB0_DTVA0_DTVB0_EPS0_ELFLR0_EMLLn1_FDSI0_GRPM1_GRVWA8_GRVWB8_GSU1_GSUAMB_GSUC0_GSUWGMRR0_GLS0_ISA1151_IU1_K1_LDSTI0_LBSPPA256_LBSPPB256_LBSPPM0_LPA8_LPB8_LPM0_LRVW16_LWPMn1_MIAV1_MIWT2_1_MO40_NTn1_NTA0_NTB0_NTC0_NTD0_NTM0_NEPBS0_NLCA1_NLCB1_ONLL1_PGR1_PLR1_PKA0_SIA1_SS1_SU32_SUM0_SUS256_SPO0_SRVW0_SSO0_SVW1_SK0_SKFTR0_SKXCCM0_SGRO0_TIN0_TLDS1_ULSGRO0_USL1_UIOFGRO0_USFGROn1_VSn1_VWA1_VWB1_WSGRA0_WSGRB0_WS32_WG16_8_1_WGM8_WGMXCC1_WGMXCCGn1
    SolutionIndex: 153
    SolutionNameMin: Cijk_Alik_Bljk_HHS_BH_Bias_HA_S_SAV_UserArgs_MT64x64x64_MI16x16x1_SN_LDSB0_AFC1_AG0_AFEM1_AFEM1_ASEM1_CLR0_CADS0_DTLA0_DTLB0_DTVA0_DTVB0_EPS0_ELFLR0_EMLLn1_FDSI0_GRPM1_GRVWA8_GRVWB8_GSU1_GSUAMB_GSUC0_GSUWGMRR0_GLS0_ISA1151_IU1_K1_LDSTI0_LBSPPA128_LBSPPB128_LBSPPM0_LPA8_LPB8_LPM0_LRVW16_LWPMn1_MIAV1_MIWT4_1_MO40_NTn1_NTA0_NTB0_NTC0_NTD0_NTM0_NEPBS0_NLCA1_NLCB1_ONLL1_PGR2_PLR1_PKA0_SIA1_SS1_SU32_SUM0_SUS256_SPO0_SRVW0_SSO0_SVW1_SK0_SKFTR0_SKXCCM0_SGRO0_TIN0_TLDS1_ULSGRO0_USL1_UIOFGRO0_USFGROn1_VSn1_VWA1_VWB1_WSGRA0_WSGRB0_WS32_WG16_8_1_WGM8_WGMXCC1_WGMXCCGn1
    SolutionIndex: 154
    SolutionNameMin: Cijk_Alik_Bljk_HHS_BH_Bias_HA_S_SAV_UserArgs_MT96x32x32_MI16x16x1_SN_LDSB0_AFC1_AG0_AFEM1_AFEM1_ASEM1_CLR0_CADS0_DTLA0_DTLB0_DTVA0_DTVB0_EPS0_ELFLR0_EMLLn1_FDSI0_GRPM1_GRVWA8_GRVWB8_GSU1_GSUAMB_GSUC0_GSUWGMRR0_GLS0_ISA1151_IU1_K1_LDSTI0_LBSPPA128_LBSPPB128_LBSPPM0_LPA8_LPB8_LPM0_LRVW16_LWPMn1_MIAV1_MIWT3_1_MO40_NTn1_NTA0_NTB0_NTC0_NTD0_NTM0_NEPBS0_NLCA1_NLCB1_ONLL1_PGR2_PLR1_PKA0_SIA1_SS1_SU32_SUM0_SUS256_SPO0_SRVW0_SSO0_SVW1_SK0_SKFTR0_SKXCCM0_SGRO0_TIN0_TLDS1_ULSGRO0_USL1_UIOFGRO0_USFGROn1_VSn1_VWA1_VWB1_WSGRA0_WSGRB0_WS32_WG32_4_1_WGM8_WGMXCC1_WGMXCCGn1
    SolutionIndex: 155
    SolutionNameMin: Cijk_Alik_Bljk_HHS_BH_Bias_HA_S_SAV_UserArgs_MT64x32x64_MI16x16x1_SN_LDSB0_AFC1_AG0_AFEM1_AFEM1_ASEM1_CLR0_CADS0_DTLA0_DTLB0_DTVA0_DTVB0_EPS0_ELFLR0_EMLLn1_FDSI0_GRPM1_GRVWA8_GRVWB8_GSU1_GSUAMB_GSUC0_GSUWGMRR0_GLS0_ISA1151_IU1_K1_LDSTI0_LBSPPA128_LBSPPB128_LBSPPM0_LPA8_LPB8_LPM0_LRVW16_LWPMn1_MIAV1_MIWT2_1_MO40_NTn1_NTA0_NTB0_NTC0_NTD0_NTM0_NEPBS0_NLCA1_NLCB1_ONLL1_PGR2_PLR1_PKA0_SIA1_SS1_SU32_SUM0_SUS256_SPO0_SRVW0_SSO0_SVW1_SK0_SKFTR0_SKXCCM0_SGRO0_TIN0_TLDS1_ULSGRO0_USL1_UIOFGRO0_USFGROn1_VSn1_VWA1_VWB1_WSGRA0_WSGRB0_WS32_WG32_4_1_WGM8_WGMXCC1_WGMXCCGn1
    SolutionIndex: 156
    SolutionNameMin: Cijk_Alik_Bljk_HHS_BH_Bias_HA_S_SAV_UserArgs_MT64x64x64_MI16x16x1_SN_LDSB0_AFC1_AG0_AFEM1_AFEM1_ASEM1_CLR0_CADS0_DTLA0_DTLB0_DTVA0_DTVB0_EPS0_ELFLR0_EMLLn1_FDSI0_GRPM1_GRVWA8_GRVWB8_GSU1_GSUAMB_GSUC0_GSUWGMRR0_GLS0_ISA1151_IU1_K1_LDSTI0_LBSPPA128_LBSPPB128_LBSPPM0_LPA8_LPB8_LPM0_LRVW16_LWPMn1_MIAV1_MIWT2_2_MO40_NTn1_NTA0_NTB0_NTC0_NTD0_NTM0_NEPBS0_NLCA1_NLCB1_ONLL1_PGR2_PLR1_PKA0_SIA3_SS1_SU32_SUM0_SUS256_SPO0_SRVW0_SSO0_SVW1_SK0_SKFTR0_SKXCCM0_SGRO0_TIN0_TLDS1_ULSGRO0_USL1_UIOFGRO0_USFGROn1_VSn1_VWA1_VWB1_WSGRA0_WSGRB0_WS32_WG32_4_1_WGM8_WGMXCC1_WGMXCCGn1
    SolutionIndex: 160
    SolutionNameMin: Cijk_Alik_Bljk_HHS_BH_Bias_HA_S_SAV_UserArgs_MT64x128x32_MI16x16x1_SN_LDSB0_AFC1_AG0_AFEM1_AFEM1_ASEM1_CLR0_CADS0_DTLA0_DTLB0_DTVA0_DTVB0_EPS0_ELFLR0_EMLLn1_FDSI0_GRPM1_GRVWA8_GRVWB8_GSU1_GSUAMB_GSUC0_GSUWGMRR0_GLS0_ISA1151_IU1_K1_LDSTI0_LBSPPA128_LBSPPB128_LBSPPM0_LPA8_LPB8_LPM0_LRVW16_LWPMn1_MIAV1_MIWT2_4_MO40_NTn1_NTA0_NTB0_NTC0_NTD0_NTM0_NEPBS0_NLCA1_NLCB1_ONLL1_PGR1_PLR0_PKA0_SIA3_SS1_SU32_SUM0_SUS256_SPO0_SRVW0_SSO0_SVW1_SK0_SKFTR0_SKXCCM0_SGRO0_TIN0_TLDS1_ULSGRO0_USL1_UIOFGRO0_USFGROn1_VSn1_VWA1_VWB1_WSGRA0_WSGRB0_WS32_WG32_4_1_WGM8_WGMXCC1_WGMXCCGn1
    SolutionIndex: 161
    SolutionNameMin: Cijk_Alik_Bljk_HHS_BH_Bias_HA_S_SAV_UserArgs_MT128x64x32_MI16x16x1_SN_LDSB0_AFC1_AG0_AFEM1_AFEM1_ASEM1_CLR0_CADS0_DTLA0_DTLB0_DTVA0_DTVB0_EPS0_ELFLR0_EMLLn1_FDSI0_GRPM1_GRVWA8_GRVWB8_GSU1_GSUAMB_GSUC0_GSUWGMRR0_GLS0_ISA1151_IU1_K1_LDSTI0_LBSPPA128_LBSPPB128_LBSPPM0_LPA8_LPB8_LPM0_LRVW16_LWPMn1_MIAV1_MIWT4_2_MO40_NTn1_NTA0_NTB0_NTC0_NTD0_NTM0_NEPBS0_NLCA1_NLCB1_ONLL1_PGR0_PLR0_PKA0_SIA3_SS1_SU32_SUM0_SUS256_SPO0_SRVW0_SSO0_SVW1_SK0_SKFTR0_SKXCCM0_SGRO0_TIN0_TLDS1_ULSGRO0_USL1_UIOFGRO0_USFGROn1_VSn1_VWA1_VWB1_WSGRA0_WSGRB0_WS32_WG32_4_1_WGM8_WGMXCC1_WGMXCCGn1
    SolutionIndex: 162
    SolutionNameMin: Cijk_Alik_Bljk_HHS_BH_Bias_HA_S_SAV_UserArgs_MT64x256x32_MI16x16x1_SN_LDSB0_AFC1_AG0_AFEM1_AFEM1_ASEM1_CLR0_CADS0_DTLA0_DTLB0_DTVA0_DTVB0_EPS0_ELFLR0_EMLLn1_FDSI0_GRPM1_GRVWA8_GRVWB8_GSU1_GSUAMB_GSUC0_GSUWGMRR0_GLS0_ISA1151_IU1_K1_LDSTI0_LBSPPA128_LBSPPB128_LBSPPM0_LPA8_LPB8_LPM0_LRVW16_LWPMn1_MIAV1_MIWT2_8_MO40_NTn1_NTA0_NTB0_NTC0_NTD0_NTM0_NEPBS0_NLCA1_NLCB1_ONLL1_PGR0_PLR0_PKA0_SIA3_SS1_SU32_SUM0_SUS256_SPO0_SRVW0_SSO0_SVW1_SK0_SKFTR0_SKXCCM0_SGRO0_TIN0_TLDS1_ULSGRO0_USL1_UIOFGRO0_USFGROn1_VSn1_VWA1_VWB1_WSGRA0_WSGRB0_WS32_WG32_4_1_WGM8_WGMXCC1_WGMXCCGn1
    SolutionIndex: 163
    SolutionNameMin: Cijk_Alik_Bljk_HHS_BH_Bias_HA_S_SAV_UserArgs_MT192x64x32_MI16x16x1_SN_LDSB0_AFC1_AG0_AFEM1_AFEM1_ASEM1_CLR0_CADS0_DTLA0_DTLB0_DTVA0_DTVB0_EPS0_ELFLR0_EMLLn1_FDSI0_GRPM1_GRVWA8_GRVWB8_GSU1_GSUAMB_GSUC0_GSUWGMRR0_GLS0_ISA1151_IU1_K1_LDSTI0_LBSPPA128_LBSPPB128_LBSPPM0_LPA8_LPB8_LPM0_LRVW16_LWPMn1_MIAV1_MIWT3_4_MO40_NTn1_NTA0_NTB0_NTC0_NTD0_NTM0_NEPBS0_NLCA1_NLCB1_ONLL1_PGR0_PLR0_PKA0_SIA3_SS1_SU32_SUM0_SUS256_SPO0_SRVW0_SSO0_SVW1_SK0_SKFTR0_SKXCCM0_SGRO0_TIN0_TLDS1_ULSGRO0_USL1_UIOFGRO0_USFGROn1_VSn1_VWA1_VWB1_WSGRA0_WSGRB0_WS32_WG64_2_1_WGM8_WGMXCC1_WGMXCCGn1
    SolutionIndex: 164
    SolutionNameMin: Cijk_Alik_Bljk_HHS_BH_Bias_HA_S_SAV_UserArgs_MT128x160x32_MI16x16x1_SN_LDSB0_AFC1_AG0_AFEM1_AFEM1_ASEM1_CLR0_CADS0_DTLA0_DTLB0_DTVA0_DTVB0_EPS0_ELFLR0_EMLLn1_FDSI0_GRPM1_GRVWA8_GRVWB8_GSU1_GSUAMB_GSUC0_GSUWGMRR0_GLS0_ISA1151_IU1_K1_LDSTI0_LBSPPA128_LBSPPB128_LBSPPM0_LPA8_LPB8_LPM0_LRVW16_LWPMn1_MIAV1_MIWT4_5_MO40_NTn1_NTA0_NTB0_NTC0_NTD0_NTM0_NEPBS0_NLCA1_NLCB1_ONLL1_PGR0_PLR0_PKA0_SIA3_SS1_SU32_SUM0_SUS256_SPO0_SRVW0_SSO0_SVW1_SK0_SKFTR0_SKXCCM0_SGRO0_TIN0_TLDS1_ULSGRO0_USL1_UIOFGRO0_USFGROn1_VSn1_VWA1_VWB1_WSGRA0_WSGRB0_WS32_WG32_4_1_WGM8_WGMXCC1_WGMXCCGn1
    SolutionIndex: 165
    SolutionNameMin: Cijk_Alik_Bljk_HHS_BH_Bias_HA_S_SAV_UserArgs_MT64x64x128_MI16x16x1_SN_LDSB1_AFC1_AG0_AFEM1_AFEM1_ASEM1_CLR0_CADS0_DTLA0_DTLB0_DTVA0_DTVB0_EPS0_ELFLR0_EMLLn1_FDSI0_GRPM1_GRVWA8_GRVWB8_GSU1_GSUAMB_GSUC0_GSUWGMRR0_GLS0_ISA1151_IU1_K1_LDSTI0_LBSPPA256_LBSPPB256_LBSPPM0_LPA8_LPB8_LPM0_LRVW16_LWPMn1_MIAV1_MIWT2_2_MO40_NTn1_NTA0_NTB0_NTC0_NTD0_NTM0_NEPBS0_NLCA1_NLCB1_ONLL1_PGR2_PLR1_PKA0_SIA3_SS1_SU32_SUM0_SUS256_SPO0_SRVW0_SSO0_SVW1_SK0_SKFTR0_SKXCCM0_SGRO0_TIN0_TLDS1_ULSGRO0_USL1_UIOFGRO0_USFGROn1_VSn1_VWA1_VWB1_WSGRA0_WSGRB0_WS32_WG32_4_1_WGM8_WGMXCC1_WGMXCCGn1
    SolutionIndex: 167
    SolutionNameMin: Cijk_Alik_Bljk_HHS_BH_Bias_HA_S_SAV_UserArgs_MT64x128x64_MI16x16x1_SN_LDSB1_AFC1_AG0_AFEM1_AFEM1_ASEM1_CLR0_CADS0_DTLA0_DTLB0_DTVA0_DTVB0_EPS0_ELFLR0_EMLLn1_FDSI0_GRPM1_GRVWA8_GRVWB8_GSU1_GSUAMB_GSUC0_GSUWGMRR0_GLS0_ISA1151_IU1_K1_LDSTI0_LBSPPA128_LBSPPB128_LBSPPM0_LPA8_LPB8_LPM0_LRVW16_LWPMn1_MIAV1_MIWT2_4_MO40_NTn1_NTA0_NTB0_NTC0_NTD0_NTM0_NEPBS0_NLCA1_NLCB1_ONLL1_PGR1_PLR1_PKA0_SIA3_SS1_SU32_SUM0_SUS256_SPO0_SRVW0_SSO0_SVW1_SK0_SKFTR0_SKXCCM0_SGRO0_TIN0_TLDS1_ULSGRO0_USL1_UIOFGRO0_USFGROn1_VSn1_VWA1_VWB1_WSGRA0_WSGRB0_WS32_WG32_4_1_WGM8_WGMXCC1_WGMXCCGn1
    SolutionIndex: 168
    SolutionNameMin: Cijk_Alik_Bljk_HHS_BH_Bias_HA_S_SAV_UserArgs_MT64x128x64_MI16x16x1_SN_LDSB1_AFC1_AG0_AFEM1_AFEM1_ASEM1_CLR0_CADS0_DTLA0_DTLB0_DTVA0_DTVB0_EPS0_ELFLR0_EMLLn1_FDSI0_GRPM1_GRVWA8_GRVWB8_GSU1_GSUAMB_GSUC0_GSUWGMRR0_GLS0_ISA1151_IU1_K1_LDSTI0_LBSPPA128_LBSPPB128_LBSPPM0_LPA8_LPB8_LPM0_LRVW16_LWPMn1_MIAV1_MIWT4_2_MO40_NTn1_NTA0_NTB0_NTC0_NTD0_NTM0_NEPBS0_NLCA1_NLCB1_ONLL1_PGR1_PLR1_PKA0_SIA3_SS1_SU32_SUM0_SUS256_SPO0_SRVW0_SSO0_SVW1_SK0_SKFTR0_SKXCCM0_SGRO0_TIN0_TLDS1_ULSGRO0_USL1_UIOFGRO0_USFGROn1_VSn1_VWA1_VWB1_WSGRA0_WSGRB0_WS32_WG16_8_1_WGM8_WGMXCC1_WGMXCCGn1
    SolutionIndex: 169
    SolutionNameMin: Cijk_Alik_Bljk_HHS_BH_Bias_HA_S_SAV_UserArgs_MT64x128x64_MI16x16x1_SN_LDSB1_AFC1_AG0_AFEM1_AFEM1_ASEM1_CLR0_CADS0_DTLA0_DTLB0_DTVA0_DTVB0_EPS0_ELFLR0_EMLLn1_FDSI0_GRPM1_GRVWA8_GRVWB8_GSU1_GSUAMB_GSUC0_GSUWGMRR0_GLS0_ISA1151_IU1_K1_LDSTI0_LBSPPA128_LBSPPB128_LBSPPM0_LPA8_LPB8_LPM0_LRVW16_LWPMn1_MIAV1_MIWT4_2_MO40_NTn1_NTA0_NTB0_NTC0_NTD0_NTM0_NEPBS0_NLCA1_NLCB1_ONLL1_PGR2_PLR1_PKA0_SIA3_SS1_SU32_SUM0_SUS256_SPO0_SRVW0_SSO0_SVW1_SK0_SKFTR0_SKXCCM0_SGRO0_TIN0_TLDS1_ULSGRO0_USL1_UIOFGRO0_USFGROn1_VSn1_VWA1_VWB1_WSGRA0_WSGRB0_WS32_WG16_8_1_WGM8_WGMXCC1_WGMXCCGn1
    SolutionIndex: 171
    SolutionNameMin: Cijk_Alik_Bljk_HHS_BH_Bias_HA_S_SAV_UserArgs_MT128x128x32_MI16x16x1_SN_LDSB0_AFC1_AG0_AFEM1_AFEM1_ASEM1_CLR0_CADS0_DTLA0_DTLB0_DTVA0_DTVB0_EPS0_ELFLR0_EMLLn1_FDSI0_GRPM1_GRVWA8_GRVWB8_GSU1_GSUAMB_GSUC0_GSUWGMRR0_GLS0_ISA1151_IU1_K1_LDSTI0_LBSPPA128_LBSPPB128_LBSPPM0_LPA8_LPB8_LPM0_LRVW16_LWPMn1_MIAV1_MIWT8_2_MO40_NTn1_NTA0_NTB0_NTC0_NTD0_NTM0_NEPBS0_NLCA1_NLCB1_ONLL1_PGR0_PLR0_PKA0_SIA3_SS1_SU32_SUM0_SUS256_SPO0_SRVW0_SSO0_SVW1_SK0_SKFTR0_SKXCCM0_SGRO0_TIN0_TLDS1_ULSGRO0_USL1_UIOFGRO0_USFGROn1_VSn1_VWA1_VWB1_WSGRA0_WSGRB0_WS32_WG16_8_1_WGM8_WGMXCC1_WGMXCCGn1
    SolutionIndex: 172
    SolutionNameMin: Cijk_Alik_Bljk_HHS_BH_Bias_HA_S_SAV_UserArgs_MT96x128x32_MI16x16x1_SN_LDSB0_AFC1_AG0_AFEM1_AFEM1_ASEM1_CLR0_CADS0_DTLA0_DTLB0_DTVA0_DTVB0_EPS0_ELFLR0_EMLLn1_FDSI0_GRPM1_GRVWA8_GRVWB8_GSU1_GSUAMB_GSUC0_GSUWGMRR0_GLS0_ISA1151_IU1_K1_LDSTI0_LBSPPA128_LBSPPB128_LBSPPM0_LPA8_LPB8_LPM0_LRVW16_LWPMn1_MIAV1_MIWT3_4_MO40_NTn1_NTA0_NTB0_NTC0_NTD0_NTM0_NEPBS0_NLCA1_NLCB1_ONLL1_PGR0_PLR0_PKA0_SIA1_SS1_SU32_SUM0_SUS256_SPO0_SRVW0_SSO0_SVW1_SK0_SKFTR0_SKXCCM0_SGRO0_TIN0_TLDS1_ULSGRO0_USL1_UIOFGRO0_USFGROn1_VSn1_VWA1_VWB1_WSGRA0_WSGRB0_WS32_WG32_4_1_WGM8_WGMXCC1_WGMXCCGn1
    SolutionIndex: 173
    SolutionNameMin: Cijk_Alik_Bljk_HHS_BH_Bias_HA_S_SAV_UserArgs_MT32x64x64_MI16x16x1_SN_LDSB0_AFC1_AG0_AFEM1_AFEM1_ASEM1_CLR0_CADS0_DTLA0_DTLB0_DTVA0_DTVB0_EPS0_ELFLR0_EMLLn1_FDSI0_GRPM1_GRVWA8_GRVWB8_GSU1_GSUAMB_GSUC0_GSUWGMRR0_GLS0_ISA1151_IU1_K1_LDSTI0_LBSPPA128_LBSPPB128_LBSPPM0_LPA8_LPB8_LPM0_LRVW16_LWPMn1_MIAV1_MIWT1_2_MO40_NTn1_NTA0_NTB0_NTC0_NTD0_NTM0_NEPBS0_NLCA1_NLCB1_ONLL1_PGR1_PLR1_PKA0_SIA1_SS1_SU32_SUM0_SUS256_SPO0_SRVW0_SSO0_SVW1_SK0_SKFTR0_SKXCCM0_SGRO0_TIN0_TLDS1_ULSGRO0_USL1_UIOFGRO0_USFGROn1_VSn1_VWA1_VWB1_WSGRA0_WSGRB0_WS32_WG32_4_1_WGM8_WGMXCC1_WGMXCCGn1
    SolutionIndex: 177
    SolutionNameMin: Cijk_Alik_Bljk_HHS_BH_Bias_HA_S_SAV_UserArgs_MT128x64x32_MI16x16x1_SN_LDSB0_AFC1_AG0_AFEM1_AFEM1_ASEM1_CLR0_CADS0_DTLA0_DTLB0_DTVA0_DTVB0_EPS0_ELFLR0_EMLLn1_FDSI0_GRPM1_GRVWA8_GRVWB8_GSU1_GSUAMB_GSUC0_GSUWGMRR0_GLS0_ISA1151_IU1_K1_LDSTI0_LBSPPA128_LBSPPB128_LBSPPM0_LPA8_LPB8_LPM0_LRVW16_LWPMn1_MIAV1_MIWT2_4_MO40_NTn1_NTA0_NTB0_NTC0_NTD0_NTM0_NEPBS0_NLCA1_NLCB1_ONLL1_PGR2_PLR1_PKA0_SIA3_SS1_SU32_SUM0_SUS256_SPO0_SRVW0_SSO0_SVW1_SK0_SKFTR0_SKXCCM0_SGRO0_TIN0_TLDS1_ULSGRO0_USL1_UIOFGRO0_USFGROn1_VSn1_VWA1_VWB1_WSGRA0_WSGRB0_WS32_WG64_2_1_WGM8_WGMXCC1_WGMXCCGn1
    SolutionIndex: 178
    SolutionNameMin: Cijk_Alik_Bljk_HHS_BH_Bias_HA_S_SAV_UserArgs_MT64x128x32_MI16x16x1_SN_LDSB0_AFC1_AG0_AFEM1_AFEM1_ASEM1_CLR0_CADS0_DTLA0_DTLB0_DTVA0_DTVB0_EPS0_ELFLR0_EMLLn1_FDSI0_GRPM1_GRVWA8_GRVWB8_GSU1_GSUAMB_GSUC0_GSUWGMRR0_GLS0_ISA1151_IU1_K1_LDSTI0_LBSPPA128_LBSPPB128_LBSPPM0_LPA8_LPB8_LPM0_LRVW16_LWPMn1_MIAV1_MIWT2_4_MO40_NTn1_NTA0_NTB0_NTC0_NTD0_NTM0_NEPBS0_NLCA1_NLCB1_ONLL1_PGR2_PLR1_PKA0_SIA3_SS1_SU32_SUM0_SUS256_SPO0_SRVW0_SSO0_SVW1_SK0_SKFTR0_SKXCCM0_SGRO0_TIN0_TLDS1_ULSGRO0_USL1_UIOFGRO0_USFGROn1_VSn1_VWA1_VWB1_WSGRA0_WSGRB0_WS32_WG32_4_1_WGM8_WGMXCC1_WGMXCCGn1
    SolutionIndex: 179
    SolutionNameMin: Cijk_Alik_Bljk_HHS_BH_Bias_HA_S_SAV_UserArgs_MT32x64x128_MI16x16x1_SN_LDSB0_AFC1_AG0_AFEM1_AFEM1_ASEM1_CLR0_CADS0_DTLA0_DTLB0_DTVA0_DTVB0_EPS0_ELFLR0_EMLLn1_FDSI0_GRPM1_GRVWA8_GRVWB8_GSU1_GSUAMB_GSUC0_GSUWGMRR0_GLS0_ISA1151_IU1_K1_LDSTI0_LBSPPA256_LBSPPB256_LBSPPM0_LPA8_LPB8_LPM0_LRVW16_LWPMn1_MIAV1_MIWT1_2_MO40_NTn1_NTA0_NTB0_NTC0_NTD0_NTM0_NEPBS0_NLCA1_NLCB1_ONLL1_PGR2_PLR1_PKA0_SIA1_SS1_SU32_SUM0_SUS256_SPO0_SRVW0_SSO0_SVW1_SK0_SKFTR0_SKXCCM0_SGRO0_TIN0_TLDS1_ULSGRO0_USL1_UIOFGRO0_USFGROn1_VSn1_VWA1_VWB1_WSGRA0_WSGRB0_WS32_WG32_4_1_WGM8_WGMXCC1_WGMXCCGn1
    SolutionIndex: 180
    SolutionNameMin: Cijk_Alik_Bljk_HHS_BH_Bias_HA_S_SAV_UserArgs_MT32x32x64_MI16x16x1_SN_LDSB0_AFC1_AG0_AFEM1_AFEM1_ASEM1_CLR0_CADS0_DTLA0_DTLB0_DTVA0_DTVB0_EPS0_ELFLR0_EMLLn1_FDSI0_GRPM1_GRVWA8_GRVWB8_GSU1_GSUAMB_GSUC0_GSUWGMRR0_GLS0_ISA1151_IU1_K1_LDSTI0_LBSPPA128_LBSPPB128_LBSPPM0_LPA8_LPB8_LPM0_LRVW16_LWPMn1_MIAV1_MIWT1_1_MO40_NTn1_NTA0_NTB0_NTC0_NTD0_NTM0_NEPBS0_NLCA1_NLCB1_ONLL1_PGR2_PLR1_PKA0_SIA3_SS1_SU32_SUM0_SUS256_SPO0_SRVW0_SSO0_SVW1_SK0_SKFTR0_SKXCCM0_SGRO0_TIN0_TLDS1_ULSGRO0_USL1_UIOFGRO0_USFGROn1_VSn1_VWA1_VWB1_WSGRA0_WSGRB0_WS32_WG32_4_1_WGM8_WGMXCC1_WGMXCCGn1
    SolutionIndex: 181
    SolutionNameMin: Cijk_Alik_Bljk_HHS_BH_Bias_HA_S_SAV_UserArgs_MT64x48x128_MI16x16x1_SN_LDSB0_AFC1_AG0_AFEM1_AFEM1_ASEM1_CLR0_CADS0_DTLA0_DTLB0_DTVA0_DTVB0_EPS0_ELFLR0_EMLLn1_FDSI0_GRPM1_GRVWA8_GRVWB8_GSU1_GSUAMB_GSUC0_GSUWGMRR0_GLS0_ISA1151_IU1_K1_LDSTI0_LBSPPA256_LBSPPB256_LBSPPM0_LPA8_LPB8_LPM0_LRVW16_LWPMn1_MIAV1_MIWT1_3_MO40_NTn1_NTA0_NTB0_NTC0_NTD0_NTM0_NEPBS0_NLCA1_NLCB1_ONLL1_PGR1_PLR1_PKA0_SIA1_SS1_SU32_SUM0_SUS256_SPO0_SRVW0_SSO0_SVW1_SK0_SKFTR0_SKXCCM0_SGRO0_TIN0_TLDS1_ULSGRO0_USL1_UIOFGRO0_USFGROn1_VSn1_VWA1_VWB1_WSGRA0_WSGRB0_WS32_WG64_2_1_WGM8_WGMXCC1_WGMXCCGn1
    SolutionIndex: 182
    SolutionNameMin: Cijk_Alik_Bljk_HHS_BH_Bias_HA_S_SAV_UserArgs_MT64x48x128_MI16x16x1_SN_LDSB0_AFC1_AG0_AFEM1_AFEM1_ASEM1_CLR0_CADS0_DTLA0_DTLB0_DTVA0_DTVB0_EPS0_ELFLR0_EMLLn1_FDSI0_GRPM1_GRVWA8_GRVWB8_GSU1_GSUAMB_GSUC0_GSUWGMRR0_GLS0_ISA1151_IU1_K1_LDSTI0_LBSPPA256_LBSPPB256_LBSPPM0_LPA8_LPB8_LPM0_LRVW16_LWPMn1_MIAV1_MIWT1_3_MO40_NTn1_NTA0_NTB0_NTC0_NTD0_NTM0_NEPBS0_NLCA1_NLCB1_ONLL1_PGR2_PLR1_PKA0_SIA1_SS1_SU32_SUM0_SUS256_SPO0_SRVW0_SSO0_SVW1_SK0_SKFTR0_SKXCCM0_SGRO0_TIN0_TLDS1_ULSGRO0_USL1_UIOFGRO0_USFGROn1_VSn1_VWA1_VWB1_WSGRA0_WSGRB0_WS32_WG64_2_1_WGM8_WGMXCC1_WGMXCCGn1
    SolutionIndex: 183
    SolutionNameMin: Cijk_Alik_Bljk_HHS_BH_Bias_HA_S_SAV_UserArgs_MT64x32x64_MI16x16x1_SN_LDSB0_AFC1_AG0_AFEM1_AFEM1_ASEM1_CLR0_CADS0_DTLA0_DTLB0_DTVA0_DTVB0_EPS0_ELFLR0_EMLLn1_FDSI0_GRPM1_GRVWA8_GRVWB8_GSU1_GSUAMB_GSUC0_GSUWGMRR0_GLS0_ISA1151_IU1_K1_LDSTI0_LBSPPA128_LBSPPB128_LBSPPM0_LPA8_LPB8_LPM0_LRVW16_LWPMn1_MIAV1_MIWT1_2_MO40_NTn1_NTA0_NTB0_NTC0_NTD0_NTM0_NEPBS0_NLCA1_NLCB1_ONLL1_PGR2_PLR1_PKA0_SIA1_SS1_SU32_SUM0_SUS256_SPO0_SRVW0_SSO0_SVW1_SK0_SKFTR0_SKXCCM0_SGRO0_TIN0_TLDS1_ULSGRO0_USL1_UIOFGRO0_USFGROn1_VSn1_VWA1_VWB1_WSGRA0_WSGRB0_WS32_WG64_2_1_WGM8_WGMXCC1_WGMXCCGn1
    SolutionIndex: 184
    SolutionNameMin: Cijk_Alik_Bljk_HHS_BH_Bias_HA_S_SAV_UserArgs_MT64x96x32_MI16x16x1_SN_LDSB0_AFC1_AG0_AFEM1_AFEM1_ASEM1_CLR0_CADS0_DTLA0_DTLB0_DTVA0_DTVB0_EPS0_ELFLR0_EMLLn1_FDSI0_GRPM1_GRVWA8_GRVWB8_GSU1_GSUAMB_GSUC0_GSUWGMRR0_GLS0_ISA1151_IU1_K1_LDSTI0_LBSPPA128_LBSPPB128_LBSPPM0_LPA8_LPB8_LPM0_LRVW16_LWPMn1_MIAV1_MIWT2_3_MO40_NTn1_NTA0_NTB0_NTC0_NTD0_NTM0_NEPBS0_NLCA1_NLCB1_ONLL1_PGR2_PLR0_PKA0_SIA1_SS1_SU32_SUM0_SUS256_SPO0_SRVW0_SSO0_SVW1_SK0_SKFTR0_SKXCCM0_SGRO0_TIN0_TLDS1_ULSGRO0_USL1_UIOFGRO0_USFGROn1_VSn1_VWA1_VWB1_WSGRA0_WSGRB0_WS32_WG32_4_1_WGM8_WGMXCC1_WGMXCCGn1
    SolutionIndex: 185
    SolutionNameMin: Cijk_Alik_Bljk_HHS_BH_Bias_HA_S_SAV_UserArgs_MT64x32x128_MI16x16x1_SN_LDSB0_AFC1_AG0_AFEM1_AFEM1_ASEM1_CLR0_CADS0_DTLA0_DTLB0_DTVA0_DTVB0_EPS0_ELFLR0_EMLLn1_FDSI0_GRPM1_GRVWA8_GRVWB8_GSU1_GSUAMB_GSUC0_GSUWGMRR0_GLS0_ISA1151_IU1_K1_LDSTI0_LBSPPA256_LBSPPB256_LBSPPM0_LPA8_LPB8_LPM0_LRVW16_LWPMn1_MIAV1_MIWT1_2_MO40_NTn1_NTA0_NTB0_NTC0_NTD0_NTM0_NEPBS0_NLCA1_NLCB1_ONLL1_PGR2_PLR1_PKA0_SIA1_SS1_SU32_SUM0_SUS256_SPO0_SRVW0_SSO0_SVW1_SK0_SKFTR0_SKXCCM0_SGRO0_TIN0_TLDS1_ULSGRO0_USL1_UIOFGRO0_USFGROn1_VSn1_VWA1_VWB1_WSGRA0_WSGRB0_WS32_WG64_2_1_WGM8_WGMXCC1_WGMXCCGn1
    SolutionIndex: 187
    SolutionNameMin: Cijk_Alik_Bljk_HHS_BH_Bias_HA_S_SAV_UserArgs_MT128x48x32_MI16x16x1_SN_LDSB0_AFC1_AG0_AFEM1_AFEM1_ASEM1_CLR0_CADS0_DTLA0_DTLB0_DTVA0_DTVB0_EPS0_ELFLR0_EMLLn1_FDSI0_GRPM1_GRVWA8_GRVWB4_GSU1_GSUAMB_GSUC0_GSUWGMRR0_GLS0_ISA1151_IU1_K1_LDSTI0_LBSPPA128_LBSPPB128_LBSPPM0_LPA8_LPB8_LPM0_LRVW16_LWPMn1_MIAV1_MIWT2_3_MO40_NTn1_NTA0_NTB0_NTC0_NTD0_NTM0_NEPBS0_NLCA1_NLCB1_ONLL1_PGR2_PLR1_PKA0_SIA1_SS1_SU32_SUM0_SUS256_SPO0_SRVW0_SSO0_SVW1_SK0_SKFTR0_SKXCCM0_SGRO0_TIN0_TLDS1_ULSGRO0_USL1_UIOFGRO0_USFGROn1_VSn1_VWA1_VWB1_WSGRA0_WSGRB0_WS32_WG64_2_1_WGM8_WGMXCC1_WGMXCCGn1
    SolutionIndex: 188
    SolutionNameMin: Cijk_Alik_Bljk_HHS_BH_Bias_HA_S_SAV_UserArgs_MT128x64x32_MI16x16x1_SN_LDSB0_AFC1_AG0_AFEM1_AFEM1_ASEM1_CLR0_CADS0_DTLA0_DTLB0_DTVA0_DTVB0_EPS0_ELFLR0_EMLLn1_FDSI0_GRPM1_GRVWA8_GRVWB8_GSU1_GSUAMB_GSUC0_GSUWGMRR0_GLS0_ISA1151_IU1_K1_LDSTI0_LBSPPA128_LBSPPB128_LBSPPM0_LPA8_LPB8_LPM0_LRVW16_LWPMn1_MIAV1_MIWT2_4_MO40_NTn1_NTA0_NTB0_NTC0_NTD0_NTM0_NEPBS0_NLCA1_NLCB1_ONLL1_PGR1_PLR0_PKA0_SIA3_SS1_SU32_SUM0_SUS256_SPO0_SRVW0_SSO0_SVW1_SK0_SKFTR0_SKXCCM0_SGRO0_TIN0_TLDS1_ULSGRO0_USL1_UIOFGRO0_USFGROn1_VSn1_VWA1_VWB1_WSGRA0_WSGRB0_WS32_WG64_2_1_WGM8_WGMXCC1_WGMXCCGn1
    SolutionIndex: 189
    SolutionNameMin: Cijk_Alik_Bljk_HHS_BH_Bias_HA_S_SAV_UserArgs_MT128x96x32_MI16x16x1_SN_LDSB0_AFC1_AG0_AFEM1_AFEM1_ASEM1_CLR0_CADS0_DTLA0_DTLB0_DTVA0_DTVB0_EPS0_ELFLR0_EMLLn1_FDSI0_GRPM1_GRVWA8_GRVWB8_GSU1_GSUAMB_GSUC0_GSUWGMRR0_GLS0_ISA1151_IU1_K1_LDSTI0_LBSPPA128_LBSPPB128_LBSPPM0_LPA8_LPB8_LPM0_LRVW16_LWPMn1_MIAV1_MIWT4_3_MO40_NTn1_NTA0_NTB0_NTC0_NTD0_NTM0_NEPBS0_NLCA1_NLCB1_ONLL1_PGR2_PLR0_PKA0_SIA1_SS1_SU32_SUM0_SUS256_SPO0_SRVW0_SSO0_SVW1_SK0_SKFTR0_SKXCCM0_SGRO0_TIN0_TLDS1_ULSGRO0_USL1_UIOFGRO0_USFGROn1_VSn1_VWA1_VWB1_WSGRA0_WSGRB0_WS32_WG32_4_1_WGM8_WGMXCC1_WGMXCCGn1
    SolutionIndex: 193
    SolutionNameMin: Cijk_Alik_Bljk_HHS_BH_Bias_HA_S_SAV_UserArgs_MT128x64x64_MI16x16x1_SN_LDSB0_AFC1_AG0_AFEM1_AFEM1_ASEM1_CLR0_CADS0_DTLA0_DTLB0_DTVA0_DTVB0_EPS0_ELFLR0_EMLLn1_FDSI0_GRPM1_GRVWA8_GRVWB8_GSU1_GSUAMB_GSUC0_GSUWGMRR0_GLS0_ISA1151_IU1_K1_LDSTI0_LBSPPA128_LBSPPB128_LBSPPM0_LPA8_LPB8_LPM0_LRVW16_LWPMn1_MIAV1_MIWT4_2_MO40_NTn1_NTA0_NTB0_NTC0_NTD0_NTM0_NEPBS0_NLCA1_NLCB1_ONLL1_PGR0_PLR0_PKA0_SIA3_SS1_SU32_SUM0_SUS256_SPO0_SRVW0_SSO0_SVW1_SK0_SKFTR0_SKXCCM0_SGRO0_TIN0_TLDS1_ULSGRO0_USL1_UIOFGRO0_USFGROn1_VSn1_VWA1_VWB1_WSGRA0_WSGRB0_WS32_WG32_4_1_WGM8_WGMXCC1_WGMXCCGn1
    SolutionIndex: 194
    SolutionNameMin: Cijk_Alik_Bljk_HHS_BH_Bias_HA_S_SAV_UserArgs_MT128x64x32_MI16x16x1_SN_LDSB0_AFC1_AG0_AFEM1_AFEM1_ASEM1_CLR0_CADS0_DTLA0_DTLB0_DTVA0_DTVB0_EPS0_ELFLR0_EMLLn1_FDSI0_GRPM1_GRVWA8_GRVWB8_GSU1_GSUAMB_GSUC0_GSUWGMRR0_GLS0_ISA1151_IU1_K1_LDSTI0_LBSPPA128_LBSPPB128_LBSPPM0_LPA8_LPB8_LPM0_LRVW16_LWPMn1_MIAV1_MIWT4_2_MO40_NTn1_NTA0_NTB0_NTC0_NTD0_NTM0_NEPBS0_NLCA1_NLCB1_ONLL1_PGR2_PLR1_PKA0_SIA3_SS1_SU32_SUM0_SUS256_SPO0_SRVW0_SSO0_SVW1_SK0_SKFTR0_SKXCCM0_SGRO0_TIN0_TLDS1_ULSGRO0_USL1_UIOFGRO0_USFGROn1_VSn1_VWA1_VWB1_WSGRA0_WSGRB0_WS32_WG32_4_1_WGM8_WGMXCC1_WGMXCCGn1
    SolutionIndex: 195
    SolutionNameMin: Cijk_Alik_Bljk_HHS_BH_Bias_HA_S_SAV_UserArgs_MT128x64x64_MI16x16x1_SN_LDSB1_AFC1_AG0_AFEM1_AFEM1_ASEM1_CLR0_CADS0_DTLA0_DTLB0_DTVA0_DTVB0_EPS0_ELFLR0_EMLLn1_FDSI0_GRPM1_GRVWA8_GRVWB8_GSU1_GSUAMB_GSUC0_GSUWGMRR0_GLS0_ISA1151_IU1_K1_LDSTI0_LBSPPA128_LBSPPB128_LBSPPM0_LPA8_LPB8_LPM0_LRVW16_LWPMn1_MIAV1_MIWT2_4_MO40_NTn1_NTA0_NTB0_NTC0_NTD0_NTM0_NEPBS0_NLCA1_NLCB1_ONLL1_PGR2_PLR1_PKA0_SIA3_SS1_SU32_SUM0_SUS256_SPO0_SRVW0_SSO0_SVW1_SK0_SKFTR0_SKXCCM0_SGRO0_TIN0_TLDS1_ULSGRO0_USL1_UIOFGRO0_USFGROn1_VSn1_VWA1_VWB1_WSGRA0_WSGRB0_WS32_WG64_2_1_WGM8_WGMXCC1_WGMXCCGn1
    SolutionIndex: 198
    SolutionNameMin: Cijk_Alik_Bljk_HHS_BH_Bias_HA_S_SAV_UserArgs_MT128x96x32_MI16x16x1_SN_LDSB1_AFC1_AG0_AFEM1_AFEM1_ASEM1_CLR0_CADS0_DTLA0_DTLB0_DTVA0_DTVB0_EPS0_ELFLR0_EMLLn1_FDSI0_GRPM1_GRVWA8_GRVWB8_GSU1_GSUAMB_GSUC0_GSUWGMRR0_GLS0_ISA1151_IU1_K1_LDSTI0_LBSPPA128_LBSPPB128_LBSPPM0_LPA8_LPB8_LPM0_LRVW16_LWPMn1_MIAV1_MIWT4_3_MO40_NTn1_NTA0_NTB0_NTC0_NTD0_NTM0_NEPBS0_NLCA1_NLCB1_ONLL1_PGR1_PLR1_PKA0_SIA3_SS1_SU32_SUM0_SUS256_SPO0_SRVW0_SSO0_SVW1_SK0_SKFTR0_SKXCCM0_SGRO0_TIN0_TLDS1_ULSGRO0_USL1_UIOFGRO0_USFGROn1_VSn1_VWA1_VWB1_WSGRA0_WSGRB0_WS32_WG32_4_1_WGM8_WGMXCC1_WGMXCCGn1
    SolutionIndex: 199
    SolutionNameMin: Cijk_Alik_Bljk_HHS_BH_Bias_HA_S_SAV_UserArgs_MT128x96x32_MI16x16x1_SN_LDSB1_AFC1_AG0_AFEM1_AFEM1_ASEM1_CLR0_CADS0_DTLA0_DTLB0_DTVA0_DTVB0_EPS0_ELFLR0_EMLLn1_FDSI0_GRPM1_GRVWA8_GRVWB8_GSU1_GSUAMB_GSUC0_GSUWGMRR0_GLS0_ISA1151_IU1_K1_LDSTI0_LBSPPA128_LBSPPB128_LBSPPM0_LPA8_LPB8_LPM0_LRVW16_LWPMn1_MIAV1_MIWT4_3_MO40_NTn1_NTA0_NTB0_NTC0_NTD0_NTM0_NEPBS0_NLCA1_NLCB1_ONLL1_PGR2_PLR1_PKA0_SIA3_SS1_SU32_SUM0_SUS256_SPO0_SRVW0_SSO0_SVW1_SK0_SKFTR0_SKXCCM0_SGRO0_TIN0_TLDS1_ULSGRO0_USL1_UIOFGRO0_USFGROn1_VSn1_VWA1_VWB1_WSGRA0_WSGRB0_WS32_WG32_4_1_WGM8_WGMXCC1_WGMXCCGn1
    SolutionIndex: 201
    SolutionNameMin: Cijk_Alik_Bljk_HHS_BH_Bias_HA_S_SAV_UserArgs_MT128x96x32_MI16x16x1_SN_LDSB0_AFC1_AG0_AFEM1_AFEM1_ASEM1_CLR0_CADS0_DTLA0_DTLB0_DTVA0_DTVB0_EPS0_ELFLR0_EMLLn1_FDSI0_GRPM1_GRVWA8_GRVWB8_GSU1_GSUAMB_GSUC0_GSUWGMRR0_GLS0_ISA1151_IU1_K1_LDSTI0_LBSPPA128_LBSPPB128_LBSPPM0_LPA8_LPB8_LPM0_LRVW16_LWPMn1_MIAV1_MIWT4_3_MO40_NTn1_NTA0_NTB0_NTC0_NTD0_NTM0_NEPBS0_NLCA1_NLCB1_ONLL1_PGR2_PLR1_PKA0_SIA3_SS1_SU32_SUM0_SUS256_SPO0_SRVW0_SSO0_SVW1_SK0_SKFTR0_SKXCCM0_SGRO0_TIN0_TLDS1_ULSGRO0_USL1_UIOFGRO0_USFGROn1_VSn1_VWA1_VWB1_WSGRA0_WSGRB0_WS32_WG32_4_1_WGM8_WGMXCC1_WGMXCCGn1
    SolutionIndex: 202
    SolutionNameMin: Cijk_Alik_Bljk_HHS_BH_Bias_HA_S_SAV_UserArgs_MT128x64x64_MI16x16x1_SN_LDSB1_AFC1_AG0_AFEM1_AFEM1_ASEM1_CLR0_CADS0_DTLA0_DTLB0_DTVA0_DTVB0_EPS0_ELFLR0_EMLLn1_FDSI0_GRPM1_GRVWA8_GRVWB8_GSU1_GSUAMB_GSUC0_GSUWGMRR0_GLS0_ISA1151_IU1_K1_LDSTI0_LBSPPA128_LBSPPB128_LBSPPM0_LPA8_LPB8_LPM0_LRVW16_LWPMn1_MIAV1_MIWT2_4_MO40_NTn1_NTA0_NTB0_NTC0_NTD0_NTM0_NEPBS0_NLCA1_NLCB1_ONLL1_PGR1_PLR1_PKA0_SIA3_SS1_SU32_SUM0_SUS256_SPO0_SRVW0_SSO0_SVW1_SK0_SKFTR0_SKXCCM0_SGRO0_TIN0_TLDS1_ULSGRO0_USL1_UIOFGRO0_USFGROn1_VSn1_VWA1_VWB1_WSGRA0_WSGRB0_WS32_WG64_2_1_WGM8_WGMXCC1_WGMXCCGn1
    SolutionIndex: 203
    SolutionNameMin: Cijk_Alik_Bljk_HHS_BH_Bias_HA_S_SAV_UserArgs_MT128x64x64_MI16x16x1_SN_LDSB1_AFC1_AG0_AFEM1_AFEM1_ASEM1_CLR0_CADS0_DTLA0_DTLB0_DTVA0_DTVB0_EPS0_ELFLR0_EMLLn1_FDSI0_GRPM1_GRVWA8_GRVWB8_GSU1_GSUAMB_GSUC0_GSUWGMRR0_GLS0_ISA1151_IU1_K1_LDSTI0_LBSPPA128_LBSPPB128_LBSPPM0_LPA8_LPB8_LPM0_LRVW16_LWPMn1_MIAV1_MIWT4_2_MO40_NTn1_NTA0_NTB0_NTC0_NTD0_NTM0_NEPBS0_NLCA1_NLCB1_ONLL1_PGR1_PLR1_PKA0_SIA3_SS1_SU32_SUM0_SUS256_SPO0_SRVW0_SSO0_SVW1_SK0_SKFTR0_SKXCCM0_SGRO0_TIN0_TLDS1_ULSGRO0_USL1_UIOFGRO0_USFGROn1_VSn1_VWA1_VWB1_WSGRA0_WSGRB0_WS32_WG32_4_1_WGM8_WGMXCC1_WGMXCCGn1
    SolutionIndex: 204
    SolutionNameMin: Cijk_Alik_Bljk_HHS_BH_Bias_HA_S_SAV_UserArgs_MT128x128x32_MI16x16x1_SN_LDSB0_AFC1_AG0_AFEM1_AFEM1_ASEM1_CLR0_CADS0_DTLA0_DTLB0_DTVA0_DTVB0_EPS0_ELFLR0_EMLLn1_FDSI0_GRPM1_GRVWA8_GRVWB8_GSU1_GSUAMB_GSUC0_GSUWGMRR0_GLS0_ISA1151_IU1_K1_LDSTI0_LBSPPA128_LBSPPB128_LBSPPM0_LPA8_LPB8_LPM0_LRVW16_LWPMn1_MIAV1_MIWT8_2_MO40_NTn1_NTA0_NTB0_NTC0_NTD0_NTM0_NEPBS0_NLCA1_NLCB1_ONLL1_PGR2_PLR0_PKA0_SIA1_SS1_SU32_SUM0_SUS256_SPO0_SRVW0_SSO0_SVW1_SK0_SKFTR0_SKXCCM0_SGRO0_TIN0_TLDS1_ULSGRO0_USL1_UIOFGRO0_USFGROn1_VSn1_VWA1_VWB1_WSGRA0_WSGRB0_WS32_WG16_8_1_WGM8_WGMXCC1_WGMXCCGn1
    SolutionIndex: 209
    SolutionNameMin: Cijk_Alik_Bljk_HHS_BH_Bias_HA_S_SAV_UserArgs_MT16x64x64_MI16x16x1_SN_LDSB0_AFC1_AG0_AFEM1_AFEM1_ASEM1_CLR0_CADS0_DTLA0_DTLB0_DTVA0_DTVB0_EPS0_ELFLR0_EMLLn1_FDSI0_GRPM1_GRVWA8_GRVWB8_GSU1_GSUAMB_GSUC0_GSUWGMRR0_GLS0_ISA1151_IU1_K1_LDSTI0_LBSPPA128_LBSPPB128_LBSPPM0_LPA8_LPB8_LPM0_LRVW16_LWPMn1_MIAV1_MIWT1_1_MO40_NTn1_NTA0_NTB0_NTC0_NTD0_NTM0_NEPBS0_NLCA1_NLCB1_ONLL1_PGR2_PLR1_PKA0_SIA1_SS1_SU32_SUM0_SUS256_SPO0_SRVW0_SSO0_SVW1_SK0_SKFTR0_SKXCCM0_SGRO0_TIN0_TLDS1_ULSGRO0_USL1_UIOFGRO0_USFGROn1_VSn1_VWA1_VWB1_WSGRA0_WSGRB0_WS32_WG16_8_1_WGM8_WGMXCC1_WGMXCCGn1
    SolutionIndex: 220
    SolutionNameMin: Cijk_Alik_Bljk_HHS_BH_Bias_HA_S_SAV_UserArgs_MT48x64x128_MI16x16x1_SN_LDSB0_AFC1_AG0_AFEM1_AFEM1_ASEM1_CLR0_CADS0_DTLA0_DTLB0_DTVA0_DTVB0_EPS0_ELFLR0_EMLLn1_FDSI0_GRPM1_GRVWA8_GRVWB8_GSU1_GSUAMB_GSUC0_GSUWGMRR0_GLS0_ISA1151_IU1_K1_LDSTI0_LBSPPA256_LBSPPB256_LBSPPM0_LPA8_LPB8_LPM0_LRVW16_LWPMn1_MIAV1_MIWT3_1_MO40_NTn1_NTA0_NTB0_NTC0_NTD0_NTM0_NEPBS0_NLCA1_NLCB1_ONLL1_PGR1_PLR1_PKA0_SIA1_SS1_SU32_SUM0_SUS256_SPO0_SRVW0_SSO0_SVW1_SK0_SKFTR0_SKXCCM0_SGRO0_TIN0_TLDS1_ULSGRO0_USL1_UIOFGRO0_USFGROn1_VSn1_VWA1_VWB1_WSGRA0_WSGRB0_WS32_WG16_8_1_WGM8_WGMXCC1_WGMXCCGn1
    SolutionIndex: 223
    SolutionNameMin: Cijk_Alik_Bljk_HHS_BH_Bias_HA_S_SAV_UserArgs_MT32x64x128_MI16x16x1_SN_LDSB0_AFC1_AG0_AFEM1_AFEM1_ASEM1_CLR0_CADS0_DTLA0_DTLB0_DTVA0_DTVB0_EPS0_ELFLR0_EMLLn1_FDSI0_GRPM1_GRVWA8_GRVWB8_GSU1_GSUAMB_GSUC0_GSUWGMRR0_GLS0_ISA1151_IU1_K1_LDSTI0_LBSPPA256_LBSPPB256_LBSPPM0_LPA8_LPB8_LPM0_LRVW16_LWPMn1_MIAV1_MIWT1_2_MO40_NTn1_NTA0_NTB0_NTC0_NTD0_NTM0_NEPBS0_NLCA1_NLCB1_ONLL1_PGR1_PLR1_PKA0_SIA1_SS1_SU32_SUM0_SUS256_SPO0_SRVW0_SSO0_SVW1_SK0_SKFTR0_SKXCCM0_SGRO0_TIN0_TLDS1_ULSGRO0_USL1_UIOFGRO0_USFGROn1_VSn1_VWA1_VWB1_WSGRA0_WSGRB0_WS32_WG32_4_1_WGM8_WGMXCC1_WGMXCCGn1
    SolutionIndex: 225
    SolutionNameMin: Cijk_Alik_Bljk_HHS_BH_Bias_HA_S_SAV_UserArgs_MT64x64x32_MI16x16x1_SN_LDSB0_AFC1_AG0_AFEM1_AFEM1_ASEM1_CLR0_CADS0_DTLA0_DTLB0_DTVA0_DTVB0_EPS0_ELFLR0_EMLLn1_FDSI0_GRPM1_GRVWA8_GRVWB8_GSU1_GSUAMB_GSUC0_GSUWGMRR0_GLS0_ISA1151_IU1_K1_LDSTI0_LBSPPA128_LBSPPB128_LBSPPM0_LPA8_LPB8_LPM0_LRVW16_LWPMn1_MIAV1_MIWT2_2_MO40_NTn1_NTA0_NTB0_NTC0_NTD0_NTM0_NEPBS0_NLCA1_NLCB1_ONLL1_PGR1_PLR1_PKA0_SIA3_SS1_SU32_SUM0_SUS256_SPO0_SRVW0_SSO0_SVW1_SK0_SKFTR0_SKXCCM0_SGRO0_TIN0_TLDS1_ULSGRO0_USL1_UIOFGRO0_USFGROn1_VSn1_VWA1_VWB1_WSGRA0_WSGRB0_WS32_WG32_4_1_WGM8_WGMXCC1_WGMXCCGn1
    SolutionIndex: 229
    SolutionNameMin: Cijk_Alik_Bljk_HHS_BH_Bias_HA_S_SAV_UserArgs_MT64x192x32_MI16x16x1_CMS_SN_LDSB1_AFC1_AG0_AFEM1_AFEM1_ASEM1_CLR1_CADS0_DTLA0_DTLB0_DTVA0_DTVB0_EPS0_ELFLR0_EMLLn1_FDSI0_GRPM1_GRVWA2_GRVWB8_GSU1_GSUAMB_GSUC0_GSUWGMRR0_GLS0_ISA1151_IU1_K1_LDSTI0_LBSPPA128_LBSPPB128_LBSPPM0_LPA16_LPB16_LPM0_LRVW16_LWPMn1_MIAV1_MIWT4_3_MO40_NTn1_NTA0_NTB0_NTC0_NTD0_NTM0_NEPBS0_NLCA1_NLCB1_ONLL1_PGR2_PLR1_PKA0_SIA3_SS1_SU32_SUM0_SUS256_SPO0_SRVW0_SSO0_SVW1_SK0_SKFTR0_SKXCCM0_SGRO0_TIN0_TLDS1_ULSGRO0_USL1_UIOFGRO0_USFGROn1_VSn1_VWA1_VWB1_WSGRA0_WSGRB0_WS32_WG16_8_1_WGM8_WGMXCC1_WGMXCCGn1
    SolutionIndex: 230
    SolutionNameMin: Cijk_Alik_Bljk_HHS_BH_Bias_HA_S_SAV_UserArgs_MT64x192x32_MI16x16x1_CMS_SN_LDSB1_AFC1_AG0_AFEM1_AFEM1_ASEM1_CLR1_CADS0_DTLA0_DTLB0_DTVA0_DTVB0_EPS0_ELFLR0_EMLLn1_FDSI0_GRPM1_GRVWA2_GRVWB8_GSU1_GSUAMB_GSUC0_GSUWGMRR0_GLS0_ISA1151_IU1_K1_LDSTI0_LBSPPA128_LBSPPB128_LBSPPM0_LPA16_LPB16_LPM0_LRVW16_LWPMn1_MIAV1_MIWT4_3_MO40_NTn1_NTA0_NTB0_NTC0_NTD0_NTM0_NEPBS0_NLCA1_NLCB1_ONLL1_PGR1_PLR1_PKA0_SIA3_SS1_SU32_SUM0_SUS256_SPO0_SRVW0_SSO0_SVW1_SK0_SKFTR0_SKXCCM0_SGRO0_TIN0_TLDS1_ULSGRO0_USL1_UIOFGRO0_USFGROn1_VSn1_VWA1_VWB1_WSGRA0_WSGRB0_WS32_WG16_8_1_WGM8_WGMXCC1_WGMXCCGn1
    SolutionIndex: 232
    SolutionNameMin: Cijk_Alik_Bljk_HHS_BH_Bias_HA_S_SAV_UserArgs_MT64x160x32_MI16x16x1_CMS_SN_LDSB1_AFC1_AG0_AFEM1_AFEM1_ASEM1_CLR1_CADS0_DTLA0_DTLB0_DTVA0_DTVB0_EPS0_ELFLR0_EMLLn1_FDSI0_GRPM1_GRVWA1_GRVWB8_GSU1_GSUAMB_GSUC0_GSUWGMRR0_GLS0_ISA1151_IU1_LDSTI0_LBSPPA128_LBSPPB128_LBSPPM0_LPA16_LPB16_LPM0_LRVW16_LWPMn1_MIAV1_MIWT2_5_MO40_NTn1_NTA0_NTB0_NTC0_NTD0_NTM0_NEPBS0_NLCA1_NLCB1_ONLL1_PGR2_PLR1_PKA0_SIA3_SS1_SU32_SUM0_SUS256_SPO0_SRVW0_SSO0_SVW1_SK0_SKFTR0_SKXCCM0_SGRO0_TIN0_TLDS1_ULSGRO0_USL1_UIOFGRO0_USFGROn1_VSn1_VWA1_VWB1_WSGRA0_WSGRB0_WS32_WG32_4_1_WGM8_WGMXCC1_WGMXCCGn1
    SolutionIndex: 234
    SolutionNameMin: Cijk_Alik_Bljk_HHS_BH_Bias_HA_S_SAV_UserArgs_MT160x64x32_MI16x16x1_CMS_SN_LDSB1_AFC1_AG0_AFEM1_AFEM1_ASEM1_CLR1_CADS0_DTLA0_DTLB0_DTVA0_DTVB0_EPS0_ELFLR0_EMLLn1_FDSI0_GRPM1_GRVWA8_GRVWB8_GSU1_GSUAMB_GSUC0_GSUWGMRR0_GLS0_ISA1151_IU1_K1_LDSTI0_LBSPPA128_LBSPPB128_LBSPPM0_LPA16_LPB16_LPM0_LRVW16_LWPMn1_MIAV1_MIWT5_2_MO40_NTn1_NTA0_NTB0_NTC0_NTD0_NTM0_NEPBS0_NLCA1_NLCB1_ONLL1_PGR2_PLR1_PKA0_SIA3_SS1_SU32_SUM0_SUS256_SPO0_SRVW0_SSO0_SVW1_SK0_SKFTR0_SKXCCM0_SGRO0_TIN0_TLDS1_ULSGRO0_USL1_UIOFGRO0_USFGROn1_VSn1_VWA1_VWB1_WSGRA0_WSGRB0_WS32_WG32_4_1_WGM8_WGMXCC1_WGMXCCGn1
    SolutionIndex: 238
    SolutionNameMin: Cijk_Alik_Bljk_HHS_BH_Bias_HA_S_SAV_UserArgs_MT64x192x32_MI16x16x1_CMS_SN_LDSB0_AFC1_AG0_AFEM1_AFEM1_ASEM1_CLR1_CADS0_DTLA0_DTLB0_DTVA0_DTVB0_EPS0_ELFLR0_EMLLn1_FDSI0_GRPM1_GRVWA8_GRVWB2_GSU1_GSUAMB_GSUC0_GSUWGMRR0_GLS0_ISA1151_IU1_K1_LDSTI0_LBSPPA128_LBSPPB128_LBSPPM0_LPA16_LPB16_LPM0_LRVW16_LWPMn1_MIAV1_MIWT4_3_MO40_NTn1_NTA0_NTB0_NTC0_NTD0_NTM0_NEPBS0_NLCA1_NLCB1_ONLL1_PGR2_PLR1_PKA0_SIA3_SS1_SU32_SUM0_SUS256_SPO0_SRVW0_SSO0_SVW1_SK0_SKFTR0_SKXCCM0_SGRO0_TIN0_TLDS1_ULSGRO0_USL1_UIOFGRO0_USFGROn1_VSn1_VWA1_VWB1_WSGRA0_WSGRB0_WS32_WG16_8_1_WGM8_WGMXCC1_WGMXCCGn1
    SolutionIndex: 240
    SolutionNameMin: Cijk_Alik_Bljk_HHS_BH_Bias_HA_S_SAV_UserArgs_MT32x128x64_MI16x16x1_CMS_SN_LDSB1_AFC1_AG0_AFEM1_AFEM1_ASEM1_CLR1_CADS0_DTLA0_DTLB0_DTVA0_DTVB0_EPS0_ELFLR0_EMLLn1_FDSI0_GRPM1_GRVWA8_GRVWB8_GSU1_GSUAMB_GSUC0_GSUWGMRR0_GLS0_ISA1151_IU1_K1_LDSTI0_LBSPPA128_LBSPPB128_LBSPPM0_LPA16_LPB16_LPM0_LRVW16_LWPMn1_MIAV1_MIWT2_2_MO40_NTn1_NTA0_NTB0_NTC0_NTD0_NTM0_NEPBS0_NLCA1_NLCB1_ONLL1_PGR2_PLR1_PKA0_SIA3_SS1_SU32_SUM0_SUS256_SPO0_SRVW0_SSO0_SVW1_SK0_SKFTR0_SKXCCM0_SGRO0_TIN0_TLDS1_ULSGRO0_USL1_UIOFGRO0_USFGROn1_VSn1_VWA1_VWB1_WSGRA0_WSGRB0_WS32_WG16_8_1_WGM8_WGMXCC1_WGMXCCGn1
    SolutionIndex: 241
    SolutionNameMin: Cijk_Alik_Bljk_HHS_BH_Bias_HA_S_SAV_UserArgs_MT64x96x32_MI16x16x1_CMS_SN_LDSB0_AFC1_AG0_AFEM1_AFEM1_ASEM1_CLR1_CADS0_DTLA0_DTLB0_DTVA0_DTVB0_EPS0_ELFLR0_EMLLn1_FDSI0_GRPM1_GRVWA1_GRVWB8_GSU1_GSUAMB_GSUC0_GSUWGMRR0_GLS0_ISA1151_IU1_LDSTI0_LBSPPA128_LBSPPB128_LBSPPM0_LPA16_LPB16_LPM0_LRVW16_LWPMn1_MIAV1_MIWT2_3_MO40_NTn1_NTA0_NTB0_NTC0_NTD0_NTM0_NEPBS0_NLCA1_NLCB1_ONLL1_PGR2_PLR1_PKA0_SIA3_SS1_SU32_SUM0_SUS256_SPO0_SRVW0_SSO0_SVW1_SK0_SKFTR0_SKXCCM0_SGRO0_TIN0_TLDS1_ULSGRO0_USL1_UIOFGRO0_USFGROn1_VSn1_VWA1_VWB1_WSGRA0_WSGRB0_WS32_WG32_4_1_WGM8_WGMXCC1_WGMXCCGn1
    SolutionIndex: 242
    SolutionNameMin: Cijk_Alik_Bljk_HHS_BH_Bias_HA_S_SAV_UserArgs_MT96x128x32_MI16x16x1_CMS_SN_LDSB1_AFC1_AG0_AFEM1_AFEM1_ASEM1_CLR1_CADS0_DTLA0_DTLB0_DTVA0_DTVB0_EPS0_ELFLR0_EMLLn1_FDSI0_GRPM1_GRVWA2_GRVWB2_GSU1_GSUAMB_GSUC0_GSUWGMRR0_GLS0_ISA1151_IU1_K1_LDSTI0_LBSPPA128_LBSPPB128_LBSPPM0_LPA16_LPB16_LPM0_LRVW16_LWPMn1_MIAV1_MIWT3_4_MO40_NTn1_NTA0_NTB0_NTC0_NTD0_NTM0_NEPBS0_NLCA1_NLCB1_ONLL1_PGR1_PLR1_PKA0_SIA3_SS1_SU32_SUM0_SUS256_SPO0_SRVW0_SSO0_SVW1_SK0_SKFTR0_SKXCCM0_SGRO0_TIN0_TLDS1_ULSGRO0_USL1_UIOFGRO0_USFGROn1_VSn1_VWA1_VWB1_WSGRA0_WSGRB0_WS32_WG32_4_1_WGM8_WGMXCC1_WGMXCCGn1
    SolutionIndex: 244
    SolutionNameMin: Cijk_Alik_Bljk_HHS_BH_Bias_HA_S_SAV_UserArgs_MT64x192x32_MI16x16x1_CMS_SN_LDSB0_AFC1_AG0_AFEM1_AFEM1_ASEM1_CLR1_CADS0_DTLA0_DTLB0_DTVA0_DTVB0_EPS0_ELFLR0_EMLLn1_FDSI0_GRPM1_GRVWA8_GRVWB8_GSU1_GSUAMB_GSUC0_GSUWGMRR0_GLS0_ISA1151_IU1_K1_LDSTI0_LBSPPA128_LBSPPB128_LBSPPM0_LPA16_LPB16_LPM0_LRVW16_LWPMn1_MIAV1_MIWT4_3_MO40_NTn1_NTA0_NTB0_NTC0_NTD0_NTM0_NEPBS0_NLCA1_NLCB1_ONLL1_PGR2_PLR1_PKA0_SIA3_SS1_SU32_SUM0_SUS256_SPO0_SRVW0_SSO0_SVW1_SK0_SKFTR0_SKXCCM0_SGRO0_TIN0_TLDS1_ULSGRO0_USL1_UIOFGRO0_USFGROn1_VSn1_VWA1_VWB1_WSGRA0_WSGRB0_WS32_WG16_8_1_WGM8_WGMXCC1_WGMXCCGn1
    SolutionIndex: 245
    SolutionNameMin: Cijk_Alik_Bljk_HHS_BH_Bias_HA_S_SAV_UserArgs_MT64x64x64_MI16x16x1_CMS_SN_LDSB0_AFC1_AG0_AFEM1_AFEM1_ASEM1_CLR1_CADS0_DTLA0_DTLB0_DTVA0_DTVB0_EPS0_ELFLR0_EMLLn1_FDSI0_GRPM1_GRVWA8_GRVWB8_GSU1_GSUAMB_GSUC0_GSUWGMRR0_GLS0_ISA1151_IU1_K1_LDSTI0_LBSPPA128_LBSPPB128_LBSPPM0_LPA16_LPB16_LPM0_LRVW16_LWPMn1_MIAV1_MIWT2_2_MO40_NTn1_NTA0_NTB0_NTC0_NTD0_NTM0_NEPBS0_NLCA1_NLCB1_ONLL1_PGR2_PLR1_PKA0_SIA3_SS1_SU32_SUM0_SUS256_SPO0_SRVW0_SSO0_SVW1_SK0_SKFTR0_SKXCCM0_SGRO0_TIN0_TLDS1_ULSGRO0_USL1_UIOFGRO0_USFGROn1_VSn1_VWA1_VWB1_WSGRA0_WSGRB0_WS32_WG32_4_1_WGM8_WGMXCC1_WGMXCCGn1
    SolutionIndex: 246
    SolutionNameMin: Cijk_Alik_Bljk_HHS_BH_Bias_HA_S_SAV_UserArgs_MT96x128x32_MI16x16x1_CMS_SN_LDSB1_AFC1_AG0_AFEM1_AFEM1_ASEM1_CLR1_CADS0_DTLA0_DTLB0_DTVA0_DTVB0_EPS0_ELFLR0_EMLLn1_FDSI0_GRPM1_GRVWA8_GRVWB8_GSU1_GSUAMB_GSUC0_GSUWGMRR0_GLS0_ISA1151_IU1_K1_LDSTI0_LBSPPA128_LBSPPB128_LBSPPM0_LPA16_LPB16_LPM0_LRVW16_LWPMn1_MIAV1_MIWT3_4_MO40_NTn1_NTA0_NTB0_NTC0_NTD0_NTM0_NEPBS0_NLCA1_NLCB1_ONLL1_PGR1_PLR1_PKA0_SIA3_SS1_SU32_SUM0_SUS256_SPO0_SRVW0_SSO0_SVW1_SK0_SKFTR0_SKXCCM0_SGRO0_TIN0_TLDS1_ULSGRO0_USL1_UIOFGRO0_USFGROn1_VSn1_VWA1_VWB1_WSGRA0_WSGRB0_WS32_WG32_4_1_WGM8_WGMXCC1_WGMXCCGn1
    SolutionIndex: 248
    SolutionNameMin: Cijk_Alik_Bljk_HHS_BH_Bias_HA_S_SAV_UserArgs_MT192x64x32_MI16x16x1_CMS_SN_LDSB0_AFC1_AG0_AFEM1_AFEM1_ASEM1_CLR1_CADS0_DTLA0_DTLB0_DTVA0_DTVB0_EPS0_ELFLR0_EMLLn1_FDSI0_GRPM1_GRVWA8_GRVWB8_GSU1_GSUAMB_GSUC0_GSUWGMRR0_GLS0_ISA1151_IU1_K1_LDSTI0_LBSPPA128_LBSPPB128_LBSPPM0_LPA16_LPB16_LPM0_LRVW16_LWPMn1_MIAV1_MIWT3_4_MO40_NTn1_NTA0_NTB0_NTC0_NTD0_NTM0_NEPBS0_NLCA1_NLCB1_ONLL1_PGR2_PLR1_PKA0_SIA3_SS1_SU32_SUM0_SUS256_SPO0_SRVW0_SSO0_SVW1_SK0_SKFTR0_SKXCCM0_SGRO0_TIN0_TLDS1_ULSGRO0_USL1_UIOFGRO0_USFGROn1_VSn1_VWA1_VWB1_WSGRA0_WSGRB0_WS32_WG64_2_1_WGM8_WGMXCC1_WGMXCCGn1
    SolutionIndex: 250
    SolutionNameMin: Cijk_Alik_Bljk_HHS_BH_Bias_HA_S_SAV_UserArgs_MT96x128x32_MI16x16x1_CMS_SN_LDSB0_AFC1_AG0_AFEM1_AFEM1_ASEM1_CLR1_CADS0_DTLA0_DTLB0_DTVA0_DTVB0_EPS0_ELFLR0_EMLLn1_FDSI0_GRPM1_GRVWA8_GRVWB8_GSU1_GSUAMB_GSUC0_GSUWGMRR0_GLS0_ISA1151_IU1_K1_LDSTI0_LBSPPA128_LBSPPB128_LBSPPM0_LPA16_LPB16_LPM0_LRVW16_LWPMn1_MIAV1_MIWT3_4_MO40_NTn1_NTA0_NTB0_NTC0_NTD0_NTM0_NEPBS0_NLCA1_NLCB1_ONLL1_PGR2_PLR1_PKA0_SIA3_SS1_SU32_SUM0_SUS256_SPO0_SRVW0_SSO0_SVW1_SK0_SKFTR0_SKXCCM0_SGRO0_TIN0_TLDS1_ULSGRO0_USL1_UIOFGRO0_USFGROn1_VSn1_VWA1_VWB1_WSGRA0_WSGRB0_WS32_WG32_4_1_WGM8_WGMXCC1_WGMXCCGn1
    SolutionIndex: 251
    SolutionNameMin: Cijk_Alik_Bljk_HHS_BH_Bias_HA_S_SAV_UserArgs_MT96x128x32_MI16x16x1_CMS_SN_LDSB0_AFC1_AG0_AFEM1_AFEM1_ASEM1_CLR1_CADS0_DTLA0_DTLB0_DTVA0_DTVB0_EPS0_ELFLR0_EMLLn1_FDSI0_GRPM1_GRVWA2_GRVWB8_GSU1_GSUAMB_GSUC0_GSUWGMRR0_GLS0_ISA1151_IU1_K1_LDSTI0_LBSPPA128_LBSPPB128_LBSPPM0_LPA16_LPB16_LPM0_LRVW16_LWPMn1_MIAV1_MIWT3_4_MO40_NTn1_NTA0_NTB0_NTC0_NTD0_NTM0_NEPBS0_NLCA1_NLCB1_ONLL1_PGR2_PLR1_PKA0_SIA3_SS1_SU32_SUM0_SUS256_SPO0_SRVW0_SSO0_SVW1_SK0_SKFTR0_SKXCCM0_SGRO0_TIN0_TLDS1_ULSGRO0_USL1_UIOFGRO0_USFGROn1_VSn1_VWA1_VWB1_WSGRA0_WSGRB0_WS32_WG32_4_1_WGM8_WGMXCC1_WGMXCCGn1
    SolutionIndex: 252
    SolutionNameMin: Cijk_Alik_Bljk_HHS_BH_Bias_HA_S_SAV_UserArgs_MT96x128x32_MI16x16x1_CMS_SN_LDSB1_AFC1_AG0_AFEM1_AFEM1_ASEM1_CLR1_CADS0_DTLA0_DTLB0_DTVA0_DTVB0_EPS0_ELFLR0_EMLLn1_FDSI0_GRPM1_GRVWA2_GRVWB8_GSU1_GSUAMB_GSUC0_GSUWGMRR0_GLS0_ISA1151_IU1_K1_LDSTI0_LBSPPA128_LBSPPB128_LBSPPM0_LPA16_LPB16_LPM0_LRVW16_LWPMn1_MIAV1_MIWT3_4_MO40_NTn1_NTA0_NTB0_NTC0_NTD0_NTM0_NEPBS0_NLCA1_NLCB1_ONLL1_PGR1_PLR1_PKA0_SIA3_SS1_SU32_SUM0_SUS256_SPO0_SRVW0_SSO0_SVW1_SK0_SKFTR0_SKXCCM0_SGRO0_TIN0_TLDS1_ULSGRO0_USL1_UIOFGRO0_USFGROn1_VSn1_VWA1_VWB1_WSGRA0_WSGRB0_WS32_WG32_4_1_WGM8_WGMXCC1_WGMXCCGn1
    SolutionIndex: 253
    SolutionNameMin: Cijk_Alik_Bljk_HHS_BH_Bias_HA_S_SAV_UserArgs_MT64x96x32_MI16x16x1_CMS_SN_LDSB0_AFC1_AG0_AFEM1_AFEM1_ASEM1_CLR1_CADS0_DTLA0_DTLB0_DTVA0_DTVB0_EPS0_ELFLR0_EMLLn1_FDSI0_GRPM1_GRVWA1_GRVWB8_GSU4_GSUAMB_GSUC0_GSUWGMRR0_GLS0_ISA1151_IU1_LDSTI0_LBSPPA128_LBSPPB128_LBSPPM0_LPA16_LPB16_LPM0_LRVW16_LWPMn1_MIAV1_MIWT2_3_MO40_NTn1_NTA0_NTB0_NTC0_NTD0_NTM0_NEPBS0_NLCA1_NLCB1_ONLL1_PGR2_PLR1_PKA0_SIA3_SS1_SU32_SUM0_SUS256_SPO0_SRVW0_SSO0_SVW1_SK0_SKFTR0_SKXCCM0_SGRO0_TIN0_TLDS1_ULSGRO0_USL1_UIOFGRO0_USFGROn1_VSn1_VWA1_VWB1_WSGRA0_WSGRB0_WS32_WG32_4_1_WGM8_WGMXCC1_WGMXCCGn1
    SolutionIndex: 254
    SolutionNameMin: Cijk_Alik_Bljk_HHS_BH_Bias_HA_S_SAV_UserArgs_MT32x16x64_MI16x16x1_CMS_SN_LDSB1_AFC1_AG0_AFEM1_AFEM1_ASEM1_CLR1_CADS0_DTLA0_DTLB0_DTVA0_DTVB0_EPS0_ELFLR0_EMLLn1_FDSI0_GRPM1_GRVWA2_GRVWB8_GSU1_GSUAMB_GSUC0_GSUWGMRR0_GLS0_ISA1151_IU1_K1_LDSTI0_LBSPPA128_LBSPPB128_LBSPPM0_LPA16_LPB16_LPM0_LRVW16_LWPMn1_MIAV1_MIWT1_1_MO40_NTn1_NTA0_NTB0_NTC0_NTD0_NTM0_NEPBS0_NLCA1_NLCB1_ONLL1_PGR1_PLR1_PKA0_SIA3_SS1_SU32_SUM0_SUS256_SPO0_SRVW0_SSO0_SVW1_SK0_SKFTR0_SKXCCM0_SGRO0_TIN0_TLDS1_ULSGRO0_USL1_UIOFGRO0_USFGROn1_VSn1_VWA1_VWB1_WSGRA0_WSGRB0_WS32_WG32_2_1_WGM8_WGMXCC1_WGMXCCGn1
    SolutionIndex: 255
    SolutionNameMin: Cijk_Alik_Bljk_HHS_BH_Bias_HA_S_SAV_UserArgs_MT64x96x32_MI16x16x1_CMS_SN_LDSB0_AFC1_AG0_AFEM1_AFEM1_ASEM1_CLR1_CADS0_DTLA0_DTLB0_DTVA0_DTVB0_EPS0_ELFLR0_EMLLn1_FDSI0_GRPM1_GRVWA1_GRVWB8_GSU2_GSUAMB_GSUC0_GSUWGMRR0_GLS0_ISA1151_IU1_LDSTI0_LBSPPA128_LBSPPB128_LBSPPM0_LPA16_LPB16_LPM0_LRVW16_LWPMn1_MIAV1_MIWT2_3_MO40_NTn1_NTA0_NTB0_NTC0_NTD0_NTM0_NEPBS0_NLCA1_NLCB1_ONLL1_PGR2_PLR1_PKA0_SIA3_SS1_SU32_SUM0_SUS256_SPO0_SRVW0_SSO0_SVW1_SK0_SKFTR0_SKXCCM0_SGRO0_TIN0_TLDS1_ULSGRO0_USL1_UIOFGRO0_USFGROn1_VSn1_VWA1_VWB1_WSGRA0_WSGRB0_WS32_WG32_4_1_WGM8_WGMXCC1_WGMXCCGn1
    SolutionIndex: 256
    SolutionNameMin: Cijk_Alik_Bljk_HHS_BH_Bias_HA_S_SAV_UserArgs_MT64x160x32_MI16x16x1_CMS_SN_LDSB1_AFC1_AG0_AFEM1_AFEM1_ASEM1_CLR1_CADS0_DTLA0_DTLB0_DTVA0_DTVB0_EPS0_ELFLR0_EMLLn1_FDSI0_GRPM1_GRVWA1_GRVWB8_GSU2_GSUAMB_GSUC0_GSUWGMRR0_GLS0_ISA1151_IU1_LDSTI0_LBSPPA128_LBSPPB128_LBSPPM0_LPA16_LPB16_LPM0_LRVW16_LWPMn1_MIAV1_MIWT2_5_MO40_NTn1_NTA0_NTB0_NTC0_NTD0_NTM0_NEPBS0_NLCA1_NLCB1_ONLL1_PGR2_PLR1_PKA0_SIA3_SS1_SU32_SUM0_SUS256_SPO0_SRVW0_SSO0_SVW1_SK0_SKFTR0_SKXCCM0_SGRO0_TIN0_TLDS1_ULSGRO0_USL1_UIOFGRO0_USFGROn1_VSn1_VWA1_VWB1_WSGRA0_WSGRB0_WS32_WG32_4_1_WGM8_WGMXCC1_WGMXCCGn1
    SolutionIndex: 257
    SolutionNameMin: Cijk_Alik_Bljk_HHS_BH_Bias_HA_S_SAV_UserArgs_MT64x192x32_MI16x16x1_CMS_SN_LDSB1_AFC1_AG0_AFEM1_AFEM1_ASEM1_CLR1_CADS0_DTLA0_DTLB0_DTVA0_DTVB0_EPS0_ELFLR0_EMLLn1_FDSI0_GRPM1_GRVWA8_GRVWB8_GSU2_GSUAMB_GSUC0_GSUWGMRR0_GLS0_ISA1151_IU1_K1_LDSTI0_LBSPPA128_LBSPPB128_LBSPPM0_LPA16_LPB16_LPM0_LRVW16_LWPMn1_MIAV1_MIWT4_3_MO40_NTn1_NTA0_NTB0_NTC0_NTD0_NTM0_NEPBS0_NLCA1_NLCB1_ONLL1_PGR2_PLR1_PKA0_SIA3_SS1_SU32_SUM0_SUS256_SPO0_SRVW0_SSO0_SVW1_SK0_SKFTR0_SKXCCM0_SGRO0_TIN0_TLDS1_ULSGRO0_USL1_UIOFGRO0_USFGROn1_VSn1_VWA1_VWB1_WSGRA0_WSGRB0_WS32_WG16_8_1_WGM8_WGMXCC1_WGMXCCGn1
    SolutionIndex: 258
    SolutionNameMin: Cijk_Alik_Bljk_HHS_BH_Bias_HA_S_SAV_UserArgs_MT128x96x32_MI16x16x1_CMS_SN_LDSB0_AFC1_AG0_AFEM1_AFEM1_ASEM1_CLR1_CADS0_DTLA0_DTLB0_DTVA0_DTVB0_EPS0_ELFLR0_EMLLn1_FDSI0_GRPM1_GRVWA8_GRVWB8_GSU1_GSUAMB_GSUC0_GSUWGMRR0_GLS0_ISA1151_IU1_K1_LDSTI0_LBSPPA128_LBSPPB128_LBSPPM0_LPA16_LPB16_LPM0_LRVW16_LWPMn1_MIAV1_MIWT4_3_MO40_NTn1_NTA0_NTB0_NTC0_NTD0_NTM0_NEPBS0_NLCA1_NLCB1_ONLL1_PGR2_PLR1_PKA0_SIA3_SS1_SU32_SUM0_SUS256_SPO0_SRVW0_SSO0_SVW1_SK0_SKFTR0_SKXCCM0_SGRO0_TIN0_TLDS1_ULSGRO0_USL1_UIOFGRO0_USFGROn1_VSn1_VWA1_VWB1_WSGRA0_WSGRB0_WS32_WG32_4_1_WGM8_WGMXCC1_WGMXCCGn1
    SolutionIndex: 259
    SolutionNameMin: Cijk_Alik_Bljk_HHS_BH_Bias_HA_S_SAV_UserArgs_MT96x96x32_MI16x16x1_CMS_SN_LDSB0_AFC1_AG0_AFEM1_AFEM1_ASEM1_CLR1_CADS0_DTLA0_DTLB0_DTVA0_DTVB0_EPS0_ELFLR0_EMLLn1_FDSI0_GRPM1_GRVWA8_GRVWB8_GSU1_GSUAMB_GSUC0_GSUWGMRR0_GLS0_ISA1151_IU1_LDSTI0_LBSPPA128_LBSPPB128_LBSPPM0_LPA16_LPB16_LPM0_LRVW16_LWPMn1_MIAV1_MIWT3_3_MO40_NTn1_NTA0_NTB0_NTC0_NTD0_NTM0_NEPBS0_NLCA1_NLCB1_ONLL1_PGR2_PLR1_PKA0_SIA3_SS1_SU32_SUM0_SUS256_SPO0_SRVW0_SSO0_SVW1_SK0_SKFTR0_SKXCCM0_SGRO0_TIN0_TLDS1_ULSGRO0_USL1_UIOFGRO0_USFGROn1_VSn1_VWA1_VWB1_WSGRA0_WSGRB0_WS32_WG32_4_1_WGM8_WGMXCC1_WGMXCCGn1
    SolutionIndex: 267
    SolutionNameMin: Cijk_Alik_Bljk_HHS_BH_Bias_HA_S_SAV_UserArgs_MT96x128x32_MI16x16x1_CMS_SN_LDSB1_AFC1_AG0_AFEM1_AFEM1_ASEM1_CLR1_CADS0_DTLA0_DTLB0_DTVA0_DTVB0_EPS0_ELFLR0_EMLLn1_FDSI0_GRPM1_GRVWA8_GRVWB8_GSU2_GSUAMB_GSUC0_GSUWGMRR0_GLS0_ISA1151_IU1_K1_LDSTI0_LBSPPA128_LBSPPB128_LBSPPM0_LPA16_LPB16_LPM0_LRVW16_LWPMn1_MIAV1_MIWT3_4_MO40_NTn1_NTA0_NTB0_NTC0_NTD0_NTM0_NEPBS0_NLCA1_NLCB1_ONLL1_PGR2_PLR1_PKA0_SIA3_SS1_SU32_SUM0_SUS256_SPO0_SRVW0_SSO0_SVW1_SK0_SKFTR0_SKXCCM0_SGRO0_TIN0_TLDS1_ULSGRO0_USL1_UIOFGRO0_USFGROn1_VSn1_VWA1_VWB1_WSGRA0_WSGRB0_WS32_WG32_4_1_WGM8_WGMXCC1_WGMXCCGn1
    SolutionIndex: 268
    SolutionNameMin: Cijk_Alik_Bljk_HHS_BH_Bias_HA_S_SAV_UserArgs_MT64x160x32_MI16x16x1_CMS_SN_LDSB1_AFC1_AG0_AFEM1_AFEM1_ASEM1_CLR1_CADS0_DTLA0_DTLB0_DTVA0_DTVB0_EPS0_ELFLR0_EMLLn1_FDSI0_GRPM1_GRVWA1_GRVWB8_GSU4_GSUAMB_GSUC0_GSUWGMRR0_GLS0_ISA1151_IU1_LDSTI0_LBSPPA128_LBSPPB128_LBSPPM0_LPA16_LPB16_LPM0_LRVW16_LWPMn1_MIAV1_MIWT2_5_MO40_NTn1_NTA0_NTB0_NTC0_NTD0_NTM0_NEPBS0_NLCA1_NLCB1_ONLL1_PGR2_PLR1_PKA0_SIA3_SS1_SU32_SUM0_SUS256_SPO0_SRVW0_SSO0_SVW1_SK0_SKFTR0_SKXCCM0_SGRO0_TIN0_TLDS1_ULSGRO0_USL1_UIOFGRO0_USFGROn1_VSn1_VWA1_VWB1_WSGRA0_WSGRB0_WS32_WG32_4_1_WGM8_WGMXCC1_WGMXCCGn1
    SolutionIndex: 272
    SolutionNameMin: Cijk_Alik_Bljk_HHS_BH_Bias_HA_S_SAV_UserArgs_MT128x48x32_MI16x16x1_CMS_SN_LDSB0_AFC1_AG0_AFEM1_AFEM1_ASEM1_CLR1_CADS0_DTLA0_DTLB0_DTVA0_DTVB0_EPS0_ELFLR0_EMLLn1_FDSI0_GRPM1_GRVWA8_GRVWB2_GSU1_GSUAMB_GSUC0_GSUWGMRR0_GLS0_ISA1151_IU1_K1_LDSTI0_LBSPPA128_LBSPPB128_LBSPPM0_LPA16_LPB16_LPM0_LRVW16_LWPMn1_MIAV1_MIWT2_3_MO40_NTn1_NTA0_NTB0_NTC0_NTD0_NTM0_NEPBS0_NLCA1_NLCB1_ONLL1_PGR2_PLR1_PKA0_SIA3_SS1_SU32_SUM0_SUS256_SPO0_SRVW0_SSO0_SVW1_SK0_SKFTR0_SKXCCM0_SGRO0_TIN0_TLDS1_ULSGRO0_USL1_UIOFGRO0_USFGROn1_VSn1_VWA1_VWB1_WSGRA0_WSGRB0_WS32_WG64_2_1_WGM8_WGMXCC1_WGMXCCGn1
    SolutionIndex: 273
    SolutionNameMin: Cijk_Alik_Bljk_HHS_BH_Bias_HA_S_SAV_UserArgs_MT128x96x32_MI16x16x1_CMS_SN_LDSB0_AFC1_AG0_AFEM1_AFEM1_ASEM1_CLR1_CADS0_DTLA0_DTLB0_DTVA0_DTVB0_EPS0_ELFLR0_EMLLn1_FDSI0_GRPM1_GRVWA8_GRVWB1_GSU1_GSUAMB_GSUC0_GSUWGMRR0_GLS0_ISA1151_IU1_K1_LDSTI0_LBSPPA128_LBSPPB128_LBSPPM0_LPA16_LPB16_LPM0_LRVW16_LWPMn1_MIAV1_MIWT4_3_MO40_NTn1_NTA0_NTB0_NTC0_NTD0_NTM0_NEPBS0_NLCA1_NLCB1_ONLL1_PGR2_PLR1_PKA0_SIA3_SS1_SU32_SUM0_SUS256_SPO0_SRVW0_SSO0_SVW1_SK0_SKFTR0_SKXCCM0_SGRO0_TIN0_TLDS1_ULSGRO0_USL1_UIOFGRO0_USFGROn1_VSn1_VWA1_VWB1_WSGRA0_WSGRB0_WS32_WG32_4_1_WGM8_WGMXCC1_WGMXCCGn1
- - - [2048, 2048, 1, 2048]
    - [2, 42736.0]
  - - [3072, 3072, 1, 3072]
    - [204, 41504.7]
  - - [4096, 4096, 1, 4096]
    - [4, 36456.0]
  - - [3904, 2112, 1, 1024]
    - [105, 39546.3]
  - - [3392, 2368, 1, 1024]
    - [123, 40517.4]
  - - [3648, 2368, 1, 1024]
    - [146, 40764.0]
  - - [3904, 2368, 1, 1024]
    - [146, 40716.3]
  - - [3136, 2624, 1, 1024]
    - [105, 39747.0]
  - - [3392, 2624, 1, 1024]
    - [105, 39455.5]
  - - [3648, 2624, 1, 1024]
    - [3, 40842.0]
  - - [3904, 2624, 1, 1024]
    - [122, 39141.6]
  - - [2880, 2880, 1, 1024]
    - [3, 40158.2]
  - - [3136, 2880, 1, 1024]
    - [0, 39607.9]
  - - [3392, 2880, 1, 1024]
    - [37, 39617.5]
  - - [3648, 2880, 1, 1024]
    - [3, 40068.5]
  - - [3904, 2880, 1, 1024]
    - [37, 38896.5]
  - - [2624, 3136, 1, 1024]
    - [37, 39375.5]
  - - [2880, 3136, 1, 1024]
    - [146, 40563.3]
  - - [3136, 3136, 1, 1024]
    - [2, 39184.9]
  - - [3392, 3136, 1, 1024]
    - [146, 39323.5]
  - - [3648, 3136, 1, 1024]
    - [138, 39576.7]
  - - [3904, 3136, 1, 1024]
    - [0, 39300.2]
  - - [2368, 3392, 1, 1024]
    - [146, 40417.8]
  - - [2624, 3392, 1, 1024]
    - [105, 40150.8]
  - - [2880, 3392, 1, 1024]
    - [2, 39539.2]
  - - [3136, 3392, 1, 1024]
    - [146, 37821.6]
  - - [3392, 3392, 1, 1024]
    - [51, 38628.9]
  - - [3648, 3392, 1, 1024]
    - [2, 39596.9]
  - - [3904, 3392, 1, 1024]
    - [146, 39248.0]
  - - [2368, 3648, 1, 1024]
    - [37, 39314.6]
  - - [2624, 3648, 1, 1024]
    - [123, 41359.0]
  - - [2880, 3648, 1, 1024]
    - [3, 40751.5]
  - - [3136, 3648, 1, 1024]
    - [164, 38662.3]
  - - [3392, 3648, 1, 1024]
    - [146, 38749.2]
  - - [3648, 3648, 1, 1024]
    - [2, 39158.9]
  - - [3904, 3648, 1, 1024]
    - [2, 39468.5]
  - - [2112, 3904, 1, 1024]
    - [3, 39826.1]
  - - [2368, 3904, 1, 1024]
    - [3, 40197.6]
  - - [2624, 3904, 1, 1024]
    - [146, 39584.7]
  - - [2880, 3904, 1, 1024]
    - [146, 39769.8]
  - - [3136, 3904, 1, 1024]
    - [2, 38994.6]
  - - [3392, 3904, 1, 1024]
    - [2, 38966.0]
  - - [3648, 3904, 1, 1024]
    - [2, 38683.3]
  - - [3904, 3904, 1, 1024]
    - [146, 38299.4]
  - - [3648, 1088, 1, 2048]
    - [124, 42894.8]
  - - [3904, 1088, 1, 2048]
    - [119, 41033.0]
  - - [3136, 1344, 1, 2048]
    - [0, 43376.3]
  - - [3392, 1344, 1, 2048]
    - [2, 40505.5]
  - - [3648, 1344, 1, 2048]
    - [114, 41578.3]
  - - [3904, 1344, 1, 2048]
    - [0, 44130.6]
  - - [2624, 1600, 1, 2048]
    - [0, 41841.0]
  - - [2880, 1600, 1, 2048]
    - [2, 43190.8]
  - - [3136, 1600, 1, 2048]
    - [2, 41943.0]
  - - [3392, 1600, 1, 2048]
    - [37, 42101.9]
  - - [3648, 1600, 1, 2048]
    - [2, 41723.4]
  - - [3904, 1600, 1, 2048]
    - [37, 41266.5]
  - - [2112, 1856, 1, 2048]
    - [5, 42588.3]
  - - [2368, 1856, 1, 2048]
    - [119, 41865.0]
  - - [2624, 1856, 1, 2048]
    - [124, 40627.5]
  - - [2880, 1856, 1, 2048]
    - [5, 42513.1]
  - - [3136, 1856, 1, 2048]
    - [2, 40892.7]
  - - [3392, 1856, 1, 2048]
    - [0, 40866.2]
  - - [3648, 1856, 1, 2048]
    - [2, 40903.7]
  - - [3904, 1856, 1, 2048]
    - [0, 41393.2]
  - - [1856, 2112, 1, 2048]
    - [5, 42141.2]
  - - [2112, 2112, 1, 2048]
    - [5, 40782.1]
  - - [2368, 2112, 1, 2048]
    - [2, 41636.1]
  - - [2624, 2112, 1, 2048]
    - [0, 41881.1]
  - - [2880, 2112, 1, 2048]
    - [2, 42661.2]
  - - [3136, 2112, 1, 2048]
    - [111, 41672.4]
  - - [3392, 2112, 1, 2048]
    - [0, 42899.6]
  - - [3648, 2112, 1, 2048]
    - [0, 43053.1]
  - - [3904, 2112, 1, 2048]
    - [0, 42268.5]
  - - [1856, 2368, 1, 2048]
    - [124, 42861.8]
  - - [2112, 2368, 1, 2048]
    - [2, 41551.7]
  - - [2368, 2368, 1, 2048]
    - [2, 42454.7]
  - - [2624, 2368, 1, 2048]
    - [114, 40656.6]
  - - [2880, 2368, 1, 2048]
    - [114, 41692.6]
  - - [3136, 2368, 1, 2048]
    - [0, 41896.8]
  - - [3392, 2368, 1, 2048]
    - [2, 40667.6]
  - - [3648, 2368, 1, 2048]
    - [114, 41432.3]
  - - [3904, 2368, 1, 2048]
    - [124, 39985.4]
  - - [1600, 2624, 1, 2048]
    - [2, 43207.7]
  - - [1856, 2624, 1, 2048]
    - [114, 42084.6]
  - - [2112, 2624, 1, 2048]
    - [2, 42192.5]
  - - [2368, 2624, 1, 2048]
    - [114, 41791.5]
  - - [2624, 2624, 1, 2048]
    - [2, 42093.3]
  - - [2880, 2624, 1, 2048]
    - [2, 42114.2]
  - - [3136, 2624, 1, 2048]
    - [0, 39514.0]
  - - [3392, 2624, 1, 2048]
    - [0, 41240.8]
  - - [3648, 2624, 1, 2048]
    - [2, 40884.6]
  - - [3904, 2624, 1, 2048]
    - [2, 39251.5]
  - - [1600, 2880, 1, 2048]
    - [2, 42224.5]
  - - [1856, 2880, 1, 2048]
    - [2, 40847.5]
  - - [2112, 2880, 1, 2048]
    - [0, 42881.5]
  - - [2368, 2880, 1, 2048]
    - [114, 41880.2]
  - - [2624, 2880, 1, 2048]
    - [124, 40836.4]
  - - [2880, 2880, 1, 2048]
    - [2, 42361.4]
  - - [3136, 2880, 1, 2048]
    - [2, 42327.0]
  - - [3392, 2880, 1, 2048]
    - [0, 39306.1]
  - - [3648, 2880, 1, 2048]
    - [0, 39845.9]
  - - [3904, 2880, 1, 2048]
    - [204, 39261.3]
  - - [1344, 3136, 1, 2048]
    - [2, 42838.1]
  - - [1600, 3136, 1, 2048]
    - [2, 41772.5]
  - - [1856, 3136, 1, 2048]
    - [0, 41104.2]
  - - [2112, 3136, 1, 2048]
    - [2, 43130.0]
  - - [2368, 3136, 1, 2048]
    - [2, 41440.2]
  - - [2624, 3136, 1, 2048]
    - [0, 40904.6]
  - - [2880, 3136, 1, 2048]
    - [0, 40342.2]
  - - [3136, 3136, 1, 2048]
    - [2, 40002.1]
  - - [3392, 3136, 1, 2048]
    - [6, 38320.5]
  - - [3648, 3136, 1, 2048]
    - [195, 38790.4]
  - - [3904, 3136, 1, 2048]
    - [195, 38604.4]
  - - [1344, 3392, 1, 2048]
    - [3, 41774.1]
  - - [1600, 3392, 1, 2048]
    - [2, 42181.8]
  - - [1856, 3392, 1, 2048]
    - [2, 41591.3]
  - - [2112, 3392, 1, 2048]
    - [2, 43025.4]
  - - [2368, 3392, 1, 2048]
    - [2, 41804.5]
  - - [2624, 3392, 1, 2048]
    - [0, 41240.8]
  - - [2880, 3392, 1, 2048]
    - [114, 38697.9]
  - - [3136, 3392, 1, 2048]
    - [37, 38186.2]
  - - [3392, 3392, 1, 2048]
    - [195, 38692.3]
  - - [3648, 3392, 1, 2048]
    - [195, 38690.1]
  - - [3904, 3392, 1, 2048]
    - [195, 38468.6]
  - - [1088, 3648, 1, 2048]
    - [0, 41053.3]
  - - [1344, 3648, 1, 2048]
    - [114, 41838.2]
  - - [1600, 3648, 1, 2048]
    - [0, 40867.6]
  - - [1856, 3648, 1, 2048]
    - [0, 41207.6]
  - - [2112, 3648, 1, 2048]
    - [2, 42819.5]
  - - [2368, 3648, 1, 2048]
    - [2, 39756.3]
  - - [2624, 3648, 1, 2048]
    - [0, 39365.8]
  - - [2880, 3648, 1, 2048]
    - [2, 38526.0]
  - - [3136, 3648, 1, 2048]
    - [0, 39081.5]
  - - [3392, 3648, 1, 2048]
    - [37, 38690.1]
  - - [3648, 3648, 1, 2048]
    - [37, 39442.2]
  - - [3904, 3648, 1, 2048]
    - [146, 38327.5]
  - - [1088, 3904, 1, 2048]
    - [114, 41423.7]
  - - [1344, 3904, 1, 2048]
    - [2, 43242.7]
  - - [1600, 3904, 1, 2048]
    - [51, 41534.5]
  - - [1856, 3904, 1, 2048]
    - [2, 42703.4]
  - - [2112, 3904, 1, 2048]
    - [2, 41489.6]
  - - [2368, 3904, 1, 2048]
    - [2, 40283.2]
  - - [2624, 3904, 1, 2048]
    - [37, 38708.3]
  - - [2880, 3904, 1, 2048]
    - [37, 38377.9]
  - - [3136, 3904, 1, 2048]
    - [37, 38163.7]
  - - [3392, 3904, 1, 2048]
    - [37, 38605.5]
  - - [3648, 3904, 1, 2048]
    - [37, 39873.1]
  - - [3904, 3904, 1, 2048]
    - [0, 38535.8]
  - - [3392, 576, 1, 4096]
    - [5, 40113.9]
  - - [3648, 576, 1, 4096]
    - [5, 39210.5]
  - - [3904, 576, 1, 4096]
    - [5, 38377.9]
  - - [2368, 832, 1, 4096]
    - [5, 41172.7]
  - - [2624, 832, 1, 4096]
    - [119, 43620.8]
  - - [2880, 832, 1, 4096]
    - [119, 41587.6]
  - - [3136, 832, 1, 4096]
    - [50, 40635.3]
  - - [3392, 832, 1, 4096]
    - [112, 39452.2]
  - - [3648, 832, 1, 4096]
    - [4, 38429.4]
  - - [3904, 832, 1, 4096]
    - [50, 37162.9]
  - - [1856, 1088, 1, 4096]
    - [5, 41879.3]
  - - [2112, 1088, 1, 4096]
    - [2, 44291.9]
  - - [2368, 1088, 1, 4096]
    - [2, 41710.9]
  - - [2624, 1088, 1, 4096]
    - [112, 42215.6]
  - - [2880, 1088, 1, 4096]
    - [124, 41874.6]
  - - [3136, 1088, 1, 4096]
    - [112, 39759.4]
  - - [3392, 1088, 1, 4096]
    - [124, 37649.5]
  - - [3648, 1088, 1, 4096]
    - [124, 40491.0]
  - - [3904, 1088, 1, 4096]
    - [124, 39361.9]
  - - [1600, 1344, 1, 4096]
    - [5, 43176.7]
  - - [1856, 1344, 1, 4096]
    - [5, 43111.1]
  - - [2112, 1344, 1, 4096]
    - [6, 43709.1]
  - - [2368, 1344, 1, 4096]
    - [0, 43525.5]
  - - [2624, 1344, 1, 4096]
    - [5, 40805.6]
  - - [2880, 1344, 1, 4096]
    - [5, 40914.8]
  - - [3136, 1344, 1, 4096]
    - [119, 38882.3]
  - - [3392, 1344, 1, 4096]
    - [4, 37346.1]
  - - [3648, 1344, 1, 4096]
    - [2, 35356.2]
  - - [3904, 1344, 1, 4096]
    - [135, 34663.9]
  - - [1344, 1600, 1, 4096]
    - [5, 43496.5]
  - - [1600, 1600, 1, 4096]
    - [2, 41859.3]
  - - [1856, 1600, 1, 4096]
    - [50, 41442.9]
  - - [2112, 1600, 1, 4096]
    - [2, 40950.3]
  - - [2368, 1600, 1, 4096]
    - [37, 40625.5]
  - - [2624, 1600, 1, 4096]
    - [0, 40895.7]
  - - [2880, 1600, 1, 4096]
    - [0, 39362.6]
  - - [3136, 1600, 1, 4096]
    - [112, 39072.4]
  - - [3392, 1600, 1, 4096]
    - [50, 37173.6]
  - - [3648, 1600, 1, 4096]
    - [4, 36555.9]
  - - [3904, 1600, 1, 4096]
    - [50, 36866.4]
  - - [1088, 1856, 1, 4096]
    - [111, 42745.1]
  - - [1344, 1856, 1, 4096]
    - [5, 42929.9]
  - - [1600, 1856, 1, 4096]
    - [124, 41232.1]
  - - [1856, 1856, 1, 4096]
    - [112, 40544.9]
  - - [2112, 1856, 1, 4096]
    - [2, 41866.5]
  - - [2368, 1856, 1, 4096]
    - [119, 40227.8]
  - - [2624, 1856, 1, 4096]
    - [120, 39037.4]
  - - [2880, 1856, 1, 4096]
    - [120, 39237.0]
  - - [3136, 1856, 1, 4096]
    - [120, 38608.0]
  - - [3392, 1856, 1, 4096]
    - [124, 37290.8]
  - - [3648, 1856, 1, 4096]
    - [4, 36370.8]
  - - [3904, 1856, 1, 4096]
    - [43, 36822.5]
  - - [1088, 2112, 1, 4096]
    - [0, 44291.9]
  - - [1344, 2112, 1, 4096]
    - [2, 44461.2]
  - - [1600, 2112, 1, 4096]
    - [0, 40889.8]
  - - [1856, 2112, 1, 4096]
    - [2, 40039.4]
  - - [2112, 2112, 1, 4096]
    - [0, 39848.2]
  - - [2368, 2112, 1, 4096]
    - [0, 40364.5]
  - - [2624, 2112, 1, 4096]
    - [6, 40498.8]
  - - [2880, 2112, 1, 4096]
    - [120, 39830.8]
  - - [3136, 2112, 1, 4096]
    - [120, 38810.8]
  - - [3392, 2112, 1, 4096]
    - [0, 36633.4]
  - - [3648, 2112, 1, 4096]
    - [124, 36107.5]
  - - [3904, 2112, 1, 4096]
    - [0, 35738.1]
  - - [832, 2368, 1, 4096]
    - [124, 43386.2]
  - - [1088, 2368, 1, 4096]
    - [2, 41710.9]
  - - [1344, 2368, 1, 4096]
    - [2, 42670.7]
  - - [1600, 2368, 1, 4096]
    - [146, 40256.6]
  - - [1856, 2368, 1, 4096]
    - [119, 39651.9]
  - - [2112, 2368, 1, 4096]
    - [0, 39970.7]
  - - [2368, 2368, 1, 4096]
    - [120, 39737.0]
  - - [2624, 2368, 1, 4096]
    - [1, 39829.5]
  - - [2880, 2368, 1, 4096]
    - [112, 38689.8]
  - - [3136, 2368, 1, 4096]
    - [112, 38698.6]
  - - [3392, 2368, 1, 4096]
    - [6, 36474.6]
  - - [3648, 2368, 1, 4096]
    - [124, 37304.3]
  - - [3904, 2368, 1, 4096]
    - [124, 37435.7]
  - - [832, 2624, 1, 4096]
    - [2, 42180.5]
  - - [1088, 2624, 1, 4096]
    - [114, 41393.7]
  - - [1344, 2624, 1, 4096]
    - [124, 40690.7]
  - - [1600, 2624, 1, 4096]
    - [1, 40606.0]
  - - [1856, 2624, 1, 4096]
    - [120, 39113.9]
  - - [2112, 2624, 1, 4096]
    - [1, 39788.9]
  - - [2368, 2624, 1, 4096]
    - [1, 39985.9]
  - - [2624, 2624, 1, 4096]
    - [37, 39721.8]
  - - [2880, 2624, 1, 4096]
    - [112, 39231.9]
  - - [3136, 2624, 1, 4096]
    - [1, 39056.1]
  - - [3392, 2624, 1, 4096]
    - [112, 37219.9]
  - - [3648, 2624, 1, 4096]
    - [43, 37129.1]
  - - [3904, 2624, 1, 4096]
    - [4, 37330.8]
  - - [832, 2880, 1, 4096]
    - [124, 41324.9]
  - - [1088, 2880, 1, 4096]
    - [0, 42288.5]
  - - [1344, 2880, 1, 4096]
    - [5, 40967.6]
  - - [1600, 2880, 1, 4096]
    - [0, 40459.5]
  - - [1856, 2880, 1, 4096]
    - [1, 40432.6]
  - - [2112, 2880, 1, 4096]
    - [0, 40977.2]
  - - [2368, 2880, 1, 4096]
    - [5, 40869.2]
  - - [2624, 2880, 1, 4096]
    - [0, 40278.4]
  - - [2880, 2880, 1, 4096]
    - [1, 39782.0]
  - - [3136, 2880, 1, 4096]
    - [120, 39544.4]
  - - [3392, 2880, 1, 4096]
    - [2, 37606.8]
  - - [3648, 2880, 1, 4096]
    - [50, 37404.2]
  - - [3904, 2880, 1, 4096]
    - [4, 38045.0]
  - - [832, 3136, 1, 4096]
    - [2, 41665.1]
  - - [1088, 3136, 1, 4096]
    - [0, 40508.5]
  - - [1344, 3136, 1, 4096]
    - [4, 39415.0]
  - - [1600, 3136, 1, 4096]
    - [1, 39791.1]
  - - [1856, 3136, 1, 4096]
    - [1, 40339.1]
  - - [2112, 3136, 1, 4096]
    - [5, 39983.4]
  - - [2368, 3136, 1, 4096]
    - [6, 40828.3]
  - - [2624, 3136, 1, 4096]
    - [119, 40077.8]
  - - [2880, 3136, 1, 4096]
    - [120, 39971.6]
  - - [3136, 3136, 1, 4096]
    - [119, 39824.1]
  - - [3392, 3136, 1, 4096]
    - [2, 36877.2]
  - - [3648, 3136, 1, 4096]
    - [4, 36708.8]
  - - [3904, 3136, 1, 4096]
    - [2, 36090.0]
  - - [576, 3392, 1, 4096]
    - [248, 35854.5]
  - - [832, 3392, 1, 4096]
    - [146, 38403.7]
  - - [1088, 3392, 1, 4096]
    - [119, 39990.1]
  - - [1344, 3392, 1, 4096]
    - [6, 39857.1]
  - - [1600, 3392, 1, 4096]
    - [1, 40235.0]
  - - [1856, 3392, 1, 4096]
    - [6, 39917.3]
  - - [2112, 3392, 1, 4096]
    - [112, 39281.6]
  - - [2368, 3392, 1, 4096]
    - [120, 39782.5]
  - - [2624, 3392, 1, 4096]
    - [112, 40665.8]
  - - [2880, 3392, 1, 4096]
    - [119, 39874.1]
  - - [3136, 3392, 1, 4096]
    - [119, 39609.5]
  - - [3392, 3392, 1, 4096]
    - [50, 36490.3]
  - - [3648, 3392, 1, 4096]
    - [4, 38151.3]
  - - [3904, 3392, 1, 4096]
    - [2, 37214.9]
  - - [576, 3648, 1, 4096]
    - [259, 33001.2]
  - - [832, 3648, 1, 4096]
    - [119, 40103.0]
  - - [1088, 3648, 1, 4096]
    - [0, 39126.6]
  - - [1344, 3648, 1, 4096]
    - [0, 39688.4]
  - - [1600, 3648, 1, 4096]
    - [1, 40282.3]
  - - [1856, 3648, 1, 4096]
    - [5, 39874.5]
  - - [2112, 3648, 1, 4096]
    - [142, 39670.6]
  - - [2368, 3648, 1, 4096]
    - [5, 41191.1]
  - - [2624, 3648, 1, 4096]
    - [112, 40970.1]
  - - [2880, 3648, 1, 4096]
    - [119, 40162.0]
  - - [3136, 3648, 1, 4096]
    - [119, 39560.0]
  - - [3392, 3648, 1, 4096]
    - [50, 36955.1]
  - - [3648, 3648, 1, 4096]
    - [4, 37489.1]
  - - [3904, 3648, 1, 4096]
    - [4, 37867.2]
  - - [576, 3904, 1, 4096]
    - [248, 32154.6]
  - - [832, 3904, 1, 4096]
    - [119, 38285.8]
  - - [1088, 3904, 1, 4096]
    - [0, 38705.2]
  - - [1344, 3904, 1, 4096]
    - [1, 39725.7]
  - - [1600, 3904, 1, 4096]
    - [1, 40291.7]
  - - [1856, 3904, 1, 4096]
    - [1, 39864.2]
  - - [2112, 3904, 1, 4096]
    - [120, 40325.4]
  - - [2368, 3904, 1, 4096]
    - [119, 40585.4]
  - - [2624, 3904, 1, 4096]
    - [119, 40152.9]
  - - [2880, 3904, 1, 4096]
    - [119, 40063.9]
  - - [3136, 3904, 1, 4096]
    - [119, 39910.1]
  - - [3392, 3904, 1, 4096]
    - [50, 36785.9]
  - - [3648, 3904, 1, 4096]
    - [4, 38239.5]
  - - [3904, 3904, 1, 4096]
    - [2, 38595.4]
  - - [1984, 1984, 1, 2048]
    - [37, 42206.6]
  - - [1984, 1088, 1, 4096]
    - [111, 43235.2]
  - - [1728, 1216, 1, 4096]
    - [5, 44710.2]
  - - [1856, 1216, 1, 4096]
    - [0, 43096.7]
  - - [1984, 1216, 1, 4096]
    - [114, 43151.9]
  - - [1472, 1344, 1, 4096]
    - [5, 41986.5]
  - - [1728, 1344, 1, 4096]
    - [2, 44660.5]
  - - [1984, 1344, 1, 4096]
    - [2, 43255.3]
  - - [1344, 1472, 1, 4096]
    - [5, 41449.6]
  - - [1472, 1472, 1, 4096]
    - [2, 42978.9]
  - - [1600, 1472, 1, 4096]
    - [50, 43356.9]
  - - [1728, 1472, 1, 4096]
    - [2, 42095.6]
  - - [1856, 1472, 1, 4096]
    - [2, 44056.7]
  - - [1984, 1472, 1, 4096]
    - [114, 42343.9]
  - - [1472, 1600, 1, 4096]
    - [124, 43849.5]
  - - [1728, 1600, 1, 4096]
    - [2, 44323.4]
  - - [1984, 1600, 1, 4096]
    - [124, 42560.9]
  - - [1216, 1728, 1, 4096]
    - [5, 44137.0]
  - - [1344, 1728, 1, 4096]
    - [2, 44040.2]
  - - [1472, 1728, 1, 4096]
    - [2, 42095.6]
  - - [1600, 1728, 1, 4096]
    - [2, 44150.6]
  - - [1728, 1728, 1, 4096]
    - [2, 42839.2]
  - - [1856, 1728, 1, 4096]
    - [2, 43355.0]
  - - [1984, 1728, 1, 4096]
    - [50, 41120.1]
  - - [1216, 1856, 1, 4096]
    - [2, 43298.6]
  - - [1472, 1856, 1, 4096]
    - [2, 43206.2]
  - - [1728, 1856, 1, 4096]
    - [0, 43788.5]
  - - [1984, 1856, 1, 4096]
    - [2, 42848.6]
  - - [1088, 1984, 1, 4096]
    - [2, 42507.7]
  - - [1216, 1984, 1, 4096]
    - [114, 43436.4]
  - - [1344, 1984, 1, 4096]
    - [0, 42007.6]
  - - [1472, 1984, 1, 4096]
    - [114, 41972.5]
  - - [1600, 1984, 1, 4096]
    - [2, 43558.9]
  - - [1728, 1984, 1, 4096]
    - [2, 42233.2]
  - - [1856, 1984, 1, 4096]
    - [2, 43155.1]
  - - [1984, 1984, 1, 4096]
    - [1, 40611.9]
  - - [3072, 896, 1, 3072]
    - [2, 44270.8]
  - - [3072, 960, 1, 3072]
    - [119, 44519.4]
  - - [3072, 1024, 1, 3072]
    - [114, 44533.1]
  - - [3072, 1280, 1, 3072]
    - [114, 45756.0]
  - - [3072, 1536, 1, 3072]
    - [2, 44533.1]
  - - [3072, 1792, 1, 3072]
    - [2, 43196.5]
  - - [3072, 2048, 1, 3072]
    - [2, 43189.6]
  - - [3072, 2304, 1, 3072]
    - [2, 41415.8]
  - - [3072, 2560, 1, 3072]
    - [2, 43490.9]
  - - [3072, 2816, 1, 3072]
    - [1, 41265.7]
  - - [3072, 3328, 1, 3072]
    - [6, 42242.0]
  - - [3072, 3584, 1, 3072]
    - [103, 41885.9]
  - - [3072, 3840, 1, 3072]
    - [114, 42987.9]
  - - [3072, 4096, 1, 3072]
    - [103, 41879.4]
  - - [3904, 4096, 1, 512]
    - [129, 36879.6]
  - - [2112, 4096, 1, 1024]
    - [3, 41784.8]
  - - [2368, 4096, 1, 1024]
    - [146, 40211.0]
  - - [2624, 4096, 1, 1024]
    - [146, 39518.3]
  - - [2880, 4096, 1, 1024]
    - [2, 39998.7]
  - - [3136, 4096, 1, 1024]
    - [2, 39030.7]
  - - [3392, 4096, 1, 1024]
    - [2, 38871.8]
  - - [3648, 4096, 1, 1024]
    - [0, 38883.9]
  - - [3904, 4096, 1, 1024]
    - [2, 39220.5]
  - - [1088, 4096, 1, 2048]
    - [0, 41019.4]
  - - [1344, 4096, 1, 2048]
    - [2, 42544.5]
  - - [1600, 4096, 1, 2048]
    - [50, 41489.3]
  - - [1856, 4096, 1, 2048]
    - [2, 41352.6]
  - - [2112, 4096, 1, 2048]
    - [2, 44458.6]
  - - [2368, 4096, 1, 2048]
    - [4, 39530.8]
  - - [2624, 4096, 1, 2048]
    - [37, 38181.6]
  - - [2880, 4096, 1, 2048]
    - [37, 38778.8]
  - - [3136, 4096, 1, 2048]
    - [114, 38264.3]
  - - [3392, 4096, 1, 2048]
    - [37, 39139.1]
  - - [3648, 4096, 1, 2048]
    - [37, 38252.1]
  - - [3904, 4096, 1, 2048]
    - [146, 38528.4]
  - - [576, 4096, 1, 4096]
    - [248, 33346.0]
  - - [832, 4096, 1, 4096]
    - [0, 37322.6]
  - - [1088, 4096, 1, 4096]
    - [6, 39170.8]
  - - [1344, 4096, 1, 4096]
    - [6, 40337.3]
  - - [1600, 4096, 1, 4096]
    - [146, 39945.8]
  - - [1856, 4096, 1, 4096]
    - [1, 40049.5]
  - - [2112, 4096, 1, 4096]
    - [119, 40334.1]
  - - [2368, 4096, 1, 4096]
    - [119, 40211.0]
  - - [2624, 4096, 1, 4096]
    - [119, 40555.9]
  - - [2880, 4096, 1, 4096]
    - [119, 40265.3]
  - - [3136, 4096, 1, 4096]
    - [112, 39588.7]
  - - [3392, 4096, 1, 4096]
    - [50, 37775.2]
  - - [3648, 4096, 1, 4096]
    - [2, 38097.3]
  - - [3904, 4096, 1, 4096]
    - [2, 37449.0]
  - - [4096, 3904, 1, 512]
    - [128, 32360.8]
  - - [4096, 2112, 1, 1024]
    - [139, 40265.3]
  - - [4096, 2368, 1, 1024]
    - [164, 40456.7]
  - - [4096, 2624, 1, 1024]
    - [37, 39027.8]
  - - [4096, 2880, 1, 1024]
    - [37, 36997.2]
  - - [4096, 3136, 1, 1024]
    - [37, 33813.2]
  - - [4096, 3392, 1, 1024]
    - [37, 34036.1]
  - - [4096, 3648, 1, 1024]
    - [37, 33926.4]
  - - [4096, 3904, 1, 1024]
    - [37, 34618.5]
  - - [4096, 1088, 1, 2048]
    - [111, 42156.1]
  - - [4096, 1344, 1, 2048]
    - [114, 41989.9]
  - - [4096, 1600, 1, 2048]
    - [37, 40795.7]
  - - [4096, 1856, 1, 2048]
    - [37, 37471.1]
  - - [4096, 2112, 1, 2048]
    - [37, 37937.3]
  - - [4096, 2368, 1, 2048]
    - [37, 37800.6]
  - - [4096, 2624, 1, 2048]
    - [37, 37434.9]
  - - [4096, 2880, 1, 2048]
    - [37, 38408.9]
  - - [4096, 3136, 1, 2048]
    - [195, 37447.2]
  - - [4096, 3392, 1, 2048]
    - [195, 37489.0]
  - - [4096, 3648, 1, 2048]
    - [37, 37387.5]
  - - [4096, 3904, 1, 2048]
    - [37, 37816.5]
  - - [4096, 576, 1, 4096]
    - [5, 34886.9]
  - - [4096, 832, 1, 4096]
    - [50, 35116.1]
  - - [4096, 1088, 1, 4096]
    - [124, 37481.7]
  - - [4096, 1344, 1, 4096]
    - [2, 33679.7]
  - - [4096, 1600, 1, 4096]
    - [2, 35601.5]
  - - [4096, 1856, 1, 4096]
    - [4, 35709.3]
  - - [4096, 2112, 1, 4096]
    - [124, 34434.9]
  - - [4096, 2368, 1, 4096]
    - [124, 35064.8]
  - - [4096, 2624, 1, 4096]
    - [50, 35908.2]
  - - [4096, 2880, 1, 4096]
    - [4, 36591.0]
  - - [4096, 3136, 1, 4096]
    - [2, 34774.2]
  - - [4096, 3392, 1, 4096]
    - [4, 35746.4]
  - - [4096, 3648, 1, 4096]
    - [2, 35949.1]
  - - [4096, 3904, 1, 4096]
    - [4, 36796.8]
  - - [128, 8192, 1, 8192]
    - [272, 16332.2]
  - - [256, 4096, 1, 8192]
    - [245, 21927.1]
  - - [256, 8192, 1, 4096]
    - [273, 23804.7]
  - - [256, 8192, 1, 8192]
    - [245, 23018.5]
  - - [384, 4096, 1, 8192]
    - [248, 27371.0]
  - - [384, 8192, 1, 4096]
    - [248, 31179.4]
  - - [384, 8192, 1, 8192]
    - [248, 30797.5]
  - - [768, 2048, 1, 8192]
    - [146, 42107.5]
  - - [768, 4096, 1, 8192]
    - [146, 39283.2]
  - - [768, 8192, 1, 2048]
    - [37, 38121.0]
  - - [768, 8192, 1, 4096]
    - [37, 40046.3]
  - - [768, 8192, 1, 8192]
    - [146, 39074.8]
  - - [1536, 1024, 1, 8192]
    - [43, 40904.5]
  - - [1536, 2048, 1, 8192]
    - [50, 35013.3]
  - - [1536, 4096, 1, 8192]
    - [50, 33752.2]
  - - [1536, 8192, 1, 1024]
    - [138, 38121.0]
  - - [1536, 8192, 1, 2048]
    - [37, 38433.7]
  - - [1536, 8192, 1, 4096]
    - [37, 40344.1]
  - - [1536, 8192, 1, 8192]
    - [50, 34782.9]
  - - [3072, 512, 1, 8192]
    - [43, 38121.0]
  - - [3072, 1024, 1, 8192]
    - [50, 41698.7]
  - - [3072, 2048, 1, 8192]
    - [4, 37334.0]
  - - [3072, 4096, 1, 8192]
    - [4, 37422.1]
  - - [3072, 8192, 1, 512]
    - [125, 35301.1]
  - - [3072, 8192, 1, 1024]
    - [37, 38405.1]
  - - [3072, 8192, 1, 2048]
    - [37, 38693.4]
  - - [3072, 8192, 1, 4096]
    - [119, 38964.0]
  - - [3072, 8192, 1, 8192]
    - [4, 37449.3]
  - - [8192, 128, 1, 8192]
    - [209, 17747.8]
  - - [8192, 256, 1, 4096]
    - [135, 24231.1]
  - - [8192, 256, 1, 8192]
    - [62, 25153.5]
  - - [8192, 512, 1, 2048]
    - [43, 32599.4]
  - - [8192, 512, 1, 4096]
    - [50, 33521.7]
  - - [8192, 512, 1, 8192]
    - [43, 34847.6]
  - - [8192, 1024, 1, 1024]
    - [30, 38177.5]
  - - [8192, 1024, 1, 2048]
    - [4, 34636.8]
  - - [8192, 1024, 1, 4096]
    - [50, 39539.4]
  - - [8192, 1024, 1, 8192]
    - [50, 40304.7]
  - - [8192, 2048, 1, 512]
    - [128, 30954.7]
  - - [8192, 2048, 1, 1024]
    - [37, 34428.6]
  - - [8192, 2048, 1, 2048]
    - [4, 34411.4]
  - - [8192, 2048, 1, 4096]
    - [2, 39056.3]
  - - [8192, 2048, 1, 8192]
    - [4, 38124.5]
  - - [8192, 4096, 1, 256]
    - [22, 29671.6]
  - - [8192, 4096, 1, 512]
    - [128, 32232.4]
  - - [8192, 4096, 1, 1024]
    - [37, 34865.3]
  - - [8192, 4096, 1, 2048]
    - [4, 34645.6]
  - - [8192, 4096, 1, 4096]
    - [4, 38098.1]
  - - [8192, 4096, 1, 8192]
    - [4, 38617.3]
  - - [8192, 8192, 1, 128]
    - [128, 20550.1]
  - - [8192, 8192, 1, 256]
    - [22, 29317.2]
  - - [8192, 8192, 1, 512]
    - [128, 33294.3]
  - - [8192, 8192, 1, 1024]
    - [37, 35605.9]
  - - [8192, 8192, 1, 2048]
    - [4, 34816.7]
  - - [8192, 8192, 1, 4096]
    - [4, 38466.0]
  - - [8192, 8192, 1, 8192]
    - [4, 38908.4]
  - - [512, 512, 1, 512]
    - [7, 13421.8]
  - - [1024, 1024, 1, 1024]
    - [16, 35204.6]
  - - [3392, 576, 1, 64]
    - [22, 8336.18]
  - - [3648, 576, 1, 64]
    - [22, 8676.12]
  - - [3904, 576, 1, 64]
    - [22, 9594.47]
  - - [2368, 832, 1, 64]
    - [22, 9006.52]
  - - [2624, 832, 1, 64]
    - [22, 9314.85]
  - - [2880, 832, 1, 64]
    - [22, 9294.2]
  - - [3136, 832, 1, 64]
    - [22, 9542.04]
  - - [3392, 832, 1, 64]
    - [9, 10624.5]
  - - [3648, 832, 1, 64]
    - [22, 10791.6]
  - - [3904, 832, 1, 64]
    - [22, 11236.8]
  - - [1856, 1088, 1, 64]
    - [14, 8337.87]
  - - [2112, 1088, 1, 64]
    - [22, 9191.42]
  - - [2368, 1088, 1, 64]
    - [22, 9422.2]
  - - [2624, 1088, 1, 64]
    - [9, 10440.8]
  - - [2880, 1088, 1, 64]
    - [22, 10840.0]
  - - [3136, 1088, 1, 64]
    - [22, 11198.3]
  - - [3392, 1088, 1, 64]
    - [22, 11809.6]
  - - [3648, 1088, 1, 64]
    - [22, 11546.3]
  - - [3904, 1088, 1, 64]
    - [22, 12356.5]
  - - [1600, 1344, 1, 64]
    - [22, 9175.04]
  - - [1856, 1344, 1, 64]
    - [22, 9675.5]
  - - [2112, 1344, 1, 64]
    - [9, 10380.9]
  - - [2368, 1344, 1, 64]
    - [22, 10720.3]
  - - [2624, 1344, 1, 64]
    - [22, 11010.0]
  - - [2880, 1344, 1, 64]
    - [22, 11522.1]
  - - [3136, 1344, 1, 64]
    - [22, 11988.7]
  - - [3392, 1344, 1, 64]
    - [22, 12685.5]
  - - [3648, 1344, 1, 64]
    - [22, 12551.5]
  - - [3904, 1344, 1, 64]
    - [22, 12437.3]
  - - [1344, 1600, 1, 64]
    - [22, 8879.07]
  - - [1600, 1600, 1, 64]
    - [9, 9362.29]
  - - [1856, 1600, 1, 64]
    - [16, 10273.2]
  - - [2112, 1600, 1, 64]
    - [22, 11382.6]
  - - [2368, 1600, 1, 64]
    - [22, 11278.3]
  - - [2624, 1600, 1, 64]
    - [22, 12213.5]
  - - [2880, 1600, 1, 64]
    - [22, 12549.4]
  - - [3136, 1600, 1, 64]
    - [22, 12351.0]
  - - [3392, 1600, 1, 64]
    - [125, 13107.2]
  - - [3648, 1600, 1, 64]
    - [22, 13341.3]
  - - [3904, 1600, 1, 64]
    - [22, 13785.2]
  - - [1088, 1856, 1, 64]
    - [22, 8615.8]
  - - [1344, 1856, 1, 64]
    - [9, 9390.92]
  - - [1600, 1856, 1, 64]
    - [9, 10558.6]
  - - [1856, 1856, 1, 64]
    - [22, 11305.8]
  - - [2112, 1856, 1, 64]
    - [22, 11149.9]
  - - [2368, 1856, 1, 64]
    - [17, 12501.4]
  - - [2624, 1856, 1, 64]
    - [22, 12467.6]
  - - [2880, 1856, 1, 64]
    - [22, 13415.6]
  - - [3136, 1856, 1, 64]
    - [22, 13303.8]
  - - [3392, 1856, 1, 64]
    - [22, 13893.6]
  - - [3648, 1856, 1, 64]
    - [22, 14207.3]
  - - [3904, 1856, 1, 64]
    - [22, 14491.6]
  - - [1088, 2112, 1, 64]
    - [22, 9191.42]
  - - [1344, 2112, 1, 64]
    - [9, 10092.5]
  - - [1600, 2112, 1, 64]
    - [22, 11382.6]
  - - [1856, 2112, 1, 64]
    - [22, 11149.9]
  - - [2112, 2112, 1, 64]
    - [22, 12147.9]
  - - [2368, 2112, 1, 64]
    - [22, 12803.1]
  - - [2624, 2112, 1, 64]
    - [22, 13384.2]
  - - [2880, 2112, 1, 64]
    - [22, 13423.6]
  - - [3136, 2112, 1, 64]
    - [22, 14369.0]
  - - [3392, 2112, 1, 64]
    - [22, 14327.8]
  - - [3648, 2112, 1, 64]
    - [22, 14719.2]
  - - [3904, 2112, 1, 64]
    - [22, 14864.7]
  - - [832, 2368, 1, 64]
    - [22, 8406.08]
  - - [1088, 2368, 1, 64]
    - [38, 9993.25]
  - - [1344, 2368, 1, 64]
    - [22, 11010.0]
  - - [1600, 2368, 1, 64]
    - [22, 11278.3]
  - - [1856, 2368, 1, 64]
    - [9, 12229.6]
  - - [2112, 2368, 1, 64]
    - [22, 12552.1]
  - - [2368, 2368, 1, 64]
    - [22, 13291.7]
  - - [2624, 2368, 1, 64]
    - [22, 13953.4]
  - - [2880, 2368, 1, 64]
    - [22, 14549.0]
  - - [3136, 2368, 1, 64]
    - [22, 14187.1]
  - - [3392, 2368, 1, 64]
    - [22, 14687.6]
  - - [3648, 2368, 1, 64]
    - [22, 15357.3]
  - - [3904, 2368, 1, 64]
    - [22, 15367.8]
  - - [832, 2624, 1, 64]
    - [22, 9014.37]
  - - [1088, 2624, 1, 64]
    - [22, 10440.8]
  - - [1344, 2624, 1, 64]
    - [22, 11574.7]
  - - [1600, 2624, 1, 64]
    - [22, 11942.1]
  - - [1856, 2624, 1, 64]
    - [22, 12987.1]
  - - [2112, 2624, 1, 64]
    - [22, 13909.1]
  - - [2368, 2624, 1, 64]
    - [17, 13953.4]
  - - [2624, 2624, 1, 64]
    - [22, 14448.0]
  - - [2880, 2624, 1, 64]
    - [22, 14656.2]
  - - [3136, 2624, 1, 64]
    - [22, 14629.1]
  - - [3392, 2624, 1, 64]
    - [22, 15395.6]
  - - [3648, 2624, 1, 64]
    - [22, 15509.6]
  - - [3904, 2624, 1, 64]
    - [22, 15798.1]
  - - [832, 2880, 1, 64]
    - [22, 9020.84]
  - - [1088, 2880, 1, 64]
    - [22, 10554.7]
  - - [1344, 2880, 1, 64]
    - [22, 11796.5]
  - - [1600, 2880, 1, 64]
    - [22, 12549.4]
  - - [1856, 2880, 1, 64]
    - [22, 13415.6]
  - - [2112, 2880, 1, 64]
    - [22, 13659.1]
  - - [2368, 2880, 1, 64]
    - [22, 14549.0]
  - - [2624, 2880, 1, 64]
    - [22, 14881.7]
  - - [2880, 2880, 1, 64]
    - [22, 15166.9]
  - - [3136, 2880, 1, 64]
    - [22, 15414.1]
  - - [3392, 2880, 1, 64]
    - [22, 15630.3]
  - - [3648, 2880, 1, 64]
    - [22, 16009.5]
  - - [3904, 2880, 1, 64]
    - [22, 16170.5]
  - - [832, 3136, 1, 64]
    - [22, 9822.69]
  - - [1088, 3136, 1, 64]
    - [22, 11492.9]
  - - [1344, 3136, 1, 64]
    - [22, 11988.7]
  - - [1600, 3136, 1, 64]
    - [22, 12845.1]
  - - [1856, 3136, 1, 64]
    - [22, 13545.7]
  - - [2112, 3136, 1, 64]
    - [22, 14369.0]
  - - [2368, 3136, 1, 64]
    - [22, 14852.1]
  - - [2624, 3136, 1, 64]
    - [22, 14629.1]
  - - [2880, 3136, 1, 64]
    - [22, 15622.4]
  - - [3136, 3136, 1, 64]
    - [22, 15735.2]
  - - [3392, 3136, 1, 64]
    - [22, 16209.2]
  - - [3648, 3136, 1, 64]
    - [22, 16091.6]
  - - [3904, 3136, 1, 64]
    - [22, 16155.6]
  - - [576, 3392, 1, 64]
    - [232, 11908.8]
  - - [832, 3392, 1, 64]
    - [9, 10321.0]
  - - [1088, 3392, 1, 64]
    - [22, 11809.6]
  - - [1344, 3392, 1, 64]
    - [22, 12415.6]
  - - [1600, 3392, 1, 64]
    - [22, 13107.2]
  - - [1856, 3392, 1, 64]
    - [22, 13893.6]
  - - [2112, 3392, 1, 64]
    - [22, 14555.2]
  - - [2368, 3392, 1, 64]
    - [22, 15119.5]
  - - [2624, 3392, 1, 64]
    - [22, 15190.4]
  - - [2880, 3392, 1, 64]
    - [22, 15828.2]
  - - [3136, 3392, 1, 64]
    - [22, 15650.3]
  - - [3392, 3392, 1, 64]
    - [22, 16183.8]
  - - [3648, 3392, 1, 64]
    - [22, 16328.6]
  - - [3904, 3392, 1, 64]
    - [38, 16617.9]
  - - [576, 3648, 1, 64]
    - [229, 12115.3]
  - - [832, 3648, 1, 64]
    - [22, 11099.9]
  - - [1088, 3648, 1, 64]
    - [22, 12096.1]
  - - [1344, 3648, 1, 64]
    - [22, 13074.4]
  - - [1600, 3648, 1, 64]
    - [22, 13341.3]
  - - [1856, 3648, 1, 64]
    - [22, 14207.3]
  - - [2112, 3648, 1, 64]
    - [22, 14719.2]
  - - [2368, 3648, 1, 64]
    - [22, 15357.3]
  - - [2624, 3648, 1, 64]
    - [22, 15509.6]
  - - [2880, 3648, 1, 64]
    - [22, 16202.4]
  - - [3136, 3648, 1, 64]
    - [22, 16091.6]
  - - [3392, 3648, 1, 64]
    - [22, 16328.6]
  - - [3648, 3648, 1, 64]
    - [22, 16223.0]
  - - [3904, 3648, 1, 64]
    - [22, 16724.3]
  - - [576, 3904, 1, 64]
    - [242, 12514.5]
  - - [832, 3904, 1, 64]
    - [22, 11236.8]
  - - [1088, 3904, 1, 64]
    - [22, 12081.9]
  - - [1344, 3904, 1, 64]
    - [22, 13432.3]
  - - [1600, 3904, 1, 64]
    - [22, 13785.2]
  - - [1856, 3904, 1, 64]
    - [22, 14491.6]
  - - [2112, 3904, 1, 64]
    - [22, 15077.0]
  - - [2368, 3904, 1, 64]
    - [22, 15170.7]
  - - [2624, 3904, 1, 64]
    - [22, 15990.8]
  - - [2880, 3904, 1, 64]
    - [22, 16170.5]
  - - [3136, 3904, 1, 64]
    - [22, 16155.6]
  - - [3392, 3904, 1, 64]
    - [22, 16456.5]
  - - [3648, 3904, 1, 64]
    - [22, 16423.0]
  - - [3904, 3904, 1, 64]
    - [38, 16817.9]
  - - [1600, 320, 1, 256]
    - [123, 11397.6]
  - - [1856, 320, 1, 256]
    - [14, 13221.2]
  - - [2112, 320, 1, 256]
    - [38, 13841.2]
  - - [2368, 320, 1, 256]
    - [14, 15518.9]
  - - [2624, 320, 1, 256]
    - [38, 15354.1]
  - - [2880, 320, 1, 256]
    - [38, 16852.1]
  - - [3136, 320, 1, 256]
    - [40, 16574.3]
  - - [3392, 320, 1, 256]
    - [22, 17927.3]
  - - [3648, 320, 1, 256]
    - [8, 18111.8]
  - - [3904, 320, 1, 256]
    - [36, 18275.2]
  - - [1088, 576, 1, 256]
    - [22, 13369.3]
  - - [1344, 576, 1, 256]
    - [10, 15854.5]
  - - [1600, 576, 1, 256]
    - [22, 16271.0]
  - - [1856, 576, 1, 256]
    - [22, 17656.7]
  - - [2112, 576, 1, 256]
    - [10, 18874.4]
  - - [2368, 576, 1, 256]
    - [38, 19398.7]
  - - [2624, 576, 1, 256]
    - [10, 20364.4]
  - - [2880, 576, 1, 256]
    - [116, 20715.8]
  - - [3136, 576, 1, 256]
    - [116, 21019.2]
  - - [3392, 576, 1, 256]
    - [10, 20840.4]
  - - [3648, 576, 1, 256]
    - [10, 21955.9]
  - - [3904, 576, 1, 256]
    - [22, 22575.2]
  - - [832, 832, 1, 256]
    - [9, 14767.4]
  - - [1088, 832, 1, 256]
    - [9, 16552.5]
  - - [1344, 832, 1, 256]
    - [9, 17891.3]
  - - [1600, 832, 1, 256]
    - [9, 20046.3]
  - - [1856, 832, 1, 256]
    - [14, 20272.5]
  - - [2112, 832, 1, 256]
    - [3, 20447.2]
  - - [2368, 832, 1, 256]
    - [22, 20174.6]
  - - [2624, 832, 1, 256]
    - [22, 22811.9]
  - - [2880, 832, 1, 256]
    - [7, 22719.1]
  - - [3136, 832, 1, 256]
    - [9, 24288.8]
  - - [3392, 832, 1, 256]
    - [16, 25349.8]
  - - [3648, 832, 1, 256]
    - [113, 25899.8]
  - - [3904, 832, 1, 256]
    - [30, 25985.0]
  - - [576, 1088, 1, 256]
    - [9, 13369.3]
  - - [832, 1088, 1, 256]
    - [9, 16552.5]
  - - [1088, 1088, 1, 256]
    - [8, 17825.8]
  - - [1344, 1088, 1, 256]
    - [163, 20796.8]
  - - [1600, 1088, 1, 256]
    - [10, 20727.7]
  - - [1856, 1088, 1, 256]
    - [10, 21997.8]
  - - [2112, 1088, 1, 256]
    - [14, 23530.0]
  - - [2368, 1088, 1, 256]
    - [14, 24427.9]
  - - [2624, 1088, 1, 256]
    - [161, 25644.1]
  - - [2880, 1088, 1, 256]
    - [123, 25876.1]
  - - [3136, 1088, 1, 256]
    - [14, 26073.5]
  - - [3392, 1088, 1, 256]
    - [125, 26613.2]
  - - [3648, 1088, 1, 256]
    - [40, 27095.2]
  - - [3904, 1088, 1, 256]
    - [39, 28243.5]
  - - [576, 1344, 1, 256]
    - [230, 20751.9]
  - - [832, 1344, 1, 256]
    - [22, 19742.2]
  - - [1088, 1344, 1, 256]
    - [15, 19197.0]
  - - [1344, 1344, 1, 256]
    - [12, 21508.0]
  - - [1600, 1344, 1, 256]
    - [106, 21173.2]
  - - [1856, 1344, 1, 256]
    - [106, 23221.2]
  - - [2112, 1344, 1, 256]
    - [16, 25497.0]
  - - [2368, 1344, 1, 256]
    - [24, 25864.9]
  - - [2624, 1344, 1, 256]
    - [199, 26950.0]
  - - [2880, 1344, 1, 256]
    - [15, 27148.1]
  - - [3136, 1344, 1, 256]
    - [9, 28025.6]
  - - [3392, 1344, 1, 256]
    - [22, 26524.2]
  - - [3648, 1344, 1, 256]
    - [22, 27285.8]
  - - [3904, 1344, 1, 256]
    - [40, 28886.6]
  - - [320, 1600, 1, 256]
    - [232, 16912.5]
  - - [576, 1600, 1, 256]
    - [246, 22363.0]
  - - [832, 1600, 1, 256]
    - [16, 20653.8]
  - - [1088, 1600, 1, 256]
    - [15, 21221.2]
  - - [1344, 1600, 1, 256]
    - [15, 22469.5]
  - - [1600, 1600, 1, 256]
    - [9, 23405.7]
  - - [1856, 1600, 1, 256]
    - [19, 26214.4]
  - - [2112, 1600, 1, 256]
    - [163, 27033.6]
  - - [2368, 1600, 1, 256]
    - [33, 26942.6]
  - - [2624, 1600, 1, 256]
    - [38, 27209.9]
  - - [2880, 1600, 1, 256]
    - [30, 28771.9]
  - - [3136, 1600, 1, 256]
    - [40, 28865.3]
  - - [3392, 1600, 1, 256]
    - [22, 28646.7]
  - - [3648, 1600, 1, 256]
    - [9, 29298.4]
  - - [3904, 1600, 1, 256]
    - [36, 30171.3]
  - - [320, 1856, 1, 256]
    - [234, 18770.8]
  - - [576, 1856, 1, 256]
    - [229, 23193.1]
  - - [832, 1856, 1, 256]
    - [123, 19283.6]
  - - [1088, 1856, 1, 256]
    - [225, 21539.5]
  - - [1344, 1856, 1, 256]
    - [106, 23221.2]
  - - [1600, 1856, 1, 256]
    - [9, 25770.1]
  - - [1856, 1856, 1, 256]
    - [31, 27133.9]
  - - [2112, 1856, 1, 256]
    - [22, 27121.3]
  - - [2368, 1856, 1, 256]
    - [28, 28849.3]
  - - [2624, 1856, 1, 256]
    - [33, 28661.1]
  - - [2880, 1856, 1, 256]
    - [22, 29114.7]
  - - [3136, 1856, 1, 256]
    - [9, 29800.5]
  - - [3392, 1856, 1, 256]
    - [18, 29302.9]
  - - [3648, 1856, 1, 256]
    - [163, 30408.7]
  - - [3904, 1856, 1, 256]
    - [9, 30161.5]
  - - [320, 2112, 1, 256]
    - [229, 21492.6]
  - - [576, 2112, 1, 256]
    - [230, 26170.3]
  - - [832, 2112, 1, 256]
    - [15, 21420.9]
  - - [1088, 2112, 1, 256]
    - [106, 23530.0]
  - - [1344, 2112, 1, 256]
    - [9, 25497.0]
  - - [1600, 2112, 1, 256]
    - [198, 26214.4]
  - - [1856, 2112, 1, 256]
    - [106, 27121.3]
  - - [2112, 2112, 1, 256]
    - [113, 27188.1]
  - - [2368, 2112, 1, 256]
    - [22, 28771.0]
  - - [2624, 2112, 1, 256]
    - [22, 28953.5]
  - - [2880, 2112, 1, 256]
    - [18, 29659.7]
  - - [3136, 2112, 1, 256]
    - [22, 29487.8]
  - - [3392, 2112, 1, 256]
    - [198, 29820.5]
  - - [3648, 2112, 1, 256]
    - [18, 29005.5]
  - - [3904, 2112, 1, 256]
    - [22, 30371.0]
  - - [320, 2368, 1, 256]
    - [234, 20419.6]
  - - [576, 2368, 1, 256]
    - [248, 21891.9]
  - - [832, 2368, 1, 256]
    - [10, 21928.9]
  - - [1088, 2368, 1, 256]
    - [106, 24427.9]
  - - [1344, 2368, 1, 256]
    - [163, 26282.1]
  - - [1600, 2368, 1, 256]
    - [33, 27322.1]
  - - [1856, 2368, 1, 256]
    - [9, 28484.1]
  - - [2112, 2368, 1, 256]
    - [163, 29432.4]
  - - [2368, 2368, 1, 256]
    - [30, 29000.0]
  - - [2624, 2368, 1, 256]
    - [19, 30298.9]
  - - [2880, 2368, 1, 256]
    - [31, 30363.1]
  - - [3136, 2368, 1, 256]
    - [22, 29704.2]
  - - [3392, 2368, 1, 256]
    - [30, 30463.1]
  - - [3648, 2368, 1, 256]
    - [38, 30714.5]
  - - [3904, 2368, 1, 256]
    - [18, 30537.2]
  - - [320, 2624, 1, 256]
    - [230, 20768.9]
  - - [576, 2624, 1, 256]
    - [234, 19944.6]
  - - [832, 2624, 1, 256]
    - [11, 21495.8]
  - - [1088, 2624, 1, 256]
    - [9, 25644.1]
  - - [1344, 2624, 1, 256]
    - [30, 28213.2]
  - - [1600, 2624, 1, 256]
    - [17, 27916.6]
  - - [1856, 2624, 1, 256]
    - [163, 28994.3]
  - - [2112, 2624, 1, 256]
    - [31, 29252.0]
  - - [2368, 2624, 1, 256]
    - [33, 29457.2]
  - - [2624, 2624, 1, 256]
    - [33, 30390.6]
  - - [2880, 2624, 1, 256]
    - [21, 29994.2]
  - - [3136, 2624, 1, 256]
    - [40, 29880.7]
  - - [3392, 2624, 1, 256]
    - [39, 30791.3]
  - - [3648, 2624, 1, 256]
    - [30, 31019.3]
  - - [3904, 2624, 1, 256]
    - [38, 29801.0]
  - - [320, 2880, 1, 256]
    - [230, 23475.6]
  - - [576, 2880, 1, 256]
    - [230, 20766.4]
  - - [832, 2880, 1, 256]
    - [106, 24536.7]
  - - [1088, 2880, 1, 256]
    - [13, 25465.4]
  - - [1344, 2880, 1, 256]
    - [125, 27525.1]
  - - [1600, 2880, 1, 256]
    - [18, 28425.3]
  - - [1856, 2880, 1, 256]
    - [116, 29114.7]
  - - [2112, 2880, 1, 256]
    - [17, 29105.3]
  - - [2368, 2880, 1, 256]
    - [40, 30900.5]
  - - [2624, 2880, 1, 256]
    - [164, 30228.5]
  - - [2880, 2880, 1, 256]
    - [30, 30773.4]
  - - [3136, 2880, 1, 256]
    - [106, 30027.4]
  - - [3392, 2880, 1, 256]
    - [22, 30498.2]
  - - [3648, 2880, 1, 256]
    - [31, 31274.4]
  - - [3904, 2880, 1, 256]
    - [16, 31804.9]
  - - [320, 3136, 1, 256]
    - [234, 23461.3]
  - - [576, 3136, 1, 256]
    - [234, 22125.5]
  - - [832, 3136, 1, 256]
    - [9, 23855.1]
  - - [1088, 3136, 1, 256]
    - [15, 26468.6]
  - - [1344, 3136, 1, 256]
    - [9, 28394.3]
  - - [1600, 3136, 1, 256]
    - [33, 28865.3]
  - - [1856, 3136, 1, 256]
    - [125, 28932.6]
  - - [2112, 3136, 1, 256]
    - [22, 29487.8]
  - - [2368, 3136, 1, 256]
    - [9, 29023.9]
  - - [2624, 3136, 1, 256]
    - [33, 30094.1]
  - - [2880, 3136, 1, 256]
    - [21, 30624.0]
  - - [3136, 3136, 1, 256]
    - [22, 30702.8]
  - - [3392, 3136, 1, 256]
    - [30, 30770.1]
  - - [3648, 3136, 1, 256]
    - [163, 30192.5]
  - - [3904, 3136, 1, 256]
    - [18, 30878.8]
  - - [320, 3392, 1, 256]
    - [229, 23156.1]
  - - [576, 3392, 1, 256]
    - [248, 23372.5]
  - - [832, 3392, 1, 256]
    - [9, 25802.5]
  - - [1088, 3392, 1, 256]
    - [22, 26993.3]
  - - [1344, 3392, 1, 256]
    - [30, 28816.4]
  - - [1600, 3392, 1, 256]
    - [35, 28945.1]
  - - [1856, 3392, 1, 256]
    - [163, 28779.7]
  - - [2112, 3392, 1, 256]
    - [30, 30822.8]
  - - [2368, 3392, 1, 256]
    - [33, 30239.1]
  - - [2624, 3392, 1, 256]
    - [28, 31213.1]
  - - [2880, 3392, 1, 256]
    - [21, 31457.3]
  - - [3136, 3392, 1, 256]
    - [30, 30426.3]
  - - [3392, 3392, 1, 256]
    - [31, 31168.8]
  - - [3648, 3392, 1, 256]
    - [19, 31056.4]
  - - [3904, 3392, 1, 256]
    - [21, 31831.4]
  - - [320, 3648, 1, 256]
    - [229, 25651.9]
  - - [576, 3648, 1, 256]
    - [229, 25019.5]
  - - [832, 3648, 1, 256]
    - [16, 27263.0]
  - - [1088, 3648, 1, 256]
    - [15, 27095.2]
  - - [1344, 3648, 1, 256]
    - [163, 29189.4]
  - - [1600, 3648, 1, 256]
    - [30, 29884.4]
  - - [1856, 3648, 1, 256]
    - [15, 30144.3]
  - - [2112, 3648, 1, 256]
    - [35, 30344.2]
  - - [2368, 3648, 1, 256]
    - [199, 29486.0]
  - - [2624, 3648, 1, 256]
    - [40, 30441.3]
  - - [2880, 3648, 1, 256]
    - [18, 31457.3]
  - - [3136, 3648, 1, 256]
    - [30, 30666.7]
  - - [3392, 3648, 1, 256]
    - [19, 31209.3]
  - - [3648, 3648, 1, 256]
    - [30, 31989.0]
  - - [3904, 3648, 1, 256]
    - [18, 31981.6]
  - - [320, 3904, 1, 256]
    - [234, 20435.5]
  - - [576, 3904, 1, 256]
    - [246, 26226.3]
  - - [832, 3904, 1, 256]
    - [15, 25985.0]
  - - [1088, 3904, 1, 256]
    - [9, 28243.5]
  - - [1344, 3904, 1, 256]
    - [33, 28278.4]
  - - [1600, 3904, 1, 256]
    - [33, 30171.3]
  - - [1856, 3904, 1, 256]
    - [39, 30408.7]
  - - [2112, 3904, 1, 256]
    - [30, 31040.9]
  - - [2368, 3904, 1, 256]
    - [30, 30537.2]
  - - [2624, 3904, 1, 256]
    - [21, 30494.1]
  - - [2880, 3904, 1, 256]
    - [21, 30620.7]
  - - [3136, 3904, 1, 256]
    - [126, 29992.3]
  - - [3392, 3904, 1, 256]
    - [35, 30679.2]
  - - [3648, 3904, 1, 256]
    - [19, 30382.5]
  - - [3904, 3904, 1, 256]
    - [163, 31465.7]
  - - [3904, 64, 1, 512]
    - [8, 9476.02]
  - - [832, 320, 1, 512]
    - [120, 12982.4]
  - - [1088, 320, 1, 512]
    - [8, 16205.3]
  - - [1344, 320, 1, 512]
    - [79, 17616.1]
  - - [1600, 320, 1, 512]
    - [46, 17476.3]
  - - [1856, 320, 1, 512]
    - [22, 19618.5]
  - - [2112, 320, 1, 512]
    - [10, 20971.5]
  - - [2368, 320, 1, 512]
    - [8, 22169.9]
  - - [2624, 320, 1, 512]
    - [108, 22627.2]
  - - [2880, 320, 1, 512]
    - [123, 22469.5]
  - - [3136, 320, 1, 512]
    - [123, 23354.6]
  - - [3392, 320, 1, 512]
    - [10, 24699.8]
  - - [3648, 320, 1, 512]
    - [8, 25433.5]
  - - [3904, 320, 1, 512]
    - [10, 26107.4]
  - - [576, 576, 1, 512]
    - [8, 15442.7]
  - - [832, 576, 1, 512]
    - [10, 18175.3]
  - - [1088, 576, 1, 512]
    - [9, 20054.0]
  - - [1344, 576, 1, 512]
    - [8, 22649.2]
  - - [1600, 576, 1, 512]
    - [0, 23593.0]
  - - [1856, 576, 1, 512]
    - [5, 24879.8]
  - - [2112, 576, 1, 512]
    - [9, 25952.3]
  - - [2368, 576, 1, 512]
    - [6, 25864.9]
  - - [2624, 576, 1, 512]
    - [35, 26684.5]
  - - [2880, 576, 1, 512]
    - [116, 29801.6]
  - - [3136, 576, 1, 512]
    - [116, 30828.1]
  - - [3392, 576, 1, 512]
    - [136, 29860.9]
  - - [3648, 576, 1, 512]
    - [30, 30305.3]
  - - [3904, 576, 1, 512]
    - [42, 29521.4]
  - - [320, 832, 1, 512]
    - [108, 12392.3]
  - - [576, 832, 1, 512]
    - [10, 18175.3]
  - - [832, 832, 1, 512]
    - [16, 22151.2]
  - - [1088, 832, 1, 512]
    - [9, 24393.2]
  - - [1344, 832, 1, 512]
    - [9, 26023.7]
  - - [1600, 832, 1, 512]
    - [9, 29003.2]
  - - [1856, 832, 1, 512]
    - [35, 29282.5]
  - - [2112, 832, 1, 512]
    - [35, 30497.6]
  - - [2368, 832, 1, 512]
    - [26, 29238.6]
  - - [2624, 832, 1, 512]
    - [31, 31486.8]
  - - [2880, 832, 1, 512]
    - [178, 31457.3]
  - - [3136, 832, 1, 512]
    - [9, 31432.6]
  - - [3392, 832, 1, 512]
    - [16, 32470.5]
  - - [3648, 832, 1, 512]
    - [148, 31079.8]
  - - [3904, 832, 1, 512]
    - [35, 33260.8]
  - - [320, 1088, 1, 512]
    - [50, 14260.6]
  - - [576, 1088, 1, 512]
    - [3, 20054.0]
  - - [832, 1088, 1, 512]
    - [16, 25052.5]
  - - [1088, 1088, 1, 512]
    - [8, 25790.5]
  - - [1344, 1088, 1, 512]
    - [18, 27224.8]
  - - [1600, 1088, 1, 512]
    - [35, 30213.2]
  - - [1856, 1088, 1, 512]
    - [10, 29123.8]
  - - [2112, 1088, 1, 512]
    - [106, 30166.7]
  - - [2368, 1088, 1, 512]
    - [16, 31407.3]
  - - [2624, 1088, 1, 512]
    - [16, 32482.6]
  - - [2880, 1088, 1, 512]
    - [123, 33423.4]
  - - [3136, 1088, 1, 512]
    - [30, 32652.9]
  - - [3392, 1088, 1, 512]
    - [40, 32578.2]
  - - [3648, 1088, 1, 512]
    - [37, 32776.5]
  - - [3904, 1088, 1, 512]
    - [125, 33457.6]
  - - [320, 1344, 1, 512]
    - [244, 23677.5]
  - - [576, 1344, 1, 512]
    - [230, 26076.4]
  - - [832, 1344, 1, 512]
    - [8, 24892.3]
  - - [1088, 1344, 1, 512]
    - [18, 28795.5]
  - - [1344, 1344, 1, 512]
    - [172, 31350.6]
  - - [1600, 1344, 1, 512]
    - [30, 30164.5]
  - - [1856, 1344, 1, 512]
    - [7, 31150.4]
  - - [2112, 1344, 1, 512]
    - [33, 31941.2]
  - - [2368, 1344, 1, 512]
    - [195, 31640.5]
  - - [2624, 1344, 1, 512]
    - [199, 33131.2]
  - - [2880, 1344, 1, 512]
    - [33, 34169.1]
  - - [3136, 1344, 1, 512]
    - [16, 33456.9]
  - - [3392, 1344, 1, 512]
    - [30, 34074.9]
  - - [3648, 1344, 1, 512]
    - [21, 33695.2]
  - - [3904, 1344, 1, 512]
    - [51, 34222.3]
  - - [320, 1600, 1, 512]
    - [234, 22405.5]
  - - [576, 1600, 1, 512]
    - [246, 29217.3]
  - - [832, 1600, 1, 512]
    - [9, 27819.4]
  - - [1088, 1600, 1, 512]
    - [3, 27852.8]
  - - [1344, 1600, 1, 512]
    - [30, 31457.3]
  - - [1600, 1600, 1, 512]
    - [16, 31207.6]
  - - [1856, 1600, 1, 512]
    - [16, 34167.1]
  - - [2112, 1600, 1, 512]
    - [30, 34260.4]
  - - [2368, 1600, 1, 512]
    - [164, 35270.3]
  - - [2624, 1600, 1, 512]
    - [16, 34670.7]
  - - [2880, 1600, 1, 512]
    - [19, 34952.5]
  - - [3136, 1600, 1, 512]
    - [40, 34253.5]
  - - [3392, 1600, 1, 512]
    - [51, 34734.1]
  - - [3648, 1600, 1, 512]
    - [31, 34952.5]
  - - [3904, 1600, 1, 512]
    - [36, 35535.1]
  - - [320, 1856, 1, 512]
    - [234, 25553.5]
  - - [576, 1856, 1, 512]
    - [246, 29427.8]
  - - [832, 1856, 1, 512]
    - [15, 28750.0]
  - - [1088, 1856, 1, 512]
    - [10, 30408.7]
  - - [1344, 1856, 1, 512]
    - [12, 31535.0]
  - - [1600, 1856, 1, 512]
    - [33, 34555.3]
  - - [1856, 1856, 1, 512]
    - [31, 33917.4]
  - - [2112, 1856, 1, 512]
    - [15, 31856.7]
  - - [2368, 1856, 1, 512]
    - [16, 33838.3]
  - - [2624, 1856, 1, 512]
    - [33, 34632.1]
  - - [2880, 1856, 1, 512]
    - [3, 33997.3]
  - - [3136, 1856, 1, 512]
    - [164, 35059.4]
  - - [3392, 1856, 1, 512]
    - [19, 34846.7]
  - - [3648, 1856, 1, 512]
    - [31, 35016.1]
  - - [3904, 1856, 1, 512]
    - [28, 34998.7]
  - - [320, 2112, 1, 512]
    - [229, 27354.2]
  - - [576, 2112, 1, 512]
    - [230, 33042.7]
  - - [832, 2112, 1, 512]
    - [35, 29989.3]
  - - [1088, 2112, 1, 512]
    - [51, 30960.6]
  - - [1344, 2112, 1, 512]
    - [28, 33409.8]
  - - [1600, 2112, 1, 512]
    - [116, 32644.3]
  - - [1856, 2112, 1, 512]
    - [16, 34307.3]
  - - [2112, 2112, 1, 512]
    - [126, 33834.1]
  - - [2368, 2112, 1, 512]
    - [106, 33692.4]
  - - [2624, 2112, 1, 512]
    - [35, 34603.0]
  - - [2880, 2112, 1, 512]
    - [33, 35189.5]
  - - [3136, 2112, 1, 512]
    - [31, 34427.4]
  - - [3392, 2112, 1, 512]
    - [16, 34279.6]
  - - [3648, 2112, 1, 512]
    - [19, 34909.2]
  - - [3904, 2112, 1, 512]
    - [31, 35179.7]
  - - [320, 2368, 1, 512]
    - [234, 25693.6]
  - - [576, 2368, 1, 512]
    - [250, 27657.5]
  - - [832, 2368, 1, 512]
    - [10, 29238.6]
  - - [1088, 2368, 1, 512]
    - [106, 31407.3]
  - - [1344, 2368, 1, 512]
    - [123, 33254.8]
  - - [1600, 2368, 1, 512]
    - [33, 34333.9]
  - - [1856, 2368, 1, 512]
    - [28, 34094.6]
  - - [2112, 2368, 1, 512]
    - [33, 33254.8]
  - - [2368, 2368, 1, 512]
    - [35, 35227.0]
  - - [2624, 2368, 1, 512]
    - [19, 35348.7]
  - - [2880, 2368, 1, 512]
    - [33, 35449.3]
  - - [3136, 2368, 1, 512]
    - [35, 35205.0]
  - - [3392, 2368, 1, 512]
    - [30, 35452.7]
  - - [3648, 2368, 1, 512]
    - [3, 35812.9]
  - - [3904, 2368, 1, 512]
    - [31, 36131.8]
  - - [320, 2624, 1, 512]
    - [229, 25820.8]
  - - [576, 2624, 1, 512]
    - [250, 24684.2]
  - - [832, 2624, 1, 512]
    - [106, 27599.6]
  - - [1088, 2624, 1, 512]
    - [9, 33602.6]
  - - [1344, 2624, 1, 512]
    - [30, 35061.1]
  - - [1600, 2624, 1, 512]
    - [9, 34952.5]
  - - [1856, 2624, 1, 512]
    - [40, 33925.4]
  - - [2112, 2624, 1, 512]
    - [3, 34603.0]
  - - [2368, 2624, 1, 512]
    - [37, 35153.4]
  - - [2624, 2624, 1, 512]
    - [31, 34904.1]
  - - [2880, 2624, 1, 512]
    - [3, 35335.6]
  - - [3136, 2624, 1, 512]
    - [31, 35109.8]
  - - [3392, 2624, 1, 512]
    - [33, 34654.8]
  - - [3648, 2624, 1, 512]
    - [30, 36037.1]
  - - [3904, 2624, 1, 512]
    - [30, 35924.5]
  - - [320, 2880, 1, 512]
    - [230, 30541.0]
  - - [576, 2880, 1, 512]
    - [251, 25973.9]
  - - [832, 2880, 1, 512]
    - [32, 31457.3]
  - - [1088, 2880, 1, 512]
    - [123, 34134.5]
  - - [1344, 2880, 1, 512]
    - [33, 35076.3]
  - - [1600, 2880, 1, 512]
    - [30, 34952.5]
  - - [1856, 2880, 1, 512]
    - [116, 35313.3]
  - - [2112, 2880, 1, 512]
    - [30, 34411.8]
  - - [2368, 2880, 1, 512]
    - [33, 33900.6]
  - - [2624, 2880, 1, 512]
    - [18, 34701.8]
  - - [2880, 2880, 1, 512]
    - [30, 35989.3]
  - - [3136, 2880, 1, 512]
    - [30, 35299.4]
  - - [3392, 2880, 1, 512]
    - [30, 35347.8]
  - - [3648, 2880, 1, 512]
    - [31, 36102.0]
  - - [3904, 2880, 1, 512]
    - [35, 36434.7]
  - - [320, 3136, 1, 512]
    - [234, 28704.0]
  - - [576, 3136, 1, 512]
    - [248, 27121.5]
  - - [832, 3136, 1, 512]
    - [9, 31432.6]
  - - [1088, 3136, 1, 512]
    - [30, 33594.8]
  - - [1344, 3136, 1, 512]
    - [9, 33456.9]
  - - [1600, 3136, 1, 512]
    - [33, 35191.9]
  - - [1856, 3136, 1, 512]
    - [164, 35059.4]
  - - [2112, 3136, 1, 512]
    - [3, 34603.0]
  - - [2368, 3136, 1, 512]
    - [3, 34722.7]
  - - [2624, 3136, 1, 512]
    - [30, 35109.8]
  - - [2880, 3136, 1, 512]
    - [33, 35846.7]
  - - [3136, 3136, 1, 512]
    - [33, 34725.9]
  - - [3392, 3136, 1, 512]
    - [30, 35713.5]
  - - [3648, 3136, 1, 512]
    - [35, 36608.4]
  - - [3904, 3136, 1, 512]
    - [21, 34921.4]
  - - [320, 3392, 1, 512]
    - [229, 28795.1]
  - - [576, 3392, 1, 512]
    - [248, 28020.8]
  - - [832, 3392, 1, 512]
    - [16, 33603.2]
  - - [1088, 3392, 1, 512]
    - [129, 31232.0]
  - - [1344, 3392, 1, 512]
    - [19, 34325.4]
  - - [1600, 3392, 1, 512]
    - [35, 35173.8]
  - - [1856, 3392, 1, 512]
    - [163, 34846.7]
  - - [2112, 3392, 1, 512]
    - [30, 36137.1]
  - - [2368, 3392, 1, 512]
    - [30, 35452.7]
  - - [2624, 3392, 1, 512]
    - [30, 34654.8]
  - - [2880, 3392, 1, 512]
    - [30, 35223.3]
  - - [3136, 3392, 1, 512]
    - [30, 35596.8]
  - - [3392, 3392, 1, 512]
    - [30, 36030.0]
  - - [3648, 3392, 1, 512]
    - [18, 35793.8]
  - - [3904, 3392, 1, 512]
    - [30, 36257.2]
  - - [320, 3648, 1, 512]
    - [230, 31707.6]
  - - [576, 3648, 1, 512]
    - [230, 29515.5]
  - - [832, 3648, 1, 512]
    - [16, 33419.1]
  - - [1088, 3648, 1, 512]
    - [16, 33589.1]
  - - [1344, 3648, 1, 512]
    - [163, 34624.7]
  - - [1600, 3648, 1, 512]
    - [30, 36005.3]
  - - [1856, 3648, 1, 512]
    - [31, 33820.4]
  - - [2112, 3648, 1, 512]
    - [35, 36025.0]
  - - [2368, 3648, 1, 512]
    - [30, 35812.9]
  - - [2624, 3648, 1, 512]
    - [3, 35132.9]
  - - [2880, 3648, 1, 512]
    - [3, 36345.9]
  - - [3136, 3648, 1, 512]
    - [35, 35499.1]
  - - [3392, 3648, 1, 512]
    - [19, 36099.7]
  - - [3648, 3648, 1, 512]
    - [30, 36146.7]
  - - [3904, 3648, 1, 512]
    - [30, 36642.2]
  - - [64, 3904, 1, 512]
    - [240, 13829.9]
  - - [320, 3904, 1, 512]
    - [244, 25034.5]
  - - [576, 3904, 1, 512]
    - [246, 31286.3]
  - - [832, 3904, 1, 512]
    - [15, 31378.1]
  - - [1088, 3904, 1, 512]
    - [9, 33717.0]
  - - [1344, 3904, 1, 512]
    - [3, 33791.8]
  - - [1600, 3904, 1, 512]
    - [51, 34574.7]
  - - [1856, 3904, 1, 512]
    - [35, 34510.3]
  - - [2112, 3904, 1, 512]
    - [30, 35475.4]
  - - [2368, 3904, 1, 512]
    - [30, 35455.2]
  - - [2624, 3904, 1, 512]
    - [33, 34850.3]
  - - [2880, 3904, 1, 512]
    - [35, 35209.1]
  - - [3136, 3904, 1, 512]
    - [30, 35819.4]
  - - [3392, 3904, 1, 512]
    - [35, 35313.0]
  - - [3648, 3904, 1, 512]
    - [31, 36459.0]
  - - [3904, 3904, 1, 512]
    - [35, 35551.3]
  - - [2112, 64, 1, 1024]
    - [179, 8929.81]
  - - [2368, 64, 1, 1024]
    - [97, 10345.9]
  - - [2624, 64, 1, 1024]
    - [86, 10115.7]
  - - [2880, 64, 1, 1024]
    - [86, 10485.8]
  - - [3136, 64, 1, 1024]
    - [121, 11417.8]
  - - [3392, 64, 1, 1024]
    - [223, 11699.9]
  - - [3648, 64, 1, 1024]
    - [121, 11953.8]
  - - [3904, 64, 1, 1024]
    - [220, 12792.6]
  - - [576, 320, 1, 1024]
    - [10, 15728.6]
  - - [832, 320, 1, 1024]
    - [10, 19473.6]
  - - [1088, 320, 1, 1024]
    - [11, 21607.0]
  - - [1344, 320, 1, 1024]
    - [92, 21483.0]
  - - [1600, 320, 1, 1024]
    - [37, 23301.7]
  - - [1856, 320, 1, 1024]
    - [40, 25340.6]
  - - [2112, 320, 1, 1024]
    - [123, 25631.9]
  - - [2368, 320, 1, 1024]
    - [123, 26756.8]
  - - [2624, 320, 1, 1024]
    - [27, 27736.5]
  - - [2880, 320, 1, 1024]
    - [112, 29037.5]
  - - [3136, 320, 1, 1024]
    - [165, 28544.6]
  - - [3392, 320, 1, 1024]
    - [46, 30040.3]
  - - [3648, 320, 1, 1024]
    - [145, 30262.7]
  - - [3904, 320, 1, 1024]
    - [112, 31981.6]
  - - [320, 576, 1, 1024]
    - [8, 15728.6]
  - - [576, 576, 1, 1024]
    - [5, 22649.2]
  - - [832, 576, 1, 1024]
    - [184, 23938.2]
  - - [1088, 576, 1, 1024]
    - [3, 25669.1]
  - - [1344, 576, 1, 1024]
    - [11, 27814.9]
  - - [1600, 576, 1, 1024]
    - [33, 33112.9]
  - - [1856, 576, 1, 1024]
    - [30, 33173.1]
  - - [2112, 576, 1, 1024]
    - [135, 32356.1]
  - - [2368, 576, 1, 1024]
    - [5, 32481.5]
  - - [2624, 576, 1, 1024]
    - [35, 32243.7]
  - - [2880, 576, 1, 1024]
    - [5, 33637.5]
  - - [3136, 576, 1, 1024]
    - [5, 35916.3]
  - - [3392, 576, 1, 1024]
    - [30, 34494.5]
  - - [3648, 576, 1, 1024]
    - [37, 34986.6]
  - - [3904, 576, 1, 1024]
    - [0, 35425.7]
  - - [320, 832, 1, 1024]
    - [7, 20194.8]
  - - [576, 832, 1, 1024]
    - [7, 23368.3]
  - - [832, 832, 1, 1024]
    - [122, 27797.5]
  - - [1088, 832, 1, 1024]
    - [9, 32524.3]
  - - [1344, 832, 1, 1024]
    - [30, 35232.2]
  - - [1600, 832, 1, 1024]
    - [35, 35406.5]
  - - [1856, 832, 1, 1024]
    - [35, 36350.6]
  - - [2112, 832, 1, 1024]
    - [35, 35281.5]
  - - [2368, 832, 1, 1024]
    - [30, 33624.3]
  - - [2624, 832, 1, 1024]
    - [146, 35769.0]
  - - [2880, 832, 1, 1024]
    - [42, 35560.4]
  - - [3136, 832, 1, 1024]
    - [3, 36105.0]
  - - [3392, 832, 1, 1024]
    - [19, 35028.8]
  - - [3648, 832, 1, 1024]
    - [42, 35317.9]
  - - [3904, 832, 1, 1024]
    - [30, 34467.2]
  - - [320, 1088, 1, 1024]
    - [10, 23001.0]
  - - [576, 1088, 1, 1024]
    - [3, 26738.7]
  - - [832, 1088, 1, 1024]
    - [33, 32524.3]
  - - [1088, 1088, 1, 1024]
    - [42, 33209.7]
  - - [1344, 1088, 1, 1024]
    - [20, 34031.1]
  - - [1600, 1088, 1, 1024]
    - [33, 34280.4]
  - - [1856, 1088, 1, 1024]
    - [37, 33622.6]
  - - [2112, 1088, 1, 1024]
    - [37, 35119.5]
  - - [2368, 1088, 1, 1024]
    - [3, 34262.6]
  - - [2624, 1088, 1, 1024]
    - [123, 33602.6]
  - - [2880, 1088, 1, 1024]
    - [123, 36255.8]
  - - [3136, 1088, 1, 1024]
    - [37, 34764.7]
  - - [3392, 1088, 1, 1024]
    - [164, 36869.0]
  - - [3648, 1088, 1, 1024]
    - [37, 36288.2]
  - - [3904, 1088, 1, 1024]
    - [37, 34657.3]
  - - [320, 1344, 1, 1024]
    - [244, 28597.5]
  - - [576, 1344, 1, 1024]
    - [229, 29360.1]
  - - [832, 1344, 1, 1024]
    - [35, 34180.4]
  - - [1088, 1344, 1, 1024]
    - [19, 34822.5]
  - - [1344, 1344, 1, 1024]
    - [172, 36268.4]
  - - [1600, 1344, 1, 1024]
    - [37, 35805.0]
  - - [1856, 1344, 1, 1024]
    - [105, 34057.7]
  - - [2112, 1344, 1, 1024]
    - [0, 36561.7]
  - - [2368, 1344, 1, 1024]
    - [0, 36413.1]
  - - [2624, 1344, 1, 1024]
    - [0, 35579.3]
  - - [2880, 1344, 1, 1024]
    - [146, 36531.0]
  - - [3136, 1344, 1, 1024]
    - [6, 36116.6]
  - - [3392, 1344, 1, 1024]
    - [2, 36903.2]
  - - [3648, 1344, 1, 1024]
    - [0, 37748.7]
  - - [3904, 1344, 1, 1024]
    - [0, 37572.8]
  - - [320, 1600, 1, 1024]
    - [234, 26084.0]
  - - [576, 1600, 1, 1024]
    - [246, 33112.9]
  - - [832, 1600, 1, 1024]
    - [16, 34078.7]
  - - [1088, 1600, 1, 1024]
    - [35, 36379.2]
  - - [1344, 1600, 1, 1024]
    - [37, 35805.0]
  - - [1600, 1600, 1, 1024]
    - [9, 34267.2]
  - - [1856, 1600, 1, 1024]
    - [51, 36200.8]
  - - [2112, 1600, 1, 1024]
    - [3, 36044.8]
  - - [2368, 1600, 1, 1024]
    - [146, 36601.2]
  - - [2624, 1600, 1, 1024]
    - [3, 35976.2]
  - - [2880, 1600, 1, 1024]
    - [51, 37301.1]
  - - [3136, 1600, 1, 1024]
    - [2, 37641.2]
  - - [3392, 1600, 1, 1024]
    - [37, 37173.6]
  - - [3648, 1600, 1, 1024]
    - [145, 36780.8]
  - - [3904, 1600, 1, 1024]
    - [146, 37187.9]
  - - [320, 1856, 1, 1024]
    - [234, 29169.0]
  - - [576, 1856, 1, 1024]
    - [230, 31277.5]
  - - [832, 1856, 1, 1024]
    - [15, 34375.1]
  - - [1088, 1856, 1, 1024]
    - [30, 33898.2]
  - - [1344, 1856, 1, 1024]
    - [42, 36753.0]
  - - [1600, 1856, 1, 1024]
    - [146, 37083.8]
  - - [1856, 1856, 1, 1024]
    - [30, 36936.2]
  - - [2112, 1856, 1, 1024]
    - [2, 36161.7]
  - - [2368, 1856, 1, 1024]
    - [169, 36441.2]
  - - [2624, 1856, 1, 1024]
    - [33, 37216.6]
  - - [2880, 1856, 1, 1024]
    - [2, 37362.2]
  - - [3136, 1856, 1, 1024]
    - [144, 36453.2]
  - - [3392, 1856, 1, 1024]
    - [51, 36115.7]
  - - [3648, 1856, 1, 1024]
    - [2, 36977.0]
  - - [3904, 1856, 1, 1024]
    - [3, 36640.6]
  - - [64, 2112, 1, 1024]
    - [245, 15639.8]
  - - [320, 2112, 1, 1024]
    - [229, 31103.8]
  - - [576, 2112, 1, 1024]
    - [230, 34035.7]
  - - [832, 2112, 1, 1024]
    - [46, 34939.0]
  - - [1088, 2112, 1, 1024]
    - [146, 35383.5]
  - - [1344, 2112, 1, 1024]
    - [3, 37748.7]
  - - [1600, 2112, 1, 1024]
    - [30, 36811.7]
  - - [1856, 2112, 1, 1024]
    - [5, 36490.4]
  - - [2112, 2112, 1, 1024]
    - [2, 36835.5]
  - - [2368, 2112, 1, 1024]
    - [2, 36843.5]
  - - [2624, 2112, 1, 1024]
    - [0, 36612.2]
  - - [2880, 2112, 1, 1024]
    - [2, 37408.7]
  - - [3136, 2112, 1, 1024]
    - [0, 38426.0]
  - - [3392, 2112, 1, 1024]
    - [6, 37143.5]
  - - [3648, 2112, 1, 1024]
    - [6, 37127.0]
  - - [64, 2368, 1, 1024]
    - [245, 17339.6]
  - - [320, 2368, 1, 1024]
    - [234, 29559.9]
  - - [576, 2368, 1, 1024]
    - [251, 31888.2]
  - - [832, 2368, 1, 1024]
    - [124, 34486.5]
  - - [1088, 2368, 1, 1024]
    - [4, 34943.3]
  - - [1344, 2368, 1, 1024]
    - [2, 36210.8]
  - - [1600, 2368, 1, 1024]
    - [164, 37126.6]
  - - [1856, 2368, 1, 1024]
    - [105, 36003.9]
  - - [2112, 2368, 1, 1024]
    - [2, 36450.1]
  - - [2368, 2368, 1, 1024]
    - [2, 37165.1]
  - - [2624, 2368, 1, 1024]
    - [146, 36885.6]
  - - [2880, 2368, 1, 1024]
    - [2, 38371.0]
  - - [3136, 2368, 1, 1024]
    - [2, 38405.4]
  - - [64, 2624, 1, 1024]
    - [240, 14511.9]
  - - [320, 2624, 1, 1024]
    - [244, 28805.1]
  - - [576, 2624, 1, 1024]
    - [244, 26916.5]
  - - [832, 2624, 1, 1024]
    - [2, 34930.7]
  - - [1088, 2624, 1, 1024]
    - [33, 35870.3]
  - - [1344, 2624, 1, 1024]
    - [30, 38013.6]
  - - [1600, 2624, 1, 1024]
    - [2, 37061.7]
  - - [1856, 2624, 1, 1024]
    - [2, 36669.3]
  - - [2112, 2624, 1, 1024]
    - [2, 37959.2]
  - - [2368, 2624, 1, 1024]
    - [51, 36673.0]
  - - [2624, 2624, 1, 1024]
    - [30, 37304.9]
  - - [2880, 2624, 1, 1024]
    - [2, 38984.8]
  - - [64, 2880, 1, 1024]
    - [240, 15927.7]
  - - [320, 2880, 1, 1024]
    - [230, 31668.4]
  - - [576, 2880, 1, 1024]
    - [238, 29313.1]
  - - [832, 2880, 1, 1024]
    - [124, 35560.4]
  - - [1088, 2880, 1, 1024]
    - [105, 36052.2]
  - - [1344, 2880, 1, 1024]
    - [51, 37929.4]
  - - [1600, 2880, 1, 1024]
    - [0, 37900.3]
  - - [1856, 2880, 1, 1024]
    - [2, 37235.1]
  - - [2112, 2880, 1, 1024]
    - [2, 39050.4]
  - - [2368, 2880, 1, 1024]
    - [30, 37245.4]
  - - [2624, 2880, 1, 1024]
    - [37, 37115.1]
  - - [64, 3136, 1, 1024]
    - [241, 17055.7]
  - - [320, 3136, 1, 1024]
    - [234, 30223.7]
  - - [576, 3136, 1, 1024]
    - [250, 31192.0]
  - - [832, 3136, 1, 1024]
    - [33, 35862.7]
  - - [1088, 3136, 1, 1024]
    - [30, 36205.8]
  - - [1344, 3136, 1, 1024]
    - [2, 37859.1]
  - - [1600, 3136, 1, 1024]
    - [33, 37097.6]
  - - [1856, 3136, 1, 1024]
    - [0, 36790.8]
  - - [2112, 3136, 1, 1024]
    - [2, 38426.0]
  - - [2368, 3136, 1, 1024]
    - [2, 37184.7]
  - - [64, 3392, 1, 1024]
    - [240, 18524.8]
  - - [320, 3392, 1, 1024]
    - [229, 26880.1]
  - - [576, 3392, 1, 1024]
    - [248, 31090.6]
  - - [832, 3392, 1, 1024]
    - [33, 36580.7]
  - - [1088, 3392, 1, 1024]
    - [105, 34830.1]
  - - [1344, 3392, 1, 1024]
    - [2, 37953.3]
  - - [1600, 3392, 1, 1024]
    - [2, 36804.3]
  - - [1856, 3392, 1, 1024]
    - [2, 36733.0]
  - - [2112, 3392, 1, 1024]
    - [2, 38207.5]
  - - [64, 3648, 1, 1024]
    - [240, 20006.3]
  - - [320, 3648, 1, 1024]
    - [230, 29014.0]
  - - [576, 3648, 1, 1024]
    - [252, 31503.3]
  - - [832, 3648, 1, 1024]
    - [12, 34921.1]
  - - [1088, 3648, 1, 1024]
    - [2, 36288.2]
  - - [1344, 3648, 1, 1024]
    - [0, 36513.3]
  - - [1600, 3648, 1, 1024]
    - [164, 37239.1]
  - - [1856, 3648, 1, 1024]
    - [2, 37578.2]
  - - [2112, 3648, 1, 1024]
    - [2, 39056.9]
  - - [64, 3904, 1, 1024]
    - [240, 17000.2]
  - - [320, 3904, 1, 1024]
    - [238, 28271.0]
  - - [576, 3904, 1, 1024]
    - [246, 33615.7]
  - - [832, 3904, 1, 1024]
    - [30, 36550.4]
  - - [1088, 3904, 1, 1024]
    - [160, 35218.6]
  - - [1344, 3904, 1, 1024]
    - [2, 39361.9]
  - - [1600, 3904, 1, 1024]
    - [51, 37187.9]
  - - [1856, 3904, 1, 1024]
    - [35, 36550.4]
  - - [1088, 64, 1, 2048]
    - [68, 9200.41]
  - - [1344, 64, 1, 2048]
    - [86, 10676.4]
  - - [1600, 64, 1, 2048]
    - [77, 11983.7]
  - - [1856, 64, 1, 2048]
    - [121, 13901.1]
  - - [2112, 64, 1, 2048]
    - [165, 14963.5]
  - - [2368, 64, 1, 2048]
    - [156, 15518.9]
  - - [2624, 64, 1, 2048]
    - [165, 15996.9]
  - - [2880, 64, 1, 2048]
    - [165, 16412.5]
  - - [3136, 64, 1, 2048]
    - [165, 17126.7]
  - - [3392, 64, 1, 2048]
    - [165, 17783.8]
  - - [3648, 64, 1, 2048]
    - [220, 18751.0]
  - - [3904, 64, 1, 2048]
    - [112, 17954.6]
  - - [320, 320, 1, 2048]
    - [181, 14463.1]
  - - [576, 320, 1, 2048]
    - [11, 21570.7]
  - - [832, 320, 1, 2048]
    - [7, 26598.0]
  - - [1088, 320, 1, 2048]
    - [87, 30341.8]
  - - [1344, 320, 1, 2048]
    - [46, 29857.8]
  - - [1600, 320, 1, 2048]
    - [37, 31775.0]
  - - [1856, 320, 1, 2048]
    - [37, 34752.8]
  - - [2112, 320, 1, 2048]
    - [37, 32567.5]
  - - [2368, 320, 1, 2048]
    - [37, 35675.7]
  - - [2624, 320, 1, 2048]
    - [112, 33391.5]
  - - [2880, 320, 1, 2048]
    - [119, 36296.9]
  - - [3136, 320, 1, 2048]
    - [50, 33970.4]
  - - [3392, 320, 1, 2048]
    - [140, 35285.4]
  - - [3648, 320, 1, 2048]
    - [119, 36223.5]
  - - [3904, 320, 1, 2048]
    - [119, 37080.1]
  - - [320, 576, 1, 2048]
    - [10, 20971.5]
  - - [576, 576, 1, 2048]
    - [5, 30885.3]
  - - [832, 576, 1, 2048]
    - [136, 34437.4]
  - - [1088, 576, 1, 2048]
    - [30, 34688.0]
  - - [1344, 576, 1, 2048]
    - [106, 34095.6]
  - - [1600, 576, 1, 2048]
    - [33, 39321.6]
  - - [1856, 576, 1, 2048]
    - [5, 38077.0]
  - - [2112, 576, 1, 2048]
    - [135, 38329.5]
  - - [2368, 576, 1, 2048]
    - [0, 39343.8]
  - - [2624, 576, 1, 2048]
    - [119, 35376.0]
  - - [2880, 576, 1, 2048]
    - [5, 37129.9]
  - - [3136, 576, 1, 2048]
    - [0, 39565.5]
  - - [3392, 576, 1, 2048]
    - [184, 37571.5]
  - - [3648, 576, 1, 2048]
    - [0, 38252.1]
  - - [3904, 576, 1, 2048]
    - [0, 40046.5]
  - - [320, 832, 1, 2048]
    - [7, 26598.0]
  - - [576, 832, 1, 2048]
    - [46, 32179.3]
  - - [832, 832, 1, 2048]
    - [51, 35890.5]
  - - [1088, 832, 1, 2048]
    - [33, 37834.3]
  - - [1344, 832, 1, 2048]
    - [30, 39146.8]
  - - [1600, 832, 1, 2048]
    - [2, 37865.2]
  - - [1856, 832, 1, 2048]
    - [35, 37205.9]
  - - [2112, 832, 1, 2048]
    - [2, 38905.0]
  - - [2368, 832, 1, 2048]
    - [2, 36026.1]
  - - [2624, 832, 1, 2048]
    - [2, 38711.1]
  - - [2880, 832, 1, 2048]
    - [5, 38041.4]
  - - [3136, 832, 1, 2048]
    - [2, 39435.7]
  - - [3392, 832, 1, 2048]
    - [119, 37900.0]
  - - [3648, 832, 1, 2048]
    - [0, 37902.2]
  - - [3904, 832, 1, 2048]
    - [0, 37904.1]
  - - [64, 1088, 1, 2048]
    - [183, 10969.7]
  - - [320, 1088, 1, 2048]
    - [47, 29709.7]
  - - [576, 1088, 1, 2048]
    - [30, 34225.5]
  - - [832, 1088, 1, 2048]
    - [33, 39029.1]
  - - [1088, 1088, 1, 2048]
    - [7, 38178.1]
  - - [1344, 1088, 1, 2048]
    - [146, 37434.2]
  - - [1600, 1088, 1, 2048]
    - [2, 37927.2]
  - - [1856, 1088, 1, 2048]
    - [0, 36598.1]
  - - [2112, 1088, 1, 2048]
    - [4, 38573.8]
  - - [2368, 1088, 1, 2048]
    - [2, 38374.1]
  - - [2624, 1088, 1, 2048]
    - [2, 38466.2]
  - - [2880, 1088, 1, 2048]
    - [2, 40233.8]
  - - [3136, 1088, 1, 2048]
    - [2, 38499.8]
  - - [3392, 1088, 1, 2048]
    - [2, 37602.7]
  - - [64, 1344, 1, 2048]
    - [253, 13195.6]
  - - [320, 1344, 1, 2048]
    - [244, 32382.5]
  - - [576, 1344, 1, 2048]
    - [230, 30401.7]
  - - [832, 1344, 1, 2048]
    - [30, 38168.2]
  - - [1088, 1344, 1, 2048]
    - [136, 36972.0]
  - - [1344, 1344, 1, 2048]
    - [2, 39565.5]
  - - [1600, 1344, 1, 2048]
    - [2, 38801.9]
  - - [1856, 1344, 1, 2048]
    - [141, 38702.0]
  - - [2112, 1344, 1, 2048]
    - [0, 41672.4]
  - - [2368, 1344, 1, 2048]
    - [0, 41383.8]
  - - [2624, 1344, 1, 2048]
    - [2, 39684.6]
  - - [2880, 1344, 1, 2048]
    - [5, 39341.1]
  - - [64, 1600, 1, 2048]
    - [254, 17476.3]
  - - [320, 1600, 1, 2048]
    - [229, 26715.3]
  - - [576, 1600, 1, 2048]
    - [250, 33435.6]
  - - [832, 1600, 1, 2048]
    - [2, 37865.2]
  - - [1088, 1600, 1, 2048]
    - [2, 37927.2]
  - - [1344, 1600, 1, 2048]
    - [2, 38973.6]
  - - [1600, 1600, 1, 2048]
    - [2, 39126.0]
  - - [1856, 1600, 1, 2048]
    - [0, 38614.2]
  - - [2112, 1600, 1, 2048]
    - [0, 38879.8]
  - - [2368, 1600, 1, 2048]
    - [51, 38992.3]
  - - [64, 1856, 1, 2048]
    - [255, 16893.7]
  - - [320, 1856, 1, 2048]
    - [232, 28687.5]
  - - [576, 1856, 1, 2048]
    - [229, 33248.7]
  - - [832, 1856, 1, 2048]
    - [43, 38102.5]
  - - [1088, 1856, 1, 2048]
    - [2, 36924.9]
  - - [1344, 1856, 1, 2048]
    - [2, 38997.4]
  - - [1600, 1856, 1, 2048]
    - [33, 38492.0]
  - - [1856, 1856, 1, 2048]
    - [30, 39745.5]
  - - [64, 2112, 1, 2048]
    - [245, 18895.8]
  - - [320, 2112, 1, 2048]
    - [229, 28686.4]
  - - [576, 2112, 1, 2048]
    - [230, 35065.7]
  - - [832, 2112, 1, 2048]
    - [5, 37881.2]
  - - [1088, 2112, 1, 2048]
    - [6, 39546.3]
  - - [1344, 2112, 1, 2048]
    - [2, 41523.6]
  - - [1600, 2112, 1, 2048]
    - [30, 39210.2]
  - - [64, 2368, 1, 2048]
    - [245, 19832.5]
  - - [320, 2368, 1, 2048]
    - [229, 29034.5]
  - - [576, 2368, 1, 2048]
    - [250, 34444.0]
  - - [832, 2368, 1, 2048]
    - [124, 37886.6]
  - - [1088, 2368, 1, 2048]
    - [2, 38514.1]
  - - [1344, 2368, 1, 2048]
    - [0, 40358.8]
  - - [1600, 2368, 1, 2048]
    - [51, 38894.5]
  - - [64, 2624, 1, 2048]
    - [255, 18540.9]
  - - [320, 2624, 1, 2048]
    - [244, 30790.8]
  - - [576, 2624, 1, 2048]
    - [250, 31078.3]
  - - [832, 2624, 1, 2048]
    - [2, 39220.4]
  - - [1088, 2624, 1, 2048]
    - [44, 38340.1]
  - - [1344, 2624, 1, 2048]
    - [2, 40576.4]
  - - [64, 2880, 1, 2048]
    - [255, 19017.0]
  - - [320, 2880, 1, 2048]
    - [244, 33614.2]
  - - [576, 2880, 1, 2048]
    - [250, 32081.1]
  - - [832, 2880, 1, 2048]
    - [124, 38189.4]
  - - [1088, 2880, 1, 2048]
    - [2, 40744.7]
  - - [1344, 2880, 1, 2048]
    - [2, 39935.7]
  - - [64, 3136, 1, 2048]
    - [256, 21025.2]
  - - [320, 3136, 1, 2048]
    - [232, 28328.2]
  - - [576, 3136, 1, 2048]
    - [250, 34095.6]
  - - [832, 3136, 1, 2048]
    - [2, 39435.7]
  - - [1088, 3136, 1, 2048]
    - [30, 39146.8]
  - - [64, 3392, 1, 2048]
    - [257, 20922.2]
  - - [320, 3392, 1, 2048]
    - [244, 28192.5]
  - - [576, 3392, 1, 2048]
    - [248, 34946.4]
  - - [832, 3392, 1, 2048]
    - [33, 38403.7]
  - - [1088, 3392, 1, 2048]
    - [2, 37790.7]
  - - [64, 3648, 1, 2048]
    - [244, 22554.3]
  - - [320, 3648, 1, 2048]
    - [244, 30769.0]
  - - [576, 3648, 1, 2048]
    - [229, 34153.6]
  - - [832, 3648, 1, 2048]
    - [2, 38370.1]
  - - [64, 3904, 1, 2048]
    - [256, 20633.3]
  - - [320, 3904, 1, 2048]
    - [244, 31881.9]
  - - [576, 3904, 1, 2048]
    - [229, 35209.1]
  - - [832, 3904, 1, 2048]
    - [2, 40562.0]
  - - [576, 64, 1, 4096]
    - [58, 10785.4]
  - - [832, 64, 1, 4096]
    - [121, 12463.1]
  - - [1088, 64, 1, 4096]
    - [152, 14626.3]
  - - [1344, 64, 1, 4096]
    - [26, 14992.4]
  - - [1600, 64, 1, 4096]
    - [220, 18641.4]
  - - [1856, 64, 1, 4096]
    - [62, 19858.7]
  - - [2112, 64, 1, 4096]
    - [27, 20505.5]
  - - [2368, 64, 1, 4096]
    - [165, 22991.0]
  - - [2624, 64, 1, 4096]
    - [90, 21165.1]
  - - [2880, 64, 1, 4096]
    - [87, 22536.6]
  - - [3136, 64, 1, 4096]
    - [46, 23828.5]
  - - [3392, 64, 1, 4096]
    - [165, 25405.5]
  - - [3648, 64, 1, 4096]
    - [165, 26200.0]
  - - [3904, 64, 1, 4096]
    - [27, 23526.7]
  - - [320, 320, 1, 4096]
    - [181, 20460.0]
  - - [576, 320, 1, 4096]
    - [184, 28489.6]
  - - [832, 320, 1, 4096]
    - [120, 32552.8]
  - - [1088, 320, 1, 4096]
    - [87, 37040.6]
  - - [1344, 320, 1, 4096]
    - [115, 35588.0]
  - - [1600, 320, 1, 4096]
    - [111, 35848.8]
  - - [1856, 320, 1, 4096]
    - [37, 39556.0]
  - - [2112, 320, 1, 4096]
    - [37, 35719.2]
  - - [2368, 320, 1, 4096]
    - [37, 38318.3]
  - - [2624, 320, 1, 4096]
    - [112, 35095.2]
  - - [2880, 320, 1, 4096]
    - [119, 39117.9]
  - - [3136, 320, 1, 4096]
    - [111, 37367.4]
  - - [3392, 320, 1, 4096]
    - [1, 36743.5]
  - - [3648, 320, 1, 4096]
    - [124, 38716.7]
  - - [3904, 320, 1, 4096]
    - [112, 35783.6]
  - - [64, 576, 1, 4096]
    - [58, 11184.8]
  - - [320, 576, 1, 4096]
    - [25, 27962.0]
  - - [576, 576, 1, 4096]
    - [5, 38827.3]
  - - [832, 576, 1, 4096]
    - [135, 39258.7]
  - - [1088, 576, 1, 4096]
    - [30, 37473.2]
  - - [1344, 576, 1, 4096]
    - [4, 37086.5]
  - - [1600, 576, 1, 4096]
    - [0, 42653.9]
  - - [1856, 576, 1, 4096]
    - [5, 41116.0]
  - - [2112, 576, 1, 4096]
    - [2, 39862.7]
  - - [2368, 576, 1, 4096]
    - [0, 42647.4]
  - - [2624, 576, 1, 4096]
    - [112, 37980.3]
  - - [2880, 576, 1, 4096]
    - [2, 39735.5]
  - - [3136, 576, 1, 4096]
    - [0, 41449.6]
  - - [64, 832, 1, 4096]
    - [150, 13631.5]
  - - [320, 832, 1, 4096]
    - [7, 34078.7]
  - - [576, 832, 1, 4096]
    - [111, 37389.2]
  - - [832, 832, 1, 4096]
    - [50, 37554.3]
  - - [1088, 832, 1, 4096]
    - [43, 40083.9]
  - - [1344, 832, 1, 4096]
    - [30, 40532.6]
  - - [1600, 832, 1, 4096]
    - [2, 41307.5]
  - - [1856, 832, 1, 4096]
    - [107, 39043.3]
  - - [2112, 832, 1, 4096]
    - [2, 40097.1]
  - - [64, 1088, 1, 4096]
    - [153, 16297.9]
  - - [320, 1088, 1, 4096]
    - [136, 38542.3]
  - - [576, 1088, 1, 4096]
    - [30, 37473.2]
  - - [832, 1088, 1, 4096]
    - [33, 40083.9]
  - - [1088, 1088, 1, 4096]
    - [0, 38481.1]
  - - [1344, 1088, 1, 4096]
    - [50, 39275.2]
  - - [1600, 1088, 1, 4096]
    - [0, 41096.9]
  - - [64, 1344, 1, 4096]
    - [253, 17398.6]
  - - [320, 1344, 1, 4096]
    - [244, 32412.3]
  - - [576, 1344, 1, 4096]
    - [230, 32224.5]
  - - [832, 1344, 1, 4096]
    - [30, 40712.7]
  - - [1088, 1344, 1, 4096]
    - [51, 39404.4]
  - - [1344, 1344, 1, 4096]
    - [0, 41800.9]
  - - [64, 1600, 1, 4096]
    - [254, 18808.5]
  - - [320, 1600, 1, 4096]
    - [229, 27324.5]
  - - [576, 1600, 1, 4096]
    - [250, 36037.0]
  - - [832, 1600, 1, 4096]
    - [2, 42432.6]
  - - [1088, 1600, 1, 4096]
    - [2, 40170.8]
  - - [64, 1856, 1, 4096]
    - [255, 19899.4]
  - - [320, 1856, 1, 4096]
    - [246, 30427.7]
  - - [576, 1856, 1, 4096]
    - [246, 33072.9]
  - - [832, 1856, 1, 4096]
    - [43, 39408.2]
  - - [64, 2112, 1, 4096]
    - [245, 20243.1]
  - - [320, 2112, 1, 4096]
    - [229, 30073.2]
  - - [576, 2112, 1, 4096]
    - [229, 36318.0]
  - - [832, 2112, 1, 4096]
    - [5, 41011.0]
  - - [64, 2368, 1, 4096]
    - [245, 21819.2]
  - - [320, 2368, 1, 4096]
    - [244, 30929.6]
  - - [576, 2368, 1, 4096]
    - [250, 35539.5]
  - - [64, 2624, 1, 4096]
    - [257, 20844.4]
  - - [320, 2624, 1, 4096]
    - [244, 33246.3]
  - - [576, 2624, 1, 4096]
    - [250, 31361.7]
  - - [64, 2880, 1, 4096]
    - [255, 22671.9]
  - - [320, 2880, 1, 4096]
    - [244, 35612.0]
  - - [576, 2880, 1, 4096]
    - [250, 33161.4]
  - - [64, 3136, 1, 4096]
    - [256, 22899.3]
  - - [320, 3136, 1, 4096]
    - [234, 27820.1]
  - - [576, 3136, 1, 4096]
    - [250, 35545.3]
  - - [64, 3392, 1, 4096]
    - [257, 22397.8]
  - - [320, 3392, 1, 4096]
    - [250, 29249.8]
  - - [64, 3648, 1, 4096]
    - [244, 24583.6]
  - - [320, 3648, 1, 4096]
    - [258, 30611.4]
  - - [64, 3904, 1, 4096]
    - [251, 19219.0]
  - - [320, 3904, 1, 4096]
    - [248, 26769.8]
  - - [1984, 1088, 1, 64]
    - [22, 8912.9]
  - - [1728, 1216, 1, 64]
    - [22, 9274.47]
  - - [1856, 1216, 1, 64]
    - [22, 9318.8]
  - - [1984, 1216, 1, 64]
    - [22, 9082.52]
  - - [1472, 1344, 1, 64]
    - [22, 8441.04]
  - - [1728, 1344, 1, 64]
    - [22, 9589.4]
  - - [1984, 1344, 1, 64]
    - [9, 9751.76]
  - - [1344, 1472, 1, 64]
    - [22, 9043.97]
  - - [1472, 1472, 1, 64]
    - [22, 9244.95]
  - - [1600, 1472, 1, 64]
    - [14, 9420.8]
  - - [1728, 1472, 1, 64]
    - [22, 9302.37]
  - - [1856, 1472, 1, 64]
    - [9, 9991.43]
  - - [1984, 1472, 1, 64]
    - [9, 10103.2]
  - - [1472, 1600, 1, 64]
    - [22, 9724.7]
  - - [1728, 1600, 1, 64]
    - [9, 10111.3]
  - - [1984, 1600, 1, 64]
    - [22, 10981.7]
  - - [1216, 1728, 1, 64]
    - [22, 9274.47]
  - - [1344, 1728, 1, 64]
    - [22, 9589.4]
  - - [1472, 1728, 1, 64]
    - [9, 9302.37]
  - - [1600, 1728, 1, 64]
    - [9, 10408.7]
  - - [1728, 1728, 1, 64]
    - [127, 10616.8]
  - - [1856, 1728, 1, 64]
    - [22, 10803.1]
  - - [1984, 1728, 1, 64]
    - [22, 11252.0]
  - - [1216, 1856, 1, 64]
    - [22, 9961.47]
  - - [1472, 1856, 1, 64]
    - [38, 10285.3]
  - - [1728, 1856, 1, 64]
    - [163, 10803.1]
  - - [1984, 1856, 1, 64]
    - [125, 11222.3]
  - - [1088, 1984, 1, 64]
    - [22, 8634.37]
  - - [1216, 1984, 1, 64]
    - [22, 9082.52]
  - - [1344, 1984, 1, 64]
    - [9, 9751.76]
  - - [1472, 1984, 1, 64]
    - [9, 10383.8]
  - - [1600, 1984, 1, 64]
    - [98, 10692.7]
  - - [1728, 1984, 1, 64]
    - [22, 11860.2]
  - - [1856, 1984, 1, 64]
    - [22, 11222.3]
  - - [1984, 1984, 1, 64]
    - [22, 11996.2]
  - - [1728, 320, 1, 256]
    - [38, 11796.5]
  - - [1984, 320, 1, 256]
    - [202, 14133.0]
  - - [1216, 448, 1, 256]
    - [203, 12678.2]
  - - [1344, 448, 1, 256]
    - [193, 12845.1]
  - - [1472, 448, 1, 256]
    - [8, 12986.2]
  - - [1600, 448, 1, 256]
    - [38, 14115.4]
  - - [1728, 448, 1, 256]
    - [11, 15854.5]
  - - [1856, 448, 1, 256]
    - [9, 14680.1]
  - - [1984, 448, 1, 256]
    - [22, 16252.9]
  - - [960, 576, 1, 256]
    - [22, 12309.4]
  - - [1216, 576, 1, 256]
    - [38, 14942.2]
  - - [1472, 576, 1, 256]
    - [9, 15503.9]
  - - [1728, 576, 1, 256]
    - [9, 16986.9]
  - - [1984, 576, 1, 256]
    - [22, 18874.4]
  - - [704, 704, 1, 256]
    - [11, 11534.3]
  - - [832, 704, 1, 256]
    - [7, 13038.8]
  - - [960, 704, 1, 256]
    - [31, 13308.8]
  - - [1088, 704, 1, 256]
    - [9, 15083.4]
  - - [1216, 704, 1, 256]
    - [9, 16857.9]
  - - [1344, 704, 1, 256]
    - [9, 16148.1]
  - - [1472, 704, 1, 256]
    - [22, 18949.3]
  - - [1600, 704, 1, 256]
    - [22, 18603.8]
  - - [1728, 704, 1, 256]
    - [8, 18874.4]
  - - [1856, 704, 1, 256]
    - [9, 19114.0]
  - - [1984, 704, 1, 256]
    - [38, 19327.8]
  - - [704, 832, 1, 256]
    - [7, 13631.5]
  - - [960, 832, 1, 256]
    - [10, 16357.8]
  - - [1216, 832, 1, 256]
    - [9, 17266.6]
  - - [1472, 832, 1, 256]
    - [10, 19595.3]
  - - [1728, 832, 1, 256]
    - [163, 18874.4]
  - - [1984, 832, 1, 256]
    - [11, 20122.7]
  - - [576, 960, 1, 256]
    - [7, 12309.4]
  - - [704, 960, 1, 256]
    - [106, 13841.2]
  - - [832, 960, 1, 256]
    - [8, 15728.6]
  - - [960, 960, 1, 256]
    - [9, 16852.1]
  - - [1088, 960, 1, 256]
    - [9, 17825.8]
  - - [1216, 960, 1, 256]
    - [8, 18677.8]
  - - [1344, 960, 1, 256]
    - [10, 19429.5]
  - - [1472, 960, 1, 256]
    - [123, 19554.5]
  - - [1600, 960, 1, 256]
    - [123, 20164.9]
  - - [1728, 960, 1, 256]
    - [163, 20715.8]
  - - [1856, 960, 1, 256]
    - [3, 20733.2]
  - - [1984, 960, 1, 256]
    - [164, 21199.5]
  - - [704, 1088, 1, 256]
    - [10, 15083.4]
  - - [960, 1088, 1, 256]
    - [9, 17825.8]
  - - [1216, 1088, 1, 256]
    - [9, 19922.9]
  - - [1472, 1088, 1, 256]
    - [10, 20499.7]
  - - [1728, 1088, 1, 256]
    - [188, 20480.7]
  - - [1984, 1088, 1, 256]
    - [22, 22104.0]
  - - [448, 1216, 1, 256]
    - [234, 16904.3]
  - - [576, 1216, 1, 256]
    - [246, 21094.9]
  - - [704, 1216, 1, 256]
    - [22, 16233.5]
  - - [832, 1216, 1, 256]
    - [9, 17861.9]
  - - [960, 1216, 1, 256]
    - [163, 19280.3]
  - - [1088, 1216, 1, 256]
    - [9, 19353.7]
  - - [1216, 1216, 1, 256]
    - [35, 18926.8]
  - - [1344, 1216, 1, 256]
    - [10, 21455.5]
  - - [1472, 1216, 1, 256]
    - [3, 20365.7]
  - - [1600, 1216, 1, 256]
    - [10, 21655.4]
  - - [1728, 1216, 1, 256]
    - [8, 21955.9]
  - - [1856, 1216, 1, 256]
    - [22, 23110.6]
  - - [1984, 1216, 1, 256]
    - [12, 22458.6]
  - - [448, 1344, 1, 256]
    - [230, 19511.5]
  - - [704, 1344, 1, 256]
    - [9, 17301.5]
  - - [960, 1344, 1, 256]
    - [9, 20018.3]
  - - [1216, 1344, 1, 256]
    - [10, 20408.9]
  - - [1472, 1344, 1, 256]
    - [10, 21102.6]
  - - [1728, 1344, 1, 256]
    - [30, 22435.6]
  - - [1984, 1344, 1, 256]
    - [106, 25282.3]
  - - [448, 1472, 1, 256]
    - [252, 19404.7]
  - - [576, 1472, 1, 256]
    - [246, 21176.1]
  - - [704, 1472, 1, 256]
    - [9, 18295.8]
  - - [832, 1472, 1, 256]
    - [9, 19595.3]
  - - [960, 1472, 1, 256]
    - [9, 20671.9]
  - - [1088, 1472, 1, 256]
    - [11, 20499.7]
  - - [1216, 1472, 1, 256]
    - [3, 20828.5]
  - - [1344, 1472, 1, 256]
    - [11, 21551.6]
  - - [1472, 1472, 1, 256]
    - [22, 22640.7]
  - - [1600, 1472, 1, 256]
    - [15, 23644.4]
  - - [1728, 1472, 1, 256]
    - [9, 23255.9]
  - - [1856, 1472, 1, 256]
    - [9, 24540.4]
  - - [1984, 1472, 1, 256]
    - [161, 25343.5]
  - - [448, 1600, 1, 256]
    - [232, 18820.6]
  - - [704, 1600, 1, 256]
    - [22, 18603.8]
  - - [960, 1600, 1, 256]
    - [9, 20695.6]
  - - [1216, 1600, 1, 256]
    - [10, 21655.4]
  - - [1472, 1600, 1, 256]
    - [106, 23189.7]
  - - [1728, 1600, 1, 256]
    - [16, 25278.2]
  - - [1984, 1600, 1, 256]
    - [163, 26214.4]
  - - [320, 1728, 1, 256]
    - [234, 18148.4]
  - - [448, 1728, 1, 256]
    - [230, 21309.8]
  - - [576, 1728, 1, 256]
    - [230, 23376.5]
  - - [704, 1728, 1, 256]
    - [7, 17795.8]
  - - [832, 1728, 1, 256]
    - [19, 18874.4]
  - - [960, 1728, 1, 256]
    - [10, 20715.8]
  - - [1088, 1728, 1, 256]
    - [7, 20925.9]
  - - [1216, 1728, 1, 256]
    - [10, 22890.2]
  - - [1344, 1728, 1, 256]
    - [15, 23781.7]
  - - [1472, 1728, 1, 256]
    - [10, 23678.8]
  - - [1600, 1728, 1, 256]
    - [9, 26214.4]
  - - [1728, 1728, 1, 256]
    - [9, 25480.4]
  - - [1856, 1728, 1, 256]
    - [163, 26064.6]
  - - [1984, 1728, 1, 256]
    - [116, 27004.9]
  - - [448, 1856, 1, 256]
    - [246, 20766.9]
  - - [704, 1856, 1, 256]
    - [9, 20272.5]
  - - [960, 1856, 1, 256]
    - [35, 20733.2]
  - - [1216, 1856, 1, 256]
    - [106, 23110.6]
  - - [1472, 1856, 1, 256]
    - [9, 24978.6]
  - - [1728, 1856, 1, 256]
    - [163, 26485.0]
  - - [1984, 1856, 1, 256]
    - [35, 26933.4]
  - - [320, 1984, 1, 256]
    - [230, 18898.8]
  - - [448, 1984, 1, 256]
    - [246, 21365.4]
  - - [576, 1984, 1, 256]
    - [230, 24481.4]
  - - [704, 1984, 1, 256]
    - [9, 20432.3]
  - - [832, 1984, 1, 256]
    - [10, 19654.7]
  - - [960, 1984, 1, 256]
    - [3, 22163.1]
  - - [1088, 1984, 1, 256]
    - [11, 22555.1]
  - - [1216, 1984, 1, 256]
    - [106, 23306.1]
  - - [1344, 1984, 1, 256]
    - [9, 24379.4]
  - - [1472, 1984, 1, 256]
    - [16, 25780.5]
  - - [1600, 1984, 1, 256]
    - [162, 25798.3]
  - - [1728, 1984, 1, 256]
    - [163, 27862.2]
  - - [1856, 1984, 1, 256]
    - [35, 27725.6]
  - - [1984, 1984, 1, 256]
    - [40, 27991.2]
  - - [1344, 192, 1, 512]
    - [10, 12582.9]
  - - [1472, 192, 1, 512]
    - [8, 13154.9]
  - - [1600, 192, 1, 512]
    - [8, 14298.8]
  - - [1728, 192, 1, 512]
    - [11, 14771.2]
  - - [1856, 192, 1, 512]
    - [8, 15204.4]
  - - [1984, 192, 1, 512]
    - [8, 16252.9]
  - - [960, 320, 1, 512]
    - [101, 13677.1]
  - - [1216, 320, 1, 512]
    - [8, 17324.3]
  - - [1472, 320, 1, 512]
    - [188, 17226.6]
  - - [1728, 320, 1, 512]
    - [110, 18265.5]
  - - [1984, 320, 1, 512]
    - [194, 20971.5]
  - - [576, 448, 1, 512]
    - [225, 12582.9]
  - - [704, 448, 1, 512]
    - [8, 15379.1]
  - - [832, 448, 1, 512]
    - [8, 16594.9]
  - - [960, 448, 1, 512]
    - [4, 16938.5]
  - - [1088, 448, 1, 512]
    - [10, 18486.0]
  - - [1216, 448, 1, 512]
    - [7, 18594.7]
  - - [1344, 448, 1, 512]
    - [177, 19267.6]
  - - [1472, 448, 1, 512]
    - [9, 20463.1]
  - - [1600, 448, 1, 512]
    - [8, 20971.5]
  - - [1728, 448, 1, 512]
    - [14, 24021.9]
  - - [1856, 448, 1, 512]
    - [16, 23651.2]
  - - [1984, 448, 1, 512]
    - [22, 24599.0]
  - - [448, 576, 1, 512]
    - [7, 12582.9]
  - - [704, 576, 1, 512]
    - [10, 18053.7]
  - - [960, 576, 1, 512]
    - [9, 18874.4]
  - - [1216, 576, 1, 512]
    - [9, 21094.9]
  - - [1472, 576, 1, 512]
    - [9, 23465.4]
  - - [1728, 576, 1, 512]
    - [9, 25480.4]
  - - [1984, 576, 1, 512]
    - [9, 26004.7]
  - - [448, 704, 1, 512]
    - [8, 15379.1]
  - - [576, 704, 1, 512]
    - [8, 18053.7]
  - - [704, 704, 1, 512]
    - [11, 17500.4]
  - - [832, 704, 1, 512]
    - [7, 20682.3]
  - - [960, 704, 1, 512]
    - [3, 21626.9]
  - - [1088, 704, 1, 512]
    - [10, 23767.7]
  - - [1216, 704, 1, 512]
    - [9, 23068.7]
  - - [1344, 704, 1, 512]
    - [9, 24222.1]
  - - [1472, 704, 1, 512]
    - [9, 25265.7]
  - - [1600, 704, 1, 512]
    - [9, 25631.9]
  - - [1728, 704, 1, 512]
    - [9, 27080.6]
  - - [1856, 704, 1, 512]
    - [9, 25730.4]
  - - [1984, 704, 1, 512]
    - [11, 25092.2]
  - - [448, 832, 1, 512]
    - [8, 16594.9]
  - - [704, 832, 1, 512]
    - [7, 20682.3]
  - - [960, 832, 1, 512]
    - [11, 24784.5]
  - - [1216, 832, 1, 512]
    - [9, 25899.8]
  - - [1472, 832, 1, 512]
    - [9, 25081.9]
  - - [1728, 832, 1, 512]
    - [18, 27777.4]
  - - [1984, 832, 1, 512]
    - [10, 28649.2]
  - - [320, 960, 1, 512]
    - [7, 16556.5]
  - - [448, 960, 1, 512]
    - [2, 16938.5]
  - - [576, 960, 1, 512]
    - [7, 19525.2]
  - - [704, 960, 1, 512]
    - [9, 20971.5]
  - - [832, 960, 1, 512]
    - [10, 24055.6]
  - - [960, 960, 1, 512]
    - [9, 24834.7]
  - - [1088, 960, 1, 512]
    - [9, 26086.5]
  - - [1216, 960, 1, 512]
    - [9, 27167.7]
  - - [1344, 960, 1, 512]
    - [9, 28110.8]
  - - [1472, 960, 1, 512]
    - [123, 28373.2]
  - - [1600, 960, 1, 512]
    - [129, 28086.9]
  - - [1728, 960, 1, 512]
    - [163, 28791.4]
  - - [1856, 960, 1, 512]
    - [35, 30408.7]
  - - [1984, 960, 1, 512]
    - [33, 30474.2]
  - - [448, 1088, 1, 512]
    - [46, 18486.0]
  - - [704, 1088, 1, 512]
    - [8, 23068.7]
  - - [960, 1088, 1, 512]
    - [9, 26738.7]
  - - [1216, 1088, 1, 512]
    - [9, 27648.2]
  - - [1472, 1088, 1, 512]
    - [10, 29285.2]
  - - [1728, 1088, 1, 512]
    - [33, 30558.5]
  - - [1984, 1088, 1, 512]
    - [10, 29870.2]
  - - [320, 1216, 1, 512]
    - [234, 21538.3]
  - - [448, 1216, 1, 512]
    - [234, 22493.6]
  - - [576, 1216, 1, 512]
    - [242, 28016.6]
  - - [704, 1216, 1, 512]
    - [9, 23692.1]
  - - [832, 1216, 1, 512]
    - [9, 25268.1]
  - - [960, 1216, 1, 512]
    - [9, 26563.9]
  - - [1088, 1216, 1, 512]
    - [9, 27648.2]
  - - [1216, 1216, 1, 512]
    - [123, 28568.7]
  - - [1344, 1216, 1, 512]
    - [172, 29884.4]
  - - [1472, 1216, 1, 512]
    - [3, 29093.8]
  - - [1600, 1216, 1, 512]
    - [33, 31129.6]
  - - [1728, 1216, 1, 512]
    - [10, 29884.4]
  - - [1856, 1216, 1, 512]
    - [30, 30408.7]
  - - [1984, 1216, 1, 512]
    - [46, 30499.3]
  - - [192, 1344, 1, 512]
    - [259, 16311.2]
  - - [448, 1344, 1, 512]
    - [229, 25373.0]
  - - [704, 1344, 1, 512]
    - [33, 23068.7]
  - - [960, 1344, 1, 512]
    - [16, 28110.8]
  - - [1216, 1344, 1, 512]
    - [10, 28853.9]
  - - [1472, 1344, 1, 512]
    - [23, 29360.1]
  - - [1728, 1344, 1, 512]
    - [30, 33973.9]
  - - [1984, 1344, 1, 512]
    - [16, 31749.9]
  - - [192, 1472, 1, 512]
    - [259, 16924.4]
  - - [320, 1472, 1, 512]
    - [244, 23878.5]
  - - [448, 1472, 1, 512]
    - [229, 26072.7]
  - - [576, 1472, 1, 512]
    - [246, 27475.3]
  - - [704, 1472, 1, 512]
    - [9, 27209.2]
  - - [832, 1472, 1, 512]
    - [9, 27868.8]
  - - [960, 1472, 1, 512]
    - [9, 30146.6]
  - - [1088, 1472, 1, 512]
    - [10, 29285.2]
  - - [1216, 1472, 1, 512]
    - [35, 31066.3]
  - - [1344, 1472, 1, 512]
    - [11, 30236.5]
  - - [1472, 1472, 1, 512]
    - [30, 31697.0]
  - - [1600, 1472, 1, 512]
    - [51, 32156.3]
  - - [1728, 1472, 1, 512]
    - [30, 31381.5]
  - - [1856, 1472, 1, 512]
    - [9, 33304.8]
  - - [1984, 1472, 1, 512]
    - [33, 33601.6]
  - - [192, 1600, 1, 512]
    - [259, 18289.1]
  - - [448, 1600, 1, 512]
    - [234, 24144.8]
  - - [704, 1600, 1, 512]
    - [9, 26214.4]
  - - [960, 1600, 1, 512]
    - [163, 27594.1]
  - - [1216, 1600, 1, 512]
    - [164, 31623.7]
  - - [1472, 1600, 1, 512]
    - [37, 32156.3]
  - - [1728, 1600, 1, 512]
    - [9, 33307.7]
  - - [1984, 1600, 1, 512]
    - [37, 33169.2]
  - - [192, 1728, 1, 512]
    - [259, 20343.6]
  - - [320, 1728, 1, 512]
    - [234, 23593.0]
  - - [448, 1728, 1, 512]
    - [229, 25489.5]
  - - [576, 1728, 1, 512]
    - [246, 28390.4]
  - - [704, 1728, 1, 512]
    - [9, 27080.6]
  - - [832, 1728, 1, 512]
    - [10, 26289.3]
  - - [960, 1728, 1, 512]
    - [35, 32050.8]
  - - [1088, 1728, 1, 512]
    - [33, 30558.5]
  - - [1216, 1728, 1, 512]
    - [30, 30738.3]
  - - [1344, 1728, 1, 512]
    - [80, 29727.1]
  - - [1472, 1728, 1, 512]
    - [10, 31381.5]
  - - [1600, 1728, 1, 512]
    - [3, 31111.6]
  - - [1728, 1728, 1, 512]
    - [16, 33973.9]
  - - [1856, 1728, 1, 512]
    - [123, 32841.4]
  - - [1984, 1728, 1, 512]
    - [30, 34758.7]
  - - [192, 1856, 1, 512]
    - [259, 20971.5]
  - - [448, 1856, 1, 512]
    - [230, 26360.5]
  - - [704, 1856, 1, 512]
    - [9, 28467.7]
  - - [960, 1856, 1, 512]
    - [35, 30924.1]
  - - [1216, 1856, 1, 512]
    - [30, 31658.4]
  - - [1472, 1856, 1, 512]
    - [9, 33706.0]
  - - [1728, 1856, 1, 512]
    - [31, 32516.2]
  - - [1984, 1856, 1, 512]
    - [35, 33970.1]
  - - [192, 1984, 1, 512]
    - [248, 21432.4]
  - - [320, 1984, 1, 512]
    - [229, 25101.0]
  - - [448, 1984, 1, 512]
    - [246, 28266.0]
  - - [576, 1984, 1, 512]
    - [230, 31289.1]
  - - [704, 1984, 1, 512]
    - [9, 27505.0]
  - - [832, 1984, 1, 512]
    - [10, 28649.2]
  - - [960, 1984, 1, 512]
    - [35, 32505.9]
  - - [1088, 1984, 1, 512]
    - [30, 31577.1]
  - - [1216, 1984, 1, 512]
    - [106, 32083.7]
  - - [1344, 1984, 1, 512]
    - [9, 32897.5]
  - - [1472, 1984, 1, 512]
    - [16, 33228.2]
  - - [1600, 1984, 1, 512]
    - [15, 33169.2]
  - - [1728, 1984, 1, 512]
    - [30, 34758.7]
  - - [1856, 1984, 1, 512]
    - [35, 34278.9]
  - - [1984, 1984, 1, 512]
    - [33, 35049.8]
  - - [1984, 64, 1, 1024]
    - [8, 8967.13]
  - - [704, 192, 1, 1024]
    - [10, 11534.3]
  - - [832, 192, 1, 1024]
    - [10, 12582.9]
  - - [960, 192, 1, 1024]
    - [135, 13481.7]
  - - [1088, 192, 1, 1024]
    - [8, 14260.6]
  - - [1216, 192, 1, 1024]
    - [7, 15424.2]
  - - [1344, 192, 1, 1024]
    - [5, 17047.8]
  - - [1472, 192, 1, 1024]
    - [112, 16537.5]
  - - [1600, 192, 1, 1024]
    - [5, 17003.9]
  - - [1728, 192, 1, 1024]
    - [142, 19984.6]
  - - [1856, 192, 1, 1024]
    - [6, 17800.2]
  - - [1984, 192, 1, 1024]
    - [0, 18574.8]
  - - [448, 320, 1, 1024]
    - [10, 13981.0]
  - - [704, 320, 1, 1024]
    - [10, 17745.1]
  - - [960, 320, 1, 1024]
    - [10, 22469.5]
  - - [1216, 320, 1, 1024]
    - [8, 22136.6]
  - - [1472, 320, 1, 1024]
    - [46, 23529.0]
  - - [1728, 320, 1, 1024]
    - [40, 23593.0]
  - - [1984, 320, 1, 1024]
    - [37, 26535.4]
  - - [320, 448, 1, 1024]
    - [10, 13345.5]
  - - [448, 448, 1, 1024]
    - [10, 17126.7]
  - - [576, 448, 1, 1024]
    - [7, 19573.4]
  - - [704, 448, 1, 1024]
    - [11, 23068.7]
  - - [832, 448, 1, 1024]
    - [10, 23855.1]
  - - [960, 448, 1, 1024]
    - [0, 24466.8]
  - - [1088, 448, 1, 1024]
    - [7, 23215.0]
  - - [1216, 448, 1, 1024]
    - [7, 25946.2]
  - - [1344, 448, 1, 1024]
    - [112, 26236.7]
  - - [1472, 448, 1, 1024]
    - [106, 28136.8]
  - - [1600, 448, 1, 1024]
    - [146, 25754.5]
  - - [1728, 448, 1, 1024]
    - [27, 29360.1]
  - - [1856, 448, 1, 1024]
    - [3, 28381.5]
  - - [1984, 448, 1, 1024]
    - [33, 31935.6]
  - - [448, 576, 1, 1024]
    - [10, 19573.4]
  - - [704, 576, 1, 1024]
    - [7, 23727.8]
  - - [960, 576, 1, 1024]
    - [7, 26336.3]
  - - [1216, 576, 1, 1024]
    - [5, 28126.5]
  - - [1472, 576, 1, 1024]
    - [30, 29938.7]
  - - [1728, 576, 1, 1024]
    - [30, 31360.5]
  - - [1984, 576, 1, 1024]
    - [28, 32963.7]
  - - [192, 704, 1, 1024]
    - [10, 11534.3]
  - - [320, 704, 1, 1024]
    - [11, 17745.1]
  - - [448, 704, 1, 1024]
    - [11, 21530.8]
  - - [576, 704, 1, 1024]
    - [46, 23727.8]
  - - [704, 704, 1, 1024]
    - [7, 24167.2]
  - - [832, 704, 1, 1024]
    - [7, 29257.8]
  - - [960, 704, 1, 1024]
    - [3, 28247.4]
  - - [1088, 704, 1, 1024]
    - [106, 28012.0]
  - - [1216, 704, 1, 1024]
    - [201, 30758.2]
  - - [1344, 704, 1, 1024]
    - [28, 30277.6]
  - - [1472, 704, 1, 1024]
    - [30, 31676.4]
  - - [1600, 704, 1, 1024]
    - [50, 32039.8]
  - - [1728, 704, 1, 1024]
    - [35, 32356.1]
  - - [1856, 704, 1, 1024]
    - [35, 32240.6]
  - - [1984, 704, 1, 1024]
    - [51, 32879.5]
  - - [192, 832, 1, 1024]
    - [10, 14870.7]
  - - [448, 832, 1, 1024]
    - [8, 22451.9]
  - - [704, 832, 1, 1024]
    - [7, 26077.6]
  - - [960, 832, 1, 1024]
    - [3, 28203.1]
  - - [1216, 832, 1, 1024]
    - [16, 31876.7]
  - - [1472, 832, 1, 1024]
    - [35, 33894.5]
  - - [1728, 832, 1, 1024]
    - [122, 32356.1]
  - - [1984, 832, 1, 1024]
    - [35, 33806.1]
  - - [192, 960, 1, 1024]
    - [11, 16412.5]
  - - [320, 960, 1, 1024]
    - [7, 23301.7]
  - - [448, 960, 1, 1024]
    - [4, 25165.8]
  - - [576, 960, 1, 1024]
    - [7, 26963.4]
  - - [704, 960, 1, 1024]
    - [16, 29449.4]
  - - [832, 960, 1, 1024]
    - [9, 29210.3]
  - - [960, 960, 1, 1024]
    - [3, 32542.0]
  - - [1088, 960, 1, 1024]
    - [9, 32909.2]
  - - [1216, 960, 1, 1024]
    - [17, 34648.6]
  - - [1344, 960, 1, 1024]
    - [35, 36197.4]
  - - [1472, 960, 1, 1024]
    - [35, 34868.3]
  - - [1600, 960, 1, 1024]
    - [51, 36578.2]
  - - [1728, 960, 1, 1024]
    - [35, 36531.0]
  - - [1856, 960, 1, 1024]
    - [35, 36859.0]
  - - [1984, 960, 1, 1024]
    - [125, 36117.6]
  - - [192, 1088, 1, 1024]
    - [7, 16454.6]
  - - [448, 1088, 1, 1024]
    - [7, 23767.7]
  - - [704, 1088, 1, 1024]
    - [9, 31373.4]
  - - [960, 1088, 1, 1024]
    - [30, 31926.8]
  - - [1216, 1088, 1, 1024]
    - [17, 34297.7]
  - - [1472, 1088, 1, 1024]
    - [116, 34893.0]
  - - [1728, 1088, 1, 1024]
    - [164, 35651.6]
  - - [1984, 1088, 1, 1024]
    - [37, 35366.4]
  - - [192, 1216, 1, 1024]
    - [248, 19922.9]
  - - [320, 1216, 1, 1024]
    - [250, 25379.5]
  - - [448, 1216, 1, 1024]
    - [234, 27014.2]
  - - [576, 1216, 1, 1024]
    - [259, 30716.3]
  - - [704, 1216, 1, 1024]
    - [3, 30227.9]
  - - [832, 1216, 1, 1024]
    - [30, 30925.2]
  - - [960, 1216, 1, 1024]
    - [30, 35158.1]
  - - [1088, 1216, 1, 1024]
    - [123, 35188.6]
  - - [1216, 1216, 1, 1024]
    - [123, 35626.9]
  - - [1344, 1216, 1, 1024]
    - [35, 35607.0]
  - - [1472, 1216, 1, 1024]
    - [3, 34583.2]
  - - [1600, 1216, 1, 1024]
    - [129, 37590.5]
  - - [1728, 1216, 1, 1024]
    - [37, 33620.0]
  - - [1856, 1216, 1, 1024]
    - [2, 34493.5]
  - - [1984, 1216, 1, 1024]
    - [5, 35041.8]
  - - [192, 1344, 1, 1024]
    - [259, 19793.3]
  - - [448, 1344, 1, 1024]
    - [229, 28677.3]
  - - [704, 1344, 1, 1024]
    - [123, 29811.8]
  - - [960, 1344, 1, 1024]
    - [35, 34317.0]
  - - [1216, 1344, 1, 1024]
    - [107, 33808.6]
  - - [1472, 1344, 1, 1024]
    - [136, 33485.1]
  - - [1728, 1344, 1, 1024]
    - [0, 36307.9]
  - - [1984, 1344, 1, 1024]
    - [0, 35460.9]
  - - [192, 1472, 1, 1024]
    - [259, 20895.8]
  - - [320, 1472, 1, 1024]
    - [244, 29866.6]
  - - [448, 1472, 1, 1024]
    - [229, 30976.3]
  - - [576, 1472, 1, 1024]
    - [252, 32037.7]
  - - [704, 1472, 1, 1024]
    - [9, 33161.2]
  - - [832, 1472, 1, 1024]
    - [35, 33894.5]
  - - [960, 1472, 1, 1024]
    - [35, 37585.3]
  - - [1088, 1472, 1, 1024]
    - [35, 33813.9]
  - - [1216, 1472, 1, 1024]
    - [33, 35590.5]
  - - [1344, 1472, 1, 1024]
    - [10, 34047.9]
  - - [1472, 1472, 1, 1024]
    - [2, 33874.6]
  - - [1600, 1472, 1, 1024]
    - [146, 36266.5]
  - - [1728, 1472, 1, 1024]
    - [33, 34728.8]
  - - [1856, 1472, 1, 1024]
    - [2, 35638.2]
  - - [1984, 1472, 1, 1024]
    - [51, 34374.0]
  - - [192, 1600, 1, 1024]
    - [259, 22389.5]
  - - [448, 1600, 1, 1024]
    - [234, 27286.4]
  - - [704, 1600, 1, 1024]
    - [9, 32491.1]
  - - [960, 1600, 1, 1024]
    - [51, 36578.2]
  - - [1216, 1600, 1, 1024]
    - [125, 38313.4]
  - - [1472, 1600, 1, 1024]
    - [144, 36266.5]
  - - [1728, 1600, 1, 1024]
    - [3, 36768.2]
  - - [1984, 1600, 1, 1024]
    - [37, 36319.4]
  - - [192, 1728, 1, 1024]
    - [259, 24980.8]
  - - [320, 1728, 1, 1024]
    - [234, 28100.8]
  - - [448, 1728, 1, 1024]
    - [229, 28826.3]
  - - [576, 1728, 1, 1024]
    - [229, 30154.3]
  - - [704, 1728, 1, 1024]
    - [12, 33667.8]
  - - [832, 1728, 1, 1024]
    - [171, 33843.7]
  - - [960, 1728, 1, 1024]
    - [35, 35762.0]
  - - [1088, 1728, 1, 1024]
    - [164, 37748.7]
  - - [1216, 1728, 1, 1024]
    - [5, 35564.9]
  - - [1344, 1728, 1, 1024]
    - [146, 38050.7]
  - - [1472, 1728, 1, 1024]
    - [3, 35437.6]
  - - [1600, 1728, 1, 1024]
    - [3, 37252.0]
  - - [1728, 1728, 1, 1024]
    - [51, 36185.2]
  - - [1856, 1728, 1, 1024]
    - [2, 36490.4]
  - - [1984, 1728, 1, 1024]
    - [30, 36760.5]
  - - [192, 1856, 1, 1024]
    - [259, 25428.9]
  - - [448, 1856, 1, 1024]
    - [246, 30086.4]
  - - [704, 1856, 1, 1024]
    - [35, 34307.3]
  - - [960, 1856, 1, 1024]
    - [35, 37235.1]
  - - [1216, 1856, 1, 1024]
    - [51, 36110.3]
  - - [1472, 1856, 1, 1024]
    - [3, 36332.5]
  - - [1728, 1856, 1, 1024]
    - [2, 36694.3]
  - - [1984, 1856, 1, 1024]
    - [3, 37896.3]
  - - [64, 1984, 1, 1024]
    - [245, 14691.9]
  - - [192, 1984, 1, 1024]
    - [250, 25747.2]
  - - [320, 1984, 1, 1024]
    - [229, 29088.0]
  - - [448, 1984, 1, 1024]
    - [246, 31657.9]
  - - [576, 1984, 1, 1024]
    - [252, 33530.4]
  - - [704, 1984, 1, 1024]
    - [19, 33653.1]
  - - [832, 1984, 1, 1024]
    - [35, 35214.7]
  - - [960, 1984, 1, 1024]
    - [3, 37870.9]
  - - [1088, 1984, 1, 1024]
    - [30, 36535.5]
  - - [1216, 1984, 1, 1024]
    - [136, 35546.0]
  - - [1344, 1984, 1, 1024]
    - [3, 37404.0]
  - - [1472, 1984, 1, 1024]
    - [19, 36693.7]
  - - [1600, 1984, 1, 1024]
    - [51, 36938.5]
  - - [1728, 1984, 1, 1024]
    - [30, 35822.8]
  - - [1856, 1984, 1, 1024]
    - [35, 37896.3]
  - - [1984, 1984, 1, 1024]
    - [33, 37847.2]
  - - [960, 64, 1, 2048]
    - [153, 8677.87]
  - - [1216, 64, 1, 2048]
    - [104, 10282.8]
  - - [1472, 64, 1, 2048]
    - [220, 11349.3]
  - - [1728, 64, 1, 2048]
    - [220, 12582.9]
  - - [1984, 64, 1, 2048]
    - [165, 14056.6]
  - - [320, 192, 1, 2048]
    - [182, 9679.16]
  - - [448, 192, 1, 2048]
    - [25, 12149.0]
  - - [576, 192, 1, 2048]
    - [133, 15620.2]
  - - [704, 192, 1, 2048]
    - [11, 17301.5]
  - - [832, 192, 1, 2048]
    - [11, 18175.3]
  - - [960, 192, 1, 2048]
    - [10, 19358.3]
  - - [1088, 192, 1, 2048]
    - [165, 21939.4]
  - - [1216, 192, 1, 2048]
    - [137, 22769.1]
  - - [1344, 192, 1, 2048]
    - [119, 22488.6]
  - - [1472, 192, 1, 2048]
    - [112, 24117.2]
  - - [1600, 192, 1, 2048]
    - [46, 25679.4]
  - - [1728, 192, 1, 2048]
    - [142, 27179.1]
  - - [1856, 192, 1, 2048]
    - [141, 27030.0]
  - - [1984, 192, 1, 2048]
    - [0, 25578.4]
  - - [192, 320, 1, 2048]
    - [121, 10941.7]
  - - [448, 320, 1, 2048]
    - [10, 19573.4]
  - - [704, 320, 1, 2048]
    - [11, 24939.1]
  - - [960, 320, 1, 2048]
    - [119, 26772.2]
  - - [1216, 320, 1, 2048]
    - [140, 31251.7]
  - - [1472, 320, 1, 2048]
    - [46, 32156.3]
  - - [1728, 320, 1, 2048]
    - [37, 33307.7]
  - - [1984, 320, 1, 2048]
    - [119, 33772.3]
  - - [192, 448, 1, 2048]
    - [92, 11744.1]
  - - [320, 448, 1, 2048]
    - [11, 20248.4]
  - - [448, 448, 1, 2048]
    - [8, 22218.5]
  - - [576, 448, 1, 2048]
    - [10, 25779.6]
  - - [704, 448, 1, 2048]
    - [11, 30042.9]
  - - [832, 448, 1, 2048]
    - [10, 30534.5]
  - - [960, 448, 1, 2048]
    - [2, 32029.2]
  - - [1088, 448, 1, 2048]
    - [46, 33274.8]
  - - [1216, 448, 1, 2048]
    - [37, 34328.8]
  - - [1344, 448, 1, 2048]
    - [203, 34735.9]
  - - [1472, 448, 1, 2048]
    - [51, 32543.8]
  - - [1600, 448, 1, 2048]
    - [51, 36247.1]
  - - [1728, 448, 1, 2048]
    - [10, 33377.8]
  - - [1856, 448, 1, 2048]
    - [30, 36231.6]
  - - [1984, 448, 1, 2048]
    - [33, 35692.7]
  - - [192, 576, 1, 2048]
    - [11, 15620.2]
  - - [448, 576, 1, 2048]
    - [7, 26424.1]
  - - [704, 576, 1, 2048]
    - [2, 30758.2]
  - - [960, 576, 1, 2048]
    - [33, 35389.4]
  - - [1216, 576, 1, 2048]
    - [5, 37748.7]
  - - [1472, 576, 1, 2048]
    - [30, 36945.6]
  - - [1728, 576, 1, 2048]
    - [5, 37748.7]
  - - [1984, 576, 1, 2048]
    - [7, 36285.6]
  - - [192, 704, 1, 2048]
    - [27, 19091.3]
  - - [320, 704, 1, 2048]
    - [10, 25631.9]
  - - [448, 704, 1, 2048]
    - [10, 30042.9]
  - - [576, 704, 1, 2048]
    - [4, 31338.6]
  - - [704, 704, 1, 2048]
    - [33, 31719.4]
  - - [832, 704, 1, 2048]
    - [7, 35281.5]
  - - [960, 704, 1, 2048]
    - [51, 35490.3]
  - - [1088, 704, 1, 2048]
    - [106, 34476.3]
  - - [1216, 704, 1, 2048]
    - [30, 36909.9]
  - - [1344, 704, 1, 2048]
    - [30, 34914.7]
  - - [1472, 704, 1, 2048]
    - [30, 36909.9]
  - - [1600, 704, 1, 2048]
    - [50, 38447.8]
  - - [1728, 704, 1, 2048]
    - [119, 36909.9]
  - - [1856, 704, 1, 2048]
    - [2, 37166.2]
  - - [1984, 704, 1, 2048]
    - [51, 38140.2]
  - - [192, 832, 1, 2048]
    - [10, 21106.8]
  - - [448, 832, 1, 2048]
    - [2, 28806.2]
  - - [704, 832, 1, 2048]
    - [7, 35281.5]
  - - [960, 832, 1, 2048]
    - [23, 35178.0]
  - - [1216, 832, 1, 2048]
    - [30, 36999.8]
  - - [1472, 832, 1, 2048]
    - [119, 37717.2]
  - - [1728, 832, 1, 2048]
    - [50, 37508.3]
  - - [1984, 832, 1, 2048]
    - [2, 37149.5]
  - - [64, 960, 1, 2048]
    - [182, 10066.3]
  - - [192, 960, 1, 2048]
    - [11, 21570.7]
  - - [320, 960, 1, 2048]
    - [7, 29959.3]
  - - [448, 960, 1, 2048]
    - [4, 33237.9]
  - - [576, 960, 1, 2048]
    - [114, 33307.7]
  - - [704, 960, 1, 2048]
    - [51, 35951.2]
  - - [832, 960, 1, 2048]
    - [124, 35560.4]
  - - [960, 960, 1, 2048]
    - [30, 39735.5]
  - - [1088, 960, 1, 2048]
    - [9, 38198.1]
  - - [1216, 960, 1, 2048]
    - [145, 38560.5]
  - - [1344, 960, 1, 2048]
    - [2, 38020.3]
  - - [1472, 960, 1, 2048]
    - [0, 38079.9]
  - - [1600, 960, 1, 2048]
    - [146, 40073.0]
  - - [1728, 960, 1, 2048]
    - [35, 37748.7]
  - - [1856, 960, 1, 2048]
    - [35, 39449.1]
  - - [1984, 960, 1, 2048]
    - [33, 39803.1]
  - - [192, 1088, 1, 2048]
    - [11, 24446.8]
  - - [448, 1088, 1, 2048]
    - [46, 33274.8]
  - - [704, 1088, 1, 2048]
    - [124, 35651.6]
  - - [960, 1088, 1, 2048]
    - [141, 36565.7]
  - - [1216, 1088, 1, 2048]
    - [2, 37895.4]
  - - [1472, 1088, 1, 2048]
    - [111, 36443.8]
  - - [1728, 1088, 1, 2048]
    - [164, 39289.5]
  - - [1984, 1088, 1, 2048]
    - [2, 38110.3]
  - - [64, 1216, 1, 2048]
    - [245, 16516.4]
  - - [192, 1216, 1, 2048]
    - [267, 23670.8]
  - - [320, 1216, 1, 2048]
    - [244, 28821.6]
  - - [448, 1216, 1, 2048]
    - [229, 27311.7]
  - - [576, 1216, 1, 2048]
    - [259, 32198.7]
  - - [704, 1216, 1, 2048]
    - [30, 36525.4]
  - - [832, 1216, 1, 2048]
    - [5, 38370.1]
  - - [960, 1216, 1, 2048]
    - [50, 40180.7]
  - - [1088, 1216, 1, 2048]
    - [0, 38162.3]
  - - [1216, 1216, 1, 2048]
    - [129, 38091.7]
  - - [1344, 1216, 1, 2048]
    - [2, 36780.8]
  - - [1472, 1216, 1, 2048]
    - [0, 38998.1]
  - - [1600, 1216, 1, 2048]
    - [129, 40248.4]
  - - [1728, 1216, 1, 2048]
    - [0, 37748.7]
  - - [1856, 1216, 1, 2048]
    - [0, 39005.3]
  - - [1984, 1216, 1, 2048]
    - [141, 37289.7]
  - - [192, 1344, 1, 2048]
    - [259, 22536.6]
  - - [448, 1344, 1, 2048]
    - [229, 31139.5]
  - - [704, 1344, 1, 2048]
    - [33, 39546.3]
  - - [960, 1344, 1, 2048]
    - [2, 37748.7]
  - - [1216, 1344, 1, 2048]
    - [107, 37607.4]
  - - [1472, 1344, 1, 2048]
    - [5, 37001.8]
  - - [1728, 1344, 1, 2048]
    - [0, 41180.4]
  - - [1984, 1344, 1, 2048]
    - [2, 39716.2]
  - - [64, 1472, 1, 2048]
    - [255, 14291.7]
  - - [192, 1472, 1, 2048]
    - [259, 24218.2]
  - - [320, 1472, 1, 2048]
    - [244, 33150.9]
  - - [448, 1472, 1, 2048]
    - [229, 33347.3]
  - - [576, 1472, 1, 2048]
    - [229, 31978.7]
  - - [704, 1472, 1, 2048]
    - [107, 36591.7]
  - - [832, 1472, 1, 2048]
    - [42, 37717.2]
  - - [960, 1472, 1, 2048]
    - [4, 40761.5]
  - - [1088, 1472, 1, 2048]
    - [5, 36647.4]
  - - [1216, 1472, 1, 2048]
    - [4, 39206.6]
  - - [1344, 1472, 1, 2048]
    - [2, 37171.5]
  - - [1472, 1472, 1, 2048]
    - [2, 38926.1]
  - - [1600, 1472, 1, 2048]
    - [51, 38587.6]
  - - [1728, 1472, 1, 2048]
    - [2, 39765.8]
  - - [1856, 1472, 1, 2048]
    - [2, 40544.9]
  - - [1984, 1472, 1, 2048]
    - [2, 38587.6]
  - - [192, 1600, 1, 2048]
    - [259, 25420.0]
  - - [448, 1600, 1, 2048]
    - [229, 29040.7]
  - - [704, 1600, 1, 2048]
    - [50, 38447.8]
  - - [960, 1600, 1, 2048]
    - [50, 38130.0]
  - - [1216, 1600, 1, 2048]
    - [125, 37590.5]
  - - [1472, 1600, 1, 2048]
    - [124, 39375.1]
  - - [1728, 1600, 1, 2048]
    - [2, 41788.3]
  - - [1984, 1600, 1, 2048]
    - [2, 40632.3]
  - - [64, 1728, 1, 2048]
    - [255, 16353.2]
  - - [192, 1728, 1, 2048]
    - [259, 28252.7]
  - - [320, 1728, 1, 2048]
    - [229, 27927.5]
  - - [448, 1728, 1, 2048]
    - [229, 29829.7]
  - - [576, 1728, 1, 2048]
    - [229, 31652.7]
  - - [704, 1728, 1, 2048]
    - [7, 37185.3]
  - - [832, 1728, 1, 2048]
    - [136, 36805.0]
  - - [960, 1728, 1, 2048]
    - [2, 37333.9]
  - - [1088, 1728, 1, 2048]
    - [7, 39491.0]
  - - [1216, 1728, 1, 2048]
    - [5, 38422.8]
  - - [1344, 1728, 1, 2048]
    - [2, 41180.4]
  - - [1472, 1728, 1, 2048]
    - [2, 38163.6]
  - - [1600, 1728, 1, 2048]
    - [6, 39185.5]
  - - [1728, 1728, 1, 2048]
    - [2, 38461.0]
  - - [1856, 1728, 1, 2048]
    - [2, 40296.2]
  - - [1984, 1728, 1, 2048]
    - [30, 39780.5]
  - - [192, 1856, 1, 2048]
    - [259, 30033.3]
  - - [448, 1856, 1, 2048]
    - [250, 31217.0]
  - - [704, 1856, 1, 2048]
    - [2, 37689.7]
  - - [960, 1856, 1, 2048]
    - [33, 39237.0]
  - - [1216, 1856, 1, 2048]
    - [0, 39170.5]
  - - [1472, 1856, 1, 2048]
    - [0, 40109.0]
  - - [1728, 1856, 1, 2048]
    - [2, 41836.2]
  - - [1984, 1856, 1, 2048]
    - [0, 40654.2]
  - - [64, 1984, 1, 2048]
    - [245, 17750.6]
  - - [192, 1984, 1, 2048]
    - [251, 29328.6]
  - - [320, 1984, 1, 2048]
    - [229, 28235.3]
  - - [448, 1984, 1, 2048]
    - [251, 32739.7]
  - - [576, 1984, 1, 2048]
    - [230, 33602.6]
  - - [704, 1984, 1, 2048]
    - [136, 37149.5]
  - - [832, 1984, 1, 2048]
    - [5, 36745.8]
  - - [960, 1984, 1, 2048]
    - [2, 41943.0]
  - - [1088, 1984, 1, 2048]
    - [2, 37784.6]
  - - [1216, 1984, 1, 2048]
    - [5, 38600.7]
  - - [1344, 1984, 1, 2048]
    - [2, 40007.2]
  - - [1472, 1984, 1, 2048]
    - [19, 37854.9]
  - - [1600, 1984, 1, 2048]
    - [2, 42352.9]
  - - [1728, 1984, 1, 2048]
    - [2, 39893.6]
  - - [1856, 1984, 1, 2048]
    - [2, 40007.2]
  - - [704, 64, 1, 4096]
    - [55, 11906.4]
  - - [960, 64, 1, 4096]
    - [153, 13245.2]
  - - [1216, 64, 1, 4096]
    - [152, 15938.4]
  - - [1472, 64, 1, 4096]
    - [220, 16078.2]
  - - [1728, 64, 1, 4096]
    - [220, 19276.0]
  - - [1984, 64, 1, 4096]
    - [26, 20395.8]
  - - [192, 192, 1, 4096]
    - [155, 11184.8]
  - - [320, 192, 1, 4096]
    - [55, 16777.2]
  - - [448, 192, 1, 4096]
    - [137, 16777.2]
  - - [576, 192, 1, 4096]
    - [26, 20590.2]
  - - [704, 192, 1, 4096]
    - [26, 24606.6]
  - - [832, 192, 1, 4096]
    - [62, 28448.3]
  - - [960, 192, 1, 4096]
    - [92, 27453.6]
  - - [1088, 192, 1, 4096]
    - [87, 30558.5]
  - - [1216, 192, 1, 4096]
    - [184, 29884.4]
  - - [1344, 192, 1, 4096]
    - [79, 31087.2]
  - - [1472, 192, 1, 4096]
    - [115, 33554.4]
  - - [1600, 192, 1, 4096]
    - [101, 34473.7]
  - - [1728, 192, 1, 4096]
    - [141, 34845.0]
  - - [1856, 192, 1, 4096]
    - [5, 34752.8]
  - - [1984, 192, 1, 4096]
    - [47, 33919.2]
  - - [192, 320, 1, 4096]
    - [82, 16777.2]
  - - [448, 320, 1, 4096]
    - [26, 26691.0]
  - - [704, 320, 1, 4096]
    - [92, 32955.2]
  - - [960, 320, 1, 4096]
    - [79, 37008.6]
  - - [1216, 320, 1, 4096]
    - [47, 38874.0]
  - - [1472, 320, 1, 4096]
    - [101, 36403.4]
  - - [1728, 320, 1, 4096]
    - [37, 38066.0]
  - - [1984, 320, 1, 4096]
    - [112, 38525.5]
  - - [192, 448, 1, 4096]
    - [27, 16777.2]
  - - [320, 448, 1, 4096]
    - [26, 26691.0]
  - - [448, 448, 1, 4096]
    - [87, 30447.5]
  - - [576, 448, 1, 4096]
    - [7, 33030.1]
  - - [704, 448, 1, 4096]
    - [11, 36909.9]
  - - [832, 448, 1, 4096]
    - [124, 33554.4]
  - - [960, 448, 1, 4096]
    - [0, 38716.7]
  - - [1088, 448, 1, 4096]
    - [46, 38028.4]
  - - [1216, 448, 1, 4096]
    - [107, 38806.4]
  - - [1344, 448, 1, 4096]
    - [112, 39778.2]
  - - [1472, 448, 1, 4096]
    - [5, 37515.7]
  - - [1600, 448, 1, 4096]
    - [51, 39945.8]
  - - [1728, 448, 1, 4096]
    - [0, 36238.8]
  - - [1856, 448, 1, 4096]
    - [2, 38267.1]
  - - [1984, 448, 1, 4096]
    - [0, 40677.7]
  - - [192, 576, 1, 4096]
    - [147, 21570.7]
  - - [448, 576, 1, 4096]
    - [7, 32522.0]
  - - [704, 576, 1, 4096]
    - [4, 36909.9]
  - - [960, 576, 1, 4096]
    - [51, 39050.4]
  - - [1216, 576, 1, 4096]
    - [141, 40407.1]
  - - [1472, 576, 1, 4096]
    - [0, 39690.1]
  - - [1728, 576, 1, 4096]
    - [5, 41180.4]
  - - [1984, 576, 1, 4096]
    - [114, 38845.2]
  - - [64, 704, 1, 4096]
    - [57, 11184.8]
  - - [192, 704, 1, 4096]
    - [26, 26364.2]
  - - [320, 704, 1, 4096]
    - [136, 32955.2]
  - - [448, 704, 1, 4096]
    - [11, 36909.9]
  - - [576, 704, 1, 4096]
    - [2, 36909.9]
  - - [704, 704, 1, 4096]
    - [51, 35305.1]
  - - [832, 704, 1, 4096]
    - [112, 38695.8]
  - - [960, 704, 1, 4096]
    - [5, 39265.8]
  - - [1088, 704, 1, 4096]
    - [2, 36269.8]
  - - [1216, 704, 1, 4096]
    - [2, 39398.2]
  - - [1344, 704, 1, 4096]
    - [5, 37995.5]
  - - [1472, 704, 1, 4096]
    - [30, 38413.0]
  - - [1600, 704, 1, 4096]
    - [50, 40119.4]
  - - [1728, 704, 1, 4096]
    - [119, 39546.3]
  - - [1856, 704, 1, 4096]
    - [0, 40240.1]
  - - [1984, 704, 1, 4096]
    - [50, 37638.4]
  - - [192, 832, 1, 4096]
    - [11, 29080.5]
  - - [448, 832, 1, 4096]
    - [47, 38168.2]
  - - [704, 832, 1, 4096]
    - [167, 39655.2]
  - - [960, 832, 1, 4096]
    - [2, 38716.7]
  - - [1216, 832, 1, 4096]
    - [5, 39655.2]
  - - [1472, 832, 1, 4096]
    - [2, 39344.2]
  - - [1728, 832, 1, 4096]
    - [50, 38998.7]
  - - [1984, 832, 1, 4096]
    - [2, 38307.2]
  - - [64, 960, 1, 4096]
    - [55, 15728.6]
  - - [192, 960, 1, 4096]
    - [25, 27453.6]
  - - [320, 960, 1, 4096]
    - [7, 38130.0]
  - - [448, 960, 1, 4096]
    - [4, 39146.8]
  - - [576, 960, 1, 4096]
    - [12, 37748.7]
  - - [704, 960, 1, 4096]
    - [5, 37921.1]
  - - [832, 960, 1, 4096]
    - [124, 39416.4]
  - - [960, 960, 1, 4096]
    - [2, 42896.3]
  - - [1088, 960, 1, 4096]
    - [5, 40170.8]
  - - [1216, 960, 1, 4096]
    - [7, 39680.6]
  - - [1344, 960, 1, 4096]
    - [2, 40652.5]
  - - [1472, 960, 1, 4096]
    - [0, 42404.0]
  - - [1600, 960, 1, 4096]
    - [51, 40853.6]
  - - [1728, 960, 1, 4096]
    - [2, 41056.0]
  - - [1856, 960, 1, 4096]
    - [2, 40209.9]
  - - [1984, 960, 1, 4096]
    - [6, 41496.8]
  - - [192, 1088, 1, 4096]
    - [87, 31114.1]
  - - [448, 1088, 1, 4096]
    - [46, 37669.6]
  - - [704, 1088, 1, 4096]
    - [124, 38732.6]
  - - [960, 1088, 1, 4096]
    - [5, 41136.4]
  - - [1216, 1088, 1, 4096]
    - [2, 41845.9]
  - - [1472, 1088, 1, 4096]
    - [2, 39163.5]
  - - [1728, 1088, 1, 4096]
    - [50, 39289.5]
  - - [64, 1216, 1, 4096]
    - [245, 18862.0]
  - - [192, 1216, 1, 4096]
    - [267, 26128.5]
  - - [320, 1216, 1, 4096]
    - [244, 29597.7]
  - - [448, 1216, 1, 4096]
    - [257, 31120.9]
  - - [576, 1216, 1, 4096]
    - [259, 33771.7]
  - - [704, 1216, 1, 4096]
    - [2, 39620.8]
  - - [832, 1216, 1, 4096]
    - [5, 39845.9]
  - - [960, 1216, 1, 4096]
    - [50, 41219.9]
  - - [1088, 1216, 1, 4096]
    - [2, 39411.2]
  - - [1216, 1216, 1, 4096]
    - [164, 39456.5]
  - - [1344, 1216, 1, 4096]
    - [5, 39493.3]
  - - [1472, 1216, 1, 4096]
    - [2, 40394.7]
  - - [1600, 1216, 1, 4096]
    - [50, 40248.4]
  - - [192, 1344, 1, 4096]
    - [267, 24495.1]
  - - [448, 1344, 1, 4096]
    - [229, 32883.3]
  - - [704, 1344, 1, 4096]
    - [33, 40581.5]
  - - [960, 1344, 1, 4096]
    - [2, 41287.7]
  - - [1216, 1344, 1, 4096]
    - [111, 39727.7]
  - - [64, 1472, 1, 4096]
    - [268, 17381.8]
  - - [192, 1472, 1, 4096]
    - [257, 26131.6]
  - - [320, 1472, 1, 4096]
    - [244, 34607.7]
  - - [448, 1472, 1, 4096]
    - [229, 35682.1]
  - - [576, 1472, 1, 4096]
    - [250, 34047.9]
  - - [704, 1472, 1, 4096]
    - [50, 38941.6]
  - - [832, 1472, 1, 4096]
    - [160, 39499.1]
  - - [960, 1472, 1, 4096]
    - [2, 43356.9]
  - - [1088, 1472, 1, 4096]
    - [0, 38250.1]
  - - [1216, 1472, 1, 4096]
    - [2, 41657.1]
  - - [192, 1600, 1, 4096]
    - [256, 27002.0]
  - - [448, 1600, 1, 4096]
    - [229, 29959.3]
  - - [704, 1600, 1, 4096]
    - [50, 39945.8]
  - - [960, 1600, 1, 4096]
    - [50, 40986.7]
  - - [1216, 1600, 1, 4096]
    - [1, 39354.0]
  - - [64, 1728, 1, 4096]
    - [255, 19652.3]
  - - [192, 1728, 1, 4096]
    - [259, 29224.8]
  - - [320, 1728, 1, 4096]
    - [229, 28889.3]
  - - [448, 1728, 1, 4096]
    - [250, 31441.7]
  - - [576, 1728, 1, 4096]
    - [229, 32680.3]
  - - [704, 1728, 1, 4096]
    - [2, 38776.9]
  - - [832, 1728, 1, 4096]
    - [135, 38615.1]
  - - [960, 1728, 1, 4096]
    - [2, 40687.3]
  - - [1088, 1728, 1, 4096]
    - [43, 40530.2]
  - - [192, 1856, 1, 4096]
    - [259, 30472.2]
  - - [448, 1856, 1, 4096]
    - [250, 33146.2]
  - - [704, 1856, 1, 4096]
    - [2, 40699.1]
  - - [960, 1856, 1, 4096]
    - [5, 41348.9]
  - - [64, 1984, 1, 4096]
    - [245, 19370.3]
  - - [192, 1984, 1, 4096]
    - [250, 30714.2]
  - - [320, 1984, 1, 4096]
    - [229, 31013.3]
  - - [448, 1984, 1, 4096]
    - [229, 35090.7]
  - - [576, 1984, 1, 4096]
    - [229, 34380.0]
  - - [704, 1984, 1, 4096]
    - [184, 38267.8]
  - - [832, 1984, 1, 4096]
    - [5, 39082.2]
  - - [960, 1984, 1, 4096]
    - [4, 42169.8]
  - - [960, 512, 1, 256]
    - [2, 12582.9]
  - - [1024, 512, 1, 256]
    - [7, 12201.6]
  - - [896, 576, 1, 256]
    - [7, 12011.0]
  - - [1024, 576, 1, 256]
    - [22, 12582.9]
  - - [768, 640, 1, 256]
    - [17, 11983.7]
  - - [832, 640, 1, 256]
    - [7, 12392.3]
  - - [896, 640, 1, 256]
    - [7, 13345.5]
  - - [960, 640, 1, 256]
    - [7, 14298.8]
  - - [1024, 640, 1, 256]
    - [14, 15252.0]
  - - [768, 704, 1, 256]
    - [38, 12582.9]
  - - [896, 704, 1, 256]
    - [22, 14041.8]
  - - [1024, 704, 1, 256]
    - [113, 14764.0]
  - - [640, 768, 1, 256]
    - [0, 11983.7]
  - - [704, 768, 1, 256]
    - [7, 13182.1]
  - - [768, 768, 1, 256]
    - [12, 13726.8]
  - - [832, 768, 1, 256]
    - [7, 14870.7]
  - - [896, 768, 1, 256]
    - [3, 14680.1]
  - - [960, 768, 1, 256]
    - [3, 15099.5]
  - - [1024, 768, 1, 256]
    - [9, 15486.7]
  - - [640, 832, 1, 256]
    - [38, 11853.5]
  - - [768, 832, 1, 256]
    - [38, 13631.5]
  - - [896, 832, 1, 256]
    - [38, 15267.3]
  - - [1024, 832, 1, 256]
    - [22, 15578.8]
  - - [576, 896, 1, 256]
    - [7, 12011.0]
  - - [640, 896, 1, 256]
    - [7, 12765.3]
  - - [704, 896, 1, 256]
    - [7, 14041.8]
  - - [768, 896, 1, 256]
    - [3, 14680.1]
  - - [832, 896, 1, 256]
    - [22, 15267.3]
  - - [896, 896, 1, 256]
    - [113, 16441.7]
  - - [960, 896, 1, 256]
    - [10, 16311.2]
  - - [1024, 896, 1, 256]
    - [9, 17398.6]
  - - [512, 960, 1, 256]
    - [38, 12582.9]
  - - [640, 960, 1, 256]
    - [38, 14298.8]
  - - [768, 960, 1, 256]
    - [9, 14518.7]
  - - [896, 960, 1, 256]
    - [38, 16311.2]
  - - [1024, 960, 1, 256]
    - [22, 17975.6]
  - - [512, 1024, 1, 256]
    - [16, 12782.6]
  - - [576, 1024, 1, 256]
    - [7, 13726.8]
  - - [640, 1024, 1, 256]
    - [38, 14588.9]
  - - [704, 1024, 1, 256]
    - [9, 14196.1]
  - - [768, 1024, 1, 256]
    - [38, 15486.7]
  - - [832, 1024, 1, 256]
    - [9, 16777.2]
  - - [896, 1024, 1, 256]
    - [38, 16777.2]
  - - [960, 1024, 1, 256]
    - [22, 18641.4]
  - - [1024, 1024, 1, 256]
    - [9, 18512.8]
  - - [960, 256, 1, 512]
    - [23, 12582.9]
  - - [1024, 256, 1, 512]
    - [7, 12782.6]
  - - [768, 320, 1, 512]
    - [8, 12582.9]
  - - [896, 320, 1, 512]
    - [11, 14680.1]
  - - [1024, 320, 1, 512]
    - [101, 13981.0]
  - - [640, 384, 1, 512]
    - [10, 13981.0]
  - - [704, 384, 1, 512]
    - [7, 13182.1]
  - - [768, 384, 1, 512]
    - [11, 14380.5]
  - - [832, 384, 1, 512]
    - [7, 16357.8]
  - - [896, 384, 1, 512]
    - [187, 15318.3]
  - - [960, 384, 1, 512]
    - [10, 16412.5]
  - - [1024, 384, 1, 512]
    - [8, 17506.7]
  - - [640, 448, 1, 512]
    - [10, 14680.1]
  - - [768, 448, 1, 512]
    - [11, 16014.6]
  - - [896, 448, 1, 512]
    - [8, 17126.7]
  - - [1024, 448, 1, 512]
    - [6, 17398.6]
  - - [576, 512, 1, 512]
    - [8, 14380.5]
  - - [640, 512, 1, 512]
    - [7, 15978.3]
  - - [704, 512, 1, 512]
    - [225, 16047.8]
  - - [768, 512, 1, 512]
    - [8, 17506.7]
  - - [832, 512, 1, 512]
    - [12, 18175.3]
  - - [896, 512, 1, 512]
    - [7, 19573.4]
  - - [960, 512, 1, 512]
    - [4, 20132.7]
  - - [1024, 512, 1, 512]
    - [16, 19884.1]
  - - [512, 576, 1, 512]
    - [8, 14380.5]
  - - [640, 576, 1, 512]
    - [11, 17158.5]
  - - [768, 576, 1, 512]
    - [6, 18119.4]
  - - [896, 576, 1, 512]
    - [195, 18223.5]
  - - [1024, 576, 1, 512]
    - [9, 20826.9]
  - - [384, 640, 1, 512]
    - [7, 11983.7]
  - - [448, 640, 1, 512]
    - [8, 13981.0]
  - - [512, 640, 1, 512]
    - [29, 14588.9]
  - - [576, 640, 1, 512]
    - [12, 16412.5]
  - - [640, 640, 1, 512]
    - [10, 18236.1]
  - - [704, 640, 1, 512]
    - [7, 19223.9]
  - - [768, 640, 1, 512]
    - [4, 20971.5]
  - - [832, 640, 1, 512]
    - [9, 19473.6]
  - - [896, 640, 1, 512]
    - [7, 20971.5]
  - - [960, 640, 1, 512]
    - [7, 19660.8]
  - - [1024, 640, 1, 512]
    - [7, 20971.5]
  - - [384, 704, 1, 512]
    - [8, 13182.1]
  - - [512, 704, 1, 512]
    - [46, 15379.1]
  - - [640, 704, 1, 512]
    - [7, 18454.9]
  - - [768, 704, 1, 512]
    - [7, 19773.1]
  - - [896, 704, 1, 512]
    - [14, 19573.4]
  - - [1024, 704, 1, 512]
    - [8, 20505.5]
  - - [320, 768, 1, 512]
    - [11, 13981.0]
  - - [384, 768, 1, 512]
    - [45, 13726.8]
  - - [448, 768, 1, 512]
    - [5, 16014.6]
  - - [512, 768, 1, 512]
    - [8, 16777.2]
  - - [576, 768, 1, 512]
    - [4, 18874.4]
  - - [640, 768, 1, 512]
    - [6, 20971.5]
  - - [704, 768, 1, 512]
    - [7, 19091.3]
  - - [768, 768, 1, 512]
    - [7, 20826.9]
  - - [832, 768, 1, 512]
    - [7, 23368.3]
  - - [896, 768, 1, 512]
    - [201, 22020.1]
  - - [960, 768, 1, 512]
    - [3, 22878.0]
  - - [1024, 768, 1, 512]
    - [9, 23685.5]
  - - [384, 832, 1, 512]
    - [46, 14870.7]
  - - [512, 832, 1, 512]
    - [6, 17448.3]
  - - [640, 832, 1, 512]
    - [7, 19473.6]
  - - [768, 832, 1, 512]
    - [202, 21106.8]
  - - [896, 832, 1, 512]
    - [10, 23132.2]
  - - [1024, 832, 1, 512]
    - [38, 22369.6]
  - - [320, 896, 1, 512]
    - [8, 14680.1]
  - - [384, 896, 1, 512]
    - [4, 14680.1]
  - - [448, 896, 1, 512]
    - [8, 17126.7]
  - - [512, 896, 1, 512]
    - [7, 19573.4]
  - - [576, 896, 1, 512]
    - [12, 19573.4]
  - - [640, 896, 1, 512]
    - [12, 18942.0]
  - - [704, 896, 1, 512]
    - [7, 22273.2]
  - - [768, 896, 1, 512]
    - [3, 22730.4]
  - - [832, 896, 1, 512]
    - [16, 23855.1]
  - - [896, 896, 1, 512]
    - [9, 24911.6]
  - - [960, 896, 1, 512]
    - [9, 23805.5]
  - - [1024, 896, 1, 512]
    - [9, 25392.5]
  - - [256, 960, 1, 512]
    - [189, 12582.9]
  - - [384, 960, 1, 512]
    - [10, 16412.5]
  - - [512, 960, 1, 512]
    - [14, 20971.5]
  - - [640, 960, 1, 512]
    - [7, 20971.5]
  - - [768, 960, 1, 512]
    - [9, 23593.0]
  - - [896, 960, 1, 512]
    - [0, 23805.5]
  - - [1024, 960, 1, 512]
    - [9, 25811.1]
  - - [256, 1024, 1, 512]
    - [7, 13421.8]
  - - [320, 1024, 1, 512]
    - [7, 16777.2]
  - - [384, 1024, 1, 512]
    - [11, 17506.7]
  - - [448, 1024, 1, 512]
    - [7, 19573.4]
  - - [512, 1024, 1, 512]
    - [14, 18512.8]
  - - [576, 1024, 1, 512]
    - [7, 20826.9]
  - - [640, 1024, 1, 512]
    - [16, 21648.0]
  - - [704, 1024, 1, 512]
    - [9, 23068.7]
  - - [768, 1024, 1, 512]
    - [9, 25977.6]
  - - [832, 1024, 1, 512]
    - [9, 24926.1]
  - - [896, 1024, 1, 512]
    - [9, 26097.9]
  - - [960, 1024, 1, 512]
    - [9, 27206.3]
  - - [1024, 1024, 1, 512]
    - [9, 26843.5]
  - - [960, 128, 1, 1024]
    - [120, 9320.68]
  - - [1024, 128, 1, 1024]
    - [130, 9942.05]
  - - [640, 192, 1, 1024]
    - [26, 10941.7]
  - - [768, 192, 1, 1024]
    - [10, 12079.6]
  - - [896, 192, 1, 1024]
    - [10, 13550.8]
  - - [1024, 192, 1, 1024]
    - [46, 14380.5]
  - - [512, 256, 1, 1024]
    - [8, 12201.6]
  - - [576, 256, 1, 1024]
    - [8, 13130.0]
  - - [640, 256, 1, 1024]
    - [10, 13981.0]
  - - [704, 256, 1, 1024]
    - [11, 15379.1]
  - - [768, 256, 1, 1024]
    - [8, 14913.1]
  - - [832, 256, 1, 1024]
    - [10, 16777.2]
  - - [896, 256, 1, 1024]
    - [10, 18067.8]
  - - [960, 256, 1, 1024]
    - [11, 17975.6]
  - - [1024, 256, 1, 1024]
    - [10, 18512.8]
  - - [384, 320, 1, 1024]
    - [220, 12582.9]
  - - [512, 320, 1, 1024]
    - [62, 14588.9]
  - - [640, 320, 1, 1024]
    - [10, 17476.3]
  - - [768, 320, 1, 1024]
    - [8, 17975.6]
  - - [896, 320, 1, 1024]
    - [10, 20971.5]
  - - [1024, 320, 1, 1024]
    - [8, 21648.0]
  - - [320, 384, 1, 1024]
    - [10, 11983.7]
  - - [384, 384, 1, 1024]
    - [10, 13726.8]
  - - [448, 384, 1, 1024]
    - [154, 14092.9]
  - - [512, 384, 1, 1024]
    - [10, 16777.2]
  - - [576, 384, 1, 1024]
    - [11, 18119.4]
  - - [640, 384, 1, 1024]
    - [10, 20132.7]
  - - [704, 384, 1, 1024]
    - [7, 19773.1]
  - - [768, 384, 1, 1024]
    - [7, 21570.7]
  - - [832, 384, 1, 1024]
    - [10, 22562.5]
  - - [896, 384, 1, 1024]
    - [5, 22020.1]
  - - [960, 384, 1, 1024]
    - [5, 23593.0]
  - - [1024, 384, 1, 1024]
    - [8, 23685.5]
  - - [384, 448, 1, 1024]
    - [23, 13550.8]
  - - [512, 448, 1, 1024]
    - [8, 18790.5]
  - - [640, 448, 1, 1024]
    - [10, 21748.2]
  - - [768, 448, 1, 1024]
    - [5, 22730.4]
  - - [896, 448, 1, 1024]
    - [10, 26518.8]
  - - [1024, 448, 1, 1024]
    - [0, 26097.9]
  - - [256, 512, 1, 1024]
    - [156, 12782.6]
  - - [320, 512, 1, 1024]
    - [10, 15252.0]
  - - [384, 512, 1, 1024]
    - [25, 16106.1]
  - - [448, 512, 1, 1024]
    - [8, 18790.5]
  - - [512, 512, 1, 1024]
    - [7, 19884.1]
  - - [576, 512, 1, 1024]
    - [7, 22369.6]
  - - [640, 512, 1, 1024]
    - [7, 23967.5]
  - - [704, 512, 1, 1024]
    - [10, 23812.8]
  - - [768, 512, 1, 1024]
    - [10, 25165.8]
  - - [832, 512, 1, 1024]
    - [7, 25659.3]
  - - [896, 512, 1, 1024]
    - [4, 26097.9]
  - - [960, 512, 1, 1024]
    - [4, 28760.9]
  - - [1024, 512, 1, 1024]
    - [12, 26843.5]
  - - [256, 576, 1, 1024]
    - [7, 12582.9]
  - - [384, 576, 1, 1024]
    - [187, 17422.5]
  - - [512, 576, 1, 1024]
    - [11, 21570.7]
  - - [640, 576, 1, 1024]
    - [11, 24354.0]
  - - [768, 576, 1, 1024]
    - [0, 26646.2]
  - - [896, 576, 1, 1024]
    - [146, 23488.1]
  - - [1024, 576, 1, 1024]
    - [7, 27453.6]
  - - [192, 640, 1, 1024]
    - [10, 11983.7]
  - - [256, 640, 1, 1024]
    - [8, 14588.9]
  - - [320, 640, 1, 1024]
    - [26, 15534.5]
  - - [384, 640, 1, 1024]
    - [11, 20971.5]
  - - [448, 640, 1, 1024]
    - [7, 21748.2]
  - - [512, 640, 1, 1024]
    - [168, 22369.6]
  - - [576, 640, 1, 1024]
    - [4, 22878.0]
  - - [640, 640, 1, 1024]
    - [2, 23967.5]
  - - [704, 640, 1, 1024]
    - [7, 27139.6]
  - - [768, 640, 1, 1024]
    - [4, 28760.9]
  - - [832, 640, 1, 1024]
    - [7, 26598.0]
  - - [896, 640, 1, 1024]
    - [12, 28644.0]
  - - [960, 640, 1, 1024]
    - [9, 27962.0]
  - - [1024, 640, 1, 1024]
    - [7, 31213.4]
  - - [256, 704, 1, 1024]
    - [59, 13670.3]
  - - [384, 704, 1, 1024]
    - [10, 19773.1]
  - - [512, 704, 1, 1024]
    - [7, 21711.7]
  - - [640, 704, 1, 1024]
    - [6, 25631.9]
  - - [768, 704, 1, 1024]
    - [7, 27007.2]
  - - [896, 704, 1, 1024]
    - [3, 26364.2]
  - - [1024, 704, 1, 1024]
    - [122, 26843.5]
  - - [192, 768, 1, 1024]
    - [10, 14380.5]
  - - [256, 768, 1, 1024]
    - [8, 16106.1]
  - - [320, 768, 1, 1024]
    - [10, 20132.7]
  - - [384, 768, 1, 1024]
    - [8, 20826.9]
  - - [448, 768, 1, 1024]
    - [5, 23488.1]
  - - [512, 768, 1, 1024]
    - [11, 25165.8]
  - - [576, 768, 1, 1024]
    - [4, 26646.2]
  - - [640, 768, 1, 1024]
    - [6, 29606.9]
  - - [704, 768, 1, 1024]
    - [7, 27007.2]
  - - [768, 768, 1, 1024]
    - [7, 28760.9]
  - - [832, 768, 1, 1024]
    - [12, 31157.7]
  - - [896, 768, 1, 1024]
    - [3, 29360.1]
  - - [960, 768, 1, 1024]
    - [3, 30815.3]
  - - [1024, 768, 1, 1024]
    - [106, 30973.3]
  - - [256, 832, 1, 1024]
    - [184, 16155.8]
  - - [384, 832, 1, 1024]
    - [5, 21106.8]
  - - [512, 832, 1, 1024]
    - [0, 25659.3]
  - - [640, 832, 1, 1024]
    - [7, 26598.0]
  - - [768, 832, 1, 1024]
    - [3, 27263.0]
  - - [896, 832, 1, 1024]
    - [9, 29360.1]
  - - [1024, 832, 1, 1024]
    - [30, 31157.7]
  - - [192, 896, 1, 1024]
    - [8, 14680.1]
  - - [256, 896, 1, 1024]
    - [7, 18067.8]
  - - [320, 896, 1, 1024]
    - [27, 20248.4]
  - - [384, 896, 1, 1024]
    - [5, 23488.1]
  - - [448, 896, 1, 1024]
    - [4, 23488.1]
  - - [512, 896, 1, 1024]
    - [12, 27633.1]
  - - [576, 896, 1, 1024]
    - [7, 26424.1]
  - - [640, 896, 1, 1024]
    - [7, 28644.0]
  - - [704, 896, 1, 1024]
    - [7, 30758.2]
  - - [768, 896, 1, 1024]
    - [3, 29984.8]
  - - [832, 896, 1, 1024]
    - [15, 29935.8]
  - - [896, 896, 1, 1024]
    - [9, 31618.6]
  - - [960, 896, 1, 1024]
    - [3, 31457.3]
  - - [1024, 896, 1, 1024]
    - [16, 32965.8]
  - - [128, 960, 1, 1024]
    - [7, 11439.0]
  - - [256, 960, 1, 1024]
    - [10, 20132.7]
  - - [384, 960, 1, 1024]
    - [5, 25165.8]
  - - [512, 960, 1, 1024]
    - [6, 29606.9]
  - - [640, 960, 1, 1024]
    - [7, 29959.3]
  - - [768, 960, 1, 1024]
    - [9, 30815.3]
  - - [896, 960, 1, 1024]
    - [139, 31457.3]
  - - [1024, 960, 1, 1024]
    - [139, 33004.4]
  - - [128, 1024, 1, 1024]
    - [10, 13421.8]
  - - [192, 1024, 1, 1024]
    - [8, 16777.2]
  - - [256, 1024, 1, 1024]
    - [7, 19884.1]
  - - [320, 1024, 1, 1024]
    - [10, 24855.1]
  - - [384, 1024, 1, 1024]
    - [122, 23685.5]
  - - [448, 1024, 1, 1024]
    - [7, 26843.5]
  - - [512, 1024, 1, 1024]
    - [7, 26843.5]
  - - [576, 1024, 1, 1024]
    - [7, 29462.4]
  - - [640, 1024, 1, 1024]
    - [7, 31956.6]
  - - [704, 1024, 1, 1024]
    - [9, 30130.5]
  - - [768, 1024, 1, 1024]
    - [9, 32212.3]
  - - [832, 1024, 1, 1024]
    - [9, 30611.1]
  - - [896, 1024, 1, 1024]
    - [9, 31848.3]
  - - [960, 1024, 1, 1024]
    - [30, 35320.5]
  - - [1024, 64, 1, 2048]
    - [151, 9256.4]
  - - [512, 128, 1, 2048]
    - [68, 9942.05]
  - - [576, 128, 1, 2048]
    - [104, 11615.0]
  - - [640, 128, 1, 2048]
    - [185, 11570.5]
  - - [704, 128, 1, 2048]
    - [173, 11906.4]
  - - [768, 128, 1, 2048]
    - [180, 12988.8]
  - - [832, 128, 1, 2048]
    - [181, 13631.5]
  - - [896, 128, 1, 2048]
    - [156, 14680.1]
  - - [960, 128, 1, 2048]
    - [46, 15728.6]
  - - [1024, 128, 1, 2048]
    - [62, 15339.2]
  - - [384, 192, 1, 2048]
    - [152, 11184.8]
  - - [512, 192, 1, 2048]
    - [46, 13884.6]
  - - [640, 192, 1, 2048]
    - [147, 15728.6]
  - - [768, 192, 1, 2048]
    - [10, 17764.1]
  - - [896, 192, 1, 2048]
    - [87, 19044.4]
  - - [1024, 192, 1, 2048]
    - [25, 20648.9]
  - - [256, 256, 1, 2048]
    - [67, 10324.4]
  - - [320, 256, 1, 2048]
    - [152, 12427.6]
  - - [384, 256, 1, 2048]
    - [121, 13884.6]
  - - [448, 256, 1, 2048]
    - [62, 16777.2]
  - - [512, 256, 1, 2048]
    - [27, 16268.8]
  - - [576, 256, 1, 2048]
    - [46, 20132.7]
  - - [640, 256, 1, 2048]
    - [10, 21648.0]
  - - [704, 256, 1, 2048]
    - [10, 20505.5]
  - - [768, 256, 1, 2048]
    - [11, 23008.8]
  - - [832, 256, 1, 2048]
    - [10, 24233.8]
  - - [896, 256, 1, 2048]
    - [10, 24090.4]
  - - [960, 256, 1, 2048]
    - [11, 26490.3]
  - - [1024, 256, 1, 2048]
    - [11, 24970.7]
  - - [256, 320, 1, 2048]
    - [223, 13421.8]
  - - [384, 320, 1, 2048]
    - [26, 16777.2]
  - - [512, 320, 1, 2048]
    - [77, 21648.0]
  - - [640, 320, 1, 2048]
    - [10, 23967.5]
  - - [768, 320, 1, 2048]
    - [10, 27206.3]
  - - [896, 320, 1, 2048]
    - [10, 27962.0]
  - - [1024, 320, 1, 2048]
    - [11, 29826.2]
  - - [192, 384, 1, 2048]
    - [149, 11615.0]
  - - [256, 384, 1, 2048]
    - [10, 13884.6]
  - - [320, 384, 1, 2048]
    - [147, 17355.7]
  - - [384, 384, 1, 2048]
    - [10, 20132.7]
  - - [448, 384, 1, 2048]
    - [10, 20724.8]
  - - [512, 384, 1, 2048]
    - [10, 23685.5]
  - - [576, 384, 1, 2048]
    - [11, 25884.8]
  - - [640, 384, 1, 2048]
    - [10, 27962.0]
  - - [704, 384, 1, 2048]
    - [10, 27007.2]
  - - [768, 384, 1, 2048]
    - [8, 27453.6]
  - - [832, 384, 1, 2048]
    - [11, 30433.1]
  - - [896, 384, 1, 2048]
    - [5, 32029.2]
  - - [960, 384, 1, 2048]
    - [92, 34317.0]
  - - [1024, 384, 1, 2048]
    - [1, 31580.6]
  - - [256, 448, 1, 2048]
    - [11, 16198.7]
  - - [384, 448, 1, 2048]
    - [10, 20724.8]
  - - [512, 448, 1, 2048]
    - [10, 26097.9]
  - - [640, 448, 1, 2048]
    - [119, 27962.0]
  - - [768, 448, 1, 2048]
    - [5, 32029.2]
  - - [896, 448, 1, 2048]
    - [46, 31618.6]
  - - [1024, 448, 1, 2048]
    - [6, 34164.5]
  - - [128, 512, 1, 2048]
    - [62, 11184.8]
  - - [192, 512, 1, 2048]
    - [10, 13884.6]
  - - [256, 512, 1, 2048]
    - [10, 17318.4]
  - - [320, 512, 1, 2048]
    - [11, 23141.0]
  - - [384, 512, 1, 2048]
    - [8, 22369.6]
  - - [448, 512, 1, 2048]
    - [11, 26843.5]
  - - [512, 512, 1, 2048]
    - [7, 27531.8]
  - - [576, 512, 1, 2048]
    - [7, 30199.0]
  - - [640, 512, 1, 2048]
    - [7, 33554.4]
  - - [704, 512, 1, 2048]
    - [11, 30130.5]
  - - [768, 512, 1, 2048]
    - [122, 32869.6]
  - - [832, 512, 1, 2048]
    - [2, 32921.3]
  - - [896, 512, 1, 2048]
    - [4, 34797.2]
  - - [960, 512, 1, 2048]
    - [4, 37986.1]
  - - [1024, 512, 1, 2048]
    - [51, 34087.0]
  - - [128, 576, 1, 2048]
    - [77, 11615.0]
  - - [256, 576, 1, 2048]
    - [10, 20132.7]
  - - [384, 576, 1, 2048]
    - [27, 25165.8]
  - - [512, 576, 1, 2048]
    - [7, 30199.0]
  - - [640, 576, 1, 2048]
    - [122, 30199.0]
  - - [768, 576, 1, 2048]
    - [0, 34187.5]
  - - [896, 576, 1, 2048]
    - [33, 33030.1]
  - - [1024, 576, 1, 2048]
    - [7, 35528.2]
  - - [128, 640, 1, 2048]
    - [185, 12427.6]
  - - [192, 640, 1, 2048]
    - [10, 16777.2]
  - - [256, 640, 1, 2048]
    - [46, 22369.6]
  - - [320, 640, 1, 2048]
    - [10, 22671.9]
  - - [384, 640, 1, 2048]
    - [10, 27962.0]
  - - [448, 640, 1, 2048]
    - [7, 28644.0]
  - - [512, 640, 1, 2048]
    - [7, 33554.4]
  - - [576, 640, 1, 2048]
    - [4, 29606.9]
  - - [640, 640, 1, 2048]
    - [37, 33554.4]
  - - [704, 640, 1, 2048]
    - [7, 34820.6]
  - - [768, 640, 1, 2048]
    - [4, 37282.7]
  - - [832, 640, 1, 2048]
    - [33, 34078.7]
  - - [896, 640, 1, 2048]
    - [51, 36700.2]
  - - [960, 640, 1, 2048]
    - [33, 40590.0]
  - - [1024, 640, 1, 2048]
    - [42, 40065.0]
  - - [128, 704, 1, 2048]
    - [182, 13182.1]
  - - [256, 704, 1, 2048]
    - [11, 21091.4]
  - - [384, 704, 1, 2048]
    - [7, 28392.2]
  - - [512, 704, 1, 2048]
    - [140, 28948.9]
  - - [640, 704, 1, 2048]
    - [6, 34175.8]
  - - [768, 704, 1, 2048]
    - [7, 33554.4]
  - - [896, 704, 1, 2048]
    - [5, 33995.9]
  - - [1024, 704, 1, 2048]
    - [51, 36909.9]
  - - [128, 768, 1, 2048]
    - [220, 14913.1]
  - - [192, 768, 1, 2048]
    - [10, 20132.7]
  - - [256, 768, 1, 2048]
    - [11, 22369.6]
  - - [320, 768, 1, 2048]
    - [11, 28760.9]
  - - [384, 768, 1, 2048]
    - [7, 30973.3]
  - - [448, 768, 1, 2048]
    - [5, 32774.1]
  - - [512, 768, 1, 2048]
    - [6, 30388.9]
  - - [576, 768, 1, 2048]
    - [2, 34187.5]
  - - [640, 768, 1, 2048]
    - [6, 37986.1]
  - - [704, 768, 1, 2048]
    - [146, 33053.6]
  - - [768, 768, 1, 2048]
    - [51, 38347.9]
  - - [832, 768, 1, 2048]
    - [7, 36862.6]
  - - [896, 768, 1, 2048]
    - [5, 35678.1]
  - - [960, 768, 1, 2048]
    - [5, 39219.5]
  - - [1024, 768, 1, 2048]
    - [33, 38809.9]
  - - [128, 832, 1, 2048]
    - [11, 15041.6]
  - - [256, 832, 1, 2048]
    - [10, 25659.3]
  - - [384, 832, 1, 2048]
    - [11, 31917.6]
  - - [512, 832, 1, 2048]
    - [105, 31724.2]
  - - [640, 832, 1, 2048]
    - [107, 34078.7]
  - - [768, 832, 1, 2048]
    - [112, 36350.6]
  - - [896, 832, 1, 2048]
    - [15, 35923.0]
  - - [1024, 832, 1, 2048]
    - [30, 37523.2]
  - - [128, 896, 1, 2048]
    - [27, 16198.7]
  - - [192, 896, 1, 2048]
    - [10, 20724.8]
  - - [256, 896, 1, 2048]
    - [11, 26843.5]
  - - [320, 896, 1, 2048]
    - [7, 29360.1]
  - - [384, 896, 1, 2048]
    - [5, 31317.5]
  - - [448, 896, 1, 2048]
    - [6, 29893.9]
  - - [512, 896, 1, 2048]
    - [7, 34797.2]
  - - [576, 896, 1, 2048]
    - [107, 34095.6]
  - - [640, 896, 1, 2048]
    - [107, 37884.0]
  - - [704, 896, 1, 2048]
    - [178, 37995.5]
  - - [768, 896, 1, 2048]
    - [3, 35678.1]
  - - [832, 896, 1, 2048]
    - [51, 37697.0]
  - - [896, 896, 1, 2048]
    - [15, 37796.9]
  - - [960, 896, 1, 2048]
    - [2, 37884.0]
  - - [1024, 896, 1, 2048]
    - [2, 39146.8]
  - - [128, 960, 1, 2048]
    - [10, 16236.0]
  - - [256, 960, 1, 2048]
    - [11, 28760.9]
  - - [384, 960, 1, 2048]
    - [5, 34317.0]
  - - [512, 960, 1, 2048]
    - [6, 37986.1]
  - - [640, 960, 1, 2048]
    - [37, 38130.0]
  - - [768, 960, 1, 2048]
    - [5, 37748.7]
  - - [896, 960, 1, 2048]
    - [35, 37086.5]
  - - [1024, 960, 1, 2048]
    - [0, 39092.5]
  - - [64, 1024, 1, 2048]
    - [62, 9942.05]
  - - [128, 1024, 1, 2048]
    - [10, 18512.8]
  - - [192, 1024, 1, 2048]
    - [10, 23685.5]
  - - [256, 1024, 1, 2048]
    - [7, 24970.7]
  - - [320, 1024, 1, 2048]
    - [7, 32736.0]
  - - [384, 1024, 1, 2048]
    - [140, 32212.3]
  - - [448, 1024, 1, 2048]
    - [4, 35453.7]
  - - [512, 1024, 1, 2048]
    - [107, 35204.6]
  - - [576, 1024, 1, 2048]
    - [7, 36058.5]
  - - [640, 1024, 1, 2048]
    - [114, 40672.0]
  - - [704, 1024, 1, 2048]
    - [51, 37377.1]
  - - [768, 1024, 1, 2048]
    - [51, 40265.3]
  - - [832, 1024, 1, 2048]
    - [9, 37124.1]
  - - [896, 1024, 1, 2048]
    - [30, 39558.9]
  - - [960, 1024, 1, 2048]
    - [30, 42835.4]
  - - [1024, 1024, 1, 2048]
    - [9, 39045.2]
  - - [512, 64, 1, 4096]
    - [54, 10737.4]
  - - [640, 64, 1, 4096]
    - [54, 11983.7]
  - - [768, 64, 1, 4096]
    - [55, 12988.8]
  - - [896, 64, 1, 4096]
    - [62, 12696.3]
  - - [1024, 64, 1, 4096]
    - [151, 13765.9]
  - - [256, 128, 1, 4096]
    - [54, 10737.4]
  - - [320, 128, 1, 4096]
    - [55, 13421.8]
  - - [384, 128, 1, 4096]
    - [182, 12988.8]
  - - [448, 128, 1, 4096]
    - [55, 15153.6]
  - - [512, 128, 1, 4096]
    - [185, 14510.0]
  - - [576, 128, 1, 4096]
    - [55, 16777.2]
  - - [640, 128, 1, 4096]
    - [185, 18137.5]
  - - [704, 128, 1, 4096]
    - [147, 17167.4]
  - - [768, 128, 1, 4096]
    - [133, 18302.4]
  - - [832, 128, 1, 4096]
    - [133, 19387.0]
  - - [896, 128, 1, 4096]
    - [46, 20424.4]
  - - [960, 128, 1, 4096]
    - [132, 20971.5]
  - - [1024, 128, 1, 4096]
    - [26, 22845.6]
  - - [256, 192, 1, 4096]
    - [121, 12988.8]
  - - [384, 192, 1, 4096]
    - [59, 17256.6]
  - - [512, 192, 1, 4096]
    - [62, 19174.0]
  - - [640, 192, 1, 4096]
    - [181, 23410.1]
  - - [768, 192, 1, 4096]
    - [77, 24652.2]
  - - [896, 192, 1, 4096]
    - [87, 25623.4]
  - - [1024, 192, 1, 4096]
    - [25, 28760.9]
  - - [128, 256, 1, 4096]
    - [54, 11671.1]
  - - [192, 256, 1, 4096]
    - [55, 13421.8]
  - - [256, 256, 1, 4096]
    - [68, 14913.1]
  - - [320, 256, 1, 4096]
    - [179, 19174.0]
  - - [384, 256, 1, 4096]
    - [133, 19174.0]
  - - [448, 256, 1, 4096]
    - [46, 20878.3]
  - - [512, 256, 1, 4096]
    - [26, 24970.7]
  - - [576, 256, 1, 4096]
    - [26, 26843.5]
  - - [640, 256, 1, 4096]
    - [26, 30504.0]
  - - [704, 256, 1, 4096]
    - [25, 26364.2]
  - - [768, 256, 1, 4096]
    - [135, 28256.4]
  - - [832, 256, 1, 4096]
    - [10, 31157.7]
  - - [896, 256, 1, 4096]
    - [92, 31317.5]
  - - [960, 256, 1, 4096]
    - [87, 35320.5]
  - - [1024, 256, 1, 4096]
    - [79, 33038.2]
  - - [128, 320, 1, 4096]
    - [209, 11983.7]
  - - [256, 320, 1, 4096]
    - [62, 19737.9]
  - - [384, 320, 1, 4096]
    - [220, 23967.5]
  - - [512, 320, 1, 4096]
    - [77, 29177.8]
  - - [640, 320, 1, 4096]
    - [11, 31068.9]
  - - [768, 320, 1, 4096]
    - [87, 35951.2]
  - - [896, 320, 1, 4096]
    - [79, 35588.0]
  - - [1024, 320, 1, 4096]
    - [79, 38347.9]
  - - [128, 384, 1, 4096]
    - [220, 12988.8]
  - - [192, 384, 1, 4096]
    - [61, 17764.1]
  - - [256, 384, 1, 4096]
    - [181, 19641.6]
  - - [320, 384, 1, 4096]
    - [135, 23967.5]
  - - [384, 384, 1, 4096]
    - [26, 28092.1]
  - - [448, 384, 1, 4096]
    - [25, 26590.3]
  - - [512, 384, 1, 4096]
    - [25, 29826.2]
  - - [576, 384, 1, 4096]
    - [87, 34187.5]
  - - [640, 384, 1, 4096]
    - [11, 36604.8]
  - - [704, 384, 1, 4096]
    - [7, 34070.7]
  - - [768, 384, 1, 4096]
    - [43, 37168.0]
  - - [832, 384, 1, 4096]
    - [7, 39063.4]
  - - [896, 384, 1, 4096]
    - [5, 39698.2]
  - - [960, 384, 1, 4096]
    - [5, 41368.5]
  - - [1024, 384, 1, 4096]
    - [50, 40265.3]
  - - [128, 448, 1, 4096]
    - [181, 15153.6]
  - - [256, 448, 1, 4096]
    - [181, 22369.6]
  - - [384, 448, 1, 4096]
    - [136, 26590.3]
  - - [512, 448, 1, 4096]
    - [184, 34164.5]
  - - [640, 448, 1, 4096]
    - [7, 36700.2]
  - - [768, 448, 1, 4096]
    - [5, 38610.6]
  - - [896, 448, 1, 4096]
    - [46, 36537.0]
  - - [1024, 448, 1, 4096]
    - [6, 39979.7]
  - - [64, 512, 1, 4096]
    - [150, 9942.05]
  - - [128, 512, 1, 4096]
    - [151, 15339.2]
  - - [192, 512, 1, 4096]
    - [181, 19641.6]
  - - [256, 512, 1, 4096]
    - [26, 26188.8]
  - - [320, 512, 1, 4096]
    - [26, 30504.0]
  - - [384, 512, 1, 4096]
    - [11, 27298.5]
  - - [448, 512, 1, 4096]
    - [87, 34164.5]
  - - [512, 512, 1, 4096]
    - [80, 34087.0]
  - - [576, 512, 1, 4096]
    - [7, 37748.7]
  - - [640, 512, 1, 4096]
    - [7, 40672.0]
  - - [704, 512, 1, 4096]
    - [47, 38347.9]
  - - [768, 512, 1, 4096]
    - [122, 38347.9]
  - - [832, 512, 1, 4096]
    - [160, 38774.0]
  - - [896, 512, 1, 4096]
    - [2, 41756.6]
  - - [960, 512, 1, 4096]
    - [4, 44247.6]
  - - [1024, 512, 1, 4096]
    - [33, 38008.6]
  - - [128, 576, 1, 4096]
    - [61, 16777.2]
  - - [256, 576, 1, 4096]
    - [156, 26260.0]
  - - [384, 576, 1, 4096]
    - [92, 33554.4]
  - - [512, 576, 1, 4096]
    - [7, 37168.0]
  - - [640, 576, 1, 4096]
    - [184, 40265.3]
  - - [768, 576, 1, 4096]
    - [6, 40717.7]
  - - [896, 576, 1, 4096]
    - [51, 38088.8]
  - - [1024, 576, 1, 4096]
    - [7, 40603.7]
  - - [64, 640, 1, 4096]
    - [155, 12905.6]
  - - [128, 640, 1, 4096]
    - [179, 17660.2]
  - - [192, 640, 1, 4096]
    - [26, 22369.6]
  - - [256, 640, 1, 4096]
    - [77, 27391.4]
  - - [320, 640, 1, 4096]
    - [136, 30504.0]
  - - [384, 640, 1, 4096]
    - [11, 34711.5]
  - - [448, 640, 1, 4096]
    - [7, 37282.7]
  - - [512, 640, 1, 4096]
    - [7, 41297.8]
  - - [576, 640, 1, 4096]
    - [92, 38716.7]
  - - [640, 640, 1, 4096]
    - [50, 43577.2]
  - - [704, 640, 1, 4096]
    - [4, 41471.8]
  - - [768, 640, 1, 4096]
    - [4, 44739.2]
  - - [832, 640, 1, 4096]
    - [51, 40389.6]
  - - [896, 640, 1, 4096]
    - [51, 41943.0]
  - - [960, 640, 1, 4096]
    - [7, 42653.9]
  - - [1024, 640, 1, 4096]
    - [7, 44005.8]
  - - [128, 704, 1, 4096]
    - [135, 18004.8]
  - - [256, 704, 1, 4096]
    - [25, 27856.5]
  - - [384, 704, 1, 4096]
    - [79, 35152.3]
  - - [512, 704, 1, 4096]
    - [1, 36454.2]
  - - [640, 704, 1, 4096]
    - [0, 40560.3]
  - - [768, 704, 1, 4096]
    - [7, 37856.3]
  - - [896, 704, 1, 4096]
    - [112, 41011.0]
  - - [1024, 704, 1, 4096]
    - [37, 37856.3]
  - - [64, 768, 1, 4096]
    - [55, 13884.6]
  - - [128, 768, 1, 4096]
    - [27, 19641.6]
  - - [192, 768, 1, 4096]
    - [165, 26843.5]
  - - [256, 768, 1, 4096]
    - [11, 29283.9]
  - - [320, 768, 1, 4096]
    - [136, 38716.7]
  - - [384, 768, 1, 4096]
    - [7, 39605.2]
  - - [448, 768, 1, 4096]
    - [5, 39146.8]
  - - [512, 768, 1, 4096]
    - [140, 37456.1]
  - - [576, 768, 1, 4096]
    - [4, 40717.7]
  - - [640, 768, 1, 4096]
    - [0, 44739.2]
  - - [704, 768, 1, 4096]
    - [51, 37220.0]
  - - [768, 768, 1, 4096]
    - [103, 40603.7]
  - - [832, 768, 1, 4096]
    - [168, 40894.5]
  - - [896, 768, 1, 4096]
    - [189, 40848.9]
  - - [960, 768, 1, 4096]
    - [5, 42835.4]
  - - [1024, 768, 1, 4096]
    - [143, 40015.2]
  - - [128, 832, 1, 4096]
    - [26, 21278.4]
  - - [256, 832, 1, 4096]
    - [87, 31724.2]
  - - [384, 832, 1, 4096]
    - [119, 37931.1]
  - - [512, 832, 1, 4096]
    - [6, 37931.1]
  - - [640, 832, 1, 4096]
    - [111, 40389.6]
  - - [768, 832, 1, 4096]
    - [119, 42556.8]
  - - [896, 832, 1, 4096]
    - [37, 38897.5]
  - - [1024, 832, 1, 4096]
    - [2, 39655.2]
  - - [64, 896, 1, 4096]
    - [182, 15658.7]
  - - [128, 896, 1, 4096]
    - [135, 23488.1]
  - - [192, 896, 1, 4096]
    - [184, 26590.3]
  - - [256, 896, 1, 4096]
    - [136, 34797.2]
  - - [320, 896, 1, 4096]
    - [43, 37282.7]
  - - [384, 896, 1, 4096]
    - [184, 38088.8]
  - - [448, 896, 1, 4096]
    - [4, 36947.6]
  - - [512, 896, 1, 4096]
    - [0, 40848.9]
  - - [576, 896, 1, 4096]
    - [107, 41047.2]
  - - [640, 896, 1, 4096]
    - [111, 42320.9]
  - - [704, 896, 1, 4096]
    - [178, 41011.0]
  - - [768, 896, 1, 4096]
    - [30, 40848.9]
  - - [832, 896, 1, 4096]
    - [50, 40177.0]
  - - [896, 896, 1, 4096]
    - [15, 39858.6]
  - - [960, 896, 1, 4096]
    - [2, 40265.3]
  - - [1024, 896, 1, 4096]
    - [2, 42464.4]
  - - [128, 960, 1, 4096]
    - [26, 21883.3]
  - - [256, 960, 1, 4096]
    - [10, 35951.2]
  - - [384, 960, 1, 4096]
    - [5, 41943.0]
  - - [512, 960, 1, 4096]
    - [6, 43766.7]
  - - [640, 960, 1, 4096]
    - [114, 40590.0]
  - - [768, 960, 1, 4096]
    - [5, 42533.8]
  - - [896, 960, 1, 4096]
    - [0, 39810.3]
  - - [1024, 960, 1, 4096]
    - [0, 43766.7]
  - - [64, 1024, 1, 4096]
    - [152, 14510.0]
  - - [128, 1024, 1, 4096]
    - [11, 22845.6]
  - - [192, 1024, 1, 4096]
    - [184, 29826.2]
  - - [256, 1024, 1, 4096]
    - [105, 33554.4]
  - - [320, 1024, 1, 4096]
    - [7, 41297.8]
  - - [384, 1024, 1, 4096]
    - [122, 38809.9]
  - - [448, 1024, 1, 4096]
    - [2, 40848.9]
  - - [512, 1024, 1, 4096]
    - [107, 39768.2]
  - - [576, 1024, 1, 4096]
    - [7, 40265.3]
  - - [640, 1024, 1, 4096]
    - [7, 41617.9]
  - - [704, 1024, 1, 4096]
    - [51, 39902.6]
  - - [768, 1024, 1, 4096]
    - [33, 42665.2]
  - - [832, 1024, 1, 4096]
    - [2, 40342.9]
  - - [896, 1024, 1, 4096]
    - [2, 42705.6]
  - - [960, 1024, 1, 4096]
    - [2, 45497.5]
  - - [1024, 1024, 1, 4096]
    - [111, 38868.5]
  - - [3072, 64, 1, 3072]
    - [86, 20473.9]
  - - [3072, 128, 1, 3072]
    - [122, 31788.4]
  - - [3072, 192, 1, 3072]
    - [112, 34187.5]
  - - [3072, 256, 1, 3072]
    - [50, 38966.4]
  - - [3072, 320, 1, 3072]
    - [119, 39219.5]
  - - [3072, 384, 1, 3072]
    - [50, 41180.4]
  - - [3072, 448, 1, 3072]
    - [0, 41247.4]
  - - [3072, 512, 1, 3072]
    - [50, 40433.8]
  - - [3072, 576, 1, 3072]
    - [0, 41180.4]
  - - [3072, 640, 1, 3072]
    - [2, 43925.8]
  - - [3072, 704, 1, 3072]
    - [2, 39428.9]
  - - [3072, 768, 1, 3072]
    - [2, 41653.8]
  - - [3072, 832, 1, 3072]
    - [2, 38966.4]
  - - [576, 4096, 1, 64]
    - [246, 13481.7]
  - - [832, 4096, 1, 64]
    - [22, 11789.4]
  - - [1088, 4096, 1, 64]
    - [16, 12676.1]
  - - [1344, 4096, 1, 64]
    - [22, 13550.8]
  - - [1600, 4096, 1, 64]
    - [22, 14218.0]
  - - [1856, 4096, 1, 64]
    - [17, 14970.4]
  - - [2112, 4096, 1, 64]
    - [31, 14963.5]
  - - [2368, 4096, 1, 64]
    - [19, 15518.9]
  - - [2624, 4096, 1, 64]
    - [22, 15996.9]
  - - [2880, 4096, 1, 64]
    - [17, 16412.5]
  - - [3136, 4096, 1, 64]
    - [22, 16441.7]
  - - [3392, 4096, 1, 64]
    - [28, 16777.2]
  - - [3648, 4096, 1, 64]
    - [20, 16777.2]
  - - [3904, 4096, 1, 64]
    - [16, 17200.2]
  - - [320, 4096, 1, 256]
    - [229, 20712.6]
  - - [576, 4096, 1, 256]
    - [242, 27705.5]
  - - [832, 4096, 1, 256]
    - [15, 27263.0]
  - - [1088, 4096, 1, 256]
    - [28, 28882.3]
  - - [1344, 4096, 1, 256]
    - [29, 29360.1]
  - - [1600, 4096, 1, 256]
    - [22, 29959.3]
  - - [1856, 4096, 1, 256]
    - [28, 29712.3]
  - - [2112, 4096, 1, 256]
    - [30, 31412.7]
  - - [2368, 4096, 1, 256]
    - [30, 31630.9]
  - - [2624, 4096, 1, 256]
    - [30, 30915.3]
  - - [2880, 4096, 1, 256]
    - [35, 32126.6]
  - - [3136, 4096, 1, 256]
    - [19, 31467.3]
  - - [3392, 4096, 1, 256]
    - [129, 31337.2]
  - - [3648, 4096, 1, 256]
    - [163, 31876.7]
  - - [3904, 4096, 1, 256]
    - [18, 32360.8]
  - - [64, 4096, 1, 512]
    - [240, 14510.0]
  - - [320, 4096, 1, 512]
    - [244, 26011.2]
  - - [576, 4096, 1, 512]
    - [246, 32385.0]
  - - [832, 4096, 1, 512]
    - [31, 34551.1]
  - - [1088, 4096, 1, 512]
    - [16, 34311.3]
  - - [1344, 4096, 1, 512]
    - [3, 35232.2]
  - - [1600, 4096, 1, 512]
    - [51, 36275.1]
  - - [1856, 4096, 1, 512]
    - [9, 35546.2]
  - - [2112, 4096, 1, 512]
    - [31, 36909.9]
  - - [2368, 4096, 1, 512]
    - [35, 36785.6]
  - - [2624, 4096, 1, 512]
    - [30, 36564.3]
  - - [2880, 4096, 1, 512]
    - [35, 37514.3]
  - - [3136, 4096, 1, 512]
    - [19, 36537.0]
  - - [3392, 4096, 1, 512]
    - [30, 35746.4]
  - - [3648, 4096, 1, 512]
    - [30, 37137.9]
  - - [64, 4096, 1, 1024]
    - [240, 17777.2]
  - - [320, 4096, 1, 1024]
    - [238, 29628.6]
  - - [576, 4096, 1, 1024]
    - [252, 35089.6]
  - - [832, 4096, 1, 1024]
    - [30, 36350.6]
  - - [1088, 4096, 1, 1024]
    - [3, 37100.8]
  - - [1344, 4096, 1, 1024]
    - [2, 37833.2]
  - - [1600, 4096, 1, 1024]
    - [51, 38238.7]
  - - [1856, 4096, 1, 1024]
    - [35, 37426.1]
  - - [64, 4096, 1, 2048]
    - [256, 20768.7]
  - - [320, 4096, 1, 2048]
    - [244, 33201.7]
  - - [576, 4096, 1, 2048]
    - [250, 35897.8]
  - - [832, 4096, 1, 2048]
    - [2, 39209.7]
  - - [64, 4096, 1, 4096]
    - [250, 20164.2]
  - - [320, 4096, 1, 4096]
    - [248, 25767.7]
  - - [4096, 576, 1, 64]
    - [117, 8882.06]
  - - [4096, 832, 1, 64]
    - [22, 11479.1]
  - - [4096, 1088, 1, 64]
    - [22, 12136.7]
  - - [4096, 1344, 1, 64]
    - [22, 13295.2]
  - - [4096, 1600, 1, 64]
    - [127, 14218.0]
  - - [4096, 1856, 1, 64]
    - [22, 14523.6]
  - - [4096, 2112, 1, 64]
    - [22, 14764.0]
  - - [4096, 2368, 1, 64]
    - [127, 15518.9]
  - - [4096, 2624, 1, 64]
    - [38, 15633.3]
  - - [4096, 2880, 1, 64]
    - [128, 16063.3]
  - - [4096, 3136, 1, 64]
    - [22, 16441.7]
  - - [4096, 3392, 1, 64]
    - [39, 16315.5]
  - - [4096, 3648, 1, 64]
    - [20, 16631.3]
  - - [4096, 3904, 1, 64]
    - [127, 16915.9]
  - - [4096, 320, 1, 256]
    - [188, 18641.4]
  - - [4096, 576, 1, 256]
    - [106, 23685.5]
  - - [4096, 832, 1, 256]
    - [22, 26843.5]
  - - [4096, 1088, 1, 256]
    - [39, 28882.3]
  - - [4096, 1344, 1, 256]
    - [22, 27906.7]
  - - [4096, 1600, 1, 256]
    - [127, 30229.2]
  - - [4096, 1856, 1, 256]
    - [113, 30173.0]
  - - [4096, 2112, 1, 256]
    - [38, 29726.1]
  - - [4096, 2368, 1, 256]
    - [40, 30845.1]
  - - [4096, 2624, 1, 256]
    - [39, 31090.0]
  - - [4096, 2880, 1, 256]
    - [40, 30815.3]
  - - [4096, 3136, 1, 256]
    - [18, 30732.1]
  - - [4096, 3392, 1, 256]
    - [19, 30530.2]
  - - [4096, 3648, 1, 256]
    - [35, 31483.2]
  - - [4096, 3904, 1, 256]
    - [19, 30895.4]
  - - [4096, 64, 1, 512]
    - [120, 10324.4]
  - - [4096, 320, 1, 512]
    - [123, 27391.4]
  - - [4096, 576, 1, 512]
    - [106, 30581.3]
  - - [4096, 832, 1, 512]
    - [116, 32613.7]
  - - [4096, 1088, 1, 512]
    - [37, 33068.1]
  - - [4096, 1344, 1, 512]
    - [35, 34583.7]
  - - [4096, 1600, 1, 512]
    - [37, 33723.0]
  - - [4096, 1856, 1, 512]
    - [18, 34752.8]
  - - [4096, 2112, 1, 512]
    - [37, 35292.3]
  - - [4096, 2368, 1, 512]
    - [18, 35345.6]
  - - [4096, 2624, 1, 512]
    - [37, 36443.2]
  - - [4096, 2880, 1, 512]
    - [164, 35320.5]
  - - [4096, 3136, 1, 512]
    - [19, 36135.5]
  - - [4096, 3392, 1, 512]
    - [19, 35390.7]
  - - [4096, 3648, 1, 512]
    - [35, 32554.9]
  - - [4096, 64, 1, 1024]
    - [112, 13094.4]
  - - [4096, 320, 1, 1024]
    - [120, 33554.4]
  - - [4096, 576, 1, 1024]
    - [0, 36604.8]
  - - [4096, 832, 1, 1024]
    - [3, 35608.8]
  - - [4096, 1088, 1, 1024]
    - [2, 35651.6]
  - - [4096, 1344, 1, 1024]
    - [2, 36964.9]
  - - [4096, 1600, 1, 1024]
    - [37, 37914.6]
  - - [4096, 1856, 1, 1024]
    - [33, 36719.9]
  - - [4096, 64, 1, 2048]
    - [97, 17895.7]
  - - [4096, 320, 1, 2048]
    - [112, 38076.0]
  - - [4096, 576, 1, 2048]
    - [6, 38500.7]
  - - [4096, 832, 1, 2048]
    - [114, 37624.4]
  - - [4096, 64, 1, 4096]
    - [77, 21053.8]
  - - [4096, 320, 1, 4096]
    - [43, 32244.5]
  - - [64, 256, 1, 8192]
    - [63, 8659.21]
  - - [64, 512, 1, 8192]
    - [54, 14913.1]
  - - [64, 1024, 1, 8192]
    - [153, 20259.3]
  - - [64, 2048, 1, 8192]
    - [245, 19976.6]
