projects/hipblaslt/library/src/amd_detail/rocblaslt/src/Tensile/Logic/asm_full/gfx1151/GridBased/gfx1151_Cijk_Ailk_Bljk_S_B_Bias_HAS_SAV_UserArgs.yaml
- {MinimumRequiredVersion: 5.0.0}
- gfx1151
- gfx1151
- [Device 1536]
    SolutionIndex: 0
    SolutionNameMin: Cijk_Ailk_Bljk_S_B_Bias_HA_S_SAV_UserArgs_MT112x64x32_SN_LDSB0_AFC1_AG0_AFEM1_AFEM1_ASEM1_CLR0_CADS0_DTLA0_DTLB0_DTVA0_DTVB0_DTVMXSA0_DTVMXSB0_DTVSM0_DPLB0_EPS0_ELFLR0_EMLLn1_FDSI0_GRPM1_GRVWA1_GRVWB1_GSU1_GSUAMB_GSUC0_GSUWGMRR0_GLS0_ISA1151_IU1_K1_LDSTI0_LBSPPA0_LBSPPB0_LBSPPM0_LPA0_LPB1_LPM0_LRVW1_LWPMn1_MIAV0_MXLIA_MXSFA_MO40_MGRIPM1_NTn1_NTA0_NTB0_NTC0_NTD0_NTM0_NEPBS0_NLCA7_NLCB1_ONLL1_PGR0_PLR1_PKA0_SGROB0_SIA1_SS0_SU4_SUM0_SUS256_SPO0_SRVW0_SSO0_SVW1_SK0_SKFTR0_SKXCCM0_SIP1_SGRO0_TDMI0_TDMS0_TIN0_TT7_8_TLDS0_TLDSMn1_ULSGRO0_USL1_USLMX0_UIOFGRO0_UPLRP0_USFGROn1_USI0_VSn1_VWA1_VWB1_WSGRA0_WSGRB0_WS32_WG16_8_1_WGM5_WGMXCC1_WGMXCCGn1
    SolutionIndex: 1
    SolutionNameMin: Cijk_Ailk_Bljk_S_B_Bias_HA_S_SAV_UserArgs_MT112x64x16_SN_LDSB0_AFC1_AG0_AFEM1_AFEM1_ASEM1_CLR0_CADS0_DTLA0_DTLB0_DTVA0_DTVB0_DTVMXSA0_DTVMXSB0_DTVSM0_DPLB0_EPS0_ELFLR0_EMLLn1_FDSI0_GRPM1_GRVWA1_GRVWB1_GSU1_GSUAMB_GSUC0_GSUWGMRR0_GLS0_ISA1151_IU1_K1_LDSTI0_LBSPPA0_LBSPPB0_LBSPPM0_LPA0_LPB1_LPM0_LRVW1_LWPMn1_MIAV0_MXLIA_MXSFA_MO40_MGRIPM1_NTn1_NTA0_NTB0_NTC0_NTD0_NTM0_NEPBS0_NLCA7_NLCB1_ONLL1_PGR1_PLR1_PKA0_SGROB0_SIA1_SS0_SU0_SUM0_SUS0_SPO0_SRVW0_SSO0_SVW1_SK0_SKFTR0_SKXCCM0_SIP1_SGRO0_TDMI0_TDMS0_TIN0_TT7_8_TLDS0_TLDSMn1_ULSGRO0_USL1_USLMX0_UIOFGRO0_UPLRP0_USFGROn1_USI0_VSn1_VWA1_VWB1_WSGRA0_WSGRB0_WS32_WG16_8_1_WGM1_WGMXCC1_WGMXCCGn1
    SolutionIndex: 2
    SolutionNameMin: Cijk_Ailk_Bljk_S_B_Bias_HA_S_SAV_UserArgs_MT112x64x16_SN_LDSB0_AFC1_AG0_AFEM1_AFEM1_ASEM1_CLR0_CADS0_DTLA0_DTLB0_DTVA0_DTVB0_DTVMXSA0_DTVMXSB0_DTVSM0_DPLB0_EPS0_ELFLR0_EMLLn1_FDSI0_GRPM1_GRVWA1_GRVWB1_GSU1_GSUAMB_GSUC0_GSUWGMRR0_GLS0_ISA1151_IU1_K1_LDSTI0_LBSPPA0_LBSPPB0_LBSPPM0_LPA0_LPB1_LPM0_LRVW1_LWPMn1_MIAV0_MXLIA_MXSFA_MO40_MGRIPM1_NTn1_NTA0_NTB0_NTC0_NTD0_NTM0_NEPBS0_NLCA7_NLCB1_ONLL1_PGR1_PLR1_PKA0_SGROB0_SIA1_SS0_SU16_SUM0_SUS256_SPO0_SRVW0_SSO0_SVW1_SK0_SKFTR0_SKXCCM0_SIP1_SGRO0_TDMI0_TDMS0_TIN0_TT7_8_TLDS0_TLDSMn1_ULSGRO0_USL1_USLMX0_UIOFGRO0_UPLRP0_USFGROn1_USI0_VSn1_VWA1_VWB1_WSGRA0_WSGRB0_WS32_WG16_8_1_WGM10_WGMXCC1_WGMXCCGn1
    SolutionIndex: 3
    SolutionNameMin: Cijk_Ailk_Bljk_S_B_Bias_HA_S_SAV_UserArgs_MT112x64x16_SN_LDSB0_AFC1_AG0_AFEM1_AFEM1_ASEM1_CLR0_CADS0_DTLA0_DTLB0_DTVA0_DTVB0_DTVMXSA0_DTVMXSB0_DTVSM0_DPLB0_EPS0_ELFLR0_EMLLn1_FDSI0_GRPM1_GRVWA1_GRVWB1_GSU1_GSUAMB_GSUC0_GSUWGMRR0_GLS0_ISA1151_IU1_K1_LDSTI0_LBSPPA0_LBSPPB0_LBSPPM0_LPA0_LPB1_LPM0_LRVW1_LWPMn1_MIAV0_MXLIA_MXSFA_MO40_MGRIPM1_NTn1_NTA0_NTB0_NTC0_NTD0_NTM0_NEPBS0_NLCA7_NLCB1_ONLL1_PGR1_PLR1_PKA0_SGROB0_SIA1_SS0_SU16_SUM0_SUS256_SPO0_SRVW0_SSO0_SVW1_SK0_SKFTR0_SKXCCM0_SIP1_SGRO0_TDMI0_TDMS0_TIN0_TT7_8_TLDS0_TLDSMn1_ULSGRO0_USL1_USLMX0_UIOFGRO0_UPLRP0_USFGROn1_USI0_VSn1_VWA1_VWB1_WSGRA0_WSGRB0_WS32_WG16_8_1_WGM5_WGMXCC1_WGMXCCGn1
    SolutionIndex: 4
    SolutionNameMin: Cijk_Ailk_Bljk_S_B_Bias_HA_S_SAV_UserArgs_MT112x64x16_SN_LDSB0_AFC1_AG0_AFEM1_AFEM1_ASEM1_CLR0_CADS0_DTLA0_DTLB0_DTVA0_DTVB0_DTVMXSA0_DTVMXSB0_DTVSM0_DPLB0_EPS0_ELFLR0_EMLLn1_FDSI0_GRPM1_GRVWA1_GRVWB1_GSU1_GSUAMB_GSUC0_GSUWGMRR0_GLS0_ISA1151_IU1_K1_LDSTI0_LBSPPA0_LBSPPB0_LBSPPM0_LPA0_LPB1_LPM0_LRVW1_LWPMn1_MIAV0_MXLIA_MXSFA_MO40_MGRIPM1_NTn1_NTA0_NTB0_NTC0_NTD0_NTM0_NEPBS0_NLCA7_NLCB1_ONLL1_PGR1_PLR1_PKA0_SGROB0_SIA1_SS0_SU0_SUM0_SUS0_SPO0_SRVW0_SSO0_SVW1_SK0_SKFTR0_SKXCCM0_SIP1_SGRO0_TDMI0_TDMS0_TIN0_TT7_8_TLDS0_TLDSMn1_ULSGRO0_USL1_USLMX0_UIOFGRO0_UPLRP0_USFGROn1_USI0_VSn1_VWA1_VWB1_WSGRA0_WSGRB0_WS32_WG16_8_1_WGM8_WGMXCC1_WGMXCCGn1
    SolutionIndex: 5
    SolutionNameMin: Cijk_Ailk_Bljk_S_B_Bias_HA_S_SAV_UserArgs_MT112x64x16_SN_LDSB0_AFC1_AG0_AFEM1_AFEM1_ASEM1_CLR0_CADS0_DTLA0_DTLB0_DTVA0_DTVB0_DTVMXSA0_DTVMXSB0_DTVSM0_DPLB0_EPS0_ELFLR0_EMLLn1_FDSI0_GRPM1_GRVWA1_GRVWB1_GSU1_GSUAMB_GSUC0_GSUWGMRR0_GLS0_ISA1151_IU1_K1_LDSTI0_LBSPPA0_LBSPPB0_LBSPPM0_LPA0_LPB1_LPM0_LRVW1_LWPMn1_MIAV0_MXLIA_MXSFA_MO40_MGRIPM1_NTn1_NTA0_NTB0_NTC0_NTD0_NTM0_NEPBS0_NLCA7_NLCB1_ONLL1_PGR1_PLR1_PKA0_SGROB0_SIA1_SS0_SU0_SUM0_SUS0_SPO0_SRVW0_SSO0_SVW1_SK0_SKFTR0_SKXCCM0_SIP1_SGRO0_TDMI0_TDMS0_TIN0_TT7_8_TLDS0_TLDSMn1_ULSGRO0_USL1_USLMX0_UIOFGRO0_UPLRP0_USFGROn1_USI0_VSn1_VWA1_VWB1_WSGRA0_WSGRB0_WS32_WG16_8_1_WGM2_WGMXCC1_WGMXCCGn1
    SolutionIndex: 6
    SolutionNameMin: Cijk_Ailk_Bljk_S_B_Bias_HA_S_SAV_UserArgs_MT112x64x16_SN_LDSB0_AFC1_AG0_AFEM1_AFEM1_ASEM1_CLR0_CADS0_DTLA0_DTLB0_DTVA0_DTVB0_DTVMXSA0_DTVMXSB0_DTVSM0_DPLB0_EPS0_ELFLR0_EMLLn1_FDSI0_GRPM1_GRVWA1_GRVWB1_GSU1_GSUAMB_GSUC0_GSUWGMRR0_GLS0_ISA1151_IU1_K1_LDSTI0_LBSPPA0_LBSPPB0_LBSPPM0_LPA0_LPB1_LPM0_LRVW1_LWPMn1_MIAV0_MXLIA_MXSFA_MO40_MGRIPM1_NTn1_NTA0_NTB0_NTC0_NTD0_NTM0_NEPBS0_NLCA7_NLCB1_ONLL1_PGR1_PLR1_PKA0_SGROB0_SIA1_SS0_SU8_SUM0_SUS256_SPO0_SRVW0_SSO0_SVW1_SK0_SKFTR0_SKXCCM0_SIP1_SGRO0_TDMI0_TDMS0_TIN0_TT7_8_TLDS0_TLDSMn1_ULSGRO0_USL1_USLMX0_UIOFGRO0_UPLRP0_USFGROn1_USI0_VSn1_VWA1_VWB1_WSGRA0_WSGRB0_WS32_WG16_8_1_WGM8_WGMXCC1_WGMXCCGn1
    SolutionIndex: 7
    SolutionNameMin: Cijk_Ailk_Bljk_S_B_Bias_HA_S_SAV_UserArgs_MT112x64x16_SN_LDSB0_AFC1_AG0_AFEM1_AFEM1_ASEM1_CLR0_CADS0_DTLA0_DTLB0_DTVA0_DTVB0_DTVMXSA0_DTVMXSB0_DTVSM0_DPLB0_EPS0_ELFLR0_EMLLn1_FDSI0_GRPM1_GRVWA1_GRVWB1_GSU1_GSUAMB_GSUC0_GSUWGMRR0_GLS0_ISA1151_IU1_K1_LDSTI0_LBSPPA0_LBSPPB0_LBSPPM0_LPA0_LPB1_LPM0_LRVW1_LWPMn1_MIAV0_MXLIA_MXSFA_MO40_MGRIPM1_NTn1_NTA0_NTB0_NTC0_NTD0_NTM0_NEPBS0_NLCA7_NLCB1_ONLL1_PGR1_PLR1_PKA0_SGROB0_SIA1_SS0_SU8_SUM0_SUS256_SPO0_SRVW0_SSO0_SVW1_SK0_SKFTR0_SKXCCM0_SIP1_SGRO0_TDMI0_TDMS0_TIN0_TT7_8_TLDS0_TLDSMn1_ULSGRO0_USL1_USLMX0_UIOFGRO0_UPLRP0_USFGROn1_USI0_VSn1_VWA1_VWB1_WSGRA0_WSGRB0_WS32_WG16_8_1_WGM2_WGMXCC1_WGMXCCGn1
    SolutionIndex: 8
    SolutionNameMin: Cijk_Ailk_Bljk_S_B_Bias_HA_S_SAV_UserArgs_MT112x64x16_SN_LDSB0_AFC1_AG0_AFEM1_AFEM1_ASEM1_CLR0_CADS0_DTLA0_DTLB0_DTVA0_DTVB0_DTVMXSA0_DTVMXSB0_DTVSM0_DPLB0_EPS0_ELFLR0_EMLLn1_FDSI0_GRPM1_GRVWA1_GRVWB1_GSU1_GSUAMB_GSUC0_GSUWGMRR0_GLS0_ISA1151_IU1_K1_LDSTI0_LBSPPA0_LBSPPB0_LBSPPM0_LPA0_LPB1_LPM0_LRVW1_LWPMn1_MIAV0_MXLIA_MXSFA_MO40_MGRIPM1_NTn1_NTA0_NTB0_NTC0_NTD0_NTM0_NEPBS0_NLCA7_NLCB1_ONLL1_PGR1_PLR1_PKA0_SGROB0_SIA1_SS0_SU16_SUM0_SUS256_SPO0_SRVW0_SSO0_SVW1_SK0_SKFTR0_SKXCCM0_SIP1_SGRO0_TDMI0_TDMS0_TIN0_TT7_8_TLDS0_TLDSMn1_ULSGRO0_USL1_USLMX0_UIOFGRO0_UPLRP0_USFGROn1_USI0_VSn1_VWA1_VWB1_WSGRA0_WSGRB0_WS32_WG16_8_1_WGM8_WGMXCC1_WGMXCCGn1
    SolutionIndex: 9
    SolutionNameMin: Cijk_Ailk_Bljk_S_B_Bias_HA_S_SAV_UserArgs_MT112x64x16_SN_LDSB0_AFC1_AG0_AFEM1_AFEM1_ASEM1_CLR0_CADS0_DTLA0_DTLB0_DTVA0_DTVB0_DTVMXSA0_DTVMXSB0_DTVSM0_DPLB0_EPS0_ELFLR0_EMLLn1_FDSI0_GRPM1_GRVWA1_GRVWB1_GSU1_GSUAMB_GSUC0_GSUWGMRR0_GLS0_ISA1151_IU1_K1_LDSTI0_LBSPPA0_LBSPPB0_LBSPPM0_LPA0_LPB1_LPM0_LRVW1_LWPMn1_MIAV0_MXLIA_MXSFA_MO40_MGRIPM1_NTn1_NTA0_NTB0_NTC0_NTD0_NTM0_NEPBS0_NLCA7_NLCB1_ONLL1_PGR1_PLR1_PKA0_SGROB0_SIA1_SS0_SU8_SUM0_SUS256_SPO0_SRVW0_SSO0_SVW1_SK0_SKFTR0_SKXCCM0_SIP1_SGRO0_TDMI0_TDMS0_TIN0_TT7_8_TLDS0_TLDSMn1_ULSGRO0_USL1_USLMX0_UIOFGRO0_UPLRP0_USFGROn1_USI0_VSn1_VWA1_VWB1_WSGRA0_WSGRB0_WS32_WG16_8_1_WGM10_WGMXCC1_WGMXCCGn1
    SolutionIndex: 10
    SolutionNameMin: Cijk_Ailk_Bljk_S_B_Bias_HA_S_SAV_UserArgs_MT112x64x16_SN_LDSB0_AFC1_AG0_AFEM1_AFEM1_ASEM1_CLR0_CADS0_DTLA0_DTLB0_DTVA0_DTVB0_DTVMXSA0_DTVMXSB0_DTVSM0_DPLB0_EPS0_ELFLR0_EMLLn1_FDSI0_GRPM1_GRVWA1_GRVWB1_GSU1_GSUAMB_GSUC0_GSUWGMRR0_GLS0_ISA1151_IU1_K1_LDSTI0_LBSPPA0_LBSPPB0_LBSPPM0_LPA0_LPB1_LPM0_LRVW1_LWPMn1_MIAV0_MXLIA_MXSFA_MO40_MGRIPM1_NTn1_NTA0_NTB0_NTC0_NTD0_NTM0_NEPBS0_NLCA7_NLCB1_ONLL1_PGR1_PLR1_PKA0_SGROB0_SIA1_SS0_SU8_SUM0_SUS256_SPO0_SRVW0_SSO0_SVW1_SK0_SKFTR0_SKXCCM0_SIP1_SGRO0_TDMI0_TDMS0_TIN0_TT7_8_TLDS0_TLDSMn1_ULSGRO0_USL1_USLMX0_UIOFGRO0_UPLRP0_USFGROn1_USI0_VSn1_VWA1_VWB1_WSGRA0_WSGRB0_WS32_WG16_8_1_WGM1_WGMXCC1_WGMXCCGn1
    SolutionIndex: 11
    SolutionNameMin: Cijk_Ailk_Bljk_S_B_Bias_HA_S_SAV_UserArgs_MT112x64x16_SN_LDSB0_AFC1_AG0_AFEM1_AFEM1_ASEM1_CLR0_CADS0_DTLA0_DTLB0_DTVA0_DTVB0_DTVMXSA0_DTVMXSB0_DTVSM0_DPLB0_EPS0_ELFLR0_EMLLn1_FDSI0_GRPM1_GRVWA1_GRVWB1_GSU1_GSUAMB_GSUC0_GSUWGMRR0_GLS0_ISA1151_IU1_K1_LDSTI0_LBSPPA0_LBSPPB0_LBSPPM0_LPA0_LPB1_LPM0_LRVW1_LWPMn1_MIAV0_MXLIA_MXSFA_MO40_MGRIPM1_NTn1_NTA0_NTB0_NTC0_NTD0_NTM0_NEPBS0_NLCA7_NLCB1_ONLL1_PGR1_PLR1_PKA0_SGROB0_SIA1_SS0_SU8_SUM0_SUS256_SPO0_SRVW0_SSO0_SVW1_SK0_SKFTR0_SKXCCM0_SIP1_SGRO0_TDMI0_TDMS0_TIN0_TT7_8_TLDS0_TLDSMn1_ULSGRO0_USL1_USLMX0_UIOFGRO0_UPLRP0_USFGROn1_USI0_VSn1_VWA1_VWB1_WSGRA0_WSGRB0_WS32_WG16_8_1_WGM4_WGMXCC1_WGMXCCGn1
    SolutionIndex: 12
    SolutionNameMin: Cijk_Ailk_Bljk_S_B_Bias_HA_S_SAV_UserArgs_MT112x64x32_SN_LDSB0_AFC1_AG0_AFEM1_AFEM1_ASEM1_CLR0_CADS0_DTLA0_DTLB0_DTVA0_DTVB0_DTVMXSA0_DTVMXSB0_DTVSM0_DPLB0_EPS0_ELFLR0_EMLLn1_FDSI0_GRPM1_GRVWA1_GRVWB1_GSU1_GSUAMB_GSUC0_GSUWGMRR0_GLS0_ISA1151_IU1_K1_LDSTI0_LBSPPA0_LBSPPB0_LBSPPM0_LPA0_LPB1_LPM0_LRVW1_LWPMn1_MIAV0_MXLIA_MXSFA_MO40_MGRIPM1_NTn1_NTA0_NTB0_NTC0_NTD0_NTM0_NEPBS0_NLCA7_NLCB1_ONLL1_PGR0_PLR1_PKA0_SGROB0_SIA1_SS0_SU0_SUM0_SUS0_SPO0_SRVW0_SSO0_SVW1_SK0_SKFTR0_SKXCCM0_SIP1_SGRO0_TDMI0_TDMS0_TIN0_TT7_8_TLDS0_TLDSMn1_ULSGRO0_USL1_USLMX0_UIOFGRO0_UPLRP0_USFGROn1_USI0_VSn1_VWA1_VWB1_WSGRA0_WSGRB0_WS32_WG16_8_1_WGM4_WGMXCC1_WGMXCCGn1
    SolutionIndex: 13
    SolutionNameMin: Cijk_Ailk_Bljk_S_B_Bias_HA_S_SAV_UserArgs_MT112x64x16_SN_LDSB0_AFC1_AG0_AFEM1_AFEM1_ASEM1_CLR0_CADS0_DTLA0_DTLB0_DTVA0_DTVB0_DTVMXSA0_DTVMXSB0_DTVSM0_DPLB0_EPS0_ELFLR0_EMLLn1_FDSI0_GRPM1_GRVWA1_GRVWB1_GSU1_GSUAMB_GSUC0_GSUWGMRR0_GLS0_ISA1151_IU1_K1_LDSTI0_LBSPPA0_LBSPPB0_LBSPPM0_LPA0_LPB1_LPM0_LRVW1_LWPMn1_MIAV0_MXLIA_MXSFA_MO40_MGRIPM1_NTn1_NTA0_NTB0_NTC0_NTD0_NTM0_NEPBS0_NLCA7_NLCB1_ONLL1_PGR0_PLR1_PKA0_SGROB0_SIA1_SS0_SU0_SUM0_SUS0_SPO0_SRVW0_SSO0_SVW1_SK0_SKFTR0_SKXCCM0_SIP1_SGRO0_TDMI0_TDMS0_TIN0_TT7_8_TLDS0_TLDSMn1_ULSGRO0_USL1_USLMX0_UIOFGRO0_UPLRP0_USFGROn1_USI0_VSn1_VWA1_VWB1_WSGRA0_WSGRB0_WS32_WG16_8_1_WGM1_WGMXCC1_WGMXCCGn1
    SolutionIndex: 14
    SolutionNameMin: Cijk_Ailk_Bljk_S_B_Bias_HA_S_SAV_UserArgs_MT96x64x16_SN_LDSB0_AFC1_AG0_AFEM1_AFEM1_ASEM1_CLR0_CADS0_DTLA0_DTLB0_DTVA0_DTVB0_DTVMXSA0_DTVMXSB0_DTVSM0_DPLB0_EPS0_ELFLR0_EMLLn1_FDSI0_GRPM1_GRVWA1_GRVWB1_GSU1_GSUAMB_GSUC0_GSUWGMRR0_GLS0_ISA1151_IU1_K1_LDSTI0_LBSPPA0_LBSPPB0_LBSPPM0_LPA0_LPB1_LPM0_LRVW1_LWPMn1_MIAV0_MXLIA_MXSFA_MO40_MGRIPM1_NTn1_NTA0_NTB0_NTC0_NTD0_NTM0_NEPBS0_NLCA3_NLCB1_ONLL1_PGR1_PLR1_PKA0_SGROB0_SIA1_SS0_SU0_SUM0_SUS0_SPO0_SRVW0_SSO0_SVW1_SK0_SKFTR0_SKXCCM0_SIP1_SGRO0_TDMI0_TDMS0_TIN0_TT6_8_TLDS0_TLDSMn1_ULSGRO0_USL1_USLMX0_UIOFGRO0_UPLRP0_USFGROn1_USI0_VSn1_VWA1_VWB1_WSGRA0_WSGRB0_WS32_WG16_8_1_WGM2_WGMXCC1_WGMXCCGn1
    SolutionIndex: 15
    SolutionNameMin: Cijk_Ailk_Bljk_S_B_Bias_HA_S_SAV_UserArgs_MT96x64x16_SN_LDSB0_AFC1_AG0_AFEM1_AFEM1_ASEM1_CLR0_CADS0_DTLA0_DTLB0_DTVA0_DTVB0_DTVMXSA0_DTVMXSB0_DTVSM0_DPLB0_EPS0_ELFLR0_EMLLn1_FDSI0_GRPM1_GRVWA1_GRVWB1_GSU1_GSUAMB_GSUC0_GSUWGMRR0_GLS0_ISA1151_IU1_K1_LDSTI0_LBSPPA0_LBSPPB0_LBSPPM0_LPA0_LPB1_LPM0_LRVW1_LWPMn1_MIAV0_MXLIA_MXSFA_MO40_MGRIPM1_NTn1_NTA0_NTB0_NTC0_NTD0_NTM0_NEPBS0_NLCA3_NLCB1_ONLL1_PGR1_PLR1_PKA0_SGROB0_SIA1_SS0_SU8_SUM0_SUS256_SPO0_SRVW0_SSO0_SVW1_SK0_SKFTR0_SKXCCM0_SIP1_SGRO0_TDMI0_TDMS0_TIN0_TT6_8_TLDS0_TLDSMn1_ULSGRO0_USL1_USLMX0_UIOFGRO0_UPLRP0_USFGROn1_USI0_VSn1_VWA1_VWB1_WSGRA0_WSGRB0_WS32_WG16_8_1_WGM2_WGMXCC1_WGMXCCGn1
    SolutionIndex: 16
    SolutionNameMin: Cijk_Ailk_Bljk_S_B_Bias_HA_S_SAV_UserArgs_MT112x64x16_SN_LDSB0_AFC1_AG0_AFEM1_AFEM1_ASEM1_CLR0_CADS0_DTLA0_DTLB0_DTVA0_DTVB0_DTVMXSA0_DTVMXSB0_DTVSM0_DPLB0_EPS0_ELFLR0_EMLLn1_FDSI0_GRPM1_GRVWA1_GRVWB1_GSU1_GSUAMB_GSUC0_GSUWGMRR0_GLS0_ISA1151_IU1_K1_LDSTI0_LBSPPA0_LBSPPB0_LBSPPM0_LPA0_LPB1_LPM0_LRVW1_LWPMn1_MIAV0_MXLIA_MXSFA_MO40_MGRIPM1_NTn1_NTA0_NTB0_NTC0_NTD0_NTM0_NEPBS0_NLCA7_NLCB1_ONLL1_PGR0_PLR1_PKA0_SGROB0_SIA1_SS0_SU8_SUM0_SUS256_SPO0_SRVW0_SSO0_SVW1_SK0_SKFTR0_SKXCCM0_SIP1_SGRO0_TDMI0_TDMS0_TIN0_TT7_8_TLDS0_TLDSMn1_ULSGRO0_USL1_USLMX0_UIOFGRO0_UPLRP0_USFGROn1_USI0_VSn1_VWA1_VWB1_WSGRA0_WSGRB0_WS32_WG16_8_1_WGM4_WGMXCC1_WGMXCCGn1
    SolutionIndex: 17
    SolutionNameMin: Cijk_Ailk_Bljk_S_B_Bias_HA_S_SAV_UserArgs_MT112x64x16_SN_LDSB0_AFC1_AG0_AFEM1_AFEM1_ASEM1_CLR0_CADS0_DTLA0_DTLB0_DTVA0_DTVB0_DTVMXSA0_DTVMXSB0_DTVSM0_DPLB0_EPS0_ELFLR0_EMLLn1_FDSI0_GRPM1_GRVWA1_GRVWB1_GSU1_GSUAMB_GSUC0_GSUWGMRR0_GLS0_ISA1151_IU1_K1_LDSTI0_LBSPPA0_LBSPPB0_LBSPPM0_LPA0_LPB1_LPM0_LRVW1_LWPMn1_MIAV0_MXLIA_MXSFA_MO40_MGRIPM1_NTn1_NTA0_NTB0_NTC0_NTD0_NTM0_NEPBS0_NLCA7_NLCB1_ONLL1_PGR1_PLR1_PKA0_SGROB0_SIA1_SS0_SU8_SUM0_SUS256_SPO0_SRVW0_SSO0_SVW1_SK0_SKFTR0_SKXCCM0_SIP1_SGRO0_TDMI0_TDMS0_TIN0_TT7_8_TLDS0_TLDSMn1_ULSGRO0_USL1_USLMX0_UIOFGRO0_UPLRP0_USFGROn1_USI0_VSn1_VWA1_VWB1_WSGRA0_WSGRB0_WS32_WG16_8_1_WGM5_WGMXCC1_WGMXCCGn1
    SolutionIndex: 18
    SolutionNameMin: Cijk_Ailk_Bljk_S_B_Bias_HA_S_SAV_UserArgs_MT96x64x32_SN_LDSB0_AFC1_AG0_AFEM1_AFEM1_ASEM1_CLR0_CADS0_DTLA0_DTLB0_DTVA0_DTVB0_DTVMXSA0_DTVMXSB0_DTVSM0_DPLB0_EPS0_ELFLR0_EMLLn1_FDSI0_GRPM1_GRVWA1_GRVWB1_GSU1_GSUAMB_GSUC0_GSUWGMRR0_GLS0_ISA1151_IU1_K1_LDSTI0_LBSPPA0_LBSPPB0_LBSPPM0_LPA0_LPB1_LPM0_LRVW1_LWPMn1_MIAV0_MXLIA_MXSFA_MO40_MGRIPM1_NTn1_NTA0_NTB0_NTC0_NTD0_NTM0_NEPBS0_NLCA3_NLCB1_ONLL1_PGR0_PLR1_PKA0_SGROB0_SIA1_SS0_SU8_SUM0_SUS256_SPO0_SRVW0_SSO0_SVW1_SK0_SKFTR0_SKXCCM0_SIP1_SGRO0_TDMI0_TDMS0_TIN0_TT6_8_TLDS0_TLDSMn1_ULSGRO0_USL1_USLMX0_UIOFGRO0_UPLRP0_USFGROn1_USI0_VSn1_VWA1_VWB1_WSGRA0_WSGRB0_WS32_WG16_8_1_WGM1_WGMXCC1_WGMXCCGn1
    SolutionIndex: 19
    SolutionNameMin: Cijk_Ailk_Bljk_S_B_Bias_HA_S_SAV_UserArgs_MT112x64x32_SN_LDSB0_AFC1_AG0_AFEM1_AFEM1_ASEM1_CLR0_CADS0_DTLA0_DTLB0_DTVA0_DTVB0_DTVMXSA0_DTVMXSB0_DTVSM0_DPLB0_EPS0_ELFLR0_EMLLn1_FDSI0_GRPM1_GRVWA1_GRVWB1_GSU1_GSUAMB_GSUC0_GSUWGMRR0_GLS0_ISA1151_IU1_K1_LDSTI0_LBSPPA0_LBSPPB0_LBSPPM0_LPA0_LPB1_LPM0_LRVW1_LWPMn1_MIAV0_MXLIA_MXSFA_MO40_MGRIPM1_NTn1_NTA0_NTB0_NTC0_NTD0_NTM0_NEPBS0_NLCA7_NLCB1_ONLL1_PGR0_PLR1_PKA0_SGROB0_SIA1_SS0_SU8_SUM0_SUS256_SPO0_SRVW0_SSO0_SVW1_SK0_SKFTR0_SKXCCM0_SIP1_SGRO0_TDMI0_TDMS0_TIN0_TT7_8_TLDS0_TLDSMn1_ULSGRO0_USL1_USLMX0_UIOFGRO0_UPLRP0_USFGROn1_USI0_VSn1_VWA1_VWB1_WSGRA0_WSGRB0_WS32_WG16_8_1_WGM4_WGMXCC1_WGMXCCGn1
    SolutionIndex: 20
    SolutionNameMin: Cijk_Ailk_Bljk_S_B_Bias_HA_S_SAV_UserArgs_MT112x64x32_SN_LDSB0_AFC1_AG0_AFEM1_AFEM1_ASEM1_CLR0_CADS0_DTLA0_DTLB0_DTVA0_DTVB0_DTVMXSA0_DTVMXSB0_DTVSM0_DPLB0_EPS0_ELFLR0_EMLLn1_FDSI0_GRPM1_GRVWA1_GRVWB1_GSU1_GSUAMB_GSUC0_GSUWGMRR0_GLS0_ISA1151_IU1_K1_LDSTI0_LBSPPA0_LBSPPB0_LBSPPM0_LPA0_LPB1_LPM0_LRVW1_LWPMn1_MIAV0_MXLIA_MXSFA_MO40_MGRIPM1_NTn1_NTA0_NTB0_NTC0_NTD0_NTM0_NEPBS0_NLCA7_NLCB1_ONLL1_PGR0_PLR1_PKA0_SGROB0_SIA1_SS0_SU8_SUM0_SUS256_SPO0_SRVW0_SSO0_SVW1_SK0_SKFTR0_SKXCCM0_SIP1_SGRO0_TDMI0_TDMS0_TIN0_TT7_8_TLDS0_TLDSMn1_ULSGRO0_USL1_USLMX0_UIOFGRO0_UPLRP0_USFGROn1_USI0_VSn1_VWA1_VWB1_WSGRA0_WSGRB0_WS32_WG16_8_1_WGM8_WGMXCC1_WGMXCCGn1
    SolutionIndex: 21
    SolutionNameMin: Cijk_Ailk_Bljk_S_B_Bias_HA_S_SAV_UserArgs_MT56x64x16_SN_LDSB0_AFC1_AG0_AFEM1_AFEM1_ASEM1_CLR0_CADS0_DTLA0_DTLB0_DTVA0_DTVB0_DTVMXSA0_DTVMXSB0_DTVSM0_DPLB0_EPS0_ELFLR0_EMLLn1_FDSI0_GRPM1_GRVWA1_GRVWB1_GSU1_GSUAMB_GSUC0_GSUWGMRR0_GLS0_ISA1151_IU1_K1_LDSTI0_LBSPPA0_LBSPPB0_LBSPPM0_LPA0_LPB1_LPM0_LRVW1_LWPMn1_MIAV0_MXLIA_MXSFA_MO40_MGRIPM1_NTn1_NTA0_NTB0_NTC0_NTD0_NTM0_NEPBS0_NLCA7_NLCB1_ONLL1_PGR1_PLR1_PKA0_SGROB0_SIA1_SS0_SU8_SUM0_SUS256_SPO0_SRVW0_SSO0_SVW1_SK0_SKFTR0_SKXCCM0_SIP1_SGRO0_TDMI0_TDMS0_TIN0_TT7_8_TLDS0_TLDSMn1_ULSGRO0_USL1_USLMX0_UIOFGRO0_UPLRP0_USFGROn1_USI0_VSn1_VWA1_VWB1_WSGRA0_WSGRB0_WS32_WG8_8_1_WGM4_WGMXCC1_WGMXCCGn1
    SolutionIndex: 22
    SolutionNameMin: Cijk_Ailk_Bljk_S_B_Bias_HA_S_SAV_UserArgs_MT80x64x16_SN_LDSB0_AFC1_AG0_AFEM1_AFEM1_ASEM1_CLR0_CADS0_DTLA0_DTLB0_DTVA0_DTVB0_DTVMXSA0_DTVMXSB0_DTVSM0_DPLB0_EPS0_ELFLR0_EMLLn1_FDSI0_GRPM1_GRVWA1_GRVWB1_GSU1_GSUAMB_GSUC0_GSUWGMRR0_GLS0_ISA1151_IU1_K1_LDSTI0_LBSPPA0_LBSPPB0_LBSPPM0_LPA0_LPB1_LPM0_LRVW1_LWPMn1_MIAV0_MXLIA_MXSFA_MO40_MGRIPM1_NTn1_NTA0_NTB0_NTC0_NTD0_NTM0_NEPBS0_NLCA5_NLCB1_ONLL1_PGR1_PLR1_PKA0_SGROB0_SIA1_SS0_SU8_SUM0_SUS256_SPO0_SRVW0_SSO0_SVW1_SK0_SKFTR0_SKXCCM0_SIP1_SGRO0_TDMI0_TDMS0_TIN0_TT5_8_TLDS0_TLDSMn1_ULSGRO0_USL1_USLMX0_UIOFGRO0_UPLRP0_USFGROn1_USI0_VSn1_VWA1_VWB1_WSGRA0_WSGRB0_WS32_WG16_8_1_WGM1_WGMXCC1_WGMXCCGn1
    SolutionIndex: 23
    SolutionNameMin: Cijk_Ailk_Bljk_S_B_Bias_HA_S_SAV_UserArgs_MT80x64x32_SN_LDSB0_AFC1_AG0_AFEM1_AFEM1_ASEM1_CLR0_CADS0_DTLA0_DTLB0_DTVA0_DTVB0_DTVMXSA0_DTVMXSB0_DTVSM0_DPLB0_EPS0_ELFLR0_EMLLn1_FDSI0_GRPM1_GRVWA1_GRVWB1_GSU1_GSUAMB_GSUC0_GSUWGMRR0_GLS0_ISA1151_IU1_K1_LDSTI0_LBSPPA0_LBSPPB0_LBSPPM0_LPA0_LPB1_LPM0_LRVW1_LWPMn1_MIAV0_MXLIA_MXSFA_MO40_MGRIPM1_NTn1_NTA0_NTB0_NTC0_NTD0_NTM0_NEPBS0_NLCA5_NLCB1_ONLL1_PGR0_PLR1_PKA0_SGROB0_SIA1_SS0_SU8_SUM0_SUS256_SPO0_SRVW0_SSO0_SVW1_SK0_SKFTR0_SKXCCM0_SIP1_SGRO0_TDMI0_TDMS0_TIN0_TT5_8_TLDS0_TLDSMn1_ULSGRO0_USL1_USLMX0_UIOFGRO0_UPLRP0_USFGROn1_USI0_VSn1_VWA1_VWB1_WSGRA0_WSGRB0_WS32_WG16_8_1_WGM4_WGMXCC1_WGMXCCGn1
    SolutionIndex: 24
    SolutionNameMin: Cijk_Ailk_Bljk_S_B_Bias_HA_S_SAV_UserArgs_MT112x64x32_SN_LDSB0_AFC1_AG0_AFEM1_AFEM1_ASEM1_CLR0_CADS0_DTLA0_DTLB0_DTVA0_DTVB0_DTVMXSA0_DTVMXSB0_DTVSM0_DPLB0_EPS0_ELFLR0_EMLLn1_FDSI0_GRPM1_GRVWA1_GRVWB1_GSU1_GSUAMB_GSUC0_GSUWGMRR0_GLS0_ISA1151_IU1_K1_LDSTI0_LBSPPA0_LBSPPB0_LBSPPM0_LPA0_LPB1_LPM0_LRVW1_LWPMn1_MIAV0_MXLIA_MXSFA_MO40_MGRIPM1_NTn1_NTA0_NTB0_NTC0_NTD0_NTM0_NEPBS0_NLCA7_NLCB1_ONLL1_PGR0_PLR1_PKA0_SGROB0_SIA1_SS0_SU8_SUM0_SUS256_SPO0_SRVW0_SSO0_SVW1_SK0_SKFTR0_SKXCCM0_SIP1_SGRO0_TDMI0_TDMS0_TIN0_TT7_8_TLDS0_TLDSMn1_ULSGRO0_USL1_USLMX0_UIOFGRO0_UPLRP0_USFGROn1_USI0_VSn1_VWA1_VWB1_WSGRA0_WSGRB0_WS32_WG16_8_1_WGM1_WGMXCC1_WGMXCCGn1
    SolutionIndex: 25
    SolutionNameMin: Cijk_Ailk_Bljk_S_B_Bias_HA_S_SAV_UserArgs_MT112x64x16_SN_LDSB0_AFC1_AG0_AFEM1_AFEM1_ASEM1_CLR0_CADS0_DTLA0_DTLB0_DTVA0_DTVB0_DTVMXSA0_DTVMXSB0_DTVSM0_DPLB0_EPS0_ELFLR0_EMLLn1_FDSI0_GRPM1_GRVWA1_GRVWB1_GSU1_GSUAMB_GSUC0_GSUWGMRR0_GLS0_ISA1151_IU1_K1_LDSTI0_LBSPPA0_LBSPPB0_LBSPPM0_LPA0_LPB1_LPM0_LRVW1_LWPMn1_MIAV0_MXLIA_MXSFA_MO40_MGRIPM1_NTn1_NTA0_NTB0_NTC0_NTD0_NTM0_NEPBS0_NLCA7_NLCB1_ONLL1_PGR0_PLR1_PKA0_SGROB0_SIA1_SS0_SU0_SUM0_SUS0_SPO0_SRVW0_SSO0_SVW1_SK0_SKFTR0_SKXCCM0_SIP1_SGRO0_TDMI0_TDMS0_TIN0_TT7_8_TLDS0_TLDSMn1_ULSGRO0_USL1_USLMX0_UIOFGRO0_UPLRP0_USFGROn1_USI0_VSn1_VWA1_VWB1_WSGRA0_WSGRB0_WS32_WG16_8_1_WGM8_WGMXCC1_WGMXCCGn1
    SolutionIndex: 26
    SolutionNameMin: Cijk_Ailk_Bljk_S_B_Bias_HA_S_SAV_UserArgs_MT80x64x16_SN_LDSB0_AFC1_AG0_AFEM1_AFEM1_ASEM1_CLR0_CADS0_DTLA0_DTLB0_DTVA0_DTVB0_DTVMXSA0_DTVMXSB0_DTVSM0_DPLB0_EPS0_ELFLR0_EMLLn1_FDSI0_GRPM1_GRVWA1_GRVWB1_GSU1_GSUAMB_GSUC0_GSUWGMRR0_GLS0_ISA1151_IU1_K1_LDSTI0_LBSPPA0_LBSPPB0_LBSPPM0_LPA0_LPB1_LPM0_LRVW1_LWPMn1_MIAV0_MXLIA_MXSFA_MO40_MGRIPM1_NTn1_NTA0_NTB0_NTC0_NTD0_NTM0_NEPBS0_NLCA5_NLCB1_ONLL1_PGR1_PLR1_PKA0_SGROB0_SIA1_SS0_SU0_SUM0_SUS0_SPO0_SRVW0_SSO0_SVW1_SK0_SKFTR0_SKXCCM0_SIP1_SGRO0_TDMI0_TDMS0_TIN0_TT5_8_TLDS0_TLDSMn1_ULSGRO0_USL1_USLMX0_UIOFGRO0_UPLRP0_USFGROn1_USI0_VSn1_VWA1_VWB1_WSGRA0_WSGRB0_WS32_WG16_8_1_WGM4_WGMXCC1_WGMXCCGn1
    SolutionIndex: 27
    SolutionNameMin: Cijk_Ailk_Bljk_S_B_Bias_HA_S_SAV_UserArgs_MT80x64x16_SN_LDSB0_AFC1_AG0_AFEM1_AFEM1_ASEM1_CLR0_CADS0_DTLA0_DTLB0_DTVA0_DTVB0_DTVMXSA0_DTVMXSB0_DTVSM0_DPLB0_EPS0_ELFLR0_EMLLn1_FDSI0_GRPM1_GRVWA1_GRVWB1_GSU1_GSUAMB_GSUC0_GSUWGMRR0_GLS0_ISA1151_IU1_K1_LDSTI0_LBSPPA0_LBSPPB0_LBSPPM0_LPA0_LPB1_LPM0_LRVW1_LWPMn1_MIAV0_MXLIA_MXSFA_MO40_MGRIPM1_NTn1_NTA0_NTB0_NTC0_NTD0_NTM0_NEPBS0_NLCA5_NLCB1_ONLL1_PGR1_PLR1_PKA0_SGROB0_SIA1_SS0_SU8_SUM0_SUS256_SPO0_SRVW0_SSO0_SVW1_SK0_SKFTR0_SKXCCM0_SIP1_SGRO0_TDMI0_TDMS0_TIN0_TT5_8_TLDS0_TLDSMn1_ULSGRO0_USL1_USLMX0_UIOFGRO0_UPLRP0_USFGROn1_USI0_VSn1_VWA1_VWB1_WSGRA0_WSGRB0_WS32_WG16_8_1_WGM8_WGMXCC1_WGMXCCGn1
    SolutionIndex: 28
    SolutionNameMin: Cijk_Ailk_Bljk_S_B_Bias_HA_S_SAV_UserArgs_MT112x64x32_SN_LDSB0_AFC1_AG0_AFEM1_AFEM1_ASEM1_CLR0_CADS0_DTLA0_DTLB0_DTVA0_DTVB0_DTVMXSA0_DTVMXSB0_DTVSM0_DPLB0_EPS0_ELFLR0_EMLLn1_FDSI0_GRPM1_GRVWA1_GRVWB1_GSU1_GSUAMB_GSUC0_GSUWGMRR0_GLS0_ISA1151_IU1_K1_LDSTI0_LBSPPA0_LBSPPB0_LBSPPM0_LPA0_LPB1_LPM0_LRVW1_LWPMn1_MIAV0_MXLIA_MXSFA_MO40_MGRIPM1_NTn1_NTA0_NTB0_NTC0_NTD0_NTM0_NEPBS0_NLCA7_NLCB1_ONLL1_PGR0_PLR1_PKA0_SGROB0_SIA1_SS0_SU0_SUM0_SUS0_SPO0_SRVW0_SSO0_SVW1_SK0_SKFTR0_SKXCCM0_SIP1_SGRO0_TDMI0_TDMS0_TIN0_TT7_8_TLDS0_TLDSMn1_ULSGRO0_USL1_USLMX0_UIOFGRO0_UPLRP0_USFGROn1_USI0_VSn1_VWA1_VWB1_WSGRA0_WSGRB0_WS32_WG16_8_1_WGM8_WGMXCC1_WGMXCCGn1
    SolutionIndex: 29
    SolutionNameMin: Cijk_Ailk_Bljk_S_B_Bias_HA_S_SAV_UserArgs_MT112x64x16_SN_LDSB0_AFC1_AG0_AFEM1_AFEM1_ASEM1_CLR0_CADS0_DTLA0_DTLB0_DTVA0_DTVB0_DTVMXSA0_DTVMXSB0_DTVSM0_DPLB0_EPS0_ELFLR0_EMLLn1_FDSI0_GRPM1_GRVWA1_GRVWB1_GSU1_GSUAMB_GSUC0_GSUWGMRR0_GLS0_ISA1151_IU1_K1_LDSTI0_LBSPPA0_LBSPPB0_LBSPPM0_LPA0_LPB1_LPM0_LRVW1_LWPMn1_MIAV0_MXLIA_MXSFA_MO40_MGRIPM1_NTn1_NTA0_NTB0_NTC0_NTD0_NTM0_NEPBS0_NLCA7_NLCB1_ONLL1_PGR1_PLR1_PKA0_SGROB0_SIA1_SS0_SU0_SUM0_SUS0_SPO0_SRVW0_SSO0_SVW1_SK0_SKFTR0_SKXCCM0_SIP1_SGRO0_TDMI0_TDMS0_TIN0_TT7_8_TLDS0_TLDSMn1_ULSGRO0_USL1_USLMX0_UIOFGRO0_UPLRP0_USFGROn1_USI0_VSn1_VWA1_VWB1_WSGRA0_WSGRB0_WS32_WG16_8_1_WGM4_WGMXCC1_WGMXCCGn1
    SolutionIndex: 30
    SolutionNameMin: Cijk_Ailk_Bljk_S_B_Bias_HA_S_SAV_UserArgs_MT112x64x16_SN_LDSB0_AFC1_AG0_AFEM1_AFEM1_ASEM1_CLR0_CADS0_DTLA0_DTLB0_DTVA0_DTVB0_DTVMXSA0_DTVMXSB0_DTVSM0_DPLB0_EPS0_ELFLR0_EMLLn1_FDSI0_GRPM1_GRVWA1_GRVWB1_GSU1_GSUAMB_GSUC0_GSUWGMRR0_GLS0_ISA1151_IU1_K1_LDSTI0_LBSPPA0_LBSPPB0_LBSPPM0_LPA0_LPB1_LPM0_LRVW1_LWPMn1_MIAV0_MXLIA_MXSFA_MO40_MGRIPM1_NTn1_NTA0_NTB0_NTC0_NTD0_NTM0_NEPBS0_NLCA7_NLCB1_ONLL1_PGR0_PLR1_PKA0_SGROB0_SIA1_SS0_SU0_SUM0_SUS0_SPO0_SRVW0_SSO0_SVW1_SK0_SKFTR0_SKXCCM0_SIP1_SGRO0_TDMI0_TDMS0_TIN0_TT7_8_TLDS0_TLDSMn1_ULSGRO0_USL1_USLMX0_UIOFGRO0_UPLRP0_USFGROn1_USI0_VSn1_VWA1_VWB1_WSGRA0_WSGRB0_WS32_WG16_8_1_WGM5_WGMXCC1_WGMXCCGn1
    SolutionIndex: 31
    SolutionNameMin: Cijk_Ailk_Bljk_S_B_Bias_HA_S_SAV_UserArgs_MT80x64x16_SN_LDSB0_AFC1_AG0_AFEM1_AFEM1_ASEM1_CLR0_CADS0_DTLA0_DTLB0_DTVA0_DTVB0_DTVMXSA0_DTVMXSB0_DTVSM0_DPLB0_EPS0_ELFLR0_EMLLn1_FDSI0_GRPM1_GRVWA1_GRVWB1_GSU1_GSUAMB_GSUC0_GSUWGMRR0_GLS0_ISA1151_IU1_K1_LDSTI0_LBSPPA0_LBSPPB0_LBSPPM0_LPA0_LPB1_LPM0_LRVW1_LWPMn1_MIAV0_MXLIA_MXSFA_MO40_MGRIPM1_NTn1_NTA0_NTB0_NTC0_NTD0_NTM0_NEPBS0_NLCA5_NLCB1_ONLL1_PGR1_PLR1_PKA0_SGROB0_SIA1_SS0_SU0_SUM0_SUS0_SPO0_SRVW0_SSO0_SVW1_SK0_SKFTR0_SKXCCM0_SIP1_SGRO0_TDMI0_TDMS0_TIN0_TT5_8_TLDS0_TLDSMn1_ULSGRO0_USL1_USLMX0_UIOFGRO0_UPLRP0_USFGROn1_USI0_VSn1_VWA1_VWB1_WSGRA0_WSGRB0_WS32_WG16_8_1_WGM2_WGMXCC1_WGMXCCGn1
    SolutionIndex: 32
    SolutionNameMin: Cijk_Ailk_Bljk_S_B_Bias_HA_S_SAV_UserArgs_MT80x64x32_SN_LDSB0_AFC1_AG0_AFEM1_AFEM1_ASEM1_CLR0_CADS0_DTLA0_DTLB0_DTVA0_DTVB0_DTVMXSA0_DTVMXSB0_DTVSM0_DPLB0_EPS0_ELFLR0_EMLLn1_FDSI0_GRPM1_GRVWA1_GRVWB1_GSU1_GSUAMB_GSUC0_GSUWGMRR0_GLS0_ISA1151_IU1_K1_LDSTI0_LBSPPA0_LBSPPB0_LBSPPM0_LPA0_LPB1_LPM0_LRVW1_LWPMn1_MIAV0_MXLIA_MXSFA_MO40_MGRIPM1_NTn1_NTA0_NTB0_NTC0_NTD0_NTM0_NEPBS0_NLCA5_NLCB1_ONLL1_PGR0_PLR1_PKA0_SGROB0_SIA1_SS0_SU0_SUM0_SUS0_SPO0_SRVW0_SSO0_SVW1_SK0_SKFTR0_SKXCCM0_SIP1_SGRO0_TDMI0_TDMS0_TIN0_TT5_8_TLDS0_TLDSMn1_ULSGRO0_USL1_USLMX0_UIOFGRO0_UPLRP0_USFGROn1_USI0_VSn1_VWA1_VWB1_WSGRA0_WSGRB0_WS32_WG16_8_1_WGM4_WGMXCC1_WGMXCCGn1
    SolutionIndex: 33
    SolutionNameMin: Cijk_Ailk_Bljk_S_B_Bias_HA_S_SAV_UserArgs_MT80x64x32_SN_LDSB0_AFC1_AG0_AFEM1_AFEM1_ASEM1_CLR0_CADS0_DTLA0_DTLB0_DTVA0_DTVB0_DTVMXSA0_DTVMXSB0_DTVSM0_DPLB0_EPS0_ELFLR0_EMLLn1_FDSI0_GRPM1_GRVWA1_GRVWB1_GSU1_GSUAMB_GSUC0_GSUWGMRR0_GLS0_ISA1151_IU1_K1_LDSTI0_LBSPPA0_LBSPPB0_LBSPPM0_LPA0_LPB1_LPM0_LRVW1_LWPMn1_MIAV0_MXLIA_MXSFA_MO40_MGRIPM1_NTn1_NTA0_NTB0_NTC0_NTD0_NTM0_NEPBS0_NLCA5_NLCB1_ONLL1_PGR1_PLR1_PKA0_SGROB0_SIA1_SS0_SU8_SUM0_SUS256_SPO0_SRVW0_SSO0_SVW1_SK0_SKFTR0_SKXCCM0_SIP1_SGRO0_TDMI0_TDMS0_TIN0_TT5_8_TLDS0_TLDSMn1_ULSGRO0_USL1_USLMX0_UIOFGRO0_UPLRP0_USFGROn1_USI0_VSn1_VWA1_VWB1_WSGRA0_WSGRB0_WS32_WG16_8_1_WGM4_WGMXCC1_WGMXCCGn1
    SolutionIndex: 34
    SolutionNameMin: Cijk_Ailk_Bljk_S_B_Bias_HA_S_SAV_UserArgs_MT80x64x32_SN_LDSB0_AFC1_AG0_AFEM1_AFEM1_ASEM1_CLR0_CADS0_DTLA0_DTLB0_DTVA0_DTVB0_DTVMXSA0_DTVMXSB0_DTVSM0_DPLB0_EPS0_ELFLR0_EMLLn1_FDSI0_GRPM1_GRVWA1_GRVWB1_GSU1_GSUAMB_GSUC0_GSUWGMRR0_GLS0_ISA1151_IU1_K1_LDSTI0_LBSPPA0_LBSPPB0_LBSPPM0_LPA0_LPB1_LPM0_LRVW1_LWPMn1_MIAV0_MXLIA_MXSFA_MO40_MGRIPM1_NTn1_NTA0_NTB0_NTC0_NTD0_NTM0_NEPBS0_NLCA5_NLCB1_ONLL1_PGR1_PLR1_PKA0_SGROB0_SIA1_SS0_SU8_SUM0_SUS256_SPO0_SRVW0_SSO0_SVW1_SK0_SKFTR0_SKXCCM0_SIP1_SGRO0_TDMI0_TDMS0_TIN0_TT5_8_TLDS0_TLDSMn1_ULSGRO0_USL1_USLMX0_UIOFGRO0_UPLRP0_USFGROn1_USI0_VSn1_VWA1_VWB1_WSGRA0_WSGRB0_WS32_WG16_8_1_WGM1_WGMXCC1_WGMXCCGn1
    SolutionIndex: 35
    SolutionNameMin: Cijk_Ailk_Bljk_S_B_Bias_HA_S_SAV_UserArgs_MT112x64x32_SN_LDSB0_AFC1_AG0_AFEM1_AFEM1_ASEM1_CLR0_CADS0_DTLA0_DTLB0_DTVA0_DTVB0_DTVMXSA0_DTVMXSB0_DTVSM0_DPLB0_EPS0_ELFLR0_EMLLn1_FDSI0_GRPM1_GRVWA1_GRVWB1_GSU1_GSUAMB_GSUC0_GSUWGMRR0_GLS0_ISA1151_IU1_K1_LDSTI0_LBSPPA0_LBSPPB0_LBSPPM0_LPA0_LPB1_LPM0_LRVW1_LWPMn1_MIAV0_MXLIA_MXSFA_MO40_MGRIPM1_NTn1_NTA0_NTB0_NTC0_NTD0_NTM0_NEPBS0_NLCA7_NLCB1_ONLL1_PGR0_PLR1_PKA0_SGROB0_SIA1_SS0_SU0_SUM0_SUS0_SPO0_SRVW0_SSO0_SVW1_SK0_SKFTR0_SKXCCM0_SIP1_SGRO0_TDMI0_TDMS0_TIN0_TT7_8_TLDS0_TLDSMn1_ULSGRO0_USL1_USLMX0_UIOFGRO0_UPLRP0_USFGROn1_USI0_VSn1_VWA1_VWB1_WSGRA0_WSGRB0_WS32_WG16_8_1_WGM1_WGMXCC1_WGMXCCGn1
    SolutionIndex: 36
    SolutionNameMin: Cijk_Ailk_Bljk_S_B_Bias_HA_S_SAV_UserArgs_MT112x64x32_SN_LDSB0_AFC1_AG0_AFEM1_AFEM1_ASEM1_CLR0_CADS0_DTLA0_DTLB0_DTVA0_DTVB0_DTVMXSA0_DTVMXSB0_DTVSM0_DPLB0_EPS0_ELFLR0_EMLLn1_FDSI0_GRPM1_GRVWA1_GRVWB1_GSU1_GSUAMB_GSUC0_GSUWGMRR0_GLS0_ISA1151_IU1_K1_LDSTI0_LBSPPA0_LBSPPB0_LBSPPM0_LPA0_LPB1_LPM0_LRVW1_LWPMn1_MIAV0_MXLIA_MXSFA_MO40_MGRIPM1_NTn1_NTA0_NTB0_NTC0_NTD0_NTM0_NEPBS0_NLCA7_NLCB1_ONLL1_PGR1_PLR1_PKA0_SGROB0_SIA1_SS0_SU8_SUM0_SUS256_SPO0_SRVW0_SSO0_SVW1_SK0_SKFTR0_SKXCCM0_SIP1_SGRO0_TDMI0_TDMS0_TIN0_TT7_8_TLDS0_TLDSMn1_ULSGRO0_USL1_USLMX0_UIOFGRO0_UPLRP0_USFGROn1_USI0_VSn1_VWA1_VWB1_WSGRA0_WSGRB0_WS32_WG16_8_1_WGM1_WGMXCC1_WGMXCCGn1
    SolutionIndex: 37
    SolutionNameMin: Cijk_Ailk_Bljk_S_B_Bias_HA_S_SAV_UserArgs_MT80x64x32_SN_LDSB0_AFC1_AG0_AFEM1_AFEM1_ASEM1_CLR0_CADS0_DTLA0_DTLB0_DTVA0_DTVB0_DTVMXSA0_DTVMXSB0_DTVSM0_DPLB0_EPS0_ELFLR0_EMLLn1_FDSI0_GRPM1_GRVWA1_GRVWB1_GSU1_GSUAMB_GSUC0_GSUWGMRR0_GLS0_ISA1151_IU1_K1_LDSTI0_LBSPPA0_LBSPPB0_LBSPPM0_LPA0_LPB1_LPM0_LRVW1_LWPMn1_MIAV0_MXLIA_MXSFA_MO40_MGRIPM1_NTn1_NTA0_NTB0_NTC0_NTD0_NTM0_NEPBS0_NLCA5_NLCB1_ONLL1_PGR0_PLR1_PKA0_SGROB0_SIA1_SS0_SU8_SUM0_SUS256_SPO0_SRVW0_SSO0_SVW1_SK0_SKFTR0_SKXCCM0_SIP1_SGRO0_TDMI0_TDMS0_TIN0_TT5_8_TLDS0_TLDSMn1_ULSGRO0_USL1_USLMX0_UIOFGRO0_UPLRP0_USFGROn1_USI0_VSn1_VWA1_VWB1_WSGRA0_WSGRB0_WS32_WG16_8_1_WGM1_WGMXCC1_WGMXCCGn1
    SolutionIndex: 38
    SolutionNameMin: Cijk_Ailk_Bljk_S_B_Bias_HA_S_SAV_UserArgs_MT80x64x16_SN_LDSB0_AFC1_AG0_AFEM1_AFEM1_ASEM1_CLR0_CADS0_DTLA0_DTLB0_DTVA0_DTVB0_DTVMXSA0_DTVMXSB0_DTVSM0_DPLB0_EPS0_ELFLR0_EMLLn1_FDSI0_GRPM1_GRVWA1_GRVWB1_GSU1_GSUAMB_GSUC0_GSUWGMRR0_GLS0_ISA1151_IU1_K1_LDSTI0_LBSPPA0_LBSPPB0_LBSPPM0_LPA0_LPB1_LPM0_LRVW1_LWPMn1_MIAV0_MXLIA_MXSFA_MO40_MGRIPM1_NTn1_NTA0_NTB0_NTC0_NTD0_NTM0_NEPBS0_NLCA5_NLCB1_ONLL1_PGR1_PLR1_PKA0_SGROB0_SIA1_SS0_SU8_SUM0_SUS256_SPO0_SRVW0_SSO0_SVW1_SK0_SKFTR0_SKXCCM0_SIP1_SGRO0_TDMI0_TDMS0_TIN0_TT5_8_TLDS0_TLDSMn1_ULSGRO0_USL1_USLMX0_UIOFGRO0_UPLRP0_USFGROn1_USI0_VSn1_VWA1_VWB1_WSGRA0_WSGRB0_WS32_WG16_8_1_WGM5_WGMXCC1_WGMXCCGn1
    SolutionIndex: 39
    SolutionNameMin: Cijk_Ailk_Bljk_S_B_Bias_HA_S_SAV_UserArgs_MT112x64x16_SN_LDSB0_AFC1_AG0_AFEM1_AFEM1_ASEM1_CLR0_CADS0_DTLA0_DTLB0_DTVA0_DTVB0_DTVMXSA0_DTVMXSB0_DTVSM0_DPLB0_EPS0_ELFLR0_EMLLn1_FDSI0_GRPM1_GRVWA1_GRVWB1_GSU1_GSUAMB_GSUC0_GSUWGMRR0_GLS0_ISA1151_IU1_K1_LDSTI0_LBSPPA0_LBSPPB0_LBSPPM0_LPA0_LPB1_LPM0_LRVW1_LWPMn1_MIAV0_MXLIA_MXSFA_MO40_MGRIPM1_NTn1_NTA0_NTB0_NTC0_NTD0_NTM0_NEPBS0_NLCA7_NLCB1_ONLL1_PGR0_PLR1_PKA0_SGROB0_SIA1_SS0_SU8_SUM0_SUS256_SPO0_SRVW0_SSO0_SVW1_SK0_SKFTR0_SKXCCM0_SIP1_SGRO0_TDMI0_TDMS0_TIN0_TT7_8_TLDS0_TLDSMn1_ULSGRO0_USL1_USLMX0_UIOFGRO0_UPLRP0_USFGROn1_USI0_VSn1_VWA1_VWB1_WSGRA0_WSGRB0_WS32_WG16_8_1_WGM1_WGMXCC1_WGMXCCGn1
    SolutionIndex: 40
    SolutionNameMin: Cijk_Ailk_Bljk_S_B_Bias_HA_S_SAV_UserArgs_MT112x64x32_SN_LDSB0_AFC1_AG0_AFEM1_AFEM1_ASEM1_CLR0_CADS0_DTLA0_DTLB0_DTVA0_DTVB0_DTVMXSA0_DTVMXSB0_DTVSM0_DPLB0_EPS0_ELFLR0_EMLLn1_FDSI0_GRPM1_GRVWA1_GRVWB1_GSU1_GSUAMB_GSUC0_GSUWGMRR0_GLS0_ISA1151_IU1_K1_LDSTI0_LBSPPA0_LBSPPB0_LBSPPM0_LPA0_LPB1_LPM0_LRVW1_LWPMn1_MIAV0_MXLIA_MXSFA_MO40_MGRIPM1_NTn1_NTA0_NTB0_NTC0_NTD0_NTM0_NEPBS0_NLCA7_NLCB1_ONLL1_PGR1_PLR1_PKA0_SGROB0_SIA1_SS0_SU8_SUM0_SUS256_SPO0_SRVW0_SSO0_SVW1_SK0_SKFTR0_SKXCCM0_SIP1_SGRO0_TDMI0_TDMS0_TIN0_TT7_8_TLDS0_TLDSMn1_ULSGRO0_USL1_USLMX0_UIOFGRO0_UPLRP0_USFGROn1_USI0_VSn1_VWA1_VWB1_WSGRA0_WSGRB0_WS32_WG16_8_1_WGM8_WGMXCC1_WGMXCCGn1
    SolutionIndex: 41
    SolutionNameMin: Cijk_Ailk_Bljk_S_B_Bias_HA_S_SAV_UserArgs_MT112x64x32_SN_LDSB0_AFC1_AG0_AFEM1_AFEM1_ASEM1_CLR0_CADS0_DTLA0_DTLB0_DTVA0_DTVB0_DTVMXSA0_DTVMXSB0_DTVSM0_DPLB0_EPS0_ELFLR0_EMLLn1_FDSI0_GRPM1_GRVWA1_GRVWB1_GSU1_GSUAMB_GSUC0_GSUWGMRR0_GLS0_ISA1151_IU1_K1_LDSTI0_LBSPPA0_LBSPPB0_LBSPPM0_LPA0_LPB1_LPM0_LRVW1_LWPMn1_MIAV0_MXLIA_MXSFA_MO40_MGRIPM1_NTn1_NTA0_NTB0_NTC0_NTD0_NTM0_NEPBS0_NLCA7_NLCB1_ONLL1_PGR0_PLR1_PKA0_SGROB0_SIA1_SS0_SU8_SUM0_SUS256_SPO0_SRVW0_SSO0_SVW1_SK0_SKFTR0_SKXCCM0_SIP1_SGRO0_TDMI0_TDMS0_TIN0_TT7_8_TLDS0_TLDSMn1_ULSGRO0_USL1_USLMX0_UIOFGRO0_UPLRP0_USFGROn1_USI0_VSn1_VWA1_VWB1_WSGRA0_WSGRB0_WS32_WG16_8_1_WGM5_WGMXCC1_WGMXCCGn1
    SolutionIndex: 42
    SolutionNameMin: Cijk_Ailk_Bljk_S_B_Bias_HA_S_SAV_UserArgs_MT80x64x16_SN_LDSB0_AFC1_AG0_AFEM1_AFEM1_ASEM1_CLR0_CADS0_DTLA0_DTLB0_DTVA0_DTVB0_DTVMXSA0_DTVMXSB0_DTVSM0_DPLB0_EPS0_ELFLR0_EMLLn1_FDSI0_GRPM1_GRVWA1_GRVWB1_GSU1_GSUAMB_GSUC0_GSUWGMRR0_GLS0_ISA1151_IU1_K1_LDSTI0_LBSPPA0_LBSPPB0_LBSPPM0_LPA0_LPB1_LPM0_LRVW1_LWPMn1_MIAV0_MXLIA_MXSFA_MO40_MGRIPM1_NTn1_NTA0_NTB0_NTC0_NTD0_NTM0_NEPBS0_NLCA5_NLCB1_ONLL1_PGR1_PLR1_PKA0_SGROB0_SIA1_SS0_SU8_SUM0_SUS256_SPO0_SRVW0_SSO0_SVW1_SK0_SKFTR0_SKXCCM0_SIP1_SGRO0_TDMI0_TDMS0_TIN0_TT5_8_TLDS0_TLDSMn1_ULSGRO0_USL1_USLMX0_UIOFGRO0_UPLRP0_USFGROn1_USI0_VSn1_VWA1_VWB1_WSGRA0_WSGRB0_WS32_WG16_8_1_WGM4_WGMXCC1_WGMXCCGn1
    SolutionIndex: 43
    SolutionNameMin: Cijk_Ailk_Bljk_S_B_Bias_HA_S_SAV_UserArgs_MT112x64x16_SN_LDSB0_AFC1_AG0_AFEM1_AFEM1_ASEM1_CLR0_CADS0_DTLA0_DTLB0_DTVA0_DTVB0_DTVMXSA0_DTVMXSB0_DTVSM0_DPLB0_EPS0_ELFLR0_EMLLn1_FDSI0_GRPM1_GRVWA1_GRVWB1_GSU1_GSUAMB_GSUC0_GSUWGMRR0_GLS0_ISA1151_IU1_K1_LDSTI0_LBSPPA0_LBSPPB0_LBSPPM0_LPA0_LPB1_LPM0_LRVW1_LWPMn1_MIAV0_MXLIA_MXSFA_MO40_MGRIPM1_NTn1_NTA0_NTB0_NTC0_NTD0_NTM0_NEPBS0_NLCA7_NLCB1_ONLL1_PGR0_PLR1_PKA0_SGROB0_SIA1_SS0_SU8_SUM0_SUS256_SPO0_SRVW0_SSO0_SVW1_SK0_SKFTR0_SKXCCM0_SIP1_SGRO0_TDMI0_TDMS0_TIN0_TT7_8_TLDS0_TLDSMn1_ULSGRO0_USL1_USLMX0_UIOFGRO0_UPLRP0_USFGROn1_USI0_VSn1_VWA1_VWB1_WSGRA0_WSGRB0_WS32_WG16_8_1_WGM8_WGMXCC1_WGMXCCGn1
    SolutionIndex: 44
    SolutionNameMin: Cijk_Ailk_Bljk_S_B_Bias_HA_S_SAV_UserArgs_MT112x64x16_SN_LDSB0_AFC1_AG0_AFEM1_AFEM1_ASEM1_CLR0_CADS0_DTLA0_DTLB0_DTVA0_DTVB0_DTVMXSA0_DTVMXSB0_DTVSM0_DPLB0_EPS0_ELFLR0_EMLLn1_FDSI0_GRPM1_GRVWA1_GRVWB1_GSU1_GSUAMB_GSUC0_GSUWGMRR0_GLS0_ISA1151_IU1_K1_LDSTI0_LBSPPA0_LBSPPB0_LBSPPM0_LPA0_LPB1_LPM0_LRVW1_LWPMn1_MIAV0_MXLIA_MXSFA_MO40_MGRIPM1_NTn1_NTA0_NTB0_NTC0_NTD0_NTM0_NEPBS0_NLCA7_NLCB1_ONLL1_PGR0_PLR1_PKA0_SGROB0_SIA1_SS0_SU8_SUM0_SUS256_SPO0_SRVW0_SSO0_SVW1_SK0_SKFTR0_SKXCCM0_SIP1_SGRO0_TDMI0_TDMS0_TIN0_TT7_8_TLDS0_TLDSMn1_ULSGRO0_USL1_USLMX0_UIOFGRO0_UPLRP0_USFGROn1_USI0_VSn1_VWA1_VWB1_WSGRA0_WSGRB0_WS32_WG16_8_1_WGM5_WGMXCC1_WGMXCCGn1
    SolutionIndex: 45
    SolutionNameMin: Cijk_Ailk_Bljk_S_B_Bias_HA_S_SAV_UserArgs_MT112x64x32_SN_LDSB0_AFC1_AG0_AFEM1_AFEM1_ASEM1_CLR0_CADS0_DTLA0_DTLB0_DTVA0_DTVB0_DTVMXSA0_DTVMXSB0_DTVSM0_DPLB0_EPS0_ELFLR0_EMLLn1_FDSI0_GRPM1_GRVWA1_GRVWB1_GSU1_GSUAMB_GSUC0_GSUWGMRR0_GLS0_ISA1151_IU1_K1_LDSTI0_LBSPPA0_LBSPPB0_LBSPPM0_LPA0_LPB1_LPM0_LRVW1_LWPMn1_MIAV0_MXLIA_MXSFA_MO40_MGRIPM1_NTn1_NTA0_NTB0_NTC0_NTD0_NTM0_NEPBS0_NLCA7_NLCB1_ONLL1_PGR0_PLR1_PKA0_SGROB0_SIA1_SS0_SU0_SUM0_SUS0_SPO0_SRVW0_SSO0_SVW1_SK0_SKFTR0_SKXCCM0_SIP1_SGRO0_TDMI0_TDMS0_TIN0_TT7_8_TLDS0_TLDSMn1_ULSGRO0_USL1_USLMX0_UIOFGRO0_UPLRP0_USFGROn1_USI0_VSn1_VWA1_VWB1_WSGRA0_WSGRB0_WS32_WG16_8_1_WGM2_WGMXCC1_WGMXCCGn1
    SolutionIndex: 46
    SolutionNameMin: Cijk_Ailk_Bljk_S_B_Bias_HA_S_SAV_UserArgs_MT16x16x64_SN_LDSB0_AFC1_AG0_AFEM1_AFEM1_ASEM1_CLR0_CADS0_DTLA0_DTLB0_DTVA0_DTVB0_DTVMXSA0_DTVMXSB0_DTVSM0_DPLB0_EPS0_ELFLR0_EMLLn1_FDSI0_GRPM1_GRVWA1_GRVWB1_GSU1_GSUAMB_GSUC0_GSUWGMRR0_GLS0_ISA1151_IU1_K1_LDSTI0_LBSPPA0_LBSPPB0_LBSPPM0_LPA0_LPB1_LPM0_LRVW1_LWPMn1_MIAV0_MXLIA_MXSFA_MO40_MGRIPM1_NTn1_NTA0_NTB0_NTC0_NTD0_NTM0_NEPBS0_NLCA1_NLCB1_ONLL1_PGR0_PLR1_PKA0_SGROB0_SIA1_SS0_SU8_SUM0_SUS256_SPO0_SRVW0_SSO0_SVW1_SK0_SKFTR0_SKXCCM0_SIP1_SGRO0_TDMI0_TDMS0_TIN0_TT2_2_TLDS0_TLDSMn1_ULSGRO0_USL1_USLMX0_UIOFGRO0_UPLRP0_USFGROn1_USI0_VSn1_VWA1_VWB1_WSGRA0_WSGRB0_WS32_WG8_8_1_WGM4_WGMXCC1_WGMXCCGn1
    SolutionIndex: 47
    SolutionNameMin: Cijk_Ailk_Bljk_S_B_Bias_HA_S_SAV_UserArgs_MT32x32x16_SN_LDSB0_AFC1_AG0_AFEM1_AFEM1_ASEM1_CLR0_CADS0_DTLA0_DTLB0_DTVA0_DTVB0_DTVMXSA0_DTVMXSB0_DTVSM0_DPLB0_EPS0_ELFLR0_EMLLn1_FDSI0_GRPM1_GRVWA1_GRVWB1_GSU1_GSUAMB_GSUC0_GSUWGMRR0_GLS0_ISA1151_IU1_K1_LDSTI0_LBSPPA0_LBSPPB0_LBSPPM0_LPA0_LPB1_LPM0_LRVW1_LWPMn1_MIAV0_MXLIA_MXSFA_MO40_MGRIPM1_NTn1_NTA0_NTB0_NTC0_NTD0_NTM0_NEPBS0_NLCA1_NLCB1_ONLL1_PGR1_PLR1_PKA0_SGROB0_SIA1_SS0_SU8_SUM0_SUS256_SPO0_SRVW0_SSO0_SVW1_SK0_SKFTR0_SKXCCM0_SIP1_SGRO0_TDMI0_TDMS0_TIN0_TT4_4_TLDS0_TLDSMn1_ULSGRO0_USL1_USLMX0_UIOFGRO0_UPLRP0_USFGROn1_USI0_VSn1_VWA1_VWB1_WSGRA0_WSGRB0_WS32_WG8_8_1_WGM1_WGMXCC1_WGMXCCGn1
    SolutionIndex: 48
    SolutionNameMin: Cijk_Ailk_Bljk_S_B_Bias_HA_S_SAV_UserArgs_MT32x32x32_SN_LDSB0_AFC1_AG0_AFEM1_AFEM1_ASEM1_CLR0_CADS0_DTLA0_DTLB0_DTVA0_DTVB0_DTVMXSA0_DTVMXSB0_DTVSM0_DPLB0_EPS0_ELFLR0_EMLLn1_FDSI0_GRPM1_GRVWA1_GRVWB1_GSU1_GSUAMB_GSUC0_GSUWGMRR0_GLS0_ISA1151_IU1_K1_LDSTI0_LBSPPA0_LBSPPB0_LBSPPM0_LPA0_LPB1_LPM0_LRVW1_LWPMn1_MIAV0_MXLIA_MXSFA_MO40_MGRIPM1_NTn1_NTA0_NTB0_NTC0_NTD0_NTM0_NEPBS0_NLCA1_NLCB1_ONLL1_PGR1_PLR1_PKA0_SGROB0_SIA1_SS0_SU0_SUM0_SUS0_SPO0_SRVW0_SSO0_SVW1_SK0_SKFTR0_SKXCCM0_SIP1_SGRO0_TDMI0_TDMS0_TIN0_TT4_4_TLDS0_TLDSMn1_ULSGRO0_USL1_USLMX0_UIOFGRO0_UPLRP0_USFGROn1_USI0_VSn1_VWA1_VWB1_WSGRA0_WSGRB0_WS32_WG8_8_1_WGM4_WGMXCC1_WGMXCCGn1
    SolutionIndex: 49
    SolutionNameMin: Cijk_Ailk_Bljk_S_B_Bias_HA_S_SAV_UserArgs_MT64x32x64_SN_LDSB0_AFC1_AG0_AFEM1_AFEM1_ASEM1_CLR0_CADS0_DTLA0_DTLB0_DTVA0_DTVB0_DTVMXSA0_DTVMXSB0_DTVSM0_DPLB0_EPS0_ELFLR0_EMLLn1_FDSI0_GRPM1_GRVWA1_GRVWB1_GSU1_GSUAMB_GSUC0_GSUWGMRR0_GLS0_ISA1151_IU1_K1_LDSTI0_LBSPPA0_LBSPPB0_LBSPPM0_LPA0_LPB1_LPM0_LRVW1_LWPMn1_MIAV0_MXLIA_MXSFA_MO40_MGRIPM1_NTn1_NTA0_NTB0_NTC0_NTD0_NTM0_NEPBS0_NLCA1_NLCB1_ONLL1_PGR0_PLR1_PKA0_SGROB0_SIA1_SS0_SU8_SUM0_SUS256_SPO0_SRVW0_SSO0_SVW1_SK0_SKFTR0_SKXCCM0_SIP1_SGRO0_TDMI0_TDMS0_TIN0_TT4_4_TLDS0_TLDSMn1_ULSGRO0_USL1_USLMX0_UIOFGRO0_UPLRP0_USFGROn1_USI0_VSn1_VWA1_VWB1_WSGRA0_WSGRB0_WS32_WG16_8_1_WGM1_WGMXCC1_WGMXCCGn1
    SolutionIndex: 50
    SolutionNameMin: Cijk_Ailk_Bljk_S_B_Bias_HA_S_SAV_UserArgs_MT64x32x16_SN_LDSB0_AFC1_AG0_AFEM1_AFEM1_ASEM1_CLR0_CADS0_DTLA0_DTLB0_DTVA0_DTVB0_DTVMXSA0_DTVMXSB0_DTVSM0_DPLB0_EPS0_ELFLR0_EMLLn1_FDSI0_GRPM1_GRVWA1_GRVWB1_GSU1_GSUAMB_GSUC0_GSUWGMRR0_GLS0_ISA1151_IU1_K1_LDSTI0_LBSPPA0_LBSPPB0_LBSPPM0_LPA0_LPB1_LPM0_LRVW1_LWPMn1_MIAV0_MXLIA_MXSFA_MO40_MGRIPM1_NTn1_NTA0_NTB0_NTC0_NTD0_NTM0_NEPBS0_NLCA1_NLCB1_ONLL1_PGR1_PLR1_PKA0_SGROB0_SIA1_SS0_SU0_SUM0_SUS0_SPO0_SRVW0_SSO0_SVW1_SK0_SKFTR0_SKXCCM0_SIP1_SGRO0_TDMI0_TDMS0_TIN0_TT4_4_TLDS0_TLDSMn1_ULSGRO0_USL1_USLMX0_UIOFGRO0_UPLRP0_USFGROn1_USI0_VSn1_VWA1_VWB1_WSGRA0_WSGRB0_WS32_WG16_8_1_WGM1_WGMXCC1_WGMXCCGn1
    SolutionIndex: 51
    SolutionNameMin: Cijk_Ailk_Bljk_S_B_Bias_HA_S_SAV_UserArgs_MT56x64x32_SN_LDSB0_AFC1_AG0_AFEM1_AFEM1_ASEM1_CLR0_CADS0_DTLA0_DTLB0_DTVA0_DTVB0_DTVMXSA0_DTVMXSB0_DTVSM0_DPLB0_EPS0_ELFLR0_EMLLn1_FDSI0_GRPM1_GRVWA1_GRVWB1_GSU1_GSUAMB_GSUC0_GSUWGMRR0_GLS0_ISA1151_IU1_K1_LDSTI0_LBSPPA0_LBSPPB0_LBSPPM0_LPA0_LPB1_LPM0_LRVW1_LWPMn1_MIAV0_MXLIA_MXSFA_MO40_MGRIPM1_NTn1_NTA0_NTB0_NTC0_NTD0_NTM0_NEPBS0_NLCA7_NLCB1_ONLL1_PGR0_PLR1_PKA0_SGROB0_SIA1_SS0_SU0_SUM0_SUS0_SPO0_SRVW0_SSO0_SVW1_SK0_SKFTR0_SKXCCM0_SIP1_SGRO0_TDMI0_TDMS0_TIN0_TT7_8_TLDS0_TLDSMn1_ULSGRO0_USL1_USLMX0_UIOFGRO0_UPLRP0_USFGROn1_USI0_VSn1_VWA1_VWB1_WSGRA0_WSGRB0_WS32_WG8_8_1_WGM1_WGMXCC1_WGMXCCGn1
    SolutionIndex: 52
    SolutionNameMin: Cijk_Ailk_Bljk_S_B_Bias_HA_S_SAV_UserArgs_MT56x64x32_SN_LDSB0_AFC1_AG0_AFEM1_AFEM1_ASEM1_CLR0_CADS0_DTLA0_DTLB0_DTVA0_DTVB0_DTVMXSA0_DTVMXSB0_DTVSM0_DPLB0_EPS0_ELFLR0_EMLLn1_FDSI0_GRPM1_GRVWA1_GRVWB1_GSU1_GSUAMB_GSUC0_GSUWGMRR0_GLS0_ISA1151_IU1_K1_LDSTI0_LBSPPA0_LBSPPB0_LBSPPM0_LPA0_LPB1_LPM0_LRVW1_LWPMn1_MIAV0_MXLIA_MXSFA_MO40_MGRIPM1_NTn1_NTA0_NTB0_NTC0_NTD0_NTM0_NEPBS0_NLCA7_NLCB1_ONLL1_PGR1_PLR1_PKA0_SGROB0_SIA1_SS0_SU8_SUM0_SUS256_SPO0_SRVW0_SSO0_SVW1_SK0_SKFTR0_SKXCCM0_SIP1_SGRO0_TDMI0_TDMS0_TIN0_TT7_8_TLDS0_TLDSMn1_ULSGRO0_USL1_USLMX0_UIOFGRO0_UPLRP0_USFGROn1_USI0_VSn1_VWA1_VWB1_WSGRA0_WSGRB0_WS32_WG8_8_1_WGM1_WGMXCC1_WGMXCCGn1
    SolutionIndex: 53
    SolutionNameMin: Cijk_Ailk_Bljk_S_B_Bias_HA_S_SAV_UserArgs_MT80x64x32_SN_LDSB0_AFC1_AG0_AFEM1_AFEM1_ASEM1_CLR0_CADS0_DTLA0_DTLB0_DTVA0_DTVB0_DTVMXSA0_DTVMXSB0_DTVSM0_DPLB0_EPS0_ELFLR0_EMLLn1_FDSI0_GRPM1_GRVWA1_GRVWB1_GSU1_GSUAMB_GSUC0_GSUWGMRR0_GLS0_ISA1151_IU1_K1_LDSTI0_LBSPPA0_LBSPPB0_LBSPPM0_LPA0_LPB1_LPM0_LRVW1_LWPMn1_MIAV0_MXLIA_MXSFA_MO40_MGRIPM1_NTn1_NTA0_NTB0_NTC0_NTD0_NTM0_NEPBS0_NLCA5_NLCB1_ONLL1_PGR0_PLR1_PKA0_SGROB0_SIA1_SS0_SU0_SUM0_SUS0_SPO0_SRVW0_SSO0_SVW1_SK0_SKFTR0_SKXCCM0_SIP1_SGRO0_TDMI0_TDMS0_TIN0_TT5_8_TLDS0_TLDSMn1_ULSGRO0_USL1_USLMX0_UIOFGRO0_UPLRP0_USFGROn1_USI0_VSn1_VWA1_VWB1_WSGRA0_WSGRB0_WS32_WG16_8_1_WGM1_WGMXCC1_WGMXCCGn1
    SolutionIndex: 54
    SolutionNameMin: Cijk_Ailk_Bljk_S_B_Bias_HA_S_SAV_UserArgs_MT80x64x16_SN_LDSB0_AFC1_AG0_AFEM1_AFEM1_ASEM1_CLR0_CADS0_DTLA0_DTLB0_DTVA0_DTVB0_DTVMXSA0_DTVMXSB0_DTVSM0_DPLB0_EPS0_ELFLR0_EMLLn1_FDSI0_GRPM1_GRVWA1_GRVWB1_GSU1_GSUAMB_GSUC0_GSUWGMRR0_GLS0_ISA1151_IU1_K1_LDSTI0_LBSPPA0_LBSPPB0_LBSPPM0_LPA0_LPB1_LPM0_LRVW1_LWPMn1_MIAV0_MXLIA_MXSFA_MO40_MGRIPM1_NTn1_NTA0_NTB0_NTC0_NTD0_NTM0_NEPBS0_NLCA5_NLCB1_ONLL1_PGR1_PLR1_PKA0_SGROB0_SIA1_SS0_SU0_SUM0_SUS0_SPO0_SRVW0_SSO0_SVW1_SK0_SKFTR0_SKXCCM0_SIP1_SGRO0_TDMI0_TDMS0_TIN0_TT5_8_TLDS0_TLDSMn1_ULSGRO0_USL1_USLMX0_UIOFGRO0_UPLRP0_USFGROn1_USI0_VSn1_VWA1_VWB1_WSGRA0_WSGRB0_WS32_WG16_8_1_WGM1_WGMXCC1_WGMXCCGn1
    SolutionIndex: 55
    SolutionNameMin: Cijk_Ailk_Bljk_S_B_Bias_HA_S_SAV_UserArgs_MT40x64x32_SN_LDSB0_AFC1_AG0_AFEM1_AFEM1_ASEM1_CLR0_CADS0_DTLA0_DTLB0_DTVA0_DTVB0_DTVMXSA0_DTVMXSB0_DTVSM0_DPLB0_EPS0_ELFLR0_EMLLn1_FDSI0_GRPM1_GRVWA1_GRVWB1_GSU1_GSUAMB_GSUC0_GSUWGMRR0_GLS0_ISA1151_IU1_K1_LDSTI0_LBSPPA0_LBSPPB0_LBSPPM0_LPA0_LPB1_LPM0_LRVW1_LWPMn1_MIAV0_MXLIA_MXSFA_MO40_MGRIPM1_NTn1_NTA0_NTB0_NTC0_NTD0_NTM0_NEPBS0_NLCA5_NLCB1_ONLL1_PGR1_PLR1_PKA0_SGROB0_SIA1_SS0_SU0_SUM0_SUS0_SPO0_SRVW0_SSO0_SVW1_SK0_SKFTR0_SKXCCM0_SIP1_SGRO0_TDMI0_TDMS0_TIN0_TT5_8_TLDS0_TLDSMn1_ULSGRO0_USL1_USLMX0_UIOFGRO0_UPLRP0_USFGROn1_USI0_VSn1_VWA1_VWB1_WSGRA0_WSGRB0_WS32_WG8_8_1_WGM1_WGMXCC1_WGMXCCGn1
    SolutionIndex: 56
    SolutionNameMin: Cijk_Ailk_Bljk_S_B_Bias_HA_S_SAV_UserArgs_MT80x64x32_SN_LDSB0_AFC1_AG0_AFEM1_AFEM1_ASEM1_CLR0_CADS0_DTLA0_DTLB0_DTVA0_DTVB0_DTVMXSA0_DTVMXSB0_DTVSM0_DPLB0_EPS0_ELFLR0_EMLLn1_FDSI0_GRPM1_GRVWA1_GRVWB1_GSU1_GSUAMB_GSUC0_GSUWGMRR0_GLS0_ISA1151_IU1_K1_LDSTI0_LBSPPA0_LBSPPB0_LBSPPM0_LPA0_LPB1_LPM0_LRVW1_LWPMn1_MIAV0_MXLIA_MXSFA_MO40_MGRIPM1_NTn1_NTA0_NTB0_NTC0_NTD0_NTM0_NEPBS0_NLCA5_NLCB1_ONLL1_PGR1_PLR1_PKA0_SGROB0_SIA1_SS0_SU0_SUM0_SUS0_SPO0_SRVW0_SSO0_SVW1_SK0_SKFTR0_SKXCCM0_SIP1_SGRO0_TDMI0_TDMS0_TIN0_TT5_8_TLDS0_TLDSMn1_ULSGRO0_USL1_USLMX0_UIOFGRO0_UPLRP0_USFGROn1_USI0_VSn1_VWA1_VWB1_WSGRA0_WSGRB0_WS32_WG16_8_1_WGM1_WGMXCC1_WGMXCCGn1
    SolutionIndex: 57
    SolutionNameMin: Cijk_Ailk_Bljk_S_B_Bias_HA_S_SAV_UserArgs_MT40x64x16_SN_LDSB0_AFC1_AG0_AFEM1_AFEM1_ASEM1_CLR0_CADS0_DTLA0_DTLB0_DTVA0_DTVB0_DTVMXSA0_DTVMXSB0_DTVSM0_DPLB0_EPS0_ELFLR0_EMLLn1_FDSI0_GRPM1_GRVWA1_GRVWB1_GSU1_GSUAMB_GSUC0_GSUWGMRR0_GLS0_ISA1151_IU1_K1_LDSTI0_LBSPPA0_LBSPPB0_LBSPPM0_LPA0_LPB1_LPM0_LRVW1_LWPMn1_MIAV0_MXLIA_MXSFA_MO40_MGRIPM1_NTn1_NTA0_NTB0_NTC0_NTD0_NTM0_NEPBS0_NLCA5_NLCB1_ONLL1_PGR1_PLR1_PKA0_SGROB0_SIA1_SS0_SU8_SUM0_SUS256_SPO0_SRVW0_SSO0_SVW1_SK0_SKFTR0_SKXCCM0_SIP1_SGRO0_TDMI0_TDMS0_TIN0_TT5_8_TLDS0_TLDSMn1_ULSGRO0_USL1_USLMX0_UIOFGRO0_UPLRP0_USFGROn1_USI0_VSn1_VWA1_VWB1_WSGRA0_WSGRB0_WS32_WG8_8_1_WGM1_WGMXCC1_WGMXCCGn1
    SolutionIndex: 58
    SolutionNameMin: Cijk_Ailk_Bljk_S_B_Bias_HA_S_SAV_UserArgs_MT32x16x64_SN_LDSB0_AFC1_AG0_AFEM1_AFEM1_ASEM1_CLR0_CADS0_DTLA0_DTLB0_DTVA0_DTVB0_DTVMXSA0_DTVMXSB0_DTVSM0_DPLB0_EPS0_ELFLR0_EMLLn1_FDSI0_GRPM1_GRVWA1_GRVWB1_GSU1_GSUAMB_GSUC0_GSUWGMRR0_GLS0_ISA1151_IU1_K1_LDSTI0_LBSPPA0_LBSPPB0_LBSPPM0_LPA0_LPB1_LPM0_LRVW1_LWPMn1_MIAV0_MXLIA_MXSFA_MO40_MGRIPM1_NTn1_NTA0_NTB0_NTC0_NTD0_NTM0_NEPBS0_NLCA1_NLCB1_ONLL1_PGR0_PLR1_PKA0_SGROB0_SIA1_SS0_SU0_SUM0_SUS0_SPO0_SRVW0_SSO0_SVW1_SK0_SKFTR0_SKXCCM0_SIP1_SGRO0_TDMI0_TDMS0_TIN0_TT4_2_TLDS0_TLDSMn1_ULSGRO0_USL1_USLMX0_UIOFGRO0_UPLRP0_USFGROn1_USI0_VSn1_VWA1_VWB1_WSGRA0_WSGRB0_WS32_WG8_8_1_WGM4_WGMXCC1_WGMXCCGn1
    SolutionIndex: 59
    SolutionNameMin: Cijk_Ailk_Bljk_S_B_Bias_HA_S_SAV_UserArgs_MT32x16x64_SN_LDSB0_AFC1_AG0_AFEM1_AFEM1_ASEM1_CLR0_CADS0_DTLA0_DTLB0_DTVA0_DTVB0_DTVMXSA0_DTVMXSB0_DTVSM0_DPLB0_EPS0_ELFLR0_EMLLn1_FDSI0_GRPM1_GRVWA1_GRVWB1_GSU1_GSUAMB_GSUC0_GSUWGMRR0_GLS0_ISA1151_IU1_K1_LDSTI0_LBSPPA0_LBSPPB0_LBSPPM0_LPA0_LPB1_LPM0_LRVW1_LWPMn1_MIAV0_MXLIA_MXSFA_MO40_MGRIPM1_NTn1_NTA0_NTB0_NTC0_NTD0_NTM0_NEPBS0_NLCA1_NLCB1_ONLL1_PGR0_PLR1_PKA0_SGROB0_SIA1_SS0_SU0_SUM0_SUS0_SPO0_SRVW0_SSO0_SVW1_SK0_SKFTR0_SKXCCM0_SIP1_SGRO0_TDMI0_TDMS0_TIN0_TT4_2_TLDS0_TLDSMn1_ULSGRO0_USL1_USLMX0_UIOFGRO0_UPLRP0_USFGROn1_USI0_VSn1_VWA1_VWB1_WSGRA0_WSGRB0_WS32_WG8_8_1_WGM1_WGMXCC1_WGMXCCGn1
    SolutionIndex: 60
    SolutionNameMin: Cijk_Ailk_Bljk_S_B_Bias_HA_S_SAV_UserArgs_MT32x32x32_SN_LDSB0_AFC1_AG0_AFEM1_AFEM1_ASEM1_CLR0_CADS0_DTLA0_DTLB0_DTVA0_DTVB0_DTVMXSA0_DTVMXSB0_DTVSM0_DPLB0_EPS1_ELFLR0_EMLLn1_FDSI0_GRPM1_GRVWA1_GRVWB1_GSU1_GSUAMB_GSUC0_GSUWGMRR0_GLS0_ISA1151_IU1_K1_LDSTI0_LBSPPA0_LBSPPB0_LBSPPM0_LPA0_LPB1_LPM0_LRVW1_LWPMn1_MIAV0_MXLIA_MXSFA_MO40_MGRIPM1_NTn1_NTA0_NTB0_NTC0_NTD0_NTM0_NEPBS0_NLCA1_NLCB1_ONLL1_PGR1_PLR1_PKA0_SGROB0_SIA1_SS0_SU0_SUM0_SUS0_SPO0_SRVW0_SSO0_SVW1_SK0_SKFTR0_SKXCCM0_SIP1_SGRO0_TDMI0_TDMS0_TIN0_TT4_4_TLDS0_TLDSMn1_ULSGRO0_USL1_USLMX0_UIOFGRO0_UPLRP0_USFGROn1_USI0_VSn1_VWA1_VWB1_WSGRA0_WSGRB0_WS32_WG8_8_1_WGM4_WGMXCC1_WGMXCCGn1
    SolutionIndex: 61
    SolutionNameMin: Cijk_Ailk_Bljk_S_B_Bias_HA_S_SAV_UserArgs_MT32x16x16_SN_LDSB0_AFC1_AG0_AFEM1_AFEM1_ASEM1_CLR0_CADS0_DTLA0_DTLB0_DTVA0_DTVB0_DTVMXSA0_DTVMXSB0_DTVSM0_DPLB0_EPS1_ELFLR0_EMLLn1_FDSI0_GRPM1_GRVWA1_GRVWB1_GSU1_GSUAMB_GSUC0_GSUWGMRR0_GLS0_ISA1151_IU1_K1_LDSTI0_LBSPPA0_LBSPPB0_LBSPPM0_LPA0_LPB1_LPM0_LRVW1_LWPMn1_MIAV0_MXLIA_MXSFA_MO40_MGRIPM1_NTn1_NTA0_NTB0_NTC0_NTD0_NTM0_NEPBS0_NLCA1_NLCB1_ONLL1_PGR1_PLR1_PKA0_SGROB0_SIA1_SS0_SU0_SUM0_SUS0_SPO0_SRVW0_SSO0_SVW1_SK0_SKFTR0_SKXCCM0_SIP1_SGRO0_TDMI0_TDMS0_TIN0_TT4_2_TLDS0_TLDSMn1_ULSGRO0_USL1_USLMX0_UIOFGRO0_UPLRP0_USFGROn1_USI0_VSn1_VWA1_VWB1_WSGRA0_WSGRB0_WS32_WG8_8_1_WGM1_WGMXCC1_WGMXCCGn1
    SolutionIndex: 62
    SolutionNameMin: Cijk_Ailk_Bljk_S_B_Bias_HA_S_SAV_UserArgs_MT32x16x16_SN_LDSB0_AFC1_AG0_AFEM1_AFEM1_ASEM1_CLR0_CADS0_DTLA0_DTLB0_DTVA0_DTVB0_DTVMXSA0_DTVMXSB0_DTVSM0_DPLB0_EPS0_ELFLR0_EMLLn1_FDSI0_GRPM1_GRVWA1_GRVWB1_GSU1_GSUAMB_GSUC0_GSUWGMRR0_GLS0_ISA1151_IU1_K1_LDSTI0_LBSPPA0_LBSPPB0_LBSPPM0_LPA0_LPB1_LPM0_LRVW1_LWPMn1_MIAV0_MXLIA_MXSFA_MO40_MGRIPM1_NTn1_NTA0_NTB0_NTC0_NTD0_NTM0_NEPBS0_NLCA1_NLCB1_ONLL1_PGR0_PLR1_PKA0_SGROB0_SIA1_SS0_SU0_SUM0_SUS0_SPO0_SRVW0_SSO0_SVW1_SK0_SKFTR0_SKXCCM0_SIP1_SGRO0_TDMI0_TDMS0_TIN0_TT4_2_TLDS0_TLDSMn1_ULSGRO0_USL1_USLMX0_UIOFGRO0_UPLRP0_USFGROn1_USI0_VSn1_VWA1_VWB1_WSGRA0_WSGRB0_WS32_WG8_8_1_WGM1_WGMXCC1_WGMXCCGn1
    SolutionIndex: 63
    SolutionNameMin: Cijk_Ailk_Bljk_S_B_Bias_HA_S_SAV_UserArgs_MT80x64x32_SN_LDSB0_AFC1_AG0_AFEM1_AFEM1_ASEM1_CLR0_CADS0_DTLA0_DTLB0_DTVA0_DTVB0_DTVMXSA0_DTVMXSB0_DTVSM0_DPLB0_EPS0_ELFLR0_EMLLn1_FDSI0_GRPM1_GRVWA1_GRVWB1_GSU1_GSUAMB_GSUC0_GSUWGMRR0_GLS0_ISA1151_IU1_K1_LDSTI0_LBSPPA0_LBSPPB0_LBSPPM0_LPA0_LPB1_LPM0_LRVW1_LWPMn1_MIAV0_MXLIA_MXSFA_MO40_MGRIPM1_NTn1_NTA0_NTB0_NTC0_NTD0_NTM0_NEPBS0_NLCA5_NLCB1_ONLL1_PGR0_PLR1_PKA0_SGROB0_SIA1_SS0_SU8_SUM0_SUS256_SPO0_SRVW0_SSO0_SVW1_SK0_SKFTR0_SKXCCM0_SIP1_SGRO0_TDMI0_TDMS0_TIN0_TT5_8_TLDS0_TLDSMn1_ULSGRO0_USL1_USLMX0_UIOFGRO0_UPLRP0_USFGROn1_USI0_VSn1_VWA1_VWB1_WSGRA0_WSGRB0_WS32_WG16_8_1_WGM2_WGMXCC1_WGMXCCGn1
    SolutionIndex: 64
    SolutionNameMin: Cijk_Ailk_Bljk_S_B_Bias_HA_S_SAV_UserArgs_MT80x64x32_SN_LDSB0_AFC1_AG0_AFEM1_AFEM1_ASEM1_CLR0_CADS0_DTLA0_DTLB0_DTVA0_DTVB0_DTVMXSA0_DTVMXSB0_DTVSM0_DPLB0_EPS0_ELFLR0_EMLLn1_FDSI0_GRPM1_GRVWA1_GRVWB1_GSU1_GSUAMB_GSUC0_GSUWGMRR0_GLS0_ISA1151_IU1_K1_LDSTI0_LBSPPA0_LBSPPB0_LBSPPM0_LPA0_LPB1_LPM0_LRVW1_LWPMn1_MIAV0_MXLIA_MXSFA_MO40_MGRIPM1_NTn1_NTA0_NTB0_NTC0_NTD0_NTM0_NEPBS0_NLCA5_NLCB1_ONLL1_PGR1_PLR1_PKA0_SGROB0_SIA1_SS0_SU8_SUM0_SUS256_SPO0_SRVW0_SSO0_SVW1_SK0_SKFTR0_SKXCCM0_SIP1_SGRO0_TDMI0_TDMS0_TIN0_TT5_8_TLDS0_TLDSMn1_ULSGRO0_USL1_USLMX0_UIOFGRO0_UPLRP0_USFGROn1_USI0_VSn1_VWA1_VWB1_WSGRA0_WSGRB0_WS32_WG16_8_1_WGM5_WGMXCC1_WGMXCCGn1
    SolutionIndex: 65
    SolutionNameMin: Cijk_Ailk_Bljk_S_B_Bias_HA_S_SAV_UserArgs_MT112x64x32_SN_LDSB0_AFC1_AG0_AFEM1_AFEM1_ASEM1_CLR0_CADS0_DTLA0_DTLB0_DTVA0_DTVB0_DTVMXSA0_DTVMXSB0_DTVSM0_DPLB0_EPS0_ELFLR0_EMLLn1_FDSI0_GRPM1_GRVWA1_GRVWB1_GSU1_GSUAMB_GSUC0_GSUWGMRR0_GLS0_ISA1151_IU1_K1_LDSTI0_LBSPPA0_LBSPPB0_LBSPPM0_LPA0_LPB1_LPM0_LRVW1_LWPMn1_MIAV0_MXLIA_MXSFA_MO40_MGRIPM1_NTn1_NTA0_NTB0_NTC0_NTD0_NTM0_NEPBS0_NLCA7_NLCB1_ONLL1_PGR0_PLR1_PKA0_SGROB0_SIA1_SS0_SU0_SUM0_SUS0_SPO0_SRVW0_SSO0_SVW1_SK0_SKFTR0_SKXCCM0_SIP1_SGRO0_TDMI0_TDMS0_TIN0_TT7_8_TLDS0_TLDSMn1_ULSGRO0_USL1_USLMX0_UIOFGRO0_UPLRP0_USFGROn1_USI0_VSn1_VWA1_VWB1_WSGRA0_WSGRB0_WS32_WG16_8_1_WGM5_WGMXCC1_WGMXCCGn1
    SolutionIndex: 66
    SolutionNameMin: Cijk_Ailk_Bljk_S_B_Bias_HA_S_SAV_UserArgs_MT64x32x64_SN_LDSB0_AFC1_AG0_AFEM1_AFEM1_ASEM1_CLR0_CADS0_DTLA0_DTLB0_DTVA0_DTVB0_DTVMXSA0_DTVMXSB0_DTVSM0_DPLB0_EPS0_ELFLR0_EMLLn1_FDSI0_GRPM1_GRVWA1_GRVWB1_GSU1_GSUAMB_GSUC0_GSUWGMRR0_GLS0_ISA1151_IU1_K1_LDSTI0_LBSPPA0_LBSPPB0_LBSPPM0_LPA0_LPB1_LPM0_LRVW1_LWPMn1_MIAV0_MXLIA_MXSFA_MO40_MGRIPM1_NTn1_NTA0_NTB0_NTC0_NTD0_NTM0_NEPBS0_NLCA1_NLCB1_ONLL1_PGR1_PLR1_PKA0_SGROB0_SIA1_SS0_SU8_SUM0_SUS256_SPO0_SRVW0_SSO0_SVW1_SK0_SKFTR0_SKXCCM0_SIP1_SGRO0_TDMI0_TDMS0_TIN0_TT4_4_TLDS0_TLDSMn1_ULSGRO0_USL1_USLMX0_UIOFGRO0_UPLRP0_USFGROn1_USI0_VSn1_VWA1_VWB1_WSGRA0_WSGRB0_WS32_WG16_8_1_WGM4_WGMXCC1_WGMXCCGn1
    SolutionIndex: 67
    SolutionNameMin: Cijk_Ailk_Bljk_S_B_Bias_HA_S_SAV_UserArgs_MT64x16x64_SN_LDSB0_AFC1_AG0_AFEM1_AFEM1_ASEM1_CLR0_CADS0_DTLA0_DTLB0_DTVA0_DTVB0_DTVMXSA0_DTVMXSB0_DTVSM0_DPLB0_EPS0_ELFLR0_EMLLn1_FDSI0_GRPM1_GRVWA1_GRVWB1_GSU1_GSUAMB_GSUC0_GSUWGMRR0_GLS0_ISA1151_IU1_K1_LDSTI0_LBSPPA0_LBSPPB0_LBSPPM0_LPA0_LPB1_LPM0_LRVW1_LWPMn1_MIAV0_MXLIA_MXSFA_MO40_MGRIPM1_NTn1_NTA0_NTB0_NTC0_NTD0_NTM0_NEPBS0_NLCA1_NLCB1_ONLL1_PGR0_PLR1_PKA0_SGROB0_SIA1_SS0_SU0_SUM0_SUS0_SPO0_SRVW0_SSO0_SVW1_SK0_SKFTR0_SKXCCM0_SIP1_SGRO0_TDMI0_TDMS0_TIN0_TT4_2_TLDS0_TLDSMn1_ULSGRO0_USL1_USLMX0_UIOFGRO0_UPLRP0_USFGROn1_USI0_VSn1_VWA1_VWB1_WSGRA0_WSGRB0_WS32_WG16_8_1_WGM1_WGMXCC1_WGMXCCGn1
    SolutionIndex: 68
    SolutionNameMin: Cijk_Ailk_Bljk_S_B_Bias_HA_S_SAV_UserArgs_MT64x32x64_SN_LDSB0_AFC1_AG0_AFEM1_AFEM1_ASEM1_CLR0_CADS0_DTLA0_DTLB0_DTVA0_DTVB0_DTVMXSA0_DTVMXSB0_DTVSM0_DPLB0_EPS0_ELFLR0_EMLLn1_FDSI0_GRPM1_GRVWA1_GRVWB1_GSU1_GSUAMB_GSUC0_GSUWGMRR0_GLS0_ISA1151_IU1_K1_LDSTI0_LBSPPA0_LBSPPB0_LBSPPM0_LPA0_LPB1_LPM0_LRVW1_LWPMn1_MIAV0_MXLIA_MXSFA_MO40_MGRIPM1_NTn1_NTA0_NTB0_NTC0_NTD0_NTM0_NEPBS0_NLCA1_NLCB1_ONLL1_PGR1_PLR1_PKA0_SGROB0_SIA1_SS0_SU8_SUM0_SUS256_SPO0_SRVW0_SSO0_SVW1_SK0_SKFTR0_SKXCCM0_SIP1_SGRO0_TDMI0_TDMS0_TIN0_TT4_4_TLDS0_TLDSMn1_ULSGRO0_USL1_USLMX0_UIOFGRO0_UPLRP0_USFGROn1_USI0_VSn1_VWA1_VWB1_WSGRA0_WSGRB0_WS32_WG16_8_1_WGM1_WGMXCC1_WGMXCCGn1
    SolutionIndex: 69
    SolutionNameMin: Cijk_Ailk_Bljk_S_B_Bias_HA_S_SAV_UserArgs_MT64x32x32_SN_LDSB0_AFC1_AG0_AFEM1_AFEM1_ASEM1_CLR0_CADS0_DTLA0_DTLB0_DTVA0_DTVB0_DTVMXSA0_DTVMXSB0_DTVSM0_DPLB0_EPS0_ELFLR0_EMLLn1_FDSI0_GRPM1_GRVWA1_GRVWB1_GSU1_GSUAMB_GSUC0_GSUWGMRR0_GLS0_ISA1151_IU1_K1_LDSTI0_LBSPPA0_LBSPPB0_LBSPPM0_LPA0_LPB1_LPM0_LRVW1_LWPMn1_MIAV0_MXLIA_MXSFA_MO40_MGRIPM1_NTn1_NTA0_NTB0_NTC0_NTD0_NTM0_NEPBS0_NLCA1_NLCB1_ONLL1_PGR1_PLR1_PKA0_SGROB0_SIA1_SS0_SU8_SUM0_SUS256_SPO0_SRVW0_SSO0_SVW1_SK0_SKFTR0_SKXCCM0_SIP1_SGRO0_TDMI0_TDMS0_TIN0_TT4_4_TLDS0_TLDSMn1_ULSGRO0_USL1_USLMX0_UIOFGRO0_UPLRP0_USFGROn1_USI0_VSn1_VWA1_VWB1_WSGRA0_WSGRB0_WS32_WG16_8_1_WGM1_WGMXCC1_WGMXCCGn1
    SolutionIndex: 70
    SolutionNameMin: Cijk_Ailk_Bljk_S_B_Bias_HA_S_SAV_UserArgs_MT112x64x16_SN_LDSB0_AFC1_AG0_AFEM1_AFEM1_ASEM1_CLR0_CADS0_DTLA0_DTLB0_DTVA0_DTVB0_DTVMXSA0_DTVMXSB0_DTVSM0_DPLB0_EPS0_ELFLR0_EMLLn1_FDSI0_GRPM1_GRVWA1_GRVWB1_GSU1_GSUAMB_GSUC0_GSUWGMRR0_GLS0_ISA1151_IU1_K1_LDSTI0_LBSPPA0_LBSPPB0_LBSPPM0_LPA0_LPB1_LPM0_LRVW1_LWPMn1_MIAV0_MXLIA_MXSFA_MO40_MGRIPM1_NTn1_NTA0_NTB0_NTC0_NTD0_NTM0_NEPBS0_NLCA7_NLCB1_ONLL1_PGR0_PLR1_PKA0_SGROB0_SIA1_SS0_SU0_SUM0_SUS0_SPO0_SRVW0_SSO0_SVW1_SK0_SKFTR0_SKXCCM0_SIP1_SGRO0_TDMI0_TDMS0_TIN0_TT7_8_TLDS0_TLDSMn1_ULSGRO0_USL1_USLMX0_UIOFGRO0_UPLRP0_USFGROn1_USI0_VSn1_VWA1_VWB1_WSGRA0_WSGRB0_WS32_WG16_8_1_WGM4_WGMXCC1_WGMXCCGn1
    SolutionIndex: 71
    SolutionNameMin: Cijk_Ailk_Bljk_S_B_Bias_HA_S_SAV_UserArgs_MT40x64x32_SN_LDSB0_AFC1_AG0_AFEM1_AFEM1_ASEM1_CLR0_CADS0_DTLA0_DTLB0_DTVA0_DTVB0_DTVMXSA0_DTVMXSB0_DTVSM0_DPLB0_EPS0_ELFLR0_EMLLn1_FDSI0_GRPM1_GRVWA1_GRVWB1_GSU1_GSUAMB_GSUC0_GSUWGMRR0_GLS0_ISA1151_IU1_K1_LDSTI0_LBSPPA0_LBSPPB0_LBSPPM0_LPA0_LPB1_LPM0_LRVW1_LWPMn1_MIAV0_MXLIA_MXSFA_MO40_MGRIPM1_NTn1_NTA0_NTB0_NTC0_NTD0_NTM0_NEPBS0_NLCA5_NLCB1_ONLL1_PGR1_PLR1_PKA0_SGROB0_SIA1_SS0_SU0_SUM0_SUS0_SPO0_SRVW0_SSO0_SVW1_SK0_SKFTR0_SKXCCM0_SIP1_SGRO0_TDMI0_TDMS0_TIN0_TT5_8_TLDS0_TLDSMn1_ULSGRO0_USL1_USLMX0_UIOFGRO0_UPLRP0_USFGROn1_USI0_VSn1_VWA1_VWB1_WSGRA0_WSGRB0_WS32_WG8_8_1_WGM4_WGMXCC1_WGMXCCGn1
    SolutionIndex: 72
    SolutionNameMin: Cijk_Ailk_Bljk_S_B_Bias_HA_S_SAV_UserArgs_MT64x32x32_SN_LDSB0_AFC1_AG0_AFEM1_AFEM1_ASEM1_CLR0_CADS0_DTLA0_DTLB0_DTVA0_DTVB0_DTVMXSA0_DTVMXSB0_DTVSM0_DPLB0_EPS0_ELFLR0_EMLLn1_FDSI0_GRPM1_GRVWA1_GRVWB1_GSU1_GSUAMB_GSUC0_GSUWGMRR0_GLS0_ISA1151_IU1_K1_LDSTI0_LBSPPA0_LBSPPB0_LBSPPM0_LPA0_LPB1_LPM0_LRVW1_LWPMn1_MIAV0_MXLIA_MXSFA_MO40_MGRIPM1_NTn1_NTA0_NTB0_NTC0_NTD0_NTM0_NEPBS0_NLCA1_NLCB1_ONLL1_PGR1_PLR1_PKA0_SGROB0_SIA1_SS0_SU0_SUM0_SUS0_SPO0_SRVW0_SSO0_SVW1_SK0_SKFTR0_SKXCCM0_SIP1_SGRO0_TDMI0_TDMS0_TIN0_TT4_4_TLDS0_TLDSMn1_ULSGRO0_USL1_USLMX0_UIOFGRO0_UPLRP0_USFGROn1_USI0_VSn1_VWA1_VWB1_WSGRA0_WSGRB0_WS32_WG16_8_1_WGM4_WGMXCC1_WGMXCCGn1
    SolutionIndex: 73
    SolutionNameMin: Cijk_Ailk_Bljk_S_B_Bias_HA_S_SAV_UserArgs_MT64x32x32_SN_LDSB0_AFC1_AG0_AFEM1_AFEM1_ASEM1_CLR0_CADS0_DTLA0_DTLB0_DTVA0_DTVB0_DTVMXSA0_DTVMXSB0_DTVSM0_DPLB0_EPS0_ELFLR0_EMLLn1_FDSI0_GRPM1_GRVWA1_GRVWB1_GSU1_GSUAMB_GSUC0_GSUWGMRR0_GLS0_ISA1151_IU1_K1_LDSTI0_LBSPPA0_LBSPPB0_LBSPPM0_LPA0_LPB1_LPM0_LRVW1_LWPMn1_MIAV0_MXLIA_MXSFA_MO40_MGRIPM1_NTn1_NTA0_NTB0_NTC0_NTD0_NTM0_NEPBS0_NLCA1_NLCB1_ONLL1_PGR0_PLR1_PKA0_SGROB0_SIA1_SS0_SU0_SUM0_SUS0_SPO0_SRVW0_SSO0_SVW1_SK0_SKFTR0_SKXCCM0_SIP1_SGRO0_TDMI0_TDMS0_TIN0_TT4_4_TLDS0_TLDSMn1_ULSGRO0_USL1_USLMX0_UIOFGRO0_UPLRP0_USFGROn1_USI0_VSn1_VWA1_VWB1_WSGRA0_WSGRB0_WS32_WG16_8_1_WGM4_WGMXCC1_WGMXCCGn1
    SolutionIndex: 74
    SolutionNameMin: Cijk_Ailk_Bljk_S_B_Bias_HA_S_SAV_UserArgs_MT32x16x64_SN_LDSB0_AFC1_AG0_AFEM1_AFEM1_ASEM1_CLR0_CADS0_DTLA0_DTLB0_DTVA0_DTVB0_DTVMXSA0_DTVMXSB0_DTVSM0_DPLB0_EPS0_ELFLR0_EMLLn1_FDSI0_GRPM1_GRVWA1_GRVWB1_GSU1_GSUAMB_GSUC0_GSUWGMRR0_GLS0_ISA1151_IU1_K1_LDSTI0_LBSPPA0_LBSPPB0_LBSPPM0_LPA0_LPB1_LPM0_LRVW1_LWPMn1_MIAV0_MXLIA_MXSFA_MO40_MGRIPM1_NTn1_NTA0_NTB0_NTC0_NTD0_NTM0_NEPBS0_NLCA1_NLCB1_ONLL1_PGR0_PLR1_PKA0_SGROB0_SIA1_SS0_SU8_SUM0_SUS256_SPO0_SRVW0_SSO0_SVW1_SK0_SKFTR0_SKXCCM0_SIP1_SGRO0_TDMI0_TDMS0_TIN0_TT4_2_TLDS0_TLDSMn1_ULSGRO0_USL1_USLMX0_UIOFGRO0_UPLRP0_USFGROn1_USI0_VSn1_VWA1_VWB1_WSGRA0_WSGRB0_WS32_WG8_8_1_WGM1_WGMXCC1_WGMXCCGn1
    SolutionIndex: 75
    SolutionNameMin: Cijk_Ailk_Bljk_S_B_Bias_HA_S_SAV_UserArgs_MT64x32x32_SN_LDSB0_AFC1_AG0_AFEM1_AFEM1_ASEM1_CLR0_CADS0_DTLA0_DTLB0_DTVA0_DTVB0_DTVMXSA0_DTVMXSB0_DTVSM0_DPLB0_EPS0_ELFLR0_EMLLn1_FDSI0_GRPM1_GRVWA1_GRVWB1_GSU1_GSUAMB_GSUC0_GSUWGMRR0_GLS0_ISA1151_IU1_K1_LDSTI0_LBSPPA0_LBSPPB0_LBSPPM0_LPA0_LPB1_LPM0_LRVW1_LWPMn1_MIAV0_MXLIA_MXSFA_MO40_MGRIPM1_NTn1_NTA0_NTB0_NTC0_NTD0_NTM0_NEPBS0_NLCA1_NLCB1_ONLL1_PGR1_PLR1_PKA0_SGROB0_SIA1_SS0_SU8_SUM0_SUS256_SPO0_SRVW0_SSO0_SVW1_SK0_SKFTR0_SKXCCM0_SIP1_SGRO0_TDMI0_TDMS0_TIN0_TT4_4_TLDS0_TLDSMn1_ULSGRO0_USL1_USLMX0_UIOFGRO0_UPLRP0_USFGROn1_USI0_VSn1_VWA1_VWB1_WSGRA0_WSGRB0_WS32_WG16_8_1_WGM4_WGMXCC1_WGMXCCGn1
    SolutionIndex: 76
    SolutionNameMin: Cijk_Ailk_Bljk_S_B_Bias_HA_S_SAV_UserArgs_MT80x64x16_SN_LDSB0_AFC1_AG0_AFEM1_AFEM1_ASEM1_CLR0_CADS0_DTLA0_DTLB0_DTVA0_DTVB0_DTVMXSA0_DTVMXSB0_DTVSM0_DPLB0_EPS0_ELFLR0_EMLLn1_FDSI0_GRPM1_GRVWA1_GRVWB1_GSU1_GSUAMB_GSUC0_GSUWGMRR0_GLS0_ISA1151_IU1_K1_LDSTI0_LBSPPA0_LBSPPB0_LBSPPM0_LPA0_LPB1_LPM0_LRVW1_LWPMn1_MIAV0_MXLIA_MXSFA_MO40_MGRIPM1_NTn1_NTA0_NTB0_NTC0_NTD0_NTM0_NEPBS0_NLCA5_NLCB1_ONLL1_PGR0_PLR1_PKA0_SGROB0_SIA1_SS0_SU8_SUM0_SUS256_SPO0_SRVW0_SSO0_SVW1_SK0_SKFTR0_SKXCCM0_SIP1_SGRO0_TDMI0_TDMS0_TIN0_TT5_8_TLDS0_TLDSMn1_ULSGRO0_USL1_USLMX0_UIOFGRO0_UPLRP0_USFGROn1_USI0_VSn1_VWA1_VWB1_WSGRA0_WSGRB0_WS32_WG16_8_1_WGM1_WGMXCC1_WGMXCCGn1
    SolutionIndex: 77
    SolutionNameMin: Cijk_Ailk_Bljk_S_B_Bias_HA_S_SAV_UserArgs_MT64x32x64_SN_LDSB0_AFC1_AG0_AFEM1_AFEM1_ASEM1_CLR0_CADS0_DTLA0_DTLB0_DTVA0_DTVB0_DTVMXSA0_DTVMXSB0_DTVSM0_DPLB0_EPS0_ELFLR0_EMLLn1_FDSI0_GRPM1_GRVWA1_GRVWB1_GSU1_GSUAMB_GSUC0_GSUWGMRR0_GLS0_ISA1151_IU1_K1_LDSTI0_LBSPPA0_LBSPPB0_LBSPPM0_LPA0_LPB1_LPM0_LRVW1_LWPMn1_MIAV0_MXLIA_MXSFA_MO40_MGRIPM1_NTn1_NTA0_NTB0_NTC0_NTD0_NTM0_NEPBS0_NLCA1_NLCB1_ONLL1_PGR0_PLR1_PKA0_SGROB0_SIA1_SS0_SU0_SUM0_SUS0_SPO0_SRVW0_SSO0_SVW1_SK0_SKFTR0_SKXCCM0_SIP1_SGRO0_TDMI0_TDMS0_TIN0_TT4_4_TLDS0_TLDSMn1_ULSGRO0_USL1_USLMX0_UIOFGRO0_UPLRP0_USFGROn1_USI0_VSn1_VWA1_VWB1_WSGRA0_WSGRB0_WS32_WG16_8_1_WGM4_WGMXCC1_WGMXCCGn1
    SolutionIndex: 78
    SolutionNameMin: Cijk_Ailk_Bljk_S_B_Bias_HA_S_SAV_UserArgs_MT56x64x16_SN_LDSB0_AFC1_AG0_AFEM1_AFEM1_ASEM1_CLR0_CADS0_DTLA0_DTLB0_DTVA0_DTVB0_DTVMXSA0_DTVMXSB0_DTVSM0_DPLB0_EPS0_ELFLR0_EMLLn1_FDSI0_GRPM1_GRVWA1_GRVWB1_GSU1_GSUAMB_GSUC0_GSUWGMRR0_GLS0_ISA1151_IU1_K1_LDSTI0_LBSPPA0_LBSPPB0_LBSPPM0_LPA0_LPB1_LPM0_LRVW1_LWPMn1_MIAV0_MXLIA_MXSFA_MO40_MGRIPM1_NTn1_NTA0_NTB0_NTC0_NTD0_NTM0_NEPBS0_NLCA7_NLCB1_ONLL1_PGR1_PLR1_PKA0_SGROB0_SIA1_SS0_SU8_SUM0_SUS256_SPO0_SRVW0_SSO0_SVW1_SK0_SKFTR0_SKXCCM0_SIP1_SGRO0_TDMI0_TDMS0_TIN0_TT7_8_TLDS0_TLDSMn1_ULSGRO0_USL1_USLMX0_UIOFGRO0_UPLRP0_USFGROn1_USI0_VSn1_VWA1_VWB1_WSGRA0_WSGRB0_WS32_WG8_8_1_WGM1_WGMXCC1_WGMXCCGn1
    SolutionIndex: 79
    SolutionNameMin: Cijk_Ailk_Bljk_S_B_Bias_HA_S_SAV_UserArgs_MT56x64x32_SN_LDSB0_AFC1_AG0_AFEM1_AFEM1_ASEM1_CLR0_CADS0_DTLA0_DTLB0_DTVA0_DTVB0_DTVMXSA0_DTVMXSB0_DTVSM0_DPLB0_EPS0_ELFLR0_EMLLn1_FDSI0_GRPM1_GRVWA1_GRVWB1_GSU1_GSUAMB_GSUC0_GSUWGMRR0_GLS0_ISA1151_IU1_K1_LDSTI0_LBSPPA0_LBSPPB0_LBSPPM0_LPA0_LPB1_LPM0_LRVW1_LWPMn1_MIAV0_MXLIA_MXSFA_MO40_MGRIPM1_NTn1_NTA0_NTB0_NTC0_NTD0_NTM0_NEPBS0_NLCA7_NLCB1_ONLL1_PGR1_PLR1_PKA0_SGROB0_SIA1_SS0_SU0_SUM0_SUS0_SPO0_SRVW0_SSO0_SVW1_SK0_SKFTR0_SKXCCM0_SIP1_SGRO0_TDMI0_TDMS0_TIN0_TT7_8_TLDS0_TLDSMn1_ULSGRO0_USL1_USLMX0_UIOFGRO0_UPLRP0_USFGROn1_USI0_VSn1_VWA1_VWB1_WSGRA0_WSGRB0_WS32_WG8_8_1_WGM4_WGMXCC1_WGMXCCGn1
    SolutionIndex: 80
    SolutionNameMin: Cijk_Ailk_Bljk_S_B_Bias_HA_S_SAV_UserArgs_MT56x64x32_SN_LDSB0_AFC1_AG0_AFEM1_AFEM1_ASEM1_CLR0_CADS0_DTLA0_DTLB0_DTVA0_DTVB0_DTVMXSA0_DTVMXSB0_DTVSM0_DPLB0_EPS0_ELFLR0_EMLLn1_FDSI0_GRPM1_GRVWA1_GRVWB1_GSU1_GSUAMB_GSUC0_GSUWGMRR0_GLS0_ISA1151_IU1_K1_LDSTI0_LBSPPA0_LBSPPB0_LBSPPM0_LPA0_LPB1_LPM0_LRVW1_LWPMn1_MIAV0_MXLIA_MXSFA_MO40_MGRIPM1_NTn1_NTA0_NTB0_NTC0_NTD0_NTM0_NEPBS0_NLCA7_NLCB1_ONLL1_PGR0_PLR1_PKA0_SGROB0_SIA1_SS0_SU8_SUM0_SUS256_SPO0_SRVW0_SSO0_SVW1_SK0_SKFTR0_SKXCCM0_SIP1_SGRO0_TDMI0_TDMS0_TIN0_TT7_8_TLDS0_TLDSMn1_ULSGRO0_USL1_USLMX0_UIOFGRO0_UPLRP0_USFGROn1_USI0_VSn1_VWA1_VWB1_WSGRA0_WSGRB0_WS32_WG8_8_1_WGM4_WGMXCC1_WGMXCCGn1
    SolutionIndex: 81
    SolutionNameMin: Cijk_Ailk_Bljk_S_B_Bias_HA_S_SAV_UserArgs_MT56x64x32_SN_LDSB0_AFC1_AG0_AFEM1_AFEM1_ASEM1_CLR0_CADS0_DTLA0_DTLB0_DTVA0_DTVB0_DTVMXSA0_DTVMXSB0_DTVSM0_DPLB0_EPS0_ELFLR0_EMLLn1_FDSI0_GRPM1_GRVWA1_GRVWB1_GSU1_GSUAMB_GSUC0_GSUWGMRR0_GLS0_ISA1151_IU1_K1_LDSTI0_LBSPPA0_LBSPPB0_LBSPPM0_LPA0_LPB1_LPM0_LRVW1_LWPMn1_MIAV0_MXLIA_MXSFA_MO40_MGRIPM1_NTn1_NTA0_NTB0_NTC0_NTD0_NTM0_NEPBS0_NLCA7_NLCB1_ONLL1_PGR0_PLR1_PKA0_SGROB0_SIA1_SS0_SU8_SUM0_SUS256_SPO0_SRVW0_SSO0_SVW1_SK0_SKFTR0_SKXCCM0_SIP1_SGRO0_TDMI0_TDMS0_TIN0_TT7_8_TLDS0_TLDSMn1_ULSGRO0_USL1_USLMX0_UIOFGRO0_UPLRP0_USFGROn1_USI0_VSn1_VWA1_VWB1_WSGRA0_WSGRB0_WS32_WG8_8_1_WGM1_WGMXCC1_WGMXCCGn1
    SolutionIndex: 82
    SolutionNameMin: Cijk_Ailk_Bljk_S_B_Bias_HA_S_SAV_UserArgs_MT40x64x16_SN_LDSB0_AFC1_AG0_AFEM1_AFEM1_ASEM1_CLR0_CADS0_DTLA0_DTLB0_DTVA0_DTVB0_DTVMXSA0_DTVMXSB0_DTVSM0_DPLB0_EPS0_ELFLR0_EMLLn1_FDSI0_GRPM1_GRVWA1_GRVWB1_GSU1_GSUAMB_GSUC0_GSUWGMRR0_GLS0_ISA1151_IU1_K1_LDSTI0_LBSPPA0_LBSPPB0_LBSPPM0_LPA0_LPB1_LPM0_LRVW1_LWPMn1_MIAV0_MXLIA_MXSFA_MO40_MGRIPM1_NTn1_NTA0_NTB0_NTC0_NTD0_NTM0_NEPBS0_NLCA5_NLCB1_ONLL1_PGR1_PLR1_PKA0_SGROB0_SIA1_SS0_SU8_SUM0_SUS256_SPO0_SRVW0_SSO0_SVW1_SK0_SKFTR0_SKXCCM0_SIP1_SGRO0_TDMI0_TDMS0_TIN0_TT5_8_TLDS0_TLDSMn1_ULSGRO0_USL1_USLMX0_UIOFGRO0_UPLRP0_USFGROn1_USI0_VSn1_VWA1_VWB1_WSGRA0_WSGRB0_WS32_WG8_8_1_WGM4_WGMXCC1_WGMXCCGn1
    SolutionIndex: 83
    SolutionNameMin: Cijk_Ailk_Bljk_S_B_Bias_HA_S_SAV_UserArgs_MT40x64x16_SN_LDSB0_AFC1_AG0_AFEM1_AFEM1_ASEM1_CLR0_CADS0_DTLA0_DTLB0_DTVA0_DTVB0_DTVMXSA0_DTVMXSB0_DTVSM0_DPLB0_EPS0_ELFLR0_EMLLn1_FDSI0_GRPM1_GRVWA1_GRVWB1_GSU1_GSUAMB_GSUC0_GSUWGMRR0_GLS0_ISA1151_IU1_K1_LDSTI0_LBSPPA0_LBSPPB0_LBSPPM0_LPA0_LPB1_LPM0_LRVW1_LWPMn1_MIAV0_MXLIA_MXSFA_MO40_MGRIPM1_NTn1_NTA0_NTB0_NTC0_NTD0_NTM0_NEPBS0_NLCA5_NLCB1_ONLL1_PGR1_PLR1_PKA0_SGROB0_SIA1_SS0_SU0_SUM0_SUS0_SPO0_SRVW0_SSO0_SVW1_SK0_SKFTR0_SKXCCM0_SIP1_SGRO0_TDMI0_TDMS0_TIN0_TT5_8_TLDS0_TLDSMn1_ULSGRO0_USL1_USLMX0_UIOFGRO0_UPLRP0_USFGROn1_USI0_VSn1_VWA1_VWB1_WSGRA0_WSGRB0_WS32_WG8_8_1_WGM4_WGMXCC1_WGMXCCGn1
    SolutionIndex: 84
    SolutionNameMin: Cijk_Ailk_Bljk_S_B_Bias_HA_S_SAV_UserArgs_MT8x8x128_SN_LDSB0_AFC1_AG0_AFEM1_AFEM1_ASEM1_CLR0_CADS0_DTLA0_DTLB0_DTVA0_DTVB0_DTVMXSA0_DTVMXSB0_DTVSM0_DPLB0_EPS0_ELFLR0_EMLLn1_FDSI0_GRPM1_GRVWA1_GRVWB1_GSU1_GSUAMB_GSUC0_GSUWGMRR0_GLS0_ISA1151_IU1_K1_LDSTI0_LBSPPA0_LBSPPB0_LBSPPM0_LPA0_LPB1_LPM0_LRVW1_LWPMn1_MIAV0_MXLIA_MXSFA_MO40_MGRIPM1_NTn1_NTA0_NTB0_NTC0_NTD0_NTM0_NEPBS0_NLCA1_NLCB2_ONLL1_PGR1_PLR1_PKA0_SGROB0_SIA1_SS0_SU0_SUM0_SUS0_SPO0_SRVW0_SSO0_SVW1_SK0_SKFTR0_SKXCCM0_SIP1_SGRO0_TDMI0_TDMS0_TIN0_TT1_1_TLDS0_TLDSMn1_ULSGRO0_USL1_USLMX0_UIOFGRO0_UPLRP0_USFGROn1_USI0_VSn1_VWA1_VWB1_WSGRA0_WSGRB0_WS32_WG8_8_1_WGM1_WGMXCC1_WGMXCCGn1
    SolutionIndex: 85
    SolutionNameMin: Cijk_Ailk_Bljk_S_B_Bias_HA_S_SAV_UserArgs_MT16x8x128_SN_LDSB0_AFC1_AG0_AFEM1_AFEM1_ASEM1_CLR0_CADS0_DTLA0_DTLB0_DTVA0_DTVB0_DTVMXSA0_DTVMXSB0_DTVSM0_DPLB0_EPS1_ELFLR0_EMLLn1_FDSI0_GRPM1_GRVWA1_GRVWB1_GSU1_GSUAMB_GSUC0_GSUWGMRR0_GLS0_ISA1151_IU1_K1_LDSTI0_LBSPPA0_LBSPPB0_LBSPPM0_LPA0_LPB1_LPM0_LRVW1_LWPMn1_MIAV0_MXLIA_MXSFA_MO40_MGRIPM1_NTn1_NTA0_NTB0_NTC0_NTD0_NTM0_NEPBS0_NLCA1_NLCB1_ONLL1_PGR1_PLR1_PKA0_SGROB0_SIA1_SS0_SU0_SUM0_SUS0_SPO0_SRVW0_SSO0_SVW1_SK0_SKFTR0_SKXCCM0_SIP1_SGRO0_TDMI0_TDMS0_TIN0_TT1_1_TLDS0_TLDSMn1_ULSGRO0_USL1_USLMX0_UIOFGRO0_UPLRP0_USFGROn1_USI0_VSn1_VWA1_VWB1_WSGRA0_WSGRB0_WS32_WG16_8_1_WGM1_WGMXCC1_WGMXCCGn1
    SolutionIndex: 86
    SolutionNameMin: Cijk_Ailk_Bljk_S_B_Bias_HA_S_SAV_UserArgs_MT16x16x128_SN_LDSB0_AFC1_AG0_AFEM1_AFEM1_ASEM1_CLR0_CADS0_DTLA0_DTLB0_DTVA0_DTVB0_DTVMXSA0_DTVMXSB0_DTVSM0_DPLB0_EPS0_ELFLR0_EMLLn1_FDSI0_GRPM1_GRVWA1_GRVWB1_GSU1_GSUAMB_GSUC0_GSUWGMRR0_GLS0_ISA1151_IU1_K1_LDSTI0_LBSPPA0_LBSPPB0_LBSPPM0_LPA0_LPB1_LPM0_LRVW1_LWPMn1_MIAV0_MXLIA_MXSFA_MO40_MGRIPM1_NTn1_NTA0_NTB0_NTC0_NTD0_NTM0_NEPBS0_NLCA1_NLCB2_ONLL1_PGR0_PLR1_PKA0_SGROB0_SIA1_SS0_SU0_SUM0_SUS0_SPO0_SRVW0_SSO0_SVW1_SK0_SKFTR0_SKXCCM0_SIP1_SGRO0_TDMI0_TDMS0_TIN0_TT2_2_TLDS0_TLDSMn1_ULSGRO0_USL1_USLMX0_UIOFGRO0_UPLRP0_USFGROn1_USI0_VSn1_VWA1_VWB1_WSGRA0_WSGRB0_WS32_WG8_8_1_WGM1_WGMXCC1_WGMXCCGn1
    SolutionIndex: 87
    SolutionNameMin: Cijk_Ailk_Bljk_S_B_Bias_HA_S_SAV_UserArgs_MT16x16x32_SN_LDSB0_AFC1_AG0_AFEM1_AFEM1_ASEM1_CLR0_CADS0_DTLA0_DTLB0_DTVA0_DTVB0_DTVMXSA0_DTVMXSB0_DTVSM0_DPLB0_EPS0_ELFLR0_EMLLn1_FDSI0_GRPM1_GRVWA1_GRVWB1_GSU1_GSUAMB_GSUC0_GSUWGMRR0_GLS0_ISA1151_IU1_K1_LDSTI0_LBSPPA0_LBSPPB0_LBSPPM0_LPA0_LPB1_LPM0_LRVW1_LWPMn1_MIAV0_MXLIA_MXSFA_MO40_MGRIPM1_NTn1_NTA0_NTB0_NTC0_NTD0_NTM0_NEPBS0_NLCA1_NLCB1_ONLL1_PGR1_PLR1_PKA0_SGROB0_SIA1_SS0_SU8_SUM0_SUS256_SPO0_SRVW0_SSO0_SVW1_SK0_SKFTR0_SKXCCM0_SIP1_SGRO0_TDMI0_TDMS0_TIN0_TT2_2_TLDS0_TLDSMn1_ULSGRO0_USL1_USLMX0_UIOFGRO0_UPLRP0_USFGROn1_USI0_VSn1_VWA1_VWB1_WSGRA0_WSGRB0_WS32_WG8_8_1_WGM1_WGMXCC1_WGMXCCGn1
    SolutionIndex: 88
    SolutionNameMin: Cijk_Ailk_Bljk_S_B_Bias_HA_S_SAV_UserArgs_MT16x8x64_SN_LDSB0_AFC1_AG0_AFEM1_AFEM1_ASEM1_CLR0_CADS0_DTLA0_DTLB0_DTVA0_DTVB0_DTVMXSA0_DTVMXSB0_DTVSM0_DPLB0_EPS0_ELFLR0_EMLLn1_FDSI0_GRPM1_GRVWA1_GRVWB1_GSU1_GSUAMB_GSUC0_GSUWGMRR0_GLS0_ISA1151_IU1_K1_LDSTI0_LBSPPA0_LBSPPB0_LBSPPM0_LPA0_LPB1_LPM0_LRVW1_LWPMn1_MIAV0_MXLIA_MXSFA_MO40_MGRIPM1_NTn1_NTA0_NTB0_NTC0_NTD0_NTM0_NEPBS0_NLCA1_NLCB1_ONLL1_PGR1_PLR1_PKA0_SGROB0_SIA1_SS0_SU8_SUM0_SUS256_SPO0_SRVW0_SSO0_SVW1_SK0_SKFTR0_SKXCCM0_SIP1_SGRO0_TDMI0_TDMS0_TIN0_TT1_1_TLDS0_TLDSMn1_ULSGRO0_USL1_USLMX0_UIOFGRO0_UPLRP0_USFGROn1_USI0_VSn1_VWA1_VWB1_WSGRA0_WSGRB0_WS32_WG16_8_1_WGM1_WGMXCC1_WGMXCCGn1
    SolutionIndex: 89
    SolutionNameMin: Cijk_Ailk_Bljk_S_B_Bias_HA_S_SAV_UserArgs_MT32x32x32_SN_LDSB0_AFC1_AG0_AFEM1_AFEM1_ASEM1_CLR0_CADS0_DTLA0_DTLB0_DTVA0_DTVB0_DTVMXSA0_DTVMXSB0_DTVSM0_DPLB0_EPS0_ELFLR0_EMLLn1_FDSI0_GRPM1_GRVWA1_GRVWB1_GSU1_GSUAMB_GSUC0_GSUWGMRR0_GLS0_ISA1151_IU1_K1_LDSTI0_LBSPPA0_LBSPPB0_LBSPPM0_LPA0_LPB1_LPM0_LRVW1_LWPMn1_MIAV0_MXLIA_MXSFA_MO40_MGRIPM1_NTn1_NTA0_NTB0_NTC0_NTD0_NTM0_NEPBS0_NLCA1_NLCB1_ONLL1_PGR0_PLR1_PKA0_SGROB0_SIA1_SS0_SU8_SUM0_SUS256_SPO0_SRVW0_SSO0_SVW1_SK0_SKFTR0_SKXCCM0_SIP1_SGRO0_TDMI0_TDMS0_TIN0_TT4_4_TLDS0_TLDSMn1_ULSGRO0_USL1_USLMX0_UIOFGRO0_UPLRP0_USFGROn1_USI0_VSn1_VWA1_VWB1_WSGRA0_WSGRB0_WS32_WG8_8_1_WGM1_WGMXCC1_WGMXCCGn1
    SolutionIndex: 90
    SolutionNameMin: Cijk_Ailk_Bljk_S_B_Bias_HA_S_SAV_UserArgs_MT64x16x128_SN_LDSB0_AFC1_AG0_AFEM1_AFEM1_ASEM1_CLR0_CADS0_DTLA0_DTLB0_DTVA0_DTVB0_DTVMXSA0_DTVMXSB0_DTVSM0_DPLB0_EPS0_ELFLR0_EMLLn1_FDSI0_GRPM1_GRVWA1_GRVWB1_GSU1_GSUAMB_GSUC0_GSUWGMRR0_GLS0_ISA1151_IU1_K1_LDSTI0_LBSPPA0_LBSPPB0_LBSPPM0_LPA0_LPB1_LPM0_LRVW1_LWPMn1_MIAV0_MXLIA_MXSFA_MO40_MGRIPM1_NTn1_NTA0_NTB0_NTC0_NTD0_NTM0_NEPBS0_NLCA1_NLCB1_ONLL1_PGR0_PLR1_PKA0_SGROB0_SIA1_SS0_SU0_SUM0_SUS0_SPO0_SRVW0_SSO0_SVW1_SK0_SKFTR0_SKXCCM0_SIP1_SGRO0_TDMI0_TDMS0_TIN0_TT4_2_TLDS0_TLDSMn1_ULSGRO0_USL1_USLMX0_UIOFGRO0_UPLRP0_USFGROn1_USI0_VSn1_VWA1_VWB1_WSGRA0_WSGRB0_WS32_WG16_8_1_WGM1_WGMXCC1_WGMXCCGn1
    SolutionIndex: 91
    SolutionNameMin: Cijk_Ailk_Bljk_S_B_Bias_HA_S_SAV_UserArgs_MT16x8x64_SN_LDSB0_AFC1_AG0_AFEM1_AFEM1_ASEM1_CLR0_CADS0_DTLA0_DTLB0_DTVA0_DTVB0_DTVMXSA0_DTVMXSB0_DTVSM0_DPLB0_EPS0_ELFLR0_EMLLn1_FDSI0_GRPM1_GRVWA1_GRVWB1_GSU1_GSUAMB_GSUC0_GSUWGMRR0_GLS0_ISA1151_IU1_K1_LDSTI0_LBSPPA0_LBSPPB0_LBSPPM0_LPA0_LPB1_LPM0_LRVW1_LWPMn1_MIAV0_MXLIA_MXSFA_MO40_MGRIPM1_NTn1_NTA0_NTB0_NTC0_NTD0_NTM0_NEPBS0_NLCA1_NLCB1_ONLL1_PGR1_PLR1_PKA0_SGROB0_SIA1_SS0_SU0_SUM0_SUS0_SPO0_SRVW0_SSO0_SVW1_SK0_SKFTR0_SKXCCM0_SIP1_SGRO0_TDMI0_TDMS0_TIN0_TT1_1_TLDS0_TLDSMn1_ULSGRO0_USL1_USLMX0_UIOFGRO0_UPLRP0_USFGROn1_USI0_VSn1_VWA1_VWB1_WSGRA0_WSGRB0_WS32_WG16_8_1_WGM1_WGMXCC1_WGMXCCGn1
    SolutionIndex: 92
    SolutionNameMin: Cijk_Ailk_Bljk_S_B_Bias_HA_S_SAV_UserArgs_MT64x32x32_SN_LDSB0_AFC1_AG0_AFEM1_AFEM1_ASEM1_CLR0_CADS0_DTLA0_DTLB0_DTVA0_DTVB0_DTVMXSA0_DTVMXSB0_DTVSM0_DPLB0_EPS0_ELFLR0_EMLLn1_FDSI0_GRPM1_GRVWA1_GRVWB1_GSU1_GSUAMB_GSUC0_GSUWGMRR0_GLS0_ISA1151_IU1_K1_LDSTI0_LBSPPA0_LBSPPB0_LBSPPM0_LPA0_LPB1_LPM0_LRVW1_LWPMn1_MIAV0_MXLIA_MXSFA_MO40_MGRIPM1_NTn1_NTA0_NTB0_NTC0_NTD0_NTM0_NEPBS0_NLCA1_NLCB1_ONLL1_PGR0_PLR1_PKA0_SGROB0_SIA1_SS0_SU8_SUM0_SUS256_SPO0_SRVW0_SSO0_SVW1_SK0_SKFTR0_SKXCCM0_SIP1_SGRO0_TDMI0_TDMS0_TIN0_TT4_4_TLDS0_TLDSMn1_ULSGRO0_USL1_USLMX0_UIOFGRO0_UPLRP0_USFGROn1_USI0_VSn1_VWA1_VWB1_WSGRA0_WSGRB0_WS32_WG16_8_1_WGM1_WGMXCC1_WGMXCCGn1
    SolutionIndex: 93
    SolutionNameMin: Cijk_Ailk_Bljk_S_B_Bias_HA_S_SAV_UserArgs_MT64x32x128_SN_LDSB0_AFC1_AG0_AFEM1_AFEM1_ASEM1_CLR0_CADS0_DTLA0_DTLB0_DTVA0_DTVB0_DTVMXSA0_DTVMXSB0_DTVSM0_DPLB0_EPS0_ELFLR0_EMLLn1_FDSI0_GRPM1_GRVWA1_GRVWB1_GSU1_GSUAMB_GSUC0_GSUWGMRR0_GLS0_ISA1151_IU1_K1_LDSTI0_LBSPPA0_LBSPPB0_LBSPPM0_LPA0_LPB1_LPM0_LRVW1_LWPMn1_MIAV0_MXLIA_MXSFA_MO40_MGRIPM1_NTn1_NTA0_NTB0_NTC0_NTD0_NTM0_NEPBS0_NLCA1_NLCB1_ONLL1_PGR0_PLR1_PKA0_SGROB0_SIA1_SS0_SU8_SUM0_SUS512_SPO0_SRVW0_SSO0_SVW1_SK0_SKFTR0_SKXCCM0_SIP1_SGRO0_TDMI0_TDMS0_TIN0_TT4_4_TLDS0_TLDSMn1_ULSGRO0_USL1_USLMX0_UIOFGRO0_UPLRP0_USFGROn1_USI0_VSn1_VWA1_VWB1_WSGRA0_WSGRB0_WS32_WG16_8_1_WGM1_WGMXCC1_WGMXCCGn1
    SolutionIndex: 94
    SolutionNameMin: Cijk_Ailk_Bljk_S_B_Bias_HA_S_SAV_UserArgs_MT32x16x64_SN_LDSB0_AFC1_AG0_AFEM1_AFEM1_ASEM1_CLR0_CADS0_DTLA0_DTLB0_DTVA0_DTVB0_DTVMXSA0_DTVMXSB0_DTVSM0_DPLB0_EPS1_ELFLR0_EMLLn1_FDSI0_GRPM1_GRVWA1_GRVWB1_GSU1_GSUAMB_GSUC0_GSUWGMRR0_GLS0_ISA1151_IU1_K1_LDSTI0_LBSPPA0_LBSPPB0_LBSPPM0_LPA0_LPB1_LPM0_LRVW1_LWPMn1_MIAV0_MXLIA_MXSFA_MO40_MGRIPM1_NTn1_NTA0_NTB0_NTC0_NTD0_NTM0_NEPBS0_NLCA1_NLCB1_ONLL1_PGR1_PLR1_PKA0_SGROB0_SIA1_SS0_SU8_SUM0_SUS256_SPO0_SRVW0_SSO0_SVW1_SK0_SKFTR0_SKXCCM0_SIP1_SGRO0_TDMI0_TDMS0_TIN0_TT2_2_TLDS0_TLDSMn1_ULSGRO0_USL1_USLMX0_UIOFGRO0_UPLRP0_USFGROn1_USI0_VSn1_VWA1_VWB1_WSGRA0_WSGRB0_WS32_WG16_8_1_WGM1_WGMXCC1_WGMXCCGn1
    SolutionIndex: 95
    SolutionNameMin: Cijk_Ailk_Bljk_S_B_Bias_HA_S_SAV_UserArgs_MT64x32x16_SN_LDSB0_AFC1_AG0_AFEM1_AFEM1_ASEM1_CLR0_CADS0_DTLA0_DTLB0_DTVA0_DTVB0_DTVMXSA0_DTVMXSB0_DTVSM0_DPLB0_EPS0_ELFLR0_EMLLn1_FDSI0_GRPM1_GRVWA1_GRVWB1_GSU1_GSUAMB_GSUC0_GSUWGMRR0_GLS0_ISA1151_IU1_K1_LDSTI0_LBSPPA0_LBSPPB0_LBSPPM0_LPA0_LPB1_LPM0_LRVW1_LWPMn1_MIAV0_MXLIA_MXSFA_MO40_MGRIPM1_NTn1_NTA0_NTB0_NTC0_NTD0_NTM0_NEPBS0_NLCA1_NLCB1_ONLL1_PGR0_PLR1_PKA0_SGROB0_SIA1_SS0_SU0_SUM0_SUS0_SPO0_SRVW0_SSO0_SVW1_SK0_SKFTR0_SKXCCM0_SIP1_SGRO0_TDMI0_TDMS0_TIN0_TT4_4_TLDS0_TLDSMn1_ULSGRO0_USL1_USLMX0_UIOFGRO0_UPLRP0_USFGROn1_USI0_VSn1_VWA1_VWB1_WSGRA0_WSGRB0_WS32_WG16_8_1_WGM1_WGMXCC1_WGMXCCGn1
    SolutionIndex: 96
    SolutionNameMin: Cijk_Ailk_Bljk_S_B_Bias_HA_S_SAV_UserArgs_MT64x32x32_SN_LDSB0_AFC1_AG0_AFEM1_AFEM1_ASEM1_CLR0_CADS0_DTLA0_DTLB0_DTVA0_DTVB0_DTVMXSA0_DTVMXSB0_DTVSM0_DPLB0_EPS0_ELFLR0_EMLLn1_FDSI0_GRPM1_GRVWA1_GRVWB1_GSU1_GSUAMB_GSUC0_GSUWGMRR0_GLS0_ISA1151_IU1_K1_LDSTI0_LBSPPA0_LBSPPB0_LBSPPM0_LPA0_LPB1_LPM0_LRVW1_LWPMn1_MIAV0_MXLIA_MXSFA_MO40_MGRIPM1_NTn1_NTA0_NTB0_NTC0_NTD0_NTM0_NEPBS0_NLCA1_NLCB1_ONLL1_PGR0_PLR1_PKA0_SGROB0_SIA1_SS0_SU0_SUM0_SUS0_SPO0_SRVW0_SSO0_SVW1_SK0_SKFTR0_SKXCCM0_SIP1_SGRO0_TDMI0_TDMS0_TIN0_TT4_4_TLDS0_TLDSMn1_ULSGRO0_USL1_USLMX0_UIOFGRO0_UPLRP0_USFGROn1_USI0_VSn1_VWA1_VWB1_WSGRA0_WSGRB0_WS32_WG16_8_1_WGM1_WGMXCC1_WGMXCCGn1
    SolutionIndex: 97
    SolutionNameMin: Cijk_Ailk_Bljk_S_B_Bias_HA_S_SAV_UserArgs_MT64x32x16_SN_LDSB0_AFC1_AG0_AFEM1_AFEM1_ASEM1_CLR0_CADS0_DTLA0_DTLB0_DTVA0_DTVB0_DTVMXSA0_DTVMXSB0_DTVSM0_DPLB0_EPS1_ELFLR0_EMLLn1_FDSI0_GRPM1_GRVWA1_GRVWB1_GSU1_GSUAMB_GSUC0_GSUWGMRR0_GLS0_ISA1151_IU1_K1_LDSTI0_LBSPPA0_LBSPPB0_LBSPPM0_LPA0_LPB1_LPM0_LRVW1_LWPMn1_MIAV0_MXLIA_MXSFA_MO40_MGRIPM1_NTn1_NTA0_NTB0_NTC0_NTD0_NTM0_NEPBS0_NLCA1_NLCB1_ONLL1_PGR1_PLR1_PKA0_SGROB0_SIA1_SS0_SU0_SUM0_SUS0_SPO0_SRVW0_SSO0_SVW1_SK0_SKFTR0_SKXCCM0_SIP1_SGRO0_TDMI0_TDMS0_TIN0_TT4_4_TLDS0_TLDSMn1_ULSGRO0_USL1_USLMX0_UIOFGRO0_UPLRP0_USFGROn1_USI0_VSn1_VWA1_VWB1_WSGRA0_WSGRB0_WS32_WG16_8_1_WGM1_WGMXCC1_WGMXCCGn1
    SolutionIndex: 98
    SolutionNameMin: Cijk_Ailk_Bljk_S_B_Bias_HA_S_SAV_UserArgs_MT32x16x32_SN_LDSB0_AFC1_AG0_AFEM1_AFEM1_ASEM1_CLR0_CADS0_DTLA0_DTLB0_DTVA0_DTVB0_DTVMXSA0_DTVMXSB0_DTVSM0_DPLB0_EPS0_ELFLR0_EMLLn1_FDSI0_GRPM1_GRVWA1_GRVWB1_GSU1_GSUAMB_GSUC0_GSUWGMRR0_GLS0_ISA1151_IU1_K1_LDSTI0_LBSPPA0_LBSPPB0_LBSPPM0_LPA0_LPB1_LPM0_LRVW1_LWPMn1_MIAV0_MXLIA_MXSFA_MO40_MGRIPM1_NTn1_NTA0_NTB0_NTC0_NTD0_NTM0_NEPBS0_NLCA1_NLCB1_ONLL1_PGR1_PLR1_PKA0_SGROB0_SIA1_SS0_SU0_SUM0_SUS0_SPO0_SRVW0_SSO0_SVW1_SK0_SKFTR0_SKXCCM0_SIP1_SGRO0_TDMI0_TDMS0_TIN0_TT2_2_TLDS0_TLDSMn1_ULSGRO0_USL1_USLMX0_UIOFGRO0_UPLRP0_USFGROn1_USI0_VSn1_VWA1_VWB1_WSGRA0_WSGRB0_WS32_WG16_8_1_WGM1_WGMXCC1_WGMXCCGn1
    SolutionIndex: 99
    SolutionNameMin: Cijk_Ailk_Bljk_S_B_Bias_HA_S_SAV_UserArgs_MT64x32x32_SN_LDSB0_AFC1_AG0_AFEM1_AFEM1_ASEM1_CLR0_CADS0_DTLA0_DTLB0_DTVA0_DTVB0_DTVMXSA0_DTVMXSB0_DTVSM0_DPLB0_EPS1_ELFLR0_EMLLn1_FDSI0_GRPM1_GRVWA1_GRVWB1_GSU1_GSUAMB_GSUC0_GSUWGMRR0_GLS0_ISA1151_IU1_K1_LDSTI0_LBSPPA0_LBSPPB0_LBSPPM0_LPA0_LPB1_LPM0_LRVW1_LWPMn1_MIAV0_MXLIA_MXSFA_MO40_MGRIPM1_NTn1_NTA0_NTB0_NTC0_NTD0_NTM0_NEPBS0_NLCA1_NLCB1_ONLL1_PGR1_PLR1_PKA0_SGROB0_SIA1_SS0_SU8_SUM0_SUS256_SPO0_SRVW0_SSO0_SVW1_SK0_SKFTR0_SKXCCM0_SIP1_SGRO0_TDMI0_TDMS0_TIN0_TT4_4_TLDS0_TLDSMn1_ULSGRO0_USL1_USLMX0_UIOFGRO0_UPLRP0_USFGROn1_USI0_VSn1_VWA1_VWB1_WSGRA0_WSGRB0_WS32_WG16_8_1_WGM1_WGMXCC1_WGMXCCGn1
    SolutionIndex: 100
    SolutionNameMin: Cijk_Ailk_Bljk_S_B_Bias_HA_S_SAV_UserArgs_MT64x16x32_SN_LDSB0_AFC1_AG0_AFEM1_AFEM1_ASEM1_CLR0_CADS0_DTLA0_DTLB0_DTVA0_DTVB0_DTVMXSA0_DTVMXSB0_DTVSM0_DPLB0_EPS0_ELFLR0_EMLLn1_FDSI0_GRPM1_GRVWA1_GRVWB1_GSU1_GSUAMB_GSUC0_GSUWGMRR0_GLS0_ISA1151_IU1_K1_LDSTI0_LBSPPA0_LBSPPB0_LBSPPM0_LPA0_LPB1_LPM0_LRVW1_LWPMn1_MIAV0_MXLIA_MXSFA_MO40_MGRIPM1_NTn1_NTA0_NTB0_NTC0_NTD0_NTM0_NEPBS0_NLCA1_NLCB1_ONLL1_PGR1_PLR1_PKA0_SGROB0_SIA1_SS0_SU0_SUM0_SUS0_SPO0_SRVW0_SSO0_SVW1_SK0_SKFTR0_SKXCCM0_SIP1_SGRO0_TDMI0_TDMS0_TIN0_TT4_2_TLDS0_TLDSMn1_ULSGRO0_USL1_USLMX0_UIOFGRO0_UPLRP0_USFGROn1_USI0_VSn1_VWA1_VWB1_WSGRA0_WSGRB0_WS32_WG16_8_1_WGM1_WGMXCC1_WGMXCCGn1
    SolutionIndex: 101
    SolutionNameMin: Cijk_Ailk_Bljk_S_B_Bias_HA_S_SAV_UserArgs_MT64x32x16_SN_LDSB0_AFC1_AG0_AFEM1_AFEM1_ASEM1_CLR0_CADS0_DTLA0_DTLB0_DTVA0_DTVB0_DTVMXSA0_DTVMXSB0_DTVSM0_DPLB0_EPS1_ELFLR0_EMLLn1_FDSI0_GRPM1_GRVWA1_GRVWB1_GSU1_GSUAMB_GSUC0_GSUWGMRR0_GLS0_ISA1151_IU1_K1_LDSTI0_LBSPPA0_LBSPPB0_LBSPPM0_LPA0_LPB1_LPM0_LRVW1_LWPMn1_MIAV0_MXLIA_MXSFA_MO40_MGRIPM1_NTn1_NTA0_NTB0_NTC0_NTD0_NTM0_NEPBS0_NLCA1_NLCB1_ONLL1_PGR1_PLR1_PKA0_SGROB0_SIA1_SS0_SU8_SUM0_SUS256_SPO0_SRVW0_SSO0_SVW1_SK0_SKFTR0_SKXCCM0_SIP1_SGRO0_TDMI0_TDMS0_TIN0_TT4_4_TLDS0_TLDSMn1_ULSGRO0_USL1_USLMX0_UIOFGRO0_UPLRP0_USFGROn1_USI0_VSn1_VWA1_VWB1_WSGRA0_WSGRB0_WS32_WG16_8_1_WGM1_WGMXCC1_WGMXCCGn1
    SolutionIndex: 102
    SolutionNameMin: Cijk_Ailk_Bljk_S_B_Bias_HA_S_SAV_UserArgs_MT32x16x16_SN_LDSB0_AFC1_AG0_AFEM1_AFEM1_ASEM1_CLR0_CADS0_DTLA0_DTLB0_DTVA0_DTVB0_DTVMXSA0_DTVMXSB0_DTVSM0_DPLB0_EPS0_ELFLR0_EMLLn1_FDSI0_GRPM1_GRVWA1_GRVWB1_GSU1_GSUAMB_GSUC0_GSUWGMRR0_GLS0_ISA1151_IU1_K1_LDSTI0_LBSPPA0_LBSPPB0_LBSPPM0_LPA0_LPB1_LPM0_LRVW1_LWPMn1_MIAV0_MXLIA_MXSFA_MO40_MGRIPM1_NTn1_NTA0_NTB0_NTC0_NTD0_NTM0_NEPBS0_NLCA1_NLCB1_ONLL1_PGR1_PLR1_PKA0_SGROB0_SIA1_SS0_SU8_SUM0_SUS256_SPO0_SRVW0_SSO0_SVW1_SK0_SKFTR0_SKXCCM0_SIP1_SGRO0_TDMI0_TDMS0_TIN0_TT4_2_TLDS0_TLDSMn1_ULSGRO0_USL1_USLMX0_UIOFGRO0_UPLRP0_USFGROn1_USI0_VSn1_VWA1_VWB1_WSGRA0_WSGRB0_WS32_WG8_8_1_WGM1_WGMXCC1_WGMXCCGn1
    SolutionIndex: 103
    SolutionNameMin: Cijk_Ailk_Bljk_S_B_Bias_HA_S_SAV_UserArgs_MT64x16x16_SN_LDSB0_AFC1_AG0_AFEM1_AFEM1_ASEM1_CLR0_CADS0_DTLA0_DTLB0_DTVA0_DTVB0_DTVMXSA0_DTVMXSB0_DTVSM0_DPLB0_EPS0_ELFLR0_EMLLn1_FDSI0_GRPM1_GRVWA1_GRVWB1_GSU1_GSUAMB_GSUC0_GSUWGMRR0_GLS0_ISA1151_IU1_K1_LDSTI0_LBSPPA0_LBSPPB0_LBSPPM0_LPA0_LPB1_LPM0_LRVW1_LWPMn1_MIAV0_MXLIA_MXSFA_MO40_MGRIPM1_NTn1_NTA0_NTB0_NTC0_NTD0_NTM0_NEPBS0_NLCA1_NLCB1_ONLL1_PGR1_PLR1_PKA0_SGROB0_SIA1_SS0_SU0_SUM0_SUS0_SPO0_SRVW0_SSO0_SVW1_SK0_SKFTR0_SKXCCM0_SIP1_SGRO0_TDMI0_TDMS0_TIN0_TT4_2_TLDS0_TLDSMn1_ULSGRO0_USL1_USLMX0_UIOFGRO0_UPLRP0_USFGROn1_USI0_VSn1_VWA1_VWB1_WSGRA0_WSGRB0_WS32_WG16_8_1_WGM1_WGMXCC1_WGMXCCGn1
    SolutionIndex: 104
    SolutionNameMin: Cijk_Ailk_Bljk_S_B_Bias_HA_S_SAV_UserArgs_MT64x16x32_SN_LDSB0_AFC1_AG0_AFEM1_AFEM1_ASEM1_CLR0_CADS0_DTLA0_DTLB0_DTVA0_DTVB0_DTVMXSA0_DTVMXSB0_DTVSM0_DPLB0_EPS0_ELFLR0_EMLLn1_FDSI0_GRPM1_GRVWA1_GRVWB1_GSU1_GSUAMB_GSUC0_GSUWGMRR0_GLS0_ISA1151_IU1_K1_LDSTI0_LBSPPA0_LBSPPB0_LBSPPM0_LPA0_LPB1_LPM0_LRVW1_LWPMn1_MIAV0_MXLIA_MXSFA_MO40_MGRIPM1_NTn1_NTA0_NTB0_NTC0_NTD0_NTM0_NEPBS0_NLCA1_NLCB1_ONLL1_PGR0_PLR1_PKA0_SGROB0_SIA1_SS0_SU0_SUM0_SUS0_SPO0_SRVW0_SSO0_SVW1_SK0_SKFTR0_SKXCCM0_SIP1_SGRO0_TDMI0_TDMS0_TIN0_TT4_2_TLDS0_TLDSMn1_ULSGRO0_USL1_USLMX0_UIOFGRO0_UPLRP0_USFGROn1_USI0_VSn1_VWA1_VWB1_WSGRA0_WSGRB0_WS32_WG16_8_1_WGM1_WGMXCC1_WGMXCCGn1
    SolutionIndex: 105
    SolutionNameMin: Cijk_Ailk_Bljk_S_B_Bias_HA_S_SAV_UserArgs_MT64x32x128_SN_LDSB0_AFC1_AG0_AFEM1_AFEM1_ASEM1_CLR0_CADS0_DTLA0_DTLB0_DTVA0_DTVB0_DTVMXSA0_DTVMXSB0_DTVSM0_DPLB0_EPS0_ELFLR0_EMLLn1_FDSI0_GRPM1_GRVWA1_GRVWB1_GSU1_GSUAMB_GSUC0_GSUWGMRR0_GLS0_ISA1151_IU1_K1_LDSTI0_LBSPPA0_LBSPPB0_LBSPPM0_LPA0_LPB1_LPM0_LRVW1_LWPMn1_MIAV0_MXLIA_MXSFA_MO40_MGRIPM1_NTn1_NTA0_NTB0_NTC0_NTD0_NTM0_NEPBS0_NLCA1_NLCB1_ONLL1_PGR0_PLR1_PKA0_SGROB0_SIA1_SS0_SU0_SUM0_SUS0_SPO0_SRVW0_SSO0_SVW1_SK0_SKFTR0_SKXCCM0_SIP1_SGRO0_TDMI0_TDMS0_TIN0_TT4_4_TLDS0_TLDSMn1_ULSGRO0_USL1_USLMX0_UIOFGRO0_UPLRP0_USFGROn1_USI0_VSn1_VWA1_VWB1_WSGRA0_WSGRB0_WS32_WG16_8_1_WGM1_WGMXCC1_WGMXCCGn1
    SolutionIndex: 106
    SolutionNameMin: Cijk_Ailk_Bljk_S_B_Bias_HA_S_SAV_UserArgs_MT64x16x128_SN_LDSB0_AFC1_AG0_AFEM1_AFEM1_ASEM1_CLR0_CADS0_DTLA0_DTLB0_DTVA0_DTVB0_DTVMXSA0_DTVMXSB0_DTVSM0_DPLB0_EPS0_ELFLR0_EMLLn1_FDSI0_GRPM1_GRVWA1_GRVWB1_GSU1_GSUAMB_GSUC0_GSUWGMRR0_GLS0_ISA1151_IU1_K1_LDSTI0_LBSPPA0_LBSPPB0_LBSPPM0_LPA0_LPB1_LPM0_LRVW1_LWPMn1_MIAV0_MXLIA_MXSFA_MO40_MGRIPM1_NTn1_NTA0_NTB0_NTC0_NTD0_NTM0_NEPBS0_NLCA1_NLCB1_ONLL1_PGR0_PLR1_PKA0_SGROB0_SIA1_SS0_SU0_SUM0_SUS0_SPO0_SRVW0_SSO0_SVW1_SK0_SKFTR0_SKXCCM0_SIP1_SGRO0_TDMI0_TDMS0_TIN0_TT4_2_TLDS0_TLDSMn1_ULSGRO0_USL1_USLMX0_UIOFGRO0_UPLRP0_USFGROn1_USI0_VSn1_VWA1_VWB1_WSGRA0_WSGRB0_WS32_WG16_8_1_WGM2_WGMXCC1_WGMXCCGn1
    SolutionIndex: 107
    SolutionNameMin: Cijk_Ailk_Bljk_S_B_Bias_HA_S_SAV_UserArgs_MT16x8x32_SN_LDSB0_AFC1_AG0_AFEM1_AFEM1_ASEM1_CLR0_CADS0_DTLA0_DTLB0_DTVA0_DTVB0_DTVMXSA0_DTVMXSB0_DTVSM0_DPLB0_EPS0_ELFLR0_EMLLn1_FDSI0_GRPM1_GRVWA1_GRVWB1_GSU1_GSUAMB_GSUC0_GSUWGMRR0_GLS0_ISA1151_IU1_K1_LDSTI0_LBSPPA0_LBSPPB0_LBSPPM0_LPA0_LPB1_LPM0_LRVW1_LWPMn1_MIAV0_MXLIA_MXSFA_MO40_MGRIPM1_NTn1_NTA0_NTB0_NTC0_NTD0_NTM0_NEPBS0_NLCA1_NLCB1_ONLL1_PGR1_PLR1_PKA0_SGROB0_SIA1_SS0_SU0_SUM0_SUS0_SPO0_SRVW0_SSO0_SVW1_SK0_SKFTR0_SKXCCM0_SIP1_SGRO0_TDMI0_TDMS0_TIN0_TT1_1_TLDS0_TLDSMn1_ULSGRO0_USL1_USLMX0_UIOFGRO0_UPLRP0_USFGROn1_USI0_VSn1_VWA1_VWB1_WSGRA0_WSGRB0_WS32_WG16_8_1_WGM1_WGMXCC1_WGMXCCGn1
    SolutionIndex: 108
    SolutionNameMin: Cijk_Ailk_Bljk_S_B_Bias_HA_S_SAV_UserArgs_MT64x16x16_SN_LDSB0_AFC1_AG0_AFEM1_AFEM1_ASEM1_CLR0_CADS0_DTLA0_DTLB0_DTVA0_DTVB0_DTVMXSA0_DTVMXSB0_DTVSM0_DPLB0_EPS0_ELFLR0_EMLLn1_FDSI0_GRPM1_GRVWA1_GRVWB1_GSU1_GSUAMB_GSUC0_GSUWGMRR0_GLS0_ISA1151_IU1_K1_LDSTI0_LBSPPA0_LBSPPB0_LBSPPM0_LPA0_LPB1_LPM0_LRVW1_LWPMn1_MIAV0_MXLIA_MXSFA_MO40_MGRIPM1_NTn1_NTA0_NTB0_NTC0_NTD0_NTM0_NEPBS0_NLCA1_NLCB1_ONLL1_PGR1_PLR1_PKA0_SGROB0_SIA1_SS0_SU8_SUM0_SUS256_SPO0_SRVW0_SSO0_SVW1_SK0_SKFTR0_SKXCCM0_SIP1_SGRO0_TDMI0_TDMS0_TIN0_TT4_2_TLDS0_TLDSMn1_ULSGRO0_USL1_USLMX0_UIOFGRO0_UPLRP0_USFGROn1_USI0_VSn1_VWA1_VWB1_WSGRA0_WSGRB0_WS32_WG16_8_1_WGM1_WGMXCC1_WGMXCCGn1
    SolutionIndex: 109
    SolutionNameMin: Cijk_Ailk_Bljk_S_B_Bias_HA_S_SAV_UserArgs_MT64x16x16_SN_LDSB0_AFC1_AG0_AFEM1_AFEM1_ASEM1_CLR0_CADS0_DTLA0_DTLB0_DTVA0_DTVB0_DTVMXSA0_DTVMXSB0_DTVSM0_DPLB0_EPS0_ELFLR0_EMLLn1_FDSI0_GRPM1_GRVWA1_GRVWB1_GSU1_GSUAMB_GSUC0_GSUWGMRR0_GLS0_ISA1151_IU1_K1_LDSTI0_LBSPPA0_LBSPPB0_LBSPPM0_LPA0_LPB1_LPM0_LRVW1_LWPMn1_MIAV0_MXLIA_MXSFA_MO40_MGRIPM1_NTn1_NTA0_NTB0_NTC0_NTD0_NTM0_NEPBS0_NLCA1_NLCB1_ONLL1_PGR0_PLR1_PKA0_SGROB0_SIA1_SS0_SU8_SUM0_SUS256_SPO0_SRVW0_SSO0_SVW1_SK0_SKFTR0_SKXCCM0_SIP1_SGRO0_TDMI0_TDMS0_TIN0_TT4_2_TLDS0_TLDSMn1_ULSGRO0_USL1_USLMX0_UIOFGRO0_UPLRP0_USFGROn1_USI0_VSn1_VWA1_VWB1_WSGRA0_WSGRB0_WS32_WG16_8_1_WGM1_WGMXCC1_WGMXCCGn1
    SolutionIndex: 110
    SolutionNameMin: Cijk_Ailk_Bljk_S_B_Bias_HA_S_SAV_UserArgs_MT64x16x32_SN_LDSB0_AFC1_AG0_AFEM1_AFEM1_ASEM1_CLR0_CADS0_DTLA0_DTLB0_DTVA0_DTVB0_DTVMXSA0_DTVMXSB0_DTVSM0_DPLB0_EPS0_ELFLR0_EMLLn1_FDSI0_GRPM1_GRVWA1_GRVWB1_GSU1_GSUAMB_GSUC0_GSUWGMRR0_GLS0_ISA1151_IU1_K1_LDSTI0_LBSPPA0_LBSPPB0_LBSPPM0_LPA0_LPB1_LPM0_LRVW1_LWPMn1_MIAV0_MXLIA_MXSFA_MO40_MGRIPM1_NTn1_NTA0_NTB0_NTC0_NTD0_NTM0_NEPBS0_NLCA1_NLCB1_ONLL1_PGR1_PLR1_PKA0_SGROB0_SIA1_SS0_SU0_SUM0_SUS0_SPO0_SRVW0_SSO0_SVW1_SK0_SKFTR0_SKXCCM0_SIP1_SGRO0_TDMI0_TDMS0_TIN0_TT4_2_TLDS0_TLDSMn1_ULSGRO0_USL1_USLMX0_UIOFGRO0_UPLRP0_USFGROn1_USI0_VSn1_VWA1_VWB1_WSGRA0_WSGRB0_WS32_WG16_8_1_WGM2_WGMXCC1_WGMXCCGn1
    SolutionIndex: 111
    SolutionNameMin: Cijk_Ailk_Bljk_S_B_Bias_HA_S_SAV_UserArgs_MT64x16x64_SN_LDSB0_AFC1_AG0_AFEM1_AFEM1_ASEM1_CLR0_CADS0_DTLA0_DTLB0_DTVA0_DTVB0_DTVMXSA0_DTVMXSB0_DTVSM0_DPLB0_EPS0_ELFLR0_EMLLn1_FDSI0_GRPM1_GRVWA1_GRVWB1_GSU1_GSUAMB_GSUC0_GSUWGMRR0_GLS0_ISA1151_IU1_K1_LDSTI0_LBSPPA0_LBSPPB0_LBSPPM0_LPA0_LPB1_LPM0_LRVW1_LWPMn1_MIAV0_MXLIA_MXSFA_MO40_MGRIPM1_NTn1_NTA0_NTB0_NTC0_NTD0_NTM0_NEPBS0_NLCA1_NLCB1_ONLL1_PGR1_PLR1_PKA0_SGROB0_SIA1_SS0_SU0_SUM0_SUS0_SPO0_SRVW0_SSO0_SVW1_SK0_SKFTR0_SKXCCM0_SIP1_SGRO0_TDMI0_TDMS0_TIN0_TT4_2_TLDS0_TLDSMn1_ULSGRO0_USL1_USLMX0_UIOFGRO0_UPLRP0_USFGROn1_USI0_VSn1_VWA1_VWB1_WSGRA0_WSGRB0_WS32_WG16_8_1_WGM4_WGMXCC1_WGMXCCGn1
    SolutionIndex: 112
    SolutionNameMin: Cijk_Ailk_Bljk_S_B_Bias_HA_S_SAV_UserArgs_MT64x16x64_SN_LDSB0_AFC1_AG0_AFEM1_AFEM1_ASEM1_CLR0_CADS0_DTLA0_DTLB0_DTVA0_DTVB0_DTVMXSA0_DTVMXSB0_DTVSM0_DPLB0_EPS0_ELFLR0_EMLLn1_FDSI0_GRPM1_GRVWA1_GRVWB1_GSU1_GSUAMB_GSUC0_GSUWGMRR0_GLS0_ISA1151_IU1_K1_LDSTI0_LBSPPA0_LBSPPB0_LBSPPM0_LPA0_LPB1_LPM0_LRVW1_LWPMn1_MIAV0_MXLIA_MXSFA_MO40_MGRIPM1_NTn1_NTA0_NTB0_NTC0_NTD0_NTM0_NEPBS0_NLCA1_NLCB1_ONLL1_PGR0_PLR1_PKA0_SGROB0_SIA1_SS0_SU0_SUM0_SUS0_SPO0_SRVW0_SSO0_SVW1_SK0_SKFTR0_SKXCCM0_SIP1_SGRO0_TDMI0_TDMS0_TIN0_TT4_2_TLDS0_TLDSMn1_ULSGRO0_USL1_USLMX0_UIOFGRO0_UPLRP0_USFGROn1_USI0_VSn1_VWA1_VWB1_WSGRA0_WSGRB0_WS32_WG16_8_1_WGM4_WGMXCC1_WGMXCCGn1
    SolutionIndex: 113
    SolutionNameMin: Cijk_Ailk_Bljk_S_B_Bias_HA_S_SAV_UserArgs_MT64x16x64_SN_LDSB0_AFC1_AG0_AFEM1_AFEM1_ASEM1_CLR0_CADS0_DTLA0_DTLB0_DTVA0_DTVB0_DTVMXSA0_DTVMXSB0_DTVSM0_DPLB0_EPS0_ELFLR0_EMLLn1_FDSI0_GRPM1_GRVWA1_GRVWB1_GSU1_GSUAMB_GSUC0_GSUWGMRR0_GLS0_ISA1151_IU1_K1_LDSTI0_LBSPPA0_LBSPPB0_LBSPPM0_LPA0_LPB1_LPM0_LRVW1_LWPMn1_MIAV0_MXLIA_MXSFA_MO40_MGRIPM1_NTn1_NTA0_NTB0_NTC0_NTD0_NTM0_NEPBS0_NLCA1_NLCB1_ONLL1_PGR0_PLR1_PKA0_SGROB0_SIA1_SS0_SU8_SUM0_SUS256_SPO0_SRVW0_SSO0_SVW1_SK0_SKFTR0_SKXCCM0_SIP1_SGRO0_TDMI0_TDMS0_TIN0_TT4_2_TLDS0_TLDSMn1_ULSGRO0_USL1_USLMX0_UIOFGRO0_UPLRP0_USFGROn1_USI0_VSn1_VWA1_VWB1_WSGRA0_WSGRB0_WS32_WG16_8_1_WGM4_WGMXCC1_WGMXCCGn1
    SolutionIndex: 114
    SolutionNameMin: Cijk_Ailk_Bljk_S_B_Bias_HA_S_SAV_UserArgs_MT64x32x64_SN_LDSB0_AFC1_AG0_AFEM1_AFEM1_ASEM1_CLR0_CADS0_DTLA0_DTLB0_DTVA0_DTVB0_DTVMXSA0_DTVMXSB0_DTVSM0_DPLB0_EPS0_ELFLR0_EMLLn1_FDSI0_GRPM1_GRVWA1_GRVWB1_GSU1_GSUAMB_GSUC0_GSUWGMRR0_GLS0_ISA1151_IU1_K1_LDSTI0_LBSPPA0_LBSPPB0_LBSPPM0_LPA0_LPB1_LPM0_LRVW1_LWPMn1_MIAV0_MXLIA_MXSFA_MO40_MGRIPM1_NTn1_NTA0_NTB0_NTC0_NTD0_NTM0_NEPBS0_NLCA1_NLCB1_ONLL1_PGR0_PLR1_PKA0_SGROB0_SIA1_SS0_SU8_SUM0_SUS256_SPO0_SRVW0_SSO0_SVW1_SK0_SKFTR0_SKXCCM0_SIP1_SGRO0_TDMI0_TDMS0_TIN0_TT4_4_TLDS0_TLDSMn1_ULSGRO0_USL1_USLMX0_UIOFGRO0_UPLRP0_USFGROn1_USI0_VSn1_VWA1_VWB1_WSGRA0_WSGRB0_WS32_WG16_8_1_WGM4_WGMXCC1_WGMXCCGn1
    SolutionIndex: 115
    SolutionNameMin: Cijk_Ailk_Bljk_S_B_Bias_HA_S_SAV_UserArgs_MT64x32x32_SN_LDSB0_AFC1_AG0_AFEM1_AFEM1_ASEM1_CLR0_CADS0_DTLA0_DTLB0_DTVA0_DTVB0_DTVMXSA0_DTVMXSB0_DTVSM0_DPLB0_EPS0_ELFLR0_EMLLn1_FDSI0_GRPM1_GRVWA1_GRVWB1_GSU1_GSUAMB_GSUC0_GSUWGMRR0_GLS0_ISA1151_IU1_K1_LDSTI0_LBSPPA0_LBSPPB0_LBSPPM0_LPA0_LPB1_LPM0_LRVW1_LWPMn1_MIAV0_MXLIA_MXSFA_MO40_MGRIPM1_NTn1_NTA0_NTB0_NTC0_NTD0_NTM0_NEPBS0_NLCA1_NLCB1_ONLL1_PGR1_PLR1_PKA0_SGROB0_SIA1_SS0_SU0_SUM0_SUS0_SPO0_SRVW0_SSO0_SVW1_SK0_SKFTR0_SKXCCM0_SIP1_SGRO0_TDMI0_TDMS0_TIN0_TT4_4_TLDS0_TLDSMn1_ULSGRO0_USL1_USLMX0_UIOFGRO0_UPLRP0_USFGROn1_USI0_VSn1_VWA1_VWB1_WSGRA0_WSGRB0_WS32_WG16_8_1_WGM1_WGMXCC1_WGMXCCGn1
    SolutionIndex: 116
    SolutionNameMin: Cijk_Ailk_Bljk_S_B_Bias_HA_S_SAV_UserArgs_MT64x32x32_SN_LDSB0_AFC1_AG0_AFEM1_AFEM1_ASEM1_CLR0_CADS0_DTLA0_DTLB0_DTVA0_DTVB0_DTVMXSA0_DTVMXSB0_DTVSM0_DPLB0_EPS0_ELFLR0_EMLLn1_FDSI0_GRPM1_GRVWA1_GRVWB1_GSU1_GSUAMB_GSUC0_GSUWGMRR0_GLS0_ISA1151_IU1_K1_LDSTI0_LBSPPA0_LBSPPB0_LBSPPM0_LPA0_LPB1_LPM0_LRVW1_LWPMn1_MIAV0_MXLIA_MXSFA_MO40_MGRIPM1_NTn1_NTA0_NTB0_NTC0_NTD0_NTM0_NEPBS0_NLCA1_NLCB1_ONLL1_PGR0_PLR1_PKA0_SGROB0_SIA1_SS0_SU8_SUM0_SUS256_SPO0_SRVW0_SSO0_SVW1_SK0_SKFTR0_SKXCCM0_SIP1_SGRO0_TDMI0_TDMS0_TIN0_TT4_4_TLDS0_TLDSMn1_ULSGRO0_USL1_USLMX0_UIOFGRO0_UPLRP0_USFGROn1_USI0_VSn1_VWA1_VWB1_WSGRA0_WSGRB0_WS32_WG16_8_1_WGM4_WGMXCC1_WGMXCCGn1
    SolutionIndex: 117
    SolutionNameMin: Cijk_Ailk_Bljk_S_B_Bias_HA_S_SAV_UserArgs_MT64x16x64_SN_LDSB0_AFC1_AG0_AFEM1_AFEM1_ASEM1_CLR0_CADS0_DTLA0_DTLB0_DTVA0_DTVB0_DTVMXSA0_DTVMXSB0_DTVSM0_DPLB0_EPS0_ELFLR0_EMLLn1_FDSI0_GRPM1_GRVWA1_GRVWB1_GSU1_GSUAMB_GSUC0_GSUWGMRR0_GLS0_ISA1151_IU1_K1_LDSTI0_LBSPPA0_LBSPPB0_LBSPPM0_LPA0_LPB1_LPM0_LRVW1_LWPMn1_MIAV0_MXLIA_MXSFA_MO40_MGRIPM1_NTn1_NTA0_NTB0_NTC0_NTD0_NTM0_NEPBS0_NLCA1_NLCB1_ONLL1_PGR1_PLR1_PKA0_SGROB0_SIA1_SS0_SU8_SUM0_SUS256_SPO0_SRVW0_SSO0_SVW1_SK0_SKFTR0_SKXCCM0_SIP1_SGRO0_TDMI0_TDMS0_TIN0_TT4_2_TLDS0_TLDSMn1_ULSGRO0_USL1_USLMX0_UIOFGRO0_UPLRP0_USFGROn1_USI0_VSn1_VWA1_VWB1_WSGRA0_WSGRB0_WS32_WG16_8_1_WGM1_WGMXCC1_WGMXCCGn1
    SolutionIndex: 118
    SolutionNameMin: Cijk_Ailk_Bljk_S_B_Bias_HA_S_SAV_UserArgs_MT64x16x64_SN_LDSB0_AFC1_AG0_AFEM1_AFEM1_ASEM1_CLR0_CADS0_DTLA0_DTLB0_DTVA0_DTVB0_DTVMXSA0_DTVMXSB0_DTVSM0_DPLB0_EPS0_ELFLR0_EMLLn1_FDSI0_GRPM1_GRVWA1_GRVWB1_GSU1_GSUAMB_GSUC0_GSUWGMRR0_GLS0_ISA1151_IU1_K1_LDSTI0_LBSPPA0_LBSPPB0_LBSPPM0_LPA0_LPB1_LPM0_LRVW1_LWPMn1_MIAV0_MXLIA_MXSFA_MO40_MGRIPM1_NTn1_NTA0_NTB0_NTC0_NTD0_NTM0_NEPBS0_NLCA1_NLCB1_ONLL1_PGR1_PLR1_PKA0_SGROB0_SIA1_SS0_SU8_SUM0_SUS256_SPO0_SRVW0_SSO0_SVW1_SK0_SKFTR0_SKXCCM0_SIP1_SGRO0_TDMI0_TDMS0_TIN0_TT4_2_TLDS0_TLDSMn1_ULSGRO0_USL1_USLMX0_UIOFGRO0_UPLRP0_USFGROn1_USI0_VSn1_VWA1_VWB1_WSGRA0_WSGRB0_WS32_WG16_8_1_WGM4_WGMXCC1_WGMXCCGn1
    SolutionIndex: 119
    SolutionNameMin: Cijk_Ailk_Bljk_S_B_Bias_HA_S_SAV_UserArgs_MT64x16x64_SN_LDSB0_AFC1_AG0_AFEM1_AFEM1_ASEM1_CLR0_CADS0_DTLA0_DTLB0_DTVA0_DTVB0_DTVMXSA0_DTVMXSB0_DTVSM0_DPLB0_EPS0_ELFLR0_EMLLn1_FDSI0_GRPM1_GRVWA1_GRVWB1_GSU1_GSUAMB_GSUC0_GSUWGMRR0_GLS0_ISA1151_IU1_K1_LDSTI0_LBSPPA0_LBSPPB0_LBSPPM0_LPA0_LPB1_LPM0_LRVW1_LWPMn1_MIAV0_MXLIA_MXSFA_MO40_MGRIPM1_NTn1_NTA0_NTB0_NTC0_NTD0_NTM0_NEPBS0_NLCA1_NLCB1_ONLL1_PGR1_PLR1_PKA0_SGROB0_SIA1_SS0_SU0_SUM0_SUS0_SPO0_SRVW0_SSO0_SVW1_SK0_SKFTR0_SKXCCM0_SIP1_SGRO0_TDMI0_TDMS0_TIN0_TT4_2_TLDS0_TLDSMn1_ULSGRO0_USL1_USLMX0_UIOFGRO0_UPLRP0_USFGROn1_USI0_VSn1_VWA1_VWB1_WSGRA0_WSGRB0_WS32_WG16_8_1_WGM2_WGMXCC1_WGMXCCGn1
    SolutionIndex: 120
    SolutionNameMin: Cijk_Ailk_Bljk_S_B_Bias_HA_S_SAV_UserArgs_MT64x16x64_SN_LDSB0_AFC1_AG0_AFEM1_AFEM1_ASEM1_CLR0_CADS0_DTLA0_DTLB0_DTVA0_DTVB0_DTVMXSA0_DTVMXSB0_DTVSM0_DPLB0_EPS0_ELFLR0_EMLLn1_FDSI0_GRPM1_GRVWA1_GRVWB1_GSU1_GSUAMB_GSUC0_GSUWGMRR0_GLS0_ISA1151_IU1_K1_LDSTI0_LBSPPA0_LBSPPB0_LBSPPM0_LPA0_LPB1_LPM0_LRVW1_LWPMn1_MIAV0_MXLIA_MXSFA_MO40_MGRIPM1_NTn1_NTA0_NTB0_NTC0_NTD0_NTM0_NEPBS0_NLCA1_NLCB1_ONLL1_PGR0_PLR1_PKA0_SGROB0_SIA1_SS0_SU8_SUM0_SUS256_SPO0_SRVW0_SSO0_SVW1_SK0_SKFTR0_SKXCCM0_SIP1_SGRO0_TDMI0_TDMS0_TIN0_TT4_2_TLDS0_TLDSMn1_ULSGRO0_USL1_USLMX0_UIOFGRO0_UPLRP0_USFGROn1_USI0_VSn1_VWA1_VWB1_WSGRA0_WSGRB0_WS32_WG16_8_1_WGM2_WGMXCC1_WGMXCCGn1
    SolutionIndex: 121
    SolutionNameMin: Cijk_Ailk_Bljk_S_B_Bias_HA_S_SAV_UserArgs_MT64x32x16_SN_LDSB0_AFC1_AG0_AFEM1_AFEM1_ASEM1_CLR0_CADS0_DTLA0_DTLB0_DTVA0_DTVB0_DTVMXSA0_DTVMXSB0_DTVSM0_DPLB0_EPS0_ELFLR0_EMLLn1_FDSI0_GRPM1_GRVWA1_GRVWB1_GSU1_GSUAMB_GSUC0_GSUWGMRR0_GLS0_ISA1151_IU1_K1_LDSTI0_LBSPPA0_LBSPPB0_LBSPPM0_LPA0_LPB1_LPM0_LRVW1_LWPMn1_MIAV0_MXLIA_MXSFA_MO40_MGRIPM1_NTn1_NTA0_NTB0_NTC0_NTD0_NTM0_NEPBS0_NLCA1_NLCB1_ONLL1_PGR1_PLR1_PKA0_SGROB0_SIA1_SS0_SU8_SUM0_SUS256_SPO0_SRVW0_SSO0_SVW1_SK0_SKFTR0_SKXCCM0_SIP1_SGRO0_TDMI0_TDMS0_TIN0_TT4_4_TLDS0_TLDSMn1_ULSGRO0_USL1_USLMX0_UIOFGRO0_UPLRP0_USFGROn1_USI0_VSn1_VWA1_VWB1_WSGRA0_WSGRB0_WS32_WG16_8_1_WGM4_WGMXCC1_WGMXCCGn1
    SolutionIndex: 122
    SolutionNameMin: Cijk_Ailk_Bljk_S_B_Bias_HA_S_SAV_UserArgs_MT64x32x64_SN_LDSB0_AFC1_AG0_AFEM1_AFEM1_ASEM1_CLR0_CADS0_DTLA0_DTLB0_DTVA0_DTVB0_DTVMXSA0_DTVMXSB0_DTVSM0_DPLB0_EPS0_ELFLR0_EMLLn1_FDSI0_GRPM1_GRVWA1_GRVWB1_GSU1_GSUAMB_GSUC0_GSUWGMRR0_GLS0_ISA1151_IU1_K1_LDSTI0_LBSPPA0_LBSPPB0_LBSPPM0_LPA0_LPB1_LPM0_LRVW1_LWPMn1_MIAV0_MXLIA_MXSFA_MO40_MGRIPM1_NTn1_NTA0_NTB0_NTC0_NTD0_NTM0_NEPBS0_NLCA1_NLCB1_ONLL1_PGR0_PLR1_PKA0_SGROB0_SIA1_SS0_SU8_SUM0_SUS256_SPO0_SRVW0_SSO0_SVW1_SK0_SKFTR0_SKXCCM0_SIP1_SGRO0_TDMI0_TDMS0_TIN0_TT4_4_TLDS0_TLDSMn1_ULSGRO0_USL1_USLMX0_UIOFGRO0_UPLRP0_USFGROn1_USI0_VSn1_VWA1_VWB1_WSGRA0_WSGRB0_WS32_WG16_8_1_WGM2_WGMXCC1_WGMXCCGn1
    SolutionIndex: 123
    SolutionNameMin: Cijk_Ailk_Bljk_S_B_Bias_HA_S_SAV_UserArgs_MT64x16x32_SN_LDSB0_AFC1_AG0_AFEM1_AFEM1_ASEM1_CLR0_CADS0_DTLA0_DTLB0_DTVA0_DTVB0_DTVMXSA0_DTVMXSB0_DTVSM0_DPLB0_EPS0_ELFLR0_EMLLn1_FDSI0_GRPM1_GRVWA1_GRVWB1_GSU1_GSUAMB_GSUC0_GSUWGMRR0_GLS0_ISA1151_IU1_K1_LDSTI0_LBSPPA0_LBSPPB0_LBSPPM0_LPA0_LPB1_LPM0_LRVW1_LWPMn1_MIAV0_MXLIA_MXSFA_MO40_MGRIPM1_NTn1_NTA0_NTB0_NTC0_NTD0_NTM0_NEPBS0_NLCA1_NLCB1_ONLL1_PGR1_PLR1_PKA0_SGROB0_SIA1_SS0_SU0_SUM0_SUS0_SPO0_SRVW0_SSO0_SVW1_SK0_SKFTR0_SKXCCM0_SIP1_SGRO0_TDMI0_TDMS0_TIN0_TT4_2_TLDS0_TLDSMn1_ULSGRO0_USL1_USLMX0_UIOFGRO0_UPLRP0_USFGROn1_USI0_VSn1_VWA1_VWB1_WSGRA0_WSGRB0_WS32_WG16_8_1_WGM4_WGMXCC1_WGMXCCGn1
    SolutionIndex: 124
    SolutionNameMin: Cijk_Ailk_Bljk_S_B_Bias_HA_S_SAV_UserArgs_MT64x16x64_SN_LDSB0_AFC1_AG0_AFEM1_AFEM1_ASEM1_CLR0_CADS0_DTLA0_DTLB0_DTVA0_DTVB0_DTVMXSA0_DTVMXSB0_DTVSM0_DPLB0_EPS0_ELFLR0_EMLLn1_FDSI0_GRPM1_GRVWA1_GRVWB1_GSU1_GSUAMB_GSUC0_GSUWGMRR0_GLS0_ISA1151_IU1_K1_LDSTI0_LBSPPA0_LBSPPB0_LBSPPM0_LPA0_LPB1_LPM0_LRVW1_LWPMn1_MIAV0_MXLIA_MXSFA_MO40_MGRIPM1_NTn1_NTA0_NTB0_NTC0_NTD0_NTM0_NEPBS0_NLCA1_NLCB1_ONLL1_PGR1_PLR1_PKA0_SGROB0_SIA1_SS0_SU8_SUM0_SUS256_SPO0_SRVW0_SSO0_SVW1_SK0_SKFTR0_SKXCCM0_SIP1_SGRO0_TDMI0_TDMS0_TIN0_TT4_2_TLDS0_TLDSMn1_ULSGRO0_USL1_USLMX0_UIOFGRO0_UPLRP0_USFGROn1_USI0_VSn1_VWA1_VWB1_WSGRA0_WSGRB0_WS32_WG16_8_1_WGM2_WGMXCC1_WGMXCCGn1
    SolutionIndex: 125
    SolutionNameMin: Cijk_Ailk_Bljk_S_B_Bias_HA_S_SAV_UserArgs_MT64x32x64_SN_LDSB0_AFC1_AG0_AFEM1_AFEM1_ASEM1_CLR0_CADS0_DTLA0_DTLB0_DTVA0_DTVB0_DTVMXSA0_DTVMXSB0_DTVSM0_DPLB0_EPS0_ELFLR0_EMLLn1_FDSI0_GRPM1_GRVWA1_GRVWB1_GSU1_GSUAMB_GSUC0_GSUWGMRR0_GLS0_ISA1151_IU1_K1_LDSTI0_LBSPPA0_LBSPPB0_LBSPPM0_LPA0_LPB1_LPM0_LRVW1_LWPMn1_MIAV0_MXLIA_MXSFA_MO40_MGRIPM1_NTn1_NTA0_NTB0_NTC0_NTD0_NTM0_NEPBS0_NLCA1_NLCB1_ONLL1_PGR0_PLR1_PKA0_SGROB0_SIA1_SS0_SU0_SUM0_SUS0_SPO0_SRVW0_SSO0_SVW1_SK0_SKFTR0_SKXCCM0_SIP1_SGRO0_TDMI0_TDMS0_TIN0_TT4_4_TLDS0_TLDSMn1_ULSGRO0_USL1_USLMX0_UIOFGRO0_UPLRP0_USFGROn1_USI0_VSn1_VWA1_VWB1_WSGRA0_WSGRB0_WS32_WG16_8_1_WGM2_WGMXCC1_WGMXCCGn1
    SolutionIndex: 126
    SolutionNameMin: Cijk_Ailk_Bljk_S_B_Bias_HA_S_SAV_UserArgs_MT64x16x64_SN_LDSB0_AFC1_AG0_AFEM1_AFEM1_ASEM1_CLR0_CADS0_DTLA0_DTLB0_DTVA0_DTVB0_DTVMXSA0_DTVMXSB0_DTVSM0_DPLB0_EPS0_ELFLR0_EMLLn1_FDSI0_GRPM1_GRVWA1_GRVWB1_GSU1_GSUAMB_GSUC0_GSUWGMRR0_GLS0_ISA1151_IU1_K1_LDSTI0_LBSPPA0_LBSPPB0_LBSPPM0_LPA0_LPB1_LPM0_LRVW1_LWPMn1_MIAV0_MXLIA_MXSFA_MO40_MGRIPM1_NTn1_NTA0_NTB0_NTC0_NTD0_NTM0_NEPBS0_NLCA1_NLCB1_ONLL1_PGR1_PLR1_PKA0_SGROB0_SIA1_SS0_SU0_SUM0_SUS0_SPO0_SRVW0_SSO0_SVW1_SK0_SKFTR0_SKXCCM0_SIP1_SGRO0_TDMI0_TDMS0_TIN0_TT4_2_TLDS0_TLDSMn1_ULSGRO0_USL1_USLMX0_UIOFGRO0_UPLRP0_USFGROn1_USI0_VSn1_VWA1_VWB1_WSGRA0_WSGRB0_WS32_WG16_8_1_WGM1_WGMXCC1_WGMXCCGn1
    SolutionIndex: 127
    SolutionNameMin: Cijk_Ailk_Bljk_S_B_Bias_HA_S_SAV_UserArgs_MT64x16x64_SN_LDSB0_AFC1_AG0_AFEM1_AFEM1_ASEM1_CLR0_CADS0_DTLA0_DTLB0_DTVA0_DTVB0_DTVMXSA0_DTVMXSB0_DTVSM0_DPLB0_EPS0_ELFLR0_EMLLn1_FDSI0_GRPM1_GRVWA1_GRVWB1_GSU1_GSUAMB_GSUC0_GSUWGMRR0_GLS0_ISA1151_IU1_K1_LDSTI0_LBSPPA0_LBSPPB0_LBSPPM0_LPA0_LPB1_LPM0_LRVW1_LWPMn1_MIAV0_MXLIA_MXSFA_MO40_MGRIPM1_NTn1_NTA0_NTB0_NTC0_NTD0_NTM0_NEPBS0_NLCA1_NLCB1_ONLL1_PGR0_PLR1_PKA0_SGROB0_SIA1_SS0_SU8_SUM0_SUS256_SPO0_SRVW0_SSO0_SVW1_SK0_SKFTR0_SKXCCM0_SIP1_SGRO0_TDMI0_TDMS0_TIN0_TT4_2_TLDS0_TLDSMn1_ULSGRO0_USL1_USLMX0_UIOFGRO0_UPLRP0_USFGROn1_USI0_VSn1_VWA1_VWB1_WSGRA0_WSGRB0_WS32_WG16_8_1_WGM1_WGMXCC1_WGMXCCGn1
    SolutionIndex: 128
    SolutionNameMin: Cijk_Ailk_Bljk_S_B_Bias_HA_S_SAV_UserArgs_MT64x32x64_SN_LDSB0_AFC1_AG0_AFEM1_AFEM1_ASEM1_CLR0_CADS0_DTLA0_DTLB0_DTVA0_DTVB0_DTVMXSA0_DTVMXSB0_DTVSM0_DPLB0_EPS0_ELFLR0_EMLLn1_FDSI0_GRPM1_GRVWA1_GRVWB1_GSU1_GSUAMB_GSUC0_GSUWGMRR0_GLS0_ISA1151_IU1_K1_LDSTI0_LBSPPA0_LBSPPB0_LBSPPM0_LPA0_LPB1_LPM0_LRVW1_LWPMn1_MIAV0_MXLIA_MXSFA_MO40_MGRIPM1_NTn1_NTA0_NTB0_NTC0_NTD0_NTM0_NEPBS0_NLCA1_NLCB1_ONLL1_PGR0_PLR1_PKA0_SGROB0_SIA1_SS0_SU0_SUM0_SUS0_SPO0_SRVW0_SSO0_SVW1_SK0_SKFTR0_SKXCCM0_SIP1_SGRO0_TDMI0_TDMS0_TIN0_TT4_4_TLDS0_TLDSMn1_ULSGRO0_USL1_USLMX0_UIOFGRO0_UPLRP0_USFGROn1_USI0_VSn1_VWA1_VWB1_WSGRA0_WSGRB0_WS32_WG16_8_1_WGM1_WGMXCC1_WGMXCCGn1
    SolutionIndex: 129
    SolutionNameMin: Cijk_Ailk_Bljk_S_B_Bias_HA_S_SAV_UserArgs_MT64x32x16_SN_LDSB0_AFC1_AG0_AFEM1_AFEM1_ASEM1_CLR0_CADS0_DTLA0_DTLB0_DTVA0_DTVB0_DTVMXSA0_DTVMXSB0_DTVSM0_DPLB0_EPS0_ELFLR0_EMLLn1_FDSI0_GRPM1_GRVWA1_GRVWB1_GSU1_GSUAMB_GSUC0_GSUWGMRR0_GLS0_ISA1151_IU1_K1_LDSTI0_LBSPPA0_LBSPPB0_LBSPPM0_LPA0_LPB1_LPM0_LRVW1_LWPMn1_MIAV0_MXLIA_MXSFA_MO40_MGRIPM1_NTn1_NTA0_NTB0_NTC0_NTD0_NTM0_NEPBS0_NLCA1_NLCB1_ONLL1_PGR0_PLR1_PKA0_SGROB0_SIA1_SS0_SU8_SUM0_SUS256_SPO0_SRVW0_SSO0_SVW1_SK0_SKFTR0_SKXCCM0_SIP1_SGRO0_TDMI0_TDMS0_TIN0_TT4_4_TLDS0_TLDSMn1_ULSGRO0_USL1_USLMX0_UIOFGRO0_UPLRP0_USFGROn1_USI0_VSn1_VWA1_VWB1_WSGRA0_WSGRB0_WS32_WG16_8_1_WGM1_WGMXCC1_WGMXCCGn1
    SolutionIndex: 130
    SolutionNameMin: Cijk_Ailk_Bljk_S_B_Bias_HA_S_SAV_UserArgs_MT64x32x64_SN_LDSB0_AFC1_AG0_AFEM1_AFEM1_ASEM1_CLR0_CADS0_DTLA0_DTLB0_DTVA0_DTVB0_DTVMXSA0_DTVMXSB0_DTVSM0_DPLB0_EPS0_ELFLR0_EMLLn1_FDSI0_GRPM1_GRVWA1_GRVWB1_GSU1_GSUAMB_GSUC0_GSUWGMRR0_GLS0_ISA1151_IU1_K1_LDSTI0_LBSPPA0_LBSPPB0_LBSPPM0_LPA0_LPB1_LPM0_LRVW1_LWPMn1_MIAV0_MXLIA_MXSFA_MO40_MGRIPM1_NTn1_NTA0_NTB0_NTC0_NTD0_NTM0_NEPBS0_NLCA1_NLCB1_ONLL1_PGR1_PLR1_PKA0_SGROB0_SIA1_SS0_SU0_SUM0_SUS0_SPO0_SRVW0_SSO0_SVW1_SK0_SKFTR0_SKXCCM0_SIP1_SGRO0_TDMI0_TDMS0_TIN0_TT4_4_TLDS0_TLDSMn1_ULSGRO0_USL1_USLMX0_UIOFGRO0_UPLRP0_USFGROn1_USI0_VSn1_VWA1_VWB1_WSGRA0_WSGRB0_WS32_WG16_8_1_WGM4_WGMXCC1_WGMXCCGn1
    SolutionIndex: 131
    SolutionNameMin: Cijk_Ailk_Bljk_S_B_Bias_HA_S_SAV_UserArgs_MT64x32x64_SN_LDSB0_AFC1_AG0_AFEM1_AFEM1_ASEM1_CLR0_CADS0_DTLA0_DTLB0_DTVA0_DTVB0_DTVMXSA0_DTVMXSB0_DTVSM0_DPLB0_EPS0_ELFLR0_EMLLn1_FDSI0_GRPM1_GRVWA1_GRVWB1_GSU1_GSUAMB_GSUC0_GSUWGMRR0_GLS0_ISA1151_IU1_K1_LDSTI0_LBSPPA0_LBSPPB0_LBSPPM0_LPA0_LPB1_LPM0_LRVW1_LWPMn1_MIAV0_MXLIA_MXSFA_MO40_MGRIPM1_NTn1_NTA0_NTB0_NTC0_NTD0_NTM0_NEPBS0_NLCA1_NLCB1_ONLL1_PGR1_PLR1_PKA0_SGROB0_SIA1_SS0_SU0_SUM0_SUS0_SPO0_SRVW0_SSO0_SVW1_SK0_SKFTR0_SKXCCM0_SIP1_SGRO0_TDMI0_TDMS0_TIN0_TT4_4_TLDS0_TLDSMn1_ULSGRO0_USL1_USLMX0_UIOFGRO0_UPLRP0_USFGROn1_USI0_VSn1_VWA1_VWB1_WSGRA0_WSGRB0_WS32_WG16_8_1_WGM1_WGMXCC1_WGMXCCGn1
    SolutionIndex: 132
    SolutionNameMin: Cijk_Ailk_Bljk_S_B_Bias_HA_S_SAV_UserArgs_MT64x16x64_SN_LDSB0_AFC1_AG0_AFEM1_AFEM1_ASEM1_CLR0_CADS0_DTLA0_DTLB0_DTVA0_DTVB0_DTVMXSA0_DTVMXSB0_DTVSM0_DPLB0_EPS0_ELFLR0_EMLLn1_FDSI0_GRPM1_GRVWA1_GRVWB1_GSU1_GSUAMB_GSUC0_GSUWGMRR0_GLS0_ISA1151_IU1_K1_LDSTI0_LBSPPA0_LBSPPB0_LBSPPM0_LPA0_LPB1_LPM0_LRVW1_LWPMn1_MIAV0_MXLIA_MXSFA_MO40_MGRIPM1_NTn1_NTA0_NTB0_NTC0_NTD0_NTM0_NEPBS0_NLCA1_NLCB1_ONLL1_PGR0_PLR1_PKA0_SGROB0_SIA1_SS0_SU0_SUM0_SUS0_SPO0_SRVW0_SSO0_SVW1_SK0_SKFTR0_SKXCCM0_SIP1_SGRO0_TDMI0_TDMS0_TIN0_TT4_2_TLDS0_TLDSMn1_ULSGRO0_USL1_USLMX0_UIOFGRO0_UPLRP0_USFGROn1_USI0_VSn1_VWA1_VWB1_WSGRA0_WSGRB0_WS32_WG16_8_1_WGM2_WGMXCC1_WGMXCCGn1
    SolutionIndex: 133
    SolutionNameMin: Cijk_Ailk_Bljk_S_B_Bias_HA_S_SAV_UserArgs_MT64x16x32_SN_LDSB0_AFC1_AG0_AFEM1_AFEM1_ASEM1_CLR0_CADS0_DTLA0_DTLB0_DTVA0_DTVB0_DTVMXSA0_DTVMXSB0_DTVSM0_DPLB0_EPS0_ELFLR0_EMLLn1_FDSI0_GRPM1_GRVWA1_GRVWB1_GSU1_GSUAMB_GSUC0_GSUWGMRR0_GLS0_ISA1151_IU1_K1_LDSTI0_LBSPPA0_LBSPPB0_LBSPPM0_LPA0_LPB1_LPM0_LRVW1_LWPMn1_MIAV0_MXLIA_MXSFA_MO40_MGRIPM1_NTn1_NTA0_NTB0_NTC0_NTD0_NTM0_NEPBS0_NLCA1_NLCB1_ONLL1_PGR0_PLR1_PKA0_SGROB0_SIA1_SS0_SU8_SUM0_SUS256_SPO0_SRVW0_SSO0_SVW1_SK0_SKFTR0_SKXCCM0_SIP1_SGRO0_TDMI0_TDMS0_TIN0_TT4_2_TLDS0_TLDSMn1_ULSGRO0_USL1_USLMX0_UIOFGRO0_UPLRP0_USFGROn1_USI0_VSn1_VWA1_VWB1_WSGRA0_WSGRB0_WS32_WG16_8_1_WGM4_WGMXCC1_WGMXCCGn1
    SolutionIndex: 134
    SolutionNameMin: Cijk_Ailk_Bljk_S_B_Bias_HA_S_SAV_UserArgs_MT64x16x32_SN_LDSB0_AFC1_AG0_AFEM1_AFEM1_ASEM1_CLR0_CADS0_DTLA0_DTLB0_DTVA0_DTVB0_DTVMXSA0_DTVMXSB0_DTVSM0_DPLB0_EPS0_ELFLR0_EMLLn1_FDSI0_GRPM1_GRVWA1_GRVWB1_GSU1_GSUAMB_GSUC0_GSUWGMRR0_GLS0_ISA1151_IU1_K1_LDSTI0_LBSPPA0_LBSPPB0_LBSPPM0_LPA0_LPB1_LPM0_LRVW1_LWPMn1_MIAV0_MXLIA_MXSFA_MO40_MGRIPM1_NTn1_NTA0_NTB0_NTC0_NTD0_NTM0_NEPBS0_NLCA1_NLCB1_ONLL1_PGR0_PLR1_PKA0_SGROB0_SIA1_SS0_SU8_SUM0_SUS256_SPO0_SRVW0_SSO0_SVW1_SK0_SKFTR0_SKXCCM0_SIP1_SGRO0_TDMI0_TDMS0_TIN0_TT4_2_TLDS0_TLDSMn1_ULSGRO0_USL1_USLMX0_UIOFGRO0_UPLRP0_USFGROn1_USI0_VSn1_VWA1_VWB1_WSGRA0_WSGRB0_WS32_WG16_8_1_WGM2_WGMXCC1_WGMXCCGn1
    SolutionIndex: 135
    SolutionNameMin: Cijk_Ailk_Bljk_S_B_Bias_HA_S_SAV_UserArgs_MT64x32x32_SN_LDSB0_AFC1_AG0_AFEM1_AFEM1_ASEM1_CLR0_CADS0_DTLA0_DTLB0_DTVA0_DTVB0_DTVMXSA0_DTVMXSB0_DTVSM0_DPLB0_EPS0_ELFLR0_EMLLn1_FDSI0_GRPM1_GRVWA1_GRVWB1_GSU1_GSUAMB_GSUC0_GSUWGMRR0_GLS0_ISA1151_IU1_K1_LDSTI0_LBSPPA0_LBSPPB0_LBSPPM0_LPA0_LPB1_LPM0_LRVW1_LWPMn1_MIAV0_MXLIA_MXSFA_MO40_MGRIPM1_NTn1_NTA0_NTB0_NTC0_NTD0_NTM0_NEPBS0_NLCA1_NLCB1_ONLL1_PGR0_PLR1_PKA0_SGROB0_SIA1_SS0_SU8_SUM0_SUS256_SPO0_SRVW0_SSO0_SVW1_SK0_SKFTR0_SKXCCM0_SIP1_SGRO0_TDMI0_TDMS0_TIN0_TT4_4_TLDS0_TLDSMn1_ULSGRO0_USL1_USLMX0_UIOFGRO0_UPLRP0_USFGROn1_USI0_VSn1_VWA1_VWB1_WSGRA0_WSGRB0_WS32_WG16_8_1_WGM2_WGMXCC1_WGMXCCGn1
    SolutionIndex: 136
    SolutionNameMin: Cijk_Ailk_Bljk_S_B_Bias_HA_S_SAV_UserArgs_MT64x16x32_SN_LDSB0_AFC1_AG0_AFEM1_AFEM1_ASEM1_CLR0_CADS0_DTLA0_DTLB0_DTVA0_DTVB0_DTVMXSA0_DTVMXSB0_DTVSM0_DPLB0_EPS0_ELFLR0_EMLLn1_FDSI0_GRPM1_GRVWA1_GRVWB1_GSU1_GSUAMB_GSUC0_GSUWGMRR0_GLS0_ISA1151_IU1_K1_LDSTI0_LBSPPA0_LBSPPB0_LBSPPM0_LPA0_LPB1_LPM0_LRVW1_LWPMn1_MIAV0_MXLIA_MXSFA_MO40_MGRIPM1_NTn1_NTA0_NTB0_NTC0_NTD0_NTM0_NEPBS0_NLCA1_NLCB1_ONLL1_PGR0_PLR1_PKA0_SGROB0_SIA1_SS0_SU0_SUM0_SUS0_SPO0_SRVW0_SSO0_SVW1_SK0_SKFTR0_SKXCCM0_SIP1_SGRO0_TDMI0_TDMS0_TIN0_TT4_2_TLDS0_TLDSMn1_ULSGRO0_USL1_USLMX0_UIOFGRO0_UPLRP0_USFGROn1_USI0_VSn1_VWA1_VWB1_WSGRA0_WSGRB0_WS32_WG16_8_1_WGM4_WGMXCC1_WGMXCCGn1
    SolutionIndex: 137
    SolutionNameMin: Cijk_Ailk_Bljk_S_B_Bias_HA_S_SAV_UserArgs_MT64x32x16_SN_LDSB0_AFC1_AG0_AFEM1_AFEM1_ASEM1_CLR0_CADS0_DTLA0_DTLB0_DTVA0_DTVB0_DTVMXSA0_DTVMXSB0_DTVSM0_DPLB0_EPS0_ELFLR0_EMLLn1_FDSI0_GRPM1_GRVWA1_GRVWB1_GSU1_GSUAMB_GSUC0_GSUWGMRR0_GLS0_ISA1151_IU1_K1_LDSTI0_LBSPPA0_LBSPPB0_LBSPPM0_LPA0_LPB1_LPM0_LRVW1_LWPMn1_MIAV0_MXLIA_MXSFA_MO40_MGRIPM1_NTn1_NTA0_NTB0_NTC0_NTD0_NTM0_NEPBS0_NLCA1_NLCB1_ONLL1_PGR0_PLR1_PKA0_SGROB0_SIA1_SS0_SU0_SUM0_SUS0_SPO0_SRVW0_SSO0_SVW1_SK0_SKFTR0_SKXCCM0_SIP1_SGRO0_TDMI0_TDMS0_TIN0_TT4_4_TLDS0_TLDSMn1_ULSGRO0_USL1_USLMX0_UIOFGRO0_UPLRP0_USFGROn1_USI0_VSn1_VWA1_VWB1_WSGRA0_WSGRB0_WS32_WG16_8_1_WGM4_WGMXCC1_WGMXCCGn1
    SolutionIndex: 138
    SolutionNameMin: Cijk_Ailk_Bljk_S_B_Bias_HA_S_SAV_UserArgs_MT64x16x32_SN_LDSB0_AFC1_AG0_AFEM1_AFEM1_ASEM1_CLR0_CADS0_DTLA0_DTLB0_DTVA0_DTVB0_DTVMXSA0_DTVMXSB0_DTVSM0_DPLB0_EPS0_ELFLR0_EMLLn1_FDSI0_GRPM1_GRVWA1_GRVWB1_GSU1_GSUAMB_GSUC0_GSUWGMRR0_GLS0_ISA1151_IU1_K1_LDSTI0_LBSPPA0_LBSPPB0_LBSPPM0_LPA0_LPB1_LPM0_LRVW1_LWPMn1_MIAV0_MXLIA_MXSFA_MO40_MGRIPM1_NTn1_NTA0_NTB0_NTC0_NTD0_NTM0_NEPBS0_NLCA1_NLCB1_ONLL1_PGR0_PLR1_PKA0_SGROB0_SIA1_SS0_SU0_SUM0_SUS0_SPO0_SRVW0_SSO0_SVW1_SK0_SKFTR0_SKXCCM0_SIP1_SGRO0_TDMI0_TDMS0_TIN0_TT4_2_TLDS0_TLDSMn1_ULSGRO0_USL1_USLMX0_UIOFGRO0_UPLRP0_USFGROn1_USI0_VSn1_VWA1_VWB1_WSGRA0_WSGRB0_WS32_WG16_8_1_WGM2_WGMXCC1_WGMXCCGn1
    SolutionIndex: 139
    SolutionNameMin: Cijk_Ailk_Bljk_S_B_Bias_HA_S_SAV_UserArgs_MT64x32x16_SN_LDSB0_AFC1_AG0_AFEM1_AFEM1_ASEM1_CLR0_CADS0_DTLA0_DTLB0_DTVA0_DTVB0_DTVMXSA0_DTVMXSB0_DTVSM0_DPLB0_EPS0_ELFLR0_EMLLn1_FDSI0_GRPM1_GRVWA1_GRVWB1_GSU1_GSUAMB_GSUC0_GSUWGMRR0_GLS0_ISA1151_IU1_K1_LDSTI0_LBSPPA0_LBSPPB0_LBSPPM0_LPA0_LPB1_LPM0_LRVW1_LWPMn1_MIAV0_MXLIA_MXSFA_MO40_MGRIPM1_NTn1_NTA0_NTB0_NTC0_NTD0_NTM0_NEPBS0_NLCA1_NLCB1_ONLL1_PGR1_PLR1_PKA0_SGROB0_SIA1_SS0_SU8_SUM0_SUS256_SPO0_SRVW0_SSO0_SVW1_SK0_SKFTR0_SKXCCM0_SIP1_SGRO0_TDMI0_TDMS0_TIN0_TT4_4_TLDS0_TLDSMn1_ULSGRO0_USL1_USLMX0_UIOFGRO0_UPLRP0_USFGROn1_USI0_VSn1_VWA1_VWB1_WSGRA0_WSGRB0_WS32_WG16_8_1_WGM1_WGMXCC1_WGMXCCGn1
    SolutionIndex: 140
    SolutionNameMin: Cijk_Ailk_Bljk_S_B_Bias_HA_S_SAV_UserArgs_MT64x32x32_SN_LDSB0_AFC1_AG0_AFEM1_AFEM1_ASEM1_CLR0_CADS0_DTLA0_DTLB0_DTVA0_DTVB0_DTVMXSA0_DTVMXSB0_DTVSM0_DPLB0_EPS0_ELFLR0_EMLLn1_FDSI0_GRPM1_GRVWA1_GRVWB1_GSU1_GSUAMB_GSUC0_GSUWGMRR0_GLS0_ISA1151_IU1_K1_LDSTI0_LBSPPA0_LBSPPB0_LBSPPM0_LPA0_LPB1_LPM0_LRVW1_LWPMn1_MIAV0_MXLIA_MXSFA_MO40_MGRIPM1_NTn1_NTA0_NTB0_NTC0_NTD0_NTM0_NEPBS0_NLCA1_NLCB1_ONLL1_PGR0_PLR1_PKA0_SGROB0_SIA1_SS0_SU0_SUM0_SUS0_SPO0_SRVW0_SSO0_SVW1_SK0_SKFTR0_SKXCCM0_SIP1_SGRO0_TDMI0_TDMS0_TIN0_TT4_4_TLDS0_TLDSMn1_ULSGRO0_USL1_USLMX0_UIOFGRO0_UPLRP0_USFGROn1_USI0_VSn1_VWA1_VWB1_WSGRA0_WSGRB0_WS32_WG16_8_1_WGM2_WGMXCC1_WGMXCCGn1
    SolutionIndex: 141
    SolutionNameMin: Cijk_Ailk_Bljk_S_B_Bias_HA_S_SAV_UserArgs_MT8x8x64_SN_LDSB0_AFC1_AG0_AFEM1_AFEM1_ASEM1_CLR0_CADS0_DTLA0_DTLB0_DTVA0_DTVB0_DTVMXSA0_DTVMXSB0_DTVSM0_DPLB0_EPS0_ELFLR0_EMLLn1_FDSI0_GRPM1_GRVWA1_GRVWB1_GSU1_GSUAMB_GSUC0_GSUWGMRR0_GLS0_ISA1151_IU1_K1_LDSTI0_LBSPPA0_LBSPPB0_LBSPPM0_LPA0_LPB1_LPM0_LRVW1_LWPMn1_MIAV0_MXLIA_MXSFA_MO40_MGRIPM1_NTn1_NTA0_NTB0_NTC0_NTD0_NTM0_NEPBS0_NLCA1_NLCB1_ONLL1_PGR0_PLR1_PKA0_SGROB0_SIA1_SS0_SU0_SUM0_SUS0_SPO0_SRVW0_SSO0_SVW1_SK0_SKFTR0_SKXCCM0_SIP1_SGRO0_TDMI0_TDMS0_TIN0_TT1_1_TLDS0_TLDSMn1_ULSGRO0_USL1_USLMX0_UIOFGRO0_UPLRP0_USFGROn1_USI0_VSn1_VWA1_VWB1_WSGRA0_WSGRB0_WS32_WG8_8_1_WGM4_WGMXCC1_WGMXCCGn1
    SolutionIndex: 142
    SolutionNameMin: Cijk_Ailk_Bljk_S_B_Bias_HA_S_SAV_UserArgs_MT8x8x32_SN_LDSB0_AFC1_AG0_AFEM1_AFEM1_ASEM1_CLR0_CADS0_DTLA0_DTLB0_DTVA0_DTVB0_DTVMXSA0_DTVMXSB0_DTVSM0_DPLB0_EPS0_ELFLR0_EMLLn1_FDSI0_GRPM1_GRVWA1_GRVWB1_GSU1_GSUAMB_GSUC0_GSUWGMRR0_GLS0_ISA1151_IU1_K1_LDSTI0_LBSPPA0_LBSPPB0_LBSPPM0_LPA0_LPB1_LPM0_LRVW1_LWPMn1_MIAV0_MXLIA_MXSFA_MO40_MGRIPM1_NTn1_NTA0_NTB0_NTC0_NTD0_NTM0_NEPBS0_NLCA1_NLCB1_ONLL1_PGR1_PLR1_PKA0_SGROB0_SIA1_SS0_SU0_SUM0_SUS0_SPO0_SRVW0_SSO0_SVW1_SK0_SKFTR0_SKXCCM0_SIP1_SGRO0_TDMI0_TDMS0_TIN0_TT1_1_TLDS0_TLDSMn1_ULSGRO0_USL1_USLMX0_UIOFGRO0_UPLRP0_USFGROn1_USI0_VSn1_VWA1_VWB1_WSGRA0_WSGRB0_WS32_WG8_8_1_WGM1_WGMXCC1_WGMXCCGn1
    SolutionIndex: 143
    SolutionNameMin: Cijk_Ailk_Bljk_S_B_Bias_HA_S_SAV_UserArgs_MT8x8x16_SN_LDSB0_AFC1_AG0_AFEM1_AFEM1_ASEM1_CLR0_CADS0_DTLA0_DTLB0_DTVA0_DTVB0_DTVMXSA0_DTVMXSB0_DTVSM0_DPLB0_EPS0_ELFLR0_EMLLn1_FDSI0_GRPM1_GRVWA1_GRVWB1_GSU1_GSUAMB_GSUC0_GSUWGMRR0_GLS0_ISA1151_IU1_K1_LDSTI0_LBSPPA0_LBSPPB0_LBSPPM0_LPA0_LPB1_LPM0_LRVW1_LWPMn1_MIAV0_MXLIA_MXSFA_MO40_MGRIPM1_NTn1_NTA0_NTB0_NTC0_NTD0_NTM0_NEPBS0_NLCA1_NLCB1_ONLL1_PGR1_PLR1_PKA0_SGROB0_SIA1_SS0_SU0_SUM0_SUS0_SPO0_SRVW0_SSO0_SVW1_SK0_SKFTR0_SKXCCM0_SIP1_SGRO0_TDMI0_TDMS0_TIN0_TT1_1_TLDS0_TLDSMn1_ULSGRO0_USL1_USLMX0_UIOFGRO0_UPLRP0_USFGROn1_USI0_VSn1_VWA1_VWB1_WSGRA0_WSGRB0_WS32_WG8_8_1_WGM2_WGMXCC1_WGMXCCGn1
    SolutionIndex: 144
    SolutionNameMin: Cijk_Ailk_Bljk_S_B_Bias_HA_S_SAV_UserArgs_MT8x8x32_SN_LDSB0_AFC1_AG0_AFEM1_AFEM1_ASEM1_CLR0_CADS0_DTLA0_DTLB0_DTVA0_DTVB0_DTVMXSA0_DTVMXSB0_DTVSM0_DPLB0_EPS0_ELFLR0_EMLLn1_FDSI0_GRPM1_GRVWA1_GRVWB1_GSU1_GSUAMB_GSUC0_GSUWGMRR0_GLS0_ISA1151_IU1_K1_LDSTI0_LBSPPA0_LBSPPB0_LBSPPM0_LPA0_LPB1_LPM0_LRVW1_LWPMn1_MIAV0_MXLIA_MXSFA_MO40_MGRIPM1_NTn1_NTA0_NTB0_NTC0_NTD0_NTM0_NEPBS0_NLCA1_NLCB1_ONLL1_PGR0_PLR1_PKA0_SGROB0_SIA1_SS0_SU0_SUM0_SUS0_SPO0_SRVW0_SSO0_SVW1_SK0_SKFTR0_SKXCCM0_SIP1_SGRO0_TDMI0_TDMS0_TIN0_TT1_1_TLDS0_TLDSMn1_ULSGRO0_USL1_USLMX0_UIOFGRO0_UPLRP0_USFGROn1_USI0_VSn1_VWA1_VWB1_WSGRA0_WSGRB0_WS32_WG8_8_1_WGM2_WGMXCC1_WGMXCCGn1
    SolutionIndex: 145
    SolutionNameMin: Cijk_Ailk_Bljk_S_B_Bias_HA_S_SAV_UserArgs_MT8x8x16_SN_LDSB0_AFC1_AG0_AFEM1_AFEM1_ASEM1_CLR0_CADS0_DTLA0_DTLB0_DTVA0_DTVB0_DTVMXSA0_DTVMXSB0_DTVSM0_DPLB0_EPS0_ELFLR0_EMLLn1_FDSI0_GRPM1_GRVWA1_GRVWB1_GSU1_GSUAMB_GSUC0_GSUWGMRR0_GLS0_ISA1151_IU1_K1_LDSTI0_LBSPPA0_LBSPPB0_LBSPPM0_LPA0_LPB1_LPM0_LRVW1_LWPMn1_MIAV0_MXLIA_MXSFA_MO40_MGRIPM1_NTn1_NTA0_NTB0_NTC0_NTD0_NTM0_NEPBS0_NLCA1_NLCB1_ONLL1_PGR1_PLR1_PKA0_SGROB0_SIA1_SS0_SU8_SUM0_SUS256_SPO0_SRVW0_SSO0_SVW1_SK0_SKFTR0_SKXCCM0_SIP1_SGRO0_TDMI0_TDMS0_TIN0_TT1_1_TLDS0_TLDSMn1_ULSGRO0_USL1_USLMX0_UIOFGRO0_UPLRP0_USFGROn1_USI0_VSn1_VWA1_VWB1_WSGRA0_WSGRB0_WS32_WG8_8_1_WGM1_WGMXCC1_WGMXCCGn1
    SolutionIndex: 146
    SolutionNameMin: Cijk_Ailk_Bljk_S_B_Bias_HA_S_SAV_UserArgs_MT8x8x16_SN_LDSB0_AFC1_AG0_AFEM1_AFEM1_ASEM1_CLR0_CADS0_DTLA0_DTLB0_DTVA0_DTVB0_DTVMXSA0_DTVMXSB0_DTVSM0_DPLB0_EPS0_ELFLR0_EMLLn1_FDSI0_GRPM1_GRVWA1_GRVWB1_GSU1_GSUAMB_GSUC0_GSUWGMRR0_GLS0_ISA1151_IU1_K1_LDSTI0_LBSPPA0_LBSPPB0_LBSPPM0_LPA0_LPB1_LPM0_LRVW1_LWPMn1_MIAV0_MXLIA_MXSFA_MO40_MGRIPM1_NTn1_NTA0_NTB0_NTC0_NTD0_NTM0_NEPBS0_NLCA1_NLCB1_ONLL1_PGR1_PLR1_PKA0_SGROB0_SIA1_SS0_SU0_SUM0_SUS0_SPO0_SRVW0_SSO0_SVW1_SK0_SKFTR0_SKXCCM0_SIP1_SGRO0_TDMI0_TDMS0_TIN0_TT1_1_TLDS0_TLDSMn1_ULSGRO0_USL1_USLMX0_UIOFGRO0_UPLRP0_USFGROn1_USI0_VSn1_VWA1_VWB1_WSGRA0_WSGRB0_WS32_WG8_8_1_WGM4_WGMXCC1_WGMXCCGn1
    SolutionIndex: 147
    SolutionNameMin: Cijk_Ailk_Bljk_S_B_Bias_HA_S_SAV_UserArgs_MT16x16x32_SN_LDSB0_AFC1_AG0_AFEM1_AFEM1_ASEM1_CLR0_CADS0_DTLA0_DTLB0_DTVA0_DTVB0_DTVMXSA0_DTVMXSB0_DTVSM0_DPLB0_EPS0_ELFLR0_EMLLn1_FDSI0_GRPM1_GRVWA1_GRVWB1_GSU1_GSUAMB_GSUC0_GSUWGMRR0_GLS0_ISA1151_IU1_K1_LDSTI0_LBSPPA0_LBSPPB0_LBSPPM0_LPA0_LPB1_LPM0_LRVW1_LWPMn1_MIAV0_MXLIA_MXSFA_MO40_MGRIPM1_NTn1_NTA0_NTB0_NTC0_NTD0_NTM0_NEPBS0_NLCA1_NLCB1_ONLL1_PGR0_PLR1_PKA0_SGROB0_SIA1_SS0_SU8_SUM0_SUS256_SPO0_SRVW0_SSO0_SVW1_SK0_SKFTR0_SKXCCM0_SIP1_SGRO0_TDMI0_TDMS0_TIN0_TT2_2_TLDS0_TLDSMn1_ULSGRO0_USL1_USLMX0_UIOFGRO0_UPLRP0_USFGROn1_USI0_VSn1_VWA1_VWB1_WSGRA0_WSGRB0_WS32_WG8_8_1_WGM1_WGMXCC1_WGMXCCGn1
    SolutionIndex: 148
    SolutionNameMin: Cijk_Ailk_Bljk_S_B_Bias_HA_S_SAV_UserArgs_MT8x8x64_SN_LDSB0_AFC1_AG0_AFEM1_AFEM1_ASEM1_CLR0_CADS0_DTLA0_DTLB0_DTVA0_DTVB0_DTVMXSA0_DTVMXSB0_DTVSM0_DPLB0_EPS1_ELFLR0_EMLLn1_FDSI0_GRPM1_GRVWA1_GRVWB1_GSU1_GSUAMB_GSUC0_GSUWGMRR0_GLS0_ISA1151_IU1_K1_LDSTI0_LBSPPA0_LBSPPB0_LBSPPM0_LPA0_LPB1_LPM0_LRVW1_LWPMn1_MIAV0_MXLIA_MXSFA_MO40_MGRIPM1_NTn1_NTA0_NTB0_NTC0_NTD0_NTM0_NEPBS0_NLCA1_NLCB1_ONLL1_PGR1_PLR1_PKA0_SGROB0_SIA1_SS0_SU0_SUM0_SUS0_SPO0_SRVW0_SSO0_SVW1_SK0_SKFTR0_SKXCCM0_SIP1_SGRO0_TDMI0_TDMS0_TIN0_TT1_1_TLDS0_TLDSMn1_ULSGRO0_USL1_USLMX0_UIOFGRO0_UPLRP0_USFGROn1_USI0_VSn1_VWA1_VWB1_WSGRA0_WSGRB0_WS32_WG8_8_1_WGM1_WGMXCC1_WGMXCCGn1
    SolutionIndex: 149
    SolutionNameMin: Cijk_Ailk_Bljk_S_B_Bias_HA_S_SAV_UserArgs_MT8x8x128_SN_LDSB0_AFC1_AG0_AFEM1_AFEM1_ASEM1_CLR0_CADS0_DTLA0_DTLB0_DTVA0_DTVB0_DTVMXSA0_DTVMXSB0_DTVSM0_DPLB0_EPS0_ELFLR0_EMLLn1_FDSI0_GRPM1_GRVWA1_GRVWB1_GSU1_GSUAMB_GSUC0_GSUWGMRR0_GLS0_ISA1151_IU1_K1_LDSTI0_LBSPPA0_LBSPPB0_LBSPPM0_LPA0_LPB1_LPM0_LRVW1_LWPMn1_MIAV0_MXLIA_MXSFA_MO40_MGRIPM1_NTn1_NTA0_NTB0_NTC0_NTD0_NTM0_NEPBS0_NLCA1_NLCB2_ONLL1_PGR0_PLR1_PKA0_SGROB0_SIA1_SS0_SU0_SUM0_SUS0_SPO0_SRVW0_SSO0_SVW1_SK0_SKFTR0_SKXCCM0_SIP1_SGRO0_TDMI0_TDMS0_TIN0_TT1_1_TLDS0_TLDSMn1_ULSGRO0_USL1_USLMX0_UIOFGRO0_UPLRP0_USFGROn1_USI0_VSn1_VWA1_VWB1_WSGRA0_WSGRB0_WS32_WG8_8_1_WGM1_WGMXCC1_WGMXCCGn1
    SolutionIndex: 150
    SolutionNameMin: Cijk_Ailk_Bljk_S_B_Bias_HA_S_SAV_UserArgs_MT16x16x64_SN_LDSB0_AFC1_AG0_AFEM1_AFEM1_ASEM1_CLR0_CADS0_DTLA0_DTLB0_DTVA0_DTVB0_DTVMXSA0_DTVMXSB0_DTVSM0_DPLB0_EPS1_ELFLR0_EMLLn1_FDSI0_GRPM1_GRVWA1_GRVWB1_GSU1_GSUAMB_GSUC0_GSUWGMRR0_GLS0_ISA1151_IU1_K1_LDSTI0_LBSPPA0_LBSPPB0_LBSPPM0_LPA0_LPB1_LPM0_LRVW1_LWPMn1_MIAV0_MXLIA_MXSFA_MO40_MGRIPM1_NTn1_NTA0_NTB0_NTC0_NTD0_NTM0_NEPBS0_NLCA1_NLCB1_ONLL1_PGR1_PLR1_PKA0_SGROB0_SIA1_SS0_SU0_SUM0_SUS0_SPO0_SRVW0_SSO0_SVW1_SK0_SKFTR0_SKXCCM0_SIP1_SGRO0_TDMI0_TDMS0_TIN0_TT2_2_TLDS0_TLDSMn1_ULSGRO0_USL1_USLMX0_UIOFGRO0_UPLRP0_USFGROn1_USI0_VSn1_VWA1_VWB1_WSGRA0_WSGRB0_WS32_WG8_8_1_WGM1_WGMXCC1_WGMXCCGn1
    SolutionIndex: 151
    SolutionNameMin: Cijk_Ailk_Bljk_S_B_Bias_HA_S_SAV_UserArgs_MT8x8x128_SN_LDSB0_AFC1_AG0_AFEM1_AFEM1_ASEM1_CLR0_CADS0_DTLA0_DTLB0_DTVA0_DTVB0_DTVMXSA0_DTVMXSB0_DTVSM0_DPLB0_EPS1_ELFLR0_EMLLn1_FDSI0_GRPM1_GRVWA1_GRVWB1_GSU1_GSUAMB_GSUC0_GSUWGMRR0_GLS0_ISA1151_IU1_K1_LDSTI0_LBSPPA0_LBSPPB0_LBSPPM0_LPA0_LPB1_LPM0_LRVW1_LWPMn1_MIAV0_MXLIA_MXSFA_MO40_MGRIPM1_NTn1_NTA0_NTB0_NTC0_NTD0_NTM0_NEPBS0_NLCA1_NLCB2_ONLL1_PGR1_PLR1_PKA0_SGROB0_SIA1_SS0_SU0_SUM0_SUS0_SPO0_SRVW0_SSO0_SVW1_SK0_SKFTR0_SKXCCM0_SIP1_SGRO0_TDMI0_TDMS0_TIN0_TT1_1_TLDS0_TLDSMn1_ULSGRO0_USL1_USLMX0_UIOFGRO0_UPLRP0_USFGROn1_USI0_VSn1_VWA1_VWB1_WSGRA0_WSGRB0_WS32_WG8_8_1_WGM4_WGMXCC1_WGMXCCGn1
    SolutionIndex: 152
    SolutionNameMin: Cijk_Ailk_Bljk_S_B_Bias_HA_S_SAV_UserArgs_MT8x8x16_SN_LDSB0_AFC1_AG0_AFEM1_AFEM1_ASEM1_CLR0_CADS0_DTLA0_DTLB0_DTVA0_DTVB0_DTVMXSA0_DTVMXSB0_DTVSM0_DPLB0_EPS1_ELFLR0_EMLLn1_FDSI0_GRPM1_GRVWA1_GRVWB1_GSU1_GSUAMB_GSUC0_GSUWGMRR0_GLS0_ISA1151_IU1_K1_LDSTI0_LBSPPA0_LBSPPB0_LBSPPM0_LPA0_LPB1_LPM0_LRVW1_LWPMn1_MIAV0_MXLIA_MXSFA_MO40_MGRIPM1_NTn1_NTA0_NTB0_NTC0_NTD0_NTM0_NEPBS0_NLCA1_NLCB1_ONLL1_PGR1_PLR1_PKA0_SGROB0_SIA1_SS0_SU0_SUM0_SUS0_SPO0_SRVW0_SSO0_SVW1_SK0_SKFTR0_SKXCCM0_SIP1_SGRO0_TDMI0_TDMS0_TIN0_TT1_1_TLDS0_TLDSMn1_ULSGRO0_USL1_USLMX0_UIOFGRO0_UPLRP0_USFGROn1_USI0_VSn1_VWA1_VWB1_WSGRA0_WSGRB0_WS32_WG8_8_1_WGM1_WGMXCC1_WGMXCCGn1
    SolutionIndex: 153
    SolutionNameMin: Cijk_Ailk_Bljk_S_B_Bias_HA_S_SAV_UserArgs_MT8x8x128_SN_LDSB0_AFC1_AG0_AFEM1_AFEM1_ASEM1_CLR0_CADS0_DTLA0_DTLB0_DTVA0_DTVB0_DTVMXSA0_DTVMXSB0_DTVSM0_DPLB0_EPS1_ELFLR0_EMLLn1_FDSI0_GRPM1_GRVWA1_GRVWB1_GSU1_GSUAMB_GSUC0_GSUWGMRR0_GLS0_ISA1151_IU1_K1_LDSTI0_LBSPPA0_LBSPPB0_LBSPPM0_LPA0_LPB1_LPM0_LRVW1_LWPMn1_MIAV0_MXLIA_MXSFA_MO40_MGRIPM1_NTn1_NTA0_NTB0_NTC0_NTD0_NTM0_NEPBS0_NLCA1_NLCB2_ONLL1_PGR1_PLR1_PKA0_SGROB0_SIA1_SS0_SU8_SUM0_SUS512_SPO0_SRVW0_SSO0_SVW1_SK0_SKFTR0_SKXCCM0_SIP1_SGRO0_TDMI0_TDMS0_TIN0_TT1_1_TLDS0_TLDSMn1_ULSGRO0_USL1_USLMX0_UIOFGRO0_UPLRP0_USFGROn1_USI0_VSn1_VWA1_VWB1_WSGRA0_WSGRB0_WS32_WG8_8_1_WGM1_WGMXCC1_WGMXCCGn1
    SolutionIndex: 154
    SolutionNameMin: Cijk_Ailk_Bljk_S_B_Bias_HA_S_SAV_UserArgs_MT8x8x16_SN_LDSB0_AFC1_AG0_AFEM1_AFEM1_ASEM1_CLR0_CADS0_DTLA0_DTLB0_DTVA0_DTVB0_DTVMXSA0_DTVMXSB0_DTVSM0_DPLB0_EPS0_ELFLR0_EMLLn1_FDSI0_GRPM1_GRVWA1_GRVWB1_GSU1_GSUAMB_GSUC0_GSUWGMRR0_GLS0_ISA1151_IU1_K1_LDSTI0_LBSPPA0_LBSPPB0_LBSPPM0_LPA0_LPB1_LPM0_LRVW1_LWPMn1_MIAV0_MXLIA_MXSFA_MO40_MGRIPM1_NTn1_NTA0_NTB0_NTC0_NTD0_NTM0_NEPBS0_NLCA1_NLCB1_ONLL1_PGR0_PLR1_PKA0_SGROB0_SIA1_SS0_SU0_SUM0_SUS0_SPO0_SRVW0_SSO0_SVW1_SK0_SKFTR0_SKXCCM0_SIP1_SGRO0_TDMI0_TDMS0_TIN0_TT1_1_TLDS0_TLDSMn1_ULSGRO0_USL1_USLMX0_UIOFGRO0_UPLRP0_USFGROn1_USI0_VSn1_VWA1_VWB1_WSGRA0_WSGRB0_WS32_WG8_8_1_WGM1_WGMXCC1_WGMXCCGn1
    SolutionIndex: 155
    SolutionNameMin: Cijk_Ailk_Bljk_S_B_Bias_HA_S_SAV_UserArgs_MT16x16x16_SN_LDSB0_AFC1_AG0_AFEM1_AFEM1_ASEM1_CLR0_CADS0_DTLA0_DTLB0_DTVA0_DTVB0_DTVMXSA0_DTVMXSB0_DTVSM0_DPLB0_EPS0_ELFLR0_EMLLn1_FDSI0_GRPM1_GRVWA1_GRVWB1_GSU1_GSUAMB_GSUC0_GSUWGMRR0_GLS0_ISA1151_IU1_K1_LDSTI0_LBSPPA0_LBSPPB0_LBSPPM0_LPA0_LPB1_LPM0_LRVW1_LWPMn1_MIAV0_MXLIA_MXSFA_MO40_MGRIPM1_NTn1_NTA0_NTB0_NTC0_NTD0_NTM0_NEPBS0_NLCA1_NLCB1_ONLL1_PGR0_PLR1_PKA0_SGROB0_SIA1_SS0_SU8_SUM0_SUS256_SPO0_SRVW0_SSO0_SVW1_SK0_SKFTR0_SKXCCM0_SIP1_SGRO0_TDMI0_TDMS0_TIN0_TT2_2_TLDS0_TLDSMn1_ULSGRO0_USL1_USLMX0_UIOFGRO0_UPLRP0_USFGROn1_USI0_VSn1_VWA1_VWB1_WSGRA0_WSGRB0_WS32_WG8_8_1_WGM1_WGMXCC1_WGMXCCGn1
    SolutionIndex: 156
    SolutionNameMin: Cijk_Ailk_Bljk_S_B_Bias_HA_S_SAV_UserArgs_MT16x16x16_SN_LDSB0_AFC1_AG0_AFEM1_AFEM1_ASEM1_CLR0_CADS0_DTLA0_DTLB0_DTVA0_DTVB0_DTVMXSA0_DTVMXSB0_DTVSM0_DPLB0_EPS0_ELFLR0_EMLLn1_FDSI0_GRPM1_GRVWA1_GRVWB1_GSU1_GSUAMB_GSUC0_GSUWGMRR0_GLS0_ISA1151_IU1_K1_LDSTI0_LBSPPA0_LBSPPB0_LBSPPM0_LPA0_LPB1_LPM0_LRVW1_LWPMn1_MIAV0_MXLIA_MXSFA_MO40_MGRIPM1_NTn1_NTA0_NTB0_NTC0_NTD0_NTM0_NEPBS0_NLCA1_NLCB1_ONLL1_PGR1_PLR1_PKA0_SGROB0_SIA1_SS0_SU0_SUM0_SUS0_SPO0_SRVW0_SSO0_SVW1_SK0_SKFTR0_SKXCCM0_SIP1_SGRO0_TDMI0_TDMS0_TIN0_TT2_2_TLDS0_TLDSMn1_ULSGRO0_USL1_USLMX0_UIOFGRO0_UPLRP0_USFGROn1_USI0_VSn1_VWA1_VWB1_WSGRA0_WSGRB0_WS32_WG8_8_1_WGM1_WGMXCC1_WGMXCCGn1
    SolutionIndex: 157
    SolutionNameMin: Cijk_Ailk_Bljk_S_B_Bias_HA_S_SAV_UserArgs_MT16x16x16_SN_LDSB0_AFC1_AG0_AFEM1_AFEM1_ASEM1_CLR0_CADS0_DTLA0_DTLB0_DTVA0_DTVB0_DTVMXSA0_DTVMXSB0_DTVSM0_DPLB0_EPS0_ELFLR0_EMLLn1_FDSI0_GRPM1_GRVWA1_GRVWB1_GSU1_GSUAMB_GSUC0_GSUWGMRR0_GLS0_ISA1151_IU1_K1_LDSTI0_LBSPPA0_LBSPPB0_LBSPPM0_LPA0_LPB1_LPM0_LRVW1_LWPMn1_MIAV0_MXLIA_MXSFA_MO40_MGRIPM1_NTn1_NTA0_NTB0_NTC0_NTD0_NTM0_NEPBS0_NLCA1_NLCB1_ONLL1_PGR0_PLR1_PKA0_SGROB0_SIA1_SS0_SU0_SUM0_SUS0_SPO0_SRVW0_SSO0_SVW1_SK0_SKFTR0_SKXCCM0_SIP1_SGRO0_TDMI0_TDMS0_TIN0_TT2_2_TLDS0_TLDSMn1_ULSGRO0_USL1_USLMX0_UIOFGRO0_UPLRP0_USFGROn1_USI0_VSn1_VWA1_VWB1_WSGRA0_WSGRB0_WS32_WG8_8_1_WGM1_WGMXCC1_WGMXCCGn1
    SolutionIndex: 158
    SolutionNameMin: Cijk_Ailk_Bljk_S_B_Bias_HA_S_SAV_UserArgs_MT8x8x64_SN_LDSB0_AFC1_AG0_AFEM1_AFEM1_ASEM1_CLR0_CADS0_DTLA0_DTLB0_DTVA0_DTVB0_DTVMXSA0_DTVMXSB0_DTVSM0_DPLB0_EPS0_ELFLR0_EMLLn1_FDSI0_GRPM1_GRVWA1_GRVWB1_GSU1_GSUAMB_GSUC0_GSUWGMRR0_GLS0_ISA1151_IU1_K1_LDSTI0_LBSPPA0_LBSPPB0_LBSPPM0_LPA0_LPB1_LPM0_LRVW1_LWPMn1_MIAV0_MXLIA_MXSFA_MO40_MGRIPM1_NTn1_NTA0_NTB0_NTC0_NTD0_NTM0_NEPBS0_NLCA1_NLCB1_ONLL1_PGR1_PLR1_PKA0_SGROB0_SIA1_SS0_SU0_SUM0_SUS0_SPO0_SRVW0_SSO0_SVW1_SK0_SKFTR0_SKXCCM0_SIP1_SGRO0_TDMI0_TDMS0_TIN0_TT1_1_TLDS0_TLDSMn1_ULSGRO0_USL1_USLMX0_UIOFGRO0_UPLRP0_USFGROn1_USI0_VSn1_VWA1_VWB1_WSGRA0_WSGRB0_WS32_WG8_8_1_WGM1_WGMXCC1_WGMXCCGn1
    SolutionIndex: 159
    SolutionNameMin: Cijk_Ailk_Bljk_S_B_Bias_HA_S_SAV_UserArgs_MT8x8x128_SN_LDSB0_AFC1_AG0_AFEM1_AFEM1_ASEM1_CLR0_CADS0_DTLA0_DTLB0_DTVA0_DTVB0_DTVMXSA0_DTVMXSB0_DTVSM0_DPLB0_EPS0_ELFLR0_EMLLn1_FDSI0_GRPM1_GRVWA1_GRVWB1_GSU1_GSUAMB_GSUC0_GSUWGMRR0_GLS0_ISA1151_IU1_K1_LDSTI0_LBSPPA0_LBSPPB0_LBSPPM0_LPA0_LPB1_LPM0_LRVW1_LWPMn1_MIAV0_MXLIA_MXSFA_MO40_MGRIPM1_NTn1_NTA0_NTB0_NTC0_NTD0_NTM0_NEPBS0_NLCA1_NLCB2_ONLL1_PGR0_PLR1_PKA0_SGROB0_SIA1_SS0_SU8_SUM0_SUS512_SPO0_SRVW0_SSO0_SVW1_SK0_SKFTR0_SKXCCM0_SIP1_SGRO0_TDMI0_TDMS0_TIN0_TT1_1_TLDS0_TLDSMn1_ULSGRO0_USL1_USLMX0_UIOFGRO0_UPLRP0_USFGROn1_USI0_VSn1_VWA1_VWB1_WSGRA0_WSGRB0_WS32_WG8_8_1_WGM4_WGMXCC1_WGMXCCGn1
    SolutionIndex: 160
    SolutionNameMin: Cijk_Ailk_Bljk_S_B_Bias_HA_S_SAV_UserArgs_MT16x16x64_SN_LDSB0_AFC1_AG0_AFEM1_AFEM1_ASEM1_CLR0_CADS0_DTLA0_DTLB0_DTVA0_DTVB0_DTVMXSA0_DTVMXSB0_DTVSM0_DPLB0_EPS1_ELFLR0_EMLLn1_FDSI0_GRPM1_GRVWA1_GRVWB1_GSU1_GSUAMB_GSUC0_GSUWGMRR0_GLS0_ISA1151_IU1_K1_LDSTI0_LBSPPA0_LBSPPB0_LBSPPM0_LPA0_LPB1_LPM0_LRVW1_LWPMn1_MIAV0_MXLIA_MXSFA_MO40_MGRIPM1_NTn1_NTA0_NTB0_NTC0_NTD0_NTM0_NEPBS0_NLCA1_NLCB1_ONLL1_PGR1_PLR1_PKA0_SGROB0_SIA1_SS0_SU8_SUM0_SUS256_SPO0_SRVW0_SSO0_SVW1_SK0_SKFTR0_SKXCCM0_SIP1_SGRO0_TDMI0_TDMS0_TIN0_TT2_2_TLDS0_TLDSMn1_ULSGRO0_USL1_USLMX0_UIOFGRO0_UPLRP0_USFGROn1_USI0_VSn1_VWA1_VWB1_WSGRA0_WSGRB0_WS32_WG8_8_1_WGM1_WGMXCC1_WGMXCCGn1
    SolutionIndex: 161
    SolutionNameMin: Cijk_Ailk_Bljk_S_B_Bias_HA_S_SAV_UserArgs_MT8x8x16_SN_LDSB0_AFC1_AG0_AFEM1_AFEM1_ASEM1_CLR0_CADS0_DTLA0_DTLB0_DTVA0_DTVB0_DTVMXSA0_DTVMXSB0_DTVSM0_DPLB0_EPS0_ELFLR0_EMLLn1_FDSI0_GRPM1_GRVWA1_GRVWB1_GSU1_GSUAMB_GSUC0_GSUWGMRR0_GLS0_ISA1151_IU1_K1_LDSTI0_LBSPPA0_LBSPPB0_LBSPPM0_LPA0_LPB1_LPM0_LRVW1_LWPMn1_MIAV0_MXLIA_MXSFA_MO40_MGRIPM1_NTn1_NTA0_NTB0_NTC0_NTD0_NTM0_NEPBS0_NLCA1_NLCB1_ONLL1_PGR1_PLR1_PKA0_SGROB0_SIA1_SS0_SU0_SUM0_SUS0_SPO0_SRVW0_SSO0_SVW1_SK0_SKFTR0_SKXCCM0_SIP1_SGRO0_TDMI0_TDMS0_TIN0_TT1_1_TLDS0_TLDSMn1_ULSGRO0_USL1_USLMX0_UIOFGRO0_UPLRP0_USFGROn1_USI0_VSn1_VWA1_VWB1_WSGRA0_WSGRB0_WS32_WG8_8_1_WGM1_WGMXCC1_WGMXCCGn1
    SolutionIndex: 162
    SolutionNameMin: Cijk_Ailk_Bljk_S_B_Bias_HA_S_SAV_UserArgs_MT8x8x128_SN_LDSB0_AFC1_AG0_AFEM1_AFEM1_ASEM1_CLR0_CADS0_DTLA0_DTLB0_DTVA0_DTVB0_DTVMXSA0_DTVMXSB0_DTVSM0_DPLB0_EPS0_ELFLR0_EMLLn1_FDSI0_GRPM1_GRVWA1_GRVWB1_GSU1_GSUAMB_GSUC0_GSUWGMRR0_GLS0_ISA1151_IU1_K1_LDSTI0_LBSPPA0_LBSPPB0_LBSPPM0_LPA0_LPB1_LPM0_LRVW1_LWPMn1_MIAV0_MXLIA_MXSFA_MO40_MGRIPM1_NTn1_NTA0_NTB0_NTC0_NTD0_NTM0_NEPBS0_NLCA1_NLCB2_ONLL1_PGR0_PLR1_PKA0_SGROB0_SIA1_SS0_SU8_SUM0_SUS512_SPO0_SRVW0_SSO0_SVW1_SK0_SKFTR0_SKXCCM0_SIP1_SGRO0_TDMI0_TDMS0_TIN0_TT1_1_TLDS0_TLDSMn1_ULSGRO0_USL1_USLMX0_UIOFGRO0_UPLRP0_USFGROn1_USI0_VSn1_VWA1_VWB1_WSGRA0_WSGRB0_WS32_WG8_8_1_WGM1_WGMXCC1_WGMXCCGn1
    SolutionIndex: 163
    SolutionNameMin: Cijk_Ailk_Bljk_S_B_Bias_HA_S_SAV_UserArgs_MT8x8x64_SN_LDSB0_AFC1_AG0_AFEM1_AFEM1_ASEM1_CLR0_CADS0_DTLA0_DTLB0_DTVA0_DTVB0_DTVMXSA0_DTVMXSB0_DTVSM0_DPLB0_EPS0_ELFLR0_EMLLn1_FDSI0_GRPM1_GRVWA1_GRVWB1_GSU1_GSUAMB_GSUC0_GSUWGMRR0_GLS0_ISA1151_IU1_K1_LDSTI0_LBSPPA0_LBSPPB0_LBSPPM0_LPA0_LPB1_LPM0_LRVW1_LWPMn1_MIAV0_MXLIA_MXSFA_MO40_MGRIPM1_NTn1_NTA0_NTB0_NTC0_NTD0_NTM0_NEPBS0_NLCA1_NLCB1_ONLL1_PGR0_PLR1_PKA0_SGROB0_SIA1_SS0_SU8_SUM0_SUS256_SPO0_SRVW0_SSO0_SVW1_SK0_SKFTR0_SKXCCM0_SIP1_SGRO0_TDMI0_TDMS0_TIN0_TT1_1_TLDS0_TLDSMn1_ULSGRO0_USL1_USLMX0_UIOFGRO0_UPLRP0_USFGROn1_USI0_VSn1_VWA1_VWB1_WSGRA0_WSGRB0_WS32_WG8_8_1_WGM1_WGMXCC1_WGMXCCGn1
    SolutionIndex: 164
    SolutionNameMin: Cijk_Ailk_Bljk_S_B_Bias_HA_S_SAV_UserArgs_MT16x16x16_SN_LDSB0_AFC1_AG0_AFEM1_AFEM1_ASEM1_CLR0_CADS0_DTLA0_DTLB0_DTVA0_DTVB0_DTVMXSA0_DTVMXSB0_DTVSM0_DPLB0_EPS0_ELFLR0_EMLLn1_FDSI0_GRPM1_GRVWA1_GRVWB1_GSU1_GSUAMB_GSUC0_GSUWGMRR0_GLS0_ISA1151_IU1_K1_LDSTI0_LBSPPA0_LBSPPB0_LBSPPM0_LPA0_LPB1_LPM0_LRVW1_LWPMn1_MIAV0_MXLIA_MXSFA_MO40_MGRIPM1_NTn1_NTA0_NTB0_NTC0_NTD0_NTM0_NEPBS0_NLCA1_NLCB1_ONLL1_PGR1_PLR1_PKA0_SGROB0_SIA1_SS0_SU8_SUM0_SUS256_SPO0_SRVW0_SSO0_SVW1_SK0_SKFTR0_SKXCCM0_SIP1_SGRO0_TDMI0_TDMS0_TIN0_TT2_2_TLDS0_TLDSMn1_ULSGRO0_USL1_USLMX0_UIOFGRO0_UPLRP0_USFGROn1_USI0_VSn1_VWA1_VWB1_WSGRA0_WSGRB0_WS32_WG8_8_1_WGM1_WGMXCC1_WGMXCCGn1
    SolutionIndex: 165
    SolutionNameMin: Cijk_Ailk_Bljk_S_B_Bias_HA_S_SAV_UserArgs_MT16x16x16_SN_LDSB0_AFC1_AG0_AFEM1_AFEM1_ASEM1_CLR0_CADS0_DTLA0_DTLB0_DTVA0_DTVB0_DTVMXSA0_DTVMXSB0_DTVSM0_DPLB0_EPS1_ELFLR0_EMLLn1_FDSI0_GRPM1_GRVWA1_GRVWB1_GSU1_GSUAMB_GSUC0_GSUWGMRR0_GLS0_ISA1151_IU1_K1_LDSTI0_LBSPPA0_LBSPPB0_LBSPPM0_LPA0_LPB1_LPM0_LRVW1_LWPMn1_MIAV0_MXLIA_MXSFA_MO40_MGRIPM1_NTn1_NTA0_NTB0_NTC0_NTD0_NTM0_NEPBS0_NLCA1_NLCB1_ONLL1_PGR1_PLR1_PKA0_SGROB0_SIA1_SS0_SU8_SUM0_SUS256_SPO0_SRVW0_SSO0_SVW1_SK0_SKFTR0_SKXCCM0_SIP1_SGRO0_TDMI0_TDMS0_TIN0_TT2_2_TLDS0_TLDSMn1_ULSGRO0_USL1_USLMX0_UIOFGRO0_UPLRP0_USFGROn1_USI0_VSn1_VWA1_VWB1_WSGRA0_WSGRB0_WS32_WG8_8_1_WGM1_WGMXCC1_WGMXCCGn1
    SolutionIndex: 166
    SolutionNameMin: Cijk_Ailk_Bljk_S_B_Bias_HA_S_SAV_UserArgs_MT16x16x32_SN_LDSB0_AFC1_AG0_AFEM1_AFEM1_ASEM1_CLR0_CADS0_DTLA0_DTLB0_DTVA0_DTVB0_DTVMXSA0_DTVMXSB0_DTVSM0_DPLB0_EPS1_ELFLR0_EMLLn1_FDSI0_GRPM1_GRVWA1_GRVWB1_GSU1_GSUAMB_GSUC0_GSUWGMRR0_GLS0_ISA1151_IU1_K1_LDSTI0_LBSPPA0_LBSPPB0_LBSPPM0_LPA0_LPB1_LPM0_LRVW1_LWPMn1_MIAV0_MXLIA_MXSFA_MO40_MGRIPM1_NTn1_NTA0_NTB0_NTC0_NTD0_NTM0_NEPBS0_NLCA1_NLCB1_ONLL1_PGR1_PLR1_PKA0_SGROB0_SIA1_SS0_SU0_SUM0_SUS0_SPO0_SRVW0_SSO0_SVW1_SK0_SKFTR0_SKXCCM0_SIP1_SGRO0_TDMI0_TDMS0_TIN0_TT2_2_TLDS0_TLDSMn1_ULSGRO0_USL1_USLMX0_UIOFGRO0_UPLRP0_USFGROn1_USI0_VSn1_VWA1_VWB1_WSGRA0_WSGRB0_WS32_WG8_8_1_WGM1_WGMXCC1_WGMXCCGn1
    SolutionIndex: 167
    SolutionNameMin: Cijk_Ailk_Bljk_S_B_Bias_HA_S_SAV_UserArgs_MT32x16x64_SN_LDSB0_AFC1_AG0_AFEM1_AFEM1_ASEM1_CLR0_CADS0_DTLA0_DTLB0_DTVA0_DTVB0_DTVMXSA0_DTVMXSB0_DTVSM0_DPLB0_EPS1_ELFLR0_EMLLn1_FDSI0_GRPM1_GRVWA1_GRVWB1_GSU1_GSUAMB_GSUC0_GSUWGMRR0_GLS0_ISA1151_IU1_K1_LDSTI0_LBSPPA0_LBSPPB0_LBSPPM0_LPA0_LPB1_LPM0_LRVW1_LWPMn1_MIAV0_MXLIA_MXSFA_MO40_MGRIPM1_NTn1_NTA0_NTB0_NTC0_NTD0_NTM0_NEPBS0_NLCA1_NLCB1_ONLL1_PGR1_PLR1_PKA0_SGROB0_SIA1_SS0_SU0_SUM0_SUS0_SPO0_SRVW0_SSO0_SVW1_SK0_SKFTR0_SKXCCM0_SIP1_SGRO0_TDMI0_TDMS0_TIN0_TT2_2_TLDS0_TLDSMn1_ULSGRO0_USL1_USLMX0_UIOFGRO0_UPLRP0_USFGROn1_USI0_VSn1_VWA1_VWB1_WSGRA0_WSGRB0_WS32_WG16_8_1_WGM1_WGMXCC1_WGMXCCGn1
    SolutionIndex: 168
    SolutionNameMin: Cijk_Ailk_Bljk_S_B_Bias_HA_S_SAV_UserArgs_MT32x16x64_SN_LDSB0_AFC1_AG0_AFEM1_AFEM1_ASEM1_CLR0_CADS0_DTLA0_DTLB0_DTVA0_DTVB0_DTVMXSA0_DTVMXSB0_DTVSM0_DPLB0_EPS0_ELFLR0_EMLLn1_FDSI0_GRPM1_GRVWA1_GRVWB1_GSU1_GSUAMB_GSUC0_GSUWGMRR0_GLS0_ISA1151_IU1_K1_LDSTI0_LBSPPA0_LBSPPB0_LBSPPM0_LPA0_LPB1_LPM0_LRVW1_LWPMn1_MIAV0_MXLIA_MXSFA_MO40_MGRIPM1_NTn1_NTA0_NTB0_NTC0_NTD0_NTM0_NEPBS0_NLCA1_NLCB1_ONLL1_PGR1_PLR1_PKA0_SGROB0_SIA1_SS0_SU8_SUM0_SUS256_SPO0_SRVW0_SSO0_SVW1_SK0_SKFTR0_SKXCCM0_SIP1_SGRO0_TDMI0_TDMS0_TIN0_TT2_2_TLDS0_TLDSMn1_ULSGRO0_USL1_USLMX0_UIOFGRO0_UPLRP0_USFGROn1_USI0_VSn1_VWA1_VWB1_WSGRA0_WSGRB0_WS32_WG16_8_1_WGM1_WGMXCC1_WGMXCCGn1
    SolutionIndex: 169
    SolutionNameMin: Cijk_Ailk_Bljk_S_B_Bias_HA_S_SAV_UserArgs_MT16x16x32_SN_LDSB0_AFC1_AG0_AFEM1_AFEM1_ASEM1_CLR0_CADS0_DTLA0_DTLB0_DTVA0_DTVB0_DTVMXSA0_DTVMXSB0_DTVSM0_DPLB0_EPS0_ELFLR0_EMLLn1_FDSI0_GRPM1_GRVWA1_GRVWB1_GSU1_GSUAMB_GSUC0_GSUWGMRR0_GLS0_ISA1151_IU1_K1_LDSTI0_LBSPPA0_LBSPPB0_LBSPPM0_LPA0_LPB1_LPM0_LRVW1_LWPMn1_MIAV0_MXLIA_MXSFA_MO40_MGRIPM1_NTn1_NTA0_NTB0_NTC0_NTD0_NTM0_NEPBS0_NLCA1_NLCB1_ONLL1_PGR0_PLR1_PKA0_SGROB0_SIA1_SS0_SU0_SUM0_SUS0_SPO0_SRVW0_SSO0_SVW1_SK0_SKFTR0_SKXCCM0_SIP1_SGRO0_TDMI0_TDMS0_TIN0_TT2_2_TLDS0_TLDSMn1_ULSGRO0_USL1_USLMX0_UIOFGRO0_UPLRP0_USFGROn1_USI0_VSn1_VWA1_VWB1_WSGRA0_WSGRB0_WS32_WG8_8_1_WGM1_WGMXCC1_WGMXCCGn1
    SolutionIndex: 170
    SolutionNameMin: Cijk_Ailk_Bljk_S_B_Bias_HA_S_SAV_UserArgs_MT32x16x64_SN_LDSB0_AFC1_AG0_AFEM1_AFEM1_ASEM1_CLR0_CADS0_DTLA0_DTLB0_DTVA0_DTVB0_DTVMXSA0_DTVMXSB0_DTVSM0_DPLB0_EPS0_ELFLR0_EMLLn1_FDSI0_GRPM1_GRVWA1_GRVWB1_GSU1_GSUAMB_GSUC0_GSUWGMRR0_GLS0_ISA1151_IU1_K1_LDSTI0_LBSPPA0_LBSPPB0_LBSPPM0_LPA0_LPB1_LPM0_LRVW1_LWPMn1_MIAV0_MXLIA_MXSFA_MO40_MGRIPM1_NTn1_NTA0_NTB0_NTC0_NTD0_NTM0_NEPBS0_NLCA1_NLCB1_ONLL1_PGR1_PLR1_PKA0_SGROB0_SIA1_SS0_SU0_SUM0_SUS0_SPO0_SRVW0_SSO0_SVW1_SK0_SKFTR0_SKXCCM0_SIP1_SGRO0_TDMI0_TDMS0_TIN0_TT2_2_TLDS0_TLDSMn1_ULSGRO0_USL1_USLMX0_UIOFGRO0_UPLRP0_USFGROn1_USI0_VSn1_VWA1_VWB1_WSGRA0_WSGRB0_WS32_WG16_8_1_WGM1_WGMXCC1_WGMXCCGn1
    SolutionIndex: 171
    SolutionNameMin: Cijk_Ailk_Bljk_S_B_Bias_HA_S_SAV_UserArgs_MT32x16x16_SN_LDSB0_AFC1_AG0_AFEM1_AFEM1_ASEM1_CLR0_CADS0_DTLA0_DTLB0_DTVA0_DTVB0_DTVMXSA0_DTVMXSB0_DTVSM0_DPLB0_EPS0_ELFLR0_EMLLn1_FDSI0_GRPM1_GRVWA1_GRVWB1_GSU1_GSUAMB_GSUC0_GSUWGMRR0_GLS0_ISA1151_IU1_K1_LDSTI0_LBSPPA0_LBSPPB0_LBSPPM0_LPA0_LPB1_LPM0_LRVW1_LWPMn1_MIAV0_MXLIA_MXSFA_MO40_MGRIPM1_NTn1_NTA0_NTB0_NTC0_NTD0_NTM0_NEPBS0_NLCA1_NLCB1_ONLL1_PGR0_PLR1_PKA0_SGROB0_SIA1_SS0_SU0_SUM0_SUS0_SPO0_SRVW0_SSO0_SVW1_SK0_SKFTR0_SKXCCM0_SIP1_SGRO0_TDMI0_TDMS0_TIN0_TT2_2_TLDS0_TLDSMn1_ULSGRO0_USL1_USLMX0_UIOFGRO0_UPLRP0_USFGROn1_USI0_VSn1_VWA1_VWB1_WSGRA0_WSGRB0_WS32_WG16_8_1_WGM1_WGMXCC1_WGMXCCGn1
    SolutionIndex: 172
    SolutionNameMin: Cijk_Ailk_Bljk_S_B_Bias_HA_S_SAV_UserArgs_MT32x16x64_SN_LDSB0_AFC1_AG0_AFEM1_AFEM1_ASEM1_CLR0_CADS0_DTLA0_DTLB0_DTVA0_DTVB0_DTVMXSA0_DTVMXSB0_DTVSM0_DPLB0_EPS0_ELFLR0_EMLLn1_FDSI0_GRPM1_GRVWA1_GRVWB1_GSU1_GSUAMB_GSUC0_GSUWGMRR0_GLS0_ISA1151_IU1_K1_LDSTI0_LBSPPA0_LBSPPB0_LBSPPM0_LPA0_LPB1_LPM0_LRVW1_LWPMn1_MIAV0_MXLIA_MXSFA_MO40_MGRIPM1_NTn1_NTA0_NTB0_NTC0_NTD0_NTM0_NEPBS0_NLCA1_NLCB1_ONLL1_PGR0_PLR1_PKA0_SGROB0_SIA1_SS0_SU0_SUM0_SUS0_SPO0_SRVW0_SSO0_SVW1_SK0_SKFTR0_SKXCCM0_SIP1_SGRO0_TDMI0_TDMS0_TIN0_TT2_2_TLDS0_TLDSMn1_ULSGRO0_USL1_USLMX0_UIOFGRO0_UPLRP0_USFGROn1_USI0_VSn1_VWA1_VWB1_WSGRA0_WSGRB0_WS32_WG16_8_1_WGM1_WGMXCC1_WGMXCCGn1
    SolutionIndex: 173
    SolutionNameMin: Cijk_Ailk_Bljk_S_B_Bias_HA_S_SAV_UserArgs_MT32x16x32_SN_LDSB0_AFC1_AG0_AFEM1_AFEM1_ASEM1_CLR0_CADS0_DTLA0_DTLB0_DTVA0_DTVB0_DTVMXSA0_DTVMXSB0_DTVSM0_DPLB0_EPS0_ELFLR0_EMLLn1_FDSI0_GRPM1_GRVWA1_GRVWB1_GSU1_GSUAMB_GSUC0_GSUWGMRR0_GLS0_ISA1151_IU1_K1_LDSTI0_LBSPPA0_LBSPPB0_LBSPPM0_LPA0_LPB1_LPM0_LRVW1_LWPMn1_MIAV0_MXLIA_MXSFA_MO40_MGRIPM1_NTn1_NTA0_NTB0_NTC0_NTD0_NTM0_NEPBS0_NLCA1_NLCB1_ONLL1_PGR0_PLR1_PKA0_SGROB0_SIA1_SS0_SU0_SUM0_SUS0_SPO0_SRVW0_SSO0_SVW1_SK0_SKFTR0_SKXCCM0_SIP1_SGRO0_TDMI0_TDMS0_TIN0_TT2_2_TLDS0_TLDSMn1_ULSGRO0_USL1_USLMX0_UIOFGRO0_UPLRP0_USFGROn1_USI0_VSn1_VWA1_VWB1_WSGRA0_WSGRB0_WS32_WG16_8_1_WGM1_WGMXCC1_WGMXCCGn1
    SolutionIndex: 174
    SolutionNameMin: Cijk_Ailk_Bljk_S_B_Bias_HA_S_SAV_UserArgs_MT16x16x16_SN_LDSB0_AFC1_AG0_AFEM1_AFEM1_ASEM1_CLR0_CADS0_DTLA0_DTLB0_DTVA0_DTVB0_DTVMXSA0_DTVMXSB0_DTVSM0_DPLB0_EPS1_ELFLR0_EMLLn1_FDSI0_GRPM1_GRVWA1_GRVWB1_GSU1_GSUAMB_GSUC0_GSUWGMRR0_GLS0_ISA1151_IU1_K1_LDSTI0_LBSPPA0_LBSPPB0_LBSPPM0_LPA0_LPB1_LPM0_LRVW1_LWPMn1_MIAV0_MXLIA_MXSFA_MO40_MGRIPM1_NTn1_NTA0_NTB0_NTC0_NTD0_NTM0_NEPBS0_NLCA1_NLCB1_ONLL1_PGR1_PLR1_PKA0_SGROB0_SIA1_SS0_SU0_SUM0_SUS0_SPO0_SRVW0_SSO0_SVW1_SK0_SKFTR0_SKXCCM0_SIP1_SGRO0_TDMI0_TDMS0_TIN0_TT2_2_TLDS0_TLDSMn1_ULSGRO0_USL1_USLMX0_UIOFGRO0_UPLRP0_USFGROn1_USI0_VSn1_VWA1_VWB1_WSGRA0_WSGRB0_WS32_WG8_8_1_WGM1_WGMXCC1_WGMXCCGn1
    SolutionIndex: 175
    SolutionNameMin: Cijk_Ailk_Bljk_S_B_Bias_HA_S_SAV_UserArgs_MT32x32x16_SN_LDSB0_AFC1_AG0_AFEM1_AFEM1_ASEM1_CLR0_CADS0_DTLA0_DTLB0_DTVA0_DTVB0_DTVMXSA0_DTVMXSB0_DTVSM0_DPLB0_EPS0_ELFLR0_EMLLn1_FDSI0_GRPM1_GRVWA1_GRVWB1_GSU1_GSUAMB_GSUC0_GSUWGMRR0_GLS0_ISA1151_IU1_K1_LDSTI0_LBSPPA0_LBSPPB0_LBSPPM0_LPA0_LPB1_LPM0_LRVW1_LWPMn1_MIAV0_MXLIA_MXSFA_MO40_MGRIPM1_NTn1_NTA0_NTB0_NTC0_NTD0_NTM0_NEPBS0_NLCA1_NLCB1_ONLL1_PGR0_PLR1_PKA0_SGROB0_SIA1_SS0_SU8_SUM0_SUS256_SPO0_SRVW0_SSO0_SVW1_SK0_SKFTR0_SKXCCM0_SIP1_SGRO0_TDMI0_TDMS0_TIN0_TT4_4_TLDS0_TLDSMn1_ULSGRO0_USL1_USLMX0_UIOFGRO0_UPLRP0_USFGROn1_USI0_VSn1_VWA1_VWB1_WSGRA0_WSGRB0_WS32_WG8_8_1_WGM1_WGMXCC1_WGMXCCGn1
    SolutionIndex: 176
    SolutionNameMin: Cijk_Ailk_Bljk_S_B_Bias_HA_S_SAV_UserArgs_MT32x32x16_SN_LDSB0_AFC1_AG0_AFEM1_AFEM1_ASEM1_CLR0_CADS0_DTLA0_DTLB0_DTVA0_DTVB0_DTVMXSA0_DTVMXSB0_DTVSM0_DPLB0_EPS0_ELFLR0_EMLLn1_FDSI0_GRPM1_GRVWA1_GRVWB1_GSU1_GSUAMB_GSUC0_GSUWGMRR0_GLS0_ISA1151_IU1_K1_LDSTI0_LBSPPA0_LBSPPB0_LBSPPM0_LPA0_LPB1_LPM0_LRVW1_LWPMn1_MIAV0_MXLIA_MXSFA_MO40_MGRIPM1_NTn1_NTA0_NTB0_NTC0_NTD0_NTM0_NEPBS0_NLCA1_NLCB1_ONLL1_PGR1_PLR1_PKA0_SGROB0_SIA1_SS0_SU0_SUM0_SUS0_SPO0_SRVW0_SSO0_SVW1_SK0_SKFTR0_SKXCCM0_SIP1_SGRO0_TDMI0_TDMS0_TIN0_TT4_4_TLDS0_TLDSMn1_ULSGRO0_USL1_USLMX0_UIOFGRO0_UPLRP0_USFGROn1_USI0_VSn1_VWA1_VWB1_WSGRA0_WSGRB0_WS32_WG8_8_1_WGM1_WGMXCC1_WGMXCCGn1
    SolutionIndex: 177
    SolutionNameMin: Cijk_Ailk_Bljk_S_B_Bias_HA_S_SAV_UserArgs_MT16x16x64_SN_LDSB0_AFC1_AG0_AFEM1_AFEM1_ASEM1_CLR0_CADS0_DTLA0_DTLB0_DTVA0_DTVB0_DTVMXSA0_DTVMXSB0_DTVSM0_DPLB0_EPS0_ELFLR0_EMLLn1_FDSI0_GRPM1_GRVWA1_GRVWB1_GSU1_GSUAMB_GSUC0_GSUWGMRR0_GLS0_ISA1151_IU1_K1_LDSTI0_LBSPPA0_LBSPPB0_LBSPPM0_LPA0_LPB1_LPM0_LRVW1_LWPMn1_MIAV0_MXLIA_MXSFA_MO40_MGRIPM1_NTn1_NTA0_NTB0_NTC0_NTD0_NTM0_NEPBS0_NLCA1_NLCB1_ONLL1_PGR1_PLR1_PKA0_SGROB0_SIA1_SS0_SU0_SUM0_SUS0_SPO0_SRVW0_SSO0_SVW1_SK0_SKFTR0_SKXCCM0_SIP1_SGRO0_TDMI0_TDMS0_TIN0_TT2_2_TLDS0_TLDSMn1_ULSGRO0_USL1_USLMX0_UIOFGRO0_UPLRP0_USFGROn1_USI0_VSn1_VWA1_VWB1_WSGRA0_WSGRB0_WS32_WG8_8_1_WGM1_WGMXCC1_WGMXCCGn1
    SolutionIndex: 178
    SolutionNameMin: Cijk_Ailk_Bljk_S_B_Bias_HA_S_SAV_UserArgs_MT8x8x128_SN_LDSB0_AFC1_AG0_AFEM1_AFEM1_ASEM1_CLR0_CADS0_DTLA0_DTLB0_DTVA0_DTVB0_DTVMXSA0_DTVMXSB0_DTVSM0_DPLB0_EPS1_ELFLR0_EMLLn1_FDSI0_GRPM1_GRVWA1_GRVWB1_GSU1_GSUAMB_GSUC0_GSUWGMRR0_GLS0_ISA1151_IU1_K1_LDSTI0_LBSPPA0_LBSPPB0_LBSPPM0_LPA0_LPB1_LPM0_LRVW1_LWPMn1_MIAV0_MXLIA_MXSFA_MO40_MGRIPM1_NTn1_NTA0_NTB0_NTC0_NTD0_NTM0_NEPBS0_NLCA1_NLCB2_ONLL1_PGR1_PLR1_PKA0_SGROB0_SIA1_SS0_SU0_SUM0_SUS0_SPO0_SRVW0_SSO0_SVW1_SK0_SKFTR0_SKXCCM0_SIP1_SGRO0_TDMI0_TDMS0_TIN0_TT1_1_TLDS0_TLDSMn1_ULSGRO0_USL1_USLMX0_UIOFGRO0_UPLRP0_USFGROn1_USI0_VSn1_VWA1_VWB1_WSGRA0_WSGRB0_WS32_WG8_8_1_WGM1_WGMXCC1_WGMXCCGn1
    SolutionIndex: 179
    SolutionNameMin: Cijk_Ailk_Bljk_S_B_Bias_HA_S_SAV_UserArgs_MT8x8x64_SN_LDSB0_AFC1_AG0_AFEM1_AFEM1_ASEM1_CLR0_CADS0_DTLA0_DTLB0_DTVA0_DTVB0_DTVMXSA0_DTVMXSB0_DTVSM0_DPLB0_EPS0_ELFLR0_EMLLn1_FDSI0_GRPM1_GRVWA1_GRVWB1_GSU1_GSUAMB_GSUC0_GSUWGMRR0_GLS0_ISA1151_IU1_K1_LDSTI0_LBSPPA0_LBSPPB0_LBSPPM0_LPA0_LPB1_LPM0_LRVW1_LWPMn1_MIAV0_MXLIA_MXSFA_MO40_MGRIPM1_NTn1_NTA0_NTB0_NTC0_NTD0_NTM0_NEPBS0_NLCA1_NLCB1_ONLL1_PGR0_PLR1_PKA0_SGROB0_SIA1_SS0_SU0_SUM0_SUS0_SPO0_SRVW0_SSO0_SVW1_SK0_SKFTR0_SKXCCM0_SIP1_SGRO0_TDMI0_TDMS0_TIN0_TT1_1_TLDS0_TLDSMn1_ULSGRO0_USL1_USLMX0_UIOFGRO0_UPLRP0_USFGROn1_USI0_VSn1_VWA1_VWB1_WSGRA0_WSGRB0_WS32_WG8_8_1_WGM1_WGMXCC1_WGMXCCGn1
    SolutionIndex: 180
    SolutionNameMin: Cijk_Ailk_Bljk_S_B_Bias_HA_S_SAV_UserArgs_MT16x16x64_SN_LDSB0_AFC1_AG0_AFEM1_AFEM1_ASEM1_CLR0_CADS0_DTLA0_DTLB0_DTVA0_DTVB0_DTVMXSA0_DTVMXSB0_DTVSM0_DPLB0_EPS0_ELFLR0_EMLLn1_FDSI0_GRPM1_GRVWA1_GRVWB1_GSU1_GSUAMB_GSUC0_GSUWGMRR0_GLS0_ISA1151_IU1_K1_LDSTI0_LBSPPA0_LBSPPB0_LBSPPM0_LPA0_LPB1_LPM0_LRVW1_LWPMn1_MIAV0_MXLIA_MXSFA_MO40_MGRIPM1_NTn1_NTA0_NTB0_NTC0_NTD0_NTM0_NEPBS0_NLCA1_NLCB1_ONLL1_PGR0_PLR1_PKA0_SGROB0_SIA1_SS0_SU0_SUM0_SUS0_SPO0_SRVW0_SSO0_SVW1_SK0_SKFTR0_SKXCCM0_SIP1_SGRO0_TDMI0_TDMS0_TIN0_TT2_2_TLDS0_TLDSMn1_ULSGRO0_USL1_USLMX0_UIOFGRO0_UPLRP0_USFGROn1_USI0_VSn1_VWA1_VWB1_WSGRA0_WSGRB0_WS32_WG8_8_1_WGM1_WGMXCC1_WGMXCCGn1
    SolutionIndex: 181
    SolutionNameMin: Cijk_Ailk_Bljk_S_B_Bias_HA_S_SAV_UserArgs_MT32x32x16_SN_LDSB0_AFC1_AG0_AFEM1_AFEM1_ASEM1_CLR0_CADS0_DTLA0_DTLB0_DTVA0_DTVB0_DTVMXSA0_DTVMXSB0_DTVSM0_DPLB0_EPS1_ELFLR0_EMLLn1_FDSI0_GRPM1_GRVWA1_GRVWB1_GSU1_GSUAMB_GSUC0_GSUWGMRR0_GLS0_ISA1151_IU1_K1_LDSTI0_LBSPPA0_LBSPPB0_LBSPPM0_LPA0_LPB1_LPM0_LRVW1_LWPMn1_MIAV0_MXLIA_MXSFA_MO40_MGRIPM1_NTn1_NTA0_NTB0_NTC0_NTD0_NTM0_NEPBS0_NLCA1_NLCB1_ONLL1_PGR1_PLR1_PKA0_SGROB0_SIA1_SS0_SU0_SUM0_SUS0_SPO0_SRVW0_SSO0_SVW1_SK0_SKFTR0_SKXCCM0_SIP1_SGRO0_TDMI0_TDMS0_TIN0_TT4_4_TLDS0_TLDSMn1_ULSGRO0_USL1_USLMX0_UIOFGRO0_UPLRP0_USFGROn1_USI0_VSn1_VWA1_VWB1_WSGRA0_WSGRB0_WS32_WG8_8_1_WGM1_WGMXCC1_WGMXCCGn1
    SolutionIndex: 182
    SolutionNameMin: Cijk_Ailk_Bljk_S_B_Bias_HA_S_SAV_UserArgs_MT32x16x128_SN_LDSB0_AFC1_AG0_AFEM1_AFEM1_ASEM1_CLR0_CADS0_DTLA0_DTLB0_DTVA0_DTVB0_DTVMXSA0_DTVMXSB0_DTVSM0_DPLB0_EPS0_ELFLR0_EMLLn1_FDSI0_GRPM1_GRVWA1_GRVWB1_GSU1_GSUAMB_GSUC0_GSUWGMRR0_GLS0_ISA1151_IU1_K1_LDSTI0_LBSPPA0_LBSPPB0_LBSPPM0_LPA0_LPB1_LPM0_LRVW1_LWPMn1_MIAV0_MXLIA_MXSFA_MO40_MGRIPM1_NTn1_NTA0_NTB0_NTC0_NTD0_NTM0_NEPBS0_NLCA1_NLCB1_ONLL1_PGR0_PLR1_PKA0_SGROB0_SIA1_SS0_SU0_SUM0_SUS0_SPO0_SRVW0_SSO0_SVW1_SK0_SKFTR0_SKXCCM0_SIP1_SGRO0_TDMI0_TDMS0_TIN0_TT2_2_TLDS0_TLDSMn1_ULSGRO0_USL1_USLMX0_UIOFGRO0_UPLRP0_USFGROn1_USI0_VSn1_VWA1_VWB1_WSGRA0_WSGRB0_WS32_WG16_8_1_WGM1_WGMXCC1_WGMXCCGn1
    SolutionIndex: 183
    SolutionNameMin: Cijk_Ailk_Bljk_S_B_Bias_HA_S_SAV_UserArgs_MT32x16x16_SN_LDSB0_AFC1_AG0_AFEM1_AFEM1_ASEM1_CLR0_CADS0_DTLA0_DTLB0_DTVA0_DTVB0_DTVMXSA0_DTVMXSB0_DTVSM0_DPLB0_EPS0_ELFLR0_EMLLn1_FDSI0_GRPM1_GRVWA1_GRVWB1_GSU1_GSUAMB_GSUC0_GSUWGMRR0_GLS0_ISA1151_IU1_K1_LDSTI0_LBSPPA0_LBSPPB0_LBSPPM0_LPA0_LPB1_LPM0_LRVW1_LWPMn1_MIAV0_MXLIA_MXSFA_MO40_MGRIPM1_NTn1_NTA0_NTB0_NTC0_NTD0_NTM0_NEPBS0_NLCA1_NLCB1_ONLL1_PGR1_PLR1_PKA0_SGROB0_SIA1_SS0_SU0_SUM0_SUS0_SPO0_SRVW0_SSO0_SVW1_SK0_SKFTR0_SKXCCM0_SIP1_SGRO0_TDMI0_TDMS0_TIN0_TT2_2_TLDS0_TLDSMn1_ULSGRO0_USL1_USLMX0_UIOFGRO0_UPLRP0_USFGROn1_USI0_VSn1_VWA1_VWB1_WSGRA0_WSGRB0_WS32_WG16_8_1_WGM1_WGMXCC1_WGMXCCGn1
    SolutionIndex: 184
    SolutionNameMin: Cijk_Ailk_Bljk_S_B_Bias_HA_S_SAV_UserArgs_MT32x32x16_SN_LDSB0_AFC1_AG0_AFEM1_AFEM1_ASEM1_CLR0_CADS0_DTLA0_DTLB0_DTVA0_DTVB0_DTVMXSA0_DTVMXSB0_DTVSM0_DPLB0_EPS0_ELFLR0_EMLLn1_FDSI0_GRPM1_GRVWA1_GRVWB1_GSU1_GSUAMB_GSUC0_GSUWGMRR0_GLS0_ISA1151_IU1_K1_LDSTI0_LBSPPA0_LBSPPB0_LBSPPM0_LPA0_LPB1_LPM0_LRVW1_LWPMn1_MIAV0_MXLIA_MXSFA_MO40_MGRIPM1_NTn1_NTA0_NTB0_NTC0_NTD0_NTM0_NEPBS0_NLCA1_NLCB1_ONLL1_PGR0_PLR1_PKA0_SGROB0_SIA1_SS0_SU0_SUM0_SUS0_SPO0_SRVW0_SSO0_SVW1_SK0_SKFTR0_SKXCCM0_SIP1_SGRO0_TDMI0_TDMS0_TIN0_TT4_4_TLDS0_TLDSMn1_ULSGRO0_USL1_USLMX0_UIOFGRO0_UPLRP0_USFGROn1_USI0_VSn1_VWA1_VWB1_WSGRA0_WSGRB0_WS32_WG8_8_1_WGM1_WGMXCC1_WGMXCCGn1
    SolutionIndex: 185
    SolutionNameMin: Cijk_Ailk_Bljk_S_B_Bias_HA_S_SAV_UserArgs_MT32x16x128_SN_LDSB0_AFC1_AG0_AFEM1_AFEM1_ASEM1_CLR0_CADS0_DTLA0_DTLB0_DTVA0_DTVB0_DTVMXSA0_DTVMXSB0_DTVSM0_DPLB0_EPS0_ELFLR0_EMLLn1_FDSI0_GRPM1_GRVWA1_GRVWB1_GSU1_GSUAMB_GSUC0_GSUWGMRR0_GLS0_ISA1151_IU1_K1_LDSTI0_LBSPPA0_LBSPPB0_LBSPPM0_LPA0_LPB1_LPM0_LRVW1_LWPMn1_MIAV0_MXLIA_MXSFA_MO40_MGRIPM1_NTn1_NTA0_NTB0_NTC0_NTD0_NTM0_NEPBS0_NLCA1_NLCB1_ONLL1_PGR1_PLR1_PKA0_SGROB0_SIA1_SS0_SU0_SUM0_SUS0_SPO0_SRVW0_SSO0_SVW1_SK0_SKFTR0_SKXCCM0_SIP1_SGRO0_TDMI0_TDMS0_TIN0_TT2_2_TLDS0_TLDSMn1_ULSGRO0_USL1_USLMX0_UIOFGRO0_UPLRP0_USFGROn1_USI0_VSn1_VWA1_VWB1_WSGRA0_WSGRB0_WS32_WG16_8_1_WGM1_WGMXCC1_WGMXCCGn1
    SolutionIndex: 186
    SolutionNameMin: Cijk_Ailk_Bljk_S_B_Bias_HA_S_SAV_UserArgs_MT16x16x128_SN_LDSB0_AFC1_AG0_AFEM1_AFEM1_ASEM1_CLR0_CADS0_DTLA0_DTLB0_DTVA0_DTVB0_DTVMXSA0_DTVMXSB0_DTVSM0_DPLB0_EPS0_ELFLR0_EMLLn1_FDSI0_GRPM1_GRVWA1_GRVWB1_GSU1_GSUAMB_GSUC0_GSUWGMRR0_GLS0_ISA1151_IU1_K1_LDSTI0_LBSPPA0_LBSPPB0_LBSPPM0_LPA0_LPB1_LPM0_LRVW1_LWPMn1_MIAV0_MXLIA_MXSFA_MO40_MGRIPM1_NTn1_NTA0_NTB0_NTC0_NTD0_NTM0_NEPBS0_NLCA1_NLCB2_ONLL1_PGR1_PLR1_PKA0_SGROB0_SIA1_SS0_SU0_SUM0_SUS0_SPO0_SRVW0_SSO0_SVW1_SK0_SKFTR0_SKXCCM0_SIP1_SGRO0_TDMI0_TDMS0_TIN0_TT2_2_TLDS0_TLDSMn1_ULSGRO0_USL1_USLMX0_UIOFGRO0_UPLRP0_USFGROn1_USI0_VSn1_VWA1_VWB1_WSGRA0_WSGRB0_WS32_WG8_8_1_WGM1_WGMXCC1_WGMXCCGn1
    SolutionIndex: 187
    SolutionNameMin: Cijk_Ailk_Bljk_S_B_Bias_HA_S_SAV_UserArgs_MT32x16x16_SN_LDSB0_AFC1_AG0_AFEM1_AFEM1_ASEM1_CLR0_CADS0_DTLA0_DTLB0_DTVA0_DTVB0_DTVMXSA0_DTVMXSB0_DTVSM0_DPLB0_EPS1_ELFLR0_EMLLn1_FDSI0_GRPM1_GRVWA1_GRVWB1_GSU1_GSUAMB_GSUC0_GSUWGMRR0_GLS0_ISA1151_IU1_K1_LDSTI0_LBSPPA0_LBSPPB0_LBSPPM0_LPA0_LPB1_LPM0_LRVW1_LWPMn1_MIAV0_MXLIA_MXSFA_MO40_MGRIPM1_NTn1_NTA0_NTB0_NTC0_NTD0_NTM0_NEPBS0_NLCA1_NLCB1_ONLL1_PGR1_PLR1_PKA0_SGROB0_SIA1_SS0_SU0_SUM0_SUS0_SPO0_SRVW0_SSO0_SVW1_SK0_SKFTR0_SKXCCM0_SIP1_SGRO0_TDMI0_TDMS0_TIN0_TT2_2_TLDS0_TLDSMn1_ULSGRO0_USL1_USLMX0_UIOFGRO0_UPLRP0_USFGROn1_USI0_VSn1_VWA1_VWB1_WSGRA0_WSGRB0_WS32_WG16_8_1_WGM1_WGMXCC1_WGMXCCGn1
- - - [6144, 8192, 1, 8192]
    - [0, 3.11]
  - - [768, 8192, 1, 8192]
    - [1, 3.25]
  - - [6144, 1024, 1, 8192]
    - [4, 3.38]
  - - [3072, 8192, 1, 4096]
    - [2, 3.25]
  - - [6144, 8192, 1, 4096]
    - [3, 3.3]
  - - [6144, 8192, 1, 1024]
    - [5, 3.39]
  - - [3072, 2048, 1, 8192]
    - [6, 3.24]
  - - [1536, 8192, 1, 8192]
    - [7, 3.23]
  - - [6144, 4096, 1, 8192]
    - [4, 3.28]
  - - [1536, 4096, 1, 8192]
    - [1, 3.25]
  - - [1536, 8192, 1, 4096]
    - [5, 3.31]
  - - [3072, 4096, 1, 4096]
    - [8, 3.3]
  - - [3072, 8192, 1, 2048]
    - [3, 3.32]
  - - [6144, 2048, 1, 4096]
    - [6, 3.4]
  - - [6144, 4096, 1, 2048]
    - [3, 3.36]
  - - [3072, 4096, 1, 8192]
    - [6, 3.22]
  - - [6144, 2048, 1, 8192]
    - [9, 3.3]
  - - [6144, 4096, 1, 4096]
    - [9, 3.33]
  - - [6144, 8192, 1, 2048]
    - [3, 3.31]
  - - [3072, 8192, 1, 8192]
    - [6, 3.21]
  - - [256, 8192, 1, 8192]
    - [14, 2.66]
  - - [768, 8192, 1, 2048]
    - [10, 3.24]
  - - [3072, 2048, 1, 2048]
    - [11, 3.29]
  - - [6144, 256, 1, 8192]
    - [12, 3.26]
  - - [6144, 8192, 1, 256]
    - [13, 3.25]
  - - [1536, 4096, 1, 4096]
    - [5, 3.32]
  - - [384, 8192, 1, 8192]
    - [15, 3.0]
  - - [768, 4096, 1, 8192]
    - [7, 3.2]
  - - [1536, 8192, 1, 2048]
    - [1, 3.29]
  - - [3072, 8192, 1, 1024]
    - [1, 3.27]
  - - [3072, 2048, 1, 4096]
    - [6, 3.24]
  - - [6144, 1024, 1, 4096]
    - [6, 3.41]
  - - [6144, 512, 1, 8192]
    - [16, 3.29]
  - - [3072, 4096, 1, 1024]
    - [1, 3.29]
  - - [1536, 1024, 1, 8192]
    - [17, 3.21]
  - - [6144, 2048, 1, 2048]
    - [11, 3.39]
  - - [384, 4096, 1, 8192]
    - [14, 2.72]
  - - [384, 8192, 1, 4096]
    - [18, 3.05]
  - - [768, 2048, 1, 8192]
    - [11, 3.23]
  - - [768, 4096, 1, 4096]
    - [11, 3.21]
  - - [1536, 2048, 1, 4096]
    - [10, 3.26]
  - - [1536, 4096, 1, 2048]
    - [19, 3.25]
  - - [1536, 8192, 1, 1024]
    - [10, 3.27]
  - - [3072, 512, 1, 8192]
    - [6, 3.2]
  - - [3072, 1024, 1, 4096]
    - [6, 3.25]
  - - [3072, 8192, 1, 512]
    - [13, 3.28]
  - - [6144, 512, 1, 4096]
    - [20, 3.4]
  - - [6144, 1024, 1, 2048]
    - [6, 3.43]
  - - [6144, 2048, 1, 1024]
    - [1, 3.41]
  - - [6144, 4096, 1, 512]
    - [1, 3.34]
  - - [768, 8192, 1, 4096]
    - [11, 3.27]
  - - [1536, 2048, 1, 8192]
    - [10, 3.25]
  - - [3072, 1024, 1, 8192]
    - [4, 3.2]
  - - [3072, 4096, 1, 2048]
    - [11, 3.32]
  - - [6144, 4096, 1, 1024]
    - [5, 3.34]
  - - [6144, 8192, 1, 512]
    - [5, 3.29]
  - - [384, 1024, 1, 8192]
    - [21, 2.84]
  - - [384, 2048, 1, 4096]
    - [22, 2.68]
  - - [384, 4096, 1, 2048]
    - [23, 2.77]
  - - [384, 8192, 1, 1024]
    - [23, 2.78]
  - - [768, 512, 1, 8192]
    - [6, 3.19]
  - - [768, 1024, 1, 4096]
    - [22, 3.21]
  - - [768, 2048, 1, 2048]
    - [1, 3.31]
  - - [768, 4096, 1, 1024]
    - [11, 3.27]
  - - [768, 8192, 1, 512]
    - [24, 3.15]
  - - [1536, 256, 1, 8192]
    - [29, 3.21]
  - - [1536, 512, 1, 4096]
    - [25, 3.18]
  - - [1536, 1024, 1, 2048]
    - [1, 3.31]
  - - [1536, 2048, 1, 1024]
    - [1, 3.3]
  - - [1536, 4096, 1, 512]
    - [30, 3.23]
  - - [1536, 8192, 1, 256]
    - [1, 3.08]
  - - [3072, 128, 1, 8192]
    - [31, 3.07]
  - - [3072, 256, 1, 4096]
    - [26, 3.15]
  - - [3072, 512, 1, 2048]
    - [4, 3.3]
  - - [3072, 1024, 1, 1024]
    - [1, 3.29]
  - - [3072, 2048, 1, 512]
    - [13, 3.25]
  - - [3072, 4096, 1, 256]
    - [1, 3.07]
  - - [3072, 8192, 1, 128]
    - [13, 2.91]
  - - [6144, 64, 1, 8192]
    - [26, 2.15]
  - - [6144, 128, 1, 4096]
    - [27, 2.98]
  - - [6144, 256, 1, 2048]
    - [28, 3.35]
  - - [6144, 512, 1, 1024]
    - [25, 3.45]
  - - [6144, 1024, 1, 512]
    - [5, 3.31]
  - - [6144, 2048, 1, 256]
    - [1, 3.16]
  - - [6144, 4096, 1, 128]
    - [13, 2.96]
  - - [6144, 8192, 1, 64]
    - [1, 2.16]
  - - [64, 8192, 1, 8192]
    - [32, 1.05]
  - - [128, 4096, 1, 8192]
    - [33, 1.54]
  - - [128, 8192, 1, 4096]
    - [34, 1.7]
  - - [256, 2048, 1, 8192]
    - [35, 2.06]
  - - [256, 4096, 1, 4096]
    - [36, 2.17]
  - - [256, 8192, 1, 2048]
    - [37, 2.36]
  - - [384, 2048, 1, 8192]
    - [38, 2.52]
  - - [384, 4096, 1, 4096]
    - [38, 2.73]
  - - [384, 8192, 1, 2048]
    - [23, 2.9]
  - - [768, 1024, 1, 8192]
    - [39, 2.92]
  - - [768, 2048, 1, 4096]
    - [11, 3.22]
  - - [768, 4096, 1, 2048]
    - [10, 3.17]
  - - [768, 8192, 1, 1024]
    - [24, 3.1]
  - - [1536, 512, 1, 8192]
    - [40, 3.07]
  - - [1536, 1024, 1, 4096]
    - [7, 3.25]
  - - [1536, 2048, 1, 2048]
    - [17, 3.23]
  - - [1536, 4096, 1, 1024]
    - [41, 3.19]
  - - [1536, 8192, 1, 512]
    - [1, 3.23]
  - - [3072, 256, 1, 8192]
    - [42, 3.05]
  - - [3072, 512, 1, 4096]
    - [4, 3.3]
  - - [3072, 1024, 1, 2048]
    - [4, 3.23]
  - - [3072, 2048, 1, 1024]
    - [43, 3.24]
  - - [3072, 4096, 1, 512]
    - [35, 3.24]
  - - [3072, 8192, 1, 256]
    - [13, 3.17]
  - - [6144, 128, 1, 8192]
    - [27, 2.93]
  - - [6144, 256, 1, 4096]
    - [12, 3.31]
  - - [6144, 512, 1, 2048]
    - [25, 3.42]
  - - [6144, 1024, 1, 1024]
    - [4, 3.44]
  - - [6144, 2048, 1, 512]
    - [1, 3.28]
  - - [6144, 4096, 1, 256]
    - [44, 3.18]
  - - [6144, 8192, 1, 128]
    - [13, 2.98]
  - - [128, 8192, 1, 8192]
    - [34, 1.71]
  - - [256, 4096, 1, 8192]
    - [45, 2.16]
  - - [256, 8192, 1, 4096]
    - [1, 2.37]
  - - [16, 8192, 1, 4096]
    - [58, 0.4]
  - - [16, 4096, 1, 8192]
    - [46, 0.37]
  - - [16, 8192, 1, 8192]
    - [59, 0.43]
  - - [64, 8192, 1, 1024]
    - [47, 1.75]
  - - [64, 4096, 1, 4096]
    - [48, 1.17]
  - - [64, 4096, 1, 8192]
    - [60, 1.26]
  - - [128, 8192, 1, 512]
    - [63, 2.26]
  - - [128, 8192, 1, 2048]
    - [49, 1.87]
  - - [128, 2048, 1, 8192]
    - [50, 1.63]
  - - [256, 8192, 1, 256]
    - [51, 2.58]
  - - [256, 2048, 1, 2048]
    - [21, 3.08]
  - - [256, 1024, 1, 8192]
    - [52, 2.47]
  - - [384, 8192, 1, 256]
    - [53, 2.95]
  - - [384, 1024, 1, 2048]
    - [54, 3.14]
  - - [384, 512, 1, 8192]
    - [55, 3.03]
  - - [768, 8192, 1, 128]
    - [13, 2.88]
  - - [768, 2048, 1, 1024]
    - [1, 3.25]
  - - [768, 256, 1, 8192]
    - [56, 3.05]
  - - [1536, 8192, 1, 64]
    - [24, 2.13]
  - - [1536, 512, 1, 1024]
    - [54, 3.15]
  - - [1536, 128, 1, 8192]
    - [64, 2.45]
  - - [3072, 4096, 1, 64]
    - [37, 2.09]
  - - [3072, 1024, 1, 512]
    - [1, 3.18]
  - - [3072, 64, 1, 8192]
    - [57, 2.02]
  - - [6144, 8192, 1, 16]
    - [62, 0.63]
  - - [6144, 256, 1, 512]
    - [65, 3.25]
  - - [6144, 16, 1, 8192]
    - [61, 0.64]
  - - [64, 1024, 1, 8192]
    - [66, 1.4]
  - - [64, 8192, 1, 4096]
    - [67, 1.32]
  - - [128, 512, 1, 8192]
    - [68, 1.7]
  - - [128, 8192, 1, 1024]
    - [49, 2.08]
  - - [256, 256, 1, 8192]
    - [68, 1.72]
  - - [256, 2048, 1, 1024]
    - [21, 2.95]
  - - [256, 8192, 1, 1024]
    - [37, 2.31]
  - - [384, 256, 1, 8192]
    - [69, 2.01]
  - - [384, 8192, 1, 512]
    - [53, 3.04]
  - - [768, 128, 1, 8192]
    - [69, 2.0]
  - - [768, 8192, 1, 256]
    - [70, 3.12]
  - - [1536, 64, 1, 8192]
    - [71, 1.6]
  - - [1536, 8192, 1, 128]
    - [13, 2.82]
  - - [3072, 64, 1, 4096]
    - [57, 2.02]
  - - [3072, 8192, 1, 64]
    - [37, 2.12]
  - - [6144, 64, 1, 2048]
    - [22, 2.12]
  - - [6144, 512, 1, 256]
    - [70, 3.2]
  - - [6144, 4096, 1, 64]
    - [1, 2.12]
  - - [64, 2048, 1, 4096]
    - [72, 1.81]
  - - [64, 2048, 1, 8192]
    - [69, 1.18]
  - - [64, 4096, 1, 2048]
    - [73, 1.85]
  - - [64, 8192, 1, 2048]
    - [74, 1.2]
  - - [128, 1024, 1, 4096]
    - [34, 2.1]
  - - [128, 1024, 1, 8192]
    - [75, 1.94]
  - - [128, 2048, 1, 2048]
    - [42, 2.21]
  - - [128, 2048, 1, 4096]
    - [42, 2.11]
  - - [128, 4096, 1, 1024]
    - [76, 2.14]
  - - [128, 4096, 1, 2048]
    - [49, 2.05]
  - - [128, 4096, 1, 4096]
    - [77, 1.71]
  - - [256, 512, 1, 4096]
    - [34, 2.15]
  - - [256, 512, 1, 8192]
    - [71, 2.21]
  - - [256, 1024, 1, 2048]
    - [78, 2.86]
  - - [256, 1024, 1, 4096]
    - [79, 2.99]
  - - [256, 2048, 1, 4096]
    - [80, 2.65]
  - - [256, 4096, 1, 512]
    - [81, 2.61]
  - - [256, 4096, 1, 1024]
    - [81, 2.74]
  - - [256, 4096, 1, 2048]
    - [80, 2.45]
  - - [256, 8192, 1, 512]
    - [81, 2.75]
  - - [384, 512, 1, 4096]
    - [55, 3.05]
  - - [384, 1024, 1, 4096]
    - [82, 3.18]
  - - [384, 2048, 1, 1024]
    - [54, 3.06]
  - - [384, 2048, 1, 2048]
    - [54, 3.16]
  - - [384, 4096, 1, 512]
    - [54, 2.99]
  - - [384, 4096, 1, 1024]
    - [54, 3.1]
  - - [768, 256, 1, 4096]
    - [55, 3.03]
  - - [768, 512, 1, 2048]
    - [83, 3.19]
  - - [768, 512, 1, 4096]
    - [83, 3.25]
  - - [768, 1024, 1, 1024]
    - [54, 3.11]
  - - [768, 1024, 1, 2048]
    - [13, 3.17]
  - - [768, 2048, 1, 512]
    - [1, 3.12]
  - - [768, 4096, 1, 256]
    - [70, 2.98]
  - - [768, 4096, 1, 512]
    - [1, 3.18]
  - - [1536, 128, 1, 4096]
    - [56, 2.99]
  - - [1536, 256, 1, 2048]
    - [29, 3.2]
  - - [1536, 256, 1, 4096]
    - [29, 3.23]
  - - [1536, 512, 1, 2048]
    - [70, 3.2]
  - - [1536, 1024, 1, 512]
    - [29, 3.11]
  - - [1536, 1024, 1, 1024]
    - [1, 3.25]
  - - [1536, 2048, 1, 256]
    - [70, 3.01]
  - - [1536, 2048, 1, 512]
    - [1, 3.19]
  - - [1536, 4096, 1, 128]
    - [24, 2.88]
  - - [1536, 4096, 1, 256]
    - [35, 3.15]
  - - [3072, 128, 1, 2048]
    - [29, 3.2]
  - - [3072, 128, 1, 4096]
    - [22, 3.06]
  - - [3072, 256, 1, 1024]
    - [70, 3.16]
  - - [3072, 256, 1, 2048]
    - [70, 3.19]
  - - [3072, 512, 1, 512]
    - [1, 3.13]
  - - [3072, 512, 1, 1024]
    - [1, 3.26]
  - - [3072, 1024, 1, 256]
    - [53, 2.94]
  - - [3072, 2048, 1, 128]
    - [24, 2.88]
  - - [3072, 2048, 1, 256]
    - [70, 3.14]
  - - [3072, 4096, 1, 128]
    - [35, 2.78]
  - - [6144, 64, 1, 4096]
    - [54, 2.13]
  - - [6144, 128, 1, 1024]
    - [70, 3.15]
  - - [6144, 128, 1, 2048]
    - [26, 3.08]
  - - [6144, 256, 1, 1024]
    - [12, 3.43]
  - - [6144, 512, 1, 512]
    - [13, 3.4]
  - - [6144, 1024, 1, 128]
    - [70, 2.94]
  - - [6144, 1024, 1, 256]
    - [39, 3.21]
  - - [6144, 2048, 1, 64]
    - [1, 2.06]
  - - [6144, 2048, 1, 128]
    - [1, 2.83]
  - - [1, 8192, 1, 8192]
    - [84, 0.03]
  - - [16, 512, 1, 8192]
    - [85, 0.45]
  - - [16, 8192, 1, 512]
    - [86, 0.85]
  - - [16, 8192, 1, 1024]
    - [87, 0.9]
  - - [64, 128, 1, 8192]
    - [88, 0.45]
  - - [64, 2048, 1, 512]
    - [89, 1.36]
  - - [64, 1024, 1, 2048]
    - [105, 1.56]
  - - [64, 512, 1, 8192]
    - [106, 1.12]
  - - [128, 64, 1, 8192]
    - [91, 0.45]
  - - [128, 2048, 1, 256]
    - [92, 1.82]
  - - [128, 512, 1, 2048]
    - [105, 1.65]
  - - [128, 256, 1, 8192]
    - [90, 1.13]
  - - [256, 64, 1, 4096]
    - [94, 0.76]
  - - [256, 2048, 1, 128]
    - [95, 1.82]
  - - [256, 1024, 1, 512]
    - [96, 2.09]
  - - [256, 256, 1, 4096]
    - [93, 1.67]
  - - [384, 16, 1, 8192]
    - [85, 0.36]
  - - [384, 512, 1, 256]
    - [97, 1.85]
  - - [384, 64, 1, 4096]
    - [98, 0.9]
  - - [384, 1024, 1, 256]
    - [92, 2.04]
  - - [384, 256, 1, 2048]
    - [99, 1.87]
  - - [384, 4096, 1, 128]
    - [96, 2.05]
  - - [384, 512, 1, 2048]
    - [50, 2.28]
  - - [768, 16, 1, 4096]
    - [107, 0.6]
  - - [768, 512, 1, 128]
    - [95, 1.76]
  - - [768, 64, 1, 2048]
    - [100, 1.28]
  - - [768, 1024, 1, 128]
    - [96, 1.92]
  - - [768, 256, 1, 1024]
    - [50, 2.27]
  - - [768, 4096, 1, 64]
    - [96, 1.84]
  - - [768, 512, 1, 1024]
    - [95, 2.27]
  - - [1536, 16, 1, 2048]
    - [98, 0.91]
  - - [1536, 512, 1, 64]
    - [92, 1.58]
  - - [1536, 128, 1, 512]
    - [101, 2.06]
  - - [1536, 16, 1, 8192]
    - [94, 0.62]
  - - [1536, 1024, 1, 128]
    - [96, 1.94]
  - - [1536, 256, 1, 1024]
    - [96, 2.26]
  - - [3072, 16, 1, 1024]
    - [100, 1.2]
  - - [3072, 1024, 1, 16]
    - [95, 1.05]
  - - [3072, 128, 1, 256]
    - [96, 2.08]
  - - [3072, 16, 1, 4096]
    - [102, 0.6]
  - - [3072, 1024, 1, 64]
    - [96, 1.87]
  - - [3072, 256, 1, 512]
    - [96, 2.22]
  - - [6144, 1, 1, 8192]
    - [61, 0.04]
  - - [6144, 512, 1, 16]
    - [95, 1.02]
  - - [6144, 64, 1, 256]
    - [96, 1.98]
  - - [6144, 8192, 1, 2]
    - [62, 0.08]
  - - [6144, 512, 1, 64]
    - [96, 1.82]
  - - [6144, 128, 1, 512]
    - [96, 2.21]
  - - [12288, 1024, 1, 4]
    - [103, 0.16]
  - - [12288, 2048, 1, 4]
    - [104, 0.16]
  - - [2048, 12288, 1, 2]
    - [129, 0.05]
  - - [4096, 12288, 1, 1]
    - [103, 0.01]
  - - [4096, 12288, 1, 2]
    - [108, 0.03]
  - - [8192, 12288, 1, 1]
    - [109, 0.02]
  - - [8192, 12288, 1, 2]
    - [140, 0.05]
  - - [256, 64, 1, 8192]
    - [110, 0.57]
  - - [512, 64, 1, 2048]
    - [111, 0.83]
  - - [512, 64, 1, 4096]
    - [67, 0.93]
  - - [1024, 64, 1, 1024]
    - [112, 0.49]
  - - [1024, 64, 1, 4096]
    - [113, 0.91]
  - - [2048, 64, 1, 1024]
    - [114, 0.66]
  - - [2048, 64, 1, 2048]
    - [115, 0.89]
  - - [4096, 64, 1, 256]
    - [49, 0.53]
  - - [4096, 64, 1, 512]
    - [116, 0.72]
  - - [4096, 64, 1, 1024]
    - [116, 0.93]
  - - [8192, 64, 1, 128]
    - [75, 0.42]
  - - [8192, 64, 1, 256]
    - [92, 0.71]
  - - [8192, 64, 1, 512]
    - [73, 0.9]
  - - [128, 128, 1, 4096]
    - [113, 0.52]
  - - [128, 128, 1, 8192]
    - [117, 0.58]
  - - [256, 128, 1, 2048]
    - [118, 0.58]
  - - [256, 128, 1, 4096]
    - [119, 1.03]
  - - [512, 128, 1, 1024]
    - [100, 0.47]
  - - [512, 128, 1, 4096]
    - [120, 1.01]
  - - [1024, 128, 1, 512]
    - [114, 0.57]
  - - [1024, 128, 1, 1024]
    - [114, 0.75]
  - - [1024, 128, 1, 2048]
    - [69, 0.88]
  - - [2048, 128, 1, 512]
    - [121, 0.7]
  - - [2048, 128, 1, 1024]
    - [112, 1.06]
  - - [4096, 128, 1, 128]
    - [49, 0.49]
  - - [4096, 128, 1, 256]
    - [112, 0.74]
  - - [4096, 128, 1, 512]
    - [112, 1.04]
  - - [8192, 128, 1, 64]
    - [96, 0.44]
  - - [8192, 128, 1, 128]
    - [122, 0.68]
  - - [8192, 128, 1, 256]
    - [113, 0.94]
  - - [64, 256, 1, 8192]
    - [123, 0.57]
  - - [128, 256, 1, 2048]
    - [124, 0.62]
  - - [128, 256, 1, 4096]
    - [112, 0.98]
  - - [256, 256, 1, 1024]
    - [50, 0.56]
  - - [256, 256, 1, 2048]
    - [118, 0.72]
  - - [512, 256, 1, 512]
    - [77, 0.57]
  - - [512, 256, 1, 1024]
    - [77, 0.78]
  - - [512, 256, 1, 2048]
    - [112, 1.0]
  - - [1024, 256, 1, 256]
    - [125, 0.48]
  - - [1024, 256, 1, 1024]
    - [116, 1.01]
  - - [2048, 256, 1, 256]
    - [92, 0.68]
  - - [2048, 256, 1, 512]
    - [69, 0.97]
  - - [4096, 256, 1, 64]
    - [92, 0.39]
  - - [4096, 256, 1, 128]
    - [114, 0.66]
  - - [4096, 256, 1, 256]
    - [113, 1.0]
  - - [8192, 256, 1, 64]
    - [96, 0.32]
  - - [8192, 256, 1, 128]
    - [96, 0.4]
  - - [64, 384, 1, 2048]
    - [124, 0.68]
  - - [64, 384, 1, 8192]
    - [126, 0.82]
  - - [128, 384, 1, 1024]
    - [120, 0.36]
  - - [128, 384, 1, 2048]
    - [112, 0.57]
  - - [128, 384, 1, 4096]
    - [127, 0.72]
  - - [128, 384, 1, 8192]
    - [77, 0.93]
  - - [256, 384, 1, 512]
    - [114, 0.46]
  - - [256, 384, 1, 1024]
    - [114, 0.7]
  - - [256, 384, 1, 4096]
    - [113, 1.22]
  - - [512, 384, 1, 512]
    - [114, 0.74]
  - - [512, 384, 1, 1024]
    - [116, 0.87]
  - - [1024, 384, 1, 128]
    - [128, 0.37]
  - - [1024, 384, 1, 512]
    - [116, 0.93]
  - - [1024, 384, 1, 1024]
    - [113, 1.22]
  - - [2048, 384, 1, 64]
    - [49, 0.37]
  - - [2048, 384, 1, 128]
    - [49, 0.54]
  - - [2048, 384, 1, 256]
    - [96, 0.88]
  - - [2048, 384, 1, 512]
    - [92, 1.07]
  - - [4096, 384, 1, 64]
    - [113, 0.5]
  - - [4096, 384, 1, 256]
    - [113, 1.17]
  - - [8192, 384, 1, 16]
    - [129, 0.15]
  - - [8192, 384, 1, 64]
    - [92, 0.35]
  - - [8192, 384, 1, 128]
    - [92, 0.43]
  - - [16, 768, 1, 8192]
    - [68, 0.31]
  - - [64, 768, 1, 1024]
    - [120, 0.61]
  - - [64, 768, 1, 4096]
    - [130, 0.84]
  - - [64, 768, 1, 8192]
    - [131, 1.26]
  - - [128, 768, 1, 512]
    - [122, 0.46]
  - - [128, 768, 1, 1024]
    - [75, 0.63]
  - - [128, 768, 1, 2048]
    - [127, 0.97]
  - - [128, 768, 1, 4096]
    - [113, 1.13]
  - - [256, 768, 1, 256]
    - [49, 0.41]
  - - [256, 768, 1, 512]
    - [122, 0.7]
  - - [256, 768, 1, 2048]
    - [49, 1.05]
  - - [512, 768, 1, 256]
    - [116, 0.61]
  - - [512, 768, 1, 512]
    - [128, 0.92]
  - - [1024, 768, 1, 64]
    - [128, 0.38]
  - - [1024, 768, 1, 256]
    - [73, 0.9]
  - - [1024, 768, 1, 512]
    - [96, 1.11]
  - - [2048, 768, 1, 64]
    - [114, 0.55]
  - - [2048, 768, 1, 128]
    - [132, 0.81]
  - - [2048, 768, 1, 256]
    - [127, 1.16]
  - - [4096, 768, 1, 16]
    - [129, 0.15]
  - - [4096, 768, 1, 128]
    - [92, 0.44]
  - - [8192, 768, 1, 16]
    - [96, 0.18]
  - - [8192, 768, 1, 64]
    - [129, 0.4]
  - - [16, 1536, 1, 4096]
    - [112, 0.37]
  - - [64, 1536, 1, 512]
    - [133, 0.41]
  - - [64, 1536, 1, 1024]
    - [112, 0.59]
  - - [64, 1536, 1, 2048]
    - [113, 0.88]
  - - [64, 1536, 1, 4096]
    - [132, 1.3]
  - - [128, 1536, 1, 256]
    - [134, 0.43]
  - - [128, 1536, 1, 1024]
    - [77, 0.84]
  - - [128, 1536, 1, 2048]
    - [113, 1.14]
  - - [256, 1536, 1, 128]
    - [116, 0.41]
  - - [256, 1536, 1, 256]
    - [114, 0.6]
  - - [256, 1536, 1, 512]
    - [135, 0.89]
  - - [512, 1536, 1, 128]
    - [128, 0.55]
  - - [512, 1536, 1, 256]
    - [113, 0.9]
  - - [512, 1536, 1, 512]
    - [113, 1.2]
  - - [1024, 1536, 1, 64]
    - [127, 0.56]
  - - [1024, 1536, 1, 256]
    - [114, 1.46]
  - - [2048, 1536, 1, 16]
    - [96, 0.15]
  - - [2048, 1536, 1, 64]
    - [92, 0.35]
  - - [2048, 1536, 1, 128]
    - [92, 0.44]
  - - [4096, 1536, 1, 16]
    - [95, 0.19]
  - - [4096, 1536, 1, 64]
    - [96, 0.4]
  - - [8192, 1536, 1, 4]
    - [129, 0.07]
  - - [8192, 1536, 1, 16]
    - [95, 0.23]
  - - [16, 3072, 1, 2048]
    - [120, 0.28]
  - - [16, 3072, 1, 8192]
    - [128, 0.3]
  - - [64, 3072, 1, 256]
    - [136, 0.53]
  - - [64, 3072, 1, 512]
    - [128, 0.67]
  - - [64, 3072, 1, 1024]
    - [125, 0.81]
  - - [64, 3072, 1, 2048]
    - [73, 1.07]
  - - [128, 3072, 1, 128]
    - [137, 0.37]
  - - [128, 3072, 1, 512]
    - [135, 0.82]
  - - [128, 3072, 1, 1024]
    - [113, 1.12]
  - - [256, 3072, 1, 64]
    - [128, 0.4]
  - - [256, 3072, 1, 128]
    - [114, 0.63]
  - - [256, 3072, 1, 256]
    - [116, 0.91]
  - - [512, 3072, 1, 64]
    - [122, 0.53]
  - - [512, 3072, 1, 128]
    - [112, 0.81]
  - - [512, 3072, 1, 256]
    - [120, 1.16]
  - - [1024, 3072, 1, 128]
    - [92, 0.43]
  - - [2048, 3072, 1, 16]
    - [95, 0.19]
  - - [2048, 3072, 1, 64]
    - [96, 0.4]
  - - [4096, 3072, 1, 4]
    - [129, 0.07]
  - - [4096, 3072, 1, 16]
    - [95, 0.24]
  - - [8192, 3072, 1, 2]
    - [129, 0.05]
  - - [8192, 3072, 1, 4]
    - [129, 0.09]
  - - [8192, 3072, 1, 16]
    - [109, 0.29]
  - - [16, 6144, 1, 512]
    - [113, 0.25]
  - - [16, 6144, 1, 1024]
    - [114, 0.34]
  - - [16, 6144, 1, 2048]
    - [67, 0.26]
  - - [16, 6144, 1, 4096]
    - [49, 0.31]
  - - [64, 6144, 1, 128]
    - [138, 0.48]
  - - [64, 6144, 1, 512]
    - [73, 0.78]
  - - [64, 6144, 1, 1024]
    - [112, 1.19]
  - - [128, 6144, 1, 64]
    - [116, 0.38]
  - - [128, 6144, 1, 128]
    - [125, 0.57]
  - - [128, 6144, 1, 256]
    - [92, 0.83]
  - - [256, 6144, 1, 64]
    - [128, 0.56]
  - - [256, 6144, 1, 128]
    - [113, 0.82]
  - - [256, 6144, 1, 256]
    - [114, 1.23]
  - - [512, 6144, 1, 128]
    - [92, 0.43]
  - - [1024, 6144, 1, 16]
    - [129, 0.19]
  - - [1024, 6144, 1, 64]
    - [96, 0.4]
  - - [2048, 6144, 1, 4]
    - [95, 0.07]
  - - [2048, 6144, 1, 16]
    - [95, 0.23]
  - - [4096, 6144, 1, 2]
    - [139, 0.04]
  - - [4096, 6144, 1, 4]
    - [129, 0.09]
  - - [4096, 6144, 1, 16]
    - [139, 0.27]
  - - [8192, 6144, 1, 1]
    - [129, 0.02]
  - - [8192, 6144, 1, 4]
    - [129, 0.06]
  - - [1024, 16, 1, 4096]
    - [141, 0.28]
  - - [1024, 16, 1, 8192]
    - [142, 0.48]
  - - [2048, 16, 1, 2048]
    - [143, 0.32]
  - - [2048, 16, 1, 4096]
    - [144, 0.52]
  - - [2048, 16, 1, 8192]
    - [145, 0.47]
  - - [4096, 16, 1, 1024]
    - [143, 0.31]
  - - [4096, 16, 1, 2048]
    - [144, 0.45]
  - - [4096, 16, 1, 4096]
    - [146, 0.43]
  - - [8192, 16, 1, 2048]
    - [146, 0.41]
  - - [1, 1, 1, 1]
    - [147, 0.0]
  - - [1, 1, 1, 64]
    - [148, 0.0]
  - - [1, 1, 1, 1024]
    - [149, 0.0]
  - - [1, 1, 1, 8192]
    - [149, 0.0]
  - - [16, 1, 1, 1]
    - [150, 0.0]
  - - [16, 1, 1, 256]
    - [149, 0.0]
  - - [16, 1, 1, 4096]
    - [151, 0.0]
  - - [256, 1, 1, 16]
    - [152, 0.0]
  - - [256, 1, 1, 1024]
    - [153, 0.01]
  - - [1024, 1, 1, 1]
    - [154, 0.0]
  - - [1024, 1, 1, 64]
    - [152, 0.01]
  - - [4096, 1, 1, 1]
    - [155, 0.0]
  - - [4096, 1, 1, 16]
    - [156, 0.01]
  - - [8192, 1, 1, 1]
    - [157, 0.0]
  - - [8192, 1, 1, 16]
    - [155, 0.01]
  - - [1, 16, 1, 1]
    - [156, 0.0]
  - - [1, 16, 1, 256]
    - [158, 0.0]
  - - [1, 16, 1, 4096]
    - [159, 0.0]
  - - [1, 64, 1, 1]
    - [160, 0.0]
  - - [1, 64, 1, 64]
    - [161, 0.0]
  - - [1, 64, 1, 1024]
    - [162, 0.0]
  - - [1, 256, 1, 1]
    - [150, 0.0]
  - - [1, 256, 1, 64]
    - [145, 0.0]
  - - [1, 768, 1, 1]
    - [163, 0.0]
  - - [1, 768, 1, 64]
    - [145, 0.01]
  - - [1, 3072, 1, 1]
    - [157, 0.0]
  - - [1, 3072, 1, 16]
    - [156, 0.01]
  - - [1, 6144, 1, 1]
    - [156, 0.0]
  - - [1, 6144, 1, 16]
    - [155, 0.01]
  - - [16, 16, 1, 1]
    - [157, 0.0]
  - - [16, 16, 1, 256]
    - [149, 0.01]
  - - [128, 16, 1, 16]
    - [145, 0.01]
  - - [128, 16, 1, 1024]
    - [84, 0.1]
  - - [1024, 16, 1, 1]
    - [164, 0.0]
  - - [1024, 16, 1, 64]
    - [165, 0.17]
  - - [4096, 16, 1, 1]
    - [155, 0.01]
  - - [4096, 16, 1, 16]
    - [164, 0.16]
  - - [8192, 16, 1, 1]
    - [155, 0.02]
  - - [8192, 16, 1, 16]
    - [157, 0.23]
  - - [16, 64, 1, 1]
    - [166, 0.0]
  - - [16, 64, 1, 256]
    - [167, 0.03]
  - - [16, 64, 1, 4096]
    - [168, 0.05]
  - - [64, 64, 1, 1]
    - [169, 0.0]
  - - [64, 64, 1, 128]
    - [170, 0.08]
  - - [256, 64, 1, 16]
    - [171, 0.05]
  - - [512, 64, 1, 1]
    - [171, 0.01]
  - - [1024, 64, 1, 16]
    - [95, 0.19]
  - - [4096, 64, 1, 1]
    - [97, 0.03]
  - - [16, 128, 1, 1]
    - [166, 0.0]
  - - [16, 128, 1, 256]
    - [170, 0.06]
  - - [16, 128, 1, 4096]
    - [167, 0.1]
  - - [128, 128, 1, 1]
    - [172, 0.0]
  - - [128, 128, 1, 64]
    - [167, 0.19]
  - - [16, 256, 1, 1]
    - [157, 0.0]
  - - [64, 256, 1, 16]
    - [171, 0.06]
  - - [256, 256, 1, 1]
    - [97, 0.01]
  - - [16, 384, 1, 1]
    - [173, 0.0]
  - - [64, 384, 1, 16]
    - [174, 0.08]
  - - [256, 384, 1, 1]
    - [97, 0.02]
  - - [512, 384, 1, 16]
    - [50, 0.44]
  - - [16, 768, 1, 1]
    - [147, 0.0]
  - - [64, 768, 1, 1]
    - [101, 0.01]
  - - [128, 768, 1, 16]
    - [50, 0.27]
  - - [16, 1536, 1, 1]
    - [147, 0.0]
  - - [64, 1536, 1, 16]
    - [101, 0.28]
  - - [16, 3072, 1, 1]
    - [157, 0.01]
  - - [64, 3072, 1, 1]
    - [95, 0.03]
  - - [16, 6144, 1, 1]
    - [175, 0.01]
  - - [64, 6144, 1, 1]
    - [95, 0.05]
  - - [1024, 12288, 1, 1]
    - [176, 0.04]
  - - [1024, 16, 1, 1024]
    - [177, 0.61]
  - - [1024, 16, 1, 128]
    - [177, 0.27]
  - - [1024, 16, 1, 16]
    - [156, 0.05]
  - - [1024, 16, 1, 2048]
    - [177, 0.68]
  - - [1024, 16, 1, 256]
    - [174, 0.38]
  - - [1024, 16, 1, 512]
    - [150, 0.5]
  - - [128, 16, 1, 1]
    - [161, 0.0]
  - - [128, 16, 1, 128]
    - [161, 0.04]
  - - [128, 16, 1, 2048]
    - [178, 0.12]
  - - [128, 16, 1, 256]
    - [158, 0.06]
  - - [128, 16, 1, 4096]
    - [178, 0.13]
  - - [128, 16, 1, 512]
    - [84, 0.08]
  - - [128, 16, 1, 64]
    - [179, 0.02]
  - - [128, 16, 1, 8192]
    - [178, 0.13]
  - - [16, 16, 1, 1024]
    - [84, 0.01]
  - - [16, 16, 1, 128]
    - [178, 0.0]
  - - [16, 16, 1, 16]
    - [152, 0.0]
  - - [16, 16, 1, 2048]
    - [149, 0.02]
  - - [16, 16, 1, 4096]
    - [178, 0.02]
  - - [16, 16, 1, 512]
    - [148, 0.01]
  - - [16, 16, 1, 64]
    - [161, 0.0]
  - - [16, 16, 1, 8192]
    - [149, 0.02]
  - - [1, 16, 1, 1024]
    - [178, 0.0]
  - - [1, 16, 1, 128]
    - [152, 0.0]
  - - [1, 16, 1, 16]
    - [174, 0.0]
  - - [1, 16, 1, 2048]
    - [149, 0.0]
  - - [1, 16, 1, 512]
    - [158, 0.0]
  - - [1, 16, 1, 64]
    - [161, 0.0]
  - - [1, 16, 1, 8192]
    - [149, 0.0]
  - - [2048, 16, 1, 1]
    - [180, 0.01]
  - - [2048, 16, 1, 1024]
    - [156, 0.88]
  - - [2048, 16, 1, 128]
    - [156, 0.46]
  - - [2048, 16, 1, 16]
    - [157, 0.09]
  - - [2048, 16, 1, 256]
    - [156, 0.58]
  - - [2048, 16, 1, 512]
    - [174, 0.77]
  - - [2048, 16, 1, 64]
    - [157, 0.29]
  - - [256, 16, 1, 1]
    - [157, 0.0]
  - - [256, 16, 1, 1024]
    - [158, 0.21]
  - - [256, 16, 1, 128]
    - [161, 0.08]
  - - [256, 16, 1, 16]
    - [161, 0.01]
  - - [256, 16, 1, 2048]
    - [84, 0.23]
  - - [256, 16, 1, 256]
    - [148, 0.12]
  - - [256, 16, 1, 4096]
    - [84, 0.25]
  - - [256, 16, 1, 512]
    - [158, 0.17]
  - - [256, 16, 1, 64]
    - [179, 0.04]
  - - [256, 16, 1, 8192]
    - [84, 0.25]
  - - [4096, 16, 1, 128]
    - [174, 0.59]
  - - [4096, 16, 1, 256]
    - [174, 0.81]
  - - [4096, 16, 1, 512]
    - [174, 0.92]
  - - [4096, 16, 1, 64]
    - [156, 0.45]
  - - [512, 16, 1, 1]
    - [158, 0.0]
  - - [512, 16, 1, 1024]
    - [158, 0.35]
  - - [512, 16, 1, 128]
    - [174, 0.14]
  - - [512, 16, 1, 16]
    - [156, 0.02]
  - - [512, 16, 1, 2048]
    - [158, 0.41]
  - - [512, 16, 1, 256]
    - [148, 0.21]
  - - [512, 16, 1, 4096]
    - [158, 0.44]
  - - [512, 16, 1, 512]
    - [158, 0.29]
  - - [512, 16, 1, 64]
    - [174, 0.09]
  - - [64, 16, 1, 1]
    - [180, 0.0]
  - - [64, 16, 1, 1024]
    - [148, 0.05]
  - - [64, 16, 1, 128]
    - [152, 0.02]
  - - [64, 16, 1, 16]
    - [154, 0.0]
  - - [64, 16, 1, 2048]
    - [178, 0.06]
  - - [64, 16, 1, 256]
    - [149, 0.03]
  - - [64, 16, 1, 4096]
    - [84, 0.06]
  - - [64, 16, 1, 512]
    - [84, 0.04]
  - - [64, 16, 1, 64]
    - [161, 0.01]
  - - [64, 16, 1, 8192]
    - [178, 0.06]
  - - [8192, 16, 1, 128]
    - [180, 0.75]
  - - [8192, 16, 1, 256]
    - [157, 0.89]
  - - [8192, 16, 1, 64]
    - [157, 0.58]
  - - [1024, 1, 1, 1024]
    - [148, 0.04]
  - - [1024, 1, 1, 128]
    - [148, 0.02]
  - - [1024, 1, 1, 16]
    - [154, 0.0]
  - - [1024, 1, 1, 2048]
    - [148, 0.05]
  - - [1024, 1, 1, 256]
    - [148, 0.02]
  - - [1024, 1, 1, 4096]
    - [158, 0.05]
  - - [1024, 1, 1, 512]
    - [148, 0.04]
  - - [1024, 1, 1, 8192]
    - [158, 0.05]
  - - [128, 1, 1, 1]
    - [148, 0.0]
  - - [128, 1, 1, 1024]
    - [158, 0.01]
  - - [128, 1, 1, 128]
    - [152, 0.0]
  - - [128, 1, 1, 16]
    - [154, 0.0]
  - - [128, 1, 1, 2048]
    - [84, 0.01]
  - - [128, 1, 1, 256]
    - [158, 0.0]
  - - [128, 1, 1, 4096]
    - [178, 0.01]
  - - [128, 1, 1, 512]
    - [149, 0.01]
  - - [128, 1, 1, 64]
    - [179, 0.0]
  - - [128, 1, 1, 8192]
    - [178, 0.01]
  - - [16, 1, 1, 1024]
    - [158, 0.0]
  - - [16, 1, 1, 128]
    - [152, 0.0]
  - - [16, 1, 1, 16]
    - [161, 0.0]
  - - [16, 1, 1, 2048]
    - [149, 0.0]
  - - [16, 1, 1, 512]
    - [84, 0.0]
  - - [16, 1, 1, 64]
    - [179, 0.0]
  - - [16, 1, 1, 8192]
    - [149, 0.0]
  - - [1, 1, 1, 128]
    - [178, 0.0]
  - - [1, 1, 1, 16]
    - [154, 0.0]
  - - [1, 1, 1, 2048]
    - [149, 0.0]
  - - [1, 1, 1, 256]
    - [84, 0.0]
  - - [1, 1, 1, 4096]
    - [149, 0.0]
  - - [1, 1, 1, 512]
    - [149, 0.0]
  - - [2048, 1, 1, 1]
    - [156, 0.0]
  - - [2048, 1, 1, 1024]
    - [179, 0.06]
  - - [2048, 1, 1, 128]
    - [156, 0.03]
  - - [2048, 1, 1, 16]
    - [157, 0.01]
  - - [2048, 1, 1, 2048]
    - [179, 0.06]
  - - [2048, 1, 1, 256]
    - [180, 0.03]
  - - [2048, 1, 1, 4096]
    - [179, 0.06]
  - - [2048, 1, 1, 512]
    - [180, 0.05]
  - - [2048, 1, 1, 64]
    - [174, 0.02]
  - - [2048, 1, 1, 8192]
    - [161, 0.04]
  - - [256, 1, 1, 1]
    - [154, 0.0]
  - - [256, 1, 1, 128]
    - [152, 0.0]
  - - [256, 1, 1, 2048]
    - [84, 0.01]
  - - [256, 1, 1, 256]
    - [149, 0.01]
  - - [256, 1, 1, 4096]
    - [178, 0.02]
  - - [256, 1, 1, 512]
    - [148, 0.01]
  - - [256, 1, 1, 64]
    - [161, 0.0]
  - - [256, 1, 1, 8192]
    - [178, 0.02]
  - - [4096, 1, 1, 1024]
    - [152, 0.06]
  - - [4096, 1, 1, 128]
    - [174, 0.04]
  - - [4096, 1, 1, 2048]
    - [180, 0.06]
  - - [4096, 1, 1, 256]
    - [180, 0.05]
  - - [4096, 1, 1, 4096]
    - [174, 0.04]
  - - [4096, 1, 1, 512]
    - [174, 0.06]
  - - [4096, 1, 1, 64]
    - [157, 0.03]
  - - [4096, 1, 1, 8192]
    - [174, 0.04]
  - - [512, 1, 1, 1]
    - [177, 0.0]
  - - [512, 1, 1, 1024]
    - [178, 0.02]
  - - [512, 1, 1, 128]
    - [158, 0.01]
  - - [512, 1, 1, 16]
    - [161, 0.0]
  - - [512, 1, 1, 2048]
    - [178, 0.03]
  - - [512, 1, 1, 256]
    - [148, 0.01]
  - - [512, 1, 1, 4096]
    - [84, 0.03]
  - - [512, 1, 1, 512]
    - [158, 0.02]
  - - [512, 1, 1, 64]
    - [161, 0.01]
  - - [512, 1, 1, 8192]
    - [178, 0.03]
  - - [64, 1, 1, 1]
    - [152, 0.0]
  - - [64, 1, 1, 1024]
    - [84, 0.0]
  - - [64, 1, 1, 128]
    - [84, 0.0]
  - - [64, 1, 1, 16]
    - [157, 0.0]
  - - [64, 1, 1, 2048]
    - [84, 0.0]
  - - [64, 1, 1, 256]
    - [149, 0.0]
  - - [64, 1, 1, 4096]
    - [158, 0.0]
  - - [64, 1, 1, 512]
    - [158, 0.0]
  - - [64, 1, 1, 64]
    - [179, 0.0]
  - - [64, 1, 1, 8192]
    - [178, 0.0]
  - - [8192, 1, 1, 1024]
    - [152, 0.07]
  - - [8192, 1, 1, 128]
    - [180, 0.04]
  - - [8192, 1, 1, 2048]
    - [157, 0.03]
  - - [8192, 1, 1, 256]
    - [179, 0.06]
  - - [8192, 1, 1, 4096]
    - [157, 0.03]
  - - [8192, 1, 1, 512]
    - [157, 0.06]
  - - [8192, 1, 1, 64]
    - [157, 0.04]
  - - [1024, 12288, 1, 2]
    - [181, 0.07]
  - - [2048, 12288, 1, 1]
    - [181, 0.04]
  - - [1024, 128, 1, 1]
    - [95, 0.02]
  - - [1024, 128, 1, 128]
    - [50, 1.3]
  - - [1024, 128, 1, 16]
    - [50, 0.3]
  - - [1024, 128, 1, 256]
    - [50, 1.6]
  - - [1024, 128, 1, 64]
    - [50, 0.88]
  - - [128, 128, 1, 1024]
    - [167, 0.66]
  - - [128, 128, 1, 128]
    - [167, 0.3]
  - - [128, 128, 1, 16]
    - [156, 0.06]
  - - [128, 128, 1, 2048]
    - [167, 0.72]
  - - [128, 128, 1, 256]
    - [170, 0.44]
  - - [128, 128, 1, 512]
    - [167, 0.56]
  - - [16, 128, 1, 1024]
    - [182, 0.09]
  - - [16, 128, 1, 128]
    - [177, 0.04]
  - - [16, 128, 1, 16]
    - [156, 0.01]
  - - [16, 128, 1, 2048]
    - [182, 0.1]
  - - [16, 128, 1, 512]
    - [182, 0.07]
  - - [16, 128, 1, 64]
    - [183, 0.02]
  - - [16, 128, 1, 8192]
    - [182, 0.1]
  - - [1, 128, 1, 1]
    - [157, 0.0]
  - - [1, 128, 1, 1024]
    - [182, 0.01]
  - - [1, 128, 1, 128]
    - [170, 0.0]
  - - [1, 128, 1, 16]
    - [156, 0.0]
  - - [1, 128, 1, 2048]
    - [182, 0.01]
  - - [1, 128, 1, 256]
    - [167, 0.0]
  - - [1, 128, 1, 4096]
    - [182, 0.01]
  - - [1, 128, 1, 512]
    - [182, 0.0]
  - - [1, 128, 1, 64]
    - [174, 0.0]
  - - [1, 128, 1, 8192]
    - [182, 0.01]
  - - [2048, 128, 1, 1]
    - [95, 0.03]
  - - [2048, 128, 1, 128]
    - [50, 1.62]
  - - [2048, 128, 1, 16]
    - [184, 0.43]
  - - [2048, 128, 1, 64]
    - [97, 1.28]
  - - [256, 128, 1, 1]
    - [157, 0.01]
  - - [256, 128, 1, 1024]
    - [170, 0.94]
  - - [256, 128, 1, 128]
    - [167, 0.49]
  - - [256, 128, 1, 16]
    - [174, 0.1]
  - - [256, 128, 1, 256]
    - [167, 0.66]
  - - [256, 128, 1, 512]
    - [167, 0.83]
  - - [256, 128, 1, 64]
    - [183, 0.32]
  - - [4096, 128, 1, 1]
    - [95, 0.05]
  - - [4096, 128, 1, 16]
    - [95, 0.58]
  - - [4096, 128, 1, 64]
    - [95, 1.5]
  - - [512, 128, 1, 1]
    - [95, 0.01]
  - - [512, 128, 1, 128]
    - [50, 0.85]
  - - [512, 128, 1, 16]
    - [157, 0.17]
  - - [512, 128, 1, 256]
    - [97, 1.17]
  - - [512, 128, 1, 512]
    - [50, 1.4]
  - - [512, 128, 1, 64]
    - [50, 0.58]
  - - [64, 128, 1, 1]
    - [156, 0.0]
  - - [64, 128, 1, 1024]
    - [182, 0.35]
  - - [64, 128, 1, 128]
    - [182, 0.15]
  - - [64, 128, 1, 16]
    - [156, 0.03]
  - - [64, 128, 1, 2048]
    - [182, 0.4]
  - - [64, 128, 1, 256]
    - [150, 0.22]
  - - [64, 128, 1, 4096]
    - [182, 0.4]
  - - [64, 128, 1, 512]
    - [182, 0.29]
  - - [64, 128, 1, 64]
    - [167, 0.09]
  - - [8192, 128, 1, 1]
    - [97, 0.06]
  - - [8192, 128, 1, 16]
    - [97, 0.78]
  - - [1024, 1536, 1, 1]
    - [95, 0.07]
  - - [1024, 1536, 1, 16]
    - [95, 0.88]
  - - [128, 1536, 1, 1]
    - [184, 0.03]
  - - [128, 1536, 1, 128]
    - [50, 1.59]
  - - [128, 1536, 1, 16]
    - [184, 0.37]
  - - [128, 1536, 1, 64]
    - [50, 1.18]
  - - [16, 1536, 1, 1024]
    - [177, 0.69]
  - - [16, 1536, 1, 128]
    - [177, 0.4]
  - - [16, 1536, 1, 16]
    - [157, 0.08]
  - - [16, 1536, 1, 256]
    - [177, 0.55]
  - - [16, 1536, 1, 512]
    - [177, 0.51]
  - - [16, 1536, 1, 64]
    - [156, 0.26]
  - - [1, 1536, 1, 1]
    - [156, 0.0]
  - - [1, 1536, 1, 1024]
    - [177, 0.04]
  - - [1, 1536, 1, 128]
    - [150, 0.02]
  - - [1, 1536, 1, 16]
    - [156, 0.0]
  - - [1, 1536, 1, 2048]
    - [150, 0.05]
  - - [1, 1536, 1, 256]
    - [150, 0.03]
  - - [1, 1536, 1, 4096]
    - [177, 0.05]
  - - [1, 1536, 1, 512]
    - [177, 0.03]
  - - [1, 1536, 1, 64]
    - [177, 0.02]
  - - [1, 1536, 1, 8192]
    - [180, 0.03]
  - - [2048, 1536, 1, 1]
    - [95, 0.09]
  - - [256, 1536, 1, 1]
    - [95, 0.04]
  - - [256, 1536, 1, 16]
    - [95, 0.52]
  - - [256, 1536, 1, 64]
    - [95, 1.41]
  - - [4096, 1536, 1, 1]
    - [95, 0.1]
  - - [4096, 1536, 1, 2]
    - [95, 0.2]
  - - [4096, 1536, 1, 4]
    - [95, 0.39]
  - - [512, 1536, 1, 1]
    - [184, 0.05]
  - - [512, 1536, 1, 16]
    - [181, 0.66]
  - - [64, 1536, 1, 1]
    - [50, 0.02]
  - - [64, 1536, 1, 128]
    - [97, 1.15]
  - - [64, 1536, 1, 256]
    - [97, 1.46]
  - - [64, 1536, 1, 64]
    - [181, 0.77]
  - - [8192, 1536, 1, 1]
    - [171, 0.04]
  - - [8192, 1536, 1, 2]
    - [176, 0.07]
  - - [1024, 256, 1, 1]
    - [97, 0.03]
  - - [1024, 256, 1, 128]
    - [97, 1.64]
  - - [1024, 256, 1, 16]
    - [95, 0.43]
  - - [1024, 256, 1, 64]
    - [97, 1.25]
  - - [128, 256, 1, 1]
    - [157, 0.01]
  - - [128, 256, 1, 1024]
    - [167, 0.94]
  - - [128, 256, 1, 128]
    - [167, 0.5]
  - - [128, 256, 1, 16]
    - [174, 0.1]
  - - [128, 256, 1, 256]
    - [167, 0.69]
  - - [128, 256, 1, 512]
    - [167, 0.82]
  - - [128, 256, 1, 64]
    - [183, 0.32]
  - - [16, 256, 1, 1024]
    - [182, 0.18]
  - - [16, 256, 1, 128]
    - [156, 0.08]
  - - [16, 256, 1, 16]
    - [156, 0.01]
  - - [16, 256, 1, 2048]
    - [182, 0.19]
  - - [16, 256, 1, 256]
    - [170, 0.11]
  - - [16, 256, 1, 4096]
    - [182, 0.2]
  - - [16, 256, 1, 512]
    - [167, 0.14]
  - - [16, 256, 1, 64]
    - [172, 0.05]
  - - [16, 256, 1, 8192]
    - [182, 0.2]
  - - [1, 256, 1, 1024]
    - [182, 0.01]
  - - [1, 256, 1, 128]
    - [182, 0.0]
  - - [1, 256, 1, 16]
    - [174, 0.0]
  - - [1, 256, 1, 2048]
    - [182, 0.01]
  - - [1, 256, 1, 256]
    - [170, 0.01]
  - - [1, 256, 1, 4096]
    - [182, 0.01]
  - - [1, 256, 1, 512]
    - [182, 0.01]
  - - [1, 256, 1, 8192]
    - [182, 0.01]
  - - [2048, 256, 1, 1]
    - [95, 0.04]
  - - [2048, 256, 1, 16]
    - [95, 0.57]
  - - [2048, 256, 1, 64]
    - [95, 1.51]
  - - [256, 256, 1, 128]
    - [97, 0.86]
  - - [256, 256, 1, 16]
    - [95, 0.19]
  - - [256, 256, 1, 256]
    - [50, 1.15]
  - - [256, 256, 1, 512]
    - [97, 1.4]
  - - [256, 256, 1, 64]
    - [131, 0.55]
  - - [4096, 256, 1, 1]
    - [97, 0.06]
  - - [4096, 256, 1, 16]
    - [184, 0.78]
  - - [512, 256, 1, 1]
    - [95, 0.02]
  - - [512, 256, 1, 128]
    - [97, 1.29]
  - - [512, 256, 1, 16]
    - [176, 0.3]
  - - [512, 256, 1, 256]
    - [50, 1.59]
  - - [512, 256, 1, 64]
    - [97, 0.88]
  - - [64, 256, 1, 1]
    - [157, 0.0]
  - - [64, 256, 1, 1024]
    - [167, 0.66]
  - - [64, 256, 1, 128]
    - [170, 0.31]
  - - [64, 256, 1, 2048]
    - [185, 0.71]
  - - [64, 256, 1, 256]
    - [167, 0.44]
  - - [64, 256, 1, 512]
    - [167, 0.56]
  - - [64, 256, 1, 64]
    - [177, 0.18]
  - - [8192, 256, 1, 1]
    - [95, 0.08]
  - - [8192, 256, 1, 16]
    - [95, 0.94]
  - - [1024, 3072, 1, 1]
    - [95, 0.09]
  - - [128, 3072, 1, 1]
    - [95, 0.05]
  - - [128, 3072, 1, 16]
    - [95, 0.55]
  - - [128, 3072, 1, 64]
    - [95, 1.41]
  - - [16, 3072, 1, 128]
    - [180, 0.6]
  - - [16, 3072, 1, 16]
    - [157, 0.14]
  - - [16, 3072, 1, 256]
    - [180, 0.59]
  - - [16, 3072, 1, 512]
    - [150, 0.63]
  - - [16, 3072, 1, 64]
    - [157, 0.39]
  - - [1, 3072, 1, 1024]
    - [150, 0.05]
  - - [1, 3072, 1, 128]
    - [180, 0.04]
  - - [1, 3072, 1, 2048]
    - [180, 0.05]
  - - [1, 3072, 1, 256]
    - [180, 0.04]
  - - [1, 3072, 1, 4096]
    - [177, 0.02]
  - - [1, 3072, 1, 512]
    - [150, 0.04]
  - - [1, 3072, 1, 64]
    - [180, 0.02]
  - - [1, 3072, 1, 8192]
    - [177, 0.03]
  - - [2048, 3072, 1, 1]
    - [95, 0.11]
  - - [2048, 3072, 1, 2]
    - [95, 0.2]
  - - [2048, 3072, 1, 4]
    - [95, 0.39]
  - - [256, 3072, 1, 1]
    - [184, 0.05]
  - - [256, 3072, 1, 16]
    - [184, 0.68]
  - - [4096, 3072, 1, 1]
    - [176, 0.04]
  - - [4096, 3072, 1, 2]
    - [176, 0.08]
  - - [512, 3072, 1, 1]
    - [95, 0.07]
  - - [512, 3072, 1, 16]
    - [184, 0.89]
  - - [64, 3072, 1, 128]
    - [97, 1.55]
  - - [64, 3072, 1, 16]
    - [95, 0.43]
  - - [64, 3072, 1, 64]
    - [50, 1.26]
  - - [8192, 3072, 1, 1]
    - [171, 0.04]
  - - [1024, 384, 1, 1]
    - [184, 0.04]
  - - [1024, 384, 1, 16]
    - [95, 0.51]
  - - [1024, 384, 1, 64]
    - [95, 1.4]
  - - [128, 384, 1, 1]
    - [97, 0.01]
  - - [128, 384, 1, 128]
    - [97, 0.67]
  - - [128, 384, 1, 16]
    - [50, 0.15]
  - - [128, 384, 1, 256]
    - [97, 0.88]
  - - [128, 384, 1, 512]
    - [181, 1.06]
  - - [128, 384, 1, 64]
    - [50, 0.45]
  - - [16, 384, 1, 1024]
    - [150, 0.25]
  - - [16, 384, 1, 128]
    - [170, 0.11]
  - - [16, 384, 1, 16]
    - [156, 0.02]
  - - [16, 384, 1, 2048]
    - [185, 0.26]
  - - [16, 384, 1, 256]
    - [167, 0.16]
  - - [16, 384, 1, 4096]
    - [186, 0.28]
  - - [16, 384, 1, 512]
    - [167, 0.21]
  - - [16, 384, 1, 64]
    - [187, 0.07]
  - - [1, 384, 1, 1]
    - [157, 0.0]
  - - [1, 384, 1, 1024]
    - [167, 0.02]
  - - [1, 384, 1, 128]
    - [167, 0.01]
  - - [1, 384, 1, 16]
    - [187, 0.0]
  - - [1, 384, 1, 2048]
    - [185, 0.02]
  - - [1, 384, 1, 256]
    - [167, 0.01]
  - - [1, 384, 1, 4096]
    - [186, 0.02]
  - - [1, 384, 1, 512]
    - [170, 0.01]
  - - [1, 384, 1, 64]
    - [170, 0.0]
  - - [1, 384, 1, 8192]
    - [186, 0.02]
  - - [2048, 384, 1, 1]
    - [184, 0.05]
  - - [2048, 384, 1, 16]
    - [184, 0.69]
  - - [256, 384, 1, 128]
    - [97, 1.13]
  - - [256, 384, 1, 16]
    - [50, 0.25]
  - - [256, 384, 1, 256]
    - [97, 1.45]
  - - [256, 384, 1, 64]
    - [97, 0.75]
  - - [4096, 384, 1, 1]
    - [97, 0.07]
  - - [4096, 384, 1, 16]
    - [184, 0.88]
  - - [512, 384, 1, 1]
    - [95, 0.03]
  - - [512, 384, 1, 128]
    - [97, 1.58]
  - - [512, 384, 1, 64]
    - [50, 1.15]
  - - [64, 384, 1, 1]
    - [157, 0.01]
  - - [64, 384, 1, 1024]
    - [167, 0.84]
  - - [64, 384, 1, 128]
    - [187, 0.41]
  - - [64, 384, 1, 256]
    - [167, 0.59]
  - - [64, 384, 1, 512]
    - [167, 0.73]
  - - [64, 384, 1, 64]
    - [187, 0.26]
  - - [8192, 384, 1, 1]
    - [95, 0.09]
  - - [1024, 6144, 1, 1]
    - [95, 0.1]
  - - [1024, 6144, 1, 2]
    - [95, 0.2]
  - - [1024, 6144, 1, 4]
    - [95, 0.39]
  - - [128, 6144, 1, 1]
    - [184, 0.05]
  - - [128, 6144, 1, 16]
    - [176, 0.67]
  - - [16, 6144, 1, 128]
    - [180, 0.62]
  - - [16, 6144, 1, 16]
    - [157, 0.21]
  - - [16, 6144, 1, 256]
    - [150, 0.7]
  - - [16, 6144, 1, 64]
    - [157, 0.51]
  - - [1, 6144, 1, 1024]
    - [86, 0.05]
  - - [1, 6144, 1, 128]
    - [180, 0.04]
  - - [1, 6144, 1, 2048]
    - [177, 0.03]
  - - [1, 6144, 1, 256]
    - [150, 0.04]
  - - [1, 6144, 1, 4096]
    - [177, 0.03]
  - - [1, 6144, 1, 512]
    - [86, 0.05]
  - - [1, 6144, 1, 64]
    - [184, 0.03]
  - - [2048, 6144, 1, 1]
    - [181, 0.04]
  - - [2048, 6144, 1, 2]
    - [176, 0.07]
  - - [256, 6144, 1, 1]
    - [50, 0.07]
  - - [256, 6144, 1, 16]
    - [97, 0.86]
  - - [4096, 6144, 1, 1]
    - [176, 0.04]
  - - [512, 6144, 1, 1]
    - [95, 0.09]
  - - [64, 6144, 1, 16]
    - [95, 0.58]
  - - [64, 6144, 1, 64]
    - [95, 1.41]
  - - [1024, 64, 1, 1]
    - [184, 0.01]
  - - [1024, 64, 1, 128]
    - [181, 0.84]
  - - [1024, 64, 1, 256]
    - [50, 1.16]
  - - [1024, 64, 1, 512]
    - [97, 1.38]
  - - [1024, 64, 1, 64]
    - [97, 0.57]
  - - [128, 64, 1, 1]
    - [156, 0.0]
  - - [128, 64, 1, 1024]
    - [182, 0.35]
  - - [128, 64, 1, 128]
    - [172, 0.15]
  - - [128, 64, 1, 16]
    - [156, 0.03]
  - - [128, 64, 1, 2048]
    - [182, 0.39]
  - - [128, 64, 1, 256]
    - [167, 0.23]
  - - [128, 64, 1, 4096]
    - [185, 0.4]
  - - [128, 64, 1, 512]
    - [170, 0.29]
  - - [128, 64, 1, 64]
    - [156, 0.09]
  - - [16, 64, 1, 1024]
    - [182, 0.04]
  - - [16, 64, 1, 128]
    - [172, 0.02]
  - - [16, 64, 1, 16]
    - [156, 0.0]
  - - [16, 64, 1, 2048]
    - [182, 0.05]
  - - [16, 64, 1, 512]
    - [182, 0.04]
  - - [16, 64, 1, 64]
    - [180, 0.01]
  - - [16, 64, 1, 8192]
    - [182, 0.05]
  - - [1, 64, 1, 128]
    - [167, 0.0]
  - - [1, 64, 1, 16]
    - [156, 0.0]
  - - [1, 64, 1, 2048]
    - [182, 0.0]
  - - [1, 64, 1, 256]
    - [167, 0.0]
  - - [1, 64, 1, 4096]
    - [182, 0.0]
  - - [1, 64, 1, 512]
    - [182, 0.0]
  - - [1, 64, 1, 8192]
    - [182, 0.0]
  - - [2048, 64, 1, 1]
    - [95, 0.02]
  - - [2048, 64, 1, 128]
    - [97, 1.28]
  - - [2048, 64, 1, 16]
    - [176, 0.3]
  - - [2048, 64, 1, 256]
    - [97, 1.56]
  - - [2048, 64, 1, 64]
    - [97, 0.84]
  - - [256, 64, 1, 1]
    - [157, 0.0]
  - - [256, 64, 1, 1024]
    - [167, 0.66]
  - - [256, 64, 1, 128]
    - [170, 0.3]
  - - [256, 64, 1, 2048]
    - [167, 0.72]
  - - [256, 64, 1, 256]
    - [170, 0.44]
  - - [256, 64, 1, 512]
    - [167, 0.56]
  - - [256, 64, 1, 64]
    - [183, 0.18]
  - - [4096, 64, 1, 128]
    - [97, 1.62]
  - - [4096, 64, 1, 16]
    - [95, 0.43]
  - - [4096, 64, 1, 64]
    - [97, 1.26]
  - - [512, 64, 1, 1024]
    - [167, 0.93]
  - - [512, 64, 1, 128]
    - [167, 0.48]
  - - [512, 64, 1, 16]
    - [156, 0.1]
  - - [512, 64, 1, 256]
    - [167, 0.68]
  - - [512, 64, 1, 512]
    - [170, 0.83]
  - - [512, 64, 1, 64]
    - [183, 0.32]
  - - [64, 64, 1, 1024]
    - [182, 0.18]
  - - [64, 64, 1, 16]
    - [157, 0.01]
  - - [64, 64, 1, 2048]
    - [182, 0.2]
  - - [64, 64, 1, 256]
    - [150, 0.11]
  - - [64, 64, 1, 4096]
    - [182, 0.2]
  - - [64, 64, 1, 512]
    - [170, 0.15]
  - - [64, 64, 1, 64]
    - [177, 0.05]
  - - [64, 64, 1, 8192]
    - [182, 0.2]
  - - [8192, 64, 1, 1]
    - [95, 0.05]
  - - [8192, 64, 1, 16]
    - [95, 0.58]
  - - [8192, 64, 1, 64]
    - [95, 1.52]
  - - [1024, 768, 1, 1]
    - [184, 0.05]
  - - [1024, 768, 1, 16]
    - [184, 0.7]
  - - [128, 768, 1, 1]
    - [97, 0.02]
  - - [128, 768, 1, 128]
    - [97, 1.1]
  - - [128, 768, 1, 256]
    - [50, 1.45]
  - - [128, 768, 1, 64]
    - [50, 0.77]
  - - [16, 768, 1, 1024]
    - [150, 0.43]
  - - [16, 768, 1, 128]
    - [156, 0.22]
  - - [16, 768, 1, 16]
    - [156, 0.04]
  - - [16, 768, 1, 2048]
    - [177, 0.48]
  - - [16, 768, 1, 256]
    - [177, 0.32]
  - - [16, 768, 1, 512]
    - [177, 0.4]
  - - [16, 768, 1, 64]
    - [180, 0.14]
  - - [1, 768, 1, 1024]
    - [150, 0.03]
  - - [1, 768, 1, 128]
    - [177, 0.01]
  - - [1, 768, 1, 16]
    - [156, 0.0]
  - - [1, 768, 1, 2048]
    - [177, 0.03]
  - - [1, 768, 1, 256]
    - [150, 0.02]
  - - [1, 768, 1, 4096]
    - [177, 0.03]
  - - [1, 768, 1, 512]
    - [150, 0.02]
  - - [1, 768, 1, 8192]
    - [177, 0.03]
  - - [2048, 768, 1, 1]
    - [50, 0.07]
  - - [2048, 768, 1, 16]
    - [184, 0.9]
  - - [256, 768, 1, 1]
    - [50, 0.03]
  - - [256, 768, 1, 128]
    - [50, 1.58]
  - - [256, 768, 1, 16]
    - [95, 0.39]
  - - [256, 768, 1, 64]
    - [97, 1.16]
  - - [4096, 768, 1, 1]
    - [95, 0.09]
  - - [512, 768, 1, 1]
    - [95, 0.04]
  - - [512, 768, 1, 16]
    - [95, 0.52]
  - - [512, 768, 1, 64]
    - [95, 1.41]
  - - [64, 768, 1, 128]
    - [131, 0.65]
  - - [64, 768, 1, 16]
    - [174, 0.15]
  - - [64, 768, 1, 256]
    - [97, 0.89]
  - - [64, 768, 1, 512]
    - [50, 1.06]
  - - [64, 768, 1, 64]
    - [50, 0.45]
  - - [8192, 768, 1, 1]
    - [95, 0.1]
  - - [8192, 768, 1, 2]
    - [95, 0.2]
  - - [8192, 768, 1, 4]
    - [95, 0.38]
- null
- null
- DeviceEfficiency
- GridBased
