projects/hipblaslt/library/src/amd_detail/rocblaslt/src/Tensile/Logic/asm_full/gfx1151/GridBased/gfx1151_Cijk_Ailk_Bljk_BBS_BH_Bias_HAS_SAV_UserArgs.yaml
- {MinimumRequiredVersion: 5.0.0}
- gfx1151
- gfx1151
- [Device 1536]
    SolutionIndex: 0
    SolutionNameMin: Cijk_Ailk_Bljk_BBS_BH_Bias_HA_S_SAV_UserArgs_MT32x32x32_MI16x16x1_CMS_SN_LDSB0_AFC1_AG0_AFEM1_AFEM1_ASEM1_CLR1_CADS0_DTLA0_DTLB0_DTVA0_DTVB0_DTVSM0_DPLBn1_EPS0_ELFLR0_EMLLn1_FDSI0_GRPM1_GRVWA2_GRVWB8_GSU1_GSUAMB_GSUC0_GSUWGMRR0_GLS0_ISA1151_IU1_LDSTI0_LBSPPA1024_LBSPPB128_LBSPPM0_LPA16_LPB16_LPM0_LRVW16_LWPMn1_MIAV1_MIWT1_1_MO40_MGRIPMn1_NTn1_NTA0_NTB0_NTC0_NTD0_NTM0_NEPBS0_NLCA1_NLCB1_ONLL1_PGR2_PLR1_PKA0_SGROBn1_SIA3_SS0_SU32_SUM1_SUS256_SPO0_SRVW0_SSO0_SVW1_SK0_SKFTR0_SKXCCM0_SGRO0_TIN0_TLDS1_TLDSM1_ULSGRO0_USL1_UIOFGRO0_UPLRP0_USFGROn1_VSn1_VWA1_VWB1_WSGRA0_WSGRB0_WS32_WG32_4_1_WGM8_WGMXCC1_WGMXCCGn1
    SolutionIndex: 1
    SolutionNameMin: Cijk_Ailk_Bljk_BBS_BH_Bias_HA_S_SAV_UserArgs_MT32x32x32_MI16x16x1_CMS_SN_LDSB0_AFC1_AG0_AFEM1_AFEM1_ASEM1_CLR1_CADS0_DTLA0_DTLB0_DTVA0_DTVB0_DTVSM0_DPLBn1_EPS0_ELFLR0_EMLLn1_FDSI0_GRPM1_GRVWA2_GRVWB1_GSU1_GSUAMB_GSUC0_GSUWGMRR0_GLS0_ISA1151_IU1_LDSTI0_LBSPPA1024_LBSPPB1024_LBSPPM0_LPA16_LPB16_LPM0_LRVW16_LWPMn1_MIAV1_MIWT1_1_MO40_MGRIPMn1_NTn1_NTA0_NTB0_NTC0_NTD0_NTM0_NEPBS0_NLCA1_NLCB1_ONLL1_PGR2_PLR1_PKA0_SGROBn1_SIA3_SS0_SU32_SUM1_SUS256_SPO0_SRVW0_SSO0_SVW1_SK0_SKFTR0_SKXCCM0_SGRO0_TIN0_TLDS0_TLDSM1_ULSGRO0_USL1_UIOFGRO0_UPLRP0_USFGROn1_VSn1_VWA1_VWB1_WSGRA0_WSGRB0_WS32_WG32_4_1_WGM8_WGMXCC1_WGMXCCGn1
    SolutionIndex: 2
    SolutionNameMin: Cijk_Ailk_Bljk_BBS_BH_Bias_HA_S_SAV_UserArgs_MT16x64x32_MI16x16x1_CMS_SN_LDSB0_AFC1_AG0_AFEM1_AFEM1_ASEM1_CLR1_CADS0_DTLA0_DTLB0_DTVA0_DTVB0_DTVSM0_DPLBn1_EPS0_ELFLR0_EMLLn1_FDSI0_GRPM1_GRVWA1_GRVWB8_GSU1_GSUAMB_GSUC0_GSUWGMRR0_GLS0_ISA1151_IU1_LDSTI0_LBSPPA512_LBSPPB2048_LBSPPM0_LPA16_LPB16_LPM0_LRVW16_LWPMn1_MIAV1_MIWT1_1_MO40_MGRIPMn1_NTn1_NTA0_NTB0_NTC0_NTD0_NTM0_NEPBS0_NLCA1_NLCB1_ONLL1_PGR2_PLR1_PKA0_SGROBn1_SIA3_SS0_SU32_SUM1_SUS256_SPO0_SRVW0_SSO0_SVW1_SK0_SKFTR0_SKXCCM0_SGRO0_TIN0_TLDS0_TLDSM1_ULSGRO0_USL1_UIOFGRO0_UPLRP0_USFGROn1_VSn1_VWA1_VWB1_WSGRA0_WSGRB0_WS32_WG16_8_1_WGM8_WGMXCC1_WGMXCCGn1
    SolutionIndex: 3
    SolutionNameMin: Cijk_Ailk_Bljk_BBS_BH_Bias_HA_S_SAV_UserArgs_MT64x16x64_MI16x16x1_CMS_SN_LDSB0_AFC1_AG0_AFEM1_AFEM1_ASEM1_CLR1_CADS0_DTLA0_DTLB0_DTVA0_DTVB0_DTVSM0_DPLBn1_EPS0_ELFLR0_EMLLn1_FDSI0_GRPM1_GRVWA1_GRVWB8_GSU1_GSUAMB_GSUC0_GSUWGMRR0_GLS0_ISA1151_IU1_LDSTI0_LBSPPA2048_LBSPPB128_LBSPPM0_LPA16_LPB16_LPM0_LRVW16_LWPMn1_MIAV1_MIWT1_1_MO40_MGRIPMn1_NTn1_NTA0_NTB0_NTC0_NTD0_NTM0_NEPBS0_NLCA1_NLCB1_ONLL1_PGR2_PLR1_PKA0_SGROBn1_SIA3_SS0_SU32_SUM1_SUS256_SPO0_SRVW0_SSO0_SVW1_SK0_SKFTR0_SKXCCM0_SGRO0_TIN0_TLDS1_TLDSM1_ULSGRO0_USL1_UIOFGRO0_UPLRP0_USFGROn1_VSn1_VWA1_VWB1_WSGRA0_WSGRB0_WS32_WG64_2_1_WGM8_WGMXCC1_WGMXCCGn1
    SolutionIndex: 4
    SolutionNameMin: Cijk_Ailk_Bljk_BBS_BH_Bias_HA_S_SAV_UserArgs_MT32x32x64_MI16x16x1_CMS_SN_LDSB0_AFC1_AG0_AFEM1_AFEM1_ASEM1_CLR1_CADS0_DTLA0_DTLB0_DTVA0_DTVB0_DTVSM0_DPLBn1_EPS0_ELFLR0_EMLLn1_FDSI0_GRPM1_GRVWA1_GRVWB8_GSU1_GSUAMB_GSUC0_GSUWGMRR0_GLS0_ISA1151_IU1_LDSTI0_LBSPPA1024_LBSPPB1024_LBSPPM0_LPA16_LPB16_LPM0_LRVW16_LWPMn1_MIAV1_MIWT1_1_MO40_MGRIPMn1_NTn1_NTA0_NTB0_NTC0_NTD0_NTM0_NEPBS0_NLCA1_NLCB1_ONLL1_PGR2_PLR1_PKA0_SGROBn1_SIA3_SS0_SU32_SUM1_SUS256_SPO0_SRVW0_SSO0_SVW1_SK0_SKFTR0_SKXCCM0_SGRO0_TIN0_TLDS0_TLDSM1_ULSGRO0_USL1_UIOFGRO0_UPLRP0_USFGROn1_VSn1_VWA1_VWB1_WSGRA0_WSGRB0_WS32_WG32_4_1_WGM8_WGMXCC1_WGMXCCGn1
    SolutionIndex: 5
    SolutionNameMin: Cijk_Ailk_Bljk_BBS_BH_Bias_HA_S_SAV_UserArgs_MT16x64x64_MI16x16x1_CMS_SN_LDSB0_AFC1_AG0_AFEM1_AFEM1_ASEM1_CLR1_CADS0_DTLA0_DTLB0_DTVA0_DTVB0_DTVSM0_DPLBn1_EPS0_ELFLR0_EMLLn1_FDSI0_GRPM1_GRVWA1_GRVWB8_GSU1_GSUAMB_GSUC0_GSUWGMRR0_GLS0_ISA1151_IU1_LDSTI0_LBSPPA512_LBSPPB2048_LBSPPM0_LPA16_LPB16_LPM0_LRVW16_LWPMn1_MIAV1_MIWT1_1_MO40_MGRIPMn1_NTn1_NTA0_NTB0_NTC0_NTD0_NTM0_NEPBS0_NLCA1_NLCB1_ONLL1_PGR2_PLR1_PKA0_SGROBn1_SIA3_SS0_SU32_SUM1_SUS256_SPO0_SRVW0_SSO0_SVW1_SK0_SKFTR0_SKXCCM0_SGRO0_TIN0_TLDS0_TLDSM1_ULSGRO0_USL1_UIOFGRO0_UPLRP0_USFGROn1_VSn1_VWA1_VWB1_WSGRA0_WSGRB0_WS32_WG16_8_1_WGM8_WGMXCC1_WGMXCCGn1
    SolutionIndex: 6
    SolutionNameMin: Cijk_Ailk_Bljk_BBS_BH_Bias_HA_S_SAV_UserArgs_MT64x16x32_MI16x16x1_CMS_SN_LDSB0_AFC1_AG0_AFEM1_AFEM1_ASEM1_CLR1_CADS0_DTLA0_DTLB0_DTVA0_DTVB0_DTVSM0_DPLBn1_EPS0_ELFLR0_EMLLn1_FDSI0_GRPM1_GRVWA8_GRVWB4_GSU1_GSUAMB_GSUC0_GSUWGMRR0_GLS0_ISA1151_IU1_LDSTI0_LBSPPA2048_LBSPPB512_LBSPPM0_LPA16_LPB16_LPM0_LRVW16_LWPMn1_MIAV1_MIWT1_1_MO40_MGRIPMn1_NTn1_NTA0_NTB0_NTC0_NTD0_NTM0_NEPBS0_NLCA1_NLCB1_ONLL1_PGR2_PLR1_PKA0_SGROBn1_SIA3_SS1_SU32_SUM1_SUS256_SPO0_SRVW0_SSO0_SVW1_SK0_SKFTR0_SKXCCM0_SGRO0_TIN0_TLDS0_TLDSM1_ULSGRO0_USL1_UIOFGRO0_UPLRP0_USFGROn1_VSn1_VWA1_VWB1_WSGRA0_WSGRB0_WS32_WG64_2_1_WGM8_WGMXCC1_WGMXCCGn1
    SolutionIndex: 7
    SolutionNameMin: Cijk_Ailk_Bljk_BBS_BH_Bias_HA_S_SAV_UserArgs_MT64x16x32_MI16x16x1_CMS_SN_LDSB0_AFC1_AG0_AFEM1_AFEM1_ASEM1_CLR1_CADS0_DTLA0_DTLB0_DTVA0_DTVB0_DTVSM0_DPLBn1_EPS0_ELFLR0_EMLLn1_FDSI0_GRPM1_GRVWA8_GRVWB4_GSU1_GSUAMB_GSUC0_GSUWGMRR0_GLS0_ISA1151_IU1_LDSTI0_LBSPPA2048_LBSPPB128_LBSPPM0_LPA16_LPB16_LPM0_LRVW16_LWPMn1_MIAV1_MIWT1_1_MO40_MGRIPMn1_NTn1_NTA0_NTB0_NTC0_NTD0_NTM0_NEPBS0_NLCA1_NLCB1_ONLL1_PGR2_PLR1_PKA0_SGROBn1_SIA3_SS1_SU32_SUM1_SUS256_SPO0_SRVW0_SSO0_SVW1_SK0_SKFTR0_SKXCCM0_SGRO0_TIN0_TLDS1_TLDSM1_ULSGRO0_USL1_UIOFGRO0_UPLRP0_USFGROn1_VSn1_VWA1_VWB1_WSGRA0_WSGRB0_WS32_WG64_2_1_WGM8_WGMXCC1_WGMXCCGn1
    SolutionIndex: 8
    SolutionNameMin: Cijk_Ailk_Bljk_BBS_BH_Bias_HA_S_SAV_UserArgs_MT64x16x32_MI16x16x1_CMS_SN_LDSB0_AFC1_AG0_AFEM1_AFEM1_ASEM1_CLR1_CADS0_DTLA0_DTLB0_DTVA0_DTVB0_DTVSM0_DPLBn1_EPS0_ELFLR0_EMLLn1_FDSI0_GRPM1_GRVWA1_GRVWB4_GSU1_GSUAMB_GSUC0_GSUWGMRR0_GLS0_ISA1151_IU1_LDSTI0_LBSPPA2048_LBSPPB128_LBSPPM0_LPA16_LPB16_LPM0_LRVW16_LWPMn1_MIAV1_MIWT1_1_MO40_MGRIPMn1_NTn1_NTA0_NTB0_NTC0_NTD0_NTM0_NEPBS0_NLCA1_NLCB1_ONLL1_PGR2_PLR1_PKA0_SGROBn1_SIA3_SS1_SU32_SUM1_SUS256_SPO0_SRVW0_SSO0_SVW1_SK0_SKFTR0_SKXCCM0_SGRO0_TIN0_TLDS1_TLDSM1_ULSGRO0_USL1_UIOFGRO0_UPLRP0_USFGROn1_VSn1_VWA1_VWB1_WSGRA0_WSGRB0_WS32_WG64_2_1_WGM8_WGMXCC1_WGMXCCGn1
    SolutionIndex: 9
    SolutionNameMin: Cijk_Ailk_Bljk_BBS_BH_Bias_HA_S_SAV_UserArgs_MT64x16x32_MI16x16x1_CMS_SN_LDSB0_AFC1_AG0_AFEM1_AFEM1_ASEM1_CLR1_CADS0_DTLA0_DTLB0_DTVA0_DTVB0_DTVSM0_DPLBn1_EPS0_ELFLR0_EMLLn1_FDSI0_GRPM1_GRVWA8_GRVWB1_GSU1_GSUAMB_GSUC0_GSUWGMRR0_GLS0_ISA1151_IU1_LDSTI0_LBSPPA2048_LBSPPB512_LBSPPM0_LPA16_LPB16_LPM0_LRVW16_LWPMn1_MIAV1_MIWT1_1_MO40_MGRIPMn1_NTn1_NTA0_NTB0_NTC0_NTD0_NTM0_NEPBS0_NLCA1_NLCB1_ONLL1_PGR2_PLR1_PKA0_SGROBn1_SIA3_SS1_SU32_SUM1_SUS256_SPO0_SRVW0_SSO0_SVW1_SK0_SKFTR0_SKXCCM0_SGRO0_TIN0_TLDS0_TLDSM1_ULSGRO0_USL1_UIOFGRO0_UPLRP0_USFGROn1_VSn1_VWA1_VWB1_WSGRA0_WSGRB0_WS32_WG64_2_1_WGM8_WGMXCC1_WGMXCCGn1
    SolutionIndex: 10
    SolutionNameMin: Cijk_Ailk_Bljk_BBS_BH_Bias_HA_S_SAV_UserArgs_MT64x16x32_MI16x16x1_CMS_SN_LDSB0_AFC1_AG0_AFEM1_AFEM1_ASEM1_CLR1_CADS0_DTLA0_DTLB0_DTVA0_DTVB0_DTVSM0_DPLBn1_EPS0_ELFLR0_EMLLn1_FDSI0_GRPM1_GRVWA8_GRVWB1_GSU1_GSUAMB_GSUC0_GSUWGMRR0_GLS0_ISA1151_IU1_LDSTI0_LBSPPA2048_LBSPPB128_LBSPPM0_LPA16_LPB16_LPM0_LRVW16_LWPMn1_MIAV1_MIWT1_1_MO40_MGRIPMn1_NTn1_NTA0_NTB0_NTC0_NTD0_NTM0_NEPBS0_NLCA1_NLCB1_ONLL1_PGR2_PLR1_PKA0_SGROBn1_SIA3_SS1_SU32_SUM1_SUS256_SPO0_SRVW0_SSO0_SVW1_SK0_SKFTR0_SKXCCM0_SGRO0_TIN0_TLDS1_TLDSM1_ULSGRO0_USL1_UIOFGRO0_UPLRP0_USFGROn1_VSn1_VWA1_VWB1_WSGRA0_WSGRB0_WS32_WG64_2_1_WGM8_WGMXCC1_WGMXCCGn1
    SolutionIndex: 11
    SolutionNameMin: Cijk_Ailk_Bljk_BBS_BH_Bias_HA_S_SAV_UserArgs_MT64x16x32_MI16x16x1_CMS_SN_LDSB0_AFC1_AG0_AFEM1_AFEM1_ASEM1_CLR1_CADS0_DTLA0_DTLB0_DTVA0_DTVB0_DTVSM0_DPLBn1_EPS0_ELFLR0_EMLLn1_FDSI0_GRPM1_GRVWA1_GRVWB1_GSU1_GSUAMB_GSUC0_GSUWGMRR0_GLS0_ISA1151_IU1_LDSTI0_LBSPPA2048_LBSPPB128_LBSPPM0_LPA16_LPB16_LPM0_LRVW16_LWPMn1_MIAV1_MIWT1_1_MO40_MGRIPMn1_NTn1_NTA0_NTB0_NTC0_NTD0_NTM0_NEPBS0_NLCA1_NLCB1_ONLL1_PGR2_PLR1_PKA0_SGROBn1_SIA3_SS1_SU32_SUM1_SUS256_SPO0_SRVW0_SSO0_SVW1_SK0_SKFTR0_SKXCCM0_SGRO0_TIN0_TLDS1_TLDSM1_ULSGRO0_USL1_UIOFGRO0_UPLRP0_USFGROn1_VSn1_VWA1_VWB1_WSGRA0_WSGRB0_WS32_WG64_2_1_WGM8_WGMXCC1_WGMXCCGn1
    SolutionIndex: 12
    SolutionNameMin: Cijk_Ailk_Bljk_BBS_BH_Bias_HA_S_SAV_UserArgs_MT64x16x32_MI16x16x1_CMS_SN_LDSB0_AFC1_AG0_AFEM1_AFEM1_ASEM1_CLR1_CADS0_DTLA0_DTLB0_DTVA0_DTVB0_DTVSM0_DPLBn1_EPS0_ELFLR0_EMLLn1_FDSI0_GRPM1_GRVWA8_GRVWB4_GSU4_GSUAMB_GSUC0_GSUWGMRR0_GLS0_ISA1151_IU1_LDSTI0_LBSPPA2048_LBSPPB128_LBSPPM0_LPA16_LPB16_LPM0_LRVW16_LWPMn1_MIAV1_MIWT1_1_MO40_MGRIPMn1_NTn1_NTA0_NTB0_NTC0_NTD0_NTM0_NEPBS0_NLCA1_NLCB1_ONLL1_PGR2_PLR1_PKA0_SGROBn1_SIA3_SS1_SU32_SUM1_SUS256_SPO0_SRVW0_SSO0_SVW1_SK0_SKFTR0_SKXCCM0_SGRO0_TIN0_TLDS1_TLDSM1_ULSGRO0_USL1_UIOFGRO0_UPLRP0_USFGROn1_VSn1_VWA1_VWB1_WSGRA0_WSGRB0_WS32_WG64_2_1_WGM8_WGMXCC1_WGMXCCGn1
    SolutionIndex: 13
    SolutionNameMin: Cijk_Ailk_Bljk_BBS_BH_Bias_HA_S_SAV_UserArgs_MT192x16x32_MI16x16x1_CMS_SN_LDSB0_AFC1_AG0_AFEM1_AFEM1_ASEM1_CLR1_CADS0_DTLA0_DTLB0_DTVA0_DTVB0_DTVSM0_DPLBn1_EPS0_ELFLR0_EMLLn1_FDSI0_GRPM1_GRVWA8_GRVWB1_GSU1_GSUAMB_GSUC0_GSUWGMRR0_GLS0_ISA1151_IU1_LDSTI0_LBSPPA6144_LBSPPB128_LBSPPM0_LPA16_LPB16_LPM0_LRVW16_LWPMn1_MIAV1_MIWT3_1_MO40_MGRIPMn1_NTn1_NTA0_NTB0_NTC0_NTD0_NTM0_NEPBS0_NLCA3_NLCB1_ONLL1_PGR2_PLR1_PKA0_SGROBn1_SIA3_SS1_SU32_SUM1_SUS256_SPO0_SRVW0_SSO0_SVW1_SK0_SKFTR0_SKXCCM0_SGRO0_TIN0_TLDS1_TLDSM1_ULSGRO0_USL1_UIOFGRO0_UPLRP0_USFGROn1_VSn1_VWA1_VWB1_WSGRA0_WSGRB0_WS32_WG64_2_1_WGM8_WGMXCC1_WGMXCCGn1
    SolutionIndex: 14
    SolutionNameMin: Cijk_Ailk_Bljk_BBS_BH_Bias_HA_S_SAV_UserArgs_MT32x32x32_MI16x16x1_CMS_SN_LDSB0_AFC1_AG0_AFEM1_AFEM1_ASEM1_CLR1_CADS0_DTLA0_DTLB0_DTVA0_DTVB0_DTVSM0_DPLBn1_EPS0_ELFLR0_EMLLn1_FDSI0_GRPM1_GRVWA8_GRVWB8_GSU1_GSUAMB_GSUC0_GSUWGMRR0_GLS0_ISA1151_IU1_LDSTI0_LBSPPA1024_LBSPPB128_LBSPPM0_LPA16_LPB16_LPM0_LRVW16_LWPMn1_MIAV1_MIWT1_1_MO40_MGRIPMn1_NTn1_NTA0_NTB0_NTC0_NTD0_NTM0_NEPBS0_NLCA1_NLCB1_ONLL1_PGR2_PLR1_PKA0_SGROBn1_SIA3_SS1_SU32_SUM1_SUS256_SPO0_SRVW0_SSO0_SVW1_SK0_SKFTR0_SKXCCM0_SGRO0_TIN0_TLDS1_TLDSM1_ULSGRO0_USL1_UIOFGRO0_UPLRP0_USFGROn1_VSn1_VWA1_VWB1_WSGRA0_WSGRB0_WS32_WG32_4_1_WGM8_WGMXCC1_WGMXCCGn1
    SolutionIndex: 15
    SolutionNameMin: Cijk_Ailk_Bljk_BBS_BH_Bias_HA_S_SAV_UserArgs_MT32x32x32_MI16x16x1_CMS_SN_LDSB0_AFC1_AG0_AFEM1_AFEM1_ASEM1_CLR1_CADS0_DTLA0_DTLB0_DTVA0_DTVB0_DTVSM0_DPLBn1_EPS0_ELFLR0_EMLLn1_FDSI0_GRPM1_GRVWA1_GRVWB8_GSU1_GSUAMB_GSUC0_GSUWGMRR0_GLS0_ISA1151_IU1_LDSTI0_LBSPPA1024_LBSPPB128_LBSPPM0_LPA16_LPB16_LPM0_LRVW16_LWPMn1_MIAV1_MIWT1_1_MO40_MGRIPMn1_NTn1_NTA0_NTB0_NTC0_NTD0_NTM0_NEPBS0_NLCA1_NLCB1_ONLL1_PGR2_PLR1_PKA0_SGROBn1_SIA3_SS1_SU32_SUM1_SUS256_SPO0_SRVW0_SSO0_SVW1_SK0_SKFTR0_SKXCCM0_SGRO0_TIN0_TLDS1_TLDSM1_ULSGRO0_USL1_UIOFGRO0_UPLRP0_USFGROn1_VSn1_VWA1_VWB1_WSGRA0_WSGRB0_WS32_WG32_4_1_WGM8_WGMXCC1_WGMXCCGn1
    SolutionIndex: 16
    SolutionNameMin: Cijk_Ailk_Bljk_BBS_BH_Bias_HA_S_SAV_UserArgs_MT32x32x32_MI16x16x1_CMS_SN_LDSB0_AFC1_AG0_AFEM1_AFEM1_ASEM1_CLR1_CADS0_DTLA0_DTLB0_DTVA0_DTVB0_DTVSM0_DPLBn1_EPS0_ELFLR0_EMLLn1_FDSI0_GRPM1_GRVWA8_GRVWB1_GSU1_GSUAMB_GSUC0_GSUWGMRR0_GLS0_ISA1151_IU1_LDSTI0_LBSPPA1024_LBSPPB128_LBSPPM0_LPA16_LPB16_LPM0_LRVW16_LWPMn1_MIAV1_MIWT1_1_MO40_MGRIPMn1_NTn1_NTA0_NTB0_NTC0_NTD0_NTM0_NEPBS0_NLCA1_NLCB1_ONLL1_PGR2_PLR1_PKA0_SGROBn1_SIA3_SS1_SU32_SUM1_SUS256_SPO0_SRVW0_SSO0_SVW1_SK0_SKFTR0_SKXCCM0_SGRO0_TIN0_TLDS1_TLDSM1_ULSGRO0_USL1_UIOFGRO0_UPLRP0_USFGROn1_VSn1_VWA1_VWB1_WSGRA0_WSGRB0_WS32_WG32_4_1_WGM8_WGMXCC1_WGMXCCGn1
    SolutionIndex: 17
    SolutionNameMin: Cijk_Ailk_Bljk_BBS_BH_Bias_HA_S_SAV_UserArgs_MT32x32x32_MI16x16x1_CMS_SN_LDSB0_AFC1_AG0_AFEM1_AFEM1_ASEM1_CLR1_CADS0_DTLA0_DTLB0_DTVA0_DTVB0_DTVSM0_DPLBn1_EPS0_ELFLR0_EMLLn1_FDSI0_GRPM1_GRVWA1_GRVWB1_GSU1_GSUAMB_GSUC0_GSUWGMRR0_GLS0_ISA1151_IU1_LDSTI0_LBSPPA1024_LBSPPB128_LBSPPM0_LPA16_LPB16_LPM0_LRVW16_LWPMn1_MIAV1_MIWT1_1_MO40_MGRIPMn1_NTn1_NTA0_NTB0_NTC0_NTD0_NTM0_NEPBS0_NLCA1_NLCB1_ONLL1_PGR2_PLR1_PKA0_SGROBn1_SIA3_SS1_SU32_SUM1_SUS256_SPO0_SRVW0_SSO0_SVW1_SK0_SKFTR0_SKXCCM0_SGRO0_TIN0_TLDS1_TLDSM1_ULSGRO0_USL1_UIOFGRO0_UPLRP0_USFGROn1_VSn1_VWA1_VWB1_WSGRA0_WSGRB0_WS32_WG32_4_1_WGM8_WGMXCC1_WGMXCCGn1
    SolutionIndex: 18
    SolutionNameMin: Cijk_Ailk_Bljk_BBS_BH_Bias_HA_S_SAV_UserArgs_MT32x32x32_MI16x16x1_CMS_SN_LDSB0_AFC1_AG0_AFEM1_AFEM1_ASEM1_CLR1_CADS0_DTLA0_DTLB0_DTVA0_DTVB0_DTVSM0_DPLBn1_EPS0_ELFLR0_EMLLn1_FDSI0_GRPM1_GRVWA8_GRVWB8_GSU4_GSUAMB_GSUC0_GSUWGMRR0_GLS0_ISA1151_IU1_LDSTI0_LBSPPA1024_LBSPPB128_LBSPPM0_LPA16_LPB16_LPM0_LRVW16_LWPMn1_MIAV1_MIWT1_1_MO40_MGRIPMn1_NTn1_NTA0_NTB0_NTC0_NTD0_NTM0_NEPBS0_NLCA1_NLCB1_ONLL1_PGR2_PLR1_PKA0_SGROBn1_SIA3_SS1_SU32_SUM1_SUS256_SPO0_SRVW0_SSO0_SVW1_SK0_SKFTR0_SKXCCM0_SGRO0_TIN0_TLDS1_TLDSM1_ULSGRO0_USL1_UIOFGRO0_UPLRP0_USFGROn1_VSn1_VWA1_VWB1_WSGRA0_WSGRB0_WS32_WG32_4_1_WGM8_WGMXCC1_WGMXCCGn1
    SolutionIndex: 19
    SolutionNameMin: Cijk_Ailk_Bljk_BBS_BH_Bias_HA_S_SAV_UserArgs_MT64x32x32_MI16x16x1_CMS_SN_LDSB0_AFC1_AG0_AFEM1_AFEM1_ASEM1_CLR1_CADS0_DTLA0_DTLB0_DTVA0_DTVB0_DTVSM0_DPLBn1_EPS0_ELFLR0_EMLLn1_FDSI0_GRPM1_GRVWA8_GRVWB8_GSU1_GSUAMB_GSUC0_GSUWGMRR0_GLS0_ISA1151_IU1_LDSTI0_LBSPPA2048_LBSPPB1024_LBSPPM0_LPA16_LPB16_LPM0_LRVW16_LWPMn1_MIAV1_MIWT2_1_MO40_MGRIPMn1_NTn1_NTA0_NTB0_NTC0_NTD0_NTM0_NEPBS0_NLCA1_NLCB1_ONLL1_PGR2_PLR1_PKA0_SGROBn1_SIA3_SS1_SU32_SUM1_SUS256_SPO0_SRVW0_SSO0_SVW1_SK0_SKFTR0_SKXCCM0_SGRO0_TIN0_TLDS0_TLDSM1_ULSGRO0_USL1_UIOFGRO0_UPLRP0_USFGROn1_VSn1_VWA1_VWB1_WSGRA0_WSGRB0_WS32_WG32_4_1_WGM8_WGMXCC1_WGMXCCGn1
    SolutionIndex: 20
    SolutionNameMin: Cijk_Ailk_Bljk_BBS_BH_Bias_HA_S_SAV_UserArgs_MT64x32x32_MI16x16x1_CMS_SN_LDSB0_AFC1_AG0_AFEM1_AFEM1_ASEM1_CLR1_CADS0_DTLA0_DTLB0_DTVA0_DTVB0_DTVSM0_DPLBn1_EPS0_ELFLR0_EMLLn1_FDSI0_GRPM1_GRVWA8_GRVWB8_GSU1_GSUAMB_GSUC0_GSUWGMRR0_GLS0_ISA1151_IU1_LDSTI0_LBSPPA2048_LBSPPB128_LBSPPM0_LPA16_LPB16_LPM0_LRVW16_LWPMn1_MIAV1_MIWT2_1_MO40_MGRIPMn1_NTn1_NTA0_NTB0_NTC0_NTD0_NTM0_NEPBS0_NLCA1_NLCB1_ONLL1_PGR2_PLR1_PKA0_SGROBn1_SIA3_SS1_SU32_SUM1_SUS256_SPO0_SRVW0_SSO0_SVW1_SK0_SKFTR0_SKXCCM0_SGRO0_TIN0_TLDS1_TLDSM1_ULSGRO0_USL1_UIOFGRO0_UPLRP0_USFGROn1_VSn1_VWA1_VWB1_WSGRA0_WSGRB0_WS32_WG32_4_1_WGM8_WGMXCC1_WGMXCCGn1
    SolutionIndex: 21
    SolutionNameMin: Cijk_Ailk_Bljk_BBS_BH_Bias_HA_S_SAV_UserArgs_MT64x32x32_MI16x16x1_CMS_SN_LDSB0_AFC1_AG0_AFEM1_AFEM1_ASEM1_CLR1_CADS0_DTLA0_DTLB0_DTVA0_DTVB0_DTVSM0_DPLBn1_EPS0_ELFLR0_EMLLn1_FDSI0_GRPM1_GRVWA1_GRVWB8_GSU1_GSUAMB_GSUC0_GSUWGMRR0_GLS0_ISA1151_IU1_LDSTI0_LBSPPA2048_LBSPPB1024_LBSPPM0_LPA16_LPB16_LPM0_LRVW16_LWPMn1_MIAV1_MIWT2_1_MO40_MGRIPMn1_NTn1_NTA0_NTB0_NTC0_NTD0_NTM0_NEPBS0_NLCA1_NLCB1_ONLL1_PGR2_PLR1_PKA0_SGROBn1_SIA3_SS1_SU32_SUM1_SUS256_SPO0_SRVW0_SSO0_SVW1_SK0_SKFTR0_SKXCCM0_SGRO0_TIN0_TLDS0_TLDSM1_ULSGRO0_USL1_UIOFGRO0_UPLRP0_USFGROn1_VSn1_VWA1_VWB1_WSGRA0_WSGRB0_WS32_WG32_4_1_WGM8_WGMXCC1_WGMXCCGn1
    SolutionIndex: 22
    SolutionNameMin: Cijk_Ailk_Bljk_BBS_BH_Bias_HA_S_SAV_UserArgs_MT64x32x32_MI16x16x1_CMS_SN_LDSB0_AFC1_AG0_AFEM1_AFEM1_ASEM1_CLR1_CADS0_DTLA0_DTLB0_DTVA0_DTVB0_DTVSM0_DPLBn1_EPS0_ELFLR0_EMLLn1_FDSI0_GRPM1_GRVWA1_GRVWB8_GSU1_GSUAMB_GSUC0_GSUWGMRR0_GLS0_ISA1151_IU1_LDSTI0_LBSPPA2048_LBSPPB128_LBSPPM0_LPA16_LPB16_LPM0_LRVW16_LWPMn1_MIAV1_MIWT2_1_MO40_MGRIPMn1_NTn1_NTA0_NTB0_NTC0_NTD0_NTM0_NEPBS0_NLCA1_NLCB1_ONLL1_PGR2_PLR1_PKA0_SGROBn1_SIA3_SS1_SU32_SUM1_SUS256_SPO0_SRVW0_SSO0_SVW1_SK0_SKFTR0_SKXCCM0_SGRO0_TIN0_TLDS1_TLDSM1_ULSGRO0_USL1_UIOFGRO0_UPLRP0_USFGROn1_VSn1_VWA1_VWB1_WSGRA0_WSGRB0_WS32_WG32_4_1_WGM8_WGMXCC1_WGMXCCGn1
    SolutionIndex: 25
    SolutionNameMin: Cijk_Ailk_Bljk_BBS_BH_Bias_HA_S_SAV_UserArgs_MT64x32x32_MI16x16x1_CMS_SN_LDSB0_AFC1_AG0_AFEM1_AFEM1_ASEM1_CLR1_CADS0_DTLA0_DTLB0_DTVA0_DTVB0_DTVSM0_DPLBn1_EPS0_ELFLR0_EMLLn1_FDSI0_GRPM1_GRVWA1_GRVWB1_GSU1_GSUAMB_GSUC0_GSUWGMRR0_GLS0_ISA1151_IU1_LDSTI0_LBSPPA2048_LBSPPB128_LBSPPM0_LPA16_LPB16_LPM0_LRVW16_LWPMn1_MIAV1_MIWT2_1_MO40_MGRIPMn1_NTn1_NTA0_NTB0_NTC0_NTD0_NTM0_NEPBS0_NLCA1_NLCB1_ONLL1_PGR2_PLR1_PKA0_SGROBn1_SIA3_SS1_SU32_SUM1_SUS256_SPO0_SRVW0_SSO0_SVW1_SK0_SKFTR0_SKXCCM0_SGRO0_TIN0_TLDS1_TLDSM1_ULSGRO0_USL1_UIOFGRO0_UPLRP0_USFGROn1_VSn1_VWA1_VWB1_WSGRA0_WSGRB0_WS32_WG32_4_1_WGM8_WGMXCC1_WGMXCCGn1
    SolutionIndex: 26
    SolutionNameMin: Cijk_Ailk_Bljk_BBS_BH_Bias_HA_S_SAV_UserArgs_MT64x32x32_MI16x16x1_CMS_SN_LDSB0_AFC1_AG0_AFEM1_AFEM1_ASEM1_CLR1_CADS0_DTLA0_DTLB0_DTVA0_DTVB0_DTVSM0_DPLBn1_EPS0_ELFLR0_EMLLn1_FDSI0_GRPM1_GRVWA8_GRVWB8_GSU4_GSUAMB_GSUC0_GSUWGMRR0_GLS0_ISA1151_IU1_LDSTI0_LBSPPA2048_LBSPPB128_LBSPPM0_LPA16_LPB16_LPM0_LRVW16_LWPMn1_MIAV1_MIWT2_1_MO40_MGRIPMn1_NTn1_NTA0_NTB0_NTC0_NTD0_NTM0_NEPBS0_NLCA1_NLCB1_ONLL1_PGR2_PLR1_PKA0_SGROBn1_SIA3_SS1_SU32_SUM1_SUS256_SPO0_SRVW0_SSO0_SVW1_SK0_SKFTR0_SKXCCM0_SGRO0_TIN0_TLDS1_TLDSM1_ULSGRO0_USL1_UIOFGRO0_UPLRP0_USFGROn1_VSn1_VWA1_VWB1_WSGRA0_WSGRB0_WS32_WG32_4_1_WGM8_WGMXCC1_WGMXCCGn1
    SolutionIndex: 27
    SolutionNameMin: Cijk_Ailk_Bljk_BBS_BH_Bias_HA_S_SAV_UserArgs_MT96x32x32_MI16x16x1_CMS_SN_LDSB0_AFC1_AG0_AFEM1_AFEM1_ASEM1_CLR1_CADS0_DTLA0_DTLB0_DTVA0_DTVB0_DTVSM0_DPLBn1_EPS0_ELFLR0_EMLLn1_FDSI0_GRPM1_GRVWA8_GRVWB8_GSU1_GSUAMB_GSUC0_GSUWGMRR0_GLS0_ISA1151_IU1_LDSTI0_LBSPPA3072_LBSPPB128_LBSPPM0_LPA16_LPB16_LPM0_LRVW16_LWPMn1_MIAV1_MIWT3_1_MO40_MGRIPMn1_NTn1_NTA0_NTB0_NTC0_NTD0_NTM0_NEPBS0_NLCA3_NLCB1_ONLL1_PGR2_PLR1_PKA0_SGROBn1_SIA3_SS1_SU32_SUM1_SUS256_SPO0_SRVW0_SSO0_SVW1_SK0_SKFTR0_SKXCCM0_SGRO0_TIN0_TLDS1_TLDSM1_ULSGRO0_USL1_UIOFGRO0_UPLRP0_USFGROn1_VSn1_VWA1_VWB1_WSGRA0_WSGRB0_WS32_WG32_4_1_WGM8_WGMXCC1_WGMXCCGn1
    SolutionIndex: 29
    SolutionNameMin: Cijk_Ailk_Bljk_BBS_BH_Bias_HA_S_SAV_UserArgs_MT96x32x32_MI16x16x1_CMS_SN_LDSB0_AFC1_AG0_AFEM1_AFEM1_ASEM1_CLR1_CADS0_DTLA0_DTLB0_DTVA0_DTVB0_DTVSM0_DPLBn1_EPS0_ELFLR0_EMLLn1_FDSI0_GRPM1_GRVWA8_GRVWB8_GSU4_GSUAMB_GSUC0_GSUWGMRR0_GLS0_ISA1151_IU1_LDSTI0_LBSPPA3072_LBSPPB128_LBSPPM0_LPA16_LPB16_LPM0_LRVW16_LWPMn1_MIAV1_MIWT3_1_MO40_MGRIPMn1_NTn1_NTA0_NTB0_NTC0_NTD0_NTM0_NEPBS0_NLCA3_NLCB1_ONLL1_PGR2_PLR1_PKA0_SGROBn1_SIA3_SS1_SU32_SUM1_SUS256_SPO0_SRVW0_SSO0_SVW1_SK0_SKFTR0_SKXCCM0_SGRO0_TIN0_TLDS1_TLDSM1_ULSGRO0_USL1_UIOFGRO0_UPLRP0_USFGROn1_VSn1_VWA1_VWB1_WSGRA0_WSGRB0_WS32_WG32_4_1_WGM8_WGMXCC1_WGMXCCGn1
    SolutionIndex: 30
    SolutionNameMin: Cijk_Ailk_Bljk_BBS_BH_Bias_HA_S_SAV_UserArgs_MT160x32x32_MI16x16x1_CMS_SN_LDSB0_AFC1_AG0_AFEM1_AFEM1_ASEM1_CLR1_CADS0_DTLA0_DTLB0_DTVA0_DTVB0_DTVSM0_DPLBn1_EPS0_ELFLR0_EMLLn1_FDSI0_GRPM1_GRVWA8_GRVWB8_GSU1_GSUAMB_GSUC0_GSUWGMRR0_GLS0_ISA1151_IU1_LDSTI0_LBSPPA5120_LBSPPB128_LBSPPM0_LPA16_LPB16_LPM0_LRVW16_LWPMn1_MIAV1_MIWT5_1_MO40_MGRIPMn1_NTn1_NTA0_NTB0_NTC0_NTD0_NTM0_NEPBS0_NLCA5_NLCB1_ONLL1_PGR2_PLR1_PKA0_SGROBn1_SIA3_SS1_SU32_SUM1_SUS256_SPO0_SRVW0_SSO0_SVW1_SK0_SKFTR0_SKXCCM0_SGRO0_TIN0_TLDS1_TLDSM1_ULSGRO0_USL1_UIOFGRO0_UPLRP0_USFGROn1_VSn1_VWA1_VWB1_WSGRA0_WSGRB0_WS32_WG32_4_1_WGM8_WGMXCC1_WGMXCCGn1
    SolutionIndex: 31
    SolutionNameMin: Cijk_Ailk_Bljk_BBS_BH_Bias_HA_S_SAV_UserArgs_MT64x48x32_MI16x16x1_CMS_SN_LDSB0_AFC1_AG0_AFEM1_AFEM1_ASEM1_CLR1_CADS0_DTLA0_DTLB0_DTVA0_DTVB0_DTVSM0_DPLBn1_EPS0_ELFLR0_EMLLn1_FDSI0_GRPM1_GRVWA8_GRVWB4_GSU1_GSUAMB_GSUC0_GSUWGMRR0_GLS0_ISA1151_IU1_LDSTI0_LBSPPA2048_LBSPPB128_LBSPPM0_LPA16_LPB16_LPM0_LRVW16_LWPMn1_MIAV1_MIWT1_3_MO40_MGRIPMn1_NTn1_NTA0_NTB0_NTC0_NTD0_NTM0_NEPBS0_NLCA1_NLCB1_ONLL1_PGR2_PLR1_PKA0_SGROBn1_SIA3_SS1_SU32_SUM1_SUS256_SPO0_SRVW0_SSO0_SVW1_SK0_SKFTR0_SKXCCM0_SGRO0_TIN0_TLDS1_TLDSM1_ULSGRO0_USL1_UIOFGRO0_UPLRP0_USFGROn1_VSn1_VWA1_VWB1_WSGRA0_WSGRB0_WS32_WG64_2_1_WGM8_WGMXCC1_WGMXCCGn1
    SolutionIndex: 32
    SolutionNameMin: Cijk_Ailk_Bljk_BBS_BH_Bias_HA_S_SAV_UserArgs_MT64x48x32_MI16x16x1_CMS_SN_LDSB0_AFC1_AG0_AFEM1_AFEM1_ASEM1_CLR1_CADS0_DTLA0_DTLB0_DTVA0_DTVB0_DTVSM0_DPLBn1_EPS0_ELFLR0_EMLLn1_FDSI0_GRPM1_GRVWA1_GRVWB4_GSU1_GSUAMB_GSUC0_GSUWGMRR0_GLS0_ISA1151_IU1_LDSTI0_LBSPPA2048_LBSPPB128_LBSPPM0_LPA16_LPB16_LPM0_LRVW16_LWPMn1_MIAV1_MIWT1_3_MO40_MGRIPMn1_NTn1_NTA0_NTB0_NTC0_NTD0_NTM0_NEPBS0_NLCA1_NLCB1_ONLL1_PGR2_PLR1_PKA0_SGROBn1_SIA3_SS1_SU32_SUM1_SUS256_SPO0_SRVW0_SSO0_SVW1_SK0_SKFTR0_SKXCCM0_SGRO0_TIN0_TLDS1_TLDSM1_ULSGRO0_USL1_UIOFGRO0_UPLRP0_USFGROn1_VSn1_VWA1_VWB1_WSGRA0_WSGRB0_WS32_WG64_2_1_WGM8_WGMXCC1_WGMXCCGn1
    SolutionIndex: 34
    SolutionNameMin: Cijk_Ailk_Bljk_BBS_BH_Bias_HA_S_SAV_UserArgs_MT64x48x32_MI16x16x1_CMS_SN_LDSB0_AFC1_AG0_AFEM1_AFEM1_ASEM1_CLR1_CADS0_DTLA0_DTLB0_DTVA0_DTVB0_DTVSM0_DPLBn1_EPS0_ELFLR0_EMLLn1_FDSI0_GRPM1_GRVWA1_GRVWB1_GSU1_GSUAMB_GSUC0_GSUWGMRR0_GLS0_ISA1151_IU1_LDSTI0_LBSPPA2048_LBSPPB128_LBSPPM0_LPA16_LPB16_LPM0_LRVW16_LWPMn1_MIAV1_MIWT1_3_MO40_MGRIPMn1_NTn1_NTA0_NTB0_NTC0_NTD0_NTM0_NEPBS0_NLCA1_NLCB1_ONLL1_PGR2_PLR1_PKA0_SGROBn1_SIA3_SS1_SU32_SUM1_SUS256_SPO0_SRVW0_SSO0_SVW1_SK0_SKFTR0_SKXCCM0_SGRO0_TIN0_TLDS1_TLDSM1_ULSGRO0_USL1_UIOFGRO0_UPLRP0_USFGROn1_VSn1_VWA1_VWB1_WSGRA0_WSGRB0_WS32_WG64_2_1_WGM8_WGMXCC1_WGMXCCGn1
    SolutionIndex: 36
    SolutionNameMin: Cijk_Ailk_Bljk_BBS_BH_Bias_HA_S_SAV_UserArgs_MT128x48x32_MI16x16x1_CMS_SN_LDSB0_AFC1_AG0_AFEM1_AFEM1_ASEM1_CLR1_CADS0_DTLA0_DTLB0_DTVA0_DTVB0_DTVSM0_DPLBn1_EPS0_ELFLR0_EMLLn1_FDSI0_GRPM1_GRVWA8_GRVWB4_GSU1_GSUAMB_GSUC0_GSUWGMRR0_GLS0_ISA1151_IU1_LDSTI0_LBSPPA4096_LBSPPB128_LBSPPM0_LPA16_LPB16_LPM0_LRVW16_LWPMn1_MIAV1_MIWT2_3_MO40_MGRIPMn1_NTn1_NTA0_NTB0_NTC0_NTD0_NTM0_NEPBS0_NLCA1_NLCB1_ONLL1_PGR2_PLR1_PKA0_SGROBn1_SIA3_SS1_SU32_SUM1_SUS256_SPO0_SRVW0_SSO0_SVW1_SK0_SKFTR0_SKXCCM0_SGRO0_TIN0_TLDS1_TLDSM1_ULSGRO0_USL1_UIOFGRO0_UPLRP0_USFGROn1_VSn1_VWA1_VWB1_WSGRA0_WSGRB0_WS32_WG64_2_1_WGM8_WGMXCC1_WGMXCCGn1
    SolutionIndex: 37
    SolutionNameMin: Cijk_Ailk_Bljk_BBS_BH_Bias_HA_S_SAV_UserArgs_MT128x48x32_MI16x16x1_CMS_SN_LDSB0_AFC1_AG0_AFEM1_AFEM1_ASEM1_CLR1_CADS0_DTLA0_DTLB0_DTVA0_DTVB0_DTVSM0_DPLBn1_EPS0_ELFLR0_EMLLn1_FDSI0_GRPM1_GRVWA8_GRVWB4_GSU2_GSUAMB_GSUC0_GSUWGMRR0_GLS0_ISA1151_IU1_LDSTI0_LBSPPA4096_LBSPPB128_LBSPPM0_LPA16_LPB16_LPM0_LRVW16_LWPMn1_MIAV1_MIWT2_3_MO40_MGRIPMn1_NTn1_NTA0_NTB0_NTC0_NTD0_NTM0_NEPBS0_NLCA1_NLCB1_ONLL1_PGR2_PLR1_PKA0_SGROBn1_SIA3_SS1_SU32_SUM1_SUS256_SPO0_SRVW0_SSO0_SVW1_SK0_SKFTR0_SKXCCM0_SGRO0_TIN0_TLDS1_TLDSM1_ULSGRO0_USL1_UIOFGRO0_UPLRP0_USFGROn1_VSn1_VWA1_VWB1_WSGRA0_WSGRB0_WS32_WG64_2_1_WGM8_WGMXCC1_WGMXCCGn1
    SolutionIndex: 38
    SolutionNameMin: Cijk_Ailk_Bljk_BBS_BH_Bias_HA_S_SAV_UserArgs_MT128x48x32_MI16x16x1_CMS_SN_LDSB0_AFC1_AG0_AFEM1_AFEM1_ASEM1_CLR1_CADS0_DTLA0_DTLB0_DTVA0_DTVB0_DTVSM0_DPLBn1_EPS0_ELFLR0_EMLLn1_FDSI0_GRPM1_GRVWA8_GRVWB4_GSU4_GSUAMB_GSUC0_GSUWGMRR0_GLS0_ISA1151_IU1_LDSTI0_LBSPPA4096_LBSPPB128_LBSPPM0_LPA16_LPB16_LPM0_LRVW16_LWPMn1_MIAV1_MIWT2_3_MO40_MGRIPMn1_NTn1_NTA0_NTB0_NTC0_NTD0_NTM0_NEPBS0_NLCA1_NLCB1_ONLL1_PGR2_PLR1_PKA0_SGROBn1_SIA3_SS1_SU32_SUM1_SUS256_SPO0_SRVW0_SSO0_SVW1_SK0_SKFTR0_SKXCCM0_SGRO0_TIN0_TLDS1_TLDSM1_ULSGRO0_USL1_UIOFGRO0_UPLRP0_USFGROn1_VSn1_VWA1_VWB1_WSGRA0_WSGRB0_WS32_WG64_2_1_WGM8_WGMXCC1_WGMXCCGn1
    SolutionIndex: 39
    SolutionNameMin: Cijk_Ailk_Bljk_BBS_BH_Bias_HA_S_SAV_UserArgs_MT16x64x32_MI16x16x1_CMS_SN_LDSB0_AFC1_AG0_AFEM1_AFEM1_ASEM1_CLR1_CADS0_DTLA0_DTLB0_DTVA0_DTVB0_DTVSM0_DPLBn1_EPS0_ELFLR0_EMLLn1_FDSI0_GRPM1_GRVWA4_GRVWB8_GSU1_GSUAMB_GSUC0_GSUWGMRR0_GLS0_ISA1151_IU1_LDSTI0_LBSPPA512_LBSPPB2048_LBSPPM0_LPA16_LPB16_LPM0_LRVW16_LWPMn1_MIAV1_MIWT1_1_MO40_MGRIPMn1_NTn1_NTA0_NTB0_NTC0_NTD0_NTM0_NEPBS0_NLCA1_NLCB1_ONLL1_PGR2_PLR1_PKA0_SGROBn1_SIA3_SS1_SU32_SUM1_SUS256_SPO0_SRVW0_SSO0_SVW1_SK0_SKFTR0_SKXCCM0_SGRO0_TIN0_TLDS0_TLDSM1_ULSGRO0_USL1_UIOFGRO0_UPLRP0_USFGROn1_VSn1_VWA1_VWB1_WSGRA0_WSGRB0_WS32_WG16_8_1_WGM8_WGMXCC1_WGMXCCGn1
    SolutionIndex: 40
    SolutionNameMin: Cijk_Ailk_Bljk_BBS_BH_Bias_HA_S_SAV_UserArgs_MT16x64x32_MI16x16x1_CMS_SN_LDSB0_AFC1_AG0_AFEM1_AFEM1_ASEM1_CLR1_CADS0_DTLA0_DTLB0_DTVA0_DTVB0_DTVSM0_DPLBn1_EPS0_ELFLR0_EMLLn1_FDSI0_GRPM1_GRVWA1_GRVWB8_GSU1_GSUAMB_GSUC0_GSUWGMRR0_GLS0_ISA1151_IU1_LDSTI0_LBSPPA512_LBSPPB2048_LBSPPM0_LPA16_LPB16_LPM0_LRVW16_LWPMn1_MIAV1_MIWT1_1_MO40_MGRIPMn1_NTn1_NTA0_NTB0_NTC0_NTD0_NTM0_NEPBS0_NLCA1_NLCB1_ONLL1_PGR2_PLR1_PKA0_SGROBn1_SIA3_SS1_SU32_SUM1_SUS256_SPO0_SRVW0_SSO0_SVW1_SK0_SKFTR0_SKXCCM0_SGRO0_TIN0_TLDS0_TLDSM1_ULSGRO0_USL1_UIOFGRO0_UPLRP0_USFGROn1_VSn1_VWA1_VWB1_WSGRA0_WSGRB0_WS32_WG16_8_1_WGM8_WGMXCC1_WGMXCCGn1
    SolutionIndex: 41
    SolutionNameMin: Cijk_Ailk_Bljk_BBS_BH_Bias_HA_S_SAV_UserArgs_MT32x64x32_MI16x16x1_CMS_SN_LDSB0_AFC1_AG0_AFEM1_AFEM1_ASEM1_CLR1_CADS0_DTLA0_DTLB0_DTVA0_DTVB0_DTVSM0_DPLBn1_EPS0_ELFLR0_EMLLn1_FDSI0_GRPM1_GRVWA1_GRVWB8_GSU1_GSUAMB_GSUC0_GSUWGMRR0_GLS0_ISA1151_IU1_LDSTI0_LBSPPA1024_LBSPPB2048_LBSPPM0_LPA16_LPB16_LPM0_LRVW16_LWPMn1_MIAV1_MIWT2_1_MO40_MGRIPMn1_NTn1_NTA0_NTB0_NTC0_NTD0_NTM0_NEPBS0_NLCA1_NLCB1_ONLL1_PGR2_PLR1_PKA0_SGROBn1_SIA3_SS1_SU32_SUM1_SUS256_SPO0_SRVW0_SSO0_SVW1_SK0_SKFTR0_SKXCCM0_SGRO0_TIN0_TLDS0_TLDSM1_ULSGRO0_USL1_UIOFGRO0_UPLRP0_USFGROn1_VSn1_VWA1_VWB1_WSGRA0_WSGRB0_WS32_WG16_8_1_WGM8_WGMXCC1_WGMXCCGn1
    SolutionIndex: 43
    SolutionNameMin: Cijk_Ailk_Bljk_BBS_BH_Bias_HA_S_SAV_UserArgs_MT64x80x32_MI16x16x1_CMS_SN_LDSB0_AFC1_AG0_AFEM1_AFEM1_ASEM1_CLR1_CADS0_DTLA0_DTLB0_DTVA0_DTVB0_DTVSM0_DPLBn1_EPS0_ELFLR0_EMLLn1_FDSI0_GRPM1_GRVWA8_GRVWB4_GSU1_GSUAMB_GSUC0_GSUWGMRR0_GLS0_ISA1151_IU1_LDSTI0_LBSPPA2048_LBSPPB128_LBSPPM0_LPA16_LPB16_LPM0_LRVW16_LWPMn1_MIAV1_MIWT1_5_MO40_MGRIPMn1_NTn1_NTA0_NTB0_NTC0_NTD0_NTM0_NEPBS0_NLCA1_NLCB1_ONLL1_PGR2_PLR1_PKA0_SGROBn1_SIA3_SS1_SU32_SUM1_SUS256_SPO0_SRVW0_SSO0_SVW1_SK0_SKFTR0_SKXCCM0_SGRO0_TIN0_TLDS1_TLDSM1_ULSGRO0_USL1_UIOFGRO0_UPLRP0_USFGROn1_VSn1_VWA1_VWB1_WSGRA0_WSGRB0_WS32_WG64_2_1_WGM8_WGMXCC1_WGMXCCGn1
    SolutionIndex: 44
    SolutionNameMin: Cijk_Ailk_Bljk_BBS_BH_Bias_HA_S_SAV_UserArgs_MT32x96x32_MI16x16x1_CMS_SN_LDSB0_AFC1_AG0_AFEM1_AFEM1_ASEM1_CLR1_CADS0_DTLA0_DTLB0_DTVA0_DTVB0_DTVSM0_DPLBn1_EPS0_ELFLR0_EMLLn1_FDSI0_GRPM1_GRVWA8_GRVWB8_GSU1_GSUAMB_GSUC0_GSUWGMRR0_GLS0_ISA1151_IU1_LDSTI0_LBSPPA1024_LBSPPB128_LBSPPM0_LPA16_LPB16_LPM0_LRVW16_LWPMn1_MIAV1_MIWT1_3_MO40_MGRIPMn1_NTn1_NTA0_NTB0_NTC0_NTD0_NTM0_NEPBS0_NLCA1_NLCB1_ONLL1_PGR2_PLR1_PKA0_SGROBn1_SIA3_SS1_SU32_SUM1_SUS256_SPO0_SRVW0_SSO0_SVW1_SK0_SKFTR0_SKXCCM0_SGRO0_TIN0_TLDS1_TLDSM1_ULSGRO0_USL1_UIOFGRO0_UPLRP0_USFGROn1_VSn1_VWA1_VWB1_WSGRA0_WSGRB0_WS32_WG32_4_1_WGM8_WGMXCC1_WGMXCCGn1
    SolutionIndex: 46
    SolutionNameMin: Cijk_Ailk_Bljk_BBS_BH_Bias_HA_S_SAV_UserArgs_MT64x96x32_MI16x16x1_CMS_SN_LDSB0_AFC1_AG0_AFEM1_AFEM1_ASEM1_CLR1_CADS0_DTLA0_DTLB0_DTVA0_DTVB0_DTVSM0_DPLBn1_EPS0_ELFLR0_EMLLn1_FDSI0_GRPM1_GRVWA8_GRVWB8_GSU1_GSUAMB_GSUC0_GSUWGMRR0_GLS0_ISA1151_IU1_LDSTI0_LBSPPA2048_LBSPPB3072_LBSPPM0_LPA16_LPB16_LPM0_LRVW16_LWPMn1_MIAV1_MIWT2_3_MO40_MGRIPMn1_NTn1_NTA0_NTB0_NTC0_NTD0_NTM0_NEPBS0_NLCA1_NLCB1_ONLL1_PGR2_PLR1_PKA0_SGROBn1_SIA3_SS1_SU32_SUM1_SUS256_SPO0_SRVW0_SSO0_SVW1_SK0_SKFTR0_SKXCCM0_SGRO0_TIN0_TLDS0_TLDSM1_ULSGRO0_USL1_UIOFGRO0_UPLRP0_USFGROn1_VSn1_VWA1_VWB1_WSGRA0_WSGRB0_WS32_WG32_4_1_WGM8_WGMXCC1_WGMXCCGn1
    SolutionIndex: 47
    SolutionNameMin: Cijk_Ailk_Bljk_BBS_BH_Bias_HA_S_SAV_UserArgs_MT64x96x32_MI16x16x1_CMS_SN_LDSB0_AFC1_AG0_AFEM1_AFEM1_ASEM1_CLR1_CADS0_DTLA0_DTLB0_DTVA0_DTVB0_DTVSM0_DPLBn1_EPS0_ELFLR0_EMLLn1_FDSI0_GRPM1_GRVWA8_GRVWB8_GSU1_GSUAMB_GSUC0_GSUWGMRR0_GLS0_ISA1151_IU1_LDSTI0_LBSPPA2048_LBSPPB128_LBSPPM0_LPA16_LPB16_LPM0_LRVW16_LWPMn1_MIAV1_MIWT2_3_MO40_MGRIPMn1_NTn1_NTA0_NTB0_NTC0_NTD0_NTM0_NEPBS0_NLCA1_NLCB1_ONLL1_PGR2_PLR1_PKA0_SGROBn1_SIA3_SS1_SU32_SUM1_SUS256_SPO0_SRVW0_SSO0_SVW1_SK0_SKFTR0_SKXCCM0_SGRO0_TIN0_TLDS1_TLDSM1_ULSGRO0_USL1_UIOFGRO0_UPLRP0_USFGROn1_VSn1_VWA1_VWB1_WSGRA0_WSGRB0_WS32_WG32_4_1_WGM8_WGMXCC1_WGMXCCGn1
    SolutionIndex: 48
    SolutionNameMin: Cijk_Ailk_Bljk_BBS_BH_Bias_HA_S_SAV_UserArgs_MT64x96x32_MI16x16x1_CMS_SN_LDSB0_AFC1_AG0_AFEM1_AFEM1_ASEM1_CLR1_CADS0_DTLA0_DTLB0_DTVA0_DTVB0_DTVSM0_DPLBn1_EPS0_ELFLR0_EMLLn1_FDSI0_GRPM1_GRVWA1_GRVWB8_GSU1_GSUAMB_GSUC0_GSUWGMRR0_GLS0_ISA1151_IU1_LDSTI0_LBSPPA2048_LBSPPB128_LBSPPM0_LPA16_LPB16_LPM0_LRVW16_LWPMn1_MIAV1_MIWT2_3_MO40_MGRIPMn1_NTn1_NTA0_NTB0_NTC0_NTD0_NTM0_NEPBS0_NLCA1_NLCB1_ONLL1_PGR2_PLR1_PKA0_SGROBn1_SIA3_SS1_SU32_SUM1_SUS256_SPO0_SRVW0_SSO0_SVW1_SK0_SKFTR0_SKXCCM0_SGRO0_TIN0_TLDS1_TLDSM1_ULSGRO0_USL1_UIOFGRO0_UPLRP0_USFGROn1_VSn1_VWA1_VWB1_WSGRA0_WSGRB0_WS32_WG32_4_1_WGM8_WGMXCC1_WGMXCCGn1
    SolutionIndex: 51
    SolutionNameMin: Cijk_Ailk_Bljk_BBS_BH_Bias_HA_S_SAV_UserArgs_MT64x96x32_MI16x16x1_CMS_SN_LDSB0_AFC1_AG0_AFEM1_AFEM1_ASEM1_CLR1_CADS0_DTLA0_DTLB0_DTVA0_DTVB0_DTVSM0_DPLBn1_EPS0_ELFLR0_EMLLn1_FDSI0_GRPM1_GRVWA8_GRVWB8_GSU4_GSUAMB_GSUC0_GSUWGMRR0_GLS0_ISA1151_IU1_LDSTI0_LBSPPA2048_LBSPPB128_LBSPPM0_LPA16_LPB16_LPM0_LRVW16_LWPMn1_MIAV1_MIWT2_3_MO40_MGRIPMn1_NTn1_NTA0_NTB0_NTC0_NTD0_NTM0_NEPBS0_NLCA1_NLCB1_ONLL1_PGR2_PLR1_PKA0_SGROBn1_SIA3_SS1_SU32_SUM1_SUS256_SPO0_SRVW0_SSO0_SVW1_SK0_SKFTR0_SKXCCM0_SGRO0_TIN0_TLDS1_TLDSM1_ULSGRO0_USL1_UIOFGRO0_UPLRP0_USFGROn1_VSn1_VWA1_VWB1_WSGRA0_WSGRB0_WS32_WG32_4_1_WGM8_WGMXCC1_WGMXCCGn1
    SolutionIndex: 52
    SolutionNameMin: Cijk_Ailk_Bljk_BBS_BH_Bias_HA_S_SAV_UserArgs_MT64x96x32_MI16x16x1_CMS_SN_LDSB0_AFC1_AG0_AFEM1_AFEM1_ASEM1_CLR1_CADS0_DTLA0_DTLB0_DTVA0_DTVB0_DTVSM0_DPLBn1_EPS0_ELFLR0_EMLLn1_FDSI0_GRPM1_GRVWA1_GRVWB8_GSU4_GSUAMB_GSUC0_GSUWGMRR0_GLS0_ISA1151_IU1_LDSTI0_LBSPPA2048_LBSPPB128_LBSPPM0_LPA16_LPB16_LPM0_LRVW16_LWPMn1_MIAV1_MIWT2_3_MO40_MGRIPMn1_NTn1_NTA0_NTB0_NTC0_NTD0_NTM0_NEPBS0_NLCA1_NLCB1_ONLL1_PGR2_PLR1_PKA0_SGROBn1_SIA3_SS1_SU32_SUM1_SUS256_SPO0_SRVW0_SSO0_SVW1_SK0_SKFTR0_SKXCCM0_SGRO0_TIN0_TLDS1_TLDSM1_ULSGRO0_USL1_UIOFGRO0_UPLRP0_USFGROn1_VSn1_VWA1_VWB1_WSGRA0_WSGRB0_WS32_WG32_4_1_WGM8_WGMXCC1_WGMXCCGn1
    SolutionIndex: 53
    SolutionNameMin: Cijk_Ailk_Bljk_BBS_BH_Bias_HA_S_SAV_UserArgs_MT96x96x32_MI16x16x1_CMS_SN_LDSB0_AFC1_AG0_AFEM1_AFEM1_ASEM1_CLR1_CADS0_DTLA0_DTLB0_DTVA0_DTVB0_DTVSM0_DPLBn1_EPS0_ELFLR0_EMLLn1_FDSI0_GRPM1_GRVWA8_GRVWB8_GSU1_GSUAMB_GSUC0_GSUWGMRR0_GLS0_ISA1151_IU1_LDSTI0_LBSPPA3072_LBSPPB128_LBSPPM0_LPA16_LPB16_LPM0_LRVW16_LWPMn1_MIAV1_MIWT3_3_MO40_MGRIPMn1_NTn1_NTA0_NTB0_NTC0_NTD0_NTM0_NEPBS0_NLCA3_NLCB1_ONLL1_PGR2_PLR1_PKA0_SGROBn1_SIA3_SS1_SU32_SUM1_SUS256_SPO0_SRVW0_SSO0_SVW1_SK0_SKFTR0_SKXCCM0_SGRO0_TIN0_TLDS1_TLDSM1_ULSGRO0_USL1_UIOFGRO0_UPLRP0_USFGROn1_VSn1_VWA1_VWB1_WSGRA0_WSGRB0_WS32_WG32_4_1_WGM8_WGMXCC1_WGMXCCGn1
    SolutionIndex: 57
    SolutionNameMin: Cijk_Ailk_Bljk_BBS_BH_Bias_HA_S_SAV_UserArgs_MT64x112x32_MI16x16x1_CMS_SN_LDSB0_AFC1_AG0_AFEM1_AFEM1_ASEM1_CLR1_CADS0_DTLA0_DTLB0_DTVA0_DTVB0_DTVSM0_DPLBn1_EPS0_ELFLR0_EMLLn1_FDSI0_GRPM1_GRVWA8_GRVWB4_GSU1_GSUAMB_GSUC0_GSUWGMRR0_GLS0_ISA1151_IU1_LDSTI0_LBSPPA2048_LBSPPB128_LBSPPM0_LPA16_LPB16_LPM0_LRVW16_LWPMn1_MIAV1_MIWT1_7_MO40_MGRIPMn1_NTn1_NTA0_NTB0_NTC0_NTD0_NTM0_NEPBS0_NLCA1_NLCB1_ONLL1_PGR2_PLR1_PKA0_SGROBn1_SIA3_SS1_SU32_SUM1_SUS256_SPO0_SRVW0_SSO0_SVW1_SK0_SKFTR0_SKXCCM0_SGRO0_TIN0_TLDS1_TLDSM1_ULSGRO0_USL1_UIOFGRO0_UPLRP0_USFGROn1_VSn1_VWA1_VWB1_WSGRA0_WSGRB0_WS32_WG64_2_1_WGM8_WGMXCC1_WGMXCCGn1
    SolutionIndex: 58
    SolutionNameMin: Cijk_Ailk_Bljk_BBS_BH_Bias_HA_S_SAV_UserArgs_MT64x112x32_MI16x16x1_CMS_SN_LDSB0_AFC1_AG0_AFEM1_AFEM1_ASEM1_CLR1_CADS0_DTLA0_DTLB0_DTVA0_DTVB0_DTVSM0_DPLBn1_EPS0_ELFLR0_EMLLn1_FDSI0_GRPM1_GRVWA1_GRVWB4_GSU1_GSUAMB_GSUC0_GSUWGMRR0_GLS0_ISA1151_IU1_LDSTI0_LBSPPA2048_LBSPPB128_LBSPPM0_LPA16_LPB16_LPM0_LRVW16_LWPMn1_MIAV1_MIWT1_7_MO40_MGRIPMn1_NTn1_NTA0_NTB0_NTC0_NTD0_NTM0_NEPBS0_NLCA1_NLCB1_ONLL1_PGR2_PLR1_PKA0_SGROBn1_SIA3_SS1_SU32_SUM1_SUS256_SPO0_SRVW0_SSO0_SVW1_SK0_SKFTR0_SKXCCM0_SGRO0_TIN0_TLDS1_TLDSM1_ULSGRO0_USL1_UIOFGRO0_UPLRP0_USFGROn1_VSn1_VWA1_VWB1_WSGRA0_WSGRB0_WS32_WG64_2_1_WGM8_WGMXCC1_WGMXCCGn1
    SolutionIndex: 59
    SolutionNameMin: Cijk_Ailk_Bljk_BBS_BH_Bias_HA_S_SAV_UserArgs_MT48x128x32_MI16x16x1_CMS_SN_LDSB0_AFC1_AG0_AFEM1_AFEM1_ASEM1_CLR1_CADS0_DTLA0_DTLB0_DTVA0_DTVB0_DTVSM0_DPLBn1_EPS0_ELFLR0_EMLLn1_FDSI0_GRPM1_GRVWA4_GRVWB8_GSU1_GSUAMB_GSUC0_GSUWGMRR0_GLS0_ISA1151_IU1_LDSTI0_LBSPPA1536_LBSPPB4096_LBSPPM0_LPA16_LPB16_LPM0_LRVW16_LWPMn1_MIAV1_MIWT3_2_MO40_MGRIPMn1_NTn1_NTA0_NTB0_NTC0_NTD0_NTM0_NEPBS0_NLCA3_NLCB1_ONLL1_PGR2_PLR1_PKA0_SGROBn1_SIA3_SS1_SU32_SUM1_SUS256_SPO0_SRVW0_SSO0_SVW1_SK0_SKFTR0_SKXCCM0_SGRO0_TIN0_TLDS0_TLDSM1_ULSGRO0_USL1_UIOFGRO0_UPLRP0_USFGROn1_VSn1_VWA1_VWB1_WSGRA0_WSGRB0_WS32_WG16_8_1_WGM8_WGMXCC1_WGMXCCGn1
    SolutionIndex: 60
    SolutionNameMin: Cijk_Ailk_Bljk_BBS_BH_Bias_HA_S_SAV_UserArgs_MT32x224x32_MI16x16x1_CMS_SN_LDSB1_AFC1_AG0_AFEM1_AFEM1_ASEM1_CLR1_CADS0_DTLA0_DTLB0_DTVA0_DTVB0_DTVSM0_DPLBn1_EPS0_ELFLR0_EMLLn1_FDSI0_GRPM1_GRVWA1_GRVWB8_GSU1_GSUAMB_GSUC0_GSUWGMRR0_GLS0_ISA1151_IU1_LDSTI0_LBSPPA1024_LBSPPB128_LBSPPM0_LPA16_LPB16_LPM0_LRVW16_LWPMn1_MIAV1_MIWT1_7_MO40_MGRIPMn1_NTn1_NTA0_NTB0_NTC0_NTD0_NTM0_NEPBS0_NLCA1_NLCB1_ONLL1_PGR2_PLR1_PKA0_SGROBn1_SIA3_SS1_SU32_SUM1_SUS256_SPO0_SRVW0_SSO0_SVW1_SK0_SKFTR0_SKXCCM0_SGRO0_TIN0_TLDS1_TLDSM1_ULSGRO0_USL1_UIOFGRO0_UPLRP0_USFGROn1_VSn1_VWA1_VWB1_WSGRA0_WSGRB0_WS32_WG32_4_1_WGM8_WGMXCC1_WGMXCCGn1
    SolutionIndex: 61
    SolutionNameMin: Cijk_Ailk_Bljk_BBS_BH_Bias_HA_S_SAV_UserArgs_MT64x16x64_MI16x16x1_CMS_SN_LDSB0_AFC1_AG0_AFEM1_AFEM1_ASEM1_CLR1_CADS0_DTLA0_DTLB0_DTVA0_DTVB0_DTVSM0_DPLBn1_EPS0_ELFLR0_EMLLn1_FDSI0_GRPM1_GRVWA8_GRVWB8_GSU1_GSUAMB_GSUC0_GSUWGMRR0_GLS0_ISA1151_IU1_LDSTI0_LBSPPA2048_LBSPPB512_LBSPPM0_LPA16_LPB16_LPM0_LRVW16_LWPMn1_MIAV1_MIWT1_1_MO40_MGRIPMn1_NTn1_NTA0_NTB0_NTC0_NTD0_NTM0_NEPBS0_NLCA1_NLCB1_ONLL1_PGR2_PLR1_PKA0_SGROBn1_SIA3_SS1_SU32_SUM1_SUS256_SPO0_SRVW0_SSO0_SVW1_SK0_SKFTR0_SKXCCM0_SGRO0_TIN0_TLDS0_TLDSM1_ULSGRO0_USL1_UIOFGRO0_UPLRP0_USFGROn1_VSn1_VWA1_VWB1_WSGRA0_WSGRB0_WS32_WG64_2_1_WGM8_WGMXCC1_WGMXCCGn1
    SolutionIndex: 62
    SolutionNameMin: Cijk_Ailk_Bljk_BBS_BH_Bias_HA_S_SAV_UserArgs_MT64x16x64_MI16x16x1_CMS_SN_LDSB0_AFC1_AG0_AFEM1_AFEM1_ASEM1_CLR1_CADS0_DTLA0_DTLB0_DTVA0_DTVB0_DTVSM0_DPLBn1_EPS0_ELFLR0_EMLLn1_FDSI0_GRPM1_GRVWA8_GRVWB8_GSU1_GSUAMB_GSUC0_GSUWGMRR0_GLS0_ISA1151_IU1_LDSTI0_LBSPPA2048_LBSPPB128_LBSPPM0_LPA16_LPB16_LPM0_LRVW16_LWPMn1_MIAV1_MIWT1_1_MO40_MGRIPMn1_NTn1_NTA0_NTB0_NTC0_NTD0_NTM0_NEPBS0_NLCA1_NLCB1_ONLL1_PGR2_PLR1_PKA0_SGROBn1_SIA3_SS1_SU32_SUM1_SUS256_SPO0_SRVW0_SSO0_SVW1_SK0_SKFTR0_SKXCCM0_SGRO0_TIN0_TLDS1_TLDSM1_ULSGRO0_USL1_UIOFGRO0_UPLRP0_USFGROn1_VSn1_VWA1_VWB1_WSGRA0_WSGRB0_WS32_WG64_2_1_WGM8_WGMXCC1_WGMXCCGn1
    SolutionIndex: 63
    SolutionNameMin: Cijk_Ailk_Bljk_BBS_BH_Bias_HA_S_SAV_UserArgs_MT64x16x64_MI16x16x1_CMS_SN_LDSB0_AFC1_AG0_AFEM1_AFEM1_ASEM1_CLR1_CADS0_DTLA0_DTLB0_DTVA0_DTVB0_DTVSM0_DPLBn1_EPS0_ELFLR0_EMLLn1_FDSI0_GRPM1_GRVWA8_GRVWB1_GSU1_GSUAMB_GSUC0_GSUWGMRR0_GLS0_ISA1151_IU1_LDSTI0_LBSPPA2048_LBSPPB128_LBSPPM0_LPA16_LPB16_LPM0_LRVW16_LWPMn1_MIAV1_MIWT1_1_MO40_MGRIPMn1_NTn1_NTA0_NTB0_NTC0_NTD0_NTM0_NEPBS0_NLCA1_NLCB1_ONLL1_PGR2_PLR1_PKA0_SGROBn1_SIA3_SS1_SU32_SUM1_SUS256_SPO0_SRVW0_SSO0_SVW1_SK0_SKFTR0_SKXCCM0_SGRO0_TIN0_TLDS1_TLDSM1_ULSGRO0_USL1_UIOFGRO0_UPLRP0_USFGROn1_VSn1_VWA1_VWB1_WSGRA0_WSGRB0_WS32_WG64_2_1_WGM8_WGMXCC1_WGMXCCGn1
    SolutionIndex: 64
    SolutionNameMin: Cijk_Ailk_Bljk_BBS_BH_Bias_HA_S_SAV_UserArgs_MT64x16x64_MI16x16x1_CMS_SN_LDSB0_AFC1_AG0_AFEM1_AFEM1_ASEM1_CLR1_CADS0_DTLA0_DTLB0_DTVA0_DTVB0_DTVSM0_DPLBn1_EPS0_ELFLR0_EMLLn1_FDSI0_GRPM1_GRVWA8_GRVWB8_GSU4_GSUAMB_GSUC0_GSUWGMRR0_GLS0_ISA1151_IU1_LDSTI0_LBSPPA2048_LBSPPB128_LBSPPM0_LPA16_LPB16_LPM0_LRVW16_LWPMn1_MIAV1_MIWT1_1_MO40_MGRIPMn1_NTn1_NTA0_NTB0_NTC0_NTD0_NTM0_NEPBS0_NLCA1_NLCB1_ONLL1_PGR2_PLR1_PKA0_SGROBn1_SIA3_SS1_SU32_SUM1_SUS256_SPO0_SRVW0_SSO0_SVW1_SK0_SKFTR0_SKXCCM0_SGRO0_TIN0_TLDS1_TLDSM1_ULSGRO0_USL1_UIOFGRO0_UPLRP0_USFGROn1_VSn1_VWA1_VWB1_WSGRA0_WSGRB0_WS32_WG64_2_1_WGM8_WGMXCC1_WGMXCCGn1
    SolutionIndex: 65
    SolutionNameMin: Cijk_Ailk_Bljk_BBS_BH_Bias_HA_S_SAV_UserArgs_MT32x32x64_MI16x16x1_CMS_SN_LDSB0_AFC1_AG0_AFEM1_AFEM1_ASEM1_CLR1_CADS0_DTLA0_DTLB0_DTVA0_DTVB0_DTVSM0_DPLBn1_EPS0_ELFLR0_EMLLn1_FDSI0_GRPM1_GRVWA8_GRVWB8_GSU1_GSUAMB_GSUC0_GSUWGMRR0_GLS0_ISA1151_IU1_LDSTI0_LBSPPA1024_LBSPPB1024_LBSPPM0_LPA16_LPB16_LPM0_LRVW16_LWPMn1_MIAV1_MIWT1_1_MO40_MGRIPMn1_NTn1_NTA0_NTB0_NTC0_NTD0_NTM0_NEPBS0_NLCA1_NLCB1_ONLL1_PGR2_PLR1_PKA0_SGROBn1_SIA3_SS1_SU32_SUM1_SUS256_SPO0_SRVW0_SSO0_SVW1_SK0_SKFTR0_SKXCCM0_SGRO0_TIN0_TLDS0_TLDSM1_ULSGRO0_USL1_UIOFGRO0_UPLRP0_USFGROn1_VSn1_VWA1_VWB1_WSGRA0_WSGRB0_WS32_WG32_4_1_WGM8_WGMXCC1_WGMXCCGn1
    SolutionIndex: 66
    SolutionNameMin: Cijk_Ailk_Bljk_BBS_BH_Bias_HA_S_SAV_UserArgs_MT64x32x64_MI16x16x1_CMS_SN_LDSB0_AFC1_AG0_AFEM1_AFEM1_ASEM1_CLR1_CADS0_DTLA0_DTLB0_DTVA0_DTVB0_DTVSM0_DPLBn1_EPS0_ELFLR0_EMLLn1_FDSI0_GRPM1_GRVWA8_GRVWB8_GSU1_GSUAMB_GSUC0_GSUWGMRR0_GLS0_ISA1151_IU1_LDSTI0_LBSPPA2048_LBSPPB1024_LBSPPM0_LPA16_LPB16_LPM0_LRVW16_LWPMn1_MIAV1_MIWT2_1_MO40_MGRIPMn1_NTn1_NTA0_NTB0_NTC0_NTD0_NTM0_NEPBS0_NLCA1_NLCB1_ONLL1_PGR2_PLR1_PKA0_SGROBn1_SIA3_SS1_SU32_SUM1_SUS256_SPO0_SRVW0_SSO0_SVW1_SK0_SKFTR0_SKXCCM0_SGRO0_TIN0_TLDS0_TLDSM1_ULSGRO0_USL1_UIOFGRO0_UPLRP0_USFGROn1_VSn1_VWA1_VWB1_WSGRA0_WSGRB0_WS32_WG32_4_1_WGM8_WGMXCC1_WGMXCCGn1
    SolutionIndex: 67
    SolutionNameMin: Cijk_Ailk_Bljk_BBS_BH_Bias_HA_S_SAV_UserArgs_MT64x32x64_MI16x16x1_CMS_SN_LDSB0_AFC1_AG0_AFEM1_AFEM1_ASEM1_CLR1_CADS0_DTLA0_DTLB0_DTVA0_DTVB0_DTVSM0_DPLBn1_EPS0_ELFLR0_EMLLn1_FDSI0_GRPM1_GRVWA8_GRVWB1_GSU1_GSUAMB_GSUC0_GSUWGMRR0_GLS0_ISA1151_IU1_LDSTI0_LBSPPA2048_LBSPPB128_LBSPPM0_LPA16_LPB16_LPM0_LRVW16_LWPMn1_MIAV1_MIWT2_1_MO40_MGRIPMn1_NTn1_NTA0_NTB0_NTC0_NTD0_NTM0_NEPBS0_NLCA1_NLCB1_ONLL1_PGR2_PLR1_PKA0_SGROBn1_SIA3_SS1_SU32_SUM1_SUS256_SPO0_SRVW0_SSO0_SVW1_SK0_SKFTR0_SKXCCM0_SGRO0_TIN0_TLDS1_TLDSM1_ULSGRO0_USL1_UIOFGRO0_UPLRP0_USFGROn1_VSn1_VWA1_VWB1_WSGRA0_WSGRB0_WS32_WG32_4_1_WGM8_WGMXCC1_WGMXCCGn1
    SolutionIndex: 68
    SolutionNameMin: Cijk_Ailk_Bljk_BBS_BH_Bias_HA_S_SAV_UserArgs_MT64x32x64_MI16x16x1_CMS_SN_LDSB0_AFC1_AG0_AFEM1_AFEM1_ASEM1_CLR1_CADS0_DTLA0_DTLB0_DTVA0_DTVB0_DTVSM0_DPLBn1_EPS0_ELFLR0_EMLLn1_FDSI0_GRPM1_GRVWA8_GRVWB8_GSU4_GSUAMB_GSUC0_GSUWGMRR0_GLS0_ISA1151_IU1_LDSTI0_LBSPPA2048_LBSPPB1024_LBSPPM0_LPA16_LPB16_LPM0_LRVW16_LWPMn1_MIAV1_MIWT2_1_MO40_MGRIPMn1_NTn1_NTA0_NTB0_NTC0_NTD0_NTM0_NEPBS0_NLCA1_NLCB1_ONLL1_PGR2_PLR1_PKA0_SGROBn1_SIA3_SS1_SU32_SUM1_SUS256_SPO0_SRVW0_SSO0_SVW1_SK0_SKFTR0_SKXCCM0_SGRO0_TIN0_TLDS0_TLDSM1_ULSGRO0_USL1_UIOFGRO0_UPLRP0_USFGROn1_VSn1_VWA1_VWB1_WSGRA0_WSGRB0_WS32_WG32_4_1_WGM8_WGMXCC1_WGMXCCGn1
    SolutionIndex: 69
    SolutionNameMin: Cijk_Ailk_Bljk_BBS_BH_Bias_HA_S_SAV_UserArgs_MT64x48x64_MI16x16x1_CMS_SN_LDSB0_AFC1_AG0_AFEM1_AFEM1_ASEM1_CLR1_CADS0_DTLA0_DTLB0_DTVA0_DTVB0_DTVSM0_DPLBn1_EPS0_ELFLR0_EMLLn1_FDSI0_GRPM1_GRVWA8_GRVWB8_GSU1_GSUAMB_GSUC0_GSUWGMRR0_GLS0_ISA1151_IU1_LDSTI0_LBSPPA2048_LBSPPB128_LBSPPM0_LPA16_LPB16_LPM0_LRVW16_LWPMn1_MIAV1_MIWT1_3_MO40_MGRIPMn1_NTn1_NTA0_NTB0_NTC0_NTD0_NTM0_NEPBS0_NLCA1_NLCB1_ONLL1_PGR2_PLR1_PKA0_SGROBn1_SIA3_SS1_SU32_SUM1_SUS256_SPO0_SRVW0_SSO0_SVW1_SK0_SKFTR0_SKXCCM0_SGRO0_TIN0_TLDS1_TLDSM1_ULSGRO0_USL1_UIOFGRO0_UPLRP0_USFGROn1_VSn1_VWA1_VWB1_WSGRA0_WSGRB0_WS32_WG64_2_1_WGM8_WGMXCC1_WGMXCCGn1
    SolutionIndex: 70
    SolutionNameMin: Cijk_Ailk_Bljk_BBS_BH_Bias_HA_S_SAV_UserArgs_MT16x64x64_MI16x16x1_CMS_SN_LDSB0_AFC1_AG0_AFEM1_AFEM1_ASEM1_CLR1_CADS0_DTLA0_DTLB0_DTVA0_DTVB0_DTVSM0_DPLBn1_EPS0_ELFLR0_EMLLn1_FDSI0_GRPM1_GRVWA8_GRVWB8_GSU1_GSUAMB_GSUC0_GSUWGMRR0_GLS0_ISA1151_IU1_LDSTI0_LBSPPA512_LBSPPB2048_LBSPPM0_LPA16_LPB16_LPM0_LRVW16_LWPMn1_MIAV1_MIWT1_1_MO40_MGRIPMn1_NTn1_NTA0_NTB0_NTC0_NTD0_NTM0_NEPBS0_NLCA1_NLCB1_ONLL1_PGR2_PLR1_PKA0_SGROBn1_SIA3_SS1_SU32_SUM1_SUS256_SPO0_SRVW0_SSO0_SVW1_SK0_SKFTR0_SKXCCM0_SGRO0_TIN0_TLDS0_TLDSM1_ULSGRO0_USL1_UIOFGRO0_UPLRP0_USFGROn1_VSn1_VWA1_VWB1_WSGRA0_WSGRB0_WS32_WG16_8_1_WGM8_WGMXCC1_WGMXCCGn1
    SolutionIndex: 71
    SolutionNameMin: Cijk_Ailk_Bljk_BBS_BH_Bias_HA_S_SAV_UserArgs_MT32x64x64_MI16x16x1_CMS_SN_LDSB0_AFC1_AG0_AFEM1_AFEM1_ASEM1_CLR1_CADS0_DTLA0_DTLB0_DTVA0_DTVB0_DTVSM0_DPLBn1_EPS0_ELFLR0_EMLLn1_FDSI0_GRPM1_GRVWA8_GRVWB8_GSU1_GSUAMB_GSUC0_GSUWGMRR0_GLS0_ISA1151_IU1_LDSTI0_LBSPPA1024_LBSPPB2048_LBSPPM0_LPA16_LPB16_LPM0_LRVW16_LWPMn1_MIAV1_MIWT2_1_MO40_MGRIPMn1_NTn1_NTA0_NTB0_NTC0_NTD0_NTM0_NEPBS0_NLCA1_NLCB1_ONLL1_PGR2_PLR1_PKA0_SGROBn1_SIA3_SS1_SU32_SUM1_SUS256_SPO0_SRVW0_SSO0_SVW1_SK0_SKFTR0_SKXCCM0_SGRO0_TIN0_TLDS0_TLDSM1_ULSGRO0_USL1_UIOFGRO0_UPLRP0_USFGROn1_VSn1_VWA1_VWB1_WSGRA0_WSGRB0_WS32_WG16_8_1_WGM8_WGMXCC1_WGMXCCGn1
    SolutionIndex: 72
    SolutionNameMin: Cijk_Ailk_Bljk_BBS_BH_Bias_HA_S_SAV_UserArgs_MT96x128x64_MI16x16x1_SN_LDSB1_AFC1_AG0_AFEM1_AFEM1_ASEM1_CLR0_CADS0_DTLA0_DTLB0_DTVA0_DTVB0_DTVSM0_DPLB0_EPS0_ELFLR0_EMLLn1_FDSI0_GRPM1_GRVWA8_GRVWB8_GSU1_GSUAMB_GSUC0_GSUWGMRR0_GLS0_ISA1151_IU1_K1_LDSTI0_LBSPPA3072_LBSPPB128_LBSPPM0_LPA8_LPB8_LPM0_LRVW16_LWPMn1_MIAV1_MIWT3_4_MO40_MGRIPM1_NTn1_NTA0_NTB0_NTC0_NTD0_NTM0_NEPBS0_NLCA3_NLCB1_ONLL1_PGR2_PLR0_PKA0_SGROB0_SIA3_SS1_SU32_SUM0_SUS256_SPO0_SRVW0_SSO0_SVW1_SK0_SKFTR0_SKXCCM0_SGRO0_TIN0_TLDS1_TLDSMn1_ULSGRO0_USL1_UIOFGRO0_UPLRP0_USFGROn1_VSn1_VWA1_VWB1_WSGRA0_WSGRB0_WS32_WG32_4_1_WGM8_WGMXCC1_WGMXCCGn1
    SolutionIndex: 74
    SolutionNameMin: Cijk_Ailk_Bljk_BBS_BH_Bias_HA_S_SAV_UserArgs_MT128x96x64_MI16x16x1_SN_LDSB1_AFC1_AG0_AFEM1_AFEM1_ASEM1_CLR0_CADS0_DTLA0_DTLB0_DTVA0_DTVB0_DTVSM0_DPLB0_EPS0_ELFLR0_EMLLn1_FDSI0_GRPM1_GRVWA8_GRVWB8_GSU1_GSUAMB_GSUC0_GSUWGMRR0_GLS0_ISA1151_IU1_K1_LDSTI0_LBSPPA4096_LBSPPB128_LBSPPM0_LPA8_LPB8_LPM0_LRVW16_LWPMn1_MIAV1_MIWT2_6_MO40_MGRIPM1_NTn1_NTA0_NTB0_NTC0_NTD0_NTM0_NEPBS0_NLCA1_NLCB1_ONLL1_PGR2_PLR0_PKA0_SGROB0_SIA3_SS1_SU32_SUM0_SUS256_SPO0_SRVW0_SSO0_SVW1_SK0_SKFTR0_SKXCCM0_SGRO0_TIN0_TLDS1_TLDSMn1_ULSGRO0_USL1_UIOFGRO0_UPLRP0_USFGROn1_VSn1_VWA1_VWB1_WSGRA0_WSGRB0_WS32_WG64_2_1_WGM8_WGMXCC1_WGMXCCGn1
    SolutionIndex: 75
    SolutionNameMin: Cijk_Ailk_Bljk_BBS_BH_Bias_HA_S_SAV_UserArgs_MT128x112x64_MI16x16x1_SN_LDSB0_AFC1_AG0_AFEM1_AFEM1_ASEM1_CLR0_CADS0_DTLA0_DTLB0_DTVA0_DTVB0_DTVSM0_DPLB0_EPS0_ELFLR0_EMLLn1_FDSI0_GRPM1_GRVWA8_GRVWB8_GSU1_GSUAMB_GSUC0_GSUWGMRR0_GLS0_ISA1151_IU1_K1_LDSTI0_LBSPPA4096_LBSPPB128_LBSPPM0_LPA8_LPB8_LPM0_LRVW16_LWPMn1_MIAV1_MIWT2_7_MO40_MGRIPM1_NTn1_NTA0_NTB0_NTC0_NTD0_NTM0_NEPBS0_NLCA1_NLCB1_ONLL1_PGR0_PLR0_PKA0_SGROB0_SIA1_SS1_SU32_SUM0_SUS256_SPO0_SRVW0_SSO0_SVW1_SK0_SKFTR0_SKXCCM0_SGRO0_TIN0_TLDS1_TLDSMn1_ULSGRO0_USL1_UIOFGRO0_UPLRP0_USFGROn1_VSn1_VWA1_VWB1_WSGRA0_WSGRB0_WS32_WG64_2_1_WGM8_WGMXCC1_WGMXCCGn1
    SolutionIndex: 76
    SolutionNameMin: Cijk_Ailk_Bljk_BBS_BH_Bias_HA_S_SAV_UserArgs_MT64x96x32_MI16x16x1_SN_LDSB0_AFC1_AG0_AFEM1_AFEM1_ASEM1_CLR0_CADS0_DTLA0_DTLB0_DTVA0_DTVB0_DTVSM0_DPLB0_EPS0_ELFLR0_EMLLn1_FDSI0_GRPM1_GRVWA8_GRVWB8_GSU1_GSUAMB_GSUC0_GSUWGMRR0_GLS0_ISA1151_IU1_K1_LDSTI0_LBSPPA2048_LBSPPB3072_LBSPPM0_LPA8_LPB8_LPM0_LRVW16_LWPMn1_MIAV1_MIWT2_3_MO40_MGRIPM1_NTn1_NTA0_NTB0_NTC0_NTD0_NTM0_NEPBS0_NLCA1_NLCB1_ONLL1_PGR1_PLR1_PKA0_SGROB0_SIA1_SS1_SU32_SUM0_SUS256_SPO0_SRVW0_SSO0_SVW1_SK0_SKFTR0_SKXCCM0_SGRO0_TIN0_TLDS0_TLDSMn1_ULSGRO0_USL1_UIOFGRO0_UPLRP0_USFGROn1_VSn1_VWA1_VWB1_WSGRA0_WSGRB0_WS32_WG32_4_1_WGM8_WGMXCC1_WGMXCCGn1
    SolutionIndex: 77
    SolutionNameMin: Cijk_Ailk_Bljk_BBS_BH_Bias_HA_S_SAV_UserArgs_MT128x32x64_MI16x16x1_SN_LDSB0_AFC1_AG0_AFEM1_AFEM1_ASEM1_CLR0_CADS0_DTLA0_DTLB0_DTVA0_DTVB0_DTVSM0_DPLB0_EPS0_ELFLR0_EMLLn1_FDSI0_GRPM1_GRVWA8_GRVWB8_GSU1_GSUAMB_GSUC0_GSUWGMRR0_GLS0_ISA1151_IU1_K1_LDSTI0_LBSPPA4096_LBSPPB1024_LBSPPM0_LPA8_LPB8_LPM0_LRVW16_LWPMn1_MIAV1_MIWT2_2_MO40_MGRIPM1_NTn1_NTA0_NTB0_NTC0_NTD0_NTM0_NEPBS0_NLCA1_NLCB1_ONLL1_PGR2_PLR1_PKA0_SGROB0_SIA3_SS1_SU32_SUM0_SUS256_SPO0_SRVW0_SSO0_SVW1_SK0_SKFTR0_SKXCCM0_SGRO0_TIN0_TLDS0_TLDSMn1_ULSGRO0_USL1_UIOFGRO0_UPLRP0_USFGROn1_VSn1_VWA1_VWB1_WSGRA0_WSGRB0_WS32_WG64_2_1_WGM8_WGMXCC1_WGMXCCGn1
    SolutionIndex: 80
    SolutionNameMin: Cijk_Ailk_Bljk_BBS_BH_Bias_HA_S_SAV_UserArgs_MT32x16x32_MI16x16x1_SN_LDSB0_AFC1_AG0_AFEM1_AFEM1_ASEM1_CLR0_CADS0_DTLA0_DTLB0_DTVA0_DTVB0_DTVSM0_DPLB0_EPS0_ELFLR0_EMLLn1_FDSI0_GRPM1_GRVWA8_GRVWB8_GSU1_GSUAMB_GSUC0_GSUWGMRR0_GLS0_ISA1151_IU1_K1_LDSTI0_LBSPPA1024_LBSPPB512_LBSPPM0_LPA8_LPB8_LPM0_LRVW16_LWPMn1_MIAV1_MIWT1_1_MO40_MGRIPM1_NTn1_NTA0_NTB0_NTC0_NTD0_NTM0_NEPBS0_NLCA1_NLCB1_ONLL1_PGR2_PLR1_PKA0_SGROB0_SIA1_SS1_SU32_SUM0_SUS256_SPO0_SRVW0_SSO0_SVW1_SK0_SKFTR0_SKXCCM0_SGRO0_TIN0_TLDS0_TLDSMn1_ULSGRO0_USL1_UIOFGRO0_UPLRP0_USFGROn1_VSn1_VWA1_VWB1_WSGRA0_WSGRB0_WS32_WG32_2_1_WGM8_WGMXCC1_WGMXCCGn1
    SolutionIndex: 81
    SolutionNameMin: Cijk_Ailk_Bljk_BBS_BH_Bias_HA_S_SAV_UserArgs_MT64x32x64_MI16x16x1_SN_LDSB0_AFC1_AG0_AFEM1_AFEM1_ASEM1_CLR0_CADS0_DTLA0_DTLB0_DTVA0_DTVB0_DTVSM0_DPLB0_EPS0_ELFLR0_EMLLn1_FDSI0_GRPM1_GRVWA8_GRVWB8_GSU1_GSUAMB_GSUC0_GSUWGMRR0_GLS0_ISA1151_IU1_K1_LDSTI0_LBSPPA2048_LBSPPB1024_LBSPPM0_LPA8_LPB8_LPM0_LRVW16_LWPMn1_MIAV1_MIWT2_1_MO40_MGRIPM1_NTn1_NTA0_NTB0_NTC0_NTD0_NTM0_NEPBS0_NLCA1_NLCB1_ONLL1_PGR2_PLR1_PKA0_SGROB0_SIA1_SS1_SU32_SUM0_SUS256_SPO0_SRVW0_SSO0_SVW1_SK0_SKFTR0_SKXCCM0_SGRO0_TIN0_TLDS0_TLDSMn1_ULSGRO0_USL1_UIOFGRO0_UPLRP0_USFGROn1_VSn1_VWA1_VWB1_WSGRA0_WSGRB0_WS32_WG32_4_1_WGM8_WGMXCC1_WGMXCCGn1
    SolutionIndex: 82
    SolutionNameMin: Cijk_Ailk_Bljk_BBS_BH_Bias_HA_S_SAV_UserArgs_MT64x32x32_MI16x16x1_SN_LDSB0_AFC1_AG0_AFEM1_AFEM1_ASEM1_CLR0_CADS0_DTLA0_DTLB0_DTVA0_DTVB0_DTVSM0_DPLB0_EPS0_ELFLR0_EMLLn1_FDSI0_GRPM1_GRVWA8_GRVWB8_GSU1_GSUAMB_GSUC0_GSUWGMRR0_GLS0_ISA1151_IU1_K1_LDSTI0_LBSPPA2048_LBSPPB1024_LBSPPM0_LPA8_LPB8_LPM0_LRVW16_LWPMn1_MIAV1_MIWT2_1_MO40_MGRIPM1_NTn1_NTA0_NTB0_NTC0_NTD0_NTM0_NEPBS0_NLCA1_NLCB1_ONLL1_PGR2_PLR1_PKA0_SGROB0_SIA1_SS1_SU32_SUM0_SUS256_SPO0_SRVW0_SSO0_SVW1_SK0_SKFTR0_SKXCCM0_SGRO0_TIN0_TLDS0_TLDSMn1_ULSGRO0_USL1_UIOFGRO0_UPLRP0_USFGROn1_VSn1_VWA1_VWB1_WSGRA0_WSGRB0_WS32_WG32_4_1_WGM8_WGMXCC1_WGMXCCGn1
    SolutionIndex: 83
    SolutionNameMin: Cijk_Ailk_Bljk_BBS_BH_Bias_HA_S_SAV_UserArgs_MT128x32x32_MI16x16x1_SN_LDSB0_AFC1_AG0_AFEM1_AFEM1_ASEM1_CLR0_CADS0_DTLA0_DTLB0_DTVA0_DTVB0_DTVSM0_DPLB0_EPS0_ELFLR0_EMLLn1_FDSI0_GRPM1_GRVWA8_GRVWB8_GSU1_GSUAMB_GSUC0_GSUWGMRR0_GLS0_ISA1151_IU1_K1_LDSTI0_LBSPPA4096_LBSPPB1024_LBSPPM0_LPA8_LPB8_LPM0_LRVW16_LWPMn1_MIAV1_MIWT2_2_MO40_MGRIPM1_NTn1_NTA0_NTB0_NTC0_NTD0_NTM0_NEPBS0_NLCA1_NLCB1_ONLL1_PGR2_PLR1_PKA0_SGROB0_SIA1_SS1_SU32_SUM0_SUS256_SPO0_SRVW0_SSO0_SVW1_SK0_SKFTR0_SKXCCM0_SGRO0_TIN0_TLDS0_TLDSMn1_ULSGRO0_USL1_UIOFGRO0_UPLRP0_USFGROn1_VSn1_VWA1_VWB1_WSGRA0_WSGRB0_WS32_WG64_2_1_WGM8_WGMXCC1_WGMXCCGn1
    SolutionIndex: 84
    SolutionNameMin: Cijk_Ailk_Bljk_BBS_BH_Bias_HA_S_SAV_UserArgs_MT128x32x64_MI16x16x1_SN_LDSB0_AFC1_AG0_AFEM1_AFEM1_ASEM1_CLR0_CADS0_DTLA0_DTLB0_DTVA0_DTVB0_DTVSM0_DPLB0_EPS0_ELFLR0_EMLLn1_FDSI0_GRPM1_GRVWA8_GRVWB8_GSU1_GSUAMB_GSUC0_GSUWGMRR0_GLS0_ISA1151_IU1_K1_LDSTI0_LBSPPA4096_LBSPPB1024_LBSPPM0_LPA8_LPB8_LPM0_LRVW16_LWPMn1_MIAV1_MIWT2_2_MO40_MGRIPM1_NTn1_NTA0_NTB0_NTC0_NTD0_NTM0_NEPBS0_NLCA1_NLCB1_ONLL1_PGR2_PLR1_PKA0_SGROB0_SIA1_SS1_SU32_SUM0_SUS256_SPO0_SRVW0_SSO0_SVW1_SK0_SKFTR0_SKXCCM0_SGRO0_TIN0_TLDS0_TLDSMn1_ULSGRO0_USL1_UIOFGRO0_UPLRP0_USFGROn1_VSn1_VWA1_VWB1_WSGRA0_WSGRB0_WS32_WG64_2_1_WGM8_WGMXCC1_WGMXCCGn1
    SolutionIndex: 85
    SolutionNameMin: Cijk_Ailk_Bljk_BBS_BH_Bias_HA_S_SAV_UserArgs_MT64x32x64_MI16x16x1_SN_LDSB0_AFC1_AG0_AFEM1_AFEM1_ASEM1_CLR0_CADS0_DTLA0_DTLB0_DTVA0_DTVB0_DTVSM0_DPLB0_EPS0_ELFLR0_EMLLn1_FDSI0_GRPM1_GRVWA8_GRVWB8_GSU1_GSUAMB_GSUC0_GSUWGMRR0_GLS0_ISA1151_IU1_K1_LDSTI0_LBSPPA2048_LBSPPB1024_LBSPPM0_LPA8_LPB8_LPM0_LRVW16_LWPMn1_MIAV1_MIWT2_1_MO40_MGRIPM1_NTn1_NTA0_NTB0_NTC0_NTD0_NTM0_NEPBS0_NLCA1_NLCB1_ONLL1_PGR2_PLR1_PKA0_SGROB0_SIA3_SS1_SU32_SUM0_SUS256_SPO0_SRVW0_SSO0_SVW1_SK0_SKFTR0_SKXCCM0_SGRO0_TIN0_TLDS0_TLDSMn1_ULSGRO0_USL1_UIOFGRO0_UPLRP0_USFGROn1_VSn1_VWA1_VWB1_WSGRA0_WSGRB0_WS32_WG32_4_1_WGM8_WGMXCC1_WGMXCCGn1
    SolutionIndex: 87
    SolutionNameMin: Cijk_Ailk_Bljk_BBS_BH_Bias_HA_S_SAV_UserArgs_MT128x64x32_MI16x16x1_SN_LDSB0_AFC1_AG0_AFEM1_AFEM1_ASEM1_CLR0_CADS0_DTLA0_DTLB0_DTVA0_DTVB0_DTVSM0_DPLB0_EPS0_ELFLR0_EMLLn1_FDSI0_GRPM1_GRVWA8_GRVWB8_GSU1_GSUAMB_GSUC0_GSUWGMRR0_GLS0_ISA1151_IU1_K1_LDSTI0_LBSPPA4096_LBSPPB2048_LBSPPM0_LPA8_LPB8_LPM0_LRVW16_LWPMn1_MIAV1_MIWT4_2_MO40_MGRIPM1_NTn1_NTA0_NTB0_NTC0_NTD0_NTM0_NEPBS0_NLCA1_NLCB1_ONLL1_PGR2_PLR0_PKA0_SGROB0_SIA1_SS1_SU32_SUM0_SUS256_SPO0_SRVW0_SSO0_SVW1_SK0_SKFTR0_SKXCCM0_SGRO0_TIN0_TLDS0_TLDSMn1_ULSGRO0_USL1_UIOFGRO0_UPLRP0_USFGROn1_VSn1_VWA1_VWB1_WSGRA0_WSGRB0_WS32_WG32_4_1_WGM8_WGMXCC1_WGMXCCGn1
    SolutionIndex: 89
    SolutionNameMin: Cijk_Ailk_Bljk_BBS_BH_Bias_HA_S_SAV_UserArgs_MT128x32x32_MI16x16x1_SN_LDSB0_AFC1_AG0_AFEM1_AFEM1_ASEM1_CLR0_CADS0_DTLA0_DTLB0_DTVA0_DTVB0_DTVSM0_DPLB0_EPS0_ELFLR0_EMLLn1_FDSI0_GRPM1_GRVWA8_GRVWB8_GSU1_GSUAMB_GSUC0_GSUWGMRR0_GLS0_ISA1151_IU1_K1_LDSTI0_LBSPPA4096_LBSPPB1024_LBSPPM0_LPA8_LPB8_LPM0_LRVW16_LWPMn1_MIAV1_MIWT2_2_MO40_MGRIPM1_NTn1_NTA0_NTB0_NTC0_NTD0_NTM0_NEPBS0_NLCA1_NLCB1_ONLL1_PGR2_PLR1_PKA0_SGROB0_SIA3_SS1_SU32_SUM0_SUS256_SPO0_SRVW0_SSO0_SVW1_SK0_SKFTR0_SKXCCM0_SGRO0_TIN0_TLDS0_TLDSMn1_ULSGRO0_USL1_UIOFGRO0_UPLRP0_USFGROn1_VSn1_VWA1_VWB1_WSGRA0_WSGRB0_WS32_WG64_2_1_WGM8_WGMXCC1_WGMXCCGn1
    SolutionIndex: 91
    SolutionNameMin: Cijk_Ailk_Bljk_BBS_BH_Bias_HA_S_SAV_UserArgs_MT128x64x32_MI16x16x1_SN_LDSB1_AFC1_AG0_AFEM1_AFEM1_ASEM1_CLR0_CADS0_DTLA0_DTLB0_DTVA0_DTVB0_DTVSM0_DPLB0_EPS0_ELFLR0_EMLLn1_FDSI0_GRPM1_GRVWA8_GRVWB8_GSU1_GSUAMB_GSUC0_GSUWGMRR0_GLS0_ISA1151_IU1_K1_LDSTI0_LBSPPA4096_LBSPPB2048_LBSPPM0_LPA8_LPB8_LPM0_LRVW16_LWPMn1_MIAV1_MIWT4_2_MO40_MGRIPM1_NTn1_NTA0_NTB0_NTC0_NTD0_NTM0_NEPBS0_NLCA1_NLCB1_ONLL1_PGR2_PLR0_PKA0_SGROB0_SIA3_SS1_SU32_SUM0_SUS256_SPO0_SRVW0_SSO0_SVW1_SK0_SKFTR0_SKXCCM0_SGRO0_TIN0_TLDS0_TLDSMn1_ULSGRO0_USL1_UIOFGRO0_UPLRP0_USFGROn1_VSn1_VWA1_VWB1_WSGRA0_WSGRB0_WS32_WG32_4_1_WGM8_WGMXCC1_WGMXCCGn1
    SolutionIndex: 92
    SolutionNameMin: Cijk_Ailk_Bljk_BBS_BH_Bias_HA_S_SAV_UserArgs_MT128x64x64_MI16x16x1_SN_LDSB1_AFC1_AG0_AFEM1_AFEM1_ASEM1_CLR0_CADS0_DTLA0_DTLB0_DTVA0_DTVB0_DTVSM0_DPLB0_EPS0_ELFLR0_EMLLn1_FDSI0_GRPM1_GRVWA8_GRVWB8_GSU1_GSUAMB_GSUC0_GSUWGMRR0_GLS0_ISA1151_IU1_K1_LDSTI0_LBSPPA4096_LBSPPB2048_LBSPPM0_LPA8_LPB8_LPM0_LRVW16_LWPMn1_MIAV1_MIWT2_4_MO40_MGRIPM1_NTn1_NTA0_NTB0_NTC0_NTD0_NTM0_NEPBS0_NLCA1_NLCB1_ONLL1_PGR2_PLR0_PKA0_SGROB0_SIA3_SS1_SU32_SUM0_SUS256_SPO0_SRVW0_SSO0_SVW1_SK0_SKFTR0_SKXCCM0_SGRO0_TIN0_TLDS0_TLDSMn1_ULSGRO0_USL1_UIOFGRO0_UPLRP0_USFGROn1_VSn1_VWA1_VWB1_WSGRA0_WSGRB0_WS32_WG64_2_1_WGM8_WGMXCC1_WGMXCCGn1
    SolutionIndex: 93
    SolutionNameMin: Cijk_Ailk_Bljk_BBS_BH_Bias_HA_S_SAV_UserArgs_MT128x64x32_MI16x16x1_SN_LDSB0_AFC1_AG0_AFEM1_AFEM1_ASEM1_CLR0_CADS0_DTLA0_DTLB0_DTVA0_DTVB0_DTVSM0_DPLB0_EPS0_ELFLR0_EMLLn1_FDSI0_GRPM1_GRVWA8_GRVWB8_GSU1_GSUAMB_GSUC0_GSUWGMRR0_GLS0_ISA1151_IU1_K1_LDSTI0_LBSPPA4096_LBSPPB2048_LBSPPM0_LPA8_LPB8_LPM0_LRVW16_LWPMn1_MIAV1_MIWT2_4_MO40_MGRIPM1_NTn1_NTA0_NTB0_NTC0_NTD0_NTM0_NEPBS0_NLCA1_NLCB1_ONLL1_PGR1_PLR0_PKA0_SGROB0_SIA1_SS1_SU32_SUM0_SUS256_SPO0_SRVW0_SSO0_SVW1_SK0_SKFTR0_SKXCCM0_SGRO0_TIN0_TLDS0_TLDSMn1_ULSGRO0_USL1_UIOFGRO0_UPLRP0_USFGROn1_VSn1_VWA1_VWB1_WSGRA0_WSGRB0_WS32_WG64_2_1_WGM8_WGMXCC1_WGMXCCGn1
    SolutionIndex: 94
    SolutionNameMin: Cijk_Ailk_Bljk_BBS_BH_Bias_HA_S_SAV_UserArgs_MT128x64x32_MI16x16x1_SN_LDSB1_AFC1_AG0_AFEM1_AFEM1_ASEM1_CLR0_CADS0_DTLA0_DTLB0_DTVA0_DTVB0_DTVSM0_DPLB0_EPS0_ELFLR0_EMLLn1_FDSI0_GRPM1_GRVWA8_GRVWB8_GSU1_GSUAMB_GSUC0_GSUWGMRR0_GLS0_ISA1151_IU1_K1_LDSTI0_LBSPPA4096_LBSPPB2048_LBSPPM0_LPA8_LPB8_LPM0_LRVW16_LWPMn1_MIAV1_MIWT2_4_MO40_MGRIPM1_NTn1_NTA0_NTB0_NTC0_NTD0_NTM0_NEPBS0_NLCA1_NLCB1_ONLL1_PGR2_PLR0_PKA0_SGROB0_SIA3_SS1_SU32_SUM0_SUS256_SPO0_SRVW0_SSO0_SVW1_SK0_SKFTR0_SKXCCM0_SGRO0_TIN0_TLDS0_TLDSMn1_ULSGRO0_USL1_UIOFGRO0_UPLRP0_USFGROn1_VSn1_VWA1_VWB1_WSGRA0_WSGRB0_WS32_WG64_2_1_WGM8_WGMXCC1_WGMXCCGn1
    SolutionIndex: 95
    SolutionNameMin: Cijk_Ailk_Bljk_BBS_BH_Bias_HA_S_SAV_UserArgs_MT64x128x32_MI16x16x1_SN_LDSB1_AFC1_AG0_AFEM1_AFEM1_ASEM1_CLR0_CADS0_DTLA0_DTLB0_DTVA0_DTVB0_DTVSM0_DPLB0_EPS0_ELFLR0_EMLLn1_FDSI0_GRPM1_GRVWA8_GRVWB8_GSU1_GSUAMB_GSUC0_GSUWGMRR0_GLS0_ISA1151_IU1_K1_LDSTI0_LBSPPA2048_LBSPPB4096_LBSPPM0_LPA8_LPB8_LPM0_LRVW16_LWPMn1_MIAV1_MIWT4_2_MO40_MGRIPM1_NTn1_NTA0_NTB0_NTC0_NTD0_NTM0_NEPBS0_NLCA1_NLCB1_ONLL1_PGR2_PLR0_PKA0_SGROB0_SIA3_SS1_SU32_SUM0_SUS256_SPO0_SRVW0_SSO0_SVW1_SK0_SKFTR0_SKXCCM0_SGRO0_TIN0_TLDS0_TLDSMn1_ULSGRO0_USL1_UIOFGRO0_UPLRP0_USFGROn1_VSn1_VWA1_VWB1_WSGRA0_WSGRB0_WS32_WG16_8_1_WGM8_WGMXCC1_WGMXCCGn1
    SolutionIndex: 96
    SolutionNameMin: Cijk_Ailk_Bljk_BBS_BH_Bias_HA_S_SAV_UserArgs_MT128x64x32_MI16x16x1_SN_LDSB1_AFC1_AG0_AFEM1_AFEM1_ASEM1_CLR0_CADS0_DTLA0_DTLB0_DTVA0_DTVB0_DTVSM0_DPLB0_EPS0_ELFLR0_EMLLn1_FDSI0_GRPM1_GRVWA8_GRVWB8_GSU1_GSUAMB_GSUC0_GSUWGMRR0_GLS0_ISA1151_IU1_K1_LDSTI0_LBSPPA4096_LBSPPB2048_LBSPPM0_LPA8_LPB8_LPM0_LRVW16_LWPMn1_MIAV1_MIWT2_4_MO40_MGRIPM1_NTn1_NTA0_NTB0_NTC0_NTD0_NTM0_NEPBS0_NLCA1_NLCB1_ONLL1_PGR1_PLR0_PKA0_SGROB0_SIA3_SS1_SU32_SUM0_SUS256_SPO0_SRVW0_SSO0_SVW1_SK0_SKFTR0_SKXCCM0_SGRO0_TIN0_TLDS0_TLDSMn1_ULSGRO0_USL1_UIOFGRO0_UPLRP0_USFGROn1_VSn1_VWA1_VWB1_WSGRA0_WSGRB0_WS32_WG64_2_1_WGM8_WGMXCC1_WGMXCCGn1
    SolutionIndex: 97
    SolutionNameMin: Cijk_Ailk_Bljk_BBS_BH_Bias_HA_S_SAV_UserArgs_MT128x96x32_MI16x16x1_SN_LDSB1_AFC1_AG0_AFEM1_AFEM1_ASEM1_CLR0_CADS0_DTLA0_DTLB0_DTVA0_DTVB0_DTVSM0_DPLB0_EPS0_ELFLR0_EMLLn1_FDSI0_GRPM1_GRVWA8_GRVWB8_GSU1_GSUAMB_GSUC0_GSUWGMRR0_GLS0_ISA1151_IU1_K1_LDSTI0_LBSPPA4096_LBSPPB3072_LBSPPM0_LPA8_LPB8_LPM0_LRVW16_LWPMn1_MIAV1_MIWT4_3_MO40_MGRIPM1_NTn1_NTA0_NTB0_NTC0_NTD0_NTM0_NEPBS0_NLCA1_NLCB1_ONLL1_PGR1_PLR0_PKA0_SGROB0_SIA3_SS1_SU32_SUM0_SUS256_SPO0_SRVW0_SSO0_SVW1_SK0_SKFTR0_SKXCCM0_SGRO0_TIN0_TLDS0_TLDSMn1_ULSGRO0_USL1_UIOFGRO0_UPLRP0_USFGROn1_VSn1_VWA1_VWB1_WSGRA0_WSGRB0_WS32_WG32_4_1_WGM8_WGMXCC1_WGMXCCGn1
    SolutionIndex: 98
    SolutionNameMin: Cijk_Ailk_Bljk_BBS_BH_Bias_HA_S_SAV_UserArgs_MT128x96x32_MI16x16x1_SN_LDSB1_AFC1_AG0_AFEM1_AFEM1_ASEM1_CLR0_CADS0_DTLA0_DTLB0_DTVA0_DTVB0_DTVSM0_DPLB0_EPS0_ELFLR0_EMLLn1_FDSI0_GRPM1_GRVWA8_GRVWB8_GSU1_GSUAMB_GSUC0_GSUWGMRR0_GLS0_ISA1151_IU1_K1_LDSTI0_LBSPPA4096_LBSPPB3072_LBSPPM0_LPA8_LPB8_LPM0_LRVW16_LWPMn1_MIAV1_MIWT4_3_MO40_MGRIPM1_NTn1_NTA0_NTB0_NTC0_NTD0_NTM0_NEPBS0_NLCA1_NLCB1_ONLL1_PGR2_PLR0_PKA0_SGROB0_SIA3_SS1_SU32_SUM0_SUS256_SPO0_SRVW0_SSO0_SVW1_SK0_SKFTR0_SKXCCM0_SGRO0_TIN0_TLDS0_TLDSMn1_ULSGRO0_USL1_UIOFGRO0_UPLRP0_USFGROn1_VSn1_VWA1_VWB1_WSGRA0_WSGRB0_WS32_WG32_4_1_WGM8_WGMXCC1_WGMXCCGn1
    SolutionIndex: 100
    SolutionNameMin: Cijk_Ailk_Bljk_BBS_BH_Bias_HA_S_SAV_UserArgs_MT128x64x32_MI16x16x1_SN_LDSB0_AFC1_AG0_AFEM1_AFEM1_ASEM1_CLR0_CADS0_DTLA0_DTLB0_DTVA0_DTVB0_DTVSM0_DPLB0_EPS0_ELFLR0_EMLLn1_FDSI0_GRPM1_GRVWA8_GRVWB8_GSU1_GSUAMB_GSUC0_GSUWGMRR0_GLS0_ISA1151_IU1_K1_LDSTI0_LBSPPA4096_LBSPPB2048_LBSPPM0_LPA8_LPB8_LPM0_LRVW16_LWPMn1_MIAV1_MIWT4_2_MO40_MGRIPM1_NTn1_NTA0_NTB0_NTC0_NTD0_NTM0_NEPBS0_NLCA1_NLCB1_ONLL1_PGR1_PLR0_PKA0_SGROB0_SIA1_SS1_SU32_SUM0_SUS256_SPO0_SRVW0_SSO0_SVW1_SK0_SKFTR0_SKXCCM0_SGRO0_TIN0_TLDS0_TLDSMn1_ULSGRO0_USL1_UIOFGRO0_UPLRP0_USFGROn1_VSn1_VWA1_VWB1_WSGRA0_WSGRB0_WS32_WG32_4_1_WGM8_WGMXCC1_WGMXCCGn1
    SolutionIndex: 102
    SolutionNameMin: Cijk_Ailk_Bljk_BBS_BH_Bias_HA_S_SAV_UserArgs_MT64x64x64_MI16x16x1_SN_LDSB0_AFC1_AG0_AFEM1_AFEM1_ASEM1_CLR0_CADS0_DTLA0_DTLB0_DTVA0_DTVB0_DTVSM0_DPLB0_EPS0_ELFLR0_EMLLn1_FDSI0_GRPM1_GRVWA8_GRVWB8_GSU1_GSUAMB_GSUC0_GSUWGMRR0_GLS0_ISA1151_IU1_K1_LDSTI0_LBSPPA2048_LBSPPB2048_LBSPPM0_LPA8_LPB8_LPM0_LRVW16_LWPMn1_MIAV1_MIWT2_2_MO40_MGRIPM1_NTn1_NTA0_NTB0_NTC0_NTD0_NTM0_NEPBS0_NLCA1_NLCB1_ONLL1_PGR2_PLR1_PKA0_SGROB0_SIA1_SS1_SU32_SUM0_SUS256_SPO0_SRVW0_SSO0_SVW1_SK0_SKFTR0_SKXCCM0_SGRO0_TIN0_TLDS0_TLDSMn1_ULSGRO0_USL1_UIOFGRO0_UPLRP0_USFGROn1_VSn1_VWA1_VWB1_WSGRA0_WSGRB0_WS32_WG32_4_1_WGM8_WGMXCC1_WGMXCCGn1
    SolutionIndex: 103
    SolutionNameMin: Cijk_Ailk_Bljk_BBS_BH_Bias_HA_S_SAV_UserArgs_MT128x16x32_MI16x16x1_SN_LDSB0_AFC1_AG0_AFEM1_AFEM1_ASEM1_CLR0_CADS0_DTLA0_DTLB0_DTVA0_DTVB0_DTVSM0_DPLB0_EPS0_ELFLR0_EMLLn1_FDSI0_GRPM1_GRVWA8_GRVWB4_GSU1_GSUAMB_GSUC0_GSUWGMRR0_GLS0_ISA1151_IU1_K1_LDSTI0_LBSPPA4096_LBSPPB512_LBSPPM0_LPA8_LPB8_LPM0_LRVW16_LWPMn1_MIAV1_MIWT2_1_MO40_MGRIPM1_NTn1_NTA0_NTB0_NTC0_NTD0_NTM0_NEPBS0_NLCA1_NLCB1_ONLL1_PGR2_PLR1_PKA0_SGROB0_SIA1_SS1_SU32_SUM0_SUS256_SPO0_SRVW0_SSO0_SVW1_SK0_SKFTR0_SKXCCM0_SGRO0_TIN0_TLDS0_TLDSMn1_ULSGRO0_USL1_UIOFGRO0_UPLRP0_USFGROn1_VSn1_VWA1_VWB1_WSGRA0_WSGRB0_WS32_WG64_2_1_WGM8_WGMXCC1_WGMXCCGn1
    SolutionIndex: 104
    SolutionNameMin: Cijk_Ailk_Bljk_BBS_BH_Bias_HA_S_SAV_UserArgs_MT128x64x32_MI16x16x1_SN_LDSB0_AFC1_AG0_AFEM1_AFEM1_ASEM1_CLR0_CADS0_DTLA0_DTLB0_DTVA0_DTVB0_DTVSM0_DPLB0_EPS0_ELFLR0_EMLLn1_FDSI0_GRPM1_GRVWA8_GRVWB8_GSU1_GSUAMB_GSUC0_GSUWGMRR0_GLS0_ISA1151_IU1_K1_LDSTI0_LBSPPA4096_LBSPPB2048_LBSPPM0_LPA8_LPB8_LPM0_LRVW16_LWPMn1_MIAV1_MIWT2_4_MO40_MGRIPM1_NTn1_NTA0_NTB0_NTC0_NTD0_NTM0_NEPBS0_NLCA1_NLCB1_ONLL1_PGR2_PLR0_PKA0_SGROB0_SIA1_SS1_SU32_SUM0_SUS256_SPO0_SRVW0_SSO0_SVW1_SK0_SKFTR0_SKXCCM0_SGRO0_TIN0_TLDS0_TLDSMn1_ULSGRO0_USL1_UIOFGRO0_UPLRP0_USFGROn1_VSn1_VWA1_VWB1_WSGRA0_WSGRB0_WS32_WG64_2_1_WGM8_WGMXCC1_WGMXCCGn1
    SolutionIndex: 106
    SolutionNameMin: Cijk_Ailk_Bljk_BBS_BH_Bias_HA_S_SAV_UserArgs_MT128x64x64_MI16x16x1_SN_LDSB1_AFC1_AG0_AFEM1_AFEM1_ASEM1_CLR0_CADS0_DTLA0_DTLB0_DTVA0_DTVB0_DTVSM0_DPLB0_EPS0_ELFLR0_EMLLn1_FDSI0_GRPM1_GRVWA8_GRVWB8_GSU1_GSUAMB_GSUC0_GSUWGMRR0_GLS0_ISA1151_IU1_K1_LDSTI0_LBSPPA4096_LBSPPB2048_LBSPPM0_LPA8_LPB8_LPM0_LRVW16_LWPMn1_MIAV1_MIWT2_4_MO40_MGRIPM1_NTn1_NTA0_NTB0_NTC0_NTD0_NTM0_NEPBS0_NLCA1_NLCB1_ONLL1_PGR1_PLR0_PKA0_SGROB0_SIA3_SS1_SU32_SUM0_SUS256_SPO0_SRVW0_SSO0_SVW1_SK0_SKFTR0_SKXCCM0_SGRO0_TIN0_TLDS0_TLDSMn1_ULSGRO0_USL1_UIOFGRO0_UPLRP0_USFGROn1_VSn1_VWA1_VWB1_WSGRA0_WSGRB0_WS32_WG64_2_1_WGM8_WGMXCC1_WGMXCCGn1
    SolutionIndex: 107
    SolutionNameMin: Cijk_Ailk_Bljk_BBS_BH_Bias_HA_S_SAV_UserArgs_MT128x64x32_MI16x16x1_SN_LDSB0_AFC1_AG0_AFEM1_AFEM1_ASEM1_CLR0_CADS0_DTLA0_DTLB0_DTVA0_DTVB0_DTVSM0_DPLB0_EPS0_ELFLR0_EMLLn1_FDSI0_GRPM1_GRVWA8_GRVWB8_GSU1_GSUAMB_GSUC0_GSUWGMRR0_GLS0_ISA1151_IU1_K1_LDSTI0_LBSPPA4096_LBSPPB2048_LBSPPM0_LPA8_LPB8_LPM0_LRVW16_LWPMn1_MIAV1_MIWT2_4_MO40_MGRIPM1_NTn1_NTA0_NTB0_NTC0_NTD0_NTM0_NEPBS0_NLCA1_NLCB1_ONLL1_PGR1_PLR0_PKA0_SGROB0_SIA3_SS1_SU32_SUM0_SUS256_SPO0_SRVW0_SSO0_SVW1_SK0_SKFTR0_SKXCCM0_SGRO0_TIN0_TLDS0_TLDSMn1_ULSGRO0_USL1_UIOFGRO0_UPLRP0_USFGROn1_VSn1_VWA1_VWB1_WSGRA0_WSGRB0_WS32_WG64_2_1_WGM8_WGMXCC1_WGMXCCGn1
    SolutionIndex: 108
    SolutionNameMin: Cijk_Ailk_Bljk_BBS_BH_Bias_HA_S_SAV_UserArgs_MT128x96x32_MI16x16x1_SN_LDSB0_AFC1_AG0_AFEM1_AFEM1_ASEM1_CLR0_CADS0_DTLA0_DTLB0_DTVA0_DTVB0_DTVSM0_DPLB0_EPS0_ELFLR0_EMLLn1_FDSI0_GRPM1_GRVWA8_GRVWB8_GSU1_GSUAMB_GSUC0_GSUWGMRR0_GLS0_ISA1151_IU1_K1_LDSTI0_LBSPPA4096_LBSPPB3072_LBSPPM0_LPA8_LPB8_LPM0_LRVW16_LWPMn1_MIAV1_MIWT4_3_MO40_MGRIPM1_NTn1_NTA0_NTB0_NTC0_NTD0_NTM0_NEPBS0_NLCA1_NLCB1_ONLL1_PGR2_PLR0_PKA0_SGROB0_SIA1_SS1_SU32_SUM0_SUS256_SPO0_SRVW0_SSO0_SVW1_SK0_SKFTR0_SKXCCM0_SGRO0_TIN0_TLDS0_TLDSMn1_ULSGRO0_USL1_UIOFGRO0_UPLRP0_USFGROn1_VSn1_VWA1_VWB1_WSGRA0_WSGRB0_WS32_WG32_4_1_WGM8_WGMXCC1_WGMXCCGn1
    SolutionIndex: 109
    SolutionNameMin: Cijk_Ailk_Bljk_BBS_BH_Bias_HA_S_SAV_UserArgs_MT64x128x32_MI16x16x1_SN_LDSB1_AFC1_AG0_AFEM1_AFEM1_ASEM1_CLR0_CADS0_DTLA0_DTLB0_DTVA0_DTVB0_DTVSM0_DPLB0_EPS0_ELFLR0_EMLLn1_FDSI0_GRPM1_GRVWA8_GRVWB8_GSU1_GSUAMB_GSUC0_GSUWGMRR0_GLS0_ISA1151_IU1_K1_LDSTI0_LBSPPA2048_LBSPPB4096_LBSPPM0_LPA8_LPB8_LPM0_LRVW16_LWPMn1_MIAV1_MIWT2_4_MO40_MGRIPM1_NTn1_NTA0_NTB0_NTC0_NTD0_NTM0_NEPBS0_NLCA1_NLCB1_ONLL1_PGR2_PLR0_PKA0_SGROB0_SIA3_SS1_SU32_SUM0_SUS256_SPO0_SRVW0_SSO0_SVW1_SK0_SKFTR0_SKXCCM0_SGRO0_TIN0_TLDS0_TLDSMn1_ULSGRO0_USL1_UIOFGRO0_UPLRP0_USFGROn1_VSn1_VWA1_VWB1_WSGRA0_WSGRB0_WS32_WG32_4_1_WGM8_WGMXCC1_WGMXCCGn1
    SolutionIndex: 112
    SolutionNameMin: Cijk_Ailk_Bljk_BBS_BH_Bias_HA_S_SAV_UserArgs_MT64x32x128_MI16x16x1_SN_LDSB0_AFC1_AG0_AFEM1_AFEM1_ASEM1_CLR0_CADS0_DTLA0_DTLB0_DTVA0_DTVB0_DTVSM0_DPLB0_EPS0_ELFLR0_EMLLn1_FDSI0_GRPM1_GRVWA8_GRVWB8_GSU1_GSUAMB_GSUC0_GSUWGMRR0_GLS0_ISA1151_IU1_K1_LDSTI0_LBSPPA2048_LBSPPB1024_LBSPPM0_LPA8_LPB8_LPM0_LRVW16_LWPMn1_MIAV1_MIWT2_1_MO40_MGRIPM1_NTn1_NTA0_NTB0_NTC0_NTD0_NTM0_NEPBS0_NLCA1_NLCB1_ONLL1_PGR2_PLR1_PKA0_SGROB0_SIA1_SS1_SU32_SUM0_SUS256_SPO0_SRVW0_SSO0_SVW1_SK0_SKFTR0_SKXCCM0_SGRO0_TIN0_TLDS0_TLDSMn1_ULSGRO0_USL1_UIOFGRO0_UPLRP0_USFGROn1_VSn1_VWA1_VWB1_WSGRA0_WSGRB0_WS32_WG32_4_1_WGM8_WGMXCC1_WGMXCCGn1
    SolutionIndex: 113
    SolutionNameMin: Cijk_Ailk_Bljk_BBS_BH_Bias_HA_S_SAV_UserArgs_MT64x16x64_MI16x16x1_SN_LDSB0_AFC1_AG0_AFEM1_AFEM1_ASEM1_CLR0_CADS0_DTLA0_DTLB0_DTVA0_DTVB0_DTVSM0_DPLB0_EPS0_ELFLR0_EMLLn1_FDSI0_GRPM1_GRVWA8_GRVWB8_GSU1_GSUAMB_GSUC0_GSUWGMRR0_GLS0_ISA1151_IU1_K1_LDSTI0_LBSPPA2048_LBSPPB512_LBSPPM0_LPA8_LPB8_LPM0_LRVW16_LWPMn1_MIAV1_MIWT1_1_MO40_MGRIPM1_NTn1_NTA0_NTB0_NTC0_NTD0_NTM0_NEPBS0_NLCA1_NLCB1_ONLL1_PGR2_PLR1_PKA0_SGROB0_SIA1_SS1_SU32_SUM0_SUS256_SPO0_SRVW0_SSO0_SVW1_SK0_SKFTR0_SKXCCM0_SGRO0_TIN0_TLDS0_TLDSMn1_ULSGRO0_USL1_UIOFGRO0_UPLRP0_USFGROn1_VSn1_VWA1_VWB1_WSGRA0_WSGRB0_WS32_WG64_2_1_WGM8_WGMXCC1_WGMXCCGn1
    SolutionIndex: 118
    SolutionNameMin: Cijk_Ailk_Bljk_BBS_BH_Bias_HA_S_SAV_UserArgs_MT64x64x128_MI16x16x1_SN_LDSB1_AFC1_AG0_AFEM1_AFEM1_ASEM1_CLR0_CADS0_DTLA0_DTLB0_DTVA0_DTVB0_DTVSM0_DPLB0_EPS0_ELFLR0_EMLLn1_FDSI0_GRPM1_GRVWA8_GRVWB8_GSU1_GSUAMB_GSUC0_GSUWGMRR0_GLS0_ISA1151_IU1_K1_LDSTI0_LBSPPA2048_LBSPPB2048_LBSPPM0_LPA8_LPB8_LPM0_LRVW16_LWPMn1_MIAV1_MIWT2_2_MO40_MGRIPM1_NTn1_NTA0_NTB0_NTC0_NTD0_NTM0_NEPBS0_NLCA1_NLCB1_ONLL1_PGR2_PLR1_PKA0_SGROB0_SIA3_SS1_SU32_SUM0_SUS256_SPO0_SRVW0_SSO0_SVW1_SK0_SKFTR0_SKXCCM0_SGRO0_TIN0_TLDS0_TLDSMn1_ULSGRO0_USL1_UIOFGRO0_UPLRP0_USFGROn1_VSn1_VWA1_VWB1_WSGRA0_WSGRB0_WS32_WG32_4_1_WGM8_WGMXCC1_WGMXCCGn1
    SolutionIndex: 120
    SolutionNameMin: Cijk_Ailk_Bljk_BBS_BH_Bias_HA_S_SAV_UserArgs_MT64x96x32_MI16x16x1_SN_LDSB0_AFC1_AG0_AFEM1_AFEM1_ASEM1_CLR0_CADS0_DTLA0_DTLB0_DTVA0_DTVB0_DTVSM0_DPLB0_EPS0_ELFLR0_EMLLn1_FDSI0_GRPM1_GRVWA8_GRVWB8_GSU1_GSUAMB_GSUC0_GSUWGMRR0_GLS0_ISA1151_IU1_K1_LDSTI0_LBSPPA2048_LBSPPB3072_LBSPPM0_LPA8_LPB8_LPM0_LRVW16_LWPMn1_MIAV1_MIWT2_3_MO40_MGRIPM1_NTn1_NTA0_NTB0_NTC0_NTD0_NTM0_NEPBS0_NLCA1_NLCB1_ONLL1_PGR2_PLR1_PKA0_SGROB0_SIA1_SS1_SU32_SUM0_SUS256_SPO0_SRVW0_SSO0_SVW1_SK0_SKFTR0_SKXCCM0_SGRO0_TIN0_TLDS0_TLDSMn1_ULSGRO0_USL1_UIOFGRO0_UPLRP0_USFGROn1_VSn1_VWA1_VWB1_WSGRA0_WSGRB0_WS32_WG32_4_1_WGM8_WGMXCC1_WGMXCCGn1
    SolutionIndex: 121
    SolutionNameMin: Cijk_Ailk_Bljk_BBS_BH_Bias_HA_S_SAV_UserArgs_MT64x96x32_MI16x16x1_SN_LDSB0_AFC1_AG0_AFEM1_AFEM1_ASEM1_CLR0_CADS0_DTLA0_DTLB0_DTVA0_DTVB0_DTVSM0_DPLB0_EPS0_ELFLR0_EMLLn1_FDSI0_GRPM1_GRVWA8_GRVWB8_GSU1_GSUAMB_GSUC0_GSUWGMRR0_GLS0_ISA1151_IU1_K1_LDSTI0_LBSPPA2048_LBSPPB3072_LBSPPM0_LPA8_LPB8_LPM0_LRVW16_LWPMn1_MIAV1_MIWT2_3_MO40_MGRIPM1_NTn1_NTA0_NTB0_NTC0_NTD0_NTM0_NEPBS0_NLCA1_NLCB1_ONLL1_PGR2_PLR0_PKA0_SGROB0_SIA1_SS1_SU32_SUM0_SUS256_SPO0_SRVW0_SSO0_SVW1_SK0_SKFTR0_SKXCCM0_SGRO0_TIN0_TLDS0_TLDSMn1_ULSGRO0_USL1_UIOFGRO0_UPLRP0_USFGROn1_VSn1_VWA1_VWB1_WSGRA0_WSGRB0_WS32_WG32_4_1_WGM8_WGMXCC1_WGMXCCGn1
    SolutionIndex: 122
    SolutionNameMin: Cijk_Ailk_Bljk_BBS_BH_Bias_HA_S_SAV_UserArgs_MT64x96x32_MI16x16x1_SN_LDSB0_AFC1_AG0_AFEM1_AFEM1_ASEM1_CLR0_CADS0_DTLA0_DTLB0_DTVA0_DTVB0_DTVSM0_DPLB0_EPS0_ELFLR0_EMLLn1_FDSI0_GRPM1_GRVWA8_GRVWB8_GSU1_GSUAMB_GSUC0_GSUWGMRR0_GLS0_ISA1151_IU1_K1_LDSTI0_LBSPPA2048_LBSPPB3072_LBSPPM0_LPA8_LPB8_LPM0_LRVW16_LWPMn1_MIAV1_MIWT2_3_MO40_MGRIPM1_NTn1_NTA0_NTB0_NTC0_NTD0_NTM0_NEPBS0_NLCA1_NLCB1_ONLL1_PGR2_PLR1_PKA0_SGROB0_SIA3_SS1_SU32_SUM0_SUS256_SPO0_SRVW0_SSO0_SVW1_SK0_SKFTR0_SKXCCM0_SGRO0_TIN0_TLDS0_TLDSMn1_ULSGRO0_USL1_UIOFGRO0_UPLRP0_USFGROn1_VSn1_VWA1_VWB1_WSGRA0_WSGRB0_WS32_WG32_4_1_WGM8_WGMXCC1_WGMXCCGn1
    SolutionIndex: 127
    SolutionNameMin: Cijk_Ailk_Bljk_BBS_BH_Bias_HA_S_SAV_UserArgs_MT128x32x32_MI16x16x1_SN_LDSB1_AFC1_AG0_AFEM1_AFEM1_ASEM1_CLR0_CADS0_DTLA0_DTLB0_DTVA0_DTVB0_DTVSM0_DPLB0_EPS0_ELFLR0_EMLLn1_FDSI0_GRPM1_GRVWA8_GRVWB8_GSU1_GSUAMB_GSUC0_GSUWGMRR0_GLS0_ISA1151_IU1_K1_LDSTI0_LBSPPA4096_LBSPPB1024_LBSPPM0_LPA8_LPB8_LPM0_LRVW16_LWPMn1_MIAV1_MIWT2_2_MO40_MGRIPM1_NTn1_NTA0_NTB0_NTC0_NTD0_NTM0_NEPBS0_NLCA1_NLCB1_ONLL1_PGR2_PLR0_PKA0_SGROB0_SIA3_SS1_SU32_SUM0_SUS256_SPO0_SRVW0_SSO0_SVW1_SK0_SKFTR0_SKXCCM0_SGRO0_TIN0_TLDS0_TLDSMn1_ULSGRO0_USL1_UIOFGRO0_UPLRP0_USFGROn1_VSn1_VWA1_VWB1_WSGRA0_WSGRB0_WS32_WG64_2_1_WGM8_WGMXCC1_WGMXCCGn1
    SolutionIndex: 128
    SolutionNameMin: Cijk_Ailk_Bljk_BBS_BH_Bias_HA_S_SAV_UserArgs_MT128x32x64_MI16x16x1_SN_LDSB1_AFC1_AG0_AFEM1_AFEM1_ASEM1_CLR0_CADS0_DTLA0_DTLB0_DTVA0_DTVB0_DTVSM0_DPLB0_EPS0_ELFLR0_EMLLn1_FDSI0_GRPM1_GRVWA8_GRVWB8_GSU1_GSUAMB_GSUC0_GSUWGMRR0_GLS0_ISA1151_IU1_K1_LDSTI0_LBSPPA4096_LBSPPB1024_LBSPPM0_LPA8_LPB8_LPM0_LRVW16_LWPMn1_MIAV1_MIWT2_2_MO40_MGRIPM1_NTn1_NTA0_NTB0_NTC0_NTD0_NTM0_NEPBS0_NLCA1_NLCB1_ONLL1_PGR2_PLR0_PKA0_SGROB0_SIA3_SS1_SU32_SUM0_SUS256_SPO0_SRVW0_SSO0_SVW1_SK0_SKFTR0_SKXCCM0_SGRO0_TIN0_TLDS0_TLDSMn1_ULSGRO0_USL1_UIOFGRO0_UPLRP0_USFGROn1_VSn1_VWA1_VWB1_WSGRA0_WSGRB0_WS32_WG64_2_1_WGM8_WGMXCC1_WGMXCCGn1
    SolutionIndex: 129
    SolutionNameMin: Cijk_Ailk_Bljk_BBS_BH_Bias_HA_S_SAV_UserArgs_MT16x16x128_MI16x16x1_SN_LDSB0_AFC1_AG0_AFEM1_AFEM1_ASEM1_CLR0_CADS0_DTLA0_DTLB0_DTVA0_DTVB0_DTVSM0_DPLB0_EPS0_ELFLR0_EMLLn1_FDSI0_GRPM1_GRVWA8_GRVWB8_GSU1_GSUAMB_GSUC0_GSUWGMRR0_GLS0_ISA1151_IU1_K1_LDSTI0_LBSPPA512_LBSPPB512_LBSPPM0_LPA8_LPB8_LPM0_LRVW16_LWPMn1_MIAV1_MIWT1_1_MO40_MGRIPM1_NTn1_NTA0_NTB0_NTC0_NTD0_NTM0_NEPBS0_NLCA1_NLCB1_ONLL1_PGR1_PLR1_PKA0_SGROB0_SIA3_SS1_SU32_SUM0_SUS256_SPO0_SRVW0_SSO0_SVW1_SK0_SKFTR0_SKXCCM0_SGRO0_TIN0_TLDS0_TLDSMn1_ULSGRO0_USL1_UIOFGRO0_UPLRP0_USFGROn1_VSn1_VWA1_VWB1_WSGRA0_WSGRB0_WS32_WG16_2_1_WGM8_WGMXCC1_WGMXCCGn1
    SolutionIndex: 130
    SolutionNameMin: Cijk_Ailk_Bljk_BBS_BH_Bias_HA_S_SAV_UserArgs_MT64x48x64_MI16x16x1_SN_LDSB0_AFC1_AG0_AFEM1_AFEM1_ASEM1_CLR0_CADS0_DTLA0_DTLB0_DTVA0_DTVB0_DTVSM0_DPLB0_EPS0_ELFLR0_EMLLn1_FDSI0_GRPM1_GRVWA8_GRVWB8_GSU1_GSUAMB_GSUC0_GSUWGMRR0_GLS0_ISA1151_IU1_K1_LDSTI0_LBSPPA2048_LBSPPB1536_LBSPPM0_LPA8_LPB8_LPM0_LRVW16_LWPMn1_MIAV1_MIWT1_3_MO40_MGRIPM1_NTn1_NTA0_NTB0_NTC0_NTD0_NTM0_NEPBS0_NLCA1_NLCB1_ONLL1_PGR2_PLR1_PKA0_SGROB0_SIA1_SS1_SU32_SUM0_SUS256_SPO0_SRVW0_SSO0_SVW1_SK0_SKFTR0_SKXCCM0_SGRO0_TIN0_TLDS0_TLDSMn1_ULSGRO0_USL1_UIOFGRO0_UPLRP0_USFGROn1_VSn1_VWA1_VWB1_WSGRA0_WSGRB0_WS32_WG64_2_1_WGM8_WGMXCC1_WGMXCCGn1
    SolutionIndex: 131
    SolutionNameMin: Cijk_Ailk_Bljk_BBS_BH_Bias_HA_S_SAV_UserArgs_MT128x32x32_MI16x16x1_SN_LDSB0_AFC1_AG0_AFEM1_AFEM1_ASEM1_CLR0_CADS0_DTLA0_DTLB0_DTVA0_DTVB0_DTVSM0_DPLB0_EPS0_ELFLR0_EMLLn1_FDSI0_GRPM1_GRVWA8_GRVWB8_GSU1_GSUAMB_GSUC0_GSUWGMRR0_GLS0_ISA1151_IU1_K1_LDSTI0_LBSPPA4096_LBSPPB1024_LBSPPM0_LPA8_LPB8_LPM0_LRVW16_LWPMn1_MIAV1_MIWT2_2_MO40_MGRIPM1_NTn1_NTA0_NTB0_NTC0_NTD0_NTM0_NEPBS0_NLCA1_NLCB1_ONLL1_PGR2_PLR0_PKA0_SGROB0_SIA1_SS1_SU32_SUM0_SUS256_SPO0_SRVW0_SSO0_SVW1_SK0_SKFTR0_SKXCCM0_SGRO0_TIN0_TLDS0_TLDSMn1_ULSGRO0_USL1_UIOFGRO0_UPLRP0_USFGROn1_VSn1_VWA1_VWB1_WSGRA0_WSGRB0_WS32_WG64_2_1_WGM8_WGMXCC1_WGMXCCGn1
    SolutionIndex: 133
    SolutionNameMin: Cijk_Ailk_Bljk_BBS_BH_Bias_HA_S_SAV_UserArgs_MT128x32x32_MI16x16x1_SN_LDSB1_AFC1_AG0_AFEM1_AFEM1_ASEM1_CLR0_CADS0_DTLA0_DTLB0_DTVA0_DTVB0_DTVSM0_DPLB0_EPS0_ELFLR0_EMLLn1_FDSI0_GRPM1_GRVWA8_GRVWB8_GSU1_GSUAMB_GSUC0_GSUWGMRR0_GLS0_ISA1151_IU1_K1_LDSTI0_LBSPPA4096_LBSPPB1024_LBSPPM0_LPA8_LPB8_LPM0_LRVW16_LWPMn1_MIAV1_MIWT2_2_MO40_MGRIPM1_NTn1_NTA0_NTB0_NTC0_NTD0_NTM0_NEPBS0_NLCA1_NLCB1_ONLL1_PGR1_PLR0_PKA0_SGROB0_SIA3_SS1_SU32_SUM0_SUS256_SPO0_SRVW0_SSO0_SVW1_SK0_SKFTR0_SKXCCM0_SGRO0_TIN0_TLDS0_TLDSMn1_ULSGRO0_USL1_UIOFGRO0_UPLRP0_USFGROn1_VSn1_VWA1_VWB1_WSGRA0_WSGRB0_WS32_WG64_2_1_WGM8_WGMXCC1_WGMXCCGn1
    SolutionIndex: 134
    SolutionNameMin: Cijk_Ailk_Bljk_BBS_BH_Bias_HA_S_SAV_UserArgs_MT64x64x32_MI16x16x1_SN_LDSB1_AFC1_AG0_AFEM1_AFEM1_ASEM1_CLR0_CADS0_DTLA0_DTLB0_DTVA0_DTVB0_DTVSM0_DPLB0_EPS0_ELFLR0_EMLLn1_FDSI0_GRPM1_GRVWA8_GRVWB8_GSU1_GSUAMB_GSUC0_GSUWGMRR0_GLS0_ISA1151_IU1_K1_LDSTI0_LBSPPA2048_LBSPPB2048_LBSPPM0_LPA8_LPB8_LPM0_LRVW16_LWPMn1_MIAV1_MIWT2_2_MO40_MGRIPM1_NTn1_NTA0_NTB0_NTC0_NTD0_NTM0_NEPBS0_NLCA1_NLCB1_ONLL1_PGR2_PLR0_PKA0_SGROB0_SIA3_SS1_SU32_SUM0_SUS256_SPO0_SRVW0_SSO0_SVW1_SK0_SKFTR0_SKXCCM0_SGRO0_TIN0_TLDS0_TLDSMn1_ULSGRO0_USL1_UIOFGRO0_UPLRP0_USFGROn1_VSn1_VWA1_VWB1_WSGRA0_WSGRB0_WS32_WG32_4_1_WGM8_WGMXCC1_WGMXCCGn1
    SolutionIndex: 135
    SolutionNameMin: Cijk_Ailk_Bljk_BBS_BH_Bias_HA_S_SAV_UserArgs_MT32x16x32_MI16x16x1_SN_LDSB0_AFC1_AG0_AFEM1_AFEM1_ASEM1_CLR0_CADS0_DTLA0_DTLB0_DTVA0_DTVB0_DTVSM0_DPLB0_EPS0_ELFLR0_EMLLn1_FDSI0_GRPM1_GRVWA8_GRVWB8_GSU1_GSUAMB_GSUC0_GSUWGMRR0_GLS0_ISA1151_IU1_K1_LDSTI0_LBSPPA1024_LBSPPB512_LBSPPM0_LPA8_LPB8_LPM0_LRVW16_LWPMn1_MIAV1_MIWT1_1_MO40_MGRIPM1_NTn1_NTA0_NTB0_NTC0_NTD0_NTM0_NEPBS0_NLCA1_NLCB1_ONLL1_PGR2_PLR1_PKA0_SGROB0_SIA3_SS1_SU32_SUM0_SUS256_SPO0_SRVW0_SSO0_SVW1_SK0_SKFTR0_SKXCCM0_SGRO0_TIN0_TLDS0_TLDSMn1_ULSGRO0_USL1_UIOFGRO0_UPLRP0_USFGROn1_VSn1_VWA1_VWB1_WSGRA0_WSGRB0_WS32_WG32_2_1_WGM8_WGMXCC1_WGMXCCGn1
    SolutionIndex: 136
    SolutionNameMin: Cijk_Ailk_Bljk_BBS_BH_Bias_HA_S_SAV_UserArgs_MT32x16x128_MI16x16x1_SN_LDSB0_AFC1_AG0_AFEM1_AFEM1_ASEM1_CLR0_CADS0_DTLA0_DTLB0_DTVA0_DTVB0_DTVSM0_DPLB0_EPS0_ELFLR0_EMLLn1_FDSI0_GRPM1_GRVWA8_GRVWB8_GSU1_GSUAMB_GSUC0_GSUWGMRR0_GLS0_ISA1151_IU1_K1_LDSTI0_LBSPPA1024_LBSPPB512_LBSPPM0_LPA8_LPB8_LPM0_LRVW16_LWPMn1_MIAV1_MIWT1_1_MO40_MGRIPM1_NTn1_NTA0_NTB0_NTC0_NTD0_NTM0_NEPBS0_NLCA1_NLCB1_ONLL1_PGR2_PLR1_PKA0_SGROB0_SIA1_SS1_SU32_SUM0_SUS256_SPO0_SRVW0_SSO0_SVW1_SK0_SKFTR0_SKXCCM0_SGRO0_TIN0_TLDS0_TLDSMn1_ULSGRO0_USL1_UIOFGRO0_UPLRP0_USFGROn1_VSn1_VWA1_VWB1_WSGRA0_WSGRB0_WS32_WG32_2_1_WGM8_WGMXCC1_WGMXCCGn1
    SolutionIndex: 137
    SolutionNameMin: Cijk_Ailk_Bljk_BBS_BH_Bias_HA_S_SAV_UserArgs_MT64x16x128_MI16x16x1_SN_LDSB0_AFC1_AG0_AFEM1_AFEM1_ASEM1_CLR0_CADS0_DTLA0_DTLB0_DTVA0_DTVB0_DTVSM0_DPLB0_EPS0_ELFLR0_EMLLn1_FDSI0_GRPM1_GRVWA8_GRVWB8_GSU1_GSUAMB_GSUC0_GSUWGMRR0_GLS0_ISA1151_IU1_K1_LDSTI0_LBSPPA2048_LBSPPB512_LBSPPM0_LPA8_LPB8_LPM0_LRVW16_LWPMn1_MIAV1_MIWT1_1_MO40_MGRIPM1_NTn1_NTA0_NTB0_NTC0_NTD0_NTM0_NEPBS0_NLCA1_NLCB1_ONLL1_PGR1_PLR1_PKA0_SGROB0_SIA1_SS1_SU32_SUM0_SUS256_SPO0_SRVW0_SSO0_SVW1_SK0_SKFTR0_SKXCCM0_SGRO0_TIN0_TLDS0_TLDSMn1_ULSGRO0_USL1_UIOFGRO0_UPLRP0_USFGROn1_VSn1_VWA1_VWB1_WSGRA0_WSGRB0_WS32_WG64_2_1_WGM8_WGMXCC1_WGMXCCGn1
    SolutionIndex: 138
    SolutionNameMin: Cijk_Ailk_Bljk_BBS_BH_Bias_HA_S_SAV_UserArgs_MT32x16x64_MI16x16x1_SN_LDSB0_AFC1_AG0_AFEM1_AFEM1_ASEM1_CLR0_CADS0_DTLA0_DTLB0_DTVA0_DTVB0_DTVSM0_DPLB0_EPS0_ELFLR0_EMLLn1_FDSI0_GRPM1_GRVWA8_GRVWB8_GSU1_GSUAMB_GSUC0_GSUWGMRR0_GLS0_ISA1151_IU1_K1_LDSTI0_LBSPPA1024_LBSPPB512_LBSPPM0_LPA8_LPB8_LPM0_LRVW16_LWPMn1_MIAV1_MIWT1_1_MO40_MGRIPM1_NTn1_NTA0_NTB0_NTC0_NTD0_NTM0_NEPBS0_NLCA1_NLCB1_ONLL1_PGR2_PLR1_PKA0_SGROB0_SIA1_SS1_SU32_SUM0_SUS256_SPO0_SRVW0_SSO0_SVW1_SK0_SKFTR0_SKXCCM0_SGRO0_TIN0_TLDS0_TLDSMn1_ULSGRO0_USL1_UIOFGRO0_UPLRP0_USFGROn1_VSn1_VWA1_VWB1_WSGRA0_WSGRB0_WS32_WG32_2_1_WGM8_WGMXCC1_WGMXCCGn1
    SolutionIndex: 139
    SolutionNameMin: Cijk_Ailk_Bljk_BBS_BH_Bias_HA_S_SAV_UserArgs_MT128x64x32_MI16x16x1_SN_LDSB1_AFC1_AG0_AFEM1_AFEM1_ASEM1_CLR0_CADS0_DTLA0_DTLB0_DTVA0_DTVB0_DTVSM0_DPLB0_EPS0_ELFLR0_EMLLn1_FDSI0_GRPM1_GRVWA8_GRVWB8_GSU1_GSUAMB_GSUC0_GSUWGMRR0_GLS0_ISA1151_IU1_K1_LDSTI0_LBSPPA4096_LBSPPB2048_LBSPPM0_LPA8_LPB8_LPM0_LRVW16_LWPMn1_MIAV1_MIWT4_2_MO40_MGRIPM1_NTn1_NTA0_NTB0_NTC0_NTD0_NTM0_NEPBS0_NLCA1_NLCB1_ONLL1_PGR1_PLR0_PKA0_SGROB0_SIA3_SS1_SU32_SUM0_SUS256_SPO0_SRVW0_SSO0_SVW1_SK0_SKFTR0_SKXCCM0_SGRO0_TIN0_TLDS0_TLDSMn1_ULSGRO0_USL1_UIOFGRO0_UPLRP0_USFGROn1_VSn1_VWA1_VWB1_WSGRA0_WSGRB0_WS32_WG32_4_1_WGM8_WGMXCC1_WGMXCCGn1
    SolutionIndex: 140
    SolutionNameMin: Cijk_Ailk_Bljk_BBS_BH_Bias_HA_S_SAV_UserArgs_MT64x16x128_MI16x16x1_SN_LDSB0_AFC1_AG0_AFEM1_AFEM1_ASEM1_CLR0_CADS0_DTLA0_DTLB0_DTVA0_DTVB0_DTVSM0_DPLB0_EPS0_ELFLR0_EMLLn1_FDSI0_GRPM1_GRVWA8_GRVWB8_GSU1_GSUAMB_GSUC0_GSUWGMRR0_GLS0_ISA1151_IU1_K1_LDSTI0_LBSPPA2048_LBSPPB512_LBSPPM0_LPA8_LPB8_LPM0_LRVW16_LWPMn1_MIAV1_MIWT1_1_MO40_MGRIPM1_NTn1_NTA0_NTB0_NTC0_NTD0_NTM0_NEPBS0_NLCA1_NLCB1_ONLL1_PGR2_PLR1_PKA0_SGROB0_SIA3_SS1_SU32_SUM0_SUS256_SPO0_SRVW0_SSO0_SVW1_SK0_SKFTR0_SKXCCM0_SGRO0_TIN0_TLDS0_TLDSMn1_ULSGRO0_USL1_UIOFGRO0_UPLRP0_USFGROn1_VSn1_VWA1_VWB1_WSGRA0_WSGRB0_WS32_WG64_2_1_WGM8_WGMXCC1_WGMXCCGn1
    SolutionIndex: 141
    SolutionNameMin: Cijk_Ailk_Bljk_BBS_BH_Bias_HA_S_SAV_UserArgs_MT32x16x64_MI16x16x1_SN_LDSB0_AFC1_AG0_AFEM1_AFEM1_ASEM1_CLR0_CADS0_DTLA0_DTLB0_DTVA0_DTVB0_DTVSM0_DPLB0_EPS0_ELFLR0_EMLLn1_FDSI0_GRPM1_GRVWA8_GRVWB8_GSU1_GSUAMB_GSUC0_GSUWGMRR0_GLS0_ISA1151_IU1_K1_LDSTI0_LBSPPA1024_LBSPPB512_LBSPPM0_LPA8_LPB8_LPM0_LRVW16_LWPMn1_MIAV1_MIWT1_1_MO40_MGRIPM1_NTn1_NTA0_NTB0_NTC0_NTD0_NTM0_NEPBS0_NLCA1_NLCB1_ONLL1_PGR2_PLR1_PKA0_SGROB0_SIA3_SS1_SU32_SUM0_SUS256_SPO0_SRVW0_SSO0_SVW1_SK0_SKFTR0_SKXCCM0_SGRO0_TIN0_TLDS0_TLDSMn1_ULSGRO0_USL1_UIOFGRO0_UPLRP0_USFGROn1_VSn1_VWA1_VWB1_WSGRA0_WSGRB0_WS32_WG32_2_1_WGM8_WGMXCC1_WGMXCCGn1
    SolutionIndex: 142
    SolutionNameMin: Cijk_Ailk_Bljk_BBS_BH_Bias_HA_S_SAV_UserArgs_MT64x16x64_MI16x16x1_SN_LDSB0_AFC1_AG0_AFEM1_AFEM1_ASEM1_CLR0_CADS0_DTLA0_DTLB0_DTVA0_DTVB0_DTVSM0_DPLB0_EPS0_ELFLR0_EMLLn1_FDSI0_GRPM1_GRVWA8_GRVWB8_GSU1_GSUAMB_GSUC0_GSUWGMRR0_GLS0_ISA1151_IU1_K1_LDSTI0_LBSPPA2048_LBSPPB512_LBSPPM0_LPA8_LPB8_LPM0_LRVW16_LWPMn1_MIAV1_MIWT1_1_MO40_MGRIPM1_NTn1_NTA0_NTB0_NTC0_NTD0_NTM0_NEPBS0_NLCA1_NLCB1_ONLL1_PGR1_PLR1_PKA0_SGROB0_SIA3_SS1_SU32_SUM0_SUS256_SPO0_SRVW0_SSO0_SVW1_SK0_SKFTR0_SKXCCM0_SGRO0_TIN0_TLDS0_TLDSMn1_ULSGRO0_USL1_UIOFGRO0_UPLRP0_USFGROn1_VSn1_VWA1_VWB1_WSGRA0_WSGRB0_WS32_WG64_2_1_WGM8_WGMXCC1_WGMXCCGn1
    SolutionIndex: 143
    SolutionNameMin: Cijk_Ailk_Bljk_BBS_BH_Bias_HA_S_SAV_UserArgs_MT16x16x64_MI16x16x1_SN_LDSB0_AFC1_AG0_AFEM1_AFEM1_ASEM1_CLR0_CADS0_DTLA0_DTLB0_DTVA0_DTVB0_DTVSM0_DPLB0_EPS0_ELFLR0_EMLLn1_FDSI0_GRPM1_GRVWA8_GRVWB8_GSU1_GSUAMB_GSUC0_GSUWGMRR0_GLS0_ISA1151_IU1_K1_LDSTI0_LBSPPA512_LBSPPB512_LBSPPM0_LPA8_LPB8_LPM0_LRVW16_LWPMn1_MIAV1_MIWT1_1_MO40_MGRIPM1_NTn1_NTA0_NTB0_NTC0_NTD0_NTM0_NEPBS0_NLCA1_NLCB1_ONLL1_PGR2_PLR0_PKA0_SGROB0_SIA3_SS1_SU32_SUM0_SUS256_SPO0_SRVW0_SSO0_SVW1_SK0_SKFTR0_SKXCCM0_SGRO0_TIN0_TLDS0_TLDSMn1_ULSGRO0_USL1_UIOFGRO0_UPLRP0_USFGROn1_VSn1_VWA1_VWB1_WSGRA0_WSGRB0_WS32_WG16_2_1_WGM8_WGMXCC1_WGMXCCGn1
    SolutionIndex: 144
    SolutionNameMin: Cijk_Ailk_Bljk_BBS_BH_Bias_HA_S_SAV_UserArgs_MT64x32x64_MI16x16x1_SN_LDSB0_AFC1_AG0_AFEM1_AFEM1_ASEM1_CLR0_CADS0_DTLA0_DTLB0_DTVA0_DTVB0_DTVSM0_DPLB0_EPS0_ELFLR0_EMLLn1_FDSI0_GRPM1_GRVWA8_GRVWB8_GSU1_GSUAMB_GSUC0_GSUWGMRR0_GLS0_ISA1151_IU1_K1_LDSTI0_LBSPPA2048_LBSPPB1024_LBSPPM0_LPA8_LPB8_LPM0_LRVW16_LWPMn1_MIAV1_MIWT2_1_MO40_MGRIPM1_NTn1_NTA0_NTB0_NTC0_NTD0_NTM0_NEPBS0_NLCA1_NLCB1_ONLL1_PGR2_PLR0_PKA0_SGROB0_SIA3_SS1_SU32_SUM0_SUS256_SPO0_SRVW0_SSO0_SVW1_SK0_SKFTR0_SKXCCM0_SGRO0_TIN0_TLDS0_TLDSMn1_ULSGRO0_USL1_UIOFGRO0_UPLRP0_USFGROn1_VSn1_VWA1_VWB1_WSGRA0_WSGRB0_WS32_WG32_4_1_WGM8_WGMXCC1_WGMXCCGn1
    SolutionIndex: 145
    SolutionNameMin: Cijk_Ailk_Bljk_BBS_BH_Bias_HA_S_SAV_UserArgs_MT32x16x16_MI16x16x1_SN_LDSB0_AFC1_AG0_AFEM1_AFEM1_ASEM1_CLR0_CADS0_DTLA0_DTLB0_DTVA0_DTVB0_DTVSM0_DPLB0_EPS0_ELFLR0_EMLLn1_FDSI0_GRPM1_GRVWA8_GRVWB4_GSU1_GSUAMB_GSUC0_GSUWGMRR0_GLS0_ISA1151_IU1_K1_LDSTI0_LBSPPA1024_LBSPPB512_LBSPPM0_LPA8_LPB8_LPM0_LRVW16_LWPMn1_MIAV1_MIWT1_1_MO40_MGRIPM1_NTn1_NTA0_NTB0_NTC0_NTD0_NTM0_NEPBS0_NLCA1_NLCB1_ONLL1_PGR2_PLR1_PKA0_SGROB0_SIA3_SS1_SU32_SUM0_SUS256_SPO0_SRVW0_SSO0_SVW1_SK0_SKFTR0_SKXCCM0_SGRO0_TIN0_TLDS0_TLDSMn1_ULSGRO0_USL1_UIOFGRO0_UPLRP0_USFGROn1_VSn1_VWA1_VWB1_WSGRA0_WSGRB0_WS32_WG32_2_1_WGM8_WGMXCC1_WGMXCCGn1
    SolutionIndex: 146
    SolutionNameMin: Cijk_Ailk_Bljk_BBS_BH_Bias_HA_S_SAV_UserArgs_MT16x16x64_MI16x16x1_SN_LDSB0_AFC1_AG0_AFEM1_AFEM1_ASEM1_CLR0_CADS0_DTLA0_DTLB0_DTVA0_DTVB0_DTVSM0_DPLB0_EPS0_ELFLR0_EMLLn1_FDSI0_GRPM1_GRVWA8_GRVWB8_GSU1_GSUAMB_GSUC0_GSUWGMRR0_GLS0_ISA1151_IU1_K1_LDSTI0_LBSPPA512_LBSPPB512_LBSPPM0_LPA8_LPB8_LPM0_LRVW16_LWPMn1_MIAV1_MIWT1_1_MO40_MGRIPM1_NTn1_NTA0_NTB0_NTC0_NTD0_NTM0_NEPBS0_NLCA1_NLCB1_ONLL1_PGR1_PLR1_PKA0_SGROB0_SIA3_SS1_SU32_SUM0_SUS256_SPO0_SRVW0_SSO0_SVW1_SK0_SKFTR0_SKXCCM0_SGRO0_TIN0_TLDS0_TLDSMn1_ULSGRO0_USL1_UIOFGRO0_UPLRP0_USFGROn1_VSn1_VWA1_VWB1_WSGRA0_WSGRB0_WS32_WG16_2_1_WGM8_WGMXCC1_WGMXCCGn1
    SolutionIndex: 147
    SolutionNameMin: Cijk_Ailk_Bljk_BBS_BH_Bias_HA_S_SAV_UserArgs_MT16x16x64_MI16x16x1_SN_LDSB0_AFC1_AG0_AFEM1_AFEM1_ASEM1_CLR0_CADS0_DTLA0_DTLB0_DTVA0_DTVB0_DTVSM0_DPLB0_EPS0_ELFLR0_EMLLn1_FDSI0_GRPM1_GRVWA8_GRVWB8_GSU1_GSUAMB_GSUC0_GSUWGMRR0_GLS0_ISA1151_IU1_K1_LDSTI0_LBSPPA512_LBSPPB512_LBSPPM0_LPA8_LPB8_LPM0_LRVW16_LWPMn1_MIAV1_MIWT1_1_MO40_MGRIPM1_NTn1_NTA0_NTB0_NTC0_NTD0_NTM0_NEPBS0_NLCA1_NLCB1_ONLL1_PGR2_PLR1_PKA0_SGROB0_SIA1_SS1_SU32_SUM0_SUS256_SPO0_SRVW0_SSO0_SVW1_SK0_SKFTR0_SKXCCM0_SGRO0_TIN0_TLDS0_TLDSMn1_ULSGRO0_USL1_UIOFGRO0_UPLRP0_USFGROn1_VSn1_VWA1_VWB1_WSGRA0_WSGRB0_WS32_WG16_2_1_WGM8_WGMXCC1_WGMXCCGn1
    SolutionIndex: 148
    SolutionNameMin: Cijk_Ailk_Bljk_BBS_BH_Bias_HA_S_SAV_UserArgs_MT32x16x128_MI16x16x1_SN_LDSB0_AFC1_AG0_AFEM1_AFEM1_ASEM1_CLR0_CADS0_DTLA0_DTLB0_DTVA0_DTVB0_DTVSM0_DPLB0_EPS0_ELFLR0_EMLLn1_FDSI0_GRPM1_GRVWA8_GRVWB8_GSU1_GSUAMB_GSUC0_GSUWGMRR0_GLS0_ISA1151_IU1_K1_LDSTI0_LBSPPA1024_LBSPPB512_LBSPPM0_LPA8_LPB8_LPM0_LRVW16_LWPMn1_MIAV1_MIWT1_1_MO40_MGRIPM1_NTn1_NTA0_NTB0_NTC0_NTD0_NTM0_NEPBS0_NLCA1_NLCB1_ONLL1_PGR2_PLR1_PKA0_SGROB0_SIA3_SS1_SU32_SUM0_SUS256_SPO0_SRVW0_SSO0_SVW1_SK0_SKFTR0_SKXCCM0_SGRO0_TIN0_TLDS0_TLDSMn1_ULSGRO0_USL1_UIOFGRO0_UPLRP0_USFGROn1_VSn1_VWA1_VWB1_WSGRA0_WSGRB0_WS32_WG32_2_1_WGM8_WGMXCC1_WGMXCCGn1
    SolutionIndex: 149
    SolutionNameMin: Cijk_Ailk_Bljk_BBS_BH_Bias_HA_S_SAV_UserArgs_MT32x16x128_MI16x16x1_SN_LDSB0_AFC1_AG0_AFEM1_AFEM1_ASEM1_CLR0_CADS0_DTLA0_DTLB0_DTVA0_DTVB0_DTVSM0_DPLB0_EPS0_ELFLR0_EMLLn1_FDSI0_GRPM1_GRVWA8_GRVWB8_GSU1_GSUAMB_GSUC0_GSUWGMRR0_GLS0_ISA1151_IU1_K1_LDSTI0_LBSPPA1024_LBSPPB512_LBSPPM0_LPA8_LPB8_LPM0_LRVW16_LWPMn1_MIAV1_MIWT1_1_MO40_MGRIPM1_NTn1_NTA0_NTB0_NTC0_NTD0_NTM0_NEPBS0_NLCA1_NLCB1_ONLL1_PGR1_PLR1_PKA0_SGROB0_SIA1_SS1_SU32_SUM0_SUS256_SPO0_SRVW0_SSO0_SVW1_SK0_SKFTR0_SKXCCM0_SGRO0_TIN0_TLDS0_TLDSMn1_ULSGRO0_USL1_UIOFGRO0_UPLRP0_USFGROn1_VSn1_VWA1_VWB1_WSGRA0_WSGRB0_WS32_WG32_2_1_WGM8_WGMXCC1_WGMXCCGn1
    SolutionIndex: 150
    SolutionNameMin: Cijk_Ailk_Bljk_BBS_BH_Bias_HA_S_SAV_UserArgs_MT32x16x32_MI16x16x1_SN_LDSB1_AFC1_AG0_AFEM1_AFEM1_ASEM1_CLR0_CADS0_DTLA0_DTLB0_DTVA0_DTVB0_DTVSM0_DPLB0_EPS0_ELFLR0_EMLLn1_FDSI0_GRPM1_GRVWA8_GRVWB8_GSU1_GSUAMB_GSUC0_GSUWGMRR0_GLS0_ISA1151_IU1_K1_LDSTI0_LBSPPA1024_LBSPPB512_LBSPPM0_LPA8_LPB8_LPM0_LRVW16_LWPMn1_MIAV1_MIWT1_1_MO40_MGRIPM1_NTn1_NTA0_NTB0_NTC0_NTD0_NTM0_NEPBS0_NLCA1_NLCB1_ONLL1_PGR2_PLR1_PKA0_SGROB0_SIA3_SS1_SU32_SUM0_SUS256_SPO0_SRVW0_SSO0_SVW1_SK0_SKFTR0_SKXCCM0_SGRO0_TIN0_TLDS0_TLDSMn1_ULSGRO0_USL1_UIOFGRO0_UPLRP0_USFGROn1_VSn1_VWA1_VWB1_WSGRA0_WSGRB0_WS32_WG32_2_1_WGM8_WGMXCC1_WGMXCCGn1
    SolutionIndex: 151
    SolutionNameMin: Cijk_Ailk_Bljk_BBS_BH_Bias_HA_S_SAV_UserArgs_MT16x16x64_MI16x16x1_SN_LDSB0_AFC1_AG0_AFEM1_AFEM1_ASEM1_CLR0_CADS0_DTLA0_DTLB0_DTVA0_DTVB0_DTVSM0_DPLB0_EPS0_ELFLR0_EMLLn1_FDSI0_GRPM1_GRVWA8_GRVWB8_GSU1_GSUAMB_GSUC0_GSUWGMRR0_GLS0_ISA1151_IU1_K1_LDSTI0_LBSPPA512_LBSPPB512_LBSPPM0_LPA8_LPB8_LPM0_LRVW16_LWPMn1_MIAV1_MIWT1_1_MO40_MGRIPM1_NTn1_NTA0_NTB0_NTC0_NTD0_NTM0_NEPBS0_NLCA1_NLCB1_ONLL1_PGR2_PLR1_PKA0_SGROB0_SIA3_SS1_SU32_SUM0_SUS256_SPO0_SRVW0_SSO0_SVW1_SK0_SKFTR0_SKXCCM0_SGRO0_TIN0_TLDS0_TLDSMn1_ULSGRO0_USL1_UIOFGRO0_UPLRP0_USFGROn1_VSn1_VWA1_VWB1_WSGRA0_WSGRB0_WS32_WG16_2_1_WGM8_WGMXCC1_WGMXCCGn1
    SolutionIndex: 152
    SolutionNameMin: Cijk_Ailk_Bljk_BBS_BH_Bias_HA_S_SAV_UserArgs_MT64x16x64_MI16x16x1_SN_LDSB0_AFC1_AG0_AFEM1_AFEM1_ASEM1_CLR0_CADS0_DTLA0_DTLB0_DTVA0_DTVB0_DTVSM0_DPLB0_EPS0_ELFLR0_EMLLn1_FDSI0_GRPM1_GRVWA8_GRVWB8_GSU1_GSUAMB_GSUC0_GSUWGMRR0_GLS0_ISA1151_IU1_K1_LDSTI0_LBSPPA2048_LBSPPB512_LBSPPM0_LPA8_LPB8_LPM0_LRVW16_LWPMn1_MIAV1_MIWT1_1_MO40_MGRIPM1_NTn1_NTA0_NTB0_NTC0_NTD0_NTM0_NEPBS0_NLCA1_NLCB1_ONLL1_PGR2_PLR1_PKA0_SGROB0_SIA3_SS1_SU32_SUM0_SUS256_SPO0_SRVW0_SSO0_SVW1_SK0_SKFTR0_SKXCCM0_SGRO0_TIN0_TLDS0_TLDSMn1_ULSGRO0_USL1_UIOFGRO0_UPLRP0_USFGROn1_VSn1_VWA1_VWB1_WSGRA0_WSGRB0_WS32_WG64_2_1_WGM8_WGMXCC1_WGMXCCGn1
    SolutionIndex: 153
    SolutionNameMin: Cijk_Ailk_Bljk_BBS_BH_Bias_HA_S_SAV_UserArgs_MT16x16x128_MI16x16x1_SN_LDSB0_AFC1_AG0_AFEM1_AFEM1_ASEM1_CLR0_CADS0_DTLA0_DTLB0_DTVA0_DTVB0_DTVSM0_DPLB0_EPS0_ELFLR0_EMLLn1_FDSI0_GRPM1_GRVWA8_GRVWB8_GSU1_GSUAMB_GSUC0_GSUWGMRR0_GLS0_ISA1151_IU1_K1_LDSTI0_LBSPPA512_LBSPPB512_LBSPPM0_LPA8_LPB8_LPM0_LRVW16_LWPMn1_MIAV1_MIWT1_1_MO40_MGRIPM1_NTn1_NTA0_NTB0_NTC0_NTD0_NTM0_NEPBS0_NLCA1_NLCB1_ONLL1_PGR2_PLR1_PKA0_SGROB0_SIA3_SS1_SU32_SUM0_SUS256_SPO0_SRVW0_SSO0_SVW1_SK0_SKFTR0_SKXCCM0_SGRO0_TIN0_TLDS0_TLDSMn1_ULSGRO0_USL1_UIOFGRO0_UPLRP0_USFGROn1_VSn1_VWA1_VWB1_WSGRA0_WSGRB0_WS32_WG16_2_1_WGM8_WGMXCC1_WGMXCCGn1
    SolutionIndex: 154
    SolutionNameMin: Cijk_Ailk_Bljk_BBS_BH_Bias_HA_S_SAV_UserArgs_MT16x16x64_MI16x16x1_SN_LDSB0_AFC1_AG0_AFEM1_AFEM1_ASEM1_CLR0_CADS0_DTLA0_DTLB0_DTVA0_DTVB0_DTVSM0_DPLB0_EPS0_ELFLR0_EMLLn1_FDSI0_GRPM1_GRVWA8_GRVWB8_GSU1_GSUAMB_GSUC0_GSUWGMRR0_GLS0_ISA1151_IU1_K1_LDSTI0_LBSPPA512_LBSPPB512_LBSPPM0_LPA8_LPB8_LPM0_LRVW16_LWPMn1_MIAV1_MIWT1_1_MO40_MGRIPM1_NTn1_NTA0_NTB0_NTC0_NTD0_NTM0_NEPBS0_NLCA1_NLCB1_ONLL1_PGR1_PLR1_PKA0_SGROB0_SIA1_SS1_SU32_SUM0_SUS256_SPO0_SRVW0_SSO0_SVW1_SK0_SKFTR0_SKXCCM0_SGRO0_TIN0_TLDS0_TLDSMn1_ULSGRO0_USL1_UIOFGRO0_UPLRP0_USFGROn1_VSn1_VWA1_VWB1_WSGRA0_WSGRB0_WS32_WG16_2_1_WGM8_WGMXCC1_WGMXCCGn1
    SolutionIndex: 156
    SolutionNameMin: Cijk_Ailk_Bljk_BBS_BH_Bias_HA_S_SAV_UserArgs_MT128x64x16_MI16x16x1_SN_LDSB0_AFC1_AG0_AFEM1_AFEM1_ASEM1_CLR0_CADS0_DTLA0_DTLB0_DTVA0_DTVB0_DTVSM0_DPLB0_EPS0_ELFLR0_EMLLn1_FDSI0_GRPM1_GRVWA8_GRVWB8_GSU1_GSUAMB_GSUC0_GSUWGMRR0_GLS0_ISA1151_IU1_K1_LDSTI0_LBSPPA4096_LBSPPB2048_LBSPPM0_LPA8_LPB8_LPM0_LRVW16_LWPMn1_MIAV1_MIWT4_2_MO40_MGRIPM1_NTn1_NTA0_NTB0_NTC0_NTD0_NTM0_NEPBS0_NLCA1_NLCB1_ONLL1_PGR2_PLR0_PKA0_SGROB0_SIA1_SS1_SU32_SUM0_SUS256_SPO0_SRVW0_SSO0_SVW1_SK0_SKFTR0_SKXCCM0_SGRO0_TIN0_TLDS0_TLDSMn1_ULSGRO0_USL1_UIOFGRO0_UPLRP0_USFGROn1_VSn1_VWA1_VWB1_WSGRA0_WSGRB0_WS32_WG32_4_1_WGM8_WGMXCC1_WGMXCCGn1
    SolutionIndex: 157
    SolutionNameMin: Cijk_Ailk_Bljk_BBS_BH_Bias_HA_S_SAV_UserArgs_MT64x64x32_MI16x16x1_SN_LDSB0_AFC1_AG0_AFEM1_AFEM1_ASEM1_CLR0_CADS0_DTLA0_DTLB0_DTVA0_DTVB0_DTVSM0_DPLB0_EPS0_ELFLR0_EMLLn1_FDSI0_GRPM1_GRVWA8_GRVWB8_GSU1_GSUAMB_GSUC0_GSUWGMRR0_GLS0_ISA1151_IU1_K1_LDSTI0_LBSPPA2048_LBSPPB2048_LBSPPM0_LPA8_LPB8_LPM0_LRVW16_LWPMn1_MIAV1_MIWT2_2_MO40_MGRIPM1_NTn1_NTA0_NTB0_NTC0_NTD0_NTM0_NEPBS0_NLCA1_NLCB1_ONLL1_PGR1_PLR1_PKA0_SGROB0_SIA1_SS1_SU32_SUM0_SUS256_SPO0_SRVW0_SSO0_SVW1_SK0_SKFTR0_SKXCCM0_SGRO0_TIN0_TLDS0_TLDSMn1_ULSGRO0_USL1_UIOFGRO0_UPLRP0_USFGROn1_VSn1_VWA1_VWB1_WSGRA0_WSGRB0_WS32_WG32_4_1_WGM8_WGMXCC1_WGMXCCGn1
    SolutionIndex: 158
    SolutionNameMin: Cijk_Ailk_Bljk_BBS_BH_Bias_HA_S_SAV_UserArgs_MT64x64x32_MI16x16x1_SN_LDSB0_AFC1_AG0_AFEM1_AFEM1_ASEM1_CLR0_CADS0_DTLA0_DTLB0_DTVA0_DTVB0_DTVSM0_DPLB0_EPS0_ELFLR0_EMLLn1_FDSI0_GRPM1_GRVWA8_GRVWB8_GSU1_GSUAMB_GSUC0_GSUWGMRR0_GLS0_ISA1151_IU1_K1_LDSTI0_LBSPPA2048_LBSPPB2048_LBSPPM0_LPA8_LPB8_LPM0_LRVW16_LWPMn1_MIAV1_MIWT2_2_MO40_MGRIPM1_NTn1_NTA0_NTB0_NTC0_NTD0_NTM0_NEPBS0_NLCA1_NLCB1_ONLL1_PGR2_PLR1_PKA0_SGROB0_SIA1_SS1_SU32_SUM0_SUS256_SPO0_SRVW0_SSO0_SVW1_SK0_SKFTR0_SKXCCM0_SGRO0_TIN0_TLDS0_TLDSMn1_ULSGRO0_USL1_UIOFGRO0_UPLRP0_USFGROn1_VSn1_VWA1_VWB1_WSGRA0_WSGRB0_WS32_WG32_4_1_WGM8_WGMXCC1_WGMXCCGn1
    SolutionIndex: 159
    SolutionNameMin: Cijk_Ailk_Bljk_BBS_BH_Bias_HA_S_SAV_UserArgs_MT64x64x32_MI16x16x1_SN_LDSB0_AFC1_AG0_AFEM1_AFEM1_ASEM1_CLR0_CADS0_DTLA0_DTLB0_DTVA0_DTVB0_DTVSM0_DPLB0_EPS0_ELFLR0_EMLLn1_FDSI0_GRPM1_GRVWA8_GRVWB8_GSU1_GSUAMB_GSUC0_GSUWGMRR0_GLS0_ISA1151_IU1_K1_LDSTI0_LBSPPA2048_LBSPPB2048_LBSPPM0_LPA8_LPB8_LPM0_LRVW16_LWPMn1_MIAV1_MIWT2_2_MO40_MGRIPM1_NTn1_NTA0_NTB0_NTC0_NTD0_NTM0_NEPBS0_NLCA1_NLCB1_ONLL1_PGR2_PLR1_PKA0_SGROB0_SIA3_SS1_SU32_SUM0_SUS256_SPO0_SRVW0_SSO0_SVW1_SK0_SKFTR0_SKXCCM0_SGRO0_TIN0_TLDS0_TLDSMn1_ULSGRO0_USL1_UIOFGRO0_UPLRP0_USFGROn1_VSn1_VWA1_VWB1_WSGRA0_WSGRB0_WS32_WG32_4_1_WGM8_WGMXCC1_WGMXCCGn1
- - - [64, 64, 1, 64]
    - [142, 127.627]
  - - [256, 256, 1, 256]
    - [144, 4915.49]
  - - [320, 64, 1, 64]
    - [151, 633.435]
  - - [576, 64, 1, 64]
    - [142, 1003.96]
  - - [832, 64, 1, 64]
    - [135, 1357.26]
  - - [1088, 64, 1, 64]
    - [20, 1747.63]
  - - [1344, 64, 1, 64]
    - [82, 1877.83]
  - - [1600, 64, 1, 64]
    - [82, 2200.87]
  - - [1856, 64, 1, 64]
    - [82, 2418.47]
  - - [2112, 64, 1, 64]
    - [134, 2674.56]
  - - [2368, 64, 1, 64]
    - [134, 3233.11]
  - - [2624, 64, 1, 64]
    - [134, 3256.94]
  - - [2880, 64, 1, 64]
    - [134, 3089.25]
  - - [3136, 64, 1, 64]
    - [157, 3723.2]
  - - [3392, 64, 1, 64]
    - [134, 4086.36]
  - - [3648, 64, 1, 64]
    - [134, 4394.77]
  - - [3904, 64, 1, 64]
    - [134, 4100.2]
  - - [64, 320, 1, 64]
    - [61, 534.988]
  - - [320, 320, 1, 64]
    - [135, 2364.76]
  - - [576, 320, 1, 64]
    - [43, 3540.31]
  - - [832, 320, 1, 64]
    - [43, 4441.05]
  - - [1088, 320, 1, 64]
    - [134, 5369.21]
  - - [1344, 320, 1, 64]
    - [134, 5794.76]
  - - [1600, 320, 1, 64]
    - [134, 6425.1]
  - - [1856, 320, 1, 64]
    - [156, 6620.25]
  - - [2112, 320, 1, 64]
    - [156, 7122.55]
  - - [2368, 320, 1, 64]
    - [94, 8290.02]
  - - [2624, 320, 1, 64]
    - [134, 7102.5]
  - - [2880, 320, 1, 64]
    - [127, 7536.04]
  - - [3136, 320, 1, 64]
    - [134, 7978.3]
  - - [3392, 320, 1, 64]
    - [133, 7040.49]
  - - [3648, 320, 1, 64]
    - [133, 7058.31]
  - - [3904, 320, 1, 64]
    - [107, 7392.87]
  - - [64, 576, 1, 64]
    - [62, 1089.37]
  - - [320, 576, 1, 64]
    - [69, 3744.91]
  - - [576, 576, 1, 64]
    - [47, 5492.34]
  - - [832, 576, 1, 64]
    - [47, 6434.04]
  - - [1088, 576, 1, 64]
    - [156, 6610.67]
  - - [1344, 576, 1, 64]
    - [156, 7688.24]
  - - [1600, 576, 1, 64]
    - [134, 8024.82]
  - - [1856, 576, 1, 64]
    - [97, 8715.87]
  - - [2112, 576, 1, 64]
    - [53, 8508.94]
  - - [2368, 576, 1, 64]
    - [156, 7953.4]
  - - [2624, 576, 1, 64]
    - [156, 8534.89]
  - - [2880, 576, 1, 64]
    - [127, 8691.07]
  - - [3136, 576, 1, 64]
    - [133, 8846.08]
  - - [64, 832, 1, 64]
    - [62, 1405.35]
  - - [320, 832, 1, 64]
    - [30, 4484.04]
  - - [576, 832, 1, 64]
    - [134, 6525.71]
  - - [832, 832, 1, 64]
    - [96, 6943.71]
  - - [1088, 832, 1, 64]
    - [134, 7968.24]
  - - [1344, 832, 1, 64]
    - [97, 9175.04]
  - - [1600, 832, 1, 64]
    - [156, 7972.76]
  - - [1856, 832, 1, 64]
    - [94, 9641.78]
  - - [2112, 832, 1, 64]
    - [134, 8772.97]
  - - [64, 1088, 1, 64]
    - [81, 1740.21]
  - - [320, 1088, 1, 64]
    - [134, 5434.69]
  - - [576, 1088, 1, 64]
    - [94, 6797.97]
  - - [832, 1088, 1, 64]
    - [134, 8276.26]
  - - [1088, 1088, 1, 64]
    - [107, 7204.4]
  - - [1344, 1088, 1, 64]
    - [94, 9175.04]
  - - [1600, 1088, 1, 64]
    - [134, 8714.18]
  - - [64, 1344, 1, 64]
    - [69, 1955.75]
  - - [320, 1344, 1, 64]
    - [57, 6116.69]
  - - [576, 1344, 1, 64]
    - [109, 7991.16]
  - - [832, 1344, 1, 64]
    - [97, 8890.1]
  - - [1088, 1344, 1, 64]
    - [94, 9175.04]
  - - [1344, 1344, 1, 64]
    - [134, 8944.99]
  - - [64, 1600, 1, 64]
    - [85, 2247.91]
  - - [320, 1600, 1, 64]
    - [134, 6362.72]
  - - [576, 1600, 1, 64]
    - [134, 8366.3]
  - - [832, 1600, 1, 64]
    - [94, 8519.68]
  - - [1088, 1600, 1, 64]
    - [134, 8803.43]
  - - [64, 1856, 1, 64]
    - [85, 2457.91]
  - - [320, 1856, 1, 64]
    - [134, 6099.42]
  - - [576, 1856, 1, 64]
    - [97, 8343.85]
  - - [832, 1856, 1, 64]
    - [109, 9594.98]
  - - [64, 2112, 1, 64]
    - [102, 2649.45]
  - - [320, 2112, 1, 64]
    - [60, 7588.38]
  - - [576, 2112, 1, 64]
    - [53, 8416.95]
  - - [832, 2112, 1, 64]
    - [134, 9332.76]
  - - [64, 2368, 1, 64]
    - [102, 2734.38]
  - - [320, 2368, 1, 64]
    - [109, 8219.77]
  - - [576, 2368, 1, 64]
    - [96, 7726.78]
  - - [64, 2624, 1, 64]
    - [69, 2881.69]
  - - [320, 2624, 1, 64]
    - [134, 7845.19]
  - - [576, 2624, 1, 64]
    - [109, 9437.18]
  - - [64, 2880, 1, 64]
    - [69, 3744.91]
  - - [320, 2880, 1, 64]
    - [134, 8307.38]
  - - [576, 2880, 1, 64]
    - [134, 8466.72]
  - - [64, 3136, 1, 64]
    - [20, 3670.02]
  - - [320, 3136, 1, 64]
    - [134, 7929.05]
  - - [576, 3136, 1, 64]
    - [134, 8744.73]
  - - [64, 3392, 1, 64]
    - [134, 4147.35]
  - - [320, 3392, 1, 64]
    - [134, 7805.41]
  - - [64, 3648, 1, 64]
    - [157, 4460.36]
  - - [320, 3648, 1, 64]
    - [134, 8301.23]
  - - [64, 3904, 1, 64]
    - [31, 4264.21]
  - - [320, 3904, 1, 64]
    - [159, 6952.92]
  - - [64, 64, 1, 256]
    - [129, 447.69]
  - - [320, 64, 1, 256]
    - [140, 1984.64]
  - - [576, 64, 1, 256]
    - [113, 3051.83]
  - - [832, 64, 1, 256]
    - [144, 3831.6]
  - - [1088, 64, 1, 256]
    - [144, 4636.78]
  - - [1344, 64, 1, 256]
    - [82, 4982.73]
  - - [1600, 64, 1, 256]
    - [82, 5523.6]
  - - [1856, 64, 1, 256]
    - [82, 5984.82]
  - - [2112, 64, 1, 256]
    - [158, 6466.36]
  - - [2368, 64, 1, 256]
    - [158, 6965.6]
  - - [2624, 64, 1, 256]
    - [134, 6956.71]
  - - [2880, 64, 1, 256]
    - [134, 7121.7]
  - - [3136, 64, 1, 256]
    - [134, 7249.04]
  - - [3392, 64, 1, 256]
    - [134, 10485.8]
  - - [3648, 64, 1, 256]
    - [134, 7543.29]
  - - [3904, 64, 1, 256]
    - [134, 9765.36]
  - - [64, 320, 1, 256]
    - [153, 2056.03]
  - - [320, 320, 1, 256]
    - [80, 6480.07]
  - - [576, 320, 1, 256]
    - [43, 9280.9]
  - - [832, 320, 1, 256]
    - [134, 10485.9]
  - - [1088, 320, 1, 256]
    - [134, 12126.4]
  - - [1344, 320, 1, 256]
    - [94, 14406.9]
  - - [64, 576, 1, 256]
    - [62, 3196.77]
  - - [320, 576, 1, 256]
    - [47, 9437.18]
  - - [576, 576, 1, 256]
    - [53, 14518.7]
  - - [832, 576, 1, 256]
    - [48, 15932.9]
  - - [64, 832, 1, 256]
    - [62, 3905.7]
  - - [320, 832, 1, 256]
    - [30, 10567.0]
  - - [576, 832, 1, 256]
    - [53, 15529.5]
  - - [64, 1088, 1, 256]
    - [66, 4523.39]
  - - [320, 1088, 1, 256]
    - [47, 13712.1]
  - - [64, 1344, 1, 256]
    - [69, 5045.41]
  - - [320, 1344, 1, 256]
    - [47, 14733.2]
  - - [64, 1600, 1, 256]
    - [69, 5373.72]
  - - [64, 1856, 1, 256]
    - [69, 5737.67]
  - - [64, 2112, 1, 256]
    - [69, 6018.2]
  - - [64, 2368, 1, 256]
    - [69, 6546.29]
  - - [64, 2624, 1, 256]
    - [69, 8035.82]
  - - [64, 2880, 1, 256]
    - [69, 7057.55]
  - - [64, 3136, 1, 256]
    - [48, 6864.82]
  - - [64, 3392, 1, 256]
    - [47, 10485.8]
  - - [64, 3648, 1, 256]
    - [48, 10867.1]
  - - [64, 3904, 1, 256]
    - [31, 9406.34]
  - - [64, 64, 1, 512]
    - [129, 748.983]
  - - [320, 64, 1, 512]
    - [140, 3256.75]
  - - [576, 64, 1, 512]
    - [113, 4706.18]
  - - [832, 64, 1, 512]
    - [144, 5644.16]
  - - [1088, 64, 1, 512]
    - [144, 6787.98]
  - - [1344, 64, 1, 512]
    - [144, 7083.66]
  - - [1600, 64, 1, 512]
    - [144, 7794.97]
  - - [1856, 64, 1, 512]
    - [144, 8215.29]
  - - [2112, 64, 1, 512]
    - [158, 11162.3]
  - - [2368, 64, 1, 512]
    - [158, 12515.3]
  - - [2624, 64, 1, 512]
    - [134, 8909.99]
  - - [2880, 64, 1, 512]
    - [82, 9173.37]
  - - [3136, 64, 1, 512]
    - [82, 9438.4]
  - - [3392, 64, 1, 512]
    - [83, 14069.5]
  - - [3648, 64, 1, 512]
    - [134, 9831.75]
  - - [64, 320, 1, 512]
    - [147, 3055.6]
  - - [320, 320, 1, 512]
    - [135, 9087.54]
  - - [576, 320, 1, 512]
    - [27, 12927.6]
  - - [64, 576, 1, 512]
    - [65, 4616.82]
  - - [320, 576, 1, 512]
    - [47, 13291.8]
  - - [64, 832, 1, 512]
    - [69, 5800.63]
  - - [64, 1088, 1, 512]
    - [66, 6539.28]
  - - [64, 1344, 1, 512]
    - [69, 7726.35]
  - - [64, 1600, 1, 512]
    - [69, 7867.38]
  - - [64, 1856, 1, 512]
    - [69, 8111.09]
  - - [64, 2112, 1, 512]
    - [69, 8133.58]
  - - [64, 2368, 1, 512]
    - [69, 8492.26]
  - - [64, 2624, 1, 512]
    - [69, 11541.4]
  - - [64, 2880, 1, 512]
    - [32, 8921.18]
  - - [64, 3136, 1, 512]
    - [43, 12531.8]
  - - [64, 3392, 1, 512]
    - [47, 14249.9]
  - - [64, 3648, 1, 512]
    - [47, 15938.4]
  - - [64, 64, 1, 1024]
    - [153, 1046.18]
  - - [320, 64, 1, 1024]
    - [148, 4875.2]
  - - [576, 64, 1, 1024]
    - [112, 7401.71]
  - - [832, 64, 1, 1024]
    - [152, 7411.92]
  - - [1088, 64, 1, 1024]
    - [144, 8897.07]
  - - [1344, 64, 1, 1024]
    - [144, 8875.95]
  - - [1600, 64, 1, 1024]
    - [144, 9917.35]
  - - [1856, 64, 1, 1024]
    - [144, 10331]
  - - [64, 320, 1, 1024]
    - [62, 4282.9]
  - - [320, 320, 1, 1024]
    - [80, 11284.9]
  - - [64, 576, 1, 1024]
    - [62, 6305.73]
  - - [64, 832, 1, 1024]
    - [62, 7467.71]
  - - [64, 1088, 1, 1024]
    - [66, 8483.72]
  - - [64, 1344, 1, 1024]
    - [69, 8697.96]
  - - [64, 1600, 1, 1024]
    - [69, 11715.9]
  - - [64, 1856, 1, 1024]
    - [69, 9855.94]
  - - [64, 64, 1, 2048]
    - [64, 1950.84]
  - - [320, 64, 1, 2048]
    - [153, 5699.5]
  - - [576, 64, 1, 2048]
    - [112, 9437.18]
  - - [832, 64, 1, 2048]
    - [118, 8591.34]
  - - [64, 320, 1, 2048]
    - [63, 5086.85]
  - - [64, 576, 1, 2048]
    - [62, 8778.78]
  - - [64, 832, 1, 2048]
    - [62, 8536.56]
  - - [64, 64, 1, 4096]
    - [64, 2290.15]
  - - [320, 64, 1, 4096]
    - [68, 9532.51]
  - - [64, 320, 1, 4096]
    - [64, 6983.76]
  - - [192, 64, 1, 64]
    - [16, 365.782]
  - - [448, 64, 1, 64]
    - [151, 851.281]
  - - [704, 64, 1, 64]
    - [135, 1171.59]
  - - [960, 64, 1, 64]
    - [82, 1523.51]
  - - [1216, 64, 1, 64]
    - [82, 1852.02]
  - - [1472, 64, 1, 64]
    - [82, 2060.31]
  - - [1728, 64, 1, 64]
    - [82, 2265.05]
  - - [1984, 64, 1, 64]
    - [134, 2557.99]
  - - [64, 192, 1, 64]
    - [61, 357.469]
  - - [192, 192, 1, 64]
    - [138, 1077.23]
  - - [320, 192, 1, 64]
    - [138, 1598.59]
  - - [448, 192, 1, 64]
    - [82, 2041.3]
  - - [576, 192, 1, 64]
    - [82, 2524.63]
  - - [704, 192, 1, 64]
    - [134, 2836.31]
  - - [832, 192, 1, 64]
    - [158, 3235.74]
  - - [960, 192, 1, 64]
    - [31, 3599.6]
  - - [1088, 192, 1, 64]
    - [134, 3833.44]
  - - [1216, 192, 1, 64]
    - [134, 4170.42]
  - - [1344, 192, 1, 64]
    - [32, 4289.63]
  - - [1472, 192, 1, 64]
    - [32, 4624.59]
  - - [1600, 192, 1, 64]
    - [31, 5106.7]
  - - [1728, 192, 1, 64]
    - [76, 4931.16]
  - - [1856, 192, 1, 64]
    - [46, 6001.72]
  - - [1984, 192, 1, 64]
    - [134, 5269.13]
  - - [192, 320, 1, 64]
    - [138, 1612.2]
  - - [448, 320, 1, 64]
    - [134, 3058.35]
  - - [704, 320, 1, 64]
    - [134, 4240.56]
  - - [960, 320, 1, 64]
    - [43, 5042.57]
  - - [1216, 320, 1, 64]
    - [134, 5791.55]
  - - [1472, 320, 1, 64]
    - [134, 6362.4]
  - - [1728, 320, 1, 64]
    - [134, 6677.25]
  - - [1984, 320, 1, 64]
    - [156, 6828.16]
  - - [64, 448, 1, 64]
    - [147, 874.113]
  - - [192, 448, 1, 64]
    - [13, 1966.08]
  - - [320, 448, 1, 64]
    - [134, 3058.35]
  - - [448, 448, 1, 64]
    - [20, 3768.94]
  - - [576, 448, 1, 64]
    - [57, 4244.55]
  - - [704, 448, 1, 64]
    - [134, 5110.15]
  - - [832, 448, 1, 64]
    - [134, 5818.32]
  - - [960, 448, 1, 64]
    - [134, 5949.53]
  - - [1088, 448, 1, 64]
    - [134, 6781.55]
  - - [1216, 448, 1, 64]
    - [134, 6836.3]
  - - [1344, 448, 1, 64]
    - [156, 6583.67]
  - - [1472, 448, 1, 64]
    - [60, 7536.64]
  - - [1600, 448, 1, 64]
    - [156, 7587.45]
  - - [1728, 448, 1, 64]
    - [156, 7850.61]
  - - [1856, 448, 1, 64]
    - [134, 7570.2]
  - - [1984, 448, 1, 64]
    - [127, 7582]
  - - [192, 576, 1, 64]
    - [69, 2525.9]
  - - [448, 576, 1, 64]
    - [32, 4206.83]
  - - [704, 576, 1, 64]
    - [134, 6253.56]
  - - [960, 576, 1, 64]
    - [53, 7450.41]
  - - [1216, 576, 1, 64]
    - [96, 7533.89]
  - - [1472, 576, 1, 64]
    - [134, 7807.74]
  - - [1728, 576, 1, 64]
    - [134, 7633.94]
  - - [1984, 576, 1, 64]
    - [97, 9258.0]
  - - [64, 704, 1, 64]
    - [143, 1187.16]
  - - [192, 704, 1, 64]
    - [134, 2837.75]
  - - [320, 704, 1, 64]
    - [134, 4240.56]
  - - [448, 704, 1, 64]
    - [134, 5175.66]
  - - [576, 704, 1, 64]
    - [157, 6179.11]
  - - [704, 704, 1, 64]
    - [134, 6099.89]
  - - [832, 704, 1, 64]
    - [156, 6363.92]
  - - [960, 704, 1, 64]
    - [96, 6809.81]
  - - [1088, 704, 1, 64]
    - [96, 7843.35]
  - - [1216, 704, 1, 64]
    - [134, 7883.18]
  - - [1344, 704, 1, 64]
    - [134, 8712.99]
  - - [1472, 704, 1, 64]
    - [97, 8290.3]
  - - [1600, 704, 1, 64]
    - [134, 7921.93]
  - - [1728, 704, 1, 64]
    - [159, 7497.76]
  - - [1856, 704, 1, 64]
    - [156, 7781.41]
  - - [1984, 704, 1, 64]
    - [94, 8850.6]
  - - [192, 832, 1, 64]
    - [157, 3098.07]
  - - [448, 832, 1, 64]
    - [134, 5427.89]
  - - [704, 832, 1, 64]
    - [156, 6252.55]
  - - [960, 832, 1, 64]
    - [134, 7395.26]
  - - [1216, 832, 1, 64]
    - [97, 8409.03]
  - - [1472, 832, 1, 64]
    - [100, 7490.91]
  - - [1728, 832, 1, 64]
    - [94, 9247.49]
  - - [1984, 832, 1, 64]
    - [134, 8563.52]
  - - [64, 960, 1, 64]
    - [85, 1567.43]
  - - [192, 960, 1, 64]
    - [34, 3686.4]
  - - [320, 960, 1, 64]
    - [32, 5008.49]
  - - [448, 960, 1, 64]
    - [48, 6116.69]
  - - [576, 960, 1, 64]
    - [53, 7864.32]
  - - [704, 960, 1, 64]
    - [96, 6720.37]
  - - [832, 960, 1, 64]
    - [134, 7925.28]
  - - [960, 960, 1, 64]
    - [134, 8011.08]
  - - [1088, 960, 1, 64]
    - [97, 8355.84]
  - - [1216, 960, 1, 64]
    - [97, 9280.87]
  - - [1344, 960, 1, 64]
    - [53, 9074.22]
  - - [1472, 960, 1, 64]
    - [156, 8258.3]
  - - [1600, 960, 1, 64]
    - [156, 8705.21]
  - - [1728, 960, 1, 64]
    - [134, 8508.94]
  - - [1856, 960, 1, 64]
    - [127, 8749.52]
  - - [1984, 960, 1, 64]
    - [134, 8778.69]
  - - [192, 1088, 1, 64]
    - [158, 4051.32]
  - - [448, 1088, 1, 64]
    - [134, 6781.55]
  - - [704, 1088, 1, 64]
    - [134, 7368.52]
  - - [960, 1088, 1, 64]
    - [97, 8252.68]
  - - [1216, 1088, 1, 64]
    - [96, 7709.4]
  - - [1472, 1088, 1, 64]
    - [134, 8629.82]
  - - [1728, 1088, 1, 64]
    - [134, 9664.59]
  - - [64, 1216, 1, 64]
    - [85, 1888.82]
  - - [192, 1216, 1, 64]
    - [158, 4394.77]
  - - [320, 1216, 1, 64]
    - [134, 6074.07]
  - - [448, 1216, 1, 64]
    - [134, 6225.92]
  - - [576, 1216, 1, 64]
    - [109, 7795.93]
  - - [704, 1216, 1, 64]
    - [134, 7998.26]
  - - [832, 1216, 1, 64]
    - [97, 7993.77]
  - - [960, 1216, 1, 64]
    - [93, 8033.45]
  - - [1088, 1216, 1, 64]
    - [96, 7751.87]
  - - [1216, 1216, 1, 64]
    - [94, 9277.84]
  - - [1344, 1216, 1, 64]
    - [134, 8693.63]
  - - [1472, 1216, 1, 64]
    - [134, 8945.69]
  - - [1600, 1216, 1, 64]
    - [134, 9766.15]
  - - [192, 1344, 1, 64]
    - [32, 4011.8]
  - - [448, 1344, 1, 64]
    - [134, 6232.51]
  - - [704, 1344, 1, 64]
    - [134, 8528.91]
  - - [960, 1344, 1, 64]
    - [53, 8927.07]
  - - [1216, 1344, 1, 64]
    - [134, 8610.15]
  - - [64, 1472, 1, 64]
    - [85, 2067.75]
  - - [192, 1472, 1, 64]
    - [32, 4443.15]
  - - [320, 1472, 1, 64]
    - [134, 6152.36]
  - - [448, 1472, 1, 64]
    - [96, 6482.61]
  - - [576, 1472, 1, 64]
    - [134, 7483.94]
  - - [704, 1472, 1, 64]
    - [97, 8088.1]
  - - [832, 1472, 1, 64]
    - [159, 7489.6]
  - - [960, 1472, 1, 64]
    - [96, 8144.07]
  - - [1088, 1472, 1, 64]
    - [134, 8485.89]
  - - [1216, 1472, 1, 64]
    - [134, 8919.38]
  - - [192, 1600, 1, 64]
    - [27, 4729.23]
  - - [448, 1600, 1, 64]
    - [134, 7459.38]
  - - [704, 1600, 1, 64]
    - [134, 7793.47]
  - - [960, 1600, 1, 64]
    - [94, 9273.96]
  - - [1216, 1600, 1, 64]
    - [134, 9766.15]
  - - [64, 1728, 1, 64]
    - [85, 2338.83]
  - - [192, 1728, 1, 64]
    - [47, 5444.53]
  - - [320, 1728, 1, 64]
    - [134, 6805.66]
  - - [448, 1728, 1, 64]
    - [109, 7991.16]
  - - [576, 1728, 1, 64]
    - [134, 7477.28]
  - - [704, 1728, 1, 64]
    - [96, 7129.68]
  - - [832, 1728, 1, 64]
    - [94, 9020.84]
  - - [960, 1728, 1, 64]
    - [134, 8570.03]
  - - [1088, 1728, 1, 64]
    - [134, 9664.59]
  - - [192, 1856, 1, 64]
    - [134, 5495.55]
  - - [448, 1856, 1, 64]
    - [134, 7942.57]
  - - [704, 1856, 1, 64]
    - [96, 7509.7]
  - - [960, 1856, 1, 64]
    - [134, 8843.04]
  - - [64, 1984, 1, 64]
    - [102, 2511.32]
  - - [192, 1984, 1, 64]
    - [134, 4928.49]
  - - [320, 1984, 1, 64]
    - [106, 6233.06]
  - - [448, 1984, 1, 64]
    - [134, 7635.6]
  - - [576, 1984, 1, 64]
    - [107, 7050.98]
  - - [704, 1984, 1, 64]
    - [96, 7831.52]
  - - [832, 1984, 1, 64]
    - [134, 8569.74]
  - - [960, 1984, 1, 64]
    - [134, 8926.28]
  - - [192, 64, 1, 256]
    - [129, 1252.84]
  - - [448, 64, 1, 256]
    - [113, 2503.29]
  - - [704, 64, 1, 256]
    - [144, 3344.18]
  - - [960, 64, 1, 256]
    - [144, 4198.03]
  - - [1216, 64, 1, 256]
    - [81, 4916.07]
  - - [1472, 64, 1, 256]
    - [82, 5235.34]
  - - [1728, 64, 1, 256]
    - [82, 5779.95]
  - - [1984, 64, 1, 256]
    - [158, 6165.85]
  - - [64, 192, 1, 256]
    - [136, 1277.11]
  - - [192, 192, 1, 256]
    - [62, 3179.39]
  - - [320, 192, 1, 256]
    - [138, 4651.05]
  - - [448, 192, 1, 256]
    - [31, 5181.2]
  - - [576, 192, 1, 256]
    - [82, 6703.06]
  - - [704, 192, 1, 256]
    - [158, 7991.39]
  - - [832, 192, 1, 256]
    - [158, 9133.85]
  - - [960, 192, 1, 256]
    - [120, 9068.5]
  - - [1088, 192, 1, 256]
    - [120, 10589.6]
  - - [1216, 192, 1, 256]
    - [120, 11719.4]
  - - [1344, 192, 1, 256]
    - [134, 10315.9]
  - - [1472, 192, 1, 256]
    - [134, 11253.5]
  - - [1600, 192, 1, 256]
    - [134, 12229.4]
  - - [1728, 192, 1, 256]
    - [120, 13058.8]
  - - [1856, 192, 1, 256]
    - [121, 13607.4]
  - - [1984, 192, 1, 256]
    - [127, 13491.8]
  - - [192, 320, 1, 256]
    - [62, 4597.19]
  - - [448, 320, 1, 256]
    - [158, 8247.23]
  - - [704, 320, 1, 256]
    - [158, 10571.9]
  - - [960, 320, 1, 256]
    - [134, 11733.6]
  - - [1216, 320, 1, 256]
    - [134, 13870.8]
  - - [1472, 320, 1, 256]
    - [91, 15298.5]
  - - [64, 448, 1, 256]
    - [62, 2594.47]
  - - [192, 448, 1, 256]
    - [27, 5513.84]
  - - [320, 448, 1, 256]
    - [158, 7871.79]
  - - [448, 448, 1, 256]
    - [158, 9394.44]
  - - [576, 448, 1, 256]
    - [57, 10741.5]
  - - [704, 448, 1, 256]
    - [134, 11960.9]
  - - [832, 448, 1, 256]
    - [134, 12722.7]
  - - [960, 448, 1, 256]
    - [94, 14247.6]
  - - [1088, 448, 1, 256]
    - [134, 15115.1]
  - - [192, 576, 1, 256]
    - [69, 6845.95]
  - - [448, 576, 1, 256]
    - [47, 10611.8]
  - - [704, 576, 1, 256]
    - [47, 14036.2]
  - - [64, 704, 1, 256]
    - [62, 3376.13]
  - - [192, 704, 1, 256]
    - [158, 7325.29]
  - - [320, 704, 1, 256]
    - [157, 10779.8]
  - - [448, 704, 1, 256]
    - [47, 11842.7]
  - - [576, 704, 1, 256]
    - [134, 13845.5]
  - - [192, 832, 1, 256]
    - [27, 8344.65]
  - - [448, 832, 1, 256]
    - [134, 13071.3]
  - - [64, 960, 1, 256]
    - [62, 4213.24]
  - - [192, 960, 1, 256]
    - [69, 9729.06]
  - - [320, 960, 1, 256]
    - [47, 12998.9]
  - - [448, 960, 1, 256]
    - [47, 14877.2]
  - - [192, 1088, 1, 256]
    - [47, 8973.62]
  - - [448, 1088, 1, 256]
    - [53, 15695.7]
  - - [64, 1216, 1, 256]
    - [66, 4885.65]
  - - [192, 1216, 1, 256]
    - [48, 9500.58]
  - - [320, 1216, 1, 256]
    - [134, 13461.4]
  - - [192, 1344, 1, 256]
    - [47, 11010.0]
  - - [64, 1472, 1, 256]
    - [7, 5139.49]
  - - [192, 1472, 1, 256]
    - [47, 10823.5]
  - - [320, 1472, 1, 256]
    - [47, 15073.3]
  - - [192, 1600, 1, 256]
    - [43, 11498.7]
  - - [64, 1728, 1, 256]
    - [69, 6822.06]
  - - [192, 1728, 1, 256]
    - [53, 14395.7]
  - - [192, 1856, 1, 256]
    - [48, 12654.9]
  - - [64, 1984, 1, 256]
    - [7, 5568.94]
  - - [192, 1984, 1, 256]
    - [47, 11885.5]
  - - [192, 64, 1, 512]
    - [148, 2042.55]
  - - [448, 64, 1, 512]
    - [138, 3845.74]
  - - [704, 64, 1, 512]
    - [144, 4925.6]
  - - [960, 64, 1, 512]
    - [144, 6290.1]
  - - [1216, 64, 1, 512]
    - [144, 7255.83]
  - - [1472, 64, 1, 512]
    - [144, 7497.27]
  - - [1728, 64, 1, 512]
    - [144, 8055.94]
  - - [1984, 64, 1, 512]
    - [158, 10571.0]
  - - [64, 192, 1, 512]
    - [147, 1998.24]
  - - [192, 192, 1, 512]
    - [62, 4812.8]
  - - [320, 192, 1, 512]
    - [138, 7052.81]
  - - [448, 192, 1, 512]
    - [44, 7773.39]
  - - [576, 192, 1, 512]
    - [130, 9469.48]
  - - [704, 192, 1, 512]
    - [158, 10861.6]
  - - [832, 192, 1, 512]
    - [158, 13086.2]
  - - [960, 192, 1, 512]
    - [47, 13198.9]
  - - [1088, 192, 1, 512]
    - [47, 15279.3]
  - - [1216, 192, 1, 512]
    - [121, 15339]
  - - [192, 320, 1, 512]
    - [138, 6869.06]
  - - [448, 320, 1, 512]
    - [102, 11126.2]
  - - [704, 320, 1, 512]
    - [128, 14600.4]
  - - [64, 448, 1, 512]
    - [65, 3790.69]
  - - [192, 448, 1, 512]
    - [27, 7593.14]
  - - [320, 448, 1, 512]
    - [158, 11744.1]
  - - [448, 448, 1, 512]
    - [47, 13059.2]
  - - [192, 576, 1, 512]
    - [69, 9818.32]
  - - [64, 704, 1, 512]
    - [69, 5070.04]
  - - [192, 704, 1, 512]
    - [20, 9678.35]
  - - [320, 704, 1, 512]
    - [47, 15277.3]
  - - [192, 832, 1, 512]
    - [27, 11262.1]
  - - [64, 960, 1, 512]
    - [69, 6242.72]
  - - [192, 960, 1, 512]
    - [47, 13198.9]
  - - [192, 1088, 1, 512]
    - [47, 14073.0]
  - - [64, 1216, 1, 512]
    - [66, 7081.3]
  - - [192, 1216, 1, 512]
    - [47, 15524.4]
  - - [64, 1472, 1, 512]
    - [69, 7655.52]
  - - [64, 1728, 1, 512]
    - [69, 8065.32]
  - - [64, 1984, 1, 512]
    - [69, 8009.35]
  - - [192, 64, 1, 1024]
    - [148, 2925.35]
  - - [448, 64, 1, 1024]
    - [138, 5269.01]
  - - [704, 64, 1, 1024]
    - [102, 6526.42]
  - - [960, 64, 1, 1024]
    - [81, 8218.46]
  - - [1216, 64, 1, 1024]
    - [81, 9272.82]
  - - [1472, 64, 1, 1024]
    - [144, 9496.38]
  - - [1728, 64, 1, 1024]
    - [144, 10162.3]
  - - [64, 192, 1, 1024]
    - [62, 2775.4]
  - - [192, 192, 1, 1024]
    - [62, 6497.32]
  - - [320, 192, 1, 1024]
    - [138, 9714.26]
  - - [448, 192, 1, 1024]
    - [69, 9714.52]
  - - [576, 192, 1, 1024]
    - [120, 13245.2]
  - - [192, 320, 1, 1024]
    - [62, 8508.48]
  - - [64, 448, 1, 1024]
    - [62, 5277.62]
  - - [192, 448, 1, 1024]
    - [27, 9683.94]
  - - [192, 576, 1, 1024]
    - [69, 12176.8]
  - - [64, 704, 1, 1024]
    - [69, 7208.96]
  - - [64, 960, 1, 1024]
    - [62, 7936.68]
  - - [64, 1216, 1, 1024]
    - [66, 8866.74]
  - - [64, 1472, 1, 1024]
    - [69, 9116.41]
  - - [64, 1728, 1, 1024]
    - [66, 9651.87]
  - - [192, 64, 1, 2048]
    - [68, 3520.93]
  - - [448, 64, 1, 2048]
    - [148, 6176.95]
  - - [704, 64, 1, 2048]
    - [138, 7527.08]
  - - [64, 192, 1, 2048]
    - [64, 3654.92]
  - - [192, 192, 1, 2048]
    - [62, 7941.3]
  - - [64, 448, 1, 2048]
    - [62, 6153.09]
  - - [64, 704, 1, 2048]
    - [62, 7575.78]
  - - [192, 64, 1, 4096]
    - [64, 4980.11]
  - - [448, 64, 1, 4096]
    - [68, 7659.71]
  - - [64, 192, 1, 4096]
    - [64, 5818.69]
  - - [64, 448, 1, 4096]
    - [68, 7362.07]
  - - [128, 64, 1, 64]
    - [141, 223.101]
  - - [256, 64, 1, 64]
    - [61, 476.625]
  - - [384, 64, 1, 64]
    - [146, 699.051]
  - - [512, 64, 1, 64]
    - [138, 948.803]
  - - [640, 64, 1, 64]
    - [146, 1105.04]
  - - [768, 64, 1, 64]
    - [135, 1233.62]
  - - [896, 64, 1, 64]
    - [17, 1429.09]
  - - [1024, 64, 1, 64]
    - [82, 1608.82]
  - - [64, 128, 1, 64]
    - [15, 243.855]
  - - [128, 128, 1, 64]
    - [14, 487.71]
  - - [192, 128, 1, 64]
    - [151, 683.854]
  - - [256, 128, 1, 64]
    - [141, 979.69]
  - - [320, 128, 1, 64]
    - [146, 1154.08]
  - - [384, 128, 1, 64]
    - [138, 1300.53]
  - - [448, 128, 1, 64]
    - [14, 1439.22]
  - - [512, 128, 1, 64]
    - [82, 1661.31]
  - - [576, 128, 1, 64]
    - [82, 1715.85]
  - - [640, 128, 1, 64]
    - [82, 1963.92]
  - - [704, 128, 1, 64]
    - [19, 1988.68]
  - - [768, 128, 1, 64]
    - [82, 2219.2]
  - - [832, 128, 1, 64]
    - [82, 2395.36]
  - - [896, 128, 1, 64]
    - [82, 2539.44]
  - - [960, 128, 1, 64]
    - [82, 2667.54]
  - - [1024, 128, 1, 64]
    - [134, 2796.2]
  - - [128, 192, 1, 64]
    - [152, 766.997]
  - - [256, 192, 1, 64]
    - [141, 1258.29]
  - - [384, 192, 1, 64]
    - [82, 1857.98]
  - - [512, 192, 1, 64]
    - [69, 2246.95]
  - - [640, 192, 1, 64]
    - [82, 2707.71]
  - - [768, 192, 1, 64]
    - [134, 3112.93]
  - - [896, 192, 1, 64]
    - [31, 3404.27]
  - - [1024, 192, 1, 64]
    - [134, 3726.11]
  - - [64, 256, 1, 64]
    - [113, 476.625]
  - - [128, 256, 1, 64]
    - [146, 1003.8]
  - - [192, 256, 1, 64]
    - [62, 1356.34]
  - - [256, 256, 1, 64]
    - [103, 1732.47]
  - - [320, 256, 1, 64]
    - [82, 1981.12]
  - - [384, 256, 1, 64]
    - [103, 2292.91]
  - - [448, 256, 1, 64]
    - [82, 2607.66]
  - - [512, 256, 1, 64]
    - [83, 2820.43]
  - - [576, 256, 1, 64]
    - [134, 3145.73]
  - - [640, 256, 1, 64]
    - [83, 3302.11]
  - - [704, 256, 1, 64]
    - [20, 3443.09]
  - - [768, 256, 1, 64]
    - [127, 3765.06]
  - - [832, 256, 1, 64]
    - [158, 4009.26]
  - - [896, 256, 1, 64]
    - [127, 4243.1]
  - - [960, 256, 1, 64]
    - [158, 4309.22]
  - - [1024, 256, 1, 64]
    - [109, 4252.99]
  - - [128, 320, 1, 64]
    - [147, 1172.09]
  - - [256, 320, 1, 64]
    - [103, 1992.48]
  - - [384, 320, 1, 64]
    - [20, 2808.69]
  - - [512, 320, 1, 64]
    - [83, 3318.06]
  - - [640, 320, 1, 64]
    - [134, 3900.9]
  - - [768, 320, 1, 64]
    - [157, 4626.07]
  - - [896, 320, 1, 64]
    - [43, 4800.46]
  - - [1024, 320, 1, 64]
    - [127, 5113.53]
  - - [64, 384, 1, 64]
    - [62, 759.391]
  - - [128, 384, 1, 64]
    - [152, 1334.16]
  - - [192, 384, 1, 64]
    - [20, 1780.6]
  - - [256, 384, 1, 64]
    - [69, 2288.45]
  - - [320, 384, 1, 64]
    - [20, 2759.41]
  - - [384, 384, 1, 64]
    - [127, 3095.23]
  - - [448, 384, 1, 64]
    - [31, 3415.16]
  - - [512, 384, 1, 64]
    - [127, 3770.21]
  - - [576, 384, 1, 64]
    - [134, 4163.46]
  - - [640, 384, 1, 64]
    - [127, 4463.71]
  - - [704, 384, 1, 64]
    - [31, 4483.78]
  - - [768, 384, 1, 64]
    - [32, 4879.15]
  - - [832, 384, 1, 64]
    - [47, 5281.57]
  - - [896, 384, 1, 64]
    - [47, 5585.66]
  - - [960, 384, 1, 64]
    - [47, 6208.67]
  - - [1024, 384, 1, 64]
    - [134, 6138.01]
  - - [128, 448, 1, 64]
    - [81, 1515.29]
  - - [256, 448, 1, 64]
    - [20, 2575.45]
  - - [384, 448, 1, 64]
    - [27, 3366.87]
  - - [512, 448, 1, 64]
    - [89, 4382.11]
  - - [640, 448, 1, 64]
    - [30, 4959.48]
  - - [768, 448, 1, 64]
    - [134, 5286.1]
  - - [896, 448, 1, 64]
    - [133, 5962.6]
  - - [1024, 448, 1, 64]
    - [156, 6461.16]
  - - [64, 512, 1, 64]
    - [65, 838.861]
  - - [128, 512, 1, 64]
    - [103, 1703.41]
  - - [192, 512, 1, 64]
    - [13, 2169.47]
  - - [256, 512, 1, 64]
    - [133, 2843.6]
  - - [320, 512, 1, 64]
    - [158, 3495.25]
  - - [384, 512, 1, 64]
    - [20, 3647.22]
  - - [448, 512, 1, 64]
    - [159, 4021.94]
  - - [512, 512, 1, 64]
    - [133, 4258.22]
  - - [576, 512, 1, 64]
    - [109, 5101.18]
  - - [640, 512, 1, 64]
    - [93, 5518.82]
  - - [704, 512, 1, 64]
    - [134, 5626.51]
  - - [768, 512, 1, 64]
    - [133, 5884.69]
  - - [832, 512, 1, 64]
    - [109, 6196.13]
  - - [896, 512, 1, 64]
    - [156, 6827.94]
  - - [960, 512, 1, 64]
    - [109, 7315.65]
  - - [1024, 512, 1, 64]
    - [156, 6426.71]
  - - [128, 576, 1, 64]
    - [103, 1881.31]
  - - [256, 576, 1, 64]
    - [83, 3199.05]
  - - [384, 576, 1, 64]
    - [131, 4102.38]
  - - [512, 576, 1, 64]
    - [36, 4831.63]
  - - [640, 576, 1, 64]
    - [47, 6376.48]
  - - [768, 576, 1, 64]
    - [156, 6297.47]
  - - [896, 576, 1, 64]
    - [133, 6419.65]
  - - [1024, 576, 1, 64]
    - [156, 6928.79]
  - - [64, 640, 1, 64]
    - [142, 1134.04]
  - - [128, 640, 1, 64]
    - [103, 1971.94]
  - - [192, 640, 1, 64]
    - [85, 2654.42]
  - - [256, 640, 1, 64]
    - [83, 3554.49]
  - - [320, 640, 1, 64]
    - [20, 3971.88]
  - - [384, 640, 1, 64]
    - [127, 4493.9]
  - - [448, 640, 1, 64]
    - [43, 4959.48]
  - - [512, 640, 1, 64]
    - [156, 5332.78]
  - - [576, 640, 1, 64]
    - [59, 6049.48]
  - - [640, 640, 1, 64]
    - [133, 6037.98]
  - - [704, 640, 1, 64]
    - [109, 6628.93]
  - - [768, 640, 1, 64]
    - [156, 6740.4]
  - - [832, 640, 1, 64]
    - [134, 6308.44]
  - - [896, 640, 1, 64]
    - [94, 7414.17]
  - - [960, 640, 1, 64]
    - [72, 8024.82]
  - - [1024, 640, 1, 64]
    - [156, 7060.39]
  - - [128, 704, 1, 64]
    - [103, 2077.13]
  - - [256, 704, 1, 64]
    - [133, 3360.84]
  - - [384, 704, 1, 64]
    - [107, 4364.5]
  - - [512, 704, 1, 64]
    - [133, 5356.34]
  - - [640, 704, 1, 64]
    - [94, 6948.4]
  - - [768, 704, 1, 64]
    - [96, 6461.84]
  - - [896, 704, 1, 64]
    - [94, 8155.59]
  - - [1024, 704, 1, 64]
    - [156, 7350.14]
  - - [64, 768, 1, 64]
    - [138, 1308.84]
  - - [128, 768, 1, 64]
    - [69, 2276.31]
  - - [192, 768, 1, 64]
    - [134, 3094.16]
  - - [256, 768, 1, 64]
    - [36, 3716.75]
  - - [320, 768, 1, 64]
    - [134, 4695.12]
  - - [384, 768, 1, 64]
    - [93, 5101.18]
  - - [448, 768, 1, 64]
    - [122, 5646.18]
  - - [512, 768, 1, 64]
    - [133, 5758.62]
  - - [576, 768, 1, 64]
    - [109, 6012.75]
  - - [640, 768, 1, 64]
    - [96, 7401.71]
  - - [704, 768, 1, 64]
    - [109, 6852.08]
  - - [768, 768, 1, 64]
    - [107, 6907.56]
  - - [832, 768, 1, 64]
    - [109, 7503.57]
  - - [896, 768, 1, 64]
    - [74, 8635.33]
  - - [960, 768, 1, 64]
    - [72, 8903.0]
  - - [1024, 768, 1, 64]
    - [156, 7661.48]
  - - [128, 832, 1, 64]
    - [103, 2412.19]
  - - [256, 832, 1, 64]
    - [133, 4130.75]
  - - [384, 832, 1, 64]
    - [93, 5310.97]
  - - [512, 832, 1, 64]
    - [133, 5876.16]
  - - [640, 832, 1, 64]
    - [133, 6482.15]
  - - [768, 832, 1, 64]
    - [93, 8178.89]
  - - [896, 832, 1, 64]
    - [96, 8754.17]
  - - [1024, 832, 1, 64]
    - [127, 8018.52]
  - - [64, 896, 1, 64]
    - [62, 1499.43]
  - - [128, 896, 1, 64]
    - [103, 2540.18]
  - - [192, 896, 1, 64]
    - [13, 3387.71]
  - - [256, 896, 1, 64]
    - [89, 4448.5]
  - - [320, 896, 1, 64]
    - [30, 4893.35]
  - - [384, 896, 1, 64]
    - [59, 5306.05]
  - - [448, 896, 1, 64]
    - [134, 6265.88]
  - - [512, 896, 1, 64]
    - [94, 6272.99]
  - - [576, 896, 1, 64]
    - [134, 6101.52]
  - - [640, 896, 1, 64]
    - [107, 6719.42]
  - - [704, 896, 1, 64]
    - [109, 7763.5]
  - - [768, 896, 1, 64]
    - [72, 9080.45]
  - - [832, 896, 1, 64]
    - [109, 7462.08]
  - - [896, 896, 1, 64]
    - [92, 7854.69]
  - - [960, 896, 1, 64]
    - [134, 7663.51]
  - - [1024, 896, 1, 64]
    - [75, 8764.22]
  - - [128, 960, 1, 64]
    - [128, 2651.93]
  - - [256, 960, 1, 64]
    - [128, 4766.25]
  - - [384, 960, 1, 64]
    - [36, 6208.67]
  - - [512, 960, 1, 64]
    - [156, 6439.68]
  - - [640, 960, 1, 64]
    - [74, 7098.79]
  - - [768, 960, 1, 64]
    - [74, 9532.51]
  - - [896, 960, 1, 64]
    - [74, 9410.3]
  - - [1024, 960, 1, 64]
    - [97, 7947.65]
  - - [64, 1024, 1, 64]
    - [144, 1663.13]
  - - [128, 1024, 1, 64]
    - [77, 2843.6]
  - - [192, 1024, 1, 64]
    - [20, 3635.83]
  - - [256, 1024, 1, 64]
    - [94, 4534.38]
  - - [320, 1024, 1, 64]
    - [109, 5309.25]
  - - [384, 1024, 1, 64]
    - [128, 5785.25]
  - - [448, 1024, 1, 64]
    - [109, 6749.45]
  - - [512, 1024, 1, 64]
    - [133, 6229.69]
  - - [576, 1024, 1, 64]
    - [72, 7549.75]
  - - [640, 1024, 1, 64]
    - [96, 8305.55]
  - - [704, 1024, 1, 64]
    - [109, 8165.9]
  - - [768, 1024, 1, 64]
    - [96, 7814.84]
  - - [832, 1024, 1, 64]
    - [134, 7631.2]
  - - [896, 1024, 1, 64]
    - [127, 8124.24]
  - - [960, 1024, 1, 64]
    - [134, 8157.32]
  - - [1024, 1024, 1, 64]
    - [97, 8548.9]
  - - [128, 64, 1, 256]
    - [129, 861.035]
  - - [256, 64, 1, 256]
    - [140, 1634.98]
  - - [384, 64, 1, 256]
    - [113, 2167.61]
  - - [512, 64, 1, 256]
    - [113, 2810.54]
  - - [640, 64, 1, 256]
    - [81, 3246.87]
  - - [768, 64, 1, 256]
    - [144, 3613.76]
  - - [896, 64, 1, 256]
    - [144, 4020.45]
  - - [1024, 64, 1, 256]
    - [144, 4405.29]
  - - [64, 128, 1, 256]
    - [129, 887.585]
  - - [128, 128, 1, 256]
    - [140, 1644.11]
  - - [192, 128, 1, 256]
    - [138, 2257.49]
  - - [256, 128, 1, 256]
    - [113, 2955.35]
  - - [320, 128, 1, 256]
    - [81, 3468.7]
  - - [384, 128, 1, 256]
    - [7, 3647.22]
  - - [448, 128, 1, 256]
    - [144, 4336.78]
  - - [512, 128, 1, 256]
    - [144, 4830.71]
  - - [576, 128, 1, 256]
    - [144, 5322.72]
  - - [640, 128, 1, 256]
    - [144, 5742.12]
  - - [704, 128, 1, 256]
    - [82, 5565.18]
  - - [768, 128, 1, 256]
    - [82, 5936.73]
  - - [832, 128, 1, 256]
    - [82, 6446.73]
  - - [896, 128, 1, 256]
    - [82, 6971.42]
  - - [960, 128, 1, 256]
    - [82, 7304.4]
  - - [1024, 128, 1, 256]
    - [158, 7989.15]
  - - [128, 192, 1, 256]
    - [141, 2246.95]
  - - [256, 192, 1, 256]
    - [144, 3752.81]
  - - [384, 192, 1, 256]
    - [81, 5392.68]
  - - [512, 192, 1, 256]
    - [83, 6269.73]
  - - [640, 192, 1, 256]
    - [83, 7330.61]
  - - [768, 192, 1, 256]
    - [83, 8790.44]
  - - [896, 192, 1, 256]
    - [120, 8739.47]
  - - [1024, 192, 1, 256]
    - [120, 9482.1]
  - - [64, 256, 1, 256]
    - [149, 1639.12]
  - - [128, 256, 1, 256]
    - [62, 3008.83]
  - - [192, 256, 1, 256]
    - [144, 3787.5]
  - - [320, 256, 1, 256]
    - [144, 5672.51]
  - - [384, 256, 1, 256]
    - [27, 6227.06]
  - - [448, 256, 1, 256]
    - [20, 6930.39]
  - - [512, 256, 1, 256]
    - [83, 8184.01]
  - - [576, 256, 1, 256]
    - [158, 8444.33]
  - - [640, 256, 1, 256]
    - [83, 9527.99]
  - - [704, 256, 1, 256]
    - [158, 8894.19]
  - - [768, 256, 1, 256]
    - [131, 9694.14]
  - - [832, 256, 1, 256]
    - [158, 10107.1]
  - - [896, 256, 1, 256]
    - [83, 10692.5]
  - - [960, 256, 1, 256]
    - [158, 11759.7]
  - - [1024, 256, 1, 256]
    - [87, 11115.2]
  - - [128, 320, 1, 256]
    - [138, 3503.46]
  - - [256, 320, 1, 256]
    - [144, 5636.88]
  - - [384, 320, 1, 256]
    - [83, 7314.18]
  - - [512, 320, 1, 256]
    - [83, 9376.69]
  - - [640, 320, 1, 256]
    - [89, 10180.3]
  - - [768, 320, 1, 256]
    - [131, 11175.4]
  - - [896, 320, 1, 256]
    - [104, 12010.2]
  - - [1024, 320, 1, 256]
    - [104, 14716.9]
  - - [64, 384, 1, 256]
    - [62, 2254.14]
  - - [128, 384, 1, 256]
    - [69, 3700.86]
  - - [192, 384, 1, 256]
    - [66, 5274.08]
  - - [256, 384, 1, 256]
    - [31, 6371.09]
  - - [320, 384, 1, 256]
    - [69, 7672.51]
  - - [384, 384, 1, 256]
    - [83, 8987.79]
  - - [448, 384, 1, 256]
    - [47, 9025.27]
  - - [512, 384, 1, 256]
    - [47, 10143.3]
  - - [576, 384, 1, 256]
    - [47, 11102.6]
  - - [640, 384, 1, 256]
    - [83, 11283.2]
  - - [704, 384, 1, 256]
    - [95, 11345.2]
  - - [768, 384, 1, 256]
    - [104, 12152.8]
  - - [832, 384, 1, 256]
    - [47, 13086.2]
  - - [896, 384, 1, 256]
    - [36, 14092.9]
  - - [960, 384, 1, 256]
    - [53, 16271.0]
  - - [1024, 384, 1, 256]
    - [74, 14695.4]
  - - [128, 448, 1, 256]
    - [62, 4384.29]
  - - [256, 448, 1, 256]
    - [20, 6990.51]
  - - [384, 448, 1, 256]
    - [27, 8992.33]
  - - [512, 448, 1, 256]
    - [83, 10862.3]
  - - [640, 448, 1, 256]
    - [87, 11819.6]
  - - [768, 448, 1, 256]
    - [36, 12414.2]
  - - [896, 448, 1, 256]
    - [127, 14370.3]
  - - [1024, 448, 1, 256]
    - [94, 16078.7]
  - - [64, 512, 1, 256]
    - [62, 2884.76]
  - - [128, 512, 1, 256]
    - [66, 4787.92]
  - - [192, 512, 1, 256]
    - [27, 6258.89]
  - - [256, 512, 1, 256]
    - [128, 7989.15]
  - - [320, 512, 1, 256]
    - [158, 9320.68]
  - - [384, 512, 1, 256]
    - [83, 9496.54]
  - - [448, 512, 1, 256]
    - [158, 10346.5]
  - - [512, 512, 1, 256]
    - [104, 10732]
  - - [576, 512, 1, 256]
    - [95, 11310.2]
  - - [640, 512, 1, 256]
    - [104, 12988.6]
  - - [704, 512, 1, 256]
    - [59, 12905.6]
  - - [768, 512, 1, 256]
    - [127, 13952.1]
  - - [832, 512, 1, 256]
    - [109, 14348.9]
  - - [896, 512, 1, 256]
    - [104, 16021.1]
  - - [128, 576, 1, 256]
    - [66, 5279.03]
  - - [256, 576, 1, 256]
    - [128, 8109.98]
  - - [384, 576, 1, 256]
    - [36, 11674.9]
  - - [512, 576, 1, 256]
    - [47, 11828.1]
  - - [640, 576, 1, 256]
    - [36, 14861.7]
  - - [768, 576, 1, 256]
    - [74, 16294.4]
  - - [64, 640, 1, 256]
    - [62, 3323.05]
  - - [128, 640, 1, 256]
    - [66, 5601.69]
  - - [192, 640, 1, 256]
    - [20, 7137.76]
  - - [256, 640, 1, 256]
    - [83, 9532.51]
  - - [320, 640, 1, 256]
    - [30, 9798.86]
  - - [384, 640, 1, 256]
    - [127, 10812.8]
  - - [448, 640, 1, 256]
    - [43, 11139.1]
  - - [512, 640, 1, 256]
    - [104, 12665.4]
  - - [576, 640, 1, 256]
    - [59, 13164.3]
  - - [640, 640, 1, 256]
    - [127, 14275]
  - - [704, 640, 1, 256]
    - [109, 15077.6]
  - - [128, 704, 1, 256]
    - [7, 5492.54]
  - - [256, 704, 1, 256]
    - [69, 8923.55]
  - - [384, 704, 1, 256]
    - [87, 10735.5]
  - - [512, 704, 1, 256]
    - [36, 13981.0]
  - - [640, 704, 1, 256]
    - [104, 15420.8]
  - - [64, 768, 1, 256]
    - [62, 3682.88]
  - - [128, 768, 1, 256]
    - [69, 6061.03]
  - - [192, 768, 1, 256]
    - [158, 8206.25]
  - - [256, 768, 1, 256]
    - [36, 9918.13]
  - - [320, 768, 1, 256]
    - [47, 12099.0]
  - - [384, 768, 1, 256]
    - [53, 11962.3]
  - - [448, 768, 1, 256]
    - [47, 13981.0]
  - - [512, 768, 1, 256]
    - [74, 13701.8]
  - - [576, 768, 1, 256]
    - [53, 15515.3]
  - - [128, 832, 1, 256]
    - [20, 6301.21]
  - - [256, 832, 1, 256]
    - [36, 9741.53]
  - - [384, 832, 1, 256]
    - [36, 12107.3]
  - - [512, 832, 1, 256]
    - [94, 14428.2]
  - - [64, 896, 1, 256]
    - [62, 4112.09]
  - - [128, 896, 1, 256]
    - [20, 6820.01]
  - - [192, 896, 1, 256]
    - [27, 8635.33]
  - - [256, 896, 1, 256]
    - [36, 9899.91]
  - - [320, 896, 1, 256]
    - [30, 11223.4]
  - - [384, 896, 1, 256]
    - [36, 13013.2]
  - - [448, 896, 1, 256]
    - [134, 13511.8]
  - - [512, 896, 1, 256]
    - [91, 15450]
  - - [128, 960, 1, 256]
    - [69, 7344.26]
  - - [256, 960, 1, 256]
    - [36, 12839.7]
  - - [384, 960, 1, 256]
    - [47, 15345.0]
  - - [64, 1024, 1, 256]
    - [66, 4432.85]
  - - [128, 1024, 1, 256]
    - [20, 6836.01]
  - - [192, 1024, 1, 256]
    - [20, 8833.07]
  - - [256, 1024, 1, 256]
    - [36, 10179.7]
  - - [320, 1024, 1, 256]
    - [47, 12264.5]
  - - [384, 1024, 1, 256]
    - [127, 13539]
  - - [448, 1024, 1, 256]
    - [47, 14989.6]
  - - [128, 64, 1, 512]
    - [129, 1446.31]
  - - [256, 64, 1, 512]
    - [140, 2686.59]
  - - [384, 64, 1, 512]
    - [138, 3388.13]
  - - [512, 64, 1, 512]
    - [113, 4194.3]
  - - [640, 64, 1, 512]
    - [81, 5114.67]
  - - [768, 64, 1, 512]
    - [144, 5269.57]
  - - [896, 64, 1, 512]
    - [144, 6009.52]
  - - [1024, 64, 1, 512]
    - [144, 6490.69]
  - - [64, 128, 1, 512]
    - [129, 1375.18]
  - - [128, 128, 1, 512]
    - [148, 2585.27]
  - - [192, 128, 1, 512]
    - [138, 3440.08]
  - - [256, 128, 1, 512]
    - [113, 4441.79]
  - - [320, 128, 1, 512]
    - [138, 5526.69]
  - - [384, 128, 1, 512]
    - [130, 5433.37]
  - - [448, 128, 1, 512]
    - [144, 6191.92]
  - - [512, 128, 1, 512]
    - [84, 7198.57]
  - - [576, 128, 1, 512]
    - [158, 8206.25]
  - - [640, 128, 1, 512]
    - [84, 9118.05]
  - - [704, 128, 1, 512]
    - [144, 7653.02]
  - - [768, 128, 1, 512]
    - [83, 8391.14]
  - - [832, 128, 1, 512]
    - [144, 8880.9]
  - - [896, 128, 1, 512]
    - [128, 9577.91]
  - - [960, 128, 1, 512]
    - [158, 10012.9]
  - - [1024, 128, 1, 512]
    - [131, 10830.2]
  - - [128, 192, 1, 512]
    - [141, 3544.48]
  - - [256, 192, 1, 512]
    - [130, 5655.24]
  - - [384, 192, 1, 512]
    - [84, 8206.25]
  - - [512, 192, 1, 512]
    - [83, 8621.38]
  - - [640, 192, 1, 512]
    - [83, 10381.2]
  - - [768, 192, 1, 512]
    - [83, 12128.2]
  - - [896, 192, 1, 512]
    - [47, 12171.6]
  - - [1024, 192, 1, 512]
    - [47, 14483.9]
  - - [64, 256, 1, 512]
    - [65, 2488.89]
  - - [128, 256, 1, 512]
    - [62, 4410.97]
  - - [192, 256, 1, 512]
    - [69, 5592.41]
  - - [256, 256, 1, 512]
    - [144, 6853.41]
  - - [320, 256, 1, 512]
    - [102, 8450.51]
  - - [384, 256, 1, 512]
    - [27, 8677.87]
  - - [448, 256, 1, 512]
    - [144, 9462.43]
  - - [512, 256, 1, 512]
    - [83, 11184.8]
  - - [576, 256, 1, 512]
    - [158, 11509.9]
  - - [640, 256, 1, 512]
    - [83, 13640.0]
  - - [704, 256, 1, 512]
    - [47, 11595.9]
  - - [768, 256, 1, 512]
    - [83, 12938.2]
  - - [832, 256, 1, 512]
    - [128, 13720.7]
  - - [896, 256, 1, 512]
    - [83, 14931.1]
  - - [128, 320, 1, 512]
    - [138, 5407.05]
  - - [256, 320, 1, 512]
    - [102, 9218.25]
  - - [384, 320, 1, 512]
    - [27, 10663.5]
  - - [512, 320, 1, 512]
    - [83, 13640.0]
  - - [640, 320, 1, 512]
    - [131, 13256]
  - - [64, 384, 1, 512]
    - [65, 3336.13]
  - - [128, 384, 1, 512]
    - [69, 5785.25]
  - - [192, 384, 1, 512]
    - [66, 7743.64]
  - - [256, 384, 1, 512]
    - [31, 8987.79]
  - - [320, 384, 1, 512]
    - [31, 10442.8]
  - - [384, 384, 1, 512]
    - [102, 11296.2]
  - - [448, 384, 1, 512]
    - [47, 12318.9]
  - - [512, 384, 1, 512]
    - [47, 13438.3]
  - - [576, 384, 1, 512]
    - [47, 15620.2]
  - - [128, 448, 1, 512]
    - [69, 6397.04]
  - - [256, 448, 1, 512]
    - [31, 10037.7]
  - - [384, 448, 1, 512]
    - [27, 12233.4]
  - - [512, 448, 1, 512]
    - [47, 15763.8]
  - - [64, 512, 1, 512]
    - [65, 4352.01]
  - - [128, 512, 1, 512]
    - [66, 7104.27]
  - - [192, 512, 1, 512]
    - [27, 8753.33]
  - - [256, 512, 1, 512]
    - [102, 9673.64]
  - - [320, 512, 1, 512]
    - [158, 13751.8]
  - - [384, 512, 1, 512]
    - [36, 13981.0]
  - - [448, 512, 1, 512]
    - [158, 13541.9]
  - - [128, 576, 1, 512]
    - [66, 7672.25]
  - - [256, 576, 1, 512]
    - [36, 10594]
  - - [384, 576, 1, 512]
    - [36, 15950.2]
  - - [64, 640, 1, 512]
    - [66, 5015.01]
  - - [128, 640, 1, 512]
    - [66, 8217.61]
  - - [192, 640, 1, 512]
    - [27, 11135.3]
  - - [256, 640, 1, 512]
    - [102, 11242.1]
  - - [320, 640, 1, 512]
    - [47, 13607.1]
  - - [128, 704, 1, 512]
    - [44, 7886.73]
  - - [256, 704, 1, 512]
    - [36, 12469.6]
  - - [64, 768, 1, 512]
    - [69, 5499.04]
  - - [128, 768, 1, 512]
    - [69, 8807.75]
  - - [192, 768, 1, 512]
    - [47, 10704.7]
  - - [256, 768, 1, 512]
    - [36, 14150.3]
  - - [128, 832, 1, 512]
    - [69, 9065.82]
  - - [256, 832, 1, 512]
    - [36, 14837.0]
  - - [64, 896, 1, 512]
    - [69, 5959.94]
  - - [128, 896, 1, 512]
    - [69, 9952.59]
  - - [192, 896, 1, 512]
    - [27, 12149.0]
  - - [256, 896, 1, 512]
    - [36, 15870.3]
  - - [128, 960, 1, 512]
    - [69, 10439.3]
  - - [64, 1024, 1, 512]
    - [66, 6536.7]
  - - [128, 1024, 1, 512]
    - [20, 9488.28]
  - - [192, 1024, 1, 512]
    - [47, 13264.8]
  - - [128, 64, 1, 1024]
    - [153, 2158.88]
  - - [256, 64, 1, 1024]
    - [148, 3946.46]
  - - [384, 64, 1, 1024]
    - [148, 4728.97]
  - - [512, 64, 1, 1024]
    - [81, 6150.54]
  - - [640, 64, 1, 1024]
    - [112, 7259.02]
  - - [768, 64, 1, 1024]
    - [84, 7019.32]
  - - [896, 64, 1, 1024]
    - [84, 8572.3]
  - - [1024, 64, 1, 1024]
    - [84, 8885.2]
  - - [64, 128, 1, 1024]
    - [62, 1913.53]
  - - [128, 128, 1, 1024]
    - [62, 3540.56]
  - - [192, 128, 1, 1024]
    - [62, 4477.75]
  - - [256, 128, 1, 1024]
    - [138, 5800.79]
  - - [320, 128, 1, 1024]
    - [66, 6844.24]
  - - [384, 128, 1, 1024]
    - [69, 7989.15]
  - - [448, 128, 1, 1024]
    - [102, 7888.41]
  - - [512, 128, 1, 1024]
    - [102, 9655.95]
  - - [576, 128, 1, 1024]
    - [102, 11021.5]
  - - [640, 128, 1, 1024]
    - [102, 11358.3]
  - - [704, 128, 1, 1024]
    - [130, 9736.05]
  - - [768, 128, 1, 1024]
    - [130, 10421.1]
  - - [832, 128, 1, 1024]
    - [130, 11264]
  - - [896, 128, 1, 1024]
    - [84, 12214.4]
  - - [128, 192, 1, 1024]
    - [62, 4586.16]
  - - [256, 192, 1, 1024]
    - [69, 7528.1]
  - - [384, 192, 1, 1024]
    - [118, 9218.68]
  - - [512, 192, 1, 1024]
    - [120, 11912.8]
  - - [64, 256, 1, 1024]
    - [62, 3676.51]
  - - [128, 256, 1, 1024]
    - [62, 6112.36]
  - - [192, 256, 1, 1024]
    - [69, 7864.32]
  - - [256, 256, 1, 1024]
    - [66, 8402.89]
  - - [320, 256, 1, 1024]
    - [71, 10066.4]
  - - [384, 256, 1, 1024]
    - [37, 12055.5]
  - - [448, 256, 1, 1024]
    - [27, 12835.0]
  - - [128, 320, 1, 1024]
    - [62, 7166.97]
  - - [256, 320, 1, 1024]
    - [141, 10308.6]
  - - [64, 384, 1, 1024]
    - [62, 4682.86]
  - - [128, 384, 1, 1024]
    - [69, 8053.06]
  - - [192, 384, 1, 1024]
    - [66, 9678.78]
  - - [256, 384, 1, 1024]
    - [37, 10969.7]
  - - [128, 448, 1, 1024]
    - [69, 8830.11]
  - - [256, 448, 1, 1024]
    - [69, 12188.8]
  - - [64, 512, 1, 1024]
    - [62, 5915.57]
  - - [128, 512, 1, 1024]
    - [66, 8904.81]
  - - [192, 512, 1, 1024]
    - [27, 11042.2]
  - - [128, 576, 1, 1024]
    - [66, 9914.6]
  - - [64, 640, 1, 1024]
    - [62, 6726.76]
  - - [128, 640, 1, 1024]
    - [66, 10736.2]
  - - [128, 704, 1, 1024]
    - [69, 10121.2]
  - - [64, 768, 1, 1024]
    - [69, 8053.06]
  - - [128, 768, 1, 1024]
    - [69, 11024.2]
  - - [128, 832, 1, 1024]
    - [69, 11622.1]
  - - [64, 896, 1, 1024]
    - [62, 7825.74]
  - - [128, 896, 1, 1024]
    - [69, 12305.9]
  - - [64, 1024, 1, 1024]
    - [66, 8253.84]
  - - [128, 64, 1, 2048]
    - [64, 2744.29]
  - - [256, 64, 1, 2048]
    - [148, 4452.78]
  - - [384, 64, 1, 2048]
    - [26, 6942.3]
  - - [512, 64, 1, 2048]
    - [138, 6980.74]
  - - [640, 64, 1, 2048]
    - [136, 11650.8]
  - - [768, 64, 1, 2048]
    - [118, 7965.35]
  - - [896, 64, 1, 2048]
    - [118, 9298.64]
  - - [64, 128, 1, 2048]
    - [64, 2875.76]
  - - [128, 128, 1, 2048]
    - [68, 4398.73]
  - - [192, 128, 1, 2048]
    - [29, 7241.96]
  - - [256, 128, 1, 2048]
    - [62, 7017.71]
  - - [320, 128, 1, 2048]
    - [62, 8472.68]
  - - [384, 128, 1, 2048]
    - [38, 11570.5]
  - - [448, 128, 1, 2048]
    - [62, 9035.42]
  - - [128, 192, 1, 2048]
    - [68, 5697.47]
  - - [256, 192, 1, 2048]
    - [38, 9248.59]
  - - [64, 256, 1, 2048]
    - [63, 4435.71]
  - - [128, 256, 1, 2048]
    - [62, 7313.15]
  - - [192, 256, 1, 2048]
    - [26, 8613.69]
  - - [128, 320, 1, 2048]
    - [62, 8688.04]
  - - [64, 384, 1, 2048]
    - [62, 5516.12]
  - - [128, 384, 1, 2048]
    - [51, 11439.0]
  - - [128, 448, 1, 2048]
    - [62, 9559.59]
  - - [64, 512, 1, 2048]
    - [62, 6940.05]
  - - [64, 640, 1, 2048]
    - [63, 7689.3]
  - - [64, 768, 1, 2048]
    - [62, 8133.49]
  - - [64, 896, 1, 2048]
    - [63, 8975.88]
  - - [128, 64, 1, 4096]
    - [64, 4971.03]
  - - [256, 64, 1, 4096]
    - [68, 7669.58]
  - - [384, 64, 1, 4096]
    - [68, 7064.73]
  - - [64, 128, 1, 4096]
    - [64, 4934.48]
  - - [128, 128, 1, 4096]
    - [68, 6062.83]
  - - [192, 128, 1, 4096]
    - [68, 7823.97]
  - - [128, 192, 1, 4096]
    - [68, 7482.88]
  - - [64, 256, 1, 4096]
    - [64, 5998.27]
  - - [64, 384, 1, 4096]
    - [12, 6984.26]
  - - [1, 1, 1, 1]
    - [11, 0.000344828]
  - - [2, 2, 1, 2]
    - [15, 0.00280702]
  - - [4, 2, 1, 2]
    - [0, 0.00561404]
  - - [6, 2, 1, 2]
    - [17, 0.00842105]
  - - [8, 2, 1, 2]
    - [15, 0.0116364]
  - - [10, 2, 1, 2]
    - [10, 0.0140351]
  - - [12, 2, 1, 2]
    - [15, 0.0174545]
  - - [14, 2, 1, 2]
    - [15, 0.02]
  - - [16, 2, 1, 2]
    - [15, 0.0228571]
  - - [2, 4, 1, 2]
    - [8, 0.00571429]
  - - [4, 4, 1, 2]
    - [40, 0.0114286]
  - - [6, 4, 1, 2]
    - [11, 0.0168421]
  - - [8, 4, 1, 2]
    - [11, 0.0228571]
  - - [10, 4, 1, 2]
    - [17, 0.0275862]
  - - [12, 4, 1, 2]
    - [15, 0.0349091]
  - - [14, 4, 1, 2]
    - [16, 0.0386207]
  - - [16, 4, 1, 2]
    - [8, 0.0457143]
  - - [2, 6, 1, 2]
    - [11, 0.00827586]
  - - [4, 6, 1, 2]
    - [40, 0.0171429]
  - - [6, 6, 1, 2]
    - [0, 0.0248276]
  - - [8, 6, 1, 2]
    - [2, 0.0331034]
  - - [10, 6, 1, 2]
    - [8, 0.0421053]
  - - [12, 6, 1, 2]
    - [15, 0.0533333]
  - - [14, 6, 1, 2]
    - [11, 0.06]
  - - [16, 6, 1, 2]
    - [15, 0.0711111]
  - - [2, 8, 1, 2]
    - [40, 0.0114286]
  - - [4, 8, 1, 2]
    - [40, 0.0224561]
  - - [6, 8, 1, 2]
    - [17, 0.0349091]
  - - [8, 8, 1, 2]
    - [15, 0.0465455]
  - - [10, 8, 1, 2]
    - [15, 0.0581818]
  - - [12, 8, 1, 2]
    - [15, 0.0698182]
  - - [14, 8, 1, 2]
    - [15, 0.08]
  - - [16, 8, 1, 2]
    - [15, 0.0948148]
  - - [2, 10, 1, 2]
    - [8, 0.0140351]
  - - [4, 10, 1, 2]
    - [1, 0.0280702]
  - - [6, 10, 1, 2]
    - [39, 0.0428571]
  - - [8, 10, 1, 2]
    - [11, 0.0542373]
  - - [10, 10, 1, 2]
    - [15, 0.0740741]
  - - [12, 10, 1, 2]
    - [11, 0.0872727]
  - - [14, 10, 1, 2]
    - [17, 0.1]
  - - [16, 10, 1, 2]
    - [39, 0.114286]
  - - [2, 12, 1, 2]
    - [11, 0.0168421]
  - - [4, 12, 1, 2]
    - [15, 0.0336842]
  - - [6, 12, 1, 2]
    - [11, 0.0496552]
  - - [8, 12, 1, 2]
    - [10, 0.0650847]
  - - [10, 12, 1, 2]
    - [15, 0.0872727]
  - - [12, 12, 1, 2]
    - [15, 0.104727]
  - - [14, 12, 1, 2]
    - [0, 0.113898]
  - - [16, 12, 1, 2]
    - [10, 0.139636]
  - - [2, 14, 1, 2]
    - [17, 0.0193103]
  - - [4, 14, 1, 2]
    - [8, 0.0386207]
  - - [6, 14, 1, 2]
    - [8, 0.0569492]
  - - [8, 14, 1, 2]
    - [15, 0.082963]
  - - [10, 14, 1, 2]
    - [15, 0.103704]
  - - [12, 14, 1, 2]
    - [15, 0.12]
  - - [14, 14, 1, 2]
    - [15, 0.14]
  - - [16, 14, 1, 2]
    - [14, 0.154483]
  - - [2, 16, 1, 2]
    - [8, 0.0216949]
  - - [4, 16, 1, 2]
    - [2, 0.0441379]
  - - [6, 16, 1, 2]
    - [15, 0.0650847]
  - - [8, 16, 1, 2]
    - [15, 0.0898246]
  - - [10, 16, 1, 2]
    - [11, 0.114286]
  - - [12, 16, 1, 2]
    - [11, 0.137143]
  - - [14, 16, 1, 2]
    - [17, 0.157193]
  - - [16, 16, 1, 2]
    - [15, 0.179649]
  - - [2, 2, 1, 4]
    - [40, 0.00561404]
  - - [4, 2, 1, 4]
    - [17, 0.0110345]
  - - [6, 2, 1, 4]
    - [8, 0.0168421]
  - - [8, 2, 1, 4]
    - [14, 0.0232727]
  - - [10, 2, 1, 4]
    - [11, 0.0290909]
  - - [12, 2, 1, 4]
    - [15, 0.0349091]
  - - [14, 2, 1, 4]
    - [11, 0.04]
  - - [16, 2, 1, 4]
    - [15, 0.0457143]
  - - [2, 4, 1, 4]
    - [17, 0.0116364]
  - - [4, 4, 1, 4]
    - [0, 0.0237037]
  - - [6, 4, 1, 4]
    - [15, 0.0336842]
  - - [8, 4, 1, 4]
    - [11, 0.0457143]
  - - [10, 4, 1, 4]
    - [15, 0.0581818]
  - - [12, 4, 1, 4]
    - [15, 0.0711111]
  - - [14, 4, 1, 4]
    - [15, 0.0814545]
  - - [16, 4, 1, 4]
    - [11, 0.0867797]
  - - [2, 6, 1, 4]
    - [40, 0.0171429]
  - - [4, 6, 1, 4]
    - [11, 0.0336842]
  - - [6, 6, 1, 4]
    - [15, 0.0505263]
  - - [8, 6, 1, 4]
    - [11, 0.0673684]
  - - [10, 6, 1, 4]
    - [17, 0.0857143]
  - - [12, 6, 1, 4]
    - [2, 0.0993103]
  - - [14, 6, 1, 4]
    - [15, 0.122182]
  - - [16, 6, 1, 4]
    - [15, 0.137143]
  - - [2, 8, 1, 4]
    - [11, 0.0224561]
  - - [4, 8, 1, 4]
    - [17, 0.0465455]
  - - [6, 8, 1, 4]
    - [8, 0.0662069]
  - - [8, 8, 1, 4]
    - [15, 0.0930909]
  - - [10, 8, 1, 4]
    - [15, 0.116364]
  - - [12, 8, 1, 4]
    - [15, 0.137143]
  - - [14, 8, 1, 4]
    - [11, 0.154483]
  - - [16, 8, 1, 4]
    - [15, 0.186182]
  - - [2, 10, 1, 4]
    - [8, 0.0275862]
  - - [4, 10, 1, 4]
    - [39, 0.0592593]
  - - [6, 10, 1, 4]
    - [17, 0.0827586]
  - - [8, 10, 1, 4]
    - [11, 0.116364]
  - - [10, 10, 1, 4]
    - [2, 0.137931]
  - - [12, 10, 1, 4]
    - [15, 0.174545]
  - - [14, 10, 1, 4]
    - [15, 0.203636]
  - - [16, 10, 1, 4]
    - [8, 0.224561]
  - - [2, 12, 1, 4]
    - [8, 0.0331034]
  - - [4, 12, 1, 4]
    - [17, 0.0685714]
  - - [6, 12, 1, 4]
    - [15, 0.101053]
  - - [8, 12, 1, 4]
    - [150, 0.132414]
  - - [10, 12, 1, 4]
    - [17, 0.174545]
  - - [12, 12, 1, 4]
    - [15, 0.205714]
  - - [14, 12, 1, 4]
    - [15, 0.244364]
  - - [16, 12, 1, 4]
    - [11, 0.269474]
  - - [2, 14, 1, 4]
    - [8, 0.0392982]
  - - [4, 14, 1, 4]
    - [39, 0.0785965]
  - - [6, 14, 1, 4]
    - [8, 0.115862]
  - - [8, 14, 1, 4]
    - [17, 0.16]
  - - [10, 14, 1, 4]
    - [11, 0.203636]
  - - [12, 14, 1, 4]
    - [17, 0.244364]
  - - [14, 14, 1, 4]
    - [11, 0.275088]
  - - [16, 14, 1, 4]
    - [15, 0.32]
  - - [2, 16, 1, 4]
    - [2, 0.0441379]
  - - [4, 16, 1, 4]
    - [5, 0.0867797]
  - - [6, 16, 1, 4]
    - [8, 0.132414]
  - - [8, 16, 1, 4]
    - [7, 0.173559]
  - - [10, 16, 1, 4]
    - [15, 0.232727]
  - - [12, 16, 1, 4]
    - [11, 0.269474]
  - - [14, 16, 1, 4]
    - [15, 0.325818]
  - - [16, 16, 1, 4]
    - [15, 0.365714]
  - - [2, 2, 1, 6]
    - [17, 0.00842105]
  - - [4, 2, 1, 6]
    - [0, 0.0162712]
  - - [6, 2, 1, 6]
    - [17, 0.0252632]
  - - [8, 2, 1, 6]
    - [15, 0.0349091]
  - - [10, 2, 1, 6]
    - [0, 0.0393443]
  - - [12, 2, 1, 6]
    - [16, 0.0496552]
  - - [14, 2, 1, 6]
    - [15, 0.0610909]
  - - [16, 2, 1, 6]
    - [11, 0.0673684]
  - - [2, 4, 1, 6]
    - [0, 0.016]
  - - [4, 4, 1, 6]
    - [39, 0.0342857]
  - - [6, 4, 1, 6]
    - [17, 0.0505263]
  - - [8, 4, 1, 6]
    - [15, 0.0685714]
  - - [10, 4, 1, 6]
    - [15, 0.0872727]
  - - [12, 4, 1, 6]
    - [11, 0.104727]
  - - [14, 4, 1, 6]
    - [17, 0.115862]
  - - [16, 4, 1, 6]
    - [15, 0.139636]
  - - [2, 6, 1, 6]
    - [40, 0.0252632]
  - - [4, 6, 1, 6]
    - [2, 0.0488136]
  - - [6, 6, 1, 6]
    - [17, 0.0771429]
  - - [8, 6, 1, 6]
    - [11, 0.104727]
  - - [10, 6, 1, 6]
    - [11, 0.122034]
  - - [12, 6, 1, 6]
    - [17, 0.148966]
  - - [14, 6, 1, 6]
    - [15, 0.186667]
  - - [16, 6, 1, 6]
    - [15, 0.209455]
  - - [2, 8, 1, 6]
    - [3, 0.032]
  - - [4, 8, 1, 6]
    - [40, 0.0685714]
  - - [6, 8, 1, 6]
    - [17, 0.102857]
  - - [8, 8, 1, 6]
    - [150, 0.134737]
  - - [10, 8, 1, 6]
    - [14, 0.162712]
  - - [12, 8, 1, 6]
    - [15, 0.18]
  - - [14, 8, 1, 6]
    - [15, 0.244364]
  - - [16, 8, 1, 6]
    - [11, 0.274286]
  - - [2, 10, 1, 6]
    - [8, 0.0413793]
  - - [4, 10, 1, 6]
    - [0, 0.0827586]
  - - [6, 10, 1, 6]
    - [17, 0.126316]
  - - [8, 10, 1, 6]
    - [15, 0.177778]
  - - [10, 10, 1, 6]
    - [14, 0.210526]
  - - [12, 10, 1, 6]
    - [15, 0.261818]
  - - [14, 10, 1, 6]
    - [15, 0.3]
  - - [16, 10, 1, 6]
    - [141, 0.336842]
  - - [2, 12, 1, 6]
    - [17, 0.0523636]
  - - [4, 12, 1, 6]
    - [8, 0.101053]
  - - [6, 12, 1, 6]
    - [8, 0.151579]
  - - [8, 12, 1, 6]
    - [15, 0.202105]
  - - [10, 12, 1, 6]
    - [15, 0.261818]
  - - [12, 12, 1, 6]
    - [17, 0.314182]
  - - [14, 12, 1, 6]
    - [15, 0.36]
  - - [16, 12, 1, 6]
    - [17, 0.411429]
  - - [2, 14, 1, 6]
    - [40, 0.0569492]
  - - [4, 14, 1, 6]
    - [11, 0.108387]
  - - [6, 14, 1, 6]
    - [40, 0.18]
  - - [8, 14, 1, 6]
    - [15, 0.24]
  - - [10, 14, 1, 6]
    - [8, 0.3]
  - - [12, 14, 1, 6]
    - [5, 0.341695]
  - - [14, 14, 1, 6]
    - [17, 0.42]
  - - [16, 14, 1, 6]
    - [15, 0.48]
  - - [2, 16, 1, 6]
    - [8, 0.0685714]
  - - [4, 16, 1, 6]
    - [8, 0.132414]
  - - [6, 16, 1, 6]
    - [5, 0.198621]
  - - [8, 16, 1, 6]
    - [10, 0.274286]
  - - [10, 16, 1, 6]
    - [15, 0.336842]
  - - [12, 16, 1, 6]
    - [15, 0.411429]
  - - [14, 16, 1, 6]
    - [11, 0.488727]
  - - [16, 16, 1, 6]
    - [15, 0.548571]
  - - [2, 2, 1, 8]
    - [1, 0.0114286]
  - - [4, 2, 1, 8]
    - [11, 0.022069]
  - - [6, 2, 1, 8]
    - [2, 0.0331034]
  - - [8, 2, 1, 8]
    - [8, 0.0426667]
  - - [10, 2, 1, 8]
    - [11, 0.0561404]
  - - [12, 2, 1, 8]
    - [15, 0.0698182]
  - - [14, 2, 1, 8]
    - [15, 0.0814545]
  - - [16, 2, 1, 8]
    - [15, 0.0930909]
  - - [2, 4, 1, 8]
    - [5, 0.0216949]
  - - [4, 4, 1, 8]
    - [39, 0.0419672]
  - - [6, 4, 1, 8]
    - [17, 0.0662069]
  - - [8, 4, 1, 8]
    - [15, 0.0930909]
  - - [10, 4, 1, 8]
    - [15, 0.116364]
  - - [12, 4, 1, 8]
    - [11, 0.134737]
  - - [14, 4, 1, 8]
    - [11, 0.162909]
  - - [16, 4, 1, 8]
    - [15, 0.182857]
  - - [2, 6, 1, 8]
    - [11, 0.0342857]
  - - [4, 6, 1, 8]
    - [8, 0.0673684]
  - - [6, 6, 1, 8]
    - [17, 0.102857]
  - - [8, 6, 1, 8]
    - [11, 0.139636]
  - - [10, 6, 1, 8]
    - [15, 0.174545]
  - - [12, 6, 1, 8]
    - [15, 0.213333]
  - - [14, 6, 1, 8]
    - [15, 0.24]
  - - [16, 6, 1, 8]
    - [11, 0.284444]
  - - [2, 8, 1, 8]
    - [11, 0.0457143]
  - - [4, 8, 1, 8]
    - [11, 0.0898246]
  - - [6, 8, 1, 8]
    - [17, 0.137143]
  - - [8, 8, 1, 8]
    - [40, 0.186182]
  - - [10, 8, 1, 8]
    - [15, 0.228571]
  - - [12, 8, 1, 8]
    - [11, 0.279273]
  - - [14, 8, 1, 8]
    - [15, 0.32]
  - - [16, 8, 1, 8]
    - [39, 0.365714]
  - - [2, 10, 1, 8]
    - [11, 0.0551724]
  - - [4, 10, 1, 8]
    - [17, 0.118519]
  - - [6, 10, 1, 8]
    - [8, 0.168421]
  - - [8, 10, 1, 8]
    - [15, 0.232727]
  - - [10, 10, 1, 8]
    - [2, 0.275862]
  - - [12, 10, 1, 8]
    - [2, 0.342857]
  - - [14, 10, 1, 8]
    - [15, 0.407273]
  - - [16, 10, 1, 8]
    - [14, 0.441379]
  - - [2, 12, 1, 8]
    - [8, 0.0650847]
  - - [4, 12, 1, 8]
    - [17, 0.134737]
  - - [6, 12, 1, 8]
    - [8, 0.198621]
  - - [8, 12, 1, 8]
    - [15, 0.279273]
  - - [10, 12, 1, 8]
    - [11, 0.342857]
  - - [12, 12, 1, 8]
    - [15, 0.426667]
  - - [14, 12, 1, 8]
    - [15, 0.48]
  - - [16, 12, 1, 8]
    - [15, 0.558545]
  - - [2, 14, 1, 8]
    - [8, 0.0759322]
  - - [4, 14, 1, 8]
    - [17, 0.16]
  - - [6, 14, 1, 8]
    - [0, 0.231724]
  - - [8, 14, 1, 8]
    - [14, 0.32]
  - - [10, 14, 1, 8]
    - [15, 0.392982]
  - - [12, 14, 1, 8]
    - [15, 0.488727]
  - - [14, 14, 1, 8]
    - [0, 0.531525]
  - - [16, 14, 1, 8]
    - [15, 0.651636]
  - - [2, 16, 1, 8]
    - [17, 0.0882759]
  - - [4, 16, 1, 8]
    - [8, 0.176552]
  - - [6, 16, 1, 8]
    - [1, 0.256]
  - - [8, 16, 1, 8]
    - [15, 0.365714]
  - - [10, 16, 1, 8]
    - [15, 0.457143]
  - - [12, 16, 1, 8]
    - [15, 0.548571]
  - - [14, 16, 1, 8]
    - [15, 0.651636]
  - - [16, 16, 1, 8]
    - [7, 0.731429]
  - - [2, 2, 1, 10]
    - [8, 0.0137931]
  - - [4, 2, 1, 10]
    - [40, 0.0285714]
  - - [6, 2, 1, 10]
    - [17, 0.0413793]
  - - [8, 2, 1, 10]
    - [62, 0.0551724]
  - - [10, 2, 1, 10]
    - [15, 0.0727273]
  - - [12, 2, 1, 10]
    - [15, 0.0888889]
  - - [14, 2, 1, 10]
    - [14, 0.0982456]
  - - [16, 2, 1, 10]
    - [16, 0.110345]
  - - [2, 4, 1, 10]
    - [0, 0.0271186]
  - - [4, 4, 1, 10]
    - [39, 0.0592593]
  - - [6, 4, 1, 10]
    - [5, 0.0842105]
  - - [8, 4, 1, 10]
    - [17, 0.116364]
  - - [10, 4, 1, 10]
    - [11, 0.145455]
  - - [12, 4, 1, 10]
    - [15, 0.177778]
  - - [14, 4, 1, 10]
    - [15, 0.2]
  - - [16, 4, 1, 10]
    - [15, 0.232727]
  - - [2, 6, 1, 10]
    - [17, 0.0421053]
  - - [4, 6, 1, 10]
    - [8, 0.0827586]
  - - [6, 6, 1, 10]
    - [15, 0.128571]
  - - [8, 6, 1, 10]
    - [15, 0.171429]
  - - [10, 6, 1, 10]
    - [15, 0.218182]
  - - [12, 6, 1, 10]
    - [15, 0.261818]
  - - [14, 6, 1, 10]
    - [15, 0.305455]
  - - [16, 6, 1, 10]
    - [15, 0.342857]
  - - [2, 8, 1, 10]
    - [25, 0.0533333]
  - - [4, 8, 1, 10]
    - [39, 0.114286]
  - - [6, 8, 1, 10]
    - [15, 0.168421]
  - - [8, 8, 1, 10]
    - [2, 0.209836]
  - - [10, 8, 1, 10]
    - [15, 0.285714]
  - - [12, 8, 1, 10]
    - [15, 0.342857]
  - - [14, 8, 1, 10]
    - [15, 0.407273]
  - - [16, 8, 1, 10]
    - [15, 0.465455]
  - - [2, 10, 1, 10]
    - [8, 0.0701754]
  - - [4, 10, 1, 10]
    - [17, 0.145455]
  - - [6, 10, 1, 10]
    - [17, 0.218182]
  - - [8, 10, 1, 10]
    - [14, 0.280702]
  - - [10, 10, 1, 10]
    - [9, 0.344828]
  - - [12, 10, 1, 10]
    - [15, 0.436364]
  - - [14, 10, 1, 10]
    - [15, 0.518519]
  - - [16, 10, 1, 10]
    - [11, 0.571429]
  - - [2, 12, 1, 10]
    - [17, 0.0842105]
  - - [4, 12, 1, 10]
    - [39, 0.174545]
  - - [6, 12, 1, 10]
    - [2, 0.244068]
  - - [8, 12, 1, 10]
    - [15, 0.349091]
  - - [10, 12, 1, 10]
    - [0, 0.428571]
  - - [12, 12, 1, 10]
    - [0, 0.505263]
  - - [14, 12, 1, 10]
    - [15, 0.622222]
  - - [16, 12, 1, 10]
    - [9, 0.685714]
  - - [2, 14, 1, 10]
    - [2, 0.0949153]
  - - [4, 14, 1, 10]
    - [15, 0.196491]
  - - [6, 14, 1, 10]
    - [17, 0.3]
  - - [8, 14, 1, 10]
    - [0, 0.4]
  - - [10, 14, 1, 10]
    - [17, 0.474576]
  - - [12, 14, 1, 10]
    - [11, 0.6]
  - - [14, 14, 1, 10]
    - [3, 0.687719]
  - - [16, 14, 1, 10]
    - [15, 0.814545]
  - - [2, 16, 1, 10]
    - [0, 0.110345]
  - - [4, 16, 1, 10]
    - [4, 0.228571]
  - - [6, 16, 1, 10]
    - [0, 0.331034]
  - - [8, 16, 1, 10]
    - [0, 0.449123]
  - - [10, 16, 1, 10]
    - [11, 0.561404]
  - - [12, 16, 1, 10]
    - [11, 0.685714]
  - - [14, 16, 1, 10]
    - [14, 0.785965]
  - - [16, 16, 1, 10]
    - [2, 0.898246]
  - - [2, 2, 1, 12]
    - [8, 0.0168421]
  - - [4, 2, 1, 12]
    - [8, 0.0331034]
  - - [6, 2, 1, 12]
    - [40, 0.0514286]
  - - [8, 2, 1, 12]
    - [0, 0.0662069]
  - - [10, 2, 1, 12]
    - [15, 0.0888889]
  - - [12, 2, 1, 12]
    - [15, 0.104727]
  - - [14, 2, 1, 12]
    - [8, 0.115862]
  - - [16, 2, 1, 12]
    - [15, 0.139636]
  - - [2, 4, 1, 12]
    - [15, 0.0314754]
  - - [4, 4, 1, 12]
    - [40, 0.0673684]
  - - [6, 4, 1, 12]
    - [2, 0.0976271]
  - - [8, 4, 1, 12]
    - [15, 0.139636]
  - - [10, 4, 1, 12]
    - [0, 0.174545]
  - - [12, 4, 1, 12]
    - [11, 0.205714]
  - - [14, 4, 1, 12]
    - [15, 0.248889]
  - - [16, 4, 1, 12]
    - [15, 0.274286]
  - - [2, 6, 1, 12]
    - [17, 0.0505263]
  - - [4, 6, 1, 12]
    - [39, 0.102857]
  - - [6, 6, 1, 12]
    - [40, 0.151579]
  - - [8, 6, 1, 12]
    - [15, 0.209455]
  - - [10, 6, 1, 12]
    - [17, 0.257143]
  - - [12, 6, 1, 12]
    - [0, 0.292881]
  - - [14, 6, 1, 12]
    - [11, 0.347586]
  - - [16, 6, 1, 12]
    - [3, 0.390508]
  - - [2, 8, 1, 12]
    - [40, 0.0685714]
  - - [4, 8, 1, 12]
    - [39, 0.139636]
  - - [6, 8, 1, 12]
    - [17, 0.205714]
  - - [8, 8, 1, 12]
    - [14, 0.269474]
  - - [10, 8, 1, 12]
    - [15, 0.342857]
  - - [12, 8, 1, 12]
    - [17, 0.404211]
  - - [14, 8, 1, 12]
    - [11, 0.48]
  - - [16, 8, 1, 12]
    - [11, 0.529655]
  - - [2, 10, 1, 12]
    - [17, 0.0872727]
  - - [4, 10, 1, 12]
    - [17, 0.174545]
  - - [6, 10, 1, 12]
    - [15, 0.257143]
  - - [8, 10, 1, 12]
    - [10, 0.342857]
  - - [10, 10, 1, 12]
    - [15, 0.444444]
  - - [12, 10, 1, 12]
    - [15, 0.533333]
  - - [14, 10, 1, 12]
    - [15, 0.610909]
  - - [16, 10, 1, 12]
    - [152, 0.650847]
  - - [2, 12, 1, 12]
    - [11, 0.101053]
  - - [4, 12, 1, 12]
    - [2, 0.195254]
  - - [6, 12, 1, 12]
    - [11, 0.303158]
  - - [8, 12, 1, 12]
    - [15, 0.411429]
  - - [10, 12, 1, 12]
    - [17, 0.514286]
  - - [12, 12, 1, 12]
    - [15, 0.628364]
  - - [14, 12, 1, 12]
    - [15, 0.733091]
  - - [16, 12, 1, 12]
    - [17, 0.822857]
  - - [2, 14, 1, 12]
    - [17, 0.12]
  - - [4, 14, 1, 12]
    - [5, 0.224]
  - - [6, 14, 1, 12]
    - [17, 0.36]
  - - [8, 14, 1, 12]
    - [6, 0.463448]
  - - [10, 14, 1, 12]
    - [6, 0.533333]
  - - [12, 14, 1, 12]
    - [17, 1.00489]
  - - [14, 14, 1, 12]
    - [8, 0.825263]
  - - [16, 14, 1, 12]
    - [17, 0.943158]
  - - [2, 16, 1, 12]
    - [11, 0.139636]
  - - [4, 16, 1, 12]
    - [11, 0.274286]
  - - [6, 16, 1, 12]
    - [8, 0.411429]
  - - [8, 16, 1, 12]
    - [15, 0.558545]
  - - [10, 16, 1, 12]
    - [15, 0.685714]
  - - [12, 16, 1, 12]
    - [15, 0.837818]
  - - [14, 16, 1, 12]
    - [11, 0.943158]
  - - [16, 16, 1, 12]
    - [151, 1.09714]
  - - [2, 2, 1, 14]
    - [17, 0.02]
  - - [4, 2, 1, 14]
    - [39, 0.0407273]
  - - [6, 2, 1, 14]
    - [11, 0.057931]
  - - [8, 2, 1, 14]
    - [15, 0.0785965]
  - - [10, 2, 1, 14]
    - [15, 0.1]
  - - [12, 2, 1, 14]
    - [15, 0.113898]
  - - [14, 2, 1, 14]
    - [15, 0.14]
  - - [16, 2, 1, 14]
    - [0, 0.157193]
  - - [2, 4, 1, 14]
    - [40, 0.0407273]
  - - [4, 4, 1, 14]
    - [11, 0.08]
  - - [6, 4, 1, 14]
    - [3, 0.113898]
  - - [8, 4, 1, 14]
    - [15, 0.162909]
  - - [10, 4, 1, 14]
    - [40, 0.189831]
  - - [12, 4, 1, 14]
    - [10, 0.231724]
  - - [14, 4, 1, 14]
    - [15, 0.285091]
  - - [16, 4, 1, 14]
    - [65, 0.325818]
  - - [2, 6, 1, 14]
    - [8, 0.0541935]
  - - [4, 6, 1, 14]
    - [0, 0.122182]
  - - [6, 6, 1, 14]
    - [39, 0.18]
  - - [8, 6, 1, 14]
    - [152, 0.231724]
  - - [10, 6, 1, 14]
    - [15, 0.3]
  - - [12, 6, 1, 14]
    - [15, 0.353684]
  - - [14, 6, 1, 14]
    - [15, 0.42]
  - - [16, 6, 1, 14]
    - [15, 0.488727]
  - - [2, 8, 1, 14]
    - [17, 0.08]
  - - [4, 8, 1, 14]
    - [39, 0.165926]
  - - [6, 8, 1, 14]
    - [0, 0.231724]
  - - [8, 8, 1, 14]
    - [8, 0.325818]
  - - [10, 8, 1, 14]
    - [15, 0.4]
  - - [12, 8, 1, 14]
    - [8, 0.48]
  - - [14, 8, 1, 14]
    - [15, 0.570182]
  - - [16, 8, 1, 14]
    - [15, 0.651636]
  - - [2, 10, 1, 14]
    - [2, 0.0982456]
  - - [4, 10, 1, 14]
    - [15, 0.2]
  - - [6, 10, 1, 14]
    - [11, 0.305455]
  - - [8, 10, 1, 14]
    - [0, 0.4]
  - - [10, 10, 1, 14]
    - [15, 0.518519]
  - - [12, 10, 1, 14]
    - [2, 0.610909]
  - - [14, 10, 1, 14]
    - [80, 0.675862]
  - - [16, 10, 1, 14]
    - [11, 0.814545]
  - - [2, 12, 1, 14]
    - [0, 0.122182]
  - - [4, 12, 1, 14]
    - [0, 0.235789]
  - - [6, 12, 1, 14]
    - [15, 0.330492]
  - - [8, 12, 1, 14]
    - [7, 0.497778]
  - - [10, 12, 1, 14]
    - [11, 0.6]
  - - [12, 12, 1, 14]
    - [40, 0.695172]
  - - [14, 12, 1, 14]
    - [2, 0.84]
  - - [16, 12, 1, 14]
    - [17, 0.96]
  - - [2, 14, 1, 14]
    - [8, 0.142545]
  - - [4, 14, 1, 14]
    - [11, 0.28]
  - - [6, 14, 1, 14]
    - [2, 0.427636]
  - - [8, 14, 1, 14]
    - [11, 0.550175]
  - - [10, 14, 1, 14]
    - [15, 0.712727]
  - - [12, 14, 1, 14]
    - [2, 0.84]
  - - [14, 14, 1, 14]
    - [11, 0.8575]
  - - [16, 14, 1, 14]
    - [11, 1.14036]
  - - [2, 16, 1, 14]
    - [5, 0.16]
  - - [4, 16, 1, 14]
    - [17, 0.325818]
  - - [6, 16, 1, 14]
    - [2, 0.471579]
  - - [8, 16, 1, 14]
    - [2, 0.651636]
  - - [10, 16, 1, 14]
    - [3, 0.772414]
  - - [12, 16, 1, 14]
    - [11, 0.995556]
  - - [14, 16, 1, 14]
    - [2, 1.08138]
  - - [16, 16, 1, 14]
    - [11, 1.32741]
  - - [2, 2, 1, 16]
    - [0, 0.022069]
  - - [4, 2, 1, 16]
    - [2, 0.0457143]
  - - [6, 2, 1, 16]
    - [15, 0.0673684]
  - - [8, 2, 1, 16]
    - [14, 0.0930909]
  - - [10, 2, 1, 16]
    - [15, 0.114286]
  - - [12, 2, 1, 16]
    - [0, 0.139636]
  - - [14, 2, 1, 16]
    - [11, 0.165926]
  - - [16, 2, 1, 16]
    - [62, 0.179649]
  - - [2, 4, 1, 16]
    - [17, 0.0457143]
  - - [4, 4, 1, 16]
    - [2, 0.0948148]
  - - [6, 4, 1, 16]
    - [4, 0.137143]
  - - [8, 4, 1, 16]
    - [11, 0.18963]
  - - [10, 4, 1, 16]
    - [17, 0.232727]
  - - [12, 4, 1, 16]
    - [11, 0.274286]
  - - [14, 4, 1, 16]
    - [11, 0.325818]
  - - [16, 4, 1, 16]
    - [7, 0.347119]
  - - [2, 6, 1, 16]
    - [40, 0.0698182]
  - - [4, 6, 1, 16]
    - [40, 0.137143]
  - - [6, 6, 1, 16]
    - [40, 0.195254]
  - - [8, 6, 1, 16]
    - [135, 0.274286]
  - - [10, 6, 1, 16]
    - [145, 0.336842]
  - - [12, 6, 1, 16]
    - [17, 0.418909]
  - - [14, 6, 1, 16]
    - [145, 0.488727]
  - - [16, 6, 1, 16]
    - [10, 0.558545]
  - - [2, 8, 1, 16]
    - [2, 0.0898246]
  - - [4, 8, 1, 16]
    - [1, 0.173559]
  - - [6, 8, 1, 16]
    - [11, 0.274286]
  - - [8, 8, 1, 16]
    - [2, 0.347119]
  - - [10, 8, 1, 16]
    - [15, 0.474074]
  - - [12, 8, 1, 16]
    - [65, 0.538947]
  - - [14, 8, 1, 16]
    - [15, 0.651636]
  - - [16, 8, 1, 16]
    - [145, 0.744727]
  - - [2, 10, 1, 16]
    - [8, 0.114286]
  - - [4, 10, 1, 16]
    - [2, 0.22069]
  - - [6, 10, 1, 16]
    - [0, 0.349091]
  - - [8, 10, 1, 16]
    - [15, 0.465455]
  - - [10, 10, 1, 16]
    - [17, 0.571429]
  - - [12, 10, 1, 16]
    - [2, 0.673684]
  - - [14, 10, 1, 16]
    - [145, 0.785965]
  - - [16, 10, 1, 16]
    - [15, 0.898246]
  - - [2, 12, 1, 16]
    - [17, 0.142222]
  - - [4, 12, 1, 16]
    - [15, 0.284444]
  - - [6, 12, 1, 16]
    - [15, 0.426667]
  - - [8, 12, 1, 16]
    - [15, 0.568889]
  - - [10, 12, 1, 16]
    - [10, 0.685714]
  - - [12, 12, 1, 16]
    - [2, 0.837818]
  - - [14, 12, 1, 16]
    - [17, 0.867097]
  - - [16, 12, 1, 16]
    - [5, 1.04136]
  - - [2, 14, 1, 16]
    - [15, 0.157193]
  - - [4, 14, 1, 16]
    - [2, 0.308966]
  - - [6, 14, 1, 16]
    - [11, 0.48]
  - - [8, 14, 1, 16]
    - [17, 0.64]
  - - [10, 14, 1, 16]
    - [11, 0.814545]
  - - [12, 14, 1, 16]
    - [2, 0.926897]
  - - [14, 14, 1, 16]
    - [17, 1.14036]
  - - [16, 14, 1, 16]
    - [5, 1.23586]
  - - [2, 16, 1, 16]
    - [0, 0.179649]
  - - [4, 16, 1, 16]
    - [0, 0.365714]
  - - [6, 16, 1, 16]
    - [3, 0.512]
  - - [8, 16, 1, 16]
    - [11, 0.731429]
  - - [10, 16, 1, 16]
    - [15, 0.930909]
  - - [12, 16, 1, 16]
    - [63, 0.990968]
  - - [14, 16, 1, 16]
    - [11, 1.28]
  - - [16, 16, 1, 16]
    - [147, 1.43719]
  - - [2, 2, 1, 1024]
    - [0, 0.890435]
  - - [4, 2, 1, 1024]
    - [5, 1.79613]
  - - [6, 2, 1, 1024]
    - [5, 2.6738]
  - - [8, 2, 1, 1024]
    - [153, 4.70731]
  - - [10, 2, 1, 1024]
    - [153, 5.72538]
  - - [12, 2, 1, 1024]
    - [153, 6.85774]
  - - [14, 2, 1, 1024]
    - [153, 7.98599]
  - - [16, 2, 1, 1024]
    - [153, 9.31485]
  - - [2, 4, 1, 1024]
    - [5, 1.78939]
  - - [4, 4, 1, 1024]
    - [0, 3.48596]
  - - [6, 4, 1, 1024]
    - [5, 5.34346]
  - - [8, 4, 1, 1024]
    - [153, 9.38754]
  - - [10, 4, 1, 1024]
    - [153, 11.4286]
  - - [12, 4, 1, 1024]
    - [153, 13.7094]
  - - [14, 4, 1, 1024]
    - [153, 15.9555]
  - - [16, 4, 1, 1024]
    - [153, 18.6122]
  - - [2, 6, 1, 1024]
    - [5, 2.67998]
  - - [4, 6, 1, 1024]
    - [5, 5.35104]
  - - [6, 6, 1, 1024]
    - [5, 7.98527]
  - - [8, 6, 1, 1024]
    - [153, 14.0672]
  - - [10, 6, 1, 1024]
    - [153, 17.1172]
  - - [12, 6, 1, 1024]
    - [153, 20.5103]
  - - [14, 6, 1, 1024]
    - [153, 23.8662]
  - - [16, 6, 1, 1024]
    - [153, 27.9147]
  - - [2, 8, 1, 1024]
    - [5, 3.5716]
  - - [4, 8, 1, 1024]
    - [5, 7.13336]
  - - [6, 8, 1, 1024]
    - [5, 10.6681]
  - - [8, 8, 1, 1024]
    - [153, 18.7403]
  - - [10, 8, 1, 1024]
    - [153, 22.7606]
  - - [12, 8, 1, 1024]
    - [153, 27.2683]
  - - [14, 8, 1, 1024]
    - [153, 31.7851]
  - - [16, 8, 1, 1024]
    - [153, 37.0994]
  - - [2, 10, 1, 1024]
    - [5, 4.40875]
  - - [4, 10, 1, 1024]
    - [5, 8.81358]
  - - [6, 10, 1, 1024]
    - [4, 13.2142]
  - - [8, 10, 1, 1024]
    - [153, 23.2902]
  - - [10, 10, 1, 1024]
    - [153, 28.2935]
  - - [12, 10, 1, 1024]
    - [153, 33.9702]
  - - [14, 10, 1, 1024]
    - [153, 39.5966]
  - - [16, 10, 1, 1024]
    - [64, 42.5558]
  - - [2, 12, 1, 1024]
    - [5, 5.28139]
  - - [4, 12, 1, 1024]
    - [5, 10.5574]
  - - [6, 12, 1, 1024]
    - [5, 15.8114]
  - - [8, 12, 1, 1024]
    - [18, 25.2062]
  - - [10, 12, 1, 1024]
    - [153, 33.8003]
  - - [12, 12, 1, 1024]
    - [153, 40.5134]
  - - [14, 12, 1, 1024]
    - [153, 47.2652]
  - - [16, 12, 1, 1024]
    - [7, 42.7409]
  - - [2, 14, 1, 1024]
    - [5, 6.14884]
  - - [4, 14, 1, 1024]
    - [5, 12.2936]
  - - [6, 14, 1, 1024]
    - [4, 18.4032]
  - - [8, 14, 1, 1024]
    - [153, 32.2303]
  - - [10, 14, 1, 1024]
    - [153, 39.2035]
  - - [12, 14, 1, 1024]
    - [153, 47.082]
  - - [14, 14, 1, 1024]
    - [153, 54.6866]
  - - [16, 14, 1, 1024]
    - [153, 64.04]
  - - [2, 16, 1, 1024]
    - [5, 6.99713]
  - - [4, 16, 1, 1024]
    - [5, 13.994]
  - - [6, 16, 1, 1024]
    - [15, 20.2689]
  - - [8, 16, 1, 1024]
    - [153, 36.7059]
  - - [10, 16, 1, 1024]
    - [64, 43.6907]
  - - [12, 16, 1, 1024]
    - [64, 51.7389]
  - - [14, 16, 1, 1024]
    - [18, 61.1669]
  - - [16, 16, 1, 1024]
    - [153, 74.5422]
  - - [2, 2, 1, 2048]
    - [52, 1.22269]
  - - [4, 2, 1, 2048]
    - [52, 2.47379]
  - - [6, 2, 1, 2048]
    - [52, 3.69177]
  - - [8, 2, 1, 2048]
    - [64, 7.84025]
  - - [10, 2, 1, 2048]
    - [64, 9.53982]
  - - [12, 2, 1, 2048]
    - [64, 11.5652]
  - - [14, 2, 1, 2048]
    - [64, 13.4927]
  - - [16, 2, 1, 2048]
    - [64, 15.451]
  - - [2, 4, 1, 2048]
    - [52, 2.46711]
  - - [4, 4, 1, 2048]
    - [52, 4.912]
  - - [6, 4, 1, 2048]
    - [52, 7.34937]
  - - [8, 4, 1, 2048]
    - [64, 15.3706]
  - - [10, 4, 1, 2048]
    - [64, 18.7927]
  - - [12, 4, 1, 2048]
    - [64, 22.4798]
  - - [14, 4, 1, 2048]
    - [64, 26.0561]
  - - [16, 4, 1, 2048]
    - [64, 31.9688]
  - - [2, 6, 1, 2048]
    - [52, 3.66968]
  - - [4, 6, 1, 2048]
    - [52, 7.32923]
  - - [6, 6, 1, 2048]
    - [52, 10.9496]
  - - [8, 6, 1, 2048]
    - [64, 23.0358]
  - - [10, 6, 1, 2048]
    - [64, 28.5844]
  - - [12, 6, 1, 2048]
    - [64, 35.1086]
  - - [14, 6, 1, 2048]
    - [64, 38.9913]
  - - [16, 6, 1, 2048]
    - [18, 49.152]
  - - [2, 8, 1, 2048]
    - [52, 4.87115]
  - - [4, 8, 1, 2048]
    - [52, 9.73367]
  - - [6, 8, 1, 2048]
    - [52, 14.5866]
  - - [8, 8, 1, 2048]
    - [64, 30.2268]
  - - [10, 8, 1, 2048]
    - [64, 37.0729]
  - - [12, 8, 1, 2048]
    - [64, 46.8114]
  - - [14, 8, 1, 2048]
    - [64, 51.3206]
  - - [16, 8, 1, 2048]
    - [64, 59.6355]
  - - [2, 10, 1, 2048]
    - [52, 6.07145]
  - - [4, 10, 1, 2048]
    - [52, 12.1276]
  - - [6, 10, 1, 2048]
    - [52, 18.1871]
  - - [8, 10, 1, 2048]
    - [64, 39.0095]
  - - [10, 10, 1, 2048]
    - [64, 48.7619]
  - - [12, 10, 1, 2048]
    - [64, 54.9518]
  - - [14, 10, 1, 2048]
    - [64, 63.5521]
  - - [16, 10, 1, 2048]
    - [64, 79.922]
  - - [2, 12, 1, 2048]
    - [52, 7.2529]
  - - [4, 12, 1, 2048]
    - [52, 14.5205]
  - - [6, 12, 1, 2048]
    - [52, 20.6232]
  - - [8, 12, 1, 2048]
    - [64, 44.5295]
  - - [10, 12, 1, 2048]
    - [64, 57.8259]
  - - [12, 12, 1, 2048]
    - [64, 63.7608]
  - - [14, 12, 1, 2048]
    - [64, 81.92]
  - - [16, 12, 1, 2048]
    - [18, 95.9063]
  - - [2, 14, 1, 2048]
    - [52, 7.96444]
  - - [4, 14, 1, 2048]
    - [52, 17.2463]
  - - [6, 14, 1, 2048]
    - [52, 25.2282]
  - - [8, 14, 1, 2048]
    - [64, 51.6669]
  - - [10, 14, 1, 2048]
    - [64, 65.9126]
  - - [12, 14, 1, 2048]
    - [64, 80.9562]
  - - [14, 14, 1, 2048]
    - [64, 93.3507]
  - - [16, 14, 1, 2048]
    - [64, 110.543]
  - - [2, 16, 1, 2048]
    - [52, 9.60439]
  - - [4, 16, 1, 2048]
    - [52, 19.1919]
  - - [6, 16, 1, 2048]
    - [52, 28.7519]
  - - [8, 16, 1, 2048]
    - [64, 58.4109]
  - - [10, 16, 1, 2048]
    - [12, 78.019]
  - - [12, 16, 1, 2048]
    - [12, 92.5214]
  - - [14, 16, 1, 2048]
    - [12, 109.227]
  - - [16, 16, 1, 2048]
    - [64, 110.162]
  - - [2, 2, 1, 4096]
    - [52, 1.62888]
  - - [4, 2, 1, 4096]
    - [52, 3.25122]
  - - [6, 2, 1, 4096]
    - [52, 4.85824]
  - - [8, 2, 1, 4096]
    - [64, 12.1603]
  - - [10, 2, 1, 4096]
    - [64, 15.7538]
  - - [12, 2, 1, 4096]
    - [64, 17.7207]
  - - [14, 2, 1, 4096]
    - [64, 20.5184]
  - - [16, 2, 1, 4096]
    - [64, 25.7004]
  - - [2, 4, 1, 4096]
    - [52, 3.06243]
  - - [4, 4, 1, 4096]
    - [52, 6.44591]
  - - [6, 4, 1, 4096]
    - [52, 9.7047]
  - - [8, 4, 1, 4096]
    - [64, 24.0789]
  - - [10, 4, 1, 4096]
    - [64, 31.8136]
  - - [12, 4, 1, 4096]
    - [64, 35.1511]
  - - [14, 4, 1, 4096]
    - [64, 44.539]
  - - [16, 4, 1, 4096]
    - [64, 50.9017]
  - - [2, 6, 1, 4096]
    - [52, 4.84671]
  - - [4, 6, 1, 4096]
    - [52, 9.67236]
  - - [6, 6, 1, 4096]
    - [52, 14.4145]
  - - [8, 6, 1, 4096]
    - [64, 35.8235]
  - - [10, 6, 1, 4096]
    - [64, 43.7509]
  - - [12, 6, 1, 4096]
    - [64, 52.0628]
  - - [14, 6, 1, 4096]
    - [64, 60.4141]
  - - [16, 6, 1, 4096]
    - [64, 69.9076]
  - - [2, 8, 1, 4096]
    - [52, 6.09637]
  - - [4, 8, 1, 4096]
    - [52, 12.5428]
  - - [6, 8, 1, 4096]
    - [52, 18.0374]
  - - [8, 8, 1, 4096]
    - [64, 51.4008]
  - - [10, 8, 1, 4096]
    - [64, 63.0154]
  - - [12, 8, 1, 4096]
    - [64, 75.6185]
  - - [14, 8, 1, 4096]
    - [64, 88.2215]
  - - [16, 8, 1, 4096]
    - [64, 101.803]
  - - [2, 10, 1, 4096]
    - [52, 8.02185]
  - - [4, 10, 1, 4096]
    - [52, 15.1005]
  - - [6, 10, 1, 4096]
    - [52, 22.6507]
  - - [8, 10, 1, 4096]
    - [64, 64.8871]
  - - [10, 10, 1, 4096]
    - [64, 69.9021]
  - - [12, 10, 1, 4096]
    - [64, 94.5231]
  - - [14, 10, 1, 4096]
    - [64, 97.6986]
  - - [16, 10, 1, 4096]
    - [64, 128.502]
  - - [2, 12, 1, 4096]
    - [52, 9.10222]
  - - [4, 12, 1, 4096]
    - [52, 18.1206]
  - - [6, 12, 1, 4096]
    - [52, 27.1808]
  - - [8, 12, 1, 4096]
    - [64, 68.8787]
  - - [10, 12, 1, 4096]
    - [64, 95.4408]
  - - [12, 12, 1, 4096]
    - [64, 113.428]
  - - [14, 12, 1, 4096]
    - [64, 132.332]
  - - [16, 12, 1, 4096]
    - [64, 154.202]
  - - [2, 14, 1, 4096]
    - [52, 11.1443]
  - - [4, 14, 1, 4096]
    - [52, 22.2765]
  - - [6, 14, 1, 4096]
    - [52, 33.3344]
  - - [8, 14, 1, 4096]
    - [64, 90.842]
  - - [10, 14, 1, 4096]
    - [64, 111.348]
  - - [12, 14, 1, 4096]
    - [64, 132.332]
  - - [14, 14, 1, 4096]
    - [64, 154.388]
  - - [16, 14, 1, 4096]
    - [64, 178.156]
  - - [2, 16, 1, 4096]
    - [52, 12.7056]
  - - [4, 16, 1, 4096]
    - [52, 25.3927]
  - - [6, 16, 1, 4096]
    - [52, 38.0261]
  - - [8, 16, 1, 4096]
    - [64, 89.4422]
  - - [10, 16, 1, 4096]
    - [18, 129.774]
  - - [12, 16, 1, 4096]
    - [64, 152.705]
  - - [14, 16, 1, 4096]
    - [64, 174.763]
  - - [16, 16, 1, 4096]
    - [12, 195.996]
  - - [64, 4096, 1, 64]
    - [32, 3286.92]
  - - [320, 4096, 1, 64]
    - [109, 8648.05]
  - - [64, 4096, 1, 256]
    - [43, 7157.06]
  - - [4096, 64, 1, 64]
    - [156, 3195.55]
  - - [4096, 320, 1, 64]
    - [107, 8648.05]
  - - [4096, 64, 1, 256]
    - [156, 7270.85]
  - - [64, 64, 1, 8192]
    - [64, 4534.38]
  - - [64, 128, 1, 8192]
    - [64, 6744.61]
  - - [64, 8192, 1, 64]
    - [134, 4564.1]
  - - [64, 8192, 1, 128]
    - [118, 6367.08]
  - - [128, 64, 1, 8192]
    - [64, 6677.5]
  - - [128, 8192, 1, 64]
    - [128, 6243.99]
  - - [8192, 64, 1, 64]
    - [134, 4266.4]
  - - [8192, 64, 1, 128]
    - [156, 5872.51]
  - - [8192, 128, 1, 64]
    - [107, 5472.11]
  - - [64, 1, 1, 64]
    - [4, 1.67184]
  - - [64, 16, 1, 64]
    - [147, 30.4819]
  - - [64, 32, 1, 64]
    - [14, 58.2542]
  - - [1, 1, 1, 64]
    - [5, 0.022069]
  - - [16, 1, 1, 64]
    - [14, 0.359298]
  - - [32, 1, 1, 64]
    - [146, 0.910222]
  - - [64, 1, 1, 1]
    - [0, 0.0278261]
  - - [64, 1, 1, 16]
    - [15, 0.393846]
  - - [64, 1, 1, 32]
    - [151, 0.910222]
  - - [1, 16, 1, 64]
    - [17, 0.353103]
  - - [16, 16, 1, 64]
    - [147, 8.11932]
  - - [32, 16, 1, 64]
    - [147, 13.6533]
  - - [64, 16, 1, 1]
    - [145, 0.465455]
  - - [64, 16, 1, 16]
    - [6, 8.13627]
  - - [64, 16, 1, 32]
    - [2, 14.247]
  - - [1, 32, 1, 64]
    - [2, 0.682667]
  - - [16, 32, 1, 64]
    - [154, 14.8945]
  - - [32, 32, 1, 64]
    - [80, 30.4819]
  - - [64, 32, 1, 1]
    - [15, 0.930909]
  - - [64, 32, 1, 16]
    - [141, 14.8945]
  - - [64, 32, 1, 32]
    - [9, 28.4939]
  - - [1, 1, 1, 1]
    - [5, 0.000344828]
  - - [1, 1, 1, 16]
    - [5, 0.00561404]
  - - [1, 1, 1, 32]
    - [2, 0.0110345]
  - - [16, 1, 1, 1]
    - [17, 0.00592593]
  - - [16, 1, 1, 16]
    - [15, 0.0948148]
  - - [16, 1, 1, 32]
    - [0, 0.182857]
  - - [32, 1, 1, 1]
    - [40, 0.013617]
  - - [32, 1, 1, 16]
    - [151, 0.222609]
  - - [32, 1, 1, 32]
    - [39, 0.455111]
  - - [1, 16, 1, 1]
    - [2, 0.00561404]
  - - [1, 16, 1, 16]
    - [15, 0.0914286]
  - - [1, 16, 1, 32]
    - [11, 0.179649]
  - - [16, 16, 1, 1]
    - [11, 0.0914286]
  - - [16, 16, 1, 16]
    - [143, 1.46286]
  - - [16, 16, 1, 32]
    - [15, 3.09132]
  - - [32, 16, 1, 1]
    - [2, 0.213333]
  - - [32, 16, 1, 16]
    - [146, 4.07728]
  - - [32, 16, 1, 32]
    - [2, 6.5536]
  - - [1, 32, 1, 1]
    - [3, 0.0130612]
  - - [1, 32, 1, 16]
    - [3, 0.222609]
  - - [1, 32, 1, 32]
    - [3, 0.4096]
  - - [16, 32, 1, 1]
    - [154, 0.232727]
  - - [16, 32, 1, 16]
    - [152, 3.56174]
  - - [16, 32, 1, 32]
    - [10, 7.62047]
  - - [32, 32, 1, 1]
    - [5, 0.426667]
  - - [32, 32, 1, 16]
    - [145, 7.62047]
  - - [32, 32, 1, 32]
    - [150, 14.8945]
  - - [1, 64, 1, 64]
    - [8, 1.78087]
  - - [16, 64, 1, 64]
    - [146, 29.7891]
  - - [32, 64, 1, 64]
    - [151, 65.277]
  - - [1, 64, 1, 1]
    - [3, 0.0261224]
  - - [1, 64, 1, 16]
    - [3, 0.426667]
  - - [1, 64, 1, 32]
    - [15, 0.890435]
  - - [16, 64, 1, 1]
    - [65, 0.426667]
  - - [16, 64, 1, 16]
    - [7, 7.28178]
  - - [16, 64, 1, 32]
    - [14, 14.8945]
  - - [32, 64, 1, 1]
    - [16, 0.930909]
  - - [32, 64, 1, 16]
    - [145, 15.2409]
  - - [32, 64, 1, 32]
    - [14, 30.4819]
  - - [64, 64, 1, 1]
    - [15, 1.86182]
  - - [64, 64, 1, 16]
    - [145, 30.4819]
  - - [64, 64, 1, 32]
    - [7, 60.9637]
  - - [256, 1, 1, 256]
    - [129, 25.8186]
  - - [256, 16, 1, 256]
    - [153, 420.323]
  - - [256, 32, 1, 256]
    - [129, 823.978]
  - - [1, 1, 1, 256]
    - [15, 0.0775758]
  - - [16, 1, 1, 256]
    - [153, 1.79049]
  - - [32, 1, 1, 256]
    - [129, 3.2768]
  - - [256, 1, 1, 1]
    - [16, 0.113778]
  - - [256, 1, 1, 16]
    - [145, 1.86182]
  - - [256, 1, 1, 32]
    - [16, 3.72364]
  - - [1, 16, 1, 256]
    - [4, 1.61554]
  - - [16, 16, 1, 256]
    - [153, 29.0591]
  - - [32, 16, 1, 256]
    - [129, 52.4288]
  - - [256, 16, 1, 1]
    - [62, 1.86182]
  - - [256, 16, 1, 16]
    - [145, 32.6161]
  - - [256, 16, 1, 32]
    - [80, 60.9637]
  - - [1, 32, 1, 256]
    - [4, 3.20371]
  - - [16, 32, 1, 256]
    - [129, 53.4988]
  - - [32, 32, 1, 256]
    - [129, 109.227]
  - - [256, 32, 1, 1]
    - [3, 3.21255]
  - - [256, 32, 1, 16]
    - [145, 60.9637]
  - - [256, 32, 1, 32]
    - [10, 121.927]
  - - [1, 256, 1, 256]
    - [4, 25.4305]
  - - [16, 256, 1, 256]
    - [129, 427.99]
  - - [32, 256, 1, 256]
    - [129, 862.899]
  - - [1, 256, 1, 1]
    - [40, 0.113778]
  - - [1, 256, 1, 16]
    - [40, 1.74298]
  - - [1, 256, 1, 32]
    - [40, 3.64089]
  - - [16, 256, 1, 1]
    - [151, 1.86182]
  - - [16, 256, 1, 16]
    - [15, 29.7891]
  - - [16, 256, 1, 32]
    - [1, 53.4988]
  - - [32, 256, 1, 1]
    - [138, 3.72364]
  - - [32, 256, 1, 16]
    - [145, 60.9637]
  - - [32, 256, 1, 32]
    - [15, 124.83]
  - - [256, 256, 1, 1]
    - [20, 26.7494]
  - - [256, 256, 1, 16]
    - [145, 466.174]
  - - [256, 256, 1, 32]
    - [103, 936.967]
  - - [512, 1, 1, 512]
    - [140, 79.6658]
  - - [512, 16, 1, 512]
    - [140, 1287.95]
  - - [512, 32, 1, 512]
    - [140, 2515.79]
  - - [1, 1, 1, 512]
    - [15, 0.132987]
  - - [16, 1, 1, 512]
    - [153, 3.03513]
  - - [32, 1, 1, 512]
    - [129, 5.74877]
  - - [512, 1, 1, 1]
    - [143, 0.217872]
  - - [512, 1, 1, 16]
    - [16, 3.64089]
  - - [512, 1, 1, 32]
    - [7, 8.05544]
  - - [1, 16, 1, 512]
    - [4, 2.53615]
  - - [16, 16, 1, 512]
    - [153, 49.2818]
  - - [32, 16, 1, 512]
    - [129, 91.9804]
  - - [512, 16, 1, 1]
    - [6, 4.0196]
  - - [512, 16, 1, 16]
    - [145, 59.5782]
  - - [512, 16, 1, 32]
    - [150, 111.551]
  - - [1, 32, 1, 512]
    - [4, 4.98498]
  - - [16, 32, 1, 512]
    - [153, 97.1567]
  - - [32, 32, 1, 512]
    - [129, 190.65]
  - - [512, 32, 1, 1]
    - [14, 7.62047]
  - - [512, 32, 1, 16]
    - [145, 129.104]
  - - [512, 32, 1, 32]
    - [16, 243.855]
  - - [1, 512, 1, 512]
    - [5, 77.0845]
  - - [16, 512, 1, 512]
    - [70, 1206.88]
  - - [32, 512, 1, 512]
    - [65, 2406.37]
  - - [1, 512, 1, 1]
    - [40, 0.213333]
  - - [1, 512, 1, 16]
    - [17, 3.64089]
  - - [1, 512, 1, 32]
    - [17, 7.44727]
  - - [16, 512, 1, 1]
    - [4, 3.2768]
  - - [16, 512, 1, 16]
    - [147, 59.5782]
  - - [16, 512, 1, 32]
    - [17, 119.156]
  - - [32, 512, 1, 1]
    - [145, 8.03206]
  - - [32, 512, 1, 16]
    - [145, 121.927]
  - - [32, 512, 1, 32]
    - [40, 233.017]
  - - [512, 512, 1, 1]
    - [131, 73.8434]
  - - [512, 512, 1, 16]
    - [156, 1290.56]
  - - [512, 512, 1, 32]
    - [131, 2482.72]
  - - [1024, 1, 1, 1024]
    - [113, 162.339]
  - - [1024, 16, 1, 1024]
    - [113, 2577.29]
  - - [1024, 32, 1, 1024]
    - [81, 4850.68]
  - - [1, 1, 1, 1024]
    - [15, 0.20898]
  - - [16, 1, 1, 1024]
    - [153, 4.66735]
  - - [32, 1, 1, 1024]
    - [153, 9.35834]
  - - [1024, 1, 1, 1]
    - [145, 0.476279]
  - - [1024, 1, 1, 16]
    - [145, 7.92433]
  - - [1024, 1, 1, 32]
    - [10, 14.8945]
  - - [1, 16, 1, 1024]
    - [4, 3.48297]
  - - [16, 16, 1, 1024]
    - [153, 74.5422]
  - - [32, 16, 1, 1024]
    - [153, 149.847]
  - - [1024, 16, 1, 1]
    - [145, 7.44727]
  - - [1024, 16, 1, 16]
    - [150, 104.858]
  - - [1024, 16, 1, 32]
    - [80, 238.313]
  - - [1, 32, 1, 1024]
    - [4, 6.8375]
  - - [16, 32, 1, 1024]
    - [153, 144.941]
  - - [32, 32, 1, 1024]
    - [153, 288.231]
  - - [1024, 32, 1, 1]
    - [9, 13.1072]
  - - [1024, 32, 1, 16]
    - [145, 233.017]
  - - [1024, 32, 1, 32]
    - [80, 493.304]
  - - [1, 1024, 1, 1024]
    - [5, 159.532]
  - - [16, 1024, 1, 1024]
    - [70, 2502.88]
  - - [32, 1024, 1, 1024]
    - [70, 4597.91]
  - - [1, 1024, 1, 1]
    - [5, 0.435745]
  - - [1, 1024, 1, 16]
    - [5, 7.12348]
  - - [1, 1024, 1, 32]
    - [40, 14.247]
  - - [16, 1024, 1, 1]
    - [39, 7.12348]
  - - [16, 1024, 1, 16]
    - [40, 130.192]
  - - [16, 1024, 1, 32]
    - [2, 190.65]
  - - [32, 1024, 1, 1]
    - [15, 16.0813]
  - - [32, 1024, 1, 16]
    - [145, 260.941]
  - - [32, 1024, 1, 32]
    - [80, 466.034]
  - - [1024, 1024, 1, 1]
    - [98, 153.077]
  - - [1024, 1024, 1, 16]
    - [98, 2413.99]
  - - [1024, 1024, 1, 32]
    - [98, 4230.02]
  - - [2048, 1, 1, 2048]
    - [103, 218.149]
  - - [2048, 16, 1, 2048]
    - [103, 3452.13]
  - - [1, 1, 1, 2048]
    - [52, 0.290496]
  - - [16, 1, 1, 2048]
    - [64, 7.78389]
  - - [32, 1, 1, 2048]
    - [64, 15.1211]
  - - [2048, 1, 1, 1]
    - [7, 0.871489]
  - - [2048, 1, 1, 16]
    - [145, 14.9789]
  - - [2048, 1, 1, 32]
    - [145, 27.6503]
  - - [1, 16, 1, 2048]
    - [52, 4.64794]
  - - [16, 16, 1, 2048]
    - [64, 110.162]
  - - [32, 16, 1, 2048]
    - [64, 252.669]
  - - [2048, 16, 1, 1]
    - [11, 14.5636]
  - - [2048, 16, 1, 16]
    - [145, 233.017]
  - - [2048, 16, 1, 32]
    - [145, 446.529]
  - - [1, 32, 1, 2048]
    - [52, 9.23042]
  - - [16, 32, 1, 2048]
    - [64, 252.669]
  - - [32, 32, 1, 2048]
    - [64, 499.322]
  - - [2048, 32, 1, 1]
    - [20, 26.2144]
  - - [2048, 32, 1, 16]
    - [25, 419.43]
  - - [2048, 32, 1, 32]
    - [25, 873.813]
  - - [1, 2048, 1, 2048]
    - [4, 169.55]
  - - [16, 2048, 1, 2048]
    - [65, 2693.59]
  - - [1, 2048, 1, 1]
    - [2, 0.758519]
  - - [1, 2048, 1, 16]
    - [40, 13.6533]
  - - [1, 2048, 1, 32]
    - [40, 27.8877]
  - - [16, 2048, 1, 1]
    - [39, 13.9438]
  - - [16, 2048, 1, 16]
    - [40, 218.453]
  - - [16, 2048, 1, 32]
    - [39, 455.903]
  - - [32, 2048, 1, 1]
    - [41, 28.5911]
  - - [32, 2048, 1, 16]
    - [145, 447.903]
  - - [32, 2048, 1, 32]
    - [41, 899.05]
  - - [2048, 2048, 1, 1]
    - [133, 149.183]
  - - [2048, 2048, 1, 16]
    - [127, 2391.64]
  - - [3072, 1, 1, 3072]
    - [103, 218.128]
  - - [1, 1, 1, 3072]
    - [52, 0.365714]
  - - [16, 1, 1, 3072]
    - [64, 10.5703]
  - - [32, 1, 1, 3072]
    - [64, 19.6695]
  - - [3072, 1, 1, 1]
    - [11, 1.20471]
  - - [3072, 1, 1, 16]
    - [145, 19.2753]
  - - [3072, 1, 1, 32]
    - [145, 38.2144]
  - - [1, 16, 1, 3072]
    - [52, 5.71535]
  - - [16, 16, 1, 3072]
    - [64, 149.774]
  - - [32, 16, 1, 3072]
    - [64, 296.566]
  - - [3072, 16, 1, 1]
    - [8, 21.2319]
  - - [3072, 16, 1, 16]
    - [145, 327.68]
  - - [3072, 16, 1, 32]
    - [10, 604.344]
  - - [1, 32, 1, 3072]
    - [52, 11.4307]
  - - [16, 32, 1, 3072]
    - [64, 297.789]
  - - [32, 32, 1, 3072]
    - [64, 575.058]
  - - [3072, 32, 1, 1]
    - [22, 38.7959]
  - - [3072, 32, 1, 16]
    - [22, 551.882]
  - - [3072, 32, 1, 32]
    - [20, 1187.07]
  - - [1, 3072, 1, 3072]
    - [5, 461.476]
  - - [1, 3072, 1, 1]
    - [40, 1.18154]
  - - [1, 3072, 1, 16]
    - [2, 21.0091]
  - - [1, 3072, 1, 32]
    - [40, 38.5506]
  - - [16, 3072, 1, 1]
    - [40, 21.937]
  - - [16, 3072, 1, 16]
    - [40, 339.615]
  - - [16, 3072, 1, 32]
    - [39, 533.174]
  - - [32, 3072, 1, 1]
    - [44, 35.7469]
  - - [32, 3072, 1, 16]
    - [145, 609.407]
  - - [32, 3072, 1, 32]
    - [44, 1187.07]
  - - [3072, 3072, 1, 1]
    - [127, 189.941]
  - - [4096, 1, 1, 4096]
    - [145, 216.178]
  - - [1, 1, 1, 4096]
    - [52, 0.39961]
  - - [16, 1, 1, 4096]
    - [64, 12.9774]
  - - [32, 1, 1, 4096]
    - [64, 25.7004]
  - - [4096, 1, 1, 1]
    - [103, 1.54566]
  - - [4096, 1, 1, 16]
    - [145, 24.8041]
  - - [4096, 1, 1, 32]
    - [145, 44.5042]
  - - [1, 16, 1, 4096]
    - [52, 6.39376]
  - - [16, 16, 1, 4096]
    - [64, 205.603]
  - - [32, 16, 1, 4096]
    - [64, 403.298]
  - - [4096, 16, 1, 1]
    - [103, 25.7004]
  - - [4096, 16, 1, 16]
    - [145, 392.49]
  - - [4096, 16, 1, 32]
    - [145, 709.787]
  - - [1, 32, 1, 4096]
    - [52, 12.664]
  - - [16, 32, 1, 4096]
    - [64, 411.206]
  - - [32, 32, 1, 4096]
    - [64, 822.413]
  - - [4096, 32, 1, 1]
    - [83, 44.4312]
  - - [4096, 32, 1, 16]
    - [127, 723.156]
  - - [4096, 32, 1, 32]
    - [83, 1446.31]
  - - [1, 4096, 1, 4096]
    - [15, 184.959]
  - - [1, 4096, 1, 1]
    - [2, 1.6216]
  - - [1, 4096, 1, 16]
    - [40, 19.563]
  - - [1, 4096, 1, 32]
    - [40, 41.6102]
  - - [16, 4096, 1, 1]
    - [40, 26.2599]
  - - [16, 4096, 1, 16]
    - [40, 367.921]
  - - [16, 4096, 1, 32]
    - [39, 762.601]
  - - [32, 4096, 1, 1]
    - [44, 47.7207]
  - - [32, 4096, 1, 16]
    - [44, 665.763]
  - - [32, 4096, 1, 32]
    - [41, 1310.72]
  - - [4096, 4096, 1, 1]
    - [127, 179.657]
  - - [320, 1, 1, 64]
    - [151, 9.79624]
  - - [320, 16, 1, 64]
    - [61, 148.945]
  - - [320, 32, 1, 64]
    - [16, 297.891]
  - - [320, 1, 1, 1]
    - [80, 0.145455]
  - - [320, 1, 1, 16]
    - [40, 2.27556]
  - - [320, 1, 1, 32]
    - [15, 4.65455]
  - - [320, 16, 1, 1]
    - [14, 2.27556]
  - - [320, 16, 1, 16]
    - [145, 37.2364]
  - - [320, 16, 1, 32]
    - [80, 76.2047]
  - - [320, 32, 1, 1]
    - [15, 4.65455]
  - - [320, 32, 1, 16]
    - [145, 81.4194]
  - - [320, 32, 1, 32]
    - [150, 152.409]
  - - [320, 64, 1, 1]
    - [6, 9.10222]
  - - [320, 64, 1, 16]
    - [145, 148.945]
  - - [320, 64, 1, 32]
    - [15, 312.076]
  - - [576, 1, 1, 64]
    - [62, 17.1426]
  - - [576, 16, 1, 64]
    - [10, 268.102]
  - - [576, 32, 1, 64]
    - [146, 552.808]
  - - [576, 1, 1, 1]
    - [17, 0.261818]
  - - [576, 1, 1, 16]
    - [145, 4.18909]
  - - [576, 1, 1, 32]
    - [7, 9.18889]
  - - [576, 16, 1, 1]
    - [7, 4.18909]
  - - [576, 16, 1, 16]
    - [145, 70.2171]
  - - [576, 16, 1, 32]
    - [80, 120.372]
  - - [576, 32, 1, 1]
    - [138, 7.3728]
  - - [576, 32, 1, 16]
    - [14, 137.168]
  - - [576, 32, 1, 32]
    - [10, 268.102]
  - - [576, 64, 1, 1]
    - [15, 17.6414]
  - - [576, 64, 1, 16]
    - [145, 294.124]
  - - [576, 64, 1, 32]
    - [14, 524.288]
  - - [832, 1, 1, 64]
    - [80, 23.6658]
  - - [832, 16, 1, 64]
    - [113, 347.742]
  - - [832, 32, 1, 64]
    - [151, 759.973]
  - - [832, 1, 1, 1]
    - [7, 0.369778]
  - - [832, 1, 1, 16]
    - [10, 5.91644]
  - - [832, 1, 1, 32]
    - [7, 11.8329]
  - - [832, 16, 1, 1]
    - [145, 6.05091]
  - - [832, 16, 1, 16]
    - [6, 90.6349]
  - - [832, 16, 1, 32]
    - [150, 198.132]
  - - [832, 32, 1, 1]
    - [15, 11.5757]
  - - [832, 32, 1, 16]
    - [145, 211.789]
  - - [832, 32, 1, 32]
    - [80, 413.73]
  - - [832, 64, 1, 1]
    - [22, 21.7339]
  - - [832, 64, 1, 16]
    - [145, 386.305]
  - - [832, 64, 1, 32]
    - [14, 709.973]
  - - [1088, 1, 1, 64]
    - [7, 30.2748]
  - - [1088, 16, 1, 64]
    - [7, 487.908]
  - - [1088, 32, 1, 64]
    - [80, 938.318]
  - - [1088, 1, 1, 1]
    - [8, 0.483556]
  - - [1088, 1, 1, 16]
    - [145, 7.91273]
  - - [1088, 1, 1, 32]
    - [150, 16.6058]
  - - [1088, 16, 1, 1]
    - [145, 7.91273]
  - - [1088, 16, 1, 16]
    - [145, 126.604]
  - - [1088, 16, 1, 32]
    - [10, 259.096]
  - - [1088, 32, 1, 1]
    - [15, 16.6006]
  - - [1088, 32, 1, 16]
    - [145, 273.552]
  - - [1088, 32, 1, 32]
    - [135, 522.54]
  - - [1088, 64, 1, 1]
    - [20, 28.4212]
  - - [1088, 64, 1, 16]
    - [145, 460.4]
  - - [1088, 64, 1, 32]
    - [20, 927.305]
  - - [1344, 1, 1, 64]
    - [138, 35.84]
  - - [1344, 16, 1, 64]
    - [7, 598.372]
  - - [1344, 32, 1, 64]
    - [135, 1101.0]
  - - [1344, 1, 1, 1]
    - [150, 0.50717]
  - - [1344, 1, 1, 16]
    - [11, 9.15064]
  - - [1344, 1, 1, 32]
    - [8, 18.6991]
  - - [1344, 16, 1, 1]
    - [145, 9.55733]
  - - [1344, 16, 1, 16]
    - [145, 169.602]
  - - [1344, 16, 1, 32]
    - [80, 312.785]
  - - [1344, 32, 1, 1]
    - [15, 19.1965]
  - - [1344, 32, 1, 16]
    - [145, 286.72]
  - - [1344, 32, 1, 32]
    - [20, 585.641]
  - - [1344, 64, 1, 1]
    - [22, 34.9484]
  - - [1344, 64, 1, 16]
    - [25, 482.897]
  - - [1344, 64, 1, 32]
    - [20, 1038.68]
  - - [1600, 1, 1, 64]
    - [135, 41.7416]
  - - [1600, 16, 1, 64]
    - [80, 712.348]
  - - [1600, 32, 1, 64]
    - [80, 1310.72]
  - - [1600, 1, 1, 1]
    - [80, 0.666667]
  - - [1600, 1, 1, 16]
    - [9, 10.6667]
  - - [1600, 1, 1, 32]
    - [11, 22.2609]
  - - [1600, 16, 1, 1]
    - [145, 12.1101]
  - - [1600, 16, 1, 16]
    - [11, 178.087]
  - - [1600, 16, 1, 32]
    - [7, 380.427]
  - - [1600, 32, 1, 1]
    - [17, 20.898]
  - - [1600, 32, 1, 16]
    - [145, 341.333]
  - - [1600, 32, 1, 32]
    - [80, 699.271]
  - - [1600, 64, 1, 1]
    - [22, 40.9295]
  - - [1600, 64, 1, 16]
    - [145, 614.134]
  - - [1600, 64, 1, 32]
    - [20, 1191.56]
  - - [1856, 1, 1, 64]
    - [80, 49.4933]
  - - [1856, 16, 1, 64]
    - [80, 826.323]
  - - [1856, 32, 1, 64]
    - [20, 1367.65]
  - - [1856, 1, 1, 1]
    - [11, 0.806957]
  - - [1856, 1, 1, 16]
    - [145, 13.8934]
  - - [1856, 1, 1, 32]
    - [7, 25.2732]
  - - [1856, 16, 1, 1]
    - [11, 12.9113]
  - - [1856, 16, 1, 16]
    - [145, 227.942]
  - - [1856, 16, 1, 32]
    - [7, 432.468]
  - - [1856, 32, 1, 1]
    - [15, 25.953]
  - - [1856, 32, 1, 16]
    - [145, 395.947]
  - - [1856, 32, 1, 32]
    - [20, 793.423]
  - - [1856, 64, 1, 1]
    - [21, 43.9941]
  - - [1856, 64, 1, 16]
    - [22, 717.186]
  - - [1856, 64, 1, 32]
    - [20, 1434.37]
  - - [2112, 1, 1, 64]
    - [11, 56.32]
  - - [2112, 16, 1, 64]
    - [6, 920.293]
  - - [2112, 32, 1, 64]
    - [82, 1526.99]
  - - [2112, 1, 1, 1]
    - [62, 0.862041]
  - - [2112, 1, 1, 16]
    - [145, 15.4629]
  - - [2112, 1, 1, 32]
    - [7, 29.3843]
  - - [2112, 16, 1, 1]
    - [10, 14.3796]
  - - [2112, 16, 1, 16]
    - [145, 254.308]
  - - [2112, 16, 1, 32]
    - [7, 480.597]
  - - [2112, 32, 1, 1]
    - [20, 27.5853]
  - - [2112, 32, 1, 16]
    - [25, 408.054]
  - - [2112, 32, 1, 32]
    - [20, 901.12]
  - - [2112, 64, 1, 1]
    - [157, 49.6397]
  - - [2112, 64, 1, 16]
    - [157, 709.078]
  - - [2112, 64, 1, 32]
    - [159, 1482.22]
  - - [2368, 1, 1, 64]
    - [8, 56.6556]
  - - [2368, 16, 1, 64]
    - [8, 1031.84]
  - - [2368, 32, 1, 64]
    - [82, 1611.28]
  - - [2368, 1, 1, 1]
    - [7, 1.00766]
  - - [2368, 1, 1, 16]
    - [145, 17.2448]
  - - [2368, 1, 1, 32]
    - [8, 32.9461]
  - - [2368, 16, 1, 1]
    - [11, 17.5716]
  - - [2368, 16, 1, 16]
    - [145, 263.569]
  - - [2368, 16, 1, 32]
    - [7, 519.919]
  - - [2368, 32, 1, 1]
    - [22, 31.5733]
  - - [2368, 32, 1, 16]
    - [25, 484.966]
  - - [2368, 32, 1, 32]
    - [20, 989.727]
  - - [2368, 64, 1, 1]
    - [159, 46.6314]
  - - [2368, 64, 1, 16]
    - [157, 826.903]
  - - [2368, 64, 1, 32]
    - [159, 1732.02]
  - - [2624, 1, 1, 64]
    - [8, 58.3196]
  - - [2624, 16, 1, 64]
    - [135, 1119.57]
  - - [2624, 32, 1, 64]
    - [82, 1655.73]
  - - [2624, 1, 1, 1]
    - [11, 1.0496]
  - - [2624, 1, 1, 16]
    - [145, 18.3986]
  - - [2624, 1, 1, 32]
    - [145, 33.5872]
  - - [2624, 16, 1, 1]
    - [11, 17.1363]
  - - [2624, 16, 1, 16]
    - [145, 274.181]
  - - [2624, 16, 1, 32]
    - [80, 559.787]
  - - [2624, 32, 1, 1]
    - [22, 33.8814]
  - - [2624, 32, 1, 16]
    - [22, 505.253]
  - - [2624, 32, 1, 32]
    - [22, 1013.95]
  - - [2624, 64, 1, 1]
    - [27, 58.7699]
  - - [2624, 64, 1, 16]
    - [27, 842.298]
  - - [2624, 64, 1, 32]
    - [27, 1663.22]
  - - [2880, 1, 1, 64]
    - [11, 68.2667]
  - - [2880, 16, 1, 64]
    - [135, 1179.65]
  - - [2880, 32, 1, 64]
    - [82, 1797.3]
  - - [2880, 1, 1, 1]
    - [8, 1.23717]
  - - [2880, 1, 1, 16]
    - [145, 20.0134]
  - - [2880, 1, 1, 32]
    - [8, 36.864]
  - - [2880, 16, 1, 1]
    - [11, 18.8082]
  - - [2880, 16, 1, 16]
    - [145, 307.2]
  - - [2880, 16, 1, 32]
    - [80, 614.4]
  - - [2880, 32, 1, 1]
    - [22, 36.6273]
  - - [2880, 32, 1, 16]
    - [22, 546.881]
  - - [2880, 32, 1, 32]
    - [19, 1112.88]
  - - [2880, 64, 1, 1]
    - [27, 64.8775]
  - - [2880, 64, 1, 16]
    - [159, 951.329]
  - - [2880, 64, 1, 32]
    - [13, 2033.88]
  - - [3136, 1, 1, 64]
    - [10, 75.7374]
  - - [3136, 16, 1, 64]
    - [145, 1284.51]
  - - [3136, 32, 1, 64]
    - [82, 1874.85]
  - - [3136, 1, 1, 1]
    - [11, 1.2544]
  - - [3136, 1, 1, 16]
    - [145, 21.6382]
  - - [3136, 1, 1, 32]
    - [135, 38.5969]
  - - [3136, 16, 1, 1]
    - [8, 19.6769]
  - - [3136, 16, 1, 16]
    - [145, 341.624]
  - - [3136, 16, 1, 32]
    - [80, 669.013]
  - - [3136, 32, 1, 1]
    - [22, 39.6503]
  - - [3136, 32, 1, 16]
    - [21, 594.679]
  - - [3136, 32, 1, 32]
    - [20, 1211.8]
  - - [3136, 64, 1, 1]
    - [25, 63.8684]
  - - [3136, 64, 1, 16]
    - [157, 964.163]
  - - [3136, 64, 1, 32]
    - [20, 2071.78]
  - - [3392, 1, 1, 64]
    - [8, 80.403]
  - - [3392, 16, 1, 64]
    - [10, 1335.93]
  - - [3392, 32, 1, 64]
    - [82, 1929.06]
  - - [3392, 1, 1, 1]
    - [8, 1.44351]
  - - [3392, 1, 1, 16]
    - [145, 23.0129]
  - - [3392, 1, 1, 32]
    - [8, 43.4176]
  - - [3392, 16, 1, 1]
    - [8, 23.2856]
  - - [3392, 16, 1, 16]
    - [145, 361.813]
  - - [3392, 16, 1, 32]
    - [135, 694.682]
  - - [3392, 32, 1, 1]
    - [22, 42.4841]
  - - [3392, 32, 1, 16]
    - [22, 624.526]
  - - [3392, 32, 1, 32]
    - [20, 1335.93]
  - - [3392, 64, 1, 1]
    - [83, 65.7842]
  - - [3392, 64, 1, 16]
    - [157, 1036.84]
  - - [3392, 64, 1, 32]
    - [134, 2170.88]
  - - [3648, 1, 1, 64]
    - [7, 86.4711]
  - - [3648, 16, 1, 64]
    - [6, 1146.88]
  - - [3648, 32, 1, 64]
    - [20, 2576.24]
  - - [3648, 1, 1, 1]
    - [8, 1.5479]
  - - [3648, 1, 1, 16]
    - [145, 24.3865]
  - - [3648, 1, 1, 32]
    - [8, 44.4612]
  - - [3648, 16, 1, 1]
    - [8, 24.8618]
  - - [3648, 16, 1, 16]
    - [145, 381.179]
  - - [3648, 16, 1, 32]
    - [10, 778.24]
  - - [3648, 32, 1, 1]
    - [25, 45.206]
  - - [3648, 32, 1, 16]
    - [25, 657.125]
  - - [3648, 32, 1, 32]
    - [20, 1436.75]
  - - [3648, 64, 1, 1]
    - [158, 75.8793]
  - - [3648, 64, 1, 16]
    - [134, 1149.4]
  - - [3648, 64, 1, 32]
    - [134, 2298.8]
  - - [3904, 1, 1, 64]
    - [103, 74.543]
  - - [3904, 16, 1, 64]
    - [103, 1136.99]
  - - [3904, 32, 1, 64]
    - [127, 2034.72]
  - - [3904, 1, 1, 1]
    - [103, 1.57904]
  - - [3904, 1, 1, 16]
    - [145, 24.6285]
  - - [3904, 1, 1, 32]
    - [103, 47.1426]
  - - [3904, 16, 1, 1]
    - [103, 25.2149]
  - - [3904, 16, 1, 16]
    - [145, 391.294]
  - - [3904, 16, 1, 32]
    - [103, 700.026]
  - - [3904, 32, 1, 1]
    - [27, 43.9405]
  - - [3904, 32, 1, 16]
    - [22, 652.081]
  - - [3904, 32, 1, 32]
    - [20, 1355.15]
  - - [3904, 64, 1, 1]
    - [30, 71.3874]
  - - [3904, 64, 1, 16]
    - [30, 1126.11]
  - - [3904, 64, 1, 32]
    - [30, 2220.94]
  - - [1, 320, 1, 64]
    - [40, 8.71489]
  - - [16, 320, 1, 64]
    - [70, 148.945]
  - - [32, 320, 1, 64]
    - [135, 262.144]
  - - [1, 320, 1, 1]
    - [17, 0.142222]
  - - [1, 320, 1, 16]
    - [17, 2.17872]
  - - [1, 320, 1, 32]
    - [8, 4.55111]
  - - [16, 320, 1, 1]
    - [17, 2.27556]
  - - [16, 320, 1, 16]
    - [145, 36.4089]
  - - [16, 320, 1, 32]
    - [14, 74.4727]
  - - [32, 320, 1, 1]
    - [145, 4.65455]
  - - [32, 320, 1, 16]
    - [145, 82.6322]
  - - [32, 320, 1, 32]
    - [14, 152.409]
  - - [64, 320, 1, 1]
    - [152, 9.30909]
  - - [64, 320, 1, 16]
    - [145, 161.834]
  - - [64, 320, 1, 32]
    - [10, 297.891]
  - - [320, 320, 1, 1]
    - [21, 37.9259]
  - - [320, 320, 1, 16]
    - [145, 667.212]
  - - [320, 320, 1, 32]
    - [20, 1129.93]
  - - [576, 320, 1, 1]
    - [27, 66.8411]
  - - [576, 320, 1, 16]
    - [27, 1013.87]
  - - [576, 320, 1, 32]
    - [27, 2028.76]
  - - [832, 320, 1, 1]
    - [43, 85.0127]
  - - [832, 320, 1, 16]
    - [43, 1301.61]
  - - [832, 320, 1, 32]
    - [43, 2469.47]
  - - [1088, 320, 1, 1]
    - [43, 95.8096]
  - - [1088, 320, 1, 16]
    - [43, 1489.84]
  - - [1088, 320, 1, 32]
    - [159, 2856.7]
  - - [1344, 320, 1, 1]
    - [156, 108.642]
  - - [1344, 320, 1, 16]
    - [156, 1658.14]
  - - [1344, 320, 1, 32]
    - [134, 3398.16]
  - - [1600, 320, 1, 1]
    - [58, 112.657]
  - - [1600, 320, 1, 16]
    - [134, 1769.96]
  - - [1600, 320, 1, 32]
    - [134, 3561.74]
  - - [1856, 320, 1, 1]
    - [107, 119.003]
  - - [1856, 320, 1, 16]
    - [156, 2021.86]
  - - [1856, 320, 1, 32]
    - [156, 3801.09]
  - - [2112, 320, 1, 1]
    - [156, 121.903]
  - - [2112, 320, 1, 16]
    - [156, 2046.27]
  - - [2112, 320, 1, 32]
    - [156, 3909.37]
  - - [2368, 320, 1, 1]
    - [94, 147.138]
  - - [2368, 320, 1, 16]
    - [156, 2552.45]
  - - [2368, 320, 1, 32]
    - [156, 4575.15]
  - - [2624, 320, 1, 1]
    - [133, 129.182]
  - - [2624, 320, 1, 16]
    - [133, 2051.13]
  - - [2624, 320, 1, 32]
    - [133, 4333.83]
  - - [2880, 320, 1, 1]
    - [98, 129.174]
  - - [2880, 320, 1, 16]
    - [134, 2286.14]
  - - [2880, 320, 1, 32]
    - [127, 4572.28]
  - - [3136, 320, 1, 1]
    - [98, 136.533]
  - - [3136, 320, 1, 16]
    - [98, 2155.21]
  - - [3136, 320, 1, 32]
    - [134, 4060.55]
  - - [3392, 320, 1, 1]
    - [58, 133.476]
  - - [3392, 320, 1, 16]
    - [58, 2100.1]
  - - [3392, 320, 1, 32]
    - [134, 3981.52]
  - - [3648, 320, 1, 1]
    - [159, 131.955]
  - - [3648, 320, 1, 16]
    - [156, 2320.22]
  - - [3648, 320, 1, 32]
    - [159, 4079.83]
  - - [3904, 320, 1, 1]
    - [100, 152.351]
  - - [3904, 320, 1, 16]
    - [156, 2498.56]
  - - [3904, 320, 1, 32]
    - [87, 4816.5]
  - - [1, 576, 1, 64]
    - [4, 18.1447]
  - - [16, 576, 1, 64]
    - [143, 268.102]
  - - [32, 576, 1, 64]
    - [138, 581.73]
  - - [1, 576, 1, 1]
    - [2, 0.235102]
  - - [1, 576, 1, 16]
    - [17, 3.47774]
  - - [1, 576, 1, 32]
    - [40, 8.192]
  - - [16, 576, 1, 1]
    - [17, 4.096]
  - - [16, 576, 1, 16]
    - [143, 65.536]
  - - [16, 576, 1, 32]
    - [14, 134.051]
  - - [32, 576, 1, 1]
    - [150, 7.3728]
  - - [32, 576, 1, 16]
    - [145, 134.051]
  - - [32, 576, 1, 32]
    - [14, 268.102]
  - - [64, 576, 1, 1]
    - [15, 16.0278]
  - - [64, 576, 1, 16]
    - [145, 292.643]
  - - [64, 576, 1, 32]
    - [14, 524.288]
  - - [320, 576, 1, 1]
    - [32, 68.8208]
  - - [320, 576, 1, 16]
    - [32, 1047.96]
  - - [320, 576, 1, 32]
    - [31, 1999.4]
  - - [576, 576, 1, 1]
    - [48, 97.5812]
  - - [576, 576, 1, 16]
    - [48, 1561.3]
  - - [576, 576, 1, 32]
    - [48, 3122.6]
  - - [832, 576, 1, 1]
    - [48, 121.325]
  - - [832, 576, 1, 16]
    - [48, 1916.93]
  - - [832, 576, 1, 32]
    - [121, 3566.38]
  - - [1088, 576, 1, 1]
    - [94, 116.053]
  - - [1088, 576, 1, 16]
    - [156, 2067.42]
  - - [1088, 576, 1, 32]
    - [156, 3750.17]
  - - [1344, 576, 1, 1]
    - [156, 157.989]
  - - [1344, 576, 1, 16]
    - [156, 2249]
  - - [1344, 576, 1, 32]
    - [156, 4222.12]
  - - [1600, 576, 1, 1]
    - [108, 144.0]
  - - [1600, 576, 1, 16]
    - [134, 2077.79]
  - - [1600, 576, 1, 32]
    - [134, 4502.47]
  - - [1856, 576, 1, 1]
    - [97, 160.76]
  - - [1856, 576, 1, 16]
    - [97, 2672.64]
  - - [1856, 576, 1, 32]
    - [98, 4246.59]
  - - [2112, 576, 1, 1]
    - [53, 149.265]
  - - [2112, 576, 1, 16]
    - [53, 2479.51]
  - - [2112, 576, 1, 32]
    - [159, 4324.55]
  - - [2368, 576, 1, 1]
    - [156, 142.886]
  - - [2368, 576, 1, 16]
    - [156, 2745.09]
  - - [2368, 576, 1, 32]
    - [156, 4467.47]
  - - [2624, 576, 1, 1]
    - [156, 173.727]
  - - [2624, 576, 1, 16]
    - [156, 2861.87]
  - - [2624, 576, 1, 32]
    - [96, 5559.26]
  - - [2880, 576, 1, 1]
    - [156, 174.619]
  - - [2880, 576, 1, 16]
    - [156, 2932.83]
  - - [2880, 576, 1, 32]
    - [134, 4745.69]
  - - [3136, 576, 1, 1]
    - [94, 173.686]
  - - [3136, 576, 1, 16]
    - [156, 2890.14]
  - - [3136, 576, 1, 32]
    - [134, 4832.39]
  - - [3392, 576, 1, 1]
    - [156, 153.769]
  - - [3392, 576, 1, 16]
    - [156, 2977.21]
  - - [3392, 576, 1, 32]
    - [134, 4996.11]
  - - [3648, 576, 1, 1]
    - [156, 157.517]
  - - [3648, 576, 1, 16]
    - [156, 2534.53]
  - - [3648, 576, 1, 32]
    - [134, 5014.53]
  - - [3904, 576, 1, 1]
    - [156, 165.749]
  - - [3904, 576, 1, 16]
    - [156, 3226.84]
  - - [3904, 576, 1, 32]
    - [98, 6046.94]
  - - [1, 832, 1, 64]
    - [5, 25.0694]
  - - [16, 832, 1, 64]
    - [154, 378.652]
  - - [32, 832, 1, 64]
    - [154, 655.36]
  - - [1, 832, 1, 1]
    - [40, 0.361739]
  - - [1, 832, 1, 16]
    - [40, 5.78783]
  - - [1, 832, 1, 32]
    - [2, 11.0933]
  - - [16, 832, 1, 1]
    - [39, 5.91644]
  - - [16, 832, 1, 16]
    - [40, 85.1968]
  - - [16, 832, 1, 32]
    - [39, 214.909]
  - - [32, 832, 1, 1]
    - [15, 11.8329]
  - - [32, 832, 1, 16]
    - [15, 185.21]
  - - [32, 832, 1, 32]
    - [150, 387.258]
  - - [64, 832, 1, 1]
    - [20, 24.0769]
  - - [64, 832, 1, 16]
    - [145, 354.987]
  - - [64, 832, 1, 32]
    - [20, 776.974]
  - - [320, 832, 1, 1]
    - [30, 73.9556]
  - - [320, 832, 1, 16]
    - [30, 1234.74]
  - - [320, 832, 1, 32]
    - [30, 2581.72]
  - - [576, 832, 1, 1]
    - [134, 111.449]
  - - [576, 832, 1, 16]
    - [134, 1666.89]
  - - [576, 832, 1, 32]
    - [134, 3682]
  - - [832, 832, 1, 1]
    - [156, 124.725]
  - - [832, 832, 1, 16]
    - [156, 2106.82]
  - - [832, 832, 1, 32]
    - [96, 3982.9]
  - - [1088, 832, 1, 1]
    - [134, 129.637]
  - - [1088, 832, 1, 16]
    - [134, 2087.76]
  - - [1088, 832, 1, 32]
    - [134, 4526.08]
  - - [1344, 832, 1, 1]
    - [98, 169.425]
  - - [1344, 832, 1, 16]
    - [98, 2144]
  - - [1344, 832, 1, 32]
    - [98, 4238.84]
  - - [1600, 832, 1, 1]
    - [156, 153.896]
  - - [1600, 832, 1, 16]
    - [156, 2662.4]
  - - [1600, 832, 1, 32]
    - [96, 5011.58]
  - - [1856, 832, 1, 1]
    - [94, 174.485]
  - - [1856, 832, 1, 16]
    - [156, 2994.8]
  - - [1856, 832, 1, 32]
    - [94, 5583.52]
  - - [2112, 832, 1, 1]
    - [96, 173.122]
  - - [2112, 832, 1, 16]
    - [156, 2883.58]
  - - [2112, 832, 1, 32]
    - [134, 4848.13]
  - - [2368, 832, 1, 1]
    - [60, 152.917]
  - - [2368, 832, 1, 16]
    - [156, 2946.06]
  - - [2368, 832, 1, 32]
    - [134, 5037.35]
  - - [2624, 832, 1, 1]
    - [156, 161.08]
  - - [2624, 832, 1, 16]
    - [156, 3161.15]
  - - [2624, 832, 1, 32]
    - [134, 5019.2]
  - - [2880, 832, 1, 1]
    - [156, 190.929]
  - - [2880, 832, 1, 16]
    - [156, 3276.8]
  - - [2880, 832, 1, 32]
    - [96, 5244.06]
  - - [3136, 832, 1, 1]
    - [96, 190.449]
  - - [3136, 832, 1, 16]
    - [156, 3261.44]
  - - [3136, 832, 1, 32]
    - [134, 5309.51]
  - - [3392, 832, 1, 1]
    - [156, 194.631]
  - - [3392, 832, 1, 16]
    - [156, 3213.83]
  - - [3392, 832, 1, 32]
    - [134, 5435.64]
  - - [3648, 832, 1, 1]
    - [156, 204.386]
  - - [3648, 832, 1, 16]
    - [156, 3431.96]
  - - [3648, 832, 1, 32]
    - [134, 5408.53]
  - - [3904, 832, 1, 1]
    - [156, 209.557]
  - - [3904, 832, 1, 16]
    - [156, 3571.82]
  - - [3904, 832, 1, 32]
    - [134, 5463.58]
  - - [1, 1088, 1, 64]
    - [5, 31.579]
  - - [16, 1088, 1, 64]
    - [146, 515.871]
  - - [32, 1088, 1, 64]
    - [65, 840.839]
  - - [1, 1088, 1, 1]
    - [40, 0.473043]
  - - [1, 1088, 1, 16]
    - [2, 7.10531]
  - - [1, 1088, 1, 32]
    - [2, 14.2106]
  - - [16, 1088, 1, 1]
    - [5, 7.40766]
  - - [16, 1088, 1, 16]
    - [40, 121.099]
  - - [16, 1088, 1, 32]
    - [40, 280.234]
  - - [32, 1088, 1, 1]
    - [14, 14.8153]
  - - [32, 1088, 1, 16]
    - [145, 247.58]
  - - [32, 1088, 1, 32]
    - [14, 495.161]
  - - [64, 1088, 1, 1]
    - [22, 27.8528]
  - - [64, 1088, 1, 16]
    - [25, 454.74]
  - - [64, 1088, 1, 32]
    - [20, 928.427]
  - - [320, 1088, 1, 1]
    - [48, 94.0973]
  - - [320, 1088, 1, 16]
    - [34, 1446.9]
  - - [320, 1088, 1, 32]
    - [34, 2931.87]
  - - [576, 1088, 1, 1]
    - [156, 124.097]
  - - [576, 1088, 1, 16]
    - [156, 2067.42]
  - - [576, 1088, 1, 32]
    - [96, 3860.04]
  - - [832, 1088, 1, 1]
    - [134, 136.123]
  - - [832, 1088, 1, 16]
    - [134, 2078.37]
  - - [832, 1088, 1, 32]
    - [134, 4422.43]
  - - [1088, 1088, 1, 1]
    - [60, 142.62]
  - - [1088, 1088, 1, 16]
    - [156, 2397.46]
  - - [1088, 1088, 1, 32]
    - [159, 4261.13]
  - - [1344, 1088, 1, 1]
    - [94, 164.3]
  - - [1344, 1088, 1, 16]
    - [156, 2870.72]
  - - [1344, 1088, 1, 32]
    - [94, 5378.47]
  - - [1600, 1088, 1, 1]
    - [156, 171.507]
  - - [1600, 1088, 1, 16]
    - [133, 2359.84]
  - - [1600, 1088, 1, 32]
    - [134, 5382.18]
  - - [1856, 1088, 1, 1]
    - [60, 158.318]
  - - [1856, 1088, 1, 16]
    - [134, 2459.97]
  - - [1856, 1088, 1, 32]
    - [134, 5080.46]
  - - [2112, 1088, 1, 1]
    - [91, 189.124]
  - - [2112, 1088, 1, 16]
    - [156, 3253.6]
  - - [2112, 1088, 1, 32]
    - [96, 6102.19]
  - - [2368, 1088, 1, 1]
    - [96, 192.988]
  - - [2368, 1088, 1, 16]
    - [156, 3258.67]
  - - [2368, 1088, 1, 32]
    - [134, 5338.26]
  - - [2624, 1088, 1, 1]
    - [94, 193.553]
  - - [2624, 1088, 1, 16]
    - [156, 3274.45]
  - - [2624, 1088, 1, 32]
    - [134, 5437.79]
  - - [2880, 1088, 1, 1]
    - [156, 209.595]
  - - [2880, 1088, 1, 16]
    - [156, 3568.33]
  - - [2880, 1088, 1, 32]
    - [134, 5469.52]
  - - [3136, 1088, 1, 1]
    - [96, 206.161]
  - - [3136, 1088, 1, 16]
    - [156, 3533.43]
  - - [3136, 1088, 1, 32]
    - [96, 6403.69]
  - - [3392, 1088, 1, 1]
    - [96, 209.687]
  - - [3392, 1088, 1, 16]
    - [156, 3413.18]
  - - [3392, 1088, 1, 32]
    - [134, 5703.94]
  - - [3648, 1088, 1, 1]
    - [156, 214.542]
  - - [3648, 1088, 1, 16]
    - [156, 3681.41]
  - - [3904, 1088, 1, 1]
    - [156, 217.266]
  - - [3904, 1088, 1, 16]
    - [156, 3663.66]
  - - [1, 1344, 1, 64]
    - [5, 36.7968]
  - - [16, 1344, 1, 64]
    - [146, 598.372]
  - - [32, 1344, 1, 64]
    - [138, 1101.0]
  - - [1, 1344, 1, 1]
    - [40, 0.571915]
  - - [1, 1344, 1, 16]
    - [2, 10.2983]
  - - [1, 1344, 1, 32]
    - [2, 15.9289]
  - - [16, 1344, 1, 1]
    - [40, 8.96]
  - - [16, 1344, 1, 16]
    - [40, 166.979]
  - - [16, 1344, 1, 32]
    - [40, 305.835]
  - - [32, 1344, 1, 1]
    - [15, 17.5543]
  - - [32, 1344, 1, 16]
    - [145, 329.234]
  - - [32, 1344, 1, 32]
    - [14, 573.44]
  - - [64, 1344, 1, 1]
    - [32, 32.4589]
  - - [64, 1344, 1, 16]
    - [145, 556.517]
  - - [64, 1344, 1, 32]
    - [31, 1123.71]
  - - [320, 1344, 1, 1]
    - [58, 106.193]
  - - [320, 1344, 1, 16]
    - [58, 1784.5]
  - - [320, 1344, 1, 32]
    - [58, 3621.73]
  - - [576, 1344, 1, 1]
    - [95, 144.7]
  - - [576, 1344, 1, 16]
    - [95, 2315.2]
  - - [576, 1344, 1, 32]
    - [95, 4587.52]
  - - [832, 1344, 1, 1]
    - [98, 159.744]
  - - [832, 1344, 1, 16]
    - [98, 2592.95]
  - - [832, 1344, 1, 32]
    - [98, 4368.14]
  - - [1088, 1344, 1, 1]
    - [156, 152.31]
  - - [1088, 1344, 1, 16]
    - [156, 2785.28]
  - - [1088, 1344, 1, 32]
    - [96, 4794.47]
  - - [1344, 1344, 1, 1]
    - [60, 177.964]
  - - [1344, 1344, 1, 16]
    - [134, 2370.38]
  - - [1344, 1344, 1, 32]
    - [134, 5427.49]
  - - [1600, 1344, 1, 1]
    - [60, 197.284]
  - - [1600, 1344, 1, 16]
    - [156, 2597.3]
  - - [1600, 1344, 1, 32]
    - [97, 6089.63]
  - - [1856, 1344, 1, 1]
    - [156, 169.286]
  - - [1856, 1344, 1, 16]
    - [156, 3155.05]
  - - [1856, 1344, 1, 32]
    - [134, 5283.73]
  - - [2112, 1344, 1, 1]
    - [60, 171.212]
  - - [2112, 1344, 1, 16]
    - [156, 3315.07]
  - - [2112, 1344, 1, 32]
    - [134, 5423.85]
  - - [2368, 1344, 1, 1]
    - [156, 177.472]
  - - [2368, 1344, 1, 16]
    - [156, 3560.94]
  - - [2368, 1344, 1, 32]
    - [134, 5518.02]
  - - [2624, 1344, 1, 1]
    - [156, 178.216]
  - - [2624, 1344, 1, 16]
    - [156, 2800.28]
  - - [2624, 1344, 1, 32]
    - [134, 5609.3]
  - - [2880, 1344, 1, 1]
    - [156, 180.619]
  - - [2880, 1344, 1, 16]
    - [156, 3611.17]
  - - [2880, 1344, 1, 32]
    - [134, 5765.39]
  - - [3136, 1344, 1, 1]
    - [94, 183.318]
  - - [3136, 1344, 1, 16]
    - [156, 3635.39]
  - - [3392, 1344, 1, 1]
    - [156, 187.859]
  - - [3392, 1344, 1, 16]
    - [156, 2966.97]
  - - [3648, 1344, 1, 1]
    - [156, 187.287]
  - - [3648, 1344, 1, 16]
    - [156, 2976.31]
  - - [3904, 1344, 1, 1]
    - [156, 190.917]
  - - [3904, 1344, 1, 16]
    - [156, 3807.33]
  - - [1, 1600, 1, 64]
    - [5, 42.8878]
  - - [16, 1600, 1, 64]
    - [146, 712.348]
  - - [32, 1600, 1, 64]
    - [138, 1278.23]
  - - [1, 1600, 1, 1]
    - [40, 0.666667]
  - - [1, 1600, 1, 16]
    - [40, 10.449]
  - - [1, 1600, 1, 32]
    - [40, 21.7872]
  - - [16, 1600, 1, 1]
    - [39, 10.6667]
  - - [16, 1600, 1, 16]
    - [40, 170.667]
  - - [16, 1600, 1, 32]
    - [39, 348.596]
  - - [32, 1600, 1, 1]
    - [15, 20.898]
  - - [32, 1600, 1, 16]
    - [145, 334.367]
  - - [32, 1600, 1, 32]
    - [80, 739.979]
  - - [64, 1600, 1, 1]
    - [20, 37.9259]
  - - [64, 1600, 1, 16]
    - [20, 595.782]
  - - [64, 1600, 1, 32]
    - [19, 1260.31]
  - - [320, 1600, 1, 1]
    - [134, 105.567]
  - - [320, 1600, 1, 16]
    - [134, 1724.63]
  - - [320, 1600, 1, 32]
    - [134, 3561.74]
  - - [576, 1600, 1, 1]
    - [72, 144.0]
  - - [576, 1600, 1, 16]
    - [134, 2084.42]
  - - [576, 1600, 1, 32]
    - [134, 4537.11]
  - - [832, 1600, 1, 1]
    - [156, 154.791]
  - - [832, 1600, 1, 16]
    - [156, 2629.53]
  - - [832, 1600, 1, 32]
    - [94, 4868.39]
  - - [1088, 1600, 1, 1]
    - [109, 152.153]
  - - [1088, 1600, 1, 16]
    - [156, 2785.28]
  - - [1088, 1600, 1, 32]
    - [134, 4840.77]
  - - [1344, 1600, 1, 1]
    - [94, 158.486]
  - - [1344, 1600, 1, 16]
    - [156, 3031.4]
  - - [1344, 1600, 1, 32]
    - [134, 5067.44]
  - - [1600, 1600, 1, 1]
    - [94, 189.63]
  - - [1600, 1600, 1, 16]
    - [109, 2609.69]
  - - [1600, 1600, 1, 32]
    - [134, 5244.65]
  - - [1856, 1600, 1, 1]
    - [134, 171.359]
  - - [1856, 1600, 1, 16]
    - [156, 3311.05]
  - - [1856, 1600, 1, 32]
    - [134, 5483.33]
  - - [2112, 1600, 1, 1]
    - [156, 178.5]
  - - [2112, 1600, 1, 16]
    - [156, 3432.84]
  - - [2112, 1600, 1, 32]
    - [134, 5511.21]
  - - [2368, 1600, 1, 1]
    - [156, 183.032]
  - - [2368, 1600, 1, 16]
    - [156, 3545.08]
  - - [2368, 1600, 1, 32]
    - [134, 5765.98]
  - - [2624, 1600, 1, 1]
    - [156, 215.303]
  - - [2624, 1600, 1, 16]
    - [156, 3650.78]
  - - [2880, 1600, 1, 1]
    - [156, 189.334]
  - - [2880, 1600, 1, 16]
    - [156, 3723.64]
  - - [3136, 1600, 1, 1]
    - [94, 189.382]
  - - [3136, 1600, 1, 16]
    - [156, 3769.09]
  - - [3392, 1600, 1, 1]
    - [156, 193.182]
  - - [3392, 1600, 1, 16]
    - [156, 3842.27]
  - - [3648, 1600, 1, 1]
    - [156, 192.903]
  - - [3648, 1600, 1, 16]
    - [156, 3907.48]
  - - [3904, 1600, 1, 1]
    - [156, 193.972]
  - - [3904, 1600, 1, 16]
    - [156, 3973.85]
  - - [1, 1856, 1, 64]
    - [5, 48.2261]
  - - [16, 1856, 1, 64]
    - [147, 844.686]
  - - [32, 1856, 1, 64]
    - [141, 1392]
  - - [1, 1856, 1, 1]
    - [40, 0.757551]
  - - [1, 1856, 1, 16]
    - [2, 10.7985]
  - - [1, 1856, 1, 32]
    - [2, 28.2645]
  - - [16, 1856, 1, 1]
    - [40, 12.6366]
  - - [16, 1856, 1, 16]
    - [40, 197.973]
  - - [16, 1856, 1, 32]
    - [40, 413.162]
  - - [32, 1856, 1, 1]
    - [15, 23.7568]
  - - [32, 1856, 1, 16]
    - [145, 387.866]
  - - [32, 1856, 1, 32]
    - [41, 824.527]
  - - [64, 1856, 1, 1]
    - [25, 43.9941]
  - - [64, 1856, 1, 16]
    - [22, 716.87]
  - - [64, 1856, 1, 32]
    - [20, 1407.81]
  - - [320, 1856, 1, 1]
    - [60, 116.645]
  - - [320, 1856, 1, 16]
    - [156, 1913.21]
  - - [320, 1856, 1, 32]
    - [60, 3721.56]
  - - [576, 1856, 1, 1]
    - [98, 152.722]
  - - [576, 1856, 1, 16]
    - [98, 2426.23]
  - - [576, 1856, 1, 32]
    - [98, 4464.99]
  - - [832, 1856, 1, 1]
    - [109, 153.835]
  - - [832, 1856, 1, 16]
    - [95, 2730.06]
  - - [832, 1856, 1, 32]
    - [109, 4737.97]
  - - [1088, 1856, 1, 1]
    - [98, 177.914]
  - - [1088, 1856, 1, 16]
    - [156, 2937.2]
  - - [1088, 1856, 1, 32]
    - [134, 5012.48]
  - - [1344, 1856, 1, 1]
    - [156, 169.981]
  - - [1344, 1856, 1, 16]
    - [156, 3167.57]
  - - [1344, 1856, 1, 32]
    - [134, 5292.07]
  - - [1600, 1856, 1, 1]
    - [156, 197.316]
  - - [1600, 1856, 1, 16]
    - [156, 3322.63]
  - - [1600, 1856, 1, 32]
    - [134, 5442.11]
  - - [1856, 1856, 1, 1]
    - [156, 177.54]
  - - [1856, 1856, 1, 16]
    - [156, 2804.34]
  - - [1856, 1856, 1, 32]
    - [134, 5576.04]
  - - [2112, 1856, 1, 1]
    - [156, 212.459]
  - - [2112, 1856, 1, 16]
    - [156, 3614.87]
  - - [2368, 1856, 1, 1]
    - [156, 188.174]
  - - [2368, 1856, 1, 16]
    - [156, 3672.07]
  - - [2624, 1856, 1, 1]
    - [156, 189.238]
  - - [2624, 1856, 1, 16]
    - [156, 3810.38]
  - - [2880, 1856, 1, 1]
    - [156, 192.508]
  - - [2880, 1856, 1, 16]
    - [156, 3843.8]
  - - [3136, 1856, 1, 1]
    - [96, 191.913]
  - - [3136, 1856, 1, 16]
    - [156, 3864.18]
  - - [3392, 1856, 1, 1]
    - [156, 191.898]
  - - [3392, 1856, 1, 16]
    - [156, 3911.8]
  - - [3648, 1856, 1, 1]
    - [133, 182.55]
  - - [3648, 1856, 1, 16]
    - [156, 3827.95]
  - - [3904, 1856, 1, 1]
    - [156, 186.861]
  - - [3904, 1856, 1, 16]
    - [156, 4039.48]
  - - [1, 2112, 1, 64]
    - [5, 53.201]
  - - [16, 2112, 1, 64]
    - [146, 901.12]
  - - [32, 2112, 1, 64]
    - [71, 1513.61]
  - - [1, 2112, 1, 1]
    - [2, 1.01898]
  - - [1, 2112, 1, 16]
    - [40, 13.5168]
  - - [1, 2112, 1, 32]
    - [2, 31.172]
  - - [16, 2112, 1, 1]
    - [40, 14.3796]
  - - [16, 2112, 1, 16]
    - [40, 225.28]
  - - [16, 2112, 1, 32]
    - [40, 498.829]
  - - [32, 2112, 1, 1]
    - [41, 29.178]
  - - [32, 2112, 1, 16]
    - [145, 459.151]
  - - [32, 2112, 1, 32]
    - [41, 915.46]
  - - [64, 2112, 1, 1]
    - [44, 52.3282]
  - - [64, 2112, 1, 16]
    - [34, 745.754]
  - - [64, 2112, 1, 32]
    - [159, 1544.78]
  - - [320, 2112, 1, 1]
    - [60, 127.023]
  - - [320, 2112, 1, 16]
    - [156, 2070.26]
  - - [320, 2112, 1, 32]
    - [60, 3968.23]
  - - [576, 2112, 1, 1]
    - [53, 149.265]
  - - [576, 2112, 1, 16]
    - [53, 2479.51]
  - - [576, 2112, 1, 32]
    - [53, 4835.82]
  - - [832, 2112, 1, 1]
    - [109, 154.74]
  - - [832, 2112, 1, 16]
    - [134, 2376.23]
  - - [832, 2112, 1, 32]
    - [134, 5329.85]
  - - [1088, 2112, 1, 1]
    - [98, 193.912]
  - - [1088, 2112, 1, 16]
    - [156, 3129.0]
  - - [1088, 2112, 1, 32]
    - [96, 5208.95]
  - - [1344, 2112, 1, 1]
    - [96, 169.058]
  - - [1344, 2112, 1, 16]
    - [156, 3221.02]
  - - [1344, 2112, 1, 32]
    - [134, 5442.86]
  - - [1600, 2112, 1, 1]
    - [156, 180.225]
  - - [1600, 2112, 1, 16]
    - [98, 3421.97]
  - - [1600, 2112, 1, 32]
    - [134, 5477.69]
  - - [1856, 2112, 1, 1]
    - [134, 181.66]
  - - [1856, 2112, 1, 16]
    - [156, 3583.88]
  - - [2112, 2112, 1, 1]
    - [156, 187.306]
  - - [2112, 2112, 1, 16]
    - [156, 3632.0]
  - - [2368, 2112, 1, 1]
    - [156, 192.872]
  - - [2368, 2112, 1, 16]
    - [156, 3774.5]
  - - [2624, 2112, 1, 1]
    - [156, 193.401]
  - - [2624, 2112, 1, 16]
    - [156, 3830.25]
  - - [2880, 2112, 1, 1]
    - [156, 195.527]
  - - [2880, 2112, 1, 16]
    - [156, 3121.12]
  - - [3136, 2112, 1, 1]
    - [98, 243.95]
  - - [3136, 2112, 1, 16]
    - [156, 3976.42]
  - - [3392, 2112, 1, 1]
    - [156, 187.797]
  - - [3392, 2112, 1, 16]
    - [156, 2984.87]
  - - [3648, 2112, 1, 1]
    - [156, 189.004]
  - - [3648, 2112, 1, 16]
    - [156, 2993.69]
  - - [3904, 2112, 1, 1]
    - [156, 190.89]
  - - [1, 2368, 1, 64]
    - [5, 57.27]
  - - [16, 2368, 1, 64]
    - [151, 908.906]
  - - [32, 2368, 1, 64]
    - [71, 1594.88]
  - - [1, 2368, 1, 1]
    - [2, 1.14068]
  - - [1, 2368, 1, 16]
    - [40, 16.1226]
  - - [1, 2368, 1, 32]
    - [2, 33.9089]
  - - [16, 2368, 1, 1]
    - [40, 18.4845]
  - - [16, 2368, 1, 16]
    - [40, 278]
  - - [16, 2368, 1, 32]
    - [39, 527.137]
  - - [32, 2368, 1, 1]
    - [41, 32.2551]
  - - [32, 2368, 1, 16]
    - [145, 457.515]
  - - [32, 2368, 1, 32]
    - [14, 898.086]
  - - [64, 2368, 1, 1]
    - [158, 57.1005]
  - - [64, 2368, 1, 16]
    - [157, 847.32]
  - - [64, 2368, 1, 32]
    - [159, 1763.51]
  - - [320, 2368, 1, 1]
    - [109, 145.723]
  - - [320, 2368, 1, 16]
    - [109, 2100.85]
  - - [320, 2368, 1, 32]
    - [95, 4330.06]
  - - [576, 2368, 1, 1]
    - [60, 160.467]
  - - [576, 2368, 1, 16]
    - [156, 2613.59]
  - - [576, 2368, 1, 32]
    - [60, 4536.15]
  - - [832, 2368, 1, 1]
    - [60, 153.655]
  - - [832, 2368, 1, 16]
    - [156, 2827.16]
  - - [832, 2368, 1, 32]
    - [134, 5035.22]
  - - [1088, 2368, 1, 1]
    - [109, 166.726]
  - - [1088, 2368, 1, 16]
    - [156, 3064.84]
  - - [1088, 2368, 1, 32]
    - [134, 5220.07]
  - - [1344, 2368, 1, 1]
    - [94, 176.259]
  - - [1344, 2368, 1, 16]
    - [156, 3499.76]
  - - [1344, 2368, 1, 32]
    - [134, 5518.29]
  - - [1600, 2368, 1, 1]
    - [156, 182.274]
  - - [1600, 2368, 1, 16]
    - [156, 3504.09]
  - - [1600, 2368, 1, 32]
    - [134, 5722.03]
  - - [1856, 2368, 1, 1]
    - [134, 185.893]
  - - [1856, 2368, 1, 16]
    - [156, 3596.94]
  - - [2112, 2368, 1, 1]
    - [156, 189.039]
  - - [2112, 2368, 1, 16]
    - [156, 3713.2]
  - - [2368, 2368, 1, 1]
    - [156, 193.293]
  - - [2368, 2368, 1, 16]
    - [156, 3850.59]
  - - [2624, 2368, 1, 1]
    - [156, 194.085]
  - - [2624, 2368, 1, 16]
    - [156, 3883.52]
  - - [2880, 2368, 1, 1]
    - [139, 183.9]
  - - [2880, 2368, 1, 16]
    - [156, 3975.13]
  - - [3136, 2368, 1, 1]
    - [94, 186.782]
  - - [3136, 2368, 1, 16]
    - [156, 3960.56]
  - - [3392, 2368, 1, 1]
    - [156, 190.224]
  - - [3648, 2368, 1, 1]
    - [156, 191.327]
  - - [3904, 2368, 1, 1]
    - [156, 193.083]
  - - [1, 2624, 1, 64]
    - [5, 57.708]
  - - [16, 2624, 1, 64]
    - [146, 1074.79]
  - - [32, 2624, 1, 64]
    - [71, 1621.83]
  - - [1, 2624, 1, 1]
    - [2, 1.18415]
  - - [1, 2624, 1, 16]
    - [2, 18.2801]
  - - [1, 2624, 1, 32]
    - [2, 35.0187]
  - - [16, 2624, 1, 1]
    - [40, 16.4643]
  - - [16, 2624, 1, 16]
    - [40, 253.488]
  - - [16, 2624, 1, 32]
    - [40, 548.362]
  - - [32, 2624, 1, 1]
    - [41, 33.3623]
  - - [32, 2624, 1, 16]
    - [145, 528.04]
  - - [32, 2624, 1, 32]
    - [41, 1016.68]
  - - [64, 2624, 1, 1]
    - [34, 53.313]
  - - [64, 2624, 1, 16]
    - [34, 895.659]
  - - [64, 2624, 1, 32]
    - [31, 1628.47]
  - - [320, 2624, 1, 1]
    - [159, 127.639]
  - - [320, 2624, 1, 16]
    - [134, 2051.13]
  - - [320, 2624, 1, 32]
    - [134, 4265.04]
  - - [576, 2624, 1, 1]
    - [95, 170.782]
  - - [576, 2624, 1, 16]
    - [156, 2449.93]
  - - [576, 2624, 1, 32]
    - [109, 4802.86]
  - - [832, 2624, 1, 1]
    - [156, 161.996]
  - - [832, 2624, 1, 16]
    - [156, 3091.21]
  - - [832, 2624, 1, 32]
    - [96, 5081.97]
  - - [1088, 2624, 1, 1]
    - [60, 196.214]
  - - [1088, 2624, 1, 16]
    - [156, 3216.8]
  - - [1088, 2624, 1, 32]
    - [134, 5353.75]
  - - [1344, 2624, 1, 1]
    - [156, 178.582]
  - - [1344, 2624, 1, 16]
    - [156, 3409.46]
  - - [1344, 2624, 1, 32]
    - [134, 5605.55]
  - - [1600, 2624, 1, 1]
    - [156, 187.668]
  - - [1600, 2624, 1, 16]
    - [109, 2864.86]
  - - [1856, 2624, 1, 1]
    - [134, 189.437]
  - - [1856, 2624, 1, 16]
    - [156, 3728.34]
  - - [2112, 2624, 1, 1]
    - [156, 192.917]
  - - [2112, 2624, 1, 16]
    - [156, 3855.23]
  - - [2368, 2624, 1, 1]
    - [94, 196.913]
  - - [2368, 2624, 1, 16]
    - [156, 3953.01]
  - - [2624, 2624, 1, 1]
    - [156, 185.866]
  - - [2624, 2624, 1, 16]
    - [156, 3977.11]
  - - [2880, 2624, 1, 1]
    - [156, 189.792]
  - - [2880, 2624, 1, 16]
    - [156, 4030.46]
  - - [3136, 2624, 1, 1]
    - [94, 190.291]
  - - [3392, 2624, 1, 1]
    - [156, 193.003]
  - - [3648, 2624, 1, 1]
    - [156, 194.111]
  - - [3904, 2624, 1, 1]
    - [156, 195.772]
  - - [1, 2880, 1, 64]
    - [5, 62.7351]
  - - [16, 2880, 1, 64]
    - [154, 1156.52]
  - - [32, 2880, 1, 64]
    - [135, 1782.99]
  - - [1, 2880, 1, 1]
    - [40, 1.12941]
  - - [1, 2880, 1, 16]
    - [2, 19.8249]
  - - [1, 2880, 1, 32]
    - [2, 38.4574]
  - - [16, 2880, 1, 1]
    - [40, 20.6643]
  - - [16, 2880, 1, 16]
    - [40, 289.129]
  - - [16, 2880, 1, 32]
    - [39, 517.389]
  - - [32, 2880, 1, 1]
    - [44, 34.1333]
  - - [32, 2880, 1, 16]
    - [145, 580.392]
  - - [32, 2880, 1, 32]
    - [44, 1121.05]
  - - [64, 2880, 1, 1]
    - [34, 56.7138]
  - - [64, 2880, 1, 16]
    - [34, 1016.94]
  - - [64, 2880, 1, 32]
    - [32, 1921.95]
  - - [320, 2880, 1, 1]
    - [48, 141.785]
  - - [320, 2880, 1, 16]
    - [48, 2200.84]
  - - [320, 2880, 1, 32]
    - [134, 4572.28]
  - - [576, 2880, 1, 1]
    - [95, 171.905]
  - - [576, 2880, 1, 16]
    - [95, 2694.63]
  - - [576, 2880, 1, 32]
    - [134, 4846.03]
  - - [832, 2880, 1, 1]
    - [109, 170.847]
  - - [832, 2880, 1, 16]
    - [95, 3067.08]
  - - [832, 2880, 1, 32]
    - [95, 6233.91]
  - - [1088, 2880, 1, 1]
    - [96, 176.092]
  - - [1088, 2880, 1, 16]
    - [156, 2850.19]
  - - [1088, 2880, 1, 32]
    - [94, 5500.58]
  - - [1344, 2880, 1, 1]
    - [94, 181.738]
  - - [1344, 2880, 1, 16]
    - [156, 3579.86]
  - - [1344, 2880, 1, 32]
    - [134, 5790.66]
  - - [1600, 2880, 1, 1]
    - [156, 190.155]
  - - [1600, 2880, 1, 16]
    - [156, 2926.92]
  - - [1856, 2880, 1, 1]
    - [134, 191.589]
  - - [1856, 2880, 1, 16]
    - [156, 3718.46]
  - - [2112, 2880, 1, 1]
    - [156, 193.851]
  - - [2112, 2880, 1, 16]
    - [156, 3079.8]
  - - [2368, 2880, 1, 1]
    - [96, 184.362]
  - - [2368, 2880, 1, 16]
    - [156, 3918.04]
  - - [2624, 2880, 1, 1]
    - [156, 189.093]
  - - [2624, 2880, 1, 16]
    - [156, 3983.98]
  - - [2880, 2880, 1, 1]
    - [156, 191.673]
  - - [3136, 2880, 1, 1]
    - [94, 192.272]
  - - [3392, 2880, 1, 1]
    - [156, 194.828]
  - - [3648, 2880, 1, 1]
    - [156, 195.68]
  - - [3904, 2880, 1, 1]
    - [156, 196.906]
  - - [1, 3136, 1, 64]
    - [5, 66.9026]
  - - [16, 3136, 1, 64]
    - [70, 1038.18]
  - - [32, 3136, 1, 64]
    - [15, 2105.75]
  - - [1, 3136, 1, 1]
    - [2, 1.10035]
  - - [1, 3136, 1, 16]
    - [2, 21.3973]
  - - [1, 3136, 1, 32]
    - [40, 38.5969]
  - - [16, 3136, 1, 1]
    - [40, 19.2985]
  - - [16, 3136, 1, 16]
    - [40, 314.83]
  - - [16, 3136, 1, 32]
    - [39, 629.66]
  - - [32, 3136, 1, 1]
    - [41, 31.36]
  - - [32, 3136, 1, 16]
    - [145, 615.126]
  - - [32, 3136, 1, 32]
    - [41, 1189.72]
  - - [64, 3136, 1, 1]
    - [157, 61.7551]
  - - [64, 3136, 1, 16]
    - [157, 1026.65]
  - - [64, 3136, 1, 32]
    - [157, 1976.16]
  - - [320, 3136, 1, 1]
    - [58, 133.359]
  - - [320, 3136, 1, 16]
    - [58, 2073.76]
  - - [320, 3136, 1, 32]
    - [98, 4163.75]
  - - [576, 3136, 1, 1]
    - [60, 180.634]
  - - [576, 3136, 1, 16]
    - [60, 2726.54]
  - - [576, 3136, 1, 32]
    - [134, 5453.09]
  - - [832, 3136, 1, 1]
    - [60, 196.177]
  - - [832, 3136, 1, 16]
    - [134, 2633.1]
  - - [832, 3136, 1, 32]
    - [134, 5279.03]
  - - [1088, 3136, 1, 1]
    - [60, 209.323]
  - - [1088, 3136, 1, 16]
    - [156, 3369.84]
  - - [1088, 3136, 1, 32]
    - [94, 5507.48]
  - - [1344, 3136, 1, 1]
    - [156, 187.224]
  - - [1344, 3136, 1, 16]
    - [156, 3530.71]
  - - [1600, 3136, 1, 1]
    - [156, 191.691]
  - - [1600, 3136, 1, 16]
    - [134, 2936.31]
  - - [1856, 3136, 1, 1]
    - [156, 193.029]
  - - [1856, 3136, 1, 16]
    - [156, 3816.67]
  - - [2112, 3136, 1, 1]
    - [156, 179.482]
  - - [2112, 3136, 1, 16]
    - [156, 3910.4]
  - - [2368, 3136, 1, 1]
    - [156, 190.441]
  - - [2368, 3136, 1, 16]
    - [156, 3987.14]
  - - [2624, 3136, 1, 1]
    - [156, 191.895]
  - - [2880, 3136, 1, 1]
    - [156, 194.134]
  - - [3136, 3136, 1, 1]
    - [94, 194.513]
  - - [3392, 3136, 1, 1]
    - [156, 196.663]
  - - [3648, 3136, 1, 1]
    - [156, 197.596]
  - - [3904, 3136, 1, 1]
    - [156, 198.791]
  - - [1, 3392, 1, 64]
    - [5, 70.9417]
  - - [16, 3392, 1, 64]
    - [70, 1114.01]
  - - [32, 3392, 1, 64]
    - [71, 1891.38]
  - - [1, 3392, 1, 1]
    - [2, 1.49432]
  - - [1, 3392, 1, 16]
    - [2, 22.7706]
  - - [1, 3392, 1, 32]
    - [2, 44.0092]
  - - [16, 3392, 1, 1]
    - [40, 24.0264]
  - - [16, 3392, 1, 16]
    - [40, 333.982]
  - - [16, 3392, 1, 32]
    - [39, 694.682]
  - - [32, 3392, 1, 1]
    - [44, 32.4012]
  - - [32, 3392, 1, 16]
    - [44, 598.863]
  - - [32, 3392, 1, 32]
    - [44, 1177.43]
  - - [64, 3392, 1, 1]
    - [157, 65.7842]
  - - [64, 3392, 1, 16]
    - [157, 1006.78]
  - - [64, 3392, 1, 32]
    - [157, 2105.1]
  - - [320, 3392, 1, 1]
    - [58, 144.725]
  - - [320, 3392, 1, 16]
    - [58, 2240.91]
  - - [320, 3392, 1, 32]
    - [134, 4036.96]
  - - [576, 3392, 1, 1]
    - [60, 172.902]
  - - [576, 3392, 1, 16]
    - [156, 2778.73]
  - - [576, 3392, 1, 32]
    - [134, 5366.64]
  - - [832, 3392, 1, 1]
    - [60, 171.069]
  - - [832, 3392, 1, 16]
    - [156, 3168.72]
  - - [832, 3392, 1, 32]
    - [134, 5405.45]
  - - [1088, 3392, 1, 1]
    - [96, 179.133]
  - - [1088, 3392, 1, 16]
    - [156, 3453.1]
  - - [1088, 3392, 1, 32]
    - [134, 5630.51]
  - - [1344, 3392, 1, 1]
    - [156, 187.778]
  - - [1344, 3392, 1, 16]
    - [156, 2984.3]
  - - [1600, 3392, 1, 1]
    - [156, 194.828]
  - - [1600, 3392, 1, 16]
    - [156, 3718.85]
  - - [1856, 3392, 1, 1]
    - [134, 194.362]
  - - [1856, 3392, 1, 16]
    - [156, 3822.73]
  - - [2112, 3392, 1, 1]
    - [156, 186.494]
  - - [2112, 3392, 1, 16]
    - [156, 3973.05]
  - - [2368, 3392, 1, 1]
    - [156, 191.618]
  - - [2624, 3392, 1, 1]
    - [156, 193.45]
  - - [2880, 3392, 1, 1]
    - [156, 195.195]
  - - [3136, 3392, 1, 1]
    - [94, 195.93]
  - - [3392, 3392, 1, 1]
    - [156, 198.305]
  - - [3648, 3392, 1, 1]
    - [156, 198.891]
  - - [3904, 3392, 1, 1]
    - [156, 199.893]
  - - [1, 3648, 1, 64]
    - [5, 67.673]
  - - [16, 3648, 1, 64]
    - [70, 1159.57]
  - - [32, 3648, 1, 64]
    - [71, 2027.76]
  - - [1, 3648, 1, 1]
    - [2, 1.60411]
  - - [1, 3648, 1, 16]
    - [2, 24.031]
  - - [1, 3648, 1, 32]
    - [40, 44.8985]
  - - [16, 3648, 1, 1]
    - [40, 25.6677]
  - - [16, 3648, 1, 16]
    - [40, 366.231]
  - - [16, 3648, 1, 32]
    - [39, 732.461]
  - - [32, 3648, 1, 1]
    - [44, 41.6914]
  - - [32, 3648, 1, 16]
    - [44, 667.063]
  - - [32, 3648, 1, 32]
    - [44, 1409.64]
  - - [64, 3648, 1, 1]
    - [48, 80.1284]
  - - [64, 3648, 1, 16]
    - [48, 1205.02]
  - - [64, 3648, 1, 32]
    - [134, 2449.54]
  - - [320, 3648, 1, 1]
    - [48, 139.804]
  - - [320, 3648, 1, 16]
    - [156, 2171.41]
  - - [320, 3648, 1, 32]
    - [159, 4151.15]
  - - [576, 3648, 1, 1]
    - [98, 161.313]
  - - [576, 3648, 1, 16]
    - [156, 2601.71]
  - - [576, 3648, 1, 32]
    - [53, 5924.22]
  - - [832, 3648, 1, 1]
    - [156, 173.792]
  - - [832, 3648, 1, 16]
    - [156, 3303.55]
  - - [832, 3648, 1, 32]
    - [134, 5433.25]
  - - [1088, 3648, 1, 1]
    - [94, 185.169]
  - - [1088, 3648, 1, 16]
    - [156, 3498.86]
  - - [1344, 3648, 1, 1]
    - [94, 191.842]
  - - [1344, 3648, 1, 16]
    - [156, 3735.55]
  - - [1600, 3648, 1, 1]
    - [156, 194.923]
  - - [1600, 3648, 1, 16]
    - [97, 3811.79]
  - - [1856, 3648, 1, 1]
    - [134, 183.209]
  - - [1856, 3648, 1, 16]
    - [156, 3868.96]
  - - [2112, 3648, 1, 1]
    - [156, 190.097]
  - - [2112, 3648, 1, 16]
    - [156, 3995.89]
  - - [2368, 3648, 1, 1]
    - [156, 194.231]
  - - [2624, 3648, 1, 1]
    - [156, 195.499]
  - - [2880, 3648, 1, 1]
    - [156, 197.133]
  - - [3136, 3648, 1, 1]
    - [156, 196.944]
  - - [3392, 3648, 1, 1]
    - [156, 199.457]
  - - [3648, 3648, 1, 1]
    - [156, 200.5]
  - - [3904, 3648, 1, 1]
    - [156, 201.588]
  - - [1, 3904, 1, 64]
    - [5, 71.4597]
  - - [16, 3904, 1, 64]
    - [70, 1089.33]
  - - [32, 3904, 1, 64]
    - [71, 1961.19]
  - - [1, 3904, 1, 1]
    - [2, 1.57618]
  - - [1, 3904, 1, 16]
    - [2, 23.9133]
  - - [1, 3904, 1, 32]
    - [40, 40.96]
  - - [16, 3904, 1, 1]
    - [40, 25.5635]
  - - [16, 3904, 1, 16]
    - [40, 322.395]
  - - [16, 3904, 1, 32]
    - [40, 655.36]
  - - [32, 3904, 1, 1]
    - [44, 45.7919]
  - - [32, 3904, 1, 16]
    - [145, 644.79]
  - - [32, 3904, 1, 32]
    - [41, 1249.28]
  - - [64, 3904, 1, 1]
    - [32, 77.8682]
  - - [64, 3904, 1, 16]
    - [32, 1136.05]
  - - [64, 3904, 1, 32]
    - [32, 2087.42]
  - - [320, 3904, 1, 1]
    - [60, 148.724]
  - - [320, 3904, 1, 16]
    - [156, 2282.79]
  - - [320, 3904, 1, 32]
    - [159, 4290.84]
  - - [576, 3904, 1, 1]
    - [109, 185.843]
  - - [576, 3904, 1, 16]
    - [156, 2937.08]
  - - [576, 3904, 1, 32]
    - [94, 5173.3]
  - - [832, 3904, 1, 1]
    - [109, 179.008]
  - - [832, 3904, 1, 16]
    - [95, 3248.13]
  - - [832, 3904, 1, 32]
    - [134, 5426.55]
  - - [1088, 3904, 1, 1]
    - [96, 187.234]
  - - [1088, 3904, 1, 16]
    - [156, 3476.26]
  - - [1344, 3904, 1, 1]
    - [156, 193.138]
  - - [1344, 3904, 1, 16]
    - [156, 3674.03]
  - - [1600, 3904, 1, 1]
    - [156, 198.045]
  - - [1600, 3904, 1, 16]
    - [156, 3807.33]
  - - [1856, 3904, 1, 1]
    - [134, 188.783]
  - - [1856, 3904, 1, 16]
    - [156, 3929.94]
  - - [2112, 3904, 1, 1]
    - [156, 190.6]
  - - [2368, 3904, 1, 1]
    - [156, 194.816]
  - - [2624, 3904, 1, 1]
    - [156, 196.532]
  - - [2880, 3904, 1, 1]
    - [156, 197.978]
  - - [3136, 3904, 1, 1]
    - [156, 197.904]
  - - [3392, 3904, 1, 1]
    - [156, 201.074]
  - - [3648, 3904, 1, 1]
    - [156, 201.437]
  - - [3904, 3904, 1, 1]
    - [156, 202.456]
  - - [64, 1, 1, 256]
    - [129, 6.99951]
  - - [64, 16, 1, 256]
    - [153, 114.077]
  - - [64, 32, 1, 256]
    - [129, 213.995]
  - - [1, 64, 1, 256]
    - [4, 6.46372]
  - - [16, 64, 1, 256]
    - [153, 106.998]
  - - [32, 64, 1, 256]
    - [129, 232.279]
  - - [320, 1, 1, 256]
    - [129, 32.1255]
  - - [320, 16, 1, 256]
    - [140, 509.93]
  - - [320, 32, 1, 256]
    - [140, 1009.49]
  - - [576, 1, 1, 256]
    - [62, 52.1955]
  - - [576, 16, 1, 256]
    - [135, 925.214]
  - - [576, 32, 1, 256]
    - [140, 1647.44]
  - - [832, 1, 1, 256]
    - [152, 80.3743]
  - - [832, 16, 1, 256]
    - [113, 1127.93]
  - - [832, 32, 1, 256]
    - [113, 2139.69]
  - - [1088, 1, 1, 256]
    - [113, 84.9631]
  - - [1088, 16, 1, 256]
    - [113, 1351]
  - - [1088, 32, 1, 256]
    - [113, 2530.46]
  - - [1344, 1, 1, 256]
    - [113, 95.3206]
  - - [1344, 16, 1, 256]
    - [113, 1523.9]
  - - [1344, 32, 1, 256]
    - [144, 2849.14]
  - - [1600, 1, 1, 256]
    - [113, 105.82]
  - - [1600, 16, 1, 256]
    - [113, 1688.15]
  - - [1600, 32, 1, 256]
    - [15, 3125.34]
  - - [1856, 1, 1, 256]
    - [113, 114.762]
  - - [1856, 16, 1, 256]
    - [113, 1817.84]
  - - [1856, 32, 1, 256]
    - [82, 3368.33]
  - - [2112, 1, 1, 256]
    - [113, 122.296]
  - - [2112, 16, 1, 256]
    - [113, 1926.48]
  - - [2112, 32, 1, 256]
    - [82, 3598.4]
  - - [2368, 1, 1, 256]
    - [8, 128.673]
  - - [2368, 16, 1, 256]
    - [10, 3233.11]
  - - [2368, 32, 1, 256]
    - [82, 3795.34]
  - - [2624, 1, 1, 256]
    - [103, 130.254]
  - - [2624, 16, 1, 256]
    - [7, 3161.15]
  - - [2624, 32, 1, 256]
    - [82, 3923.74]
  - - [2880, 1, 1, 256]
    - [7, 207.685]
  - - [2880, 16, 1, 256]
    - [7, 2166.95]
  - - [2880, 32, 1, 256]
    - [82, 4110.76]
  - - [3136, 1, 1, 256]
    - [8, 142.173]
  - - [3136, 16, 1, 256]
    - [7, 3519.19]
  - - [3136, 32, 1, 256]
    - [19, 6044.73]
  - - [3392, 1, 1, 256]
    - [10, 241.209]
  - - [3392, 16, 1, 256]
    - [10, 3969.61]
  - - [3392, 32, 1, 256]
    - [82, 4230.53]
  - - [3648, 1, 1, 256]
    - [10, 259.413]
  - - [3648, 16, 1, 256]
    - [7, 2333.74]
  - - [3648, 32, 1, 256]
    - [27, 7201.06]
  - - [3904, 1, 1, 256]
    - [103, 151.518]
  - - [3904, 16, 1, 256]
    - [103, 2342.91]
  - - [3904, 32, 1, 256]
    - [127, 4244.41]
  - - [1, 320, 1, 256]
    - [4, 31.1271]
  - - [16, 320, 1, 256]
    - [151, 468.114]
  - - [32, 320, 1, 256]
    - [153, 1039.56]
  - - [1, 576, 1, 256]
    - [4, 53.1907]
  - - [16, 576, 1, 256]
    - [5, 827.484]
  - - [32, 576, 1, 256]
    - [65, 1651.05]
  - - [1, 832, 1, 256]
    - [5, 66.56]
  - - [16, 832, 1, 256]
    - [5, 1091.37]
  - - [32, 832, 1, 256]
    - [65, 2134]
  - - [1, 1088, 1, 256]
    - [5, 82.342]
  - - [16, 1088, 1, 256]
    - [5, 1295.58]
  - - [32, 1088, 1, 256]
    - [65, 2509.03]
  - - [1, 1344, 1, 256]
    - [5, 91.4817]
  - - [16, 1344, 1, 256]
    - [5, 1433.12]
  - - [32, 1344, 1, 256]
    - [14, 3286.58]
  - - [1, 1600, 1, 256]
    - [5, 103.544]
  - - [16, 1600, 1, 256]
    - [5, 1616.93]
  - - [32, 1600, 1, 256]
    - [65, 3015.15]
  - - [1, 1856, 1, 256]
    - [5, 135.753]
  - - [16, 1856, 1, 256]
    - [70, 1751.09]
  - - [32, 1856, 1, 256]
    - [71, 3199.39]
  - - [1, 2112, 1, 256]
    - [5, 119.428]
  - - [16, 2112, 1, 256]
    - [70, 1864.56]
  - - [32, 2112, 1, 256]
    - [71, 3408.12]
  - - [1, 2368, 1, 256]
    - [5, 125.349]
  - - [16, 2368, 1, 256]
    - [70, 1951.25]
  - - [32, 2368, 1, 256]
    - [71, 3598.71]
  - - [1, 2624, 1, 256]
    - [40, 172.242]
  - - [16, 2624, 1, 256]
    - [70, 1953.87]
  - - [32, 2624, 1, 256]
    - [44, 3758.67]
  - - [1, 2880, 1, 256]
    - [40, 169.49]
  - - [16, 2880, 1, 256]
    - [40, 2071.1]
  - - [32, 2880, 1, 256]
    - [44, 5551.28]
  - - [1, 3136, 1, 256]
    - [40, 188.898]
  - - [16, 3136, 1, 256]
    - [70, 3251.91]
  - - [32, 3136, 1, 256]
    - [44, 4034.57]
  - - [1, 3392, 1, 256]
    - [5, 214.408]
  - - [16, 3392, 1, 256]
    - [39, 3517.38]
  - - [32, 3392, 1, 256]
    - [44, 4074.66]
  - - [1, 3648, 1, 256]
    - [40, 227.778]
  - - [16, 3648, 1, 256]
    - [39, 3782.84]
  - - [32, 3648, 1, 256]
    - [44, 6949.86]
  - - [1, 3904, 1, 256]
    - [40, 208.213]
  - - [16, 3904, 1, 256]
    - [40, 2213.53]
  - - [32, 3904, 1, 256]
    - [41, 5710.99]
  - - [64, 1, 1, 512]
    - [129, 11.4975]
  - - [64, 16, 1, 512]
    - [129, 195.162]
  - - [64, 32, 1, 512]
    - [129, 386.507]
  - - [1, 64, 1, 512]
    - [4, 10.0497]
  - - [16, 64, 1, 512]
    - [153, 189.383]
  - - [32, 64, 1, 512]
    - [153, 381.347]
  - - [320, 1, 1, 512]
    - [140, 52.5099]
  - - [320, 16, 1, 512]
    - [140, 846.848]
  - - [320, 32, 1, 512]
    - [148, 1659.13]
  - - [576, 1, 1, 512]
    - [140, 84.1944]
  - - [576, 16, 1, 512]
    - [140, 1364.13]
  - - [576, 32, 1, 512]
    - [140, 2631.27]
  - - [832, 1, 1, 512]
    - [140, 106.491]
  - - [832, 16, 1, 512]
    - [140, 1709.03]
  - - [832, 32, 1, 512]
    - [113, 3180.08]
  - - [1088, 1, 1, 512]
    - [113, 123.425]
  - - [1088, 16, 1, 512]
    - [113, 1965.57]
  - - [1088, 32, 1, 512]
    - [113, 3737.86]
  - - [1344, 1, 1, 512]
    - [113, 134.09]
  - - [1344, 16, 1, 512]
    - [113, 2139.61]
  - - [1344, 32, 1, 512]
    - [144, 4029.74]
  - - [1600, 1, 1, 512]
    - [113, 144.706]
  - - [1600, 16, 1, 512]
    - [113, 2302.97]
  - - [1600, 32, 1, 512]
    - [144, 4350.71]
  - - [1856, 1, 1, 512]
    - [113, 152.702]
  - - [1856, 16, 1, 512]
    - [113, 2414.53]
  - - [1856, 32, 1, 512]
    - [113, 4532.35]
  - - [2112, 1, 1, 512]
    - [113, 159.077]
  - - [2112, 16, 1, 512]
    - [113, 2514.05]
  - - [2112, 32, 1, 512]
    - [82, 4762.13]
  - - [2368, 1, 1, 512]
    - [62, 163.886]
  - - [2368, 16, 1, 512]
    - [142, 2583.09]
  - - [2368, 32, 1, 512]
    - [82, 4892.68]
  - - [2624, 1, 1, 512]
    - [103, 165.986]
  - - [2624, 16, 1, 512]
    - [142, 2598.2]
  - - [2624, 32, 1, 512]
    - [82, 4937.39]
  - - [2880, 1, 1, 512]
    - [8, 170.716]
  - - [2880, 16, 1, 512]
    - [7, 2673.06]
  - - [2880, 32, 1, 512]
    - [82, 5064.48]
  - - [3136, 1, 1, 512]
    - [10, 324.37]
  - - [3136, 16, 1, 512]
    - [7, 2735.82]
  - - [3136, 32, 1, 512]
    - [20, 8354.51]
  - - [3392, 1, 1, 512]
    - [10, 354.429]
  - - [3392, 16, 1, 512]
    - [7, 5670.87]
  - - [3392, 32, 1, 512]
    - [82, 5289.24]
  - - [3648, 1, 1, 512]
    - [10, 377.328]
  - - [3648, 16, 1, 512]
    - [7, 6161.74]
  - - [3648, 32, 1, 512]
    - [82, 5395.12]
  - - [3904, 1, 1, 512]
    - [103, 363.427]
  - - [3904, 16, 1, 512]
    - [103, 2853.34]
  - - [3904, 32, 1, 512]
    - [83, 8945.89]
  - - [1, 320, 1, 512]
    - [4, 47.8364]
  - - [16, 320, 1, 512]
    - [70, 761.194]
  - - [32, 320, 1, 512]
    - [65, 1536.88]
  - - [1, 576, 1, 512]
    - [4, 77.7461]
  - - [16, 576, 1, 512]
    - [70, 1238.52]
  - - [32, 576, 1, 512]
    - [65, 2470.61]
  - - [1, 832, 1, 512]
    - [5, 101.494]
  - - [16, 832, 1, 512]
    - [70, 1621.29]
  - - [32, 832, 1, 512]
    - [65, 3123.94]
  - - [1, 1088, 1, 512]
    - [5, 120.687]
  - - [16, 1088, 1, 512]
    - [70, 1914.67]
  - - [32, 1088, 1, 512]
    - [65, 3617.71]
  - - [1, 1344, 1, 512]
    - [5, 134.858]
  - - [16, 1344, 1, 512]
    - [70, 2133.09]
  - - [32, 1344, 1, 512]
    - [71, 3976.2]
  - - [1, 1600, 1, 512]
    - [5, 145.28]
  - - [16, 1600, 1, 512]
    - [70, 2283.05]
  - - [32, 1600, 1, 512]
    - [65, 4275.46]
  - - [1, 1856, 1, 512]
    - [5, 153.399]
  - - [16, 1856, 1, 512]
    - [70, 3495.25]
  - - [32, 1856, 1, 512]
    - [71, 4428.67]
  - - [1, 2112, 1, 512]
    - [5, 158.07]
  - - [16, 2112, 1, 512]
    - [5, 3761.2]
  - - [32, 2112, 1, 512]
    - [71, 6528.87]
  - - [1, 2368, 1, 512]
    - [5, 161.053]
  - - [16, 2368, 1, 512]
    - [70, 2506.74]
  - - [32, 2368, 1, 512]
    - [71, 4702.89]
  - - [1, 2624, 1, 512]
    - [40, 237.785]
  - - [16, 2624, 1, 512]
    - [70, 2538.46]
  - - [32, 2624, 1, 512]
    - [44, 7225.48]
  - - [1, 2880, 1, 512]
    - [40, 260.984]
  - - [16, 2880, 1, 512]
    - [5, 4369.07]
  - - [32, 2880, 1, 512]
    - [44, 8065.97]
  - - [1, 3136, 1, 512]
    - [5, 289.303]
  - - [16, 3136, 1, 512]
    - [5, 4670.93]
  - - [32, 3136, 1, 512]
    - [44, 5023.15]
  - - [1, 3392, 1, 512]
    - [5, 294.357]
  - - [16, 3392, 1, 512]
    - [40, 4962.01]
  - - [32, 3392, 1, 512]
    - [44, 9110.58]
  - - [1, 3648, 1, 512]
    - [5, 175.035]
  - - [16, 3648, 1, 512]
    - [5, 2711.46]
  - - [32, 3648, 1, 512]
    - [44, 9879.15]
  - - [1, 3904, 1, 512]
    - [40, 296.126]
  - - [16, 3904, 1, 512]
    - [39, 4882.68]
  - - [32, 3904, 1, 512]
    - [44, 5163.23]
  - - [64, 1, 1, 1024]
    - [153, 18.2109]
  - - [64, 16, 1, 1024]
    - [153, 291.368]
  - - [64, 32, 1, 1024]
    - [153, 572.946]
  - - [1, 64, 1, 1024]
    - [4, 14.0938]
  - - [16, 64, 1, 1024]
    - [64, 267.002]
  - - [32, 64, 1, 1024]
    - [153, 529.451]
  - - [320, 1, 1, 1024]
    - [140, 80.0902]
  - - [320, 16, 1, 1024]
    - [136, 1275.1]
  - - [320, 32, 1, 1024]
    - [148, 2536.48]
  - - [576, 1, 1, 1024]
    - [140, 122.623]
  - - [576, 16, 1, 1024]
    - [140, 1962.28]
  - - [576, 32, 1, 1024]
    - [140, 3826.02]
  - - [832, 1, 1, 1024]
    - [140, 145.179]
  - - [832, 16, 1, 1024]
    - [140, 2315.35]
  - - [832, 32, 1, 1024]
    - [112, 5398.61]
  - - [1088, 1, 1, 1024]
    - [137, 259.096]
  - - [1088, 16, 1, 1024]
    - [152, 4145.53]
  - - [1088, 32, 1, 1024]
    - [113, 4871.7]
  - - [1344, 1, 1, 1024]
    - [113, 167.235]
  - - [1344, 16, 1, 1024]
    - [113, 2653.45]
  - - [1344, 32, 1, 1024]
    - [113, 5025.57]
  - - [1600, 1, 1, 1024]
    - [113, 177.182]
  - - [1600, 16, 1, 1024]
    - [113, 2806.47]
  - - [1600, 32, 1, 1024]
    - [113, 5359.52]
  - - [1856, 1, 1, 1024]
    - [62, 183.304]
  - - [1856, 16, 1, 1024]
    - [113, 2891.89]
  - - [1856, 32, 1, 1024]
    - [144, 5547.19]
  - - [2112, 1, 1, 1024]
    - [62, 376.12]
  - - [2112, 16, 1, 1024]
    - [62, 2998.31]
  - - [2112, 32, 1, 1024]
    - [144, 5726.65]
  - - [2368, 1, 1, 1024]
    - [62, 194.224]
  - - [2368, 16, 1, 1024]
    - [62, 3068.34]
  - - [2368, 32, 1, 1024]
    - [82, 10485.8]
  - - [2624, 1, 1, 1024]
    - [103, 193.868]
  - - [2624, 16, 1, 1024]
    - [142, 3040.94]
  - - [2624, 32, 1, 1024]
    - [103, 5862.58]
  - - [2880, 1, 1, 1024]
    - [8, 197.511]
  - - [2880, 16, 1, 1024]
    - [7, 6553.6]
  - - [2880, 32, 1, 1024]
    - [103, 5941.75]
  - - [3136, 1, 1, 1024]
    - [62, 442.933]
  - - [3136, 16, 1, 1024]
    - [7, 7136.14]
  - - [3136, 32, 1, 1024]
    - [20, 10874.1]
  - - [3392, 1, 1, 1024]
    - [7, 472.573]
  - - [3392, 16, 1, 1024]
    - [7, 7665.45]
  - - [3392, 32, 1, 1024]
    - [103, 6125.88]
  - - [3648, 1, 1, 1024]
    - [7, 504.804]
  - - [3648, 16, 1, 1024]
    - [7, 8131.81]
  - - [3648, 32, 1, 1024]
    - [20, 12451.8]
  - - [3904, 1, 1, 1024]
    - [103, 506.037]
  - - [3904, 16, 1, 1024]
    - [103, 7394.58]
  - - [1, 320, 1, 1024]
    - [4, 64.3805]
  - - [16, 320, 1, 1024]
    - [62, 1082.13]
  - - [32, 320, 1, 1024]
    - [62, 2146.05]
  - - [1, 576, 1, 1024]
    - [4, 103.067]
  - - [16, 576, 1, 1024]
    - [65, 1624.25]
  - - [32, 576, 1, 1024]
    - [65, 3282.28]
  - - [1, 832, 1, 1024]
    - [4, 129.421]
  - - [16, 832, 1, 1024]
    - [65, 2057.37]
  - - [32, 832, 1, 1024]
    - [65, 4140.68]
  - - [1, 1088, 1, 1024]
    - [4, 148.414]
  - - [16, 1088, 1, 1024]
    - [5, 3792.72]
  - - [32, 1088, 1, 1024]
    - [65, 4623.6]
  - - [1, 1344, 1, 1024]
    - [5, 159.24]
  - - [16, 1344, 1, 1024]
    - [70, 3495.25]
  - - [32, 1344, 1, 1024]
    - [65, 4863]
  - - [1, 1600, 1, 1024]
    - [5, 248.242]
  - - [16, 1600, 1, 1024]
    - [70, 4194.3]
  - - [32, 1600, 1, 1024]
    - [65, 5120.01]
  - - [1, 1856, 1, 1024]
    - [5, 178.271]
  - - [16, 1856, 1, 1024]
    - [5, 4607.38]
  - - [32, 1856, 1, 1024]
    - [65, 5302.8]
  - - [1, 2112, 1, 1024]
    - [5, 325.216]
  - - [16, 2112, 1, 1024]
    - [5, 5406.72]
  - - [32, 2112, 1, 1024]
    - [71, 8705.16]
  - - [1, 2368, 1, 1024]
    - [5, 356.593]
  - - [16, 2368, 1, 1024]
    - [5, 5968.82]
  - - [32, 2368, 1, 1024]
    - [71, 9639.08]
  - - [1, 2624, 1, 1024]
    - [5, 190.338]
  - - [16, 2624, 1, 1024]
    - [5, 2970.02]
  - - [32, 2624, 1, 1024]
    - [71, 5603.82]
  - - [1, 2880, 1, 1024]
    - [5, 187.651]
  - - [16, 2880, 1, 1024]
    - [70, 2930.58]
  - - [32, 2880, 1, 1024]
    - [17, 5605.39]
  - - [1, 3136, 1, 1024]
    - [5, 360.816]
  - - [16, 3136, 1, 1024]
    - [70, 6044.73]
  - - [32, 3136, 1, 1024]
    - [17, 5747.27]
  - - [1, 3392, 1, 1024]
    - [5, 191.411]
  - - [16, 3392, 1, 1024]
    - [70, 6576.87]
  - - [32, 3392, 1, 1024]
    - [17, 5797.62]
  - - [1, 3648, 1, 1024]
    - [5, 194.758]
  - - [16, 3648, 1, 1024]
    - [5, 3036.15]
  - - [32, 3648, 1, 1024]
    - [17, 5864.79]
  - - [1, 3904, 1, 1024]
    - [5, 194.289]
  - - [16, 3904, 1, 1024]
    - [5, 3032.71]
  - - [64, 1, 1, 2048]
    - [64, 31.2076]
  - - [64, 16, 1, 2048]
    - [64, 505.338]
  - - [64, 32, 1, 2048]
    - [64, 998.644]
  - - [1, 64, 1, 2048]
    - [3, 16.1408]
  - - [16, 64, 1, 2048]
    - [64, 446.203]
  - - [32, 64, 1, 2048]
    - [64, 986.895]
  - - [320, 1, 1, 2048]
    - [136, 109.442]
  - - [320, 16, 1, 2048]
    - [153, 1696.64]
  - - [320, 32, 1, 2048]
    - [153, 3279.36]
  - - [576, 1, 1, 2048]
    - [140, 157.141]
  - - [576, 16, 1, 2048]
    - [148, 2432.94]
  - - [576, 32, 1, 2048]
    - [148, 4688.22]
  - - [832, 1, 1, 2048]
    - [140, 177.995]
  - - [832, 16, 1, 2048]
    - [140, 4469.34]
  - - [832, 32, 1, 2048]
    - [140, 5197.36]
  - - [1088, 1, 1, 2048]
    - [137, 189.617]
  - - [1088, 16, 1, 2048]
    - [140, 5704.25]
  - - [1088, 32, 1, 2048]
    - [81, 8590.74]
  - - [1344, 1, 1, 2048]
    - [137, 194.622]
  - - [1344, 16, 1, 2048]
    - [137, 3069.57]
  - - [1344, 32, 1, 2048]
    - [113, 5865.49]
  - - [1600, 1, 1, 2048]
    - [62, 201.287]
  - - [1600, 16, 1, 2048]
    - [62, 3171.59]
  - - [1600, 32, 1, 2048]
    - [144, 6119.26]
  - - [1856, 1, 1, 2048]
    - [62, 206.621]
  - - [1856, 16, 1, 2048]
    - [62, 3253.19]
  - - [1856, 32, 1, 2048]
    - [113, 6236.07]
  - - [2112, 1, 1, 2048]
    - [62, 211.789]
  - - [2112, 16, 1, 2048]
    - [62, 3336.98]
  - - [2368, 1, 1, 2048]
    - [62, 541.862]
  - - [2368, 16, 1, 2048]
    - [62, 8767.75]
  - - [2624, 1, 1, 2048]
    - [62, 212.182]
  - - [2624, 16, 1, 2048]
    - [62, 3348.08]
  - - [2880, 1, 1, 2048]
    - [7, 495.65]
  - - [2880, 16, 1, 2048]
    - [7, 8031.65]
  - - [3136, 1, 1, 2048]
    - [7, 551.29]
  - - [3136, 16, 1, 2048]
    - [62, 8782.94]
  - - [3392, 1, 1, 2048]
    - [7, 586.229]
  - - [3392, 16, 1, 2048]
    - [62, 9340.26]
  - - [3648, 1, 1, 2048]
    - [62, 622.592]
  - - [3648, 16, 1, 2048]
    - [62, 10045.2]
  - - [3904, 1, 1, 2048]
    - [7, 207.504]
  - - [1, 320, 1, 2048]
    - [3, 78.1871]
  - - [16, 320, 1, 2048]
    - [64, 1318.11]
  - - [32, 320, 1, 2048]
    - [64, 2596.78]
  - - [1, 576, 1, 2048]
    - [4, 112.932]
  - - [16, 576, 1, 2048]
    - [62, 1887.98]
  - - [32, 576, 1, 2048]
    - [62, 3725.37]
  - - [1, 832, 1, 2048]
    - [4, 128.387]
  - - [16, 832, 1, 2048]
    - [62, 2215.98]
  - - [32, 832, 1, 2048]
    - [62, 4371.02]
  - - [1, 1088, 1, 2048]
    - [4, 147.081]
  - - [16, 1088, 1, 2048]
    - [62, 2385.45]
  - - [32, 1088, 1, 2048]
    - [62, 4697.63]
  - - [1, 1344, 1, 2048]
    - [4, 152.999]
  - - [16, 1344, 1, 2048]
    - [65, 2419.02]
  - - [32, 1344, 1, 2048]
    - [65, 4798.29]
  - - [1, 1600, 1, 2048]
    - [4, 160.553]
  - - [16, 1600, 1, 2048]
    - [65, 2556.3]
  - - [32, 1600, 1, 2048]
    - [65, 5015.24]
  - - [1, 1856, 1, 2048]
    - [4, 164.192]
  - - [16, 1856, 1, 2048]
    - [65, 2616.14]
  - - [32, 1856, 1, 2048]
    - [65, 5160.43]
  - - [1, 2112, 1, 2048]
    - [4, 168.008]
  - - [16, 2112, 1, 2048]
    - [65, 2680.4]
  - - [1, 2368, 1, 2048]
    - [17, 170.61]
  - - [16, 2368, 1, 2048]
    - [67, 2726.17]
  - - [1, 2624, 1, 2048]
    - [17, 169.975]
  - - [16, 2624, 1, 2048]
    - [65, 2706.35]
  - - [1, 2880, 1, 2048]
    - [17, 161.419]
  - - [16, 2880, 1, 2048]
    - [70, 6669.39]
  - - [1, 3136, 1, 2048]
    - [17, 169.16]
  - - [16, 3136, 1, 2048]
    - [17, 2679.27]
  - - [1, 3392, 1, 2048]
    - [17, 170.132]
  - - [16, 3392, 1, 2048]
    - [16, 2699.84]
  - - [1, 3648, 1, 2048]
    - [17, 171.794]
  - - [16, 3648, 1, 2048]
    - [17, 2723.08]
  - - [1, 3904, 1, 2048]
    - [17, 172.184]
  - - [64, 1, 1, 4096]
    - [64, 51.4008]
  - - [64, 16, 1, 4096]
    - [64, 663.445]
  - - [64, 32, 1, 4096]
    - [64, 1644.83]
  - - [1, 64, 1, 4096]
    - [3, 18.275]
  - - [16, 64, 1, 4096]
    - [64, 662.13]
  - - [32, 64, 1, 4096]
    - [64, 1613.19]
  - - [320, 1, 1, 4096]
    - [64, 229.951]
  - - [320, 16, 1, 4096]
    - [64, 3883.61]
  - - [320, 32, 1, 4096]
    - [64, 3914.07]
  - - [576, 1, 1, 4096]
    - [140, 187.503]
  - - [576, 16, 1, 4096]
    - [140, 2838.42]
  - - [576, 32, 1, 4096]
    - [148, 5209.8]
  - - [832, 1, 1, 4096]
    - [140, 203.01]
  - - [832, 16, 1, 4096]
    - [140, 3169.41]
  - - [832, 32, 1, 4096]
    - [112, 5934.9]
  - - [1088, 1, 1, 4096]
    - [140, 450.146]
  - - [1088, 16, 1, 4096]
    - [140, 7202.34]
  - - [1344, 1, 1, 4096]
    - [137, 212.973]
  - - [1344, 16, 1, 4096]
    - [137, 3334.21]
  - - [1600, 1, 1, 4096]
    - [62, 217.53]
  - - [1600, 16, 1, 4096]
    - [62, 3427.57]
  - - [1856, 1, 1, 4096]
    - [62, 206.081]
  - - [1856, 16, 1, 4096]
    - [62, 3273.95]
  - - [2112, 1, 1, 4096]
    - [62, 211.839]
  - - [2368, 1, 1, 4096]
    - [62, 642.34]
  - - [2624, 1, 1, 4096]
    - [62, 213.283]
  - - [2880, 1, 1, 4096]
    - [8, 216.17]
  - - [3136, 1, 1, 4096]
    - [7, 620.534]
  - - [3392, 1, 1, 4096]
    - [7, 661.602]
  - - [3648, 1, 1, 4096]
    - [62, 714.938]
  - - [3904, 1, 1, 4096]
    - [7, 220.852]
  - - [1, 320, 1, 4096]
    - [3, 88.9294]
  - - [16, 320, 1, 4096]
    - [64, 1884.73]
  - - [32, 320, 1, 4096]
    - [64, 3675.3]
  - - [1, 576, 1, 4096]
    - [4, 130.299]
  - - [16, 576, 1, 4096]
    - [62, 2260.54]
  - - [32, 576, 1, 4096]
    - [62, 4477.69]
  - - [1, 832, 1, 4096]
    - [4, 143.581]
  - - [16, 832, 1, 4096]
    - [62, 2544.72]
  - - [32, 832, 1, 4096]
    - [62, 5049.53]
  - - [1, 1088, 1, 4096]
    - [4, 166.44]
  - - [16, 1088, 1, 4096]
    - [62, 2664.7]
  - - [1, 1344, 1, 4096]
    - [4, 167.536]
  - - [16, 1344, 1, 4096]
    - [65, 2620.01]
  - - [1, 1600, 1, 4096]
    - [4, 168.285]
  - - [16, 1600, 1, 4096]
    - [65, 2663.41]
  - - [1, 1856, 1, 4096]
    - [4, 172.454]
  - - [16, 1856, 1, 4096]
    - [65, 2743.83]
  - - [1, 2112, 1, 4096]
    - [4, 177.567]
  - - [1, 2368, 1, 4096]
    - [4, 180.817]
  - - [1, 2624, 1, 4096]
    - [4, 181.462]
  - - [1, 2880, 1, 4096]
    - [4, 184.798]
  - - [1, 3136, 1, 4096]
    - [4, 189.405]
  - - [1, 3392, 1, 4096]
    - [15, 180.522]
  - - [1, 3648, 1, 4096]
    - [15, 182.536]
  - - [1, 3904, 1, 4096]
    - [15, 182.942]
  - - [192, 1, 1, 64]
    - [62, 5.96673]
  - - [192, 16, 1, 64]
    - [154, 91.4456]
  - - [192, 32, 1, 64]
    - [147, 194.601]
  - - [192, 1, 1, 1]
    - [16, 0.0872727]
  - - [192, 1, 1, 16]
    - [16, 1.36533]
  - - [192, 1, 1, 32]
    - [15, 2.79273]
  - - [192, 16, 1, 1]
    - [150, 1.52371]
  - - [192, 16, 1, 16]
    - [145, 22.8614]
  - - [192, 16, 1, 32]
    - [7, 44.6836]
  - - [192, 32, 1, 1]
    - [17, 2.85767]
  - - [192, 32, 1, 16]
    - [145, 45.7228]
  - - [192, 32, 1, 32]
    - [17, 91.4456]
  - - [192, 64, 1, 1]
    - [7, 6.03723]
  - - [192, 64, 1, 16]
    - [14, 89.3673]
  - - [192, 64, 1, 32]
    - [10, 187.246]
  - - [448, 1, 1, 64]
    - [154, 13.0327]
  - - [448, 16, 1, 64]
    - [150, 208.524]
  - - [448, 32, 1, 64]
    - [141, 417.047]
  - - [448, 1, 1, 1]
    - [80, 0.203636]
  - - [448, 1, 1, 16]
    - [10, 3.18578]
  - - [448, 1, 1, 32]
    - [135, 6.37156]
  - - [448, 16, 1, 1]
    - [61, 3.18578]
  - - [448, 16, 1, 16]
    - [0, 43.2785]
  - - [448, 16, 1, 32]
    - [80, 109.227]
  - - [448, 32, 1, 1]
    - [150, 7.09611]
  - - [448, 32, 1, 16]
    - [145, 104.262]
  - - [448, 32, 1, 32]
    - [11, 213.373]
  - - [448, 64, 1, 1]
    - [15, 13.8995]
  - - [448, 64, 1, 16]
    - [145, 199.457]
  - - [448, 64, 1, 32]
    - [80, 417.047]
  - - [704, 1, 1, 64]
    - [113, 20.0249]
  - - [704, 16, 1, 64]
    - [62, 332.793]
  - - [704, 32, 1, 64]
    - [147, 657.127]
  - - [704, 1, 1, 1]
    - [80, 0.32]
  - - [704, 1, 1, 16]
    - [145, 5.12]
  - - [704, 1, 1, 32]
    - [10, 10.0124]
  - - [704, 16, 1, 1]
    - [145, 4.59755]
  - - [704, 16, 1, 16]
    - [145, 81.92]
  - - [704, 16, 1, 32]
    - [135, 163.84]
  - - [704, 32, 1, 1]
    - [145, 9.79478]
  - - [704, 32, 1, 16]
    - [145, 160.199]
  - - [704, 32, 1, 32]
    - [10, 313.433]
  - - [704, 64, 1, 1]
    - [21, 17.3292]
  - - [704, 64, 1, 16]
    - [145, 306.764]
  - - [704, 64, 1, 32]
    - [20, 600.747]
  - - [960, 1, 1, 64]
    - [61, 27.3067]
  - - [960, 16, 1, 64]
    - [151, 436.45]
  - - [960, 32, 1, 64]
    - [146, 854.817]
  - - [960, 1, 1, 1]
    - [10, 0.426667]
  - - [960, 1, 1, 16]
    - [145, 6.98182]
  - - [960, 1, 1, 32]
    - [11, 13.9636]
  - - [960, 16, 1, 1]
    - [6, 6.98182]
  - - [960, 16, 1, 16]
    - [145, 111.709]
  - - [960, 16, 1, 32]
    - [7, 218.453]
  - - [960, 32, 1, 1]
    - [8, 13.3565]
  - - [960, 32, 1, 16]
    - [145, 244.128]
  - - [960, 32, 1, 32]
    - [15, 436.907]
  - - [960, 64, 1, 1]
    - [22, 26.9013]
  - - [960, 64, 1, 16]
    - [145, 434.489]
  - - [960, 64, 1, 32]
    - [19, 819.2]
  - - [1216, 1, 1, 64]
    - [10, 34.5884]
  - - [1216, 16, 1, 64]
    - [80, 553.415]
  - - [1216, 32, 1, 64]
    - [15, 1020.31]
  - - [1216, 1, 1, 1]
    - [10, 0.540444]
  - - [1216, 1, 1, 16]
    - [7, 8.10667]
  - - [1216, 1, 1, 32]
    - [10, 18.5984]
  - - [1216, 16, 1, 1]
    - [80, 8.84364]
  - - [1216, 16, 1, 16]
    - [145, 144.789]
  - - [1216, 16, 1, 32]
    - [10, 300.16]
  - - [1216, 32, 1, 1]
    - [15, 16.9183]
  - - [1216, 32, 1, 16]
    - [145, 302.941]
  - - [1216, 32, 1, 32]
    - [14, 553.415]
  - - [1216, 64, 1, 1]
    - [22, 33.7714]
  - - [1216, 64, 1, 16]
    - [25, 508.238]
  - - [1216, 64, 1, 32]
    - [20, 1059.73]
  - - [1472, 1, 1, 64]
    - [7, 38.99]
  - - [1472, 16, 1, 64]
    - [80, 655.36]
  - - [1472, 32, 1, 64]
    - [80, 1205.86]
  - - [1472, 1, 1, 1]
    - [7, 0.626383]
  - - [1472, 1, 1, 16]
    - [151, 10.0221]
  - - [1472, 1, 1, 32]
    - [11, 20.48]
  - - [1472, 16, 1, 1]
    - [80, 10.24]
  - - [1472, 16, 1, 16]
    - [145, 167.481]
  - - [1472, 16, 1, 32]
    - [10, 353.694]
  - - [1472, 32, 1, 1]
    - [15, 20.853]
  - - [1472, 32, 1, 16]
    - [145, 320.708]
  - - [1472, 32, 1, 32]
    - [20, 655.36]
  - - [1472, 64, 1, 1]
    - [22, 37.9222]
  - - [1472, 64, 1, 16]
    - [145, 571.56]
  - - [1472, 64, 1, 32]
    - [20, 1159.48]
  - - [1728, 1, 1, 64]
    - [10, 45.1396]
  - - [1728, 16, 1, 64]
    - [7, 709.901]
  - - [1728, 32, 1, 64]
    - [82, 1319.43]
  - - [1728, 1, 1, 1]
    - [145, 0.735319]
  - - [1728, 1, 1, 16]
    - [145, 13.0152]
  - - [1728, 1, 1, 32]
    - [8, 24.0417]
  - - [1728, 16, 1, 1]
    - [145, 13.0435]
  - - [1728, 16, 1, 16]
    - [145, 201.076]
  - - [1728, 16, 1, 32]
    - [7, 407.811]
  - - [1728, 32, 1, 1]
    - [11, 22.1184]
  - - [1728, 32, 1, 16]
    - [145, 361.117]
  - - [1728, 32, 1, 32]
    - [10, 722.233]
  - - [1728, 64, 1, 1]
    - [22, 44.0386]
  - - [1728, 64, 1, 16]
    - [22, 655.41]
  - - [1728, 64, 1, 32]
    - [20, 1288.22]
  - - [1984, 1, 1, 64]
    - [10, 51.8269]
  - - [1984, 16, 1, 64]
    - [7, 789.232]
  - - [1984, 32, 1, 64]
    - [82, 1460.78]
  - - [1984, 1, 1, 1]
    - [11, 0.826667]
  - - [1984, 1, 1, 16]
    - [145, 14.6717]
  - - [1984, 1, 1, 32]
    - [11, 27.0162]
  - - [1984, 16, 1, 1]
    - [11, 13.8017]
  - - [1984, 16, 1, 16]
    - [145, 230.865]
  - - [1984, 16, 1, 32]
    - [11, 451.47]
  - - [1984, 32, 1, 1]
    - [22, 25.9135]
  - - [1984, 32, 1, 16]
    - [145, 414.081]
  - - [1984, 32, 1, 32]
    - [20, 846.507]
  - - [1984, 64, 1, 1]
    - [158, 46.5091]
  - - [1984, 64, 1, 16]
    - [157, 700.697]
  - - [1984, 64, 1, 32]
    - [159, 1422.44]
  - - [1, 192, 1, 64]
    - [5, 5.22894]
  - - [16, 192, 1, 64]
    - [151, 87.3813]
  - - [32, 192, 1, 64]
    - [15, 178.735]
  - - [1, 192, 1, 1]
    - [4, 0.0783673]
  - - [1, 192, 1, 16]
    - [3, 1.2288]
  - - [1, 192, 1, 32]
    - [40, 2.73067]
  - - [16, 192, 1, 1]
    - [11, 1.36533]
  - - [16, 192, 1, 16]
    - [143, 21.8453]
  - - [16, 192, 1, 32]
    - [39, 45.7228]
  - - [32, 192, 1, 1]
    - [15, 2.79273]
  - - [32, 192, 1, 16]
    - [145, 45.7228]
  - - [32, 192, 1, 32]
    - [15, 93.6229]
  - - [64, 192, 1, 1]
    - [141, 5.46133]
  - - [64, 192, 1, 16]
    - [14, 87.3813]
  - - [64, 192, 1, 32]
    - [150, 182.891]
  - - [192, 192, 1, 1]
    - [15, 17.8888]
  - - [192, 192, 1, 16]
    - [145, 262.144]
  - - [192, 192, 1, 32]
    - [14, 536.204]
  - - [320, 192, 1, 1]
    - [22, 25.0776]
  - - [320, 192, 1, 16]
    - [145, 448.061]
  - - [320, 192, 1, 32]
    - [20, 819.2]
  - - [448, 192, 1, 1]
    - [22, 32.4589]
  - - [448, 192, 1, 16]
    - [145, 566.676]
  - - [448, 192, 1, 32]
    - [20, 1000.91]
  - - [576, 192, 1, 1]
    - [32, 44.928]
  - - [576, 192, 1, 16]
    - [22, 693.355]
  - - [576, 192, 1, 32]
    - [31, 1387.82]
  - - [704, 192, 1, 1]
    - [32, 51.3678]
  - - [704, 192, 1, 16]
    - [34, 758.838]
  - - [704, 192, 1, 32]
    - [134, 1351.68]
  - - [832, 192, 1, 1]
    - [157, 56.0505]
  - - [832, 192, 1, 16]
    - [34, 881.346]
  - - [832, 192, 1, 32]
    - [31, 1806.82]
  - - [960, 192, 1, 1]
    - [32, 68.5527]
  - - [960, 192, 1, 16]
    - [32, 1030.91]
  - - [960, 192, 1, 32]
    - [31, 2106.51]
  - - [1088, 192, 1, 1]
    - [48, 66.3162]
  - - [1088, 192, 1, 16]
    - [158, 1012.83]
  - - [1088, 192, 1, 32]
    - [159, 2164.49]
  - - [1216, 192, 1, 1]
    - [48, 74.1181]
  - - [1216, 192, 1, 16]
    - [48, 1167.36]
  - - [1216, 192, 1, 32]
    - [159, 2360.8]
  - - [1344, 192, 1, 1]
    - [48, 81.5908]
  - - [1344, 192, 1, 16]
    - [32, 1236.93]
  - - [1344, 192, 1, 32]
    - [34, 2326.07]
  - - [1472, 192, 1, 1]
    - [48, 87.835]
  - - [1472, 192, 1, 16]
    - [48, 1273.8]
  - - [1472, 192, 1, 32]
    - [34, 2659.99]
  - - [1600, 192, 1, 1]
    - [48, 94.8959]
  - - [1600, 192, 1, 16]
    - [48, 1434.9]
  - - [1600, 192, 1, 32]
    - [32, 2777.57]
  - - [1728, 192, 1, 1]
    - [48, 97.5812]
  - - [1728, 192, 1, 16]
    - [48, 1495.33]
  - - [1728, 192, 1, 32]
    - [48, 3122.6]
  - - [1856, 192, 1, 1]
    - [47, 98.9867]
  - - [1856, 192, 1, 16]
    - [48, 1606.09]
  - - [1856, 192, 1, 32]
    - [48, 3305.29]
  - - [1984, 192, 1, 1]
    - [48, 100.21]
  - - [1984, 192, 1, 16]
    - [48, 1562.78]
  - - [1984, 192, 1, 32]
    - [127, 3294.51]
  - - [192, 320, 1, 1]
    - [20, 25.0776]
  - - [192, 320, 1, 16]
    - [145, 401.241]
  - - [192, 320, 1, 32]
    - [20, 878.859]
  - - [448, 320, 1, 1]
    - [158, 53.7959]
  - - [448, 320, 1, 16]
    - [22, 829.502]
  - - [448, 320, 1, 32]
    - [159, 1695.46]
  - - [704, 320, 1, 1]
    - [157, 71.5175]
  - - [704, 320, 1, 16]
    - [159, 1169.54]
  - - [704, 320, 1, 32]
    - [158, 2252.8]
  - - [960, 320, 1, 1]
    - [43, 94.4558]
  - - [960, 320, 1, 16]
    - [43, 1464.03]
  - - [960, 320, 1, 32]
    - [30, 2934.45]
  - - [1216, 320, 1, 1]
    - [43, 104.027]
  - - [1216, 320, 1, 16]
    - [43, 1556.48]
  - - [1216, 320, 1, 32]
    - [134, 3152.36]
  - - [1472, 320, 1, 1]
    - [156, 115.971]
  - - [1472, 320, 1, 16]
    - [156, 1816.06]
  - - [1472, 320, 1, 32]
    - [134, 3652.83]
  - - [1728, 320, 1, 1]
    - [134, 113.285]
  - - [1728, 320, 1, 16]
    - [156, 1882.42]
  - - [1728, 320, 1, 32]
    - [134, 3777.17]
  - - [1984, 320, 1, 1]
    - [156, 128.259]
  - - [1984, 320, 1, 16]
    - [156, 2138.54]
  - - [1984, 320, 1, 32]
    - [156, 3772.64]
  - - [1, 448, 1, 64]
    - [17, 12.4661]
  - - [16, 448, 1, 64]
    - [70, 208.524]
  - - [32, 448, 1, 64]
    - [143, 374.491]
  - - [1, 448, 1, 1]
    - [3, 0.149333]
  - - [1, 448, 1, 16]
    - [40, 2.98667]
  - - [1, 448, 1, 32]
    - [22, 5.7344]
  - - [16, 448, 1, 1]
    - [154, 3.25818]
  - - [16, 448, 1, 16]
    - [145, 52.1309]
  - - [16, 448, 1, 32]
    - [14, 104.262]
  - - [32, 448, 1, 1]
    - [40, 5.97333]
  - - [32, 448, 1, 16]
    - [145, 114.539]
  - - [32, 448, 1, 32]
    - [14, 213.373]
  - - [64, 448, 1, 1]
    - [6, 12.2009]
  - - [64, 448, 1, 16]
    - [145, 183.501]
  - - [64, 448, 1, 32]
    - [14, 407.78]
  - - [192, 448, 1, 1]
    - [20, 31.8578]
  - - [192, 448, 1, 16]
    - [145, 570.776]
  - - [192, 448, 1, 32]
    - [27, 1058.66]
  - - [320, 448, 1, 1]
    - [158, 53.8534]
  - - [320, 448, 1, 16]
    - [22, 831.565]
  - - [320, 448, 1, 32]
    - [159, 1693.64]
  - - [448, 448, 1, 1]
    - [134, 64.7432]
  - - [448, 448, 1, 16]
    - [25, 1019.45]
  - - [448, 448, 1, 32]
    - [20, 2038.9]
  - - [576, 448, 1, 1]
    - [58, 82.1603]
  - - [576, 448, 1, 16]
    - [58, 1251.14]
  - - [576, 448, 1, 32]
    - [31, 2359.3]
  - - [704, 448, 1, 1]
    - [58, 87.6089]
  - - [704, 448, 1, 16]
    - [58, 1424.86]
  - - [704, 448, 1, 32]
    - [134, 2765.08]
  - - [832, 448, 1, 1]
    - [58, 105.97]
  - - [832, 448, 1, 16]
    - [58, 1652.91]
  - - [832, 448, 1, 32]
    - [134, 3272.37]
  - - [960, 448, 1, 1]
    - [58, 114.688]
  - - [960, 448, 1, 16]
    - [58, 1835.01]
  - - [960, 448, 1, 32]
    - [58, 3670.02]
  - - [1088, 448, 1, 1]
    - [58, 114.688]
  - - [1088, 448, 1, 16]
    - [58, 1813.67]
  - - [1088, 448, 1, 32]
    - [134, 3428.04]
  - - [1216, 448, 1, 1]
    - [58, 118.768]
  - - [1216, 448, 1, 16]
    - [58, 1936.95]
  - - [1216, 448, 1, 32]
    - [58, 3961.95]
  - - [1344, 448, 1, 1]
    - [60, 116.915]
  - - [1344, 448, 1, 16]
    - [156, 2049.74]
  - - [1344, 448, 1, 32]
    - [60, 3805.06]
  - - [1472, 448, 1, 1]
    - [60, 137.387]
  - - [1472, 448, 1, 16]
    - [156, 2198.19]
  - - [1472, 448, 1, 32]
    - [60, 4034.93]
  - - [1600, 448, 1, 1]
    - [60, 133.702]
  - - [1600, 448, 1, 16]
    - [156, 2389.33]
  - - [1600, 448, 1, 32]
    - [60, 4224.78]
  - - [1728, 448, 1, 1]
    - [96, 133.585]
  - - [1728, 448, 1, 16]
    - [156, 2580.48]
  - - [1728, 448, 1, 32]
    - [156, 4308.6]
  - - [1856, 448, 1, 1]
    - [60, 143.36]
  - - [1856, 448, 1, 16]
    - [134, 1997.48]
  - - [1856, 448, 1, 32]
    - [134, 4058.6]
  - - [1984, 448, 1, 1]
    - [108, 127.234]
  - - [1984, 448, 1, 16]
    - [134, 2222.08]
  - - [1984, 448, 1, 32]
    - [134, 4587.52]
  - - [192, 576, 1, 1]
    - [44, 41.7328]
  - - [192, 576, 1, 16]
    - [32, 698.528]
  - - [192, 576, 1, 32]
    - [13, 1424.87]
  - - [448, 576, 1, 1]
    - [48, 84.7205]
  - - [448, 576, 1, 16]
    - [32, 1146.88]
  - - [448, 576, 1, 32]
    - [48, 2489.75]
  - - [704, 576, 1, 1]
    - [48, 105.326]
  - - [704, 576, 1, 16]
    - [134, 1601.99]
  - - [704, 576, 1, 32]
    - [134, 3461.54]
  - - [960, 576, 1, 1]
    - [53, 121.53]
  - - [960, 576, 1, 16]
    - [53, 2131.89]
  - - [960, 576, 1, 32]
    - [53, 4315.79]
  - - [1216, 576, 1, 1]
    - [139, 128.517]
  - - [1216, 576, 1, 16]
    - [156, 2134.6]
  - - [1216, 576, 1, 32]
    - [156, 4093.91]
  - - [1472, 576, 1, 1]
    - [108, 127.763]
  - - [1472, 576, 1, 16]
    - [134, 2066.86]
  - - [1472, 576, 1, 32]
    - [134, 4275.03]
  - - [1728, 576, 1, 1]
    - [97, 150.807]
  - - [1728, 576, 1, 16]
    - [97, 2359.3]
  - - [1728, 576, 1, 32]
    - [134, 4161.35]
  - - [1984, 576, 1, 1]
    - [98, 169.301]
  - - [1984, 576, 1, 16]
    - [98, 2688.9]
  - - [1984, 576, 1, 32]
    - [98, 4524.99]
  - - [1, 704, 1, 64]
    - [5, 21.5383]
  - - [16, 704, 1, 64]
    - [70, 313.433]
  - - [32, 704, 1, 64]
    - [138, 691.493]
  - - [1, 704, 1, 1]
    - [40, 0.299574]
  - - [1, 704, 1, 16]
    - [40, 4.79319]
  - - [1, 704, 1, 32]
    - [2, 9.38667]
  - - [16, 704, 1, 1]
    - [39, 5.00622]
  - - [16, 704, 1, 16]
    - [40, 80.0996]
  - - [16, 704, 1, 32]
    - [40, 179.457]
  - - [32, 704, 1, 1]
    - [14, 9.79478]
  - - [32, 704, 1, 16]
    - [17, 160.199]
  - - [32, 704, 1, 32]
    - [14, 266.999]
  - - [64, 704, 1, 1]
    - [21, 18.3902]
  - - [64, 704, 1, 16]
    - [145, 306.764]
  - - [64, 704, 1, 32]
    - [20, 665.061]
  - - [192, 704, 1, 1]
    - [27, 52.0027]
  - - [192, 704, 1, 16]
    - [27, 804.441]
  - - [192, 704, 1, 32]
    - [134, 1517.68]
  - - [320, 704, 1, 1]
    - [159, 78.1009]
  - - [320, 704, 1, 16]
    - [158, 1185.4]
  - - [320, 704, 1, 32]
    - [157, 2218.14]
  - - [448, 704, 1, 1]
    - [157, 82.9979]
  - - [448, 704, 1, 16]
    - [159, 1327.97]
  - - [448, 704, 1, 32]
    - [134, 2765.08]
  - - [576, 704, 1, 1]
    - [157, 100.124]
  - - [576, 704, 1, 16]
    - [134, 1544.78]
  - - [576, 704, 1, 32]
    - [159, 3327.21]
  - - [704, 704, 1, 1]
    - [134, 107.743]
  - - [704, 704, 1, 16]
    - [156, 1705.35]
  - - [704, 704, 1, 32]
    - [134, 3304.11]
  - - [832, 704, 1, 1]
    - [156, 118.329]
  - - [832, 704, 1, 16]
    - [156, 1974.61]
  - - [832, 704, 1, 32]
    - [156, 3675.51]
  - - [960, 704, 1, 1]
    - [53, 123.499]
  - - [960, 704, 1, 16]
    - [156, 1992.11]
  - - [960, 704, 1, 32]
    - [96, 3846.63]
  - - [1088, 704, 1, 1]
    - [156, 143.169]
  - - [1088, 704, 1, 16]
    - [156, 2426.78]
  - - [1088, 704, 1, 32]
    - [96, 4169.91]
  - - [1216, 704, 1, 1]
    - [134, 127.39]
  - - [1216, 704, 1, 16]
    - [134, 2056.33]
  - - [1216, 704, 1, 32]
    - [134, 4280.32]
  - - [1344, 704, 1, 1]
    - [134, 139.144]
  - - [1344, 704, 1, 16]
    - [134, 2402.99]
  - - [1344, 704, 1, 32]
    - [134, 4694.21]
  - - [1472, 704, 1, 1]
    - [98, 146.991]
  - - [1472, 704, 1, 16]
    - [98, 2271.32]
  - - [1472, 704, 1, 32]
    - [98, 4311.52]
  - - [1600, 704, 1, 1]
    - [159, 129.563]
  - - [1600, 704, 1, 16]
    - [156, 2387.07]
  - - [1600, 704, 1, 32]
    - [159, 4106.4]
  - - [1728, 704, 1, 1]
    - [157, 137.297]
  - - [1728, 704, 1, 16]
    - [156, 2417.91]
  - - [1728, 704, 1, 32]
    - [159, 4359.51]
  - - [1856, 704, 1, 1]
    - [156, 154.63]
  - - [1856, 704, 1, 16]
    - [156, 2646.33]
  - - [1856, 704, 1, 32]
    - [159, 4405.63]
  - - [1984, 704, 1, 1]
    - [156, 147.584]
  - - [1984, 704, 1, 16]
    - [156, 2742.06]
  - - [1984, 704, 1, 32]
    - [156, 5079.04]
  - - [192, 832, 1, 1]
    - [159, 56.0505]
  - - [192, 832, 1, 16]
    - [27, 915.751]
  - - [192, 832, 1, 32]
    - [13, 1858.38]
  - - [448, 832, 1, 1]
    - [159, 94.3635]
  - - [448, 832, 1, 16]
    - [157, 1490.94]
  - - [448, 832, 1, 32]
    - [134, 3281.49]
  - - [704, 832, 1, 1]
    - [156, 117.31]
  - - [704, 832, 1, 16]
    - [156, 1952.43]
  - - [704, 832, 1, 32]
    - [96, 3666.12]
  - - [960, 832, 1, 1]
    - [157, 125.872]
  - - [960, 832, 1, 16]
    - [134, 2203.37]
  - - [960, 832, 1, 32]
    - [159, 4110.4]
  - - [1216, 832, 1, 1]
    - [98, 152.137]
  - - [1216, 832, 1, 16]
    - [98, 2093.62]
  - - [1216, 832, 1, 32]
    - [98, 4624.97]
  - - [1472, 832, 1, 1]
    - [158, 139.148]
  - - [1472, 832, 1, 16]
    - [156, 2512.21]
  - - [1472, 832, 1, 32]
    - [159, 4417.44]
  - - [1728, 832, 1, 1]
    - [156, 169.141]
  - - [1728, 832, 1, 16]
    - [156, 2822.47]
  - - [1728, 832, 1, 32]
    - [96, 5318.64]
  - - [1984, 832, 1, 1]
    - [156, 147.586]
  - - [1984, 832, 1, 16]
    - [156, 2886.45]
  - - [1984, 832, 1, 32]
    - [134, 4771.43]
  - - [1, 960, 1, 64]
    - [40, 26.713]
  - - [16, 960, 1, 64]
    - [146, 466.9]
  - - [32, 960, 1, 64]
    - [138, 902.493]
  - - [1, 960, 1, 1]
    - [40, 0.417391]
  - - [1, 960, 1, 16]
    - [40, 6.67826]
  - - [1, 960, 1, 32]
    - [2, 15.255]
  - - [16, 960, 1, 1]
    - [39, 6.67826]
  - - [16, 960, 1, 16]
    - [40, 109.227]
  - - [16, 960, 1, 32]
    - [40, 245.01]
  - - [32, 960, 1, 1]
    - [80, 15.0032]
  - - [32, 960, 1, 16]
    - [145, 213.704]
  - - [32, 960, 1, 32]
    - [135, 436.907]
  - - [64, 960, 1, 1]
    - [22, 27.3828]
  - - [64, 960, 1, 16]
    - [145, 401.241]
  - - [64, 960, 1, 32]
    - [20, 877.947]
  - - [192, 960, 1, 1]
    - [32, 63.5586]
  - - [192, 960, 1, 16]
    - [31, 1016.94]
  - - [192, 960, 1, 32]
    - [34, 1999.4]
  - - [320, 960, 1, 1]
    - [48, 97.1329]
  - - [320, 960, 1, 16]
    - [48, 1481.05]
  - - [320, 960, 1, 32]
    - [31, 2927.47]
  - - [448, 960, 1, 1]
    - [48, 112.251]
  - - [448, 960, 1, 16]
    - [48, 1767.99]
  - - [448, 960, 1, 32]
    - [134, 3531.73]
  - - [576, 960, 1, 1]
    - [53, 124.261]
  - - [576, 960, 1, 16]
    - [53, 1988.17]
  - - [576, 960, 1, 32]
    - [53, 4115.05]
  - - [704, 960, 1, 1]
    - [108, 125.156]
  - - [704, 960, 1, 16]
    - [156, 2120.28]
  - - [704, 960, 1, 32]
    - [91, 4004.98]
  - - [832, 960, 1, 1]
    - [108, 128.94]
  - - [832, 960, 1, 16]
    - [159, 2009.29]
  - - [832, 960, 1, 32]
    - [159, 4140.3]
  - - [960, 960, 1, 1]
    - [108, 145.134]
  - - [960, 960, 1, 16]
    - [134, 2100.35]
  - - [960, 960, 1, 32]
    - [134, 4718.59]
  - - [1088, 960, 1, 1]
    - [98, 149.211]
  - - [1088, 960, 1, 16]
    - [98, 2404.56]
  - - [1088, 960, 1, 32]
    - [98, 4740.9]
  - - [1216, 960, 1, 1]
    - [98, 166.766]
  - - [1216, 960, 1, 16]
    - [98, 2630.67]
  - - [1216, 960, 1, 32]
    - [98, 4488.97]
  - - [1344, 960, 1, 1]
    - [159, 141.81]
  - - [1344, 960, 1, 16]
    - [156, 2663.72]
  - - [1344, 960, 1, 32]
    - [159, 4494.41]
  - - [1472, 960, 1, 1]
    - [156, 163.366]
  - - [1472, 960, 1, 16]
    - [156, 2791.35]
  - - [1472, 960, 1, 32]
    - [96, 5227.73]
  - - [1600, 960, 1, 1]
    - [156, 173.559]
  - - [1600, 960, 1, 16]
    - [156, 2960.96]
  - - [1600, 960, 1, 32]
    - [156, 4883.09]
  - - [1728, 960, 1, 1]
    - [156, 170.142]
  - - [1728, 960, 1, 16]
    - [156, 2885.01]
  - - [1728, 960, 1, 32]
    - [134, 4825.07]
  - - [1856, 960, 1, 1]
    - [134, 149.297]
  - - [1856, 960, 1, 16]
    - [134, 2383.9]
  - - [1856, 960, 1, 32]
    - [134, 4919.23]
  - - [1984, 960, 1, 1]
    - [108, 182.262]
  - - [1984, 960, 1, 16]
    - [134, 2381.11]
  - - [1984, 960, 1, 32]
    - [134, 4949.78]
  - - [192, 1088, 1, 1]
    - [159, 66.3162]
  - - [192, 1088, 1, 16]
    - [157, 1028.41]
  - - [192, 1088, 1, 32]
    - [158, 2056.82]
  - - [448, 1088, 1, 1]
    - [134, 105.962]
  - - [448, 1088, 1, 16]
    - [134, 1733.06]
  - - [448, 1088, 1, 32]
    - [134, 3670.02]
  - - [704, 1088, 1, 1]
    - [109, 131.8]
  - - [704, 1088, 1, 16]
    - [109, 2269.49]
  - - [704, 1088, 1, 32]
    - [134, 4054.04]
  - - [960, 1088, 1, 1]
    - [98, 151.374]
  - - [960, 1088, 1, 16]
    - [98, 2370.45]
  - - [960, 1088, 1, 32]
    - [98, 4259]
  - - [1216, 1088, 1, 1]
    - [156, 155.648]
  - - [1216, 1088, 1, 16]
    - [156, 2646.02]
  - - [1216, 1088, 1, 32]
    - [94, 4951.61]
  - - [1472, 1088, 1, 1]
    - [156, 166.827]
  - - [1472, 1088, 1, 16]
    - [156, 2815.89]
  - - [1472, 1088, 1, 32]
    - [134, 4855.62]
  - - [1728, 1088, 1, 1]
    - [60, 151.985]
  - - [1728, 1088, 1, 16]
    - [127, 2406.94]
  - - [1728, 1088, 1, 32]
    - [134, 5469.28]
  - - [1984, 1088, 1, 1]
    - [156, 158.781]
  - - [1984, 1088, 1, 16]
    - [156, 2558.13]
  - - [1984, 1088, 1, 32]
    - [134, 5042.09]
  - - [1, 1216, 1, 64]
    - [5, 34.6447]
  - - [16, 1216, 1, 64]
    - [146, 498.074]
  - - [32, 1216, 1, 64]
    - [141, 1016.48]
  - - [1, 1216, 1, 1]
    - [40, 0.528696]
  - - [1, 1216, 1, 16]
    - [2, 9.57021]
  - - [1, 1216, 1, 32]
    - [40, 16.5583]
  - - [16, 1216, 1, 1]
    - [40, 8.27915]
  - - [16, 1216, 1, 16]
    - [40, 154.709]
  - - [16, 1216, 1, 32]
    - [39, 282.996]
  - - [32, 1216, 1, 1]
    - [14, 16.5583]
  - - [32, 1216, 1, 16]
    - [145, 276.708]
  - - [32, 1216, 1, 32]
    - [15, 541.384]
  - - [64, 1216, 1, 1]
    - [25, 31.1296]
  - - [64, 1216, 1, 16]
    - [25, 521.16]
  - - [64, 1216, 1, 32]
    - [22, 1016.48]
  - - [192, 1216, 1, 1]
    - [134, 70.7491]
  - - [192, 1216, 1, 16]
    - [134, 1115.09]
  - - [192, 1216, 1, 32]
    - [158, 2298.8]
  - - [320, 1216, 1, 1]
    - [134, 103.504]
  - - [320, 1216, 1, 16]
    - [134, 1661.27]
  - - [320, 1216, 1, 32]
    - [134, 3453.9]
  - - [448, 1216, 1, 1]
    - [58, 114.688]
  - - [448, 1216, 1, 16]
    - [156, 1877.74]
  - - [448, 1216, 1, 32]
    - [134, 3709.06]
  - - [576, 1216, 1, 1]
    - [156, 128.517]
  - - [576, 1216, 1, 16]
    - [156, 2197.38]
  - - [576, 1216, 1, 32]
    - [96, 4118.4]
  - - [704, 1216, 1, 1]
    - [159, 129.887]
  - - [704, 1216, 1, 16]
    - [134, 2068.62]
  - - [704, 1216, 1, 32]
    - [134, 4280.32]
  - - [832, 1216, 1, 1]
    - [98, 143.505]
  - - [832, 1216, 1, 16]
    - [97, 2329.12]
  - - [832, 1216, 1, 32]
    - [98, 4203.01]
  - - [960, 1216, 1, 1]
    - [60, 133.721]
  - - [960, 1216, 1, 16]
    - [156, 2291.75]
  - - [960, 1216, 1, 32]
    - [159, 4273.47]
  - - [1088, 1216, 1, 1]
    - [94, 152.949]
  - - [1088, 1216, 1, 16]
    - [156, 2613.35]
  - - [1088, 1216, 1, 32]
    - [94, 4951.61]
  - - [1216, 1216, 1, 1]
    - [156, 156.175]
  - - [1216, 1216, 1, 16]
    - [156, 2902.88]
  - - [1216, 1216, 1, 32]
    - [94, 5346.55]
  - - [1344, 1216, 1, 1]
    - [156, 171.131]
  - - [1344, 1216, 1, 16]
    - [156, 2873.5]
  - - [1344, 1216, 1, 32]
    - [134, 4813.1]
  - - [1472, 1216, 1, 1]
    - [158, 148.693]
  - - [1472, 1216, 1, 16]
    - [156, 2780.51]
  - - [1472, 1216, 1, 32]
    - [134, 5403.63]
  - - [1600, 1216, 1, 1]
    - [134, 150.279]
  - - [1600, 1216, 1, 16]
    - [156, 2817.16]
  - - [1600, 1216, 1, 32]
    - [134, 4994.54]
  - - [1728, 1216, 1, 1]
    - [156, 158.615]
  - - [1728, 1216, 1, 16]
    - [156, 2975.22]
  - - [1728, 1216, 1, 32]
    - [134, 5106.4]
  - - [1856, 1216, 1, 1]
    - [156, 165.907]
  - - [1856, 1216, 1, 16]
    - [156, 3209.81]
  - - [1856, 1216, 1, 32]
    - [134, 5061.33]
  - - [1984, 1216, 1, 1]
    - [156, 193.004]
  - - [1984, 1216, 1, 16]
    - [156, 3271.25]
  - - [1984, 1216, 1, 32]
    - [134, 5182.67]
  - - [192, 1344, 1, 1]
    - [48, 84.7513]
  - - [192, 1344, 1, 16]
    - [48, 1232.47]
  - - [192, 1344, 1, 32]
    - [31, 2393.49]
  - - [448, 1344, 1, 1]
    - [60, 121.639]
  - - [448, 1344, 1, 16]
    - [156, 1899.85]
  - - [448, 1344, 1, 32]
    - [60, 3568.07]
  - - [704, 1344, 1, 1]
    - [134, 130.991]
  - - [704, 1344, 1, 16]
    - [134, 2138.71]
  - - [704, 1344, 1, 32]
    - [134, 4730.88]
  - - [960, 1344, 1, 1]
    - [60, 161.28]
  - - [960, 1344, 1, 16]
    - [53, 2564.45]
  - - [960, 1344, 1, 32]
    - [60, 4598.12]
  - - [1216, 1344, 1, 1]
    - [96, 153.892]
  - - [1216, 1344, 1, 16]
    - [156, 2889.38]
  - - [1216, 1344, 1, 32]
    - [94, 5363.87]
  - - [1472, 1344, 1, 1]
    - [60, 184.034]
  - - [1472, 1344, 1, 16]
    - [156, 2468.06]
  - - [1472, 1344, 1, 32]
    - [134, 5122.55]
  - - [1728, 1344, 1, 1]
    - [98, 205.525]
  - - [1728, 1344, 1, 16]
    - [156, 3259.55]
  - - [1728, 1344, 1, 32]
    - [98, 6298.12]
  - - [1984, 1344, 1, 1]
    - [60, 166.686]
