projects/hipblaslt/library/src/amd_detail/rocblaslt/src/Tensile/Logic/asm_full/gfx1151/GridBased/gfx1151_Cijk_Alik_Bljk_BBS_BH_Bias_HAS_SAV_UserArgs.yaml
- {MinimumRequiredVersion: 5.0.0}
- gfx1151
- gfx1151
- [Device 1536]
    SolutionIndex: 3
    SolutionNameMin: Cijk_Alik_Bljk_BBS_BH_Bias_HA_S_SAV_UserArgs_MT96x128x64_MI16x16x1_SN_LDSB0_AFC1_AG0_AFEM1_AFEM1_ASEM1_CLR0_CADS0_DTLA0_DTLB0_DTVA0_DTVB0_EPS0_FDSI0_GRPM1_GRVWA8_GRVWB8_GSU1_GSUAMB_GSUC0_GSUWGMRR0_GLS0_ISA1151_IU1_K1_LDSTI0_LBSPPA128_LBSPPB128_LBSPPM0_LPA8_LPB8_LPM0_LRVW16_LWPMn1_MIAV1_MIWT6_2_MO40_NTn1_NTA0_NTB0_NTC0_NTD0_NTM0_NEPBS0_NLCA1_NLCB1_ONLL1_PGR0_PLR0_PKA0_SIA3_SS1_SU32_SUM0_SUS256_SPO0_SRVW0_SSO0_SVW1_SK0_SKFTR0_SKXCCM0_TLDS1_ULSGRO0_USL1_UIOFGRO0_USFGROn1_VSn1_VWA1_VWB1_WSGRA0_WSGRB0_WS32_WG16_8_1_WGM8_WGMXCC1_WGMXCCGn1
    SolutionIndex: 4
    SolutionNameMin: Cijk_Alik_Bljk_BBS_BH_Bias_HA_S_SAV_UserArgs_MT128x128x64_MI16x16x1_SN_LDSB0_AFC1_AG0_AFEM1_AFEM1_ASEM1_CLR0_CADS0_DTLA0_DTLB0_DTVA0_DTVB0_EPS0_FDSI0_GRPM1_GRVWA8_GRVWB8_GSU1_GSUAMB_GSUC0_GSUWGMRR0_GLS0_ISA1151_IU1_K1_LDSTI0_LBSPPA128_LBSPPB128_LBSPPM0_LPA8_LPB8_LPM0_LRVW16_LWPMn1_MIAV1_MIWT8_2_MO40_NTn1_NTA0_NTB0_NTC0_NTD0_NTM0_NEPBS0_NLCA1_NLCB1_ONLL1_PGR0_PLR0_PKA0_SIA3_SS1_SU32_SUM0_SUS256_SPO0_SRVW0_SSO0_SVW1_SK0_SKFTR0_SKXCCM0_TLDS1_ULSGRO0_USL1_UIOFGRO0_USFGROn1_VSn1_VWA1_VWB1_WSGRA0_WSGRB0_WS32_WG16_8_1_WGM8_WGMXCC1_WGMXCCGn1
    SolutionIndex: 5
    SolutionNameMin: Cijk_Alik_Bljk_BBS_BH_Bias_HA_S_SAV_UserArgs_MT96x128x64_MI16x16x1_SN_LDSB0_AFC1_AG0_AFEM1_AFEM1_ASEM1_CLR0_CADS0_DTLA0_DTLB0_DTVA0_DTVB0_EPS0_FDSI0_GRPM1_GRVWA8_GRVWB8_GSU1_GSUAMB_GSUC0_GSUWGMRR0_GLS0_ISA1151_IU1_K1_LDSTI0_LBSPPA128_LBSPPB128_LBSPPM0_LPA8_LPB8_LPM0_LRVW16_LWPMn1_MIAV1_MIWT3_4_MO40_NTn1_NTA0_NTB0_NTC0_NTD0_NTM0_NEPBS0_NLCA1_NLCB1_ONLL1_PGR0_PLR0_PKA0_SIA3_SS1_SU32_SUM0_SUS256_SPO0_SRVW0_SSO0_SVW1_SK0_SKFTR0_SKXCCM0_TLDS1_ULSGRO0_USL1_UIOFGRO0_USFGROn1_VSn1_VWA1_VWB1_WSGRA0_WSGRB0_WS32_WG32_4_1_WGM8_WGMXCC1_WGMXCCGn1
    SolutionIndex: 7
    SolutionNameMin: Cijk_Alik_Bljk_BBS_BH_Bias_HA_S_SAV_UserArgs_MT128x128x64_MI16x16x1_SN_LDSB0_AFC1_AG0_AFEM1_AFEM1_ASEM1_CLR0_CADS0_DTLA0_DTLB0_DTVA0_DTVB0_EPS0_FDSI0_GRPM1_GRVWA8_GRVWB8_GSU1_GSUAMB_GSUC0_GSUWGMRR0_GLS0_ISA1151_IU1_K1_LDSTI0_LBSPPA128_LBSPPB128_LBSPPM0_LPA8_LPB8_LPM0_LRVW16_LWPMn1_MIAV1_MIWT4_4_MO40_NTn1_NTA0_NTB0_NTC0_NTD0_NTM0_NEPBS0_NLCA1_NLCB1_ONLL1_PGR0_PLR0_PKA0_SIA3_SS1_SU32_SUM0_SUS256_SPO0_SRVW0_SSO0_SVW1_SK0_SKFTR0_SKXCCM0_TLDS1_ULSGRO0_USL1_UIOFGRO0_USFGROn1_VSn1_VWA1_VWB1_WSGRA0_WSGRB0_WS32_WG32_4_1_WGM8_WGMXCC1_WGMXCCGn1
    SolutionIndex: 8
    SolutionNameMin: Cijk_Alik_Bljk_BBS_BH_Bias_HA_S_SAV_UserArgs_MT128x96x64_MI16x16x1_SN_LDSB0_AFC1_AG0_AFEM1_AFEM1_ASEM1_CLR0_CADS0_DTLA0_DTLB0_DTVA0_DTVB0_EPS0_FDSI0_GRPM1_GRVWA8_GRVWB8_GSU1_GSUAMB_GSUC0_GSUWGMRR0_GLS0_ISA1151_IU1_K1_LDSTI0_LBSPPA128_LBSPPB128_LBSPPM0_LPA8_LPB8_LPM0_LRVW16_LWPMn1_MIAV1_MIWT4_3_MO40_NTn1_NTA0_NTB0_NTC0_NTD0_NTM0_NEPBS0_NLCA1_NLCB1_ONLL1_PGR0_PLR0_PKA0_SIA3_SS1_SU32_SUM0_SUS256_SPO0_SRVW0_SSO0_SVW1_SK0_SKFTR0_SKXCCM0_TLDS1_ULSGRO0_USL1_UIOFGRO0_USFGROn1_VSn1_VWA1_VWB1_WSGRA0_WSGRB0_WS32_WG32_4_1_WGM8_WGMXCC1_WGMXCCGn1
    SolutionIndex: 9
    SolutionNameMin: Cijk_Alik_Bljk_BBS_BH_Bias_HA_S_SAV_UserArgs_MT80x128x64_MI16x16x1_SN_LDSB1_AFC1_AG0_AFEM1_AFEM1_ASEM1_CLR0_CADS0_DTLA0_DTLB0_DTVA0_DTVB0_EPS0_FDSI0_GRPM1_GRVWA8_GRVWB8_GSU1_GSUAMB_GSUC0_GSUWGMRR0_GLS0_ISA1151_IU1_K1_LDSTI0_LBSPPA128_LBSPPB128_LBSPPM0_LPA8_LPB8_LPM0_LRVW16_LWPMn1_MIAV1_MIWT5_2_MO40_NTn1_NTA0_NTB0_NTC0_NTD0_NTM0_NEPBS0_NLCA1_NLCB1_ONLL1_PGR2_PLR1_PKA0_SIA3_SS1_SU32_SUM0_SUS256_SPO0_SRVW0_SSO0_SVW1_SK0_SKFTR0_SKXCCM0_TLDS1_ULSGRO0_USL1_UIOFGRO0_USFGROn1_VSn1_VWA1_VWB1_WSGRA0_WSGRB0_WS32_WG16_8_1_WGM8_WGMXCC1_WGMXCCGn1
    SolutionIndex: 10
    SolutionNameMin: Cijk_Alik_Bljk_BBS_BH_Bias_HA_S_SAV_UserArgs_MT64x48x64_MI16x16x1_SN_LDSB0_AFC1_AG0_AFEM1_AFEM1_ASEM1_CLR0_CADS0_DTLA0_DTLB0_DTVA0_DTVB0_EPS0_FDSI0_GRPM1_GRVWA8_GRVWB8_GSU1_GSUAMB_GSUC0_GSUWGMRR0_GLS0_ISA1151_IU1_K1_LDSTI0_LBSPPA128_LBSPPB128_LBSPPM0_LPA8_LPB8_LPM0_LRVW16_LWPMn1_MIAV1_MIWT1_3_MO40_NTn1_NTA0_NTB0_NTC0_NTD0_NTM0_NEPBS0_NLCA1_NLCB1_ONLL1_PGR2_PLR1_PKA0_SIA1_SS1_SU32_SUM0_SUS256_SPO0_SRVW0_SSO0_SVW1_SK0_SKFTR0_SKXCCM0_TLDS1_ULSGRO0_USL1_UIOFGRO0_USFGROn1_VSn1_VWA1_VWB1_WSGRA0_WSGRB0_WS32_WG64_2_1_WGM8_WGMXCC1_WGMXCCGn1
    SolutionIndex: 11
    SolutionNameMin: Cijk_Alik_Bljk_BBS_BH_Bias_HA_S_SAV_UserArgs_MT64x64x64_MI16x16x1_SN_LDSB0_AFC1_AG0_AFEM1_AFEM1_ASEM1_CLR0_CADS0_DTLA0_DTLB0_DTVA0_DTVB0_EPS0_FDSI0_GRPM1_GRVWA8_GRVWB8_GSU1_GSUAMB_GSUC0_GSUWGMRR0_GLS0_ISA1151_IU1_K1_LDSTI0_LBSPPA128_LBSPPB128_LBSPPM0_LPA8_LPB8_LPM0_LRVW16_LWPMn1_MIAV1_MIWT2_2_MO40_NTn1_NTA0_NTB0_NTC0_NTD0_NTM0_NEPBS0_NLCA1_NLCB1_ONLL1_PGR2_PLR1_PKA0_SIA1_SS1_SU32_SUM0_SUS256_SPO0_SRVW0_SSO0_SVW1_SK0_SKFTR0_SKXCCM0_TLDS1_ULSGRO0_USL1_UIOFGRO0_USFGROn1_VSn1_VWA1_VWB1_WSGRA0_WSGRB0_WS32_WG32_4_1_WGM8_WGMXCC1_WGMXCCGn1
    SolutionIndex: 12
    SolutionNameMin: Cijk_Alik_Bljk_BBS_BH_Bias_HA_S_SAV_UserArgs_MT128x64x64_MI16x16x1_SN_LDSB0_AFC1_AG0_AFEM1_AFEM1_ASEM1_CLR0_CADS0_DTLA0_DTLB0_DTVA0_DTVB0_EPS0_FDSI0_GRPM1_GRVWA8_GRVWB8_GSU1_GSUAMB_GSUC0_GSUWGMRR0_GLS0_ISA1151_IU1_K1_LDSTI0_LBSPPA128_LBSPPB128_LBSPPM0_LPA8_LPB8_LPM0_LRVW16_LWPMn1_MIAV1_MIWT4_2_MO40_NTn1_NTA0_NTB0_NTC0_NTD0_NTM0_NEPBS0_NLCA1_NLCB1_ONLL1_PGR2_PLR1_PKA0_SIA1_SS1_SU32_SUM0_SUS256_SPO0_SRVW0_SSO0_SVW1_SK0_SKFTR0_SKXCCM0_TLDS1_ULSGRO0_USL1_UIOFGRO0_USFGROn1_VSn1_VWA1_VWB1_WSGRA0_WSGRB0_WS32_WG32_4_1_WGM8_WGMXCC1_WGMXCCGn1
    SolutionIndex: 13
    SolutionNameMin: Cijk_Alik_Bljk_BBS_BH_Bias_HA_S_SAV_UserArgs_MT64x128x32_MI16x16x1_SN_LDSB0_AFC1_AG0_AFEM1_AFEM1_ASEM1_CLR0_CADS0_DTLA0_DTLB0_DTVA0_DTVB0_EPS0_FDSI0_GRPM1_GRVWA8_GRVWB8_GSU1_GSUAMB_GSUC0_GSUWGMRR0_GLS0_ISA1151_IU1_K1_LDSTI0_LBSPPA128_LBSPPB128_LBSPPM0_LPA8_LPB8_LPM0_LRVW16_LWPMn1_MIAV1_MIWT4_2_MO40_NTn1_NTA0_NTB0_NTC0_NTD0_NTM0_NEPBS0_NLCA1_NLCB1_ONLL1_PGR2_PLR1_PKA0_SIA1_SS1_SU32_SUM0_SUS256_SPO0_SRVW0_SSO0_SVW1_SK0_SKFTR0_SKXCCM0_TLDS1_ULSGRO0_USL1_UIOFGRO0_USFGROn1_VSn1_VWA1_VWB1_WSGRA0_WSGRB0_WS32_WG16_8_1_WGM8_WGMXCC1_WGMXCCGn1
    SolutionIndex: 14
    SolutionNameMin: Cijk_Alik_Bljk_BBS_BH_Bias_HA_S_SAV_UserArgs_MT128x128x32_MI16x16x1_SN_LDSB0_AFC1_AG0_AFEM1_AFEM1_ASEM1_CLR0_CADS0_DTLA0_DTLB0_DTVA0_DTVB0_EPS0_FDSI0_GRPM1_GRVWA8_GRVWB8_GSU1_GSUAMB_GSUC0_GSUWGMRR0_GLS0_ISA1151_IU1_K1_LDSTI0_LBSPPA128_LBSPPB128_LBSPPM0_LPA8_LPB8_LPM0_LRVW16_LWPMn1_MIAV1_MIWT4_4_MO40_NTn1_NTA0_NTB0_NTC0_NTD0_NTM0_NEPBS0_NLCA1_NLCB1_ONLL1_PGR0_PLR0_PKA0_SIA3_SS1_SU32_SUM0_SUS256_SPO0_SRVW0_SSO0_SVW1_SK0_SKFTR0_SKXCCM0_TLDS1_ULSGRO0_USL1_UIOFGRO0_USFGROn1_VSn1_VWA1_VWB1_WSGRA0_WSGRB0_WS32_WG32_4_1_WGM8_WGMXCC1_WGMXCCGn1
    SolutionIndex: 15
    SolutionNameMin: Cijk_Alik_Bljk_BBS_BH_Bias_HA_S_SAV_UserArgs_MT32x64x64_MI16x16x1_SN_LDSB0_AFC1_AG0_AFEM1_AFEM1_ASEM1_CLR0_CADS0_DTLA0_DTLB0_DTVA0_DTVB0_EPS0_FDSI0_GRPM1_GRVWA8_GRVWB8_GSU1_GSUAMB_GSUC0_GSUWGMRR0_GLS0_ISA1151_IU1_K1_LDSTI0_LBSPPA128_LBSPPB128_LBSPPM0_LPA8_LPB8_LPM0_LRVW16_LWPMn1_MIAV1_MIWT2_1_MO40_NTn1_NTA0_NTB0_NTC0_NTD0_NTM0_NEPBS0_NLCA1_NLCB1_ONLL1_PGR1_PLR1_PKA0_SIA1_SS1_SU32_SUM0_SUS256_SPO0_SRVW0_SSO0_SVW1_SK0_SKFTR0_SKXCCM0_TLDS1_ULSGRO0_USL1_UIOFGRO0_USFGROn1_VSn1_VWA1_VWB1_WSGRA0_WSGRB0_WS32_WG16_8_1_WGM8_WGMXCC1_WGMXCCGn1
    SolutionIndex: 16
    SolutionNameMin: Cijk_Alik_Bljk_BBS_BH_Bias_HA_S_SAV_UserArgs_MT16x64x64_MI16x16x1_SN_LDSB0_AFC1_AG0_AFEM1_AFEM1_ASEM1_CLR0_CADS0_DTLA0_DTLB0_DTVA0_DTVB0_EPS0_FDSI0_GRPM1_GRVWA8_GRVWB8_GSU1_GSUAMB_GSUC0_GSUWGMRR0_GLS0_ISA1151_IU1_K1_LDSTI0_LBSPPA128_LBSPPB128_LBSPPM0_LPA8_LPB8_LPM0_LRVW16_LWPMn1_MIAV1_MIWT1_1_MO40_NTn1_NTA0_NTB0_NTC0_NTD0_NTM0_NEPBS0_NLCA1_NLCB1_ONLL1_PGR2_PLR1_PKA0_SIA1_SS1_SU32_SUM0_SUS256_SPO0_SRVW0_SSO0_SVW1_SK0_SKFTR0_SKXCCM0_TLDS1_ULSGRO0_USL1_UIOFGRO0_USFGROn1_VSn1_VWA1_VWB1_WSGRA0_WSGRB0_WS32_WG16_8_1_WGM8_WGMXCC1_WGMXCCGn1
    SolutionIndex: 17
    SolutionNameMin: Cijk_Alik_Bljk_BBS_BH_Bias_HA_S_SAV_UserArgs_MT16x16x32_MI16x16x1_SN_LDSB0_AFC1_AG0_AFEM1_AFEM1_ASEM1_CLR0_CADS0_DTLA0_DTLB0_DTVA0_DTVB0_EPS0_FDSI0_GRPM1_GRVWA8_GRVWB8_GSU1_GSUAMB_GSUC0_GSUWGMRR0_GLS0_ISA1151_IU1_K1_LDSTI0_LBSPPA128_LBSPPB128_LBSPPM0_LPA8_LPB8_LPM0_LRVW16_LWPMn1_MIAV1_MIWT1_1_MO40_NTn1_NTA0_NTB0_NTC0_NTD0_NTM0_NEPBS0_NLCA1_NLCB1_ONLL1_PGR2_PLR1_PKA0_SIA3_SS1_SU32_SUM0_SUS256_SPO0_SRVW0_SSO0_SVW1_SK0_SKFTR0_SKXCCM0_TLDS1_ULSGRO0_USL1_UIOFGRO0_USFGROn1_VSn1_VWA1_VWB1_WSGRA0_WSGRB0_WS32_WG16_2_1_WGM8_WGMXCC1_WGMXCCGn1
    SolutionIndex: 18
    SolutionNameMin: Cijk_Alik_Bljk_BBS_BH_Bias_HA_S_SAV_UserArgs_MT32x64x128_MI16x16x1_SN_LDSB0_AFC1_AG0_AFEM1_AFEM1_ASEM1_CLR0_CADS0_DTLA0_DTLB0_DTVA0_DTVB0_EPS0_FDSI0_GRPM1_GRVWA8_GRVWB8_GSU1_GSUAMB_GSUC0_GSUWGMRR0_GLS0_ISA1151_IU1_K1_LDSTI0_LBSPPA256_LBSPPB256_LBSPPM0_LPA8_LPB8_LPM0_LRVW16_LWPMn1_MIAV1_MIWT2_1_MO40_NTn1_NTA0_NTB0_NTC0_NTD0_NTM0_NEPBS0_NLCA1_NLCB1_ONLL1_PGR1_PLR1_PKA0_SIA1_SS1_SU32_SUM0_SUS256_SPO0_SRVW0_SSO0_SVW1_SK0_SKFTR0_SKXCCM0_TLDS1_ULSGRO0_USL1_UIOFGRO0_USFGROn1_VSn1_VWA1_VWB1_WSGRA0_WSGRB0_WS32_WG16_8_1_WGM8_WGMXCC1_WGMXCCGn1
    SolutionIndex: 19
    SolutionNameMin: Cijk_Alik_Bljk_BBS_BH_Bias_HA_S_SAV_UserArgs_MT64x32x128_MI16x16x1_SN_LDSB0_AFC1_AG0_AFEM1_AFEM1_ASEM1_CLR0_CADS0_DTLA0_DTLB0_DTVA0_DTVB0_EPS0_FDSI0_GRPM1_GRVWA8_GRVWB8_GSU1_GSUAMB_GSUC0_GSUWGMRR0_GLS0_ISA1151_IU1_K1_LDSTI0_LBSPPA256_LBSPPB256_LBSPPM0_LPA8_LPB8_LPM0_LRVW16_LWPMn1_MIAV1_MIWT2_1_MO40_NTn1_NTA0_NTB0_NTC0_NTD0_NTM0_NEPBS0_NLCA1_NLCB1_ONLL1_PGR2_PLR1_PKA0_SIA1_SS1_SU32_SUM0_SUS256_SPO0_SRVW0_SSO0_SVW1_SK0_SKFTR0_SKXCCM0_TLDS1_ULSGRO0_USL1_UIOFGRO0_USFGROn1_VSn1_VWA1_VWB1_WSGRA0_WSGRB0_WS32_WG32_4_1_WGM8_WGMXCC1_WGMXCCGn1
    SolutionIndex: 20
    SolutionNameMin: Cijk_Alik_Bljk_BBS_BH_Bias_HA_S_SAV_UserArgs_MT32x64x128_MI16x16x1_SN_LDSB0_AFC1_AG0_AFEM1_AFEM1_ASEM1_CLR0_CADS0_DTLA0_DTLB0_DTVA0_DTVB0_EPS0_FDSI0_GRPM1_GRVWA8_GRVWB8_GSU1_GSUAMB_GSUC0_GSUWGMRR0_GLS0_ISA1151_IU1_K1_LDSTI0_LBSPPA256_LBSPPB256_LBSPPM0_LPA8_LPB8_LPM0_LRVW16_LWPMn1_MIAV1_MIWT2_1_MO40_NTn1_NTA0_NTB0_NTC0_NTD0_NTM0_NEPBS0_NLCA1_NLCB1_ONLL1_PGR2_PLR1_PKA0_SIA1_SS1_SU32_SUM0_SUS256_SPO0_SRVW0_SSO0_SVW1_SK0_SKFTR0_SKXCCM0_TLDS1_ULSGRO0_USL1_UIOFGRO0_USFGROn1_VSn1_VWA1_VWB1_WSGRA0_WSGRB0_WS32_WG16_8_1_WGM8_WGMXCC1_WGMXCCGn1
    SolutionIndex: 21
    SolutionNameMin: Cijk_Alik_Bljk_BBS_BH_Bias_HA_S_SAV_UserArgs_MT64x32x32_MI16x16x1_SN_LDSB0_AFC1_AG0_AFEM1_AFEM1_ASEM1_CLR0_CADS0_DTLA0_DTLB0_DTVA0_DTVB0_EPS0_FDSI0_GRPM1_GRVWA8_GRVWB8_GSU1_GSUAMB_GSUC0_GSUWGMRR0_GLS0_ISA1151_IU1_K1_LDSTI0_LBSPPA128_LBSPPB128_LBSPPM0_LPA8_LPB8_LPM0_LRVW16_LWPMn1_MIAV1_MIWT2_1_MO40_NTn1_NTA0_NTB0_NTC0_NTD0_NTM0_NEPBS0_NLCA1_NLCB1_ONLL1_PGR2_PLR1_PKA0_SIA1_SS1_SU32_SUM0_SUS256_SPO0_SRVW0_SSO0_SVW1_SK0_SKFTR0_SKXCCM0_TLDS1_ULSGRO0_USL1_UIOFGRO0_USFGROn1_VSn1_VWA1_VWB1_WSGRA0_WSGRB0_WS32_WG32_4_1_WGM8_WGMXCC1_WGMXCCGn1
    SolutionIndex: 22
    SolutionNameMin: Cijk_Alik_Bljk_BBS_BH_Bias_HA_S_SAV_UserArgs_MT64x32x64_MI16x16x1_SN_LDSB0_AFC1_AG0_AFEM1_AFEM1_ASEM1_CLR0_CADS0_DTLA0_DTLB0_DTVA0_DTVB0_EPS0_FDSI0_GRPM1_GRVWA8_GRVWB8_GSU1_GSUAMB_GSUC0_GSUWGMRR0_GLS0_ISA1151_IU1_K1_LDSTI0_LBSPPA128_LBSPPB128_LBSPPM0_LPA8_LPB8_LPM0_LRVW16_LWPMn1_MIAV1_MIWT2_1_MO40_NTn1_NTA0_NTB0_NTC0_NTD0_NTM0_NEPBS0_NLCA1_NLCB1_ONLL1_PGR1_PLR1_PKA0_SIA1_SS1_SU32_SUM0_SUS256_SPO0_SRVW0_SSO0_SVW1_SK0_SKFTR0_SKXCCM0_TLDS1_ULSGRO0_USL1_UIOFGRO0_USFGROn1_VSn1_VWA1_VWB1_WSGRA0_WSGRB0_WS32_WG32_4_1_WGM8_WGMXCC1_WGMXCCGn1
    SolutionIndex: 23
    SolutionNameMin: Cijk_Alik_Bljk_BBS_BH_Bias_HA_S_SAV_UserArgs_MT64x64x128_MI16x16x1_SN_LDSB1_AFC1_AG0_AFEM1_AFEM1_ASEM1_CLR0_CADS0_DTLA0_DTLB0_DTVA0_DTVB0_EPS0_FDSI0_GRPM1_GRVWA8_GRVWB8_GSU1_GSUAMB_GSUC0_GSUWGMRR0_GLS0_ISA1151_IU1_K1_LDSTI0_LBSPPA256_LBSPPB256_LBSPPM0_LPA8_LPB8_LPM0_LRVW16_LWPMn1_MIAV1_MIWT2_2_MO40_NTn1_NTA0_NTB0_NTC0_NTD0_NTM0_NEPBS0_NLCA1_NLCB1_ONLL1_PGR2_PLR1_PKA0_SIA3_SS1_SU32_SUM0_SUS256_SPO0_SRVW0_SSO0_SVW1_SK0_SKFTR0_SKXCCM0_TLDS1_ULSGRO0_USL1_UIOFGRO0_USFGROn1_VSn1_VWA1_VWB1_WSGRA0_WSGRB0_WS32_WG32_4_1_WGM8_WGMXCC1_WGMXCCGn1
    SolutionIndex: 24
    SolutionNameMin: Cijk_Alik_Bljk_BBS_BH_Bias_HA_S_SAV_UserArgs_MT64x64x32_MI16x16x1_SN_LDSB0_AFC1_AG0_AFEM1_AFEM1_ASEM1_CLR0_CADS0_DTLA0_DTLB0_DTVA0_DTVB0_EPS0_FDSI0_GRPM1_GRVWA8_GRVWB8_GSU1_GSUAMB_GSUC0_GSUWGMRR0_GLS0_ISA1151_IU1_K1_LDSTI0_LBSPPA128_LBSPPB128_LBSPPM0_LPA8_LPB8_LPM0_LRVW16_LWPMn1_MIAV1_MIWT2_2_MO40_NTn1_NTA0_NTB0_NTC0_NTD0_NTM0_NEPBS0_NLCA1_NLCB1_ONLL1_PGR2_PLR1_PKA0_SIA1_SS1_SU32_SUM0_SUS256_SPO0_SRVW0_SSO0_SVW1_SK0_SKFTR0_SKXCCM0_TLDS1_ULSGRO0_USL1_UIOFGRO0_USFGROn1_VSn1_VWA1_VWB1_WSGRA0_WSGRB0_WS32_WG32_4_1_WGM8_WGMXCC1_WGMXCCGn1
    SolutionIndex: 25
    SolutionNameMin: Cijk_Alik_Bljk_BBS_BH_Bias_HA_S_SAV_UserArgs_MT128x32x32_MI16x16x1_SN_LDSB0_AFC1_AG0_AFEM1_AFEM1_ASEM1_CLR0_CADS0_DTLA0_DTLB0_DTVA0_DTVB0_EPS0_FDSI0_GRPM1_GRVWA8_GRVWB8_GSU1_GSUAMB_GSUC0_GSUWGMRR0_GLS0_ISA1151_IU1_K1_LDSTI0_LBSPPA128_LBSPPB128_LBSPPM0_LPA8_LPB8_LPM0_LRVW16_LWPMn1_MIAV1_MIWT2_2_MO40_NTn1_NTA0_NTB0_NTC0_NTD0_NTM0_NEPBS0_NLCA1_NLCB1_ONLL1_PGR1_PLR1_PKA0_SIA3_SS1_SU32_SUM0_SUS256_SPO0_SRVW0_SSO0_SVW1_SK0_SKFTR0_SKXCCM0_TLDS1_ULSGRO0_USL1_UIOFGRO0_USFGROn1_VSn1_VWA1_VWB1_WSGRA0_WSGRB0_WS32_WG64_2_1_WGM8_WGMXCC1_WGMXCCGn1
    SolutionIndex: 26
    SolutionNameMin: Cijk_Alik_Bljk_BBS_BH_Bias_HA_S_SAV_UserArgs_MT64x64x64_MI16x16x1_SN_LDSB1_AFC1_AG0_AFEM1_AFEM1_ASEM1_CLR0_CADS0_DTLA0_DTLB0_DTVA0_DTVB0_EPS0_FDSI0_GRPM1_GRVWA8_GRVWB8_GSU1_GSUAMB_GSUC0_GSUWGMRR0_GLS0_ISA1151_IU1_K1_LDSTI0_LBSPPA128_LBSPPB128_LBSPPM0_LPA8_LPB8_LPM0_LRVW16_LWPMn1_MIAV1_MIWT2_2_MO40_NTn1_NTA0_NTB0_NTC0_NTD0_NTM0_NEPBS0_NLCA1_NLCB1_ONLL1_PGR1_PLR1_PKA0_SIA3_SS1_SU32_SUM0_SUS256_SPO0_SRVW0_SSO0_SVW1_SK0_SKFTR0_SKXCCM0_TLDS1_ULSGRO0_USL1_UIOFGRO0_USFGROn1_VSn1_VWA1_VWB1_WSGRA0_WSGRB0_WS32_WG32_4_1_WGM8_WGMXCC1_WGMXCCGn1
    SolutionIndex: 27
    SolutionNameMin: Cijk_Alik_Bljk_BBS_BH_Bias_HA_S_SAV_UserArgs_MT64x64x32_MI16x16x1_SN_LDSB0_AFC1_AG0_AFEM1_AFEM1_ASEM1_CLR0_CADS0_DTLA0_DTLB0_DTVA0_DTVB0_EPS0_FDSI0_GRPM1_GRVWA8_GRVWB8_GSU1_GSUAMB_GSUC0_GSUWGMRR0_GLS0_ISA1151_IU1_K1_LDSTI0_LBSPPA128_LBSPPB128_LBSPPM0_LPA8_LPB8_LPM0_LRVW16_LWPMn1_MIAV1_MIWT2_2_MO40_NTn1_NTA0_NTB0_NTC0_NTD0_NTM0_NEPBS0_NLCA1_NLCB1_ONLL1_PGR2_PLR0_PKA0_SIA3_SS1_SU32_SUM0_SUS256_SPO0_SRVW0_SSO0_SVW1_SK0_SKFTR0_SKXCCM0_TLDS1_ULSGRO0_USL1_UIOFGRO0_USFGROn1_VSn1_VWA1_VWB1_WSGRA0_WSGRB0_WS32_WG32_4_1_WGM8_WGMXCC1_WGMXCCGn1
    SolutionIndex: 28
    SolutionNameMin: Cijk_Alik_Bljk_BBS_BH_Bias_HA_S_SAV_UserArgs_MT128x64x32_MI16x16x1_SN_LDSB0_AFC1_AG0_AFEM1_AFEM1_ASEM1_CLR0_CADS0_DTLA0_DTLB0_DTVA0_DTVB0_EPS0_FDSI0_GRPM1_GRVWA8_GRVWB8_GSU1_GSUAMB_GSUC0_GSUWGMRR0_GLS0_ISA1151_IU1_K1_LDSTI0_LBSPPA128_LBSPPB128_LBSPPM0_LPA8_LPB8_LPM0_LRVW16_LWPMn1_MIAV1_MIWT4_2_MO40_NTn1_NTA0_NTB0_NTC0_NTD0_NTM0_NEPBS0_NLCA1_NLCB1_ONLL1_PGR2_PLR0_PKA0_SIA1_SS1_SU32_SUM0_SUS256_SPO0_SRVW0_SSO0_SVW1_SK0_SKFTR0_SKXCCM0_TLDS1_ULSGRO0_USL1_UIOFGRO0_USFGROn1_VSn1_VWA1_VWB1_WSGRA0_WSGRB0_WS32_WG32_4_1_WGM8_WGMXCC1_WGMXCCGn1
    SolutionIndex: 29
    SolutionNameMin: Cijk_Alik_Bljk_BBS_BH_Bias_HA_S_SAV_UserArgs_MT128x64x64_MI16x16x1_SN_LDSB0_AFC1_AG0_AFEM1_AFEM1_ASEM1_CLR0_CADS0_DTLA0_DTLB0_DTVA0_DTVB0_EPS0_FDSI0_GRPM1_GRVWA8_GRVWB8_GSU1_GSUAMB_GSUC0_GSUWGMRR0_GLS0_ISA1151_IU1_K1_LDSTI0_LBSPPA128_LBSPPB128_LBSPPM0_LPA8_LPB8_LPM0_LRVW16_LWPMn1_MIAV1_MIWT4_2_MO40_NTn1_NTA0_NTB0_NTC0_NTD0_NTM0_NEPBS0_NLCA1_NLCB1_ONLL1_PGR2_PLR0_PKA0_SIA1_SS1_SU32_SUM0_SUS256_SPO0_SRVW0_SSO0_SVW1_SK0_SKFTR0_SKXCCM0_TLDS1_ULSGRO0_USL1_UIOFGRO0_USFGROn1_VSn1_VWA1_VWB1_WSGRA0_WSGRB0_WS32_WG32_4_1_WGM8_WGMXCC1_WGMXCCGn1
    SolutionIndex: 30
    SolutionNameMin: Cijk_Alik_Bljk_BBS_BH_Bias_HA_S_SAV_UserArgs_MT128x64x64_MI16x16x1_SN_LDSB0_AFC1_AG0_AFEM1_AFEM1_ASEM1_CLR0_CADS0_DTLA0_DTLB0_DTVA0_DTVB0_EPS0_FDSI0_GRPM1_GRVWA8_GRVWB8_GSU1_GSUAMB_GSUC0_GSUWGMRR0_GLS0_ISA1151_IU1_K1_LDSTI0_LBSPPA128_LBSPPB128_LBSPPM0_LPA8_LPB8_LPM0_LRVW16_LWPMn1_MIAV1_MIWT2_4_MO40_NTn1_NTA0_NTB0_NTC0_NTD0_NTM0_NEPBS0_NLCA1_NLCB1_ONLL1_PGR2_PLR1_PKA0_SIA1_SS1_SU32_SUM0_SUS256_SPO0_SRVW0_SSO0_SVW1_SK0_SKFTR0_SKXCCM0_TLDS1_ULSGRO0_USL1_UIOFGRO0_USFGROn1_VSn1_VWA1_VWB1_WSGRA0_WSGRB0_WS32_WG64_2_1_WGM8_WGMXCC1_WGMXCCGn1
    SolutionIndex: 31
    SolutionNameMin: Cijk_Alik_Bljk_BBS_BH_Bias_HA_S_SAV_UserArgs_MT64x128x32_MI16x16x1_SN_LDSB0_AFC1_AG0_AFEM1_AFEM1_ASEM1_CLR0_CADS0_DTLA0_DTLB0_DTVA0_DTVB0_EPS0_FDSI0_GRPM1_GRVWA8_GRVWB8_GSU1_GSUAMB_GSUC0_GSUWGMRR0_GLS0_ISA1151_IU1_K1_LDSTI0_LBSPPA128_LBSPPB128_LBSPPM0_LPA8_LPB8_LPM0_LRVW16_LWPMn1_MIAV1_MIWT2_4_MO40_NTn1_NTA0_NTB0_NTC0_NTD0_NTM0_NEPBS0_NLCA1_NLCB1_ONLL1_PGR2_PLR1_PKA0_SIA1_SS1_SU32_SUM0_SUS256_SPO0_SRVW0_SSO0_SVW1_SK0_SKFTR0_SKXCCM0_TLDS1_ULSGRO0_USL1_UIOFGRO0_USFGROn1_VSn1_VWA1_VWB1_WSGRA0_WSGRB0_WS32_WG32_4_1_WGM8_WGMXCC1_WGMXCCGn1
    SolutionIndex: 32
    SolutionNameMin: Cijk_Alik_Bljk_BBS_BH_Bias_HA_S_SAV_UserArgs_MT128x64x32_MI16x16x1_SN_LDSB0_AFC1_AG0_AFEM1_AFEM1_ASEM1_CLR0_CADS0_DTLA0_DTLB0_DTVA0_DTVB0_EPS0_FDSI0_GRPM1_GRVWA8_GRVWB8_GSU1_GSUAMB_GSUC0_GSUWGMRR0_GLS0_ISA1151_IU1_K1_LDSTI0_LBSPPA128_LBSPPB128_LBSPPM0_LPA8_LPB8_LPM0_LRVW16_LWPMn1_MIAV1_MIWT2_4_MO40_NTn1_NTA0_NTB0_NTC0_NTD0_NTM0_NEPBS0_NLCA1_NLCB1_ONLL1_PGR2_PLR1_PKA0_SIA3_SS1_SU32_SUM0_SUS256_SPO0_SRVW0_SSO0_SVW1_SK0_SKFTR0_SKXCCM0_TLDS1_ULSGRO0_USL1_UIOFGRO0_USFGROn1_VSn1_VWA1_VWB1_WSGRA0_WSGRB0_WS32_WG64_2_1_WGM8_WGMXCC1_WGMXCCGn1
    SolutionIndex: 33
    SolutionNameMin: Cijk_Alik_Bljk_BBS_BH_Bias_HA_S_SAV_UserArgs_MT128x64x32_MI16x16x1_SN_LDSB0_AFC1_AG0_AFEM1_AFEM1_ASEM1_CLR0_CADS0_DTLA0_DTLB0_DTVA0_DTVB0_EPS0_FDSI0_GRPM1_GRVWA8_GRVWB8_GSU1_GSUAMB_GSUC0_GSUWGMRR0_GLS0_ISA1151_IU1_K1_LDSTI0_LBSPPA128_LBSPPB128_LBSPPM0_LPA8_LPB8_LPM0_LRVW16_LWPMn1_MIAV1_MIWT4_2_MO40_NTn1_NTA0_NTB0_NTC0_NTD0_NTM0_NEPBS0_NLCA1_NLCB1_ONLL1_PGR2_PLR1_PKA0_SIA3_SS1_SU32_SUM0_SUS256_SPO0_SRVW0_SSO0_SVW1_SK0_SKFTR0_SKXCCM0_TLDS1_ULSGRO0_USL1_UIOFGRO0_USFGROn1_VSn1_VWA1_VWB1_WSGRA0_WSGRB0_WS32_WG32_4_1_WGM8_WGMXCC1_WGMXCCGn1
    SolutionIndex: 34
    SolutionNameMin: Cijk_Alik_Bljk_BBS_BH_Bias_HA_S_SAV_UserArgs_MT128x64x64_MI16x16x1_SN_LDSB1_AFC1_AG0_AFEM1_AFEM1_ASEM1_CLR0_CADS0_DTLA0_DTLB0_DTVA0_DTVB0_EPS0_FDSI0_GRPM1_GRVWA8_GRVWB8_GSU1_GSUAMB_GSUC0_GSUWGMRR0_GLS0_ISA1151_IU1_K1_LDSTI0_LBSPPA128_LBSPPB128_LBSPPM0_LPA8_LPB8_LPM0_LRVW16_LWPMn1_MIAV1_MIWT2_4_MO40_NTn1_NTA0_NTB0_NTC0_NTD0_NTM0_NEPBS0_NLCA1_NLCB1_ONLL1_PGR2_PLR1_PKA0_SIA3_SS1_SU32_SUM0_SUS256_SPO0_SRVW0_SSO0_SVW1_SK0_SKFTR0_SKXCCM0_TLDS1_ULSGRO0_USL1_UIOFGRO0_USFGROn1_VSn1_VWA1_VWB1_WSGRA0_WSGRB0_WS32_WG64_2_1_WGM8_WGMXCC1_WGMXCCGn1
    SolutionIndex: 35
    SolutionNameMin: Cijk_Alik_Bljk_BBS_BH_Bias_HA_S_SAV_UserArgs_MT64x128x32_MI16x16x1_SN_LDSB0_AFC1_AG0_AFEM1_AFEM1_ASEM1_CLR0_CADS0_DTLA0_DTLB0_DTVA0_DTVB0_EPS0_FDSI0_GRPM1_GRVWA8_GRVWB8_GSU1_GSUAMB_GSUC0_GSUWGMRR0_GLS0_ISA1151_IU1_K1_LDSTI0_LBSPPA128_LBSPPB128_LBSPPM0_LPA8_LPB8_LPM0_LRVW16_LWPMn1_MIAV1_MIWT2_4_MO40_NTn1_NTA0_NTB0_NTC0_NTD0_NTM0_NEPBS0_NLCA1_NLCB1_ONLL1_PGR1_PLR0_PKA0_SIA3_SS1_SU32_SUM0_SUS256_SPO0_SRVW0_SSO0_SVW1_SK0_SKFTR0_SKXCCM0_TLDS1_ULSGRO0_USL1_UIOFGRO0_USFGROn1_VSn1_VWA1_VWB1_WSGRA0_WSGRB0_WS32_WG32_4_1_WGM8_WGMXCC1_WGMXCCGn1
    SolutionIndex: 36
    SolutionNameMin: Cijk_Alik_Bljk_BBS_BH_Bias_HA_S_SAV_UserArgs_MT64x128x32_MI16x16x1_SN_LDSB0_AFC1_AG0_AFEM1_AFEM1_ASEM1_CLR0_CADS0_DTLA0_DTLB0_DTVA0_DTVB0_EPS0_FDSI0_GRPM1_GRVWA8_GRVWB8_GSU1_GSUAMB_GSUC0_GSUWGMRR0_GLS0_ISA1151_IU1_K1_LDSTI0_LBSPPA128_LBSPPB128_LBSPPM0_LPA8_LPB8_LPM0_LRVW16_LWPMn1_MIAV1_MIWT4_2_MO40_NTn1_NTA0_NTB0_NTC0_NTD0_NTM0_NEPBS0_NLCA1_NLCB1_ONLL1_PGR2_PLR1_PKA0_SIA3_SS1_SU32_SUM0_SUS256_SPO0_SRVW0_SSO0_SVW1_SK0_SKFTR0_SKXCCM0_TLDS1_ULSGRO0_USL1_UIOFGRO0_USFGROn1_VSn1_VWA1_VWB1_WSGRA0_WSGRB0_WS32_WG16_8_1_WGM8_WGMXCC1_WGMXCCGn1
    SolutionIndex: 37
    SolutionNameMin: Cijk_Alik_Bljk_BBS_BH_Bias_HA_S_SAV_UserArgs_MT128x128x32_MI16x16x1_SN_LDSB0_AFC1_AG0_AFEM1_AFEM1_ASEM1_CLR0_CADS0_DTLA0_DTLB0_DTVA0_DTVB0_EPS0_FDSI0_GRPM1_GRVWA8_GRVWB8_GSU1_GSUAMB_GSUC0_GSUWGMRR0_GLS0_ISA1151_IU1_K1_LDSTI0_LBSPPA128_LBSPPB128_LBSPPM0_LPA8_LPB8_LPM0_LRVW16_LWPMn1_MIAV1_MIWT2_8_MO40_NTn1_NTA0_NTB0_NTC0_NTD0_NTM0_NEPBS0_NLCA1_NLCB1_ONLL1_PGR0_PLR0_PKA0_SIA3_SS1_SU32_SUM0_SUS256_SPO0_SRVW0_SSO0_SVW1_SK0_SKFTR0_SKXCCM0_TLDS1_ULSGRO0_USL1_UIOFGRO0_USFGROn1_VSn1_VWA1_VWB1_WSGRA0_WSGRB0_WS32_WG64_2_1_WGM8_WGMXCC1_WGMXCCGn1
    SolutionIndex: 38
    SolutionNameMin: Cijk_Alik_Bljk_BBS_BH_Bias_HA_S_SAV_UserArgs_MT128x128x32_MI16x16x1_SN_LDSB0_AFC1_AG0_AFEM1_AFEM1_ASEM1_CLR0_CADS0_DTLA0_DTLB0_DTVA0_DTVB0_EPS0_FDSI0_GRPM1_GRVWA8_GRVWB8_GSU1_GSUAMB_GSUC0_GSUWGMRR0_GLS0_ISA1151_IU1_K1_LDSTI0_LBSPPA128_LBSPPB128_LBSPPM0_LPA8_LPB8_LPM0_LRVW16_LWPMn1_MIAV1_MIWT4_4_MO40_NTn1_NTA0_NTB0_NTC0_NTD0_NTM0_NEPBS0_NLCA1_NLCB1_ONLL1_PGR0_PLR0_PKA0_SIA1_SS1_SU32_SUM0_SUS256_SPO0_SRVW0_SSO0_SVW1_SK0_SKFTR0_SKXCCM0_TLDS1_ULSGRO0_USL1_UIOFGRO0_USFGROn1_VSn1_VWA1_VWB1_WSGRA0_WSGRB0_WS32_WG32_4_1_WGM8_WGMXCC1_WGMXCCGn1
    SolutionIndex: 39
    SolutionNameMin: Cijk_Alik_Bljk_BBS_BH_Bias_HA_S_SAV_UserArgs_MT64x32x32_MI16x16x1_SN_LDSB0_AFC1_AG0_AFEM1_AFEM1_ASEM1_CLR0_CADS0_DTLA0_DTLB0_DTVA0_DTVB0_EPS0_FDSI0_GRPM1_GRVWA8_GRVWB8_GSU1_GSUAMB_GSUC0_GSUWGMRR0_GLS0_ISA1151_IU1_K1_LDSTI0_LBSPPA128_LBSPPB128_LBSPPM0_LPA8_LPB8_LPM0_LRVW16_LWPMn1_MIAV1_MIWT2_1_MO40_NTn1_NTA0_NTB0_NTC0_NTD0_NTM0_NEPBS0_NLCA1_NLCB1_ONLL1_PGR1_PLR1_PKA0_SIA1_SS1_SU32_SUM0_SUS256_SPO0_SRVW0_SSO0_SVW1_SK0_SKFTR0_SKXCCM0_TLDS1_ULSGRO0_USL1_UIOFGRO0_USFGROn1_VSn1_VWA1_VWB1_WSGRA0_WSGRB0_WS32_WG32_4_1_WGM8_WGMXCC1_WGMXCCGn1
    SolutionIndex: 40
    SolutionNameMin: Cijk_Alik_Bljk_BBS_BH_Bias_HA_S_SAV_UserArgs_MT64x32x64_MI16x16x1_SN_LDSB0_AFC1_AG0_AFEM1_AFEM1_ASEM1_CLR0_CADS0_DTLA0_DTLB0_DTVA0_DTVB0_EPS0_FDSI0_GRPM1_GRVWA8_GRVWB8_GSU1_GSUAMB_GSUC0_GSUWGMRR0_GLS0_ISA1151_IU1_K1_LDSTI0_LBSPPA128_LBSPPB128_LBSPPM0_LPA8_LPB8_LPM0_LRVW16_LWPMn1_MIAV1_MIWT2_1_MO40_NTn1_NTA0_NTB0_NTC0_NTD0_NTM0_NEPBS0_NLCA1_NLCB1_ONLL1_PGR2_PLR1_PKA0_SIA1_SS1_SU32_SUM0_SUS256_SPO0_SRVW0_SSO0_SVW1_SK0_SKFTR0_SKXCCM0_TLDS1_ULSGRO0_USL1_UIOFGRO0_USFGROn1_VSn1_VWA1_VWB1_WSGRA0_WSGRB0_WS32_WG32_4_1_WGM8_WGMXCC1_WGMXCCGn1
    SolutionIndex: 41
    SolutionNameMin: Cijk_Alik_Bljk_BBS_BH_Bias_HA_S_SAV_UserArgs_MT64x64x32_MI16x16x1_SN_LDSB0_AFC1_AG0_AFEM1_AFEM1_ASEM1_CLR0_CADS0_DTLA0_DTLB0_DTVA0_DTVB0_EPS0_FDSI0_GRPM1_GRVWA8_GRVWB8_GSU1_GSUAMB_GSUC0_GSUWGMRR0_GLS0_ISA1151_IU1_K1_LDSTI0_LBSPPA128_LBSPPB128_LBSPPM0_LPA8_LPB8_LPM0_LRVW16_LWPMn1_MIAV1_MIWT2_2_MO40_NTn1_NTA0_NTB0_NTC0_NTD0_NTM0_NEPBS0_NLCA1_NLCB1_ONLL1_PGR2_PLR1_PKA0_SIA3_SS1_SU32_SUM0_SUS256_SPO0_SRVW0_SSO0_SVW1_SK0_SKFTR0_SKXCCM0_TLDS1_ULSGRO0_USL1_UIOFGRO0_USFGROn1_VSn1_VWA1_VWB1_WSGRA0_WSGRB0_WS32_WG32_4_1_WGM8_WGMXCC1_WGMXCCGn1
    SolutionIndex: 42
    SolutionNameMin: Cijk_Alik_Bljk_BBS_BH_Bias_HA_S_SAV_UserArgs_MT64x64x32_MI16x16x1_SN_LDSB0_AFC1_AG0_AFEM1_AFEM1_ASEM1_CLR0_CADS0_DTLA0_DTLB0_DTVA0_DTVB0_EPS0_FDSI0_GRPM1_GRVWA8_GRVWB8_GSU1_GSUAMB_GSUC0_GSUWGMRR0_GLS0_ISA1151_IU1_K1_LDSTI0_LBSPPA128_LBSPPB128_LBSPPM0_LPA8_LPB8_LPM0_LRVW16_LWPMn1_MIAV1_MIWT2_2_MO40_NTn1_NTA0_NTB0_NTC0_NTD0_NTM0_NEPBS0_NLCA1_NLCB1_ONLL1_PGR2_PLR0_PKA0_SIA1_SS1_SU32_SUM0_SUS256_SPO0_SRVW0_SSO0_SVW1_SK0_SKFTR0_SKXCCM0_TLDS1_ULSGRO0_USL1_UIOFGRO0_USFGROn1_VSn1_VWA1_VWB1_WSGRA0_WSGRB0_WS32_WG32_4_1_WGM8_WGMXCC1_WGMXCCGn1
    SolutionIndex: 43
    SolutionNameMin: Cijk_Alik_Bljk_BBS_BH_Bias_HA_S_SAV_UserArgs_MT64x64x64_MI16x16x1_SN_LDSB1_AFC1_AG0_AFEM1_AFEM1_ASEM1_CLR0_CADS0_DTLA0_DTLB0_DTVA0_DTVB0_EPS0_FDSI0_GRPM1_GRVWA8_GRVWB8_GSU1_GSUAMB_GSUC0_GSUWGMRR0_GLS0_ISA1151_IU1_K1_LDSTI0_LBSPPA128_LBSPPB128_LBSPPM0_LPA8_LPB8_LPM0_LRVW16_LWPMn1_MIAV1_MIWT2_2_MO40_NTn1_NTA0_NTB0_NTC0_NTD0_NTM0_NEPBS0_NLCA1_NLCB1_ONLL1_PGR2_PLR1_PKA0_SIA3_SS1_SU32_SUM0_SUS256_SPO0_SRVW0_SSO0_SVW1_SK0_SKFTR0_SKXCCM0_TLDS1_ULSGRO0_USL1_UIOFGRO0_USFGROn1_VSn1_VWA1_VWB1_WSGRA0_WSGRB0_WS32_WG32_4_1_WGM8_WGMXCC1_WGMXCCGn1
    SolutionIndex: 44
    SolutionNameMin: Cijk_Alik_Bljk_BBS_BH_Bias_HA_S_SAV_UserArgs_MT64x32x32_MI16x16x1_SN_LDSB1_AFC1_AG0_AFEM1_AFEM1_ASEM1_CLR0_CADS0_DTLA0_DTLB0_DTVA0_DTVB0_EPS0_FDSI0_GRPM1_GRVWA8_GRVWB8_GSU1_GSUAMB_GSUC0_GSUWGMRR0_GLS0_ISA1151_IU1_K1_LDSTI0_LBSPPA128_LBSPPB128_LBSPPM0_LPA8_LPB8_LPM0_LRVW16_LWPMn1_MIAV1_MIWT2_1_MO40_NTn1_NTA0_NTB0_NTC0_NTD0_NTM0_NEPBS0_NLCA1_NLCB1_ONLL1_PGR2_PLR1_PKA0_SIA3_SS1_SU32_SUM0_SUS256_SPO0_SRVW0_SSO0_SVW1_SK0_SKFTR0_SKXCCM0_TLDS1_ULSGRO0_USL1_UIOFGRO0_USFGROn1_VSn1_VWA1_VWB1_WSGRA0_WSGRB0_WS32_WG32_4_1_WGM8_WGMXCC1_WGMXCCGn1
    SolutionIndex: 45
    SolutionNameMin: Cijk_Alik_Bljk_BBS_BH_Bias_HA_S_SAV_UserArgs_MT32x128x64_MI16x16x1_SN_LDSB0_AFC1_AG0_AFEM1_AFEM1_ASEM1_CLR0_CADS0_DTLA0_DTLB0_DTVA0_DTVB0_EPS0_FDSI0_GRPM1_GRVWA8_GRVWB8_GSU1_GSUAMB_GSUC0_GSUWGMRR0_GLS0_ISA1151_IU1_K1_LDSTI0_LBSPPA128_LBSPPB128_LBSPPM0_LPA8_LPB8_LPM0_LRVW16_LWPMn1_MIAV1_MIWT2_2_MO40_NTn1_NTA0_NTB0_NTC0_NTD0_NTM0_NEPBS0_NLCA1_NLCB1_ONLL1_PGR2_PLR1_PKA0_SIA1_SS1_SU32_SUM0_SUS256_SPO0_SRVW0_SSO0_SVW1_SK0_SKFTR0_SKXCCM0_TLDS1_ULSGRO0_USL1_UIOFGRO0_USFGROn1_VSn1_VWA1_VWB1_WSGRA0_WSGRB0_WS32_WG16_8_1_WGM8_WGMXCC1_WGMXCCGn1
    SolutionIndex: 46
    SolutionNameMin: Cijk_Alik_Bljk_BBS_BH_Bias_HA_S_SAV_UserArgs_MT32x128x32_MI16x16x1_SN_LDSB0_AFC1_AG0_AFEM1_AFEM1_ASEM1_CLR0_CADS0_DTLA0_DTLB0_DTVA0_DTVB0_EPS0_FDSI0_GRPM1_GRVWA8_GRVWB8_GSU1_GSUAMB_GSUC0_GSUWGMRR0_GLS0_ISA1151_IU1_K1_LDSTI0_LBSPPA128_LBSPPB128_LBSPPM0_LPA8_LPB8_LPM0_LRVW16_LWPMn1_MIAV1_MIWT2_2_MO40_NTn1_NTA0_NTB0_NTC0_NTD0_NTM0_NEPBS0_NLCA1_NLCB1_ONLL1_PGR2_PLR1_PKA0_SIA3_SS1_SU32_SUM0_SUS256_SPO0_SRVW0_SSO0_SVW1_SK0_SKFTR0_SKXCCM0_TLDS1_ULSGRO0_USL1_UIOFGRO0_USFGROn1_VSn1_VWA1_VWB1_WSGRA0_WSGRB0_WS32_WG16_8_1_WGM8_WGMXCC1_WGMXCCGn1
    SolutionIndex: 47
    SolutionNameMin: Cijk_Alik_Bljk_BBS_BH_Bias_HA_S_SAV_UserArgs_MT64x64x32_MI16x16x1_SN_LDSB0_AFC1_AG0_AFEM1_AFEM1_ASEM1_CLR0_CADS0_DTLA0_DTLB0_DTVA0_DTVB0_EPS0_FDSI0_GRPM1_GRVWA8_GRVWB8_GSU1_GSUAMB_GSUC0_GSUWGMRR0_GLS0_ISA1151_IU1_K1_LDSTI0_LBSPPA128_LBSPPB128_LBSPPM0_LPA8_LPB8_LPM0_LRVW16_LWPMn1_MIAV1_MIWT2_2_MO40_NTn1_NTA0_NTB0_NTC0_NTD0_NTM0_NEPBS0_NLCA1_NLCB1_ONLL1_PGR1_PLR1_PKA0_SIA3_SS1_SU32_SUM0_SUS256_SPO0_SRVW0_SSO0_SVW1_SK0_SKFTR0_SKXCCM0_TLDS1_ULSGRO0_USL1_UIOFGRO0_USFGROn1_VSn1_VWA1_VWB1_WSGRA0_WSGRB0_WS32_WG32_4_1_WGM8_WGMXCC1_WGMXCCGn1
    SolutionIndex: 48
    SolutionNameMin: Cijk_Alik_Bljk_BBS_BH_Bias_HA_S_SAV_UserArgs_MT64x128x64_MI16x16x1_SN_LDSB0_AFC1_AG0_AFEM1_AFEM1_ASEM1_CLR0_CADS0_DTLA0_DTLB0_DTVA0_DTVB0_EPS0_FDSI0_GRPM1_GRVWA8_GRVWB8_GSU1_GSUAMB_GSUC0_GSUWGMRR0_GLS0_ISA1151_IU1_K1_LDSTI0_LBSPPA128_LBSPPB128_LBSPPM0_LPA8_LPB8_LPM0_LRVW16_LWPMn1_MIAV1_MIWT2_4_MO40_NTn1_NTA0_NTB0_NTC0_NTD0_NTM0_NEPBS0_NLCA1_NLCB1_ONLL1_PGR1_PLR1_PKA0_SIA3_SS1_SU32_SUM0_SUS256_SPO0_SRVW0_SSO0_SVW1_SK0_SKFTR0_SKXCCM0_TLDS1_ULSGRO0_USL1_UIOFGRO0_USFGROn1_VSn1_VWA1_VWB1_WSGRA0_WSGRB0_WS32_WG32_4_1_WGM8_WGMXCC1_WGMXCCGn1
    SolutionIndex: 49
    SolutionNameMin: Cijk_Alik_Bljk_BBS_BH_Bias_HA_S_SAV_UserArgs_MT128x64x32_MI16x16x1_SN_LDSB1_AFC1_AG0_AFEM1_AFEM1_ASEM1_CLR0_CADS0_DTLA0_DTLB0_DTVA0_DTVB0_EPS0_FDSI0_GRPM1_GRVWA8_GRVWB8_GSU1_GSUAMB_GSUC0_GSUWGMRR0_GLS0_ISA1151_IU1_K1_LDSTI0_LBSPPA128_LBSPPB128_LBSPPM0_LPA8_LPB8_LPM0_LRVW16_LWPMn1_MIAV1_MIWT4_2_MO40_NTn1_NTA0_NTB0_NTC0_NTD0_NTM0_NEPBS0_NLCA1_NLCB1_ONLL1_PGR2_PLR1_PKA0_SIA3_SS1_SU32_SUM0_SUS256_SPO0_SRVW0_SSO0_SVW1_SK0_SKFTR0_SKXCCM0_TLDS1_ULSGRO0_USL1_UIOFGRO0_USFGROn1_VSn1_VWA1_VWB1_WSGRA0_WSGRB0_WS32_WG32_4_1_WGM8_WGMXCC1_WGMXCCGn1
    SolutionIndex: 50
    SolutionNameMin: Cijk_Alik_Bljk_BBS_BH_Bias_HA_S_SAV_UserArgs_MT64x128x32_MI16x16x1_SN_LDSB0_AFC1_AG0_AFEM1_AFEM1_ASEM1_CLR0_CADS0_DTLA0_DTLB0_DTVA0_DTVB0_EPS0_FDSI0_GRPM1_GRVWA8_GRVWB8_GSU1_GSUAMB_GSUC0_GSUWGMRR0_GLS0_ISA1151_IU1_K1_LDSTI0_LBSPPA128_LBSPPB128_LBSPPM0_LPA8_LPB8_LPM0_LRVW16_LWPMn1_MIAV1_MIWT2_4_MO40_NTn1_NTA0_NTB0_NTC0_NTD0_NTM0_NEPBS0_NLCA1_NLCB1_ONLL1_PGR2_PLR1_PKA0_SIA3_SS1_SU32_SUM0_SUS256_SPO0_SRVW0_SSO0_SVW1_SK0_SKFTR0_SKXCCM0_TLDS1_ULSGRO0_USL1_UIOFGRO0_USFGROn1_VSn1_VWA1_VWB1_WSGRA0_WSGRB0_WS32_WG32_4_1_WGM8_WGMXCC1_WGMXCCGn1
    SolutionIndex: 51
    SolutionNameMin: Cijk_Alik_Bljk_BBS_BH_Bias_HA_S_SAV_UserArgs_MT64x128x64_MI16x16x1_SN_LDSB1_AFC1_AG0_AFEM1_AFEM1_ASEM1_CLR0_CADS0_DTLA0_DTLB0_DTVA0_DTVB0_EPS0_FDSI0_GRPM1_GRVWA8_GRVWB8_GSU1_GSUAMB_GSUC0_GSUWGMRR0_GLS0_ISA1151_IU1_K1_LDSTI0_LBSPPA128_LBSPPB128_LBSPPM0_LPA8_LPB8_LPM0_LRVW16_LWPMn1_MIAV1_MIWT4_2_MO40_NTn1_NTA0_NTB0_NTC0_NTD0_NTM0_NEPBS0_NLCA1_NLCB1_ONLL1_PGR1_PLR1_PKA0_SIA3_SS1_SU32_SUM0_SUS256_SPO0_SRVW0_SSO0_SVW1_SK0_SKFTR0_SKXCCM0_TLDS1_ULSGRO0_USL1_UIOFGRO0_USFGROn1_VSn1_VWA1_VWB1_WSGRA0_WSGRB0_WS32_WG16_8_1_WGM8_WGMXCC1_WGMXCCGn1
    SolutionIndex: 53
    SolutionNameMin: Cijk_Alik_Bljk_BBS_BH_Bias_HA_S_SAV_UserArgs_MT128x128x32_MI16x16x1_SN_LDSB0_AFC1_AG0_AFEM1_AFEM1_ASEM1_CLR0_CADS0_DTLA0_DTLB0_DTVA0_DTVB0_EPS0_FDSI0_GRPM1_GRVWA8_GRVWB8_GSU1_GSUAMB_GSUC0_GSUWGMRR0_GLS0_ISA1151_IU1_K1_LDSTI0_LBSPPA128_LBSPPB128_LBSPPM0_LPA8_LPB8_LPM0_LRVW16_LWPMn1_MIAV1_MIWT2_8_MO40_NTn1_NTA0_NTB0_NTC0_NTD0_NTM0_NEPBS0_NLCA1_NLCB1_ONLL1_PGR0_PLR0_PKA0_SIA1_SS1_SU32_SUM0_SUS256_SPO0_SRVW0_SSO0_SVW1_SK0_SKFTR0_SKXCCM0_TLDS1_ULSGRO0_USL1_UIOFGRO0_USFGROn1_VSn1_VWA1_VWB1_WSGRA0_WSGRB0_WS32_WG64_2_1_WGM8_WGMXCC1_WGMXCCGn1
    SolutionIndex: 54
    SolutionNameMin: Cijk_Alik_Bljk_BBS_BH_Bias_HA_S_SAV_UserArgs_MT32x128x64_MI16x16x1_SN_LDSB1_AFC1_AG0_AFEM1_AFEM1_ASEM1_CLR0_CADS0_DTLA0_DTLB0_DTVA0_DTVB0_EPS0_FDSI0_GRPM1_GRVWA8_GRVWB8_GSU1_GSUAMB_GSUC0_GSUWGMRR0_GLS0_ISA1151_IU1_K1_LDSTI0_LBSPPA128_LBSPPB128_LBSPPM0_LPA8_LPB8_LPM0_LRVW16_LWPMn1_MIAV1_MIWT2_2_MO40_NTn1_NTA0_NTB0_NTC0_NTD0_NTM0_NEPBS0_NLCA1_NLCB1_ONLL1_PGR2_PLR1_PKA0_SIA3_SS1_SU32_SUM0_SUS256_SPO0_SRVW0_SSO0_SVW1_SK0_SKFTR0_SKXCCM0_TLDS1_ULSGRO0_USL1_UIOFGRO0_USFGROn1_VSn1_VWA1_VWB1_WSGRA0_WSGRB0_WS32_WG16_8_1_WGM8_WGMXCC1_WGMXCCGn1
    SolutionIndex: 55
    SolutionNameMin: Cijk_Alik_Bljk_BBS_BH_Bias_HA_S_SAV_UserArgs_MT128x64x32_MI16x16x1_SN_LDSB0_AFC1_AG0_AFEM1_AFEM1_ASEM1_CLR0_CADS0_DTLA0_DTLB0_DTVA0_DTVB0_EPS0_FDSI0_GRPM1_GRVWA8_GRVWB8_GSU1_GSUAMB_GSUC0_GSUWGMRR0_GLS0_ISA1151_IU1_K1_LDSTI0_LBSPPA128_LBSPPB128_LBSPPM0_LPA8_LPB8_LPM0_LRVW16_LWPMn1_MIAV1_MIWT2_4_MO40_NTn1_NTA0_NTB0_NTC0_NTD0_NTM0_NEPBS0_NLCA1_NLCB1_ONLL1_PGR2_PLR0_PKA0_SIA1_SS1_SU32_SUM0_SUS256_SPO0_SRVW0_SSO0_SVW1_SK0_SKFTR0_SKXCCM0_TLDS1_ULSGRO0_USL1_UIOFGRO0_USFGROn1_VSn1_VWA1_VWB1_WSGRA0_WSGRB0_WS32_WG64_2_1_WGM8_WGMXCC1_WGMXCCGn1
    SolutionIndex: 56
    SolutionNameMin: Cijk_Alik_Bljk_BBS_BH_Bias_HA_S_SAV_UserArgs_MT64x128x64_MI16x16x1_SN_LDSB0_AFC1_AG0_AFEM1_AFEM1_ASEM1_CLR0_CADS0_DTLA0_DTLB0_DTVA0_DTVB0_EPS0_FDSI0_GRPM1_GRVWA8_GRVWB8_GSU1_GSUAMB_GSUC0_GSUWGMRR0_GLS0_ISA1151_IU1_K1_LDSTI0_LBSPPA128_LBSPPB128_LBSPPM0_LPA8_LPB8_LPM0_LRVW16_LWPMn1_MIAV1_MIWT4_2_MO40_NTn1_NTA0_NTB0_NTC0_NTD0_NTM0_NEPBS0_NLCA1_NLCB1_ONLL1_PGR0_PLR1_PKA0_SIA3_SS1_SU32_SUM0_SUS256_SPO0_SRVW0_SSO0_SVW1_SK0_SKFTR0_SKXCCM0_TLDS1_ULSGRO0_USL1_UIOFGRO0_USFGROn1_VSn1_VWA1_VWB1_WSGRA0_WSGRB0_WS32_WG16_8_1_WGM8_WGMXCC1_WGMXCCGn1
    SolutionIndex: 57
    SolutionNameMin: Cijk_Alik_Bljk_BBS_BH_Bias_HA_S_SAV_UserArgs_MT64x128x64_MI16x16x1_SN_LDSB1_AFC1_AG0_AFEM1_AFEM1_ASEM1_CLR0_CADS0_DTLA0_DTLB0_DTVA0_DTVB0_EPS0_FDSI0_GRPM1_GRVWA8_GRVWB8_GSU1_GSUAMB_GSUC0_GSUWGMRR0_GLS0_ISA1151_IU1_K1_LDSTI0_LBSPPA128_LBSPPB128_LBSPPM0_LPA8_LPB8_LPM0_LRVW16_LWPMn1_MIAV1_MIWT2_4_MO40_NTn1_NTA0_NTB0_NTC0_NTD0_NTM0_NEPBS0_NLCA1_NLCB1_ONLL1_PGR2_PLR1_PKA0_SIA3_SS1_SU32_SUM0_SUS256_SPO0_SRVW0_SSO0_SVW1_SK0_SKFTR0_SKXCCM0_TLDS1_ULSGRO0_USL1_UIOFGRO0_USFGROn1_VSn1_VWA1_VWB1_WSGRA0_WSGRB0_WS32_WG32_4_1_WGM8_WGMXCC1_WGMXCCGn1
    SolutionIndex: 59
    SolutionNameMin: Cijk_Alik_Bljk_BBS_BH_Bias_HA_S_SAV_UserArgs_MT128x64x64_MI16x16x1_SN_LDSB1_AFC1_AG0_AFEM1_AFEM1_ASEM1_CLR0_CADS0_DTLA0_DTLB0_DTVA0_DTVB0_EPS0_FDSI0_GRPM1_GRVWA8_GRVWB8_GSU1_GSUAMB_GSUC0_GSUWGMRR0_GLS0_ISA1151_IU1_K1_LDSTI0_LBSPPA128_LBSPPB128_LBSPPM0_LPA8_LPB8_LPM0_LRVW16_LWPMn1_MIAV1_MIWT4_2_MO40_NTn1_NTA0_NTB0_NTC0_NTD0_NTM0_NEPBS0_NLCA1_NLCB1_ONLL1_PGR1_PLR1_PKA0_SIA3_SS1_SU32_SUM0_SUS256_SPO0_SRVW0_SSO0_SVW1_SK0_SKFTR0_SKXCCM0_TLDS1_ULSGRO0_USL1_UIOFGRO0_USFGROn1_VSn1_VWA1_VWB1_WSGRA0_WSGRB0_WS32_WG32_4_1_WGM8_WGMXCC1_WGMXCCGn1
    SolutionIndex: 60
    SolutionNameMin: Cijk_Alik_Bljk_BBS_BH_Bias_HA_S_SAV_UserArgs_MT64x128x64_MI16x16x1_SN_LDSB0_AFC1_AG0_AFEM1_AFEM1_ASEM1_CLR0_CADS0_DTLA0_DTLB0_DTVA0_DTVB0_EPS0_FDSI0_GRPM1_GRVWA8_GRVWB8_GSU1_GSUAMB_GSUC0_GSUWGMRR0_GLS0_ISA1151_IU1_K1_LDSTI0_LBSPPA128_LBSPPB128_LBSPPM0_LPA8_LPB8_LPM0_LRVW16_LWPMn1_MIAV1_MIWT4_2_MO40_NTn1_NTA0_NTB0_NTC0_NTD0_NTM0_NEPBS0_NLCA1_NLCB1_ONLL1_PGR2_PLR1_PKA0_SIA3_SS1_SU32_SUM0_SUS256_SPO0_SRVW0_SSO0_SVW1_SK0_SKFTR0_SKXCCM0_TLDS1_ULSGRO0_USL1_UIOFGRO0_USFGROn1_VSn1_VWA1_VWB1_WSGRA0_WSGRB0_WS32_WG16_8_1_WGM8_WGMXCC1_WGMXCCGn1
    SolutionIndex: 61
    SolutionNameMin: Cijk_Alik_Bljk_BBS_BH_Bias_HA_S_SAV_UserArgs_MT64x128x32_MI16x16x1_SN_LDSB0_AFC1_AG0_AFEM1_AFEM1_ASEM1_CLR0_CADS0_DTLA0_DTLB0_DTVA0_DTVB0_EPS0_FDSI0_GRPM1_GRVWA8_GRVWB8_GSU1_GSUAMB_GSUC0_GSUWGMRR0_GLS0_ISA1151_IU1_K1_LDSTI0_LBSPPA128_LBSPPB128_LBSPPM0_LPA8_LPB8_LPM0_LRVW16_LWPMn1_MIAV1_MIWT4_2_MO40_NTn1_NTA0_NTB0_NTC0_NTD0_NTM0_NEPBS0_NLCA1_NLCB1_ONLL1_PGR0_PLR0_PKA0_SIA3_SS1_SU32_SUM0_SUS256_SPO0_SRVW0_SSO0_SVW1_SK0_SKFTR0_SKXCCM0_TLDS1_ULSGRO0_USL1_UIOFGRO0_USFGROn1_VSn1_VWA1_VWB1_WSGRA0_WSGRB0_WS32_WG16_8_1_WGM8_WGMXCC1_WGMXCCGn1
    SolutionIndex: 62
    SolutionNameMin: Cijk_Alik_Bljk_BBS_BH_Bias_HA_S_SAV_UserArgs_MT32x32x128_MI16x16x1_SN_LDSB0_AFC1_AG0_AFEM1_AFEM1_ASEM1_CLR0_CADS0_DTLA0_DTLB0_DTVA0_DTVB0_EPS0_FDSI0_GRPM1_GRVWA8_GRVWB8_GSU1_GSUAMB_GSUC0_GSUWGMRR0_GLS0_ISA1151_IU1_K1_LDSTI0_LBSPPA256_LBSPPB256_LBSPPM0_LPA8_LPB8_LPM0_LRVW16_LWPMn1_MIAV1_MIWT1_1_MO40_NTn1_NTA0_NTB0_NTC0_NTD0_NTM0_NEPBS0_NLCA1_NLCB1_ONLL1_PGR2_PLR1_PKA0_SIA1_SS1_SU32_SUM0_SUS256_SPO0_SRVW0_SSO0_SVW1_SK0_SKFTR0_SKXCCM0_TLDS1_ULSGRO0_USL1_UIOFGRO0_USFGROn1_VSn1_VWA1_VWB1_WSGRA0_WSGRB0_WS32_WG32_4_1_WGM8_WGMXCC1_WGMXCCGn1
    SolutionIndex: 63
    SolutionNameMin: Cijk_Alik_Bljk_BBS_BH_Bias_HA_S_SAV_UserArgs_MT16x16x64_MI16x16x1_SN_LDSB0_AFC1_AG0_AFEM1_AFEM1_ASEM1_CLR0_CADS0_DTLA0_DTLB0_DTVA0_DTVB0_EPS0_FDSI0_GRPM1_GRVWA8_GRVWB8_GSU1_GSUAMB_GSUC0_GSUWGMRR0_GLS0_ISA1151_IU1_K1_LDSTI0_LBSPPA128_LBSPPB128_LBSPPM0_LPA8_LPB8_LPM0_LRVW16_LWPMn1_MIAV1_MIWT1_1_MO40_NTn1_NTA0_NTB0_NTC0_NTD0_NTM0_NEPBS0_NLCA1_NLCB1_ONLL1_PGR2_PLR1_PKA0_SIA3_SS1_SU32_SUM0_SUS256_SPO0_SRVW0_SSO0_SVW1_SK0_SKFTR0_SKXCCM0_TLDS1_ULSGRO0_USL1_UIOFGRO0_USFGROn1_VSn1_VWA1_VWB1_WSGRA0_WSGRB0_WS32_WG16_2_1_WGM8_WGMXCC1_WGMXCCGn1
    SolutionIndex: 64
    SolutionNameMin: Cijk_Alik_Bljk_BBS_BH_Bias_HA_S_SAV_UserArgs_MT32x32x64_MI16x16x1_SN_LDSB0_AFC1_AG0_AFEM1_AFEM1_ASEM1_CLR0_CADS0_DTLA0_DTLB0_DTVA0_DTVB0_EPS0_FDSI0_GRPM1_GRVWA8_GRVWB8_GSU1_GSUAMB_GSUC0_GSUWGMRR0_GLS0_ISA1151_IU1_K1_LDSTI0_LBSPPA128_LBSPPB128_LBSPPM0_LPA8_LPB8_LPM0_LRVW16_LWPMn1_MIAV1_MIWT1_1_MO40_NTn1_NTA0_NTB0_NTC0_NTD0_NTM0_NEPBS0_NLCA1_NLCB1_ONLL1_PGR2_PLR1_PKA0_SIA1_SS1_SU32_SUM0_SUS256_SPO0_SRVW0_SSO0_SVW1_SK0_SKFTR0_SKXCCM0_TLDS1_ULSGRO0_USL1_UIOFGRO0_USFGROn1_VSn1_VWA1_VWB1_WSGRA0_WSGRB0_WS32_WG32_4_1_WGM8_WGMXCC1_WGMXCCGn1
    SolutionIndex: 65
    SolutionNameMin: Cijk_Alik_Bljk_BBS_BH_Bias_HA_S_SAV_UserArgs_MT32x32x64_MI16x16x1_SN_LDSB0_AFC1_AG0_AFEM1_AFEM1_ASEM1_CLR0_CADS0_DTLA0_DTLB0_DTVA0_DTVB0_EPS0_FDSI0_GRPM1_GRVWA8_GRVWB8_GSU1_GSUAMB_GSUC0_GSUWGMRR0_GLS0_ISA1151_IU1_K1_LDSTI0_LBSPPA128_LBSPPB128_LBSPPM0_LPA8_LPB8_LPM0_LRVW16_LWPMn1_MIAV1_MIWT1_1_MO40_NTn1_NTA0_NTB0_NTC0_NTD0_NTM0_NEPBS0_NLCA1_NLCB1_ONLL1_PGR2_PLR1_PKA0_SIA3_SS1_SU32_SUM0_SUS256_SPO0_SRVW0_SSO0_SVW1_SK0_SKFTR0_SKXCCM0_TLDS1_ULSGRO0_USL1_UIOFGRO0_USFGROn1_VSn1_VWA1_VWB1_WSGRA0_WSGRB0_WS32_WG32_4_1_WGM8_WGMXCC1_WGMXCCGn1
    SolutionIndex: 66
    SolutionNameMin: Cijk_Alik_Bljk_BBS_BH_Bias_HA_S_SAV_UserArgs_MT64x48x128_MI16x16x1_SN_LDSB0_AFC1_AG0_AFEM1_AFEM1_ASEM1_CLR0_CADS0_DTLA0_DTLB0_DTVA0_DTVB0_EPS0_FDSI0_GRPM1_GRVWA8_GRVWB8_GSU1_GSUAMB_GSUC0_GSUWGMRR0_GLS0_ISA1151_IU1_K1_LDSTI0_LBSPPA256_LBSPPB256_LBSPPM0_LPA8_LPB8_LPM0_LRVW16_LWPMn1_MIAV1_MIWT1_3_MO40_NTn1_NTA0_NTB0_NTC0_NTD0_NTM0_NEPBS0_NLCA1_NLCB1_ONLL1_PGR2_PLR1_PKA0_SIA1_SS1_SU32_SUM0_SUS256_SPO0_SRVW0_SSO0_SVW1_SK0_SKFTR0_SKXCCM0_TLDS1_ULSGRO0_USL1_UIOFGRO0_USFGROn1_VSn1_VWA1_VWB1_WSGRA0_WSGRB0_WS32_WG64_2_1_WGM8_WGMXCC1_WGMXCCGn1
    SolutionIndex: 67
    SolutionNameMin: Cijk_Alik_Bljk_BBS_BH_Bias_HA_S_SAV_UserArgs_MT64x48x128_MI16x16x1_SN_LDSB0_AFC1_AG0_AFEM1_AFEM1_ASEM1_CLR0_CADS0_DTLA0_DTLB0_DTVA0_DTVB0_EPS0_FDSI0_GRPM1_GRVWA8_GRVWB8_GSU1_GSUAMB_GSUC0_GSUWGMRR0_GLS0_ISA1151_IU1_K1_LDSTI0_LBSPPA256_LBSPPB256_LBSPPM0_LPA8_LPB8_LPM0_LRVW16_LWPMn1_MIAV1_MIWT1_3_MO40_NTn1_NTA0_NTB0_NTC0_NTD0_NTM0_NEPBS0_NLCA1_NLCB1_ONLL1_PGR1_PLR1_PKA0_SIA1_SS1_SU32_SUM0_SUS256_SPO0_SRVW0_SSO0_SVW1_SK0_SKFTR0_SKXCCM0_TLDS1_ULSGRO0_USL1_UIOFGRO0_USFGROn1_VSn1_VWA1_VWB1_WSGRA0_WSGRB0_WS32_WG64_2_1_WGM8_WGMXCC1_WGMXCCGn1
    SolutionIndex: 69
    SolutionNameMin: Cijk_Alik_Bljk_BBS_BH_Bias_HA_S_SAV_UserArgs_MT64x96x32_MI16x16x1_SN_LDSB0_AFC1_AG0_AFEM1_AFEM1_ASEM1_CLR0_CADS0_DTLA0_DTLB0_DTVA0_DTVB0_EPS0_FDSI0_GRPM1_GRVWA8_GRVWB8_GSU1_GSUAMB_GSUC0_GSUWGMRR0_GLS0_ISA1151_IU1_K1_LDSTI0_LBSPPA128_LBSPPB128_LBSPPM0_LPA8_LPB8_LPM0_LRVW16_LWPMn1_MIAV1_MIWT2_3_MO40_NTn1_NTA0_NTB0_NTC0_NTD0_NTM0_NEPBS0_NLCA1_NLCB1_ONLL1_PGR2_PLR1_PKA0_SIA1_SS1_SU32_SUM0_SUS256_SPO0_SRVW0_SSO0_SVW1_SK0_SKFTR0_SKXCCM0_TLDS1_ULSGRO0_USL1_UIOFGRO0_USFGROn1_VSn1_VWA1_VWB1_WSGRA0_WSGRB0_WS32_WG32_4_1_WGM8_WGMXCC1_WGMXCCGn1
    SolutionIndex: 70
    SolutionNameMin: Cijk_Alik_Bljk_BBS_BH_Bias_HA_S_SAV_UserArgs_MT64x96x32_MI16x16x1_SN_LDSB0_AFC1_AG0_AFEM1_AFEM1_ASEM1_CLR0_CADS0_DTLA0_DTLB0_DTVA0_DTVB0_EPS0_FDSI0_GRPM1_GRVWA8_GRVWB8_GSU1_GSUAMB_GSUC0_GSUWGMRR0_GLS0_ISA1151_IU1_K1_LDSTI0_LBSPPA128_LBSPPB128_LBSPPM0_LPA8_LPB8_LPM0_LRVW16_LWPMn1_MIAV1_MIWT2_3_MO40_NTn1_NTA0_NTB0_NTC0_NTD0_NTM0_NEPBS0_NLCA1_NLCB1_ONLL1_PGR2_PLR0_PKA0_SIA1_SS1_SU32_SUM0_SUS256_SPO0_SRVW0_SSO0_SVW1_SK0_SKFTR0_SKXCCM0_TLDS1_ULSGRO0_USL1_UIOFGRO0_USFGROn1_VSn1_VWA1_VWB1_WSGRA0_WSGRB0_WS32_WG32_4_1_WGM8_WGMXCC1_WGMXCCGn1
    SolutionIndex: 73
    SolutionNameMin: Cijk_Alik_Bljk_BBS_BH_Bias_HA_S_SAV_UserArgs_MT32x128x32_MI16x16x1_SN_LDSB0_AFC1_AG0_AFEM1_AFEM1_ASEM1_CLR0_CADS0_DTLA0_DTLB0_DTVA0_DTVB0_EPS0_FDSI0_GRPM1_GRVWA8_GRVWB8_GSU1_GSUAMB_GSUC0_GSUWGMRR0_GLS0_ISA1151_IU1_K1_LDSTI0_LBSPPA128_LBSPPB128_LBSPPM0_LPA8_LPB8_LPM0_LRVW16_LWPMn1_MIAV1_MIWT2_2_MO40_NTn1_NTA0_NTB0_NTC0_NTD0_NTM0_NEPBS0_NLCA1_NLCB1_ONLL1_PGR2_PLR1_PKA0_SIA1_SS1_SU32_SUM0_SUS256_SPO0_SRVW0_SSO0_SVW1_SK0_SKFTR0_SKXCCM0_TLDS1_ULSGRO0_USL1_UIOFGRO0_USFGROn1_VSn1_VWA1_VWB1_WSGRA0_WSGRB0_WS32_WG16_8_1_WGM8_WGMXCC1_WGMXCCGn1
    SolutionIndex: 74
    SolutionNameMin: Cijk_Alik_Bljk_BBS_BH_Bias_HA_S_SAV_UserArgs_MT64x128x64_MI16x16x1_SN_LDSB0_AFC1_AG0_AFEM1_AFEM1_ASEM1_CLR0_CADS0_DTLA0_DTLB0_DTVA0_DTVB0_EPS0_FDSI0_GRPM1_GRVWA8_GRVWB8_GSU1_GSUAMB_GSUC0_GSUWGMRR0_GLS0_ISA1151_IU1_K1_LDSTI0_LBSPPA128_LBSPPB128_LBSPPM0_LPA8_LPB8_LPM0_LRVW16_LWPMn1_MIAV1_MIWT4_2_MO40_NTn1_NTA0_NTB0_NTC0_NTD0_NTM0_NEPBS0_NLCA1_NLCB1_ONLL1_PGR0_PLR0_PKA0_SIA3_SS1_SU32_SUM0_SUS256_SPO0_SRVW0_SSO0_SVW1_SK0_SKFTR0_SKXCCM0_TLDS1_ULSGRO0_USL1_UIOFGRO0_USFGROn1_VSn1_VWA1_VWB1_WSGRA0_WSGRB0_WS32_WG16_8_1_WGM8_WGMXCC1_WGMXCCGn1
    SolutionIndex: 78
    SolutionNameMin: Cijk_Alik_Bljk_BBS_BH_Bias_HA_S_SAV_UserArgs_MT128x96x32_MI16x16x1_SN_LDSB0_AFC1_AG0_AFEM1_AFEM1_ASEM1_CLR0_CADS0_DTLA0_DTLB0_DTVA0_DTVB0_EPS0_FDSI0_GRPM1_GRVWA8_GRVWB8_GSU1_GSUAMB_GSUC0_GSUWGMRR0_GLS0_ISA1151_IU1_K1_LDSTI0_LBSPPA128_LBSPPB128_LBSPPM0_LPA8_LPB8_LPM0_LRVW16_LWPMn1_MIAV1_MIWT4_3_MO40_NTn1_NTA0_NTB0_NTC0_NTD0_NTM0_NEPBS0_NLCA1_NLCB1_ONLL1_PGR2_PLR0_PKA0_SIA1_SS1_SU32_SUM0_SUS256_SPO0_SRVW0_SSO0_SVW1_SK0_SKFTR0_SKXCCM0_TLDS1_ULSGRO0_USL1_UIOFGRO0_USFGROn1_VSn1_VWA1_VWB1_WSGRA0_WSGRB0_WS32_WG32_4_1_WGM8_WGMXCC1_WGMXCCGn1
    SolutionIndex: 79
    SolutionNameMin: Cijk_Alik_Bljk_BBS_BH_Bias_HA_S_SAV_UserArgs_MT16x16x128_MI16x16x1_SN_LDSB0_AFC1_AG0_AFEM1_AFEM1_ASEM1_CLR0_CADS0_DTLA0_DTLB0_DTVA0_DTVB0_EPS0_FDSI0_GRPM1_GRVWA8_GRVWB8_GSU1_GSUAMB_GSUC0_GSUWGMRR0_GLS0_ISA1151_IU1_K1_LDSTI0_LBSPPA256_LBSPPB256_LBSPPM0_LPA8_LPB8_LPM0_LRVW16_LWPMn1_MIAV1_MIWT1_1_MO40_NTn1_NTA0_NTB0_NTC0_NTD0_NTM0_NEPBS0_NLCA1_NLCB1_ONLL1_PGR1_PLR1_PKA0_SIA1_SS1_SU32_SUM0_SUS256_SPO0_SRVW0_SSO0_SVW1_SK0_SKFTR0_SKXCCM0_TLDS1_ULSGRO0_USL1_UIOFGRO0_USFGROn1_VSn1_VWA1_VWB1_WSGRA0_WSGRB0_WS32_WG16_2_1_WGM8_WGMXCC1_WGMXCCGn1
    SolutionIndex: 80
    SolutionNameMin: Cijk_Alik_Bljk_BBS_BH_Bias_HA_S_SAV_UserArgs_MT64x64x32_MI16x16x1_SN_LDSB0_AFC1_AG0_AFEM1_AFEM1_ASEM1_CLR0_CADS0_DTLA0_DTLB0_DTVA0_DTVB0_EPS0_FDSI0_GRPM1_GRVWA8_GRVWB8_GSU1_GSUAMB_GSUC0_GSUWGMRR0_GLS0_ISA1151_IU1_K1_LDSTI0_LBSPPA128_LBSPPB128_LBSPPM0_LPA8_LPB8_LPM0_LRVW16_LWPMn1_MIAV1_MIWT2_2_MO40_NTn1_NTA0_NTB0_NTC0_NTD0_NTM0_NEPBS0_NLCA1_NLCB1_ONLL1_PGR1_PLR1_PKA0_SIA1_SS1_SU32_SUM0_SUS256_SPO0_SRVW0_SSO0_SVW1_SK0_SKFTR0_SKXCCM0_TLDS1_ULSGRO0_USL1_UIOFGRO0_USFGROn1_VSn1_VWA1_VWB1_WSGRA0_WSGRB0_WS32_WG32_4_1_WGM8_WGMXCC1_WGMXCCGn1
    SolutionIndex: 81
    SolutionNameMin: Cijk_Alik_Bljk_BBS_BH_Bias_HA_S_SAV_UserArgs_MT64x128x32_MI16x16x1_SN_LDSB0_AFC1_AG0_AFEM1_AFEM1_ASEM1_CLR0_CADS0_DTLA0_DTLB0_DTVA0_DTVB0_EPS0_FDSI0_GRPM1_GRVWA8_GRVWB8_GSU1_GSUAMB_GSUC0_GSUWGMRR0_GLS0_ISA1151_IU1_K1_LDSTI0_LBSPPA128_LBSPPB128_LBSPPM0_LPA8_LPB8_LPM0_LRVW16_LWPMn1_MIAV1_MIWT2_4_MO40_NTn1_NTA0_NTB0_NTC0_NTD0_NTM0_NEPBS0_NLCA1_NLCB1_ONLL1_PGR0_PLR0_PKA0_SIA3_SS1_SU32_SUM0_SUS256_SPO0_SRVW0_SSO0_SVW1_SK0_SKFTR0_SKXCCM0_TLDS1_ULSGRO0_USL1_UIOFGRO0_USFGROn1_VSn1_VWA1_VWB1_WSGRA0_WSGRB0_WS32_WG32_4_1_WGM8_WGMXCC1_WGMXCCGn1
    SolutionIndex: 82
    SolutionNameMin: Cijk_Alik_Bljk_BBS_BH_Bias_HA_S_SAV_UserArgs_MT128x64x32_MI16x16x1_SN_LDSB0_AFC1_AG0_AFEM1_AFEM1_ASEM1_CLR0_CADS0_DTLA0_DTLB0_DTVA0_DTVB0_EPS0_FDSI0_GRPM1_GRVWA8_GRVWB8_GSU1_GSUAMB_GSUC0_GSUWGMRR0_GLS0_ISA1151_IU1_K1_LDSTI0_LBSPPA128_LBSPPB128_LBSPPM0_LPA8_LPB8_LPM0_LRVW16_LWPMn1_MIAV1_MIWT2_4_MO40_NTn1_NTA0_NTB0_NTC0_NTD0_NTM0_NEPBS0_NLCA1_NLCB1_ONLL1_PGR0_PLR0_PKA0_SIA3_SS1_SU32_SUM0_SUS256_SPO0_SRVW0_SSO0_SVW1_SK0_SKFTR0_SKXCCM0_TLDS1_ULSGRO0_USL1_UIOFGRO0_USFGROn1_VSn1_VWA1_VWB1_WSGRA0_WSGRB0_WS32_WG64_2_1_WGM8_WGMXCC1_WGMXCCGn1
    SolutionIndex: 85
    SolutionNameMin: Cijk_Alik_Bljk_BBS_BH_Bias_HA_S_SAV_UserArgs_MT32x16x32_MI16x16x1_SN_LDSB0_AFC1_AG0_AFEM1_AFEM1_ASEM1_CLR0_CADS0_DTLA0_DTLB0_DTVA0_DTVB0_EPS0_FDSI0_GRPM1_GRVWA8_GRVWB8_GSU1_GSUAMB_GSUC0_GSUWGMRR0_GLS0_ISA1151_IU1_K1_LDSTI0_LBSPPA128_LBSPPB128_LBSPPM0_LPA8_LPB8_LPM0_LRVW16_LWPMn1_MIAV1_MIWT1_1_MO40_NTn1_NTA0_NTB0_NTC0_NTD0_NTM0_NEPBS0_NLCA1_NLCB1_ONLL1_PGR2_PLR1_PKA0_SIA3_SS1_SU32_SUM0_SUS256_SPO0_SRVW0_SSO0_SVW1_SK0_SKFTR0_SKXCCM0_TLDS1_ULSGRO0_USL1_UIOFGRO0_USFGROn1_VSn1_VWA1_VWB1_WSGRA0_WSGRB0_WS32_WG32_2_1_WGM8_WGMXCC1_WGMXCCGn1
    SolutionIndex: 86
    SolutionNameMin: Cijk_Alik_Bljk_BBS_BH_Bias_HA_S_SAV_UserArgs_MT64x16x128_MI16x16x1_SN_LDSB0_AFC1_AG0_AFEM1_AFEM1_ASEM1_CLR0_CADS0_DTLA0_DTLB0_DTVA0_DTVB0_EPS0_FDSI0_GRPM1_GRVWA8_GRVWB8_GSU1_GSUAMB_GSUC0_GSUWGMRR0_GLS0_ISA1151_IU1_K1_LDSTI0_LBSPPA256_LBSPPB256_LBSPPM0_LPA8_LPB8_LPM0_LRVW16_LWPMn1_MIAV1_MIWT1_1_MO40_NTn1_NTA0_NTB0_NTC0_NTD0_NTM0_NEPBS0_NLCA1_NLCB1_ONLL1_PGR2_PLR1_PKA0_SIA1_SS1_SU32_SUM0_SUS256_SPO0_SRVW0_SSO0_SVW1_SK0_SKFTR0_SKXCCM0_TLDS1_ULSGRO0_USL1_UIOFGRO0_USFGROn1_VSn1_VWA1_VWB1_WSGRA0_WSGRB0_WS32_WG64_2_1_WGM8_WGMXCC1_WGMXCCGn1
    SolutionIndex: 88
    SolutionNameMin: Cijk_Alik_Bljk_BBS_BH_Bias_HA_S_SAV_UserArgs_MT128x64x32_MI16x16x1_SN_LDSB0_AFC1_AG0_AFEM1_AFEM1_ASEM1_CLR0_CADS0_DTLA0_DTLB0_DTVA0_DTVB0_EPS0_FDSI0_GRPM1_GRVWA8_GRVWB8_GSU1_GSUAMB_GSUC0_GSUWGMRR0_GLS0_ISA1151_IU1_K1_LDSTI0_LBSPPA128_LBSPPB128_LBSPPM0_LPA8_LPB8_LPM0_LRVW16_LWPMn1_MIAV1_MIWT4_2_MO40_NTn1_NTA0_NTB0_NTC0_NTD0_NTM0_NEPBS0_NLCA1_NLCB1_ONLL1_PGR2_PLR1_PKA0_SIA1_SS1_SU32_SUM0_SUS256_SPO0_SRVW0_SSO0_SVW1_SK0_SKFTR0_SKXCCM0_TLDS1_ULSGRO0_USL1_UIOFGRO0_USFGROn1_VSn1_VWA1_VWB1_WSGRA0_WSGRB0_WS32_WG32_4_1_WGM8_WGMXCC1_WGMXCCGn1
    SolutionIndex: 90
    SolutionNameMin: Cijk_Alik_Bljk_BBS_BH_Bias_HA_S_SAV_UserArgs_MT128x64x64_MI16x16x1_SN_LDSB0_AFC1_AG0_AFEM1_AFEM1_ASEM1_CLR0_CADS0_DTLA0_DTLB0_DTVA0_DTVB0_EPS0_FDSI0_GRPM1_GRVWA8_GRVWB8_GSU1_GSUAMB_GSUC0_GSUWGMRR0_GLS0_ISA1151_IU1_K1_LDSTI0_LBSPPA128_LBSPPB128_LBSPPM0_LPA8_LPB8_LPM0_LRVW16_LWPMn1_MIAV1_MIWT4_2_MO40_NTn1_NTA0_NTB0_NTC0_NTD0_NTM0_NEPBS0_NLCA1_NLCB1_ONLL1_PGR0_PLR1_PKA0_SIA3_SS1_SU32_SUM0_SUS256_SPO0_SRVW0_SSO0_SVW1_SK0_SKFTR0_SKXCCM0_TLDS1_ULSGRO0_USL1_UIOFGRO0_USFGROn1_VSn1_VWA1_VWB1_WSGRA0_WSGRB0_WS32_WG32_4_1_WGM8_WGMXCC1_WGMXCCGn1
    SolutionIndex: 92
    SolutionNameMin: Cijk_Alik_Bljk_BBS_BH_Bias_HA_S_SAV_UserArgs_MT16x16x32_MI16x16x1_SN_LDSB0_AFC1_AG0_AFEM1_AFEM1_ASEM1_CLR0_CADS0_DTLA0_DTLB0_DTVA0_DTVB0_EPS0_FDSI0_GRPM1_GRVWA8_GRVWB8_GSU1_GSUAMB_GSUC0_GSUWGMRR0_GLS0_ISA1151_IU1_K1_LDSTI0_LBSPPA128_LBSPPB128_LBSPPM0_LPA8_LPB8_LPM0_LRVW16_LWPMn1_MIAV1_MIWT1_1_MO40_NTn1_NTA0_NTB0_NTC0_NTD0_NTM0_NEPBS0_NLCA1_NLCB1_ONLL1_PGR2_PLR1_PKA0_SIA1_SS1_SU32_SUM0_SUS256_SPO0_SRVW0_SSO0_SVW1_SK0_SKFTR0_SKXCCM0_TLDS1_ULSGRO0_USL1_UIOFGRO0_USFGROn1_VSn1_VWA1_VWB1_WSGRA0_WSGRB0_WS32_WG16_2_1_WGM8_WGMXCC1_WGMXCCGn1
    SolutionIndex: 93
    SolutionNameMin: Cijk_Alik_Bljk_BBS_BH_Bias_HA_S_SAV_UserArgs_MT16x16x128_MI16x16x1_SN_LDSB0_AFC1_AG0_AFEM1_AFEM1_ASEM1_CLR0_CADS0_DTLA0_DTLB0_DTVA0_DTVB0_EPS0_FDSI0_GRPM1_GRVWA8_GRVWB8_GSU1_GSUAMB_GSUC0_GSUWGMRR0_GLS0_ISA1151_IU1_K1_LDSTI0_LBSPPA256_LBSPPB256_LBSPPM0_LPA8_LPB8_LPM0_LRVW16_LWPMn1_MIAV1_MIWT1_1_MO40_NTn1_NTA0_NTB0_NTC0_NTD0_NTM0_NEPBS0_NLCA1_NLCB1_ONLL1_PGR2_PLR1_PKA0_SIA3_SS1_SU32_SUM0_SUS256_SPO0_SRVW0_SSO0_SVW1_SK0_SKFTR0_SKXCCM0_TLDS1_ULSGRO0_USL1_UIOFGRO0_USFGROn1_VSn1_VWA1_VWB1_WSGRA0_WSGRB0_WS32_WG16_2_1_WGM8_WGMXCC1_WGMXCCGn1
    SolutionIndex: 94
    SolutionNameMin: Cijk_Alik_Bljk_BBS_BH_Bias_HA_S_SAV_UserArgs_MT64x32x128_MI16x16x1_SN_LDSB0_AFC1_AG0_AFEM1_AFEM1_ASEM1_CLR0_CADS0_DTLA0_DTLB0_DTVA0_DTVB0_EPS0_FDSI0_GRPM1_GRVWA8_GRVWB8_GSU1_GSUAMB_GSUC0_GSUWGMRR0_GLS0_ISA1151_IU1_K1_LDSTI0_LBSPPA256_LBSPPB256_LBSPPM0_LPA8_LPB8_LPM0_LRVW16_LWPMn1_MIAV1_MIWT2_1_MO40_NTn1_NTA0_NTB0_NTC0_NTD0_NTM0_NEPBS0_NLCA1_NLCB1_ONLL1_PGR1_PLR1_PKA0_SIA1_SS1_SU32_SUM0_SUS256_SPO0_SRVW0_SSO0_SVW1_SK0_SKFTR0_SKXCCM0_TLDS1_ULSGRO0_USL1_UIOFGRO0_USFGROn1_VSn1_VWA1_VWB1_WSGRA0_WSGRB0_WS32_WG32_4_1_WGM8_WGMXCC1_WGMXCCGn1
    SolutionIndex: 97
    SolutionNameMin: Cijk_Alik_Bljk_BBS_BH_Bias_HA_S_SAV_UserArgs_MT16x16x32_MI16x16x1_SN_LDSB0_AFC1_AG0_AFEM1_AFEM1_ASEM1_CLR0_CADS0_DTLA0_DTLB0_DTVA0_DTVB0_EPS0_FDSI0_GRPM1_GRVWA8_GRVWB8_GSU1_GSUAMB_GSUC0_GSUWGMRR0_GLS0_ISA1151_IU1_K1_LDSTI0_LBSPPA128_LBSPPB128_LBSPPM0_LPA8_LPB8_LPM0_LRVW16_LWPMn1_MIAV1_MIWT1_1_MO40_NTn1_NTA0_NTB0_NTC0_NTD0_NTM0_NEPBS0_NLCA1_NLCB1_ONLL1_PGR1_PLR0_PKA0_SIA3_SS1_SU32_SUM0_SUS256_SPO0_SRVW0_SSO0_SVW1_SK0_SKFTR0_SKXCCM0_TLDS1_ULSGRO0_USL1_UIOFGRO0_USFGROn1_VSn1_VWA1_VWB1_WSGRA0_WSGRB0_WS32_WG16_2_1_WGM8_WGMXCC1_WGMXCCGn1
    SolutionIndex: 98
    SolutionNameMin: Cijk_Alik_Bljk_BBS_BH_Bias_HA_S_SAV_UserArgs_MT16x16x128_MI16x16x1_SN_LDSB0_AFC1_AG0_AFEM1_AFEM1_ASEM1_CLR0_CADS0_DTLA0_DTLB0_DTVA0_DTVB0_EPS0_FDSI0_GRPM1_GRVWA8_GRVWB8_GSU1_GSUAMB_GSUC0_GSUWGMRR0_GLS0_ISA1151_IU1_K1_LDSTI0_LBSPPA256_LBSPPB256_LBSPPM0_LPA8_LPB8_LPM0_LRVW16_LWPMn1_MIAV1_MIWT1_1_MO40_NTn1_NTA0_NTB0_NTC0_NTD0_NTM0_NEPBS0_NLCA1_NLCB1_ONLL1_PGR0_PLR1_PKA0_SIA1_SS1_SU32_SUM0_SUS256_SPO0_SRVW0_SSO0_SVW1_SK0_SKFTR0_SKXCCM0_TLDS1_ULSGRO0_USL1_UIOFGRO0_USFGROn1_VSn1_VWA1_VWB1_WSGRA0_WSGRB0_WS32_WG16_2_1_WGM8_WGMXCC1_WGMXCCGn1
    SolutionIndex: 99
    SolutionNameMin: Cijk_Alik_Bljk_BBS_BH_Bias_HA_S_SAV_UserArgs_MT16x16x128_MI16x16x1_SN_LDSB0_AFC1_AG0_AFEM1_AFEM1_ASEM1_CLR0_CADS0_DTLA0_DTLB0_DTVA0_DTVB0_EPS0_FDSI0_GRPM1_GRVWA8_GRVWB8_GSU1_GSUAMB_GSUC0_GSUWGMRR0_GLS0_ISA1151_IU1_K1_LDSTI0_LBSPPA256_LBSPPB256_LBSPPM0_LPA8_LPB8_LPM0_LRVW16_LWPMn1_MIAV1_MIWT1_1_MO40_NTn1_NTA0_NTB0_NTC0_NTD0_NTM0_NEPBS0_NLCA1_NLCB1_ONLL1_PGR0_PLR1_PKA0_SIA3_SS1_SU32_SUM0_SUS256_SPO0_SRVW0_SSO0_SVW1_SK0_SKFTR0_SKXCCM0_TLDS1_ULSGRO0_USL1_UIOFGRO0_USFGROn1_VSn1_VWA1_VWB1_WSGRA0_WSGRB0_WS32_WG16_2_1_WGM8_WGMXCC1_WGMXCCGn1
    SolutionIndex: 100
    SolutionNameMin: Cijk_Alik_Bljk_BBS_BH_Bias_HA_S_SAV_UserArgs_MT32x16x128_MI16x16x1_SN_LDSB0_AFC1_AG0_AFEM1_AFEM1_ASEM1_CLR0_CADS0_DTLA0_DTLB0_DTVA0_DTVB0_EPS0_FDSI0_GRPM1_GRVWA8_GRVWB8_GSU1_GSUAMB_GSUC0_GSUWGMRR0_GLS0_ISA1151_IU1_K1_LDSTI0_LBSPPA256_LBSPPB256_LBSPPM0_LPA8_LPB8_LPM0_LRVW16_LWPMn1_MIAV1_MIWT1_1_MO40_NTn1_NTA0_NTB0_NTC0_NTD0_NTM0_NEPBS0_NLCA1_NLCB1_ONLL1_PGR2_PLR1_PKA0_SIA3_SS1_SU32_SUM0_SUS256_SPO0_SRVW0_SSO0_SVW1_SK0_SKFTR0_SKXCCM0_TLDS1_ULSGRO0_USL1_UIOFGRO0_USFGROn1_VSn1_VWA1_VWB1_WSGRA0_WSGRB0_WS32_WG32_2_1_WGM8_WGMXCC1_WGMXCCGn1
    SolutionIndex: 101
    SolutionNameMin: Cijk_Alik_Bljk_BBS_BH_Bias_HA_S_SAV_UserArgs_MT32x16x128_MI16x16x1_SN_LDSB0_AFC1_AG0_AFEM1_AFEM1_ASEM1_CLR0_CADS0_DTLA0_DTLB0_DTVA0_DTVB0_EPS0_FDSI0_GRPM1_GRVWA8_GRVWB8_GSU1_GSUAMB_GSUC0_GSUWGMRR0_GLS0_ISA1151_IU1_K1_LDSTI0_LBSPPA256_LBSPPB256_LBSPPM0_LPA8_LPB8_LPM0_LRVW16_LWPMn1_MIAV1_MIWT1_1_MO40_NTn1_NTA0_NTB0_NTC0_NTD0_NTM0_NEPBS0_NLCA1_NLCB1_ONLL1_PGR1_PLR1_PKA0_SIA1_SS1_SU32_SUM0_SUS256_SPO0_SRVW0_SSO0_SVW1_SK0_SKFTR0_SKXCCM0_TLDS1_ULSGRO0_USL1_UIOFGRO0_USFGROn1_VSn1_VWA1_VWB1_WSGRA0_WSGRB0_WS32_WG32_2_1_WGM8_WGMXCC1_WGMXCCGn1
    SolutionIndex: 102
    SolutionNameMin: Cijk_Alik_Bljk_BBS_BH_Bias_HA_S_SAV_UserArgs_MT16x16x32_MI16x16x1_SN_LDSB0_AFC1_AG0_AFEM1_AFEM1_ASEM1_CLR0_CADS0_DTLA0_DTLB0_DTVA0_DTVB0_EPS0_FDSI0_GRPM1_GRVWA8_GRVWB8_GSU1_GSUAMB_GSUC0_GSUWGMRR0_GLS0_ISA1151_IU1_K1_LDSTI0_LBSPPA128_LBSPPB128_LBSPPM0_LPA8_LPB8_LPM0_LRVW16_LWPMn1_MIAV1_MIWT1_1_MO40_NTn1_NTA0_NTB0_NTC0_NTD0_NTM0_NEPBS0_NLCA1_NLCB1_ONLL1_PGR1_PLR1_PKA0_SIA1_SS1_SU32_SUM0_SUS256_SPO0_SRVW0_SSO0_SVW1_SK0_SKFTR0_SKXCCM0_TLDS1_ULSGRO0_USL1_UIOFGRO0_USFGROn1_VSn1_VWA1_VWB1_WSGRA0_WSGRB0_WS32_WG16_2_1_WGM8_WGMXCC1_WGMXCCGn1
    SolutionIndex: 103
    SolutionNameMin: Cijk_Alik_Bljk_BBS_BH_Bias_HA_S_SAV_UserArgs_MT32x32x32_MI16x16x1_SN_LDSB0_AFC1_AG0_AFEM1_AFEM1_ASEM1_CLR0_CADS0_DTLA0_DTLB0_DTVA0_DTVB0_EPS0_FDSI0_GRPM1_GRVWA8_GRVWB8_GSU1_GSUAMB_GSUC0_GSUWGMRR0_GLS0_ISA1151_IU1_K1_LDSTI0_LBSPPA128_LBSPPB128_LBSPPM0_LPA8_LPB8_LPM0_LRVW16_LWPMn1_MIAV1_MIWT1_1_MO40_NTn1_NTA0_NTB0_NTC0_NTD0_NTM0_NEPBS0_NLCA1_NLCB1_ONLL1_PGR2_PLR1_PKA0_SIA1_SS1_SU32_SUM0_SUS256_SPO0_SRVW0_SSO0_SVW1_SK0_SKFTR0_SKXCCM0_TLDS1_ULSGRO0_USL1_UIOFGRO0_USFGROn1_VSn1_VWA1_VWB1_WSGRA0_WSGRB0_WS32_WG32_4_1_WGM8_WGMXCC1_WGMXCCGn1
    SolutionIndex: 104
    SolutionNameMin: Cijk_Alik_Bljk_BBS_BH_Bias_HA_S_SAV_UserArgs_MT32x16x16_MI16x16x1_SN_LDSB0_AFC1_AG0_AFEM1_AFEM1_ASEM1_CLR0_CADS0_DTLA0_DTLB0_DTVA0_DTVB0_EPS0_FDSI0_GRPM1_GRVWA8_GRVWB4_GSU1_GSUAMB_GSUC0_GSUWGMRR0_GLS0_ISA1151_IU1_K1_LDSTI0_LBSPPA128_LBSPPB128_LBSPPM0_LPA8_LPB8_LPM0_LRVW16_LWPMn1_MIAV1_MIWT1_1_MO40_NTn1_NTA0_NTB0_NTC0_NTD0_NTM0_NEPBS0_NLCA1_NLCB1_ONLL1_PGR2_PLR0_PKA0_SIA3_SS1_SU32_SUM0_SUS256_SPO0_SRVW0_SSO0_SVW1_SK0_SKFTR0_SKXCCM0_TLDS1_ULSGRO0_USL1_UIOFGRO0_USFGROn1_VSn1_VWA1_VWB1_WSGRA0_WSGRB0_WS32_WG32_2_1_WGM8_WGMXCC1_WGMXCCGn1
    SolutionIndex: 105
    SolutionNameMin: Cijk_Alik_Bljk_BBS_BH_Bias_HA_S_SAV_UserArgs_MT16x16x128_MI16x16x1_SN_LDSB0_AFC1_AG0_AFEM1_AFEM1_ASEM1_CLR0_CADS0_DTLA0_DTLB0_DTVA0_DTVB0_EPS0_FDSI0_GRPM1_GRVWA8_GRVWB8_GSU1_GSUAMB_GSUC0_GSUWGMRR0_GLS0_ISA1151_IU1_K1_LDSTI0_LBSPPA256_LBSPPB256_LBSPPM0_LPA8_LPB8_LPM0_LRVW16_LWPMn1_MIAV1_MIWT1_1_MO40_NTn1_NTA0_NTB0_NTC0_NTD0_NTM0_NEPBS0_NLCA1_NLCB1_ONLL1_PGR1_PLR1_PKA0_SIA3_SS1_SU32_SUM0_SUS256_SPO0_SRVW0_SSO0_SVW1_SK0_SKFTR0_SKXCCM0_TLDS1_ULSGRO0_USL1_UIOFGRO0_USFGROn1_VSn1_VWA1_VWB1_WSGRA0_WSGRB0_WS32_WG16_2_1_WGM8_WGMXCC1_WGMXCCGn1
    SolutionIndex: 106
    SolutionNameMin: Cijk_Alik_Bljk_BBS_BH_Bias_HA_S_SAV_UserArgs_MT16x16x64_MI16x16x1_SN_LDSB0_AFC1_AG0_AFEM1_AFEM1_ASEM1_CLR0_CADS0_DTLA0_DTLB0_DTVA0_DTVB0_EPS0_FDSI0_GRPM1_GRVWA8_GRVWB8_GSU1_GSUAMB_GSUC0_GSUWGMRR0_GLS0_ISA1151_IU1_K1_LDSTI0_LBSPPA128_LBSPPB128_LBSPPM0_LPA8_LPB8_LPM0_LRVW16_LWPMn1_MIAV1_MIWT1_1_MO40_NTn1_NTA0_NTB0_NTC0_NTD0_NTM0_NEPBS0_NLCA1_NLCB1_ONLL1_PGR2_PLR1_PKA0_SIA1_SS1_SU32_SUM0_SUS256_SPO0_SRVW0_SSO0_SVW1_SK0_SKFTR0_SKXCCM0_TLDS1_ULSGRO0_USL1_UIOFGRO0_USFGROn1_VSn1_VWA1_VWB1_WSGRA0_WSGRB0_WS32_WG16_2_1_WGM8_WGMXCC1_WGMXCCGn1
    SolutionIndex: 107
    SolutionNameMin: Cijk_Alik_Bljk_BBS_BH_Bias_HA_S_SAV_UserArgs_MT32x16x64_MI16x16x1_SN_LDSB0_AFC1_AG0_AFEM1_AFEM1_ASEM1_CLR0_CADS0_DTLA0_DTLB0_DTVA0_DTVB0_EPS0_FDSI0_GRPM1_GRVWA8_GRVWB8_GSU1_GSUAMB_GSUC0_GSUWGMRR0_GLS0_ISA1151_IU1_K1_LDSTI0_LBSPPA128_LBSPPB128_LBSPPM0_LPA8_LPB8_LPM0_LRVW16_LWPMn1_MIAV1_MIWT1_1_MO40_NTn1_NTA0_NTB0_NTC0_NTD0_NTM0_NEPBS0_NLCA1_NLCB1_ONLL1_PGR2_PLR1_PKA0_SIA3_SS1_SU32_SUM0_SUS256_SPO0_SRVW0_SSO0_SVW1_SK0_SKFTR0_SKXCCM0_TLDS1_ULSGRO0_USL1_UIOFGRO0_USFGROn1_VSn1_VWA1_VWB1_WSGRA0_WSGRB0_WS32_WG32_2_1_WGM8_WGMXCC1_WGMXCCGn1
    SolutionIndex: 108
    SolutionNameMin: Cijk_Alik_Bljk_BBS_BH_Bias_HA_S_SAV_UserArgs_MT32x32x128_MI16x16x1_SN_LDSB0_AFC1_AG0_AFEM1_AFEM1_ASEM1_CLR0_CADS0_DTLA0_DTLB0_DTVA0_DTVB0_EPS0_FDSI0_GRPM1_GRVWA8_GRVWB8_GSU1_GSUAMB_GSUC0_GSUWGMRR0_GLS0_ISA1151_IU1_K1_LDSTI0_LBSPPA256_LBSPPB256_LBSPPM0_LPA8_LPB8_LPM0_LRVW16_LWPMn1_MIAV1_MIWT1_1_MO40_NTn1_NTA0_NTB0_NTC0_NTD0_NTM0_NEPBS0_NLCA1_NLCB1_ONLL1_PGR1_PLR1_PKA0_SIA3_SS1_SU32_SUM0_SUS256_SPO0_SRVW0_SSO0_SVW1_SK0_SKFTR0_SKXCCM0_TLDS1_ULSGRO0_USL1_UIOFGRO0_USFGROn1_VSn1_VWA1_VWB1_WSGRA0_WSGRB0_WS32_WG32_4_1_WGM8_WGMXCC1_WGMXCCGn1
    SolutionIndex: 109
    SolutionNameMin: Cijk_Alik_Bljk_BBS_BH_Bias_HA_S_SAV_UserArgs_MT32x32x128_MI16x16x1_SN_LDSB0_AFC1_AG0_AFEM1_AFEM1_ASEM1_CLR0_CADS0_DTLA0_DTLB0_DTVA0_DTVB0_EPS0_FDSI0_GRPM1_GRVWA8_GRVWB8_GSU1_GSUAMB_GSUC0_GSUWGMRR0_GLS0_ISA1151_IU1_K1_LDSTI0_LBSPPA256_LBSPPB256_LBSPPM0_LPA8_LPB8_LPM0_LRVW16_LWPMn1_MIAV1_MIWT1_1_MO40_NTn1_NTA0_NTB0_NTC0_NTD0_NTM0_NEPBS0_NLCA1_NLCB1_ONLL1_PGR2_PLR1_PKA0_SIA3_SS1_SU32_SUM0_SUS256_SPO0_SRVW0_SSO0_SVW1_SK0_SKFTR0_SKXCCM0_TLDS1_ULSGRO0_USL1_UIOFGRO0_USFGROn1_VSn1_VWA1_VWB1_WSGRA0_WSGRB0_WS32_WG32_4_1_WGM8_WGMXCC1_WGMXCCGn1
    SolutionIndex: 110
    SolutionNameMin: Cijk_Alik_Bljk_BBS_BH_Bias_HA_S_SAV_UserArgs_MT32x16x128_MI16x16x1_SN_LDSB0_AFC1_AG0_AFEM1_AFEM1_ASEM1_CLR0_CADS0_DTLA0_DTLB0_DTVA0_DTVB0_EPS0_FDSI0_GRPM1_GRVWA8_GRVWB8_GSU1_GSUAMB_GSUC0_GSUWGMRR0_GLS0_ISA1151_IU1_K1_LDSTI0_LBSPPA256_LBSPPB256_LBSPPM0_LPA8_LPB8_LPM0_LRVW16_LWPMn1_MIAV1_MIWT1_1_MO40_NTn1_NTA0_NTB0_NTC0_NTD0_NTM0_NEPBS0_NLCA1_NLCB1_ONLL1_PGR1_PLR1_PKA0_SIA3_SS1_SU32_SUM0_SUS256_SPO0_SRVW0_SSO0_SVW1_SK0_SKFTR0_SKXCCM0_TLDS1_ULSGRO0_USL1_UIOFGRO0_USFGROn1_VSn1_VWA1_VWB1_WSGRA0_WSGRB0_WS32_WG32_2_1_WGM8_WGMXCC1_WGMXCCGn1
    SolutionIndex: 111
    SolutionNameMin: Cijk_Alik_Bljk_BBS_BH_Bias_HA_S_SAV_UserArgs_MT16x16x32_MI16x16x1_SN_LDSB1_AFC1_AG0_AFEM1_AFEM1_ASEM1_CLR0_CADS0_DTLA0_DTLB0_DTVA0_DTVB0_EPS0_FDSI0_GRPM1_GRVWA8_GRVWB8_GSU1_GSUAMB_GSUC0_GSUWGMRR0_GLS0_ISA1151_IU1_K1_LDSTI0_LBSPPA128_LBSPPB128_LBSPPM0_LPA8_LPB8_LPM0_LRVW16_LWPMn1_MIAV1_MIWT1_1_MO40_NTn1_NTA0_NTB0_NTC0_NTD0_NTM0_NEPBS0_NLCA1_NLCB1_ONLL1_PGR1_PLR1_PKA0_SIA3_SS1_SU32_SUM0_SUS256_SPO0_SRVW0_SSO0_SVW1_SK0_SKFTR0_SKXCCM0_TLDS1_ULSGRO0_USL1_UIOFGRO0_USFGROn1_VSn1_VWA1_VWB1_WSGRA0_WSGRB0_WS32_WG16_2_1_WGM8_WGMXCC1_WGMXCCGn1
    SolutionIndex: 112
    SolutionNameMin: Cijk_Alik_Bljk_BBS_BH_Bias_HA_S_SAV_UserArgs_MT32x16x64_MI16x16x1_SN_LDSB0_AFC1_AG0_AFEM1_AFEM1_ASEM1_CLR0_CADS0_DTLA0_DTLB0_DTVA0_DTVB0_EPS0_FDSI0_GRPM1_GRVWA8_GRVWB8_GSU1_GSUAMB_GSUC0_GSUWGMRR0_GLS0_ISA1151_IU1_K1_LDSTI0_LBSPPA128_LBSPPB128_LBSPPM0_LPA8_LPB8_LPM0_LRVW16_LWPMn1_MIAV1_MIWT1_1_MO40_NTn1_NTA0_NTB0_NTC0_NTD0_NTM0_NEPBS0_NLCA1_NLCB1_ONLL1_PGR2_PLR1_PKA0_SIA1_SS1_SU32_SUM0_SUS256_SPO0_SRVW0_SSO0_SVW1_SK0_SKFTR0_SKXCCM0_TLDS1_ULSGRO0_USL1_UIOFGRO0_USFGROn1_VSn1_VWA1_VWB1_WSGRA0_WSGRB0_WS32_WG32_2_1_WGM8_WGMXCC1_WGMXCCGn1
    SolutionIndex: 113
    SolutionNameMin: Cijk_Alik_Bljk_BBS_BH_Bias_HA_S_SAV_UserArgs_MT32x32x128_MI16x16x1_SN_LDSB0_AFC1_AG0_AFEM1_AFEM1_ASEM1_CLR0_CADS0_DTLA0_DTLB0_DTVA0_DTVB0_EPS0_FDSI0_GRPM1_GRVWA8_GRVWB8_GSU1_GSUAMB_GSUC0_GSUWGMRR0_GLS0_ISA1151_IU1_K1_LDSTI0_LBSPPA256_LBSPPB256_LBSPPM0_LPA8_LPB8_LPM0_LRVW16_LWPMn1_MIAV1_MIWT1_1_MO40_NTn1_NTA0_NTB0_NTC0_NTD0_NTM0_NEPBS0_NLCA1_NLCB1_ONLL1_PGR1_PLR1_PKA0_SIA1_SS1_SU32_SUM0_SUS256_SPO0_SRVW0_SSO0_SVW1_SK0_SKFTR0_SKXCCM0_TLDS1_ULSGRO0_USL1_UIOFGRO0_USFGROn1_VSn1_VWA1_VWB1_WSGRA0_WSGRB0_WS32_WG32_4_1_WGM8_WGMXCC1_WGMXCCGn1
    SolutionIndex: 114
    SolutionNameMin: Cijk_Alik_Bljk_BBS_BH_Bias_HA_S_SAV_UserArgs_MT64x16x64_MI16x16x1_SN_LDSB0_AFC1_AG0_AFEM1_AFEM1_ASEM1_CLR0_CADS0_DTLA0_DTLB0_DTVA0_DTVB0_EPS0_FDSI0_GRPM1_GRVWA8_GRVWB8_GSU1_GSUAMB_GSUC0_GSUWGMRR0_GLS0_ISA1151_IU1_K1_LDSTI0_LBSPPA128_LBSPPB128_LBSPPM0_LPA8_LPB8_LPM0_LRVW16_LWPMn1_MIAV1_MIWT1_1_MO40_NTn1_NTA0_NTB0_NTC0_NTD0_NTM0_NEPBS0_NLCA1_NLCB1_ONLL1_PGR2_PLR1_PKA0_SIA3_SS1_SU32_SUM0_SUS256_SPO0_SRVW0_SSO0_SVW1_SK0_SKFTR0_SKXCCM0_TLDS1_ULSGRO0_USL1_UIOFGRO0_USFGROn1_VSn1_VWA1_VWB1_WSGRA0_WSGRB0_WS32_WG64_2_1_WGM8_WGMXCC1_WGMXCCGn1
    SolutionIndex: 115
    SolutionNameMin: Cijk_Alik_Bljk_BBS_BH_Bias_HA_S_SAV_UserArgs_MT16x16x32_MI16x16x1_SN_LDSB1_AFC1_AG0_AFEM1_AFEM1_ASEM1_CLR0_CADS0_DTLA0_DTLB0_DTVA0_DTVB0_EPS0_FDSI0_GRPM1_GRVWA8_GRVWB8_GSU1_GSUAMB_GSUC0_GSUWGMRR0_GLS0_ISA1151_IU1_K1_LDSTI0_LBSPPA128_LBSPPB128_LBSPPM0_LPA8_LPB8_LPM0_LRVW16_LWPMn1_MIAV1_MIWT1_1_MO40_NTn1_NTA0_NTB0_NTC0_NTD0_NTM0_NEPBS0_NLCA1_NLCB1_ONLL1_PGR2_PLR1_PKA0_SIA3_SS1_SU32_SUM0_SUS256_SPO0_SRVW0_SSO0_SVW1_SK0_SKFTR0_SKXCCM0_TLDS1_ULSGRO0_USL1_UIOFGRO0_USFGROn1_VSn1_VWA1_VWB1_WSGRA0_WSGRB0_WS32_WG16_2_1_WGM8_WGMXCC1_WGMXCCGn1
    SolutionIndex: 116
    SolutionNameMin: Cijk_Alik_Bljk_BBS_BH_Bias_HA_S_SAV_UserArgs_MT128x32x32_MI16x16x1_SN_LDSB0_AFC1_AG0_AFEM1_AFEM1_ASEM1_CLR0_CADS0_DTLA0_DTLB0_DTVA0_DTVB0_EPS0_FDSI0_GRPM1_GRVWA8_GRVWB8_GSU1_GSUAMB_GSUC0_GSUWGMRR0_GLS0_ISA1151_IU1_K1_LDSTI0_LBSPPA128_LBSPPB128_LBSPPM0_LPA8_LPB8_LPM0_LRVW16_LWPMn1_MIAV1_MIWT2_2_MO40_NTn1_NTA0_NTB0_NTC0_NTD0_NTM0_NEPBS0_NLCA1_NLCB1_ONLL1_PGR2_PLR1_PKA0_SIA3_SS1_SU32_SUM0_SUS256_SPO0_SRVW0_SSO0_SVW1_SK0_SKFTR0_SKXCCM0_TLDS1_ULSGRO0_USL1_UIOFGRO0_USFGROn1_VSn1_VWA1_VWB1_WSGRA0_WSGRB0_WS32_WG64_2_1_WGM8_WGMXCC1_WGMXCCGn1
    SolutionIndex: 117
    SolutionNameMin: Cijk_Alik_Bljk_BBS_BH_Bias_HA_S_SAV_UserArgs_MT32x64x64_MI16x16x1_SN_LDSB0_AFC1_AG0_AFEM1_AFEM1_ASEM1_CLR0_CADS0_DTLA0_DTLB0_DTVA0_DTVB0_EPS0_FDSI0_GRPM1_GRVWA8_GRVWB8_GSU1_GSUAMB_GSUC0_GSUWGMRR0_GLS0_ISA1151_IU1_K1_LDSTI0_LBSPPA128_LBSPPB128_LBSPPM0_LPA8_LPB8_LPM0_LRVW16_LWPMn1_MIAV1_MIWT2_1_MO40_NTn1_NTA0_NTB0_NTC0_NTD0_NTM0_NEPBS0_NLCA1_NLCB1_ONLL1_PGR2_PLR1_PKA0_SIA1_SS1_SU32_SUM0_SUS256_SPO0_SRVW0_SSO0_SVW1_SK0_SKFTR0_SKXCCM0_TLDS1_ULSGRO0_USL1_UIOFGRO0_USFGROn1_VSn1_VWA1_VWB1_WSGRA0_WSGRB0_WS32_WG16_8_1_WGM8_WGMXCC1_WGMXCCGn1
    SolutionIndex: 118
    SolutionNameMin: Cijk_Alik_Bljk_BBS_BH_Bias_HA_S_SAV_UserArgs_MT32x16x128_MI16x16x1_SN_LDSB0_AFC1_AG0_AFEM1_AFEM1_ASEM1_CLR0_CADS0_DTLA0_DTLB0_DTVA0_DTVB0_EPS0_FDSI0_GRPM1_GRVWA8_GRVWB8_GSU1_GSUAMB_GSUC0_GSUWGMRR0_GLS0_ISA1151_IU1_K1_LDSTI0_LBSPPA256_LBSPPB256_LBSPPM0_LPA8_LPB8_LPM0_LRVW16_LWPMn1_MIAV1_MIWT1_1_MO40_NTn1_NTA0_NTB0_NTC0_NTD0_NTM0_NEPBS0_NLCA1_NLCB1_ONLL1_PGR2_PLR1_PKA0_SIA1_SS1_SU32_SUM0_SUS256_SPO0_SRVW0_SSO0_SVW1_SK0_SKFTR0_SKXCCM0_TLDS1_ULSGRO0_USL1_UIOFGRO0_USFGROn1_VSn1_VWA1_VWB1_WSGRA0_WSGRB0_WS32_WG32_2_1_WGM8_WGMXCC1_WGMXCCGn1
- - - [64, 64, 1, 64]
    - [15, 43.6907]
  - - [256, 256, 1, 256]
    - [19, 2396.75]
  - - [320, 64, 1, 64]
    - [16, 201.649]
  - - [576, 64, 1, 64]
    - [16, 362.969]
  - - [832, 64, 1, 64]
    - [15, 567.979]
  - - [1088, 64, 1, 64]
    - [39, 685.607]
  - - [1344, 64, 1, 64]
    - [39, 846.927]
  - - [1600, 64, 1, 64]
    - [10, 936.229]
  - - [1856, 64, 1, 64]
    - [15, 1086.03]
  - - [2112, 64, 1, 64]
    - [21, 1330.88]
  - - [2368, 64, 1, 64]
    - [24, 1492.2]
  - - [2624, 64, 1, 64]
    - [39, 1535.41]
  - - [2880, 64, 1, 64]
    - [39, 1685.21]
  - - [3136, 64, 1, 64]
    - [24, 1976.16]
  - - [3392, 64, 1, 64]
    - [39, 1852.48]
  - - [3648, 64, 1, 64]
    - [27, 2298.8]
  - - [3904, 64, 1, 64]
    - [28, 1998.85]
  - - [64, 320, 1, 64]
    - [15, 218.453]
  - - [320, 320, 1, 64]
    - [11, 1008.25]
  - - [576, 320, 1, 64]
    - [39, 1685.21]
  - - [832, 320, 1, 64]
    - [41, 2271.91]
  - - [1088, 320, 1, 64]
    - [42, 3183.18]
  - - [1344, 320, 1, 64]
    - [55, 3238.25]
  - - [1600, 320, 1, 64]
    - [9, 3449.26]
  - - [1856, 320, 1, 64]
    - [28, 4223.43]
  - - [2112, 320, 1, 64]
    - [49, 4325.38]
  - - [2368, 320, 1, 64]
    - [49, 5104.91]
  - - [2624, 320, 1, 64]
    - [41, 4885.41]
  - - [2880, 320, 1, 64]
    - [82, 5128.9]
  - - [3136, 320, 1, 64]
    - [26, 5352.11]
  - - [3392, 320, 1, 64]
    - [26, 5789.01]
  - - [3648, 320, 1, 64]
    - [28, 6225.92]
  - - [3904, 320, 1, 64]
    - [55, 6396.31]
  - - [64, 576, 1, 64]
    - [15, 362.969]
  - - [320, 576, 1, 64]
    - [39, 1685.21]
  - - [576, 576, 1, 64]
    - [39, 2498.08]
  - - [832, 576, 1, 64]
    - [55, 3407.87]
  - - [1088, 576, 1, 64]
    - [43, 4221.9]
  - - [1344, 576, 1, 64]
    - [49, 5215.29]
  - - [1600, 576, 1, 64]
    - [8, 5128.9]
  - - [1856, 576, 1, 64]
    - [26, 5701.63]
  - - [2112, 576, 1, 64]
    - [55, 6228.54]
  - - [2368, 576, 1, 64]
    - [26, 6466.22]
  - - [2624, 576, 1, 64]
    - [49, 7165.27]
  - - [2880, 576, 1, 64]
    - [43, 7077.89]
  - - [3136, 576, 1, 64]
    - [55, 7225.34]
  - - [64, 832, 1, 64]
    - [15, 524.288]
  - - [320, 832, 1, 64]
    - [29, 2129.92]
  - - [576, 832, 1, 64]
    - [55, 3407.87]
  - - [832, 832, 1, 64]
    - [61, 4430.23]
  - - [1088, 832, 1, 64]
    - [27, 5037.72]
  - - [1344, 832, 1, 64]
    - [26, 5725.22]
  - - [1600, 832, 1, 64]
    - [81, 6085.49]
  - - [1856, 832, 1, 64]
    - [49, 7320.61]
  - - [2112, 832, 1, 64]
    - [43, 7497.32]
  - - [64, 1088, 1, 64]
    - [23, 636.635]
  - - [320, 1088, 1, 64]
    - [50, 2785.28]
  - - [576, 1088, 1, 64]
    - [9, 3646.18]
  - - [832, 1088, 1, 64]
    - [49, 4634.71]
  - - [1088, 1088, 1, 64]
    - [43, 6313.3]
  - - [1344, 1088, 1, 64]
    - [14, 6932.25]
  - - [1600, 1088, 1, 64]
    - [55, 7187.82]
  - - [64, 1344, 1, 64]
    - [39, 786.432]
  - - [320, 1344, 1, 64]
    - [26, 3670.02]
  - - [576, 1344, 1, 64]
    - [47, 4954.52]
  - - [832, 1344, 1, 64]
    - [43, 6223.07]
  - - [1088, 1344, 1, 64]
    - [82, 6684.67]
  - - [1344, 1344, 1, 64]
    - [3, 7458.42]
  - - [64, 1600, 1, 64]
    - [10, 1008.25]
  - - [320, 1600, 1, 64]
    - [55, 3449.26]
  - - [576, 1600, 1, 64]
    - [61, 5617.37]
  - - [832, 1600, 1, 64]
    - [61, 6815.74]
  - - [1088, 1600, 1, 64]
    - [3, 6963.2]
  - - [64, 1856, 1, 64]
    - [17, 1013.62]
  - - [320, 1856, 1, 64]
    - [31, 4223.43]
  - - [576, 1856, 1, 64]
    - [26, 5701.63]
  - - [832, 1856, 1, 64]
    - [5, 6588.55]
  - - [64, 2112, 1, 64]
    - [39, 1235.82]
  - - [320, 2112, 1, 64]
    - [9, 4119.41]
  - - [576, 2112, 1, 64]
    - [27, 6488.06]
  - - [832, 2112, 1, 64]
    - [43, 7497.32]
  - - [64, 2368, 1, 64]
    - [11, 1492.2]
  - - [320, 2368, 1, 64]
    - [61, 5104.91]
  - - [576, 2368, 1, 64]
    - [61, 6235.28]
  - - [64, 2624, 1, 64]
    - [27, 1433.05]
  - - [320, 2624, 1, 64]
    - [61, 5118.05]
  - - [576, 2624, 1, 64]
    - [61, 7440.86]
  - - [64, 2880, 1, 64]
    - [42, 1814.84]
  - - [320, 2880, 1, 64]
    - [26, 5362.04]
  - - [576, 2880, 1, 64]
    - [61, 7321.95]
  - - [64, 3136, 1, 64]
    - [41, 1835.01]
  - - [320, 3136, 1, 64]
    - [61, 5838.66]
  - - [576, 3136, 1, 64]
    - [3, 7225.34]
  - - [64, 3392, 1, 64]
    - [27, 2137.48]
  - - [320, 3392, 1, 64]
    - [61, 5343.7]
  - - [64, 3648, 1, 64]
    - [26, 2134.6]
  - - [320, 3648, 1, 64]
    - [61, 6225.92]
  - - [64, 3904, 1, 64]
    - [26, 2284.4]
  - - [320, 3904, 1, 64]
    - [26, 6396.31]
  - - [64, 64, 1, 256]
    - [19, 174.763]
  - - [320, 64, 1, 256]
    - [16, 873.813]
  - - [576, 64, 1, 256]
    - [94, 1348.17]
  - - [832, 64, 1, 256]
    - [11, 1947.36]
  - - [1088, 64, 1, 256]
    - [21, 2546.54]
  - - [1344, 64, 1, 256]
    - [11, 2936.01]
  - - [1600, 64, 1, 256]
    - [23, 3495.25]
  - - [1856, 64, 1, 256]
    - [21, 4344.1]
  - - [2112, 64, 1, 256]
    - [23, 4613.73]
  - - [2368, 64, 1, 256]
    - [23, 4849.66]
  - - [2624, 64, 1, 256]
    - [23, 5057.84]
  - - [2880, 64, 1, 256]
    - [27, 5551.28]
  - - [3136, 64, 1, 256]
    - [23, 5708.91]
  - - [3392, 64, 1, 256]
    - [27, 6174.95]
  - - [3648, 64, 1, 256]
    - [23, 7031.63]
  - - [3904, 64, 1, 256]
    - [12, 6732.96]
  - - [64, 320, 1, 256]
    - [16, 873.813]
  - - [320, 320, 1, 256]
    - [10, 3744.91]
  - - [576, 320, 1, 256]
    - [24, 5898.24]
  - - [832, 320, 1, 256]
    - [55, 7573.05]
  - - [1088, 320, 1, 256]
    - [23, 8488.47]
  - - [1344, 320, 1, 256]
    - [43, 11589.5]
  - - [64, 576, 1, 256]
    - [19, 1348.17]
  - - [320, 576, 1, 256]
    - [23, 5551.28]
  - - [576, 576, 1, 256]
    - [24, 9437.18]
  - - [832, 576, 1, 256]
    - [26, 11684.1]
  - - [64, 832, 1, 256]
    - [23, 1817.53]
  - - [320, 832, 1, 256]
    - [23, 7174.47]
  - - [576, 832, 1, 256]
    - [23, 10668.1]
  - - [64, 1088, 1, 256]
    - [21, 2546.54]
  - - [320, 1088, 1, 256]
    - [24, 9903.22]
  - - [64, 1344, 1, 256]
    - [15, 2936.01]
  - - [320, 1344, 1, 256]
    - [26, 11010.0]
  - - [64, 1600, 1, 256]
    - [39, 3744.91]
  - - [64, 1856, 1, 256]
    - [11, 4344.1]
  - - [64, 2112, 1, 256]
    - [10, 4613.73]
  - - [64, 2368, 1, 256]
    - [39, 5172.97]
  - - [64, 2624, 1, 256]
    - [10, 5057.84]
  - - [64, 2880, 1, 256]
    - [27, 6291.46]
  - - [64, 3136, 1, 256]
    - [26, 6044.73]
  - - [64, 3392, 1, 256]
    - [47, 6538.18]
  - - [64, 3648, 1, 256]
    - [69, 7031.63]
  - - [64, 3904, 1, 256]
    - [24, 7525.07]
  - - [64, 64, 1, 512]
    - [17, 322.639]
  - - [320, 64, 1, 512]
    - [23, 1310.72]
  - - [576, 64, 1, 512]
    - [10, 2516.58]
  - - [832, 64, 1, 512]
    - [22, 3407.87]
  - - [1088, 64, 1, 512]
    - [21, 4194.3]
  - - [1344, 64, 1, 512]
    - [39, 4635.81]
  - - [1600, 64, 1, 512]
    - [15, 6168.09]
  - - [1856, 64, 1, 512]
    - [21, 6401.83]
  - - [2112, 64, 1, 512]
    - [23, 7689.56]
  - - [2368, 64, 1, 512]
    - [11, 7759.46]
  - - [2624, 64, 1, 512]
    - [23, 7816.66]
  - - [2880, 64, 1, 512]
    - [23, 8579.26]
  - - [3136, 64, 1, 512]
    - [27, 9341.86]
  - - [3392, 64, 1, 512]
    - [23, 10585.6]
  - - [3648, 64, 1, 512]
    - [43, 10867.1]
  - - [64, 320, 1, 512]
    - [23, 1233.62]
  - - [320, 320, 1, 512]
    - [10, 6168.09]
  - - [576, 320, 1, 512]
    - [24, 9933.88]
  - - [64, 576, 1, 512]
    - [21, 2696.34]
  - - [320, 576, 1, 512]
    - [27, 10485.8]
  - - [64, 832, 1, 512]
    - [39, 3635.06]
  - - [64, 1088, 1, 512]
    - [11, 4753.54]
  - - [64, 1344, 1, 512]
    - [10, 5181.2]
  - - [64, 1600, 1, 512]
    - [10, 6168.09]
  - - [64, 1856, 1, 512]
    - [23, 6757.49]
  - - [64, 2112, 1, 512]
    - [45, 8650.75]
  - - [64, 2368, 1, 512]
    - [11, 8621.62]
  - - [64, 2624, 1, 512]
    - [10, 9553.69]
  - - [64, 2880, 1, 512]
    - [10, 9933.88]
  - - [64, 3136, 1, 512]
    - [39, 9786.71]
  - - [64, 3392, 1, 512]
    - [24, 12349.9]
  - - [64, 3648, 1, 512]
    - [24, 13282.0]
  - - [64, 64, 1, 1024]
    - [63, 559.241]
  - - [320, 64, 1, 1024]
    - [62, 2796.2]
  - - [576, 64, 1, 1024]
    - [16, 4441.03]
  - - [832, 64, 1, 1024]
    - [23, 4741.39]
  - - [1088, 64, 1, 1024]
    - [19, 7130.32]
  - - [1344, 64, 1, 1024]
    - [24, 7046.43]
  - - [1600, 64, 1, 1024]
    - [11, 8065.97]
  - - [1856, 64, 1, 1024]
    - [27, 9730.79]
  - - [64, 320, 1, 1024]
    - [16, 2621.44]
  - - [320, 320, 1, 1024]
    - [11, 9986.44]
  - - [64, 576, 1, 1024]
    - [63, 5033.16]
  - - [64, 832, 1, 1024]
    - [23, 5739.57]
  - - [64, 1088, 1, 1024]
    - [23, 7505.6]
  - - [64, 1344, 1, 1024]
    - [22, 8388.61]
  - - [64, 1600, 1, 1024]
    - [10, 10485.8]
  - - [64, 1856, 1, 1024]
    - [67, 12163.5]
  - - [64, 64, 1, 2048]
    - [62, 1118.48]
  - - [320, 64, 1, 2048]
    - [62, 4415.06]
  - - [576, 64, 1, 2048]
    - [64, 6291.46]
  - - [832, 64, 1, 2048]
    - [11, 7789.42]
  - - [64, 320, 1, 2048]
    - [62, 4934.48]
  - - [64, 576, 1, 2048]
    - [19, 7947.1]
  - - [64, 832, 1, 2048]
    - [10, 8388.61]
  - - [64, 64, 1, 4096]
    - [62, 1677.72]
  - - [320, 64, 1, 4096]
    - [86, 6990.51]
  - - [64, 320, 1, 4096]
    - [62, 7989.15]
  - - [192, 64, 1, 64]
    - [16, 120.99]
  - - [448, 64, 1, 64]
    - [17, 282.309]
  - - [704, 64, 1, 64]
    - [23, 411.941]
  - - [960, 64, 1, 64]
    - [15, 604.948]
  - - [1216, 64, 1, 64]
    - [39, 766.267]
  - - [1472, 64, 1, 64]
    - [27, 927.586]
  - - [1728, 64, 1, 64]
    - [10, 1011.13]
  - - [1984, 64, 1, 64]
    - [15, 1160.92]
  - - [64, 192, 1, 64]
    - [16, 120.99]
  - - [192, 192, 1, 64]
    - [39, 362.969]
  - - [320, 192, 1, 64]
    - [117, 604.948]
  - - [448, 192, 1, 64]
    - [17, 846.927]
  - - [576, 192, 1, 64]
    - [11, 1088.91]
  - - [704, 192, 1, 64]
    - [21, 1235.82]
  - - [832, 192, 1, 64]
    - [39, 1460.52]
  - - [960, 192, 1, 64]
    - [39, 1572.86]
  - - [1088, 192, 1, 64]
    - [47, 1671.17]
  - - [1216, 192, 1, 64]
    - [39, 1867.78]
  - - [1344, 192, 1, 64]
    - [39, 2064.38]
  - - [1472, 192, 1, 64]
    - [24, 2583.99]
  - - [1600, 192, 1, 64]
    - [27, 2621.44]
  - - [1728, 192, 1, 64]
    - [27, 2831.16]
  - - [1856, 192, 1, 64]
    - [55, 2850.82]
  - - [1984, 192, 1, 64]
    - [27, 3482.77]
  - - [192, 320, 1, 64]
    - [11, 561.737]
  - - [448, 320, 1, 64]
    - [39, 1223.34]
  - - [704, 320, 1, 64]
    - [23, 1922.39]
  - - [960, 320, 1, 64]
    - [12, 2621.44]
  - - [1216, 320, 1, 64]
    - [3, 2767.08]
  - - [1472, 320, 1, 64]
    - [27, 3546.65]
  - - [1728, 320, 1, 64]
    - [26, 3932.16]
  - - [1984, 320, 1, 64]
    - [32, 4063.23]
  - - [64, 448, 1, 64]
    - [39, 262.144]
  - - [192, 448, 1, 64]
    - [39, 786.432]
  - - [320, 448, 1, 64]
    - [15, 1310.72]
  - - [448, 448, 1, 64]
    - [39, 1835.01]
  - - [576, 448, 1, 64]
    - [26, 2359.3]
  - - [704, 448, 1, 64]
    - [39, 2523.14]
  - - [832, 448, 1, 64]
    - [27, 3407.87]
  - - [960, 448, 1, 64]
    - [13, 3440.64]
  - - [1088, 448, 1, 64]
    - [26, 3670.02]
  - - [1216, 448, 1, 64]
    - [26, 4101.78]
  - - [1344, 448, 1, 64]
    - [55, 4056.33]
  - - [1472, 448, 1, 64]
    - [8, 4220.52]
  - - [1600, 448, 1, 64]
    - [49, 4828.97]
  - - [1728, 448, 1, 64]
    - [49, 4954.52]
  - - [1856, 448, 1, 64]
    - [3, 4627.41]
  - - [1984, 448, 1, 64]
    - [24, 5171.39]
  - - [192, 576, 1, 64]
    - [26, 1088.91]
  - - [448, 576, 1, 64]
    - [39, 2202.01]
  - - [704, 576, 1, 64]
    - [55, 3053.21]
  - - [960, 576, 1, 64]
    - [55, 3932.16]
  - - [1216, 576, 1, 64]
    - [8, 4718.59]
  - - [1472, 576, 1, 64]
    - [27, 4933.07]
  - - [1728, 576, 1, 64]
    - [26, 5539.22]
  - - [1984, 576, 1, 64]
    - [55, 6094.85]
  - - [64, 704, 1, 64]
    - [15, 443.628]
  - - [192, 704, 1, 64]
    - [39, 1235.82]
  - - [320, 704, 1, 64]
    - [39, 1922.39]
  - - [448, 704, 1, 64]
    - [27, 2883.58]
  - - [576, 704, 1, 64]
    - [55, 3053.21]
  - - [704, 704, 1, 64]
    - [49, 3338.89]
  - - [832, 704, 1, 64]
    - [55, 3945.96]
  - - [960, 704, 1, 64]
    - [3, 4325.38]
  - - [1088, 704, 1, 64]
    - [61, 4668.66]
  - - [1216, 704, 1, 64]
    - [5, 4980.74]
  - - [1344, 704, 1, 64]
    - [36, 4658.1]
  - - [1472, 704, 1, 64]
    - [61, 5767.17]
  - - [1600, 704, 1, 64]
    - [43, 6268.66]
  - - [1728, 704, 1, 64]
    - [27, 6488.06]
  - - [1856, 704, 1, 64]
    - [61, 6689.91]
  - - [1984, 704, 1, 64]
    - [14, 6876.24]
  - - [192, 832, 1, 64]
    - [39, 1460.52]
  - - [448, 832, 1, 64]
    - [50, 2981.89]
  - - [704, 832, 1, 64]
    - [3, 4165.18]
  - - [960, 832, 1, 64]
    - [3, 4647.1]
  - - [1216, 832, 1, 64]
    - [26, 5630.4]
  - - [1472, 832, 1, 64]
    - [55, 6029.31]
  - - [1728, 832, 1, 64]
    - [61, 7077.89]
  - - [1984, 832, 1, 64]
    - [34, 7042.94]
  - - [64, 960, 1, 64]
    - [17, 655.36]
  - - [192, 960, 1, 64]
    - [39, 1572.86]
  - - [320, 960, 1, 64]
    - [56, 2621.44]
  - - [448, 960, 1, 64]
    - [70, 3238.25]
  - - [576, 960, 1, 64]
    - [31, 3932.16]
  - - [704, 960, 1, 64]
    - [43, 4325.38]
  - - [832, 960, 1, 64]
    - [27, 4868.39]
  - - [960, 960, 1, 64]
    - [3, 5362.04]
  - - [1088, 960, 1, 64]
    - [82, 6076.97]
  - - [1216, 960, 1, 64]
    - [59, 6225.92]
  - - [1344, 960, 1, 64]
    - [61, 5898.24]
  - - [1472, 960, 1, 64]
    - [82, 6459.98]
  - - [1600, 960, 1, 64]
    - [49, 7021.71]
  - - [1728, 960, 1, 64]
    - [26, 7321.95]
  - - [1856, 960, 1, 64]
    - [8, 7356.94]
  - - [1984, 960, 1, 64]
    - [78, 7864.32]
  - - [192, 1088, 1, 64]
    - [21, 1782.58]
  - - [448, 1088, 1, 64]
    - [41, 3670.02]
  - - [704, 1088, 1, 64]
    - [41, 4902.09]
  - - [960, 1088, 1, 64]
    - [61, 5812.76]
  - - [1216, 1088, 1, 64]
    - [61, 7056.04]
  - - [1472, 1088, 1, 64]
    - [43, 7068.85]
  - - [1728, 1088, 1, 64]
    - [55, 7292.37]
  - - [64, 1216, 1, 64]
    - [39, 766.267]
  - - [192, 1216, 1, 64]
    - [39, 1992.29]
  - - [320, 1216, 1, 64]
    - [36, 3112.96]
  - - [448, 1216, 1, 64]
    - [9, 4101.78]
  - - [576, 1216, 1, 64]
    - [5, 4718.59]
  - - [704, 1216, 1, 64]
    - [27, 4980.74]
  - - [832, 1216, 1, 64]
    - [26, 5630.4]
  - - [960, 1216, 1, 64]
    - [26, 6225.92]
  - - [1088, 1216, 1, 64]
    - [61, 6513.27]
  - - [1216, 1216, 1, 64]
    - [49, 7009.92]
  - - [1344, 1216, 1, 64]
    - [43, 7213.48]
  - - [1472, 1216, 1, 64]
    - [78, 7637.13]
  - - [1600, 1216, 1, 64]
    - [26, 7115.34]
  - - [192, 1344, 1, 64]
    - [73, 2202.01]
  - - [448, 1344, 1, 64]
    - [13, 4056.33]
  - - [704, 1344, 1, 64]
    - [49, 5265.68]
  - - [960, 1344, 1, 64]
    - [9, 5898.24]
  - - [1216, 1344, 1, 64]
    - [43, 6973.03]
  - - [64, 1472, 1, 64]
    - [11, 927.586]
  - - [192, 1472, 1, 64]
    - [13, 2260.99]
  - - [320, 1472, 1, 64]
    - [13, 3349.62]
  - - [448, 1472, 1, 64]
    - [3, 4220.52]
  - - [576, 1472, 1, 64]
    - [3, 4933.07]
  - - [704, 1472, 1, 64]
    - [26, 5101.73]
  - - [832, 1472, 1, 64]
    - [35, 6531.75]
  - - [960, 1472, 1, 64]
    - [61, 7235.17]
  - - [1088, 1472, 1, 64]
    - [43, 7068.85]
  - - [1216, 1472, 1, 64]
    - [3, 7637.13]
  - - [192, 1600, 1, 64]
    - [39, 2313.04]
  - - [448, 1600, 1, 64]
    - [27, 4369.07]
  - - [704, 1600, 1, 64]
    - [31, 5545.35]
  - - [960, 1600, 1, 64]
    - [9, 6779.59]
  - - [1216, 1600, 1, 64]
    - [26, 7324.61]
  - - [64, 1728, 1, 64]
    - [22, 1088.91]
  - - [192, 1728, 1, 64]
    - [42, 2831.16]
  - - [320, 1728, 1, 64]
    - [57, 3932.16]
  - - [448, 1728, 1, 64]
    - [81, 4718.59]
  - - [576, 1728, 1, 64]
    - [61, 5791.0]
  - - [704, 1728, 1, 64]
    - [61, 6770.15]
  - - [832, 1728, 1, 64]
    - [37, 7077.89]
  - - [960, 1728, 1, 64]
    - [49, 7077.89]
  - - [1088, 1728, 1, 64]
    - [26, 7520.26]
  - - [192, 1856, 1, 64]
    - [27, 3258.08]
  - - [448, 1856, 1, 64]
    - [3, 4837.75]
  - - [704, 1856, 1, 64]
    - [61, 6968.66]
  - - [960, 1856, 1, 64]
    - [5, 7356.94]
  - - [64, 1984, 1, 64]
    - [41, 1160.92]
  - - [192, 1984, 1, 64]
    - [3, 2708.82]
  - - [320, 1984, 1, 64]
    - [50, 4514.7]
  - - [448, 1984, 1, 64]
    - [61, 5417.64]
  - - [576, 1984, 1, 64]
    - [55, 5626.01]
  - - [704, 1984, 1, 64]
    - [61, 7151.29]
  - - [832, 1984, 1, 64]
    - [3, 6815.74]
  - - [960, 1984, 1, 64]
    - [5, 8126.46]
  - - [192, 64, 1, 256]
    - [23, 449.39]
  - - [448, 64, 1, 256]
    - [17, 1129.24]
  - - [704, 64, 1, 256]
    - [23, 1647.76]
  - - [960, 64, 1, 256]
    - [15, 2097.15]
  - - [1216, 64, 1, 256]
    - [20, 2846.13]
  - - [1472, 64, 1, 256]
    - [23, 3014.66]
  - - [1728, 64, 1, 256]
    - [11, 4044.51]
  - - [1984, 64, 1, 256]
    - [43, 4063.23]
  - - [64, 192, 1, 256]
    - [17, 449.39]
  - - [192, 192, 1, 256]
    - [17, 1451.87]
  - - [320, 192, 1, 256]
    - [17, 2246.95]
  - - [448, 192, 1, 256]
    - [10, 2936.01]
  - - [576, 192, 1, 256]
    - [10, 3774.87]
  - - [704, 192, 1, 256]
    - [23, 4943.29]
  - - [832, 192, 1, 256]
    - [10, 5842.07]
  - - [960, 192, 1, 256]
    - [27, 5898.24]
  - - [1088, 192, 1, 256]
    - [23, 6291.46]
  - - [1216, 192, 1, 256]
    - [41, 7471.1]
  - - [1344, 192, 1, 256]
    - [11, 7340.03]
  - - [1472, 192, 1, 256]
    - [55, 8511.97]
  - - [1600, 192, 1, 256]
    - [12, 8278.23]
  - - [1728, 192, 1, 256]
    - [55, 8089.01]
  - - [1856, 192, 1, 256]
    - [41, 10136.2]
  - - [1984, 192, 1, 256]
    - [26, 8865.23]
  - - [192, 320, 1, 256]
    - [16, 2246.95]
  - - [448, 320, 1, 256]
    - [27, 4587.52]
  - - [704, 320, 1, 256]
    - [10, 6784.9]
  - - [960, 320, 1, 256]
    - [41, 9252.14]
  - - [1216, 320, 1, 256]
    - [27, 11068.3]
  - - [1472, 320, 1, 256]
    - [26, 11484.4]
  - - [64, 448, 1, 256]
    - [11, 1129.24]
  - - [192, 448, 1, 256]
    - [10, 3145.73]
  - - [320, 448, 1, 256]
    - [39, 4893.35]
  - - [448, 448, 1, 256]
    - [26, 6850.7]
  - - [576, 448, 1, 256]
    - [12, 7771.8]
  - - [704, 448, 1, 256]
    - [80, 8498.98]
  - - [832, 448, 1, 256]
    - [24, 10044.3]
  - - [960, 448, 1, 256]
    - [55, 10485.8]
  - - [1088, 448, 1, 256]
    - [26, 11883.9]
  - - [192, 576, 1, 256]
    - [10, 3774.87]
  - - [448, 576, 1, 256]
    - [42, 8257.54]
  - - [704, 576, 1, 256]
    - [26, 11534.3]
  - - [64, 704, 1, 256]
    - [18, 1647.76]
  - - [192, 704, 1, 256]
    - [46, 4613.73]
  - - [320, 704, 1, 256]
    - [10, 6784.9]
  - - [448, 704, 1, 256]
    - [24, 9498.86]
  - - [576, 704, 1, 256]
    - [41, 10927.3]
  - - [192, 832, 1, 256]
    - [11, 5452.6]
  - - [448, 832, 1, 256]
    - [27, 10602.3]
  - - [64, 960, 1, 256]
    - [10, 2246.95]
  - - [192, 960, 1, 256]
    - [24, 5898.24]
  - - [320, 960, 1, 256]
    - [27, 9252.14]
  - - [448, 960, 1, 256]
    - [32, 11010.0]
  - - [192, 1088, 1, 256]
    - [26, 6684.67]
  - - [448, 1088, 1, 256]
    - [26, 11883.9]
  - - [64, 1216, 1, 256]
    - [21, 2846.13]
  - - [192, 1216, 1, 256]
    - [23, 7031.63]
  - - [320, 1216, 1, 256]
    - [26, 11068.3]
  - - [192, 1344, 1, 256]
    - [39, 6953.71]
  - - [64, 1472, 1, 256]
    - [10, 3215.63]
  - - [192, 1472, 1, 256]
    - [27, 8511.97]
  - - [320, 1472, 1, 256]
    - [13, 11484.4]
  - - [192, 1600, 1, 256]
    - [24, 9252.14]
  - - [64, 1728, 1, 256]
    - [23, 3538.94]
  - - [192, 1728, 1, 256]
    - [24, 9437.18]
  - - [192, 1856, 1, 256]
    - [26, 9602.75]
  - - [64, 1984, 1, 256]
    - [23, 4334.11]
  - - [192, 1984, 1, 256]
    - [41, 10265.0]
  - - [192, 64, 1, 512]
    - [62, 967.916]
  - - [448, 64, 1, 512]
    - [100, 1957.34]
  - - [704, 64, 1, 512]
    - [63, 3295.52]
  - - [960, 64, 1, 512]
    - [17, 4194.3]
  - - [1216, 64, 1, 512]
    - [17, 4427.32]
  - - [1472, 64, 1, 512]
    - [65, 5359.39]
  - - [1728, 64, 1, 512]
    - [11, 6291.46]
  - - [1984, 64, 1, 512]
    - [11, 6501.17]
  - - [64, 192, 1, 512]
    - [17, 898.779]
  - - [192, 192, 1, 512]
    - [16, 2903.75]
  - - [320, 192, 1, 512]
    - [23, 3700.86]
  - - [448, 192, 1, 512]
    - [23, 5181.2]
  - - [576, 192, 1, 512]
    - [10, 6661.54]
  - - [704, 192, 1, 512]
    - [11, 8141.88]
  - - [832, 192, 1, 512]
    - [11, 9087.66]
  - - [960, 192, 1, 512]
    - [10, 9933.88]
  - - [1088, 192, 1, 512]
    - [23, 10695.5]
  - - [1216, 192, 1, 512]
    - [23, 11384.5]
  - - [192, 320, 1, 512]
    - [18, 4493.9]
  - - [448, 320, 1, 512]
    - [11, 9175.04]
  - - [704, 320, 1, 512]
    - [24, 12815.9]
  - - [64, 448, 1, 512]
    - [21, 2097.15]
  - - [192, 448, 1, 512]
    - [10, 5181.2]
  - - [320, 448, 1, 512]
    - [41, 9175.04]
  - - [448, 448, 1, 512]
    - [39, 11417.8]
  - - [192, 576, 1, 512]
    - [10, 6661.54]
  - - [64, 704, 1, 512]
    - [10, 3549.03]
  - - [192, 704, 1, 512]
    - [23, 8141.88]
  - - [320, 704, 1, 512]
    - [26, 12815.9]
  - - [192, 832, 1, 512]
    - [23, 9622.23]
  - - [64, 960, 1, 512]
    - [10, 4493.9]
  - - [192, 960, 1, 512]
    - [10, 10485.8]
  - - [192, 1088, 1, 512]
    - [23, 11883.9]
  - - [64, 1216, 1, 512]
    - [11, 4980.74]
  - - [192, 1216, 1, 512]
    - [24, 13282.0]
  - - [64, 1472, 1, 512]
    - [15, 6029.31]
  - - [64, 1728, 1, 512]
    - [43, 7077.89]
  - - [64, 1984, 1, 512]
    - [11, 8126.46]
  - - [192, 64, 1, 1024]
    - [16, 1677.72]
  - - [448, 64, 1, 1024]
    - [63, 3670.02]
  - - [704, 64, 1, 1024]
    - [16, 4856.56]
  - - [960, 64, 1, 1024]
    - [40, 5719.51]
  - - [1216, 64, 1, 1024]
    - [20, 7244.71]
  - - [1472, 64, 1, 1024]
    - [11, 7420.69]
  - - [1728, 64, 1, 1024]
    - [11, 8388.61]
  - - [64, 192, 1, 1024]
    - [62, 1677.72]
  - - [192, 192, 1, 1024]
    - [16, 5033.16]
  - - [320, 192, 1, 1024]
    - [64, 6990.51]
  - - [448, 192, 1, 1024]
    - [23, 8007.31]
  - - [576, 192, 1, 1024]
    - [11, 10785.4]
  - - [192, 320, 1, 1024]
    - [19, 7401.71]
  - - [64, 448, 1, 1024]
    - [101, 4194.3]
  - - [192, 448, 1, 1024]
    - [23, 8007.31]
  - - [192, 576, 1, 1024]
    - [21, 11324.6]
  - - [64, 704, 1, 1024]
    - [10, 5767.17]
  - - [64, 960, 1, 1024]
    - [11, 7401.71]
  - - [64, 1216, 1, 1024]
    - [23, 7969.18]
  - - [64, 1472, 1, 1024]
    - [42, 10154.6]
  - - [64, 1728, 1, 1024]
    - [23, 11324.6]
  - - [192, 64, 1, 2048]
    - [62, 2796.2]
  - - [448, 64, 1, 2048]
    - [19, 5872.03]
  - - [704, 64, 1, 2048]
    - [63, 8023.89]
  - - [64, 192, 1, 2048]
    - [62, 3145.73]
  - - [192, 192, 1, 2048]
    - [19, 7947.1]
  - - [64, 448, 1, 2048]
    - [63, 6524.47]
  - - [64, 704, 1, 2048]
    - [10, 8788.07]
  - - [192, 64, 1, 4096]
    - [19, 4376.67]
  - - [448, 64, 1, 4096]
    - [19, 9033.89]
  - - [64, 192, 1, 4096]
    - [86, 4793.49]
  - - [64, 448, 1, 4096]
    - [63, 10212.2]
  - - [128, 64, 1, 64]
    - [22, 87.3813]
  - - [256, 64, 1, 64]
    - [16, 190.65]
  - - [384, 64, 1, 64]
    - [16, 241.979]
  - - [512, 64, 1, 64]
    - [46, 322.639]
  - - [640, 64, 1, 64]
    - [16, 403.298]
  - - [768, 64, 1, 64]
    - [11, 524.288]
  - - [896, 64, 1, 64]
    - [11, 611.669]
  - - [1024, 64, 1, 64]
    - [17, 599.186]
  - - [64, 128, 1, 64]
    - [15, 80.6597]
  - - [128, 128, 1, 64]
    - [11, 161.319]
  - - [192, 128, 1, 64]
    - [39, 262.144]
  - - [256, 128, 1, 64]
    - [73, 349.525]
  - - [320, 128, 1, 64]
    - [16, 403.298]
  - - [384, 128, 1, 64]
    - [39, 483.958]
  - - [448, 128, 1, 64]
    - [17, 564.618]
  - - [512, 128, 1, 64]
    - [15, 699.051]
  - - [576, 128, 1, 64]
    - [17, 786.432]
  - - [640, 128, 1, 64]
    - [21, 873.813]
  - - [704, 128, 1, 64]
    - [15, 887.257]
  - - [768, 128, 1, 64]
    - [39, 967.916]
  - - [832, 128, 1, 64]
    - [15, 973.678]
  - - [896, 128, 1, 64]
    - [13, 1048.58]
  - - [960, 128, 1, 64]
    - [15, 1209.9]
  - - [1024, 128, 1, 64]
    - [11, 1290.56]
  - - [128, 192, 1, 64]
    - [11, 241.979]
  - - [256, 192, 1, 64]
    - [11, 483.958]
  - - [384, 192, 1, 64]
    - [21, 786.432]
  - - [512, 192, 1, 64]
    - [39, 838.861]
  - - [640, 192, 1, 64]
    - [11, 1310.72]
  - - [768, 192, 1, 64]
    - [39, 1348.17]
  - - [896, 192, 1, 64]
    - [10, 1468.01]
  - - [1024, 192, 1, 64]
    - [21, 1935.83]
  - - [64, 256, 1, 64]
    - [21, 161.319]
  - - [128, 256, 1, 64]
    - [39, 299.593]
  - - [192, 256, 1, 64]
    - [39, 483.958]
  - - [256, 256, 1, 64]
    - [21, 699.051]
  - - [320, 256, 1, 64]
    - [23, 806.597]
  - - [384, 256, 1, 64]
    - [22, 967.916]
  - - [448, 256, 1, 64]
    - [39, 1048.58]
  - - [512, 256, 1, 64]
    - [23, 1118.48]
  - - [576, 256, 1, 64]
    - [26, 1572.86]
  - - [640, 256, 1, 64]
    - [23, 1310.72]
  - - [704, 256, 1, 64]
    - [39, 1647.76]
  - - [768, 256, 1, 64]
    - [26, 1935.83]
  - - [832, 256, 1, 64]
    - [23, 1703.94]
  - - [896, 256, 1, 64]
    - [39, 1957.34]
  - - [960, 256, 1, 64]
    - [73, 2246.95]
  - - [1024, 256, 1, 64]
    - [34, 2396.75]
  - - [128, 320, 1, 64]
    - [39, 436.907]
  - - [256, 320, 1, 64]
    - [39, 806.597]
  - - [384, 320, 1, 64]
    - [10, 1123.47]
  - - [512, 320, 1, 64]
    - [11, 1613.19]
  - - [640, 320, 1, 64]
    - [39, 1747.63]
  - - [768, 320, 1, 64]
    - [39, 2097.15]
  - - [896, 320, 1, 64]
    - [55, 2446.68]
  - - [1024, 320, 1, 64]
    - [55, 2796.2]
  - - [64, 384, 1, 64]
    - [10, 262.144]
  - - [128, 384, 1, 64]
    - [11, 483.958]
  - - [192, 384, 1, 64]
    - [23, 725.937]
  - - [256, 384, 1, 64]
    - [33, 838.861]
  - - [320, 384, 1, 64]
    - [104, 983.04]
  - - [384, 384, 1, 64]
    - [45, 1451.87]
  - - [448, 384, 1, 64]
    - [74, 1572.86]
  - - [512, 384, 1, 64]
    - [12, 1797.56]
  - - [576, 384, 1, 64]
    - [10, 2022.25]
  - - [640, 384, 1, 64]
    - [50, 2246.95]
  - - [704, 384, 1, 64]
    - [24, 2306.87]
  - - [768, 384, 1, 64]
    - [13, 2696.34]
  - - [832, 384, 1, 64]
    - [60, 2726.3]
  - - [896, 384, 1, 64]
    - [36, 2936.01]
  - - [960, 384, 1, 64]
    - [42, 3145.73]
  - - [1024, 384, 1, 64]
    - [27, 3595.12]
  - - [128, 448, 1, 64]
    - [15, 611.669]
  - - [256, 448, 1, 64]
    - [27, 1223.34]
  - - [384, 448, 1, 64]
    - [30, 1468.01]
  - - [512, 448, 1, 64]
    - [27, 1957.34]
  - - [640, 448, 1, 64]
    - [24, 2621.44]
  - - [768, 448, 1, 64]
    - [49, 2752.51]
  - - [896, 448, 1, 64]
    - [24, 3425.35]
  - - [1024, 448, 1, 64]
    - [33, 3454.13]
  - - [64, 512, 1, 64]
    - [15, 322.639]
  - - [128, 512, 1, 64]
    - [11, 699.051]
  - - [192, 512, 1, 64]
    - [39, 967.916]
  - - [256, 512, 1, 64]
    - [10, 1118.48]
  - - [320, 512, 1, 64]
    - [23, 1497.97]
  - - [384, 512, 1, 64]
    - [32, 1797.56]
  - - [448, 512, 1, 64]
    - [24, 2097.15]
  - - [512, 512, 1, 64]
    - [54, 2236.96]
  - - [576, 512, 1, 64]
    - [41, 2696.34]
  - - [640, 512, 1, 64]
    - [12, 2995.93]
  - - [704, 512, 1, 64]
    - [27, 3075.82]
  - - [768, 512, 1, 64]
    - [35, 3595.12]
  - - [832, 512, 1, 64]
    - [55, 3207.41]
  - - [896, 512, 1, 64]
    - [28, 3670.02]
  - - [960, 512, 1, 64]
    - [3, 3495.25]
  - - [1024, 512, 1, 64]
    - [4, 3532.05]
  - - [128, 576, 1, 64]
    - [39, 725.937]
  - - [256, 576, 1, 64]
    - [11, 1348.17]
  - - [384, 576, 1, 64]
    - [39, 1887.44]
  - - [512, 576, 1, 64]
    - [55, 2516.58]
  - - [640, 576, 1, 64]
    - [33, 2949.12]
  - - [768, 576, 1, 64]
    - [33, 3538.94]
  - - [896, 576, 1, 64]
    - [8, 3670.02]
  - - [1024, 576, 1, 64]
    - [33, 4194.3]
  - - [64, 640, 1, 64]
    - [44, 436.907]
  - - [128, 640, 1, 64]
    - [39, 806.597]
  - - [192, 640, 1, 64]
    - [45, 1209.9]
  - - [256, 640, 1, 64]
    - [10, 1497.97]
  - - [320, 640, 1, 64]
    - [39, 1747.63]
  - - [384, 640, 1, 64]
    - [27, 2097.15]
  - - [448, 640, 1, 64]
    - [11, 2293.76]
  - - [512, 640, 1, 64]
    - [55, 2796.2]
  - - [576, 640, 1, 64]
    - [26, 3370.42]
  - - [640, 640, 1, 64]
    - [32, 3276.8]
  - - [704, 640, 1, 64]
    - [35, 3844.78]
  - - [768, 640, 1, 64]
    - [28, 4194.3]
  - - [832, 640, 1, 64]
    - [50, 3786.52]
  - - [896, 640, 1, 64]
    - [55, 4077.8]
  - - [960, 640, 1, 64]
    - [3, 4139.12]
  - - [1024, 640, 1, 64]
    - [32, 4934.48]
  - - [128, 704, 1, 64]
    - [39, 887.257]
  - - [256, 704, 1, 64]
    - [55, 1356.98]
  - - [384, 704, 1, 64]
    - [12, 2471.64]
  - - [512, 704, 1, 64]
    - [55, 3075.82]
  - - [640, 704, 1, 64]
    - [49, 3844.78]
  - - [768, 704, 1, 64]
    - [26, 4070.94]
  - - [896, 704, 1, 64]
    - [28, 4485.58]
  - - [1024, 704, 1, 64]
    - [82, 4613.73]
  - - [64, 768, 1, 64]
    - [40, 483.958]
  - - [128, 768, 1, 64]
    - [10, 1048.58]
  - - [192, 768, 1, 64]
    - [10, 1572.86]
  - - [256, 768, 1, 64]
    - [21, 1935.83]
  - - [320, 768, 1, 64]
    - [51, 2097.15]
  - - [384, 768, 1, 64]
    - [36, 2516.58]
  - - [448, 768, 1, 64]
    - [13, 2752.51]
  - - [512, 768, 1, 64]
    - [34, 3145.73]
  - - [576, 768, 1, 64]
    - [5, 3330.77]
  - - [640, 768, 1, 64]
    - [28, 4194.3]
  - - [704, 768, 1, 64]
    - [43, 4070.94]
  - - [768, 768, 1, 64]
    - [3, 4194.3]
  - - [832, 768, 1, 64]
    - [35, 4811.11]
  - - [896, 768, 1, 64]
    - [3, 4635.81]
  - - [960, 768, 1, 64]
    - [3, 4966.94]
  - - [1024, 768, 1, 64]
    - [82, 5033.16]
  - - [128, 832, 1, 64]
    - [39, 1048.58]
  - - [256, 832, 1, 64]
    - [39, 1817.53]
  - - [384, 832, 1, 64]
    - [30, 2555.9]
  - - [512, 832, 1, 64]
    - [55, 3207.41]
  - - [640, 832, 1, 64]
    - [9, 4009.26]
  - - [768, 832, 1, 64]
    - [29, 4089.45]
  - - [896, 832, 1, 64]
    - [82, 4771.02]
  - - [1024, 832, 1, 64]
    - [3, 4956.9]
  - - [64, 896, 1, 64]
    - [10, 611.669]
  - - [128, 896, 1, 64]
    - [39, 1129.24]
  - - [192, 896, 1, 64]
    - [23, 1468.01]
  - - [256, 896, 1, 64]
    - [39, 2097.15]
  - - [320, 896, 1, 64]
    - [9, 2293.76]
  - - [384, 896, 1, 64]
    - [34, 2752.51]
  - - [448, 896, 1, 64]
    - [13, 3425.35]
  - - [512, 896, 1, 64]
    - [28, 3454.13]
  - - [576, 896, 1, 64]
    - [3, 3670.02]
  - - [640, 896, 1, 64]
    - [34, 4317.67]
  - - [704, 896, 1, 64]
    - [13, 4485.58]
  - - [768, 896, 1, 64]
    - [3, 4404.02]
  - - [832, 896, 1, 64]
    - [61, 4771.02]
  - - [896, 896, 1, 64]
    - [49, 5408.44]
  - - [960, 896, 1, 64]
    - [3, 5242.88]
  - - [1024, 896, 1, 64]
    - [7, 6181.08]
  - - [128, 960, 1, 64]
    - [54, 1209.9]
  - - [256, 960, 1, 64]
    - [41, 2419.79]
  - - [384, 960, 1, 64]
    - [27, 3145.73]
  - - [512, 960, 1, 64]
    - [55, 3932.16]
  - - [640, 960, 1, 64]
    - [8, 4626.07]
  - - [768, 960, 1, 64]
    - [3, 4103.12]
  - - [896, 960, 1, 64]
    - [3, 4786.98]
  - - [1024, 960, 1, 64]
    - [8, 5470.83]
  - - [64, 1024, 1, 64]
    - [15, 645.278]
  - - [128, 1024, 1, 64]
    - [39, 1198.37]
  - - [192, 1024, 1, 64]
    - [24, 1935.83]
  - - [256, 1024, 1, 64]
    - [27, 2236.96]
  - - [320, 1024, 1, 64]
    - [36, 2621.44]
  - - [384, 1024, 1, 64]
    - [26, 3355.44]
  - - [448, 1024, 1, 64]
    - [56, 3454.13]
  - - [512, 1024, 1, 64]
    - [4, 3728.27]
  - - [576, 1024, 1, 64]
    - [5, 4441.03]
  - - [640, 1024, 1, 64]
    - [55, 4660.34]
  - - [704, 1024, 1, 64]
    - [9, 4856.56]
  - - [768, 1024, 1, 64]
    - [3, 4575.6]
  - - [832, 1024, 1, 64]
    - [24, 4956.9]
  - - [896, 1024, 1, 64]
    - [4, 5592.41]
  - - [960, 1024, 1, 64]
    - [5, 5991.86]
  - - [1024, 1024, 1, 64]
    - [37, 6100.81]
  - - [128, 64, 1, 256]
    - [17, 349.525]
  - - [256, 64, 1, 256]
    - [17, 645.278]
  - - [384, 64, 1, 256]
    - [16, 967.916]
  - - [512, 64, 1, 256]
    - [24, 1118.48]
  - - [640, 64, 1, 256]
    - [17, 1613.19]
  - - [768, 64, 1, 256]
    - [16, 1935.83]
  - - [896, 64, 1, 256]
    - [23, 1957.34]
  - - [1024, 64, 1, 256]
    - [16, 2236.96]
  - - [64, 128, 1, 256]
    - [39, 322.639]
  - - [128, 128, 1, 256]
    - [44, 599.186]
  - - [192, 128, 1, 256]
    - [22, 898.779]
  - - [256, 128, 1, 256]
    - [18, 1290.56]
  - - [320, 128, 1, 256]
    - [11, 1497.97]
  - - [384, 128, 1, 256]
    - [23, 1572.86]
  - - [448, 128, 1, 256]
    - [23, 2097.15]
  - - [512, 128, 1, 256]
    - [17, 2396.75]
  - - [576, 128, 1, 256]
    - [18, 2903.75]
  - - [640, 128, 1, 256]
    - [19, 2796.2]
  - - [704, 128, 1, 256]
    - [10, 3295.52]
  - - [768, 128, 1, 256]
    - [15, 3355.44]
  - - [832, 128, 1, 256]
    - [22, 3407.87]
  - - [896, 128, 1, 256]
    - [15, 3914.68]
  - - [960, 128, 1, 256]
    - [23, 4194.3]
  - - [1024, 128, 1, 256]
    - [23, 4793.49]
  - - [128, 192, 1, 256]
    - [39, 967.916]
  - - [256, 192, 1, 256]
    - [10, 1935.83]
  - - [384, 192, 1, 256]
    - [11, 2696.34]
  - - [512, 192, 1, 256]
    - [10, 3355.44]
  - - [640, 192, 1, 256]
    - [11, 4194.3]
  - - [768, 192, 1, 256]
    - [23, 5033.16]
  - - [896, 192, 1, 256]
    - [10, 5505.02]
  - - [1024, 192, 1, 256]
    - [24, 6710.89]
  - - [64, 256, 1, 256]
    - [11, 599.186]
  - - [128, 256, 1, 256]
    - [23, 1118.48]
  - - [192, 256, 1, 256]
    - [15, 1797.56]
  - - [320, 256, 1, 256]
    - [15, 2995.93]
  - - [384, 256, 1, 256]
    - [54, 3355.44]
  - - [448, 256, 1, 256]
    - [22, 3914.68]
  - - [512, 256, 1, 256]
    - [27, 4793.49]
  - - [576, 256, 1, 256]
    - [10, 4718.59]
  - - [640, 256, 1, 256]
    - [42, 5991.86]
  - - [704, 256, 1, 256]
    - [41, 5767.17]
  - - [768, 256, 1, 256]
    - [24, 6291.46]
  - - [832, 256, 1, 256]
    - [23, 6815.74]
  - - [896, 256, 1, 256]
    - [23, 7829.37]
  - - [960, 256, 1, 256]
    - [23, 7401.71]
  - - [1024, 256, 1, 256]
    - [30, 8388.61]
  - - [128, 320, 1, 256]
    - [15, 1747.63]
  - - [256, 320, 1, 256]
    - [15, 2796.2]
  - - [384, 320, 1, 256]
    - [23, 4194.3]
  - - [512, 320, 1, 256]
    - [11, 5592.41]
  - - [640, 320, 1, 256]
    - [44, 6990.51]
  - - [768, 320, 1, 256]
    - [23, 7401.71]
  - - [896, 320, 1, 256]
    - [88, 8635.33]
  - - [1024, 320, 1, 256]
    - [49, 9320.68]
  - - [64, 384, 1, 256]
    - [15, 967.916]
  - - [128, 384, 1, 256]
    - [10, 1935.83]
  - - [192, 384, 1, 256]
    - [11, 2903.75]
  - - [256, 384, 1, 256]
    - [46, 3595.12]
  - - [320, 384, 1, 256]
    - [23, 4194.3]
  - - [384, 384, 1, 256]
    - [23, 5033.16]
  - - [448, 384, 1, 256]
    - [10, 5872.03]
  - - [512, 384, 1, 256]
    - [25, 6710.89]
  - - [576, 384, 1, 256]
    - [23, 7077.89]
  - - [640, 384, 1, 256]
    - [23, 7401.71]
  - - [704, 384, 1, 256]
    - [60, 7689.56]
  - - [768, 384, 1, 256]
    - [12, 8388.61]
  - - [832, 384, 1, 256]
    - [36, 9622.23]
  - - [896, 384, 1, 256]
    - [42, 9786.71]
  - - [960, 384, 1, 256]
    - [9, 10485.8]
  - - [1024, 384, 1, 256]
    - [42, 11184.8]
  - - [128, 448, 1, 256]
    - [10, 2097.15]
  - - [256, 448, 1, 256]
    - [11, 3914.68]
  - - [384, 448, 1, 256]
    - [10, 5872.03]
  - - [512, 448, 1, 256]
    - [29, 6908.27]
  - - [640, 448, 1, 256]
    - [24, 8635.33]
  - - [768, 448, 1, 256]
    - [55, 9271.62]
  - - [896, 448, 1, 256]
    - [26, 10816.9]
  - - [1024, 448, 1, 256]
    - [55, 11744.1]
  - - [64, 512, 1, 256]
    - [17, 1398.1]
  - - [128, 512, 1, 256]
    - [20, 2396.75]
  - - [192, 512, 1, 256]
    - [15, 3595.12]
  - - [256, 512, 1, 256]
    - [23, 4473.92]
  - - [320, 512, 1, 256]
    - [10, 5242.88]
  - - [384, 512, 1, 256]
    - [23, 6710.89]
  - - [448, 512, 1, 256]
    - [10, 6908.27]
  - - [512, 512, 1, 256]
    - [55, 7064.09]
  - - [576, 512, 1, 256]
    - [25, 7947.1]
  - - [640, 512, 1, 256]
    - [12, 10485.8]
  - - [704, 512, 1, 256]
    - [54, 9227.47]
  - - [768, 512, 1, 256]
    - [24, 10596.1]
  - - [832, 512, 1, 256]
    - [13, 10905.2]
  - - [896, 512, 1, 256]
    - [50, 12362.2]
  - - [128, 576, 1, 256]
    - [39, 2696.34]
  - - [256, 576, 1, 256]
    - [15, 5033.16]
  - - [384, 576, 1, 256]
    - [24, 7549.75]
  - - [512, 576, 1, 256]
    - [55, 8388.61]
  - - [640, 576, 1, 256]
    - [26, 10485.8]
  - - [768, 576, 1, 256]
    - [28, 11324.6]
  - - [64, 640, 1, 256]
    - [39, 1613.19]
  - - [128, 640, 1, 256]
    - [44, 2995.93]
  - - [192, 640, 1, 256]
    - [23, 3932.16]
  - - [256, 640, 1, 256]
    - [11, 5592.41]
  - - [320, 640, 1, 256]
    - [21, 6168.09]
  - - [384, 640, 1, 256]
    - [24, 7864.32]
  - - [448, 640, 1, 256]
    - [41, 9175.04]
  - - [512, 640, 1, 256]
    - [60, 10485.8]
  - - [576, 640, 1, 256]
    - [54, 9933.88]
  - - [640, 640, 1, 256]
    - [9, 10485.8]
  - - [704, 640, 1, 256]
    - [13, 12141.4]
  - - [128, 704, 1, 256]
    - [23, 3075.82]
  - - [256, 704, 1, 256]
    - [34, 5126.37]
  - - [384, 704, 1, 256]
    - [55, 8141.88]
  - - [512, 704, 1, 256]
    - [24, 10252.7]
  - - [640, 704, 1, 256]
    - [34, 12141.4]
  - - [64, 768, 1, 256]
    - [17, 1797.56]
  - - [128, 768, 1, 256]
    - [11, 3595.12]
  - - [192, 768, 1, 256]
    - [45, 5392.68]
  - - [256, 768, 1, 256]
    - [21, 6710.89]
  - - [320, 768, 1, 256]
    - [23, 7864.32]
  - - [384, 768, 1, 256]
    - [55, 7947.1]
  - - [448, 768, 1, 256]
    - [24, 9271.62]
  - - [512, 768, 1, 256]
    - [43, 11184.8]
  - - [576, 768, 1, 256]
    - [13, 11920.7]
  - - [128, 832, 1, 256]
    - [10, 3635.06]
  - - [256, 832, 1, 256]
    - [24, 6414.82]
  - - [384, 832, 1, 256]
    - [34, 10223.6]
  - - [512, 832, 1, 256]
    - [35, 11479.1]
  - - [64, 896, 1, 256]
    - [23, 2097.15]
  - - [128, 896, 1, 256]
    - [11, 4194.3]
  - - [192, 896, 1, 256]
    - [23, 5181.2]
  - - [256, 896, 1, 256]
    - [41, 7829.37]
  - - [320, 896, 1, 256]
    - [39, 7726.35]
  - - [384, 896, 1, 256]
    - [55, 8808.04]
  - - [448, 896, 1, 256]
    - [47, 10816.9]
  - - [512, 896, 1, 256]
    - [34, 13048.9]
  - - [128, 960, 1, 256]
    - [15, 4493.9]
  - - [256, 960, 1, 256]
    - [23, 7401.71]
  - - [384, 960, 1, 256]
    - [55, 10485.8]
  - - [64, 1024, 1, 256]
    - [11, 2581.11]
  - - [128, 1024, 1, 256]
    - [27, 4793.49]
  - - [192, 1024, 1, 256]
    - [21, 5921.37]
  - - [256, 1024, 1, 256]
    - [12, 7456.54]
  - - [320, 1024, 1, 256]
    - [46, 9320.68]
  - - [384, 1024, 1, 256]
    - [3, 9586.98]
  - - [448, 1024, 1, 256]
    - [3, 10212.2]
  - - [128, 64, 1, 512]
    - [62, 645.278]
  - - [256, 64, 1, 512]
    - [62, 1290.56]
  - - [384, 64, 1, 512]
    - [16, 1677.72]
  - - [512, 64, 1, 512]
    - [16, 2236.96]
  - - [640, 64, 1, 512]
    - [23, 2621.44]
  - - [768, 64, 1, 512]
    - [11, 3145.73]
  - - [896, 64, 1, 512]
    - [11, 3454.13]
  - - [1024, 64, 1, 512]
    - [11, 4194.3]
  - - [64, 128, 1, 512]
    - [10, 559.241]
  - - [128, 128, 1, 512]
    - [20, 1290.56]
  - - [192, 128, 1, 512]
    - [11, 1398.1]
  - - [256, 128, 1, 512]
    - [43, 2097.15]
  - - [320, 128, 1, 512]
    - [10, 3226.39]
  - - [384, 128, 1, 512]
    - [10, 3355.44]
  - - [448, 128, 1, 512]
    - [23, 3670.02]
  - - [512, 128, 1, 512]
    - [10, 4194.3]
  - - [576, 128, 1, 512]
    - [11, 5033.16]
  - - [640, 128, 1, 512]
    - [11, 5592.41]
  - - [704, 128, 1, 512]
    - [92, 5767.17]
  - - [768, 128, 1, 512]
    - [11, 5921.37]
  - - [832, 128, 1, 512]
    - [22, 6815.74]
  - - [896, 128, 1, 512]
    - [42, 6908.27]
  - - [960, 128, 1, 512]
    - [23, 6990.51]
  - - [1024, 128, 1, 512]
    - [11, 8388.61]
  - - [128, 192, 1, 512]
    - [18, 1935.83]
  - - [256, 192, 1, 512]
    - [10, 3355.44]
  - - [384, 192, 1, 512]
    - [11, 4718.59]
  - - [512, 192, 1, 512]
    - [10, 6291.46]
  - - [640, 192, 1, 512]
    - [10, 7401.71]
  - - [768, 192, 1, 512]
    - [23, 8882.06]
  - - [896, 192, 1, 512]
    - [10, 9271.62]
  - - [1024, 192, 1, 512]
    - [69, 11184.8]
  - - [64, 256, 1, 512]
    - [16, 1290.56]
  - - [128, 256, 1, 512]
    - [39, 2236.96]
  - - [192, 256, 1, 512]
    - [10, 3595.12]
  - - [256, 256, 1, 512]
    - [15, 4793.49]
  - - [320, 256, 1, 512]
    - [11, 5592.41]
  - - [384, 256, 1, 512]
    - [11, 5921.37]
  - - [448, 256, 1, 512]
    - [11, 6908.27]
  - - [512, 256, 1, 512]
    - [23, 8388.61]
  - - [576, 256, 1, 512]
    - [11, 8388.61]
  - - [640, 256, 1, 512]
    - [26, 9868.95]
  - - [704, 256, 1, 512]
    - [44, 8788.07]
  - - [768, 256, 1, 512]
    - [24, 11184.8]
  - - [832, 256, 1, 512]
    - [23, 12116.9]
  - - [896, 256, 1, 512]
    - [24, 13048.9]
  - - [128, 320, 1, 512]
    - [62, 3226.39]
  - - [256, 320, 1, 512]
    - [11, 5242.88]
  - - [384, 320, 1, 512]
    - [21, 7864.32]
  - - [512, 320, 1, 512]
    - [23, 9868.95]
  - - [640, 320, 1, 512]
    - [41, 12336.2]
  - - [64, 384, 1, 512]
    - [39, 1677.72]
  - - [128, 384, 1, 512]
    - [10, 3595.12]
  - - [192, 384, 1, 512]
    - [23, 4718.59]
  - - [256, 384, 1, 512]
    - [23, 6291.46]
  - - [320, 384, 1, 512]
    - [23, 6990.51]
  - - [384, 384, 1, 512]
    - [23, 8882.06]
  - - [448, 384, 1, 512]
    - [10, 10362.4]
  - - [512, 384, 1, 512]
    - [23, 10066.3]
  - - [576, 384, 1, 512]
    - [24, 12582.9]
  - - [128, 448, 1, 512]
    - [23, 3914.68]
  - - [256, 448, 1, 512]
    - [10, 6908.27]
  - - [384, 448, 1, 512]
    - [27, 9786.71]
  - - [512, 448, 1, 512]
    - [23, 12362.2]
  - - [64, 512, 1, 512]
    - [10, 2236.96]
  - - [128, 512, 1, 512]
    - [11, 4473.92]
  - - [192, 512, 1, 512]
    - [10, 5921.37]
  - - [256, 512, 1, 512]
    - [23, 7456.54]
  - - [320, 512, 1, 512]
    - [11, 10485.8]
  - - [384, 512, 1, 512]
    - [27, 11842.7]
  - - [448, 512, 1, 512]
    - [41, 12362.2]
  - - [128, 576, 1, 512]
    - [19, 5392.68]
  - - [256, 576, 1, 512]
    - [11, 8882.06]
  - - [384, 576, 1, 512]
    - [55, 11324.6]
  - - [64, 640, 1, 512]
    - [18, 2995.93]
  - - [128, 640, 1, 512]
    - [10, 5242.88]
  - - [192, 640, 1, 512]
    - [11, 7864.32]
  - - [256, 640, 1, 512]
    - [11, 10485.8]
  - - [320, 640, 1, 512]
    - [23, 11037.6]
  - - [128, 704, 1, 512]
    - [22, 5427.92]
  - - [256, 704, 1, 512]
    - [42, 10252.7]
  - - [64, 768, 1, 512]
    - [10, 3595.12]
  - - [128, 768, 1, 512]
    - [10, 6291.46]
  - - [192, 768, 1, 512]
    - [24, 9437.18]
  - - [256, 768, 1, 512]
    - [32, 9586.98]
  - - [128, 832, 1, 512]
    - [39, 6414.82]
  - - [256, 832, 1, 512]
    - [23, 12116.9]
  - - [64, 896, 1, 512]
    - [10, 4194.3]
  - - [128, 896, 1, 512]
    - [22, 6908.27]
  - - [192, 896, 1, 512]
    - [10, 9271.62]
  - - [256, 896, 1, 512]
    - [46, 11744.1]
  - - [128, 960, 1, 512]
    - [11, 7864.32]
  - - [64, 1024, 1, 512]
    - [23, 4194.3]
  - - [128, 1024, 1, 512]
    - [11, 7895.16]
  - - [192, 1024, 1, 512]
    - [23, 10066.3]
  - - [128, 64, 1, 1024]
    - [16, 1118.48]
  - - [256, 64, 1, 1024]
    - [62, 2236.96]
  - - [384, 64, 1, 1024]
    - [86, 2960.69]
  - - [512, 64, 1, 1024]
    - [62, 4194.3]
  - - [640, 64, 1, 1024]
    - [16, 4660.34]
  - - [768, 64, 1, 1024]
    - [11, 5033.16]
  - - [896, 64, 1, 1024]
    - [10, 5338.21]
  - - [1024, 64, 1, 1024]
    - [40, 6391.32]
  - - [64, 128, 1, 1024]
    - [39, 932.068]
  - - [128, 128, 1, 1024]
    - [62, 2396.75]
  - - [192, 128, 1, 1024]
    - [114, 2960.69]
  - - [256, 128, 1, 1024]
    - [118, 4473.92]
  - - [320, 128, 1, 1024]
    - [64, 4934.48]
  - - [384, 128, 1, 1024]
    - [16, 5921.37]
  - - [448, 128, 1, 1024]
    - [64, 6181.08]
  - - [512, 128, 1, 1024]
    - [39, 6100.81]
  - - [576, 128, 1, 1024]
    - [107, 7549.75]
  - - [640, 128, 1, 1024]
    - [40, 8830.11]
  - - [704, 128, 1, 1024]
    - [10, 8788.07]
  - - [768, 128, 1, 1024]
    - [66, 9151.21]
  - - [832, 128, 1, 1024]
    - [15, 9482.77]
  - - [896, 128, 1, 1024]
    - [40, 9033.89]
  - - [128, 192, 1, 1024]
    - [19, 3355.44]
  - - [256, 192, 1, 1024]
    - [10, 5921.37]
  - - [384, 192, 1, 1024]
    - [27, 6565.0]
  - - [512, 192, 1, 1024]
    - [10, 9586.98]
  - - [64, 256, 1, 1024]
    - [62, 2396.75]
  - - [128, 256, 1, 1024]
    - [62, 4194.3]
  - - [192, 256, 1, 1024]
    - [17, 5921.37]
  - - [256, 256, 1, 1024]
    - [18, 7895.16]
  - - [320, 256, 1, 1024]
    - [11, 9320.68]
  - - [384, 256, 1, 1024]
    - [11, 9586.98]
  - - [448, 256, 1, 1024]
    - [11, 11744.1]
  - - [128, 320, 1, 1024]
    - [40, 5242.88]
  - - [256, 320, 1, 1024]
    - [23, 8388.61]
  - - [64, 384, 1, 1024]
    - [18, 3595.12]
  - - [128, 384, 1, 1024]
    - [10, 5921.37]
  - - [192, 384, 1, 1024]
    - [18, 8882.06]
  - - [256, 384, 1, 1024]
    - [10, 10596.1]
  - - [128, 448, 1, 1024]
    - [10, 7340.03]
  - - [256, 448, 1, 1024]
    - [42, 11744.1]
  - - [64, 512, 1, 1024]
    - [39, 3532.05]
  - - [128, 512, 1, 1024]
    - [44, 7064.09]
  - - [192, 512, 1, 1024]
    - [26, 10596.1]
  - - [128, 576, 1, 1024]
    - [11, 8388.61]
  - - [64, 640, 1, 1024]
    - [109, 5242.88]
  - - [128, 640, 1, 1024]
    - [40, 9320.68]
  - - [128, 704, 1, 1024]
    - [11, 9713.13]
  - - [64, 768, 1, 1024]
    - [39, 5298.07]
  - - [128, 768, 1, 1024]
    - [10, 10066.3]
  - - [128, 832, 1, 1024]
    - [23, 10385.9]
  - - [64, 896, 1, 1024]
    - [10, 7340.03]
  - - [128, 896, 1, 1024]
    - [10, 9395.24]
  - - [64, 1024, 1, 1024]
    - [11, 7895.16]
  - - [128, 64, 1, 2048]
    - [62, 1973.79]
  - - [256, 64, 1, 2048]
    - [62, 3728.27]
  - - [384, 64, 1, 2048]
    - [19, 5298.07]
  - - [512, 64, 1, 2048]
    - [16, 6391.32]
  - - [640, 64, 1, 2048]
    - [16, 7626.01]
  - - [768, 64, 1, 2048]
    - [16, 7743.33]
  - - [896, 64, 1, 2048]
    - [16, 8699.3]
  - - [64, 128, 1, 2048]
    - [16, 1864.14]
  - - [128, 128, 1, 2048]
    - [62, 4194.3]
  - - [192, 128, 1, 2048]
    - [19, 5298.07]
  - - [256, 128, 1, 2048]
    - [19, 7456.54]
  - - [320, 128, 1, 2048]
    - [40, 8830.11]
  - - [384, 128, 1, 2048]
    - [10, 9151.21]
  - - [448, 128, 1, 2048]
    - [23, 9033.89]
  - - [128, 192, 1, 2048]
    - [19, 5592.41]
  - - [256, 192, 1, 2048]
    - [10, 9151.21]
  - - [64, 256, 1, 2048]
    - [62, 4194.3]
  - - [128, 256, 1, 2048]
    - [19, 7456.54]
  - - [192, 256, 1, 2048]
    - [10, 9151.21]
  - - [128, 320, 1, 2048]
    - [19, 9320.68]
  - - [64, 384, 1, 2048]
    - [63, 5921.37]
  - - [128, 384, 1, 2048]
    - [94, 8753.33]
  - - [128, 448, 1, 2048]
    - [10, 10676.4]
  - - [64, 512, 1, 2048]
    - [19, 7456.54]
  - - [64, 640, 1, 2048]
    - [20, 8830.11]
  - - [64, 768, 1, 2048]
    - [10, 9586.98]
  - - [64, 896, 1, 2048]
    - [10, 10676.4]
  - - [128, 64, 1, 4096]
    - [62, 3050.4]
  - - [256, 64, 1, 4096]
    - [62, 5835.55]
  - - [384, 64, 1, 4096]
    - [93, 7456.54]
  - - [64, 128, 1, 4096]
    - [118, 3195.66]
  - - [128, 128, 1, 4096]
    - [62, 6391.32]
  - - [192, 128, 1, 4096]
    - [19, 8753.33]
  - - [128, 192, 1, 4096]
    - [63, 8753.33]
  - - [64, 256, 1, 4096]
    - [62, 6710.89]
  - - [64, 384, 1, 4096]
    - [19, 8388.61]
  - - [1, 1, 1, 1]
    - [16, 0.000142857]
  - - [2, 2, 1, 2]
    - [16, 0.00145455]
  - - [4, 2, 1, 2]
    - [17, 0.00266667]
  - - [6, 2, 1, 2]
    - [17, 0.00436364]
  - - [8, 2, 1, 2]
    - [11, 0.00457143]
  - - [10, 2, 1, 2]
    - [15, 0.00571429]
  - - [12, 2, 1, 2]
    - [39, 0.00738462]
  - - [14, 2, 1, 2]
    - [17, 0.00861538]
  - - [16, 2, 1, 2]
    - [16, 0.0106667]
  - - [2, 4, 1, 2]
    - [16, 0.00246154]
  - - [4, 4, 1, 2]
    - [16, 0.00492308]
  - - [6, 4, 1, 2]
    - [17, 0.008]
  - - [8, 4, 1, 2]
    - [39, 0.0106667]
  - - [10, 4, 1, 2]
    - [39, 0.0133333]
  - - [12, 4, 1, 2]
    - [17, 0.0147692]
  - - [14, 4, 1, 2]
    - [16, 0.0186667]
  - - [16, 4, 1, 2]
    - [23, 0.0196923]
  - - [2, 6, 1, 2]
    - [39, 0.004]
  - - [4, 6, 1, 2]
    - [39, 0.008]
  - - [6, 6, 1, 2]
    - [23, 0.0102857]
  - - [8, 6, 1, 2]
    - [16, 0.0147692]
  - - [10, 6, 1, 2]
    - [15, 0.02]
  - - [12, 6, 1, 2]
    - [62, 0.0221538]
  - - [14, 6, 1, 2]
    - [17, 0.0258462]
  - - [16, 6, 1, 2]
    - [15, 0.032]
  - - [2, 8, 1, 2]
    - [15, 0.00492308]
  - - [4, 8, 1, 2]
    - [17, 0.00984615]
  - - [6, 8, 1, 2]
    - [21, 0.016]
  - - [8, 8, 1, 2]
    - [18, 0.0196923]
  - - [10, 8, 1, 2]
    - [15, 0.0266667]
  - - [12, 8, 1, 2]
    - [17, 0.0295385]
  - - [14, 8, 1, 2]
    - [39, 0.032]
  - - [16, 8, 1, 2]
    - [17, 0.0393846]
  - - [2, 10, 1, 2]
    - [22, 0.00615385]
  - - [4, 10, 1, 2]
    - [15, 0.0114286]
  - - [6, 10, 1, 2]
    - [39, 0.0184615]
  - - [8, 10, 1, 2]
    - [63, 0.0246154]
  - - [10, 10, 1, 2]
    - [16, 0.0363636]
  - - [12, 10, 1, 2]
    - [39, 0.0369231]
  - - [14, 10, 1, 2]
    - [10, 0.0430769]
  - - [16, 10, 1, 2]
    - [17, 0.0492308]
  - - [2, 12, 1, 2]
    - [17, 0.00738462]
  - - [4, 12, 1, 2]
    - [10, 0.016]
  - - [6, 12, 1, 2]
    - [11, 0.0221538]
  - - [8, 12, 1, 2]
    - [39, 0.0349091]
  - - [10, 12, 1, 2]
    - [17, 0.0369231]
  - - [12, 12, 1, 2]
    - [39, 0.0443077]
  - - [14, 12, 1, 2]
    - [15, 0.056]
  - - [16, 12, 1, 2]
    - [39, 0.064]
  - - [2, 14, 1, 2]
    - [15, 0.00933333]
  - - [4, 14, 1, 2]
    - [115, 0.0172308]
  - - [6, 14, 1, 2]
    - [40, 0.028]
  - - [8, 14, 1, 2]
    - [15, 0.0373333]
  - - [10, 14, 1, 2]
    - [16, 0.0466667]
  - - [12, 14, 1, 2]
    - [23, 0.048]
  - - [14, 14, 1, 2]
    - [39, 0.0603077]
  - - [16, 14, 1, 2]
    - [15, 0.0746667]
  - - [2, 16, 1, 2]
    - [102, 0.00984615]
  - - [4, 16, 1, 2]
    - [17, 0.0196923]
  - - [6, 16, 1, 2]
    - [16, 0.0295385]
  - - [8, 16, 1, 2]
    - [110, 0.0393846]
  - - [10, 16, 1, 2]
    - [39, 0.0533333]
  - - [12, 16, 1, 2]
    - [16, 0.064]
  - - [14, 16, 1, 2]
    - [17, 0.0746667]
  - - [16, 16, 1, 2]
    - [23, 0.0787692]
  - - [2, 2, 1, 4]
    - [16, 0.00246154]
  - - [4, 2, 1, 4]
    - [39, 0.00457143]
  - - [6, 2, 1, 4]
    - [18, 0.00738462]
  - - [8, 2, 1, 4]
    - [15, 0.0106667]
  - - [10, 2, 1, 4]
    - [17, 0.0123077]
  - - [12, 2, 1, 4]
    - [10, 0.016]
  - - [14, 2, 1, 4]
    - [39, 0.0172308]
  - - [16, 2, 1, 4]
    - [15, 0.0182857]
  - - [2, 4, 1, 4]
    - [10, 0.00533333]
  - - [4, 4, 1, 4]
    - [11, 0.00914286]
  - - [6, 4, 1, 4]
    - [10, 0.016]
  - - [8, 4, 1, 4]
    - [18, 0.0196923]
  - - [10, 4, 1, 4]
    - [22, 0.0246154]
  - - [12, 4, 1, 4]
    - [17, 0.0295385]
  - - [14, 4, 1, 4]
    - [62, 0.0373333]
  - - [16, 4, 1, 4]
    - [97, 0.0393846]
  - - [2, 6, 1, 4]
    - [16, 0.00738462]
  - - [4, 6, 1, 4]
    - [10, 0.0147692]
  - - [6, 6, 1, 4]
    - [15, 0.0221538]
  - - [8, 6, 1, 4]
    - [17, 0.0295385]
  - - [10, 6, 1, 4]
    - [17, 0.04]
  - - [12, 6, 1, 4]
    - [16, 0.0523636]
  - - [14, 6, 1, 4]
    - [17, 0.0516923]
  - - [16, 6, 1, 4]
    - [39, 0.0590769]
  - - [2, 8, 1, 4]
    - [20, 0.0106667]
  - - [4, 8, 1, 4]
    - [16, 0.0196923]
  - - [6, 8, 1, 4]
    - [39, 0.0295385]
  - - [8, 8, 1, 4]
    - [15, 0.0393846]
  - - [10, 8, 1, 4]
    - [16, 0.0492308]
  - - [12, 8, 1, 4]
    - [15, 0.064]
  - - [14, 8, 1, 4]
    - [17, 0.0746667]
  - - [16, 8, 1, 4]
    - [39, 0.0787692]
  - - [2, 10, 1, 4]
    - [39, 0.0123077]
  - - [4, 10, 1, 4]
    - [17, 0.0246154]
  - - [6, 10, 1, 4]
    - [17, 0.0369231]
  - - [8, 10, 1, 4]
    - [23, 0.0457143]
  - - [10, 10, 1, 4]
    - [39, 0.0615385]
  - - [12, 10, 1, 4]
    - [10, 0.08]
  - - [14, 10, 1, 4]
    - [39, 0.0861538]
  - - [16, 10, 1, 4]
    - [16, 0.106667]
  - - [2, 12, 1, 4]
    - [23, 0.0137143]
  - - [4, 12, 1, 4]
    - [15, 0.0295385]
  - - [6, 12, 1, 4]
    - [17, 0.048]
  - - [8, 12, 1, 4]
    - [16, 0.0590769]
  - - [10, 12, 1, 4]
    - [10, 0.08]
  - - [12, 12, 1, 4]
    - [10, 0.0886154]
  - - [14, 12, 1, 4]
    - [16, 0.112]
  - - [16, 12, 1, 4]
    - [16, 0.128]
  - - [2, 14, 1, 4]
    - [23, 0.016]
  - - [4, 14, 1, 4]
    - [16, 0.0373333]
  - - [6, 14, 1, 4]
    - [17, 0.0516923]
  - - [8, 14, 1, 4]
    - [10, 0.0746667]
  - - [10, 14, 1, 4]
    - [23, 0.08]
  - - [12, 14, 1, 4]
    - [39, 0.122182]
  - - [14, 14, 1, 4]
    - [39, 0.130667]
  - - [16, 14, 1, 4]
    - [19, 0.128]
  - - [2, 16, 1, 4]
    - [39, 0.0196923]
  - - [4, 16, 1, 4]
    - [39, 0.0426667]
  - - [6, 16, 1, 4]
    - [15, 0.064]
  - - [8, 16, 1, 4]
    - [23, 0.0731429]
  - - [10, 16, 1, 4]
    - [16, 0.0984615]
  - - [12, 16, 1, 4]
    - [17, 0.118154]
  - - [14, 16, 1, 4]
    - [39, 0.149333]
  - - [16, 16, 1, 4]
    - [15, 0.157538]
  - - [2, 2, 1, 6]
    - [112, 0.00369231]
  - - [4, 2, 1, 6]
    - [17, 0.008]
  - - [6, 2, 1, 6]
    - [15, 0.0110769]
  - - [8, 2, 1, 6]
    - [23, 0.0137143]
  - - [10, 2, 1, 6]
    - [39, 0.0184615]
  - - [12, 2, 1, 6]
    - [11, 0.024]
  - - [14, 2, 1, 6]
    - [18, 0.0258462]
  - - [16, 2, 1, 6]
    - [39, 0.032]
  - - [2, 4, 1, 6]
    - [39, 0.00738462]
  - - [4, 4, 1, 6]
    - [15, 0.016]
  - - [6, 4, 1, 6]
    - [17, 0.0221538]
  - - [8, 4, 1, 6]
    - [102, 0.032]
  - - [10, 4, 1, 6]
    - [39, 0.0369231]
  - - [12, 4, 1, 6]
    - [39, 0.0443077]
  - - [14, 4, 1, 6]
    - [16, 0.0516923]
  - - [16, 4, 1, 6]
    - [17, 0.064]
  - - [2, 6, 1, 6]
    - [63, 0.0110769]
  - - [4, 6, 1, 6]
    - [10, 0.024]
  - - [6, 6, 1, 6]
    - [39, 0.036]
  - - [8, 6, 1, 6]
    - [16, 0.048]
  - - [10, 6, 1, 6]
    - [10, 0.0553846]
  - - [12, 6, 1, 6]
    - [39, 0.0664615]
  - - [14, 6, 1, 6]
    - [63, 0.084]
  - - [16, 6, 1, 6]
    - [11, 0.0886154]
  - - [2, 8, 1, 6]
    - [23, 0.0137143]
  - - [4, 8, 1, 6]
    - [40, 0.0295385]
  - - [6, 8, 1, 6]
    - [39, 0.0443077]
  - - [8, 8, 1, 6]
    - [39, 0.0590769]
  - - [10, 8, 1, 6]
    - [16, 0.0738462]
  - - [12, 8, 1, 6]
    - [17, 0.0886154]
  - - [14, 8, 1, 6]
    - [17, 0.112]
  - - [16, 8, 1, 6]
    - [15, 0.118154]
  - - [2, 10, 1, 6]
    - [16, 0.0184615]
  - - [4, 10, 1, 6]
    - [10, 0.0369231]
  - - [6, 10, 1, 6]
    - [16, 0.06]
  - - [8, 10, 1, 6]
    - [118, 0.0738462]
  - - [10, 10, 1, 6]
    - [11, 0.0857143]
  - - [12, 10, 1, 6]
    - [17, 0.110769]
  - - [14, 10, 1, 6]
    - [18, 0.14]
  - - [16, 10, 1, 6]
    - [19, 0.137143]
  - - [2, 12, 1, 6]
    - [17, 0.024]
  - - [4, 12, 1, 6]
    - [17, 0.0443077]
  - - [6, 12, 1, 6]
    - [39, 0.0664615]
  - - [8, 12, 1, 6]
    - [15, 0.096]
  - - [10, 12, 1, 6]
    - [39, 0.110769]
  - - [12, 12, 1, 6]
    - [10, 0.132923]
  - - [14, 12, 1, 6]
    - [79, 0.168]
  - - [16, 12, 1, 6]
    - [41, 0.177231]
  - - [2, 14, 1, 6]
    - [17, 0.0258462]
  - - [4, 14, 1, 6]
    - [17, 0.0516923]
  - - [6, 14, 1, 6]
    - [17, 0.084]
  - - [8, 14, 1, 6]
    - [39, 0.103385]
  - - [10, 14, 1, 6]
    - [39, 0.129231]
  - - [12, 14, 1, 6]
    - [39, 0.168]
  - - [14, 14, 1, 6]
    - [17, 0.196]
  - - [16, 14, 1, 6]
    - [17, 0.206769]
  - - [2, 16, 1, 6]
    - [11, 0.0274286]
  - - [4, 16, 1, 6]
    - [97, 0.0451765]
  - - [6, 16, 1, 6]
    - [11, 0.0886154]
  - - [8, 16, 1, 6]
    - [10, 0.118154]
  - - [10, 16, 1, 6]
    - [16, 0.16]
  - - [12, 16, 1, 6]
    - [44, 0.192]
  - - [14, 16, 1, 6]
    - [16, 0.206769]
  - - [16, 16, 1, 6]
    - [39, 0.236308]
  - - [2, 2, 1, 8]
    - [15, 0.00492308]
  - - [4, 2, 1, 8]
    - [17, 0.00914286]
  - - [6, 2, 1, 8]
    - [16, 0.0174545]
  - - [8, 2, 1, 8]
    - [17, 0.0213333]
  - - [10, 2, 1, 8]
    - [16, 0.0266667]
  - - [12, 2, 1, 8]
    - [16, 0.0295385]
  - - [14, 2, 1, 8]
    - [15, 0.0373333]
  - - [16, 2, 1, 8]
    - [64, 0.0393846]
  - - [2, 4, 1, 8]
    - [17, 0.0106667]
  - - [4, 4, 1, 8]
    - [17, 0.0232727]
  - - [6, 4, 1, 8]
    - [10, 0.032]
  - - [8, 4, 1, 8]
    - [17, 0.0465455]
  - - [10, 4, 1, 8]
    - [17, 0.0492308]
  - - [12, 4, 1, 8]
    - [17, 0.0698182]
  - - [14, 4, 1, 8]
    - [16, 0.0689231]
  - - [16, 4, 1, 8]
    - [10, 0.0787692]
  - - [2, 6, 1, 8]
    - [15, 0.016]
  - - [4, 6, 1, 8]
    - [39, 0.0295385]
  - - [6, 6, 1, 8]
    - [15, 0.0443077]
  - - [8, 6, 1, 8]
    - [15, 0.0590769]
  - - [10, 6, 1, 8]
    - [13, 0.0685714]
  - - [12, 6, 1, 8]
    - [20, 0.0886154]
  - - [14, 6, 1, 8]
    - [17, 0.103385]
  - - [16, 6, 1, 8]
    - [20, 0.118154]
  - - [2, 8, 1, 8]
    - [17, 0.0213333]
  - - [4, 8, 1, 8]
    - [20, 0.0426667]
  - - [6, 8, 1, 8]
    - [39, 0.064]
  - - [8, 8, 1, 8]
    - [39, 0.0853333]
  - - [10, 8, 1, 8]
    - [17, 0.116364]
  - - [12, 8, 1, 8]
    - [64, 0.128]
  - - [14, 8, 1, 8]
    - [16, 0.149333]
  - - [16, 8, 1, 8]
    - [10, 0.157538]
  - - [2, 10, 1, 8]
    - [16, 0.0246154]
  - - [4, 10, 1, 8]
    - [10, 0.0492308]
  - - [6, 10, 1, 8]
    - [15, 0.0738462]
  - - [8, 10, 1, 8]
    - [17, 0.116364]
  - - [10, 10, 1, 8]
    - [16, 0.133333]
  - - [12, 10, 1, 8]
    - [17, 0.147692]
  - - [14, 10, 1, 8]
    - [39, 0.186667]
  - - [16, 10, 1, 8]
    - [39, 0.196923]
  - - [2, 12, 1, 8]
    - [23, 0.0295385]
  - - [4, 12, 1, 8]
    - [17, 0.064]
  - - [6, 12, 1, 8]
    - [10, 0.0886154]
  - - [8, 12, 1, 8]
    - [17, 0.128]
  - - [10, 12, 1, 8]
    - [39, 0.137143]
  - - [12, 12, 1, 8]
    - [16, 0.177231]
  - - [14, 12, 1, 8]
    - [15, 0.206769]
  - - [16, 12, 1, 8]
    - [17, 0.256]
  - - [2, 14, 1, 8]
    - [97, 0.0344615]
  - - [4, 14, 1, 8]
    - [62, 0.0814545]
  - - [6, 14, 1, 8]
    - [17, 0.112]
  - - [8, 14, 1, 8]
    - [17, 0.137846]
  - - [10, 14, 1, 8]
    - [17, 0.172308]
  - - [12, 14, 1, 8]
    - [39, 0.206769]
  - - [14, 14, 1, 8]
    - [39, 0.241231]
  - - [16, 14, 1, 8]
    - [62, 0.298667]
  - - [2, 16, 1, 8]
    - [16, 0.0426667]
  - - [4, 16, 1, 8]
    - [16, 0.0853333]
  - - [6, 16, 1, 8]
    - [39, 0.118154]
  - - [8, 16, 1, 8]
    - [39, 0.157538]
  - - [10, 16, 1, 8]
    - [15, 0.196923]
  - - [12, 16, 1, 8]
    - [17, 0.236308]
  - - [14, 16, 1, 8]
    - [39, 0.256]
  - - [16, 16, 1, 8]
    - [17, 0.372364]
  - - [2, 2, 1, 10]
    - [16, 0.00615385]
  - - [4, 2, 1, 10]
    - [17, 0.0133333]
  - - [6, 2, 1, 10]
    - [17, 0.0184615]
  - - [8, 2, 1, 10]
    - [15, 0.0246154]
  - - [10, 2, 1, 10]
    - [17, 0.0307692]
  - - [12, 2, 1, 10]
    - [15, 0.04]
  - - [14, 2, 1, 10]
    - [15, 0.0430769]
  - - [16, 2, 1, 10]
    - [39, 0.0533333]
  - - [2, 4, 1, 10]
    - [39, 0.0133333]
  - - [4, 4, 1, 10]
    - [39, 0.0266667]
  - - [6, 4, 1, 10]
    - [23, 0.0342857]
  - - [8, 4, 1, 10]
    - [15, 0.0533333]
  - - [10, 4, 1, 10]
    - [10, 0.0615385]
  - - [12, 4, 1, 10]
    - [16, 0.0738462]
  - - [14, 4, 1, 10]
    - [39, 0.0861538]
  - - [16, 4, 1, 10]
    - [17, 0.0914286]
  - - [2, 6, 1, 10]
    - [16, 0.02]
  - - [4, 6, 1, 10]
    - [10, 0.0369231]
  - - [6, 6, 1, 10]
    - [15, 0.06]
  - - [8, 6, 1, 10]
    - [16, 0.08]
  - - [10, 6, 1, 10]
    - [44, 0.1]
  - - [12, 6, 1, 10]
    - [47, 0.110769]
  - - [14, 6, 1, 10]
    - [39, 0.14]
  - - [16, 6, 1, 10]
    - [39, 0.147692]
  - - [2, 8, 1, 10]
    - [16, 0.0266667]
  - - [4, 8, 1, 10]
    - [15, 0.0492308]
  - - [6, 8, 1, 10]
    - [16, 0.08]
  - - [8, 8, 1, 10]
    - [23, 0.0984615]
  - - [10, 8, 1, 10]
    - [39, 0.123077]
  - - [12, 8, 1, 10]
    - [16, 0.16]
  - - [14, 8, 1, 10]
    - [10, 0.172308]
  - - [16, 8, 1, 10]
    - [17, 0.182857]
  - - [2, 10, 1, 10]
    - [10, 0.0333333]
  - - [4, 10, 1, 10]
    - [17, 0.0727273]
  - - [6, 10, 1, 10]
    - [39, 0.0923077]
  - - [8, 10, 1, 10]
    - [39, 0.123077]
  - - [10, 10, 1, 10]
    - [39, 0.153846]
  - - [12, 10, 1, 10]
    - [23, 0.184615]
  - - [14, 10, 1, 10]
    - [16, 0.233333]
  - - [16, 10, 1, 10]
    - [15, 0.246154]
  - - [2, 12, 1, 10]
    - [17, 0.0436364]
  - - [4, 12, 1, 10]
    - [39, 0.08]
  - - [6, 12, 1, 10]
    - [39, 0.110769]
  - - [8, 12, 1, 10]
    - [107, 0.137143]
  - - [10, 12, 1, 10]
    - [17, 0.218182]
  - - [12, 12, 1, 10]
    - [18, 0.221538]
  - - [14, 12, 1, 10]
    - [39, 0.258462]
  - - [16, 12, 1, 10]
    - [16, 0.295385]
  - - [2, 14, 1, 10]
    - [17, 0.0466667]
  - - [4, 14, 1, 10]
    - [23, 0.0861538]
  - - [6, 14, 1, 10]
    - [16, 0.129231]
  - - [8, 14, 1, 10]
    - [17, 0.203636]
  - - [10, 14, 1, 10]
    - [15, 0.215385]
  - - [12, 14, 1, 10]
    - [39, 0.258462]
  - - [14, 14, 1, 10]
    - [22, 0.301538]
  - - [16, 14, 1, 10]
    - [39, 0.32]
  - - [2, 16, 1, 10]
    - [16, 0.0492308]
  - - [4, 16, 1, 10]
    - [8, 0.0752941]
  - - [6, 16, 1, 10]
    - [17, 0.16]
  - - [8, 16, 1, 10]
    - [16, 0.232727]
  - - [10, 16, 1, 10]
    - [11, 0.246154]
  - - [12, 16, 1, 10]
    - [39, 0.32]
  - - [14, 16, 1, 10]
    - [39, 0.32]
  - - [16, 16, 1, 10]
    - [17, 0.393846]
  - - [2, 2, 1, 12]
    - [16, 0.00872727]
  - - [4, 2, 1, 12]
    - [16, 0.016]
  - - [6, 2, 1, 12]
    - [39, 0.0221538]
  - - [8, 2, 1, 12]
    - [15, 0.0295385]
  - - [10, 2, 1, 12]
    - [17, 0.0369231]
  - - [12, 2, 1, 12]
    - [11, 0.0443077]
  - - [14, 2, 1, 12]
    - [17, 0.0516923]
  - - [16, 2, 1, 12]
    - [39, 0.064]
  - - [2, 4, 1, 12]
    - [23, 0.0147692]
  - - [4, 4, 1, 12]
    - [17, 0.0295385]
  - - [6, 4, 1, 12]
    - [16, 0.0443077]
  - - [8, 4, 1, 12]
    - [39, 0.0590769]
  - - [10, 4, 1, 12]
    - [16, 0.08]
  - - [12, 4, 1, 12]
    - [16, 0.096]
  - - [14, 4, 1, 12]
    - [16, 0.112]
  - - [16, 4, 1, 12]
    - [10, 0.128]
  - - [2, 6, 1, 12]
    - [39, 0.0205714]
  - - [4, 6, 1, 12]
    - [17, 0.048]
  - - [6, 6, 1, 12]
    - [39, 0.0664615]
  - - [8, 6, 1, 12]
    - [15, 0.0886154]
  - - [10, 6, 1, 12]
    - [9, 0.0847059]
  - - [12, 6, 1, 12]
    - [17, 0.144]
  - - [14, 6, 1, 12]
    - [15, 0.168]
  - - [16, 6, 1, 12]
    - [17, 0.192]
  - - [2, 8, 1, 12]
    - [11, 0.032]
  - - [4, 8, 1, 12]
    - [17, 0.0590769]
  - - [6, 8, 1, 12]
    - [16, 0.104727]
  - - [8, 8, 1, 12]
    - [11, 0.118154]
  - - [10, 8, 1, 12]
    - [10, 0.147692]
  - - [12, 8, 1, 12]
    - [22, 0.177231]
  - - [14, 8, 1, 12]
    - [27, 0.192]
  - - [16, 8, 1, 12]
    - [17, 0.236308]
  - - [2, 10, 1, 12]
    - [15, 0.0369231]
  - - [4, 10, 1, 12]
    - [15, 0.0685714]
  - - [6, 10, 1, 12]
    - [39, 0.110769]
  - - [8, 10, 1, 12]
    - [17, 0.16]
  - - [10, 10, 1, 12]
    - [16, 0.184615]
  - - [12, 10, 1, 12]
    - [16, 0.221538]
  - - [14, 10, 1, 12]
    - [39, 0.258462]
  - - [16, 10, 1, 12]
    - [16, 0.32]
  - - [2, 12, 1, 12]
    - [39, 0.0443077]
  - - [4, 12, 1, 12]
    - [17, 0.096]
  - - [6, 12, 1, 12]
    - [15, 0.144]
  - - [8, 12, 1, 12]
    - [17, 0.192]
  - - [10, 12, 1, 12]
    - [17, 0.221538]
  - - [12, 12, 1, 12]
    - [11, 0.265846]
  - - [14, 12, 1, 12]
    - [39, 0.310154]
  - - [16, 12, 1, 12]
    - [39, 0.354462]
  - - [2, 14, 1, 12]
    - [93, 0.0516923]
  - - [4, 14, 1, 12]
    - [63, 0.112]
  - - [6, 14, 1, 12]
    - [16, 0.168]
  - - [8, 14, 1, 12]
    - [10, 0.206769]
  - - [10, 14, 1, 12]
    - [10, 0.258462]
  - - [12, 14, 1, 12]
    - [39, 0.288]
  - - [14, 14, 1, 12]
    - [39, 0.361846]
  - - [16, 14, 1, 12]
    - [15, 0.413538]
  - - [2, 16, 1, 12]
    - [21, 0.0698182]
  - - [4, 16, 1, 12]
    - [39, 0.118154]
  - - [6, 16, 1, 12]
    - [15, 0.177231]
  - - [8, 16, 1, 12]
    - [40, 0.256]
  - - [10, 16, 1, 12]
    - [16, 0.295385]
  - - [12, 16, 1, 12]
    - [17, 0.354462]
  - - [14, 16, 1, 12]
    - [19, 0.448]
  - - [16, 16, 1, 12]
    - [23, 0.4096]
  - - [2, 2, 1, 14]
    - [16, 0.00861538]
  - - [4, 2, 1, 14]
    - [20, 0.0203636]
  - - [6, 2, 1, 14]
    - [17, 0.0258462]
  - - [8, 2, 1, 14]
    - [17, 0.0373333]
  - - [10, 2, 1, 14]
    - [17, 0.0466667]
  - - [12, 2, 1, 14]
    - [16, 0.0516923]
  - - [14, 2, 1, 14]
    - [10, 0.056]
  - - [16, 2, 1, 14]
    - [62, 0.0689231]
  - - [2, 4, 1, 14]
    - [17, 0.0186667]
  - - [4, 4, 1, 14]
    - [22, 0.0344615]
  - - [6, 4, 1, 14]
    - [17, 0.0516923]
  - - [8, 4, 1, 14]
    - [39, 0.0689231]
  - - [10, 4, 1, 14]
    - [16, 0.0861538]
  - - [12, 4, 1, 14]
    - [16, 0.112]
  - - [14, 4, 1, 14]
    - [15, 0.120615]
  - - [16, 4, 1, 14]
    - [17, 0.162909]
  - - [2, 6, 1, 14]
    - [10, 0.024]
  - - [4, 6, 1, 14]
    - [17, 0.0516923]
  - - [6, 6, 1, 14]
    - [17, 0.0775385]
  - - [8, 6, 1, 14]
    - [16, 0.112]
  - - [10, 6, 1, 14]
    - [39, 0.12]
  - - [12, 6, 1, 14]
    - [39, 0.155077]
  - - [14, 6, 1, 14]
    - [39, 0.180923]
  - - [16, 6, 1, 14]
    - [17, 0.224]
  - - [2, 8, 1, 14]
    - [17, 0.0373333]
  - - [4, 8, 1, 14]
    - [16, 0.0746667]
  - - [6, 8, 1, 14]
    - [39, 0.103385]
  - - [8, 8, 1, 14]
    - [15, 0.149333]
  - - [10, 8, 1, 14]
    - [15, 0.16]
  - - [12, 8, 1, 14]
    - [16, 0.206769]
  - - [14, 8, 1, 14]
    - [22, 0.261333]
  - - [16, 8, 1, 14]
    - [64, 0.298667]
  - - [2, 10, 1, 14]
    - [18, 0.0430769]
  - - [4, 10, 1, 14]
    - [16, 0.0933333]
  - - [6, 10, 1, 14]
    - [15, 0.129231]
  - - [8, 10, 1, 14]
    - [15, 0.172308]
  - - [10, 10, 1, 14]
    - [94, 0.2]
  - - [12, 10, 1, 14]
    - [39, 0.24]
  - - [14, 10, 1, 14]
    - [16, 0.326667]
  - - [16, 10, 1, 14]
    - [39, 0.344615]
  - - [2, 12, 1, 14]
    - [105, 0.0516923]
  - - [4, 12, 1, 14]
    - [19, 0.103385]
  - - [6, 12, 1, 14]
    - [39, 0.155077]
  - - [8, 12, 1, 14]
    - [15, 0.206769]
  - - [10, 12, 1, 14]
    - [15, 0.28]
  - - [12, 12, 1, 14]
    - [23, 0.288]
  - - [14, 12, 1, 14]
    - [104, 0.361846]
  - - [16, 12, 1, 14]
    - [16, 0.448]
  - - [2, 14, 1, 14]
    - [39, 0.0603077]
  - - [4, 14, 1, 14]
    - [39, 0.142545]
  - - [6, 14, 1, 14]
    - [15, 0.180923]
  - - [8, 14, 1, 14]
    - [15, 0.261333]
  - - [10, 14, 1, 14]
    - [20, 0.28]
  - - [12, 14, 1, 14]
    - [15, 0.392]
  - - [14, 14, 1, 14]
    - [10, 0.457333]
  - - [16, 14, 1, 14]
    - [39, 0.448]
  - - [2, 16, 1, 14]
    - [17, 0.0689231]
  - - [4, 16, 1, 14]
    - [11, 0.149333]
  - - [6, 16, 1, 14]
    - [10, 0.206769]
  - - [8, 16, 1, 14]
    - [19, 0.325818]
  - - [10, 16, 1, 14]
    - [16, 0.344615]
  - - [12, 16, 1, 14]
    - [17, 0.413538]
  - - [14, 16, 1, 14]
    - [40, 0.482462]
  - - [16, 16, 1, 14]
    - [17, 0.597333]
  - - [2, 2, 1, 16]
    - [39, 0.0106667]
  - - [4, 2, 1, 16]
    - [16, 0.0213333]
  - - [6, 2, 1, 16]
    - [22, 0.0295385]
  - - [8, 2, 1, 16]
    - [16, 0.0426667]
  - - [10, 2, 1, 16]
    - [15, 0.0492308]
  - - [12, 2, 1, 16]
    - [16, 0.0590769]
  - - [14, 2, 1, 16]
    - [10, 0.0746667]
  - - [16, 2, 1, 16]
    - [18, 0.0853333]
  - - [2, 4, 1, 16]
    - [113, 0.0196923]
  - - [4, 4, 1, 16]
    - [15, 0.0426667]
  - - [6, 4, 1, 16]
    - [23, 0.0590769]
  - - [8, 4, 1, 16]
    - [17, 0.0787692]
  - - [10, 4, 1, 16]
    - [39, 0.0984615]
  - - [12, 4, 1, 16]
    - [16, 0.128]
  - - [14, 4, 1, 16]
    - [39, 0.137846]
  - - [16, 4, 1, 16]
    - [15, 0.170667]
  - - [2, 6, 1, 16]
    - [16, 0.032]
  - - [4, 6, 1, 16]
    - [19, 0.0590769]
  - - [6, 6, 1, 16]
    - [62, 0.0886154]
  - - [8, 6, 1, 16]
    - [17, 0.118154]
  - - [10, 6, 1, 16]
    - [10, 0.147692]
  - - [12, 6, 1, 16]
    - [17, 0.177231]
  - - [14, 6, 1, 16]
    - [17, 0.244364]
  - - [16, 6, 1, 16]
    - [43, 0.256]
  - - [2, 8, 1, 16]
    - [15, 0.0426667]
  - - [4, 8, 1, 16]
    - [16, 0.0853333]
  - - [6, 8, 1, 16]
    - [39, 0.118154]
  - - [8, 8, 1, 16]
    - [15, 0.170667]
  - - [10, 8, 1, 16]
    - [39, 0.196923]
  - - [12, 8, 1, 16]
    - [39, 0.256]
  - - [14, 8, 1, 16]
    - [17, 0.275692]
  - - [16, 8, 1, 16]
    - [15, 0.341333]
  - - [2, 10, 1, 16]
    - [39, 0.0492308]
  - - [4, 10, 1, 16]
    - [39, 0.106667]
  - - [6, 10, 1, 16]
    - [39, 0.147692]
  - - [8, 10, 1, 16]
    - [16, 0.196923]
  - - [10, 10, 1, 16]
    - [22, 0.246154]
  - - [12, 10, 1, 16]
    - [15, 0.32]
  - - [14, 10, 1, 16]
    - [39, 0.344615]
  - - [16, 10, 1, 16]
    - [16, 0.393846]
  - - [2, 12, 1, 16]
    - [23, 0.0590769]
  - - [4, 12, 1, 16]
    - [16, 0.118154]
  - - [6, 12, 1, 16]
    - [17, 0.192]
  - - [8, 12, 1, 16]
    - [16, 0.256]
  - - [10, 12, 1, 16]
    - [17, 0.349091]
  - - [12, 12, 1, 16]
    - [18, 0.384]
  - - [14, 12, 1, 16]
    - [10, 0.448]
  - - [16, 12, 1, 16]
    - [15, 0.512]
  - - [2, 14, 1, 16]
    - [39, 0.0689231]
  - - [4, 14, 1, 16]
    - [16, 0.137846]
  - - [6, 14, 1, 16]
    - [39, 0.206769]
  - - [8, 14, 1, 16]
    - [10, 0.298667]
  - - [10, 14, 1, 16]
    - [19, 0.407273]
  - - [12, 14, 1, 16]
    - [15, 0.448]
  - - [14, 14, 1, 16]
    - [23, 0.448]
  - - [16, 14, 1, 16]
    - [39, 0.551385]
  - - [2, 16, 1, 16]
    - [10, 0.0853333]
  - - [4, 16, 1, 16]
    - [39, 0.157538]
  - - [6, 16, 1, 16]
    - [10, 0.256]
  - - [8, 16, 1, 16]
    - [39, 0.315077]
  - - [10, 16, 1, 16]
    - [25, 0.365714]
  - - [12, 16, 1, 16]
    - [16, 0.472615]
  - - [14, 16, 1, 16]
    - [23, 0.551385]
  - - [16, 16, 1, 16]
    - [18, 0.630154]
  - - [2, 2, 1, 1024]
    - [16, 0.585143]
  - - [4, 2, 1, 1024]
    - [16, 1.09227]
  - - [6, 2, 1, 1024]
    - [16, 1.89046]
  - - [8, 2, 1, 1024]
    - [62, 2.18453]
  - - [10, 2, 1, 1024]
    - [93, 2.56]
  - - [12, 2, 1, 1024]
    - [62, 3.51086]
  - - [14, 2, 1, 1024]
    - [64, 3.82293]
  - - [16, 2, 1, 1024]
    - [16, 4.36907]
  - - [2, 4, 1, 1024]
    - [16, 1.17029]
  - - [4, 4, 1, 1024]
    - [62, 2.52062]
  - - [6, 4, 1, 1024]
    - [16, 3.51086]
  - - [8, 4, 1, 1024]
    - [62, 5.04123]
  - - [10, 4, 1, 1024]
    - [16, 5.85143]
  - - [12, 4, 1, 1024]
    - [16, 6.5536]
  - - [14, 4, 1, 1024]
    - [100, 8.192]
  - - [16, 4, 1, 1024]
    - [16, 8.73813]
  - - [2, 6, 1, 1024]
    - [118, 1.6384]
  - - [4, 6, 1, 1024]
    - [118, 3.51086]
  - - [6, 6, 1, 1024]
    - [16, 4.9152]
  - - [8, 6, 1, 1024]
    - [19, 6.5536]
  - - [10, 6, 1, 1024]
    - [65, 8.77714]
  - - [12, 6, 1, 1024]
    - [16, 10.5326]
  - - [14, 6, 1, 1024]
    - [16, 11.4688]
  - - [16, 6, 1, 1024]
    - [62, 15.1237]
  - - [2, 8, 1, 1024]
    - [16, 2.34057]
  - - [4, 8, 1, 1024]
    - [16, 4.36907]
  - - [6, 8, 1, 1024]
    - [62, 7.56185]
  - - [8, 8, 1, 1024]
    - [16, 9.36229]
  - - [10, 8, 1, 1024]
    - [79, 10.9227]
  - - [12, 8, 1, 1024]
    - [16, 13.1072]
  - - [14, 8, 1, 1024]
    - [16, 15.2917]
  - - [16, 8, 1, 1024]
    - [16, 18.7246]
  - - [2, 10, 1, 1024]
    - [62, 2.92571]
  - - [4, 10, 1, 1024]
    - [16, 5.85143]
  - - [6, 10, 1, 1024]
    - [16, 8.77714]
  - - [8, 10, 1, 1024]
    - [16, 11.7029]
  - - [10, 10, 1, 1024]
    - [16, 14.6286]
  - - [12, 10, 1, 1024]
    - [16, 17.5543]
  - - [14, 10, 1, 1024]
    - [16, 20.48]
  - - [16, 10, 1, 1024]
    - [16, 23.4057]
  - - [2, 12, 1, 1024]
    - [62, 3.51086]
  - - [4, 12, 1, 1024]
    - [62, 6.144]
  - - [6, 12, 1, 1024]
    - [16, 10.5326]
  - - [8, 12, 1, 1024]
    - [44, 12.288]
  - - [10, 12, 1, 1024]
    - [62, 17.5543]
  - - [12, 12, 1, 1024]
    - [62, 19.6608]
  - - [14, 12, 1, 1024]
    - [62, 24.576]
  - - [16, 12, 1, 1024]
    - [16, 26.2144]
  - - [2, 14, 1, 1024]
    - [109, 3.82293]
  - - [4, 14, 1, 1024]
    - [16, 8.192]
  - - [6, 14, 1, 1024]
    - [64, 11.4688]
  - - [8, 14, 1, 1024]
    - [62, 16.384]
  - - [10, 14, 1, 1024]
    - [16, 20.48]
  - - [12, 14, 1, 1024]
    - [16, 22.9376]
  - - [14, 14, 1, 1024]
    - [20, 25.088]
  - - [16, 14, 1, 1024]
    - [118, 30.5835]
  - - [2, 16, 1, 1024]
    - [62, 5.04123]
  - - [4, 16, 1, 1024]
    - [62, 9.36229]
  - - [6, 16, 1, 1024]
    - [16, 14.0434]
  - - [8, 16, 1, 1024]
    - [62, 18.7246]
  - - [10, 16, 1, 1024]
    - [16, 21.8453]
  - - [12, 16, 1, 1024]
    - [62, 28.0869]
  - - [14, 16, 1, 1024]
    - [62, 32.768]
  - - [16, 16, 1, 1024]
    - [64, 34.9525]
  - - [2, 2, 1, 2048]
    - [16, 1.024]
  - - [4, 2, 1, 2048]
    - [16, 1.92753]
  - - [6, 2, 1, 2048]
    - [16, 3.2768]
  - - [8, 2, 1, 2048]
    - [109, 4.096]
  - - [10, 2, 1, 2048]
    - [16, 4.81882]
  - - [12, 2, 1, 2048]
    - [62, 6.5536]
  - - [14, 2, 1, 2048]
    - [16, 6.74635]
  - - [16, 2, 1, 2048]
    - [65, 8.192]
  - - [2, 4, 1, 2048]
    - [86, 1.82044]
  - - [4, 4, 1, 2048]
    - [86, 3.44926]
  - - [6, 4, 1, 2048]
    - [63, 5.46133]
  - - [8, 4, 1, 2048]
    - [19, 5.95782]
  - - [10, 4, 1, 2048]
    - [86, 9.10222]
  - - [12, 4, 1, 2048]
    - [16, 12.288]
  - - [14, 4, 1, 2048]
    - [62, 14.336]
  - - [16, 4, 1, 2048]
    - [16, 16.384]
  - - [2, 6, 1, 2048]
    - [16, 2.89129]
  - - [4, 6, 1, 2048]
    - [62, 6.5536]
  - - [6, 6, 1, 2048]
    - [62, 8.67388]
  - - [8, 6, 1, 2048]
    - [101, 12.288]
  - - [10, 6, 1, 2048]
    - [62, 15.36]
  - - [12, 6, 1, 2048]
    - [62, 19.6608]
  - - [14, 6, 1, 2048]
    - [62, 22.9376]
  - - [16, 6, 1, 2048]
    - [86, 21.8453]
  - - [2, 8, 1, 2048]
    - [86, 4.096]
  - - [4, 8, 1, 2048]
    - [113, 6.89853]
  - - [6, 8, 1, 2048]
    - [86, 10.9227]
  - - [8, 8, 1, 2048]
    - [105, 16.384]
  - - [10, 8, 1, 2048]
    - [16, 19.2753]
  - - [12, 8, 1, 2048]
    - [62, 24.576]
  - - [14, 8, 1, 2048]
    - [62, 28.672]
  - - [16, 8, 1, 2048]
    - [62, 30.8405]
  - - [2, 10, 1, 2048]
    - [62, 5.12]
  - - [4, 10, 1, 2048]
    - [62, 10.9227]
  - - [6, 10, 1, 2048]
    - [64, 12.288]
  - - [8, 10, 1, 2048]
    - [16, 20.48]
  - - [10, 10, 1, 2048]
    - [16, 22.7556]
  - - [12, 10, 1, 2048]
    - [62, 30.72]
  - - [14, 10, 1, 2048]
    - [62, 35.84]
  - - [16, 10, 1, 2048]
    - [16, 40.96]
  - - [2, 12, 1, 2048]
    - [62, 6.5536]
  - - [4, 12, 1, 2048]
    - [62, 12.288]
  - - [6, 12, 1, 2048]
    - [86, 16.384]
  - - [8, 12, 1, 2048]
    - [16, 24.576]
  - - [10, 12, 1, 2048]
    - [62, 30.72]
  - - [12, 12, 1, 2048]
    - [16, 34.6955]
  - - [14, 12, 1, 2048]
    - [86, 32.768]
  - - [16, 12, 1, 2048]
    - [65, 46.2607]
  - - [2, 14, 1, 2048]
    - [86, 5.46133]
  - - [4, 14, 1, 2048]
    - [62, 15.2917]
  - - [6, 14, 1, 2048]
    - [62, 20.2391]
  - - [8, 14, 1, 2048]
    - [17, 24.1448]
  - - [10, 14, 1, 2048]
    - [16, 33.7318]
  - - [12, 14, 1, 2048]
    - [62, 45.8752]
  - - [14, 14, 1, 2048]
    - [62, 53.5211]
  - - [16, 14, 1, 2048]
    - [16, 53.9708]
  - - [2, 16, 1, 2048]
    - [62, 8.192]
  - - [4, 16, 1, 2048]
    - [62, 16.384]
  - - [6, 16, 1, 2048]
    - [62, 24.576]
  - - [8, 16, 1, 2048]
    - [62, 32.768]
  - - [10, 16, 1, 2048]
    - [62, 40.96]
  - - [12, 16, 1, 2048]
    - [16, 49.152]
  - - [14, 16, 1, 2048]
    - [16, 57.344]
  - - [16, 16, 1, 2048]
    - [62, 52.4288]
  - - [2, 2, 1, 4096]
    - [86, 1.48945]
  - - [4, 2, 1, 4096]
    - [62, 3.12076]
  - - [6, 2, 1, 4096]
    - [62, 4.68114]
  - - [8, 2, 1, 4096]
    - [16, 6.24152]
  - - [10, 2, 1, 4096]
    - [16, 7.8019]
  - - [12, 2, 1, 4096]
    - [62, 7.86432]
  - - [14, 2, 1, 4096]
    - [62, 10.9227]
  - - [16, 2, 1, 4096]
    - [16, 11.9156]
  - - [2, 4, 1, 4096]
    - [16, 3.12076]
  - - [4, 4, 1, 4096]
    - [16, 5.95782]
  - - [6, 4, 1, 4096]
    - [110, 8.54817]
  - - [8, 4, 1, 4096]
    - [16, 12.483]
  - - [10, 4, 1, 4096]
    - [62, 17.2463]
  - - [12, 4, 1, 4096]
    - [100, 16.384]
  - - [14, 4, 1, 4096]
    - [62, 22.9376]
  - - [16, 4, 1, 4096]
    - [16, 24.9661]
  - - [2, 6, 1, 4096]
    - [62, 4.9152]
  - - [4, 6, 1, 4096]
    - [16, 9.8304]
  - - [6, 6, 1, 4096]
    - [16, 13.4051]
  - - [8, 6, 1, 4096]
    - [16, 18.7246]
  - - [10, 6, 1, 4096]
    - [112, 21.3704]
  - - [12, 6, 1, 4096]
    - [62, 28.0869]
  - - [14, 6, 1, 4096]
    - [86, 32.768]
  - - [16, 6, 1, 4096]
    - [16, 35.7469]
  - - [2, 8, 1, 4096]
    - [62, 6.5536]
  - - [4, 8, 1, 4096]
    - [62, 13.1072]
  - - [6, 8, 1, 4096]
    - [86, 17.8735]
  - - [8, 8, 1, 4096]
    - [62, 27.5941]
  - - [10, 8, 1, 4096]
    - [118, 31.2076]
  - - [12, 8, 1, 4096]
    - [62, 37.4491]
  - - [14, 8, 1, 4096]
    - [62, 45.8752]
  - - [16, 8, 1, 4096]
    - [16, 47.6625]
  - - [2, 10, 1, 4096]
    - [86, 7.8019]
  - - [4, 10, 1, 4096]
    - [62, 13.6533]
  - - [6, 10, 1, 4096]
    - [62, 23.4057]
  - - [8, 10, 1, 4096]
    - [62, 27.3067]
  - - [10, 10, 1, 4096]
    - [86, 39.0095]
  - - [12, 10, 1, 4096]
    - [62, 49.152]
  - - [14, 10, 1, 4096]
    - [62, 60.3621]
  - - [16, 10, 1, 4096]
    - [62, 65.536]
  - - [2, 12, 1, 4096]
    - [16, 8.93673]
  - - [4, 12, 1, 4096]
    - [16, 18.7246]
  - - [6, 12, 1, 4096]
    - [16, 28.0869]
  - - [8, 12, 1, 4096]
    - [62, 39.3216]
  - - [10, 12, 1, 4096]
    - [86, 42.7409]
  - - [12, 12, 1, 4096]
    - [62, 49.152]
  - - [14, 12, 1, 4096]
    - [16, 65.536]
  - - [16, 12, 1, 4096]
    - [16, 71.4938]
  - - [2, 14, 1, 4096]
    - [16, 10.4262]
  - - [4, 14, 1, 4096]
    - [64, 19.9457]
  - - [6, 14, 1, 4096]
    - [62, 36.2173]
  - - [8, 14, 1, 4096]
    - [16, 43.6907]
  - - [10, 14, 1, 4096]
    - [62, 60.3621]
  - - [12, 14, 1, 4096]
    - [16, 59.8372]
  - - [14, 14, 1, 4096]
    - [16, 80.2816]
  - - [16, 14, 1, 4096]
    - [62, 91.7504]
  - - [2, 16, 1, 4096]
    - [62, 10.4858]
  - - [4, 16, 1, 4096]
    - [16, 24.9661]
  - - [6, 16, 1, 4096]
    - [16, 37.4491]
  - - [8, 16, 1, 4096]
    - [62, 52.4288]
  - - [10, 16, 1, 4096]
    - [62, 62.4152]
  - - [12, 16, 1, 4096]
    - [64, 68.3854]
  - - [14, 16, 1, 4096]
    - [62, 96.5794]
  - - [16, 16, 1, 4096]
    - [62, 110.376]
  - - [64, 4096, 1, 64]
    - [21, 2396.75]
  - - [320, 4096, 1, 64]
    - [61, 6990.51]
  - - [64, 4096, 1, 256]
    - [57, 7456.54]
  - - [4096, 64, 1, 64]
    - [26, 2396.75]
  - - [4096, 320, 1, 64]
    - [55, 6710.89]
  - - [4096, 64, 1, 256]
    - [12, 6710.89]
  - - [64, 64, 1, 8192]
    - [62, 2396.75]
  - - [64, 128, 1, 8192]
    - [62, 4793.49]
  - - [64, 8192, 1, 64]
    - [43, 3050.4]
  - - [64, 8192, 1, 128]
    - [31, 6391.32]
  - - [128, 64, 1, 8192]
    - [62, 4329.6]
  - - [128, 8192, 1, 64]
    - [53, 6391.32]
  - - [8192, 64, 1, 64]
    - [55, 3532.05]
  - - [8192, 64, 1, 128]
    - [26, 6710.89]
  - - [8192, 128, 1, 64]
    - [26, 5592.41]
  - - [64, 1, 1, 64]
    - [17, 0.630154]
  - - [64, 16, 1, 64]
    - [63, 10.0825]
  - - [64, 32, 1, 64]
    - [39, 20.1649]
  - - [1, 1, 1, 64]
    - [17, 0.0106667]
  - - [16, 1, 1, 64]
    - [63, 0.157538]
  - - [32, 1, 1, 64]
    - [19, 0.315077]
  - - [64, 1, 1, 1]
    - [16, 0.00984615]
  - - [64, 1, 1, 16]
    - [16, 0.157538]
  - - [64, 1, 1, 32]
    - [11, 0.315077]
  - - [1, 16, 1, 64]
    - [18, 0.157538]
  - - [16, 16, 1, 64]
    - [39, 2.52062]
  - - [32, 16, 1, 64]
    - [11, 5.46133]
  - - [64, 16, 1, 1]
    - [39, 0.146286]
  - - [64, 16, 1, 16]
    - [16, 2.97891]
  - - [64, 16, 1, 32]
    - [21, 5.04123]
  - - [1, 32, 1, 64]
    - [17, 0.315077]
  - - [16, 32, 1, 64]
    - [21, 5.04123]
  - - [32, 32, 1, 64]
    - [17, 10.9227]
  - - [64, 32, 1, 1]
    - [39, 0.315077]
  - - [64, 32, 1, 16]
    - [39, 5.46133]
  - - [64, 32, 1, 32]
    - [16, 10.9227]
  - - [1, 1, 1, 1]
    - [16, 0.000153846]
  - - [1, 1, 1, 16]
    - [16, 0.00266667]
  - - [1, 1, 1, 32]
    - [20, 0.00492308]
  - - [16, 1, 1, 1]
    - [17, 0.00246154]
  - - [16, 1, 1, 16]
    - [39, 0.0393846]
  - - [16, 1, 1, 32]
    - [16, 0.0853333]
  - - [32, 1, 1, 1]
    - [16, 0.00533333]
  - - [32, 1, 1, 16]
    - [16, 0.0787692]
  - - [32, 1, 1, 32]
    - [16, 0.170667]
  - - [1, 16, 1, 1]
    - [10, 0.00266667]
  - - [1, 16, 1, 16]
    - [10, 0.0365714]
  - - [1, 16, 1, 32]
    - [30, 0.064]
  - - [16, 16, 1, 1]
    - [15, 0.0393846]
  - - [16, 16, 1, 16]
    - [15, 0.630154]
  - - [16, 16, 1, 32]
    - [17, 1.26031]
  - - [32, 16, 1, 1]
    - [16, 0.0787692]
  - - [32, 16, 1, 16]
    - [16, 1.26031]
  - - [32, 16, 1, 32]
    - [17, 2.73067]
  - - [1, 32, 1, 1]
    - [19, 0.00457143]
  - - [1, 32, 1, 16]
    - [10, 0.0853333]
  - - [1, 32, 1, 32]
    - [15, 0.157538]
  - - [16, 32, 1, 1]
    - [15, 0.0853333]
  - - [16, 32, 1, 16]
    - [17, 1.36533]
  - - [16, 32, 1, 32]
    - [21, 2.73067]
  - - [32, 32, 1, 1]
    - [23, 0.157538]
  - - [32, 32, 1, 16]
    - [10, 2.52062]
  - - [32, 32, 1, 32]
    - [39, 5.04123]
  - - [1, 64, 1, 64]
    - [15, 0.630154]
  - - [16, 64, 1, 64]
    - [17, 11.9156]
  - - [32, 64, 1, 64]
    - [10, 21.8453]
  - - [1, 64, 1, 1]
    - [39, 0.00984615]
  - - [1, 64, 1, 16]
    - [15, 0.170667]
  - - [1, 64, 1, 32]
    - [17, 0.315077]
  - - [16, 64, 1, 1]
    - [15, 0.157538]
  - - [16, 64, 1, 16]
    - [16, 2.34057]
  - - [16, 64, 1, 32]
    - [17, 5.04123]
  - - [32, 64, 1, 1]
    - [16, 0.372364]
  - - [32, 64, 1, 16]
    - [16, 5.46133]
  - - [32, 64, 1, 32]
    - [17, 11.9156]
  - - [64, 64, 1, 1]
    - [15, 0.682667]
  - - [64, 64, 1, 16]
    - [15, 10.9227]
  - - [64, 64, 1, 32]
    - [16, 20.1649]
  - - [256, 1, 1, 256]
    - [15, 9.36229]
  - - [256, 16, 1, 256]
    - [10, 161.319]
  - - [256, 32, 1, 256]
    - [39, 299.593]
  - - [1, 1, 1, 256]
    - [106, 0.0426667]
  - - [16, 1, 1, 256]
    - [16, 0.585143]
  - - [32, 1, 1, 256]
    - [18, 1.26031]
  - - [256, 1, 1, 1]
    - [10, 0.0393846]
  - - [256, 1, 1, 16]
    - [39, 0.630154]
  - - [256, 1, 1, 32]
    - [17, 1.26031]
  - - [1, 16, 1, 256]
    - [16, 0.630154]
  - - [16, 16, 1, 256]
    - [19, 9.36229]
  - - [32, 16, 1, 256]
    - [17, 20.1649]
  - - [256, 16, 1, 1]
    - [17, 0.744727]
  - - [256, 16, 1, 16]
    - [12, 8.73813]
  - - [256, 16, 1, 32]
    - [39, 20.1649]
  - - [1, 32, 1, 256]
    - [17, 1.36533]
  - - [16, 32, 1, 256]
    - [17, 20.1649]
  - - [32, 32, 1, 256]
    - [10, 40.3298]
  - - [256, 32, 1, 1]
    - [15, 1.26031]
  - - [256, 32, 1, 16]
    - [39, 21.8453]
  - - [256, 32, 1, 32]
    - [39, 47.6625]
  - - [1, 256, 1, 256]
    - [24, 8.73813]
  - - [16, 256, 1, 256]
    - [17, 161.319]
  - - [32, 256, 1, 256]
    - [39, 299.593]
  - - [1, 256, 1, 1]
    - [39, 0.0426667]
  - - [1, 256, 1, 16]
    - [16, 0.682667]
  - - [1, 256, 1, 32]
    - [39, 1.26031]
  - - [16, 256, 1, 1]
    - [16, 0.630154]
  - - [16, 256, 1, 16]
    - [15, 10.0825]
  - - [16, 256, 1, 32]
    - [16, 21.8453]
  - - [32, 256, 1, 1]
    - [23, 1.09227]
  - - [32, 256, 1, 16]
    - [16, 23.8313]
  - - [32, 256, 1, 32]
    - [39, 40.3298]
  - - [256, 256, 1, 1]
    - [23, 9.36229]
  - - [256, 256, 1, 16]
    - [11, 161.319]
  - - [256, 256, 1, 32]
    - [15, 299.593]
  - - [512, 1, 1, 512]
    - [17, 40.3298]
  - - [512, 16, 1, 512]
    - [108, 559.241]
  - - [512, 32, 1, 512]
    - [16, 1198.37]
  - - [1, 1, 1, 512]
    - [20, 0.0731429]
  - - [16, 1, 1, 512]
    - [101, 1.17029]
  - - [32, 1, 1, 512]
    - [39, 2.18453]
  - - [512, 1, 1, 1]
    - [15, 0.0853333]
  - - [512, 1, 1, 16]
    - [10, 1.17029]
  - - [512, 1, 1, 32]
    - [10, 2.34057]
  - - [1, 16, 1, 512]
    - [16, 1.17029]
  - - [16, 16, 1, 512]
    - [19, 18.7246]
  - - [32, 16, 1, 512]
    - [103, 37.4491]
  - - [512, 16, 1, 1]
    - [17, 1.26031]
  - - [512, 16, 1, 16]
    - [17, 23.8313]
  - - [512, 16, 1, 32]
    - [85, 37.4491]
  - - [1, 32, 1, 512]
    - [62, 2.52062]
  - - [16, 32, 1, 512]
    - [62, 43.6907]
  - - [32, 32, 1, 512]
    - [118, 74.8983]
  - - [512, 32, 1, 1]
    - [23, 2.52062]
  - - [512, 32, 1, 16]
    - [39, 40.3298]
  - - [512, 32, 1, 32]
    - [39, 87.3813]
  - - [1, 512, 1, 512]
    - [19, 34.9525]
  - - [16, 512, 1, 512]
    - [10, 559.241]
  - - [32, 512, 1, 512]
    - [39, 1118.48]
  - - [1, 512, 1, 1]
    - [18, 0.0731429]
  - - [1, 512, 1, 16]
    - [39, 1.26031]
  - - [1, 512, 1, 32]
    - [17, 2.73067]
  - - [16, 512, 1, 1]
    - [15, 1.26031]
  - - [16, 512, 1, 16]
    - [17, 20.1649]
  - - [16, 512, 1, 32]
    - [39, 40.3298]
  - - [32, 512, 1, 1]
    - [17, 2.73067]
  - - [32, 512, 1, 16]
    - [39, 40.3298]
  - - [32, 512, 1, 32]
    - [17, 87.3813]
  - - [512, 512, 1, 1]
    - [27, 37.4491]
  - - [512, 512, 1, 16]
    - [12, 599.186]
  - - [512, 512, 1, 32]
    - [39, 1118.48]
  - - [1024, 1, 1, 1024]
    - [62, 110.376]
  - - [1024, 16, 1, 1024]
    - [62, 1766.02]
  - - [1024, 32, 1, 1024]
    - [62, 3532.05]
  - - [1, 1, 1, 1024]
    - [62, 0.157538]
  - - [16, 1, 1, 1024]
    - [100, 2.18453]
  - - [32, 1, 1, 1024]
    - [62, 4.68114]
  - - [1024, 1, 1, 1]
    - [39, 0.186182]
  - - [1024, 1, 1, 16]
    - [15, 2.52062]
  - - [1024, 1, 1, 32]
    - [92, 4.68114]
  - - [1, 16, 1, 1024]
    - [16, 2.52062]
  - - [16, 16, 1, 1024]
    - [16, 37.4491]
  - - [32, 16, 1, 1024]
    - [109, 69.9051]
  - - [1024, 16, 1, 1]
    - [15, 2.34057]
  - - [1024, 16, 1, 16]
    - [17, 40.3298]
  - - [1024, 16, 1, 32]
    - [17, 87.3813]
  - - [1, 32, 1, 1024]
    - [108, 4.36907]
  - - [16, 32, 1, 1024]
    - [16, 69.9051]
  - - [32, 32, 1, 1024]
    - [63, 149.797]
  - - [1024, 32, 1, 1]
    - [10, 5.04123]
  - - [1024, 32, 1, 16]
    - [22, 87.3813]
  - - [1024, 32, 1, 32]
    - [21, 190.65]
  - - [1, 1024, 1, 1024]
    - [105, 131.072]
  - - [16, 1024, 1, 1024]
    - [62, 2236.96]
  - - [32, 1024, 1, 1024]
    - [23, 3532.05]
  - - [1, 1024, 1, 1]
    - [18, 0.170667]
  - - [1, 1024, 1, 16]
    - [20, 2.52062]
  - - [1, 1024, 1, 32]
    - [16, 5.46133]
  - - [16, 1024, 1, 1]
    - [16, 2.73067]
  - - [16, 1024, 1, 16]
    - [23, 37.4491]
  - - [16, 1024, 1, 32]
    - [15, 87.3813]
  - - [32, 1024, 1, 1]
    - [10, 4.36907]
  - - [32, 1024, 1, 16]
    - [23, 74.8983]
  - - [32, 1024, 1, 32]
    - [17, 174.763]
  - - [1024, 1024, 1, 1]
    - [61, 110.376]
  - - [1024, 1024, 1, 16]
    - [53, 1677.72]
  - - [1024, 1024, 1, 32]
    - [37, 3355.44]
  - - [2048, 1, 1, 2048]
    - [63, 289.262]
  - - [2048, 16, 1, 2048]
    - [110, 4793.49]
  - - [1, 1, 1, 2048]
    - [62, 0.256]
  - - [16, 1, 1, 2048]
    - [64, 3.44926]
  - - [32, 1, 1, 2048]
    - [62, 6.24152]
  - - [2048, 1, 1, 1]
    - [11, 0.315077]
  - - [2048, 1, 1, 16]
    - [17, 5.46133]
  - - [2048, 1, 1, 32]
    - [39, 10.0825]
  - - [1, 16, 1, 2048]
    - [62, 4.36907]
  - - [16, 16, 1, 2048]
    - [62, 69.9051]
  - - [32, 16, 1, 2048]
    - [16, 123.362]
  - - [2048, 16, 1, 1]
    - [17, 5.04123]
  - - [2048, 16, 1, 16]
    - [21, 74.8983]
  - - [2048, 16, 1, 32]
    - [44, 174.763]
  - - [1, 32, 1, 2048]
    - [105, 7.71012]
  - - [16, 32, 1, 2048]
    - [109, 131.072]
  - - [32, 32, 1, 2048]
    - [86, 246.724]
  - - [2048, 32, 1, 1]
    - [22, 10.0825]
  - - [2048, 32, 1, 16]
    - [19, 149.797]
  - - [2048, 32, 1, 32]
    - [19, 299.593]
  - - [1, 2048, 1, 2048]
    - [16, 335.544]
  - - [16, 2048, 1, 2048]
    - [16, 6710.89]
  - - [1, 2048, 1, 1]
    - [17, 0.341333]
  - - [1, 2048, 1, 16]
    - [15, 5.46133]
  - - [1, 2048, 1, 32]
    - [16, 10.9227]
  - - [16, 2048, 1, 1]
    - [16, 4.68114]
  - - [16, 2048, 1, 16]
    - [54, 74.8983]
  - - [16, 2048, 1, 32]
    - [11, 161.319]
  - - [32, 2048, 1, 1]
    - [11, 10.0825]
  - - [32, 2048, 1, 16]
    - [15, 161.319]
  - - [32, 2048, 1, 32]
    - [97, 299.593]
  - - [2048, 2048, 1, 1]
    - [14, 190.65]
  - - [2048, 2048, 1, 16]
    - [14, 3355.44]
  - - [3072, 1, 1, 3072]
    - [105, 460.35]
  - - [1, 1, 1, 3072]
    - [62, 0.361412]
  - - [16, 1, 1, 3072]
    - [62, 5.46133]
  - - [32, 1, 1, 3072]
    - [16, 9.8304]
  - - [3072, 1, 1, 1]
    - [22, 0.438857]
  - - [3072, 1, 1, 16]
    - [17, 8.192]
  - - [3072, 1, 1, 32]
    - [22, 14.0434]
  - - [1, 16, 1, 3072]
    - [62, 5.46133]
  - - [16, 16, 1, 3072]
    - [16, 87.3813]
  - - [32, 16, 1, 3072]
    - [118, 142.988]
  - - [3072, 16, 1, 1]
    - [17, 8.192]
  - - [3072, 16, 1, 16]
    - [39, 120.99]
  - - [3072, 16, 1, 32]
    - [19, 196.608]
  - - [1, 32, 1, 3072]
    - [62, 10.9227]
  - - [16, 32, 1, 3072]
    - [79, 165.565]
  - - [32, 32, 1, 3072]
    - [62, 370.086]
  - - [3072, 32, 1, 1]
    - [55, 13.1072]
  - - [3072, 32, 1, 16]
    - [23, 224.695]
  - - [3072, 32, 1, 32]
    - [25, 483.958]
  - - [1, 3072, 1, 3072]
    - [17, 608.851]
  - - [1, 3072, 1, 1]
    - [23, 0.4096]
  - - [1, 3072, 1, 16]
    - [21, 6.5536]
  - - [1, 3072, 1, 32]
    - [102, 14.0434]
  - - [16, 3072, 1, 1]
    - [39, 7.02171]
  - - [16, 3072, 1, 16]
    - [39, 104.858]
  - - [16, 3072, 1, 32]
    - [27, 224.695]
  - - [32, 3072, 1, 1]
    - [21, 13.1072]
  - - [32, 3072, 1, 16]
    - [23, 209.715]
  - - [32, 3072, 1, 32]
    - [46, 524.288]
  - - [3072, 3072, 1, 1]
    - [38, 277.564]
  - - [4096, 1, 1, 4096]
    - [79, 524.288]
  - - [1, 1, 1, 4096]
    - [16, 0.390095]
  - - [16, 1, 1, 4096]
    - [64, 5.46133]
  - - [32, 1, 1, 4096]
    - [62, 13.1072]
  - - [4096, 1, 1, 1]
    - [39, 0.585143]
  - - [4096, 1, 1, 16]
    - [39, 9.36229]
  - - [4096, 1, 1, 32]
    - [17, 20.1649]
  - - [1, 16, 1, 4096]
    - [64, 5.95782]
  - - [16, 16, 1, 4096]
    - [62, 110.376]
  - - [32, 16, 1, 4096]
    - [62, 199.729]
  - - [4096, 16, 1, 1]
    - [17, 10.9227]
  - - [4096, 16, 1, 16]
    - [17, 161.319]
  - - [4096, 16, 1, 32]
    - [21, 299.593]
  - - [1, 32, 1, 4096]
    - [62, 13.1072]
  - - [16, 32, 1, 4096]
    - [64, 182.361]
  - - [32, 32, 1, 4096]
    - [62, 419.43]
  - - [4096, 32, 1, 1]
    - [25, 20.1649]
  - - [4096, 32, 1, 16]
    - [39, 279.62]
  - - [4096, 32, 1, 32]
    - [39, 599.186]
  - - [1, 4096, 1, 4096]
    - [16, 645.278]
  - - [1, 4096, 1, 1]
    - [15, 0.630154]
  - - [1, 4096, 1, 16]
    - [15, 10.0825]
  - - [1, 4096, 1, 32]
    - [3, 14.5636]
  - - [16, 4096, 1, 1]
    - [16, 10.9227]
  - - [16, 4096, 1, 16]
    - [16, 161.319]
  - - [16, 4096, 1, 32]
    - [63, 279.62]
  - - [32, 4096, 1, 1]
    - [46, 20.1649]
  - - [32, 4096, 1, 16]
    - [15, 299.593]
  - - [32, 4096, 1, 32]
    - [17, 524.288]
  - - [4096, 4096, 1, 1]
    - [14, 291.778]
  - - [320, 1, 1, 64]
    - [16, 3.41333]
  - - [320, 16, 1, 64]
    - [17, 50.4123]
  - - [320, 32, 1, 64]
    - [17, 100.825]
  - - [320, 1, 1, 1]
    - [17, 0.0581818]
  - - [320, 1, 1, 16]
    - [17, 0.853333]
  - - [320, 1, 1, 32]
    - [15, 1.70667]
  - - [320, 16, 1, 1]
    - [17, 0.853333]
  - - [320, 16, 1, 16]
    - [39, 12.6031]
  - - [320, 16, 1, 32]
    - [17, 27.3067]
  - - [320, 32, 1, 1]
    - [44, 1.86182]
  - - [320, 32, 1, 16]
    - [16, 27.3067]
  - - [320, 32, 1, 32]
    - [17, 50.4123]
  - - [320, 64, 1, 1]
    - [16, 3.41333]
  - - [320, 64, 1, 16]
    - [39, 54.6133]
  - - [320, 64, 1, 32]
    - [22, 100.825]
  - - [576, 1, 1, 64]
    - [16, 5.67138]
  - - [576, 16, 1, 64]
    - [16, 90.7422]
  - - [576, 32, 1, 64]
    - [39, 181.484]
  - - [576, 1, 1, 1]
    - [17, 0.0886154]
  - - [576, 1, 1, 16]
    - [39, 1.41785]
  - - [576, 1, 1, 32]
    - [15, 3.072]
  - - [576, 16, 1, 1]
    - [39, 1.67564]
  - - [576, 16, 1, 16]
    - [10, 21.0651]
  - - [576, 16, 1, 32]
    - [17, 45.3711]
  - - [576, 32, 1, 1]
    - [39, 2.83569]
  - - [576, 32, 1, 16]
    - [44, 49.152]
  - - [576, 32, 1, 32]
    - [21, 98.304]
  - - [576, 64, 1, 1]
    - [16, 6.144]
  - - [576, 64, 1, 16]
    - [39, 90.7422]
  - - [576, 64, 1, 32]
    - [17, 181.484]
  - - [832, 1, 1, 64]
    - [39, 8.192]
  - - [832, 16, 1, 64]
    - [10, 131.072]
  - - [832, 32, 1, 64]
    - [39, 262.144]
  - - [832, 1, 1, 1]
    - [40, 0.128]
  - - [832, 1, 1, 16]
    - [18, 2.048]
  - - [832, 1, 1, 32]
    - [15, 4.096]
  - - [832, 16, 1, 1]
    - [15, 2.048]
  - - [832, 16, 1, 16]
    - [64, 32.768]
  - - [832, 16, 1, 32]
    - [17, 65.536]
  - - [832, 32, 1, 1]
    - [17, 4.43733]
  - - [832, 32, 1, 16]
    - [15, 70.9973]
  - - [832, 32, 1, 32]
    - [39, 131.072]
  - - [832, 64, 1, 1]
    - [23, 7.60686]
  - - [832, 64, 1, 16]
    - [39, 141.995]
  - - [832, 64, 1, 32]
    - [43, 283.989]
  - - [1088, 1, 1, 64]
    - [11, 11.6053]
  - - [1088, 16, 1, 64]
    - [15, 171.402]
  - - [1088, 32, 1, 64]
    - [17, 342.804]
  - - [1088, 1, 1, 1]
    - [10, 0.167385]
  - - [1088, 1, 1, 16]
    - [15, 2.67815]
  - - [1088, 1, 1, 32]
    - [17, 5.80267]
  - - [1088, 16, 1, 1]
    - [39, 2.67815]
  - - [1088, 16, 1, 16]
    - [17, 46.4213]
  - - [1088, 16, 1, 32]
    - [19, 85.7009]
  - - [1088, 32, 1, 1]
    - [39, 5.35631]
  - - [1088, 32, 1, 16]
    - [15, 85.7009]
  - - [1088, 32, 1, 32]
    - [19, 171.402]
  - - [1088, 64, 1, 1]
    - [10, 11.6053]
  - - [1088, 64, 1, 16]
    - [39, 171.402]
  - - [1088, 64, 1, 32]
    - [39, 342.804]
  - - [1344, 1, 1, 64]
    - [17, 14.336]
  - - [1344, 16, 1, 64]
    - [17, 211.732]
  - - [1344, 32, 1, 64]
    - [40, 423.463]
  - - [1344, 1, 1, 1]
    - [39, 0.192]
  - - [1344, 1, 1, 16]
    - [23, 3.072]
  - - [1344, 1, 1, 32]
    - [39, 6.144]
  - - [1344, 16, 1, 1]
    - [39, 3.30831]
  - - [1344, 16, 1, 16]
    - [17, 57.344]
  - - [1344, 16, 1, 32]
    - [17, 125.114]
  - - [1344, 32, 1, 1]
    - [39, 6.61662]
  - - [1344, 32, 1, 16]
    - [21, 105.866]
  - - [1344, 32, 1, 32]
    - [39, 196.608]
  - - [1344, 64, 1, 1]
    - [21, 12.288]
  - - [1344, 64, 1, 16]
    - [39, 211.732]
  - - [1344, 64, 1, 32]
    - [11, 393.216]
  - - [1600, 1, 1, 64]
    - [21, 17.0667]
  - - [1600, 16, 1, 64]
    - [17, 273.067]
  - - [1600, 32, 1, 64]
    - [17, 468.114]
  - - [1600, 1, 1, 1]
    - [17, 0.246154]
  - - [1600, 1, 1, 16]
    - [39, 3.93846]
  - - [1600, 1, 1, 32]
    - [25, 8.53333]
  - - [1600, 16, 1, 1]
    - [39, 3.65714]
  - - [1600, 16, 1, 16]
    - [27, 58.5143]
  - - [1600, 16, 1, 32]
    - [39, 126.031]
  - - [1600, 32, 1, 1]
    - [39, 7.31429]
  - - [1600, 32, 1, 16]
    - [39, 126.031]
  - - [1600, 32, 1, 32]
    - [21, 252.062]
  - - [1600, 64, 1, 1]
    - [23, 15.7538]
  - - [1600, 64, 1, 16]
    - [23, 218.453]
  - - [1600, 64, 1, 32]
    - [21, 546.133]
  - - [1856, 1, 1, 64]
    - [21, 16.9691]
  - - [1856, 16, 1, 64]
    - [17, 316.757]
  - - [1856, 32, 1, 64]
    - [17, 584.783]
  - - [1856, 1, 1, 1]
    - [15, 0.265143]
  - - [1856, 1, 1, 16]
    - [22, 4.24229]
  - - [1856, 1, 1, 32]
    - [10, 9.13723]
  - - [1856, 16, 1, 1]
    - [10, 4.24229]
  - - [1856, 16, 1, 16]
    - [17, 79.1893]
  - - [1856, 16, 1, 32]
    - [25, 158.379]
  - - [1856, 32, 1, 1]
    - [21, 10.7985]
  - - [1856, 32, 1, 16]
    - [39, 158.379]
  - - [1856, 32, 1, 32]
    - [17, 316.757]
  - - [1856, 64, 1, 1]
    - [23, 16.9691]
  - - [1856, 64, 1, 16]
    - [12, 271.506]
  - - [1856, 64, 1, 32]
    - [23, 543.013]
  - - [2112, 1, 1, 64]
    - [10, 20.7951]
  - - [2112, 16, 1, 64]
    - [48, 288.358]
  - - [2112, 32, 1, 64]
    - [21, 720.896]
  - - [2112, 1, 1, 1]
    - [17, 0.352]
  - - [2112, 1, 1, 16]
    - [24, 4.82743]
  - - [2112, 1, 1, 32]
    - [17, 12.288]
  - - [2112, 16, 1, 1]
    - [21, 5.632]
  - - [2112, 16, 1, 16]
    - [10, 90.112]
  - - [2112, 16, 1, 32]
    - [17, 166.361]
  - - [2112, 32, 1, 1]
    - [21, 10.3975]
  - - [2112, 32, 1, 16]
    - [17, 166.361]
  - - [2112, 32, 1, 32]
    - [17, 332.721]
  - - [2112, 64, 1, 1]
    - [23, 19.3097]
  - - [2112, 64, 1, 16]
    - [23, 308.955]
  - - [2112, 64, 1, 32]
    - [27, 720.896]
  - - [2368, 1, 1, 64]
    - [100, 21.6503]
  - - [2368, 16, 1, 64]
    - [22, 346.405]
  - - [2368, 32, 1, 64]
    - [39, 746.102]
  - - [2368, 1, 1, 1]
    - [23, 0.338286]
  - - [2368, 1, 1, 16]
    - [17, 6.31467]
  - - [2368, 1, 1, 32]
    - [17, 12.6293]
  - - [2368, 16, 1, 1]
    - [27, 5.82892]
  - - [2368, 16, 1, 16]
    - [24, 86.6011]
  - - [2368, 16, 1, 32]
    - [39, 186.526]
  - - [2368, 32, 1, 1]
    - [39, 11.6578]
  - - [2368, 32, 1, 16]
    - [10, 186.526]
  - - [2368, 32, 1, 32]
    - [17, 373.051]
  - - [2368, 64, 1, 1]
    - [23, 21.6503]
  - - [2368, 64, 1, 16]
    - [11, 373.051]
  - - [2368, 64, 1, 32]
    - [27, 808.277]
  - - [2624, 1, 1, 64]
    - [39, 23.9909]
  - - [2624, 16, 1, 64]
    - [17, 447.829]
  - - [2624, 32, 1, 64]
    - [17, 826.762]
  - - [2624, 1, 1, 1]
    - [39, 0.374857]
  - - [2624, 1, 1, 16]
    - [17, 6.99733]
  - - [2624, 1, 1, 32]
    - [107, 11.9954]
  - - [2624, 16, 1, 1]
    - [23, 5.59787]
  - - [2624, 16, 1, 16]
    - [39, 95.9634]
  - - [2624, 16, 1, 32]
    - [39, 206.69]
  - - [2624, 32, 1, 1]
    - [23, 11.9954]
  - - [2624, 32, 1, 16]
    - [17, 191.927]
  - - [2624, 32, 1, 32]
    - [39, 413.381]
  - - [2624, 64, 1, 1]
    - [23, 22.3915]
  - - [2624, 64, 1, 16]
    - [21, 413.381]
  - - [2624, 64, 1, 32]
    - [21, 826.762]
  - - [2880, 1, 1, 64]
    - [17, 28.3569]
  - - [2880, 16, 1, 64]
    - [44, 453.711]
  - - [2880, 32, 1, 64]
    - [116, 786.432]
  - - [2880, 1, 1, 1]
    - [23, 0.411429]
  - - [2880, 1, 1, 16]
    - [25, 7.08923]
  - - [2880, 1, 1, 32]
    - [39, 13.1657]
  - - [2880, 16, 1, 1]
    - [22, 6.144]
  - - [2880, 16, 1, 16]
    - [39, 105.326]
  - - [2880, 16, 1, 32]
    - [39, 226.855]
  - - [2880, 32, 1, 1]
    - [21, 14.1785]
  - - [2880, 32, 1, 16]
    - [10, 226.855]
  - - [2880, 32, 1, 32]
    - [39, 453.711]
  - - [2880, 64, 1, 1]
    - [39, 26.3314]
  - - [2880, 64, 1, 16]
    - [26, 453.711]
  - - [2880, 64, 1, 32]
    - [23, 786.432]
  - - [3136, 1, 1, 64]
    - [23, 26.7605]
  - - [3136, 16, 1, 64]
    - [12, 377.796]
  - - [3136, 32, 1, 64]
    - [39, 988.081]
  - - [3136, 1, 1, 1]
    - [39, 0.448]
  - - [3136, 1, 1, 16]
    - [22, 8.36267]
  - - [3136, 1, 1, 32]
    - [17, 16.7253]
  - - [3136, 16, 1, 1]
    - [39, 7.168]
  - - [3136, 16, 1, 16]
    - [17, 123.51]
  - - [3136, 16, 1, 32]
    - [25, 229.376]
  - - [3136, 32, 1, 1]
    - [22, 15.4388]
  - - [3136, 32, 1, 16]
    - [39, 229.376]
  - - [3136, 32, 1, 32]
    - [21, 494.041]
  - - [3136, 64, 1, 1]
    - [44, 28.672]
  - - [3136, 64, 1, 16]
    - [47, 428.169]
  - - [3136, 64, 1, 32]
    - [21, 988.081]
  - - [3392, 1, 1, 64]
    - [39, 31.0126]
  - - [3392, 16, 1, 64]
    - [22, 496.201]
  - - [3392, 32, 1, 64]
    - [22, 992.402]
  - - [3392, 1, 1, 1]
    - [39, 0.452267]
  - - [3392, 1, 1, 16]
    - [63, 7.23627]
  - - [3392, 1, 1, 32]
    - [25, 15.5063]
  - - [3392, 16, 1, 1]
    - [17, 8.34954]
  - - [3392, 16, 1, 16]
    - [10, 133.593]
  - - [3392, 16, 1, 32]
    - [21, 248.101]
  - - [3392, 32, 1, 1]
    - [39, 15.5063]
  - - [3392, 32, 1, 16]
    - [39, 267.185]
  - - [3392, 32, 1, 32]
    - [21, 578.901]
  - - [3392, 64, 1, 1]
    - [23, 28.9451]
  - - [3392, 64, 1, 16]
    - [27, 463.121]
  - - [3392, 64, 1, 32]
    - [39, 926.242]
  - - [3648, 1, 1, 64]
    - [39, 35.9188]
  - - [3648, 16, 1, 64]
    - [17, 574.7]
  - - [3648, 32, 1, 64]
    - [39, 996.147]
  - - [3648, 1, 1, 1]
    - [39, 0.561231]
  - - [3648, 1, 1, 16]
    - [17, 9.728]
  - - [3648, 1, 1, 32]
    - [39, 16.6766]
  - - [3648, 16, 1, 1]
    - [39, 8.33829]
  - - [3648, 16, 1, 16]
    - [39, 133.413]
  - - [3648, 16, 1, 32]
    - [17, 311.296]
  - - [3648, 32, 1, 1]
    - [39, 16.6766]
  - - [3648, 32, 1, 16]
    - [23, 249.037]
  - - [3648, 32, 1, 32]
    - [39, 533.65]
  - - [3648, 64, 1, 1]
    - [49, 29.184]
  - - [3648, 64, 1, 16]
    - [42, 574.7]
  - - [3648, 64, 1, 32]
    - [39, 996.147]
  - - [3904, 1, 1, 64]
    - [21, 33.3141]
  - - [3904, 16, 1, 64]
    - [28, 470.317]
  - - [3904, 32, 1, 64]
    - [10, 1066.05]
  - - [3904, 1, 1, 1]
    - [17, 0.600615]
  - - [3904, 1, 1, 16]
    - [17, 9.60985]
  - - [3904, 1, 1, 32]
    - [17, 19.2197]
  - - [3904, 16, 1, 1]
    - [22, 9.60985]
  - - [3904, 16, 1, 16]
    - [21, 142.775]
  - - [3904, 16, 1, 32]
    - [17, 285.55]
  - - [3904, 32, 1, 1]
    - [22, 19.2197]
  - - [3904, 32, 1, 16]
    - [39, 285.55]
  - - [3904, 32, 1, 32]
    - [25, 571.099]
  - - [3904, 64, 1, 1]
    - [21, 35.6937]
  - - [3904, 64, 1, 16]
    - [39, 533.026]
  - - [3904, 64, 1, 32]
    - [39, 1066.05]
  - - [1, 320, 1, 64]
    - [16, 3.15077]
  - - [16, 320, 1, 64]
    - [16, 59.5782]
  - - [32, 320, 1, 64]
    - [15, 109.227]
  - - [1, 320, 1, 1]
    - [16, 0.0492308]
  - - [1, 320, 1, 16]
    - [39, 0.731429]
  - - [1, 320, 1, 32]
    - [17, 1.70667]
  - - [16, 320, 1, 1]
    - [20, 0.853333]
  - - [16, 320, 1, 16]
    - [16, 13.6533]
  - - [16, 320, 1, 32]
    - [39, 25.2062]
  - - [32, 320, 1, 1]
    - [86, 1.70667]
  - - [32, 320, 1, 16]
    - [39, 25.2062]
  - - [32, 320, 1, 32]
    - [11, 50.4123]
  - - [64, 320, 1, 1]
    - [15, 3.15077]
  - - [64, 320, 1, 16]
    - [11, 50.4123]
  - - [64, 320, 1, 32]
    - [39, 100.825]
  - - [320, 320, 1, 1]
    - [39, 15.7538]
  - - [320, 320, 1, 16]
    - [23, 234.057]
  - - [320, 320, 1, 32]
    - [10, 468.114]
  - - [576, 320, 1, 1]
    - [30, 23.04]
  - - [576, 320, 1, 16]
    - [32, 368.64]
  - - [576, 320, 1, 32]
    - [47, 842.606]
  - - [832, 320, 1, 1]
    - [39, 33.28]
  - - [832, 320, 1, 16]
    - [47, 608.549]
  - - [832, 320, 1, 32]
    - [27, 1135.96]
  - - [1088, 320, 1, 1]
    - [24, 46.4213]
  - - [1088, 320, 1, 16]
    - [24, 742.741]
  - - [1088, 320, 1, 32]
    - [55, 1392.64]
  - - [1344, 320, 1, 1]
    - [10, 50.5976]
  - - [1344, 320, 1, 16]
    - [33, 860.16]
  - - [1344, 320, 1, 32]
    - [55, 1619.12]
  - - [1600, 320, 1, 1]
    - [55, 56.8889]
  - - [1600, 320, 1, 16]
    - [26, 1024.0]
  - - [1600, 320, 1, 32]
    - [24, 1927.53]
  - - [1856, 320, 1, 1]
    - [55, 65.9911]
  - - [1856, 320, 1, 16]
    - [55, 1117.97]
  - - [1856, 320, 1, 32]
    - [55, 2000.57]
  - - [2112, 320, 1, 1]
    - [49, 75.0933]
  - - [2112, 320, 1, 16]
    - [3, 1029.85]
  - - [2112, 320, 1, 32]
    - [24, 2162.69]
  - - [2368, 320, 1, 1]
    - [49, 79.7642]
  - - [2368, 320, 1, 16]
    - [49, 1212.42]
  - - [2368, 320, 1, 32]
    - [49, 2694.26]
  - - [2624, 320, 1, 1]
    - [82, 83.968]
  - - [2624, 320, 1, 16]
    - [61, 1279.51]
  - - [2624, 320, 1, 32]
    - [47, 2686.98]
  - - [2880, 320, 1, 1]
    - [61, 92.16]
  - - [2880, 320, 1, 16]
    - [49, 1404.34]
  - - [2880, 320, 1, 32]
    - [49, 2681.02]
  - - [3136, 320, 1, 1]
    - [82, 91.2291]
  - - [3136, 320, 1, 16]
    - [43, 1459.67]
  - - [3136, 320, 1, 32]
    - [61, 2919.33]
  - - [3392, 320, 1, 1]
    - [61, 98.6764]
  - - [3392, 320, 1, 16]
    - [43, 1578.82]
  - - [3392, 320, 1, 32]
    - [26, 2894.51]
  - - [3648, 320, 1, 1]
    - [43, 101.51]
  - - [3648, 320, 1, 16]
    - [26, 1624.15]
  - - [3648, 320, 1, 32]
    - [27, 3248.31]
  - - [3904, 320, 1, 1]
    - [33, 104.107]
  - - [3904, 320, 1, 16]
    - [55, 1665.71]
  - - [3904, 320, 1, 32]
    - [33, 3476.26]
  - - [1, 576, 1, 64]
    - [16, 6.144]
  - - [16, 576, 1, 64]
    - [16, 107.241]
  - - [32, 576, 1, 64]
    - [16, 196.608]
  - - [1, 576, 1, 1]
    - [18, 0.0886154]
  - - [1, 576, 1, 16]
    - [39, 1.41785]
  - - [1, 576, 1, 32]
    - [17, 2.83569]
  - - [16, 576, 1, 1]
    - [39, 1.536]
  - - [16, 576, 1, 16]
    - [15, 22.6855]
  - - [16, 576, 1, 32]
    - [40, 45.3711]
  - - [32, 576, 1, 1]
    - [39, 2.83569]
  - - [32, 576, 1, 16]
    - [39, 45.3711]
  - - [32, 576, 1, 32]
    - [17, 98.304]
  - - [64, 576, 1, 1]
    - [19, 5.67138]
  - - [64, 576, 1, 16]
    - [17, 90.7422]
  - - [64, 576, 1, 32]
    - [17, 181.484]
  - - [320, 576, 1, 1]
    - [39, 26.3314]
  - - [320, 576, 1, 16]
    - [27, 453.711]
  - - [320, 576, 1, 32]
    - [39, 842.606]
  - - [576, 576, 1, 1]
    - [27, 47.3966]
  - - [576, 576, 1, 16]
    - [42, 707.789]
  - - [576, 576, 1, 32]
    - [27, 1415.58]
  - - [832, 576, 1, 1]
    - [55, 56.3802]
  - - [832, 576, 1, 16]
    - [32, 958.464]
  - - [832, 576, 1, 32]
    - [55, 1804.17]
  - - [1088, 576, 1, 1]
    - [3, 62.6688]
  - - [1088, 576, 1, 16]
    - [43, 1114.11]
  - - [1088, 576, 1, 32]
    - [3, 2005.4]
  - - [1344, 576, 1, 1]
    - [82, 81.4888]
  - - [1344, 576, 1, 16]
    - [27, 1238.63]
  - - [1344, 576, 1, 32]
    - [80, 2477.26]
  - - [1600, 576, 1, 1]
    - [82, 83.7818]
  - - [1600, 576, 1, 16]
    - [8, 1340.51]
  - - [1600, 576, 1, 32]
    - [49, 2808.69]
  - - [1856, 576, 1, 1]
    - [13, 92.9614]
  - - [1856, 576, 1, 16]
    - [82, 1554.99]
  - - [1856, 576, 1, 32]
    - [82, 3109.98]
  - - [2112, 576, 1, 1]
    - [55, 101.376]
  - - [2112, 576, 1, 16]
    - [33, 1692.54]
  - - [2112, 576, 1, 32]
    - [32, 3385.08]
  - - [2368, 576, 1, 1]
    - [28, 104.921]
  - - [2368, 576, 1, 16]
    - [14, 1678.73]
  - - [2368, 576, 1, 32]
    - [38, 3637.25]
  - - [2624, 576, 1, 1]
    - [27, 111.957]
  - - [2624, 576, 1, 16]
    - [82, 1934.62]
  - - [2624, 576, 1, 32]
    - [49, 3869.25]
  - - [2880, 576, 1, 1]
    - [14, 118.491]
  - - [2880, 576, 1, 16]
    - [43, 1966.08]
  - - [2880, 576, 1, 32]
    - [49, 3932.16]
  - - [3136, 576, 1, 1]
    - [8, 129.024]
  - - [3136, 576, 1, 16]
    - [8, 1993.2]
  - - [3136, 576, 1, 32]
    - [49, 4128.77]
  - - [3392, 576, 1, 1]
    - [49, 134.744]
  - - [3392, 576, 1, 16]
    - [49, 2155.91]
  - - [3392, 576, 1, 32]
    - [49, 4033.64]
  - - [3648, 576, 1, 1]
    - [82, 131.328]
  - - [3648, 576, 1, 16]
    - [8, 2037.57]
  - - [3648, 576, 1, 32]
    - [49, 4482.66]
  - - [3904, 576, 1, 1]
    - [49, 145.078]
  - - [3904, 576, 1, 16]
    - [49, 2321.24]
  - - [3904, 576, 1, 32]
    - [49, 4642.49]
  - - [1, 832, 1, 64]
    - [39, 8.192]
  - - [16, 832, 1, 64]
    - [22, 121.71]
  - - [32, 832, 1, 64]
    - [17, 262.144]
  - - [1, 832, 1, 1]
    - [63, 0.128]
  - - [1, 832, 1, 16]
    - [15, 2.048]
  - - [1, 832, 1, 32]
    - [16, 4.43733]
  - - [16, 832, 1, 1]
    - [15, 2.048]
  - - [16, 832, 1, 16]
    - [64, 30.4274]
  - - [16, 832, 1, 32]
    - [16, 65.536]
  - - [32, 832, 1, 1]
    - [15, 4.096]
  - - [32, 832, 1, 16]
    - [21, 65.536]
  - - [32, 832, 1, 32]
    - [15, 131.072]
  - - [64, 832, 1, 1]
    - [19, 8.192]
  - - [64, 832, 1, 16]
    - [10, 121.71]
  - - [64, 832, 1, 32]
    - [17, 262.144]
  - - [320, 832, 1, 1]
    - [24, 38.0343]
  - - [320, 832, 1, 16]
    - [21, 567.979]
  - - [320, 832, 1, 32]
    - [13, 1217.1]
  - - [576, 832, 1, 1]
    - [3, 53.248]
  - - [576, 832, 1, 16]
    - [55, 851.968]
  - - [576, 832, 1, 32]
    - [28, 1703.94]
  - - [832, 832, 1, 1]
    - [80, 62.9295]
  - - [832, 832, 1, 16]
    - [9, 1054.82]
  - - [832, 832, 1, 32]
    - [49, 2215.12]
  - - [1088, 832, 1, 1]
    - [41, 86.211]
  - - [1088, 832, 1, 16]
    - [27, 1379.38]
  - - [1088, 832, 1, 32]
    - [49, 2633.36]
  - - [1344, 832, 1, 1]
    - [61, 101.655]
  - - [1344, 832, 1, 16]
    - [61, 1703.94]
  - - [1344, 832, 1, 32]
    - [61, 3252.97]
  - - [1600, 832, 1, 1]
    - [61, 110.933]
  - - [1600, 832, 1, 16]
    - [9, 1638.4]
  - - [1600, 832, 1, 32]
    - [61, 3704.21]
  - - [1856, 832, 1, 1]
    - [8, 118.784]
  - - [1856, 832, 1, 16]
    - [49, 1976.57]
  - - [1856, 832, 1, 32]
    - [82, 3529.58]
  - - [2112, 832, 1, 1]
    - [55, 125.513]
  - - [2112, 832, 1, 16]
    - [28, 1938.96]
  - - [2112, 832, 1, 32]
    - [49, 3877.92]
  - - [2368, 832, 1, 1]
    - [61, 140.727]
  - - [2368, 832, 1, 16]
    - [26, 1970.18]
  - - [2368, 832, 1, 32]
    - [49, 4067.46]
  - - [2624, 832, 1, 1]
    - [14, 136.448]
  - - [2624, 832, 1, 16]
    - [49, 2328.71]
  - - [2624, 832, 1, 32]
    - [49, 4507.19]
  - - [2880, 832, 1, 1]
    - [49, 149.76]
  - - [2880, 832, 1, 16]
    - [5, 2255.21]
  - - [2880, 832, 1, 32]
    - [49, 4510.42]
  - - [3136, 832, 1, 1]
    - [61, 163.072]
  - - [3136, 832, 1, 16]
    - [61, 2609.15]
  - - [3136, 832, 1, 32]
    - [61, 5060.17]
  - - [3392, 832, 1, 1]
    - [82, 156.786]
  - - [3392, 832, 1, 16]
    - [61, 2656.14]
  - - [3392, 832, 1, 32]
    - [82, 5160.49]
  - - [3648, 832, 1, 1]
    - [49, 164.061]
  - - [3648, 832, 1, 16]
    - [61, 2624.98]
  - - [3648, 832, 1, 32]
    - [49, 5249.96]
  - - [3904, 832, 1, 1]
    - [38, 170.954]
  - - [3904, 832, 1, 16]
    - [37, 2598.5]
  - - [3904, 832, 1, 32]
    - [14, 5197.0]
  - - [1, 1088, 1, 64]
    - [15, 10.7126]
  - - [16, 1088, 1, 64]
    - [16, 171.402]
  - - [32, 1088, 1, 64]
    - [39, 342.804]
  - - [1, 1088, 1, 1]
    - [15, 0.167385]
  - - [1, 1088, 1, 16]
    - [39, 2.67815]
  - - [1, 1088, 1, 32]
    - [15, 5.80267]
  - - [16, 1088, 1, 1]
    - [39, 2.90133]
  - - [16, 1088, 1, 16]
    - [16, 39.7897]
  - - [16, 1088, 1, 32]
    - [15, 92.8427]
  - - [32, 1088, 1, 1]
    - [39, 5.35631]
  - - [32, 1088, 1, 16]
    - [18, 92.8427]
  - - [32, 1088, 1, 32]
    - [39, 171.402]
  - - [64, 1088, 1, 1]
    - [20, 9.94743]
  - - [64, 1088, 1, 16]
    - [39, 171.402]
  - - [64, 1088, 1, 32]
    - [11, 371.371]
  - - [320, 1088, 1, 1]
    - [13, 43.52]
  - - [320, 1088, 1, 16]
    - [24, 742.741]
  - - [320, 1088, 1, 32]
    - [55, 1310.72]
  - - [576, 1088, 1, 1]
    - [81, 65.9672]
  - - [576, 1088, 1, 16]
    - [3, 1055.47]
  - - [576, 1088, 1, 32]
    - [49, 2228.22]
  - - [832, 1088, 1, 1]
    - [61, 90.5216]
  - - [832, 1088, 1, 16]
    - [61, 1524.57]
  - - [832, 1088, 1, 32]
    - [61, 3049.15]
  - - [1088, 1088, 1, 1]
    - [55, 98.6453]
  - - [1088, 1088, 1, 16]
    - [61, 1721.81]
  - - [1088, 1088, 1, 32]
    - [61, 3293.9]
  - - [1344, 1088, 1, 1]
    - [53, 108.316]
  - - [1344, 1088, 1, 16]
    - [37, 1949.7]
  - - [1344, 1088, 1, 32]
    - [14, 3599.44]
  - - [1600, 1088, 1, 1]
    - [49, 128.948]
  - - [1600, 1088, 1, 16]
    - [5, 1989.49]
  - - [1600, 1088, 1, 32]
    - [13, 3841.77]
  - - [1856, 1088, 1, 1]
    - [37, 134.622]
  - - [1856, 1088, 1, 16]
    - [14, 2019.33]
  - - [1856, 1088, 1, 32]
    - [49, 4038.66]
  - - [2112, 1088, 1, 1]
    - [49, 135.168]
  - - [2112, 1088, 1, 16]
    - [55, 2162.69]
  - - [2112, 1088, 1, 32]
    - [49, 4595.71]
  - - [2368, 1088, 1, 1]
    - [14, 151.552]
  - - [2368, 1088, 1, 16]
    - [61, 2498.31]
  - - [2368, 1088, 1, 32]
    - [14, 4849.66]
  - - [2624, 1088, 1, 1]
    - [14, 173.025]
  - - [2624, 1088, 1, 16]
    - [53, 2686.98]
  - - [2624, 1088, 1, 32]
    - [61, 4808.27]
  - - [2880, 1088, 1, 1]
    - [61, 174.08]
  - - [2880, 1088, 1, 16]
    - [14, 2638.69]
  - - [2880, 1088, 1, 32]
    - [38, 5277.37]
  - - [3136, 1088, 1, 1]
    - [37, 174.973]
  - - [3136, 1088, 1, 16]
    - [3, 2539.14]
  - - [3136, 1088, 1, 32]
    - [49, 5459.15]
  - - [3392, 1088, 1, 1]
    - [53, 180.024]
  - - [3392, 1088, 1, 16]
    - [38, 2952.4]
  - - [3392, 1088, 1, 32]
    - [49, 5492.83]
  - - [3648, 1088, 1, 1]
    - [82, 180.41]
  - - [3648, 1088, 1, 16]
    - [82, 2822.42]
  - - [3904, 1088, 1, 1]
    - [37, 197.561]
  - - [3904, 1088, 1, 16]
    - [37, 3160.97]
  - - [1, 1344, 1, 64]
    - [10, 12.288]
  - - [16, 1344, 1, 64]
    - [17, 211.732]
  - - [32, 1344, 1, 64]
    - [15, 458.752]
  - - [1, 1344, 1, 1]
    - [40, 0.206769]
  - - [1, 1344, 1, 16]
    - [17, 3.584]
  - - [1, 1344, 1, 32]
    - [39, 6.61662]
  - - [16, 1344, 1, 1]
    - [102, 3.072]
  - - [16, 1344, 1, 16]
    - [17, 62.5571]
  - - [16, 1344, 1, 32]
    - [39, 105.866]
  - - [32, 1344, 1, 1]
    - [73, 7.168]
  - - [32, 1344, 1, 16]
    - [16, 105.866]
  - - [32, 1344, 1, 32]
    - [17, 172.032]
  - - [64, 1344, 1, 1]
    - [23, 11.4688]
  - - [64, 1344, 1, 16]
    - [21, 229.376]
  - - [64, 1344, 1, 32]
    - [21, 458.752]
  - - [320, 1344, 1, 1]
    - [44, 47.7867]
  - - [320, 1344, 1, 16]
    - [13, 860.16]
  - - [320, 1344, 1, 32]
    - [55, 1619.12]
  - - [576, 1344, 1, 1]
    - [47, 77.4144]
  - - [576, 1344, 1, 16]
    - [41, 1303.82]
  - - [576, 1344, 1, 32]
    - [24, 2607.64]
  - - [832, 1344, 1, 1]
    - [55, 93.184]
  - - [832, 1344, 1, 16]
    - [13, 1490.94]
  - - [832, 1344, 1, 32]
    - [55, 2981.89]
  - - [1088, 1344, 1, 1]
    - [14, 108.316]
  - - [1088, 1344, 1, 16]
    - [37, 1949.7]
  - - [1088, 1344, 1, 32]
    - [14, 3743.42]
  - - [1344, 1344, 1, 1]
    - [50, 129.024]
  - - [1344, 1344, 1, 16]
    - [3, 1993.2]
  - - [1344, 1344, 1, 32]
    - [50, 3986.4]
  - - [1600, 1344, 1, 1]
    - [49, 138.735]
  - - [1600, 1344, 1, 16]
    - [53, 2293.76]
  - - [1600, 1344, 1, 32]
    - [49, 4439.54]
  - - [1856, 1344, 1, 1]
    - [61, 155.904]
  - - [1856, 1344, 1, 16]
    - [14, 2347.73]
  - - [1856, 1344, 1, 32]
    - [61, 4988.93]
  - - [2112, 1344, 1, 1]
    - [37, 166.972]
  - - [2112, 1344, 1, 16]
    - [8, 2523.14]
  - - [2112, 1344, 1, 32]
    - [14, 5190.45]
  - - [2368, 1344, 1, 1]
    - [61, 176.811]
  - - [2368, 1344, 1, 16]
    - [61, 2828.97]
  - - [2368, 1344, 1, 32]
    - [55, 4967.95]
  - - [2624, 1344, 1, 1]
    - [61, 167.936]
  - - [2624, 1344, 1, 16]
    - [38, 2893.67]
  - - [2624, 1344, 1, 32]
    - [82, 5373.95]
  - - [2880, 1344, 1, 1]
    - [14, 184.32]
  - - [2880, 1344, 1, 16]
    - [37, 3021.05]
  - - [2880, 1344, 1, 32]
    - [14, 5630.14]
  - - [3136, 1344, 1, 1]
    - [38, 200.704]
  - - [3136, 1344, 1, 16]
    - [81, 2997.18]
  - - [3392, 1344, 1, 1]
    - [38, 212.039]
  - - [3392, 1344, 1, 16]
    - [14, 3315.53]
  - - [3648, 1344, 1, 1]
    - [14, 213.17]
  - - [3648, 1344, 1, 16]
    - [14, 3137.86]
  - - [3904, 1344, 1, 1]
    - [38, 209.879]
  - - [3904, 1344, 1, 16]
    - [38, 3426.6]
  - - [1, 1600, 1, 64]
    - [39, 14.6286]
  - - [16, 1600, 1, 64]
    - [16, 273.067]
  - - [32, 1600, 1, 64]
    - [15, 468.114]
  - - [1, 1600, 1, 1]
    - [16, 0.266667]
  - - [1, 1600, 1, 16]
    - [17, 4.26667]
  - - [1, 1600, 1, 32]
    - [17, 8.53333]
  - - [16, 1600, 1, 1]
    - [39, 3.93846]
  - - [16, 1600, 1, 16]
    - [15, 63.0154]
  - - [16, 1600, 1, 32]
    - [18, 136.533]
  - - [32, 1600, 1, 1]
    - [39, 7.87692]
  - - [32, 1600, 1, 16]
    - [98, 117.029]
  - - [32, 1600, 1, 32]
    - [16, 252.062]
  - - [64, 1600, 1, 1]
    - [47, 15.7538]
  - - [64, 1600, 1, 16]
    - [23, 252.062]
  - - [64, 1600, 1, 32]
    - [10, 504.123]
  - - [320, 1600, 1, 1]
    - [43, 64.0]
  - - [320, 1600, 1, 16]
    - [26, 1024.0]
  - - [320, 1600, 1, 32]
    - [9, 1820.44]
  - - [576, 1600, 1, 1]
    - [61, 97.0105]
  - - [576, 1600, 1, 16]
    - [61, 1474.56]
  - - [576, 1600, 1, 32]
    - [3, 2564.45]
  - - [832, 1600, 1, 1]
    - [61, 115.757]
  - - [832, 1600, 1, 16]
    - [37, 1774.93]
  - - [832, 1600, 1, 32]
    - [14, 3704.21]
  - - [1088, 1600, 1, 1]
    - [61, 124.343]
  - - [1088, 1600, 1, 16]
    - [55, 1920.88]
  - - [1088, 1600, 1, 32]
    - [28, 3841.77]
  - - [1344, 1600, 1, 1]
    - [14, 138.735]
  - - [1344, 1600, 1, 16]
    - [26, 2150.4]
  - - [1344, 1600, 1, 32]
    - [14, 4047.81]
  - - [1600, 1600, 1, 1]
    - [14, 155.152]
  - - [1600, 1600, 1, 16]
    - [38, 2482.42]
  - - [1600, 1600, 1, 32]
    - [61, 5120.0]
  - - [1856, 1600, 1, 1]
    - [53, 160.519]
  - - [1856, 1600, 1, 16]
    - [14, 2568.3]
  - - [1856, 1600, 1, 32]
    - [37, 5279.29]
  - - [2112, 1600, 1, 1]
    - [14, 160.914]
  - - [2112, 1600, 1, 16]
    - [37, 2845.64]
  - - [2112, 1600, 1, 32]
    - [37, 5029.51]
  - - [2368, 1600, 1, 1]
    - [14, 189.44]
  - - [2368, 1600, 1, 16]
    - [61, 3031.04]
  - - [2368, 1600, 1, 32]
    - [37, 5773.41]
  - - [2624, 1600, 1, 1]
    - [14, 199.924]
  - - [2624, 1600, 1, 16]
    - [14, 3124.39]
  - - [2880, 1600, 1, 1]
    - [14, 200.348]
  - - [2880, 1600, 1, 16]
    - [14, 3205.57]
  - - [3136, 1600, 1, 1]
    - [37, 209.067]
  - - [3136, 1600, 1, 16]
    - [53, 3211.26]
  - - [3392, 1600, 1, 1]
    - [14, 217.088]
  - - [3392, 1600, 1, 16]
    - [14, 3339.82]
  - - [3648, 1600, 1, 1]
    - [38, 220.257]
  - - [3648, 1600, 1, 16]
    - [14, 3524.11]
  - - [3904, 1600, 1, 1]
    - [14, 223.086]
  - - [3904, 1600, 1, 16]
    - [14, 3569.37]
  - - [1, 1856, 1, 64]
    - [17, 19.7973]
  - - [16, 1856, 1, 64]
    - [39, 271.506]
  - - [32, 1856, 1, 64]
    - [39, 543.013]
  - - [1, 1856, 1, 1]
    - [39, 0.285538]
  - - [1, 1856, 1, 16]
    - [16, 4.94933]
  - - [1, 1856, 1, 32]
    - [39, 9.13723]
  - - [16, 1856, 1, 1]
    - [23, 4.24229]
  - - [16, 1856, 1, 16]
    - [39, 67.8766]
  - - [16, 1856, 1, 32]
    - [97, 146.196]
  - - [32, 1856, 1, 1]
    - [16, 9.13723]
  - - [32, 1856, 1, 16]
    - [39, 146.196]
  - - [32, 1856, 1, 32]
    - [18, 292.391]
  - - [64, 1856, 1, 1]
    - [21, 16.9691]
  - - [64, 1856, 1, 16]
    - [10, 292.391]
  - - [64, 1856, 1, 32]
    - [22, 584.783]
  - - [320, 1856, 1, 1]
    - [9, 62.5179]
  - - [320, 1856, 1, 16]
    - [13, 1117.97]
  - - [320, 1856, 1, 32]
    - [13, 2111.72]
  - - [576, 1856, 1, 1]
    - [61, 101.815]
  - - [576, 1856, 1, 16]
    - [81, 1629.04]
  - - [576, 1856, 1, 32]
    - [61, 3420.98]
  - - [832, 1856, 1, 1]
    - [81, 118.784]
  - - [832, 1856, 1, 16]
    - [61, 2058.92]
  - - [832, 1856, 1, 32]
    - [61, 4117.85]
  - - [1088, 1856, 1, 1]
    - [49, 134.622]
  - - [1088, 1856, 1, 16]
    - [49, 2084.47]
  - - [1088, 1856, 1, 32]
    - [49, 4307.9]
  - - [1344, 1856, 1, 1]
    - [61, 155.904]
  - - [1344, 1856, 1, 16]
    - [55, 2280.65]
  - - [1344, 1856, 1, 32]
    - [14, 4837.75]
  - - [1600, 1856, 1, 1]
    - [14, 174.682]
  - - [1600, 1856, 1, 16]
    - [14, 2794.92]
  - - [1600, 1856, 1, 32]
    - [14, 5589.84]
  - - [1856, 1856, 1, 1]
    - [61, 181.302]
  - - [1856, 1856, 1, 16]
    - [14, 2755.79]
  - - [1856, 1856, 1, 32]
    - [61, 5010.53]
  - - [2112, 1856, 1, 1]
    - [38, 195.994]
  - - [2112, 1856, 1, 16]
    - [61, 3059.41]
  - - [2368, 1856, 1, 1]
    - [61, 204.419]
  - - [2368, 1856, 1, 16]
    - [14, 3125.34]
  - - [2624, 1856, 1, 1]
    - [14, 194.806]
  - - [2624, 1856, 1, 16]
    - [38, 3387.93]
  - - [2880, 1856, 1, 1]
    - [14, 209.619]
  - - [2880, 1856, 1, 16]
    - [38, 3353.9]
  - - [3136, 1856, 1, 1]
    - [14, 223.862]
  - - [3136, 1856, 1, 16]
    - [37, 3581.79]
  - - [3392, 1856, 1, 1]
    - [37, 228.929]
  - - [3392, 1856, 1, 16]
    - [14, 3662.87]
  - - [3648, 1856, 1, 1]
    - [14, 233.472]
  - - [3648, 1856, 1, 16]
    - [38, 3672.24]
  - - [3904, 1856, 1, 1]
    - [14, 241.527]
  - - [3904, 1856, 1, 16]
    - [14, 3622.91]
  - - [1, 2112, 1, 64]
    - [11, 18.0224]
  - - [16, 2112, 1, 64]
    - [18, 360.448]
  - - [32, 2112, 1, 64]
    - [16, 617.911]
  - - [1, 2112, 1, 1]
    - [16, 0.352]
  - - [1, 2112, 1, 16]
    - [102, 4.82743]
  - - [1, 2112, 1, 32]
    - [23, 9.0112]
  - - [16, 2112, 1, 1]
    - [15, 5.632]
  - - [16, 2112, 1, 16]
    - [26, 77.2389]
  - - [16, 2112, 1, 32]
    - [17, 166.361]
  - - [32, 2112, 1, 1]
    - [17, 11.264]
  - - [32, 2112, 1, 16]
    - [15, 166.361]
  - - [32, 2112, 1, 32]
    - [39, 332.721]
  - - [64, 2112, 1, 1]
    - [22, 19.3097]
  - - [64, 2112, 1, 16]
    - [23, 332.721]
  - - [64, 2112, 1, 32]
    - [24, 665.442]
  - - [320, 2112, 1, 1]
    - [49, 71.1411]
  - - [320, 2112, 1, 16]
    - [9, 1081.34]
  - - [320, 2112, 1, 32]
    - [24, 2162.69]
  - - [576, 2112, 1, 1]
    - [50, 105.784]
  - - [576, 2112, 1, 16]
    - [61, 1692.54]
  - - [576, 2112, 1, 32]
    - [61, 3114.27]
  - - [832, 2112, 1, 1]
    - [26, 125.513]
  - - [832, 2112, 1, 16]
    - [26, 2008.21]
  - - [832, 2112, 1, 32]
    - [61, 3877.92]
  - - [1088, 2112, 1, 1]
    - [38, 143.616]
  - - [1088, 2112, 1, 16]
    - [49, 2371.98]
  - - [1088, 2112, 1, 32]
    - [61, 4595.71]
  - - [1344, 2112, 1, 1]
    - [3, 157.696]
  - - [1344, 2112, 1, 16]
    - [14, 2595.23]
  - - [1344, 2112, 1, 32]
    - [82, 5343.11]
  - - [1600, 2112, 1, 1]
    - [14, 168.96]
  - - [1600, 2112, 1, 16]
    - [81, 2637.42]
  - - [1600, 2112, 1, 32]
    - [61, 4915.2]
  - - [1856, 2112, 1, 1]
    - [53, 191.213]
  - - [1856, 2112, 1, 16]
    - [38, 2986.57]
  - - [2112, 2112, 1, 1]
    - [37, 207.467]
  - - [2112, 2112, 1, 16]
    - [37, 3319.47]
  - - [2368, 2112, 1, 1]
    - [38, 200.049]
  - - [2368, 2112, 1, 16]
    - [38, 3334.14]
  - - [2624, 2112, 1, 1]
    - [38, 217.329]
  - - [2624, 2112, 1, 16]
    - [38, 3410.39]
  - - [2880, 2112, 1, 1]
    - [14, 217.234]
  - - [2880, 2112, 1, 16]
    - [37, 3672.49]
  - - [3136, 2112, 1, 1]
    - [14, 220.774]
  - - [3136, 2112, 1, 16]
    - [38, 3654.2]
  - - [3392, 2112, 1, 1]
    - [38, 223.872]
  - - [3392, 2112, 1, 16]
    - [61, 3697.5]
  - - [3648, 2112, 1, 1]
    - [14, 233.472]
  - - [3648, 2112, 1, 16]
    - [14, 3852.29]
  - - [3904, 2112, 1, 1]
    - [14, 249.856]
  - - [1, 2368, 1, 64]
    - [16, 25.2587]
  - - [16, 2368, 1, 64]
    - [15, 373.051]
  - - [32, 2368, 1, 64]
    - [22, 692.809]
  - - [1, 2368, 1, 1]
    - [15, 0.338286]
  - - [1, 2368, 1, 16]
    - [39, 5.41257]
  - - [1, 2368, 1, 32]
    - [43, 10.8251]
  - - [16, 2368, 1, 1]
    - [54, 5.41257]
  - - [16, 2368, 1, 16]
    - [15, 86.6011]
  - - [16, 2368, 1, 32]
    - [17, 202.069]
  - - [32, 2368, 1, 1]
    - [15, 12.6293]
  - - [32, 2368, 1, 16]
    - [17, 202.069]
  - - [32, 2368, 1, 32]
    - [16, 346.405]
  - - [64, 2368, 1, 1]
    - [11, 23.3157]
  - - [64, 2368, 1, 16]
    - [15, 346.405]
  - - [64, 2368, 1, 32]
    - [23, 692.809]
  - - [320, 2368, 1, 1]
    - [27, 79.7642]
  - - [320, 2368, 1, 16]
    - [9, 1212.42]
  - - [320, 2368, 1, 32]
    - [42, 2108.55]
  - - [576, 2368, 1, 1]
    - [61, 123.997]
  - - [576, 2368, 1, 16]
    - [14, 1745.88]
  - - [576, 2368, 1, 32]
    - [38, 3637.25]
  - - [832, 2368, 1, 1]
    - [26, 131.345]
  - - [832, 2368, 1, 16]
    - [61, 2101.52]
  - - [832, 2368, 1, 32]
    - [81, 4067.46]
  - - [1088, 2368, 1, 1]
    - [38, 156.144]
  - - [1088, 2368, 1, 16]
    - [14, 2576.38]
  - - [1088, 2368, 1, 32]
    - [61, 5152.77]
  - - [1344, 2368, 1, 1]
    - [38, 159.13]
  - - [1344, 2368, 1, 16]
    - [61, 2828.97]
  - - [1344, 2368, 1, 32]
    - [61, 5360.15]
  - - [1600, 2368, 1, 1]
    - [14, 180.419]
  - - [1600, 2368, 1, 16]
    - [82, 2819.57]
  - - [1600, 2368, 1, 32]
    - [37, 5639.14]
  - - [1856, 2368, 1, 1]
    - [61, 204.419]
  - - [1856, 2368, 1, 16]
    - [53, 3057.4]
  - - [2112, 2368, 1, 1]
    - [37, 204.131]
  - - [2112, 2368, 1, 16]
    - [37, 3405.08]
  - - [2368, 2368, 1, 1]
    - [14, 215.67]
  - - [2368, 2368, 1, 16]
    - [82, 3385.61]
  - - [2624, 2368, 1, 1]
    - [38, 214.263]
  - - [2624, 2368, 1, 16]
    - [37, 3615.2]
  - - [2880, 2368, 1, 1]
    - [14, 231.181]
  - - [2880, 2368, 1, 16]
    - [37, 3698.9]
  - - [3136, 2368, 1, 1]
    - [38, 243.477]
  - - [3136, 2368, 1, 16]
    - [37, 3832.8]
  - - [3392, 2368, 1, 1]
    - [38, 247.146]
  - - [3648, 2368, 1, 1]
    - [14, 239.957]
  - - [3904, 2368, 1, 1]
    - [14, 260.413]
  - - [1, 2624, 1, 64]
    - [43, 22.3915]
  - - [16, 2624, 1, 64]
    - [17, 447.829]
  - - [32, 2624, 1, 64]
    - [15, 826.762]
  - - [1, 2624, 1, 1]
    - [16, 0.437333]
  - - [1, 2624, 1, 16]
    - [17, 6.45908]
  - - [1, 2624, 1, 32]
    - [15, 12.9182]
  - - [16, 2624, 1, 1]
    - [26, 5.99771]
  - - [16, 2624, 1, 16]
    - [16, 95.9634]
  - - [16, 2624, 1, 32]
    - [39, 191.927]
  - - [32, 2624, 1, 1]
    - [15, 11.9954]
  - - [32, 2624, 1, 16]
    - [15, 191.927]
  - - [32, 2624, 1, 32]
    - [17, 413.381]
  - - [64, 2624, 1, 1]
    - [23, 22.3915]
  - - [64, 2624, 1, 16]
    - [10, 413.381]
  - - [64, 2624, 1, 32]
    - [24, 767.707]
  - - [320, 2624, 1, 1]
    - [26, 79.9695]
  - - [320, 2624, 1, 16]
    - [61, 1414.2]
  - - [320, 2624, 1, 32]
    - [61, 2828.4]
  - - [576, 2624, 1, 1]
    - [61, 120.914]
  - - [576, 2624, 1, 16]
    - [61, 2102.85]
  - - [576, 2624, 1, 32]
    - [61, 4030.46]
  - - [832, 2624, 1, 1]
    - [14, 136.448]
  - - [832, 2624, 1, 16]
    - [9, 2117.01]
  - - [832, 2624, 1, 32]
    - [14, 4366.34]
  - - [1088, 2624, 1, 1]
    - [14, 173.025]
  - - [1088, 2624, 1, 16]
    - [14, 2768.4]
  - - [1088, 2624, 1, 32]
    - [61, 5373.95]
  - - [1344, 2624, 1, 1]
    - [61, 185.613]
  - - [1344, 2624, 1, 16]
    - [14, 2821.32]
  - - [1344, 2624, 1, 32]
    - [61, 5505.02]
  - - [1600, 2624, 1, 1]
    - [61, 204.8]
  - - [1600, 2624, 1, 16]
    - [14, 3198.78]
  - - [1856, 2624, 1, 1]
    - [61, 207.24]
  - - [1856, 2624, 1, 16]
    - [14, 3246.76]
  - - [2112, 2624, 1, 1]
    - [14, 217.329]
  - - [2112, 2624, 1, 16]
    - [38, 3284.08]
  - - [2368, 2624, 1, 1]
    - [14, 225.95]
  - - [2368, 2624, 1, 16]
    - [37, 3615.2]
  - - [2624, 2624, 1, 1]
    - [14, 222.109]
  - - [2624, 2624, 1, 16]
    - [14, 3734.44]
  - - [2880, 2624, 1, 1]
    - [38, 239.909]
  - - [2880, 2624, 1, 16]
    - [14, 3609.37]
  - - [3136, 2624, 1, 1]
    - [37, 245.638]
  - - [3392, 2624, 1, 1]
    - [53, 254.303]
  - - [3648, 2624, 1, 1]
    - [14, 258.712]
  - - [3904, 2624, 1, 1]
    - [14, 259.344]
  - - [1, 2880, 1, 64]
    - [16, 26.3314]
  - - [16, 2880, 1, 64]
    - [10, 421.303]
  - - [32, 2880, 1, 64]
    - [15, 842.606]
  - - [1, 2880, 1, 1]
    - [54, 0.384]
  - - [1, 2880, 1, 16]
    - [39, 6.58286]
  - - [1, 2880, 1, 32]
    - [23, 12.288]
  - - [16, 2880, 1, 1]
    - [16, 7.08923]
  - - [16, 2880, 1, 16]
    - [16, 122.88]
  - - [16, 2880, 1, 32]
    - [54, 210.651]
  - - [32, 2880, 1, 1]
    - [39, 14.1785]
  - - [32, 2880, 1, 16]
    - [17, 226.855]
  - - [32, 2880, 1, 32]
    - [36, 368.64]
  - - [64, 2880, 1, 1]
    - [47, 24.576]
  - - [64, 2880, 1, 16]
    - [10, 393.216]
  - - [64, 2880, 1, 32]
    - [27, 983.04]
  - - [320, 2880, 1, 1]
    - [41, 87.7714]
  - - [320, 2880, 1, 16]
    - [26, 1340.51]
  - - [320, 2880, 1, 32]
    - [24, 2564.45]
  - - [576, 2880, 1, 1]
    - [61, 122.88]
  - - [576, 2880, 1, 16]
    - [3, 1830.49]
  - - [576, 2880, 1, 32]
    - [61, 4083.4]
  - - [832, 2880, 1, 1]
    - [3, 136.923]
  - - [832, 2880, 1, 16]
    - [14, 2255.21]
  - - [832, 2880, 1, 32]
    - [61, 4792.32]
  - - [1088, 2880, 1, 1]
    - [61, 174.08]
  - - [1088, 2880, 1, 16]
    - [61, 2785.28]
  - - [1088, 2880, 1, 32]
    - [61, 5142.06]
  - - [1344, 2880, 1, 1]
    - [38, 188.816]
  - - [1344, 2880, 1, 16]
    - [53, 2949.12]
  - - [1344, 2880, 1, 32]
    - [38, 5761.07]
  - - [1600, 2880, 1, 1]
    - [37, 209.455]
  - - [1600, 2880, 1, 16]
    - [38, 3351.27]
  - - [1856, 2880, 1, 1]
    - [38, 218.175]
  - - [1856, 2880, 1, 16]
    - [14, 3353.9]
  - - [2112, 2880, 1, 1]
    - [14, 217.234]
  - - [2112, 2880, 1, 16]
    - [14, 3538.94]
  - - [2368, 2880, 1, 1]
    - [37, 227.328]
  - - [2368, 2880, 1, 16]
    - [38, 3637.25]
  - - [2624, 2880, 1, 1]
    - [53, 243.778]
  - - [2624, 2880, 1, 16]
    - [14, 3778.56]
  - - [2880, 2880, 1, 1]
    - [14, 243.953]
  - - [3136, 2880, 1, 1]
    - [37, 254.414]
  - - [3392, 2880, 1, 1]
    - [14, 244.224]
  - - [3648, 2880, 1, 1]
    - [38, 262.656]
  - - [3904, 2880, 1, 1]
    - [38, 264.553]
  - - [1, 3136, 1, 64]
    - [102, 23.6122]
  - - [16, 3136, 1, 64]
    - [15, 494.041]
  - - [32, 3136, 1, 64]
    - [39, 856.337]
  - - [1, 3136, 1, 1]
    - [39, 0.448]
  - - [1, 3136, 1, 16]
    - [46, 7.168]
  - - [1, 3136, 1, 32]
    - [102, 14.336]
  - - [16, 3136, 1, 1]
    - [21, 7.168]
  - - [16, 3136, 1, 16]
    - [39, 107.042]
  - - [16, 3136, 1, 32]
    - [16, 267.605]
  - - [32, 3136, 1, 1]
    - [15, 15.4388]
  - - [32, 3136, 1, 16]
    - [15, 247.02]
  - - [32, 3136, 1, 32]
    - [15, 494.041]
  - - [64, 3136, 1, 1]
    - [47, 33.4507]
  - - [64, 3136, 1, 16]
    - [24, 494.041]
  - - [64, 3136, 1, 32]
    - [26, 856.337]
  - - [320, 3136, 1, 1]
    - [61, 95.5733]
  - - [320, 3136, 1, 16]
    - [61, 1529.17]
  - - [320, 3136, 1, 32]
    - [61, 3211.26]
  - - [576, 3136, 1, 1]
    - [81, 129.024]
  - - [576, 3136, 1, 16]
    - [50, 2064.38]
  - - [576, 3136, 1, 32]
    - [31, 3853.52]
  - - [832, 3136, 1, 1]
    - [61, 163.072]
  - - [832, 3136, 1, 16]
    - [14, 2385.51]
  - - [832, 3136, 1, 32]
    - [53, 5060.17]
  - - [1088, 3136, 1, 1]
    - [61, 179.577]
  - - [1088, 3136, 1, 16]
    - [14, 2729.57]
  - - [1088, 3136, 1, 32]
    - [61, 5459.15]
  - - [1344, 3136, 1, 1]
    - [37, 200.704]
  - - [1344, 3136, 1, 16]
    - [14, 3211.26]
  - - [1600, 3136, 1, 1]
    - [82, 200.704]
  - - [1600, 3136, 1, 16]
    - [14, 3211.26]
  - - [1856, 3136, 1, 1]
    - [38, 223.862]
  - - [1856, 3136, 1, 16]
    - [14, 3514.21]
  - - [2112, 3136, 1, 1]
    - [14, 232.394]
  - - [2112, 3136, 1, 16]
    - [14, 3654.2]
  - - [2368, 3136, 1, 1]
    - [14, 243.477]
  - - [2368, 3136, 1, 16]
    - [14, 3600.51]
  - - [2624, 3136, 1, 1]
    - [14, 245.638]
  - - [2880, 3136, 1, 1]
    - [14, 254.414]
  - - [3136, 3136, 1, 1]
    - [82, 239.866]
  - - [3392, 3136, 1, 1]
    - [37, 262.65]
  - - [3648, 3136, 1, 1]
    - [53, 257.082]
  - - [3904, 3136, 1, 1]
    - [37, 269.076]
  - - [1, 3392, 1, 64]
    - [39, 28.9451]
  - - [16, 3392, 1, 64]
    - [16, 496.201]
  - - [32, 3392, 1, 64]
    - [39, 926.242]
  - - [1, 3392, 1, 1]
    - [46, 0.484571]
  - - [1, 3392, 1, 16]
    - [23, 7.23627]
  - - [1, 3392, 1, 32]
    - [10, 14.4725]
  - - [16, 3392, 1, 1]
    - [16, 7.75314]
  - - [16, 3392, 1, 16]
    - [54, 115.78]
  - - [16, 3392, 1, 32]
    - [41, 267.185]
  - - [32, 3392, 1, 1]
    - [15, 14.4725]
  - - [32, 3392, 1, 16]
    - [21, 248.101]
  - - [32, 3392, 1, 32]
    - [27, 496.201]
  - - [64, 3392, 1, 1]
    - [39, 31.0126]
  - - [64, 3392, 1, 16]
    - [26, 534.37]
  - - [64, 3392, 1, 32]
    - [27, 1068.74]
  - - [320, 3392, 1, 1]
    - [26, 98.6764]
  - - [320, 3392, 1, 16]
    - [61, 1736.7]
  - - [320, 3392, 1, 32]
    - [61, 3473.41]
  - - [576, 3392, 1, 1]
    - [61, 134.744]
  - - [576, 3392, 1, 16]
    - [61, 2084.04]
  - - [576, 3392, 1, 32]
    - [36, 3789.17]
  - - [832, 3392, 1, 1]
    - [14, 166.008]
  - - [832, 3392, 1, 16]
    - [61, 2822.14]
  - - [832, 3392, 1, 32]
    - [38, 4881.55]
  - - [1088, 3392, 1, 1]
    - [61, 189.256]
  - - [1088, 3392, 1, 16]
    - [61, 2880.39]
  - - [1088, 3392, 1, 32]
    - [53, 5248.71]
  - - [1344, 3392, 1, 1]
    - [38, 202.615]
  - - [1344, 3392, 1, 16]
    - [37, 3241.85]
  - - [1600, 3392, 1, 1]
    - [38, 212.831]
  - - [1600, 3392, 1, 16]
    - [61, 3216.12]
  - - [1856, 3392, 1, 1]
    - [14, 224.841]
  - - [1856, 3392, 1, 16]
    - [38, 3662.87]
  - - [2112, 3392, 1, 1]
    - [14, 223.872]
  - - [2112, 3392, 1, 16]
    - [37, 3697.5]
  - - [2368, 3392, 1, 1]
    - [38, 243.402]
  - - [2624, 3392, 1, 1]
    - [14, 250.721]
  - - [2880, 3392, 1, 1]
    - [14, 247.315]
  - - [3136, 3392, 1, 1]
    - [14, 253.269]
  - - [3392, 3392, 1, 1]
    - [14, 252.872]
  - - [3648, 3392, 1, 1]
    - [14, 260.506]
  - - [3904, 3392, 1, 1]
    - [38, 254.661]
  - - [1, 3648, 1, 64]
    - [39, 31.1296]
  - - [16, 3648, 1, 64]
    - [17, 622.592]
  - - [32, 3648, 1, 64]
    - [10, 933.888]
  - - [1, 3648, 1, 1]
    - [15, 0.608]
  - - [1, 3648, 1, 16]
    - [24, 8.33829]
  - - [1, 3648, 1, 32]
    - [17, 19.456]
  - - [16, 3648, 1, 1]
    - [23, 7.7824]
  - - [16, 3648, 1, 16]
    - [15, 143.675]
  - - [16, 3648, 1, 32]
    - [98, 249.037]
  - - [32, 3648, 1, 1]
    - [21, 16.6766]
  - - [32, 3648, 1, 16]
    - [42, 287.35]
  - - [32, 3648, 1, 32]
    - [39, 498.074]
  - - [64, 3648, 1, 1]
    - [42, 35.9188]
  - - [64, 3648, 1, 16]
    - [41, 574.7]
  - - [64, 3648, 1, 32]
    - [21, 1149.4]
  - - [320, 3648, 1, 1]
    - [61, 106.124]
  - - [320, 3648, 1, 16]
    - [56, 1494.22]
  - - [320, 3648, 1, 32]
    - [27, 3248.31]
  - - [576, 3648, 1, 1]
    - [14, 135.564]
  - - [576, 3648, 1, 16]
    - [61, 2241.33]
  - - [576, 3648, 1, 32]
    - [14, 4075.15]
  - - [832, 3648, 1, 1]
    - [61, 178.537]
  - - [832, 3648, 1, 16]
    - [61, 2697.9]
  - - [832, 3648, 1, 32]
    - [61, 5111.81]
  - - [1088, 3648, 1, 1]
    - [38, 193.611]
  - - [1088, 3648, 1, 16]
    - [14, 2953.69]
  - - [1344, 3648, 1, 1]
    - [14, 200.119]
  - - [1344, 3648, 1, 16]
    - [61, 3338.15]
  - - [1600, 3648, 1, 1]
    - [14, 220.257]
  - - [1600, 3648, 1, 16]
    - [38, 3524.11]
  - - [1856, 3648, 1, 1]
    - [38, 233.472]
  - - [1856, 3648, 1, 16]
    - [37, 3672.24]
  - - [2112, 3648, 1, 1]
    - [14, 244.59]
  - - [2112, 3648, 1, 16]
    - [14, 3679.8]
  - - [2368, 3648, 1, 1]
    - [38, 246.813]
  - - [2624, 3648, 1, 1]
    - [14, 258.712]
  - - [2880, 3648, 1, 1]
    - [14, 262.656]
  - - [3136, 3648, 1, 1]
    - [38, 262.991]
  - - [3392, 3648, 1, 1]
    - [14, 263.277]
  - - [3648, 3648, 1, 1]
    - [14, 253.484]
  - - [3904, 3648, 1, 1]
    - [14, 258.942]
  - - [1, 3904, 1, 64]
    - [102, 35.6937]
  - - [16, 3904, 1, 64]
    - [39, 499.712]
  - - [32, 3904, 1, 64]
    - [15, 1230.06]
  - - [1, 3904, 1, 1]
    - [16, 0.600615]
  - - [1, 3904, 1, 16]
    - [97, 8.32853]
  - - [1, 3904, 1, 32]
    - [21, 16.6571]
  - - [16, 3904, 1, 1]
    - [16, 8.92343]
  - - [16, 3904, 1, 16]
    - [15, 133.257]
  - - [16, 3904, 1, 32]
    - [63, 249.856]
  - - [32, 3904, 1, 1]
    - [15, 17.8469]
  - - [32, 3904, 1, 16]
    - [39, 235.159]
  - - [32, 3904, 1, 32]
    - [13, 499.712]
  - - [64, 3904, 1, 1]
    - [24, 31.232]
  - - [64, 3904, 1, 16]
    - [31, 499.712]
  - - [64, 3904, 1, 32]
    - [39, 999.424]
  - - [320, 3904, 1, 1]
    - [61, 118.979]
  - - [320, 3904, 1, 16]
    - [31, 1738.13]
  - - [320, 3904, 1, 32]
    - [35, 3476.26]
  - - [576, 3904, 1, 1]
    - [5, 136.285]
  - - [576, 3904, 1, 16]
    - [14, 2248.7]
  - - [576, 3904, 1, 32]
    - [14, 3997.7]
  - - [832, 3904, 1, 1]
    - [61, 166.571]
  - - [832, 3904, 1, 16]
    - [61, 2735.27]
  - - [832, 3904, 1, 32]
    - [61, 5197.0]
  - - [1088, 3904, 1, 1]
    - [14, 197.561]
  - - [1088, 3904, 1, 16]
    - [37, 3236.23]
  - - [1344, 3904, 1, 1]
    - [37, 209.879]
  - - [1344, 3904, 1, 16]
    - [53, 3426.6]
  - - [1600, 3904, 1, 1]
    - [37, 231.348]
  - - [1600, 3904, 1, 16]
    - [14, 3569.37]
  - - [1856, 3904, 1, 1]
    - [37, 233.736]
  - - [1856, 3904, 1, 16]
    - [81, 3622.91]
  - - [2112, 3904, 1, 1]
    - [53, 246.127]
  - - [2368, 3904, 1, 1]
    - [14, 243.281]
  - - [2624, 3904, 1, 1]
    - [14, 259.344]
  - - [2880, 3904, 1, 1]
    - [14, 267.703]
  - - [3136, 3904, 1, 1]
    - [14, 263.289]
  - - [3392, 3904, 1, 1]
    - [14, 267.523]
  - - [3648, 3904, 1, 1]
    - [14, 258.942]
  - - [3904, 3904, 1, 1]
    - [14, 277.113]
  - - [64, 1, 1, 256]
    - [18, 2.34057]
  - - [64, 16, 1, 256]
    - [21, 40.3298]
  - - [64, 32, 1, 256]
    - [26, 69.9051]
  - - [1, 64, 1, 256]
    - [85, 2.52062]
  - - [16, 64, 1, 256]
    - [17, 37.4491]
  - - [32, 64, 1, 256]
    - [102, 80.6597]
  - - [320, 1, 1, 256]
    - [62, 12.6031]
  - - [320, 16, 1, 256]
    - [39, 187.246]
  - - [320, 32, 1, 256]
    - [39, 374.491]
  - - [576, 1, 1, 256]
    - [39, 21.0651]
  - - [576, 16, 1, 256]
    - [39, 314.573]
  - - [576, 32, 1, 256]
    - [21, 674.085]
  - - [832, 1, 1, 256]
    - [10, 30.4274]
  - - [832, 16, 1, 256]
    - [10, 524.288]
  - - [832, 32, 1, 256]
    - [17, 1135.96]
  - - [1088, 1, 1, 256]
    - [10, 39.7897]
  - - [1088, 16, 1, 256]
    - [10, 594.193]
  - - [1088, 32, 1, 256]
    - [17, 1485.48]
  - - [1344, 1, 1, 256]
    - [10, 49.152]
  - - [1344, 16, 1, 256]
    - [39, 734.003]
  - - [1344, 32, 1, 256]
    - [21, 1468.01]
  - - [1600, 1, 1, 256]
    - [21, 54.6133]
  - - [1600, 16, 1, 256]
    - [17, 1008.25]
  - - [1600, 32, 1, 256]
    - [17, 1872.46]
  - - [1856, 1, 1, 256]
    - [10, 59.392]
  - - [1856, 16, 1, 256]
    - [17, 1086.03]
  - - [1856, 32, 1, 256]
    - [21, 2172.05]
  - - [2112, 1, 1, 256]
    - [10, 67.584]
  - - [2112, 16, 1, 256]
    - [11, 1081.34]
  - - [2112, 32, 1, 256]
    - [39, 2306.87]
  - - [2368, 1, 1, 256]
    - [44, 86.6011]
  - - [2368, 16, 1, 256]
    - [86, 1293.24]
  - - [2368, 32, 1, 256]
    - [17, 2771.24]
  - - [2624, 1, 1, 256]
    - [39, 83.968]
  - - [2624, 16, 1, 256]
    - [63, 1343.49]
  - - [2624, 32, 1, 256]
    - [17, 2866.11]
  - - [2880, 1, 1, 256]
    - [40, 92.16]
  - - [2880, 16, 1, 256]
    - [17, 1572.86]
  - - [2880, 32, 1, 256]
    - [22, 2775.64]
  - - [3136, 1, 1, 256]
    - [17, 107.042]
  - - [3136, 16, 1, 256]
    - [21, 1712.67]
  - - [3136, 32, 1, 256]
    - [39, 3022.37]
  - - [3392, 1, 1, 256]
    - [102, 115.78]
  - - [3392, 16, 1, 256]
    - [39, 1634.54]
  - - [3392, 32, 1, 256]
    - [19, 3087.47]
  - - [3648, 1, 1, 256]
    - [39, 109.869]
  - - [3648, 16, 1, 256]
    - [17, 1867.78]
  - - [3648, 32, 1, 256]
    - [21, 3735.55]
  - - [3904, 1, 1, 256]
    - [17, 124.928]
  - - [3904, 16, 1, 256]
    - [63, 1998.85]
  - - [3904, 32, 1, 256]
    - [115, 3762.54]
  - - [1, 320, 1, 256]
    - [16, 13.6533]
  - - [16, 320, 1, 256]
    - [16, 218.453]
  - - [32, 320, 1, 256]
    - [16, 436.907]
  - - [1, 576, 1, 256]
    - [16, 21.0651]
  - - [16, 576, 1, 256]
    - [18, 362.969]
  - - [32, 576, 1, 256]
    - [16, 786.432]
  - - [1, 832, 1, 256]
    - [17, 30.4274]
  - - [16, 832, 1, 256]
    - [39, 486.839]
  - - [32, 832, 1, 256]
    - [15, 1048.58]
  - - [1, 1088, 1, 256]
    - [16, 39.7897]
  - - [16, 1088, 1, 256]
    - [23, 594.193]
  - - [32, 1088, 1, 256]
    - [39, 1273.27]
  - - [1, 1344, 1, 256]
    - [92, 45.8752]
  - - [16, 1344, 1, 256]
    - [15, 734.003]
  - - [32, 1344, 1, 256]
    - [16, 1693.85]
  - - [1, 1600, 1, 256]
    - [92, 58.5143]
  - - [16, 1600, 1, 256]
    - [20, 873.813]
  - - [32, 1600, 1, 256]
    - [11, 1872.46]
  - - [1, 1856, 1, 256]
    - [21, 59.392]
  - - [16, 1856, 1, 256]
    - [17, 1086.03]
  - - [32, 1856, 1, 256]
    - [39, 2027.25]
  - - [1, 2112, 1, 256]
    - [18, 77.2389]
  - - [16, 2112, 1, 256]
    - [11, 1081.34]
  - - [32, 2112, 1, 256]
    - [10, 2162.69]
  - - [1, 2368, 1, 256]
    - [16, 93.2628]
  - - [16, 2368, 1, 256]
    - [15, 1385.62]
  - - [32, 2368, 1, 256]
    - [15, 2586.49]
  - - [1, 2624, 1, 256]
    - [15, 89.5659]
  - - [16, 2624, 1, 256]
    - [10, 1264.46]
  - - [32, 2624, 1, 256]
    - [15, 2866.11]
  - - [1, 2880, 1, 256]
    - [115, 86.7388]
  - - [16, 2880, 1, 256]
    - [16, 1387.82]
  - - [32, 2880, 1, 256]
    - [42, 2949.12]
  - - [1, 3136, 1, 256]
    - [17, 114.688]
  - - [16, 3136, 1, 256]
    - [39, 1427.23]
  - - [32, 3136, 1, 256]
    - [46, 3425.35]
  - - [1, 3392, 1, 256]
    - [16, 124.05]
  - - [16, 3392, 1, 256]
    - [15, 1736.7]
  - - [32, 3392, 1, 256]
    - [15, 3704.97]
  - - [1, 3648, 1, 256]
    - [16, 133.413]
  - - [16, 3648, 1, 256]
    - [23, 1660.25]
  - - [32, 3648, 1, 256]
    - [115, 3515.81]
  - - [1, 3904, 1, 256]
    - [17, 142.775]
  - - [16, 3904, 1, 256]
    - [98, 1881.27]
  - - [32, 3904, 1, 256]
    - [26, 3366.48]
  - - [64, 1, 1, 512]
    - [16, 5.04123]
  - - [64, 16, 1, 512]
    - [17, 74.8983]
  - - [64, 32, 1, 512]
    - [108, 149.797]
  - - [1, 64, 1, 512]
    - [109, 4.68114]
  - - [16, 64, 1, 512]
    - [40, 80.6597]
  - - [32, 64, 1, 512]
    - [18, 149.797]
  - - [320, 1, 1, 512]
    - [39, 21.8453]
  - - [320, 16, 1, 512]
    - [10, 374.491]
  - - [320, 32, 1, 512]
    - [16, 699.051]
  - - [576, 1, 1, 512]
    - [114, 39.3216]
  - - [576, 16, 1, 512]
    - [40, 674.085]
  - - [576, 32, 1, 512]
    - [62, 1451.87]
  - - [832, 1, 1, 512]
    - [86, 53.248]
  - - [832, 16, 1, 512]
    - [19, 973.678]
  - - [832, 32, 1, 512]
    - [86, 1947.36]
  - - [1088, 1, 1, 512]
    - [40, 69.632]
  - - [1088, 16, 1, 512]
    - [39, 1048.58]
  - - [1088, 32, 1, 512]
    - [62, 2376.77]
  - - [1344, 1, 1, 512]
    - [93, 80.9562]
  - - [1344, 16, 1, 512]
    - [98, 1295.3]
  - - [1344, 32, 1, 512]
    - [11, 2590.6]
  - - [1600, 1, 1, 512]
    - [19, 96.3765]
  - - [1600, 16, 1, 512]
    - [17, 1542.02]
  - - [1600, 32, 1, 512]
    - [64, 2912.71]
  - - [1856, 1, 1, 512]
    - [40, 111.797]
  - - [1856, 16, 1, 512]
    - [10, 1689.37]
  - - [1856, 32, 1, 512]
    - [19, 3577.49]
  - - [2112, 1, 1, 512]
    - [19, 120.149]
  - - [2112, 16, 1, 512]
    - [118, 1922.39]
  - - [2112, 32, 1, 512]
    - [22, 3642.42]
  - - [2368, 1, 1, 512]
    - [19, 127.623]
  - - [2368, 16, 1, 512]
    - [19, 2041.96]
  - - [2368, 32, 1, 512]
    - [107, 3879.73]
  - - [2624, 1, 1, 512]
    - [39, 127.951]
  - - [2624, 16, 1, 512]
    - [100, 2149.58]
  - - [2624, 32, 1, 512]
    - [63, 3582.63]
  - - [2880, 1, 1, 512]
    - [17, 140.434]
  - - [2880, 16, 1, 512]
    - [93, 2359.3]
  - - [2880, 32, 1, 512]
    - [22, 4493.9]
  - - [3136, 1, 1, 512]
    - [40, 152.917]
  - - [3136, 16, 1, 512]
    - [22, 2335.46]
  - - [3136, 32, 1, 512]
    - [40, 4893.35]
  - - [3392, 1, 1, 512]
    - [86, 157.882]
  - - [3392, 16, 1, 512]
    - [112, 2646.41]
  - - [3392, 32, 1, 512]
    - [22, 5052.23]
  - - [3648, 1, 1, 512]
    - [107, 186.778]
  - - [3648, 16, 1, 512]
    - [100, 2846.13]
  - - [3648, 32, 1, 512]
    - [23, 5197.29]
  - - [3904, 1, 1, 512]
    - [86, 166.571]
  - - [3904, 16, 1, 512]
    - [118, 3045.86]
  - - [3904, 32, 1, 512]
    - [19, 5117.05]
  - - [1, 320, 1, 512]
    - [16, 23.4057]
  - - [16, 320, 1, 512]
    - [18, 374.491]
  - - [32, 320, 1, 512]
    - [62, 873.813]
  - - [1, 576, 1, 512]
    - [118, 42.1303]
  - - [16, 576, 1, 512]
    - [39, 629.146]
  - - [32, 576, 1, 512]
    - [23, 1258.29]
  - - [1, 832, 1, 512]
    - [16, 65.536]
  - - [16, 832, 1, 512]
    - [16, 1048.58]
  - - [32, 832, 1, 512]
    - [15, 1817.53]
  - - [1, 1088, 1, 512]
    - [16, 85.7009]
  - - [16, 1088, 1, 512]
    - [64, 1188.39]
  - - [32, 1088, 1, 512]
    - [21, 2376.77]
  - - [1, 1344, 1, 512]
    - [15, 98.304]
  - - [16, 1344, 1, 512]
    - [15, 1376.26]
  - - [32, 1344, 1, 512]
    - [102, 2752.51]
  - - [1, 1600, 1, 512]
    - [17, 117.029]
  - - [16, 1600, 1, 512]
    - [16, 1872.46]
  - - [32, 1600, 1, 512]
    - [15, 3744.91]
  - - [1, 1856, 1, 512]
    - [17, 135.753]
  - - [16, 1856, 1, 512]
    - [16, 2027.25]
  - - [32, 1856, 1, 512]
    - [11, 3801.09]
  - - [1, 2112, 1, 512]
    - [63, 154.478]
  - - [16, 2112, 1, 512]
    - [63, 2471.64]
  - - [32, 2112, 1, 512]
    - [64, 3844.78]
  - - [1, 2368, 1, 512]
    - [63, 161.655]
  - - [16, 2368, 1, 512]
    - [39, 2041.96]
  - - [32, 2368, 1, 512]
    - [23, 4083.93]
  - - [1, 2624, 1, 512]
    - [17, 167.936]
  - - [16, 2624, 1, 512]
    - [16, 2866.11]
  - - [32, 2624, 1, 512]
    - [85, 4776.85]
  - - [1, 2880, 1, 512]
    - [115, 184.32]
  - - [16, 2880, 1, 512]
    - [15, 2621.44]
  - - [32, 2880, 1, 512]
    - [64, 5242.88]
  - - [1, 3136, 1, 512]
    - [17, 160.563]
  - - [16, 3136, 1, 512]
    - [97, 3022.37]
  - - [32, 3136, 1, 512]
    - [45, 6044.73]
  - - [1, 3392, 1, 512]
    - [102, 217.088]
  - - [16, 3392, 1, 512]
    - [17, 3473.41]
  - - [32, 3392, 1, 512]
    - [45, 6538.18]
  - - [1, 3648, 1, 512]
    - [45, 219.738]
  - - [16, 3648, 1, 512]
    - [111, 3735.55]
  - - [32, 3648, 1, 512]
    - [45, 7031.63]
  - - [1, 3904, 1, 512]
    - [17, 249.856]
  - - [16, 3904, 1, 512]
    - [17, 3997.7]
  - - [32, 3904, 1, 512]
    - [54, 7525.07]
  - - [64, 1, 1, 1024]
    - [62, 9.36229]
  - - [64, 16, 1, 1024]
    - [86, 139.81]
  - - [64, 32, 1, 1024]
    - [40, 262.144]
  - - [1, 64, 1, 1024]
    - [62, 9.36229]
  - - [16, 64, 1, 1024]
    - [16, 139.81]
  - - [32, 64, 1, 1024]
    - [16, 279.62]
  - - [320, 1, 1, 1024]
    - [62, 43.6907]
  - - [320, 16, 1, 1024]
    - [118, 655.36]
  - - [320, 32, 1, 1024]
    - [86, 1233.62]
  - - [576, 1, 1, 1024]
    - [62, 62.0867]
  - - [576, 16, 1, 1024]
    - [20, 1110.26]
  - - [576, 32, 1, 1024]
    - [16, 2220.51]
  - - [832, 1, 1, 1024]
    - [19, 94.6631]
  - - [832, 16, 1, 1024]
    - [112, 1434.89]
  - - [832, 32, 1, 1024]
    - [10, 2726.3]
  - - [1088, 1, 1, 1024]
    - [63, 117.275]
  - - [1088, 16, 1, 1024]
    - [62, 1782.58]
  - - [1088, 32, 1, 1024]
    - [39, 3100.14]
  - - [1344, 1, 1, 1024]
    - [22, 125.114]
  - - [1344, 16, 1, 1024]
    - [21, 2001.83]
  - - [1344, 32, 1, 1024]
    - [23, 3387.71]
  - - [1600, 1, 1, 1024]
    - [118, 131.072]
  - - [1600, 16, 1, 1024]
    - [86, 2279.51]
  - - [1600, 32, 1, 1024]
    - [10, 4194.3]
  - - [1856, 1, 1, 1024]
    - [118, 146.196]
  - - [1856, 16, 1, 1024]
    - [19, 2534.06]
  - - [1856, 32, 1, 1024]
    - [19, 4865.39]
  - - [2112, 1, 1, 1024]
    - [106, 160.199]
  - - [2112, 16, 1, 1024]
    - [110, 2883.58]
  - - [2112, 32, 1, 1024]
    - [19, 5536.48]
  - - [2368, 1, 1, 1024]
    - [109, 186.526]
  - - [2368, 16, 1, 1024]
    - [105, 3103.78]
  - - [2368, 32, 1, 1024]
    - [108, 5968.82]
  - - [2624, 1, 1, 1024]
    - [105, 185.309]
  - - [2624, 16, 1, 1024]
    - [93, 3070.83]
  - - [2624, 32, 1, 1024]
    - [62, 6141.66]
  - - [2880, 1, 1, 1024]
    - [105, 196.608]
  - - [2880, 16, 1, 1024]
    - [105, 3495.25]
  - - [2880, 32, 1, 1024]
    - [62, 6088.51]
  - - [3136, 1, 1, 1024]
    - [93, 221.466]
  - - [3136, 16, 1, 1024]
    - [105, 3543.46]
  - - [3136, 32, 1, 1024]
    - [106, 6629.71]
  - - [3392, 1, 1, 1024]
    - [118, 224.091]
  - - [3392, 16, 1, 1024]
    - [79, 3585.45]
  - - [3392, 32, 1, 1024]
    - [19, 6736.31]
  - - [3648, 1, 1, 1024]
    - [93, 233.472]
  - - [3648, 16, 1, 1024]
    - [105, 3856.05]
  - - [3648, 32, 1, 1024]
    - [108, 7471.1]
  - - [3904, 1, 1, 1024]
    - [79, 235.159]
  - - [3904, 16, 1, 1024]
    - [105, 4411.25]
  - - [1, 320, 1, 1024]
    - [16, 46.8114]
  - - [16, 320, 1, 1024]
    - [16, 699.051]
  - - [32, 320, 1, 1024]
    - [20, 1497.97]
  - - [1, 576, 1, 1024]
    - [64, 73.728]
  - - [16, 576, 1, 1024]
    - [16, 1348.17]
  - - [32, 576, 1, 1024]
    - [113, 2516.58]
  - - [1, 832, 1, 1024]
    - [63, 106.496]
  - - [16, 832, 1, 1024]
    - [16, 1947.36]
  - - [32, 832, 1, 1024]
    - [62, 3407.87]
  - - [1, 1088, 1, 1024]
    - [16, 148.548]
  - - [16, 1088, 1, 1024]
    - [112, 2097.15]
  - - [32, 1088, 1, 1024]
    - [16, 4194.3]
  - - [1, 1344, 1, 1024]
    - [16, 172.032]
  - - [16, 1344, 1, 1024]
    - [16, 2752.51]
  - - [32, 1344, 1, 1024]
    - [63, 5505.02]
  - - [1, 1600, 1, 1024]
    - [16, 204.8]
  - - [16, 1600, 1, 1024]
    - [64, 2912.71]
  - - [32, 1600, 1, 1024]
    - [64, 5518.82]
  - - [1, 1856, 1, 1024]
    - [106, 223.593]
  - - [16, 1856, 1, 1024]
    - [99, 3801.09]
  - - [32, 1856, 1, 1024]
    - [45, 6757.49]
  - - [1, 2112, 1, 1024]
    - [16, 240.299]
  - - [16, 2112, 1, 1024]
    - [63, 4070.94]
  - - [32, 2112, 1, 1024]
    - [18, 7284.84]
  - - [1, 2368, 1, 1024]
    - [63, 303.104]
  - - [16, 2368, 1, 1024]
    - [63, 4564.39]
  - - [32, 2368, 1, 1024]
    - [15, 8167.86]
  - - [1, 2624, 1, 1024]
    - [17, 298.553]
  - - [16, 2624, 1, 1024]
    - [17, 4776.85]
  - - [32, 2624, 1, 1024]
    - [15, 8598.32]
  - - [1, 2880, 1, 1024]
    - [17, 256.445]
  - - [16, 2880, 1, 1024]
    - [16, 5242.88]
  - - [32, 2880, 1, 1024]
    - [45, 8987.79]
  - - [1, 3136, 1, 1024]
    - [17, 356.807]
  - - [16, 3136, 1, 1024]
    - [17, 5708.91]
  - - [32, 3136, 1, 1024]
    - [15, 9786.71]
  - - [1, 3392, 1, 1024]
    - [16, 365.622]
  - - [16, 3392, 1, 1024]
    - [16, 5849.95]
  - - [32, 3392, 1, 1024]
    - [15, 8549.93]
  - - [1, 3648, 1, 1024]
    - [17, 373.555]
  - - [16, 3648, 1, 1024]
    - [45, 4980.74]
  - - [32, 3648, 1, 1024]
    - [15, 11953.8]
  - - [1, 3904, 1, 1024]
    - [16, 399.77]
  - - [16, 3904, 1, 1024]
    - [17, 6091.73]
  - - [64, 1, 1, 2048]
    - [16, 15.4202]
  - - [64, 16, 1, 2048]
    - [62, 262.144]
  - - [64, 32, 1, 2048]
    - [62, 524.288]
  - - [1, 64, 1, 2048]
    - [16, 15.4202]
  - - [16, 64, 1, 2048]
    - [62, 246.724]
  - - [32, 64, 1, 2048]
    - [62, 559.241]
  - - [320, 1, 1, 2048]
    - [16, 68.9853]
  - - [320, 16, 1, 2048]
    - [62, 1165.08]
  - - [320, 32, 1, 2048]
    - [62, 2330.17]
  - - [576, 1, 1, 2048]
    - [16, 112.347]
  - - [576, 16, 1, 2048]
    - [62, 1986.78]
  - - [576, 32, 1, 2048]
    - [93, 3282.5]
  - - [832, 1, 1, 2048]
    - [118, 179.362]
  - - [832, 16, 1, 2048]
    - [63, 2596.47]
  - - [832, 32, 1, 2048]
    - [40, 4956.9]
  - - [1088, 1, 1, 2048]
    - [107, 193.759]
  - - [1088, 16, 1, 2048]
    - [79, 2852.13]
  - - [1088, 32, 1, 2048]
    - [64, 5484.86]
  - - [1344, 1, 1, 2048]
    - [105, 211.732]
  - - [1344, 16, 1, 2048]
    - [93, 3670.02]
  - - [1344, 32, 1, 2048]
    - [19, 5682.61]
  - - [1600, 1, 1, 2048]
    - [107, 252.062]
  - - [1600, 16, 1, 2048]
    - [107, 3615.78]
  - - [1600, 32, 1, 2048]
    - [65, 7231.56]
  - - [1856, 1, 1, 2048]
    - [112, 281.562]
  - - [1856, 16, 1, 2048]
    - [19, 4054.49]
  - - [1856, 32, 1, 2048]
    - [19, 7847.41]
  - - [2112, 1, 1, 2048]
    - [100, 279.057]
  - - [2112, 16, 1, 2048]
    - [118, 4772.83]
  - - [2368, 1, 1, 2048]
    - [93, 312.882]
  - - [2368, 16, 1, 2048]
    - [100, 4849.66]
  - - [2624, 1, 1, 2048]
    - [79, 298.553]
  - - [2624, 16, 1, 2048]
    - [79, 5211.1]
  - - [2880, 1, 1, 2048]
    - [93, 327.68]
  - - [2880, 16, 1, 2048]
    - [79, 5551.28]
  - - [3136, 1, 1, 2048]
    - [93, 338.028]
  - - [3136, 16, 1, 2048]
    - [79, 5872.03]
  - - [3392, 1, 1, 2048]
    - [105, 365.622]
  - - [3392, 16, 1, 2048]
    - [105, 5557.45]
  - - [3648, 1, 1, 2048]
    - [118, 383.134]
  - - [3648, 16, 1, 2048]
    - [93, 5831.11]
  - - [3904, 1, 1, 2048]
    - [79, 410.02]
  - - [1, 320, 1, 2048]
    - [16, 77.1012]
  - - [16, 320, 1, 2048]
    - [62, 1310.72]
  - - [32, 320, 1, 2048]
    - [64, 2207.53]
  - - [1, 576, 1, 2048]
    - [62, 138.782]
  - - [16, 576, 1, 2048]
    - [112, 2097.15]
  - - [32, 576, 1, 2048]
    - [62, 3774.87]
  - - [1, 832, 1, 2048]
    - [64, 162.28]
  - - [16, 832, 1, 2048]
    - [16, 3207.41]
  - - [32, 832, 1, 2048]
    - [20, 5739.57]
  - - [1, 1088, 1, 2048]
    - [16, 222.822]
  - - [16, 1088, 1, 2048]
    - [63, 3961.29]
  - - [32, 1088, 1, 2048]
    - [20, 7922.57]
  - - [1, 1344, 1, 2048]
    - [16, 289.738]
  - - [16, 1344, 1, 2048]
    - [105, 4003.65]
  - - [32, 1344, 1, 2048]
    - [63, 8388.61]
  - - [1, 1600, 1, 2048]
    - [63, 344.926]
  - - [16, 1600, 1, 2048]
    - [105, 5242.88]
  - - [32, 1600, 1, 2048]
    - [112, 9986.44]
  - - [1, 1856, 1, 2048]
    - [63, 380.109]
  - - [16, 1856, 1, 2048]
    - [16, 6081.74]
  - - [32, 1856, 1, 2048]
    - [112, 11584.3]
  - - [1, 2112, 1, 2048]
    - [16, 432.538]
  - - [16, 2112, 1, 2048]
    - [63, 6920.6]
  - - [1, 2368, 1, 2048]
    - [16, 421.71]
  - - [16, 2368, 1, 2048]
    - [63, 7389.96]
  - - [1, 2624, 1, 2048]
    - [63, 467.3]
  - - [16, 2624, 1, 2048]
    - [63, 7165.27]
  - - [1, 2880, 1, 2048]
    - [63, 491.52]
  - - [16, 2880, 1, 2048]
    - [63, 6508.4]
  - - [1, 3136, 1, 2048]
    - [17, 428.169]
  - - [16, 3136, 1, 2048]
    - [16, 7340.03]
  - - [1, 3392, 1, 2048]
    - [17, 514.579]
  - - [16, 3392, 1, 2048]
    - [17, 7939.22]
  - - [1, 3648, 1, 2048]
    - [111, 515.249]
  - - [16, 3648, 1, 2048]
    - [17, 8854.64]
  - - [1, 3904, 1, 2048]
    - [16, 551.406]
  - - [64, 1, 1, 4096]
    - [62, 24.9661]
  - - [64, 16, 1, 4096]
    - [109, 399.458]
  - - [64, 32, 1, 4096]
    - [16, 762.601]
  - - [1, 64, 1, 4096]
    - [62, 27.5941]
  - - [16, 64, 1, 4096]
    - [16, 399.458]
  - - [32, 64, 1, 4096]
    - [62, 798.915]
  - - [320, 1, 1, 4096]
    - [118, 113.976]
  - - [320, 16, 1, 4096]
    - [86, 1823.61]
  - - [320, 32, 1, 4096]
    - [16, 3647.22]
  - - [576, 1, 1, 4096]
    - [118, 205.156]
  - - [576, 16, 1, 4096]
    - [62, 3282.5]
  - - [576, 32, 1, 4096]
    - [118, 5592.41]
  - - [832, 1, 1, 4096]
    - [118, 252.435]
  - - [832, 16, 1, 4096]
    - [106, 4038.96]
  - - [832, 32, 1, 4096]
    - [19, 7520.82]
  - - [1088, 1, 1, 4096]
    - [19, 330.107]
  - - [1088, 16, 1, 4096]
    - [100, 4600.2]
  - - [1344, 1, 1, 4096]
    - [107, 344.064]
  - - [1344, 16, 1, 4096]
    - [106, 5338.21]
  - - [1600, 1, 1, 4096]
    - [63, 397.188]
  - - [1600, 16, 1, 4096]
    - [63, 6168.09]
  - - [1856, 1, 1, 4096]
    - [101, 400.115]
  - - [1856, 16, 1, 4096]
    - [86, 6401.83]
  - - [2112, 1, 1, 4096]
    - [112, 432.538]
  - - [2368, 1, 1, 4096]
    - [118, 440.879]
  - - [2624, 1, 1, 4096]
    - [105, 447.829]
  - - [2880, 1, 1, 4096]
    - [79, 491.52]
  - - [3136, 1, 1, 4096]
    - [79, 494.041]
  - - [3392, 1, 1, 4096]
    - [93, 505.223]
  - - [3648, 1, 1, 4096]
    - [105, 533.65]
  - - [3904, 1, 1, 4096]
    - [79, 533.026]
  - - [1, 320, 1, 4096]
    - [16, 124.83]
  - - [16, 320, 1, 4096]
    - [16, 1823.61]
  - - [32, 320, 1, 4096]
    - [20, 3495.25]
  - - [1, 576, 1, 4096]
    - [62, 188.744]
  - - [16, 576, 1, 4096]
    - [16, 3145.73]
  - - [32, 576, 1, 4096]
    - [109, 6291.46]
  - - [1, 832, 1, 4096]
    - [79, 309.807]
  - - [16, 832, 1, 4096]
    - [16, 4741.39]
  - - [32, 832, 1, 4096]
    - [20, 9087.66]
  - - [1, 1088, 1, 4096]
    - [105, 371.371]
  - - [16, 1088, 1, 4096]
    - [20, 5704.25]
  - - [1, 1344, 1, 4096]
    - [79, 407.78]
  - - [16, 1344, 1, 4096]
    - [79, 6291.46]
  - - [1, 1600, 1, 4096]
    - [16, 485.452]
  - - [16, 1600, 1, 4096]
    - [63, 8065.97]
  - - [1, 1856, 1, 4096]
    - [106, 490.463]
  - - [16, 1856, 1, 4096]
    - [63, 9009.99]
  - - [1, 2112, 1, 4096]
    - [16, 576.717]
  - - [1, 2368, 1, 4096]
    - [63, 587.838]
  - - [1, 2624, 1, 4096]
    - [106, 614.166]
  - - [1, 2880, 1, 4096]
    - [106, 589.824]
  - - [1, 3136, 1, 4096]
    - [17, 658.721]
  - - [1, 3392, 1, 4096]
    - [16, 661.602]
  - - [1, 3648, 1, 4096]
    - [16, 711.534]
  - - [1, 3904, 1, 4096]
    - [16, 726.854]
  - - [192, 1, 1, 64]
    - [39, 2.048]
  - - [192, 16, 1, 64]
    - [15, 32.768]
  - - [192, 32, 1, 64]
    - [16, 71.4938]
  - - [192, 1, 1, 1]
    - [17, 0.0349091]
  - - [192, 1, 1, 16]
    - [10, 0.512]
  - - [192, 1, 1, 32]
    - [21, 0.945231]
  - - [192, 16, 1, 1]
    - [16, 0.512]
  - - [192, 16, 1, 16]
    - [17, 8.93673]
  - - [192, 16, 1, 32]
    - [17, 16.384]
  - - [192, 32, 1, 1]
    - [17, 0.945231]
  - - [192, 32, 1, 16]
    - [17, 15.1237]
  - - [192, 32, 1, 32]
    - [39, 30.2474]
  - - [192, 64, 1, 1]
    - [17, 2.048]
  - - [192, 64, 1, 16]
    - [16, 32.768]
  - - [192, 64, 1, 32]
    - [17, 60.4948]
  - - [448, 1, 1, 64]
    - [16, 4.77867]
  - - [448, 16, 1, 64]
    - [15, 76.4587]
  - - [448, 32, 1, 64]
    - [17, 141.154]
  - - [448, 1, 1, 1]
    - [10, 0.0746667]
  - - [448, 1, 1, 16]
    - [15, 1.19467]
  - - [448, 1, 1, 32]
    - [16, 2.20554]
  - - [448, 16, 1, 1]
    - [10, 1.19467]
  - - [448, 16, 1, 16]
    - [39, 17.6443]
  - - [448, 16, 1, 32]
    - [10, 38.2293]
  - - [448, 32, 1, 1]
    - [23, 2.20554]
  - - [448, 32, 1, 16]
    - [39, 38.2293]
  - - [448, 32, 1, 32]
    - [39, 70.5772]
  - - [448, 64, 1, 1]
    - [15, 4.41108]
  - - [448, 64, 1, 16]
    - [39, 83.4095]
  - - [448, 64, 1, 32]
    - [16, 152.917]
  - - [704, 1, 1, 64]
    - [16, 6.93169]
  - - [704, 16, 1, 64]
    - [17, 102.985]
  - - [704, 32, 1, 64]
    - [17, 240.299]
  - - [704, 1, 1, 1]
    - [18, 0.100571]
  - - [704, 1, 1, 16]
    - [39, 1.87733]
  - - [704, 1, 1, 32]
    - [15, 3.75467]
  - - [704, 16, 1, 1]
    - [23, 1.73292]
  - - [704, 16, 1, 16]
    - [39, 30.0373]
  - - [704, 16, 1, 32]
    - [17, 60.0747]
  - - [704, 32, 1, 1]
    - [39, 3.75467]
  - - [704, 32, 1, 16]
    - [17, 60.0747]
  - - [704, 32, 1, 32]
    - [17, 110.907]
  - - [704, 64, 1, 1]
    - [22, 6.93169]
  - - [704, 64, 1, 16]
    - [10, 96.1195]
  - - [704, 64, 1, 32]
    - [15, 240.299]
  - - [960, 1, 1, 64]
    - [17, 10.24]
  - - [960, 16, 1, 64]
    - [15, 151.237]
  - - [960, 32, 1, 64]
    - [17, 327.68]
  - - [960, 1, 1, 1]
    - [26, 0.147692]
  - - [960, 1, 1, 16]
    - [102, 2.36308]
  - - [960, 1, 1, 32]
    - [39, 4.72615]
  - - [960, 16, 1, 1]
    - [17, 2.36308]
  - - [960, 16, 1, 16]
    - [10, 37.8092]
  - - [960, 16, 1, 32]
    - [17, 75.6185]
  - - [960, 32, 1, 1]
    - [15, 4.38857]
  - - [960, 32, 1, 16]
    - [39, 75.6185]
  - - [960, 32, 1, 32]
    - [21, 151.237]
  - - [960, 64, 1, 1]
    - [39, 9.45231]
  - - [960, 64, 1, 16]
    - [17, 163.84]
  - - [960, 64, 1, 32]
    - [17, 327.68]
  - - [1216, 1, 1, 64]
    - [39, 12.9707]
  - - [1216, 16, 1, 64]
    - [10, 191.567]
  - - [1216, 32, 1, 64]
    - [24, 383.134]
  - - [1216, 1, 1, 1]
    - [39, 0.187077]
  - - [1216, 1, 1, 16]
    - [17, 2.99323]
  - - [1216, 1, 1, 32]
    - [80, 5.55886]
  - - [1216, 16, 1, 1]
    - [17, 2.99323]
  - - [1216, 16, 1, 16]
    - [17, 47.8917]
  - - [1216, 16, 1, 32]
    - [17, 95.7834]
  - - [1216, 32, 1, 1]
    - [39, 5.98646]
  - - [1216, 32, 1, 16]
    - [39, 95.7834]
  - - [1216, 32, 1, 32]
    - [39, 191.567]
  - - [1216, 64, 1, 1]
    - [15, 12.9707]
  - - [1216, 64, 1, 16]
    - [23, 177.883]
  - - [1216, 64, 1, 32]
    - [17, 383.134]
  - - [1472, 1, 1, 64]
    - [39, 14.4935]
  - - [1472, 16, 1, 64]
    - [39, 231.897]
  - - [1472, 32, 1, 64]
    - [39, 463.793]
  - - [1472, 1, 1, 1]
    - [17, 0.245333]
  - - [1472, 1, 1, 16]
    - [39, 3.36457]
  - - [1472, 1, 1, 32]
    - [21, 7.24677]
  - - [1472, 16, 1, 1]
    - [23, 3.36457]
  - - [1472, 16, 1, 16]
    - [17, 57.9742]
  - - [1472, 16, 1, 32]
    - [17, 115.948]
  - - [1472, 32, 1, 1]
    - [23, 7.24677]
  - - [1472, 32, 1, 16]
    - [19, 125.611]
  - - [1472, 32, 1, 32]
    - [17, 231.897]
  - - [1472, 64, 1, 1]
    - [36, 12.5611]
  - - [1472, 64, 1, 16]
    - [15, 231.897]
  - - [1472, 64, 1, 32]
    - [39, 463.793]
  - - [1728, 1, 1, 64]
    - [39, 15.7989]
  - - [1728, 16, 1, 64]
    - [17, 294.912]
  - - [1728, 32, 1, 64]
    - [19, 505.563]
  - - [1728, 1, 1, 1]
    - [39, 0.246857]
  - - [1728, 1, 1, 16]
    - [22, 4.608]
  - - [1728, 1, 1, 32]
    - [39, 7.89943]
  - - [1728, 16, 1, 1]
    - [11, 4.25354]
  - - [1728, 16, 1, 16]
    - [102, 68.0566]
  - - [1728, 16, 1, 32]
    - [17, 147.456]
  - - [1728, 32, 1, 1]
    - [17, 9.216]
  - - [1728, 32, 1, 16]
    - [39, 136.113]
  - - [1728, 32, 1, 32]
    - [17, 294.912]
  - - [1728, 64, 1, 1]
    - [16, 13.824]
  - - [1728, 64, 1, 16]
    - [39, 294.912]
  - - [1728, 64, 1, 32]
    - [39, 544.453]
  - - [1984, 1, 1, 64]
    - [17, 19.5348]
  - - [1984, 16, 1, 64]
    - [21, 290.231]
  - - [1984, 32, 1, 64]
    - [39, 625.113]
  - - [1984, 1, 1, 1]
    - [39, 0.305231]
  - - [1984, 1, 1, 16]
    - [39, 4.53486]
  - - [1984, 1, 1, 32]
    - [39, 9.06971]
  - - [1984, 16, 1, 1]
    - [17, 4.88369]
  - - [1984, 16, 1, 16]
    - [26, 72.5577]
  - - [1984, 16, 1, 32]
    - [17, 156.278]
  - - [1984, 32, 1, 1]
    - [21, 9.06971]
  - - [1984, 32, 1, 16]
    - [19, 145.115]
  - - [1984, 32, 1, 32]
    - [39, 312.556]
  - - [1984, 64, 1, 1]
    - [27, 21.1627]
  - - [1984, 64, 1, 16]
    - [23, 290.231]
  - - [1984, 64, 1, 32]
    - [23, 580.462]
  - - [1, 192, 1, 64]
    - [17, 2.23418]
  - - [16, 192, 1, 64]
    - [17, 32.768]
  - - [32, 192, 1, 64]
    - [16, 71.4938]
  - - [1, 192, 1, 1]
    - [10, 0.0295385]
  - - [1, 192, 1, 16]
    - [16, 0.512]
  - - [1, 192, 1, 32]
    - [10, 0.945231]
  - - [16, 192, 1, 1]
    - [79, 0.512]
  - - [16, 192, 1, 16]
    - [17, 8.192]
  - - [16, 192, 1, 32]
    - [15, 16.384]
  - - [32, 192, 1, 1]
    - [11, 0.945231]
  - - [32, 192, 1, 16]
    - [16, 16.384]
  - - [32, 192, 1, 32]
    - [16, 30.2474]
  - - [64, 192, 1, 1]
    - [16, 2.048]
  - - [64, 192, 1, 16]
    - [15, 30.2474]
  - - [64, 192, 1, 32]
    - [17, 71.4938]
  - - [192, 192, 1, 1]
    - [39, 5.67138]
  - - [192, 192, 1, 16]
    - [39, 90.7422]
  - - [192, 192, 1, 32]
    - [17, 214.481]
  - - [320, 192, 1, 1]
    - [10, 9.45231]
  - - [320, 192, 1, 16]
    - [17, 140.434]
  - - [320, 192, 1, 32]
    - [23, 302.474]
  - - [448, 192, 1, 1]
    - [15, 13.2332]
  - - [448, 192, 1, 16]
    - [70, 211.732]
  - - [448, 192, 1, 32]
    - [21, 458.752]
  - - [576, 192, 1, 1]
    - [15, 17.0142]
  - - [576, 192, 1, 16]
    - [11, 272.226]
  - - [576, 192, 1, 32]
    - [10, 544.453]
  - - [704, 192, 1, 1]
    - [21, 20.7951]
  - - [704, 192, 1, 16]
    - [11, 360.448]
  - - [704, 192, 1, 32]
    - [11, 665.442]
  - - [832, 192, 1, 1]
    - [23, 22.8206]
  - - [832, 192, 1, 16]
    - [10, 365.129]
  - - [832, 192, 1, 32]
    - [21, 786.432]
  - - [960, 192, 1, 1]
    - [39, 28.3569]
  - - [960, 192, 1, 16]
    - [10, 453.711]
  - - [960, 192, 1, 32]
    - [39, 842.606]
  - - [1088, 192, 1, 1]
    - [23, 27.8528]
  - - [1088, 192, 1, 16]
    - [27, 477.477]
  - - [1088, 192, 1, 32]
    - [27, 891.29]
  - - [1216, 192, 1, 1]
    - [25, 33.3531]
  - - [1216, 192, 1, 16]
    - [23, 498.074]
  - - [1216, 192, 1, 32]
    - [12, 878.953]
  - - [1344, 192, 1, 1]
    - [5, 32.256]
  - - [1344, 192, 1, 16]
    - [24, 589.824]
  - - [1344, 192, 1, 32]
    - [27, 1101.0]
  - - [1472, 192, 1, 1]
    - [116, 35.328]
  - - [1472, 192, 1, 16]
    - [24, 645.998]
  - - [1472, 192, 1, 32]
    - [41, 1391.38]
  - - [1600, 192, 1, 1]
    - [27, 43.8857]
  - - [1600, 192, 1, 16]
    - [28, 578.259]
  - - [1600, 192, 1, 32]
    - [29, 1228.8]
  - - [1728, 192, 1, 1]
    - [24, 41.472]
  - - [1728, 192, 1, 16]
    - [55, 663.552]
  - - [1728, 192, 1, 32]
    - [24, 1117.56]
  - - [1856, 192, 1, 1]
    - [24, 50.9074]
  - - [1856, 192, 1, 16]
    - [55, 670.78]
  - - [1856, 192, 1, 32]
    - [27, 1629.04]
  - - [1984, 192, 1, 1]
    - [47, 50.7904]
  - - [1984, 192, 1, 16]
    - [27, 812.646]
  - - [1984, 192, 1, 32]
    - [55, 1434.08]
  - - [192, 320, 1, 1]
    - [39, 9.45231]
  - - [192, 320, 1, 16]
    - [22, 151.237]
  - - [192, 320, 1, 32]
    - [10, 302.474]
  - - [448, 320, 1, 1]
    - [22, 19.1147]
  - - [448, 320, 1, 16]
    - [21, 327.68]
  - - [448, 320, 1, 32]
    - [39, 655.36]
  - - [704, 320, 1, 1]
    - [39, 32.1829]
  - - [704, 320, 1, 16]
    - [12, 480.597]
  - - [704, 320, 1, 32]
    - [10, 961.195]
  - - [960, 320, 1, 1]
    - [33, 43.8857]
  - - [960, 320, 1, 16]
    - [21, 614.4]
  - - [960, 320, 1, 32]
    - [55, 1310.72]
  - - [1216, 320, 1, 1]
    - [49, 48.64]
  - - [1216, 320, 1, 16]
    - [13, 778.24]
  - - [1216, 320, 1, 32]
    - [55, 1464.92]
  - - [1472, 320, 1, 1]
    - [26, 55.4165]
  - - [1472, 320, 1, 16]
    - [13, 886.664]
  - - [1472, 320, 1, 32]
    - [55, 1884.16]
  - - [1728, 320, 1, 1]
    - [55, 65.0541]
  - - [1728, 320, 1, 16]
    - [55, 983.04]
  - - [1728, 320, 1, 32]
    - [55, 1966.08]
  - - [1984, 320, 1, 1]
    - [28, 74.6918]
  - - [1984, 320, 1, 16]
    - [55, 1069.27]
  - - [1984, 320, 1, 32]
    - [28, 2257.35]
  - - [1, 448, 1, 64]
    - [39, 4.41108]
  - - [16, 448, 1, 64]
    - [92, 57.344]
  - - [32, 448, 1, 64]
    - [64, 141.154]
  - - [1, 448, 1, 1]
    - [15, 0.0746667]
  - - [1, 448, 1, 16]
    - [16, 1.10277]
  - - [1, 448, 1, 32]
    - [17, 2.60655]
  - - [16, 448, 1, 1]
    - [15, 1.19467]
  - - [16, 448, 1, 16]
    - [15, 19.1147]
  - - [16, 448, 1, 32]
    - [106, 38.2293]
  - - [32, 448, 1, 1]
    - [17, 2.38933]
  - - [32, 448, 1, 16]
    - [17, 35.2886]
  - - [32, 448, 1, 32]
    - [17, 83.4095]
  - - [64, 448, 1, 1]
    - [26, 4.41108]
  - - [64, 448, 1, 16]
    - [39, 70.5772]
  - - [64, 448, 1, 32]
    - [16, 141.154]
  - - [192, 448, 1, 1]
    - [39, 13.2332]
  - - [192, 448, 1, 16]
    - [17, 196.608]
  - - [192, 448, 1, 32]
    - [21, 458.752]
  - - [320, 448, 1, 1]
    - [39, 20.48]
  - - [320, 448, 1, 16]
    - [11, 352.886]
  - - [320, 448, 1, 32]
    - [23, 655.36]
  - - [448, 448, 1, 1]
    - [27, 28.672]
  - - [448, 448, 1, 16]
    - [23, 458.752]
  - - [448, 448, 1, 32]
    - [24, 917.504]
  - - [576, 448, 1, 1]
    - [24, 34.4064]
  - - [576, 448, 1, 16]
    - [24, 589.824]
  - - [576, 448, 1, 32]
    - [39, 1101.0]
  - - [704, 448, 1, 1]
    - [55, 42.0523]
  - - [704, 448, 1, 16]
    - [24, 672.836]
  - - [704, 448, 1, 32]
    - [39, 1441.79]
  - - [832, 448, 1, 1]
    - [59, 46.592]
  - - [832, 448, 1, 16]
    - [27, 795.17]
  - - [832, 448, 1, 32]
    - [42, 1490.94]
  - - [960, 448, 1, 1]
    - [13, 53.76]
  - - [960, 448, 1, 16]
    - [32, 860.16]
  - - [960, 448, 1, 32]
    - [13, 1619.12]
  - - [1088, 448, 1, 1]
    - [24, 57.344]
  - - [1088, 448, 1, 16]
    - [43, 917.504]
  - - [1088, 448, 1, 32]
    - [55, 1835.01]
  - - [1216, 448, 1, 1]
    - [32, 64.0904]
  - - [1216, 448, 1, 16]
    - [26, 968.476]
  - - [1216, 448, 1, 32]
    - [31, 1936.95]
  - - [1344, 448, 1, 1]
    - [47, 66.9013]
  - - [1344, 448, 1, 16]
    - [5, 1070.42]
  - - [1344, 448, 1, 32]
    - [28, 2266.77]
  - - [1472, 448, 1, 1]
    - [42, 69.4164]
  - - [1472, 448, 1, 16]
    - [61, 1110.66]
  - - [1472, 448, 1, 32]
    - [49, 2344.73]
  - - [1600, 448, 1, 1]
    - [3, 68.2667]
  - - [1600, 448, 1, 16]
    - [49, 1207.24]
  - - [1600, 448, 1, 32]
    - [27, 2414.48]
  - - [1728, 448, 1, 1]
    - [3, 70.3767]
  - - [1728, 448, 1, 16]
    - [24, 1303.82]
  - - [1728, 448, 1, 32]
    - [41, 2607.64]
  - - [1856, 448, 1, 1]
    - [3, 79.1893]
  - - [1856, 448, 1, 16]
    - [43, 1267.03]
  - - [1856, 448, 1, 32]
    - [49, 2534.06]
  - - [1984, 448, 1, 1]
    - [8, 80.8029]
  - - [1984, 448, 1, 16]
    - [55, 1236.64]
  - - [1984, 448, 1, 32]
    - [27, 2585.69]
  - - [192, 576, 1, 1]
    - [11, 17.0142]
  - - [192, 576, 1, 16]
    - [39, 272.226]
  - - [192, 576, 1, 32]
    - [39, 544.453]
  - - [448, 576, 1, 1]
    - [13, 32.256]
  - - [448, 576, 1, 16]
    - [39, 550.502]
  - - [448, 576, 1, 32]
    - [39, 1101.0]
  - - [704, 576, 1, 1]
    - [34, 47.7064]
  - - [704, 576, 1, 16]
    - [27, 811.008]
  - - [704, 576, 1, 32]
    - [27, 1730.15]
  - - [960, 576, 1, 1]
    - [5, 61.44]
  - - [960, 576, 1, 16]
    - [8, 983.04]
  - - [960, 576, 1, 32]
    - [9, 1966.08]
  - - [1216, 576, 1, 1]
    - [41, 73.728]
  - - [1216, 576, 1, 16]
    - [27, 1120.67]
  - - [1216, 576, 1, 32]
    - [8, 2134.6]
  - - [1472, 576, 1, 1]
    - [82, 84.7872]
  - - [1472, 576, 1, 16]
    - [3, 1233.27]
  - - [1472, 576, 1, 32]
    - [80, 2359.3]
  - - [1728, 576, 1, 1]
    - [24, 86.5503]
  - - [1728, 576, 1, 16]
    - [24, 1384.8]
  - - [1728, 576, 1, 32]
    - [61, 3033.38]
  - - [1984, 576, 1, 1]
    - [49, 99.3725]
  - - [1984, 576, 1, 16]
    - [26, 1662.23]
  - - [1984, 576, 1, 32]
    - [24, 3179.92]
  - - [1, 704, 1, 64]
    - [22, 6.93169]
  - - [16, 704, 1, 64]
    - [39, 110.907]
  - - [32, 704, 1, 64]
    - [17, 240.299]
  - - [1, 704, 1, 1]
    - [22, 0.100571]
  - - [1, 704, 1, 16]
    - [16, 1.87733]
  - - [1, 704, 1, 32]
    - [16, 3.46585]
  - - [16, 704, 1, 1]
    - [16, 1.73292]
  - - [16, 704, 1, 16]
    - [16, 30.0373]
  - - [16, 704, 1, 32]
    - [17, 55.4535]
  - - [32, 704, 1, 1]
    - [39, 3.21829]
  - - [32, 704, 1, 16]
    - [16, 60.0747]
  - - [32, 704, 1, 32]
    - [39, 110.907]
  - - [64, 704, 1, 1]
    - [17, 7.50933]
  - - [64, 704, 1, 16]
    - [11, 120.149]
  - - [64, 704, 1, 32]
    - [17, 221.814]
  - - [192, 704, 1, 1]
    - [32, 16.896]
  - - [192, 704, 1, 16]
    - [23, 288.358]
  - - [192, 704, 1, 32]
    - [39, 617.911]
  - - [320, 704, 1, 1]
    - [39, 32.1829]
  - - [320, 704, 1, 16]
    - [24, 554.535]
  - - [320, 704, 1, 32]
    - [23, 961.195]
  - - [448, 704, 1, 1]
    - [23, 39.424]
  - - [448, 704, 1, 16]
    - [50, 630.784]
  - - [448, 704, 1, 32]
    - [39, 1261.57]
  - - [576, 704, 1, 1]
    - [13, 47.7064]
  - - [576, 704, 1, 16]
    - [13, 763.302]
  - - [576, 704, 1, 32]
    - [13, 1730.15]
  - - [704, 704, 1, 1]
    - [55, 55.0684]
  - - [704, 704, 1, 16]
    - [26, 932.924]
  - - [704, 704, 1, 32]
    - [47, 1762.19]
  - - [832, 704, 1, 1]
    - [13, 68.9092]
  - - [832, 704, 1, 16]
    - [55, 1102.55]
  - - [832, 704, 1, 32]
    - [55, 2082.59]
  - - [960, 704, 1, 1]
    - [5, 71.1411]
  - - [960, 704, 1, 16]
    - [3, 1081.34]
  - - [960, 704, 1, 32]
    - [24, 2276.51]
  - - [1088, 704, 1, 1]
    - [27, 76.5952]
  - - [1088, 704, 1, 16]
    - [42, 1290.02]
  - - [1088, 704, 1, 32]
    - [5, 2334.33]
  - - [1216, 704, 1, 1]
    - [61, 85.6064]
  - - [1216, 704, 1, 16]
    - [5, 1304.48]
  - - [1216, 704, 1, 32]
    - [82, 2739.4]
  - - [1344, 704, 1, 1]
    - [61, 90.112]
  - - [1344, 704, 1, 16]
    - [24, 1376.26]
  - - [1344, 704, 1, 32]
    - [27, 2632.84]
  - - [1472, 704, 1, 1]
    - [61, 98.6941]
  - - [1472, 704, 1, 16]
    - [26, 1579.11]
  - - [1472, 704, 1, 32]
    - [61, 3014.66]
  - - [1600, 704, 1, 1]
    - [53, 93.8667]
  - - [1600, 704, 1, 16]
    - [36, 1567.17]
  - - [1600, 704, 1, 32]
    - [37, 3276.8]
  - - [1728, 704, 1, 1]
    - [33, 105.784]
  - - [1728, 704, 1, 16]
    - [55, 1622.02]
  - - [1728, 704, 1, 32]
    - [55, 3244.03]
  - - [1856, 704, 1, 1]
    - [37, 108.885]
  - - [1856, 704, 1, 16]
    - [61, 1817.91]
  - - [1856, 704, 1, 32]
    - [61, 3635.82]
  - - [1984, 704, 1, 1]
    - [53, 116.395]
  - - [1984, 704, 1, 16]
    - [38, 1655.39]
  - - [1984, 704, 1, 32]
    - [61, 3724.63]
  - - [192, 832, 1, 1]
    - [10, 22.8206]
  - - [192, 832, 1, 16]
    - [23, 365.129]
  - - [192, 832, 1, 32]
    - [24, 786.432]
  - - [448, 832, 1, 1]
    - [24, 49.6981]
  - - [448, 832, 1, 16]
    - [13, 701.621]
  - - [448, 832, 1, 32]
    - [90, 1403.24]
  - - [704, 832, 1, 1]
    - [5, 61.6556]
  - - [704, 832, 1, 16]
    - [55, 1041.29]
  - - [704, 832, 1, 32]
    - [28, 2205.09]
  - - [960, 832, 1, 1]
    - [41, 84.0758]
  - - [960, 832, 1, 16]
    - [5, 1217.1]
  - - [960, 832, 1, 32]
    - [27, 2690.43]
  - - [1216, 832, 1, 1]
    - [61, 101.171]
  - - [1216, 832, 1, 16]
    - [31, 1407.6]
  - - [1216, 832, 1, 32]
    - [61, 3083.31]
  - - [1472, 832, 1, 1]
    - [32, 106.496]
  - - [1472, 832, 1, 16]
    - [14, 1632.94]
  - - [1472, 832, 1, 32]
    - [82, 3407.87]
  - - [1728, 832, 1, 1]
    - [37, 119.808]
  - - [1728, 832, 1, 16]
    - [61, 2000.27]
  - - [1728, 832, 1, 32]
    - [14, 3833.86]
  - - [1984, 832, 1, 1]
    - [61, 122.273]
  - - [1984, 832, 1, 16]
    - [28, 1821.45]
  - - [1984, 832, 1, 32]
    - [55, 3521.47]
  - - [1, 960, 1, 64]
    - [39, 9.45231]
  - - [16, 960, 1, 64]
    - [39, 151.237]
  - - [32, 960, 1, 64]
    - [16, 327.68]
  - - [1, 960, 1, 1]
    - [16, 0.16]
  - - [1, 960, 1, 16]
    - [16, 2.36308]
  - - [1, 960, 1, 32]
    - [15, 5.12]
  - - [16, 960, 1, 1]
    - [39, 2.36308]
  - - [16, 960, 1, 16]
    - [17, 40.96]
  - - [16, 960, 1, 32]
    - [17, 81.92]
  - - [32, 960, 1, 1]
    - [26, 4.72615]
  - - [32, 960, 1, 16]
    - [16, 75.6185]
  - - [32, 960, 1, 32]
    - [17, 151.237]
  - - [64, 960, 1, 1]
    - [23, 8.77714]
  - - [64, 960, 1, 16]
    - [10, 151.237]
  - - [64, 960, 1, 32]
    - [17, 302.474]
  - - [192, 960, 1, 1]
    - [26, 26.3314]
  - - [192, 960, 1, 16]
    - [24, 453.711]
  - - [192, 960, 1, 32]
    - [39, 842.606]
  - - [320, 960, 1, 1]
    - [9, 38.4]
  - - [320, 960, 1, 16]
    - [39, 655.36]
  - - [320, 960, 1, 32]
    - [27, 1404.34]
  - - [448, 960, 1, 1]
    - [9, 50.5976]
  - - [448, 960, 1, 16]
    - [3, 809.562]
  - - [448, 960, 1, 32]
    - [28, 1835.01]
  - - [576, 960, 1, 1]
    - [3, 61.44]
  - - [576, 960, 1, 16]
    - [26, 1040.87]
  - - [576, 960, 1, 32]
    - [26, 2081.73]
  - - [704, 960, 1, 1]
    - [81, 71.1411]
  - - [704, 960, 1, 16]
    - [8, 1029.85]
  - - [704, 960, 1, 32]
    - [61, 2276.51]
  - - [832, 960, 1, 1]
    - [27, 84.0758]
  - - [832, 960, 1, 16]
    - [47, 1345.21]
  - - [832, 960, 1, 32]
    - [70, 2323.55]
  - - [960, 960, 1, 1]
    - [61, 97.0105]
  - - [960, 960, 1, 16]
    - [3, 1282.23]
  - - [960, 960, 1, 32]
    - [82, 2808.69]
  - - [1088, 960, 1, 1]
    - [61, 104.448]
  - - [1088, 960, 1, 16]
    - [24, 1453.19]
  - - [1088, 960, 1, 32]
    - [55, 2785.28]
  - - [1216, 960, 1, 1]
    - [61, 106.124]
  - - [1216, 960, 1, 16]
    - [43, 1624.15]
  - - [1216, 960, 1, 32]
    - [24, 3248.31]
  - - [1344, 960, 1, 1]
    - [61, 107.52]
  - - [1344, 960, 1, 16]
    - [27, 1651.51]
  - - [1344, 960, 1, 32]
    - [53, 3440.64]
  - - [1472, 960, 1, 1]
    - [14, 108.702]
  - - [1472, 960, 1, 16]
    - [82, 1739.22]
  - - [1472, 960, 1, 32]
    - [14, 3617.59]
  - - [1600, 960, 1, 1]
    - [49, 122.88]
  - - [1600, 960, 1, 16]
    - [49, 1966.08]
  - - [1600, 960, 1, 32]
    - [49, 3932.16]
  - - [1728, 960, 1, 1]
    - [5, 114.406]
  - - [1728, 960, 1, 16]
    - [5, 1830.49]
  - - [1728, 960, 1, 32]
    - [49, 3932.16]
  - - [1856, 960, 1, 1]
    - [61, 131.982]
  - - [1856, 960, 1, 16]
    - [36, 2036.3]
  - - [1856, 960, 1, 32]
    - [61, 3932.16]
  - - [1984, 960, 1, 1]
    - [8, 131.354]
  - - [1984, 960, 1, 16]
    - [8, 2101.67]
  - - [1984, 960, 1, 32]
    - [78, 4203.34]
  - - [192, 1088, 1, 1]
    - [21, 32.1378]
  - - [192, 1088, 1, 16]
    - [39, 445.645]
  - - [192, 1088, 1, 32]
    - [39, 954.953]
  - - [448, 1088, 1, 1]
    - [41, 57.344]
  - - [448, 1088, 1, 16]
    - [27, 917.504]
  - - [448, 1088, 1, 32]
    - [24, 1949.7]
  - - [704, 1088, 1, 1]
    - [3, 72.9478]
  - - [704, 1088, 1, 16]
    - [55, 1114.11]
  - - [704, 1088, 1, 32]
    - [61, 2580.05]
  - - [960, 1088, 1, 1]
    - [55, 87.04]
  - - [960, 1088, 1, 16]
    - [61, 1671.17]
  - - [960, 1088, 1, 32]
    - [55, 2785.28]
  - - [1216, 1088, 1, 1]
    - [14, 110.251]
  - - [1216, 1088, 1, 16]
    - [61, 1924.38]
  - - [1216, 1088, 1, 32]
    - [14, 3528.02]
  - - [1472, 1088, 1, 1]
    - [49, 123.195]
  - - [1472, 1088, 1, 16]
    - [8, 1830.33]
  - - [1472, 1088, 1, 32]
    - [14, 3534.42]
  - - [1728, 1088, 1, 1]
    - [82, 125.338]
  - - [1728, 1088, 1, 16]
    - [26, 2074.55]
  - - [1728, 1088, 1, 32]
    - [28, 4010.8]
  - - [1984, 1088, 1, 1]
    - [49, 139.264]
  - - [1984, 1088, 1, 16]
    - [14, 2158.59]
  - - [1984, 1088, 1, 32]
    - [49, 4317.18]
  - - [1, 1216, 1, 64]
    - [39, 11.9729]
  - - [16, 1216, 1, 64]
    - [16, 191.567]
  - - [32, 1216, 1, 64]
    - [15, 383.134]
  - - [1, 1216, 1, 1]
    - [15, 0.187077]
  - - [1, 1216, 1, 16]
    - [11, 2.77943]
  - - [1, 1216, 1, 32]
    - [18, 5.55886]
  - - [16, 1216, 1, 1]
    - [16, 3.24267]
  - - [16, 1216, 1, 16]
    - [16, 44.4709]
  - - [16, 1216, 1, 32]
    - [39, 95.7834]
  - - [32, 1216, 1, 1]
    - [17, 7.07491]
  - - [32, 1216, 1, 16]
    - [39, 103.765]
  - - [32, 1216, 1, 32]
    - [16, 207.531]
  - - [64, 1216, 1, 1]
    - [11, 11.9729]
  - - [64, 1216, 1, 16]
    - [17, 191.567]
  - - [64, 1216, 1, 32]
    - [39, 383.134]
  - - [192, 1216, 1, 1]
    - [24, 33.3531]
  - - [192, 1216, 1, 16]
    - [23, 533.65]
  - - [192, 1216, 1, 32]
    - [21, 1067.3]
  - - [320, 1216, 1, 1]
    - [24, 51.8827]
  - - [320, 1216, 1, 16]
    - [24, 889.417]
  - - [320, 1216, 1, 32]
    - [36, 1556.48]
  - - [448, 1216, 1, 1]
    - [24, 64.0904]
  - - [448, 1216, 1, 16]
    - [55, 968.476]
  - - [448, 1216, 1, 32]
    - [49, 2179.07]
  - - [576, 1216, 1, 1]
    - [49, 77.824]
  - - [576, 1216, 1, 16]
    - [49, 1245.18]
  - - [576, 1216, 1, 32]
    - [24, 2241.33]
  - - [704, 1216, 1, 1]
    - [5, 81.5299]
  - - [704, 1216, 1, 16]
    - [5, 1304.48]
  - - [704, 1216, 1, 32]
    - [27, 2608.96]
  - - [832, 1216, 1, 1]
    - [43, 91.9738]
  - - [832, 1216, 1, 16]
    - [43, 1541.66]
  - - [832, 1216, 1, 32]
    - [61, 3237.48]
  - - [960, 1216, 1, 1]
    - [13, 101.51]
  - - [960, 1216, 1, 16]
    - [81, 1624.15]
  - - [960, 1216, 1, 32]
    - [13, 3112.96]
  - - [1088, 1216, 1, 1]
    - [37, 110.251]
  - - [1088, 1216, 1, 16]
    - [61, 1840.71]
  - - [1088, 1216, 1, 32]
    - [61, 3256.64]
  - - [1216, 1216, 1, 1]
    - [14, 123.221]
  - - [1216, 1216, 1, 16]
    - [37, 1971.54]
  - - [1216, 1216, 1, 32]
    - [37, 3785.36]
  - - [1344, 1216, 1, 1]
    - [8, 112.711]
  - - [1344, 1216, 1, 16]
    - [3, 1867.78]
  - - [1344, 1216, 1, 32]
    - [24, 3735.55]
  - - [1472, 1216, 1, 1]
    - [61, 132.589]
  - - [1472, 1216, 1, 16]
    - [28, 1975.12]
  - - [1472, 1216, 1, 32]
    - [28, 3950.24]
  - - [1600, 1216, 1, 1]
    - [82, 121.6]
  - - [1600, 1216, 1, 16]
    - [61, 2146.87]
  - - [1600, 1216, 1, 32]
    - [49, 4016.72]
  - - [1728, 1216, 1, 1]
    - [14, 140.083]
  - - [1728, 1216, 1, 16]
    - [55, 2037.57]
  - - [1728, 1216, 1, 32]
    - [14, 4075.15]
  - - [1856, 1216, 1, 1]
    - [37, 141.056]
  - - [1856, 1216, 1, 16]
    - [14, 2329.7]
  - - [1856, 1216, 1, 32]
    - [49, 4513.79]
  - - [1984, 1216, 1, 1]
    - [38, 150.784]
  - - [1984, 1216, 1, 16]
    - [32, 2339.44]
  - - [1984, 1216, 1, 32]
    - [49, 4678.87]
  - - [192, 1344, 1, 1]
    - [54, 34.4064]
  - - [192, 1344, 1, 16]
    - [27, 550.502]
  - - [192, 1344, 1, 32]
    - [50, 1179.65]
  - - [448, 1344, 1, 1]
    - [55, 57.344]
  - - [448, 1344, 1, 16]
    - [3, 1014.08]
  - - [448, 1344, 1, 32]
    - [57, 2028.17]
  - - [704, 1344, 1, 1]
    - [61, 94.6176]
  - - [704, 1344, 1, 16]
    - [61, 1513.88]
  - - [704, 1344, 1, 32]
    - [61, 3027.76]
  - - [960, 1344, 1, 1]
    - [61, 117.295]
  - - [960, 1344, 1, 16]
    - [61, 1876.71]
  - - [960, 1344, 1, 32]
    - [14, 3440.64]
  - - [1216, 1344, 1, 1]
    - [8, 112.711]
  - - [1216, 1344, 1, 16]
    - [49, 1936.95]
  - - [1216, 1344, 1, 32]
    - [61, 3873.91]
  - - [1472, 1344, 1, 1]
    - [28, 123.648]
  - - [1472, 1344, 1, 16]
    - [82, 2183.03]
  - - [1472, 1344, 1, 32]
    - [49, 4084.37]
  - - [1728, 1344, 1, 1]
    - [14, 132.71]
  - - [1728, 1344, 1, 16]
    - [3, 2185.82]
  - - [1728, 1344, 1, 32]
    - [49, 4246.73]
  - - [1984, 1344, 1, 1]
    - [81, 161.606]
  - - [1984, 1344, 1, 16]
    - [61, 2585.69]
  - - [1984, 1344, 1, 32]
    - [82, 4740.44]
  - - [1, 1472, 1, 64]
    - [23, 12.5611]
  - - [16, 1472, 1, 64]
    - [16, 251.221]
  - - [32, 1472, 1, 64]
    - [16, 463.793]
  - - [1, 1472, 1, 1]
    - [15, 0.245333]
  - - [1, 1472, 1, 16]
    - [21, 3.62338]
  - - [1, 1472, 1, 32]
    - [39, 7.24677]
  - - [16, 1472, 1, 1]
    - [39, 3.92533]
  - - [16, 1472, 1, 16]
    - [18, 62.8053]
  - - [16, 1472, 1, 32]
    - [39, 115.948]
  - - [32, 1472, 1, 1]
    - [23, 6.28053]
  - - [32, 1472, 1, 16]
    - [22, 107.666]
  - - [32, 1472, 1, 32]
    - [39, 215.333]
  - - [64, 1472, 1, 1]
    - [23, 14.4935]
  - - [64, 1472, 1, 16]
    - [10, 215.333]
  - - [64, 1472, 1, 32]
    - [11, 430.665]
  - - [192, 1472, 1, 1]
    - [26, 35.328]
  - - [192, 1472, 1, 16]
    - [21, 645.998]
  - - [192, 1472, 1, 32]
    - [21, 1205.86]
  - - [320, 1472, 1, 1]
    - [13, 58.88]
  - - [320, 1472, 1, 16]
    - [3, 837.404]
  - - [320, 1472, 1, 32]
    - [13, 1884.16]
  - - [448, 1472, 1, 1]
    - [24, 69.4164]
  - - [448, 1472, 1, 16]
    - [5, 1110.66]
  - - [448, 1472, 1, 32]
    - [3, 2110.26]
  - - [576, 1472, 1, 1]
    - [26, 77.0793]
  - - [576, 1472, 1, 16]
    - [61, 1427.99]
  - - [576, 1472, 1, 32]
    - [61, 2855.99]
  - - [704, 1472, 1, 1]
    - [61, 103.629]
  - - [704, 1472, 1, 16]
    - [55, 1381.72]
  - - [704, 1472, 1, 32]
    - [28, 2883.58]
  - - [832, 1472, 1, 1]
    - [61, 106.496]
  - - [832, 1472, 1, 16]
    - [61, 1781.39]
  - - [832, 1472, 1, 32]
    - [61, 3562.78]
  - - [960, 1472, 1, 1]
    - [61, 122.88]
  - - [960, 1472, 1, 16]
    - [37, 1884.16]
  - - [960, 1472, 1, 32]
    - [61, 3932.16]
  - - [1088, 1472, 1, 1]
    - [26, 118.632]
  - - [1088, 1472, 1, 16]
    - [61, 1971.12]
  - - [1088, 1472, 1, 32]
    - [55, 3796.23]
  - - [1216, 1472, 1, 1]
    - [3, 123.445]
  - - [1216, 1472, 1, 16]
    - [33, 2045.66]
  - - [1216, 1472, 1, 32]
    - [13, 3818.56]
  - - [1344, 1472, 1, 1]
    - [61, 136.439]
  - - [1344, 1472, 1, 16]
    - [61, 2183.03]
  - - [1344, 1472, 1, 32]
    - [14, 4084.37]
  - - [1472, 1472, 1, 1]
    - [61, 139.793]
  - - [1472, 1472, 1, 16]
    - [55, 2101.12]
  - - [1472, 1472, 1, 32]
    - [14, 4202.25]
  - - [1600, 1472, 1, 1]
    - [9, 138.541]
  - - [1600, 1472, 1, 16]
    - [49, 2355.2]
  - - [1600, 1472, 1, 32]
    - [49, 4710.4]
  - - [1728, 1472, 1, 1]
    - [14, 149.624]
  - - [1728, 1472, 1, 16]
    - [14, 2466.54]
  - - [1728, 1472, 1, 32]
    - [14, 4787.98]
  - - [1856, 1472, 1, 1]
    - [53, 160.708]
  - - [1856, 1472, 1, 16]
    - [14, 2571.32]
  - - [1856, 1472, 1, 32]
    - [14, 4995.72]
  - - [1984, 1472, 1, 1]
    - [14, 157.862]
  - - [1984, 1472, 1, 16]
    - [14, 2670.12]
  - - [1984, 1472, 1, 32]
    - [14, 5497.31]
  - - [192, 1600, 1, 1]
    - [35, 38.4]
  - - [192, 1600, 1, 16]
    - [13, 614.4]
  - - [192, 1600, 1, 32]
    - [28, 1156.52]
  - - [448, 1600, 1, 1]
    - [49, 75.4526]
  - - [448, 1600, 1, 16]
    - [42, 1207.24]
  - - [448, 1600, 1, 32]
    - [27, 2293.76]
  - - [704, 1600, 1, 1]
    - [43, 102.4]
  - - [704, 1600, 1, 16]
    - [61, 1716.42]
  - - [704, 1600, 1, 32]
    - [55, 3003.73]
  - - [960, 1600, 1, 1]
    - [61, 122.88]
  - - [960, 1600, 1, 16]
    - [61, 2137.04]
  - - [960, 1600, 1, 32]
    - [61, 4096.0]
  - - [1216, 1600, 1, 1]
    - [14, 125.523]
  - - [1216, 1600, 1, 16]
    - [37, 2075.31]
  - - [1216, 1600, 1, 32]
    - [49, 3662.31]
  - - [1472, 1600, 1, 1]
    - [49, 147.2]
  - - [1472, 1600, 1, 16]
    - [61, 2355.2]
  - - [1472, 1600, 1, 32]
    - [55, 4306.65]
  - - [1728, 1600, 1, 1]
    - [82, 153.6]
  - - [1728, 1600, 1, 16]
    - [14, 2602.16]
  - - [1728, 1600, 1, 32]
    - [61, 5204.33]
  - - [1984, 1600, 1, 1]
    - [37, 158.72]
  - - [1984, 1600, 1, 16]
    - [81, 2604.64]
  - - [1984, 1600, 1, 32]
    - [82, 5209.27]
  - - [1, 1728, 1, 64]
    - [44, 14.7456]
  - - [16, 1728, 1, 64]
    - [39, 252.782]
  - - [32, 1728, 1, 64]
    - [39, 544.453]
  - - [1, 1728, 1, 1]
    - [18, 0.265846]
  - - [1, 1728, 1, 16]
    - [15, 3.94971]
  - - [1, 1728, 1, 32]
    - [17, 10.0538]
  - - [16, 1728, 1, 1]
    - [65, 3.94971]
  - - [16, 1728, 1, 16]
    - [39, 68.0566]
  - - [16, 1728, 1, 32]
    - [10, 126.391]
  - - [32, 1728, 1, 1]
    - [45, 8.50708]
  - - [32, 1728, 1, 16]
    - [23, 126.391]
  - - [32, 1728, 1, 32]
    - [16, 272.226]
  - - [64, 1728, 1, 1]
    - [23, 15.7989]
  - - [64, 1728, 1, 16]
    - [11, 272.226]
  - - [64, 1728, 1, 32]
    - [23, 505.563]
  - - [192, 1728, 1, 1]
    - [13, 44.2368]
  - - [192, 1728, 1, 16]
    - [13, 707.789]
  - - [192, 1728, 1, 32]
    - [27, 1415.58]
  - - [320, 1728, 1, 1]
    - [9, 65.0541]
  - - [320, 1728, 1, 16]
    - [50, 983.04]
  - - [320, 1728, 1, 32]
    - [3, 1769.47]
  - - [448, 1728, 1, 1]
    - [3, 73.728]
  - - [448, 1728, 1, 16]
    - [24, 1303.82]
  - - [448, 1728, 1, 32]
    - [47, 2607.64]
  - - [576, 1728, 1, 1]
    - [55, 82.944]
  - - [576, 1728, 1, 16]
    - [81, 1447.75]
  - - [576, 1728, 1, 32]
    - [61, 3185.05]
  - - [704, 1728, 1, 1]
    - [61, 115.858]
  - - [704, 1728, 1, 16]
    - [31, 1692.54]
  - - [704, 1728, 1, 32]
    - [61, 3114.27]
  - - [832, 1728, 1, 1]
    - [14, 119.808]
  - - [832, 1728, 1, 16]
    - [14, 2000.27]
  - - [832, 1728, 1, 32]
    - [14, 3680.5]
  - - [960, 1728, 1, 1]
    - [61, 122.88]
  - - [960, 1728, 1, 16]
    - [55, 1830.49]
  - - [960, 1728, 1, 32]
    - [55, 3538.94]
  - - [1088, 1728, 1, 1]
    - [13, 129.66]
  - - [1088, 1728, 1, 16]
    - [61, 2228.22]
  - - [1088, 1728, 1, 32]
    - [36, 4010.8]
  - - [1216, 1728, 1, 1]
    - [61, 150.089]
  - - [1216, 1728, 1, 16]
    - [14, 2101.25]
  - - [1216, 1728, 1, 32]
    - [49, 4482.66]
  - - [1344, 1728, 1, 1]
    - [14, 140.753]
  - - [1344, 1728, 1, 16]
    - [61, 2322.43]
  - - [1344, 1728, 1, 32]
    - [14, 4504.11]
  - - [1472, 1728, 1, 1]
    - [14, 158.976]
  - - [1472, 1728, 1, 16]
    - [14, 2543.62]
  - - [1472, 1728, 1, 32]
    - [82, 4933.07]
  - - [1600, 1728, 1, 1]
    - [37, 149.449]
  - - [1600, 1728, 1, 16]
    - [14, 2681.02]
  - - [1600, 1728, 1, 32]
    - [38, 5204.33]
  - - [1728, 1728, 1, 1]
    - [14, 175.646]
  - - [1728, 1728, 1, 16]
    - [53, 2810.34]
  - - [1728, 1728, 1, 32]
    - [14, 5620.68]
  - - [1856, 1728, 1, 1]
    - [14, 164.47]
  - - [1856, 1728, 1, 16]
    - [14, 2631.52]
  - - [1856, 1728, 1, 32]
    - [53, 5401.55]
  - - [1984, 1728, 1, 1]
    - [37, 163.255]
  - - [1984, 1728, 1, 16]
    - [38, 2742.68]
  - - [1984, 1728, 1, 32]
    - [61, 5351.57]
  - - [192, 1856, 1, 1]
    - [26, 47.5136]
  - - [192, 1856, 1, 16]
    - [24, 760.218]
  - - [192, 1856, 1, 32]
    - [49, 1425.41]
  - - [448, 1856, 1, 1]
    - [82, 83.1488]
  - - [448, 1856, 1, 16]
    - [61, 1400.4]
  - - [448, 1856, 1, 32]
    - [24, 2534.06]
  - - [704, 1856, 1, 1]
    - [61, 100.51]
  - - [704, 1856, 1, 16]
    - [61, 1817.91]
  - - [704, 1856, 1, 32]
    - [37, 3484.33]
  - - [960, 1856, 1, 1]
    - [3, 127.269]
  - - [960, 1856, 1, 16]
    - [81, 2036.3]
  - - [960, 1856, 1, 32]
    - [28, 3932.16]
  - - [1216, 1856, 1, 1]
    - [14, 136.782]
  - - [1216, 1856, 1, 16]
    - [61, 2329.7]
  - - [1216, 1856, 1, 32]
    - [49, 4377.01]
  - - [1472, 1856, 1, 1]
    - [14, 160.708]
  - - [1472, 1856, 1, 16]
    - [14, 2649.24]
  - - [1472, 1856, 1, 32]
    - [14, 4995.72]
  - - [1728, 1856, 1, 1]
    - [14, 164.47]
  - - [1728, 1856, 1, 16]
    - [61, 2773.77]
  - - [1728, 1856, 1, 32]
    - [38, 5263.04]
  - - [1984, 1856, 1, 1]
    - [5, 167.377]
  - - [1984, 1856, 1, 16]
    - [82, 2740.32]
  - - [1984, 1856, 1, 32]
    - [37, 5611.13]
  - - [1, 1984, 1, 64]
    - [17, 19.5348]
  - - [16, 1984, 1, 64]
    - [16, 312.556]
  - - [32, 1984, 1, 64]
    - [103, 625.113]
  - - [1, 1984, 1, 1]
    - [23, 0.283429]
  - - [1, 1984, 1, 16]
    - [17, 4.88369]
  - - [1, 1984, 1, 32]
    - [18, 9.06971]
  - - [16, 1984, 1, 1]
    - [23, 4.53486]
  - - [16, 1984, 1, 16]
    - [16, 72.5577]
  - - [16, 1984, 1, 32]
    - [17, 156.278]
  - - [32, 1984, 1, 1]
    - [10, 9.76738]
  - - [32, 1984, 1, 16]
    - [15, 156.278]
  - - [32, 1984, 1, 32]
    - [39, 290.231]
  - - [64, 1984, 1, 1]
    - [11, 19.5348]
  - - [64, 1984, 1, 16]
    - [22, 290.231]
  - - [64, 1984, 1, 32]
    - [39, 625.113]
  - - [192, 1984, 1, 1]
    - [10, 42.3253]
  - - [192, 1984, 1, 16]
    - [24, 812.646]
  - - [192, 1984, 1, 32]
    - [31, 1625.29]
  - - [320, 1984, 1, 1]
    - [13, 70.5422]
  - - [320, 1984, 1, 16]
    - [5, 1015.81]
  - - [320, 1984, 1, 32]
    - [31, 2390.14]
  - - [448, 1984, 1, 1]
    - [5, 84.6507]
  - - [448, 1984, 1, 16]
    - [3, 1354.41]
  - - [448, 1984, 1, 32]
    - [27, 2708.82]
  - - [576, 1984, 1, 1]
    - [26, 103.889]
  - - [576, 1984, 1, 16]
    - [43, 1662.23]
  - - [576, 1984, 1, 32]
    - [55, 2925.53]
  - - [704, 1984, 1, 1]
    - [53, 121.455]
  - - [704, 1984, 1, 16]
    - [14, 1787.82]
  - - [704, 1984, 1, 32]
    - [37, 3724.63]
  - - [832, 1984, 1, 1]
    - [61, 132.055]
  - - [832, 1984, 1, 16]
    - [61, 1886.5]
  - - [832, 1984, 1, 32]
    - [31, 3773.0]
  - - [960, 1984, 1, 1]
    - [3, 136.046]
  - - [960, 1984, 1, 16]
    - [5, 2176.73]
  - - [960, 1984, 1, 32]
    - [50, 4203.34]
  - - [1088, 1984, 1, 1]
    - [61, 143.906]
  - - [1088, 1984, 1, 16]
    - [14, 2093.18]
  - - [1088, 1984, 1, 32]
    - [55, 4063.23]
  - - [1216, 1984, 1, 1]
    - [14, 146.215]
  - - [1216, 1984, 1, 16]
    - [37, 2339.44]
  - - [1216, 1984, 1, 32]
    - [14, 4678.87]
  - - [1344, 1984, 1, 1]
    - [53, 166.656]
  - - [1344, 1984, 1, 16]
    - [61, 2666.5]
  - - [1344, 1984, 1, 32]
    - [14, 4875.88]
  - - [1472, 1984, 1, 1]
    - [14, 176.997]
  - - [1472, 1984, 1, 16]
    - [53, 2748.66]
  - - [1472, 1984, 1, 32]
    - [14, 5497.31]
  - - [1600, 1984, 1, 1]
    - [14, 167.074]
  - - [1600, 1984, 1, 16]
    - [53, 2745.43]
  - - [1600, 1984, 1, 32]
    - [81, 5209.27]
  - - [1728, 1984, 1, 1]
    - [61, 175.813]
  - - [1728, 1984, 1, 16]
    - [61, 2887.03]
  - - [1728, 1984, 1, 32]
    - [53, 5224.16]
  - - [1856, 1984, 1, 1]
    - [37, 179.625]
  - - [1856, 1984, 1, 16]
    - [61, 3021.38]
  - - [1856, 1984, 1, 32]
    - [14, 5480.64]
  - - [1984, 1984, 1, 1]
    - [53, 178.921]
  - - [1984, 1984, 1, 16]
    - [61, 3072.2]
  - - [192, 1, 1, 256]
    - [17, 8.192]
  - - [192, 16, 1, 256]
    - [17, 112.347]
  - - [192, 32, 1, 256]
    - [39, 224.695]
  - - [448, 1, 1, 256]
    - [16, 16.384]
  - - [448, 16, 1, 256]
    - [10, 262.144]
  - - [448, 32, 1, 256]
    - [17, 524.288]
  - - [704, 1, 1, 256]
    - [10, 27.7268]
  - - [704, 16, 1, 256]
    - [15, 411.941]
  - - [704, 32, 1, 256]
    - [17, 823.881]
  - - [960, 1, 1, 256]
    - [17, 37.8092]
  - - [960, 16, 1, 256]
    - [93, 561.737]
  - - [960, 32, 1, 256]
    - [63, 1209.9]
  - - [1216, 1, 1, 256]
    - [10, 44.4709]
  - - [1216, 16, 1, 256]
    - [39, 711.534]
  - - [1216, 32, 1, 256]
    - [10, 1423.07]
  - - [1472, 1, 1, 256]
    - [11, 47.104]
  - - [1472, 16, 1, 256]
    - [39, 803.908]
  - - [1472, 32, 1, 256]
    - [10, 1507.33]
  - - [1728, 1, 1, 256]
    - [10, 63.1954]
  - - [1728, 16, 1, 256]
    - [39, 1011.13]
  - - [1728, 32, 1, 256]
    - [21, 2177.81]
  - - [1984, 1, 1, 256]
    - [102, 67.7205]
  - - [1984, 16, 1, 256]
    - [106, 1160.92]
  - - [1984, 32, 1, 256]
    - [23, 2167.06]
  - - [1, 192, 1, 256]
    - [15, 7.02171]
  - - [16, 192, 1, 256]
    - [19, 120.99]
  - - [32, 192, 1, 256]
    - [16, 241.979]
  - - [1, 448, 1, 256]
    - [16, 17.6443]
  - - [16, 448, 1, 256]
    - [16, 305.835]
  - - [32, 448, 1, 256]
    - [16, 611.669]
  - - [1, 704, 1, 256]
    - [39, 25.7463]
  - - [16, 704, 1, 256]
    - [18, 443.628]
  - - [32, 704, 1, 256]
    - [15, 887.257]
  - - [1, 960, 1, 256]
    - [62, 37.8092]
  - - [16, 960, 1, 256]
    - [10, 561.737]
  - - [32, 960, 1, 256]
    - [18, 1209.9]
  - - [1, 1216, 1, 256]
    - [16, 51.8827]
  - - [16, 1216, 1, 256]
    - [10, 664.098]
  - - [32, 1216, 1, 256]
    - [16, 1532.53]
  - - [1, 1472, 1, 256]
    - [23, 50.2443]
  - - [16, 1472, 1, 256]
    - [54, 803.908]
  - - [32, 1472, 1, 256]
    - [17, 1722.66]
  - - [1, 1728, 1, 256]
    - [16, 63.1954]
  - - [16, 1728, 1, 256]
    - [98, 1011.13]
  - - [32, 1728, 1, 256]
    - [15, 2022.25]
  - - [1, 1984, 1, 256]
    - [17, 72.5577]
  - - [16, 1984, 1, 256]
    - [17, 1160.92]
  - - [32, 1984, 1, 256]
    - [17, 2321.85]
  - - [192, 1, 1, 512]
    - [62, 14.0434]
  - - [192, 16, 1, 512]
    - [64, 209.715]
  - - [192, 32, 1, 512]
    - [22, 419.43]
  - - [448, 1, 1, 512]
    - [17, 35.2886]
  - - [448, 16, 1, 512]
    - [10, 524.288]
  - - [448, 32, 1, 512]
    - [40, 1048.58]
  - - [704, 1, 1, 512]
    - [86, 48.0597]
  - - [704, 16, 1, 512]
    - [22, 720.896]
  - - [704, 32, 1, 512]
    - [21, 1647.76]
  - - [960, 1, 1, 512]
    - [64, 61.44]
  - - [960, 16, 1, 512]
    - [11, 983.04]
  - - [960, 32, 1, 512]
    - [63, 2246.95]
  - - [1216, 1, 1, 512]
    - [10, 77.824]
  - - [1216, 16, 1, 512]
    - [62, 1328.2]
  - - [1216, 32, 1, 512]
    - [40, 2490.37]
  - - [1472, 1, 1, 512]
    - [86, 88.6664]
  - - [1472, 16, 1, 512]
    - [93, 1418.66]
  - - [1472, 32, 1, 512]
    - [17, 2679.69]
  - - [1728, 1, 1, 512]
    - [39, 98.304]
  - - [1728, 16, 1, 512]
    - [19, 1665.39]
  - - [1728, 32, 1, 512]
    - [39, 3145.73]
  - - [1984, 1, 1, 512]
    - [19, 119.507]
  - - [1984, 16, 1, 512]
    - [11, 1805.88]
  - - [1984, 32, 1, 512]
    - [39, 3611.76]
  - - [1, 192, 1, 512]
    - [10, 14.0434]
  - - [16, 192, 1, 512]
    - [16, 241.979]
  - - [32, 192, 1, 512]
    - [10, 449.39]
  - - [1, 448, 1, 512]
    - [39, 30.5835]
  - - [16, 448, 1, 512]
    - [112, 524.288]
  - - [32, 448, 1, 512]
    - [10, 978.671]
  - - [1, 704, 1, 512]
    - [16, 55.4535]
  - - [16, 704, 1, 512]
    - [16, 961.195]
  - - [32, 704, 1, 512]
    - [20, 1647.76]
  - - [1, 960, 1, 512]
    - [16, 75.6185]
  - - [16, 960, 1, 512]
    - [10, 1123.47]
  - - [32, 960, 1, 512]
    - [16, 2246.95]
  - - [1, 1216, 1, 512]
    - [15, 88.9417]
  - - [16, 1216, 1, 512]
    - [17, 1328.2]
  - - [32, 1216, 1, 512]
    - [11, 2490.37]
  - - [1, 1472, 1, 512]
    - [103, 94.208]
  - - [16, 1472, 1, 512]
    - [63, 1722.66]
  - - [32, 1472, 1, 512]
    - [18, 3445.32]
  - - [1, 1728, 1, 512]
    - [39, 104.087]
  - - [16, 1728, 1, 512]
    - [45, 1887.44]
  - - [32, 1728, 1, 512]
    - [16, 3774.87]
  - - [1, 1984, 1, 512]
    - [45, 119.507]
  - - [16, 1984, 1, 512]
    - [39, 1805.88]
  - - [32, 1984, 1, 512]
    - [112, 4334.11]
  - - [192, 1, 1, 1024]
    - [86, 24.576]
  - - [192, 16, 1, 1024]
    - [118, 393.216]
  - - [192, 32, 1, 1024]
    - [86, 786.432]
  - - [448, 1, 1, 1024]
    - [118, 53.9708]
  - - [448, 16, 1, 1024]
    - [16, 917.504]
  - - [448, 32, 1, 1024]
    - [16, 1631.12]
  - - [704, 1, 1, 1024]
    - [86, 72.0896]
  - - [704, 16, 1, 1024]
    - [62, 1281.59]
  - - [704, 32, 1, 1024]
    - [40, 2563.19]
  - - [960, 1, 1, 1024]
    - [107, 109.227]
  - - [960, 16, 1, 1024]
    - [19, 1655.65]
  - - [960, 32, 1, 1024]
    - [112, 3311.29]
  - - [1216, 1, 1, 1024]
    - [62, 118.589]
  - - [1216, 16, 1, 1024]
    - [17, 1897.42]
  - - [1216, 32, 1, 1024]
    - [62, 3794.85]
  - - [1472, 1, 1, 1024]
    - [107, 131.072]
  - - [1472, 16, 1, 1024]
    - [19, 2097.15]
  - - [1472, 32, 1, 1024]
    - [22, 4019.54]
  - - [1728, 1, 1, 1024]
    - [118, 153.867]
  - - [1728, 16, 1, 1024]
    - [40, 2264.92]
  - - [1728, 32, 1, 1024]
    - [11, 4355.62]
  - - [1984, 1, 1, 1024]
    - [118, 162.529]
  - - [1984, 16, 1, 1024]
    - [118, 2826.6]
  - - [1984, 32, 1, 1024]
    - [19, 5000.9]
  - - [1, 192, 1, 1024]
    - [16, 28.0869]
  - - [16, 192, 1, 1024]
    - [21, 370.086]
  - - [32, 192, 1, 1024]
    - [63, 898.779]
  - - [1, 448, 1, 1024]
    - [62, 61.1669]
  - - [16, 448, 1, 1024]
    - [16, 1048.58]
  - - [32, 448, 1, 1024]
    - [16, 1957.34]
  - - [1, 704, 1, 1024]
    - [63, 102.985]
  - - [16, 704, 1, 1024]
    - [62, 1537.91]
  - - [32, 704, 1, 1024]
    - [16, 3075.82]
  - - [1, 960, 1, 1024]
    - [117, 115.652]
  - - [16, 960, 1, 1024]
    - [105, 1850.43]
  - - [32, 960, 1, 1024]
    - [20, 4194.3]
  - - [1, 1216, 1, 1024]
    - [16, 146.492]
  - - [16, 1216, 1, 1024]
    - [16, 2656.39]
  - - [32, 1216, 1, 1024]
    - [16, 3984.59]
  - - [1, 1472, 1, 1024]
    - [16, 188.416]
  - - [16, 1472, 1, 1024]
    - [16, 3014.66]
  - - [32, 1472, 1, 1024]
    - [65, 5359.39]
  - - [1, 1728, 1, 1024]
    - [63, 208.173]
  - - [16, 1728, 1, 1024]
    - [63, 3538.94]
  - - [32, 1728, 1, 1024]
    - [15, 6291.46]
  - - [1, 1984, 1, 1024]
    - [16, 213.854]
  - - [16, 1984, 1, 1024]
    - [16, 3611.76]
  - - [32, 1984, 1, 1024]
    - [18, 5910.16]
  - - [192, 1, 1, 2048]
    - [62, 49.152]
  - - [192, 16, 1, 2048]
    - [16, 740.171]
  - - [192, 32, 1, 2048]
    - [40, 1398.1]
  - - [448, 1, 1, 2048]
    - [62, 101.945]
  - - [448, 16, 1, 2048]
    - [118, 1468.01]
  - - [448, 32, 1, 2048]
    - [19, 3090.54]
  - - [704, 1, 1, 2048]
    - [118, 144.179]
  - - [704, 16, 1, 2048]
    - [86, 2097.15]
  - - [704, 32, 1, 2048]
    - [19, 4394.03]
  - - [960, 1, 1, 2048]
    - [110, 187.246]
  - - [960, 16, 1, 2048]
    - [112, 2995.93]
  - - [960, 32, 1, 2048]
    - [108, 5470.83]
  - - [1216, 1, 1, 2048]
    - [62, 191.567]
  - - [1216, 16, 1, 2048]
    - [105, 3187.67]
  - - [1216, 32, 1, 2048]
    - [62, 6640.98]
  - - [1472, 1, 1, 2048]
    - [118, 231.897]
  - - [1472, 16, 1, 2048]
    - [105, 3445.32]
  - - [1472, 32, 1, 2048]
    - [40, 6431.27]
  - - [1728, 1, 1, 2048]
    - [118, 262.144]
  - - [1728, 16, 1, 2048]
    - [118, 4044.51]
  - - [1728, 32, 1, 2048]
    - [19, 7810.08]
  - - [1984, 1, 1, 2048]
    - [100, 290.231]
  - - [1984, 16, 1, 2048]
    - [110, 4483.57]
  - - [1, 192, 1, 2048]
    - [16, 43.6907]
  - - [16, 192, 1, 2048]
    - [62, 786.432]
  - - [32, 192, 1, 2048]
    - [16, 1480.34]
  - - [1, 448, 1, 2048]
    - [109, 107.942]
  - - [16, 448, 1, 2048]
    - [16, 1727.07]
  - - [32, 448, 1, 2048]
    - [16, 3454.13]
  - - [1, 704, 1, 2048]
    - [63, 169.623]
  - - [16, 704, 1, 2048]
    - [63, 2713.96]
  - - [32, 704, 1, 2048]
    - [20, 5126.37]
  - - [1, 960, 1, 2048]
    - [16, 231.304]
  - - [16, 960, 1, 2048]
    - [105, 3495.25]
  - - [32, 960, 1, 2048]
    - [20, 6990.51]
  - - [1, 1216, 1, 2048]
    - [16, 262.144]
  - - [16, 1216, 1, 2048]
    - [63, 4194.3]
  - - [32, 1216, 1, 2048]
    - [107, 8388.61]
  - - [1, 1472, 1, 2048]
    - [16, 301.466]
  - - [16, 1472, 1, 2048]
    - [93, 4384.95]
  - - [32, 1472, 1, 2048]
    - [112, 8769.91]
  - - [1, 1728, 1, 2048]
    - [63, 372.52]
  - - [16, 1728, 1, 2048]
    - [16, 5960.33]
  - - [32, 1728, 1, 2048]
    - [18, 9847.5]
  - - [1, 1984, 1, 2048]
    - [63, 406.323]
  - - [16, 1984, 1, 2048]
    - [16, 6501.17]
  - - [192, 1, 1, 4096]
    - [86, 71.4938]
  - - [192, 16, 1, 4096]
    - [62, 1198.37]
  - - [192, 32, 1, 4096]
    - [62, 2396.75]
  - - [448, 1, 1, 4096]
    - [118, 159.566]
  - - [448, 16, 1, 4096]
    - [112, 2258.47]
  - - [448, 32, 1, 4096]
    - [62, 5338.21]
  - - [704, 1, 1, 4096]
    - [100, 250.746]
  - - [704, 16, 1, 4096]
    - [118, 3295.52]
  - - [704, 32, 1, 4096]
    - [63, 6835.16]
  - - [960, 1, 1, 4096]
    - [118, 271.183]
  - - [960, 16, 1, 4096]
    - [106, 4839.58]
  - - [1216, 1, 1, 4096]
    - [105, 355.767]
  - - [1216, 16, 1, 4096]
    - [106, 4980.74]
  - - [1472, 1, 1, 4096]
    - [101, 344.532]
  - - [1472, 16, 1, 4096]
    - [79, 5512.51]
  - - [1728, 1, 1, 4096]
    - [63, 428.963]
  - - [1728, 16, 1, 4096]
    - [63, 6291.46]
  - - [1984, 1, 1, 4096]
    - [101, 416.742]
  - - [1, 192, 1, 4096]
    - [16, 71.4938]
  - - [16, 192, 1, 4096]
    - [62, 1258.29]
  - - [32, 192, 1, 4096]
    - [86, 2287.8]
  - - [1, 448, 1, 4096]
    - [16, 166.819]
  - - [16, 448, 1, 4096]
    - [62, 2348.81]
  - - [32, 448, 1, 4096]
    - [62, 4893.35]
  - - [1, 704, 1, 4096]
    - [93, 221.814]
  - - [16, 704, 1, 4096]
    - [16, 4011.94]
  - - [32, 704, 1, 4096]
    - [63, 8023.89]
  - - [1, 960, 1, 4096]
    - [79, 327.68]
  - - [16, 960, 1, 4096]
    - [16, 5470.83]
  - - [1, 1216, 1, 4096]
    - [18, 415.061]
  - - [16, 1216, 1, 4096]
    - [16, 6375.34]
  - - [1, 1472, 1, 4096]
    - [63, 463.793]
  - - [16, 1472, 1, 4096]
    - [16, 6890.64]
  - - [1, 1728, 1, 4096]
    - [63, 456.638]
  - - [16, 1728, 1, 4096]
    - [63, 7306.21]
  - - [1, 1984, 1, 4096]
    - [16, 492.513]
  - - [128, 1, 1, 64]
    - [39, 1.26031]
  - - [128, 16, 1, 64]
    - [20, 20.1649]
  - - [128, 32, 1, 64]
    - [17, 40.3298]
  - - [128, 1, 1, 1]
    - [15, 0.0213333]
  - - [128, 1, 1, 16]
    - [17, 0.341333]
  - - [128, 1, 1, 32]
    - [16, 0.630154]
  - - [128, 16, 1, 1]
    - [11, 0.292571]
  - - [128, 16, 1, 16]
    - [17, 5.04123]
  - - [128, 16, 1, 32]
    - [17, 10.0825]
  - - [128, 32, 1, 1]
    - [17, 0.630154]
  - - [128, 32, 1, 16]
    - [17, 10.9227]
  - - [128, 32, 1, 32]
    - [17, 20.1649]
  - - [128, 64, 1, 1]
    - [17, 1.48945]
  - - [128, 64, 1, 16]
    - [15, 20.1649]
  - - [128, 64, 1, 32]
    - [17, 43.6907]
  - - [256, 1, 1, 64]
    - [15, 2.97891]
  - - [256, 16, 1, 64]
    - [17, 40.3298]
  - - [256, 32, 1, 64]
    - [15, 87.3813]
  - - [256, 64, 1, 1]
    - [23, 2.34057]
  - - [256, 64, 1, 16]
    - [10, 40.3298]
  - - [256, 64, 1, 32]
    - [17, 87.3813]
  - - [384, 1, 1, 64]
    - [15, 3.78092]
  - - [384, 16, 1, 64]
    - [39, 60.4948]
  - - [384, 32, 1, 64]
    - [64, 131.072]
  - - [384, 1, 1, 1]
    - [22, 0.0590769]
  - - [384, 1, 1, 16]
    - [11, 0.877714]
  - - [384, 1, 1, 32]
    - [16, 1.75543]
  - - [384, 16, 1, 1]
    - [23, 1.024]
  - - [384, 16, 1, 16]
    - [17, 15.1237]
  - - [384, 16, 1, 32]
    - [17, 32.768]
  - - [384, 32, 1, 1]
    - [39, 2.048]
  - - [384, 32, 1, 16]
    - [16, 30.2474]
  - - [384, 32, 1, 32]
    - [16, 65.536]
  - - [384, 64, 1, 1]
    - [39, 3.78092]
  - - [384, 64, 1, 16]
    - [63, 60.4948]
  - - [384, 64, 1, 32]
    - [10, 131.072]
  - - [512, 1, 1, 64]
    - [16, 5.46133]
  - - [512, 16, 1, 64]
    - [21, 87.3813]
  - - [512, 32, 1, 64]
    - [39, 174.763]
  - - [512, 64, 1, 1]
    - [22, 5.04123]
  - - [512, 64, 1, 16]
    - [21, 87.3813]
  - - [512, 64, 1, 32]
    - [15, 174.763]
  - - [640, 1, 1, 64]
    - [39, 6.30154]
  - - [640, 16, 1, 64]
    - [17, 100.825]
  - - [640, 32, 1, 64]
    - [17, 218.453]
  - - [640, 1, 1, 1]
    - [15, 0.0984615]
  - - [640, 1, 1, 16]
    - [10, 1.70667]
  - - [640, 1, 1, 32]
    - [79, 3.41333]
  - - [640, 16, 1, 1]
    - [10, 1.57538]
  - - [640, 16, 1, 16]
    - [17, 27.3067]
  - - [640, 16, 1, 32]
    - [17, 54.6133]
  - - [640, 32, 1, 1]
    - [39, 3.41333]
  - - [640, 32, 1, 16]
    - [22, 50.4123]
  - - [640, 32, 1, 32]
    - [17, 109.227]
  - - [640, 64, 1, 1]
    - [22, 6.30154]
  - - [640, 64, 1, 16]
    - [15, 100.825]
  - - [640, 64, 1, 32]
    - [15, 201.649]
  - - [768, 1, 1, 64]
    - [17, 8.93673]
  - - [768, 16, 1, 64]
    - [17, 131.072]
  - - [768, 32, 1, 64]
    - [17, 262.144]
  - - [768, 1, 1, 1]
    - [39, 0.118154]
  - - [768, 1, 1, 16]
    - [17, 2.23418]
  - - [768, 1, 1, 32]
    - [17, 3.78092]
  - - [768, 16, 1, 1]
    - [17, 2.048]
  - - [768, 16, 1, 16]
    - [17, 30.2474]
  - - [768, 16, 1, 32]
    - [23, 60.4948]
  - - [768, 32, 1, 1]
    - [39, 3.78092]
  - - [768, 32, 1, 16]
    - [39, 56.1737]
  - - [768, 32, 1, 32]
    - [16, 131.072]
  - - [768, 64, 1, 1]
    - [15, 7.56185]
  - - [768, 64, 1, 16]
    - [11, 131.072]
  - - [768, 64, 1, 32]
    - [17, 262.144]
  - - [896, 1, 1, 64]
    - [11, 8.192]
  - - [896, 16, 1, 64]
    - [21, 141.154]
  - - [896, 32, 1, 64]
    - [16, 282.309]
  - - [896, 1, 1, 1]
    - [39, 0.137846]
  - - [896, 1, 1, 16]
    - [10, 2.38933]
  - - [896, 1, 1, 32]
    - [102, 4.77867]
  - - [896, 16, 1, 1]
    - [23, 2.048]
  - - [896, 16, 1, 16]
    - [16, 38.2293]
  - - [896, 16, 1, 32]
    - [23, 70.5772]
  - - [896, 32, 1, 1]
    - [22, 4.41108]
  - - [896, 32, 1, 16]
    - [21, 76.4587]
  - - [896, 32, 1, 32]
    - [15, 152.917]
  - - [896, 64, 1, 1]
    - [39, 8.82215]
  - - [896, 64, 1, 16]
    - [21, 152.917]
  - - [896, 64, 1, 32]
    - [11, 282.309]
  - - [1024, 1, 1, 64]
    - [17, 10.0825]
  - - [1024, 16, 1, 64]
    - [39, 161.319]
  - - [1024, 32, 1, 64]
    - [15, 299.593]
  - - [1024, 64, 1, 1]
    - [39, 10.9227]
  - - [1024, 64, 1, 16]
    - [19, 174.763]
  - - [1024, 64, 1, 32]
    - [40, 322.639]
  - - [1, 128, 1, 64]
    - [25, 1.17029]
  - - [16, 128, 1, 64]
    - [17, 21.8453]
  - - [32, 128, 1, 64]
    - [39, 40.3298]
  - - [1, 128, 1, 1]
    - [39, 0.0196923]
  - - [1, 128, 1, 16]
    - [39, 0.292571]
  - - [1, 128, 1, 32]
    - [15, 0.682667]
  - - [16, 128, 1, 1]
    - [15, 0.315077]
  - - [16, 128, 1, 16]
    - [16, 5.95782]
  - - [16, 128, 1, 32]
    - [17, 11.9156]
  - - [32, 128, 1, 1]
    - [39, 0.630154]
  - - [32, 128, 1, 16]
    - [15, 11.9156]
  - - [32, 128, 1, 32]
    - [17, 20.1649]
  - - [64, 128, 1, 1]
    - [23, 1.26031]
  - - [64, 128, 1, 16]
    - [39, 20.1649]
  - - [64, 128, 1, 32]
    - [16, 43.6907]
  - - [128, 128, 1, 1]
    - [16, 2.73067]
  - - [128, 128, 1, 16]
    - [10, 40.3298]
  - - [128, 128, 1, 32]
    - [11, 80.6597]
  - - [192, 128, 1, 1]
    - [39, 3.78092]
  - - [192, 128, 1, 16]
    - [20, 71.4938]
  - - [192, 128, 1, 32]
    - [15, 131.072]
  - - [256, 128, 1, 1]
    - [10, 5.46133]
  - - [256, 128, 1, 16]
    - [23, 80.6597]
  - - [256, 128, 1, 32]
    - [21, 190.65]
