projects/hipblaslt/library/src/amd_detail/rocblaslt/src/Tensile/Logic/asm_full/gfx1151/GridBased/gfx1151_Cijk_Ailk_Bljk_BBS_BH_Bias_HAS_SAV_UserArgs.yaml
- {MinimumRequiredVersion: 5.0.0}
- gfx1151
- gfx1151
- [Device 1536]
    SolutionIndex: 0
    SolutionNameMin: Cijk_Ailk_Bljk_BBS_BH_Bias_HA_S_SAV_UserArgs_MT32x32x32_MI16x16x1_CMS_SN_LDSB0_AFC1_AG0_AFEM1_AFEM1_ASEM1_CLR1_CADS0_DTLA0_DTLB0_DTVA0_DTVB0_DTVSM0_DPLBn1_EPS0_ELFLR0_EMLLn1_FDSI0_GRPM1_GRVWA2_GRVWB8_GSU1_GSUAMB_GSUC0_GSUWGMRR0_GLS0_ISA1151_IU1_LDSTI0_LBSPPA1024_LBSPPB128_LBSPPM0_LPA16_LPB16_LPM0_LRVW16_LWPMn1_MIAV1_MIWT1_1_MO40_MGRIPMn1_NTn1_NTA0_NTB0_NTC0_NTD0_NTM0_NEPBS0_NLCA1_NLCB1_ONLL1_PGR2_PLR1_PKA0_SGROBn1_SIA3_SS0_SU32_SUM1_SUS256_SPO0_SRVW0_SSO0_SVW1_SK0_SKFTR0_SKXCCM0_SGRO0_TIN0_TLDS1_TLDSM1_ULSGRO0_USL1_UIOFGRO0_UPLRP0_USFGROn1_VSn1_VWA1_VWB1_WSGRA0_WSGRB0_WS32_WG32_4_1_WGM8_WGMXCC1_WGMXCCGn1
    SolutionIndex: 1
    SolutionNameMin: Cijk_Ailk_Bljk_BBS_BH_Bias_HA_S_SAV_UserArgs_MT32x32x32_MI16x16x1_CMS_SN_LDSB0_AFC1_AG0_AFEM1_AFEM1_ASEM1_CLR1_CADS0_DTLA0_DTLB0_DTVA0_DTVB0_DTVSM0_DPLBn1_EPS0_ELFLR0_EMLLn1_FDSI0_GRPM1_GRVWA2_GRVWB1_GSU1_GSUAMB_GSUC0_GSUWGMRR0_GLS0_ISA1151_IU1_LDSTI0_LBSPPA1024_LBSPPB1024_LBSPPM0_LPA16_LPB16_LPM0_LRVW16_LWPMn1_MIAV1_MIWT1_1_MO40_MGRIPMn1_NTn1_NTA0_NTB0_NTC0_NTD0_NTM0_NEPBS0_NLCA1_NLCB1_ONLL1_PGR2_PLR1_PKA0_SGROBn1_SIA3_SS0_SU32_SUM1_SUS256_SPO0_SRVW0_SSO0_SVW1_SK0_SKFTR0_SKXCCM0_SGRO0_TIN0_TLDS0_TLDSM1_ULSGRO0_USL1_UIOFGRO0_UPLRP0_USFGROn1_VSn1_VWA1_VWB1_WSGRA0_WSGRB0_WS32_WG32_4_1_WGM8_WGMXCC1_WGMXCCGn1
    SolutionIndex: 2
    SolutionNameMin: Cijk_Ailk_Bljk_BBS_BH_Bias_HA_S_SAV_UserArgs_MT16x64x32_MI16x16x1_CMS_SN_LDSB0_AFC1_AG0_AFEM1_AFEM1_ASEM1_CLR1_CADS0_DTLA0_DTLB0_DTVA0_DTVB0_DTVSM0_DPLBn1_EPS0_ELFLR0_EMLLn1_FDSI0_GRPM1_GRVWA1_GRVWB8_GSU1_GSUAMB_GSUC0_GSUWGMRR0_GLS0_ISA1151_IU1_LDSTI0_LBSPPA512_LBSPPB2048_LBSPPM0_LPA16_LPB16_LPM0_LRVW16_LWPMn1_MIAV1_MIWT1_1_MO40_MGRIPMn1_NTn1_NTA0_NTB0_NTC0_NTD0_NTM0_NEPBS0_NLCA1_NLCB1_ONLL1_PGR2_PLR1_PKA0_SGROBn1_SIA3_SS0_SU32_SUM1_SUS256_SPO0_SRVW0_SSO0_SVW1_SK0_SKFTR0_SKXCCM0_SGRO0_TIN0_TLDS0_TLDSM1_ULSGRO0_USL1_UIOFGRO0_UPLRP0_USFGROn1_VSn1_VWA1_VWB1_WSGRA0_WSGRB0_WS32_WG16_8_1_WGM8_WGMXCC1_WGMXCCGn1
    SolutionIndex: 3
    SolutionNameMin: Cijk_Ailk_Bljk_BBS_BH_Bias_HA_S_SAV_UserArgs_MT64x16x64_MI16x16x1_CMS_SN_LDSB0_AFC1_AG0_AFEM1_AFEM1_ASEM1_CLR1_CADS0_DTLA0_DTLB0_DTVA0_DTVB0_DTVSM0_DPLBn1_EPS0_ELFLR0_EMLLn1_FDSI0_GRPM1_GRVWA1_GRVWB8_GSU1_GSUAMB_GSUC0_GSUWGMRR0_GLS0_ISA1151_IU1_LDSTI0_LBSPPA2048_LBSPPB128_LBSPPM0_LPA16_LPB16_LPM0_LRVW16_LWPMn1_MIAV1_MIWT1_1_MO40_MGRIPMn1_NTn1_NTA0_NTB0_NTC0_NTD0_NTM0_NEPBS0_NLCA1_NLCB1_ONLL1_PGR2_PLR1_PKA0_SGROBn1_SIA3_SS0_SU32_SUM1_SUS256_SPO0_SRVW0_SSO0_SVW1_SK0_SKFTR0_SKXCCM0_SGRO0_TIN0_TLDS1_TLDSM1_ULSGRO0_USL1_UIOFGRO0_UPLRP0_USFGROn1_VSn1_VWA1_VWB1_WSGRA0_WSGRB0_WS32_WG64_2_1_WGM8_WGMXCC1_WGMXCCGn1
    SolutionIndex: 4
    SolutionNameMin: Cijk_Ailk_Bljk_BBS_BH_Bias_HA_S_SAV_UserArgs_MT32x32x64_MI16x16x1_CMS_SN_LDSB0_AFC1_AG0_AFEM1_AFEM1_ASEM1_CLR1_CADS0_DTLA0_DTLB0_DTVA0_DTVB0_DTVSM0_DPLBn1_EPS0_ELFLR0_EMLLn1_FDSI0_GRPM1_GRVWA1_GRVWB8_GSU1_GSUAMB_GSUC0_GSUWGMRR0_GLS0_ISA1151_IU1_LDSTI0_LBSPPA1024_LBSPPB1024_LBSPPM0_LPA16_LPB16_LPM0_LRVW16_LWPMn1_MIAV1_MIWT1_1_MO40_MGRIPMn1_NTn1_NTA0_NTB0_NTC0_NTD0_NTM0_NEPBS0_NLCA1_NLCB1_ONLL1_PGR2_PLR1_PKA0_SGROBn1_SIA3_SS0_SU32_SUM1_SUS256_SPO0_SRVW0_SSO0_SVW1_SK0_SKFTR0_SKXCCM0_SGRO0_TIN0_TLDS0_TLDSM1_ULSGRO0_USL1_UIOFGRO0_UPLRP0_USFGROn1_VSn1_VWA1_VWB1_WSGRA0_WSGRB0_WS32_WG32_4_1_WGM8_WGMXCC1_WGMXCCGn1
    SolutionIndex: 5
    SolutionNameMin: Cijk_Ailk_Bljk_BBS_BH_Bias_HA_S_SAV_UserArgs_MT16x64x64_MI16x16x1_CMS_SN_LDSB0_AFC1_AG0_AFEM1_AFEM1_ASEM1_CLR1_CADS0_DTLA0_DTLB0_DTVA0_DTVB0_DTVSM0_DPLBn1_EPS0_ELFLR0_EMLLn1_FDSI0_GRPM1_GRVWA1_GRVWB8_GSU1_GSUAMB_GSUC0_GSUWGMRR0_GLS0_ISA1151_IU1_LDSTI0_LBSPPA512_LBSPPB2048_LBSPPM0_LPA16_LPB16_LPM0_LRVW16_LWPMn1_MIAV1_MIWT1_1_MO40_MGRIPMn1_NTn1_NTA0_NTB0_NTC0_NTD0_NTM0_NEPBS0_NLCA1_NLCB1_ONLL1_PGR2_PLR1_PKA0_SGROBn1_SIA3_SS0_SU32_SUM1_SUS256_SPO0_SRVW0_SSO0_SVW1_SK0_SKFTR0_SKXCCM0_SGRO0_TIN0_TLDS0_TLDSM1_ULSGRO0_USL1_UIOFGRO0_UPLRP0_USFGROn1_VSn1_VWA1_VWB1_WSGRA0_WSGRB0_WS32_WG16_8_1_WGM8_WGMXCC1_WGMXCCGn1
    SolutionIndex: 6
    SolutionNameMin: Cijk_Ailk_Bljk_BBS_BH_Bias_HA_S_SAV_UserArgs_MT64x16x32_MI16x16x1_CMS_SN_LDSB0_AFC1_AG0_AFEM1_AFEM1_ASEM1_CLR1_CADS0_DTLA0_DTLB0_DTVA0_DTVB0_DTVSM0_DPLBn1_EPS0_ELFLR0_EMLLn1_FDSI0_GRPM1_GRVWA8_GRVWB4_GSU1_GSUAMB_GSUC0_GSUWGMRR0_GLS0_ISA1151_IU1_LDSTI0_LBSPPA2048_LBSPPB512_LBSPPM0_LPA16_LPB16_LPM0_LRVW16_LWPMn1_MIAV1_MIWT1_1_MO40_MGRIPMn1_NTn1_NTA0_NTB0_NTC0_NTD0_NTM0_NEPBS0_NLCA1_NLCB1_ONLL1_PGR2_PLR1_PKA0_SGROBn1_SIA3_SS1_SU32_SUM1_SUS256_SPO0_SRVW0_SSO0_SVW1_SK0_SKFTR0_SKXCCM0_SGRO0_TIN0_TLDS0_TLDSM1_ULSGRO0_USL1_UIOFGRO0_UPLRP0_USFGROn1_VSn1_VWA1_VWB1_WSGRA0_WSGRB0_WS32_WG64_2_1_WGM8_WGMXCC1_WGMXCCGn1
    SolutionIndex: 7
    SolutionNameMin: Cijk_Ailk_Bljk_BBS_BH_Bias_HA_S_SAV_UserArgs_MT64x16x32_MI16x16x1_CMS_SN_LDSB0_AFC1_AG0_AFEM1_AFEM1_ASEM1_CLR1_CADS0_DTLA0_DTLB0_DTVA0_DTVB0_DTVSM0_DPLBn1_EPS0_ELFLR0_EMLLn1_FDSI0_GRPM1_GRVWA8_GRVWB4_GSU1_GSUAMB_GSUC0_GSUWGMRR0_GLS0_ISA1151_IU1_LDSTI0_LBSPPA2048_LBSPPB128_LBSPPM0_LPA16_LPB16_LPM0_LRVW16_LWPMn1_MIAV1_MIWT1_1_MO40_MGRIPMn1_NTn1_NTA0_NTB0_NTC0_NTD0_NTM0_NEPBS0_NLCA1_NLCB1_ONLL1_PGR2_PLR1_PKA0_SGROBn1_SIA3_SS1_SU32_SUM1_SUS256_SPO0_SRVW0_SSO0_SVW1_SK0_SKFTR0_SKXCCM0_SGRO0_TIN0_TLDS1_TLDSM1_ULSGRO0_USL1_UIOFGRO0_UPLRP0_USFGROn1_VSn1_VWA1_VWB1_WSGRA0_WSGRB0_WS32_WG64_2_1_WGM8_WGMXCC1_WGMXCCGn1
    SolutionIndex: 8
    SolutionNameMin: Cijk_Ailk_Bljk_BBS_BH_Bias_HA_S_SAV_UserArgs_MT64x16x32_MI16x16x1_CMS_SN_LDSB0_AFC1_AG0_AFEM1_AFEM1_ASEM1_CLR1_CADS0_DTLA0_DTLB0_DTVA0_DTVB0_DTVSM0_DPLBn1_EPS0_ELFLR0_EMLLn1_FDSI0_GRPM1_GRVWA1_GRVWB4_GSU1_GSUAMB_GSUC0_GSUWGMRR0_GLS0_ISA1151_IU1_LDSTI0_LBSPPA2048_LBSPPB128_LBSPPM0_LPA16_LPB16_LPM0_LRVW16_LWPMn1_MIAV1_MIWT1_1_MO40_MGRIPMn1_NTn1_NTA0_NTB0_NTC0_NTD0_NTM0_NEPBS0_NLCA1_NLCB1_ONLL1_PGR2_PLR1_PKA0_SGROBn1_SIA3_SS1_SU32_SUM1_SUS256_SPO0_SRVW0_SSO0_SVW1_SK0_SKFTR0_SKXCCM0_SGRO0_TIN0_TLDS1_TLDSM1_ULSGRO0_USL1_UIOFGRO0_UPLRP0_USFGROn1_VSn1_VWA1_VWB1_WSGRA0_WSGRB0_WS32_WG64_2_1_WGM8_WGMXCC1_WGMXCCGn1
    SolutionIndex: 9
    SolutionNameMin: Cijk_Ailk_Bljk_BBS_BH_Bias_HA_S_SAV_UserArgs_MT64x16x32_MI16x16x1_CMS_SN_LDSB0_AFC1_AG0_AFEM1_AFEM1_ASEM1_CLR1_CADS0_DTLA0_DTLB0_DTVA0_DTVB0_DTVSM0_DPLBn1_EPS0_ELFLR0_EMLLn1_FDSI0_GRPM1_GRVWA8_GRVWB1_GSU1_GSUAMB_GSUC0_GSUWGMRR0_GLS0_ISA1151_IU1_LDSTI0_LBSPPA2048_LBSPPB512_LBSPPM0_LPA16_LPB16_LPM0_LRVW16_LWPMn1_MIAV1_MIWT1_1_MO40_MGRIPMn1_NTn1_NTA0_NTB0_NTC0_NTD0_NTM0_NEPBS0_NLCA1_NLCB1_ONLL1_PGR2_PLR1_PKA0_SGROBn1_SIA3_SS1_SU32_SUM1_SUS256_SPO0_SRVW0_SSO0_SVW1_SK0_SKFTR0_SKXCCM0_SGRO0_TIN0_TLDS0_TLDSM1_ULSGRO0_USL1_UIOFGRO0_UPLRP0_USFGROn1_VSn1_VWA1_VWB1_WSGRA0_WSGRB0_WS32_WG64_2_1_WGM8_WGMXCC1_WGMXCCGn1
    SolutionIndex: 10
    SolutionNameMin: Cijk_Ailk_Bljk_BBS_BH_Bias_HA_S_SAV_UserArgs_MT64x16x32_MI16x16x1_CMS_SN_LDSB0_AFC1_AG0_AFEM1_AFEM1_ASEM1_CLR1_CADS0_DTLA0_DTLB0_DTVA0_DTVB0_DTVSM0_DPLBn1_EPS0_ELFLR0_EMLLn1_FDSI0_GRPM1_GRVWA8_GRVWB1_GSU1_GSUAMB_GSUC0_GSUWGMRR0_GLS0_ISA1151_IU1_LDSTI0_LBSPPA2048_LBSPPB128_LBSPPM0_LPA16_LPB16_LPM0_LRVW16_LWPMn1_MIAV1_MIWT1_1_MO40_MGRIPMn1_NTn1_NTA0_NTB0_NTC0_NTD0_NTM0_NEPBS0_NLCA1_NLCB1_ONLL1_PGR2_PLR1_PKA0_SGROBn1_SIA3_SS1_SU32_SUM1_SUS256_SPO0_SRVW0_SSO0_SVW1_SK0_SKFTR0_SKXCCM0_SGRO0_TIN0_TLDS1_TLDSM1_ULSGRO0_USL1_UIOFGRO0_UPLRP0_USFGROn1_VSn1_VWA1_VWB1_WSGRA0_WSGRB0_WS32_WG64_2_1_WGM8_WGMXCC1_WGMXCCGn1
    SolutionIndex: 11
    SolutionNameMin: Cijk_Ailk_Bljk_BBS_BH_Bias_HA_S_SAV_UserArgs_MT64x16x32_MI16x16x1_CMS_SN_LDSB0_AFC1_AG0_AFEM1_AFEM1_ASEM1_CLR1_CADS0_DTLA0_DTLB0_DTVA0_DTVB0_DTVSM0_DPLBn1_EPS0_ELFLR0_EMLLn1_FDSI0_GRPM1_GRVWA1_GRVWB1_GSU1_GSUAMB_GSUC0_GSUWGMRR0_GLS0_ISA1151_IU1_LDSTI0_LBSPPA2048_LBSPPB128_LBSPPM0_LPA16_LPB16_LPM0_LRVW16_LWPMn1_MIAV1_MIWT1_1_MO40_MGRIPMn1_NTn1_NTA0_NTB0_NTC0_NTD0_NTM0_NEPBS0_NLCA1_NLCB1_ONLL1_PGR2_PLR1_PKA0_SGROBn1_SIA3_SS1_SU32_SUM1_SUS256_SPO0_SRVW0_SSO0_SVW1_SK0_SKFTR0_SKXCCM0_SGRO0_TIN0_TLDS1_TLDSM1_ULSGRO0_USL1_UIOFGRO0_UPLRP0_USFGROn1_VSn1_VWA1_VWB1_WSGRA0_WSGRB0_WS32_WG64_2_1_WGM8_WGMXCC1_WGMXCCGn1
    SolutionIndex: 12
    SolutionNameMin: Cijk_Ailk_Bljk_BBS_BH_Bias_HA_S_SAV_UserArgs_MT64x16x32_MI16x16x1_CMS_SN_LDSB0_AFC1_AG0_AFEM1_AFEM1_ASEM1_CLR1_CADS0_DTLA0_DTLB0_DTVA0_DTVB0_DTVSM0_DPLBn1_EPS0_ELFLR0_EMLLn1_FDSI0_GRPM1_GRVWA8_GRVWB4_GSU4_GSUAMB_GSUC0_GSUWGMRR0_GLS0_ISA1151_IU1_LDSTI0_LBSPPA2048_LBSPPB128_LBSPPM0_LPA16_LPB16_LPM0_LRVW16_LWPMn1_MIAV1_MIWT1_1_MO40_MGRIPMn1_NTn1_NTA0_NTB0_NTC0_NTD0_NTM0_NEPBS0_NLCA1_NLCB1_ONLL1_PGR2_PLR1_PKA0_SGROBn1_SIA3_SS1_SU32_SUM1_SUS256_SPO0_SRVW0_SSO0_SVW1_SK0_SKFTR0_SKXCCM0_SGRO0_TIN0_TLDS1_TLDSM1_ULSGRO0_USL1_UIOFGRO0_UPLRP0_USFGROn1_VSn1_VWA1_VWB1_WSGRA0_WSGRB0_WS32_WG64_2_1_WGM8_WGMXCC1_WGMXCCGn1
    SolutionIndex: 13
    SolutionNameMin: Cijk_Ailk_Bljk_BBS_BH_Bias_HA_S_SAV_UserArgs_MT192x16x32_MI16x16x1_CMS_SN_LDSB0_AFC1_AG0_AFEM1_AFEM1_ASEM1_CLR1_CADS0_DTLA0_DTLB0_DTVA0_DTVB0_DTVSM0_DPLBn1_EPS0_ELFLR0_EMLLn1_FDSI0_GRPM1_GRVWA8_GRVWB1_GSU1_GSUAMB_GSUC0_GSUWGMRR0_GLS0_ISA1151_IU1_LDSTI0_LBSPPA6144_LBSPPB128_LBSPPM0_LPA16_LPB16_LPM0_LRVW16_LWPMn1_MIAV1_MIWT3_1_MO40_MGRIPMn1_NTn1_NTA0_NTB0_NTC0_NTD0_NTM0_NEPBS0_NLCA3_NLCB1_ONLL1_PGR2_PLR1_PKA0_SGROBn1_SIA3_SS1_SU32_SUM1_SUS256_SPO0_SRVW0_SSO0_SVW1_SK0_SKFTR0_SKXCCM0_SGRO0_TIN0_TLDS1_TLDSM1_ULSGRO0_USL1_UIOFGRO0_UPLRP0_USFGROn1_VSn1_VWA1_VWB1_WSGRA0_WSGRB0_WS32_WG64_2_1_WGM8_WGMXCC1_WGMXCCGn1
    SolutionIndex: 14
    SolutionNameMin: Cijk_Ailk_Bljk_BBS_BH_Bias_HA_S_SAV_UserArgs_MT32x32x32_MI16x16x1_CMS_SN_LDSB0_AFC1_AG0_AFEM1_AFEM1_ASEM1_CLR1_CADS0_DTLA0_DTLB0_DTVA0_DTVB0_DTVSM0_DPLBn1_EPS0_ELFLR0_EMLLn1_FDSI0_GRPM1_GRVWA8_GRVWB8_GSU1_GSUAMB_GSUC0_GSUWGMRR0_GLS0_ISA1151_IU1_LDSTI0_LBSPPA1024_LBSPPB128_LBSPPM0_LPA16_LPB16_LPM0_LRVW16_LWPMn1_MIAV1_MIWT1_1_MO40_MGRIPMn1_NTn1_NTA0_NTB0_NTC0_NTD0_NTM0_NEPBS0_NLCA1_NLCB1_ONLL1_PGR2_PLR1_PKA0_SGROBn1_SIA3_SS1_SU32_SUM1_SUS256_SPO0_SRVW0_SSO0_SVW1_SK0_SKFTR0_SKXCCM0_SGRO0_TIN0_TLDS1_TLDSM1_ULSGRO0_USL1_UIOFGRO0_UPLRP0_USFGROn1_VSn1_VWA1_VWB1_WSGRA0_WSGRB0_WS32_WG32_4_1_WGM8_WGMXCC1_WGMXCCGn1
    SolutionIndex: 15
    SolutionNameMin: Cijk_Ailk_Bljk_BBS_BH_Bias_HA_S_SAV_UserArgs_MT32x32x32_MI16x16x1_CMS_SN_LDSB0_AFC1_AG0_AFEM1_AFEM1_ASEM1_CLR1_CADS0_DTLA0_DTLB0_DTVA0_DTVB0_DTVSM0_DPLBn1_EPS0_ELFLR0_EMLLn1_FDSI0_GRPM1_GRVWA1_GRVWB8_GSU1_GSUAMB_GSUC0_GSUWGMRR0_GLS0_ISA1151_IU1_LDSTI0_LBSPPA1024_LBSPPB128_LBSPPM0_LPA16_LPB16_LPM0_LRVW16_LWPMn1_MIAV1_MIWT1_1_MO40_MGRIPMn1_NTn1_NTA0_NTB0_NTC0_NTD0_NTM0_NEPBS0_NLCA1_NLCB1_ONLL1_PGR2_PLR1_PKA0_SGROBn1_SIA3_SS1_SU32_SUM1_SUS256_SPO0_SRVW0_SSO0_SVW1_SK0_SKFTR0_SKXCCM0_SGRO0_TIN0_TLDS1_TLDSM1_ULSGRO0_USL1_UIOFGRO0_UPLRP0_USFGROn1_VSn1_VWA1_VWB1_WSGRA0_WSGRB0_WS32_WG32_4_1_WGM8_WGMXCC1_WGMXCCGn1
    SolutionIndex: 16
    SolutionNameMin: Cijk_Ailk_Bljk_BBS_BH_Bias_HA_S_SAV_UserArgs_MT32x32x32_MI16x16x1_CMS_SN_LDSB0_AFC1_AG0_AFEM1_AFEM1_ASEM1_CLR1_CADS0_DTLA0_DTLB0_DTVA0_DTVB0_DTVSM0_DPLBn1_EPS0_ELFLR0_EMLLn1_FDSI0_GRPM1_GRVWA8_GRVWB1_GSU1_GSUAMB_GSUC0_GSUWGMRR0_GLS0_ISA1151_IU1_LDSTI0_LBSPPA1024_LBSPPB128_LBSPPM0_LPA16_LPB16_LPM0_LRVW16_LWPMn1_MIAV1_MIWT1_1_MO40_MGRIPMn1_NTn1_NTA0_NTB0_NTC0_NTD0_NTM0_NEPBS0_NLCA1_NLCB1_ONLL1_PGR2_PLR1_PKA0_SGROBn1_SIA3_SS1_SU32_SUM1_SUS256_SPO0_SRVW0_SSO0_SVW1_SK0_SKFTR0_SKXCCM0_SGRO0_TIN0_TLDS1_TLDSM1_ULSGRO0_USL1_UIOFGRO0_UPLRP0_USFGROn1_VSn1_VWA1_VWB1_WSGRA0_WSGRB0_WS32_WG32_4_1_WGM8_WGMXCC1_WGMXCCGn1
    SolutionIndex: 17
    SolutionNameMin: Cijk_Ailk_Bljk_BBS_BH_Bias_HA_S_SAV_UserArgs_MT32x32x32_MI16x16x1_CMS_SN_LDSB0_AFC1_AG0_AFEM1_AFEM1_ASEM1_CLR1_CADS0_DTLA0_DTLB0_DTVA0_DTVB0_DTVSM0_DPLBn1_EPS0_ELFLR0_EMLLn1_FDSI0_GRPM1_GRVWA1_GRVWB1_GSU1_GSUAMB_GSUC0_GSUWGMRR0_GLS0_ISA1151_IU1_LDSTI0_LBSPPA1024_LBSPPB128_LBSPPM0_LPA16_LPB16_LPM0_LRVW16_LWPMn1_MIAV1_MIWT1_1_MO40_MGRIPMn1_NTn1_NTA0_NTB0_NTC0_NTD0_NTM0_NEPBS0_NLCA1_NLCB1_ONLL1_PGR2_PLR1_PKA0_SGROBn1_SIA3_SS1_SU32_SUM1_SUS256_SPO0_SRVW0_SSO0_SVW1_SK0_SKFTR0_SKXCCM0_SGRO0_TIN0_TLDS1_TLDSM1_ULSGRO0_USL1_UIOFGRO0_UPLRP0_USFGROn1_VSn1_VWA1_VWB1_WSGRA0_WSGRB0_WS32_WG32_4_1_WGM8_WGMXCC1_WGMXCCGn1
    SolutionIndex: 18
    SolutionNameMin: Cijk_Ailk_Bljk_BBS_BH_Bias_HA_S_SAV_UserArgs_MT32x32x32_MI16x16x1_CMS_SN_LDSB0_AFC1_AG0_AFEM1_AFEM1_ASEM1_CLR1_CADS0_DTLA0_DTLB0_DTVA0_DTVB0_DTVSM0_DPLBn1_EPS0_ELFLR0_EMLLn1_FDSI0_GRPM1_GRVWA8_GRVWB8_GSU4_GSUAMB_GSUC0_GSUWGMRR0_GLS0_ISA1151_IU1_LDSTI0_LBSPPA1024_LBSPPB128_LBSPPM0_LPA16_LPB16_LPM0_LRVW16_LWPMn1_MIAV1_MIWT1_1_MO40_MGRIPMn1_NTn1_NTA0_NTB0_NTC0_NTD0_NTM0_NEPBS0_NLCA1_NLCB1_ONLL1_PGR2_PLR1_PKA0_SGROBn1_SIA3_SS1_SU32_SUM1_SUS256_SPO0_SRVW0_SSO0_SVW1_SK0_SKFTR0_SKXCCM0_SGRO0_TIN0_TLDS1_TLDSM1_ULSGRO0_USL1_UIOFGRO0_UPLRP0_USFGROn1_VSn1_VWA1_VWB1_WSGRA0_WSGRB0_WS32_WG32_4_1_WGM8_WGMXCC1_WGMXCCGn1
    SolutionIndex: 19
    SolutionNameMin: Cijk_Ailk_Bljk_BBS_BH_Bias_HA_S_SAV_UserArgs_MT64x32x32_MI16x16x1_CMS_SN_LDSB0_AFC1_AG0_AFEM1_AFEM1_ASEM1_CLR1_CADS0_DTLA0_DTLB0_DTVA0_DTVB0_DTVSM0_DPLBn1_EPS0_ELFLR0_EMLLn1_FDSI0_GRPM1_GRVWA8_GRVWB8_GSU1_GSUAMB_GSUC0_GSUWGMRR0_GLS0_ISA1151_IU1_LDSTI0_LBSPPA2048_LBSPPB1024_LBSPPM0_LPA16_LPB16_LPM0_LRVW16_LWPMn1_MIAV1_MIWT2_1_MO40_MGRIPMn1_NTn1_NTA0_NTB0_NTC0_NTD0_NTM0_NEPBS0_NLCA1_NLCB1_ONLL1_PGR2_PLR1_PKA0_SGROBn1_SIA3_SS1_SU32_SUM1_SUS256_SPO0_SRVW0_SSO0_SVW1_SK0_SKFTR0_SKXCCM0_SGRO0_TIN0_TLDS0_TLDSM1_ULSGRO0_USL1_UIOFGRO0_UPLRP0_USFGROn1_VSn1_VWA1_VWB1_WSGRA0_WSGRB0_WS32_WG32_4_1_WGM8_WGMXCC1_WGMXCCGn1
    SolutionIndex: 20
    SolutionNameMin: Cijk_Ailk_Bljk_BBS_BH_Bias_HA_S_SAV_UserArgs_MT64x32x32_MI16x16x1_CMS_SN_LDSB0_AFC1_AG0_AFEM1_AFEM1_ASEM1_CLR1_CADS0_DTLA0_DTLB0_DTVA0_DTVB0_DTVSM0_DPLBn1_EPS0_ELFLR0_EMLLn1_FDSI0_GRPM1_GRVWA8_GRVWB8_GSU1_GSUAMB_GSUC0_GSUWGMRR0_GLS0_ISA1151_IU1_LDSTI0_LBSPPA2048_LBSPPB128_LBSPPM0_LPA16_LPB16_LPM0_LRVW16_LWPMn1_MIAV1_MIWT2_1_MO40_MGRIPMn1_NTn1_NTA0_NTB0_NTC0_NTD0_NTM0_NEPBS0_NLCA1_NLCB1_ONLL1_PGR2_PLR1_PKA0_SGROBn1_SIA3_SS1_SU32_SUM1_SUS256_SPO0_SRVW0_SSO0_SVW1_SK0_SKFTR0_SKXCCM0_SGRO0_TIN0_TLDS1_TLDSM1_ULSGRO0_USL1_UIOFGRO0_UPLRP0_USFGROn1_VSn1_VWA1_VWB1_WSGRA0_WSGRB0_WS32_WG32_4_1_WGM8_WGMXCC1_WGMXCCGn1
    SolutionIndex: 21
    SolutionNameMin: Cijk_Ailk_Bljk_BBS_BH_Bias_HA_S_SAV_UserArgs_MT64x32x32_MI16x16x1_CMS_SN_LDSB0_AFC1_AG0_AFEM1_AFEM1_ASEM1_CLR1_CADS0_DTLA0_DTLB0_DTVA0_DTVB0_DTVSM0_DPLBn1_EPS0_ELFLR0_EMLLn1_FDSI0_GRPM1_GRVWA1_GRVWB8_GSU1_GSUAMB_GSUC0_GSUWGMRR0_GLS0_ISA1151_IU1_LDSTI0_LBSPPA2048_LBSPPB1024_LBSPPM0_LPA16_LPB16_LPM0_LRVW16_LWPMn1_MIAV1_MIWT2_1_MO40_MGRIPMn1_NTn1_NTA0_NTB0_NTC0_NTD0_NTM0_NEPBS0_NLCA1_NLCB1_ONLL1_PGR2_PLR1_PKA0_SGROBn1_SIA3_SS1_SU32_SUM1_SUS256_SPO0_SRVW0_SSO0_SVW1_SK0_SKFTR0_SKXCCM0_SGRO0_TIN0_TLDS0_TLDSM1_ULSGRO0_USL1_UIOFGRO0_UPLRP0_USFGROn1_VSn1_VWA1_VWB1_WSGRA0_WSGRB0_WS32_WG32_4_1_WGM8_WGMXCC1_WGMXCCGn1
    SolutionIndex: 22
    SolutionNameMin: Cijk_Ailk_Bljk_BBS_BH_Bias_HA_S_SAV_UserArgs_MT64x32x32_MI16x16x1_CMS_SN_LDSB0_AFC1_AG0_AFEM1_AFEM1_ASEM1_CLR1_CADS0_DTLA0_DTLB0_DTVA0_DTVB0_DTVSM0_DPLBn1_EPS0_ELFLR0_EMLLn1_FDSI0_GRPM1_GRVWA1_GRVWB8_GSU1_GSUAMB_GSUC0_GSUWGMRR0_GLS0_ISA1151_IU1_LDSTI0_LBSPPA2048_LBSPPB128_LBSPPM0_LPA16_LPB16_LPM0_LRVW16_LWPMn1_MIAV1_MIWT2_1_MO40_MGRIPMn1_NTn1_NTA0_NTB0_NTC0_NTD0_NTM0_NEPBS0_NLCA1_NLCB1_ONLL1_PGR2_PLR1_PKA0_SGROBn1_SIA3_SS1_SU32_SUM1_SUS256_SPO0_SRVW0_SSO0_SVW1_SK0_SKFTR0_SKXCCM0_SGRO0_TIN0_TLDS1_TLDSM1_ULSGRO0_USL1_UIOFGRO0_UPLRP0_USFGROn1_VSn1_VWA1_VWB1_WSGRA0_WSGRB0_WS32_WG32_4_1_WGM8_WGMXCC1_WGMXCCGn1
    SolutionIndex: 24
    SolutionNameMin: Cijk_Ailk_Bljk_BBS_BH_Bias_HA_S_SAV_UserArgs_MT64x32x32_MI16x16x1_CMS_SN_LDSB0_AFC1_AG0_AFEM1_AFEM1_ASEM1_CLR1_CADS0_DTLA0_DTLB0_DTVA0_DTVB0_DTVSM0_DPLBn1_EPS0_ELFLR0_EMLLn1_FDSI0_GRPM1_GRVWA8_GRVWB1_GSU1_GSUAMB_GSUC0_GSUWGMRR0_GLS0_ISA1151_IU1_LDSTI0_LBSPPA2048_LBSPPB128_LBSPPM0_LPA16_LPB16_LPM0_LRVW16_LWPMn1_MIAV1_MIWT2_1_MO40_MGRIPMn1_NTn1_NTA0_NTB0_NTC0_NTD0_NTM0_NEPBS0_NLCA1_NLCB1_ONLL1_PGR2_PLR1_PKA0_SGROBn1_SIA3_SS1_SU32_SUM1_SUS256_SPO0_SRVW0_SSO0_SVW1_SK0_SKFTR0_SKXCCM0_SGRO0_TIN0_TLDS1_TLDSM1_ULSGRO0_USL1_UIOFGRO0_UPLRP0_USFGROn1_VSn1_VWA1_VWB1_WSGRA0_WSGRB0_WS32_WG32_4_1_WGM8_WGMXCC1_WGMXCCGn1
    SolutionIndex: 25
    SolutionNameMin: Cijk_Ailk_Bljk_BBS_BH_Bias_HA_S_SAV_UserArgs_MT64x32x32_MI16x16x1_CMS_SN_LDSB0_AFC1_AG0_AFEM1_AFEM1_ASEM1_CLR1_CADS0_DTLA0_DTLB0_DTVA0_DTVB0_DTVSM0_DPLBn1_EPS0_ELFLR0_EMLLn1_FDSI0_GRPM1_GRVWA1_GRVWB1_GSU1_GSUAMB_GSUC0_GSUWGMRR0_GLS0_ISA1151_IU1_LDSTI0_LBSPPA2048_LBSPPB128_LBSPPM0_LPA16_LPB16_LPM0_LRVW16_LWPMn1_MIAV1_MIWT2_1_MO40_MGRIPMn1_NTn1_NTA0_NTB0_NTC0_NTD0_NTM0_NEPBS0_NLCA1_NLCB1_ONLL1_PGR2_PLR1_PKA0_SGROBn1_SIA3_SS1_SU32_SUM1_SUS256_SPO0_SRVW0_SSO0_SVW1_SK0_SKFTR0_SKXCCM0_SGRO0_TIN0_TLDS1_TLDSM1_ULSGRO0_USL1_UIOFGRO0_UPLRP0_USFGROn1_VSn1_VWA1_VWB1_WSGRA0_WSGRB0_WS32_WG32_4_1_WGM8_WGMXCC1_WGMXCCGn1
    SolutionIndex: 26
    SolutionNameMin: Cijk_Ailk_Bljk_BBS_BH_Bias_HA_S_SAV_UserArgs_MT64x32x32_MI16x16x1_CMS_SN_LDSB0_AFC1_AG0_AFEM1_AFEM1_ASEM1_CLR1_CADS0_DTLA0_DTLB0_DTVA0_DTVB0_DTVSM0_DPLBn1_EPS0_ELFLR0_EMLLn1_FDSI0_GRPM1_GRVWA8_GRVWB8_GSU4_GSUAMB_GSUC0_GSUWGMRR0_GLS0_ISA1151_IU1_LDSTI0_LBSPPA2048_LBSPPB128_LBSPPM0_LPA16_LPB16_LPM0_LRVW16_LWPMn1_MIAV1_MIWT2_1_MO40_MGRIPMn1_NTn1_NTA0_NTB0_NTC0_NTD0_NTM0_NEPBS0_NLCA1_NLCB1_ONLL1_PGR2_PLR1_PKA0_SGROBn1_SIA3_SS1_SU32_SUM1_SUS256_SPO0_SRVW0_SSO0_SVW1_SK0_SKFTR0_SKXCCM0_SGRO0_TIN0_TLDS1_TLDSM1_ULSGRO0_USL1_UIOFGRO0_UPLRP0_USFGROn1_VSn1_VWA1_VWB1_WSGRA0_WSGRB0_WS32_WG32_4_1_WGM8_WGMXCC1_WGMXCCGn1
    SolutionIndex: 27
    SolutionNameMin: Cijk_Ailk_Bljk_BBS_BH_Bias_HA_S_SAV_UserArgs_MT96x32x32_MI16x16x1_CMS_SN_LDSB0_AFC1_AG0_AFEM1_AFEM1_ASEM1_CLR1_CADS0_DTLA0_DTLB0_DTVA0_DTVB0_DTVSM0_DPLBn1_EPS0_ELFLR0_EMLLn1_FDSI0_GRPM1_GRVWA8_GRVWB8_GSU1_GSUAMB_GSUC0_GSUWGMRR0_GLS0_ISA1151_IU1_LDSTI0_LBSPPA3072_LBSPPB128_LBSPPM0_LPA16_LPB16_LPM0_LRVW16_LWPMn1_MIAV1_MIWT3_1_MO40_MGRIPMn1_NTn1_NTA0_NTB0_NTC0_NTD0_NTM0_NEPBS0_NLCA3_NLCB1_ONLL1_PGR2_PLR1_PKA0_SGROBn1_SIA3_SS1_SU32_SUM1_SUS256_SPO0_SRVW0_SSO0_SVW1_SK0_SKFTR0_SKXCCM0_SGRO0_TIN0_TLDS1_TLDSM1_ULSGRO0_USL1_UIOFGRO0_UPLRP0_USFGROn1_VSn1_VWA1_VWB1_WSGRA0_WSGRB0_WS32_WG32_4_1_WGM8_WGMXCC1_WGMXCCGn1
    SolutionIndex: 28
    SolutionNameMin: Cijk_Ailk_Bljk_BBS_BH_Bias_HA_S_SAV_UserArgs_MT96x32x32_MI16x16x1_CMS_SN_LDSB0_AFC1_AG0_AFEM1_AFEM1_ASEM1_CLR1_CADS0_DTLA0_DTLB0_DTVA0_DTVB0_DTVSM0_DPLBn1_EPS0_ELFLR0_EMLLn1_FDSI0_GRPM1_GRVWA8_GRVWB1_GSU1_GSUAMB_GSUC0_GSUWGMRR0_GLS0_ISA1151_IU1_LDSTI0_LBSPPA3072_LBSPPB128_LBSPPM0_LPA16_LPB16_LPM0_LRVW16_LWPMn1_MIAV1_MIWT3_1_MO40_MGRIPMn1_NTn1_NTA0_NTB0_NTC0_NTD0_NTM0_NEPBS0_NLCA3_NLCB1_ONLL1_PGR2_PLR1_PKA0_SGROBn1_SIA3_SS1_SU32_SUM1_SUS256_SPO0_SRVW0_SSO0_SVW1_SK0_SKFTR0_SKXCCM0_SGRO0_TIN0_TLDS1_TLDSM1_ULSGRO0_USL1_UIOFGRO0_UPLRP0_USFGROn1_VSn1_VWA1_VWB1_WSGRA0_WSGRB0_WS32_WG32_4_1_WGM8_WGMXCC1_WGMXCCGn1
    SolutionIndex: 29
    SolutionNameMin: Cijk_Ailk_Bljk_BBS_BH_Bias_HA_S_SAV_UserArgs_MT96x32x32_MI16x16x1_CMS_SN_LDSB0_AFC1_AG0_AFEM1_AFEM1_ASEM1_CLR1_CADS0_DTLA0_DTLB0_DTVA0_DTVB0_DTVSM0_DPLBn1_EPS0_ELFLR0_EMLLn1_FDSI0_GRPM1_GRVWA8_GRVWB8_GSU4_GSUAMB_GSUC0_GSUWGMRR0_GLS0_ISA1151_IU1_LDSTI0_LBSPPA3072_LBSPPB128_LBSPPM0_LPA16_LPB16_LPM0_LRVW16_LWPMn1_MIAV1_MIWT3_1_MO40_MGRIPMn1_NTn1_NTA0_NTB0_NTC0_NTD0_NTM0_NEPBS0_NLCA3_NLCB1_ONLL1_PGR2_PLR1_PKA0_SGROBn1_SIA3_SS1_SU32_SUM1_SUS256_SPO0_SRVW0_SSO0_SVW1_SK0_SKFTR0_SKXCCM0_SGRO0_TIN0_TLDS1_TLDSM1_ULSGRO0_USL1_UIOFGRO0_UPLRP0_USFGROn1_VSn1_VWA1_VWB1_WSGRA0_WSGRB0_WS32_WG32_4_1_WGM8_WGMXCC1_WGMXCCGn1
    SolutionIndex: 30
    SolutionNameMin: Cijk_Ailk_Bljk_BBS_BH_Bias_HA_S_SAV_UserArgs_MT160x32x32_MI16x16x1_CMS_SN_LDSB0_AFC1_AG0_AFEM1_AFEM1_ASEM1_CLR1_CADS0_DTLA0_DTLB0_DTVA0_DTVB0_DTVSM0_DPLBn1_EPS0_ELFLR0_EMLLn1_FDSI0_GRPM1_GRVWA8_GRVWB8_GSU1_GSUAMB_GSUC0_GSUWGMRR0_GLS0_ISA1151_IU1_LDSTI0_LBSPPA5120_LBSPPB128_LBSPPM0_LPA16_LPB16_LPM0_LRVW16_LWPMn1_MIAV1_MIWT5_1_MO40_MGRIPMn1_NTn1_NTA0_NTB0_NTC0_NTD0_NTM0_NEPBS0_NLCA5_NLCB1_ONLL1_PGR2_PLR1_PKA0_SGROBn1_SIA3_SS1_SU32_SUM1_SUS256_SPO0_SRVW0_SSO0_SVW1_SK0_SKFTR0_SKXCCM0_SGRO0_TIN0_TLDS1_TLDSM1_ULSGRO0_USL1_UIOFGRO0_UPLRP0_USFGROn1_VSn1_VWA1_VWB1_WSGRA0_WSGRB0_WS32_WG32_4_1_WGM8_WGMXCC1_WGMXCCGn1
    SolutionIndex: 31
    SolutionNameMin: Cijk_Ailk_Bljk_BBS_BH_Bias_HA_S_SAV_UserArgs_MT64x48x32_MI16x16x1_CMS_SN_LDSB0_AFC1_AG0_AFEM1_AFEM1_ASEM1_CLR1_CADS0_DTLA0_DTLB0_DTVA0_DTVB0_DTVSM0_DPLBn1_EPS0_ELFLR0_EMLLn1_FDSI0_GRPM1_GRVWA8_GRVWB4_GSU1_GSUAMB_GSUC0_GSUWGMRR0_GLS0_ISA1151_IU1_LDSTI0_LBSPPA2048_LBSPPB128_LBSPPM0_LPA16_LPB16_LPM0_LRVW16_LWPMn1_MIAV1_MIWT1_3_MO40_MGRIPMn1_NTn1_NTA0_NTB0_NTC0_NTD0_NTM0_NEPBS0_NLCA1_NLCB1_ONLL1_PGR2_PLR1_PKA0_SGROBn1_SIA3_SS1_SU32_SUM1_SUS256_SPO0_SRVW0_SSO0_SVW1_SK0_SKFTR0_SKXCCM0_SGRO0_TIN0_TLDS1_TLDSM1_ULSGRO0_USL1_UIOFGRO0_UPLRP0_USFGROn1_VSn1_VWA1_VWB1_WSGRA0_WSGRB0_WS32_WG64_2_1_WGM8_WGMXCC1_WGMXCCGn1
    SolutionIndex: 32
    SolutionNameMin: Cijk_Ailk_Bljk_BBS_BH_Bias_HA_S_SAV_UserArgs_MT64x48x32_MI16x16x1_CMS_SN_LDSB0_AFC1_AG0_AFEM1_AFEM1_ASEM1_CLR1_CADS0_DTLA0_DTLB0_DTVA0_DTVB0_DTVSM0_DPLBn1_EPS0_ELFLR0_EMLLn1_FDSI0_GRPM1_GRVWA1_GRVWB4_GSU1_GSUAMB_GSUC0_GSUWGMRR0_GLS0_ISA1151_IU1_LDSTI0_LBSPPA2048_LBSPPB128_LBSPPM0_LPA16_LPB16_LPM0_LRVW16_LWPMn1_MIAV1_MIWT1_3_MO40_MGRIPMn1_NTn1_NTA0_NTB0_NTC0_NTD0_NTM0_NEPBS0_NLCA1_NLCB1_ONLL1_PGR2_PLR1_PKA0_SGROBn1_SIA3_SS1_SU32_SUM1_SUS256_SPO0_SRVW0_SSO0_SVW1_SK0_SKFTR0_SKXCCM0_SGRO0_TIN0_TLDS1_TLDSM1_ULSGRO0_USL1_UIOFGRO0_UPLRP0_USFGROn1_VSn1_VWA1_VWB1_WSGRA0_WSGRB0_WS32_WG64_2_1_WGM8_WGMXCC1_WGMXCCGn1
    SolutionIndex: 33
    SolutionNameMin: Cijk_Ailk_Bljk_BBS_BH_Bias_HA_S_SAV_UserArgs_MT64x48x32_MI16x16x1_CMS_SN_LDSB0_AFC1_AG0_AFEM1_AFEM1_ASEM1_CLR1_CADS0_DTLA0_DTLB0_DTVA0_DTVB0_DTVSM0_DPLBn1_EPS0_ELFLR0_EMLLn1_FDSI0_GRPM1_GRVWA8_GRVWB1_GSU1_GSUAMB_GSUC0_GSUWGMRR0_GLS0_ISA1151_IU1_LDSTI0_LBSPPA2048_LBSPPB128_LBSPPM0_LPA16_LPB16_LPM0_LRVW16_LWPMn1_MIAV1_MIWT1_3_MO40_MGRIPMn1_NTn1_NTA0_NTB0_NTC0_NTD0_NTM0_NEPBS0_NLCA1_NLCB1_ONLL1_PGR2_PLR1_PKA0_SGROBn1_SIA3_SS1_SU32_SUM1_SUS256_SPO0_SRVW0_SSO0_SVW1_SK0_SKFTR0_SKXCCM0_SGRO0_TIN0_TLDS1_TLDSM1_ULSGRO0_USL1_UIOFGRO0_UPLRP0_USFGROn1_VSn1_VWA1_VWB1_WSGRA0_WSGRB0_WS32_WG64_2_1_WGM8_WGMXCC1_WGMXCCGn1
    SolutionIndex: 34
    SolutionNameMin: Cijk_Ailk_Bljk_BBS_BH_Bias_HA_S_SAV_UserArgs_MT64x48x32_MI16x16x1_CMS_SN_LDSB0_AFC1_AG0_AFEM1_AFEM1_ASEM1_CLR1_CADS0_DTLA0_DTLB0_DTVA0_DTVB0_DTVSM0_DPLBn1_EPS0_ELFLR0_EMLLn1_FDSI0_GRPM1_GRVWA1_GRVWB1_GSU1_GSUAMB_GSUC0_GSUWGMRR0_GLS0_ISA1151_IU1_LDSTI0_LBSPPA2048_LBSPPB128_LBSPPM0_LPA16_LPB16_LPM0_LRVW16_LWPMn1_MIAV1_MIWT1_3_MO40_MGRIPMn1_NTn1_NTA0_NTB0_NTC0_NTD0_NTM0_NEPBS0_NLCA1_NLCB1_ONLL1_PGR2_PLR1_PKA0_SGROBn1_SIA3_SS1_SU32_SUM1_SUS256_SPO0_SRVW0_SSO0_SVW1_SK0_SKFTR0_SKXCCM0_SGRO0_TIN0_TLDS1_TLDSM1_ULSGRO0_USL1_UIOFGRO0_UPLRP0_USFGROn1_VSn1_VWA1_VWB1_WSGRA0_WSGRB0_WS32_WG64_2_1_WGM8_WGMXCC1_WGMXCCGn1
    SolutionIndex: 36
    SolutionNameMin: Cijk_Ailk_Bljk_BBS_BH_Bias_HA_S_SAV_UserArgs_MT128x48x32_MI16x16x1_CMS_SN_LDSB0_AFC1_AG0_AFEM1_AFEM1_ASEM1_CLR1_CADS0_DTLA0_DTLB0_DTVA0_DTVB0_DTVSM0_DPLBn1_EPS0_ELFLR0_EMLLn1_FDSI0_GRPM1_GRVWA8_GRVWB4_GSU1_GSUAMB_GSUC0_GSUWGMRR0_GLS0_ISA1151_IU1_LDSTI0_LBSPPA4096_LBSPPB128_LBSPPM0_LPA16_LPB16_LPM0_LRVW16_LWPMn1_MIAV1_MIWT2_3_MO40_MGRIPMn1_NTn1_NTA0_NTB0_NTC0_NTD0_NTM0_NEPBS0_NLCA1_NLCB1_ONLL1_PGR2_PLR1_PKA0_SGROBn1_SIA3_SS1_SU32_SUM1_SUS256_SPO0_SRVW0_SSO0_SVW1_SK0_SKFTR0_SKXCCM0_SGRO0_TIN0_TLDS1_TLDSM1_ULSGRO0_USL1_UIOFGRO0_UPLRP0_USFGROn1_VSn1_VWA1_VWB1_WSGRA0_WSGRB0_WS32_WG64_2_1_WGM8_WGMXCC1_WGMXCCGn1
    SolutionIndex: 37
    SolutionNameMin: Cijk_Ailk_Bljk_BBS_BH_Bias_HA_S_SAV_UserArgs_MT128x48x32_MI16x16x1_CMS_SN_LDSB0_AFC1_AG0_AFEM1_AFEM1_ASEM1_CLR1_CADS0_DTLA0_DTLB0_DTVA0_DTVB0_DTVSM0_DPLBn1_EPS0_ELFLR0_EMLLn1_FDSI0_GRPM1_GRVWA8_GRVWB4_GSU2_GSUAMB_GSUC0_GSUWGMRR0_GLS0_ISA1151_IU1_LDSTI0_LBSPPA4096_LBSPPB128_LBSPPM0_LPA16_LPB16_LPM0_LRVW16_LWPMn1_MIAV1_MIWT2_3_MO40_MGRIPMn1_NTn1_NTA0_NTB0_NTC0_NTD0_NTM0_NEPBS0_NLCA1_NLCB1_ONLL1_PGR2_PLR1_PKA0_SGROBn1_SIA3_SS1_SU32_SUM1_SUS256_SPO0_SRVW0_SSO0_SVW1_SK0_SKFTR0_SKXCCM0_SGRO0_TIN0_TLDS1_TLDSM1_ULSGRO0_USL1_UIOFGRO0_UPLRP0_USFGROn1_VSn1_VWA1_VWB1_WSGRA0_WSGRB0_WS32_WG64_2_1_WGM8_WGMXCC1_WGMXCCGn1
    SolutionIndex: 38
    SolutionNameMin: Cijk_Ailk_Bljk_BBS_BH_Bias_HA_S_SAV_UserArgs_MT128x48x32_MI16x16x1_CMS_SN_LDSB0_AFC1_AG0_AFEM1_AFEM1_ASEM1_CLR1_CADS0_DTLA0_DTLB0_DTVA0_DTVB0_DTVSM0_DPLBn1_EPS0_ELFLR0_EMLLn1_FDSI0_GRPM1_GRVWA8_GRVWB4_GSU4_GSUAMB_GSUC0_GSUWGMRR0_GLS0_ISA1151_IU1_LDSTI0_LBSPPA4096_LBSPPB128_LBSPPM0_LPA16_LPB16_LPM0_LRVW16_LWPMn1_MIAV1_MIWT2_3_MO40_MGRIPMn1_NTn1_NTA0_NTB0_NTC0_NTD0_NTM0_NEPBS0_NLCA1_NLCB1_ONLL1_PGR2_PLR1_PKA0_SGROBn1_SIA3_SS1_SU32_SUM1_SUS256_SPO0_SRVW0_SSO0_SVW1_SK0_SKFTR0_SKXCCM0_SGRO0_TIN0_TLDS1_TLDSM1_ULSGRO0_USL1_UIOFGRO0_UPLRP0_USFGROn1_VSn1_VWA1_VWB1_WSGRA0_WSGRB0_WS32_WG64_2_1_WGM8_WGMXCC1_WGMXCCGn1
    SolutionIndex: 39
    SolutionNameMin: Cijk_Ailk_Bljk_BBS_BH_Bias_HA_S_SAV_UserArgs_MT16x64x32_MI16x16x1_CMS_SN_LDSB0_AFC1_AG0_AFEM1_AFEM1_ASEM1_CLR1_CADS0_DTLA0_DTLB0_DTVA0_DTVB0_DTVSM0_DPLBn1_EPS0_ELFLR0_EMLLn1_FDSI0_GRPM1_GRVWA4_GRVWB8_GSU1_GSUAMB_GSUC0_GSUWGMRR0_GLS0_ISA1151_IU1_LDSTI0_LBSPPA512_LBSPPB2048_LBSPPM0_LPA16_LPB16_LPM0_LRVW16_LWPMn1_MIAV1_MIWT1_1_MO40_MGRIPMn1_NTn1_NTA0_NTB0_NTC0_NTD0_NTM0_NEPBS0_NLCA1_NLCB1_ONLL1_PGR2_PLR1_PKA0_SGROBn1_SIA3_SS1_SU32_SUM1_SUS256_SPO0_SRVW0_SSO0_SVW1_SK0_SKFTR0_SKXCCM0_SGRO0_TIN0_TLDS0_TLDSM1_ULSGRO0_USL1_UIOFGRO0_UPLRP0_USFGROn1_VSn1_VWA1_VWB1_WSGRA0_WSGRB0_WS32_WG16_8_1_WGM8_WGMXCC1_WGMXCCGn1
    SolutionIndex: 40
    SolutionNameMin: Cijk_Ailk_Bljk_BBS_BH_Bias_HA_S_SAV_UserArgs_MT16x64x32_MI16x16x1_CMS_SN_LDSB0_AFC1_AG0_AFEM1_AFEM1_ASEM1_CLR1_CADS0_DTLA0_DTLB0_DTVA0_DTVB0_DTVSM0_DPLBn1_EPS0_ELFLR0_EMLLn1_FDSI0_GRPM1_GRVWA1_GRVWB8_GSU1_GSUAMB_GSUC0_GSUWGMRR0_GLS0_ISA1151_IU1_LDSTI0_LBSPPA512_LBSPPB2048_LBSPPM0_LPA16_LPB16_LPM0_LRVW16_LWPMn1_MIAV1_MIWT1_1_MO40_MGRIPMn1_NTn1_NTA0_NTB0_NTC0_NTD0_NTM0_NEPBS0_NLCA1_NLCB1_ONLL1_PGR2_PLR1_PKA0_SGROBn1_SIA3_SS1_SU32_SUM1_SUS256_SPO0_SRVW0_SSO0_SVW1_SK0_SKFTR0_SKXCCM0_SGRO0_TIN0_TLDS0_TLDSM1_ULSGRO0_USL1_UIOFGRO0_UPLRP0_USFGROn1_VSn1_VWA1_VWB1_WSGRA0_WSGRB0_WS32_WG16_8_1_WGM8_WGMXCC1_WGMXCCGn1
    SolutionIndex: 41
    SolutionNameMin: Cijk_Ailk_Bljk_BBS_BH_Bias_HA_S_SAV_UserArgs_MT32x64x32_MI16x16x1_CMS_SN_LDSB0_AFC1_AG0_AFEM1_AFEM1_ASEM1_CLR1_CADS0_DTLA0_DTLB0_DTVA0_DTVB0_DTVSM0_DPLBn1_EPS0_ELFLR0_EMLLn1_FDSI0_GRPM1_GRVWA1_GRVWB8_GSU1_GSUAMB_GSUC0_GSUWGMRR0_GLS0_ISA1151_IU1_LDSTI0_LBSPPA1024_LBSPPB2048_LBSPPM0_LPA16_LPB16_LPM0_LRVW16_LWPMn1_MIAV1_MIWT2_1_MO40_MGRIPMn1_NTn1_NTA0_NTB0_NTC0_NTD0_NTM0_NEPBS0_NLCA1_NLCB1_ONLL1_PGR2_PLR1_PKA0_SGROBn1_SIA3_SS1_SU32_SUM1_SUS256_SPO0_SRVW0_SSO0_SVW1_SK0_SKFTR0_SKXCCM0_SGRO0_TIN0_TLDS0_TLDSM1_ULSGRO0_USL1_UIOFGRO0_UPLRP0_USFGROn1_VSn1_VWA1_VWB1_WSGRA0_WSGRB0_WS32_WG16_8_1_WGM8_WGMXCC1_WGMXCCGn1
    SolutionIndex: 42
    SolutionNameMin: Cijk_Ailk_Bljk_BBS_BH_Bias_HA_S_SAV_UserArgs_MT32x64x32_MI16x16x1_CMS_SN_LDSB0_AFC1_AG0_AFEM1_AFEM1_ASEM1_CLR1_CADS0_DTLA0_DTLB0_DTVA0_DTVB0_DTVSM0_DPLBn1_EPS0_ELFLR0_EMLLn1_FDSI0_GRPM1_GRVWA8_GRVWB1_GSU1_GSUAMB_GSUC0_GSUWGMRR0_GLS0_ISA1151_IU1_LDSTI0_LBSPPA1024_LBSPPB128_LBSPPM0_LPA16_LPB16_LPM0_LRVW16_LWPMn1_MIAV1_MIWT2_1_MO40_MGRIPMn1_NTn1_NTA0_NTB0_NTC0_NTD0_NTM0_NEPBS0_NLCA1_NLCB1_ONLL1_PGR2_PLR1_PKA0_SGROBn1_SIA3_SS1_SU32_SUM1_SUS256_SPO0_SRVW0_SSO0_SVW1_SK0_SKFTR0_SKXCCM0_SGRO0_TIN0_TLDS1_TLDSM1_ULSGRO0_USL1_UIOFGRO0_UPLRP0_USFGROn1_VSn1_VWA1_VWB1_WSGRA0_WSGRB0_WS32_WG16_8_1_WGM8_WGMXCC1_WGMXCCGn1
    SolutionIndex: 43
    SolutionNameMin: Cijk_Ailk_Bljk_BBS_BH_Bias_HA_S_SAV_UserArgs_MT64x80x32_MI16x16x1_CMS_SN_LDSB0_AFC1_AG0_AFEM1_AFEM1_ASEM1_CLR1_CADS0_DTLA0_DTLB0_DTVA0_DTVB0_DTVSM0_DPLBn1_EPS0_ELFLR0_EMLLn1_FDSI0_GRPM1_GRVWA8_GRVWB4_GSU1_GSUAMB_GSUC0_GSUWGMRR0_GLS0_ISA1151_IU1_LDSTI0_LBSPPA2048_LBSPPB128_LBSPPM0_LPA16_LPB16_LPM0_LRVW16_LWPMn1_MIAV1_MIWT1_5_MO40_MGRIPMn1_NTn1_NTA0_NTB0_NTC0_NTD0_NTM0_NEPBS0_NLCA1_NLCB1_ONLL1_PGR2_PLR1_PKA0_SGROBn1_SIA3_SS1_SU32_SUM1_SUS256_SPO0_SRVW0_SSO0_SVW1_SK0_SKFTR0_SKXCCM0_SGRO0_TIN0_TLDS1_TLDSM1_ULSGRO0_USL1_UIOFGRO0_UPLRP0_USFGROn1_VSn1_VWA1_VWB1_WSGRA0_WSGRB0_WS32_WG64_2_1_WGM8_WGMXCC1_WGMXCCGn1
    SolutionIndex: 44
    SolutionNameMin: Cijk_Ailk_Bljk_BBS_BH_Bias_HA_S_SAV_UserArgs_MT32x96x32_MI16x16x1_CMS_SN_LDSB0_AFC1_AG0_AFEM1_AFEM1_ASEM1_CLR1_CADS0_DTLA0_DTLB0_DTVA0_DTVB0_DTVSM0_DPLBn1_EPS0_ELFLR0_EMLLn1_FDSI0_GRPM1_GRVWA8_GRVWB8_GSU1_GSUAMB_GSUC0_GSUWGMRR0_GLS0_ISA1151_IU1_LDSTI0_LBSPPA1024_LBSPPB128_LBSPPM0_LPA16_LPB16_LPM0_LRVW16_LWPMn1_MIAV1_MIWT1_3_MO40_MGRIPMn1_NTn1_NTA0_NTB0_NTC0_NTD0_NTM0_NEPBS0_NLCA1_NLCB1_ONLL1_PGR2_PLR1_PKA0_SGROBn1_SIA3_SS1_SU32_SUM1_SUS256_SPO0_SRVW0_SSO0_SVW1_SK0_SKFTR0_SKXCCM0_SGRO0_TIN0_TLDS1_TLDSM1_ULSGRO0_USL1_UIOFGRO0_UPLRP0_USFGROn1_VSn1_VWA1_VWB1_WSGRA0_WSGRB0_WS32_WG32_4_1_WGM8_WGMXCC1_WGMXCCGn1
    SolutionIndex: 45
    SolutionNameMin: Cijk_Ailk_Bljk_BBS_BH_Bias_HA_S_SAV_UserArgs_MT32x96x32_MI16x16x1_CMS_SN_LDSB0_AFC1_AG0_AFEM1_AFEM1_ASEM1_CLR1_CADS0_DTLA0_DTLB0_DTVA0_DTVB0_DTVSM0_DPLBn1_EPS0_ELFLR0_EMLLn1_FDSI0_GRPM1_GRVWA1_GRVWB8_GSU1_GSUAMB_GSUC0_GSUWGMRR0_GLS0_ISA1151_IU1_LDSTI0_LBSPPA1024_LBSPPB3072_LBSPPM0_LPA16_LPB16_LPM0_LRVW16_LWPMn1_MIAV1_MIWT1_3_MO40_MGRIPMn1_NTn1_NTA0_NTB0_NTC0_NTD0_NTM0_NEPBS0_NLCA1_NLCB1_ONLL1_PGR2_PLR1_PKA0_SGROBn1_SIA3_SS1_SU32_SUM1_SUS256_SPO0_SRVW0_SSO0_SVW1_SK0_SKFTR0_SKXCCM0_SGRO0_TIN0_TLDS0_TLDSM1_ULSGRO0_USL1_UIOFGRO0_UPLRP0_USFGROn1_VSn1_VWA1_VWB1_WSGRA0_WSGRB0_WS32_WG32_4_1_WGM8_WGMXCC1_WGMXCCGn1
    SolutionIndex: 46
    SolutionNameMin: Cijk_Ailk_Bljk_BBS_BH_Bias_HA_S_SAV_UserArgs_MT64x96x32_MI16x16x1_CMS_SN_LDSB0_AFC1_AG0_AFEM1_AFEM1_ASEM1_CLR1_CADS0_DTLA0_DTLB0_DTVA0_DTVB0_DTVSM0_DPLBn1_EPS0_ELFLR0_EMLLn1_FDSI0_GRPM1_GRVWA8_GRVWB8_GSU1_GSUAMB_GSUC0_GSUWGMRR0_GLS0_ISA1151_IU1_LDSTI0_LBSPPA2048_LBSPPB3072_LBSPPM0_LPA16_LPB16_LPM0_LRVW16_LWPMn1_MIAV1_MIWT2_3_MO40_MGRIPMn1_NTn1_NTA0_NTB0_NTC0_NTD0_NTM0_NEPBS0_NLCA1_NLCB1_ONLL1_PGR2_PLR1_PKA0_SGROBn1_SIA3_SS1_SU32_SUM1_SUS256_SPO0_SRVW0_SSO0_SVW1_SK0_SKFTR0_SKXCCM0_SGRO0_TIN0_TLDS0_TLDSM1_ULSGRO0_USL1_UIOFGRO0_UPLRP0_USFGROn1_VSn1_VWA1_VWB1_WSGRA0_WSGRB0_WS32_WG32_4_1_WGM8_WGMXCC1_WGMXCCGn1
    SolutionIndex: 47
    SolutionNameMin: Cijk_Ailk_Bljk_BBS_BH_Bias_HA_S_SAV_UserArgs_MT64x96x32_MI16x16x1_CMS_SN_LDSB0_AFC1_AG0_AFEM1_AFEM1_ASEM1_CLR1_CADS0_DTLA0_DTLB0_DTVA0_DTVB0_DTVSM0_DPLBn1_EPS0_ELFLR0_EMLLn1_FDSI0_GRPM1_GRVWA8_GRVWB8_GSU1_GSUAMB_GSUC0_GSUWGMRR0_GLS0_ISA1151_IU1_LDSTI0_LBSPPA2048_LBSPPB128_LBSPPM0_LPA16_LPB16_LPM0_LRVW16_LWPMn1_MIAV1_MIWT2_3_MO40_MGRIPMn1_NTn1_NTA0_NTB0_NTC0_NTD0_NTM0_NEPBS0_NLCA1_NLCB1_ONLL1_PGR2_PLR1_PKA0_SGROBn1_SIA3_SS1_SU32_SUM1_SUS256_SPO0_SRVW0_SSO0_SVW1_SK0_SKFTR0_SKXCCM0_SGRO0_TIN0_TLDS1_TLDSM1_ULSGRO0_USL1_UIOFGRO0_UPLRP0_USFGROn1_VSn1_VWA1_VWB1_WSGRA0_WSGRB0_WS32_WG32_4_1_WGM8_WGMXCC1_WGMXCCGn1
    SolutionIndex: 48
    SolutionNameMin: Cijk_Ailk_Bljk_BBS_BH_Bias_HA_S_SAV_UserArgs_MT64x96x32_MI16x16x1_CMS_SN_LDSB0_AFC1_AG0_AFEM1_AFEM1_ASEM1_CLR1_CADS0_DTLA0_DTLB0_DTVA0_DTVB0_DTVSM0_DPLBn1_EPS0_ELFLR0_EMLLn1_FDSI0_GRPM1_GRVWA1_GRVWB8_GSU1_GSUAMB_GSUC0_GSUWGMRR0_GLS0_ISA1151_IU1_LDSTI0_LBSPPA2048_LBSPPB128_LBSPPM0_LPA16_LPB16_LPM0_LRVW16_LWPMn1_MIAV1_MIWT2_3_MO40_MGRIPMn1_NTn1_NTA0_NTB0_NTC0_NTD0_NTM0_NEPBS0_NLCA1_NLCB1_ONLL1_PGR2_PLR1_PKA0_SGROBn1_SIA3_SS1_SU32_SUM1_SUS256_SPO0_SRVW0_SSO0_SVW1_SK0_SKFTR0_SKXCCM0_SGRO0_TIN0_TLDS1_TLDSM1_ULSGRO0_USL1_UIOFGRO0_UPLRP0_USFGROn1_VSn1_VWA1_VWB1_WSGRA0_WSGRB0_WS32_WG32_4_1_WGM8_WGMXCC1_WGMXCCGn1
    SolutionIndex: 50
    SolutionNameMin: Cijk_Ailk_Bljk_BBS_BH_Bias_HA_S_SAV_UserArgs_MT64x96x32_MI16x16x1_CMS_SN_LDSB0_AFC1_AG0_AFEM1_AFEM1_ASEM1_CLR1_CADS0_DTLA0_DTLB0_DTVA0_DTVB0_DTVSM0_DPLBn1_EPS0_ELFLR0_EMLLn1_FDSI0_GRPM1_GRVWA8_GRVWB8_GSU2_GSUAMB_GSUC0_GSUWGMRR0_GLS0_ISA1151_IU1_LDSTI0_LBSPPA2048_LBSPPB128_LBSPPM0_LPA16_LPB16_LPM0_LRVW16_LWPMn1_MIAV1_MIWT2_3_MO40_MGRIPMn1_NTn1_NTA0_NTB0_NTC0_NTD0_NTM0_NEPBS0_NLCA1_NLCB1_ONLL1_PGR2_PLR1_PKA0_SGROBn1_SIA3_SS1_SU32_SUM1_SUS256_SPO0_SRVW0_SSO0_SVW1_SK0_SKFTR0_SKXCCM0_SGRO0_TIN0_TLDS1_TLDSM1_ULSGRO0_USL1_UIOFGRO0_UPLRP0_USFGROn1_VSn1_VWA1_VWB1_WSGRA0_WSGRB0_WS32_WG32_4_1_WGM8_WGMXCC1_WGMXCCGn1
    SolutionIndex: 51
    SolutionNameMin: Cijk_Ailk_Bljk_BBS_BH_Bias_HA_S_SAV_UserArgs_MT64x96x32_MI16x16x1_CMS_SN_LDSB0_AFC1_AG0_AFEM1_AFEM1_ASEM1_CLR1_CADS0_DTLA0_DTLB0_DTVA0_DTVB0_DTVSM0_DPLBn1_EPS0_ELFLR0_EMLLn1_FDSI0_GRPM1_GRVWA8_GRVWB8_GSU4_GSUAMB_GSUC0_GSUWGMRR0_GLS0_ISA1151_IU1_LDSTI0_LBSPPA2048_LBSPPB128_LBSPPM0_LPA16_LPB16_LPM0_LRVW16_LWPMn1_MIAV1_MIWT2_3_MO40_MGRIPMn1_NTn1_NTA0_NTB0_NTC0_NTD0_NTM0_NEPBS0_NLCA1_NLCB1_ONLL1_PGR2_PLR1_PKA0_SGROBn1_SIA3_SS1_SU32_SUM1_SUS256_SPO0_SRVW0_SSO0_SVW1_SK0_SKFTR0_SKXCCM0_SGRO0_TIN0_TLDS1_TLDSM1_ULSGRO0_USL1_UIOFGRO0_UPLRP0_USFGROn1_VSn1_VWA1_VWB1_WSGRA0_WSGRB0_WS32_WG32_4_1_WGM8_WGMXCC1_WGMXCCGn1
    SolutionIndex: 52
    SolutionNameMin: Cijk_Ailk_Bljk_BBS_BH_Bias_HA_S_SAV_UserArgs_MT64x96x32_MI16x16x1_CMS_SN_LDSB0_AFC1_AG0_AFEM1_AFEM1_ASEM1_CLR1_CADS0_DTLA0_DTLB0_DTVA0_DTVB0_DTVSM0_DPLBn1_EPS0_ELFLR0_EMLLn1_FDSI0_GRPM1_GRVWA1_GRVWB8_GSU4_GSUAMB_GSUC0_GSUWGMRR0_GLS0_ISA1151_IU1_LDSTI0_LBSPPA2048_LBSPPB128_LBSPPM0_LPA16_LPB16_LPM0_LRVW16_LWPMn1_MIAV1_MIWT2_3_MO40_MGRIPMn1_NTn1_NTA0_NTB0_NTC0_NTD0_NTM0_NEPBS0_NLCA1_NLCB1_ONLL1_PGR2_PLR1_PKA0_SGROBn1_SIA3_SS1_SU32_SUM1_SUS256_SPO0_SRVW0_SSO0_SVW1_SK0_SKFTR0_SKXCCM0_SGRO0_TIN0_TLDS1_TLDSM1_ULSGRO0_USL1_UIOFGRO0_UPLRP0_USFGROn1_VSn1_VWA1_VWB1_WSGRA0_WSGRB0_WS32_WG32_4_1_WGM8_WGMXCC1_WGMXCCGn1
    SolutionIndex: 53
    SolutionNameMin: Cijk_Ailk_Bljk_BBS_BH_Bias_HA_S_SAV_UserArgs_MT96x96x32_MI16x16x1_CMS_SN_LDSB0_AFC1_AG0_AFEM1_AFEM1_ASEM1_CLR1_CADS0_DTLA0_DTLB0_DTVA0_DTVB0_DTVSM0_DPLBn1_EPS0_ELFLR0_EMLLn1_FDSI0_GRPM1_GRVWA8_GRVWB8_GSU1_GSUAMB_GSUC0_GSUWGMRR0_GLS0_ISA1151_IU1_LDSTI0_LBSPPA3072_LBSPPB128_LBSPPM0_LPA16_LPB16_LPM0_LRVW16_LWPMn1_MIAV1_MIWT3_3_MO40_MGRIPMn1_NTn1_NTA0_NTB0_NTC0_NTD0_NTM0_NEPBS0_NLCA3_NLCB1_ONLL1_PGR2_PLR1_PKA0_SGROBn1_SIA3_SS1_SU32_SUM1_SUS256_SPO0_SRVW0_SSO0_SVW1_SK0_SKFTR0_SKXCCM0_SGRO0_TIN0_TLDS1_TLDSM1_ULSGRO0_USL1_UIOFGRO0_UPLRP0_USFGROn1_VSn1_VWA1_VWB1_WSGRA0_WSGRB0_WS32_WG32_4_1_WGM8_WGMXCC1_WGMXCCGn1
    SolutionIndex: 55
    SolutionNameMin: Cijk_Ailk_Bljk_BBS_BH_Bias_HA_S_SAV_UserArgs_MT96x96x32_MI16x16x1_CMS_SN_LDSB0_AFC1_AG0_AFEM1_AFEM1_ASEM1_CLR1_CADS0_DTLA0_DTLB0_DTVA0_DTVB0_DTVSM0_DPLBn1_EPS0_ELFLR0_EMLLn1_FDSI0_GRPM1_GRVWA8_GRVWB8_GSU4_GSUAMB_GSUC0_GSUWGMRR0_GLS0_ISA1151_IU1_LDSTI0_LBSPPA3072_LBSPPB128_LBSPPM0_LPA16_LPB16_LPM0_LRVW16_LWPMn1_MIAV1_MIWT3_3_MO40_MGRIPMn1_NTn1_NTA0_NTB0_NTC0_NTD0_NTM0_NEPBS0_NLCA3_NLCB1_ONLL1_PGR2_PLR1_PKA0_SGROBn1_SIA3_SS1_SU32_SUM1_SUS256_SPO0_SRVW0_SSO0_SVW1_SK0_SKFTR0_SKXCCM0_SGRO0_TIN0_TLDS1_TLDSM1_ULSGRO0_USL1_UIOFGRO0_UPLRP0_USFGROn1_VSn1_VWA1_VWB1_WSGRA0_WSGRB0_WS32_WG32_4_1_WGM8_WGMXCC1_WGMXCCGn1
    SolutionIndex: 57
    SolutionNameMin: Cijk_Ailk_Bljk_BBS_BH_Bias_HA_S_SAV_UserArgs_MT64x112x32_MI16x16x1_CMS_SN_LDSB0_AFC1_AG0_AFEM1_AFEM1_ASEM1_CLR1_CADS0_DTLA0_DTLB0_DTVA0_DTVB0_DTVSM0_DPLBn1_EPS0_ELFLR0_EMLLn1_FDSI0_GRPM1_GRVWA8_GRVWB4_GSU1_GSUAMB_GSUC0_GSUWGMRR0_GLS0_ISA1151_IU1_LDSTI0_LBSPPA2048_LBSPPB128_LBSPPM0_LPA16_LPB16_LPM0_LRVW16_LWPMn1_MIAV1_MIWT1_7_MO40_MGRIPMn1_NTn1_NTA0_NTB0_NTC0_NTD0_NTM0_NEPBS0_NLCA1_NLCB1_ONLL1_PGR2_PLR1_PKA0_SGROBn1_SIA3_SS1_SU32_SUM1_SUS256_SPO0_SRVW0_SSO0_SVW1_SK0_SKFTR0_SKXCCM0_SGRO0_TIN0_TLDS1_TLDSM1_ULSGRO0_USL1_UIOFGRO0_UPLRP0_USFGROn1_VSn1_VWA1_VWB1_WSGRA0_WSGRB0_WS32_WG64_2_1_WGM8_WGMXCC1_WGMXCCGn1
    SolutionIndex: 58
    SolutionNameMin: Cijk_Ailk_Bljk_BBS_BH_Bias_HA_S_SAV_UserArgs_MT64x112x32_MI16x16x1_CMS_SN_LDSB0_AFC1_AG0_AFEM1_AFEM1_ASEM1_CLR1_CADS0_DTLA0_DTLB0_DTVA0_DTVB0_DTVSM0_DPLBn1_EPS0_ELFLR0_EMLLn1_FDSI0_GRPM1_GRVWA1_GRVWB4_GSU1_GSUAMB_GSUC0_GSUWGMRR0_GLS0_ISA1151_IU1_LDSTI0_LBSPPA2048_LBSPPB128_LBSPPM0_LPA16_LPB16_LPM0_LRVW16_LWPMn1_MIAV1_MIWT1_7_MO40_MGRIPMn1_NTn1_NTA0_NTB0_NTC0_NTD0_NTM0_NEPBS0_NLCA1_NLCB1_ONLL1_PGR2_PLR1_PKA0_SGROBn1_SIA3_SS1_SU32_SUM1_SUS256_SPO0_SRVW0_SSO0_SVW1_SK0_SKFTR0_SKXCCM0_SGRO0_TIN0_TLDS1_TLDSM1_ULSGRO0_USL1_UIOFGRO0_UPLRP0_USFGROn1_VSn1_VWA1_VWB1_WSGRA0_WSGRB0_WS32_WG64_2_1_WGM8_WGMXCC1_WGMXCCGn1
    SolutionIndex: 59
    SolutionNameMin: Cijk_Ailk_Bljk_BBS_BH_Bias_HA_S_SAV_UserArgs_MT48x128x32_MI16x16x1_CMS_SN_LDSB0_AFC1_AG0_AFEM1_AFEM1_ASEM1_CLR1_CADS0_DTLA0_DTLB0_DTVA0_DTVB0_DTVSM0_DPLBn1_EPS0_ELFLR0_EMLLn1_FDSI0_GRPM1_GRVWA4_GRVWB8_GSU1_GSUAMB_GSUC0_GSUWGMRR0_GLS0_ISA1151_IU1_LDSTI0_LBSPPA1536_LBSPPB4096_LBSPPM0_LPA16_LPB16_LPM0_LRVW16_LWPMn1_MIAV1_MIWT3_2_MO40_MGRIPMn1_NTn1_NTA0_NTB0_NTC0_NTD0_NTM0_NEPBS0_NLCA3_NLCB1_ONLL1_PGR2_PLR1_PKA0_SGROBn1_SIA3_SS1_SU32_SUM1_SUS256_SPO0_SRVW0_SSO0_SVW1_SK0_SKFTR0_SKXCCM0_SGRO0_TIN0_TLDS0_TLDSM1_ULSGRO0_USL1_UIOFGRO0_UPLRP0_USFGROn1_VSn1_VWA1_VWB1_WSGRA0_WSGRB0_WS32_WG16_8_1_WGM8_WGMXCC1_WGMXCCGn1
    SolutionIndex: 60
    SolutionNameMin: Cijk_Ailk_Bljk_BBS_BH_Bias_HA_S_SAV_UserArgs_MT32x224x32_MI16x16x1_CMS_SN_LDSB1_AFC1_AG0_AFEM1_AFEM1_ASEM1_CLR1_CADS0_DTLA0_DTLB0_DTVA0_DTVB0_DTVSM0_DPLBn1_EPS0_ELFLR0_EMLLn1_FDSI0_GRPM1_GRVWA1_GRVWB8_GSU1_GSUAMB_GSUC0_GSUWGMRR0_GLS0_ISA1151_IU1_LDSTI0_LBSPPA1024_LBSPPB128_LBSPPM0_LPA16_LPB16_LPM0_LRVW16_LWPMn1_MIAV1_MIWT1_7_MO40_MGRIPMn1_NTn1_NTA0_NTB0_NTC0_NTD0_NTM0_NEPBS0_NLCA1_NLCB1_ONLL1_PGR2_PLR1_PKA0_SGROBn1_SIA3_SS1_SU32_SUM1_SUS256_SPO0_SRVW0_SSO0_SVW1_SK0_SKFTR0_SKXCCM0_SGRO0_TIN0_TLDS1_TLDSM1_ULSGRO0_USL1_UIOFGRO0_UPLRP0_USFGROn1_VSn1_VWA1_VWB1_WSGRA0_WSGRB0_WS32_WG32_4_1_WGM8_WGMXCC1_WGMXCCGn1
    SolutionIndex: 61
    SolutionNameMin: Cijk_Ailk_Bljk_BBS_BH_Bias_HA_S_SAV_UserArgs_MT64x16x64_MI16x16x1_CMS_SN_LDSB0_AFC1_AG0_AFEM1_AFEM1_ASEM1_CLR1_CADS0_DTLA0_DTLB0_DTVA0_DTVB0_DTVSM0_DPLBn1_EPS0_ELFLR0_EMLLn1_FDSI0_GRPM1_GRVWA8_GRVWB8_GSU1_GSUAMB_GSUC0_GSUWGMRR0_GLS0_ISA1151_IU1_LDSTI0_LBSPPA2048_LBSPPB512_LBSPPM0_LPA16_LPB16_LPM0_LRVW16_LWPMn1_MIAV1_MIWT1_1_MO40_MGRIPMn1_NTn1_NTA0_NTB0_NTC0_NTD0_NTM0_NEPBS0_NLCA1_NLCB1_ONLL1_PGR2_PLR1_PKA0_SGROBn1_SIA3_SS1_SU32_SUM1_SUS256_SPO0_SRVW0_SSO0_SVW1_SK0_SKFTR0_SKXCCM0_SGRO0_TIN0_TLDS0_TLDSM1_ULSGRO0_USL1_UIOFGRO0_UPLRP0_USFGROn1_VSn1_VWA1_VWB1_WSGRA0_WSGRB0_WS32_WG64_2_1_WGM8_WGMXCC1_WGMXCCGn1
    SolutionIndex: 62
    SolutionNameMin: Cijk_Ailk_Bljk_BBS_BH_Bias_HA_S_SAV_UserArgs_MT64x16x64_MI16x16x1_CMS_SN_LDSB0_AFC1_AG0_AFEM1_AFEM1_ASEM1_CLR1_CADS0_DTLA0_DTLB0_DTVA0_DTVB0_DTVSM0_DPLBn1_EPS0_ELFLR0_EMLLn1_FDSI0_GRPM1_GRVWA8_GRVWB8_GSU1_GSUAMB_GSUC0_GSUWGMRR0_GLS0_ISA1151_IU1_LDSTI0_LBSPPA2048_LBSPPB128_LBSPPM0_LPA16_LPB16_LPM0_LRVW16_LWPMn1_MIAV1_MIWT1_1_MO40_MGRIPMn1_NTn1_NTA0_NTB0_NTC0_NTD0_NTM0_NEPBS0_NLCA1_NLCB1_ONLL1_PGR2_PLR1_PKA0_SGROBn1_SIA3_SS1_SU32_SUM1_SUS256_SPO0_SRVW0_SSO0_SVW1_SK0_SKFTR0_SKXCCM0_SGRO0_TIN0_TLDS1_TLDSM1_ULSGRO0_USL1_UIOFGRO0_UPLRP0_USFGROn1_VSn1_VWA1_VWB1_WSGRA0_WSGRB0_WS32_WG64_2_1_WGM8_WGMXCC1_WGMXCCGn1
    SolutionIndex: 63
    SolutionNameMin: Cijk_Ailk_Bljk_BBS_BH_Bias_HA_S_SAV_UserArgs_MT64x16x64_MI16x16x1_CMS_SN_LDSB0_AFC1_AG0_AFEM1_AFEM1_ASEM1_CLR1_CADS0_DTLA0_DTLB0_DTVA0_DTVB0_DTVSM0_DPLBn1_EPS0_ELFLR0_EMLLn1_FDSI0_GRPM1_GRVWA8_GRVWB1_GSU1_GSUAMB_GSUC0_GSUWGMRR0_GLS0_ISA1151_IU1_LDSTI0_LBSPPA2048_LBSPPB128_LBSPPM0_LPA16_LPB16_LPM0_LRVW16_LWPMn1_MIAV1_MIWT1_1_MO40_MGRIPMn1_NTn1_NTA0_NTB0_NTC0_NTD0_NTM0_NEPBS0_NLCA1_NLCB1_ONLL1_PGR2_PLR1_PKA0_SGROBn1_SIA3_SS1_SU32_SUM1_SUS256_SPO0_SRVW0_SSO0_SVW1_SK0_SKFTR0_SKXCCM0_SGRO0_TIN0_TLDS1_TLDSM1_ULSGRO0_USL1_UIOFGRO0_UPLRP0_USFGROn1_VSn1_VWA1_VWB1_WSGRA0_WSGRB0_WS32_WG64_2_1_WGM8_WGMXCC1_WGMXCCGn1
    SolutionIndex: 64
    SolutionNameMin: Cijk_Ailk_Bljk_BBS_BH_Bias_HA_S_SAV_UserArgs_MT64x16x64_MI16x16x1_CMS_SN_LDSB0_AFC1_AG0_AFEM1_AFEM1_ASEM1_CLR1_CADS0_DTLA0_DTLB0_DTVA0_DTVB0_DTVSM0_DPLBn1_EPS0_ELFLR0_EMLLn1_FDSI0_GRPM1_GRVWA8_GRVWB8_GSU4_GSUAMB_GSUC0_GSUWGMRR0_GLS0_ISA1151_IU1_LDSTI0_LBSPPA2048_LBSPPB128_LBSPPM0_LPA16_LPB16_LPM0_LRVW16_LWPMn1_MIAV1_MIWT1_1_MO40_MGRIPMn1_NTn1_NTA0_NTB0_NTC0_NTD0_NTM0_NEPBS0_NLCA1_NLCB1_ONLL1_PGR2_PLR1_PKA0_SGROBn1_SIA3_SS1_SU32_SUM1_SUS256_SPO0_SRVW0_SSO0_SVW1_SK0_SKFTR0_SKXCCM0_SGRO0_TIN0_TLDS1_TLDSM1_ULSGRO0_USL1_UIOFGRO0_UPLRP0_USFGROn1_VSn1_VWA1_VWB1_WSGRA0_WSGRB0_WS32_WG64_2_1_WGM8_WGMXCC1_WGMXCCGn1
    SolutionIndex: 65
    SolutionNameMin: Cijk_Ailk_Bljk_BBS_BH_Bias_HA_S_SAV_UserArgs_MT32x32x64_MI16x16x1_CMS_SN_LDSB0_AFC1_AG0_AFEM1_AFEM1_ASEM1_CLR1_CADS0_DTLA0_DTLB0_DTVA0_DTVB0_DTVSM0_DPLBn1_EPS0_ELFLR0_EMLLn1_FDSI0_GRPM1_GRVWA8_GRVWB8_GSU1_GSUAMB_GSUC0_GSUWGMRR0_GLS0_ISA1151_IU1_LDSTI0_LBSPPA1024_LBSPPB1024_LBSPPM0_LPA16_LPB16_LPM0_LRVW16_LWPMn1_MIAV1_MIWT1_1_MO40_MGRIPMn1_NTn1_NTA0_NTB0_NTC0_NTD0_NTM0_NEPBS0_NLCA1_NLCB1_ONLL1_PGR2_PLR1_PKA0_SGROBn1_SIA3_SS1_SU32_SUM1_SUS256_SPO0_SRVW0_SSO0_SVW1_SK0_SKFTR0_SKXCCM0_SGRO0_TIN0_TLDS0_TLDSM1_ULSGRO0_USL1_UIOFGRO0_UPLRP0_USFGROn1_VSn1_VWA1_VWB1_WSGRA0_WSGRB0_WS32_WG32_4_1_WGM8_WGMXCC1_WGMXCCGn1
    SolutionIndex: 66
    SolutionNameMin: Cijk_Ailk_Bljk_BBS_BH_Bias_HA_S_SAV_UserArgs_MT64x32x64_MI16x16x1_CMS_SN_LDSB0_AFC1_AG0_AFEM1_AFEM1_ASEM1_CLR1_CADS0_DTLA0_DTLB0_DTVA0_DTVB0_DTVSM0_DPLBn1_EPS0_ELFLR0_EMLLn1_FDSI0_GRPM1_GRVWA8_GRVWB8_GSU1_GSUAMB_GSUC0_GSUWGMRR0_GLS0_ISA1151_IU1_LDSTI0_LBSPPA2048_LBSPPB1024_LBSPPM0_LPA16_LPB16_LPM0_LRVW16_LWPMn1_MIAV1_MIWT2_1_MO40_MGRIPMn1_NTn1_NTA0_NTB0_NTC0_NTD0_NTM0_NEPBS0_NLCA1_NLCB1_ONLL1_PGR2_PLR1_PKA0_SGROBn1_SIA3_SS1_SU32_SUM1_SUS256_SPO0_SRVW0_SSO0_SVW1_SK0_SKFTR0_SKXCCM0_SGRO0_TIN0_TLDS0_TLDSM1_ULSGRO0_USL1_UIOFGRO0_UPLRP0_USFGROn1_VSn1_VWA1_VWB1_WSGRA0_WSGRB0_WS32_WG32_4_1_WGM8_WGMXCC1_WGMXCCGn1
    SolutionIndex: 68
    SolutionNameMin: Cijk_Ailk_Bljk_BBS_BH_Bias_HA_S_SAV_UserArgs_MT64x32x64_MI16x16x1_CMS_SN_LDSB0_AFC1_AG0_AFEM1_AFEM1_ASEM1_CLR1_CADS0_DTLA0_DTLB0_DTVA0_DTVB0_DTVSM0_DPLBn1_EPS0_ELFLR0_EMLLn1_FDSI0_GRPM1_GRVWA8_GRVWB8_GSU4_GSUAMB_GSUC0_GSUWGMRR0_GLS0_ISA1151_IU1_LDSTI0_LBSPPA2048_LBSPPB1024_LBSPPM0_LPA16_LPB16_LPM0_LRVW16_LWPMn1_MIAV1_MIWT2_1_MO40_MGRIPMn1_NTn1_NTA0_NTB0_NTC0_NTD0_NTM0_NEPBS0_NLCA1_NLCB1_ONLL1_PGR2_PLR1_PKA0_SGROBn1_SIA3_SS1_SU32_SUM1_SUS256_SPO0_SRVW0_SSO0_SVW1_SK0_SKFTR0_SKXCCM0_SGRO0_TIN0_TLDS0_TLDSM1_ULSGRO0_USL1_UIOFGRO0_UPLRP0_USFGROn1_VSn1_VWA1_VWB1_WSGRA0_WSGRB0_WS32_WG32_4_1_WGM8_WGMXCC1_WGMXCCGn1
    SolutionIndex: 69
    SolutionNameMin: Cijk_Ailk_Bljk_BBS_BH_Bias_HA_S_SAV_UserArgs_MT64x48x64_MI16x16x1_CMS_SN_LDSB0_AFC1_AG0_AFEM1_AFEM1_ASEM1_CLR1_CADS0_DTLA0_DTLB0_DTVA0_DTVB0_DTVSM0_DPLBn1_EPS0_ELFLR0_EMLLn1_FDSI0_GRPM1_GRVWA8_GRVWB8_GSU1_GSUAMB_GSUC0_GSUWGMRR0_GLS0_ISA1151_IU1_LDSTI0_LBSPPA2048_LBSPPB128_LBSPPM0_LPA16_LPB16_LPM0_LRVW16_LWPMn1_MIAV1_MIWT1_3_MO40_MGRIPMn1_NTn1_NTA0_NTB0_NTC0_NTD0_NTM0_NEPBS0_NLCA1_NLCB1_ONLL1_PGR2_PLR1_PKA0_SGROBn1_SIA3_SS1_SU32_SUM1_SUS256_SPO0_SRVW0_SSO0_SVW1_SK0_SKFTR0_SKXCCM0_SGRO0_TIN0_TLDS1_TLDSM1_ULSGRO0_USL1_UIOFGRO0_UPLRP0_USFGROn1_VSn1_VWA1_VWB1_WSGRA0_WSGRB0_WS32_WG64_2_1_WGM8_WGMXCC1_WGMXCCGn1
    SolutionIndex: 70
    SolutionNameMin: Cijk_Ailk_Bljk_BBS_BH_Bias_HA_S_SAV_UserArgs_MT16x64x64_MI16x16x1_CMS_SN_LDSB0_AFC1_AG0_AFEM1_AFEM1_ASEM1_CLR1_CADS0_DTLA0_DTLB0_DTVA0_DTVB0_DTVSM0_DPLBn1_EPS0_ELFLR0_EMLLn1_FDSI0_GRPM1_GRVWA8_GRVWB8_GSU1_GSUAMB_GSUC0_GSUWGMRR0_GLS0_ISA1151_IU1_LDSTI0_LBSPPA512_LBSPPB2048_LBSPPM0_LPA16_LPB16_LPM0_LRVW16_LWPMn1_MIAV1_MIWT1_1_MO40_MGRIPMn1_NTn1_NTA0_NTB0_NTC0_NTD0_NTM0_NEPBS0_NLCA1_NLCB1_ONLL1_PGR2_PLR1_PKA0_SGROBn1_SIA3_SS1_SU32_SUM1_SUS256_SPO0_SRVW0_SSO0_SVW1_SK0_SKFTR0_SKXCCM0_SGRO0_TIN0_TLDS0_TLDSM1_ULSGRO0_USL1_UIOFGRO0_UPLRP0_USFGROn1_VSn1_VWA1_VWB1_WSGRA0_WSGRB0_WS32_WG16_8_1_WGM8_WGMXCC1_WGMXCCGn1
    SolutionIndex: 71
    SolutionNameMin: Cijk_Ailk_Bljk_BBS_BH_Bias_HA_S_SAV_UserArgs_MT32x64x64_MI16x16x1_CMS_SN_LDSB0_AFC1_AG0_AFEM1_AFEM1_ASEM1_CLR1_CADS0_DTLA0_DTLB0_DTVA0_DTVB0_DTVSM0_DPLBn1_EPS0_ELFLR0_EMLLn1_FDSI0_GRPM1_GRVWA8_GRVWB8_GSU1_GSUAMB_GSUC0_GSUWGMRR0_GLS0_ISA1151_IU1_LDSTI0_LBSPPA1024_LBSPPB2048_LBSPPM0_LPA16_LPB16_LPM0_LRVW16_LWPMn1_MIAV1_MIWT2_1_MO40_MGRIPMn1_NTn1_NTA0_NTB0_NTC0_NTD0_NTM0_NEPBS0_NLCA1_NLCB1_ONLL1_PGR2_PLR1_PKA0_SGROBn1_SIA3_SS1_SU32_SUM1_SUS256_SPO0_SRVW0_SSO0_SVW1_SK0_SKFTR0_SKXCCM0_SGRO0_TIN0_TLDS0_TLDSM1_ULSGRO0_USL1_UIOFGRO0_UPLRP0_USFGROn1_VSn1_VWA1_VWB1_WSGRA0_WSGRB0_WS32_WG16_8_1_WGM8_WGMXCC1_WGMXCCGn1
    SolutionIndex: 72
    SolutionNameMin: Cijk_Ailk_Bljk_BBS_BH_Bias_HA_S_SAV_UserArgs_MT96x128x64_MI16x16x1_SN_LDSB1_AFC1_AG0_AFEM1_AFEM1_ASEM1_CLR0_CADS0_DTLA0_DTLB0_DTVA0_DTVB0_DTVSM0_DPLB0_EPS0_ELFLR0_EMLLn1_FDSI0_GRPM1_GRVWA8_GRVWB8_GSU1_GSUAMB_GSUC0_GSUWGMRR0_GLS0_ISA1151_IU1_K1_LDSTI0_LBSPPA3072_LBSPPB128_LBSPPM0_LPA8_LPB8_LPM0_LRVW16_LWPMn1_MIAV1_MIWT3_4_MO40_MGRIPM1_NTn1_NTA0_NTB0_NTC0_NTD0_NTM0_NEPBS0_NLCA3_NLCB1_ONLL1_PGR2_PLR0_PKA0_SGROB0_SIA3_SS1_SU32_SUM0_SUS256_SPO0_SRVW0_SSO0_SVW1_SK0_SKFTR0_SKXCCM0_SGRO0_TIN0_TLDS1_TLDSMn1_ULSGRO0_USL1_UIOFGRO0_UPLRP0_USFGROn1_VSn1_VWA1_VWB1_WSGRA0_WSGRB0_WS32_WG32_4_1_WGM8_WGMXCC1_WGMXCCGn1
    SolutionIndex: 73
    SolutionNameMin: Cijk_Ailk_Bljk_BBS_BH_Bias_HA_S_SAV_UserArgs_MT96x128x64_MI16x16x1_SN_LDSB0_AFC1_AG0_AFEM1_AFEM1_ASEM1_CLR0_CADS0_DTLA0_DTLB0_DTVA0_DTVB0_DTVSM0_DPLB0_EPS0_ELFLR0_EMLLn1_FDSI0_GRPM1_GRVWA8_GRVWB8_GSU1_GSUAMB_GSUC0_GSUWGMRR0_GLS0_ISA1151_IU1_K1_LDSTI0_LBSPPA3072_LBSPPB128_LBSPPM0_LPA8_LPB8_LPM0_LRVW16_LWPMn1_MIAV1_MIWT3_4_MO40_MGRIPM1_NTn1_NTA0_NTB0_NTC0_NTD0_NTM0_NEPBS0_NLCA3_NLCB1_ONLL1_PGR2_PLR0_PKA0_SGROB0_SIA1_SS1_SU32_SUM0_SUS256_SPO0_SRVW0_SSO0_SVW1_SK0_SKFTR0_SKXCCM0_SGRO0_TIN0_TLDS1_TLDSMn1_ULSGRO0_USL1_UIOFGRO0_UPLRP0_USFGROn1_VSn1_VWA1_VWB1_WSGRA0_WSGRB0_WS32_WG32_4_1_WGM8_WGMXCC1_WGMXCCGn1
    SolutionIndex: 74
    SolutionNameMin: Cijk_Ailk_Bljk_BBS_BH_Bias_HA_S_SAV_UserArgs_MT128x96x64_MI16x16x1_SN_LDSB1_AFC1_AG0_AFEM1_AFEM1_ASEM1_CLR0_CADS0_DTLA0_DTLB0_DTVA0_DTVB0_DTVSM0_DPLB0_EPS0_ELFLR0_EMLLn1_FDSI0_GRPM1_GRVWA8_GRVWB8_GSU1_GSUAMB_GSUC0_GSUWGMRR0_GLS0_ISA1151_IU1_K1_LDSTI0_LBSPPA4096_LBSPPB128_LBSPPM0_LPA8_LPB8_LPM0_LRVW16_LWPMn1_MIAV1_MIWT2_6_MO40_MGRIPM1_NTn1_NTA0_NTB0_NTC0_NTD0_NTM0_NEPBS0_NLCA1_NLCB1_ONLL1_PGR2_PLR0_PKA0_SGROB0_SIA3_SS1_SU32_SUM0_SUS256_SPO0_SRVW0_SSO0_SVW1_SK0_SKFTR0_SKXCCM0_SGRO0_TIN0_TLDS1_TLDSMn1_ULSGRO0_USL1_UIOFGRO0_UPLRP0_USFGROn1_VSn1_VWA1_VWB1_WSGRA0_WSGRB0_WS32_WG64_2_1_WGM8_WGMXCC1_WGMXCCGn1
    SolutionIndex: 75
    SolutionNameMin: Cijk_Ailk_Bljk_BBS_BH_Bias_HA_S_SAV_UserArgs_MT128x112x64_MI16x16x1_SN_LDSB0_AFC1_AG0_AFEM1_AFEM1_ASEM1_CLR0_CADS0_DTLA0_DTLB0_DTVA0_DTVB0_DTVSM0_DPLB0_EPS0_ELFLR0_EMLLn1_FDSI0_GRPM1_GRVWA8_GRVWB8_GSU1_GSUAMB_GSUC0_GSUWGMRR0_GLS0_ISA1151_IU1_K1_LDSTI0_LBSPPA4096_LBSPPB128_LBSPPM0_LPA8_LPB8_LPM0_LRVW16_LWPMn1_MIAV1_MIWT2_7_MO40_MGRIPM1_NTn1_NTA0_NTB0_NTC0_NTD0_NTM0_NEPBS0_NLCA1_NLCB1_ONLL1_PGR0_PLR0_PKA0_SGROB0_SIA1_SS1_SU32_SUM0_SUS256_SPO0_SRVW0_SSO0_SVW1_SK0_SKFTR0_SKXCCM0_SGRO0_TIN0_TLDS1_TLDSMn1_ULSGRO0_USL1_UIOFGRO0_UPLRP0_USFGROn1_VSn1_VWA1_VWB1_WSGRA0_WSGRB0_WS32_WG64_2_1_WGM8_WGMXCC1_WGMXCCGn1
    SolutionIndex: 76
    SolutionNameMin: Cijk_Ailk_Bljk_BBS_BH_Bias_HA_S_SAV_UserArgs_MT64x96x32_MI16x16x1_SN_LDSB0_AFC1_AG0_AFEM1_AFEM1_ASEM1_CLR0_CADS0_DTLA0_DTLB0_DTVA0_DTVB0_DTVSM0_DPLB0_EPS0_ELFLR0_EMLLn1_FDSI0_GRPM1_GRVWA8_GRVWB8_GSU1_GSUAMB_GSUC0_GSUWGMRR0_GLS0_ISA1151_IU1_K1_LDSTI0_LBSPPA2048_LBSPPB3072_LBSPPM0_LPA8_LPB8_LPM0_LRVW16_LWPMn1_MIAV1_MIWT2_3_MO40_MGRIPM1_NTn1_NTA0_NTB0_NTC0_NTD0_NTM0_NEPBS0_NLCA1_NLCB1_ONLL1_PGR1_PLR1_PKA0_SGROB0_SIA1_SS1_SU32_SUM0_SUS256_SPO0_SRVW0_SSO0_SVW1_SK0_SKFTR0_SKXCCM0_SGRO0_TIN0_TLDS0_TLDSMn1_ULSGRO0_USL1_UIOFGRO0_UPLRP0_USFGROn1_VSn1_VWA1_VWB1_WSGRA0_WSGRB0_WS32_WG32_4_1_WGM8_WGMXCC1_WGMXCCGn1
    SolutionIndex: 77
    SolutionNameMin: Cijk_Ailk_Bljk_BBS_BH_Bias_HA_S_SAV_UserArgs_MT128x32x64_MI16x16x1_SN_LDSB0_AFC1_AG0_AFEM1_AFEM1_ASEM1_CLR0_CADS0_DTLA0_DTLB0_DTVA0_DTVB0_DTVSM0_DPLB0_EPS0_ELFLR0_EMLLn1_FDSI0_GRPM1_GRVWA8_GRVWB8_GSU1_GSUAMB_GSUC0_GSUWGMRR0_GLS0_ISA1151_IU1_K1_LDSTI0_LBSPPA4096_LBSPPB1024_LBSPPM0_LPA8_LPB8_LPM0_LRVW16_LWPMn1_MIAV1_MIWT2_2_MO40_MGRIPM1_NTn1_NTA0_NTB0_NTC0_NTD0_NTM0_NEPBS0_NLCA1_NLCB1_ONLL1_PGR2_PLR1_PKA0_SGROB0_SIA3_SS1_SU32_SUM0_SUS256_SPO0_SRVW0_SSO0_SVW1_SK0_SKFTR0_SKXCCM0_SGRO0_TIN0_TLDS0_TLDSMn1_ULSGRO0_USL1_UIOFGRO0_UPLRP0_USFGROn1_VSn1_VWA1_VWB1_WSGRA0_WSGRB0_WS32_WG64_2_1_WGM8_WGMXCC1_WGMXCCGn1
    SolutionIndex: 78
    SolutionNameMin: Cijk_Ailk_Bljk_BBS_BH_Bias_HA_S_SAV_UserArgs_MT128x64x64_MI16x16x1_SN_LDSB0_AFC1_AG0_AFEM1_AFEM1_ASEM1_CLR0_CADS0_DTLA0_DTLB0_DTVA0_DTVB0_DTVSM0_DPLB0_EPS0_ELFLR0_EMLLn1_FDSI0_GRPM1_GRVWA8_GRVWB8_GSU1_GSUAMB_GSUC0_GSUWGMRR0_GLS0_ISA1151_IU1_K1_LDSTI0_LBSPPA4096_LBSPPB2048_LBSPPM0_LPA8_LPB8_LPM0_LRVW16_LWPMn1_MIAV1_MIWT2_4_MO40_MGRIPM1_NTn1_NTA0_NTB0_NTC0_NTD0_NTM0_NEPBS0_NLCA1_NLCB1_ONLL1_PGR1_PLR0_PKA0_SGROB0_SIA1_SS1_SU32_SUM0_SUS256_SPO0_SRVW0_SSO0_SVW1_SK0_SKFTR0_SKXCCM0_SGRO0_TIN0_TLDS0_TLDSMn1_ULSGRO0_USL1_UIOFGRO0_UPLRP0_USFGROn1_VSn1_VWA1_VWB1_WSGRA0_WSGRB0_WS32_WG64_2_1_WGM8_WGMXCC1_WGMXCCGn1
    SolutionIndex: 79
    SolutionNameMin: Cijk_Ailk_Bljk_BBS_BH_Bias_HA_S_SAV_UserArgs_MT128x96x32_MI16x16x1_SN_LDSB0_AFC1_AG0_AFEM1_AFEM1_ASEM1_CLR0_CADS0_DTLA0_DTLB0_DTVA0_DTVB0_DTVSM0_DPLB0_EPS0_ELFLR0_EMLLn1_FDSI0_GRPM1_GRVWA8_GRVWB8_GSU1_GSUAMB_GSUC0_GSUWGMRR0_GLS0_ISA1151_IU1_K1_LDSTI0_LBSPPA4096_LBSPPB3072_LBSPPM0_LPA8_LPB8_LPM0_LRVW16_LWPMn1_MIAV1_MIWT4_3_MO40_MGRIPM1_NTn1_NTA0_NTB0_NTC0_NTD0_NTM0_NEPBS0_NLCA1_NLCB1_ONLL1_PGR1_PLR0_PKA0_SGROB0_SIA1_SS1_SU32_SUM0_SUS256_SPO0_SRVW0_SSO0_SVW1_SK0_SKFTR0_SKXCCM0_SGRO0_TIN0_TLDS0_TLDSMn1_ULSGRO0_USL1_UIOFGRO0_UPLRP0_USFGROn1_VSn1_VWA1_VWB1_WSGRA0_WSGRB0_WS32_WG32_4_1_WGM8_WGMXCC1_WGMXCCGn1
    SolutionIndex: 80
    SolutionNameMin: Cijk_Ailk_Bljk_BBS_BH_Bias_HA_S_SAV_UserArgs_MT32x16x32_MI16x16x1_SN_LDSB0_AFC1_AG0_AFEM1_AFEM1_ASEM1_CLR0_CADS0_DTLA0_DTLB0_DTVA0_DTVB0_DTVSM0_DPLB0_EPS0_ELFLR0_EMLLn1_FDSI0_GRPM1_GRVWA8_GRVWB8_GSU1_GSUAMB_GSUC0_GSUWGMRR0_GLS0_ISA1151_IU1_K1_LDSTI0_LBSPPA1024_LBSPPB512_LBSPPM0_LPA8_LPB8_LPM0_LRVW16_LWPMn1_MIAV1_MIWT1_1_MO40_MGRIPM1_NTn1_NTA0_NTB0_NTC0_NTD0_NTM0_NEPBS0_NLCA1_NLCB1_ONLL1_PGR2_PLR1_PKA0_SGROB0_SIA1_SS1_SU32_SUM0_SUS256_SPO0_SRVW0_SSO0_SVW1_SK0_SKFTR0_SKXCCM0_SGRO0_TIN0_TLDS0_TLDSMn1_ULSGRO0_USL1_UIOFGRO0_UPLRP0_USFGROn1_VSn1_VWA1_VWB1_WSGRA0_WSGRB0_WS32_WG32_2_1_WGM8_WGMXCC1_WGMXCCGn1
    SolutionIndex: 81
    SolutionNameMin: Cijk_Ailk_Bljk_BBS_BH_Bias_HA_S_SAV_UserArgs_MT64x32x64_MI16x16x1_SN_LDSB0_AFC1_AG0_AFEM1_AFEM1_ASEM1_CLR0_CADS0_DTLA0_DTLB0_DTVA0_DTVB0_DTVSM0_DPLB0_EPS0_ELFLR0_EMLLn1_FDSI0_GRPM1_GRVWA8_GRVWB8_GSU1_GSUAMB_GSUC0_GSUWGMRR0_GLS0_ISA1151_IU1_K1_LDSTI0_LBSPPA2048_LBSPPB1024_LBSPPM0_LPA8_LPB8_LPM0_LRVW16_LWPMn1_MIAV1_MIWT2_1_MO40_MGRIPM1_NTn1_NTA0_NTB0_NTC0_NTD0_NTM0_NEPBS0_NLCA1_NLCB1_ONLL1_PGR2_PLR1_PKA0_SGROB0_SIA1_SS1_SU32_SUM0_SUS256_SPO0_SRVW0_SSO0_SVW1_SK0_SKFTR0_SKXCCM0_SGRO0_TIN0_TLDS0_TLDSMn1_ULSGRO0_USL1_UIOFGRO0_UPLRP0_USFGROn1_VSn1_VWA1_VWB1_WSGRA0_WSGRB0_WS32_WG32_4_1_WGM8_WGMXCC1_WGMXCCGn1
    SolutionIndex: 82
    SolutionNameMin: Cijk_Ailk_Bljk_BBS_BH_Bias_HA_S_SAV_UserArgs_MT64x32x32_MI16x16x1_SN_LDSB0_AFC1_AG0_AFEM1_AFEM1_ASEM1_CLR0_CADS0_DTLA0_DTLB0_DTVA0_DTVB0_DTVSM0_DPLB0_EPS0_ELFLR0_EMLLn1_FDSI0_GRPM1_GRVWA8_GRVWB8_GSU1_GSUAMB_GSUC0_GSUWGMRR0_GLS0_ISA1151_IU1_K1_LDSTI0_LBSPPA2048_LBSPPB1024_LBSPPM0_LPA8_LPB8_LPM0_LRVW16_LWPMn1_MIAV1_MIWT2_1_MO40_MGRIPM1_NTn1_NTA0_NTB0_NTC0_NTD0_NTM0_NEPBS0_NLCA1_NLCB1_ONLL1_PGR2_PLR1_PKA0_SGROB0_SIA1_SS1_SU32_SUM0_SUS256_SPO0_SRVW0_SSO0_SVW1_SK0_SKFTR0_SKXCCM0_SGRO0_TIN0_TLDS0_TLDSMn1_ULSGRO0_USL1_UIOFGRO0_UPLRP0_USFGROn1_VSn1_VWA1_VWB1_WSGRA0_WSGRB0_WS32_WG32_4_1_WGM8_WGMXCC1_WGMXCCGn1
    SolutionIndex: 83
    SolutionNameMin: Cijk_Ailk_Bljk_BBS_BH_Bias_HA_S_SAV_UserArgs_MT128x32x32_MI16x16x1_SN_LDSB0_AFC1_AG0_AFEM1_AFEM1_ASEM1_CLR0_CADS0_DTLA0_DTLB0_DTVA0_DTVB0_DTVSM0_DPLB0_EPS0_ELFLR0_EMLLn1_FDSI0_GRPM1_GRVWA8_GRVWB8_GSU1_GSUAMB_GSUC0_GSUWGMRR0_GLS0_ISA1151_IU1_K1_LDSTI0_LBSPPA4096_LBSPPB1024_LBSPPM0_LPA8_LPB8_LPM0_LRVW16_LWPMn1_MIAV1_MIWT2_2_MO40_MGRIPM1_NTn1_NTA0_NTB0_NTC0_NTD0_NTM0_NEPBS0_NLCA1_NLCB1_ONLL1_PGR2_PLR1_PKA0_SGROB0_SIA1_SS1_SU32_SUM0_SUS256_SPO0_SRVW0_SSO0_SVW1_SK0_SKFTR0_SKXCCM0_SGRO0_TIN0_TLDS0_TLDSMn1_ULSGRO0_USL1_UIOFGRO0_UPLRP0_USFGROn1_VSn1_VWA1_VWB1_WSGRA0_WSGRB0_WS32_WG64_2_1_WGM8_WGMXCC1_WGMXCCGn1
    SolutionIndex: 84
    SolutionNameMin: Cijk_Ailk_Bljk_BBS_BH_Bias_HA_S_SAV_UserArgs_MT128x32x64_MI16x16x1_SN_LDSB0_AFC1_AG0_AFEM1_AFEM1_ASEM1_CLR0_CADS0_DTLA0_DTLB0_DTVA0_DTVB0_DTVSM0_DPLB0_EPS0_ELFLR0_EMLLn1_FDSI0_GRPM1_GRVWA8_GRVWB8_GSU1_GSUAMB_GSUC0_GSUWGMRR0_GLS0_ISA1151_IU1_K1_LDSTI0_LBSPPA4096_LBSPPB1024_LBSPPM0_LPA8_LPB8_LPM0_LRVW16_LWPMn1_MIAV1_MIWT2_2_MO40_MGRIPM1_NTn1_NTA0_NTB0_NTC0_NTD0_NTM0_NEPBS0_NLCA1_NLCB1_ONLL1_PGR2_PLR1_PKA0_SGROB0_SIA1_SS1_SU32_SUM0_SUS256_SPO0_SRVW0_SSO0_SVW1_SK0_SKFTR0_SKXCCM0_SGRO0_TIN0_TLDS0_TLDSMn1_ULSGRO0_USL1_UIOFGRO0_UPLRP0_USFGROn1_VSn1_VWA1_VWB1_WSGRA0_WSGRB0_WS32_WG64_2_1_WGM8_WGMXCC1_WGMXCCGn1
    SolutionIndex: 85
    SolutionNameMin: Cijk_Ailk_Bljk_BBS_BH_Bias_HA_S_SAV_UserArgs_MT64x32x64_MI16x16x1_SN_LDSB0_AFC1_AG0_AFEM1_AFEM1_ASEM1_CLR0_CADS0_DTLA0_DTLB0_DTVA0_DTVB0_DTVSM0_DPLB0_EPS0_ELFLR0_EMLLn1_FDSI0_GRPM1_GRVWA8_GRVWB8_GSU1_GSUAMB_GSUC0_GSUWGMRR0_GLS0_ISA1151_IU1_K1_LDSTI0_LBSPPA2048_LBSPPB1024_LBSPPM0_LPA8_LPB8_LPM0_LRVW16_LWPMn1_MIAV1_MIWT2_1_MO40_MGRIPM1_NTn1_NTA0_NTB0_NTC0_NTD0_NTM0_NEPBS0_NLCA1_NLCB1_ONLL1_PGR2_PLR1_PKA0_SGROB0_SIA3_SS1_SU32_SUM0_SUS256_SPO0_SRVW0_SSO0_SVW1_SK0_SKFTR0_SKXCCM0_SGRO0_TIN0_TLDS0_TLDSMn1_ULSGRO0_USL1_UIOFGRO0_UPLRP0_USFGROn1_VSn1_VWA1_VWB1_WSGRA0_WSGRB0_WS32_WG32_4_1_WGM8_WGMXCC1_WGMXCCGn1
    SolutionIndex: 87
    SolutionNameMin: Cijk_Ailk_Bljk_BBS_BH_Bias_HA_S_SAV_UserArgs_MT128x64x32_MI16x16x1_SN_LDSB0_AFC1_AG0_AFEM1_AFEM1_ASEM1_CLR0_CADS0_DTLA0_DTLB0_DTVA0_DTVB0_DTVSM0_DPLB0_EPS0_ELFLR0_EMLLn1_FDSI0_GRPM1_GRVWA8_GRVWB8_GSU1_GSUAMB_GSUC0_GSUWGMRR0_GLS0_ISA1151_IU1_K1_LDSTI0_LBSPPA4096_LBSPPB2048_LBSPPM0_LPA8_LPB8_LPM0_LRVW16_LWPMn1_MIAV1_MIWT4_2_MO40_MGRIPM1_NTn1_NTA0_NTB0_NTC0_NTD0_NTM0_NEPBS0_NLCA1_NLCB1_ONLL1_PGR2_PLR0_PKA0_SGROB0_SIA1_SS1_SU32_SUM0_SUS256_SPO0_SRVW0_SSO0_SVW1_SK0_SKFTR0_SKXCCM0_SGRO0_TIN0_TLDS0_TLDSMn1_ULSGRO0_USL1_UIOFGRO0_UPLRP0_USFGROn1_VSn1_VWA1_VWB1_WSGRA0_WSGRB0_WS32_WG32_4_1_WGM8_WGMXCC1_WGMXCCGn1
    SolutionIndex: 88
    SolutionNameMin: Cijk_Ailk_Bljk_BBS_BH_Bias_HA_S_SAV_UserArgs_MT128x64x64_MI16x16x1_SN_LDSB1_AFC1_AG0_AFEM1_AFEM1_ASEM1_CLR0_CADS0_DTLA0_DTLB0_DTVA0_DTVB0_DTVSM0_DPLB0_EPS0_ELFLR0_EMLLn1_FDSI0_GRPM1_GRVWA8_GRVWB8_GSU1_GSUAMB_GSUC0_GSUWGMRR0_GLS0_ISA1151_IU1_K1_LDSTI0_LBSPPA4096_LBSPPB2048_LBSPPM0_LPA8_LPB8_LPM0_LRVW16_LWPMn1_MIAV1_MIWT4_2_MO40_MGRIPM1_NTn1_NTA0_NTB0_NTC0_NTD0_NTM0_NEPBS0_NLCA1_NLCB1_ONLL1_PGR2_PLR0_PKA0_SGROB0_SIA3_SS1_SU32_SUM0_SUS256_SPO0_SRVW0_SSO0_SVW1_SK0_SKFTR0_SKXCCM0_SGRO0_TIN0_TLDS0_TLDSMn1_ULSGRO0_USL1_UIOFGRO0_UPLRP0_USFGROn1_VSn1_VWA1_VWB1_WSGRA0_WSGRB0_WS32_WG32_4_1_WGM8_WGMXCC1_WGMXCCGn1
    SolutionIndex: 89
    SolutionNameMin: Cijk_Ailk_Bljk_BBS_BH_Bias_HA_S_SAV_UserArgs_MT128x32x32_MI16x16x1_SN_LDSB0_AFC1_AG0_AFEM1_AFEM1_ASEM1_CLR0_CADS0_DTLA0_DTLB0_DTVA0_DTVB0_DTVSM0_DPLB0_EPS0_ELFLR0_EMLLn1_FDSI0_GRPM1_GRVWA8_GRVWB8_GSU1_GSUAMB_GSUC0_GSUWGMRR0_GLS0_ISA1151_IU1_K1_LDSTI0_LBSPPA4096_LBSPPB1024_LBSPPM0_LPA8_LPB8_LPM0_LRVW16_LWPMn1_MIAV1_MIWT2_2_MO40_MGRIPM1_NTn1_NTA0_NTB0_NTC0_NTD0_NTM0_NEPBS0_NLCA1_NLCB1_ONLL1_PGR2_PLR1_PKA0_SGROB0_SIA3_SS1_SU32_SUM0_SUS256_SPO0_SRVW0_SSO0_SVW1_SK0_SKFTR0_SKXCCM0_SGRO0_TIN0_TLDS0_TLDSMn1_ULSGRO0_USL1_UIOFGRO0_UPLRP0_USFGROn1_VSn1_VWA1_VWB1_WSGRA0_WSGRB0_WS32_WG64_2_1_WGM8_WGMXCC1_WGMXCCGn1
    SolutionIndex: 90
    SolutionNameMin: Cijk_Ailk_Bljk_BBS_BH_Bias_HA_S_SAV_UserArgs_MT128x64x64_MI16x16x1_SN_LDSB0_AFC1_AG0_AFEM1_AFEM1_ASEM1_CLR0_CADS0_DTLA0_DTLB0_DTVA0_DTVB0_DTVSM0_DPLB0_EPS0_ELFLR0_EMLLn1_FDSI0_GRPM1_GRVWA8_GRVWB8_GSU1_GSUAMB_GSUC0_GSUWGMRR0_GLS0_ISA1151_IU1_K1_LDSTI0_LBSPPA4096_LBSPPB2048_LBSPPM0_LPA8_LPB8_LPM0_LRVW16_LWPMn1_MIAV1_MIWT2_4_MO40_MGRIPM1_NTn1_NTA0_NTB0_NTC0_NTD0_NTM0_NEPBS0_NLCA1_NLCB1_ONLL1_PGR2_PLR0_PKA0_SGROB0_SIA1_SS1_SU32_SUM0_SUS256_SPO0_SRVW0_SSO0_SVW1_SK0_SKFTR0_SKXCCM0_SGRO0_TIN0_TLDS0_TLDSMn1_ULSGRO0_USL1_UIOFGRO0_UPLRP0_USFGROn1_VSn1_VWA1_VWB1_WSGRA0_WSGRB0_WS32_WG64_2_1_WGM8_WGMXCC1_WGMXCCGn1
    SolutionIndex: 91
    SolutionNameMin: Cijk_Ailk_Bljk_BBS_BH_Bias_HA_S_SAV_UserArgs_MT128x64x32_MI16x16x1_SN_LDSB1_AFC1_AG0_AFEM1_AFEM1_ASEM1_CLR0_CADS0_DTLA0_DTLB0_DTVA0_DTVB0_DTVSM0_DPLB0_EPS0_ELFLR0_EMLLn1_FDSI0_GRPM1_GRVWA8_GRVWB8_GSU1_GSUAMB_GSUC0_GSUWGMRR0_GLS0_ISA1151_IU1_K1_LDSTI0_LBSPPA4096_LBSPPB2048_LBSPPM0_LPA8_LPB8_LPM0_LRVW16_LWPMn1_MIAV1_MIWT4_2_MO40_MGRIPM1_NTn1_NTA0_NTB0_NTC0_NTD0_NTM0_NEPBS0_NLCA1_NLCB1_ONLL1_PGR2_PLR0_PKA0_SGROB0_SIA3_SS1_SU32_SUM0_SUS256_SPO0_SRVW0_SSO0_SVW1_SK0_SKFTR0_SKXCCM0_SGRO0_TIN0_TLDS0_TLDSMn1_ULSGRO0_USL1_UIOFGRO0_UPLRP0_USFGROn1_VSn1_VWA1_VWB1_WSGRA0_WSGRB0_WS32_WG32_4_1_WGM8_WGMXCC1_WGMXCCGn1
    SolutionIndex: 92
    SolutionNameMin: Cijk_Ailk_Bljk_BBS_BH_Bias_HA_S_SAV_UserArgs_MT128x64x64_MI16x16x1_SN_LDSB1_AFC1_AG0_AFEM1_AFEM1_ASEM1_CLR0_CADS0_DTLA0_DTLB0_DTVA0_DTVB0_DTVSM0_DPLB0_EPS0_ELFLR0_EMLLn1_FDSI0_GRPM1_GRVWA8_GRVWB8_GSU1_GSUAMB_GSUC0_GSUWGMRR0_GLS0_ISA1151_IU1_K1_LDSTI0_LBSPPA4096_LBSPPB2048_LBSPPM0_LPA8_LPB8_LPM0_LRVW16_LWPMn1_MIAV1_MIWT2_4_MO40_MGRIPM1_NTn1_NTA0_NTB0_NTC0_NTD0_NTM0_NEPBS0_NLCA1_NLCB1_ONLL1_PGR2_PLR0_PKA0_SGROB0_SIA3_SS1_SU32_SUM0_SUS256_SPO0_SRVW0_SSO0_SVW1_SK0_SKFTR0_SKXCCM0_SGRO0_TIN0_TLDS0_TLDSMn1_ULSGRO0_USL1_UIOFGRO0_UPLRP0_USFGROn1_VSn1_VWA1_VWB1_WSGRA0_WSGRB0_WS32_WG64_2_1_WGM8_WGMXCC1_WGMXCCGn1
    SolutionIndex: 93
    SolutionNameMin: Cijk_Ailk_Bljk_BBS_BH_Bias_HA_S_SAV_UserArgs_MT128x64x32_MI16x16x1_SN_LDSB0_AFC1_AG0_AFEM1_AFEM1_ASEM1_CLR0_CADS0_DTLA0_DTLB0_DTVA0_DTVB0_DTVSM0_DPLB0_EPS0_ELFLR0_EMLLn1_FDSI0_GRPM1_GRVWA8_GRVWB8_GSU1_GSUAMB_GSUC0_GSUWGMRR0_GLS0_ISA1151_IU1_K1_LDSTI0_LBSPPA4096_LBSPPB2048_LBSPPM0_LPA8_LPB8_LPM0_LRVW16_LWPMn1_MIAV1_MIWT2_4_MO40_MGRIPM1_NTn1_NTA0_NTB0_NTC0_NTD0_NTM0_NEPBS0_NLCA1_NLCB1_ONLL1_PGR1_PLR0_PKA0_SGROB0_SIA1_SS1_SU32_SUM0_SUS256_SPO0_SRVW0_SSO0_SVW1_SK0_SKFTR0_SKXCCM0_SGRO0_TIN0_TLDS0_TLDSMn1_ULSGRO0_USL1_UIOFGRO0_UPLRP0_USFGROn1_VSn1_VWA1_VWB1_WSGRA0_WSGRB0_WS32_WG64_2_1_WGM8_WGMXCC1_WGMXCCGn1
    SolutionIndex: 94
    SolutionNameMin: Cijk_Ailk_Bljk_BBS_BH_Bias_HA_S_SAV_UserArgs_MT128x64x32_MI16x16x1_SN_LDSB1_AFC1_AG0_AFEM1_AFEM1_ASEM1_CLR0_CADS0_DTLA0_DTLB0_DTVA0_DTVB0_DTVSM0_DPLB0_EPS0_ELFLR0_EMLLn1_FDSI0_GRPM1_GRVWA8_GRVWB8_GSU1_GSUAMB_GSUC0_GSUWGMRR0_GLS0_ISA1151_IU1_K1_LDSTI0_LBSPPA4096_LBSPPB2048_LBSPPM0_LPA8_LPB8_LPM0_LRVW16_LWPMn1_MIAV1_MIWT2_4_MO40_MGRIPM1_NTn1_NTA0_NTB0_NTC0_NTD0_NTM0_NEPBS0_NLCA1_NLCB1_ONLL1_PGR2_PLR0_PKA0_SGROB0_SIA3_SS1_SU32_SUM0_SUS256_SPO0_SRVW0_SSO0_SVW1_SK0_SKFTR0_SKXCCM0_SGRO0_TIN0_TLDS0_TLDSMn1_ULSGRO0_USL1_UIOFGRO0_UPLRP0_USFGROn1_VSn1_VWA1_VWB1_WSGRA0_WSGRB0_WS32_WG64_2_1_WGM8_WGMXCC1_WGMXCCGn1
    SolutionIndex: 95
    SolutionNameMin: Cijk_Ailk_Bljk_BBS_BH_Bias_HA_S_SAV_UserArgs_MT64x128x32_MI16x16x1_SN_LDSB1_AFC1_AG0_AFEM1_AFEM1_ASEM1_CLR0_CADS0_DTLA0_DTLB0_DTVA0_DTVB0_DTVSM0_DPLB0_EPS0_ELFLR0_EMLLn1_FDSI0_GRPM1_GRVWA8_GRVWB8_GSU1_GSUAMB_GSUC0_GSUWGMRR0_GLS0_ISA1151_IU1_K1_LDSTI0_LBSPPA2048_LBSPPB4096_LBSPPM0_LPA8_LPB8_LPM0_LRVW16_LWPMn1_MIAV1_MIWT4_2_MO40_MGRIPM1_NTn1_NTA0_NTB0_NTC0_NTD0_NTM0_NEPBS0_NLCA1_NLCB1_ONLL1_PGR2_PLR0_PKA0_SGROB0_SIA3_SS1_SU32_SUM0_SUS256_SPO0_SRVW0_SSO0_SVW1_SK0_SKFTR0_SKXCCM0_SGRO0_TIN0_TLDS0_TLDSMn1_ULSGRO0_USL1_UIOFGRO0_UPLRP0_USFGROn1_VSn1_VWA1_VWB1_WSGRA0_WSGRB0_WS32_WG16_8_1_WGM8_WGMXCC1_WGMXCCGn1
    SolutionIndex: 96
    SolutionNameMin: Cijk_Ailk_Bljk_BBS_BH_Bias_HA_S_SAV_UserArgs_MT128x64x32_MI16x16x1_SN_LDSB1_AFC1_AG0_AFEM1_AFEM1_ASEM1_CLR0_CADS0_DTLA0_DTLB0_DTVA0_DTVB0_DTVSM0_DPLB0_EPS0_ELFLR0_EMLLn1_FDSI0_GRPM1_GRVWA8_GRVWB8_GSU1_GSUAMB_GSUC0_GSUWGMRR0_GLS0_ISA1151_IU1_K1_LDSTI0_LBSPPA4096_LBSPPB2048_LBSPPM0_LPA8_LPB8_LPM0_LRVW16_LWPMn1_MIAV1_MIWT2_4_MO40_MGRIPM1_NTn1_NTA0_NTB0_NTC0_NTD0_NTM0_NEPBS0_NLCA1_NLCB1_ONLL1_PGR1_PLR0_PKA0_SGROB0_SIA3_SS1_SU32_SUM0_SUS256_SPO0_SRVW0_SSO0_SVW1_SK0_SKFTR0_SKXCCM0_SGRO0_TIN0_TLDS0_TLDSMn1_ULSGRO0_USL1_UIOFGRO0_UPLRP0_USFGROn1_VSn1_VWA1_VWB1_WSGRA0_WSGRB0_WS32_WG64_2_1_WGM8_WGMXCC1_WGMXCCGn1
    SolutionIndex: 97
    SolutionNameMin: Cijk_Ailk_Bljk_BBS_BH_Bias_HA_S_SAV_UserArgs_MT128x96x32_MI16x16x1_SN_LDSB1_AFC1_AG0_AFEM1_AFEM1_ASEM1_CLR0_CADS0_DTLA0_DTLB0_DTVA0_DTVB0_DTVSM0_DPLB0_EPS0_ELFLR0_EMLLn1_FDSI0_GRPM1_GRVWA8_GRVWB8_GSU1_GSUAMB_GSUC0_GSUWGMRR0_GLS0_ISA1151_IU1_K1_LDSTI0_LBSPPA4096_LBSPPB3072_LBSPPM0_LPA8_LPB8_LPM0_LRVW16_LWPMn1_MIAV1_MIWT4_3_MO40_MGRIPM1_NTn1_NTA0_NTB0_NTC0_NTD0_NTM0_NEPBS0_NLCA1_NLCB1_ONLL1_PGR1_PLR0_PKA0_SGROB0_SIA3_SS1_SU32_SUM0_SUS256_SPO0_SRVW0_SSO0_SVW1_SK0_SKFTR0_SKXCCM0_SGRO0_TIN0_TLDS0_TLDSMn1_ULSGRO0_USL1_UIOFGRO0_UPLRP0_USFGROn1_VSn1_VWA1_VWB1_WSGRA0_WSGRB0_WS32_WG32_4_1_WGM8_WGMXCC1_WGMXCCGn1
    SolutionIndex: 98
    SolutionNameMin: Cijk_Ailk_Bljk_BBS_BH_Bias_HA_S_SAV_UserArgs_MT128x96x32_MI16x16x1_SN_LDSB1_AFC1_AG0_AFEM1_AFEM1_ASEM1_CLR0_CADS0_DTLA0_DTLB0_DTVA0_DTVB0_DTVSM0_DPLB0_EPS0_ELFLR0_EMLLn1_FDSI0_GRPM1_GRVWA8_GRVWB8_GSU1_GSUAMB_GSUC0_GSUWGMRR0_GLS0_ISA1151_IU1_K1_LDSTI0_LBSPPA4096_LBSPPB3072_LBSPPM0_LPA8_LPB8_LPM0_LRVW16_LWPMn1_MIAV1_MIWT4_3_MO40_MGRIPM1_NTn1_NTA0_NTB0_NTC0_NTD0_NTM0_NEPBS0_NLCA1_NLCB1_ONLL1_PGR2_PLR0_PKA0_SGROB0_SIA3_SS1_SU32_SUM0_SUS256_SPO0_SRVW0_SSO0_SVW1_SK0_SKFTR0_SKXCCM0_SGRO0_TIN0_TLDS0_TLDSMn1_ULSGRO0_USL1_UIOFGRO0_UPLRP0_USFGROn1_VSn1_VWA1_VWB1_WSGRA0_WSGRB0_WS32_WG32_4_1_WGM8_WGMXCC1_WGMXCCGn1
    SolutionIndex: 99
    SolutionNameMin: Cijk_Ailk_Bljk_BBS_BH_Bias_HA_S_SAV_UserArgs_MT64x32x64_MI16x16x1_SN_LDSB0_AFC1_AG0_AFEM1_AFEM1_ASEM1_CLR0_CADS0_DTLA0_DTLB0_DTVA0_DTVB0_DTVSM0_DPLB0_EPS0_ELFLR0_EMLLn1_FDSI0_GRPM1_GRVWA8_GRVWB8_GSU1_GSUAMB_GSUC0_GSUWGMRR0_GLS0_ISA1151_IU1_K1_LDSTI0_LBSPPA2048_LBSPPB1024_LBSPPM0_LPA8_LPB8_LPM0_LRVW16_LWPMn1_MIAV1_MIWT2_1_MO40_MGRIPM1_NTn1_NTA0_NTB0_NTC0_NTD0_NTM0_NEPBS0_NLCA1_NLCB1_ONLL1_PGR1_PLR1_PKA0_SGROB0_SIA3_SS1_SU32_SUM0_SUS256_SPO0_SRVW0_SSO0_SVW1_SK0_SKFTR0_SKXCCM0_SGRO0_TIN0_TLDS0_TLDSMn1_ULSGRO0_USL1_UIOFGRO0_UPLRP0_USFGROn1_VSn1_VWA1_VWB1_WSGRA0_WSGRB0_WS32_WG32_4_1_WGM8_WGMXCC1_WGMXCCGn1
    SolutionIndex: 100
    SolutionNameMin: Cijk_Ailk_Bljk_BBS_BH_Bias_HA_S_SAV_UserArgs_MT128x64x32_MI16x16x1_SN_LDSB0_AFC1_AG0_AFEM1_AFEM1_ASEM1_CLR0_CADS0_DTLA0_DTLB0_DTVA0_DTVB0_DTVSM0_DPLB0_EPS0_ELFLR0_EMLLn1_FDSI0_GRPM1_GRVWA8_GRVWB8_GSU1_GSUAMB_GSUC0_GSUWGMRR0_GLS0_ISA1151_IU1_K1_LDSTI0_LBSPPA4096_LBSPPB2048_LBSPPM0_LPA8_LPB8_LPM0_LRVW16_LWPMn1_MIAV1_MIWT4_2_MO40_MGRIPM1_NTn1_NTA0_NTB0_NTC0_NTD0_NTM0_NEPBS0_NLCA1_NLCB1_ONLL1_PGR1_PLR0_PKA0_SGROB0_SIA1_SS1_SU32_SUM0_SUS256_SPO0_SRVW0_SSO0_SVW1_SK0_SKFTR0_SKXCCM0_SGRO0_TIN0_TLDS0_TLDSMn1_ULSGRO0_USL1_UIOFGRO0_UPLRP0_USFGROn1_VSn1_VWA1_VWB1_WSGRA0_WSGRB0_WS32_WG32_4_1_WGM8_WGMXCC1_WGMXCCGn1
    SolutionIndex: 102
    SolutionNameMin: Cijk_Ailk_Bljk_BBS_BH_Bias_HA_S_SAV_UserArgs_MT64x64x64_MI16x16x1_SN_LDSB0_AFC1_AG0_AFEM1_AFEM1_ASEM1_CLR0_CADS0_DTLA0_DTLB0_DTVA0_DTVB0_DTVSM0_DPLB0_EPS0_ELFLR0_EMLLn1_FDSI0_GRPM1_GRVWA8_GRVWB8_GSU1_GSUAMB_GSUC0_GSUWGMRR0_GLS0_ISA1151_IU1_K1_LDSTI0_LBSPPA2048_LBSPPB2048_LBSPPM0_LPA8_LPB8_LPM0_LRVW16_LWPMn1_MIAV1_MIWT2_2_MO40_MGRIPM1_NTn1_NTA0_NTB0_NTC0_NTD0_NTM0_NEPBS0_NLCA1_NLCB1_ONLL1_PGR2_PLR1_PKA0_SGROB0_SIA1_SS1_SU32_SUM0_SUS256_SPO0_SRVW0_SSO0_SVW1_SK0_SKFTR0_SKXCCM0_SGRO0_TIN0_TLDS0_TLDSMn1_ULSGRO0_USL1_UIOFGRO0_UPLRP0_USFGROn1_VSn1_VWA1_VWB1_WSGRA0_WSGRB0_WS32_WG32_4_1_WGM8_WGMXCC1_WGMXCCGn1
    SolutionIndex: 103
    SolutionNameMin: Cijk_Ailk_Bljk_BBS_BH_Bias_HA_S_SAV_UserArgs_MT128x16x32_MI16x16x1_SN_LDSB0_AFC1_AG0_AFEM1_AFEM1_ASEM1_CLR0_CADS0_DTLA0_DTLB0_DTVA0_DTVB0_DTVSM0_DPLB0_EPS0_ELFLR0_EMLLn1_FDSI0_GRPM1_GRVWA8_GRVWB4_GSU1_GSUAMB_GSUC0_GSUWGMRR0_GLS0_ISA1151_IU1_K1_LDSTI0_LBSPPA4096_LBSPPB512_LBSPPM0_LPA8_LPB8_LPM0_LRVW16_LWPMn1_MIAV1_MIWT2_1_MO40_MGRIPM1_NTn1_NTA0_NTB0_NTC0_NTD0_NTM0_NEPBS0_NLCA1_NLCB1_ONLL1_PGR2_PLR1_PKA0_SGROB0_SIA1_SS1_SU32_SUM0_SUS256_SPO0_SRVW0_SSO0_SVW1_SK0_SKFTR0_SKXCCM0_SGRO0_TIN0_TLDS0_TLDSMn1_ULSGRO0_USL1_UIOFGRO0_UPLRP0_USFGROn1_VSn1_VWA1_VWB1_WSGRA0_WSGRB0_WS32_WG64_2_1_WGM8_WGMXCC1_WGMXCCGn1
    SolutionIndex: 104
    SolutionNameMin: Cijk_Ailk_Bljk_BBS_BH_Bias_HA_S_SAV_UserArgs_MT128x64x32_MI16x16x1_SN_LDSB0_AFC1_AG0_AFEM1_AFEM1_ASEM1_CLR0_CADS0_DTLA0_DTLB0_DTVA0_DTVB0_DTVSM0_DPLB0_EPS0_ELFLR0_EMLLn1_FDSI0_GRPM1_GRVWA8_GRVWB8_GSU1_GSUAMB_GSUC0_GSUWGMRR0_GLS0_ISA1151_IU1_K1_LDSTI0_LBSPPA4096_LBSPPB2048_LBSPPM0_LPA8_LPB8_LPM0_LRVW16_LWPMn1_MIAV1_MIWT2_4_MO40_MGRIPM1_NTn1_NTA0_NTB0_NTC0_NTD0_NTM0_NEPBS0_NLCA1_NLCB1_ONLL1_PGR2_PLR0_PKA0_SGROB0_SIA1_SS1_SU32_SUM0_SUS256_SPO0_SRVW0_SSO0_SVW1_SK0_SKFTR0_SKXCCM0_SGRO0_TIN0_TLDS0_TLDSMn1_ULSGRO0_USL1_UIOFGRO0_UPLRP0_USFGROn1_VSn1_VWA1_VWB1_WSGRA0_WSGRB0_WS32_WG64_2_1_WGM8_WGMXCC1_WGMXCCGn1
    SolutionIndex: 105
    SolutionNameMin: Cijk_Ailk_Bljk_BBS_BH_Bias_HA_S_SAV_UserArgs_MT128x64x64_MI16x16x1_SN_LDSB0_AFC1_AG0_AFEM1_AFEM1_ASEM1_CLR0_CADS0_DTLA0_DTLB0_DTVA0_DTVB0_DTVSM0_DPLB0_EPS0_ELFLR0_EMLLn1_FDSI0_GRPM1_GRVWA8_GRVWB8_GSU1_GSUAMB_GSUC0_GSUWGMRR0_GLS0_ISA1151_IU1_K1_LDSTI0_LBSPPA4096_LBSPPB2048_LBSPPM0_LPA8_LPB8_LPM0_LRVW16_LWPMn1_MIAV1_MIWT4_2_MO40_MGRIPM1_NTn1_NTA0_NTB0_NTC0_NTD0_NTM0_NEPBS0_NLCA1_NLCB1_ONLL1_PGR2_PLR0_PKA0_SGROB0_SIA1_SS1_SU32_SUM0_SUS256_SPO0_SRVW0_SSO0_SVW1_SK0_SKFTR0_SKXCCM0_SGRO0_TIN0_TLDS0_TLDSMn1_ULSGRO0_USL1_UIOFGRO0_UPLRP0_USFGROn1_VSn1_VWA1_VWB1_WSGRA0_WSGRB0_WS32_WG32_4_1_WGM8_WGMXCC1_WGMXCCGn1
    SolutionIndex: 106
    SolutionNameMin: Cijk_Ailk_Bljk_BBS_BH_Bias_HA_S_SAV_UserArgs_MT128x64x64_MI16x16x1_SN_LDSB1_AFC1_AG0_AFEM1_AFEM1_ASEM1_CLR0_CADS0_DTLA0_DTLB0_DTVA0_DTVB0_DTVSM0_DPLB0_EPS0_ELFLR0_EMLLn1_FDSI0_GRPM1_GRVWA8_GRVWB8_GSU1_GSUAMB_GSUC0_GSUWGMRR0_GLS0_ISA1151_IU1_K1_LDSTI0_LBSPPA4096_LBSPPB2048_LBSPPM0_LPA8_LPB8_LPM0_LRVW16_LWPMn1_MIAV1_MIWT2_4_MO40_MGRIPM1_NTn1_NTA0_NTB0_NTC0_NTD0_NTM0_NEPBS0_NLCA1_NLCB1_ONLL1_PGR1_PLR0_PKA0_SGROB0_SIA3_SS1_SU32_SUM0_SUS256_SPO0_SRVW0_SSO0_SVW1_SK0_SKFTR0_SKXCCM0_SGRO0_TIN0_TLDS0_TLDSMn1_ULSGRO0_USL1_UIOFGRO0_UPLRP0_USFGROn1_VSn1_VWA1_VWB1_WSGRA0_WSGRB0_WS32_WG64_2_1_WGM8_WGMXCC1_WGMXCCGn1
    SolutionIndex: 107
    SolutionNameMin: Cijk_Ailk_Bljk_BBS_BH_Bias_HA_S_SAV_UserArgs_MT128x64x32_MI16x16x1_SN_LDSB0_AFC1_AG0_AFEM1_AFEM1_ASEM1_CLR0_CADS0_DTLA0_DTLB0_DTVA0_DTVB0_DTVSM0_DPLB0_EPS0_ELFLR0_EMLLn1_FDSI0_GRPM1_GRVWA8_GRVWB8_GSU1_GSUAMB_GSUC0_GSUWGMRR0_GLS0_ISA1151_IU1_K1_LDSTI0_LBSPPA4096_LBSPPB2048_LBSPPM0_LPA8_LPB8_LPM0_LRVW16_LWPMn1_MIAV1_MIWT2_4_MO40_MGRIPM1_NTn1_NTA0_NTB0_NTC0_NTD0_NTM0_NEPBS0_NLCA1_NLCB1_ONLL1_PGR1_PLR0_PKA0_SGROB0_SIA3_SS1_SU32_SUM0_SUS256_SPO0_SRVW0_SSO0_SVW1_SK0_SKFTR0_SKXCCM0_SGRO0_TIN0_TLDS0_TLDSMn1_ULSGRO0_USL1_UIOFGRO0_UPLRP0_USFGROn1_VSn1_VWA1_VWB1_WSGRA0_WSGRB0_WS32_WG64_2_1_WGM8_WGMXCC1_WGMXCCGn1
    SolutionIndex: 108
    SolutionNameMin: Cijk_Ailk_Bljk_BBS_BH_Bias_HA_S_SAV_UserArgs_MT128x96x32_MI16x16x1_SN_LDSB0_AFC1_AG0_AFEM1_AFEM1_ASEM1_CLR0_CADS0_DTLA0_DTLB0_DTVA0_DTVB0_DTVSM0_DPLB0_EPS0_ELFLR0_EMLLn1_FDSI0_GRPM1_GRVWA8_GRVWB8_GSU1_GSUAMB_GSUC0_GSUWGMRR0_GLS0_ISA1151_IU1_K1_LDSTI0_LBSPPA4096_LBSPPB3072_LBSPPM0_LPA8_LPB8_LPM0_LRVW16_LWPMn1_MIAV1_MIWT4_3_MO40_MGRIPM1_NTn1_NTA0_NTB0_NTC0_NTD0_NTM0_NEPBS0_NLCA1_NLCB1_ONLL1_PGR2_PLR0_PKA0_SGROB0_SIA1_SS1_SU32_SUM0_SUS256_SPO0_SRVW0_SSO0_SVW1_SK0_SKFTR0_SKXCCM0_SGRO0_TIN0_TLDS0_TLDSMn1_ULSGRO0_USL1_UIOFGRO0_UPLRP0_USFGROn1_VSn1_VWA1_VWB1_WSGRA0_WSGRB0_WS32_WG32_4_1_WGM8_WGMXCC1_WGMXCCGn1
    SolutionIndex: 109
    SolutionNameMin: Cijk_Ailk_Bljk_BBS_BH_Bias_HA_S_SAV_UserArgs_MT64x128x32_MI16x16x1_SN_LDSB1_AFC1_AG0_AFEM1_AFEM1_ASEM1_CLR0_CADS0_DTLA0_DTLB0_DTVA0_DTVB0_DTVSM0_DPLB0_EPS0_ELFLR0_EMLLn1_FDSI0_GRPM1_GRVWA8_GRVWB8_GSU1_GSUAMB_GSUC0_GSUWGMRR0_GLS0_ISA1151_IU1_K1_LDSTI0_LBSPPA2048_LBSPPB4096_LBSPPM0_LPA8_LPB8_LPM0_LRVW16_LWPMn1_MIAV1_MIWT2_4_MO40_MGRIPM1_NTn1_NTA0_NTB0_NTC0_NTD0_NTM0_NEPBS0_NLCA1_NLCB1_ONLL1_PGR2_PLR0_PKA0_SGROB0_SIA3_SS1_SU32_SUM0_SUS256_SPO0_SRVW0_SSO0_SVW1_SK0_SKFTR0_SKXCCM0_SGRO0_TIN0_TLDS0_TLDSMn1_ULSGRO0_USL1_UIOFGRO0_UPLRP0_USFGROn1_VSn1_VWA1_VWB1_WSGRA0_WSGRB0_WS32_WG32_4_1_WGM8_WGMXCC1_WGMXCCGn1
    SolutionIndex: 112
    SolutionNameMin: Cijk_Ailk_Bljk_BBS_BH_Bias_HA_S_SAV_UserArgs_MT64x32x128_MI16x16x1_SN_LDSB0_AFC1_AG0_AFEM1_AFEM1_ASEM1_CLR0_CADS0_DTLA0_DTLB0_DTVA0_DTVB0_DTVSM0_DPLB0_EPS0_ELFLR0_EMLLn1_FDSI0_GRPM1_GRVWA8_GRVWB8_GSU1_GSUAMB_GSUC0_GSUWGMRR0_GLS0_ISA1151_IU1_K1_LDSTI0_LBSPPA2048_LBSPPB1024_LBSPPM0_LPA8_LPB8_LPM0_LRVW16_LWPMn1_MIAV1_MIWT2_1_MO40_MGRIPM1_NTn1_NTA0_NTB0_NTC0_NTD0_NTM0_NEPBS0_NLCA1_NLCB1_ONLL1_PGR2_PLR1_PKA0_SGROB0_SIA1_SS1_SU32_SUM0_SUS256_SPO0_SRVW0_SSO0_SVW1_SK0_SKFTR0_SKXCCM0_SGRO0_TIN0_TLDS0_TLDSMn1_ULSGRO0_USL1_UIOFGRO0_UPLRP0_USFGROn1_VSn1_VWA1_VWB1_WSGRA0_WSGRB0_WS32_WG32_4_1_WGM8_WGMXCC1_WGMXCCGn1
    SolutionIndex: 113
    SolutionNameMin: Cijk_Ailk_Bljk_BBS_BH_Bias_HA_S_SAV_UserArgs_MT64x16x64_MI16x16x1_SN_LDSB0_AFC1_AG0_AFEM1_AFEM1_ASEM1_CLR0_CADS0_DTLA0_DTLB0_DTVA0_DTVB0_DTVSM0_DPLB0_EPS0_ELFLR0_EMLLn1_FDSI0_GRPM1_GRVWA8_GRVWB8_GSU1_GSUAMB_GSUC0_GSUWGMRR0_GLS0_ISA1151_IU1_K1_LDSTI0_LBSPPA2048_LBSPPB512_LBSPPM0_LPA8_LPB8_LPM0_LRVW16_LWPMn1_MIAV1_MIWT1_1_MO40_MGRIPM1_NTn1_NTA0_NTB0_NTC0_NTD0_NTM0_NEPBS0_NLCA1_NLCB1_ONLL1_PGR2_PLR1_PKA0_SGROB0_SIA1_SS1_SU32_SUM0_SUS256_SPO0_SRVW0_SSO0_SVW1_SK0_SKFTR0_SKXCCM0_SGRO0_TIN0_TLDS0_TLDSMn1_ULSGRO0_USL1_UIOFGRO0_UPLRP0_USFGROn1_VSn1_VWA1_VWB1_WSGRA0_WSGRB0_WS32_WG64_2_1_WGM8_WGMXCC1_WGMXCCGn1
    SolutionIndex: 116
    SolutionNameMin: Cijk_Ailk_Bljk_BBS_BH_Bias_HA_S_SAV_UserArgs_MT64x48x128_MI16x16x1_SN_LDSB0_AFC1_AG0_AFEM1_AFEM1_ASEM1_CLR0_CADS0_DTLA0_DTLB0_DTVA0_DTVB0_DTVSM0_DPLB0_EPS0_ELFLR0_EMLLn1_FDSI0_GRPM1_GRVWA8_GRVWB8_GSU1_GSUAMB_GSUC0_GSUWGMRR0_GLS0_ISA1151_IU1_K1_LDSTI0_LBSPPA2048_LBSPPB1536_LBSPPM0_LPA8_LPB8_LPM0_LRVW16_LWPMn1_MIAV1_MIWT1_3_MO40_MGRIPM1_NTn1_NTA0_NTB0_NTC0_NTD0_NTM0_NEPBS0_NLCA1_NLCB1_ONLL1_PGR2_PLR1_PKA0_SGROB0_SIA1_SS1_SU32_SUM0_SUS256_SPO0_SRVW0_SSO0_SVW1_SK0_SKFTR0_SKXCCM0_SGRO0_TIN0_TLDS0_TLDSMn1_ULSGRO0_USL1_UIOFGRO0_UPLRP0_USFGROn1_VSn1_VWA1_VWB1_WSGRA0_WSGRB0_WS32_WG64_2_1_WGM8_WGMXCC1_WGMXCCGn1
    SolutionIndex: 117
    SolutionNameMin: Cijk_Ailk_Bljk_BBS_BH_Bias_HA_S_SAV_UserArgs_MT64x48x64_MI16x16x1_SN_LDSB0_AFC1_AG0_AFEM1_AFEM1_ASEM1_CLR0_CADS0_DTLA0_DTLB0_DTVA0_DTVB0_DTVSM0_DPLB0_EPS0_ELFLR0_EMLLn1_FDSI0_GRPM1_GRVWA8_GRVWB8_GSU1_GSUAMB_GSUC0_GSUWGMRR0_GLS0_ISA1151_IU1_K1_LDSTI0_LBSPPA2048_LBSPPB1536_LBSPPM0_LPA8_LPB8_LPM0_LRVW16_LWPMn1_MIAV1_MIWT1_3_MO40_MGRIPM1_NTn1_NTA0_NTB0_NTC0_NTD0_NTM0_NEPBS0_NLCA1_NLCB1_ONLL1_PGR1_PLR1_PKA0_SGROB0_SIA3_SS1_SU32_SUM0_SUS256_SPO0_SRVW0_SSO0_SVW1_SK0_SKFTR0_SKXCCM0_SGRO0_TIN0_TLDS0_TLDSMn1_ULSGRO0_USL1_UIOFGRO0_UPLRP0_USFGROn1_VSn1_VWA1_VWB1_WSGRA0_WSGRB0_WS32_WG64_2_1_WGM8_WGMXCC1_WGMXCCGn1
    SolutionIndex: 118
    SolutionNameMin: Cijk_Ailk_Bljk_BBS_BH_Bias_HA_S_SAV_UserArgs_MT64x64x128_MI16x16x1_SN_LDSB1_AFC1_AG0_AFEM1_AFEM1_ASEM1_CLR0_CADS0_DTLA0_DTLB0_DTVA0_DTVB0_DTVSM0_DPLB0_EPS0_ELFLR0_EMLLn1_FDSI0_GRPM1_GRVWA8_GRVWB8_GSU1_GSUAMB_GSUC0_GSUWGMRR0_GLS0_ISA1151_IU1_K1_LDSTI0_LBSPPA2048_LBSPPB2048_LBSPPM0_LPA8_LPB8_LPM0_LRVW16_LWPMn1_MIAV1_MIWT2_2_MO40_MGRIPM1_NTn1_NTA0_NTB0_NTC0_NTD0_NTM0_NEPBS0_NLCA1_NLCB1_ONLL1_PGR2_PLR1_PKA0_SGROB0_SIA3_SS1_SU32_SUM0_SUS256_SPO0_SRVW0_SSO0_SVW1_SK0_SKFTR0_SKXCCM0_SGRO0_TIN0_TLDS0_TLDSMn1_ULSGRO0_USL1_UIOFGRO0_UPLRP0_USFGROn1_VSn1_VWA1_VWB1_WSGRA0_WSGRB0_WS32_WG32_4_1_WGM8_WGMXCC1_WGMXCCGn1
    SolutionIndex: 120
    SolutionNameMin: Cijk_Ailk_Bljk_BBS_BH_Bias_HA_S_SAV_UserArgs_MT64x96x32_MI16x16x1_SN_LDSB0_AFC1_AG0_AFEM1_AFEM1_ASEM1_CLR0_CADS0_DTLA0_DTLB0_DTVA0_DTVB0_DTVSM0_DPLB0_EPS0_ELFLR0_EMLLn1_FDSI0_GRPM1_GRVWA8_GRVWB8_GSU1_GSUAMB_GSUC0_GSUWGMRR0_GLS0_ISA1151_IU1_K1_LDSTI0_LBSPPA2048_LBSPPB3072_LBSPPM0_LPA8_LPB8_LPM0_LRVW16_LWPMn1_MIAV1_MIWT2_3_MO40_MGRIPM1_NTn1_NTA0_NTB0_NTC0_NTD0_NTM0_NEPBS0_NLCA1_NLCB1_ONLL1_PGR2_PLR1_PKA0_SGROB0_SIA1_SS1_SU32_SUM0_SUS256_SPO0_SRVW0_SSO0_SVW1_SK0_SKFTR0_SKXCCM0_SGRO0_TIN0_TLDS0_TLDSMn1_ULSGRO0_USL1_UIOFGRO0_UPLRP0_USFGROn1_VSn1_VWA1_VWB1_WSGRA0_WSGRB0_WS32_WG32_4_1_WGM8_WGMXCC1_WGMXCCGn1
    SolutionIndex: 121
    SolutionNameMin: Cijk_Ailk_Bljk_BBS_BH_Bias_HA_S_SAV_UserArgs_MT64x96x32_MI16x16x1_SN_LDSB0_AFC1_AG0_AFEM1_AFEM1_ASEM1_CLR0_CADS0_DTLA0_DTLB0_DTVA0_DTVB0_DTVSM0_DPLB0_EPS0_ELFLR0_EMLLn1_FDSI0_GRPM1_GRVWA8_GRVWB8_GSU1_GSUAMB_GSUC0_GSUWGMRR0_GLS0_ISA1151_IU1_K1_LDSTI0_LBSPPA2048_LBSPPB3072_LBSPPM0_LPA8_LPB8_LPM0_LRVW16_LWPMn1_MIAV1_MIWT2_3_MO40_MGRIPM1_NTn1_NTA0_NTB0_NTC0_NTD0_NTM0_NEPBS0_NLCA1_NLCB1_ONLL1_PGR2_PLR0_PKA0_SGROB0_SIA1_SS1_SU32_SUM0_SUS256_SPO0_SRVW0_SSO0_SVW1_SK0_SKFTR0_SKXCCM0_SGRO0_TIN0_TLDS0_TLDSMn1_ULSGRO0_USL1_UIOFGRO0_UPLRP0_USFGROn1_VSn1_VWA1_VWB1_WSGRA0_WSGRB0_WS32_WG32_4_1_WGM8_WGMXCC1_WGMXCCGn1
    SolutionIndex: 122
    SolutionNameMin: Cijk_Ailk_Bljk_BBS_BH_Bias_HA_S_SAV_UserArgs_MT64x96x32_MI16x16x1_SN_LDSB0_AFC1_AG0_AFEM1_AFEM1_ASEM1_CLR0_CADS0_DTLA0_DTLB0_DTVA0_DTVB0_DTVSM0_DPLB0_EPS0_ELFLR0_EMLLn1_FDSI0_GRPM1_GRVWA8_GRVWB8_GSU1_GSUAMB_GSUC0_GSUWGMRR0_GLS0_ISA1151_IU1_K1_LDSTI0_LBSPPA2048_LBSPPB3072_LBSPPM0_LPA8_LPB8_LPM0_LRVW16_LWPMn1_MIAV1_MIWT2_3_MO40_MGRIPM1_NTn1_NTA0_NTB0_NTC0_NTD0_NTM0_NEPBS0_NLCA1_NLCB1_ONLL1_PGR2_PLR1_PKA0_SGROB0_SIA3_SS1_SU32_SUM0_SUS256_SPO0_SRVW0_SSO0_SVW1_SK0_SKFTR0_SKXCCM0_SGRO0_TIN0_TLDS0_TLDSMn1_ULSGRO0_USL1_UIOFGRO0_UPLRP0_USFGROn1_VSn1_VWA1_VWB1_WSGRA0_WSGRB0_WS32_WG32_4_1_WGM8_WGMXCC1_WGMXCCGn1
    SolutionIndex: 124
    SolutionNameMin: Cijk_Ailk_Bljk_BBS_BH_Bias_HA_S_SAV_UserArgs_MT64x48x128_MI16x16x1_SN_LDSB0_AFC1_AG0_AFEM1_AFEM1_ASEM1_CLR0_CADS0_DTLA0_DTLB0_DTVA0_DTVB0_DTVSM0_DPLB0_EPS0_ELFLR0_EMLLn1_FDSI0_GRPM1_GRVWA8_GRVWB8_GSU1_GSUAMB_GSUC0_GSUWGMRR0_GLS0_ISA1151_IU1_K1_LDSTI0_LBSPPA2048_LBSPPB1536_LBSPPM0_LPA8_LPB8_LPM0_LRVW16_LWPMn1_MIAV1_MIWT1_3_MO40_MGRIPM1_NTn1_NTA0_NTB0_NTC0_NTD0_NTM0_NEPBS0_NLCA1_NLCB1_ONLL1_PGR2_PLR0_PKA0_SGROB0_SIA1_SS1_SU32_SUM0_SUS256_SPO0_SRVW0_SSO0_SVW1_SK0_SKFTR0_SKXCCM0_SGRO0_TIN0_TLDS0_TLDSMn1_ULSGRO0_USL1_UIOFGRO0_UPLRP0_USFGROn1_VSn1_VWA1_VWB1_WSGRA0_WSGRB0_WS32_WG64_2_1_WGM8_WGMXCC1_WGMXCCGn1
    SolutionIndex: 127
    SolutionNameMin: Cijk_Ailk_Bljk_BBS_BH_Bias_HA_S_SAV_UserArgs_MT128x32x32_MI16x16x1_SN_LDSB1_AFC1_AG0_AFEM1_AFEM1_ASEM1_CLR0_CADS0_DTLA0_DTLB0_DTVA0_DTVB0_DTVSM0_DPLB0_EPS0_ELFLR0_EMLLn1_FDSI0_GRPM1_GRVWA8_GRVWB8_GSU1_GSUAMB_GSUC0_GSUWGMRR0_GLS0_ISA1151_IU1_K1_LDSTI0_LBSPPA4096_LBSPPB1024_LBSPPM0_LPA8_LPB8_LPM0_LRVW16_LWPMn1_MIAV1_MIWT2_2_MO40_MGRIPM1_NTn1_NTA0_NTB0_NTC0_NTD0_NTM0_NEPBS0_NLCA1_NLCB1_ONLL1_PGR2_PLR0_PKA0_SGROB0_SIA3_SS1_SU32_SUM0_SUS256_SPO0_SRVW0_SSO0_SVW1_SK0_SKFTR0_SKXCCM0_SGRO0_TIN0_TLDS0_TLDSMn1_ULSGRO0_USL1_UIOFGRO0_UPLRP0_USFGROn1_VSn1_VWA1_VWB1_WSGRA0_WSGRB0_WS32_WG64_2_1_WGM8_WGMXCC1_WGMXCCGn1
    SolutionIndex: 128
    SolutionNameMin: Cijk_Ailk_Bljk_BBS_BH_Bias_HA_S_SAV_UserArgs_MT128x32x64_MI16x16x1_SN_LDSB1_AFC1_AG0_AFEM1_AFEM1_ASEM1_CLR0_CADS0_DTLA0_DTLB0_DTVA0_DTVB0_DTVSM0_DPLB0_EPS0_ELFLR0_EMLLn1_FDSI0_GRPM1_GRVWA8_GRVWB8_GSU1_GSUAMB_GSUC0_GSUWGMRR0_GLS0_ISA1151_IU1_K1_LDSTI0_LBSPPA4096_LBSPPB1024_LBSPPM0_LPA8_LPB8_LPM0_LRVW16_LWPMn1_MIAV1_MIWT2_2_MO40_MGRIPM1_NTn1_NTA0_NTB0_NTC0_NTD0_NTM0_NEPBS0_NLCA1_NLCB1_ONLL1_PGR2_PLR0_PKA0_SGROB0_SIA3_SS1_SU32_SUM0_SUS256_SPO0_SRVW0_SSO0_SVW1_SK0_SKFTR0_SKXCCM0_SGRO0_TIN0_TLDS0_TLDSMn1_ULSGRO0_USL1_UIOFGRO0_UPLRP0_USFGROn1_VSn1_VWA1_VWB1_WSGRA0_WSGRB0_WS32_WG64_2_1_WGM8_WGMXCC1_WGMXCCGn1
    SolutionIndex: 129
    SolutionNameMin: Cijk_Ailk_Bljk_BBS_BH_Bias_HA_S_SAV_UserArgs_MT16x16x128_MI16x16x1_SN_LDSB0_AFC1_AG0_AFEM1_AFEM1_ASEM1_CLR0_CADS0_DTLA0_DTLB0_DTVA0_DTVB0_DTVSM0_DPLB0_EPS0_ELFLR0_EMLLn1_FDSI0_GRPM1_GRVWA8_GRVWB8_GSU1_GSUAMB_GSUC0_GSUWGMRR0_GLS0_ISA1151_IU1_K1_LDSTI0_LBSPPA512_LBSPPB512_LBSPPM0_LPA8_LPB8_LPM0_LRVW16_LWPMn1_MIAV1_MIWT1_1_MO40_MGRIPM1_NTn1_NTA0_NTB0_NTC0_NTD0_NTM0_NEPBS0_NLCA1_NLCB1_ONLL1_PGR1_PLR1_PKA0_SGROB0_SIA3_SS1_SU32_SUM0_SUS256_SPO0_SRVW0_SSO0_SVW1_SK0_SKFTR0_SKXCCM0_SGRO0_TIN0_TLDS0_TLDSMn1_ULSGRO0_USL1_UIOFGRO0_UPLRP0_USFGROn1_VSn1_VWA1_VWB1_WSGRA0_WSGRB0_WS32_WG16_2_1_WGM8_WGMXCC1_WGMXCCGn1
    SolutionIndex: 130
    SolutionNameMin: Cijk_Ailk_Bljk_BBS_BH_Bias_HA_S_SAV_UserArgs_MT64x48x64_MI16x16x1_SN_LDSB0_AFC1_AG0_AFEM1_AFEM1_ASEM1_CLR0_CADS0_DTLA0_DTLB0_DTVA0_DTVB0_DTVSM0_DPLB0_EPS0_ELFLR0_EMLLn1_FDSI0_GRPM1_GRVWA8_GRVWB8_GSU1_GSUAMB_GSUC0_GSUWGMRR0_GLS0_ISA1151_IU1_K1_LDSTI0_LBSPPA2048_LBSPPB1536_LBSPPM0_LPA8_LPB8_LPM0_LRVW16_LWPMn1_MIAV1_MIWT1_3_MO40_MGRIPM1_NTn1_NTA0_NTB0_NTC0_NTD0_NTM0_NEPBS0_NLCA1_NLCB1_ONLL1_PGR2_PLR1_PKA0_SGROB0_SIA1_SS1_SU32_SUM0_SUS256_SPO0_SRVW0_SSO0_SVW1_SK0_SKFTR0_SKXCCM0_SGRO0_TIN0_TLDS0_TLDSMn1_ULSGRO0_USL1_UIOFGRO0_UPLRP0_USFGROn1_VSn1_VWA1_VWB1_WSGRA0_WSGRB0_WS32_WG64_2_1_WGM8_WGMXCC1_WGMXCCGn1
    SolutionIndex: 131
    SolutionNameMin: Cijk_Ailk_Bljk_BBS_BH_Bias_HA_S_SAV_UserArgs_MT128x32x32_MI16x16x1_SN_LDSB0_AFC1_AG0_AFEM1_AFEM1_ASEM1_CLR0_CADS0_DTLA0_DTLB0_DTVA0_DTVB0_DTVSM0_DPLB0_EPS0_ELFLR0_EMLLn1_FDSI0_GRPM1_GRVWA8_GRVWB8_GSU1_GSUAMB_GSUC0_GSUWGMRR0_GLS0_ISA1151_IU1_K1_LDSTI0_LBSPPA4096_LBSPPB1024_LBSPPM0_LPA8_LPB8_LPM0_LRVW16_LWPMn1_MIAV1_MIWT2_2_MO40_MGRIPM1_NTn1_NTA0_NTB0_NTC0_NTD0_NTM0_NEPBS0_NLCA1_NLCB1_ONLL1_PGR2_PLR0_PKA0_SGROB0_SIA1_SS1_SU32_SUM0_SUS256_SPO0_SRVW0_SSO0_SVW1_SK0_SKFTR0_SKXCCM0_SGRO0_TIN0_TLDS0_TLDSMn1_ULSGRO0_USL1_UIOFGRO0_UPLRP0_USFGROn1_VSn1_VWA1_VWB1_WSGRA0_WSGRB0_WS32_WG64_2_1_WGM8_WGMXCC1_WGMXCCGn1
    SolutionIndex: 133
    SolutionNameMin: Cijk_Ailk_Bljk_BBS_BH_Bias_HA_S_SAV_UserArgs_MT128x32x32_MI16x16x1_SN_LDSB1_AFC1_AG0_AFEM1_AFEM1_ASEM1_CLR0_CADS0_DTLA0_DTLB0_DTVA0_DTVB0_DTVSM0_DPLB0_EPS0_ELFLR0_EMLLn1_FDSI0_GRPM1_GRVWA8_GRVWB8_GSU1_GSUAMB_GSUC0_GSUWGMRR0_GLS0_ISA1151_IU1_K1_LDSTI0_LBSPPA4096_LBSPPB1024_LBSPPM0_LPA8_LPB8_LPM0_LRVW16_LWPMn1_MIAV1_MIWT2_2_MO40_MGRIPM1_NTn1_NTA0_NTB0_NTC0_NTD0_NTM0_NEPBS0_NLCA1_NLCB1_ONLL1_PGR1_PLR0_PKA0_SGROB0_SIA3_SS1_SU32_SUM0_SUS256_SPO0_SRVW0_SSO0_SVW1_SK0_SKFTR0_SKXCCM0_SGRO0_TIN0_TLDS0_TLDSMn1_ULSGRO0_USL1_UIOFGRO0_UPLRP0_USFGROn1_VSn1_VWA1_VWB1_WSGRA0_WSGRB0_WS32_WG64_2_1_WGM8_WGMXCC1_WGMXCCGn1
    SolutionIndex: 134
    SolutionNameMin: Cijk_Ailk_Bljk_BBS_BH_Bias_HA_S_SAV_UserArgs_MT64x64x32_MI16x16x1_SN_LDSB1_AFC1_AG0_AFEM1_AFEM1_ASEM1_CLR0_CADS0_DTLA0_DTLB0_DTVA0_DTVB0_DTVSM0_DPLB0_EPS0_ELFLR0_EMLLn1_FDSI0_GRPM1_GRVWA8_GRVWB8_GSU1_GSUAMB_GSUC0_GSUWGMRR0_GLS0_ISA1151_IU1_K1_LDSTI0_LBSPPA2048_LBSPPB2048_LBSPPM0_LPA8_LPB8_LPM0_LRVW16_LWPMn1_MIAV1_MIWT2_2_MO40_MGRIPM1_NTn1_NTA0_NTB0_NTC0_NTD0_NTM0_NEPBS0_NLCA1_NLCB1_ONLL1_PGR2_PLR0_PKA0_SGROB0_SIA3_SS1_SU32_SUM0_SUS256_SPO0_SRVW0_SSO0_SVW1_SK0_SKFTR0_SKXCCM0_SGRO0_TIN0_TLDS0_TLDSMn1_ULSGRO0_USL1_UIOFGRO0_UPLRP0_USFGROn1_VSn1_VWA1_VWB1_WSGRA0_WSGRB0_WS32_WG32_4_1_WGM8_WGMXCC1_WGMXCCGn1
    SolutionIndex: 135
    SolutionNameMin: Cijk_Ailk_Bljk_BBS_BH_Bias_HA_S_SAV_UserArgs_MT32x16x32_MI16x16x1_SN_LDSB0_AFC1_AG0_AFEM1_AFEM1_ASEM1_CLR0_CADS0_DTLA0_DTLB0_DTVA0_DTVB0_DTVSM0_DPLB0_EPS0_ELFLR0_EMLLn1_FDSI0_GRPM1_GRVWA8_GRVWB8_GSU1_GSUAMB_GSUC0_GSUWGMRR0_GLS0_ISA1151_IU1_K1_LDSTI0_LBSPPA1024_LBSPPB512_LBSPPM0_LPA8_LPB8_LPM0_LRVW16_LWPMn1_MIAV1_MIWT1_1_MO40_MGRIPM1_NTn1_NTA0_NTB0_NTC0_NTD0_NTM0_NEPBS0_NLCA1_NLCB1_ONLL1_PGR2_PLR1_PKA0_SGROB0_SIA3_SS1_SU32_SUM0_SUS256_SPO0_SRVW0_SSO0_SVW1_SK0_SKFTR0_SKXCCM0_SGRO0_TIN0_TLDS0_TLDSMn1_ULSGRO0_USL1_UIOFGRO0_UPLRP0_USFGROn1_VSn1_VWA1_VWB1_WSGRA0_WSGRB0_WS32_WG32_2_1_WGM8_WGMXCC1_WGMXCCGn1
    SolutionIndex: 136
    SolutionNameMin: Cijk_Ailk_Bljk_BBS_BH_Bias_HA_S_SAV_UserArgs_MT32x16x128_MI16x16x1_SN_LDSB0_AFC1_AG0_AFEM1_AFEM1_ASEM1_CLR0_CADS0_DTLA0_DTLB0_DTVA0_DTVB0_DTVSM0_DPLB0_EPS0_ELFLR0_EMLLn1_FDSI0_GRPM1_GRVWA8_GRVWB8_GSU1_GSUAMB_GSUC0_GSUWGMRR0_GLS0_ISA1151_IU1_K1_LDSTI0_LBSPPA1024_LBSPPB512_LBSPPM0_LPA8_LPB8_LPM0_LRVW16_LWPMn1_MIAV1_MIWT1_1_MO40_MGRIPM1_NTn1_NTA0_NTB0_NTC0_NTD0_NTM0_NEPBS0_NLCA1_NLCB1_ONLL1_PGR2_PLR1_PKA0_SGROB0_SIA1_SS1_SU32_SUM0_SUS256_SPO0_SRVW0_SSO0_SVW1_SK0_SKFTR0_SKXCCM0_SGRO0_TIN0_TLDS0_TLDSMn1_ULSGRO0_USL1_UIOFGRO0_UPLRP0_USFGROn1_VSn1_VWA1_VWB1_WSGRA0_WSGRB0_WS32_WG32_2_1_WGM8_WGMXCC1_WGMXCCGn1
    SolutionIndex: 137
    SolutionNameMin: Cijk_Ailk_Bljk_BBS_BH_Bias_HA_S_SAV_UserArgs_MT64x16x128_MI16x16x1_SN_LDSB0_AFC1_AG0_AFEM1_AFEM1_ASEM1_CLR0_CADS0_DTLA0_DTLB0_DTVA0_DTVB0_DTVSM0_DPLB0_EPS0_ELFLR0_EMLLn1_FDSI0_GRPM1_GRVWA8_GRVWB8_GSU1_GSUAMB_GSUC0_GSUWGMRR0_GLS0_ISA1151_IU1_K1_LDSTI0_LBSPPA2048_LBSPPB512_LBSPPM0_LPA8_LPB8_LPM0_LRVW16_LWPMn1_MIAV1_MIWT1_1_MO40_MGRIPM1_NTn1_NTA0_NTB0_NTC0_NTD0_NTM0_NEPBS0_NLCA1_NLCB1_ONLL1_PGR1_PLR1_PKA0_SGROB0_SIA1_SS1_SU32_SUM0_SUS256_SPO0_SRVW0_SSO0_SVW1_SK0_SKFTR0_SKXCCM0_SGRO0_TIN0_TLDS0_TLDSMn1_ULSGRO0_USL1_UIOFGRO0_UPLRP0_USFGROn1_VSn1_VWA1_VWB1_WSGRA0_WSGRB0_WS32_WG64_2_1_WGM8_WGMXCC1_WGMXCCGn1
    SolutionIndex: 138
    SolutionNameMin: Cijk_Ailk_Bljk_BBS_BH_Bias_HA_S_SAV_UserArgs_MT32x16x64_MI16x16x1_SN_LDSB0_AFC1_AG0_AFEM1_AFEM1_ASEM1_CLR0_CADS0_DTLA0_DTLB0_DTVA0_DTVB0_DTVSM0_DPLB0_EPS0_ELFLR0_EMLLn1_FDSI0_GRPM1_GRVWA8_GRVWB8_GSU1_GSUAMB_GSUC0_GSUWGMRR0_GLS0_ISA1151_IU1_K1_LDSTI0_LBSPPA1024_LBSPPB512_LBSPPM0_LPA8_LPB8_LPM0_LRVW16_LWPMn1_MIAV1_MIWT1_1_MO40_MGRIPM1_NTn1_NTA0_NTB0_NTC0_NTD0_NTM0_NEPBS0_NLCA1_NLCB1_ONLL1_PGR2_PLR1_PKA0_SGROB0_SIA1_SS1_SU32_SUM0_SUS256_SPO0_SRVW0_SSO0_SVW1_SK0_SKFTR0_SKXCCM0_SGRO0_TIN0_TLDS0_TLDSMn1_ULSGRO0_USL1_UIOFGRO0_UPLRP0_USFGROn1_VSn1_VWA1_VWB1_WSGRA0_WSGRB0_WS32_WG32_2_1_WGM8_WGMXCC1_WGMXCCGn1
    SolutionIndex: 139
    SolutionNameMin: Cijk_Ailk_Bljk_BBS_BH_Bias_HA_S_SAV_UserArgs_MT128x64x32_MI16x16x1_SN_LDSB1_AFC1_AG0_AFEM1_AFEM1_ASEM1_CLR0_CADS0_DTLA0_DTLB0_DTVA0_DTVB0_DTVSM0_DPLB0_EPS0_ELFLR0_EMLLn1_FDSI0_GRPM1_GRVWA8_GRVWB8_GSU1_GSUAMB_GSUC0_GSUWGMRR0_GLS0_ISA1151_IU1_K1_LDSTI0_LBSPPA4096_LBSPPB2048_LBSPPM0_LPA8_LPB8_LPM0_LRVW16_LWPMn1_MIAV1_MIWT4_2_MO40_MGRIPM1_NTn1_NTA0_NTB0_NTC0_NTD0_NTM0_NEPBS0_NLCA1_NLCB1_ONLL1_PGR1_PLR0_PKA0_SGROB0_SIA3_SS1_SU32_SUM0_SUS256_SPO0_SRVW0_SSO0_SVW1_SK0_SKFTR0_SKXCCM0_SGRO0_TIN0_TLDS0_TLDSMn1_ULSGRO0_USL1_UIOFGRO0_UPLRP0_USFGROn1_VSn1_VWA1_VWB1_WSGRA0_WSGRB0_WS32_WG32_4_1_WGM8_WGMXCC1_WGMXCCGn1
    SolutionIndex: 140
    SolutionNameMin: Cijk_Ailk_Bljk_BBS_BH_Bias_HA_S_SAV_UserArgs_MT64x16x128_MI16x16x1_SN_LDSB0_AFC1_AG0_AFEM1_AFEM1_ASEM1_CLR0_CADS0_DTLA0_DTLB0_DTVA0_DTVB0_DTVSM0_DPLB0_EPS0_ELFLR0_EMLLn1_FDSI0_GRPM1_GRVWA8_GRVWB8_GSU1_GSUAMB_GSUC0_GSUWGMRR0_GLS0_ISA1151_IU1_K1_LDSTI0_LBSPPA2048_LBSPPB512_LBSPPM0_LPA8_LPB8_LPM0_LRVW16_LWPMn1_MIAV1_MIWT1_1_MO40_MGRIPM1_NTn1_NTA0_NTB0_NTC0_NTD0_NTM0_NEPBS0_NLCA1_NLCB1_ONLL1_PGR2_PLR1_PKA0_SGROB0_SIA3_SS1_SU32_SUM0_SUS256_SPO0_SRVW0_SSO0_SVW1_SK0_SKFTR0_SKXCCM0_SGRO0_TIN0_TLDS0_TLDSMn1_ULSGRO0_USL1_UIOFGRO0_UPLRP0_USFGROn1_VSn1_VWA1_VWB1_WSGRA0_WSGRB0_WS32_WG64_2_1_WGM8_WGMXCC1_WGMXCCGn1
    SolutionIndex: 141
    SolutionNameMin: Cijk_Ailk_Bljk_BBS_BH_Bias_HA_S_SAV_UserArgs_MT32x16x64_MI16x16x1_SN_LDSB0_AFC1_AG0_AFEM1_AFEM1_ASEM1_CLR0_CADS0_DTLA0_DTLB0_DTVA0_DTVB0_DTVSM0_DPLB0_EPS0_ELFLR0_EMLLn1_FDSI0_GRPM1_GRVWA8_GRVWB8_GSU1_GSUAMB_GSUC0_GSUWGMRR0_GLS0_ISA1151_IU1_K1_LDSTI0_LBSPPA1024_LBSPPB512_LBSPPM0_LPA8_LPB8_LPM0_LRVW16_LWPMn1_MIAV1_MIWT1_1_MO40_MGRIPM1_NTn1_NTA0_NTB0_NTC0_NTD0_NTM0_NEPBS0_NLCA1_NLCB1_ONLL1_PGR2_PLR1_PKA0_SGROB0_SIA3_SS1_SU32_SUM0_SUS256_SPO0_SRVW0_SSO0_SVW1_SK0_SKFTR0_SKXCCM0_SGRO0_TIN0_TLDS0_TLDSMn1_ULSGRO0_USL1_UIOFGRO0_UPLRP0_USFGROn1_VSn1_VWA1_VWB1_WSGRA0_WSGRB0_WS32_WG32_2_1_WGM8_WGMXCC1_WGMXCCGn1
    SolutionIndex: 142
    SolutionNameMin: Cijk_Ailk_Bljk_BBS_BH_Bias_HA_S_SAV_UserArgs_MT64x16x64_MI16x16x1_SN_LDSB0_AFC1_AG0_AFEM1_AFEM1_ASEM1_CLR0_CADS0_DTLA0_DTLB0_DTVA0_DTVB0_DTVSM0_DPLB0_EPS0_ELFLR0_EMLLn1_FDSI0_GRPM1_GRVWA8_GRVWB8_GSU1_GSUAMB_GSUC0_GSUWGMRR0_GLS0_ISA1151_IU1_K1_LDSTI0_LBSPPA2048_LBSPPB512_LBSPPM0_LPA8_LPB8_LPM0_LRVW16_LWPMn1_MIAV1_MIWT1_1_MO40_MGRIPM1_NTn1_NTA0_NTB0_NTC0_NTD0_NTM0_NEPBS0_NLCA1_NLCB1_ONLL1_PGR1_PLR1_PKA0_SGROB0_SIA3_SS1_SU32_SUM0_SUS256_SPO0_SRVW0_SSO0_SVW1_SK0_SKFTR0_SKXCCM0_SGRO0_TIN0_TLDS0_TLDSMn1_ULSGRO0_USL1_UIOFGRO0_UPLRP0_USFGROn1_VSn1_VWA1_VWB1_WSGRA0_WSGRB0_WS32_WG64_2_1_WGM8_WGMXCC1_WGMXCCGn1
    SolutionIndex: 143
    SolutionNameMin: Cijk_Ailk_Bljk_BBS_BH_Bias_HA_S_SAV_UserArgs_MT16x16x64_MI16x16x1_SN_LDSB0_AFC1_AG0_AFEM1_AFEM1_ASEM1_CLR0_CADS0_DTLA0_DTLB0_DTVA0_DTVB0_DTVSM0_DPLB0_EPS0_ELFLR0_EMLLn1_FDSI0_GRPM1_GRVWA8_GRVWB8_GSU1_GSUAMB_GSUC0_GSUWGMRR0_GLS0_ISA1151_IU1_K1_LDSTI0_LBSPPA512_LBSPPB512_LBSPPM0_LPA8_LPB8_LPM0_LRVW16_LWPMn1_MIAV1_MIWT1_1_MO40_MGRIPM1_NTn1_NTA0_NTB0_NTC0_NTD0_NTM0_NEPBS0_NLCA1_NLCB1_ONLL1_PGR2_PLR0_PKA0_SGROB0_SIA3_SS1_SU32_SUM0_SUS256_SPO0_SRVW0_SSO0_SVW1_SK0_SKFTR0_SKXCCM0_SGRO0_TIN0_TLDS0_TLDSMn1_ULSGRO0_USL1_UIOFGRO0_UPLRP0_USFGROn1_VSn1_VWA1_VWB1_WSGRA0_WSGRB0_WS32_WG16_2_1_WGM8_WGMXCC1_WGMXCCGn1
    SolutionIndex: 144
    SolutionNameMin: Cijk_Ailk_Bljk_BBS_BH_Bias_HA_S_SAV_UserArgs_MT64x32x64_MI16x16x1_SN_LDSB0_AFC1_AG0_AFEM1_AFEM1_ASEM1_CLR0_CADS0_DTLA0_DTLB0_DTVA0_DTVB0_DTVSM0_DPLB0_EPS0_ELFLR0_EMLLn1_FDSI0_GRPM1_GRVWA8_GRVWB8_GSU1_GSUAMB_GSUC0_GSUWGMRR0_GLS0_ISA1151_IU1_K1_LDSTI0_LBSPPA2048_LBSPPB1024_LBSPPM0_LPA8_LPB8_LPM0_LRVW16_LWPMn1_MIAV1_MIWT2_1_MO40_MGRIPM1_NTn1_NTA0_NTB0_NTC0_NTD0_NTM0_NEPBS0_NLCA1_NLCB1_ONLL1_PGR2_PLR0_PKA0_SGROB0_SIA3_SS1_SU32_SUM0_SUS256_SPO0_SRVW0_SSO0_SVW1_SK0_SKFTR0_SKXCCM0_SGRO0_TIN0_TLDS0_TLDSMn1_ULSGRO0_USL1_UIOFGRO0_UPLRP0_USFGROn1_VSn1_VWA1_VWB1_WSGRA0_WSGRB0_WS32_WG32_4_1_WGM8_WGMXCC1_WGMXCCGn1
    SolutionIndex: 145
    SolutionNameMin: Cijk_Ailk_Bljk_BBS_BH_Bias_HA_S_SAV_UserArgs_MT32x16x16_MI16x16x1_SN_LDSB0_AFC1_AG0_AFEM1_AFEM1_ASEM1_CLR0_CADS0_DTLA0_DTLB0_DTVA0_DTVB0_DTVSM0_DPLB0_EPS0_ELFLR0_EMLLn1_FDSI0_GRPM1_GRVWA8_GRVWB4_GSU1_GSUAMB_GSUC0_GSUWGMRR0_GLS0_ISA1151_IU1_K1_LDSTI0_LBSPPA1024_LBSPPB512_LBSPPM0_LPA8_LPB8_LPM0_LRVW16_LWPMn1_MIAV1_MIWT1_1_MO40_MGRIPM1_NTn1_NTA0_NTB0_NTC0_NTD0_NTM0_NEPBS0_NLCA1_NLCB1_ONLL1_PGR2_PLR1_PKA0_SGROB0_SIA3_SS1_SU32_SUM0_SUS256_SPO0_SRVW0_SSO0_SVW1_SK0_SKFTR0_SKXCCM0_SGRO0_TIN0_TLDS0_TLDSMn1_ULSGRO0_USL1_UIOFGRO0_UPLRP0_USFGROn1_VSn1_VWA1_VWB1_WSGRA0_WSGRB0_WS32_WG32_2_1_WGM8_WGMXCC1_WGMXCCGn1
    SolutionIndex: 146
    SolutionNameMin: Cijk_Ailk_Bljk_BBS_BH_Bias_HA_S_SAV_UserArgs_MT16x16x64_MI16x16x1_SN_LDSB0_AFC1_AG0_AFEM1_AFEM1_ASEM1_CLR0_CADS0_DTLA0_DTLB0_DTVA0_DTVB0_DTVSM0_DPLB0_EPS0_ELFLR0_EMLLn1_FDSI0_GRPM1_GRVWA8_GRVWB8_GSU1_GSUAMB_GSUC0_GSUWGMRR0_GLS0_ISA1151_IU1_K1_LDSTI0_LBSPPA512_LBSPPB512_LBSPPM0_LPA8_LPB8_LPM0_LRVW16_LWPMn1_MIAV1_MIWT1_1_MO40_MGRIPM1_NTn1_NTA0_NTB0_NTC0_NTD0_NTM0_NEPBS0_NLCA1_NLCB1_ONLL1_PGR1_PLR1_PKA0_SGROB0_SIA3_SS1_SU32_SUM0_SUS256_SPO0_SRVW0_SSO0_SVW1_SK0_SKFTR0_SKXCCM0_SGRO0_TIN0_TLDS0_TLDSMn1_ULSGRO0_USL1_UIOFGRO0_UPLRP0_USFGROn1_VSn1_VWA1_VWB1_WSGRA0_WSGRB0_WS32_WG16_2_1_WGM8_WGMXCC1_WGMXCCGn1
    SolutionIndex: 147
    SolutionNameMin: Cijk_Ailk_Bljk_BBS_BH_Bias_HA_S_SAV_UserArgs_MT16x16x64_MI16x16x1_SN_LDSB0_AFC1_AG0_AFEM1_AFEM1_ASEM1_CLR0_CADS0_DTLA0_DTLB0_DTVA0_DTVB0_DTVSM0_DPLB0_EPS0_ELFLR0_EMLLn1_FDSI0_GRPM1_GRVWA8_GRVWB8_GSU1_GSUAMB_GSUC0_GSUWGMRR0_GLS0_ISA1151_IU1_K1_LDSTI0_LBSPPA512_LBSPPB512_LBSPPM0_LPA8_LPB8_LPM0_LRVW16_LWPMn1_MIAV1_MIWT1_1_MO40_MGRIPM1_NTn1_NTA0_NTB0_NTC0_NTD0_NTM0_NEPBS0_NLCA1_NLCB1_ONLL1_PGR2_PLR1_PKA0_SGROB0_SIA1_SS1_SU32_SUM0_SUS256_SPO0_SRVW0_SSO0_SVW1_SK0_SKFTR0_SKXCCM0_SGRO0_TIN0_TLDS0_TLDSMn1_ULSGRO0_USL1_UIOFGRO0_UPLRP0_USFGROn1_VSn1_VWA1_VWB1_WSGRA0_WSGRB0_WS32_WG16_2_1_WGM8_WGMXCC1_WGMXCCGn1
    SolutionIndex: 148
    SolutionNameMin: Cijk_Ailk_Bljk_BBS_BH_Bias_HA_S_SAV_UserArgs_MT32x16x128_MI16x16x1_SN_LDSB0_AFC1_AG0_AFEM1_AFEM1_ASEM1_CLR0_CADS0_DTLA0_DTLB0_DTVA0_DTVB0_DTVSM0_DPLB0_EPS0_ELFLR0_EMLLn1_FDSI0_GRPM1_GRVWA8_GRVWB8_GSU1_GSUAMB_GSUC0_GSUWGMRR0_GLS0_ISA1151_IU1_K1_LDSTI0_LBSPPA1024_LBSPPB512_LBSPPM0_LPA8_LPB8_LPM0_LRVW16_LWPMn1_MIAV1_MIWT1_1_MO40_MGRIPM1_NTn1_NTA0_NTB0_NTC0_NTD0_NTM0_NEPBS0_NLCA1_NLCB1_ONLL1_PGR2_PLR1_PKA0_SGROB0_SIA3_SS1_SU32_SUM0_SUS256_SPO0_SRVW0_SSO0_SVW1_SK0_SKFTR0_SKXCCM0_SGRO0_TIN0_TLDS0_TLDSMn1_ULSGRO0_USL1_UIOFGRO0_UPLRP0_USFGROn1_VSn1_VWA1_VWB1_WSGRA0_WSGRB0_WS32_WG32_2_1_WGM8_WGMXCC1_WGMXCCGn1
    SolutionIndex: 149
    SolutionNameMin: Cijk_Ailk_Bljk_BBS_BH_Bias_HA_S_SAV_UserArgs_MT32x16x128_MI16x16x1_SN_LDSB0_AFC1_AG0_AFEM1_AFEM1_ASEM1_CLR0_CADS0_DTLA0_DTLB0_DTVA0_DTVB0_DTVSM0_DPLB0_EPS0_ELFLR0_EMLLn1_FDSI0_GRPM1_GRVWA8_GRVWB8_GSU1_GSUAMB_GSUC0_GSUWGMRR0_GLS0_ISA1151_IU1_K1_LDSTI0_LBSPPA1024_LBSPPB512_LBSPPM0_LPA8_LPB8_LPM0_LRVW16_LWPMn1_MIAV1_MIWT1_1_MO40_MGRIPM1_NTn1_NTA0_NTB0_NTC0_NTD0_NTM0_NEPBS0_NLCA1_NLCB1_ONLL1_PGR1_PLR1_PKA0_SGROB0_SIA1_SS1_SU32_SUM0_SUS256_SPO0_SRVW0_SSO0_SVW1_SK0_SKFTR0_SKXCCM0_SGRO0_TIN0_TLDS0_TLDSMn1_ULSGRO0_USL1_UIOFGRO0_UPLRP0_USFGROn1_VSn1_VWA1_VWB1_WSGRA0_WSGRB0_WS32_WG32_2_1_WGM8_WGMXCC1_WGMXCCGn1
    SolutionIndex: 150
    SolutionNameMin: Cijk_Ailk_Bljk_BBS_BH_Bias_HA_S_SAV_UserArgs_MT32x16x32_MI16x16x1_SN_LDSB1_AFC1_AG0_AFEM1_AFEM1_ASEM1_CLR0_CADS0_DTLA0_DTLB0_DTVA0_DTVB0_DTVSM0_DPLB0_EPS0_ELFLR0_EMLLn1_FDSI0_GRPM1_GRVWA8_GRVWB8_GSU1_GSUAMB_GSUC0_GSUWGMRR0_GLS0_ISA1151_IU1_K1_LDSTI0_LBSPPA1024_LBSPPB512_LBSPPM0_LPA8_LPB8_LPM0_LRVW16_LWPMn1_MIAV1_MIWT1_1_MO40_MGRIPM1_NTn1_NTA0_NTB0_NTC0_NTD0_NTM0_NEPBS0_NLCA1_NLCB1_ONLL1_PGR2_PLR1_PKA0_SGROB0_SIA3_SS1_SU32_SUM0_SUS256_SPO0_SRVW0_SSO0_SVW1_SK0_SKFTR0_SKXCCM0_SGRO0_TIN0_TLDS0_TLDSMn1_ULSGRO0_USL1_UIOFGRO0_UPLRP0_USFGROn1_VSn1_VWA1_VWB1_WSGRA0_WSGRB0_WS32_WG32_2_1_WGM8_WGMXCC1_WGMXCCGn1
    SolutionIndex: 151
    SolutionNameMin: Cijk_Ailk_Bljk_BBS_BH_Bias_HA_S_SAV_UserArgs_MT16x16x64_MI16x16x1_SN_LDSB0_AFC1_AG0_AFEM1_AFEM1_ASEM1_CLR0_CADS0_DTLA0_DTLB0_DTVA0_DTVB0_DTVSM0_DPLB0_EPS0_ELFLR0_EMLLn1_FDSI0_GRPM1_GRVWA8_GRVWB8_GSU1_GSUAMB_GSUC0_GSUWGMRR0_GLS0_ISA1151_IU1_K1_LDSTI0_LBSPPA512_LBSPPB512_LBSPPM0_LPA8_LPB8_LPM0_LRVW16_LWPMn1_MIAV1_MIWT1_1_MO40_MGRIPM1_NTn1_NTA0_NTB0_NTC0_NTD0_NTM0_NEPBS0_NLCA1_NLCB1_ONLL1_PGR2_PLR1_PKA0_SGROB0_SIA3_SS1_SU32_SUM0_SUS256_SPO0_SRVW0_SSO0_SVW1_SK0_SKFTR0_SKXCCM0_SGRO0_TIN0_TLDS0_TLDSMn1_ULSGRO0_USL1_UIOFGRO0_UPLRP0_USFGROn1_VSn1_VWA1_VWB1_WSGRA0_WSGRB0_WS32_WG16_2_1_WGM8_WGMXCC1_WGMXCCGn1
    SolutionIndex: 152
    SolutionNameMin: Cijk_Ailk_Bljk_BBS_BH_Bias_HA_S_SAV_UserArgs_MT64x16x64_MI16x16x1_SN_LDSB0_AFC1_AG0_AFEM1_AFEM1_ASEM1_CLR0_CADS0_DTLA0_DTLB0_DTVA0_DTVB0_DTVSM0_DPLB0_EPS0_ELFLR0_EMLLn1_FDSI0_GRPM1_GRVWA8_GRVWB8_GSU1_GSUAMB_GSUC0_GSUWGMRR0_GLS0_ISA1151_IU1_K1_LDSTI0_LBSPPA2048_LBSPPB512_LBSPPM0_LPA8_LPB8_LPM0_LRVW16_LWPMn1_MIAV1_MIWT1_1_MO40_MGRIPM1_NTn1_NTA0_NTB0_NTC0_NTD0_NTM0_NEPBS0_NLCA1_NLCB1_ONLL1_PGR2_PLR1_PKA0_SGROB0_SIA3_SS1_SU32_SUM0_SUS256_SPO0_SRVW0_SSO0_SVW1_SK0_SKFTR0_SKXCCM0_SGRO0_TIN0_TLDS0_TLDSMn1_ULSGRO0_USL1_UIOFGRO0_UPLRP0_USFGROn1_VSn1_VWA1_VWB1_WSGRA0_WSGRB0_WS32_WG64_2_1_WGM8_WGMXCC1_WGMXCCGn1
    SolutionIndex: 153
    SolutionNameMin: Cijk_Ailk_Bljk_BBS_BH_Bias_HA_S_SAV_UserArgs_MT16x16x128_MI16x16x1_SN_LDSB0_AFC1_AG0_AFEM1_AFEM1_ASEM1_CLR0_CADS0_DTLA0_DTLB0_DTVA0_DTVB0_DTVSM0_DPLB0_EPS0_ELFLR0_EMLLn1_FDSI0_GRPM1_GRVWA8_GRVWB8_GSU1_GSUAMB_GSUC0_GSUWGMRR0_GLS0_ISA1151_IU1_K1_LDSTI0_LBSPPA512_LBSPPB512_LBSPPM0_LPA8_LPB8_LPM0_LRVW16_LWPMn1_MIAV1_MIWT1_1_MO40_MGRIPM1_NTn1_NTA0_NTB0_NTC0_NTD0_NTM0_NEPBS0_NLCA1_NLCB1_ONLL1_PGR2_PLR1_PKA0_SGROB0_SIA3_SS1_SU32_SUM0_SUS256_SPO0_SRVW0_SSO0_SVW1_SK0_SKFTR0_SKXCCM0_SGRO0_TIN0_TLDS0_TLDSMn1_ULSGRO0_USL1_UIOFGRO0_UPLRP0_USFGROn1_VSn1_VWA1_VWB1_WSGRA0_WSGRB0_WS32_WG16_2_1_WGM8_WGMXCC1_WGMXCCGn1
    SolutionIndex: 154
    SolutionNameMin: Cijk_Ailk_Bljk_BBS_BH_Bias_HA_S_SAV_UserArgs_MT16x16x64_MI16x16x1_SN_LDSB0_AFC1_AG0_AFEM1_AFEM1_ASEM1_CLR0_CADS0_DTLA0_DTLB0_DTVA0_DTVB0_DTVSM0_DPLB0_EPS0_ELFLR0_EMLLn1_FDSI0_GRPM1_GRVWA8_GRVWB8_GSU1_GSUAMB_GSUC0_GSUWGMRR0_GLS0_ISA1151_IU1_K1_LDSTI0_LBSPPA512_LBSPPB512_LBSPPM0_LPA8_LPB8_LPM0_LRVW16_LWPMn1_MIAV1_MIWT1_1_MO40_MGRIPM1_NTn1_NTA0_NTB0_NTC0_NTD0_NTM0_NEPBS0_NLCA1_NLCB1_ONLL1_PGR1_PLR1_PKA0_SGROB0_SIA1_SS1_SU32_SUM0_SUS256_SPO0_SRVW0_SSO0_SVW1_SK0_SKFTR0_SKXCCM0_SGRO0_TIN0_TLDS0_TLDSMn1_ULSGRO0_USL1_UIOFGRO0_UPLRP0_USFGROn1_VSn1_VWA1_VWB1_WSGRA0_WSGRB0_WS32_WG16_2_1_WGM8_WGMXCC1_WGMXCCGn1
    SolutionIndex: 155
    SolutionNameMin: Cijk_Ailk_Bljk_BBS_BH_Bias_HA_S_SAV_UserArgs_MT64x32x32_MI16x16x1_SN_LDSB0_AFC1_AG0_AFEM1_AFEM1_ASEM1_CLR0_CADS0_DTLA0_DTLB0_DTVA0_DTVB0_DTVSM0_DPLB0_EPS0_ELFLR0_EMLLn1_FDSI0_GRPM1_GRVWA8_GRVWB8_GSU1_GSUAMB_GSUC0_GSUWGMRR0_GLS0_ISA1151_IU1_K1_LDSTI0_LBSPPA2048_LBSPPB1024_LBSPPM0_LPA8_LPB8_LPM0_LRVW16_LWPMn1_MIAV1_MIWT2_1_MO40_MGRIPM1_NTn1_NTA0_NTB0_NTC0_NTD0_NTM0_NEPBS0_NLCA1_NLCB1_ONLL1_PGR1_PLR1_PKA0_SGROB0_SIA1_SS1_SU32_SUM0_SUS256_SPO0_SRVW0_SSO0_SVW1_SK0_SKFTR0_SKXCCM0_SGRO0_TIN0_TLDS0_TLDSMn1_ULSGRO0_USL1_UIOFGRO0_UPLRP0_USFGROn1_VSn1_VWA1_VWB1_WSGRA0_WSGRB0_WS32_WG32_4_1_WGM8_WGMXCC1_WGMXCCGn1
    SolutionIndex: 156
    SolutionNameMin: Cijk_Ailk_Bljk_BBS_BH_Bias_HA_S_SAV_UserArgs_MT128x64x16_MI16x16x1_SN_LDSB0_AFC1_AG0_AFEM1_AFEM1_ASEM1_CLR0_CADS0_DTLA0_DTLB0_DTVA0_DTVB0_DTVSM0_DPLB0_EPS0_ELFLR0_EMLLn1_FDSI0_GRPM1_GRVWA8_GRVWB8_GSU1_GSUAMB_GSUC0_GSUWGMRR0_GLS0_ISA1151_IU1_K1_LDSTI0_LBSPPA4096_LBSPPB2048_LBSPPM0_LPA8_LPB8_LPM0_LRVW16_LWPMn1_MIAV1_MIWT4_2_MO40_MGRIPM1_NTn1_NTA0_NTB0_NTC0_NTD0_NTM0_NEPBS0_NLCA1_NLCB1_ONLL1_PGR2_PLR0_PKA0_SGROB0_SIA1_SS1_SU32_SUM0_SUS256_SPO0_SRVW0_SSO0_SVW1_SK0_SKFTR0_SKXCCM0_SGRO0_TIN0_TLDS0_TLDSMn1_ULSGRO0_USL1_UIOFGRO0_UPLRP0_USFGROn1_VSn1_VWA1_VWB1_WSGRA0_WSGRB0_WS32_WG32_4_1_WGM8_WGMXCC1_WGMXCCGn1
    SolutionIndex: 157
    SolutionNameMin: Cijk_Ailk_Bljk_BBS_BH_Bias_HA_S_SAV_UserArgs_MT64x64x32_MI16x16x1_SN_LDSB0_AFC1_AG0_AFEM1_AFEM1_ASEM1_CLR0_CADS0_DTLA0_DTLB0_DTVA0_DTVB0_DTVSM0_DPLB0_EPS0_ELFLR0_EMLLn1_FDSI0_GRPM1_GRVWA8_GRVWB8_GSU1_GSUAMB_GSUC0_GSUWGMRR0_GLS0_ISA1151_IU1_K1_LDSTI0_LBSPPA2048_LBSPPB2048_LBSPPM0_LPA8_LPB8_LPM0_LRVW16_LWPMn1_MIAV1_MIWT2_2_MO40_MGRIPM1_NTn1_NTA0_NTB0_NTC0_NTD0_NTM0_NEPBS0_NLCA1_NLCB1_ONLL1_PGR1_PLR1_PKA0_SGROB0_SIA1_SS1_SU32_SUM0_SUS256_SPO0_SRVW0_SSO0_SVW1_SK0_SKFTR0_SKXCCM0_SGRO0_TIN0_TLDS0_TLDSMn1_ULSGRO0_USL1_UIOFGRO0_UPLRP0_USFGROn1_VSn1_VWA1_VWB1_WSGRA0_WSGRB0_WS32_WG32_4_1_WGM8_WGMXCC1_WGMXCCGn1
    SolutionIndex: 158
    SolutionNameMin: Cijk_Ailk_Bljk_BBS_BH_Bias_HA_S_SAV_UserArgs_MT64x64x32_MI16x16x1_SN_LDSB0_AFC1_AG0_AFEM1_AFEM1_ASEM1_CLR0_CADS0_DTLA0_DTLB0_DTVA0_DTVB0_DTVSM0_DPLB0_EPS0_ELFLR0_EMLLn1_FDSI0_GRPM1_GRVWA8_GRVWB8_GSU1_GSUAMB_GSUC0_GSUWGMRR0_GLS0_ISA1151_IU1_K1_LDSTI0_LBSPPA2048_LBSPPB2048_LBSPPM0_LPA8_LPB8_LPM0_LRVW16_LWPMn1_MIAV1_MIWT2_2_MO40_MGRIPM1_NTn1_NTA0_NTB0_NTC0_NTD0_NTM0_NEPBS0_NLCA1_NLCB1_ONLL1_PGR2_PLR1_PKA0_SGROB0_SIA1_SS1_SU32_SUM0_SUS256_SPO0_SRVW0_SSO0_SVW1_SK0_SKFTR0_SKXCCM0_SGRO0_TIN0_TLDS0_TLDSMn1_ULSGRO0_USL1_UIOFGRO0_UPLRP0_USFGROn1_VSn1_VWA1_VWB1_WSGRA0_WSGRB0_WS32_WG32_4_1_WGM8_WGMXCC1_WGMXCCGn1
    SolutionIndex: 159
    SolutionNameMin: Cijk_Ailk_Bljk_BBS_BH_Bias_HA_S_SAV_UserArgs_MT64x64x32_MI16x16x1_SN_LDSB0_AFC1_AG0_AFEM1_AFEM1_ASEM1_CLR0_CADS0_DTLA0_DTLB0_DTVA0_DTVB0_DTVSM0_DPLB0_EPS0_ELFLR0_EMLLn1_FDSI0_GRPM1_GRVWA8_GRVWB8_GSU1_GSUAMB_GSUC0_GSUWGMRR0_GLS0_ISA1151_IU1_K1_LDSTI0_LBSPPA2048_LBSPPB2048_LBSPPM0_LPA8_LPB8_LPM0_LRVW16_LWPMn1_MIAV1_MIWT2_2_MO40_MGRIPM1_NTn1_NTA0_NTB0_NTC0_NTD0_NTM0_NEPBS0_NLCA1_NLCB1_ONLL1_PGR2_PLR1_PKA0_SGROB0_SIA3_SS1_SU32_SUM0_SUS256_SPO0_SRVW0_SSO0_SVW1_SK0_SKFTR0_SKXCCM0_SGRO0_TIN0_TLDS0_TLDSMn1_ULSGRO0_USL1_UIOFGRO0_UPLRP0_USFGROn1_VSn1_VWA1_VWB1_WSGRA0_WSGRB0_WS32_WG32_4_1_WGM8_WGMXCC1_WGMXCCGn1
- - - [64, 64, 1, 64]
    - [0, 104.858]
  - - [256, 256, 1, 256]
    - [66, 4725.98]
  - - [320, 64, 1, 64]
    - [141, 595.782]
  - - [576, 64, 1, 64]
    - [142, 1003.96]
  - - [832, 64, 1, 64]
    - [17, 1336.42]
  - - [1088, 64, 1, 64]
    - [20, 1747.63]
  - - [1344, 64, 1, 64]
    - [13, 1931.59]
  - - [1600, 64, 1, 64]
    - [19, 2299.51]
  - - [1856, 64, 1, 64]
    - [20, 2667.43]
  - - [2112, 64, 1, 64]
    - [157, 2836.31]
  - - [2368, 64, 1, 64]
    - [134, 3233.11]
  - - [2624, 64, 1, 64]
    - [134, 3256.94]
  - - [2880, 64, 1, 64]
    - [30, 3629.69]
  - - [3136, 64, 1, 64]
    - [157, 3723.2]
  - - [3392, 64, 1, 64]
    - [134, 4086.36]
  - - [3648, 64, 1, 64]
    - [134, 4394.77]
  - - [3904, 64, 1, 64]
    - [134, 4100.2]
  - - [64, 320, 1, 64]
    - [61, 534.988]
  - - [320, 320, 1, 64]
    - [20, 2299.51]
  - - [576, 320, 1, 64]
    - [13, 3469.55]
  - - [832, 320, 1, 64]
    - [31, 4207.25]
  - - [1088, 320, 1, 64]
    - [134, 5369.21]
  - - [1344, 320, 1, 64]
    - [134, 5794.76]
  - - [1600, 320, 1, 64]
    - [134, 6425.1]
  - - [1856, 320, 1, 64]
    - [106, 6727.59]
  - - [2112, 320, 1, 64]
    - [96, 7269.54]
  - - [2368, 320, 1, 64]
    - [94, 8290.02]
  - - [2624, 320, 1, 64]
    - [133, 7732.31]
  - - [2880, 320, 1, 64]
    - [134, 8426.06]
  - - [3136, 320, 1, 64]
    - [134, 7978.3]
  - - [3392, 320, 1, 64]
    - [134, 7939.22]
  - - [3648, 320, 1, 64]
    - [134, 8076.87]
  - - [3904, 320, 1, 64]
    - [100, 8416.2]
  - - [64, 576, 1, 64]
    - [14, 1003.96]
  - - [320, 576, 1, 64]
    - [69, 3744.91]
  - - [576, 576, 1, 64]
    - [46, 5444.53]
  - - [832, 576, 1, 64]
    - [48, 6667.58]
  - - [1088, 576, 1, 64]
    - [94, 6975.31]
  - - [1344, 576, 1, 64]
    - [94, 8189.29]
  - - [1600, 576, 1, 64]
    - [134, 8024.82]
  - - [1856, 576, 1, 64]
    - [97, 8715.87]
  - - [2112, 576, 1, 64]
    - [53, 8508.94]
  - - [2368, 576, 1, 64]
    - [94, 8685.97]
  - - [2624, 576, 1, 64]
    - [94, 9577.34]
  - - [2880, 576, 1, 64]
    - [94, 9521.82]
  - - [3136, 576, 1, 64]
    - [74, 9797.08]
  - - [64, 832, 1, 64]
    - [20, 1363.15]
  - - [320, 832, 1, 64]
    - [30, 4484.04]
  - - [576, 832, 1, 64]
    - [134, 6525.71]
  - - [832, 832, 1, 64]
    - [109, 7203.63]
  - - [1088, 832, 1, 64]
    - [133, 7828.9]
  - - [1344, 832, 1, 64]
    - [97, 9175.04]
  - - [1600, 832, 1, 64]
    - [106, 8649.42]
  - - [1856, 832, 1, 64]
    - [94, 9641.78]
  - - [2112, 832, 1, 64]
    - [74, 9332.76]
  - - [64, 1088, 1, 64]
    - [20, 1747.63]
  - - [320, 1088, 1, 64]
    - [134, 5434.69]
  - - [576, 1088, 1, 64]
    - [94, 6797.97]
  - - [832, 1088, 1, 64]
    - [134, 8276.26]
  - - [1088, 1088, 1, 64]
    - [104, 7850.74]
  - - [1344, 1088, 1, 64]
    - [94, 9175.04]
  - - [1600, 1088, 1, 64]
    - [74, 9687.93]
  - - [64, 1344, 1, 64]
    - [20, 1931.59]
  - - [320, 1344, 1, 64]
    - [57, 6116.69]
  - - [576, 1344, 1, 64]
    - [109, 7991.16]
  - - [832, 1344, 1, 64]
    - [97, 8890.1]
  - - [1088, 1344, 1, 64]
    - [94, 9175.04]
  - - [1344, 1344, 1, 64]
    - [74, 9965.99]
  - - [64, 1600, 1, 64]
    - [20, 2299.51]
  - - [320, 1600, 1, 64]
    - [134, 6362.72]
  - - [576, 1600, 1, 64]
    - [134, 8366.3]
  - - [832, 1600, 1, 64]
    - [94, 8519.68]
  - - [1088, 1600, 1, 64]
    - [72, 9323.11]
  - - [64, 1856, 1, 64]
    - [20, 2621.44]
  - - [320, 1856, 1, 64]
    - [109, 6668.58]
  - - [576, 1856, 1, 64]
    - [97, 8343.85]
  - - [832, 1856, 1, 64]
    - [109, 9594.98]
  - - [64, 2112, 1, 64]
    - [134, 2883.58]
  - - [320, 2112, 1, 64]
    - [60, 7588.38]
  - - [576, 2112, 1, 64]
    - [53, 8416.95]
  - - [832, 2112, 1, 64]
    - [134, 9332.76]
  - - [64, 2368, 1, 64]
    - [159, 2984.41]
  - - [320, 2368, 1, 64]
    - [109, 8219.77]
  - - [576, 2368, 1, 64]
    - [53, 8729.4]
  - - [64, 2624, 1, 64]
    - [34, 3256.94]
  - - [320, 2624, 1, 64]
    - [134, 7845.19]
  - - [576, 2624, 1, 64]
    - [109, 9437.18]
  - - [64, 2880, 1, 64]
    - [69, 3744.91]
  - - [320, 2880, 1, 64]
    - [134, 8307.38]
  - - [576, 2880, 1, 64]
    - [109, 9313.01]
  - - [64, 3136, 1, 64]
    - [20, 3670.02]
  - - [320, 3136, 1, 64]
    - [134, 7929.05]
  - - [576, 3136, 1, 64]
    - [72, 9633.79]
  - - [64, 3392, 1, 64]
    - [134, 4147.35]
  - - [320, 3392, 1, 64]
    - [134, 7805.41]
  - - [64, 3648, 1, 64]
    - [157, 4460.36]
  - - [320, 3648, 1, 64]
    - [134, 8301.23]
  - - [64, 3904, 1, 64]
    - [31, 4264.21]
  - - [320, 3904, 1, 64]
    - [109, 8035.57]
  - - [64, 64, 1, 256]
    - [143, 374.491]
  - - [320, 64, 1, 256]
    - [65, 1807.89]
  - - [576, 64, 1, 256]
    - [112, 3199.05]
  - - [832, 64, 1, 256]
    - [10, 3839.86]
  - - [1088, 64, 1, 256]
    - [20, 5093.08]
  - - [1344, 64, 1, 256]
    - [157, 5306.05]
  - - [1600, 64, 1, 256]
    - [19, 6096.37]
  - - [1856, 64, 1, 256]
    - [157, 7240.17]
  - - [2112, 64, 1, 256]
    - [157, 8141.88]
  - - [2368, 64, 1, 256]
    - [157, 8718.5]
  - - [2624, 64, 1, 256]
    - [28, 8111.63]
  - - [2880, 64, 1, 256]
    - [30, 9252.14]
  - - [3136, 64, 1, 256]
    - [128, 9603.78]
  - - [3392, 64, 1, 256]
    - [134, 10485.8]
  - - [3648, 64, 1, 256]
    - [83, 10673.0]
  - - [3904, 64, 1, 256]
    - [134, 9765.36]
  - - [64, 320, 1, 256]
    - [153, 2056.03]
  - - [320, 320, 1, 256]
    - [66, 6168.09]
  - - [576, 320, 1, 256]
    - [28, 9074.22]
  - - [832, 320, 1, 256]
    - [93, 10733.5]
  - - [1088, 320, 1, 256]
    - [134, 12126.4]
  - - [1344, 320, 1, 256]
    - [93, 14298.8]
  - - [64, 576, 1, 256]
    - [112, 3199.05]
  - - [320, 576, 1, 256]
    - [47, 9437.18]
  - - [576, 576, 1, 256]
    - [53, 14518.7]
  - - [832, 576, 1, 256]
    - [48, 15932.9]
  - - [64, 832, 1, 256]
    - [14, 4069.1]
  - - [320, 832, 1, 256]
    - [30, 10567.0]
  - - [576, 832, 1, 256]
    - [53, 15529.5]
  - - [64, 1088, 1, 256]
    - [112, 5021.35]
  - - [320, 1088, 1, 256]
    - [47, 13712.1]
  - - [64, 1344, 1, 256]
    - [116, 5437.06]
  - - [320, 1344, 1, 256]
    - [48, 14486.9]
  - - [64, 1600, 1, 256]
    - [19, 6168.09]
  - - [64, 1856, 1, 256]
    - [19, 7071.79]
  - - [64, 2112, 1, 256]
    - [157, 7864.32]
  - - [64, 2368, 1, 256]
    - [118, 8817.57]
  - - [64, 2624, 1, 256]
    - [69, 8035.82]
  - - [64, 2880, 1, 256]
    - [32, 9252.14]
  - - [64, 3136, 1, 256]
    - [157, 9880.81]
  - - [64, 3392, 1, 256]
    - [47, 10485.8]
  - - [64, 3648, 1, 256]
    - [48, 10867.1]
  - - [64, 3904, 1, 256]
    - [31, 9406.34]
  - - [64, 64, 1, 512]
    - [129, 748.983]
  - - [320, 64, 1, 512]
    - [149, 3554.49]
  - - [576, 64, 1, 512]
    - [66, 4902.43]
  - - [832, 64, 1, 512]
    - [10, 5800.63]
  - - [1088, 64, 1, 512]
    - [84, 7427.41]
  - - [1344, 64, 1, 512]
    - [27, 7659.16]
  - - [1600, 64, 1, 512]
    - [27, 8665.92]
  - - [1856, 64, 1, 512]
    - [27, 10308.0]
  - - [2112, 64, 1, 512]
    - [158, 11162.3]
  - - [2368, 64, 1, 512]
    - [158, 12515.3]
  - - [2624, 64, 1, 512]
    - [27, 11619.4]
  - - [2880, 64, 1, 512]
    - [27, 12927.6]
  - - [3136, 64, 1, 512]
    - [83, 12925.8]
  - - [3392, 64, 1, 512]
    - [83, 14069.5]
  - - [3648, 64, 1, 512]
    - [128, 15227.7]
  - - [64, 320, 1, 512]
    - [141, 3437.95]
  - - [320, 320, 1, 512]
    - [43, 9039.45]
  - - [576, 320, 1, 512]
    - [27, 12927.6]
  - - [64, 576, 1, 512]
    - [137, 4966.94]
  - - [320, 576, 1, 512]
    - [47, 13291.8]
  - - [64, 832, 1, 512]
    - [69, 5800.63]
  - - [64, 1088, 1, 512]
    - [112, 7427.41]
  - - [64, 1344, 1, 512]
    - [69, 7726.35]
  - - [64, 1600, 1, 512]
    - [31, 9039.45]
  - - [64, 1856, 1, 512]
    - [44, 10136.2]
  - - [64, 2112, 1, 512]
    - [158, 10177.4]
  - - [64, 2368, 1, 512]
    - [20, 10485.8]
  - - [64, 2624, 1, 512]
    - [69, 11541.4]
  - - [64, 2880, 1, 512]
    - [47, 12927.6]
  - - [64, 3136, 1, 512]
    - [43, 12531.8]
  - - [64, 3392, 1, 512]
    - [47, 14249.9]
  - - [64, 3648, 1, 512]
    - [47, 15938.4]
  - - [64, 64, 1, 1024]
    - [129, 1089.43]
  - - [320, 64, 1, 1024]
    - [141, 5518.82]
  - - [576, 64, 1, 1024]
    - [112, 7401.71]
  - - [832, 64, 1, 1024]
    - [27, 8077.92]
  - - [1088, 64, 1, 1024]
    - [102, 10485.8]
  - - [1344, 64, 1, 1024]
    - [27, 10009.1]
  - - [1600, 64, 1, 1024]
    - [27, 11522.8]
  - - [1856, 64, 1, 1024]
    - [27, 13149.7]
  - - [64, 320, 1, 1024]
    - [138, 5178.15]
  - - [320, 320, 1, 1024]
    - [50, 12122.3]
  - - [64, 576, 1, 1024]
    - [14, 7122.4]
  - - [64, 832, 1, 1024]
    - [69, 8453.64]
  - - [64, 1088, 1, 1024]
    - [20, 9635.56]
  - - [64, 1344, 1, 1024]
    - [50, 10066.3]
  - - [64, 1600, 1, 1024]
    - [69, 11715.9]
  - - [64, 1856, 1, 1024]
    - [44, 13293.4]
  - - [64, 64, 1, 2048]
    - [64, 1950.84]
  - - [320, 64, 1, 2048]
    - [149, 7913.78]
  - - [576, 64, 1, 2048]
    - [112, 9437.18]
  - - [832, 64, 1, 2048]
    - [55, 11127.7]
  - - [64, 320, 1, 2048]
    - [138, 7489.83]
  - - [64, 576, 1, 2048]
    - [62, 8778.78]
  - - [64, 832, 1, 2048]
    - [51, 11071.3]
  - - [64, 64, 1, 4096]
    - [18, 3050.4]
  - - [320, 64, 1, 4096]
    - [68, 9532.51]
  - - [64, 320, 1, 4096]
    - [68, 9269.18]
  - - [192, 64, 1, 64]
    - [16, 365.782]
  - - [448, 64, 1, 64]
    - [14, 797.83]
  - - [704, 64, 1, 64]
    - [20, 1153.43]
  - - [960, 64, 1, 64]
    - [10, 1542.02]
  - - [1216, 64, 1, 64]
    - [158, 1844.72]
  - - [1472, 64, 1, 64]
    - [20, 2115.55]
  - - [1728, 64, 1, 64]
    - [20, 2399.28]
  - - [1984, 64, 1, 64]
    - [157, 2708.82]
  - - [64, 192, 1, 64]
    - [61, 357.469]
  - - [192, 192, 1, 64]
    - [16, 1025.78]
  - - [320, 192, 1, 64]
    - [31, 1572.86]
  - - [448, 192, 1, 64]
    - [69, 2001.83]
  - - [576, 192, 1, 64]
    - [69, 2573.78]
  - - [704, 192, 1, 64]
    - [134, 2836.31]
  - - [832, 192, 1, 64]
    - [159, 3407.87]
  - - [960, 192, 1, 64]
    - [69, 3744.91]
  - - [1088, 192, 1, 64]
    - [121, 3932.16]
  - - [1216, 192, 1, 64]
    - [121, 4394.77]
  - - [1344, 192, 1, 64]
    - [32, 4289.63]
  - - [1472, 192, 1, 64]
    - [121, 4823.45]
  - - [1600, 192, 1, 64]
    - [31, 5106.7]
  - - [1728, 192, 1, 64]
    - [121, 5587.81]
  - - [1856, 192, 1, 64]
    - [46, 6001.72]
  - - [1984, 192, 1, 64]
    - [158, 5804.62]
  - - [192, 320, 1, 64]
    - [21, 1429.88]
  - - [448, 320, 1, 64]
    - [134, 3058.35]
  - - [704, 320, 1, 64]
    - [134, 4240.56]
  - - [960, 320, 1, 64]
    - [30, 5173.89]
  - - [1216, 320, 1, 64]
    - [134, 5791.55]
  - - [1472, 320, 1, 64]
    - [93, 6152.36]
  - - [1728, 320, 1, 64]
    - [134, 6677.25]
  - - [1984, 320, 1, 64]
    - [107, 7128.48]
  - - [64, 448, 1, 64]
    - [65, 797.83]
  - - [192, 448, 1, 64]
    - [13, 1966.08]
  - - [320, 448, 1, 64]
    - [134, 3058.35]
  - - [448, 448, 1, 64]
    - [157, 3777.96]
  - - [576, 448, 1, 64]
    - [60, 4404.02]
  - - [704, 448, 1, 64]
    - [134, 5110.15]
  - - [832, 448, 1, 64]
    - [134, 5818.32]
  - - [960, 448, 1, 64]
    - [60, 6327.61]
  - - [1088, 448, 1, 64]
    - [134, 6781.55]
  - - [1216, 448, 1, 64]
    - [134, 6836.3]
  - - [1344, 448, 1, 64]
    - [60, 7006.39]
  - - [1472, 448, 1, 64]
    - [60, 7536.64]
  - - [1600, 448, 1, 64]
    - [60, 8048.28]
  - - [1728, 448, 1, 64]
    - [139, 8397.49]
  - - [1856, 448, 1, 64]
    - [60, 7768.65]
  - - [1984, 448, 1, 64]
    - [134, 8068.83]
  - - [192, 576, 1, 64]
    - [32, 2527.82]
  - - [448, 576, 1, 64]
    - [34, 4289.63]
  - - [704, 576, 1, 64]
    - [134, 6253.56]
  - - [960, 576, 1, 64]
    - [53, 7450.41]
  - - [1216, 576, 1, 64]
    - [96, 7533.89]
  - - [1472, 576, 1, 64]
    - [134, 7807.74]
  - - [1728, 576, 1, 64]
    - [97, 7962.62]
  - - [1984, 576, 1, 64]
    - [97, 9258.0]
  - - [64, 704, 1, 64]
    - [14, 1153.43]
  - - [192, 704, 1, 64]
    - [157, 2790.57]
  - - [320, 704, 1, 64]
    - [134, 4240.56]
  - - [448, 704, 1, 64]
    - [134, 5175.66]
  - - [576, 704, 1, 64]
    - [157, 6179.11]
  - - [704, 704, 1, 64]
    - [134, 6099.89]
  - - [832, 704, 1, 64]
    - [107, 6634.8]
  - - [960, 704, 1, 64]
    - [134, 7208.96]
  - - [1088, 704, 1, 64]
    - [96, 7843.35]
  - - [1216, 704, 1, 64]
    - [134, 7883.18]
  - - [1344, 704, 1, 64]
    - [134, 8712.99]
  - - [1472, 704, 1, 64]
    - [97, 8290.3]
  - - [1600, 704, 1, 64]
    - [134, 7921.93]
  - - [1728, 704, 1, 64]
    - [87, 8282.63]
  - - [1856, 704, 1, 64]
    - [106, 8621.02]
  - - [1984, 704, 1, 64]
    - [94, 8850.6]
  - - [192, 832, 1, 64]
    - [157, 3098.07]
  - - [448, 832, 1, 64]
    - [158, 5748.22]
  - - [704, 832, 1, 64]
    - [93, 6694.03]
  - - [960, 832, 1, 64]
    - [72, 7355.12]
  - - [1216, 832, 1, 64]
    - [97, 8409.03]
  - - [1472, 832, 1, 64]
    - [87, 8338.41]
  - - [1728, 832, 1, 64]
    - [94, 9247.49]
  - - [1984, 832, 1, 64]
    - [94, 9432.5]
  - - [64, 960, 1, 64]
    - [15, 1542.02]
  - - [192, 960, 1, 64]
    - [34, 3686.4]
  - - [320, 960, 1, 64]
    - [30, 5313.73]
  - - [448, 960, 1, 64]
    - [48, 6116.69]
  - - [576, 960, 1, 64]
    - [53, 7864.32]
  - - [704, 960, 1, 64]
    - [53, 7090.78]
  - - [832, 960, 1, 64]
    - [134, 7925.28]
  - - [960, 960, 1, 64]
    - [133, 8024.82]
  - - [1088, 960, 1, 64]
    - [97, 8355.84]
  - - [1216, 960, 1, 64]
    - [97, 9280.87]
  - - [1344, 960, 1, 64]
    - [53, 9074.22]
  - - [1472, 960, 1, 64]
    - [53, 8998.97]
  - - [1600, 960, 1, 64]
    - [94, 9544.08]
  - - [1728, 960, 1, 64]
    - [74, 9313.01]
  - - [1856, 960, 1, 64]
    - [74, 9872.96]
  - - [1984, 960, 1, 64]
    - [74, 9991.55]
  - - [192, 1088, 1, 64]
    - [158, 4051.32]
  - - [448, 1088, 1, 64]
    - [134, 6781.55]
  - - [704, 1088, 1, 64]
    - [109, 8379.65]
  - - [960, 1088, 1, 64]
    - [97, 8252.68]
  - - [1216, 1088, 1, 64]
    - [53, 8640.05]
  - - [1472, 1088, 1, 64]
    - [94, 9360.58]
  - - [1728, 1088, 1, 64]
    - [134, 9664.59]
  - - [64, 1216, 1, 64]
    - [20, 1992.29]
  - - [192, 1216, 1, 64]
    - [158, 4394.77]
  - - [320, 1216, 1, 64]
    - [134, 6074.07]
  - - [448, 1216, 1, 64]
    - [134, 6225.92]
  - - [576, 1216, 1, 64]
    - [109, 7795.93]
  - - [704, 1216, 1, 64]
    - [134, 7998.26]
  - - [832, 1216, 1, 64]
    - [97, 7993.77]
  - - [960, 1216, 1, 64]
    - [93, 8033.45]
  - - [1088, 1216, 1, 64]
    - [53, 8509.8]
  - - [1216, 1216, 1, 64]
    - [94, 9277.84]
  - - [1344, 1216, 1, 64]
    - [94, 9215.46]
  - - [1472, 1216, 1, 64]
    - [74, 9833.21]
  - - [1600, 1216, 1, 64]
    - [134, 9766.15]
  - - [192, 1344, 1, 64]
    - [31, 4289.63]
  - - [448, 1344, 1, 64]
    - [60, 6643.99]
  - - [704, 1344, 1, 64]
    - [134, 8528.91]
  - - [960, 1344, 1, 64]
    - [53, 8927.07]
  - - [1216, 1344, 1, 64]
    - [94, 9338.88]
  - - [64, 1472, 1, 64]
    - [19, 2115.55]
  - - [192, 1472, 1, 64]
    - [134, 4698.17]
  - - [320, 1472, 1, 64]
    - [134, 6152.36]
  - - [448, 1472, 1, 64]
    - [72, 7093.31]
  - - [576, 1472, 1, 64]
    - [72, 7864.32]
  - - [704, 1472, 1, 64]
    - [97, 8088.1]
  - - [832, 1472, 1, 64]
    - [134, 8164.69]
  - - [960, 1472, 1, 64]
    - [53, 9181.69]
  - - [1088, 1472, 1, 64]
    - [94, 9151.63]
  - - [1216, 1472, 1, 64]
    - [72, 9626.63]
  - - [192, 1600, 1, 64]
    - [134, 5106.7]
  - - [448, 1600, 1, 64]
    - [134, 7459.38]
  - - [704, 1600, 1, 64]
    - [134, 7793.47]
  - - [960, 1600, 1, 64]
    - [94, 9273.96]
  - - [1216, 1600, 1, 64]
    - [134, 9766.15]
  - - [64, 1728, 1, 64]
    - [20, 2440.65]
  - - [192, 1728, 1, 64]
    - [47, 5444.53]
  - - [320, 1728, 1, 64]
    - [134, 6805.66]
  - - [448, 1728, 1, 64]
    - [109, 7991.16]
  - - [576, 1728, 1, 64]
    - [97, 8114.78]
  - - [704, 1728, 1, 64]
    - [134, 8068.06]
  - - [832, 1728, 1, 64]
    - [94, 9020.84]
  - - [960, 1728, 1, 64]
    - [96, 9564.71]
  - - [1088, 1728, 1, 64]
    - [134, 9664.59]
  - - [192, 1856, 1, 64]
    - [134, 5495.55]
  - - [448, 1856, 1, 64]
    - [134, 7942.57]
  - - [704, 1856, 1, 64]
    - [94, 8404.42]
  - - [960, 1856, 1, 64]
    - [72, 9623.01]
  - - [64, 1984, 1, 64]
    - [157, 2664.41]
  - - [192, 1984, 1, 64]
    - [158, 5804.62]
  - - [320, 1984, 1, 64]
    - [60, 7066.49]
  - - [448, 1984, 1, 64]
    - [134, 7635.6]
  - - [576, 1984, 1, 64]
    - [134, 7993.24]
  - - [704, 1984, 1, 64]
    - [95, 8554.17]
  - - [832, 1984, 1, 64]
    - [109, 9307.84]
  - - [960, 1984, 1, 64]
    - [72, 10074.1]
  - - [192, 64, 1, 256]
    - [7, 1233.62]
  - - [448, 64, 1, 256]
    - [136, 2575.45]
  - - [704, 64, 1, 256]
    - [80, 3495.25]
  - - [960, 64, 1, 256]
    - [7, 4493.9]
  - - [1216, 64, 1, 256]
    - [20, 5774.77]
  - - [1472, 64, 1, 256]
    - [20, 5544.19]
  - - [1728, 64, 1, 256]
    - [19, 6661.54]
  - - [1984, 64, 1, 256]
    - [157, 7304.69]
  - - [64, 192, 1, 256]
    - [80, 1066.35]
  - - [192, 192, 1, 256]
    - [66, 2859.75]
  - - [320, 192, 1, 256]
    - [116, 4695.12]
  - - [448, 192, 1, 256]
    - [31, 5181.2]
  - - [576, 192, 1, 256]
    - [124, 6990.51]
  - - [704, 192, 1, 256]
    - [157, 8047.21]
  - - [832, 192, 1, 256]
    - [157, 9401.03]
  - - [960, 192, 1, 256]
    - [44, 9729.06]
  - - [1088, 192, 1, 256]
    - [120, 10589.6]
  - - [1216, 192, 1, 256]
    - [120, 11719.4]
  - - [1344, 192, 1, 256]
    - [53, 11292.4]
  - - [1472, 192, 1, 256]
    - [48, 11669.6]
  - - [1600, 192, 1, 256]
    - [30, 12582.9]
  - - [1728, 192, 1, 256]
    - [53, 14155.8]
  - - [1856, 192, 1, 256]
    - [48, 14596.2]
  - - [1984, 192, 1, 256]
    - [128, 13638.8]
  - - [192, 320, 1, 256]
    - [14, 4695.12]
  - - [448, 320, 1, 256]
    - [158, 8247.23]
  - - [704, 320, 1, 256]
    - [157, 10779.8]
  - - [960, 320, 1, 256]
    - [100, 12684.4]
  - - [1216, 320, 1, 256]
    - [93, 13645.9]
  - - [1472, 320, 1, 256]
    - [93, 15866.6]
  - - [64, 448, 1, 256]
    - [7, 2406.57]
  - - [192, 448, 1, 256]
    - [13, 5306.05]
  - - [320, 448, 1, 256]
    - [157, 8534.92]
  - - [448, 448, 1, 256]
    - [36, 9603.78]
  - - [576, 448, 1, 256]
    - [57, 10741.5]
  - - [704, 448, 1, 256]
    - [53, 12326.8]
  - - [832, 448, 1, 256]
    - [134, 12722.7]
  - - [960, 448, 1, 256]
    - [73, 14582.8]
  - - [1088, 448, 1, 256]
    - [53, 15217.1]
  - - [192, 576, 1, 256]
    - [31, 6905.26]
  - - [448, 576, 1, 256]
    - [48, 10919.1]
  - - [704, 576, 1, 256]
    - [157, 14220.4]
  - - [64, 704, 1, 256]
    - [10, 3295.52]
  - - [192, 704, 1, 256]
    - [157, 7954.71]
  - - [320, 704, 1, 256]
    - [157, 10779.8]
  - - [448, 704, 1, 256]
    - [157, 12615.7]
  - - [576, 704, 1, 256]
    - [157, 14220.4]
  - - [192, 832, 1, 256]
    - [157, 9622.23]
  - - [448, 832, 1, 256]
    - [134, 13071.3]
  - - [64, 960, 1, 256]
    - [141, 4993.22]
  - - [192, 960, 1, 256]
    - [69, 9729.06]
  - - [320, 960, 1, 256]
    - [47, 12998.9]
  - - [448, 960, 1, 256]
    - [48, 14582.8]
  - - [192, 1088, 1, 256]
    - [159, 9903.22]
  - - [448, 1088, 1, 256]
    - [53, 15695.7]
  - - [64, 1216, 1, 256]
    - [112, 5612.1]
  - - [192, 1216, 1, 256]
    - [157, 11277.1]
  - - [320, 1216, 1, 256]
    - [134, 13461.4]
  - - [192, 1344, 1, 256]
    - [47, 11010.0]
  - - [64, 1472, 1, 256]
    - [19, 5742.2]
  - - [192, 1472, 1, 256]
    - [134, 10962.4]
  - - [320, 1472, 1, 256]
    - [47, 15073.3]
  - - [192, 1600, 1, 256]
    - [53, 12099.0]
  - - [64, 1728, 1, 256]
    - [69, 6822.06]
  - - [192, 1728, 1, 256]
    - [53, 14395.7]
  - - [192, 1856, 1, 256]
    - [53, 13822.1]
  - - [64, 1984, 1, 256]
    - [157, 7472.61]
  - - [192, 1984, 1, 256]
    - [157, 13089.6]
  - - [192, 64, 1, 512]
    - [14, 2062.77]
  - - [448, 64, 1, 512]
    - [80, 3967.58]
  - - [704, 64, 1, 512]
    - [141, 5070.04]
  - - [960, 64, 1, 512]
    - [27, 6838.54]
  - - [1216, 64, 1, 512]
    - [157, 8477.85]
  - - [1472, 64, 1, 512]
    - [20, 8316.29]
  - - [1728, 64, 1, 512]
    - [27, 10021.8]
  - - [1984, 64, 1, 512]
    - [158, 10571.0]
  - - [64, 192, 1, 512]
    - [138, 2097.15]
  - - [192, 192, 1, 512]
    - [10, 4778.32]
  - - [320, 192, 1, 512]
    - [116, 7315.65]
  - - [448, 192, 1, 512]
    - [31, 7794.72]
  - - [576, 192, 1, 512]
    - [120, 10295.1]
  - - [704, 192, 1, 512]
    - [83, 11162.3]
  - - [832, 192, 1, 512]
    - [158, 13086.2]
  - - [960, 192, 1, 512]
    - [47, 13198.9]
  - - [1088, 192, 1, 512]
    - [47, 15279.3]
  - - [1216, 192, 1, 512]
    - [47, 16602.5]
  - - [192, 320, 1, 512]
    - [27, 6765.01]
  - - [448, 320, 1, 512]
    - [157, 12032.8]
  - - [704, 320, 1, 512]
    - [128, 14600.4]
  - - [64, 448, 1, 512]
    - [141, 4021.94]
  - - [192, 448, 1, 512]
    - [27, 7593.14]
  - - [320, 448, 1, 512]
    - [158, 11744.1]
  - - [448, 448, 1, 512]
    - [36, 13886.5]
  - - [192, 576, 1, 512]
    - [27, 9847.5]
  - - [64, 704, 1, 512]
    - [69, 5070.04]
  - - [192, 704, 1, 512]
    - [158, 11253.0]
  - - [320, 704, 1, 512]
    - [47, 15277.3]
  - - [192, 832, 1, 512]
    - [158, 13086.2]
  - - [64, 960, 1, 512]
    - [116, 7149.38]
  - - [192, 960, 1, 512]
    - [47, 13198.9]
  - - [192, 1088, 1, 512]
    - [47, 14073.0]
  - - [64, 1216, 1, 512]
    - [112, 8215.65]
  - - [192, 1216, 1, 512]
    - [47, 15524.4]
  - - [64, 1472, 1, 512]
    - [44, 8175.34]
  - - [64, 1728, 1, 512]
    - [31, 9933.88]
  - - [64, 1984, 1, 512]
    - [102, 9631.36]
  - - [192, 64, 1, 1024]
    - [10, 3069.0]
  - - [448, 64, 1, 1024]
    - [26, 5539.65]
  - - [704, 64, 1, 1024]
    - [27, 6784.9]
  - - [960, 64, 1, 1024]
    - [27, 9320.68]
  - - [1216, 64, 1, 1024]
    - [158, 11303.8]
  - - [1472, 64, 1, 1024]
    - [27, 10601.0]
  - - [1728, 64, 1, 1024]
    - [27, 12724.3]
  - - [64, 192, 1, 1024]
    - [80, 3185.55]
  - - [192, 192, 1, 1024]
    - [81, 7122.4]
  - - [320, 192, 1, 1024]
    - [69, 10066.3]
  - - [448, 192, 1, 1024]
    - [51, 11010.0]
  - - [576, 192, 1, 1024]
    - [120, 13245.2]
  - - [192, 320, 1, 1024]
    - [27, 9460.84]
  - - [64, 448, 1, 1024]
    - [112, 5701.0]
  - - [192, 448, 1, 1024]
    - [55, 10423.7]
  - - [192, 576, 1, 1024]
    - [120, 13168.2]
  - - [64, 704, 1, 1024]
    - [69, 7208.96]
  - - [64, 960, 1, 1024]
    - [69, 9830.4]
  - - [64, 1216, 1, 1024]
    - [20, 10696.9]
  - - [64, 1472, 1, 1024]
    - [44, 10839.2]
  - - [64, 1728, 1, 1024]
    - [47, 12868.9]
  - - [192, 64, 1, 2048]
    - [26, 4376.67]
  - - [448, 64, 1, 2048]
    - [29, 8270.46]
  - - [704, 64, 1, 2048]
    - [55, 9611.95]
  - - [64, 192, 1, 2048]
    - [26, 4415.06]
  - - [192, 192, 1, 2048]
    - [55, 9679.16]
  - - [64, 448, 1, 2048]
    - [51, 7777.52]
  - - [64, 704, 1, 2048]
    - [51, 10310.0]
  - - [192, 64, 1, 4096]
    - [29, 6494.41]
  - - [448, 64, 1, 4096]
    - [29, 11292.4]
  - - [64, 192, 1, 4096]
    - [64, 5818.69]
  - - [64, 448, 1, 4096]
    - [51, 10975.7]
  - - [128, 64, 1, 64]
    - [141, 223.101]
  - - [256, 64, 1, 64]
    - [61, 476.625]
  - - [384, 64, 1, 64]
    - [146, 699.051]
  - - [512, 64, 1, 64]
    - [142, 892.405]
  - - [640, 64, 1, 64]
    - [15, 1092.27]
  - - [768, 64, 1, 64]
    - [135, 1233.62]
  - - [896, 64, 1, 64]
    - [20, 1439.22]
  - - [1024, 64, 1, 64]
    - [19, 1644.83]
  - - [64, 128, 1, 64]
    - [15, 243.855]
  - - [128, 128, 1, 64]
    - [14, 487.71]
  - - [192, 128, 1, 64]
    - [151, 683.854]
  - - [256, 128, 1, 64]
    - [14, 932.068]
  - - [320, 128, 1, 64]
    - [22, 1115.51]
  - - [384, 128, 1, 64]
    - [20, 1209.9]
  - - [448, 128, 1, 64]
    - [14, 1439.22]
  - - [512, 128, 1, 64]
    - [22, 1553.45]
  - - [576, 128, 1, 64]
    - [82, 1715.85]
  - - [640, 128, 1, 64]
    - [20, 2016.49]
  - - [704, 128, 1, 64]
    - [19, 1988.68]
  - - [768, 128, 1, 64]
    - [27, 2246.95]
  - - [832, 128, 1, 64]
    - [20, 2434.19]
  - - [896, 128, 1, 64]
    - [144, 2531.05]
  - - [960, 128, 1, 64]
    - [19, 2759.41]
  - - [1024, 128, 1, 64]
    - [134, 2796.2]
  - - [128, 192, 1, 64]
    - [138, 699.051]
  - - [256, 192, 1, 64]
    - [141, 1258.29]
  - - [384, 192, 1, 64]
    - [20, 1850.43]
  - - [512, 192, 1, 64]
    - [69, 2246.95]
  - - [640, 192, 1, 64]
    - [69, 2808.69]
  - - [768, 192, 1, 64]
    - [77, 3145.73]
  - - [896, 192, 1, 64]
    - [33, 3191.32]
  - - [1024, 192, 1, 64]
    - [89, 3813.0]
  - - [64, 256, 1, 64]
    - [113, 476.625]
  - - [128, 256, 1, 64]
    - [14, 892.405]
  - - [192, 256, 1, 64]
    - [80, 1258.29]
  - - [256, 256, 1, 64]
    - [21, 1613.19]
  - - [320, 256, 1, 64]
    - [20, 2056.03]
  - - [384, 256, 1, 64]
    - [20, 2246.95]
  - - [448, 256, 1, 64]
    - [20, 2575.45]
  - - [512, 256, 1, 64]
    - [89, 2843.6]
  - - [576, 256, 1, 64]
    - [134, 3145.73]
  - - [640, 256, 1, 64]
    - [20, 3276.8]
  - - [704, 256, 1, 64]
    - [20, 3443.09]
  - - [768, 256, 1, 64]
    - [128, 3871.67]
  - - [832, 256, 1, 64]
    - [158, 4009.26]
  - - [896, 256, 1, 64]
    - [89, 4448.5]
  - - [960, 256, 1, 64]
    - [158, 4309.22]
  - - [1024, 256, 1, 64]
    - [93, 4534.38]
  - - [128, 320, 1, 64]
    - [10, 1092.27]
  - - [256, 320, 1, 64]
    - [20, 1941.81]
  - - [384, 320, 1, 64]
    - [20, 2808.69]
  - - [512, 320, 1, 64]
    - [134, 3554.49]
  - - [640, 320, 1, 64]
    - [30, 4032.98]
  - - [768, 320, 1, 64]
    - [157, 4626.07]
  - - [896, 320, 1, 64]
    - [92, 4959.48]
  - - [1024, 320, 1, 64]
    - [89, 5518.82]
  - - [64, 384, 1, 64]
    - [14, 683.854]
  - - [128, 384, 1, 64]
    - [31, 1258.29]
  - - [192, 384, 1, 64]
    - [20, 1780.6]
  - - [256, 384, 1, 64]
    - [20, 2246.95]
  - - [320, 384, 1, 64]
    - [20, 2759.41]
  - - [384, 384, 1, 64]
    - [157, 3199.05]
  - - [448, 384, 1, 64]
    - [117, 3495.25]
  - - [512, 384, 1, 64]
    - [20, 3700.86]
  - - [576, 384, 1, 64]
    - [134, 4163.46]
  - - [640, 384, 1, 64]
    - [128, 4695.12]
  - - [704, 384, 1, 64]
    - [109, 4613.73]
  - - [768, 384, 1, 64]
    - [105, 5101.18]
  - - [832, 384, 1, 64]
    - [109, 5380.85]
  - - [896, 384, 1, 64]
    - [121, 5646.18]
  - - [960, 384, 1, 64]
    - [47, 6208.67]
  - - [1024, 384, 1, 64]
    - [134, 6138.01]
  - - [128, 448, 1, 64]
    - [17, 1384.91]
  - - [256, 448, 1, 64]
    - [20, 2575.45]
  - - [384, 448, 1, 64]
    - [20, 3238.25]
  - - [512, 448, 1, 64]
    - [89, 4382.11]
  - - [640, 448, 1, 64]
    - [30, 4959.48]
  - - [768, 448, 1, 64]
    - [128, 5306.05]
  - - [896, 448, 1, 64]
    - [96, 6116.69]
  - - [1024, 448, 1, 64]
    - [93, 6908.27]
  - - [64, 512, 1, 64]
    - [65, 838.861]
  - - [128, 512, 1, 64]
    - [85, 1644.83]
  - - [192, 512, 1, 64]
    - [13, 2169.47]
  - - [256, 512, 1, 64]
    - [133, 2843.6]
  - - [320, 512, 1, 64]
    - [158, 3495.25]
  - - [384, 512, 1, 64]
    - [20, 3647.22]
  - - [448, 512, 1, 64]
    - [159, 4021.94]
  - - [512, 512, 1, 64]
    - [78, 4596.5]
  - - [576, 512, 1, 64]
    - [109, 5101.18]
  - - [640, 512, 1, 64]
    - [93, 5518.82]
  - - [704, 512, 1, 64]
    - [134, 5626.51]
  - - [768, 512, 1, 64]
    - [128, 5991.86]
  - - [832, 512, 1, 64]
    - [109, 6196.13]
  - - [896, 512, 1, 64]
    - [156, 6827.94]
  - - [960, 512, 1, 64]
    - [109, 7315.65]
  - - [1024, 512, 1, 64]
    - [87, 6847.84]
  - - [128, 576, 1, 64]
    - [85, 1715.85]
  - - [256, 576, 1, 64]
    - [83, 3199.05]
  - - [384, 576, 1, 64]
    - [128, 4225.6]
  - - [512, 576, 1, 64]
    - [48, 5033.16]
  - - [640, 576, 1, 64]
    - [47, 6376.48]
  - - [768, 576, 1, 64]
    - [96, 6740.85]
  - - [896, 576, 1, 64]
    - [74, 6740.85]
  - - [1024, 576, 1, 64]
    - [96, 7626.01]
  - - [64, 640, 1, 64]
    - [135, 1092.27]
  - - [128, 640, 1, 64]
    - [20, 2016.49]
  - - [192, 640, 1, 64]
    - [20, 2759.41]
  - - [256, 640, 1, 64]
    - [83, 3554.49]
  - - [320, 640, 1, 64]
    - [20, 3971.88]
  - - [384, 640, 1, 64]
    - [127, 4493.9]
  - - [448, 640, 1, 64]
    - [43, 4959.48]
  - - [512, 640, 1, 64]
    - [139, 5447.15]
  - - [576, 640, 1, 64]
    - [59, 6049.48]
  - - [640, 640, 1, 64]
    - [134, 6393.76]
  - - [704, 640, 1, 64]
    - [109, 6628.93]
  - - [768, 640, 1, 64]
    - [100, 7489.83]
  - - [832, 640, 1, 64]
    - [95, 6815.74]
  - - [896, 640, 1, 64]
    - [94, 7414.17]
  - - [960, 640, 1, 64]
    - [72, 8024.82]
  - - [1024, 640, 1, 64]
    - [91, 8305.55]
  - - [128, 704, 1, 64]
    - [155, 1988.68]
  - - [256, 704, 1, 64]
    - [20, 3443.09]
  - - [384, 704, 1, 64]
    - [27, 4493.9]
  - - [512, 704, 1, 64]
    - [107, 5558.72]
  - - [640, 704, 1, 64]
    - [94, 6948.4]
  - - [768, 704, 1, 64]
    - [87, 6719.03]
  - - [896, 704, 1, 64]
    - [94, 8155.59]
  - - [1024, 704, 1, 64]
    - [139, 8388.61]
  - - [64, 768, 1, 64]
    - [8, 1187.07]
  - - [128, 768, 1, 64]
    - [20, 2287.8]
  - - [192, 768, 1, 64]
    - [134, 3094.16]
  - - [256, 768, 1, 64]
    - [134, 3813.0]
  - - [320, 768, 1, 64]
    - [134, 4695.12]
  - - [384, 768, 1, 64]
    - [93, 5101.18]
  - - [448, 768, 1, 64]
    - [122, 5646.18]
  - - [512, 768, 1, 64]
    - [100, 5991.86]
  - - [576, 768, 1, 64]
    - [73, 6584.08]
  - - [640, 768, 1, 64]
    - [96, 7401.71]
  - - [704, 768, 1, 64]
    - [109, 6852.08]
  - - [768, 768, 1, 64]
    - [72, 7864.32]
  - - [832, 768, 1, 64]
    - [109, 7503.57]
  - - [896, 768, 1, 64]
    - [74, 8635.33]
  - - [960, 768, 1, 64]
    - [72, 8903.0]
  - - [1024, 768, 1, 64]
    - [106, 8987.79]
  - - [128, 832, 1, 64]
    - [22, 2350.26]
  - - [256, 832, 1, 64]
    - [133, 4130.75]
  - - [384, 832, 1, 64]
    - [93, 5310.97]
  - - [512, 832, 1, 64]
    - [104, 6340.23]
  - - [640, 832, 1, 64]
    - [93, 6884.59]
  - - [768, 832, 1, 64]
    - [93, 8178.89]
  - - [896, 832, 1, 64]
    - [96, 8754.17]
  - - [1024, 832, 1, 64]
    - [127, 8018.52]
  - - [64, 896, 1, 64]
    - [11, 1334.55]
  - - [128, 896, 1, 64]
    - [20, 2621.44]
  - - [192, 896, 1, 64]
    - [13, 3387.71]
  - - [256, 896, 1, 64]
    - [89, 4448.5]
  - - [320, 896, 1, 64]
    - [30, 4893.35]
  - - [384, 896, 1, 64]
    - [59, 5306.05]
  - - [448, 896, 1, 64]
    - [134, 6265.88]
  - - [512, 896, 1, 64]
    - [87, 6452.78]
  - - [576, 896, 1, 64]
    - [72, 6881.28]
  - - [640, 896, 1, 64]
    - [92, 7196.11]
  - - [704, 896, 1, 64]
    - [109, 7763.5]
  - - [768, 896, 1, 64]
    - [72, 9080.45]
  - - [832, 896, 1, 64]
    - [95, 8225.9]
  - - [896, 896, 1, 64]
    - [75, 8935.69]
  - - [960, 896, 1, 64]
    - [72, 8879.07]
  - - [1024, 896, 1, 64]
    - [75, 8764.22]
  - - [128, 960, 1, 64]
    - [32, 2665.87]
  - - [256, 960, 1, 64]
    - [128, 4766.25]
  - - [384, 960, 1, 64]
    - [36, 6208.67]
  - - [512, 960, 1, 64]
    - [87, 7489.83]
  - - [640, 960, 1, 64]
    - [92, 7710.12]
  - - [768, 960, 1, 64]
    - [74, 9532.51]
  - - [896, 960, 1, 64]
    - [74, 9410.3]
  - - [1024, 960, 1, 64]
    - [74, 10313.9]
  - - [64, 1024, 1, 64]
    - [155, 1613.19]
  - - [128, 1024, 1, 64]
    - [77, 2843.6]
  - - [192, 1024, 1, 64]
    - [158, 3756.09]
  - - [256, 1024, 1, 64]
    - [94, 4534.38]
  - - [320, 1024, 1, 64]
    - [109, 5309.25]
  - - [384, 1024, 1, 64]
    - [128, 5785.25]
  - - [448, 1024, 1, 64]
    - [109, 6749.45]
  - - [512, 1024, 1, 64]
    - [139, 6710.89]
  - - [576, 1024, 1, 64]
    - [72, 7549.75]
  - - [640, 1024, 1, 64]
    - [96, 8305.55]
  - - [704, 1024, 1, 64]
    - [109, 8165.9]
  - - [768, 1024, 1, 64]
    - [88, 9068.77]
  - - [832, 1024, 1, 64]
    - [109, 7734.18]
  - - [896, 1024, 1, 64]
    - [133, 8448.96]
  - - [960, 1024, 1, 64]
    - [72, 10147.5]
  - - [1024, 1024, 1, 64]
    - [97, 8548.9]
  - - [128, 64, 1, 256]
    - [14, 838.861]
  - - [256, 64, 1, 256]
    - [80, 1446.31]
  - - [384, 64, 1, 256]
    - [135, 1997.29]
  - - [512, 64, 1, 256]
    - [14, 2892.62]
  - - [640, 64, 1, 256]
    - [141, 3744.91]
  - - [768, 64, 1, 256]
    - [14, 3700.86]
  - - [896, 64, 1, 256]
    - [85, 4255.09]
  - - [1024, 64, 1, 256]
    - [84, 4862.96]
  - - [64, 128, 1, 256]
    - [138, 855.98]
  - - [128, 128, 1, 256]
    - [10, 1582.76]
  - - [192, 128, 1, 256]
    - [7, 2132.7]
  - - [256, 128, 1, 256]
    - [14, 2843.6]
  - - [320, 128, 1, 256]
    - [82, 3615.78]
  - - [384, 128, 1, 256]
    - [7, 3647.22]
  - - [448, 128, 1, 256]
    - [62, 4317.67]
  - - [512, 128, 1, 256]
    - [20, 4862.96]
  - - [576, 128, 1, 256]
    - [158, 5242.88]
  - - [640, 128, 1, 256]
    - [81, 5991.86]
  - - [704, 128, 1, 256]
    - [27, 5558.72]
  - - [768, 128, 1, 256]
    - [27, 6291.46]
  - - [832, 128, 1, 256]
    - [19, 6491.18]
  - - [896, 128, 1, 256]
    - [20, 7074.73]
  - - [960, 128, 1, 256]
    - [13, 7580.07]
  - - [1024, 128, 1, 256]
    - [158, 7989.15]
  - - [128, 192, 1, 256]
    - [141, 2246.95]
  - - [256, 192, 1, 256]
    - [116, 3813.0]
  - - [384, 192, 1, 256]
    - [81, 5392.68]
  - - [512, 192, 1, 256]
    - [76, 6213.78]
  - - [640, 192, 1, 256]
    - [31, 7963.87]
  - - [768, 192, 1, 256]
    - [128, 8677.87]
  - - [896, 192, 1, 256]
    - [69, 9080.45]
  - - [1024, 192, 1, 256]
    - [47, 10596.1]
  - - [64, 256, 1, 256]
    - [135, 1613.19]
  - - [128, 256, 1, 256]
    - [112, 2892.62]
  - - [192, 256, 1, 256]
    - [61, 3595.12]
  - - [320, 256, 1, 256]
    - [20, 5991.86]
  - - [384, 256, 1, 256]
    - [20, 6138.01]
  - - [448, 256, 1, 256]
    - [27, 6990.51]
  - - [512, 256, 1, 256]
    - [83, 8184.01]
  - - [576, 256, 1, 256]
    - [157, 8882.06]
  - - [640, 256, 1, 256]
    - [157, 9642.08]
  - - [704, 256, 1, 256]
    - [157, 8788.07]
  - - [768, 256, 1, 256]
    - [134, 9407.78]
  - - [832, 256, 1, 256]
    - [157, 10191.8]
  - - [896, 256, 1, 256]
    - [133, 11079.3]
  - - [960, 256, 1, 256]
    - [158, 11759.7]
  - - [1024, 256, 1, 256]
    - [100, 12091.7]
  - - [128, 320, 1, 256]
    - [112, 3554.49]
  - - [256, 320, 1, 256]
    - [83, 5907.47]
  - - [384, 320, 1, 256]
    - [27, 7767.23]
  - - [512, 320, 1, 256]
    - [84, 9754.2]
  - - [640, 320, 1, 256]
    - [89, 10180.3]
  - - [768, 320, 1, 256]
    - [128, 11983.7]
  - - [896, 320, 1, 256]
    - [78, 12655.2]
  - - [1024, 320, 1, 256]
    - [104, 14716.9]
  - - [64, 384, 1, 256]
    - [14, 2132.7]
  - - [128, 384, 1, 256]
    - [69, 3700.86]
  - - [192, 384, 1, 256]
    - [20, 5392.68]
  - - [256, 384, 1, 256]
    - [31, 6371.09]
  - - [320, 384, 1, 256]
    - [69, 7672.51]
  - - [384, 384, 1, 256]
    - [83, 8987.79]
  - - [448, 384, 1, 256]
    - [69, 8720.83]
  - - [512, 384, 1, 256]
    - [121, 9966.66]
  - - [576, 384, 1, 256]
    - [47, 11102.6]
  - - [640, 384, 1, 256]
    - [47, 12972.1]
  - - [704, 384, 1, 256]
    - [95, 11345.2]
  - - [768, 384, 1, 256]
    - [47, 13016.8]
  - - [832, 384, 1, 256]
    - [47, 13086.2]
  - - [896, 384, 1, 256]
    - [36, 14092.9]
  - - [960, 384, 1, 256]
    - [53, 16271.0]
  - - [1024, 384, 1, 256]
    - [74, 14695.4]
  - - [128, 448, 1, 256]
    - [7, 4255.09]
  - - [256, 448, 1, 256]
    - [20, 6990.51]
  - - [384, 448, 1, 256]
    - [28, 8720.83]
  - - [512, 448, 1, 256]
    - [134, 10874.1]
  - - [640, 448, 1, 256]
    - [105, 12765.3]
  - - [768, 448, 1, 256]
    - [53, 13447.4]
  - - [896, 448, 1, 256]
    - [94, 14372.1]
  - - [1024, 448, 1, 256]
    - [93, 16425.2]
  - - [64, 512, 1, 256]
    - [10, 2843.6]
  - - [128, 512, 1, 256]
    - [84, 4793.49]
  - - [192, 512, 1, 256]
    - [19, 5991.86]
  - - [256, 512, 1, 256]
    - [128, 7989.15]
  - - [320, 512, 1, 256]
    - [158, 9320.68]
  - - [384, 512, 1, 256]
    - [83, 9496.54]
  - - [448, 512, 1, 256]
    - [157, 11079.3]
  - - [512, 512, 1, 256]
    - [88, 11773.5]
  - - [576, 512, 1, 256]
    - [73, 12079.6]
  - - [640, 512, 1, 256]
    - [90, 14339.5]
  - - [704, 512, 1, 256]
    - [59, 12905.6]
  - - [768, 512, 1, 256]
    - [73, 15486.7]
  - - [832, 512, 1, 256]
    - [109, 14348.9]
  - - [896, 512, 1, 256]
    - [100, 16311.2]
  - - [128, 576, 1, 256]
    - [19, 5171.06]
  - - [256, 576, 1, 256]
    - [84, 8987.79]
  - - [384, 576, 1, 256]
    - [36, 11674.9]
  - - [512, 576, 1, 256]
    - [93, 13016.8]
  - - [640, 576, 1, 256]
    - [36, 14861.7]
  - - [768, 576, 1, 256]
    - [74, 16294.4]
  - - [64, 640, 1, 256]
    - [112, 3495.25]
  - - [128, 640, 1, 256]
    - [112, 5991.86]
  - - [192, 640, 1, 256]
    - [27, 7315.65]
  - - [256, 640, 1, 256]
    - [83, 9532.51]
  - - [320, 640, 1, 256]
    - [157, 9986.44]
  - - [384, 640, 1, 256]
    - [128, 12336.2]
  - - [448, 640, 1, 256]
    - [95, 11838.8]
  - - [512, 640, 1, 256]
    - [93, 14847.1]
  - - [576, 640, 1, 256]
    - [73, 15099.5]
  - - [640, 640, 1, 256]
    - [92, 14665.4]
  - - [704, 640, 1, 256]
    - [109, 15077.6]
  - - [128, 704, 1, 256]
    - [7, 5492.54]
  - - [256, 704, 1, 256]
    - [128, 8958.71]
  - - [384, 704, 1, 256]
    - [156, 12035.8]
  - - [512, 704, 1, 256]
    - [36, 13981.0]
  - - [640, 704, 1, 256]
    - [92, 16245.5]
  - - [64, 768, 1, 256]
    - [14, 3700.86]
  - - [128, 768, 1, 256]
    - [120, 6213.78]
  - - [192, 768, 1, 256]
    - [158, 8206.25]
  - - [256, 768, 1, 256]
    - [120, 9868.95]
  - - [320, 768, 1, 256]
    - [47, 12099.0]
  - - [384, 768, 1, 256]
    - [87, 13245.2]
  - - [448, 768, 1, 256]
    - [47, 13981.0]
  - - [512, 768, 1, 256]
    - [79, 14483.9]
  - - [576, 768, 1, 256]
    - [73, 18119.4]
  - - [128, 832, 1, 256]
    - [128, 6414.82]
  - - [256, 832, 1, 256]
    - [128, 10287.9]
  - - [384, 832, 1, 256]
    - [100, 14605.2]
  - - [512, 832, 1, 256]
    - [88, 15468.4]
  - - [64, 896, 1, 256]
    - [10, 4194.3]
  - - [128, 896, 1, 256]
    - [131, 7074.73]
  - - [192, 896, 1, 256]
    - [27, 8635.33]
  - - [256, 896, 1, 256]
    - [157, 11079.3]
  - - [320, 896, 1, 256]
    - [95, 11744.1]
  - - [384, 896, 1, 256]
    - [73, 13870.9]
  - - [448, 896, 1, 256]
    - [157, 13793.3]
  - - [512, 896, 1, 256]
    - [100, 16198.7]
  - - [128, 960, 1, 256]
    - [31, 7489.83]
  - - [256, 960, 1, 256]
    - [36, 12839.7]
  - - [384, 960, 1, 256]
    - [47, 15345.0]
  - - [64, 1024, 1, 256]
    - [19, 4725.98]
  - - [128, 1024, 1, 256]
    - [84, 7989.15]
  - - [192, 1024, 1, 256]
    - [157, 9496.54]
  - - [256, 1024, 1, 256]
    - [104, 11877.7]
  - - [320, 1024, 1, 256]
    - [109, 13751.8]
  - - [384, 1024, 1, 256]
    - [73, 15852.5]
  - - [448, 1024, 1, 256]
    - [109, 15153.6]
  - - [128, 64, 1, 512]
    - [129, 1446.31]
  - - [256, 64, 1, 512]
    - [141, 2796.2]
  - - [384, 64, 1, 512]
    - [112, 3495.25]
  - - [512, 64, 1, 512]
    - [113, 4194.3]
  - - [640, 64, 1, 512]
    - [112, 5518.82]
  - - [768, 64, 1, 512]
    - [27, 5719.51]
  - - [896, 64, 1, 512]
    - [14, 6524.47]
  - - [1024, 64, 1, 512]
    - [84, 7374.6]
  - - [64, 128, 1, 512]
    - [129, 1375.18]
  - - [128, 128, 1, 512]
    - [14, 2796.2]
  - - [192, 128, 1, 512]
    - [80, 3544.48]
  - - [256, 128, 1, 512]
    - [14, 4534.38]
  - - [320, 128, 1, 512]
    - [10, 5309.25]
  - - [384, 128, 1, 512]
    - [69, 5655.24]
  - - [448, 128, 1, 512]
    - [14, 6181.08]
  - - [512, 128, 1, 512]
    - [102, 7540.32]
  - - [576, 128, 1, 512]
    - [158, 8206.25]
  - - [640, 128, 1, 512]
    - [84, 9118.05]
  - - [704, 128, 1, 512]
    - [69, 8023.89]
  - - [768, 128, 1, 512]
    - [27, 8603.7]
  - - [832, 128, 1, 512]
    - [31, 9241.69]
  - - [896, 128, 1, 512]
    - [77, 10037.7]
  - - [960, 128, 1, 512]
    - [27, 11135.3]
  - - [1024, 128, 1, 512]
    - [77, 11374.4]
  - - [128, 192, 1, 512]
    - [141, 3544.48]
  - - [256, 192, 1, 512]
    - [130, 5655.24]
  - - [384, 192, 1, 512]
    - [84, 8206.25]
  - - [512, 192, 1, 512]
    - [31, 9320.68]
  - - [640, 192, 1, 512]
    - [120, 11439.0]
  - - [768, 192, 1, 512]
    - [84, 12905.6]
  - - [896, 192, 1, 512]
    - [36, 12673.4]
  - - [1024, 192, 1, 512]
    - [47, 14483.9]
  - - [64, 256, 1, 512]
    - [10, 2706.0]
  - - [128, 256, 1, 512]
    - [7, 4415.06]
  - - [192, 256, 1, 512]
    - [69, 5592.41]
  - - [256, 256, 1, 512]
    - [84, 7374.6]
  - - [320, 256, 1, 512]
    - [157, 8738.13]
  - - [384, 256, 1, 512]
    - [27, 8677.87]
  - - [448, 256, 1, 512]
    - [27, 9705.83]
  - - [512, 256, 1, 512]
    - [83, 11184.8]
  - - [576, 256, 1, 512]
    - [157, 12079.6]
  - - [640, 256, 1, 512]
    - [83, 13640.0]
  - - [704, 256, 1, 512]
    - [36, 12640.4]
  - - [768, 256, 1, 512]
    - [73, 13695.7]
  - - [832, 256, 1, 512]
    - [47, 13981.0]
  - - [896, 256, 1, 512]
    - [128, 15056.5]
  - - [128, 320, 1, 512]
    - [7, 5518.82]
  - - [256, 320, 1, 512]
    - [102, 9218.25]
  - - [384, 320, 1, 512]
    - [27, 10663.5]
  - - [512, 320, 1, 512]
    - [83, 13640.0]
  - - [640, 320, 1, 512]
    - [43, 14169.9]
  - - [64, 384, 1, 512]
    - [138, 3355.44]
  - - [128, 384, 1, 512]
    - [69, 5785.25]
  - - [192, 384, 1, 512]
    - [158, 7864.32]
  - - [256, 384, 1, 512]
    - [31, 8987.79]
  - - [320, 384, 1, 512]
    - [44, 11037.6]
  - - [384, 384, 1, 512]
    - [83, 12478.9]
  - - [448, 384, 1, 512]
    - [47, 12318.9]
  - - [512, 384, 1, 512]
    - [36, 14278.5]
  - - [576, 384, 1, 512]
    - [47, 15620.2]
  - - [128, 448, 1, 512]
    - [84, 6382.64]
  - - [256, 448, 1, 512]
    - [31, 10037.7]
  - - [384, 448, 1, 512]
    - [27, 12233.4]
  - - [512, 448, 1, 512]
    - [47, 15763.8]
  - - [64, 512, 1, 512]
    - [62, 4301.85]
  - - [128, 512, 1, 512]
    - [102, 6918.44]
  - - [192, 512, 1, 512]
    - [27, 8753.33]
  - - [256, 512, 1, 512]
    - [131, 11092.4]
  - - [320, 512, 1, 512]
    - [158, 13751.8]
  - - [384, 512, 1, 512]
    - [36, 13981.0]
  - - [448, 512, 1, 512]
    - [157, 14865.9]
  - - [128, 576, 1, 512]
    - [84, 8206.25]
  - - [256, 576, 1, 512]
    - [77, 12276.0]
  - - [384, 576, 1, 512]
    - [36, 15950.2]
  - - [64, 640, 1, 512]
    - [10, 5377.31]
  - - [128, 640, 1, 512]
    - [83, 8648.05]
  - - [192, 640, 1, 512]
    - [27, 11135.3]
  - - [256, 640, 1, 512]
    - [83, 13640.0]
  - - [320, 640, 1, 512]
    - [30, 13797.1]
  - - [128, 704, 1, 512]
    - [44, 7886.73]
  - - [256, 704, 1, 512]
    - [36, 12469.6]
  - - [64, 768, 1, 512]
    - [31, 5719.51]
  - - [128, 768, 1, 512]
    - [120, 9068.77]
  - - [192, 768, 1, 512]
    - [158, 12177.0]
  - - [256, 768, 1, 512]
    - [47, 14588.9]
  - - [128, 832, 1, 512]
    - [31, 9320.68]
  - - [256, 832, 1, 512]
    - [36, 14837.0]
  - - [64, 896, 1, 512]
    - [7, 6452.78]
  - - [128, 896, 1, 512]
    - [69, 9952.59]
  - - [192, 896, 1, 512]
    - [27, 12149.0]
  - - [256, 896, 1, 512]
    - [36, 15870.3]
  - - [128, 960, 1, 512]
    - [44, 10847.3]
  - - [64, 1024, 1, 512]
    - [20, 7294.44]
  - - [128, 1024, 1, 512]
    - [77, 10824.0]
  - - [192, 1024, 1, 512]
    - [73, 13603.1]
  - - [128, 64, 1, 1024]
    - [129, 2178.86]
  - - [256, 64, 1, 1024]
    - [141, 4194.3]
  - - [384, 64, 1, 1024]
    - [141, 4934.48]
  - - [512, 64, 1, 1024]
    - [112, 6579.3]
  - - [640, 64, 1, 1024]
    - [137, 7695.97]
  - - [768, 64, 1, 1024]
    - [27, 7684.22]
  - - [896, 64, 1, 1024]
    - [84, 8572.3]
  - - [1024, 64, 1, 1024]
    - [83, 9942.05]
  - - [64, 128, 1, 1024]
    - [129, 2330.17]
  - - [128, 128, 1, 1024]
    - [137, 4194.3]
  - - [192, 128, 1, 1024]
    - [141, 5033.16]
  - - [256, 128, 1, 1024]
    - [112, 6515.42]
  - - [320, 128, 1, 1024]
    - [7, 7767.23]
  - - [384, 128, 1, 1024]
    - [69, 7989.15]
  - - [448, 128, 1, 1024]
    - [27, 8572.3]
  - - [512, 128, 1, 1024]
    - [102, 9655.95]
  - - [576, 128, 1, 1024]
    - [102, 11021.5]
  - - [640, 128, 1, 1024]
    - [83, 12157.4]
  - - [704, 128, 1, 1024]
    - [37, 10426.5]
  - - [768, 128, 1, 1024]
    - [27, 11247.3]
  - - [832, 128, 1, 1024]
    - [69, 11983.7]
  - - [896, 128, 1, 1024]
    - [27, 12696.3]
  - - [128, 192, 1, 1024]
    - [141, 5033.16]
  - - [256, 192, 1, 1024]
    - [51, 8184.01]
  - - [384, 192, 1, 1024]
    - [83, 11102.6]
  - - [512, 192, 1, 1024]
    - [120, 11912.8]
  - - [64, 256, 1, 1024]
    - [141, 4247.4]
  - - [128, 256, 1, 1024]
    - [81, 6331.02]
  - - [192, 256, 1, 1024]
    - [69, 7864.32]
  - - [256, 256, 1, 1024]
    - [102, 10016.2]
  - - [320, 256, 1, 1024]
    - [102, 12520.3]
  - - [384, 256, 1, 1024]
    - [37, 12055.5]
  - - [448, 256, 1, 1024]
    - [27, 12835.0]
  - - [128, 320, 1, 1024]
    - [81, 8144.28]
  - - [256, 320, 1, 1024]
    - [102, 12157.4]
  - - [64, 384, 1, 1024]
    - [148, 5135.88]
  - - [128, 384, 1, 1024]
    - [69, 8053.06]
  - - [192, 384, 1, 1024]
    - [102, 10862.9]
  - - [256, 384, 1, 1024]
    - [120, 11842.7]
  - - [128, 448, 1, 1024]
    - [69, 8830.11]
  - - [256, 448, 1, 1024]
    - [37, 13121.8]
  - - [64, 512, 1, 1024]
    - [112, 6391.32]
  - - [128, 512, 1, 1024]
    - [84, 9725.92]
  - - [192, 512, 1, 1024]
    - [50, 11637.4]
  - - [128, 576, 1, 1024]
    - [84, 10941.7]
  - - [64, 640, 1, 1024]
    - [112, 7839.82]
  - - [128, 640, 1, 1024]
    - [102, 11814.9]
  - - [128, 704, 1, 1024]
    - [50, 11184.8]
  - - [64, 768, 1, 1024]
    - [69, 8053.06]
  - - [128, 768, 1, 1024]
    - [47, 11773.5]
  - - [128, 832, 1, 1024]
    - [37, 12680.5]
  - - [64, 896, 1, 1024]
    - [14, 8329.11]
  - - [128, 896, 1, 1024]
    - [37, 13576.9]
  - - [64, 1024, 1, 1024]
    - [20, 9130.46]
  - - [128, 64, 1, 2048]
    - [18, 3389.34]
  - - [256, 64, 1, 2048]
    - [26, 5546.19]
  - - [384, 64, 1, 2048]
    - [26, 6942.3]
  - - [512, 64, 1, 2048]
    - [81, 8184.01]
  - - [640, 64, 1, 2048]
    - [136, 11650.8]
  - - [768, 64, 1, 2048]
    - [55, 10431.4]
  - - [896, 64, 1, 2048]
    - [55, 11685.6]
  - - [64, 128, 1, 2048]
    - [68, 3389.34]
  - - [128, 128, 1, 2048]
    - [61, 5639.4]
  - - [192, 128, 1, 2048]
    - [29, 7241.96]
  - - [256, 128, 1, 2048]
    - [81, 8336.5]
  - - [320, 128, 1, 2048]
    - [148, 11814.9]
  - - [384, 128, 1, 2048]
    - [38, 11570.5]
  - - [448, 128, 1, 2048]
    - [55, 11862.7]
  - - [128, 192, 1, 2048]
    - [38, 7568.67]
  - - [256, 192, 1, 2048]
    - [51, 12201.6]
  - - [64, 256, 1, 2048]
    - [140, 5546.19]
  - - [128, 256, 1, 2048]
    - [51, 8285.04]
  - - [192, 256, 1, 2048]
    - [51, 12055.5]
  - - [128, 320, 1, 2048]
    - [38, 9986.44]
  - - [64, 384, 1, 2048]
    - [51, 7401.71]
  - - [128, 384, 1, 2048]
    - [51, 11439.0]
  - - [128, 448, 1, 2048]
    - [38, 12560.5]
  - - [64, 512, 1, 2048]
    - [51, 7895.16]
  - - [64, 640, 1, 2048]
    - [51, 9868.95]
  - - [64, 768, 1, 2048]
    - [51, 10485.8]
  - - [64, 896, 1, 2048]
    - [51, 11292.4]
  - - [128, 64, 1, 4096]
    - [64, 4971.03]
  - - [256, 64, 1, 4096]
    - [68, 7669.58]
  - - [384, 64, 1, 4096]
    - [29, 9541.54]
  - - [64, 128, 1, 4096]
    - [64, 4934.48]
  - - [128, 128, 1, 4096]
    - [26, 7895.16]
  - - [192, 128, 1, 4096]
    - [29, 9820.81]
  - - [128, 192, 1, 4096]
    - [38, 10116.9]
  - - [64, 256, 1, 4096]
    - [26, 7758.25]
  - - [64, 384, 1, 4096]
    - [51, 9773.14]
  - - [1, 1, 1, 1]
    - [11, 0.000344828]
  - - [2, 2, 1, 2]
    - [15, 0.00280702]
  - - [4, 2, 1, 2]
    - [0, 0.00561404]
  - - [6, 2, 1, 2]
    - [17, 0.00842105]
  - - [8, 2, 1, 2]
    - [15, 0.0116364]
  - - [10, 2, 1, 2]
    - [10, 0.0140351]
  - - [12, 2, 1, 2]
    - [15, 0.0174545]
  - - [14, 2, 1, 2]
    - [15, 0.02]
  - - [16, 2, 1, 2]
    - [15, 0.0228571]
  - - [2, 4, 1, 2]
    - [8, 0.00571429]
  - - [4, 4, 1, 2]
    - [40, 0.0114286]
  - - [6, 4, 1, 2]
    - [11, 0.0168421]
  - - [8, 4, 1, 2]
    - [11, 0.0228571]
  - - [10, 4, 1, 2]
    - [17, 0.0275862]
  - - [12, 4, 1, 2]
    - [15, 0.0349091]
  - - [14, 4, 1, 2]
    - [16, 0.0386207]
  - - [16, 4, 1, 2]
    - [8, 0.0457143]
  - - [2, 6, 1, 2]
    - [11, 0.00827586]
  - - [4, 6, 1, 2]
    - [40, 0.0171429]
  - - [6, 6, 1, 2]
    - [0, 0.0248276]
  - - [8, 6, 1, 2]
    - [2, 0.0331034]
  - - [10, 6, 1, 2]
    - [8, 0.0421053]
  - - [12, 6, 1, 2]
    - [15, 0.0533333]
  - - [14, 6, 1, 2]
    - [11, 0.06]
  - - [16, 6, 1, 2]
    - [15, 0.0711111]
  - - [2, 8, 1, 2]
    - [40, 0.0114286]
  - - [4, 8, 1, 2]
    - [40, 0.0224561]
  - - [6, 8, 1, 2]
    - [17, 0.0349091]
  - - [8, 8, 1, 2]
    - [15, 0.0465455]
  - - [10, 8, 1, 2]
    - [15, 0.0581818]
  - - [12, 8, 1, 2]
    - [15, 0.0698182]
  - - [14, 8, 1, 2]
    - [15, 0.08]
  - - [16, 8, 1, 2]
    - [15, 0.0948148]
  - - [2, 10, 1, 2]
    - [8, 0.0140351]
  - - [4, 10, 1, 2]
    - [1, 0.0280702]
  - - [6, 10, 1, 2]
    - [39, 0.0428571]
  - - [8, 10, 1, 2]
    - [11, 0.0542373]
  - - [10, 10, 1, 2]
    - [15, 0.0740741]
  - - [12, 10, 1, 2]
    - [11, 0.0872727]
  - - [14, 10, 1, 2]
    - [17, 0.1]
  - - [16, 10, 1, 2]
    - [39, 0.114286]
  - - [2, 12, 1, 2]
    - [11, 0.0168421]
  - - [4, 12, 1, 2]
    - [15, 0.0336842]
  - - [6, 12, 1, 2]
    - [11, 0.0496552]
  - - [8, 12, 1, 2]
    - [10, 0.0650847]
  - - [10, 12, 1, 2]
    - [15, 0.0872727]
  - - [12, 12, 1, 2]
    - [15, 0.104727]
  - - [14, 12, 1, 2]
    - [0, 0.113898]
  - - [16, 12, 1, 2]
    - [10, 0.139636]
  - - [2, 14, 1, 2]
    - [17, 0.0193103]
  - - [4, 14, 1, 2]
    - [8, 0.0386207]
  - - [6, 14, 1, 2]
    - [8, 0.0569492]
  - - [8, 14, 1, 2]
    - [15, 0.082963]
  - - [10, 14, 1, 2]
    - [15, 0.103704]
  - - [12, 14, 1, 2]
    - [15, 0.12]
  - - [14, 14, 1, 2]
    - [15, 0.14]
  - - [16, 14, 1, 2]
    - [14, 0.154483]
  - - [2, 16, 1, 2]
    - [8, 0.0216949]
  - - [4, 16, 1, 2]
    - [2, 0.0441379]
  - - [6, 16, 1, 2]
    - [15, 0.0650847]
  - - [8, 16, 1, 2]
    - [15, 0.0898246]
  - - [10, 16, 1, 2]
    - [11, 0.114286]
  - - [12, 16, 1, 2]
    - [11, 0.137143]
  - - [14, 16, 1, 2]
    - [17, 0.157193]
  - - [16, 16, 1, 2]
    - [15, 0.179649]
  - - [2, 2, 1, 4]
    - [40, 0.00561404]
  - - [4, 2, 1, 4]
    - [17, 0.0110345]
  - - [6, 2, 1, 4]
    - [8, 0.0168421]
  - - [8, 2, 1, 4]
    - [14, 0.0232727]
  - - [10, 2, 1, 4]
    - [11, 0.0290909]
  - - [12, 2, 1, 4]
    - [15, 0.0349091]
  - - [14, 2, 1, 4]
    - [11, 0.04]
  - - [16, 2, 1, 4]
    - [15, 0.0457143]
  - - [2, 4, 1, 4]
    - [17, 0.0116364]
  - - [4, 4, 1, 4]
    - [0, 0.0237037]
  - - [6, 4, 1, 4]
    - [15, 0.0336842]
  - - [8, 4, 1, 4]
    - [11, 0.0457143]
  - - [10, 4, 1, 4]
    - [15, 0.0581818]
  - - [12, 4, 1, 4]
    - [15, 0.0711111]
  - - [14, 4, 1, 4]
    - [15, 0.0814545]
  - - [16, 4, 1, 4]
    - [11, 0.0867797]
  - - [2, 6, 1, 4]
    - [40, 0.0171429]
  - - [4, 6, 1, 4]
    - [11, 0.0336842]
  - - [6, 6, 1, 4]
    - [15, 0.0505263]
  - - [8, 6, 1, 4]
    - [11, 0.0673684]
  - - [10, 6, 1, 4]
    - [17, 0.0857143]
  - - [12, 6, 1, 4]
    - [2, 0.0993103]
  - - [14, 6, 1, 4]
    - [15, 0.122182]
  - - [16, 6, 1, 4]
    - [15, 0.137143]
  - - [2, 8, 1, 4]
    - [11, 0.0224561]
  - - [4, 8, 1, 4]
    - [17, 0.0465455]
  - - [6, 8, 1, 4]
    - [8, 0.0662069]
  - - [8, 8, 1, 4]
    - [15, 0.0930909]
  - - [10, 8, 1, 4]
    - [15, 0.116364]
  - - [12, 8, 1, 4]
    - [15, 0.137143]
  - - [14, 8, 1, 4]
    - [11, 0.154483]
  - - [16, 8, 1, 4]
    - [15, 0.186182]
  - - [2, 10, 1, 4]
    - [8, 0.0275862]
  - - [4, 10, 1, 4]
    - [39, 0.0592593]
  - - [6, 10, 1, 4]
    - [17, 0.0827586]
  - - [8, 10, 1, 4]
    - [11, 0.116364]
  - - [10, 10, 1, 4]
    - [2, 0.137931]
  - - [12, 10, 1, 4]
    - [15, 0.174545]
  - - [14, 10, 1, 4]
    - [15, 0.203636]
  - - [16, 10, 1, 4]
    - [8, 0.224561]
  - - [2, 12, 1, 4]
    - [8, 0.0331034]
  - - [4, 12, 1, 4]
    - [17, 0.0685714]
  - - [6, 12, 1, 4]
    - [15, 0.101053]
  - - [8, 12, 1, 4]
    - [150, 0.132414]
  - - [10, 12, 1, 4]
    - [17, 0.174545]
  - - [12, 12, 1, 4]
    - [15, 0.205714]
  - - [14, 12, 1, 4]
    - [15, 0.244364]
  - - [16, 12, 1, 4]
    - [11, 0.269474]
  - - [2, 14, 1, 4]
    - [8, 0.0392982]
  - - [4, 14, 1, 4]
    - [39, 0.0785965]
  - - [6, 14, 1, 4]
    - [8, 0.115862]
  - - [8, 14, 1, 4]
    - [17, 0.16]
  - - [10, 14, 1, 4]
    - [11, 0.203636]
  - - [12, 14, 1, 4]
    - [17, 0.244364]
  - - [14, 14, 1, 4]
    - [11, 0.275088]
  - - [16, 14, 1, 4]
    - [15, 0.32]
  - - [2, 16, 1, 4]
    - [2, 0.0441379]
  - - [4, 16, 1, 4]
    - [5, 0.0867797]
  - - [6, 16, 1, 4]
    - [8, 0.132414]
  - - [8, 16, 1, 4]
    - [7, 0.173559]
  - - [10, 16, 1, 4]
    - [15, 0.232727]
  - - [12, 16, 1, 4]
    - [11, 0.269474]
  - - [14, 16, 1, 4]
    - [15, 0.325818]
  - - [16, 16, 1, 4]
    - [15, 0.365714]
  - - [2, 2, 1, 6]
    - [17, 0.00842105]
  - - [4, 2, 1, 6]
    - [0, 0.0162712]
  - - [6, 2, 1, 6]
    - [17, 0.0252632]
  - - [8, 2, 1, 6]
    - [15, 0.0349091]
  - - [10, 2, 1, 6]
    - [0, 0.0393443]
  - - [12, 2, 1, 6]
    - [16, 0.0496552]
  - - [14, 2, 1, 6]
    - [15, 0.0610909]
  - - [16, 2, 1, 6]
    - [11, 0.0673684]
  - - [2, 4, 1, 6]
    - [0, 0.016]
  - - [4, 4, 1, 6]
    - [39, 0.0342857]
  - - [6, 4, 1, 6]
    - [17, 0.0505263]
  - - [8, 4, 1, 6]
    - [15, 0.0685714]
  - - [10, 4, 1, 6]
    - [15, 0.0872727]
  - - [12, 4, 1, 6]
    - [11, 0.104727]
  - - [14, 4, 1, 6]
    - [17, 0.115862]
  - - [16, 4, 1, 6]
    - [15, 0.139636]
  - - [2, 6, 1, 6]
    - [40, 0.0252632]
  - - [4, 6, 1, 6]
    - [2, 0.0488136]
  - - [6, 6, 1, 6]
    - [17, 0.0771429]
  - - [8, 6, 1, 6]
    - [11, 0.104727]
  - - [10, 6, 1, 6]
    - [11, 0.122034]
  - - [12, 6, 1, 6]
    - [17, 0.148966]
  - - [14, 6, 1, 6]
    - [15, 0.186667]
  - - [16, 6, 1, 6]
    - [15, 0.209455]
  - - [2, 8, 1, 6]
    - [3, 0.032]
  - - [4, 8, 1, 6]
    - [40, 0.0685714]
  - - [6, 8, 1, 6]
    - [17, 0.102857]
  - - [8, 8, 1, 6]
    - [150, 0.134737]
  - - [10, 8, 1, 6]
    - [14, 0.162712]
  - - [12, 8, 1, 6]
    - [15, 0.18]
  - - [14, 8, 1, 6]
    - [15, 0.244364]
  - - [16, 8, 1, 6]
    - [11, 0.274286]
  - - [2, 10, 1, 6]
    - [8, 0.0413793]
  - - [4, 10, 1, 6]
    - [0, 0.0827586]
  - - [6, 10, 1, 6]
    - [17, 0.126316]
  - - [8, 10, 1, 6]
    - [15, 0.177778]
  - - [10, 10, 1, 6]
    - [14, 0.210526]
  - - [12, 10, 1, 6]
    - [15, 0.261818]
  - - [14, 10, 1, 6]
    - [15, 0.3]
  - - [16, 10, 1, 6]
    - [141, 0.336842]
  - - [2, 12, 1, 6]
    - [17, 0.0523636]
  - - [4, 12, 1, 6]
    - [8, 0.101053]
  - - [6, 12, 1, 6]
    - [8, 0.151579]
  - - [8, 12, 1, 6]
    - [15, 0.202105]
  - - [10, 12, 1, 6]
    - [15, 0.261818]
  - - [12, 12, 1, 6]
    - [17, 0.314182]
  - - [14, 12, 1, 6]
    - [15, 0.36]
  - - [16, 12, 1, 6]
    - [17, 0.411429]
  - - [2, 14, 1, 6]
    - [40, 0.0569492]
  - - [4, 14, 1, 6]
    - [11, 0.108387]
  - - [6, 14, 1, 6]
    - [40, 0.18]
  - - [8, 14, 1, 6]
    - [15, 0.24]
  - - [10, 14, 1, 6]
    - [8, 0.3]
  - - [12, 14, 1, 6]
    - [5, 0.341695]
  - - [14, 14, 1, 6]
    - [17, 0.42]
  - - [16, 14, 1, 6]
    - [15, 0.48]
  - - [2, 16, 1, 6]
    - [8, 0.0685714]
  - - [4, 16, 1, 6]
    - [8, 0.132414]
  - - [6, 16, 1, 6]
    - [5, 0.198621]
  - - [8, 16, 1, 6]
    - [10, 0.274286]
  - - [10, 16, 1, 6]
    - [15, 0.336842]
  - - [12, 16, 1, 6]
    - [15, 0.411429]
  - - [14, 16, 1, 6]
    - [11, 0.488727]
  - - [16, 16, 1, 6]
    - [15, 0.548571]
  - - [2, 2, 1, 8]
    - [1, 0.0114286]
  - - [4, 2, 1, 8]
    - [11, 0.022069]
  - - [6, 2, 1, 8]
    - [2, 0.0331034]
  - - [8, 2, 1, 8]
    - [8, 0.0426667]
  - - [10, 2, 1, 8]
    - [11, 0.0561404]
  - - [12, 2, 1, 8]
    - [15, 0.0698182]
  - - [14, 2, 1, 8]
    - [15, 0.0814545]
  - - [16, 2, 1, 8]
    - [15, 0.0930909]
  - - [2, 4, 1, 8]
    - [5, 0.0216949]
  - - [4, 4, 1, 8]
    - [39, 0.0419672]
  - - [6, 4, 1, 8]
    - [17, 0.0662069]
  - - [8, 4, 1, 8]
    - [15, 0.0930909]
  - - [10, 4, 1, 8]
    - [15, 0.116364]
  - - [12, 4, 1, 8]
    - [11, 0.134737]
  - - [14, 4, 1, 8]
    - [11, 0.162909]
  - - [16, 4, 1, 8]
    - [15, 0.182857]
  - - [2, 6, 1, 8]
    - [11, 0.0342857]
  - - [4, 6, 1, 8]
    - [8, 0.0673684]
  - - [6, 6, 1, 8]
    - [17, 0.102857]
  - - [8, 6, 1, 8]
    - [11, 0.139636]
  - - [10, 6, 1, 8]
    - [15, 0.174545]
  - - [12, 6, 1, 8]
    - [15, 0.213333]
  - - [14, 6, 1, 8]
    - [15, 0.24]
  - - [16, 6, 1, 8]
    - [11, 0.284444]
  - - [2, 8, 1, 8]
    - [11, 0.0457143]
  - - [4, 8, 1, 8]
    - [11, 0.0898246]
  - - [6, 8, 1, 8]
    - [17, 0.137143]
  - - [8, 8, 1, 8]
    - [40, 0.186182]
  - - [10, 8, 1, 8]
    - [15, 0.228571]
  - - [12, 8, 1, 8]
    - [11, 0.279273]
  - - [14, 8, 1, 8]
    - [15, 0.32]
  - - [16, 8, 1, 8]
    - [39, 0.365714]
  - - [2, 10, 1, 8]
    - [11, 0.0551724]
  - - [4, 10, 1, 8]
    - [17, 0.118519]
  - - [6, 10, 1, 8]
    - [8, 0.168421]
  - - [8, 10, 1, 8]
    - [15, 0.232727]
  - - [10, 10, 1, 8]
    - [2, 0.275862]
  - - [12, 10, 1, 8]
    - [2, 0.342857]
  - - [14, 10, 1, 8]
    - [15, 0.407273]
  - - [16, 10, 1, 8]
    - [14, 0.441379]
  - - [2, 12, 1, 8]
    - [8, 0.0650847]
  - - [4, 12, 1, 8]
    - [17, 0.134737]
  - - [6, 12, 1, 8]
    - [8, 0.198621]
  - - [8, 12, 1, 8]
    - [15, 0.279273]
  - - [10, 12, 1, 8]
    - [11, 0.342857]
  - - [12, 12, 1, 8]
    - [15, 0.426667]
  - - [14, 12, 1, 8]
    - [15, 0.48]
  - - [16, 12, 1, 8]
    - [15, 0.558545]
  - - [2, 14, 1, 8]
    - [8, 0.0759322]
  - - [4, 14, 1, 8]
    - [17, 0.16]
  - - [6, 14, 1, 8]
    - [0, 0.231724]
  - - [8, 14, 1, 8]
    - [14, 0.32]
  - - [10, 14, 1, 8]
    - [15, 0.392982]
  - - [12, 14, 1, 8]
    - [15, 0.488727]
  - - [14, 14, 1, 8]
    - [0, 0.531525]
  - - [16, 14, 1, 8]
    - [15, 0.651636]
  - - [2, 16, 1, 8]
    - [17, 0.0882759]
  - - [4, 16, 1, 8]
    - [8, 0.176552]
  - - [6, 16, 1, 8]
    - [1, 0.256]
  - - [8, 16, 1, 8]
    - [15, 0.365714]
  - - [10, 16, 1, 8]
    - [15, 0.457143]
  - - [12, 16, 1, 8]
    - [15, 0.548571]
  - - [14, 16, 1, 8]
    - [15, 0.651636]
  - - [16, 16, 1, 8]
    - [7, 0.731429]
  - - [2, 2, 1, 10]
    - [8, 0.0137931]
  - - [4, 2, 1, 10]
    - [40, 0.0285714]
  - - [6, 2, 1, 10]
    - [17, 0.0413793]
  - - [8, 2, 1, 10]
    - [62, 0.0551724]
  - - [10, 2, 1, 10]
    - [15, 0.0727273]
  - - [12, 2, 1, 10]
    - [15, 0.0888889]
  - - [14, 2, 1, 10]
    - [14, 0.0982456]
  - - [16, 2, 1, 10]
    - [16, 0.110345]
  - - [2, 4, 1, 10]
    - [0, 0.0271186]
  - - [4, 4, 1, 10]
    - [39, 0.0592593]
  - - [6, 4, 1, 10]
    - [5, 0.0842105]
  - - [8, 4, 1, 10]
    - [17, 0.116364]
  - - [10, 4, 1, 10]
    - [11, 0.145455]
  - - [12, 4, 1, 10]
    - [15, 0.177778]
  - - [14, 4, 1, 10]
    - [15, 0.2]
  - - [16, 4, 1, 10]
    - [15, 0.232727]
  - - [2, 6, 1, 10]
    - [17, 0.0421053]
  - - [4, 6, 1, 10]
    - [8, 0.0827586]
  - - [6, 6, 1, 10]
    - [15, 0.128571]
  - - [8, 6, 1, 10]
    - [15, 0.171429]
  - - [10, 6, 1, 10]
    - [15, 0.218182]
  - - [12, 6, 1, 10]
    - [15, 0.261818]
  - - [14, 6, 1, 10]
    - [15, 0.305455]
  - - [16, 6, 1, 10]
    - [15, 0.342857]
  - - [2, 8, 1, 10]
    - [25, 0.0533333]
  - - [4, 8, 1, 10]
    - [39, 0.114286]
  - - [6, 8, 1, 10]
    - [15, 0.168421]
  - - [8, 8, 1, 10]
    - [2, 0.209836]
  - - [10, 8, 1, 10]
    - [15, 0.285714]
  - - [12, 8, 1, 10]
    - [15, 0.342857]
  - - [14, 8, 1, 10]
    - [15, 0.407273]
  - - [16, 8, 1, 10]
    - [15, 0.465455]
  - - [2, 10, 1, 10]
    - [8, 0.0701754]
  - - [4, 10, 1, 10]
    - [17, 0.145455]
  - - [6, 10, 1, 10]
    - [17, 0.218182]
  - - [8, 10, 1, 10]
    - [14, 0.280702]
  - - [10, 10, 1, 10]
    - [9, 0.344828]
  - - [12, 10, 1, 10]
    - [15, 0.436364]
  - - [14, 10, 1, 10]
    - [15, 0.518519]
  - - [16, 10, 1, 10]
    - [11, 0.571429]
  - - [2, 12, 1, 10]
    - [17, 0.0842105]
  - - [4, 12, 1, 10]
    - [39, 0.174545]
  - - [6, 12, 1, 10]
    - [2, 0.244068]
  - - [8, 12, 1, 10]
    - [15, 0.349091]
  - - [10, 12, 1, 10]
    - [0, 0.428571]
  - - [12, 12, 1, 10]
    - [0, 0.505263]
  - - [14, 12, 1, 10]
    - [15, 0.622222]
  - - [16, 12, 1, 10]
    - [9, 0.685714]
  - - [2, 14, 1, 10]
    - [2, 0.0949153]
  - - [4, 14, 1, 10]
    - [15, 0.196491]
  - - [6, 14, 1, 10]
    - [17, 0.3]
  - - [8, 14, 1, 10]
    - [0, 0.4]
  - - [10, 14, 1, 10]
    - [17, 0.474576]
  - - [12, 14, 1, 10]
    - [11, 0.6]
  - - [14, 14, 1, 10]
    - [3, 0.687719]
  - - [16, 14, 1, 10]
    - [15, 0.814545]
  - - [2, 16, 1, 10]
    - [0, 0.110345]
  - - [4, 16, 1, 10]
    - [4, 0.228571]
  - - [6, 16, 1, 10]
    - [0, 0.331034]
  - - [8, 16, 1, 10]
    - [0, 0.449123]
  - - [10, 16, 1, 10]
    - [11, 0.561404]
  - - [12, 16, 1, 10]
    - [11, 0.685714]
  - - [14, 16, 1, 10]
    - [14, 0.785965]
  - - [16, 16, 1, 10]
    - [2, 0.898246]
  - - [2, 2, 1, 12]
    - [8, 0.0168421]
  - - [4, 2, 1, 12]
    - [8, 0.0331034]
  - - [6, 2, 1, 12]
    - [40, 0.0514286]
  - - [8, 2, 1, 12]
    - [0, 0.0662069]
  - - [10, 2, 1, 12]
    - [15, 0.0888889]
  - - [12, 2, 1, 12]
    - [15, 0.104727]
  - - [14, 2, 1, 12]
    - [8, 0.115862]
  - - [16, 2, 1, 12]
    - [15, 0.139636]
  - - [2, 4, 1, 12]
    - [15, 0.0314754]
  - - [4, 4, 1, 12]
    - [40, 0.0673684]
  - - [6, 4, 1, 12]
    - [2, 0.0976271]
  - - [8, 4, 1, 12]
    - [15, 0.139636]
  - - [10, 4, 1, 12]
    - [0, 0.174545]
  - - [12, 4, 1, 12]
    - [11, 0.205714]
  - - [14, 4, 1, 12]
    - [15, 0.248889]
  - - [16, 4, 1, 12]
    - [15, 0.274286]
  - - [2, 6, 1, 12]
    - [17, 0.0505263]
  - - [4, 6, 1, 12]
    - [39, 0.102857]
  - - [6, 6, 1, 12]
    - [40, 0.151579]
  - - [8, 6, 1, 12]
    - [15, 0.209455]
  - - [10, 6, 1, 12]
    - [17, 0.257143]
  - - [12, 6, 1, 12]
    - [0, 0.292881]
  - - [14, 6, 1, 12]
    - [11, 0.347586]
  - - [16, 6, 1, 12]
    - [3, 0.390508]
  - - [2, 8, 1, 12]
    - [40, 0.0685714]
  - - [4, 8, 1, 12]
    - [39, 0.139636]
  - - [6, 8, 1, 12]
    - [17, 0.205714]
  - - [8, 8, 1, 12]
    - [14, 0.269474]
  - - [10, 8, 1, 12]
    - [15, 0.342857]
  - - [12, 8, 1, 12]
    - [17, 0.404211]
  - - [14, 8, 1, 12]
    - [11, 0.48]
  - - [16, 8, 1, 12]
    - [11, 0.529655]
  - - [2, 10, 1, 12]
    - [17, 0.0872727]
  - - [4, 10, 1, 12]
    - [17, 0.174545]
  - - [6, 10, 1, 12]
    - [15, 0.257143]
  - - [8, 10, 1, 12]
    - [10, 0.342857]
  - - [10, 10, 1, 12]
    - [15, 0.444444]
  - - [12, 10, 1, 12]
    - [15, 0.533333]
  - - [14, 10, 1, 12]
    - [15, 0.610909]
  - - [16, 10, 1, 12]
    - [152, 0.650847]
  - - [2, 12, 1, 12]
    - [11, 0.101053]
  - - [4, 12, 1, 12]
    - [2, 0.195254]
  - - [6, 12, 1, 12]
    - [11, 0.303158]
  - - [8, 12, 1, 12]
    - [15, 0.411429]
  - - [10, 12, 1, 12]
    - [17, 0.514286]
  - - [12, 12, 1, 12]
    - [15, 0.628364]
  - - [14, 12, 1, 12]
    - [15, 0.733091]
  - - [16, 12, 1, 12]
    - [17, 0.822857]
  - - [2, 14, 1, 12]
    - [17, 0.12]
  - - [4, 14, 1, 12]
    - [5, 0.224]
  - - [6, 14, 1, 12]
    - [17, 0.36]
  - - [8, 14, 1, 12]
    - [6, 0.463448]
  - - [10, 14, 1, 12]
    - [6, 0.533333]
  - - [12, 14, 1, 12]
    - [9, 0.64]
  - - [14, 14, 1, 12]
    - [8, 0.825263]
  - - [16, 14, 1, 12]
    - [17, 0.943158]
  - - [2, 16, 1, 12]
    - [11, 0.139636]
  - - [4, 16, 1, 12]
    - [11, 0.274286]
  - - [6, 16, 1, 12]
    - [8, 0.411429]
  - - [8, 16, 1, 12]
    - [15, 0.558545]
  - - [10, 16, 1, 12]
    - [15, 0.685714]
  - - [12, 16, 1, 12]
    - [15, 0.837818]
  - - [14, 16, 1, 12]
    - [11, 0.943158]
  - - [16, 16, 1, 12]
    - [151, 1.09714]
  - - [2, 2, 1, 14]
    - [17, 0.02]
  - - [4, 2, 1, 14]
    - [39, 0.0407273]
  - - [6, 2, 1, 14]
    - [11, 0.057931]
  - - [8, 2, 1, 14]
    - [15, 0.0785965]
  - - [10, 2, 1, 14]
    - [15, 0.1]
  - - [12, 2, 1, 14]
    - [15, 0.113898]
  - - [14, 2, 1, 14]
    - [15, 0.14]
  - - [16, 2, 1, 14]
    - [0, 0.157193]
  - - [2, 4, 1, 14]
    - [40, 0.0407273]
  - - [4, 4, 1, 14]
    - [11, 0.08]
  - - [6, 4, 1, 14]
    - [3, 0.113898]
  - - [8, 4, 1, 14]
    - [15, 0.162909]
  - - [10, 4, 1, 14]
    - [40, 0.189831]
  - - [12, 4, 1, 14]
    - [10, 0.231724]
  - - [14, 4, 1, 14]
    - [15, 0.285091]
  - - [16, 4, 1, 14]
    - [65, 0.325818]
  - - [2, 6, 1, 14]
    - [8, 0.0541935]
  - - [4, 6, 1, 14]
    - [0, 0.122182]
  - - [6, 6, 1, 14]
    - [39, 0.18]
  - - [8, 6, 1, 14]
    - [152, 0.231724]
  - - [10, 6, 1, 14]
    - [15, 0.3]
  - - [12, 6, 1, 14]
    - [15, 0.353684]
  - - [14, 6, 1, 14]
    - [15, 0.42]
  - - [16, 6, 1, 14]
    - [15, 0.488727]
  - - [2, 8, 1, 14]
    - [17, 0.08]
  - - [4, 8, 1, 14]
    - [39, 0.165926]
  - - [6, 8, 1, 14]
    - [0, 0.231724]
  - - [8, 8, 1, 14]
    - [8, 0.325818]
  - - [10, 8, 1, 14]
    - [15, 0.4]
  - - [12, 8, 1, 14]
    - [8, 0.48]
  - - [14, 8, 1, 14]
    - [15, 0.570182]
  - - [16, 8, 1, 14]
    - [15, 0.651636]
  - - [2, 10, 1, 14]
    - [2, 0.0982456]
  - - [4, 10, 1, 14]
    - [15, 0.2]
  - - [6, 10, 1, 14]
    - [11, 0.305455]
  - - [8, 10, 1, 14]
    - [0, 0.4]
  - - [10, 10, 1, 14]
    - [15, 0.518519]
  - - [12, 10, 1, 14]
    - [2, 0.610909]
  - - [14, 10, 1, 14]
    - [80, 0.675862]
  - - [16, 10, 1, 14]
    - [11, 0.814545]
  - - [2, 12, 1, 14]
    - [0, 0.122182]
  - - [4, 12, 1, 14]
    - [0, 0.235789]
  - - [6, 12, 1, 14]
    - [15, 0.330492]
  - - [8, 12, 1, 14]
    - [7, 0.497778]
  - - [10, 12, 1, 14]
    - [11, 0.6]
  - - [12, 12, 1, 14]
    - [40, 0.695172]
  - - [14, 12, 1, 14]
    - [2, 0.84]
  - - [16, 12, 1, 14]
    - [17, 0.96]
  - - [2, 14, 1, 14]
    - [8, 0.142545]
  - - [4, 14, 1, 14]
    - [11, 0.28]
  - - [6, 14, 1, 14]
    - [2, 0.427636]
  - - [8, 14, 1, 14]
    - [11, 0.550175]
  - - [10, 14, 1, 14]
    - [15, 0.712727]
  - - [12, 14, 1, 14]
    - [2, 0.84]
  - - [14, 14, 1, 14]
    - [11, 0.8575]
  - - [16, 14, 1, 14]
    - [11, 1.14036]
  - - [2, 16, 1, 14]
    - [5, 0.16]
  - - [4, 16, 1, 14]
    - [17, 0.325818]
  - - [6, 16, 1, 14]
    - [2, 0.471579]
  - - [8, 16, 1, 14]
    - [2, 0.651636]
  - - [10, 16, 1, 14]
    - [3, 0.772414]
  - - [12, 16, 1, 14]
    - [11, 0.995556]
  - - [14, 16, 1, 14]
    - [2, 1.08138]
  - - [16, 16, 1, 14]
    - [11, 1.32741]
  - - [2, 2, 1, 16]
    - [0, 0.022069]
  - - [4, 2, 1, 16]
    - [2, 0.0457143]
  - - [6, 2, 1, 16]
    - [15, 0.0673684]
  - - [8, 2, 1, 16]
    - [14, 0.0930909]
  - - [10, 2, 1, 16]
    - [15, 0.114286]
  - - [12, 2, 1, 16]
    - [0, 0.139636]
  - - [14, 2, 1, 16]
    - [11, 0.165926]
  - - [16, 2, 1, 16]
    - [62, 0.179649]
  - - [2, 4, 1, 16]
    - [17, 0.0457143]
  - - [4, 4, 1, 16]
    - [2, 0.0948148]
  - - [6, 4, 1, 16]
    - [4, 0.137143]
  - - [8, 4, 1, 16]
    - [11, 0.18963]
  - - [10, 4, 1, 16]
    - [17, 0.232727]
  - - [12, 4, 1, 16]
    - [11, 0.274286]
  - - [14, 4, 1, 16]
    - [11, 0.325818]
  - - [16, 4, 1, 16]
    - [7, 0.347119]
  - - [2, 6, 1, 16]
    - [40, 0.0698182]
  - - [4, 6, 1, 16]
    - [40, 0.137143]
  - - [6, 6, 1, 16]
    - [40, 0.195254]
  - - [8, 6, 1, 16]
    - [135, 0.274286]
  - - [10, 6, 1, 16]
    - [145, 0.336842]
  - - [12, 6, 1, 16]
    - [17, 0.418909]
  - - [14, 6, 1, 16]
    - [145, 0.488727]
  - - [16, 6, 1, 16]
    - [10, 0.558545]
  - - [2, 8, 1, 16]
    - [2, 0.0898246]
  - - [4, 8, 1, 16]
    - [1, 0.173559]
  - - [6, 8, 1, 16]
    - [11, 0.274286]
  - - [8, 8, 1, 16]
    - [2, 0.347119]
  - - [10, 8, 1, 16]
    - [15, 0.474074]
  - - [12, 8, 1, 16]
    - [65, 0.538947]
  - - [14, 8, 1, 16]
    - [15, 0.651636]
  - - [16, 8, 1, 16]
    - [145, 0.744727]
  - - [2, 10, 1, 16]
    - [8, 0.114286]
  - - [4, 10, 1, 16]
    - [2, 0.22069]
  - - [6, 10, 1, 16]
    - [0, 0.349091]
  - - [8, 10, 1, 16]
    - [15, 0.465455]
  - - [10, 10, 1, 16]
    - [17, 0.571429]
  - - [12, 10, 1, 16]
    - [2, 0.673684]
  - - [14, 10, 1, 16]
    - [145, 0.785965]
  - - [16, 10, 1, 16]
    - [15, 0.898246]
  - - [2, 12, 1, 16]
    - [17, 0.142222]
  - - [4, 12, 1, 16]
    - [15, 0.284444]
  - - [6, 12, 1, 16]
    - [15, 0.426667]
  - - [8, 12, 1, 16]
    - [15, 0.568889]
  - - [10, 12, 1, 16]
    - [10, 0.685714]
  - - [12, 12, 1, 16]
    - [2, 0.837818]
  - - [14, 12, 1, 16]
    - [17, 0.867097]
  - - [16, 12, 1, 16]
    - [5, 1.04136]
  - - [2, 14, 1, 16]
    - [15, 0.157193]
  - - [4, 14, 1, 16]
    - [2, 0.308966]
  - - [6, 14, 1, 16]
    - [11, 0.48]
  - - [8, 14, 1, 16]
    - [17, 0.64]
  - - [10, 14, 1, 16]
    - [11, 0.814545]
  - - [12, 14, 1, 16]
    - [2, 0.926897]
  - - [14, 14, 1, 16]
    - [17, 1.14036]
  - - [16, 14, 1, 16]
    - [5, 1.23586]
  - - [2, 16, 1, 16]
    - [0, 0.179649]
  - - [4, 16, 1, 16]
    - [0, 0.365714]
  - - [6, 16, 1, 16]
    - [3, 0.512]
  - - [8, 16, 1, 16]
    - [11, 0.731429]
  - - [10, 16, 1, 16]
    - [15, 0.930909]
  - - [12, 16, 1, 16]
    - [63, 0.990968]
  - - [14, 16, 1, 16]
    - [11, 1.28]
  - - [16, 16, 1, 16]
    - [147, 1.43719]
  - - [2, 2, 1, 1024]
    - [0, 0.890435]
  - - [4, 2, 1, 1024]
    - [0, 1.72463]
  - - [6, 2, 1, 1024]
    - [0, 2.58695]
  - - [8, 2, 1, 1024]
    - [18, 3.60088]
  - - [10, 2, 1, 1024]
    - [18, 5.53514]
  - - [12, 2, 1, 1024]
    - [64, 6.64216]
  - - [14, 2, 1, 1024]
    - [64, 7.54526]
  - - [16, 2, 1, 1024]
    - [12, 9.10222]
  - - [2, 4, 1, 1024]
    - [0, 1.76172]
  - - [4, 4, 1, 1024]
    - [0, 3.48596]
  - - [6, 4, 1, 1024]
    - [0, 5.28516]
  - - [8, 4, 1, 1024]
    - [68, 7.8959]
  - - [10, 4, 1, 1024]
    - [64, 10.5026]
  - - [12, 4, 1, 1024]
    - [64, 12.9347]
  - - [14, 4, 1, 1024]
    - [12, 12.7431]
  - - [16, 4, 1, 1024]
    - [64, 18.2044]
  - - [2, 6, 1, 1024]
    - [0, 2.61447]
  - - [4, 6, 1, 1024]
    - [15, 5.01551]
  - - [6, 6, 1, 1024]
    - [0, 7.92774]
  - - [8, 6, 1, 1024]
    - [7, 10.6852]
  - - [10, 6, 1, 1024]
    - [18, 16.6054]
  - - [12, 6, 1, 1024]
    - [12, 19.9265]
  - - [14, 6, 1, 1024]
    - [12, 23.566]
  - - [16, 6, 1, 1024]
    - [64, 26.2144]
  - - [2, 8, 1, 1024]
    - [0, 3.44926]
  - - [4, 8, 1, 1024]
    - [15, 6.68735]
  - - [6, 8, 1, 1024]
    - [0, 10.5703]
  - - [8, 8, 1, 1024]
    - [12, 18.2044]
  - - [10, 8, 1, 1024]
    - [64, 21.8453]
  - - [12, 8, 1, 1024]
    - [64, 24.2726]
  - - [14, 8, 1, 1024]
    - [64, 30.1811]
  - - [16, 8, 1, 1024]
    - [64, 34.9525]
  - - [2, 10, 1, 1024]
    - [0, 4.45217]
  - - [4, 10, 1, 1024]
    - [0, 8.71489]
  - - [6, 10, 1, 1024]
    - [0, 13.5033]
  - - [8, 10, 1, 1024]
    - [18, 22.7556]
  - - [10, 10, 1, 1024]
    - [12, 28.0548]
  - - [12, 10, 1, 1024]
    - [12, 29.6096]
  - - [14, 10, 1, 1024]
    - [18, 39.2767]
  - - [16, 10, 1, 1024]
    - [64, 42.5558]
  - - [2, 12, 1, 1024]
    - [0, 5.34261]
  - - [4, 12, 1, 1024]
    - [0, 10.6852]
  - - [6, 12, 1, 1024]
    - [0, 15.2016]
  - - [8, 12, 1, 1024]
    - [18, 25.2062]
  - - [10, 12, 1, 1024]
    - [12, 33.6658]
  - - [12, 12, 1, 1024]
    - [0, 32.0557]
  - - [14, 12, 1, 1024]
    - [18, 47.1321]
  - - [16, 12, 1, 1024]
    - [7, 42.7409]
  - - [2, 14, 1, 1024]
    - [0, 6.23304]
  - - [4, 14, 1, 1024]
    - [0, 11.8235]
  - - [6, 14, 1, 1024]
    - [0, 18.4981]
  - - [8, 14, 1, 1024]
    - [18, 32.3065]
  - - [10, 14, 1, 1024]
    - [12, 39.2767]
  - - [12, 14, 1, 1024]
    - [64, 45.2716]
  - - [14, 14, 1, 1024]
    - [64, 52.8168]
  - - [16, 14, 1, 1024]
    - [12, 63.7156]
  - - [2, 16, 1, 1024]
    - [15, 6.6198]
  - - [4, 16, 1, 1024]
    - [0, 13.7971]
  - - [6, 16, 1, 1024]
    - [15, 20.2689]
  - - [8, 16, 1, 1024]
    - [12, 34.9525]
  - - [10, 16, 1, 1024]
    - [64, 43.6907]
  - - [12, 16, 1, 1024]
    - [64, 51.7389]
  - - [14, 16, 1, 1024]
    - [18, 61.1669]
  - - [16, 16, 1, 1024]
    - [18, 66.3656]
  - - [2, 2, 1, 2048]
    - [52, 1.22269]
  - - [4, 2, 1, 2048]
    - [0, 2.52062]
  - - [6, 2, 1, 2048]
    - [0, 3.69564]
  - - [8, 2, 1, 2048]
    - [18, 7.9922]
  - - [10, 2, 1, 2048]
    - [18, 8.44536]
  - - [12, 2, 1, 2048]
    - [64, 11.5652]
  - - [14, 2, 1, 2048]
    - [64, 13.4927]
  - - [16, 2, 1, 2048]
    - [18, 15.9844]
  - - [2, 4, 1, 2048]
    - [0, 2.54016]
  - - [4, 4, 1, 2048]
    - [0, 5.00275]
  - - [6, 4, 1, 2048]
    - [0, 7.50412]
  - - [8, 4, 1, 2048]
    - [12, 15.4202]
  - - [10, 4, 1, 2048]
    - [12, 19.5048]
  - - [12, 4, 1, 2048]
    - [12, 22.0908]
  - - [14, 4, 1, 2048]
    - [12, 27.3067]
  - - [16, 4, 1, 2048]
    - [64, 31.9688]
  - - [2, 6, 1, 2048]
    - [0, 3.78092]
  - - [4, 6, 1, 2048]
    - [0, 7.56185]
  - - [6, 6, 1, 2048]
    - [0, 11.2562]
  - - [8, 6, 1, 2048]
    - [18, 24.2726]
  - - [10, 6, 1, 2048]
    - [18, 29.9707]
  - - [12, 6, 1, 2048]
    - [64, 35.1086]
  - - [14, 6, 1, 2048]
    - [18, 41.959]
  - - [16, 6, 1, 2048]
    - [18, 49.152]
  - - [2, 8, 1, 2048]
    - [0, 5.08031]
  - - [4, 8, 1, 2048]
    - [0, 9.9297]
  - - [6, 8, 1, 2048]
    - [0, 15.1237]
  - - [8, 8, 1, 2048]
    - [18, 32.3635]
  - - [10, 8, 1, 2048]
    - [12, 39.4795]
  - - [12, 8, 1, 2048]
    - [64, 46.8114]
  - - [14, 8, 1, 2048]
    - [12, 54.6133]
  - - [16, 8, 1, 2048]
    - [12, 64.7269]
  - - [2, 10, 1, 2048]
    - [0, 6.25344]
  - - [4, 10, 1, 2048]
    - [0, 12.7008]
  - - [6, 10, 1, 2048]
    - [0, 19.0512]
  - - [8, 10, 1, 2048]
    - [64, 39.0095]
  - - [10, 10, 1, 2048]
    - [64, 48.7619]
  - - [12, 10, 1, 2048]
    - [12, 53.4261]
  - - [14, 10, 1, 2048]
    - [12, 63.0154]
  - - [16, 10, 1, 2048]
    - [64, 79.922]
  - - [2, 12, 1, 2048]
    - [0, 7.56185]
  - - [4, 12, 1, 2048]
    - [0, 14.5636]
  - - [6, 12, 1, 2048]
    - [52, 20.6232]
  - - [8, 12, 1, 2048]
    - [12, 45.7228]
  - - [10, 12, 1, 2048]
    - [64, 57.8259]
  - - [12, 12, 1, 2048]
    - [18, 70.2171]
  - - [14, 12, 1, 2048]
    - [64, 81.92]
  - - [16, 12, 1, 2048]
    - [18, 95.9063]
  - - [2, 14, 1, 2048]
    - [52, 7.96444]
  - - [4, 14, 1, 2048]
    - [52, 17.2463]
  - - [6, 14, 1, 2048]
    - [0, 26.88]
  - - [8, 14, 1, 2048]
    - [12, 55.2713]
  - - [10, 14, 1, 2048]
    - [64, 65.9126]
  - - [12, 14, 1, 2048]
    - [64, 80.9562]
  - - [14, 14, 1, 2048]
    - [64, 93.3507]
  - - [16, 14, 1, 2048]
    - [64, 110.543]
  - - [2, 16, 1, 2048]
    - [0, 10.0055]
  - - [4, 16, 1, 2048]
    - [0, 20.011]
  - - [6, 16, 1, 2048]
    - [0, 30.2474]
  - - [8, 16, 1, 2048]
    - [12, 63.1672]
  - - [10, 16, 1, 2048]
    - [12, 78.019]
  - - [12, 16, 1, 2048]
    - [12, 92.5214]
  - - [14, 16, 1, 2048]
    - [12, 109.227]
  - - [16, 16, 1, 2048]
    - [18, 126.334]
  - - [2, 2, 1, 4096]
    - [0, 1.56785]
  - - [4, 2, 1, 4096]
    - [0, 3.10597]
  - - [6, 2, 1, 4096]
    - [0, 4.68114]
  - - [8, 2, 1, 4096]
    - [12, 13.1072]
  - - [10, 2, 1, 4096]
    - [64, 15.7538]
  - - [12, 2, 1, 4096]
    - [18, 18.7246]
  - - [14, 2, 1, 4096]
    - [18, 22.4878]
  - - [16, 2, 1, 4096]
    - [64, 25.7004]
  - - [2, 4, 1, 4096]
    - [52, 3.06243]
  - - [4, 4, 1, 4096]
    - [0, 6.24152]
  - - [6, 4, 1, 4096]
    - [0, 9.63765]
  - - [8, 4, 1, 4096]
    - [18, 25.9549]
  - - [10, 4, 1, 4096]
    - [64, 31.8136]
  - - [12, 4, 1, 4096]
    - [18, 38.9323]
  - - [14, 4, 1, 4096]
    - [64, 44.539]
  - - [16, 4, 1, 4096]
    - [64, 50.9017]
  - - [2, 6, 1, 4096]
    - [0, 4.70354]
  - - [4, 6, 1, 4096]
    - [0, 9.31791]
  - - [6, 6, 1, 4096]
    - [0, 14.0434]
  - - [8, 6, 1, 4096]
    - [18, 38.9323]
  - - [10, 6, 1, 4096]
    - [12, 45.9364]
  - - [12, 6, 1, 4096]
    - [18, 57.8259]
  - - [14, 6, 1, 4096]
    - [12, 66.8085]
  - - [16, 6, 1, 4096]
    - [18, 78.6432]
  - - [2, 8, 1, 4096]
    - [52, 6.09637]
  - - [4, 8, 1, 4096]
    - [52, 12.5428]
  - - [6, 8, 1, 4096]
    - [52, 18.0374]
  - - [8, 8, 1, 4096]
    - [64, 51.4008]
  - - [10, 8, 1, 4096]
    - [64, 63.0154]
  - - [12, 8, 1, 4096]
    - [64, 75.6185]
  - - [14, 8, 1, 4096]
    - [64, 88.2215]
  - - [16, 8, 1, 4096]
    - [64, 101.803]
  - - [2, 10, 1, 4096]
    - [0, 7.83923]
  - - [4, 10, 1, 4096]
    - [52, 15.1005]
  - - [6, 10, 1, 4096]
    - [52, 22.6507]
  - - [8, 10, 1, 4096]
    - [64, 64.8871]
  - - [10, 10, 1, 4096]
    - [12, 73.8018]
  - - [12, 10, 1, 4096]
    - [64, 94.5231]
  - - [14, 10, 1, 4096]
    - [18, 111.348]
  - - [16, 10, 1, 4096]
    - [64, 128.502]
  - - [2, 12, 1, 4096]
    - [52, 9.10222]
  - - [4, 12, 1, 4096]
    - [52, 18.1206]
  - - [6, 12, 1, 4096]
    - [52, 27.1808]
  - - [8, 12, 1, 4096]
    - [18, 77.8646]
  - - [10, 12, 1, 4096]
    - [64, 95.4408]
  - - [12, 12, 1, 4096]
    - [64, 113.428]
  - - [14, 12, 1, 4096]
    - [64, 132.332]
  - - [16, 12, 1, 4096]
    - [64, 154.202]
  - - [2, 14, 1, 4096]
    - [0, 10.9227]
  - - [4, 14, 1, 4096]
    - [0, 22.7105]
  - - [6, 14, 1, 4096]
    - [0, 32.768]
  - - [8, 14, 1, 4096]
    - [64, 90.842]
  - - [10, 14, 1, 4096]
    - [64, 111.348]
  - - [12, 14, 1, 4096]
    - [64, 132.332]
  - - [14, 14, 1, 4096]
    - [64, 154.388]
  - - [16, 14, 1, 4096]
    - [64, 178.156]
  - - [2, 16, 1, 4096]
    - [0, 12.8502]
  - - [4, 16, 1, 4096]
    - [0, 24.9661]
  - - [6, 16, 1, 4096]
    - [0, 37.9919]
  - - [8, 16, 1, 4096]
    - [18, 103.819]
  - - [10, 16, 1, 4096]
    - [18, 129.774]
  - - [12, 16, 1, 4096]
    - [64, 152.705]
  - - [14, 16, 1, 4096]
    - [64, 174.763]
  - - [16, 16, 1, 4096]
    - [12, 195.996]
  - - [64, 4096, 1, 64]
    - [34, 4357.72]
  - - [320, 4096, 1, 64]
    - [109, 8648.05]
  - - [64, 4096, 1, 256]
    - [95, 9942.05]
  - - [4096, 64, 1, 64]
    - [158, 4301.85]
  - - [4096, 320, 1, 64]
    - [107, 8648.05]
  - - [4096, 64, 1, 256]
    - [87, 11278.8]
  - - [64, 64, 1, 8192]
    - [64, 4534.38]
  - - [64, 128, 1, 8192]
    - [64, 6744.61]
  - - [64, 8192, 1, 64]
    - [109, 6515.42]
  - - [64, 8192, 1, 128]
    - [109, 9320.68]
  - - [128, 64, 1, 8192]
    - [64, 6677.5]
  - - [128, 8192, 1, 64]
    - [94, 8184.01]
  - - [8192, 64, 1, 64]
    - [133, 6452.78]
  - - [8192, 64, 1, 128]
    - [100, 10091.6]
  - - [8192, 128, 1, 64]
    - [91, 8036.99]
  - - [64, 1, 1, 64]
    - [4, 1.67184]
  - - [64, 16, 1, 64]
    - [147, 30.4819]
  - - [64, 32, 1, 64]
    - [14, 58.2542]
  - - [1, 1, 1, 64]
    - [5, 0.022069]
  - - [16, 1, 1, 64]
    - [14, 0.359298]
  - - [32, 1, 1, 64]
    - [146, 0.910222]
  - - [64, 1, 1, 1]
    - [0, 0.0278261]
  - - [64, 1, 1, 16]
    - [15, 0.393846]
  - - [64, 1, 1, 32]
    - [151, 0.910222]
  - - [1, 16, 1, 64]
    - [17, 0.353103]
  - - [16, 16, 1, 64]
    - [10, 5.64966]
  - - [32, 16, 1, 64]
    - [147, 13.6533]
  - - [64, 16, 1, 1]
    - [145, 0.465455]
  - - [64, 16, 1, 16]
    - [0, 6.97191]
  - - [64, 16, 1, 32]
    - [2, 14.247]
  - - [1, 32, 1, 64]
    - [2, 0.682667]
  - - [16, 32, 1, 64]
    - [154, 14.8945]
  - - [32, 32, 1, 64]
    - [80, 30.4819]
  - - [64, 32, 1, 1]
    - [15, 0.930909]
  - - [64, 32, 1, 16]
    - [141, 14.8945]
  - - [64, 32, 1, 32]
    - [9, 28.4939]
  - - [1, 1, 1, 1]
    - [5, 0.000344828]
  - - [1, 1, 1, 16]
    - [5, 0.00561404]
  - - [1, 1, 1, 32]
    - [2, 0.0110345]
  - - [16, 1, 1, 1]
    - [17, 0.00592593]
  - - [16, 1, 1, 16]
    - [15, 0.0948148]
  - - [16, 1, 1, 32]
    - [0, 0.182857]
  - - [32, 1, 1, 1]
    - [40, 0.013617]
  - - [32, 1, 1, 16]
    - [151, 0.222609]
  - - [32, 1, 1, 32]
    - [39, 0.455111]
  - - [1, 16, 1, 1]
    - [2, 0.00561404]
  - - [1, 16, 1, 16]
    - [15, 0.0914286]
  - - [1, 16, 1, 32]
    - [11, 0.179649]
  - - [16, 16, 1, 1]
    - [11, 0.0914286]
  - - [16, 16, 1, 16]
    - [143, 1.46286]
  - - [16, 16, 1, 32]
    - [15, 3.09132]
  - - [32, 16, 1, 1]
    - [2, 0.213333]
  - - [32, 16, 1, 16]
    - [5, 3.48596]
  - - [32, 16, 1, 32]
    - [2, 6.5536]
  - - [1, 32, 1, 1]
    - [3, 0.0130612]
  - - [1, 32, 1, 16]
    - [3, 0.222609]
  - - [1, 32, 1, 32]
    - [3, 0.4096]
  - - [16, 32, 1, 1]
    - [154, 0.232727]
  - - [16, 32, 1, 16]
    - [152, 3.56174]
  - - [16, 32, 1, 32]
    - [10, 7.62047]
  - - [32, 32, 1, 1]
    - [5, 0.426667]
  - - [32, 32, 1, 16]
    - [145, 7.62047]
  - - [32, 32, 1, 32]
    - [150, 14.8945]
  - - [1, 64, 1, 64]
    - [8, 1.78087]
  - - [16, 64, 1, 64]
    - [146, 29.7891]
  - - [32, 64, 1, 64]
    - [14, 59.5782]
  - - [1, 64, 1, 1]
    - [3, 0.0261224]
  - - [1, 64, 1, 16]
    - [3, 0.426667]
  - - [1, 64, 1, 32]
    - [15, 0.890435]
  - - [16, 64, 1, 1]
    - [65, 0.426667]
  - - [16, 64, 1, 16]
    - [7, 7.28178]
  - - [16, 64, 1, 32]
    - [14, 14.8945]
  - - [32, 64, 1, 1]
    - [16, 0.930909]
  - - [32, 64, 1, 16]
    - [145, 15.2409]
  - - [32, 64, 1, 32]
    - [14, 30.4819]
  - - [64, 64, 1, 1]
    - [15, 1.86182]
  - - [64, 64, 1, 16]
    - [145, 30.4819]
  - - [64, 64, 1, 32]
    - [7, 60.9637]
  - - [256, 1, 1, 256]
    - [138, 25.2062]
  - - [256, 16, 1, 256]
    - [138, 419.43]
  - - [256, 32, 1, 256]
    - [62, 822.413]
  - - [1, 1, 1, 256]
    - [15, 0.0775758]
  - - [16, 1, 1, 256]
    - [15, 1.28]
  - - [32, 1, 1, 256]
    - [129, 3.2768]
  - - [256, 1, 1, 1]
    - [16, 0.113778]
  - - [256, 1, 1, 16]
    - [145, 1.86182]
  - - [256, 1, 1, 32]
    - [16, 3.72364]
  - - [1, 16, 1, 256]
    - [15, 1.20471]
  - - [16, 16, 1, 256]
    - [7, 18.9959]
  - - [32, 16, 1, 256]
    - [129, 52.4288]
  - - [256, 16, 1, 1]
    - [62, 1.86182]
  - - [256, 16, 1, 16]
    - [0, 25.2062]
  - - [256, 16, 1, 32]
    - [80, 60.9637]
  - - [1, 32, 1, 256]
    - [8, 2.6859]
  - - [16, 32, 1, 256]
    - [129, 53.4988]
  - - [32, 32, 1, 256]
    - [129, 109.227]
  - - [256, 32, 1, 1]
    - [3, 3.21255]
  - - [256, 32, 1, 16]
    - [145, 60.9637]
  - - [256, 32, 1, 32]
    - [10, 121.927]
  - - [1, 256, 1, 256]
    - [17, 22.9951]
  - - [16, 256, 1, 256]
    - [129, 427.99]
  - - [32, 256, 1, 256]
    - [136, 762.601]
  - - [1, 256, 1, 1]
    - [40, 0.113778]
  - - [1, 256, 1, 16]
    - [40, 1.74298]
  - - [1, 256, 1, 32]
    - [40, 3.64089]
  - - [16, 256, 1, 1]
    - [151, 1.86182]
  - - [16, 256, 1, 16]
    - [15, 29.7891]
  - - [16, 256, 1, 32]
    - [1, 53.4988]
  - - [32, 256, 1, 1]
    - [138, 3.72364]
  - - [32, 256, 1, 16]
    - [145, 60.9637]
  - - [32, 256, 1, 32]
    - [15, 124.83]
  - - [256, 256, 1, 1]
    - [20, 26.7494]
  - - [256, 256, 1, 16]
    - [25, 427.99]
  - - [256, 256, 1, 32]
    - [25, 873.813]
  - - [512, 1, 1, 512]
    - [141, 87.3813]
  - - [512, 16, 1, 512]
    - [136, 1421.8]
  - - [512, 32, 1, 512]
    - [141, 2750.36]
  - - [1, 1, 1, 512]
    - [15, 0.132987]
  - - [16, 1, 1, 512]
    - [12, 2.40941]
  - - [32, 1, 1, 512]
    - [129, 5.74877]
  - - [512, 1, 1, 1]
    - [143, 0.217872]
  - - [512, 1, 1, 16]
    - [16, 3.64089]
  - - [512, 1, 1, 32]
    - [145, 7.28178]
  - - [1, 16, 1, 512]
    - [15, 2.10051]
  - - [16, 16, 1, 512]
    - [12, 37.9919]
  - - [32, 16, 1, 512]
    - [129, 91.9804]
  - - [512, 16, 1, 1]
    - [15, 3.72364]
  - - [512, 16, 1, 16]
    - [145, 59.5782]
  - - [512, 16, 1, 32]
    - [150, 111.551]
  - - [1, 32, 1, 512]
    - [3, 4.48877]
  - - [16, 32, 1, 512]
    - [129, 84.5626]
  - - [32, 32, 1, 512]
    - [129, 190.65]
  - - [512, 32, 1, 1]
    - [14, 7.62047]
  - - [512, 32, 1, 16]
    - [14, 119.156]
  - - [512, 32, 1, 32]
    - [16, 243.855]
  - - [1, 512, 1, 512]
    - [40, 69.9051]
  - - [16, 512, 1, 512]
    - [129, 1421.8]
  - - [32, 512, 1, 512]
    - [141, 2750.36]
  - - [1, 512, 1, 1]
    - [40, 0.213333]
  - - [1, 512, 1, 16]
    - [17, 3.64089]
  - - [1, 512, 1, 32]
    - [17, 7.44727]
  - - [16, 512, 1, 1]
    - [4, 3.2768]
  - - [16, 512, 1, 16]
    - [147, 59.5782]
  - - [16, 512, 1, 32]
    - [17, 119.156]
  - - [32, 512, 1, 1]
    - [0, 6.30154]
  - - [32, 512, 1, 16]
    - [145, 121.927]
  - - [32, 512, 1, 32]
    - [40, 233.017]
  - - [512, 512, 1, 1]
    - [131, 73.8434]
  - - [512, 512, 1, 16]
    - [156, 1290.56]
  - - [512, 512, 1, 32]
    - [107, 2504.06]
  - - [1024, 1, 1, 1024]
    - [137, 252.669]
  - - [1024, 16, 1, 1024]
    - [141, 4092.0]
  - - [1024, 32, 1, 1024]
    - [112, 6515.42]
  - - [1, 1, 1, 1024]
    - [15, 0.20898]
  - - [16, 1, 1, 1024]
    - [18, 4.55111]
  - - [32, 1, 1, 1024]
    - [129, 9.23042]
  - - [1024, 1, 1, 1]
    - [145, 0.476279]
  - - [1024, 1, 1, 16]
    - [142, 6.30154]
  - - [1024, 1, 1, 32]
    - [10, 14.8945]
  - - [1, 16, 1, 1024]
    - [15, 3.2768]
  - - [16, 16, 1, 1024]
    - [18, 71.8203]
  - - [32, 16, 1, 1024]
    - [129, 149.797]
  - - [1024, 16, 1, 1]
    - [145, 7.44727]
  - - [1024, 16, 1, 16]
    - [150, 104.858]
  - - [1024, 16, 1, 32]
    - [80, 238.313]
  - - [1, 32, 1, 1024]
    - [15, 6.68735]
  - - [16, 32, 1, 1024]
    - [18, 131.072]
  - - [32, 32, 1, 1024]
    - [129, 308.405]
  - - [1024, 32, 1, 1]
    - [9, 13.1072]
  - - [1024, 32, 1, 16]
    - [145, 233.017]
  - - [1024, 32, 1, 32]
    - [11, 436.907]
  - - [1, 1024, 1, 1024]
    - [40, 199.729]
  - - [16, 1024, 1, 1024]
    - [153, 3608.0]
  - - [32, 1024, 1, 1024]
    - [14, 5835.55]
  - - [1, 1024, 1, 1]
    - [5, 0.435745]
  - - [1, 1024, 1, 16]
    - [5, 7.12348]
  - - [1, 1024, 1, 32]
    - [40, 14.247]
  - - [16, 1024, 1, 1]
    - [39, 7.12348]
  - - [16, 1024, 1, 16]
    - [17, 102.802]
  - - [16, 1024, 1, 32]
    - [2, 190.65]
  - - [32, 1024, 1, 1]
    - [14, 13.9438]
  - - [32, 1024, 1, 16]
    - [65, 190.65]
  - - [32, 1024, 1, 32]
    - [80, 466.034]
  - - [1024, 1024, 1, 1]
    - [98, 153.077]
  - - [1024, 1024, 1, 16]
    - [98, 2413.99]
  - - [1024, 1024, 1, 32]
    - [97, 4759.49]
  - - [2048, 1, 1, 2048]
    - [7, 479.349]
  - - [2048, 16, 1, 2048]
    - [62, 7582.92]
  - - [1, 1, 1, 2048]
    - [52, 0.290496]
  - - [16, 1, 1, 2048]
    - [18, 7.9922]
  - - [32, 1, 1, 2048]
    - [18, 14.5636]
  - - [2048, 1, 1, 1]
    - [7, 0.871489]
  - - [2048, 1, 1, 16]
    - [11, 14.247]
  - - [2048, 1, 1, 32]
    - [80, 27.3067]
  - - [1, 16, 1, 2048]
    - [52, 4.64794]
  - - [16, 16, 1, 2048]
    - [18, 126.334]
  - - [32, 16, 1, 2048]
    - [64, 252.669]
  - - [2048, 16, 1, 1]
    - [11, 14.5636]
  - - [2048, 16, 1, 16]
    - [145, 233.017]
  - - [2048, 16, 1, 32]
    - [9, 466.034]
  - - [1, 32, 1, 2048]
    - [52, 9.23042]
  - - [16, 32, 1, 2048]
    - [64, 252.669]
  - - [32, 32, 1, 2048]
    - [64, 499.322]
  - - [2048, 32, 1, 1]
    - [20, 26.2144]
  - - [2048, 32, 1, 16]
    - [25, 419.43]
  - - [2048, 32, 1, 32]
    - [25, 873.813]
  - - [1, 2048, 1, 2048]
    - [5, 393.831]
  - - [16, 2048, 1, 2048]
    - [70, 6452.78]
  - - [1, 2048, 1, 1]
    - [2, 0.758519]
  - - [1, 2048, 1, 16]
    - [40, 13.6533]
  - - [1, 2048, 1, 32]
    - [40, 27.8877]
  - - [16, 2048, 1, 1]
    - [39, 13.9438]
  - - [16, 2048, 1, 16]
    - [40, 218.453]
  - - [16, 2048, 1, 32]
    - [39, 455.903]
  - - [32, 2048, 1, 1]
    - [15, 24.2726]
  - - [32, 2048, 1, 16]
    - [15, 388.361]
  - - [32, 2048, 1, 32]
    - [14, 776.723]
  - - [2048, 2048, 1, 1]
    - [91, 224.896]
  - - [2048, 2048, 1, 16]
    - [156, 3707.67]
  - - [3072, 1, 1, 3072]
    - [7, 577.198]
  - - [1, 1, 1, 3072]
    - [52, 0.365714]
  - - [16, 1, 1, 3072]
    - [64, 10.5703]
  - - [32, 1, 1, 3072]
    - [18, 21.3704]
  - - [3072, 1, 1, 1]
    - [11, 1.20471]
  - - [3072, 1, 1, 16]
    - [145, 19.2753]
  - - [3072, 1, 1, 32]
    - [10, 38.5506]
  - - [1, 16, 1, 3072]
    - [52, 5.71535]
  - - [16, 16, 1, 3072]
    - [12, 169.125]
  - - [32, 16, 1, 3072]
    - [18, 338.25]
  - - [3072, 16, 1, 1]
    - [80, 19.6608]
  - - [3072, 16, 1, 16]
    - [145, 327.68]
  - - [3072, 16, 1, 32]
    - [11, 641.985]
  - - [1, 32, 1, 3072]
    - [52, 11.4307]
  - - [16, 32, 1, 3072]
    - [18, 327.68]
  - - [32, 32, 1, 3072]
    - [18, 683.854]
  - - [3072, 32, 1, 1]
    - [19, 36.4089]
  - - [3072, 32, 1, 16]
    - [22, 551.882]
  - - [3072, 32, 1, 32]
    - [20, 1187.07]
  - - [1, 3072, 1, 3072]
    - [5, 461.476]
  - - [1, 3072, 1, 1]
    - [40, 1.18154]
  - - [1, 3072, 1, 16]
    - [41, 17.2463]
  - - [1, 3072, 1, 32]
    - [40, 38.5506]
  - - [16, 3072, 1, 1]
    - [70, 16.384]
  - - [16, 3072, 1, 16]
    - [41, 271.183]
  - - [16, 3072, 1, 32]
    - [39, 533.174]
  - - [32, 3072, 1, 1]
    - [44, 35.7469]
  - - [32, 3072, 1, 16]
    - [44, 561.737]
  - - [32, 3072, 1, 32]
    - [44, 1187.07]
  - - [3072, 3072, 1, 1]
    - [98, 252.331]
  - - [4096, 1, 1, 4096]
    - [103, 699.051]
  - - [1, 1, 1, 4096]
    - [52, 0.39961]
  - - [16, 1, 1, 4096]
    - [64, 12.9774]
  - - [32, 1, 1, 4096]
    - [64, 25.7004]
  - - [4096, 1, 1, 1]
    - [103, 1.54566]
  - - [4096, 1, 1, 16]
    - [103, 23.8313]
  - - [4096, 1, 1, 32]
    - [103, 46.8114]
  - - [1, 16, 1, 4096]
    - [52, 6.39376]
  - - [16, 16, 1, 4096]
    - [64, 205.603]
  - - [32, 16, 1, 4096]
    - [64, 403.298]
  - - [4096, 16, 1, 1]
    - [103, 25.7004]
  - - [4096, 16, 1, 16]
    - [6, 349.525]
  - - [4096, 16, 1, 32]
    - [103, 822.413]
  - - [1, 32, 1, 4096]
    - [52, 12.664]
  - - [16, 32, 1, 4096]
    - [64, 411.206]
  - - [32, 32, 1, 4096]
    - [64, 822.413]
  - - [4096, 32, 1, 1]
    - [83, 44.4312]
  - - [4096, 32, 1, 16]
    - [127, 723.156]
  - - [4096, 32, 1, 32]
    - [83, 1446.31]
  - - [1, 4096, 1, 4096]
    - [40, 465.387]
  - - [1, 4096, 1, 1]
    - [40, 1.32129]
  - - [1, 4096, 1, 16]
    - [40, 19.563]
  - - [1, 4096, 1, 32]
    - [40, 41.6102]
  - - [16, 4096, 1, 1]
    - [5, 20.1649]
  - - [16, 4096, 1, 16]
    - [40, 367.921]
  - - [16, 4096, 1, 32]
    - [39, 762.601]
  - - [32, 4096, 1, 1]
    - [17, 38.5506]
  - - [32, 4096, 1, 16]
    - [44, 665.763]
  - - [32, 4096, 1, 32]
    - [41, 1310.72]
  - - [4096, 4096, 1, 1]
    - [97, 271.916]
  - - [320, 1, 1, 64]
    - [16, 9.30909]
  - - [320, 16, 1, 64]
    - [61, 148.945]
  - - [320, 32, 1, 64]
    - [16, 297.891]
  - - [320, 1, 1, 1]
    - [80, 0.145455]
  - - [320, 1, 1, 16]
    - [40, 2.27556]
  - - [320, 1, 1, 32]
    - [15, 4.65455]
  - - [320, 16, 1, 1]
    - [14, 2.27556]
  - - [320, 16, 1, 16]
    - [145, 37.2364]
  - - [320, 16, 1, 32]
    - [80, 76.2047]
  - - [320, 32, 1, 1]
    - [15, 4.65455]
  - - [320, 32, 1, 16]
    - [15, 74.4727]
  - - [320, 32, 1, 32]
    - [150, 152.409]
  - - [320, 64, 1, 1]
    - [6, 9.10222]
  - - [320, 64, 1, 16]
    - [145, 148.945]
  - - [320, 64, 1, 32]
    - [15, 312.076]
  - - [576, 1, 1, 64]
    - [14, 16.384]
  - - [576, 16, 1, 64]
    - [10, 268.102]
  - - [576, 32, 1, 64]
    - [14, 536.204]
  - - [576, 1, 1, 1]
    - [17, 0.261818]
  - - [576, 1, 1, 16]
    - [145, 4.18909]
  - - [576, 1, 1, 32]
    - [10, 8.192]
  - - [576, 16, 1, 1]
    - [7, 4.18909]
  - - [576, 16, 1, 16]
    - [145, 70.2171]
  - - [576, 16, 1, 32]
    - [80, 120.372]
  - - [576, 32, 1, 1]
    - [138, 7.3728]
  - - [576, 32, 1, 16]
    - [14, 137.168]
  - - [576, 32, 1, 32]
    - [10, 268.102]
  - - [576, 64, 1, 1]
    - [22, 14.7456]
  - - [576, 64, 1, 16]
    - [15, 262.144]
  - - [576, 64, 1, 32]
    - [14, 524.288]
  - - [832, 1, 1, 64]
    - [80, 23.6658]
  - - [832, 16, 1, 64]
    - [113, 347.742]
  - - [832, 32, 1, 64]
    - [20, 668.21]
  - - [832, 1, 1, 1]
    - [7, 0.369778]
  - - [832, 1, 1, 16]
    - [10, 5.91644]
  - - [832, 1, 1, 32]
    - [7, 11.8329]
  - - [832, 16, 1, 1]
    - [145, 6.05091]
  - - [832, 16, 1, 16]
    - [6, 90.6349]
  - - [832, 16, 1, 32]
    - [150, 198.132]
  - - [832, 32, 1, 1]
    - [15, 11.5757]
  - - [832, 32, 1, 16]
    - [99, 163.84]
  - - [832, 32, 1, 32]
    - [22, 378.652]
  - - [832, 64, 1, 1]
    - [22, 21.7339]
  - - [832, 64, 1, 16]
    - [22, 354.987]
  - - [832, 64, 1, 32]
    - [14, 709.973]
  - - [1088, 1, 1, 64]
    - [7, 30.2748]
  - - [1088, 16, 1, 64]
    - [10, 454.74]
  - - [1088, 32, 1, 64]
    - [113, 968.793]
  - - [1088, 1, 1, 1]
    - [8, 0.483556]
  - - [1088, 1, 1, 16]
    - [145, 7.91273]
  - - [1088, 1, 1, 32]
    - [24, 13.6533]
  - - [1088, 16, 1, 1]
    - [145, 7.91273]
  - - [1088, 16, 1, 16]
    - [145, 126.604]
  - - [1088, 16, 1, 32]
    - [10, 259.096]
  - - [1088, 32, 1, 1]
    - [25, 14.2106]
  - - [1088, 32, 1, 16]
    - [14, 222.822]
  - - [1088, 32, 1, 32]
    - [16, 506.415]
  - - [1088, 64, 1, 1]
    - [20, 28.4212]
  - - [1088, 64, 1, 16]
    - [20, 454.74]
  - - [1088, 64, 1, 32]
    - [7, 825.268]
  - - [1344, 1, 1, 64]
    - [138, 35.84]
  - - [1344, 16, 1, 64]
    - [7, 598.372]
  - - [1344, 32, 1, 64]
    - [135, 1101.0]
  - - [1344, 1, 1, 1]
    - [150, 0.50717]
  - - [1344, 1, 1, 16]
    - [11, 9.15064]
  - - [1344, 1, 1, 32]
    - [8, 18.6991]
  - - [1344, 16, 1, 1]
    - [145, 9.55733]
  - - [1344, 16, 1, 16]
    - [11, 152.917]
  - - [1344, 16, 1, 32]
    - [80, 312.785]
  - - [1344, 32, 1, 1]
    - [143, 16.8659]
  - - [1344, 32, 1, 16]
    - [145, 286.72]
  - - [1344, 32, 1, 32]
    - [20, 585.641]
  - - [1344, 64, 1, 1]
    - [20, 31.8578]
  - - [1344, 64, 1, 16]
    - [25, 482.897]
  - - [1344, 64, 1, 32]
    - [20, 1038.68]
  - - [1600, 1, 1, 64]
    - [61, 41.7959]
  - - [1600, 16, 1, 64]
    - [80, 712.348]
  - - [1600, 32, 1, 64]
    - [80, 1310.72]
  - - [1600, 1, 1, 1]
    - [80, 0.666667]
  - - [1600, 1, 1, 16]
    - [9, 10.6667]
  - - [1600, 1, 1, 32]
    - [11, 22.2609]
  - - [1600, 16, 1, 1]
    - [138, 10.449]
  - - [1600, 16, 1, 16]
    - [11, 178.087]
  - - [1600, 16, 1, 32]
    - [9, 364.089]
  - - [1600, 32, 1, 1]
    - [17, 20.898]
  - - [1600, 32, 1, 16]
    - [145, 341.333]
  - - [1600, 32, 1, 32]
    - [145, 682.667]
  - - [1600, 64, 1, 1]
    - [20, 37.9259]
  - - [1600, 64, 1, 16]
    - [14, 528.516]
  - - [1600, 64, 1, 32]
    - [20, 1191.56]
  - - [1856, 1, 1, 64]
    - [80, 49.4933]
  - - [1856, 16, 1, 64]
    - [80, 826.323]
  - - [1856, 32, 1, 64]
    - [17, 1490.62]
  - - [1856, 1, 1, 1]
    - [11, 0.806957]
  - - [1856, 1, 1, 16]
    - [8, 12.6366]
  - - [1856, 1, 1, 32]
    - [7, 25.2732]
  - - [1856, 16, 1, 1]
    - [11, 12.9113]
  - - [1856, 16, 1, 16]
    - [8, 202.186]
  - - [1856, 16, 1, 32]
    - [16, 351.953]
  - - [1856, 32, 1, 1]
    - [19, 24.2416]
  - - [1856, 32, 1, 16]
    - [145, 395.947]
  - - [1856, 32, 1, 32]
    - [16, 717.186]
  - - [1856, 64, 1, 1]
    - [21, 43.9941]
  - - [1856, 64, 1, 16]
    - [22, 717.186]
  - - [1856, 64, 1, 32]
    - [20, 1434.37]
  - - [2112, 1, 1, 64]
    - [11, 56.32]
  - - [2112, 16, 1, 64]
    - [6, 920.293]
  - - [2112, 32, 1, 64]
    - [19, 1663.61]
  - - [2112, 1, 1, 1]
    - [62, 0.862041]
  - - [2112, 1, 1, 16]
    - [11, 14.3796]
  - - [2112, 1, 1, 32]
    - [7, 29.3843]
  - - [2112, 16, 1, 1]
    - [10, 14.3796]
  - - [2112, 16, 1, 16]
    - [11, 240.299]
  - - [2112, 16, 1, 32]
    - [7, 480.597]
  - - [2112, 32, 1, 1]
    - [20, 27.5853]
  - - [2112, 32, 1, 16]
    - [25, 408.054]
  - - [2112, 32, 1, 32]
    - [20, 901.12]
  - - [2112, 64, 1, 1]
    - [20, 44.3174]
  - - [2112, 64, 1, 16]
    - [157, 709.078]
  - - [2112, 64, 1, 32]
    - [20, 1441.79]
  - - [2368, 1, 1, 64]
    - [7, 61.858]
  - - [2368, 16, 1, 64]
    - [8, 1031.84]
  - - [2368, 32, 1, 64]
    - [22, 1701.64]
  - - [2368, 1, 1, 1]
    - [7, 1.00766]
  - - [2368, 1, 1, 16]
    - [8, 15.7867]
  - - [2368, 1, 1, 32]
    - [8, 32.9461]
  - - [2368, 16, 1, 1]
    - [9, 14.858]
  - - [2368, 16, 1, 16]
    - [145, 263.569]
  - - [2368, 16, 1, 32]
    - [135, 527.137]
  - - [2368, 32, 1, 1]
    - [22, 31.5733]
  - - [2368, 32, 1, 16]
    - [25, 484.966]
  - - [2368, 32, 1, 32]
    - [20, 989.727]
  - - [2368, 64, 1, 1]
    - [159, 46.6314]
  - - [2368, 64, 1, 16]
    - [20, 782.204]
  - - [2368, 64, 1, 32]
    - [159, 1732.02]
  - - [2624, 1, 1, 64]
    - [80, 64.5908]
  - - [2624, 16, 1, 64]
    - [135, 1119.57]
  - - [2624, 32, 1, 64]
    - [20, 1919.27]
  - - [2624, 1, 1, 1]
    - [11, 1.0496]
  - - [2624, 1, 1, 16]
    - [11, 16.7936]
  - - [2624, 1, 1, 32]
    - [145, 33.5872]
  - - [2624, 16, 1, 1]
    - [11, 17.1363]
  - - [2624, 16, 1, 16]
    - [145, 274.181]
  - - [2624, 16, 1, 32]
    - [80, 559.787]
  - - [2624, 32, 1, 1]
    - [19, 31.0993]
  - - [2624, 32, 1, 16]
    - [20, 497.588]
  - - [2624, 32, 1, 32]
    - [22, 1013.95]
  - - [2624, 64, 1, 1]
    - [20, 52.48]
  - - [2624, 64, 1, 16]
    - [25, 853.008]
  - - [2624, 64, 1, 32]
    - [20, 1733.53]
  - - [2880, 1, 1, 64]
    - [11, 68.2667]
  - - [2880, 16, 1, 64]
    - [135, 1179.65]
  - - [2880, 32, 1, 64]
    - [19, 2069.56]
  - - [2880, 1, 1, 1]
    - [80, 1.12941]
  - - [2880, 1, 1, 16]
    - [7, 18.0706]
  - - [2880, 1, 1, 32]
    - [8, 36.864]
  - - [2880, 16, 1, 1]
    - [11, 18.8082]
  - - [2880, 16, 1, 16]
    - [145, 307.2]
  - - [2880, 16, 1, 32]
    - [80, 614.4]
  - - [2880, 32, 1, 1]
    - [20, 34.7774]
  - - [2880, 32, 1, 16]
    - [20, 508.469]
  - - [2880, 32, 1, 32]
    - [19, 1112.88]
  - - [2880, 64, 1, 1]
    - [30, 60.4328]
  - - [2880, 64, 1, 16]
    - [159, 951.329]
  - - [2880, 64, 1, 32]
    - [13, 2033.88]
  - - [3136, 1, 1, 64]
    - [10, 75.7374]
  - - [3136, 16, 1, 64]
    - [145, 1284.51]
  - - [3136, 32, 1, 64]
    - [25, 2140.84]
  - - [3136, 1, 1, 1]
    - [11, 1.2544]
  - - [3136, 1, 1, 16]
    - [11, 19.6769]
  - - [3136, 1, 1, 32]
    - [135, 38.5969]
  - - [3136, 16, 1, 1]
    - [8, 19.6769]
  - - [3136, 16, 1, 16]
    - [145, 341.624]
  - - [3136, 16, 1, 32]
    - [80, 669.013]
  - - [3136, 32, 1, 1]
    - [20, 37.8687]
  - - [3136, 32, 1, 16]
    - [21, 594.679]
  - - [3136, 32, 1, 32]
    - [20, 1211.8]
  - - [3136, 64, 1, 1]
    - [20, 61.7551]
  - - [3136, 64, 1, 16]
    - [20, 988.081]
  - - [3136, 64, 1, 32]
    - [20, 2071.78]
  - - [3392, 1, 1, 64]
    - [8, 80.403]
  - - [3392, 16, 1, 64]
    - [10, 1335.93]
  - - [3392, 32, 1, 64]
    - [20, 2437.48]
  - - [3392, 1, 1, 1]
    - [10, 1.3302]
  - - [3392, 1, 1, 16]
    - [7, 21.2831]
  - - [3392, 1, 1, 32]
    - [8, 43.4176]
  - - [3392, 16, 1, 1]
    - [7, 19.3829]
  - - [3392, 16, 1, 16]
    - [145, 361.813]
  - - [3392, 16, 1, 32]
    - [135, 694.682]
  - - [3392, 32, 1, 1]
    - [20, 39.4705]
  - - [3392, 32, 1, 16]
    - [19, 631.529]
  - - [3392, 32, 1, 32]
    - [20, 1335.93]
  - - [3392, 64, 1, 1]
    - [83, 65.7842]
  - - [3392, 64, 1, 16]
    - [157, 1036.84]
  - - [3392, 64, 1, 32]
    - [134, 2170.88]
  - - [3648, 1, 1, 64]
    - [7, 86.4711]
  - - [3648, 16, 1, 64]
    - [62, 1464.92]
  - - [3648, 32, 1, 64]
    - [20, 2576.24]
  - - [3648, 1, 1, 1]
    - [62, 1.3766]
  - - [3648, 1, 1, 16]
    - [6, 21.6178]
  - - [3648, 1, 1, 32]
    - [10, 45.7788]
  - - [3648, 16, 1, 1]
    - [13, 22.8894]
  - - [3648, 16, 1, 16]
    - [145, 381.179]
  - - [3648, 16, 1, 32]
    - [10, 778.24]
  - - [3648, 32, 1, 1]
    - [20, 43.2356]
  - - [3648, 32, 1, 16]
    - [20, 691.769]
  - - [3648, 32, 1, 32]
    - [20, 1436.75]
  - - [3648, 64, 1, 1]
    - [20, 67.673]
  - - [3648, 64, 1, 16]
    - [134, 1149.4]
  - - [3648, 64, 1, 32]
    - [134, 2298.8]
  - - [3904, 1, 1, 64]
    - [80, 78.08]
  - - [3904, 16, 1, 64]
    - [10, 1355.15]
  - - [3904, 32, 1, 64]
    - [20, 2460.12]
  - - [3904, 1, 1, 1]
    - [141, 1.25935]
  - - [3904, 1, 1, 16]
    - [13, 21.1742]
  - - [3904, 1, 1, 32]
    - [103, 47.1426]
  - - [3904, 16, 1, 1]
    - [10, 22.7142]
  - - [3904, 16, 1, 16]
    - [8, 356.937]
  - - [3904, 16, 1, 32]
    - [11, 726.854]
  - - [3904, 32, 1, 1]
    - [20, 40.2994]
  - - [3904, 32, 1, 16]
    - [20, 666.283]
  - - [3904, 32, 1, 32]
    - [20, 1355.15]
  - - [3904, 64, 1, 1]
    - [30, 71.3874]
  - - [3904, 64, 1, 16]
    - [30, 1126.11]
  - - [3904, 64, 1, 32]
    - [30, 2220.94]
  - - [1, 320, 1, 64]
    - [40, 8.71489]
  - - [16, 320, 1, 64]
    - [70, 148.945]
  - - [32, 320, 1, 64]
    - [135, 262.144]
  - - [1, 320, 1, 1]
    - [17, 0.142222]
  - - [1, 320, 1, 16]
    - [17, 2.17872]
  - - [1, 320, 1, 32]
    - [8, 4.55111]
  - - [16, 320, 1, 1]
    - [17, 2.27556]
  - - [16, 320, 1, 16]
    - [145, 36.4089]
  - - [16, 320, 1, 32]
    - [14, 74.4727]
  - - [32, 320, 1, 1]
    - [145, 4.65455]
  - - [32, 320, 1, 16]
    - [10, 68.2667]
  - - [32, 320, 1, 32]
    - [14, 152.409]
  - - [64, 320, 1, 1]
    - [152, 9.30909]
  - - [64, 320, 1, 16]
    - [22, 142.47]
  - - [64, 320, 1, 32]
    - [10, 297.891]
  - - [320, 320, 1, 1]
    - [21, 37.9259]
  - - [320, 320, 1, 16]
    - [19, 595.782]
  - - [320, 320, 1, 32]
    - [20, 1129.93]
  - - [576, 320, 1, 1]
    - [20, 58.5143]
  - - [576, 320, 1, 16]
    - [24, 880.334]
  - - [576, 320, 1, 32]
    - [28, 2033.88]
  - - [832, 320, 1, 1]
    - [30, 72.9425]
  - - [832, 320, 1, 16]
    - [30, 1199.95]
  - - [832, 320, 1, 32]
    - [43, 2469.47]
  - - [1088, 320, 1, 1]
    - [34, 89.2718]
  - - [1088, 320, 1, 16]
    - [34, 1428.35]
  - - [1088, 320, 1, 32]
    - [159, 2856.7]
  - - [1344, 320, 1, 1]
    - [91, 102.4]
  - - [1344, 320, 1, 16]
    - [156, 1658.14]
  - - [1344, 320, 1, 32]
    - [134, 3398.16]
  - - [1600, 320, 1, 1]
    - [127, 108.936]
  - - [1600, 320, 1, 16]
    - [127, 1724.63]
  - - [1600, 320, 1, 32]
    - [134, 3561.74]
  - - [1856, 320, 1, 1]
    - [91, 119.984]
  - - [1856, 320, 1, 16]
    - [156, 2021.86]
  - - [1856, 320, 1, 32]
    - [156, 3801.09]
  - - [2112, 320, 1, 1]
    - [91, 135.168]
  - - [2112, 320, 1, 16]
    - [91, 2141.28]
  - - [2112, 320, 1, 32]
    - [139, 4080.54]
  - - [2368, 320, 1, 1]
    - [94, 147.138]
  - - [2368, 320, 1, 16]
    - [156, 2552.45]
  - - [2368, 320, 1, 32]
    - [156, 4575.15]
  - - [2624, 320, 1, 1]
    - [133, 129.182]
  - - [2624, 320, 1, 16]
    - [133, 2051.13]
  - - [2624, 320, 1, 32]
    - [133, 4333.83]
  - - [2880, 320, 1, 1]
    - [127, 140.702]
  - - [2880, 320, 1, 16]
    - [134, 2286.14]
  - - [2880, 320, 1, 32]
    - [127, 4572.28]
  - - [3136, 320, 1, 1]
    - [98, 136.533]
  - - [3136, 320, 1, 16]
    - [98, 2155.21]
  - - [3136, 320, 1, 32]
    - [94, 4225.35]
  - - [3392, 320, 1, 1]
    - [134, 136.533]
  - - [3392, 320, 1, 16]
    - [156, 2170.88]
  - - [3392, 320, 1, 32]
    - [94, 4424.72]
  - - [3648, 320, 1, 1]
    - [104, 142.361]
  - - [3648, 320, 1, 16]
    - [156, 2320.22]
  - - [3648, 320, 1, 32]
    - [94, 4527.94]
  - - [3904, 320, 1, 1]
    - [100, 152.351]
  - - [3904, 320, 1, 16]
    - [156, 2498.56]
  - - [3904, 320, 1, 32]
    - [87, 4816.5]
  - - [1, 576, 1, 64]
    - [40, 15.0465]
  - - [16, 576, 1, 64]
    - [143, 268.102]
  - - [32, 576, 1, 64]
    - [135, 536.204]
  - - [1, 576, 1, 1]
    - [2, 0.235102]
  - - [1, 576, 1, 16]
    - [17, 3.47774]
  - - [1, 576, 1, 32]
    - [40, 8.192]
  - - [16, 576, 1, 1]
    - [17, 4.096]
  - - [16, 576, 1, 16]
    - [143, 65.536]
  - - [16, 576, 1, 32]
    - [14, 134.051]
  - - [32, 576, 1, 1]
    - [150, 7.3728]
  - - [32, 576, 1, 16]
    - [145, 134.051]
  - - [32, 576, 1, 32]
    - [14, 268.102]
  - - [64, 576, 1, 1]
    - [15, 16.0278]
  - - [64, 576, 1, 16]
    - [15, 256.445]
  - - [64, 576, 1, 32]
    - [14, 524.288]
  - - [320, 576, 1, 1]
    - [31, 63.5586]
  - - [320, 576, 1, 16]
    - [44, 1016.94]
  - - [320, 576, 1, 32]
    - [31, 1999.4]
  - - [576, 576, 1, 1]
    - [48, 97.5812]
  - - [576, 576, 1, 16]
    - [48, 1561.3]
  - - [576, 576, 1, 32]
    - [48, 3122.6]
  - - [832, 576, 1, 1]
    - [48, 121.325]
  - - [832, 576, 1, 16]
    - [48, 1916.93]
  - - [832, 576, 1, 32]
    - [121, 3566.38]
  - - [1088, 576, 1, 1]
    - [94, 116.053]
  - - [1088, 576, 1, 16]
    - [156, 2067.42]
  - - [1088, 576, 1, 32]
    - [96, 3679.64]
  - - [1344, 576, 1, 1]
    - [156, 157.989]
  - - [1344, 576, 1, 16]
    - [91, 2428.69]
  - - [1344, 576, 1, 32]
    - [94, 4384.53]
  - - [1600, 576, 1, 1]
    - [108, 144.0]
  - - [1600, 576, 1, 16]
    - [108, 2304.0]
  - - [1600, 576, 1, 32]
    - [134, 4502.47]
  - - [1856, 576, 1, 1]
    - [97, 160.76]
  - - [1856, 576, 1, 16]
    - [97, 2672.64]
  - - [1856, 576, 1, 32]
    - [97, 4751.36]
  - - [2112, 576, 1, 1]
    - [53, 149.265]
  - - [2112, 576, 1, 16]
    - [53, 2479.51]
  - - [2112, 576, 1, 32]
    - [107, 4776.49]
  - - [2368, 576, 1, 1]
    - [48, 156.778]
  - - [2368, 576, 1, 16]
    - [156, 2745.09]
  - - [2368, 576, 1, 32]
    - [94, 5104.91]
  - - [2624, 576, 1, 1]
    - [156, 173.727]
  - - [2624, 576, 1, 16]
    - [156, 2861.87]
  - - [2624, 576, 1, 32]
    - [96, 5559.26]
  - - [2880, 576, 1, 1]
    - [156, 174.619]
  - - [2880, 576, 1, 16]
    - [156, 2932.83]
  - - [2880, 576, 1, 32]
    - [94, 5472.59]
  - - [3136, 576, 1, 1]
    - [94, 173.686]
  - - [3136, 576, 1, 16]
    - [156, 2890.14]
  - - [3136, 576, 1, 32]
    - [108, 5478.93]
  - - [3392, 576, 1, 1]
    - [98, 178.428]
  - - [3392, 576, 1, 16]
    - [156, 2977.21]
  - - [3392, 576, 1, 32]
    - [98, 5532.86]
  - - [3648, 576, 1, 1]
    - [53, 186.778]
  - - [3648, 576, 1, 16]
    - [53, 3112.96]
  - - [3648, 576, 1, 32]
    - [97, 5898.24]
  - - [3904, 576, 1, 1]
    - [98, 201.677]
  - - [3904, 576, 1, 16]
    - [156, 3226.84]
  - - [3904, 576, 1, 32]
    - [98, 6046.94]
  - - [1, 832, 1, 64]
    - [40, 23.1513]
  - - [16, 832, 1, 64]
    - [154, 378.652]
  - - [32, 832, 1, 64]
    - [154, 655.36]
  - - [1, 832, 1, 1]
    - [40, 0.361739]
  - - [1, 832, 1, 16]
    - [40, 5.78783]
  - - [1, 832, 1, 32]
    - [2, 11.0933]
  - - [16, 832, 1, 1]
    - [39, 5.91644]
  - - [16, 832, 1, 16]
    - [40, 85.1968]
  - - [16, 832, 1, 32]
    - [16, 163.84]
  - - [32, 832, 1, 1]
    - [15, 11.8329]
  - - [32, 832, 1, 16]
    - [15, 185.21]
  - - [32, 832, 1, 32]
    - [150, 387.258]
  - - [64, 832, 1, 1]
    - [15, 21.2992]
  - - [64, 832, 1, 16]
    - [145, 354.987]
  - - [64, 832, 1, 32]
    - [19, 709.973]
  - - [320, 832, 1, 1]
    - [30, 73.9556]
  - - [320, 832, 1, 16]
    - [30, 1234.74]
  - - [320, 832, 1, 32]
    - [30, 2581.72]
  - - [576, 832, 1, 1]
    - [134, 111.449]
  - - [576, 832, 1, 16]
    - [134, 1666.89]
  - - [576, 832, 1, 32]
    - [159, 3333.79]
  - - [832, 832, 1, 1]
    - [156, 124.725]
  - - [832, 832, 1, 16]
    - [91, 2051.03]
  - - [832, 832, 1, 32]
    - [91, 4140.41]
  - - [1088, 832, 1, 1]
    - [133, 138.201]
  - - [1088, 832, 1, 16]
    - [156, 2228.22]
  - - [1088, 832, 1, 32]
    - [134, 4526.08]
  - - [1344, 832, 1, 1]
    - [98, 169.425]
  - - [1344, 832, 1, 16]
    - [97, 2611.87]
  - - [1344, 832, 1, 32]
    - [97, 5075.55]
  - - [1600, 832, 1, 1]
    - [156, 153.896]
  - - [1600, 832, 1, 16]
    - [156, 2662.4]
  - - [1600, 832, 1, 32]
    - [96, 5011.58]
  - - [1856, 832, 1, 1]
    - [94, 174.485]
  - - [1856, 832, 1, 16]
    - [156, 2994.8]
  - - [1856, 832, 1, 32]
    - [94, 5583.52]
  - - [2112, 832, 1, 1]
    - [96, 173.122]
  - - [2112, 832, 1, 16]
    - [156, 2883.58]
  - - [2112, 832, 1, 32]
    - [94, 5406.72]
  - - [2368, 832, 1, 1]
    - [98, 175.127]
  - - [2368, 832, 1, 16]
    - [156, 2946.06]
  - - [2368, 832, 1, 32]
    - [94, 5604.06]
  - - [2624, 832, 1, 1]
    - [98, 191.506]
  - - [2624, 832, 1, 16]
    - [156, 3161.15]
  - - [2624, 832, 1, 32]
    - [94, 5996.68]
  - - [2880, 832, 1, 1]
    - [156, 190.929]
  - - [2880, 832, 1, 16]
    - [156, 3276.8]
  - - [2880, 832, 1, 32]
    - [94, 6085.49]
  - - [3136, 832, 1, 1]
    - [96, 190.449]
  - - [3136, 832, 1, 16]
    - [156, 3261.44]
  - - [3136, 832, 1, 32]
    - [156, 5942.55]
  - - [3392, 832, 1, 1]
    - [156, 194.631]
  - - [3392, 832, 1, 16]
    - [156, 3213.83]
  - - [3392, 832, 1, 32]
    - [156, 6081.39]
  - - [3648, 832, 1, 1]
    - [156, 204.386]
  - - [3648, 832, 1, 16]
    - [156, 3431.96]
  - - [3648, 832, 1, 32]
    - [96, 6389.76]
  - - [3904, 832, 1, 1]
    - [156, 209.557]
  - - [3904, 832, 1, 16]
    - [156, 3571.82]
  - - [3904, 832, 1, 32]
    - [156, 6641.54]
  - - [1, 1088, 1, 64]
    - [40, 30.2748]
  - - [16, 1088, 1, 64]
    - [40, 484.397]
  - - [32, 1088, 1, 64]
    - [65, 840.839]
  - - [1, 1088, 1, 1]
    - [40, 0.473043]
  - - [1, 1088, 1, 16]
    - [2, 7.10531]
  - - [1, 1088, 1, 32]
    - [2, 14.2106]
  - - [16, 1088, 1, 1]
    - [5, 7.40766]
  - - [16, 1088, 1, 16]
    - [40, 121.099]
  - - [16, 1088, 1, 32]
    - [15, 214.252]
  - - [32, 1088, 1, 1]
    - [14, 14.8153]
  - - [32, 1088, 1, 16]
    - [145, 247.58]
  - - [32, 1088, 1, 32]
    - [14, 495.161]
  - - [64, 1088, 1, 1]
    - [22, 27.8528]
  - - [64, 1088, 1, 16]
    - [25, 454.74]
  - - [64, 1088, 1, 32]
    - [20, 928.427]
  - - [320, 1088, 1, 1]
    - [48, 94.0973]
  - - [320, 1088, 1, 16]
    - [34, 1446.9]
  - - [320, 1088, 1, 32]
    - [34, 2931.87]
  - - [576, 1088, 1, 1]
    - [156, 124.097]
  - - [576, 1088, 1, 16]
    - [156, 2067.42]
  - - [576, 1088, 1, 32]
    - [134, 3856.54]
  - - [832, 1088, 1, 1]
    - [134, 136.123]
  - - [832, 1088, 1, 16]
    - [156, 2245.5]
  - - [832, 1088, 1, 32]
    - [134, 4422.43]
  - - [1088, 1088, 1, 1]
    - [60, 142.62]
  - - [1088, 1088, 1, 16]
    - [156, 2397.46]
  - - [1088, 1088, 1, 32]
    - [94, 4563.83]
  - - [1344, 1088, 1, 1]
    - [94, 164.3]
  - - [1344, 1088, 1, 16]
    - [156, 2870.72]
  - - [1344, 1088, 1, 32]
    - [94, 5378.47]
  - - [1600, 1088, 1, 1]
    - [156, 171.507]
  - - [1600, 1088, 1, 16]
    - [156, 2785.28]
  - - [1600, 1088, 1, 32]
    - [134, 5382.18]
  - - [1856, 1088, 1, 1]
    - [98, 179.496]
  - - [1856, 1088, 1, 16]
    - [156, 2871.93]
  - - [1856, 1088, 1, 32]
    - [97, 5570.56]
  - - [2112, 1088, 1, 1]
    - [91, 189.124]
  - - [2112, 1088, 1, 16]
    - [156, 3253.6]
  - - [2112, 1088, 1, 32]
    - [96, 6102.19]
  - - [2368, 1088, 1, 1]
    - [96, 192.988]
  - - [2368, 1088, 1, 16]
    - [156, 3258.67]
  - - [2368, 1088, 1, 32]
    - [156, 5974.22]
  - - [2624, 1088, 1, 1]
    - [94, 193.553]
  - - [2624, 1088, 1, 16]
    - [156, 3274.45]
  - - [2624, 1088, 1, 32]
    - [156, 6172.78]
  - - [2880, 1088, 1, 1]
    - [156, 209.595]
  - - [2880, 1088, 1, 16]
    - [156, 3568.33]
  - - [2880, 1088, 1, 32]
    - [96, 6575.09]
  - - [3136, 1088, 1, 1]
    - [96, 206.161]
  - - [3136, 1088, 1, 16]
    - [156, 3533.43]
  - - [3136, 1088, 1, 32]
    - [96, 6403.69]
  - - [3392, 1088, 1, 1]
    - [96, 209.687]
  - - [3392, 1088, 1, 16]
    - [156, 3413.18]
  - - [3392, 1088, 1, 32]
    - [156, 6471.01]
  - - [3648, 1088, 1, 1]
    - [156, 214.542]
  - - [3648, 1088, 1, 16]
    - [156, 3681.41]
  - - [3904, 1088, 1, 1]
    - [156, 217.266]
  - - [3904, 1088, 1, 16]
    - [156, 3663.66]
  - - [1, 1344, 1, 64]
    - [40, 34.4064]
  - - [16, 1344, 1, 64]
    - [146, 598.372]
  - - [32, 1344, 1, 64]
    - [138, 1101.0]
  - - [1, 1344, 1, 1]
    - [40, 0.571915]
  - - [1, 1344, 1, 16]
    - [41, 8.27077]
  - - [1, 1344, 1, 32]
    - [2, 15.9289]
  - - [16, 1344, 1, 1]
    - [40, 8.96]
  - - [16, 1344, 1, 16]
    - [154, 149.593]
  - - [16, 1344, 1, 32]
    - [40, 305.835]
  - - [32, 1344, 1, 1]
    - [15, 17.5543]
  - - [32, 1344, 1, 16]
    - [150, 250.228]
  - - [32, 1344, 1, 32]
    - [14, 573.44]
  - - [64, 1344, 1, 1]
    - [32, 32.4589]
  - - [64, 1344, 1, 16]
    - [20, 519.342]
  - - [64, 1344, 1, 32]
    - [20, 1058.66]
  - - [320, 1344, 1, 1]
    - [58, 106.193]
  - - [320, 1344, 1, 16]
    - [57, 1742.1]
  - - [320, 1344, 1, 32]
    - [58, 3621.73]
  - - [576, 1344, 1, 1]
    - [95, 144.7]
  - - [576, 1344, 1, 16]
    - [95, 2315.2]
  - - [576, 1344, 1, 32]
    - [95, 4587.52]
  - - [832, 1344, 1, 1]
    - [98, 159.744]
  - - [832, 1344, 1, 16]
    - [98, 2592.95]
  - - [832, 1344, 1, 32]
    - [97, 4935.54]
  - - [1088, 1344, 1, 1]
    - [60, 167.117]
  - - [1088, 1344, 1, 16]
    - [156, 2785.28]
  - - [1088, 1344, 1, 32]
    - [60, 5505.02]
  - - [1344, 1344, 1, 1]
    - [60, 177.964]
  - - [1344, 1344, 1, 16]
    - [60, 2752.51]
  - - [1344, 1344, 1, 32]
    - [134, 5427.49]
  - - [1600, 1344, 1, 1]
    - [60, 197.284]
  - - [1600, 1344, 1, 16]
    - [60, 3085.78]
  - - [1600, 1344, 1, 32]
    - [97, 6089.63]
  - - [1856, 1344, 1, 1]
    - [98, 197.973]
  - - [1856, 1344, 1, 16]
    - [156, 3155.05]
  - - [1856, 1344, 1, 32]
    - [95, 6163.93]
  - - [2112, 1344, 1, 1]
    - [53, 199.896]
  - - [2112, 1344, 1, 16]
    - [156, 3315.07]
  - - [2112, 1344, 1, 32]
    - [96, 6158.16]
  - - [2368, 1344, 1, 1]
    - [97, 215.04]
  - - [2368, 1344, 1, 16]
    - [156, 3560.94]
  - - [2368, 1344, 1, 32]
    - [97, 6570.51]
  - - [2624, 1344, 1, 1]
    - [97, 217.025]
  - - [2624, 1344, 1, 16]
    - [97, 3430.18]
  - - [2624, 1344, 1, 32]
    - [97, 6798.37]
  - - [2880, 1344, 1, 1]
    - [97, 225.042]
  - - [2880, 1344, 1, 16]
    - [156, 3611.17]
  - - [2880, 1344, 1, 32]
    - [156, 6843.26]
  - - [3136, 1344, 1, 1]
    - [98, 221.831]
  - - [3136, 1344, 1, 16]
    - [156, 3635.39]
  - - [3392, 1344, 1, 1]
    - [98, 236.823]
  - - [3392, 1344, 1, 16]
    - [98, 3702.62]
  - - [3648, 1344, 1, 1]
    - [97, 240.339]
  - - [3648, 1344, 1, 16]
    - [97, 3817.35]
  - - [3904, 1344, 1, 1]
    - [97, 236.884]
  - - [3904, 1344, 1, 16]
    - [156, 3807.33]
  - - [1, 1600, 1, 64]
    - [40, 40.96]
  - - [16, 1600, 1, 64]
    - [146, 712.348]
  - - [32, 1600, 1, 64]
    - [150, 1310.72]
  - - [1, 1600, 1, 1]
    - [40, 0.666667]
  - - [1, 1600, 1, 16]
    - [40, 10.449]
  - - [1, 1600, 1, 32]
    - [40, 21.7872]
  - - [16, 1600, 1, 1]
    - [39, 10.6667]
  - - [16, 1600, 1, 16]
    - [40, 170.667]
  - - [16, 1600, 1, 32]
    - [39, 348.596]
  - - [32, 1600, 1, 1]
    - [15, 20.898]
  - - [32, 1600, 1, 16]
    - [145, 334.367]
  - - [32, 1600, 1, 32]
    - [15, 682.667]
  - - [64, 1600, 1, 1]
    - [20, 37.9259]
  - - [64, 1600, 1, 16]
    - [20, 595.782]
  - - [64, 1600, 1, 32]
    - [19, 1260.31]
  - - [320, 1600, 1, 1]
    - [134, 105.567]
  - - [320, 1600, 1, 16]
    - [134, 1724.63]
  - - [320, 1600, 1, 32]
    - [134, 3561.74]
  - - [576, 1600, 1, 1]
    - [72, 144.0]
  - - [576, 1600, 1, 16]
    - [72, 2286.14]
  - - [576, 1600, 1, 32]
    - [134, 4537.11]
  - - [832, 1600, 1, 1]
    - [156, 154.791]
  - - [832, 1600, 1, 16]
    - [156, 2629.53]
  - - [832, 1600, 1, 32]
    - [94, 4868.39]
  - - [1088, 1600, 1, 1]
    - [91, 170.667]
  - - [1088, 1600, 1, 16]
    - [156, 2785.28]
  - - [1088, 1600, 1, 32]
    - [156, 5230.57]
  - - [1344, 1600, 1, 1]
    - [98, 188.632]
  - - [1344, 1600, 1, 16]
    - [156, 3031.4]
  - - [1344, 1600, 1, 32]
    - [97, 5983.72]
  - - [1600, 1600, 1, 1]
    - [94, 189.63]
  - - [1600, 1600, 1, 16]
    - [156, 3162.93]
  - - [1600, 1600, 1, 32]
    - [156, 5957.82]
  - - [1856, 1600, 1, 1]
    - [94, 195.368]
  - - [1856, 1600, 1, 16]
    - [156, 3311.05]
  - - [1856, 1600, 1, 32]
    - [96, 6272.42]
  - - [2112, 1600, 1, 1]
    - [98, 210.542]
  - - [2112, 1600, 1, 16]
    - [156, 3432.84]
  - - [2112, 1600, 1, 32]
    - [97, 6634.01]
  - - [2368, 1600, 1, 1]
    - [98, 214.663]
  - - [2368, 1600, 1, 16]
    - [156, 3545.08]
  - - [2368, 1600, 1, 32]
    - [96, 6607.17]
  - - [2624, 1600, 1, 1]
    - [156, 215.303]
  - - [2624, 1600, 1, 16]
    - [156, 3650.78]
  - - [2880, 1600, 1, 1]
    - [98, 225.882]
  - - [2880, 1600, 1, 16]
    - [156, 3723.64]
  - - [3136, 1600, 1, 1]
    - [97, 223.501]
  - - [3136, 1600, 1, 16]
    - [156, 3769.09]
  - - [3392, 1600, 1, 1]
    - [97, 227.079]
  - - [3392, 1600, 1, 16]
    - [156, 3842.27]
  - - [3648, 1600, 1, 1]
    - [98, 238.724]
  - - [3648, 1600, 1, 16]
    - [156, 3907.48]
  - - [3904, 1600, 1, 1]
    - [97, 240.246]
  - - [3904, 1600, 1, 16]
    - [156, 3973.85]
  - - [1, 1856, 1, 64]
    - [40, 43.9941]
  - - [16, 1856, 1, 64]
    - [147, 844.686]
  - - [32, 1856, 1, 64]
    - [14, 1461.96]
  - - [1, 1856, 1, 1]
    - [40, 0.757551]
  - - [1, 1856, 1, 16]
    - [2, 10.7985]
  - - [1, 1856, 1, 32]
    - [41, 23.291]
  - - [16, 1856, 1, 1]
    - [40, 12.6366]
  - - [16, 1856, 1, 16]
    - [40, 197.973]
  - - [16, 1856, 1, 32]
    - [40, 413.162]
  - - [32, 1856, 1, 1]
    - [15, 23.7568]
  - - [32, 1856, 1, 16]
    - [145, 387.866]
  - - [32, 1856, 1, 32]
    - [16, 703.905]
  - - [64, 1856, 1, 1]
    - [25, 43.9941]
  - - [64, 1856, 1, 16]
    - [24, 691.107]
  - - [64, 1856, 1, 32]
    - [20, 1407.81]
  - - [320, 1856, 1, 1]
    - [134, 109.985]
  - - [320, 1856, 1, 16]
    - [60, 1743.62]
  - - [320, 1856, 1, 32]
    - [95, 3654.89]
  - - [576, 1856, 1, 1]
    - [98, 152.722]
  - - [576, 1856, 1, 16]
    - [98, 2426.23]
  - - [576, 1856, 1, 32]
    - [97, 4654.39]
  - - [832, 1856, 1, 1]
    - [95, 170.629]
  - - [832, 1856, 1, 16]
    - [95, 2730.06]
  - - [832, 1856, 1, 32]
    - [95, 5521.13]
  - - [1088, 1856, 1, 1]
    - [98, 177.914]
  - - [1088, 1856, 1, 16]
    - [156, 2937.2]
  - - [1088, 1856, 1, 32]
    - [98, 5643.54]
  - - [1344, 1856, 1, 1]
    - [95, 193.369]
  - - [1344, 1856, 1, 16]
    - [156, 3167.57]
  - - [1344, 1856, 1, 32]
    - [95, 6116.69]
  - - [1600, 1856, 1, 1]
    - [156, 197.316]
  - - [1600, 1856, 1, 16]
    - [156, 3322.63]
  - - [1600, 1856, 1, 32]
    - [96, 6251.79]
  - - [1856, 1856, 1, 1]
    - [98, 215.296]
  - - [1856, 1856, 1, 16]
    - [97, 3402.21]
  - - [1856, 1856, 1, 32]
    - [97, 6783.48]
  - - [2112, 1856, 1, 1]
    - [156, 212.459]
  - - [2112, 1856, 1, 16]
    - [156, 3614.87]
  - - [2368, 1856, 1, 1]
    - [97, 225.964]
  - - [2368, 1856, 1, 16]
    - [156, 3672.07]
  - - [2624, 1856, 1, 1]
    - [97, 231.361]
  - - [2624, 1856, 1, 16]
    - [156, 3810.38]
  - - [2880, 1856, 1, 1]
    - [97, 226.495]
  - - [2880, 1856, 1, 16]
    - [156, 3843.8]
  - - [3136, 1856, 1, 1]
    - [97, 236.122]
  - - [3136, 1856, 1, 16]
    - [156, 3864.18]
  - - [3392, 1856, 1, 1]
    - [97, 236.231]
  - - [3392, 1856, 1, 16]
    - [156, 3911.8]
  - - [3648, 1856, 1, 1]
    - [98, 240.95]
  - - [3648, 1856, 1, 16]
    - [156, 3827.95]
  - - [3904, 1856, 1, 1]
    - [97, 243.967]
  - - [3904, 1856, 1, 16]
    - [156, 4039.48]
  - - [1, 2112, 1, 64]
    - [40, 54.0672]
  - - [16, 2112, 1, 64]
    - [146, 901.12]
  - - [32, 2112, 1, 64]
    - [141, 1544.78]
  - - [1, 2112, 1, 1]
    - [40, 0.862041]
  - - [1, 2112, 1, 16]
    - [40, 13.5168]
  - - [1, 2112, 1, 32]
    - [40, 28.16]
  - - [16, 2112, 1, 1]
    - [40, 14.3796]
  - - [16, 2112, 1, 16]
    - [40, 225.28]
  - - [16, 2112, 1, 32]
    - [2, 400.498]
  - - [32, 2112, 1, 1]
    - [39, 24.576]
  - - [32, 2112, 1, 16]
    - [17, 372.877]
  - - [32, 2112, 1, 32]
    - [42, 772.389]
  - - [64, 2112, 1, 1]
    - [159, 47.4274]
  - - [64, 2112, 1, 16]
    - [34, 745.754]
  - - [64, 2112, 1, 32]
    - [159, 1544.78]
  - - [320, 2112, 1, 1]
    - [95, 133.83]
  - - [320, 2112, 1, 16]
    - [109, 2141.28]
  - - [320, 2112, 1, 32]
    - [60, 3968.23]
  - - [576, 2112, 1, 1]
    - [53, 149.265]
  - - [576, 2112, 1, 16]
    - [53, 2479.51]
  - - [576, 2112, 1, 32]
    - [53, 4835.82]
  - - [832, 2112, 1, 1]
    - [95, 168.152]
  - - [832, 2112, 1, 16]
    - [95, 2690.43]
  - - [832, 2112, 1, 32]
    - [134, 5329.85]
  - - [1088, 2112, 1, 1]
    - [98, 193.912]
  - - [1088, 2112, 1, 16]
    - [156, 3129.0]
  - - [1088, 2112, 1, 32]
    - [97, 6002.56]
  - - [1344, 2112, 1, 1]
    - [53, 200.603]
  - - [1344, 2112, 1, 16]
    - [156, 3221.02]
  - - [1344, 2112, 1, 32]
    - [53, 6200.2]
  - - [1600, 2112, 1, 1]
    - [97, 217.312]
  - - [1600, 2112, 1, 16]
    - [98, 3421.97]
  - - [1600, 2112, 1, 32]
    - [98, 6573.52]
  - - [1856, 2112, 1, 1]
    - [97, 215.378]
  - - [1856, 2112, 1, 16]
    - [156, 3583.88]
  - - [2112, 2112, 1, 1]
    - [97, 226.424]
  - - [2112, 2112, 1, 16]
    - [156, 3632.0]
  - - [2368, 2112, 1, 1]
    - [97, 233.157]
  - - [2368, 2112, 1, 16]
    - [156, 3774.5]
  - - [2624, 2112, 1, 1]
    - [97, 234.826]
  - - [2624, 2112, 1, 16]
    - [156, 3830.25]
  - - [2880, 2112, 1, 1]
    - [97, 247.762]
  - - [2880, 2112, 1, 16]
    - [97, 3940.12]
  - - [3136, 2112, 1, 1]
    - [98, 243.95]
  - - [3136, 2112, 1, 16]
    - [156, 3976.42]
  - - [3392, 2112, 1, 1]
    - [98, 253.141]
  - - [3392, 2112, 1, 16]
    - [97, 4064.63]
  - - [3648, 2112, 1, 1]
    - [97, 254.697]
  - - [3648, 2112, 1, 16]
    - [97, 4035.13]
  - - [3904, 2112, 1, 1]
    - [97, 259.693]
  - - [1, 2368, 1, 64]
    - [40, 53.1761]
  - - [16, 2368, 1, 64]
    - [70, 866.011]
  - - [32, 2368, 1, 64]
    - [42, 1763.51]
  - - [1, 2368, 1, 1]
    - [40, 0.966531]
  - - [1, 2368, 1, 16]
    - [40, 16.1226]
  - - [1, 2368, 1, 32]
    - [40, 32.2451]
  - - [16, 2368, 1, 1]
    - [70, 15.1552]
  - - [16, 2368, 1, 16]
    - [39, 247.432]
  - - [16, 2368, 1, 32]
    - [39, 527.137]
  - - [32, 2368, 1, 1]
    - [71, 28.0652]
  - - [32, 2368, 1, 16]
    - [145, 457.515]
  - - [32, 2368, 1, 32]
    - [14, 898.086]
  - - [64, 2368, 1, 1]
    - [34, 48.1117]
  - - [64, 2368, 1, 16]
    - [31, 808.277]
  - - [64, 2368, 1, 32]
    - [159, 1763.51]
  - - [320, 2368, 1, 1]
    - [109, 145.723]
  - - [320, 2368, 1, 16]
    - [95, 2224.62]
  - - [320, 2368, 1, 32]
    - [95, 4330.06]
  - - [576, 2368, 1, 1]
    - [60, 160.467]
  - - [576, 2368, 1, 16]
    - [156, 2613.59]
  - - [576, 2368, 1, 32]
    - [95, 4988.23]
  - - [832, 2368, 1, 1]
    - [98, 174.352]
  - - [832, 2368, 1, 16]
    - [156, 2827.16]
  - - [832, 2368, 1, 32]
    - [98, 5506.17]
  - - [1088, 2368, 1, 1]
    - [97, 188.057]
  - - [1088, 2368, 1, 16]
    - [156, 3064.84]
  - - [1088, 2368, 1, 32]
    - [109, 5785.56]
  - - [1344, 2368, 1, 1]
    - [98, 203.361]
  - - [1344, 2368, 1, 16]
    - [156, 3499.76]
  - - [1344, 2368, 1, 32]
    - [95, 6549.39]
  - - [1600, 2368, 1, 1]
    - [97, 211.665]
  - - [1600, 2368, 1, 16]
    - [156, 3504.09]
  - - [1600, 2368, 1, 32]
    - [96, 6589.22]
  - - [1856, 2368, 1, 1]
    - [97, 221.411]
  - - [1856, 2368, 1, 16]
    - [156, 3596.94]
  - - [2112, 2368, 1, 1]
    - [97, 231.538]
  - - [2112, 2368, 1, 16]
    - [156, 3713.2]
  - - [2368, 2368, 1, 1]
    - [97, 233.157]
  - - [2368, 2368, 1, 16]
    - [156, 3850.59]
  - - [2624, 2368, 1, 1]
    - [97, 241.306]
  - - [2624, 2368, 1, 16]
    - [156, 3883.52]
  - - [2880, 2368, 1, 1]
    - [98, 242.268]
  - - [2880, 2368, 1, 16]
    - [156, 3975.13]
  - - [3136, 2368, 1, 1]
    - [98, 246.713]
  - - [3136, 2368, 1, 16]
    - [156, 3960.56]
  - - [3392, 2368, 1, 1]
    - [98, 249.062]
  - - [3648, 2368, 1, 1]
    - [97, 231.594]
  - - [3904, 2368, 1, 1]
    - [98, 240.121]
  - - [1, 2624, 1, 64]
    - [40, 61.0676]
  - - [16, 2624, 1, 64]
    - [146, 1074.79]
  - - [32, 2624, 1, 64]
    - [14, 1791.32]
  - - [1, 2624, 1, 1]
    - [41, 0.937143]
  - - [1, 2624, 1, 16]
    - [40, 16.1477]
  - - [1, 2624, 1, 32]
    - [40, 33.5872]
  - - [16, 2624, 1, 1]
    - [40, 16.4643]
  - - [16, 2624, 1, 16]
    - [40, 253.488]
  - - [16, 2624, 1, 32]
    - [40, 548.362]
  - - [32, 2624, 1, 1]
    - [15, 29.4625]
  - - [32, 2624, 1, 16]
    - [15, 471.399]
  - - [32, 2624, 1, 32]
    - [14, 977.082]
  - - [64, 2624, 1, 1]
    - [34, 53.313]
  - - [64, 2624, 1, 16]
    - [34, 895.659]
  - - [64, 2624, 1, 32]
    - [31, 1628.47]
  - - [320, 2624, 1, 1]
    - [134, 131.2]
  - - [320, 2624, 1, 16]
    - [134, 2051.13]
  - - [320, 2624, 1, 32]
    - [134, 4265.04]
  - - [576, 2624, 1, 1]
    - [95, 170.782]
  - - [576, 2624, 1, 16]
    - [95, 2701.99]
  - - [576, 2624, 1, 32]
    - [95, 5465.04]
  - - [832, 2624, 1, 1]
    - [98, 185.802]
  - - [832, 2624, 1, 16]
    - [156, 3091.21]
  - - [832, 2624, 1, 32]
    - [95, 5749.91]
  - - [1088, 2624, 1, 1]
    - [60, 196.214]
  - - [1088, 2624, 1, 16]
    - [156, 3216.8]
  - - [1088, 2624, 1, 32]
    - [96, 6070.24]
  - - [1344, 2624, 1, 1]
    - [97, 212.449]
  - - [1344, 2624, 1, 16]
    - [156, 3409.46]
  - - [1344, 2624, 1, 32]
    - [97, 6523.29]
  - - [1600, 2624, 1, 1]
    - [97, 212.04]
  - - [1600, 2624, 1, 16]
    - [156, 3418.54]
  - - [1856, 2624, 1, 1]
    - [97, 223.401]
  - - [1856, 2624, 1, 16]
    - [156, 3728.34]
  - - [2112, 2624, 1, 1]
    - [97, 233.835]
  - - [2112, 2624, 1, 16]
    - [156, 3855.23]
  - - [2368, 2624, 1, 1]
    - [97, 238.07]
  - - [2368, 2624, 1, 16]
    - [156, 3953.01]
  - - [2624, 2624, 1, 1]
    - [97, 243.3]
  - - [2624, 2624, 1, 16]
    - [156, 3977.11]
  - - [2880, 2624, 1, 1]
    - [97, 246.562]
  - - [2880, 2624, 1, 16]
    - [156, 4030.46]
  - - [3136, 2624, 1, 1]
    - [97, 246.005]
  - - [3392, 2624, 1, 1]
    - [97, 239.264]
  - - [3648, 2624, 1, 1]
    - [97, 242.645]
  - - [3904, 2624, 1, 1]
    - [98, 246.252]
  - - [1, 2880, 1, 64]
    - [40, 61.44]
  - - [16, 2880, 1, 64]
    - [154, 1156.52]
  - - [32, 2880, 1, 64]
    - [71, 1966.08]
  - - [1, 2880, 1, 1]
    - [40, 1.12941]
  - - [1, 2880, 1, 16]
    - [40, 15.6203]
  - - [1, 2880, 1, 32]
    - [40, 33.5127]
  - - [16, 2880, 1, 1]
    - [143, 17.7231]
  - - [16, 2880, 1, 16]
    - [40, 289.129]
  - - [16, 2880, 1, 32]
    - [39, 517.389]
  - - [32, 2880, 1, 1]
    - [44, 34.1333]
  - - [32, 2880, 1, 16]
    - [44, 526.629]
  - - [32, 2880, 1, 32]
    - [45, 1092.27]
  - - [64, 2880, 1, 1]
    - [34, 56.7138]
  - - [64, 2880, 1, 16]
    - [34, 1016.94]
  - - [64, 2880, 1, 32]
    - [34, 2069.56]
  - - [320, 2880, 1, 1]
    - [48, 141.785]
  - - [320, 2880, 1, 16]
    - [48, 2200.84]
  - - [320, 2880, 1, 32]
    - [134, 4572.28]
  - - [576, 2880, 1, 1]
    - [95, 171.905]
  - - [576, 2880, 1, 16]
    - [95, 2694.63]
  - - [576, 2880, 1, 32]
    - [95, 5389.25]
  - - [832, 2880, 1, 1]
    - [95, 193.239]
  - - [832, 2880, 1, 16]
    - [95, 3067.08]
  - - [832, 2880, 1, 32]
    - [95, 6233.91]
  - - [1088, 2880, 1, 1]
    - [97, 204.133]
  - - [1088, 2880, 1, 16]
    - [97, 3276.8]
  - - [1088, 2880, 1, 32]
    - [97, 6407.03]
  - - [1344, 2880, 1, 1]
    - [97, 210.938]
  - - [1344, 2880, 1, 16]
    - [156, 3579.86]
  - - [1344, 2880, 1, 32]
    - [156, 6519.11]
  - - [1600, 2880, 1, 1]
    - [97, 230.4]
  - - [1600, 2880, 1, 16]
    - [98, 3677.21]
  - - [1856, 2880, 1, 1]
    - [97, 233.418]
  - - [1856, 2880, 1, 16]
    - [156, 3718.46]
  - - [2112, 2880, 1, 1]
    - [97, 244.771]
  - - [2112, 2880, 1, 16]
    - [97, 3854.3]
  - - [2368, 2880, 1, 1]
    - [97, 245.318]
  - - [2368, 2880, 1, 16]
    - [156, 3918.04]
  - - [2624, 2880, 1, 1]
    - [97, 249.41]
  - - [2624, 2880, 1, 16]
    - [156, 3983.98]
  - - [2880, 2880, 1, 1]
    - [97, 256.793]
  - - [3136, 2880, 1, 1]
    - [97, 242.787]
  - - [3392, 2880, 1, 1]
    - [98, 251.777]
  - - [3648, 2880, 1, 1]
    - [97, 253.468]
  - - [3904, 2880, 1, 1]
    - [97, 257.879]
  - - [1, 3136, 1, 64]
    - [40, 65.8046]
  - - [16, 3136, 1, 64]
    - [40, 1146.88]
  - - [32, 3136, 1, 64]
    - [15, 2105.75]
  - - [1, 3136, 1, 1]
    - [2, 1.10035]
  - - [1, 3136, 1, 16]
    - [41, 17.6056]
  - - [1, 3136, 1, 32]
    - [40, 38.5969]
  - - [16, 3136, 1, 1]
    - [40, 19.2985]
  - - [16, 3136, 1, 16]
    - [40, 314.83]
  - - [16, 3136, 1, 32]
    - [39, 629.66]
  - - [32, 3136, 1, 1]
    - [41, 31.36]
  - - [32, 3136, 1, 16]
    - [15, 563.38]
  - - [32, 3136, 1, 32]
    - [14, 1126.76]
  - - [64, 3136, 1, 1]
    - [157, 61.7551]
  - - [64, 3136, 1, 16]
    - [20, 973.11]
  - - [64, 3136, 1, 32]
    - [157, 1976.16]
  - - [320, 3136, 1, 1]
    - [60, 147.576]
  - - [320, 3136, 1, 16]
    - [60, 2277.49]
  - - [320, 3136, 1, 32]
    - [97, 4491.28]
  - - [576, 3136, 1, 1]
    - [60, 180.634]
  - - [576, 3136, 1, 16]
    - [60, 2726.54]
  - - [576, 3136, 1, 32]
    - [134, 5453.09]
  - - [832, 3136, 1, 1]
    - [60, 196.177]
  - - [832, 3136, 1, 16]
    - [60, 3069.59]
  - - [832, 3136, 1, 32]
    - [95, 5778.05]
  - - [1088, 3136, 1, 1]
    - [60, 209.323]
  - - [1088, 3136, 1, 16]
    - [156, 3369.84]
  - - [1088, 3136, 1, 32]
    - [98, 6366.35]
  - - [1344, 3136, 1, 1]
    - [60, 215.04]
  - - [1344, 3136, 1, 16]
    - [156, 3530.71]
  - - [1600, 3136, 1, 1]
    - [60, 225.004]
  - - [1600, 3136, 1, 16]
    - [156, 3616.29]
  - - [1856, 3136, 1, 1]
    - [97, 233.752]
  - - [1856, 3136, 1, 16]
    - [156, 3816.67]
  - - [2112, 3136, 1, 1]
    - [97, 239.106]
  - - [2112, 3136, 1, 16]
    - [156, 3910.4]
  - - [2368, 3136, 1, 1]
    - [97, 248.363]
  - - [2368, 3136, 1, 16]
    - [156, 3987.14]
  - - [2624, 3136, 1, 1]
    - [98, 250.498]
  - - [2880, 3136, 1, 1]
    - [97, 241.812]
  - - [3136, 3136, 1, 1]
    - [97, 244.335]
  - - [3392, 3136, 1, 1]
    - [97, 249.117]
  - - [3648, 3136, 1, 1]
    - [97, 252.821]
  - - [3904, 3136, 1, 1]
    - [97, 257.475]
  - - [1, 3392, 1, 64]
    - [41, 71.1764]
  - - [16, 3392, 1, 64]
    - [40, 1310.72]
  - - [32, 3392, 1, 64]
    - [41, 2170.88]
  - - [1, 3392, 1, 1]
    - [40, 1.28]
  - - [1, 3392, 1, 16]
    - [41, 19.0428]
  - - [1, 3392, 1, 32]
    - [41, 35.5882]
  - - [16, 3392, 1, 1]
    - [39, 21.2831]
  - - [16, 3392, 1, 16]
    - [40, 333.982]
  - - [16, 3392, 1, 32]
    - [39, 694.682]
  - - [32, 3392, 1, 1]
    - [44, 32.4012]
  - - [32, 3392, 1, 16]
    - [44, 598.863]
  - - [32, 3392, 1, 32]
    - [44, 1177.43]
  - - [64, 3392, 1, 1]
    - [157, 65.7842]
  - - [64, 3392, 1, 16]
    - [157, 1006.78]
  - - [64, 3392, 1, 32]
    - [157, 2105.1]
  - - [320, 3392, 1, 1]
    - [58, 144.725]
  - - [320, 3392, 1, 16]
    - [58, 2240.91]
  - - [320, 3392, 1, 32]
    - [57, 4341.76]
  - - [576, 3392, 1, 1]
    - [60, 172.902]
  - - [576, 3392, 1, 16]
    - [156, 2778.73]
  - - [576, 3392, 1, 32]
    - [134, 5366.64]
  - - [832, 3392, 1, 1]
    - [156, 191.332]
  - - [832, 3392, 1, 16]
    - [156, 3168.72]
  - - [832, 3392, 1, 32]
    - [96, 5960.96]
  - - [1088, 3392, 1, 1]
    - [97, 204.46]
  - - [1088, 3392, 1, 16]
    - [156, 3453.1]
  - - [1088, 3392, 1, 32]
    - [94, 6366.35]
  - - [1344, 3392, 1, 1]
    - [98, 222.383]
  - - [1344, 3392, 1, 16]
    - [97, 3532.28]
  - - [1600, 3392, 1, 1]
    - [97, 227.079]
  - - [1600, 3392, 1, 16]
    - [156, 3718.85]
  - - [1856, 3392, 1, 1]
    - [97, 234.909]
  - - [1856, 3392, 1, 16]
    - [156, 3822.73]
  - - [2112, 3392, 1, 1]
    - [97, 245.76]
  - - [2112, 3392, 1, 16]
    - [156, 3973.05]
  - - [2368, 3392, 1, 1]
    - [97, 249.449]
  - - [2624, 3392, 1, 1]
    - [98, 237.666]
  - - [2880, 3392, 1, 1]
    - [98, 244.836]
  - - [3136, 3392, 1, 1]
    - [97, 247.092]
  - - [3392, 3392, 1, 1]
    - [97, 249.04]
  - - [3648, 3392, 1, 1]
    - [97, 254.087]
  - - [3904, 3392, 1, 1]
    - [97, 262.225]
  - - [1, 3648, 1, 64]
    - [5, 67.673]
  - - [16, 3648, 1, 64]
    - [40, 1358.38]
  - - [32, 3648, 1, 64]
    - [44, 2576.24]
  - - [1, 3648, 1, 1]
    - [40, 1.40308]
  - - [1, 3648, 1, 16]
    - [41, 20.1269]
  - - [1, 3648, 1, 32]
    - [40, 44.8985]
  - - [16, 3648, 1, 1]
    - [39, 22.0257]
  - - [16, 3648, 1, 16]
    - [40, 366.231]
  - - [16, 3648, 1, 32]
    - [39, 732.461]
  - - [32, 3648, 1, 1]
    - [44, 41.6914]
  - - [32, 3648, 1, 16]
    - [44, 667.063]
  - - [32, 3648, 1, 32]
    - [44, 1409.64]
  - - [64, 3648, 1, 1]
    - [34, 70.7491]
  - - [64, 3648, 1, 16]
    - [48, 1205.02]
  - - [64, 3648, 1, 32]
    - [134, 2449.54]
  - - [320, 3648, 1, 1]
    - [48, 139.804]
  - - [320, 3648, 1, 16]
    - [60, 2223.54]
  - - [320, 3648, 1, 32]
    - [95, 4343.67]
  - - [576, 3648, 1, 1]
    - [53, 187.611]
  - - [576, 3648, 1, 16]
    - [53, 3070.32]
  - - [576, 3648, 1, 32]
    - [53, 5924.22]
  - - [832, 3648, 1, 1]
    - [95, 197.729]
  - - [832, 3648, 1, 16]
    - [156, 3303.55]
  - - [832, 3648, 1, 32]
    - [95, 6245.94]
  - - [1088, 3648, 1, 1]
    - [97, 210.558]
  - - [1088, 3648, 1, 16]
    - [156, 3498.86]
  - - [1344, 3648, 1, 1]
    - [97, 231.269]
  - - [1344, 3648, 1, 16]
    - [156, 3735.55]
  - - [1600, 3648, 1, 1]
    - [97, 241.689]
  - - [1600, 3648, 1, 16]
    - [97, 3811.79]
  - - [1856, 3648, 1, 1]
    - [98, 246.655]
  - - [1856, 3648, 1, 16]
    - [156, 3868.96]
  - - [2112, 3648, 1, 1]
    - [97, 252.196]
  - - [2112, 3648, 1, 16]
    - [156, 3995.89]
  - - [2368, 3648, 1, 1]
    - [97, 231.905]
  - - [2624, 3648, 1, 1]
    - [98, 248.31]
  - - [2880, 3648, 1, 1]
    - [97, 251.646]
  - - [3136, 3648, 1, 1]
    - [97, 256.218]
  - - [3392, 3648, 1, 1]
    - [98, 258.871]
  - - [3648, 3648, 1, 1]
    - [97, 261.452]
  - - [3904, 3648, 1, 1]
    - [98, 263.006]
  - - [1, 3904, 1, 64]
    - [41, 70.382]
  - - [16, 3904, 1, 64]
    - [39, 1269.11]
  - - [32, 3904, 1, 64]
    - [14, 2252.22]
  - - [1, 3904, 1, 1]
    - [40, 1.22]
  - - [1, 3904, 1, 16]
    - [40, 21.5393]
  - - [1, 3904, 1, 32]
    - [40, 40.96]
  - - [16, 3904, 1, 1]
    - [39, 21.9172]
  - - [16, 3904, 1, 16]
    - [40, 322.395]
  - - [16, 3904, 1, 32]
    - [40, 655.36]
  - - [32, 3904, 1, 1]
    - [71, 40.2994]
  - - [32, 3904, 1, 16]
    - [145, 644.79]
  - - [32, 3904, 1, 32]
    - [41, 1249.28]
  - - [64, 3904, 1, 1]
    - [34, 73.4871]
  - - [64, 3904, 1, 16]
    - [158, 1110.47]
  - - [64, 3904, 1, 32]
    - [34, 2252.22]
  - - [320, 3904, 1, 1]
    - [60, 148.724]
  - - [320, 3904, 1, 16]
    - [95, 2337.83]
  - - [320, 3904, 1, 32]
    - [95, 4595.05]
  - - [576, 3904, 1, 1]
    - [109, 185.843]
  - - [576, 3904, 1, 16]
    - [156, 2937.08]
  - - [576, 3904, 1, 32]
    - [95, 5971.66]
  - - [832, 3904, 1, 1]
    - [95, 204.285]
  - - [832, 3904, 1, 16]
    - [95, 3248.13]
  - - [832, 3904, 1, 32]
    - [109, 6599.37]
  - - [1088, 3904, 1, 1]
    - [97, 216.16]
  - - [1088, 3904, 1, 16]
    - [156, 3476.26]
  - - [1344, 3904, 1, 1]
    - [97, 226.651]
  - - [1344, 3904, 1, 16]
    - [156, 3674.03]
  - - [1600, 3904, 1, 1]
    - [97, 234.827]
  - - [1600, 3904, 1, 16]
    - [156, 3807.33]
  - - [1856, 3904, 1, 1]
    - [97, 243.967]
  - - [1856, 3904, 1, 16]
    - [156, 3929.94]
  - - [2112, 3904, 1, 1]
    - [97, 240.386]
  - - [2368, 3904, 1, 1]
    - [97, 240.121]
  - - [2624, 3904, 1, 1]
    - [98, 248.342]
  - - [2880, 3904, 1, 1]
    - [98, 253.232]
  - - [3136, 3904, 1, 1]
    - [98, 251.395]
  - - [3392, 3904, 1, 1]
    - [97, 255.152]
  - - [3648, 3904, 1, 1]
    - [97, 262.28]
  - - [3904, 3904, 1, 1]
    - [97, 261.877]
  - - [64, 1, 1, 256]
    - [149, 6.4251]
  - - [64, 16, 1, 256]
    - [141, 104.858]
  - - [64, 32, 1, 256]
    - [129, 213.995]
  - - [1, 64, 1, 256]
    - [15, 6.06815]
  - - [16, 64, 1, 256]
    - [153, 106.998]
  - - [32, 64, 1, 256]
    - [149, 209.715]
  - - [320, 1, 1, 256]
    - [129, 32.1255]
  - - [320, 16, 1, 256]
    - [143, 476.625]
  - - [320, 32, 1, 256]
    - [150, 1048.58]
  - - [576, 1, 1, 256]
    - [129, 58.9824]
  - - [576, 16, 1, 256]
    - [135, 925.214]
  - - [576, 32, 1, 256]
    - [80, 1887.44]
  - - [832, 1, 1, 256]
    - [152, 80.3743]
  - - [832, 16, 1, 256]
    - [10, 1310.72]
  - - [832, 32, 1, 256]
    - [136, 2310.42]
  - - [1088, 1, 1, 256]
    - [10, 105.105]
  - - [1088, 16, 1, 256]
    - [141, 1747.63]
  - - [1088, 32, 1, 256]
    - [112, 3021.32]
  - - [1344, 1, 1, 256]
    - [80, 110.988]
  - - [1344, 16, 1, 256]
    - [80, 1898.28]
  - - [1344, 32, 1, 256]
    - [80, 3191.32]
  - - [1600, 1, 1, 256]
    - [7, 136.533]
  - - [1600, 16, 1, 256]
    - [80, 2299.51]
  - - [1600, 32, 1, 256]
    - [10, 3744.91]
  - - [1856, 1, 1, 256]
    - [141, 158.379]
  - - [1856, 16, 1, 256]
    - [80, 2667.43]
  - - [1856, 32, 1, 256]
    - [7, 4407.06]
  - - [2112, 1, 1, 256]
    - [7, 177.27]
  - - [2112, 16, 1, 256]
    - [10, 2883.58]
  - - [2112, 32, 1, 256]
    - [20, 5014.93]
  - - [2368, 1, 1, 256]
    - [7, 183.699]
  - - [2368, 16, 1, 256]
    - [10, 3233.11]
  - - [2368, 32, 1, 256]
    - [66, 5464.41]
  - - [2624, 1, 1, 256]
    - [13, 181.552]
  - - [2624, 16, 1, 256]
    - [7, 3161.15]
  - - [2624, 32, 1, 256]
    - [19, 5118.05]
  - - [2880, 1, 1, 256]
    - [7, 207.685]
  - - [2880, 16, 1, 256]
    - [80, 3419.27]
  - - [2880, 32, 1, 256]
    - [27, 5551.28]
  - - [3136, 1, 1, 256]
    - [135, 226.145]
  - - [3136, 16, 1, 256]
    - [7, 3519.19]
  - - [3136, 32, 1, 256]
    - [19, 6044.73]
  - - [3392, 1, 1, 256]
    - [10, 241.209]
  - - [3392, 16, 1, 256]
    - [10, 3969.61]
  - - [3392, 32, 1, 256]
    - [19, 6538.18]
  - - [3648, 1, 1, 256]
    - [10, 259.413]
  - - [3648, 16, 1, 256]
    - [13, 4209.07]
  - - [3648, 32, 1, 256]
    - [27, 7201.06]
  - - [3904, 1, 1, 256]
    - [80, 243.762]
  - - [3904, 16, 1, 256]
    - [61, 3807.33]
  - - [3904, 32, 1, 256]
    - [19, 6270.9]
  - - [1, 320, 1, 256]
    - [5, 28.2483]
  - - [16, 320, 1, 256]
    - [151, 468.114]
  - - [32, 320, 1, 256]
    - [135, 1048.58]
  - - [1, 576, 1, 256]
    - [15, 52.6629]
  - - [16, 576, 1, 256]
    - [147, 907.422]
  - - [32, 576, 1, 256]
    - [14, 1850.43]
  - - [1, 832, 1, 256]
    - [5, 66.56]
  - - [16, 832, 1, 256]
    - [153, 1285.99]
  - - [32, 832, 1, 256]
    - [80, 2163.73]
  - - [1, 1088, 1, 256]
    - [40, 88.4216]
  - - [16, 1088, 1, 256]
    - [129, 1591.59]
  - - [32, 1088, 1, 256]
    - [15, 2875.13]
  - - [1, 1344, 1, 256]
    - [40, 94.2641]
  - - [16, 1344, 1, 256]
    - [153, 1898.28]
  - - [32, 1344, 1, 256]
    - [14, 3286.58]
  - - [1, 1600, 1, 256]
    - [40, 118.725]
  - - [16, 1600, 1, 256]
    - [129, 2184.53]
  - - [32, 1600, 1, 256]
    - [80, 3799.19]
  - - [1, 1856, 1, 256]
    - [5, 135.753]
  - - [16, 1856, 1, 256]
    - [147, 2413.39]
  - - [32, 1856, 1, 256]
    - [17, 4054.49]
  - - [1, 2112, 1, 256]
    - [40, 146.128]
  - - [16, 2112, 1, 256]
    - [143, 2703.36]
  - - [32, 2112, 1, 256]
    - [41, 4553.03]
  - - [1, 2368, 1, 256]
    - [40, 168.391]
  - - [16, 2368, 1, 256]
    - [40, 2732.21]
  - - [32, 2368, 1, 256]
    - [41, 4849.66]
  - - [1, 2624, 1, 256]
    - [40, 172.242]
  - - [16, 2624, 1, 256]
    - [151, 2904.84]
  - - [32, 2624, 1, 256]
    - [14, 4885.41]
  - - [1, 2880, 1, 256]
    - [40, 169.49]
  - - [16, 2880, 1, 256]
    - [146, 3104.34]
  - - [32, 2880, 1, 256]
    - [44, 5551.28]
  - - [1, 3136, 1, 256]
    - [40, 188.898]
  - - [16, 3136, 1, 256]
    - [70, 3251.91]
  - - [32, 3136, 1, 256]
    - [14, 5708.91]
  - - [1, 3392, 1, 256]
    - [5, 214.408]
  - - [16, 3392, 1, 256]
    - [39, 3517.38]
  - - [32, 3392, 1, 256]
    - [71, 6315.29]
  - - [1, 3648, 1, 256]
    - [40, 227.778]
  - - [16, 3648, 1, 256]
    - [39, 3782.84]
  - - [32, 3648, 1, 256]
    - [44, 6949.86]
  - - [1, 3904, 1, 256]
    - [40, 208.213]
  - - [16, 3904, 1, 256]
    - [70, 3476.26]
  - - [32, 3904, 1, 256]
    - [41, 5710.99]
  - - [64, 1, 1, 512]
    - [129, 11.4975]
  - - [64, 16, 1, 512]
    - [80, 174.763]
  - - [64, 32, 1, 512]
    - [148, 361.578]
  - - [1, 64, 1, 512]
    - [15, 9.9297]
  - - [16, 64, 1, 512]
    - [129, 187.246]
  - - [32, 64, 1, 512]
    - [136, 361.578]
  - - [320, 1, 1, 512]
    - [129, 55.539]
  - - [320, 16, 1, 512]
    - [153, 903.945]
  - - [320, 32, 1, 512]
    - [80, 1807.89]
  - - [576, 1, 1, 512]
    - [141, 93.6229]
  - - [576, 16, 1, 512]
    - [80, 1497.97]
  - - [576, 32, 1, 512]
    - [10, 3094.16]
  - - [832, 1, 1, 512]
    - [7, 133.12]
  - - [832, 16, 1, 512]
    - [10, 2234.67]
  - - [832, 32, 1, 512]
    - [149, 3734.65]
  - - [1088, 1, 1, 512]
    - [137, 179.695]
  - - [1088, 16, 1, 512]
    - [10, 2922.26]
  - - [1088, 32, 1, 512]
    - [14, 4570.72]
  - - [1344, 1, 1, 512]
    - [141, 191.147]
  - - [1344, 16, 1, 512]
    - [138, 3058.35]
  - - [1344, 32, 1, 512]
    - [80, 4948.34]
  - - [1600, 1, 1, 512]
    - [149, 221.405]
  - - [1600, 16, 1, 512]
    - [80, 3640.89]
  - - [1600, 32, 1, 512]
    - [10, 5577.53]
  - - [1856, 1, 1, 512]
    - [80, 253.406]
  - - [1856, 16, 1, 512]
    - [80, 4054.49]
  - - [1856, 32, 1, 512]
    - [10, 6401.83]
  - - [2112, 1, 1, 512]
    - [137, 270.336]
  - - [2112, 16, 1, 512]
    - [10, 4436.28]
  - - [2112, 32, 1, 512]
    - [19, 6990.51]
  - - [2368, 1, 1, 512]
    - [10, 292.148]
  - - [2368, 16, 1, 512]
    - [7, 4911.05]
  - - [2368, 32, 1, 512]
    - [19, 7837.84]
  - - [2624, 1, 1, 512]
    - [10, 271.412]
  - - [2624, 16, 1, 512]
    - [7, 4573.58]
  - - [2624, 32, 1, 512]
    - [27, 7106.05]
  - - [2880, 1, 1, 512]
    - [80, 307.2]
  - - [2880, 16, 1, 512]
    - [80, 5019.78]
  - - [2880, 32, 1, 512]
    - [27, 8206.25]
  - - [3136, 1, 1, 512]
    - [10, 324.37]
  - - [3136, 16, 1, 512]
    - [80, 5242.88]
  - - [3136, 32, 1, 512]
    - [20, 8354.51]
  - - [3392, 1, 1, 512]
    - [10, 354.429]
  - - [3392, 16, 1, 512]
    - [7, 5670.87]
  - - [3392, 32, 1, 512]
    - [27, 9419.41]
  - - [3648, 1, 1, 512]
    - [10, 377.328]
  - - [3648, 16, 1, 512]
    - [7, 6161.74]
  - - [3648, 32, 1, 512]
    - [27, 9961.47]
  - - [3904, 1, 1, 512]
    - [103, 363.427]
  - - [3904, 16, 1, 512]
    - [62, 5562.01]
  - - [3904, 32, 1, 512]
    - [83, 8945.89]
  - - [1, 320, 1, 512]
    - [40, 45.5111]
  - - [16, 320, 1, 512]
    - [129, 936.229]
  - - [32, 320, 1, 512]
    - [136, 1807.89]
  - - [1, 576, 1, 512]
    - [40, 79.7059]
  - - [16, 576, 1, 512]
    - [153, 1599.52]
  - - [32, 576, 1, 512]
    - [14, 3094.16]
  - - [1, 832, 1, 512]
    - [40, 112.101]
  - - [16, 832, 1, 512]
    - [129, 2034.55]
  - - [32, 832, 1, 512]
    - [80, 3587.23]
  - - [1, 1088, 1, 512]
    - [40, 150.556]
  - - [16, 1088, 1, 512]
    - [153, 2660.57]
  - - [32, 1088, 1, 512]
    - [14, 4570.72]
  - - [1, 1344, 1, 512]
    - [17, 132.332]
  - - [16, 1344, 1, 512]
    - [153, 2859.75]
  - - [32, 1344, 1, 512]
    - [14, 4685.13]
  - - [1, 1600, 1, 512]
    - [40, 182.044]
  - - [16, 1600, 1, 512]
    - [153, 3404.47]
  - - [32, 1600, 1, 512]
    - [14, 5461.33]
  - - [1, 1856, 1, 512]
    - [40, 211.172]
  - - [16, 1856, 1, 512]
    - [70, 3495.25]
  - - [32, 1856, 1, 512]
    - [14, 6081.74]
  - - [1, 2112, 1, 512]
    - [40, 232.547]
  - - [16, 2112, 1, 512]
    - [5, 3761.2]
  - - [32, 2112, 1, 512]
    - [71, 6528.87]
  - - [1, 2368, 1, 512]
    - [40, 255.245]
  - - [16, 2368, 1, 512]
    - [39, 4263.44]
  - - [32, 2368, 1, 512]
    - [41, 6990.51]
  - - [1, 2624, 1, 512]
    - [40, 237.785]
  - - [16, 2624, 1, 512]
    - [40, 3873.12]
  - - [32, 2624, 1, 512]
    - [44, 7225.48]
  - - [1, 2880, 1, 512]
    - [40, 260.984]
  - - [16, 2880, 1, 512]
    - [5, 4369.07]
  - - [32, 2880, 1, 512]
    - [44, 8065.97]
  - - [1, 3136, 1, 512]
    - [5, 289.303]
  - - [16, 3136, 1, 512]
    - [5, 4670.93]
  - - [32, 3136, 1, 512]
    - [14, 7965.93]
  - - [1, 3392, 1, 512]
    - [5, 294.357]
  - - [16, 3392, 1, 512]
    - [40, 4962.01]
  - - [32, 3392, 1, 512]
    - [44, 9110.58]
  - - [1, 3648, 1, 512]
    - [40, 322.03]
  - - [16, 3648, 1, 512]
    - [40, 5242.88]
  - - [32, 3648, 1, 512]
    - [44, 9879.15]
  - - [1, 3904, 1, 512]
    - [40, 296.126]
  - - [16, 3904, 1, 512]
    - [39, 4882.68]
  - - [32, 3904, 1, 512]
    - [42, 8096.6]
  - - [64, 1, 1, 1024]
    - [129, 18.4608]
  - - [64, 16, 1, 1024]
    - [129, 308.405]
  - - [64, 32, 1, 1024]
    - [129, 607.87]
  - - [1, 64, 1, 1024]
    - [4, 14.0938]
  - - [16, 64, 1, 1024]
    - [129, 291.271]
  - - [32, 64, 1, 1024]
    - [129, 599.186]
  - - [320, 1, 1, 1024]
    - [129, 89.7753]
  - - [320, 16, 1, 1024]
    - [129, 1456.36]
  - - [320, 32, 1, 1024]
    - [129, 2589.08]
  - - [576, 1, 1, 1024]
    - [149, 155.217]
  - - [576, 16, 1, 1024]
    - [149, 2483.47]
  - - [576, 32, 1, 1024]
    - [10, 4603.5]
  - - [832, 1, 1, 1024]
    - [141, 212.992]
  - - [832, 16, 1, 1024]
    - [141, 3451.01]
  - - [832, 32, 1, 1024]
    - [112, 5398.61]
  - - [1088, 1, 1, 1024]
    - [137, 259.096]
  - - [1088, 16, 1, 1024]
    - [152, 4145.53]
  - - [1088, 32, 1, 1024]
    - [81, 6423.71]
  - - [1344, 1, 1, 1024]
    - [141, 262.144]
  - - [1344, 16, 1, 1024]
    - [80, 4493.9]
  - - [1344, 32, 1, 1024]
    - [27, 6775.41]
  - - [1600, 1, 1, 1024]
    - [138, 321.255]
  - - [1600, 16, 1, 1024]
    - [80, 4993.22]
  - - [1600, 32, 1, 1024]
    - [14, 7436.71]
  - - [1856, 1, 1, 1024]
    - [138, 339.383]
  - - [1856, 16, 1, 1024]
    - [141, 5631.24]
  - - [1856, 32, 1, 1024]
    - [27, 8688.2]
  - - [2112, 1, 1, 1024]
    - [62, 376.12]
  - - [2112, 16, 1, 1024]
    - [7, 6070.7]
  - - [2112, 32, 1, 1024]
    - [20, 9415.78]
  - - [2368, 1, 1, 1024]
    - [152, 414.501]
  - - [2368, 16, 1, 1024]
    - [7, 7054.06]
  - - [2368, 32, 1, 1024]
    - [82, 10485.8]
  - - [2624, 1, 1, 1024]
    - [135, 386.615]
  - - [2624, 16, 1, 1024]
    - [80, 6098.1]
  - - [2624, 32, 1, 1024]
    - [27, 9346.0]
  - - [2880, 1, 1, 1024]
    - [80, 418.315]
  - - [2880, 16, 1, 1024]
    - [7, 6553.6]
  - - [2880, 32, 1, 1024]
    - [30, 10485.8]
  - - [3136, 1, 1, 1024]
    - [62, 442.933]
  - - [3136, 16, 1, 1024]
    - [7, 7136.14]
  - - [3136, 32, 1, 1024]
    - [20, 10874.1]
  - - [3392, 1, 1, 1024]
    - [7, 472.573]
  - - [3392, 16, 1, 1024]
    - [7, 7665.45]
  - - [3392, 32, 1, 1024]
    - [27, 12214.2]
  - - [3648, 1, 1, 1024]
    - [7, 504.804]
  - - [3648, 16, 1, 1024]
    - [7, 8131.81]
  - - [3648, 32, 1, 1024]
    - [20, 12451.8]
  - - [3904, 1, 1, 1024]
    - [103, 506.037]
  - - [3904, 16, 1, 1024]
    - [103, 7394.58]
  - - [1, 320, 1, 1024]
    - [15, 75.3287]
  - - [16, 320, 1, 1024]
    - [129, 1476.87]
  - - [32, 320, 1, 1024]
    - [129, 2833.99]
  - - [1, 576, 1, 1024]
    - [15, 134.051]
  - - [16, 576, 1, 1024]
    - [129, 2419.79]
  - - [32, 576, 1, 1024]
    - [141, 4493.9]
  - - [1, 832, 1, 1024]
    - [40, 167.053]
  - - [16, 832, 1, 1024]
    - [129, 3170.11]
  - - [32, 832, 1, 1024]
    - [149, 5293.78]
  - - [1, 1088, 1, 1024]
    - [40, 208.245]
  - - [16, 1088, 1, 1024]
    - [5, 3792.72]
  - - [32, 1088, 1, 1024]
    - [14, 6366.35]
  - - [1, 1344, 1, 1024]
    - [40, 206.956]
  - - [16, 1344, 1, 1024]
    - [70, 3495.25]
  - - [32, 1344, 1, 1024]
    - [0, 6382.64]
  - - [1, 1600, 1, 1024]
    - [5, 248.242]
  - - [16, 1600, 1, 1024]
    - [70, 4194.3]
  - - [32, 1600, 1, 1024]
    - [14, 7436.71]
  - - [1, 1856, 1, 1024]
    - [40, 269.581]
  - - [16, 1856, 1, 1024]
    - [5, 4607.38]
  - - [32, 1856, 1, 1024]
    - [14, 8565.83]
  - - [1, 2112, 1, 1024]
    - [5, 325.216]
  - - [16, 2112, 1, 1024]
    - [5, 5406.72]
  - - [32, 2112, 1, 1024]
    - [71, 8705.16]
  - - [1, 2368, 1, 1024]
    - [5, 356.593]
  - - [16, 2368, 1, 1024]
    - [5, 5968.82]
  - - [32, 2368, 1, 1024]
    - [71, 9639.08]
  - - [1, 2624, 1, 1024]
    - [40, 312.439]
  - - [16, 2624, 1, 1024]
    - [40, 5028.26]
  - - [32, 2624, 1, 1024]
    - [44, 9607.07]
  - - [1, 2880, 1, 1024]
    - [40, 340.939]
  - - [16, 2880, 1, 1024]
    - [40, 5685.05]
  - - [32, 2880, 1, 1024]
    - [44, 10544.3]
  - - [1, 3136, 1, 1024]
    - [5, 360.816]
  - - [16, 3136, 1, 1024]
    - [70, 6044.73]
  - - [32, 3136, 1, 1024]
    - [44, 10327.7]
  - - [1, 3392, 1, 1024]
    - [40, 396.961]
  - - [16, 3392, 1, 1024]
    - [70, 6576.87]
  - - [32, 3392, 1, 1024]
    - [44, 12281.7]
  - - [1, 3648, 1, 1024]
    - [40, 424.495]
  - - [16, 3648, 1, 1024]
    - [40, 6791.91]
  - - [32, 3648, 1, 1024]
    - [44, 12923.0]
  - - [1, 3904, 1, 1024]
    - [40, 375.371]
  - - [16, 3904, 1, 1024]
    - [40, 6120.87]
  - - [64, 1, 1, 2048]
    - [64, 31.2076]
  - - [64, 16, 1, 2048]
    - [64, 505.338]
  - - [64, 32, 1, 2048]
    - [64, 998.644]
  - - [1, 64, 1, 2048]
    - [52, 19.563]
  - - [16, 64, 1, 2048]
    - [64, 446.203]
  - - [32, 64, 1, 2048]
    - [64, 986.895]
  - - [320, 1, 1, 2048]
    - [64, 154.202]
  - - [320, 16, 1, 2048]
    - [64, 2438.55]
  - - [320, 32, 1, 2048]
    - [129, 4194.3]
  - - [576, 1, 1, 2048]
    - [64, 224.695]
  - - [576, 16, 1, 2048]
    - [141, 3495.25]
  - - [576, 32, 1, 2048]
    - [140, 6138.01]
  - - [832, 1, 1, 2048]
    - [136, 274.828]
  - - [832, 16, 1, 2048]
    - [140, 4469.34]
  - - [832, 32, 1, 2048]
    - [29, 7626.01]
  - - [1088, 1, 1, 2048]
    - [62, 356.516]
  - - [1088, 16, 1, 2048]
    - [140, 5704.25]
  - - [1088, 32, 1, 2048]
    - [81, 8590.74]
  - - [1344, 1, 1, 2048]
    - [12, 339.816]
  - - [1344, 16, 1, 2048]
    - [136, 5505.02]
  - - [1344, 32, 1, 2048]
    - [29, 9732.64]
  - - [1600, 1, 1, 2048]
    - [12, 399.61]
  - - [1600, 16, 1, 2048]
    - [138, 6472.69]
  - - [1600, 32, 1, 2048]
    - [26, 9845.78]
  - - [1856, 1, 1, 2048]
    - [138, 439.432]
  - - [1856, 16, 1, 2048]
    - [138, 7113.15]
  - - [1856, 32, 1, 2048]
    - [27, 10909.0]
  - - [2112, 1, 1, 2048]
    - [113, 483.282]
  - - [2112, 16, 1, 2048]
    - [113, 7864.32]
  - - [2368, 1, 1, 2048]
    - [62, 541.862]
  - - [2368, 16, 1, 2048]
    - [62, 8767.75]
  - - [2624, 1, 1, 2048]
    - [135, 467.3]
  - - [2624, 16, 1, 2048]
    - [80, 7816.66]
  - - [2880, 1, 1, 2048]
    - [7, 495.65]
  - - [2880, 16, 1, 2048]
    - [7, 8031.65]
  - - [3136, 1, 1, 2048]
    - [7, 551.29]
  - - [3136, 16, 1, 2048]
    - [62, 8782.94]
  - - [3392, 1, 1, 2048]
    - [7, 586.229]
  - - [3392, 16, 1, 2048]
    - [62, 9340.26]
  - - [3648, 1, 1, 2048]
    - [62, 622.592]
  - - [3648, 16, 1, 2048]
    - [62, 10045.2]
  - - [3904, 1, 1, 2048]
    - [103, 615.03]
  - - [1, 320, 1, 2048]
    - [15, 96.3765]
  - - [16, 320, 1, 2048]
    - [129, 2139.95]
  - - [32, 320, 1, 2048]
    - [149, 3956.89]
  - - [1, 576, 1, 2048]
    - [15, 154.202]
  - - [16, 576, 1, 2048]
    - [153, 3094.16]
  - - [32, 576, 1, 2048]
    - [14, 5763.17]
  - - [1, 832, 1, 2048]
    - [5, 225.687]
  - - [16, 832, 1, 2048]
    - [70, 3839.86]
  - - [32, 832, 1, 2048]
    - [14, 6196.13]
  - - [1, 1088, 1, 2048]
    - [40, 273.402]
  - - [16, 1088, 1, 2048]
    - [70, 4785.45]
  - - [32, 1088, 1, 2048]
    - [14, 8102.63]
  - - [1, 1344, 1, 2048]
    - [5, 260.902]
  - - [16, 1344, 1, 2048]
    - [153, 4338.94]
  - - [32, 1344, 1, 2048]
    - [44, 7794.72]
  - - [1, 1600, 1, 2048]
    - [5, 316.599]
  - - [16, 1600, 1, 2048]
    - [5, 5115.0]
  - - [32, 1600, 1, 2048]
    - [14, 9157.87]
  - - [1, 1856, 1, 2048]
    - [5, 356.91]
  - - [16, 1856, 1, 2048]
    - [70, 5847.83]
  - - [32, 1856, 1, 2048]
    - [44, 10669.7]
  - - [1, 2112, 1, 2048]
    - [5, 411.941]
  - - [16, 2112, 1, 2048]
    - [70, 6654.42]
  - - [1, 2368, 1, 2048]
    - [5, 446.974]
  - - [16, 2368, 1, 2048]
    - [70, 7607.32]
  - - [1, 2624, 1, 2048]
    - [40, 371.9]
  - - [16, 2624, 1, 2048]
    - [40, 5950.4]
  - - [1, 2880, 1, 2048]
    - [40, 405.377]
  - - [16, 2880, 1, 2048]
    - [70, 6669.39]
  - - [1, 3136, 1, 2048]
    - [5, 441.411]
  - - [16, 3136, 1, 2048]
    - [39, 7161.01]
  - - [1, 3392, 1, 2048]
    - [5, 472.573]
  - - [16, 3392, 1, 2048]
    - [70, 7665.45]
  - - [1, 3648, 1, 2048]
    - [40, 508.238]
  - - [16, 3648, 1, 2048]
    - [70, 8477.85]
  - - [1, 3904, 1, 2048]
    - [5, 433.355]
  - - [64, 1, 1, 4096]
    - [64, 51.4008]
  - - [64, 16, 1, 4096]
    - [18, 822.413]
  - - [64, 32, 1, 4096]
    - [64, 1644.83]
  - - [1, 64, 1, 4096]
    - [52, 25.2062]
  - - [16, 64, 1, 4096]
    - [18, 762.601]
  - - [32, 64, 1, 4096]
    - [64, 1613.19]
  - - [320, 1, 1, 4096]
    - [64, 229.951]
  - - [320, 16, 1, 4096]
    - [64, 3883.61]
  - - [320, 32, 1, 4096]
    - [12, 5991.86]
  - - [576, 1, 1, 4096]
    - [64, 316.684]
  - - [576, 16, 1, 4096]
    - [12, 5354.43]
  - - [576, 32, 1, 4096]
    - [26, 9041.61]
  - - [832, 1, 1, 4096]
    - [12, 378.652]
  - - [832, 16, 1, 4096]
    - [12, 6340.23]
  - - [832, 32, 1, 4096]
    - [29, 10435.6]
  - - [1088, 1, 1, 4096]
    - [140, 450.146]
  - - [1088, 16, 1, 4096]
    - [140, 7202.34]
  - - [1344, 1, 1, 4096]
    - [12, 456.848]
  - - [1344, 16, 1, 4096]
    - [136, 7829.37]
  - - [1600, 1, 1, 4096]
    - [12, 510.008]
  - - [1600, 16, 1, 4096]
    - [12, 8004.4]
  - - [1856, 1, 1, 4096]
    - [12, 518.92]
  - - [1856, 16, 1, 4096]
    - [12, 8535.78]
  - - [2112, 1, 1, 4096]
    - [7, 574.801]
  - - [2368, 1, 1, 4096]
    - [62, 642.34]
  - - [2624, 1, 1, 4096]
    - [150, 561.248]
  - - [2880, 1, 1, 4096]
    - [12, 608.066]
  - - [3136, 1, 1, 4096]
    - [7, 620.534]
  - - [3392, 1, 1, 4096]
    - [7, 661.602]
  - - [3648, 1, 1, 4096]
    - [62, 714.938]
  - - [3904, 1, 1, 4096]
    - [103, 684.83]
  - - [1, 320, 1, 4096]
    - [52, 122.497]
  - - [16, 320, 1, 4096]
    - [18, 2706.0]
  - - [32, 320, 1, 4096]
    - [18, 5706.54]
  - - [1, 576, 1, 4096]
    - [15, 189.502]
  - - [16, 576, 1, 4096]
    - [153, 3932.16]
  - - [32, 576, 1, 4096]
    - [18, 7088.96]
  - - [1, 832, 1, 4096]
    - [5, 266.24]
  - - [16, 832, 1, 4096]
    - [153, 4741.39]
  - - [32, 832, 1, 4096]
    - [51, 7989.15]
  - - [1, 1088, 1, 4096]
    - [5, 346.805]
  - - [16, 1088, 1, 4096]
    - [70, 5868.57]
  - - [1, 1344, 1, 4096]
    - [52, 313.677]
  - - [16, 1344, 1, 4096]
    - [153, 5628.14]
  - - [1, 1600, 1, 4096]
    - [5, 353.294]
  - - [16, 1600, 1, 4096]
    - [153, 6316.72]
  - - [1, 1856, 1, 4096]
    - [5, 407.623]
  - - [16, 1856, 1, 4096]
    - [70, 6757.49]
  - - [1, 2112, 1, 4096]
    - [5, 456.504]
  - - [1, 2368, 1, 4096]
    - [5, 509.151]
  - - [1, 2624, 1, 4096]
    - [5, 409.444]
  - - [1, 2880, 1, 4096]
    - [5, 448.535]
  - - [1, 3136, 1, 4096]
    - [40, 481.991]
  - - [1, 3392, 1, 4096]
    - [5, 525.279]
  - - [1, 3648, 1, 4096]
    - [40, 567.067]
  - - [1, 3904, 1, 4096]
    - [5, 449.179]
  - - [192, 1, 1, 64]
    - [6, 5.46133]
  - - [192, 16, 1, 64]
    - [154, 91.4456]
  - - [192, 32, 1, 64]
    - [16, 178.735]
  - - [192, 1, 1, 1]
    - [16, 0.0872727]
  - - [192, 1, 1, 16]
    - [16, 1.36533]
  - - [192, 1, 1, 32]
    - [15, 2.79273]
  - - [192, 16, 1, 1]
    - [2, 1.18154]
  - - [192, 16, 1, 16]
    - [145, 22.8614]
  - - [192, 16, 1, 32]
    - [7, 44.6836]
  - - [192, 32, 1, 1]
    - [17, 2.85767]
  - - [192, 32, 1, 16]
    - [145, 45.7228]
  - - [192, 32, 1, 32]
    - [17, 91.4456]
  - - [192, 64, 1, 1]
    - [21, 5.01551]
  - - [192, 64, 1, 16]
    - [14, 89.3673]
  - - [192, 64, 1, 32]
    - [10, 187.246]
  - - [448, 1, 1, 64]
    - [154, 13.0327]
  - - [448, 16, 1, 64]
    - [150, 208.524]
  - - [448, 32, 1, 64]
    - [141, 417.047]
  - - [448, 1, 1, 1]
    - [80, 0.203636]
  - - [448, 1, 1, 16]
    - [10, 3.18578]
  - - [448, 1, 1, 32]
    - [135, 6.37156]
  - - [448, 16, 1, 1]
    - [61, 3.18578]
  - - [448, 16, 1, 16]
    - [0, 43.2785]
  - - [448, 16, 1, 32]
    - [80, 109.227]
  - - [448, 32, 1, 1]
    - [15, 6.51636]
  - - [448, 32, 1, 16]
    - [145, 104.262]
  - - [448, 32, 1, 32]
    - [11, 213.373]
  - - [448, 64, 1, 1]
    - [21, 12.4661]
  - - [448, 64, 1, 16]
    - [145, 199.457]
  - - [448, 64, 1, 32]
    - [80, 417.047]
  - - [704, 1, 1, 64]
    - [113, 20.0249]
  - - [704, 16, 1, 64]
    - [10, 327.68]
  - - [704, 32, 1, 64]
    - [135, 640.796]
  - - [704, 1, 1, 1]
    - [80, 0.32]
  - - [704, 1, 1, 16]
    - [145, 5.12]
  - - [704, 1, 1, 32]
    - [10, 10.0124]
  - - [704, 16, 1, 1]
    - [145, 4.59755]
  - - [704, 16, 1, 16]
    - [145, 81.92]
  - - [704, 16, 1, 32]
    - [135, 163.84]
  - - [704, 32, 1, 1]
    - [145, 9.79478]
  - - [704, 32, 1, 16]
    - [145, 160.199]
  - - [704, 32, 1, 32]
    - [10, 313.433]
  - - [704, 64, 1, 1]
    - [21, 17.3292]
  - - [704, 64, 1, 16]
    - [145, 306.764]
  - - [704, 64, 1, 32]
    - [20, 600.747]
  - - [960, 1, 1, 64]
    - [61, 27.3067]
  - - [960, 16, 1, 64]
    - [11, 446.836]
  - - [960, 32, 1, 64]
    - [146, 854.817]
  - - [960, 1, 1, 1]
    - [10, 0.426667]
  - - [960, 1, 1, 16]
    - [145, 6.98182]
  - - [960, 1, 1, 32]
    - [11, 13.9636]
  - - [960, 16, 1, 1]
    - [6, 6.98182]
  - - [960, 16, 1, 16]
    - [145, 111.709]
  - - [960, 16, 1, 32]
    - [7, 218.453]
  - - [960, 32, 1, 1]
    - [8, 13.3565]
  - - [960, 32, 1, 16]
    - [20, 200.62]
  - - [960, 32, 1, 32]
    - [15, 436.907]
  - - [960, 64, 1, 1]
    - [13, 22.7556]
  - - [960, 64, 1, 16]
    - [15, 401.241]
  - - [960, 64, 1, 32]
    - [19, 819.2]
  - - [1216, 1, 1, 64]
    - [10, 34.5884]
  - - [1216, 16, 1, 64]
    - [80, 553.415]
  - - [1216, 32, 1, 64]
    - [20, 1059.73]
  - - [1216, 1, 1, 1]
    - [10, 0.540444]
  - - [1216, 1, 1, 16]
    - [7, 8.10667]
  - - [1216, 1, 1, 32]
    - [14, 14.9662]
  - - [1216, 16, 1, 1]
    - [80, 8.84364]
  - - [1216, 16, 1, 16]
    - [145, 144.789]
  - - [1216, 16, 1, 32]
    - [11, 289.578]
  - - [1216, 32, 1, 1]
    - [15, 16.9183]
  - - [1216, 32, 1, 16]
    - [15, 270.692]
  - - [1216, 32, 1, 32]
    - [14, 553.415]
  - - [1216, 64, 1, 1]
    - [19, 31.1296]
  - - [1216, 64, 1, 16]
    - [25, 508.238]
  - - [1216, 64, 1, 32]
    - [20, 1059.73]
  - - [1472, 1, 1, 64]
    - [152, 36.2338]
  - - [1472, 16, 1, 64]
    - [80, 655.36]
  - - [1472, 32, 1, 64]
    - [80, 1205.86]
  - - [1472, 1, 1, 1]
    - [7, 0.626383]
  - - [1472, 1, 1, 16]
    - [151, 10.0221]
  - - [1472, 1, 1, 32]
    - [11, 20.48]
  - - [1472, 16, 1, 1]
    - [80, 10.24]
  - - [1472, 16, 1, 16]
    - [145, 167.481]
  - - [1472, 16, 1, 32]
    - [146, 264.444]
  - - [1472, 32, 1, 1]
    - [21, 19.2261]
  - - [1472, 32, 1, 16]
    - [145, 320.708]
  - - [1472, 32, 1, 32]
    - [20, 655.36]
  - - [1472, 64, 1, 1]
    - [20, 34.8919]
  - - [1472, 64, 1, 16]
    - [19, 548.119]
  - - [1472, 64, 1, 32]
    - [20, 1159.48]
  - - [1728, 1, 1, 64]
    - [10, 45.1396]
  - - [1728, 16, 1, 64]
    - [62, 786.432]
  - - [1728, 32, 1, 64]
    - [20, 1444.47]
  - - [1728, 1, 1, 1]
    - [145, 0.735319]
  - - [1728, 1, 1, 16]
    - [8, 11.7651]
  - - [1728, 1, 1, 32]
    - [8, 24.0417]
  - - [1728, 16, 1, 1]
    - [143, 10.24]
  - - [1728, 16, 1, 16]
    - [145, 201.076]
  - - [1728, 16, 1, 32]
    - [11, 402.153]
  - - [1728, 32, 1, 1]
    - [11, 22.1184]
  - - [1728, 32, 1, 16]
    - [145, 361.117]
  - - [1728, 32, 1, 32]
    - [10, 722.233]
  - - [1728, 64, 1, 1]
    - [20, 40.96]
  - - [1728, 64, 1, 16]
    - [20, 655.36]
  - - [1728, 64, 1, 32]
    - [13, 1335.45]
  - - [1984, 1, 1, 64]
    - [10, 51.8269]
  - - [1984, 16, 1, 64]
    - [113, 864.517]
  - - [1984, 32, 1, 64]
    - [21, 1533.3]
  - - [1984, 1, 1, 1]
    - [11, 0.826667]
  - - [1984, 1, 1, 16]
    - [103, 11.9789]
  - - [1984, 1, 1, 32]
    - [11, 27.0162]
  - - [1984, 16, 1, 1]
    - [11, 13.8017]
  - - [1984, 16, 1, 16]
    - [145, 230.865]
  - - [1984, 16, 1, 32]
    - [11, 451.47]
  - - [1984, 32, 1, 1]
    - [22, 25.9135]
  - - [1984, 32, 1, 16]
    - [20, 414.616]
  - - [1984, 32, 1, 32]
    - [20, 846.507]
  - - [1984, 64, 1, 1]
    - [20, 40.96]
  - - [1984, 64, 1, 16]
    - [20, 666.104]
  - - [1984, 64, 1, 32]
    - [20, 1377.37]
  - - [1, 192, 1, 64]
    - [5, 5.22894]
  - - [16, 192, 1, 64]
    - [151, 87.3813]
  - - [32, 192, 1, 64]
    - [15, 178.735]
  - - [1, 192, 1, 1]
    - [4, 0.0783673]
  - - [1, 192, 1, 16]
    - [3, 1.2288]
  - - [1, 192, 1, 32]
    - [40, 2.73067]
  - - [16, 192, 1, 1]
    - [11, 1.36533]
  - - [16, 192, 1, 16]
    - [143, 21.8453]
  - - [16, 192, 1, 32]
    - [39, 45.7228]
  - - [32, 192, 1, 1]
    - [15, 2.79273]
  - - [32, 192, 1, 16]
    - [145, 45.7228]
  - - [32, 192, 1, 32]
    - [15, 93.6229]
  - - [64, 192, 1, 1]
    - [141, 5.46133]
  - - [64, 192, 1, 16]
    - [14, 87.3813]
  - - [64, 192, 1, 32]
    - [150, 182.891]
  - - [192, 192, 1, 1]
    - [25, 16.0278]
  - - [192, 192, 1, 16]
    - [145, 262.144]
  - - [192, 192, 1, 32]
    - [14, 536.204]
  - - [320, 192, 1, 1]
    - [22, 25.0776]
  - - [320, 192, 1, 16]
    - [25, 401.241]
  - - [320, 192, 1, 32]
    - [20, 819.2]
  - - [448, 192, 1, 1]
    - [22, 32.4589]
  - - [448, 192, 1, 16]
    - [20, 519.342]
  - - [448, 192, 1, 32]
    - [20, 1000.91]
  - - [576, 192, 1, 1]
    - [31, 41.7328]
  - - [576, 192, 1, 16]
    - [20, 667.725]
  - - [576, 192, 1, 32]
    - [31, 1387.82]
  - - [704, 192, 1, 1]
    - [31, 45.8197]
  - - [704, 192, 1, 16]
    - [34, 758.838]
  - - [704, 192, 1, 32]
    - [134, 1351.68]
  - - [832, 192, 1, 1]
    - [157, 56.0505]
  - - [832, 192, 1, 16]
    - [34, 881.346]
  - - [832, 192, 1, 32]
    - [157, 1597.44]
  - - [960, 192, 1, 1]
    - [34, 63.5586]
  - - [960, 192, 1, 16]
    - [28, 999.702]
  - - [960, 192, 1, 32]
    - [31, 2106.51]
  - - [1088, 192, 1, 1]
    - [48, 66.3162]
  - - [1088, 192, 1, 16]
    - [158, 1012.83]
  - - [1088, 192, 1, 32]
    - [121, 2025.66]
  - - [1216, 192, 1, 1]
    - [48, 74.1181]
  - - [1216, 192, 1, 16]
    - [48, 1167.36]
  - - [1216, 192, 1, 32]
    - [48, 2410.03]
  - - [1344, 192, 1, 1]
    - [34, 75.8965]
  - - [1344, 192, 1, 16]
    - [46, 1163.03]
  - - [1344, 192, 1, 32]
    - [34, 2326.07]
  - - [1472, 192, 1, 1]
    - [32, 83.1247]
  - - [1472, 192, 1, 16]
    - [48, 1273.8]
  - - [1472, 192, 1, 32]
    - [34, 2659.99]
  - - [1600, 192, 1, 1]
    - [30, 91.7015]
  - - [1600, 192, 1, 16]
    - [30, 1445.65]
  - - [1600, 192, 1, 32]
    - [30, 2934.45]
  - - [1728, 192, 1, 1]
    - [48, 97.5812]
  - - [1728, 192, 1, 16]
    - [48, 1495.33]
  - - [1728, 192, 1, 32]
    - [48, 3122.6]
  - - [1856, 192, 1, 1]
    - [47, 98.9867]
  - - [1856, 192, 1, 16]
    - [48, 1606.09]
  - - [1856, 192, 1, 32]
    - [48, 3305.29]
  - - [1984, 192, 1, 1]
    - [127, 98.9423]
  - - [1984, 192, 1, 16]
    - [48, 1562.78]
  - - [1984, 192, 1, 32]
    - [127, 3294.51]
  - - [192, 320, 1, 1]
    - [20, 25.0776]
  - - [192, 320, 1, 16]
    - [145, 401.241]
  - - [192, 320, 1, 32]
    - [40, 819.2]
  - - [448, 320, 1, 1]
    - [20, 47.7867]
  - - [448, 320, 1, 16]
    - [20, 752.052]
  - - [448, 320, 1, 32]
    - [20, 1581.9]
  - - [704, 320, 1, 1]
    - [157, 71.5175]
  - - [704, 320, 1, 16]
    - [22, 1075.96]
  - - [704, 320, 1, 32]
    - [158, 2252.8]
  - - [960, 320, 1, 1]
    - [30, 86.5352]
  - - [960, 320, 1, 16]
    - [30, 1424.7]
  - - [960, 320, 1, 32]
    - [30, 2934.45]
  - - [1216, 320, 1, 1]
    - [159, 96.079]
  - - [1216, 320, 1, 16]
    - [43, 1556.48]
  - - [1216, 320, 1, 32]
    - [134, 3152.36]
  - - [1472, 320, 1, 1]
    - [134, 112.152]
  - - [1472, 320, 1, 16]
    - [156, 1816.06]
  - - [1472, 320, 1, 32]
    - [107, 3465.12]
  - - [1728, 320, 1, 1]
    - [127, 120.209]
  - - [1728, 320, 1, 16]
    - [156, 1882.42]
  - - [1728, 320, 1, 32]
    - [127, 3686.4]
  - - [1984, 320, 1, 1]
    - [156, 128.259]
  - - [1984, 320, 1, 16]
    - [156, 2138.54]
  - - [1984, 320, 1, 32]
    - [94, 3983.56]
  - - [1, 448, 1, 64]
    - [17, 12.4661]
  - - [16, 448, 1, 64]
    - [70, 208.524]
  - - [32, 448, 1, 64]
    - [143, 374.491]
  - - [1, 448, 1, 1]
    - [3, 0.149333]
  - - [1, 448, 1, 16]
    - [40, 2.98667]
  - - [1, 448, 1, 32]
    - [22, 5.7344]
  - - [16, 448, 1, 1]
    - [154, 3.25818]
  - - [16, 448, 1, 16]
    - [145, 52.1309]
  - - [16, 448, 1, 32]
    - [14, 104.262]
  - - [32, 448, 1, 1]
    - [40, 5.97333]
  - - [32, 448, 1, 16]
    - [143, 88.2215]
  - - [32, 448, 1, 32]
    - [14, 213.373]
  - - [64, 448, 1, 1]
    - [6, 12.2009]
  - - [64, 448, 1, 16]
    - [145, 183.501]
  - - [64, 448, 1, 32]
    - [14, 407.78]
  - - [192, 448, 1, 1]
    - [20, 31.8578]
  - - [192, 448, 1, 16]
    - [22, 509.724]
  - - [192, 448, 1, 32]
    - [27, 1058.66]
  - - [320, 448, 1, 1]
    - [34, 48.5966]
  - - [320, 448, 1, 16]
    - [34, 764.587]
  - - [320, 448, 1, 32]
    - [30, 1581.9]
  - - [448, 448, 1, 1]
    - [134, 64.7432]
  - - [448, 448, 1, 16]
    - [25, 1019.45]
  - - [448, 448, 1, 32]
    - [20, 2038.9]
  - - [576, 448, 1, 1]
    - [31, 73.728]
  - - [576, 448, 1, 16]
    - [58, 1251.14]
  - - [576, 448, 1, 32]
    - [31, 2359.3]
  - - [704, 448, 1, 1]
    - [58, 87.6089]
  - - [704, 448, 1, 16]
    - [31, 1327.97]
  - - [704, 448, 1, 32]
    - [134, 2765.08]
  - - [832, 448, 1, 1]
    - [157, 94.3635]
  - - [832, 448, 1, 16]
    - [159, 1529.17]
  - - [832, 448, 1, 32]
    - [58, 3223.66]
  - - [960, 448, 1, 1]
    - [58, 114.688]
  - - [960, 448, 1, 16]
    - [58, 1835.01]
  - - [960, 448, 1, 32]
    - [58, 3670.02]
  - - [1088, 448, 1, 1]
    - [58, 114.688]
  - - [1088, 448, 1, 16]
    - [58, 1813.67]
  - - [1088, 448, 1, 32]
    - [134, 3428.04]
  - - [1216, 448, 1, 1]
    - [60, 121.06]
  - - [1216, 448, 1, 16]
    - [58, 1936.95]
  - - [1216, 448, 1, 32]
    - [58, 3961.95]
  - - [1344, 448, 1, 1]
    - [60, 116.915]
  - - [1344, 448, 1, 16]
    - [156, 2049.74]
  - - [1344, 448, 1, 32]
    - [156, 3777.96]
  - - [1472, 448, 1, 1]
    - [60, 137.387]
  - - [1472, 448, 1, 16]
    - [156, 2198.19]
  - - [1472, 448, 1, 32]
    - [127, 3981.62]
  - - [1600, 448, 1, 1]
    - [91, 144.808]
  - - [1600, 448, 1, 16]
    - [156, 2389.33]
  - - [1600, 448, 1, 32]
    - [156, 4497.57]
  - - [1728, 448, 1, 1]
    - [91, 154.829]
  - - [1728, 448, 1, 16]
    - [156, 2580.48]
  - - [1728, 448, 1, 32]
    - [91, 4763.96]
  - - [1856, 448, 1, 1]
    - [60, 143.36]
  - - [1856, 448, 1, 16]
    - [60, 2163.22]
  - - [1856, 448, 1, 32]
    - [60, 4326.44]
  - - [1984, 448, 1, 1]
    - [96, 135.7]
  - - [1984, 448, 1, 16]
    - [134, 2222.08]
  - - [1984, 448, 1, 32]
    - [134, 4587.52]
  - - [192, 576, 1, 1]
    - [44, 41.7328]
  - - [192, 576, 1, 16]
    - [20, 655.36]
  - - [192, 576, 1, 32]
    - [20, 1361.13]
  - - [448, 576, 1, 1]
    - [34, 75.8965]
  - - [448, 576, 1, 16]
    - [32, 1146.88]
  - - [448, 576, 1, 32]
    - [121, 2502.28]
  - - [704, 576, 1, 1]
    - [48, 105.326]
  - - [704, 576, 1, 16]
    - [134, 1601.99]
  - - [704, 576, 1, 32]
    - [48, 3327.21]
  - - [960, 576, 1, 1]
    - [53, 121.53]
  - - [960, 576, 1, 16]
    - [53, 2131.89]
  - - [960, 576, 1, 32]
    - [53, 4315.79]
  - - [1216, 576, 1, 1]
    - [139, 128.517]
  - - [1216, 576, 1, 16]
    - [156, 2134.6]
  - - [1216, 576, 1, 32]
    - [94, 4150.61]
  - - [1472, 576, 1, 1]
    - [74, 134.583]
  - - [1472, 576, 1, 16]
    - [48, 2136.37]
  - - [1472, 576, 1, 32]
    - [108, 4272.74]
  - - [1728, 576, 1, 1]
    - [97, 150.807]
  - - [1728, 576, 1, 16]
    - [97, 2359.3]
  - - [1728, 576, 1, 32]
    - [97, 4683.9]
  - - [1984, 576, 1, 1]
    - [98, 169.301]
  - - [1984, 576, 1, 16]
    - [98, 2688.9]
  - - [1984, 576, 1, 32]
    - [97, 5299.87]
  - - [1, 704, 1, 64]
    - [40, 19.1728]
  - - [16, 704, 1, 64]
    - [70, 313.433]
  - - [32, 704, 1, 64]
    - [80, 576.717]
  - - [1, 704, 1, 1]
    - [40, 0.299574]
  - - [1, 704, 1, 16]
    - [40, 4.79319]
  - - [1, 704, 1, 32]
    - [2, 9.38667]
  - - [16, 704, 1, 1]
    - [39, 5.00622]
  - - [16, 704, 1, 16]
    - [40, 80.0996]
  - - [16, 704, 1, 32]
    - [15, 156.717]
  - - [32, 704, 1, 1]
    - [14, 9.79478]
  - - [32, 704, 1, 16]
    - [17, 160.199]
