projects/hipblaslt/library/src/amd_detail/rocblaslt/src/Tensile/Logic/asm_full/gfx1151/GridBased/gfx1151_Cijk_Alik_Bljk_S_B_Bias_HA_S_SAV_UserArgs.yaml
- {MinimumRequiredVersion: 5.0.0}
- gfx1151
- gfx1151
- [Device 1536]
    SolutionIndex: 0
    SolutionNameMin: Cijk_Alik_Bljk_S_B_Bias_HA_S_SAV_UserArgs_MT8x32x32_SN_LDSB0_AFC1_AG0_AFEM1_AFEM1_ASEM1_CLR0_CADS0_DTLA0_DTLB0_DTVA0_DTVB0_DTVMXSA0_DTVMXSB0_DTVSM0_DPLB0_EPS0_ELFLR0_EMLLn1_FDSI0_GRPM1_GRVWA1_GRVWB1_GSU1_GSUAMB_GSUC0_GSUWGMRR0_GLS0_ISA1151_IU1_K1_LDSTI0_LBSPPA0_LBSPPB0_LBSPPM0_LPA1_LPB1_LPM0_LRVW1_LWPMn1_MIAV0_MO40_MGRIPM1_NTn1_NTA0_NTB0_NTC0_NTD0_NTM0_NEPBS0_NLCA1_NLCB1_ONLL1_PGR1_PLR1_PKA0_SGROB0_SIA1_SS0_SU0_SUM0_SUS0_SPO0_SRVW0_SSO0_SVW1_SK0_SKFTR0_SKXCCM0_SGRO0_TDMI0_TIN0_TT1_2_TLDS0_TLDSMn1_ULSGRO0_USL1_UIOFGRO0_UPLRP0_USFGROn1_VSn1_VWA1_VWB1_WSGRA0_WSGRB0_WS32_WG8_16_1_WGM1_WGMXCC1_WGMXCCGn1
    SolutionIndex: 1
    SolutionNameMin: Cijk_Alik_Bljk_S_B_Bias_HA_S_SAV_UserArgs_MT8x32x32_SN_LDSB0_AFC1_AG0_AFEM1_AFEM1_ASEM1_CLR0_CADS0_DTLA0_DTLB0_DTVA0_DTVB0_DTVMXSA0_DTVMXSB0_DTVSM0_DPLB0_EPS0_ELFLR0_EMLLn1_FDSI0_GRPM1_GRVWA1_GRVWB1_GSU1_GSUAMB_GSUC0_GSUWGMRR0_GLS0_ISA1151_IU1_K1_LDSTI0_LBSPPA0_LBSPPB0_LBSPPM0_LPA1_LPB1_LPM0_LRVW1_LWPMn1_MIAV0_MO40_MGRIPM1_NTn1_NTA0_NTB0_NTC0_NTD0_NTM0_NEPBS0_NLCA1_NLCB1_ONLL1_PGR1_PLR1_PKA0_SGROB0_SIA1_SS0_SU8_SUM0_SUS256_SPO0_SRVW0_SSO0_SVW1_SK0_SKFTR0_SKXCCM0_SGRO0_TDMI0_TIN0_TT1_2_TLDS0_TLDSMn1_ULSGRO0_USL1_UIOFGRO0_UPLRP0_USFGROn1_VSn1_VWA1_VWB1_WSGRA0_WSGRB0_WS32_WG8_16_1_WGM1_WGMXCC1_WGMXCCGn1
    SolutionIndex: 2
    SolutionNameMin: Cijk_Alik_Bljk_S_B_Bias_HA_S_SAV_UserArgs_MT8x32x32_SN_LDSB0_AFC1_AG0_AFEM1_AFEM1_ASEM1_CLR0_CADS0_DTLA0_DTLB0_DTVA0_DTVB0_DTVMXSA0_DTVMXSB0_DTVSM0_DPLB0_EPS0_ELFLR0_EMLLn1_FDSI0_GRPM1_GRVWA1_GRVWB1_GSU1_GSUAMB_GSUC0_GSUWGMRR0_GLS0_ISA1151_IU1_K1_LDSTI0_LBSPPA0_LBSPPB0_LBSPPM0_LPA1_LPB1_LPM0_LRVW1_LWPMn1_MIAV0_MO40_MGRIPM1_NTn1_NTA0_NTB0_NTC0_NTD0_NTM0_NEPBS0_NLCA1_NLCB1_ONLL1_PGR0_PLR1_PKA0_SGROB0_SIA1_SS0_SU0_SUM0_SUS0_SPO0_SRVW0_SSO0_SVW1_SK0_SKFTR0_SKXCCM0_SGRO0_TDMI0_TIN0_TT1_4_TLDS0_TLDSMn1_ULSGRO0_USL1_UIOFGRO0_UPLRP0_USFGROn1_VSn1_VWA1_VWB1_WSGRA0_WSGRB0_WS32_WG8_8_1_WGM1_WGMXCC1_WGMXCCGn1
    SolutionIndex: 3
    SolutionNameMin: Cijk_Alik_Bljk_S_B_Bias_HA_S_SAV_UserArgs_MT8x32x32_SN_LDSB0_AFC1_AG0_AFEM1_AFEM1_ASEM1_CLR0_CADS0_DTLA0_DTLB0_DTVA0_DTVB0_DTVMXSA0_DTVMXSB0_DTVSM0_DPLB0_EPS0_ELFLR0_EMLLn1_FDSI0_GRPM1_GRVWA1_GRVWB1_GSU1_GSUAMB_GSUC0_GSUWGMRR0_GLS0_ISA1151_IU1_K1_LDSTI0_LBSPPA0_LBSPPB0_LBSPPM0_LPA1_LPB1_LPM0_LRVW1_LWPMn1_MIAV0_MO40_MGRIPM1_NTn1_NTA0_NTB0_NTC0_NTD0_NTM0_NEPBS0_NLCA1_NLCB1_ONLL1_PGR1_PLR1_PKA0_SGROB0_SIA1_SS0_SU0_SUM0_SUS0_SPO0_SRVW0_SSO0_SVW1_SK0_SKFTR0_SKXCCM0_SGRO0_TDMI0_TIN0_TT1_4_TLDS0_TLDSMn1_ULSGRO0_USL1_UIOFGRO0_UPLRP0_USFGROn1_VSn1_VWA1_VWB1_WSGRA0_WSGRB0_WS32_WG8_8_1_WGM1_WGMXCC1_WGMXCCGn1
    SolutionIndex: 4
    SolutionNameMin: Cijk_Alik_Bljk_S_B_Bias_HA_S_SAV_UserArgs_MT8x32x32_SN_LDSB0_AFC1_AG0_AFEM1_AFEM1_ASEM1_CLR0_CADS0_DTLA0_DTLB0_DTVA0_DTVB0_DTVMXSA0_DTVMXSB0_DTVSM0_DPLB0_EPS0_ELFLR0_EMLLn1_FDSI0_GRPM1_GRVWA1_GRVWB1_GSU1_GSUAMB_GSUC0_GSUWGMRR0_GLS0_ISA1151_IU1_K1_LDSTI0_LBSPPA0_LBSPPB0_LBSPPM0_LPA1_LPB1_LPM0_LRVW1_LWPMn1_MIAV0_MO40_MGRIPM1_NTn1_NTA0_NTB0_NTC0_NTD0_NTM0_NEPBS0_NLCA1_NLCB1_ONLL1_PGR1_PLR1_PKA0_SGROB0_SIA1_SS0_SU8_SUM0_SUS256_SPO0_SRVW0_SSO0_SVW1_SK0_SKFTR0_SKXCCM0_SGRO0_TDMI0_TIN0_TT1_4_TLDS0_TLDSMn1_ULSGRO0_USL1_UIOFGRO0_UPLRP0_USFGROn1_VSn1_VWA1_VWB1_WSGRA0_WSGRB0_WS32_WG8_8_1_WGM1_WGMXCC1_WGMXCCGn1
    SolutionIndex: 5
    SolutionNameMin: Cijk_Alik_Bljk_S_B_Bias_HA_S_SAV_UserArgs_MT8x64x32_SN_LDSB0_AFC1_AG0_AFEM1_AFEM1_ASEM1_CLR0_CADS0_DTLA0_DTLB0_DTVA0_DTVB0_DTVMXSA0_DTVMXSB0_DTVSM0_DPLB0_EPS0_ELFLR0_EMLLn1_FDSI0_GRPM1_GRVWA1_GRVWB1_GSU1_GSUAMB_GSUC0_GSUWGMRR0_GLS0_ISA1151_IU1_K1_LDSTI0_LBSPPA0_LBSPPB0_LBSPPM0_LPA1_LPB1_LPM0_LRVW1_LWPMn1_MIAV0_MO40_MGRIPM1_NTn1_NTA0_NTB0_NTC0_NTD0_NTM0_NEPBS0_NLCA1_NLCB1_ONLL1_PGR0_PLR1_PKA0_SGROB0_SIA1_SS0_SU0_SUM0_SUS0_SPO0_SRVW0_SSO0_SVW1_SK0_SKFTR0_SKXCCM0_SGRO0_TDMI0_TIN0_TT1_4_TLDS0_TLDSMn1_ULSGRO0_USL1_UIOFGRO0_UPLRP0_USFGROn1_VSn1_VWA1_VWB1_WSGRA0_WSGRB0_WS32_WG8_16_1_WGM1_WGMXCC1_WGMXCCGn1
    SolutionIndex: 6
    SolutionNameMin: Cijk_Alik_Bljk_S_B_Bias_HA_S_SAV_UserArgs_MT8x64x32_SN_LDSB0_AFC1_AG0_AFEM1_AFEM1_ASEM1_CLR0_CADS0_DTLA0_DTLB0_DTVA0_DTVB0_DTVMXSA0_DTVMXSB0_DTVSM0_DPLB0_EPS0_ELFLR0_EMLLn1_FDSI0_GRPM1_GRVWA1_GRVWB1_GSU1_GSUAMB_GSUC0_GSUWGMRR0_GLS0_ISA1151_IU1_K1_LDSTI0_LBSPPA0_LBSPPB0_LBSPPM0_LPA1_LPB1_LPM0_LRVW1_LWPMn1_MIAV0_MO40_MGRIPM1_NTn1_NTA0_NTB0_NTC0_NTD0_NTM0_NEPBS0_NLCA1_NLCB1_ONLL1_PGR1_PLR1_PKA0_SGROB0_SIA1_SS0_SU0_SUM0_SUS0_SPO0_SRVW0_SSO0_SVW1_SK0_SKFTR0_SKXCCM0_SGRO0_TDMI0_TIN0_TT1_4_TLDS0_TLDSMn1_ULSGRO0_USL1_UIOFGRO0_UPLRP0_USFGROn1_VSn1_VWA1_VWB1_WSGRA0_WSGRB0_WS32_WG8_16_1_WGM1_WGMXCC1_WGMXCCGn1
    SolutionIndex: 7
    SolutionNameMin: Cijk_Alik_Bljk_S_B_Bias_HA_S_SAV_UserArgs_MT8x64x32_SN_LDSB0_AFC1_AG0_AFEM1_AFEM1_ASEM1_CLR0_CADS0_DTLA0_DTLB0_DTVA0_DTVB0_DTVMXSA0_DTVMXSB0_DTVSM0_DPLB0_EPS0_ELFLR0_EMLLn1_FDSI0_GRPM1_GRVWA1_GRVWB1_GSU1_GSUAMB_GSUC0_GSUWGMRR0_GLS0_ISA1151_IU1_K1_LDSTI0_LBSPPA0_LBSPPB0_LBSPPM0_LPA1_LPB1_LPM0_LRVW1_LWPMn1_MIAV0_MO40_MGRIPM1_NTn1_NTA0_NTB0_NTC0_NTD0_NTM0_NEPBS0_NLCA1_NLCB1_ONLL1_PGR0_PLR1_PKA0_SGROB0_SIA1_SS0_SU8_SUM0_SUS256_SPO0_SRVW0_SSO0_SVW1_SK0_SKFTR0_SKXCCM0_SGRO0_TDMI0_TIN0_TT1_4_TLDS0_TLDSMn1_ULSGRO0_USL1_UIOFGRO0_UPLRP0_USFGROn1_VSn1_VWA1_VWB1_WSGRA0_WSGRB0_WS32_WG8_16_1_WGM1_WGMXCC1_WGMXCCGn1
    SolutionIndex: 8
    SolutionNameMin: Cijk_Alik_Bljk_S_B_Bias_HA_S_SAV_UserArgs_MT8x64x32_SN_LDSB0_AFC1_AG0_AFEM1_AFEM1_ASEM1_CLR0_CADS0_DTLA0_DTLB0_DTVA0_DTVB0_DTVMXSA0_DTVMXSB0_DTVSM0_DPLB0_EPS0_ELFLR0_EMLLn1_FDSI0_GRPM1_GRVWA1_GRVWB1_GSU1_GSUAMB_GSUC0_GSUWGMRR0_GLS0_ISA1151_IU1_K1_LDSTI0_LBSPPA0_LBSPPB0_LBSPPM0_LPA1_LPB1_LPM0_LRVW1_LWPMn1_MIAV0_MO40_MGRIPM1_NTn1_NTA0_NTB0_NTC0_NTD0_NTM0_NEPBS0_NLCA1_NLCB1_ONLL1_PGR1_PLR1_PKA0_SGROB0_SIA1_SS0_SU8_SUM0_SUS256_SPO0_SRVW0_SSO0_SVW1_SK0_SKFTR0_SKXCCM0_SGRO0_TDMI0_TIN0_TT1_4_TLDS0_TLDSMn1_ULSGRO0_USL1_UIOFGRO0_UPLRP0_USFGROn1_VSn1_VWA1_VWB1_WSGRA0_WSGRB0_WS32_WG8_16_1_WGM1_WGMXCC1_WGMXCCGn1
    SolutionIndex: 9
    SolutionNameMin: Cijk_Alik_Bljk_S_B_Bias_HA_S_SAV_UserArgs_MT8x8x128_SN_LDSB0_AFC1_AG0_AFEM1_AFEM1_ASEM1_CLR0_CADS0_DTLA0_DTLB0_DTVA0_DTVB0_DTVMXSA0_DTVMXSB0_DTVSM0_DPLB0_EPS0_ELFLR0_EMLLn1_FDSI0_GRPM1_GRVWA1_GRVWB1_GSU1_GSUAMB_GSUC0_GSUWGMRR0_GLS0_ISA1151_IU1_K1_LDSTI0_LBSPPA0_LBSPPB0_LBSPPM0_LPA1_LPB1_LPM0_LRVW1_LWPMn1_MIAV0_MO40_MGRIPM1_NTn1_NTA0_NTB0_NTC0_NTD0_NTM0_NEPBS0_NLCA2_NLCB2_ONLL1_PGR1_PLR1_PKA0_SGROB0_SIA1_SS0_SU0_SUM0_SUS0_SPO0_SRVW0_SSO0_SVW1_SK0_SKFTR0_SKXCCM0_SGRO0_TDMI0_TIN0_TT1_1_TLDS0_TLDSMn1_ULSGRO0_USL1_UIOFGRO0_UPLRP0_USFGROn1_VSn1_VWA1_VWB1_WSGRA0_WSGRB0_WS32_WG8_8_1_WGM1_WGMXCC1_WGMXCCGn1
    SolutionIndex: 10
    SolutionNameMin: Cijk_Alik_Bljk_S_B_Bias_HA_S_SAV_UserArgs_MT8x8x128_SN_LDSB0_AFC1_AG0_AFEM1_AFEM1_ASEM1_CLR0_CADS0_DTLA0_DTLB0_DTVA0_DTVB0_DTVMXSA0_DTVMXSB0_DTVSM0_DPLB0_EPS0_ELFLR0_EMLLn1_FDSI0_GRPM1_GRVWA1_GRVWB1_GSU1_GSUAMB_GSUC0_GSUWGMRR0_GLS0_ISA1151_IU1_K1_LDSTI0_LBSPPA0_LBSPPB0_LBSPPM0_LPA1_LPB1_LPM0_LRVW1_LWPMn1_MIAV0_MO40_MGRIPM1_NTn1_NTA0_NTB0_NTC0_NTD0_NTM0_NEPBS0_NLCA2_NLCB2_ONLL1_PGR1_PLR1_PKA0_SGROB0_SIA1_SS0_SU8_SUM0_SUS512_SPO0_SRVW0_SSO0_SVW1_SK0_SKFTR0_SKXCCM0_SGRO0_TDMI0_TIN0_TT1_1_TLDS0_TLDSMn1_ULSGRO0_USL1_UIOFGRO0_UPLRP0_USFGROn1_VSn1_VWA1_VWB1_WSGRA0_WSGRB0_WS32_WG8_8_1_WGM1_WGMXCC1_WGMXCCGn1
    SolutionIndex: 11
    SolutionNameMin: Cijk_Alik_Bljk_S_B_Bias_HA_S_SAV_UserArgs_MT8x16x128_SN_LDSB0_AFC1_AG0_AFEM1_AFEM1_ASEM1_CLR0_CADS0_DTLA0_DTLB0_DTVA0_DTVB0_DTVMXSA0_DTVMXSB0_DTVSM0_DPLB0_EPS0_ELFLR0_EMLLn1_FDSI0_GRPM1_GRVWA1_GRVWB1_GSU1_GSUAMB_GSUC0_GSUWGMRR0_GLS0_ISA1151_IU1_K1_LDSTI0_LBSPPA0_LBSPPB0_LBSPPM0_LPA1_LPB1_LPM0_LRVW1_LWPMn1_MIAV0_MO40_MGRIPM1_NTn1_NTA0_NTB0_NTC0_NTD0_NTM0_NEPBS0_NLCA1_NLCB1_ONLL1_PGR1_PLR1_PKA0_SGROB0_SIA1_SS0_SU0_SUM0_SUS0_SPO0_SRVW0_SSO0_SVW1_SK0_SKFTR0_SKXCCM0_SGRO0_TDMI0_TIN0_TT1_1_TLDS0_TLDSMn1_ULSGRO0_USL1_UIOFGRO0_UPLRP0_USFGROn1_VSn1_VWA1_VWB1_WSGRA0_WSGRB0_WS32_WG8_16_1_WGM1_WGMXCC1_WGMXCCGn1
    SolutionIndex: 12
    SolutionNameMin: Cijk_Alik_Bljk_S_B_Bias_HA_S_SAV_UserArgs_MT8x16x128_SN_LDSB0_AFC1_AG0_AFEM1_AFEM1_ASEM1_CLR0_CADS0_DTLA0_DTLB0_DTVA0_DTVB0_DTVMXSA0_DTVMXSB0_DTVSM0_DPLB0_EPS0_ELFLR0_EMLLn1_FDSI0_GRPM1_GRVWA1_GRVWB1_GSU1_GSUAMB_GSUC0_GSUWGMRR0_GLS0_ISA1151_IU1_K1_LDSTI0_LBSPPA0_LBSPPB0_LBSPPM0_LPA1_LPB1_LPM0_LRVW1_LWPMn1_MIAV0_MO40_MGRIPM1_NTn1_NTA0_NTB0_NTC0_NTD0_NTM0_NEPBS0_NLCA1_NLCB1_ONLL1_PGR1_PLR1_PKA0_SGROB0_SIA1_SS0_SU8_SUM0_SUS512_SPO0_SRVW0_SSO0_SVW1_SK0_SKFTR0_SKXCCM0_SGRO0_TDMI0_TIN0_TT1_1_TLDS0_TLDSMn1_ULSGRO0_USL1_UIOFGRO0_UPLRP0_USFGROn1_VSn1_VWA1_VWB1_WSGRA0_WSGRB0_WS32_WG8_16_1_WGM1_WGMXCC1_WGMXCCGn1
    SolutionIndex: 13
    SolutionNameMin: Cijk_Alik_Bljk_S_B_Bias_HA_S_SAV_UserArgs_MT8x16x128_SN_LDSB0_AFC1_AG0_AFEM1_AFEM1_ASEM1_CLR0_CADS0_DTLA0_DTLB0_DTVA0_DTVB0_DTVMXSA0_DTVMXSB0_DTVSM0_DPLB0_EPS0_ELFLR0_EMLLn1_FDSI0_GRPM1_GRVWA1_GRVWB1_GSU1_GSUAMB_GSUC0_GSUWGMRR0_GLS0_ISA1151_IU1_K1_LDSTI0_LBSPPA0_LBSPPB0_LBSPPM0_LPA1_LPB1_LPM0_LRVW1_LWPMn1_MIAV0_MO40_MGRIPM1_NTn1_NTA0_NTB0_NTC0_NTD0_NTM0_NEPBS0_NLCA2_NLCB2_ONLL1_PGR0_PLR1_PKA0_SGROB0_SIA1_SS0_SU0_SUM0_SUS0_SPO0_SRVW0_SSO0_SVW1_SK0_SKFTR0_SKXCCM0_SGRO0_TDMI0_TIN0_TT1_2_TLDS0_TLDSMn1_ULSGRO0_USL1_UIOFGRO0_UPLRP0_USFGROn1_VSn1_VWA1_VWB1_WSGRA0_WSGRB0_WS32_WG8_8_1_WGM1_WGMXCC1_WGMXCCGn1
    SolutionIndex: 14
    SolutionNameMin: Cijk_Alik_Bljk_S_B_Bias_HA_S_SAV_UserArgs_MT8x16x128_SN_LDSB0_AFC1_AG0_AFEM1_AFEM1_ASEM1_CLR0_CADS0_DTLA0_DTLB0_DTVA0_DTVB0_DTVMXSA0_DTVMXSB0_DTVSM0_DPLB0_EPS0_ELFLR0_EMLLn1_FDSI0_GRPM1_GRVWA1_GRVWB1_GSU1_GSUAMB_GSUC0_GSUWGMRR0_GLS0_ISA1151_IU1_K1_LDSTI0_LBSPPA0_LBSPPB0_LBSPPM0_LPA1_LPB1_LPM0_LRVW1_LWPMn1_MIAV0_MO40_MGRIPM1_NTn1_NTA0_NTB0_NTC0_NTD0_NTM0_NEPBS0_NLCA2_NLCB2_ONLL1_PGR0_PLR1_PKA0_SGROB0_SIA1_SS0_SU8_SUM0_SUS512_SPO0_SRVW0_SSO0_SVW1_SK0_SKFTR0_SKXCCM0_SGRO0_TDMI0_TIN0_TT1_2_TLDS0_TLDSMn1_ULSGRO0_USL1_UIOFGRO0_UPLRP0_USFGROn1_VSn1_VWA1_VWB1_WSGRA0_WSGRB0_WS32_WG8_8_1_WGM1_WGMXCC1_WGMXCCGn1
    SolutionIndex: 15
    SolutionNameMin: Cijk_Alik_Bljk_S_B_Bias_HA_S_SAV_UserArgs_MT8x8x256_SN_LDSB0_AFC1_AG0_AFEM1_AFEM1_ASEM1_CLR0_CADS0_DTLA0_DTLB0_DTVA0_DTVB0_DTVMXSA0_DTVMXSB0_DTVSM0_DPLB0_EPS0_ELFLR0_EMLLn1_FDSI0_GRPM1_GRVWA1_GRVWB1_GSU1_GSUAMB_GSUC0_GSUWGMRR0_GLS0_ISA1151_IU1_K1_LDSTI0_LBSPPA0_LBSPPB0_LBSPPM0_LPA1_LPB1_LPM0_LRVW1_LWPMn1_MIAV0_MO40_MGRIPM1_NTn1_NTA0_NTB0_NTC0_NTD0_NTM0_NEPBS0_NLCA4_NLCB4_ONLL1_PGR0_PLR1_PKA0_SGROB0_SIA1_SS0_SU0_SUM0_SUS0_SPO0_SRVW0_SSO0_SVW1_SK0_SKFTR0_SKXCCM0_SGRO0_TDMI0_TIN0_TT1_1_TLDS0_TLDSMn1_ULSGRO0_USL1_UIOFGRO0_UPLRP0_USFGROn1_VSn1_VWA1_VWB1_WSGRA0_WSGRB0_WS32_WG8_8_1_WGM1_WGMXCC1_WGMXCCGn1
    SolutionIndex: 16
    SolutionNameMin: Cijk_Alik_Bljk_S_B_Bias_HA_S_SAV_UserArgs_MT8x16x128_SN_LDSB0_AFC1_AG0_AFEM1_AFEM1_ASEM1_CLR0_CADS0_DTLA0_DTLB0_DTVA0_DTVB0_DTVMXSA0_DTVMXSB0_DTVSM0_DPLB0_EPS0_ELFLR0_EMLLn1_FDSI0_GRPM1_GRVWA1_GRVWB1_GSU1_GSUAMB_GSUC0_GSUWGMRR0_GLS0_ISA1151_IU1_K1_LDSTI0_LBSPPA0_LBSPPB0_LBSPPM0_LPA1_LPB1_LPM0_LRVW1_LWPMn1_MIAV0_MO40_MGRIPM1_NTn1_NTA0_NTB0_NTC0_NTD0_NTM0_NEPBS0_NLCA1_NLCB1_ONLL1_PGR1_PLR1_PKA0_SGROB0_SIA1_SS0_SU16_SUM0_SUS512_SPO0_SRVW0_SSO0_SVW1_SK0_SKFTR0_SKXCCM0_SGRO0_TDMI0_TIN0_TT1_1_TLDS0_TLDSMn1_ULSGRO0_USL1_UIOFGRO0_UPLRP0_USFGROn1_VSn1_VWA1_VWB1_WSGRA0_WSGRB0_WS32_WG8_16_1_WGM1_WGMXCC1_WGMXCCGn1
    SolutionIndex: 17
    SolutionNameMin: Cijk_Alik_Bljk_S_B_Bias_HA_S_SAV_UserArgs_MT8x8x32_SN_LDSB0_AFC1_AG0_AFEM1_AFEM1_ASEM1_CLR0_CADS0_DTLA0_DTLB0_DTVA0_DTVB0_DTVMXSA0_DTVMXSB0_DTVSM0_DPLB0_EPS0_ELFLR0_EMLLn1_FDSI0_GRPM1_GRVWA1_GRVWB1_GSU1_GSUAMB_GSUC0_GSUWGMRR0_GLS0_ISA1151_IU1_K1_LDSTI0_LBSPPA0_LBSPPB0_LBSPPM0_LPA1_LPB1_LPM0_LRVW1_LWPMn1_MIAV0_MO40_MGRIPM1_NTn1_NTA0_NTB0_NTC0_NTD0_NTM0_NEPBS0_NLCA1_NLCB1_ONLL1_PGR0_PLR1_PKA0_SGROB0_SIA1_SS0_SU8_SUM0_SUS256_SPO0_SRVW0_SSO0_SVW1_SK0_SKFTR0_SKXCCM0_SGRO0_TDMI0_TIN0_TT1_1_TLDS0_TLDSMn1_ULSGRO0_USL1_UIOFGRO0_UPLRP0_USFGROn1_VSn1_VWA1_VWB1_WSGRA0_WSGRB0_WS32_WG8_8_1_WGM1_WGMXCC1_WGMXCCGn1
    SolutionIndex: 18
    SolutionNameMin: Cijk_Alik_Bljk_S_B_Bias_HA_S_SAV_UserArgs_MT8x8x32_SN_LDSB0_AFC1_AG0_AFEM1_AFEM1_ASEM1_CLR0_CADS0_DTLA0_DTLB0_DTVA0_DTVB0_DTVMXSA0_DTVMXSB0_DTVSM0_DPLB0_EPS0_ELFLR0_EMLLn1_FDSI0_GRPM1_GRVWA1_GRVWB1_GSU1_GSUAMB_GSUC0_GSUWGMRR0_GLS0_ISA1151_IU1_K1_LDSTI0_LBSPPA0_LBSPPB0_LBSPPM0_LPA1_LPB1_LPM0_LRVW1_LWPMn1_MIAV0_MO40_MGRIPM1_NTn1_NTA0_NTB0_NTC0_NTD0_NTM0_NEPBS0_NLCA1_NLCB1_ONLL1_PGR0_PLR1_PKA0_SGROB0_SIA1_SS0_SU0_SUM0_SUS0_SPO0_SRVW0_SSO0_SVW1_SK0_SKFTR0_SKXCCM0_SGRO0_TDMI0_TIN0_TT1_1_TLDS0_TLDSMn1_ULSGRO0_USL1_UIOFGRO0_UPLRP0_USFGROn1_VSn1_VWA1_VWB1_WSGRA0_WSGRB0_WS32_WG8_8_1_WGM1_WGMXCC1_WGMXCCGn1
    SolutionIndex: 19
    SolutionNameMin: Cijk_Alik_Bljk_S_B_Bias_HA_S_SAV_UserArgs_MT8x16x128_SN_LDSB0_AFC1_AG0_AFEM1_AFEM1_ASEM1_CLR0_CADS0_DTLA0_DTLB0_DTVA0_DTVB0_DTVMXSA0_DTVMXSB0_DTVSM0_DPLB0_EPS0_ELFLR0_EMLLn1_FDSI0_GRPM1_GRVWA1_GRVWB1_GSU1_GSUAMB_GSUC0_GSUWGMRR0_GLS0_ISA1151_IU1_K1_LDSTI0_LBSPPA0_LBSPPB0_LBSPPM0_LPA1_LPB1_LPM0_LRVW1_LWPMn1_MIAV0_MO40_MGRIPM1_NTn1_NTA0_NTB0_NTC0_NTD0_NTM0_NEPBS0_NLCA1_NLCB1_ONLL1_PGR0_PLR1_PKA0_SGROB0_SIA1_SS0_SU0_SUM0_SUS0_SPO0_SRVW0_SSO0_SVW1_SK0_SKFTR0_SKXCCM0_SGRO0_TDMI0_TIN0_TT1_1_TLDS0_TLDSMn1_ULSGRO0_USL1_UIOFGRO0_UPLRP0_USFGROn1_VSn1_VWA1_VWB1_WSGRA0_WSGRB0_WS32_WG8_16_1_WGM1_WGMXCC1_WGMXCCGn1
    SolutionIndex: 20
    SolutionNameMin: Cijk_Alik_Bljk_S_B_Bias_HA_S_SAV_UserArgs_MT8x16x256_SN_LDSB0_AFC1_AG0_AFEM1_AFEM1_ASEM1_CLR0_CADS0_DTLA0_DTLB0_DTVA0_DTVB0_DTVMXSA0_DTVMXSB0_DTVSM0_DPLB0_EPS0_ELFLR0_EMLLn1_FDSI0_GRPM1_GRVWA1_GRVWB1_GSU1_GSUAMB_GSUC0_GSUWGMRR0_GLS0_ISA1151_IU1_K1_LDSTI0_LBSPPA0_LBSPPB0_LBSPPM0_LPA1_LPB1_LPM0_LRVW1_LWPMn1_MIAV0_MO40_MGRIPM1_NTn1_NTA0_NTB0_NTC0_NTD0_NTM0_NEPBS0_NLCA2_NLCB2_ONLL1_PGR0_PLR1_PKA0_SGROB0_SIA1_SS0_SU8_SUM0_SUS1024_SPO0_SRVW0_SSO0_SVW1_SK0_SKFTR0_SKXCCM0_SGRO0_TDMI0_TIN0_TT1_1_TLDS0_TLDSMn1_ULSGRO0_USL1_UIOFGRO0_UPLRP0_USFGROn1_VSn1_VWA1_VWB1_WSGRA0_WSGRB0_WS32_WG8_16_1_WGM1_WGMXCC1_WGMXCCGn1
    SolutionIndex: 21
    SolutionNameMin: Cijk_Alik_Bljk_S_B_Bias_HA_S_SAV_UserArgs_MT8x16x256_SN_LDSB0_AFC1_AG0_AFEM1_AFEM1_ASEM1_CLR0_CADS0_DTLA0_DTLB0_DTVA0_DTVB0_DTVMXSA0_DTVMXSB0_DTVSM0_DPLB0_EPS0_ELFLR0_EMLLn1_FDSI0_GRPM1_GRVWA1_GRVWB1_GSU1_GSUAMB_GSUC0_GSUWGMRR0_GLS0_ISA1151_IU1_K1_LDSTI0_LBSPPA0_LBSPPB0_LBSPPM0_LPA1_LPB1_LPM0_LRVW1_LWPMn1_MIAV0_MO40_MGRIPM1_NTn1_NTA0_NTB0_NTC0_NTD0_NTM0_NEPBS0_NLCA2_NLCB2_ONLL1_PGR0_PLR1_PKA0_SGROB0_SIA1_SS0_SU0_SUM0_SUS0_SPO0_SRVW0_SSO0_SVW1_SK0_SKFTR0_SKXCCM0_SGRO0_TDMI0_TIN0_TT1_1_TLDS0_TLDSMn1_ULSGRO0_USL1_UIOFGRO0_UPLRP0_USFGROn1_VSn1_VWA1_VWB1_WSGRA0_WSGRB0_WS32_WG8_16_1_WGM1_WGMXCC1_WGMXCCGn1
    SolutionIndex: 22
    SolutionNameMin: Cijk_Alik_Bljk_S_B_Bias_HA_S_SAV_UserArgs_MT8x16x32_SN_LDSB0_AFC1_AG0_AFEM1_AFEM1_ASEM1_CLR0_CADS0_DTLA0_DTLB0_DTVA0_DTVB0_DTVMXSA0_DTVMXSB0_DTVSM0_DPLB0_EPS0_ELFLR0_EMLLn1_FDSI0_GRPM1_GRVWA1_GRVWB1_GSU1_GSUAMB_GSUC0_GSUWGMRR0_GLS0_ISA1151_IU1_K1_LDSTI0_LBSPPA0_LBSPPB0_LBSPPM0_LPA1_LPB1_LPM0_LRVW1_LWPMn1_MIAV0_MO40_MGRIPM1_NTn1_NTA0_NTB0_NTC0_NTD0_NTM0_NEPBS0_NLCA1_NLCB1_ONLL1_PGR0_PLR1_PKA0_SGROB0_SIA1_SS0_SU0_SUM0_SUS0_SPO0_SRVW0_SSO0_SVW1_SK0_SKFTR0_SKXCCM0_SGRO0_TDMI0_TIN0_TT1_1_TLDS0_TLDSMn1_ULSGRO0_USL1_UIOFGRO0_UPLRP0_USFGROn1_VSn1_VWA1_VWB1_WSGRA0_WSGRB0_WS32_WG8_16_1_WGM1_WGMXCC1_WGMXCCGn1
    SolutionIndex: 23
    SolutionNameMin: Cijk_Alik_Bljk_S_B_Bias_HA_S_SAV_UserArgs_MT8x16x128_SN_LDSB0_AFC1_AG0_AFEM1_AFEM1_ASEM1_CLR0_CADS0_DTLA0_DTLB0_DTVA0_DTVB0_DTVMXSA0_DTVMXSB0_DTVSM0_DPLB0_EPS0_ELFLR0_EMLLn1_FDSI0_GRPM1_GRVWA1_GRVWB1_GSU1_GSUAMB_GSUC0_GSUWGMRR0_GLS0_ISA1151_IU1_K1_LDSTI0_LBSPPA0_LBSPPB0_LBSPPM0_LPA1_LPB1_LPM0_LRVW1_LWPMn1_MIAV0_MO40_MGRIPM1_NTn1_NTA0_NTB0_NTC0_NTD0_NTM0_NEPBS0_NLCA1_NLCB1_ONLL1_PGR0_PLR1_PKA0_SGROB0_SIA1_SS0_SU8_SUM0_SUS512_SPO0_SRVW0_SSO0_SVW1_SK0_SKFTR0_SKXCCM0_SGRO0_TDMI0_TIN0_TT1_1_TLDS0_TLDSMn1_ULSGRO0_USL1_UIOFGRO0_UPLRP0_USFGROn1_VSn1_VWA1_VWB1_WSGRA0_WSGRB0_WS32_WG8_16_1_WGM1_WGMXCC1_WGMXCCGn1
    SolutionIndex: 24
    SolutionNameMin: Cijk_Alik_Bljk_S_B_Bias_HA_S_SAV_UserArgs_MT8x8x128_SN_LDSB0_AFC1_AG0_AFEM1_AFEM1_ASEM1_CLR0_CADS0_DTLA0_DTLB0_DTVA0_DTVB0_DTVMXSA0_DTVMXSB0_DTVSM0_DPLB0_EPS0_ELFLR0_EMLLn1_FDSI0_GRPM1_GRVWA1_GRVWB1_GSU1_GSUAMB_GSUC0_GSUWGMRR0_GLS0_ISA1151_IU1_K1_LDSTI0_LBSPPA0_LBSPPB0_LBSPPM0_LPA1_LPB1_LPM0_LRVW1_LWPMn1_MIAV0_MO40_MGRIPM1_NTn1_NTA0_NTB0_NTC0_NTD0_NTM0_NEPBS0_NLCA2_NLCB2_ONLL1_PGR0_PLR1_PKA0_SGROB0_SIA1_SS0_SU8_SUM0_SUS512_SPO0_SRVW0_SSO0_SVW1_SK0_SKFTR0_SKXCCM0_SGRO0_TDMI0_TIN0_TT1_1_TLDS0_TLDSMn1_ULSGRO0_USL1_UIOFGRO0_UPLRP0_USFGROn1_VSn1_VWA1_VWB1_WSGRA0_WSGRB0_WS32_WG8_8_1_WGM1_WGMXCC1_WGMXCCGn1
    SolutionIndex: 25
    SolutionNameMin: Cijk_Alik_Bljk_S_B_Bias_HA_S_SAV_UserArgs_MT8x8x128_SN_LDSB0_AFC1_AG0_AFEM1_AFEM1_ASEM1_CLR0_CADS0_DTLA0_DTLB0_DTVA0_DTVB0_DTVMXSA0_DTVMXSB0_DTVSM0_DPLB0_EPS0_ELFLR0_EMLLn1_FDSI0_GRPM1_GRVWA1_GRVWB1_GSU1_GSUAMB_GSUC0_GSUWGMRR0_GLS0_ISA1151_IU1_K1_LDSTI0_LBSPPA0_LBSPPB0_LBSPPM0_LPA1_LPB1_LPM0_LRVW1_LWPMn1_MIAV0_MO40_MGRIPM1_NTn1_NTA0_NTB0_NTC0_NTD0_NTM0_NEPBS0_NLCA2_NLCB2_ONLL1_PGR0_PLR1_PKA0_SGROB0_SIA1_SS0_SU0_SUM0_SUS0_SPO0_SRVW0_SSO0_SVW1_SK0_SKFTR0_SKXCCM0_SGRO0_TDMI0_TIN0_TT1_1_TLDS0_TLDSMn1_ULSGRO0_USL1_UIOFGRO0_UPLRP0_USFGROn1_VSn1_VWA1_VWB1_WSGRA0_WSGRB0_WS32_WG8_8_1_WGM1_WGMXCC1_WGMXCCGn1
    SolutionIndex: 26
    SolutionNameMin: Cijk_Alik_Bljk_S_B_Bias_HA_S_SAV_UserArgs_MT32x8x32_SN_LDSB0_AFC1_AG0_AFEM1_AFEM1_ASEM1_CLR0_CADS0_DTLA0_DTLB0_DTVA0_DTVB0_DTVMXSA0_DTVMXSB0_DTVSM0_DPLB0_EPS0_ELFLR0_EMLLn1_FDSI0_GRPM1_GRVWA1_GRVWB1_GSU1_GSUAMB_GSUC0_GSUWGMRR0_GLS0_ISA1151_IU1_K1_LDSTI0_LBSPPA0_LBSPPB0_LBSPPM0_LPA1_LPB1_LPM0_LRVW1_LWPMn1_MIAV0_MO40_MGRIPM1_NTn1_NTA0_NTB0_NTC0_NTD0_NTM0_NEPBS0_NLCA1_NLCB1_ONLL1_PGR0_PLR1_PKA0_SGROB0_SIA1_SS0_SU16_SUM0_SUS256_SPO0_SRVW0_SSO0_SVW1_SK0_SKFTR0_SKXCCM0_SGRO0_TDMI0_TIN0_TT4_1_TLDS0_TLDSMn1_ULSGRO0_USL1_UIOFGRO0_UPLRP0_USFGROn1_VSn1_VWA1_VWB1_WSGRA0_WSGRB0_WS32_WG8_8_1_WGM1_WGMXCC1_WGMXCCGn1
    SolutionIndex: 27
    SolutionNameMin: Cijk_Alik_Bljk_S_B_Bias_HA_S_SAV_UserArgs_MT64x8x32_SN_LDSB0_AFC1_AG0_AFEM1_AFEM1_ASEM1_CLR0_CADS0_DTLA0_DTLB0_DTVA0_DTVB0_DTVMXSA0_DTVMXSB0_DTVSM0_DPLB0_EPS0_ELFLR0_EMLLn1_FDSI0_GRPM1_GRVWA1_GRVWB1_GSU1_GSUAMB_GSUC0_GSUWGMRR0_GLS0_ISA1151_IU1_K1_LDSTI0_LBSPPA0_LBSPPB0_LBSPPM0_LPA1_LPB1_LPM0_LRVW1_LWPMn1_MIAV0_MO40_MGRIPM1_NTn1_NTA0_NTB0_NTC0_NTD0_NTM0_NEPBS0_NLCA1_NLCB1_ONLL1_PGR1_PLR1_PKA0_SGROB0_SIA1_SS0_SU32_SUM0_SUS256_SPO0_SRVW0_SSO0_SVW1_SK0_SKFTR0_SKXCCM0_SGRO0_TDMI0_TIN0_TT4_1_TLDS0_TLDSMn1_ULSGRO0_USL1_UIOFGRO0_UPLRP0_USFGROn1_VSn1_VWA1_VWB1_WSGRA0_WSGRB0_WS32_WG16_8_1_WGM1_WGMXCC1_WGMXCCGn1
    SolutionIndex: 28
    SolutionNameMin: Cijk_Alik_Bljk_S_B_Bias_HA_S_SAV_UserArgs_MT64x8x32_SN_LDSB0_AFC1_AG0_AFEM1_AFEM1_ASEM1_CLR0_CADS0_DTLA0_DTLB0_DTVA0_DTVB0_DTVMXSA0_DTVMXSB0_DTVSM0_DPLB0_EPS0_ELFLR0_EMLLn1_FDSI0_GRPM1_GRVWA1_GRVWB1_GSU1_GSUAMB_GSUC0_GSUWGMRR0_GLS0_ISA1151_IU1_K1_LDSTI0_LBSPPA0_LBSPPB0_LBSPPM0_LPA1_LPB1_LPM0_LRVW1_LWPMn1_MIAV0_MO40_MGRIPM1_NTn1_NTA0_NTB0_NTC0_NTD0_NTM0_NEPBS0_NLCA1_NLCB1_ONLL1_PGR0_PLR1_PKA0_SGROB0_SIA1_SS0_SU16_SUM0_SUS256_SPO0_SRVW0_SSO0_SVW1_SK0_SKFTR0_SKXCCM0_SGRO0_TDMI0_TIN0_TT4_1_TLDS0_TLDSMn1_ULSGRO0_USL1_UIOFGRO0_UPLRP0_USFGROn1_VSn1_VWA1_VWB1_WSGRA0_WSGRB0_WS32_WG16_8_1_WGM1_WGMXCC1_WGMXCCGn1
    SolutionIndex: 29
    SolutionNameMin: Cijk_Alik_Bljk_S_B_Bias_HA_S_SAV_UserArgs_MT8x8x32_SN_LDSB0_AFC1_AG0_AFEM1_AFEM1_ASEM1_CLR0_CADS0_DTLA0_DTLB0_DTVA0_DTVB0_DTVMXSA0_DTVMXSB0_DTVSM0_DPLB0_EPS0_ELFLR0_EMLLn1_FDSI0_GRPM1_GRVWA1_GRVWB1_GSU1_GSUAMB_GSUC0_GSUWGMRR0_GLS0_ISA1151_IU1_K1_LDSTI0_LBSPPA0_LBSPPB0_LBSPPM0_LPA1_LPB1_LPM0_LRVW1_LWPMn1_MIAV0_MO40_MGRIPM1_NTn1_NTA0_NTB0_NTC0_NTD0_NTM0_NEPBS0_NLCA1_NLCB1_ONLL1_PGR0_PLR1_PKA0_SGROB0_SIA1_SS0_SU16_SUM0_SUS256_SPO0_SRVW0_SSO0_SVW1_SK0_SKFTR0_SKXCCM0_SGRO0_TDMI0_TIN0_TT1_1_TLDS0_TLDSMn1_ULSGRO0_USL1_UIOFGRO0_UPLRP0_USFGROn1_VSn1_VWA1_VWB1_WSGRA0_WSGRB0_WS32_WG8_8_1_WGM1_WGMXCC1_WGMXCCGn1
    SolutionIndex: 30
    SolutionNameMin: Cijk_Alik_Bljk_S_B_Bias_HA_S_SAV_UserArgs_MT8x8x32_SN_LDSB0_AFC1_AG0_AFEM1_AFEM1_ASEM1_CLR0_CADS0_DTLA0_DTLB0_DTVA0_DTVB0_DTVMXSA0_DTVMXSB0_DTVSM0_DPLB0_EPS0_ELFLR0_EMLLn1_FDSI0_GRPM1_GRVWA1_GRVWB1_GSU1_GSUAMB_GSUC0_GSUWGMRR0_GLS0_ISA1151_IU1_K1_LDSTI0_LBSPPA0_LBSPPB0_LBSPPM0_LPA1_LPB1_LPM0_LRVW1_LWPMn1_MIAV0_MO40_MGRIPM1_NTn1_NTA0_NTB0_NTC0_NTD0_NTM0_NEPBS0_NLCA1_NLCB1_ONLL1_PGR1_PLR1_PKA0_SGROB0_SIA1_SS0_SU32_SUM0_SUS256_SPO0_SRVW0_SSO0_SVW1_SK0_SKFTR0_SKXCCM0_SGRO0_TDMI0_TIN0_TT1_1_TLDS0_TLDSMn1_ULSGRO0_USL1_UIOFGRO0_UPLRP0_USFGROn1_VSn1_VWA1_VWB1_WSGRA0_WSGRB0_WS32_WG8_8_1_WGM1_WGMXCC1_WGMXCCGn1
    SolutionIndex: 31
    SolutionNameMin: Cijk_Alik_Bljk_S_B_Bias_HA_S_SAV_UserArgs_MT16x8x128_SN_LDSB0_AFC1_AG0_AFEM1_AFEM1_ASEM1_CLR0_CADS0_DTLA0_DTLB0_DTVA0_DTVB0_DTVMXSA0_DTVMXSB0_DTVSM0_DPLB0_EPS0_ELFLR0_EMLLn1_FDSI0_GRPM1_GRVWA1_GRVWB1_GSU1_GSUAMB_GSUC0_GSUWGMRR0_GLS0_ISA1151_IU1_K1_LDSTI0_LBSPPA0_LBSPPB0_LBSPPM0_LPA1_LPB1_LPM0_LRVW1_LWPMn1_MIAV0_MO40_MGRIPM1_NTn1_NTA0_NTB0_NTC0_NTD0_NTM0_NEPBS0_NLCA1_NLCB1_ONLL1_PGR1_PLR1_PKA0_SGROB0_SIA1_SS0_SU32_SUM0_SUS512_SPO0_SRVW0_SSO0_SVW1_SK0_SKFTR0_SKXCCM0_SGRO0_TDMI0_TIN0_TT1_1_TLDS0_TLDSMn1_ULSGRO0_USL1_UIOFGRO0_UPLRP0_USFGROn1_VSn1_VWA1_VWB1_WSGRA0_WSGRB0_WS32_WG16_8_1_WGM1_WGMXCC1_WGMXCCGn1
    SolutionIndex: 32
    SolutionNameMin: Cijk_Alik_Bljk_S_B_Bias_HA_S_SAV_UserArgs_MT64x8x32_SN_LDSB0_AFC1_AG0_AFEM1_AFEM1_ASEM1_CLR0_CADS0_DTLA0_DTLB0_DTVA0_DTVB0_DTVMXSA0_DTVMXSB0_DTVSM0_DPLB0_EPS0_ELFLR0_EMLLn1_FDSI0_GRPM1_GRVWA1_GRVWB1_GSU1_GSUAMB_GSUC0_GSUWGMRR0_GLS0_ISA1151_IU1_K1_LDSTI0_LBSPPA0_LBSPPB0_LBSPPM0_LPA1_LPB1_LPM0_LRVW1_LWPMn1_MIAV0_MO40_MGRIPM1_NTn1_NTA0_NTB0_NTC0_NTD0_NTM0_NEPBS0_NLCA1_NLCB1_ONLL1_PGR1_PLR1_PKA0_SGROB0_SIA1_SS0_SU16_SUM0_SUS256_SPO0_SRVW0_SSO0_SVW1_SK0_SKFTR0_SKXCCM0_SGRO0_TDMI0_TIN0_TT4_1_TLDS0_TLDSMn1_ULSGRO0_USL1_UIOFGRO0_UPLRP0_USFGROn1_VSn1_VWA1_VWB1_WSGRA0_WSGRB0_WS32_WG16_8_1_WGM1_WGMXCC1_WGMXCCGn1
    SolutionIndex: 33
    SolutionNameMin: Cijk_Alik_Bljk_S_B_Bias_HA_S_SAV_UserArgs_MT64x8x32_SN_LDSB0_AFC1_AG0_AFEM1_AFEM1_ASEM1_CLR0_CADS0_DTLA0_DTLB0_DTVA0_DTVB0_DTVMXSA0_DTVMXSB0_DTVSM0_DPLB0_EPS0_ELFLR0_EMLLn1_FDSI0_GRPM1_GRVWA1_GRVWB1_GSU1_GSUAMB_GSUC0_GSUWGMRR0_GLS0_ISA1151_IU1_K1_LDSTI0_LBSPPA0_LBSPPB0_LBSPPM0_LPA1_LPB1_LPM0_LRVW1_LWPMn1_MIAV0_MO40_MGRIPM1_NTn1_NTA0_NTB0_NTC0_NTD0_NTM0_NEPBS0_NLCA1_NLCB1_ONLL1_PGR0_PLR1_PKA0_SGROB0_SIA1_SS0_SU32_SUM0_SUS256_SPO0_SRVW0_SSO0_SVW1_SK0_SKFTR0_SKXCCM0_SGRO0_TDMI0_TIN0_TT4_1_TLDS0_TLDSMn1_ULSGRO0_USL1_UIOFGRO0_UPLRP0_USFGROn1_VSn1_VWA1_VWB1_WSGRA0_WSGRB0_WS32_WG16_8_1_WGM1_WGMXCC1_WGMXCCGn1
    SolutionIndex: 34
    SolutionNameMin: Cijk_Alik_Bljk_S_B_Bias_HA_S_SAV_UserArgs_MT32x8x32_SN_LDSB0_AFC1_AG0_AFEM1_AFEM1_ASEM1_CLR0_CADS0_DTLA0_DTLB0_DTVA0_DTVB0_DTVMXSA0_DTVMXSB0_DTVSM0_DPLB0_EPS0_ELFLR0_EMLLn1_FDSI0_GRPM1_GRVWA1_GRVWB1_GSU1_GSUAMB_GSUC0_GSUWGMRR0_GLS0_ISA1151_IU1_K1_LDSTI0_LBSPPA0_LBSPPB0_LBSPPM0_LPA1_LPB1_LPM0_LRVW1_LWPMn1_MIAV0_MO40_MGRIPM1_NTn1_NTA0_NTB0_NTC0_NTD0_NTM0_NEPBS0_NLCA1_NLCB1_ONLL1_PGR1_PLR1_PKA0_SGROB0_SIA1_SS0_SU32_SUM0_SUS256_SPO0_SRVW0_SSO0_SVW1_SK0_SKFTR0_SKXCCM0_SGRO0_TDMI0_TIN0_TT2_1_TLDS0_TLDSMn1_ULSGRO0_USL1_UIOFGRO0_UPLRP0_USFGROn1_VSn1_VWA1_VWB1_WSGRA0_WSGRB0_WS32_WG16_8_1_WGM1_WGMXCC1_WGMXCCGn1
    SolutionIndex: 35
    SolutionNameMin: Cijk_Alik_Bljk_S_B_Bias_HA_S_SAV_UserArgs_MT32x8x32_SN_LDSB0_AFC1_AG0_AFEM1_AFEM1_ASEM1_CLR0_CADS0_DTLA0_DTLB0_DTVA0_DTVB0_DTVMXSA0_DTVMXSB0_DTVSM0_DPLB0_EPS0_ELFLR0_EMLLn1_FDSI0_GRPM1_GRVWA1_GRVWB1_GSU1_GSUAMB_GSUC0_GSUWGMRR0_GLS0_ISA1151_IU1_K1_LDSTI0_LBSPPA0_LBSPPB0_LBSPPM0_LPA1_LPB1_LPM0_LRVW1_LWPMn1_MIAV0_MO40_MGRIPM1_NTn1_NTA0_NTB0_NTC0_NTD0_NTM0_NEPBS0_NLCA1_NLCB1_ONLL1_PGR1_PLR1_PKA0_SGROB0_SIA1_SS0_SU16_SUM0_SUS256_SPO0_SRVW0_SSO0_SVW1_SK0_SKFTR0_SKXCCM0_SGRO0_TDMI0_TIN0_TT4_1_TLDS0_TLDSMn1_ULSGRO0_USL1_UIOFGRO0_UPLRP0_USFGROn1_VSn1_VWA1_VWB1_WSGRA0_WSGRB0_WS32_WG8_8_1_WGM1_WGMXCC1_WGMXCCGn1
    SolutionIndex: 36
    SolutionNameMin: Cijk_Alik_Bljk_S_B_Bias_HA_S_SAV_UserArgs_MT32x8x32_SN_LDSB0_AFC1_AG0_AFEM1_AFEM1_ASEM1_CLR0_CADS0_DTLA0_DTLB0_DTVA0_DTVB0_DTVMXSA0_DTVMXSB0_DTVSM0_DPLB0_EPS0_ELFLR0_EMLLn1_FDSI0_GRPM1_GRVWA1_GRVWB1_GSU1_GSUAMB_GSUC0_GSUWGMRR0_GLS0_ISA1151_IU1_K1_LDSTI0_LBSPPA0_LBSPPB0_LBSPPM0_LPA1_LPB1_LPM0_LRVW1_LWPMn1_MIAV0_MO40_MGRIPM1_NTn1_NTA0_NTB0_NTC0_NTD0_NTM0_NEPBS0_NLCA1_NLCB1_ONLL1_PGR1_PLR1_PKA0_SGROB0_SIA1_SS0_SU32_SUM0_SUS256_SPO0_SRVW0_SSO0_SVW1_SK0_SKFTR0_SKXCCM0_SGRO0_TDMI0_TIN0_TT4_1_TLDS0_TLDSMn1_ULSGRO0_USL1_UIOFGRO0_UPLRP0_USFGROn1_VSn1_VWA1_VWB1_WSGRA0_WSGRB0_WS32_WG8_8_1_WGM1_WGMXCC1_WGMXCCGn1
    SolutionIndex: 37
    SolutionNameMin: Cijk_Alik_Bljk_S_B_Bias_HA_S_SAV_UserArgs_MT32x8x32_SN_LDSB0_AFC1_AG0_AFEM1_AFEM1_ASEM1_CLR0_CADS0_DTLA0_DTLB0_DTVA0_DTVB0_DTVMXSA0_DTVMXSB0_DTVSM0_DPLB0_EPS0_ELFLR0_EMLLn1_FDSI0_GRPM1_GRVWA1_GRVWB1_GSU1_GSUAMB_GSUC0_GSUWGMRR0_GLS0_ISA1151_IU1_K1_LDSTI0_LBSPPA0_LBSPPB0_LBSPPM0_LPA1_LPB1_LPM0_LRVW1_LWPMn1_MIAV0_MO40_MGRIPM1_NTn1_NTA0_NTB0_NTC0_NTD0_NTM0_NEPBS0_NLCA1_NLCB1_ONLL1_PGR0_PLR1_PKA0_SGROB0_SIA1_SS0_SU32_SUM0_SUS256_SPO0_SRVW0_SSO0_SVW1_SK0_SKFTR0_SKXCCM0_SGRO0_TDMI0_TIN0_TT4_1_TLDS0_TLDSMn1_ULSGRO0_USL1_UIOFGRO0_UPLRP0_USFGROn1_VSn1_VWA1_VWB1_WSGRA0_WSGRB0_WS32_WG8_8_1_WGM1_WGMXCC1_WGMXCCGn1
    SolutionIndex: 38
    SolutionNameMin: Cijk_Alik_Bljk_S_B_Bias_HA_S_SAV_UserArgs_MT16x8x128_SN_LDSB0_AFC1_AG0_AFEM1_AFEM1_ASEM1_CLR0_CADS0_DTLA0_DTLB0_DTVA0_DTVB0_DTVMXSA0_DTVMXSB0_DTVSM0_DPLB0_EPS0_ELFLR0_EMLLn1_FDSI0_GRPM1_GRVWA1_GRVWB1_GSU1_GSUAMB_GSUC0_GSUWGMRR0_GLS0_ISA1151_IU1_K1_LDSTI0_LBSPPA0_LBSPPB0_LBSPPM0_LPA1_LPB1_LPM0_LRVW1_LWPMn1_MIAV0_MO40_MGRIPM1_NTn1_NTA0_NTB0_NTC0_NTD0_NTM0_NEPBS0_NLCA1_NLCB1_ONLL1_PGR1_PLR1_PKA0_SGROB0_SIA1_SS0_SU16_SUM0_SUS512_SPO0_SRVW0_SSO0_SVW1_SK0_SKFTR0_SKXCCM0_SGRO0_TDMI0_TIN0_TT1_1_TLDS0_TLDSMn1_ULSGRO0_USL1_UIOFGRO0_UPLRP0_USFGROn1_VSn1_VWA1_VWB1_WSGRA0_WSGRB0_WS32_WG16_8_1_WGM1_WGMXCC1_WGMXCCGn1
    SolutionIndex: 39
    SolutionNameMin: Cijk_Alik_Bljk_S_B_Bias_HA_S_SAV_UserArgs_MT32x8x32_SN_LDSB0_AFC1_AG0_AFEM1_AFEM1_ASEM1_CLR0_CADS0_DTLA0_DTLB0_DTVA0_DTVB0_DTVMXSA0_DTVMXSB0_DTVSM0_DPLB0_EPS0_ELFLR0_EMLLn1_FDSI0_GRPM1_GRVWA1_GRVWB1_GSU1_GSUAMB_GSUC0_GSUWGMRR0_GLS0_ISA1151_IU1_K1_LDSTI0_LBSPPA0_LBSPPB0_LBSPPM0_LPA1_LPB1_LPM0_LRVW1_LWPMn1_MIAV0_MO40_MGRIPM1_NTn1_NTA0_NTB0_NTC0_NTD0_NTM0_NEPBS0_NLCA1_NLCB1_ONLL1_PGR1_PLR1_PKA0_SGROB0_SIA1_SS0_SU16_SUM0_SUS256_SPO0_SRVW0_SSO0_SVW1_SK0_SKFTR0_SKXCCM0_SGRO0_TDMI0_TIN0_TT2_1_TLDS0_TLDSMn1_ULSGRO0_USL1_UIOFGRO0_UPLRP0_USFGROn1_VSn1_VWA1_VWB1_WSGRA0_WSGRB0_WS32_WG16_8_1_WGM1_WGMXCC1_WGMXCCGn1
    SolutionIndex: 40
    SolutionNameMin: Cijk_Alik_Bljk_S_B_Bias_HA_S_SAV_UserArgs_MT8x8x32_SN_LDSB0_AFC1_AG0_AFEM1_AFEM1_ASEM1_CLR0_CADS0_DTLA0_DTLB0_DTVA0_DTVB0_DTVMXSA0_DTVMXSB0_DTVSM0_DPLB0_EPS0_ELFLR0_EMLLn1_FDSI0_GRPM1_GRVWA1_GRVWB1_GSU1_GSUAMB_GSUC0_GSUWGMRR0_GLS0_ISA1151_IU1_K1_LDSTI0_LBSPPA0_LBSPPB0_LBSPPM0_LPA1_LPB1_LPM0_LRVW1_LWPMn1_MIAV0_MO40_MGRIPM1_NTn1_NTA0_NTB0_NTC0_NTD0_NTM0_NEPBS0_NLCA1_NLCB1_ONLL1_PGR1_PLR1_PKA0_SGROB0_SIA1_SS0_SU16_SUM0_SUS256_SPO0_SRVW0_SSO0_SVW1_SK0_SKFTR0_SKXCCM0_SGRO0_TDMI0_TIN0_TT1_1_TLDS0_TLDSMn1_ULSGRO0_USL1_UIOFGRO0_UPLRP0_USFGROn1_VSn1_VWA1_VWB1_WSGRA0_WSGRB0_WS32_WG8_8_1_WGM1_WGMXCC1_WGMXCCGn1
    SolutionIndex: 41
    SolutionNameMin: Cijk_Alik_Bljk_S_B_Bias_HA_S_SAV_UserArgs_MT16x8x32_SN_LDSB0_AFC1_AG0_AFEM1_AFEM1_ASEM1_CLR0_CADS0_DTLA0_DTLB0_DTVA0_DTVB0_DTVMXSA0_DTVMXSB0_DTVSM0_DPLB0_EPS0_ELFLR0_EMLLn1_FDSI0_GRPM1_GRVWA1_GRVWB1_GSU1_GSUAMB_GSUC0_GSUWGMRR0_GLS0_ISA1151_IU1_K1_LDSTI0_LBSPPA0_LBSPPB0_LBSPPM0_LPA1_LPB1_LPM0_LRVW1_LWPMn1_MIAV0_MO40_MGRIPM1_NTn1_NTA0_NTB0_NTC0_NTD0_NTM0_NEPBS0_NLCA1_NLCB1_ONLL1_PGR1_PLR1_PKA0_SGROB0_SIA1_SS0_SU16_SUM0_SUS256_SPO0_SRVW0_SSO0_SVW1_SK0_SKFTR0_SKXCCM0_SGRO0_TDMI0_TIN0_TT2_1_TLDS0_TLDSMn1_ULSGRO0_USL1_UIOFGRO0_UPLRP0_USFGROn1_VSn1_VWA1_VWB1_WSGRA0_WSGRB0_WS32_WG8_8_1_WGM1_WGMXCC1_WGMXCCGn1
    SolutionIndex: 42
    SolutionNameMin: Cijk_Alik_Bljk_S_B_Bias_HA_S_SAV_UserArgs_MT16x8x32_SN_LDSB0_AFC1_AG0_AFEM1_AFEM1_ASEM1_CLR0_CADS0_DTLA0_DTLB0_DTVA0_DTVB0_DTVMXSA0_DTVMXSB0_DTVSM0_DPLB0_EPS0_ELFLR0_EMLLn1_FDSI0_GRPM1_GRVWA1_GRVWB1_GSU1_GSUAMB_GSUC0_GSUWGMRR0_GLS0_ISA1151_IU1_K1_LDSTI0_LBSPPA0_LBSPPB0_LBSPPM0_LPA1_LPB1_LPM0_LRVW1_LWPMn1_MIAV0_MO40_MGRIPM1_NTn1_NTA0_NTB0_NTC0_NTD0_NTM0_NEPBS0_NLCA1_NLCB1_ONLL1_PGR1_PLR1_PKA0_SGROB0_SIA1_SS0_SU32_SUM0_SUS256_SPO0_SRVW0_SSO0_SVW1_SK0_SKFTR0_SKXCCM0_SGRO0_TDMI0_TIN0_TT2_1_TLDS0_TLDSMn1_ULSGRO0_USL1_UIOFGRO0_UPLRP0_USFGROn1_VSn1_VWA1_VWB1_WSGRA0_WSGRB0_WS32_WG8_8_1_WGM1_WGMXCC1_WGMXCCGn1
    SolutionIndex: 43
    SolutionNameMin: Cijk_Alik_Bljk_S_B_Bias_HA_S_SAV_UserArgs_MT32x8x16_SN_LDSB0_AFC1_AG0_AFEM1_AFEM1_ASEM1_CLR0_CADS0_DTLA0_DTLB0_DTVA0_DTVB0_DTVMXSA0_DTVMXSB0_DTVSM0_DPLB0_EPS0_ELFLR0_EMLLn1_FDSI0_GRPM1_GRVWA1_GRVWB1_GSU1_GSUAMB_GSUC0_GSUWGMRR0_GLS0_ISA1151_IU1_K1_LDSTI0_LBSPPA0_LBSPPB0_LBSPPM0_LPA1_LPB1_LPM0_LRVW1_LWPMn1_MIAV0_MO40_MGRIPM1_NTn1_NTA0_NTB0_NTC0_NTD0_NTM0_NEPBS0_NLCA1_NLCB1_ONLL1_PGR0_PLR1_PKA0_SGROB0_SIA1_SS0_SU32_SUM0_SUS256_SPO0_SRVW0_SSO0_SVW1_SK0_SKFTR0_SKXCCM0_SGRO0_TDMI0_TIN0_TT2_1_TLDS0_TLDSMn1_ULSGRO0_USL1_UIOFGRO0_UPLRP0_USFGROn1_VSn1_VWA1_VWB1_WSGRA0_WSGRB0_WS32_WG16_8_1_WGM1_WGMXCC1_WGMXCCGn1
    SolutionIndex: 44
    SolutionNameMin: Cijk_Alik_Bljk_S_B_Bias_HA_S_SAV_UserArgs_MT16x8x32_SN_LDSB0_AFC1_AG0_AFEM1_AFEM1_ASEM1_CLR0_CADS0_DTLA0_DTLB0_DTVA0_DTVB0_DTVMXSA0_DTVMXSB0_DTVSM0_DPLB0_EPS0_ELFLR0_EMLLn1_FDSI0_GRPM1_GRVWA1_GRVWB1_GSU1_GSUAMB_GSUC0_GSUWGMRR0_GLS0_ISA1151_IU1_K1_LDSTI0_LBSPPA0_LBSPPB0_LBSPPM0_LPA1_LPB1_LPM0_LRVW1_LWPMn1_MIAV0_MO40_MGRIPM1_NTn1_NTA0_NTB0_NTC0_NTD0_NTM0_NEPBS0_NLCA1_NLCB1_ONLL1_PGR0_PLR1_PKA0_SGROB0_SIA1_SS0_SU32_SUM0_SUS256_SPO0_SRVW0_SSO0_SVW1_SK0_SKFTR0_SKXCCM0_SGRO0_TDMI0_TIN0_TT1_1_TLDS0_TLDSMn1_ULSGRO0_USL1_UIOFGRO0_UPLRP0_USFGROn1_VSn1_VWA1_VWB1_WSGRA0_WSGRB0_WS32_WG16_8_1_WGM1_WGMXCC1_WGMXCCGn1
    SolutionIndex: 45
    SolutionNameMin: Cijk_Alik_Bljk_S_B_Bias_HA_S_SAV_UserArgs_MT16x8x128_SN_LDSB0_AFC1_AG0_AFEM1_AFEM1_ASEM1_CLR0_CADS0_DTLA0_DTLB0_DTVA0_DTVB0_DTVMXSA0_DTVMXSB0_DTVSM0_DPLB0_EPS0_ELFLR0_EMLLn1_FDSI0_GRPM1_GRVWA1_GRVWB1_GSU1_GSUAMB_GSUC0_GSUWGMRR0_GLS0_ISA1151_IU1_K1_LDSTI0_LBSPPA0_LBSPPB0_LBSPPM0_LPA1_LPB1_LPM0_LRVW1_LWPMn1_MIAV0_MO40_MGRIPM1_NTn1_NTA0_NTB0_NTC0_NTD0_NTM0_NEPBS0_NLCA1_NLCB1_ONLL1_PGR0_PLR1_PKA0_SGROB0_SIA1_SS0_SU16_SUM0_SUS512_SPO0_SRVW0_SSO0_SVW1_SK0_SKFTR0_SKXCCM0_SGRO0_TDMI0_TIN0_TT1_1_TLDS0_TLDSMn1_ULSGRO0_USL1_UIOFGRO0_UPLRP0_USFGROn1_VSn1_VWA1_VWB1_WSGRA0_WSGRB0_WS32_WG16_8_1_WGM1_WGMXCC1_WGMXCCGn1
    SolutionIndex: 46
    SolutionNameMin: Cijk_Alik_Bljk_S_B_Bias_HA_S_SAV_UserArgs_MT8x8x16_SN_LDSB0_AFC1_AG0_AFEM1_AFEM1_ASEM1_CLR0_CADS0_DTLA0_DTLB0_DTVA0_DTVB0_DTVMXSA0_DTVMXSB0_DTVSM0_DPLB0_EPS0_ELFLR0_EMLLn1_FDSI0_GRPM1_GRVWA1_GRVWB1_GSU1_GSUAMB_GSUC0_GSUWGMRR0_GLS0_ISA1151_IU1_K1_LDSTI0_LBSPPA0_LBSPPB0_LBSPPM0_LPA1_LPB1_LPM0_LRVW1_LWPMn1_MIAV0_MO40_MGRIPM1_NTn1_NTA0_NTB0_NTC0_NTD0_NTM0_NEPBS0_NLCA1_NLCB1_ONLL1_PGR0_PLR1_PKA0_SGROB0_SIA1_SS0_SU16_SUM0_SUS256_SPO0_SRVW0_SSO0_SVW1_SK0_SKFTR0_SKXCCM0_SGRO0_TDMI0_TIN0_TT1_1_TLDS0_TLDSMn1_ULSGRO0_USL1_UIOFGRO0_UPLRP0_USFGROn1_VSn1_VWA1_VWB1_WSGRA0_WSGRB0_WS32_WG8_8_1_WGM1_WGMXCC1_WGMXCCGn1
    SolutionIndex: 47
    SolutionNameMin: Cijk_Alik_Bljk_S_B_Bias_HA_S_SAV_UserArgs_MT32x8x32_SN_LDSB0_AFC1_AG0_AFEM1_AFEM1_ASEM1_CLR0_CADS0_DTLA0_DTLB0_DTVA0_DTVB0_DTVMXSA0_DTVMXSB0_DTVSM0_DPLB0_EPS0_ELFLR0_EMLLn1_FDSI0_GRPM1_GRVWA1_GRVWB1_GSU1_GSUAMB_GSUC0_GSUWGMRR0_GLS0_ISA1151_IU1_K1_LDSTI0_LBSPPA0_LBSPPB0_LBSPPM0_LPA1_LPB1_LPM0_LRVW1_LWPMn1_MIAV0_MO40_MGRIPM1_NTn1_NTA0_NTB0_NTC0_NTD0_NTM0_NEPBS0_NLCA1_NLCB1_ONLL1_PGR0_PLR1_PKA0_SGROB0_SIA1_SS0_SU32_SUM0_SUS256_SPO0_SRVW0_SSO0_SVW1_SK0_SKFTR0_SKXCCM0_SGRO0_TDMI0_TIN0_TT2_1_TLDS0_TLDSMn1_ULSGRO0_USL1_UIOFGRO0_UPLRP0_USFGROn1_VSn1_VWA1_VWB1_WSGRA0_WSGRB0_WS32_WG16_8_1_WGM1_WGMXCC1_WGMXCCGn1
    SolutionIndex: 48
    SolutionNameMin: Cijk_Alik_Bljk_S_B_Bias_HA_S_SAV_UserArgs_MT8x8x128_SN_LDSB0_AFC1_AG0_AFEM1_AFEM1_ASEM1_CLR0_CADS0_DTLA0_DTLB0_DTVA0_DTVB0_DTVMXSA0_DTVMXSB0_DTVSM0_DPLB0_EPS0_ELFLR0_EMLLn1_FDSI0_GRPM1_GRVWA1_GRVWB1_GSU1_GSUAMB_GSUC0_GSUWGMRR0_GLS0_ISA1151_IU1_K1_LDSTI0_LBSPPA0_LBSPPB0_LBSPPM0_LPA1_LPB1_LPM0_LRVW1_LWPMn1_MIAV0_MO40_MGRIPM1_NTn1_NTA0_NTB0_NTC0_NTD0_NTM0_NEPBS0_NLCA2_NLCB2_ONLL1_PGR0_PLR1_PKA0_SGROB0_SIA1_SS0_SU16_SUM0_SUS512_SPO0_SRVW0_SSO0_SVW1_SK0_SKFTR0_SKXCCM0_SGRO0_TDMI0_TIN0_TT1_1_TLDS0_TLDSMn1_ULSGRO0_USL1_UIOFGRO0_UPLRP0_USFGROn1_VSn1_VWA1_VWB1_WSGRA0_WSGRB0_WS32_WG8_8_1_WGM1_WGMXCC1_WGMXCCGn1
    SolutionIndex: 49
    SolutionNameMin: Cijk_Alik_Bljk_S_B_Bias_HA_S_SAV_UserArgs_MT16x8x128_SN_LDSB0_AFC1_AG0_AFEM1_AFEM1_ASEM1_CLR0_CADS0_DTLA0_DTLB0_DTVA0_DTVB0_DTVMXSA0_DTVMXSB0_DTVSM0_DPLB0_EPS0_ELFLR0_EMLLn1_FDSI0_GRPM1_GRVWA1_GRVWB1_GSU1_GSUAMB_GSUC0_GSUWGMRR0_GLS0_ISA1151_IU1_K1_LDSTI0_LBSPPA0_LBSPPB0_LBSPPM0_LPA1_LPB1_LPM0_LRVW1_LWPMn1_MIAV0_MO40_MGRIPM1_NTn1_NTA0_NTB0_NTC0_NTD0_NTM0_NEPBS0_NLCA1_NLCB1_ONLL1_PGR0_PLR1_PKA0_SGROB0_SIA1_SS0_SU32_SUM0_SUS512_SPO0_SRVW0_SSO0_SVW1_SK0_SKFTR0_SKXCCM0_SGRO0_TDMI0_TIN0_TT1_1_TLDS0_TLDSMn1_ULSGRO0_USL1_UIOFGRO0_UPLRP0_USFGROn1_VSn1_VWA1_VWB1_WSGRA0_WSGRB0_WS32_WG16_8_1_WGM1_WGMXCC1_WGMXCCGn1
    SolutionIndex: 50
    SolutionNameMin: Cijk_Alik_Bljk_S_B_Bias_HA_S_SAV_UserArgs_MT16x8x16_SN_LDSB0_AFC1_AG0_AFEM1_AFEM1_ASEM1_CLR0_CADS0_DTLA0_DTLB0_DTVA0_DTVB0_DTVMXSA0_DTVMXSB0_DTVSM0_DPLB0_EPS0_ELFLR0_EMLLn1_FDSI0_GRPM1_GRVWA1_GRVWB1_GSU1_GSUAMB_GSUC0_GSUWGMRR0_GLS0_ISA1151_IU1_K1_LDSTI0_LBSPPA0_LBSPPB0_LBSPPM0_LPA1_LPB1_LPM0_LRVW1_LWPMn1_MIAV0_MO40_MGRIPM1_NTn1_NTA0_NTB0_NTC0_NTD0_NTM0_NEPBS0_NLCA1_NLCB1_ONLL1_PGR0_PLR1_PKA0_SGROB0_SIA1_SS0_SU16_SUM0_SUS256_SPO0_SRVW0_SSO0_SVW1_SK0_SKFTR0_SKXCCM0_SGRO0_TDMI0_TIN0_TT1_1_TLDS0_TLDSMn1_ULSGRO0_USL1_UIOFGRO0_UPLRP0_USFGROn1_VSn1_VWA1_VWB1_WSGRA0_WSGRB0_WS32_WG16_8_1_WGM1_WGMXCC1_WGMXCCGn1
    SolutionIndex: 51
    SolutionNameMin: Cijk_Alik_Bljk_S_B_Bias_HA_S_SAV_UserArgs_MT16x8x32_SN_LDSB0_AFC1_AG0_AFEM1_AFEM1_ASEM1_CLR0_CADS0_DTLA0_DTLB0_DTVA0_DTVB0_DTVMXSA0_DTVMXSB0_DTVSM0_DPLB0_EPS0_ELFLR0_EMLLn1_FDSI0_GRPM1_GRVWA1_GRVWB1_GSU1_GSUAMB_GSUC0_GSUWGMRR0_GLS0_ISA1151_IU1_K1_LDSTI0_LBSPPA0_LBSPPB0_LBSPPM0_LPA1_LPB1_LPM0_LRVW1_LWPMn1_MIAV0_MO40_MGRIPM1_NTn1_NTA0_NTB0_NTC0_NTD0_NTM0_NEPBS0_NLCA1_NLCB1_ONLL1_PGR0_PLR1_PKA0_SGROB0_SIA1_SS0_SU16_SUM0_SUS256_SPO0_SRVW0_SSO0_SVW1_SK0_SKFTR0_SKXCCM0_SGRO0_TDMI0_TIN0_TT2_1_TLDS0_TLDSMn1_ULSGRO0_USL1_UIOFGRO0_UPLRP0_USFGROn1_VSn1_VWA1_VWB1_WSGRA0_WSGRB0_WS32_WG8_8_1_WGM1_WGMXCC1_WGMXCCGn1
    SolutionIndex: 52
    SolutionNameMin: Cijk_Alik_Bljk_S_B_Bias_HA_S_SAV_UserArgs_MT16x8x256_SN_LDSB0_AFC1_AG0_AFEM1_AFEM1_ASEM1_CLR0_CADS0_DTLA0_DTLB0_DTVA0_DTVB0_DTVMXSA0_DTVMXSB0_DTVSM0_DPLB0_EPS0_ELFLR0_EMLLn1_FDSI0_GRPM1_GRVWA1_GRVWB1_GSU1_GSUAMB_GSUC0_GSUWGMRR0_GLS0_ISA1151_IU1_K1_LDSTI0_LBSPPA0_LBSPPB0_LBSPPM0_LPA1_LPB1_LPM0_LRVW1_LWPMn1_MIAV0_MO40_MGRIPM1_NTn1_NTA0_NTB0_NTC0_NTD0_NTM0_NEPBS0_NLCA2_NLCB2_ONLL1_PGR0_PLR1_PKA0_SGROB0_SIA1_SS0_SU32_SUM0_SUS1024_SPO0_SRVW0_SSO0_SVW1_SK0_SKFTR0_SKXCCM0_SGRO0_TDMI0_TIN0_TT1_1_TLDS0_TLDSMn1_ULSGRO0_USL1_UIOFGRO0_UPLRP0_USFGROn1_VSn1_VWA1_VWB1_WSGRA0_WSGRB0_WS32_WG16_8_1_WGM1_WGMXCC1_WGMXCCGn1
    SolutionIndex: 53
    SolutionNameMin: Cijk_Alik_Bljk_S_B_Bias_HA_S_SAV_UserArgs_MT16x8x32_SN_LDSB0_AFC1_AG0_AFEM1_AFEM1_ASEM1_CLR0_CADS0_DTLA0_DTLB0_DTVA0_DTVB0_DTVMXSA0_DTVMXSB0_DTVSM0_DPLB0_EPS0_ELFLR0_EMLLn1_FDSI0_GRPM1_GRVWA1_GRVWB1_GSU1_GSUAMB_GSUC0_GSUWGMRR0_GLS0_ISA1151_IU1_K1_LDSTI0_LBSPPA0_LBSPPB0_LBSPPM0_LPA1_LPB1_LPM0_LRVW1_LWPMn1_MIAV0_MO40_MGRIPM1_NTn1_NTA0_NTB0_NTC0_NTD0_NTM0_NEPBS0_NLCA1_NLCB1_ONLL1_PGR0_PLR1_PKA0_SGROB0_SIA1_SS0_SU16_SUM0_SUS256_SPO0_SRVW0_SSO0_SVW1_SK0_SKFTR0_SKXCCM0_SGRO0_TDMI0_TIN0_TT1_1_TLDS0_TLDSMn1_ULSGRO0_USL1_UIOFGRO0_UPLRP0_USFGROn1_VSn1_VWA1_VWB1_WSGRA0_WSGRB0_WS32_WG16_8_1_WGM1_WGMXCC1_WGMXCCGn1
    SolutionIndex: 54
    SolutionNameMin: Cijk_Alik_Bljk_S_B_Bias_HA_S_SAV_UserArgs_MT16x8x256_SN_LDSB0_AFC1_AG0_AFEM1_AFEM1_ASEM1_CLR0_CADS0_DTLA0_DTLB0_DTVA0_DTVB0_DTVMXSA0_DTVMXSB0_DTVSM0_DPLB0_EPS0_ELFLR0_EMLLn1_FDSI0_GRPM1_GRVWA1_GRVWB1_GSU1_GSUAMB_GSUC0_GSUWGMRR0_GLS0_ISA1151_IU1_K1_LDSTI0_LBSPPA0_LBSPPB0_LBSPPM0_LPA1_LPB1_LPM0_LRVW1_LWPMn1_MIAV0_MO40_MGRIPM1_NTn1_NTA0_NTB0_NTC0_NTD0_NTM0_NEPBS0_NLCA2_NLCB2_ONLL1_PGR0_PLR1_PKA0_SGROB0_SIA1_SS0_SU16_SUM0_SUS1024_SPO0_SRVW0_SSO0_SVW1_SK0_SKFTR0_SKXCCM0_SGRO0_TDMI0_TIN0_TT1_1_TLDS0_TLDSMn1_ULSGRO0_USL1_UIOFGRO0_UPLRP0_USFGROn1_VSn1_VWA1_VWB1_WSGRA0_WSGRB0_WS32_WG16_8_1_WGM1_WGMXCC1_WGMXCCGn1
    SolutionIndex: 55
    SolutionNameMin: Cijk_Alik_Bljk_S_B_Bias_HA_S_SAV_UserArgs_MT8x8x128_SN_LDSB0_AFC1_AG0_AFEM1_AFEM1_ASEM1_CLR0_CADS0_DTLA0_DTLB0_DTVA0_DTVB0_DTVMXSA0_DTVMXSB0_DTVSM0_DPLB0_EPS0_ELFLR0_EMLLn1_FDSI0_GRPM1_GRVWA1_GRVWB1_GSU1_GSUAMB_GSUC0_GSUWGMRR0_GLS0_ISA1151_IU1_K1_LDSTI0_LBSPPA0_LBSPPB0_LBSPPM0_LPA1_LPB1_LPM0_LRVW1_LWPMn1_MIAV0_MO40_MGRIPM1_NTn1_NTA0_NTB0_NTC0_NTD0_NTM0_NEPBS0_NLCA2_NLCB2_ONLL1_PGR0_PLR1_PKA0_SGROB0_SIA1_SS0_SU32_SUM0_SUS512_SPO0_SRVW0_SSO0_SVW1_SK0_SKFTR0_SKXCCM0_SGRO0_TDMI0_TIN0_TT1_1_TLDS0_TLDSMn1_ULSGRO0_USL1_UIOFGRO0_UPLRP0_USFGROn1_VSn1_VWA1_VWB1_WSGRA0_WSGRB0_WS32_WG8_8_1_WGM1_WGMXCC1_WGMXCCGn1
    SolutionIndex: 56
    SolutionNameMin: Cijk_Alik_Bljk_S_B_Bias_HA_S_SAV_UserArgs_MT8x8x256_SN_LDSB0_AFC1_AG0_AFEM1_AFEM1_ASEM1_CLR0_CADS0_DTLA0_DTLB0_DTVA0_DTVB0_DTVMXSA0_DTVMXSB0_DTVSM0_DPLB0_EPS0_ELFLR0_EMLLn1_FDSI0_GRPM1_GRVWA1_GRVWB1_GSU1_GSUAMB_GSUC0_GSUWGMRR0_GLS0_ISA1151_IU1_K1_LDSTI0_LBSPPA0_LBSPPB0_LBSPPM0_LPA1_LPB1_LPM0_LRVW1_LWPMn1_MIAV0_MO40_MGRIPM1_NTn1_NTA0_NTB0_NTC0_NTD0_NTM0_NEPBS0_NLCA4_NLCB4_ONLL1_PGR0_PLR1_PKA0_SGROB0_SIA1_SS0_SU16_SUM0_SUS1024_SPO0_SRVW0_SSO0_SVW1_SK0_SKFTR0_SKXCCM0_SGRO0_TDMI0_TIN0_TT1_1_TLDS0_TLDSMn1_ULSGRO0_USL1_UIOFGRO0_UPLRP0_USFGROn1_VSn1_VWA1_VWB1_WSGRA0_WSGRB0_WS32_WG8_8_1_WGM1_WGMXCC1_WGMXCCGn1
    SolutionIndex: 57
    SolutionNameMin: Cijk_Alik_Bljk_S_B_Bias_HA_S_SAV_UserArgs_MT8x16x256_SN_LDSB0_AFC1_AG0_AFEM1_AFEM1_ASEM1_CLR0_CADS0_DTLA0_DTLB0_DTVA0_DTVB0_DTVMXSA0_DTVMXSB0_DTVSM0_DPLB0_EPS0_ELFLR0_EMLLn1_FDSI0_GRPM1_GRVWA1_GRVWB1_GSU1_GSUAMB_GSUC0_GSUWGMRR0_GLS0_ISA1151_IU1_K1_LDSTI0_LBSPPA0_LBSPPB0_LBSPPM0_LPA1_LPB1_LPM0_LRVW1_LWPMn1_MIAV0_MO40_MGRIPM1_NTn1_NTA0_NTB0_NTC0_NTD0_NTM0_NEPBS0_NLCA2_NLCB2_ONLL1_PGR0_PLR1_PKA0_SGROB0_SIA1_SS0_SU0_SUM0_SUS0_SPO0_SRVW0_SSO0_SVW1_SK0_SKFTR0_SKXCCM0_SGRO0_TDMI0_TIN0_TT1_1_TLDS0_TLDSMn1_ULSGRO0_USL1_UIOFGRO0_UPLRP0_USFGROn1_VSn1_VWA1_VWB1_WSGRA0_WSGRB0_WS32_WG8_16_1_WGM3_WGMXCC1_WGMXCCGn1
    SolutionIndex: 58
    SolutionNameMin: Cijk_Alik_Bljk_S_B_Bias_HA_S_SAV_UserArgs_MT8x32x64_SN_LDSB0_AFC1_AG0_AFEM1_AFEM1_ASEM1_CLR0_CADS0_DTLA0_DTLB0_DTVA0_DTVB0_DTVMXSA0_DTVMXSB0_DTVSM0_DPLB0_EPS0_ELFLR0_EMLLn1_FDSI0_GRPM1_GRVWA1_GRVWB1_GSU1_GSUAMB_GSUC0_GSUWGMRR0_GLS0_ISA1151_IU1_K1_LDSTI0_LBSPPA0_LBSPPB0_LBSPPM0_LPA1_LPB1_LPM0_LRVW1_LWPMn1_MIAV0_MO40_MGRIPM1_NTn1_NTA0_NTB0_NTC0_NTD0_NTM0_NEPBS0_NLCA1_NLCB1_ONLL1_PGR0_PLR1_PKA0_SGROB0_SIA1_SS0_SU16_SUM0_SUS256_SPO0_SRVW0_SSO0_SVW1_SK0_SKFTR0_SKXCCM0_SGRO0_TDMI0_TIN0_TT1_2_TLDS0_TLDSMn1_ULSGRO0_USL1_UIOFGRO0_UPLRP0_USFGROn1_VSn1_VWA1_VWB1_WSGRA0_WSGRB0_WS32_WG8_16_1_WGM3_WGMXCC1_WGMXCCGn1
    SolutionIndex: 59
    SolutionNameMin: Cijk_Alik_Bljk_S_B_Bias_HA_S_SAV_UserArgs_MT8x16x128_SN_LDSB0_AFC1_AG0_AFEM1_AFEM1_ASEM1_CLR0_CADS0_DTLA0_DTLB0_DTVA0_DTVB0_DTVMXSA0_DTVMXSB0_DTVSM0_DPLB0_EPS0_ELFLR0_EMLLn1_FDSI0_GRPM1_GRVWA1_GRVWB1_GSU1_GSUAMB_GSUC0_GSUWGMRR0_GLS0_ISA1151_IU1_K1_LDSTI0_LBSPPA0_LBSPPB0_LBSPPM0_LPA1_LPB1_LPM0_LRVW1_LWPMn1_MIAV0_MO40_MGRIPM1_NTn1_NTA0_NTB0_NTC0_NTD0_NTM0_NEPBS0_NLCA2_NLCB2_ONLL1_PGR0_PLR1_PKA0_SGROB0_SIA1_SS0_SU16_SUM0_SUS512_SPO0_SRVW0_SSO0_SVW1_SK0_SKFTR0_SKXCCM0_SGRO0_TDMI0_TIN0_TT1_2_TLDS0_TLDSMn1_ULSGRO0_USL1_UIOFGRO0_UPLRP0_USFGROn1_VSn1_VWA1_VWB1_WSGRA0_WSGRB0_WS32_WG8_8_1_WGM3_WGMXCC1_WGMXCCGn1
    SolutionIndex: 60
    SolutionNameMin: Cijk_Alik_Bljk_S_B_Bias_HA_S_SAV_UserArgs_MT8x32x128_SN_LDSB0_AFC1_AG0_AFEM1_AFEM1_ASEM1_CLR0_CADS0_DTLA0_DTLB0_DTVA0_DTVB0_DTVMXSA0_DTVMXSB0_DTVSM0_DPLB0_EPS0_ELFLR0_EMLLn1_FDSI0_GRPM1_GRVWA1_GRVWB1_GSU1_GSUAMB_GSUC0_GSUWGMRR0_GLS0_ISA1151_IU1_K1_LDSTI0_LBSPPA0_LBSPPB0_LBSPPM0_LPA1_LPB1_LPM0_LRVW1_LWPMn1_MIAV0_MO40_MGRIPM1_NTn1_NTA0_NTB0_NTC0_NTD0_NTM0_NEPBS0_NLCA1_NLCB1_ONLL1_PGR0_PLR1_PKA0_SGROB0_SIA1_SS0_SU16_SUM0_SUS512_SPO0_SRVW0_SSO0_SVW1_SK0_SKFTR0_SKXCCM0_SGRO0_TDMI0_TIN0_TT1_2_TLDS0_TLDSMn1_ULSGRO0_USL1_UIOFGRO0_UPLRP0_USFGROn1_VSn1_VWA1_VWB1_WSGRA0_WSGRB0_WS32_WG8_16_1_WGM1_WGMXCC1_WGMXCCGn1
    SolutionIndex: 61
    SolutionNameMin: Cijk_Alik_Bljk_S_B_Bias_HA_S_SAV_UserArgs_MT8x16x64_SN_LDSB0_AFC1_AG0_AFEM1_AFEM1_ASEM1_CLR0_CADS0_DTLA0_DTLB0_DTVA0_DTVB0_DTVMXSA0_DTVMXSB0_DTVSM0_DPLB0_EPS0_ELFLR0_EMLLn1_FDSI0_GRPM1_GRVWA1_GRVWB1_GSU1_GSUAMB_GSUC0_GSUWGMRR0_GLS0_ISA1151_IU1_K1_LDSTI0_LBSPPA0_LBSPPB0_LBSPPM0_LPA1_LPB1_LPM0_LRVW1_LWPMn1_MIAV0_MO40_MGRIPM1_NTn1_NTA0_NTB0_NTC0_NTD0_NTM0_NEPBS0_NLCA1_NLCB1_ONLL1_PGR0_PLR1_PKA0_SGROB0_SIA1_SS0_SU0_SUM0_SUS0_SPO0_SRVW0_SSO0_SVW1_SK0_SKFTR0_SKXCCM0_SGRO0_TDMI0_TIN0_TT1_1_TLDS0_TLDSMn1_ULSGRO0_USL1_UIOFGRO0_UPLRP0_USFGROn1_VSn1_VWA1_VWB1_WSGRA0_WSGRB0_WS32_WG8_16_1_WGM3_WGMXCC1_WGMXCCGn1
    SolutionIndex: 62
    SolutionNameMin: Cijk_Alik_Bljk_S_B_Bias_HA_S_SAV_UserArgs_MT16x16x64_SN_LDSB0_AFC1_AG0_AFEM1_AFEM1_ASEM1_CLR0_CADS0_DTLA0_DTLB0_DTVA0_DTVB0_DTVMXSA0_DTVMXSB0_DTVSM0_DPLB0_EPS0_ELFLR0_EMLLn1_FDSI0_GRPM1_GRVWA1_GRVWB1_GSU1_GSUAMB_GSUC0_GSUWGMRR0_GLS0_ISA1151_IU1_K1_LDSTI0_LBSPPA0_LBSPPB0_LBSPPM0_LPA1_LPB1_LPM0_LRVW1_LWPMn1_MIAV0_MO40_MGRIPM1_NTn1_NTA0_NTB0_NTC0_NTD0_NTM0_NEPBS0_NLCA1_NLCB1_ONLL1_PGR0_PLR1_PKA0_SGROB0_SIA1_SS0_SU16_SUM0_SUS256_SPO0_SRVW0_SSO0_SVW1_SK0_SKFTR0_SKXCCM0_SGRO0_TDMI0_TIN0_TT2_1_TLDS0_TLDSMn1_ULSGRO0_USL1_UIOFGRO0_UPLRP0_USFGROn1_VSn1_VWA1_VWB1_WSGRA0_WSGRB0_WS32_WG8_16_1_WGM3_WGMXCC1_WGMXCCGn1
    SolutionIndex: 63
    SolutionNameMin: Cijk_Alik_Bljk_S_B_Bias_HA_S_SAV_UserArgs_MT8x16x256_SN_LDSB0_AFC1_AG0_AFEM1_AFEM1_ASEM1_CLR0_CADS0_DTLA0_DTLB0_DTVA0_DTVB0_DTVMXSA0_DTVMXSB0_DTVSM0_DPLB0_EPS0_ELFLR0_EMLLn1_FDSI0_GRPM1_GRVWA1_GRVWB1_GSU1_GSUAMB_GSUC0_GSUWGMRR0_GLS0_ISA1151_IU1_K1_LDSTI0_LBSPPA0_LBSPPB0_LBSPPM0_LPA1_LPB1_LPM0_LRVW1_LWPMn1_MIAV0_MO40_MGRIPM1_NTn1_NTA0_NTB0_NTC0_NTD0_NTM0_NEPBS0_NLCA2_NLCB2_ONLL1_PGR0_PLR1_PKA0_SGROB0_SIA1_SS0_SU16_SUM0_SUS1024_SPO0_SRVW0_SSO0_SVW1_SK0_SKFTR0_SKXCCM0_SGRO0_TDMI0_TIN0_TT1_1_TLDS0_TLDSMn1_ULSGRO0_USL1_UIOFGRO0_UPLRP0_USFGROn1_VSn1_VWA1_VWB1_WSGRA0_WSGRB0_WS32_WG8_16_1_WGM1_WGMXCC1_WGMXCCGn1
    SolutionIndex: 64
    SolutionNameMin: Cijk_Alik_Bljk_S_B_Bias_HA_S_SAV_UserArgs_MT8x8x256_SN_LDSB0_AFC1_AG0_AFEM1_AFEM1_ASEM1_CLR0_CADS0_DTLA0_DTLB0_DTVA0_DTVB0_DTVMXSA0_DTVMXSB0_DTVSM0_DPLB0_EPS0_ELFLR0_EMLLn1_FDSI0_GRPM1_GRVWA1_GRVWB1_GSU1_GSUAMB_GSUC0_GSUWGMRR0_GLS0_ISA1151_IU1_K1_LDSTI0_LBSPPA0_LBSPPB0_LBSPPM0_LPA1_LPB1_LPM0_LRVW1_LWPMn1_MIAV0_MO40_MGRIPM1_NTn1_NTA0_NTB0_NTC0_NTD0_NTM0_NEPBS0_NLCA4_NLCB4_ONLL1_PGR0_PLR1_PKA0_SGROB0_SIA1_SS0_SU0_SUM0_SUS0_SPO0_SRVW0_SSO0_SVW1_SK0_SKFTR0_SKXCCM0_SGRO0_TDMI0_TIN0_TT1_1_TLDS0_TLDSMn1_ULSGRO0_USL1_UIOFGRO0_UPLRP0_USFGROn1_VSn1_VWA1_VWB1_WSGRA0_WSGRB0_WS32_WG8_8_1_WGM3_WGMXCC1_WGMXCCGn1
    SolutionIndex: 65
    SolutionNameMin: Cijk_Alik_Bljk_S_B_Bias_HA_S_SAV_UserArgs_MT96x64x32_SN_LDSB0_AFC1_AG0_AFEM1_AFEM1_ASEM1_CLR0_CADS0_DTLA0_DTLB0_DTVA0_DTVB0_DTVMXSA0_DTVMXSB0_DTVSM0_DPLB0_EPS0_ELFLR0_EMLLn1_FDSI0_GRPM1_GRVWA1_GRVWB1_GSU1_GSUAMB_GSUC0_GSUWGMRR0_GLS0_ISA1151_IU1_K1_LDSTI0_LBSPPA0_LBSPPB0_LBSPPM0_LPA1_LPB1_LPM0_LRVW1_LWPMn1_MIAV0_MO40_MGRIPM1_NTn1_NTA0_NTB0_NTC0_NTD0_NTM0_NEPBS0_NLCA1_NLCB1_ONLL1_PGR0_PLR1_PKA0_SGROB0_SIA1_SS0_SU0_SUM0_SUS0_SPO0_SRVW0_SSO0_SVW1_SK0_SKFTR0_SKXCCM0_SGRO0_TDMI0_TIN0_TT6_8_TLDS0_TLDSMn1_ULSGRO0_USL1_UIOFGRO0_UPLRP0_USFGROn1_VSn1_VWA1_VWB1_WSGRA0_WSGRB0_WS32_WG16_8_1_WGM1_WGMXCC1_WGMXCCGn1
    SolutionIndex: 66
    SolutionNameMin: Cijk_Alik_Bljk_S_B_Bias_HA_S_SAV_UserArgs_MT96x64x32_SN_LDSB0_AFC1_AG0_AFEM1_AFEM1_ASEM1_CLR0_CADS0_DTLA0_DTLB0_DTVA0_DTVB0_DTVMXSA0_DTVMXSB0_DTVSM0_DPLB0_EPS0_ELFLR0_EMLLn1_FDSI0_GRPM1_GRVWA1_GRVWB1_GSU1_GSUAMB_GSUC0_GSUWGMRR0_GLS0_ISA1151_IU1_K1_LDSTI0_LBSPPA0_LBSPPB0_LBSPPM0_LPA1_LPB1_LPM0_LRVW1_LWPMn1_MIAV0_MO40_MGRIPM1_NTn1_NTA0_NTB0_NTC0_NTD0_NTM0_NEPBS0_NLCA1_NLCB1_ONLL1_PGR0_PLR1_PKA0_SGROB0_SIA1_SS0_SU0_SUM0_SUS0_SPO0_SRVW0_SSO0_SVW1_SK0_SKFTR0_SKXCCM0_SGRO0_TDMI0_TIN0_TT6_8_TLDS0_TLDSMn1_ULSGRO0_USL1_UIOFGRO0_UPLRP0_USFGROn1_VSn1_VWA1_VWB1_WSGRA0_WSGRB0_WS32_WG16_8_1_WGM8_WGMXCC1_WGMXCCGn1
    SolutionIndex: 67
    SolutionNameMin: Cijk_Alik_Bljk_S_B_Bias_HA_S_SAV_UserArgs_MT96x64x32_SN_LDSB0_AFC1_AG0_AFEM1_AFEM1_ASEM1_CLR0_CADS0_DTLA0_DTLB0_DTVA0_DTVB0_DTVMXSA0_DTVMXSB0_DTVSM0_DPLB0_EPS0_ELFLR0_EMLLn1_FDSI0_GRPM1_GRVWA1_GRVWB1_GSU1_GSUAMB_GSUC0_GSUWGMRR0_GLS0_ISA1151_IU1_K1_LDSTI0_LBSPPA0_LBSPPB0_LBSPPM0_LPA1_LPB1_LPM0_LRVW1_LWPMn1_MIAV0_MO40_MGRIPM1_NTn1_NTA0_NTB0_NTC0_NTD0_NTM0_NEPBS0_NLCA1_NLCB1_ONLL1_PGR0_PLR1_PKA0_SGROB0_SIA1_SS0_SU4_SUM0_SUS256_SPO0_SRVW0_SSO0_SVW1_SK0_SKFTR0_SKXCCM0_SGRO0_TDMI0_TIN0_TT6_8_TLDS0_TLDSMn1_ULSGRO0_USL1_UIOFGRO0_UPLRP0_USFGROn1_VSn1_VWA1_VWB1_WSGRA0_WSGRB0_WS32_WG16_8_1_WGM8_WGMXCC1_WGMXCCGn1
    SolutionIndex: 68
    SolutionNameMin: Cijk_Alik_Bljk_S_B_Bias_HA_S_SAV_UserArgs_MT96x64x32_SN_LDSB0_AFC1_AG0_AFEM1_AFEM1_ASEM1_CLR0_CADS0_DTLA0_DTLB0_DTVA0_DTVB0_DTVMXSA0_DTVMXSB0_DTVSM0_DPLB0_EPS0_ELFLR0_EMLLn1_FDSI0_GRPM1_GRVWA1_GRVWB1_GSU1_GSUAMB_GSUC0_GSUWGMRR0_GLS0_ISA1151_IU1_K1_LDSTI0_LBSPPA0_LBSPPB0_LBSPPM0_LPA1_LPB1_LPM0_LRVW1_LWPMn1_MIAV0_MO40_MGRIPM1_NTn1_NTA0_NTB0_NTC0_NTD0_NTM0_NEPBS0_NLCA1_NLCB1_ONLL1_PGR0_PLR1_PKA0_SGROB0_SIA1_SS0_SU8_SUM0_SUS256_SPO0_SRVW0_SSO0_SVW1_SK0_SKFTR0_SKXCCM0_SGRO0_TDMI0_TIN0_TT6_8_TLDS0_TLDSMn1_ULSGRO0_USL1_UIOFGRO0_UPLRP0_USFGROn1_VSn1_VWA1_VWB1_WSGRA0_WSGRB0_WS32_WG16_8_1_WGM1_WGMXCC1_WGMXCCGn1
    SolutionIndex: 69
    SolutionNameMin: Cijk_Alik_Bljk_S_B_Bias_HA_S_SAV_UserArgs_MT96x64x32_SN_LDSB0_AFC1_AG0_AFEM1_AFEM1_ASEM1_CLR0_CADS0_DTLA0_DTLB0_DTVA0_DTVB0_DTVMXSA0_DTVMXSB0_DTVSM0_DPLB0_EPS0_ELFLR0_EMLLn1_FDSI0_GRPM1_GRVWA1_GRVWB1_GSU1_GSUAMB_GSUC0_GSUWGMRR0_GLS0_ISA1151_IU1_K1_LDSTI0_LBSPPA0_LBSPPB0_LBSPPM0_LPA1_LPB1_LPM0_LRVW1_LWPMn1_MIAV0_MO40_MGRIPM1_NTn1_NTA0_NTB0_NTC0_NTD0_NTM0_NEPBS0_NLCA1_NLCB1_ONLL1_PGR0_PLR1_PKA0_SGROB0_SIA1_SS0_SU8_SUM0_SUS256_SPO0_SRVW0_SSO0_SVW1_SK0_SKFTR0_SKXCCM0_SGRO0_TDMI0_TIN0_TT6_8_TLDS0_TLDSMn1_ULSGRO0_USL1_UIOFGRO0_UPLRP0_USFGROn1_VSn1_VWA1_VWB1_WSGRA0_WSGRB0_WS32_WG16_8_1_WGM8_WGMXCC1_WGMXCCGn1
    SolutionIndex: 70
    SolutionNameMin: Cijk_Alik_Bljk_S_B_Bias_HA_S_SAV_UserArgs_MT96x64x32_SN_LDSB0_AFC1_AG0_AFEM1_AFEM1_ASEM1_CLR0_CADS0_DTLA0_DTLB0_DTVA0_DTVB0_DTVMXSA0_DTVMXSB0_DTVSM0_DPLB0_EPS0_ELFLR0_EMLLn1_FDSI0_GRPM1_GRVWA1_GRVWB1_GSU1_GSUAMB_GSUC0_GSUWGMRR0_GLS0_ISA1151_IU1_K1_LDSTI0_LBSPPA0_LBSPPB0_LBSPPM0_LPA1_LPB1_LPM0_LRVW1_LWPMn1_MIAV0_MO40_MGRIPM1_NTn1_NTA0_NTB0_NTC0_NTD0_NTM0_NEPBS0_NLCA1_NLCB1_ONLL1_PGR0_PLR1_PKA0_SGROB0_SIA1_SS0_SU16_SUM0_SUS256_SPO0_SRVW0_SSO0_SVW1_SK0_SKFTR0_SKXCCM0_SGRO0_TDMI0_TIN0_TT6_8_TLDS0_TLDSMn1_ULSGRO0_USL1_UIOFGRO0_UPLRP0_USFGROn1_VSn1_VWA1_VWB1_WSGRA0_WSGRB0_WS32_WG16_8_1_WGM8_WGMXCC1_WGMXCCGn1
    SolutionIndex: 71
    SolutionNameMin: Cijk_Alik_Bljk_S_B_Bias_HA_S_SAV_UserArgs_MT112x64x32_SN_LDSB0_AFC1_AG0_AFEM1_AFEM1_ASEM1_CLR0_CADS0_DTLA0_DTLB0_DTVA0_DTVB0_DTVMXSA0_DTVMXSB0_DTVSM0_DPLB0_EPS0_ELFLR0_EMLLn1_FDSI0_GRPM1_GRVWA1_GRVWB1_GSU1_GSUAMB_GSUC0_GSUWGMRR0_GLS0_ISA1151_IU1_K1_LDSTI0_LBSPPA0_LBSPPB0_LBSPPM0_LPA1_LPB1_LPM0_LRVW1_LWPMn1_MIAV0_MO40_MGRIPM1_NTn1_NTA0_NTB0_NTC0_NTD0_NTM0_NEPBS0_NLCA1_NLCB1_ONLL1_PGR0_PLR1_PKA0_SGROB0_SIA1_SS0_SU0_SUM0_SUS0_SPO0_SRVW0_SSO0_SVW1_SK0_SKFTR0_SKXCCM0_SGRO0_TDMI0_TIN0_TT7_8_TLDS0_TLDSMn1_ULSGRO0_USL1_UIOFGRO0_UPLRP0_USFGROn1_VSn1_VWA1_VWB1_WSGRA0_WSGRB0_WS32_WG16_8_1_WGM1_WGMXCC1_WGMXCCGn1
    SolutionIndex: 72
    SolutionNameMin: Cijk_Alik_Bljk_S_B_Bias_HA_S_SAV_UserArgs_MT112x64x32_SN_LDSB0_AFC1_AG0_AFEM1_AFEM1_ASEM1_CLR0_CADS0_DTLA0_DTLB0_DTVA0_DTVB0_DTVMXSA0_DTVMXSB0_DTVSM0_DPLB0_EPS0_ELFLR0_EMLLn1_FDSI0_GRPM1_GRVWA1_GRVWB1_GSU1_GSUAMB_GSUC0_GSUWGMRR0_GLS0_ISA1151_IU1_K1_LDSTI0_LBSPPA0_LBSPPB0_LBSPPM0_LPA1_LPB1_LPM0_LRVW1_LWPMn1_MIAV0_MO40_MGRIPM1_NTn1_NTA0_NTB0_NTC0_NTD0_NTM0_NEPBS0_NLCA1_NLCB1_ONLL1_PGR0_PLR1_PKA0_SGROB0_SIA1_SS0_SU4_SUM0_SUS256_SPO0_SRVW0_SSO0_SVW1_SK0_SKFTR0_SKXCCM0_SGRO0_TDMI0_TIN0_TT7_8_TLDS0_TLDSMn1_ULSGRO0_USL1_UIOFGRO0_UPLRP0_USFGROn1_VSn1_VWA1_VWB1_WSGRA0_WSGRB0_WS32_WG16_8_1_WGM8_WGMXCC1_WGMXCCGn1
    SolutionIndex: 73
    SolutionNameMin: Cijk_Alik_Bljk_S_B_Bias_HA_S_SAV_UserArgs_MT112x64x32_SN_LDSB0_AFC1_AG0_AFEM1_AFEM1_ASEM1_CLR0_CADS0_DTLA0_DTLB0_DTVA0_DTVB0_DTVMXSA0_DTVMXSB0_DTVSM0_DPLB0_EPS0_ELFLR0_EMLLn1_FDSI0_GRPM1_GRVWA1_GRVWB1_GSU1_GSUAMB_GSUC0_GSUWGMRR0_GLS0_ISA1151_IU1_K1_LDSTI0_LBSPPA0_LBSPPB0_LBSPPM0_LPA1_LPB1_LPM0_LRVW1_LWPMn1_MIAV0_MO40_MGRIPM1_NTn1_NTA0_NTB0_NTC0_NTD0_NTM0_NEPBS0_NLCA1_NLCB1_ONLL1_PGR0_PLR1_PKA0_SGROB0_SIA1_SS0_SU8_SUM0_SUS256_SPO0_SRVW0_SSO0_SVW1_SK0_SKFTR0_SKXCCM0_SGRO0_TDMI0_TIN0_TT7_8_TLDS0_TLDSMn1_ULSGRO0_USL1_UIOFGRO0_UPLRP0_USFGROn1_VSn1_VWA1_VWB1_WSGRA0_WSGRB0_WS32_WG16_8_1_WGM1_WGMXCC1_WGMXCCGn1
    SolutionIndex: 74
    SolutionNameMin: Cijk_Alik_Bljk_S_B_Bias_HA_S_SAV_UserArgs_MT96x64x16_SN_LDSB0_AFC1_AG0_AFEM1_AFEM1_ASEM1_CLR0_CADS0_DTLA0_DTLB0_DTVA0_DTVB0_DTVMXSA0_DTVMXSB0_DTVSM0_DPLB0_EPS0_ELFLR0_EMLLn1_FDSI0_GRPM1_GRVWA1_GRVWB1_GSU1_GSUAMB_GSUC0_GSUWGMRR0_GLS0_ISA1151_IU1_K1_LDSTI0_LBSPPA0_LBSPPB0_LBSPPM0_LPA1_LPB1_LPM0_LRVW1_LWPMn1_MIAV0_MO40_MGRIPM1_NTn1_NTA0_NTB0_NTC0_NTD0_NTM0_NEPBS0_NLCA1_NLCB1_ONLL1_PGR0_PLR1_PKA0_SGROB0_SIA1_SS0_SU0_SUM0_SUS0_SPO0_SRVW0_SSO0_SVW1_SK0_SKFTR0_SKXCCM0_SGRO0_TDMI0_TIN0_TT6_8_TLDS0_TLDSMn1_ULSGRO0_USL1_UIOFGRO0_UPLRP0_USFGROn1_VSn1_VWA1_VWB1_WSGRA0_WSGRB0_WS32_WG16_8_1_WGM1_WGMXCC1_WGMXCCGn1
    SolutionIndex: 75
    SolutionNameMin: Cijk_Alik_Bljk_S_B_Bias_HA_S_SAV_UserArgs_MT96x64x16_SN_LDSB0_AFC1_AG0_AFEM1_AFEM1_ASEM1_CLR0_CADS0_DTLA0_DTLB0_DTVA0_DTVB0_DTVMXSA0_DTVMXSB0_DTVSM0_DPLB0_EPS0_ELFLR0_EMLLn1_FDSI0_GRPM1_GRVWA1_GRVWB1_GSU1_GSUAMB_GSUC0_GSUWGMRR0_GLS0_ISA1151_IU1_K1_LDSTI0_LBSPPA0_LBSPPB0_LBSPPM0_LPA1_LPB1_LPM0_LRVW1_LWPMn1_MIAV0_MO40_MGRIPM1_NTn1_NTA0_NTB0_NTC0_NTD0_NTM0_NEPBS0_NLCA1_NLCB1_ONLL1_PGR0_PLR1_PKA0_SGROB0_SIA1_SS0_SU8_SUM0_SUS256_SPO0_SRVW0_SSO0_SVW1_SK0_SKFTR0_SKXCCM0_SGRO0_TDMI0_TIN0_TT6_8_TLDS0_TLDSMn1_ULSGRO0_USL1_UIOFGRO0_UPLRP0_USFGROn1_VSn1_VWA1_VWB1_WSGRA0_WSGRB0_WS32_WG16_8_1_WGM1_WGMXCC1_WGMXCCGn1
    SolutionIndex: 76
    SolutionNameMin: Cijk_Alik_Bljk_S_B_Bias_HA_S_SAV_UserArgs_MT112x64x8_SN_LDSB0_AFC1_AG0_AFEM1_AFEM1_ASEM1_CLR0_CADS0_DTLA0_DTLB0_DTVA0_DTVB0_DTVMXSA0_DTVMXSB0_DTVSM0_DPLB0_EPS0_ELFLR0_EMLLn1_FDSI0_GRPM1_GRVWA1_GRVWB1_GSU1_GSUAMB_GSUC0_GSUWGMRR0_GLS0_ISA1151_IU1_K1_LDSTI0_LBSPPA0_LBSPPB0_LBSPPM0_LPA1_LPB1_LPM0_LRVW1_LWPMn1_MIAV0_MO40_MGRIPM1_NTn1_NTA0_NTB0_NTC0_NTD0_NTM0_NEPBS0_NLCA1_NLCB1_ONLL1_PGR0_PLR1_PKA0_SGROB0_SIA1_SS0_SU8_SUM0_SUS256_SPO0_SRVW0_SSO0_SVW1_SK0_SKFTR0_SKXCCM0_SGRO0_TDMI0_TIN0_TT7_8_TLDS0_TLDSMn1_ULSGRO0_USL1_UIOFGRO0_UPLRP0_USFGROn1_VSn1_VWA1_VWB1_WSGRA0_WSGRB0_WS32_WG16_8_1_WGM1_WGMXCC1_WGMXCCGn1
    SolutionIndex: 77
    SolutionNameMin: Cijk_Alik_Bljk_S_B_Bias_HA_S_SAV_UserArgs_MT112x64x16_SN_LDSB0_AFC1_AG0_AFEM1_AFEM1_ASEM1_CLR0_CADS0_DTLA0_DTLB0_DTVA0_DTVB0_DTVMXSA0_DTVMXSB0_DTVSM0_DPLB0_EPS0_ELFLR0_EMLLn1_FDSI0_GRPM1_GRVWA1_GRVWB1_GSU1_GSUAMB_GSUC0_GSUWGMRR0_GLS0_ISA1151_IU1_K1_LDSTI0_LBSPPA0_LBSPPB0_LBSPPM0_LPA1_LPB1_LPM0_LRVW1_LWPMn1_MIAV0_MO40_MGRIPM1_NTn1_NTA0_NTB0_NTC0_NTD0_NTM0_NEPBS0_NLCA1_NLCB1_ONLL1_PGR0_PLR1_PKA0_SGROB0_SIA1_SS0_SU0_SUM0_SUS0_SPO0_SRVW0_SSO0_SVW1_SK0_SKFTR0_SKXCCM0_SGRO0_TDMI0_TIN0_TT7_8_TLDS0_TLDSMn1_ULSGRO0_USL1_UIOFGRO0_UPLRP0_USFGROn1_VSn1_VWA1_VWB1_WSGRA0_WSGRB0_WS32_WG16_8_1_WGM1_WGMXCC1_WGMXCCGn1
    SolutionIndex: 78
    SolutionNameMin: Cijk_Alik_Bljk_S_B_Bias_HA_S_SAV_UserArgs_MT32x64x32_SN_LDSB0_AFC1_AG0_AFEM1_AFEM1_ASEM1_CLR0_CADS0_DTLA0_DTLB0_DTVA0_DTVB0_DTVMXSA0_DTVMXSB0_DTVSM0_DPLB0_EPS0_ELFLR0_EMLLn1_FDSI0_GRPM1_GRVWA1_GRVWB1_GSU1_GSUAMB_GSUC0_GSUWGMRR0_GLS0_ISA1151_IU1_K1_LDSTI0_LBSPPA0_LBSPPB0_LBSPPM0_LPA1_LPB1_LPM0_LRVW1_LWPMn1_MIAV0_MO40_MGRIPM1_NTn1_NTA0_NTB0_NTC0_NTD0_NTM0_NEPBS0_NLCA1_NLCB1_ONLL1_PGR0_PLR1_PKA0_SGROB0_SIA1_SS0_SU8_SUM0_SUS256_SPO0_SRVW0_SSO0_SVW1_SK0_SKFTR0_SKXCCM0_SGRO0_TDMI0_TIN0_TT4_8_TLDS0_TLDSMn1_ULSGRO0_USL1_UIOFGRO0_UPLRP0_USFGROn1_VSn1_VWA1_VWB1_WSGRA0_WSGRB0_WS32_WG8_8_1_WGM1_WGMXCC1_WGMXCCGn1
    SolutionIndex: 79
    SolutionNameMin: Cijk_Alik_Bljk_S_B_Bias_HA_S_SAV_UserArgs_MT40x64x8_SN_LDSB0_AFC1_AG0_AFEM1_AFEM1_ASEM1_CLR0_CADS0_DTLA0_DTLB0_DTVA0_DTVB0_DTVMXSA0_DTVMXSB0_DTVSM0_DPLB0_EPS0_ELFLR0_EMLLn1_FDSI0_GRPM1_GRVWA1_GRVWB1_GSU1_GSUAMB_GSUC0_GSUWGMRR0_GLS0_ISA1151_IU1_K1_LDSTI0_LBSPPA0_LBSPPB0_LBSPPM0_LPA1_LPB1_LPM0_LRVW1_LWPMn1_MIAV0_MO40_MGRIPM1_NTn1_NTA0_NTB0_NTC0_NTD0_NTM0_NEPBS0_NLCA1_NLCB1_ONLL1_PGR0_PLR1_PKA0_SGROB0_SIA1_SS0_SU0_SUM0_SUS0_SPO0_SRVW0_SSO0_SVW1_SK0_SKFTR0_SKXCCM0_SGRO0_TDMI0_TIN0_TT5_8_TLDS0_TLDSMn1_ULSGRO0_USL1_UIOFGRO0_UPLRP0_USFGROn1_VSn1_VWA1_VWB1_WSGRA0_WSGRB0_WS32_WG8_8_1_WGM1_WGMXCC1_WGMXCCGn1
    SolutionIndex: 80
    SolutionNameMin: Cijk_Alik_Bljk_S_B_Bias_HA_S_SAV_UserArgs_MT32x64x32_SN_LDSB0_AFC1_AG0_AFEM1_AFEM1_ASEM1_CLR0_CADS0_DTLA0_DTLB0_DTVA0_DTVB0_DTVMXSA0_DTVMXSB0_DTVSM0_DPLB0_EPS0_ELFLR0_EMLLn1_FDSI0_GRPM1_GRVWA1_GRVWB1_GSU1_GSUAMB_GSUC0_GSUWGMRR0_GLS0_ISA1151_IU1_K1_LDSTI0_LBSPPA0_LBSPPB0_LBSPPM0_LPA1_LPB1_LPM0_LRVW1_LWPMn1_MIAV0_MO40_MGRIPM1_NTn1_NTA0_NTB0_NTC0_NTD0_NTM0_NEPBS0_NLCA1_NLCB1_ONLL1_PGR0_PLR1_PKA0_SGROB0_SIA1_SS0_SU0_SUM0_SUS0_SPO0_SRVW0_SSO0_SVW1_SK0_SKFTR0_SKXCCM0_SGRO0_TDMI0_TIN0_TT4_8_TLDS0_TLDSMn1_ULSGRO0_USL1_UIOFGRO0_UPLRP0_USFGROn1_VSn1_VWA1_VWB1_WSGRA0_WSGRB0_WS32_WG8_8_1_WGM1_WGMXCC1_WGMXCCGn1
    SolutionIndex: 81
    SolutionNameMin: Cijk_Alik_Bljk_S_B_Bias_HA_S_SAV_UserArgs_MT32x64x8_SN_LDSB0_AFC1_AG0_AFEM1_AFEM1_ASEM1_CLR0_CADS0_DTLA0_DTLB0_DTVA0_DTVB0_DTVMXSA0_DTVMXSB0_DTVSM0_DPLB0_EPS0_ELFLR0_EMLLn1_FDSI0_GRPM1_GRVWA1_GRVWB1_GSU1_GSUAMB_GSUC0_GSUWGMRR0_GLS0_ISA1151_IU1_K1_LDSTI0_LBSPPA0_LBSPPB0_LBSPPM0_LPA1_LPB1_LPM0_LRVW1_LWPMn1_MIAV0_MO40_MGRIPM1_NTn1_NTA0_NTB0_NTC0_NTD0_NTM0_NEPBS0_NLCA1_NLCB1_ONLL1_PGR0_PLR1_PKA0_SGROB0_SIA1_SS0_SU0_SUM0_SUS0_SPO0_SRVW0_SSO0_SVW1_SK0_SKFTR0_SKXCCM0_SGRO0_TDMI0_TIN0_TT4_8_TLDS0_TLDSMn1_ULSGRO0_USL1_UIOFGRO0_UPLRP0_USFGROn1_VSn1_VWA1_VWB1_WSGRA0_WSGRB0_WS32_WG8_8_1_WGM1_WGMXCC1_WGMXCCGn1
    SolutionIndex: 82
    SolutionNameMin: Cijk_Alik_Bljk_S_B_Bias_HA_S_SAV_UserArgs_MT48x64x8_SN_LDSB0_AFC1_AG0_AFEM1_AFEM1_ASEM1_CLR0_CADS0_DTLA0_DTLB0_DTVA0_DTVB0_DTVMXSA0_DTVMXSB0_DTVSM0_DPLB0_EPS0_ELFLR0_EMLLn1_FDSI0_GRPM1_GRVWA1_GRVWB1_GSU1_GSUAMB_GSUC0_GSUWGMRR0_GLS0_ISA1151_IU1_K1_LDSTI0_LBSPPA0_LBSPPB0_LBSPPM0_LPA1_LPB1_LPM0_LRVW1_LWPMn1_MIAV0_MO40_MGRIPM1_NTn1_NTA0_NTB0_NTC0_NTD0_NTM0_NEPBS0_NLCA1_NLCB1_ONLL1_PGR0_PLR1_PKA0_SGROB0_SIA1_SS0_SU0_SUM0_SUS0_SPO0_SRVW0_SSO0_SVW1_SK0_SKFTR0_SKXCCM0_SGRO0_TDMI0_TIN0_TT6_8_TLDS0_TLDSMn1_ULSGRO0_USL1_UIOFGRO0_UPLRP0_USFGROn1_VSn1_VWA1_VWB1_WSGRA0_WSGRB0_WS32_WG8_8_1_WGM1_WGMXCC1_WGMXCCGn1
    SolutionIndex: 83
    SolutionNameMin: Cijk_Alik_Bljk_S_B_Bias_HA_S_SAV_UserArgs_MT32x64x8_SN_LDSB0_AFC1_AG0_AFEM1_AFEM1_ASEM1_CLR0_CADS0_DTLA0_DTLB0_DTVA0_DTVB0_DTVMXSA0_DTVMXSB0_DTVSM0_DPLB0_EPS0_ELFLR0_EMLLn1_FDSI0_GRPM1_GRVWA1_GRVWB1_GSU1_GSUAMB_GSUC0_GSUWGMRR0_GLS0_ISA1151_IU1_K1_LDSTI0_LBSPPA0_LBSPPB0_LBSPPM0_LPA1_LPB1_LPM0_LRVW1_LWPMn1_MIAV0_MO40_MGRIPM1_NTn1_NTA0_NTB0_NTC0_NTD0_NTM0_NEPBS0_NLCA1_NLCB1_ONLL1_PGR0_PLR1_PKA0_SGROB0_SIA1_SS0_SU8_SUM0_SUS256_SPO0_SRVW0_SSO0_SVW1_SK0_SKFTR0_SKXCCM0_SGRO0_TDMI0_TIN0_TT4_8_TLDS0_TLDSMn1_ULSGRO0_USL1_UIOFGRO0_UPLRP0_USFGROn1_VSn1_VWA1_VWB1_WSGRA0_WSGRB0_WS32_WG8_8_1_WGM1_WGMXCC1_WGMXCCGn1
    SolutionIndex: 84
    SolutionNameMin: Cijk_Alik_Bljk_S_B_Bias_HA_S_SAV_UserArgs_MT112x64x8_SN_LDSB0_AFC1_AG0_AFEM1_AFEM1_ASEM1_CLR0_CADS0_DTLA0_DTLB0_DTVA0_DTVB0_DTVMXSA0_DTVMXSB0_DTVSM0_DPLB0_EPS0_ELFLR0_EMLLn1_FDSI0_GRPM1_GRVWA1_GRVWB1_GSU1_GSUAMB_GSUC0_GSUWGMRR0_GLS0_ISA1151_IU1_K1_LDSTI0_LBSPPA0_LBSPPB0_LBSPPM0_LPA1_LPB1_LPM0_LRVW1_LWPMn1_MIAV0_MO40_MGRIPM1_NTn1_NTA0_NTB0_NTC0_NTD0_NTM0_NEPBS0_NLCA1_NLCB1_ONLL1_PGR0_PLR1_PKA0_SGROB0_SIA1_SS0_SU0_SUM0_SUS0_SPO0_SRVW0_SSO0_SVW1_SK0_SKFTR0_SKXCCM0_SGRO0_TDMI0_TIN0_TT7_8_TLDS0_TLDSMn1_ULSGRO0_USL1_UIOFGRO0_UPLRP0_USFGROn1_VSn1_VWA1_VWB1_WSGRA0_WSGRB0_WS32_WG16_8_1_WGM1_WGMXCC1_WGMXCCGn1
    SolutionIndex: 85
    SolutionNameMin: Cijk_Alik_Bljk_S_B_Bias_HA_S_SAV_UserArgs_MT40x64x8_SN_LDSB0_AFC1_AG0_AFEM1_AFEM1_ASEM1_CLR0_CADS0_DTLA0_DTLB0_DTVA0_DTVB0_DTVMXSA0_DTVMXSB0_DTVSM0_DPLB0_EPS0_ELFLR0_EMLLn1_FDSI0_GRPM1_GRVWA1_GRVWB1_GSU1_GSUAMB_GSUC0_GSUWGMRR0_GLS0_ISA1151_IU1_K1_LDSTI0_LBSPPA0_LBSPPB0_LBSPPM0_LPA1_LPB1_LPM0_LRVW1_LWPMn1_MIAV0_MO40_MGRIPM1_NTn1_NTA0_NTB0_NTC0_NTD0_NTM0_NEPBS0_NLCA1_NLCB1_ONLL1_PGR0_PLR1_PKA0_SGROB0_SIA1_SS0_SU8_SUM0_SUS256_SPO0_SRVW0_SSO0_SVW1_SK0_SKFTR0_SKXCCM0_SGRO0_TDMI0_TIN0_TT5_8_TLDS0_TLDSMn1_ULSGRO0_USL1_UIOFGRO0_UPLRP0_USFGROn1_VSn1_VWA1_VWB1_WSGRA0_WSGRB0_WS32_WG8_8_1_WGM1_WGMXCC1_WGMXCCGn1
    SolutionIndex: 86
    SolutionNameMin: Cijk_Alik_Bljk_S_B_Bias_HA_S_SAV_UserArgs_MT48x64x8_SN_LDSB0_AFC1_AG0_AFEM1_AFEM1_ASEM1_CLR0_CADS0_DTLA0_DTLB0_DTVA0_DTVB0_DTVMXSA0_DTVMXSB0_DTVSM0_DPLB0_EPS0_ELFLR0_EMLLn1_FDSI0_GRPM1_GRVWA1_GRVWB1_GSU1_GSUAMB_GSUC0_GSUWGMRR0_GLS0_ISA1151_IU1_K1_LDSTI0_LBSPPA0_LBSPPB0_LBSPPM0_LPA1_LPB1_LPM0_LRVW1_LWPMn1_MIAV0_MO40_MGRIPM1_NTn1_NTA0_NTB0_NTC0_NTD0_NTM0_NEPBS0_NLCA1_NLCB1_ONLL1_PGR0_PLR1_PKA0_SGROB0_SIA1_SS0_SU8_SUM0_SUS256_SPO0_SRVW0_SSO0_SVW1_SK0_SKFTR0_SKXCCM0_SGRO0_TDMI0_TIN0_TT6_8_TLDS0_TLDSMn1_ULSGRO0_USL1_UIOFGRO0_UPLRP0_USFGROn1_VSn1_VWA1_VWB1_WSGRA0_WSGRB0_WS32_WG8_8_1_WGM1_WGMXCC1_WGMXCCGn1
    SolutionIndex: 87
    SolutionNameMin: Cijk_Alik_Bljk_S_B_Bias_HA_S_SAV_UserArgs_MT80x64x16_SN_LDSB0_AFC1_AG0_AFEM1_AFEM1_ASEM1_CLR0_CADS0_DTLA0_DTLB0_DTVA0_DTVB0_DTVMXSA0_DTVMXSB0_DTVSM0_DPLB0_EPS0_ELFLR0_EMLLn1_FDSI0_GRPM1_GRVWA1_GRVWB1_GSU1_GSUAMB_GSUC0_GSUWGMRR0_GLS0_ISA1151_IU1_K1_LDSTI0_LBSPPA0_LBSPPB0_LBSPPM0_LPA1_LPB1_LPM0_LRVW1_LWPMn1_MIAV0_MO40_MGRIPM1_NTn1_NTA0_NTB0_NTC0_NTD0_NTM0_NEPBS0_NLCA1_NLCB1_ONLL1_PGR0_PLR1_PKA0_SGROB0_SIA1_SS0_SU8_SUM0_SUS256_SPO0_SRVW0_SSO0_SVW1_SK0_SKFTR0_SKXCCM0_SGRO0_TDMI0_TIN0_TT5_8_TLDS0_TLDSMn1_ULSGRO0_USL1_UIOFGRO0_UPLRP0_USFGROn1_VSn1_VWA1_VWB1_WSGRA0_WSGRB0_WS32_WG16_8_1_WGM1_WGMXCC1_WGMXCCGn1
    SolutionIndex: 88
    SolutionNameMin: Cijk_Alik_Bljk_S_B_Bias_HA_S_SAV_UserArgs_MT96x64x8_SN_LDSB0_AFC1_AG0_AFEM1_AFEM1_ASEM1_CLR0_CADS0_DTLA0_DTLB0_DTVA0_DTVB0_DTVMXSA0_DTVMXSB0_DTVSM0_DPLB0_EPS0_ELFLR0_EMLLn1_FDSI0_GRPM1_GRVWA1_GRVWB1_GSU1_GSUAMB_GSUC0_GSUWGMRR0_GLS0_ISA1151_IU1_K1_LDSTI0_LBSPPA0_LBSPPB0_LBSPPM0_LPA1_LPB1_LPM0_LRVW1_LWPMn1_MIAV0_MO40_MGRIPM1_NTn1_NTA0_NTB0_NTC0_NTD0_NTM0_NEPBS0_NLCA1_NLCB1_ONLL1_PGR0_PLR1_PKA0_SGROB0_SIA1_SS0_SU0_SUM0_SUS0_SPO0_SRVW0_SSO0_SVW1_SK0_SKFTR0_SKXCCM0_SGRO0_TDMI0_TIN0_TT6_8_TLDS0_TLDSMn1_ULSGRO0_USL1_UIOFGRO0_UPLRP0_USFGROn1_VSn1_VWA1_VWB1_WSGRA0_WSGRB0_WS32_WG16_8_1_WGM1_WGMXCC1_WGMXCCGn1
    SolutionIndex: 89
    SolutionNameMin: Cijk_Alik_Bljk_S_B_Bias_HA_S_SAV_UserArgs_MT32x64x32_SN_LDSB0_AFC1_AG0_AFEM1_AFEM1_ASEM1_CLR0_CADS0_DTLA0_DTLB0_DTVA0_DTVB0_DTVMXSA0_DTVMXSB0_DTVSM0_DPLB0_EPS0_ELFLR0_EMLLn1_FDSI0_GRPM1_GRVWA1_GRVWB1_GSU1_GSUAMB_GSUC0_GSUWGMRR0_GLS0_ISA1151_IU1_K1_LDSTI0_LBSPPA0_LBSPPB0_LBSPPM0_LPA1_LPB1_LPM0_LRVW1_LWPMn1_MIAV0_MO40_MGRIPM1_NTn1_NTA0_NTB0_NTC0_NTD0_NTM0_NEPBS0_NLCA1_NLCB1_ONLL1_PGR0_PLR1_PKA0_SGROB0_SIA1_SS0_SU32_SUM0_SUS256_SPO0_SRVW0_SSO0_SVW1_SK0_SKFTR0_SKXCCM0_SGRO0_TDMI0_TIN0_TT4_8_TLDS0_TLDSMn1_ULSGRO0_USL1_UIOFGRO0_UPLRP0_USFGROn1_VSn1_VWA1_VWB1_WSGRA0_WSGRB0_WS32_WG8_8_1_WGM1_WGMXCC1_WGMXCCGn1
    SolutionIndex: 90
    SolutionNameMin: Cijk_Alik_Bljk_S_B_Bias_HA_S_SAV_UserArgs_MT112x64x16_SN_LDSB0_AFC1_AG0_AFEM1_AFEM1_ASEM1_CLR0_CADS0_DTLA0_DTLB0_DTVA0_DTVB0_DTVMXSA0_DTVMXSB0_DTVSM0_DPLB0_EPS0_ELFLR0_EMLLn1_FDSI0_GRPM1_GRVWA1_GRVWB1_GSU1_GSUAMB_GSUC0_GSUWGMRR0_GLS0_ISA1151_IU1_K1_LDSTI0_LBSPPA0_LBSPPB0_LBSPPM0_LPA1_LPB1_LPM0_LRVW1_LWPMn1_MIAV0_MO40_MGRIPM1_NTn1_NTA0_NTB0_NTC0_NTD0_NTM0_NEPBS0_NLCA1_NLCB1_ONLL1_PGR0_PLR1_PKA0_SGROB0_SIA1_SS0_SU16_SUM0_SUS256_SPO0_SRVW0_SSO0_SVW1_SK0_SKFTR0_SKXCCM0_SGRO0_TDMI0_TIN0_TT7_8_TLDS0_TLDSMn1_ULSGRO0_USL1_UIOFGRO0_UPLRP0_USFGROn1_VSn1_VWA1_VWB1_WSGRA0_WSGRB0_WS32_WG16_8_1_WGM1_WGMXCC1_WGMXCCGn1
    SolutionIndex: 91
    SolutionNameMin: Cijk_Alik_Bljk_S_B_Bias_HA_S_SAV_UserArgs_MT32x64x32_SN_LDSB0_AFC1_AG0_AFEM1_AFEM1_ASEM1_CLR0_CADS0_DTLA0_DTLB0_DTVA0_DTVB0_DTVMXSA0_DTVMXSB0_DTVSM0_DPLB0_EPS0_ELFLR0_EMLLn1_FDSI0_GRPM1_GRVWA1_GRVWB1_GSU1_GSUAMB_GSUC0_GSUWGMRR0_GLS0_ISA1151_IU1_K1_LDSTI0_LBSPPA0_LBSPPB0_LBSPPM0_LPA1_LPB1_LPM0_LRVW1_LWPMn1_MIAV0_MO40_MGRIPM1_NTn1_NTA0_NTB0_NTC0_NTD0_NTM0_NEPBS0_NLCA1_NLCB1_ONLL1_PGR0_PLR1_PKA0_SGROB0_SIA1_SS0_SU16_SUM0_SUS256_SPO0_SRVW0_SSO0_SVW1_SK0_SKFTR0_SKXCCM0_SGRO0_TDMI0_TIN0_TT4_8_TLDS0_TLDSMn1_ULSGRO0_USL1_UIOFGRO0_UPLRP0_USFGROn1_VSn1_VWA1_VWB1_WSGRA0_WSGRB0_WS32_WG8_8_1_WGM1_WGMXCC1_WGMXCCGn1
    SolutionIndex: 92
    SolutionNameMin: Cijk_Alik_Bljk_S_B_Bias_HA_S_SAV_UserArgs_MT112x64x16_SN_LDSB0_AFC1_AG0_AFEM1_AFEM1_ASEM1_CLR0_CADS0_DTLA0_DTLB0_DTVA0_DTVB0_DTVMXSA0_DTVMXSB0_DTVSM0_DPLB0_EPS0_ELFLR0_EMLLn1_FDSI0_GRPM1_GRVWA1_GRVWB1_GSU1_GSUAMB_GSUC0_GSUWGMRR0_GLS0_ISA1151_IU1_K1_LDSTI0_LBSPPA0_LBSPPB0_LBSPPM0_LPA1_LPB1_LPM0_LRVW1_LWPMn1_MIAV0_MO40_MGRIPM1_NTn1_NTA0_NTB0_NTC0_NTD0_NTM0_NEPBS0_NLCA1_NLCB1_ONLL1_PGR0_PLR1_PKA0_SGROB0_SIA1_SS0_SU32_SUM0_SUS256_SPO0_SRVW0_SSO0_SVW1_SK0_SKFTR0_SKXCCM0_SGRO0_TDMI0_TIN0_TT7_8_TLDS0_TLDSMn1_ULSGRO0_USL1_UIOFGRO0_UPLRP0_USFGROn1_VSn1_VWA1_VWB1_WSGRA0_WSGRB0_WS32_WG16_8_1_WGM1_WGMXCC1_WGMXCCGn1
    SolutionIndex: 93
    SolutionNameMin: Cijk_Alik_Bljk_S_B_Bias_HA_S_SAV_UserArgs_MT80x64x32_SN_LDSB0_AFC1_AG0_AFEM1_AFEM1_ASEM1_CLR0_CADS0_DTLA0_DTLB0_DTVA0_DTVB0_DTVMXSA0_DTVMXSB0_DTVSM0_DPLB0_EPS0_ELFLR0_EMLLn1_FDSI0_GRPM1_GRVWA1_GRVWB1_GSU1_GSUAMB_GSUC0_GSUWGMRR0_GLS0_ISA1151_IU1_K1_LDSTI0_LBSPPA0_LBSPPB0_LBSPPM0_LPA1_LPB1_LPM0_LRVW1_LWPMn1_MIAV0_MO40_MGRIPM1_NTn1_NTA0_NTB0_NTC0_NTD0_NTM0_NEPBS0_NLCA1_NLCB1_ONLL1_PGR0_PLR1_PKA0_SGROB0_SIA1_SS0_SU0_SUM0_SUS0_SPO0_SRVW0_SSO0_SVW1_SK0_SKFTR0_SKXCCM0_SGRO0_TDMI0_TIN0_TT5_8_TLDS0_TLDSMn1_ULSGRO0_USL1_UIOFGRO0_UPLRP0_USFGROn1_VSn1_VWA1_VWB1_WSGRA0_WSGRB0_WS32_WG16_8_1_WGM1_WGMXCC1_WGMXCCGn1
    SolutionIndex: 94
    SolutionNameMin: Cijk_Alik_Bljk_S_B_Bias_HA_S_SAV_UserArgs_MT112x64x16_SN_LDSB0_AFC1_AG0_AFEM1_AFEM1_ASEM1_CLR0_CADS0_DTLA0_DTLB0_DTVA0_DTVB0_DTVMXSA0_DTVMXSB0_DTVSM0_DPLB0_EPS0_ELFLR0_EMLLn1_FDSI0_GRPM1_GRVWA1_GRVWB1_GSU1_GSUAMB_GSUC0_GSUWGMRR0_GLS0_ISA1151_IU1_K1_LDSTI0_LBSPPA0_LBSPPB0_LBSPPM0_LPA1_LPB1_LPM0_LRVW1_LWPMn1_MIAV0_MO40_MGRIPM1_NTn1_NTA0_NTB0_NTC0_NTD0_NTM0_NEPBS0_NLCA1_NLCB1_ONLL1_PGR0_PLR1_PKA0_SGROB0_SIA1_SS0_SU8_SUM0_SUS256_SPO0_SRVW0_SSO0_SVW1_SK0_SKFTR0_SKXCCM0_SGRO0_TDMI0_TIN0_TT7_8_TLDS0_TLDSMn1_ULSGRO0_USL1_UIOFGRO0_UPLRP0_USFGROn1_VSn1_VWA1_VWB1_WSGRA0_WSGRB0_WS32_WG16_8_1_WGM1_WGMXCC1_WGMXCCGn1
    SolutionIndex: 95
    SolutionNameMin: Cijk_Alik_Bljk_S_B_Bias_HA_S_SAV_UserArgs_MT80x64x32_SN_LDSB0_AFC1_AG0_AFEM1_AFEM1_ASEM1_CLR0_CADS0_DTLA0_DTLB0_DTVA0_DTVB0_DTVMXSA0_DTVMXSB0_DTVSM0_DPLB0_EPS0_ELFLR0_EMLLn1_FDSI0_GRPM1_GRVWA1_GRVWB1_GSU1_GSUAMB_GSUC0_GSUWGMRR0_GLS0_ISA1151_IU1_K1_LDSTI0_LBSPPA0_LBSPPB0_LBSPPM0_LPA1_LPB1_LPM0_LRVW1_LWPMn1_MIAV0_MO40_MGRIPM1_NTn1_NTA0_NTB0_NTC0_NTD0_NTM0_NEPBS0_NLCA1_NLCB1_ONLL1_PGR0_PLR1_PKA0_SGROB0_SIA1_SS0_SU32_SUM0_SUS256_SPO0_SRVW0_SSO0_SVW1_SK0_SKFTR0_SKXCCM0_SGRO0_TDMI0_TIN0_TT5_8_TLDS0_TLDSMn1_ULSGRO0_USL1_UIOFGRO0_UPLRP0_USFGROn1_VSn1_VWA1_VWB1_WSGRA0_WSGRB0_WS32_WG16_8_1_WGM1_WGMXCC1_WGMXCCGn1
    SolutionIndex: 96
    SolutionNameMin: Cijk_Alik_Bljk_S_B_Bias_HA_S_SAV_UserArgs_MT112x64x32_SN_LDSB0_AFC1_AG0_AFEM1_AFEM1_ASEM1_CLR0_CADS0_DTLA0_DTLB0_DTVA0_DTVB0_DTVMXSA0_DTVMXSB0_DTVSM0_DPLB0_EPS0_ELFLR0_EMLLn1_FDSI0_GRPM1_GRVWA1_GRVWB1_GSU1_GSUAMB_GSUC0_GSUWGMRR0_GLS0_ISA1151_IU1_K1_LDSTI0_LBSPPA0_LBSPPB0_LBSPPM0_LPA1_LPB1_LPM0_LRVW1_LWPMn1_MIAV0_MO40_MGRIPM1_NTn1_NTA0_NTB0_NTC0_NTD0_NTM0_NEPBS0_NLCA1_NLCB1_ONLL1_PGR0_PLR1_PKA0_SGROB0_SIA1_SS0_SU32_SUM0_SUS256_SPO0_SRVW0_SSO0_SVW1_SK0_SKFTR0_SKXCCM0_SGRO0_TDMI0_TIN0_TT7_8_TLDS0_TLDSMn1_ULSGRO0_USL1_UIOFGRO0_UPLRP0_USFGROn1_VSn1_VWA1_VWB1_WSGRA0_WSGRB0_WS32_WG16_8_1_WGM1_WGMXCC1_WGMXCCGn1
    SolutionIndex: 97
    SolutionNameMin: Cijk_Alik_Bljk_S_B_Bias_HA_S_SAV_UserArgs_MT96x64x16_SN_LDSB0_AFC1_AG0_AFEM1_AFEM1_ASEM1_CLR0_CADS0_DTLA0_DTLB0_DTVA0_DTVB0_DTVMXSA0_DTVMXSB0_DTVSM0_DPLB0_EPS0_ELFLR0_EMLLn1_FDSI0_GRPM1_GRVWA1_GRVWB1_GSU1_GSUAMB_GSUC0_GSUWGMRR0_GLS0_ISA1151_IU1_K1_LDSTI0_LBSPPA0_LBSPPB0_LBSPPM0_LPA1_LPB1_LPM0_LRVW1_LWPMn1_MIAV0_MO40_MGRIPM1_NTn1_NTA0_NTB0_NTC0_NTD0_NTM0_NEPBS0_NLCA1_NLCB1_ONLL1_PGR0_PLR1_PKA0_SGROB0_SIA1_SS0_SU0_SUM0_SUS0_SPO0_SRVW0_SSO0_SVW1_SK0_SKFTR0_SKXCCM0_SGRO0_TDMI0_TIN0_TT6_8_TLDS0_TLDSMn1_ULSGRO0_USL1_UIOFGRO0_UPLRP0_USFGROn1_VSn1_VWA1_VWB1_WSGRA0_WSGRB0_WS32_WG16_8_1_WGM2_WGMXCC1_WGMXCCGn1
    SolutionIndex: 98
    SolutionNameMin: Cijk_Alik_Bljk_S_B_Bias_HA_S_SAV_UserArgs_MT56x64x16_SN_LDSB0_AFC1_AG0_AFEM1_AFEM1_ASEM1_CLR0_CADS0_DTLA0_DTLB0_DTVA0_DTVB0_DTVMXSA0_DTVMXSB0_DTVSM0_DPLB0_EPS0_ELFLR0_EMLLn1_FDSI0_GRPM1_GRVWA1_GRVWB1_GSU1_GSUAMB_GSUC0_GSUWGMRR0_GLS0_ISA1151_IU1_K1_LDSTI0_LBSPPA0_LBSPPB0_LBSPPM0_LPA1_LPB1_LPM0_LRVW1_LWPMn1_MIAV0_MO40_MGRIPM1_NTn1_NTA0_NTB0_NTC0_NTD0_NTM0_NEPBS0_NLCA1_NLCB1_ONLL1_PGR0_PLR1_PKA0_SGROB0_SIA1_SS0_SU8_SUM0_SUS256_SPO0_SRVW0_SSO0_SVW1_SK0_SKFTR0_SKXCCM0_SGRO0_TDMI0_TIN0_TT7_8_TLDS0_TLDSMn1_ULSGRO0_USL1_UIOFGRO0_UPLRP0_USFGROn1_VSn1_VWA1_VWB1_WSGRA0_WSGRB0_WS32_WG8_8_1_WGM4_WGMXCC1_WGMXCCGn1
    SolutionIndex: 99
    SolutionNameMin: Cijk_Alik_Bljk_S_B_Bias_HA_S_SAV_UserArgs_MT56x64x32_SN_LDSB0_AFC1_AG0_AFEM1_AFEM1_ASEM1_CLR0_CADS0_DTLA0_DTLB0_DTVA0_DTVB0_DTVMXSA0_DTVMXSB0_DTVSM0_DPLB0_EPS0_ELFLR0_EMLLn1_FDSI0_GRPM1_GRVWA1_GRVWB1_GSU1_GSUAMB_GSUC0_GSUWGMRR0_GLS0_ISA1151_IU1_K1_LDSTI0_LBSPPA0_LBSPPB0_LBSPPM0_LPA1_LPB1_LPM0_LRVW1_LWPMn1_MIAV0_MO40_MGRIPM1_NTn1_NTA0_NTB0_NTC0_NTD0_NTM0_NEPBS0_NLCA1_NLCB1_ONLL1_PGR0_PLR1_PKA0_SGROB0_SIA1_SS0_SU0_SUM0_SUS0_SPO0_SRVW0_SSO0_SVW1_SK0_SKFTR0_SKXCCM0_SGRO0_TDMI0_TIN0_TT7_8_TLDS0_TLDSMn1_ULSGRO0_USL1_UIOFGRO0_UPLRP0_USFGROn1_VSn1_VWA1_VWB1_WSGRA0_WSGRB0_WS32_WG8_8_1_WGM2_WGMXCC1_WGMXCCGn1
    SolutionIndex: 100
    SolutionNameMin: Cijk_Alik_Bljk_S_B_Bias_HA_S_SAV_UserArgs_MT112x64x32_SN_LDSB0_AFC1_AG0_AFEM1_AFEM1_ASEM1_CLR0_CADS0_DTLA0_DTLB0_DTVA0_DTVB0_DTVMXSA0_DTVMXSB0_DTVSM0_DPLB0_EPS0_ELFLR0_EMLLn1_FDSI0_GRPM1_GRVWA1_GRVWB1_GSU1_GSUAMB_GSUC0_GSUWGMRR0_GLS0_ISA1151_IU1_K1_LDSTI0_LBSPPA0_LBSPPB0_LBSPPM0_LPA1_LPB1_LPM0_LRVW1_LWPMn1_MIAV0_MO40_MGRIPM1_NTn1_NTA0_NTB0_NTC0_NTD0_NTM0_NEPBS0_NLCA1_NLCB1_ONLL1_PGR0_PLR1_PKA0_SGROB0_SIA1_SS0_SU16_SUM0_SUS256_SPO0_SRVW0_SSO0_SVW1_SK0_SKFTR0_SKXCCM0_SGRO0_TDMI0_TIN0_TT7_8_TLDS0_TLDSMn1_ULSGRO0_USL1_UIOFGRO0_UPLRP0_USFGROn1_VSn1_VWA1_VWB1_WSGRA0_WSGRB0_WS32_WG16_8_1_WGM1_WGMXCC1_WGMXCCGn1
    SolutionIndex: 101
    SolutionNameMin: Cijk_Alik_Bljk_S_B_Bias_HA_S_SAV_UserArgs_MT112x64x32_SN_LDSB0_AFC1_AG0_AFEM1_AFEM1_ASEM1_CLR0_CADS0_DTLA0_DTLB0_DTVA0_DTVB0_DTVMXSA0_DTVMXSB0_DTVSM0_DPLB0_EPS0_ELFLR0_EMLLn1_FDSI0_GRPM1_GRVWA1_GRVWB1_GSU1_GSUAMB_GSUC0_GSUWGMRR0_GLS0_ISA1151_IU1_K1_LDSTI0_LBSPPA0_LBSPPB0_LBSPPM0_LPA1_LPB1_LPM0_LRVW1_LWPMn1_MIAV0_MO40_MGRIPM1_NTn1_NTA0_NTB0_NTC0_NTD0_NTM0_NEPBS0_NLCA1_NLCB1_ONLL1_PGR0_PLR1_PKA0_SGROB0_SIA1_SS0_SU4_SUM0_SUS256_SPO0_SRVW0_SSO0_SVW1_SK0_SKFTR0_SKXCCM0_SGRO0_TDMI0_TIN0_TT7_8_TLDS0_TLDSMn1_ULSGRO0_USL1_UIOFGRO0_UPLRP0_USFGROn1_VSn1_VWA1_VWB1_WSGRA0_WSGRB0_WS32_WG16_8_1_WGM1_WGMXCC1_WGMXCCGn1
    SolutionIndex: 102
    SolutionNameMin: Cijk_Alik_Bljk_S_B_Bias_HA_S_SAV_UserArgs_MT96x64x32_SN_LDSB0_AFC1_AG0_AFEM1_AFEM1_ASEM1_CLR0_CADS0_DTLA0_DTLB0_DTVA0_DTVB0_DTVMXSA0_DTVMXSB0_DTVSM0_DPLB0_EPS0_ELFLR0_EMLLn1_FDSI0_GRPM1_GRVWA1_GRVWB1_GSU1_GSUAMB_GSUC0_GSUWGMRR0_GLS0_ISA1151_IU1_K1_LDSTI0_LBSPPA0_LBSPPB0_LBSPPM0_LPA1_LPB1_LPM0_LRVW1_LWPMn1_MIAV0_MO40_MGRIPM1_NTn1_NTA0_NTB0_NTC0_NTD0_NTM0_NEPBS0_NLCA1_NLCB1_ONLL1_PGR0_PLR1_PKA0_SGROB0_SIA1_SS0_SU16_SUM0_SUS256_SPO0_SRVW0_SSO0_SVW1_SK0_SKFTR0_SKXCCM0_SGRO0_TDMI0_TIN0_TT6_8_TLDS0_TLDSMn1_ULSGRO0_USL1_UIOFGRO0_UPLRP0_USFGROn1_VSn1_VWA1_VWB1_WSGRA0_WSGRB0_WS32_WG16_8_1_WGM1_WGMXCC1_WGMXCCGn1
    SolutionIndex: 103
    SolutionNameMin: Cijk_Alik_Bljk_S_B_Bias_HA_S_SAV_UserArgs_MT96x64x32_SN_LDSB0_AFC1_AG0_AFEM1_AFEM1_ASEM1_CLR0_CADS0_DTLA0_DTLB0_DTVA0_DTVB0_DTVMXSA0_DTVMXSB0_DTVSM0_DPLB0_EPS0_ELFLR0_EMLLn1_FDSI0_GRPM1_GRVWA1_GRVWB1_GSU1_GSUAMB_GSUC0_GSUWGMRR0_GLS0_ISA1151_IU1_K1_LDSTI0_LBSPPA0_LBSPPB0_LBSPPM0_LPA1_LPB1_LPM0_LRVW1_LWPMn1_MIAV0_MO40_MGRIPM1_NTn1_NTA0_NTB0_NTC0_NTD0_NTM0_NEPBS0_NLCA1_NLCB1_ONLL1_PGR0_PLR1_PKA0_SGROB0_SIA1_SS0_SU4_SUM0_SUS256_SPO0_SRVW0_SSO0_SVW1_SK0_SKFTR0_SKXCCM0_SGRO0_TDMI0_TIN0_TT6_8_TLDS0_TLDSMn1_ULSGRO0_USL1_UIOFGRO0_UPLRP0_USFGROn1_VSn1_VWA1_VWB1_WSGRA0_WSGRB0_WS32_WG16_8_1_WGM1_WGMXCC1_WGMXCCGn1
    SolutionIndex: 104
    SolutionNameMin: Cijk_Alik_Bljk_S_B_Bias_HA_S_SAV_UserArgs_MT112x64x32_SN_LDSB0_AFC1_AG0_AFEM1_AFEM1_ASEM1_CLR0_CADS0_DTLA0_DTLB0_DTVA0_DTVB0_DTVMXSA0_DTVMXSB0_DTVSM0_DPLB0_EPS0_ELFLR0_EMLLn1_FDSI0_GRPM1_GRVWA1_GRVWB1_GSU1_GSUAMB_GSUC0_GSUWGMRR0_GLS0_ISA1151_IU1_K1_LDSTI0_LBSPPA0_LBSPPB0_LBSPPM0_LPA1_LPB1_LPM0_LRVW1_LWPMn1_MIAV0_MO40_MGRIPM1_NTn1_NTA0_NTB0_NTC0_NTD0_NTM0_NEPBS0_NLCA1_NLCB1_ONLL1_PGR0_PLR1_PKA0_SGROB0_SIA1_SS0_SU8_SUM0_SUS256_SPO0_SRVW0_SSO0_SVW1_SK0_SKFTR0_SKXCCM0_SGRO0_TDMI0_TIN0_TT7_8_TLDS0_TLDSMn1_ULSGRO0_USL1_UIOFGRO0_UPLRP0_USFGROn1_VSn1_VWA1_VWB1_WSGRA0_WSGRB0_WS32_WG16_8_1_WGM8_WGMXCC1_WGMXCCGn1
    SolutionIndex: 105
    SolutionNameMin: Cijk_Alik_Bljk_S_B_Bias_HA_S_SAV_UserArgs_MT112x64x32_SN_LDSB0_AFC1_AG0_AFEM1_AFEM1_ASEM1_CLR0_CADS0_DTLA0_DTLB0_DTVA0_DTVB0_DTVMXSA0_DTVMXSB0_DTVSM0_DPLB0_EPS0_ELFLR0_EMLLn1_FDSI0_GRPM1_GRVWA1_GRVWB1_GSU1_GSUAMB_GSUC0_GSUWGMRR0_GLS0_ISA1151_IU1_K1_LDSTI0_LBSPPA0_LBSPPB0_LBSPPM0_LPA1_LPB1_LPM0_LRVW1_LWPMn1_MIAV0_MO40_MGRIPM1_NTn1_NTA0_NTB0_NTC0_NTD0_NTM0_NEPBS0_NLCA1_NLCB1_ONLL1_PGR0_PLR1_PKA0_SGROB0_SIA1_SS0_SU4_SUM0_SUS256_SPO0_SRVW0_SSO0_SVW1_SK0_SKFTR0_SKXCCM0_SGRO0_TDMI0_TIN0_TT7_8_TLDS0_TLDSMn1_ULSGRO0_USL1_UIOFGRO0_UPLRP0_USFGROn1_VSn1_VWA1_VWB1_WSGRA0_WSGRB0_WS32_WG16_8_1_WGM4_WGMXCC1_WGMXCCGn1
    SolutionIndex: 106
    SolutionNameMin: Cijk_Alik_Bljk_S_B_Bias_HA_S_SAV_UserArgs_MT96x64x32_SN_LDSB0_AFC1_AG0_AFEM1_AFEM1_ASEM1_CLR0_CADS0_DTLA0_DTLB0_DTVA0_DTVB0_DTVMXSA0_DTVMXSB0_DTVSM0_DPLB0_EPS0_ELFLR0_EMLLn1_FDSI0_GRPM1_GRVWA1_GRVWB1_GSU1_GSUAMB_GSUC0_GSUWGMRR0_GLS0_ISA1151_IU1_K1_LDSTI0_LBSPPA0_LBSPPB0_LBSPPM0_LPA1_LPB1_LPM0_LRVW1_LWPMn1_MIAV0_MO40_MGRIPM1_NTn1_NTA0_NTB0_NTC0_NTD0_NTM0_NEPBS0_NLCA1_NLCB1_ONLL1_PGR0_PLR1_PKA0_SGROB0_SIA1_SS0_SU16_SUM0_SUS256_SPO0_SRVW0_SSO0_SVW1_SK0_SKFTR0_SKXCCM0_SGRO0_TDMI0_TIN0_TT6_8_TLDS0_TLDSMn1_ULSGRO0_USL1_UIOFGRO0_UPLRP0_USFGROn1_VSn1_VWA1_VWB1_WSGRA0_WSGRB0_WS32_WG16_8_1_WGM4_WGMXCC1_WGMXCCGn1
    SolutionIndex: 107
    SolutionNameMin: Cijk_Alik_Bljk_S_B_Bias_HA_S_SAV_UserArgs_MT112x64x32_SN_LDSB0_AFC1_AG0_AFEM1_AFEM1_ASEM1_CLR0_CADS0_DTLA0_DTLB0_DTVA0_DTVB0_DTVMXSA0_DTVMXSB0_DTVSM0_DPLB0_EPS0_ELFLR0_EMLLn1_FDSI0_GRPM1_GRVWA1_GRVWB1_GSU1_GSUAMB_GSUC0_GSUWGMRR0_GLS0_ISA1151_IU1_K1_LDSTI0_LBSPPA0_LBSPPB0_LBSPPM0_LPA1_LPB1_LPM0_LRVW1_LWPMn1_MIAV0_MO40_MGRIPM1_NTn1_NTA0_NTB0_NTC0_NTD0_NTM0_NEPBS0_NLCA1_NLCB1_ONLL1_PGR0_PLR1_PKA0_SGROB0_SIA1_SS0_SU16_SUM0_SUS256_SPO0_SRVW0_SSO0_SVW1_SK0_SKFTR0_SKXCCM0_SGRO0_TDMI0_TIN0_TT7_8_TLDS0_TLDSMn1_ULSGRO0_USL1_UIOFGRO0_UPLRP0_USFGROn1_VSn1_VWA1_VWB1_WSGRA0_WSGRB0_WS32_WG16_8_1_WGM4_WGMXCC1_WGMXCCGn1
    SolutionIndex: 108
    SolutionNameMin: Cijk_Alik_Bljk_S_B_Bias_HA_S_SAV_UserArgs_MT112x64x32_SN_LDSB0_AFC1_AG0_AFEM1_AFEM1_ASEM1_CLR0_CADS0_DTLA0_DTLB0_DTVA0_DTVB0_DTVMXSA0_DTVMXSB0_DTVSM0_DPLB0_EPS0_ELFLR0_EMLLn1_FDSI0_GRPM1_GRVWA1_GRVWB1_GSU1_GSUAMB_GSUC0_GSUWGMRR0_GLS0_ISA1151_IU1_K1_LDSTI0_LBSPPA0_LBSPPB0_LBSPPM0_LPA1_LPB1_LPM0_LRVW1_LWPMn1_MIAV0_MO40_MGRIPM1_NTn1_NTA0_NTB0_NTC0_NTD0_NTM0_NEPBS0_NLCA1_NLCB1_ONLL1_PGR0_PLR1_PKA0_SGROB0_SIA1_SS0_SU8_SUM0_SUS256_SPO0_SRVW0_SSO0_SVW1_SK0_SKFTR0_SKXCCM0_SGRO0_TDMI0_TIN0_TT7_8_TLDS0_TLDSMn1_ULSGRO0_USL1_UIOFGRO0_UPLRP0_USFGROn1_VSn1_VWA1_VWB1_WSGRA0_WSGRB0_WS32_WG16_8_1_WGM4_WGMXCC1_WGMXCCGn1
    SolutionIndex: 109
    SolutionNameMin: Cijk_Alik_Bljk_S_B_Bias_HA_S_SAV_UserArgs_MT64x32x32_SN_LDSB0_AFC1_AG0_AFEM1_AFEM1_ASEM1_CLR0_CADS0_DTLA0_DTLB0_DTVA0_DTVB0_DTVMXSA0_DTVMXSB0_DTVSM0_DPLB0_EPS0_ELFLR0_EMLLn1_FDSI0_GRPM1_GRVWA1_GRVWB1_GSU1_GSUAMB_GSUC0_GSUWGMRR0_GLS0_ISA1151_IU1_K1_LDSTI0_LBSPPA0_LBSPPB0_LBSPPM0_LPA1_LPB1_LPM0_LRVW1_LWPMn1_MIAV0_MO40_MGRIPM1_NTn1_NTA0_NTB0_NTC0_NTD0_NTM0_NEPBS0_NLCA1_NLCB1_ONLL1_PGR1_PLR1_PKA0_SGROB0_SIA1_SS0_SU8_SUM0_SUS256_SPO0_SRVW0_SSO0_SVW1_SK0_SKFTR0_SKXCCM0_SGRO0_TDMI0_TIN0_TT4_4_TLDS0_TLDSMn1_ULSGRO0_USL1_UIOFGRO0_UPLRP0_USFGROn1_VSn1_VWA1_VWB1_WSGRA0_WSGRB0_WS32_WG16_8_1_WGM1_WGMXCC1_WGMXCCGn1
    SolutionIndex: 110
    SolutionNameMin: Cijk_Alik_Bljk_S_B_Bias_HA_S_SAV_UserArgs_MT32x32x32_SN_LDSB0_AFC1_AG0_AFEM1_AFEM1_ASEM1_CLR0_CADS0_DTLA0_DTLB0_DTVA0_DTVB0_DTVMXSA0_DTVMXSB0_DTVSM0_DPLB0_EPS0_ELFLR0_EMLLn1_FDSI0_GRPM1_GRVWA1_GRVWB1_GSU1_GSUAMB_GSUC0_GSUWGMRR0_GLS0_ISA1151_IU1_K1_LDSTI0_LBSPPA0_LBSPPB0_LBSPPM0_LPA1_LPB1_LPM0_LRVW1_LWPMn1_MIAV0_MO40_MGRIPM1_NTn1_NTA0_NTB0_NTC0_NTD0_NTM0_NEPBS0_NLCA1_NLCB1_ONLL1_PGR1_PLR1_PKA0_SGROB0_SIA1_SS0_SU8_SUM0_SUS256_SPO0_SRVW0_SSO0_SVW1_SK0_SKFTR0_SKXCCM0_SGRO0_TDMI0_TIN0_TT4_4_TLDS0_TLDSMn1_ULSGRO0_USL1_UIOFGRO0_UPLRP0_USFGROn1_VSn1_VWA1_VWB1_WSGRA0_WSGRB0_WS32_WG8_8_1_WGM1_WGMXCC1_WGMXCCGn1
    SolutionIndex: 111
    SolutionNameMin: Cijk_Alik_Bljk_S_B_Bias_HA_S_SAV_UserArgs_MT32x32x32_SN_LDSB0_AFC1_AG0_AFEM1_AFEM1_ASEM1_CLR0_CADS0_DTLA0_DTLB0_DTVA0_DTVB0_DTVMXSA0_DTVMXSB0_DTVSM0_DPLB0_EPS0_ELFLR0_EMLLn1_FDSI0_GRPM1_GRVWA1_GRVWB1_GSU1_GSUAMB_GSUC0_GSUWGMRR0_GLS0_ISA1151_IU1_K1_LDSTI0_LBSPPA0_LBSPPB0_LBSPPM0_LPA1_LPB1_LPM0_LRVW1_LWPMn1_MIAV0_MO40_MGRIPM1_NTn1_NTA0_NTB0_NTC0_NTD0_NTM0_NEPBS0_NLCA1_NLCB1_ONLL1_PGR1_PLR1_PKA0_SGROB0_SIA1_SS0_SU0_SUM0_SUS0_SPO0_SRVW0_SSO0_SVW1_SK0_SKFTR0_SKXCCM0_SGRO0_TDMI0_TIN0_TT4_4_TLDS0_TLDSMn1_ULSGRO0_USL1_UIOFGRO0_UPLRP0_USFGROn1_VSn1_VWA1_VWB1_WSGRA0_WSGRB0_WS32_WG8_8_1_WGM1_WGMXCC1_WGMXCCGn1
    SolutionIndex: 112
    SolutionNameMin: Cijk_Alik_Bljk_S_B_Bias_HA_S_SAV_UserArgs_MT64x64x32_SN_LDSB0_AFC1_AG0_AFEM1_AFEM1_ASEM1_CLR0_CADS0_DTLA0_DTLB0_DTVA0_DTVB0_DTVMXSA0_DTVMXSB0_DTVSM0_DPLB0_EPS0_ELFLR0_EMLLn1_FDSI0_GRPM1_GRVWA1_GRVWB1_GSU1_GSUAMB_GSUC0_GSUWGMRR0_GLS0_ISA1151_IU1_K1_LDSTI0_LBSPPA0_LBSPPB0_LBSPPM0_LPA1_LPB1_LPM0_LRVW1_LWPMn1_MIAV0_MO40_MGRIPM1_NTn1_NTA0_NTB0_NTC0_NTD0_NTM0_NEPBS0_NLCA1_NLCB1_ONLL1_PGR1_PLR1_PKA0_SGROB0_SIA1_SS0_SU8_SUM0_SUS256_SPO0_SRVW0_SSO0_SVW1_SK0_SKFTR0_SKXCCM0_SGRO0_TDMI0_TIN0_TT4_8_TLDS0_TLDSMn1_ULSGRO0_USL1_UIOFGRO0_UPLRP0_USFGROn1_VSn1_VWA1_VWB1_WSGRA0_WSGRB0_WS32_WG16_8_1_WGM1_WGMXCC1_WGMXCCGn1
    SolutionIndex: 113
    SolutionNameMin: Cijk_Alik_Bljk_S_B_Bias_HA_S_SAV_UserArgs_MT48x64x32_SN_LDSB0_AFC1_AG0_AFEM1_AFEM1_ASEM1_CLR0_CADS0_DTLA0_DTLB0_DTVA0_DTVB0_DTVMXSA0_DTVMXSB0_DTVSM0_DPLB0_EPS0_ELFLR0_EMLLn1_FDSI0_GRPM1_GRVWA1_GRVWB1_GSU1_GSUAMB_GSUC0_GSUWGMRR0_GLS0_ISA1151_IU1_K1_LDSTI0_LBSPPA0_LBSPPB0_LBSPPM0_LPA1_LPB1_LPM0_LRVW1_LWPMn1_MIAV0_MO40_MGRIPM1_NTn1_NTA0_NTB0_NTC0_NTD0_NTM0_NEPBS0_NLCA1_NLCB1_ONLL1_PGR1_PLR1_PKA0_SGROB0_SIA1_SS0_SU8_SUM0_SUS256_SPO0_SRVW0_SSO0_SVW1_SK0_SKFTR0_SKXCCM0_SGRO0_TDMI0_TIN0_TT6_8_TLDS0_TLDSMn1_ULSGRO0_USL1_UIOFGRO0_UPLRP0_USFGROn1_VSn1_VWA1_VWB1_WSGRA0_WSGRB0_WS32_WG8_8_1_WGM1_WGMXCC1_WGMXCCGn1
    SolutionIndex: 114
    SolutionNameMin: Cijk_Alik_Bljk_S_B_Bias_HA_S_SAV_UserArgs_MT64x32x32_SN_LDSB0_AFC1_AG0_AFEM1_AFEM1_ASEM1_CLR0_CADS0_DTLA0_DTLB0_DTVA0_DTVB0_DTVMXSA0_DTVMXSB0_DTVSM0_DPLB0_EPS0_ELFLR0_EMLLn1_FDSI0_GRPM1_GRVWA1_GRVWB1_GSU1_GSUAMB_GSUC0_GSUWGMRR0_GLS0_ISA1151_IU1_K1_LDSTI0_LBSPPA0_LBSPPB0_LBSPPM0_LPA1_LPB1_LPM0_LRVW1_LWPMn1_MIAV0_MO40_MGRIPM1_NTn1_NTA0_NTB0_NTC0_NTD0_NTM0_NEPBS0_NLCA1_NLCB1_ONLL1_PGR1_PLR1_PKA0_SGROB0_SIA1_SS0_SU8_SUM0_SUS256_SPO0_SRVW0_SSO0_SVW1_SK0_SKFTR0_SKXCCM0_SGRO0_TDMI0_TIN0_TT8_4_TLDS0_TLDSMn1_ULSGRO0_USL1_UIOFGRO0_UPLRP0_USFGROn1_VSn1_VWA1_VWB1_WSGRA0_WSGRB0_WS32_WG8_8_1_WGM1_WGMXCC1_WGMXCCGn1
    SolutionIndex: 115
    SolutionNameMin: Cijk_Alik_Bljk_S_B_Bias_HA_S_SAV_UserArgs_MT96x64x32_SN_LDSB0_AFC1_AG0_AFEM1_AFEM1_ASEM1_CLR0_CADS0_DTLA0_DTLB0_DTVA0_DTVB0_DTVMXSA0_DTVMXSB0_DTVSM0_DPLB0_EPS0_ELFLR0_EMLLn1_FDSI0_GRPM1_GRVWA1_GRVWB1_GSU1_GSUAMB_GSUC0_GSUWGMRR0_GLS0_ISA1151_IU1_K1_LDSTI0_LBSPPA0_LBSPPB0_LBSPPM0_LPA1_LPB1_LPM0_LRVW1_LWPMn1_MIAV0_MO40_MGRIPM1_NTn1_NTA0_NTB0_NTC0_NTD0_NTM0_NEPBS0_NLCA1_NLCB1_ONLL1_PGR1_PLR1_PKA0_SGROB0_SIA1_SS0_SU8_SUM0_SUS256_SPO0_SRVW0_SSO0_SVW1_SK0_SKFTR0_SKXCCM0_SGRO0_TDMI0_TIN0_TT6_8_TLDS0_TLDSMn1_ULSGRO0_USL1_UIOFGRO0_UPLRP0_USFGROn1_VSn1_VWA1_VWB1_WSGRA0_WSGRB0_WS32_WG16_8_1_WGM1_WGMXCC1_WGMXCCGn1
    SolutionIndex: 116
    SolutionNameMin: Cijk_Alik_Bljk_S_B_Bias_HA_S_SAV_UserArgs_MT64x32x32_SN_LDSB0_AFC1_AG0_AFEM1_AFEM1_ASEM1_CLR0_CADS0_DTLA0_DTLB0_DTVA0_DTVB0_DTVMXSA0_DTVMXSB0_DTVSM0_DPLB0_EPS0_ELFLR0_EMLLn1_FDSI0_GRPM1_GRVWA1_GRVWB1_GSU1_GSUAMB_GSUC0_GSUWGMRR0_GLS0_ISA1151_IU1_K1_LDSTI0_LBSPPA0_LBSPPB0_LBSPPM0_LPA1_LPB1_LPM0_LRVW1_LWPMn1_MIAV0_MO40_MGRIPM1_NTn1_NTA0_NTB0_NTC0_NTD0_NTM0_NEPBS0_NLCA1_NLCB1_ONLL1_PGR1_PLR1_PKA0_SGROB0_SIA1_SS0_SU0_SUM0_SUS0_SPO0_SRVW0_SSO0_SVW1_SK0_SKFTR0_SKXCCM0_SGRO0_TDMI0_TIN0_TT8_4_TLDS0_TLDSMn1_ULSGRO0_USL1_UIOFGRO0_UPLRP0_USFGROn1_VSn1_VWA1_VWB1_WSGRA0_WSGRB0_WS32_WG8_8_1_WGM1_WGMXCC1_WGMXCCGn1
    SolutionIndex: 117
    SolutionNameMin: Cijk_Alik_Bljk_S_B_Bias_HA_S_SAV_UserArgs_MT32x32x32_SN_LDSB0_AFC1_AG0_AFEM1_AFEM1_ASEM1_CLR0_CADS0_DTLA0_DTLB0_DTVA0_DTVB0_DTVMXSA0_DTVMXSB0_DTVSM0_DPLB0_EPS0_ELFLR0_EMLLn1_FDSI0_GRPM1_GRVWA1_GRVWB1_GSU1_GSUAMB_GSUC0_GSUWGMRR0_GLS0_ISA1151_IU1_K1_LDSTI0_LBSPPA0_LBSPPB0_LBSPPM0_LPA1_LPB1_LPM0_LRVW1_LWPMn1_MIAV0_MO40_MGRIPM1_NTn1_NTA0_NTB0_NTC0_NTD0_NTM0_NEPBS0_NLCA1_NLCB1_ONLL1_PGR1_PLR1_PKA0_SGROB0_SIA1_SS0_SU16_SUM0_SUS256_SPO0_SRVW0_SSO0_SVW1_SK0_SKFTR0_SKXCCM0_SGRO0_TDMI0_TIN0_TT2_4_TLDS0_TLDSMn1_ULSGRO0_USL1_UIOFGRO0_UPLRP0_USFGROn1_VSn1_VWA1_VWB1_WSGRA0_WSGRB0_WS32_WG16_8_1_WGM1_WGMXCC1_WGMXCCGn1
    SolutionIndex: 118
    SolutionNameMin: Cijk_Alik_Bljk_S_B_Bias_HA_S_SAV_UserArgs_MT32x64x32_SN_LDSB0_AFC1_AG0_AFEM1_AFEM1_ASEM1_CLR0_CADS0_DTLA0_DTLB0_DTVA0_DTVB0_DTVMXSA0_DTVMXSB0_DTVSM0_DPLB0_EPS0_ELFLR0_EMLLn1_FDSI0_GRPM1_GRVWA1_GRVWB1_GSU1_GSUAMB_GSUC0_GSUWGMRR0_GLS0_ISA1151_IU1_K1_LDSTI0_LBSPPA0_LBSPPB0_LBSPPM0_LPA1_LPB1_LPM0_LRVW1_LWPMn1_MIAV0_MO40_MGRIPM1_NTn1_NTA0_NTB0_NTC0_NTD0_NTM0_NEPBS0_NLCA1_NLCB1_ONLL1_PGR1_PLR1_PKA0_SGROB0_SIA1_SS0_SU16_SUM0_SUS256_SPO0_SRVW0_SSO0_SVW1_SK0_SKFTR0_SKXCCM0_SGRO0_TDMI0_TIN0_TT4_8_TLDS0_TLDSMn1_ULSGRO0_USL1_UIOFGRO0_UPLRP0_USFGROn1_VSn1_VWA1_VWB1_WSGRA0_WSGRB0_WS32_WG8_8_1_WGM1_WGMXCC1_WGMXCCGn1
    SolutionIndex: 119
    SolutionNameMin: Cijk_Alik_Bljk_S_B_Bias_HA_S_SAV_UserArgs_MT96x64x32_SN_LDSB0_AFC1_AG0_AFEM1_AFEM1_ASEM1_CLR0_CADS0_DTLA0_DTLB0_DTVA0_DTVB0_DTVMXSA0_DTVMXSB0_DTVSM0_DPLB0_EPS0_ELFLR0_EMLLn1_FDSI0_GRPM1_GRVWA1_GRVWB1_GSU1_GSUAMB_GSUC0_GSUWGMRR0_GLS0_ISA1151_IU1_K1_LDSTI0_LBSPPA0_LBSPPB0_LBSPPM0_LPA1_LPB1_LPM0_LRVW1_LWPMn1_MIAV0_MO40_MGRIPM1_NTn1_NTA0_NTB0_NTC0_NTD0_NTM0_NEPBS0_NLCA1_NLCB1_ONLL1_PGR1_PLR1_PKA0_SGROB0_SIA1_SS0_SU4_SUM0_SUS256_SPO0_SRVW0_SSO0_SVW1_SK0_SKFTR0_SKXCCM0_SGRO0_TDMI0_TIN0_TT6_8_TLDS0_TLDSMn1_ULSGRO0_USL1_UIOFGRO0_UPLRP0_USFGROn1_VSn1_VWA1_VWB1_WSGRA0_WSGRB0_WS32_WG16_8_1_WGM1_WGMXCC1_WGMXCCGn1
    SolutionIndex: 120
    SolutionNameMin: Cijk_Alik_Bljk_S_B_Bias_HA_S_SAV_UserArgs_MT32x32x32_SN_LDSB0_AFC1_AG0_AFEM1_AFEM1_ASEM1_CLR0_CADS0_DTLA0_DTLB0_DTVA0_DTVB0_DTVMXSA0_DTVMXSB0_DTVSM0_DPLB0_EPS0_ELFLR0_EMLLn1_FDSI0_GRPM1_GRVWA1_GRVWB1_GSU1_GSUAMB_GSUC0_GSUWGMRR0_GLS0_ISA1151_IU1_K1_LDSTI0_LBSPPA0_LBSPPB0_LBSPPM0_LPA1_LPB1_LPM0_LRVW1_LWPMn1_MIAV0_MO40_MGRIPM1_NTn1_NTA0_NTB0_NTC0_NTD0_NTM0_NEPBS0_NLCA1_NLCB1_ONLL1_PGR1_PLR1_PKA0_SGROB0_SIA1_SS0_SU16_SUM0_SUS256_SPO0_SRVW0_SSO0_SVW1_SK0_SKFTR0_SKXCCM0_SGRO0_TDMI0_TIN0_TT4_4_TLDS0_TLDSMn1_ULSGRO0_USL1_UIOFGRO0_UPLRP0_USFGROn1_VSn1_VWA1_VWB1_WSGRA0_WSGRB0_WS32_WG8_8_1_WGM1_WGMXCC1_WGMXCCGn1
    SolutionIndex: 121
    SolutionNameMin: Cijk_Alik_Bljk_S_B_Bias_HA_S_SAV_UserArgs_MT64x32x32_SN_LDSB0_AFC1_AG0_AFEM1_AFEM1_ASEM1_CLR0_CADS0_DTLA0_DTLB0_DTVA0_DTVB0_DTVMXSA0_DTVMXSB0_DTVSM0_DPLB0_EPS0_ELFLR0_EMLLn1_FDSI0_GRPM1_GRVWA1_GRVWB1_GSU1_GSUAMB_GSUC0_GSUWGMRR0_GLS0_ISA1151_IU1_K1_LDSTI0_LBSPPA0_LBSPPB0_LBSPPM0_LPA1_LPB1_LPM0_LRVW1_LWPMn1_MIAV0_MO40_MGRIPM1_NTn1_NTA0_NTB0_NTC0_NTD0_NTM0_NEPBS0_NLCA1_NLCB1_ONLL1_PGR1_PLR1_PKA0_SGROB0_SIA1_SS0_SU16_SUM0_SUS256_SPO0_SRVW0_SSO0_SVW1_SK0_SKFTR0_SKXCCM0_SGRO0_TDMI0_TIN0_TT4_4_TLDS0_TLDSMn1_ULSGRO0_USL1_UIOFGRO0_UPLRP0_USFGROn1_VSn1_VWA1_VWB1_WSGRA0_WSGRB0_WS32_WG16_8_1_WGM1_WGMXCC1_WGMXCCGn1
    SolutionIndex: 122
    SolutionNameMin: Cijk_Alik_Bljk_S_B_Bias_HA_S_SAV_UserArgs_MT48x64x32_SN_LDSB0_AFC1_AG0_AFEM1_AFEM1_ASEM1_CLR0_CADS0_DTLA0_DTLB0_DTVA0_DTVB0_DTVMXSA0_DTVMXSB0_DTVSM0_DPLB0_EPS0_ELFLR0_EMLLn1_FDSI0_GRPM1_GRVWA1_GRVWB1_GSU1_GSUAMB_GSUC0_GSUWGMRR0_GLS0_ISA1151_IU1_K1_LDSTI0_LBSPPA0_LBSPPB0_LBSPPM0_LPA1_LPB1_LPM0_LRVW1_LWPMn1_MIAV0_MO40_MGRIPM1_NTn1_NTA0_NTB0_NTC0_NTD0_NTM0_NEPBS0_NLCA1_NLCB1_ONLL1_PGR1_PLR1_PKA0_SGROB0_SIA1_SS0_SU4_SUM0_SUS256_SPO0_SRVW0_SSO0_SVW1_SK0_SKFTR0_SKXCCM0_SGRO0_TDMI0_TIN0_TT6_8_TLDS0_TLDSMn1_ULSGRO0_USL1_UIOFGRO0_UPLRP0_USFGROn1_VSn1_VWA1_VWB1_WSGRA0_WSGRB0_WS32_WG8_8_1_WGM1_WGMXCC1_WGMXCCGn1
    SolutionIndex: 123
    SolutionNameMin: Cijk_Alik_Bljk_S_B_Bias_HA_S_SAV_UserArgs_MT32x32x32_SN_LDSB0_AFC1_AG0_AFEM1_AFEM1_ASEM1_CLR0_CADS0_DTLA0_DTLB0_DTVA0_DTVB0_DTVMXSA0_DTVMXSB0_DTVSM0_DPLB0_EPS0_ELFLR0_EMLLn1_FDSI0_GRPM1_GRVWA1_GRVWB1_GSU1_GSUAMB_GSUC0_GSUWGMRR0_GLS0_ISA1151_IU1_K1_LDSTI0_LBSPPA0_LBSPPB0_LBSPPM0_LPA1_LPB1_LPM0_LRVW1_LWPMn1_MIAV0_MO40_MGRIPM1_NTn1_NTA0_NTB0_NTC0_NTD0_NTM0_NEPBS0_NLCA1_NLCB1_ONLL1_PGR0_PLR1_PKA0_SGROB0_SIA1_SS0_SU0_SUM0_SUS0_SPO0_SRVW0_SSO0_SVW1_SK0_SKFTR0_SKXCCM0_SGRO0_TDMI0_TIN0_TT2_4_TLDS0_TLDSMn1_ULSGRO0_USL1_UIOFGRO0_UPLRP0_USFGROn1_VSn1_VWA1_VWB1_WSGRA0_WSGRB0_WS32_WG16_8_1_WGM1_WGMXCC1_WGMXCCGn1
    SolutionIndex: 124
    SolutionNameMin: Cijk_Alik_Bljk_S_B_Bias_HA_S_SAV_UserArgs_MT32x32x32_SN_LDSB0_AFC1_AG0_AFEM1_AFEM1_ASEM1_CLR0_CADS0_DTLA0_DTLB0_DTVA0_DTVB0_DTVMXSA0_DTVMXSB0_DTVSM0_DPLB0_EPS0_ELFLR0_EMLLn1_FDSI0_GRPM1_GRVWA1_GRVWB1_GSU1_GSUAMB_GSUC0_GSUWGMRR0_GLS0_ISA1151_IU1_K1_LDSTI0_LBSPPA0_LBSPPB0_LBSPPM0_LPA1_LPB1_LPM0_LRVW1_LWPMn1_MIAV0_MO40_MGRIPM1_NTn1_NTA0_NTB0_NTC0_NTD0_NTM0_NEPBS0_NLCA1_NLCB1_ONLL1_PGR1_PLR1_PKA0_SGROB0_SIA1_SS0_SU0_SUM0_SUS0_SPO0_SRVW0_SSO0_SVW1_SK0_SKFTR0_SKXCCM0_SGRO0_TDMI0_TIN0_TT2_4_TLDS0_TLDSMn1_ULSGRO0_USL1_UIOFGRO0_UPLRP0_USFGROn1_VSn1_VWA1_VWB1_WSGRA0_WSGRB0_WS32_WG16_8_1_WGM1_WGMXCC1_WGMXCCGn1
    SolutionIndex: 125
    SolutionNameMin: Cijk_Alik_Bljk_S_B_Bias_HA_S_SAV_UserArgs_MT64x32x16_SN_LDSB0_AFC1_AG0_AFEM1_AFEM1_ASEM1_CLR0_CADS0_DTLA0_DTLB0_DTVA0_DTVB0_DTVMXSA0_DTVMXSB0_DTVSM0_DPLB0_EPS0_ELFLR0_EMLLn1_FDSI0_GRPM1_GRVWA1_GRVWB1_GSU1_GSUAMB_GSUC0_GSUWGMRR0_GLS0_ISA1151_IU1_K1_LDSTI0_LBSPPA0_LBSPPB0_LBSPPM0_LPA1_LPB1_LPM0_LRVW1_LWPMn1_MIAV0_MO40_MGRIPM1_NTn1_NTA0_NTB0_NTC0_NTD0_NTM0_NEPBS0_NLCA1_NLCB1_ONLL1_PGR0_PLR1_PKA0_SGROB0_SIA1_SS0_SU0_SUM0_SUS0_SPO0_SRVW0_SSO0_SVW1_SK0_SKFTR0_SKXCCM0_SGRO0_TDMI0_TIN0_TT4_4_TLDS0_TLDSMn1_ULSGRO0_USL1_UIOFGRO0_UPLRP0_USFGROn1_VSn1_VWA1_VWB1_WSGRA0_WSGRB0_WS32_WG16_8_1_WGM1_WGMXCC1_WGMXCCGn1
    SolutionIndex: 126
    SolutionNameMin: Cijk_Alik_Bljk_S_B_Bias_HA_S_SAV_UserArgs_MT16x32x16_SN_LDSB0_AFC1_AG0_AFEM1_AFEM1_ASEM1_CLR0_CADS0_DTLA0_DTLB0_DTVA0_DTVB0_DTVMXSA0_DTVMXSB0_DTVSM0_DPLB0_EPS0_ELFLR0_EMLLn1_FDSI0_GRPM1_GRVWA1_GRVWB1_GSU1_GSUAMB_GSUC0_GSUWGMRR0_GLS0_ISA1151_IU1_K1_LDSTI0_LBSPPA0_LBSPPB0_LBSPPM0_LPA1_LPB1_LPM0_LRVW1_LWPMn1_MIAV0_MO40_MGRIPM1_NTn1_NTA0_NTB0_NTC0_NTD0_NTM0_NEPBS0_NLCA1_NLCB1_ONLL1_PGR0_PLR1_PKA0_SGROB0_SIA1_SS0_SU0_SUM0_SUS0_SPO0_SRVW0_SSO0_SVW1_SK0_SKFTR0_SKXCCM0_SGRO0_TDMI0_TIN0_TT2_4_TLDS0_TLDSMn1_ULSGRO0_USL1_UIOFGRO0_UPLRP0_USFGROn1_VSn1_VWA1_VWB1_WSGRA0_WSGRB0_WS32_WG8_8_1_WGM1_WGMXCC1_WGMXCCGn1
    SolutionIndex: 127
    SolutionNameMin: Cijk_Alik_Bljk_S_B_Bias_HA_S_SAV_UserArgs_MT64x64x32_SN_LDSB0_AFC1_AG0_AFEM1_AFEM1_ASEM1_CLR0_CADS0_DTLA0_DTLB0_DTVA0_DTVB0_DTVMXSA0_DTVMXSB0_DTVSM0_DPLB0_EPS0_ELFLR0_EMLLn1_FDSI0_GRPM1_GRVWA1_GRVWB1_GSU1_GSUAMB_GSUC0_GSUWGMRR0_GLS0_ISA1151_IU1_K1_LDSTI0_LBSPPA0_LBSPPB0_LBSPPM0_LPA1_LPB1_LPM0_LRVW1_LWPMn1_MIAV0_MO40_MGRIPM1_NTn1_NTA0_NTB0_NTC0_NTD0_NTM0_NEPBS0_NLCA1_NLCB1_ONLL1_PGR0_PLR1_PKA0_SGROB0_SIA1_SS0_SU0_SUM0_SUS0_SPO0_SRVW0_SSO0_SVW1_SK0_SKFTR0_SKXCCM0_SGRO0_TDMI0_TIN0_TT4_8_TLDS0_TLDSMn1_ULSGRO0_USL1_UIOFGRO0_UPLRP0_USFGROn1_VSn1_VWA1_VWB1_WSGRA0_WSGRB0_WS32_WG16_8_1_WGM1_WGMXCC1_WGMXCCGn1
    SolutionIndex: 128
    SolutionNameMin: Cijk_Alik_Bljk_S_B_Bias_HA_S_SAV_UserArgs_MT64x32x32_SN_LDSB0_AFC1_AG0_AFEM1_AFEM1_ASEM1_CLR0_CADS0_DTLA0_DTLB0_DTVA0_DTVB0_DTVMXSA0_DTVMXSB0_DTVSM0_DPLB0_EPS0_ELFLR0_EMLLn1_FDSI0_GRPM1_GRVWA1_GRVWB1_GSU1_GSUAMB_GSUC0_GSUWGMRR0_GLS0_ISA1151_IU1_K1_LDSTI0_LBSPPA0_LBSPPB0_LBSPPM0_LPA1_LPB1_LPM0_LRVW1_LWPMn1_MIAV0_MO40_MGRIPM1_NTn1_NTA0_NTB0_NTC0_NTD0_NTM0_NEPBS0_NLCA1_NLCB1_ONLL1_PGR0_PLR1_PKA0_SGROB0_SIA1_SS0_SU0_SUM0_SUS0_SPO0_SRVW0_SSO0_SVW1_SK0_SKFTR0_SKXCCM0_SGRO0_TDMI0_TIN0_TT4_4_TLDS0_TLDSMn1_ULSGRO0_USL1_UIOFGRO0_UPLRP0_USFGROn1_VSn1_VWA1_VWB1_WSGRA0_WSGRB0_WS32_WG16_8_1_WGM1_WGMXCC1_WGMXCCGn1
    SolutionIndex: 129
    SolutionNameMin: Cijk_Alik_Bljk_S_B_Bias_HA_S_SAV_UserArgs_MT96x64x32_SN_LDSB0_AFC1_AG0_AFEM1_AFEM1_ASEM1_CLR0_CADS0_DTLA0_DTLB0_DTVA0_DTVB0_DTVMXSA0_DTVMXSB0_DTVSM0_DPLB0_EPS0_ELFLR0_EMLLn1_FDSI0_GRPM1_GRVWA1_GRVWB1_GSU1_GSUAMB_GSUC0_GSUWGMRR0_GLS0_ISA1151_IU1_K1_LDSTI0_LBSPPA0_LBSPPB0_LBSPPM0_LPA1_LPB1_LPM0_LRVW1_LWPMn1_MIAV0_MO40_MGRIPM1_NTn1_NTA0_NTB0_NTC0_NTD0_NTM0_NEPBS0_NLCA1_NLCB1_ONLL1_PGR1_PLR1_PKA0_SGROB0_SIA1_SS0_SU0_SUM0_SUS0_SPO0_SRVW0_SSO0_SVW1_SK0_SKFTR0_SKXCCM0_SGRO0_TDMI0_TIN0_TT6_8_TLDS0_TLDSMn1_ULSGRO0_USL1_UIOFGRO0_UPLRP0_USFGROn1_VSn1_VWA1_VWB1_WSGRA0_WSGRB0_WS32_WG16_8_1_WGM1_WGMXCC1_WGMXCCGn1
    SolutionIndex: 130
    SolutionNameMin: Cijk_Alik_Bljk_S_B_Bias_HA_S_SAV_UserArgs_MT16x32x16_SN_LDSB0_AFC1_AG0_AFEM1_AFEM1_ASEM1_CLR0_CADS0_DTLA0_DTLB0_DTVA0_DTVB0_DTVMXSA0_DTVMXSB0_DTVSM0_DPLB0_EPS0_ELFLR0_EMLLn1_FDSI0_GRPM1_GRVWA1_GRVWB1_GSU1_GSUAMB_GSUC0_GSUWGMRR0_GLS0_ISA1151_IU1_K1_LDSTI0_LBSPPA0_LBSPPB0_LBSPPM0_LPA1_LPB1_LPM0_LRVW1_LWPMn1_MIAV0_MO40_MGRIPM1_NTn1_NTA0_NTB0_NTC0_NTD0_NTM0_NEPBS0_NLCA1_NLCB1_ONLL1_PGR1_PLR1_PKA0_SGROB0_SIA1_SS0_SU0_SUM0_SUS0_SPO0_SRVW0_SSO0_SVW1_SK0_SKFTR0_SKXCCM0_SGRO0_TDMI0_TIN0_TT2_4_TLDS0_TLDSMn1_ULSGRO0_USL1_UIOFGRO0_UPLRP0_USFGROn1_VSn1_VWA1_VWB1_WSGRA0_WSGRB0_WS32_WG8_8_1_WGM1_WGMXCC1_WGMXCCGn1
    SolutionIndex: 131
    SolutionNameMin: Cijk_Alik_Bljk_S_B_Bias_HA_S_SAV_UserArgs_MT32x32x16_SN_LDSB0_AFC1_AG0_AFEM1_AFEM1_ASEM1_CLR0_CADS0_DTLA0_DTLB0_DTVA0_DTVB0_DTVMXSA0_DTVMXSB0_DTVSM0_DPLB0_EPS0_ELFLR0_EMLLn1_FDSI0_GRPM1_GRVWA1_GRVWB1_GSU1_GSUAMB_GSUC0_GSUWGMRR0_GLS0_ISA1151_IU1_K1_LDSTI0_LBSPPA0_LBSPPB0_LBSPPM0_LPA1_LPB1_LPM0_LRVW1_LWPMn1_MIAV0_MO40_MGRIPM1_NTn1_NTA0_NTB0_NTC0_NTD0_NTM0_NEPBS0_NLCA1_NLCB1_ONLL1_PGR1_PLR1_PKA0_SGROB0_SIA1_SS0_SU0_SUM0_SUS0_SPO0_SRVW0_SSO0_SVW1_SK0_SKFTR0_SKXCCM0_SGRO0_TDMI0_TIN0_TT2_4_TLDS0_TLDSMn1_ULSGRO0_USL1_UIOFGRO0_UPLRP0_USFGROn1_VSn1_VWA1_VWB1_WSGRA0_WSGRB0_WS32_WG16_8_1_WGM1_WGMXCC1_WGMXCCGn1
    SolutionIndex: 132
    SolutionNameMin: Cijk_Alik_Bljk_S_B_Bias_HA_S_SAV_UserArgs_MT96x64x16_SN_LDSB0_AFC1_AG0_AFEM1_AFEM1_ASEM1_CLR0_CADS0_DTLA0_DTLB0_DTVA0_DTVB0_DTVMXSA0_DTVMXSB0_DTVSM0_DPLB0_EPS0_ELFLR0_EMLLn1_FDSI0_GRPM1_GRVWA1_GRVWB1_GSU1_GSUAMB_GSUC0_GSUWGMRR0_GLS0_ISA1151_IU1_K1_LDSTI0_LBSPPA0_LBSPPB0_LBSPPM0_LPA1_LPB1_LPM0_LRVW1_LWPMn1_MIAV0_MO40_MGRIPM1_NTn1_NTA0_NTB0_NTC0_NTD0_NTM0_NEPBS0_NLCA1_NLCB1_ONLL1_PGR1_PLR1_PKA0_SGROB0_SIA1_SS0_SU0_SUM0_SUS0_SPO0_SRVW0_SSO0_SVW1_SK0_SKFTR0_SKXCCM0_SGRO0_TDMI0_TIN0_TT6_8_TLDS0_TLDSMn1_ULSGRO0_USL1_UIOFGRO0_UPLRP0_USFGROn1_VSn1_VWA1_VWB1_WSGRA0_WSGRB0_WS32_WG16_8_1_WGM1_WGMXCC1_WGMXCCGn1
    SolutionIndex: 133
    SolutionNameMin: Cijk_Alik_Bljk_S_B_Bias_HA_S_SAV_UserArgs_MT64x32x32_SN_LDSB0_AFC1_AG0_AFEM1_AFEM1_ASEM1_CLR0_CADS0_DTLA0_DTLB0_DTVA0_DTVB0_DTVMXSA0_DTVMXSB0_DTVSM0_DPLB0_EPS0_ELFLR0_EMLLn1_FDSI0_GRPM1_GRVWA1_GRVWB1_GSU1_GSUAMB_GSUC0_GSUWGMRR0_GLS0_ISA1151_IU1_K1_LDSTI0_LBSPPA0_LBSPPB0_LBSPPM0_LPA1_LPB1_LPM0_LRVW1_LWPMn1_MIAV0_MO40_MGRIPM1_NTn1_NTA0_NTB0_NTC0_NTD0_NTM0_NEPBS0_NLCA1_NLCB1_ONLL1_PGR1_PLR1_PKA0_SGROB0_SIA1_SS0_SU0_SUM0_SUS0_SPO0_SRVW0_SSO0_SVW1_SK0_SKFTR0_SKXCCM0_SGRO0_TDMI0_TIN0_TT4_4_TLDS0_TLDSMn1_ULSGRO0_USL1_UIOFGRO0_UPLRP0_USFGROn1_VSn1_VWA1_VWB1_WSGRA0_WSGRB0_WS32_WG16_8_1_WGM1_WGMXCC1_WGMXCCGn1
    SolutionIndex: 134
    SolutionNameMin: Cijk_Alik_Bljk_S_B_Bias_HA_S_SAV_UserArgs_MT16x32x32_SN_LDSB0_AFC1_AG0_AFEM1_AFEM1_ASEM1_CLR0_CADS0_DTLA0_DTLB0_DTVA0_DTVB0_DTVMXSA0_DTVMXSB0_DTVSM0_DPLB0_EPS0_ELFLR0_EMLLn1_FDSI0_GRPM1_GRVWA1_GRVWB1_GSU1_GSUAMB_GSUC0_GSUWGMRR0_GLS0_ISA1151_IU1_K1_LDSTI0_LBSPPA0_LBSPPB0_LBSPPM0_LPA1_LPB1_LPM0_LRVW1_LWPMn1_MIAV0_MO40_MGRIPM1_NTn1_NTA0_NTB0_NTC0_NTD0_NTM0_NEPBS0_NLCA1_NLCB1_ONLL1_PGR0_PLR1_PKA0_SGROB0_SIA1_SS0_SU0_SUM0_SUS0_SPO0_SRVW0_SSO0_SVW1_SK0_SKFTR0_SKXCCM0_SGRO0_TDMI0_TIN0_TT2_4_TLDS0_TLDSMn1_ULSGRO0_USL1_UIOFGRO0_UPLRP0_USFGROn1_VSn1_VWA1_VWB1_WSGRA0_WSGRB0_WS32_WG8_8_1_WGM1_WGMXCC1_WGMXCCGn1
    SolutionIndex: 135
    SolutionNameMin: Cijk_Alik_Bljk_S_B_Bias_HA_S_SAV_UserArgs_MT64x64x32_SN_LDSB0_AFC1_AG0_AFEM1_AFEM1_ASEM1_CLR0_CADS0_DTLA0_DTLB0_DTVA0_DTVB0_DTVMXSA0_DTVMXSB0_DTVSM0_DPLB0_EPS0_ELFLR0_EMLLn1_FDSI0_GRPM1_GRVWA1_GRVWB1_GSU1_GSUAMB_GSUC0_GSUWGMRR0_GLS0_ISA1151_IU1_K1_LDSTI0_LBSPPA0_LBSPPB0_LBSPPM0_LPA1_LPB1_LPM0_LRVW1_LWPMn1_MIAV0_MO40_MGRIPM1_NTn1_NTA0_NTB0_NTC0_NTD0_NTM0_NEPBS0_NLCA1_NLCB1_ONLL1_PGR1_PLR1_PKA0_SGROB0_SIA1_SS0_SU0_SUM0_SUS0_SPO0_SRVW0_SSO0_SVW1_SK0_SKFTR0_SKXCCM0_SGRO0_TDMI0_TIN0_TT4_8_TLDS0_TLDSMn1_ULSGRO0_USL1_UIOFGRO0_UPLRP0_USFGROn1_VSn1_VWA1_VWB1_WSGRA0_WSGRB0_WS32_WG16_8_1_WGM1_WGMXCC1_WGMXCCGn1
    SolutionIndex: 136
    SolutionNameMin: Cijk_Alik_Bljk_S_B_Bias_HA_S_SAV_UserArgs_MT32x32x32_SN_LDSB0_AFC1_AG0_AFEM1_AFEM1_ASEM1_CLR0_CADS0_DTLA0_DTLB0_DTVA0_DTVB0_DTVMXSA0_DTVMXSB0_DTVSM0_DPLB0_EPS0_ELFLR0_EMLLn1_FDSI0_GRPM1_GRVWA1_GRVWB1_GSU1_GSUAMB_GSUC0_GSUWGMRR0_GLS0_ISA1151_IU1_K1_LDSTI0_LBSPPA0_LBSPPB0_LBSPPM0_LPA1_LPB1_LPM0_LRVW1_LWPMn1_MIAV0_MO40_MGRIPM1_NTn1_NTA0_NTB0_NTC0_NTD0_NTM0_NEPBS0_NLCA1_NLCB1_ONLL1_PGR0_PLR1_PKA0_SGROB0_SIA1_SS0_SU0_SUM0_SUS0_SPO0_SRVW0_SSO0_SVW1_SK0_SKFTR0_SKXCCM0_SGRO0_TDMI0_TIN0_TT4_4_TLDS0_TLDSMn1_ULSGRO0_USL1_UIOFGRO0_UPLRP0_USFGROn1_VSn1_VWA1_VWB1_WSGRA0_WSGRB0_WS32_WG8_8_1_WGM1_WGMXCC1_WGMXCCGn1
    SolutionIndex: 137
    SolutionNameMin: Cijk_Alik_Bljk_S_B_Bias_HA_S_SAV_UserArgs_MT16x32x32_SN_LDSB0_AFC1_AG0_AFEM1_AFEM1_ASEM1_CLR0_CADS0_DTLA0_DTLB0_DTVA0_DTVB0_DTVMXSA0_DTVMXSB0_DTVSM0_DPLB0_EPS0_ELFLR0_EMLLn1_FDSI0_GRPM1_GRVWA1_GRVWB1_GSU1_GSUAMB_GSUC0_GSUWGMRR0_GLS0_ISA1151_IU1_K1_LDSTI0_LBSPPA0_LBSPPB0_LBSPPM0_LPA1_LPB1_LPM0_LRVW1_LWPMn1_MIAV0_MO40_MGRIPM1_NTn1_NTA0_NTB0_NTC0_NTD0_NTM0_NEPBS0_NLCA1_NLCB1_ONLL1_PGR1_PLR1_PKA0_SGROB0_SIA1_SS0_SU0_SUM0_SUS0_SPO0_SRVW0_SSO0_SVW1_SK0_SKFTR0_SKXCCM0_SGRO0_TDMI0_TIN0_TT2_4_TLDS0_TLDSMn1_ULSGRO0_USL1_UIOFGRO0_UPLRP0_USFGROn1_VSn1_VWA1_VWB1_WSGRA0_WSGRB0_WS32_WG8_8_1_WGM1_WGMXCC1_WGMXCCGn1
    SolutionIndex: 138
    SolutionNameMin: Cijk_Alik_Bljk_S_B_Bias_HA_S_SAV_UserArgs_MT48x64x16_SN_LDSB0_AFC1_AG0_AFEM1_AFEM1_ASEM1_CLR0_CADS0_DTLA0_DTLB0_DTVA0_DTVB0_DTVMXSA0_DTVMXSB0_DTVSM0_DPLB0_EPS0_ELFLR0_EMLLn1_FDSI0_GRPM1_GRVWA1_GRVWB1_GSU1_GSUAMB_GSUC0_GSUWGMRR0_GLS0_ISA1151_IU1_K1_LDSTI0_LBSPPA0_LBSPPB0_LBSPPM0_LPA1_LPB1_LPM0_LRVW1_LWPMn1_MIAV0_MO40_MGRIPM1_NTn1_NTA0_NTB0_NTC0_NTD0_NTM0_NEPBS0_NLCA1_NLCB1_ONLL1_PGR1_PLR1_PKA0_SGROB0_SIA1_SS0_SU0_SUM0_SUS0_SPO0_SRVW0_SSO0_SVW1_SK0_SKFTR0_SKXCCM0_SGRO0_TDMI0_TIN0_TT6_8_TLDS0_TLDSMn1_ULSGRO0_USL1_UIOFGRO0_UPLRP0_USFGROn1_VSn1_VWA1_VWB1_WSGRA0_WSGRB0_WS32_WG8_8_1_WGM1_WGMXCC1_WGMXCCGn1
    SolutionIndex: 139
    SolutionNameMin: Cijk_Alik_Bljk_S_B_Bias_HA_S_SAV_UserArgs_MT128x32x16_SN_LDSB0_AFC1_AG0_AFEM1_AFEM1_ASEM1_CLR0_CADS0_DTLA0_DTLB0_DTVA0_DTVB0_DTVMXSA0_DTVMXSB0_DTVSM0_DPLB0_EPS0_ELFLR0_EMLLn1_FDSI0_GRPM1_GRVWA1_GRVWB1_GSU1_GSUAMB_GSUC0_GSUWGMRR0_GLS0_ISA1151_IU1_K1_LDSTI0_LBSPPA0_LBSPPB0_LBSPPM0_LPA1_LPB1_LPM0_LRVW1_LWPMn1_MIAV0_MO40_MGRIPM1_NTn1_NTA0_NTB0_NTC0_NTD0_NTM0_NEPBS0_NLCA1_NLCB1_ONLL1_PGR1_PLR1_PKA0_SGROB0_SIA1_SS0_SU0_SUM0_SUS0_SPO0_SRVW0_SSO0_SVW1_SK0_SKFTR0_SKXCCM0_SGRO0_TDMI0_TIN0_TT8_4_TLDS0_TLDSMn1_ULSGRO0_USL1_UIOFGRO0_UPLRP0_USFGROn1_VSn1_VWA1_VWB1_WSGRA0_WSGRB0_WS32_WG16_8_1_WGM1_WGMXCC1_WGMXCCGn1
    SolutionIndex: 140
    SolutionNameMin: Cijk_Alik_Bljk_S_B_Bias_HA_S_SAV_UserArgs_MT16x32x128_SN_LDSB0_AFC1_AG0_AFEM1_AFEM1_ASEM1_CLR0_CADS0_DTLA0_DTLB0_DTVA0_DTVB0_DTVMXSA0_DTVMXSB0_DTVSM0_DPLB0_EPS0_ELFLR0_EMLLn1_FDSI0_GRPM1_GRVWA1_GRVWB1_GSU1_GSUAMB_GSUC0_GSUWGMRR0_GLS0_ISA1151_IU1_K1_LDSTI0_LBSPPA0_LBSPPB0_LBSPPM0_LPA1_LPB1_LPM0_LRVW1_LWPMn1_MIAV0_MO40_MGRIPM1_NTn1_NTA0_NTB0_NTC0_NTD0_NTM0_NEPBS0_NLCA2_NLCB2_ONLL1_PGR0_PLR1_PKA0_SGROB0_SIA1_SS0_SU0_SUM0_SUS0_SPO0_SRVW0_SSO0_SVW1_SK0_SKFTR0_SKXCCM0_SGRO0_TDMI0_TIN0_TT2_4_TLDS0_TLDSMn1_ULSGRO0_USL1_UIOFGRO0_UPLRP0_USFGROn1_VSn1_VWA1_VWB1_WSGRA0_WSGRB0_WS32_WG8_8_1_WGM1_WGMXCC1_WGMXCCGn1
    SolutionIndex: 141
    SolutionNameMin: Cijk_Alik_Bljk_S_B_Bias_HA_S_SAV_UserArgs_MT128x32x32_SN_LDSB0_AFC1_AG0_AFEM1_AFEM1_ASEM1_CLR0_CADS0_DTLA0_DTLB0_DTVA0_DTVB0_DTVMXSA0_DTVMXSB0_DTVSM0_DPLB0_EPS0_ELFLR0_EMLLn1_FDSI0_GRPM1_GRVWA1_GRVWB1_GSU1_GSUAMB_GSUC0_GSUWGMRR0_GLS0_ISA1151_IU1_K1_LDSTI0_LBSPPA0_LBSPPB0_LBSPPM0_LPA1_LPB1_LPM0_LRVW1_LWPMn1_MIAV0_MO40_MGRIPM1_NTn1_NTA0_NTB0_NTC0_NTD0_NTM0_NEPBS0_NLCA1_NLCB1_ONLL1_PGR1_PLR1_PKA0_SGROB0_SIA1_SS0_SU8_SUM0_SUS256_SPO0_SRVW0_SSO0_SVW1_SK0_SKFTR0_SKXCCM0_SGRO0_TDMI0_TIN0_TT8_4_TLDS0_TLDSMn1_ULSGRO0_USL1_UIOFGRO0_UPLRP0_USFGROn1_VSn1_VWA1_VWB1_WSGRA0_WSGRB0_WS32_WG16_8_1_WGM1_WGMXCC1_WGMXCCGn1
    SolutionIndex: 142
    SolutionNameMin: Cijk_Alik_Bljk_S_B_Bias_HA_S_SAV_UserArgs_MT64x32x32_SN_LDSB0_AFC1_AG0_AFEM1_AFEM1_ASEM1_CLR0_CADS0_DTLA0_DTLB0_DTVA0_DTVB0_DTVMXSA0_DTVMXSB0_DTVSM0_DPLB0_EPS0_ELFLR0_EMLLn1_FDSI0_GRPM1_GRVWA1_GRVWB1_GSU1_GSUAMB_GSUC0_GSUWGMRR0_GLS0_ISA1151_IU1_K1_LDSTI0_LBSPPA0_LBSPPB0_LBSPPM0_LPA1_LPB1_LPM0_LRVW1_LWPMn1_MIAV0_MO40_MGRIPM1_NTn1_NTA0_NTB0_NTC0_NTD0_NTM0_NEPBS0_NLCA1_NLCB1_ONLL1_PGR0_PLR1_PKA0_SGROB0_SIA1_SS0_SU8_SUM0_SUS256_SPO0_SRVW0_SSO0_SVW1_SK0_SKFTR0_SKXCCM0_SGRO0_TDMI0_TIN0_TT8_4_TLDS0_TLDSMn1_ULSGRO0_USL1_UIOFGRO0_UPLRP0_USFGROn1_VSn1_VWA1_VWB1_WSGRA0_WSGRB0_WS32_WG8_8_1_WGM1_WGMXCC1_WGMXCCGn1
    SolutionIndex: 143
    SolutionNameMin: Cijk_Alik_Bljk_S_B_Bias_HA_S_SAV_UserArgs_MT32x64x32_SN_LDSB0_AFC1_AG0_AFEM1_AFEM1_ASEM1_CLR0_CADS0_DTLA0_DTLB0_DTVA0_DTVB0_DTVMXSA0_DTVMXSB0_DTVSM0_DPLB0_EPS0_ELFLR0_EMLLn1_FDSI0_GRPM1_GRVWA1_GRVWB1_GSU1_GSUAMB_GSUC0_GSUWGMRR0_GLS0_ISA1151_IU1_K1_LDSTI0_LBSPPA0_LBSPPB0_LBSPPM0_LPA1_LPB1_LPM0_LRVW1_LWPMn1_MIAV0_MO40_MGRIPM1_NTn1_NTA0_NTB0_NTC0_NTD0_NTM0_NEPBS0_NLCA1_NLCB1_ONLL1_PGR1_PLR1_PKA0_SGROB0_SIA1_SS0_SU8_SUM0_SUS256_SPO0_SRVW0_SSO0_SVW1_SK0_SKFTR0_SKXCCM0_SGRO0_TDMI0_TIN0_TT4_8_TLDS0_TLDSMn1_ULSGRO0_USL1_UIOFGRO0_UPLRP0_USFGROn1_VSn1_VWA1_VWB1_WSGRA0_WSGRB0_WS32_WG8_8_1_WGM1_WGMXCC1_WGMXCCGn1
    SolutionIndex: 144
    SolutionNameMin: Cijk_Alik_Bljk_S_B_Bias_HA_S_SAV_UserArgs_MT128x32x32_SN_LDSB0_AFC1_AG0_AFEM1_AFEM1_ASEM1_CLR0_CADS0_DTLA0_DTLB0_DTVA0_DTVB0_DTVMXSA0_DTVMXSB0_DTVSM0_DPLB0_EPS0_ELFLR0_EMLLn1_FDSI0_GRPM1_GRVWA1_GRVWB1_GSU1_GSUAMB_GSUC0_GSUWGMRR0_GLS0_ISA1151_IU1_K1_LDSTI0_LBSPPA0_LBSPPB0_LBSPPM0_LPA1_LPB1_LPM0_LRVW1_LWPMn1_MIAV0_MO40_MGRIPM1_NTn1_NTA0_NTB0_NTC0_NTD0_NTM0_NEPBS0_NLCA1_NLCB1_ONLL1_PGR1_PLR1_PKA0_SGROB0_SIA1_SS0_SU0_SUM0_SUS0_SPO0_SRVW0_SSO0_SVW1_SK0_SKFTR0_SKXCCM0_SGRO0_TDMI0_TIN0_TT8_4_TLDS0_TLDSMn1_ULSGRO0_USL1_UIOFGRO0_UPLRP0_USFGROn1_VSn1_VWA1_VWB1_WSGRA0_WSGRB0_WS32_WG16_8_1_WGM1_WGMXCC1_WGMXCCGn1
    SolutionIndex: 145
    SolutionNameMin: Cijk_Alik_Bljk_S_B_Bias_HA_S_SAV_UserArgs_MT128x32x32_SN_LDSB0_AFC1_AG0_AFEM1_AFEM1_ASEM1_CLR0_CADS0_DTLA0_DTLB0_DTVA0_DTVB0_DTVMXSA0_DTVMXSB0_DTVSM0_DPLB0_EPS0_ELFLR0_EMLLn1_FDSI0_GRPM1_GRVWA1_GRVWB1_GSU1_GSUAMB_GSUC0_GSUWGMRR0_GLS0_ISA1151_IU1_K1_LDSTI0_LBSPPA0_LBSPPB0_LBSPPM0_LPA1_LPB1_LPM0_LRVW1_LWPMn1_MIAV0_MO40_MGRIPM1_NTn1_NTA0_NTB0_NTC0_NTD0_NTM0_NEPBS0_NLCA1_NLCB1_ONLL1_PGR0_PLR1_PKA0_SGROB0_SIA1_SS0_SU8_SUM0_SUS256_SPO0_SRVW0_SSO0_SVW1_SK0_SKFTR0_SKXCCM0_SGRO0_TDMI0_TIN0_TT8_4_TLDS0_TLDSMn1_ULSGRO0_USL1_UIOFGRO0_UPLRP0_USFGROn1_VSn1_VWA1_VWB1_WSGRA0_WSGRB0_WS32_WG16_8_1_WGM1_WGMXCC1_WGMXCCGn1
    SolutionIndex: 146
    SolutionNameMin: Cijk_Alik_Bljk_S_B_Bias_HA_S_SAV_UserArgs_MT128x32x32_SN_LDSB0_AFC1_AG0_AFEM1_AFEM1_ASEM1_CLR0_CADS0_DTLA0_DTLB0_DTVA0_DTVB0_DTVMXSA0_DTVMXSB0_DTVSM0_DPLB0_EPS0_ELFLR0_EMLLn1_FDSI0_GRPM1_GRVWA1_GRVWB1_GSU1_GSUAMB_GSUC0_GSUWGMRR0_GLS0_ISA1151_IU1_K1_LDSTI0_LBSPPA0_LBSPPB0_LBSPPM0_LPA1_LPB1_LPM0_LRVW1_LWPMn1_MIAV0_MO40_MGRIPM1_NTn1_NTA0_NTB0_NTC0_NTD0_NTM0_NEPBS0_NLCA1_NLCB1_ONLL1_PGR1_PLR1_PKA0_SGROB0_SIA1_SS0_SU4_SUM0_SUS256_SPO0_SRVW0_SSO0_SVW1_SK0_SKFTR0_SKXCCM0_SGRO0_TDMI0_TIN0_TT8_4_TLDS0_TLDSMn1_ULSGRO0_USL1_UIOFGRO0_UPLRP0_USFGROn1_VSn1_VWA1_VWB1_WSGRA0_WSGRB0_WS32_WG16_8_1_WGM1_WGMXCC1_WGMXCCGn1
    SolutionIndex: 147
    SolutionNameMin: Cijk_Alik_Bljk_S_B_Bias_HA_S_SAV_UserArgs_MT64x64x32_SN_LDSB0_AFC1_AG0_AFEM1_AFEM1_ASEM1_CLR0_CADS0_DTLA0_DTLB0_DTVA0_DTVB0_DTVMXSA0_DTVMXSB0_DTVSM0_DPLB0_EPS0_ELFLR0_EMLLn1_FDSI0_GRPM1_GRVWA1_GRVWB1_GSU1_GSUAMB_GSUC0_GSUWGMRR0_GLS0_ISA1151_IU1_K1_LDSTI0_LBSPPA0_LBSPPB0_LBSPPM0_LPA1_LPB1_LPM0_LRVW1_LWPMn1_MIAV0_MO40_MGRIPM1_NTn1_NTA0_NTB0_NTC0_NTD0_NTM0_NEPBS0_NLCA1_NLCB1_ONLL1_PGR1_PLR1_PKA0_SGROB0_SIA1_SS0_SU16_SUM0_SUS256_SPO0_SRVW0_SSO0_SVW1_SK0_SKFTR0_SKXCCM0_SGRO0_TDMI0_TIN0_TT4_8_TLDS0_TLDSMn1_ULSGRO0_USL1_UIOFGRO0_UPLRP0_USFGROn1_VSn1_VWA1_VWB1_WSGRA0_WSGRB0_WS32_WG16_8_1_WGM1_WGMXCC1_WGMXCCGn1
    SolutionIndex: 148
    SolutionNameMin: Cijk_Alik_Bljk_S_B_Bias_HA_S_SAV_UserArgs_MT96x64x32_SN_LDSB0_AFC1_AG0_AFEM1_AFEM1_ASEM1_CLR0_CADS0_DTLA0_DTLB0_DTVA0_DTVB0_DTVMXSA0_DTVMXSB0_DTVSM0_DPLB0_EPS0_ELFLR0_EMLLn1_FDSI0_GRPM1_GRVWA1_GRVWB1_GSU1_GSUAMB_GSUC0_GSUWGMRR0_GLS0_ISA1151_IU1_K1_LDSTI0_LBSPPA0_LBSPPB0_LBSPPM0_LPA1_LPB1_LPM0_LRVW1_LWPMn1_MIAV0_MO40_MGRIPM1_NTn1_NTA0_NTB0_NTC0_NTD0_NTM0_NEPBS0_NLCA1_NLCB1_ONLL1_PGR1_PLR1_PKA0_SGROB0_SIA1_SS0_SU16_SUM0_SUS256_SPO0_SRVW0_SSO0_SVW1_SK0_SKFTR0_SKXCCM0_SGRO0_TDMI0_TIN0_TT6_8_TLDS0_TLDSMn1_ULSGRO0_USL1_UIOFGRO0_UPLRP0_USFGROn1_VSn1_VWA1_VWB1_WSGRA0_WSGRB0_WS32_WG16_8_1_WGM1_WGMXCC1_WGMXCCGn1
    SolutionIndex: 149
    SolutionNameMin: Cijk_Alik_Bljk_S_B_Bias_HA_S_SAV_UserArgs_MT64x32x32_SN_LDSB0_AFC1_AG0_AFEM1_AFEM1_ASEM1_CLR0_CADS0_DTLA0_DTLB0_DTVA0_DTVB0_DTVMXSA0_DTVMXSB0_DTVSM0_DPLB0_EPS0_ELFLR0_EMLLn1_FDSI0_GRPM1_GRVWA1_GRVWB1_GSU1_GSUAMB_GSUC0_GSUWGMRR0_GLS0_ISA1151_IU1_K1_LDSTI0_LBSPPA0_LBSPPB0_LBSPPM0_LPA1_LPB1_LPM0_LRVW1_LWPMn1_MIAV0_MO40_MGRIPM1_NTn1_NTA0_NTB0_NTC0_NTD0_NTM0_NEPBS0_NLCA1_NLCB1_ONLL1_PGR0_PLR1_PKA0_SGROB0_SIA1_SS0_SU4_SUM0_SUS256_SPO0_SRVW0_SSO0_SVW1_SK0_SKFTR0_SKXCCM0_SGRO0_TDMI0_TIN0_TT8_4_TLDS0_TLDSMn1_ULSGRO0_USL1_UIOFGRO0_UPLRP0_USFGROn1_VSn1_VWA1_VWB1_WSGRA0_WSGRB0_WS32_WG8_8_1_WGM1_WGMXCC1_WGMXCCGn1
    SolutionIndex: 150
    SolutionNameMin: Cijk_Alik_Bljk_S_B_Bias_HA_S_SAV_UserArgs_MT128x64x32_SN_LDSB0_AFC1_AG0_AFEM1_AFEM1_ASEM1_CLR0_CADS0_DTLA0_DTLB0_DTVA0_DTVB0_DTVMXSA0_DTVMXSB0_DTVSM0_DPLB0_EPS0_ELFLR0_EMLLn1_FDSI0_GRPM1_GRVWA1_GRVWB1_GSU1_GSUAMB_GSUC0_GSUWGMRR0_GLS0_ISA1151_IU1_K1_LDSTI0_LBSPPA0_LBSPPB0_LBSPPM0_LPA1_LPB1_LPM0_LRVW1_LWPMn1_MIAV0_MO40_MGRIPM1_NTn1_NTA0_NTB0_NTC0_NTD0_NTM0_NEPBS0_NLCA1_NLCB1_ONLL1_PGR1_PLR1_PKA0_SGROB0_SIA1_SS0_SU4_SUM0_SUS256_SPO0_SRVW0_SSO0_SVW1_SK0_SKFTR0_SKXCCM0_SGRO0_TDMI0_TIN0_TT8_8_TLDS0_TLDSMn1_ULSGRO0_USL1_UIOFGRO0_UPLRP0_USFGROn1_VSn1_VWA1_VWB1_WSGRA0_WSGRB0_WS32_WG16_8_1_WGM1_WGMXCC1_WGMXCCGn1
    SolutionIndex: 151
    SolutionNameMin: Cijk_Alik_Bljk_S_B_Bias_HA_S_SAV_UserArgs_MT128x64x32_SN_LDSB0_AFC1_AG0_AFEM1_AFEM1_ASEM1_CLR0_CADS0_DTLA0_DTLB0_DTVA0_DTVB0_DTVMXSA0_DTVMXSB0_DTVSM0_DPLB0_EPS0_ELFLR0_EMLLn1_FDSI0_GRPM1_GRVWA1_GRVWB1_GSU1_GSUAMB_GSUC0_GSUWGMRR0_GLS0_ISA1151_IU1_K1_LDSTI0_LBSPPA0_LBSPPB0_LBSPPM0_LPA1_LPB1_LPM0_LRVW1_LWPMn1_MIAV0_MO40_MGRIPM1_NTn1_NTA0_NTB0_NTC0_NTD0_NTM0_NEPBS0_NLCA1_NLCB1_ONLL1_PGR1_PLR1_PKA0_SGROB0_SIA1_SS0_SU16_SUM0_SUS256_SPO0_SRVW0_SSO0_SVW1_SK0_SKFTR0_SKXCCM0_SGRO0_TDMI0_TIN0_TT8_8_TLDS0_TLDSMn1_ULSGRO0_USL1_UIOFGRO0_UPLRP0_USFGROn1_VSn1_VWA1_VWB1_WSGRA0_WSGRB0_WS32_WG16_8_1_WGM1_WGMXCC1_WGMXCCGn1
    SolutionIndex: 152
    SolutionNameMin: Cijk_Alik_Bljk_S_B_Bias_HA_S_SAV_UserArgs_MT64x64x32_SN_LDSB0_AFC1_AG0_AFEM1_AFEM1_ASEM1_CLR0_CADS0_DTLA0_DTLB0_DTVA0_DTVB0_DTVMXSA0_DTVMXSB0_DTVSM0_DPLB0_EPS0_ELFLR0_EMLLn1_FDSI0_GRPM1_GRVWA1_GRVWB1_GSU1_GSUAMB_GSUC0_GSUWGMRR0_GLS0_ISA1151_IU1_K1_LDSTI0_LBSPPA0_LBSPPB0_LBSPPM0_LPA1_LPB1_LPM0_LRVW1_LWPMn1_MIAV0_MO40_MGRIPM1_NTn1_NTA0_NTB0_NTC0_NTD0_NTM0_NEPBS0_NLCA1_NLCB1_ONLL1_PGR0_PLR1_PKA0_SGROB0_SIA1_SS0_SU8_SUM0_SUS256_SPO0_SRVW0_SSO0_SVW1_SK0_SKFTR0_SKXCCM0_SGRO0_TDMI0_TIN0_TT4_8_TLDS0_TLDSMn1_ULSGRO0_USL1_UIOFGRO0_UPLRP0_USFGROn1_VSn1_VWA1_VWB1_WSGRA0_WSGRB0_WS32_WG16_8_1_WGM1_WGMXCC1_WGMXCCGn1
    SolutionIndex: 153
    SolutionNameMin: Cijk_Alik_Bljk_S_B_Bias_HA_S_SAV_UserArgs_MT64x64x32_SN_LDSB0_AFC1_AG0_AFEM1_AFEM1_ASEM1_CLR0_CADS0_DTLA0_DTLB0_DTVA0_DTVB0_DTVMXSA0_DTVMXSB0_DTVSM0_DPLB0_EPS0_ELFLR0_EMLLn1_FDSI0_GRPM1_GRVWA1_GRVWB1_GSU1_GSUAMB_GSUC0_GSUWGMRR0_GLS0_ISA1151_IU1_K1_LDSTI0_LBSPPA0_LBSPPB0_LBSPPM0_LPA1_LPB1_LPM0_LRVW1_LWPMn1_MIAV0_MO40_MGRIPM1_NTn1_NTA0_NTB0_NTC0_NTD0_NTM0_NEPBS0_NLCA1_NLCB1_ONLL1_PGR0_PLR1_PKA0_SGROB0_SIA1_SS0_SU16_SUM0_SUS256_SPO0_SRVW0_SSO0_SVW1_SK0_SKFTR0_SKXCCM0_SGRO0_TDMI0_TIN0_TT4_8_TLDS0_TLDSMn1_ULSGRO0_USL1_UIOFGRO0_UPLRP0_USFGROn1_VSn1_VWA1_VWB1_WSGRA0_WSGRB0_WS32_WG16_8_1_WGM1_WGMXCC1_WGMXCCGn1
    SolutionIndex: 154
    SolutionNameMin: Cijk_Alik_Bljk_S_B_Bias_HA_S_SAV_UserArgs_MT64x32x32_SN_LDSB0_AFC1_AG0_AFEM1_AFEM1_ASEM1_CLR0_CADS0_DTLA0_DTLB0_DTVA0_DTVB0_DTVMXSA0_DTVMXSB0_DTVSM0_DPLB0_EPS0_ELFLR0_EMLLn1_FDSI0_GRPM1_GRVWA1_GRVWB1_GSU1_GSUAMB_GSUC0_GSUWGMRR0_GLS0_ISA1151_IU1_K1_LDSTI0_LBSPPA0_LBSPPB0_LBSPPM0_LPA1_LPB1_LPM0_LRVW1_LWPMn1_MIAV0_MO40_MGRIPM1_NTn1_NTA0_NTB0_NTC0_NTD0_NTM0_NEPBS0_NLCA1_NLCB1_ONLL1_PGR1_PLR1_PKA0_SGROB0_SIA1_SS0_SU4_SUM0_SUS256_SPO0_SRVW0_SSO0_SVW1_SK0_SKFTR0_SKXCCM0_SGRO0_TDMI0_TIN0_TT8_4_TLDS0_TLDSMn1_ULSGRO0_USL1_UIOFGRO0_UPLRP0_USFGROn1_VSn1_VWA1_VWB1_WSGRA0_WSGRB0_WS32_WG8_8_1_WGM1_WGMXCC1_WGMXCCGn1
    SolutionIndex: 155
    SolutionNameMin: Cijk_Alik_Bljk_S_B_Bias_HA_S_SAV_UserArgs_MT64x32x32_SN_LDSB0_AFC1_AG0_AFEM1_AFEM1_ASEM1_CLR0_CADS0_DTLA0_DTLB0_DTVA0_DTVB0_DTVMXSA0_DTVMXSB0_DTVSM0_DPLB0_EPS0_ELFLR0_EMLLn1_FDSI0_GRPM1_GRVWA1_GRVWB1_GSU1_GSUAMB_GSUC0_GSUWGMRR0_GLS0_ISA1151_IU1_K1_LDSTI0_LBSPPA0_LBSPPB0_LBSPPM0_LPA1_LPB1_LPM0_LRVW1_LWPMn1_MIAV0_MO40_MGRIPM1_NTn1_NTA0_NTB0_NTC0_NTD0_NTM0_NEPBS0_NLCA1_NLCB1_ONLL1_PGR1_PLR1_PKA0_SGROB0_SIA1_SS0_SU16_SUM0_SUS256_SPO0_SRVW0_SSO0_SVW1_SK0_SKFTR0_SKXCCM0_SGRO0_TDMI0_TIN0_TT8_4_TLDS0_TLDSMn1_ULSGRO0_USL1_UIOFGRO0_UPLRP0_USFGROn1_VSn1_VWA1_VWB1_WSGRA0_WSGRB0_WS32_WG8_8_1_WGM1_WGMXCC1_WGMXCCGn1
    SolutionIndex: 156
    SolutionNameMin: Cijk_Alik_Bljk_S_B_Bias_HA_S_SAV_UserArgs_MT128x64x32_SN_LDSB0_AFC1_AG0_AFEM1_AFEM1_ASEM1_CLR0_CADS0_DTLA0_DTLB0_DTVA0_DTVB0_DTVMXSA0_DTVMXSB0_DTVSM0_DPLB0_EPS0_ELFLR0_EMLLn1_FDSI0_GRPM1_GRVWA1_GRVWB1_GSU1_GSUAMB_GSUC0_GSUWGMRR0_GLS0_ISA1151_IU1_K1_LDSTI0_LBSPPA0_LBSPPB0_LBSPPM0_LPA1_LPB1_LPM0_LRVW1_LWPMn1_MIAV0_MO40_MGRIPM1_NTn1_NTA0_NTB0_NTC0_NTD0_NTM0_NEPBS0_NLCA1_NLCB1_ONLL1_PGR0_PLR1_PKA0_SGROB0_SIA1_SS0_SU8_SUM0_SUS256_SPO0_SRVW0_SSO0_SVW1_SK0_SKFTR0_SKXCCM0_SGRO0_TDMI0_TIN0_TT8_8_TLDS0_TLDSMn1_ULSGRO0_USL1_UIOFGRO0_UPLRP0_USFGROn1_VSn1_VWA1_VWB1_WSGRA0_WSGRB0_WS32_WG16_8_1_WGM1_WGMXCC1_WGMXCCGn1
    SolutionIndex: 157
    SolutionNameMin: Cijk_Alik_Bljk_S_B_Bias_HA_S_SAV_UserArgs_MT128x64x32_SN_LDSB0_AFC1_AG0_AFEM1_AFEM1_ASEM1_CLR0_CADS0_DTLA0_DTLB0_DTVA0_DTVB0_DTVMXSA0_DTVMXSB0_DTVSM0_DPLB0_EPS0_ELFLR0_EMLLn1_FDSI0_GRPM1_GRVWA1_GRVWB1_GSU1_GSUAMB_GSUC0_GSUWGMRR0_GLS0_ISA1151_IU1_K1_LDSTI0_LBSPPA0_LBSPPB0_LBSPPM0_LPA1_LPB1_LPM0_LRVW1_LWPMn1_MIAV0_MO40_MGRIPM1_NTn1_NTA0_NTB0_NTC0_NTD0_NTM0_NEPBS0_NLCA1_NLCB1_ONLL1_PGR1_PLR1_PKA0_SGROB0_SIA1_SS0_SU8_SUM0_SUS256_SPO0_SRVW0_SSO0_SVW1_SK0_SKFTR0_SKXCCM0_SGRO0_TDMI0_TIN0_TT8_8_TLDS0_TLDSMn1_ULSGRO0_USL1_UIOFGRO0_UPLRP0_USFGROn1_VSn1_VWA1_VWB1_WSGRA0_WSGRB0_WS32_WG16_8_1_WGM1_WGMXCC1_WGMXCCGn1
    SolutionIndex: 158
    SolutionNameMin: Cijk_Alik_Bljk_S_B_Bias_HA_S_SAV_UserArgs_MT128x64x32_SN_LDSB0_AFC1_AG0_AFEM1_AFEM1_ASEM1_CLR0_CADS0_DTLA0_DTLB0_DTVA0_DTVB0_DTVMXSA0_DTVMXSB0_DTVSM0_DPLB0_EPS0_ELFLR0_EMLLn1_FDSI0_GRPM1_GRVWA1_GRVWB1_GSU1_GSUAMB_GSUC0_GSUWGMRR0_GLS0_ISA1151_IU1_K1_LDSTI0_LBSPPA0_LBSPPB0_LBSPPM0_LPA1_LPB1_LPM0_LRVW1_LWPMn1_MIAV0_MO40_MGRIPM1_NTn1_NTA0_NTB0_NTC0_NTD0_NTM0_NEPBS0_NLCA1_NLCB1_ONLL1_PGR0_PLR1_PKA0_SGROB0_SIA1_SS0_SU16_SUM0_SUS256_SPO0_SRVW0_SSO0_SVW1_SK0_SKFTR0_SKXCCM0_SGRO0_TDMI0_TIN0_TT8_8_TLDS0_TLDSMn1_ULSGRO0_USL1_UIOFGRO0_UPLRP0_USFGROn1_VSn1_VWA1_VWB1_WSGRA0_WSGRB0_WS32_WG16_8_1_WGM1_WGMXCC1_WGMXCCGn1
    SolutionIndex: 159
    SolutionNameMin: Cijk_Alik_Bljk_S_B_Bias_HA_S_SAV_UserArgs_MT128x64x32_SN_LDSB0_AFC1_AG0_AFEM1_AFEM1_ASEM1_CLR0_CADS0_DTLA0_DTLB0_DTVA0_DTVB0_DTVMXSA0_DTVMXSB0_DTVSM0_DPLB0_EPS0_ELFLR0_EMLLn1_FDSI0_GRPM1_GRVWA1_GRVWB1_GSU1_GSUAMB_GSUC0_GSUWGMRR0_GLS0_ISA1151_IU1_K1_LDSTI0_LBSPPA0_LBSPPB0_LBSPPM0_LPA1_LPB1_LPM0_LRVW1_LWPMn1_MIAV0_MO40_MGRIPM1_NTn1_NTA0_NTB0_NTC0_NTD0_NTM0_NEPBS0_NLCA1_NLCB1_ONLL1_PGR0_PLR1_PKA0_SGROB0_SIA1_SS0_SU4_SUM0_SUS256_SPO0_SRVW0_SSO0_SVW1_SK0_SKFTR0_SKXCCM0_SGRO0_TDMI0_TIN0_TT8_8_TLDS0_TLDSMn1_ULSGRO0_USL1_UIOFGRO0_UPLRP0_USFGROn1_VSn1_VWA1_VWB1_WSGRA0_WSGRB0_WS32_WG16_8_1_WGM1_WGMXCC1_WGMXCCGn1
    SolutionIndex: 160
    SolutionNameMin: Cijk_Alik_Bljk_S_B_Bias_HA_S_SAV_UserArgs_MT48x64x32_SN_LDSB0_AFC1_AG0_AFEM1_AFEM1_ASEM1_CLR0_CADS0_DTLA0_DTLB0_DTVA0_DTVB0_DTVMXSA0_DTVMXSB0_DTVSM0_DPLB0_EPS0_ELFLR0_EMLLn1_FDSI0_GRPM1_GRVWA1_GRVWB1_GSU1_GSUAMB_GSUC0_GSUWGMRR0_GLS0_ISA1151_IU1_K1_LDSTI0_LBSPPA0_LBSPPB0_LBSPPM0_LPA1_LPB1_LPM0_LRVW1_LWPMn1_MIAV0_MO40_MGRIPM1_NTn1_NTA0_NTB0_NTC0_NTD0_NTM0_NEPBS0_NLCA1_NLCB1_ONLL1_PGR0_PLR1_PKA0_SGROB0_SIA1_SS0_SU16_SUM0_SUS256_SPO0_SRVW0_SSO0_SVW1_SK0_SKFTR0_SKXCCM0_SGRO0_TDMI0_TIN0_TT6_8_TLDS0_TLDSMn1_ULSGRO0_USL1_UIOFGRO0_UPLRP0_USFGROn1_VSn1_VWA1_VWB1_WSGRA0_WSGRB0_WS32_WG8_8_1_WGM1_WGMXCC1_WGMXCCGn1
    SolutionIndex: 161
    SolutionNameMin: Cijk_Alik_Bljk_S_B_Bias_HA_S_SAV_UserArgs_MT48x64x32_SN_LDSB0_AFC1_AG0_AFEM1_AFEM1_ASEM1_CLR0_CADS0_DTLA0_DTLB0_DTVA0_DTVB0_DTVMXSA0_DTVMXSB0_DTVSM0_DPLB0_EPS0_ELFLR0_EMLLn1_FDSI0_GRPM1_GRVWA1_GRVWB1_GSU1_GSUAMB_GSUC0_GSUWGMRR0_GLS0_ISA1151_IU1_K1_LDSTI0_LBSPPA0_LBSPPB0_LBSPPM0_LPA1_LPB1_LPM0_LRVW1_LWPMn1_MIAV0_MO40_MGRIPM1_NTn1_NTA0_NTB0_NTC0_NTD0_NTM0_NEPBS0_NLCA1_NLCB1_ONLL1_PGR0_PLR1_PKA0_SGROB0_SIA1_SS0_SU4_SUM0_SUS256_SPO0_SRVW0_SSO0_SVW1_SK0_SKFTR0_SKXCCM0_SGRO0_TDMI0_TIN0_TT6_8_TLDS0_TLDSMn1_ULSGRO0_USL1_UIOFGRO0_UPLRP0_USFGROn1_VSn1_VWA1_VWB1_WSGRA0_WSGRB0_WS32_WG8_8_1_WGM1_WGMXCC1_WGMXCCGn1
    SolutionIndex: 162
    SolutionNameMin: Cijk_Alik_Bljk_S_B_Bias_HA_S_SAV_UserArgs_MT64x32x32_SN_LDSB0_AFC1_AG0_AFEM1_AFEM1_ASEM1_CLR0_CADS0_DTLA0_DTLB0_DTVA0_DTVB0_DTVMXSA0_DTVMXSB0_DTVSM0_DPLB0_EPS0_ELFLR0_EMLLn1_FDSI0_GRPM1_GRVWA1_GRVWB1_GSU1_GSUAMB_GSUC0_GSUWGMRR0_GLS0_ISA1151_IU1_K1_LDSTI0_LBSPPA0_LBSPPB0_LBSPPM0_LPA1_LPB1_LPM0_LRVW1_LWPMn1_MIAV0_MO40_MGRIPM1_NTn1_NTA0_NTB0_NTC0_NTD0_NTM0_NEPBS0_NLCA1_NLCB1_ONLL1_PGR0_PLR1_PKA0_SGROB0_SIA1_SS0_SU16_SUM0_SUS256_SPO0_SRVW0_SSO0_SVW1_SK0_SKFTR0_SKXCCM0_SGRO0_TDMI0_TIN0_TT8_4_TLDS0_TLDSMn1_ULSGRO0_USL1_UIOFGRO0_UPLRP0_USFGROn1_VSn1_VWA1_VWB1_WSGRA0_WSGRB0_WS32_WG8_8_1_WGM1_WGMXCC1_WGMXCCGn1
    SolutionIndex: 163
    SolutionNameMin: Cijk_Alik_Bljk_S_B_Bias_HA_S_SAV_UserArgs_MT48x64x32_SN_LDSB0_AFC1_AG0_AFEM1_AFEM1_ASEM1_CLR0_CADS0_DTLA0_DTLB0_DTVA0_DTVB0_DTVMXSA0_DTVMXSB0_DTVSM0_DPLB0_EPS0_ELFLR0_EMLLn1_FDSI0_GRPM1_GRVWA1_GRVWB1_GSU1_GSUAMB_GSUC0_GSUWGMRR0_GLS0_ISA1151_IU1_K1_LDSTI0_LBSPPA0_LBSPPB0_LBSPPM0_LPA1_LPB1_LPM0_LRVW1_LWPMn1_MIAV0_MO40_MGRIPM1_NTn1_NTA0_NTB0_NTC0_NTD0_NTM0_NEPBS0_NLCA1_NLCB1_ONLL1_PGR0_PLR1_PKA0_SGROB0_SIA1_SS0_SU32_SUM0_SUS256_SPO0_SRVW0_SSO0_SVW1_SK0_SKFTR0_SKXCCM0_SGRO0_TDMI0_TIN0_TT6_8_TLDS0_TLDSMn1_ULSGRO0_USL1_UIOFGRO0_UPLRP0_USFGROn1_VSn1_VWA1_VWB1_WSGRA0_WSGRB0_WS32_WG8_8_1_WGM1_WGMXCC1_WGMXCCGn1
    SolutionIndex: 164
    SolutionNameMin: Cijk_Alik_Bljk_S_B_Bias_HA_S_SAV_UserArgs_MT128x64x32_SN_LDSB0_AFC1_AG0_AFEM1_AFEM1_ASEM1_CLR0_CADS0_DTLA0_DTLB0_DTVA0_DTVB0_DTVMXSA0_DTVMXSB0_DTVSM0_DPLB0_EPS0_ELFLR0_EMLLn1_FDSI0_GRPM1_GRVWA1_GRVWB1_GSU1_GSUAMB_GSUC0_GSUWGMRR0_GLS0_ISA1151_IU1_K1_LDSTI0_LBSPPA0_LBSPPB0_LBSPPM0_LPA1_LPB1_LPM0_LRVW1_LWPMn1_MIAV0_MO40_MGRIPM1_NTn1_NTA0_NTB0_NTC0_NTD0_NTM0_NEPBS0_NLCA1_NLCB1_ONLL1_PGR0_PLR1_PKA0_SGROB0_SIA1_SS0_SU32_SUM0_SUS256_SPO0_SRVW0_SSO0_SVW1_SK0_SKFTR0_SKXCCM0_SGRO0_TDMI0_TIN0_TT8_8_TLDS0_TLDSMn1_ULSGRO0_USL1_UIOFGRO0_UPLRP0_USFGROn1_VSn1_VWA1_VWB1_WSGRA0_WSGRB0_WS32_WG16_8_1_WGM1_WGMXCC1_WGMXCCGn1
    SolutionIndex: 165
    SolutionNameMin: Cijk_Alik_Bljk_S_B_Bias_HA_S_SAV_UserArgs_MT64x64x32_SN_LDSB0_AFC1_AG0_AFEM1_AFEM1_ASEM1_CLR0_CADS0_DTLA0_DTLB0_DTVA0_DTVB0_DTVMXSA0_DTVMXSB0_DTVSM0_DPLB0_EPS0_ELFLR0_EMLLn1_FDSI0_GRPM1_GRVWA1_GRVWB1_GSU1_GSUAMB_GSUC0_GSUWGMRR0_GLS0_ISA1151_IU1_K1_LDSTI0_LBSPPA0_LBSPPB0_LBSPPM0_LPA1_LPB1_LPM0_LRVW1_LWPMn1_MIAV0_MO40_MGRIPM1_NTn1_NTA0_NTB0_NTC0_NTD0_NTM0_NEPBS0_NLCA1_NLCB1_ONLL1_PGR0_PLR1_PKA0_SGROB0_SIA1_SS0_SU32_SUM0_SUS256_SPO0_SRVW0_SSO0_SVW1_SK0_SKFTR0_SKXCCM0_SGRO0_TDMI0_TIN0_TT4_8_TLDS0_TLDSMn1_ULSGRO0_USL1_UIOFGRO0_UPLRP0_USFGROn1_VSn1_VWA1_VWB1_WSGRA0_WSGRB0_WS32_WG16_8_1_WGM1_WGMXCC1_WGMXCCGn1
    SolutionIndex: 166
    SolutionNameMin: Cijk_Alik_Bljk_S_B_Bias_HA_S_SAV_UserArgs_MT128x64x32_SN_LDSB0_AFC1_AG0_AFEM1_AFEM1_ASEM1_CLR0_CADS0_DTLA0_DTLB0_DTVA0_DTVB0_DTVMXSA0_DTVMXSB0_DTVSM0_DPLB0_EPS0_ELFLR0_EMLLn1_FDSI0_GRPM1_GRVWA1_GRVWB1_GSU1_GSUAMB_GSUC0_GSUWGMRR0_GLS0_ISA1151_IU1_K1_LDSTI0_LBSPPA0_LBSPPB0_LBSPPM0_LPA1_LPB1_LPM0_LRVW1_LWPMn1_MIAV0_MO40_MGRIPM1_NTn1_NTA0_NTB0_NTC0_NTD0_NTM0_NEPBS0_NLCA1_NLCB1_ONLL1_PGR0_PLR1_PKA0_SGROB0_SIA1_SS0_SU2_SUM0_SUS256_SPO0_SRVW0_SSO0_SVW1_SK0_SKFTR0_SKXCCM0_SGRO0_TDMI0_TIN0_TT8_8_TLDS0_TLDSMn1_ULSGRO0_USL1_UIOFGRO0_UPLRP0_USFGROn1_VSn1_VWA1_VWB1_WSGRA0_WSGRB0_WS32_WG16_8_1_WGM1_WGMXCC1_WGMXCCGn1
    SolutionIndex: 167
    SolutionNameMin: Cijk_Alik_Bljk_S_B_Bias_HA_S_SAV_UserArgs_MT128x32x16_SN_LDSB0_AFC1_AG0_AFEM1_AFEM1_ASEM1_CLR0_CADS0_DTLA0_DTLB0_DTVA0_DTVB0_DTVMXSA0_DTVMXSB0_DTVSM0_DPLB0_EPS0_ELFLR0_EMLLn1_FDSI0_GRPM1_GRVWA1_GRVWB1_GSU1_GSUAMB_GSUC0_GSUWGMRR0_GLS0_ISA1151_IU1_K1_LDSTI0_LBSPPA0_LBSPPB0_LBSPPM0_LPA1_LPB1_LPM0_LRVW1_LWPMn1_MIAV0_MO40_MGRIPM1_NTn1_NTA0_NTB0_NTC0_NTD0_NTM0_NEPBS0_NLCA1_NLCB1_ONLL1_PGR0_PLR1_PKA0_SGROB0_SIA1_SS0_SU0_SUM0_SUS0_SPO0_SRVW0_SSO0_SVW1_SK0_SKFTR0_SKXCCM0_SGRO0_TDMI0_TIN0_TT8_4_TLDS0_TLDSMn1_ULSGRO0_USL1_UIOFGRO0_UPLRP0_USFGROn1_VSn1_VWA1_VWB1_WSGRA0_WSGRB0_WS32_WG16_8_1_WGM1_WGMXCC1_WGMXCCGn1
    SolutionIndex: 168
    SolutionNameMin: Cijk_Alik_Bljk_S_B_Bias_HA_S_SAV_UserArgs_MT64x64x16_SN_LDSB0_AFC1_AG0_AFEM1_AFEM1_ASEM1_CLR0_CADS0_DTLA0_DTLB0_DTVA0_DTVB0_DTVMXSA0_DTVMXSB0_DTVSM0_DPLB0_EPS0_ELFLR0_EMLLn1_FDSI0_GRPM1_GRVWA1_GRVWB1_GSU1_GSUAMB_GSUC0_GSUWGMRR0_GLS0_ISA1151_IU1_K1_LDSTI0_LBSPPA0_LBSPPB0_LBSPPM0_LPA1_LPB1_LPM0_LRVW1_LWPMn1_MIAV0_MO40_MGRIPM1_NTn1_NTA0_NTB0_NTC0_NTD0_NTM0_NEPBS0_NLCA1_NLCB1_ONLL1_PGR1_PLR1_PKA0_SGROB0_SIA1_SS0_SU0_SUM0_SUS0_SPO0_SRVW0_SSO0_SVW1_SK0_SKFTR0_SKXCCM0_SGRO0_TDMI0_TIN0_TT4_8_TLDS0_TLDSMn1_ULSGRO0_USL1_UIOFGRO0_UPLRP0_USFGROn1_VSn1_VWA1_VWB1_WSGRA0_WSGRB0_WS32_WG16_8_1_WGM1_WGMXCC1_WGMXCCGn1
    SolutionIndex: 169
    SolutionNameMin: Cijk_Alik_Bljk_S_B_Bias_HA_S_SAV_UserArgs_MT64x32x32_SN_LDSB0_AFC1_AG0_AFEM1_AFEM1_ASEM1_CLR0_CADS0_DTLA0_DTLB0_DTVA0_DTVB0_DTVMXSA0_DTVMXSB0_DTVSM0_DPLB0_EPS0_ELFLR0_EMLLn1_FDSI0_GRPM1_GRVWA1_GRVWB1_GSU1_GSUAMB_GSUC0_GSUWGMRR0_GLS0_ISA1151_IU1_K1_LDSTI0_LBSPPA0_LBSPPB0_LBSPPM0_LPA1_LPB1_LPM0_LRVW1_LWPMn1_MIAV0_MO40_MGRIPM1_NTn1_NTA0_NTB0_NTC0_NTD0_NTM0_NEPBS0_NLCA1_NLCB1_ONLL1_PGR0_PLR1_PKA0_SGROB0_SIA1_SS0_SU0_SUM0_SUS0_SPO0_SRVW0_SSO0_SVW1_SK0_SKFTR0_SKXCCM0_SGRO0_TDMI0_TIN0_TT8_4_TLDS0_TLDSMn1_ULSGRO0_USL1_UIOFGRO0_UPLRP0_USFGROn1_VSn1_VWA1_VWB1_WSGRA0_WSGRB0_WS32_WG8_8_1_WGM1_WGMXCC1_WGMXCCGn1
    SolutionIndex: 170
    SolutionNameMin: Cijk_Alik_Bljk_S_B_Bias_HA_S_SAV_UserArgs_MT64x32x32_SN_LDSB0_AFC1_AG0_AFEM1_AFEM1_ASEM1_CLR0_CADS0_DTLA0_DTLB0_DTVA0_DTVB0_DTVMXSA0_DTVMXSB0_DTVSM0_DPLB0_EPS0_ELFLR0_EMLLn1_FDSI0_GRPM1_GRVWA1_GRVWB1_GSU1_GSUAMB_GSUC0_GSUWGMRR0_GLS0_ISA1151_IU1_K1_LDSTI0_LBSPPA0_LBSPPB0_LBSPPM0_LPA1_LPB1_LPM0_LRVW1_LWPMn1_MIAV0_MO40_MGRIPM1_NTn1_NTA0_NTB0_NTC0_NTD0_NTM0_NEPBS0_NLCA1_NLCB1_ONLL1_PGR0_PLR1_PKA0_SGROB0_SIA1_SS0_SU8_SUM0_SUS256_SPO0_SRVW0_SSO0_SVW1_SK0_SKFTR0_SKXCCM0_SGRO0_TDMI0_TIN0_TT4_4_TLDS0_TLDSMn1_ULSGRO0_USL1_UIOFGRO0_UPLRP0_USFGROn1_VSn1_VWA1_VWB1_WSGRA0_WSGRB0_WS32_WG16_8_1_WGM1_WGMXCC1_WGMXCCGn1
    SolutionIndex: 171
    SolutionNameMin: Cijk_Alik_Bljk_S_B_Bias_HA_S_SAV_UserArgs_MT48x64x32_SN_LDSB0_AFC1_AG0_AFEM1_AFEM1_ASEM1_CLR0_CADS0_DTLA0_DTLB0_DTVA0_DTVB0_DTVMXSA0_DTVMXSB0_DTVSM0_DPLB0_EPS0_ELFLR0_EMLLn1_FDSI0_GRPM1_GRVWA1_GRVWB1_GSU1_GSUAMB_GSUC0_GSUWGMRR0_GLS0_ISA1151_IU1_K1_LDSTI0_LBSPPA0_LBSPPB0_LBSPPM0_LPA1_LPB1_LPM0_LRVW1_LWPMn1_MIAV0_MO40_MGRIPM1_NTn1_NTA0_NTB0_NTC0_NTD0_NTM0_NEPBS0_NLCA1_NLCB1_ONLL1_PGR0_PLR1_PKA0_SGROB0_SIA1_SS0_SU8_SUM0_SUS256_SPO0_SRVW0_SSO0_SVW1_SK0_SKFTR0_SKXCCM0_SGRO0_TDMI0_TIN0_TT6_8_TLDS0_TLDSMn1_ULSGRO0_USL1_UIOFGRO0_UPLRP0_USFGROn1_VSn1_VWA1_VWB1_WSGRA0_WSGRB0_WS32_WG8_8_1_WGM1_WGMXCC1_WGMXCCGn1
    SolutionIndex: 172
    SolutionNameMin: Cijk_Alik_Bljk_S_B_Bias_HA_S_SAV_UserArgs_MT64x32x64_SN_LDSB0_AFC1_AG0_AFEM1_AFEM1_ASEM1_CLR0_CADS0_DTLA0_DTLB0_DTVA0_DTVB0_DTVMXSA0_DTVMXSB0_DTVSM0_DPLB0_EPS0_ELFLR0_EMLLn1_FDSI0_GRPM1_GRVWA1_GRVWB1_GSU1_GSUAMB_GSUC0_GSUWGMRR0_GLS0_ISA1151_IU1_K1_LDSTI0_LBSPPA0_LBSPPB0_LBSPPM0_LPA1_LPB1_LPM0_LRVW1_LWPMn1_MIAV0_MO40_MGRIPM1_NTn1_NTA0_NTB0_NTC0_NTD0_NTM0_NEPBS0_NLCA1_NLCB1_ONLL1_PGR0_PLR1_PKA0_SGROB0_SIA1_SS0_SU8_SUM0_SUS256_SPO0_SRVW0_SSO0_SVW1_SK0_SKFTR0_SKXCCM0_SGRO0_TDMI0_TIN0_TT8_4_TLDS0_TLDSMn1_ULSGRO0_USL1_UIOFGRO0_UPLRP0_USFGROn1_VSn1_VWA1_VWB1_WSGRA0_WSGRB0_WS32_WG8_8_1_WGM1_WGMXCC1_WGMXCCGn1
    SolutionIndex: 173
    SolutionNameMin: Cijk_Alik_Bljk_S_B_Bias_HA_S_SAV_UserArgs_MT128x32x32_SN_LDSB0_AFC1_AG0_AFEM1_AFEM1_ASEM1_CLR0_CADS0_DTLA0_DTLB0_DTVA0_DTVB0_DTVMXSA0_DTVMXSB0_DTVSM0_DPLB0_EPS0_ELFLR0_EMLLn1_FDSI0_GRPM1_GRVWA1_GRVWB1_GSU1_GSUAMB_GSUC0_GSUWGMRR0_GLS0_ISA1151_IU1_K1_LDSTI0_LBSPPA0_LBSPPB0_LBSPPM0_LPA1_LPB1_LPM0_LRVW1_LWPMn1_MIAV0_MO40_MGRIPM1_NTn1_NTA0_NTB0_NTC0_NTD0_NTM0_NEPBS0_NLCA1_NLCB1_ONLL1_PGR0_PLR1_PKA0_SGROB0_SIA1_SS0_SU4_SUM0_SUS256_SPO0_SRVW0_SSO0_SVW1_SK0_SKFTR0_SKXCCM0_SGRO0_TDMI0_TIN0_TT8_4_TLDS0_TLDSMn1_ULSGRO0_USL1_UIOFGRO0_UPLRP0_USFGROn1_VSn1_VWA1_VWB1_WSGRA0_WSGRB0_WS32_WG16_8_1_WGM1_WGMXCC1_WGMXCCGn1
    SolutionIndex: 174
    SolutionNameMin: Cijk_Alik_Bljk_S_B_Bias_HA_S_SAV_UserArgs_MT128x32x32_SN_LDSB0_AFC1_AG0_AFEM1_AFEM1_ASEM1_CLR0_CADS0_DTLA0_DTLB0_DTVA0_DTVB0_DTVMXSA0_DTVMXSB0_DTVSM0_DPLB0_EPS0_ELFLR0_EMLLn1_FDSI0_GRPM1_GRVWA1_GRVWB1_GSU1_GSUAMB_GSUC0_GSUWGMRR0_GLS0_ISA1151_IU1_K1_LDSTI0_LBSPPA0_LBSPPB0_LBSPPM0_LPA1_LPB1_LPM0_LRVW1_LWPMn1_MIAV0_MO40_MGRIPM1_NTn1_NTA0_NTB0_NTC0_NTD0_NTM0_NEPBS0_NLCA1_NLCB1_ONLL1_PGR0_PLR1_PKA0_SGROB0_SIA1_SS0_SU16_SUM0_SUS256_SPO0_SRVW0_SSO0_SVW1_SK0_SKFTR0_SKXCCM0_SGRO0_TDMI0_TIN0_TT8_4_TLDS0_TLDSMn1_ULSGRO0_USL1_UIOFGRO0_UPLRP0_USFGROn1_VSn1_VWA1_VWB1_WSGRA0_WSGRB0_WS32_WG16_8_1_WGM1_WGMXCC1_WGMXCCGn1
    SolutionIndex: 175
    SolutionNameMin: Cijk_Alik_Bljk_S_B_Bias_HA_S_SAV_UserArgs_MT32x64x32_SN_LDSB0_AFC1_AG0_AFEM1_AFEM1_ASEM1_CLR0_CADS0_DTLA0_DTLB0_DTVA0_DTVB0_DTVMXSA0_DTVMXSB0_DTVSM0_DPLB0_EPS0_ELFLR0_EMLLn1_FDSI0_GRPM1_GRVWA1_GRVWB1_GSU1_GSUAMB_GSUC0_GSUWGMRR0_GLS0_ISA1151_IU1_K1_LDSTI0_LBSPPA0_LBSPPB0_LBSPPM0_LPA1_LPB1_LPM0_LRVW1_LWPMn1_MIAV0_MO40_MGRIPM1_NTn1_NTA0_NTB0_NTC0_NTD0_NTM0_NEPBS0_NLCA1_NLCB1_ONLL1_PGR0_PLR1_PKA0_SGROB0_SIA1_SS0_SU4_SUM0_SUS256_SPO0_SRVW0_SSO0_SVW1_SK0_SKFTR0_SKXCCM0_SGRO0_TDMI0_TIN0_TT4_8_TLDS0_TLDSMn1_ULSGRO0_USL1_UIOFGRO0_UPLRP0_USFGROn1_VSn1_VWA1_VWB1_WSGRA0_WSGRB0_WS32_WG8_8_1_WGM1_WGMXCC1_WGMXCCGn1
    SolutionIndex: 176
    SolutionNameMin: Cijk_Alik_Bljk_S_B_Bias_HA_S_SAV_UserArgs_MT96x64x32_SN_LDSB0_AFC1_AG0_AFEM1_AFEM1_ASEM1_CLR0_CADS0_DTLA0_DTLB0_DTVA0_DTVB0_DTVMXSA0_DTVMXSB0_DTVSM0_DPLB0_EPS0_ELFLR0_EMLLn1_FDSI0_GRPM1_GRVWA1_GRVWB1_GSU1_GSUAMB_GSUC0_GSUWGMRR0_GLS0_ISA1151_IU1_K1_LDSTI0_LBSPPA0_LBSPPB0_LBSPPM0_LPA1_LPB1_LPM0_LRVW1_LWPMn1_MIAV0_MO40_MGRIPM1_NTn1_NTA0_NTB0_NTC0_NTD0_NTM0_NEPBS0_NLCA1_NLCB1_ONLL1_PGR0_PLR1_PKA0_SGROB0_SIA1_SS0_SU8_SUM0_SUS256_SPO0_SRVW0_SSO0_SVW1_SK0_SKFTR0_SKXCCM0_SGRO0_TDMI0_TIN0_TT6_8_TLDS0_TLDSMn1_ULSGRO0_USL1_UIOFGRO0_UPLRP0_USFGROn1_VSn1_VWA1_VWB1_WSGRA0_WSGRB0_WS32_WG16_8_1_WGM4_WGMXCC1_WGMXCCGn1
    SolutionIndex: 177
    SolutionNameMin: Cijk_Alik_Bljk_S_B_Bias_HA_S_SAV_UserArgs_MT128x64x32_SN_LDSB0_AFC1_AG0_AFEM1_AFEM1_ASEM1_CLR0_CADS0_DTLA0_DTLB0_DTVA0_DTVB0_DTVMXSA0_DTVMXSB0_DTVSM0_DPLB0_EPS0_ELFLR0_EMLLn1_FDSI0_GRPM1_GRVWA1_GRVWB1_GSU1_GSUAMB_GSUC0_GSUWGMRR0_GLS0_ISA1151_IU1_K1_LDSTI0_LBSPPA0_LBSPPB0_LBSPPM0_LPA1_LPB1_LPM0_LRVW1_LWPMn1_MIAV0_MO40_MGRIPM1_NTn1_NTA0_NTB0_NTC0_NTD0_NTM0_NEPBS0_NLCA1_NLCB1_ONLL1_PGR0_PLR1_PKA0_SGROB0_SIA1_SS0_SU8_SUM0_SUS256_SPO0_SRVW0_SSO0_SVW1_SK0_SKFTR0_SKXCCM0_SGRO0_TDMI0_TIN0_TT8_8_TLDS0_TLDSMn1_ULSGRO0_USL1_UIOFGRO0_UPLRP0_USFGROn1_VSn1_VWA1_VWB1_WSGRA0_WSGRB0_WS32_WG16_8_1_WGM8_WGMXCC1_WGMXCCGn1
    SolutionIndex: 178
    SolutionNameMin: Cijk_Alik_Bljk_S_B_Bias_HA_S_SAV_UserArgs_MT48x64x32_SN_LDSB0_AFC1_AG0_AFEM1_AFEM1_ASEM1_CLR0_CADS0_DTLA0_DTLB0_DTVA0_DTVB0_DTVMXSA0_DTVMXSB0_DTVSM0_DPLB0_EPS0_ELFLR0_EMLLn1_FDSI0_GRPM1_GRVWA1_GRVWB1_GSU1_GSUAMB_GSUC0_GSUWGMRR0_GLS0_ISA1151_IU1_K1_LDSTI0_LBSPPA0_LBSPPB0_LBSPPM0_LPA1_LPB1_LPM0_LRVW1_LWPMn1_MIAV0_MO40_MGRIPM1_NTn1_NTA0_NTB0_NTC0_NTD0_NTM0_NEPBS0_NLCA1_NLCB1_ONLL1_PGR0_PLR1_PKA0_SGROB0_SIA1_SS0_SU8_SUM0_SUS256_SPO0_SRVW0_SSO0_SVW1_SK0_SKFTR0_SKXCCM0_SGRO0_TDMI0_TIN0_TT6_8_TLDS0_TLDSMn1_ULSGRO0_USL1_UIOFGRO0_UPLRP0_USFGROn1_VSn1_VWA1_VWB1_WSGRA0_WSGRB0_WS32_WG8_8_1_WGM4_WGMXCC1_WGMXCCGn1
    SolutionIndex: 179
    SolutionNameMin: Cijk_Alik_Bljk_S_B_Bias_HA_S_SAV_UserArgs_MT128x64x32_SN_LDSB0_AFC1_AG0_AFEM1_AFEM1_ASEM1_CLR0_CADS0_DTLA0_DTLB0_DTVA0_DTVB0_DTVMXSA0_DTVMXSB0_DTVSM0_DPLB0_EPS0_ELFLR0_EMLLn1_FDSI0_GRPM1_GRVWA1_GRVWB1_GSU1_GSUAMB_GSUC0_GSUWGMRR0_GLS0_ISA1151_IU1_K1_LDSTI0_LBSPPA0_LBSPPB0_LBSPPM0_LPA1_LPB1_LPM0_LRVW1_LWPMn1_MIAV0_MO40_MGRIPM1_NTn1_NTA0_NTB0_NTC0_NTD0_NTM0_NEPBS0_NLCA1_NLCB1_ONLL1_PGR0_PLR1_PKA0_SGROB0_SIA1_SS0_SU0_SUM0_SUS0_SPO0_SRVW0_SSO0_SVW1_SK0_SKFTR0_SKXCCM0_SGRO0_TDMI0_TIN0_TT8_8_TLDS0_TLDSMn1_ULSGRO0_USL1_UIOFGRO0_UPLRP0_USFGROn1_VSn1_VWA1_VWB1_WSGRA0_WSGRB0_WS32_WG16_8_1_WGM4_WGMXCC1_WGMXCCGn1
    SolutionIndex: 180
    SolutionNameMin: Cijk_Alik_Bljk_S_B_Bias_HA_S_SAV_UserArgs_MT128x64x32_SN_LDSB0_AFC1_AG0_AFEM1_AFEM1_ASEM1_CLR0_CADS0_DTLA0_DTLB0_DTVA0_DTVB0_DTVMXSA0_DTVMXSB0_DTVSM0_DPLB0_EPS0_ELFLR0_EMLLn1_FDSI0_GRPM1_GRVWA1_GRVWB1_GSU1_GSUAMB_GSUC0_GSUWGMRR0_GLS0_ISA1151_IU1_K1_LDSTI0_LBSPPA0_LBSPPB0_LBSPPM0_LPA1_LPB1_LPM0_LRVW1_LWPMn1_MIAV0_MO40_MGRIPM1_NTn1_NTA0_NTB0_NTC0_NTD0_NTM0_NEPBS0_NLCA1_NLCB1_ONLL1_PGR0_PLR1_PKA0_SGROB0_SIA1_SS0_SU0_SUM0_SUS0_SPO0_SRVW0_SSO0_SVW1_SK0_SKFTR0_SKXCCM0_SGRO0_TDMI0_TIN0_TT8_8_TLDS0_TLDSMn1_ULSGRO0_USL1_UIOFGRO0_UPLRP0_USFGROn1_VSn1_VWA1_VWB1_WSGRA0_WSGRB0_WS32_WG16_8_1_WGM1_WGMXCC1_WGMXCCGn1
    SolutionIndex: 181
    SolutionNameMin: Cijk_Alik_Bljk_S_B_Bias_HA_S_SAV_UserArgs_MT64x64x32_SN_LDSB0_AFC1_AG0_AFEM1_AFEM1_ASEM1_CLR0_CADS0_DTLA0_DTLB0_DTVA0_DTVB0_DTVMXSA0_DTVMXSB0_DTVSM0_DPLB0_EPS0_ELFLR0_EMLLn1_FDSI0_GRPM1_GRVWA1_GRVWB1_GSU1_GSUAMB_GSUC0_GSUWGMRR0_GLS0_ISA1151_IU1_K1_LDSTI0_LBSPPA0_LBSPPB0_LBSPPM0_LPA1_LPB1_LPM0_LRVW1_LWPMn1_MIAV0_MO40_MGRIPM1_NTn1_NTA0_NTB0_NTC0_NTD0_NTM0_NEPBS0_NLCA1_NLCB1_ONLL1_PGR0_PLR1_PKA0_SGROB0_SIA1_SS0_SU8_SUM0_SUS256_SPO0_SRVW0_SSO0_SVW1_SK0_SKFTR0_SKXCCM0_SGRO0_TDMI0_TIN0_TT4_8_TLDS0_TLDSMn1_ULSGRO0_USL1_UIOFGRO0_UPLRP0_USFGROn1_VSn1_VWA1_VWB1_WSGRA0_WSGRB0_WS32_WG16_8_1_WGM8_WGMXCC1_WGMXCCGn1
    SolutionIndex: 182
    SolutionNameMin: Cijk_Alik_Bljk_S_B_Bias_HA_S_SAV_UserArgs_MT96x64x16_SN_LDSB0_AFC1_AG0_AFEM1_AFEM1_ASEM1_CLR0_CADS0_DTLA0_DTLB0_DTVA0_DTVB0_DTVMXSA0_DTVMXSB0_DTVSM0_DPLB0_EPS0_ELFLR0_EMLLn1_FDSI0_GRPM1_GRVWA1_GRVWB1_GSU1_GSUAMB_GSUC0_GSUWGMRR0_GLS0_ISA1151_IU1_K1_LDSTI0_LBSPPA0_LBSPPB0_LBSPPM0_LPA1_LPB1_LPM0_LRVW1_LWPMn1_MIAV0_MO40_MGRIPM1_NTn1_NTA0_NTB0_NTC0_NTD0_NTM0_NEPBS0_NLCA1_NLCB1_ONLL1_PGR0_PLR1_PKA0_SGROB0_SIA1_SS0_SU4_SUM0_SUS256_SPO0_SRVW0_SSO0_SVW1_SK0_SKFTR0_SKXCCM0_SGRO0_TDMI0_TIN0_TT6_8_TLDS0_TLDSMn1_ULSGRO0_USL1_UIOFGRO0_UPLRP0_USFGROn1_VSn1_VWA1_VWB1_WSGRA0_WSGRB0_WS32_WG16_8_1_WGM1_WGMXCC1_WGMXCCGn1
    SolutionIndex: 183
    SolutionNameMin: Cijk_Alik_Bljk_S_B_Bias_HA_S_SAV_UserArgs_MT96x64x16_SN_LDSB0_AFC1_AG0_AFEM1_AFEM1_ASEM1_CLR0_CADS0_DTLA0_DTLB0_DTVA0_DTVB0_DTVMXSA0_DTVMXSB0_DTVSM0_DPLB0_EPS0_ELFLR0_EMLLn1_FDSI0_GRPM1_GRVWA1_GRVWB1_GSU1_GSUAMB_GSUC0_GSUWGMRR0_GLS0_ISA1151_IU1_K1_LDSTI0_LBSPPA0_LBSPPB0_LBSPPM0_LPA1_LPB1_LPM0_LRVW1_LWPMn1_MIAV0_MO40_MGRIPM1_NTn1_NTA0_NTB0_NTC0_NTD0_NTM0_NEPBS0_NLCA1_NLCB1_ONLL1_PGR0_PLR1_PKA0_SGROB0_SIA1_SS0_SU16_SUM0_SUS256_SPO0_SRVW0_SSO0_SVW1_SK0_SKFTR0_SKXCCM0_SGRO0_TDMI0_TIN0_TT6_8_TLDS0_TLDSMn1_ULSGRO0_USL1_UIOFGRO0_UPLRP0_USFGROn1_VSn1_VWA1_VWB1_WSGRA0_WSGRB0_WS32_WG16_8_1_WGM1_WGMXCC1_WGMXCCGn1
    SolutionIndex: 184
    SolutionNameMin: Cijk_Alik_Bljk_S_B_Bias_HA_S_SAV_UserArgs_MT128x32x16_SN_LDSB0_AFC1_AG0_AFEM1_AFEM1_ASEM1_CLR0_CADS0_DTLA0_DTLB0_DTVA0_DTVB0_DTVMXSA0_DTVMXSB0_DTVSM0_DPLB0_EPS0_ELFLR0_EMLLn1_FDSI0_GRPM1_GRVWA1_GRVWB1_GSU1_GSUAMB_GSUC0_GSUWGMRR0_GLS0_ISA1151_IU1_K1_LDSTI0_LBSPPA0_LBSPPB0_LBSPPM0_LPA1_LPB1_LPM0_LRVW1_LWPMn1_MIAV0_MO40_MGRIPM1_NTn1_NTA0_NTB0_NTC0_NTD0_NTM0_NEPBS0_NLCA1_NLCB1_ONLL1_PGR0_PLR1_PKA0_SGROB0_SIA1_SS0_SU16_SUM0_SUS256_SPO0_SRVW0_SSO0_SVW1_SK0_SKFTR0_SKXCCM0_SGRO0_TDMI0_TIN0_TT8_4_TLDS0_TLDSMn1_ULSGRO0_USL1_UIOFGRO0_UPLRP0_USFGROn1_VSn1_VWA1_VWB1_WSGRA0_WSGRB0_WS32_WG16_8_1_WGM1_WGMXCC1_WGMXCCGn1
    SolutionIndex: 185
    SolutionNameMin: Cijk_Alik_Bljk_S_B_Bias_HA_S_SAV_UserArgs_MT128x32x16_SN_LDSB0_AFC1_AG0_AFEM1_AFEM1_ASEM1_CLR0_CADS0_DTLA0_DTLB0_DTVA0_DTVB0_DTVMXSA0_DTVMXSB0_DTVSM0_DPLB0_EPS0_ELFLR0_EMLLn1_FDSI0_GRPM1_GRVWA1_GRVWB1_GSU1_GSUAMB_GSUC0_GSUWGMRR0_GLS0_ISA1151_IU1_K1_LDSTI0_LBSPPA0_LBSPPB0_LBSPPM0_LPA1_LPB1_LPM0_LRVW1_LWPMn1_MIAV0_MO40_MGRIPM1_NTn1_NTA0_NTB0_NTC0_NTD0_NTM0_NEPBS0_NLCA1_NLCB1_ONLL1_PGR0_PLR1_PKA0_SGROB0_SIA1_SS0_SU8_SUM0_SUS256_SPO0_SRVW0_SSO0_SVW1_SK0_SKFTR0_SKXCCM0_SGRO0_TDMI0_TIN0_TT8_4_TLDS0_TLDSMn1_ULSGRO0_USL1_UIOFGRO0_UPLRP0_USFGROn1_VSn1_VWA1_VWB1_WSGRA0_WSGRB0_WS32_WG16_8_1_WGM1_WGMXCC1_WGMXCCGn1
    SolutionIndex: 186
    SolutionNameMin: Cijk_Alik_Bljk_S_B_Bias_HA_S_SAV_UserArgs_MT32x16x32_SN_LDSB0_AFC1_AG0_AFEM1_AFEM1_ASEM1_CLR0_CADS0_DTLA0_DTLB0_DTVA0_DTVB0_DTVMXSA0_DTVMXSB0_DTVSM0_DPLB0_EPS0_ELFLR0_EMLLn1_FDSI0_GRPM1_GRVWA1_GRVWB1_GSU1_GSUAMB_GSUC0_GSUWGMRR0_GLS0_ISA1151_IU1_K1_LDSTI0_LBSPPA0_LBSPPB0_LBSPPM0_LPA1_LPB1_LPM0_LRVW1_LWPMn1_MIAV0_MO40_MGRIPM1_NTn1_NTA0_NTB0_NTC0_NTD0_NTM0_NEPBS0_NLCA1_NLCB1_ONLL1_PGR1_PLR1_PKA0_SGROB0_SIA1_SS0_SU0_SUM0_SUS0_SPO0_SRVW0_SSO0_SVW1_SK0_SKFTR0_SKXCCM0_SGRO0_TDMI0_TIN0_TT2_2_TLDS0_TLDSMn1_ULSGRO0_USL1_UIOFGRO0_UPLRP0_USFGROn1_VSn1_VWA1_VWB1_WSGRA0_WSGRB0_WS32_WG16_8_1_WGM1_WGMXCC1_WGMXCCGn1
    SolutionIndex: 187
    SolutionNameMin: Cijk_Alik_Bljk_S_B_Bias_HA_S_SAV_UserArgs_MT32x16x128_SN_LDSB0_AFC1_AG0_AFEM1_AFEM1_ASEM1_CLR0_CADS0_DTLA0_DTLB0_DTVA0_DTVB0_DTVMXSA0_DTVMXSB0_DTVSM0_DPLB0_EPS0_ELFLR0_EMLLn1_FDSI0_GRPM1_GRVWA1_GRVWB1_GSU1_GSUAMB_GSUC0_GSUWGMRR0_GLS0_ISA1151_IU1_K1_LDSTI0_LBSPPA0_LBSPPB0_LBSPPM0_LPA1_LPB1_LPM0_LRVW1_LWPMn1_MIAV0_MO40_MGRIPM1_NTn1_NTA0_NTB0_NTC0_NTD0_NTM0_NEPBS0_NLCA1_NLCB1_ONLL1_PGR1_PLR1_PKA0_SGROB0_SIA1_SS0_SU0_SUM0_SUS0_SPO0_SRVW0_SSO0_SVW1_SK0_SKFTR0_SKXCCM0_SGRO0_TDMI0_TIN0_TT2_2_TLDS0_TLDSMn1_ULSGRO0_USL1_UIOFGRO0_UPLRP0_USFGROn1_VSn1_VWA1_VWB1_WSGRA0_WSGRB0_WS32_WG16_8_1_WGM1_WGMXCC1_WGMXCCGn1
    SolutionIndex: 188
    SolutionNameMin: Cijk_Alik_Bljk_S_B_Bias_HA_S_SAV_UserArgs_MT16x8x128_SN_LDSB0_AFC1_AG0_AFEM1_AFEM1_ASEM1_CLR0_CADS0_DTLA0_DTLB0_DTVA0_DTVB0_DTVMXSA0_DTVMXSB0_DTVSM0_DPLB0_EPS0_ELFLR0_EMLLn1_FDSI0_GRPM1_GRVWA1_GRVWB1_GSU1_GSUAMB_GSUC0_GSUWGMRR0_GLS0_ISA1151_IU1_K1_LDSTI0_LBSPPA0_LBSPPB0_LBSPPM0_LPA1_LPB1_LPM0_LRVW1_LWPMn1_MIAV0_MO40_MGRIPM1_NTn1_NTA0_NTB0_NTC0_NTD0_NTM0_NEPBS0_NLCA1_NLCB1_ONLL1_PGR1_PLR1_PKA0_SGROB0_SIA1_SS0_SU8_SUM0_SUS512_SPO0_SRVW0_SSO0_SVW1_SK0_SKFTR0_SKXCCM0_SGRO0_TDMI0_TIN0_TT1_1_TLDS0_TLDSMn1_ULSGRO0_USL1_UIOFGRO0_UPLRP0_USFGROn1_VSn1_VWA1_VWB1_WSGRA0_WSGRB0_WS32_WG16_8_1_WGM1_WGMXCC1_WGMXCCGn1
    SolutionIndex: 189
    SolutionNameMin: Cijk_Alik_Bljk_S_B_Bias_HA_S_SAV_UserArgs_MT16x16x32_SN_LDSB0_AFC1_AG0_AFEM1_AFEM1_ASEM1_CLR0_CADS0_DTLA0_DTLB0_DTVA0_DTVB0_DTVMXSA0_DTVMXSB0_DTVSM0_DPLB0_EPS0_ELFLR0_EMLLn1_FDSI0_GRPM1_GRVWA1_GRVWB1_GSU1_GSUAMB_GSUC0_GSUWGMRR0_GLS0_ISA1151_IU1_K1_LDSTI0_LBSPPA0_LBSPPB0_LBSPPM0_LPA1_LPB1_LPM0_LRVW1_LWPMn1_MIAV0_MO40_MGRIPM1_NTn1_NTA0_NTB0_NTC0_NTD0_NTM0_NEPBS0_NLCA1_NLCB1_ONLL1_PGR1_PLR1_PKA0_SGROB0_SIA1_SS0_SU8_SUM0_SUS256_SPO0_SRVW0_SSO0_SVW1_SK0_SKFTR0_SKXCCM0_SGRO0_TDMI0_TIN0_TT1_2_TLDS0_TLDSMn1_ULSGRO0_USL1_UIOFGRO0_UPLRP0_USFGROn1_VSn1_VWA1_VWB1_WSGRA0_WSGRB0_WS32_WG16_8_1_WGM1_WGMXCC1_WGMXCCGn1
    SolutionIndex: 190
    SolutionNameMin: Cijk_Alik_Bljk_S_B_Bias_HA_S_SAV_UserArgs_MT16x16x128_SN_LDSB0_AFC1_AG0_AFEM1_AFEM1_ASEM1_CLR0_CADS0_DTLA0_DTLB0_DTVA0_DTVB0_DTVMXSA0_DTVMXSB0_DTVSM0_DPLB0_EPS0_ELFLR0_EMLLn1_FDSI0_GRPM1_GRVWA1_GRVWB1_GSU1_GSUAMB_GSUC0_GSUWGMRR0_GLS0_ISA1151_IU1_K1_LDSTI0_LBSPPA0_LBSPPB0_LBSPPM0_LPA1_LPB1_LPM0_LRVW1_LWPMn1_MIAV0_MO40_MGRIPM1_NTn1_NTA0_NTB0_NTC0_NTD0_NTM0_NEPBS0_NLCA1_NLCB1_ONLL1_PGR1_PLR1_PKA0_SGROB0_SIA1_SS0_SU0_SUM0_SUS0_SPO0_SRVW0_SSO0_SVW1_SK0_SKFTR0_SKXCCM0_SGRO0_TDMI0_TIN0_TT1_2_TLDS0_TLDSMn1_ULSGRO0_USL1_UIOFGRO0_UPLRP0_USFGROn1_VSn1_VWA1_VWB1_WSGRA0_WSGRB0_WS32_WG16_8_1_WGM1_WGMXCC1_WGMXCCGn1
    SolutionIndex: 191
    SolutionNameMin: Cijk_Alik_Bljk_S_B_Bias_HA_S_SAV_UserArgs_MT16x16x128_SN_LDSB0_AFC1_AG0_AFEM1_AFEM1_ASEM1_CLR0_CADS0_DTLA0_DTLB0_DTVA0_DTVB0_DTVMXSA0_DTVMXSB0_DTVSM0_DPLB0_EPS0_ELFLR0_EMLLn1_FDSI0_GRPM1_GRVWA1_GRVWB1_GSU1_GSUAMB_GSUC0_GSUWGMRR0_GLS0_ISA1151_IU1_K1_LDSTI0_LBSPPA0_LBSPPB0_LBSPPM0_LPA1_LPB1_LPM0_LRVW1_LWPMn1_MIAV0_MO40_MGRIPM1_NTn1_NTA0_NTB0_NTC0_NTD0_NTM0_NEPBS0_NLCA1_NLCB1_ONLL1_PGR1_PLR1_PKA0_SGROB0_SIA1_SS0_SU8_SUM0_SUS512_SPO0_SRVW0_SSO0_SVW1_SK0_SKFTR0_SKXCCM0_SGRO0_TDMI0_TIN0_TT1_2_TLDS0_TLDSMn1_ULSGRO0_USL1_UIOFGRO0_UPLRP0_USFGROn1_VSn1_VWA1_VWB1_WSGRA0_WSGRB0_WS32_WG16_8_1_WGM1_WGMXCC1_WGMXCCGn1
    SolutionIndex: 192
    SolutionNameMin: Cijk_Alik_Bljk_S_B_Bias_HA_S_SAV_UserArgs_MT16x32x32_SN_LDSB0_AFC1_AG0_AFEM1_AFEM1_ASEM1_CLR0_CADS0_DTLA0_DTLB0_DTVA0_DTVB0_DTVMXSA0_DTVMXSB0_DTVSM0_DPLB0_EPS0_ELFLR0_EMLLn1_FDSI0_GRPM1_GRVWA1_GRVWB1_GSU1_GSUAMB_GSUC0_GSUWGMRR0_GLS0_ISA1151_IU1_K1_LDSTI0_LBSPPA0_LBSPPB0_LBSPPM0_LPA1_LPB1_LPM0_LRVW1_LWPMn1_MIAV0_MO40_MGRIPM1_NTn1_NTA0_NTB0_NTC0_NTD0_NTM0_NEPBS0_NLCA1_NLCB1_ONLL1_PGR1_PLR1_PKA0_SGROB0_SIA1_SS0_SU0_SUM0_SUS0_SPO0_SRVW0_SSO0_SVW1_SK0_SKFTR0_SKXCCM0_SGRO0_TDMI0_TIN0_TT1_4_TLDS0_TLDSMn1_ULSGRO0_USL1_UIOFGRO0_UPLRP0_USFGROn1_VSn1_VWA1_VWB1_WSGRA0_WSGRB0_WS32_WG16_8_1_WGM1_WGMXCC1_WGMXCCGn1
    SolutionIndex: 193
    SolutionNameMin: Cijk_Alik_Bljk_S_B_Bias_HA_S_SAV_UserArgs_MT32x16x32_SN_LDSB0_AFC1_AG0_AFEM1_AFEM1_ASEM1_CLR0_CADS0_DTLA0_DTLB0_DTVA0_DTVB0_DTVMXSA0_DTVMXSB0_DTVSM0_DPLB0_EPS0_ELFLR0_EMLLn1_FDSI0_GRPM1_GRVWA1_GRVWB1_GSU1_GSUAMB_GSUC0_GSUWGMRR0_GLS0_ISA1151_IU1_K1_LDSTI0_LBSPPA0_LBSPPB0_LBSPPM0_LPA1_LPB1_LPM0_LRVW1_LWPMn1_MIAV0_MO40_MGRIPM1_NTn1_NTA0_NTB0_NTC0_NTD0_NTM0_NEPBS0_NLCA1_NLCB1_ONLL1_PGR1_PLR1_PKA0_SGROB0_SIA1_SS0_SU8_SUM0_SUS256_SPO0_SRVW0_SSO0_SVW1_SK0_SKFTR0_SKXCCM0_SGRO0_TDMI0_TIN0_TT2_2_TLDS0_TLDSMn1_ULSGRO0_USL1_UIOFGRO0_UPLRP0_USFGROn1_VSn1_VWA1_VWB1_WSGRA0_WSGRB0_WS32_WG16_8_1_WGM1_WGMXCC1_WGMXCCGn1
    SolutionIndex: 194
    SolutionNameMin: Cijk_Alik_Bljk_S_B_Bias_HA_S_SAV_UserArgs_MT16x32x128_SN_LDSB0_AFC1_AG0_AFEM1_AFEM1_ASEM1_CLR0_CADS0_DTLA0_DTLB0_DTVA0_DTVB0_DTVMXSA0_DTVMXSB0_DTVSM0_DPLB0_EPS0_ELFLR0_EMLLn1_FDSI0_GRPM1_GRVWA1_GRVWB1_GSU1_GSUAMB_GSUC0_GSUWGMRR0_GLS0_ISA1151_IU1_K1_LDSTI0_LBSPPA0_LBSPPB0_LBSPPM0_LPA1_LPB1_LPM0_LRVW1_LWPMn1_MIAV0_MO40_MGRIPM1_NTn1_NTA0_NTB0_NTC0_NTD0_NTM0_NEPBS0_NLCA1_NLCB1_ONLL1_PGR1_PLR1_PKA0_SGROB0_SIA1_SS0_SU8_SUM0_SUS512_SPO0_SRVW0_SSO0_SVW1_SK0_SKFTR0_SKXCCM0_SGRO0_TDMI0_TIN0_TT1_4_TLDS0_TLDSMn1_ULSGRO0_USL1_UIOFGRO0_UPLRP0_USFGROn1_VSn1_VWA1_VWB1_WSGRA0_WSGRB0_WS32_WG16_8_1_WGM1_WGMXCC1_WGMXCCGn1
    SolutionIndex: 195
    SolutionNameMin: Cijk_Alik_Bljk_S_B_Bias_HA_S_SAV_UserArgs_MT32x16x128_SN_LDSB0_AFC1_AG0_AFEM1_AFEM1_ASEM1_CLR0_CADS0_DTLA0_DTLB0_DTVA0_DTVB0_DTVMXSA0_DTVMXSB0_DTVSM0_DPLB0_EPS0_ELFLR0_EMLLn1_FDSI0_GRPM1_GRVWA1_GRVWB1_GSU1_GSUAMB_GSUC0_GSUWGMRR0_GLS0_ISA1151_IU1_K1_LDSTI0_LBSPPA0_LBSPPB0_LBSPPM0_LPA1_LPB1_LPM0_LRVW1_LWPMn1_MIAV0_MO40_MGRIPM1_NTn1_NTA0_NTB0_NTC0_NTD0_NTM0_NEPBS0_NLCA1_NLCB1_ONLL1_PGR1_PLR1_PKA0_SGROB0_SIA1_SS0_SU8_SUM0_SUS512_SPO0_SRVW0_SSO0_SVW1_SK0_SKFTR0_SKXCCM0_SGRO0_TDMI0_TIN0_TT2_2_TLDS0_TLDSMn1_ULSGRO0_USL1_UIOFGRO0_UPLRP0_USFGROn1_VSn1_VWA1_VWB1_WSGRA0_WSGRB0_WS32_WG16_8_1_WGM1_WGMXCC1_WGMXCCGn1
    SolutionIndex: 196
    SolutionNameMin: Cijk_Alik_Bljk_S_B_Bias_HA_S_SAV_UserArgs_MT16x32x128_SN_LDSB0_AFC1_AG0_AFEM1_AFEM1_ASEM1_CLR0_CADS0_DTLA0_DTLB0_DTVA0_DTVB0_DTVMXSA0_DTVMXSB0_DTVSM0_DPLB0_EPS0_ELFLR0_EMLLn1_FDSI0_GRPM1_GRVWA1_GRVWB1_GSU1_GSUAMB_GSUC0_GSUWGMRR0_GLS0_ISA1151_IU1_K1_LDSTI0_LBSPPA0_LBSPPB0_LBSPPM0_LPA1_LPB1_LPM0_LRVW1_LWPMn1_MIAV0_MO40_MGRIPM1_NTn1_NTA0_NTB0_NTC0_NTD0_NTM0_NEPBS0_NLCA1_NLCB1_ONLL1_PGR1_PLR1_PKA0_SGROB0_SIA1_SS0_SU0_SUM0_SUS0_SPO0_SRVW0_SSO0_SVW1_SK0_SKFTR0_SKXCCM0_SGRO0_TDMI0_TIN0_TT1_4_TLDS0_TLDSMn1_ULSGRO0_USL1_UIOFGRO0_UPLRP0_USFGROn1_VSn1_VWA1_VWB1_WSGRA0_WSGRB0_WS32_WG16_8_1_WGM1_WGMXCC1_WGMXCCGn1
    SolutionIndex: 197
    SolutionNameMin: Cijk_Alik_Bljk_S_B_Bias_HA_S_SAV_UserArgs_MT32x16x32_SN_LDSB0_AFC1_AG0_AFEM1_AFEM1_ASEM1_CLR0_CADS0_DTLA0_DTLB0_DTVA0_DTVB0_DTVMXSA0_DTVMXSB0_DTVSM0_DPLB0_EPS0_ELFLR0_EMLLn1_FDSI0_GRPM1_GRVWA1_GRVWB1_GSU1_GSUAMB_GSUC0_GSUWGMRR0_GLS0_ISA1151_IU1_K1_LDSTI0_LBSPPA0_LBSPPB0_LBSPPM0_LPA1_LPB1_LPM0_LRVW1_LWPMn1_MIAV0_MO40_MGRIPM1_NTn1_NTA0_NTB0_NTC0_NTD0_NTM0_NEPBS0_NLCA1_NLCB1_ONLL1_PGR0_PLR1_PKA0_SGROB0_SIA1_SS0_SU0_SUM0_SUS0_SPO0_SRVW0_SSO0_SVW1_SK0_SKFTR0_SKXCCM0_SGRO0_TDMI0_TIN0_TT4_2_TLDS0_TLDSMn1_ULSGRO0_USL1_UIOFGRO0_UPLRP0_USFGROn1_VSn1_VWA1_VWB1_WSGRA0_WSGRB0_WS32_WG8_8_1_WGM1_WGMXCC1_WGMXCCGn1
    SolutionIndex: 198
    SolutionNameMin: Cijk_Alik_Bljk_S_B_Bias_HA_S_SAV_UserArgs_MT32x32x16_SN_LDSB0_AFC1_AG0_AFEM1_AFEM1_ASEM1_CLR0_CADS0_DTLA0_DTLB0_DTVA0_DTVB0_DTVMXSA0_DTVMXSB0_DTVSM0_DPLB0_EPS0_ELFLR0_EMLLn1_FDSI0_GRPM1_GRVWA1_GRVWB1_GSU1_GSUAMB_GSUC0_GSUWGMRR0_GLS0_ISA1151_IU1_K1_LDSTI0_LBSPPA0_LBSPPB0_LBSPPM0_LPA1_LPB1_LPM0_LRVW1_LWPMn1_MIAV0_MO40_MGRIPM1_NTn1_NTA0_NTB0_NTC0_NTD0_NTM0_NEPBS0_NLCA1_NLCB1_ONLL1_PGR0_PLR1_PKA0_SGROB0_SIA1_SS0_SU0_SUM0_SUS0_SPO0_SRVW0_SSO0_SVW1_SK0_SKFTR0_SKXCCM0_SGRO0_TDMI0_TIN0_TT2_4_TLDS0_TLDSMn1_ULSGRO0_USL1_UIOFGRO0_UPLRP0_USFGROn1_VSn1_VWA1_VWB1_WSGRA0_WSGRB0_WS32_WG16_8_1_WGM1_WGMXCC1_WGMXCCGn1
    SolutionIndex: 199
    SolutionNameMin: Cijk_Alik_Bljk_S_B_Bias_HA_S_SAV_UserArgs_MT64x16x32_SN_LDSB0_AFC1_AG0_AFEM1_AFEM1_ASEM1_CLR0_CADS0_DTLA0_DTLB0_DTVA0_DTVB0_DTVMXSA0_DTVMXSB0_DTVSM0_DPLB0_EPS0_ELFLR0_EMLLn1_FDSI0_GRPM1_GRVWA1_GRVWB1_GSU1_GSUAMB_GSUC0_GSUWGMRR0_GLS0_ISA1151_IU1_K1_LDSTI0_LBSPPA0_LBSPPB0_LBSPPM0_LPA1_LPB1_LPM0_LRVW1_LWPMn1_MIAV0_MO40_MGRIPM1_NTn1_NTA0_NTB0_NTC0_NTD0_NTM0_NEPBS0_NLCA1_NLCB1_ONLL1_PGR0_PLR1_PKA0_SGROB0_SIA1_SS0_SU0_SUM0_SUS0_SPO0_SRVW0_SSO0_SVW1_SK0_SKFTR0_SKXCCM0_SGRO0_TDMI0_TIN0_TT4_2_TLDS0_TLDSMn1_ULSGRO0_USL1_UIOFGRO0_UPLRP0_USFGROn1_VSn1_VWA1_VWB1_WSGRA0_WSGRB0_WS32_WG16_8_1_WGM1_WGMXCC1_WGMXCCGn1
    SolutionIndex: 200
    SolutionNameMin: Cijk_Alik_Bljk_S_B_Bias_HA_S_SAV_UserArgs_MT32x32x64_SN_LDSB0_AFC1_AG0_AFEM1_AFEM1_ASEM1_CLR0_CADS0_DTLA0_DTLB0_DTVA0_DTVB0_DTVMXSA0_DTVMXSB0_DTVSM0_DPLB0_EPS0_ELFLR0_EMLLn1_FDSI0_GRPM1_GRVWA1_GRVWB1_GSU1_GSUAMB_GSUC0_GSUWGMRR0_GLS0_ISA1151_IU1_K1_LDSTI0_LBSPPA0_LBSPPB0_LBSPPM0_LPA1_LPB1_LPM0_LRVW1_LWPMn1_MIAV0_MO40_MGRIPM1_NTn1_NTA0_NTB0_NTC0_NTD0_NTM0_NEPBS0_NLCA1_NLCB1_ONLL1_PGR0_PLR1_PKA0_SGROB0_SIA1_SS0_SU16_SUM0_SUS256_SPO0_SRVW0_SSO0_SVW1_SK0_SKFTR0_SKXCCM0_SGRO0_TDMI0_TIN0_TT2_4_TLDS0_TLDSMn1_ULSGRO0_USL1_UIOFGRO0_UPLRP0_USFGROn1_VSn1_VWA1_VWB1_WSGRA0_WSGRB0_WS32_WG16_8_1_WGM1_WGMXCC1_WGMXCCGn1
    SolutionIndex: 201
    SolutionNameMin: Cijk_Alik_Bljk_S_B_Bias_HA_S_SAV_UserArgs_MT32x32x64_SN_LDSB0_AFC1_AG0_AFEM1_AFEM1_ASEM1_CLR0_CADS0_DTLA0_DTLB0_DTVA0_DTVB0_DTVMXSA0_DTVMXSB0_DTVSM0_DPLB0_EPS0_ELFLR0_EMLLn1_FDSI0_GRPM1_GRVWA1_GRVWB1_GSU1_GSUAMB_GSUC0_GSUWGMRR0_GLS0_ISA1151_IU1_K1_LDSTI0_LBSPPA0_LBSPPB0_LBSPPM0_LPA1_LPB1_LPM0_LRVW1_LWPMn1_MIAV0_MO40_MGRIPM1_NTn1_NTA0_NTB0_NTC0_NTD0_NTM0_NEPBS0_NLCA1_NLCB1_ONLL1_PGR0_PLR1_PKA0_SGROB0_SIA1_SS0_SU0_SUM0_SUS0_SPO0_SRVW0_SSO0_SVW1_SK0_SKFTR0_SKXCCM0_SGRO0_TDMI0_TIN0_TT2_4_TLDS0_TLDSMn1_ULSGRO0_USL1_UIOFGRO0_UPLRP0_USFGROn1_VSn1_VWA1_VWB1_WSGRA0_WSGRB0_WS32_WG16_8_1_WGM1_WGMXCC1_WGMXCCGn1
    SolutionIndex: 202
    SolutionNameMin: Cijk_Alik_Bljk_S_B_Bias_HA_S_SAV_UserArgs_MT32x16x32_SN_LDSB0_AFC1_AG0_AFEM1_AFEM1_ASEM1_CLR0_CADS0_DTLA0_DTLB0_DTVA0_DTVB0_DTVMXSA0_DTVMXSB0_DTVSM0_DPLB0_EPS0_ELFLR0_EMLLn1_FDSI0_GRPM1_GRVWA1_GRVWB1_GSU1_GSUAMB_GSUC0_GSUWGMRR0_GLS0_ISA1151_IU1_K1_LDSTI0_LBSPPA0_LBSPPB0_LBSPPM0_LPA1_LPB1_LPM0_LRVW1_LWPMn1_MIAV0_MO40_MGRIPM1_NTn1_NTA0_NTB0_NTC0_NTD0_NTM0_NEPBS0_NLCA1_NLCB1_ONLL1_PGR0_PLR1_PKA0_SGROB0_SIA1_SS0_SU16_SUM0_SUS256_SPO0_SRVW0_SSO0_SVW1_SK0_SKFTR0_SKXCCM0_SGRO0_TDMI0_TIN0_TT4_2_TLDS0_TLDSMn1_ULSGRO0_USL1_UIOFGRO0_UPLRP0_USFGROn1_VSn1_VWA1_VWB1_WSGRA0_WSGRB0_WS32_WG8_8_1_WGM1_WGMXCC1_WGMXCCGn1
    SolutionIndex: 203
    SolutionNameMin: Cijk_Alik_Bljk_S_B_Bias_HA_S_SAV_UserArgs_MT32x32x64_SN_LDSB0_AFC1_AG0_AFEM1_AFEM1_ASEM1_CLR0_CADS0_DTLA0_DTLB0_DTVA0_DTVB0_DTVMXSA0_DTVMXSB0_DTVSM0_DPLB0_EPS0_ELFLR0_EMLLn1_FDSI0_GRPM1_GRVWA1_GRVWB1_GSU1_GSUAMB_GSUC0_GSUWGMRR0_GLS0_ISA1151_IU1_K1_LDSTI0_LBSPPA0_LBSPPB0_LBSPPM0_LPA1_LPB1_LPM0_LRVW1_LWPMn1_MIAV0_MO40_MGRIPM1_NTn1_NTA0_NTB0_NTC0_NTD0_NTM0_NEPBS0_NLCA1_NLCB1_ONLL1_PGR1_PLR1_PKA0_SGROB0_SIA1_SS0_SU0_SUM0_SUS0_SPO0_SRVW0_SSO0_SVW1_SK0_SKFTR0_SKXCCM0_SGRO0_TDMI0_TIN0_TT2_4_TLDS0_TLDSMn1_ULSGRO0_USL1_UIOFGRO0_UPLRP0_USFGROn1_VSn1_VWA1_VWB1_WSGRA0_WSGRB0_WS32_WG16_8_1_WGM1_WGMXCC1_WGMXCCGn1
    SolutionIndex: 204
    SolutionNameMin: Cijk_Alik_Bljk_S_B_Bias_HA_S_SAV_UserArgs_MT32x32x64_SN_LDSB0_AFC1_AG0_AFEM1_AFEM1_ASEM1_CLR0_CADS0_DTLA0_DTLB0_DTVA0_DTVB0_DTVMXSA0_DTVMXSB0_DTVSM0_DPLB0_EPS0_ELFLR0_EMLLn1_FDSI0_GRPM1_GRVWA1_GRVWB1_GSU1_GSUAMB_GSUC0_GSUWGMRR0_GLS0_ISA1151_IU1_K1_LDSTI0_LBSPPA0_LBSPPB0_LBSPPM0_LPA1_LPB1_LPM0_LRVW1_LWPMn1_MIAV0_MO40_MGRIPM1_NTn1_NTA0_NTB0_NTC0_NTD0_NTM0_NEPBS0_NLCA1_NLCB1_ONLL1_PGR1_PLR1_PKA0_SGROB0_SIA1_SS0_SU16_SUM0_SUS256_SPO0_SRVW0_SSO0_SVW1_SK0_SKFTR0_SKXCCM0_SGRO0_TDMI0_TIN0_TT2_4_TLDS0_TLDSMn1_ULSGRO0_USL1_UIOFGRO0_UPLRP0_USFGROn1_VSn1_VWA1_VWB1_WSGRA0_WSGRB0_WS32_WG16_8_1_WGM1_WGMXCC1_WGMXCCGn1
    SolutionIndex: 205
    SolutionNameMin: Cijk_Alik_Bljk_S_B_Bias_HA_S_SAV_UserArgs_MT32x32x64_SN_LDSB0_AFC1_AG0_AFEM1_AFEM1_ASEM1_CLR0_CADS0_DTLA0_DTLB0_DTVA0_DTVB0_DTVMXSA0_DTVMXSB0_DTVSM0_DPLB0_EPS0_ELFLR0_EMLLn1_FDSI0_GRPM1_GRVWA1_GRVWB1_GSU1_GSUAMB_GSUC0_GSUWGMRR0_GLS0_ISA1151_IU1_K1_LDSTI0_LBSPPA0_LBSPPB0_LBSPPM0_LPA1_LPB1_LPM0_LRVW1_LWPMn1_MIAV0_MO40_MGRIPM1_NTn1_NTA0_NTB0_NTC0_NTD0_NTM0_NEPBS0_NLCA1_NLCB1_ONLL1_PGR1_PLR1_PKA0_SGROB0_SIA1_SS0_SU8_SUM0_SUS256_SPO0_SRVW0_SSO0_SVW1_SK0_SKFTR0_SKXCCM0_SGRO0_TDMI0_TIN0_TT2_4_TLDS0_TLDSMn1_ULSGRO0_USL1_UIOFGRO0_UPLRP0_USFGROn1_VSn1_VWA1_VWB1_WSGRA0_WSGRB0_WS32_WG16_8_1_WGM1_WGMXCC1_WGMXCCGn1
    SolutionIndex: 206
    SolutionNameMin: Cijk_Alik_Bljk_S_B_Bias_HA_S_SAV_UserArgs_MT16x32x32_SN_LDSB0_AFC1_AG0_AFEM1_AFEM1_ASEM1_CLR0_CADS0_DTLA0_DTLB0_DTVA0_DTVB0_DTVMXSA0_DTVMXSB0_DTVSM0_DPLB0_EPS0_ELFLR0_EMLLn1_FDSI0_GRPM1_GRVWA1_GRVWB1_GSU1_GSUAMB_GSUC0_GSUWGMRR0_GLS0_ISA1151_IU1_K1_LDSTI0_LBSPPA0_LBSPPB0_LBSPPM0_LPA1_LPB1_LPM0_LRVW1_LWPMn1_MIAV0_MO40_MGRIPM1_NTn1_NTA0_NTB0_NTC0_NTD0_NTM0_NEPBS0_NLCA1_NLCB1_ONLL1_PGR1_PLR1_PKA0_SGROB0_SIA1_SS0_SU8_SUM0_SUS256_SPO0_SRVW0_SSO0_SVW1_SK0_SKFTR0_SKXCCM0_SGRO0_TDMI0_TIN0_TT2_4_TLDS0_TLDSMn1_ULSGRO0_USL1_UIOFGRO0_UPLRP0_USFGROn1_VSn1_VWA1_VWB1_WSGRA0_WSGRB0_WS32_WG8_8_1_WGM1_WGMXCC1_WGMXCCGn1
    SolutionIndex: 207
    SolutionNameMin: Cijk_Alik_Bljk_S_B_Bias_HA_S_SAV_UserArgs_MT16x32x64_SN_LDSB0_AFC1_AG0_AFEM1_AFEM1_ASEM1_CLR0_CADS0_DTLA0_DTLB0_DTVA0_DTVB0_DTVMXSA0_DTVMXSB0_DTVSM0_DPLB0_EPS0_ELFLR0_EMLLn1_FDSI0_GRPM1_GRVWA1_GRVWB1_GSU1_GSUAMB_GSUC0_GSUWGMRR0_GLS0_ISA1151_IU1_K1_LDSTI0_LBSPPA0_LBSPPB0_LBSPPM0_LPA1_LPB1_LPM0_LRVW1_LWPMn1_MIAV0_MO40_MGRIPM1_NTn1_NTA0_NTB0_NTC0_NTD0_NTM0_NEPBS0_NLCA1_NLCB1_ONLL1_PGR1_PLR1_PKA0_SGROB0_SIA1_SS0_SU8_SUM0_SUS256_SPO0_SRVW0_SSO0_SVW1_SK0_SKFTR0_SKXCCM0_SGRO0_TDMI0_TIN0_TT2_4_TLDS0_TLDSMn1_ULSGRO0_USL1_UIOFGRO0_UPLRP0_USFGROn1_VSn1_VWA1_VWB1_WSGRA0_WSGRB0_WS32_WG8_8_1_WGM1_WGMXCC1_WGMXCCGn1
    SolutionIndex: 208
    SolutionNameMin: Cijk_Alik_Bljk_S_B_Bias_HA_S_SAV_UserArgs_MT64x32x64_SN_LDSB0_AFC1_AG0_AFEM1_AFEM1_ASEM1_CLR0_CADS0_DTLA0_DTLB0_DTVA0_DTVB0_DTVMXSA0_DTVMXSB0_DTVSM0_DPLB0_EPS0_ELFLR0_EMLLn1_FDSI0_GRPM1_GRVWA1_GRVWB1_GSU1_GSUAMB_GSUC0_GSUWGMRR0_GLS0_ISA1151_IU1_K1_LDSTI0_LBSPPA0_LBSPPB0_LBSPPM0_LPA1_LPB1_LPM0_LRVW1_LWPMn1_MIAV0_MO40_MGRIPM1_NTn1_NTA0_NTB0_NTC0_NTD0_NTM0_NEPBS0_NLCA1_NLCB1_ONLL1_PGR1_PLR1_PKA0_SGROB0_SIA1_SS0_SU0_SUM0_SUS0_SPO0_SRVW0_SSO0_SVW1_SK0_SKFTR0_SKXCCM0_SGRO0_TDMI0_TIN0_TT4_4_TLDS0_TLDSMn1_ULSGRO0_USL1_UIOFGRO0_UPLRP0_USFGROn1_VSn1_VWA1_VWB1_WSGRA0_WSGRB0_WS32_WG16_8_1_WGM1_WGMXCC1_WGMXCCGn1
    SolutionIndex: 209
    SolutionNameMin: Cijk_Alik_Bljk_S_B_Bias_HA_S_SAV_UserArgs_MT32x32x32_SN_LDSB0_AFC1_AG0_AFEM1_AFEM1_ASEM1_CLR0_CADS0_DTLA0_DTLB0_DTVA0_DTVB0_DTVMXSA0_DTVMXSB0_DTVSM0_DPLB0_EPS0_ELFLR0_EMLLn1_FDSI0_GRPM1_GRVWA1_GRVWB1_GSU1_GSUAMB_GSUC0_GSUWGMRR0_GLS0_ISA1151_IU1_K1_LDSTI0_LBSPPA0_LBSPPB0_LBSPPM0_LPA1_LPB1_LPM0_LRVW1_LWPMn1_MIAV0_MO40_MGRIPM1_NTn1_NTA0_NTB0_NTC0_NTD0_NTM0_NEPBS0_NLCA1_NLCB1_ONLL1_PGR1_PLR1_PKA0_SGROB0_SIA1_SS0_SU8_SUM0_SUS256_SPO0_SRVW0_SSO0_SVW1_SK0_SKFTR0_SKXCCM0_SGRO0_TDMI0_TIN0_TT2_4_TLDS0_TLDSMn1_ULSGRO0_USL1_UIOFGRO0_UPLRP0_USFGROn1_VSn1_VWA1_VWB1_WSGRA0_WSGRB0_WS32_WG16_8_1_WGM1_WGMXCC1_WGMXCCGn1
    SolutionIndex: 210
    SolutionNameMin: Cijk_Alik_Bljk_S_B_Bias_HA_S_SAV_UserArgs_MT16x32x64_SN_LDSB0_AFC1_AG0_AFEM1_AFEM1_ASEM1_CLR0_CADS0_DTLA0_DTLB0_DTVA0_DTVB0_DTVMXSA0_DTVMXSB0_DTVSM0_DPLB0_EPS0_ELFLR0_EMLLn1_FDSI0_GRPM1_GRVWA1_GRVWB1_GSU1_GSUAMB_GSUC0_GSUWGMRR0_GLS0_ISA1151_IU1_K1_LDSTI0_LBSPPA0_LBSPPB0_LBSPPM0_LPA1_LPB1_LPM0_LRVW1_LWPMn1_MIAV0_MO40_MGRIPM1_NTn1_NTA0_NTB0_NTC0_NTD0_NTM0_NEPBS0_NLCA1_NLCB1_ONLL1_PGR0_PLR1_PKA0_SGROB0_SIA1_SS0_SU8_SUM0_SUS256_SPO0_SRVW0_SSO0_SVW1_SK0_SKFTR0_SKXCCM0_SGRO0_TDMI0_TIN0_TT2_4_TLDS0_TLDSMn1_ULSGRO0_USL1_UIOFGRO0_UPLRP0_USFGROn1_VSn1_VWA1_VWB1_WSGRA0_WSGRB0_WS32_WG8_8_1_WGM1_WGMXCC1_WGMXCCGn1
    SolutionIndex: 211
    SolutionNameMin: Cijk_Alik_Bljk_S_B_Bias_HA_S_SAV_UserArgs_MT64x32x64_SN_LDSB0_AFC1_AG0_AFEM1_AFEM1_ASEM1_CLR0_CADS0_DTLA0_DTLB0_DTVA0_DTVB0_DTVMXSA0_DTVMXSB0_DTVSM0_DPLB0_EPS0_ELFLR0_EMLLn1_FDSI0_GRPM1_GRVWA1_GRVWB1_GSU1_GSUAMB_GSUC0_GSUWGMRR0_GLS0_ISA1151_IU1_K1_LDSTI0_LBSPPA0_LBSPPB0_LBSPPM0_LPA1_LPB1_LPM0_LRVW1_LWPMn1_MIAV0_MO40_MGRIPM1_NTn1_NTA0_NTB0_NTC0_NTD0_NTM0_NEPBS0_NLCA1_NLCB1_ONLL1_PGR1_PLR1_PKA0_SGROB0_SIA1_SS0_SU8_SUM0_SUS256_SPO0_SRVW0_SSO0_SVW1_SK0_SKFTR0_SKXCCM0_SGRO0_TDMI0_TIN0_TT4_4_TLDS0_TLDSMn1_ULSGRO0_USL1_UIOFGRO0_UPLRP0_USFGROn1_VSn1_VWA1_VWB1_WSGRA0_WSGRB0_WS32_WG16_8_1_WGM1_WGMXCC1_WGMXCCGn1
    SolutionIndex: 212
    SolutionNameMin: Cijk_Alik_Bljk_S_B_Bias_HA_S_SAV_UserArgs_MT64x32x128_SN_LDSB0_AFC1_AG0_AFEM1_AFEM1_ASEM1_CLR0_CADS0_DTLA0_DTLB0_DTVA0_DTVB0_DTVMXSA0_DTVMXSB0_DTVSM0_DPLB0_EPS0_ELFLR0_EMLLn1_FDSI0_GRPM1_GRVWA1_GRVWB1_GSU1_GSUAMB_GSUC0_GSUWGMRR0_GLS0_ISA1151_IU1_K1_LDSTI0_LBSPPA0_LBSPPB0_LBSPPM0_LPA1_LPB1_LPM0_LRVW1_LWPMn1_MIAV0_MO40_MGRIPM1_NTn1_NTA0_NTB0_NTC0_NTD0_NTM0_NEPBS0_NLCA1_NLCB1_ONLL1_PGR0_PLR1_PKA0_SGROB0_SIA1_SS0_SU0_SUM0_SUS0_SPO0_SRVW0_SSO0_SVW1_SK0_SKFTR0_SKXCCM0_SGRO0_TDMI0_TIN0_TT4_4_TLDS0_TLDSMn1_ULSGRO0_USL1_UIOFGRO0_UPLRP0_USFGROn1_VSn1_VWA1_VWB1_WSGRA0_WSGRB0_WS32_WG16_8_1_WGM1_WGMXCC1_WGMXCCGn1
    SolutionIndex: 213
    SolutionNameMin: Cijk_Alik_Bljk_S_B_Bias_HA_S_SAV_UserArgs_MT64x32x128_SN_LDSB0_AFC1_AG0_AFEM1_AFEM1_ASEM1_CLR0_CADS0_DTLA0_DTLB0_DTVA0_DTVB0_DTVMXSA0_DTVMXSB0_DTVSM0_DPLB0_EPS0_ELFLR0_EMLLn1_FDSI0_GRPM1_GRVWA1_GRVWB1_GSU1_GSUAMB_GSUC0_GSUWGMRR0_GLS0_ISA1151_IU1_K1_LDSTI0_LBSPPA0_LBSPPB0_LBSPPM0_LPA1_LPB1_LPM0_LRVW1_LWPMn1_MIAV0_MO40_MGRIPM1_NTn1_NTA0_NTB0_NTC0_NTD0_NTM0_NEPBS0_NLCA1_NLCB1_ONLL1_PGR0_PLR1_PKA0_SGROB0_SIA1_SS0_SU8_SUM0_SUS512_SPO0_SRVW0_SSO0_SVW1_SK0_SKFTR0_SKXCCM0_SGRO0_TDMI0_TIN0_TT4_4_TLDS0_TLDSMn1_ULSGRO0_USL1_UIOFGRO0_UPLRP0_USFGROn1_VSn1_VWA1_VWB1_WSGRA0_WSGRB0_WS32_WG16_8_1_WGM1_WGMXCC1_WGMXCCGn1
    SolutionIndex: 214
    SolutionNameMin: Cijk_Alik_Bljk_S_B_Bias_HA_S_SAV_UserArgs_MT32x16x32_SN_LDSB0_AFC1_AG0_AFEM1_AFEM1_ASEM1_CLR0_CADS0_DTLA0_DTLB0_DTVA0_DTVB0_DTVMXSA0_DTVMXSB0_DTVSM0_DPLB0_EPS0_ELFLR0_EMLLn1_FDSI0_GRPM1_GRVWA1_GRVWB1_GSU1_GSUAMB_GSUC0_GSUWGMRR0_GLS0_ISA1151_IU1_K1_LDSTI0_LBSPPA0_LBSPPB0_LBSPPM0_LPA1_LPB1_LPM0_LRVW1_LWPMn1_MIAV0_MO40_MGRIPM1_NTn1_NTA0_NTB0_NTC0_NTD0_NTM0_NEPBS0_NLCA1_NLCB1_ONLL1_PGR1_PLR1_PKA0_SGROB0_SIA1_SS0_SU16_SUM0_SUS256_SPO0_SRVW0_SSO0_SVW1_SK0_SKFTR0_SKXCCM0_SGRO0_TDMI0_TIN0_TT2_2_TLDS0_TLDSMn1_ULSGRO0_USL1_UIOFGRO0_UPLRP0_USFGROn1_VSn1_VWA1_VWB1_WSGRA0_WSGRB0_WS32_WG16_8_1_WGM1_WGMXCC1_WGMXCCGn1
    SolutionIndex: 215
    SolutionNameMin: Cijk_Alik_Bljk_S_B_Bias_HA_S_SAV_UserArgs_MT16x16x128_SN_LDSB0_AFC1_AG0_AFEM1_AFEM1_ASEM1_CLR0_CADS0_DTLA0_DTLB0_DTVA0_DTVB0_DTVMXSA0_DTVMXSB0_DTVSM0_DPLB0_EPS0_ELFLR0_EMLLn1_FDSI0_GRPM1_GRVWA1_GRVWB1_GSU1_GSUAMB_GSUC0_GSUWGMRR0_GLS0_ISA1151_IU1_K1_LDSTI0_LBSPPA0_LBSPPB0_LBSPPM0_LPA1_LPB1_LPM0_LRVW1_LWPMn1_MIAV0_MO40_MGRIPM1_NTn1_NTA0_NTB0_NTC0_NTD0_NTM0_NEPBS0_NLCA2_NLCB2_ONLL1_PGR0_PLR1_PKA0_SGROB0_SIA1_SS0_SU16_SUM0_SUS512_SPO0_SRVW0_SSO0_SVW1_SK0_SKFTR0_SKXCCM0_SGRO0_TDMI0_TIN0_TT2_2_TLDS0_TLDSMn1_ULSGRO0_USL1_UIOFGRO0_UPLRP0_USFGROn1_VSn1_VWA1_VWB1_WSGRA0_WSGRB0_WS32_WG8_8_1_WGM1_WGMXCC1_WGMXCCGn1
    SolutionIndex: 216
    SolutionNameMin: Cijk_Alik_Bljk_S_B_Bias_HA_S_SAV_UserArgs_MT32x16x64_SN_LDSB0_AFC1_AG0_AFEM1_AFEM1_ASEM1_CLR0_CADS0_DTLA0_DTLB0_DTVA0_DTVB0_DTVMXSA0_DTVMXSB0_DTVSM0_DPLB0_EPS0_ELFLR0_EMLLn1_FDSI0_GRPM1_GRVWA1_GRVWB1_GSU1_GSUAMB_GSUC0_GSUWGMRR0_GLS0_ISA1151_IU1_K1_LDSTI0_LBSPPA0_LBSPPB0_LBSPPM0_LPA1_LPB1_LPM0_LRVW1_LWPMn1_MIAV0_MO40_MGRIPM1_NTn1_NTA0_NTB0_NTC0_NTD0_NTM0_NEPBS0_NLCA1_NLCB1_ONLL1_PGR1_PLR1_PKA0_SGROB0_SIA1_SS0_SU16_SUM0_SUS256_SPO0_SRVW0_SSO0_SVW1_SK0_SKFTR0_SKXCCM0_SGRO0_TDMI0_TIN0_TT2_2_TLDS0_TLDSMn1_ULSGRO0_USL1_UIOFGRO0_UPLRP0_USFGROn1_VSn1_VWA1_VWB1_WSGRA0_WSGRB0_WS32_WG16_8_1_WGM1_WGMXCC1_WGMXCCGn1
    SolutionIndex: 217
    SolutionNameMin: Cijk_Alik_Bljk_S_B_Bias_HA_S_SAV_UserArgs_MT64x32x64_SN_LDSB0_AFC1_AG0_AFEM1_AFEM1_ASEM1_CLR0_CADS0_DTLA0_DTLB0_DTVA0_DTVB0_DTVMXSA0_DTVMXSB0_DTVSM0_DPLB0_EPS0_ELFLR0_EMLLn1_FDSI0_GRPM1_GRVWA1_GRVWB1_GSU1_GSUAMB_GSUC0_GSUWGMRR0_GLS0_ISA1151_IU1_K1_LDSTI0_LBSPPA0_LBSPPB0_LBSPPM0_LPA1_LPB1_LPM0_LRVW1_LWPMn1_MIAV0_MO40_MGRIPM1_NTn1_NTA0_NTB0_NTC0_NTD0_NTM0_NEPBS0_NLCA1_NLCB1_ONLL1_PGR1_PLR1_PKA0_SGROB0_SIA1_SS0_SU16_SUM0_SUS256_SPO0_SRVW0_SSO0_SVW1_SK0_SKFTR0_SKXCCM0_SGRO0_TDMI0_TIN0_TT4_4_TLDS0_TLDSMn1_ULSGRO0_USL1_UIOFGRO0_UPLRP0_USFGROn1_VSn1_VWA1_VWB1_WSGRA0_WSGRB0_WS32_WG16_8_1_WGM1_WGMXCC1_WGMXCCGn1
    SolutionIndex: 218
    SolutionNameMin: Cijk_Alik_Bljk_S_B_Bias_HA_S_SAV_UserArgs_MT16x16x64_SN_LDSB0_AFC1_AG0_AFEM1_AFEM1_ASEM1_CLR0_CADS0_DTLA0_DTLB0_DTVA0_DTVB0_DTVMXSA0_DTVMXSB0_DTVSM0_DPLB0_EPS0_ELFLR0_EMLLn1_FDSI0_GRPM1_GRVWA1_GRVWB1_GSU1_GSUAMB_GSUC0_GSUWGMRR0_GLS0_ISA1151_IU1_K1_LDSTI0_LBSPPA0_LBSPPB0_LBSPPM0_LPA1_LPB1_LPM0_LRVW1_LWPMn1_MIAV0_MO40_MGRIPM1_NTn1_NTA0_NTB0_NTC0_NTD0_NTM0_NEPBS0_NLCA1_NLCB1_ONLL1_PGR1_PLR1_PKA0_SGROB0_SIA1_SS0_SU16_SUM0_SUS256_SPO0_SRVW0_SSO0_SVW1_SK0_SKFTR0_SKXCCM0_SGRO0_TDMI0_TIN0_TT2_2_TLDS0_TLDSMn1_ULSGRO0_USL1_UIOFGRO0_UPLRP0_USFGROn1_VSn1_VWA1_VWB1_WSGRA0_WSGRB0_WS32_WG8_8_1_WGM1_WGMXCC1_WGMXCCGn1
    SolutionIndex: 219
    SolutionNameMin: Cijk_Alik_Bljk_S_B_Bias_HA_S_SAV_UserArgs_MT16x16x64_SN_LDSB0_AFC1_AG0_AFEM1_AFEM1_ASEM1_CLR0_CADS0_DTLA0_DTLB0_DTVA0_DTVB0_DTVMXSA0_DTVMXSB0_DTVSM0_DPLB0_EPS0_ELFLR0_EMLLn1_FDSI0_GRPM1_GRVWA1_GRVWB1_GSU1_GSUAMB_GSUC0_GSUWGMRR0_GLS0_ISA1151_IU1_K1_LDSTI0_LBSPPA0_LBSPPB0_LBSPPM0_LPA1_LPB1_LPM0_LRVW1_LWPMn1_MIAV0_MO40_MGRIPM1_NTn1_NTA0_NTB0_NTC0_NTD0_NTM0_NEPBS0_NLCA1_NLCB1_ONLL1_PGR0_PLR1_PKA0_SGROB0_SIA1_SS0_SU16_SUM0_SUS256_SPO0_SRVW0_SSO0_SVW1_SK0_SKFTR0_SKXCCM0_SGRO0_TDMI0_TIN0_TT2_2_TLDS0_TLDSMn1_ULSGRO0_USL1_UIOFGRO0_UPLRP0_USFGROn1_VSn1_VWA1_VWB1_WSGRA0_WSGRB0_WS32_WG8_8_1_WGM1_WGMXCC1_WGMXCCGn1
    SolutionIndex: 220
    SolutionNameMin: Cijk_Alik_Bljk_S_B_Bias_HA_S_SAV_UserArgs_MT32x32x32_SN_LDSB0_AFC1_AG0_AFEM1_AFEM1_ASEM1_CLR0_CADS0_DTLA0_DTLB0_DTVA0_DTVB0_DTVMXSA0_DTVMXSB0_DTVSM0_DPLB0_EPS0_ELFLR0_EMLLn1_FDSI0_GRPM1_GRVWA1_GRVWB1_GSU1_GSUAMB_GSUC0_GSUWGMRR0_GLS0_ISA1151_IU1_K1_LDSTI0_LBSPPA0_LBSPPB0_LBSPPM0_LPA1_LPB1_LPM0_LRVW1_LWPMn1_MIAV0_MO40_MGRIPM1_NTn1_NTA0_NTB0_NTC0_NTD0_NTM0_NEPBS0_NLCA1_NLCB1_ONLL1_PGR1_PLR1_PKA0_SGROB0_SIA1_SS0_SU32_SUM0_SUS256_SPO0_SRVW0_SSO0_SVW1_SK0_SKFTR0_SKXCCM0_SGRO0_TDMI0_TIN0_TT2_4_TLDS0_TLDSMn1_ULSGRO0_USL1_UIOFGRO0_UPLRP0_USFGROn1_VSn1_VWA1_VWB1_WSGRA0_WSGRB0_WS32_WG16_8_1_WGM1_WGMXCC1_WGMXCCGn1
    SolutionIndex: 221
    SolutionNameMin: Cijk_Alik_Bljk_S_B_Bias_HA_S_SAV_UserArgs_MT64x32x32_SN_LDSB0_AFC1_AG0_AFEM1_AFEM1_ASEM1_CLR0_CADS0_DTLA0_DTLB0_DTVA0_DTVB0_DTVMXSA0_DTVMXSB0_DTVSM0_DPLB0_EPS0_ELFLR0_EMLLn1_FDSI0_GRPM1_GRVWA1_GRVWB1_GSU1_GSUAMB_GSUC0_GSUWGMRR0_GLS0_ISA1151_IU1_K1_LDSTI0_LBSPPA0_LBSPPB0_LBSPPM0_LPA1_LPB1_LPM0_LRVW1_LWPMn1_MIAV0_MO40_MGRIPM1_NTn1_NTA0_NTB0_NTC0_NTD0_NTM0_NEPBS0_NLCA1_NLCB1_ONLL1_PGR1_PLR1_PKA0_SGROB0_SIA1_SS0_SU32_SUM0_SUS256_SPO0_SRVW0_SSO0_SVW1_SK0_SKFTR0_SKXCCM0_SGRO0_TDMI0_TIN0_TT4_4_TLDS0_TLDSMn1_ULSGRO0_USL1_UIOFGRO0_UPLRP0_USFGROn1_VSn1_VWA1_VWB1_WSGRA0_WSGRB0_WS32_WG16_8_1_WGM1_WGMXCC1_WGMXCCGn1
    SolutionIndex: 222
    SolutionNameMin: Cijk_Alik_Bljk_S_B_Bias_HA_S_SAV_UserArgs_MT16x32x64_SN_LDSB0_AFC1_AG0_AFEM1_AFEM1_ASEM1_CLR0_CADS0_DTLA0_DTLB0_DTVA0_DTVB0_DTVMXSA0_DTVMXSB0_DTVSM0_DPLB0_EPS0_ELFLR0_EMLLn1_FDSI0_GRPM1_GRVWA1_GRVWB1_GSU1_GSUAMB_GSUC0_GSUWGMRR0_GLS0_ISA1151_IU1_K1_LDSTI0_LBSPPA0_LBSPPB0_LBSPPM0_LPA1_LPB1_LPM0_LRVW1_LWPMn1_MIAV0_MO40_MGRIPM1_NTn1_NTA0_NTB0_NTC0_NTD0_NTM0_NEPBS0_NLCA1_NLCB1_ONLL1_PGR1_PLR1_PKA0_SGROB0_SIA1_SS0_SU32_SUM0_SUS256_SPO0_SRVW0_SSO0_SVW1_SK0_SKFTR0_SKXCCM0_SGRO0_TDMI0_TIN0_TT2_4_TLDS0_TLDSMn1_ULSGRO0_USL1_UIOFGRO0_UPLRP0_USFGROn1_VSn1_VWA1_VWB1_WSGRA0_WSGRB0_WS32_WG8_8_1_WGM1_WGMXCC1_WGMXCCGn1
    SolutionIndex: 223
    SolutionNameMin: Cijk_Alik_Bljk_S_B_Bias_HA_S_SAV_UserArgs_MT32x16x32_SN_LDSB0_AFC1_AG0_AFEM1_AFEM1_ASEM1_CLR0_CADS0_DTLA0_DTLB0_DTVA0_DTVB0_DTVMXSA0_DTVMXSB0_DTVSM0_DPLB0_EPS0_ELFLR0_EMLLn1_FDSI0_GRPM1_GRVWA1_GRVWB1_GSU1_GSUAMB_GSUC0_GSUWGMRR0_GLS0_ISA1151_IU1_K1_LDSTI0_LBSPPA0_LBSPPB0_LBSPPM0_LPA1_LPB1_LPM0_LRVW1_LWPMn1_MIAV0_MO40_MGRIPM1_NTn1_NTA0_NTB0_NTC0_NTD0_NTM0_NEPBS0_NLCA1_NLCB1_ONLL1_PGR1_PLR1_PKA0_SGROB0_SIA1_SS0_SU32_SUM0_SUS256_SPO0_SRVW0_SSO0_SVW1_SK0_SKFTR0_SKXCCM0_SGRO0_TDMI0_TIN0_TT2_2_TLDS0_TLDSMn1_ULSGRO0_USL1_UIOFGRO0_UPLRP0_USFGROn1_VSn1_VWA1_VWB1_WSGRA0_WSGRB0_WS32_WG16_8_1_WGM1_WGMXCC1_WGMXCCGn1
    SolutionIndex: 224
    SolutionNameMin: Cijk_Alik_Bljk_S_B_Bias_HA_S_SAV_UserArgs_MT16x16x32_SN_LDSB0_AFC1_AG0_AFEM1_AFEM1_ASEM1_CLR0_CADS0_DTLA0_DTLB0_DTVA0_DTVB0_DTVMXSA0_DTVMXSB0_DTVSM0_DPLB0_EPS0_ELFLR0_EMLLn1_FDSI0_GRPM1_GRVWA1_GRVWB1_GSU1_GSUAMB_GSUC0_GSUWGMRR0_GLS0_ISA1151_IU1_K1_LDSTI0_LBSPPA0_LBSPPB0_LBSPPM0_LPA1_LPB1_LPM0_LRVW1_LWPMn1_MIAV0_MO40_MGRIPM1_NTn1_NTA0_NTB0_NTC0_NTD0_NTM0_NEPBS0_NLCA1_NLCB1_ONLL1_PGR1_PLR1_PKA0_SGROB0_SIA1_SS0_SU32_SUM0_SUS256_SPO0_SRVW0_SSO0_SVW1_SK0_SKFTR0_SKXCCM0_SGRO0_TDMI0_TIN0_TT2_2_TLDS0_TLDSMn1_ULSGRO0_USL1_UIOFGRO0_UPLRP0_USFGROn1_VSn1_VWA1_VWB1_WSGRA0_WSGRB0_WS32_WG8_8_1_WGM1_WGMXCC1_WGMXCCGn1
    SolutionIndex: 225
    SolutionNameMin: Cijk_Alik_Bljk_S_B_Bias_HA_S_SAV_UserArgs_MT32x16x32_SN_LDSB0_AFC1_AG0_AFEM1_AFEM1_ASEM1_CLR0_CADS0_DTLA0_DTLB0_DTVA0_DTVB0_DTVMXSA0_DTVMXSB0_DTVSM0_DPLB0_EPS0_ELFLR0_EMLLn1_FDSI0_GRPM1_GRVWA1_GRVWB1_GSU1_GSUAMB_GSUC0_GSUWGMRR0_GLS0_ISA1151_IU1_K1_LDSTI0_LBSPPA0_LBSPPB0_LBSPPM0_LPA1_LPB1_LPM0_LRVW1_LWPMn1_MIAV0_MO40_MGRIPM1_NTn1_NTA0_NTB0_NTC0_NTD0_NTM0_NEPBS0_NLCA1_NLCB1_ONLL1_PGR0_PLR1_PKA0_SGROB0_SIA1_SS0_SU0_SUM0_SUS0_SPO0_SRVW0_SSO0_SVW1_SK0_SKFTR0_SKXCCM0_SGRO0_TDMI0_TIN0_TT2_2_TLDS0_TLDSMn1_ULSGRO0_USL1_UIOFGRO0_UPLRP0_USFGROn1_VSn1_VWA1_VWB1_WSGRA0_WSGRB0_WS32_WG16_8_1_WGM1_WGMXCC1_WGMXCCGn1
    SolutionIndex: 226
    SolutionNameMin: Cijk_Alik_Bljk_S_B_Bias_HA_S_SAV_UserArgs_MT64x16x16_SN_LDSB0_AFC1_AG0_AFEM1_AFEM1_ASEM1_CLR0_CADS0_DTLA0_DTLB0_DTVA0_DTVB0_DTVMXSA0_DTVMXSB0_DTVSM0_DPLB0_EPS0_ELFLR0_EMLLn1_FDSI0_GRPM1_GRVWA1_GRVWB1_GSU1_GSUAMB_GSUC0_GSUWGMRR0_GLS0_ISA1151_IU1_K1_LDSTI0_LBSPPA0_LBSPPB0_LBSPPM0_LPA1_LPB1_LPM0_LRVW1_LWPMn1_MIAV0_MO40_MGRIPM1_NTn1_NTA0_NTB0_NTC0_NTD0_NTM0_NEPBS0_NLCA1_NLCB1_ONLL1_PGR0_PLR1_PKA0_SGROB0_SIA1_SS0_SU0_SUM0_SUS0_SPO0_SRVW0_SSO0_SVW1_SK0_SKFTR0_SKXCCM0_SGRO0_TDMI0_TIN0_TT4_2_TLDS0_TLDSMn1_ULSGRO0_USL1_UIOFGRO0_UPLRP0_USFGROn1_VSn1_VWA1_VWB1_WSGRA0_WSGRB0_WS32_WG16_8_1_WGM1_WGMXCC1_WGMXCCGn1
    SolutionIndex: 227
    SolutionNameMin: Cijk_Alik_Bljk_S_B_Bias_HA_S_SAV_UserArgs_MT32x16x16_SN_LDSB0_AFC1_AG0_AFEM1_AFEM1_ASEM1_CLR0_CADS0_DTLA0_DTLB0_DTVA0_DTVB0_DTVMXSA0_DTVMXSB0_DTVSM0_DPLB0_EPS0_ELFLR0_EMLLn1_FDSI0_GRPM1_GRVWA1_GRVWB1_GSU1_GSUAMB_GSUC0_GSUWGMRR0_GLS0_ISA1151_IU1_K1_LDSTI0_LBSPPA0_LBSPPB0_LBSPPM0_LPA1_LPB1_LPM0_LRVW1_LWPMn1_MIAV0_MO40_MGRIPM1_NTn1_NTA0_NTB0_NTC0_NTD0_NTM0_NEPBS0_NLCA1_NLCB1_ONLL1_PGR0_PLR1_PKA0_SGROB0_SIA1_SS0_SU0_SUM0_SUS0_SPO0_SRVW0_SSO0_SVW1_SK0_SKFTR0_SKXCCM0_SGRO0_TDMI0_TIN0_TT4_2_TLDS0_TLDSMn1_ULSGRO0_USL1_UIOFGRO0_UPLRP0_USFGROn1_VSn1_VWA1_VWB1_WSGRA0_WSGRB0_WS32_WG8_8_1_WGM1_WGMXCC1_WGMXCCGn1
    SolutionIndex: 228
    SolutionNameMin: Cijk_Alik_Bljk_S_B_Bias_HA_S_SAV_UserArgs_MT16x16x16_SN_LDSB0_AFC1_AG0_AFEM1_AFEM1_ASEM1_CLR0_CADS0_DTLA0_DTLB0_DTVA0_DTVB0_DTVMXSA0_DTVMXSB0_DTVSM0_DPLB0_EPS0_ELFLR0_EMLLn1_FDSI0_GRPM1_GRVWA1_GRVWB1_GSU1_GSUAMB_GSUC0_GSUWGMRR0_GLS0_ISA1151_IU1_K1_LDSTI0_LBSPPA0_LBSPPB0_LBSPPM0_LPA1_LPB1_LPM0_LRVW1_LWPMn1_MIAV0_MO40_MGRIPM1_NTn1_NTA0_NTB0_NTC0_NTD0_NTM0_NEPBS0_NLCA1_NLCB1_ONLL1_PGR0_PLR1_PKA0_SGROB0_SIA1_SS0_SU0_SUM0_SUS0_SPO0_SRVW0_SSO0_SVW1_SK0_SKFTR0_SKXCCM0_SGRO0_TDMI0_TIN0_TT2_2_TLDS0_TLDSMn1_ULSGRO0_USL1_UIOFGRO0_UPLRP0_USFGROn1_VSn1_VWA1_VWB1_WSGRA0_WSGRB0_WS32_WG8_8_1_WGM1_WGMXCC1_WGMXCCGn1
    SolutionIndex: 229
    SolutionNameMin: Cijk_Alik_Bljk_S_B_Bias_HA_S_SAV_UserArgs_MT32x16x16_SN_LDSB0_AFC1_AG0_AFEM1_AFEM1_ASEM1_CLR0_CADS0_DTLA0_DTLB0_DTVA0_DTVB0_DTVMXSA0_DTVMXSB0_DTVSM0_DPLB0_EPS0_ELFLR0_EMLLn1_FDSI0_GRPM1_GRVWA1_GRVWB1_GSU1_GSUAMB_GSUC0_GSUWGMRR0_GLS0_ISA1151_IU1_K1_LDSTI0_LBSPPA0_LBSPPB0_LBSPPM0_LPA1_LPB1_LPM0_LRVW1_LWPMn1_MIAV0_MO40_MGRIPM1_NTn1_NTA0_NTB0_NTC0_NTD0_NTM0_NEPBS0_NLCA1_NLCB1_ONLL1_PGR1_PLR1_PKA0_SGROB0_SIA1_SS0_SU0_SUM0_SUS0_SPO0_SRVW0_SSO0_SVW1_SK0_SKFTR0_SKXCCM0_SGRO0_TDMI0_TIN0_TT4_2_TLDS0_TLDSMn1_ULSGRO0_USL1_UIOFGRO0_UPLRP0_USFGROn1_VSn1_VWA1_VWB1_WSGRA0_WSGRB0_WS32_WG8_8_1_WGM1_WGMXCC1_WGMXCCGn1
    SolutionIndex: 230
    SolutionNameMin: Cijk_Alik_Bljk_S_B_Bias_HA_S_SAV_UserArgs_MT32x16x16_SN_LDSB0_AFC1_AG0_AFEM1_AFEM1_ASEM1_CLR0_CADS0_DTLA0_DTLB0_DTVA0_DTVB0_DTVMXSA0_DTVMXSB0_DTVSM0_DPLB0_EPS0_ELFLR0_EMLLn1_FDSI0_GRPM1_GRVWA1_GRVWB1_GSU1_GSUAMB_GSUC0_GSUWGMRR0_GLS0_ISA1151_IU1_K1_LDSTI0_LBSPPA0_LBSPPB0_LBSPPM0_LPA1_LPB1_LPM0_LRVW1_LWPMn1_MIAV0_MO40_MGRIPM1_NTn1_NTA0_NTB0_NTC0_NTD0_NTM0_NEPBS0_NLCA1_NLCB1_ONLL1_PGR1_PLR1_PKA0_SGROB0_SIA1_SS0_SU16_SUM0_SUS256_SPO0_SRVW0_SSO0_SVW1_SK0_SKFTR0_SKXCCM0_SGRO0_TDMI0_TIN0_TT2_2_TLDS0_TLDSMn1_ULSGRO0_USL1_UIOFGRO0_UPLRP0_USFGROn1_VSn1_VWA1_VWB1_WSGRA0_WSGRB0_WS32_WG16_8_1_WGM1_WGMXCC1_WGMXCCGn1
    SolutionIndex: 231
    SolutionNameMin: Cijk_Alik_Bljk_S_B_Bias_HA_S_SAV_UserArgs_MT16x16x16_SN_LDSB0_AFC1_AG0_AFEM1_AFEM1_ASEM1_CLR0_CADS0_DTLA0_DTLB0_DTVA0_DTVB0_DTVMXSA0_DTVMXSB0_DTVSM0_DPLB0_EPS0_ELFLR0_EMLLn1_FDSI0_GRPM1_GRVWA1_GRVWB1_GSU1_GSUAMB_GSUC0_GSUWGMRR0_GLS0_ISA1151_IU1_K1_LDSTI0_LBSPPA0_LBSPPB0_LBSPPM0_LPA1_LPB1_LPM0_LRVW1_LWPMn1_MIAV0_MO40_MGRIPM1_NTn1_NTA0_NTB0_NTC0_NTD0_NTM0_NEPBS0_NLCA1_NLCB1_ONLL1_PGR1_PLR1_PKA0_SGROB0_SIA1_SS0_SU0_SUM0_SUS0_SPO0_SRVW0_SSO0_SVW1_SK0_SKFTR0_SKXCCM0_SGRO0_TDMI0_TIN0_TT2_2_TLDS0_TLDSMn1_ULSGRO0_USL1_UIOFGRO0_UPLRP0_USFGROn1_VSn1_VWA1_VWB1_WSGRA0_WSGRB0_WS32_WG8_8_1_WGM1_WGMXCC1_WGMXCCGn1
    SolutionIndex: 232
    SolutionNameMin: Cijk_Alik_Bljk_S_B_Bias_HA_S_SAV_UserArgs_MT64x16x16_SN_LDSB0_AFC1_AG0_AFEM1_AFEM1_ASEM1_CLR0_CADS0_DTLA0_DTLB0_DTVA0_DTVB0_DTVMXSA0_DTVMXSB0_DTVSM0_DPLB0_EPS0_ELFLR0_EMLLn1_FDSI0_GRPM1_GRVWA1_GRVWB1_GSU1_GSUAMB_GSUC0_GSUWGMRR0_GLS0_ISA1151_IU1_K1_LDSTI0_LBSPPA0_LBSPPB0_LBSPPM0_LPA1_LPB1_LPM0_LRVW1_LWPMn1_MIAV0_MO40_MGRIPM1_NTn1_NTA0_NTB0_NTC0_NTD0_NTM0_NEPBS0_NLCA1_NLCB1_ONLL1_PGR1_PLR1_PKA0_SGROB0_SIA1_SS0_SU0_SUM0_SUS0_SPO0_SRVW0_SSO0_SVW1_SK0_SKFTR0_SKXCCM0_SGRO0_TDMI0_TIN0_TT4_2_TLDS0_TLDSMn1_ULSGRO0_USL1_UIOFGRO0_UPLRP0_USFGROn1_VSn1_VWA1_VWB1_WSGRA0_WSGRB0_WS32_WG16_8_1_WGM1_WGMXCC1_WGMXCCGn1
    SolutionIndex: 233
    SolutionNameMin: Cijk_Alik_Bljk_S_B_Bias_HA_S_SAV_UserArgs_MT32x16x16_SN_LDSB0_AFC1_AG0_AFEM1_AFEM1_ASEM1_CLR0_CADS0_DTLA0_DTLB0_DTVA0_DTVB0_DTVMXSA0_DTVMXSB0_DTVSM0_DPLB0_EPS0_ELFLR0_EMLLn1_FDSI0_GRPM1_GRVWA1_GRVWB1_GSU1_GSUAMB_GSUC0_GSUWGMRR0_GLS0_ISA1151_IU1_K1_LDSTI0_LBSPPA0_LBSPPB0_LBSPPM0_LPA1_LPB1_LPM0_LRVW1_LWPMn1_MIAV0_MO40_MGRIPM1_NTn1_NTA0_NTB0_NTC0_NTD0_NTM0_NEPBS0_NLCA1_NLCB1_ONLL1_PGR0_PLR1_PKA0_SGROB0_SIA1_SS0_SU16_SUM0_SUS256_SPO0_SRVW0_SSO0_SVW1_SK0_SKFTR0_SKXCCM0_SGRO0_TDMI0_TIN0_TT2_2_TLDS0_TLDSMn1_ULSGRO0_USL1_UIOFGRO0_UPLRP0_USFGROn1_VSn1_VWA1_VWB1_WSGRA0_WSGRB0_WS32_WG16_8_1_WGM1_WGMXCC1_WGMXCCGn1
    SolutionIndex: 234
    SolutionNameMin: Cijk_Alik_Bljk_S_B_Bias_HA_S_SAV_UserArgs_MT16x16x16_SN_LDSB0_AFC1_AG0_AFEM1_AFEM1_ASEM1_CLR0_CADS0_DTLA0_DTLB0_DTVA0_DTVB0_DTVMXSA0_DTVMXSB0_DTVSM0_DPLB0_EPS0_ELFLR0_EMLLn1_FDSI0_GRPM1_GRVWA1_GRVWB1_GSU1_GSUAMB_GSUC0_GSUWGMRR0_GLS0_ISA1151_IU1_K1_LDSTI0_LBSPPA0_LBSPPB0_LBSPPM0_LPA1_LPB1_LPM0_LRVW1_LWPMn1_MIAV0_MO40_MGRIPM1_NTn1_NTA0_NTB0_NTC0_NTD0_NTM0_NEPBS0_NLCA1_NLCB1_ONLL1_PGR1_PLR1_PKA0_SGROB0_SIA1_SS0_SU16_SUM0_SUS256_SPO0_SRVW0_SSO0_SVW1_SK0_SKFTR0_SKXCCM0_SGRO0_TDMI0_TIN0_TT2_2_TLDS0_TLDSMn1_ULSGRO0_USL1_UIOFGRO0_UPLRP0_USFGROn1_VSn1_VWA1_VWB1_WSGRA0_WSGRB0_WS32_WG8_8_1_WGM1_WGMXCC1_WGMXCCGn1
    SolutionIndex: 235
    SolutionNameMin: Cijk_Alik_Bljk_S_B_Bias_HA_S_SAV_UserArgs_MT32x16x64_SN_LDSB0_AFC1_AG0_AFEM1_AFEM1_ASEM1_CLR0_CADS0_DTLA0_DTLB0_DTVA0_DTVB0_DTVMXSA0_DTVMXSB0_DTVSM0_DPLB0_EPS0_ELFLR0_EMLLn1_FDSI0_GRPM1_GRVWA1_GRVWB1_GSU1_GSUAMB_GSUC0_GSUWGMRR0_GLS0_ISA1151_IU1_K1_LDSTI0_LBSPPA0_LBSPPB0_LBSPPM0_LPA1_LPB1_LPM0_LRVW1_LWPMn1_MIAV0_MO40_MGRIPM1_NTn1_NTA0_NTB0_NTC0_NTD0_NTM0_NEPBS0_NLCA1_NLCB1_ONLL1_PGR0_PLR1_PKA0_SGROB0_SIA1_SS0_SU0_SUM0_SUS0_SPO0_SRVW0_SSO0_SVW1_SK0_SKFTR0_SKXCCM0_SGRO0_TDMI0_TIN0_TT2_2_TLDS0_TLDSMn1_ULSGRO0_USL1_UIOFGRO0_UPLRP0_USFGROn1_VSn1_VWA1_VWB1_WSGRA0_WSGRB0_WS32_WG16_8_1_WGM1_WGMXCC1_WGMXCCGn1
    SolutionIndex: 236
    SolutionNameMin: Cijk_Alik_Bljk_S_B_Bias_HA_S_SAV_UserArgs_MT64x16x32_SN_LDSB0_AFC1_AG0_AFEM1_AFEM1_ASEM1_CLR0_CADS0_DTLA0_DTLB0_DTVA0_DTVB0_DTVMXSA0_DTVMXSB0_DTVSM0_DPLB0_EPS0_ELFLR0_EMLLn1_FDSI0_GRPM1_GRVWA1_GRVWB1_GSU1_GSUAMB_GSUC0_GSUWGMRR0_GLS0_ISA1151_IU1_K1_LDSTI0_LBSPPA0_LBSPPB0_LBSPPM0_LPA1_LPB1_LPM0_LRVW1_LWPMn1_MIAV0_MO40_MGRIPM1_NTn1_NTA0_NTB0_NTC0_NTD0_NTM0_NEPBS0_NLCA1_NLCB1_ONLL1_PGR1_PLR1_PKA0_SGROB0_SIA1_SS0_SU0_SUM0_SUS0_SPO0_SRVW0_SSO0_SVW1_SK0_SKFTR0_SKXCCM0_SGRO0_TDMI0_TIN0_TT4_2_TLDS0_TLDSMn1_ULSGRO0_USL1_UIOFGRO0_UPLRP0_USFGROn1_VSn1_VWA1_VWB1_WSGRA0_WSGRB0_WS32_WG16_8_1_WGM1_WGMXCC1_WGMXCCGn1
    SolutionIndex: 237
    SolutionNameMin: Cijk_Alik_Bljk_S_B_Bias_HA_S_SAV_UserArgs_MT32x16x32_SN_LDSB0_AFC1_AG0_AFEM1_AFEM1_ASEM1_CLR0_CADS0_DTLA0_DTLB0_DTVA0_DTVB0_DTVMXSA0_DTVMXSB0_DTVSM0_DPLB0_EPS0_ELFLR0_EMLLn1_FDSI0_GRPM1_GRVWA1_GRVWB1_GSU1_GSUAMB_GSUC0_GSUWGMRR0_GLS0_ISA1151_IU1_K1_LDSTI0_LBSPPA0_LBSPPB0_LBSPPM0_LPA1_LPB1_LPM0_LRVW1_LWPMn1_MIAV0_MO40_MGRIPM1_NTn1_NTA0_NTB0_NTC0_NTD0_NTM0_NEPBS0_NLCA1_NLCB1_ONLL1_PGR1_PLR1_PKA0_SGROB0_SIA1_SS0_SU0_SUM0_SUS0_SPO0_SRVW0_SSO0_SVW1_SK0_SKFTR0_SKXCCM0_SGRO0_TDMI0_TIN0_TT4_2_TLDS0_TLDSMn1_ULSGRO0_USL1_UIOFGRO0_UPLRP0_USFGROn1_VSn1_VWA1_VWB1_WSGRA0_WSGRB0_WS32_WG8_8_1_WGM1_WGMXCC1_WGMXCCGn1
    SolutionIndex: 238
    SolutionNameMin: Cijk_Alik_Bljk_S_B_Bias_HA_S_SAV_UserArgs_MT64x16x32_SN_LDSB0_AFC1_AG0_AFEM1_AFEM1_ASEM1_CLR0_CADS0_DTLA0_DTLB0_DTVA0_DTVB0_DTVMXSA0_DTVMXSB0_DTVSM0_DPLB0_EPS0_ELFLR0_EMLLn1_FDSI0_GRPM1_GRVWA1_GRVWB1_GSU1_GSUAMB_GSUC0_GSUWGMRR0_GLS0_ISA1151_IU1_K1_LDSTI0_LBSPPA0_LBSPPB0_LBSPPM0_LPA1_LPB1_LPM0_LRVW1_LWPMn1_MIAV0_MO40_MGRIPM1_NTn1_NTA0_NTB0_NTC0_NTD0_NTM0_NEPBS0_NLCA1_NLCB1_ONLL1_PGR1_PLR1_PKA0_SGROB0_SIA1_SS0_SU16_SUM0_SUS256_SPO0_SRVW0_SSO0_SVW1_SK0_SKFTR0_SKXCCM0_SGRO0_TDMI0_TIN0_TT4_2_TLDS0_TLDSMn1_ULSGRO0_USL1_UIOFGRO0_UPLRP0_USFGROn1_VSn1_VWA1_VWB1_WSGRA0_WSGRB0_WS32_WG16_8_1_WGM1_WGMXCC1_WGMXCCGn1
    SolutionIndex: 239
    SolutionNameMin: Cijk_Alik_Bljk_S_B_Bias_HA_S_SAV_UserArgs_MT16x32x32_SN_LDSB0_AFC1_AG0_AFEM1_AFEM1_ASEM1_CLR0_CADS0_DTLA0_DTLB0_DTVA0_DTVB0_DTVMXSA0_DTVMXSB0_DTVSM0_DPLB0_EPS0_ELFLR0_EMLLn1_FDSI0_GRPM1_GRVWA1_GRVWB1_GSU1_GSUAMB_GSUC0_GSUWGMRR0_GLS0_ISA1151_IU1_K1_LDSTI0_LBSPPA0_LBSPPB0_LBSPPM0_LPA1_LPB1_LPM0_LRVW1_LWPMn1_MIAV0_MO40_MGRIPM1_NTn1_NTA0_NTB0_NTC0_NTD0_NTM0_NEPBS0_NLCA1_NLCB1_ONLL1_PGR1_PLR1_PKA0_SGROB0_SIA1_SS0_SU16_SUM0_SUS256_SPO0_SRVW0_SSO0_SVW1_SK0_SKFTR0_SKXCCM0_SGRO0_TDMI0_TIN0_TT2_4_TLDS0_TLDSMn1_ULSGRO0_USL1_UIOFGRO0_UPLRP0_USFGROn1_VSn1_VWA1_VWB1_WSGRA0_WSGRB0_WS32_WG8_8_1_WGM1_WGMXCC1_WGMXCCGn1
    SolutionIndex: 240
    SolutionNameMin: Cijk_Alik_Bljk_S_B_Bias_HA_S_SAV_UserArgs_MT16x32x64_SN_LDSB0_AFC1_AG0_AFEM1_AFEM1_ASEM1_CLR0_CADS0_DTLA0_DTLB0_DTVA0_DTVB0_DTVMXSA0_DTVMXSB0_DTVSM0_DPLB0_EPS0_ELFLR0_EMLLn1_FDSI0_GRPM1_GRVWA1_GRVWB1_GSU1_GSUAMB_GSUC0_GSUWGMRR0_GLS0_ISA1151_IU1_K1_LDSTI0_LBSPPA0_LBSPPB0_LBSPPM0_LPA1_LPB1_LPM0_LRVW1_LWPMn1_MIAV0_MO40_MGRIPM1_NTn1_NTA0_NTB0_NTC0_NTD0_NTM0_NEPBS0_NLCA1_NLCB1_ONLL1_PGR0_PLR1_PKA0_SGROB0_SIA1_SS0_SU0_SUM0_SUS0_SPO0_SRVW0_SSO0_SVW1_SK0_SKFTR0_SKXCCM0_SGRO0_TDMI0_TIN0_TT2_4_TLDS0_TLDSMn1_ULSGRO0_USL1_UIOFGRO0_UPLRP0_USFGROn1_VSn1_VWA1_VWB1_WSGRA0_WSGRB0_WS32_WG8_8_1_WGM1_WGMXCC1_WGMXCCGn1
    SolutionIndex: 241
    SolutionNameMin: Cijk_Alik_Bljk_S_B_Bias_HA_S_SAV_UserArgs_MT16x8x128_SN_LDSB0_AFC1_AG0_AFEM1_AFEM1_ASEM1_CLR0_CADS0_DTLA0_DTLB0_DTVA0_DTVB0_DTVMXSA0_DTVMXSB0_DTVSM0_DPLB0_EPS0_ELFLR0_EMLLn1_FDSI0_GRPM1_GRVWA1_GRVWB1_GSU1_GSUAMB_GSUC0_GSUWGMRR0_GLS0_ISA1151_IU1_K1_LDSTI0_LBSPPA0_LBSPPB0_LBSPPM0_LPA1_LPB1_LPM0_LRVW1_LWPMn1_MIAV0_MO40_MGRIPM1_NTn1_NTA0_NTB0_NTC0_NTD0_NTM0_NEPBS0_NLCA1_NLCB1_ONLL1_PGR1_PLR1_PKA0_SGROB0_SIA1_SS0_SU0_SUM0_SUS0_SPO0_SRVW0_SSO0_SVW1_SK0_SKFTR0_SKXCCM0_SGRO0_TDMI0_TIN0_TT1_1_TLDS0_TLDSMn1_ULSGRO0_USL1_UIOFGRO0_UPLRP0_USFGROn1_VSn1_VWA1_VWB1_WSGRA0_WSGRB0_WS32_WG16_8_1_WGM1_WGMXCC1_WGMXCCGn1
    SolutionIndex: 242
    SolutionNameMin: Cijk_Alik_Bljk_S_B_Bias_HA_S_SAV_UserArgs_MT16x8x256_SN_LDSB0_AFC1_AG0_AFEM1_AFEM1_ASEM1_CLR0_CADS0_DTLA0_DTLB0_DTVA0_DTVB0_DTVMXSA0_DTVMXSB0_DTVSM0_DPLB0_EPS0_ELFLR0_EMLLn1_FDSI0_GRPM1_GRVWA1_GRVWB1_GSU1_GSUAMB_GSUC0_GSUWGMRR0_GLS0_ISA1151_IU1_K1_LDSTI0_LBSPPA0_LBSPPB0_LBSPPM0_LPA1_LPB1_LPM0_LRVW1_LWPMn1_MIAV0_MO40_MGRIPM1_NTn1_NTA0_NTB0_NTC0_NTD0_NTM0_NEPBS0_NLCA2_NLCB2_ONLL1_PGR0_PLR1_PKA0_SGROB0_SIA1_SS0_SU0_SUM0_SUS0_SPO0_SRVW0_SSO0_SVW1_SK0_SKFTR0_SKXCCM0_SGRO0_TDMI0_TIN0_TT1_1_TLDS0_TLDSMn1_ULSGRO0_USL1_UIOFGRO0_UPLRP0_USFGROn1_VSn1_VWA1_VWB1_WSGRA0_WSGRB0_WS32_WG16_8_1_WGM1_WGMXCC1_WGMXCCGn1
    SolutionIndex: 243
    SolutionNameMin: Cijk_Alik_Bljk_S_B_Bias_HA_S_SAV_UserArgs_MT16x8x256_SN_LDSB0_AFC1_AG0_AFEM1_AFEM1_ASEM1_CLR0_CADS0_DTLA0_DTLB0_DTVA0_DTVB0_DTVMXSA0_DTVMXSB0_DTVSM0_DPLB0_EPS0_ELFLR0_EMLLn1_FDSI0_GRPM1_GRVWA1_GRVWB1_GSU1_GSUAMB_GSUC0_GSUWGMRR0_GLS0_ISA1151_IU1_K1_LDSTI0_LBSPPA0_LBSPPB0_LBSPPM0_LPA1_LPB1_LPM0_LRVW1_LWPMn1_MIAV0_MO40_MGRIPM1_NTn1_NTA0_NTB0_NTC0_NTD0_NTM0_NEPBS0_NLCA2_NLCB2_ONLL1_PGR1_PLR1_PKA0_SGROB0_SIA1_SS0_SU0_SUM0_SUS0_SPO0_SRVW0_SSO0_SVW1_SK0_SKFTR0_SKXCCM0_SGRO0_TDMI0_TIN0_TT1_1_TLDS0_TLDSMn1_ULSGRO0_USL1_UIOFGRO0_UPLRP0_USFGROn1_VSn1_VWA1_VWB1_WSGRA0_WSGRB0_WS32_WG16_8_1_WGM1_WGMXCC1_WGMXCCGn1
    SolutionIndex: 244
    SolutionNameMin: Cijk_Alik_Bljk_S_B_Bias_HA_S_SAV_UserArgs_MT16x8x256_SN_LDSB0_AFC1_AG0_AFEM1_AFEM1_ASEM1_CLR0_CADS0_DTLA0_DTLB0_DTVA0_DTVB0_DTVMXSA0_DTVMXSB0_DTVSM0_DPLB0_EPS0_ELFLR0_EMLLn1_FDSI0_GRPM1_GRVWA1_GRVWB1_GSU1_GSUAMB_GSUC0_GSUWGMRR0_GLS0_ISA1151_IU1_K1_LDSTI0_LBSPPA0_LBSPPB0_LBSPPM0_LPA1_LPB1_LPM0_LRVW1_LWPMn1_MIAV0_MO40_MGRIPM1_NTn1_NTA0_NTB0_NTC0_NTD0_NTM0_NEPBS0_NLCA2_NLCB2_ONLL1_PGR1_PLR1_PKA0_SGROB0_SIA1_SS0_SU16_SUM0_SUS1024_SPO0_SRVW0_SSO0_SVW1_SK0_SKFTR0_SKXCCM0_SGRO0_TDMI0_TIN0_TT1_1_TLDS0_TLDSMn1_ULSGRO0_USL1_UIOFGRO0_UPLRP0_USFGROn1_VSn1_VWA1_VWB1_WSGRA0_WSGRB0_WS32_WG16_8_1_WGM1_WGMXCC1_WGMXCCGn1
    SolutionIndex: 245
    SolutionNameMin: Cijk_Alik_Bljk_S_B_Bias_HA_S_SAV_UserArgs_MT16x8x64_SN_LDSB0_AFC1_AG0_AFEM1_AFEM1_ASEM1_CLR0_CADS0_DTLA0_DTLB0_DTVA0_DTVB0_DTVMXSA0_DTVMXSB0_DTVSM0_DPLB0_EPS0_ELFLR0_EMLLn1_FDSI0_GRPM1_GRVWA1_GRVWB1_GSU1_GSUAMB_GSUC0_GSUWGMRR0_GLS0_ISA1151_IU1_K1_LDSTI0_LBSPPA0_LBSPPB0_LBSPPM0_LPA1_LPB1_LPM0_LRVW1_LWPMn1_MIAV0_MO40_MGRIPM1_NTn1_NTA0_NTB0_NTC0_NTD0_NTM0_NEPBS0_NLCA1_NLCB1_ONLL1_PGR0_PLR1_PKA0_SGROB0_SIA1_SS0_SU0_SUM0_SUS0_SPO0_SRVW0_SSO0_SVW1_SK0_SKFTR0_SKXCCM0_SGRO0_TDMI0_TIN0_TT1_1_TLDS0_TLDSMn1_ULSGRO0_USL1_UIOFGRO0_UPLRP0_USFGROn1_VSn1_VWA1_VWB1_WSGRA0_WSGRB0_WS32_WG16_8_1_WGM1_WGMXCC1_WGMXCCGn1
    SolutionIndex: 246
    SolutionNameMin: Cijk_Alik_Bljk_S_B_Bias_HA_S_SAV_UserArgs_MT16x8x64_SN_LDSB0_AFC1_AG0_AFEM1_AFEM1_ASEM1_CLR0_CADS0_DTLA0_DTLB0_DTVA0_DTVB0_DTVMXSA0_DTVMXSB0_DTVSM0_DPLB0_EPS0_ELFLR0_EMLLn1_FDSI0_GRPM1_GRVWA1_GRVWB1_GSU1_GSUAMB_GSUC0_GSUWGMRR0_GLS0_ISA1151_IU1_K1_LDSTI0_LBSPPA0_LBSPPB0_LBSPPM0_LPA1_LPB1_LPM0_LRVW1_LWPMn1_MIAV0_MO40_MGRIPM1_NTn1_NTA0_NTB0_NTC0_NTD0_NTM0_NEPBS0_NLCA1_NLCB1_ONLL1_PGR0_PLR1_PKA0_SGROB0_SIA1_SS0_SU32_SUM0_SUS256_SPO0_SRVW0_SSO0_SVW1_SK0_SKFTR0_SKXCCM0_SGRO0_TDMI0_TIN0_TT1_1_TLDS0_TLDSMn1_ULSGRO0_USL1_UIOFGRO0_UPLRP0_USFGROn1_VSn1_VWA1_VWB1_WSGRA0_WSGRB0_WS32_WG16_8_1_WGM1_WGMXCC1_WGMXCCGn1
    SolutionIndex: 247
    SolutionNameMin: Cijk_Alik_Bljk_S_B_Bias_HA_S_SAV_UserArgs_MT8x8x64_SN_LDSB0_AFC1_AG0_AFEM1_AFEM1_ASEM1_CLR0_CADS0_DTLA0_DTLB0_DTVA0_DTVB0_DTVMXSA0_DTVMXSB0_DTVSM0_DPLB0_EPS0_ELFLR0_EMLLn1_FDSI0_GRPM1_GRVWA1_GRVWB1_GSU1_GSUAMB_GSUC0_GSUWGMRR0_GLS0_ISA1151_IU1_K1_LDSTI0_LBSPPA0_LBSPPB0_LBSPPM0_LPA1_LPB1_LPM0_LRVW1_LWPMn1_MIAV0_MO40_MGRIPM1_NTn1_NTA0_NTB0_NTC0_NTD0_NTM0_NEPBS0_NLCA1_NLCB1_ONLL1_PGR0_PLR1_PKA0_SGROB0_SIA1_SS0_SU0_SUM0_SUS0_SPO0_SRVW0_SSO0_SVW1_SK0_SKFTR0_SKXCCM0_SGRO0_TDMI0_TIN0_TT1_1_TLDS0_TLDSMn1_ULSGRO0_USL1_UIOFGRO0_UPLRP0_USFGROn1_VSn1_VWA1_VWB1_WSGRA0_WSGRB0_WS32_WG8_8_1_WGM1_WGMXCC1_WGMXCCGn1
    SolutionIndex: 248
    SolutionNameMin: Cijk_Alik_Bljk_S_B_Bias_HA_S_SAV_UserArgs_MT16x8x64_SN_LDSB0_AFC1_AG0_AFEM1_AFEM1_ASEM1_CLR0_CADS0_DTLA0_DTLB0_DTVA0_DTVB0_DTVMXSA0_DTVMXSB0_DTVSM0_DPLB0_EPS0_ELFLR0_EMLLn1_FDSI0_GRPM1_GRVWA1_GRVWB1_GSU1_GSUAMB_GSUC0_GSUWGMRR0_GLS0_ISA1151_IU1_K1_LDSTI0_LBSPPA0_LBSPPB0_LBSPPM0_LPA1_LPB1_LPM0_LRVW1_LWPMn1_MIAV0_MO40_MGRIPM1_NTn1_NTA0_NTB0_NTC0_NTD0_NTM0_NEPBS0_NLCA1_NLCB1_ONLL1_PGR1_PLR1_PKA0_SGROB0_SIA1_SS0_SU0_SUM0_SUS0_SPO0_SRVW0_SSO0_SVW1_SK0_SKFTR0_SKXCCM0_SGRO0_TDMI0_TIN0_TT1_1_TLDS0_TLDSMn1_ULSGRO0_USL1_UIOFGRO0_UPLRP0_USFGROn1_VSn1_VWA1_VWB1_WSGRA0_WSGRB0_WS32_WG16_8_1_WGM1_WGMXCC1_WGMXCCGn1
    SolutionIndex: 249
    SolutionNameMin: Cijk_Alik_Bljk_S_B_Bias_HA_S_SAV_UserArgs_MT16x8x64_SN_LDSB0_AFC1_AG0_AFEM1_AFEM1_ASEM1_CLR0_CADS0_DTLA0_DTLB0_DTVA0_DTVB0_DTVMXSA0_DTVMXSB0_DTVSM0_DPLB0_EPS0_ELFLR0_EMLLn1_FDSI0_GRPM1_GRVWA1_GRVWB1_GSU1_GSUAMB_GSUC0_GSUWGMRR0_GLS0_ISA1151_IU1_K1_LDSTI0_LBSPPA0_LBSPPB0_LBSPPM0_LPA1_LPB1_LPM0_LRVW1_LWPMn1_MIAV0_MO40_MGRIPM1_NTn1_NTA0_NTB0_NTC0_NTD0_NTM0_NEPBS0_NLCA1_NLCB1_ONLL1_PGR1_PLR1_PKA0_SGROB0_SIA1_SS0_SU32_SUM0_SUS256_SPO0_SRVW0_SSO0_SVW1_SK0_SKFTR0_SKXCCM0_SGRO0_TDMI0_TIN0_TT1_1_TLDS0_TLDSMn1_ULSGRO0_USL1_UIOFGRO0_UPLRP0_USFGROn1_VSn1_VWA1_VWB1_WSGRA0_WSGRB0_WS32_WG16_8_1_WGM1_WGMXCC1_WGMXCCGn1
    SolutionIndex: 250
    SolutionNameMin: Cijk_Alik_Bljk_S_B_Bias_HA_S_SAV_UserArgs_MT8x4x8_SN_LDSB0_AFC1_AG0_AFEM1_AFEM1_ASEM1_CLR0_CADS0_DTLA0_DTLB0_DTVA0_DTVB0_DTVMXSA0_DTVMXSB0_DTVSM0_DPLB0_EPS0_ELFLR0_EMLLn1_FDSI0_GRPM1_GRVWA1_GRVWB1_GSU1_GSUAMB_GSUC0_GSUWGMRR0_GLS0_ISA1151_IU1_K1_LDSTI0_LBSPPA0_LBSPPB0_LBSPPM0_LPA1_LPB1_LPM0_LRVW1_LWPMn1_MIAV0_MO40_MGRIPM1_NTn1_NTA0_NTB0_NTC0_NTD0_NTM0_NEPBS0_NLCA1_NLCB1_ONLL0_PGR0_PLR1_PKA0_SGROB0_SIA1_SS0_SU0_SUM0_SUS0_SPO0_SRVW0_SSO0_SVW1_SK0_SKFTR0_SKXCCM0_SGRO0_TDMI0_TIN0_TT1_1_TLDS0_TLDSMn1_ULSGRO0_USL1_UIOFGRO0_UPLRP0_USFGROn1_VSn1_VWA1_VWB1_WSGRA0_WSGRB0_WS32_WG8_4_1_WGM1_WGMXCC1_WGMXCCGn1
    SolutionIndex: 251
    SolutionNameMin: Cijk_Alik_Bljk_S_B_Bias_HA_S_SAV_UserArgs_MT16x8x8_SN_LDSB0_AFC1_AG0_AFEM1_AFEM1_ASEM1_CLR0_CADS0_DTLA0_DTLB0_DTVA0_DTVB0_DTVMXSA0_DTVMXSB0_DTVSM0_DPLB0_EPS0_ELFLR0_EMLLn1_FDSI0_GRPM1_GRVWA1_GRVWB1_GSU1_GSUAMB_GSUC0_GSUWGMRR0_GLS0_ISA1151_IU1_K1_LDSTI0_LBSPPA0_LBSPPB0_LBSPPM0_LPA1_LPB1_LPM0_LRVW1_LWPMn1_MIAV0_MO40_MGRIPM1_NTn1_NTA0_NTB0_NTC0_NTD0_NTM0_NEPBS0_NLCA1_NLCB1_ONLL0_PGR0_PLR1_PKA0_SGROB0_SIA1_SS0_SU0_SUM0_SUS0_SPO0_SRVW0_SSO0_SVW1_SK0_SKFTR0_SKXCCM0_SGRO0_TDMI0_TIN0_TT2_1_TLDS0_TLDSMn1_ULSGRO0_USL1_UIOFGRO0_UPLRP0_USFGROn1_VSn1_VWA1_VWB1_WSGRA0_WSGRB0_WS32_WG8_8_1_WGM1_WGMXCC1_WGMXCCGn1
    SolutionIndex: 252
    SolutionNameMin: Cijk_Alik_Bljk_S_B_Bias_HA_S_SAV_UserArgs_MT16x8x16_SN_LDSB0_AFC1_AG0_AFEM1_AFEM1_ASEM1_CLR0_CADS0_DTLA0_DTLB0_DTVA0_DTVB0_DTVMXSA0_DTVMXSB0_DTVSM0_DPLB0_EPS0_ELFLR0_EMLLn1_FDSI0_GRPM1_GRVWA1_GRVWB1_GSU1_GSUAMB_GSUC0_GSUWGMRR0_GLS0_ISA1151_IU1_K1_LDSTI0_LBSPPA0_LBSPPB0_LBSPPM0_LPA1_LPB1_LPM0_LRVW1_LWPMn1_MIAV0_MO40_MGRIPM1_NTn1_NTA0_NTB0_NTC0_NTD0_NTM0_NEPBS0_NLCA1_NLCB1_ONLL0_PGR0_PLR1_PKA0_SGROB0_SIA1_SS0_SU0_SUM0_SUS0_SPO0_SRVW0_SSO0_SVW1_SK0_SKFTR0_SKXCCM0_SGRO0_TDMI0_TIN0_TT1_1_TLDS0_TLDSMn1_ULSGRO0_USL1_UIOFGRO0_UPLRP0_USFGROn1_VSn1_VWA1_VWB1_WSGRA0_WSGRB0_WS32_WG16_8_1_WGM1_WGMXCC1_WGMXCCGn1
    SolutionIndex: 253
    SolutionNameMin: Cijk_Alik_Bljk_S_B_Bias_HA_S_SAV_UserArgs_MT8x4x16_SN_LDSB0_AFC1_AG0_AFEM1_AFEM1_ASEM1_CLR0_CADS0_DTLA0_DTLB0_DTVA0_DTVB0_DTVMXSA0_DTVMXSB0_DTVSM0_DPLB0_EPS0_ELFLR0_EMLLn1_FDSI0_GRPM1_GRVWA1_GRVWB1_GSU1_GSUAMB_GSUC0_GSUWGMRR0_GLS0_ISA1151_IU1_K1_LDSTI0_LBSPPA0_LBSPPB0_LBSPPM0_LPA1_LPB1_LPM0_LRVW1_LWPMn1_MIAV0_MO40_MGRIPM1_NTn1_NTA0_NTB0_NTC0_NTD0_NTM0_NEPBS0_NLCA1_NLCB1_ONLL0_PGR0_PLR1_PKA0_SGROB0_SIA1_SS0_SU0_SUM0_SUS0_SPO0_SRVW0_SSO0_SVW1_SK0_SKFTR0_SKXCCM0_SGRO0_TDMI0_TIN0_TT1_1_TLDS0_TLDSMn1_ULSGRO0_USL1_UIOFGRO0_UPLRP0_USFGROn1_VSn1_VWA1_VWB1_WSGRA0_WSGRB0_WS32_WG8_4_1_WGM1_WGMXCC1_WGMXCCGn1
    SolutionIndex: 254
    SolutionNameMin: Cijk_Alik_Bljk_S_B_Bias_HA_S_SAV_UserArgs_MT8x8x16_SN_LDSB0_AFC1_AG0_AFEM1_AFEM1_ASEM1_CLR0_CADS0_DTLA0_DTLB0_DTVA0_DTVB0_DTVMXSA0_DTVMXSB0_DTVSM0_DPLB0_EPS0_ELFLR0_EMLLn1_FDSI0_GRPM1_GRVWA1_GRVWB1_GSU1_GSUAMB_GSUC0_GSUWGMRR0_GLS0_ISA1151_IU1_K1_LDSTI0_LBSPPA0_LBSPPB0_LBSPPM0_LPA1_LPB1_LPM0_LRVW1_LWPMn1_MIAV0_MO40_MGRIPM1_NTn1_NTA0_NTB0_NTC0_NTD0_NTM0_NEPBS0_NLCA1_NLCB1_ONLL0_PGR0_PLR1_PKA0_SGROB0_SIA1_SS0_SU0_SUM0_SUS0_SPO0_SRVW0_SSO0_SVW1_SK0_SKFTR0_SKXCCM0_SGRO0_TDMI0_TIN0_TT1_2_TLDS0_TLDSMn1_ULSGRO0_USL1_UIOFGRO0_UPLRP0_USFGROn1_VSn1_VWA1_VWB1_WSGRA0_WSGRB0_WS32_WG8_4_1_WGM1_WGMXCC1_WGMXCCGn1
    SolutionIndex: 255
    SolutionNameMin: Cijk_Alik_Bljk_S_B_Bias_HA_S_SAV_UserArgs_MT8x8x8_SN_LDSB0_AFC1_AG0_AFEM1_AFEM1_ASEM1_CLR0_CADS0_DTLA0_DTLB0_DTVA0_DTVB0_DTVMXSA0_DTVMXSB0_DTVSM0_DPLB0_EPS0_ELFLR0_EMLLn1_FDSI0_GRPM1_GRVWA1_GRVWB1_GSU1_GSUAMB_GSUC0_GSUWGMRR0_GLS0_ISA1151_IU1_K1_LDSTI0_LBSPPA0_LBSPPB0_LBSPPM0_LPA1_LPB1_LPM0_LRVW1_LWPMn1_MIAV0_MO40_MGRIPM1_NTn1_NTA0_NTB0_NTC0_NTD0_NTM0_NEPBS0_NLCA1_NLCB1_ONLL0_PGR0_PLR1_PKA0_SGROB0_SIA1_SS0_SU0_SUM0_SUS0_SPO0_SRVW0_SSO0_SVW1_SK0_SKFTR0_SKXCCM0_SGRO0_TDMI0_TIN0_TT1_2_TLDS0_TLDSMn1_ULSGRO0_USL1_UIOFGRO0_UPLRP0_USFGROn1_VSn1_VWA1_VWB1_WSGRA0_WSGRB0_WS32_WG8_4_1_WGM1_WGMXCC1_WGMXCCGn1
    SolutionIndex: 256
    SolutionNameMin: Cijk_Alik_Bljk_S_B_Bias_HA_S_SAV_UserArgs_MT16x8x16_SN_LDSB0_AFC1_AG0_AFEM1_AFEM1_ASEM1_CLR0_CADS0_DTLA0_DTLB0_DTVA0_DTVB0_DTVMXSA0_DTVMXSB0_DTVSM0_DPLB0_EPS0_ELFLR0_EMLLn1_FDSI0_GRPM1_GRVWA1_GRVWB1_GSU1_GSUAMB_GSUC0_GSUWGMRR0_GLS0_ISA1151_IU1_K1_LDSTI0_LBSPPA0_LBSPPB0_LBSPPM0_LPA1_LPB1_LPM0_LRVW1_LWPMn1_MIAV0_MO40_MGRIPM1_NTn1_NTA0_NTB0_NTC0_NTD0_NTM0_NEPBS0_NLCA1_NLCB1_ONLL0_PGR1_PLR1_PKA0_SGROB0_SIA1_SS0_SU0_SUM0_SUS0_SPO0_SRVW0_SSO0_SVW1_SK0_SKFTR0_SKXCCM0_SGRO0_TDMI0_TIN0_TT1_1_TLDS0_TLDSMn1_ULSGRO0_USL1_UIOFGRO0_UPLRP0_USFGROn1_VSn1_VWA1_VWB1_WSGRA0_WSGRB0_WS32_WG16_8_1_WGM1_WGMXCC1_WGMXCCGn1
    SolutionIndex: 257
    SolutionNameMin: Cijk_Alik_Bljk_S_B_Bias_HA_S_SAV_UserArgs_MT8x8x16_SN_LDSB0_AFC1_AG0_AFEM1_AFEM1_ASEM1_CLR0_CADS0_DTLA0_DTLB0_DTVA0_DTVB0_DTVMXSA0_DTVMXSB0_DTVSM0_DPLB0_EPS0_ELFLR0_EMLLn1_FDSI0_GRPM1_GRVWA1_GRVWB1_GSU1_GSUAMB_GSUC0_GSUWGMRR0_GLS0_ISA1151_IU1_K1_LDSTI0_LBSPPA0_LBSPPB0_LBSPPM0_LPA1_LPB1_LPM0_LRVW1_LWPMn1_MIAV0_MO40_MGRIPM1_NTn1_NTA0_NTB0_NTC0_NTD0_NTM0_NEPBS0_NLCA1_NLCB1_ONLL0_PGR0_PLR1_PKA0_SGROB0_SIA1_SS0_SU0_SUM0_SUS0_SPO0_SRVW0_SSO0_SVW1_SK0_SKFTR0_SKXCCM0_SGRO0_TDMI0_TIN0_TT1_1_TLDS0_TLDSMn1_ULSGRO0_USL1_UIOFGRO0_UPLRP0_USFGROn1_VSn1_VWA1_VWB1_WSGRA0_WSGRB0_WS32_WG8_8_1_WGM1_WGMXCC1_WGMXCCGn1
    SolutionIndex: 258
    SolutionNameMin: Cijk_Alik_Bljk_S_B_Bias_HA_S_SAV_UserArgs_MT8x4x64_SN_LDSB0_AFC1_AG0_AFEM1_AFEM1_ASEM1_CLR0_CADS0_DTLA0_DTLB0_DTVA0_DTVB0_DTVMXSA0_DTVMXSB0_DTVSM0_DPLB0_EPS0_ELFLR0_EMLLn1_FDSI0_GRPM1_GRVWA1_GRVWB1_GSU1_GSUAMB_GSUC0_GSUWGMRR0_GLS0_ISA1151_IU1_K1_LDSTI0_LBSPPA0_LBSPPB0_LBSPPM0_LPA1_LPB1_LPM0_LRVW1_LWPMn1_MIAV0_MO40_MGRIPM1_NTn1_NTA0_NTB0_NTC0_NTD0_NTM0_NEPBS0_NLCA2_NLCB2_ONLL0_PGR1_PLR1_PKA0_SGROB0_SIA1_SS0_SU0_SUM0_SUS0_SPO0_SRVW0_SSO0_SVW1_SK0_SKFTR0_SKXCCM0_SGRO0_TDMI0_TIN0_TT1_1_TLDS0_TLDSMn1_ULSGRO0_USL1_UIOFGRO0_UPLRP0_USFGROn1_VSn1_VWA1_VWB1_WSGRA0_WSGRB0_WS32_WG8_4_1_WGM1_WGMXCC1_WGMXCCGn1
    SolutionIndex: 259
    SolutionNameMin: Cijk_Alik_Bljk_S_B_Bias_HA_S_SAV_UserArgs_MT8x4x16_SN_LDSB0_AFC1_AG0_AFEM1_AFEM1_ASEM1_CLR0_CADS0_DTLA0_DTLB0_DTVA0_DTVB0_DTVMXSA0_DTVMXSB0_DTVSM0_DPLB0_EPS0_ELFLR0_EMLLn1_FDSI0_GRPM1_GRVWA1_GRVWB1_GSU1_GSUAMB_GSUC0_GSUWGMRR0_GLS0_ISA1151_IU1_K1_LDSTI0_LBSPPA0_LBSPPB0_LBSPPM0_LPA1_LPB1_LPM0_LRVW1_LWPMn1_MIAV0_MO40_MGRIPM1_NTn1_NTA0_NTB0_NTC0_NTD0_NTM0_NEPBS0_NLCA1_NLCB1_ONLL0_PGR1_PLR1_PKA0_SGROB0_SIA1_SS0_SU0_SUM0_SUS0_SPO0_SRVW0_SSO0_SVW1_SK0_SKFTR0_SKXCCM0_SGRO0_TDMI0_TIN0_TT1_1_TLDS0_TLDSMn1_ULSGRO0_USL1_UIOFGRO0_UPLRP0_USFGROn1_VSn1_VWA1_VWB1_WSGRA0_WSGRB0_WS32_WG8_4_1_WGM1_WGMXCC1_WGMXCCGn1
    SolutionIndex: 260
    SolutionNameMin: Cijk_Alik_Bljk_S_B_Bias_HA_S_SAV_UserArgs_MT16x8x32_SN_LDSB0_AFC1_AG0_AFEM1_AFEM1_ASEM1_CLR0_CADS0_DTLA0_DTLB0_DTVA0_DTVB0_DTVMXSA0_DTVMXSB0_DTVSM0_DPLB0_EPS0_ELFLR0_EMLLn1_FDSI0_GRPM1_GRVWA1_GRVWB1_GSU1_GSUAMB_GSUC0_GSUWGMRR0_GLS0_ISA1151_IU1_K1_LDSTI0_LBSPPA0_LBSPPB0_LBSPPM0_LPA1_LPB1_LPM0_LRVW1_LWPMn1_MIAV0_MO40_MGRIPM1_NTn1_NTA0_NTB0_NTC0_NTD0_NTM0_NEPBS0_NLCA1_NLCB1_ONLL0_PGR1_PLR1_PKA0_SGROB0_SIA1_SS0_SU8_SUM0_SUS256_SPO0_SRVW0_SSO0_SVW1_SK0_SKFTR0_SKXCCM0_SGRO0_TDMI0_TIN0_TT1_1_TLDS0_TLDSMn1_ULSGRO0_USL1_UIOFGRO0_UPLRP0_USFGROn1_VSn1_VWA1_VWB1_WSGRA0_WSGRB0_WS32_WG16_8_1_WGM1_WGMXCC1_WGMXCCGn1
    SolutionIndex: 261
    SolutionNameMin: Cijk_Alik_Bljk_S_B_Bias_HA_S_SAV_UserArgs_MT16x4x16_SN_LDSB0_AFC1_AG0_AFEM1_AFEM1_ASEM1_CLR0_CADS0_DTLA0_DTLB0_DTVA0_DTVB0_DTVMXSA0_DTVMXSB0_DTVSM0_DPLB0_EPS0_ELFLR0_EMLLn1_FDSI0_GRPM1_GRVWA1_GRVWB1_GSU1_GSUAMB_GSUC0_GSUWGMRR0_GLS0_ISA1151_IU1_K1_LDSTI0_LBSPPA0_LBSPPB0_LBSPPM0_LPA1_LPB1_LPM0_LRVW1_LWPMn1_MIAV0_MO40_MGRIPM1_NTn1_NTA0_NTB0_NTC0_NTD0_NTM0_NEPBS0_NLCA1_NLCB1_ONLL0_PGR0_PLR1_PKA0_SGROB0_SIA1_SS0_SU0_SUM0_SUS0_SPO0_SRVW0_SSO0_SVW1_SK0_SKFTR0_SKXCCM0_SGRO0_TDMI0_TIN0_TT1_1_TLDS0_TLDSMn1_ULSGRO0_USL1_UIOFGRO0_UPLRP0_USFGROn1_VSn1_VWA1_VWB1_WSGRA0_WSGRB0_WS32_WG16_4_1_WGM1_WGMXCC1_WGMXCCGn1
    SolutionIndex: 262
    SolutionNameMin: Cijk_Alik_Bljk_S_B_Bias_HA_S_SAV_UserArgs_MT8x8x64_SN_LDSB0_AFC1_AG0_AFEM1_AFEM1_ASEM1_CLR0_CADS0_DTLA0_DTLB0_DTVA0_DTVB0_DTVMXSA0_DTVMXSB0_DTVSM0_DPLB0_EPS1_ELFLR0_EMLLn1_FDSI0_GRPM1_GRVWA1_GRVWB1_GSU1_GSUAMB_GSUC0_GSUWGMRR0_GLS0_ISA1151_IU1_K1_LDSTI0_LBSPPA0_LBSPPB0_LBSPPM0_LPA1_LPB1_LPM0_LRVW1_LWPMn1_MIAV0_MO40_MGRIPM1_NTn1_NTA0_NTB0_NTC0_NTD0_NTM0_NEPBS0_NLCA1_NLCB1_ONLL0_PGR1_PLR1_PKA0_SGROB0_SIA1_SS0_SU8_SUM0_SUS256_SPO0_SRVW0_SSO0_SVW1_SK0_SKFTR0_SKXCCM0_SGRO0_TDMI0_TIN0_TT1_1_TLDS0_TLDSMn1_ULSGRO0_USL1_UIOFGRO0_UPLRP0_USFGROn1_VSn1_VWA1_VWB1_WSGRA0_WSGRB0_WS32_WG8_8_1_WGM1_WGMXCC1_WGMXCCGn1
    SolutionIndex: 263
    SolutionNameMin: Cijk_Alik_Bljk_S_B_Bias_HA_S_SAV_UserArgs_MT8x4x64_SN_LDSB0_AFC1_AG0_AFEM1_AFEM1_ASEM1_CLR0_CADS0_DTLA0_DTLB0_DTVA0_DTVB0_DTVMXSA0_DTVMXSB0_DTVSM0_DPLB0_EPS0_ELFLR0_EMLLn1_FDSI0_GRPM1_GRVWA1_GRVWB1_GSU1_GSUAMB_GSUC0_GSUWGMRR0_GLS0_ISA1151_IU1_K1_LDSTI0_LBSPPA0_LBSPPB0_LBSPPM0_LPA1_LPB1_LPM0_LRVW1_LWPMn1_MIAV0_MO40_MGRIPM1_NTn1_NTA0_NTB0_NTC0_NTD0_NTM0_NEPBS0_NLCA2_NLCB2_ONLL0_PGR0_PLR1_PKA0_SGROB0_SIA1_SS0_SU0_SUM0_SUS0_SPO0_SRVW0_SSO0_SVW1_SK0_SKFTR0_SKXCCM0_SGRO0_TDMI0_TIN0_TT1_1_TLDS0_TLDSMn1_ULSGRO0_USL1_UIOFGRO0_UPLRP0_USFGROn1_VSn1_VWA1_VWB1_WSGRA0_WSGRB0_WS32_WG8_4_1_WGM1_WGMXCC1_WGMXCCGn1
    SolutionIndex: 264
    SolutionNameMin: Cijk_Alik_Bljk_S_B_Bias_HA_S_SAV_UserArgs_MT16x8x128_SN_LDSB0_AFC1_AG0_AFEM1_AFEM1_ASEM1_CLR0_CADS0_DTLA0_DTLB0_DTVA0_DTVB0_DTVMXSA0_DTVMXSB0_DTVSM0_DPLB0_EPS0_ELFLR0_EMLLn1_FDSI0_GRPM1_GRVWA1_GRVWB1_GSU1_GSUAMB_GSUC0_GSUWGMRR0_GLS0_ISA1151_IU1_K1_LDSTI0_LBSPPA0_LBSPPB0_LBSPPM0_LPA1_LPB1_LPM0_LRVW1_LWPMn1_MIAV0_MO40_MGRIPM1_NTn1_NTA0_NTB0_NTC0_NTD0_NTM0_NEPBS0_NLCA1_NLCB1_ONLL0_PGR1_PLR1_PKA0_SGROB0_SIA1_SS0_SU16_SUM0_SUS512_SPO0_SRVW0_SSO0_SVW1_SK0_SKFTR0_SKXCCM0_SGRO0_TDMI0_TIN0_TT1_1_TLDS0_TLDSMn1_ULSGRO0_USL1_UIOFGRO0_UPLRP0_USFGROn1_VSn1_VWA1_VWB1_WSGRA0_WSGRB0_WS32_WG16_8_1_WGM1_WGMXCC1_WGMXCCGn1
    SolutionIndex: 265
    SolutionNameMin: Cijk_Alik_Bljk_S_B_Bias_HA_S_SAV_UserArgs_MT16x4x64_SN_LDSB0_AFC1_AG0_AFEM1_AFEM1_ASEM1_CLR0_CADS0_DTLA0_DTLB0_DTVA0_DTVB0_DTVMXSA0_DTVMXSB0_DTVSM0_DPLB0_EPS0_ELFLR0_EMLLn1_FDSI0_GRPM1_GRVWA1_GRVWB1_GSU1_GSUAMB_GSUC0_GSUWGMRR0_GLS0_ISA1151_IU1_K1_LDSTI0_LBSPPA0_LBSPPB0_LBSPPM0_LPA1_LPB1_LPM0_LRVW1_LWPMn1_MIAV0_MO40_MGRIPM1_NTn1_NTA0_NTB0_NTC0_NTD0_NTM0_NEPBS0_NLCA1_NLCB1_ONLL0_PGR0_PLR1_PKA0_SGROB0_SIA1_SS0_SU0_SUM0_SUS0_SPO0_SRVW0_SSO0_SVW1_SK0_SKFTR0_SKXCCM0_SGRO0_TDMI0_TIN0_TT1_1_TLDS0_TLDSMn1_ULSGRO0_USL1_UIOFGRO0_UPLRP0_USFGROn1_VSn1_VWA1_VWB1_WSGRA0_WSGRB0_WS32_WG16_4_1_WGM1_WGMXCC1_WGMXCCGn1
    SolutionIndex: 266
    SolutionNameMin: Cijk_Alik_Bljk_S_B_Bias_HA_S_SAV_UserArgs_MT16x8x128_SN_LDSB0_AFC1_AG0_AFEM1_AFEM1_ASEM1_CLR0_CADS0_DTLA0_DTLB0_DTVA0_DTVB0_DTVMXSA0_DTVMXSB0_DTVSM0_DPLB0_EPS0_ELFLR0_EMLLn1_FDSI0_GRPM1_GRVWA1_GRVWB1_GSU1_GSUAMB_GSUC0_GSUWGMRR0_GLS0_ISA1151_IU1_K1_LDSTI0_LBSPPA0_LBSPPB0_LBSPPM0_LPA1_LPB1_LPM0_LRVW1_LWPMn1_MIAV0_MO40_MGRIPM1_NTn1_NTA0_NTB0_NTC0_NTD0_NTM0_NEPBS0_NLCA1_NLCB1_ONLL0_PGR1_PLR1_PKA0_SGROB0_SIA1_SS0_SU8_SUM0_SUS512_SPO0_SRVW0_SSO0_SVW1_SK0_SKFTR0_SKXCCM0_SGRO0_TDMI0_TIN0_TT1_1_TLDS0_TLDSMn1_ULSGRO0_USL1_UIOFGRO0_UPLRP0_USFGROn1_VSn1_VWA1_VWB1_WSGRA0_WSGRB0_WS32_WG16_8_1_WGM1_WGMXCC1_WGMXCCGn1
    SolutionIndex: 267
    SolutionNameMin: Cijk_Alik_Bljk_S_B_Bias_HA_S_SAV_UserArgs_MT16x8x128_SN_LDSB0_AFC1_AG0_AFEM1_AFEM1_ASEM1_CLR0_CADS0_DTLA0_DTLB0_DTVA0_DTVB0_DTVMXSA0_DTVMXSB0_DTVSM0_DPLB0_EPS1_ELFLR0_EMLLn1_FDSI0_GRPM1_GRVWA1_GRVWB1_GSU1_GSUAMB_GSUC0_GSUWGMRR0_GLS0_ISA1151_IU1_K1_LDSTI0_LBSPPA0_LBSPPB0_LBSPPM0_LPA1_LPB1_LPM0_LRVW1_LWPMn1_MIAV0_MO40_MGRIPM1_NTn1_NTA0_NTB0_NTC0_NTD0_NTM0_NEPBS0_NLCA1_NLCB1_ONLL0_PGR1_PLR1_PKA0_SGROB0_SIA1_SS0_SU16_SUM0_SUS512_SPO0_SRVW0_SSO0_SVW1_SK0_SKFTR0_SKXCCM0_SGRO0_TDMI0_TIN0_TT1_1_TLDS0_TLDSMn1_ULSGRO0_USL1_UIOFGRO0_UPLRP0_USFGROn1_VSn1_VWA1_VWB1_WSGRA0_WSGRB0_WS32_WG16_8_1_WGM1_WGMXCC1_WGMXCCGn1
    SolutionIndex: 268
    SolutionNameMin: Cijk_Alik_Bljk_S_B_Bias_HA_S_SAV_UserArgs_MT16x8x64_SN_LDSB0_AFC1_AG0_AFEM1_AFEM1_ASEM1_CLR0_CADS0_DTLA0_DTLB0_DTVA0_DTVB0_DTVMXSA0_DTVMXSB0_DTVSM0_DPLB0_EPS1_ELFLR0_EMLLn1_FDSI0_GRPM1_GRVWA1_GRVWB1_GSU1_GSUAMB_GSUC0_GSUWGMRR0_GLS0_ISA1151_IU1_K1_LDSTI0_LBSPPA0_LBSPPB0_LBSPPM0_LPA1_LPB1_LPM0_LRVW1_LWPMn1_MIAV0_MO40_MGRIPM1_NTn1_NTA0_NTB0_NTC0_NTD0_NTM0_NEPBS0_NLCA1_NLCB1_ONLL0_PGR1_PLR1_PKA0_SGROB0_SIA1_SS0_SU0_SUM0_SUS0_SPO0_SRVW0_SSO0_SVW1_SK0_SKFTR0_SKXCCM0_SGRO0_TDMI0_TIN0_TT1_1_TLDS0_TLDSMn1_ULSGRO0_USL1_UIOFGRO0_UPLRP0_USFGROn1_VSn1_VWA1_VWB1_WSGRA0_WSGRB0_WS32_WG16_8_1_WGM1_WGMXCC1_WGMXCCGn1
    SolutionIndex: 269
    SolutionNameMin: Cijk_Alik_Bljk_S_B_Bias_HA_S_SAV_UserArgs_MT8x8x128_SN_LDSB0_AFC1_AG0_AFEM1_AFEM1_ASEM1_CLR0_CADS0_DTLA0_DTLB0_DTVA0_DTVB0_DTVMXSA0_DTVMXSB0_DTVSM0_DPLB0_EPS0_ELFLR0_EMLLn1_FDSI0_GRPM1_GRVWA1_GRVWB1_GSU1_GSUAMB_GSUC0_GSUWGMRR0_GLS0_ISA1151_IU1_K1_LDSTI0_LBSPPA0_LBSPPB0_LBSPPM0_LPA1_LPB1_LPM0_LRVW1_LWPMn1_MIAV0_MO40_MGRIPM1_NTn1_NTA0_NTB0_NTC0_NTD0_NTM0_NEPBS0_NLCA2_NLCB2_ONLL0_PGR0_PLR1_PKA0_SGROB0_SIA1_SS0_SU0_SUM0_SUS0_SPO0_SRVW0_SSO0_SVW1_SK0_SKFTR0_SKXCCM0_SGRO0_TDMI0_TIN0_TT1_1_TLDS0_TLDSMn1_ULSGRO0_USL1_UIOFGRO0_UPLRP0_USFGROn1_VSn1_VWA1_VWB1_WSGRA0_WSGRB0_WS32_WG8_8_1_WGM1_WGMXCC1_WGMXCCGn1
    SolutionIndex: 270
    SolutionNameMin: Cijk_Alik_Bljk_S_B_Bias_HA_S_SAV_UserArgs_MT16x4x64_SN_LDSB0_AFC1_AG0_AFEM1_AFEM1_ASEM1_CLR0_CADS0_DTLA0_DTLB0_DTVA0_DTVB0_DTVMXSA0_DTVMXSB0_DTVSM0_DPLB0_EPS0_ELFLR0_EMLLn1_FDSI0_GRPM1_GRVWA1_GRVWB1_GSU1_GSUAMB_GSUC0_GSUWGMRR0_GLS0_ISA1151_IU1_K1_LDSTI0_LBSPPA0_LBSPPB0_LBSPPM0_LPA1_LPB1_LPM0_LRVW1_LWPMn1_MIAV0_MO40_MGRIPM1_NTn1_NTA0_NTB0_NTC0_NTD0_NTM0_NEPBS0_NLCA1_NLCB1_ONLL0_PGR1_PLR1_PKA0_SGROB0_SIA1_SS0_SU16_SUM0_SUS256_SPO0_SRVW0_SSO0_SVW1_SK0_SKFTR0_SKXCCM0_SGRO0_TDMI0_TIN0_TT1_1_TLDS0_TLDSMn1_ULSGRO0_USL1_UIOFGRO0_UPLRP0_USFGROn1_VSn1_VWA1_VWB1_WSGRA0_WSGRB0_WS32_WG16_4_1_WGM1_WGMXCC1_WGMXCCGn1
    SolutionIndex: 271
    SolutionNameMin: Cijk_Alik_Bljk_S_B_Bias_HA_S_SAV_UserArgs_MT8x8x128_SN_LDSB0_AFC1_AG0_AFEM1_AFEM1_ASEM1_CLR0_CADS0_DTLA0_DTLB0_DTVA0_DTVB0_DTVMXSA0_DTVMXSB0_DTVSM0_DPLB0_EPS0_ELFLR0_EMLLn1_FDSI0_GRPM1_GRVWA1_GRVWB1_GSU1_GSUAMB_GSUC0_GSUWGMRR0_GLS0_ISA1151_IU1_K1_LDSTI0_LBSPPA0_LBSPPB0_LBSPPM0_LPA1_LPB1_LPM0_LRVW1_LWPMn1_MIAV0_MO40_MGRIPM1_NTn1_NTA0_NTB0_NTC0_NTD0_NTM0_NEPBS0_NLCA2_NLCB2_ONLL0_PGR1_PLR1_PKA0_SGROB0_SIA1_SS0_SU0_SUM0_SUS0_SPO0_SRVW0_SSO0_SVW1_SK0_SKFTR0_SKXCCM0_SGRO0_TDMI0_TIN0_TT1_1_TLDS0_TLDSMn1_ULSGRO0_USL1_UIOFGRO0_UPLRP0_USFGROn1_VSn1_VWA1_VWB1_WSGRA0_WSGRB0_WS32_WG8_8_1_WGM1_WGMXCC1_WGMXCCGn1
    SolutionIndex: 272
    SolutionNameMin: Cijk_Alik_Bljk_S_B_Bias_HA_S_SAV_UserArgs_MT16x8x64_SN_LDSB0_AFC1_AG0_AFEM1_AFEM1_ASEM1_CLR0_CADS0_DTLA0_DTLB0_DTVA0_DTVB0_DTVMXSA0_DTVMXSB0_DTVSM0_DPLB0_EPS0_ELFLR0_EMLLn1_FDSI0_GRPM1_GRVWA1_GRVWB1_GSU1_GSUAMB_GSUC0_GSUWGMRR0_GLS0_ISA1151_IU1_K1_LDSTI0_LBSPPA0_LBSPPB0_LBSPPM0_LPA1_LPB1_LPM0_LRVW1_LWPMn1_MIAV0_MO40_MGRIPM1_NTn1_NTA0_NTB0_NTC0_NTD0_NTM0_NEPBS0_NLCA1_NLCB1_ONLL0_PGR1_PLR1_PKA0_SGROB0_SIA1_SS0_SU0_SUM0_SUS0_SPO0_SRVW0_SSO0_SVW1_SK0_SKFTR0_SKXCCM0_SGRO0_TDMI0_TIN0_TT1_1_TLDS0_TLDSMn1_ULSGRO0_USL1_UIOFGRO0_UPLRP0_USFGROn1_VSn1_VWA1_VWB1_WSGRA0_WSGRB0_WS32_WG16_8_1_WGM1_WGMXCC1_WGMXCCGn1
    SolutionIndex: 273
    SolutionNameMin: Cijk_Alik_Bljk_S_B_Bias_HA_S_SAV_UserArgs_MT16x8x64_SN_LDSB0_AFC1_AG0_AFEM1_AFEM1_ASEM1_CLR0_CADS0_DTLA0_DTLB0_DTVA0_DTVB0_DTVMXSA0_DTVMXSB0_DTVSM0_DPLB0_EPS1_ELFLR0_EMLLn1_FDSI0_GRPM1_GRVWA1_GRVWB1_GSU1_GSUAMB_GSUC0_GSUWGMRR0_GLS0_ISA1151_IU1_K1_LDSTI0_LBSPPA0_LBSPPB0_LBSPPM0_LPA1_LPB1_LPM0_LRVW1_LWPMn1_MIAV0_MO40_MGRIPM1_NTn1_NTA0_NTB0_NTC0_NTD0_NTM0_NEPBS0_NLCA1_NLCB1_ONLL0_PGR1_PLR1_PKA0_SGROB0_SIA1_SS0_SU8_SUM0_SUS256_SPO0_SRVW0_SSO0_SVW1_SK0_SKFTR0_SKXCCM0_SGRO0_TDMI0_TIN0_TT1_1_TLDS0_TLDSMn1_ULSGRO0_USL1_UIOFGRO0_UPLRP0_USFGROn1_VSn1_VWA1_VWB1_WSGRA0_WSGRB0_WS32_WG16_8_1_WGM1_WGMXCC1_WGMXCCGn1
    SolutionIndex: 274
    SolutionNameMin: Cijk_Alik_Bljk_S_B_Bias_HA_S_SAV_UserArgs_MT8x8x128_SN_LDSB0_AFC1_AG0_AFEM1_AFEM1_ASEM1_CLR0_CADS0_DTLA0_DTLB0_DTVA0_DTVB0_DTVMXSA0_DTVMXSB0_DTVSM0_DPLB0_EPS1_ELFLR0_EMLLn1_FDSI0_GRPM1_GRVWA1_GRVWB1_GSU1_GSUAMB_GSUC0_GSUWGMRR0_GLS0_ISA1151_IU1_K1_LDSTI0_LBSPPA0_LBSPPB0_LBSPPM0_LPA1_LPB1_LPM0_LRVW1_LWPMn1_MIAV0_MO40_MGRIPM1_NTn1_NTA0_NTB0_NTC0_NTD0_NTM0_NEPBS0_NLCA2_NLCB2_ONLL0_PGR1_PLR1_PKA0_SGROB0_SIA1_SS0_SU0_SUM0_SUS0_SPO0_SRVW0_SSO0_SVW1_SK0_SKFTR0_SKXCCM0_SGRO0_TDMI0_TIN0_TT1_1_TLDS0_TLDSMn1_ULSGRO0_USL1_UIOFGRO0_UPLRP0_USFGROn1_VSn1_VWA1_VWB1_WSGRA0_WSGRB0_WS32_WG8_8_1_WGM1_WGMXCC1_WGMXCCGn1
    SolutionIndex: 275
    SolutionNameMin: Cijk_Alik_Bljk_S_B_Bias_HA_S_SAV_UserArgs_MT16x8x128_SN_LDSB0_AFC1_AG0_AFEM1_AFEM1_ASEM1_CLR0_CADS0_DTLA0_DTLB0_DTVA0_DTVB0_DTVMXSA0_DTVMXSB0_DTVSM0_DPLB0_EPS1_ELFLR0_EMLLn1_FDSI0_GRPM1_GRVWA1_GRVWB1_GSU1_GSUAMB_GSUC0_GSUWGMRR0_GLS0_ISA1151_IU1_K1_LDSTI0_LBSPPA0_LBSPPB0_LBSPPM0_LPA1_LPB1_LPM0_LRVW1_LWPMn1_MIAV0_MO40_MGRIPM1_NTn1_NTA0_NTB0_NTC0_NTD0_NTM0_NEPBS0_NLCA1_NLCB1_ONLL0_PGR1_PLR1_PKA0_SGROB0_SIA1_SS0_SU0_SUM0_SUS0_SPO0_SRVW0_SSO0_SVW1_SK0_SKFTR0_SKXCCM0_SGRO0_TDMI0_TIN0_TT1_1_TLDS0_TLDSMn1_ULSGRO0_USL1_UIOFGRO0_UPLRP0_USFGROn1_VSn1_VWA1_VWB1_WSGRA0_WSGRB0_WS32_WG16_8_1_WGM1_WGMXCC1_WGMXCCGn1
    SolutionIndex: 276
    SolutionNameMin: Cijk_Alik_Bljk_S_B_Bias_HA_S_SAV_UserArgs_MT8x8x128_SN_LDSB0_AFC1_AG0_AFEM1_AFEM1_ASEM1_CLR0_CADS0_DTLA0_DTLB0_DTVA0_DTVB0_DTVMXSA0_DTVMXSB0_DTVSM0_DPLB0_EPS1_ELFLR0_EMLLn1_FDSI0_GRPM1_GRVWA1_GRVWB1_GSU1_GSUAMB_GSUC0_GSUWGMRR0_GLS0_ISA1151_IU1_K1_LDSTI0_LBSPPA0_LBSPPB0_LBSPPM0_LPA1_LPB1_LPM0_LRVW1_LWPMn1_MIAV0_MO40_MGRIPM1_NTn1_NTA0_NTB0_NTC0_NTD0_NTM0_NEPBS0_NLCA2_NLCB2_ONLL0_PGR1_PLR1_PKA0_SGROB0_SIA1_SS0_SU8_SUM0_SUS512_SPO0_SRVW0_SSO0_SVW1_SK0_SKFTR0_SKXCCM0_SGRO0_TDMI0_TIN0_TT1_1_TLDS0_TLDSMn1_ULSGRO0_USL1_UIOFGRO0_UPLRP0_USFGROn1_VSn1_VWA1_VWB1_WSGRA0_WSGRB0_WS32_WG8_8_1_WGM1_WGMXCC1_WGMXCCGn1
- - - [1, 1024, 1, 1]
    - [1, 0.0]
  - - [1, 2048, 1, 1]
    - [2, 0.0]
  - - [1, 4096, 1, 1]
    - [5, 0.0]
  - - [1, 8192, 1, 1]
    - [2, 0.0]
  - - [1, 1024, 1, 16]
    - [0, 0.0]
  - - [1, 2048, 1, 16]
    - [7, 0.01]
  - - [1, 1024, 1, 64]
    - [3, 0.01]
  - - [1, 4096, 1, 16]
    - [2, 0.01]
  - - [1, 1024, 1, 128]
    - [11, 0.02]
  - - [1, 2048, 1, 64]
    - [8, 0.02]
  - - [1, 8192, 1, 16]
    - [5, 0.02]
  - - [1, 1024, 1, 256]
    - [12, 0.03]
  - - [1, 2048, 1, 128]
    - [6, 0.04]
  - - [1, 4096, 1, 64]
    - [4, 0.04]
  - - [1, 1024, 1, 512]
    - [1, 0.04]
  - - [1, 2048, 1, 256]
    - [6, 0.05]
  - - [1, 4096, 1, 128]
    - [4, 0.05]
  - - [1, 8192, 1, 64]
    - [2, 0.05]
  - - [1, 1024, 1, 1024]
    - [12, 0.04]
  - - [1, 2048, 1, 512]
    - [13, 0.04]
  - - [1, 4096, 1, 256]
    - [13, 0.05]
  - - [1, 8192, 1, 128]
    - [3, 0.06]
  - - [1, 1024, 1, 2048]
    - [12, 0.05]
  - - [1, 2048, 1, 1024]
    - [13, 0.06]
  - - [1, 4096, 1, 512]
    - [13, 0.05]
  - - [1, 8192, 1, 256]
    - [13, 0.06]
  - - [1, 1024, 1, 4096]
    - [11, 0.06]
  - - [1, 2048, 1, 2048]
    - [13, 0.07]
  - - [1, 4096, 1, 1024]
    - [3, 0.07]
  - - [1, 8192, 1, 512]
    - [13, 0.07]
  - - [1, 1024, 1, 8192]
    - [16, 0.06]
  - - [1, 2048, 1, 4096]
    - [0, 0.07]
  - - [1, 4096, 1, 2048]
    - [3, 0.07]
  - - [1, 8192, 1, 1024]
    - [14, 0.07]
  - - [1, 2048, 1, 8192]
    - [9, 0.03]
  - - [1, 4096, 1, 4096]
    - [9, 0.03]
  - - [1, 8192, 1, 2048]
    - [9, 0.03]
  - - [1, 4096, 1, 8192]
    - [15, 0.03]
  - - [1, 8192, 1, 4096]
    - [9, 0.03]
  - - [1, 8192, 1, 8192]
    - [10, 0.03]
  - - [1, 16, 1, 1]
    - [5, 0.0]
  - - [1, 16, 1, 16]
    - [17, 0.0]
  - - [1, 16, 1, 64]
    - [18, 0.0]
  - - [1, 16, 1, 128]
    - [19, 0.0]
  - - [1, 16, 1, 256]
    - [19, 0.0]
  - - [1, 16, 1, 512]
    - [19, 0.0]
  - - [1, 16, 1, 1024]
    - [20, 0.0]
  - - [1, 16, 1, 2048]
    - [20, 0.0]
  - - [1, 16, 1, 4096]
    - [20, 0.0]
  - - [1, 16, 1, 8192]
    - [21, 0.0]
  - - [1, 64, 1, 1]
    - [18, 0.0]
  - - [1, 64, 1, 16]
    - [22, 0.0]
  - - [1, 64, 1, 64]
    - [22, 0.0]
  - - [1, 64, 1, 128]
    - [23, 0.0]
  - - [1, 64, 1, 256]
    - [23, 0.0]
  - - [1, 64, 1, 512]
    - [23, 0.0]
  - - [1, 64, 1, 1024]
    - [21, 0.0]
  - - [1, 64, 1, 2048]
    - [20, 0.0]
  - - [1, 64, 1, 4096]
    - [21, 0.0]
  - - [1, 64, 1, 8192]
    - [21, 0.0]
  - - [1, 128, 1, 1]
    - [18, 0.0]
  - - [1, 128, 1, 16]
    - [18, 0.0]
  - - [1, 128, 1, 64]
    - [22, 0.0]
  - - [1, 128, 1, 128]
    - [23, 0.0]
  - - [1, 128, 1, 256]
    - [23, 0.0]
  - - [1, 128, 1, 512]
    - [19, 0.01]
  - - [1, 128, 1, 1024]
    - [21, 0.01]
  - - [1, 128, 1, 2048]
    - [20, 0.01]
  - - [1, 128, 1, 4096]
    - [20, 0.01]
  - - [1, 128, 1, 8192]
    - [21, 0.01]
  - - [1, 256, 1, 1]
    - [18, 0.0]
  - - [1, 256, 1, 16]
    - [19, 0.0]
  - - [1, 256, 1, 64]
    - [18, 0.0]
  - - [1, 256, 1, 128]
    - [19, 0.01]
  - - [1, 256, 1, 256]
    - [19, 0.01]
  - - [1, 256, 1, 512]
    - [21, 0.01]
  - - [1, 256, 1, 1024]
    - [21, 0.01]
  - - [1, 256, 1, 2048]
    - [20, 0.02]
  - - [1, 256, 1, 4096]
    - [21, 0.02]
  - - [1, 256, 1, 8192]
    - [20, 0.02]
  - - [1, 512, 1, 1]
    - [18, 0.0]
  - - [1, 512, 1, 16]
    - [19, 0.0]
  - - [1, 512, 1, 64]
    - [18, 0.01]
  - - [1, 512, 1, 128]
    - [23, 0.01]
  - - [1, 512, 1, 256]
    - [24, 0.02]
  - - [1, 512, 1, 512]
    - [25, 0.02]
  - - [1, 512, 1, 1024]
    - [21, 0.03]
  - - [1, 512, 1, 2048]
    - [21, 0.03]
  - - [1, 512, 1, 4096]
    - [21, 0.03]
  - - [1, 512, 1, 8192]
    - [21, 0.03]
  - - [768, 1, 1, 1]
    - [26, 0.0]
  - - [1536, 1, 1, 1]
    - [27, 0.0]
  - - [3072, 1, 1, 1]
    - [28, 0.0]
  - - [6144, 1, 1, 1]
    - [26, 0.0]
  - - [768, 1, 1, 16]
    - [29, 0.0]
  - - [1536, 1, 1, 16]
    - [43, 0.01]
  - - [768, 1, 1, 64]
    - [30, 0.01]
  - - [3072, 1, 1, 16]
    - [28, 0.01]
  - - [768, 1, 1, 128]
    - [31, 0.02]
  - - [1536, 1, 1, 64]
    - [32, 0.02]
  - - [6144, 1, 1, 16]
    - [33, 0.02]
  - - [768, 1, 1, 256]
    - [31, 0.02]
  - - [1536, 1, 1, 128]
    - [34, 0.03]
  - - [3072, 1, 1, 64]
    - [35, 0.03]
  - - [768, 1, 1, 512]
    - [31, 0.03]
  - - [1536, 1, 1, 256]
    - [34, 0.04]
  - - [3072, 1, 1, 128]
    - [35, 0.05]
  - - [6144, 1, 1, 64]
    - [26, 0.05]
  - - [768, 1, 1, 1024]
    - [31, 0.04]
  - - [1536, 1, 1, 512]
    - [34, 0.05]
  - - [3072, 1, 1, 256]
    - [36, 0.06]
  - - [6144, 1, 1, 128]
    - [37, 0.06]
  - - [768, 1, 1, 2048]
    - [31, 0.04]
  - - [1536, 1, 1, 1024]
    - [34, 0.07]
  - - [3072, 1, 1, 512]
    - [34, 0.08]
  - - [6144, 1, 1, 256]
    - [26, 0.08]
  - - [768, 1, 1, 4096]
    - [31, 0.05]
  - - [1536, 1, 1, 2048]
    - [34, 0.07]
  - - [3072, 1, 1, 1024]
    - [34, 0.09]
  - - [6144, 1, 1, 512]
    - [26, 0.09]
  - - [768, 1, 1, 8192]
    - [38, 0.05]
  - - [1536, 1, 1, 4096]
    - [34, 0.08]
  - - [3072, 1, 1, 2048]
    - [39, 0.1]
  - - [6144, 1, 1, 1024]
    - [37, 0.1]
  - - [1536, 1, 1, 8192]
    - [40, 0.04]
  - - [3072, 1, 1, 4096]
    - [41, 0.04]
  - - [6144, 1, 1, 2048]
    - [30, 0.03]
  - - [3072, 1, 1, 8192]
    - [42, 0.04]
  - - [6144, 1, 1, 4096]
    - [30, 0.03]
  - - [6144, 1, 1, 8192]
    - [30, 0.03]
  - - [16, 1, 1, 1]
    - [44, 0.0]
  - - [64, 1, 1, 1]
    - [29, 0.0]
  - - [128, 1, 1, 1]
    - [45, 0.0]
  - - [16, 1, 1, 16]
    - [46, 0.0]
  - - [256, 1, 1, 1]
    - [47, 0.0]
  - - [384, 1, 1, 1]
    - [45, 0.0]
  - - [16, 1, 1, 64]
    - [44, 0.0]
  - - [64, 1, 1, 16]
    - [44, 0.0]
  - - [16, 1, 1, 128]
    - [48, 0.0]
  - - [128, 1, 1, 16]
    - [46, 0.0]
  - - [16, 1, 1, 256]
    - [49, 0.0]
  - - [64, 1, 1, 64]
    - [44, 0.0]
  - - [256, 1, 1, 16]
    - [50, 0.0]
  - - [384, 1, 1, 16]
    - [46, 0.0]
  - - [16, 1, 1, 512]
    - [45, 0.0]
  - - [64, 1, 1, 128]
    - [48, 0.0]
  - - [128, 1, 1, 64]
    - [51, 0.0]
  - - [16, 1, 1, 1024]
    - [52, 0.0]
  - - [64, 1, 1, 256]
    - [49, 0.0]
  - - [128, 1, 1, 128]
    - [45, 0.0]
  - - [256, 1, 1, 64]
    - [51, 0.0]
  - - [384, 1, 1, 64]
    - [53, 0.0]
  - - [16, 1, 1, 2048]
    - [54, 0.0]
  - - [64, 1, 1, 512]
    - [55, 0.0]
  - - [128, 1, 1, 256]
    - [45, 0.0]
  - - [256, 1, 1, 128]
    - [45, 0.01]
  - - [384, 1, 1, 128]
    - [45, 0.01]
  - - [16, 1, 1, 4096]
    - [54, 0.0]
  - - [64, 1, 1, 1024]
    - [52, 0.0]
  - - [128, 1, 1, 512]
    - [56, 0.01]
  - - [256, 1, 1, 256]
    - [45, 0.01]
  - - [384, 1, 1, 256]
    - [48, 0.01]
  - - [16, 1, 1, 8192]
    - [54, 0.0]
  - - [64, 1, 1, 2048]
    - [54, 0.0]
  - - [128, 1, 1, 1024]
    - [54, 0.01]
  - - [256, 1, 1, 512]
    - [45, 0.01]
  - - [384, 1, 1, 512]
    - [48, 0.02]
  - - [64, 1, 1, 4096]
    - [52, 0.0]
  - - [128, 1, 1, 2048]
    - [52, 0.01]
  - - [256, 1, 1, 1024]
    - [54, 0.01]
  - - [384, 1, 1, 1024]
    - [52, 0.02]
  - - [64, 1, 1, 8192]
    - [54, 0.0]
  - - [128, 1, 1, 4096]
    - [54, 0.01]
  - - [256, 1, 1, 2048]
    - [54, 0.02]
  - - [384, 1, 1, 2048]
    - [52, 0.02]
  - - [128, 1, 1, 8192]
    - [54, 0.01]
  - - [256, 1, 1, 4096]
    - [52, 0.02]
  - - [384, 1, 1, 4096]
    - [52, 0.02]
  - - [256, 1, 1, 8192]
    - [52, 0.02]
  - - [384, 1, 1, 8192]
    - [54, 0.02]
  - - [1, 1, 1, 1]
    - [57, 0.0]
  - - [1, 1, 1, 16]
    - [58, 0.0]
  - - [1, 1, 1, 64]
    - [59, 0.0]
  - - [1, 1, 1, 128]
    - [60, 0.0]
  - - [1, 1, 1, 256]
    - [61, 0.0]
  - - [1, 1, 1, 512]
    - [62, 0.0]
  - - [1, 1, 1, 1024]
    - [63, 0.0]
  - - [1, 1, 1, 2048]
    - [63, 0.0]
  - - [1, 1, 1, 4096]
    - [64, 0.0]
  - - [1, 1, 1, 8192]
    - [64, 0.0]
  - - [768, 8192, 1, 4096]
    - [65, 3.39]
  - - [768, 8192, 1, 8192]
    - [65, 3.13]
  - - [3072, 4096, 1, 4096]
    - [66, 3.15]
  - - [6144, 4096, 1, 2048]
    - [66, 3.35]
  - - [1536, 8192, 1, 8192]
    - [66, 3.02]
  - - [3072, 4096, 1, 8192]
    - [66, 3.03]
  - - [3072, 8192, 1, 4096]
    - [66, 3.16]
  - - [6144, 2048, 1, 8192]
    - [66, 3.06]
  - - [6144, 4096, 1, 4096]
    - [66, 3.22]
  - - [6144, 8192, 1, 2048]
    - [66, 3.33]
  - - [3072, 8192, 1, 8192]
    - [66, 3.09]
  - - [6144, 4096, 1, 8192]
    - [66, 3.1]
  - - [6144, 8192, 1, 8192]
    - [66, 3.13]
  - - [6144, 1024, 1, 2048]
    - [67, 3.17]
  - - [6144, 1024, 1, 4096]
    - [67, 3.14]
  - - [6144, 2048, 1, 2048]
    - [67, 3.27]
  - - [1536, 4096, 1, 8192]
    - [67, 2.97]
  - - [6144, 2048, 1, 4096]
    - [67, 3.15]
  - - [768, 8192, 1, 2048]
    - [68, 3.42]
  - - [3072, 2048, 1, 2048]
    - [68, 3.45]
  - - [1536, 4096, 1, 4096]
    - [68, 3.39]
  - - [3072, 2048, 1, 8192]
    - [69, 2.99]
  - - [3072, 2048, 1, 4096]
    - [70, 2.99]
  - - [6144, 1024, 1, 8192]
    - [70, 2.82]
  - - [3072, 4096, 1, 2048]
    - [71, 3.51]
  - - [1536, 8192, 1, 4096]
    - [71, 3.49]
  - - [6144, 8192, 1, 4096]
    - [72, 3.21]
  - - [1536, 4096, 1, 2048]
    - [73, 3.47]
  - - [1536, 8192, 1, 2048]
    - [73, 3.53]
  - - [3072, 8192, 1, 2048]
    - [73, 3.58]
  - - [768, 8192, 1, 1]
    - [74, 0.13]
  - - [1536, 4096, 1, 1]
    - [75, 0.13]
  - - [3072, 2048, 1, 1]
    - [76, 0.13]
  - - [6144, 1024, 1, 1]
    - [77, 0.13]
  - - [1536, 8192, 1, 1]
    - [78, 0.04]
  - - [3072, 4096, 1, 1]
    - [78, 0.04]
  - - [6144, 2048, 1, 1]
    - [78, 0.04]
  - - [12288, 1024, 1, 1]
    - [79, 0.04]
  - - [3072, 8192, 1, 1]
    - [80, 0.04]
  - - [6144, 4096, 1, 1]
    - [81, 0.04]
  - - [12288, 2048, 1, 1]
    - [82, 0.04]
  - - [6144, 8192, 1, 1]
    - [83, 0.04]
  - - [12288, 4096, 1, 1]
    - [81, 0.04]
  - - [12288, 8192, 1, 1]
    - [81, 0.04]
  - - [768, 8192, 1, 2]
    - [75, 0.25]
  - - [1536, 4096, 1, 2]
    - [74, 0.25]
  - - [3072, 2048, 1, 2]
    - [75, 0.25]
  - - [6144, 1024, 1, 2]
    - [84, 0.25]
  - - [1536, 8192, 1, 2]
    - [78, 0.08]
  - - [3072, 4096, 1, 2]
    - [78, 0.07]
  - - [6144, 2048, 1, 2]
    - [80, 0.07]
  - - [12288, 1024, 1, 2]
    - [85, 0.07]
  - - [3072, 8192, 1, 2]
    - [78, 0.07]
  - - [6144, 4096, 1, 2]
    - [80, 0.07]
  - - [12288, 2048, 1, 2]
    - [86, 0.07]
  - - [6144, 8192, 1, 2]
    - [78, 0.07]
  - - [12288, 4096, 1, 2]
    - [81, 0.07]
  - - [12288, 8192, 1, 2]
    - [81, 0.07]
  - - [768, 8192, 1, 4]
    - [87, 0.48]
  - - [1536, 4096, 1, 4]
    - [87, 0.48]
  - - [3072, 2048, 1, 4]
    - [74, 0.48]
  - - [6144, 1024, 1, 4]
    - [75, 0.48]
  - - [1536, 8192, 1, 4]
    - [78, 0.15]
  - - [3072, 4096, 1, 4]
    - [78, 0.14]
  - - [6144, 2048, 1, 4]
    - [78, 0.14]
  - - [12288, 1024, 1, 4]
    - [85, 0.14]
  - - [3072, 8192, 1, 4]
    - [78, 0.15]
  - - [6144, 4096, 1, 4]
    - [80, 0.14]
  - - [12288, 2048, 1, 4]
    - [88, 0.14]
  - - [6144, 8192, 1, 4]
    - [78, 0.14]
  - - [768, 8192, 1, 16]
    - [75, 1.41]
  - - [1536, 4096, 1, 16]
    - [74, 1.43]
  - - [3072, 2048, 1, 16]
    - [74, 1.44]
  - - [6144, 1024, 1, 16]
    - [84, 1.43]
  - - [1536, 8192, 1, 16]
    - [80, 0.6]
  - - [3072, 4096, 1, 16]
    - [89, 0.58]
  - - [6144, 2048, 1, 16]
    - [78, 0.57]
  - - [768, 8192, 1, 64]
    - [77, 2.44]
  - - [1536, 4096, 1, 64]
    - [75, 2.42]
  - - [3072, 2048, 1, 64]
    - [87, 2.39]
  - - [3072, 8192, 1, 16]
    - [80, 0.59]
  - - [6144, 1024, 1, 64]
    - [90, 2.47]
  - - [6144, 4096, 1, 16]
    - [91, 0.59]
  - - [768, 8192, 1, 128]
    - [68, 2.93]
  - - [1536, 4096, 1, 128]
    - [97, 2.93]
  - - [1536, 8192, 1, 64]
    - [68, 2.15]
  - - [3072, 2048, 1, 128]
    - [92, 2.9]
  - - [3072, 4096, 1, 64]
    - [93, 2.08]
  - - [6144, 1024, 1, 128]
    - [94, 2.97]
  - - [6144, 2048, 1, 64]
    - [95, 2.05]
  - - [6144, 8192, 1, 16]
    - [80, 0.59]
  - - [1536, 8192, 1, 128]
    - [73, 2.94]
  - - [3072, 4096, 1, 128]
    - [73, 2.89]
  - - [3072, 8192, 1, 64]
    - [93, 2.14]
  - - [6144, 2048, 1, 128]
    - [98, 2.87]
  - - [6144, 4096, 1, 64]
    - [99, 2.11]
  - - [3072, 8192, 1, 128]
    - [98, 2.94]
  - - [6144, 4096, 1, 128]
    - [96, 2.96]
  - - [6144, 8192, 1, 64]
    - [93, 2.13]
  - - [6144, 8192, 1, 128]
    - [98, 3.09]
  - - [768, 8192, 1, 256]
    - [100, 3.27]
  - - [1536, 4096, 1, 256]
    - [100, 3.28]
  - - [3072, 2048, 1, 256]
    - [101, 3.26]
  - - [6144, 1024, 1, 256]
    - [101, 3.23]
  - - [768, 8192, 1, 512]
    - [100, 3.32]
  - - [1536, 4096, 1, 512]
    - [100, 3.37]
  - - [1536, 8192, 1, 256]
    - [103, 3.21]
  - - [3072, 2048, 1, 512]
    - [104, 3.36]
  - - [3072, 4096, 1, 256]
    - [100, 3.2]
  - - [6144, 1024, 1, 512]
    - [73, 3.35]
  - - [6144, 2048, 1, 256]
    - [101, 3.27]
  - - [768, 8192, 1, 1024]
    - [102, 3.36]
  - - [1536, 4096, 1, 1024]
    - [73, 3.4]
  - - [1536, 8192, 1, 512]
    - [107, 3.37]
  - - [3072, 2048, 1, 1024]
    - [106, 3.42]
  - - [3072, 4096, 1, 512]
    - [100, 3.42]
  - - [3072, 8192, 1, 256]
    - [105, 3.26]
  - - [6144, 1024, 1, 1024]
    - [73, 3.48]
  - - [6144, 2048, 1, 512]
    - [73, 3.47]
  - - [6144, 4096, 1, 256]
    - [101, 3.34]
  - - [1536, 8192, 1, 1024]
    - [73, 3.42]
  - - [3072, 4096, 1, 1024]
    - [73, 3.5]
  - - [3072, 8192, 1, 512]
    - [107, 3.41]
  - - [6144, 2048, 1, 1024]
    - [100, 3.56]
  - - [6144, 4096, 1, 512]
    - [108, 3.5]
  - - [6144, 8192, 1, 256]
    - [100, 3.39]
  - - [3072, 8192, 1, 1024]
    - [105, 3.48]
  - - [6144, 4096, 1, 1024]
    - [73, 3.61]
  - - [6144, 8192, 1, 512]
    - [73, 3.54]
  - - [6144, 8192, 1, 1024]
    - [73, 3.55]
  - - [384, 256, 1, 2048]
    - [109, 1.86]
  - - [768, 128, 1, 2048]
    - [109, 1.86]
  - - [1536, 64, 1, 2048]
    - [109, 1.86]
  - - [6144, 16, 1, 2048]
    - [117, 0.51]
  - - [16, 8192, 1, 2048]
    - [111, 0.34]
  - - [64, 2048, 1, 2048]
    - [118, 2.0]
  - - [128, 1024, 1, 2048]
    - [112, 2.11]
  - - [256, 512, 1, 2048]
    - [112, 2.26]
  - - [384, 256, 1, 4096]
    - [109, 1.97]
  - - [384, 512, 1, 2048]
    - [119, 2.59]
  - - [768, 128, 1, 4096]
    - [109, 1.95]
  - - [768, 256, 1, 2048]
    - [119, 2.6]
  - - [1536, 64, 1, 4096]
    - [109, 1.96]
  - - [1536, 128, 1, 2048]
    - [119, 2.59]
  - - [3072, 64, 1, 2048]
    - [113, 2.57]
  - - [6144, 16, 1, 4096]
    - [120, 0.52]
  - - [16, 8192, 1, 4096]
    - [111, 0.39]
  - - [64, 2048, 1, 4096]
    - [114, 1.89]
  - - [128, 1024, 1, 4096]
    - [112, 2.27]
  - - [256, 512, 1, 4096]
    - [112, 2.37]
  - - [384, 256, 1, 8192]
    - [121, 2.02]
  - - [384, 512, 1, 4096]
    - [115, 2.69]
  - - [768, 128, 1, 8192]
    - [121, 2.02]
  - - [768, 256, 1, 4096]
    - [115, 2.68]
  - - [1536, 64, 1, 8192]
    - [117, 1.58]
  - - [1536, 128, 1, 4096]
    - [122, 2.69]
  - - [3072, 64, 1, 4096]
    - [78, 1.37]
  - - [6144, 16, 1, 8192]
    - [117, 0.52]
  - - [16, 8192, 1, 8192]
    - [110, 0.42]
  - - [64, 2048, 1, 8192]
    - [116, 1.32]
  - - [128, 1024, 1, 8192]
    - [114, 1.83]
  - - [256, 512, 1, 8192]
    - [112, 2.4]
  - - [384, 512, 1, 8192]
    - [115, 2.74]
  - - [768, 256, 1, 8192]
    - [113, 2.74]
  - - [1536, 128, 1, 8192]
    - [78, 1.79]
  - - [3072, 64, 1, 8192]
    - [78, 1.29]
  - - [384, 256, 1, 1]
    - [123, 0.02]
  - - [768, 128, 1, 1]
    - [123, 0.02]
  - - [1536, 64, 1, 1]
    - [124, 0.02]
  - - [6144, 16, 1, 1]
    - [125, 0.02]
  - - [16, 8192, 1, 1]
    - [126, 0.02]
  - - [64, 2048, 1, 1]
    - [127, 0.02]
  - - [128, 1024, 1, 1]
    - [127, 0.02]
  - - [256, 512, 1, 1]
    - [123, 0.02]
  - - [384, 512, 1, 1]
    - [74, 0.03]
  - - [768, 256, 1, 1]
    - [74, 0.03]
  - - [1536, 128, 1, 1]
    - [128, 0.03]
  - - [3072, 64, 1, 1]
    - [129, 0.03]
  - - [384, 256, 1, 16]
    - [123, 0.27]
  - - [768, 128, 1, 16]
    - [123, 0.26]
  - - [1536, 64, 1, 16]
    - [139, 0.26]
  - - [6144, 16, 1, 16]
    - [128, 0.21]
  - - [16, 8192, 1, 16]
    - [130, 0.3]
  - - [64, 2048, 1, 16]
    - [127, 0.33]
  - - [128, 1024, 1, 16]
    - [139, 0.33]
  - - [256, 512, 1, 16]
    - [131, 0.31]
  - - [384, 512, 1, 16]
    - [139, 0.44]
  - - [768, 256, 1, 16]
    - [132, 0.42]
  - - [1536, 128, 1, 16]
    - [132, 0.43]
  - - [3072, 64, 1, 16]
    - [132, 0.42]
  - - [384, 256, 1, 64]
    - [133, 0.81]
  - - [768, 128, 1, 64]
    - [111, 0.8]
  - - [1536, 64, 1, 64]
    - [133, 0.8]
  - - [6144, 16, 1, 64]
    - [128, 0.57]
  - - [16, 8192, 1, 64]
    - [134, 0.73]
  - - [64, 2048, 1, 64]
    - [135, 0.99]
  - - [128, 1024, 1, 64]
    - [135, 1.0]
  - - [256, 512, 1, 64]
    - [135, 0.97]
  - - [384, 512, 1, 64]
    - [132, 1.26]
  - - [768, 256, 1, 64]
    - [132, 1.22]
  - - [1536, 128, 1, 64]
    - [132, 1.22]
  - - [3072, 64, 1, 64]
    - [132, 1.24]
  - - [384, 256, 1, 128]
    - [111, 1.15]
  - - [768, 128, 1, 128]
    - [133, 1.13]
  - - [1536, 64, 1, 128]
    - [111, 1.14]
  - - [6144, 16, 1, 128]
    - [136, 0.6]
  - - [16, 8192, 1, 128]
    - [137, 0.8]
  - - [64, 2048, 1, 128]
    - [135, 1.42]
  - - [128, 1024, 1, 128]
    - [135, 1.39]
  - - [256, 512, 1, 128]
    - [135, 1.39]
  - - [384, 512, 1, 128]
    - [132, 1.7]
  - - [768, 256, 1, 128]
    - [132, 1.68]
  - - [1536, 128, 1, 128]
    - [132, 1.68]
  - - [3072, 64, 1, 128]
    - [138, 1.5]
  - - [384, 256, 1, 256]
    - [141, 1.32]
  - - [768, 128, 1, 256]
    - [112, 1.32]
  - - [1536, 64, 1, 256]
    - [146, 1.32]
  - - [6144, 16, 1, 256]
    - [142, 0.85]
  - - [16, 8192, 1, 256]
    - [140, 0.82]
  - - [64, 2048, 1, 256]
    - [143, 1.48]
  - - [128, 1024, 1, 256]
    - [141, 1.73]
  - - [256, 512, 1, 256]
    - [144, 1.71]
  - - [384, 256, 1, 512]
    - [147, 1.59]
  - - [384, 512, 1, 256]
    - [119, 2.12]
  - - [768, 128, 1, 512]
    - [147, 1.57]
  - - [768, 256, 1, 256]
    - [115, 2.11]
  - - [1536, 64, 1, 512]
    - [147, 1.56]
  - - [1536, 128, 1, 256]
    - [148, 2.1]
  - - [3072, 64, 1, 256]
    - [148, 2.08]
  - - [6144, 16, 1, 512]
    - [142, 0.98]
  - - [16, 8192, 1, 512]
    - [140, 0.93]
  - - [64, 2048, 1, 512]
    - [135, 1.42]
  - - [128, 1024, 1, 512]
    - [143, 1.75]
  - - [256, 512, 1, 512]
    - [147, 2.08]
  - - [384, 256, 1, 1024]
    - [111, 1.8]
  - - [384, 512, 1, 512]
    - [115, 2.43]
  - - [768, 128, 1, 1024]
    - [112, 1.74]
  - - [768, 256, 1, 512]
    - [115, 2.42]
  - - [1536, 64, 1, 1024]
    - [112, 1.73]
  - - [1536, 128, 1, 512]
    - [115, 2.41]
  - - [3072, 64, 1, 512]
    - [115, 2.4]
  - - [6144, 16, 1, 1024]
    - [145, 1.03]
  - - [16, 8192, 1, 1024]
    - [140, 0.97]
  - - [64, 2048, 1, 1024]
    - [118, 1.86]
  - - [128, 1024, 1, 1024]
    - [143, 2.03]
  - - [256, 512, 1, 1024]
    - [112, 2.26]
  - - [384, 512, 1, 1024]
    - [119, 2.59]
  - - [768, 256, 1, 1024]
    - [119, 2.61]
  - - [1536, 128, 1, 1024]
    - [119, 2.6]
  - - [3072, 64, 1, 1024]
    - [115, 2.53]
  - - [64, 4096, 1, 2048]
    - [162, 1.99]
  - - [128, 2048, 1, 2048]
    - [150, 2.47]
  - - [256, 1024, 1, 2048]
    - [151, 2.57]
  - - [384, 1024, 1, 2048]
    - [152, 2.93]
  - - [768, 512, 1, 2048]
    - [153, 2.94]
  - - [1536, 256, 1, 2048]
    - [152, 2.91]
  - - [3072, 128, 1, 2048]
    - [152, 2.94]
  - - [6144, 64, 1, 2048]
    - [153, 1.61]
  - - [64, 4096, 1, 4096]
    - [154, 1.16]
  - - [64, 8192, 1, 2048]
    - [155, 1.2]
  - - [128, 2048, 1, 4096]
    - [149, 2.17]
  - - [128, 4096, 1, 2048]
    - [156, 2.32]
  - - [256, 1024, 1, 4096]
    - [157, 2.71]
  - - [256, 2048, 1, 2048]
    - [103, 2.98]
  - - [384, 1024, 1, 4096]
    - [153, 3.02]
  - - [384, 2048, 1, 2048]
    - [158, 3.34]
  - - [768, 512, 1, 4096]
    - [152, 3.02]
  - - [768, 1024, 1, 2048]
    - [158, 3.29]
  - - [1536, 256, 1, 4096]
    - [152, 3.01]
  - - [1536, 512, 1, 2048]
    - [158, 3.27]
  - - [3072, 128, 1, 4096]
    - [163, 2.29]
  - - [3072, 256, 1, 2048]
    - [156, 3.33]
  - - [6144, 64, 1, 4096]
    - [160, 1.58]
  - - [6144, 128, 1, 2048]
    - [164, 2.17]
  - - [64, 4096, 1, 8192]
    - [154, 1.23]
  - - [64, 8192, 1, 4096]
    - [114, 1.37]
  - - [128, 2048, 1, 8192]
    - [150, 1.78]
  - - [128, 4096, 1, 4096]
    - [114, 1.83]
  - - [256, 1024, 1, 8192]
    - [149, 2.19]
  - - [256, 2048, 1, 4096]
    - [153, 2.48]
  - - [384, 1024, 1, 8192]
    - [161, 2.53]
  - - [384, 2048, 1, 4096]
    - [156, 2.76]
  - - [768, 512, 1, 8192]
    - [152, 2.75]
  - - [768, 1024, 1, 4096]
    - [158, 3.35]
  - - [1536, 256, 1, 8192]
    - [165, 2.34]
  - - [1536, 512, 1, 4096]
    - [156, 3.29]
  - - [3072, 128, 1, 8192]
    - [165, 1.85]
  - - [3072, 256, 1, 4096]
    - [164, 2.52]
  - - [6144, 64, 1, 8192]
    - [153, 1.51]
  - - [6144, 128, 1, 4096]
    - [164, 1.75]
  - - [64, 8192, 1, 8192]
    - [114, 1.41]
  - - [128, 4096, 1, 8192]
    - [158, 1.94]
  - - [256, 2048, 1, 8192]
    - [159, 2.15]
  - - [384, 2048, 1, 8192]
    - [166, 2.62]
  - - [768, 1024, 1, 8192]
    - [156, 2.9]
  - - [1536, 512, 1, 8192]
    - [158, 2.41]
  - - [3072, 256, 1, 8192]
    - [164, 1.93]
  - - [6144, 128, 1, 8192]
    - [164, 1.58]
  - - [64, 4096, 1, 1]
    - [127, 0.04]
  - - [128, 2048, 1, 1]
    - [167, 0.04]
  - - [256, 1024, 1, 1]
    - [127, 0.04]
  - - [384, 1024, 1, 1]
    - [74, 0.06]
  - - [768, 512, 1, 1]
    - [74, 0.05]
  - - [1536, 256, 1, 1]
    - [74, 0.05]
  - - [3072, 128, 1, 1]
    - [74, 0.06]
  - - [6144, 64, 1, 1]
    - [74, 0.06]
  - - [64, 8192, 1, 1]
    - [127, 0.06]
  - - [128, 4096, 1, 1]
    - [167, 0.06]
  - - [256, 2048, 1, 1]
    - [127, 0.05]
  - - [384, 2048, 1, 1]
    - [74, 0.07]
  - - [768, 1024, 1, 1]
    - [74, 0.07]
  - - [1536, 512, 1, 1]
    - [74, 0.06]
  - - [3072, 256, 1, 1]
    - [74, 0.06]
  - - [6144, 128, 1, 1]
    - [74, 0.06]
  - - [64, 4096, 1, 16]
    - [127, 0.53]
  - - [128, 2048, 1, 16]
    - [139, 0.51]
  - - [256, 1024, 1, 16]
    - [127, 0.48]
  - - [384, 1024, 1, 16]
    - [132, 0.66]
  - - [768, 512, 1, 16]
    - [132, 0.65]
  - - [1536, 256, 1, 16]
    - [65, 0.64]
  - - [3072, 128, 1, 16]
    - [65, 0.64]
  - - [6144, 64, 1, 16]
    - [65, 0.61]
  - - [64, 8192, 1, 16]
    - [127, 0.77]
  - - [128, 4096, 1, 16]
    - [167, 0.73]
  - - [256, 2048, 1, 16]
    - [127, 0.66]
  - - [384, 2048, 1, 16]
    - [167, 0.8]
  - - [768, 1024, 1, 16]
    - [74, 0.73]
  - - [1536, 512, 1, 16]
    - [128, 0.73]
  - - [3072, 256, 1, 16]
    - [74, 0.78]
  - - [6144, 128, 1, 16]
    - [74, 0.79]
  - - [64, 4096, 1, 64]
    - [127, 1.35]
  - - [128, 2048, 1, 64]
    - [127, 1.39]
  - - [256, 1024, 1, 64]
    - [127, 1.38]
  - - [384, 1024, 1, 64]
    - [138, 1.66]
  - - [768, 512, 1, 64]
    - [132, 1.66]
  - - [1536, 256, 1, 64]
    - [132, 1.66]
  - - [3072, 128, 1, 64]
    - [127, 1.54]
  - - [6144, 64, 1, 64]
    - [132, 1.46]
  - - [64, 4096, 1, 128]
    - [128, 1.56]
  - - [64, 8192, 1, 64]
    - [127, 1.71]
  - - [128, 2048, 1, 128]
    - [139, 1.76]
  - - [128, 4096, 1, 64]
    - [127, 1.75]
  - - [256, 1024, 1, 128]
    - [127, 1.79]
  - - [256, 2048, 1, 64]
    - [127, 1.72]
  - - [384, 1024, 1, 128]
    - [168, 2.12]
  - - [384, 2048, 1, 64]
    - [74, 2.13]
  - - [768, 512, 1, 128]
    - [132, 2.13]
  - - [768, 1024, 1, 64]
    - [74, 2.1]
  - - [1536, 256, 1, 128]
    - [132, 2.07]
  - - [1536, 512, 1, 64]
    - [74, 2.09]
  - - [3072, 128, 1, 128]
    - [132, 1.99]
  - - [3072, 256, 1, 64]
    - [74, 2.06]
  - - [6144, 64, 1, 128]
    - [168, 1.75]
  - - [6144, 128, 1, 64]
    - [74, 1.99]
  - - [64, 8192, 1, 128]
    - [127, 2.0]
  - - [128, 4096, 1, 128]
    - [127, 2.12]
  - - [256, 2048, 1, 128]
    - [127, 2.17]
  - - [384, 2048, 1, 128]
    - [74, 2.5]
  - - [768, 1024, 1, 128]
    - [74, 2.49]
  - - [1536, 512, 1, 128]
    - [74, 2.45]
  - - [3072, 256, 1, 128]
    - [74, 2.35]
  - - [6144, 128, 1, 128]
    - [74, 2.28]
  - - [64, 4096, 1, 256]
    - [169, 1.61]
  - - [128, 2048, 1, 256]
    - [170, 1.86]
  - - [256, 1024, 1, 256]
    - [174, 1.99]
  - - [384, 1024, 1, 256]
    - [145, 2.42]
  - - [768, 512, 1, 256]
    - [68, 2.41]
  - - [1536, 256, 1, 256]
    - [173, 2.39]
  - - [3072, 128, 1, 256]
    - [103, 2.36]
  - - [6144, 64, 1, 256]
    - [173, 2.31]
  - - [64, 4096, 1, 512]
    - [112, 1.66]
  - - [64, 8192, 1, 256]
    - [153, 1.96]
  - - [128, 2048, 1, 512]
    - [175, 1.94]
  - - [128, 4096, 1, 256]
    - [158, 2.18]
  - - [256, 1024, 1, 512]
    - [171, 2.13]
  - - [256, 2048, 1, 256]
    - [103, 2.45]
  - - [384, 1024, 1, 512]
    - [152, 2.6]
  - - [384, 2048, 1, 256]
    - [158, 2.82]
  - - [768, 512, 1, 512]
    - [153, 2.71]
  - - [768, 1024, 1, 256]
    - [159, 2.85]
  - - [1536, 256, 1, 512]
    - [153, 2.73]
  - - [1536, 512, 1, 256]
    - [156, 2.89]
  - - [3072, 128, 1, 512]
    - [153, 2.66]
  - - [3072, 256, 1, 256]
    - [156, 2.83]
  - - [6144, 64, 1, 512]
    - [153, 2.7]
  - - [6144, 128, 1, 256]
    - [156, 2.8]
  - - [64, 4096, 1, 1024]
    - [142, 1.9]
  - - [64, 8192, 1, 512]
    - [112, 1.91]
  - - [128, 2048, 1, 1024]
    - [153, 2.14]
  - - [128, 4096, 1, 512]
    - [156, 2.18]
  - - [256, 1024, 1, 1024]
    - [171, 2.23]
  - - [256, 2048, 1, 512]
    - [68, 2.52]
  - - [384, 1024, 1, 1024]
    - [153, 2.77]
  - - [384, 2048, 1, 512]
    - [159, 2.99]
  - - [768, 512, 1, 1024]
    - [152, 2.79]
  - - [768, 1024, 1, 512]
    - [159, 3.02]
  - - [1536, 256, 1, 1024]
    - [153, 2.74]
  - - [1536, 512, 1, 512]
    - [159, 3.04]
  - - [3072, 128, 1, 1024]
    - [152, 2.78]
  - - [3072, 256, 1, 512]
    - [156, 3.05]
  - - [6144, 64, 1, 1024]
    - [152, 2.76]
  - - [6144, 128, 1, 512]
    - [156, 3.02]
  - - [64, 8192, 1, 1024]
    - [172, 1.81]
  - - [128, 4096, 1, 1024]
    - [153, 2.6]
  - - [256, 2048, 1, 1024]
    - [103, 2.8]
  - - [384, 2048, 1, 1024]
    - [159, 3.23]
  - - [768, 1024, 1, 1024]
    - [158, 3.27]
  - - [1536, 512, 1, 1024]
    - [159, 3.27]
  - - [3072, 256, 1, 1024]
    - [156, 3.25]
  - - [6144, 128, 1, 1024]
    - [156, 3.23]
  - - [128, 8192, 1, 2048]
    - [112, 1.71]
  - - [256, 4096, 1, 2048]
    - [152, 2.69]
  - - [384, 4096, 1, 2048]
    - [68, 3.11]
  - - [768, 2048, 1, 2048]
    - [176, 3.36]
  - - [1536, 1024, 1, 2048]
    - [177, 3.34]
  - - [3072, 512, 1, 2048]
    - [176, 3.37]
  - - [6144, 256, 1, 2048]
    - [176, 2.94]
  - - [128, 8192, 1, 4096]
    - [112, 1.83]
  - - [256, 4096, 1, 4096]
    - [115, 2.4]
  - - [256, 8192, 1, 2048]
    - [152, 2.64]
  - - [384, 4096, 1, 4096]
    - [157, 2.91]
  - - [384, 8192, 1, 2048]
    - [68, 3.2]
  - - [768, 2048, 1, 4096]
    - [68, 3.15]
  - - [768, 4096, 1, 2048]
    - [68, 3.39]
  - - [1536, 1024, 1, 4096]
    - [156, 3.23]
  - - [1536, 2048, 1, 2048]
    - [68, 3.47]
  - - [3072, 512, 1, 4096]
    - [69, 3.03]
  - - [3072, 1024, 1, 2048]
    - [68, 3.45]
  - - [6144, 256, 1, 4096]
    - [178, 2.76]
  - - [6144, 512, 1, 2048]
    - [69, 3.21]
  - - [128, 8192, 1, 8192]
    - [156, 1.82]
  - - [256, 4096, 1, 8192]
    - [115, 2.37]
  - - [256, 8192, 1, 4096]
    - [157, 2.57]
  - - [384, 4096, 1, 8192]
    - [180, 2.76]
  - - [384, 8192, 1, 4096]
    - [68, 3.17]
  - - [768, 2048, 1, 8192]
    - [156, 2.9]
  - - [768, 4096, 1, 4096]
    - [68, 3.37]
  - - [1536, 1024, 1, 8192]
    - [177, 2.75]
  - - [1536, 2048, 1, 4096]
    - [68, 3.39]
  - - [3072, 512, 1, 8192]
    - [69, 2.73]
  - - [3072, 1024, 1, 4096]
    - [69, 3.02]
  - - [6144, 256, 1, 8192]
    - [181, 2.54]
  - - [6144, 512, 1, 4096]
    - [69, 3.19]
  - - [256, 8192, 1, 8192]
    - [179, 2.5]
  - - [384, 8192, 1, 8192]
    - [68, 2.94]
  - - [768, 4096, 1, 8192]
    - [68, 3.11]
  - - [1536, 2048, 1, 8192]
    - [69, 2.96]
  - - [3072, 1024, 1, 8192]
    - [69, 2.94]
  - - [6144, 512, 1, 8192]
    - [69, 3.01]
  - - [128, 8192, 1, 1]
    - [167, 0.08]
  - - [256, 4096, 1, 1]
    - [127, 0.07]
  - - [384, 4096, 1, 1]
    - [167, 0.09]
  - - [768, 2048, 1, 1]
    - [182, 0.09]
  - - [1536, 1024, 1, 1]
    - [183, 0.09]
  - - [3072, 512, 1, 1]
    - [75, 0.09]
  - - [6144, 256, 1, 1]
    - [183, 0.09]
  - - [256, 8192, 1, 1]
    - [127, 0.09]
  - - [384, 8192, 1, 1]
    - [183, 0.12]
  - - [768, 4096, 1, 1]
    - [74, 0.11]
  - - [1536, 2048, 1, 1]
    - [183, 0.12]
  - - [3072, 1024, 1, 1]
    - [183, 0.12]
  - - [6144, 512, 1, 1]
    - [74, 0.12]
  - - [128, 8192, 1, 16]
    - [184, 0.94]
  - - [256, 4096, 1, 16]
    - [184, 0.88]
  - - [384, 4096, 1, 16]
    - [183, 1.1]
  - - [768, 2048, 1, 16]
    - [183, 1.01]
  - - [1536, 1024, 1, 16]
    - [183, 1.09]
  - - [3072, 512, 1, 16]
    - [183, 1.03]
  - - [6144, 256, 1, 16]
    - [127, 1.02]
  - - [256, 8192, 1, 16]
    - [185, 1.14]
  - - [384, 8192, 1, 16]
    - [75, 1.32]
  - - [768, 4096, 1, 16]
    - [183, 1.28]
  - - [1536, 2048, 1, 16]
    - [183, 1.3]
  - - [3072, 1024, 1, 16]
    - [75, 1.28]
  - - [6144, 512, 1, 16]
    - [183, 1.26]
  - - [128, 8192, 1, 64]
    - [127, 1.98]
  - - [256, 4096, 1, 64]
    - [74, 1.97]
  - - [384, 4096, 1, 64]
    - [75, 2.31]
  - - [768, 2048, 1, 64]
    - [182, 2.31]
  - - [1536, 1024, 1, 64]
    - [74, 2.26]
  - - [3072, 512, 1, 64]
    - [74, 2.23]
  - - [6144, 256, 1, 64]
    - [74, 2.2]
  - - [128, 8192, 1, 128]
    - [127, 2.32]
  - - [256, 4096, 1, 128]
    - [127, 2.39]
  - - [256, 8192, 1, 64]
    - [75, 2.14]
  - - [384, 4096, 1, 128]
    - [75, 2.67]
  - - [384, 8192, 1, 64]
    - [74, 2.4]
  - - [768, 2048, 1, 128]
    - [74, 2.71]
  - - [768, 4096, 1, 64]
    - [74, 2.42]
  - - [1536, 1024, 1, 128]
    - [75, 2.63]
  - - [1536, 2048, 1, 64]
    - [74, 2.41]
  - - [3072, 512, 1, 128]
    - [75, 2.59]
  - - [3072, 1024, 1, 64]
    - [75, 2.38]
  - - [6144, 256, 1, 128]
    - [183, 2.57]
  - - [6144, 512, 1, 64]
    - [74, 2.34]
  - - [256, 8192, 1, 128]
    - [127, 2.42]
  - - [384, 8192, 1, 128]
    - [75, 2.84]
  - - [768, 4096, 1, 128]
    - [74, 2.77]
  - - [1536, 2048, 1, 128]
    - [102, 2.7]
  - - [3072, 1024, 1, 128]
    - [74, 2.74]
  - - [6144, 512, 1, 128]
    - [182, 2.66]
  - - [128, 8192, 1, 256]
    - [152, 2.46]
  - - [256, 4096, 1, 256]
    - [153, 2.48]
  - - [384, 4096, 1, 256]
    - [159, 2.88]
  - - [768, 2048, 1, 256]
    - [159, 2.92]
  - - [1536, 1024, 1, 256]
    - [166, 2.89]
  - - [3072, 512, 1, 256]
    - [159, 2.87]
  - - [6144, 256, 1, 256]
    - [103, 2.88]
  - - [128, 8192, 1, 512]
    - [152, 2.55]
  - - [256, 4096, 1, 512]
    - [153, 2.75]
  - - [256, 8192, 1, 256]
    - [152, 2.76]
  - - [384, 4096, 1, 512]
    - [158, 3.12]
  - - [384, 8192, 1, 256]
    - [68, 3.18]
  - - [768, 2048, 1, 512]
    - [159, 3.14]
  - - [768, 4096, 1, 256]
    - [103, 3.26]
  - - [1536, 1024, 1, 512]
    - [156, 3.17]
  - - [1536, 2048, 1, 256]
    - [103, 3.21]
  - - [3072, 512, 1, 512]
    - [103, 3.08]
  - - [3072, 1024, 1, 256]
    - [103, 3.13]
  - - [6144, 256, 1, 512]
    - [158, 3.14]
  - - [6144, 512, 1, 256]
    - [103, 3.07]
  - - [128, 8192, 1, 1024]
    - [162, 2.33]
  - - [256, 4096, 1, 1024]
    - [152, 2.89]
  - - [256, 8192, 1, 512]
    - [156, 2.91]
  - - [384, 4096, 1, 1024]
    - [156, 3.3]
  - - [384, 8192, 1, 512]
    - [102, 3.33]
  - - [768, 2048, 1, 1024]
    - [158, 3.32]
  - - [768, 4096, 1, 512]
    - [103, 3.4]
  - - [1536, 1024, 1, 1024]
    - [159, 3.31]
  - - [1536, 2048, 1, 512]
    - [102, 3.38]
  - - [3072, 512, 1, 1024]
    - [159, 3.29]
  - - [3072, 1024, 1, 512]
    - [102, 3.38]
  - - [6144, 256, 1, 1024]
    - [156, 3.29]
  - - [6144, 512, 1, 512]
    - [102, 3.3]
  - - [256, 8192, 1, 1024]
    - [173, 2.81]
  - - [384, 8192, 1, 1024]
    - [103, 3.09]
  - - [768, 4096, 1, 1024]
    - [102, 3.45]
  - - [1536, 2048, 1, 1024]
    - [103, 3.45]
  - - [3072, 1024, 1, 1024]
    - [103, 3.44]
  - - [6144, 512, 1, 1024]
    - [68, 3.39]
  - - [384, 16, 1, 512]
    - [188, 0.26]
  - - [16, 512, 1, 512]
    - [189, 0.33]
  - - [64, 128, 1, 512]
    - [190, 0.33]
  - - [128, 64, 1, 512]
    - [191, 0.33]
  - - [384, 16, 1, 1024]
    - [188, 0.31]
  - - [768, 16, 1, 512]
    - [189, 0.46]
  - - [16, 512, 1, 1024]
    - [190, 0.39]
  - - [16, 1024, 1, 512]
    - [192, 0.52]
  - - [64, 128, 1, 1024]
    - [190, 0.4]
  - - [64, 256, 1, 512]
    - [186, 0.56]
  - - [128, 64, 1, 1024]
    - [191, 0.4]
  - - [128, 128, 1, 512]
    - [186, 0.56]
  - - [256, 64, 1, 512]
    - [193, 0.56]
  - - [384, 16, 1, 2048]
    - [188, 0.35]
  - - [768, 16, 1, 1024]
    - [189, 0.53]
  - - [16, 512, 1, 2048]
    - [191, 0.42]
  - - [16, 1024, 1, 1024]
    - [194, 0.56]
  - - [64, 128, 1, 2048]
    - [191, 0.44]
  - - [64, 256, 1, 1024]
    - [186, 0.65]
  - - [128, 64, 1, 2048]
    - [191, 0.44]
  - - [128, 128, 1, 1024]
    - [186, 0.65]
  - - [256, 64, 1, 1024]
    - [186, 0.65]
  - - [384, 16, 1, 4096]
    - [188, 0.37]
  - - [768, 16, 1, 2048]
    - [189, 0.59]
  - - [16, 512, 1, 4096]
    - [191, 0.45]
  - - [16, 1024, 1, 2048]
    - [194, 0.66]
  - - [64, 128, 1, 4096]
    - [191, 0.47]
  - - [64, 256, 1, 2048]
    - [187, 0.71]
  - - [128, 64, 1, 4096]
    - [191, 0.47]
  - - [128, 128, 1, 2048]
    - [187, 0.72]
  - - [256, 64, 1, 2048]
    - [187, 0.71]
  - - [384, 16, 1, 8192]
    - [188, 0.36]
  - - [768, 16, 1, 4096]
    - [189, 0.62]
  - - [16, 512, 1, 8192]
    - [190, 0.45]
  - - [16, 1024, 1, 4096]
    - [194, 0.72]
  - - [64, 128, 1, 8192]
    - [191, 0.46]
  - - [64, 256, 1, 4096]
    - [187, 0.75]
  - - [128, 64, 1, 8192]
    - [191, 0.46]
  - - [128, 128, 1, 4096]
    - [187, 0.76]
  - - [256, 64, 1, 4096]
    - [195, 0.76]
  - - [768, 16, 1, 8192]
    - [189, 0.62]
  - - [16, 1024, 1, 8192]
    - [196, 0.72]
  - - [64, 256, 1, 8192]
    - [187, 0.74]
  - - [128, 128, 1, 8192]
    - [187, 0.75]
  - - [256, 64, 1, 8192]
    - [187, 0.75]
  - - [384, 16, 1, 1]
    - [197, 0.0]
  - - [16, 512, 1, 1]
    - [126, 0.0]
  - - [64, 128, 1, 1]
    - [198, 0.0]
  - - [128, 64, 1, 1]
    - [123, 0.0]
  - - [768, 16, 1, 1]
    - [199, 0.0]
  - - [16, 1024, 1, 1]
    - [126, 0.0]
  - - [64, 256, 1, 1]
    - [126, 0.0]
  - - [128, 128, 1, 1]
    - [198, 0.0]
  - - [256, 64, 1, 1]
    - [198, 0.0]
  - - [384, 16, 1, 16]
    - [198, 0.02]
  - - [16, 512, 1, 16]
    - [126, 0.03]
  - - [64, 128, 1, 16]
    - [126, 0.03]
  - - [128, 64, 1, 16]
    - [126, 0.03]
  - - [768, 16, 1, 16]
    - [126, 0.04]
  - - [16, 1024, 1, 16]
    - [126, 0.06]
  - - [64, 256, 1, 16]
    - [198, 0.06]
  - - [128, 128, 1, 16]
    - [126, 0.06]
  - - [256, 64, 1, 16]
    - [198, 0.06]
  - - [384, 16, 1, 64]
    - [200, 0.07]
  - - [16, 512, 1, 64]
    - [200, 0.09]
  - - [64, 128, 1, 64]
    - [201, 0.09]
  - - [128, 64, 1, 64]
    - [201, 0.09]
  - - [384, 16, 1, 128]
    - [201, 0.1]
  - - [768, 16, 1, 64]
    - [197, 0.13]
  - - [16, 512, 1, 128]
    - [124, 0.14]
  - - [16, 1024, 1, 64]
    - [134, 0.17]
  - - [64, 128, 1, 128]
    - [201, 0.14]
  - - [64, 256, 1, 64]
    - [201, 0.18]
  - - [128, 64, 1, 128]
    - [201, 0.14]
  - - [128, 128, 1, 64]
    - [201, 0.18]
  - - [256, 64, 1, 64]
    - [200, 0.18]
  - - [384, 16, 1, 256]
    - [200, 0.14]
  - - [768, 16, 1, 128]
    - [202, 0.2]
  - - [16, 512, 1, 256]
    - [203, 0.19]
  - - [16, 1024, 1, 128]
    - [137, 0.27]
  - - [64, 128, 1, 256]
    - [124, 0.19]
  - - [64, 256, 1, 128]
    - [201, 0.28]
  - - [128, 64, 1, 256]
    - [117, 0.2]
  - - [128, 128, 1, 128]
    - [204, 0.28]
  - - [256, 64, 1, 128]
    - [203, 0.28]
  - - [768, 16, 1, 256]
    - [204, 0.28]
  - - [16, 1024, 1, 256]
    - [137, 0.36]
  - - [64, 256, 1, 256]
    - [204, 0.39]
  - - [128, 128, 1, 256]
    - [203, 0.39]
  - - [256, 64, 1, 256]
    - [203, 0.39]
  - - [384, 64, 1, 512]
    - [214, 0.75]
  - - [1536, 16, 1, 512]
    - [193, 0.73]
  - - [16, 2048, 1, 512]
    - [207, 0.54]
  - - [64, 512, 1, 512]
    - [220, 0.92]
  - - [128, 256, 1, 512]
    - [205, 0.93]
  - - [256, 128, 1, 512]
    - [205, 0.92]
  - - [384, 64, 1, 1024]
    - [214, 0.86]
  - - [384, 128, 1, 512]
    - [209, 1.12]
  - - [768, 64, 1, 512]
    - [117, 1.12]
  - - [1536, 16, 1, 1024]
    - [193, 0.84]
  - - [3072, 16, 1, 512]
    - [214, 1.02]
  - - [16, 2048, 1, 1024]
    - [207, 0.75]
  - - [16, 4096, 1, 512]
    - [215, 0.69]
  - - [64, 512, 1, 1024]
    - [205, 1.01]
  - - [64, 1024, 1, 512]
    - [208, 1.22]
  - - [128, 256, 1, 1024]
    - [204, 1.06]
  - - [128, 512, 1, 512]
    - [109, 1.43]
  - - [256, 128, 1, 1024]
    - [205, 1.05]
  - - [256, 256, 1, 512]
    - [221, 1.44]
  - - [384, 64, 1, 2048]
    - [216, 0.91]
  - - [384, 128, 1, 1024]
    - [220, 1.24]
  - - [768, 64, 1, 1024]
    - [117, 1.24]
  - - [1536, 16, 1, 2048]
    - [214, 0.92]
  - - [3072, 16, 1, 1024]
    - [193, 1.13]
  - - [16, 2048, 1, 2048]
    - [222, 0.91]
  - - [16, 4096, 1, 1024]
    - [210, 0.93]
  - - [64, 512, 1, 2048]
    - [205, 1.1]
  - - [64, 1024, 1, 1024]
    - [208, 1.37]
  - - [128, 256, 1, 2048]
    - [209, 1.12]
  - - [128, 512, 1, 1024]
    - [211, 1.51]
  - - [256, 128, 1, 2048]
    - [205, 1.13]
  - - [256, 256, 1, 1024]
    - [217, 1.57]
  - - [384, 64, 1, 4096]
    - [214, 0.91]
  - - [384, 128, 1, 2048]
    - [209, 1.32]
  - - [768, 64, 1, 2048]
    - [209, 1.32]
  - - [1536, 16, 1, 4096]
    - [214, 0.91]
  - - [3072, 16, 1, 2048]
    - [223, 1.2]
  - - [16, 2048, 1, 4096]
    - [207, 0.9]
  - - [16, 4096, 1, 2048]
    - [206, 0.99]
  - - [64, 512, 1, 4096]
    - [205, 1.1]
  - - [64, 1024, 1, 2048]
    - [208, 1.55]
  - - [128, 256, 1, 4096]
    - [205, 1.12]
  - - [128, 512, 1, 2048]
    - [217, 1.64]
  - - [256, 128, 1, 4096]
    - [205, 1.12]
  - - [256, 256, 1, 2048]
    - [211, 1.67]
  - - [384, 64, 1, 8192]
    - [214, 0.95]
  - - [384, 128, 1, 4096]
    - [209, 1.31]
  - - [768, 64, 1, 4096]
    - [209, 1.31]
  - - [1536, 16, 1, 8192]
    - [224, 0.56]
  - - [3072, 16, 1, 4096]
    - [117, 0.55]
  - - [16, 2048, 1, 8192]
    - [219, 0.4]
  - - [16, 4096, 1, 4096]
    - [218, 0.41]
  - - [64, 512, 1, 8192]
    - [205, 1.15]
  - - [64, 1024, 1, 4096]
    - [212, 1.63]
  - - [128, 256, 1, 8192]
    - [205, 1.16]
  - - [128, 512, 1, 4096]
    - [213, 1.67]
  - - [256, 128, 1, 8192]
    - [205, 1.17]
  - - [256, 256, 1, 4096]
    - [213, 1.67]
  - - [384, 128, 1, 8192]
    - [209, 1.36]
  - - [768, 64, 1, 8192]
    - [209, 1.36]
  - - [3072, 16, 1, 8192]
    - [117, 0.57]
  - - [16, 4096, 1, 8192]
    - [218, 0.44]
  - - [64, 1024, 1, 8192]
    - [213, 1.46]
  - - [128, 512, 1, 8192]
    - [213, 1.74]
  - - [256, 256, 1, 8192]
    - [213, 1.75]
  - - [384, 64, 1, 1]
    - [225, 0.01]
  - - [1536, 16, 1, 1]
    - [226, 0.01]
  - - [16, 2048, 1, 1]
    - [126, 0.01]
  - - [64, 512, 1, 1]
    - [226, 0.01]
  - - [128, 256, 1, 1]
    - [198, 0.01]
  - - [256, 128, 1, 1]
    - [198, 0.01]
  - - [384, 128, 1, 1]
    - [198, 0.01]
  - - [768, 64, 1, 1]
    - [123, 0.01]
  - - [3072, 16, 1, 1]
    - [227, 0.01]
  - - [16, 4096, 1, 1]
    - [228, 0.01]
  - - [64, 1024, 1, 1]
    - [128, 0.01]
  - - [128, 512, 1, 1]
    - [128, 0.01]
  - - [256, 256, 1, 1]
    - [123, 0.01]
  - - [384, 64, 1, 16]
    - [229, 0.08]
  - - [1536, 16, 1, 16]
    - [230, 0.08]
  - - [16, 2048, 1, 16]
    - [231, 0.1]
  - - [64, 512, 1, 16]
    - [232, 0.11]
  - - [128, 256, 1, 16]
    - [232, 0.11]
  - - [256, 128, 1, 16]
    - [227, 0.11]
  - - [384, 128, 1, 16]
    - [232, 0.16]
  - - [768, 64, 1, 16]
    - [232, 0.15]
  - - [3072, 16, 1, 16]
    - [233, 0.15]
  - - [16, 4096, 1, 16]
    - [234, 0.18]
  - - [64, 1024, 1, 16]
    - [232, 0.2]
  - - [128, 512, 1, 16]
    - [232, 0.2]
  - - [256, 256, 1, 16]
    - [232, 0.18]
  - - [384, 64, 1, 64]
    - [235, 0.27]
  - - [1536, 16, 1, 64]
    - [186, 0.27]
  - - [16, 2048, 1, 64]
    - [134, 0.34]
  - - [64, 512, 1, 64]
    - [236, 0.35]
  - - [128, 256, 1, 64]
    - [204, 0.36]
  - - [256, 128, 1, 64]
    - [203, 0.36]
  - - [384, 64, 1, 128]
    - [214, 0.42]
  - - [384, 128, 1, 64]
    - [117, 0.48]
  - - [768, 64, 1, 64]
    - [124, 0.47]
  - - [1536, 16, 1, 128]
    - [186, 0.43]
  - - [3072, 16, 1, 64]
    - [237, 0.48]
  - - [16, 2048, 1, 128]
    - [137, 0.52]
  - - [16, 4096, 1, 64]
    - [137, 0.55]
  - - [64, 512, 1, 128]
    - [117, 0.54]
  - - [64, 1024, 1, 64]
    - [121, 0.62]
  - - [128, 256, 1, 128]
    - [203, 0.55]
  - - [128, 512, 1, 64]
    - [133, 0.62]
  - - [256, 128, 1, 128]
    - [117, 0.55]
  - - [256, 256, 1, 64]
    - [133, 0.61]
  - - [384, 64, 1, 256]
    - [214, 0.59]
  - - [384, 128, 1, 128]
    - [137, 0.71]
  - - [768, 64, 1, 128]
    - [124, 0.72]
  - - [1536, 16, 1, 256]
    - [216, 0.59]
  - - [3072, 16, 1, 128]
    - [237, 0.69]
  - - [16, 2048, 1, 256]
    - [239, 0.63]
  - - [16, 4096, 1, 128]
    - [137, 0.69]
  - - [64, 512, 1, 256]
    - [124, 0.75]
  - - [64, 1024, 1, 128]
    - [133, 0.93]
  - - [128, 256, 1, 256]
    - [124, 0.75]
  - - [128, 512, 1, 128]
    - [133, 0.9]
  - - [256, 128, 1, 256]
    - [124, 0.74]
  - - [256, 256, 1, 128]
    - [121, 0.91]
  - - [384, 128, 1, 256]
    - [117, 0.93]
  - - [768, 64, 1, 256]
    - [124, 0.94]
  - - [3072, 16, 1, 256]
    - [238, 0.88]
  - - [16, 4096, 1, 256]
    - [240, 0.65]
  - - [64, 1024, 1, 256]
    - [133, 1.18]
  - - [128, 512, 1, 256]
    - [133, 1.18]
  - - [256, 256, 1, 256]
    - [121, 1.18]
  - - [16, 64, 1, 512]
    - [241, 0.04]
  - - [64, 16, 1, 512]
    - [45, 0.05]
  - - [16, 64, 1, 1024]
    - [242, 0.06]
  - - [16, 128, 1, 512]
    - [54, 0.09]
  - - [64, 16, 1, 1024]
    - [54, 0.06]
  - - [128, 16, 1, 512]
    - [241, 0.09]
  - - [16, 64, 1, 2048]
    - [242, 0.06]
  - - [16, 128, 1, 1024]
    - [242, 0.11]
  - - [16, 256, 1, 512]
    - [38, 0.18]
  - - [64, 16, 1, 2048]
    - [54, 0.06]
  - - [64, 64, 1, 512]
    - [38, 0.18]
  - - [128, 16, 1, 1024]
    - [54, 0.11]
  - - [256, 16, 1, 512]
    - [38, 0.18]
  - - [16, 64, 1, 4096]
    - [242, 0.07]
  - - [16, 128, 1, 2048]
    - [54, 0.13]
  - - [16, 256, 1, 1024]
    - [38, 0.22]
  - - [64, 16, 1, 4096]
    - [242, 0.07]
  - - [64, 64, 1, 1024]
    - [38, 0.22]
  - - [128, 16, 1, 2048]
    - [54, 0.13]
  - - [256, 16, 1, 1024]
    - [241, 0.22]
  - - [16, 64, 1, 8192]
    - [54, 0.07]
  - - [16, 128, 1, 4096]
    - [242, 0.13]
  - - [16, 256, 1, 2048]
    - [38, 0.24]
  - - [64, 16, 1, 8192]
    - [54, 0.07]
  - - [64, 64, 1, 2048]
    - [38, 0.25]
  - - [128, 16, 1, 4096]
    - [54, 0.13]
  - - [256, 16, 1, 2048]
    - [38, 0.24]
  - - [16, 128, 1, 8192]
    - [242, 0.13]
  - - [16, 256, 1, 4096]
    - [243, 0.26]
  - - [64, 64, 1, 4096]
    - [38, 0.26]
  - - [128, 16, 1, 8192]
    - [54, 0.13]
  - - [256, 16, 1, 4096]
    - [38, 0.26]
  - - [16, 256, 1, 8192]
    - [243, 0.25]
  - - [64, 64, 1, 8192]
    - [244, 0.26]
  - - [256, 16, 1, 8192]
    - [244, 0.26]
  - - [16, 16, 1, 1]
    - [245, 0.0]
  - - [16, 16, 1, 16]
    - [246, 0.0]
  - - [16, 16, 1, 64]
    - [247, 0.0]
  - - [16, 16, 1, 128]
    - [248, 0.01]
  - - [16, 16, 1, 256]
    - [249, 0.01]
  - - [16, 16, 1, 512]
    - [248, 0.01]
  - - [16, 16, 1, 1024]
    - [52, 0.01]
  - - [16, 16, 1, 2048]
    - [242, 0.02]
  - - [16, 16, 1, 4096]
    - [242, 0.02]
  - - [16, 16, 1, 8192]
    - [52, 0.02]
  - - [16, 64, 1, 1]
    - [250, 0.0]
  - - [64, 16, 1, 1]
    - [251, 0.0]
  - - [16, 128, 1, 1]
    - [252, 0.0]
  - - [128, 16, 1, 1]
    - [250, 0.0]
  - - [16, 256, 1, 1]
    - [253, 0.0]
  - - [64, 64, 1, 1]
    - [254, 0.0]
  - - [256, 16, 1, 1]
    - [255, 0.0]
  - - [16, 64, 1, 16]
    - [256, 0.0]
  - - [64, 16, 1, 16]
    - [257, 0.0]
  - - [16, 128, 1, 16]
    - [254, 0.01]
  - - [128, 16, 1, 16]
    - [256, 0.01]
  - - [16, 64, 1, 64]
    - [258, 0.01]
  - - [16, 256, 1, 16]
    - [259, 0.01]
  - - [64, 16, 1, 64]
    - [260, 0.01]
  - - [64, 64, 1, 16]
    - [253, 0.02]
  - - [256, 16, 1, 16]
    - [261, 0.02]
  - - [16, 64, 1, 128]
    - [262, 0.02]
  - - [16, 128, 1, 64]
    - [263, 0.03]
  - - [64, 16, 1, 128]
    - [264, 0.02]
  - - [128, 16, 1, 64]
    - [265, 0.03]
  - - [16, 64, 1, 256]
    - [266, 0.03]
  - - [16, 128, 1, 128]
    - [267, 0.04]
  - - [16, 256, 1, 64]
    - [268, 0.05]
  - - [64, 16, 1, 256]
    - [269, 0.03]
  - - [64, 64, 1, 64]
    - [270, 0.05]
  - - [128, 16, 1, 128]
    - [271, 0.04]
  - - [256, 16, 1, 64]
    - [272, 0.05]
  - - [16, 128, 1, 256]
    - [273, 0.07]
  - - [16, 256, 1, 128]
    - [274, 0.09]
  - - [64, 64, 1, 128]
    - [275, 0.09]
  - - [128, 16, 1, 256]
    - [267, 0.07]
  - - [256, 16, 1, 128]
    - [275, 0.09]
  - - [16, 256, 1, 256]
    - [276, 0.13]
  - - [64, 64, 1, 256]
    - [275, 0.13]
  - - [256, 16, 1, 256]
    - [266, 0.13]
- null
- null
- DeviceEfficiency
- GridBased
