projects/hipblaslt/library/src/amd_detail/rocblaslt/src/Tensile/Logic/asm_full/gfx1151/GridBased/gfx1151_Cijk_Alik_Bljk_BBS_BH_Bias_AuxB_HAS_SAV_UserArgs.yaml
- {MinimumRequiredVersion: 5.0.0}
- gfx1151
- gfx1151
- [Device 1536]
    SolutionIndex: 0
    SolutionNameMin: Cijk_Alik_Bljk_BBS_BH_Bias_HA_S_SAV_UserArgs_MT128x96x64_MI16x16x1_SN_LDSB0_AFC1_AG0_AFEM1_AFEM1_ASEM1_CLR0_CADS0_DTLA0_DTLB0_DTVA0_DTVB0_DTVMXSA0_DTVMXSB0_DTVSM0_DPLBn1_EPS0_ELFLR0_EMLLn1_FDSI0_GRPM1_GRVWA8_GRVWB8_GSU1_GSUAMB_GSUC0_GSUWGMRR0_GLS0_ISA1151_IU1_K1_LDSTI0_LBSPPA128_LBSPPB128_LBSPPM0_LPA8_LPB8_LPM0_LRVW16_LWPMn1_MIAV1_MIWT2_6_MO40_MGRIPMn1_NTn1_NTA0_NTB0_NTC0_NTD0_NTM0_NEPBS0_NLCA1_NLCB1_ONLL1_PGR2_PLR0_PKA0_SGROBn1_SIA1_SS1_SU32_SUM1_SUS256_SPO0_SRVW0_SSO0_SVW1_SK0_SKFTR0_SKXCCM0_SGRO0_TDMI0_TIN0_TLDS1_TLDSM1_ULSGRO0_USL1_UIOFGRO0_UPLRP0_USFGROn1_VSn1_VWA1_VWB1_WSGRA0_WSGRB0_WS32_WG64_2_1_WGM8_WGMXCC1_WGMXCCGn1
    SolutionIndex: 1
    SolutionNameMin: Cijk_Alik_Bljk_BBS_BH_Bias_HA_S_SAV_UserArgs_MT96x128x64_MI16x16x1_SN_LDSB0_AFC1_AG0_AFEM1_AFEM1_ASEM1_CLR0_CADS0_DTLA0_DTLB0_DTVA0_DTVB0_DTVMXSA0_DTVMXSB0_DTVSM0_DPLBn1_EPS0_ELFLR0_EMLLn1_FDSI0_GRPM1_GRVWA8_GRVWB8_GSU1_GSUAMB_GSUC0_GSUWGMRR0_GLS0_ISA1151_IU1_K1_LDSTI0_LBSPPA128_LBSPPB128_LBSPPM0_LPA8_LPB8_LPM0_LRVW16_LWPMn1_MIAV1_MIWT6_2_MO40_MGRIPMn1_NTn1_NTA0_NTB0_NTC0_NTD0_NTM0_NEPBS0_NLCA1_NLCB1_ONLL1_PGR2_PLR0_PKA0_SGROBn1_SIA1_SS1_SU32_SUM1_SUS256_SPO0_SRVW0_SSO0_SVW1_SK0_SKFTR0_SKXCCM0_SGRO0_TDMI0_TIN0_TLDS1_TLDSM1_ULSGRO0_USL1_UIOFGRO0_UPLRP0_USFGROn1_VSn1_VWA1_VWB1_WSGRA0_WSGRB0_WS32_WG16_8_1_WGM8_WGMXCC1_WGMXCCGn1
    SolutionIndex: 2
    SolutionNameMin: Cijk_Alik_Bljk_BBS_BH_Bias_HA_S_SAV_UserArgs_MT96x128x64_MI16x16x1_SN_LDSB0_AFC1_AG0_AFEM1_AFEM1_ASEM1_CLR0_CADS0_DTLA0_DTLB0_DTVA0_DTVB0_DTVMXSA0_DTVMXSB0_DTVSM0_DPLBn1_EPS0_ELFLR0_EMLLn1_FDSI0_GRPM1_GRVWA8_GRVWB8_GSU1_GSUAMB_GSUC0_GSUWGMRR0_GLS0_ISA1151_IU1_K1_LDSTI0_LBSPPA128_LBSPPB128_LBSPPM0_LPA8_LPB8_LPM0_LRVW16_LWPMn1_MIAV1_MIWT3_4_MO40_MGRIPMn1_NTn1_NTA0_NTB0_NTC0_NTD0_NTM0_NEPBS0_NLCA1_NLCB1_ONLL1_PGR0_PLR0_PKA0_SGROBn1_SIA1_SS1_SU32_SUM1_SUS256_SPO0_SRVW0_SSO0_SVW1_SK0_SKFTR0_SKXCCM0_SGRO0_TDMI0_TIN0_TLDS1_TLDSM1_ULSGRO0_USL1_UIOFGRO0_UPLRP0_USFGROn1_VSn1_VWA1_VWB1_WSGRA0_WSGRB0_WS32_WG32_4_1_WGM8_WGMXCC1_WGMXCCGn1
    SolutionIndex: 3
    SolutionNameMin: Cijk_Alik_Bljk_BBS_BH_Bias_HA_S_SAV_UserArgs_MT96x128x64_MI16x16x1_SN_LDSB0_AFC1_AG0_AFEM1_AFEM1_ASEM1_CLR0_CADS0_DTLA0_DTLB0_DTVA0_DTVB0_DTVMXSA0_DTVMXSB0_DTVSM0_DPLBn1_EPS0_ELFLR0_EMLLn1_FDSI0_GRPM1_GRVWA8_GRVWB8_GSU1_GSUAMB_GSUC0_GSUWGMRR0_GLS0_ISA1151_IU1_K1_LDSTI0_LBSPPA128_LBSPPB128_LBSPPM0_LPA8_LPB8_LPM0_LRVW16_LWPMn1_MIAV1_MIWT3_4_MO40_MGRIPMn1_NTn1_NTA0_NTB0_NTC0_NTD0_NTM0_NEPBS0_NLCA1_NLCB1_ONLL1_PGR2_PLR0_PKA0_SGROBn1_SIA1_SS1_SU32_SUM1_SUS256_SPO0_SRVW0_SSO0_SVW1_SK0_SKFTR0_SKXCCM0_SGRO0_TDMI0_TIN0_TLDS1_TLDSM1_ULSGRO0_USL1_UIOFGRO0_UPLRP0_USFGROn1_VSn1_VWA1_VWB1_WSGRA0_WSGRB0_WS32_WG32_4_1_WGM8_WGMXCC1_WGMXCCGn1
    SolutionIndex: 4
    SolutionNameMin: Cijk_Alik_Bljk_BBS_BH_Bias_HA_S_SAV_UserArgs_MT96x96x64_MI16x16x1_SN_LDSB0_AFC1_AG0_AFEM1_AFEM1_ASEM1_CLR0_CADS0_DTLA0_DTLB0_DTVA0_DTVB0_DTVMXSA0_DTVMXSB0_DTVSM0_DPLBn1_EPS0_ELFLR0_EMLLn1_FDSI0_GRPM1_GRVWA8_GRVWB8_GSU1_GSUAMB_GSUC0_GSUWGMRR0_GLS0_ISA1151_IU1_K1_LDSTI0_LBSPPA128_LBSPPB128_LBSPPM0_LPA8_LPB8_LPM0_LRVW16_LWPMn1_MIAV1_MIWT3_3_MO40_MGRIPMn1_NTn1_NTA0_NTB0_NTC0_NTD0_NTM0_NEPBS0_NLCA1_NLCB1_ONLL1_PGR2_PLR0_PKA0_SGROBn1_SIA1_SS1_SU32_SUM1_SUS256_SPO0_SRVW0_SSO0_SVW1_SK0_SKFTR0_SKXCCM0_SGRO0_TDMI0_TIN0_TLDS1_TLDSM1_ULSGRO0_USL1_UIOFGRO0_UPLRP0_USFGROn1_VSn1_VWA1_VWB1_WSGRA0_WSGRB0_WS32_WG32_4_1_WGM8_WGMXCC1_WGMXCCGn1
    SolutionIndex: 5
    SolutionNameMin: Cijk_Alik_Bljk_BBS_BH_Bias_HA_S_SAV_UserArgs_MT128x96x64_MI16x16x1_SN_LDSB0_AFC1_AG0_AFEM1_AFEM1_ASEM1_CLR0_CADS0_DTLA0_DTLB0_DTVA0_DTVB0_DTVMXSA0_DTVMXSB0_DTVSM0_DPLBn1_EPS0_ELFLR0_EMLLn1_FDSI0_GRPM1_GRVWA8_GRVWB8_GSU1_GSUAMB_GSUC0_GSUWGMRR0_GLS0_ISA1151_IU1_K1_LDSTI0_LBSPPA128_LBSPPB128_LBSPPM0_LPA8_LPB8_LPM0_LRVW16_LWPMn1_MIAV1_MIWT4_3_MO40_MGRIPMn1_NTn1_NTA0_NTB0_NTC0_NTD0_NTM0_NEPBS0_NLCA1_NLCB1_ONLL1_PGR2_PLR0_PKA0_SGROBn1_SIA1_SS1_SU32_SUM1_SUS256_SPO0_SRVW0_SSO0_SVW1_SK0_SKFTR0_SKXCCM0_SGRO0_TDMI0_TIN0_TLDS1_TLDSM1_ULSGRO0_USL1_UIOFGRO0_UPLRP0_USFGROn1_VSn1_VWA1_VWB1_WSGRA0_WSGRB0_WS32_WG32_4_1_WGM8_WGMXCC1_WGMXCCGn1
    SolutionIndex: 6
    SolutionNameMin: Cijk_Alik_Bljk_BBS_BH_Bias_HA_S_SAV_UserArgs_MT64x128x32_MI16x16x1_SN_LDSB0_AFC1_AG0_AFEM1_AFEM1_ASEM1_CLR0_CADS0_DTLA0_DTLB0_DTVA0_DTVB0_DTVMXSA0_DTVMXSB0_DTVSM0_DPLBn1_EPS0_ELFLR0_EMLLn1_FDSI0_GRPM1_GRVWA8_GRVWB8_GSU1_GSUAMB_GSUC0_GSUWGMRR0_GLS0_ISA1151_IU1_K1_LDSTI0_LBSPPA128_LBSPPB128_LBSPPM0_LPA8_LPB8_LPM0_LRVW16_LWPMn1_MIAV1_MIWT4_2_MO40_MGRIPMn1_NTn1_NTA0_NTB0_NTC0_NTD0_NTM0_NEPBS0_NLCA1_NLCB1_ONLL1_PGR2_PLR1_PKA0_SGROBn1_SIA1_SS1_SU32_SUM1_SUS256_SPO0_SRVW0_SSO0_SVW1_SK0_SKFTR0_SKXCCM0_SGRO0_TDMI0_TIN0_TLDS1_TLDSM1_ULSGRO0_USL1_UIOFGRO0_UPLRP0_USFGROn1_VSn1_VWA1_VWB1_WSGRA0_WSGRB0_WS32_WG16_8_1_WGM8_WGMXCC1_WGMXCCGn1
    SolutionIndex: 7
    SolutionNameMin: Cijk_Alik_Bljk_BBS_BH_Bias_HA_S_SAV_UserArgs_MT64x64x32_MI16x16x1_SN_LDSB0_AFC1_AG0_AFEM1_AFEM1_ASEM1_CLR0_CADS0_DTLA0_DTLB0_DTVA0_DTVB0_DTVMXSA0_DTVMXSB0_DTVSM0_DPLBn1_EPS0_ELFLR0_EMLLn1_FDSI0_GRPM1_GRVWA8_GRVWB8_GSU1_GSUAMB_GSUC0_GSUWGMRR0_GLS0_ISA1151_IU1_K1_LDSTI0_LBSPPA128_LBSPPB128_LBSPPM0_LPA8_LPB8_LPM0_LRVW16_LWPMn1_MIAV1_MIWT2_2_MO40_MGRIPMn1_NTn1_NTA0_NTB0_NTC0_NTD0_NTM0_NEPBS0_NLCA1_NLCB1_ONLL1_PGR1_PLR1_PKA0_SGROBn1_SIA1_SS1_SU32_SUM1_SUS256_SPO0_SRVW0_SSO0_SVW1_SK0_SKFTR0_SKXCCM0_SGRO0_TDMI0_TIN0_TLDS1_TLDSM1_ULSGRO0_USL1_UIOFGRO0_UPLRP0_USFGROn1_VSn1_VWA1_VWB1_WSGRA0_WSGRB0_WS32_WG32_4_1_WGM8_WGMXCC1_WGMXCCGn1
    SolutionIndex: 8
    SolutionNameMin: Cijk_Alik_Bljk_BBS_BH_Bias_HA_S_SAV_UserArgs_MT64x128x32_MI16x16x1_SN_LDSB0_AFC1_AG0_AFEM1_AFEM1_ASEM1_CLR0_CADS0_DTLA0_DTLB0_DTVA0_DTVB0_DTVMXSA0_DTVMXSB0_DTVSM0_DPLBn1_EPS0_ELFLR0_EMLLn1_FDSI0_GRPM1_GRVWA8_GRVWB8_GSU1_GSUAMB_GSUC0_GSUWGMRR0_GLS0_ISA1151_IU1_K1_LDSTI0_LBSPPA128_LBSPPB128_LBSPPM0_LPA8_LPB8_LPM0_LRVW16_LWPMn1_MIAV1_MIWT2_4_MO40_MGRIPMn1_NTn1_NTA0_NTB0_NTC0_NTD0_NTM0_NEPBS0_NLCA1_NLCB1_ONLL1_PGR0_PLR0_PKA0_SGROBn1_SIA3_SS1_SU32_SUM1_SUS256_SPO0_SRVW0_SSO0_SVW1_SK0_SKFTR0_SKXCCM0_SGRO0_TDMI0_TIN0_TLDS1_TLDSM1_ULSGRO0_USL1_UIOFGRO0_UPLRP0_USFGROn1_VSn1_VWA1_VWB1_WSGRA0_WSGRB0_WS32_WG32_4_1_WGM8_WGMXCC1_WGMXCCGn1
    SolutionIndex: 9
    SolutionNameMin: Cijk_Alik_Bljk_BBS_BH_Bias_HA_S_SAV_UserArgs_MT64x64x32_MI16x16x1_SN_LDSB0_AFC1_AG0_AFEM1_AFEM1_ASEM1_CLR0_CADS0_DTLA0_DTLB0_DTVA0_DTVB0_DTVMXSA0_DTVMXSB0_DTVSM0_DPLBn1_EPS0_ELFLR0_EMLLn1_FDSI0_GRPM1_GRVWA8_GRVWB8_GSU1_GSUAMB_GSUC0_GSUWGMRR0_GLS0_ISA1151_IU1_K1_LDSTI0_LBSPPA128_LBSPPB128_LBSPPM0_LPA8_LPB8_LPM0_LRVW16_LWPMn1_MIAV1_MIWT2_2_MO40_MGRIPMn1_NTn1_NTA0_NTB0_NTC0_NTD0_NTM0_NEPBS0_NLCA1_NLCB1_ONLL1_PGR2_PLR0_PKA0_SGROBn1_SIA3_SS1_SU32_SUM1_SUS256_SPO0_SRVW0_SSO0_SVW1_SK0_SKFTR0_SKXCCM0_SGRO0_TDMI0_TIN0_TLDS1_TLDSM1_ULSGRO0_USL1_UIOFGRO0_UPLRP0_USFGROn1_VSn1_VWA1_VWB1_WSGRA0_WSGRB0_WS32_WG32_4_1_WGM8_WGMXCC1_WGMXCCGn1
    SolutionIndex: 10
    SolutionNameMin: Cijk_Alik_Bljk_BBS_BH_Bias_HA_S_SAV_UserArgs_MT64x64x32_MI16x16x1_SN_LDSB0_AFC1_AG0_AFEM1_AFEM1_ASEM1_CLR0_CADS0_DTLA0_DTLB0_DTVA0_DTVB0_DTVMXSA0_DTVMXSB0_DTVSM0_DPLBn1_EPS0_ELFLR0_EMLLn1_FDSI0_GRPM1_GRVWA8_GRVWB8_GSU1_GSUAMB_GSUC0_GSUWGMRR0_GLS0_ISA1151_IU1_K1_LDSTI0_LBSPPA128_LBSPPB128_LBSPPM0_LPA8_LPB8_LPM0_LRVW16_LWPMn1_MIAV1_MIWT2_2_MO40_MGRIPMn1_NTn1_NTA0_NTB0_NTC0_NTD0_NTM0_NEPBS0_NLCA1_NLCB1_ONLL1_PGR2_PLR1_PKA0_SGROBn1_SIA3_SS1_SU32_SUM1_SUS256_SPO0_SRVW0_SSO0_SVW1_SK0_SKFTR0_SKXCCM0_SGRO0_TDMI0_TIN0_TLDS1_TLDSM1_ULSGRO0_USL1_UIOFGRO0_UPLRP0_USFGROn1_VSn1_VWA1_VWB1_WSGRA0_WSGRB0_WS32_WG32_4_1_WGM8_WGMXCC1_WGMXCCGn1
    SolutionIndex: 11
    SolutionNameMin: Cijk_Alik_Bljk_BBS_BH_Bias_HA_S_SAV_UserArgs_MT64x128x32_MI16x16x1_SN_LDSB0_AFC1_AG0_AFEM1_AFEM1_ASEM1_CLR0_CADS0_DTLA0_DTLB0_DTVA0_DTVB0_DTVMXSA0_DTVMXSB0_DTVSM0_DPLBn1_EPS0_ELFLR0_EMLLn1_FDSI0_GRPM1_GRVWA8_GRVWB8_GSU1_GSUAMB_GSUC0_GSUWGMRR0_GLS0_ISA1151_IU1_K1_LDSTI0_LBSPPA128_LBSPPB128_LBSPPM0_LPA8_LPB8_LPM0_LRVW16_LWPMn1_MIAV1_MIWT2_4_MO40_MGRIPMn1_NTn1_NTA0_NTB0_NTC0_NTD0_NTM0_NEPBS0_NLCA1_NLCB1_ONLL1_PGR2_PLR0_PKA0_SGROBn1_SIA3_SS1_SU32_SUM1_SUS256_SPO0_SRVW0_SSO0_SVW1_SK0_SKFTR0_SKXCCM0_SGRO0_TDMI0_TIN0_TLDS1_TLDSM1_ULSGRO0_USL1_UIOFGRO0_UPLRP0_USFGROn1_VSn1_VWA1_VWB1_WSGRA0_WSGRB0_WS32_WG32_4_1_WGM8_WGMXCC1_WGMXCCGn1
    SolutionIndex: 12
    SolutionNameMin: Cijk_Alik_Bljk_BBS_BH_Bias_HA_S_SAV_UserArgs_MT64x128x32_MI16x16x1_SN_LDSB0_AFC1_AG0_AFEM1_AFEM1_ASEM1_CLR0_CADS0_DTLA0_DTLB0_DTVA0_DTVB0_DTVMXSA0_DTVMXSB0_DTVSM0_DPLBn1_EPS0_ELFLR0_EMLLn1_FDSI0_GRPM1_GRVWA8_GRVWB8_GSU1_GSUAMB_GSUC0_GSUWGMRR0_GLS0_ISA1151_IU1_K1_LDSTI0_LBSPPA128_LBSPPB128_LBSPPM0_LPA8_LPB8_LPM0_LRVW16_LWPMn1_MIAV1_MIWT4_2_MO40_MGRIPMn1_NTn1_NTA0_NTB0_NTC0_NTD0_NTM0_NEPBS0_NLCA1_NLCB1_ONLL1_PGR0_PLR1_PKA0_SGROBn1_SIA1_SS1_SU32_SUM1_SUS256_SPO0_SRVW0_SSO0_SVW1_SK0_SKFTR0_SKXCCM0_SGRO0_TDMI0_TIN0_TLDS1_TLDSM1_ULSGRO0_USL1_UIOFGRO0_UPLRP0_USFGROn1_VSn1_VWA1_VWB1_WSGRA0_WSGRB0_WS32_WG16_8_1_WGM8_WGMXCC1_WGMXCCGn1
    SolutionIndex: 13
    SolutionNameMin: Cijk_Alik_Bljk_BBS_BH_Bias_HA_S_SAV_UserArgs_MT128x64x32_MI16x16x1_SN_LDSB1_AFC1_AG0_AFEM1_AFEM1_ASEM1_CLR0_CADS0_DTLA0_DTLB0_DTVA0_DTVB0_DTVMXSA0_DTVMXSB0_DTVSM0_DPLBn1_EPS0_ELFLR0_EMLLn1_FDSI0_GRPM1_GRVWA8_GRVWB8_GSU1_GSUAMB_GSUC0_GSUWGMRR0_GLS0_ISA1151_IU1_K1_LDSTI0_LBSPPA128_LBSPPB128_LBSPPM0_LPA8_LPB8_LPM0_LRVW16_LWPMn1_MIAV1_MIWT2_4_MO40_MGRIPMn1_NTn1_NTA0_NTB0_NTC0_NTD0_NTM0_NEPBS0_NLCA1_NLCB1_ONLL1_PGR2_PLR1_PKA0_SGROBn1_SIA3_SS1_SU32_SUM1_SUS256_SPO0_SRVW0_SSO0_SVW1_SK0_SKFTR0_SKXCCM0_SGRO0_TDMI0_TIN0_TLDS1_TLDSM1_ULSGRO0_USL1_UIOFGRO0_UPLRP0_USFGROn1_VSn1_VWA1_VWB1_WSGRA0_WSGRB0_WS32_WG64_2_1_WGM8_WGMXCC1_WGMXCCGn1
    SolutionIndex: 14
    SolutionNameMin: Cijk_Alik_Bljk_BBS_BH_Bias_HA_S_SAV_UserArgs_MT64x128x32_MI16x16x1_SN_LDSB1_AFC1_AG0_AFEM1_AFEM1_ASEM1_CLR0_CADS0_DTLA0_DTLB0_DTVA0_DTVB0_DTVMXSA0_DTVMXSB0_DTVSM0_DPLBn1_EPS0_ELFLR0_EMLLn1_FDSI0_GRPM1_GRVWA8_GRVWB8_GSU1_GSUAMB_GSUC0_GSUWGMRR0_GLS0_ISA1151_IU1_K1_LDSTI0_LBSPPA128_LBSPPB128_LBSPPM0_LPA8_LPB8_LPM0_LRVW16_LWPMn1_MIAV1_MIWT2_4_MO40_MGRIPMn1_NTn1_NTA0_NTB0_NTC0_NTD0_NTM0_NEPBS0_NLCA1_NLCB1_ONLL1_PGR2_PLR1_PKA0_SGROBn1_SIA3_SS1_SU32_SUM1_SUS256_SPO0_SRVW0_SSO0_SVW1_SK0_SKFTR0_SKXCCM0_SGRO0_TDMI0_TIN0_TLDS1_TLDSM1_ULSGRO0_USL1_UIOFGRO0_UPLRP0_USFGROn1_VSn1_VWA1_VWB1_WSGRA0_WSGRB0_WS32_WG32_4_1_WGM8_WGMXCC1_WGMXCCGn1
    SolutionIndex: 15
    SolutionNameMin: Cijk_Alik_Bljk_BBS_BH_Bias_HA_S_SAV_UserArgs_MT64x128x32_MI16x16x1_SN_LDSB0_AFC1_AG0_AFEM1_AFEM1_ASEM1_CLR0_CADS0_DTLA0_DTLB0_DTVA0_DTVB0_DTVMXSA0_DTVMXSB0_DTVSM0_DPLBn1_EPS0_ELFLR0_EMLLn1_FDSI0_GRPM1_GRVWA8_GRVWB8_GSU1_GSUAMB_GSUC0_GSUWGMRR0_GLS0_ISA1151_IU1_K1_LDSTI0_LBSPPA128_LBSPPB128_LBSPPM0_LPA8_LPB8_LPM0_LRVW16_LWPMn1_MIAV1_MIWT4_2_MO40_MGRIPMn1_NTn1_NTA0_NTB0_NTC0_NTD0_NTM0_NEPBS0_NLCA1_NLCB1_ONLL1_PGR0_PLR0_PKA0_SGROBn1_SIA3_SS1_SU32_SUM1_SUS256_SPO0_SRVW0_SSO0_SVW1_SK0_SKFTR0_SKXCCM0_SGRO0_TDMI0_TIN0_TLDS1_TLDSM1_ULSGRO0_USL1_UIOFGRO0_UPLRP0_USFGROn1_VSn1_VWA1_VWB1_WSGRA0_WSGRB0_WS32_WG16_8_1_WGM8_WGMXCC1_WGMXCCGn1
    SolutionIndex: 16
    SolutionNameMin: Cijk_Alik_Bljk_BBS_BH_Bias_HA_S_SAV_UserArgs_MT64x128x32_MI16x16x1_SN_LDSB0_AFC1_AG0_AFEM1_AFEM1_ASEM1_CLR0_CADS0_DTLA0_DTLB0_DTVA0_DTVB0_DTVMXSA0_DTVMXSB0_DTVSM0_DPLBn1_EPS0_ELFLR0_EMLLn1_FDSI0_GRPM1_GRVWA8_GRVWB8_GSU1_GSUAMB_GSUC0_GSUWGMRR0_GLS0_ISA1151_IU1_K1_LDSTI0_LBSPPA128_LBSPPB128_LBSPPM0_LPA8_LPB8_LPM0_LRVW16_LWPMn1_MIAV1_MIWT2_4_MO40_MGRIPMn1_NTn1_NTA0_NTB0_NTC0_NTD0_NTM0_NEPBS0_NLCA1_NLCB1_ONLL1_PGR0_PLR0_PKA0_SGROBn1_SIA1_SS1_SU32_SUM1_SUS256_SPO0_SRVW0_SSO0_SVW1_SK0_SKFTR0_SKXCCM0_SGRO0_TDMI0_TIN0_TLDS1_TLDSM1_ULSGRO0_USL1_UIOFGRO0_UPLRP0_USFGROn1_VSn1_VWA1_VWB1_WSGRA0_WSGRB0_WS32_WG32_4_1_WGM8_WGMXCC1_WGMXCCGn1
    SolutionIndex: 17
    SolutionNameMin: Cijk_Alik_Bljk_BBS_BH_Bias_HA_S_SAV_UserArgs_MT128x128x32_MI16x16x1_SN_LDSB0_AFC1_AG0_AFEM1_AFEM1_ASEM1_CLR0_CADS0_DTLA0_DTLB0_DTVA0_DTVB0_DTVMXSA0_DTVMXSB0_DTVSM0_DPLBn1_EPS0_ELFLR0_EMLLn1_FDSI0_GRPM1_GRVWA8_GRVWB8_GSU1_GSUAMB_GSUC0_GSUWGMRR0_GLS0_ISA1151_IU1_K1_LDSTI0_LBSPPA128_LBSPPB128_LBSPPM0_LPA8_LPB8_LPM0_LRVW16_LWPMn1_MIAV1_MIWT4_4_MO40_MGRIPMn1_NTn1_NTA0_NTB0_NTC0_NTD0_NTM0_NEPBS0_NLCA1_NLCB1_ONLL1_PGR0_PLR0_PKA0_SGROBn1_SIA1_SS1_SU32_SUM1_SUS256_SPO0_SRVW0_SSO0_SVW1_SK0_SKFTR0_SKXCCM0_SGRO0_TDMI0_TIN0_TLDS1_TLDSM1_ULSGRO0_USL1_UIOFGRO0_UPLRP0_USFGROn1_VSn1_VWA1_VWB1_WSGRA0_WSGRB0_WS32_WG32_4_1_WGM8_WGMXCC1_WGMXCCGn1
    SolutionIndex: 18
    SolutionNameMin: Cijk_Alik_Bljk_BBS_BH_Bias_HA_S_SAV_UserArgs_MT128x128x32_MI16x16x1_SN_LDSB0_AFC1_AG0_AFEM1_AFEM1_ASEM1_CLR0_CADS0_DTLA0_DTLB0_DTVA0_DTVB0_DTVMXSA0_DTVMXSB0_DTVSM0_DPLBn1_EPS0_ELFLR0_EMLLn1_FDSI0_GRPM1_GRVWA8_GRVWB8_GSU1_GSUAMB_GSUC0_GSUWGMRR0_GLS0_ISA1151_IU1_K1_LDSTI0_LBSPPA128_LBSPPB128_LBSPPM0_LPA8_LPB8_LPM0_LRVW16_LWPMn1_MIAV1_MIWT4_4_MO40_MGRIPMn1_NTn1_NTA0_NTB0_NTC0_NTD0_NTM0_NEPBS0_NLCA1_NLCB1_ONLL1_PGR0_PLR0_PKA0_SGROBn1_SIA3_SS1_SU32_SUM1_SUS256_SPO0_SRVW0_SSO0_SVW1_SK0_SKFTR0_SKXCCM0_SGRO0_TDMI0_TIN0_TLDS1_TLDSM1_ULSGRO0_USL1_UIOFGRO0_UPLRP0_USFGROn1_VSn1_VWA1_VWB1_WSGRA0_WSGRB0_WS32_WG32_4_1_WGM8_WGMXCC1_WGMXCCGn1
    SolutionIndex: 19
    SolutionNameMin: Cijk_Alik_Bljk_BBS_BH_Bias_HA_S_SAV_UserArgs_MT128x128x32_MI16x16x1_SN_LDSB0_AFC1_AG0_AFEM1_AFEM1_ASEM1_CLR0_CADS0_DTLA0_DTLB0_DTVA0_DTVB0_DTVMXSA0_DTVMXSB0_DTVSM0_DPLBn1_EPS0_ELFLR0_EMLLn1_FDSI0_GRPM1_GRVWA8_GRVWB8_GSU1_GSUAMB_GSUC0_GSUWGMRR0_GLS0_ISA1151_IU1_K1_LDSTI0_LBSPPA128_LBSPPB128_LBSPPM0_LPA8_LPB8_LPM0_LRVW16_LWPMn1_MIAV1_MIWT2_8_MO40_MGRIPMn1_NTn1_NTA0_NTB0_NTC0_NTD0_NTM0_NEPBS0_NLCA1_NLCB1_ONLL1_PGR0_PLR0_PKA0_SGROBn1_SIA3_SS1_SU32_SUM1_SUS256_SPO0_SRVW0_SSO0_SVW1_SK0_SKFTR0_SKXCCM0_SGRO0_TDMI0_TIN0_TLDS1_TLDSM1_ULSGRO0_USL1_UIOFGRO0_UPLRP0_USFGROn1_VSn1_VWA1_VWB1_WSGRA0_WSGRB0_WS32_WG64_2_1_WGM8_WGMXCC1_WGMXCCGn1
    SolutionIndex: 20
    SolutionNameMin: Cijk_Alik_Bljk_BBS_BH_Bias_HA_S_SAV_UserArgs_MT128x128x32_MI16x16x1_SN_LDSB0_AFC1_AG0_AFEM1_AFEM1_ASEM1_CLR0_CADS0_DTLA0_DTLB0_DTVA0_DTVB0_DTVMXSA0_DTVMXSB0_DTVSM0_DPLBn1_EPS0_ELFLR0_EMLLn1_FDSI0_GRPM1_GRVWA8_GRVWB8_GSU1_GSUAMB_GSUC0_GSUWGMRR0_GLS0_ISA1151_IU1_K1_LDSTI0_LBSPPA128_LBSPPB128_LBSPPM0_LPA8_LPB8_LPM0_LRVW16_LWPMn1_MIAV1_MIWT2_8_MO40_MGRIPMn1_NTn1_NTA0_NTB0_NTC0_NTD0_NTM0_NEPBS0_NLCA1_NLCB1_ONLL1_PGR0_PLR0_PKA0_SGROBn1_SIA1_SS1_SU32_SUM1_SUS256_SPO0_SRVW0_SSO0_SVW1_SK0_SKFTR0_SKXCCM0_SGRO0_TDMI0_TIN0_TLDS1_TLDSM1_ULSGRO0_USL1_UIOFGRO0_UPLRP0_USFGROn1_VSn1_VWA1_VWB1_WSGRA0_WSGRB0_WS32_WG64_2_1_WGM8_WGMXCC1_WGMXCCGn1
    SolutionIndex: 21
    SolutionNameMin: Cijk_Alik_Bljk_BBS_BH_Bias_HA_S_SAV_UserArgs_MT64x64x32_MI16x16x1_SN_LDSB0_AFC1_AG0_AFEM1_AFEM1_ASEM1_CLR0_CADS0_DTLA0_DTLB0_DTVA0_DTVB0_DTVMXSA0_DTVMXSB0_DTVSM0_DPLBn1_EPS0_ELFLR0_EMLLn1_FDSI0_GRPM1_GRVWA8_GRVWB8_GSU1_GSUAMB_GSUC0_GSUWGMRR0_GLS0_ISA1151_IU1_K1_LDSTI0_LBSPPA128_LBSPPB128_LBSPPM0_LPA8_LPB8_LPM0_LRVW16_LWPMn1_MIAV1_MIWT4_4_MO40_MGRIPMn1_NTn1_NTA0_NTB0_NTC0_NTD0_NTM0_NEPBS0_NLCA1_NLCB1_ONLL1_PGR0_PLR0_PKA0_SGROBn1_SIA3_SS1_SU32_SUM1_SUS256_SPO0_SRVW0_SSO0_SVW1_SK0_SKFTR0_SKXCCM0_SGRO0_TDMI0_TIN0_TLDS1_TLDSM1_ULSGRO0_USL1_UIOFGRO0_UPLRP0_USFGROn1_VSn1_VWA1_VWB1_WSGRA0_WSGRB0_WS32_WG16_2_1_WGM8_WGMXCC1_WGMXCCGn1
    SolutionIndex: 22
    SolutionNameMin: Cijk_Alik_Bljk_BBS_BH_Bias_HA_S_SAV_UserArgs_MT64x64x32_MI16x16x1_SN_LDSB0_AFC1_AG0_AFEM1_AFEM1_ASEM1_CLR0_CADS0_DTLA0_DTLB0_DTVA0_DTVB0_DTVMXSA0_DTVMXSB0_DTVSM0_DPLBn1_EPS0_ELFLR0_EMLLn1_FDSI0_GRPM1_GRVWA8_GRVWB8_GSU1_GSUAMB_GSUC0_GSUWGMRR0_GLS0_ISA1151_IU1_K1_LDSTI0_LBSPPA128_LBSPPB128_LBSPPM0_LPA8_LPB8_LPM0_LRVW16_LWPMn1_MIAV1_MIWT2_2_MO40_MGRIPMn1_NTn1_NTA0_NTB0_NTC0_NTD0_NTM0_NEPBS0_NLCA1_NLCB1_ONLL1_PGR1_PLR0_PKA0_SGROBn1_SIA3_SS1_SU32_SUM1_SUS256_SPO0_SRVW0_SSO0_SVW1_SK0_SKFTR0_SKXCCM0_SGRO0_TDMI0_TIN0_TLDS1_TLDSM1_ULSGRO0_USL1_UIOFGRO0_UPLRP0_USFGROn1_VSn1_VWA1_VWB1_WSGRA0_WSGRB0_WS32_WG32_4_1_WGM8_WGMXCC1_WGMXCCGn1
    SolutionIndex: 23
    SolutionNameMin: Cijk_Alik_Bljk_BBS_BH_Bias_HA_S_SAV_UserArgs_MT128x64x32_MI16x16x1_SN_LDSB1_AFC1_AG0_AFEM1_AFEM1_ASEM1_CLR0_CADS0_DTLA0_DTLB0_DTVA0_DTVB0_DTVMXSA0_DTVMXSB0_DTVSM0_DPLBn1_EPS0_ELFLR0_EMLLn1_FDSI0_GRPM1_GRVWA8_GRVWB8_GSU1_GSUAMB_GSUC0_GSUWGMRR0_GLS0_ISA1151_IU1_K1_LDSTI0_LBSPPA128_LBSPPB128_LBSPPM0_LPA8_LPB8_LPM0_LRVW16_LWPMn1_MIAV1_MIWT2_4_MO40_MGRIPMn1_NTn1_NTA0_NTB0_NTC0_NTD0_NTM0_NEPBS0_NLCA1_NLCB1_ONLL1_PGR1_PLR1_PKA0_SGROBn1_SIA3_SS1_SU32_SUM1_SUS256_SPO0_SRVW0_SSO0_SVW1_SK0_SKFTR0_SKXCCM0_SGRO0_TDMI0_TIN0_TLDS1_TLDSM1_ULSGRO0_USL1_UIOFGRO0_UPLRP0_USFGROn1_VSn1_VWA1_VWB1_WSGRA0_WSGRB0_WS32_WG64_2_1_WGM8_WGMXCC1_WGMXCCGn1
    SolutionIndex: 24
    SolutionNameMin: Cijk_Alik_Bljk_BBS_BH_Bias_HA_S_SAV_UserArgs_MT128x48x32_MI16x16x1_SN_LDSB0_AFC1_AG0_AFEM1_AFEM1_ASEM1_CLR0_CADS0_DTLA0_DTLB0_DTVA0_DTVB0_DTVMXSA0_DTVMXSB0_DTVSM0_DPLBn1_EPS0_ELFLR0_EMLLn1_FDSI0_GRPM1_GRVWA8_GRVWB4_GSU1_GSUAMB_GSUC0_GSUWGMRR0_GLS0_ISA1151_IU1_K1_LDSTI0_LBSPPA128_LBSPPB128_LBSPPM0_LPA8_LPB8_LPM0_LRVW16_LWPMn1_MIAV1_MIWT2_3_MO40_MGRIPMn1_NTn1_NTA0_NTB0_NTC0_NTD0_NTM0_NEPBS0_NLCA1_NLCB1_ONLL1_PGR2_PLR0_PKA0_SGROBn1_SIA1_SS1_SU32_SUM1_SUS256_SPO0_SRVW0_SSO0_SVW1_SK0_SKFTR0_SKXCCM0_SGRO0_TDMI0_TIN0_TLDS1_TLDSM1_ULSGRO0_USL1_UIOFGRO0_UPLRP0_USFGROn1_VSn1_VWA1_VWB1_WSGRA0_WSGRB0_WS32_WG64_2_1_WGM8_WGMXCC1_WGMXCCGn1
    SolutionIndex: 25
    SolutionNameMin: Cijk_Alik_Bljk_BBS_BH_Bias_HA_S_SAV_UserArgs_MT64x64x32_MI16x16x1_SN_LDSB0_AFC1_AG0_AFEM1_AFEM1_ASEM1_CLR0_CADS0_DTLA0_DTLB0_DTVA0_DTVB0_DTVMXSA0_DTVMXSB0_DTVSM0_DPLBn1_EPS0_ELFLR0_EMLLn1_FDSI0_GRPM1_GRVWA8_GRVWB8_GSU1_GSUAMB_GSUC0_GSUWGMRR0_GLS0_ISA1151_IU1_K1_LDSTI0_LBSPPA128_LBSPPB128_LBSPPM0_LPA8_LPB8_LPM0_LRVW16_LWPMn1_MIAV1_MIWT2_2_MO40_MGRIPMn1_NTn1_NTA0_NTB0_NTC0_NTD0_NTM0_NEPBS0_NLCA1_NLCB1_ONLL1_PGR2_PLR0_PKA0_SGROBn1_SIA1_SS1_SU32_SUM1_SUS256_SPO0_SRVW0_SSO0_SVW1_SK0_SKFTR0_SKXCCM0_SGRO0_TDMI0_TIN0_TLDS1_TLDSM1_ULSGRO0_USL1_UIOFGRO0_UPLRP0_USFGROn1_VSn1_VWA1_VWB1_WSGRA0_WSGRB0_WS32_WG32_4_1_WGM8_WGMXCC1_WGMXCCGn1
    SolutionIndex: 26
    SolutionNameMin: Cijk_Alik_Bljk_BBS_BH_Bias_HA_S_SAV_UserArgs_MT64x64x32_MI16x16x1_SN_LDSB0_AFC1_AG0_AFEM1_AFEM1_ASEM1_CLR0_CADS0_DTLA0_DTLB0_DTVA0_DTVB0_DTVMXSA0_DTVMXSB0_DTVSM0_DPLBn1_EPS0_ELFLR0_EMLLn1_FDSI0_GRPM1_GRVWA8_GRVWB8_GSU1_GSUAMB_GSUC0_GSUWGMRR0_GLS0_ISA1151_IU1_K1_LDSTI0_LBSPPA128_LBSPPB128_LBSPPM0_LPA8_LPB8_LPM0_LRVW16_LWPMn1_MIAV1_MIWT2_2_MO40_MGRIPMn1_NTn1_NTA0_NTB0_NTC0_NTD0_NTM0_NEPBS0_NLCA1_NLCB1_ONLL1_PGR2_PLR1_PKA0_SGROBn1_SIA1_SS1_SU32_SUM1_SUS256_SPO0_SRVW0_SSO0_SVW1_SK0_SKFTR0_SKXCCM0_SGRO0_TDMI0_TIN0_TLDS1_TLDSM1_ULSGRO0_USL1_UIOFGRO0_UPLRP0_USFGROn1_VSn1_VWA1_VWB1_WSGRA0_WSGRB0_WS32_WG32_4_1_WGM8_WGMXCC1_WGMXCCGn1
    SolutionIndex: 27
    SolutionNameMin: Cijk_Alik_Bljk_BBS_BH_Bias_HA_S_SAV_UserArgs_MT64x128x32_MI16x16x1_SN_LDSB1_AFC1_AG0_AFEM1_AFEM1_ASEM1_CLR0_CADS0_DTLA0_DTLB0_DTVA0_DTVB0_DTVMXSA0_DTVMXSB0_DTVSM0_DPLBn1_EPS0_ELFLR0_EMLLn1_FDSI0_GRPM1_GRVWA8_GRVWB8_GSU1_GSUAMB_GSUC0_GSUWGMRR0_GLS0_ISA1151_IU1_K1_LDSTI0_LBSPPA128_LBSPPB128_LBSPPM0_LPA8_LPB8_LPM0_LRVW16_LWPMn1_MIAV1_MIWT4_2_MO40_MGRIPMn1_NTn1_NTA0_NTB0_NTC0_NTD0_NTM0_NEPBS0_NLCA1_NLCB1_ONLL1_PGR2_PLR1_PKA0_SGROBn1_SIA3_SS1_SU32_SUM1_SUS256_SPO0_SRVW0_SSO0_SVW1_SK0_SKFTR0_SKXCCM0_SGRO0_TDMI0_TIN0_TLDS1_TLDSM1_ULSGRO0_USL1_UIOFGRO0_UPLRP0_USFGROn1_VSn1_VWA1_VWB1_WSGRA0_WSGRB0_WS32_WG16_8_1_WGM8_WGMXCC1_WGMXCCGn1
    SolutionIndex: 28
    SolutionNameMin: Cijk_Alik_Bljk_BBS_BH_Bias_HA_S_SAV_UserArgs_MT96x128x32_MI16x16x1_SN_LDSB1_AFC1_AG0_AFEM1_AFEM1_ASEM1_CLR0_CADS0_DTLA0_DTLB0_DTVA0_DTVB0_DTVMXSA0_DTVMXSB0_DTVSM0_DPLBn1_EPS0_ELFLR0_EMLLn1_FDSI0_GRPM1_GRVWA8_GRVWB8_GSU1_GSUAMB_GSUC0_GSUWGMRR0_GLS0_ISA1151_IU1_K1_LDSTI0_LBSPPA128_LBSPPB128_LBSPPM0_LPA8_LPB8_LPM0_LRVW16_LWPMn1_MIAV1_MIWT3_4_MO40_MGRIPMn1_NTn1_NTA0_NTB0_NTC0_NTD0_NTM0_NEPBS0_NLCA1_NLCB1_ONLL1_PGR2_PLR1_PKA0_SGROBn1_SIA3_SS1_SU32_SUM1_SUS256_SPO0_SRVW0_SSO0_SVW1_SK0_SKFTR0_SKXCCM0_SGRO0_TDMI0_TIN0_TLDS1_TLDSM1_ULSGRO0_USL1_UIOFGRO0_UPLRP0_USFGROn1_VSn1_VWA1_VWB1_WSGRA0_WSGRB0_WS32_WG32_4_1_WGM8_WGMXCC1_WGMXCCGn1
    SolutionIndex: 29
    SolutionNameMin: Cijk_Alik_Bljk_BBS_BH_Bias_HA_S_SAV_UserArgs_MT64x128x32_MI16x16x1_SN_LDSB0_AFC1_AG0_AFEM1_AFEM1_ASEM1_CLR0_CADS0_DTLA0_DTLB0_DTVA0_DTVB0_DTVMXSA0_DTVMXSB0_DTVSM0_DPLBn1_EPS0_ELFLR0_EMLLn1_FDSI0_GRPM1_GRVWA8_GRVWB8_GSU1_GSUAMB_GSUC0_GSUWGMRR0_GLS0_ISA1151_IU1_K1_LDSTI0_LBSPPA128_LBSPPB128_LBSPPM0_LPA8_LPB8_LPM0_LRVW16_LWPMn1_MIAV1_MIWT4_2_MO40_MGRIPMn1_NTn1_NTA0_NTB0_NTC0_NTD0_NTM0_NEPBS0_NLCA1_NLCB1_ONLL1_PGR0_PLR1_PKA0_SGROBn1_SIA3_SS1_SU32_SUM1_SUS256_SPO0_SRVW0_SSO0_SVW1_SK0_SKFTR0_SKXCCM0_SGRO0_TDMI0_TIN0_TLDS1_TLDSM1_ULSGRO0_USL1_UIOFGRO0_UPLRP0_USFGROn1_VSn1_VWA1_VWB1_WSGRA0_WSGRB0_WS32_WG16_8_1_WGM8_WGMXCC1_WGMXCCGn1
    SolutionIndex: 30
    SolutionNameMin: Cijk_Alik_Bljk_BBS_BH_Bias_HA_S_SAV_UserArgs_MT80x128x32_MI16x16x1_SN_LDSB1_AFC1_AG0_AFEM1_AFEM1_ASEM1_CLR0_CADS0_DTLA0_DTLB0_DTVA0_DTVB0_DTVMXSA0_DTVMXSB0_DTVSM0_DPLBn1_EPS0_ELFLR0_EMLLn1_FDSI0_GRPM1_GRVWA4_GRVWB8_GSU1_GSUAMB_GSUC0_GSUWGMRR0_GLS0_ISA1151_IU1_K1_LDSTI0_LBSPPA128_LBSPPB128_LBSPPM0_LPA8_LPB8_LPM0_LRVW16_LWPMn1_MIAV1_MIWT5_2_MO40_MGRIPMn1_NTn1_NTA0_NTB0_NTC0_NTD0_NTM0_NEPBS0_NLCA1_NLCB1_ONLL1_PGR2_PLR1_PKA0_SGROBn1_SIA3_SS1_SU32_SUM1_SUS256_SPO0_SRVW0_SSO0_SVW1_SK0_SKFTR0_SKXCCM0_SGRO0_TDMI0_TIN0_TLDS1_TLDSM1_ULSGRO0_USL1_UIOFGRO0_UPLRP0_USFGROn1_VSn1_VWA1_VWB1_WSGRA0_WSGRB0_WS32_WG16_8_1_WGM8_WGMXCC1_WGMXCCGn1
    SolutionIndex: 31
    SolutionNameMin: Cijk_Alik_Bljk_BBS_BH_Bias_HA_S_SAV_UserArgs_MT64x128x32_MI16x16x1_SN_LDSB1_AFC1_AG0_AFEM1_AFEM1_ASEM1_CLR0_CADS0_DTLA0_DTLB0_DTVA0_DTVB0_DTVMXSA0_DTVMXSB0_DTVSM0_DPLBn1_EPS0_ELFLR0_EMLLn1_FDSI0_GRPM1_GRVWA8_GRVWB8_GSU1_GSUAMB_GSUC0_GSUWGMRR0_GLS0_ISA1151_IU1_K1_LDSTI0_LBSPPA128_LBSPPB128_LBSPPM0_LPA8_LPB8_LPM0_LRVW16_LWPMn1_MIAV1_MIWT4_2_MO40_MGRIPMn1_NTn1_NTA0_NTB0_NTC0_NTD0_NTM0_NEPBS0_NLCA1_NLCB1_ONLL1_PGR1_PLR1_PKA0_SGROBn1_SIA3_SS1_SU32_SUM1_SUS256_SPO0_SRVW0_SSO0_SVW1_SK0_SKFTR0_SKXCCM0_SGRO0_TDMI0_TIN0_TLDS1_TLDSM1_ULSGRO0_USL1_UIOFGRO0_UPLRP0_USFGROn1_VSn1_VWA1_VWB1_WSGRA0_WSGRB0_WS32_WG16_8_1_WGM8_WGMXCC1_WGMXCCGn1
    SolutionIndex: 32
    SolutionNameMin: Cijk_Alik_Bljk_BBS_BH_Bias_HA_S_SAV_UserArgs_MT96x128x32_MI16x16x1_SN_LDSB0_AFC1_AG0_AFEM1_AFEM1_ASEM1_CLR0_CADS0_DTLA0_DTLB0_DTVA0_DTVB0_DTVMXSA0_DTVMXSB0_DTVSM0_DPLBn1_EPS0_ELFLR0_EMLLn1_FDSI0_GRPM1_GRVWA8_GRVWB8_GSU1_GSUAMB_GSUC0_GSUWGMRR0_GLS0_ISA1151_IU1_K1_LDSTI0_LBSPPA128_LBSPPB128_LBSPPM0_LPA8_LPB8_LPM0_LRVW16_LWPMn1_MIAV1_MIWT3_4_MO40_MGRIPMn1_NTn1_NTA0_NTB0_NTC0_NTD0_NTM0_NEPBS0_NLCA1_NLCB1_ONLL1_PGR0_PLR0_PKA0_SGROBn1_SIA3_SS1_SU32_SUM1_SUS256_SPO0_SRVW0_SSO0_SVW1_SK0_SKFTR0_SKXCCM0_SGRO0_TDMI0_TIN0_TLDS1_TLDSM1_ULSGRO0_USL1_UIOFGRO0_UPLRP0_USFGROn1_VSn1_VWA1_VWB1_WSGRA0_WSGRB0_WS32_WG32_4_1_WGM8_WGMXCC1_WGMXCCGn1
    SolutionIndex: 33
    SolutionNameMin: Cijk_Alik_Bljk_BBS_BH_Bias_HA_S_SAV_UserArgs_MT128x80x32_MI16x16x1_SN_LDSB0_AFC1_AG0_AFEM1_AFEM1_ASEM1_CLR0_CADS0_DTLA0_DTLB0_DTVA0_DTVB0_DTVMXSA0_DTVMXSB0_DTVSM0_DPLBn1_EPS0_ELFLR0_EMLLn1_FDSI0_GRPM1_GRVWA8_GRVWB4_GSU1_GSUAMB_GSUC0_GSUWGMRR0_GLS0_ISA1151_IU1_K1_LDSTI0_LBSPPA128_LBSPPB128_LBSPPM0_LPA8_LPB8_LPM0_LRVW16_LWPMn1_MIAV1_MIWT2_5_MO40_MGRIPMn1_NTn1_NTA0_NTB0_NTC0_NTD0_NTM0_NEPBS0_NLCA1_NLCB1_ONLL1_PGR0_PLR0_PKA0_SGROBn1_SIA3_SS1_SU32_SUM1_SUS256_SPO0_SRVW0_SSO0_SVW1_SK0_SKFTR0_SKXCCM0_SGRO0_TDMI0_TIN0_TLDS1_TLDSM1_ULSGRO0_USL1_UIOFGRO0_UPLRP0_USFGROn1_VSn1_VWA1_VWB1_WSGRA0_WSGRB0_WS32_WG64_2_1_WGM8_WGMXCC1_WGMXCCGn1
    SolutionIndex: 34
    SolutionNameMin: Cijk_Alik_Bljk_BBS_BH_Bias_HA_S_SAV_UserArgs_MT128x80x64_MI16x16x1_SN_LDSB1_AFC1_AG0_AFEM1_AFEM1_ASEM1_CLR0_CADS0_DTLA0_DTLB0_DTVA0_DTVB0_DTVMXSA0_DTVMXSB0_DTVSM0_DPLBn1_EPS0_ELFLR0_EMLLn1_FDSI0_GRPM1_GRVWA8_GRVWB8_GSU1_GSUAMB_GSUC0_GSUWGMRR0_GLS0_ISA1151_IU1_K1_LDSTI0_LBSPPA128_LBSPPB128_LBSPPM0_LPA8_LPB8_LPM0_LRVW16_LWPMn1_MIAV1_MIWT2_5_MO40_MGRIPMn1_NTn1_NTA0_NTB0_NTC0_NTD0_NTM0_NEPBS0_NLCA1_NLCB1_ONLL1_PGR2_PLR1_PKA0_SGROBn1_SIA3_SS1_SU32_SUM1_SUS256_SPO0_SRVW0_SSO0_SVW1_SK0_SKFTR0_SKXCCM0_SGRO0_TDMI0_TIN0_TLDS1_TLDSM1_ULSGRO0_USL1_UIOFGRO0_UPLRP0_USFGROn1_VSn1_VWA1_VWB1_WSGRA0_WSGRB0_WS32_WG64_2_1_WGM8_WGMXCC1_WGMXCCGn1
    SolutionIndex: 35
    SolutionNameMin: Cijk_Alik_Bljk_BBS_BH_Bias_HA_S_SAV_UserArgs_MT128x64x32_MI16x16x1_SN_LDSB0_AFC1_AG0_AFEM1_AFEM1_ASEM1_CLR0_CADS0_DTLA0_DTLB0_DTVA0_DTVB0_DTVMXSA0_DTVMXSB0_DTVSM0_DPLBn1_EPS0_ELFLR0_EMLLn1_FDSI0_GRPM1_GRVWA8_GRVWB8_GSU1_GSUAMB_GSUC0_GSUWGMRR0_GLS0_ISA1151_IU1_K1_LDSTI0_LBSPPA128_LBSPPB128_LBSPPM0_LPA8_LPB8_LPM0_LRVW16_LWPMn1_MIAV1_MIWT2_4_MO40_MGRIPMn1_NTn1_NTA0_NTB0_NTC0_NTD0_NTM0_NEPBS0_NLCA1_NLCB1_ONLL1_PGR0_PLR0_PKA0_SGROBn1_SIA1_SS1_SU32_SUM1_SUS256_SPO0_SRVW0_SSO0_SVW1_SK0_SKFTR0_SKXCCM0_SGRO0_TDMI0_TIN0_TLDS1_TLDSM1_ULSGRO0_USL1_UIOFGRO0_UPLRP0_USFGROn1_VSn1_VWA1_VWB1_WSGRA0_WSGRB0_WS32_WG64_2_1_WGM8_WGMXCC1_WGMXCCGn1
    SolutionIndex: 36
    SolutionNameMin: Cijk_Alik_Bljk_BBS_BH_Bias_HA_S_SAV_UserArgs_MT128x64x32_MI16x16x1_SN_LDSB0_AFC1_AG0_AFEM1_AFEM1_ASEM1_CLR0_CADS0_DTLA0_DTLB0_DTVA0_DTVB0_DTVMXSA0_DTVMXSB0_DTVSM0_DPLBn1_EPS0_ELFLR0_EMLLn1_FDSI0_GRPM1_GRVWA8_GRVWB8_GSU1_GSUAMB_GSUC0_GSUWGMRR0_GLS0_ISA1151_IU1_K1_LDSTI0_LBSPPA128_LBSPPB128_LBSPPM0_LPA8_LPB8_LPM0_LRVW16_LWPMn1_MIAV1_MIWT2_4_MO40_MGRIPMn1_NTn1_NTA0_NTB0_NTC0_NTD0_NTM0_NEPBS0_NLCA1_NLCB1_ONLL1_PGR0_PLR0_PKA0_SGROBn1_SIA3_SS1_SU32_SUM1_SUS256_SPO0_SRVW0_SSO0_SVW1_SK0_SKFTR0_SKXCCM0_SGRO0_TDMI0_TIN0_TLDS1_TLDSM1_ULSGRO0_USL1_UIOFGRO0_UPLRP0_USFGROn1_VSn1_VWA1_VWB1_WSGRA0_WSGRB0_WS32_WG64_2_1_WGM8_WGMXCC1_WGMXCCGn1
    SolutionIndex: 37
    SolutionNameMin: Cijk_Alik_Bljk_BBS_BH_Bias_HA_S_SAV_UserArgs_MT128x80x32_MI16x16x1_SN_LDSB1_AFC1_AG0_AFEM1_AFEM1_ASEM1_CLR0_CADS0_DTLA0_DTLB0_DTVA0_DTVB0_DTVMXSA0_DTVMXSB0_DTVSM0_DPLBn1_EPS0_ELFLR0_EMLLn1_FDSI0_GRPM1_GRVWA8_GRVWB4_GSU1_GSUAMB_GSUC0_GSUWGMRR0_GLS0_ISA1151_IU1_K1_LDSTI0_LBSPPA128_LBSPPB128_LBSPPM0_LPA8_LPB8_LPM0_LRVW16_LWPMn1_MIAV1_MIWT2_5_MO40_MGRIPMn1_NTn1_NTA0_NTB0_NTC0_NTD0_NTM0_NEPBS0_NLCA1_NLCB1_ONLL1_PGR2_PLR1_PKA0_SGROBn1_SIA3_SS1_SU32_SUM1_SUS256_SPO0_SRVW0_SSO0_SVW1_SK0_SKFTR0_SKXCCM0_SGRO0_TDMI0_TIN0_TLDS1_TLDSM1_ULSGRO0_USL1_UIOFGRO0_UPLRP0_USFGROn1_VSn1_VWA1_VWB1_WSGRA0_WSGRB0_WS32_WG64_2_1_WGM8_WGMXCC1_WGMXCCGn1
    SolutionIndex: 38
    SolutionNameMin: Cijk_Alik_Bljk_BBS_BH_Bias_HA_S_SAV_UserArgs_MT64x128x64_MI16x16x1_SN_LDSB0_AFC1_AG0_AFEM1_AFEM1_ASEM1_CLR0_CADS0_DTLA0_DTLB0_DTVA0_DTVB0_DTVMXSA0_DTVMXSB0_DTVSM0_DPLBn1_EPS0_ELFLR0_EMLLn1_FDSI0_GRPM1_GRVWA8_GRVWB8_GSU1_GSUAMB_GSUC0_GSUWGMRR0_GLS0_ISA1151_IU1_K1_LDSTI0_LBSPPA128_LBSPPB128_LBSPPM0_LPA8_LPB8_LPM0_LRVW16_LWPMn1_MIAV1_MIWT4_2_MO40_MGRIPMn1_NTn1_NTA0_NTB0_NTC0_NTD0_NTM0_NEPBS0_NLCA1_NLCB1_ONLL1_PGR2_PLR0_PKA0_SGROBn1_SIA1_SS1_SU32_SUM1_SUS256_SPO0_SRVW0_SSO0_SVW1_SK0_SKFTR0_SKXCCM0_SGRO0_TDMI0_TIN0_TLDS1_TLDSM1_ULSGRO0_USL1_UIOFGRO0_UPLRP0_USFGROn1_VSn1_VWA1_VWB1_WSGRA0_WSGRB0_WS32_WG16_8_1_WGM8_WGMXCC1_WGMXCCGn1
    SolutionIndex: 39
    SolutionNameMin: Cijk_Alik_Bljk_BBS_BH_Bias_HA_S_SAV_UserArgs_MT64x64x32_MI16x16x1_SN_LDSB0_AFC1_AG0_AFEM1_AFEM1_ASEM1_CLR0_CADS0_DTLA0_DTLB0_DTVA0_DTVB0_DTVMXSA0_DTVMXSB0_DTVSM0_DPLBn1_EPS0_ELFLR0_EMLLn1_FDSI0_GRPM1_GRVWA8_GRVWB8_GSU1_GSUAMB_GSUC0_GSUWGMRR0_GLS0_ISA1151_IU1_K1_LDSTI0_LBSPPA128_LBSPPB128_LBSPPM0_LPA8_LPB8_LPM0_LRVW16_LWPMn1_MIAV1_MIWT2_2_MO40_MGRIPMn1_NTn1_NTA0_NTB0_NTC0_NTD0_NTM0_NEPBS0_NLCA1_NLCB1_ONLL1_PGR1_PLR0_PKA0_SGROBn1_SIA1_SS1_SU32_SUM1_SUS256_SPO0_SRVW0_SSO0_SVW1_SK0_SKFTR0_SKXCCM0_SGRO0_TDMI0_TIN0_TLDS1_TLDSM1_ULSGRO0_USL1_UIOFGRO0_UPLRP0_USFGROn1_VSn1_VWA1_VWB1_WSGRA0_WSGRB0_WS32_WG32_4_1_WGM8_WGMXCC1_WGMXCCGn1
    SolutionIndex: 40
    SolutionNameMin: Cijk_Alik_Bljk_BBS_BH_Bias_HA_S_SAV_UserArgs_MT64x64x64_MI16x16x1_SN_LDSB1_AFC1_AG0_AFEM1_AFEM1_ASEM1_CLR0_CADS0_DTLA0_DTLB0_DTVA0_DTVB0_DTVMXSA0_DTVMXSB0_DTVSM0_DPLBn1_EPS0_ELFLR0_EMLLn1_FDSI0_GRPM1_GRVWA8_GRVWB8_GSU1_GSUAMB_GSUC0_GSUWGMRR0_GLS0_ISA1151_IU1_K1_LDSTI0_LBSPPA128_LBSPPB128_LBSPPM0_LPA8_LPB8_LPM0_LRVW16_LWPMn1_MIAV1_MIWT2_2_MO40_MGRIPMn1_NTn1_NTA0_NTB0_NTC0_NTD0_NTM0_NEPBS0_NLCA1_NLCB1_ONLL1_PGR2_PLR1_PKA0_SGROBn1_SIA3_SS1_SU32_SUM1_SUS256_SPO0_SRVW0_SSO0_SVW1_SK0_SKFTR0_SKXCCM0_SGRO0_TDMI0_TIN0_TLDS1_TLDSM1_ULSGRO0_USL1_UIOFGRO0_UPLRP0_USFGROn1_VSn1_VWA1_VWB1_WSGRA0_WSGRB0_WS32_WG32_4_1_WGM8_WGMXCC1_WGMXCCGn1
    SolutionIndex: 41
    SolutionNameMin: Cijk_Alik_Bljk_BBS_BH_Bias_HA_S_SAV_UserArgs_MT160x64x32_MI16x16x1_SN_LDSB0_AFC1_AG0_AFEM1_AFEM1_ASEM1_CLR0_CADS0_DTLA0_DTLB0_DTVA0_DTVB0_DTVMXSA0_DTVMXSB0_DTVSM0_DPLBn1_EPS0_ELFLR0_EMLLn1_FDSI0_GRPM1_GRVWA8_GRVWB8_GSU1_GSUAMB_GSUC0_GSUWGMRR0_GLS0_ISA1151_IU1_K1_LDSTI0_LBSPPA128_LBSPPB128_LBSPPM0_LPA8_LPB8_LPM0_LRVW16_LWPMn1_MIAV1_MIWT5_2_MO40_MGRIPMn1_NTn1_NTA0_NTB0_NTC0_NTD0_NTM0_NEPBS0_NLCA1_NLCB1_ONLL1_PGR2_PLR1_PKA0_SGROBn1_SIA1_SS1_SU32_SUM1_SUS256_SPO0_SRVW0_SSO0_SVW1_SK0_SKFTR0_SKXCCM0_SGRO0_TDMI0_TIN0_TLDS1_TLDSM1_ULSGRO0_USL1_UIOFGRO0_UPLRP0_USFGROn1_VSn1_VWA1_VWB1_WSGRA0_WSGRB0_WS32_WG32_4_1_WGM8_WGMXCC1_WGMXCCGn1
    SolutionIndex: 42
    SolutionNameMin: Cijk_Alik_Bljk_BBS_BH_Bias_HA_S_SAV_UserArgs_MT64x64x128_MI16x16x1_SN_LDSB0_AFC1_AG0_AFEM1_AFEM1_ASEM1_CLR0_CADS0_DTLA0_DTLB0_DTVA0_DTVB0_DTVMXSA0_DTVMXSB0_DTVSM0_DPLBn1_EPS0_ELFLR0_EMLLn1_FDSI0_GRPM1_GRVWA8_GRVWB8_GSU1_GSUAMB_GSUC0_GSUWGMRR0_GLS0_ISA1151_IU1_K1_LDSTI0_LBSPPA256_LBSPPB256_LBSPPM0_LPA8_LPB8_LPM0_LRVW16_LWPMn1_MIAV1_MIWT2_2_MO40_MGRIPMn1_NTn1_NTA0_NTB0_NTC0_NTD0_NTM0_NEPBS0_NLCA1_NLCB1_ONLL1_PGR0_PLR0_PKA0_SGROBn1_SIA1_SS1_SU32_SUM1_SUS256_SPO0_SRVW0_SSO0_SVW1_SK0_SKFTR0_SKXCCM0_SGRO0_TDMI0_TIN0_TLDS1_TLDSM1_ULSGRO0_USL1_UIOFGRO0_UPLRP0_USFGROn1_VSn1_VWA1_VWB1_WSGRA0_WSGRB0_WS32_WG32_4_1_WGM8_WGMXCC1_WGMXCCGn1
    SolutionIndex: 43
    SolutionNameMin: Cijk_Alik_Bljk_BBS_BH_Bias_HA_S_SAV_UserArgs_MT80x128x32_MI16x16x1_SN_LDSB0_AFC1_AG0_AFEM1_AFEM1_ASEM1_CLR0_CADS0_DTLA0_DTLB0_DTVA0_DTVB0_DTVMXSA0_DTVMXSB0_DTVSM0_DPLBn1_EPS0_ELFLR0_EMLLn1_FDSI0_GRPM1_GRVWA4_GRVWB8_GSU1_GSUAMB_GSUC0_GSUWGMRR0_GLS0_ISA1151_IU1_K1_LDSTI0_LBSPPA128_LBSPPB128_LBSPPM0_LPA8_LPB8_LPM0_LRVW16_LWPMn1_MIAV1_MIWT5_2_MO40_MGRIPMn1_NTn1_NTA0_NTB0_NTC0_NTD0_NTM0_NEPBS0_NLCA1_NLCB1_ONLL1_PGR0_PLR1_PKA0_SGROBn1_SIA3_SS1_SU32_SUM1_SUS256_SPO0_SRVW0_SSO0_SVW1_SK0_SKFTR0_SKXCCM0_SGRO0_TDMI0_TIN0_TLDS1_TLDSM1_ULSGRO0_USL1_UIOFGRO0_UPLRP0_USFGROn1_VSn1_VWA1_VWB1_WSGRA0_WSGRB0_WS32_WG16_8_1_WGM8_WGMXCC1_WGMXCCGn1
    SolutionIndex: 44
    SolutionNameMin: Cijk_Alik_Bljk_BBS_BH_Bias_HA_S_SAV_UserArgs_MT80x128x64_MI16x16x1_SN_LDSB0_AFC1_AG0_AFEM1_AFEM1_ASEM1_CLR0_CADS0_DTLA0_DTLB0_DTVA0_DTVB0_DTVMXSA0_DTVMXSB0_DTVSM0_DPLBn1_EPS0_ELFLR0_EMLLn1_FDSI0_GRPM1_GRVWA8_GRVWB8_GSU1_GSUAMB_GSUC0_GSUWGMRR0_GLS0_ISA1151_IU1_K1_LDSTI0_LBSPPA128_LBSPPB128_LBSPPM0_LPA8_LPB8_LPM0_LRVW16_LWPMn1_MIAV1_MIWT5_2_MO40_MGRIPMn1_NTn1_NTA0_NTB0_NTC0_NTD0_NTM0_NEPBS0_NLCA1_NLCB1_ONLL1_PGR2_PLR0_PKA0_SGROBn1_SIA1_SS1_SU32_SUM1_SUS256_SPO0_SRVW0_SSO0_SVW1_SK0_SKFTR0_SKXCCM0_SGRO0_TDMI0_TIN0_TLDS1_TLDSM1_ULSGRO0_USL1_UIOFGRO0_UPLRP0_USFGROn1_VSn1_VWA1_VWB1_WSGRA0_WSGRB0_WS32_WG16_8_1_WGM8_WGMXCC1_WGMXCCGn1
    SolutionIndex: 45
    SolutionNameMin: Cijk_Alik_Bljk_BBS_BH_Bias_HA_S_SAV_UserArgs_MT80x128x32_MI16x16x1_SN_LDSB0_AFC1_AG0_AFEM1_AFEM1_ASEM1_CLR0_CADS0_DTLA0_DTLB0_DTVA0_DTVB0_DTVMXSA0_DTVMXSB0_DTVSM0_DPLBn1_EPS0_ELFLR0_EMLLn1_FDSI0_GRPM1_GRVWA4_GRVWB8_GSU1_GSUAMB_GSUC0_GSUWGMRR0_GLS0_ISA1151_IU1_K1_LDSTI0_LBSPPA128_LBSPPB128_LBSPPM0_LPA8_LPB8_LPM0_LRVW16_LWPMn1_MIAV1_MIWT5_2_MO40_MGRIPMn1_NTn1_NTA0_NTB0_NTC0_NTD0_NTM0_NEPBS0_NLCA1_NLCB1_ONLL1_PGR2_PLR1_PKA0_SGROBn1_SIA3_SS1_SU32_SUM1_SUS256_SPO0_SRVW0_SSO0_SVW1_SK0_SKFTR0_SKXCCM0_SGRO0_TDMI0_TIN0_TLDS1_TLDSM1_ULSGRO0_USL1_UIOFGRO0_UPLRP0_USFGROn1_VSn1_VWA1_VWB1_WSGRA0_WSGRB0_WS32_WG16_8_1_WGM8_WGMXCC1_WGMXCCGn1
    SolutionIndex: 46
    SolutionNameMin: Cijk_Alik_Bljk_BBS_BH_Bias_HA_S_SAV_UserArgs_MT16x16x128_MI16x16x1_SN_LDSB0_AFC1_AG0_AFEM1_AFEM1_ASEM1_CLR0_CADS0_DTLA0_DTLB0_DTVA0_DTVB0_DTVMXSA0_DTVMXSB0_DTVSM0_DPLBn1_EPS0_ELFLR0_EMLLn1_FDSI0_GRPM1_GRVWA8_GRVWB8_GSU1_GSUAMB_GSUC0_GSUWGMRR0_GLS0_ISA1151_IU1_K1_LDSTI0_LBSPPA256_LBSPPB256_LBSPPM0_LPA8_LPB8_LPM0_LRVW16_LWPMn1_MIAV1_MIWT1_1_MO40_MGRIPMn1_NTn1_NTA0_NTB0_NTC0_NTD0_NTM0_NEPBS0_NLCA1_NLCB1_ONLL1_PGR1_PLR1_PKA0_SGROBn1_SIA1_SS1_SU32_SUM1_SUS256_SPO0_SRVW0_SSO0_SVW1_SK0_SKFTR0_SKXCCM0_SGRO0_TDMI0_TIN0_TLDS1_TLDSM1_ULSGRO0_USL1_UIOFGRO0_UPLRP0_USFGROn1_VSn1_VWA1_VWB1_WSGRA0_WSGRB0_WS32_WG16_2_1_WGM8_WGMXCC1_WGMXCCGn1
    SolutionIndex: 47
    SolutionNameMin: Cijk_Alik_Bljk_BBS_BH_Bias_HA_S_SAV_UserArgs_MT32x16x32_MI16x16x1_SN_LDSB0_AFC1_AG0_AFEM1_AFEM1_ASEM1_CLR0_CADS0_DTLA0_DTLB0_DTVA0_DTVB0_DTVMXSA0_DTVMXSB0_DTVSM0_DPLBn1_EPS0_ELFLR0_EMLLn1_FDSI0_GRPM1_GRVWA8_GRVWB8_GSU1_GSUAMB_GSUC0_GSUWGMRR0_GLS0_ISA1151_IU1_K1_LDSTI0_LBSPPA128_LBSPPB128_LBSPPM0_LPA8_LPB8_LPM0_LRVW16_LWPMn1_MIAV1_MIWT1_1_MO40_MGRIPMn1_NTn1_NTA0_NTB0_NTC0_NTD0_NTM0_NEPBS0_NLCA1_NLCB1_ONLL1_PGR1_PLR1_PKA0_SGROBn1_SIA1_SS1_SU32_SUM1_SUS256_SPO0_SRVW0_SSO0_SVW1_SK0_SKFTR0_SKXCCM0_SGRO0_TDMI0_TIN0_TLDS1_TLDSM1_ULSGRO0_USL1_UIOFGRO0_UPLRP0_USFGROn1_VSn1_VWA1_VWB1_WSGRA0_WSGRB0_WS32_WG32_2_1_WGM8_WGMXCC1_WGMXCCGn1
    SolutionIndex: 48
    SolutionNameMin: Cijk_Alik_Bljk_BBS_BH_Bias_HA_S_SAV_UserArgs_MT32x16x128_MI16x16x1_SN_LDSB0_AFC1_AG0_AFEM1_AFEM1_ASEM1_CLR0_CADS0_DTLA0_DTLB0_DTVA0_DTVB0_DTVMXSA0_DTVMXSB0_DTVSM0_DPLBn1_EPS0_ELFLR0_EMLLn1_FDSI0_GRPM1_GRVWA8_GRVWB8_GSU1_GSUAMB_GSUC0_GSUWGMRR0_GLS0_ISA1151_IU1_K1_LDSTI0_LBSPPA256_LBSPPB256_LBSPPM0_LPA8_LPB8_LPM0_LRVW16_LWPMn1_MIAV1_MIWT1_1_MO40_MGRIPMn1_NTn1_NTA0_NTB0_NTC0_NTD0_NTM0_NEPBS0_NLCA1_NLCB1_ONLL1_PGR1_PLR1_PKA0_SGROBn1_SIA1_SS1_SU32_SUM1_SUS256_SPO0_SRVW0_SSO0_SVW1_SK0_SKFTR0_SKXCCM0_SGRO0_TDMI0_TIN0_TLDS1_TLDSM1_ULSGRO0_USL1_UIOFGRO0_UPLRP0_USFGROn1_VSn1_VWA1_VWB1_WSGRA0_WSGRB0_WS32_WG32_2_1_WGM8_WGMXCC1_WGMXCCGn1
    SolutionIndex: 49
    SolutionNameMin: Cijk_Alik_Bljk_BBS_BH_Bias_HA_S_SAV_UserArgs_MT32x16x64_MI16x16x1_SN_LDSB0_AFC1_AG0_AFEM1_AFEM1_ASEM1_CLR0_CADS0_DTLA0_DTLB0_DTVA0_DTVB0_DTVMXSA0_DTVMXSB0_DTVSM0_DPLBn1_EPS0_ELFLR0_EMLLn1_FDSI0_GRPM1_GRVWA8_GRVWB8_GSU1_GSUAMB_GSUC0_GSUWGMRR0_GLS0_ISA1151_IU1_K1_LDSTI0_LBSPPA128_LBSPPB128_LBSPPM0_LPA8_LPB8_LPM0_LRVW16_LWPMn1_MIAV1_MIWT1_1_MO40_MGRIPMn1_NTn1_NTA0_NTB0_NTC0_NTD0_NTM0_NEPBS0_NLCA1_NLCB1_ONLL1_PGR2_PLR1_PKA0_SGROBn1_SIA1_SS1_SU32_SUM1_SUS256_SPO0_SRVW0_SSO0_SVW1_SK0_SKFTR0_SKXCCM0_SGRO0_TDMI0_TIN0_TLDS1_TLDSM1_ULSGRO0_USL1_UIOFGRO0_UPLRP0_USFGROn1_VSn1_VWA1_VWB1_WSGRA0_WSGRB0_WS32_WG32_2_1_WGM8_WGMXCC1_WGMXCCGn1
    SolutionIndex: 50
    SolutionNameMin: Cijk_Alik_Bljk_BBS_BH_Bias_HA_S_SAV_UserArgs_MT16x64x64_MI16x16x1_SN_LDSB0_AFC1_AG0_AFEM1_AFEM1_ASEM1_CLR0_CADS0_DTLA0_DTLB0_DTVA0_DTVB0_DTVMXSA0_DTVMXSB0_DTVSM0_DPLBn1_EPS0_ELFLR0_EMLLn1_FDSI0_GRPM1_GRVWA8_GRVWB8_GSU1_GSUAMB_GSUC0_GSUWGMRR0_GLS0_ISA1151_IU1_K1_LDSTI0_LBSPPA128_LBSPPB128_LBSPPM0_LPA8_LPB8_LPM0_LRVW16_LWPMn1_MIAV1_MIWT1_1_MO40_MGRIPMn1_NTn1_NTA0_NTB0_NTC0_NTD0_NTM0_NEPBS0_NLCA1_NLCB1_ONLL1_PGR1_PLR1_PKA0_SGROBn1_SIA1_SS1_SU32_SUM1_SUS256_SPO0_SRVW0_SSO0_SVW1_SK0_SKFTR0_SKXCCM0_SGRO0_TDMI0_TIN0_TLDS1_TLDSM1_ULSGRO0_USL1_UIOFGRO0_UPLRP0_USFGROn1_VSn1_VWA1_VWB1_WSGRA0_WSGRB0_WS32_WG16_8_1_WGM8_WGMXCC1_WGMXCCGn1
    SolutionIndex: 51
    SolutionNameMin: Cijk_Alik_Bljk_BBS_BH_Bias_HA_S_SAV_UserArgs_MT32x16x32_MI16x16x1_SN_LDSB0_AFC1_AG0_AFEM1_AFEM1_ASEM1_CLR0_CADS0_DTLA0_DTLB0_DTVA0_DTVB0_DTVMXSA0_DTVMXSB0_DTVSM0_DPLBn1_EPS0_ELFLR0_EMLLn1_FDSI0_GRPM1_GRVWA8_GRVWB8_GSU1_GSUAMB_GSUC0_GSUWGMRR0_GLS0_ISA1151_IU1_K1_LDSTI0_LBSPPA128_LBSPPB128_LBSPPM0_LPA8_LPB8_LPM0_LRVW16_LWPMn1_MIAV1_MIWT1_1_MO40_MGRIPMn1_NTn1_NTA0_NTB0_NTC0_NTD0_NTM0_NEPBS0_NLCA1_NLCB1_ONLL1_PGR2_PLR1_PKA0_SGROBn1_SIA1_SS1_SU32_SUM1_SUS256_SPO0_SRVW0_SSO0_SVW1_SK0_SKFTR0_SKXCCM0_SGRO0_TDMI0_TIN0_TLDS1_TLDSM1_ULSGRO0_USL1_UIOFGRO0_UPLRP0_USFGROn1_VSn1_VWA1_VWB1_WSGRA0_WSGRB0_WS32_WG32_2_1_WGM8_WGMXCC1_WGMXCCGn1
    SolutionIndex: 52
    SolutionNameMin: Cijk_Alik_Bljk_BBS_BH_Bias_HA_S_SAV_UserArgs_MT32x32x64_MI16x16x1_SN_LDSB0_AFC1_AG0_AFEM1_AFEM1_ASEM1_CLR0_CADS0_DTLA0_DTLB0_DTVA0_DTVB0_DTVMXSA0_DTVMXSB0_DTVSM0_DPLBn1_EPS0_ELFLR0_EMLLn1_FDSI0_GRPM1_GRVWA8_GRVWB8_GSU1_GSUAMB_GSUC0_GSUWGMRR0_GLS0_ISA1151_IU1_K1_LDSTI0_LBSPPA128_LBSPPB128_LBSPPM0_LPA8_LPB8_LPM0_LRVW16_LWPMn1_MIAV1_MIWT1_1_MO40_MGRIPMn1_NTn1_NTA0_NTB0_NTC0_NTD0_NTM0_NEPBS0_NLCA1_NLCB1_ONLL1_PGR2_PLR1_PKA0_SGROBn1_SIA1_SS1_SU32_SUM1_SUS256_SPO0_SRVW0_SSO0_SVW1_SK0_SKFTR0_SKXCCM0_SGRO0_TDMI0_TIN0_TLDS1_TLDSM1_ULSGRO0_USL1_UIOFGRO0_UPLRP0_USFGROn1_VSn1_VWA1_VWB1_WSGRA0_WSGRB0_WS32_WG32_4_1_WGM8_WGMXCC1_WGMXCCGn1
    SolutionIndex: 53
    SolutionNameMin: Cijk_Alik_Bljk_BBS_BH_Bias_HA_S_SAV_UserArgs_MT64x32x32_MI16x16x1_SN_LDSB0_AFC1_AG0_AFEM1_AFEM1_ASEM1_CLR0_CADS0_DTLA0_DTLB0_DTVA0_DTVB0_DTVMXSA0_DTVMXSB0_DTVSM0_DPLBn1_EPS0_ELFLR0_EMLLn1_FDSI0_GRPM1_GRVWA8_GRVWB8_GSU1_GSUAMB_GSUC0_GSUWGMRR0_GLS0_ISA1151_IU1_K1_LDSTI0_LBSPPA128_LBSPPB128_LBSPPM0_LPA8_LPB8_LPM0_LRVW16_LWPMn1_MIAV1_MIWT1_2_MO40_MGRIPMn1_NTn1_NTA0_NTB0_NTC0_NTD0_NTM0_NEPBS0_NLCA1_NLCB1_ONLL1_PGR2_PLR0_PKA0_SGROBn1_SIA1_SS1_SU32_SUM1_SUS256_SPO0_SRVW0_SSO0_SVW1_SK0_SKFTR0_SKXCCM0_SGRO0_TDMI0_TIN0_TLDS1_TLDSM1_ULSGRO0_USL1_UIOFGRO0_UPLRP0_USFGROn1_VSn1_VWA1_VWB1_WSGRA0_WSGRB0_WS32_WG64_2_1_WGM8_WGMXCC1_WGMXCCGn1
    SolutionIndex: 54
    SolutionNameMin: Cijk_Alik_Bljk_BBS_BH_Bias_HA_S_SAV_UserArgs_MT64x32x64_MI16x16x1_SN_LDSB0_AFC1_AG0_AFEM1_AFEM1_ASEM1_CLR0_CADS0_DTLA0_DTLB0_DTVA0_DTVB0_DTVMXSA0_DTVMXSB0_DTVSM0_DPLBn1_EPS0_ELFLR0_EMLLn1_FDSI0_GRPM1_GRVWA8_GRVWB8_GSU1_GSUAMB_GSUC0_GSUWGMRR0_GLS0_ISA1151_IU1_K1_LDSTI0_LBSPPA128_LBSPPB128_LBSPPM0_LPA8_LPB8_LPM0_LRVW16_LWPMn1_MIAV1_MIWT1_2_MO40_MGRIPMn1_NTn1_NTA0_NTB0_NTC0_NTD0_NTM0_NEPBS0_NLCA1_NLCB1_ONLL1_PGR1_PLR1_PKA0_SGROBn1_SIA1_SS1_SU32_SUM1_SUS256_SPO0_SRVW0_SSO0_SVW1_SK0_SKFTR0_SKXCCM0_SGRO0_TDMI0_TIN0_TLDS1_TLDSM1_ULSGRO0_USL1_UIOFGRO0_UPLRP0_USFGROn1_VSn1_VWA1_VWB1_WSGRA0_WSGRB0_WS32_WG64_2_1_WGM8_WGMXCC1_WGMXCCGn1
    SolutionIndex: 55
    SolutionNameMin: Cijk_Alik_Bljk_BBS_BH_Bias_HA_S_SAV_UserArgs_MT32x64x32_MI16x16x1_SN_LDSB0_AFC1_AG0_AFEM1_AFEM1_ASEM1_CLR0_CADS0_DTLA0_DTLB0_DTVA0_DTVB0_DTVMXSA0_DTVMXSB0_DTVSM0_DPLBn1_EPS0_ELFLR0_EMLLn1_FDSI0_GRPM1_GRVWA8_GRVWB8_GSU1_GSUAMB_GSUC0_GSUWGMRR0_GLS0_ISA1151_IU1_K1_LDSTI0_LBSPPA128_LBSPPB128_LBSPPM0_LPA8_LPB8_LPM0_LRVW16_LWPMn1_MIAV1_MIWT2_1_MO40_MGRIPMn1_NTn1_NTA0_NTB0_NTC0_NTD0_NTM0_NEPBS0_NLCA1_NLCB1_ONLL1_PGR2_PLR0_PKA0_SGROBn1_SIA1_SS1_SU32_SUM1_SUS256_SPO0_SRVW0_SSO0_SVW1_SK0_SKFTR0_SKXCCM0_SGRO0_TDMI0_TIN0_TLDS1_TLDSM1_ULSGRO0_USL1_UIOFGRO0_UPLRP0_USFGROn1_VSn1_VWA1_VWB1_WSGRA0_WSGRB0_WS32_WG16_8_1_WGM8_WGMXCC1_WGMXCCGn1
    SolutionIndex: 56
    SolutionNameMin: Cijk_Alik_Bljk_BBS_BH_Bias_HA_S_SAV_UserArgs_MT64x64x64_MI16x16x1_SN_LDSB0_AFC1_AG0_AFEM1_AFEM1_ASEM1_CLR0_CADS0_DTLA0_DTLB0_DTVA0_DTVB0_DTVMXSA0_DTVMXSB0_DTVSM0_DPLBn1_EPS0_ELFLR0_EMLLn1_FDSI0_GRPM1_GRVWA8_GRVWB8_GSU1_GSUAMB_GSUC0_GSUWGMRR0_GLS0_ISA1151_IU1_K1_LDSTI0_LBSPPA128_LBSPPB128_LBSPPM0_LPA8_LPB8_LPM0_LRVW16_LWPMn1_MIAV1_MIWT2_2_MO40_MGRIPMn1_NTn1_NTA0_NTB0_NTC0_NTD0_NTM0_NEPBS0_NLCA1_NLCB1_ONLL1_PGR2_PLR1_PKA0_SGROBn1_SIA1_SS1_SU32_SUM1_SUS256_SPO0_SRVW0_SSO0_SVW1_SK0_SKFTR0_SKXCCM0_SGRO0_TDMI0_TIN0_TLDS1_TLDSM1_ULSGRO0_USL1_UIOFGRO0_UPLRP0_USFGROn1_VSn1_VWA1_VWB1_WSGRA0_WSGRB0_WS32_WG32_4_1_WGM8_WGMXCC1_WGMXCCGn1
    SolutionIndex: 57
    SolutionNameMin: Cijk_Alik_Bljk_BBS_BH_Bias_HA_S_SAV_UserArgs_MT64x16x128_MI16x16x1_SN_LDSB0_AFC1_AG0_AFEM1_AFEM1_ASEM1_CLR0_CADS0_DTLA0_DTLB0_DTVA0_DTVB0_DTVMXSA0_DTVMXSB0_DTVSM0_DPLBn1_EPS0_ELFLR0_EMLLn1_FDSI0_GRPM1_GRVWA8_GRVWB8_GSU1_GSUAMB_GSUC0_GSUWGMRR0_GLS0_ISA1151_IU1_K1_LDSTI0_LBSPPA256_LBSPPB256_LBSPPM0_LPA8_LPB8_LPM0_LRVW16_LWPMn1_MIAV1_MIWT1_1_MO40_MGRIPMn1_NTn1_NTA0_NTB0_NTC0_NTD0_NTM0_NEPBS0_NLCA1_NLCB1_ONLL1_PGR2_PLR1_PKA0_SGROBn1_SIA1_SS1_SU32_SUM1_SUS256_SPO0_SRVW0_SSO0_SVW1_SK0_SKFTR0_SKXCCM0_SGRO0_TDMI0_TIN0_TLDS1_TLDSM1_ULSGRO0_USL1_UIOFGRO0_UPLRP0_USFGROn1_VSn1_VWA1_VWB1_WSGRA0_WSGRB0_WS32_WG64_2_1_WGM8_WGMXCC1_WGMXCCGn1
    SolutionIndex: 58
    SolutionNameMin: Cijk_Alik_Bljk_BBS_BH_Bias_HA_S_SAV_UserArgs_MT32x32x64_MI16x16x1_SN_LDSB0_AFC1_AG0_AFEM1_AFEM1_ASEM1_CLR0_CADS0_DTLA0_DTLB0_DTVA0_DTVB0_DTVMXSA0_DTVMXSB0_DTVSM0_DPLBn1_EPS0_ELFLR0_EMLLn1_FDSI0_GRPM1_GRVWA8_GRVWB8_GSU1_GSUAMB_GSUC0_GSUWGMRR0_GLS0_ISA1151_IU1_K1_LDSTI0_LBSPPA128_LBSPPB128_LBSPPM0_LPA8_LPB8_LPM0_LRVW16_LWPMn1_MIAV1_MIWT1_1_MO40_MGRIPMn1_NTn1_NTA0_NTB0_NTC0_NTD0_NTM0_NEPBS0_NLCA1_NLCB1_ONLL1_PGR1_PLR1_PKA0_SGROBn1_SIA1_SS1_SU32_SUM1_SUS256_SPO0_SRVW0_SSO0_SVW1_SK0_SKFTR0_SKXCCM0_SGRO0_TDMI0_TIN0_TLDS1_TLDSM1_ULSGRO0_USL1_UIOFGRO0_UPLRP0_USFGROn1_VSn1_VWA1_VWB1_WSGRA0_WSGRB0_WS32_WG32_4_1_WGM8_WGMXCC1_WGMXCCGn1
    SolutionIndex: 59
    SolutionNameMin: Cijk_Alik_Bljk_BBS_BH_Bias_HA_S_SAV_UserArgs_MT64x32x32_MI16x16x1_SN_LDSB0_AFC1_AG0_AFEM1_AFEM1_ASEM1_CLR0_CADS0_DTLA0_DTLB0_DTVA0_DTVB0_DTVMXSA0_DTVMXSB0_DTVSM0_DPLBn1_EPS0_ELFLR0_EMLLn1_FDSI0_GRPM1_GRVWA8_GRVWB8_GSU1_GSUAMB_GSUC0_GSUWGMRR0_GLS0_ISA1151_IU1_K1_LDSTI0_LBSPPA128_LBSPPB128_LBSPPM0_LPA8_LPB8_LPM0_LRVW16_LWPMn1_MIAV1_MIWT2_1_MO40_MGRIPMn1_NTn1_NTA0_NTB0_NTC0_NTD0_NTM0_NEPBS0_NLCA1_NLCB1_ONLL1_PGR1_PLR1_PKA0_SGROBn1_SIA1_SS1_SU32_SUM1_SUS256_SPO0_SRVW0_SSO0_SVW1_SK0_SKFTR0_SKXCCM0_SGRO0_TDMI0_TIN0_TLDS1_TLDSM1_ULSGRO0_USL1_UIOFGRO0_UPLRP0_USFGROn1_VSn1_VWA1_VWB1_WSGRA0_WSGRB0_WS32_WG32_4_1_WGM8_WGMXCC1_WGMXCCGn1
    SolutionIndex: 60
    SolutionNameMin: Cijk_Alik_Bljk_BBS_BH_Bias_HA_S_SAV_UserArgs_MT16x64x32_MI16x16x1_SN_LDSB0_AFC1_AG0_AFEM1_AFEM1_ASEM1_CLR0_CADS0_DTLA0_DTLB0_DTVA0_DTVB0_DTVMXSA0_DTVMXSB0_DTVSM0_DPLBn1_EPS0_ELFLR0_EMLLn1_FDSI0_GRPM1_GRVWA4_GRVWB8_GSU1_GSUAMB_GSUC0_GSUWGMRR0_GLS0_ISA1151_IU1_K1_LDSTI0_LBSPPA128_LBSPPB128_LBSPPM0_LPA8_LPB8_LPM0_LRVW16_LWPMn1_MIAV1_MIWT1_1_MO40_MGRIPMn1_NTn1_NTA0_NTB0_NTC0_NTD0_NTM0_NEPBS0_NLCA1_NLCB1_ONLL1_PGR2_PLR1_PKA0_SGROBn1_SIA1_SS1_SU32_SUM1_SUS256_SPO0_SRVW0_SSO0_SVW1_SK0_SKFTR0_SKXCCM0_SGRO0_TDMI0_TIN0_TLDS1_TLDSM1_ULSGRO0_USL1_UIOFGRO0_UPLRP0_USFGROn1_VSn1_VWA1_VWB1_WSGRA0_WSGRB0_WS32_WG16_8_1_WGM8_WGMXCC1_WGMXCCGn1
    SolutionIndex: 61
    SolutionNameMin: Cijk_Alik_Bljk_BBS_BH_Bias_HA_S_SAV_UserArgs_MT32x32x128_MI16x16x1_SN_LDSB0_AFC1_AG0_AFEM1_AFEM1_ASEM1_CLR0_CADS0_DTLA0_DTLB0_DTVA0_DTVB0_DTVMXSA0_DTVMXSB0_DTVSM0_DPLBn1_EPS0_ELFLR0_EMLLn1_FDSI0_GRPM1_GRVWA8_GRVWB8_GSU1_GSUAMB_GSUC0_GSUWGMRR0_GLS0_ISA1151_IU1_K1_LDSTI0_LBSPPA256_LBSPPB256_LBSPPM0_LPA8_LPB8_LPM0_LRVW16_LWPMn1_MIAV1_MIWT1_1_MO40_MGRIPMn1_NTn1_NTA0_NTB0_NTC0_NTD0_NTM0_NEPBS0_NLCA1_NLCB1_ONLL1_PGR2_PLR1_PKA0_SGROBn1_SIA1_SS1_SU32_SUM1_SUS256_SPO0_SRVW0_SSO0_SVW1_SK0_SKFTR0_SKXCCM0_SGRO0_TDMI0_TIN0_TLDS1_TLDSM1_ULSGRO0_USL1_UIOFGRO0_UPLRP0_USFGROn1_VSn1_VWA1_VWB1_WSGRA0_WSGRB0_WS32_WG32_4_1_WGM8_WGMXCC1_WGMXCCGn1
    SolutionIndex: 62
    SolutionNameMin: Cijk_Alik_Bljk_BBS_BH_Bias_HA_S_SAV_UserArgs_MT128x16x16_MI16x16x1_SN_LDSB0_AFC1_AG0_AFEM1_AFEM1_ASEM1_CLR0_CADS0_DTLA0_DTLB0_DTVA0_DTVB0_DTVMXSA0_DTVMXSB0_DTVSM0_DPLBn1_EPS0_ELFLR0_EMLLn1_FDSI0_GRPM1_GRVWA8_GRVWB2_GSU1_GSUAMB_GSUC0_GSUWGMRR0_GLS0_ISA1151_IU1_K1_LDSTI0_LBSPPA128_LBSPPB128_LBSPPM0_LPA8_LPB8_LPM0_LRVW16_LWPMn1_MIAV1_MIWT2_1_MO40_MGRIPMn1_NTn1_NTA0_NTB0_NTC0_NTD0_NTM0_NEPBS0_NLCA1_NLCB1_ONLL1_PGR2_PLR0_PKA0_SGROBn1_SIA1_SS1_SU32_SUM1_SUS256_SPO0_SRVW0_SSO0_SVW1_SK0_SKFTR0_SKXCCM0_SGRO0_TDMI0_TIN0_TLDS1_TLDSM1_ULSGRO0_USL1_UIOFGRO0_UPLRP0_USFGROn1_VSn1_VWA1_VWB1_WSGRA0_WSGRB0_WS32_WG64_2_1_WGM8_WGMXCC1_WGMXCCGn1
    SolutionIndex: 63
    SolutionNameMin: Cijk_Alik_Bljk_BBS_BH_Bias_HA_S_SAV_UserArgs_MT32x64x64_MI16x16x1_SN_LDSB0_AFC1_AG0_AFEM1_AFEM1_ASEM1_CLR0_CADS0_DTLA0_DTLB0_DTVA0_DTVB0_DTVMXSA0_DTVMXSB0_DTVSM0_DPLBn1_EPS0_ELFLR0_EMLLn1_FDSI0_GRPM1_GRVWA8_GRVWB8_GSU1_GSUAMB_GSUC0_GSUWGMRR0_GLS0_ISA1151_IU1_K1_LDSTI0_LBSPPA128_LBSPPB128_LBSPPM0_LPA8_LPB8_LPM0_LRVW16_LWPMn1_MIAV1_MIWT1_2_MO40_MGRIPMn1_NTn1_NTA0_NTB0_NTC0_NTD0_NTM0_NEPBS0_NLCA1_NLCB1_ONLL1_PGR2_PLR1_PKA0_SGROBn1_SIA1_SS1_SU32_SUM1_SUS256_SPO0_SRVW0_SSO0_SVW1_SK0_SKFTR0_SKXCCM0_SGRO0_TDMI0_TIN0_TLDS1_TLDSM1_ULSGRO0_USL1_UIOFGRO0_UPLRP0_USFGROn1_VSn1_VWA1_VWB1_WSGRA0_WSGRB0_WS32_WG32_4_1_WGM8_WGMXCC1_WGMXCCGn1
    SolutionIndex: 64
    SolutionNameMin: Cijk_Alik_Bljk_BBS_BH_Bias_HA_S_SAV_UserArgs_MT64x64x16_MI16x16x1_SN_LDSB0_AFC1_AG0_AFEM1_AFEM1_ASEM1_CLR0_CADS0_DTLA0_DTLB0_DTVA0_DTVB0_DTVMXSA0_DTVMXSB0_DTVSM0_DPLBn1_EPS0_ELFLR0_EMLLn1_FDSI0_GRPM1_GRVWA8_GRVWB8_GSU1_GSUAMB_GSUC0_GSUWGMRR0_GLS0_ISA1151_IU1_K1_LDSTI0_LBSPPA128_LBSPPB128_LBSPPM0_LPA8_LPB8_LPM0_LRVW16_LWPMn1_MIAV1_MIWT2_2_MO40_MGRIPMn1_NTn1_NTA0_NTB0_NTC0_NTD0_NTM0_NEPBS0_NLCA1_NLCB1_ONLL1_PGR1_PLR0_PKA0_SGROBn1_SIA1_SS1_SU32_SUM1_SUS256_SPO0_SRVW0_SSO0_SVW1_SK0_SKFTR0_SKXCCM0_SGRO0_TDMI0_TIN0_TLDS1_TLDSM1_ULSGRO0_USL1_UIOFGRO0_UPLRP0_USFGROn1_VSn1_VWA1_VWB1_WSGRA0_WSGRB0_WS32_WG32_4_1_WGM8_WGMXCC1_WGMXCCGn1
    SolutionIndex: 65
    SolutionNameMin: Cijk_Alik_Bljk_BBS_BH_Bias_HA_S_SAV_UserArgs_MT128x64x32_MI16x16x1_SN_LDSB0_AFC1_AG0_AFEM1_AFEM1_ASEM1_CLR0_CADS0_DTLA0_DTLB0_DTVA0_DTVB0_DTVMXSA0_DTVMXSB0_DTVSM0_DPLBn1_EPS0_ELFLR0_EMLLn1_FDSI0_GRPM1_GRVWA8_GRVWB8_GSU1_GSUAMB_GSUC0_GSUWGMRR0_GLS0_ISA1151_IU1_K1_LDSTI0_LBSPPA128_LBSPPB128_LBSPPM0_LPA8_LPB8_LPM0_LRVW16_LWPMn1_MIAV1_MIWT2_4_MO40_MGRIPMn1_NTn1_NTA0_NTB0_NTC0_NTD0_NTM0_NEPBS0_NLCA1_NLCB1_ONLL1_PGR2_PLR0_PKA0_SGROBn1_SIA1_SS1_SU32_SUM1_SUS256_SPO0_SRVW0_SSO0_SVW1_SK0_SKFTR0_SKXCCM0_SGRO0_TDMI0_TIN0_TLDS1_TLDSM1_ULSGRO0_USL1_UIOFGRO0_UPLRP0_USFGROn1_VSn1_VWA1_VWB1_WSGRA0_WSGRB0_WS32_WG64_2_1_WGM8_WGMXCC1_WGMXCCGn1
    SolutionIndex: 66
    SolutionNameMin: Cijk_Alik_Bljk_BBS_BH_Bias_HA_S_SAV_UserArgs_MT16x16x128_MI16x16x1_SN_LDSB0_AFC1_AG0_AFEM1_AFEM1_ASEM1_CLR0_CADS0_DTLA0_DTLB0_DTVA0_DTVB0_DTVMXSA0_DTVMXSB0_DTVSM0_DPLBn1_EPS0_ELFLR0_EMLLn1_FDSI0_GRPM1_GRVWA8_GRVWB8_GSU1_GSUAMB_GSUC0_GSUWGMRR0_GLS0_ISA1151_IU1_K1_LDSTI0_LBSPPA256_LBSPPB256_LBSPPM0_LPA8_LPB8_LPM0_LRVW16_LWPMn1_MIAV1_MIWT1_1_MO40_MGRIPMn1_NTn1_NTA0_NTB0_NTC0_NTD0_NTM0_NEPBS0_NLCA1_NLCB1_ONLL1_PGR2_PLR1_PKA0_SGROBn1_SIA1_SS1_SU32_SUM1_SUS256_SPO0_SRVW0_SSO0_SVW1_SK0_SKFTR0_SKXCCM0_SGRO0_TDMI0_TIN0_TLDS1_TLDSM1_ULSGRO0_USL1_UIOFGRO0_UPLRP0_USFGROn1_VSn1_VWA1_VWB1_WSGRA0_WSGRB0_WS32_WG16_2_1_WGM8_WGMXCC1_WGMXCCGn1
    SolutionIndex: 67
    SolutionNameMin: Cijk_Alik_Bljk_BBS_BH_Bias_HA_S_SAV_UserArgs_MT48x64x64_MI16x16x1_SN_LDSB0_AFC1_AG0_AFEM1_AFEM1_ASEM1_CLR0_CADS0_DTLA0_DTLB0_DTVA0_DTVB0_DTVMXSA0_DTVMXSB0_DTVSM0_DPLBn1_EPS0_ELFLR0_EMLLn1_FDSI0_GRPM1_GRVWA8_GRVWB8_GSU1_GSUAMB_GSUC0_GSUWGMRR0_GLS0_ISA1151_IU1_K1_LDSTI0_LBSPPA128_LBSPPB128_LBSPPM0_LPA8_LPB8_LPM0_LRVW16_LWPMn1_MIAV1_MIWT3_1_MO40_MGRIPMn1_NTn1_NTA0_NTB0_NTC0_NTD0_NTM0_NEPBS0_NLCA1_NLCB1_ONLL1_PGR2_PLR1_PKA0_SGROBn1_SIA1_SS1_SU32_SUM1_SUS256_SPO0_SRVW0_SSO0_SVW1_SK0_SKFTR0_SKXCCM0_SGRO0_TDMI0_TIN0_TLDS1_TLDSM1_ULSGRO0_USL1_UIOFGRO0_UPLRP0_USFGROn1_VSn1_VWA1_VWB1_WSGRA0_WSGRB0_WS32_WG16_8_1_WGM8_WGMXCC1_WGMXCCGn1
    SolutionIndex: 68
    SolutionNameMin: Cijk_Alik_Bljk_BBS_BH_Bias_HA_S_SAV_UserArgs_MT96x32x16_MI16x16x1_SN_LDSB0_AFC1_AG0_AFEM1_AFEM1_ASEM1_CLR0_CADS0_DTLA0_DTLB0_DTVA0_DTVB0_DTVMXSA0_DTVMXSB0_DTVSM0_DPLBn1_EPS0_ELFLR0_EMLLn1_FDSI0_GRPM1_GRVWA4_GRVWB4_GSU1_GSUAMB_GSUC0_GSUWGMRR0_GLS0_ISA1151_IU1_K1_LDSTI0_LBSPPA128_LBSPPB128_LBSPPM0_LPA8_LPB8_LPM0_LRVW16_LWPMn1_MIAV1_MIWT3_1_MO40_MGRIPMn1_NTn1_NTA0_NTB0_NTC0_NTD0_NTM0_NEPBS0_NLCA1_NLCB1_ONLL1_PGR1_PLR1_PKA0_SGROBn1_SIA1_SS1_SU32_SUM1_SUS256_SPO0_SRVW0_SSO0_SVW1_SK0_SKFTR0_SKXCCM0_SGRO0_TDMI0_TIN0_TLDS1_TLDSM1_ULSGRO0_USL1_UIOFGRO0_UPLRP0_USFGROn1_VSn1_VWA1_VWB1_WSGRA0_WSGRB0_WS32_WG32_4_1_WGM8_WGMXCC1_WGMXCCGn1
    SolutionIndex: 69
    SolutionNameMin: Cijk_Alik_Bljk_BBS_BH_Bias_HA_S_SAV_UserArgs_MT64x32x16_MI16x16x1_SN_LDSB0_AFC1_AG0_AFEM1_AFEM1_ASEM1_CLR0_CADS0_DTLA0_DTLB0_DTVA0_DTVB0_DTVMXSA0_DTVMXSB0_DTVSM0_DPLBn1_EPS0_ELFLR0_EMLLn1_FDSI0_GRPM1_GRVWA8_GRVWB4_GSU1_GSUAMB_GSUC0_GSUWGMRR0_GLS0_ISA1151_IU1_K1_LDSTI0_LBSPPA128_LBSPPB128_LBSPPM0_LPA8_LPB8_LPM0_LRVW16_LWPMn1_MIAV1_MIWT1_2_MO40_MGRIPMn1_NTn1_NTA0_NTB0_NTC0_NTD0_NTM0_NEPBS0_NLCA1_NLCB1_ONLL1_PGR2_PLR0_PKA0_SGROBn1_SIA1_SS1_SU32_SUM1_SUS256_SPO0_SRVW0_SSO0_SVW1_SK0_SKFTR0_SKXCCM0_SGRO0_TDMI0_TIN0_TLDS1_TLDSM1_ULSGRO0_USL1_UIOFGRO0_UPLRP0_USFGROn1_VSn1_VWA1_VWB1_WSGRA0_WSGRB0_WS32_WG64_2_1_WGM8_WGMXCC1_WGMXCCGn1
    SolutionIndex: 70
    SolutionNameMin: Cijk_Alik_Bljk_BBS_BH_Bias_HA_S_SAV_UserArgs_MT48x64x64_MI16x16x1_SN_LDSB0_AFC1_AG0_AFEM1_AFEM1_ASEM1_CLR0_CADS0_DTLA0_DTLB0_DTVA0_DTVB0_DTVMXSA0_DTVMXSB0_DTVSM0_DPLBn1_EPS0_ELFLR0_EMLLn1_FDSI0_GRPM1_GRVWA8_GRVWB8_GSU1_GSUAMB_GSUC0_GSUWGMRR0_GLS0_ISA1151_IU1_K1_LDSTI0_LBSPPA128_LBSPPB128_LBSPPM0_LPA8_LPB8_LPM0_LRVW16_LWPMn1_MIAV1_MIWT3_1_MO40_MGRIPMn1_NTn1_NTA0_NTB0_NTC0_NTD0_NTM0_NEPBS0_NLCA1_NLCB1_ONLL1_PGR1_PLR1_PKA0_SGROBn1_SIA1_SS1_SU32_SUM1_SUS256_SPO0_SRVW0_SSO0_SVW1_SK0_SKFTR0_SKXCCM0_SGRO0_TDMI0_TIN0_TLDS1_TLDSM1_ULSGRO0_USL1_UIOFGRO0_UPLRP0_USFGROn1_VSn1_VWA1_VWB1_WSGRA0_WSGRB0_WS32_WG16_8_1_WGM8_WGMXCC1_WGMXCCGn1
    SolutionIndex: 71
    SolutionNameMin: Cijk_Alik_Bljk_BBS_BH_Bias_HA_S_SAV_UserArgs_MT96x64x16_MI16x16x1_SN_LDSB0_AFC1_AG0_AFEM1_AFEM1_ASEM1_CLR0_CADS0_DTLA0_DTLB0_DTVA0_DTVB0_DTVMXSA0_DTVMXSB0_DTVSM0_DPLBn1_EPS0_ELFLR0_EMLLn1_FDSI0_GRPM1_GRVWA4_GRVWB8_GSU1_GSUAMB_GSUC0_GSUWGMRR0_GLS0_ISA1151_IU1_K1_LDSTI0_LBSPPA128_LBSPPB128_LBSPPM0_LPA8_LPB8_LPM0_LRVW16_LWPMn1_MIAV1_MIWT3_2_MO40_MGRIPMn1_NTn1_NTA0_NTB0_NTC0_NTD0_NTM0_NEPBS0_NLCA1_NLCB1_ONLL1_PGR2_PLR0_PKA0_SGROBn1_SIA1_SS1_SU32_SUM1_SUS256_SPO0_SRVW0_SSO0_SVW1_SK0_SKFTR0_SKXCCM0_SGRO0_TDMI0_TIN0_TLDS1_TLDSM1_ULSGRO0_USL1_UIOFGRO0_UPLRP0_USFGROn1_VSn1_VWA1_VWB1_WSGRA0_WSGRB0_WS32_WG32_4_1_WGM8_WGMXCC1_WGMXCCGn1
    SolutionIndex: 72
    SolutionNameMin: Cijk_Alik_Bljk_BBS_BH_Bias_HA_S_SAV_UserArgs_MT64x64x16_MI16x16x1_SN_LDSB0_AFC1_AG0_AFEM1_AFEM1_ASEM1_CLR0_CADS0_DTLA0_DTLB0_DTVA0_DTVB0_DTVMXSA0_DTVMXSB0_DTVSM0_DPLBn1_EPS0_ELFLR0_EMLLn1_FDSI0_GRPM1_GRVWA8_GRVWB8_GSU1_GSUAMB_GSUC0_GSUWGMRR0_GLS0_ISA1151_IU1_K1_LDSTI0_LBSPPA128_LBSPPB128_LBSPPM0_LPA8_LPB8_LPM0_LRVW16_LWPMn1_MIAV1_MIWT2_2_MO40_MGRIPMn1_NTn1_NTA0_NTB0_NTC0_NTD0_NTM0_NEPBS0_NLCA1_NLCB1_ONLL1_PGR2_PLR0_PKA0_SGROBn1_SIA1_SS1_SU32_SUM1_SUS256_SPO0_SRVW0_SSO0_SVW1_SK0_SKFTR0_SKXCCM0_SGRO0_TDMI0_TIN0_TLDS1_TLDSM1_ULSGRO0_USL1_UIOFGRO0_UPLRP0_USFGROn1_VSn1_VWA1_VWB1_WSGRA0_WSGRB0_WS32_WG32_4_1_WGM8_WGMXCC1_WGMXCCGn1
    SolutionIndex: 73
    SolutionNameMin: Cijk_Alik_Bljk_BBS_BH_Bias_HA_S_SAV_UserArgs_MT64x128x16_MI16x16x1_SN_LDSB0_AFC1_AG0_AFEM1_AFEM1_ASEM1_CLR0_CADS0_DTLA0_DTLB0_DTVA0_DTVB0_DTVMXSA0_DTVMXSB0_DTVSM0_DPLBn1_EPS0_ELFLR0_EMLLn1_FDSI0_GRPM1_GRVWA8_GRVWB8_GSU1_GSUAMB_GSUC0_GSUWGMRR0_GLS0_ISA1151_IU1_K1_LDSTI0_LBSPPA128_LBSPPB128_LBSPPM0_LPA8_LPB8_LPM0_LRVW16_LWPMn1_MIAV1_MIWT2_4_MO40_MGRIPMn1_NTn1_NTA0_NTB0_NTC0_NTD0_NTM0_NEPBS0_NLCA1_NLCB1_ONLL1_PGR1_PLR0_PKA0_SGROBn1_SIA1_SS1_SU32_SUM1_SUS256_SPO0_SRVW0_SSO0_SVW1_SK0_SKFTR0_SKXCCM0_SGRO0_TDMI0_TIN0_TLDS1_TLDSM1_ULSGRO0_USL1_UIOFGRO0_UPLRP0_USFGROn1_VSn1_VWA1_VWB1_WSGRA0_WSGRB0_WS32_WG32_4_1_WGM8_WGMXCC1_WGMXCCGn1
    SolutionIndex: 74
    SolutionNameMin: Cijk_Alik_Bljk_BBS_BH_Bias_HA_S_SAV_UserArgs_MT64x64x16_MI16x16x1_SN_LDSB0_AFC1_AG0_AFEM1_AFEM1_ASEM1_CLR0_CADS0_DTLA0_DTLB0_DTVA0_DTVB0_DTVMXSA0_DTVMXSB0_DTVSM0_DPLBn1_EPS0_ELFLR0_EMLLn1_FDSI0_GRPM1_GRVWA8_GRVWB8_GSU1_GSUAMB_GSUC0_GSUWGMRR0_GLS0_ISA1151_IU1_K1_LDSTI0_LBSPPA128_LBSPPB128_LBSPPM0_LPA8_LPB8_LPM0_LRVW16_LWPMn1_MIAV1_MIWT2_2_MO40_MGRIPMn1_NTn1_NTA0_NTB0_NTC0_NTD0_NTM0_NEPBS0_NLCA1_NLCB1_ONLL1_PGR2_PLR1_PKA0_SGROBn1_SIA1_SS1_SU32_SUM1_SUS256_SPO0_SRVW0_SSO0_SVW1_SK0_SKFTR0_SKXCCM0_SGRO0_TDMI0_TIN0_TLDS1_TLDSM1_ULSGRO0_USL1_UIOFGRO0_UPLRP0_USFGROn1_VSn1_VWA1_VWB1_WSGRA0_WSGRB0_WS32_WG32_4_1_WGM8_WGMXCC1_WGMXCCGn1
    SolutionIndex: 75
    SolutionNameMin: Cijk_Alik_Bljk_BBS_BH_Bias_HA_S_SAV_UserArgs_MT64x128x16_MI16x16x1_SN_LDSB0_AFC1_AG0_AFEM1_AFEM1_ASEM1_CLR0_CADS0_DTLA0_DTLB0_DTVA0_DTVB0_DTVMXSA0_DTVMXSB0_DTVSM0_DPLBn1_EPS0_ELFLR0_EMLLn1_FDSI0_GRPM1_GRVWA8_GRVWB8_GSU1_GSUAMB_GSUC0_GSUWGMRR0_GLS0_ISA1151_IU1_K1_LDSTI0_LBSPPA128_LBSPPB128_LBSPPM0_LPA8_LPB8_LPM0_LRVW16_LWPMn1_MIAV1_MIWT2_4_MO40_MGRIPMn1_NTn1_NTA0_NTB0_NTC0_NTD0_NTM0_NEPBS0_NLCA1_NLCB1_ONLL1_PGR0_PLR0_PKA0_SGROBn1_SIA1_SS1_SU32_SUM1_SUS256_SPO0_SRVW0_SSO0_SVW1_SK0_SKFTR0_SKXCCM0_SGRO0_TDMI0_TIN0_TLDS1_TLDSM1_ULSGRO0_USL1_UIOFGRO0_UPLRP0_USFGROn1_VSn1_VWA1_VWB1_WSGRA0_WSGRB0_WS32_WG32_4_1_WGM8_WGMXCC1_WGMXCCGn1
    SolutionIndex: 76
    SolutionNameMin: Cijk_Alik_Bljk_BBS_BH_Bias_HA_S_SAV_UserArgs_MT64x80x32_MI16x16x1_SN_LDSB0_AFC1_AG0_AFEM1_AFEM1_ASEM1_CLR0_CADS0_DTLA0_DTLB0_DTVA0_DTVB0_DTVMXSA0_DTVMXSB0_DTVSM0_DPLBn1_EPS0_ELFLR0_EMLLn1_FDSI0_GRPM1_GRVWA8_GRVWB4_GSU1_GSUAMB_GSUC0_GSUWGMRR0_GLS0_ISA1151_IU1_K1_LDSTI0_LBSPPA128_LBSPPB128_LBSPPM0_LPA8_LPB8_LPM0_LRVW16_LWPMn1_MIAV1_MIWT1_5_MO40_MGRIPMn1_NTn1_NTA0_NTB0_NTC0_NTD0_NTM0_NEPBS0_NLCA1_NLCB1_ONLL1_PGR0_PLR0_PKA0_SGROBn1_SIA1_SS1_SU32_SUM1_SUS256_SPO0_SRVW0_SSO0_SVW1_SK0_SKFTR0_SKXCCM0_SGRO0_TDMI0_TIN0_TLDS1_TLDSM1_ULSGRO0_USL1_UIOFGRO0_UPLRP0_USFGROn1_VSn1_VWA1_VWB1_WSGRA0_WSGRB0_WS32_WG64_2_1_WGM8_WGMXCC1_WGMXCCGn1
    SolutionIndex: 77
    SolutionNameMin: Cijk_Alik_Bljk_BBS_BH_Bias_HA_S_SAV_UserArgs_MT128x64x32_MI16x16x1_SN_LDSB0_AFC1_AG0_AFEM1_AFEM1_ASEM1_CLR0_CADS0_DTLA0_DTLB0_DTVA0_DTVB0_DTVMXSA0_DTVMXSB0_DTVSM0_DPLBn1_EPS0_ELFLR0_EMLLn1_FDSI0_GRPM1_GRVWA8_GRVWB8_GSU1_GSUAMB_GSUC0_GSUWGMRR0_GLS0_ISA1151_IU1_K1_LDSTI0_LBSPPA128_LBSPPB128_LBSPPM0_LPA8_LPB8_LPM0_LRVW16_LWPMn1_MIAV1_MIWT4_2_MO40_MGRIPMn1_NTn1_NTA0_NTB0_NTC0_NTD0_NTM0_NEPBS0_NLCA1_NLCB1_ONLL1_PGR2_PLR1_PKA0_SGROBn1_SIA1_SS1_SU32_SUM1_SUS256_SPO0_SRVW0_SSO0_SVW1_SK0_SKFTR0_SKXCCM0_SGRO0_TDMI0_TIN0_TLDS1_TLDSM1_ULSGRO0_USL1_UIOFGRO0_UPLRP0_USFGROn1_VSn1_VWA1_VWB1_WSGRA0_WSGRB0_WS32_WG32_4_1_WGM8_WGMXCC1_WGMXCCGn1
    SolutionIndex: 78
    SolutionNameMin: Cijk_Alik_Bljk_BBS_BH_Bias_HA_S_SAV_UserArgs_MT64x96x32_MI16x16x1_SN_LDSB0_AFC1_AG0_AFEM1_AFEM1_ASEM1_CLR0_CADS0_DTLA0_DTLB0_DTVA0_DTVB0_DTVMXSA0_DTVMXSB0_DTVSM0_DPLBn1_EPS0_ELFLR0_EMLLn1_FDSI0_GRPM1_GRVWA8_GRVWB8_GSU1_GSUAMB_GSUC0_GSUWGMRR0_GLS0_ISA1151_IU1_K1_LDSTI0_LBSPPA128_LBSPPB128_LBSPPM0_LPA8_LPB8_LPM0_LRVW16_LWPMn1_MIAV1_MIWT2_3_MO40_MGRIPMn1_NTn1_NTA0_NTB0_NTC0_NTD0_NTM0_NEPBS0_NLCA1_NLCB1_ONLL1_PGR0_PLR0_PKA0_SGROBn1_SIA1_SS1_SU32_SUM1_SUS256_SPO0_SRVW0_SSO0_SVW1_SK0_SKFTR0_SKXCCM0_SGRO0_TDMI0_TIN0_TLDS1_TLDSM1_ULSGRO0_USL1_UIOFGRO0_UPLRP0_USFGROn1_VSn1_VWA1_VWB1_WSGRA0_WSGRB0_WS32_WG32_4_1_WGM8_WGMXCC1_WGMXCCGn1
    SolutionIndex: 79
    SolutionNameMin: Cijk_Alik_Bljk_BBS_BH_Bias_HA_S_SAV_UserArgs_MT128x80x32_MI16x16x1_SN_LDSB0_AFC1_AG0_AFEM1_AFEM1_ASEM1_CLR0_CADS0_DTLA0_DTLB0_DTVA0_DTVB0_DTVMXSA0_DTVMXSB0_DTVSM0_DPLBn1_EPS0_ELFLR0_EMLLn1_FDSI0_GRPM1_GRVWA8_GRVWB4_GSU1_GSUAMB_GSUC0_GSUWGMRR0_GLS0_ISA1151_IU1_K1_LDSTI0_LBSPPA128_LBSPPB128_LBSPPM0_LPA8_LPB8_LPM0_LRVW16_LWPMn1_MIAV1_MIWT2_5_MO40_MGRIPMn1_NTn1_NTA0_NTB0_NTC0_NTD0_NTM0_NEPBS0_NLCA1_NLCB1_ONLL1_PGR0_PLR1_PKA0_SGROBn1_SIA1_SS1_SU32_SUM1_SUS256_SPO0_SRVW0_SSO0_SVW1_SK0_SKFTR0_SKXCCM0_SGRO0_TDMI0_TIN0_TLDS1_TLDSM1_ULSGRO0_USL1_UIOFGRO0_UPLRP0_USFGROn1_VSn1_VWA1_VWB1_WSGRA0_WSGRB0_WS32_WG64_2_1_WGM8_WGMXCC1_WGMXCCGn1
    SolutionIndex: 80
    SolutionNameMin: Cijk_Alik_Bljk_BBS_BH_Bias_HA_S_SAV_UserArgs_MT128x112x32_MI16x16x1_SN_LDSB0_AFC1_AG0_AFEM1_AFEM1_ASEM1_CLR0_CADS0_DTLA0_DTLB0_DTVA0_DTVB0_DTVMXSA0_DTVMXSB0_DTVSM0_DPLBn1_EPS0_ELFLR0_EMLLn1_FDSI0_GRPM1_GRVWA8_GRVWB4_GSU1_GSUAMB_GSUC0_GSUWGMRR0_GLS0_ISA1151_IU1_K1_LDSTI0_LBSPPA128_LBSPPB128_LBSPPM0_LPA8_LPB8_LPM0_LRVW16_LWPMn1_MIAV1_MIWT2_7_MO40_MGRIPMn1_NTn1_NTA0_NTB0_NTC0_NTD0_NTM0_NEPBS0_NLCA1_NLCB1_ONLL1_PGR2_PLR0_PKA0_SGROBn1_SIA1_SS1_SU32_SUM1_SUS256_SPO0_SRVW0_SSO0_SVW1_SK0_SKFTR0_SKXCCM0_SGRO0_TDMI0_TIN0_TLDS1_TLDSM1_ULSGRO0_USL1_UIOFGRO0_UPLRP0_USFGROn1_VSn1_VWA1_VWB1_WSGRA0_WSGRB0_WS32_WG64_2_1_WGM8_WGMXCC1_WGMXCCGn1
    SolutionIndex: 81
    SolutionNameMin: Cijk_Alik_Bljk_BBS_BH_Bias_HA_S_SAV_UserArgs_MT128x64x64_MI16x16x1_SN_LDSB0_AFC1_AG0_AFEM1_AFEM1_ASEM1_CLR0_CADS0_DTLA0_DTLB0_DTVA0_DTVB0_DTVMXSA0_DTVMXSB0_DTVSM0_DPLBn1_EPS0_ELFLR0_EMLLn1_FDSI0_GRPM1_GRVWA8_GRVWB8_GSU1_GSUAMB_GSUC0_GSUWGMRR0_GLS0_ISA1151_IU1_K1_LDSTI0_LBSPPA128_LBSPPB128_LBSPPM0_LPA8_LPB8_LPM0_LRVW16_LWPMn1_MIAV1_MIWT2_4_MO40_MGRIPMn1_NTn1_NTA0_NTB0_NTC0_NTD0_NTM0_NEPBS0_NLCA1_NLCB1_ONLL1_PGR2_PLR0_PKA0_SGROBn1_SIA1_SS1_SU32_SUM1_SUS256_SPO0_SRVW0_SSO0_SVW1_SK0_SKFTR0_SKXCCM0_SGRO0_TDMI0_TIN0_TLDS1_TLDSM1_ULSGRO0_USL1_UIOFGRO0_UPLRP0_USFGROn1_VSn1_VWA1_VWB1_WSGRA0_WSGRB0_WS32_WG64_2_1_WGM8_WGMXCC1_WGMXCCGn1
    SolutionIndex: 82
    SolutionNameMin: Cijk_Alik_Bljk_BBS_BH_Bias_HA_S_SAV_UserArgs_MT128x128x32_MI16x16x1_SN_LDSB0_AFC1_AG0_AFEM1_AFEM1_ASEM1_CLR0_CADS0_DTLA0_DTLB0_DTVA0_DTVB0_DTVMXSA0_DTVMXSB0_DTVSM0_DPLBn1_EPS0_ELFLR0_EMLLn1_FDSI0_GRPM1_GRVWA8_GRVWB8_GSU1_GSUAMB_GSUC0_GSUWGMRR0_GLS0_ISA1151_IU1_K1_LDSTI0_LBSPPA128_LBSPPB128_LBSPPM0_LPA8_LPB8_LPM0_LRVW16_LWPMn1_MIAV1_MIWT4_4_MO40_MGRIPMn1_NTn1_NTA0_NTB0_NTC0_NTD0_NTM0_NEPBS0_NLCA1_NLCB1_ONLL1_PGR2_PLR0_PKA0_SGROBn1_SIA1_SS1_SU32_SUM1_SUS256_SPO0_SRVW0_SSO0_SVW1_SK0_SKFTR0_SKXCCM0_SGRO0_TDMI0_TIN0_TLDS1_TLDSM1_ULSGRO0_USL1_UIOFGRO0_UPLRP0_USFGROn1_VSn1_VWA1_VWB1_WSGRA0_WSGRB0_WS32_WG32_4_1_WGM8_WGMXCC1_WGMXCCGn1
    SolutionIndex: 83
    SolutionNameMin: Cijk_Alik_Bljk_BBS_BH_Bias_HA_S_SAV_UserArgs_MT128x64x32_MI16x16x1_SN_LDSB0_AFC1_AG0_AFEM1_AFEM1_ASEM1_CLR0_CADS0_DTLA0_DTLB0_DTVA0_DTVB0_DTVMXSA0_DTVMXSB0_DTVSM0_DPLBn1_EPS0_ELFLR0_EMLLn1_FDSI0_GRPM1_GRVWA8_GRVWB8_GSU1_GSUAMB_GSUC0_GSUWGMRR0_GLS0_ISA1151_IU1_K1_LDSTI0_LBSPPA128_LBSPPB128_LBSPPM0_LPA8_LPB8_LPM0_LRVW16_LWPMn1_MIAV1_MIWT4_2_MO40_MGRIPMn1_NTn1_NTA0_NTB0_NTC0_NTD0_NTM0_NEPBS0_NLCA1_NLCB1_ONLL1_PGR2_PLR0_PKA0_SGROBn1_SIA1_SS1_SU32_SUM1_SUS256_SPO0_SRVW0_SSO0_SVW1_SK0_SKFTR0_SKXCCM0_SGRO0_TDMI0_TIN0_TLDS1_TLDSM1_ULSGRO0_USL1_UIOFGRO0_UPLRP0_USFGROn1_VSn1_VWA1_VWB1_WSGRA0_WSGRB0_WS32_WG32_4_1_WGM8_WGMXCC1_WGMXCCGn1
    SolutionIndex: 84
    SolutionNameMin: Cijk_Alik_Bljk_BBS_BH_Bias_HA_S_SAV_UserArgs_MT128x64x64_MI16x16x1_SN_LDSB0_AFC1_AG0_AFEM1_AFEM1_ASEM1_CLR0_CADS0_DTLA0_DTLB0_DTVA0_DTVB0_DTVMXSA0_DTVMXSB0_DTVSM0_DPLBn1_EPS0_ELFLR0_EMLLn1_FDSI0_GRPM1_GRVWA8_GRVWB8_GSU1_GSUAMB_GSUC0_GSUWGMRR0_GLS0_ISA1151_IU1_K1_LDSTI0_LBSPPA128_LBSPPB128_LBSPPM0_LPA8_LPB8_LPM0_LRVW16_LWPMn1_MIAV1_MIWT4_2_MO40_MGRIPMn1_NTn1_NTA0_NTB0_NTC0_NTD0_NTM0_NEPBS0_NLCA1_NLCB1_ONLL1_PGR2_PLR0_PKA0_SGROBn1_SIA1_SS1_SU32_SUM1_SUS256_SPO0_SRVW0_SSO0_SVW1_SK0_SKFTR0_SKXCCM0_SGRO0_TDMI0_TIN0_TLDS1_TLDSM1_ULSGRO0_USL1_UIOFGRO0_UPLRP0_USFGROn1_VSn1_VWA1_VWB1_WSGRA0_WSGRB0_WS32_WG32_4_1_WGM8_WGMXCC1_WGMXCCGn1
    SolutionIndex: 85
    SolutionNameMin: Cijk_Alik_Bljk_BBS_BH_Bias_HA_S_SAV_UserArgs_MT128x64x64_MI16x16x1_SN_LDSB0_AFC1_AG0_AFEM1_AFEM1_ASEM1_CLR0_CADS0_DTLA0_DTLB0_DTVA0_DTVB0_DTVMXSA0_DTVMXSB0_DTVSM0_DPLBn1_EPS0_ELFLR0_EMLLn1_FDSI0_GRPM1_GRVWA8_GRVWB8_GSU1_GSUAMB_GSUC0_GSUWGMRR0_GLS0_ISA1151_IU1_K1_LDSTI0_LBSPPA128_LBSPPB128_LBSPPM0_LPA8_LPB8_LPM0_LRVW16_LWPMn1_MIAV1_MIWT2_4_MO40_MGRIPMn1_NTn1_NTA0_NTB0_NTC0_NTD0_NTM0_NEPBS0_NLCA1_NLCB1_ONLL1_PGR2_PLR1_PKA0_SGROBn1_SIA1_SS1_SU32_SUM1_SUS256_SPO0_SRVW0_SSO0_SVW1_SK0_SKFTR0_SKXCCM0_SGRO0_TDMI0_TIN0_TLDS1_TLDSM1_ULSGRO0_USL1_UIOFGRO0_UPLRP0_USFGROn1_VSn1_VWA1_VWB1_WSGRA0_WSGRB0_WS32_WG64_2_1_WGM8_WGMXCC1_WGMXCCGn1
    SolutionIndex: 86
    SolutionNameMin: Cijk_Alik_Bljk_BBS_BH_Bias_HA_S_SAV_UserArgs_MT64x160x32_MI16x16x1_SN_LDSB0_AFC1_AG0_AFEM1_AFEM1_ASEM1_CLR0_CADS0_DTLA0_DTLB0_DTVA0_DTVB0_DTVMXSA0_DTVMXSB0_DTVSM0_DPLBn1_EPS0_ELFLR0_EMLLn1_FDSI0_GRPM1_GRVWA8_GRVWB8_GSU1_GSUAMB_GSUC0_GSUWGMRR0_GLS0_ISA1151_IU1_K1_LDSTI0_LBSPPA128_LBSPPB128_LBSPPM0_LPA8_LPB8_LPM0_LRVW16_LWPMn1_MIAV1_MIWT2_5_MO40_MGRIPMn1_NTn1_NTA0_NTB0_NTC0_NTD0_NTM0_NEPBS0_NLCA1_NLCB1_ONLL1_PGR0_PLR0_PKA0_SGROBn1_SIA1_SS1_SU32_SUM1_SUS256_SPO0_SRVW0_SSO0_SVW1_SK0_SKFTR0_SKXCCM0_SGRO0_TDMI0_TIN0_TLDS1_TLDSM1_ULSGRO0_USL1_UIOFGRO0_UPLRP0_USFGROn1_VSn1_VWA1_VWB1_WSGRA0_WSGRB0_WS32_WG32_4_1_WGM8_WGMXCC1_WGMXCCGn1
    SolutionIndex: 87
    SolutionNameMin: Cijk_Alik_Bljk_BBS_BH_Bias_HA_S_SAV_UserArgs_MT64x160x64_MI16x16x1_SN_LDSB0_AFC1_AG0_AFEM1_AFEM1_ASEM1_CLR0_CADS0_DTLA0_DTLB0_DTVA0_DTVB0_DTVMXSA0_DTVMXSB0_DTVSM0_DPLBn1_EPS0_ELFLR0_EMLLn1_FDSI0_GRPM1_GRVWA8_GRVWB8_GSU1_GSUAMB_GSUC0_GSUWGMRR0_GLS0_ISA1151_IU1_K1_LDSTI0_LBSPPA128_LBSPPB128_LBSPPM0_LPA8_LPB8_LPM0_LRVW16_LWPMn1_MIAV1_MIWT2_5_MO40_MGRIPMn1_NTn1_NTA0_NTB0_NTC0_NTD0_NTM0_NEPBS0_NLCA1_NLCB1_ONLL1_PGR2_PLR0_PKA0_SGROBn1_SIA1_SS1_SU32_SUM1_SUS256_SPO0_SRVW0_SSO0_SVW1_SK0_SKFTR0_SKXCCM0_SGRO0_TDMI0_TIN0_TLDS1_TLDSM1_ULSGRO0_USL1_UIOFGRO0_UPLRP0_USFGROn1_VSn1_VWA1_VWB1_WSGRA0_WSGRB0_WS32_WG32_4_1_WGM8_WGMXCC1_WGMXCCGn1
    SolutionIndex: 88
    SolutionNameMin: Cijk_Alik_Bljk_BBS_BH_Bias_HA_S_SAV_UserArgs_MT128x160x32_MI16x16x1_SN_LDSB0_AFC1_AG0_AFEM1_AFEM1_ASEM1_CLR0_CADS0_DTLA0_DTLB0_DTVA0_DTVB0_DTVMXSA0_DTVMXSB0_DTVSM0_DPLBn1_EPS0_ELFLR0_EMLLn1_FDSI0_GRPM1_GRVWA8_GRVWB8_GSU1_GSUAMB_GSUC0_GSUWGMRR0_GLS0_ISA1151_IU1_K1_LDSTI0_LBSPPA128_LBSPPB128_LBSPPM0_LPA8_LPB8_LPM0_LRVW16_LWPMn1_MIAV1_MIWT4_5_MO40_MGRIPMn1_NTn1_NTA0_NTB0_NTC0_NTD0_NTM0_NEPBS0_NLCA1_NLCB1_ONLL1_PGR0_PLR0_PKA0_SGROBn1_SIA1_SS1_SU32_SUM1_SUS256_SPO0_SRVW0_SSO0_SVW1_SK0_SKFTR0_SKXCCM0_SGRO0_TDMI0_TIN0_TLDS1_TLDSM1_ULSGRO0_USL1_UIOFGRO0_UPLRP0_USFGROn1_VSn1_VWA1_VWB1_WSGRA0_WSGRB0_WS32_WG32_4_1_WGM8_WGMXCC1_WGMXCCGn1
    SolutionIndex: 89
    SolutionNameMin: Cijk_Alik_Bljk_BBS_BH_Bias_HA_S_SAV_UserArgs_MT256x64x32_MI16x16x1_SN_LDSB0_AFC1_AG0_AFEM1_AFEM1_ASEM1_CLR0_CADS0_DTLA0_DTLB0_DTVA0_DTVB0_DTVMXSA0_DTVMXSB0_DTVSM0_DPLBn1_EPS0_ELFLR0_EMLLn1_FDSI0_GRPM1_GRVWA8_GRVWB8_GSU1_GSUAMB_GSUC0_GSUWGMRR0_GLS0_ISA1151_IU1_K1_LDSTI0_LBSPPA128_LBSPPB128_LBSPPM0_LPA8_LPB8_LPM0_LRVW16_LWPMn1_MIAV1_MIWT4_4_MO40_MGRIPMn1_NTn1_NTA0_NTB0_NTC0_NTD0_NTM0_NEPBS0_NLCA1_NLCB1_ONLL1_PGR0_PLR0_PKA0_SGROBn1_SIA1_SS1_SU32_SUM1_SUS256_SPO0_SRVW0_SSO0_SVW1_SK0_SKFTR0_SKXCCM0_SGRO0_TDMI0_TIN0_TLDS1_TLDSM1_ULSGRO0_USL1_UIOFGRO0_UPLRP0_USFGROn1_VSn1_VWA1_VWB1_WSGRA0_WSGRB0_WS32_WG64_2_1_WGM8_WGMXCC1_WGMXCCGn1
    SolutionIndex: 90
    SolutionNameMin: Cijk_Alik_Bljk_BBS_BH_Bias_HA_S_SAV_UserArgs_MT256x80x32_MI16x16x1_SN_LDSB0_AFC1_AG0_AFEM1_AFEM1_ASEM1_CLR0_CADS0_DTLA0_DTLB0_DTVA0_DTVB0_DTVMXSA0_DTVMXSB0_DTVSM0_DPLBn1_EPS0_ELFLR0_EMLLn1_FDSI0_GRPM1_GRVWA8_GRVWB4_GSU1_GSUAMB_GSUC0_GSUWGMRR0_GLS0_ISA1151_IU1_K1_LDSTI0_LBSPPA128_LBSPPB128_LBSPPM0_LPA8_LPB8_LPM0_LRVW16_LWPMn1_MIAV1_MIWT4_5_MO40_MGRIPMn1_NTn1_NTA0_NTB0_NTC0_NTD0_NTM0_NEPBS0_NLCA1_NLCB1_ONLL1_PGR0_PLR0_PKA0_SGROBn1_SIA1_SS1_SU32_SUM1_SUS256_SPO0_SRVW0_SSO0_SVW1_SK0_SKFTR0_SKXCCM0_SGRO0_TDMI0_TIN0_TLDS1_TLDSM1_ULSGRO0_USL1_UIOFGRO0_UPLRP0_USFGROn1_VSn1_VWA1_VWB1_WSGRA0_WSGRB0_WS32_WG64_2_1_WGM8_WGMXCC1_WGMXCCGn1
    SolutionIndex: 91
    SolutionNameMin: Cijk_Alik_Bljk_BBS_BH_Bias_HA_S_SAV_UserArgs_MT64x32x64_MI16x16x1_SN_LDSB0_AFC1_AG0_AFEM1_AFEM1_ASEM1_CLR0_CADS0_DTLA0_DTLB0_DTVA0_DTVB0_DTVMXSA0_DTVMXSB0_DTVSM0_DPLBn1_EPS0_ELFLR0_EMLLn1_FDSI0_GRPM1_GRVWA8_GRVWB8_GSU1_GSUAMB_GSUC0_GSUWGMRR0_GLS0_ISA1151_IU1_K1_LDSTI0_LBSPPA128_LBSPPB128_LBSPPM0_LPA8_LPB8_LPM0_LRVW16_LWPMn1_MIAV1_MIWT1_2_MO40_MGRIPMn1_NTn1_NTA0_NTB0_NTC0_NTD0_NTM0_NEPBS0_NLCA1_NLCB1_ONLL1_PGR0_PLR1_PKA0_SGROBn1_SIA1_SS1_SU32_SUM1_SUS256_SPO0_SRVW0_SSO0_SVW1_SK0_SKFTR0_SKXCCM0_SGRO0_TDMI0_TIN0_TLDS1_TLDSM1_ULSGRO0_USL1_UIOFGRO0_UPLRP0_USFGROn1_VSn1_VWA1_VWB1_WSGRA0_WSGRB0_WS32_WG64_2_1_WGM8_WGMXCC1_WGMXCCGn1
    SolutionIndex: 92
    SolutionNameMin: Cijk_Alik_Bljk_BBS_BH_Bias_HA_S_SAV_UserArgs_MT48x64x32_MI16x16x1_SN_LDSB0_AFC1_AG0_AFEM1_AFEM1_ASEM1_CLR0_CADS0_DTLA0_DTLB0_DTVA0_DTVB0_DTVMXSA0_DTVMXSB0_DTVSM0_DPLBn1_EPS0_ELFLR0_EMLLn1_FDSI0_GRPM1_GRVWA4_GRVWB8_GSU1_GSUAMB_GSUC0_GSUWGMRR0_GLS0_ISA1151_IU1_K1_LDSTI0_LBSPPA128_LBSPPB128_LBSPPM0_LPA8_LPB8_LPM0_LRVW16_LWPMn1_MIAV1_MIWT3_1_MO40_MGRIPMn1_NTn1_NTA0_NTB0_NTC0_NTD0_NTM0_NEPBS0_NLCA1_NLCB1_ONLL1_PGR2_PLR1_PKA0_SGROBn1_SIA1_SS1_SU32_SUM1_SUS256_SPO0_SRVW0_SSO0_SVW1_SK0_SKFTR0_SKXCCM0_SGRO0_TDMI0_TIN0_TLDS1_TLDSM1_ULSGRO0_USL1_UIOFGRO0_UPLRP0_USFGROn1_VSn1_VWA1_VWB1_WSGRA0_WSGRB0_WS32_WG16_8_1_WGM8_WGMXCC1_WGMXCCGn1
    SolutionIndex: 93
    SolutionNameMin: Cijk_Alik_Bljk_BBS_BH_Bias_HA_S_SAV_UserArgs_MT48x64x32_MI16x16x1_SN_LDSB0_AFC1_AG0_AFEM1_AFEM1_ASEM1_CLR0_CADS0_DTLA0_DTLB0_DTVA0_DTVB0_DTVMXSA0_DTVMXSB0_DTVSM0_DPLBn1_EPS0_ELFLR0_EMLLn1_FDSI0_GRPM1_GRVWA4_GRVWB8_GSU1_GSUAMB_GSUC0_GSUWGMRR0_GLS0_ISA1151_IU1_K1_LDSTI0_LBSPPA128_LBSPPB128_LBSPPM0_LPA8_LPB8_LPM0_LRVW16_LWPMn1_MIAV1_MIWT3_1_MO40_MGRIPMn1_NTn1_NTA0_NTB0_NTC0_NTD0_NTM0_NEPBS0_NLCA1_NLCB1_ONLL1_PGR2_PLR0_PKA0_SGROBn1_SIA1_SS1_SU32_SUM1_SUS256_SPO0_SRVW0_SSO0_SVW1_SK0_SKFTR0_SKXCCM0_SGRO0_TDMI0_TIN0_TLDS1_TLDSM1_ULSGRO0_USL1_UIOFGRO0_UPLRP0_USFGROn1_VSn1_VWA1_VWB1_WSGRA0_WSGRB0_WS32_WG16_8_1_WGM8_WGMXCC1_WGMXCCGn1
    SolutionIndex: 94
    SolutionNameMin: Cijk_Alik_Bljk_BBS_BH_Bias_HA_S_SAV_UserArgs_MT48x64x64_MI16x16x1_SN_LDSB0_AFC1_AG0_AFEM1_AFEM1_ASEM1_CLR0_CADS0_DTLA0_DTLB0_DTVA0_DTVB0_DTVMXSA0_DTVMXSB0_DTVSM0_DPLBn1_EPS0_ELFLR0_EMLLn1_FDSI0_GRPM1_GRVWA8_GRVWB8_GSU1_GSUAMB_GSUC0_GSUWGMRR0_GLS0_ISA1151_IU1_K1_LDSTI0_LBSPPA128_LBSPPB128_LBSPPM0_LPA8_LPB8_LPM0_LRVW16_LWPMn1_MIAV1_MIWT3_1_MO40_MGRIPMn1_NTn1_NTA0_NTB0_NTC0_NTD0_NTM0_NEPBS0_NLCA1_NLCB1_ONLL1_PGR2_PLR0_PKA0_SGROBn1_SIA1_SS1_SU32_SUM1_SUS256_SPO0_SRVW0_SSO0_SVW1_SK0_SKFTR0_SKXCCM0_SGRO0_TDMI0_TIN0_TLDS1_TLDSM1_ULSGRO0_USL1_UIOFGRO0_UPLRP0_USFGROn1_VSn1_VWA1_VWB1_WSGRA0_WSGRB0_WS32_WG16_8_1_WGM8_WGMXCC1_WGMXCCGn1
    SolutionIndex: 95
    SolutionNameMin: Cijk_Alik_Bljk_BBS_BH_Bias_HA_S_SAV_UserArgs_MT64x96x32_MI16x16x1_SN_LDSB0_AFC1_AG0_AFEM1_AFEM1_ASEM1_CLR0_CADS0_DTLA0_DTLB0_DTVA0_DTVB0_DTVMXSA0_DTVMXSB0_DTVSM0_DPLBn1_EPS0_ELFLR0_EMLLn1_FDSI0_GRPM1_GRVWA8_GRVWB8_GSU1_GSUAMB_GSUC0_GSUWGMRR0_GLS0_ISA1151_IU1_K1_LDSTI0_LBSPPA128_LBSPPB128_LBSPPM0_LPA8_LPB8_LPM0_LRVW16_LWPMn1_MIAV1_MIWT2_3_MO40_MGRIPMn1_NTn1_NTA0_NTB0_NTC0_NTD0_NTM0_NEPBS0_NLCA1_NLCB1_ONLL1_PGR2_PLR1_PKA0_SGROBn1_SIA1_SS1_SU32_SUM1_SUS256_SPO0_SRVW0_SSO0_SVW1_SK0_SKFTR0_SKXCCM0_SGRO0_TDMI0_TIN0_TLDS1_TLDSM1_ULSGRO0_USL1_UIOFGRO0_UPLRP0_USFGROn1_VSn1_VWA1_VWB1_WSGRA0_WSGRB0_WS32_WG32_4_1_WGM8_WGMXCC1_WGMXCCGn1
    SolutionIndex: 96
    SolutionNameMin: Cijk_Alik_Bljk_BBS_BH_Bias_HA_S_SAV_UserArgs_MT96x96x64_MI16x16x1_SN_LDSB0_AFC1_AG0_AFEM1_AFEM1_ASEM1_CLR0_CADS0_DTLA0_DTLB0_DTVA0_DTVB0_DTVMXSA0_DTVMXSB0_DTVSM0_DPLBn1_EPS0_ELFLR0_EMLLn1_FDSI0_GRPM1_GRVWA8_GRVWB8_GSU1_GSUAMB_GSUC0_GSUWGMRR0_GLS0_ISA1151_IU1_K1_LDSTI0_LBSPPA128_LBSPPB128_LBSPPM0_LPA8_LPB8_LPM0_LRVW16_LWPMn1_MIAV1_MIWT3_3_MO40_MGRIPMn1_NTn1_NTA0_NTB0_NTC0_NTD0_NTM0_NEPBS0_NLCA1_NLCB1_ONLL1_PGR1_PLR1_PKA0_SGROBn1_SIA3_SS1_SU32_SUM1_SUS256_SPO0_SRVW0_SSO0_SVW1_SK0_SKFTR0_SKXCCM0_SGRO0_TDMI0_TIN0_TLDS1_TLDSM1_ULSGRO0_USL1_UIOFGRO0_UPLRP0_USFGROn1_VSn1_VWA1_VWB1_WSGRA0_WSGRB0_WS32_WG32_4_1_WGM8_WGMXCC1_WGMXCCGn1
    SolutionIndex: 97
    SolutionNameMin: Cijk_Alik_Bljk_BBS_BH_Bias_HA_S_SAV_UserArgs_MT80x128x64_MI16x16x1_SN_LDSB1_AFC1_AG0_AFEM1_AFEM1_ASEM1_CLR0_CADS0_DTLA0_DTLB0_DTVA0_DTVB0_DTVMXSA0_DTVMXSB0_DTVSM0_DPLBn1_EPS0_ELFLR0_EMLLn1_FDSI0_GRPM1_GRVWA8_GRVWB8_GSU1_GSUAMB_GSUC0_GSUWGMRR0_GLS0_ISA1151_IU1_K1_LDSTI0_LBSPPA128_LBSPPB128_LBSPPM0_LPA8_LPB8_LPM0_LRVW16_LWPMn1_MIAV1_MIWT5_2_MO40_MGRIPMn1_NTn1_NTA0_NTB0_NTC0_NTD0_NTM0_NEPBS0_NLCA1_NLCB1_ONLL1_PGR2_PLR1_PKA0_SGROBn1_SIA3_SS1_SU32_SUM1_SUS256_SPO0_SRVW0_SSO0_SVW1_SK0_SKFTR0_SKXCCM0_SGRO0_TDMI0_TIN0_TLDS1_TLDSM1_ULSGRO0_USL1_UIOFGRO0_UPLRP0_USFGROn1_VSn1_VWA1_VWB1_WSGRA0_WSGRB0_WS32_WG16_8_1_WGM8_WGMXCC1_WGMXCCGn1
    SolutionIndex: 98
    SolutionNameMin: Cijk_Alik_Bljk_BBS_BH_Bias_HA_S_SAV_UserArgs_MT64x48x128_MI16x16x1_SN_LDSB0_AFC1_AG0_AFEM1_AFEM1_ASEM1_CLR0_CADS0_DTLA0_DTLB0_DTVA0_DTVB0_DTVMXSA0_DTVMXSB0_DTVSM0_DPLBn1_EPS0_ELFLR0_EMLLn1_FDSI0_GRPM1_GRVWA8_GRVWB8_GSU1_GSUAMB_GSUC0_GSUWGMRR0_GLS0_ISA1151_IU1_K1_LDSTI0_LBSPPA256_LBSPPB256_LBSPPM0_LPA8_LPB8_LPM0_LRVW16_LWPMn1_MIAV1_MIWT1_3_MO40_MGRIPMn1_NTn1_NTA0_NTB0_NTC0_NTD0_NTM0_NEPBS0_NLCA1_NLCB1_ONLL1_PGR2_PLR1_PKA0_SGROBn1_SIA3_SS1_SU32_SUM1_SUS256_SPO0_SRVW0_SSO0_SVW1_SK0_SKFTR0_SKXCCM0_SGRO0_TDMI0_TIN0_TLDS1_TLDSM1_ULSGRO0_USL1_UIOFGRO0_UPLRP0_USFGROn1_VSn1_VWA1_VWB1_WSGRA0_WSGRB0_WS32_WG64_2_1_WGM8_WGMXCC1_WGMXCCGn1
    SolutionIndex: 99
    SolutionNameMin: Cijk_Alik_Bljk_BBS_BH_Bias_HA_S_SAV_UserArgs_MT64x128x32_MI16x16x1_SN_LDSB0_AFC1_AG0_AFEM1_AFEM1_ASEM1_CLR0_CADS0_DTLA0_DTLB0_DTVA0_DTVB0_DTVMXSA0_DTVMXSB0_DTVSM0_DPLBn1_EPS0_ELFLR0_EMLLn1_FDSI0_GRPM1_GRVWA8_GRVWB8_GSU1_GSUAMB_GSUC0_GSUWGMRR0_GLS0_ISA1151_IU1_K1_LDSTI0_LBSPPA128_LBSPPB128_LBSPPM0_LPA8_LPB8_LPM0_LRVW16_LWPMn1_MIAV1_MIWT2_4_MO40_MGRIPMn1_NTn1_NTA0_NTB0_NTC0_NTD0_NTM0_NEPBS0_NLCA1_NLCB1_ONLL1_PGR2_PLR1_PKA0_SGROBn1_SIA1_SS1_SU32_SUM1_SUS256_SPO0_SRVW0_SSO0_SVW1_SK0_SKFTR0_SKXCCM0_SGRO0_TDMI0_TIN0_TLDS1_TLDSM1_ULSGRO0_USL1_UIOFGRO0_UPLRP0_USFGROn1_VSn1_VWA1_VWB1_WSGRA0_WSGRB0_WS32_WG32_4_1_WGM8_WGMXCC1_WGMXCCGn1
    SolutionIndex: 100
    SolutionNameMin: Cijk_Alik_Bljk_BBS_BH_Bias_HA_S_SAV_UserArgs_MT32x16x64_MI16x16x1_SN_LDSB0_AFC1_AG0_AFEM1_AFEM1_ASEM1_CLR0_CADS0_DTLA0_DTLB0_DTVA0_DTVB0_DTVMXSA0_DTVMXSB0_DTVSM0_DPLBn1_EPS0_ELFLR0_EMLLn1_FDSI0_GRPM1_GRVWA8_GRVWB8_GSU1_GSUAMB_GSUC0_GSUWGMRR0_GLS0_ISA1151_IU1_K1_LDSTI0_LBSPPA128_LBSPPB128_LBSPPM0_LPA8_LPB8_LPM0_LRVW16_LWPMn1_MIAV1_MIWT1_1_MO40_MGRIPMn1_NTn1_NTA0_NTB0_NTC0_NTD0_NTM0_NEPBS0_NLCA1_NLCB1_ONLL1_PGR2_PLR1_PKA0_SGROBn1_SIA3_SS1_SU32_SUM1_SUS256_SPO0_SRVW0_SSO0_SVW1_SK0_SKFTR0_SKXCCM0_SGRO0_TDMI0_TIN0_TLDS1_TLDSM1_ULSGRO0_USL1_UIOFGRO0_UPLRP0_USFGROn1_VSn1_VWA1_VWB1_WSGRA0_WSGRB0_WS32_WG32_2_1_WGM8_WGMXCC1_WGMXCCGn1
    SolutionIndex: 101
    SolutionNameMin: Cijk_Alik_Bljk_BBS_BH_Bias_HA_S_SAV_UserArgs_MT32x64x128_MI16x16x1_SN_LDSB0_AFC1_AG0_AFEM1_AFEM1_ASEM1_CLR0_CADS0_DTLA0_DTLB0_DTVA0_DTVB0_DTVMXSA0_DTVMXSB0_DTVSM0_DPLBn1_EPS0_ELFLR0_EMLLn1_FDSI0_GRPM1_GRVWA8_GRVWB8_GSU1_GSUAMB_GSUC0_GSUWGMRR0_GLS0_ISA1151_IU1_K1_LDSTI0_LBSPPA256_LBSPPB256_LBSPPM0_LPA8_LPB8_LPM0_LRVW16_LWPMn1_MIAV1_MIWT2_1_MO40_MGRIPMn1_NTn1_NTA0_NTB0_NTC0_NTD0_NTM0_NEPBS0_NLCA1_NLCB1_ONLL1_PGR2_PLR1_PKA0_SGROBn1_SIA1_SS1_SU32_SUM1_SUS256_SPO0_SRVW0_SSO0_SVW1_SK0_SKFTR0_SKXCCM0_SGRO0_TDMI0_TIN0_TLDS1_TLDSM1_ULSGRO0_USL1_UIOFGRO0_UPLRP0_USFGROn1_VSn1_VWA1_VWB1_WSGRA0_WSGRB0_WS32_WG16_8_1_WGM8_WGMXCC1_WGMXCCGn1
    SolutionIndex: 102
    SolutionNameMin: Cijk_Alik_Bljk_BBS_BH_Bias_HA_S_SAV_UserArgs_MT32x64x128_MI16x16x1_SN_LDSB0_AFC1_AG0_AFEM1_AFEM1_ASEM1_CLR0_CADS0_DTLA0_DTLB0_DTVA0_DTVB0_DTVMXSA0_DTVMXSB0_DTVSM0_DPLBn1_EPS0_ELFLR0_EMLLn1_FDSI0_GRPM1_GRVWA8_GRVWB8_GSU1_GSUAMB_GSUC0_GSUWGMRR0_GLS0_ISA1151_IU1_K1_LDSTI0_LBSPPA256_LBSPPB256_LBSPPM0_LPA8_LPB8_LPM0_LRVW16_LWPMn1_MIAV1_MIWT2_1_MO40_MGRIPMn1_NTn1_NTA0_NTB0_NTC0_NTD0_NTM0_NEPBS0_NLCA1_NLCB1_ONLL1_PGR1_PLR1_PKA0_SGROBn1_SIA1_SS1_SU32_SUM1_SUS256_SPO0_SRVW0_SSO0_SVW1_SK0_SKFTR0_SKXCCM0_SGRO0_TDMI0_TIN0_TLDS1_TLDSM1_ULSGRO0_USL1_UIOFGRO0_UPLRP0_USFGROn1_VSn1_VWA1_VWB1_WSGRA0_WSGRB0_WS32_WG16_8_1_WGM8_WGMXCC1_WGMXCCGn1
    SolutionIndex: 103
    SolutionNameMin: Cijk_Alik_Bljk_BBS_BH_Bias_HA_S_SAV_UserArgs_MT96x32x32_MI16x16x1_SN_LDSB0_AFC1_AG0_AFEM1_AFEM1_ASEM1_CLR0_CADS0_DTLA0_DTLB0_DTVA0_DTVB0_DTVMXSA0_DTVMXSB0_DTVSM0_DPLBn1_EPS0_ELFLR0_EMLLn1_FDSI0_GRPM1_GRVWA8_GRVWB8_GSU1_GSUAMB_GSUC0_GSUWGMRR0_GLS0_ISA1151_IU1_K1_LDSTI0_LBSPPA128_LBSPPB128_LBSPPM0_LPA8_LPB8_LPM0_LRVW16_LWPMn1_MIAV1_MIWT3_1_MO40_MGRIPMn1_NTn1_NTA0_NTB0_NTC0_NTD0_NTM0_NEPBS0_NLCA1_NLCB1_ONLL1_PGR2_PLR1_PKA0_SGROBn1_SIA1_SS1_SU32_SUM1_SUS256_SPO0_SRVW0_SSO0_SVW1_SK0_SKFTR0_SKXCCM0_SGRO0_TDMI0_TIN0_TLDS1_TLDSM1_ULSGRO0_USL1_UIOFGRO0_UPLRP0_USFGROn1_VSn1_VWA1_VWB1_WSGRA0_WSGRB0_WS32_WG32_4_1_WGM8_WGMXCC1_WGMXCCGn1
    SolutionIndex: 104
    SolutionNameMin: Cijk_Alik_Bljk_BBS_BH_Bias_HA_S_SAV_UserArgs_MT64x32x64_MI16x16x1_SN_LDSB0_AFC1_AG0_AFEM1_AFEM1_ASEM1_CLR0_CADS0_DTLA0_DTLB0_DTVA0_DTVB0_DTVMXSA0_DTVMXSB0_DTVSM0_DPLBn1_EPS0_ELFLR0_EMLLn1_FDSI0_GRPM1_GRVWA8_GRVWB8_GSU1_GSUAMB_GSUC0_GSUWGMRR0_GLS0_ISA1151_IU1_K1_LDSTI0_LBSPPA128_LBSPPB128_LBSPPM0_LPA8_LPB8_LPM0_LRVW16_LWPMn1_MIAV1_MIWT2_1_MO40_MGRIPMn1_NTn1_NTA0_NTB0_NTC0_NTD0_NTM0_NEPBS0_NLCA1_NLCB1_ONLL1_PGR2_PLR1_PKA0_SGROBn1_SIA1_SS1_SU32_SUM1_SUS256_SPO0_SRVW0_SSO0_SVW1_SK0_SKFTR0_SKXCCM0_SGRO0_TDMI0_TIN0_TLDS1_TLDSM1_ULSGRO0_USL1_UIOFGRO0_UPLRP0_USFGROn1_VSn1_VWA1_VWB1_WSGRA0_WSGRB0_WS32_WG32_4_1_WGM8_WGMXCC1_WGMXCCGn1
    SolutionIndex: 105
    SolutionNameMin: Cijk_Alik_Bljk_BBS_BH_Bias_HA_S_SAV_UserArgs_MT64x64x32_MI16x16x1_SN_LDSB0_AFC1_AG0_AFEM1_AFEM1_ASEM1_CLR0_CADS0_DTLA0_DTLB0_DTVA0_DTVB0_DTVMXSA0_DTVMXSB0_DTVSM0_DPLBn1_EPS0_ELFLR0_EMLLn1_FDSI0_GRPM1_GRVWA8_GRVWB8_GSU1_GSUAMB_GSUC0_GSUWGMRR0_GLS0_ISA1151_IU1_K1_LDSTI0_LBSPPA128_LBSPPB128_LBSPPM0_LPA8_LPB8_LPM0_LRVW16_LWPMn1_MIAV1_MIWT1_4_MO40_MGRIPMn1_NTn1_NTA0_NTB0_NTC0_NTD0_NTM0_NEPBS0_NLCA1_NLCB1_ONLL1_PGR1_PLR0_PKA0_SGROBn1_SIA3_SS1_SU32_SUM1_SUS256_SPO0_SRVW0_SSO0_SVW1_SK0_SKFTR0_SKXCCM0_SGRO0_TDMI0_TIN0_TLDS1_TLDSM1_ULSGRO0_USL1_UIOFGRO0_UPLRP0_USFGROn1_VSn1_VWA1_VWB1_WSGRA0_WSGRB0_WS32_WG64_2_1_WGM8_WGMXCC1_WGMXCCGn1
    SolutionIndex: 106
    SolutionNameMin: Cijk_Alik_Bljk_BBS_BH_Bias_HA_S_SAV_UserArgs_MT128x64x32_MI16x16x1_SN_LDSB0_AFC1_AG0_AFEM1_AFEM1_ASEM1_CLR0_CADS0_DTLA0_DTLB0_DTVA0_DTVB0_DTVMXSA0_DTVMXSB0_DTVSM0_DPLBn1_EPS0_ELFLR0_EMLLn1_FDSI0_GRPM1_GRVWA8_GRVWB8_GSU1_GSUAMB_GSUC0_GSUWGMRR0_GLS0_ISA1151_IU1_K1_LDSTI0_LBSPPA128_LBSPPB128_LBSPPM0_LPA8_LPB8_LPM0_LRVW16_LWPMn1_MIAV1_MIWT4_2_MO40_MGRIPMn1_NTn1_NTA0_NTB0_NTC0_NTD0_NTM0_NEPBS0_NLCA1_NLCB1_ONLL1_PGR0_PLR0_PKA0_SGROBn1_SIA3_SS1_SU32_SUM1_SUS256_SPO0_SRVW0_SSO0_SVW1_SK0_SKFTR0_SKXCCM0_SGRO0_TDMI0_TIN0_TLDS1_TLDSM1_ULSGRO0_USL1_UIOFGRO0_UPLRP0_USFGROn1_VSn1_VWA1_VWB1_WSGRA0_WSGRB0_WS32_WG32_4_1_WGM8_WGMXCC1_WGMXCCGn1
    SolutionIndex: 107
    SolutionNameMin: Cijk_Alik_Bljk_BBS_BH_Bias_HA_S_SAV_UserArgs_MT192x64x32_MI16x16x1_SN_LDSB0_AFC1_AG0_AFEM1_AFEM1_ASEM1_CLR0_CADS0_DTLA0_DTLB0_DTVA0_DTVB0_DTVMXSA0_DTVMXSB0_DTVSM0_DPLBn1_EPS0_ELFLR0_EMLLn1_FDSI0_GRPM1_GRVWA8_GRVWB8_GSU1_GSUAMB_GSUC0_GSUWGMRR0_GLS0_ISA1151_IU1_K1_LDSTI0_LBSPPA128_LBSPPB128_LBSPPM0_LPA8_LPB8_LPM0_LRVW16_LWPMn1_MIAV1_MIWT3_4_MO40_MGRIPMn1_NTn1_NTA0_NTB0_NTC0_NTD0_NTM0_NEPBS0_NLCA1_NLCB1_ONLL1_PGR0_PLR0_PKA0_SGROBn1_SIA3_SS1_SU32_SUM1_SUS256_SPO0_SRVW0_SSO0_SVW1_SK0_SKFTR0_SKXCCM0_SGRO0_TDMI0_TIN0_TLDS1_TLDSM1_ULSGRO0_USL1_UIOFGRO0_UPLRP0_USFGROn1_VSn1_VWA1_VWB1_WSGRA0_WSGRB0_WS32_WG64_2_1_WGM8_WGMXCC1_WGMXCCGn1
    SolutionIndex: 108
    SolutionNameMin: Cijk_Alik_Bljk_BBS_BH_Bias_HA_S_SAV_UserArgs_MT128x160x32_MI16x16x1_SN_LDSB0_AFC1_AG0_AFEM1_AFEM1_ASEM1_CLR0_CADS0_DTLA0_DTLB0_DTVA0_DTVB0_DTVMXSA0_DTVMXSB0_DTVSM0_DPLBn1_EPS0_ELFLR0_EMLLn1_FDSI0_GRPM1_GRVWA8_GRVWB8_GSU1_GSUAMB_GSUC0_GSUWGMRR0_GLS0_ISA1151_IU1_K1_LDSTI0_LBSPPA128_LBSPPB128_LBSPPM0_LPA8_LPB8_LPM0_LRVW16_LWPMn1_MIAV1_MIWT4_5_MO40_MGRIPMn1_NTn1_NTA0_NTB0_NTC0_NTD0_NTM0_NEPBS0_NLCA1_NLCB1_ONLL1_PGR0_PLR0_PKA0_SGROBn1_SIA3_SS1_SU32_SUM1_SUS256_SPO0_SRVW0_SSO0_SVW1_SK0_SKFTR0_SKXCCM0_SGRO0_TDMI0_TIN0_TLDS1_TLDSM1_ULSGRO0_USL1_UIOFGRO0_UPLRP0_USFGROn1_VSn1_VWA1_VWB1_WSGRA0_WSGRB0_WS32_WG32_4_1_WGM8_WGMXCC1_WGMXCCGn1
    SolutionIndex: 109
    SolutionNameMin: Cijk_Alik_Bljk_BBS_BH_Bias_HA_S_SAV_UserArgs_MT64x64x128_MI16x16x1_SN_LDSB1_AFC1_AG0_AFEM1_AFEM1_ASEM1_CLR0_CADS0_DTLA0_DTLB0_DTVA0_DTVB0_DTVMXSA0_DTVMXSB0_DTVSM0_DPLBn1_EPS0_ELFLR0_EMLLn1_FDSI0_GRPM1_GRVWA8_GRVWB8_GSU1_GSUAMB_GSUC0_GSUWGMRR0_GLS0_ISA1151_IU1_K1_LDSTI0_LBSPPA256_LBSPPB256_LBSPPM0_LPA8_LPB8_LPM0_LRVW16_LWPMn1_MIAV1_MIWT2_2_MO40_MGRIPMn1_NTn1_NTA0_NTB0_NTC0_NTD0_NTM0_NEPBS0_NLCA1_NLCB1_ONLL1_PGR2_PLR1_PKA0_SGROBn1_SIA3_SS1_SU32_SUM1_SUS256_SPO0_SRVW0_SSO0_SVW1_SK0_SKFTR0_SKXCCM0_SGRO0_TDMI0_TIN0_TLDS1_TLDSM1_ULSGRO0_USL1_UIOFGRO0_UPLRP0_USFGROn1_VSn1_VWA1_VWB1_WSGRA0_WSGRB0_WS32_WG32_4_1_WGM8_WGMXCC1_WGMXCCGn1
    SolutionIndex: 110
    SolutionNameMin: Cijk_Alik_Bljk_BBS_BH_Bias_HA_S_SAV_UserArgs_MT64x128x64_MI16x16x1_SN_LDSB1_AFC1_AG0_AFEM1_AFEM1_ASEM1_CLR0_CADS0_DTLA0_DTLB0_DTVA0_DTVB0_DTVMXSA0_DTVMXSB0_DTVSM0_DPLBn1_EPS0_ELFLR0_EMLLn1_FDSI0_GRPM1_GRVWA8_GRVWB8_GSU1_GSUAMB_GSUC0_GSUWGMRR0_GLS0_ISA1151_IU1_K1_LDSTI0_LBSPPA128_LBSPPB128_LBSPPM0_LPA8_LPB8_LPM0_LRVW16_LWPMn1_MIAV1_MIWT4_2_MO40_MGRIPMn1_NTn1_NTA0_NTB0_NTC0_NTD0_NTM0_NEPBS0_NLCA1_NLCB1_ONLL1_PGR1_PLR1_PKA0_SGROBn1_SIA3_SS1_SU32_SUM1_SUS256_SPO0_SRVW0_SSO0_SVW1_SK0_SKFTR0_SKXCCM0_SGRO0_TDMI0_TIN0_TLDS1_TLDSM1_ULSGRO0_USL1_UIOFGRO0_UPLRP0_USFGROn1_VSn1_VWA1_VWB1_WSGRA0_WSGRB0_WS32_WG16_8_1_WGM8_WGMXCC1_WGMXCCGn1
    SolutionIndex: 111
    SolutionNameMin: Cijk_Alik_Bljk_BBS_BH_Bias_HA_S_SAV_UserArgs_MT32x64x64_MI16x16x1_SN_LDSB0_AFC1_AG0_AFEM1_AFEM1_ASEM1_CLR0_CADS0_DTLA0_DTLB0_DTVA0_DTVB0_DTVMXSA0_DTVMXSB0_DTVSM0_DPLBn1_EPS0_ELFLR0_EMLLn1_FDSI0_GRPM1_GRVWA8_GRVWB8_GSU1_GSUAMB_GSUC0_GSUWGMRR0_GLS0_ISA1151_IU1_K1_LDSTI0_LBSPPA128_LBSPPB128_LBSPPM0_LPA8_LPB8_LPM0_LRVW16_LWPMn1_MIAV1_MIWT1_2_MO40_MGRIPMn1_NTn1_NTA0_NTB0_NTC0_NTD0_NTM0_NEPBS0_NLCA1_NLCB1_ONLL1_PGR1_PLR1_PKA0_SGROBn1_SIA1_SS1_SU32_SUM1_SUS256_SPO0_SRVW0_SSO0_SVW1_SK0_SKFTR0_SKXCCM0_SGRO0_TDMI0_TIN0_TLDS1_TLDSM1_ULSGRO0_USL1_UIOFGRO0_UPLRP0_USFGROn1_VSn1_VWA1_VWB1_WSGRA0_WSGRB0_WS32_WG32_4_1_WGM8_WGMXCC1_WGMXCCGn1
    SolutionIndex: 112
    SolutionNameMin: Cijk_Alik_Bljk_BBS_BH_Bias_HA_S_SAV_UserArgs_MT32x128x32_MI16x16x1_SN_LDSB0_AFC1_AG0_AFEM1_AFEM1_ASEM1_CLR0_CADS0_DTLA0_DTLB0_DTVA0_DTVB0_DTVMXSA0_DTVMXSB0_DTVSM0_DPLBn1_EPS0_ELFLR0_EMLLn1_FDSI0_GRPM1_GRVWA8_GRVWB8_GSU1_GSUAMB_GSUC0_GSUWGMRR0_GLS0_ISA1151_IU1_K1_LDSTI0_LBSPPA128_LBSPPB128_LBSPPM0_LPA8_LPB8_LPM0_LRVW16_LWPMn1_MIAV1_MIWT2_2_MO40_MGRIPMn1_NTn1_NTA0_NTB0_NTC0_NTD0_NTM0_NEPBS0_NLCA1_NLCB1_ONLL1_PGR2_PLR1_PKA0_SGROBn1_SIA1_SS1_SU32_SUM1_SUS256_SPO0_SRVW0_SSO0_SVW1_SK0_SKFTR0_SKXCCM0_SGRO0_TDMI0_TIN0_TLDS1_TLDSM1_ULSGRO0_USL1_UIOFGRO0_UPLRP0_USFGROn1_VSn1_VWA1_VWB1_WSGRA0_WSGRB0_WS32_WG16_8_1_WGM8_WGMXCC1_WGMXCCGn1
    SolutionIndex: 113
    SolutionNameMin: Cijk_Alik_Bljk_BBS_BH_Bias_HA_S_SAV_UserArgs_MT64x128x64_MI16x16x1_SN_LDSB0_AFC1_AG0_AFEM1_AFEM1_ASEM1_CLR0_CADS0_DTLA0_DTLB0_DTVA0_DTVB0_DTVMXSA0_DTVMXSB0_DTVSM0_DPLBn1_EPS0_ELFLR0_EMLLn1_FDSI0_GRPM1_GRVWA8_GRVWB8_GSU1_GSUAMB_GSUC0_GSUWGMRR0_GLS0_ISA1151_IU1_K1_LDSTI0_LBSPPA128_LBSPPB128_LBSPPM0_LPA8_LPB8_LPM0_LRVW16_LWPMn1_MIAV1_MIWT2_4_MO40_MGRIPMn1_NTn1_NTA0_NTB0_NTC0_NTD0_NTM0_NEPBS0_NLCA1_NLCB1_ONLL1_PGR0_PLR1_PKA0_SGROBn1_SIA3_SS1_SU32_SUM1_SUS256_SPO0_SRVW0_SSO0_SVW1_SK0_SKFTR0_SKXCCM0_SGRO0_TDMI0_TIN0_TLDS1_TLDSM1_ULSGRO0_USL1_UIOFGRO0_UPLRP0_USFGROn1_VSn1_VWA1_VWB1_WSGRA0_WSGRB0_WS32_WG32_4_1_WGM8_WGMXCC1_WGMXCCGn1
    SolutionIndex: 114
    SolutionNameMin: Cijk_Alik_Bljk_BBS_BH_Bias_HA_S_SAV_UserArgs_MT128x64x32_MI16x16x1_SN_LDSB0_AFC1_AG0_AFEM1_AFEM1_ASEM1_CLR0_CADS0_DTLA0_DTLB0_DTVA0_DTVB0_DTVMXSA0_DTVMXSB0_DTVSM0_DPLBn1_EPS0_ELFLR0_EMLLn1_FDSI0_GRPM1_GRVWA8_GRVWB8_GSU1_GSUAMB_GSUC0_GSUWGMRR0_GLS0_ISA1151_IU1_K1_LDSTI0_LBSPPA128_LBSPPB128_LBSPPM0_LPA8_LPB8_LPM0_LRVW16_LWPMn1_MIAV1_MIWT2_4_MO40_MGRIPMn1_NTn1_NTA0_NTB0_NTC0_NTD0_NTM0_NEPBS0_NLCA1_NLCB1_ONLL1_PGR2_PLR1_PKA0_SGROBn1_SIA3_SS1_SU32_SUM1_SUS256_SPO0_SRVW0_SSO0_SVW1_SK0_SKFTR0_SKXCCM0_SGRO0_TDMI0_TIN0_TLDS1_TLDSM1_ULSGRO0_USL1_UIOFGRO0_UPLRP0_USFGROn1_VSn1_VWA1_VWB1_WSGRA0_WSGRB0_WS32_WG64_2_1_WGM8_WGMXCC1_WGMXCCGn1
    SolutionIndex: 115
    SolutionNameMin: Cijk_Alik_Bljk_BBS_BH_Bias_HA_S_SAV_UserArgs_MT32x64x128_MI16x16x1_SN_LDSB0_AFC1_AG0_AFEM1_AFEM1_ASEM1_CLR0_CADS0_DTLA0_DTLB0_DTVA0_DTVB0_DTVMXSA0_DTVMXSB0_DTVSM0_DPLBn1_EPS0_ELFLR0_EMLLn1_FDSI0_GRPM1_GRVWA8_GRVWB8_GSU1_GSUAMB_GSUC0_GSUWGMRR0_GLS0_ISA1151_IU1_K1_LDSTI0_LBSPPA256_LBSPPB256_LBSPPM0_LPA8_LPB8_LPM0_LRVW16_LWPMn1_MIAV1_MIWT1_2_MO40_MGRIPMn1_NTn1_NTA0_NTB0_NTC0_NTD0_NTM0_NEPBS0_NLCA1_NLCB1_ONLL1_PGR2_PLR1_PKA0_SGROBn1_SIA1_SS1_SU32_SUM1_SUS256_SPO0_SRVW0_SSO0_SVW1_SK0_SKFTR0_SKXCCM0_SGRO0_TDMI0_TIN0_TLDS1_TLDSM1_ULSGRO0_USL1_UIOFGRO0_UPLRP0_USFGROn1_VSn1_VWA1_VWB1_WSGRA0_WSGRB0_WS32_WG32_4_1_WGM8_WGMXCC1_WGMXCCGn1
    SolutionIndex: 116
    SolutionNameMin: Cijk_Alik_Bljk_BBS_BH_Bias_HA_S_SAV_UserArgs_MT32x32x64_MI16x16x1_SN_LDSB0_AFC1_AG0_AFEM1_AFEM1_ASEM1_CLR0_CADS0_DTLA0_DTLB0_DTVA0_DTVB0_DTVMXSA0_DTVMXSB0_DTVSM0_DPLBn1_EPS0_ELFLR0_EMLLn1_FDSI0_GRPM1_GRVWA8_GRVWB8_GSU1_GSUAMB_GSUC0_GSUWGMRR0_GLS0_ISA1151_IU1_K1_LDSTI0_LBSPPA128_LBSPPB128_LBSPPM0_LPA8_LPB8_LPM0_LRVW16_LWPMn1_MIAV1_MIWT1_1_MO40_MGRIPMn1_NTn1_NTA0_NTB0_NTC0_NTD0_NTM0_NEPBS0_NLCA1_NLCB1_ONLL1_PGR2_PLR1_PKA0_SGROBn1_SIA3_SS1_SU32_SUM1_SUS256_SPO0_SRVW0_SSO0_SVW1_SK0_SKFTR0_SKXCCM0_SGRO0_TDMI0_TIN0_TLDS1_TLDSM1_ULSGRO0_USL1_UIOFGRO0_UPLRP0_USFGROn1_VSn1_VWA1_VWB1_WSGRA0_WSGRB0_WS32_WG32_4_1_WGM8_WGMXCC1_WGMXCCGn1
    SolutionIndex: 117
    SolutionNameMin: Cijk_Alik_Bljk_BBS_BH_Bias_HA_S_SAV_UserArgs_MT64x48x128_MI16x16x1_SN_LDSB0_AFC1_AG0_AFEM1_AFEM1_ASEM1_CLR0_CADS0_DTLA0_DTLB0_DTVA0_DTVB0_DTVMXSA0_DTVMXSB0_DTVSM0_DPLBn1_EPS0_ELFLR0_EMLLn1_FDSI0_GRPM1_GRVWA8_GRVWB8_GSU1_GSUAMB_GSUC0_GSUWGMRR0_GLS0_ISA1151_IU1_K1_LDSTI0_LBSPPA256_LBSPPB256_LBSPPM0_LPA8_LPB8_LPM0_LRVW16_LWPMn1_MIAV1_MIWT1_3_MO40_MGRIPMn1_NTn1_NTA0_NTB0_NTC0_NTD0_NTM0_NEPBS0_NLCA1_NLCB1_ONLL1_PGR2_PLR1_PKA0_SGROBn1_SIA1_SS1_SU32_SUM1_SUS256_SPO0_SRVW0_SSO0_SVW1_SK0_SKFTR0_SKXCCM0_SGRO0_TDMI0_TIN0_TLDS1_TLDSM1_ULSGRO0_USL1_UIOFGRO0_UPLRP0_USFGROn1_VSn1_VWA1_VWB1_WSGRA0_WSGRB0_WS32_WG64_2_1_WGM8_WGMXCC1_WGMXCCGn1
    SolutionIndex: 118
    SolutionNameMin: Cijk_Alik_Bljk_BBS_BH_Bias_HA_S_SAV_UserArgs_MT64x32x64_MI16x16x1_SN_LDSB0_AFC1_AG0_AFEM1_AFEM1_ASEM1_CLR0_CADS0_DTLA0_DTLB0_DTVA0_DTVB0_DTVMXSA0_DTVMXSB0_DTVSM0_DPLBn1_EPS0_ELFLR0_EMLLn1_FDSI0_GRPM1_GRVWA8_GRVWB8_GSU1_GSUAMB_GSUC0_GSUWGMRR0_GLS0_ISA1151_IU1_K1_LDSTI0_LBSPPA128_LBSPPB128_LBSPPM0_LPA8_LPB8_LPM0_LRVW16_LWPMn1_MIAV1_MIWT1_2_MO40_MGRIPMn1_NTn1_NTA0_NTB0_NTC0_NTD0_NTM0_NEPBS0_NLCA1_NLCB1_ONLL1_PGR2_PLR1_PKA0_SGROBn1_SIA1_SS1_SU32_SUM1_SUS256_SPO0_SRVW0_SSO0_SVW1_SK0_SKFTR0_SKXCCM0_SGRO0_TDMI0_TIN0_TLDS1_TLDSM1_ULSGRO0_USL1_UIOFGRO0_UPLRP0_USFGROn1_VSn1_VWA1_VWB1_WSGRA0_WSGRB0_WS32_WG64_2_1_WGM8_WGMXCC1_WGMXCCGn1
    SolutionIndex: 119
    SolutionNameMin: Cijk_Alik_Bljk_BBS_BH_Bias_HA_S_SAV_UserArgs_MT64x96x32_MI16x16x1_SN_LDSB0_AFC1_AG0_AFEM1_AFEM1_ASEM1_CLR0_CADS0_DTLA0_DTLB0_DTVA0_DTVB0_DTVMXSA0_DTVMXSB0_DTVSM0_DPLBn1_EPS0_ELFLR0_EMLLn1_FDSI0_GRPM1_GRVWA8_GRVWB8_GSU1_GSUAMB_GSUC0_GSUWGMRR0_GLS0_ISA1151_IU1_K1_LDSTI0_LBSPPA128_LBSPPB128_LBSPPM0_LPA8_LPB8_LPM0_LRVW16_LWPMn1_MIAV1_MIWT2_3_MO40_MGRIPMn1_NTn1_NTA0_NTB0_NTC0_NTD0_NTM0_NEPBS0_NLCA1_NLCB1_ONLL1_PGR2_PLR0_PKA0_SGROBn1_SIA1_SS1_SU32_SUM1_SUS256_SPO0_SRVW0_SSO0_SVW1_SK0_SKFTR0_SKXCCM0_SGRO0_TDMI0_TIN0_TLDS1_TLDSM1_ULSGRO0_USL1_UIOFGRO0_UPLRP0_USFGROn1_VSn1_VWA1_VWB1_WSGRA0_WSGRB0_WS32_WG32_4_1_WGM8_WGMXCC1_WGMXCCGn1
    SolutionIndex: 120
    SolutionNameMin: Cijk_Alik_Bljk_BBS_BH_Bias_HA_S_SAV_UserArgs_MT64x32x128_MI16x16x1_SN_LDSB0_AFC1_AG0_AFEM1_AFEM1_ASEM1_CLR0_CADS0_DTLA0_DTLB0_DTVA0_DTVB0_DTVMXSA0_DTVMXSB0_DTVSM0_DPLBn1_EPS0_ELFLR0_EMLLn1_FDSI0_GRPM1_GRVWA8_GRVWB8_GSU1_GSUAMB_GSUC0_GSUWGMRR0_GLS0_ISA1151_IU1_K1_LDSTI0_LBSPPA256_LBSPPB256_LBSPPM0_LPA8_LPB8_LPM0_LRVW16_LWPMn1_MIAV1_MIWT1_2_MO40_MGRIPMn1_NTn1_NTA0_NTB0_NTC0_NTD0_NTM0_NEPBS0_NLCA1_NLCB1_ONLL1_PGR2_PLR1_PKA0_SGROBn1_SIA1_SS1_SU32_SUM1_SUS256_SPO0_SRVW0_SSO0_SVW1_SK0_SKFTR0_SKXCCM0_SGRO0_TDMI0_TIN0_TLDS1_TLDSM1_ULSGRO0_USL1_UIOFGRO0_UPLRP0_USFGROn1_VSn1_VWA1_VWB1_WSGRA0_WSGRB0_WS32_WG64_2_1_WGM8_WGMXCC1_WGMXCCGn1
    SolutionIndex: 121
    SolutionNameMin: Cijk_Alik_Bljk_BBS_BH_Bias_HA_S_SAV_UserArgs_MT128x48x32_MI16x16x1_SN_LDSB0_AFC1_AG0_AFEM1_AFEM1_ASEM1_CLR0_CADS0_DTLA0_DTLB0_DTVA0_DTVB0_DTVMXSA0_DTVMXSB0_DTVSM0_DPLBn1_EPS0_ELFLR0_EMLLn1_FDSI0_GRPM1_GRVWA8_GRVWB4_GSU1_GSUAMB_GSUC0_GSUWGMRR0_GLS0_ISA1151_IU1_K1_LDSTI0_LBSPPA128_LBSPPB128_LBSPPM0_LPA8_LPB8_LPM0_LRVW16_LWPMn1_MIAV1_MIWT2_3_MO40_MGRIPMn1_NTn1_NTA0_NTB0_NTC0_NTD0_NTM0_NEPBS0_NLCA1_NLCB1_ONLL1_PGR2_PLR1_PKA0_SGROBn1_SIA1_SS1_SU32_SUM1_SUS256_SPO0_SRVW0_SSO0_SVW1_SK0_SKFTR0_SKXCCM0_SGRO0_TDMI0_TIN0_TLDS1_TLDSM1_ULSGRO0_USL1_UIOFGRO0_UPLRP0_USFGROn1_VSn1_VWA1_VWB1_WSGRA0_WSGRB0_WS32_WG64_2_1_WGM8_WGMXCC1_WGMXCCGn1
    SolutionIndex: 122
    SolutionNameMin: Cijk_Alik_Bljk_BBS_BH_Bias_HA_S_SAV_UserArgs_MT128x64x32_MI16x16x1_SN_LDSB0_AFC1_AG0_AFEM1_AFEM1_ASEM1_CLR0_CADS0_DTLA0_DTLB0_DTVA0_DTVB0_DTVMXSA0_DTVMXSB0_DTVSM0_DPLBn1_EPS0_ELFLR0_EMLLn1_FDSI0_GRPM1_GRVWA8_GRVWB8_GSU1_GSUAMB_GSUC0_GSUWGMRR0_GLS0_ISA1151_IU1_K1_LDSTI0_LBSPPA128_LBSPPB128_LBSPPM0_LPA8_LPB8_LPM0_LRVW16_LWPMn1_MIAV1_MIWT2_4_MO40_MGRIPMn1_NTn1_NTA0_NTB0_NTC0_NTD0_NTM0_NEPBS0_NLCA1_NLCB1_ONLL1_PGR1_PLR0_PKA0_SGROBn1_SIA3_SS1_SU32_SUM1_SUS256_SPO0_SRVW0_SSO0_SVW1_SK0_SKFTR0_SKXCCM0_SGRO0_TDMI0_TIN0_TLDS1_TLDSM1_ULSGRO0_USL1_UIOFGRO0_UPLRP0_USFGROn1_VSn1_VWA1_VWB1_WSGRA0_WSGRB0_WS32_WG64_2_1_WGM8_WGMXCC1_WGMXCCGn1
    SolutionIndex: 123
    SolutionNameMin: Cijk_Alik_Bljk_BBS_BH_Bias_HA_S_SAV_UserArgs_MT16x16x128_MI16x16x1_SN_LDSB0_AFC1_AG0_AFEM1_AFEM1_ASEM1_CLR0_CADS0_DTLA0_DTLB0_DTVA0_DTVB0_DTVMXSA0_DTVMXSB0_DTVSM0_DPLBn1_EPS0_ELFLR0_EMLLn1_FDSI0_GRPM1_GRVWA8_GRVWB8_GSU1_GSUAMB_GSUC0_GSUWGMRR0_GLS0_ISA1151_IU1_K1_LDSTI0_LBSPPA256_LBSPPB256_LBSPPM0_LPA8_LPB8_LPM0_LRVW16_LWPMn1_MIAV1_MIWT1_1_MO40_MGRIPMn1_NTn1_NTA0_NTB0_NTC0_NTD0_NTM0_NEPBS0_NLCA1_NLCB1_ONLL1_PGR1_PLR1_PKA0_SGROBn1_SIA3_SS1_SU32_SUM1_SUS256_SPO0_SRVW0_SSO0_SVW1_SK0_SKFTR0_SKXCCM0_SGRO0_TDMI0_TIN0_TLDS1_TLDSM1_ULSGRO0_USL1_UIOFGRO0_UPLRP0_USFGROn1_VSn1_VWA1_VWB1_WSGRA0_WSGRB0_WS32_WG16_2_1_WGM8_WGMXCC1_WGMXCCGn1
    SolutionIndex: 124
    SolutionNameMin: Cijk_Alik_Bljk_BBS_BH_Bias_HA_S_SAV_UserArgs_MT128x32x32_MI16x16x1_SN_LDSB0_AFC1_AG0_AFEM1_AFEM1_ASEM1_CLR0_CADS0_DTLA0_DTLB0_DTVA0_DTVB0_DTVMXSA0_DTVMXSB0_DTVSM0_DPLBn1_EPS0_ELFLR0_EMLLn1_FDSI0_GRPM1_GRVWA8_GRVWB8_GSU1_GSUAMB_GSUC0_GSUWGMRR0_GLS0_ISA1151_IU1_K1_LDSTI0_LBSPPA128_LBSPPB128_LBSPPM0_LPA8_LPB8_LPM0_LRVW16_LWPMn1_MIAV1_MIWT2_2_MO40_MGRIPMn1_NTn1_NTA0_NTB0_NTC0_NTD0_NTM0_NEPBS0_NLCA1_NLCB1_ONLL1_PGR2_PLR1_PKA0_SGROBn1_SIA1_SS1_SU32_SUM1_SUS256_SPO0_SRVW0_SSO0_SVW1_SK0_SKFTR0_SKXCCM0_SGRO0_TDMI0_TIN0_TLDS1_TLDSM1_ULSGRO0_USL1_UIOFGRO0_UPLRP0_USFGROn1_VSn1_VWA1_VWB1_WSGRA0_WSGRB0_WS32_WG64_2_1_WGM8_WGMXCC1_WGMXCCGn1
    SolutionIndex: 125
    SolutionNameMin: Cijk_Alik_Bljk_BBS_BH_Bias_HA_S_SAV_UserArgs_MT128x64x64_MI16x16x1_SN_LDSB1_AFC1_AG0_AFEM1_AFEM1_ASEM1_CLR0_CADS0_DTLA0_DTLB0_DTVA0_DTVB0_DTVMXSA0_DTVMXSB0_DTVSM0_DPLBn1_EPS0_ELFLR0_EMLLn1_FDSI0_GRPM1_GRVWA8_GRVWB8_GSU1_GSUAMB_GSUC0_GSUWGMRR0_GLS0_ISA1151_IU1_K1_LDSTI0_LBSPPA128_LBSPPB128_LBSPPM0_LPA8_LPB8_LPM0_LRVW16_LWPMn1_MIAV1_MIWT2_4_MO40_MGRIPMn1_NTn1_NTA0_NTB0_NTC0_NTD0_NTM0_NEPBS0_NLCA1_NLCB1_ONLL1_PGR2_PLR1_PKA0_SGROBn1_SIA3_SS1_SU32_SUM1_SUS256_SPO0_SRVW0_SSO0_SVW1_SK0_SKFTR0_SKXCCM0_SGRO0_TDMI0_TIN0_TLDS1_TLDSM1_ULSGRO0_USL1_UIOFGRO0_UPLRP0_USFGROn1_VSn1_VWA1_VWB1_WSGRA0_WSGRB0_WS32_WG64_2_1_WGM8_WGMXCC1_WGMXCCGn1
    SolutionIndex: 126
    SolutionNameMin: Cijk_Alik_Bljk_BBS_BH_Bias_HA_S_SAV_UserArgs_MT128x96x32_MI16x16x1_SN_LDSB1_AFC1_AG0_AFEM1_AFEM1_ASEM1_CLR0_CADS0_DTLA0_DTLB0_DTVA0_DTVB0_DTVMXSA0_DTVMXSB0_DTVSM0_DPLBn1_EPS0_ELFLR0_EMLLn1_FDSI0_GRPM1_GRVWA8_GRVWB8_GSU1_GSUAMB_GSUC0_GSUWGMRR0_GLS0_ISA1151_IU1_K1_LDSTI0_LBSPPA128_LBSPPB128_LBSPPM0_LPA8_LPB8_LPM0_LRVW16_LWPMn1_MIAV1_MIWT4_3_MO40_MGRIPMn1_NTn1_NTA0_NTB0_NTC0_NTD0_NTM0_NEPBS0_NLCA1_NLCB1_ONLL1_PGR2_PLR1_PKA0_SGROBn1_SIA3_SS1_SU32_SUM1_SUS256_SPO0_SRVW0_SSO0_SVW1_SK0_SKFTR0_SKXCCM0_SGRO0_TDMI0_TIN0_TLDS1_TLDSM1_ULSGRO0_USL1_UIOFGRO0_UPLRP0_USFGROn1_VSn1_VWA1_VWB1_WSGRA0_WSGRB0_WS32_WG32_4_1_WGM8_WGMXCC1_WGMXCCGn1
    SolutionIndex: 127
    SolutionNameMin: Cijk_Alik_Bljk_BBS_BH_Bias_HA_S_SAV_UserArgs_MT128x96x32_MI16x16x1_SN_LDSB0_AFC1_AG0_AFEM1_AFEM1_ASEM1_CLR0_CADS0_DTLA0_DTLB0_DTVA0_DTVB0_DTVMXSA0_DTVMXSB0_DTVSM0_DPLBn1_EPS0_ELFLR0_EMLLn1_FDSI0_GRPM1_GRVWA8_GRVWB8_GSU1_GSUAMB_GSUC0_GSUWGMRR0_GLS0_ISA1151_IU1_K1_LDSTI0_LBSPPA128_LBSPPB128_LBSPPM0_LPA8_LPB8_LPM0_LRVW16_LWPMn1_MIAV1_MIWT4_3_MO40_MGRIPMn1_NTn1_NTA0_NTB0_NTC0_NTD0_NTM0_NEPBS0_NLCA1_NLCB1_ONLL1_PGR2_PLR1_PKA0_SGROBn1_SIA3_SS1_SU32_SUM1_SUS256_SPO0_SRVW0_SSO0_SVW1_SK0_SKFTR0_SKXCCM0_SGRO0_TDMI0_TIN0_TLDS1_TLDSM1_ULSGRO0_USL1_UIOFGRO0_UPLRP0_USFGROn1_VSn1_VWA1_VWB1_WSGRA0_WSGRB0_WS32_WG32_4_1_WGM8_WGMXCC1_WGMXCCGn1
    SolutionIndex: 128
    SolutionNameMin: Cijk_Alik_Bljk_BBS_BH_Bias_HA_S_SAV_UserArgs_MT128x64x64_MI16x16x1_SN_LDSB1_AFC1_AG0_AFEM1_AFEM1_ASEM1_CLR0_CADS0_DTLA0_DTLB0_DTVA0_DTVB0_DTVMXSA0_DTVMXSB0_DTVSM0_DPLBn1_EPS0_ELFLR0_EMLLn1_FDSI0_GRPM1_GRVWA8_GRVWB8_GSU1_GSUAMB_GSUC0_GSUWGMRR0_GLS0_ISA1151_IU1_K1_LDSTI0_LBSPPA128_LBSPPB128_LBSPPM0_LPA8_LPB8_LPM0_LRVW16_LWPMn1_MIAV1_MIWT2_4_MO40_MGRIPMn1_NTn1_NTA0_NTB0_NTC0_NTD0_NTM0_NEPBS0_NLCA1_NLCB1_ONLL1_PGR1_PLR1_PKA0_SGROBn1_SIA3_SS1_SU32_SUM1_SUS256_SPO0_SRVW0_SSO0_SVW1_SK0_SKFTR0_SKXCCM0_SGRO0_TDMI0_TIN0_TLDS1_TLDSM1_ULSGRO0_USL1_UIOFGRO0_UPLRP0_USFGROn1_VSn1_VWA1_VWB1_WSGRA0_WSGRB0_WS32_WG64_2_1_WGM8_WGMXCC1_WGMXCCGn1
    SolutionIndex: 129
    SolutionNameMin: Cijk_Alik_Bljk_BBS_BH_Bias_HA_S_SAV_UserArgs_MT128x64x64_MI16x16x1_SN_LDSB1_AFC1_AG0_AFEM1_AFEM1_ASEM1_CLR0_CADS0_DTLA0_DTLB0_DTVA0_DTVB0_DTVMXSA0_DTVMXSB0_DTVSM0_DPLBn1_EPS0_ELFLR0_EMLLn1_FDSI0_GRPM1_GRVWA8_GRVWB8_GSU1_GSUAMB_GSUC0_GSUWGMRR0_GLS0_ISA1151_IU1_K1_LDSTI0_LBSPPA128_LBSPPB128_LBSPPM0_LPA8_LPB8_LPM0_LRVW16_LWPMn1_MIAV1_MIWT4_2_MO40_MGRIPMn1_NTn1_NTA0_NTB0_NTC0_NTD0_NTM0_NEPBS0_NLCA1_NLCB1_ONLL1_PGR1_PLR1_PKA0_SGROBn1_SIA3_SS1_SU32_SUM1_SUS256_SPO0_SRVW0_SSO0_SVW1_SK0_SKFTR0_SKXCCM0_SGRO0_TDMI0_TIN0_TLDS1_TLDSM1_ULSGRO0_USL1_UIOFGRO0_UPLRP0_USFGROn1_VSn1_VWA1_VWB1_WSGRA0_WSGRB0_WS32_WG32_4_1_WGM8_WGMXCC1_WGMXCCGn1
    SolutionIndex: 130
    SolutionNameMin: Cijk_Alik_Bljk_BBS_BH_Bias_HA_S_SAV_UserArgs_MT16x16x128_MI16x16x1_SN_LDSB0_AFC1_AG0_AFEM1_AFEM1_ASEM1_CLR0_CADS0_DTLA0_DTLB0_DTVA0_DTVB0_DTVMXSA0_DTVMXSB0_DTVSM0_DPLBn1_EPS0_ELFLR0_EMLLn1_FDSI0_GRPM1_GRVWA8_GRVWB8_GSU1_GSUAMB_GSUC0_GSUWGMRR0_GLS0_ISA1151_IU1_K1_LDSTI0_LBSPPA256_LBSPPB256_LBSPPM0_LPA8_LPB8_LPM0_LRVW16_LWPMn1_MIAV1_MIWT1_1_MO40_MGRIPMn1_NTn1_NTA0_NTB0_NTC0_NTD0_NTM0_NEPBS0_NLCA1_NLCB1_ONLL1_PGR0_PLR1_PKA0_SGROBn1_SIA1_SS1_SU32_SUM1_SUS256_SPO0_SRVW0_SSO0_SVW1_SK0_SKFTR0_SKXCCM0_SGRO0_TDMI0_TIN0_TLDS1_TLDSM1_ULSGRO0_USL1_UIOFGRO0_UPLRP0_USFGROn1_VSn1_VWA1_VWB1_WSGRA0_WSGRB0_WS32_WG16_2_1_WGM8_WGMXCC1_WGMXCCGn1
    SolutionIndex: 131
    SolutionNameMin: Cijk_Alik_Bljk_BBS_BH_Bias_HA_S_SAV_UserArgs_MT16x16x128_MI16x16x1_SN_LDSB0_AFC1_AG0_AFEM1_AFEM1_ASEM1_CLR0_CADS0_DTLA0_DTLB0_DTVA0_DTVB0_DTVMXSA0_DTVMXSB0_DTVSM0_DPLBn1_EPS0_ELFLR0_EMLLn1_FDSI0_GRPM1_GRVWA8_GRVWB8_GSU1_GSUAMB_GSUC0_GSUWGMRR0_GLS0_ISA1151_IU1_K1_LDSTI0_LBSPPA256_LBSPPB256_LBSPPM0_LPA8_LPB8_LPM0_LRVW16_LWPMn1_MIAV1_MIWT1_1_MO40_MGRIPMn1_NTn1_NTA0_NTB0_NTC0_NTD0_NTM0_NEPBS0_NLCA1_NLCB1_ONLL1_PGR0_PLR1_PKA0_SGROBn1_SIA3_SS1_SU32_SUM1_SUS256_SPO0_SRVW0_SSO0_SVW1_SK0_SKFTR0_SKXCCM0_SGRO0_TDMI0_TIN0_TLDS1_TLDSM1_ULSGRO0_USL1_UIOFGRO0_UPLRP0_USFGROn1_VSn1_VWA1_VWB1_WSGRA0_WSGRB0_WS32_WG16_2_1_WGM8_WGMXCC1_WGMXCCGn1
    SolutionIndex: 132
    SolutionNameMin: Cijk_Alik_Bljk_BBS_BH_Bias_HA_S_SAV_UserArgs_MT16x16x32_MI16x16x1_SN_LDSB0_AFC1_AG0_AFEM1_AFEM1_ASEM1_CLR0_CADS0_DTLA0_DTLB0_DTVA0_DTVB0_DTVMXSA0_DTVMXSB0_DTVSM0_DPLBn1_EPS0_ELFLR0_EMLLn1_FDSI0_GRPM1_GRVWA8_GRVWB8_GSU1_GSUAMB_GSUC0_GSUWGMRR0_GLS0_ISA1151_IU1_K1_LDSTI0_LBSPPA128_LBSPPB128_LBSPPM0_LPA8_LPB8_LPM0_LRVW16_LWPMn1_MIAV1_MIWT1_1_MO40_MGRIPMn1_NTn1_NTA0_NTB0_NTC0_NTD0_NTM0_NEPBS0_NLCA1_NLCB1_ONLL1_PGR2_PLR1_PKA0_SGROBn1_SIA3_SS1_SU32_SUM1_SUS256_SPO0_SRVW0_SSO0_SVW1_SK0_SKFTR0_SKXCCM0_SGRO0_TDMI0_TIN0_TLDS1_TLDSM1_ULSGRO0_USL1_UIOFGRO0_UPLRP0_USFGROn1_VSn1_VWA1_VWB1_WSGRA0_WSGRB0_WS32_WG16_2_1_WGM8_WGMXCC1_WGMXCCGn1
    SolutionIndex: 133
    SolutionNameMin: Cijk_Alik_Bljk_BBS_BH_Bias_HA_S_SAV_UserArgs_MT16x64x64_MI16x16x1_SN_LDSB0_AFC1_AG0_AFEM1_AFEM1_ASEM1_CLR0_CADS0_DTLA0_DTLB0_DTVA0_DTVB0_DTVMXSA0_DTVMXSB0_DTVSM0_DPLBn1_EPS0_ELFLR0_EMLLn1_FDSI0_GRPM1_GRVWA8_GRVWB8_GSU1_GSUAMB_GSUC0_GSUWGMRR0_GLS0_ISA1151_IU1_K1_LDSTI0_LBSPPA128_LBSPPB128_LBSPPM0_LPA8_LPB8_LPM0_LRVW16_LWPMn1_MIAV1_MIWT1_1_MO40_MGRIPMn1_NTn1_NTA0_NTB0_NTC0_NTD0_NTM0_NEPBS0_NLCA1_NLCB1_ONLL1_PGR2_PLR1_PKA0_SGROBn1_SIA1_SS1_SU32_SUM1_SUS256_SPO0_SRVW0_SSO0_SVW1_SK0_SKFTR0_SKXCCM0_SGRO0_TDMI0_TIN0_TLDS1_TLDSM1_ULSGRO0_USL1_UIOFGRO0_UPLRP0_USFGROn1_VSn1_VWA1_VWB1_WSGRA0_WSGRB0_WS32_WG16_8_1_WGM8_WGMXCC1_WGMXCCGn1
    SolutionIndex: 134
    SolutionNameMin: Cijk_Alik_Bljk_BBS_BH_Bias_HA_S_SAV_UserArgs_MT16x16x128_MI16x16x1_SN_LDSB0_AFC1_AG0_AFEM1_AFEM1_ASEM1_CLR0_CADS0_DTLA0_DTLB0_DTVA0_DTVB0_DTVMXSA0_DTVMXSB0_DTVSM0_DPLBn1_EPS0_ELFLR0_EMLLn1_FDSI0_GRPM1_GRVWA8_GRVWB8_GSU1_GSUAMB_GSUC0_GSUWGMRR0_GLS0_ISA1151_IU1_K1_LDSTI0_LBSPPA256_LBSPPB256_LBSPPM0_LPA8_LPB8_LPM0_LRVW16_LWPMn1_MIAV1_MIWT1_1_MO40_MGRIPMn1_NTn1_NTA0_NTB0_NTC0_NTD0_NTM0_NEPBS0_NLCA1_NLCB1_ONLL1_PGR2_PLR1_PKA0_SGROBn1_SIA3_SS1_SU32_SUM1_SUS256_SPO0_SRVW0_SSO0_SVW1_SK0_SKFTR0_SKXCCM0_SGRO0_TDMI0_TIN0_TLDS1_TLDSM1_ULSGRO0_USL1_UIOFGRO0_UPLRP0_USFGROn1_VSn1_VWA1_VWB1_WSGRA0_WSGRB0_WS32_WG16_2_1_WGM8_WGMXCC1_WGMXCCGn1
    SolutionIndex: 135
    SolutionNameMin: Cijk_Alik_Bljk_BBS_BH_Bias_HA_S_SAV_UserArgs_MT16x16x64_MI16x16x1_SN_LDSB0_AFC1_AG0_AFEM1_AFEM1_ASEM1_CLR0_CADS0_DTLA0_DTLB0_DTVA0_DTVB0_DTVMXSA0_DTVMXSB0_DTVSM0_DPLBn1_EPS0_ELFLR0_EMLLn1_FDSI0_GRPM1_GRVWA8_GRVWB8_GSU1_GSUAMB_GSUC0_GSUWGMRR0_GLS0_ISA1151_IU1_K1_LDSTI0_LBSPPA128_LBSPPB128_LBSPPM0_LPA8_LPB8_LPM0_LRVW16_LWPMn1_MIAV1_MIWT1_1_MO40_MGRIPMn1_NTn1_NTA0_NTB0_NTC0_NTD0_NTM0_NEPBS0_NLCA1_NLCB1_ONLL1_PGR2_PLR1_PKA0_SGROBn1_SIA1_SS1_SU32_SUM1_SUS256_SPO0_SRVW0_SSO0_SVW1_SK0_SKFTR0_SKXCCM0_SGRO0_TDMI0_TIN0_TLDS1_TLDSM1_ULSGRO0_USL1_UIOFGRO0_UPLRP0_USFGROn1_VSn1_VWA1_VWB1_WSGRA0_WSGRB0_WS32_WG16_2_1_WGM8_WGMXCC1_WGMXCCGn1
    SolutionIndex: 136
    SolutionNameMin: Cijk_Alik_Bljk_BBS_BH_Bias_HA_S_SAV_UserArgs_MT32x16x128_MI16x16x1_SN_LDSB0_AFC1_AG0_AFEM1_AFEM1_ASEM1_CLR0_CADS0_DTLA0_DTLB0_DTVA0_DTVB0_DTVMXSA0_DTVMXSB0_DTVSM0_DPLBn1_EPS0_ELFLR0_EMLLn1_FDSI0_GRPM1_GRVWA8_GRVWB8_GSU1_GSUAMB_GSUC0_GSUWGMRR0_GLS0_ISA1151_IU1_K1_LDSTI0_LBSPPA256_LBSPPB256_LBSPPM0_LPA8_LPB8_LPM0_LRVW16_LWPMn1_MIAV1_MIWT1_1_MO40_MGRIPMn1_NTn1_NTA0_NTB0_NTC0_NTD0_NTM0_NEPBS0_NLCA1_NLCB1_ONLL1_PGR2_PLR1_PKA0_SGROBn1_SIA1_SS1_SU32_SUM1_SUS256_SPO0_SRVW0_SSO0_SVW1_SK0_SKFTR0_SKXCCM0_SGRO0_TDMI0_TIN0_TLDS1_TLDSM1_ULSGRO0_USL1_UIOFGRO0_UPLRP0_USFGROn1_VSn1_VWA1_VWB1_WSGRA0_WSGRB0_WS32_WG32_2_1_WGM8_WGMXCC1_WGMXCCGn1
    SolutionIndex: 137
    SolutionNameMin: Cijk_Alik_Bljk_BBS_BH_Bias_HA_S_SAV_UserArgs_MT32x32x128_MI16x16x1_SN_LDSB0_AFC1_AG0_AFEM1_AFEM1_ASEM1_CLR0_CADS0_DTLA0_DTLB0_DTVA0_DTVB0_DTVMXSA0_DTVMXSB0_DTVSM0_DPLBn1_EPS0_ELFLR0_EMLLn1_FDSI0_GRPM1_GRVWA8_GRVWB8_GSU1_GSUAMB_GSUC0_GSUWGMRR0_GLS0_ISA1151_IU1_K1_LDSTI0_LBSPPA256_LBSPPB256_LBSPPM0_LPA8_LPB8_LPM0_LRVW16_LWPMn1_MIAV1_MIWT1_1_MO40_MGRIPMn1_NTn1_NTA0_NTB0_NTC0_NTD0_NTM0_NEPBS0_NLCA1_NLCB1_ONLL1_PGR1_PLR1_PKA0_SGROBn1_SIA3_SS1_SU32_SUM1_SUS256_SPO0_SRVW0_SSO0_SVW1_SK0_SKFTR0_SKXCCM0_SGRO0_TDMI0_TIN0_TLDS1_TLDSM1_ULSGRO0_USL1_UIOFGRO0_UPLRP0_USFGROn1_VSn1_VWA1_VWB1_WSGRA0_WSGRB0_WS32_WG32_4_1_WGM8_WGMXCC1_WGMXCCGn1
    SolutionIndex: 138
    SolutionNameMin: Cijk_Alik_Bljk_BBS_BH_Bias_HA_S_SAV_UserArgs_MT32x32x128_MI16x16x1_SN_LDSB0_AFC1_AG0_AFEM1_AFEM1_ASEM1_CLR0_CADS0_DTLA0_DTLB0_DTVA0_DTVB0_DTVMXSA0_DTVMXSB0_DTVSM0_DPLBn1_EPS0_ELFLR0_EMLLn1_FDSI0_GRPM1_GRVWA8_GRVWB8_GSU1_GSUAMB_GSUC0_GSUWGMRR0_GLS0_ISA1151_IU1_K1_LDSTI0_LBSPPA256_LBSPPB256_LBSPPM0_LPA8_LPB8_LPM0_LRVW16_LWPMn1_MIAV1_MIWT1_1_MO40_MGRIPMn1_NTn1_NTA0_NTB0_NTC0_NTD0_NTM0_NEPBS0_NLCA1_NLCB1_ONLL1_PGR1_PLR1_PKA0_SGROBn1_SIA1_SS1_SU32_SUM1_SUS256_SPO0_SRVW0_SSO0_SVW1_SK0_SKFTR0_SKXCCM0_SGRO0_TDMI0_TIN0_TLDS1_TLDSM1_ULSGRO0_USL1_UIOFGRO0_UPLRP0_USFGROn1_VSn1_VWA1_VWB1_WSGRA0_WSGRB0_WS32_WG32_4_1_WGM8_WGMXCC1_WGMXCCGn1
    SolutionIndex: 139
    SolutionNameMin: Cijk_Alik_Bljk_BBS_BH_Bias_HA_S_SAV_UserArgs_MT64x16x64_MI16x16x1_SN_LDSB0_AFC1_AG0_AFEM1_AFEM1_ASEM1_CLR0_CADS0_DTLA0_DTLB0_DTVA0_DTVB0_DTVMXSA0_DTVMXSB0_DTVSM0_DPLBn1_EPS0_ELFLR0_EMLLn1_FDSI0_GRPM1_GRVWA8_GRVWB8_GSU1_GSUAMB_GSUC0_GSUWGMRR0_GLS0_ISA1151_IU1_K1_LDSTI0_LBSPPA128_LBSPPB128_LBSPPM0_LPA8_LPB8_LPM0_LRVW16_LWPMn1_MIAV1_MIWT1_1_MO40_MGRIPMn1_NTn1_NTA0_NTB0_NTC0_NTD0_NTM0_NEPBS0_NLCA1_NLCB1_ONLL1_PGR2_PLR1_PKA0_SGROBn1_SIA3_SS1_SU32_SUM1_SUS256_SPO0_SRVW0_SSO0_SVW1_SK0_SKFTR0_SKXCCM0_SGRO0_TDMI0_TIN0_TLDS1_TLDSM1_ULSGRO0_USL1_UIOFGRO0_UPLRP0_USFGROn1_VSn1_VWA1_VWB1_WSGRA0_WSGRB0_WS32_WG64_2_1_WGM8_WGMXCC1_WGMXCCGn1
    SolutionIndex: 140
    SolutionNameMin: Cijk_Alik_Bljk_BBS_BH_Bias_HA_S_SAV_UserArgs_MT64x32x32_MI16x16x1_SN_LDSB0_AFC1_AG0_AFEM1_AFEM1_ASEM1_CLR0_CADS0_DTLA0_DTLB0_DTVA0_DTVB0_DTVMXSA0_DTVMXSB0_DTVSM0_DPLBn1_EPS0_ELFLR0_EMLLn1_FDSI0_GRPM1_GRVWA8_GRVWB8_GSU1_GSUAMB_GSUC0_GSUWGMRR0_GLS0_ISA1151_IU1_K1_LDSTI0_LBSPPA128_LBSPPB128_LBSPPM0_LPA8_LPB8_LPM0_LRVW16_LWPMn1_MIAV1_MIWT2_1_MO40_MGRIPMn1_NTn1_NTA0_NTB0_NTC0_NTD0_NTM0_NEPBS0_NLCA1_NLCB1_ONLL1_PGR2_PLR1_PKA0_SGROBn1_SIA1_SS1_SU32_SUM1_SUS256_SPO0_SRVW0_SSO0_SVW1_SK0_SKFTR0_SKXCCM0_SGRO0_TDMI0_TIN0_TLDS1_TLDSM1_ULSGRO0_USL1_UIOFGRO0_UPLRP0_USFGROn1_VSn1_VWA1_VWB1_WSGRA0_WSGRB0_WS32_WG32_4_1_WGM8_WGMXCC1_WGMXCCGn1
    SolutionIndex: 141
    SolutionNameMin: Cijk_Alik_Bljk_BBS_BH_Bias_HA_S_SAV_UserArgs_MT32x16x64_MI16x16x1_SN_LDSB0_AFC1_AG0_AFEM1_AFEM1_ASEM1_CLR0_CADS0_DTLA0_DTLB0_DTVA0_DTVB0_DTVMXSA0_DTVMXSB0_DTVSM0_DPLBn1_EPS0_ELFLR0_EMLLn1_FDSI0_GRPM1_GRVWA8_GRVWB8_GSU1_GSUAMB_GSUC0_GSUWGMRR0_GLS0_ISA1151_IU1_K1_LDSTI0_LBSPPA128_LBSPPB128_LBSPPM0_LPA8_LPB8_LPM0_LRVW16_LWPMn1_MIAV1_MIWT1_1_MO40_MGRIPMn1_NTn1_NTA0_NTB0_NTC0_NTD0_NTM0_NEPBS0_NLCA1_NLCB1_ONLL1_PGR1_PLR1_PKA0_SGROBn1_SIA1_SS1_SU32_SUM1_SUS256_SPO0_SRVW0_SSO0_SVW1_SK0_SKFTR0_SKXCCM0_SGRO0_TDMI0_TIN0_TLDS1_TLDSM1_ULSGRO0_USL1_UIOFGRO0_UPLRP0_USFGROn1_VSn1_VWA1_VWB1_WSGRA0_WSGRB0_WS32_WG32_2_1_WGM8_WGMXCC1_WGMXCCGn1
    SolutionIndex: 142
    SolutionNameMin: Cijk_Alik_Bljk_BBS_BH_Bias_HA_S_SAV_UserArgs_MT32x64x128_MI16x16x1_SN_LDSB0_AFC1_AG0_AFEM1_AFEM1_ASEM1_CLR0_CADS0_DTLA0_DTLB0_DTVA0_DTVB0_DTVMXSA0_DTVMXSB0_DTVSM0_DPLBn1_EPS0_ELFLR0_EMLLn1_FDSI0_GRPM1_GRVWA8_GRVWB8_GSU1_GSUAMB_GSUC0_GSUWGMRR0_GLS0_ISA1151_IU1_K1_LDSTI0_LBSPPA256_LBSPPB256_LBSPPM0_LPA8_LPB8_LPM0_LRVW16_LWPMn1_MIAV1_MIWT1_2_MO40_MGRIPMn1_NTn1_NTA0_NTB0_NTC0_NTD0_NTM0_NEPBS0_NLCA1_NLCB1_ONLL1_PGR1_PLR1_PKA0_SGROBn1_SIA1_SS1_SU32_SUM1_SUS256_SPO0_SRVW0_SSO0_SVW1_SK0_SKFTR0_SKXCCM0_SGRO0_TDMI0_TIN0_TLDS1_TLDSM1_ULSGRO0_USL1_UIOFGRO0_UPLRP0_USFGROn1_VSn1_VWA1_VWB1_WSGRA0_WSGRB0_WS32_WG32_4_1_WGM8_WGMXCC1_WGMXCCGn1
    SolutionIndex: 143
    SolutionNameMin: Cijk_Alik_Bljk_BBS_BH_Bias_HA_S_SAV_UserArgs_MT64x64x32_MI16x16x1_SN_LDSB0_AFC1_AG0_AFEM1_AFEM1_ASEM1_CLR0_CADS0_DTLA0_DTLB0_DTVA0_DTVB0_DTVMXSA0_DTVMXSB0_DTVSM0_DPLBn1_EPS0_ELFLR0_EMLLn1_FDSI0_GRPM1_GRVWA8_GRVWB8_GSU1_GSUAMB_GSUC0_GSUWGMRR0_GLS0_ISA1151_IU1_K1_LDSTI0_LBSPPA128_LBSPPB128_LBSPPM0_LPA8_LPB8_LPM0_LRVW16_LWPMn1_MIAV1_MIWT2_2_MO40_MGRIPMn1_NTn1_NTA0_NTB0_NTC0_NTD0_NTM0_NEPBS0_NLCA1_NLCB1_ONLL1_PGR1_PLR1_PKA0_SGROBn1_SIA3_SS1_SU32_SUM1_SUS256_SPO0_SRVW0_SSO0_SVW1_SK0_SKFTR0_SKXCCM0_SGRO0_TDMI0_TIN0_TLDS1_TLDSM1_ULSGRO0_USL1_UIOFGRO0_UPLRP0_USFGROn1_VSn1_VWA1_VWB1_WSGRA0_WSGRB0_WS32_WG32_4_1_WGM8_WGMXCC1_WGMXCCGn1
    SolutionIndex: 144
    SolutionNameMin: Cijk_Alik_Bljk_BBS_BH_Bias_HA_S_SAV_UserArgs_MT16x64x64_MI16x16x1_SN_LDSB0_AFC1_AG0_AFEM1_AFEM1_ASEM1_CLR0_CADS0_DTLA0_DTLB0_DTVA0_DTVB0_DTVMXSA0_DTVMXSB0_DTVSM0_DPLBn1_EPS0_ELFLR0_EMLLn1_FDSI0_GRPM1_GRVWA8_GRVWB8_GSU1_GSUAMB_GSUC0_GSUWGMRR0_GLS0_ISA1151_IU1_K1_LDSTI0_LBSPPA128_LBSPPB128_LBSPPM0_LPA8_LPB8_LPM0_LRVW16_LWPMn1_MIAV1_MIWT1_1_MO40_MGRIPMn1_NTn1_NTA0_NTB0_NTC0_NTD0_NTM0_NEPBS0_NLCA1_NLCB1_ONLL1_PGR2_PLR1_PKA0_SGROBn1_SIA3_SS1_SU32_SUM1_SUS256_SPO0_SRVW0_SSO0_SVW1_SK0_SKFTR0_SKXCCM0_SGRO0_TDMI0_TIN0_TLDS1_TLDSM1_ULSGRO0_USL1_UIOFGRO0_UPLRP0_USFGROn1_VSn1_VWA1_VWB1_WSGRA0_WSGRB0_WS32_WG16_8_1_WGM8_WGMXCC1_WGMXCCGn1
    SolutionIndex: 145
    SolutionNameMin: Cijk_Alik_Bljk_BBS_BH_Bias_HA_S_SAV_UserArgs_MT16x16x64_MI16x16x1_CMS_SN_LDSB0_AFC1_AG0_AFEM1_AFEM1_ASEM1_CLR1_CADS0_DTLA0_DTLB0_DTVA0_DTVB0_DTVMXSA0_DTVMXSB0_DTVSM0_DPLBn1_EPS0_ELFLR0_EMLLn1_FDSI0_GRPM1_GRVWA2_GRVWB2_GSU1_GSUAMB_GSUC0_GSUWGMRR0_GLS0_ISA1151_IU1_K1_LDSTI0_LBSPPA128_LBSPPB128_LBSPPM0_LPA16_LPB16_LPM0_LRVW16_LWPMn1_MIAV1_MIWT1_1_MO40_MGRIPMn1_NTn1_NTA0_NTB0_NTC0_NTD0_NTM0_NEPBS0_NLCA1_NLCB1_ONLL1_PGR1_PLR1_PKA0_SGROBn1_SIA3_SS1_SU32_SUM1_SUS256_SPO0_SRVW0_SSO0_SVW1_SK0_SKFTR0_SKXCCM0_SGRO0_TDMI0_TIN0_TLDS1_TLDSM1_ULSGRO0_USL1_UIOFGRO0_UPLRP0_USFGROn1_VSn1_VWA1_VWB1_WSGRA0_WSGRB0_WS32_WG16_2_1_WGM8_WGMXCC1_WGMXCCGn1
    SolutionIndex: 146
    SolutionNameMin: Cijk_Alik_Bljk_BBS_BH_Bias_HA_S_SAV_UserArgs_MT32x96x32_MI16x16x1_CMS_SN_LDSB0_AFC1_AG0_AFEM1_AFEM1_ASEM1_CLR1_CADS0_DTLA0_DTLB0_DTVA0_DTVB0_DTVMXSA0_DTVMXSB0_DTVSM0_DPLBn1_EPS0_ELFLR0_EMLLn1_FDSI0_GRPM1_GRVWA8_GRVWB8_GSU1_GSUAMB_GSUC0_GSUWGMRR0_GLS0_ISA1151_IU1_LDSTI0_LBSPPA128_LBSPPB128_LBSPPM0_LPA16_LPB16_LPM0_LRVW16_LWPMn1_MIAV1_MIWT1_3_MO40_MGRIPMn1_NTn1_NTA0_NTB0_NTC0_NTD0_NTM0_NEPBS0_NLCA1_NLCB1_ONLL1_PGR2_PLR1_PKA0_SGROBn1_SIA3_SS1_SU32_SUM1_SUS256_SPO0_SRVW0_SSO0_SVW1_SK0_SKFTR0_SKXCCM0_SGRO0_TDMI0_TIN0_TLDS1_TLDSM1_ULSGRO0_USL1_UIOFGRO0_UPLRP0_USFGROn1_VSn1_VWA1_VWB1_WSGRA0_WSGRB0_WS32_WG32_4_1_WGM8_WGMXCC1_WGMXCCGn1
    SolutionIndex: 147
    SolutionNameMin: Cijk_Alik_Bljk_BBS_BH_Bias_HA_S_SAV_UserArgs_MT64x192x32_MI16x16x1_CMS_SN_LDSB1_AFC1_AG0_AFEM1_AFEM1_ASEM1_CLR1_CADS0_DTLA0_DTLB0_DTVA0_DTVB0_DTVMXSA0_DTVMXSB0_DTVSM0_DPLBn1_EPS0_ELFLR0_EMLLn1_FDSI0_GRPM1_GRVWA2_GRVWB8_GSU1_GSUAMB_GSUC0_GSUWGMRR0_GLS0_ISA1151_IU1_K1_LDSTI0_LBSPPA128_LBSPPB128_LBSPPM0_LPA16_LPB16_LPM0_LRVW16_LWPMn1_MIAV1_MIWT4_3_MO40_MGRIPMn1_NTn1_NTA0_NTB0_NTC0_NTD0_NTM0_NEPBS0_NLCA1_NLCB1_ONLL1_PGR2_PLR1_PKA0_SGROBn1_SIA3_SS1_SU32_SUM1_SUS256_SPO0_SRVW0_SSO0_SVW1_SK0_SKFTR0_SKXCCM0_SGRO0_TDMI0_TIN0_TLDS1_TLDSM1_ULSGRO0_USL1_UIOFGRO0_UPLRP0_USFGROn1_VSn1_VWA1_VWB1_WSGRA0_WSGRB0_WS32_WG16_8_1_WGM8_WGMXCC1_WGMXCCGn1
    SolutionIndex: 148
    SolutionNameMin: Cijk_Alik_Bljk_BBS_BH_Bias_HA_S_SAV_UserArgs_MT64x192x32_MI16x16x1_CMS_SN_LDSB1_AFC1_AG0_AFEM1_AFEM1_ASEM1_CLR1_CADS0_DTLA0_DTLB0_DTVA0_DTVB0_DTVMXSA0_DTVMXSB0_DTVSM0_DPLBn1_EPS0_ELFLR0_EMLLn1_FDSI0_GRPM1_GRVWA2_GRVWB8_GSU1_GSUAMB_GSUC0_GSUWGMRR0_GLS0_ISA1151_IU1_K1_LDSTI0_LBSPPA128_LBSPPB128_LBSPPM0_LPA16_LPB16_LPM0_LRVW16_LWPMn1_MIAV1_MIWT4_3_MO40_MGRIPMn1_NTn1_NTA0_NTB0_NTC0_NTD0_NTM0_NEPBS0_NLCA1_NLCB1_ONLL1_PGR1_PLR1_PKA0_SGROBn1_SIA3_SS1_SU32_SUM1_SUS256_SPO0_SRVW0_SSO0_SVW1_SK0_SKFTR0_SKXCCM0_SGRO0_TDMI0_TIN0_TLDS1_TLDSM1_ULSGRO0_USL1_UIOFGRO0_UPLRP0_USFGROn1_VSn1_VWA1_VWB1_WSGRA0_WSGRB0_WS32_WG16_8_1_WGM8_WGMXCC1_WGMXCCGn1
    SolutionIndex: 149
    SolutionNameMin: Cijk_Alik_Bljk_BBS_BH_Bias_HA_S_SAV_UserArgs_MT32x64x32_MI16x16x1_CMS_SN_LDSB0_AFC1_AG0_AFEM1_AFEM1_ASEM1_CLR1_CADS0_DTLA0_DTLB0_DTVA0_DTVB0_DTVMXSA0_DTVMXSB0_DTVSM0_DPLBn1_EPS0_ELFLR0_EMLLn1_FDSI0_GRPM1_GRVWA8_GRVWB8_GSU1_GSUAMB_GSUC0_GSUWGMRR0_GLS0_ISA1151_IU1_LDSTI0_LBSPPA1024_LBSPPB2048_LBSPPM0_LPA16_LPB16_LPM0_LRVW16_LWPMn1_MIAV1_MIWT2_1_MO40_MGRIPMn1_NTn1_NTA0_NTB0_NTC0_NTD0_NTM0_NEPBS0_NLCA1_NLCB1_ONLL1_PGR2_PLR1_PKA0_SGROBn1_SIA3_SS1_SU32_SUM1_SUS256_SPO0_SRVW0_SSO0_SVW1_SK0_SKFTR0_SKXCCM0_SGRO0_TDMI0_TIN0_TLDS0_TLDSM1_ULSGRO0_USL1_UIOFGRO0_UPLRP0_USFGROn1_VSn1_VWA1_VWB1_WSGRA0_WSGRB0_WS32_WG16_8_1_WGM8_WGMXCC1_WGMXCCGn1
    SolutionIndex: 150
    SolutionNameMin: Cijk_Alik_Bljk_BBS_BH_Bias_HA_S_SAV_UserArgs_MT64x160x32_MI16x16x1_CMS_SN_LDSB1_AFC1_AG0_AFEM1_AFEM1_ASEM1_CLR1_CADS0_DTLA0_DTLB0_DTVA0_DTVB0_DTVMXSA0_DTVMXSB0_DTVSM0_DPLBn1_EPS0_ELFLR0_EMLLn1_FDSI0_GRPM1_GRVWA1_GRVWB8_GSU1_GSUAMB_GSUC0_GSUWGMRR0_GLS0_ISA1151_IU1_LDSTI0_LBSPPA128_LBSPPB128_LBSPPM0_LPA16_LPB16_LPM0_LRVW16_LWPMn1_MIAV1_MIWT2_5_MO40_MGRIPMn1_NTn1_NTA0_NTB0_NTC0_NTD0_NTM0_NEPBS0_NLCA1_NLCB1_ONLL1_PGR2_PLR1_PKA0_SGROBn1_SIA3_SS1_SU32_SUM1_SUS256_SPO0_SRVW0_SSO0_SVW1_SK0_SKFTR0_SKXCCM0_SGRO0_TDMI0_TIN0_TLDS1_TLDSM1_ULSGRO0_USL1_UIOFGRO0_UPLRP0_USFGROn1_VSn1_VWA1_VWB1_WSGRA0_WSGRB0_WS32_WG32_4_1_WGM8_WGMXCC1_WGMXCCGn1
    SolutionIndex: 151
    SolutionNameMin: Cijk_Alik_Bljk_BBS_BH_Bias_HA_S_SAV_UserArgs_MT160x64x32_MI16x16x1_CMS_SN_LDSB1_AFC1_AG0_AFEM1_AFEM1_ASEM1_CLR1_CADS0_DTLA0_DTLB0_DTVA0_DTVB0_DTVMXSA0_DTVMXSB0_DTVSM0_DPLBn1_EPS0_ELFLR0_EMLLn1_FDSI0_GRPM1_GRVWA8_GRVWB8_GSU1_GSUAMB_GSUC0_GSUWGMRR0_GLS0_ISA1151_IU1_K1_LDSTI0_LBSPPA128_LBSPPB128_LBSPPM0_LPA16_LPB16_LPM0_LRVW16_LWPMn1_MIAV1_MIWT5_2_MO40_MGRIPMn1_NTn1_NTA0_NTB0_NTC0_NTD0_NTM0_NEPBS0_NLCA1_NLCB1_ONLL1_PGR2_PLR1_PKA0_SGROBn1_SIA3_SS1_SU32_SUM1_SUS256_SPO0_SRVW0_SSO0_SVW1_SK0_SKFTR0_SKXCCM0_SGRO0_TDMI0_TIN0_TLDS1_TLDSM1_ULSGRO0_USL1_UIOFGRO0_UPLRP0_USFGROn1_VSn1_VWA1_VWB1_WSGRA0_WSGRB0_WS32_WG32_4_1_WGM8_WGMXCC1_WGMXCCGn1
    SolutionIndex: 152
    SolutionNameMin: Cijk_Alik_Bljk_BBS_BH_Bias_HA_S_SAV_UserArgs_MT32x160x32_MI16x16x1_CMS_SN_LDSB0_AFC1_AG0_AFEM1_AFEM1_ASEM1_CLR1_CADS0_DTLA0_DTLB0_DTVA0_DTVB0_DTVMXSA0_DTVMXSB0_DTVSM0_DPLBn1_EPS0_ELFLR0_EMLLn1_FDSI0_GRPM1_GRVWA8_GRVWB8_GSU1_GSUAMB_GSUC0_GSUWGMRR0_GLS0_ISA1151_IU1_LDSTI0_LBSPPA128_LBSPPB128_LBSPPM0_LPA16_LPB16_LPM0_LRVW16_LWPMn1_MIAV1_MIWT1_5_MO40_MGRIPMn1_NTn1_NTA0_NTB0_NTC0_NTD0_NTM0_NEPBS0_NLCA1_NLCB1_ONLL1_PGR2_PLR1_PKA0_SGROBn1_SIA3_SS1_SU32_SUM1_SUS256_SPO0_SRVW0_SSO0_SVW1_SK0_SKFTR0_SKXCCM0_SGRO0_TDMI0_TIN0_TLDS1_TLDSM1_ULSGRO0_USL1_UIOFGRO0_UPLRP0_USFGROn1_VSn1_VWA1_VWB1_WSGRA0_WSGRB0_WS32_WG32_4_1_WGM8_WGMXCC1_WGMXCCGn1
    SolutionIndex: 153
    SolutionNameMin: Cijk_Alik_Bljk_BBS_BH_Bias_HA_S_SAV_UserArgs_MT64x48x32_MI16x16x1_CMS_SN_LDSB0_AFC1_AG0_AFEM1_AFEM1_ASEM1_CLR1_CADS0_DTLA0_DTLB0_DTVA0_DTVB0_DTVMXSA0_DTVMXSB0_DTVSM0_DPLBn1_EPS0_ELFLR0_EMLLn1_FDSI0_GRPM1_GRVWA1_GRVWB4_GSU1_GSUAMB_GSUC0_GSUWGMRR0_GLS0_ISA1151_IU1_LDSTI0_LBSPPA128_LBSPPB128_LBSPPM0_LPA16_LPB16_LPM0_LRVW16_LWPMn1_MIAV1_MIWT1_3_MO40_MGRIPMn1_NTn1_NTA0_NTB0_NTC0_NTD0_NTM0_NEPBS0_NLCA1_NLCB1_ONLL1_PGR2_PLR1_PKA0_SGROBn1_SIA3_SS1_SU32_SUM1_SUS256_SPO0_SRVW0_SSO0_SVW1_SK0_SKFTR0_SKXCCM0_SGRO0_TDMI0_TIN0_TLDS1_TLDSM1_ULSGRO0_USL1_UIOFGRO0_UPLRP0_USFGROn1_VSn1_VWA1_VWB1_WSGRA0_WSGRB0_WS32_WG64_2_1_WGM8_WGMXCC1_WGMXCCGn1
    SolutionIndex: 154
    SolutionNameMin: Cijk_Alik_Bljk_BBS_BH_Bias_HA_S_SAV_UserArgs_MT64x192x32_MI16x16x1_CMS_SN_LDSB0_AFC1_AG0_AFEM1_AFEM1_ASEM1_CLR1_CADS0_DTLA0_DTLB0_DTVA0_DTVB0_DTVMXSA0_DTVMXSB0_DTVSM0_DPLBn1_EPS0_ELFLR0_EMLLn1_FDSI0_GRPM1_GRVWA8_GRVWB2_GSU1_GSUAMB_GSUC0_GSUWGMRR0_GLS0_ISA1151_IU1_K1_LDSTI0_LBSPPA128_LBSPPB128_LBSPPM0_LPA16_LPB16_LPM0_LRVW16_LWPMn1_MIAV1_MIWT4_3_MO40_MGRIPMn1_NTn1_NTA0_NTB0_NTC0_NTD0_NTM0_NEPBS0_NLCA1_NLCB1_ONLL1_PGR2_PLR1_PKA0_SGROBn1_SIA3_SS1_SU32_SUM1_SUS256_SPO0_SRVW0_SSO0_SVW1_SK0_SKFTR0_SKXCCM0_SGRO0_TDMI0_TIN0_TLDS1_TLDSM1_ULSGRO0_USL1_UIOFGRO0_UPLRP0_USFGROn1_VSn1_VWA1_VWB1_WSGRA0_WSGRB0_WS32_WG16_8_1_WGM8_WGMXCC1_WGMXCCGn1
    SolutionIndex: 155
    SolutionNameMin: Cijk_Alik_Bljk_BBS_BH_Bias_HA_S_SAV_UserArgs_MT32x64x32_MI16x16x1_CMS_SN_LDSB0_AFC1_AG0_AFEM1_AFEM1_ASEM1_CLR1_CADS0_DTLA0_DTLB0_DTVA0_DTVB0_DTVMXSA0_DTVMXSB0_DTVSM0_DPLBn1_EPS0_ELFLR0_EMLLn1_FDSI0_GRPM1_GRVWA1_GRVWB1_GSU1_GSUAMB_GSUC0_GSUWGMRR0_GLS0_ISA1151_IU1_LDSTI0_LBSPPA128_LBSPPB128_LBSPPM0_LPA16_LPB16_LPM0_LRVW16_LWPMn1_MIAV1_MIWT2_1_MO40_MGRIPMn1_NTn1_NTA0_NTB0_NTC0_NTD0_NTM0_NEPBS0_NLCA1_NLCB1_ONLL1_PGR2_PLR1_PKA0_SGROBn1_SIA3_SS1_SU32_SUM1_SUS256_SPO0_SRVW0_SSO0_SVW1_SK0_SKFTR0_SKXCCM0_SGRO0_TDMI0_TIN0_TLDS1_TLDSM1_ULSGRO0_USL1_UIOFGRO0_UPLRP0_USFGROn1_VSn1_VWA1_VWB1_WSGRA0_WSGRB0_WS32_WG16_8_1_WGM8_WGMXCC1_WGMXCCGn1
    SolutionIndex: 156
    SolutionNameMin: Cijk_Alik_Bljk_BBS_BH_Bias_HA_S_SAV_UserArgs_MT32x128x64_MI16x16x1_CMS_SN_LDSB1_AFC1_AG0_AFEM1_AFEM1_ASEM1_CLR1_CADS0_DTLA0_DTLB0_DTVA0_DTVB0_DTVMXSA0_DTVMXSB0_DTVSM0_DPLBn1_EPS0_ELFLR0_EMLLn1_FDSI0_GRPM1_GRVWA8_GRVWB8_GSU1_GSUAMB_GSUC0_GSUWGMRR0_GLS0_ISA1151_IU1_K1_LDSTI0_LBSPPA128_LBSPPB128_LBSPPM0_LPA16_LPB16_LPM0_LRVW16_LWPMn1_MIAV1_MIWT2_2_MO40_MGRIPMn1_NTn1_NTA0_NTB0_NTC0_NTD0_NTM0_NEPBS0_NLCA1_NLCB1_ONLL1_PGR2_PLR1_PKA0_SGROBn1_SIA3_SS1_SU32_SUM1_SUS256_SPO0_SRVW0_SSO0_SVW1_SK0_SKFTR0_SKXCCM0_SGRO0_TDMI0_TIN0_TLDS1_TLDSM1_ULSGRO0_USL1_UIOFGRO0_UPLRP0_USFGROn1_VSn1_VWA1_VWB1_WSGRA0_WSGRB0_WS32_WG16_8_1_WGM8_WGMXCC1_WGMXCCGn1
    SolutionIndex: 157
    SolutionNameMin: Cijk_Alik_Bljk_BBS_BH_Bias_HA_S_SAV_UserArgs_MT32x32x32_MI16x16x1_CMS_SN_LDSB0_AFC1_AG0_AFEM1_AFEM1_ASEM1_CLR1_CADS0_DTLA0_DTLB0_DTVA0_DTVB0_DTVMXSA0_DTVMXSB0_DTVSM0_DPLBn1_EPS0_ELFLR0_EMLLn1_FDSI0_GRPM1_GRVWA1_GRVWB8_GSU1_GSUAMB_GSUC0_GSUWGMRR0_GLS0_ISA1151_IU1_LDSTI0_LBSPPA128_LBSPPB128_LBSPPM0_LPA16_LPB16_LPM0_LRVW16_LWPMn1_MIAV1_MIWT1_1_MO40_MGRIPMn1_NTn1_NTA0_NTB0_NTC0_NTD0_NTM0_NEPBS0_NLCA1_NLCB1_ONLL1_PGR2_PLR1_PKA0_SGROBn1_SIA3_SS1_SU32_SUM1_SUS256_SPO0_SRVW0_SSO0_SVW1_SK0_SKFTR0_SKXCCM0_SGRO0_TDMI0_TIN0_TLDS1_TLDSM1_ULSGRO0_USL1_UIOFGRO0_UPLRP0_USFGROn1_VSn1_VWA1_VWB1_WSGRA0_WSGRB0_WS32_WG32_4_1_WGM8_WGMXCC1_WGMXCCGn1
    SolutionIndex: 158
    SolutionNameMin: Cijk_Alik_Bljk_BBS_BH_Bias_HA_S_SAV_UserArgs_MT64x64x64_MI16x16x1_CMS_SN_LDSB0_AFC1_AG0_AFEM1_AFEM1_ASEM1_CLR1_CADS0_DTLA0_DTLB0_DTVA0_DTVB0_DTVMXSA0_DTVMXSB0_DTVSM0_DPLBn1_EPS0_ELFLR0_EMLLn1_FDSI0_GRPM1_GRVWA8_GRVWB8_GSU1_GSUAMB_GSUC0_GSUWGMRR0_GLS0_ISA1151_IU1_K1_LDSTI0_LBSPPA128_LBSPPB128_LBSPPM0_LPA16_LPB16_LPM0_LRVW16_LWPMn1_MIAV1_MIWT2_2_MO40_MGRIPMn1_NTn1_NTA0_NTB0_NTC0_NTD0_NTM0_NEPBS0_NLCA1_NLCB1_ONLL1_PGR2_PLR1_PKA0_SGROBn1_SIA3_SS1_SU32_SUM1_SUS256_SPO0_SRVW0_SSO0_SVW1_SK0_SKFTR0_SKXCCM0_SGRO0_TDMI0_TIN0_TLDS1_TLDSM1_ULSGRO0_USL1_UIOFGRO0_UPLRP0_USFGROn1_VSn1_VWA1_VWB1_WSGRA0_WSGRB0_WS32_WG32_4_1_WGM8_WGMXCC1_WGMXCCGn1
    SolutionIndex: 159
    SolutionNameMin: Cijk_Alik_Bljk_BBS_BH_Bias_HA_S_SAV_UserArgs_MT96x128x32_MI16x16x1_CMS_SN_LDSB1_AFC1_AG0_AFEM1_AFEM1_ASEM1_CLR1_CADS0_DTLA0_DTLB0_DTVA0_DTVB0_DTVMXSA0_DTVMXSB0_DTVSM0_DPLBn1_EPS0_ELFLR0_EMLLn1_FDSI0_GRPM1_GRVWA8_GRVWB8_GSU1_GSUAMB_GSUC0_GSUWGMRR0_GLS0_ISA1151_IU1_K1_LDSTI0_LBSPPA128_LBSPPB128_LBSPPM0_LPA16_LPB16_LPM0_LRVW16_LWPMn1_MIAV1_MIWT3_4_MO40_MGRIPMn1_NTn1_NTA0_NTB0_NTC0_NTD0_NTM0_NEPBS0_NLCA1_NLCB1_ONLL1_PGR1_PLR1_PKA0_SGROBn1_SIA3_SS1_SU32_SUM1_SUS256_SPO0_SRVW0_SSO0_SVW1_SK0_SKFTR0_SKXCCM0_SGRO0_TDMI0_TIN0_TLDS1_TLDSM1_ULSGRO0_USL1_UIOFGRO0_UPLRP0_USFGROn1_VSn1_VWA1_VWB1_WSGRA0_WSGRB0_WS32_WG32_4_1_WGM8_WGMXCC1_WGMXCCGn1
    SolutionIndex: 160
    SolutionNameMin: Cijk_Alik_Bljk_BBS_BH_Bias_HA_S_SAV_UserArgs_MT32x128x64_MI16x16x1_CMS_SN_LDSB0_AFC1_AG0_AFEM1_AFEM1_ASEM1_CLR1_CADS0_DTLA0_DTLB0_DTVA0_DTVB0_DTVMXSA0_DTVMXSB0_DTVSM0_DPLBn1_EPS0_ELFLR0_EMLLn1_FDSI0_GRPM1_GRVWA8_GRVWB8_GSU1_GSUAMB_GSUC0_GSUWGMRR0_GLS0_ISA1151_IU1_K1_LDSTI0_LBSPPA128_LBSPPB128_LBSPPM0_LPA16_LPB16_LPM0_LRVW16_LWPMn1_MIAV1_MIWT2_2_MO40_MGRIPMn1_NTn1_NTA0_NTB0_NTC0_NTD0_NTM0_NEPBS0_NLCA1_NLCB1_ONLL1_PGR2_PLR1_PKA0_SGROBn1_SIA3_SS1_SU32_SUM1_SUS256_SPO0_SRVW0_SSO0_SVW1_SK0_SKFTR0_SKXCCM0_SGRO0_TDMI0_TIN0_TLDS1_TLDSM1_ULSGRO0_USL1_UIOFGRO0_UPLRP0_USFGROn1_VSn1_VWA1_VWB1_WSGRA0_WSGRB0_WS32_WG16_8_1_WGM8_WGMXCC1_WGMXCCGn1
    SolutionIndex: 161
    SolutionNameMin: Cijk_Alik_Bljk_BBS_BH_Bias_HA_S_SAV_UserArgs_MT192x64x32_MI16x16x1_CMS_SN_LDSB0_AFC1_AG0_AFEM1_AFEM1_ASEM1_CLR1_CADS0_DTLA0_DTLB0_DTVA0_DTVB0_DTVMXSA0_DTVMXSB0_DTVSM0_DPLBn1_EPS0_ELFLR0_EMLLn1_FDSI0_GRPM1_GRVWA8_GRVWB8_GSU1_GSUAMB_GSUC0_GSUWGMRR0_GLS0_ISA1151_IU1_K1_LDSTI0_LBSPPA128_LBSPPB128_LBSPPM0_LPA16_LPB16_LPM0_LRVW16_LWPMn1_MIAV1_MIWT3_4_MO40_MGRIPMn1_NTn1_NTA0_NTB0_NTC0_NTD0_NTM0_NEPBS0_NLCA1_NLCB1_ONLL1_PGR2_PLR1_PKA0_SGROBn1_SIA3_SS1_SU32_SUM1_SUS256_SPO0_SRVW0_SSO0_SVW1_SK0_SKFTR0_SKXCCM0_SGRO0_TDMI0_TIN0_TLDS1_TLDSM1_ULSGRO0_USL1_UIOFGRO0_UPLRP0_USFGROn1_VSn1_VWA1_VWB1_WSGRA0_WSGRB0_WS32_WG64_2_1_WGM8_WGMXCC1_WGMXCCGn1
    SolutionIndex: 162
    SolutionNameMin: Cijk_Alik_Bljk_BBS_BH_Bias_HA_S_SAV_UserArgs_MT32x96x32_MI16x16x1_CMS_SN_LDSB0_AFC1_AG0_AFEM1_AFEM1_ASEM1_CLR1_CADS0_DTLA0_DTLB0_DTVA0_DTVB0_DTVMXSA0_DTVMXSB0_DTVSM0_DPLBn1_EPS0_ELFLR0_EMLLn1_FDSI0_GRPM1_GRVWA1_GRVWB8_GSU1_GSUAMB_GSUC0_GSUWGMRR0_GLS0_ISA1151_IU1_LDSTI0_LBSPPA128_LBSPPB128_LBSPPM0_LPA16_LPB16_LPM0_LRVW16_LWPMn1_MIAV1_MIWT1_3_MO40_MGRIPMn1_NTn1_NTA0_NTB0_NTC0_NTD0_NTM0_NEPBS0_NLCA1_NLCB1_ONLL1_PGR2_PLR1_PKA0_SGROBn1_SIA3_SS1_SU32_SUM1_SUS256_SPO0_SRVW0_SSO0_SVW1_SK0_SKFTR0_SKXCCM0_SGRO0_TDMI0_TIN0_TLDS1_TLDSM1_ULSGRO0_USL1_UIOFGRO0_UPLRP0_USFGROn1_VSn1_VWA1_VWB1_WSGRA0_WSGRB0_WS32_WG32_4_1_WGM8_WGMXCC1_WGMXCCGn1
    SolutionIndex: 163
    SolutionNameMin: Cijk_Alik_Bljk_BBS_BH_Bias_HA_S_SAV_UserArgs_MT96x128x32_MI16x16x1_CMS_SN_LDSB1_AFC1_AG0_AFEM1_AFEM1_ASEM1_CLR1_CADS0_DTLA0_DTLB0_DTVA0_DTVB0_DTVMXSA0_DTVMXSB0_DTVSM0_DPLBn1_EPS0_ELFLR0_EMLLn1_FDSI0_GRPM1_GRVWA2_GRVWB8_GSU1_GSUAMB_GSUC0_GSUWGMRR0_GLS0_ISA1151_IU1_K1_LDSTI0_LBSPPA128_LBSPPB128_LBSPPM0_LPA16_LPB16_LPM0_LRVW16_LWPMn1_MIAV1_MIWT3_4_MO40_MGRIPMn1_NTn1_NTA0_NTB0_NTC0_NTD0_NTM0_NEPBS0_NLCA1_NLCB1_ONLL1_PGR1_PLR1_PKA0_SGROBn1_SIA3_SS1_SU32_SUM1_SUS256_SPO0_SRVW0_SSO0_SVW1_SK0_SKFTR0_SKXCCM0_SGRO0_TDMI0_TIN0_TLDS1_TLDSM1_ULSGRO0_USL1_UIOFGRO0_UPLRP0_USFGROn1_VSn1_VWA1_VWB1_WSGRA0_WSGRB0_WS32_WG32_4_1_WGM8_WGMXCC1_WGMXCCGn1
    SolutionIndex: 164
    SolutionNameMin: Cijk_Alik_Bljk_BBS_BH_Bias_HA_S_SAV_UserArgs_MT32x16x64_MI16x16x1_CMS_SN_LDSB1_AFC1_AG0_AFEM1_AFEM1_ASEM1_CLR1_CADS0_DTLA0_DTLB0_DTVA0_DTVB0_DTVMXSA0_DTVMXSB0_DTVSM0_DPLBn1_EPS0_ELFLR0_EMLLn1_FDSI0_GRPM1_GRVWA2_GRVWB8_GSU1_GSUAMB_GSUC0_GSUWGMRR0_GLS0_ISA1151_IU1_K1_LDSTI0_LBSPPA128_LBSPPB128_LBSPPM0_LPA16_LPB16_LPM0_LRVW16_LWPMn1_MIAV1_MIWT1_1_MO40_MGRIPMn1_NTn1_NTA0_NTB0_NTC0_NTD0_NTM0_NEPBS0_NLCA1_NLCB1_ONLL1_PGR1_PLR1_PKA0_SGROBn1_SIA3_SS1_SU32_SUM1_SUS256_SPO0_SRVW0_SSO0_SVW1_SK0_SKFTR0_SKXCCM0_SGRO0_TDMI0_TIN0_TLDS1_TLDSM1_ULSGRO0_USL1_UIOFGRO0_UPLRP0_USFGROn1_VSn1_VWA1_VWB1_WSGRA0_WSGRB0_WS32_WG32_2_1_WGM8_WGMXCC1_WGMXCCGn1
    SolutionIndex: 165
    SolutionNameMin: Cijk_Alik_Bljk_BBS_BH_Bias_HA_S_SAV_UserArgs_MT96x96x32_MI16x16x1_CMS_SN_LDSB0_AFC1_AG0_AFEM1_AFEM1_ASEM1_CLR1_CADS0_DTLA0_DTLB0_DTVA0_DTVB0_DTVMXSA0_DTVMXSB0_DTVSM0_DPLBn1_EPS0_ELFLR0_EMLLn1_FDSI0_GRPM1_GRVWA8_GRVWB8_GSU1_GSUAMB_GSUC0_GSUWGMRR0_GLS0_ISA1151_IU1_LDSTI0_LBSPPA128_LBSPPB128_LBSPPM0_LPA16_LPB16_LPM0_LRVW16_LWPMn1_MIAV1_MIWT3_3_MO40_MGRIPMn1_NTn1_NTA0_NTB0_NTC0_NTD0_NTM0_NEPBS0_NLCA1_NLCB1_ONLL1_PGR2_PLR1_PKA0_SGROBn1_SIA3_SS1_SU32_SUM1_SUS256_SPO0_SRVW0_SSO0_SVW1_SK0_SKFTR0_SKXCCM0_SGRO0_TDMI0_TIN0_TLDS1_TLDSM1_ULSGRO0_USL1_UIOFGRO0_UPLRP0_USFGROn1_VSn1_VWA1_VWB1_WSGRA0_WSGRB0_WS32_WG32_4_1_WGM8_WGMXCC1_WGMXCCGn1
    SolutionIndex: 166
    SolutionNameMin: Cijk_Alik_Bljk_BBS_BH_Bias_HA_S_SAV_UserArgs_MT96x64x32_MI16x16x1_CMS_SN_LDSB0_AFC1_AG0_AFEM1_AFEM1_ASEM1_CLR1_CADS0_DTLA0_DTLB0_DTVA0_DTVB0_DTVMXSA0_DTVMXSB0_DTVSM0_DPLBn1_EPS0_ELFLR0_EMLLn1_FDSI0_GRPM1_GRVWA8_GRVWB1_GSU1_GSUAMB_GSUC0_GSUWGMRR0_GLS0_ISA1151_IU1_LDSTI0_LBSPPA128_LBSPPB128_LBSPPM0_LPA16_LPB16_LPM0_LRVW16_LWPMn1_MIAV1_MIWT6_1_MO40_MGRIPMn1_NTn1_NTA0_NTB0_NTC0_NTD0_NTM0_NEPBS0_NLCA1_NLCB1_ONLL1_PGR2_PLR1_PKA0_SGROBn1_SIA3_SS1_SU32_SUM1_SUS256_SPO0_SRVW0_SSO0_SVW1_SK0_SKFTR0_SKXCCM0_SGRO0_TDMI0_TIN0_TLDS1_TLDSM1_ULSGRO0_USL1_UIOFGRO0_UPLRP0_USFGROn1_VSn1_VWA1_VWB1_WSGRA0_WSGRB0_WS32_WG16_8_1_WGM8_WGMXCC1_WGMXCCGn1
    SolutionIndex: 167
    SolutionNameMin: Cijk_Alik_Bljk_BBS_BH_Bias_HA_S_SAV_UserArgs_MT64x112x32_MI16x16x1_CMS_SN_LDSB0_AFC1_AG0_AFEM1_AFEM1_ASEM1_CLR1_CADS0_DTLA0_DTLB0_DTVA0_DTVB0_DTVMXSA0_DTVMXSB0_DTVSM0_DPLBn1_EPS0_ELFLR0_EMLLn1_FDSI0_GRPM1_GRVWA1_GRVWB4_GSU1_GSUAMB_GSUC0_GSUWGMRR0_GLS0_ISA1151_IU1_LDSTI0_LBSPPA128_LBSPPB128_LBSPPM0_LPA16_LPB16_LPM0_LRVW16_LWPMn1_MIAV1_MIWT1_7_MO40_MGRIPMn1_NTn1_NTA0_NTB0_NTC0_NTD0_NTM0_NEPBS0_NLCA1_NLCB1_ONLL1_PGR2_PLR1_PKA0_SGROBn1_SIA3_SS1_SU32_SUM1_SUS256_SPO0_SRVW0_SSO0_SVW1_SK0_SKFTR0_SKXCCM0_SGRO0_TDMI0_TIN0_TLDS1_TLDSM1_ULSGRO0_USL1_UIOFGRO0_UPLRP0_USFGROn1_VSn1_VWA1_VWB1_WSGRA0_WSGRB0_WS32_WG64_2_1_WGM8_WGMXCC1_WGMXCCGn1
    SolutionIndex: 168
    SolutionNameMin: Cijk_Alik_Bljk_BBS_BH_Bias_HA_S_SAV_UserArgs_MT64x48x32_MI16x16x1_CMS_SN_LDSB0_AFC1_AG0_AFEM1_AFEM1_ASEM1_CLR1_CADS0_DTLA0_DTLB0_DTVA0_DTVB0_DTVMXSA0_DTVMXSB0_DTVSM0_DPLBn1_EPS0_ELFLR0_EMLLn1_FDSI0_GRPM1_GRVWA1_GRVWB1_GSU1_GSUAMB_GSUC0_GSUWGMRR0_GLS0_ISA1151_IU1_LDSTI0_LBSPPA128_LBSPPB128_LBSPPM0_LPA16_LPB16_LPM0_LRVW16_LWPMn1_MIAV1_MIWT1_3_MO40_MGRIPMn1_NTn1_NTA0_NTB0_NTC0_NTD0_NTM0_NEPBS0_NLCA1_NLCB1_ONLL1_PGR2_PLR1_PKA0_SGROBn1_SIA3_SS1_SU32_SUM1_SUS256_SPO0_SRVW0_SSO0_SVW1_SK0_SKFTR0_SKXCCM0_SGRO0_TDMI0_TIN0_TLDS1_TLDSM1_ULSGRO0_USL1_UIOFGRO0_UPLRP0_USFGROn1_VSn1_VWA1_VWB1_WSGRA0_WSGRB0_WS32_WG64_2_1_WGM8_WGMXCC1_WGMXCCGn1
    SolutionIndex: 169
    SolutionNameMin: Cijk_Alik_Bljk_BBS_BH_Bias_HA_S_SAV_UserArgs_MT64x80x32_MI16x16x1_CMS_SN_LDSB0_AFC1_AG0_AFEM1_AFEM1_ASEM1_CLR1_CADS0_DTLA0_DTLB0_DTVA0_DTVB0_DTVMXSA0_DTVMXSB0_DTVSM0_DPLBn1_EPS0_ELFLR0_EMLLn1_FDSI0_GRPM1_GRVWA1_GRVWB4_GSU1_GSUAMB_GSUC0_GSUWGMRR0_GLS0_ISA1151_IU1_LDSTI0_LBSPPA128_LBSPPB128_LBSPPM0_LPA16_LPB16_LPM0_LRVW16_LWPMn1_MIAV1_MIWT1_5_MO40_MGRIPMn1_NTn1_NTA0_NTB0_NTC0_NTD0_NTM0_NEPBS0_NLCA1_NLCB1_ONLL1_PGR2_PLR1_PKA0_SGROBn1_SIA3_SS1_SU32_SUM1_SUS256_SPO0_SRVW0_SSO0_SVW1_SK0_SKFTR0_SKXCCM0_SGRO0_TDMI0_TIN0_TLDS1_TLDSM1_ULSGRO0_USL1_UIOFGRO0_UPLRP0_USFGROn1_VSn1_VWA1_VWB1_WSGRA0_WSGRB0_WS32_WG64_2_1_WGM8_WGMXCC1_WGMXCCGn1
    SolutionIndex: 170
    SolutionNameMin: Cijk_Alik_Bljk_BBS_BH_Bias_HA_S_SAV_UserArgs_MT16x64x32_MI16x16x1_CMS_SN_LDSB0_AFC1_AG0_AFEM1_AFEM1_ASEM1_CLR1_CADS0_DTLA0_DTLB0_DTVA0_DTVB0_DTVMXSA0_DTVMXSB0_DTVSM0_DPLBn1_EPS0_ELFLR0_EMLLn1_FDSI0_GRPM1_GRVWA4_GRVWB8_GSU1_GSUAMB_GSUC0_GSUWGMRR0_GLS0_ISA1151_IU1_LDSTI0_LBSPPA512_LBSPPB2048_LBSPPM0_LPA16_LPB16_LPM0_LRVW16_LWPMn1_MIAV1_MIWT1_1_MO40_MGRIPMn1_NTn1_NTA0_NTB0_NTC0_NTD0_NTM0_NEPBS0_NLCA1_NLCB1_ONLL1_PGR2_PLR1_PKA0_SGROBn1_SIA3_SS1_SU32_SUM1_SUS256_SPO0_SRVW0_SSO0_SVW1_SK0_SKFTR0_SKXCCM0_SGRO0_TDMI0_TIN0_TLDS0_TLDSM1_ULSGRO0_USL1_UIOFGRO0_UPLRP0_USFGROn1_VSn1_VWA1_VWB1_WSGRA0_WSGRB0_WS32_WG16_8_1_WGM8_WGMXCC1_WGMXCCGn1
    SolutionIndex: 171
    SolutionNameMin: Cijk_Alik_Bljk_BBS_BH_Bias_HA_S_SAV_UserArgs_MT16x64x64_MI16x16x1_CMS_SN_LDSB0_AFC1_AG0_AFEM1_AFEM1_ASEM1_CLR1_CADS0_DTLA0_DTLB0_DTVA0_DTVB0_DTVMXSA0_DTVMXSB0_DTVSM0_DPLBn1_EPS0_ELFLR0_EMLLn1_FDSI0_GRPM1_GRVWA8_GRVWB1_GSU1_GSUAMB_GSUC0_GSUWGMRR0_GLS0_ISA1151_IU1_LDSTI0_LBSPPA128_LBSPPB128_LBSPPM0_LPA16_LPB16_LPM0_LRVW16_LWPMn1_MIAV1_MIWT1_1_MO40_MGRIPMn1_NTn1_NTA0_NTB0_NTC0_NTD0_NTM0_NEPBS0_NLCA1_NLCB1_ONLL1_PGR2_PLR1_PKA0_SGROBn1_SIA3_SS1_SU32_SUM1_SUS256_SPO0_SRVW0_SSO0_SVW1_SK0_SKFTR0_SKXCCM0_SGRO0_TDMI0_TIN0_TLDS1_TLDSM1_ULSGRO0_USL1_UIOFGRO0_UPLRP0_USFGROn1_VSn1_VWA1_VWB1_WSGRA0_WSGRB0_WS32_WG16_8_1_WGM8_WGMXCC1_WGMXCCGn1
    SolutionIndex: 172
    SolutionNameMin: Cijk_Alik_Bljk_BBS_BH_Bias_HA_S_SAV_UserArgs_MT16x64x32_MI16x16x1_CMS_SN_LDSB0_AFC1_AG0_AFEM1_AFEM1_ASEM1_CLR1_CADS0_DTLA0_DTLB0_DTVA0_DTVB0_DTVMXSA0_DTVMXSB0_DTVSM0_DPLBn1_EPS0_ELFLR0_EMLLn1_FDSI0_GRPM1_GRVWA4_GRVWB1_GSU1_GSUAMB_GSUC0_GSUWGMRR0_GLS0_ISA1151_IU1_LDSTI0_LBSPPA128_LBSPPB128_LBSPPM0_LPA16_LPB16_LPM0_LRVW16_LWPMn1_MIAV1_MIWT1_1_MO40_MGRIPMn1_NTn1_NTA0_NTB0_NTC0_NTD0_NTM0_NEPBS0_NLCA1_NLCB1_ONLL1_PGR2_PLR1_PKA0_SGROBn1_SIA3_SS0_SU32_SUM1_SUS256_SPO0_SRVW0_SSO0_SVW1_SK0_SKFTR0_SKXCCM0_SGRO0_TDMI0_TIN0_TLDS1_TLDSM1_ULSGRO0_USL1_UIOFGRO0_UPLRP0_USFGROn1_VSn1_VWA1_VWB1_WSGRA0_WSGRB0_WS32_WG16_8_1_WGM8_WGMXCC1_WGMXCCGn1
    SolutionIndex: 173
    SolutionNameMin: Cijk_Alik_Bljk_BBS_BH_Bias_HA_S_SAV_UserArgs_MT16x64x32_MI16x16x1_CMS_SN_LDSB0_AFC1_AG0_AFEM1_AFEM1_ASEM1_CLR1_CADS0_DTLA0_DTLB0_DTVA0_DTVB0_DTVMXSA0_DTVMXSB0_DTVSM0_DPLBn1_EPS0_ELFLR0_EMLLn1_FDSI0_GRPM1_GRVWA4_GRVWB1_GSU1_GSUAMB_GSUC0_GSUWGMRR0_GLS0_ISA1151_IU1_LDSTI0_LBSPPA128_LBSPPB128_LBSPPM0_LPA16_LPB16_LPM0_LRVW16_LWPMn1_MIAV1_MIWT1_1_MO40_MGRIPMn1_NTn1_NTA0_NTB0_NTC0_NTD0_NTM0_NEPBS0_NLCA1_NLCB1_ONLL1_PGR2_PLR1_PKA0_SGROBn1_SIA3_SS1_SU32_SUM1_SUS256_SPO0_SRVW0_SSO0_SVW1_SK0_SKFTR0_SKXCCM0_SGRO0_TDMI0_TIN0_TLDS1_TLDSM1_ULSGRO0_USL1_UIOFGRO0_UPLRP0_USFGROn1_VSn1_VWA1_VWB1_WSGRA0_WSGRB0_WS32_WG16_8_1_WGM8_WGMXCC1_WGMXCCGn1
    SolutionIndex: 174
    SolutionNameMin: Cijk_Alik_Bljk_BBS_BH_Bias_HA_S_SAV_UserArgs_MT32x32x32_MI16x16x1_CMS_SN_LDSB0_AFC1_AG0_AFEM1_AFEM1_ASEM1_CLR1_CADS0_DTLA0_DTLB0_DTVA0_DTVB0_DTVMXSA0_DTVMXSB0_DTVSM0_DPLBn1_EPS0_ELFLR0_EMLLn1_FDSI0_GRPM1_GRVWA8_GRVWB1_GSU1_GSUAMB_GSUC0_GSUWGMRR0_GLS0_ISA1151_IU1_LDSTI0_LBSPPA128_LBSPPB128_LBSPPM0_LPA16_LPB16_LPM0_LRVW16_LWPMn1_MIAV1_MIWT1_1_MO40_MGRIPMn1_NTn1_NTA0_NTB0_NTC0_NTD0_NTM0_NEPBS0_NLCA1_NLCB1_ONLL1_PGR2_PLR1_PKA0_SGROBn1_SIA3_SS0_SU32_SUM1_SUS256_SPO0_SRVW0_SSO0_SVW1_SK0_SKFTR0_SKXCCM0_SGRO0_TDMI0_TIN0_TLDS1_TLDSM1_ULSGRO0_USL1_UIOFGRO0_UPLRP0_USFGROn1_VSn1_VWA1_VWB1_WSGRA0_WSGRB0_WS32_WG32_4_1_WGM8_WGMXCC1_WGMXCCGn1
    SolutionIndex: 175
    SolutionNameMin: Cijk_Alik_Bljk_BBS_BH_Bias_HA_S_SAV_UserArgs_MT32x32x32_MI16x16x1_CMS_SN_LDSB0_AFC1_AG0_AFEM1_AFEM1_ASEM1_CLR1_CADS0_DTLA0_DTLB0_DTVA0_DTVB0_DTVMXSA0_DTVMXSB0_DTVSM0_DPLBn1_EPS0_ELFLR0_EMLLn1_FDSI0_GRPM1_GRVWA1_GRVWB8_GSU1_GSUAMB_GSUC0_GSUWGMRR0_GLS0_ISA1151_IU1_LDSTI0_LBSPPA1024_LBSPPB1024_LBSPPM0_LPA16_LPB16_LPM0_LRVW16_LWPMn1_MIAV1_MIWT1_1_MO40_MGRIPMn1_NTn1_NTA0_NTB0_NTC0_NTD0_NTM0_NEPBS0_NLCA1_NLCB1_ONLL1_PGR2_PLR1_PKA0_SGROBn1_SIA3_SS0_SU32_SUM1_SUS256_SPO0_SRVW0_SSO0_SVW1_SK0_SKFTR0_SKXCCM0_SGRO0_TDMI0_TIN0_TLDS0_TLDSM1_ULSGRO0_USL1_UIOFGRO0_UPLRP0_USFGROn1_VSn1_VWA1_VWB1_WSGRA0_WSGRB0_WS32_WG32_4_1_WGM8_WGMXCC1_WGMXCCGn1
    SolutionIndex: 176
    SolutionNameMin: Cijk_Alik_Bljk_BBS_BH_Bias_HA_S_SAV_UserArgs_MT32x16x64_MI16x16x1_CMS_SN_LDSB0_AFC1_AG0_AFEM1_AFEM1_ASEM1_CLR1_CADS0_DTLA0_DTLB0_DTVA0_DTVB0_DTVMXSA0_DTVMXSB0_DTVSM0_DPLBn1_EPS0_ELFLR0_EMLLn1_FDSI0_GRPM1_GRVWA8_GRVWB1_GSU1_GSUAMB_GSUC0_GSUWGMRR0_GLS0_ISA1151_IU1_K1_LDSTI0_LBSPPA128_LBSPPB128_LBSPPM0_LPA16_LPB16_LPM0_LRVW16_LWPMn1_MIAV1_MIWT1_1_MO40_MGRIPMn1_NTn1_NTA0_NTB0_NTC0_NTD0_NTM0_NEPBS0_NLCA1_NLCB1_ONLL1_PGR1_PLR1_PKA0_SGROBn1_SIA3_SS1_SU32_SUM1_SUS256_SPO0_SRVW0_SSO0_SVW1_SK0_SKFTR0_SKXCCM0_SGRO0_TDMI0_TIN0_TLDS1_TLDSM1_ULSGRO0_USL1_UIOFGRO0_UPLRP0_USFGROn1_VSn1_VWA1_VWB1_WSGRA0_WSGRB0_WS32_WG32_2_1_WGM8_WGMXCC1_WGMXCCGn1
    SolutionIndex: 177
    SolutionNameMin: Cijk_Alik_Bljk_BBS_BH_Bias_HA_S_SAV_UserArgs_MT32x32x32_MI16x16x1_CMS_SN_LDSB0_AFC1_AG0_AFEM1_AFEM1_ASEM1_CLR1_CADS0_DTLA0_DTLB0_DTVA0_DTVB0_DTVMXSA0_DTVMXSB0_DTVSM0_DPLBn1_EPS0_ELFLR0_EMLLn1_FDSI0_GRPM1_GRVWA8_GRVWB8_GSU1_GSUAMB_GSUC0_GSUWGMRR0_GLS0_ISA1151_IU1_LDSTI0_LBSPPA128_LBSPPB128_LBSPPM0_LPA16_LPB16_LPM0_LRVW16_LWPMn1_MIAV1_MIWT1_1_MO40_MGRIPMn1_NTn1_NTA0_NTB0_NTC0_NTD0_NTM0_NEPBS0_NLCA1_NLCB1_ONLL1_PGR2_PLR1_PKA0_SGROBn1_SIA3_SS1_SU32_SUM1_SUS256_SPO0_SRVW0_SSO0_SVW1_SK0_SKFTR0_SKXCCM0_SGRO0_TDMI0_TIN0_TLDS1_TLDSM1_ULSGRO0_USL1_UIOFGRO0_UPLRP0_USFGROn1_VSn1_VWA1_VWB1_WSGRA0_WSGRB0_WS32_WG32_4_1_WGM8_WGMXCC1_WGMXCCGn1
    SolutionIndex: 178
    SolutionNameMin: Cijk_Alik_Bljk_BBS_BH_Bias_HA_S_SAV_UserArgs_MT32x160x32_MI16x16x1_CMS_SN_LDSB0_AFC1_AG0_AFEM1_AFEM1_ASEM1_CLR1_CADS0_DTLA0_DTLB0_DTVA0_DTVB0_DTVMXSA0_DTVMXSB0_DTVSM0_DPLBn1_EPS0_ELFLR0_EMLLn1_FDSI0_GRPM1_GRVWA1_GRVWB8_GSU1_GSUAMB_GSUC0_GSUWGMRR0_GLS0_ISA1151_IU1_LDSTI0_LBSPPA128_LBSPPB128_LBSPPM0_LPA16_LPB16_LPM0_LRVW16_LWPMn1_MIAV1_MIWT1_5_MO40_MGRIPMn1_NTn1_NTA0_NTB0_NTC0_NTD0_NTM0_NEPBS0_NLCA1_NLCB1_ONLL1_PGR2_PLR1_PKA0_SGROBn1_SIA3_SS1_SU32_SUM1_SUS256_SPO0_SRVW0_SSO0_SVW1_SK0_SKFTR0_SKXCCM0_SGRO0_TDMI0_TIN0_TLDS1_TLDSM1_ULSGRO0_USL1_UIOFGRO0_UPLRP0_USFGROn1_VSn1_VWA1_VWB1_WSGRA0_WSGRB0_WS32_WG32_4_1_WGM8_WGMXCC1_WGMXCCGn1
    SolutionIndex: 179
    SolutionNameMin: Cijk_Alik_Bljk_BBS_BH_Bias_HA_S_SAV_UserArgs_MT16x64x64_MI16x16x1_CMS_SN_LDSB0_AFC1_AG0_AFEM1_AFEM1_ASEM1_CLR1_CADS0_DTLA0_DTLB0_DTVA0_DTVB0_DTVMXSA0_DTVMXSB0_DTVSM0_DPLBn1_EPS0_ELFLR0_EMLLn1_FDSI0_GRPM1_GRVWA8_GRVWB8_GSU1_GSUAMB_GSUC0_GSUWGMRR0_GLS0_ISA1151_IU1_LDSTI0_LBSPPA512_LBSPPB2048_LBSPPM0_LPA16_LPB16_LPM0_LRVW16_LWPMn1_MIAV1_MIWT1_1_MO40_MGRIPMn1_NTn1_NTA0_NTB0_NTC0_NTD0_NTM0_NEPBS0_NLCA1_NLCB1_ONLL1_PGR2_PLR1_PKA0_SGROBn1_SIA3_SS1_SU32_SUM1_SUS256_SPO0_SRVW0_SSO0_SVW1_SK0_SKFTR0_SKXCCM0_SGRO0_TDMI0_TIN0_TLDS0_TLDSM1_ULSGRO0_USL1_UIOFGRO0_UPLRP0_USFGROn1_VSn1_VWA1_VWB1_WSGRA0_WSGRB0_WS32_WG16_8_1_WGM8_WGMXCC1_WGMXCCGn1
    SolutionIndex: 180
    SolutionNameMin: Cijk_Alik_Bljk_BBS_BH_Bias_HA_S_SAV_UserArgs_MT32x64x32_MI16x16x1_CMS_SN_LDSB0_AFC1_AG0_AFEM1_AFEM1_ASEM1_CLR1_CADS0_DTLA0_DTLB0_DTVA0_DTVB0_DTVMXSA0_DTVMXSB0_DTVSM0_DPLBn1_EPS0_ELFLR0_EMLLn1_FDSI0_GRPM1_GRVWA8_GRVWB1_GSU1_GSUAMB_GSUC0_GSUWGMRR0_GLS0_ISA1151_IU1_LDSTI0_LBSPPA128_LBSPPB128_LBSPPM0_LPA16_LPB16_LPM0_LRVW16_LWPMn1_MIAV1_MIWT2_1_MO40_MGRIPMn1_NTn1_NTA0_NTB0_NTC0_NTD0_NTM0_NEPBS0_NLCA1_NLCB1_ONLL1_PGR2_PLR1_PKA0_SGROBn1_SIA3_SS1_SU32_SUM1_SUS256_SPO0_SRVW0_SSO0_SVW1_SK0_SKFTR0_SKXCCM0_SGRO0_TDMI0_TIN0_TLDS1_TLDSM1_ULSGRO0_USL1_UIOFGRO0_UPLRP0_USFGROn1_VSn1_VWA1_VWB1_WSGRA0_WSGRB0_WS32_WG16_8_1_WGM8_WGMXCC1_WGMXCCGn1
    SolutionIndex: 181
    SolutionNameMin: Cijk_Alik_Bljk_BBS_BH_Bias_HA_S_SAV_UserArgs_MT96x32x32_MI16x16x1_CMS_SN_LDSB0_AFC1_AG0_AFEM1_AFEM1_ASEM1_CLR1_CADS0_DTLA0_DTLB0_DTVA0_DTVB0_DTVMXSA0_DTVMXSB0_DTVSM0_DPLBn1_EPS0_ELFLR0_EMLLn1_FDSI0_GRPM1_GRVWA8_GRVWB1_GSU1_GSUAMB_GSUC0_GSUWGMRR0_GLS0_ISA1151_IU1_LDSTI0_LBSPPA128_LBSPPB128_LBSPPM0_LPA16_LPB16_LPM0_LRVW16_LWPMn1_MIAV1_MIWT3_1_MO40_MGRIPMn1_NTn1_NTA0_NTB0_NTC0_NTD0_NTM0_NEPBS0_NLCA1_NLCB1_ONLL1_PGR2_PLR1_PKA0_SGROBn1_SIA3_SS1_SU32_SUM1_SUS256_SPO0_SRVW0_SSO0_SVW1_SK0_SKFTR0_SKXCCM0_SGRO0_TDMI0_TIN0_TLDS1_TLDSM1_ULSGRO0_USL1_UIOFGRO0_UPLRP0_USFGROn1_VSn1_VWA1_VWB1_WSGRA0_WSGRB0_WS32_WG32_4_1_WGM8_WGMXCC1_WGMXCCGn1
    SolutionIndex: 182
    SolutionNameMin: Cijk_Alik_Bljk_BBS_BH_Bias_HA_S_SAV_UserArgs_MT112x64x32_MI16x16x1_CMS_SN_LDSB0_AFC1_AG0_AFEM1_AFEM1_ASEM1_CLR1_CADS0_DTLA0_DTLB0_DTVA0_DTVB0_DTVMXSA0_DTVMXSB0_DTVSM0_DPLBn1_EPS0_ELFLR0_EMLLn1_FDSI0_GRPM1_GRVWA4_GRVWB1_GSU1_GSUAMB_GSUC0_GSUWGMRR0_GLS0_ISA1151_IU1_LDSTI0_LBSPPA128_LBSPPB128_LBSPPM0_LPA16_LPB16_LPM0_LRVW16_LWPMn1_MIAV1_MIWT7_1_MO40_MGRIPMn1_NTn1_NTA0_NTB0_NTC0_NTD0_NTM0_NEPBS0_NLCA1_NLCB1_ONLL1_PGR2_PLR1_PKA0_SGROBn1_SIA3_SS1_SU32_SUM1_SUS256_SPO0_SRVW0_SSO0_SVW1_SK0_SKFTR0_SKXCCM0_SGRO0_TDMI0_TIN0_TLDS1_TLDSM1_ULSGRO0_USL1_UIOFGRO0_UPLRP0_USFGROn1_VSn1_VWA1_VWB1_WSGRA0_WSGRB0_WS32_WG16_8_1_WGM8_WGMXCC1_WGMXCCGn1
    SolutionIndex: 183
    SolutionNameMin: Cijk_Alik_Bljk_BBS_BH_Bias_HA_S_SAV_UserArgs_MT224x32x32_MI16x16x1_CMS_SN_LDSB1_AFC1_AG0_AFEM1_AFEM1_ASEM1_CLR1_CADS0_DTLA0_DTLB0_DTVA0_DTVB0_DTVMXSA0_DTVMXSB0_DTVSM0_DPLBn1_EPS0_ELFLR0_EMLLn1_FDSI0_GRPM1_GRVWA8_GRVWB1_GSU1_GSUAMB_GSUC0_GSUWGMRR0_GLS0_ISA1151_IU1_LDSTI0_LBSPPA128_LBSPPB128_LBSPPM0_LPA16_LPB16_LPM0_LRVW16_LWPMn1_MIAV1_MIWT7_1_MO40_MGRIPMn1_NTn1_NTA0_NTB0_NTC0_NTD0_NTM0_NEPBS0_NLCA1_NLCB1_ONLL1_PGR2_PLR1_PKA0_SGROBn1_SIA3_SS1_SU32_SUM1_SUS256_SPO0_SRVW0_SSO0_SVW1_SK0_SKFTR0_SKXCCM0_SGRO0_TDMI0_TIN0_TLDS1_TLDSM1_ULSGRO0_USL1_UIOFGRO0_UPLRP0_USFGROn1_VSn1_VWA1_VWB1_WSGRA0_WSGRB0_WS32_WG32_4_1_WGM8_WGMXCC1_WGMXCCGn1
    SolutionIndex: 184
    SolutionNameMin: Cijk_Alik_Bljk_BBS_BH_Bias_HA_S_SAV_UserArgs_MT16x16x128_MI16x16x1_SN_LDSB0_AFC1_AG0_AFEM1_AFEM1_ASEM1_CLR0_CADS0_DTLA0_DTLB0_DTVA0_DTVB0_DTVMXSA0_DTVMXSB0_DTVSM0_DPLB0_EPS0_ELFLR0_EMLLn1_FDSI0_GRPM1_GRVWA8_GRVWB8_GSU1_GSUAMB_GSUC0_GSUWGMRR0_GLS0_ISA1151_IU1_K1_LDSTI0_LBSPPA256_LBSPPB256_LBSPPM0_LPA8_LPB8_LPM0_LRVW16_LWPMn1_MIAV1_MIWT1_1_MO40_MGRIPM1_NTn1_NTA0_NTB0_NTC0_NTD0_NTM0_NEPBS0_NLCA1_NLCB1_ONLL1_PGR2_PLR1_PKA0_SGROB0_SIA3_SS1_SU32_SUM0_SUS256_SPO0_SRVW0_SSO0_SVW1_SK0_SKFTR0_SKXCCM0_SGRO0_TDMI0_TIN0_TLDS1_TLDSMn1_ULSGRO0_USL1_UIOFGRO0_UPLRP0_USFGROn1_VSn1_VWA1_VWB1_WSGRA0_WSGRB0_WS32_WG16_2_1_WGM0_WGMXCC1_WGMXCCGn1
    SolutionIndex: 185
    SolutionNameMin: Cijk_Alik_Bljk_BBS_BH_Bias_HA_S_SAV_UserArgs_MT16x16x32_MI16x16x1_SN_LDSB1_AFC1_AG0_AFEM1_AFEM1_ASEM1_CLR0_CADS0_DTLA0_DTLB0_DTVA0_DTVB0_DTVMXSA0_DTVMXSB0_DTVSM0_DPLB0_EPS0_ELFLR0_EMLLn1_FDSI0_GRPM1_GRVWA8_GRVWB8_GSU1_GSUAMB_GSUC0_GSUWGMRR0_GLS0_ISA1151_IU2_K1_LDSTI0_LBSPPA128_LBSPPB128_LBSPPM0_LPA8_LPB8_LPM0_LRVW16_LWPMn1_MIAV1_MIWT1_1_MO40_MGRIPM1_NTn1_NTA0_NTB0_NTC0_NTD0_NTM0_NEPBS0_NLCA1_NLCB1_ONLL1_PGR2_PLR1_PKA0_SGROB0_SIA2_SS1_SU0_SUM0_SUS0_SPO0_SRVW0_SSO0_SVW1_SK0_SKFTR0_SKXCCM0_SGRO0_TDMI0_TIN0_TLDS1_TLDSMn1_ULSGRO0_USL1_UIOFGRO0_UPLRP0_USFGROn1_VSn1_VWA1_VWB1_WSGRA0_WSGRB0_WS32_WG16_2_1_WGM0_WGMXCC1_WGMXCCGn1
    SolutionIndex: 186
    SolutionNameMin: Cijk_Alik_Bljk_BBS_BH_Bias_HA_S_SAV_UserArgs_MT32x16x128_MI16x16x1_SN_LDSB0_AFC1_AG0_AFEM1_AFEM1_ASEM1_CLR0_CADS0_DTLA0_DTLB0_DTVA0_DTVB0_DTVMXSA0_DTVMXSB0_DTVSM0_DPLBn1_EPS0_ELFLR0_EMLLn1_FDSI0_GRPM1_GRVWA8_GRVWB8_GSU1_GSUAMB_GSUC0_GSUWGMRR0_GLS0_ISA1151_IU1_K1_LDSTI0_LBSPPA256_LBSPPB256_LBSPPM0_LPA8_LPB8_LPM0_LRVW16_LWPMn1_MIAV1_MIWT1_1_MO40_MGRIPMn1_NTn1_NTA0_NTB0_NTC0_NTD0_NTM0_NEPBS0_NLCA1_NLCB1_ONLL1_PGR2_PLR1_PKA0_SGROBn1_SIA3_SS1_SU32_SUM1_SUS256_SPO0_SRVW0_SSO0_SVW1_SK0_SKFTR0_SKXCCM0_SGRO0_TDMI0_TIN0_TLDS1_TLDSM1_ULSGRO0_USL1_UIOFGRO0_UPLRP0_USFGROn1_VSn1_VWA1_VWB1_WSGRA0_WSGRB0_WS32_WG32_2_1_WGM8_WGMXCC1_WGMXCCGn1
    SolutionIndex: 187
    SolutionNameMin: Cijk_Alik_Bljk_BBS_BH_Bias_HA_S_SAV_UserArgs_MT16x16x64_MI16x16x1_SN_LDSB0_AFC1_AG0_AFEM1_AFEM1_ASEM1_CLR0_CADS0_DTLA0_DTLB0_DTVA0_DTVB0_DTVMXSA0_DTVMXSB0_DTVSM0_DPLBn1_EPS0_ELFLR0_EMLLn1_FDSI0_GRPM1_GRVWA8_GRVWB8_GSU1_GSUAMB_GSUC0_GSUWGMRR0_GLS0_ISA1151_IU1_K1_LDSTI0_LBSPPA128_LBSPPB128_LBSPPM0_LPA8_LPB8_LPM0_LRVW16_LWPMn1_MIAV1_MIWT1_1_MO40_MGRIPMn1_NTn1_NTA0_NTB0_NTC0_NTD0_NTM0_NEPBS0_NLCA1_NLCB1_ONLL1_PGR2_PLR1_PKA0_SGROBn1_SIA3_SS1_SU32_SUM1_SUS256_SPO0_SRVW0_SSO0_SVW1_SK0_SKFTR0_SKXCCM0_SGRO0_TDMI0_TIN0_TLDS1_TLDSM1_ULSGRO0_USL1_UIOFGRO0_UPLRP0_USFGROn1_VSn1_VWA1_VWB1_WSGRA0_WSGRB0_WS32_WG16_2_1_WGM8_WGMXCC1_WGMXCCGn1
    SolutionIndex: 188
    SolutionNameMin: Cijk_Alik_Bljk_BBS_BH_Bias_HA_S_SAV_UserArgs_MT16x16x64_MI16x16x1_SN_LDSB1_AFC1_AG0_AFEM1_AFEM1_ASEM1_CLR0_CADS0_DTLA0_DTLB0_DTVA0_DTVB0_DTVMXSA0_DTVMXSB0_DTVSM0_DPLB0_EPS0_ELFLR0_EMLLn1_FDSI0_GRPM1_GRVWA8_GRVWB8_GSU1_GSUAMB_GSUC0_GSUWGMRR0_GLS0_ISA1151_IU4_K1_LDSTI0_LBSPPA128_LBSPPB128_LBSPPM0_LPA8_LPB8_LPM0_LRVW16_LWPMn1_MIAV1_MIWT1_1_MO40_MGRIPM1_NTn1_NTA0_NTB0_NTC0_NTD0_NTM0_NEPBS0_NLCA1_NLCB1_ONLL1_PGR2_PLR1_PKA0_SGROB0_SIA2_SS1_SU0_SUM0_SUS0_SPO0_SRVW0_SSO0_SVW1_SK0_SKFTR0_SKXCCM0_SGRO0_TDMI0_TIN0_TLDS1_TLDSMn1_ULSGRO0_USL1_UIOFGRO0_UPLRP0_USFGROn1_VSn1_VWA1_VWB1_WSGRA0_WSGRB0_WS32_WG16_2_1_WGM0_WGMXCC1_WGMXCCGn1
    SolutionIndex: 189
    SolutionNameMin: Cijk_Alik_Bljk_BBS_BH_Bias_HA_S_SAV_UserArgs_MT32x32x64_MI16x16x1_SN_LDSB0_AFC1_AG0_AFEM1_AFEM1_ASEM1_CLR0_CADS0_DTLA0_DTLB0_DTVA0_DTVB0_DTVMXSA0_DTVMXSB0_DTVSM0_DPLBn1_EPS0_ELFLR0_EMLLn1_FDSI0_GRPM1_GRVWA8_GRVWB8_GSU1_GSUAMB_GSUC0_GSUWGMRR0_GLS0_ISA1151_IU1_K1_LDSTI0_LBSPPA128_LBSPPB128_LBSPPM0_LPA8_LPB8_LPM0_LRVW16_LWPMn1_MIAV1_MIWT1_1_MO40_MGRIPMn1_NTn1_NTA0_NTB0_NTC0_NTD0_NTM0_NEPBS0_NLCA1_NLCB1_ONLL1_PGR2_PLR0_PKA0_SGROBn1_SIA1_SS1_SU32_SUM1_SUS256_SPO0_SRVW0_SSO0_SVW1_SK0_SKFTR0_SKXCCM0_SGRO0_TDMI0_TIN0_TLDS1_TLDSM1_ULSGRO0_USL1_UIOFGRO0_UPLRP0_USFGROn1_VSn1_VWA1_VWB1_WSGRA0_WSGRB0_WS32_WG32_4_1_WGM8_WGMXCC1_WGMXCCGn1
    SolutionIndex: 190
    SolutionNameMin: Cijk_Alik_Bljk_BBS_BH_Bias_HA_S_SAV_UserArgs_MT16x16x64_MI16x16x1_SN_LDSB0_AFC1_AG0_AFEM1_AFEM1_ASEM1_CLR0_CADS0_DTLA0_DTLB0_DTVA0_DTVB0_DTVMXSA0_DTVMXSB0_DTVSM0_DPLBn1_EPS0_ELFLR0_EMLLn1_FDSI0_GRPM1_GRVWA8_GRVWB8_GSU1_GSUAMB_GSUC0_GSUWGMRR0_GLS0_ISA1151_IU1_K1_LDSTI0_LBSPPA128_LBSPPB128_LBSPPM0_LPA8_LPB8_LPM0_LRVW16_LWPMn1_MIAV1_MIWT1_1_MO40_MGRIPMn1_NTn1_NTA0_NTB0_NTC0_NTD0_NTM0_NEPBS0_NLCA1_NLCB1_ONLL1_PGR1_PLR0_PKA0_SGROBn1_SIA1_SS1_SU32_SUM1_SUS256_SPO0_SRVW0_SSO0_SVW1_SK0_SKFTR0_SKXCCM0_SGRO0_TDMI0_TIN0_TLDS1_TLDSM1_ULSGRO0_USL1_UIOFGRO0_UPLRP0_USFGROn1_VSn1_VWA1_VWB1_WSGRA0_WSGRB0_WS32_WG16_2_1_WGM8_WGMXCC1_WGMXCCGn1
    SolutionIndex: 191
    SolutionNameMin: Cijk_Alik_Bljk_BBS_BH_Bias_HA_S_SAV_UserArgs_MT64x16x64_MI16x16x1_SN_LDSB0_AFC1_AG0_AFEM1_AFEM1_ASEM1_CLR0_CADS0_DTLA0_DTLB0_DTVA0_DTVB0_DTVMXSA0_DTVMXSB0_DTVSM0_DPLBn1_EPS0_ELFLR0_EMLLn1_FDSI0_GRPM1_GRVWA8_GRVWB8_GSU1_GSUAMB_GSUC0_GSUWGMRR0_GLS0_ISA1151_IU1_K1_LDSTI0_LBSPPA128_LBSPPB128_LBSPPM0_LPA8_LPB8_LPM0_LRVW16_LWPMn1_MIAV1_MIWT1_1_MO40_MGRIPMn1_NTn1_NTA0_NTB0_NTC0_NTD0_NTM0_NEPBS0_NLCA1_NLCB1_ONLL1_PGR2_PLR1_PKA0_SGROBn1_SIA1_SS1_SU32_SUM1_SUS256_SPO0_SRVW0_SSO0_SVW1_SK0_SKFTR0_SKXCCM0_SGRO0_TDMI0_TIN0_TLDS1_TLDSM1_ULSGRO0_USL1_UIOFGRO0_UPLRP0_USFGROn1_VSn1_VWA1_VWB1_WSGRA0_WSGRB0_WS32_WG64_2_1_WGM8_WGMXCC1_WGMXCCGn1
    SolutionIndex: 192
    SolutionNameMin: Cijk_Alik_Bljk_BBS_BH_Bias_HA_S_SAV_UserArgs_MT16x16x32_MI16x16x1_SN_LDSB0_AFC1_AG0_AFEM1_AFEM1_ASEM1_CLR0_CADS0_DTLA0_DTLB0_DTVA0_DTVB0_DTVMXSA0_DTVMXSB0_DTVSM0_DPLBn1_EPS0_ELFLR0_EMLLn1_FDSI0_GRPM1_GRVWA8_GRVWB8_GSU1_GSUAMB_GSUC0_GSUWGMRR0_GLS0_ISA1151_IU1_K1_LDSTI0_LBSPPA128_LBSPPB128_LBSPPM0_LPA8_LPB8_LPM0_LRVW16_LWPMn1_MIAV1_MIWT1_1_MO40_MGRIPMn1_NTn1_NTA0_NTB0_NTC0_NTD0_NTM0_NEPBS0_NLCA1_NLCB1_ONLL1_PGR2_PLR1_PKA0_SGROBn1_SIA1_SS1_SU32_SUM1_SUS256_SPO0_SRVW0_SSO0_SVW1_SK0_SKFTR0_SKXCCM0_SGRO0_TDMI0_TIN0_TLDS1_TLDSM1_ULSGRO0_USL1_UIOFGRO0_UPLRP0_USFGROn1_VSn1_VWA1_VWB1_WSGRA0_WSGRB0_WS32_WG16_2_1_WGM8_WGMXCC1_WGMXCCGn1
    SolutionIndex: 193
    SolutionNameMin: Cijk_Alik_Bljk_BBS_BH_Bias_HA_S_SAV_UserArgs_MT16x16x64_MI16x16x1_SN_LDSB1_AFC1_AG0_AFEM1_AFEM1_ASEM1_CLR0_CADS0_DTLA0_DTLB0_DTVA0_DTVB0_DTVMXSA0_DTVMXSB0_DTVSM0_DPLB0_EPS1_ELFLR0_EMLLn1_FDSI0_GRPM1_GRVWA8_GRVWB8_GSU1_GSUAMB_GSUC0_GSUWGMRR0_GLS0_ISA1151_IU4_K1_LDSTI0_LBSPPA128_LBSPPB128_LBSPPM0_LPA8_LPB8_LPM0_LRVW16_LWPMn1_MIAV1_MIWT1_1_MO40_MGRIPM1_NTn1_NTA0_NTB0_NTC0_NTD0_NTM0_NEPBS0_NLCA1_NLCB1_ONLL1_PGR1_PLR1_PKA0_SGROB0_SIA2_SS1_SU32_SUM0_SUS128_SPO0_SRVW0_SSO0_SVW1_SK0_SKFTR0_SKXCCM0_SGRO0_TDMI0_TIN0_TLDS1_TLDSMn1_ULSGRO0_USL1_UIOFGRO0_UPLRP0_USFGROn1_VSn1_VWA1_VWB1_WSGRA0_WSGRB0_WS32_WG16_2_1_WGM0_WGMXCC1_WGMXCCGn1
    SolutionIndex: 194
    SolutionNameMin: Cijk_Alik_Bljk_BBS_BH_Bias_HA_S_SAV_UserArgs_MT16x16x32_MI16x16x1_SN_LDSB0_AFC1_AG0_AFEM1_AFEM1_ASEM1_CLR0_CADS0_DTLA0_DTLB0_DTVA0_DTVB0_DTVMXSA0_DTVMXSB0_DTVSM0_DPLB0_EPS0_ELFLR0_EMLLn1_FDSI0_GRPM1_GRVWA8_GRVWB8_GSU1_GSUAMB_GSUC0_GSUWGMRR0_GLS0_ISA1151_IU1_K1_LDSTI0_LBSPPA128_LBSPPB128_LBSPPM0_LPA8_LPB8_LPM0_LRVW16_LWPMn1_MIAV1_MIWT1_1_MO40_MGRIPM1_NTn1_NTA0_NTB0_NTC0_NTD0_NTM0_NEPBS0_NLCA1_NLCB1_ONLL1_PGR2_PLR1_PKA0_SGROB0_SIA3_SS1_SU32_SUM0_SUS256_SPO0_SRVW0_SSO0_SVW1_SK0_SKFTR0_SKXCCM0_SGRO0_TDMI0_TIN0_TLDS1_TLDSMn1_ULSGRO0_USL1_UIOFGRO0_UPLRP0_USFGROn1_VSn1_VWA1_VWB1_WSGRA0_WSGRB0_WS32_WG16_2_1_WGM0_WGMXCC1_WGMXCCGn1
    SolutionIndex: 195
    SolutionNameMin: Cijk_Alik_Bljk_BBS_BH_Bias_HA_S_SAV_UserArgs_MT32x32x32_MI16x16x1_SN_LDSB0_AFC1_AG0_AFEM1_AFEM1_ASEM1_CLR0_CADS0_DTLA0_DTLB0_DTVA0_DTVB0_DTVMXSA0_DTVMXSB0_DTVSM0_DPLB0_EPS0_ELFLR0_EMLLn1_FDSI0_GRPM1_GRVWA8_GRVWB8_GSU1_GSUAMB_GSUC0_GSUWGMRR0_GLS0_ISA1151_IU1_K1_LDSTI0_LBSPPA128_LBSPPB128_LBSPPM0_LPA8_LPB8_LPM0_LRVW16_LWPMn1_MIAV1_MIWT2_1_MO40_MGRIPM1_NTn1_NTA0_NTB0_NTC0_NTD0_NTM0_NEPBS0_NLCA1_NLCB1_ONLL1_PGR2_PLR1_PKA0_SGROB0_SIA3_SS1_SU0_SUM0_SUS0_SPO0_SRVW0_SSO0_SVW2_SK0_SKFTR0_SKXCCM0_SGRO0_TDMI0_TIN0_TLDS1_TLDSMn1_ULSGRO0_USL1_UIOFGRO0_UPLRP0_USFGROn1_VSn1_VWA2_VWB1_WSGRA0_WSGRB0_WS32_WG16_4_1_WGM0_WGMXCC1_WGMXCCGn1
    SolutionIndex: 196
    SolutionNameMin: Cijk_Alik_Bljk_BBS_BH_Bias_HA_S_SAV_UserArgs_MT16x16x32_MI16x16x1_SN_LDSB1_AFC1_AG0_AFEM1_AFEM1_ASEM1_CLR0_CADS0_DTLA0_DTLB0_DTVA0_DTVB0_DTVMXSA0_DTVMXSB0_DTVSM0_DPLB0_EPS1_ELFLR0_EMLLn1_FDSI0_GRPM1_GRVWA8_GRVWB8_GSU1_GSUAMB_GSUC0_GSUWGMRR0_GLS0_ISA1151_IU2_K1_LDSTI0_LBSPPA128_LBSPPB128_LBSPPM0_LPA8_LPB8_LPM0_LRVW16_LWPMn1_MIAV1_MIWT1_1_MO40_MGRIPM1_NTn1_NTA0_NTB0_NTC0_NTD0_NTM0_NEPBS0_NLCA1_NLCB1_ONLL1_PGR1_PLR1_PKA0_SGROB0_SIA2_SS0_SU0_SUM0_SUS0_SPO0_SRVW0_SSO0_SVW1_SK0_SKFTR0_SKXCCM0_SGRO0_TDMI0_TIN0_TLDS1_TLDSMn1_ULSGRO0_USL1_UIOFGRO0_UPLRP0_USFGROn1_VSn1_VWA1_VWB1_WSGRA0_WSGRB0_WS32_WG16_2_1_WGM0_WGMXCC1_WGMXCCGn1
    SolutionIndex: 197
    SolutionNameMin: Cijk_Alik_Bljk_BBS_BH_Bias_HA_S_SAV_UserArgs_MT16x16x64_MI16x16x1_SN_LDSB0_AFC1_AG0_AFEM1_AFEM1_ASEM1_CLR0_CADS0_DTLA0_DTLB0_DTVA0_DTVB0_DTVMXSA0_DTVMXSB0_DTVSM0_DPLBn1_EPS0_ELFLR0_EMLLn1_FDSI0_GRPM1_GRVWA8_GRVWB8_GSU1_GSUAMB_GSUC0_GSUWGMRR0_GLS0_ISA1151_IU1_K1_LDSTI0_LBSPPA128_LBSPPB128_LBSPPM0_LPA8_LPB8_LPM0_LRVW16_LWPMn1_MIAV1_MIWT1_1_MO40_MGRIPMn1_NTn1_NTA0_NTB0_NTC0_NTD0_NTM0_NEPBS0_NLCA1_NLCB1_ONLL1_PGR1_PLR1_PKA0_SGROBn1_SIA3_SS1_SU32_SUM1_SUS256_SPO0_SRVW0_SSO0_SVW1_SK0_SKFTR0_SKXCCM0_SGRO0_TDMI0_TIN0_TLDS1_TLDSM1_ULSGRO0_USL1_UIOFGRO0_UPLRP0_USFGROn1_VSn1_VWA1_VWB1_WSGRA0_WSGRB0_WS32_WG16_2_1_WGM8_WGMXCC1_WGMXCCGn1
    SolutionIndex: 198
    SolutionNameMin: Cijk_Alik_Bljk_BBS_BH_Bias_HA_S_SAV_UserArgs_MT32x32x32_MI16x16x1_CMS_SN_LDSB0_AFC1_AG0_AFEM1_AFEM1_ASEM1_CLR1_CADS0_DTLA0_DTLB0_DTVA0_DTVB0_DTVMXSA0_DTVMXSB0_DTVSM0_DPLBn1_EPS0_ELFLR0_EMLLn1_FDSI0_GRPM1_GRVWA8_GRVWB1_GSU1_GSUAMB_GSUC0_GSUWGMRR0_GLS0_ISA1151_IU1_LDSTI0_LBSPPA128_LBSPPB128_LBSPPM0_LPA16_LPB16_LPM0_LRVW16_LWPMn1_MIAV1_MIWT1_1_MO40_MGRIPMn1_NTn1_NTA0_NTB0_NTC0_NTD0_NTM0_NEPBS0_NLCA1_NLCB1_ONLL1_PGR2_PLR1_PKA0_SGROBn1_SIA3_SS1_SU32_SUM1_SUS256_SPO0_SRVW0_SSO0_SVW1_SK0_SKFTR0_SKXCCM0_SGRO0_TDMI0_TIN0_TLDS1_TLDSM1_ULSGRO0_USL1_UIOFGRO0_UPLRP0_USFGROn1_VSn1_VWA1_VWB1_WSGRA0_WSGRB0_WS32_WG32_4_1_WGM8_WGMXCC1_WGMXCCGn1
    SolutionIndex: 199
    SolutionNameMin: Cijk_Alik_Bljk_BBS_BH_Bias_HA_S_SAV_UserArgs_MT32x64x32_MI16x16x1_SN_LDSB0_AFC1_AG0_AFEM1_AFEM1_ASEM1_CLR0_CADS0_DTLA0_DTLB0_DTVA0_DTVB0_DTVMXSA0_DTVMXSB0_DTVSM0_DPLB0_EPS0_ELFLR0_EMLLn1_FDSI0_GRPM1_GRVWA8_GRVWB8_GSU1_GSUAMB_GSUC0_GSUWGMRR0_GLS0_ISA1151_IU1_K1_LDSTI0_LBSPPA128_LBSPPB128_LBSPPM0_LPA8_LPB8_LPM0_LRVW16_LWPMn1_MIAV1_MIWT2_1_MO40_MGRIPM1_NTn1_NTA0_NTB0_NTC0_NTD0_NTM0_NEPBS0_NLCA1_NLCB1_ONLL1_PGR2_PLR1_PKA0_SGROB0_SIA3_SS1_SU8_SUM0_SUS256_SPO0_SRVW0_SSO0_SVW2_SK0_SKFTR0_SKXCCM0_SGRO0_TDMI0_TIN0_TLDS1_TLDSMn1_ULSGRO0_USL1_UIOFGRO0_UPLRP0_USFGROn1_VSn1_VWA2_VWB1_WSGRA0_WSGRB0_WS32_WG16_8_1_WGM0_WGMXCC1_WGMXCCGn1
    SolutionIndex: 200
    SolutionNameMin: Cijk_Alik_Bljk_BBS_BH_Bias_HA_S_SAV_UserArgs_MT16x16x64_MI16x16x1_SN_LDSB1_AFC1_AG0_AFEM1_AFEM1_ASEM1_CLR0_CADS0_DTLA0_DTLB0_DTVA0_DTVB0_DTVMXSA0_DTVMXSB0_DTVSM0_DPLB0_EPS0_ELFLR0_EMLLn1_FDSI0_GRPM1_GRVWA8_GRVWB8_GSU1_GSUAMB_GSUC0_GSUWGMRR0_GLS0_ISA1151_IU4_K1_LDSTI0_LBSPPA128_LBSPPB128_LBSPPM0_LPA8_LPB8_LPM0_LRVW16_LWPMn1_MIAV1_MIWT1_1_MO40_MGRIPM1_NTn1_NTA0_NTB0_NTC0_NTD0_NTM0_NEPBS0_NLCA1_NLCB1_ONLL1_PGR2_PLR1_PKA0_SGROB0_SIA2_SS1_SU32_SUM0_SUS256_SPO0_SRVW0_SSO0_SVW1_SK0_SKFTR0_SKXCCM0_SGRO0_TDMI0_TIN0_TLDS1_TLDSMn1_ULSGRO0_USL1_UIOFGRO0_UPLRP0_USFGROn1_VSn1_VWA1_VWB1_WSGRA0_WSGRB0_WS32_WG16_2_1_WGM0_WGMXCC1_WGMXCCGn1
    SolutionIndex: 201
    SolutionNameMin: Cijk_Alik_Bljk_BBS_BH_Bias_HA_S_SAV_UserArgs_MT64x16x64_MI16x16x1_SN_LDSB0_AFC1_AG0_AFEM1_AFEM1_ASEM1_CLR0_CADS0_DTLA0_DTLB0_DTVA0_DTVB0_DTVMXSA0_DTVMXSB0_DTVSM0_DPLB0_EPS0_ELFLR0_EMLLn1_FDSI0_GRPM1_GRVWA8_GRVWB8_GSU1_GSUAMB_GSUC0_GSUWGMRR0_GLS0_ISA1151_IU1_K1_LDSTI0_LBSPPA256_LBSPPB128_LBSPPM0_LPA8_LPB8_LPM0_LRVW16_LWPMn1_MIAV1_MIWT2_1_MO40_MGRIPM1_NTn1_NTA0_NTB0_NTC0_NTD0_NTM0_NEPBS0_NLCA1_NLCB1_ONLL1_PGR2_PLR0_PKA0_SGROB0_SIA3_SS1_SU32_SUM0_SUS128_SPO0_SRVW0_SSO0_SVW2_SK0_SKFTR0_SKXCCM0_SGRO0_TDMI0_TIN0_TLDS1_TLDSMn1_ULSGRO0_USL1_UIOFGRO0_UPLRP0_USFGROn1_VSn1_VWA2_VWB1_WSGRA0_WSGRB0_WS32_WG32_2_1_WGM0_WGMXCC1_WGMXCCGn1
    SolutionIndex: 202
    SolutionNameMin: Cijk_Alik_Bljk_BBS_BH_Bias_HA_S_SAV_UserArgs_MT32x32x32_MI16x16x1_SN_LDSB0_AFC1_AG0_AFEM1_AFEM1_ASEM1_CLR0_CADS0_DTLA0_DTLB0_DTVA0_DTVB0_DTVMXSA0_DTVMXSB0_DTVSM0_DPLB0_EPS0_ELFLR0_EMLLn1_FDSI0_GRPM1_GRVWA8_GRVWB8_GSU1_GSUAMB_GSUC0_GSUWGMRR0_GLS0_ISA1151_IU1_K1_LDSTI0_LBSPPA128_LBSPPB128_LBSPPM0_LPA8_LPB8_LPM0_LRVW16_LWPMn1_MIAV1_MIWT1_1_MO40_MGRIPM1_NTn1_NTA0_NTB0_NTC0_NTD0_NTM0_NEPBS0_NLCA1_NLCB1_ONLL1_PGR2_PLR1_PKA0_SGROB0_SIA3_SS1_SU8_SUM0_SUS256_SPO0_SRVW0_SSO0_SVW1_SK0_SKFTR0_SKXCCM0_SGRO0_TDMI0_TIN0_TLDS1_TLDSMn1_ULSGRO0_USL1_UIOFGRO0_UPLRP0_USFGROn1_VSn1_VWA1_VWB1_WSGRA0_WSGRB0_WS32_WG32_4_1_WGM0_WGMXCC1_WGMXCCGn1
    SolutionIndex: 203
    SolutionNameMin: Cijk_Alik_Bljk_BBS_BH_Bias_HA_S_SAV_UserArgs_MT64x16x32_MI16x16x1_SN_LDSB0_AFC1_AG0_AFEM1_AFEM1_ASEM1_CLR0_CADS0_DTLA0_DTLB0_DTVA0_DTVB0_DTVMXSA0_DTVMXSB0_DTVSM0_DPLB0_EPS0_ELFLR0_EMLLn1_FDSI0_GRPM1_GRVWA8_GRVWB8_GSU1_GSUAMB_GSUC0_GSUWGMRR0_GLS0_ISA1151_IU1_K1_LDSTI0_LBSPPA256_LBSPPB128_LBSPPM0_LPA8_LPB8_LPM0_LRVW16_LWPMn1_MIAV1_MIWT4_1_MO40_MGRIPM1_NTn1_NTA0_NTB0_NTC0_NTD0_NTM0_NEPBS0_NLCA1_NLCB1_ONLL1_PGR2_PLR1_PKA0_SGROB0_SIA3_SS1_SU0_SUM0_SUS0_SPO0_SRVW0_SSO0_SVW4_SK0_SKFTR0_SKXCCM0_SGRO0_TDMI0_TIN0_TLDS1_TLDSMn1_ULSGRO0_USL1_UIOFGRO0_UPLRP0_USFGROn1_VSn1_VWA4_VWB1_WSGRA0_WSGRB0_WS32_WG16_2_1_WGM0_WGMXCC1_WGMXCCGn1
    SolutionIndex: 204
    SolutionNameMin: Cijk_Alik_Bljk_BBS_BH_Bias_HA_S_SAV_UserArgs_MT64x32x32_MI16x16x1_SN_LDSB1_AFC1_AG0_AFEM1_AFEM1_ASEM1_CLR0_CADS0_DTLA0_DTLB0_DTVA0_DTVB0_DTVMXSA0_DTVMXSB0_DTVSM0_DPLB0_EPS1_ELFLR0_EMLLn1_FDSI0_GRPM1_GRVWA8_GRVWB8_GSU1_GSUAMB_GSUC0_GSUWGMRR0_GLS0_ISA1151_IU2_K1_LDSTI0_LBSPPA256_LBSPPB0_LBSPPM0_LPA8_LPB0_LPM0_LRVW16_LWPMn1_MIAV1_MIWT4_1_MO40_MGRIPM1_NTn1_NTA0_NTB0_NTC0_NTD0_NTM0_NEPBS0_NLCA1_NLCB1_ONLL1_PGR1_PLR1_PKA0_SGROB0_SIA2_SS1_SU0_SUM0_SUS0_SPO0_SRVW0_SSO0_SVW4_SK0_SKFTR0_SKXCCM0_SGRO0_TDMI0_TIN0_TLDS1_TLDSMn1_ULSGRO0_USL1_UIOFGRO0_UPLRP0_USFGROn1_VSn1_VWA4_VWB1_WSGRA0_WSGRB0_WS32_WG16_4_1_WGM0_WGMXCC1_WGMXCCGn1
    SolutionIndex: 205
    SolutionNameMin: Cijk_Alik_Bljk_BBS_BH_Bias_HA_S_SAV_UserArgs_MT64x32x32_MI16x16x1_CMS_SN_LDSB0_AFC1_AG0_AFEM1_AFEM1_ASEM1_CLR1_CADS0_DTLA0_DTLB0_DTVA0_DTVB0_DTVMXSA0_DTVMXSB0_DTVSM0_DPLBn1_EPS0_ELFLR0_EMLLn1_FDSI0_GRPM1_GRVWA1_GRVWB8_GSU1_GSUAMB_GSUC0_GSUWGMRR0_GLS0_ISA1151_IU1_LDSTI0_LBSPPA128_LBSPPB128_LBSPPM0_LPA16_LPB16_LPM0_LRVW16_LWPMn1_MIAV1_MIWT2_1_MO40_MGRIPMn1_NTn1_NTA0_NTB0_NTC0_NTD0_NTM0_NEPBS0_NLCA1_NLCB1_ONLL1_PGR2_PLR1_PKA0_SGROBn1_SIA3_SS1_SU32_SUM1_SUS256_SPO0_SRVW0_SSO0_SVW1_SK0_SKFTR0_SKXCCM0_SGRO0_TDMI0_TIN0_TLDS1_TLDSM1_ULSGRO0_USL1_UIOFGRO0_UPLRP0_USFGROn1_VSn1_VWA1_VWB1_WSGRA0_WSGRB0_WS32_WG32_4_1_WGM8_WGMXCC1_WGMXCCGn1
    SolutionIndex: 206
    SolutionNameMin: Cijk_Alik_Bljk_BBS_BH_Bias_HA_S_SAV_UserArgs_MT64x64x32_MI16x16x1_SN_LDSB1_AFC1_AG0_AFEM1_AFEM1_ASEM1_CLR0_CADS0_DTLA0_DTLB0_DTVA0_DTVB0_DTVMXSA0_DTVMXSB0_DTVSM0_DPLB0_EPS0_ELFLR0_EMLLn1_FDSI0_GRPM1_GRVWA8_GRVWB8_GSU1_GSUAMB_GSUC0_GSUWGMRR0_GLS0_ISA1151_IU2_K1_LDSTI0_LBSPPA256_LBSPPB128_LBSPPM0_LPA8_LPB8_LPM0_LRVW16_LWPMn1_MIAV1_MIWT4_1_MO40_MGRIPM1_NTn1_NTA0_NTB0_NTC0_NTD0_NTM0_NEPBS0_NLCA1_NLCB1_ONLL1_PGR2_PLR1_PKA0_SGROB0_SIA2_SS1_SU0_SUM0_SUS0_SPO0_SRVW0_SSO0_SVW4_SK0_SKFTR0_SKXCCM0_SGRO0_TDMI0_TIN0_TLDS1_TLDSMn1_ULSGRO0_USL1_UIOFGRO0_UPLRP0_USFGROn1_VSn1_VWA4_VWB1_WSGRA0_WSGRB0_WS32_WG16_8_1_WGM0_WGMXCC1_WGMXCCGn1
- - - [3136, 2880, 1, 1024]
    - [0, 39607.9]
  - - [2624, 3136, 1, 1024]
    - [34, 39375.5]
  - - [3136, 3136, 1, 1024]
    - [1, 39184.9]
  - - [3904, 3392, 1, 1024]
    - [97, 39248.0]
  - - [3392, 3648, 1, 1024]
    - [97, 38749.2]
  - - [3392, 3904, 1, 1024]
    - [1, 38966.0]
  - - [3904, 1088, 1, 2048]
    - [84, 41033.0]
  - - [2624, 1600, 1, 2048]
    - [0, 41841.0]
  - - [3136, 1600, 1, 2048]
    - [1, 41943.0]
  - - [3136, 1856, 1, 2048]
    - [1, 40892.7]
  - - [3904, 1856, 1, 2048]
    - [0, 41393.2]
  - - [1856, 2112, 1, 2048]
    - [4, 42141.2]
  - - [2112, 2112, 1, 2048]
    - [4, 40782.1]
  - - [2880, 2112, 1, 2048]
    - [1, 42661.2]
  - - [2368, 2368, 1, 2048]
    - [1, 42454.7]
  - - [2112, 2624, 1, 2048]
    - [1, 42192.5]
  - - [2624, 2624, 1, 2048]
    - [1, 42093.3]
  - - [2368, 2880, 1, 2048]
    - [82, 41880.2]
  - - [1600, 3136, 1, 2048]
    - [1, 41772.5]
  - - [2112, 3136, 1, 2048]
    - [1, 43130.0]
  - - [2624, 3136, 1, 2048]
    - [0, 40904.6]
  - - [3392, 3136, 1, 2048]
    - [5, 38320.5]
  - - [1600, 3648, 1, 2048]
    - [0, 40867.6]
  - - [2624, 832, 1, 4096]
    - [84, 43620.8]
  - - [3392, 832, 1, 4096]
    - [81, 39452.2]
  - - [2112, 1088, 1, 4096]
    - [1, 44291.9]
  - - [2624, 1088, 1, 4096]
    - [81, 42215.6]
  - - [2112, 1344, 1, 4096]
    - [5, 43709.1]
  - - [2880, 1344, 1, 4096]
    - [4, 40914.8]
  - - [2112, 1600, 1, 4096]
    - [1, 40950.3]
  - - [2368, 1600, 1, 4096]
    - [34, 40625.5]
  - - [3904, 1600, 1, 4096]
    - [44, 36866.4]
  - - [1344, 1856, 1, 4096]
    - [4, 42929.9]
  - - [1856, 1856, 1, 4096]
    - [81, 40544.9]
  - - [1344, 2112, 1, 4096]
    - [1, 44461.2]
  - - [2368, 2112, 1, 4096]
    - [0, 40364.5]
  - - [3136, 2112, 1, 4096]
    - [85, 38810.8]
  - - [1088, 2368, 1, 4096]
    - [1, 41710.9]
  - - [3392, 2368, 1, 4096]
    - [5, 36474.6]
  - - [3648, 2368, 1, 4096]
    - [87, 37304.3]
  - - [1088, 3136, 1, 4096]
    - [0, 40508.5]
  - - [1344, 3136, 1, 4096]
    - [3, 39415.0]
  - - [3136, 3904, 1, 4096]
    - [84, 39910.1]
  - - [1984, 1216, 1, 4096]
    - [82, 43151.9]
  - - [1472, 1344, 1, 4096]
    - [4, 41986.5]
  - - [1728, 1344, 1, 4096]
    - [1, 44660.5]
  - - [1344, 1472, 1, 4096]
    - [4, 41449.6]
  - - [1856, 1472, 1, 4096]
    - [1, 44056.7]
  - - [1600, 1728, 1, 4096]
    - [1, 44150.6]
  - - [1216, 1856, 1, 4096]
    - [1, 43298.6]
  - - [1088, 1984, 1, 4096]
    - [1, 42507.7]
  - - [2368, 4096, 1, 1024]
    - [97, 40211.0]
  - - [3136, 4096, 1, 2048]
    - [82, 38264.3]
  - - [3392, 4096, 1, 2048]
    - [34, 39139.1]
  - - [4096, 3904, 1, 512]
    - [90, 32360.8]
  - - [4096, 2368, 1, 1024]
    - [108, 40456.7]
  - - [4096, 3136, 1, 1024]
    - [34, 33813.2]
  - - [4096, 1856, 1, 2048]
    - [34, 37471.1]
  - - [4096, 2112, 1, 2048]
    - [34, 37937.3]
  - - [768, 8192, 1, 2048]
    - [34, 38121.0]
  - - [1536, 2048, 1, 8192]
    - [44, 35013.3]
  - - [3072, 512, 1, 8192]
    - [38, 38121.0]
  - - [8192, 512, 1, 8192]
    - [38, 34847.6]
  - - [8192, 2048, 1, 8192]
    - [3, 38124.5]
  - - [8192, 4096, 1, 8192]
    - [3, 38617.3]
  - - [8192, 8192, 1, 128]
    - [90, 20550.1]
  - - [8192, 8192, 1, 4096]
    - [3, 38466.0]
  - - [3392, 576, 1, 64]
    - [21, 8336.18]
  - - [2624, 832, 1, 64]
    - [21, 9314.85]
  - - [2880, 832, 1, 64]
    - [21, 9294.2]
  - - [1856, 1088, 1, 64]
    - [13, 8337.87]
  - - [2368, 1088, 1, 64]
    - [21, 9422.2]
  - - [2624, 1088, 1, 64]
    - [8, 10440.8]
  - - [2880, 1088, 1, 64]
    - [21, 10840.0]
  - - [3648, 1088, 1, 64]
    - [21, 11546.3]
  - - [3904, 1088, 1, 64]
    - [21, 12356.5]
  - - [1600, 1344, 1, 64]
    - [21, 9175.04]
  - - [2624, 1344, 1, 64]
    - [21, 11010.0]
  - - [3392, 1344, 1, 64]
    - [21, 12685.5]
  - - [3648, 1344, 1, 64]
    - [21, 12551.5]
  - - [3904, 1344, 1, 64]
    - [21, 12437.3]
  - - [1600, 1600, 1, 64]
    - [8, 9362.29]
  - - [2624, 1600, 1, 64]
    - [21, 12213.5]
  - - [2880, 1600, 1, 64]
    - [21, 12549.4]
  - - [3648, 1600, 1, 64]
    - [21, 13341.3]
  - - [3904, 1600, 1, 64]
    - [21, 13785.2]
  - - [1088, 1856, 1, 64]
    - [21, 8615.8]
  - - [2112, 1856, 1, 64]
    - [21, 11149.9]
  - - [2880, 1856, 1, 64]
    - [21, 13415.6]
  - - [3392, 1856, 1, 64]
    - [21, 13893.6]
  - - [3648, 1856, 1, 64]
    - [21, 14207.3]
  - - [3904, 1856, 1, 64]
    - [21, 14491.6]
  - - [1088, 2112, 1, 64]
    - [21, 9191.42]
  - - [2624, 2112, 1, 64]
    - [21, 13384.2]
  - - [3136, 2112, 1, 64]
    - [21, 14369.0]
  - - [3904, 2112, 1, 64]
    - [21, 14864.7]
  - - [1856, 2368, 1, 64]
    - [8, 12229.6]
  - - [2368, 2368, 1, 64]
    - [21, 13291.7]
  - - [2880, 2368, 1, 64]
    - [21, 14549.0]
  - - [3136, 2368, 1, 64]
    - [21, 14187.1]
  - - [832, 2624, 1, 64]
    - [21, 9014.37]
  - - [1088, 2624, 1, 64]
    - [21, 10440.8]
  - - [1600, 2624, 1, 64]
    - [21, 11942.1]
  - - [1856, 2624, 1, 64]
    - [21, 12987.1]
  - - [2368, 2624, 1, 64]
    - [16, 13953.4]
  - - [2624, 2624, 1, 64]
    - [21, 14448.0]
  - - [3136, 2624, 1, 64]
    - [21, 14629.1]
  - - [3392, 2624, 1, 64]
    - [21, 15395.6]
  - - [832, 2880, 1, 64]
    - [21, 9020.84]
  - - [1088, 2880, 1, 64]
    - [21, 10554.7]
  - - [1344, 2880, 1, 64]
    - [21, 11796.5]
  - - [2880, 2880, 1, 64]
    - [21, 15166.9]
  - - [3136, 2880, 1, 64]
    - [21, 15414.1]
  - - [3392, 2880, 1, 64]
    - [21, 15630.3]
  - - [3648, 2880, 1, 64]
    - [21, 16009.5]
  - - [1088, 3136, 1, 64]
    - [21, 11492.9]
  - - [1856, 3136, 1, 64]
    - [21, 13545.7]
  - - [2368, 3136, 1, 64]
    - [21, 14852.1]
  - - [3136, 3136, 1, 64]
    - [21, 15735.2]
  - - [576, 3392, 1, 64]
    - [150, 11908.8]
  - - [1088, 3392, 1, 64]
    - [21, 11809.6]
  - - [1600, 3392, 1, 64]
    - [21, 13107.2]
  - - [3392, 3392, 1, 64]
    - [21, 16183.8]
  - - [832, 3648, 1, 64]
    - [21, 11099.9]
  - - [1088, 3648, 1, 64]
    - [21, 12096.1]
  - - [1856, 3648, 1, 64]
    - [21, 14207.3]
  - - [2624, 3648, 1, 64]
    - [21, 15509.6]
  - - [3392, 3648, 1, 64]
    - [21, 16328.6]
  - - [1600, 3904, 1, 64]
    - [21, 13785.2]
  - - [2624, 3904, 1, 64]
    - [21, 15990.8]
  - - [2880, 3904, 1, 64]
    - [21, 16170.5]
  - - [3648, 3904, 1, 64]
    - [21, 16423.0]
  - - [3904, 3904, 1, 64]
    - [35, 16817.9]
  - - [2880, 320, 1, 256]
    - [35, 16852.1]
  - - [1088, 576, 1, 256]
    - [21, 13369.3]
  - - [1344, 576, 1, 256]
    - [9, 15854.5]
  - - [1856, 576, 1, 256]
    - [21, 17656.7]
  - - [1088, 832, 1, 256]
    - [8, 16552.5]
  - - [3904, 832, 1, 256]
    - [28, 25985.0]
  - - [2624, 1088, 1, 256]
    - [106, 25644.1]
  - - [3648, 1088, 1, 256]
    - [37, 27095.2]
  - - [2624, 1344, 1, 256]
    - [126, 26950.0]
  - - [2880, 1344, 1, 256]
    - [14, 27148.1]
  - - [576, 1600, 1, 256]
    - [159, 22363.0]
  - - [3648, 1600, 1, 256]
    - [8, 29298.4]
  - - [320, 1856, 1, 256]
    - [151, 18770.8]
  - - [576, 1856, 1, 256]
    - [147, 23193.1]
  - - [2112, 1856, 1, 256]
    - [21, 27121.3]
  - - [2880, 1856, 1, 256]
    - [21, 29114.7]
  - - [3392, 1856, 1, 256]
    - [17, 29302.9]
  - - [3904, 1856, 1, 256]
    - [8, 30161.5]
  - - [576, 2112, 1, 256]
    - [148, 26170.3]
  - - [832, 2112, 1, 256]
    - [14, 21420.9]
  - - [1088, 2112, 1, 256]
    - [78, 23530.0]
  - - [2368, 2112, 1, 256]
    - [21, 28771.0]
  - - [2880, 2112, 1, 256]
    - [17, 29659.7]
  - - [3136, 2112, 1, 256]
    - [21, 29487.8]
  - - [3648, 2112, 1, 256]
    - [17, 29005.5]
  - - [3904, 2112, 1, 256]
    - [21, 30371.0]
  - - [1088, 2624, 1, 256]
    - [8, 25644.1]
  - - [1600, 2624, 1, 256]
    - [16, 27916.6]
  - - [3392, 2624, 1, 256]
    - [36, 30791.3]
  - - [832, 2880, 1, 256]
    - [78, 24536.7]
  - - [2880, 2880, 1, 256]
    - [28, 30773.4]
  - - [3136, 2880, 1, 256]
    - [78, 30027.4]
  - - [3392, 2880, 1, 256]
    - [21, 30498.2]
  - - [320, 3136, 1, 256]
    - [151, 23461.3]
  - - [832, 3136, 1, 256]
    - [8, 23855.1]
  - - [1344, 3136, 1, 256]
    - [8, 28394.3]
  - - [1600, 3136, 1, 256]
    - [30, 28865.3]
  - - [2624, 3136, 1, 256]
    - [30, 30094.1]
  - - [320, 3392, 1, 256]
    - [147, 23156.1]
  - - [1856, 3392, 1, 256]
    - [107, 28779.7]
  - - [3648, 3392, 1, 256]
    - [18, 31056.4]
  - - [832, 3648, 1, 256]
    - [15, 27263.0]
  - - [1856, 3648, 1, 256]
    - [14, 30144.3]
  - - [1600, 3904, 1, 256]
    - [30, 30171.3]
  - - [1856, 3904, 1, 256]
    - [36, 30408.7]
  - - [576, 1088, 1, 512]
    - [2, 20054.0]
  - - [2112, 1344, 1, 512]
    - [30, 31941.2]
  - - [2368, 1344, 1, 512]
    - [125, 31640.5]
  - - [3136, 1344, 1, 512]
    - [15, 33456.9]
  - - [3392, 1344, 1, 512]
    - [28, 34074.9]
  - - [1088, 1600, 1, 512]
    - [2, 27852.8]
  - - [1344, 1600, 1, 512]
    - [28, 31457.3]
  - - [1856, 1600, 1, 512]
    - [15, 34167.1]
  - - [2112, 1600, 1, 512]
    - [28, 34260.4]
  - - [320, 1856, 1, 512]
    - [151, 25553.5]
  - - [1088, 1856, 1, 512]
    - [9, 30408.7]
  - - [1600, 1856, 1, 512]
    - [30, 34555.3]
  - - [2112, 1856, 1, 512]
    - [14, 31856.7]
  - - [1088, 2112, 1, 512]
    - [45, 30960.6]
  - - [1088, 2368, 1, 512]
    - [78, 31407.3]
  - - [3648, 2368, 1, 512]
    - [2, 35812.9]
  - - [1088, 2624, 1, 512]
    - [8, 33602.6]
  - - [1856, 2624, 1, 512]
    - [37, 33925.4]
  - - [1600, 2880, 1, 512]
    - [28, 34952.5]
  - - [2112, 2880, 1, 512]
    - [28, 34411.8]
  - - [3136, 2880, 1, 512]
    - [28, 35299.4]
  - - [320, 3136, 1, 512]
    - [151, 28704.0]
  - - [832, 3136, 1, 512]
    - [8, 31432.6]
  - - [1088, 3136, 1, 512]
    - [28, 33594.8]
  - - [2112, 3136, 1, 512]
    - [2, 34603.0]
  - - [2880, 3136, 1, 512]
    - [30, 35846.7]
  - - [3136, 3136, 1, 512]
    - [30, 34725.9]
  - - [1344, 3392, 1, 512]
    - [18, 34325.4]
  - - [3136, 3392, 1, 512]
    - [28, 35596.8]
  - - [3392, 3392, 1, 512]
    - [28, 36030.0]
  - - [3648, 3392, 1, 512]
    - [17, 35793.8]
  - - [3904, 3392, 1, 512]
    - [28, 36257.2]
  - - [832, 3648, 1, 512]
    - [15, 33419.1]
  - - [1088, 3648, 1, 512]
    - [15, 33589.1]
  - - [1344, 3648, 1, 512]
    - [107, 34624.7]
  - - [1600, 3648, 1, 512]
    - [28, 36005.3]
  - - [3904, 3648, 1, 512]
    - [28, 36642.2]
  - - [2624, 3904, 1, 512]
    - [30, 34850.3]
  - - [1856, 1088, 1, 1024]
    - [34, 33622.6]
  - - [2112, 1088, 1, 1024]
    - [34, 35119.5]
  - - [3136, 1088, 1, 1024]
    - [34, 34764.7]
  - - [2368, 1344, 1, 1024]
    - [0, 36413.1]
  - - [2624, 1344, 1, 1024]
    - [0, 35579.3]
  - - [832, 1600, 1, 1024]
    - [15, 34078.7]
  - - [1088, 1600, 1, 1024]
    - [32, 36379.2]
  - - [2112, 1600, 1, 1024]
    - [2, 36044.8]
  - - [3136, 1600, 1, 1024]
    - [1, 37641.2]
  - - [3904, 1600, 1, 1024]
    - [97, 37187.9]
  - - [832, 1856, 1, 1024]
    - [14, 34375.1]
  - - [1600, 1856, 1, 1024]
    - [97, 37083.8]
  - - [1856, 1856, 1, 1024]
    - [28, 36936.2]
  - - [2112, 1856, 1, 1024]
    - [1, 36161.7]
  - - [64, 2112, 1, 1024]
    - [158, 15639.8]
  - - [832, 2112, 1, 1024]
    - [40, 34939.0]
  - - [1344, 2112, 1, 1024]
    - [2, 37748.7]
  - - [1856, 2112, 1, 1024]
    - [4, 36490.4]
  - - [2368, 2112, 1, 1024]
    - [1, 36843.5]
  - - [3136, 2112, 1, 1024]
    - [0, 38426.0]
  - - [3648, 2112, 1, 1024]
    - [5, 37127.0]
  - - [64, 2368, 1, 1024]
    - [158, 17339.6]
  - - [1088, 2368, 1, 1024]
    - [3, 34943.3]
  - - [1344, 2368, 1, 1024]
    - [1, 36210.8]
  - - [2112, 2368, 1, 1024]
    - [1, 36450.1]
  - - [3136, 2368, 1, 1024]
    - [1, 38405.4]
  - - [1344, 2624, 1, 1024]
    - [28, 38013.6]
  - - [576, 3392, 1, 1024]
    - [161, 31090.6]
  - - [1600, 320, 1, 2048]
    - [34, 31775.0]
  - - [576, 832, 1, 2048]
    - [40, 32179.3]
  - - [1600, 832, 1, 2048]
    - [1, 37865.2]
  - - [2880, 832, 1, 2048]
    - [4, 38041.4]
  - - [64, 1088, 1, 2048]
    - [118, 10969.7]
  - - [320, 1088, 1, 2048]
    - [41, 29709.7]
  - - [1856, 1088, 1, 2048]
    - [0, 36598.1]
  - - [2112, 1088, 1, 2048]
    - [3, 38573.8]
  - - [2624, 1088, 1, 2048]
    - [1, 38466.2]
  - - [2880, 1088, 1, 2048]
    - [1, 40233.8]
  - - [3392, 1088, 1, 2048]
    - [1, 37602.7]
  - - [1344, 1344, 1, 2048]
    - [1, 39565.5]
  - - [1856, 1344, 1, 2048]
    - [96, 38702.0]
  - - [2624, 1344, 1, 2048]
    - [1, 39684.6]
  - - [2880, 1344, 1, 2048]
    - [4, 39341.1]
  - - [1856, 1600, 1, 2048]
    - [0, 38614.2]
  - - [576, 2112, 1, 2048]
    - [148, 35065.7]
  - - [576, 576, 1, 4096]
    - [4, 38827.3]
  - - [1856, 576, 1, 4096]
    - [4, 41116.0]
  - - [2368, 576, 1, 4096]
    - [0, 42647.4]
  - - [2624, 576, 1, 4096]
    - [81, 37980.3]
  - - [2880, 576, 1, 4096]
    - [1, 39735.5]
  - - [3136, 576, 1, 4096]
    - [0, 41449.6]
  - - [64, 832, 1, 4096]
    - [100, 13631.5]
  - - [576, 832, 1, 4096]
    - [80, 37389.2]
  - - [2112, 832, 1, 4096]
    - [1, 40097.1]
  - - [1856, 1472, 1, 64]
    - [8, 9991.43]
  - - [1984, 1472, 1, 64]
    - [8, 10103.2]
  - - [1728, 1600, 1, 64]
    - [8, 10111.3]
  - - [1216, 1728, 1, 64]
    - [21, 9274.47]
  - - [1856, 1728, 1, 64]
    - [21, 10803.1]
  - - [1984, 1856, 1, 64]
    - [88, 11222.3]
  - - [1216, 1984, 1, 64]
    - [21, 9082.52]
  - - [1344, 1984, 1, 64]
    - [8, 9751.76]
  - - [1600, 1984, 1, 64]
    - [75, 10692.7]
  - - [1856, 1984, 1, 64]
    - [21, 11222.3]
  - - [1216, 448, 1, 256]
    - [129, 12678.2]
  - - [960, 576, 1, 256]
    - [21, 12309.4]
  - - [1216, 576, 1, 256]
    - [35, 14942.2]
  - - [1728, 576, 1, 256]
    - [8, 16986.9]
  - - [704, 704, 1, 256]
    - [10, 11534.3]
  - - [1216, 704, 1, 256]
    - [8, 16857.9]
  - - [1472, 704, 1, 256]
    - [21, 18949.3]
  - - [576, 960, 1, 256]
    - [6, 12309.4]
  - - [704, 960, 1, 256]
    - [78, 13841.2]
  - - [960, 960, 1, 256]
    - [8, 16852.1]
  - - [1472, 1088, 1, 256]
    - [9, 20499.7]
  - - [1728, 1088, 1, 256]
    - [122, 20480.7]
  - - [1984, 1088, 1, 256]
    - [21, 22104.0]
  - - [448, 1216, 1, 256]
    - [151, 16904.3]
  - - [1984, 1216, 1, 256]
    - [11, 22458.6]
  - - [1472, 1344, 1, 256]
    - [9, 21102.6]
  - - [960, 1472, 1, 256]
    - [8, 20671.9]
  - - [1088, 1472, 1, 256]
    - [10, 20499.7]
  - - [1216, 1472, 1, 256]
    - [2, 20828.5]
  - - [1216, 1600, 1, 256]
    - [9, 21655.4]
  - - [1728, 1600, 1, 256]
    - [15, 25278.2]
  - - [320, 1728, 1, 256]
    - [151, 18148.4]
  - - [1216, 1728, 1, 256]
    - [9, 22890.2]
  - - [1600, 1728, 1, 256]
    - [8, 26214.4]
  - - [1728, 1728, 1, 256]
    - [8, 25480.4]
  - - [1472, 1856, 1, 256]
    - [8, 24978.6]
  - - [320, 1984, 1, 256]
    - [148, 18898.8]
  - - [704, 1984, 1, 256]
    - [8, 20432.3]
  - - [960, 1984, 1, 256]
    - [2, 22163.1]
  - - [1216, 1984, 1, 256]
    - [78, 23306.1]
  - - [1344, 1984, 1, 256]
    - [8, 24379.4]
  - - [960, 320, 1, 512]
    - [77, 13677.1]
  - - [1472, 320, 1, 512]
    - [122, 17226.6]
  - - [576, 448, 1, 512]
    - [143, 12582.9]
  - - [1344, 448, 1, 512]
    - [114, 19267.6]
  - - [1472, 448, 1, 512]
    - [8, 20463.1]
  - - [1984, 448, 1, 512]
    - [21, 24599.0]
  - - [1728, 576, 1, 512]
    - [8, 25480.4]
  - - [960, 704, 1, 512]
    - [2, 21626.9]
  - - [704, 832, 1, 512]
    - [6, 20682.3]
  - - [832, 960, 1, 512]
    - [9, 24055.6]
  - - [1088, 960, 1, 512]
    - [8, 26086.5]
  - - [1344, 960, 1, 512]
    - [8, 28110.8]
  - - [960, 1088, 1, 512]
    - [8, 26738.7]
  - - [704, 1216, 1, 512]
    - [8, 23692.1]
  - - [1728, 1216, 1, 512]
    - [9, 29884.4]
  - - [704, 1344, 1, 512]
    - [30, 23068.7]
  - - [960, 1344, 1, 512]
    - [15, 28110.8]
  - - [1216, 1344, 1, 512]
    - [9, 28853.9]
  - - [192, 1472, 1, 512]
    - [165, 16924.4]
  - - [448, 1472, 1, 512]
    - [147, 26072.7]
  - - [704, 1472, 1, 512]
    - [8, 27209.2]
  - - [1984, 1472, 1, 512]
    - [30, 33601.6]
  - - [192, 1728, 1, 512]
    - [165, 20343.6]
  - - [832, 1728, 1, 512]
    - [9, 26289.3]
  - - [1600, 1728, 1, 512]
    - [2, 31111.6]
  - - [1984, 1728, 1, 512]
    - [28, 34758.7]
  - - [704, 1856, 1, 512]
    - [8, 28467.7]
  - - [1472, 1856, 1, 512]
    - [8, 33706.0]
  - - [320, 1984, 1, 512]
    - [147, 25101.0]
  - - [832, 1984, 1, 512]
    - [9, 28649.2]
  - - [1088, 1984, 1, 512]
    - [28, 31577.1]
  - - [1472, 1984, 1, 512]
    - [15, 33228.2]
  - - [1344, 448, 1, 1024]
    - [81, 26236.7]
  - - [1216, 576, 1, 1024]
    - [4, 28126.5]
  - - [576, 704, 1, 1024]
    - [40, 23727.8]
  - - [960, 960, 1, 1024]
    - [2, 32542.0]
  - - [1344, 960, 1, 1024]
    - [32, 36197.4]
  - - [704, 1216, 1, 1024]
    - [2, 30227.9]
  - - [832, 1216, 1, 1024]
    - [28, 30925.2]
  - - [1984, 1216, 1, 1024]
    - [4, 35041.8]
  - - [448, 1344, 1, 1024]
    - [147, 28677.3]
  - - [704, 1344, 1, 1024]
    - [86, 29811.8]
  - - [1472, 1344, 1, 1024]
    - [95, 33485.1]
  - - [1728, 1344, 1, 1024]
    - [0, 36307.9]
  - - [1856, 1472, 1, 1024]
    - [1, 35638.2]
  - - [192, 1600, 1, 1024]
    - [165, 22389.5]
  - - [1600, 1728, 1, 1024]
    - [2, 37252.0]
  - - [1728, 1856, 1, 1024]
    - [1, 36694.3]
  - - [1984, 1856, 1, 1024]
    - [2, 37896.3]
  - - [960, 1984, 1, 1024]
    - [2, 37870.9]
  - - [1472, 1984, 1, 1024]
    - [18, 36693.7]
  - - [1728, 1984, 1, 1024]
    - [28, 35822.8]
  - - [1728, 576, 1, 2048]
    - [4, 37748.7]
  - - [1728, 832, 1, 2048]
    - [44, 37508.3]
  - - [64, 960, 1, 2048]
    - [117, 10066.3]
  - - [1344, 960, 1, 2048]
    - [1, 38020.3]
  - - [192, 1088, 1, 2048]
    - [10, 24446.8]
  - - [576, 1216, 1, 2048]
    - [165, 32198.7]
  - - [960, 1216, 1, 2048]
    - [44, 40180.7]
  - - [1728, 1216, 1, 2048]
    - [0, 37748.7]
  - - [1856, 1216, 1, 2048]
    - [0, 39005.3]
  - - [1984, 1216, 1, 2048]
    - [96, 37289.7]
  - - [1984, 1344, 1, 2048]
    - [1, 39716.2]
  - - [448, 1472, 1, 2048]
    - [147, 33347.3]
  - - [1088, 1472, 1, 2048]
    - [4, 36647.4]
  - - [1344, 1472, 1, 2048]
    - [1, 37171.5]
  - - [960, 1600, 1, 2048]
    - [44, 38130.0]
  - - [1728, 1728, 1, 2048]
    - [1, 38461.0]
  - - [1856, 1728, 1, 2048]
    - [1, 40296.2]
  - - [1216, 1856, 1, 2048]
    - [0, 39170.5]
  - - [64, 1984, 1, 2048]
    - [158, 17750.6]
  - - [1088, 1984, 1, 2048]
    - [1, 37784.6]
  - - [1216, 1984, 1, 2048]
    - [4, 38600.7]
  - - [1600, 1984, 1, 2048]
    - [1, 42352.9]
  - - [1728, 576, 1, 4096]
    - [4, 41180.4]
  - - [1088, 704, 1, 4096]
    - [1, 36269.8]
  - - [1216, 704, 1, 4096]
    - [1, 39398.2]
  - - [1856, 704, 1, 4096]
    - [0, 40240.1]
  - - [1728, 832, 1, 4096]
    - [44, 38998.7]
  - - [1984, 832, 1, 4096]
    - [1, 38307.2]
  - - [64, 960, 1, 4096]
    - [49, 15728.6]
  - - [960, 960, 1, 4096]
    - [1, 42896.3]
  - - [448, 1088, 1, 4096]
    - [40, 37669.6]
  - - [1216, 1088, 1, 4096]
    - [1, 41845.9]
  - - [1472, 1088, 1, 4096]
    - [1, 39163.5]
  - - [64, 1216, 1, 4096]
    - [158, 18862.0]
  - - [704, 1216, 1, 4096]
    - [1, 39620.8]
  - - [704, 1600, 1, 4096]
    - [44, 39945.8]
  - - [1088, 1728, 1, 4096]
    - [38, 40530.2]
  - - [192, 1856, 1, 4096]
    - [165, 30472.2]
  - - [576, 1984, 1, 4096]
    - [147, 34380.0]
  - - [832, 1984, 1, 4096]
    - [4, 39082.2]
  - - [832, 640, 1, 256]
    - [6, 12392.3]
  - - [896, 640, 1, 256]
    - [6, 13345.5]
  - - [960, 640, 1, 256]
    - [6, 14298.8]
  - - [704, 768, 1, 256]
    - [6, 13182.1]
  - - [768, 768, 1, 256]
    - [11, 13726.8]
  - - [832, 768, 1, 256]
    - [6, 14870.7]
  - - [1024, 832, 1, 256]
    - [21, 15578.8]
  - - [576, 896, 1, 256]
    - [6, 12011.0]
  - - [704, 896, 1, 256]
    - [6, 14041.8]
  - - [768, 896, 1, 256]
    - [2, 14680.1]
  - - [832, 896, 1, 256]
    - [21, 15267.3]
  - - [640, 960, 1, 256]
    - [35, 14298.8]
  - - [576, 1024, 1, 256]
    - [6, 13726.8]
  - - [704, 1024, 1, 256]
    - [8, 14196.1]
  - - [768, 1024, 1, 256]
    - [35, 15486.7]
  - - [832, 1024, 1, 256]
    - [8, 16777.2]
  - - [960, 256, 1, 512]
    - [22, 12582.9]
  - - [768, 320, 1, 512]
    - [7, 12582.9]
  - - [896, 320, 1, 512]
    - [10, 14680.1]
  - - [1024, 320, 1, 512]
    - [77, 13981.0]
  - - [832, 384, 1, 512]
    - [6, 16357.8]
  - - [896, 448, 1, 512]
    - [7, 17126.7]
  - - [640, 512, 1, 512]
    - [6, 15978.3]
  - - [768, 512, 1, 512]
    - [7, 17506.7]
  - - [832, 512, 1, 512]
    - [11, 18175.3]
  - - [896, 512, 1, 512]
    - [6, 19573.4]
  - - [960, 512, 1, 512]
    - [3, 20132.7]
  - - [1024, 512, 1, 512]
    - [15, 19884.1]
  - - [640, 576, 1, 512]
    - [10, 17158.5]
  - - [768, 576, 1, 512]
    - [5, 18119.4]
  - - [896, 576, 1, 512]
    - [125, 18223.5]
  - - [768, 640, 1, 512]
    - [3, 20971.5]
  - - [1024, 640, 1, 512]
    - [6, 20971.5]
  - - [704, 768, 1, 512]
    - [6, 19091.3]
  - - [768, 768, 1, 512]
    - [6, 20826.9]
  - - [832, 768, 1, 512]
    - [6, 23368.3]
  - - [896, 768, 1, 512]
    - [127, 22020.1]
  - - [768, 832, 1, 512]
    - [128, 21106.8]
  - - [384, 896, 1, 512]
    - [3, 14680.1]
  - - [384, 960, 1, 512]
    - [9, 16412.5]
  - - [640, 960, 1, 512]
    - [6, 20971.5]
  - - [256, 1024, 1, 512]
    - [6, 13421.8]
  - - [384, 1024, 1, 512]
    - [10, 17506.7]
  - - [448, 1024, 1, 512]
    - [6, 19573.4]
  - - [576, 1024, 1, 512]
    - [6, 20826.9]
  - - [896, 1024, 1, 512]
    - [8, 26097.9]
  - - [448, 384, 1, 1024]
    - [103, 14092.9]
  - - [384, 512, 1, 1024]
    - [24, 16106.1]
  - - [768, 512, 1, 1024]
    - [9, 25165.8]
  - - [384, 576, 1, 1024]
    - [121, 17422.5]
  - - [512, 576, 1, 1024]
    - [10, 21570.7]
  - - [640, 576, 1, 1024]
    - [10, 24354.0]
  - - [768, 576, 1, 1024]
    - [0, 26646.2]
  - - [1024, 640, 1, 1024]
    - [6, 31213.4]
  - - [384, 704, 1, 1024]
    - [9, 19773.1]
  - - [832, 768, 1, 1024]
    - [11, 31157.7]
  - - [1024, 768, 1, 1024]
    - [78, 30973.3]
  - - [896, 832, 1, 1024]
    - [8, 29360.1]
  - - [768, 896, 1, 1024]
    - [2, 29984.8]
  - - [576, 1024, 1, 1024]
    - [6, 29462.4]
  - - [640, 1024, 1, 1024]
    - [6, 31956.6]
  - - [128, 512, 1, 2048]
    - [56, 11184.8]
  - - [128, 640, 1, 2048]
    - [120, 12427.6]
  - - [128, 704, 1, 2048]
    - [117, 13182.1]
  - - [320, 896, 1, 2048]
    - [6, 29360.1]
  - - [64, 1024, 1, 2048]
    - [56, 9942.05]
  - - [576, 128, 1, 4096]
    - [49, 16777.2]
  - - [704, 128, 1, 4096]
    - [98, 17167.4]
  - - [832, 128, 1, 4096]
    - [94, 19387.0]
  - - [256, 320, 1, 4096]
    - [56, 19737.9]
  - - [64, 512, 1, 4096]
    - [100, 9942.05]
  - - [384, 640, 1, 4096]
    - [10, 34711.5]
  - - [640, 704, 1, 4096]
    - [0, 40560.3]
  - - [64, 768, 1, 4096]
    - [49, 13884.6]
  - - [640, 832, 1, 4096]
    - [80, 40389.6]
  - - [384, 896, 1, 4096]
    - [119, 38088.8]
  - - [1024, 896, 1, 4096]
    - [1, 42464.4]
  - - [960, 1024, 1, 4096]
    - [1, 45497.5]
  - - [3072, 320, 1, 3072]
    - [84, 39219.5]
  - - [576, 4096, 1, 64]
    - [159, 13481.7]
  - - [832, 4096, 1, 64]
    - [21, 11789.4]
  - - [1600, 4096, 1, 64]
    - [21, 14218.0]
  - - [1856, 4096, 1, 64]
    - [16, 14970.4]
  - - [3136, 4096, 1, 64]
    - [21, 16441.7]
  - - [832, 4096, 1, 256]
    - [14, 27263.0]
  - - [1344, 4096, 1, 256]
    - [27, 29360.1]
  - - [1600, 4096, 1, 256]
    - [21, 29959.3]
  - - [2112, 4096, 1, 256]
    - [28, 31412.7]
  - - [2368, 4096, 1, 256]
    - [28, 31630.9]
  - - [3136, 4096, 1, 256]
    - [18, 31467.3]
  - - [3904, 4096, 1, 256]
    - [17, 32360.8]
  - - [1856, 4096, 1, 512]
    - [8, 35546.2]
  - - [832, 4096, 1, 1024]
    - [28, 36350.6]
  - - [1088, 4096, 1, 1024]
    - [2, 37100.8]
  - - [4096, 1088, 1, 64]
    - [21, 12136.7]
  - - [4096, 3904, 1, 64]
    - [89, 16915.9]
  - - [4096, 1600, 1, 1024]
    - [34, 37914.6]
  - - [64, 8192, 1, 256]
    - [150, 15252.0]
  - - [128, 512, 1, 8192]
    - [56, 20259.3]
  - - [256, 128, 1, 8192]
    - [136, 14913.1]
  - - [768, 512, 1, 8192]
    - [44, 43826.2]
  - - [768, 8192, 1, 128]
    - [20, 23008.8]
  - - [768, 8192, 1, 1024]
    - [0, 38693.4]
  - - [8192, 128, 1, 128]
    - [8, 10737.4]
  - - [8192, 256, 1, 64]
    - [21, 8947.85]
  - - [8192, 256, 1, 128]
    - [21, 14913.1]
  - - [8192, 1024, 1, 64]
    - [89, 14913.1]
  - - [3904, 1088, 1, 32]
    - [21, 6970.34]
  - - [3648, 1344, 1, 32]
    - [21, 7297.36]
  - - [3904, 1344, 1, 32]
    - [21, 7631.97]
  - - [2624, 1600, 1, 32]
    - [21, 6717.44]
  - - [3136, 1600, 1, 32]
    - [21, 7298.33]
  - - [3904, 1600, 1, 32]
    - [21, 7838.62]
  - - [2624, 1856, 1, 32]
    - [21, 7248.59]
  - - [2880, 1856, 1, 32]
    - [21, 7602.18]
  - - [3136, 1856, 1, 32]
    - [21, 7760.55]
  - - [3392, 1856, 1, 32]
    - [21, 8058.31]
  - - [3648, 1856, 1, 32]
    - [21, 8333.15]
  - - [2368, 2112, 1, 32]
    - [21, 7443.67]
  - - [2624, 2112, 1, 32]
    - [21, 8060.93]
  - - [3648, 2112, 1, 32]
    - [21, 8650.75]
  - - [2880, 2368, 1, 32]
    - [21, 8235.28]
  - - [3648, 2368, 1, 32]
    - [21, 8917.12]
  - - [3904, 2368, 1, 32]
    - [21, 9244.67]
  - - [1600, 2624, 1, 32]
    - [21, 6889.68]
  - - [2368, 2624, 1, 32]
    - [36, 7647.55]
  - - [2624, 2624, 1, 32]
    - [21, 8314.42]
  - - [2880, 2624, 1, 32]
    - [21, 8636.71]
  - - [3136, 2624, 1, 16]
    - [21, 4463.11]
  - - [3136, 2624, 1, 32]
    - [21, 8777.45]
  - - [3904, 2624, 1, 16]
    - [75, 4892.7]
  - - [1600, 2880, 1, 32]
    - [21, 7021.71]
  - - [2624, 2880, 1, 32]
    - [21, 8338.89]
  - - [3136, 2880, 1, 16]
    - [17, 4587.52]
  - - [3392, 2880, 1, 16]
    - [75, 4809.33]
  - - [3648, 2880, 1, 16]
    - [107, 5017.91]
  - - [3648, 2880, 1, 32]
    - [21, 9338.88]
  - - [3904, 2880, 1, 16]
    - [75, 5067.5]
  - - [3904, 2880, 1, 32]
    - [21, 9724.13]
  - - [1600, 3136, 1, 32]
    - [21, 7298.33]
  - - [2624, 3136, 1, 16]
    - [17, 4463.11]
  - - [2624, 3136, 1, 32]
    - [21, 8633.56]
  - - [3136, 3136, 1, 16]
    - [21, 4768.24]
  - - [3648, 3136, 1, 16]
    - [107, 5156.11]
  - - [3648, 3136, 1, 32]
    - [21, 9633.79]
  - - [3904, 3136, 1, 32]
    - [21, 9673.44]
  - - [1856, 3392, 1, 32]
    - [21, 8058.31]
  - - [3136, 3392, 1, 32]
    - [21, 9455.39]
  - - [3392, 3392, 1, 16]
    - [32, 5113.63]
  - - [3648, 3392, 1, 32]
    - [21, 9899.21]
  - - [3904, 3392, 1, 16]
    - [17, 5231.55]
  - - [1088, 3648, 1, 32]
    - [21, 6513.27]
  - - [1856, 3648, 1, 32]
    - [21, 8333.15]
  - - [2624, 3648, 1, 32]
    - [21, 9143.74]
  - - [2880, 3648, 1, 16]
    - [107, 5093.93]
  - - [3136, 3648, 1, 16]
    - [18, 5014.85]
  - - [3136, 3648, 1, 32]
    - [21, 9633.79]
  - - [3648, 3648, 1, 16]
    - [32, 5257.44]
  - - [3648, 3648, 1, 32]
    - [21, 9903.56]
  - - [3904, 3648, 1, 32]
    - [21, 10016.2]
  - - [1344, 3904, 1, 32]
    - [21, 7631.97]
  - - [1600, 3904, 1, 32]
    - [21, 7995.39]
  - - [3136, 3904, 1, 16]
    - [20, 5087.98]
  - - [3136, 3904, 1, 32]
    - [21, 9673.44]
  - - [3648, 3904, 1, 16]
    - [107, 5425.44]
  - - [3904, 3904, 1, 16]
    - [75, 5479.99]
  - - [32, 3904, 1, 2048]
    - [160, 16142.1]
  - - [32, 1984, 1, 2048]
    - [160, 13133.7]
  - - [32, 960, 1, 4096]
    - [136, 9679.16]
  - - [3072, 1792, 1, 32]
    - [21, 7340.03]
  - - [3072, 3840, 1, 16]
    - [107, 5242.88]
  - - [32, 4096, 1, 3072]
    - [160, 18641.4]
  - - [1600, 4096, 1, 32]
    - [21, 8065.97]
  - - [1856, 4096, 1, 32]
    - [21, 8535.78]
  - - [2624, 4096, 1, 32]
    - [21, 9422.82]
  - - [3648, 4096, 1, 16]
    - [75, 5495.98]
  - - [3904, 4096, 1, 16]
    - [75, 5623.13]
  - - [4096, 1088, 1, 32]
    - [89, 6956.41]
  - - [4096, 3136, 1, 32]
    - [89, 9449.24]
  - - [4096, 3904, 1, 32]
    - [89, 10033.4]
  - - [16, 8192, 1, 2048]
    - [145, 9535.9]
  - - [8192, 2048, 1, 32]
    - [21, 9942.05]
  - - [320, 64, 1, 64]
    - [49, 218.453]
  - - [1344, 64, 1, 64]
    - [7, 786.432]
  - - [1600, 64, 1, 64]
    - [9, 936.229]
  - - [1856, 64, 1, 64]
    - [7, 1169.57]
  - - [2624, 64, 1, 64]
    - [67, 1535.41]
  - - [3392, 64, 1, 64]
    - [22, 1984.8]
  - - [320, 320, 1, 64]
    - [7, 1008.25]
  - - [832, 320, 1, 64]
    - [9, 2434.19]
  - - [1856, 320, 1, 64]
    - [86, 4471.87]
  - - [2112, 320, 1, 64]
    - [21, 4805.97]
  - - [3648, 320, 1, 64]
    - [33, 7115.34]
  - - [1600, 576, 1, 64]
    - [21, 5898.24]
  - - [1088, 832, 1, 64]
    - [21, 5517.51]
  - - [64, 2624, 1, 64]
    - [153, 3070.83]
  - - [64, 64, 1, 256]
    - [48, 174.763]
  - - [64, 320, 1, 256]
    - [46, 806.597]
  - - [832, 320, 1, 256]
    - [68, 8018.52]
  - - [1088, 320, 1, 256]
    - [22, 11141.1]
  - - [64, 576, 1, 256]
    - [48, 1451.87]
  - - [64, 832, 1, 256]
    - [117, 1817.53]
  - - [320, 832, 1, 256]
    - [10, 8519.68]
  - - [64, 1600, 1, 256]
    - [158, 6393.76]
  - - [64, 1856, 1, 256]
    - [160, 7240.17]
  - - [64, 2112, 1, 256]
    - [158, 7954.71]
  - - [64, 2368, 1, 256]
    - [158, 9348.75]
  - - [64, 2624, 1, 256]
    - [162, 8347.89]
  - - [64, 3392, 1, 256]
    - [156, 10687.4]
  - - [64, 3648, 1, 256]
    - [156, 11605.6]
  - - [832, 64, 1, 512]
    - [100, 3635.06]
  - - [64, 320, 1, 512]
    - [48, 1613.19]
  - - [320, 576, 1, 512]
    - [25, 11102.6]
  - - [64, 1856, 1, 512]
    - [158, 10669.7]
  - - [64, 2112, 1, 512]
    - [158, 11932.1]
  - - [64, 832, 1, 1024]
    - [49, 6815.74]
  - - [704, 64, 1, 64]
    - [118, 443.628]
  - - [1216, 64, 1, 64]
    - [54, 711.534]
  - - [1472, 64, 1, 64]
    - [10, 861.33]
  - - [64, 192, 1, 64]
    - [40, 120.99]
  - - [960, 192, 1, 64]
    - [7, 1685.21]
  - - [1216, 192, 1, 64]
    - [9, 2134.6]
  - - [1472, 192, 1, 64]
    - [7, 2583.99]
  - - [1728, 192, 1, 64]
    - [68, 2654.21]
  - - [1856, 192, 1, 64]
    - [143, 3040.87]
  - - [192, 320, 1, 64]
    - [7, 604.948]
  - - [960, 320, 1, 64]
    - [10, 2621.44]
  - - [1472, 320, 1, 64]
    - [13, 3768.32]
  - - [1984, 320, 1, 64]
    - [21, 4514.7]
  - - [64, 448, 1, 64]
    - [47, 282.309]
  - - [192, 448, 1, 64]
    - [7, 846.927]
  - - [320, 448, 1, 64]
    - [10, 1310.72]
  - - [704, 448, 1, 64]
    - [7, 2691.35]
  - - [1344, 448, 1, 64]
    - [107, 4533.55]
  - - [1600, 448, 1, 64]
    - [13, 5097.24]
  - - [1728, 448, 1, 64]
    - [13, 5505.02]
  - - [448, 576, 1, 64]
    - [40, 2202.01]
  - - [320, 704, 1, 64]
    - [74, 1922.39]
  - - [1088, 704, 1, 64]
    - [21, 4902.09]
  - - [1472, 704, 1, 64]
    - [21, 6632.24]
  - - [448, 832, 1, 64]
    - [25, 2981.89]
  - - [960, 832, 1, 64]
    - [41, 5380.85]
  - - [320, 960, 1, 64]
    - [9, 2621.44]
  - - [1088, 960, 1, 64]
    - [21, 6366.35]
  - - [192, 1344, 1, 64]
    - [153, 4346.07]
  - - [64, 1472, 1, 64]
    - [164, 1799.79]
  - - [192, 1472, 1, 64]
    - [168, 4637.93]
  - - [192, 1600, 1, 64]
    - [169, 4854.52]
  - - [64, 1728, 1, 64]
    - [146, 2527.82]
  - - [960, 1728, 1, 64]
    - [107, 8166.79]
  - - [448, 1856, 1, 64]
    - [147, 8795.91]
  - - [320, 1984, 1, 64]
    - [151, 7666.48]
  - - [704, 1984, 1, 64]
    - [8, 7449.26]
  - - [192, 64, 1, 256]
    - [48, 483.958]
  - - [704, 192, 1, 256]
    - [9, 4613.73]
  - - [960, 192, 1, 256]
    - [25, 5898.24]
  - - [1344, 192, 1, 256]
    - [7, 8257.54]
  - - [1472, 192, 1, 256]
    - [7, 8511.97]
  - - [64, 448, 1, 256]
    - [48, 1223.34]
  - - [192, 448, 1, 256]
    - [47, 3387.71]
  - - [320, 448, 1, 256]
    - [40, 5646.18]
  - - [704, 448, 1, 256]
    - [7, 10092.5]
  - - [448, 576, 1, 256]
    - [9, 8257.54]
  - - [192, 704, 1, 256]
    - [7, 4613.73]
  - - [320, 704, 1, 256]
    - [9, 7689.56]
  - - [576, 704, 1, 256]
    - [25, 11534.3]
  - - [192, 960, 1, 256]
    - [7, 5898.24]
  - - [448, 960, 1, 256]
    - [11, 11010.0]
  - - [192, 1344, 1, 256]
    - [165, 11692.1]
  - - [192, 1728, 1, 256]
    - [165, 15032.7]
  - - [192, 1856, 1, 256]
    - [165, 14833.5]
  - - [64, 192, 1, 512]
    - [46, 1048.58]
  - - [192, 192, 1, 512]
    - [52, 2516.58]
  - - [320, 192, 1, 512]
    - [100, 4194.3]
  - - [192, 320, 1, 512]
    - [101, 4493.9]
  - - [320, 704, 1, 512]
    - [9, 12815.9]
  - - [192, 960, 1, 512]
    - [25, 10485.8]
  - - [64, 1216, 1, 1024]
    - [158, 12958.0]
  - - [192, 64, 1, 4096]
    - [46, 4575.6]
  - - [448, 64, 1, 4096]
    - [49, 9395.24]
  - - [64, 448, 1, 4096]
    - [49, 9786.71]
  - - [768, 64, 1, 64]
    - [69, 483.958]
  - - [1024, 64, 1, 64]
    - [7, 645.278]
  - - [512, 128, 1, 64]
    - [111, 599.186]
  - - [576, 128, 1, 64]
    - [9, 725.937]
  - - [640, 128, 1, 64]
    - [7, 748.983]
  - - [1024, 128, 1, 64]
    - [7, 1198.37]
  - - [128, 192, 1, 64]
    - [47, 241.979]
  - - [256, 192, 1, 64]
    - [9, 524.288]
  - - [512, 192, 1, 64]
    - [26, 967.916]
  - - [640, 192, 1, 64]
    - [22, 1209.9]
  - - [384, 256, 1, 64]
    - [9, 967.916]
  - - [640, 256, 1, 64]
    - [7, 1497.97]
  - - [768, 256, 1, 64]
    - [27, 1797.56]
  - - [768, 320, 1, 64]
    - [64, 2246.95]
  - - [896, 320, 1, 64]
    - [13, 2446.68]
  - - [256, 384, 1, 64]
    - [9, 967.916]
  - - [512, 384, 1, 64]
    - [9, 1935.83]
  - - [576, 384, 1, 64]
    - [10, 2022.25]
  - - [704, 384, 1, 64]
    - [113, 2306.87]
  - - [768, 384, 1, 64]
    - [6, 2696.34]
  - - [832, 384, 1, 64]
    - [16, 2726.3]
  - - [256, 448, 1, 64]
    - [10, 1129.24]
  - - [1024, 448, 1, 64]
    - [35, 3670.02]
  - - [192, 512, 1, 64]
    - [9, 967.916]
  - - [512, 512, 1, 64]
    - [7, 2396.75]
  - - [576, 512, 1, 64]
    - [6, 2516.58]
  - - [832, 512, 1, 64]
    - [11, 3635.06]
  - - [896, 512, 1, 64]
    - [8, 3914.68]
  - - [256, 576, 1, 64]
    - [10, 1451.87]
  - - [384, 576, 1, 64]
    - [9, 2359.3]
  - - [512, 576, 1, 64]
    - [36, 2696.34]
  - - [1024, 576, 1, 64]
    - [13, 4194.3]
  - - [128, 640, 1, 64]
    - [53, 806.597]
  - - [448, 640, 1, 64]
    - [6, 2621.44]
  - - [512, 704, 1, 64]
    - [35, 3295.52]
  - - [640, 704, 1, 64]
    - [13, 3844.78]
  - - [768, 704, 1, 64]
    - [35, 4325.38]
  - - [192, 768, 1, 64]
    - [7, 1348.17]
  - - [768, 768, 1, 64]
    - [29, 4441.03]
  - - [832, 768, 1, 64]
    - [8, 4811.11]
  - - [896, 768, 1, 64]
    - [23, 4893.35]
  - - [256, 832, 1, 64]
    - [7, 1817.53]
  - - [1024, 832, 1, 64]
    - [21, 5739.57]
  - - [128, 896, 1, 64]
    - [7, 1129.24]
  - - [448, 896, 1, 64]
    - [143, 3425.35]
  - - [256, 960, 1, 64]
    - [13, 2419.79]
  - - [896, 1024, 1, 64]
    - [19, 6181.08]
  - - [256, 64, 1, 256]
    - [48, 645.278]
  - - [640, 64, 1, 256]
    - [136, 1497.97]
  - - [768, 64, 1, 256]
    - [47, 1797.56]
  - - [1024, 64, 1, 256]
    - [47, 2581.11]
  - - [192, 128, 1, 256]
    - [48, 967.916]
  - - [320, 128, 1, 256]
    - [49, 1747.63]
  - - [896, 128, 1, 256]
    - [10, 3914.68]
  - - [960, 128, 1, 256]
    - [7, 4194.3]
  - - [384, 192, 1, 256]
    - [55, 2516.58]
  - - [512, 192, 1, 256]
    - [104, 3355.44]
  - - [768, 192, 1, 256]
    - [7, 5392.68]
  - - [64, 256, 1, 256]
    - [46, 699.051]
  - - [192, 256, 1, 256]
    - [51, 1797.56]
  - - [384, 256, 1, 256]
    - [7, 3595.12]
  - - [704, 256, 1, 256]
    - [9, 5767.17]
  - - [768, 256, 1, 256]
    - [7, 6710.89]
  - - [832, 256, 1, 256]
    - [25, 7270.13]
  - - [1024, 256, 1, 256]
    - [122, 8388.61]
  - - [128, 320, 1, 256]
    - [52, 1497.97]
  - - [384, 320, 1, 256]
    - [7, 3932.16]
  - - [512, 320, 1, 256]
    - [7, 5991.86]
  - - [64, 384, 1, 256]
    - [48, 1048.58]
  - - [384, 384, 1, 256]
    - [9, 5392.68]
  - - [576, 384, 1, 256]
    - [7, 7077.89]
  - - [832, 384, 1, 256]
    - [10, 9622.23]
  - - [896, 384, 1, 256]
    - [24, 10362.4]
  - - [128, 448, 1, 256]
    - [133, 1957.34]
  - - [512, 448, 1, 256]
    - [9, 7340.03]
  - - [640, 448, 1, 256]
    - [114, 8635.33]
  - - [768, 448, 1, 256]
    - [7, 9786.71]
  - - [1024, 448, 1, 256]
    - [35, 12362.2]
  - - [192, 512, 1, 256]
    - [9, 3355.44]
  - - [448, 512, 1, 256]
    - [7, 7340.03]
  - - [896, 512, 1, 256]
    - [11, 12362.2]
  - - [128, 576, 1, 256]
    - [118, 2516.58]
  - - [512, 576, 1, 256]
    - [65, 8882.06]
  - - [640, 576, 1, 256]
    - [119, 10485.8]
  - - [64, 640, 1, 256]
    - [104, 1613.19]
  - - [128, 640, 1, 256]
    - [7, 2995.93]
  - - [448, 640, 1, 256]
    - [110, 8635.33]
  - - [576, 640, 1, 256]
    - [9, 10485.8]
  - - [640, 640, 1, 256]
    - [9, 11650.8]
  - - [128, 704, 1, 256]
    - [10, 3075.82]
  - - [384, 704, 1, 256]
    - [10, 8141.88]
  - - [512, 704, 1, 256]
    - [64, 9713.13]
  - - [640, 704, 1, 256]
    - [13, 12141.4]
  - - [64, 768, 1, 256]
    - [49, 1935.83]
  - - [256, 768, 1, 256]
    - [26, 6291.46]
  - - [320, 768, 1, 256]
    - [9, 8388.61]
  - - [384, 768, 1, 256]
    - [6, 8882.06]
  - - [576, 768, 1, 256]
    - [12, 12582.9]
  - - [384, 832, 1, 256]
    - [9, 9622.23]
  - - [320, 896, 1, 256]
    - [6, 9175.04]
  - - [448, 896, 1, 256]
    - [10, 11417.8]
  - - [256, 960, 1, 256]
    - [10, 8388.61]
  - - [64, 1024, 1, 256]
    - [115, 2396.75]
  - - [128, 1024, 1, 256]
    - [26, 4194.3]
  - - [192, 1024, 1, 256]
    - [7, 5921.37]
  - - [256, 1024, 1, 256]
    - [6, 7895.16]
  - - [320, 1024, 1, 256]
    - [6, 10485.8]
  - - [384, 1024, 1, 256]
    - [10, 11184.8]
  - - [448, 1024, 1, 256]
    - [15, 12362.2]
  - - [384, 128, 1, 512]
    - [49, 3595.12]
  - - [640, 128, 1, 512]
    - [49, 5592.41]
  - - [512, 256, 1, 512]
    - [39, 7895.16]
  - - [640, 320, 1, 512]
    - [9, 11650.8]
  - - [64, 384, 1, 512]
    - [46, 1797.56]
  - - [512, 448, 1, 512]
    - [124, 12362.2]
  - - [64, 512, 1, 512]
    - [48, 2396.75]
  - - [448, 512, 1, 512]
    - [9, 13816.5]
  - - [384, 576, 1, 512]
    - [24, 13323.1]
  - - [64, 640, 1, 512]
    - [120, 2995.93]
  - - [256, 704, 1, 512]
    - [25, 10855.8]
  - - [192, 768, 1, 512]
    - [9, 9437.18]
  - - [64, 1024, 1, 512]
    - [26, 4793.49]
  - - [192, 256, 1, 1024]
    - [100, 5921.37]
  - - [64, 384, 1, 1024]
    - [100, 3355.44]
  - - [256, 448, 1, 1024]
    - [25, 11744.1]
  - - [64, 512, 1, 1024]
    - [49, 4793.49]
  - - [128, 576, 1, 1024]
    - [49, 8882.06]
  - - [64, 768, 1, 1024]
    - [49, 5921.37]
  - - [128, 128, 1, 2048]
    - [46, 4194.3]
  - - [64, 256, 1, 2048]
    - [48, 4194.3]
  - - [128, 256, 1, 2048]
    - [49, 7456.54]
  - - [128, 448, 1, 2048]
    - [100, 10676.4]
  - - [64, 640, 1, 2048]
    - [48, 8830.11]
  - - [8, 2, 1, 2]
    - [141, 0.00492308]
  - - [10, 2, 1, 2]
    - [60, 0.00666667]
  - - [12, 2, 1, 2]
    - [48, 0.00738462]
  - - [2, 4, 1, 2]
    - [52, 0.00246154]
  - - [16, 4, 1, 2]
    - [51, 0.0213333]
  - - [14, 6, 1, 2]
    - [46, 0.028]
  - - [2, 8, 1, 2]
    - [26, 0.00492308]
  - - [14, 8, 1, 2]
    - [48, 0.0373333]
  - - [4, 10, 1, 2]
    - [134, 0.0123077]
  - - [2, 12, 1, 2]
    - [48, 0.008]
  - - [16, 12, 1, 2]
    - [48, 0.0590769]
  - - [2, 16, 1, 2]
    - [7, 0.00984615]
  - - [4, 16, 1, 2]
    - [49, 0.0213333]
  - - [8, 2, 1, 4]
    - [7, 0.0106667]
  - - [8, 4, 1, 4]
    - [48, 0.0213333]
  - - [16, 4, 1, 4]
    - [50, 0.0393846]
  - - [8, 6, 1, 4]
    - [116, 0.0295385]
  - - [4, 8, 1, 4]
    - [46, 0.0213333]
  - - [6, 10, 1, 4]
    - [48, 0.04]
  - - [10, 10, 1, 4]
    - [48, 0.0615385]
  - - [14, 10, 1, 4]
    - [51, 0.0861538]
  - - [6, 12, 1, 4]
    - [72, 0.0411429]
  - - [12, 12, 1, 4]
    - [48, 0.096]
  - - [14, 12, 1, 4]
    - [142, 0.112]
  - - [8, 14, 1, 4]
    - [48, 0.0689231]
  - - [2, 16, 1, 4]
    - [48, 0.0213333]
  - - [8, 16, 1, 4]
    - [48, 0.0787692]
  - - [12, 16, 1, 4]
    - [58, 0.109714]
  - - [16, 2, 1, 6]
    - [50, 0.0295385]
  - - [6, 4, 1, 6]
    - [53, 0.0221538]
  - - [4, 6, 1, 6]
    - [48, 0.024]
  - - [10, 6, 1, 6]
    - [46, 0.0654545]
  - - [2, 8, 1, 6]
    - [7, 0.0147692]
  - - [4, 12, 1, 6]
    - [48, 0.0443077]
  - - [10, 12, 1, 6]
    - [48, 0.110769]
  - - [14, 16, 1, 6]
    - [48, 0.224]
  - - [4, 2, 1, 8]
    - [46, 0.00914286]
  - - [2, 4, 1, 8]
    - [48, 0.00984615]
  - - [14, 4, 1, 8]
    - [48, 0.0689231]
  - - [2, 6, 1, 8]
    - [48, 0.016]
  - - [6, 6, 1, 8]
    - [51, 0.0443077]
  - - [2, 8, 1, 8]
    - [47, 0.0196923]
  - - [6, 8, 1, 8]
    - [130, 0.0590769]
  - - [4, 12, 1, 8]
    - [7, 0.0590769]
  - - [10, 12, 1, 8]
    - [57, 0.16]
  - - [12, 14, 1, 8]
    - [141, 0.224]
  - - [2, 2, 1, 10]
    - [7, 0.00615385]
  - - [10, 2, 1, 10]
    - [9, 0.0307692]
  - - [12, 2, 1, 10]
    - [48, 0.0369231]
  - - [8, 4, 1, 10]
    - [48, 0.0533333]
  - - [2, 6, 1, 10]
    - [48, 0.02]
  - - [4, 8, 1, 10]
    - [48, 0.0533333]
  - - [2, 10, 1, 10]
    - [48, 0.0333333]
  - - [14, 14, 1, 10]
    - [47, 0.326667]
  - - [8, 16, 1, 10]
    - [47, 0.196923]
  - - [10, 16, 1, 10]
    - [48, 0.246154]
  - - [10, 2, 1, 12]
    - [131, 0.0369231]
  - - [12, 2, 1, 12]
    - [10, 0.048]
  - - [2, 6, 1, 12]
    - [7, 0.0221538]
  - - [14, 6, 1, 12]
    - [50, 0.168]
  - - [16, 6, 1, 12]
    - [48, 0.177231]
  - - [4, 10, 1, 12]
    - [48, 0.08]
  - - [12, 12, 1, 12]
    - [48, 0.265846]
  - - [12, 16, 1, 12]
    - [9, 0.354462]
  - - [16, 2, 1, 14]
    - [25, 0.0689231]
  - - [2, 4, 1, 14]
    - [9, 0.0172308]
  - - [14, 4, 1, 14]
    - [47, 0.120615]
  - - [14, 6, 1, 14]
    - [46, 0.196]
  - - [2, 8, 1, 14]
    - [39, 0.0344615]
  - - [14, 8, 1, 14]
    - [48, 0.241231]
  - - [12, 12, 1, 14]
    - [134, 0.336]
  - - [16, 12, 1, 14]
    - [116, 0.413538]
  - - [8, 4, 1, 16]
    - [140, 0.0787692]
  - - [12, 4, 1, 16]
    - [47, 0.128]
  - - [4, 6, 1, 16]
    - [49, 0.064]
  - - [2, 8, 1, 16]
    - [7, 0.0393846]
  - - [14, 8, 1, 16]
    - [48, 0.275692]
  - - [6, 10, 1, 16]
    - [46, 0.147692]
  - - [2, 12, 1, 16]
    - [49, 0.064]
  - - [4, 12, 1, 16]
    - [47, 0.118154]
  - - [14, 14, 1, 16]
    - [48, 0.522667]
  - - [6, 4, 1, 1024]
    - [46, 3.78092]
  - - [14, 4, 1, 1024]
    - [136, 7.64587]
  - - [12, 6, 1, 1024]
    - [46, 9.8304]
  - - [16, 6, 1, 1024]
    - [46, 14.0434]
  - - [16, 8, 1, 1024]
    - [46, 18.7246]
  - - [2, 16, 1, 1024]
    - [134, 4.36907]
  - - [10, 16, 1, 1024]
    - [46, 23.4057]
  - - [2, 10, 1, 4096]
    - [57, 7.8019]
  - - [14, 12, 1, 4096]
    - [57, 65.536]
  - - [4096, 64, 1, 64]
    - [22, 2396.75]
  - - [64, 64, 1, 8192]
    - [57, 2314.1]
  - - [16, 1, 1, 64]
    - [49, 0.170667]
  - - [32, 1, 1, 64]
    - [48, 0.315077]
  - - [1, 16, 1, 64]
    - [47, 0.157538]
  - - [32, 16, 1, 64]
    - [48, 5.04123]
  - - [64, 32, 1, 16]
    - [49, 5.04123]
  - - [32, 1, 1, 16]
    - [49, 0.0853333]
  - - [32, 1, 1, 32]
    - [48, 0.157538]
  - - [1, 16, 1, 1]
    - [48, 0.00266667]
  - - [16, 32, 1, 1]
    - [133, 0.0853333]
  - - [32, 32, 1, 1]
    - [51, 0.157538]
  - - [32, 32, 1, 16]
    - [48, 2.73067]
  - - [32, 64, 1, 64]
    - [141, 20.1649]
  - - [16, 64, 1, 32]
    - [9, 5.04123]
  - - [64, 64, 1, 16]
    - [46, 10.9227]
  - - [256, 32, 1, 256]
    - [46, 381.3]
  - - [1, 1, 1, 256]
    - [48, 0.0393846]
  - - [32, 1, 1, 256]
    - [48, 1.26031]
  - - [32, 16, 1, 256]
    - [46, 21.8453]
  - - [256, 16, 1, 1]
    - [48, 0.682667]
  - - [256, 16, 1, 16]
    - [48, 10.0825]
  - - [32, 32, 1, 256]
    - [48, 43.6907]
  - - [1, 256, 1, 32]
    - [46, 1.26031]
  - - [256, 256, 1, 1]
    - [54, 10.9227]
  - - [256, 256, 1, 16]
    - [7, 161.319]
  - - [16, 16, 1, 512]
    - [48, 20.1649]
  - - [1, 32, 1, 512]
    - [46, 2.52062]
  - - [512, 32, 1, 32]
    - [51, 95.3251]
  - - [32, 512, 1, 512]
    - [49, 1290.56]
  - - [1, 512, 1, 16]
    - [48, 1.26031]
  - - [16, 512, 1, 1]
    - [50, 1.26031]
  - - [32, 512, 1, 1]
    - [52, 2.52062]
  - - [1024, 1, 1, 16]
    - [51, 2.52062]
  - - [1, 32, 1, 1024]
    - [46, 4.36907]
  - - [1, 1024, 1, 1024]
    - [46, 149.797]
  - - [1024, 1024, 1, 1]
    - [17, 110.376]
  - - [1, 32, 1, 2048]
    - [136, 8.192]
  - - [1, 2048, 1, 16]
    - [170, 13.3747]
  - - [16, 2048, 1, 16]
    - [170, 227.951]
  - - [16, 2048, 1, 32]
    - [170, 476.625]
  - - [16, 3072, 1, 1]
    - [170, 19.6608]
  - - [16, 3072, 1, 16]
    - [170, 291.271]
  - - [16, 3072, 1, 32]
    - [170, 655.36]
  - - [32, 3072, 1, 1]
    - [156, 33.8979]
  - - [32, 3072, 1, 32]
    - [146, 1187.07]
  - - [3072, 3072, 1, 1]
    - [18, 304.425]
  - - [1, 1, 1, 4096]
    - [48, 0.390095]
  - - [4096, 32, 1, 16]
    - [103, 299.593]
  - - [32, 4096, 1, 1]
    - [160, 47.6625]
  - - [32, 4096, 1, 32]
    - [162, 1471.69]
  - - [320, 32, 1, 1]
    - [9, 1.57538]
  - - [320, 32, 1, 16]
    - [47, 25.2062]
  - - [320, 32, 1, 32]
    - [9, 54.6133]
  - - [320, 64, 1, 1]
    - [7, 3.15077]
  - - [576, 1, 1, 1]
    - [49, 0.096]
  - - [576, 16, 1, 1]
    - [47, 1.536]
  - - [832, 16, 1, 64]
    - [47, 141.995]
  - - [832, 32, 1, 64]
    - [51, 283.989]
  - - [832, 16, 1, 16]
    - [51, 32.768]
  - - [832, 64, 1, 16]
    - [25, 141.995]
  - - [1088, 16, 1, 64]
    - [47, 171.402]
  - - [1088, 64, 1, 16]
    - [7, 171.402]
  - - [1344, 1, 1, 16]
    - [48, 3.072]
  - - [1344, 64, 1, 1]
    - [7, 13.2332]
  - - [1344, 64, 1, 16]
    - [10, 211.732]
  - - [1344, 64, 1, 32]
    - [7, 423.463]
  - - [1600, 64, 1, 16]
    - [9, 273.067]
  - - [1856, 1, 1, 32]
    - [141, 9.13723]
  - - [1856, 16, 1, 1]
    - [48, 5.39927]
  - - [1856, 32, 1, 1]
    - [54, 9.13723]
  - - [2112, 1, 1, 16]
    - [51, 4.82743]
  - - [2112, 64, 1, 16]
    - [22, 308.955]
  - - [2112, 64, 1, 32]
    - [7, 665.442]
  - - [2368, 16, 1, 64]
    - [49, 373.051]
  - - [2368, 1, 1, 1]
    - [48, 0.394667]
  - - [2368, 64, 1, 1]
    - [7, 25.2587]
  - - [2368, 64, 1, 32]
    - [10, 746.102]
  - - [2624, 1, 1, 64]
    - [49, 23.9909]
  - - [2624, 32, 1, 1]
    - [51, 11.1957]
  - - [2624, 64, 1, 1]
    - [7, 25.8363]
  - - [2880, 16, 1, 32]
    - [47, 245.76]
  - - [2880, 32, 1, 16]
    - [9, 196.608]
  - - [2880, 64, 1, 1]
    - [7, 26.3314]
  - - [2880, 64, 1, 16]
    - [68, 421.303]
  - - [2880, 64, 1, 32]
    - [93, 907.422]
  - - [3136, 1, 1, 64]
    - [47, 33.4507]
  - - [3136, 16, 1, 16]
    - [51, 114.688]
  - - [3392, 16, 1, 64]
    - [141, 496.201]
  - - [3392, 1, 1, 32]
    - [47, 16.6991]
  - - [3392, 32, 1, 16]
    - [59, 267.185]
  - - [3392, 64, 1, 1]
    - [9, 31.0126]
  - - [3392, 64, 1, 16]
    - [7, 496.201]
  - - [3392, 64, 1, 32]
    - [10, 1157.8]
  - - [3648, 32, 1, 64]
    - [51, 1067.3]
  - - [3648, 16, 1, 16]
    - [47, 133.413]
  - - [3648, 64, 1, 1]
    - [9, 33.3531]
  - - [3648, 64, 1, 16]
    - [9, 533.65]
  - - [3648, 64, 1, 32]
    - [7, 1067.3]
  - - [3904, 32, 1, 64]
    - [47, 1142.2]
  - - [3904, 64, 1, 32]
    - [7, 1142.2]
  - - [16, 320, 1, 16]
    - [47, 13.6533]
  - - [32, 320, 1, 32]
    - [48, 54.6133]
  - - [64, 320, 1, 1]
    - [48, 3.15077]
  - - [64, 320, 1, 32]
    - [51, 109.227]
  - - [320, 320, 1, 1]
    - [7, 14.6286]
  - - [576, 320, 1, 1]
    - [9, 28.3569]
  - - [576, 320, 1, 16]
    - [9, 421.303]
  - - [832, 320, 1, 32]
    - [9, 1310.72]
  - - [1088, 320, 1, 1]
    - [7, 49.7371]
  - - [1088, 320, 1, 32]
    - [26, 1591.59]
  - - [1344, 320, 1, 32]
    - [9, 1835.01]
  - - [1856, 320, 1, 1]
    - [12, 74.24]
  - - [1856, 320, 1, 16]
    - [71, 1187.84]
  - - [2112, 320, 1, 32]
    - [21, 2544.34]
  - - [2880, 320, 1, 32]
    - [21, 3276.8]
  - - [3136, 320, 1, 1]
    - [21, 100.352]
  - - [3136, 320, 1, 16]
    - [33, 1784.04]
  - - [3392, 320, 1, 1]
    - [21, 114.257]
  - - [3648, 320, 1, 16]
    - [107, 1778.83]
  - - [3648, 320, 1, 32]
    - [107, 3557.67]
  - - [16, 576, 1, 1]
    - [48, 1.41785]
  - - [832, 576, 1, 1]
    - [83, 59.904]
  - - [1088, 576, 1, 32]
    - [21, 2506.75]
  - - [1344, 576, 1, 32]
    - [13, 2752.51]
  - - [2112, 576, 1, 1]
    - [107, 121.651]
  - - [2112, 576, 1, 16]
    - [33, 1853.73]
  - - [3392, 576, 1, 32]
    - [21, 4809.33]
  - - [3648, 576, 1, 16]
    - [21, 2923.48]
  - - [1, 832, 1, 1]
    - [10, 0.128]
  - - [1, 832, 1, 32]
    - [144, 4.096]
  - - [64, 832, 1, 1]
    - [26, 8.192]
  - - [320, 832, 1, 16]
    - [7, 567.979]
  - - [2368, 832, 1, 16]
    - [21, 2626.9]
  - - [2624, 832, 1, 1]
    - [21, 174.653]
  - - [2624, 832, 1, 16]
    - [21, 2910.89]
  - - [2624, 832, 1, 32]
    - [21, 5373.95]
  - - [2880, 832, 1, 16]
    - [41, 2738.47]
  - - [3136, 832, 1, 16]
    - [35, 2981.89]
  - - [3136, 832, 1, 32]
    - [21, 5566.19]
  - - [3392, 832, 1, 16]
    - [75, 3010.29]
  - - [1, 1088, 1, 1]
    - [48, 0.181333]
  - - [64, 1088, 1, 1]
    - [105, 10.7126]
  - - [832, 1088, 1, 1]
    - [15, 100.58]
  - - [832, 1088, 1, 32]
    - [21, 3049.15]
  - - [1088, 1088, 1, 1]
    - [8, 118.374]
  - - [1600, 1088, 1, 16]
    - [21, 2321.07]
  - - [1856, 1088, 1, 1]
    - [21, 161.546]
  - - [2368, 1088, 1, 32]
    - [21, 5685.81]
  - - [2624, 1088, 1, 16]
    - [17, 3045.24]
  - - [2880, 1088, 1, 16]
    - [21, 3342.34]
  - - [3136, 1088, 1, 1]
    - [21, 220.127]
  - - [3136, 1088, 1, 16]
    - [21, 3522.03]
  - - [3392, 1088, 1, 16]
    - [21, 3280.44]
  - - [3648, 1088, 1, 1]
    - [21, 226.801]
  - - [3904, 1088, 1, 1]
    - [21, 242.717]
  - - [16, 1344, 1, 1]
    - [170, 8.6016]
  - - [16, 1344, 1, 32]
    - [170, 312.785]
  - - [64, 1344, 1, 1]
    - [153, 31.8578]
  - - [64, 1344, 1, 32]
    - [168, 1019.45]
  - - [320, 1344, 1, 1]
    - [167, 121.149]
  - - [320, 1344, 1, 32]
    - [154, 3822.93]
  - - [832, 1344, 1, 1]
    - [21, 117.706]
  - - [832, 1344, 1, 16]
    - [21, 1883.3]
  - - [1856, 1344, 1, 32]
    - [21, 5505.02]
  - - [2368, 1344, 1, 32]
    - [21, 6365.18]
  - - [2624, 1344, 1, 32]
    - [21, 6839.58]
  - - [2880, 1344, 1, 1]
    - [36, 227.689]
  - - [2880, 1344, 1, 16]
    - [21, 3440.64]
  - - [2880, 1344, 1, 32]
    - [21, 6695.3]
  - - [3904, 1344, 1, 1]
    - [21, 255.95]
  - - [16, 1600, 1, 32]
    - [174, 321.255]
  - - [32, 1600, 1, 1]
    - [177, 21.3333]
  - - [64, 1600, 1, 1]
    - [168, 37.2364]
  - - [320, 1600, 1, 1]
    - [151, 138.378]
  - - [320, 1600, 1, 16]
    - [151, 2214.05]
  - - [1856, 1600, 1, 1]
    - [33, 204.8]
  - - [2368, 1600, 1, 16]
    - [33, 3464.05]
  - - [2368, 1600, 1, 32]
    - [21, 6735.64]
  - - [2624, 1600, 1, 16]
    - [21, 3631.05]
  - - [2880, 1600, 1, 1]
    - [33, 242.526]
  - - [2880, 1600, 1, 16]
    - [33, 3880.42]
  - - [3136, 1600, 1, 16]
    - [75, 3822.93]
  - - [3904, 1600, 1, 16]
    - [35, 4252.87]
  - - [32, 1856, 1, 1]
    - [177, 24.2416]
  - - [1344, 1856, 1, 32]
    - [21, 5505.02]
  - - [1600, 1856, 1, 1]
    - [17, 197.973]
  - - [1600, 1856, 1, 32]
    - [19, 6130.79]
  - - [1856, 1856, 1, 1]
    - [21, 215.296]
  - - [1856, 1856, 1, 16]
    - [75, 3444.74]
  - - [2368, 1856, 1, 1]
    - [35, 237.568]
  - - [2368, 1856, 1, 16]
    - [21, 3801.09]
  - - [2624, 1856, 1, 16]
    - [19, 3801.09]
  - - [2880, 1856, 1, 1]
    - [21, 254.537]
  - - [2880, 1856, 1, 16]
    - [21, 4072.59]
  - - [3136, 1856, 1, 1]
    - [19, 258.685]
  - - [3136, 1856, 1, 16]
    - [17, 4048.99]
  - - [3392, 1856, 1, 16]
    - [21, 4286.33]
  - - [3648, 1856, 1, 1]
    - [21, 276.355]
  - - [3648, 1856, 1, 16]
    - [21, 4421.67]
  - - [3904, 1856, 1, 1]
    - [15, 278.686]
  - - [3904, 1856, 1, 16]
    - [17, 4374.84]
  - - [32, 2112, 1, 64]
    - [164, 1544.78]
  - - [1, 2112, 1, 32]
    - [179, 25.5034]
  - - [1600, 2112, 1, 32]
    - [21, 6758.4]
  - - [2112, 2112, 1, 1]
    - [21, 241.11]
  - - [2368, 2112, 1, 1]
    - [21, 250.061]
  - - [2368, 2112, 1, 16]
    - [21, 3903.39]
  - - [2624, 2112, 1, 1]
    - [21, 257.762]
  - - [2624, 2112, 1, 16]
    - [21, 4222.39]
  - - [2880, 2112, 1, 1]
    - [17, 264.459]
  - - [3392, 2112, 1, 16]
    - [32, 4245.28]
  - - [3648, 2112, 1, 1]
    - [21, 285.355]
  - - [32, 2368, 1, 64]
    - [156, 1763.51]
  - - [64, 2368, 1, 32]
    - [168, 1672.3]
  - - [320, 2368, 1, 16]
    - [151, 2787.16]
  - - [1344, 2368, 1, 1]
    - [21, 212.173]
  - - [1344, 2368, 1, 16]
    - [21, 3511.83]
  - - [1600, 2368, 1, 1]
    - [21, 222.871]
  - - [1600, 2368, 1, 16]
    - [16, 3464.05]
  - - [1600, 2368, 1, 32]
    - [21, 6928.09]
  - - [1856, 2368, 1, 16]
    - [21, 3906.67]
  - - [2112, 2368, 1, 1]
    - [21, 250.061]
  - - [2624, 2368, 1, 1]
    - [17, 270.158]
  - - [2624, 2368, 1, 16]
    - [19, 4230.56]
  - - [3136, 2368, 1, 1]
    - [16, 280.228]
  - - [1, 2624, 1, 64]
    - [145, 63.3721]
  - - [16, 2624, 1, 32]
    - [170, 559.787]
  - - [32, 2624, 1, 1]
    - [156, 28.9545]
  - - [32, 2624, 1, 16]
    - [162, 479.817]
  - - [1088, 2624, 1, 16]
    - [16, 3045.24]
  - - [1344, 2624, 1, 16]
    - [21, 3419.79]
  - - [1600, 2624, 1, 1]
    - [21, 233.244]
  - - [1600, 2624, 1, 16]
    - [16, 3631.05]
  - - [1856, 2624, 1, 16]
    - [75, 3801.09]
  - - [2368, 2624, 1, 1]
    - [21, 270.158]
  - - [2624, 2624, 1, 1]
    - [21, 275.415]
  - - [2624, 2624, 1, 16]
    - [21, 4320.24]
  - - [3904, 2624, 1, 1]
    - [21, 310.427]
  - - [32, 2880, 1, 64]
    - [146, 2069.56]
  - - [1, 2880, 1, 32]
    - [170, 36.864]
  - - [32, 2880, 1, 1]
    - [146, 34.7774]
  - - [32, 2880, 1, 16]
    - [156, 517.389]
  - - [32, 2880, 1, 32]
    - [180, 1053.26]
  - - [64, 2880, 1, 16]
    - [168, 999.702]
  - - [576, 2880, 1, 1]
    - [150, 212.677]
  - - [576, 2880, 1, 16]
    - [150, 3338.63]
  - - [832, 2880, 1, 32]
    - [21, 5476.94]
  - - [1088, 2880, 1, 16]
    - [21, 3234.52]
  - - [1600, 2880, 1, 1]
    - [33, 236.308]
  - - [1856, 2880, 1, 1]
    - [21, 254.537]
  - - [1856, 2880, 1, 16]
    - [21, 4072.59]
  - - [3136, 2880, 1, 1]
    - [21, 301.056]
  - - [3648, 2880, 1, 1]
    - [17, 309.007]
  - - [16, 3136, 1, 64]
    - [173, 1211.8]
  - - [32, 3136, 1, 64]
    - [180, 2253.52]
  - - [64, 3136, 1, 1]
    - [168, 61.7551]
  - - [64, 3136, 1, 32]
    - [180, 2071.78]
  - - [320, 3136, 1, 1]
    - [151, 206.911]
  - - [1344, 3136, 1, 1]
    - [21, 234.155]
  - - [1600, 3136, 1, 1]
    - [21, 244.761]
  - - [1856, 3136, 1, 1]
    - [21, 258.685]
  - - [3136, 3136, 1, 1]
    - [21, 302.6]
  - - [3904, 3136, 1, 1]
    - [20, 322.183]
  - - [1, 3392, 1, 64]
    - [179, 78.9411]
  - - [1, 3392, 1, 16]
    - [170, 21.2831]
  - - [32, 3392, 1, 1]
    - [149, 38.7657]
  - - [32, 3392, 1, 16]
    - [155, 609.37]
  - - [32, 3392, 1, 32]
    - [146, 1197.73]
  - - [64, 3392, 1, 16]
    - [168, 1052.55]
  - - [64, 3392, 1, 32]
    - [168, 2073.68]
  - - [320, 3392, 1, 16]
    - [147, 3020.35]
  - - [1088, 3392, 1, 1]
    - [16, 210.885]
  - - [1088, 3392, 1, 32]
    - [21, 6946.82]
  - - [1344, 3392, 1, 1]
    - [21, 253.269]
  - - [1344, 3392, 1, 16]
    - [21, 3839.03]
  - - [1600, 3392, 1, 1]
    - [21, 258.438]
  - - [1856, 3392, 1, 1]
    - [21, 267.896]
  - - [2624, 3392, 1, 1]
    - [21, 291.823]
  - - [3648, 3392, 1, 1]
    - [107, 321.403]
  - - [3904, 3392, 1, 1]
    - [19, 331.059]
  - - [16, 3648, 1, 1]
    - [170, 21.2247]
  - - [32, 3648, 1, 16]
    - [162, 679.191]
  - - [32, 3648, 1, 32]
    - [162, 1409.64]
  - - [576, 3648, 1, 1]
    - [147, 240.143]
  - - [832, 3648, 1, 16]
    - [75, 3349.12]
  - - [1600, 3648, 1, 1]
    - [21, 265.309]
  - - [1600, 3648, 1, 16]
    - [21, 4150.61]
  - - [2624, 3648, 1, 1]
    - [32, 303.884]
  - - [1, 3904, 1, 16]
    - [172, 21.1742]
  - - [16, 3904, 1, 1]
    - [170, 22.7142]
  - - [16, 3904, 1, 32]
    - [170, 768.788]
  - - [32, 3904, 1, 32]
    - [149, 1378.52]
  - - [64, 3904, 1, 16]
    - [178, 1175.79]
  - - [64, 3904, 1, 32]
    - [168, 2386.68]
  - - [1088, 3904, 1, 1]
    - [21, 235.975]
  - - [1088, 3904, 1, 16]
    - [21, 3775.6]
  - - [1344, 3904, 1, 1]
    - [32, 249.856]
  - - [1344, 3904, 1, 16]
    - [21, 3997.7]
  - - [1600, 3904, 1, 16]
    - [21, 4252.87]
  - - [2624, 3904, 1, 1]
    - [17, 305.794]
  - - [3648, 3904, 1, 1]
    - [33, 331.204]
  - - [16, 64, 1, 256]
    - [48, 40.3298]
  - - [32, 64, 1, 256]
    - [48, 80.6597]
  - - [2112, 1, 1, 256]
    - [48, 72.0896]
  - - [16, 320, 1, 256]
    - [48, 218.453]
  - - [32, 320, 1, 256]
    - [48, 374.491]
  - - [1, 576, 1, 256]
    - [48, 24.576]
  - - [16, 576, 1, 256]
    - [48, 337.042]
  - - [16, 832, 1, 256]
    - [46, 567.979]
  - - [32, 832, 1, 256]
    - [48, 1048.58]
  - - [16, 1088, 1, 256]
    - [48, 636.635]
  - - [16, 1600, 1, 256]
    - [145, 2184.53]
  - - [16, 1856, 1, 256]
    - [145, 2534.06]
  - - [16, 2112, 1, 256]
    - [145, 2790.57]
  - - [1, 2368, 1, 256]
    - [171, 170.763]
  - - [1, 2880, 1, 256]
    - [145, 196.608]
  - - [32, 2880, 1, 256]
    - [152, 5972.9]
  - - [16, 3648, 1, 256]
    - [173, 3932.16]
  - - [32, 3648, 1, 256]
    - [146, 7378.87]
  - - [1, 64, 1, 512]
    - [46, 5.04123]
  - - [16, 64, 1, 512]
    - [136, 74.8983]
  - - [32, 64, 1, 512]
    - [46, 161.319]
  - - [16, 320, 1, 512]
    - [123, 403.298]
  - - [16, 576, 1, 512]
    - [134, 674.085]
  - - [32, 576, 1, 512]
    - [46, 1451.87]
  - - [1, 832, 1, 512]
    - [48, 60.8549]
  - - [1, 1088, 1, 512]
    - [134, 79.5794]
  - - [1, 1600, 1, 512]
    - [145, 218.453]
  - - [1, 1856, 1, 512]
    - [173, 215.971]
  - - [16, 2112, 1, 512]
    - [145, 4613.73]
  - - [32, 2112, 1, 512]
    - [160, 7441.51]
  - - [16, 2368, 1, 512]
    - [145, 4789.79]
  - - [32, 3136, 1, 512]
    - [152, 8858.66]
  - - [16, 3648, 1, 512]
    - [173, 5433.53]
  - - [32, 3648, 1, 512]
    - [146, 10485.8]
  - - [1, 64, 1, 1024]
    - [48, 9.36229]
  - - [16, 64, 1, 1024]
    - [46, 149.797]
  - - [1, 320, 1, 1024]
    - [46, 50.4123]
  - - [32, 832, 1, 1024]
    - [48, 3635.06]
  - - [1, 1088, 1, 1024]
    - [46, 159.159]
  - - [16, 1088, 1, 1024]
    - [46, 2376.77]
  - - [16, 1344, 1, 1024]
    - [145, 4786.98]
  - - [32, 1600, 1, 1024]
    - [164, 8665.92]
  - - [1, 1856, 1, 1024]
    - [145, 351.953]
  - - [32, 2112, 1, 1024]
    - [160, 10729.6]
  - - [16, 3648, 1, 1024]
    - [173, 7288.88]
  - - [16, 3904, 1, 1024]
    - [160, 7028.92]
  - - [1, 320, 1, 2048]
    - [46, 81.92]
  - - [32, 320, 1, 2048]
    - [46, 2621.44]
  - - [1, 1600, 1, 2048]
    - [145, 436.907]
  - - [1, 1856, 1, 2048]
    - [145, 506.812]
  - - [1, 320, 1, 4096]
    - [46, 131.072]
  - - [16, 576, 1, 4096]
    - [136, 3595.12]
  - - [1, 832, 1, 4096]
    - [46, 309.807]
  - - [32, 832, 1, 4096]
    - [48, 9087.66]
  - - [16, 1088, 1, 4096]
    - [66, 5484.86]
  - - [16, 1344, 1, 4096]
    - [145, 7219.7]
  - - [448, 16, 1, 16]
    - [48, 20.8524]
  - - [448, 32, 1, 32]
    - [47, 70.5772]
  - - [448, 64, 1, 16]
    - [48, 70.5772]
  - - [704, 1, 1, 32]
    - [48, 3.75467]
  - - [960, 1, 1, 16]
    - [48, 2.36308]
  - - [960, 16, 1, 32]
    - [47, 75.6185]
  - - [960, 32, 1, 32]
    - [51, 151.237]
  - - [960, 64, 1, 1]
    - [26, 9.45231]
  - - [1472, 16, 1, 64]
    - [48, 231.897]
  - - [1472, 16, 1, 16]
    - [48, 57.9742]
  - - [1472, 32, 1, 1]
    - [104, 7.24677]
  - - [1472, 64, 1, 16]
    - [7, 251.221]
  - - [1472, 64, 1, 32]
    - [7, 463.793]
  - - [1728, 64, 1, 1]
    - [7, 15.7989]
  - - [1728, 64, 1, 16]
    - [42, 252.782]
  - - [1728, 64, 1, 32]
    - [7, 589.824]
  - - [1984, 1, 1, 64]
    - [132, 19.5348]
  - - [1984, 16, 1, 32]
    - [51, 156.278]
  - - [1984, 64, 1, 1]
    - [7, 19.5348]
  - - [1984, 64, 1, 16]
    - [9, 338.603]
  - - [32, 192, 1, 64]
    - [47, 60.4948]
  - - [1, 192, 1, 1]
    - [49, 0.0295385]
  - - [1, 192, 1, 16]
    - [47, 0.512]
  - - [16, 192, 1, 32]
    - [48, 15.1237]
  - - [32, 192, 1, 1]
    - [48, 1.024]
  - - [64, 192, 1, 16]
    - [52, 32.768]
  - - [448, 192, 1, 16]
    - [7, 211.732]
  - - [576, 192, 1, 16]
    - [9, 252.782]
  - - [832, 192, 1, 32]
    - [10, 851.968]
  - - [960, 192, 1, 1]
    - [10, 28.3569]
  - - [960, 192, 1, 16]
    - [7, 421.303]
  - - [1088, 192, 1, 16]
    - [10, 557.056]
  - - [1088, 192, 1, 32]
    - [10, 954.953]
  - - [1216, 192, 1, 16]
    - [10, 533.65]
  - - [1216, 192, 1, 32]
    - [9, 1149.4]
  - - [1472, 192, 1, 1]
    - [76, 37.6832]
  - - [1600, 192, 1, 32]
    - [7, 1310.72]
  - - [1728, 192, 1, 32]
    - [7, 1415.58]
  - - [1856, 192, 1, 16]
    - [7, 814.519]
  - - [1856, 192, 1, 32]
    - [7, 1520.44]
  - - [1984, 192, 1, 16]
    - [39, 812.646]
  - - [1984, 192, 1, 32]
    - [9, 1741.39]
  - - [448, 320, 1, 1]
    - [10, 22.0554]
  - - [448, 320, 1, 16]
    - [7, 352.886]
  - - [448, 320, 1, 32]
    - [9, 764.587]
  - - [704, 320, 1, 1]
    - [9, 34.6585]
  - - [704, 320, 1, 16]
    - [6, 480.597]
  - - [704, 320, 1, 32]
    - [10, 1029.85]
  - - [960, 320, 1, 32]
    - [7, 1404.34]
  - - [1216, 320, 1, 1]
    - [7, 48.64]
  - - [1728, 320, 1, 16]
    - [86, 1040.87]
  - - [1984, 320, 1, 16]
    - [12, 1195.07]
  - - [32, 448, 1, 64]
    - [49, 141.154]
  - - [1, 448, 1, 32]
    - [47, 2.20554]
  - - [16, 448, 1, 1]
    - [46, 1.19467]
  - - [320, 448, 1, 32]
    - [7, 764.587]
  - - [448, 448, 1, 1]
    - [7, 28.672]
  - - [448, 448, 1, 32]
    - [9, 1070.42]
  - - [576, 448, 1, 16]
    - [7, 635.195]
  - - [576, 448, 1, 32]
    - [7, 1101.0]
  - - [704, 448, 1, 1]
    - [9, 48.5218]
  - - [832, 448, 1, 32]
    - [22, 1703.94]
  - - [960, 448, 1, 1]
    - [6, 53.76]
  - - [960, 448, 1, 32]
    - [74, 1720.32]
  - - [1088, 448, 1, 1]
    - [12, 57.344]
  - - [1216, 448, 1, 1]
    - [37, 68.096]
  - - [1600, 448, 1, 16]
    - [27, 1349.27]
  - - [1728, 448, 1, 1]
    - [21, 86.016]
  - - [1728, 448, 1, 32]
    - [13, 2914.42]
  - - [1856, 448, 1, 16]
    - [21, 1400.4]
  - - [1856, 448, 1, 32]
    - [21, 2956.4]
  - - [1984, 448, 1, 16]
    - [21, 1580.15]
  - - [704, 576, 1, 16]
    - [64, 865.075]
  - - [704, 576, 1, 32]
    - [26, 1853.73]
  - - [1216, 576, 1, 32]
    - [13, 2801.66]
  - - [1472, 576, 1, 32]
    - [21, 3191.99]
  - - [1728, 576, 1, 1]
    - [21, 110.592]
  - - [1728, 576, 1, 16]
    - [21, 1592.52]
  - - [1728, 576, 1, 32]
    - [21, 3352.68]
  - - [192, 704, 1, 1]
    - [9, 20.7951]
  - - [320, 704, 1, 16]
    - [10, 514.926]
  - - [448, 704, 1, 1]
    - [7, 42.0523]
  - - [448, 704, 1, 16]
    - [7, 672.836]
  - - [576, 704, 1, 1]
    - [9, 54.0672]
  - - [576, 704, 1, 16]
    - [14, 811.008]
  - - [960, 704, 1, 1]
    - [107, 79.5106]
  - - [1088, 704, 1, 32]
    - [13, 2723.38]
  - - [1216, 704, 1, 1]
    - [21, 95.1182]
  - - [1344, 704, 1, 1]
    - [21, 105.131]
  - - [1472, 704, 1, 1]
    - [21, 115.143]
  - - [1600, 704, 1, 1]
    - [21, 112.64]
  - - [1728, 704, 1, 16]
    - [71, 1853.73]
  - - [192, 832, 1, 1]
    - [7, 24.576]
  - - [448, 832, 1, 16]
    - [105, 795.17]
  - - [448, 832, 1, 32]
    - [9, 1490.94]
  - - [1216, 832, 1, 32]
    - [21, 3407.87]
  - - [1984, 832, 1, 1]
    - [30, 137.557]
  - - [32, 960, 1, 16]
    - [48, 81.92]
  - - [64, 960, 1, 1]
    - [7, 9.45231]
  - - [192, 960, 1, 1]
    - [10, 30.72]
  - - [576, 960, 1, 1]
    - [31, 69.12]
  - - [960, 960, 1, 16]
    - [21, 1552.17]
  - - [192, 1088, 1, 1]
    - [7, 34.816]
  - - [192, 1088, 1, 16]
    - [9, 514.206]
  - - [192, 1088, 1, 32]
    - [7, 1028.41]
  - - [704, 1088, 1, 16]
    - [16, 1441.79]
  - - [1984, 1088, 1, 1]
    - [21, 172.687]
  - - [1984, 1088, 1, 16]
    - [21, 2763.0]
  - - [1, 1216, 1, 32]
    - [174, 17.2942]
  - - [16, 1216, 1, 1]
    - [170, 7.94122]
  - - [32, 1216, 1, 1]
    - [177, 17.2942]
  - - [32, 1216, 1, 32]
    - [177, 508.238]
  - - [192, 1216, 1, 16]
    - [181, 1185.89]
  - - [448, 1216, 1, 16]
    - [182, 1980.97]
  - - [960, 1216, 1, 1]
    - [107, 111.177]
  - - [1600, 1216, 1, 16]
    - [21, 2490.37]
  - - [1728, 1216, 1, 32]
    - [21, 5172.3]
  - - [1856, 1216, 1, 1]
    - [21, 188.075]
  - - [1984, 1216, 1, 1]
    - [21, 172.325]
  - - [448, 1344, 1, 1]
    - [148, 145.087]
  - - [448, 1344, 1, 16]
    - [147, 2349.71]
  - - [1472, 1344, 1, 16]
    - [21, 2532.31]
  - - [1984, 1344, 1, 16]
    - [16, 2844.26]
  - - [16, 1472, 1, 32]
    - [170, 334.962]
  - - [32, 1472, 1, 32]
    - [176, 558.27]
  - - [192, 1472, 1, 1]
    - [168, 85.6436]
  - - [320, 1472, 1, 16]
    - [151, 2064.83]
  - - [448, 1472, 1, 32]
    - [183, 4351.05]
  - - [1344, 1472, 1, 32]
    - [21, 5064.62]
  - - [1728, 1472, 1, 1]
    - [36, 188.416]
  - - [1728, 1472, 1, 32]
    - [21, 5813.98]
  - - [1856, 1472, 1, 1]
    - [15, 195.145]
  - - [192, 1600, 1, 16]
    - [169, 1560.38]
  - - [1216, 1600, 1, 1]
    - [21, 155.648]
  - - [1216, 1600, 1, 16]
    - [21, 2490.37]
  - - [1, 1728, 1, 1]
    - [174, 0.6912]
  - - [16, 1728, 1, 32]
    - [175, 327.68]
  - - [32, 1728, 1, 1]
    - [156, 20.1076]
  - - [64, 1728, 1, 1]
    - [158, 41.7328]
  - - [192, 1728, 1, 1]
    - [166, 100.538]
  - - [192, 1728, 1, 32]
    - [154, 2908.72]
  - - [320, 1728, 1, 1]
    - [151, 145.516]
  - - [320, 1728, 1, 32]
    - [151, 4596.03]
  - - [1088, 1728, 1, 1]
    - [21, 156.672]
  - - [1088, 1728, 1, 32]
    - [21, 4812.96]
  - - [1216, 1728, 1, 32]
    - [21, 5379.19]
  - - [1344, 1728, 1, 1]
    - [28, 178.649]
  - - [1344, 1728, 1, 32]
    - [21, 5505.02]
  - - [1472, 1728, 1, 32]
    - [21, 5613.5]
  - - [1600, 1728, 1, 32]
    - [21, 5898.24]
  - - [1728, 1728, 1, 16]
    - [16, 3185.05]
  - - [1856, 1728, 1, 1]
    - [21, 213.811]
  - - [1856, 1728, 1, 16]
    - [21, 3310.63]
  - - [1856, 1728, 1, 32]
    - [21, 6841.96]
  - - [448, 1856, 1, 16]
    - [151, 2534.06]
  - - [1472, 1856, 1, 1]
    - [15, 188.416]
  - - [1728, 1856, 1, 1]
    - [107, 213.811]
  - - [1728, 1856, 1, 16]
    - [21, 3109.98]
  - - [1728, 1856, 1, 32]
    - [21, 6621.25]
  - - [32, 1984, 1, 64]
    - [180, 1504.9]
  - - [16, 1984, 1, 1]
    - [170, 13.8017]
  - - [192, 1984, 1, 1]
    - [166, 105.813]
  - - [576, 1984, 1, 16]
    - [148, 3125.56]
  - - [960, 1984, 1, 1]
    - [21, 152.371]
  - - [1216, 1984, 1, 32]
    - [21, 5514.39]
  - - [1472, 1984, 1, 1]
    - [21, 201.41]
  - - [1728, 1984, 1, 16]
    - [21, 3538.94]
  - - [1472, 1, 1, 256]
    - [48, 57.9742]
  - - [1, 192, 1, 256]
    - [48, 7.56185]
  - - [16, 448, 1, 256]
    - [137, 282.309]
  - - [1, 704, 1, 256]
    - [102, 25.7463]
  - - [32, 704, 1, 256]
    - [48, 887.257]
  - - [1, 960, 1, 256]
    - [66, 35.1086]
  - - [16, 960, 1, 256]
    - [47, 604.948]
  - - [32, 960, 1, 256]
    - [47, 1209.9]
  - - [1, 1216, 1, 256]
    - [145, 113.199]
  - - [16, 1216, 1, 256]
    - [145, 1879.52]
  - - [1, 1472, 1, 256]
    - [145, 117.76]
  - - [16, 1472, 1, 256]
    - [145, 2192.48]
  - - [1, 1728, 1, 256]
    - [145, 152.541]
  - - [1, 192, 1, 512]
    - [134, 14.0434]
  - - [16, 192, 1, 512]
    - [48, 224.695]
  - - [1, 448, 1, 512]
    - [48, 35.2886]
  - - [16, 448, 1, 512]
    - [48, 524.288]
  - - [16, 960, 1, 512]
    - [46, 1209.9]
  - - [16, 1216, 1, 512]
    - [179, 2973.57]
  - - [32, 1472, 1, 512]
    - [146, 5419.61]
  - - [1, 1728, 1, 512]
    - [145, 245.76]
  - - [16, 1984, 1, 512]
    - [145, 4114.67]
  - - [32, 1984, 1, 512]
    - [160, 7066.49]
  - - [1, 192, 1, 1024]
    - [46, 28.0869]
  - - [16, 192, 1, 1024]
    - [46, 483.958]
  - - [16, 448, 1, 1024]
    - [46, 1129.24]
  - - [32, 448, 1, 1024]
    - [46, 2097.15]
  - - [1, 704, 1, 1024]
    - [48, 96.1195]
  - - [32, 704, 1, 1024]
    - [46, 3295.52]
  - - [16, 1216, 1, 1024]
    - [145, 4107.82]
  - - [1, 1728, 1, 1024]
    - [145, 353.894]
  - - [16, 1728, 1, 1024]
    - [145, 5341.8]
  - - [16, 192, 1, 2048]
    - [46, 838.861]
  - - [32, 192, 1, 2048]
    - [134, 1480.34]
  - - [16, 448, 1, 2048]
    - [46, 1727.07]
  - - [32, 448, 1, 2048]
    - [46, 3454.13]
  - - [1, 960, 1, 2048]
    - [46, 245.76]
  - - [32, 960, 1, 2048]
    - [48, 7401.71]
  - - [16, 1216, 1, 2048]
    - [145, 5903.09]
  - - [1, 1728, 1, 2048]
    - [145, 456.638]
  - - [32, 1728, 1, 2048]
    - [160, 11497.1]
  - - [16, 1984, 1, 2048]
    - [145, 7832.74]
  - - [1, 192, 1, 4096]
    - [48, 74.8983]
  - - [16, 704, 1, 4096]
    - [46, 4613.73]
  - - [1, 1216, 1, 4096]
    - [145, 436.907]
  - - [1, 1984, 1, 4096]
    - [145, 527.692]
  - - [128, 1, 1, 32]
    - [47, 0.630154]
  - - [128, 16, 1, 1]
    - [48, 0.341333]
  - - [256, 1, 1, 64]
    - [48, 2.52062]
  - - [384, 16, 1, 64]
    - [49, 65.536]
  - - [384, 1, 1, 16]
    - [54, 0.945231]
  - - [384, 32, 1, 1]
    - [48, 1.89046]
  - - [384, 64, 1, 1]
    - [48, 3.78092]
  - - [640, 1, 1, 1]
    - [138, 0.0984615]
  - - [640, 1, 1, 16]
    - [48, 1.70667]
  - - [640, 16, 1, 1]
    - [48, 1.70667]
  - - [640, 16, 1, 32]
    - [47, 54.6133]
  - - [640, 64, 1, 16]
    - [63, 100.825]
  - - [768, 1, 1, 64]
    - [141, 8.192]
  - - [896, 32, 1, 64]
    - [54, 282.309]
  - - [896, 16, 1, 32]
    - [51, 76.4587]
  - - [1024, 64, 1, 16]
    - [7, 161.319]
  - - [1024, 64, 1, 32]
    - [10, 322.639]
  - - [16, 128, 1, 64]
    - [46, 21.8453]
  - - [32, 128, 1, 64]
    - [47, 40.3298]
  - - [1, 128, 1, 1]
    - [134, 0.0196923]
  - - [16, 128, 1, 32]
    - [7, 10.0825]
  - - [32, 128, 1, 16]
    - [48, 10.0825]
  - - [64, 128, 1, 1]
    - [39, 1.36533]
  - - [192, 128, 1, 16]
    - [139, 60.4948]
  - - [512, 128, 1, 16]
    - [53, 161.319]
  - - [640, 128, 1, 32]
    - [7, 436.907]
  - - [704, 128, 1, 32]
    - [6, 411.941]
  - - [768, 128, 1, 32]
    - [7, 524.288]
  - - [832, 128, 1, 16]
    - [7, 283.989]
  - - [896, 128, 1, 32]
    - [7, 564.618]
  - - [1024, 128, 1, 16]
    - [7, 299.593]
  - - [128, 192, 1, 16]
    - [48, 65.536]
  - - [384, 192, 1, 1]
    - [9, 12.288]
  - - [384, 192, 1, 16]
    - [7, 181.484]
  - - [512, 192, 1, 1]
    - [10, 14.0434]
  - - [640, 192, 1, 16]
    - [70, 280.869]
  - - [768, 192, 1, 1]
    - [7, 21.0651]
  - - [768, 192, 1, 16]
    - [39, 362.969]
  - - [896, 192, 1, 1]
    - [13, 26.4665]
  - - [1024, 192, 1, 16]
    - [7, 449.39]
  - - [1, 256, 1, 64]
    - [7, 2.52062]
  - - [64, 256, 1, 1]
    - [50, 2.73067]
  - - [384, 256, 1, 1]
    - [39, 15.1237]
  - - [512, 256, 1, 32]
    - [26, 645.278]
  - - [576, 256, 1, 1]
    - [112, 22.6855]
  - - [576, 256, 1, 32]
    - [7, 725.937]
  - - [704, 256, 1, 1]
    - [14, 24.0299]
  - - [768, 256, 1, 1]
    - [11, 28.0869]
  - - [832, 256, 1, 16]
    - [9, 486.839]
  - - [832, 256, 1, 32]
    - [9, 1048.58]
  - - [896, 256, 1, 1]
    - [8, 35.2886]
  - - [1024, 256, 1, 1]
    - [14, 37.4491]
  - - [1024, 256, 1, 32]
    - [6, 1198.37]
  - - [256, 320, 1, 1]
    - [22, 13.6533]
  - - [384, 320, 1, 16]
    - [7, 302.474]
  - - [512, 320, 1, 16]
    - [7, 403.298]
  - - [768, 320, 1, 1]
    - [7, 35.1086]
  - - [896, 320, 1, 16]
    - [68, 611.669]
  - - [1024, 320, 1, 1]
    - [79, 43.6907]
  - - [1, 384, 1, 64]
    - [48, 3.78092]
  - - [16, 384, 1, 1]
    - [48, 1.024]
  - - [64, 384, 1, 16]
    - [49, 65.536]
  - - [64, 384, 1, 32]
    - [141, 120.99]
  - - [128, 384, 1, 1]
    - [9, 8.192]
  - - [256, 384, 1, 1]
    - [7, 15.1237]
  - - [320, 384, 1, 32]
    - [7, 604.948]
  - - [384, 384, 1, 1]
    - [7, 22.6855]
  - - [448, 384, 1, 32]
    - [9, 786.432]
  - - [512, 384, 1, 32]
    - [26, 967.916]
  - - [576, 384, 1, 32]
    - [7, 1088.91]
  - - [640, 384, 1, 16]
    - [7, 561.737]
  - - [704, 384, 1, 32]
    - [9, 1330.88]
  - - [960, 384, 1, 1]
    - [6, 52.6629]
  - - [960, 384, 1, 32]
    - [105, 1572.86]
  - - [128, 448, 1, 16]
    - [9, 152.917]
  - - [384, 448, 1, 16]
    - [10, 458.752]
  - - [512, 448, 1, 32]
    - [7, 1129.24]
  - - [768, 448, 1, 1]
    - [7, 49.152]
  - - [768, 448, 1, 32]
    - [13, 1572.86]
  - - [128, 512, 1, 32]
    - [39, 322.639]
  - - [256, 512, 1, 32]
    - [9, 762.601]
  - - [384, 512, 1, 1]
    - [2, 28.0869]
  - - [448, 512, 1, 16]
    - [9, 564.618]
  - - [640, 512, 1, 1]
    - [27, 50.4123]
  - - [704, 512, 1, 16]
    - [22, 823.881]
  - - [832, 512, 1, 1]
    - [6, 53.248]
  - - [832, 512, 1, 32]
    - [11, 1817.53]
  - - [896, 512, 1, 1]
    - [8, 65.536]
  - - [896, 512, 1, 16]
    - [99, 978.671]
  - - [960, 512, 1, 1]
    - [11, 65.536]
  - - [128, 576, 1, 1]
    - [9, 12.288]
  - - [128, 576, 1, 16]
    - [9, 196.608]
  - - [128, 576, 1, 32]
    - [7, 393.216]
  - - [256, 576, 1, 32]
    - [92, 725.937]
  - - [384, 576, 1, 1]
    - [7, 34.0283]
  - - [384, 576, 1, 16]
    - [7, 505.563]
  - - [512, 576, 1, 1]
    - [35, 39.3216]
  - - [512, 576, 1, 32]
    - [7, 1348.17]
  - - [640, 576, 1, 16]
    - [7, 786.432]
  - - [896, 576, 1, 1]
    - [36, 68.8128]
  - - [896, 576, 1, 16]
    - [35, 1101.0]
  - - [1024, 576, 1, 32]
    - [21, 2220.51]
  - - [1, 640, 1, 64]
    - [49, 6.82667]
  - - [16, 640, 1, 16]
    - [48, 25.2062]
  - - [64, 640, 1, 16]
    - [9, 100.825]
  - - [128, 640, 1, 16]
    - [7, 201.649]
  - - [192, 640, 1, 1]
    - [10, 17.5543]
  - - [192, 640, 1, 16]
    - [7, 302.474]
  - - [256, 640, 1, 16]
    - [14, 436.907]
  - - [320, 640, 1, 1]
    - [31, 29.2571]
  - - [384, 640, 1, 1]
    - [7, 35.1086]
  - - [448, 640, 1, 1]
    - [6, 40.96]
  - - [704, 640, 1, 16]
    - [11, 1029.85]
  - - [960, 640, 1, 1]
    - [43, 81.92]
  - - [960, 640, 1, 32]
    - [45, 2313.04]
  - - [1024, 640, 1, 1]
    - [35, 81.92]
  - - [1024, 640, 1, 16]
    - [77, 1233.62]
  - - [128, 704, 1, 16]
    - [7, 221.814]
  - - [128, 704, 1, 32]
    - [9, 443.628]
  - - [256, 704, 1, 16]
    - [25, 384.478]
  - - [512, 704, 1, 32]
    - [35, 1647.76]
  - - [640, 704, 1, 1]
    - [35, 60.0747]
  - - [768, 704, 1, 1]
    - [11, 72.0896]
  - - [896, 704, 1, 16]
    - [21, 1187.36]
  - - [32, 768, 1, 16]
    - [55, 60.4948]
  - - [64, 768, 1, 1]
    - [50, 7.56185]
  - - [128, 768, 1, 1]
    - [26, 15.1237]
  - - [256, 768, 1, 1]
    - [6, 28.0869]
  - - [256, 768, 1, 32]
    - [121, 967.916]
  - - [320, 768, 1, 1]
    - [7, 35.1086]
  - - [320, 768, 1, 16]
    - [7, 524.288]
  - - [384, 768, 1, 1]
    - [6, 39.3216]
  - - [512, 768, 1, 32]
    - [6, 1677.72]
  - - [576, 768, 1, 1]
    - [14, 63.1954]
  - - [576, 768, 1, 16]
    - [8, 943.718]
  - - [704, 768, 1, 1]
    - [6, 63.6085]
  - - [768, 768, 1, 16]
    - [13, 1179.65]
  - - [832, 768, 1, 16]
    - [75, 1277.95]
  - - [896, 768, 1, 1]
    - [8, 80.9562]
  - - [128, 832, 1, 1]
    - [9, 17.7493]
  - - [128, 832, 1, 32]
    - [55, 524.288]
  - - [512, 832, 1, 16]
    - [35, 908.766]
  - - [640, 832, 1, 1]
    - [35, 62.6447]
  - - [768, 832, 1, 1]
    - [35, 75.1736]
  - - [768, 832, 1, 16]
    - [13, 1277.95]
  - - [16, 896, 1, 64]
    - [50, 141.154]
  - - [16, 896, 1, 1]
    - [50, 2.20554]
  - - [64, 896, 1, 16]
    - [100, 131.072]
  - - [128, 896, 1, 1]
    - [22, 17.6443]
  - - [192, 896, 1, 16]
    - [7, 393.216]
  - - [384, 896, 1, 16]
    - [35, 734.003]
  - - [448, 896, 1, 32]
    - [143, 1712.67]
  - - [768, 896, 1, 1]
    - [15, 86.016]
  - - [768, 896, 1, 16]
    - [8, 1295.3]
  - - [896, 896, 1, 16]
    - [14, 1511.18]
  - - [960, 896, 1, 16]
    - [21, 1448.69]
  - - [1024, 896, 1, 16]
    - [21, 1631.12]
  - - [256, 960, 1, 1]
    - [109, 35.1086]
  - - [384, 960, 1, 1]
    - [7, 49.152]
  - - [640, 960, 1, 32]
    - [35, 2457.6]
  - - [768, 960, 1, 1]
    - [21, 81.92]
  - - [896, 960, 1, 1]
    - [16, 101.195]
  - - [192, 1024, 1, 16]
    - [6, 419.43]
  - - [320, 1024, 1, 1]
    - [8, 50.4123]
  - - [320, 1024, 1, 32]
    - [6, 1613.19]
  - - [384, 1024, 1, 1]
    - [7, 52.4288]
  - - [448, 1024, 1, 1]
    - [15, 65.536]
  - - [512, 1024, 1, 1]
    - [11, 69.9051]
  - - [512, 1024, 1, 32]
    - [13, 2396.75]
  - - [640, 1024, 1, 16]
    - [13, 1310.72]
  - - [704, 1024, 1, 1]
    - [12, 84.8113]
  - - [896, 1024, 1, 16]
    - [73, 1631.12]
  - - [896, 1024, 1, 32]
    - [18, 3454.13]
  - - [128, 32, 1, 256]
    - [48, 161.319]
  - - [640, 32, 1, 256]
    - [48, 806.597]
  - - [16, 128, 1, 256]
    - [137, 80.6597]
  - - [32, 384, 1, 256]
    - [123, 449.39]
  - - [16, 512, 1, 256]
    - [48, 322.639]
  - - [32, 512, 1, 256]
    - [48, 699.051]
  - - [1, 640, 1, 256]
    - [48, 25.2062]
  - - [32, 640, 1, 256]
    - [46, 806.597]
  - - [1, 768, 1, 256]
    - [48, 30.2474]
  - - [1, 1024, 1, 256]
    - [48, 37.4491]
  - - [16, 1024, 1, 256]
    - [48, 645.278]
  - - [16, 128, 1, 512]
    - [46, 161.319]
  - - [32, 128, 1, 512]
    - [48, 322.639]
  - - [16, 256, 1, 512]
    - [48, 322.639]
  - - [32, 256, 1, 512]
    - [46, 645.278]
  - - [1, 384, 1, 512]
    - [46, 30.2474]
  - - [32, 640, 1, 512]
    - [48, 1613.19]
  - - [32, 896, 1, 512]
    - [48, 2097.15]
  - - [1, 1024, 1, 512]
    - [46, 80.6597]
  - - [1, 128, 1, 1024]
    - [46, 18.7246]
  - - [32, 128, 1, 1024]
    - [48, 559.241]
  - - [16, 384, 1, 1024]
    - [46, 898.779]
  - - [32, 384, 1, 1024]
    - [46, 1797.56]
  - - [32, 512, 1, 1024]
    - [46, 2581.11]
  - - [16, 640, 1, 1024]
    - [46, 1497.97]
  - - [16, 896, 1, 1024]
    - [46, 2097.15]
  - - [16, 256, 1, 2048]
    - [46, 1048.58]
  - - [32, 256, 1, 2048]
    - [46, 2236.96]
  - - [32, 384, 1, 2048]
    - [46, 3145.73]
  - - [32, 640, 1, 2048]
    - [46, 4934.48]
  - - [32, 768, 1, 2048]
    - [46, 6291.46]
  - - [16, 896, 1, 2048]
    - [46, 3454.13]
  - - [1, 1024, 1, 2048]
    - [49, 246.724]
  - - [1, 128, 1, 4096]
    - [46, 52.4288]
  - - [16, 384, 1, 4096]
    - [46, 2516.58]
  - - [1, 640, 1, 4096]
    - [136, 238.313]
  - - [16, 640, 1, 4096]
    - [61, 3813.0]
  - - [32, 640, 1, 4096]
    - [46, 7626.01]
  - - [16, 768, 1, 4096]
    - [46, 4793.49]
  - - [6, 1, 1, 16]
    - [74, 0.0147692]
  - - [6, 32, 1, 32]
    - [48, 0.945231]
  - - [10, 32, 1, 1]
    - [50, 0.0533333]
  - - [14, 16, 1, 32]
    - [48, 1.19467]
  - - [1, 10, 1, 16]
    - [50, 0.0246154]
  - - [16, 10, 1, 1]
    - [51, 0.0246154]
  - - [10, 10, 1, 1]
    - [48, 0.0166667]
  - - [14, 10, 1, 32]
    - [103, 0.689231]
  - - [16, 12, 1, 1]
    - [58, 0.0349091]
  - - [32, 12, 1, 1]
    - [48, 0.064]
  - - [6, 12, 1, 32]
    - [47, 0.384]
  - - [10, 12, 1, 32]
    - [51, 0.590769]
  - - [12, 12, 1, 32]
    - [47, 0.708923]
  - - [1, 14, 1, 32]
    - [9, 0.0746667]
  - - [32, 14, 1, 1]
    - [55, 0.0689231]
  - - [14, 14, 1, 32]
    - [10, 0.964923]
  - - [6, 32, 1, 6]
    - [48, 0.192]
  - - [14, 1, 1, 6]
    - [9, 0.0129231]
  - - [32, 10, 1, 6]
    - [48, 0.295385]
  - - [1, 12, 1, 6]
    - [48, 0.012]
  - - [32, 14, 1, 6]
    - [48, 0.413538]
  - - [1, 1, 1, 10]
    - [118, 0.00153846]
  - - [1, 32, 1, 10]
    - [48, 0.0533333]
  - - [16, 32, 1, 10]
    - [132, 0.787692]
  - - [32, 14, 1, 10]
    - [48, 0.689231]
  - - [1, 16, 1, 12]
    - [48, 0.0274286]
  - - [6, 32, 1, 12]
    - [135, 0.354462]
  - - [10, 1, 1, 12]
    - [48, 0.02]
  - - [12, 1, 1, 12]
    - [46, 0.0261818]
  - - [1, 6, 1, 12]
    - [48, 0.012]
  - - [1, 10, 1, 12]
    - [10, 0.0184615]
  - - [32, 14, 1, 12]
    - [7, 0.896]
  - - [16, 1, 1, 14]
    - [47, 0.0373333]
  - - [1, 16, 1, 14]
    - [48, 0.0373333]
  - - [10, 1, 1, 14]
    - [47, 0.0233333]
  - - [12, 1, 1, 14]
    - [116, 0.0258462]
  - - [12, 1, 1, 1024]
    - [57, 1.6384]
  - - [14, 1, 1, 4096]
    - [136, 5.46133]
  - - [3072, 64, 1, 16]
    - [7, 449.39]
  - - [32, 192, 1, 3072]
    - [46, 2097.15]
  - - [3072, 192, 1, 16]
    - [35, 1179.65]
  - - [3072, 192, 1, 32]
    - [106, 2359.3]
  - - [16, 320, 1, 3072]
    - [46, 1850.43]
  - - [32, 320, 1, 3072]
    - [46, 3495.25]
  - - [3072, 320, 1, 32]
    - [21, 3145.73]
  - - [16, 384, 1, 3072]
    - [46, 2220.51]
  - - [32, 384, 1, 3072]
    - [46, 3973.55]
  - - [16, 512, 1, 3072]
    - [46, 2796.2]
  - - [3072, 512, 1, 32]
    - [17, 4793.49]
  - - [1, 576, 1, 3072]
    - [46, 196.608]
  - - [16, 576, 1, 3072]
    - [46, 2980.16]
  - - [32, 576, 1, 3072]
    - [61, 5960.33]
  - - [3072, 576, 1, 32]
    - [13, 4529.85]
  - - [16, 640, 1, 3072]
    - [46, 3311.29]
  - - [32, 640, 1, 3072]
    - [46, 6622.59]
  - - [3072, 640, 1, 16]
    - [32, 2621.44]
  - - [3072, 704, 1, 1]
    - [21, 166.361]
  - - [1, 896, 1, 3072]
    - [46, 305.835]
  - - [32, 896, 1, 3072]
    - [49, 8808.04]
  - - [32, 960, 1, 3072]
    - [48, 8579.26]
  - - [16, 1024, 1, 3072]
    - [48, 4575.6]
  - - [1, 1280, 1, 3072]
    - [145, 436.907]
  - - [1, 1280, 1, 1]
    - [157, 0.474074]
  - - [1, 1280, 1, 32]
    - [174, 17.4298]
  - - [16, 1536, 1, 32]
    - [174, 308.405]
  - - [32, 1536, 1, 16]
    - [146, 285.975]
  - - [1, 1792, 1, 3072]
    - [145, 556.063]
  - - [1, 1792, 1, 32]
    - [174, 22.4878]
  - - [3072, 2048, 1, 1]
    - [36, 267.722]
  - - [1, 2304, 1, 3072]
    - [145, 557.314]
  - - [16, 2304, 1, 32]
    - [170, 524.288]
  - - [32, 2304, 1, 1]
    - [156, 28.3569]
  - - [1, 2560, 1, 1]
    - [170, 1.0449]
  - - [32, 2560, 1, 1]
    - [156, 30.9132]
  - - [32, 2816, 1, 16]
    - [156, 544.072]
  - - [1, 3328, 1, 32]
    - [170, 38.7258]
  - - [32, 3328, 1, 1]
    - [162, 38.0343]
  - - [1, 3584, 1, 16]
    - [170, 22.0554]
  - - [1, 3584, 1, 32]
    - [170, 40.96]
  - - [16, 3584, 1, 16]
    - [179, 352.886]
  - - [16, 3584, 1, 32]
    - [170, 764.587]
  - - [1, 3840, 1, 32]
    - [170, 49.152]
  - - [16, 3840, 1, 32]
    - [170, 802.482]
  - - [32, 3840, 1, 1]
    - [162, 45.5111]
  - - [32, 3840, 1, 16]
    - [156, 702.171]
  - - [1, 4096, 1, 3072]
    - [160, 589.364]
  - - [64, 4096, 1, 16]
    - [168, 1290.56]
  - - [576, 4096, 1, 16]
    - [163, 4103.12]
  - - [832, 4096, 1, 1]
    - [21, 227.191]
  - - [1088, 4096, 1, 1]
    - [16, 240.889]
  - - [1344, 4096, 1, 1]
    - [8, 256.048]
  - - [1600, 4096, 1, 16]
    - [75, 4369.07]
  - - [3648, 4096, 1, 1]
    - [32, 347.493]
  - - [3904, 4096, 1, 1]
    - [17, 347.626]
  - - [32, 4096, 1, 512]
    - [160, 11671.1]
  - - [4096, 32, 1, 64]
    - [91, 1118.48]
  - - [4096, 832, 1, 1]
    - [21, 212.992]
  - - [4096, 1600, 1, 16]
    - [21, 4194.3]
  - - [4096, 2112, 1, 1]
    - [21, 283.631]
  - - [4096, 32, 1, 256]
    - [47, 3947.58]
  - - [16, 16, 1, 8192]
    - [57, 139.81]
  - - [16, 512, 1, 8192]
    - [61, 4628.2]
  - - [32, 8192, 1, 64]
    - [156, 4660.34]
  - - [1, 8192, 1, 1]
    - [178, 2.27556]
  - - [1, 8192, 1, 16]
    - [172, 38.5506]
  - - [16, 8192, 1, 32]
    - [170, 1310.72]
  - - [32, 8192, 1, 1]
    - [156, 80.6597]
  - - [32, 8192, 1, 16]
    - [178, 1252.03]
  - - [1, 1, 1, 128]
    - [46, 0.0213333]
  - - [32, 8192, 1, 128]
    - [152, 6515.42]
  - - [384, 8192, 1, 1]
    - [163, 266.587]
  - - [1536, 16, 1, 16]
    - [48, 65.536]
  - - [1536, 32, 1, 16]
    - [140, 112.347]
  - - [1536, 64, 1, 32]
    - [7, 483.958]
  - - [1536, 128, 1, 32]
    - [26, 967.916]
  - - [1536, 1024, 1, 32]
    - [17, 4376.67]
  - - [3072, 16, 1, 64]
    - [47, 419.43]
  - - [3072, 32, 1, 128]
    - [54, 1935.83]
  - - [3072, 32, 1, 256]
    - [47, 3355.44]
  - - [8192, 32, 1, 64]
    - [53, 2236.96]
  - - [8192, 1, 1, 16]
    - [47, 18.7246]
  - - [8192, 1, 1, 32]
    - [51, 34.9525]
  - - [8192, 16, 1, 16]
    - [47, 299.593]
  - - [8192, 16, 1, 32]
    - [62, 599.186]
  - - [8192, 32, 1, 16]
    - [68, 559.241]
  - - [8192, 64, 1, 1]
    - [21, 65.536]
  - - [8192, 32, 1, 128]
    - [53, 3947.58]
  - - [8192, 128, 1, 1]
    - [21, 110.376]
  - - [16, 128, 1, 128]
    - [46, 40.3298]
  - - [16, 256, 1, 128]
    - [50, 87.3813]
  - - [16, 512, 1, 128]
    - [46, 174.763]
  - - [32, 2048, 1, 64]
    - [160, 1582.76]
  - - [16, 2048, 1, 128]
    - [170, 1525.2]
  - - [32, 2048, 1, 128]
    - [160, 2943.37]
  - - [1, 2048, 1, 256]
    - [145, 169.125]
  - - [16, 2048, 1, 256]
    - [145, 2706.0]
  - - [1, 1, 1, 64]
    - [184, 0.0]
  - - [1, 1, 1, 512]
    - [184, 0.0]
  - - [1, 6, 1, 1]
    - [185, 0.0]
  - - [1, 6, 1, 10]
    - [185, 0.0]
  - - [1, 6, 1, 16]
    - [185, 0.0]
  - - [1, 6, 1, 1024]
    - [123, 0.8192]
  - - [1, 10, 1, 10]
    - [185, 0.0]
  - - [1, 10, 1, 4096]
    - [184, 0.0]
  - - [1, 12, 1, 10]
    - [185, 0.0]
  - - [1, 12, 1, 16]
    - [185, 0.0]
  - - [1, 12, 1, 1024]
    - [184, 0.0]
  - - [1, 12, 1, 2048]
    - [184, 0.0]
  - - [1, 14, 1, 10]
    - [48, 0.0215385]
  - - [1, 14, 1, 16]
    - [48, 0.0373333]
  - - [1, 14, 1, 1024]
    - [184, 0.0]
  - - [1, 16, 1, 10]
    - [7, 0.0266667]
  - - [1, 16, 1, 32]
    - [48, 0.0787692]
  - - [1, 16, 1, 256]
    - [184, 0.0]
  - - [1, 16, 1, 512]
    - [186, 1.26031]
  - - [1, 16, 1, 4096]
    - [184, 0.0]
  - - [1, 32, 1, 6]
    - [185, 0.0]
  - - [1, 32, 1, 14]
    - [48, 0.0689231]
  - - [1, 32, 1, 64]
    - [48, 0.341333]
  - - [1, 32, 1, 256]
    - [49, 1.26031]
  - - [1, 32, 1, 3072]
    - [184, 0.01]
  - - [1, 32, 1, 4096]
    - [184, 0.01]
  - - [1, 64, 1, 1]
    - [185, 0.0]
  - - [1, 64, 1, 256]
    - [184, 0.0]
  - - [1, 128, 1, 32]
    - [185, 0.0]
  - - [1, 128, 1, 256]
    - [48, 5.04123]
  - - [1, 128, 1, 512]
    - [48, 10.0825]
  - - [1, 256, 1, 256]
    - [46, 10.0825]
  - - [1, 256, 1, 1024]
    - [46, 37.4491]
  - - [1, 320, 1, 1]
    - [185, 0.0]
  - - [1, 320, 1, 3072]
    - [46, 115.652]
  - - [1, 384, 1, 256]
    - [46, 16.384]
  - - [1, 384, 1, 1024]
    - [187, 56.1737]
  - - [1, 384, 1, 2048]
    - [46, 98.304]
  - - [1, 384, 1, 3072]
    - [48, 124.173]
  - - [1, 448, 1, 3072]
    - [46, 144.869]
  - - [1, 512, 1, 1]
    - [48, 0.0787692]
  - - [1, 512, 1, 32]
    - [48, 2.52062]
  - - [1, 512, 1, 64]
    - [49, 5.04123]
  - - [1, 512, 1, 512]
    - [46, 40.3298]
  - - [1, 512, 1, 2048]
    - [48, 123.362]
  - - [1, 512, 1, 3072]
    - [46, 165.565]
  - - [1, 576, 1, 16]
    - [185, 0.0]
  - - [1, 576, 1, 32]
    - [185, 0.0]
  - - [1, 576, 1, 512]
    - [48, 45.3711]
  - - [1, 576, 1, 2048]
    - [46, 147.456]
  - - [1, 640, 1, 32]
    - [47, 3.41333]
  - - [1, 640, 1, 512]
    - [48, 54.6133]
  - - [1, 640, 1, 1024]
    - [46, 93.6229]
  - - [1, 704, 1, 64]
    - [63, 6.93169]
  - - [1, 768, 1, 1]
    - [48, 0.118154]
  - - [1, 768, 1, 64]
    - [185, 0.01]
  - - [1, 768, 1, 1024]
    - [46, 112.347]
  - - [1, 768, 1, 4096]
    - [46, 299.593]
  - - [1, 832, 1, 16]
    - [185, 0.0]
  - - [1, 832, 1, 64]
    - [185, 0.01]
  - - [1, 832, 1, 1024]
    - [46, 121.71]
  - - [1, 832, 1, 3072]
    - [46, 269.043]
  - - [1, 896, 1, 16]
    - [185, 0.0]
  - - [1, 896, 1, 32]
    - [185, 0.0]
  - - [1, 896, 1, 64]
    - [185, 0.01]
  - - [1, 896, 1, 256]
    - [46, 35.2886]
  - - [1, 896, 1, 1024]
    - [46, 131.072]
  - - [1, 896, 1, 2048]
    - [66, 215.883]
  - - [1, 896, 1, 4096]
    - [66, 305.835]
  - - [1, 960, 1, 1]
    - [50, 0.16]
  - - [1, 960, 1, 64]
    - [185, 0.01]
  - - [1, 960, 1, 1024]
    - [48, 122.88]
  - - [1, 1024, 1, 1]
    - [185, 0.0]
  - - [1, 1024, 1, 16]
    - [185, 0.0]
  - - [1, 1024, 1, 32]
    - [185, 0.0]
  - - [1, 1024, 1, 3072]
    - [46, 331.129]
  - - [1, 1024, 1, 4096]
    - [66, 381.3]
  - - [1, 1088, 1, 16]
    - [185, 0.0]
  - - [1, 1088, 1, 64]
    - [185, 0.01]
  - - [1, 1088, 1, 256]
    - [134, 39.7897]
  - - [1, 1216, 1, 1]
    - [185, 0.0]
  - - [1, 1216, 1, 64]
    - [185, 0.01]
  - - [1, 1216, 1, 1024]
    - [145, 273.667]
  - - [1, 1216, 1, 2048]
    - [145, 358.326]
  - - [1, 1344, 1, 1]
    - [185, 0.0]
  - - [1, 1344, 1, 16]
    - [185, 0.0]
  - - [1, 1344, 1, 1024]
    - [145, 272.526]
  - - [1, 1344, 1, 2048]
    - [145, 393.216]
  - - [1, 1344, 1, 4096]
    - [145, 460.671]
  - - [1, 1472, 1, 32]
    - [185, 0.01]
  - - [1, 1472, 1, 64]
    - [185, 0.01]
  - - [1, 1472, 1, 1024]
    - [145, 304.511]
  - - [1, 1472, 1, 2048]
    - [145, 412.967]
  - - [1, 1536, 1, 16]
    - [170, 10.24]
  - - [1, 1600, 1, 1]
    - [185, 0.0]
  - - [1, 1600, 1, 32]
    - [185, 0.01]
  - - [1, 1600, 1, 64]
    - [176, 36.5714]
  - - [1, 1600, 1, 256]
    - [145, 132.129]
  - - [1, 1600, 1, 4096]
    - [145, 520.127]
  - - [1, 1728, 1, 16]
    - [185, 0.0]
  - - [1, 1728, 1, 32]
    - [185, 0.01]
  - - [1, 1728, 1, 64]
    - [185, 0.01]
  - - [1, 1856, 1, 1]
    - [185, 0.0]
  - - [1, 1856, 1, 32]
    - [185, 0.01]
  - - [1, 1984, 1, 32]
    - [185, 0.01]
  - - [1, 1984, 1, 64]
    - [185, 0.02]
  - - [1, 1984, 1, 256]
    - [145, 169.301]
  - - [1, 2048, 1, 32]
    - [185, 0.01]
  - - [1, 2048, 1, 64]
    - [185, 0.02]
  - - [1, 2048, 1, 1024]
    - [145, 384.799]
  - - [1, 2048, 1, 2048]
    - [145, 471.27]
  - - [1, 2048, 1, 3072]
    - [145, 547.083]
  - - [1, 2048, 1, 4096]
    - [145, 594.937]
  - - [1, 2048, 1, 8192]
    - [145, 579.524]
  - - [1, 2112, 1, 1]
    - [185, 0.0]
  - - [1, 2112, 1, 16]
    - [188, 0.01]
  - - [1, 2112, 1, 64]
    - [145, 50.0622]
  - - [1, 2112, 1, 1024]
    - [145, 376.12]
  - - [1, 2112, 1, 2048]
    - [145, 483.282]
  - - [1, 2112, 1, 4096]
    - [145, 561.737]
  - - [1, 2304, 1, 1]
    - [185, 0.0]
  - - [1, 2304, 1, 32]
    - [185, 0.01]
  - - [1, 2368, 1, 1]
    - [170, 0.986667]
  - - [1, 2368, 1, 32]
    - [185, 0.01]
  - - [1, 2368, 1, 64]
    - [185, 0.02]
  - - [1, 2368, 1, 1024]
    - [145, 394.282]
  - - [1, 2368, 1, 2048]
    - [145, 502.556]
  - - [1, 2560, 1, 16]
    - [185, 0.0]
  - - [1, 2560, 1, 32]
    - [185, 0.01]
  - - [1, 2624, 1, 1]
    - [170, 0.937143]
  - - [1, 2624, 1, 1024]
    - [145, 416.585]
  - - [1, 2816, 1, 1]
    - [185, 0.0]
  - - [1, 2816, 1, 16]
    - [170, 17.669]
  - - [1, 2816, 1, 32]
    - [185, 0.01]
  - - [1, 2816, 1, 3072]
    - [145, 607.07]
  - - [1, 2880, 1, 512]
    - [145, 327.68]
  - - [1, 2880, 1, 2048]
    - [145, 604.948]
  - - [1, 3072, 1, 1]
    - [185, 0.0]
  - - [1, 3072, 1, 16]
    - [185, 0.01]
  - - [1, 3136, 1, 1]
    - [185, 0.0]
  - - [1, 3136, 1, 16]
    - [185, 0.01]
  - - [1, 3328, 1, 16]
    - [185, 0.01]
  - - [1, 3392, 1, 1]
    - [185, 0.0]
  - - [1, 3392, 1, 512]
    - [173, 327.68]
  - - [1, 3584, 1, 1]
    - [185, 0.0]
  - - [1, 3648, 1, 64]
    - [179, 84.8989]
  - - [1, 3840, 1, 1]
    - [170, 1.37143]
  - - [1, 3840, 1, 16]
    - [185, 0.01]
  - - [1, 3904, 1, 1]
    - [185, 0.0]
  - - [1, 4096, 1, 1]
    - [185, 0.0]
  - - [1, 4096, 1, 16]
    - [173, 22.2156]
  - - [1, 4096, 1, 32]
    - [185, 0.01]
  - - [1, 4096, 1, 64]
    - [185, 0.03]
  - - [1, 4096, 1, 128]
    - [188, 0.04]
  - - [1, 8192, 1, 64]
    - [185, 0.03]
  - - [1, 8192, 1, 2048]
    - [145, 627.186]
  - - [2, 2, 1, 8]
    - [184, 0.0]
  - - [2, 2, 1, 1024]
    - [52, 0.630154]
  - - [2, 4, 1, 4]
    - [185, 0.0]
  - - [2, 4, 1, 6]
    - [185, 0.0]
  - - [2, 4, 1, 10]
    - [185, 0.0]
  - - [2, 4, 1, 16]
    - [185, 0.0]
  - - [2, 4, 1, 1024]
    - [48, 1.26031]
  - - [2, 6, 1, 2]
    - [7, 0.004]
  - - [2, 6, 1, 6]
    - [185, 0.0]
  - - [2, 6, 1, 16]
    - [185, 0.0]
  - - [2, 8, 1, 10]
    - [185, 0.0]
  - - [2, 8, 1, 1024]
    - [46, 2.52062]
  - - [2, 8, 1, 2048]
    - [184, 0.0]
  - - [2, 10, 1, 4]
    - [48, 0.0123077]
  - - [2, 10, 1, 8]
    - [185, 0.0]
  - - [2, 10, 1, 12]
    - [185, 0.0]
  - - [2, 10, 1, 14]
    - [189, 0.0430769]
  - - [2, 12, 1, 8]
    - [185, 0.0]
  - - [2, 12, 1, 10]
    - [48, 0.04]
  - - [2, 12, 1, 14]
    - [49, 0.056]
  - - [2, 12, 1, 4096]
    - [184, 0.0]
  - - [2, 14, 1, 4]
    - [185, 0.0]
  - - [2, 14, 1, 6]
    - [185, 0.0]
  - - [2, 14, 1, 12]
    - [185, 0.0]
  - - [2, 14, 1, 14]
    - [137, 0.0603077]
  - - [2, 14, 1, 4096]
    - [184, 0.0]
  - - [2, 16, 1, 6]
    - [185, 0.0]
  - - [2, 16, 1, 8]
    - [185, 0.0]
  - - [2, 16, 1, 10]
    - [42, 0.0492308]
  - - [2, 16, 1, 12]
    - [185, 0.0]
  - - [2, 16, 1, 14]
    - [48, 0.0689231]
  - - [2, 16, 1, 16]
    - [185, 0.0]
  - - [2, 16, 1, 2048]
    - [184, 0.0]
  - - [4, 2, 1, 6]
    - [185, 0.0]
  - - [4, 2, 1, 10]
    - [52, 0.0133333]
  - - [4, 2, 1, 1024]
    - [184, 0.0]
  - - [4, 4, 1, 4]
    - [46, 0.00984615]
  - - [4, 4, 1, 6]
    - [48, 0.0147692]
  - - [4, 4, 1, 10]
    - [184, 0.0]
  - - [4, 4, 1, 4096]
    - [184, 0.0]
  - - [4, 6, 1, 2]
    - [184, 0.0]
  - - [4, 6, 1, 4]
    - [54, 0.0147692]
  - - [4, 6, 1, 12]
    - [48, 0.0443077]
  - - [4, 6, 1, 4096]
    - [57, 9.8304]
  - - [4, 8, 1, 14]
    - [185, 0.0]
  - - [4, 10, 1, 4]
    - [185, 0.0]
  - - [4, 10, 1, 8]
    - [185, 0.0]
  - - [4, 10, 1, 10]
    - [185, 0.0]
  - - [4, 10, 1, 14]
    - [185, 0.0]
  - - [4, 10, 1, 16]
    - [7, 0.106667]
  - - [4, 10, 1, 1024]
    - [184, 0.0]
  - - [4, 12, 1, 2]
    - [185, 0.0]
  - - [4, 14, 1, 16]
    - [185, 0.0]
  - - [4, 14, 1, 1024]
    - [184, 0.0]
  - - [4, 14, 1, 4096]
    - [184, 0.01]
  - - [4, 16, 1, 8]
    - [185, 0.0]
  - - [4, 16, 1, 10]
    - [185, 0.0]
  - - [4, 16, 1, 12]
    - [185, 0.0]
  - - [4, 16, 1, 16]
    - [48, 0.157538]
  - - [4, 16, 1, 1024]
    - [184, 0.01]
  - - [6, 1, 1, 6]
    - [185, 0.0]
  - - [6, 1, 1, 10]
    - [185, 0.0]
  - - [6, 1, 1, 12]
    - [185, 0.0]
  - - [6, 1, 1, 32]
    - [185, 0.0]
  - - [6, 1, 1, 2048]
    - [184, 0.0]
  - - [6, 2, 1, 2]
    - [185, 0.0]
  - - [6, 2, 1, 12]
    - [185, 0.0]
  - - [6, 2, 1, 16]
    - [185, 0.0]
  - - [6, 2, 1, 1024]
    - [46, 1.6384]
  - - [6, 4, 1, 2]
    - [184, 0.0]
  - - [6, 4, 1, 4]
    - [50, 0.0147692]
  - - [6, 4, 1, 10]
    - [184, 0.0]
  - - [6, 4, 1, 14]
    - [184, 0.0]
  - - [6, 4, 1, 2048]
    - [184, 0.0]
  - - [6, 4, 1, 4096]
    - [184, 0.0]
  - - [6, 6, 1, 2]
    - [48, 0.012]
  - - [6, 6, 1, 32]
    - [185, 0.0]
  - - [6, 6, 1, 4096]
    - [184, 0.01]
  - - [6, 8, 1, 4]
    - [184, 0.0]
  - - [6, 10, 1, 1]
    - [185, 0.0]
  - - [6, 10, 1, 2]
    - [48, 0.0184615]
  - - [6, 10, 1, 12]
    - [47, 0.110769]
  - - [6, 12, 1, 2]
    - [9, 0.0221538]
  - - [6, 12, 1, 8]
    - [47, 0.0886154]
  - - [6, 12, 1, 14]
    - [185, 0.0]
  - - [6, 14, 1, 1]
    - [185, 0.0]
  - - [6, 14, 1, 2]
    - [185, 0.0]
  - - [6, 14, 1, 12]
    - [49, 0.168]
  - - [6, 14, 1, 14]
    - [103, 0.180923]
  - - [6, 14, 1, 32]
    - [185, 0.0]
  - - [6, 16, 1, 10]
    - [9, 0.147692]
  - - [6, 16, 1, 12]
    - [185, 0.0]
  - - [6, 16, 1, 14]
    - [47, 0.206769]
  - - [6, 32, 1, 1]
    - [185, 0.0]
  - - [6, 32, 1, 4096]
    - [184, 0.03]
  - - [8, 2, 1, 6]
    - [185, 0.0]
  - - [8, 2, 1, 12]
    - [185, 0.0]
  - - [8, 2, 1, 16]
    - [9, 0.0426667]
  - - [8, 4, 1, 2]
    - [185, 0.0]
  - - [8, 4, 1, 8]
    - [185, 0.0]
  - - [8, 4, 1, 14]
    - [185, 0.0]
  - - [8, 4, 1, 4096]
    - [184, 0.0]
  - - [8, 6, 1, 8]
    - [48, 0.0590769]
  - - [8, 6, 1, 10]
    - [184, 0.0]
  - - [8, 6, 1, 16]
    - [184, 0.0]
  - - [8, 6, 1, 1024]
    - [184, 0.01]
  - - [8, 8, 1, 2]
    - [190, 0.0213333]
  - - [8, 8, 1, 4]
    - [184, 0.0]
  - - [8, 8, 1, 6]
    - [184, 0.0]
  - - [8, 8, 1, 12]
    - [48, 0.128]
  - - [8, 8, 1, 14]
    - [9, 0.137846]
  - - [8, 8, 1, 16]
    - [184, 0.0]
  - - [8, 8, 1, 1024]
    - [184, 0.01]
  - - [8, 8, 1, 2048]
    - [184, 0.01]
  - - [8, 10, 1, 4]
    - [184, 0.0]
  - - [8, 10, 1, 8]
    - [184, 0.0]
  - - [8, 10, 1, 12]
    - [184, 0.0]
  - - [8, 10, 1, 14]
    - [9, 0.172308]
  - - [8, 10, 1, 16]
    - [48, 0.213333]
  - - [8, 10, 1, 2048]
    - [184, 0.01]
  - - [8, 12, 1, 4]
    - [184, 0.0]
  - - [8, 12, 1, 10]
    - [48, 0.147692]
  - - [8, 12, 1, 12]
    - [184, 0.0]
  - - [8, 12, 1, 14]
    - [184, 0.0]
  - - [8, 12, 1, 16]
    - [184, 0.0]
  - - [8, 12, 1, 1024]
    - [184, 0.01]
  - - [8, 12, 1, 2048]
    - [184, 0.01]
  - - [8, 14, 1, 6]
    - [185, 0.0]
  - - [8, 14, 1, 12]
    - [185, 0.0]
  - - [8, 14, 1, 16]
    - [48, 0.298667]
  - - [8, 16, 1, 6]
    - [48, 0.118154]
  - - [8, 16, 1, 8]
    - [185, 0.0]
  - - [8, 16, 1, 12]
    - [185, 0.0]
  - - [8, 16, 1, 14]
    - [185, 0.0]
  - - [8, 16, 1, 1024]
    - [57, 17.4763]
  - - [10, 1, 1, 6]
    - [123, 0.01]
  - - [10, 1, 1, 16]
    - [185, 0.0]
  - - [10, 1, 1, 32]
    - [7, 0.0533333]
  - - [10, 1, 1, 2048]
    - [184, 0.0]
  - - [10, 1, 1, 4096]
    - [184, 0.0]
  - - [10, 2, 1, 4]
    - [48, 0.0123077]
  - - [10, 2, 1, 14]
    - [185, 0.0]
  - - [10, 2, 1, 2048]
    - [184, 0.0]
  - - [10, 2, 1, 4096]
    - [184, 0.0]
  - - [10, 4, 1, 14]
    - [185, 0.0]
  - - [10, 6, 1, 14]
    - [185, 0.0]
  - - [10, 6, 1, 16]
    - [185, 0.0]
  - - [10, 6, 1, 4096]
    - [184, 0.01]
  - - [10, 8, 1, 4]
    - [48, 0.0492308]
  - - [10, 8, 1, 6]
    - [7, 0.0685714]
  - - [10, 8, 1, 2048]
    - [184, 0.01]
  - - [10, 10, 1, 6]
    - [10, 0.0923077]
  - - [10, 10, 1, 12]
    - [184, 0.0]
  - - [10, 10, 1, 2048]
    - [184, 0.01]
  - - [10, 12, 1, 1]
    - [184, 0.0]
  - - [10, 12, 1, 2]
    - [184, 0.0]
  - - [10, 12, 1, 4]
    - [184, 0.0]
  - - [10, 14, 1, 2]
    - [184, 0.0]
  - - [10, 14, 1, 8]
    - [184, 0.0]
  - - [10, 14, 1, 14]
    - [191, 0.301538]
  - - [10, 14, 1, 2048]
    - [184, 0.01]
  - - [10, 16, 1, 6]
    - [185, 0.0]
  - - [10, 16, 1, 12]
    - [54, 0.32]
  - - [10, 16, 1, 16]
    - [48, 0.393846]
  - - [10, 16, 1, 32]
    - [185, 0.0]
  - - [10, 32, 1, 12]
    - [7, 0.590769]
  - - [10, 32, 1, 16]
    - [48, 0.853333]
  - - [10, 32, 1, 2048]
    - [184, 0.04]
  - - [10, 32, 1, 4096]
    - [184, 0.05]
  - - [12, 1, 1, 1]
    - [48, 0.002]
  - - [12, 1, 1, 10]
    - [185, 0.0]
  - - [12, 1, 1, 2048]
    - [184, 0.0]
  - - [12, 2, 1, 4]
    - [185, 0.0]
  - - [12, 2, 1, 14]
    - [185, 0.0]
  - - [12, 4, 1, 6]
    - [185, 0.0]
  - - [12, 4, 1, 10]
    - [185, 0.0]
  - - [12, 4, 1, 12]
    - [48, 0.096]
  - - [12, 6, 1, 2]
    - [10, 0.0221538]
  - - [12, 6, 1, 6]
    - [185, 0.0]
  - - [12, 6, 1, 14]
    - [185, 0.0]
  - - [12, 6, 1, 16]
    - [185, 0.0]
  - - [12, 6, 1, 2048]
    - [184, 0.01]
  - - [12, 8, 1, 2]
    - [184, 0.0]
  - - [12, 8, 1, 10]
    - [184, 0.0]
  - - [12, 8, 1, 14]
    - [184, 0.0]
  - - [12, 8, 1, 1024]
    - [184, 0.01]
  - - [12, 10, 1, 1]
    - [184, 0.0]
  - - [12, 12, 1, 16]
    - [184, 0.0]
  - - [12, 12, 1, 1024]
    - [184, 0.01]
  - - [12, 12, 1, 2048]
    - [184, 0.02]
  - - [12, 14, 1, 2]
    - [184, 0.0]
  - - [12, 14, 1, 4]
    - [101, 0.103385]
  - - [12, 14, 1, 6]
    - [123, 0.155077]
  - - [12, 14, 1, 10]
    - [48, 0.28]
  - - [12, 14, 1, 12]
    - [184, 0.0]
  - - [12, 14, 1, 4096]
    - [57, 65.536]
  - - [12, 16, 1, 1]
    - [184, 0.0]
  - - [12, 16, 1, 10]
    - [184, 0.0]
  - - [12, 16, 1, 16]
    - [51, 0.512]
  - - [12, 32, 1, 1]
    - [185, 0.0]
  - - [12, 32, 1, 6]
    - [7, 0.354462]
  - - [12, 32, 1, 10]
    - [185, 0.0]
  - - [12, 32, 1, 16]
    - [185, 0.0]
  - - [12, 32, 1, 2048]
    - [184, 0.04]
  - - [12, 32, 1, 4096]
    - [184, 0.06]
  - - [14, 1, 1, 16]
    - [9, 0.0373333]
  - - [14, 1, 1, 1024]
    - [184, 0.0]
  - - [14, 2, 1, 4]
    - [185, 0.0]
  - - [14, 2, 1, 6]
    - [185, 0.0]
  - - [14, 2, 1, 10]
    - [185, 0.0]
  - - [14, 2, 1, 1024]
    - [184, 0.0]
  - - [14, 4, 1, 2]
    - [9, 0.0186667]
  - - [14, 4, 1, 6]
    - [185, 0.0]
  - - [14, 4, 1, 12]
    - [185, 0.0]
  - - [14, 6, 1, 1]
    - [185, 0.0]
  - - [14, 6, 1, 8]
    - [185, 0.0]
  - - [14, 6, 1, 32]
    - [185, 0.0]
  - - [14, 6, 1, 1024]
    - [184, 0.01]
  - - [14, 6, 1, 2048]
    - [184, 0.01]
  - - [14, 8, 1, 1024]
    - [184, 0.01]
  - - [14, 10, 1, 8]
    - [184, 0.0]
  - - [14, 10, 1, 12]
    - [184, 0.0]
  - - [14, 10, 1, 16]
    - [184, 0.0]
  - - [14, 10, 1, 1024]
    - [184, 0.01]
  - - [14, 12, 1, 12]
    - [48, 0.336]
  - - [14, 12, 1, 14]
    - [184, 0.0]
  - - [14, 12, 1, 16]
    - [184, 0.0]
  - - [14, 12, 1, 1024]
    - [184, 0.01]
  - - [14, 14, 1, 1]
    - [184, 0.0]
  - - [14, 14, 1, 8]
    - [48, 0.261333]
  - - [14, 16, 1, 10]
    - [184, 0.0]
  - - [14, 16, 1, 14]
    - [184, 0.0]
  - - [14, 32, 1, 6]
    - [48, 0.413538]
  - - [14, 32, 1, 16]
    - [10, 1.19467]
  - - [14, 32, 1, 1024]
    - [46, 65.536]
  - - [16, 1, 1, 1]
    - [185, 0.0]
  - - [16, 1, 1, 6]
    - [185, 0.0]
  - - [16, 1, 1, 10]
    - [185, 0.0]
  - - [16, 1, 1, 512]
    - [48, 1.36533]
  - - [16, 1, 1, 4096]
    - [184, 0.0]
  - - [16, 2, 1, 2]
    - [48, 0.00984615]
  - - [16, 2, 1, 2048]
    - [136, 7.71012]
  - - [16, 2, 1, 4096]
    - [184, 0.01]
  - - [16, 4, 1, 6]
    - [185, 0.0]
  - - [16, 4, 1, 10]
    - [48, 0.0984615]
  - - [16, 4, 1, 12]
    - [52, 0.128]
  - - [16, 4, 1, 14]
    - [185, 0.0]
  - - [16, 4, 1, 16]
    - [185, 0.0]
  - - [16, 4, 1, 1024]
    - [184, 0.01]
  - - [16, 4, 1, 4096]
    - [184, 0.01]
  - - [16, 6, 1, 2]
    - [185, 0.0]
  - - [16, 6, 1, 4096]
    - [184, 0.01]
  - - [16, 8, 1, 2]
    - [185, 0.0]
  - - [16, 8, 1, 4]
    - [185, 0.0]
  - - [16, 8, 1, 6]
    - [59, 0.128]
  - - [16, 8, 1, 8]
    - [185, 0.0]
  - - [16, 8, 1, 10]
    - [185, 0.0]
  - - [16, 8, 1, 12]
    - [185, 0.0]
  - - [16, 8, 1, 4096]
    - [184, 0.02]
  - - [16, 10, 1, 4]
    - [46, 0.0984615]
  - - [16, 10, 1, 10]
    - [185, 0.0]
  - - [16, 10, 1, 14]
    - [47, 0.373333]
  - - [16, 12, 1, 6]
    - [184, 0.0]
  - - [16, 12, 1, 12]
    - [184, 0.0]
  - - [16, 14, 1, 1]
    - [52, 0.0344615]
  - - [16, 14, 1, 4]
    - [184, 0.0]
  - - [16, 14, 1, 6]
    - [184, 0.0]
  - - [16, 14, 1, 8]
    - [48, 0.275692]
  - - [16, 14, 1, 10]
    - [184, 0.0]
  - - [16, 14, 1, 12]
    - [184, 0.0]
  - - [16, 14, 1, 16]
    - [184, 0.0]
  - - [16, 14, 1, 4096]
    - [184, 0.03]
  - - [16, 16, 1, 2]
    - [184, 0.0]
  - - [16, 16, 1, 8]
    - [184, 0.0]
  - - [16, 16, 1, 12]
    - [184, 0.0]
  - - [16, 16, 1, 16]
    - [184, 0.0]
  - - [16, 16, 1, 32]
    - [48, 1.36533]
  - - [16, 16, 1, 64]
    - [48, 2.52062]
  - - [16, 16, 1, 256]
    - [48, 10.0825]
  - - [16, 16, 1, 1024]
    - [184, 0.02]
  - - [16, 32, 1, 6]
    - [48, 0.472615]
  - - [16, 32, 1, 14]
    - [185, 0.0]
  - - [16, 32, 1, 32]
    - [185, 0.0]
  - - [16, 32, 1, 256]
    - [184, 0.02]
  - - [16, 32, 1, 512]
    - [186, 40.3298]
  - - [16, 32, 1, 1024]
    - [184, 0.05]
  - - [16, 32, 1, 2048]
    - [184, 0.06]
  - - [16, 32, 1, 3072]
    - [184, 0.08]
  - - [16, 32, 1, 4096]
    - [184, 0.07]
  - - [16, 64, 1, 1]
    - [185, 0.0]
  - - [16, 64, 1, 16]
    - [185, 0.0]
  - - [16, 64, 1, 128]
    - [48, 21.8453]
  - - [16, 64, 1, 2048]
    - [184, 0.1]
  - - [16, 64, 1, 4096]
    - [184, 0.13]
  - - [16, 64, 1, 8192]
    - [57, 559.241]
  - - [16, 128, 1, 4096]
    - [184, 0.24]
  - - [16, 128, 1, 8192]
    - [184, 0.28]
  - - [16, 192, 1, 256]
    - [48, 120.99]
  - - [16, 192, 1, 3072]
    - [184, 0.37]
  - - [16, 192, 1, 4096]
    - [184, 0.32]
  - - [16, 256, 1, 256]
    - [184, 0.14]
  - - [16, 320, 1, 1]
    - [46, 0.853333]
  - - [16, 320, 1, 64]
    - [60, 50.4123]
  - - [16, 320, 1, 1024]
    - [46, 748.983]
  - - [16, 320, 1, 4096]
    - [46, 2097.15]
  - - [16, 384, 1, 256]
    - [123, 241.979]
  - - [16, 448, 1, 64]
    - [51, 70.5772]
  - - [16, 448, 1, 3072]
    - [46, 2590.6]
  - - [16, 512, 1, 32]
    - [185, 0.04]
  - - [16, 512, 1, 64]
    - [185, 0.07]
  - - [16, 512, 1, 4096]
    - [46, 3195.66]
  - - [16, 576, 1, 1024]
    - [123, 1258.29]
  - - [16, 576, 1, 2048]
    - [46, 2359.3]
  - - [16, 640, 1, 256]
    - [48, 374.491]
  - - [16, 640, 1, 512]
    - [48, 748.983]
  - - [16, 704, 1, 1]
    - [185, 0.0]
  - - [16, 704, 1, 16]
    - [47, 30.0373]
  - - [16, 704, 1, 32]
    - [185, 0.05]
  - - [16, 704, 1, 256]
    - [141, 384.478]
  - - [16, 704, 1, 1024]
    - [46, 1647.76]
  - - [16, 704, 1, 2048]
    - [46, 2883.58]
  - - [16, 768, 1, 64]
    - [188, 0.12]
  - - [16, 768, 1, 256]
    - [192, 483.958]
  - - [16, 768, 1, 2048]
    - [46, 3145.73]
  - - [16, 832, 1, 32]
    - [185, 0.06]
  - - [16, 832, 1, 64]
    - [193, 0.13]
  - - [16, 832, 1, 2048]
    - [46, 3207.41]
  - - [16, 832, 1, 3072]
    - [46, 4089.45]
  - - [16, 896, 1, 16]
    - [185, 0.03]
  - - [16, 896, 1, 32]
    - [185, 0.06]
  - - [16, 896, 1, 3072]
    - [46, 4635.81]
  - - [16, 960, 1, 64]
    - [185, 0.13]
  - - [16, 1024, 1, 1]
    - [185, 0.0]
  - - [16, 1024, 1, 128]
    - [185, 0.27]
  - - [16, 1024, 1, 2048]
    - [46, 4194.3]
  - - [16, 1024, 1, 8192]
    - [66, 8659.21]
  - - [16, 1088, 1, 1]
    - [185, 0.0]
  - - [16, 1088, 1, 16]
    - [185, 0.04]
  - - [16, 1088, 1, 64]
    - [185, 0.16]
  - - [16, 1088, 1, 512]
    - [46, 1371.21]
  - - [16, 1280, 1, 16]
    - [188, 0.05]
  - - [16, 1344, 1, 16]
    - [185, 0.05]
  - - [16, 1344, 1, 64]
    - [173, 529.329]
  - - [16, 1344, 1, 256]
    - [145, 2038.9]
  - - [16, 1344, 1, 2048]
    - [145, 6291.46]
  - - [16, 1472, 1, 1]
    - [185, 0.0]
  - - [16, 1472, 1, 16]
    - [188, 0.06]
  - - [16, 1472, 1, 64]
    - [188, 0.21]
  - - [16, 1536, 1, 3072]
    - [145, 7864.32]
  - - [16, 1600, 1, 64]
    - [193, 0.23]
  - - [16, 1728, 1, 1]
    - [185, 0.0]
  - - [16, 1728, 1, 64]
    - [185, 0.21]
  - - [16, 1728, 1, 2048]
    - [145, 7353.65]
  - - [16, 1792, 1, 16]
    - [188, 0.07]
  - - [16, 1792, 1, 3072]
    - [145, 7794.72]
  - - [16, 1856, 1, 16]
    - [185, 0.07]
  - - [16, 1856, 1, 64]
    - [185, 0.23]
  - - [16, 1984, 1, 16]
    - [188, 0.07]
  - - [16, 1984, 1, 32]
    - [170, 461.731]
  - - [16, 2048, 1, 512]
    - [145, 4473.92]
  - - [16, 2048, 1, 3072]
    - [145, 8251.09]
  - - [16, 2112, 1, 1]
    - [185, 0.0]
  - - [16, 2112, 1, 64]
    - [188, 0.27]
  - - [16, 2112, 1, 1024]
    - [145, 6017.91]
  - - [16, 2112, 1, 4096]
    - [145, 9076.2]
  - - [16, 2304, 1, 1]
    - [170, 13.9109]
  - - [16, 2368, 1, 1]
    - [185, 0.01]
  - - [16, 2368, 1, 16]
    - [185, 0.09]
  - - [16, 2368, 1, 32]
    - [185, 0.17]
  - - [16, 2368, 1, 64]
    - [180, 850.818]
  - - [16, 2368, 1, 1024]
    - [145, 6689.19]
  - - [16, 2560, 1, 1]
    - [185, 0.01]
  - - [16, 2560, 1, 16]
    - [185, 0.09]
  - - [16, 2560, 1, 32]
    - [185, 0.17]
  - - [16, 2624, 1, 1]
    - [170, 16.7936]
  - - [16, 2624, 1, 16]
    - [185, 0.09]
  - - [16, 2624, 1, 64]
    - [185, 0.3]
  - - [16, 2624, 1, 1024]
    - [145, 6770.33]
  - - [16, 2816, 1, 1]
    - [170, 18.0224]
  - - [16, 2816, 1, 16]
    - [185, 0.1]
  - - [16, 2816, 1, 3072]
    - [145, 9320.68]
  - - [16, 2880, 1, 1]
    - [185, 0.01]
  - - [16, 2880, 1, 16]
    - [185, 0.09]
  - - [16, 2880, 1, 32]
    - [170, 614.4]
  - - [16, 3136, 1, 1]
    - [185, 0.01]
  - - [16, 3136, 1, 16]
    - [185, 0.1]
  - - [16, 3136, 1, 32]
    - [170, 605.899]
  - - [16, 3136, 1, 256]
    - [173, 3336.38]
  - - [16, 3136, 1, 512]
    - [173, 4670.93]
  - - [16, 3328, 1, 1]
    - [185, 0.01]
  - - [16, 3328, 1, 16]
    - [170, 340.787]
  - - [16, 3392, 1, 16]
    - [170, 340.53]
  - - [16, 3392, 1, 32]
    - [185, 0.21]
  - - [16, 3584, 1, 1]
    - [188, 0.01]
  - - [16, 3648, 1, 16]
    - [188, 0.1]
  - - [16, 3648, 1, 32]
    - [170, 762.358]
  - - [16, 3648, 1, 64]
    - [185, 0.37]
  - - [16, 3904, 1, 16]
    - [188, 0.11]
  - - [16, 3904, 1, 512]
    - [173, 5036.47]
  - - [16, 4096, 1, 1]
    - [170, 21.8453]
  - - [16, 4096, 1, 16]
    - [188, 0.12]
  - - [16, 4096, 1, 32]
    - [194, 0.23]
  - - [16, 4096, 1, 64]
    - [188, 0.4]
  - - [16, 4096, 1, 128]
    - [188, 0.58]
  - - [16, 4096, 1, 1024]
    - [160, 7334.3]
  - - [16, 8192, 1, 1]
    - [185, 0.01]
  - - [16, 8192, 1, 64]
    - [173, 2298.25]
  - - [16, 8192, 1, 1024]
    - [145, 9161.62]
  - - [32, 1, 1, 10]
    - [48, 0.0533333]
  - - [32, 1, 1, 12]
    - [48, 0.064]
  - - [32, 1, 1, 128]
    - [184, 0.0]
  - - [32, 1, 1, 512]
    - [184, 0.0]
  - - [32, 1, 1, 2048]
    - [184, 0.0]
  - - [32, 1, 1, 8192]
    - [57, 17.4763]
  - - [32, 6, 1, 32]
    - [185, 0.0]
  - - [32, 6, 1, 2048]
    - [184, 0.02]
  - - [32, 10, 1, 1]
    - [185, 0.0]
  - - [32, 10, 1, 10]
    - [185, 0.0]
  - - [32, 10, 1, 12]
    - [46, 0.64]
  - - [32, 10, 1, 16]
    - [48, 0.787692]
  - - [32, 10, 1, 32]
    - [47, 1.57538]
  - - [32, 10, 1, 2048]
    - [184, 0.04]
  - - [32, 10, 1, 4096]
    - [184, 0.05]
  - - [32, 12, 1, 14]
    - [185, 0.0]
  - - [32, 12, 1, 2048]
    - [184, 0.05]
  - - [32, 12, 1, 4096]
    - [184, 0.06]
  - - [32, 14, 1, 14]
    - [57, 0.964923]
  - - [32, 14, 1, 1024]
    - [184, 0.04]
  - - [32, 16, 1, 1]
    - [46, 0.0787692]
  - - [32, 16, 1, 10]
    - [185, 0.0]
  - - [32, 16, 1, 14]
    - [48, 1.10277]
  - - [32, 16, 1, 512]
    - [184, 0.03]
  - - [32, 16, 1, 1024]
    - [184, 0.05]
  - - [32, 16, 1, 2048]
    - [184, 0.06]
  - - [32, 16, 1, 8192]
    - [184, 0.08]
  - - [32, 32, 1, 6]
    - [185, 0.0]
  - - [32, 32, 1, 10]
    - [48, 1.70667]
  - - [32, 32, 1, 14]
    - [185, 0.0]
  - - [32, 32, 1, 64]
    - [22, 10.9227]
  - - [32, 32, 1, 128]
    - [188, 0.02]
  - - [32, 32, 1, 3072]
    - [184, 0.16]
  - - [32, 32, 1, 8192]
    - [184, 0.15]
  - - [32, 64, 1, 1024]
    - [184, 0.19]
  - - [32, 64, 1, 3072]
    - [184, 0.29]
  - - [32, 64, 1, 8192]
    - [184, 0.28]
  - - [32, 128, 1, 1]
    - [52, 0.744727]
  - - [32, 128, 1, 128]
    - [48, 87.3813]
  - - [32, 128, 1, 2048]
    - [184, 0.35]
  - - [32, 192, 1, 1024]
    - [46, 898.779]
  - - [32, 256, 1, 128]
    - [46, 174.763]
  - - [32, 320, 1, 16]
    - [185, 0.02]
  - - [32, 320, 1, 4096]
    - [46, 4194.3]
  - - [32, 384, 1, 16]
    - [48, 32.768]
  - - [32, 448, 1, 512]
    - [48, 1048.58]
  - - [32, 448, 1, 4096]
    - [46, 5592.41]
  - - [32, 512, 1, 16]
    - [185, 0.04]
  - - [32, 512, 1, 64]
    - [193, 0.17]
  - - [32, 512, 1, 8192]
    - [186, 8659.21]
  - - [32, 576, 1, 16]
    - [195, 0.03]
  - - [32, 576, 1, 32]
    - [196, 0.08]
  - - [32, 576, 1, 1024]
    - [48, 2903.75]
  - - [32, 576, 1, 2048]
    - [46, 4441.03]
  - - [32, 576, 1, 4096]
    - [61, 7190.24]
  - - [32, 640, 1, 16]
    - [185, 0.05]
  - - [32, 640, 1, 32]
    - [7, 100.825]
  - - [32, 704, 1, 32]
    - [185, 0.11]
  - - [32, 704, 1, 3072]
    - [46, 7284.84]
  - - [32, 768, 1, 64]
    - [188, 0.24]
  - - [32, 768, 1, 256]
    - [48, 967.916]
  - - [32, 768, 1, 1024]
    - [46, 3595.12]
  - - [32, 832, 1, 16]
    - [195, 0.06]
  - - [32, 832, 1, 2048]
    - [48, 5739.57]
  - - [32, 832, 1, 3072]
    - [48, 8178.89]
  - - [32, 896, 1, 1]
    - [185, 0.0]
  - - [32, 896, 1, 256]
    - [197, 1129.24]
  - - [32, 896, 1, 1024]
    - [48, 3914.68]
  - - [32, 960, 1, 1]
    - [58, 4.72615]
  - - [32, 960, 1, 512]
    - [131, 2246.95]
  - - [32, 960, 1, 1024]
    - [49, 4194.3]
  - - [32, 1024, 1, 1]
    - [185, 0.0]
  - - [32, 1024, 1, 16]
    - [185, 0.07]
  - - [32, 1024, 1, 128]
    - [188, 0.52]
  - - [32, 1024, 1, 256]
    - [48, 1290.56]
  - - [32, 1024, 1, 1024]
    - [115, 4194.3]
  - - [32, 1024, 1, 3072]
    - [48, 9151.21]
  - - [32, 1024, 1, 8192]
    - [48, 14913.1]
  - - [32, 1088, 1, 256]
    - [52, 1485.48]
  - - [32, 1088, 1, 512]
    - [100, 2546.54]
  - - [32, 1088, 1, 1024]
    - [48, 4753.54]
  - - [32, 1088, 1, 2048]
    - [48, 7922.57]
  - - [32, 1216, 1, 64]
    - [195, 0.34]
  - - [32, 1216, 1, 1024]
    - [177, 7052.37]
  - - [32, 1280, 1, 1]
    - [185, 0.01]
  - - [32, 1280, 1, 16]
    - [156, 252.062]
  - - [32, 1280, 1, 32]
    - [198, 557.753]
  - - [32, 1344, 1, 1]
    - [185, 0.01]
  - - [32, 1344, 1, 32]
    - [185, 0.18]
  - - [32, 1344, 1, 512]
    - [146, 5181.2]
  - - [32, 1472, 1, 16]
    - [185, 0.1]
  - - [32, 1600, 1, 16]
    - [185, 0.11]
  - - [32, 1600, 1, 32]
    - [195, 0.21]
  - - [32, 1600, 1, 64]
    - [176, 1149.75]
  - - [32, 1600, 1, 256]
    - [176, 3799.19]
  - - [32, 1728, 1, 16]
    - [170, 321.722]
  - - [32, 1728, 1, 32]
    - [176, 667.725]
  - - [32, 1728, 1, 64]
    - [164, 1179.65]
  - - [32, 1728, 1, 256]
    - [146, 4225.6]
  - - [32, 1792, 1, 1]
    - [177, 23.4057]
  - - [32, 1792, 1, 16]
    - [195, 0.13]
  - - [32, 1792, 1, 32]
    - [199, 0.25]
  - - [32, 1792, 1, 3072]
    - [160, 13245.2]
  - - [32, 1856, 1, 16]
    - [185, 0.12]
  - - [32, 1856, 1, 32]
    - [195, 0.25]
  - - [32, 1856, 1, 64]
    - [195, 0.46]
  - - [32, 1856, 1, 256]
    - [200, 1.04]
  - - [32, 1984, 1, 1]
    - [156, 23.9577]
  - - [32, 1984, 1, 32]
    - [199, 0.26]
  - - [32, 2048, 1, 1]
    - [156, 24.7306]
  - - [32, 2048, 1, 1024]
    - [160, 10568.3]
  - - [32, 2048, 1, 2048]
    - [160, 13489.2]
  - - [32, 2112, 1, 1]
    - [177, 25.5034]
  - - [32, 2112, 1, 32]
    - [157, 800.996]
  - - [32, 2112, 1, 256]
    - [180, 4676.08]
  - - [32, 2304, 1, 16]
    - [195, 0.15]
  - - [32, 2304, 1, 32]
    - [162, 842.606]
  - - [32, 2368, 1, 16]
    - [156, 440.879]
  - - [32, 2368, 1, 32]
    - [185, 0.27]
  - - [32, 2368, 1, 512]
    - [160, 8254.75]
  - - [32, 2368, 1, 2048]
    - [160, 15596.9]
  - - [32, 2560, 1, 16]
    - [156, 494.611]
  - - [32, 2560, 1, 32]
    - [195, 0.3]
  - - [32, 2624, 1, 32]
    - [149, 995.176]
  - - [32, 2624, 1, 512]
    - [152, 7412.35]
  - - [32, 2816, 1, 1]
    - [156, 33.3748]
  - - [32, 3072, 1, 16]
    - [156, 582.542]
  - - [32, 3136, 1, 1]
    - [177, 35.84]
  - - [32, 3136, 1, 16]
    - [162, 583.866]
  - - [32, 3136, 1, 256]
    - [162, 6343.24]
  - - [32, 3328, 1, 16]
    - [156, 631.087]
  - - [32, 3328, 1, 32]
    - [162, 1262.17]
  - - [32, 3392, 1, 512]
    - [160, 9581.82]
  - - [32, 3584, 1, 1]
    - [156, 41.7047]
  - - [32, 3584, 1, 16]
    - [160, 667.276]
  - - [32, 3584, 1, 32]
    - [162, 1265.52]
  - - [32, 3648, 1, 1]
    - [146, 43.2356]
  - - [32, 3648, 1, 64]
    - [146, 2668.25]
  - - [32, 3840, 1, 32]
    - [156, 1268.44]
  - - [32, 3904, 1, 1]
    - [180, 43.0786]
  - - [32, 3904, 1, 16]
    - [185, 0.19]
  - - [32, 3904, 1, 256]
    - [160, 7614.66]
  - - [32, 3904, 1, 1024]
    - [160, 13981.0]
  - - [32, 4096, 1, 64]
    - [160, 2943.37]
  - - [32, 4096, 1, 128]
    - [160, 5084.0]
  - - [32, 4096, 1, 256]
    - [160, 8085.41]
  - - [32, 4096, 1, 1024]
    - [160, 15080.6]
  - - [32, 8192, 1, 32]
    - [152, 2467.24]
  - - [32, 8192, 1, 256]
    - [152, 9725.92]
  - - [64, 1, 1, 1]
    - [185, 0.0]
  - - [64, 1, 1, 512]
    - [184, 0.0]
  - - [64, 1, 1, 1024]
    - [184, 0.01]
  - - [64, 1, 1, 2048]
    - [184, 0.01]
  - - [64, 16, 1, 1]
    - [185, 0.0]
  - - [64, 16, 1, 64]
    - [185, 0.01]
  - - [64, 16, 1, 512]
    - [184, 0.07]
  - - [64, 16, 1, 2048]
    - [184, 0.12]
  - - [64, 16, 1, 8192]
    - [184, 0.14]
  - - [64, 32, 1, 64]
    - [7, 20.1649]
  - - [64, 32, 1, 128]
    - [48, 43.6907]
  - - [64, 32, 1, 256]
    - [48, 80.6597]
  - - [64, 32, 1, 512]
    - [184, 0.12]
  - - [64, 32, 1, 2048]
    - [200, 0.17]
  - - [64, 32, 1, 4096]
    - [200, 0.19]
  - - [64, 32, 1, 8192]
    - [184, 0.3]
  - - [64, 64, 1, 1]
    - [185, 0.0]
  - - [64, 64, 1, 32]
    - [7, 21.8453]
  - - [64, 64, 1, 512]
    - [48, 322.639]
  - - [64, 64, 1, 1024]
    - [46, 559.241]
  - - [64, 64, 1, 4096]
    - [136, 1597.83]
  - - [64, 128, 1, 32]
    - [185, 0.04]
  - - [64, 128, 1, 256]
    - [48, 349.525]
  - - [64, 128, 1, 1024]
    - [184, 0.66]
  - - [64, 192, 1, 32]
    - [185, 0.06]
  - - [64, 256, 1, 16]
    - [195, 0.04]
  - - [64, 256, 1, 512]
    - [116, 1198.37]
  - - [64, 384, 1, 2048]
    - [46, 5592.41]
  - - [64, 384, 1, 4096]
    - [46, 9151.21]
  - - [64, 448, 1, 1]
    - [185, 0.0]
  - - [64, 448, 1, 16]
    - [185, 0.06]
  - - [64, 448, 1, 512]
    - [48, 2097.15]
  - - [64, 448, 1, 2048]
    - [49, 6908.27]
  - - [64, 512, 1, 16]
    - [195, 0.08]
  - - [64, 512, 1, 32]
    - [185, 0.14]
  - - [64, 512, 1, 64]
    - [201, 0.3]
  - - [64, 512, 1, 256]
    - [48, 1290.56]
  - - [64, 512, 1, 2048]
    - [48, 7456.54]
  - - [64, 576, 1, 32]
    - [202, 0.18]
  - - [64, 576, 1, 1024]
    - [48, 4718.59]
  - - [64, 640, 1, 32]
    - [185, 0.19]
  - - [64, 640, 1, 64]
    - [203, 0.36]
  - - [64, 704, 1, 1]
    - [185, 0.01]
  - - [64, 704, 1, 16]
    - [185, 0.1]
  - - [64, 704, 1, 64]
    - [188, 0.38]
  - - [64, 704, 1, 4096]
    - [51, 11184.8]
  - - [64, 768, 1, 64]
    - [203, 0.42]
  - - [64, 832, 1, 32]
    - [185, 0.23]
  - - [64, 832, 1, 2048]
    - [49, 10385.9]
  - - [64, 896, 1, 1]
    - [7, 9.55733]
  - - [64, 896, 1, 64]
    - [188, 0.43]
  - - [64, 896, 1, 1024]
    - [49, 7340.03]
  - - [64, 960, 1, 32]
    - [203, 0.24]
  - - [64, 960, 1, 64]
    - [203, 0.5]
  - - [64, 1024, 1, 1]
    - [185, 0.01]
  - - [64, 1088, 1, 16]
    - [53, 171.402]
  - - [64, 1088, 1, 32]
    - [203, 0.28]
  - - [64, 1088, 1, 64]
    - [203, 0.54]
  - - [64, 1216, 1, 1]
    - [158, 31.7649]
  - - [64, 1216, 1, 16]
    - [204, 0.15]
  - - [64, 1344, 1, 16]
    - [203, 0.16]
  - - [64, 1344, 1, 64]
    - [203, 0.61]
  - - [64, 1472, 1, 16]
    - [203, 0.17]
  - - [64, 1472, 1, 32]
    - [203, 0.35]
  - - [64, 1600, 1, 16]
    - [203, 0.18]
  - - [64, 1600, 1, 32]
    - [152, 1213.63]
  - - [64, 1600, 1, 4096]
    - [164, 18808.5]
  - - [64, 1728, 1, 32]
    - [185, 0.37]
  - - [64, 1728, 1, 256]
    - [156, 6584.08]
  - - [64, 1728, 1, 512]
    - [158, 9933.88]
  - - [64, 1856, 1, 16]
    - [168, 678.766]
  - - [64, 1856, 1, 64]
    - [205, 2577.01]
  - - [64, 1984, 1, 1]
    - [156, 43.7848]
  - - [64, 1984, 1, 16]
    - [158, 738.769]
  - - [64, 1984, 1, 64]
    - [203, 0.77]
  - - [64, 1984, 1, 256]
    - [160, 7559.5]
  - - [64, 1984, 1, 4096]
    - [158, 19370.3]
  - - [64, 2048, 1, 16]
    - [206, 0.22]
  - - [64, 2048, 1, 32]
    - [153, 1421.8]
  - - [64, 2112, 1, 1]
    - [146, 45.8197]
  - - [64, 2112, 1, 16]
    - [204, 0.22]
  - - [64, 2368, 1, 16]
    - [204, 0.24]
  - - [64, 2368, 1, 64]
    - [204, 0.84]
  - - [64, 2368, 1, 512]
    - [158, 13264.0]
  - - [64, 2368, 1, 2048]
    - [158, 19832.5]
  - - [64, 2624, 1, 1]
    - [180, 55.061]
  - - [64, 2624, 1, 16]
    - [204, 0.24]
  - - [64, 2624, 1, 32]
    - [146, 1821.68]
  - - [64, 2880, 1, 1]
    - [162, 59.4581]
  - - [64, 2880, 1, 32]
    - [204, 0.5]
  - - [64, 2880, 1, 64]
    - [203, 0.83]
  - - [64, 2880, 1, 256]
    - [146, 9830.4]
  - - [64, 3136, 1, 512]
    - [156, 13793.3]
  - - [64, 3392, 1, 1]
    - [195, 0.02]
  - - [64, 3392, 1, 64]
    - [156, 4086.36]
  - - [64, 3648, 1, 1]
    - [156, 69.6931]
  - - [64, 3904, 1, 1]
    - [195, 0.02]
  - - [64, 3904, 1, 64]
    - [195, 0.97]
  - - [64, 3904, 1, 512]
    - [156, 13829.9]
  - - [64, 4096, 1, 1]
    - [195, 0.02]
  - - [64, 4096, 1, 32]
    - [168, 2542.0]
  - - [64, 4096, 1, 64]
    - [195, 1.05]
  - - [64, 4096, 1, 256]
    - [156, 10824.0]
  - - [64, 8192, 1, 1]
    - [203, 0.02]
  - - [64, 8192, 1, 16]
    - [150, 1973.79]
  - - [64, 8192, 1, 32]
    - [167, 3770.16]
  - - [64, 8192, 1, 64]
    - [203, 1.26]
  - - [64, 8192, 1, 128]
    - [150, 10485.8]
  - - [128, 1, 1, 128]
    - [184, 0.0]
  - - [128, 1, 1, 256]
    - [46, 5.46133]
  - - [128, 1, 1, 512]
    - [184, 0.01]
  - - [128, 1, 1, 1024]
    - [184, 0.01]
  - - [128, 1, 1, 4096]
    - [184, 0.02]
